{
  "date": "2025-11-27",
  "date_of_scrape": "2025-11-28T04:10:50.523Z",
  "tool_version": "0.2.0",
  "number_of_announcements": 132,
  "announcements": [
    {
      "date": "2025-11-27",
      "id": "138410",
      "original_text": "Registerbekanntmachung nach dem Umwandlungsgesetz\nBayern Amtsgericht München HRB 251156\nVM Finovia GmbH Steuer- und Rechtsberatung – München",
      "type": "Registerbekanntmachung nach dem Umwandlungsgesetz",
      "state": "Bayern",
      "amtsgericht": "Amtsgericht München",
      "registernummer": "HRB 251156",
      "registerart": "HRB",
      "company_name": "VM Finovia GmbH Steuer- und Rechtsberatung",
      "company_seat": "München",
      "details": "27.11.2025 (Bekanntmachungsdatum)\n\nBayern Amtsgericht München HRB 251156\nRegisterbekanntmachung nach dem Umwandlungsgesetz 26.11.2025 (Eintragungsdatum)\n\nVM Finovia GmbH Steuer- und Rechtsberatung\nGesellschaft mit beschränkter Haftung\nMünchen\n\nDen Gläubigern der an der Ausgliederung beteiligten Rechtsträger ist, wenn sie binnen sechs Monaten nach dem Tag, an dem die Eintragung der Ausgliederung in das Register des Sitzes desjenigen Rechtsträgers, dessen Gläubiger sie sind, nach §§ 125, 19 Abs. 3 UmwG als bekannt gemacht gilt, ihren Anspruch nach Grund und Höhe in Textform anmelden, Sicherheit zu leisten, soweit sie nicht Befriedigung verlangen können. Dieses Recht steht den Gläubigern jedoch nur zu, wenn sie glaubhaft machen, dass durch die Ausgliederung die Erfüllung ihrer Forderung gefährdet wird."
    },
    {
      "date": "2025-11-27",
      "id": "138411",
      "original_text": "Registerbekanntmachung nach dem Umwandlungsgesetz\nBayern Amtsgericht Ansbach HRA 1359\nCarl Wüst GmbH & Co. KG – Weißenburg i. Bay.",
      "type": "Registerbekanntmachung nach dem Umwandlungsgesetz",
      "state": "Bayern",
      "amtsgericht": "Amtsgericht Ansbach",
      "registernummer": "HRA 1359",
      "registerart": "HRA",
      "company_name": "Carl Wüst GmbH & Co. KG",
      "company_seat": "Weißenburg i. Bay.",
      "details": "27.11.2025 (Bekanntmachungsdatum)\n\nBayern Amtsgericht Ansbach HRA 1359\nRegisterbekanntmachung nach dem Umwandlungsgesetz 26.11.2025 (Eintragungsdatum)\n\nCarl Wüst GmbH & Co. KG\nKommanditgesellschaft\nWeißenburg i. Bay.\n\nDen Gläubigern der an der Verschmelzung beteiligten Rechtsträger ist, wenn sie binnen sechs Monaten nach dem Tag, an dem die Eintragung der Verschmelzung in das Register des Sitzes desjenigen Rechtsträgers, dessen Gläubiger sie sind, nach § 19 Abs. 3 UmwG als bekannt gemacht gilt, ihren Anspruch nach Grund und Höhe in Textform anmelden, Sicherheit zu leisten, soweit sie nicht Befriedigung verlangen können. Dieses Recht steht den Gläubigern jedoch nur zu, wenn sie glaubhaft machen, dass durch die Verschmelzung die Erfüllung ihrer Forderung gefährdet wird."
    },
    {
      "date": "2025-11-27",
      "id": "138412",
      "original_text": "Registerbekanntmachung nach dem Umwandlungsgesetz\nBayern Amtsgericht Ansbach HRB 4344\nWW MobiTec GmbH – Weißenburg i. Bay.",
      "type": "Registerbekanntmachung nach dem Umwandlungsgesetz",
      "state": "Bayern",
      "amtsgericht": "Amtsgericht Ansbach",
      "registernummer": "HRB 4344",
      "registerart": "HRB",
      "company_name": "WW MobiTec GmbH",
      "company_seat": "Weißenburg i. Bay.",
      "details": "27.11.2025 (Bekanntmachungsdatum)\n\nBayern Amtsgericht Ansbach HRB 4344\nRegisterbekanntmachung nach dem Umwandlungsgesetz 26.11.2025 (Eintragungsdatum)\n\nWW MobiTec GmbH\nGesellschaft mit beschränkter Haftung\nWeißenburg i. Bay.\n\nDen Gläubigern der an der Verschmelzung beteiligten Rechtsträger ist, wenn sie binnen sechs Monaten nach dem Tag, an dem die Eintragung der Verschmelzung in das Register des Sitzes desjenigen Rechtsträgers, dessen Gläubiger sie sind, nach § 19 Abs. 3 UmwG als bekannt gemacht gilt, ihren Anspruch nach Grund und Höhe in Textform anmelden, Sicherheit zu leisten, soweit sie nicht Befriedigung verlangen können. Dieses Recht steht den Gläubigern jedoch nur zu, wenn sie glaubhaft machen, dass durch die Verschmelzung die Erfüllung ihrer Forderung gefährdet wird."
    },
    {
      "date": "2025-11-27",
      "id": "138413",
      "original_text": "Registerbekanntmachung nach dem Umwandlungsgesetz\nBayern Amtsgericht München HRB 193878\nCarlyle Investment 3 GmbH – München",
      "type": "Registerbekanntmachung nach dem Umwandlungsgesetz",
      "state": "Bayern",
      "amtsgericht": "Amtsgericht München",
      "registernummer": "HRB 193878",
      "registerart": "HRB",
      "company_name": "Carlyle Investment 3 GmbH",
      "company_seat": "München",
      "details": "27.11.2025 (Bekanntmachungsdatum)\n\nBayern Amtsgericht München HRB 193878\nRegisterbekanntmachung nach dem Umwandlungsgesetz 26.11.2025 (Eintragungsdatum)\n\nCarlyle Investment 3 GmbH\nGesellschaft mit beschränkter Haftung\nMünchen\n\nDen Gläubigern der an der Verschmelzung beteiligten Rechtsträger ist, wenn sie binnen sechs Monaten nach dem Tag, an dem die Eintragung der Verschmelzung in das Register des Sitzes desjenigen Rechtsträgers, dessen Gläubiger sie sind, nach § 19 Abs. 3 UmwG als bekannt gemacht gilt, ihren Anspruch nach Grund und Höhe in Textform anmelden, Sicherheit zu leisten, soweit sie nicht Befriedigung verlangen können. Dieses Recht steht den Gläubigern jedoch nur zu, wenn sie glaubhaft machen, dass durch die Verschmelzung die Erfüllung ihrer Forderung gefährdet wird."
    },
    {
      "date": "2025-11-27",
      "id": "138414",
      "original_text": "Registerbekanntmachung nach dem Umwandlungsgesetz\nBayern Amtsgericht München HRB 296156\nATHAGORAS AquiCo-03 GmbH – München",
      "type": "Registerbekanntmachung nach dem Umwandlungsgesetz",
      "state": "Bayern",
      "amtsgericht": "Amtsgericht München",
      "registernummer": "HRB 296156",
      "registerart": "HRB",
      "company_name": "ATHAGORAS AquiCo-03 GmbH",
      "company_seat": "München",
      "details": "27.11.2025 (Bekanntmachungsdatum)\n\nBayern Amtsgericht München HRB 296156\nRegisterbekanntmachung nach dem Umwandlungsgesetz 26.11.2025 (Eintragungsdatum)\n\nATHAGORAS AquiCo-03 GmbH\nGesellschaft mit beschränkter Haftung\nMünchen\n\nDen Gläubigern der an der Verschmelzung beteiligten Rechtsträger ist, wenn sie binnen sechs Monaten nach dem Tag, an dem die Eintragung der Verschmelzung in das Register des Sitzes desjenigen Rechtsträgers, dessen Gläubiger sie sind, nach § 19 Abs. 3 UmwG als bekannt gemacht gilt, ihren Anspruch nach Grund und Höhe in Textform anmelden, Sicherheit zu leisten, soweit sie nicht Befriedigung verlangen können. Dieses Recht steht den Gläubigern jedoch nur zu, wenn sie glaubhaft machen, dass durch die Verschmelzung die Erfüllung ihrer Forderung gefährdet wird."
    },
    {
      "date": "2025-11-27",
      "id": "138415",
      "original_text": "Einreichung neuer Dokumente\nBayern Amtsgericht Fürth HRB 19239\nZBI Fondsmanagement GmbH – Erlangen",
      "type": "Einreichung neuer Dokumente",
      "state": "Bayern",
      "amtsgericht": "Amtsgericht Fürth",
      "registernummer": "HRB 19239",
      "registerart": "HRB",
      "company_name": "ZBI Fondsmanagement GmbH",
      "company_seat": "Erlangen",
      "details": "27.11.2025 (Bekanntmachungsdatum)\n\nBayern Amtsgericht Fürth HRB 19239\nEinreichung neuer Dokumente 26.11.2025 (Eintragungsdatum)\n\nZBI Fondsmanagement GmbH\nGesellschaft mit beschränkter Haftung\nErlangen\n\nDem Amtsgericht Fürth -Registergericht- ist eine Liste der Mitglieder des Aufsichtsrats eingereicht worden, § 52 Abs. 3 S. 2 GmbHG."
    },
    {
      "date": "2025-11-27",
      "id": "138416",
      "original_text": "Löschungsankündigung\nBayern Amtsgericht München HRB 263696\nServus Habibi GmbH – München",
      "type": "Löschungsankündigung",
      "state": "Bayern",
      "amtsgericht": "Amtsgericht München",
      "registernummer": "HRB 263696",
      "registerart": "HRB",
      "company_name": "Servus Habibi GmbH",
      "company_seat": "München",
      "details": "27.11.2025 (Bekanntmachungsdatum)\n\nBayern Amtsgericht München HRB 263696\nLöschungsankündigung\n\nServus Habibi GmbH\nGesellschaft mit beschränkter Haftung\nMünchen\n\nDas Registergericht beabsichtigt, den im Handelsregister eingetragenen Geschäftsführer wegen fehlender Eignung nach § 395 FamFG zu löschen. Die Frist zur Erhebung eines Widerspruchs ist auf drei Monate festgesetzt."
    },
    {
      "date": "2025-11-27",
      "id": "138417",
      "original_text": "Löschungsankündigung\nBayern Amtsgericht Nürnberg HRB 4517\nGrafik Studio Hornbach GmbH – Nürnberg",
      "type": "Löschungsankündigung",
      "state": "Bayern",
      "amtsgericht": "Amtsgericht Nürnberg",
      "registernummer": "HRB 4517",
      "registerart": "HRB",
      "company_name": "Grafik Studio Hornbach GmbH",
      "company_seat": "Nürnberg",
      "details": "27.11.2025 (Bekanntmachungsdatum)\n\nBayern Amtsgericht Nürnberg HRB 4517\nLöschungsankündigung\n\nGrafik Studio Hornbach GmbH\nGesellschaft mit beschränkter Haftung\nNürnberg\n\nDas Registergericht beabsichtigt, die im Handelsregister eingetragene Gesellschaft wegen Vermögenslosigkeit von Amts wegen nach § 394 FamFG zu löschen. Die Frist zur Erhebung eines Widerspruchs ist auf einen Monat festgesetzt."
    },
    {
      "date": "2025-11-27",
      "id": "138418",
      "original_text": "Registerbekanntmachung nach dem Umwandlungsgesetz\nBayern Amtsgericht München HRB 261879\ncptr Germany GmbH – München",
      "type": "Registerbekanntmachung nach dem Umwandlungsgesetz",
      "state": "Bayern",
      "amtsgericht": "Amtsgericht München",
      "registernummer": "HRB 261879",
      "registerart": "HRB",
      "company_name": "cptr Germany GmbH",
      "company_seat": "München",
      "details": "27.11.2025 (Bekanntmachungsdatum)\n\nBayern Amtsgericht München HRB 261879\nRegisterbekanntmachung nach dem Umwandlungsgesetz 26.11.2025 (Eintragungsdatum)\n\ncptr Germany GmbH\nGesellschaft mit beschränkter Haftung\nMünchen\n\nDen Gläubigern der an der Verschmelzung beteiligten Rechtsträger ist, wenn sie binnen sechs Monaten nach dem Tag, an dem die Eintragung der Verschmelzung in das Register des Sitzes desjenigen Rechtsträgers, dessen Gläubiger sie sind, nach § 19 Abs. 3 UmwG als bekannt gemacht gilt, ihren Anspruch nach Grund und Höhe in Textform anmelden, Sicherheit zu leisten, soweit sie nicht Befriedigung verlangen können. Dieses Recht steht den Gläubigern jedoch nur zu, wenn sie glaubhaft machen, dass durch die Verschmelzung die Erfüllung ihrer Forderung gefährdet wird."
    },
    {
      "date": "2025-11-27",
      "id": "138419",
      "original_text": "Löschungsankündigung\nBayern Amtsgericht Nürnberg HRB 36114\nAWH GmbH – Nürnberg",
      "type": "Löschungsankündigung",
      "state": "Bayern",
      "amtsgericht": "Amtsgericht Nürnberg",
      "registernummer": "HRB 36114",
      "registerart": "HRB",
      "company_name": "AWH GmbH",
      "company_seat": "Nürnberg",
      "details": "27.11.2025 (Bekanntmachungsdatum)\n\nBayern Amtsgericht Nürnberg HRB 36114\nLöschungsankündigung\n\nAWH GmbH\nGesellschaft mit beschränkter Haftung\nNürnberg\n\nDas Registergericht beabsichtigt, die im Handelsregister eingetragene Gesellschaft wegen Vermögenslosigkeit von Amts wegen nach § 394 FamFG zu löschen. Die Frist zur Erhebung eines Widerspruchs ist auf einen Monat festgesetzt."
    },
    {
      "date": "2025-11-27",
      "id": "138420",
      "original_text": "Löschungsankündigung\nBayern Amtsgericht München HRB 234316\nCalida Aqua UG (haftungsbeschränkt) – München",
      "type": "Löschungsankündigung",
      "state": "Bayern",
      "amtsgericht": "Amtsgericht München",
      "registernummer": "HRB 234316",
      "registerart": "HRB",
      "company_name": "Calida Aqua UG (haftungsbeschränkt)",
      "company_seat": "München",
      "details": "27.11.2025 (Bekanntmachungsdatum)\n\nBayern Amtsgericht München HRB 234316\nLöschungsankündigung 26.11.2025 (Eintragungsdatum)\n\nCalida Aqua UG (haftungsbeschränkt)\nGesellschaft mit beschränkter Haftung\nMünchen\n\nDas Registergericht beabsichtigt, die im Handelsregister eingetragene Gesellschaft wegen Vermögenslosigkeit von Amts wegen nach § 394 FamFG zu löschen. Die Frist zur Erhebung eines Widerspruchs ist auf drei Monate festgesetzt."
    },
    {
      "date": "2025-11-27",
      "id": "138421",
      "original_text": "Sonstige Registerbekanntmachung\nBayern Amtsgericht Passau HRB 5560\nW & B Vermögensverwaltung Management Aktiengesellschaft – Passau",
      "type": "Sonstige Registerbekanntmachung",
      "state": "Bayern",
      "amtsgericht": "Amtsgericht Passau",
      "registernummer": "HRB 5560",
      "registerart": "HRB",
      "company_name": "W & B Vermögensverwaltung Management Aktiengesellschaft",
      "company_seat": "Passau",
      "details": "27.11.2025 (Bekanntmachungsdatum)\n\nBayern Amtsgericht Passau HRB 5560\nSonstige Registerbekanntmachung 26.11.2025 (Eintragungsdatum)\n\nW & B Vermögensverwaltung Management Aktiengesellschaft\nAktiengesellschaft\nPassau\n\nDem Amtsgericht Passau -Registergericht- ist eine Liste der Mitglieder des Aufsichtsrats eingereicht worden, § 106 AktG."
    },
    {
      "date": "2025-11-27",
      "id": "138422",
      "original_text": "Löschungsankündigung\nBayern Amtsgericht Landshut HRB 7732\nBIO-ERNTEDANK GmbH – Velden/Vils",
      "type": "Löschungsankündigung",
      "state": "Bayern",
      "amtsgericht": "Amtsgericht Landshut",
      "registernummer": "HRB 7732",
      "registerart": "HRB",
      "company_name": "BIO-ERNTEDANK GmbH",
      "company_seat": "Velden/Vils",
      "details": "27.11.2025 (Bekanntmachungsdatum)\n\nBayern Amtsgericht Landshut HRB 7732\nLöschungsankündigung\n\nBIO-ERNTEDANK GmbH\nGesellschaft mit beschränkter Haftung\nVelden/Vils\n\nDas Registergericht beabsichtigt, die im Handelsregister eingetragene Gesellschaft wegen Vermögenslosigkeit von Amts wegen nach § 394 FamFG zu löschen. Die Frist zur Erhebung eines Widerspruchs ist auf einen Monat festgesetzt."
    },
    {
      "date": "2025-11-27",
      "id": "138423",
      "original_text": "Löschungsankündigung\nBayern Amtsgericht München HRB 232782\nON Motion GmbH – Maisach",
      "type": "Löschungsankündigung",
      "state": "Bayern",
      "amtsgericht": "Amtsgericht München",
      "registernummer": "HRB 232782",
      "registerart": "HRB",
      "company_name": "ON Motion GmbH",
      "company_seat": "Maisach",
      "details": "27.11.2025 (Bekanntmachungsdatum)\n\nBayern Amtsgericht München HRB 232782\nLöschungsankündigung 26.11.2025 (Eintragungsdatum)\n\nON Motion GmbH\nGesellschaft mit beschränkter Haftung\nMaisach\n\nDas Registergericht beabsichtigt, die im Handelsregister eingetragene Gesellschaft wegen Vermögenslosigkeit von Amts wegen nach § 394 FamFG zu löschen. Die Frist zur Erhebung eines Widerspruchs ist auf drei Monate festgesetzt."
    },
    {
      "date": "2025-11-27",
      "id": "138424",
      "original_text": "Registerbekanntmachung nach dem Umwandlungsgesetz\nBayern Amtsgericht München HRB 262827\nAURELIUS Development Thirty-Two GmbH – Grünwald",
      "type": "Registerbekanntmachung nach dem Umwandlungsgesetz",
      "state": "Bayern",
      "amtsgericht": "Amtsgericht München",
      "registernummer": "HRB 262827",
      "registerart": "HRB",
      "company_name": "AURELIUS Development Thirty-Two GmbH",
      "company_seat": "Grünwald",
      "details": "27.11.2025 (Bekanntmachungsdatum)\n\nBayern Amtsgericht München HRB 262827\nRegisterbekanntmachung nach dem Umwandlungsgesetz 26.11.2025 (Eintragungsdatum)\n\nAURELIUS Development Thirty-Two GmbH\nGesellschaft mit beschränkter Haftung\nGrünwald\n\nDen Gläubigern des formwechselnden Rechtsträgers ist, wenn sie binnen sechs Monaten nach dem Tag, an dem die Eintragung des Formwechsels nach § 201 UmwG als bekannt gemacht gilt, ihren Anspruch nach Grund und Höhe in Textform anmelden, Sicherheit zu leisten, soweit sie nicht Befriedigung verlangen können. Dieses Recht steht den Gläubigern jedoch nur zu, wenn sie glaubhaft machen, dass durch den Formwechsel die Erfüllung ihrer Forderung gefährdet wird."
    },
    {
      "date": "2025-11-27",
      "id": "138425",
      "original_text": "Registerbekanntmachung nach dem Umwandlungsgesetz\nBerlin Amtsgericht Berlin (Charlottenburg) HRB 230253\nADKY GmbH – Berlin",
      "type": "Registerbekanntmachung nach dem Umwandlungsgesetz",
      "state": "Berlin",
      "amtsgericht": "Amtsgericht Berlin (Charlottenburg)",
      "registernummer": "HRB 230253",
      "registerart": "HRB",
      "company_name": "ADKY GmbH",
      "company_seat": "Berlin",
      "details": "27.11.2025 (Bekanntmachungsdatum)\n\nBerlin Amtsgericht Berlin (Charlottenburg) HRB 230253\nRegisterbekanntmachung nach dem Umwandlungsgesetz 25.11.2025 (Eintragungsdatum)\n\nADKY GmbH\nGesellschaft mit beschränkter Haftung\nBerlin\n\nZu Eintragungsnummer 3 vom 25.11.2025 wird als nicht eingetragen veröffentlicht: Den Gläubigern der an der Verschmelzung beteiligten Rechtsträger ist, wenn sie binnen sechs Monaten nach dem Tag, an dem die Eintragung der Verschmelzung in das Register des Sitzes desjenigen Rechtsträgers, dessen Gläubiger sie sind, als bekannt gemacht gilt, ihren Anspruch nach Grund und Höhe schriftlich anmelden, Sicherheit zu leisten, soweit sie nicht Befriedigung verlangen können. Dieses Recht steht den Gläubigern jedoch nur zu, wenn sie glaubhaft machen, dass durch die Verschmelzung die Erfüllung ihrer Forderung gefährdet wird. Das Recht, Sicherheitsleistung zu verlangen, steht Gläubigern nicht zu, die im Falle der Insolvenz ein Recht auf vorzugsweise Befriedigung aus einer Deckungsmasse haben, die nach gesetzlicher Vorschrift zu ihrem Schutz errichtet und staatlich überwacht ist."
    },
    {
      "date": "2025-11-27",
      "id": "138426",
      "original_text": "Registerbekanntmachung nach dem Umwandlungsgesetz\nBerlin Amtsgericht Berlin (Charlottenburg) HRB 267986\nAQSZ Holding UG (haftungsbeschränkt) – Berlin",
      "type": "Registerbekanntmachung nach dem Umwandlungsgesetz",
      "state": "Berlin",
      "amtsgericht": "Amtsgericht Berlin (Charlottenburg)",
      "registernummer": "HRB 267986",
      "registerart": "HRB",
      "company_name": "AQSZ Holding UG (haftungsbeschränkt)",
      "company_seat": "Berlin",
      "details": "27.11.2025 (Bekanntmachungsdatum)\n\nBerlin Amtsgericht Berlin (Charlottenburg) HRB 267986\nRegisterbekanntmachung nach dem Umwandlungsgesetz 25.11.2025 (Eintragungsdatum)\n\nAQSZ Holding UG (haftungsbeschränkt)\nGesellschaft mit beschränkter Haftung\nBerlin\n\nZu Eintragungsnummer 3 vom 25.11.2025 wird als nicht eingetragen veröffentlicht: Den Gläubigern der an der Verschmelzung beteiligten Rechtsträger ist, wenn sie binnen sechs Monaten nach dem Tag, an dem die Eintragung der Verschmelzung in das Register des Sitzes desjenigen Rechtsträgers, dessen Gläubiger sie sind, als bekannt gemacht gilt, ihren Anspruch nach Grund und Höhe schriftlich anmelden, Sicherheit zu leisten, soweit sie nicht Befriedigung verlangen können. Dieses Recht steht den Gläubigern jedoch nur zu, wenn sie glaubhaft machen, dass durch die Verschmelzung die Erfüllung ihrer Forderung gefährdet wird. Das Recht, Sicherheitsleistung zu verlangen, steht Gläubigern nicht zu, die im Falle der Insolvenz ein Recht auf vorzugsweise Befriedigung aus einer Deckungsmasse haben, die nach gesetzlicher Vorschrift zu ihrem Schutz errichtet und staatlich überwacht ist."
    },
    {
      "date": "2025-11-27",
      "id": "138427",
      "original_text": "Löschungsankündigung\nBerlin Amtsgericht Berlin (Charlottenburg) HRB 173013\nX-VIP Taxi- und Limousinenservice GmbH – Berlin",
      "type": "Löschungsankündigung",
      "state": "Berlin",
      "amtsgericht": "Amtsgericht Berlin (Charlottenburg)",
      "registernummer": "HRB 173013",
      "registerart": "HRB",
      "company_name": "X-VIP Taxi- und Limousinenservice GmbH",
      "company_seat": "Berlin",
      "details": "27.11.2025 (Bekanntmachungsdatum)\n\nBerlin Amtsgericht Berlin (Charlottenburg) HRB 173013\nLöschungsankündigung\n\nX-VIP Taxi- und Limousinenservice GmbH\nGesellschaft mit beschränkter Haftung\nBerlin\n\nBei der nachstehenden Gesellschaft wird das Amtslöschungsverfahren gemäß § 394 FamFG eingeleitet. Widerspruchsfrist 6 Wochen"
    },
    {
      "date": "2025-11-27",
      "id": "138428",
      "original_text": "Registerbekanntmachung nach dem Umwandlungsgesetz\nBaden-Württemberg Amtsgericht Mannheim HRB 704547\nBlue Yonder GmbH – Karlsruhe",
      "type": "Registerbekanntmachung nach dem Umwandlungsgesetz",
      "state": "Baden-Württemberg",
      "amtsgericht": "Amtsgericht Mannheim",
      "registernummer": "HRB 704547",
      "registerart": "HRB",
      "company_name": "Blue Yonder GmbH",
      "company_seat": "Karlsruhe",
      "details": "27.11.2025 (Bekanntmachungsdatum)\n\nBaden-Württemberg Amtsgericht Mannheim HRB 704547\nRegisterbekanntmachung nach dem Umwandlungsgesetz 27.11.2025 (Eintragungsdatum)\n\nBlue Yonder GmbH\nGesellschaft mit beschränkter Haftung\nKarlsruhe\n\nDen Gläubigern der an der Verschmelzung beteiligten Rechtsträger ist, wenn sie binnen sechs Monaten nach dem Tag, an dem die Eintragung der Verschmelzung in das Register des Sitzes desjenigen Rechtsträgers, dessen Gläubiger sie sind, nach § 19 Abs. 3 UmwG als bekanntgemacht gilt, ihren Anspruch nach Grund und Höhe schriftlich anmelden, Sicherheit zu leisten, soweit sie nicht Befriedigung verlangen können. Dieses Recht steht den Gläubigern jedoch nur zu, wenn sie glaubhaft machen, dass durch die Verschmelzung die Erfüllung ihrer Forderung gefährdet wird."
    },
    {
      "date": "2025-11-27",
      "id": "138429",
      "original_text": "Einreichung neuer Dokumente\nBaden-Württemberg Amtsgericht Mannheim HRB 200308\nBiologische Heilmittel Heel GmbH – Baden-Baden",
      "type": "Einreichung neuer Dokumente",
      "state": "Baden-Württemberg",
      "amtsgericht": "Amtsgericht Mannheim",
      "registernummer": "HRB 200308",
      "registerart": "HRB",
      "company_name": "Biologische Heilmittel Heel GmbH",
      "company_seat": "Baden-Baden",
      "details": "27.11.2025 (Bekanntmachungsdatum)\n\nBaden-Württemberg Amtsgericht Mannheim HRB 200308\nEinreichung neuer Dokumente\n\nBiologische Heilmittel Heel GmbH\nGesellschaft mit beschränkter Haftung\nBaden-Baden\n\nDie Gesellschaft hat am 26.11.2025 die Liste über die Zusammensetzung des Aufsichtsrats zum Handelsregister eingereicht."
    },
    {
      "date": "2025-11-27",
      "id": "138430",
      "original_text": "Löschungsankündigung\nBaden-Württemberg Amtsgericht Ulm HRA 727477\nBerreth Dach GmbH & Co. KG – Lauchheim",
      "type": "Löschungsankündigung",
      "state": "Baden-Württemberg",
      "amtsgericht": "Amtsgericht Ulm",
      "registernummer": "HRA 727477",
      "registerart": "HRA",
      "company_name": "Berreth Dach GmbH & Co. KG",
      "company_seat": "Lauchheim",
      "details": "27.11.2025 (Bekanntmachungsdatum)\n\nBaden-Württemberg Amtsgericht Ulm HRA 727477\nLöschungsankündigung\n\nBerreth Dach GmbH & Co. KG\nKommanditgesellschaft\nLauchheim\n\nAls nicht eingetragen wird bekanntgemacht:\nDas Gericht beabsichtigt, die Gesellschaft wegen Vermögenslosigkeit im Handelsregister von Amts wegen nach § 394 FamFG zu löschen. Die Frist zur Geltendmachung eines Widerspruchs gegen die beabsichtigte Löschung ist auf  einen Monat ab Veröffentlichung bestimmt."
    },
    {
      "date": "2025-11-27",
      "id": "138431",
      "original_text": "Registerbekanntmachung nach dem Umwandlungsgesetz\nBaden-Württemberg Amtsgericht Stuttgart HRB 800998\nMaler und Stuckateur Lehmann GmbH – Remshalden",
      "type": "Registerbekanntmachung nach dem Umwandlungsgesetz",
      "state": "Baden-Württemberg",
      "amtsgericht": "Amtsgericht Stuttgart",
      "registernummer": "HRB 800998",
      "registerart": "HRB",
      "company_name": "Maler und Stuckateur Lehmann GmbH",
      "company_seat": "Remshalden",
      "details": "27.11.2025 (Bekanntmachungsdatum)\n\nBaden-Württemberg Amtsgericht Stuttgart HRB 800998\nRegisterbekanntmachung nach dem Umwandlungsgesetz 27.11.2025 (Eintragungsdatum)\n\nMaler und Stuckateur Lehmann GmbH\nGesellschaft mit beschränkter Haftung\nRemshalden\n\nAls nicht eingetragen wird bekanntgemacht:\nDen Gläubigern der an der Ausgliederung beteiligten Rechtsträger ist, wenn sie binnen sechs Monaten nach dem Tag, an dem die Eintragung der Ausgliederung in das Register des Sitzes desjenigen Rechtsträgers, dessen Gläubiger sie sind, nach § 19 Abs. 3 UmwG als bekanntgemacht gilt, ihren Anspruch nach Grund und Höhe schriftlich anmelden, Sicherheit zu leisten, soweit sie nicht Befriedigung verlangen können. Dieses Recht steht den Gläubigern jedoch nur zu, wenn sie glaubhaft machen, dass durch die Ausgliederung die Erfüllung ihrer Forderung gefährdet wird."
    },
    {
      "date": "2025-11-27",
      "id": "138432",
      "original_text": "Löschungsankündigung\nBerlin Amtsgericht Berlin (Charlottenburg) HRB 189963\nSECUDOO GmbH – Berlin",
      "type": "Löschungsankündigung",
      "state": "Berlin",
      "amtsgericht": "Amtsgericht Berlin (Charlottenburg)",
      "registernummer": "HRB 189963",
      "registerart": "HRB",
      "company_name": "SECUDOO GmbH",
      "company_seat": "Berlin",
      "details": "27.11.2025 (Bekanntmachungsdatum)\n\nBerlin Amtsgericht Berlin (Charlottenburg) HRB 189963\nLöschungsankündigung\n\nSECUDOO GmbH\nGesellschaft mit beschränkter Haftung\nBerlin\n\nBei der nachstehenden Gesellschaft wird das Amtslöschungsverfahren gemäß § 394 FamFG eingeleitet. Widerspruchsfrist 6 Wochen"
    },
    {
      "date": "2025-11-27",
      "id": "138433",
      "original_text": "Registerbekanntmachung nach dem Umwandlungsgesetz\nSachsen-Anhalt Amtsgericht Stendal HRB 3705\nSchweinezucht Binde GmbH – Genthin",
      "type": "Registerbekanntmachung nach dem Umwandlungsgesetz",
      "state": "Sachsen-Anhalt",
      "amtsgericht": "Amtsgericht Stendal",
      "registernummer": "HRB 3705",
      "registerart": "HRB",
      "company_name": "Schweinezucht Binde GmbH",
      "company_seat": "Genthin",
      "details": "27.11.2025 (Bekanntmachungsdatum)\n\nSachsen-Anhalt Amtsgericht Stendal HRB 3705\nRegisterbekanntmachung nach dem Umwandlungsgesetz 27.11.2025 (Eintragungsdatum)\n\nSchweinezucht Binde GmbH\nGesellschaft mit beschränkter Haftung\nGenthin\n\nNicht eingetragen:\nDen Gläubigern der an der Verschmelzung beteiligten Rechtsträger ist, wenn sie binnen sechs Monaten nach dem Tag, an dem die Eintragung der Verschmelzung nach § 19 Abs. 3 UmwG als bekanntgemacht gilt, ihren Anspruch nach Grund und Höhe schriftlich anmelden, Sicherheit zu leisten, soweit sie nicht Befriedigung verlangen können. Dieses Recht steht ihnen jedoch nur zu, wenn sie glaubhaft machen, dass durch die Verschmelzung die Erfüllung ihrer Forderung gefährdet wird."
    },
    {
      "date": "2025-11-27",
      "id": "138434",
      "original_text": "Registerbekanntmachung nach dem Umwandlungsgesetz\nSachsen-Anhalt Amtsgericht Stendal HRB 22835\nDEMVA GmbH – Genthin",
      "type": "Registerbekanntmachung nach dem Umwandlungsgesetz",
      "state": "Sachsen-Anhalt",
      "amtsgericht": "Amtsgericht Stendal",
      "registernummer": "HRB 22835",
      "registerart": "HRB",
      "company_name": "DEMVA GmbH",
      "company_seat": "Genthin",
      "details": "27.11.2025 (Bekanntmachungsdatum)\n\nSachsen-Anhalt Amtsgericht Stendal HRB 22835\nRegisterbekanntmachung nach dem Umwandlungsgesetz 27.11.2025 (Eintragungsdatum)\n\nDEMVA GmbH\nGesellschaft mit beschränkter Haftung\nGenthin\n\nNicht eingetragen:\nDen Gläubigern der an der Verschmelzung beteiligten Rechtsträger ist, wenn sie binnen sechs Monaten nach dem Tag, an dem die Eintragung der Verschmelzung nach § 19 Abs. 3 UmwG als bekanntgemacht gilt, ihren Anspruch nach Grund und Höhe schriftlich anmelden, Sicherheit zu leisten, soweit sie nicht Befriedigung verlangen können. Dieses Recht steht ihnen jedoch nur zu, wenn sie glaubhaft machen, dass durch die Verschmelzung die Erfüllung ihrer Forderung gefährdet wird."
    },
    {
      "date": "2025-11-27",
      "id": "138435",
      "original_text": "Registerbekanntmachung nach dem Umwandlungsgesetz\nHamburg Amtsgericht Hamburg HRB 193476\nFUNKE Medien National Brands GmbH – Hamburg",
      "type": "Registerbekanntmachung nach dem Umwandlungsgesetz",
      "state": "Hamburg",
      "amtsgericht": "Amtsgericht Hamburg",
      "registernummer": "HRB 193476",
      "registerart": "HRB",
      "company_name": "FUNKE Medien National Brands GmbH",
      "company_seat": "Hamburg",
      "details": "27.11.2025 (Bekanntmachungsdatum)\n\nHamburg Amtsgericht Hamburg HRB 193476\nRegisterbekanntmachung nach dem Umwandlungsgesetz 27.11.2025 (Eintragungsdatum)\n\nFUNKE Medien National Brands GmbH\nGesellschaft mit beschränkter Haftung\nHamburg\n\nAls nicht eingetragen wird bekannt gemacht:\nDen Gläubigern der an der Verschmelzung beteiligten Gesellschaften ist, wenn sie binnen sechs Monaten nach dem Tag, an dem die Eintragung der Verschmelzung in das Register des Sitzes desjenigen Rechtsträgers, dessen Gläubiger sie sind, nach § 19 Absatz 3 UmwG als bekannt gemacht gilt, ihren Anspruch nach Grund und Höhe schriftlich anmelden, Sicherheit zu leisten, soweit sie nicht Befriedigung verlangen können. Dieses Recht steht den Gläubigern jedoch nur zu, wenn sie glaubhaft machen, dass durch die Verschmelzung die Erfüllung ihrer Forderung gefährdet wird."
    },
    {
      "date": "2025-11-27",
      "id": "138436",
      "original_text": "Einreichung neuer Dokumente\nHamburg Amtsgericht Hamburg HRB 10199\nTEREG Gebäudedienste GmbH – Hamburg",
      "type": "Einreichung neuer Dokumente",
      "state": "Hamburg",
      "amtsgericht": "Amtsgericht Hamburg",
      "registernummer": "HRB 10199",
      "registerart": "HRB",
      "company_name": "TEREG Gebäudedienste GmbH",
      "company_seat": "Hamburg",
      "details": "27.11.2025 (Bekanntmachungsdatum)\n\nHamburg Amtsgericht Hamburg HRB 10199\nEinreichung neuer Dokumente 27.11.2025 (Eintragungsdatum)\n\nTEREG Gebäudedienste GmbH\nGesellschaft mit beschränkter Haftung\nHamburg\n\nAls nicht eingetragen wird bekannt gemacht: Liste des Aufsichtsrats wurde eingereicht."
    },
    {
      "date": "2025-11-27",
      "id": "138437",
      "original_text": "Löschungsankündigung\nBaden-Württemberg Amtsgericht Freiburg HRB 720014\nHT Technologie GmbH – Lahr",
      "type": "Löschungsankündigung",
      "state": "Baden-Württemberg",
      "amtsgericht": "Amtsgericht Freiburg",
      "registernummer": "HRB 720014",
      "registerart": "HRB",
      "company_name": "HT Technologie GmbH",
      "company_seat": "Lahr",
      "details": "27.11.2025 (Bekanntmachungsdatum)\n\nBaden-Württemberg Amtsgericht Freiburg HRB 720014\nLöschungsankündigung\n\nHT Technologie GmbH\nGesellschaft mit beschränkter Haftung\nLahr\n\nAls nicht eingetragen wird bekanntgemacht:\nDas Gericht beabsichtigt, die Gesellschaft wegen Vermögenslosigkeit im Handelsregister von Amts wegen nach § 394 FamFG zu löschen. Die Frist zur Geltendmachung eines Widerspruchs gegen die beabsichtigte Löschung ist auf einen Monat ab Veröffentlichung bestimmt."
    },
    {
      "date": "2025-11-27",
      "id": "138438",
      "original_text": "Registerbekanntmachung nach dem Umwandlungsgesetz\nBaden-Württemberg Amtsgericht Mannheim HRB 754170\nSave Energy GmbH – Kronau",
      "type": "Registerbekanntmachung nach dem Umwandlungsgesetz",
      "state": "Baden-Württemberg",
      "amtsgericht": "Amtsgericht Mannheim",
      "registernummer": "HRB 754170",
      "registerart": "HRB",
      "company_name": "Save Energy GmbH",
      "company_seat": "Kronau",
      "details": "27.11.2025 (Bekanntmachungsdatum)\n\nBaden-Württemberg Amtsgericht Mannheim HRB 754170\nRegisterbekanntmachung nach dem Umwandlungsgesetz 27.11.2025 (Eintragungsdatum)\n\nSave Energy GmbH\nGesellschaft mit beschränkter Haftung\nKronau\n\nAls nicht eingetragen wird bekanntgemacht:\nDen Gläubigern der an der Verschmelzung beteiligten Rechtsträger ist, wenn sie binnen sechs Monaten nach dem Tag, an dem die Eintragung der Verschmelzung in das Register des Sitzes desjenigen Rechtsträgers, dessen Gläubiger sie sind, nach § 19 Abs. 3 UmwG als bekanntgemacht gilt, ihren Anspruch nach Grund und Höhe schriftlich anmelden, Sicherheit zu leisten, soweit sie nicht Befriedigung verlangen können. Dieses Recht steht den Gläubigern jedoch nur zu, wenn sie glaubhaft machen, dass durch die Verschmelzung die Erfüllung ihrer Forderung gefährdet wird."
    },
    {
      "date": "2025-11-27",
      "id": "138439",
      "original_text": "Registerbekanntmachung nach dem Umwandlungsgesetz\nBerlin Amtsgericht Berlin (Charlottenburg) HRA 62050\nM-Solarkraftwerk 7 GmbH & Co. KG – Berlin",
      "type": "Registerbekanntmachung nach dem Umwandlungsgesetz",
      "state": "Berlin",
      "amtsgericht": "Amtsgericht Berlin (Charlottenburg)",
      "registernummer": "HRA 62050",
      "registerart": "HRA",
      "company_name": "M-Solarkraftwerk 7 GmbH & Co. KG",
      "company_seat": "Berlin",
      "details": "27.11.2025 (Bekanntmachungsdatum)\n\nBerlin Amtsgericht Berlin (Charlottenburg) HRA 62050\nRegisterbekanntmachung nach dem Umwandlungsgesetz 26.11.2025 (Eintragungsdatum)\n\nM-Solarkraftwerk 7 GmbH & Co. KG\nKommanditgesellschaft\nBerlin\n\nZu Eintragungsnummer 5 vom 26.11.2025 wird als nicht eingetragen veröffentlicht: Den Gläubigern der an der Spaltung beteiligten Rechtsträger ist, wenn sie binnen sechs Monaten nach dem Tag, an dem die Eintragung der Spaltung in das Register des Sitzes desjenigen Rechtsträgers, dessen Gläubiger sie sind, als bekannt gemacht gilt, ihren Anspruch nach Grund und Höhe schriftlich anmelden, Sicherheit zu leisten, soweit sie nicht Befriedigung verlangen können. Dieses Recht steht den Gläubigern jedoch nur zu, wenn sie glaubhaft machen, dass durch die Spaltung die Erfüllung ihrer Forderung gefährdet wird. Das Recht, Sicherheitsleistung zu verlangen, steht Gläubigern nicht zu, die im Falle der Insolvenz ein Recht auf vorzugsweise Befriedigung aus einer Deckungsmasse haben, die nach gesetzlicher Vorschrift zu ihrem Schutz errichtet und staatlich überwacht ist."
    },
    {
      "date": "2025-11-27",
      "id": "138440",
      "original_text": "Löschungsankündigung\nBerlin Amtsgericht Berlin (Charlottenburg) HRB 133084\nSen Fi Deutschland GmbH – Berlin",
      "type": "Löschungsankündigung",
      "state": "Berlin",
      "amtsgericht": "Amtsgericht Berlin (Charlottenburg)",
      "registernummer": "HRB 133084",
      "registerart": "HRB",
      "company_name": "Sen Fi Deutschland GmbH",
      "company_seat": "Berlin",
      "details": "27.11.2025 (Bekanntmachungsdatum)\n\nBerlin Amtsgericht Berlin (Charlottenburg) HRB 133084\nLöschungsankündigung\n\nSen Fi Deutschland GmbH\nGesellschaft mit beschränkter Haftung\nBerlin\n\nBei der nachstehenden Gesellschaft wird das Amtslöschungsverfahren gemäß § 394 FamFG eingeleitet. Widerspruchsfrist 6 Wochen"
    },
    {
      "date": "2025-11-27",
      "id": "138441",
      "original_text": "Registerbekanntmachung nach dem Umwandlungsgesetz\nBerlin Amtsgericht Berlin (Charlottenburg) HRA 64709\n4M-Photovoltaik e. K. – Berlin",
      "type": "Registerbekanntmachung nach dem Umwandlungsgesetz",
      "state": "Berlin",
      "amtsgericht": "Amtsgericht Berlin (Charlottenburg)",
      "registernummer": "HRA 64709",
      "registerart": "HRA",
      "company_name": "4M-Photovoltaik e. K.",
      "company_seat": "Berlin",
      "details": "27.11.2025 (Bekanntmachungsdatum)\n\nBerlin Amtsgericht Berlin (Charlottenburg) HRA 64709\nRegisterbekanntmachung nach dem Umwandlungsgesetz 26.11.2025 (Eintragungsdatum)\n\n4M-Photovoltaik e. K.\nEinzelkaufmann / Einzelkauffrau\nBerlin\n\nZu Eintragungsnummer 2 vom 26.11.2025 wird als nicht eingetragen veröffentlicht: Den Gläubigern der an der Spaltung beteiligten Rechtsträger ist, wenn sie binnen sechs Monaten nach dem Tag, an dem die Eintragung der Spaltung in das Register des Sitzes desjenigen Rechtsträgers, dessen Gläubiger sie sind, als bekannt gemacht gilt, ihren Anspruch nach Grund und Höhe schriftlich anmelden, Sicherheit zu leisten, soweit sie nicht Befriedigung verlangen können. Dieses Recht steht den Gläubigern jedoch nur zu, wenn sie glaubhaft machen, dass durch die Spaltung die Erfüllung ihrer Forderung gefährdet wird. Das Recht, Sicherheitsleistung zu verlangen, steht Gläubigern nicht zu, die im Falle der Insolvenz ein Recht auf vorzugsweise Befriedigung aus einer Deckungsmasse haben, die nach gesetzlicher Vorschrift zu ihrem Schutz errichtet und staatlich überwacht ist."
    },
    {
      "date": "2025-11-27",
      "id": "138442",
      "original_text": "Löschungsankündigung\nBerlin Amtsgericht Berlin (Charlottenburg) HRB 237821\nB&C Handel GmbH – Berlin",
      "type": "Löschungsankündigung",
      "state": "Berlin",
      "amtsgericht": "Amtsgericht Berlin (Charlottenburg)",
      "registernummer": "HRB 237821",
      "registerart": "HRB",
      "company_name": "B&C Handel GmbH",
      "company_seat": "Berlin",
      "details": "27.11.2025 (Bekanntmachungsdatum)\n\nBerlin Amtsgericht Berlin (Charlottenburg) HRB 237821\nLöschungsankündigung\n\nB&C Handel GmbH\nGesellschaft mit beschränkter Haftung\nBerlin\n\nBei der nachstehenden Gesellschaft wird das Amtslöschungsverfahren gemäß § 394 FamFG eingeleitet. Widerspruchsfrist 6 Wochen"
    },
    {
      "date": "2025-11-27",
      "id": "138443",
      "original_text": "Löschungsankündigung\nBerlin Amtsgericht Berlin (Charlottenburg) HRB 233751\nC.H. Brandt UG (haftungsbeschränkt) – Berlin",
      "type": "Löschungsankündigung",
      "state": "Berlin",
      "amtsgericht": "Amtsgericht Berlin (Charlottenburg)",
      "registernummer": "HRB 233751",
      "registerart": "HRB",
      "company_name": "C.H. Brandt UG (haftungsbeschränkt)",
      "company_seat": "Berlin",
      "details": "27.11.2025 (Bekanntmachungsdatum)\n\nBerlin Amtsgericht Berlin (Charlottenburg) HRB 233751\nLöschungsankündigung\n\nC.H. Brandt UG (haftungsbeschränkt)\nGesellschaft mit beschränkter Haftung\nBerlin\n\nBei der nachstehenden Gesellschaft wird das Amtslöschungsverfahren gemäß § 394 FamFG eingeleitet. Widerspruchsfrist 6 Wochen"
    },
    {
      "date": "2025-11-27",
      "id": "138444",
      "original_text": "Einreichung neuer Dokumente\nBaden-Württemberg Amtsgericht Mannheim HRB 703230\nnora systems GmbH – Weinheim",
      "type": "Einreichung neuer Dokumente",
      "state": "Baden-Württemberg",
      "amtsgericht": "Amtsgericht Mannheim",
      "registernummer": "HRB 703230",
      "registerart": "HRB",
      "company_name": "nora systems GmbH",
      "company_seat": "Weinheim",
      "details": "27.11.2025 (Bekanntmachungsdatum)\n\nBaden-Württemberg Amtsgericht Mannheim HRB 703230\nEinreichung neuer Dokumente\n\nnora systems GmbH\nGesellschaft mit beschränkter Haftung\nWeinheim\n\nDie Gesellschaft hat am 26.11.2025 die Liste über die Zusammensetzung des Aufsichtsrats zum Handelsregister eingereicht."
    },
    {
      "date": "2025-11-27",
      "id": "138445",
      "original_text": "Registerbekanntmachung nach dem Umwandlungsgesetz\nHamburg Amtsgericht Hamburg HRB 160821\nBlundstone Beteiligungs- und Beratungsgesellschaft mbH – Hamburg",
      "type": "Registerbekanntmachung nach dem Umwandlungsgesetz",
      "state": "Hamburg",
      "amtsgericht": "Amtsgericht Hamburg",
      "registernummer": "HRB 160821",
      "registerart": "HRB",
      "company_name": "Blundstone Beteiligungs- und Beratungsgesellschaft mbH",
      "company_seat": "Hamburg",
      "details": "27.11.2025 (Bekanntmachungsdatum)\n\nHamburg Amtsgericht Hamburg HRB 160821\nRegisterbekanntmachung nach dem Umwandlungsgesetz 27.11.2025 (Eintragungsdatum)\n\nBlundstone Beteiligungs- und Beratungsgesellschaft mbH\nGesellschaft mit beschränkter Haftung\nHamburg\n\nAls nicht eingetragen wird bekannt gemacht:\nDen Gläubigern der an der Verschmelzung beteiligten Gesellschaften ist, wenn sie binnen sechs Monaten nach dem Tag, an dem die Eintragung der Verschmelzung in das Register des Sitzes desjenigen Rechtsträgers, dessen Gläubiger sie sind, nach § 19 Absatz 3 UmwG als bekannt gemacht gilt, ihren Anspruch nach Grund und Höhe schriftlich anmelden, Sicherheit zu leisten, soweit sie nicht Befriedigung verlangen können. Dieses Recht steht den Gläubigern jedoch nur zu, wenn sie glaubhaft machen, dass durch die Verschmelzung die Erfüllung ihrer Forderung gefährdet wird."
    },
    {
      "date": "2025-11-27",
      "id": "138446",
      "original_text": "Registerbekanntmachung nach dem Umwandlungsgesetz\nHamburg Amtsgericht Hamburg HRB 189965\nMaklaro GmbH – Hamburg",
      "type": "Registerbekanntmachung nach dem Umwandlungsgesetz",
      "state": "Hamburg",
      "amtsgericht": "Amtsgericht Hamburg",
      "registernummer": "HRB 189965",
      "registerart": "HRB",
      "company_name": "Maklaro GmbH",
      "company_seat": "Hamburg",
      "details": "27.11.2025 (Bekanntmachungsdatum)\n\nHamburg Amtsgericht Hamburg HRB 189965\nRegisterbekanntmachung nach dem Umwandlungsgesetz 27.11.2025 (Eintragungsdatum)\n\nMaklaro GmbH\nGesellschaft mit beschränkter Haftung\nHamburg\n\nAls nicht eingetragen wird bekannt gemacht:\nDen Gläubigern der an der Verschmelzung beteiligten Gesellschaften ist, wenn sie binnen sechs Monaten nach dem Tag, an dem die Eintragung der Verschmelzung in das Register des Sitzes desjenigen Rechtsträgers, dessen Gläubiger sie sind, nach § 19 Absatz 3 UmwG als bekannt gemacht gilt, ihren Anspruch nach Grund und Höhe schriftlich anmelden, Sicherheit zu leisten, soweit sie nicht Befriedigung verlangen können. Dieses Recht steht den Gläubigern jedoch nur zu, wenn sie glaubhaft machen, dass durch die Verschmelzung die Erfüllung ihrer Forderung gefährdet wird."
    },
    {
      "date": "2025-11-27",
      "id": "138447",
      "original_text": "Registerbekanntmachung nach dem Umwandlungsgesetz\nBaden-Württemberg Amtsgericht Stuttgart HRB 22719\nFirst Data Mobile Solutions GmbH – Stuttgart",
      "type": "Registerbekanntmachung nach dem Umwandlungsgesetz",
      "state": "Baden-Württemberg",
      "amtsgericht": "Amtsgericht Stuttgart",
      "registernummer": "HRB 22719",
      "registerart": "HRB",
      "company_name": "First Data Mobile Solutions GmbH",
      "company_seat": "Stuttgart",
      "details": "27.11.2025 (Bekanntmachungsdatum)\n\nBaden-Württemberg Amtsgericht Stuttgart HRB 22719\nRegisterbekanntmachung nach dem Umwandlungsgesetz 27.11.2025 (Eintragungsdatum)\n\nFirst Data Mobile Solutions GmbH\nGesellschaft mit beschränkter Haftung\nStuttgart\n\nAls nicht eingetragen wird bekanntgemacht:\nDen Gläubigern der an der Verschmelzung beteiligten Rechtsträger ist, wenn sie binnen sechs Monaten nach dem Tag, an dem die Eintragung der Verschmelzung in das Register des Sitzes desjenigen Rechtsträgers, dessen Gläubiger sie sind, nach § 19 Abs. 3 UmwG als bekanntgemacht gilt, ihren Anspruch nach Grund und Höhe schriftlich anmelden, Sicherheit zu leisten, soweit sie nicht Befriedigung verlangen können. Dieses Recht steht den Gläubigern jedoch nur zu, wenn sie glaubhaft machen, dass durch die Verschmelzung die Erfüllung ihrer Forderung gefährdet wird."
    },
    {
      "date": "2025-11-27",
      "id": "138448",
      "original_text": "Löschungsankündigung\nSchleswig-Holstein Amtsgericht Lübeck HRB 5471\nIngenieurbüro Bertz GmbH – Lübeck",
      "type": "Löschungsankündigung",
      "state": "Schleswig-Holstein",
      "amtsgericht": "Amtsgericht Lübeck",
      "registernummer": "HRB 5471",
      "registerart": "HRB",
      "company_name": "Ingenieurbüro Bertz GmbH",
      "company_seat": "Lübeck",
      "details": "27.11.2025 (Bekanntmachungsdatum)\n\nSchleswig-Holstein Amtsgericht Lübeck HRB 5471\nLöschungsankündigung\n\nIngenieurbüro Bertz GmbH\nGesellschaft mit beschränkter Haftung\nLübeck\n\nEs ist die Löschung der nachstehenden Gesellschaft wegen Vermögenslosigkeit gemäß § 394 FamFG beabsichtigt.\nIngenieurbüro Bertz GmbH\nRapsacker 8\n23556 Lübeck\nIn der Handelsregistersache Ingenieurbüro Bertz GmbH ergeben sich aus den mir vorliegenden Unterlagen Anhaltspunkte dafür, dass die Gesellschaft vermögenslos ist:\nDas Insolvenzverfahren wurde durch Beschluss des Amtsgerichts Lübeck vom 18.09.2025 nach Abhalten des Schlusstermins im schriftlichen Verfahren und Vollzug der Schlussverteilung aufgehoben.\nIch beabsichtige daher, die Gesellschaft wegen Vermögenslosigkeit gemäß § 394 FamFG zu löschen.\nIch bestimme eine Frist von einem Monat zur Geltendmachung eines Widerspruchs gegen die Löschung, § 394 Abs. 2 S. 1 FamFG.\nWeiter bitte ich Sie, mir binnen derselben Frist mitzuteilen, ob die genannte Gesellschaft noch Vermögen hat, ggf. welche Vermögensgegenstände sie besitzt, ob die Gesellschaft noch Partei eines noch nicht rechtskräftig abgeschlossenen Rechtsstreits ist oder ob sonst noch eine Abwicklung stattfindet.\nNach Fristablauf ohne Widerspruch von Ihnen oder anderer Seite wird die Gesellschaft gelöscht.\nSteder, Dipl.-Rechtspflegerin (FH)"
    },
    {
      "date": "2025-11-27",
      "id": "138449",
      "original_text": "Löschungsankündigung\nSchleswig-Holstein Amtsgericht Pinneberg HRA 9080\nTriple A Talents Management UG & Co. KG (haftungsbeschränkt) – Ellerbek",
      "type": "Löschungsankündigung",
      "state": "Schleswig-Holstein",
      "amtsgericht": "Amtsgericht Pinneberg",
      "registernummer": "HRA 9080",
      "registerart": "HRA",
      "company_name": "Triple A Talents Management UG & Co. KG (haftungsbeschränkt)",
      "company_seat": "Ellerbek",
      "details": "27.11.2025 (Bekanntmachungsdatum)\n\nSchleswig-Holstein Amtsgericht Pinneberg HRA 9080\nLöschungsankündigung\n\nTriple A Talents Management UG & Co. KG (haftungsbeschränkt)\nKommanditgesellschaft\nEllerbek\n\nEs ist die Löschung der nachstehenden Gesellschaft wegen Vermögenslosigkeit gemäß § 394 FamFG beabsichtigt. Widerspruchsfrist: 2 Monate."
    },
    {
      "date": "2025-11-27",
      "id": "138450",
      "original_text": "Löschungsankündigung\nBaden-Württemberg Amtsgericht Ulm HRB 490414\nRudolf Bohnacker Systeme GmbH – Rottenacker",
      "type": "Löschungsankündigung",
      "state": "Baden-Württemberg",
      "amtsgericht": "Amtsgericht Ulm",
      "registernummer": "HRB 490414",
      "registerart": "HRB",
      "company_name": "Rudolf Bohnacker Systeme GmbH",
      "company_seat": "Rottenacker",
      "details": "27.11.2025 (Bekanntmachungsdatum)\n\nBaden-Württemberg Amtsgericht Ulm HRB 490414\nLöschungsankündigung\n\nRudolf Bohnacker Systeme GmbH\nGesellschaft mit beschränkter Haftung\nRottenacker\n\nDas Gericht beabsichtigt, die Gesellschaft wegen Vermögenslosigkeit im Handelsregister von Amts wegen nach § 394 FamFG zu löschen. Die Frist zur Geltendmachung eines Widerspruchs gegen die beabsichtigte Löschung ist auf  einen Monat ab Veröffentlichung bestimmt."
    },
    {
      "date": "2025-11-27",
      "id": "138451",
      "original_text": "Löschungsankündigung\nBaden-Württemberg Amtsgericht Freiburg HRB 580667\nS & W Training - Sprachen & Wirtschaft GmbH – Meersburg",
      "type": "Löschungsankündigung",
      "state": "Baden-Württemberg",
      "amtsgericht": "Amtsgericht Freiburg",
      "registernummer": "HRB 580667",
      "registerart": "HRB",
      "company_name": "S & W Training - Sprachen & Wirtschaft GmbH",
      "company_seat": "Meersburg",
      "details": "27.11.2025 (Bekanntmachungsdatum)\n\nBaden-Württemberg Amtsgericht Freiburg HRB 580667\nLöschungsankündigung\n\nS & W Training - Sprachen & Wirtschaft  GmbH\nGesellschaft mit beschränkter Haftung\nMeersburg\n\nDas Gericht beabsichtigt, die Gesellschaft wegen Vermögenslosigkeit im Handelsregister von Amts wegen nach § 394 FamFG zu löschen. Die Frist zur Geltendmachung eines Widerspruchs gegen die beabsichtigte Löschung ist auf einen Monat ab Veröffentlichung bestimmt."
    },
    {
      "date": "2025-11-27",
      "id": "138452",
      "original_text": "Löschungsankündigung\nBaden-Württemberg Amtsgericht Mannheim HRB 331012\nBauabdichtungen Rhein-Neckar GmbH – Heidelberg",
      "type": "Löschungsankündigung",
      "state": "Baden-Württemberg",
      "amtsgericht": "Amtsgericht Mannheim",
      "registernummer": "HRB 331012",
      "registerart": "HRB",
      "company_name": "Bauabdichtungen Rhein-Neckar GmbH",
      "company_seat": "Heidelberg",
      "details": "27.11.2025 (Bekanntmachungsdatum)\n\nBaden-Württemberg Amtsgericht Mannheim HRB 331012\nLöschungsankündigung\n\nBauabdichtungen Rhein-Neckar GmbH\nGesellschaft mit beschränkter Haftung\nHeidelberg\n\nDas Gericht beabsichtigt, die Gesellschaft wegen Vermögenslosigkeit im Handelsregister von Amts wegen nach § 394 FamFG zu löschen. Die Frist zur Geltendmachung eines Widerspruchs gegen die beabsichtigte Löschung ist auf einen Monat ab Veröffentlichung bestimmt."
    },
    {
      "date": "2025-11-27",
      "id": "138453",
      "original_text": "Einreichung neuer Dokumente\nThüringen Amtsgericht Jena HRB 202810\nInterMetall AG – Weira",
      "type": "Einreichung neuer Dokumente",
      "state": "Thüringen",
      "amtsgericht": "Amtsgericht Jena",
      "registernummer": "HRB 202810",
      "registerart": "HRB",
      "company_name": "InterMetall AG",
      "company_seat": "Weira",
      "details": "27.11.2025 (Bekanntmachungsdatum)\n\nThüringen Amtsgericht Jena HRB 202810\nEinreichung neuer Dokumente\n\nInterMetall AG\nAktiengesellschaft\nWeira\n\nBekanntmachung gem. § 106 AktG: Aufgrund einer Veränderung in den Personen der Aufsichtsratsmitglieder ist durch den Vorstand eine neue Liste zum Handelsregister eingereicht worden."
    },
    {
      "date": "2025-11-27",
      "id": "138454",
      "original_text": "Löschungsankündigung\nBrandenburg Amtsgericht Frankfurt/Oder HRB 16908\nHeilmann's Backshop UG (haftungsbeschränkt) – Bernau bei Berlin",
      "type": "Löschungsankündigung",
      "state": "Brandenburg",
      "amtsgericht": "Amtsgericht Frankfurt/Oder",
      "registernummer": "HRB 16908",
      "registerart": "HRB",
      "company_name": "Heilmann's Backshop UG (haftungsbeschränkt)",
      "company_seat": "Bernau bei Berlin",
      "details": "27.11.2025 (Bekanntmachungsdatum)\n\nBrandenburg Amtsgericht Frankfurt/Oder HRB 16908\nLöschungsankündigung\n\nHeilmann's Backshop UG (haftungsbeschränkt)\nGesellschaft mit beschränkter Haftung\nBernau bei Berlin\n\nBei der nachstehenden Gesellschaft wird das Amtslöschungsverfahren gemäß § 394 FamFG eingeleitet."
    },
    {
      "date": "2025-11-27",
      "id": "138455",
      "original_text": "Löschungsankündigung\nBrandenburg Amtsgericht Frankfurt/Oder HRB 9788\nPfeil Bau GmbH – Bernau bei Berlin",
      "type": "Löschungsankündigung",
      "state": "Brandenburg",
      "amtsgericht": "Amtsgericht Frankfurt/Oder",
      "registernummer": "HRB 9788",
      "registerart": "HRB",
      "company_name": "Pfeil Bau GmbH",
      "company_seat": "Bernau bei Berlin",
      "details": "27.11.2025 (Bekanntmachungsdatum)\n\nBrandenburg Amtsgericht Frankfurt/Oder HRB 9788\nLöschungsankündigung\n\nPfeil Bau GmbH\nGesellschaft mit beschränkter Haftung\nBernau bei Berlin\n\nBei der nachstehenden Gesellschaft wird das Amtslöschungsverfahren gemäß § 394 FamFG eingeleitet."
    },
    {
      "date": "2025-11-27",
      "id": "138456",
      "original_text": "Löschungsankündigung\nBrandenburg Amtsgericht Potsdam HRB 34546\nBlack Mamba GmbH – Falkensee",
      "type": "Löschungsankündigung",
      "state": "Brandenburg",
      "amtsgericht": "Amtsgericht Potsdam",
      "registernummer": "HRB 34546",
      "registerart": "HRB",
      "company_name": "Black Mamba GmbH",
      "company_seat": "Falkensee",
      "details": "27.11.2025 (Bekanntmachungsdatum)\n\nBrandenburg Amtsgericht Potsdam HRB 34546\nLöschungsankündigung\n\nBlack Mamba GmbH\nGesellschaft mit beschränkter Haftung\nFalkensee\n\nBei der nachstehenden Gesellschaft wird das Amtslöschungsverfahren gemäß § 394 FamFG eingeleitet. Widerspruchsfrist: 8 Wochen."
    },
    {
      "date": "2025-11-27",
      "id": "138457",
      "original_text": "Löschungsankündigung\nNordrhein-Westfalen Amtsgericht Coesfeld HRB 17471\nOptima Real Estate UG (haftungsbeschränkt) – Gronau",
      "type": "Löschungsankündigung",
      "state": "Nordrhein-Westfalen",
      "amtsgericht": "Amtsgericht Coesfeld",
      "registernummer": "HRB 17471",
      "registerart": "HRB",
      "company_name": "Optima Real Estate UG (haftungsbeschränkt)",
      "company_seat": "Gronau",
      "details": "27.11.2025 (Bekanntmachungsdatum)\n\nNordrhein-Westfalen Amtsgericht Coesfeld HRB 17471\nLöschungsankündigung\n\nOptima Real Estate UG (haftungsbeschränkt)\nGesellschaft mit beschränkter Haftung\nGronau\n\nDas Registergericht beabsichtigt, den Rechtsträger wegen Vermögenslosigkeit gemäß § 394 FamFG von Amts wegen zu löschen.\n\nGegen diese Verfügung kann Widerspruch eingelegt werden. Die Frist zur Erhebung eines Widerspruchs gegen die beabsichtigte Löschung ist auf zwei Monate ab Veröffentlichung festgesetzt."
    },
    {
      "date": "2025-11-27",
      "id": "138458",
      "original_text": "Einreichung neuer Dokumente\nBaden-Württemberg Amtsgericht Mannheim HRB 110206\nServiscope AG – Karlsruhe",
      "type": "Einreichung neuer Dokumente",
      "state": "Baden-Württemberg",
      "amtsgericht": "Amtsgericht Mannheim",
      "registernummer": "HRB 110206",
      "registerart": "HRB",
      "company_name": "Serviscope AG",
      "company_seat": "Karlsruhe",
      "details": "27.11.2025 (Bekanntmachungsdatum)\n\nBaden-Württemberg Amtsgericht Mannheim HRB 110206\nEinreichung neuer Dokumente\n\nServiscope AG\nAktiengesellschaft\nKarlsruhe\n\nDie Gesellschaft hat am 27.11.2025 die Liste über die Zusammensetzung des Aufsichtsrats zum Handelsregister eingereicht."
    },
    {
      "date": "2025-11-27",
      "id": "138459",
      "original_text": "Sonstige Registerbekanntmachung\nHamburg Amtsgericht Hamburg HRB 138153\nCUT POWER AG – Hamburg",
      "type": "Sonstige Registerbekanntmachung",
      "state": "Hamburg",
      "amtsgericht": "Amtsgericht Hamburg",
      "registernummer": "HRB 138153",
      "registerart": "HRB",
      "company_name": "CUT POWER AG",
      "company_seat": "Hamburg",
      "details": "27.11.2025 (Bekanntmachungsdatum)\n\nHamburg Amtsgericht Hamburg HRB 138153\nSonstige Registerbekanntmachung\n\nCUT POWER AG\nAktiengesellschaft\nHamburg\n\nAls nicht eingetragen wird bekannt gemacht: Liste des Aufsichtsrats wurde eingereicht."
    },
    {
      "date": "2025-11-27",
      "id": "138460",
      "original_text": "Sonstige Registerbekanntmachung\nBaden-Württemberg Amtsgericht Mannheim HRB 736923\nWMT Aktiengesellschaft – Heidelberg",
      "type": "Sonstige Registerbekanntmachung",
      "state": "Baden-Württemberg",
      "amtsgericht": "Amtsgericht Mannheim",
      "registernummer": "HRB 736923",
      "registerart": "HRB",
      "company_name": "WMT Aktiengesellschaft",
      "company_seat": "Heidelberg",
      "details": "27.11.2025 (Bekanntmachungsdatum)\n\nBaden-Württemberg Amtsgericht Mannheim HRB 736923\nSonstige Registerbekanntmachung\n\nWMT Aktiengesellschaft\nAktiengesellschaft\nHeidelberg\n\nDie Gesellschaft hat am 26.11.2025 die Liste über die Zusammensetzung des Aufsichtsrats zum Handelsregister eingereicht."
    },
    {
      "date": "2025-11-27",
      "id": "138461",
      "original_text": "Registerbekanntmachung nach dem Umwandlungsgesetz\nBaden-Württemberg Amtsgericht Stuttgart HRA 352469\nSchweizer GmbH & Co. KG Federntechnik – Reutlingen",
      "type": "Registerbekanntmachung nach dem Umwandlungsgesetz",
      "state": "Baden-Württemberg",
      "amtsgericht": "Amtsgericht Stuttgart",
      "registernummer": "HRA 352469",
      "registerart": "HRA",
      "company_name": "Schweizer GmbH & Co. KG Federntechnik",
      "company_seat": "Reutlingen",
      "details": "27.11.2025 (Bekanntmachungsdatum)\n\nBaden-Württemberg Amtsgericht Stuttgart HRA 352469\nRegisterbekanntmachung nach dem Umwandlungsgesetz 27.11.2025 (Eintragungsdatum)\n\nSchweizer GmbH & Co. KG Federntechnik\nKommanditgesellschaft\nReutlingen\n\nDen Gläubigern des an dem Formwechsel beteiligten Rechtsträgers ist, wenn sie binnen sechs Monaten nach dem Tag, an dem die Eintragung des Formwechsels in das Register des Sitzes desjenigen Rechtsträgers, dessen Gläubiger sie sind, nach § 19 Abs. 3 UmwG als bekanntgemacht gilt, ihren Anspruch nach Grund und Höhe schriftlich anmelden, Sicherheit zu leisten, soweit sie nicht Befriedigung verlangen können. Dieses Recht steht den Gläubigern jedoch nur zu, wenn sie glaubhaft machen, dass durch den Formwechsel die Erfüllung ihrer Forderung gefährdet wird."
    },
    {
      "date": "2025-11-27",
      "id": "138462",
      "original_text": "Registerbekanntmachung nach dem Umwandlungsgesetz\nBaden-Württemberg Amtsgericht Stuttgart HRA 727851\nJakimovski Heiztechnik e.K. – Ludwigsburg",
      "type": "Registerbekanntmachung nach dem Umwandlungsgesetz",
      "state": "Baden-Württemberg",
      "amtsgericht": "Amtsgericht Stuttgart",
      "registernummer": "HRA 727851",
      "registerart": "HRA",
      "company_name": "Jakimovski Heiztechnik e.K.",
      "company_seat": "Ludwigsburg",
      "details": "27.11.2025 (Bekanntmachungsdatum)\n\nBaden-Württemberg Amtsgericht Stuttgart HRA 727851\nRegisterbekanntmachung nach dem Umwandlungsgesetz 27.11.2025 (Eintragungsdatum)\n\nJakimovski Heiztechnik e.K.\nEinzelkaufmann / Einzelkauffrau\nLudwigsburg\n\nDen Gläubigern der an der Ausgliederung beteiligten Rechtsträger ist, wenn sie binnen sechs Monaten nach dem Tag, an dem die Eintragung der Ausgliederung in das Register des Sitzes desjenigen Rechtsträgers, dessen Gläubiger sie sind, nach § 19 Abs. 3 UmwG als bekanntgemacht gilt, ihren Anspruch nach Grund und Höhe schriftlich anmelden, Sicherheit zu leisten, soweit sie nicht Befriedigung verlangen können. Dieses Recht steht den Gläubigern jedoch nur zu, wenn sie glaubhaft machen, dass durch die Ausgliederung die Erfüllung ihrer Forderung gefährdet wird."
    },
    {
      "date": "2025-11-27",
      "id": "138463",
      "original_text": "Registerbekanntmachung nach dem Umwandlungsgesetz\nBaden-Württemberg Amtsgericht Stuttgart HRB 801152\nMesstechnik Jakimovski GmbH – Ludwigsburg",
      "type": "Registerbekanntmachung nach dem Umwandlungsgesetz",
      "state": "Baden-Württemberg",
      "amtsgericht": "Amtsgericht Stuttgart",
      "registernummer": "HRB 801152",
      "registerart": "HRB",
      "company_name": "Messtechnik Jakimovski GmbH",
      "company_seat": "Ludwigsburg",
      "details": "27.11.2025 (Bekanntmachungsdatum)\n\nBaden-Württemberg Amtsgericht Stuttgart HRB 801152\nRegisterbekanntmachung nach dem Umwandlungsgesetz 27.11.2025 (Eintragungsdatum)\n\nMesstechnik Jakimovski GmbH\nGesellschaft mit beschränkter Haftung\nLudwigsburg\n\nDen Gläubigern der an der Ausgliederung beteiligten Rechtsträger ist, wenn sie binnen sechs Monaten nach dem Tag, an dem die Eintragung der Ausgliederung in das Register des Sitzes desjenigen Rechtsträgers, dessen Gläubiger sie sind, nach § 19 Abs. 3 UmwG als bekanntgemacht gilt, ihren Anspruch nach Grund und Höhe schriftlich anmelden, Sicherheit zu leisten, soweit sie nicht Befriedigung verlangen können. Dieses Recht steht den Gläubigern jedoch nur zu, wenn sie glaubhaft machen, dass durch die Ausgliederung die Erfüllung ihrer Forderung gefährdet wird."
    },
    {
      "date": "2025-11-27",
      "id": "138464",
      "original_text": "Einreichung neuer Dokumente\nBaden-Württemberg Amtsgericht Stuttgart HRB 104458\nIHK-Zentrum für Weiterbildung GmbH – Heilbronn",
      "type": "Einreichung neuer Dokumente",
      "state": "Baden-Württemberg",
      "amtsgericht": "Amtsgericht Stuttgart",
      "registernummer": "HRB 104458",
      "registerart": "HRB",
      "company_name": "IHK-Zentrum für Weiterbildung GmbH",
      "company_seat": "Heilbronn",
      "details": "27.11.2025 (Bekanntmachungsdatum)\n\nBaden-Württemberg Amtsgericht Stuttgart HRB 104458\nEinreichung neuer Dokumente\n\nIHK-Zentrum für Weiterbildung GmbH\nGesellschaft mit beschränkter Haftung\nHeilbronn\n\nDie Gesellschaft hat am 15.09.2025 die Liste über die Zusammensetzung des Aufsichtsrats zum Handelsregister eingereicht."
    },
    {
      "date": "2025-11-27",
      "id": "138465",
      "original_text": "Löschungsankündigung\nSaarland Amtsgericht Saarbrücken HRB 100083\niform GmbH – Saarbrücken",
      "type": "Löschungsankündigung",
      "state": "Saarland",
      "amtsgericht": "Amtsgericht Saarbrücken",
      "registernummer": "HRB 100083",
      "registerart": "HRB",
      "company_name": "iform GmbH",
      "company_seat": "Saarbrücken",
      "details": "27.11.2025 (Bekanntmachungsdatum)\n\nSaarland Amtsgericht Saarbrücken HRB 100083\nLöschungsankündigung\n\niform GmbH\nGesellschaft mit beschränkter Haftung\nSaarbrücken\n\nEs ist beabsichtigt, die Gesellschaft von Amts wegen gemäß § 394 FamFG wegen Vermögenslosigkeit zu löschen.\nGegen die Löschung von Amts wegen ist das Rechtsmittel des Widerspruchs statthaft. Der Widerspruch ist binnen einer Frist zwei Monaten beginnend mit dem Tag dieser Veröffentlichung durch Einreichen eines Widerspruchsschreibens -schriftlich oder zur Niederschrift der Geschäftsstelle beim Amtsgericht Saarbrücken, -zentrales Handelsregister-, Mainzerstr.178, 66121 Saarbrücken einzulegen.\nDer Widerspruch muss die Bezeichnung der angefochtenen Löschungsankündigung enthalten sowie die Erklärung, dass Widerspruch eingelegt wird. Er ist vom Widerspruchsführer oder seinem Bevollmächtigten zu unterzeichnen.\nDas Widerspruchsschreiben kann auch in der Form eines elektronischen Dokumentes eingereicht werden, das mit einer qualifizierten elektronischen Signatur nach dem Signaturgesetz versehen sein muss (§§ 14 Abs. 2 FamFG, 130a, 298 ZPO)."
    },
    {
      "date": "2025-11-27",
      "id": "138466",
      "original_text": "Registerbekanntmachung nach dem Umwandlungsgesetz\nBaden-Württemberg Amtsgericht Stuttgart HRB 351150\nPaul Musse Elektrotechnik GmbH – Metzingen",
      "type": "Registerbekanntmachung nach dem Umwandlungsgesetz",
      "state": "Baden-Württemberg",
      "amtsgericht": "Amtsgericht Stuttgart",
      "registernummer": "HRB 351150",
      "registerart": "HRB",
      "company_name": "Paul Musse Elektrotechnik GmbH",
      "company_seat": "Metzingen",
      "details": "27.11.2025 (Bekanntmachungsdatum)\n\nBaden-Württemberg Amtsgericht Stuttgart HRB 351150\nRegisterbekanntmachung nach dem Umwandlungsgesetz 27.11.2025 (Eintragungsdatum)\n\nPaul Musse Elektrotechnik GmbH\nGesellschaft mit beschränkter Haftung\nMetzingen\n\nDen Gläubigern der an der Verschmelzung beteiligten Rechtsträger ist, wenn sie binnen sechs Monaten nach dem Tag, an dem die Eintragung der Verschmelzung in das Register des Sitzes desjenigen Rechtsträgers, dessen Gläubiger sie sind, nach § 19 Abs. 3 UmwG als bekanntgemacht gilt, ihren Anspruch nach Grund und Höhe schriftlich anmelden, Sicherheit zu leisten, soweit sie nicht Befriedigung verlangen können. Dieses Recht steht den Gläubigern jedoch nur zu, wenn sie glaubhaft machen, dass durch die Verschmelzung die Erfüllung ihrer Forderung gefährdet wird."
    },
    {
      "date": "2025-11-27",
      "id": "138467",
      "original_text": "Registerbekanntmachung nach dem Umwandlungsgesetz\nSaarland Amtsgericht Saarbrücken GsR 830\nSchauß Verwaltungs eGbR – Saarbrücken",
      "type": "Registerbekanntmachung nach dem Umwandlungsgesetz",
      "state": "Saarland",
      "amtsgericht": "Amtsgericht Saarbrücken",
      "registernummer": "GsR 830",
      "registerart": "GsR",
      "company_name": "Schauß Verwaltungs eGbR",
      "company_seat": "Saarbrücken",
      "details": "27.11.2025 (Bekanntmachungsdatum)\n\nSaarland Amtsgericht Saarbrücken GsR 830\nRegisterbekanntmachung nach dem Umwandlungsgesetz 27.11.2025 (Eintragungsdatum)\n\nSchauß Verwaltungs eGbR\nGesellschaft bürgerlichen Rechts\nSaarbrücken\n\nAls nicht eingetragen wird bekannt gemacht: Den Gläubigern der an der Verschmelzung beteiligten Gesellschaften ist, wenn sie binnen sechs Monaten nach dem Tag, an dem die Eintragung des Formwechsels in das Register des Sitzes desjenigen Rechtsträgers, dessen Gläubiger sie sind, nach § 19 Absatz 3 UmwG bekannt gemacht worden ist, ihren Anspruch nach Grund und Höhe schriftlich anmelden, Sicherheit zu leisten, soweit sie nicht Befriedigung verlangen können. Dieses Recht steht den Gläubigern jedoch nur zu, wenn sie glaubhaft machen, dass durch den Formwechsel  die Erfüllung ihrer Forderung gefährdet wird."
    },
    {
      "date": "2025-11-27",
      "id": "138468",
      "original_text": "Registerbekanntmachung nach dem Umwandlungsgesetz\nSaarland Amtsgericht Saarbrücken HRB 13352\nSchauß Verwaltungs GmbH – Saarbrücken",
      "type": "Registerbekanntmachung nach dem Umwandlungsgesetz",
      "state": "Saarland",
      "amtsgericht": "Amtsgericht Saarbrücken",
      "registernummer": "HRB 13352",
      "registerart": "HRB",
      "company_name": "Schauß Verwaltungs GmbH",
      "company_seat": "Saarbrücken",
      "details": "27.11.2025 (Bekanntmachungsdatum)\n\nSaarland Amtsgericht Saarbrücken HRB 13352\nRegisterbekanntmachung nach dem Umwandlungsgesetz 27.11.2025 (Eintragungsdatum)\n\nSchauß Verwaltungs GmbH\nGesellschaft mit beschränkter Haftung\nSaarbrücken\n\nAls nicht eingetragen wird bekannt gemacht: Den Gläubigern der an der Verschmelzung beteiligten Gesellschaften ist, wenn sie binnen sechs Monaten nach dem Tag, an dem die Eintragung des Formwechsels in das Register des Sitzes desjenigen Rechtsträgers, dessen Gläubiger sie sind, nach § 19 Absatz 3 UmwG bekannt gemacht worden ist, ihren Anspruch nach Grund und Höhe schriftlich anmelden, Sicherheit zu leisten, soweit sie nicht Befriedigung verlangen können. Dieses Recht steht den Gläubigern jedoch nur zu, wenn sie glaubhaft machen, dass durch den Formwechsel  die Erfüllung ihrer Forderung gefährdet wird."
    },
    {
      "date": "2025-11-27",
      "id": "138469",
      "original_text": "Löschungsankündigung\nSachsen Amtsgericht Dresden HRB 40549\nPKJ GmbH – Görlitz",
      "type": "Löschungsankündigung",
      "state": "Sachsen",
      "amtsgericht": "Amtsgericht Dresden",
      "registernummer": "HRB 40549",
      "registerart": "HRB",
      "company_name": "PKJ GmbH",
      "company_seat": "Görlitz",
      "details": "27.11.2025 (Bekanntmachungsdatum)\n\nSachsen Amtsgericht Dresden HRB 40549\nLöschungsankündigung\n\nPKJ GmbH\nGesellschaft mit beschränkter Haftung\nGörlitz\n\nDas Registergericht beabsichtigt, die im Handelsregister eingetragene Gesellschaft von Amts wegen nach § 394 FamFG zu löschen. Die Frist zu Erhebung eines Widerspruchs gegen die beabsichtigte Löschung wird auf einen Monat festgesetzt."
    },
    {
      "date": "2025-11-27",
      "id": "138470",
      "original_text": "Löschungsankündigung\nSachsen Amtsgericht Chemnitz HRB 30050\nAMZ Diezel UG (haftungsbeschränkt) – Werdau",
      "type": "Löschungsankündigung",
      "state": "Sachsen",
      "amtsgericht": "Amtsgericht Chemnitz",
      "registernummer": "HRB 30050",
      "registerart": "HRB",
      "company_name": "AMZ Diezel UG (haftungsbeschränkt)",
      "company_seat": "Werdau",
      "details": "27.11.2025 (Bekanntmachungsdatum)\n\nSachsen Amtsgericht Chemnitz HRB 30050\nLöschungsankündigung 27.11.2025 (Eintragungsdatum)\n\nAMZ Diezel UG (haftungsbeschränkt)\nGesellschaft mit beschränkter Haftung\nWerdau\n\nDas Registergericht beabsichtigt, die im Handelsregister eingetragene Gesellschaft von Amts wegen nach § 394 FamFG zu löschen. Die Frist zu Erhebung eines Widerspruchs gegen die beabsichtigte Löschung wird auf einen Monat festgesetzt."
    },
    {
      "date": "2025-11-27",
      "id": "138471",
      "original_text": "Registerbekanntmachung nach dem Umwandlungsgesetz\nNiedersachsen Amtsgericht Oldenburg (Oldenburg) HRB 219669\nRB Bau GmbH – Steinfeld (Oldb)",
      "type": "Registerbekanntmachung nach dem Umwandlungsgesetz",
      "state": "Niedersachsen",
      "amtsgericht": "Amtsgericht Oldenburg (Oldenburg)",
      "registernummer": "HRB 219669",
      "registerart": "HRB",
      "company_name": "RB Bau GmbH",
      "company_seat": "Steinfeld (Oldb)",
      "details": "27.11.2025 (Bekanntmachungsdatum)\n\nNiedersachsen Amtsgericht Oldenburg (Oldenburg) HRB 219669\nRegisterbekanntmachung nach dem Umwandlungsgesetz 27.11.2025 (Eintragungsdatum)\n\nRB Bau GmbH\nGesellschaft mit beschränkter Haftung\nSteinfeld (Oldb)\n\nDen Gläubigern der an der Verschmelzung beteiligten Rechtsträger ist, wenn sie binnen sechs Monaten nach dem Tag, an dem die Eintragung der Verschmelzung in das Register des Sitzes desjenigen Rechtsträgers, dessen Gläubiger sie sind, nach § 19  Abs.  3 UmwG als bekannt gemacht gilt, ihren Anspruch nach Grund und Höhe schriftlich anmelden, Sicherheit zu leisten, soweit sie nicht Befriedigung verlangen können. Dieses Recht steht den Gläubigern jedoch nur zu, wenn sie glaubhaft machen, dass durch die Verschmelzung die Erfüllung der Forderung gefährdet wird."
    },
    {
      "date": "2025-11-27",
      "id": "138472",
      "original_text": "Registerbekanntmachung nach dem Umwandlungsgesetz\nNiedersachsen Amtsgericht Oldenburg (Oldenburg) HRB 213390\nRB Projektbau GmbH – Steinfeld",
      "type": "Registerbekanntmachung nach dem Umwandlungsgesetz",
      "state": "Niedersachsen",
      "amtsgericht": "Amtsgericht Oldenburg (Oldenburg)",
      "registernummer": "HRB 213390",
      "registerart": "HRB",
      "company_name": "RB Projektbau GmbH",
      "company_seat": "Steinfeld",
      "details": "27.11.2025 (Bekanntmachungsdatum)\n\nNiedersachsen Amtsgericht Oldenburg (Oldenburg) HRB 213390\nRegisterbekanntmachung nach dem Umwandlungsgesetz 27.11.2025 (Eintragungsdatum)\n\nRB Projektbau GmbH\nGesellschaft mit beschränkter Haftung\nSteinfeld\n\nDen Gläubigern der an der Verschmelzung beteiligten Rechtsträger ist, wenn sie binnen sechs Monaten nach dem Tag, an dem die Eintragung der Verschmelzung in das Register des Sitzes desjenigen Rechtsträgers, dessen Gläubiger sie sind, nach § 19  Abs.  3 UmwG als bekannt gemacht gilt, ihren Anspruch nach Grund und Höhe schriftlich anmelden, Sicherheit zu leisten, soweit sie nicht Befriedigung verlangen können. Dieses Recht steht den Gläubigern jedoch nur zu, wenn sie glaubhaft machen, dass durch die Verschmelzung die Erfüllung der Forderung gefährdet wird."
    },
    {
      "date": "2025-11-27",
      "id": "138473",
      "original_text": "Löschungsankündigung\nNiedersachsen Amtsgericht Osnabrück HRA 130565 früher Amtsgericht Nordhorn\nGBS e.K. Global Business Service – Bad Bentheim",
      "type": "Löschungsankündigung",
      "state": "Niedersachsen",
      "amtsgericht": "Amtsgericht Osnabrück",
      "registernummer": "HRA 130565",
      "registerart": "HRA",
      "company_name": "GBS e.K. Global Business Service",
      "company_seat": "Bad Bentheim",
      "former_amtsgericht": "Nordhorn",
      "details": "27.11.2025 (Bekanntmachungsdatum)\n\nNiedersachsen Amtsgericht Osnabrück HRA 130565 früher Amtsgericht Nordhorn\nLöschungsankündigung\n\nGBS e.K. Global Business Service\nEinzelkaufmann / Einzelkauffrau\nBad Bentheim\n\nDas Registergericht beabsichtigt, die Firma von Amts wegen nach § 31 Abs. 2 Satz 2 HGB, § 393 FamFG zu löschen. Die Frist zur Erhebung eines Widerspruchs ist auf 1 Monat ab dieser Registerbekanntmachung festgesetzt."
    },
    {
      "date": "2025-11-27",
      "id": "138474",
      "original_text": "Registerbekanntmachung nach dem Umwandlungsgesetz\nNiedersachsen Amtsgericht Oldenburg (Oldenburg) HRA 110490 früher Amtsgericht Vechta\nHAGOLA Gastronomie-Technik GmbH & Co. KG – Goldenstedt",
      "type": "Registerbekanntmachung nach dem Umwandlungsgesetz",
      "state": "Niedersachsen",
      "amtsgericht": "Amtsgericht Oldenburg (Oldenburg)",
      "registernummer": "HRA 110490",
      "registerart": "HRA",
      "company_name": "HAGOLA Gastronomie-Technik GmbH & Co. KG",
      "company_seat": "Goldenstedt",
      "former_amtsgericht": "Vechta",
      "details": "27.11.2025 (Bekanntmachungsdatum)\n\nNiedersachsen Amtsgericht Oldenburg (Oldenburg) HRA 110490 früher Amtsgericht Vechta\nRegisterbekanntmachung nach dem Umwandlungsgesetz 27.11.2025 (Eintragungsdatum)\n\nHAGOLA Gastronomie-Technik GmbH & Co. KG\nKommanditgesellschaft\nGoldenstedt\n\nDen Gläubigern der an der Verschmelzung beteiligten Rechtsträger ist, wenn sie binnen sechs Monaten nach dem Tag, an dem die Eintragung der Verschmelzung in das Register des Sitzes desjenigen Rechtsträgers, dessen Gläubiger sie sind, nach § 19  Abs.  3 UmwG als bekannt gemacht gilt, ihren Anspruch nach Grund und Höhe schriftlich anmelden, Sicherheit zu leisten, soweit sie nicht Befriedigung verlangen können. Dieses Recht steht den Gläubigern jedoch nur zu, wenn sie glaubhaft machen, dass durch die Verschmelzung die Erfüllung der Forderung gefährdet wird."
    },
    {
      "date": "2025-11-27",
      "id": "138475",
      "original_text": "Einreichung neuer Dokumente\nNiedersachsen Amtsgericht Osnabrück HRB 18943\nLM IT-Services Aktiengesellschaft – Osnabrück",
      "type": "Einreichung neuer Dokumente",
      "state": "Niedersachsen",
      "amtsgericht": "Amtsgericht Osnabrück",
      "registernummer": "HRB 18943",
      "registerart": "HRB",
      "company_name": "LM IT-Services Aktiengesellschaft",
      "company_seat": "Osnabrück",
      "details": "27.11.2025 (Bekanntmachungsdatum)\n\nNiedersachsen Amtsgericht Osnabrück HRB 18943\nEinreichung neuer Dokumente 28.10.2025 (Eintragungsdatum)\n\nLM IT-Services Aktiengesellschaft\nAktiengesellschaft\nOsnabrück\n\nDie Liste der Mitglieder des Aufsichtsrats wurde beim Registergericht eingereicht."
    },
    {
      "date": "2025-11-27",
      "id": "138476",
      "original_text": "Einreichung neuer Dokumente\nNiedersachsen Amtsgericht Braunschweig HRB 10019\nBraunschweiger Versorgungs-Verwaltungs-Aktiengesellschaft – Braunschweig",
      "type": "Einreichung neuer Dokumente",
      "state": "Niedersachsen",
      "amtsgericht": "Amtsgericht Braunschweig",
      "registernummer": "HRB 10019",
      "registerart": "HRB",
      "company_name": "Braunschweiger Versorgungs-Verwaltungs-Aktiengesellschaft",
      "company_seat": "Braunschweig",
      "details": "27.11.2025 (Bekanntmachungsdatum)\n\nNiedersachsen Amtsgericht Braunschweig HRB 10019\nEinreichung neuer Dokumente 27.11.2025 (Eintragungsdatum)\n\nBraunschweiger Versorgungs-Verwaltungs-Aktiengesellschaft\nAktiengesellschaft\nBraunschweig\n\nDie Liste der Mitglieder des Aufsichtsrats wurde beim Registergericht eingereicht."
    },
    {
      "date": "2025-11-27",
      "id": "138477",
      "original_text": "Löschungsankündigung\nNiedersachsen Amtsgericht Tostedt HRB 202971\nARA GmbH – Stade",
      "type": "Löschungsankündigung",
      "state": "Niedersachsen",
      "amtsgericht": "Amtsgericht Tostedt",
      "registernummer": "HRB 202971",
      "registerart": "HRB",
      "company_name": "ARA GmbH",
      "company_seat": "Stade",
      "details": "27.11.2025 (Bekanntmachungsdatum)\n\nNiedersachsen Amtsgericht Tostedt HRB 202971\nLöschungsankündigung\n\nARA GmbH\nGesellschaft mit beschränkter Haftung\nStade\n\nDas Registergericht beabsichtigt, die Gesellschaft von Amts wegen nach § 394 FamFG zu löschen. Die Frist zur Erhebung eines Widerspruchs ist auf 1 Monat ab dieser Registerbekanntmachung festgesetzt."
    },
    {
      "date": "2025-11-27",
      "id": "138478",
      "original_text": "Löschungsankündigung\nNiedersachsen Amtsgericht Osnabrück HRA 203721\nSource GmbH & Co. KG – Nordhorn",
      "type": "Löschungsankündigung",
      "state": "Niedersachsen",
      "amtsgericht": "Amtsgericht Osnabrück",
      "registernummer": "HRA 203721",
      "registerart": "HRA",
      "company_name": "Source GmbH & Co. KG",
      "company_seat": "Nordhorn",
      "details": "27.11.2025 (Bekanntmachungsdatum)\n\nNiedersachsen Amtsgericht Osnabrück HRA 203721\nLöschungsankündigung\n\nSource GmbH & Co. KG\nKommanditgesellschaft\nNordhorn\n\nDas Registergericht beabsichtigt, die Firma von Amts wegen nach § 394 FamFG wegen Vermögenslosigkeit zu löschen. Die Frist zur Erhebung eines Widerspruchs ist auf 1 Monat ab dieser Registerbekanntmachung festgesetzt."
    },
    {
      "date": "2025-11-27",
      "id": "138479",
      "original_text": "Löschungsankündigung\nNiedersachsen Amtsgericht Osnabrück HRB 209561\nCarillon Freizeitpark Schüttorf GmbH – Bad Bentheim",
      "type": "Löschungsankündigung",
      "state": "Niedersachsen",
      "amtsgericht": "Amtsgericht Osnabrück",
      "registernummer": "HRB 209561",
      "registerart": "HRB",
      "company_name": "Carillon Freizeitpark Schüttorf GmbH",
      "company_seat": "Bad Bentheim",
      "details": "27.11.2025 (Bekanntmachungsdatum)\n\nNiedersachsen Amtsgericht Osnabrück HRB 209561\nLöschungsankündigung\n\nCarillon Freizeitpark Schüttorf GmbH\nGesellschaft mit beschränkter Haftung\nBad Bentheim\n\nDas Registergericht beabsichtigt, die eingetragene Löschung der Gesellschaft (gemäß § 394 FamFG wegen Vermögenslosigkeit) von Amts wegen nach § 395 FamFG zu löschen. Die Frist zur Erhebung eines Widerspruchs ist auf 1 Monat ab dieser Registerbekanntmachung festgesetzt."
    },
    {
      "date": "2025-11-27",
      "id": "138480",
      "original_text": "Registerbekanntmachung nach dem Umwandlungsgesetz\nNiedersachsen Amtsgericht Walsrode HRB 212830\nBAP Nds GmbH – Verden",
      "type": "Registerbekanntmachung nach dem Umwandlungsgesetz",
      "state": "Niedersachsen",
      "amtsgericht": "Amtsgericht Walsrode",
      "registernummer": "HRB 212830",
      "registerart": "HRB",
      "company_name": "BAP Nds GmbH",
      "company_seat": "Verden",
      "details": "27.11.2025 (Bekanntmachungsdatum)\n\nNiedersachsen Amtsgericht Walsrode HRB 212830\nRegisterbekanntmachung nach dem Umwandlungsgesetz 27.11.2025 (Eintragungsdatum)\n\nBAP Nds GmbH\nGesellschaft mit beschränkter Haftung\nVerden\n\nDen Gläubigern der an der Abspaltung beteiligten Rechtsträger ist, wenn sie binnen sechs Monaten nach dem Tag, an dem die Eintragung der Abspaltung in das Register des Sitzes desjenigen Rechtsträgers, dessen Gläubiger sie sind, nach § 19 Abs. 3 UmwG als bekannt gemacht gilt, ihren Anspruch nach Grund und Höhe schriftlich anmelden, Sicherheit zu leisten, soweit sie nicht Befriedigung verlangen können. Dieses Recht steht den Gläubigern jedoch nur zu, wenn sie glaubhaft machen, dass durch die Abspaltung die Erfüllung der Forderung gefährdet wird."
    },
    {
      "date": "2025-11-27",
      "id": "138481",
      "original_text": "Registerbekanntmachung nach dem Umwandlungsgesetz\nNiedersachsen Amtsgericht Walsrode HRB 205253\nBestattungsinstitut Brückmann GmbH – Rotenburg (Wümme)",
      "type": "Registerbekanntmachung nach dem Umwandlungsgesetz",
      "state": "Niedersachsen",
      "amtsgericht": "Amtsgericht Walsrode",
      "registernummer": "HRB 205253",
      "registerart": "HRB",
      "company_name": "Bestattungsinstitut Brückmann GmbH",
      "company_seat": "Rotenburg (Wümme)",
      "details": "27.11.2025 (Bekanntmachungsdatum)\n\nNiedersachsen Amtsgericht Walsrode HRB 205253\nRegisterbekanntmachung nach dem Umwandlungsgesetz 27.11.2025 (Eintragungsdatum)\n\nBestattungsinstitut Brückmann GmbH\nGesellschaft mit beschränkter Haftung\nRotenburg (Wümme)\n\nDen Gläubigern der an der Verschmelzung beteiligten Rechtsträger ist, wenn sie binnen sechs Monaten nach dem Tag, an dem die Eintragung der Verschmelzung in das Register des Sitzes desjenigen Rechtsträgers, dessen Gläubiger sie sind, nach § 19  Abs.  3 UmwG als bekannt gemacht gilt, ihren Anspruch nach Grund und Höhe schriftlich anmelden, Sicherheit zu leisten, soweit sie nicht Befriedigung verlangen können. Dieses Recht steht den Gläubigern jedoch nur zu, wenn sie glaubhaft machen, dass durch die Verschmelzung die Erfüllung der Forderung gefährdet wird."
    },
    {
      "date": "2025-11-27",
      "id": "138482",
      "original_text": "Löschungsankündigung\nNiedersachsen Amtsgericht Oldenburg (Oldenburg) HRB 208266\nBaufriese GmbH – Wilhelmshaven",
      "type": "Löschungsankündigung",
      "state": "Niedersachsen",
      "amtsgericht": "Amtsgericht Oldenburg (Oldenburg)",
      "registernummer": "HRB 208266",
      "registerart": "HRB",
      "company_name": "Baufriese GmbH",
      "company_seat": "Wilhelmshaven",
      "details": "27.11.2025 (Bekanntmachungsdatum)\n\nNiedersachsen Amtsgericht Oldenburg (Oldenburg) HRB 208266\nLöschungsankündigung\n\nBaufriese GmbH\nGesellschaft mit beschränkter Haftung\nWilhelmshaven\n\nDas Registergericht beabsichtigt, die Gesellschaft von Amts wegen nach § 394 FamFG zu löschen. Die Frist zur Erhebung eines Widerspruchs ist auf 1 Monat ab dieser Registerbekanntmachung festgesetzt."
    },
    {
      "date": "2025-11-27",
      "id": "138483",
      "original_text": "Registerbekanntmachung nach dem Umwandlungsgesetz\nNiedersachsen Amtsgericht Göttingen HRB 208018\nInstitut für Zuckerrübenforschung gGmbH – Göttingen",
      "type": "Registerbekanntmachung nach dem Umwandlungsgesetz",
      "state": "Niedersachsen",
      "amtsgericht": "Amtsgericht Göttingen",
      "registernummer": "HRB 208018",
      "registerart": "HRB",
      "company_name": "Institut für Zuckerrübenforschung gGmbH",
      "company_seat": "Göttingen",
      "details": "27.11.2025 (Bekanntmachungsdatum)\n\nNiedersachsen Amtsgericht Göttingen HRB 208018\nRegisterbekanntmachung nach dem Umwandlungsgesetz 27.11.2025 (Eintragungsdatum)\n\nInstitut für Zuckerrübenforschung gGmbH\nGesellschaft mit beschränkter Haftung\nGöttingen\n\nDen Gläubigern der an der Ausgliederung beteiligten Rechtsträger ist, wenn sie binnen sechs Monaten nach dem Tag, an dem die Eintragung der Ausgliederung in das Register des Sitzes desjenigen Rechtsträgers, dessen Gläubiger sie sind, nach § 19 Abs. 3 UmwG als bekannt gemacht gilt, ihren Anspruch nach Grund und Höhe schriftlich anmelden, Sicherheit zu leisten, soweit sie nicht Befriedigung verlangen können. Dieses Recht steht den Gläubigern jedoch nur zu, wenn sie glaubhaft machen, dass durch die Ausgliederung die Erfüllung der Forderung gefährdet wird."
    },
    {
      "date": "2025-11-27",
      "id": "138484",
      "original_text": "Löschungsankündigung\nNiedersachsen Amtsgericht Hannover HRB 225664\nMonolith Bauservice GmbH – Langenhagen",
      "type": "Löschungsankündigung",
      "state": "Niedersachsen",
      "amtsgericht": "Amtsgericht Hannover",
      "registernummer": "HRB 225664",
      "registerart": "HRB",
      "company_name": "Monolith Bauservice GmbH",
      "company_seat": "Langenhagen",
      "details": "27.11.2025 (Bekanntmachungsdatum)\n\nNiedersachsen Amtsgericht Hannover HRB 225664\nLöschungsankündigung\n\nMonolith Bauservice GmbH\nGesellschaft mit beschränkter Haftung\nLangenhagen\n\nDas Registergericht beabsichtigt, die Gesellschaft von Amts wegen nach § 394 FamFG zu löschen. Die Frist zur Erhebung eines Widerspruchs ist auf 1 Monat ab dieser Registerbekanntmachung festgesetzt."
    },
    {
      "date": "2025-11-27",
      "id": "138485",
      "original_text": "Löschungsankündigung\nRheinland-Pfalz Amtsgericht Ludwigshafen a.Rhein (Ludwigshafen) HRB 68142\nIG Trockenbau und Reinigung UG (haftungsbeschränkt) – Ludwigshafen am Rhein",
      "type": "Löschungsankündigung",
      "state": "Rheinland-Pfalz",
      "amtsgericht": "Amtsgericht Ludwigshafen a.Rhein (Ludwigshafen)",
      "registernummer": "HRB 68142",
      "registerart": "HRB",
      "company_name": "IG Trockenbau und Reinigung UG (haftungsbeschränkt)",
      "company_seat": "Ludwigshafen am Rhein",
      "details": "27.11.2025 (Bekanntmachungsdatum)\n\nRheinland-Pfalz Amtsgericht Ludwigshafen a.Rhein (Ludwigshafen) HRB 68142\nLöschungsankündigung\n\nIG Trockenbau und Reinigung UG (haftungsbeschränkt)\nGesellschaft mit beschränkter Haftung\nLudwigshafen am Rhein\n\nDas Registergericht beabsichtigt die Gesellschaft von Amts wegen nach § 394 FamFG zu löschen. Die Frist zur Erhebung eines Widerspruchs ist auf einen Monat festgesetzt."
    },
    {
      "date": "2025-11-27",
      "id": "138486",
      "original_text": "Registerbekanntmachung nach dem Umwandlungsgesetz\nRheinland-Pfalz Amtsgericht Koblenz HRB 31263\nSchramm Computer GmbH – Polch",
      "type": "Registerbekanntmachung nach dem Umwandlungsgesetz",
      "state": "Rheinland-Pfalz",
      "amtsgericht": "Amtsgericht Koblenz",
      "registernummer": "HRB 31263",
      "registerart": "HRB",
      "company_name": "Schramm Computer GmbH",
      "company_seat": "Polch",
      "details": "27.11.2025 (Bekanntmachungsdatum)\n\nRheinland-Pfalz Amtsgericht Koblenz HRB 31263\nRegisterbekanntmachung nach dem Umwandlungsgesetz 27.11.2025 (Eintragungsdatum)\n\nSchramm Computer GmbH\nGesellschaft mit beschränkter Haftung\nPolch\n\nAls nicht eingetragen wird veröffentlicht: Den Gläubigern der an der Ausgliederung beteiligten Rechtsträger ist, wenn sie binnen sechs Monaten nach dem Tag, an dem die Eintragung der Ausgliederung in das Register des Sitzes desjenigen Rechtsträgers, dessen Gläubiger sie sind, nach § 19 Abs. 3 UmwG als bekannt gemacht gilt, ihren Anspruch nach Grund und Höhe schriftlich anmelden, Sicherheit zu leisten, soweit sie nicht Befriedigung verlangen können. Dieses Recht steht den Gläubigern jedoch nur zu, wenn sie glaubhaft machen, dass durch die Ausgliederung die Erfüllung der Forderung gefährdet wird."
    },
    {
      "date": "2025-11-27",
      "id": "138487",
      "original_text": "Registerbekanntmachung nach dem Umwandlungsgesetz\nRheinland-Pfalz Amtsgericht Montabaur HRB 29263\nMBR Holding GmbH – Rengsdorf",
      "type": "Registerbekanntmachung nach dem Umwandlungsgesetz",
      "state": "Rheinland-Pfalz",
      "amtsgericht": "Amtsgericht Montabaur",
      "registernummer": "HRB 29263",
      "registerart": "HRB",
      "company_name": "MBR Holding GmbH",
      "company_seat": "Rengsdorf",
      "details": "27.11.2025 (Bekanntmachungsdatum)\n\nRheinland-Pfalz Amtsgericht Montabaur HRB 29263\nRegisterbekanntmachung nach dem Umwandlungsgesetz 27.11.2025 (Eintragungsdatum)\n\nMBR Holding GmbH\nGesellschaft mit beschränkter Haftung\nRengsdorf\n\nAls nicht eingetragen wird veröffentlicht: Den Gläubigern der an der Verschmelzung beteiligten Rechtsträger ist, wenn sie binnen sechs Monaten nach dem Tag, an dem die Eintragung der Verschmelzung in das Register des Sitzes desjenigen Rechtsträgers,dessen Gläubiger sie sind, nach § 19 Abs. 3 UmwG als bekannt gemacht gilt, ihren Anspruch nach Grund und Höhe schriftlich anmelden, Sicherheit zu leisten, soweit sie nicht Befriedigung verlangen können. Dieses Recht steht den Gläubigern jedoch nur zu, wenn sie glaubhaft machen, dass durch die Verschmelzung die Erfüllung der Forderung gefährdet wird."
    },
    {
      "date": "2025-11-27",
      "id": "138488",
      "original_text": "Registerbekanntmachung nach dem Umwandlungsgesetz\nRheinland-Pfalz Amtsgericht Koblenz HRB 14080\nRobert Ollig GmbH – Kollig",
      "type": "Registerbekanntmachung nach dem Umwandlungsgesetz",
      "state": "Rheinland-Pfalz",
      "amtsgericht": "Amtsgericht Koblenz",
      "registernummer": "HRB 14080",
      "registerart": "HRB",
      "company_name": "Robert Ollig GmbH",
      "company_seat": "Kollig",
      "details": "27.11.2025 (Bekanntmachungsdatum)\n\nRheinland-Pfalz Amtsgericht Koblenz HRB 14080\nRegisterbekanntmachung nach dem Umwandlungsgesetz 27.11.2025 (Eintragungsdatum)\n\nRobert Ollig GmbH\nGesellschaft mit beschränkter Haftung\nKollig\n\nAls nicht eingetragen wird veröffentlicht: Den Gläubigern der an der Verschmelzung beteiligten Rechtsträger ist, wenn sie binnen sechs Monaten nach dem Tag, an dem die Eintragung der Verschmelzung in das Register des Sitzes desjenigen Rechtsträgers,dessen Gläubiger sie sind, nach § 19 Abs. 3 UmwG als bekannt gemacht gilt, ihren Anspruch nach Grund und Höhe schriftlich anmelden, Sicherheit zu leisten, soweit sie nicht Befriedigung verlangen können. Dieses Recht steht den Gläubigern jedoch nur zu, wenn sie glaubhaft machen, dass durch die Verschmelzung die Erfüllungd er Forderung gefährdet wird."
    },
    {
      "date": "2025-11-27",
      "id": "138489",
      "original_text": "Registerbekanntmachung nach dem Umwandlungsgesetz\nRheinland-Pfalz Amtsgericht Koblenz HRA 23334\nCarsten Schramm e.K. – Polch",
      "type": "Registerbekanntmachung nach dem Umwandlungsgesetz",
      "state": "Rheinland-Pfalz",
      "amtsgericht": "Amtsgericht Koblenz",
      "registernummer": "HRA 23334",
      "registerart": "HRA",
      "company_name": "Carsten Schramm e.K.",
      "company_seat": "Polch",
      "details": "27.11.2025 (Bekanntmachungsdatum)\n\nRheinland-Pfalz Amtsgericht Koblenz HRA 23334\nRegisterbekanntmachung nach dem Umwandlungsgesetz 27.11.2025 (Eintragungsdatum)\n\nCarsten Schramm e.K.\nEinzelkaufmann / Einzelkauffrau\nPolch\n\nAls nicht eingetragen wird veröffentlicht: Den Gläubigern der an der Ausgliederung beteiligten Rechtsträger ist, wenn sie binnen sechs Monaten nac hdem Tag, an dem die Eintragung der Ausgliederung in das Register des Sitzes desjenigen Rechtsträgers,dessen Gläubiger sie sind, nach § 19 Abs. 3 UmwG als bekannt gemacht gilt, ihren Anspruch nach Grund und Höhe schriftlich anmelden, Sicherheit zu leisten, soweit sie nicht Befriedigung verlangen können. Dieses Recht steht den Gläubigern jedoch nur zu, wenn sie glaubhaft machen, dass durch die Ausgliederung die Erfüllung der Forderung gefährdet wird."
    },
    {
      "date": "2025-11-27",
      "id": "138490",
      "original_text": "Registerbekanntmachung nach dem Umwandlungsgesetz\nRheinland-Pfalz Amtsgericht Landau HRB 32024\nCity-Mobil Landau GmbH – Landau in der Pfalz",
      "type": "Registerbekanntmachung nach dem Umwandlungsgesetz",
      "state": "Rheinland-Pfalz",
      "amtsgericht": "Amtsgericht Landau",
      "registernummer": "HRB 32024",
      "registerart": "HRB",
      "company_name": "City-Mobil Landau GmbH",
      "company_seat": "Landau in der Pfalz",
      "details": "27.11.2025 (Bekanntmachungsdatum)\n\nRheinland-Pfalz Amtsgericht Landau HRB 32024\nRegisterbekanntmachung nach dem Umwandlungsgesetz 27.11.2025 (Eintragungsdatum)\n\nCity-Mobil Landau GmbH\nGesellschaft mit beschränkter Haftung\nLandau in der Pfalz\n\nAls nicht eingetragen wird veröffentlicht: Den Gläubigern der an der Verschmelzung beteiligten Rechtsträger ist, wenn sie binnen sechs Monaten nach dem Tag, an dem die Eintragung der Verschmelzung in das Register des Sitzes desjenigen Rechtsträgers,vdessen Gläubiger sie sind, nach § 19 Abs. 3 UmwG als bekannt gemacht gilt, ihren Anspruch nach Grund und Höhe schriftlich anmelden, Sicherheit zu leisten, soweit sie nicht Befriedigung verlangen können. Dieses Recht steht den Gläubigern jedoch nur zu, wenn sie glaubhaft machen, dass durch die Verschmelzung die Erfüllung der Forderung gefährdet wird."
    },
    {
      "date": "2025-11-27",
      "id": "138491",
      "original_text": "Registerbekanntmachung nach dem Umwandlungsgesetz\nRheinland-Pfalz Amtsgericht Landau HRB 34064\nTaxi-Blitz GmbH – Landau in der Pfalz",
      "type": "Registerbekanntmachung nach dem Umwandlungsgesetz",
      "state": "Rheinland-Pfalz",
      "amtsgericht": "Amtsgericht Landau",
      "registernummer": "HRB 34064",
      "registerart": "HRB",
      "company_name": "Taxi-Blitz GmbH",
      "company_seat": "Landau in der Pfalz",
      "details": "27.11.2025 (Bekanntmachungsdatum)\n\nRheinland-Pfalz Amtsgericht Landau HRB 34064\nRegisterbekanntmachung nach dem Umwandlungsgesetz 27.11.2025 (Eintragungsdatum)\n\nTaxi-Blitz GmbH\nGesellschaft mit beschränkter Haftung\nLandau in der Pfalz\n\nAls nicht eingetragen wird veröffentlicht: Den Gläubigern der an der Verschmelzung beteiligten Rechtsträger ist, wenn sie binnen sechs Monaten nach dem Tag, an dem die Eintragung der Verschmelzung in das Register des Sitzes desjenigen Rechtsträgers, dessen Gläubiger sie sind, nach § 19 Abs. 3 UmwG als bekannt gemacht gilt, ihren Anspruch nach Grund und Höhe schriftlich anmelden, Sicherheit zu leisten, soweit sie nicht Befriedigung verlangen können. Dieses Recht steht den Gläubigern jedoch nur zu, wenn sie glaubhaft machen, dass durch die Verschmelzung die Erfüllung der Forderung gefährdet wird."
    },
    {
      "date": "2025-11-27",
      "id": "138492",
      "original_text": "Registerbekanntmachung nach dem Umwandlungsgesetz\nRheinland-Pfalz Amtsgericht Mainz HRB 51046\nXlife Sciences GmbH – Mainz",
      "type": "Registerbekanntmachung nach dem Umwandlungsgesetz",
      "state": "Rheinland-Pfalz",
      "amtsgericht": "Amtsgericht Mainz",
      "registernummer": "HRB 51046",
      "registerart": "HRB",
      "company_name": "Xlife Sciences GmbH",
      "company_seat": "Mainz",
      "details": "27.11.2025 (Bekanntmachungsdatum)\n\nRheinland-Pfalz Amtsgericht Mainz HRB 51046\nRegisterbekanntmachung nach dem Umwandlungsgesetz 27.11.2025 (Eintragungsdatum)\n\nXlife Sciences GmbH\nGesellschaft mit beschränkter Haftung\nMainz\n\nAls nicht eingetragen wird veröffentlicht:\nDen Gläubigern der an der Verschmelzung beteiligten Rechtsträger ist, wenn sie binnen sechs Monaten nach dem Tag, an dem die Eintragung der Verschmelzung in das Register des Sitzes desjenigen Rechtsträgers, dessen Gläubiger sie sind, nach § 19 Abs. 3 UmwG als bekannt gemacht gilt, ihren Anspruch nach Grund und Höhe schriftlich anmelden, Sicherheit zu leisten, soweit sie nicht Befriedigung verlangen können. Dieses Recht steht den Gläubigern jedoch nur zu, wenn sie glaubhaft machen, dass durch die Verschmelzung die Erfüllung der Forderung gefährdet wird."
    },
    {
      "date": "2025-11-27",
      "id": "138493",
      "original_text": "Registerbekanntmachung nach dem Umwandlungsgesetz\nRheinland-Pfalz Amtsgericht Montabaur HRB 24301\nRR Verwaltungs GmbH – Rengsdorf",
      "type": "Registerbekanntmachung nach dem Umwandlungsgesetz",
      "state": "Rheinland-Pfalz",
      "amtsgericht": "Amtsgericht Montabaur",
      "registernummer": "HRB 24301",
      "registerart": "HRB",
      "company_name": "RR Verwaltungs GmbH",
      "company_seat": "Rengsdorf",
      "details": "27.11.2025 (Bekanntmachungsdatum)\n\nRheinland-Pfalz Amtsgericht Montabaur HRB 24301\nRegisterbekanntmachung nach dem Umwandlungsgesetz 27.11.2025 (Eintragungsdatum)\n\nRR Verwaltungs GmbH\nGesellschaft mit beschränkter Haftung\nRengsdorf\n\nAls nicht eingetragen wird veröffentlicht: Den Gläubigern der an der Verschmelzung beteiligten Rechtsträger ist, wenn sie binnen sechs Monaten nach dem Tag, an dem die Eintragung der Verschmelzung in das Register des Sitzes desjenigen Rechtsträgers, dessen Gläubiger sie sind, nach § 19 Abs. 3 UmwG als bekannt gemacht gilt, ihren Anspruch nach Grund und Höhe schriftlich anmelden, Sicherheit zu leisten, soweit sie nicht Befriedigung verlangen können. Dieses Recht steht den Gläubigern jedoch nur zu, wenn sie glaubhaft machen, dass durch die Verschmelzung die Erfüllung der Forderung gefährdet wird."
    },
    {
      "date": "2025-11-27",
      "id": "138494",
      "original_text": "Löschungsankündigung\nBremen Amtsgericht Bremen HRB 34684\nPrivate Pflege Eichenhof GmbH – Bremen",
      "type": "Löschungsankündigung",
      "state": "Bremen",
      "amtsgericht": "Amtsgericht Bremen",
      "registernummer": "HRB 34684",
      "registerart": "HRB",
      "company_name": "Private Pflege Eichenhof GmbH",
      "company_seat": "Bremen",
      "details": "27.11.2025 (Bekanntmachungsdatum)\n\nBremen Amtsgericht Bremen HRB 34684\nLöschungsankündigung\n\nPrivate Pflege Eichenhof GmbH\nGesellschaft mit beschränkter Haftung\nBremen\n\nEs ist beabsichtigt die im Handelsregister eingetragene Gesellschaft von Amts wegen gemäß § 394 FamFG zu löschen. Gegen die Löschung kann beim AG Bremen schriftlich oder zu Protokoll der Geschäftsstelle Widerspruch eingelegt werden. Widerspruchsfrist 4 Wochen."
    },
    {
      "date": "2025-11-27",
      "id": "138495",
      "original_text": "Löschungsankündigung\nBremen Amtsgericht Bremen HRB 35008\nK.T.P. Simply Fruit GmbH – Bremen",
      "type": "Löschungsankündigung",
      "state": "Bremen",
      "amtsgericht": "Amtsgericht Bremen",
      "registernummer": "HRB 35008",
      "registerart": "HRB",
      "company_name": "K.T.P. Simply Fruit GmbH",
      "company_seat": "Bremen",
      "details": "27.11.2025 (Bekanntmachungsdatum)\n\nBremen Amtsgericht Bremen HRB 35008\nLöschungsankündigung\n\nK.T.P. Simply Fruit GmbH\nGesellschaft mit beschränkter Haftung\nBremen\n\nEs ist beabsichtigt die im Handelsregister eingetragene Gesellschaft von Amts wegen gemäß § 394 FamFG zu löschen. Gegen die Löschung kann beim AG Bremen schriftlich oder zu Protokoll der Geschäftsstelle Widerspruch eingelegt werden. Widerspruchsfrist 4 Wochen."
    },
    {
      "date": "2025-11-27",
      "id": "138496",
      "original_text": "Löschungsankündigung\nBremen Amtsgericht Bremen HRB 33630\nOHZ Warenhandelsgesellschaft mbH – Bremen",
      "type": "Löschungsankündigung",
      "state": "Bremen",
      "amtsgericht": "Amtsgericht Bremen",
      "registernummer": "HRB 33630",
      "registerart": "HRB",
      "company_name": "OHZ Warenhandelsgesellschaft mbH",
      "company_seat": "Bremen",
      "details": "27.11.2025 (Bekanntmachungsdatum)\n\nBremen Amtsgericht Bremen HRB 33630\nLöschungsankündigung\n\nOHZ Warenhandelsgesellschaft mbH\nGesellschaft mit beschränkter Haftung\nBremen\n\nEs ist beabsichtigt die im Handelsregister eingetragene Gesellschaft von Amts wegen gemäß § 394 FamFG zu löschen. Gegen die Löschung kann beim AG Bremen schriftlich oder zu Protokoll der Geschäftsstelle Widerspruch eingelegt werden. Widerspruchsfrist 4 Wochen."
    },
    {
      "date": "2025-11-27",
      "id": "138497",
      "original_text": "Registerbekanntmachung nach dem Umwandlungsgesetz\nBremen Amtsgericht Bremen HRB 33770\nHome - smart in use Gesellschaft mit beschränkter Haftung – Bremen",
      "type": "Registerbekanntmachung nach dem Umwandlungsgesetz",
      "state": "Bremen",
      "amtsgericht": "Amtsgericht Bremen",
      "registernummer": "HRB 33770",
      "registerart": "HRB",
      "company_name": "Home - smart in use Gesellschaft mit beschränkter Haftung",
      "company_seat": "Bremen",
      "details": "27.11.2025 (Bekanntmachungsdatum)\n\nBremen Amtsgericht Bremen HRB 33770\nRegisterbekanntmachung nach dem Umwandlungsgesetz 26.11.2025 (Eintragungsdatum)\n\nHome - smart in use Gesellschaft mit beschränkter Haftung\nGesellschaft mit beschränkter Haftung\nBremen\n\nZu Eintragungsnummer 3 vom 26.11.2025 wird als nicht eingetragen veröffentlicht: Den Gläubigern der an der Verschmelzung beteiligten Rechtsträger ist, wenn sie binnen sechs Monaten nach dem Tag, an dem die Eintragung der Verschmelzung in das Register des Sitzes desjenigen Rechtsträgers, dessen Gläubiger sie sind, als bekannt gemacht gilt, ihren Anspruch nach Grund und Höhe schriftlich anmelden, Sicherheit zu leisten, soweit sie nicht Befriedigung verlangen können. Dieses Recht steht den Gläubigern jedoch nur zu, wenn sie glaubhaft machen, dass durch die Verschmelzung die Erfüllung ihrer Forderung gefährdet wird. Das Recht, Sicherheitsleistung zu verlangen, steht Gläubigern nicht zu, die im Falle der Insolvenz ein Recht auf vorzugsweise Befriedigung aus einer Deckungsmasse haben, die nach gesetzlicher Vorschrift zu ihrem Schutz errichtet und staatlich überwacht ist."
    },
    {
      "date": "2025-11-27",
      "id": "138498",
      "original_text": "Registerbekanntmachung nach dem Umwandlungsgesetz\nBremen Amtsgericht Bremen HRA 30619\nMahmud Atriss e. K. – Bremen",
      "type": "Registerbekanntmachung nach dem Umwandlungsgesetz",
      "state": "Bremen",
      "amtsgericht": "Amtsgericht Bremen",
      "registernummer": "HRA 30619",
      "registerart": "HRA",
      "company_name": "Mahmud Atriss e. K.",
      "company_seat": "Bremen",
      "details": "27.11.2025 (Bekanntmachungsdatum)\n\nBremen Amtsgericht Bremen HRA 30619\nRegisterbekanntmachung nach dem Umwandlungsgesetz 24.11.2025 (Eintragungsdatum)\n\nMahmud Atriss e. K.\nEinzelkaufmann / Einzelkauffrau\nBremen\n\n.Zu Eintragungsnummer 2 vom 24.11.2025 wird als nicht eingetragen veröffentlicht: Den Gläubigern ist, wenn sie binnen sechs Monaten nach dem Tag, an dem die Eintragung der Umwandlung als bekannt gemacht gilt, ihren Anspruch nach Grund und Höhe schriftlich anmelden, Sicherheit zu leisten, soweit sie nicht Befriedigung verlangen können. Dieses Recht steht den Gläubigern jedoch nur zu, wenn sie glaubhaft machen, dass durch die Umwandlung die Erfüllung ihrer Forderung gefährdet wird. Das Recht, Sicherheitsleistung zu verlangen, steht Gläubigern nicht zu, die im Falle der Insolvenz ein Recht auf vorzugsweise Befriedigung aus einer Deckungsmasse haben, die nach gesetzlicher Vorschrift zu ihrem Schutz errichtet und staatlich überwacht ist"
    },
    {
      "date": "2025-11-27",
      "id": "138499",
      "original_text": "Registerbekanntmachung nach dem Umwandlungsgesetz\nBremen Amtsgericht Bremen HRB 42109\nKLB GmbH – Bremen",
      "type": "Registerbekanntmachung nach dem Umwandlungsgesetz",
      "state": "Bremen",
      "amtsgericht": "Amtsgericht Bremen",
      "registernummer": "HRB 42109",
      "registerart": "HRB",
      "company_name": "KLB GmbH",
      "company_seat": "Bremen",
      "details": "27.11.2025 (Bekanntmachungsdatum)\n\nBremen Amtsgericht Bremen HRB 42109\nRegisterbekanntmachung nach dem Umwandlungsgesetz 26.11.2025 (Eintragungsdatum)\n\nKLB GmbH\nGesellschaft mit beschränkter Haftung\nBremen\n\nZu Eintragungsnummer 2 vom 26.11.2025 wird als nicht eingetragen veröffentlicht: Den Gläubigern ist, wenn sie binnen sechs Monaten nach dem Tag, an dem die Eintragung der Umwandlung als bekannt gemacht gilt, ihren Anspruch nach Grund und Höhe schriftlich anmelden, Sicherheit zu leisten, soweit sie nicht Befriedigung verlangen können. Dieses Recht steht den Gläubigern jedoch nur zu, wenn sie glaubhaft machen, dass durch die Umwandlung die Erfüllung ihrer Forderung gefährdet wird. Das Recht, Sicherheitsleistung zu verlangen, steht Gläubigern nicht zu, die im Falle der Insolvenz ein Recht auf vorzugsweise Befriedigung aus einer Deckungsmasse haben, die nach gesetzlicher Vorschrift zu ihrem Schutz errichtet und staatlich überwacht ist."
    },
    {
      "date": "2025-11-27",
      "id": "138500",
      "original_text": "Registerbekanntmachung nach dem Umwandlungsgesetz\nBremen Amtsgericht Bremen HRB 3250\nBREBAU GmbH – Bremen",
      "type": "Registerbekanntmachung nach dem Umwandlungsgesetz",
      "state": "Bremen",
      "amtsgericht": "Amtsgericht Bremen",
      "registernummer": "HRB 3250",
      "registerart": "HRB",
      "company_name": "BREBAU GmbH",
      "company_seat": "Bremen",
      "details": "27.11.2025 (Bekanntmachungsdatum)\n\nBremen Amtsgericht Bremen HRB 3250\nRegisterbekanntmachung nach dem Umwandlungsgesetz 26.11.2025 (Eintragungsdatum)\n\nBREBAU GmbH\nGesellschaft mit beschränkter Haftung\nBremen\n\nAls nicht eingetragen wird veröffentlicht: Den Gläubigern der an der Verschmelzung beteiligten Rechtsträger ist, wenn sie binnen sechs Monaten nach dem Tag, an dem die Eintragung der Verschmelzung in das Register des Sitzes desjenigen Rechtsträgers, dessen Gläubiger sie sind, als bekannt gemacht gilt, ihren Anspruch nach Grund und Höhe schriftlich anmelden, Sicherheit zu leisten, soweit sie nicht Befriedigung verlangen können. Dieses Recht steht den Gläubigern jedoch nur zu, wenn sie glaubhaft machen, dass durch die Verschmelzung die Erfüllung ihrer Forderung gefährdet wird. Das Recht, Sicherheitsleistung zu verlangen, steht Gläubigern nicht zu, die im Falle der Insolvenz ein Recht auf vorzugsweise Befriedigung aus einer Deckungsmasse haben, die nach gesetzlicher Vorschrift zu ihrem Schutz errichtet und staatlich überwacht ist."
    },
    {
      "date": "2025-11-27",
      "id": "138501",
      "original_text": "Registerbekanntmachung nach dem Umwandlungsgesetz\nBremen Amtsgericht Bremen HRB 15282\nRiehl Logistik GmbH – Bremen",
      "type": "Registerbekanntmachung nach dem Umwandlungsgesetz",
      "state": "Bremen",
      "amtsgericht": "Amtsgericht Bremen",
      "registernummer": "HRB 15282",
      "registerart": "HRB",
      "company_name": "Riehl Logistik GmbH",
      "company_seat": "Bremen",
      "details": "27.11.2025 (Bekanntmachungsdatum)\n\nBremen Amtsgericht Bremen HRB 15282\nRegisterbekanntmachung nach dem Umwandlungsgesetz 24.11.2025 (Eintragungsdatum)\n\nRiehl Logistik GmbH\nGesellschaft mit beschränkter Haftung\nBremen\n\nAls nicht eingetragen wird veröffentlicht: Den Gläubigern der an der Verschmelzung beteiligten Rechtsträger ist, wenn sie binnen sechs Monaten nach dem Tag, an dem die Eintragung der Verschmelzung in das Register des Sitzes desjenigen Rechtsträgers, dessen Gläubiger sie sind, als bekannt gemacht gilt, ihren Anspruch nach Grund und Höhe schriftlich anmelden, Sicherheit zu leisten, soweit sie nicht Befriedigung verlangen können. Dieses Recht steht den Gläubigern jedoch nur zu, wenn sie glaubhaft machen, dass durch die Verschmelzung die Erfüllung ihrer Forderung gefährdet wird. Das Recht, Sicherheitsleistung zu verlangen, steht Gläubigern nicht zu, die im Falle der Insolvenz ein Recht auf vorzugsweise Befriedigung aus einer Deckungsmasse haben, die nach gesetzlicher Vorschrift zu ihrem Schutz errichtet und staatlich überwacht ist."
    },
    {
      "date": "2025-11-27",
      "id": "138502",
      "original_text": "Löschungsankündigung\nNordrhein-Westfalen Amtsgericht Dortmund HRB 34483\nPerfect Industrial Products Holding UG (haftungsbeschränkt) – Dortmund",
      "type": "Löschungsankündigung",
      "state": "Nordrhein-Westfalen",
      "amtsgericht": "Amtsgericht Dortmund",
      "registernummer": "HRB 34483",
      "registerart": "HRB",
      "company_name": "Perfect Industrial Products Holding UG (haftungsbeschränkt)",
      "company_seat": "Dortmund",
      "details": "27.11.2025 (Bekanntmachungsdatum)\n\nNordrhein-Westfalen Amtsgericht Dortmund HRB 34483\nLöschungsankündigung\n\nPerfect Industrial Products Holding UG (haftungsbeschränkt)\nGesellschaft mit beschränkter Haftung\nDortmund\n\nDas Registergericht beabsichtigt die Gesellschaft von Amts wegen nach § 394 FamFG zu löschen. Die Frist zur Erhebung eines Widerspruchs ist auf zwei Monate festgesetzt."
    },
    {
      "date": "2025-11-27",
      "id": "138503",
      "original_text": "Löschungsankündigung\nNordrhein-Westfalen Amtsgericht Duisburg HRA 8034\nConcordia Bau und Boden AG & Co. 4. Immobilien-Fonds-Gesellschaft KG – Oberhausen",
      "type": "Löschungsankündigung",
      "state": "Nordrhein-Westfalen",
      "amtsgericht": "Amtsgericht Duisburg",
      "registernummer": "HRA 8034",
      "registerart": "HRA",
      "company_name": "Concordia Bau und Boden AG & Co. 4. Immobilien-Fonds-Gesellschaft KG",
      "company_seat": "Oberhausen",
      "details": "27.11.2025 (Bekanntmachungsdatum)\n\nNordrhein-Westfalen Amtsgericht Duisburg HRA 8034\nLöschungsankündigung\n\nConcordia Bau und Boden AG & Co. 4. Immobilien-Fonds-Gesellschaft KG\nKommanditgesellschaft\nOberhausen\n\nDas Registergericht beabsichtigt, die im Handelsregister eingetragene Gesellschaft Concordia Bau und Boden AG & Co. 4. Immobilien-Fonds-Gesellschaft KG gemäß §§ 31 Abs. 2, HGB, 393 FamFG von Amts wegen zu löschen. Gegen diese Verfügung kann Widerspruch eingelegt werden. Die Frist zur Erhebung eines Widerspruchs gegen die beabsichtigte Löschung von Amts wegen ist auf drei Monate festgesetzt. Rechtsbehelfsbelehrung Der Widerspruch ist bei dem Amtsgericht Duisburg, Kardinal-Galen-Str. 124-132, 47058 Duisburg schriftlich in deutscher Sprache oder zur Niederschrift der Geschäftsstelle einzulegen. Der Widerspruch kann auch zur Niederschrift der Geschäftsstelle eines jeden Amtsgerichtes abgegeben werden. Die Einlegung ist auch durch Übertragung eines elektronischen Dokuments an die elektronische Poststelle des Gerichts möglich. Das elektronische Dokument muss für die Bearbeitung durch das Gericht geeignet und mit einer qualifizierten elektronischen Signatur der verantwortenden Person versehen sein oder von der verantwortenden Person signiert und auf einem sicheren Übermittlungsweg gemäß § 130 a ZPO nach näherer Maßgabe der Verordnung über die technischen Rahmenbedingungen des elektronischen Rechtsverkehrs und über das besondere elektronische Behördenpostfach (BGBl. I, S. 3803) eingereicht werden. Weitere Informationen erhalten Sie auf der Internetseite www.justiz.de <http://www.justiz.de>. Der Widerspruch muss spätestens innerhalb der gesetzten Frist, beginnend mit der Zustellung dieser Verfügung, bei dem Amtsgericht Duisburg eingegangen sein. Dies gilt auch dann, wenn der Widerspruch zur Niederschrift der Geschäftsstelle eines anderen Amtsgerichtes abgegeben wurde. Die Frist beginnt mit der Veröffentlichung. Fällt das Ende der Frist auf einen Sonntag, einen allgemeinen Feiertag oder Sonnabend, so endet die Frist mit Ablauf des nächsten Werktages. Der Widerspruch muss die Bezeichnung der angefochtenen Verfügung sowie die Erklärung enthalten, dass Widerspruch gegen diese Verfügung eingelegt wird. Er ist zu unterzeichnen und soll begründet werden."
    },
    {
      "date": "2025-11-27",
      "id": "138504",
      "original_text": "Registerbekanntmachung nach dem Umwandlungsgesetz\nNordrhein-Westfalen Amtsgericht Steinfurt HRB 13606\nHotel Wefers GmbH – Emsdetten",
      "type": "Registerbekanntmachung nach dem Umwandlungsgesetz",
      "state": "Nordrhein-Westfalen",
      "amtsgericht": "Amtsgericht Steinfurt",
      "registernummer": "HRB 13606",
      "registerart": "HRB",
      "company_name": "Hotel Wefers GmbH",
      "company_seat": "Emsdetten",
      "details": "27.11.2025 (Bekanntmachungsdatum)\n\nNordrhein-Westfalen Amtsgericht Steinfurt HRB 13606\nRegisterbekanntmachung nach dem Umwandlungsgesetz 27.11.2025 (Eintragungsdatum)\n\nHotel Wefers GmbH\nGesellschaft mit beschränkter Haftung\nEmsdetten\n\nDen Gläubigern der an der Verschmelzung beteiligten Rechtsträger ist, wenn sie binnen sechs Monaten nach dem Tag, an dem die Eintragung der Verschmelzung in das Register des Sitzes desjenigen Rechtsträgers, dessen Gläubiger sie sind, nach § 19 Absatz 3 UmwG als bekanntgemacht gilt, ihren Anspruch nach Grund und Höhe schriftlich anmelden, Sicherheit zu leisten, soweit sie nicht Befriedigung verlangen können. Dieses Recht steht den Gläubigern jedoch nur zu, wenn sie glaubhaft machen, dass durch die Verschmelzung die Erfüllung ihrer Forderung gefährdet wird."
    },
    {
      "date": "2025-11-27",
      "id": "138505",
      "original_text": "Registerbekanntmachung nach dem Umwandlungsgesetz\nNordrhein-Westfalen Amtsgericht Düsseldorf HRB 110469\nCS Tech GmbH – Monheim am Rhein",
      "type": "Registerbekanntmachung nach dem Umwandlungsgesetz",
      "state": "Nordrhein-Westfalen",
      "amtsgericht": "Amtsgericht Düsseldorf",
      "registernummer": "HRB 110469",
      "registerart": "HRB",
      "company_name": "CS Tech GmbH",
      "company_seat": "Monheim am Rhein",
      "details": "27.11.2025 (Bekanntmachungsdatum)\n\nNordrhein-Westfalen Amtsgericht Düsseldorf HRB 110469\nRegisterbekanntmachung nach dem Umwandlungsgesetz 27.11.2025 (Eintragungsdatum)\n\nCS Tech GmbH\nGesellschaft mit beschränkter Haftung\nMonheim am Rhein\n\nDen Gläubigern der an der Ausgliederung beteiligten Rechtsträger ist, wenn sie binnen sechs Monaten nach dem Tag, an dem die Eintragung der Ausgliederung in das Register des Sitzes desjenigen Rechtsträgers, dessen Gläubiger sie sind, nach § 19 Absatz 3 UmwG als bekanntgemacht gilt, ihren Anspruch nach Grund und Höhe schriftlich anmelden, Sicherheit zu leisten, soweit sie nicht Befriedigung verlangen können. Dieses Recht steht den Gläubigern jedoch nur zu, wenn sie glaubhaft machen, dass durch die Ausgliederung die Erfüllung ihrer Forderung gefährdet wird."
    },
    {
      "date": "2025-11-27",
      "id": "138506",
      "original_text": "Registerbekanntmachung nach dem Umwandlungsgesetz\nNordrhein-Westfalen Amtsgericht Köln HRB 114994\nARS Computer und Consulting GmbH – Köln",
      "type": "Registerbekanntmachung nach dem Umwandlungsgesetz",
      "state": "Nordrhein-Westfalen",
      "amtsgericht": "Amtsgericht Köln",
      "registernummer": "HRB 114994",
      "registerart": "HRB",
      "company_name": "ARS Computer und Consulting GmbH",
      "company_seat": "Köln",
      "details": "27.11.2025 (Bekanntmachungsdatum)\n\nNordrhein-Westfalen Amtsgericht Köln HRB 114994\nRegisterbekanntmachung nach dem Umwandlungsgesetz 27.11.2025 (Eintragungsdatum)\n\nARS Computer und Consulting GmbH\nGesellschaft mit beschränkter Haftung\nKöln\n\nDen Gläubigern der an der Verschmelzung beteiligten Rechtsträger ist, wenn sie binnen sechs Monaten nach dem Tag, an dem die Eintragung der Verschmelzung in das Register des Sitzes desjenigen Rechtsträgers, dessen Gläubiger sie sind, nach § 19 Absatz 3 UmwG als bekanntgemacht gilt, ihren Anspruch nach Grund und Höhe schriftlich anmelden, Sicherheit zu leisten, soweit sie nicht Befriedigung verlangen können. Dieses Recht steht den Gläubigern jedoch nur zu, wenn sie glaubhaft machen, dass durch die Verschmelzung die Erfüllung ihrer Forderung gefährdet wird."
    },
    {
      "date": "2025-11-27",
      "id": "138507",
      "original_text": "Registerbekanntmachung nach dem Umwandlungsgesetz\nNordrhein-Westfalen Amtsgericht Siegburg HRB 9940\nOrbisana Healthcare GmbH – Troisdorf",
      "type": "Registerbekanntmachung nach dem Umwandlungsgesetz",
      "state": "Nordrhein-Westfalen",
      "amtsgericht": "Amtsgericht Siegburg",
      "registernummer": "HRB 9940",
      "registerart": "HRB",
      "company_name": "Orbisana Healthcare GmbH",
      "company_seat": "Troisdorf",
      "details": "27.11.2025 (Bekanntmachungsdatum)\n\nNordrhein-Westfalen Amtsgericht Siegburg HRB 9940\nRegisterbekanntmachung nach dem Umwandlungsgesetz 27.11.2025 (Eintragungsdatum)\n\nOrbisana Healthcare GmbH\nGesellschaft mit beschränkter Haftung\nTroisdorf\n\nDen Gläubigern der an der Verschmelzung beteiligten Rechtsträger ist, wenn sie binnen sechs Monaten nach dem Tag, an dem die Eintragung der Verschmelzung in das Register des Sitzes desjenigen Rechtsträgers, dessen Gläubiger sie sind, nach § 19 Absatz 3 UmwG als bekanntgemacht gilt, ihren Anspruch nach Grund und Höhe schriftlich anmelden, Sicherheit zu leisten, soweit sie nicht Befriedigung verlangen können. Dieses Recht steht den Gläubigern jedoch nur zu, wenn sie glaubhaft machen, dass durch die Verschmelzung die Erfüllung ihrer Forderung gefährdet wird."
    },
    {
      "date": "2025-11-27",
      "id": "138508",
      "original_text": "Registerbekanntmachung nach dem Umwandlungsgesetz\nNordrhein-Westfalen Amtsgericht Siegburg HRB 19048\nBrillant 4295. GmbH – Neunkirchen-Seelscheid",
      "type": "Registerbekanntmachung nach dem Umwandlungsgesetz",
      "state": "Nordrhein-Westfalen",
      "amtsgericht": "Amtsgericht Siegburg",
      "registernummer": "HRB 19048",
      "registerart": "HRB",
      "company_name": "Brillant 4295. GmbH",
      "company_seat": "Neunkirchen-Seelscheid",
      "details": "27.11.2025 (Bekanntmachungsdatum)\n\nNordrhein-Westfalen Amtsgericht Siegburg HRB 19048\nRegisterbekanntmachung nach dem Umwandlungsgesetz 27.11.2025 (Eintragungsdatum)\n\nBrillant 4295. GmbH\nGesellschaft mit beschränkter Haftung\nNeunkirchen-Seelscheid\n\nDen Gläubigern der an der Ausgliederung beteiligten Rechtsträger ist, wenn sie binnen sechs Monaten nach dem Tag, an dem die Eintragung der Ausgliederung in das Register des Sitzes desjenigen Rechtsträgers, dessen Gläubiger sie sind, nach § 19 Absatz 3 UmwG als bekanntgemacht gilt, ihren Anspruch nach Grund und Höhe schriftlich anmelden, Sicherheit zu leisten, soweit sie nicht Befriedigung verlangen können. Dieses Recht steht den Gläubigern jedoch nur zu, wenn sie glaubhaft machen, dass durch die Ausgliederung die Erfüllung ihrer Forderung gefährdet wird."
    },
    {
      "date": "2025-11-27",
      "id": "138509",
      "original_text": "Sonstige Registerbekanntmachung\nNordrhein-Westfalen Amtsgericht Bielefeld HRB 39136\nKrankenhaus Mara gGmbH – Bielefeld",
      "type": "Sonstige Registerbekanntmachung",
      "state": "Nordrhein-Westfalen",
      "amtsgericht": "Amtsgericht Bielefeld",
      "registernummer": "HRB 39136",
      "registerart": "HRB",
      "company_name": "Krankenhaus Mara gGmbH",
      "company_seat": "Bielefeld",
      "details": "27.11.2025 (Bekanntmachungsdatum)\n\nNordrhein-Westfalen Amtsgericht Bielefeld HRB 39136\nSonstige Registerbekanntmachung 27.11.2025 (Eintragungsdatum)\n\nKrankenhaus Mara gGmbH\nGesellschaft mit beschränkter Haftung\nBielefeld\n\nDem Registergericht ist eine neue Liste der Mitglieder des Aufsichtsrates eingereicht worden."
    },
    {
      "date": "2025-11-27",
      "id": "138510",
      "original_text": "Einreichung neuer Dokumente\nNordrhein-Westfalen Amtsgericht Neuss HRB 14366\nPierburg Pump Technology GmbH – Neuss",
      "type": "Einreichung neuer Dokumente",
      "state": "Nordrhein-Westfalen",
      "amtsgericht": "Amtsgericht Neuss",
      "registernummer": "HRB 14366",
      "registerart": "HRB",
      "company_name": "Pierburg Pump Technology GmbH",
      "company_seat": "Neuss",
      "details": "27.11.2025 (Bekanntmachungsdatum)\n\nNordrhein-Westfalen Amtsgericht Neuss HRB 14366\nEinreichung neuer Dokumente\n\nPierburg Pump Technology GmbH\nGesellschaft mit beschränkter Haftung\nNeuss\n\nDem Registergericht ist eine neue Liste der Mitglieder des Aufsichtsrates eingereicht worden."
    },
    {
      "date": "2025-11-27",
      "id": "138511",
      "original_text": "Registerbekanntmachung nach dem Umwandlungsgesetz\nNordrhein-Westfalen Amtsgericht Köln HRB 32293\nbrainbits GmbH – Köln",
      "type": "Registerbekanntmachung nach dem Umwandlungsgesetz",
      "state": "Nordrhein-Westfalen",
      "amtsgericht": "Amtsgericht Köln",
      "registernummer": "HRB 32293",
      "registerart": "HRB",
      "company_name": "brainbits GmbH",
      "company_seat": "Köln",
      "details": "27.11.2025 (Bekanntmachungsdatum)\n\nNordrhein-Westfalen Amtsgericht Köln HRB 32293\nRegisterbekanntmachung nach dem Umwandlungsgesetz 27.11.2025 (Eintragungsdatum)\n\nbrainbits GmbH\nGesellschaft mit beschränkter Haftung\nKöln\n\nDen Gläubigern der an der Verschmelzung beteiligten Rechtsträger ist, wenn sie binnen sechs Monaten nach dem Tag, an dem die Eintragung der Verschmelzung in das Register des Sitzes desjenigen Rechtsträgers, dessen Gläubiger sie sind, nach § 19 Absatz 3 UmwG als bekanntgemacht gilt, ihren Anspruch nach Grund und Höhe schriftlich anmelden, Sicherheit zu leisten, soweit sie nicht Befriedigung verlangen können. Dieses Recht steht den Gläubigern jedoch nur zu, wenn sie glaubhaft machen, dass durch die Verschmelzung die Erfüllung ihrer Forderung gefährdet wird."
    },
    {
      "date": "2025-11-27",
      "id": "138512",
      "original_text": "Löschungsankündigung\nNordrhein-Westfalen Amtsgericht Wuppertal HRB 27814\nWolf & Co. Sanierungen GmbH – Wuppertal",
      "type": "Löschungsankündigung",
      "state": "Nordrhein-Westfalen",
      "amtsgericht": "Amtsgericht Wuppertal",
      "registernummer": "HRB 27814",
      "registerart": "HRB",
      "company_name": "Wolf & Co. Sanierungen GmbH",
      "company_seat": "Wuppertal",
      "details": "27.11.2025 (Bekanntmachungsdatum)\n\nNordrhein-Westfalen Amtsgericht Wuppertal HRB 27814\nLöschungsankündigung\n\nWolf & Co. Sanierungen GmbH\nGesellschaft mit beschränkter Haftung\nWuppertal\n\nDas Registergericht beabsichtigt die Gesellschaft von Amts wegen nach § 394 FamFG zu löschen. Die Frist zur Erhebung eines Widerspruchs ist auf einen Monat festgesetzt."
    },
    {
      "date": "2025-11-27",
      "id": "138513",
      "original_text": "Registerbekanntmachung nach dem Umwandlungsgesetz\nNordrhein-Westfalen Amtsgericht Düsseldorf HRB 67732\nAWP 11 GmbH – Düsseldorf",
      "type": "Registerbekanntmachung nach dem Umwandlungsgesetz",
      "state": "Nordrhein-Westfalen",
      "amtsgericht": "Amtsgericht Düsseldorf",
      "registernummer": "HRB 67732",
      "registerart": "HRB",
      "company_name": "AWP 11 GmbH",
      "company_seat": "Düsseldorf",
      "details": "27.11.2025 (Bekanntmachungsdatum)\n\nNordrhein-Westfalen Amtsgericht Düsseldorf HRB 67732\nRegisterbekanntmachung nach dem Umwandlungsgesetz 27.11.2025 (Eintragungsdatum)\n\nAWP 11 GmbH\nGesellschaft mit beschränkter Haftung\nDüsseldorf\n\nDen Gläubigern der an der Verschmelzung beteiligten Rechtsträger ist, wenn sie binnen sechs Monaten nach dem Tag, an dem die Eintragung der Verschmelzung in das Register des Sitzes desjenigen Rechtsträgers, dessen Gläubiger sie sind, nach § 19 Absatz 3 UmwG als bekanntgemacht gilt, ihren Anspruch nach Grund und Höhe schriftlich anmelden, Sicherheit zu leisten, soweit sie nicht Befriedigung verlangen können. Dieses Recht steht den Gläubigern jedoch nur zu, wenn sie glaubhaft machen, dass durch die Verschmelzung die Erfüllung ihrer Forderung gefährdet wird."
    },
    {
      "date": "2025-11-27",
      "id": "138514",
      "original_text": "Löschungsankündigung\nNordrhein-Westfalen Amtsgericht Bad Oeynhausen HRB 13490\nLa Vitamina UG (haftungsbeschränkt) – Löhne",
      "type": "Löschungsankündigung",
      "state": "Nordrhein-Westfalen",
      "amtsgericht": "Amtsgericht Bad Oeynhausen",
      "registernummer": "HRB 13490",
      "registerart": "HRB",
      "company_name": "La Vitamina UG (haftungsbeschränkt)",
      "company_seat": "Löhne",
      "details": "27.11.2025 (Bekanntmachungsdatum)\n\nNordrhein-Westfalen Amtsgericht Bad Oeynhausen HRB 13490\nLöschungsankündigung\n\nLa Vitamina UG (haftungsbeschränkt)\nGesellschaft mit beschränkter Haftung\nLöhne\n\nDas Registergericht beabsichtigt die Gesellschaft von Amts wegen nach § 394 FamFG zu löschen. Die Frist zur Erhebung eines Widerspruchs ist auf einen Monat festgesetzt."
    },
    {
      "date": "2025-11-27",
      "id": "138515",
      "original_text": "Einreichung neuer Dokumente\nNordrhein-Westfalen Amtsgericht Düsseldorf GnR 506\nCultural Commons Collecting Society SCE mit beschränkter Haftung (C3S SCE) – Düsseldorf",
      "type": "Einreichung neuer Dokumente",
      "state": "Nordrhein-Westfalen",
      "amtsgericht": "Amtsgericht Düsseldorf",
      "registernummer": "GnR 506",
      "registerart": "GnR",
      "company_name": "Cultural Commons Collecting Society SCE mit beschränkter Haftung (C3S SCE)",
      "company_seat": "Düsseldorf",
      "details": "27.11.2025 (Bekanntmachungsdatum)\n\nNordrhein-Westfalen Amtsgericht Düsseldorf GnR 506\nEinreichung neuer Dokumente 27.11.2025 (Eintragungsdatum)\n\nCultural Commons Collecting Society SCE mit beschränkter Haftung (C3S SCE)\nEuropäische Genossenschaft (SCE)\nDüsseldorf\n\nEs wurde eine neue Aufsichtsratsliste in den Registerordner eingestellt."
    },
    {
      "date": "2025-11-27",
      "id": "138516",
      "original_text": "Einreichung neuer Dokumente\nNordrhein-Westfalen Amtsgericht Düsseldorf HRB 28\nFlughafen Düsseldorf GmbH – Düsseldorf",
      "type": "Einreichung neuer Dokumente",
      "state": "Nordrhein-Westfalen",
      "amtsgericht": "Amtsgericht Düsseldorf",
      "registernummer": "HRB 28",
      "registerart": "HRB",
      "company_name": "Flughafen Düsseldorf GmbH",
      "company_seat": "Düsseldorf",
      "details": "27.11.2025 (Bekanntmachungsdatum)\n\nNordrhein-Westfalen Amtsgericht Düsseldorf HRB 28\nEinreichung neuer Dokumente 27.11.2025 (Eintragungsdatum)\n\nFlughafen Düsseldorf GmbH\nGesellschaft mit beschränkter Haftung\nDüsseldorf\n\nDem Registergericht ist eine neue Liste der Mitglieder des Aufsichtsrates eingereicht worden."
    },
    {
      "date": "2025-11-27",
      "id": "138517",
      "original_text": "Löschungsankündigung\nNordrhein-Westfalen Amtsgericht Bochum HRB 19201\nElster Service GmbH – Witten",
      "type": "Löschungsankündigung",
      "state": "Nordrhein-Westfalen",
      "amtsgericht": "Amtsgericht Bochum",
      "registernummer": "HRB 19201",
      "registerart": "HRB",
      "company_name": "Elster Service GmbH",
      "company_seat": "Witten",
      "details": "27.11.2025 (Bekanntmachungsdatum)\n\nNordrhein-Westfalen Amtsgericht Bochum HRB 19201\nLöschungsankündigung\n\nElster Service GmbH\nGesellschaft mit beschränkter Haftung\nWitten\n\nDas Registergericht beabsichtigt die Gesellschaft von Amts wegen nach § 394 FamFG zu löschen. Die Frist zur Erhebung eines Widerspruchs ist auf drei Monate festgesetzt."
    },
    {
      "date": "2025-11-27",
      "id": "138518",
      "original_text": "Registerbekanntmachung nach dem Umwandlungsgesetz\nNordrhein-Westfalen Amtsgericht Siegburg HRA 7326\nDr. Buhl Consulting GmbH & Co. KG – Siegburg",
      "type": "Registerbekanntmachung nach dem Umwandlungsgesetz",
      "state": "Nordrhein-Westfalen",
      "amtsgericht": "Amtsgericht Siegburg",
      "registernummer": "HRA 7326",
      "registerart": "HRA",
      "company_name": "Dr. Buhl Consulting GmbH & Co. KG",
      "company_seat": "Siegburg",
      "details": "27.11.2025 (Bekanntmachungsdatum)\n\nNordrhein-Westfalen Amtsgericht Siegburg HRA 7326\nRegisterbekanntmachung nach dem Umwandlungsgesetz 27.11.2025 (Eintragungsdatum)\n\nDr. Buhl Consulting GmbH & Co. KG\nKommanditgesellschaft\nSiegburg\n\nDie Gesellschaft hat Gläubigern, deren Forderungen vor dieser Bekanntmachung begründet worden sind, Sicherheit zu leisten, soweit sie nicht Befriedigung verlangen können, wenn sie sich binnen sechs Monaten zu diesem Zweck melden."
    },
    {
      "date": "2025-11-27",
      "id": "138519",
      "original_text": "Löschungsankündigung\nNordrhein-Westfalen Amtsgericht Aachen HRB 9056\nbonafide Planungs- und Baugesellschaft mbH – Monschau",
      "type": "Löschungsankündigung",
      "state": "Nordrhein-Westfalen",
      "amtsgericht": "Amtsgericht Aachen",
      "registernummer": "HRB 9056",
      "registerart": "HRB",
      "company_name": "bonafide Planungs- und Baugesellschaft mbH",
      "company_seat": "Monschau",
      "details": "27.11.2025 (Bekanntmachungsdatum)\n\nNordrhein-Westfalen Amtsgericht Aachen HRB 9056\nLöschungsankündigung\n\nbonafide Planungs- und Baugesellschaft mbH\nGesellschaft mit beschränkter Haftung\nMonschau\n\nDas Registergericht beabsichtigt, von Amts wegen die Gesellschaft wegen Vermögenslosigkeit nach § 394 FamFG zu löschen.\nDies erscheint angezeigt, weil das Insolvenzverfahren Amtsgericht Aachen 92 IN 144/23  beendet und Vermögen der Gesellschaft nicht mehr erkennbar ist.\n\nZur Geltendmachung des Widerspruchs gegen die beabsichtigte Löschung wird hiermit eine Frist von einem Monat ab Veröffentlichung dieser Ankündigung bestimmt.\n\nRechtsbehelfsbelehrung:\n\nGegen diese Verfügung kann Widerspruch eingelegt werden. Zum Widerspruch ist jeder berechtigt, der an der Unterlassung der Löschung ein berechtigtes Interesse hat.\n\nDer Widerspruch ist bei dem Amtsgericht Aachen, Adalbertsteinweg 92, 52070 Aachen schriftlich in deutscher Sprache oder zur Niederschrift der Geschäftsstelle einzulegen. Der Widerspruch kann auch zur Niederschrift der Geschäftsstelle eines jeden Amtsgerichtes abgegeben werden.\n\nDer Widerspruch muss spätestens innerhalb der gesetzten Frist nach der Bekanntgabe der Verfügung bei dem Amtsgericht Aachen eingegangen sein. Dies gilt auch dann, wenn der Widerspruch zur Niederschrift der Geschäftsstelle eines anderen Amtsgerichtes abgegeben wurde. Die Frist beginnt mit der Bekanntgabe der Verfügung durch Veröffentlichung. Fällt das Ende der Frist auf einen Sonntag, einen allgemeinen Feiertag oder Sonnabend, so endet die Frist mit Ablauf des nächsten Werktages.\n\nDer Widerspruch muss die Bezeichnung der angefochtenen Verfügung sowie die Erklärung enthalten, dass Widerspruch gegen diese Verfügung eingelegt wird. Er ist zu unterzeichnen und soll begründet werden.\n\nDie Einlegung ist auch durch Übertragung eines elektronischen Dokuments an die elektronische Poststelle des Gerichts möglich. Das elektronische Dokument muss für die Bearbeitung durch das Gericht geeignet und mit einer qualifizierten elektronischen Signatur der verantwortenden Person versehen sein oder von der verantwortenden Person signiert und auf einem sicheren Übermittlungsweg gemäß § 130 a ZPO nach näherer Maßgabe der Verordnung über die technischen Rahmenbedingungen des elektronischen Rechtsverkehrs und über das besondere elektronische Behördenpostfach (BGBl. I, S. 3803) eingereicht werden. Weitere Informationen erhalten Sie auf der Internetseite www.justiz.de."
    },
    {
      "date": "2025-11-27",
      "id": "138520",
      "original_text": "Registerbekanntmachung nach dem Umwandlungsgesetz\nNordrhein-Westfalen Amtsgericht Gütersloh HRB 14120\nOnal Innovation GmbH – Harsewinkel",
      "type": "Registerbekanntmachung nach dem Umwandlungsgesetz",
      "state": "Nordrhein-Westfalen",
      "amtsgericht": "Amtsgericht Gütersloh",
      "registernummer": "HRB 14120",
      "registerart": "HRB",
      "company_name": "Onal Innovation GmbH",
      "company_seat": "Harsewinkel",
      "details": "27.11.2025 (Bekanntmachungsdatum)\n\nNordrhein-Westfalen Amtsgericht Gütersloh HRB 14120\nRegisterbekanntmachung nach dem Umwandlungsgesetz 27.11.2025 (Eintragungsdatum)\n\nOnal Innovation GmbH\nGesellschaft mit beschränkter Haftung\nHarsewinkel\n\nDen Gläubigern der an der Ausgliederung beteiligten Rechtsträger ist, wenn sie binnen sechs Monaten nach dem Tag, an dem die Eintragung der Ausgliederung in das Register des Sitzes desjenigen Rechtsträgers, dessen Gläubiger sie sind, nach § 19 Absatz 3 UmwG als bekanntgemacht gilt, ihren Anspruch nach Grund und Höhe schriftlich anmelden, Sicherheit zu leisten, soweit sie nicht Befriedigung verlangen können. Dieses Recht steht den Gläubigern jedoch nur zu, wenn sie glaubhaft machen, dass durch die Ausgliederung die Erfüllung ihrer Forderung gefährdet wird."
    },
    {
      "date": "2025-11-27",
      "id": "138521",
      "original_text": "Einreichung neuer Dokumente\nNordrhein-Westfalen Amtsgericht Düsseldorf HRB 38644\nLeo International Precision Health Aktiengesellschaft – Düsseldorf",
      "type": "Einreichung neuer Dokumente",
      "state": "Nordrhein-Westfalen",
      "amtsgericht": "Amtsgericht Düsseldorf",
      "registernummer": "HRB 38644",
      "registerart": "HRB",
      "company_name": "Leo International Precision Health Aktiengesellschaft",
      "company_seat": "Düsseldorf",
      "details": "27.11.2025 (Bekanntmachungsdatum)\n\nNordrhein-Westfalen Amtsgericht Düsseldorf HRB 38644\nEinreichung neuer Dokumente\n\nLeo International Precision Health Aktiengesellschaft\nAktiengesellschaft\nDüsseldorf\n\nDem Registergericht ist eine neue Liste der Mitglieder des Aufsichtsrates eingereicht worden."
    },
    {
      "date": "2025-11-27",
      "id": "138522",
      "original_text": "Löschungsankündigung\nNordrhein-Westfalen Amtsgericht Paderborn HRB 15495\nThe Crypto Trading Company UG (haftungsbeschränkt) – Paderborn",
      "type": "Löschungsankündigung",
      "state": "Nordrhein-Westfalen",
      "amtsgericht": "Amtsgericht Paderborn",
      "registernummer": "HRB 15495",
      "registerart": "HRB",
      "company_name": "The Crypto Trading Company UG (haftungsbeschränkt)",
      "company_seat": "Paderborn",
      "details": "27.11.2025 (Bekanntmachungsdatum)\n\nNordrhein-Westfalen Amtsgericht Paderborn HRB 15495\nLöschungsankündigung 27.11.2025 (Eintragungsdatum)\n\nThe Crypto Trading Company UG (haftungsbeschränkt)\nGesellschaft mit beschränkter Haftung\nPaderborn\n\nDas Registergericht beabsichtigt die Gesellschaft von Amts wegen nach § 394 FamFG zu löschen. Die Frist zur Erhebung eines Widerspruchs ist auf einen Monat festgesetzt."
    },
    {
      "date": "2025-11-27",
      "id": "138523",
      "original_text": "Löschungsankündigung\nNordrhein-Westfalen Amtsgericht Dortmund HRB 35696\nDMD Eis Verwaltungs GmbH – Selm",
      "type": "Löschungsankündigung",
      "state": "Nordrhein-Westfalen",
      "amtsgericht": "Amtsgericht Dortmund",
      "registernummer": "HRB 35696",
      "registerart": "HRB",
      "company_name": "DMD Eis Verwaltungs GmbH",
      "company_seat": "Selm",
      "details": "27.11.2025 (Bekanntmachungsdatum)\n\nNordrhein-Westfalen Amtsgericht Dortmund HRB 35696\nLöschungsankündigung\n\nDMD Eis Verwaltungs GmbH\nGesellschaft mit beschränkter Haftung\nSelm\n\nDas Registergericht beabsichtigt die Gesellschaft von Amts wegen nach § 394 FamFG zu löschen. Die Frist zur Erhebung eines Widerspruchs ist auf zwei Monate festgesetzt."
    },
    {
      "date": "2025-11-27",
      "id": "138524",
      "original_text": "Löschungsankündigung\nNordrhein-Westfalen Amtsgericht Aachen VR 6191\nDobermann-Rettung e.V. – Roetgen",
      "type": "Löschungsankündigung",
      "state": "Nordrhein-Westfalen",
      "amtsgericht": "Amtsgericht Aachen",
      "registernummer": "VR 6191",
      "registerart": "VR",
      "company_name": "Dobermann-Rettung e.V.",
      "company_seat": "Roetgen",
      "details": "27.11.2025 (Bekanntmachungsdatum)\n\nNordrhein-Westfalen Amtsgericht Aachen VR 6191\nLöschungsankündigung 20.11.2025 (Eintragungsdatum)\n\nDobermann-Rettung e.V.\neingetragener Verein\nRoetgen\n\nDas Registergericht beabsichtigt, von Amts wegen folgende Eintragung wegen Unzulässigkeit nach § 395 FamFG zu löschen:\n\n3. Vorsitzende Angela Greco\n\nZur Geltendmachung des Widerspruchs gegen die beabsichtigte Löschung wird hiermit eine Frist von einem Monat ab Veröffentlichung dieser Ankündigung bestimmt.\n\nRechtsbehelfsbelehrung:\n\nGegen diese Verfügung kann Widerspruch eingelegt werden. Zum Widerspruch ist jeder berechtigt, der an der Unterlassung der Löschung ein berechtigtes Interesse hat.\n\nDer Widerspruch ist bei dem Amtsgericht Aachen, Adalbertsteinweg 92, 52070 Aachen schriftlich in deutscher Sprache oder zur Niederschrift der Geschäftsstelle einzulegen. Der Widerspruch kann auch zur Niederschrift der Geschäftsstelle eines jeden Amtsgerichtes abgegeben werden.\n\nDer Widerspruch muss spätestens innerhalb der gesetzten Frist nach der Bekanntgabe der Verfügung bei dem Amtsgericht Aachen eingegangen sein. Dies gilt auch dann, wenn der Widerspruch zur Niederschrift der Geschäftsstelle eines anderen Amtsgerichtes abgegeben wurde. Die Frist beginnt mit der Bekanntgabe der Verfügung durch Veröffentlichung. Fällt das Ende der Frist auf einen Sonntag, einen allgemeinen Feiertag oder Sonnabend, so endet die Frist mit Ablauf des nächsten Werktages.\n\nDer Widerspruch muss die Bezeichnung der angefochtenen Verfügung sowie die Erklärung enthalten, dass Widerspruch gegen diese Verfügung eingelegt wird. Er ist zu unterzeichnen und soll begründet werden.\n\nDie Einlegung ist auch durch Übertragung eines elektronischen Dokuments an die elektronische Poststelle des Gerichts möglich. Das elektronische Dokument muss für die Bearbeitung durch das Gericht geeignet und mit einer qualifizierten elektronischen Signatur der verantwortenden Person versehen sein oder von der verantwortenden Person signiert und auf einem sicheren Übermittlungsweg gemäß § 130 a ZPO nach näherer Maßgabe der Verordnung über die technischen Rahmenbedingungen des elektronischen Rechtsverkehrs und über das besondere elektronische Behördenpostfach (BGBl. I, S. 3803) eingereicht werden. Weitere Informationen erhalten Sie auf der Internetseite www.justiz.de."
    },
    {
      "date": "2025-11-27",
      "id": "138525",
      "original_text": "Löschungsankündigung\nNordrhein-Westfalen Amtsgericht Duisburg HRA 8699\n\"Heutgens jun. GmbH & Co. KG\" – Mülheim an der Ruhr",
      "type": "Löschungsankündigung",
      "state": "Nordrhein-Westfalen",
      "amtsgericht": "Amtsgericht Duisburg",
      "registernummer": "HRA 8699",
      "registerart": "HRA",
      "company_name": "\"Heutgens jun. GmbH & Co. KG\"",
      "company_seat": "Mülheim an der Ruhr",
      "details": "27.11.2025 (Bekanntmachungsdatum)\n\nNordrhein-Westfalen Amtsgericht Duisburg HRA 8699\nLöschungsankündigung 27.11.2025 (Eintragungsdatum)\n\n\"Heutgens jun. GmbH & Co. KG\"\nKommanditgesellschaft\nMülheim an der Ruhr\n\nHRA 8699:\n\"Heutgens jun. GmbH & Co. KG\", Mülheim an der Ruhr\nWitzlebenstraße 15, 45472 Mülheim an der Ruhr.\nDas Registergericht beabsichtigt, die im Handelsregister eingetragene Gesellschaft gemäß § 394 FamFG wegen Vermögenslosigkeit von Amts wegen zu löschen.\nGegen diese Verfügung kann Widerspruch eingelegt werden.\nDer Widerspruch ist bei dem Amtsgericht - Registergericht - Duisburg, Kardinal-Galen-Straße 124 - 132, 47058 Duisburg, schriftlich in deutscher Sprache oder zur Niederschrift der Geschäftsstelle einzulegen. Der Widerspruch kann auch zur Niederschrift der Geschäftsstelle eines jeden Amtsgerichtes abgegeben werden.\nDer Widerspruch muss spätestens innerhalb der gesetzten Frist nach der schriftlichen Bekanntgabe der Verfügung bei dem Amtsgericht Duisburg eingegangen sein. Dies gilt auch dann, wenn der Widerspruch zur Niederschrift der Geschäftsstelle eines anderen Amtsgerichtes abgegeben wurde. Die Frist beginnt mit der schriftlichen Bekanntgabe der Verfügung.\nDer Widerspruch muss die Bezeichnung der angefochtenen Verfügung sowie die Erklärung enthalten, dass Widerspruch gegen diese Verfügung eingelegt wird. Er ist zu unterzeichnen und soll begründet werden.\nDie Einlegung ist auch durch Übertragung eines elektronischen Dokuments an die elektronische Poststelle des Gerichts möglich. Das elektronische Dokument muss für die Bearbeitung durch das Gericht geeignet und mit einer qualifizierten elektronischen Signatur der verantwortenden Person versehen sein oder von der verantwortenden Person signiert und auf einem sicheren Übermittlungsweg gemäß § 130a ZPO nach näherer Maßgabe der Verordnung über die technischen Rahmenbedingungen des elektronischen Rechtsverkehrs und über das besondere elektronische Behördenpostfach (BGBl. 2017 I, S. 3803) eingereicht werden. Weitere Informationen erhalten Sie auf der Internetseite www.justiz.de."
    },
    {
      "date": "2025-11-27",
      "id": "138526",
      "original_text": "Löschungsankündigung\nNordrhein-Westfalen Amtsgericht Hamm HRB 6975\nMaler-Wilkinghoff GmbH – Hamm",
      "type": "Löschungsankündigung",
      "state": "Nordrhein-Westfalen",
      "amtsgericht": "Amtsgericht Hamm",
      "registernummer": "HRB 6975",
      "registerart": "HRB",
      "company_name": "Maler-Wilkinghoff GmbH",
      "company_seat": "Hamm",
      "details": "27.11.2025 (Bekanntmachungsdatum)\n\nNordrhein-Westfalen Amtsgericht Hamm HRB 6975\nLöschungsankündigung\n\nMaler-Wilkinghoff GmbH\nGesellschaft mit beschränkter Haftung\nHamm\n\nDas Registergericht beabsichtigt die Gesellschaft von Amts wegen nach § 394 FamFG zu löschen. Die Frist zur Erhebung eines Widerspruchs ist auf drei Monate festgesetzt."
    },
    {
      "date": "2025-11-27",
      "id": "138527",
      "original_text": "Einreichung neuer Dokumente\nNordrhein-Westfalen Amtsgericht Düsseldorf HRB 103301\nFarina AG – Düsseldorf",
      "type": "Einreichung neuer Dokumente",
      "state": "Nordrhein-Westfalen",
      "amtsgericht": "Amtsgericht Düsseldorf",
      "registernummer": "HRB 103301",
      "registerart": "HRB",
      "company_name": "Farina AG",
      "company_seat": "Düsseldorf",
      "details": "27.11.2025 (Bekanntmachungsdatum)\n\nNordrhein-Westfalen Amtsgericht Düsseldorf HRB 103301\nEinreichung neuer Dokumente 27.11.2025 (Eintragungsdatum)\n\nFarina AG\nAktiengesellschaft\nDüsseldorf\n\nDem Registergericht ist eine Liste der Mitglieder des Aufsichtsrates eingereicht worden."
    },
    {
      "date": "2025-11-27",
      "id": "138528",
      "original_text": "Registerbekanntmachung nach dem Umwandlungsgesetz\nNordrhein-Westfalen Amtsgericht Köln HRB 117255\nATVANTAGE GmbH – Köln",
      "type": "Registerbekanntmachung nach dem Umwandlungsgesetz",
      "state": "Nordrhein-Westfalen",
      "amtsgericht": "Amtsgericht Köln",
      "registernummer": "HRB 117255",
      "registerart": "HRB",
      "company_name": "ATVANTAGE GmbH",
      "company_seat": "Köln",
      "details": "27.11.2025 (Bekanntmachungsdatum)\n\nNordrhein-Westfalen Amtsgericht Köln HRB 117255\nRegisterbekanntmachung nach dem Umwandlungsgesetz 27.11.2025 (Eintragungsdatum)\n\nATVANTAGE GmbH\nGesellschaft mit beschränkter Haftung\nKöln\n\nDen Gläubigern der an der Verschmelzung beteiligten Rechtsträger ist, wenn sie binnen sechs Monaten nach dem Tag, an dem die Eintragung der Verschmelzung in das Register des Sitzes derjenigen Rechtsträger deren Gläubiger sie sind, nach § 19 Absatz 3 UmwG als bekanntgemacht gilt, ihren Anspruch nach Grund und Höhe schriftlich anmelden, Sicherheit zu leisten, soweit sie nicht Befriedigung verlangen können. Dieses Recht steht den Gläubigern jedoch nur zu, wenn sie glaubhaft machen, dass durch die Verschmelzung die Erfüllung ihrer Forderung gefährdet wird."
    },
    {
      "date": "2025-11-27",
      "id": "138529",
      "original_text": "Registerbekanntmachung nach dem Umwandlungsgesetz\nSachsen Amtsgericht Leipzig HRB 31012\nZELLKRAFTWERK GmbH – Leipzig",
      "type": "Registerbekanntmachung nach dem Umwandlungsgesetz",
      "state": "Sachsen",
      "amtsgericht": "Amtsgericht Leipzig",
      "registernummer": "HRB 31012",
      "registerart": "HRB",
      "company_name": "ZELLKRAFTWERK GmbH",
      "company_seat": "Leipzig",
      "details": "27.11.2025 (Bekanntmachungsdatum)\n\nSachsen Amtsgericht Leipzig HRB 31012\nRegisterbekanntmachung nach dem Umwandlungsgesetz 27.11.2025 (Eintragungsdatum)\n\nZELLKRAFTWERK GmbH\nGesellschaft mit beschränkter Haftung\nLeipzig\n\nDen Gläubigern der an der Verschmelzung beteiligten Rechtsträger ist, wenn sie binnen sechs Monaten nach dem Tag, an dem die Eintragung der Verschmelzung in das Register des Sitzes desjenigen Rechtsträgers, dessen Gläubiger sie sind, nach § 19 Abs. 3 UmwG als bekannt gemacht gilt, ihren Anspruch nach Grund und Höhe in Textform anmelden, Sicherheit zu leisten, soweit sie nicht Befriedigung verlangen können. Dieses Recht steht den Gläubigern jedoch nur zu, wenn sie glaubhaft machen, dass durch die Verschmelzung die Erfüllung der Forderung gefährdet wird."
    },
    {
      "date": "2025-11-27",
      "id": "138530",
      "original_text": "Registerbekanntmachung nach dem Umwandlungsgesetz\nHessen Amtsgericht Bad Homburg v.d.H. HRB 17191\nCOMTWENTYONE GmbH – Oberursel (Taunus)",
      "type": "Registerbekanntmachung nach dem Umwandlungsgesetz",
      "state": "Hessen",
      "amtsgericht": "Amtsgericht Bad Homburg v.d.H.",
      "registernummer": "HRB 17191",
      "registerart": "HRB",
      "company_name": "COMTWENTYONE GmbH",
      "company_seat": "Oberursel (Taunus)",
      "details": "27.11.2025 (Bekanntmachungsdatum)\n\nHessen Amtsgericht Bad Homburg v.d.H. HRB 17191\nRegisterbekanntmachung nach dem Umwandlungsgesetz 27.11.2025 (Eintragungsdatum)\n\nCOMTWENTYONE GmbH\nGesellschaft mit beschränkter Haftung\nOberursel (Taunus)\n\nDen Gläubigern der an der Ausgliederung beteiligten Rechtsträger ist, wenn sie binnen sechs Monaten nach dem Tag, an dem die Eintragung der Ausgliederung in das Register des Sitzes desjenigen Rechtsträgers, dessen Gläubiger sie sind, nach §§ 125, 19 Absatz 3 UmwG bekannt gemacht worden ist, ihren Anspruch nach Grund und Höhe schriftlich anmelden, Sicherheit zu leisten, soweit sie nicht Befriedigung verlangen können. Dieses Recht steht den Gläubigern jedoch nur zu, wenn sie glaubhaft machen, dass durch die Ausgliederung die Erfüllung ihrer Forderung gefährdet wird."
    },
    {
      "date": "2025-11-27",
      "id": "138531",
      "original_text": "Registerbekanntmachung nach dem Umwandlungsgesetz\nHessen Amtsgericht Bad Homburg v.d.H. HRB 17215\nMainTalent GmbH – Oberursel (Taunus)",
      "type": "Registerbekanntmachung nach dem Umwandlungsgesetz",
      "state": "Hessen",
      "amtsgericht": "Amtsgericht Bad Homburg v.d.H.",
      "registernummer": "HRB 17215",
      "registerart": "HRB",
      "company_name": "MainTalent GmbH",
      "company_seat": "Oberursel (Taunus)",
      "details": "27.11.2025 (Bekanntmachungsdatum)\n\nHessen Amtsgericht Bad Homburg v.d.H. HRB 17215\nRegisterbekanntmachung nach dem Umwandlungsgesetz 27.11.2025 (Eintragungsdatum)\n\nMainTalent GmbH\nGesellschaft mit beschränkter Haftung\nOberursel (Taunus)\n\nDen Gläubigern der an der Ausgliederung beteiligten Rechtsträger ist, wenn sie binnen sechs Monaten nach dem Tag, an dem die Eintragung der Ausgliederung in das Register des Sitzes desjenigen Rechtsträgers, dessen Gläubiger sie sind, nach §§ 125, 19 Absatz 3 UmwG bekannt gemacht worden ist, ihren Anspruch nach Grund und Höhe schriftlich anmelden, Sicherheit zu leisten, soweit sie nicht Befriedigung verlangen können. Dieses Recht steht den Gläubigern jedoch nur zu, wenn sie glaubhaft machen, dass durch die Ausgliederung die Erfüllung ihrer Forderung gefährdet wird."
    },
    {
      "date": "2025-11-27",
      "id": "138532",
      "original_text": "Registerbekanntmachung nach dem Umwandlungsgesetz\nHessen Amtsgericht Bad Homburg v.d.H. HRA 6460\nMichael Kinze e.K. – Oberursel (Taunus)",
      "type": "Registerbekanntmachung nach dem Umwandlungsgesetz",
      "state": "Hessen",
      "amtsgericht": "Amtsgericht Bad Homburg v.d.H.",
      "registernummer": "HRA 6460",
      "registerart": "HRA",
      "company_name": "Michael Kinze e.K.",
      "company_seat": "Oberursel (Taunus)",
      "details": "27.11.2025 (Bekanntmachungsdatum)\n\nHessen Amtsgericht Bad Homburg v.d.H. HRA 6460\nRegisterbekanntmachung nach dem Umwandlungsgesetz 27.11.2025 (Eintragungsdatum)\n\nMichael Kinze e.K.\nEinzelkaufmann / Einzelkauffrau\nOberursel (Taunus)\n\nDen Gläubigern der an der Ausgliederung beteiligten Rechtsträger ist, wenn sie binnen sechs Monaten nach dem Tag, an dem die Eintragung der Ausgliederung in das Register des Sitzes desjenigen Rechtsträgers, dessen Gläubiger sie sind, nach §§ 125, 19 Absatz 3 UmwG bekannt gemacht worden ist, ihren Anspruch nach Grund und Höhe schriftlich anmelden, Sicherheit zu leisten, soweit sie nicht Befriedigung verlangen können. Dieses Recht steht den Gläubigern jedoch nur zu, wenn sie glaubhaft machen, dass durch die Ausgliederung die Erfüllung ihrer Forderung gefährdet wird."
    },
    {
      "date": "2025-11-27",
      "id": "138533",
      "original_text": "Registerbekanntmachung nach dem Umwandlungsgesetz\nHessen Amtsgericht Bad Homburg v.d.H. HRA 6459\nJudith Kinze e.K. – Oberursel (Taunus)",
      "type": "Registerbekanntmachung nach dem Umwandlungsgesetz",
      "state": "Hessen",
      "amtsgericht": "Amtsgericht Bad Homburg v.d.H.",
      "registernummer": "HRA 6459",
      "registerart": "HRA",
      "company_name": "Judith Kinze e.K.",
      "company_seat": "Oberursel (Taunus)",
      "details": "27.11.2025 (Bekanntmachungsdatum)\n\nHessen Amtsgericht Bad Homburg v.d.H. HRA 6459\nRegisterbekanntmachung nach dem Umwandlungsgesetz 27.11.2025 (Eintragungsdatum)\n\nJudith Kinze e.K.\nEinzelkaufmann / Einzelkauffrau\nOberursel (Taunus)\n\nDen Gläubigern der an der Ausgliederung beteiligten Rechtsträger ist, wenn sie binnen sechs Monaten nach dem Tag, an dem die Eintragung der Ausgliederung in das Register des Sitzes desjenigen Rechtsträgers, dessen Gläubiger sie sind, nach §§ 125, 19 Absatz 3 UmwG bekannt gemacht worden ist, ihren Anspruch nach Grund und Höhe schriftlich anmelden, Sicherheit zu leisten, soweit sie nicht Befriedigung verlangen können. Dieses Recht steht den Gläubigern jedoch nur zu, wenn sie glaubhaft machen, dass durch die Ausgliederung die Erfüllung ihrer Forderung gefährdet wird."
    },
    {
      "date": "2025-11-27",
      "id": "138534",
      "original_text": "Löschungsankündigung\nHessen Amtsgericht Darmstadt HRB 99158\nImmobau SV & Handels GmbH – Münster",
      "type": "Löschungsankündigung",
      "state": "Hessen",
      "amtsgericht": "Amtsgericht Darmstadt",
      "registernummer": "HRB 99158",
      "registerart": "HRB",
      "company_name": "Immobau SV & Handels GmbH",
      "company_seat": "Münster",
      "details": "27.11.2025 (Bekanntmachungsdatum)\n\nHessen Amtsgericht Darmstadt HRB 99158\nLöschungsankündigung\n\nImmobau SV & Handels GmbH\nGesellschaft mit beschränkter Haftung\nMünster\n\nDas Registergericht beabsichtigt die im Handelsregister eingetragene Gesellschaft von Amts wegen nach § 394 FamFG zu löschen. Die Frist zur Erhebung eines Widerspruchs gegen die beabsichtigte Löschung wird auf 3 Monate festgesetzt."
    },
    {
      "date": "2025-11-27",
      "id": "138535",
      "original_text": "Einreichung neuer Dokumente\nHessen Amtsgericht Kassel HRB 9101\nAirbus Helicopters Technik GmbH – Calden",
      "type": "Einreichung neuer Dokumente",
      "state": "Hessen",
      "amtsgericht": "Amtsgericht Kassel",
      "registernummer": "HRB 9101",
      "registerart": "HRB",
      "company_name": "Airbus Helicopters Technik GmbH",
      "company_seat": "Calden",
      "details": "27.11.2025 (Bekanntmachungsdatum)\n\nHessen Amtsgericht Kassel HRB 9101\nEinreichung neuer Dokumente\n\nAirbus Helicopters Technik GmbH\nGesellschaft mit beschränkter Haftung\nCalden\n\nDurch eine Änderung in den Personen der Aufsichtsratsmitglieder ist eine Liste der Mitglieder des Aufsichtsrates zum Handelsregister eingereicht worden."
    },
    {
      "date": "2025-11-27",
      "id": "138536",
      "original_text": "Löschungsankündigung\nHessen Amtsgericht Königstein HRB 11340\nOTOK GmbH – Kronberg im Taunus",
      "type": "Löschungsankündigung",
      "state": "Hessen",
      "amtsgericht": "Amtsgericht Königstein",
      "registernummer": "HRB 11340",
      "registerart": "HRB",
      "company_name": "OTOK GmbH",
      "company_seat": "Kronberg im Taunus",
      "details": "27.11.2025 (Bekanntmachungsdatum)\n\nHessen Amtsgericht Königstein HRB 11340\nLöschungsankündigung\n\nOTOK GmbH\nGesellschaft mit beschränkter Haftung\nKronberg im Taunus\n\nDas Registergericht beabsichtigt die im Handelsregister eingetragene Gesellschaft von Amts wegen nach § 394 FamFG zu löschen. Die Frist zur Erhebung eines Widerspruchs gegen die beabsichtigte Löschung wird auf 3 Monate festgesetzt."
    },
    {
      "date": "2025-11-27",
      "id": "138537",
      "original_text": "Registerbekanntmachung nach dem Umwandlungsgesetz\nHessen Amtsgericht Frankfurt am Main HRB 135976\naudyos GmbH Wirtschaftsprüfungsgesellschaft – Frankfurt am Main",
      "type": "Registerbekanntmachung nach dem Umwandlungsgesetz",
      "state": "Hessen",
      "amtsgericht": "Amtsgericht Frankfurt am Main",
      "registernummer": "HRB 135976",
      "registerart": "HRB",
      "company_name": "audyos GmbH Wirtschaftsprüfungsgesellschaft",
      "company_seat": "Frankfurt am Main",
      "details": "27.11.2025 (Bekanntmachungsdatum)\n\nHessen Amtsgericht Frankfurt am Main HRB 135976\nRegisterbekanntmachung nach dem Umwandlungsgesetz 27.11.2025 (Eintragungsdatum)\n\naudyos GmbH Wirtschaftsprüfungsgesellschaft\nGesellschaft mit beschränkter Haftung\nFrankfurt am Main\n\nDen Gläubigern der an der Verschmelzung beteiligten Rechtsträger ist, wenn sie binnen sechs Monaten nach dem Tag, an dem die Eintragung der Verschmelzung in das Register des Sitzes desjenigen Rechtsträgers, dessen Gläubiger sie sind, nach § 19 Absatz 3 UmwG bekannt gemacht worden ist, ihren Anspruch nach Grund und Höhe schriftlich anmelden, Sicherheit zu leisten, soweit sie nicht Befriedigung verlangen können. Dieses Recht steht den Gläubigern jedoch nur zu, wenn sie glaubhaft machen, dass durch die Verschmelzung die Erfüllung ihrer Forderung gefährdet wird."
    },
    {
      "date": "2025-11-27",
      "id": "138538",
      "original_text": "Einreichung neuer Dokumente\nHessen Amtsgericht Frankfurt am Main HRB 75707\nHoechst GmbH – Frankfurt am Main",
      "type": "Einreichung neuer Dokumente",
      "state": "Hessen",
      "amtsgericht": "Amtsgericht Frankfurt am Main",
      "registernummer": "HRB 75707",
      "registerart": "HRB",
      "company_name": "Hoechst GmbH",
      "company_seat": "Frankfurt am Main",
      "details": "27.11.2025 (Bekanntmachungsdatum)\n\nHessen Amtsgericht Frankfurt am Main HRB 75707\nEinreichung neuer Dokumente 25.11.2025 (Eintragungsdatum)\n\nHoechst GmbH\nGesellschaft mit beschränkter Haftung\nFrankfurt am Main\n\nDurch eine Änderung in den Personen der Aufsichtsratsmitglieder ist eine Liste der Mitglieder des Aufsichtsrates zum Handelsregister eingereicht worden."
    },
    {
      "date": "2025-11-27",
      "id": "138539",
      "original_text": "Löschungsankündigung\nHessen Amtsgericht Darmstadt HRB 103984\nFalcon Logistik UG (haftungsbeschränkt) – Raunheim",
      "type": "Löschungsankündigung",
      "state": "Hessen",
      "amtsgericht": "Amtsgericht Darmstadt",
      "registernummer": "HRB 103984",
      "registerart": "HRB",
      "company_name": "Falcon Logistik UG (haftungsbeschränkt)",
      "company_seat": "Raunheim",
      "details": "27.11.2025 (Bekanntmachungsdatum)\n\nHessen Amtsgericht Darmstadt HRB 103984\nLöschungsankündigung 27.11.2025 (Eintragungsdatum)\n\nFalcon Logistik UG (haftungsbeschränkt)\nGesellschaft mit beschränkter Haftung\nRaunheim\n\nDas Registergericht beabsichtigt die im Handelsregister eingetragene Gesellschaft von Amts wegen nach § 394 FamFG zu löschen. Die Frist zur Erhebung eines Widerspruchs gegen die beabsichtigte Löschung wird auf 3 Monate festgesetzt."
    },
    {
      "date": "2025-11-27",
      "id": "138540",
      "original_text": "Registerbekanntmachung nach dem Umwandlungsgesetz\nHessen Amtsgericht Marburg GsR 192\nLaufersweiler eGbR – Frielendorf",
      "type": "Registerbekanntmachung nach dem Umwandlungsgesetz",
      "state": "Hessen",
      "amtsgericht": "Amtsgericht Marburg",
      "registernummer": "GsR 192",
      "registerart": "GsR",
      "company_name": "Laufersweiler eGbR",
      "company_seat": "Frielendorf",
      "details": "27.11.2025 (Bekanntmachungsdatum)\n\nHessen Amtsgericht Marburg GsR 192\nRegisterbekanntmachung nach dem Umwandlungsgesetz 27.11.2025 (Eintragungsdatum)\n\nLaufersweiler eGbR\nGesellschaft bürgerlichen Rechts\nFrielendorf\n\nDen Gläubigern der an der formwechselnden Umwandlung beteiligten Rechtsträger ist, wenn sie binnen sechs Monaten nach dem Tag, an dem die Eintragung der formwechselnden Umwandlung in das Register des Sitzes desjenigen Rechtsträgers, dessen Gläubiger sie sind, nach § 201 UmwG bekannt gemacht worden ist, ihren Anspruch nach Grund und Höhe schriftlich anmelden, Sicherheit zu leisten, soweit sie nicht Befriedigung verlangen können. Dieses Recht steht den Gläubigern jedoch nur zu, wenn sie glaubhaft machen, dass durch die formwechselnden Umwandlung die Erfüllung ihrer Forderung gefährdet wird."
    },
    {
      "date": "2025-11-27",
      "id": "138541",
      "original_text": "Registerbekanntmachung nach dem Umwandlungsgesetz\nSachsen Amtsgericht Leipzig HRB 30308\nMIB Projekt THN Nürnberg GmbH – Leipzig",
      "type": "Registerbekanntmachung nach dem Umwandlungsgesetz",
      "state": "Sachsen",
      "amtsgericht": "Amtsgericht Leipzig",
      "registernummer": "HRB 30308",
      "registerart": "HRB",
      "company_name": "MIB Projekt THN Nürnberg GmbH",
      "company_seat": "Leipzig",
      "details": "27.11.2025 (Bekanntmachungsdatum)\n\nSachsen Amtsgericht Leipzig HRB 30308\nRegisterbekanntmachung nach dem Umwandlungsgesetz 27.11.2025 (Eintragungsdatum)\n\nMIB Projekt THN Nürnberg GmbH\nGesellschaft mit beschränkter Haftung\nLeipzig\n\nDen Gläubigern der an der Verschmelzung beteiligten Rechtsträger ist, wenn sie binnen sechs Monaten nach dem Tag, an dem die Eintragung der Verschmelzung in das Register des Sitzes desjenigen Rechtsträgers, dessen Gläubiger sie sind, nach § 19 Abs. 3 UmwG als bekannt gemacht gilt, ihren Anspruch nach Grund und Höhe in Textform anmelden, Sicherheit zu leisten, soweit sie nicht Befriedigung verlangen können. Dieses Recht steht den Gläubigern jedoch nur zu, wenn sie glaubhaft machen, dass durch die Verschmelzung die Erfüllung der Forderung gefährdet wird."
    }
  ]
}