{
  "date": "2025-11-05",
  "date_of_scrape": "2025-11-06T04:13:52.970Z",
  "tool_version": "0.2.0",
  "number_of_announcements": 136,
  "announcements": [
    {
      "date": "2025-11-05",
      "id": "136305",
      "original_text": "Sonstige Registerbekanntmachung\nHessen Amtsgericht Fritzlar HRB 2106\nBad Wildunger Kraftwagenverkehrs- und Wasserversorgungsgesellschaft mbH ( BKW ) – Bad Wildungen",
      "type": "Sonstige Registerbekanntmachung",
      "state": "Hessen",
      "amtsgericht": "Amtsgericht Fritzlar",
      "registernummer": "HRB 2106",
      "registerart": "HRB",
      "company_name": "Bad Wildunger Kraftwagenverkehrs- und Wasserversorgungsgesellschaft mbH ( BKW )",
      "company_seat": "Bad Wildungen",
      "details": "05.11.2025 (Bekanntmachungsdatum)\n\nHessen Amtsgericht Fritzlar HRB 2106\nSonstige Registerbekanntmachung 08.08.2022 (Eintragungsdatum)\n\nBad Wildunger Kraftwagenverkehrs- und Wasserversorgungsgesellschaft mbH ( BKW )\nGesellschaft mit beschränkter Haftung\nBad Wildungen\n\nDurch eine Änderung in den Personen der Aufsichtsratsmitglieder ist eine Liste der Mitglieder des Aufsichtsrates zum Handelsregister eingereicht worden."
    },
    {
      "date": "2025-11-05",
      "id": "136306",
      "original_text": "Registerbekanntmachung nach dem Umwandlungsgesetz\nBayern Amtsgericht Coburg HRB 6518\nBächlein GmbH – Coburg",
      "type": "Registerbekanntmachung nach dem Umwandlungsgesetz",
      "state": "Bayern",
      "amtsgericht": "Amtsgericht Coburg",
      "registernummer": "HRB 6518",
      "registerart": "HRB",
      "company_name": "Bächlein GmbH",
      "company_seat": "Coburg",
      "details": "05.11.2025 (Bekanntmachungsdatum)\n\nBayern Amtsgericht Coburg HRB 6518\nRegisterbekanntmachung nach dem Umwandlungsgesetz 31.10.2025 (Eintragungsdatum)\n\nBächlein GmbH\nGesellschaft mit beschränkter Haftung\nCoburg\n\nDen Gläubigern der an der Verschmelzung beteiligten Rechtsträger ist, wenn sie binnen sechs Monaten nach dem Tag, an dem die Eintragung der Verschmelzung in das Register des Sitzes desjenigen Rechtsträgers, dessen Gläubiger sie sind, nach § 19 Abs. 3 UmwG als bekannt gemacht gilt, ihren Anspruch nach Grund und Höhe in Textform anmelden, Sicherheit zu leisten, soweit sie nicht Befriedigung verlangen können. Dieses Recht steht den Gläubigern jedoch nur zu, wenn sie glaubhaft machen, dass durch die Verschmelzung die Erfüllung ihrer Forderung gefährdet wird."
    },
    {
      "date": "2025-11-05",
      "id": "136307",
      "original_text": "Registerbekanntmachung nach dem Umwandlungsgesetz\nBayern Amtsgericht Coburg HRB 7408\nGößweinsteiner Lebkuchen GmbH – Coburg",
      "type": "Registerbekanntmachung nach dem Umwandlungsgesetz",
      "state": "Bayern",
      "amtsgericht": "Amtsgericht Coburg",
      "registernummer": "HRB 7408",
      "registerart": "HRB",
      "company_name": "Gößweinsteiner Lebkuchen GmbH",
      "company_seat": "Coburg",
      "details": "05.11.2025 (Bekanntmachungsdatum)\n\nBayern Amtsgericht Coburg HRB 7408\nRegisterbekanntmachung nach dem Umwandlungsgesetz 31.10.2025 (Eintragungsdatum)\n\nGößweinsteiner Lebkuchen GmbH\nGesellschaft mit beschränkter Haftung\nCoburg\n\nDen Gläubigern der an der Verschmelzung beteiligten Rechtsträger ist, wenn sie binnen sechs Monaten nach dem Tag, an dem die Eintragung der Verschmelzung in das Register des Sitzes desjenigen Rechtsträgers, dessen Gläubiger sie sind, nach § 19 Abs. 3 UmwG als bekannt gemacht gilt, ihren Anspruch nach Grund und Höhe in Textform anmelden, Sicherheit zu leisten, soweit sie nicht Befriedigung verlangen können. Dieses Recht steht den Gläubigern jedoch nur zu, wenn sie glaubhaft machen, dass durch die Verschmelzung die Erfüllung ihrer Forderung gefährdet wird."
    },
    {
      "date": "2025-11-05",
      "id": "136308",
      "original_text": "Sonstige Registerbekanntmachung\nBayern Amtsgericht Bayreuth HRB 8089\nDaheim Pflege GmbH – Presseck",
      "type": "Sonstige Registerbekanntmachung",
      "state": "Bayern",
      "amtsgericht": "Amtsgericht Bayreuth",
      "registernummer": "HRB 8089",
      "registerart": "HRB",
      "company_name": "Daheim Pflege GmbH",
      "company_seat": "Presseck",
      "details": "05.11.2025 (Bekanntmachungsdatum)\n\nBayern Amtsgericht Bayreuth HRB 8089\nSonstige Registerbekanntmachung 04.11.2025 (Eintragungsdatum)\n\nDaheim Pflege GmbH\nGesellschaft mit beschränkter Haftung\nPresseck\n\nDen Gläubigern der an der Verschmelzung beteiligten Rechtsträger ist, wenn sie binnen sechs Monaten nach dem Tag, an dem die Eintragung der Verschmelzung in das Register des Sitzes desjenigen Rechtsträgers, dessen Gläubiger sie sind, nach § 19 Abs. 3 UmwG als bekannt gemacht gilt, ihren Anspruch nach Grund und Höhe in Textform anmelden, Sicherheit zu leisten, soweit sie nicht Befriedigung verlangen können. Dieses Recht steht den Gläubigern jedoch nur zu, wenn sie glaubhaft machen, dass durch die Verschmelzung die Erfüllung ihrer Forderung gefährdet wird."
    },
    {
      "date": "2025-11-05",
      "id": "136309",
      "original_text": "Einreichung neuer Dokumente\nBayern Amtsgericht München HRB 247494\nver.de Projektgesellschaft AG – München",
      "type": "Einreichung neuer Dokumente",
      "state": "Bayern",
      "amtsgericht": "Amtsgericht München",
      "registernummer": "HRB 247494",
      "registerart": "HRB",
      "company_name": "ver.de Projektgesellschaft AG",
      "company_seat": "München",
      "details": "05.11.2025 (Bekanntmachungsdatum)\n\nBayern Amtsgericht München HRB 247494\nEinreichung neuer Dokumente\n\nver.de Projektgesellschaft AG\nAktiengesellschaft\nMünchen\n\nDem Amtsgericht München -Registergericht- ist eine Liste der Mitglieder des Aufsichtsrats eingereicht worden, § 106 AktG."
    },
    {
      "date": "2025-11-05",
      "id": "136310",
      "original_text": "Registerbekanntmachung nach dem Umwandlungsgesetz\nBayern Amtsgericht München HRB 190698\nP.M. Verwaltungs- und Vertriebsgesellschaft Parsdorf mbH – Vaterstetten",
      "type": "Registerbekanntmachung nach dem Umwandlungsgesetz",
      "state": "Bayern",
      "amtsgericht": "Amtsgericht München",
      "registernummer": "HRB 190698",
      "registerart": "HRB",
      "company_name": "P.M. Verwaltungs- und Vertriebsgesellschaft Parsdorf mbH",
      "company_seat": "Vaterstetten",
      "details": "05.11.2025 (Bekanntmachungsdatum)\n\nBayern Amtsgericht München HRB 190698\nRegisterbekanntmachung nach dem Umwandlungsgesetz 04.11.2025 (Eintragungsdatum)\n\nP.M. Verwaltungs- und Vertriebsgesellschaft Parsdorf mbH\nGesellschaft mit beschränkter Haftung\nVaterstetten\n\nDen Gläubigern der an der Verschmelzung beteiligten Rechtsträger ist, wenn sie binnen sechs Monaten nach dem Tag, an dem die Eintragung der Verschmelzung in das Register des Sitzes desjenigen Rechtsträgers, dessen Gläubiger sie sind, nach § 19 Abs. 3 UmwG als bekannt gemacht gilt, ihren Anspruch nach Grund und Höhe in Textform anmelden, Sicherheit zu leisten, soweit sie nicht Befriedigung verlangen können. Dieses Recht steht den Gläubigern jedoch nur zu, wenn sie glaubhaft machen, dass durch die Verschmelzung die Erfüllung ihrer Forderung gefährdet wird."
    },
    {
      "date": "2025-11-05",
      "id": "136311",
      "original_text": "Registerbekanntmachung nach dem Umwandlungsgesetz\nBayern Amtsgericht München HRA 101058\nGoLocal GmbH & Co. KG – München",
      "type": "Registerbekanntmachung nach dem Umwandlungsgesetz",
      "state": "Bayern",
      "amtsgericht": "Amtsgericht München",
      "registernummer": "HRA 101058",
      "registerart": "HRA",
      "company_name": "GoLocal GmbH & Co. KG",
      "company_seat": "München",
      "details": "05.11.2025 (Bekanntmachungsdatum)\n\nBayern Amtsgericht München HRA 101058\nRegisterbekanntmachung nach dem Umwandlungsgesetz 04.11.2025 (Eintragungsdatum)\n\nGoLocal GmbH & Co. KG\nKommanditgesellschaft\nMünchen\n\nDen Gläubigern der an der Verschmelzung beteiligten Rechtsträger ist, wenn sie binnen sechs Monaten nach dem Tag, an dem die Eintragung der Verschmelzung in das Register des Sitzes desjenigen Rechtsträgers, dessen Gläubiger sie sind, nach § 19 Abs. 3 UmwG als bekannt gemacht gilt, ihren Anspruch nach Grund und Höhe in Textform anmelden, Sicherheit zu leisten, soweit sie nicht Befriedigung verlangen können. Dieses Recht steht den Gläubigern jedoch nur zu, wenn sie glaubhaft machen, dass durch die Verschmelzung die Erfüllung ihrer Forderung gefährdet wird."
    },
    {
      "date": "2025-11-05",
      "id": "136312",
      "original_text": "Löschungsankündigung\nBayern Amtsgericht Coburg HRB 6842\nTranspo-Service UG (haftungsbeschränkt) – Rödental",
      "type": "Löschungsankündigung",
      "state": "Bayern",
      "amtsgericht": "Amtsgericht Coburg",
      "registernummer": "HRB 6842",
      "registerart": "HRB",
      "company_name": "Transpo-Service UG (haftungsbeschränkt)",
      "company_seat": "Rödental",
      "details": "05.11.2025 (Bekanntmachungsdatum)\n\nBayern Amtsgericht Coburg HRB 6842\nLöschungsankündigung 03.11.2025 (Eintragungsdatum)\n\nTranspo-Service UG (haftungsbeschränkt)\nGesellschaft mit beschränkter Haftung\nRödental\n\nDas Registergericht beabsichtigt, die im Handelsregister eingetragene Gesellschaft wegen Vermögenslosigkeit von Amts wegen nach § 394 FamFG zu löschen. Die Frist zur Erhebung eines Widerspruchs ist auf sechs Wochen festgesetzt."
    },
    {
      "date": "2025-11-05",
      "id": "136313",
      "original_text": "Sonstige Registerbekanntmachung\nBayern Amtsgericht Augsburg HRB 20259\nWIRTGEN Deutschland Vertriebs- und Service GmbH – Augsburg",
      "type": "Sonstige Registerbekanntmachung",
      "state": "Bayern",
      "amtsgericht": "Amtsgericht Augsburg",
      "registernummer": "HRB 20259",
      "registerart": "HRB",
      "company_name": "WIRTGEN Deutschland Vertriebs- und Service GmbH",
      "company_seat": "Augsburg",
      "details": "05.11.2025 (Bekanntmachungsdatum)\n\nBayern Amtsgericht Augsburg HRB 20259\nSonstige Registerbekanntmachung 04.11.2025 (Eintragungsdatum)\n\nWIRTGEN Deutschland Vertriebs- und Service GmbH\nGesellschaft mit beschränkter Haftung\nAugsburg\n\nDen Gläubigern der Gesellschaft, deren Forderungen begründet worden sind, bevor die Eintragung der Beendigung des Gewinnabführungsvertrages in das Handelsregister nach § 10 des Handelsgesetzbuches als bekanntgemacht gilt, hat der andere Vertragsteil Sicherheit zu leisten, wenn sie sich binnen sechs Monaten nach der Bekanntmachung der Eintragung zu diesem Zweck bei ihm melden."
    },
    {
      "date": "2025-11-05",
      "id": "136314",
      "original_text": "Löschungsankündigung\nBayern Amtsgericht München HRB 259455\nTAJ Trading UG (haftungsbeschränkt) – München",
      "type": "Löschungsankündigung",
      "state": "Bayern",
      "amtsgericht": "Amtsgericht München",
      "registernummer": "HRB 259455",
      "registerart": "HRB",
      "company_name": "TAJ Trading UG (haftungsbeschränkt)",
      "company_seat": "München",
      "details": "05.11.2025 (Bekanntmachungsdatum)\n\nBayern Amtsgericht München HRB 259455\nLöschungsankündigung 04.11.2025 (Eintragungsdatum)\n\nTAJ Trading UG (haftungsbeschränkt)\nGesellschaft mit beschränkter Haftung\nMünchen\n\nDas Registergericht beabsichtigt, die im Handelsregister eingetragene Gesellschaft wegen Vermögenslosigkeit von Amts wegen nach § 394 FamFG zu löschen. Die Frist zur Erhebung eines Widerspruchs ist auf drei Monate festgesetzt."
    },
    {
      "date": "2025-11-05",
      "id": "136315",
      "original_text": "Registerbekanntmachung nach dem Umwandlungsgesetz\nBayern Amtsgericht Würzburg HRB 15136\nFLYERALARM Trading GmbH – Würzburg",
      "type": "Registerbekanntmachung nach dem Umwandlungsgesetz",
      "state": "Bayern",
      "amtsgericht": "Amtsgericht Würzburg",
      "registernummer": "HRB 15136",
      "registerart": "HRB",
      "company_name": "FLYERALARM Trading GmbH",
      "company_seat": "Würzburg",
      "details": "05.11.2025 (Bekanntmachungsdatum)\n\nBayern Amtsgericht Würzburg HRB 15136\nRegisterbekanntmachung nach dem Umwandlungsgesetz 04.11.2025 (Eintragungsdatum)\n\nFLYERALARM Trading GmbH\nGesellschaft mit beschränkter Haftung\nWürzburg\n\nDen Gläubigern der an der Verschmelzung beteiligten Rechtsträger ist, wenn sie binnen sechs Monaten nach dem Tag, an dem die Eintragung der Verschmelzung in das Register des Sitzes desjenigen Rechtsträgers, dessen Gläubiger sie sind, nach § 19 Abs. 3 UmwG als bekannt gemacht gilt, ihren Anspruch nach Grund und Höhe in Textform anmelden, Sicherheit zu leisten, soweit sie nicht Befriedigung verlangen können. Dieses Recht steht den Gläubigern jedoch nur zu, wenn sie glaubhaft machen, dass durch die Verschmelzung die Erfüllung ihrer Forderung gefährdet wird."
    },
    {
      "date": "2025-11-05",
      "id": "136316",
      "original_text": "Registerbekanntmachung nach dem Umwandlungsgesetz\nBayern Amtsgericht Würzburg HRB 17792\nRoklife UG (haftungsbeschränkt) – Würzburg",
      "type": "Registerbekanntmachung nach dem Umwandlungsgesetz",
      "state": "Bayern",
      "amtsgericht": "Amtsgericht Würzburg",
      "registernummer": "HRB 17792",
      "registerart": "HRB",
      "company_name": "Roklife UG (haftungsbeschränkt)",
      "company_seat": "Würzburg",
      "details": "05.11.2025 (Bekanntmachungsdatum)\n\nBayern Amtsgericht Würzburg HRB 17792\nRegisterbekanntmachung nach dem Umwandlungsgesetz 04.11.2025 (Eintragungsdatum)\n\nRoklife UG (haftungsbeschränkt)\nGesellschaft mit beschränkter Haftung\nWürzburg\n\nDen Gläubigern der an der Verschmelzung beteiligten Rechtsträger ist, wenn sie binnen sechs Monaten nach dem Tag, an dem die Eintragung der Verschmelzung in das Register des Sitzes desjenigen Rechtsträgers, dessen Gläubiger sie sind, nach § 19 Abs. 3 UmwG als bekannt gemacht gilt, ihren Anspruch nach Grund und Höhe in Textform anmelden, Sicherheit zu leisten, soweit sie nicht Befriedigung verlangen können. Dieses Recht steht den Gläubigern jedoch nur zu, wenn sie glaubhaft machen, dass durch die Verschmelzung die Erfüllung ihrer Forderung gefährdet wird."
    },
    {
      "date": "2025-11-05",
      "id": "136317",
      "original_text": "Registerbekanntmachung nach dem Umwandlungsgesetz\nBayern Amtsgericht München HRB 168471\nAkilinda Vermögensverwaltungs GmbH – Gräfelfing",
      "type": "Registerbekanntmachung nach dem Umwandlungsgesetz",
      "state": "Bayern",
      "amtsgericht": "Amtsgericht München",
      "registernummer": "HRB 168471",
      "registerart": "HRB",
      "company_name": "Akilinda Vermögensverwaltungs GmbH",
      "company_seat": "Gräfelfing",
      "details": "05.11.2025 (Bekanntmachungsdatum)\n\nBayern Amtsgericht München HRB 168471\nRegisterbekanntmachung nach dem Umwandlungsgesetz 04.11.2025 (Eintragungsdatum)\n\nAkilinda Vermögensverwaltungs GmbH\nGesellschaft mit beschränkter Haftung\nGräfelfing\n\nDen Gläubigern der an der Verschmelzung beteiligten Rechtsträger ist, wenn sie binnen sechs Monaten nach dem Tag, an dem die Eintragung der Verschmelzung in das Register des Sitzes desjenigen Rechtsträgers, dessen Gläubiger sie sind, nach § 19 Abs. 3 UmwG als bekannt gemacht gilt, ihren Anspruch nach Grund und Höhe in Textform anmelden, Sicherheit zu leisten, soweit sie nicht Befriedigung verlangen können. Dieses Recht steht den Gläubigern jedoch nur zu, wenn sie glaubhaft machen, dass durch die Verschmelzung die Erfüllung ihrer Forderung gefährdet wird."
    },
    {
      "date": "2025-11-05",
      "id": "136318",
      "original_text": "Einreichung neuer Dokumente\nBayern Amtsgericht Hof HRB 3167\nGemeinhardt AG - HEIZUNG-SOLAR-BAD – Oberkotzau",
      "type": "Einreichung neuer Dokumente",
      "state": "Bayern",
      "amtsgericht": "Amtsgericht Hof",
      "registernummer": "HRB 3167",
      "registerart": "HRB",
      "company_name": "Gemeinhardt AG - HEIZUNG-SOLAR-BAD",
      "company_seat": "Oberkotzau",
      "details": "05.11.2025 (Bekanntmachungsdatum)\n\nBayern Amtsgericht Hof HRB 3167\nEinreichung neuer Dokumente\n\nGemeinhardt AG - HEIZUNG-SOLAR-BAD\nAktiengesellschaft\nOberkotzau\n\nDem Amtsgericht Hof -Registergericht- ist eine Liste der Mitglieder des Aufsichtsrats eingereicht worden, § 106 AktG."
    },
    {
      "date": "2025-11-05",
      "id": "136319",
      "original_text": "Löschungsankündigung\nBayern Amtsgericht München HRB 284902\nPharmAI GmbH – Grünwald",
      "type": "Löschungsankündigung",
      "state": "Bayern",
      "amtsgericht": "Amtsgericht München",
      "registernummer": "HRB 284902",
      "registerart": "HRB",
      "company_name": "PharmAI GmbH",
      "company_seat": "Grünwald",
      "details": "05.11.2025 (Bekanntmachungsdatum)\n\nBayern Amtsgericht München HRB 284902\nLöschungsankündigung 04.11.2025 (Eintragungsdatum)\n\nPharmAI GmbH\nGesellschaft mit beschränkter Haftung\nGrünwald\n\nDas Registergericht beabsichtigt, die im Handelsregister eingetragene Gesellschaft wegen Vermögenslosigkeit von Amts wegen nach § 394 FamFG zu löschen. Die Frist zur Erhebung eines Widerspruchs ist auf drei Monate festgesetzt."
    },
    {
      "date": "2025-11-05",
      "id": "136320",
      "original_text": "Löschungsankündigung\nBayern Amtsgericht Landshut HRB 11311\nMoser Parts GmbH – Mengkofen",
      "type": "Löschungsankündigung",
      "state": "Bayern",
      "amtsgericht": "Amtsgericht Landshut",
      "registernummer": "HRB 11311",
      "registerart": "HRB",
      "company_name": "Moser Parts GmbH",
      "company_seat": "Mengkofen",
      "details": "05.11.2025 (Bekanntmachungsdatum)\n\nBayern Amtsgericht Landshut HRB 11311\nLöschungsankündigung\n\nMoser Parts GmbH\nGesellschaft mit beschränkter Haftung\nMengkofen\n\nDas Registergericht beabsichtigt, die im Handelsregister eingetragene Gesellschaft wegen Vermögenslosigkeit von Amts wegen nach § 394 FamFG zu löschen. Die Frist zur Erhebung eines Widerspruchs ist auf einen Monat festgesetzt."
    },
    {
      "date": "2025-11-05",
      "id": "136321",
      "original_text": "Registerbekanntmachung nach dem Umwandlungsgesetz\nBayern Amtsgericht München HRB 289472\nUniCredit Bank GmbH – München",
      "type": "Registerbekanntmachung nach dem Umwandlungsgesetz",
      "state": "Bayern",
      "amtsgericht": "Amtsgericht München",
      "registernummer": "HRB 289472",
      "registerart": "HRB",
      "company_name": "UniCredit Bank GmbH",
      "company_seat": "München",
      "details": "05.11.2025 (Bekanntmachungsdatum)\n\nBayern Amtsgericht München HRB 289472\nRegisterbekanntmachung nach dem Umwandlungsgesetz 04.11.2025 (Eintragungsdatum)\n\nUniCredit Bank GmbH\nGesellschaft mit beschränkter Haftung\nMünchen\n\nDen Gläubigern der an der Verschmelzung beteiligten Rechtsträger ist, wenn sie binnen sechs Monaten nach dem Tag, an dem die Eintragung der Verschmelzung in das Register des Sitzes desjenigen Rechtsträgers, dessen Gläubiger sie sind, nach § 19 Abs. 3 UmwG als bekannt gemacht gilt, ihren Anspruch nach Grund und Höhe in Textform anmelden, Sicherheit zu leisten, soweit sie nicht Befriedigung verlangen können. Dieses Recht steht den Gläubigern jedoch nur zu, wenn sie glaubhaft machen, dass durch die Verschmelzung die Erfüllung ihrer Forderung gefährdet wird."
    },
    {
      "date": "2025-11-05",
      "id": "136322",
      "original_text": "Einreichung neuer Dokumente\nBayern Amtsgericht Landshut HRB 5133\nStadtwerke Eggenfelden GmbH – Eggenfelden",
      "type": "Einreichung neuer Dokumente",
      "state": "Bayern",
      "amtsgericht": "Amtsgericht Landshut",
      "registernummer": "HRB 5133",
      "registerart": "HRB",
      "company_name": "Stadtwerke Eggenfelden GmbH",
      "company_seat": "Eggenfelden",
      "details": "05.11.2025 (Bekanntmachungsdatum)\n\nBayern Amtsgericht Landshut HRB 5133\nEinreichung neuer Dokumente\n\nStadtwerke Eggenfelden GmbH\nGesellschaft mit beschränkter Haftung\nEggenfelden\n\nDem Amtsgericht Landshut -Registergericht- ist eine Liste der Mitglieder des Aufsichtsrats eingereicht worden, § 52 Abs. 3 S. 2 GmbHG."
    },
    {
      "date": "2025-11-05",
      "id": "136323",
      "original_text": "Löschungsankündigung\nBayern Amtsgericht München HRB 166929\nPEF Einsteinstraße Verwaltungs GmbH – München",
      "type": "Löschungsankündigung",
      "state": "Bayern",
      "amtsgericht": "Amtsgericht München",
      "registernummer": "HRB 166929",
      "registerart": "HRB",
      "company_name": "PEF Einsteinstraße Verwaltungs GmbH",
      "company_seat": "München",
      "details": "05.11.2025 (Bekanntmachungsdatum)\n\nBayern Amtsgericht München HRB 166929\nLöschungsankündigung 04.11.2025 (Eintragungsdatum)\n\nPEF Einsteinstraße Verwaltungs GmbH\nGesellschaft mit beschränkter Haftung\nMünchen\n\nDas Registergericht beabsichtigt, die im Handelsregister eingetragene Gesellschaft wegen Vermögenslosigkeit von Amts wegen nach § 394 FamFG zu löschen. Die Frist zur Erhebung eines Widerspruchs ist auf drei Monate festgesetzt."
    },
    {
      "date": "2025-11-05",
      "id": "136324",
      "original_text": "Registerbekanntmachung nach dem Umwandlungsgesetz\nBayern Amtsgericht Coburg HRB 5722\nSiegfried Schunk Verwaltungs GmbH – Coburg",
      "type": "Registerbekanntmachung nach dem Umwandlungsgesetz",
      "state": "Bayern",
      "amtsgericht": "Amtsgericht Coburg",
      "registernummer": "HRB 5722",
      "registerart": "HRB",
      "company_name": "Siegfried Schunk Verwaltungs GmbH",
      "company_seat": "Coburg",
      "details": "05.11.2025 (Bekanntmachungsdatum)\n\nBayern Amtsgericht Coburg HRB 5722\nRegisterbekanntmachung nach dem Umwandlungsgesetz 04.11.2025 (Eintragungsdatum)\n\nSiegfried Schunk Verwaltungs GmbH\nGesellschaft mit beschränkter Haftung\nCoburg\n\nDen Gläubigern der an der Verschmelzung beteiligten Rechtsträger ist, wenn sie binnen sechs Monaten nach dem Tag, an dem die Eintragung der Verschmelzung in das Register des Sitzes desjenigen Rechtsträgers, dessen Gläubiger sie sind, nach § 19 Abs. 3 UmwG als bekannt gemacht gilt, ihren Anspruch nach Grund und Höhe in Textform anmelden, Sicherheit zu leisten, soweit sie nicht Befriedigung verlangen können. Dieses Recht steht den Gläubigern jedoch nur zu, wenn sie glaubhaft machen, dass durch die Verschmelzung die Erfüllung ihrer Forderung gefährdet wird."
    },
    {
      "date": "2025-11-05",
      "id": "136325",
      "original_text": "Sonstige Registerbekanntmachung\nBayern Amtsgericht München HRB 302285\nbauwo Log GmbH – Grünwald",
      "type": "Sonstige Registerbekanntmachung",
      "state": "Bayern",
      "amtsgericht": "Amtsgericht München",
      "registernummer": "HRB 302285",
      "registerart": "HRB",
      "company_name": "bauwo Log GmbH",
      "company_seat": "Grünwald",
      "details": "05.11.2025 (Bekanntmachungsdatum)\n\nBayern Amtsgericht München HRB 302285\nSonstige Registerbekanntmachung 04.11.2025 (Eintragungsdatum)\n\nbauwo Log GmbH\nGesellschaft mit beschränkter Haftung\nGrünwald\n\nDen Gläubigern der Gesellschaft, deren Forderungen begründet worden sind, bevor die Eintragung der Beendigung des Beherrschungs- und Gewinnabführungsvertrages in das Handelsregister nach § 10 des Handelsgesetzbuches als bekanntgemacht gilt, hat der andere Vertragsteil Sicherheit zu leisten, wenn sie sich binnen sechs Monaten nach der Bekanntmachung der Eintragung zu diesem Zweck bei ihm melden."
    },
    {
      "date": "2025-11-05",
      "id": "136326",
      "original_text": "Registerbekanntmachung nach dem Umwandlungsgesetz\nBayern Amtsgericht München HRB 53649\nHVB Verwa 4 GmbH – München",
      "type": "Registerbekanntmachung nach dem Umwandlungsgesetz",
      "state": "Bayern",
      "amtsgericht": "Amtsgericht München",
      "registernummer": "HRB 53649",
      "registerart": "HRB",
      "company_name": "HVB Verwa 4 GmbH",
      "company_seat": "München",
      "details": "05.11.2025 (Bekanntmachungsdatum)\n\nBayern Amtsgericht München HRB 53649\nRegisterbekanntmachung nach dem Umwandlungsgesetz 04.11.2025 (Eintragungsdatum)\n\nHVB Verwa 4 GmbH\nGesellschaft mit beschränkter Haftung\nMünchen\n\nDen Gläubigern der an der Verschmelzung beteiligten Rechtsträger ist, wenn sie binnen sechs Monaten nach dem Tag, an dem die Eintragung der Verschmelzung in das Register des Sitzes desjenigen Rechtsträgers, dessen Gläubiger sie sind, nach § 19 Abs. 3 UmwG als bekannt gemacht gilt, ihren Anspruch nach Grund und Höhe in Textform anmelden, Sicherheit zu leisten, soweit sie nicht Befriedigung verlangen können. Dieses Recht steht den Gläubigern jedoch nur zu, wenn sie glaubhaft machen, dass durch die Verschmelzung die Erfüllung ihrer Forderung gefährdet wird."
    },
    {
      "date": "2025-11-05",
      "id": "136327",
      "original_text": "Löschungsankündigung\nBayern Amtsgericht München HRB 275793\nSPS Achtundvierzig Management GmbH – München",
      "type": "Löschungsankündigung",
      "state": "Bayern",
      "amtsgericht": "Amtsgericht München",
      "registernummer": "HRB 275793",
      "registerart": "HRB",
      "company_name": "SPS Achtundvierzig Management GmbH",
      "company_seat": "München",
      "details": "05.11.2025 (Bekanntmachungsdatum)\n\nBayern Amtsgericht München HRB 275793\nLöschungsankündigung\n\nSPS Achtundvierzig Management GmbH\nGesellschaft mit beschränkter Haftung\nMünchen\n\nDas Registergericht beabsichtigt, die im Handelsregister eingetragene Gesellschaft wegen Vermögenslosigkeit von Amts wegen nach § 394 FamFG zu löschen. Die Frist zur Erhebung eines Widerspruchs ist auf drei Monate festgesetzt."
    },
    {
      "date": "2025-11-05",
      "id": "136328",
      "original_text": "Registerbekanntmachung nach dem Umwandlungsgesetz\nBayern Amtsgericht München HRB 301571\nMontessori-Schule Dachau gGmbH private Volksschule (Grund- und Hauptschule mit M-Zug) – Dachau",
      "type": "Registerbekanntmachung nach dem Umwandlungsgesetz",
      "state": "Bayern",
      "amtsgericht": "Amtsgericht München",
      "registernummer": "HRB 301571",
      "registerart": "HRB",
      "company_name": "Montessori-Schule Dachau gGmbH private Volksschule (Grund- und Hauptschule mit M-Zug)",
      "company_seat": "Dachau",
      "details": "05.11.2025 (Bekanntmachungsdatum)\n\nBayern Amtsgericht München HRB 301571\nRegisterbekanntmachung nach dem Umwandlungsgesetz 04.11.2025 (Eintragungsdatum)\n\nMontessori-Schule Dachau gGmbH private Volksschule (Grund- und Hauptschule mit M-Zug)\nGesellschaft mit beschränkter Haftung\nDachau\n\nDen Gläubigern der an der Ausgliederung beteiligten Rechtsträger ist, wenn sie binnen sechs Monaten nach dem Tag, an dem die Eintragung der Ausgliederung in das Register des Sitzes desjenigen Rechtsträgers, dessen Gläubiger sie sind, nach §§ 125, 19 Abs. 3 UmwG als bekannt gemacht gilt, ihren Anspruch nach Grund und Höhe in Textform anmelden, Sicherheit zu leisten, soweit sie nicht Befriedigung verlangen können. Dieses Recht steht den Gläubigern jedoch nur zu, wenn sie glaubhaft machen, dass durch die Ausgliederung die Erfüllung ihrer Forderung gefährdet wird."
    },
    {
      "date": "2025-11-05",
      "id": "136329",
      "original_text": "Registerbekanntmachung nach dem Umwandlungsgesetz\nBayern Amtsgericht Coburg HRA 4977\nSchunk Industriebedarf GmbH & Co. KG – Coburg",
      "type": "Registerbekanntmachung nach dem Umwandlungsgesetz",
      "state": "Bayern",
      "amtsgericht": "Amtsgericht Coburg",
      "registernummer": "HRA 4977",
      "registerart": "HRA",
      "company_name": "Schunk Industriebedarf GmbH & Co. KG",
      "company_seat": "Coburg",
      "details": "05.11.2025 (Bekanntmachungsdatum)\n\nBayern Amtsgericht Coburg HRA 4977\nRegisterbekanntmachung nach dem Umwandlungsgesetz 04.11.2025 (Eintragungsdatum)\n\nSchunk Industriebedarf GmbH & Co. KG\nKommanditgesellschaft\nCoburg\n\nDen Gläubigern der an der Verschmelzung beteiligten Rechtsträger ist, wenn sie binnen sechs Monaten nach dem Tag, an dem die Eintragung der Verschmelzung in das Register des Sitzes desjenigen Rechtsträgers, dessen Gläubiger sie sind, nach § 19 Abs. 3 UmwG als bekannt gemacht gilt, ihren Anspruch nach Grund und Höhe in Textform anmelden, Sicherheit zu leisten, soweit sie nicht Befriedigung verlangen können. Dieses Recht steht den Gläubigern jedoch nur zu, wenn sie glaubhaft machen, dass durch die Verschmelzung die Erfüllung ihrer Forderung gefährdet wird."
    },
    {
      "date": "2025-11-05",
      "id": "136330",
      "original_text": "Registerbekanntmachung nach dem Umwandlungsgesetz\nBayern Amtsgericht München HRB 245876\nIncyton GmbH – Planegg",
      "type": "Registerbekanntmachung nach dem Umwandlungsgesetz",
      "state": "Bayern",
      "amtsgericht": "Amtsgericht München",
      "registernummer": "HRB 245876",
      "registerart": "HRB",
      "company_name": "Incyton GmbH",
      "company_seat": "Planegg",
      "details": "05.11.2025 (Bekanntmachungsdatum)\n\nBayern Amtsgericht München HRB 245876\nRegisterbekanntmachung nach dem Umwandlungsgesetz 04.11.2025 (Eintragungsdatum)\n\nIncyton GmbH\nGesellschaft mit beschränkter Haftung\nPlanegg\n\nDen Gläubigern der an der Verschmelzung beteiligten Rechtsträger ist, wenn sie binnen sechs Monaten nach dem Tag, an dem die Eintragung der Verschmelzung in das Register des Sitzes desjenigen Rechtsträgers, dessen Gläubiger sie sind, nach § 19 Abs. 3 UmwG als bekannt gemacht gilt, ihren Anspruch nach Grund und Höhe in Textform anmelden, Sicherheit zu leisten, soweit sie nicht Befriedigung verlangen können. Dieses Recht steht den Gläubigern jedoch nur zu, wenn sie glaubhaft machen, dass durch die Verschmelzung die Erfüllung ihrer Forderung gefährdet wird."
    },
    {
      "date": "2025-11-05",
      "id": "136331",
      "original_text": "Registerbekanntmachung nach dem Umwandlungsgesetz\nBaden-Württemberg Amtsgericht Stuttgart HRB 774158\nLuvin GmbH – Stuttgart",
      "type": "Registerbekanntmachung nach dem Umwandlungsgesetz",
      "state": "Baden-Württemberg",
      "amtsgericht": "Amtsgericht Stuttgart",
      "registernummer": "HRB 774158",
      "registerart": "HRB",
      "company_name": "Luvin GmbH",
      "company_seat": "Stuttgart",
      "details": "05.11.2025 (Bekanntmachungsdatum)\n\nBaden-Württemberg Amtsgericht Stuttgart HRB 774158\nRegisterbekanntmachung nach dem Umwandlungsgesetz 05.11.2025 (Eintragungsdatum)\n\nLuvin GmbH\nGesellschaft mit beschränkter Haftung\nStuttgart\n\nAls nicht eingetragen wird bekanntgemacht:\nDen Gläubigern der an der Verschmelzung beteiligten Rechtsträger ist, wenn sie binnen sechs Monaten nach dem Tag, an dem die Eintragung der Verschmelzung in das Register des Sitzes desjenigen Rechtsträgers, dessen Gläubiger sie sind, nach § 19 Abs. 3 UmwG als bekanntgemacht gilt, ihren Anspruch nach Grund und Höhe schriftlich anmelden, Sicherheit zu leisten, soweit sie nicht Befriedigung verlangen können. Dieses Recht steht den Gläubigern jedoch nur zu, wenn sie glaubhaft machen, dass durch die Verschmelzung die Erfüllung ihrer Forderung gefährdet wird."
    },
    {
      "date": "2025-11-05",
      "id": "136332",
      "original_text": "Sonstige Registerbekanntmachung\nBaden-Württemberg Amtsgericht Stuttgart GnR 720269\nEnergie unterm Reußenstein eG – Neidlingen",
      "type": "Sonstige Registerbekanntmachung",
      "state": "Baden-Württemberg",
      "amtsgericht": "Amtsgericht Stuttgart",
      "registernummer": "GnR 720269",
      "registerart": "GnR",
      "company_name": "Energie unterm Reußenstein eG",
      "company_seat": "Neidlingen",
      "details": "05.11.2025 (Bekanntmachungsdatum)\n\nBaden-Württemberg Amtsgericht Stuttgart GnR 720269\nSonstige Registerbekanntmachung 05.11.2025 (Eintragungsdatum)\n\nEnergie unterm Reußenstein eG\neingetragene Genossenschaft\nNeidlingen\n\nDie Gesellschaft hat am 04.11.2025 die Liste über die Zusammensetzung des Aufsichtsrats zum Handelsregister eingereicht."
    },
    {
      "date": "2025-11-05",
      "id": "136333",
      "original_text": "Registerbekanntmachung nach dem Umwandlungsgesetz\nBerlin Amtsgericht Berlin (Charlottenburg) HRB 280861\nBeck Steuerberatungsgesellschaft mbH – Berlin",
      "type": "Registerbekanntmachung nach dem Umwandlungsgesetz",
      "state": "Berlin",
      "amtsgericht": "Amtsgericht Berlin (Charlottenburg)",
      "registernummer": "HRB 280861",
      "registerart": "HRB",
      "company_name": "Beck Steuerberatungsgesellschaft mbH",
      "company_seat": "Berlin",
      "details": "05.11.2025 (Bekanntmachungsdatum)\n\nBerlin Amtsgericht Berlin (Charlottenburg) HRB 280861\nRegisterbekanntmachung nach dem Umwandlungsgesetz 04.11.2025 (Eintragungsdatum)\n\nBeck Steuerberatungsgesellschaft mbH\nGesellschaft mit beschränkter Haftung\nBerlin\n\nZu Eintragungsnummer 1 vom 04.11.2025 wird als nicht eingetragen veröffentlicht: Den Gläubigern ist, wenn sie binnen sechs Monaten nach dem Tag, an dem die Eintragung der Umwandlung als bekannt gemacht gilt, ihren Anspruch nach Grund und Höhe schriftlich anmelden, Sicherheit zu leisten, soweit sie nicht Befriedigung verlangen können. Dieses Recht steht den Gläubigern jedoch nur zu, wenn sie glaubhaft machen, dass durch die Umwandlung die Erfüllung ihrer Forderung gefährdet wird. Das Recht, Sicherheitsleistung zu verlangen, steht Gläubigern nicht zu, die im Falle der Insolvenz ein Recht auf vorzugsweise Befriedigung aus einer Deckungsmasse haben, die nach gesetzlicher Vorschrift zu ihrem Schutz errichtet und staatlich überwacht ist."
    },
    {
      "date": "2025-11-05",
      "id": "136334",
      "original_text": "Einreichung neuer Dokumente\nBaden-Württemberg Amtsgericht Mannheim HRB 109694\nandrena objects ag – Karlsruhe",
      "type": "Einreichung neuer Dokumente",
      "state": "Baden-Württemberg",
      "amtsgericht": "Amtsgericht Mannheim",
      "registernummer": "HRB 109694",
      "registerart": "HRB",
      "company_name": "andrena objects ag",
      "company_seat": "Karlsruhe",
      "details": "05.11.2025 (Bekanntmachungsdatum)\n\nBaden-Württemberg Amtsgericht Mannheim HRB 109694\nEinreichung neuer Dokumente\n\nandrena objects ag\nAktiengesellschaft\nKarlsruhe\n\nDie Gesellschaft hat am 04.11.2025 die Liste über die Zusammensetzung des Aufsichtsrats zum Handelsregister eingereicht."
    },
    {
      "date": "2025-11-05",
      "id": "136335",
      "original_text": "Einreichung neuer Dokumente\nSaarland Amtsgericht Saarbrücken HRB 14093\nApolog Gesellschaft mit beschränkter Haftung – Quierschied",
      "type": "Einreichung neuer Dokumente",
      "state": "Saarland",
      "amtsgericht": "Amtsgericht Saarbrücken",
      "registernummer": "HRB 14093",
      "registerart": "HRB",
      "company_name": "Apolog Gesellschaft mit beschränkter Haftung",
      "company_seat": "Quierschied",
      "details": "05.11.2025 (Bekanntmachungsdatum)\n\nSaarland Amtsgericht Saarbrücken HRB 14093\nEinreichung neuer Dokumente 05.11.2025 (Eintragungsdatum)\n\nApolog Gesellschaft mit beschränkter Haftung\nGesellschaft mit beschränkter Haftung\nQuierschied\n\nDie Geschäftsführung der Gesellschaft hat eine Liste der Mitglieder des Aufsichtsrats zum Handelsregister eingereicht (§ 52 Abs. 3 Satz 2 GmbHG)."
    },
    {
      "date": "2025-11-05",
      "id": "136336",
      "original_text": "Registerbekanntmachung nach dem Umwandlungsgesetz\nSaarland Amtsgericht Saarbrücken HRA 13572\nBahram Rahmati e. K. – Saarbrücken",
      "type": "Registerbekanntmachung nach dem Umwandlungsgesetz",
      "state": "Saarland",
      "amtsgericht": "Amtsgericht Saarbrücken",
      "registernummer": "HRA 13572",
      "registerart": "HRA",
      "company_name": "Bahram Rahmati e. K.",
      "company_seat": "Saarbrücken",
      "details": "05.11.2025 (Bekanntmachungsdatum)\n\nSaarland Amtsgericht Saarbrücken HRA 13572\nRegisterbekanntmachung nach dem Umwandlungsgesetz 05.11.2025 (Eintragungsdatum)\n\nBahram Rahmati e. K.\nEinzelkaufmann / Einzelkauffrau\nSaarbrücken\n\nAls nicht eingetragen wird bekannt gemacht: Den Gläubigern der an der Verschmelzung beteiligten Gesellschaften ist, wenn sie binnen sechs Monaten nach dem Tag, an dem die Eintragung der Verschmelzung in das Register des Sitzes desjenigen Rechtsträgers, dessen Gläubiger sie sind, nach § 19 Absatz 3 UmwG bekannt gemacht worden ist, ihren Anspruch nach Grund und Höhe schriftlich anmelden, Sicherheit zu leisten, soweit sie nicht Befriedigung verlangen können. Dieses Recht steht den Gläubigern jedoch nur zu, wenn sie glaubhaft machen, dass durch die Verschmelzung die Erfüllung ihrer Forderung gefährdet wird."
    },
    {
      "date": "2025-11-05",
      "id": "136337",
      "original_text": "Löschungsankündigung\nBerlin Amtsgericht Berlin (Charlottenburg) HRB 222462\nAskinCakici Bau & Verwaltungs GmbH – Berlin",
      "type": "Löschungsankündigung",
      "state": "Berlin",
      "amtsgericht": "Amtsgericht Berlin (Charlottenburg)",
      "registernummer": "HRB 222462",
      "registerart": "HRB",
      "company_name": "AskinCakici Bau & Verwaltungs GmbH",
      "company_seat": "Berlin",
      "details": "05.11.2025 (Bekanntmachungsdatum)\n\nBerlin Amtsgericht Berlin (Charlottenburg) HRB 222462\nLöschungsankündigung\n\nAskinCakici Bau & Verwaltungs GmbH\nGesellschaft mit beschränkter Haftung\nBerlin\n\nBei der nachstehenden Gesellschaft wird das Amtslöschungsverfahren gemäß § 394 FamFG eingeleitet. Widerspruchsfrist 6 Wochen"
    },
    {
      "date": "2025-11-05",
      "id": "136338",
      "original_text": "Löschungsankündigung\nBrandenburg Amtsgericht Potsdam HRB 38838\nLegacy Logistik und Service UG (haftungsbeschränkt) – Zossen",
      "type": "Löschungsankündigung",
      "state": "Brandenburg",
      "amtsgericht": "Amtsgericht Potsdam",
      "registernummer": "HRB 38838",
      "registerart": "HRB",
      "company_name": "Legacy Logistik und Service UG (haftungsbeschränkt)",
      "company_seat": "Zossen",
      "details": "05.11.2025 (Bekanntmachungsdatum)\n\nBrandenburg Amtsgericht Potsdam HRB 38838\nLöschungsankündigung\n\nLegacy Logistik und Service UG (haftungsbeschränkt)\nGesellschaft mit beschränkter Haftung\nZossen\n\nBei der nachstehenden Gesellschaft wird das Amtslöschungsverfahren gemäß § 394 FamFG eingeleitet. Widerspruchsfrist: 8 Wochen."
    },
    {
      "date": "2025-11-05",
      "id": "136339",
      "original_text": "Löschungsankündigung\nBrandenburg Amtsgericht Potsdam HRB 39834\nPersonal Gastro TRMF GmbH – Ludwigsfelde",
      "type": "Löschungsankündigung",
      "state": "Brandenburg",
      "amtsgericht": "Amtsgericht Potsdam",
      "registernummer": "HRB 39834",
      "registerart": "HRB",
      "company_name": "Personal Gastro TRMF GmbH",
      "company_seat": "Ludwigsfelde",
      "details": "05.11.2025 (Bekanntmachungsdatum)\n\nBrandenburg Amtsgericht Potsdam HRB 39834\nLöschungsankündigung\n\nPersonal Gastro TRMF GmbH\nGesellschaft mit beschränkter Haftung\nLudwigsfelde\n\nBei der nachstehenden Gesellschaft wird das Amtslöschungsverfahren gemäß § 394 FamFG eingeleitet. Widerspruchsfrist 8 Wochen."
    },
    {
      "date": "2025-11-05",
      "id": "136340",
      "original_text": "Registerbekanntmachung nach dem Umwandlungsgesetz\nSchleswig-Holstein Amtsgericht Kiel HRB 10719\nPY Holding AG – Kiel",
      "type": "Registerbekanntmachung nach dem Umwandlungsgesetz",
      "state": "Schleswig-Holstein",
      "amtsgericht": "Amtsgericht Kiel",
      "registernummer": "HRB 10719",
      "registerart": "HRB",
      "company_name": "PY Holding AG",
      "company_seat": "Kiel",
      "details": "05.11.2025 (Bekanntmachungsdatum)\n\nSchleswig-Holstein Amtsgericht Kiel HRB 10719\nRegisterbekanntmachung nach dem Umwandlungsgesetz 04.11.2025 (Eintragungsdatum)\n\nPY Holding  AG\nAktiengesellschaft\nKiel\n\nZu Eintragungsnummer 10 vom 04.11.2025 wird als nicht eingetragen veröffentlicht: Den Gläubigern ist, wenn sie binnen sechs Monaten nach dem Tag, an dem die Eintragung der Umwandlung bekannt gemacht worden ist, ihren Anspruch nach Grund und Höhe schriftlich anmelden, Sicherheit zu leisten, soweit sie nicht Befriedigung verlangen können. Dieses Recht steht den Gläubigern jedoch nur zu, wenn sie glaubhaft machen, dass durch die Umwandlung die Erfüllung ihrer Forderung gefährdet wird."
    },
    {
      "date": "2025-11-05",
      "id": "136341",
      "original_text": "Löschungsankündigung\nBerlin Amtsgericht Berlin (Charlottenburg) HRB 248790\nRazmajevs Ventures UG (haftungsbeschränkt) – Berlin",
      "type": "Löschungsankündigung",
      "state": "Berlin",
      "amtsgericht": "Amtsgericht Berlin (Charlottenburg)",
      "registernummer": "HRB 248790",
      "registerart": "HRB",
      "company_name": "Razmajevs Ventures UG (haftungsbeschränkt)",
      "company_seat": "Berlin",
      "details": "05.11.2025 (Bekanntmachungsdatum)\n\nBerlin Amtsgericht Berlin (Charlottenburg) HRB 248790\nLöschungsankündigung\n\nRazmajevs Ventures UG (haftungsbeschränkt)\nGesellschaft mit beschränkter Haftung\nBerlin\n\nBei der nachstehenden Gesellschaft wird das Amtslöschungsverfahren gemäß § 394 FamFG eingeleitet. Widerspruchsfrist 6 Wochen"
    },
    {
      "date": "2025-11-05",
      "id": "136342",
      "original_text": "Löschungsankündigung\nBerlin Amtsgericht Berlin (Charlottenburg) HRB 177580\nGSK Nord-Süd Dienstleistungs GmbH – Berlin",
      "type": "Löschungsankündigung",
      "state": "Berlin",
      "amtsgericht": "Amtsgericht Berlin (Charlottenburg)",
      "registernummer": "HRB 177580",
      "registerart": "HRB",
      "company_name": "GSK Nord-Süd Dienstleistungs GmbH",
      "company_seat": "Berlin",
      "details": "05.11.2025 (Bekanntmachungsdatum)\n\nBerlin Amtsgericht Berlin (Charlottenburg) HRB 177580\nLöschungsankündigung\n\nGSK Nord-Süd Dienstleistungs GmbH\nGesellschaft mit beschränkter Haftung\nBerlin\n\nBei der nachstehenden Gesellschaft wird das Amtslöschungsverfahren gemäß § 394 FamFG eingeleitet. Widerspruchsfrist 6 Wochen"
    },
    {
      "date": "2025-11-05",
      "id": "136343",
      "original_text": "Einreichung neuer Dokumente\nHamburg Amtsgericht Hamburg HRB 126094\nLichtBlick SE – Hamburg",
      "type": "Einreichung neuer Dokumente",
      "state": "Hamburg",
      "amtsgericht": "Amtsgericht Hamburg",
      "registernummer": "HRB 126094",
      "registerart": "HRB",
      "company_name": "LichtBlick SE",
      "company_seat": "Hamburg",
      "details": "05.11.2025 (Bekanntmachungsdatum)\n\nHamburg Amtsgericht Hamburg HRB 126094\nEinreichung neuer Dokumente 05.11.2025 (Eintragungsdatum)\n\nLichtBlick SE\nEuropäische Aktiengesellschaft (SE)\nHamburg\n\nAls nicht eingetragen wird bekannt gemacht: Liste des Verwaltungsrats wurde eingereicht."
    },
    {
      "date": "2025-11-05",
      "id": "136344",
      "original_text": "Löschungsankündigung\nBaden-Württemberg Amtsgericht Stuttgart HRB 777779\nmaßgeschneidert Werbeagentur GmbH – Neckarwestheim",
      "type": "Löschungsankündigung",
      "state": "Baden-Württemberg",
      "amtsgericht": "Amtsgericht Stuttgart",
      "registernummer": "HRB 777779",
      "registerart": "HRB",
      "company_name": "maßgeschneidert Werbeagentur GmbH",
      "company_seat": "Neckarwestheim",
      "details": "05.11.2025 (Bekanntmachungsdatum)\n\nBaden-Württemberg Amtsgericht Stuttgart HRB 777779\nLöschungsankündigung\n\nmaßgeschneidert Werbeagentur GmbH\nGesellschaft mit beschränkter Haftung\nNeckarwestheim\n\nDas Gericht beabsichtigt, die Gesellschaft wegen Vermögenslosigkeit im Handelsregister von Amts wegen nach § 394 FamFG zu löschen. Die Frist zur Geltendmachung eines Widerspruchs gegen die beabsichtigte Löschung ist auf zwei Monate ab Veröffentlichung bestimmt."
    },
    {
      "date": "2025-11-05",
      "id": "136345",
      "original_text": "Registerbekanntmachung nach dem Umwandlungsgesetz\nSaarland Amtsgericht Saarbrücken HRB 14198\nKüchen Trend Peter GmbH – Saarlouis",
      "type": "Registerbekanntmachung nach dem Umwandlungsgesetz",
      "state": "Saarland",
      "amtsgericht": "Amtsgericht Saarbrücken",
      "registernummer": "HRB 14198",
      "registerart": "HRB",
      "company_name": "Küchen Trend Peter GmbH",
      "company_seat": "Saarlouis",
      "details": "05.11.2025 (Bekanntmachungsdatum)\n\nSaarland Amtsgericht Saarbrücken HRB 14198\nRegisterbekanntmachung nach dem Umwandlungsgesetz 05.11.2025 (Eintragungsdatum)\n\nKüchen Trend Peter GmbH\nGesellschaft mit beschränkter Haftung\nSaarlouis\n\nAls nicht eingetragen wird bekannt gemacht: Den Gläubigern der an der Verschmelzung beteiligten Gesellschaften ist, wenn sie binnen sechs Monaten nach dem Tag, an dem die Eintragung der Verschmelzung in das Register des Sitzes desjenigen Rechtsträgers, dessen Gläubiger sie sind, nach § 19 Absatz 3 UmwG bekannt gemacht worden ist, ihren Anspruch nach Grund und Höhe schriftlich anmelden, Sicherheit zu leisten, soweit sie nicht Befriedigung verlangen können. Dieses Recht steht den Gläubigern jedoch nur zu, wenn sie glaubhaft machen, dass durch die Verschmelzung die Erfüllung ihrer Forderung gefährdet wird."
    },
    {
      "date": "2025-11-05",
      "id": "136346",
      "original_text": "Registerbekanntmachung nach dem Umwandlungsgesetz\nBaden-Württemberg Amtsgericht Stuttgart HRA 742118\nLidl 425 GmbH & Co. KG – Bad Wimpfen",
      "type": "Registerbekanntmachung nach dem Umwandlungsgesetz",
      "state": "Baden-Württemberg",
      "amtsgericht": "Amtsgericht Stuttgart",
      "registernummer": "HRA 742118",
      "registerart": "HRA",
      "company_name": "Lidl 425 GmbH & Co. KG",
      "company_seat": "Bad Wimpfen",
      "details": "05.11.2025 (Bekanntmachungsdatum)\n\nBaden-Württemberg Amtsgericht Stuttgart HRA 742118\nRegisterbekanntmachung nach dem Umwandlungsgesetz 05.11.2025 (Eintragungsdatum)\n\nLidl 425 GmbH & Co. KG\nKommanditgesellschaft\nBad Wimpfen\n\nAls nicht eingetragen wird bekanntgemacht:\nDen Gläubigern der an der Ausgliederung beteiligten Rechtsträger ist, wenn sie binnen sechs Monaten nach dem Tag, an dem die Eintragung der Ausgliederung in das Register des Sitzes desjenigen Rechtsträgers, dessen Gläubiger sie sind, nach § 19 Abs. 3 UmwG als bekanntgemacht gilt, ihren Anspruch nach Grund und Höhe schriftlich anmelden, Sicherheit zu leisten, soweit sie nicht Befriedigung verlangen können. Dieses Recht steht den Gläubigern jedoch nur zu, wenn sie glaubhaft machen, dass durch die Ausgliederung die Erfüllung ihrer Forderung gefährdet wird."
    },
    {
      "date": "2025-11-05",
      "id": "136347",
      "original_text": "Registerbekanntmachung nach dem Umwandlungsgesetz\nBrandenburg Amtsgericht Potsdam HRB 27647\nAqua-Tool GmbH – Brandenburg an der Havel",
      "type": "Registerbekanntmachung nach dem Umwandlungsgesetz",
      "state": "Brandenburg",
      "amtsgericht": "Amtsgericht Potsdam",
      "registernummer": "HRB 27647",
      "registerart": "HRB",
      "company_name": "Aqua-Tool GmbH",
      "company_seat": "Brandenburg an der Havel",
      "details": "05.11.2025 (Bekanntmachungsdatum)\n\nBrandenburg Amtsgericht Potsdam HRB 27647\nRegisterbekanntmachung nach dem Umwandlungsgesetz 02.11.2025 (Eintragungsdatum)\n\nAqua-Tool GmbH\nGesellschaft mit beschränkter Haftung\nBrandenburg an der Havel\n\nZu Eintragungsnummer 8 vom 02.11.2025 wird als nicht eingetragen veröffentlicht:  Den Gläubigern der an der Verschmelzung beteiligten Rechtsträger ist, wenn sie binnen sechs Monaten nach dem Tag, an dem die Eintragung der Verschmelzung in das Register des Sitzes desjenigen Rechtsträgers, dessen Gläubiger sie sind, als bekannt gemacht gilt, ihren Anspruch nach Grund und Höhe schriftlich anmelden, Sicherheit zu leisten, soweit sie nicht Befriedigung verlangen können. Dieses Recht steht den Gläubigern jedoch nur zu, wenn sie glaubhaft machen, dass durch die Verschmelzung die Erfüllung ihrer Forderung gefährdet wird."
    },
    {
      "date": "2025-11-05",
      "id": "136348",
      "original_text": "Registerbekanntmachung nach dem Umwandlungsgesetz\nBaden-Württemberg Amtsgericht Stuttgart HRB 744117\nHLE Verwaltungs-GmbH – Leinfelden-Echterdingen",
      "type": "Registerbekanntmachung nach dem Umwandlungsgesetz",
      "state": "Baden-Württemberg",
      "amtsgericht": "Amtsgericht Stuttgart",
      "registernummer": "HRB 744117",
      "registerart": "HRB",
      "company_name": "HLE Verwaltungs-GmbH",
      "company_seat": "Leinfelden-Echterdingen",
      "details": "05.11.2025 (Bekanntmachungsdatum)\n\nBaden-Württemberg Amtsgericht Stuttgart HRB 744117\nRegisterbekanntmachung nach dem Umwandlungsgesetz 05.11.2025 (Eintragungsdatum)\n\nHLE Verwaltungs-GmbH\nGesellschaft mit beschränkter Haftung\nLeinfelden-Echterdingen\n\nAls nicht eingetragen wird bekanntgemacht:\nDen Gläubigern der an der Verschmelzung beteiligten Rechtsträger ist, wenn sie binnen sechs Monaten nach dem Tag, an dem die Eintragung der Verschmelzung in das Register des Sitzes desjenigen Rechtsträgers, dessen Gläubiger sie sind, nach § 19 Abs. 3 UmwG als bekanntgemacht gilt, ihren Anspruch nach Grund und Höhe schriftlich anmelden, Sicherheit zu leisten, soweit sie nicht Befriedigung verlangen können. Dieses Recht steht den Gläubigern jedoch nur zu, wenn sie glaubhaft machen, dass durch die Verschmelzung die Erfüllung ihrer Forderung gefährdet wird."
    },
    {
      "date": "2025-11-05",
      "id": "136349",
      "original_text": "Registerbekanntmachung nach dem Umwandlungsgesetz\nBrandenburg Amtsgericht Potsdam HRB 27647\nAqua-Tool GmbH – Brandenburg an der Havel",
      "type": "Registerbekanntmachung nach dem Umwandlungsgesetz",
      "state": "Brandenburg",
      "amtsgericht": "Amtsgericht Potsdam",
      "registernummer": "HRB 27647",
      "registerart": "HRB",
      "company_name": "Aqua-Tool GmbH",
      "company_seat": "Brandenburg an der Havel",
      "details": "05.11.2025 (Bekanntmachungsdatum)\n\nBrandenburg Amtsgericht Potsdam HRB 27647\nRegisterbekanntmachung nach dem Umwandlungsgesetz 02.11.2025 (Eintragungsdatum)\n\nAqua-Tool GmbH\nGesellschaft mit beschränkter Haftung\nBrandenburg an der Havel\n\nZu Eintragungsnummer 9 vom 02.11.2025 wird als nicht eingetragen veröffentlicht: Den Gläubigern der an der Verschmelzung beteiligten Rechtsträger ist, wenn sie binnen sechs Monaten nach dem Tag, an dem die Eintragung der Verschmelzung in das Register des Sitzes desjenigen Rechtsträgers, dessen Gläubiger sie sind, als bekannt gemacht gilt, ihren Anspruch nach Grund und Höhe schriftlich anmelden, Sicherheit zu leisten, soweit sie nicht Befriedigung verlangen können. Dieses Recht steht den Gläubigern jedoch nur zu, wenn sie glaubhaft machen, dass durch die Verschmelzung die Erfüllung ihrer Forderung gefährdet wird."
    },
    {
      "date": "2025-11-05",
      "id": "136350",
      "original_text": "Registerbekanntmachung nach dem Umwandlungsgesetz\nSaarland Amtsgericht Saarbrücken HRB 19797\nGlaukos GmbH – Saarbrücken",
      "type": "Registerbekanntmachung nach dem Umwandlungsgesetz",
      "state": "Saarland",
      "amtsgericht": "Amtsgericht Saarbrücken",
      "registernummer": "HRB 19797",
      "registerart": "HRB",
      "company_name": "Glaukos GmbH",
      "company_seat": "Saarbrücken",
      "details": "05.11.2025 (Bekanntmachungsdatum)\n\nSaarland Amtsgericht Saarbrücken HRB 19797\nRegisterbekanntmachung nach dem Umwandlungsgesetz 05.11.2025 (Eintragungsdatum)\n\nGlaukos GmbH\nGesellschaft mit beschränkter Haftung\nSaarbrücken\n\nAls nicht eingetragen wird bekannt gemacht: Den Gläubigern der an der Verschmelzung beteiligten Gesellschaften ist, wenn sie binnen sechs Monaten nach dem Tag, an dem die Eintragung der Verschmelzung in das Register des Sitzes desjenigen Rechtsträgers, dessen Gläubiger sie sind, nach § 19 Absatz 3 UmwG bekannt gemacht worden ist, ihren Anspruch nach Grund und Höhe schriftlich anmelden, Sicherheit zu leisten, soweit sie nicht Befriedigung verlangen können. Dieses Recht steht den Gläubigern jedoch nur zu, wenn sie glaubhaft machen, dass durch die Verschmelzung die Erfüllung ihrer Forderung gefährdet wird."
    },
    {
      "date": "2025-11-05",
      "id": "136351",
      "original_text": "Registerbekanntmachung nach dem Umwandlungsgesetz\nSaarland Amtsgericht Saarbrücken HRB 103666\neurodata NOW! GmbH – Saarbrücken",
      "type": "Registerbekanntmachung nach dem Umwandlungsgesetz",
      "state": "Saarland",
      "amtsgericht": "Amtsgericht Saarbrücken",
      "registernummer": "HRB 103666",
      "registerart": "HRB",
      "company_name": "eurodata NOW! GmbH",
      "company_seat": "Saarbrücken",
      "details": "05.11.2025 (Bekanntmachungsdatum)\n\nSaarland Amtsgericht Saarbrücken HRB 103666\nRegisterbekanntmachung nach dem Umwandlungsgesetz 05.11.2025 (Eintragungsdatum)\n\neurodata NOW! GmbH\nGesellschaft mit beschränkter Haftung\nSaarbrücken\n\nAls nicht eingetragen wird bekannt gemacht: Den Gläubigern der an der Verschmelzung beteiligten Gesellschaften ist, wenn sie binnen sechs Monaten nach dem Tag, an dem die Eintragung der Verschmelzung in das Register des Sitzes desjenigen Rechtsträgers, dessen Gläubiger sie sind, nach § 19 Absatz 3 UmwG bekannt gemacht worden ist, ihren Anspruch nach Grund und Höhe schriftlich anmelden, Sicherheit zu leisten, soweit sie nicht Befriedigung verlangen können. Dieses Recht steht den Gläubigern jedoch nur zu, wenn sie glaubhaft machen, dass durch die Verschmelzung die Erfüllung ihrer Forderung gefährdet wird."
    },
    {
      "date": "2025-11-05",
      "id": "136352",
      "original_text": "Registerbekanntmachung nach dem Umwandlungsgesetz\nHamburg Amtsgericht Hamburg VR 23597\nDie Hamburger Goldkehlchen e.V. – Hamburg",
      "type": "Registerbekanntmachung nach dem Umwandlungsgesetz",
      "state": "Hamburg",
      "amtsgericht": "Amtsgericht Hamburg",
      "registernummer": "VR 23597",
      "registerart": "VR",
      "company_name": "Die Hamburger Goldkehlchen e.V.",
      "company_seat": "Hamburg",
      "details": "05.11.2025 (Bekanntmachungsdatum)\n\nHamburg Amtsgericht Hamburg VR 23597\nRegisterbekanntmachung nach dem Umwandlungsgesetz 05.11.2025 (Eintragungsdatum)\n\nDie Hamburger Goldkehlchen e.V.\neingetragener Verein\nHamburg\n\nAls nicht eingetragen wird bekannt gemacht:\nDen Gläubigern der an der Ausgliederung beteiligten Gesellschaften ist, wenn sie binnen sechs Monaten nach dem Tag, an dem die Eintragung der Ausgliederung in das Register des Sitzes desjenigen Rechtsträgers, dessen Gläubiger sie sind, nach § 19 Absatz 3 UmwG als bekannt gemacht gilt, ihren Anspruch nach Grund und Höhe schriftlich anmelden, Sicherheit zu leisten, soweit sie nicht Befriedigung verlangen können. Dieses Recht steht den Gläubigern jedoch nur zu, wenn sie glaubhaft machen, dass durch die Ausgliederung die Erfüllung ihrer Forderung gefährdet wird."
    },
    {
      "date": "2025-11-05",
      "id": "136353",
      "original_text": "Registerbekanntmachung nach dem Umwandlungsgesetz\nHamburg Amtsgericht Hamburg HRB 193936\nDie Hamburger Goldkehlchen Entertainment GmbH – Hamburg",
      "type": "Registerbekanntmachung nach dem Umwandlungsgesetz",
      "state": "Hamburg",
      "amtsgericht": "Amtsgericht Hamburg",
      "registernummer": "HRB 193936",
      "registerart": "HRB",
      "company_name": "Die Hamburger Goldkehlchen Entertainment GmbH",
      "company_seat": "Hamburg",
      "details": "05.11.2025 (Bekanntmachungsdatum)\n\nHamburg Amtsgericht Hamburg HRB 193936\nRegisterbekanntmachung nach dem Umwandlungsgesetz 05.11.2025 (Eintragungsdatum)\n\nDie Hamburger Goldkehlchen Entertainment GmbH\nGesellschaft mit beschränkter Haftung\nHamburg\n\nAls nicht eingetragen wird bekannt gemacht:\nDen Gläubigern der an der Ausgliederung beteiligten Gesellschaften ist, wenn sie binnen sechs Monaten nach dem Tag, an dem die Eintragung der Ausgliederung in das Register des Sitzes desjenigen Rechtsträgers, dessen Gläubiger sie sind, nach § 19 Absatz 3 UmwG als bekannt gemacht gilt, ihren Anspruch nach Grund und Höhe schriftlich anmelden, Sicherheit zu leisten, soweit sie nicht Befriedigung verlangen können. Dieses Recht steht den Gläubigern jedoch nur zu, wenn sie glaubhaft machen, dass durch die Ausgliederung die Erfüllung ihrer Forderung gefährdet wird."
    },
    {
      "date": "2025-11-05",
      "id": "136354",
      "original_text": "Löschungsankündigung\nMecklenburg-Vorpommern Amtsgericht Rostock HRB 13639\nAlex-Com UG (haftungsbeschränkt) – Rostock",
      "type": "Löschungsankündigung",
      "state": "Mecklenburg-Vorpommern",
      "amtsgericht": "Amtsgericht Rostock",
      "registernummer": "HRB 13639",
      "registerart": "HRB",
      "company_name": "Alex-Com UG (haftungsbeschränkt)",
      "company_seat": "Rostock",
      "details": "05.11.2025 (Bekanntmachungsdatum)\n\nMecklenburg-Vorpommern Amtsgericht Rostock HRB 13639\nLöschungsankündigung\n\nAlex-Com UG (haftungsbeschränkt)\nGesellschaft mit beschränkter Haftung\nRostock\n\nDas Registergericht beabsichtigt, die im Handelsregister eingetragene Gesellschaft von Amts wegen nach § 394 FamFG zu löschen. Die Frist zur Erhebung eines Widerspruchs gegen die beabsichtigte Löschung wird auf einen Monat festgesetzt."
    },
    {
      "date": "2025-11-05",
      "id": "136355",
      "original_text": "Einreichung neuer Dokumente\nBaden-Württemberg Amtsgericht Ulm HRB 726465\nANDRITZ Schuler Pressen GmbH – Göppingen",
      "type": "Einreichung neuer Dokumente",
      "state": "Baden-Württemberg",
      "amtsgericht": "Amtsgericht Ulm",
      "registernummer": "HRB 726465",
      "registerart": "HRB",
      "company_name": "ANDRITZ Schuler Pressen GmbH",
      "company_seat": "Göppingen",
      "details": "05.11.2025 (Bekanntmachungsdatum)\n\nBaden-Württemberg Amtsgericht Ulm HRB 726465\nEinreichung neuer Dokumente\n\nANDRITZ Schuler Pressen GmbH\nGesellschaft mit beschränkter Haftung\nGöppingen\n\nDie Gesellschaft hat am 04.11.2025 die Liste über die Zusammensetzung des Aufsichtsrats zum Handelsregister eingereicht."
    },
    {
      "date": "2025-11-05",
      "id": "136356",
      "original_text": "Löschungsankündigung\nBaden-Württemberg Amtsgericht Mannheim HRA 501406\nErwin Ziegler – Pforzheim",
      "type": "Löschungsankündigung",
      "state": "Baden-Württemberg",
      "amtsgericht": "Amtsgericht Mannheim",
      "registernummer": "HRA 501406",
      "registerart": "HRA",
      "company_name": "Erwin Ziegler",
      "company_seat": "Pforzheim",
      "details": "05.11.2025 (Bekanntmachungsdatum)\n\nBaden-Württemberg Amtsgericht Mannheim HRA 501406\nLöschungsankündigung\n\nErwin Ziegler\nOffene Handelsgesellschaft\nPforzheim\n\nDas Gericht beabsichtigt, die Firma  von Amts wegen nach § 31 Abs. 2 HGB  zu löschen. Die Frist zur Geltendmachung eines Widerspruchs gegen die beabsichtigte Löschung ist auf einen Monat ab Veröffentlichung bestimmt."
    },
    {
      "date": "2025-11-05",
      "id": "136357",
      "original_text": "Löschungsankündigung\nBaden-Württemberg Amtsgericht Ulm HRB 726142\nRSA GmbH – Tettnang",
      "type": "Löschungsankündigung",
      "state": "Baden-Württemberg",
      "amtsgericht": "Amtsgericht Ulm",
      "registernummer": "HRB 726142",
      "registerart": "HRB",
      "company_name": "RSA GmbH",
      "company_seat": "Tettnang",
      "details": "05.11.2025 (Bekanntmachungsdatum)\n\nBaden-Württemberg Amtsgericht Ulm HRB 726142\nLöschungsankündigung\n\nRSA GmbH\nGesellschaft mit beschränkter Haftung\nTettnang\n\nDas Gericht beabsichtigt, die Gesellschaft wegen Vermögenslosigkeit im Handelsregister von Amts wegen nach § 394 FamFG zu löschen. Die Frist zur Geltendmachung eines Widerspruchs gegen die beabsichtigte Löschung ist auf  einen Monat ab Veröffentlichung bestimmt."
    },
    {
      "date": "2025-11-05",
      "id": "136358",
      "original_text": "Registerbekanntmachung nach dem Umwandlungsgesetz\nBaden-Württemberg Amtsgericht Freiburg HRB 734260\nLeisinger Holzbau GmbH – Kleines Wiesental",
      "type": "Registerbekanntmachung nach dem Umwandlungsgesetz",
      "state": "Baden-Württemberg",
      "amtsgericht": "Amtsgericht Freiburg",
      "registernummer": "HRB 734260",
      "registerart": "HRB",
      "company_name": "Leisinger Holzbau GmbH",
      "company_seat": "Kleines Wiesental",
      "details": "05.11.2025 (Bekanntmachungsdatum)\n\nBaden-Württemberg Amtsgericht Freiburg HRB 734260\nRegisterbekanntmachung nach dem Umwandlungsgesetz 05.11.2025 (Eintragungsdatum)\n\nLeisinger Holzbau GmbH\nGesellschaft mit beschränkter Haftung\nKleines Wiesental\n\nAls nicht eingetragen wird bekanntgemacht:\nDen Gläubigern der an der Ausgliederung beteiligten Rechtsträger ist, wenn sie binnen sechs Monaten nach dem Tag, an dem die Eintragung der Ausgliederung in das Register des Sitzes desjenigen Rechtsträgers, dessen Gläubiger sie sind, nach § 19 Abs. 3 UmwG als bekanntgemacht gilt, ihren Anspruch nach Grund und Höhe schriftlich anmelden, Sicherheit zu leisten, soweit sie nicht Befriedigung verlangen können. Dieses Recht steht den Gläubigern jedoch nur zu, wenn sie glaubhaft machen, dass durch die Ausgliederung die Erfüllung ihrer Forderung gefährdet wird."
    },
    {
      "date": "2025-11-05",
      "id": "136359",
      "original_text": "Löschungsankündigung\nBaden-Württemberg Amtsgericht Stuttgart HRB 789081\nGENOS UG (haftungsbeschränkt) – Ingersheim",
      "type": "Löschungsankündigung",
      "state": "Baden-Württemberg",
      "amtsgericht": "Amtsgericht Stuttgart",
      "registernummer": "HRB 789081",
      "registerart": "HRB",
      "company_name": "GENOS UG (haftungsbeschränkt)",
      "company_seat": "Ingersheim",
      "details": "05.11.2025 (Bekanntmachungsdatum)\n\nBaden-Württemberg Amtsgericht Stuttgart HRB 789081\nLöschungsankündigung\n\nGENOS UG (haftungsbeschränkt)\nGesellschaft mit beschränkter Haftung\nIngersheim\n\nAls nicht eingetragen wird bekanntgemacht:\nDas Gericht beabsichtigt, die Gesellschaft wegen Vermögenslosigkeit im Handelsregister von Amts wegen nach § 394 FamFG zu löschen. Die Frist zur Geltendmachung eines Widerspruchs gegen die beabsichtigte Löschung ist auf zwei Monate ab Veröffentlichung bestimmt."
    },
    {
      "date": "2025-11-05",
      "id": "136360",
      "original_text": "Registerbekanntmachung nach dem Umwandlungsgesetz\nBerlin Amtsgericht Berlin (Charlottenburg) HRA 64187\nBeck GmbH & Co. KG – Berlin",
      "type": "Registerbekanntmachung nach dem Umwandlungsgesetz",
      "state": "Berlin",
      "amtsgericht": "Amtsgericht Berlin (Charlottenburg)",
      "registernummer": "HRA 64187",
      "registerart": "HRA",
      "company_name": "Beck GmbH & Co. KG",
      "company_seat": "Berlin",
      "details": "05.11.2025 (Bekanntmachungsdatum)\n\nBerlin Amtsgericht Berlin (Charlottenburg) HRA 64187\nRegisterbekanntmachung nach dem Umwandlungsgesetz 04.11.2025 (Eintragungsdatum)\n\nBeck GmbH & Co. KG\nKommanditgesellschaft\nBerlin\n\nZu Eintragungsnummer 2 vom 04.11.2025 wird als nicht eingetragen veröffentlicht: Den Gläubigern ist, wenn sie binnen sechs Monaten nach dem Tag, an dem die Eintragung der Umwandlung als bekannt gemacht gilt, ihren Anspruch nach Grund und Höhe schriftlich anmelden, Sicherheit zu leisten, soweit sie nicht Befriedigung verlangen können. Dieses Recht steht den Gläubigern jedoch nur zu, wenn sie glaubhaft machen, dass durch die Umwandlung die Erfüllung ihrer Forderung gefährdet wird. Das Recht, Sicherheitsleistung zu verlangen, steht Gläubigern nicht zu, die im Falle der Insolvenz ein Recht auf vorzugsweise Befriedigung aus einer Deckungsmasse haben, die nach gesetzlicher Vorschrift zu ihrem Schutz errichtet und staatlich überwacht ist."
    },
    {
      "date": "2025-11-05",
      "id": "136361",
      "original_text": "Registerbekanntmachung nach dem Umwandlungsgesetz\nBaden-Württemberg Amtsgericht Freiburg HRB 734126\nLeisinger Holding GmbH – Kleines Wiesental",
      "type": "Registerbekanntmachung nach dem Umwandlungsgesetz",
      "state": "Baden-Württemberg",
      "amtsgericht": "Amtsgericht Freiburg",
      "registernummer": "HRB 734126",
      "registerart": "HRB",
      "company_name": "Leisinger Holding GmbH",
      "company_seat": "Kleines Wiesental",
      "details": "05.11.2025 (Bekanntmachungsdatum)\n\nBaden-Württemberg Amtsgericht Freiburg HRB 734126\nRegisterbekanntmachung nach dem Umwandlungsgesetz 05.11.2025 (Eintragungsdatum)\n\nLeisinger Holding GmbH\nGesellschaft mit beschränkter Haftung\nKleines Wiesental\n\nAls nicht eingetragen wird bekanntgemacht:\nDen Gläubigern der an der Ausgliederung beteiligten Rechtsträger ist, wenn sie binnen sechs Monaten nach dem Tag, an dem die Eintragung der Ausgliederung in das Register des Sitzes desjenigen Rechtsträgers, dessen Gläubiger sie sind, nach § 19 Abs. 3 UmwG als bekanntgemacht gilt, ihren Anspruch nach Grund und Höhe schriftlich anmelden, Sicherheit zu leisten, soweit sie nicht Befriedigung verlangen können. Dieses Recht steht den Gläubigern jedoch nur zu, wenn sie glaubhaft machen, dass durch die Ausgliederung die Erfüllung ihrer Forderung gefährdet wird."
    },
    {
      "date": "2025-11-05",
      "id": "136362",
      "original_text": "Registerbekanntmachung nach dem Umwandlungsgesetz\nBaden-Württemberg Amtsgericht Ulm HRB 631700\nMKS Softwaremanagement AG – Friedrichshafen",
      "type": "Registerbekanntmachung nach dem Umwandlungsgesetz",
      "state": "Baden-Württemberg",
      "amtsgericht": "Amtsgericht Ulm",
      "registernummer": "HRB 631700",
      "registerart": "HRB",
      "company_name": "MKS Softwaremanagement AG",
      "company_seat": "Friedrichshafen",
      "details": "05.11.2025 (Bekanntmachungsdatum)\n\nBaden-Württemberg Amtsgericht Ulm HRB 631700\nRegisterbekanntmachung nach dem Umwandlungsgesetz 05.11.2025 (Eintragungsdatum)\n\nMKS Softwaremanagement AG\nAktiengesellschaft\nFriedrichshafen\n\nAls nicht eingetragen wird bekanntgemacht:\nDen Gläubigern des an dem Formwechsel beteiligten Rechtsträgers ist, wenn sie binnen sechs Monaten nach dem Tag, an dem die Eintragung des Formwechsels in das Register des Sitzes desjenigen Rechtsträgers, dessen Gläubiger sie sind, nach § 19 Abs. 3 UmwG als bekanntgemacht gilt, ihren Anspruch nach Grund und Höhe schriftlich anmelden, Sicherheit zu leisten, soweit sie nicht Befriedigung verlangen können. Dieses Recht steht den Gläubigern jedoch nur zu, wenn sie glaubhaft machen, dass durch den Formwechsel die Erfüllung ihrer Forderung gefährdet wird."
    },
    {
      "date": "2025-11-05",
      "id": "136363",
      "original_text": "Löschungsankündigung\nBerlin Amtsgericht Berlin (Charlottenburg) HRB 220525\nRM Gastro GmbH – Berlin",
      "type": "Löschungsankündigung",
      "state": "Berlin",
      "amtsgericht": "Amtsgericht Berlin (Charlottenburg)",
      "registernummer": "HRB 220525",
      "registerart": "HRB",
      "company_name": "RM Gastro GmbH",
      "company_seat": "Berlin",
      "details": "05.11.2025 (Bekanntmachungsdatum)\n\nBerlin Amtsgericht Berlin (Charlottenburg) HRB 220525\nLöschungsankündigung\n\nRM Gastro GmbH\nGesellschaft mit beschränkter Haftung\nBerlin\n\nBei der nachstehenden Gesellschaft wird das Amtslöschungsverfahren gemäß § 394 FamFG eingeleitet. Widerspruchsfrist 6 Wochen"
    },
    {
      "date": "2025-11-05",
      "id": "136364",
      "original_text": "Sonstige Registerbekanntmachung\nThüringen Amtsgericht Eisenach VR 311077\n\"Faschingsfreunde Behringen\" (FFB) e.V. – Hörselberg-Hainich OT Behringen",
      "type": "Sonstige Registerbekanntmachung",
      "state": "Thüringen",
      "amtsgericht": "Amtsgericht Eisenach",
      "registernummer": "VR 311077",
      "registerart": "VR",
      "company_name": "\"Faschingsfreunde Behringen\" (FFB) e.V.",
      "company_seat": "Hörselberg-Hainich OT Behringen",
      "details": "05.11.2025 (Bekanntmachungsdatum)\n\nThüringen Amtsgericht Eisenach VR 311077\nSonstige Registerbekanntmachung 05.11.2025 (Eintragungsdatum)\n\n\"Faschingsfreunde Behringen\" (FFB) e.V.\neingetragener Verein\nHörselberg-Hainich OT Behringen"
    },
    {
      "date": "2025-11-05",
      "id": "136365",
      "original_text": "Registerbekanntmachung nach dem Umwandlungsgesetz\nThüringen Amtsgericht Jena HRA 506862\nideenwert GmbH & Co. KG – Eisenach",
      "type": "Registerbekanntmachung nach dem Umwandlungsgesetz",
      "state": "Thüringen",
      "amtsgericht": "Amtsgericht Jena",
      "registernummer": "HRA 506862",
      "registerart": "HRA",
      "company_name": "ideenwert GmbH & Co. KG",
      "company_seat": "Eisenach",
      "details": "05.11.2025 (Bekanntmachungsdatum)\n\nThüringen Amtsgericht Jena HRA 506862\nRegisterbekanntmachung nach dem Umwandlungsgesetz 05.11.2025 (Eintragungsdatum)\n\nideenwert GmbH & Co. KG\nKommanditgesellschaft\nEisenach\n\nDie Gesellschaft hat im Wege der Ausgliederung gemäß Ausgliederungsvertrag vom 27.06.2025, mit Nachtrag vom 27.10.2025 sowie Beschluss ihrer Gesellschafterversammlung vom 27.06.2025 das Vermögen des von dem Einzelkaufmann Hopf, Denis Ronald, Wutha-Farnroda, *23.07.1979, unter der Firma Denis Hopf e.K. mit dem Sitz in Eisenach (Amtsgericht Jena HRA 506292) betriebene Unternehmen übernommen. Die Ausgliederung ist mit zeitgleicher Eintragung im Register des Sitzes des übertragenden Rechtsträgers wirksam geworden.\nNicht eingetragen: Den Gläubigern der an der Ausgliederung beteiligten Rechtsträger, ist wenn sie binnen sechs Monaten nach dem Tag, an dem die Eintragung der Ausgliederung in das Register des Sitzes desjenigen Rechtsträgers, dessen Gläubiger sie sind, nach §§125, 19 Abs. 3 UmwG als bekanntgemacht gilt, ihren Anspruch nach Grund und Höhe schriftlich anmelden, Sicherheit zu leisten, soweit sie nicht Befriedigung verlangen können. Dieses Recht steht ihnen jedoch nur zu, wenn sie glaubhaft machen, daß durch die Ausgliederung die Erfüllung ihrer Forderung gefährdet wird."
    },
    {
      "date": "2025-11-05",
      "id": "136366",
      "original_text": "Registerbekanntmachung nach dem Umwandlungsgesetz\nThüringen Amtsgericht Jena HRA 506292\nDenis Hopf e.K – Eisenach",
      "type": "Registerbekanntmachung nach dem Umwandlungsgesetz",
      "state": "Thüringen",
      "amtsgericht": "Amtsgericht Jena",
      "registernummer": "HRA 506292",
      "registerart": "HRA",
      "company_name": "Denis Hopf e.K",
      "company_seat": "Eisenach",
      "details": "05.11.2025 (Bekanntmachungsdatum)\n\nThüringen Amtsgericht Jena HRA 506292\nRegisterbekanntmachung nach dem Umwandlungsgesetz 05.11.2025 (Eintragungsdatum)\n\nDenis Hopf e.K\nEinzelkaufmann / Einzelkauffrau\nEisenach\n\nDas von dem Einzelkaufmann Hopf, Denis Ronald, Wutha-Farnroda, *23.07.1979 unter der Firma Denis Hopf e.K mit dem Sitz in Eisenach betriebene Unternehmen ist aus dem Vermögen gemäß Ausgliederungsvertrag vom 27.06.2025, mit Nachtrag vom 27.10.2025 auf die ideenwert GmbH & Co. KG mit dem Sitz in Eisenach (Amtsgericht Jena HRA 506862) ausgegliedert. Die Firma ist erloschen. Von Amts wegen eingetragen aufgrund § 155 UmwG.\nNicht eingetragen: Den Gläubigern der an der Ausgliederung beteiligten Rechtsträger, ist wenn sie binnen sechs Monaten nach dem Tag, an dem die Eintragung der Ausgliederung in das Register des Sitzes desjenigen Rechtsträgers, dessen Gläubiger sie sind, nach §§125, 19 Abs. 3 UmwG als bekanntgemacht gilt, ihren Anspruch nach Grund und Höhe schriftlich anmelden, Sicherheit zu leisten, soweit sie nicht Befriedigung verlangen können. Dieses Recht steht ihnen jedoch nur zu, wenn sie glaubhaft machen, daß durch die Ausgliederung die Erfüllung ihrer Forderung gefährdet wird."
    },
    {
      "date": "2025-11-05",
      "id": "136367",
      "original_text": "Registerbekanntmachung nach dem Umwandlungsgesetz\nBaden-Württemberg Amtsgericht Mannheim HRB 755348\nSchreinerei Kastner GmbH – Remchingen",
      "type": "Registerbekanntmachung nach dem Umwandlungsgesetz",
      "state": "Baden-Württemberg",
      "amtsgericht": "Amtsgericht Mannheim",
      "registernummer": "HRB 755348",
      "registerart": "HRB",
      "company_name": "Schreinerei Kastner GmbH",
      "company_seat": "Remchingen",
      "details": "05.11.2025 (Bekanntmachungsdatum)\n\nBaden-Württemberg Amtsgericht Mannheim HRB 755348\nRegisterbekanntmachung nach dem Umwandlungsgesetz 05.11.2025 (Eintragungsdatum)\n\nSchreinerei Kastner GmbH\nGesellschaft mit beschränkter Haftung\nRemchingen\n\nDen Gläubigern der an der Ausgliederung beteiligten Rechtsträger ist, wenn sie binnen sechs Monaten nach dem Tag, an dem die Eintragung der Ausgliederung in das Register des Sitzes desjenigen Rechtsträgers, dessen Gläubiger sie sind, nach § 19 Abs. 3 UmwG als bekanntgemacht gilt, ihren Anspruch nach Grund und Höhe schriftlich anmelden, Sicherheit zu leisten, soweit sie nicht Befriedigung verlangen können. Dieses Recht steht den Gläubigern jedoch nur zu, wenn sie glaubhaft machen, dass durch die Ausgliederung die Erfüllung ihrer Forderung gefährdet wird."
    },
    {
      "date": "2025-11-05",
      "id": "136368",
      "original_text": "Registerbekanntmachung nach dem Umwandlungsgesetz\nSchleswig-Holstein Amtsgericht Kiel GnR 562\nVR Bank Schleswig-Mittelholstein eG – Osterrönfeld",
      "type": "Registerbekanntmachung nach dem Umwandlungsgesetz",
      "state": "Schleswig-Holstein",
      "amtsgericht": "Amtsgericht Kiel",
      "registernummer": "GnR 562",
      "registerart": "GnR",
      "company_name": "VR Bank Schleswig-Mittelholstein eG",
      "company_seat": "Osterrönfeld",
      "details": "05.11.2025 (Bekanntmachungsdatum)\n\nSchleswig-Holstein Amtsgericht Kiel GnR 562\nRegisterbekanntmachung nach dem Umwandlungsgesetz 04.11.2025 (Eintragungsdatum)\n\nVR Bank Schleswig-Mittelholstein eG\neingetragene Genossenschaft\nOsterrönfeld\n\nZu Eintragungsnummer 11 vom 04.11.2025 wird als nicht eingetragen veröffentlicht: Den Gläubigern der an der Verschmelzung beteiligten Rechtsträger ist, wenn sie binnen sechs Monaten nach dem Tag, an dem die Eintragung der Verschmelzung in das Register des Sitzes desjenigen Rechtsträgers, dessen Gläubiger sie sind, nach § 19 Abs. 3 UmwG bekannt gemacht worden ist, ihren Anspruch nach Grund und Höhe schriftlich anmelden, Sicherheit zu leisten, soweit sie nicht Befriedigung verlangen können. Dieses Recht steht den Gläubigern jedoch nur zu, wenn sie glaubhaft machen, dass durch die Verschmelzung die Erfüllung ihrer Forderung gefährdet wird."
    },
    {
      "date": "2025-11-05",
      "id": "136369",
      "original_text": "Registerbekanntmachung nach dem Umwandlungsgesetz\nBaden-Württemberg Amtsgericht Mannheim HRA 701469\nSchreinerei Kastner Inh. Achim Kastner e.K. – Remchingen",
      "type": "Registerbekanntmachung nach dem Umwandlungsgesetz",
      "state": "Baden-Württemberg",
      "amtsgericht": "Amtsgericht Mannheim",
      "registernummer": "HRA 701469",
      "registerart": "HRA",
      "company_name": "Schreinerei Kastner Inh. Achim Kastner e.K.",
      "company_seat": "Remchingen",
      "details": "05.11.2025 (Bekanntmachungsdatum)\n\nBaden-Württemberg Amtsgericht Mannheim HRA 701469\nRegisterbekanntmachung nach dem Umwandlungsgesetz 05.11.2025 (Eintragungsdatum)\n\nSchreinerei Kastner Inh. Achim Kastner e.K.\nEinzelkaufmann / Einzelkauffrau\nRemchingen\n\nAls nicht eingetragen wird bekanntgemacht:\nDen Gläubigern der an der Ausgliederung beteiligten Rechtsträger ist, wenn sie binnen sechs Monaten nach dem Tag, an dem die Eintragung der Ausgliederung in das Register des Sitzes desjenigen Rechtsträgers, dessen Gläubiger sie sind, nach § 19 Abs. 3 UmwG als bekanntgemacht gilt, ihren Anspruch nach Grund und Höhe schriftlich anmelden, Sicherheit zu leisten, soweit sie nicht Befriedigung verlangen können. Dieses Recht steht den Gläubigern jedoch nur zu, wenn sie glaubhaft machen, dass durch die Ausgliederung die Erfüllung ihrer Forderung gefährdet wird."
    },
    {
      "date": "2025-11-05",
      "id": "136370",
      "original_text": "Sonstige Registerbekanntmachung\nSachsen-Anhalt Amtsgericht Stendal HRB 102249\nBau - GmbH \"Nordharz\" – Derenburg",
      "type": "Sonstige Registerbekanntmachung",
      "state": "Sachsen-Anhalt",
      "amtsgericht": "Amtsgericht Stendal",
      "registernummer": "HRB 102249",
      "registerart": "HRB",
      "company_name": "Bau - GmbH \"Nordharz\"",
      "company_seat": "Derenburg",
      "details": "05.11.2025 (Bekanntmachungsdatum)\n\nSachsen-Anhalt Amtsgericht Stendal HRB 102249\nSonstige Registerbekanntmachung\n\nBau - GmbH \"Nordharz\"\nGesellschaft mit beschränkter Haftung\nDerenburg\n\nHinsichtlich o.g. Gesellschaft ist beabsichtigt, Frau Sandra Schiemann, Hohnhorst zum Nachtragsliquidator zu bestellen.Die Frist zu Einreichung etwaiger Stellungnahmen bzw. Erhebung eines Widerspruchs beim Amtsgericht Stendal wird auf 1 Monat festgesetzt."
    },
    {
      "date": "2025-11-05",
      "id": "136371",
      "original_text": "Registerbekanntmachung nach dem Umwandlungsgesetz\nHamburg Amtsgericht Hamburg HRB 192740\nJakala GmbH – Hamburg",
      "type": "Registerbekanntmachung nach dem Umwandlungsgesetz",
      "state": "Hamburg",
      "amtsgericht": "Amtsgericht Hamburg",
      "registernummer": "HRB 192740",
      "registerart": "HRB",
      "company_name": "Jakala GmbH",
      "company_seat": "Hamburg",
      "details": "05.11.2025 (Bekanntmachungsdatum)\n\nHamburg Amtsgericht Hamburg HRB 192740\nRegisterbekanntmachung nach dem Umwandlungsgesetz 05.11.2025 (Eintragungsdatum)\n\nJakala GmbH\nGesellschaft mit beschränkter Haftung\nHamburg\n\nAls nicht eingetragen wird bekannt gemacht:\nDen Gläubigern der an der Verschmelzung beteiligten Gesellschaften ist, wenn sie binnen sechs Monaten nach dem Tag, an dem die Eintragung der Verschmelzung in das Register des Sitzes desjenigen Rechtsträgers, dessen Gläubiger sie sind, nach § 19 Absatz 3 UmwG als bekannt gemacht gilt, ihren Anspruch nach Grund und Höhe schriftlich anmelden, Sicherheit zu leisten, soweit sie nicht Befriedigung verlangen können. Dieses Recht steht den Gläubigern jedoch nur zu, wenn sie glaubhaft machen, dass durch die Verschmelzung die Erfüllung ihrer Forderung gefährdet wird."
    },
    {
      "date": "2025-11-05",
      "id": "136372",
      "original_text": "Registerbekanntmachung nach dem Umwandlungsgesetz\nHamburg Amtsgericht Hamburg HRB 194665\nJakala GmbH – Hamburg",
      "type": "Registerbekanntmachung nach dem Umwandlungsgesetz",
      "state": "Hamburg",
      "amtsgericht": "Amtsgericht Hamburg",
      "registernummer": "HRB 194665",
      "registerart": "HRB",
      "company_name": "Jakala GmbH",
      "company_seat": "Hamburg",
      "details": "05.11.2025 (Bekanntmachungsdatum)\n\nHamburg Amtsgericht Hamburg HRB 194665\nRegisterbekanntmachung nach dem Umwandlungsgesetz 05.11.2025 (Eintragungsdatum)\n\nJakala GmbH\nGesellschaft mit beschränkter Haftung\nHamburg\n\nAls nicht eingetragen wird bekannt gemacht:\nDen Gläubigern der an der Verschmelzung beteiligten Gesellschaften ist, wenn sie binnen sechs Monaten nach dem Tag, an dem die Eintragung der Verschmelzung in das Register des Sitzes desjenigen Rechtsträgers, dessen Gläubiger sie sind, nach § 19 Absatz 3 UmwG als bekannt gemacht gilt, ihren Anspruch nach Grund und Höhe schriftlich anmelden, Sicherheit zu leisten, soweit sie nicht Befriedigung verlangen können. Dieses Recht steht den Gläubigern jedoch nur zu, wenn sie glaubhaft machen, dass durch die Verschmelzung die Erfüllung ihrer Forderung gefährdet wird."
    },
    {
      "date": "2025-11-05",
      "id": "136373",
      "original_text": "Sonstige Registerbekanntmachung\nMecklenburg-Vorpommern Amtsgericht Neubrandenburg HRB 4110\nSemcoglas Glastechnik GmbH – Neubrandenburg",
      "type": "Sonstige Registerbekanntmachung",
      "state": "Mecklenburg-Vorpommern",
      "amtsgericht": "Amtsgericht Neubrandenburg",
      "registernummer": "HRB 4110",
      "registerart": "HRB",
      "company_name": "Semcoglas Glastechnik GmbH",
      "company_seat": "Neubrandenburg",
      "details": "05.11.2025 (Bekanntmachungsdatum)\n\nMecklenburg-Vorpommern Amtsgericht Neubrandenburg HRB 4110\nSonstige Registerbekanntmachung 05.11.2025 (Eintragungsdatum)\n\nSemcoglas Glastechnik GmbH\nGesellschaft mit beschränkter Haftung\nNeubrandenburg\n\nAls nicht eingetragen wird veröffentlicht: Den Gläubigern der Gesellschaft, deren Forderungen begründet worden sind bevor die Eintragung der Beendigung des Beherrschungs- und Gewinnabführungsvertrages in das Handelsregister nach § 10 des Handelsgesetzbuches als bekanntgemacht gilt, hat der andere Vertragsteil Sicherheit zu leisten, wenn sie sich binnen sechs Monaten nach der Bekanntmachung der Eintragung zu diesem Zweck bei ihm melden."
    },
    {
      "date": "2025-11-05",
      "id": "136374",
      "original_text": "Einreichung neuer Dokumente\nBaden-Württemberg Amtsgericht Stuttgart HRB 917\nStaatliche Toto-Lotto GmbH – Stuttgart",
      "type": "Einreichung neuer Dokumente",
      "state": "Baden-Württemberg",
      "amtsgericht": "Amtsgericht Stuttgart",
      "registernummer": "HRB 917",
      "registerart": "HRB",
      "company_name": "Staatliche Toto-Lotto GmbH",
      "company_seat": "Stuttgart",
      "details": "05.11.2025 (Bekanntmachungsdatum)\n\nBaden-Württemberg Amtsgericht Stuttgart HRB 917\nEinreichung neuer Dokumente 05.11.2025 (Eintragungsdatum)\n\nStaatliche Toto-Lotto GmbH\nGesellschaft mit beschränkter Haftung\nStuttgart\n\nDie Gesellschaft hat am 04.11.2025 die Liste über die Zusammensetzung des Aufsichtsrats zum Handelsregister eingereicht."
    },
    {
      "date": "2025-11-05",
      "id": "136375",
      "original_text": "Sonstige Registerbekanntmachung\nBerlin Amtsgericht Berlin (Charlottenburg) HRB 64059\nBFS SozialFinanz AG – Berlin und Köln",
      "type": "Sonstige Registerbekanntmachung",
      "state": "Berlin",
      "amtsgericht": "Amtsgericht Berlin (Charlottenburg)",
      "registernummer": "HRB 64059",
      "registerart": "HRB",
      "company_name": "BFS SozialFinanz AG",
      "company_seat": "Berlin und Köln",
      "details": "05.11.2025 (Bekanntmachungsdatum)\n\nBerlin Amtsgericht Berlin (Charlottenburg) HRB 64059\nSonstige Registerbekanntmachung\n\nBFS SozialFinanz AG\nAktiengesellschaft\nBerlin und Köln\n\nAls nicht eingetragen wird veröffentlicht: Es wurde eine neue Liste der Aufsichtsratsmitglieder eingereicht (§ 106 AktG)."
    },
    {
      "date": "2025-11-05",
      "id": "136376",
      "original_text": "Löschungsankündigung\nBerlin Amtsgericht Berlin (Charlottenburg) HRB 207961\nB24-Rent GmbH – Berlin",
      "type": "Löschungsankündigung",
      "state": "Berlin",
      "amtsgericht": "Amtsgericht Berlin (Charlottenburg)",
      "registernummer": "HRB 207961",
      "registerart": "HRB",
      "company_name": "B24-Rent GmbH",
      "company_seat": "Berlin",
      "details": "05.11.2025 (Bekanntmachungsdatum)\n\nBerlin Amtsgericht Berlin (Charlottenburg) HRB 207961\nLöschungsankündigung\n\nB24-Rent GmbH\nGesellschaft mit beschränkter Haftung\nBerlin\n\nBei der nachstehenden Gesellschaft wird das Amtslöschungsverfahren gemäß § 394 FamFG eingeleitet. Widerspruchsfrist 6 Wochen"
    },
    {
      "date": "2025-11-05",
      "id": "136377",
      "original_text": "Löschungsankündigung\nBerlin Amtsgericht Berlin (Charlottenburg) HRB 159894\nTIO Service UG (haftungsbeschränkt) – Berlin",
      "type": "Löschungsankündigung",
      "state": "Berlin",
      "amtsgericht": "Amtsgericht Berlin (Charlottenburg)",
      "registernummer": "HRB 159894",
      "registerart": "HRB",
      "company_name": "TIO Service UG (haftungsbeschränkt)",
      "company_seat": "Berlin",
      "details": "05.11.2025 (Bekanntmachungsdatum)\n\nBerlin Amtsgericht Berlin (Charlottenburg) HRB 159894\nLöschungsankündigung\n\nTIO Service UG (haftungsbeschränkt)\nGesellschaft mit beschränkter Haftung\nBerlin\n\nBei der nachstehenden Gesellschaft wird das Amtslöschungsverfahren gemäß § 394 FamFG eingeleitet. Widerspruchsfrist 6 Wochen"
    },
    {
      "date": "2025-11-05",
      "id": "136378",
      "original_text": "Löschungsankündigung\nSachsen-Anhalt Amtsgericht Stendal HRB 23263\nDFK Immobilien GmbH – Lutherstadt Eisleben",
      "type": "Löschungsankündigung",
      "state": "Sachsen-Anhalt",
      "amtsgericht": "Amtsgericht Stendal",
      "registernummer": "HRB 23263",
      "registerart": "HRB",
      "company_name": "DFK Immobilien GmbH",
      "company_seat": "Lutherstadt Eisleben",
      "details": "05.11.2025 (Bekanntmachungsdatum)\n\nSachsen-Anhalt Amtsgericht Stendal HRB 23263\nLöschungsankündigung\n\nDFK Immobilien GmbH\nGesellschaft mit beschränkter Haftung\nLutherstadt Eisleben\n\nDas Registergericht beabsichtigt, nachfolgende im Handelregister eingetragenen Firmen von Amts wegen nach § 394 FamFG zu löschen. Die Frist zu Erhebung eines Widerspruchs wird auf drei Monate festgesetzt."
    },
    {
      "date": "2025-11-05",
      "id": "136379",
      "original_text": "Registerbekanntmachung nach dem Umwandlungsgesetz\nSachsen-Anhalt Amtsgericht Stendal HRA 4887\nWindpark Lützen GmbH & Co. KG – Lützen",
      "type": "Registerbekanntmachung nach dem Umwandlungsgesetz",
      "state": "Sachsen-Anhalt",
      "amtsgericht": "Amtsgericht Stendal",
      "registernummer": "HRA 4887",
      "registerart": "HRA",
      "company_name": "Windpark Lützen GmbH & Co. KG",
      "company_seat": "Lützen",
      "details": "05.11.2025 (Bekanntmachungsdatum)\n\nSachsen-Anhalt Amtsgericht Stendal HRA 4887\nRegisterbekanntmachung nach dem Umwandlungsgesetz 05.11.2025 (Eintragungsdatum)\n\nWindpark Lützen GmbH & Co. KG\nKommanditgesellschaft\nLützen\n\nNicht eingetragen:\nDen Gläubigern der an der Verschmelzung beteiligten Rechtsträger ist, wenn sie binnen sechs Monaten nach dem Tag, an dem die Eintragung der Verschmelzung nach § 19 Abs. 3 UmwG als bekanntgemacht gilt, ihren Anspruch nach Grund und Höhe schriftlich anmelden, Sicherheit zu leisten, soweit sie nicht Befriedigung verlangen können. Dieses Recht steht ihnen jedoch nur zu, wenn sie glaubhaft machen, dass durch die Verschmelzung die Erfüllung ihrer Forderung gefährdet wird."
    },
    {
      "date": "2025-11-05",
      "id": "136380",
      "original_text": "Löschungsankündigung\nSchleswig-Holstein Amtsgericht Pinneberg HRA 1245 ME\nStührk Delikatessen Import GmbH & Co Kommanditgesellschaft – Marne",
      "type": "Löschungsankündigung",
      "state": "Schleswig-Holstein",
      "amtsgericht": "Amtsgericht Pinneberg",
      "registernummer": "HRA 1245 ME",
      "registerart": "HRA",
      "company_name": "Stührk Delikatessen Import GmbH & Co Kommanditgesellschaft",
      "company_seat": "Marne",
      "details": "05.11.2025 (Bekanntmachungsdatum)\n\nSchleswig-Holstein Amtsgericht Pinneberg HRA 1245 ME\nLöschungsankündigung\n\nStührk Delikatessen Import GmbH & Co Kommanditgesellschaft\nKommanditgesellschaft\nMarne\n\nEs ist die Löschung der nachstehenden Gesellschaft wegen Vermögenslosigkeit gemäß § 394 FamFG beabsichtigt. Widerspruchsfrist: 2 Monate."
    },
    {
      "date": "2025-11-05",
      "id": "136381",
      "original_text": "Sonstige Registerbekanntmachung\nBrandenburg Amtsgericht Frankfurt/Oder HRA 4495\nWaade Service Dienstleistungen e.K. – Rüdnitz",
      "type": "Sonstige Registerbekanntmachung",
      "state": "Brandenburg",
      "amtsgericht": "Amtsgericht Frankfurt/Oder",
      "registernummer": "HRA 4495",
      "registerart": "HRA",
      "company_name": "Waade Service Dienstleistungen e.K.",
      "company_seat": "Rüdnitz",
      "details": "05.11.2025 (Bekanntmachungsdatum)\n\nBrandenburg Amtsgericht Frankfurt/Oder HRA 4495\nSonstige Registerbekanntmachung 04.11.2025 (Eintragungsdatum)\n\nWaade Service Dienstleistungen e.K.\nEinzelkaufmann / Einzelkauffrau\nRüdnitz\n\nAls nicht eingetragen wird veröffentlicht:\nDen Gläubigern der an der Spaltung beteiligten Rechtsträger ist, wenn sie binnen sechs Monaten nach dem Tag, an dem die Eintragung der Spaltung in das Register des Sitzes desjenigen Rechtsträgers, dessen Gläubiger sie sind, als bekannt gemacht gilt, ihren Anspruch nach Grund und Höhe schriftlich anmelden, Sicherheit zu leisten, soweit sie nicht Befriedigung verlangen können. Dieses Recht steht den Gläubigern jedoch nur zu, wenn sie glaubhaft machen, dass durch die Spaltung die Erfüllung ihrer Forderung gefährdet wird"
    },
    {
      "date": "2025-11-05",
      "id": "136382",
      "original_text": "Löschungsankündigung\nBrandenburg Amtsgericht Cottbus HRB 13702\nALLFORK UG (haftungsbeschränkt) – Schönefeld",
      "type": "Löschungsankündigung",
      "state": "Brandenburg",
      "amtsgericht": "Amtsgericht Cottbus",
      "registernummer": "HRB 13702",
      "registerart": "HRB",
      "company_name": "ALLFORK UG (haftungsbeschränkt)",
      "company_seat": "Schönefeld",
      "details": "05.11.2025 (Bekanntmachungsdatum)\n\nBrandenburg Amtsgericht Cottbus HRB 13702\nLöschungsankündigung\n\nALLFORK UG (haftungsbeschränkt)\nGesellschaft mit beschränkter Haftung\nSchönefeld\n\nBei der nachstehenden Gesellschaft wird das Amtslöschungsverfahren gemäß § 394 FamFG eingeleitet."
    },
    {
      "date": "2025-11-05",
      "id": "136383",
      "original_text": "Löschungsankündigung\nBerlin Amtsgericht Berlin (Charlottenburg) HRB 251784\nCBC Fahrzeugaufbereitung GmbH – Berlin",
      "type": "Löschungsankündigung",
      "state": "Berlin",
      "amtsgericht": "Amtsgericht Berlin (Charlottenburg)",
      "registernummer": "HRB 251784",
      "registerart": "HRB",
      "company_name": "CBC Fahrzeugaufbereitung GmbH",
      "company_seat": "Berlin",
      "details": "05.11.2025 (Bekanntmachungsdatum)\n\nBerlin Amtsgericht Berlin (Charlottenburg) HRB 251784\nLöschungsankündigung\n\nCBC Fahrzeugaufbereitung GmbH\nGesellschaft mit beschränkter Haftung\nBerlin\n\nBei der nachstehenden Gesellschaft wird das Amtslöschungsverfahren gemäß § 394 FamFG eingeleitet. Widerspruchsfrist 6 Wochen"
    },
    {
      "date": "2025-11-05",
      "id": "136384",
      "original_text": "Löschungsankündigung\nBrandenburg Amtsgericht Frankfurt/Oder HRB 17826\nPMWD Vertrieb UG (haftungsbeschränkt) – Frankfurt (Oder)",
      "type": "Löschungsankündigung",
      "state": "Brandenburg",
      "amtsgericht": "Amtsgericht Frankfurt/Oder",
      "registernummer": "HRB 17826",
      "registerart": "HRB",
      "company_name": "PMWD Vertrieb UG (haftungsbeschränkt)",
      "company_seat": "Frankfurt (Oder)",
      "details": "05.11.2025 (Bekanntmachungsdatum)\n\nBrandenburg Amtsgericht Frankfurt/Oder HRB 17826\nLöschungsankündigung\n\nPMWD Vertrieb UG (haftungsbeschränkt)\nGesellschaft mit beschränkter Haftung\nFrankfurt (Oder)\n\nBei der nachstehenden Gesellschaft wird das Amtslöschungsverfahren gemäß § 394 Abs. 1 FamFG eingeleitet."
    },
    {
      "date": "2025-11-05",
      "id": "136385",
      "original_text": "Registerbekanntmachung nach dem Umwandlungsgesetz\nSachsen Amtsgericht Chemnitz HRB 17345\nMRH Mobile Raumsysteme Hubrig GmbH – Limbach-Oberfrohna",
      "type": "Registerbekanntmachung nach dem Umwandlungsgesetz",
      "state": "Sachsen",
      "amtsgericht": "Amtsgericht Chemnitz",
      "registernummer": "HRB 17345",
      "registerart": "HRB",
      "company_name": "MRH Mobile Raumsysteme Hubrig GmbH",
      "company_seat": "Limbach-Oberfrohna",
      "details": "05.11.2025 (Bekanntmachungsdatum)\n\nSachsen Amtsgericht Chemnitz HRB 17345\nRegisterbekanntmachung nach dem Umwandlungsgesetz 05.11.2025 (Eintragungsdatum)\n\nMRH Mobile Raumsysteme Hubrig GmbH\nGesellschaft mit beschränkter Haftung\nLimbach-Oberfrohna\n\nDen Gläubigern der an der Verschmelzung beteiligten Rechtsträger ist, wenn sie binnen sechs Monaten nach dem Tag, an dem die Eintragung der Verschmelzung in das Register des Sitzes desjenigen Rechtsträgers, dessen Gläubiger sie sind, nach § 19 Abs. 3 UmwG als bekannt gemacht gilt, ihren Anspruch nach Grund und Höhe in Textform anmelden, Sicherheit zu leisten, soweit sie nicht Befriedigung verlangen können. Dieses Recht steht den Gläubigern jedoch nur zu, wenn sie glaubhaft machen, dass durch die Verschmelzung die Erfüllung der Forderung gefährdet wird."
    },
    {
      "date": "2025-11-05",
      "id": "136386",
      "original_text": "Registerbekanntmachung nach dem Umwandlungsgesetz\nSachsen Amtsgericht Chemnitz GsR 559\nMobile Raumsysteme Hubrig eGbR – Limbach-Oberfrohna",
      "type": "Registerbekanntmachung nach dem Umwandlungsgesetz",
      "state": "Sachsen",
      "amtsgericht": "Amtsgericht Chemnitz",
      "registernummer": "GsR 559",
      "registerart": "GsR",
      "company_name": "Mobile Raumsysteme Hubrig eGbR",
      "company_seat": "Limbach-Oberfrohna",
      "details": "05.11.2025 (Bekanntmachungsdatum)\n\nSachsen Amtsgericht Chemnitz GsR 559\nRegisterbekanntmachung nach dem Umwandlungsgesetz 05.11.2025 (Eintragungsdatum)\n\nMobile Raumsysteme Hubrig eGbR\nGesellschaft bürgerlichen Rechts\nLimbach-Oberfrohna\n\nDen Gläubigern der an der Verschmelzung beteiligten Rechtsträger ist, wenn sie binnen sechs Monaten nach dem Tag, an dem die Eintragung der Verschmelzung in das Register des Sitzes desjenigen Rechtsträgers, dessen Gläubiger sie sind, nach § 19 Abs. 3 UmwG als bekannt gemacht gilt, ihren Anspruch nach Grund und Höhe in Textform anmelden, Sicherheit zu leisten, soweit sie nicht Befriedigung verlangen können. Dieses Recht steht den Gläubigern jedoch nur zu, wenn sie glaubhaft machen, dass durch die Verschmelzung die Erfüllung der Forderung gefährdet wird."
    },
    {
      "date": "2025-11-05",
      "id": "136387",
      "original_text": "Löschungsankündigung\nSachsen Amtsgericht Dresden HRB 38258\nOh my basic UG (haftungsbeschränkt) – Weißwasser",
      "type": "Löschungsankündigung",
      "state": "Sachsen",
      "amtsgericht": "Amtsgericht Dresden",
      "registernummer": "HRB 38258",
      "registerart": "HRB",
      "company_name": "Oh my basic UG (haftungsbeschränkt)",
      "company_seat": "Weißwasser",
      "details": "05.11.2025 (Bekanntmachungsdatum)\n\nSachsen Amtsgericht Dresden HRB 38258\nLöschungsankündigung\n\nOh my basic UG (haftungsbeschränkt)\nGesellschaft mit beschränkter Haftung\nWeißwasser\n\nDas Registergericht beabsichtigt, die im Handelsregister eingetragene Gesellschaft von Amts wegen nach § 394 FamFG zu löschen. Die Frist zu Erhebung eines Widerspruchs gegen die beabsichtigte Löschung wird auf einen Monat festgesetzt."
    },
    {
      "date": "2025-11-05",
      "id": "136388",
      "original_text": "Löschungsankündigung\nSachsen Amtsgericht Dresden HRB 38521\nRUDLOFF Akustik & Trockenbau Verwaltungs GmbH – Radebeul",
      "type": "Löschungsankündigung",
      "state": "Sachsen",
      "amtsgericht": "Amtsgericht Dresden",
      "registernummer": "HRB 38521",
      "registerart": "HRB",
      "company_name": "RUDLOFF Akustik & Trockenbau Verwaltungs GmbH",
      "company_seat": "Radebeul",
      "details": "05.11.2025 (Bekanntmachungsdatum)\n\nSachsen Amtsgericht Dresden HRB 38521\nLöschungsankündigung\n\nRUDLOFF Akustik & Trockenbau Verwaltungs GmbH\nGesellschaft mit beschränkter Haftung\nRadebeul\n\nDas Registergericht beabsichtigt, die im Handelsregister eingetragene Gesellschaft von Amts wegen nach § 394 FamFG zu löschen. Die Frist zu Erhebung eines Widerspruchs gegen die beabsichtigte Löschung wird auf einen Monat festgesetzt."
    },
    {
      "date": "2025-11-05",
      "id": "136389",
      "original_text": "Registerbekanntmachung nach dem Umwandlungsgesetz\nSachsen Amtsgericht Chemnitz HRB 24025\nSTB GmbH – Mülsen",
      "type": "Registerbekanntmachung nach dem Umwandlungsgesetz",
      "state": "Sachsen",
      "amtsgericht": "Amtsgericht Chemnitz",
      "registernummer": "HRB 24025",
      "registerart": "HRB",
      "company_name": "STB GmbH",
      "company_seat": "Mülsen",
      "details": "05.11.2025 (Bekanntmachungsdatum)\n\nSachsen Amtsgericht Chemnitz HRB 24025\nRegisterbekanntmachung nach dem Umwandlungsgesetz 05.11.2025 (Eintragungsdatum)\n\nSTB GmbH\nGesellschaft mit beschränkter Haftung\nMülsen\n\nDen Gläubigern der an der Verschmelzung beteiligten Rechtsträger ist, wenn sie binnen sechs Monaten nach dem Tag, an dem die Eintragung der Verschmelzung in das Register des Sitzes desjenigen Rechtsträgers, dessen Gläubiger sie sind, nach § 19 Abs. 3 UmwG als bekannt gemacht gilt, ihren Anspruch nach Grund und Höhe in Textform anmelden, Sicherheit zu leisten, soweit sie nicht Befriedigung verlangen können. Dieses Recht steht den Gläubigern jedoch nur zu, wenn sie glaubhaft machen, dass durch die Verschmelzung die Erfüllung der Forderung gefährdet wird."
    },
    {
      "date": "2025-11-05",
      "id": "136390",
      "original_text": "Registerbekanntmachung nach dem Umwandlungsgesetz\nSachsen Amtsgericht Chemnitz HRA 10252\nA. Richter Kälte- u. Klimatechnik e.K. – Plauen",
      "type": "Registerbekanntmachung nach dem Umwandlungsgesetz",
      "state": "Sachsen",
      "amtsgericht": "Amtsgericht Chemnitz",
      "registernummer": "HRA 10252",
      "registerart": "HRA",
      "company_name": "A. Richter Kälte- u. Klimatechnik e.K.",
      "company_seat": "Plauen",
      "details": "05.11.2025 (Bekanntmachungsdatum)\n\nSachsen Amtsgericht Chemnitz HRA 10252\nRegisterbekanntmachung nach dem Umwandlungsgesetz 05.11.2025 (Eintragungsdatum)\n\nA. Richter Kälte- u. Klimatechnik e.K.\nEinzelkaufmann / Einzelkauffrau\nPlauen\n\nDen Gläubigern der an der Ausgliederung beteiligten Rechtsträger ist, wenn sie binnen sechs Monaten nach dem Tag, an dem die Eintragung der Ausgliederung in das Register des Sitzes desjenigen Rechtsträgers, dessen Gläubiger sie sind, nach § 19 Abs. 3 UmwG als bekannt gemacht gilt, ihren Anspruch nach Grund und Höhe in Textform anmelden, Sicherheit zu leisten, soweit sie nicht Befriedigung verlangen können. Dieses Recht steht den Gläubigern jedoch nur zu, wenn sie glaubhaft machen, dass durch die Ausgliederung die Erfüllung der Forderung gefährdet wird."
    },
    {
      "date": "2025-11-05",
      "id": "136391",
      "original_text": "Löschungsankündigung\nSachsen Amtsgericht Chemnitz HRB 31498\nE Pluribus Unum Vermögensgesellschaft UG (haftungsbeschränkt) – Werdau",
      "type": "Löschungsankündigung",
      "state": "Sachsen",
      "amtsgericht": "Amtsgericht Chemnitz",
      "registernummer": "HRB 31498",
      "registerart": "HRB",
      "company_name": "E Pluribus Unum Vermögensgesellschaft UG (haftungsbeschränkt)",
      "company_seat": "Werdau",
      "details": "05.11.2025 (Bekanntmachungsdatum)\n\nSachsen Amtsgericht Chemnitz HRB 31498\nLöschungsankündigung\n\nE Pluribus Unum Vermögensgesellschaft UG (haftungsbeschränkt)\nGesellschaft mit beschränkter Haftung\nWerdau\n\nDas Registergericht beabsichtigt, die im Handelsregister eingetragene Gesellschaft von Amts wegen nach § 394 FamFG zu löschen. Die Frist zu Erhebung eines Widerspruchs gegen die beabsichtigte Löschung wird auf einen Monat festgesetzt."
    },
    {
      "date": "2025-11-05",
      "id": "136392",
      "original_text": "Registerbekanntmachung nach dem Umwandlungsgesetz\nSachsen Amtsgericht Chemnitz HRA 10256\nRichter Kälte- & Klimatechnik GmbH & Co. KG – Plauen",
      "type": "Registerbekanntmachung nach dem Umwandlungsgesetz",
      "state": "Sachsen",
      "amtsgericht": "Amtsgericht Chemnitz",
      "registernummer": "HRA 10256",
      "registerart": "HRA",
      "company_name": "Richter Kälte- & Klimatechnik GmbH & Co. KG",
      "company_seat": "Plauen",
      "details": "05.11.2025 (Bekanntmachungsdatum)\n\nSachsen Amtsgericht Chemnitz HRA 10256\nRegisterbekanntmachung nach dem Umwandlungsgesetz 05.11.2025 (Eintragungsdatum)\n\nRichter Kälte- & Klimatechnik GmbH & Co. KG\nKommanditgesellschaft\nPlauen\n\nDen Gläubigern der an der Ausgliederung beteiligten Rechtsträger ist, wenn sie binnen sechs Monaten nach dem Tag, an dem die Eintragung der Ausgliederung in das Register des Sitzes desjenigen Rechtsträgers, dessen Gläubiger sie sind, nach § 19 Abs. 3 UmwG als bekannt gemacht gilt, ihren Anspruch nach Grund und Höhe in Textform anmelden, Sicherheit zu leisten, soweit sie nicht Befriedigung verlangen können. Dieses Recht steht den Gläubigern jedoch nur zu, wenn sie glaubhaft machen, dass durch die Ausgliederung die Erfüllung der Forderung gefährdet wird."
    },
    {
      "date": "2025-11-05",
      "id": "136393",
      "original_text": "Löschungsankündigung\nBaden-Württemberg Amtsgericht Freiburg VR 320130\nFunk Club Schluchsee Hochschwarzwald e.V. – Schluchsee",
      "type": "Löschungsankündigung",
      "state": "Baden-Württemberg",
      "amtsgericht": "Amtsgericht Freiburg",
      "registernummer": "VR 320130",
      "registerart": "VR",
      "company_name": "Funk Club Schluchsee Hochschwarzwald e.V.",
      "company_seat": "Schluchsee",
      "details": "05.11.2025 (Bekanntmachungsdatum)\n\nBaden-Württemberg Amtsgericht Freiburg VR 320130\nLöschungsankündigung\n\nFunk Club Schluchsee Hochschwarzwald e.V.\neingetragener Verein\nSchluchsee\n\nDas Gericht beabsichtigt, die Eintragung des Vereins im Vereinsregister wegen des Mangels einer wesentlichen Voraussetzung von Amts wegen nals unzulässig zu löschen. Die Frist zur Geltendmachung eines Widerspruchs gegen die beabsichtigte Löschung ist auf einen Monat ab Veröffentlichung bestimmt."
    },
    {
      "date": "2025-11-05",
      "id": "136394",
      "original_text": "Registerbekanntmachung nach dem Umwandlungsgesetz\nNiedersachsen Amtsgericht Osnabrück HRB 221798\nDerGrilltyp GmbH – Hilter a.T.W.",
      "type": "Registerbekanntmachung nach dem Umwandlungsgesetz",
      "state": "Niedersachsen",
      "amtsgericht": "Amtsgericht Osnabrück",
      "registernummer": "HRB 221798",
      "registerart": "HRB",
      "company_name": "DerGrilltyp GmbH",
      "company_seat": "Hilter a.T.W.",
      "details": "05.11.2025 (Bekanntmachungsdatum)\n\nNiedersachsen Amtsgericht Osnabrück HRB 221798\nRegisterbekanntmachung nach dem Umwandlungsgesetz 05.11.2025 (Eintragungsdatum)\n\nDerGrilltyp GmbH\nGesellschaft mit beschränkter Haftung\nHilter a.T.W.\n\nDen Gläubigern der an der Ausgliederung beteiligten Rechtsträger ist, wenn sie binnen sechs Monaten nach dem Tag, an dem die Eintragung der Ausgliederung in das Register des Sitzes desjenigen Rechtsträgers, dessen Gläubiger sie sind, nach § 19 Abs. 3 UmwG als bekannt gemacht gilt, ihren Anspruch nach Grund und Höhe schriftlich anmelden, Sicherheit zu leisten, soweit sie nicht Befriedigung verlangen können. Dieses Recht steht den Gläubigern jedoch nur zu, wenn sie glaubhaft machen, dass durch die Ausgliederung die Erfüllung der Forderung gefährdet wird."
    },
    {
      "date": "2025-11-05",
      "id": "136395",
      "original_text": "Einreichung neuer Dokumente\nNiedersachsen Amtsgericht Hannover HRB 218079\nX4B Serviceagentur für die Wirtschaft GmbH – Hannover",
      "type": "Einreichung neuer Dokumente",
      "state": "Niedersachsen",
      "amtsgericht": "Amtsgericht Hannover",
      "registernummer": "HRB 218079",
      "registerart": "HRB",
      "company_name": "X4B Serviceagentur für die Wirtschaft GmbH",
      "company_seat": "Hannover",
      "details": "05.11.2025 (Bekanntmachungsdatum)\n\nNiedersachsen Amtsgericht Hannover HRB 218079\nEinreichung neuer Dokumente\n\nX4B Serviceagentur für die Wirtschaft GmbH\nGesellschaft mit beschränkter Haftung\nHannover\n\nDie Liste der Mitglieder des Aufsichtsrats wurde beim Registergericht eingereicht."
    },
    {
      "date": "2025-11-05",
      "id": "136396",
      "original_text": "Löschungsankündigung\nNiedersachsen Amtsgericht Braunschweig HRB 207848\nGastronomiebetriebsgesellschaft Flint UG (haftungsbeschränkt) – Braunschweig",
      "type": "Löschungsankündigung",
      "state": "Niedersachsen",
      "amtsgericht": "Amtsgericht Braunschweig",
      "registernummer": "HRB 207848",
      "registerart": "HRB",
      "company_name": "Gastronomiebetriebsgesellschaft Flint UG (haftungsbeschränkt)",
      "company_seat": "Braunschweig",
      "details": "05.11.2025 (Bekanntmachungsdatum)\n\nNiedersachsen Amtsgericht Braunschweig HRB 207848\nLöschungsankündigung\n\nGastronomiebetriebsgesellschaft Flint UG (haftungsbeschränkt)\nGesellschaft mit beschränkter Haftung\nBraunschweig\n\nDas Registergericht beabsichtigt, die Gesellschaft von Amts wegen nach § 394 FamFG zu löschen. Die Frist zur Erhebung eines Widerspruchs ist auf 1 Monat ab dieser Registerbekanntmachung festgesetzt."
    },
    {
      "date": "2025-11-05",
      "id": "136397",
      "original_text": "Registerbekanntmachung nach dem Umwandlungsgesetz\nNiedersachsen Amtsgericht Oldenburg (Oldenburg) HRB 140370 früher Amtsgericht Delmenhorst\nAMORIM Deutschland GmbH – Delmenhorst",
      "type": "Registerbekanntmachung nach dem Umwandlungsgesetz",
      "state": "Niedersachsen",
      "amtsgericht": "Amtsgericht Oldenburg (Oldenburg)",
      "registernummer": "HRB 140370",
      "registerart": "HRB",
      "company_name": "AMORIM Deutschland GmbH",
      "company_seat": "Delmenhorst",
      "former_amtsgericht": "Delmenhorst",
      "details": "05.11.2025 (Bekanntmachungsdatum)\n\nNiedersachsen Amtsgericht Oldenburg (Oldenburg) HRB 140370 früher Amtsgericht Delmenhorst\nRegisterbekanntmachung nach dem Umwandlungsgesetz 05.11.2025 (Eintragungsdatum)\n\nAMORIM Deutschland GmbH\nGesellschaft mit beschränkter Haftung\nDelmenhorst\n\nDen Gläubigern der an der Verschmelzung beteiligten Rechtsträger ist, wenn sie binnen sechs Monaten nach dem Tag, an dem die Eintragung der Verschmelzung in das Register des Sitzes desjenigen Rechtsträgers, dessen Gläubiger sie sind, nach § 19  Abs.  3 UmwG als bekannt gemacht gilt, ihren Anspruch nach Grund und Höhe schriftlich anmelden, Sicherheit zu leisten, soweit sie nicht Befriedigung verlangen können. Dieses Recht steht den Gläubigern jedoch nur zu, wenn sie glaubhaft machen, dass durch die Verschmelzung die Erfüllung der Forderung gefährdet wird."
    },
    {
      "date": "2025-11-05",
      "id": "136398",
      "original_text": "Löschungsankündigung\nNiedersachsen Amtsgericht Osnabrück HRB 217010\nSpahner Sportpferde UG (haftungsbeschränkt) – Haren",
      "type": "Löschungsankündigung",
      "state": "Niedersachsen",
      "amtsgericht": "Amtsgericht Osnabrück",
      "registernummer": "HRB 217010",
      "registerart": "HRB",
      "company_name": "Spahner Sportpferde UG (haftungsbeschränkt)",
      "company_seat": "Haren",
      "details": "05.11.2025 (Bekanntmachungsdatum)\n\nNiedersachsen Amtsgericht Osnabrück HRB 217010\nLöschungsankündigung\n\nSpahner Sportpferde UG (haftungsbeschränkt)\nGesellschaft mit beschränkter Haftung\nHaren\n\nDas Registergericht beabsichtigt, die Gesellschaft von Amts wegen nach § 394 FamFG wegen Vermögenslosigkeit zu löschen. Die Frist zur Erhebung eines Widerspruchs ist auf 1 Monat ab dieser Registerbekanntmachung festgesetzt."
    },
    {
      "date": "2025-11-05",
      "id": "136399",
      "original_text": "Registerbekanntmachung nach dem Umwandlungsgesetz\nNiedersachsen Amtsgericht Oldenburg (Oldenburg) HRB 214223\nAmorim Cork Composites GmbH – Delmenhorst",
      "type": "Registerbekanntmachung nach dem Umwandlungsgesetz",
      "state": "Niedersachsen",
      "amtsgericht": "Amtsgericht Oldenburg (Oldenburg)",
      "registernummer": "HRB 214223",
      "registerart": "HRB",
      "company_name": "Amorim Cork Composites GmbH",
      "company_seat": "Delmenhorst",
      "details": "05.11.2025 (Bekanntmachungsdatum)\n\nNiedersachsen Amtsgericht Oldenburg (Oldenburg) HRB 214223\nRegisterbekanntmachung nach dem Umwandlungsgesetz 05.11.2025 (Eintragungsdatum)\n\nAmorim Cork Composites GmbH\nGesellschaft mit beschränkter Haftung\nDelmenhorst\n\nDen Gläubigern der an der Verschmelzung beteiligten Rechtsträger ist, wenn sie binnen sechs Monaten nach dem Tag, an dem die Eintragung der Verschmelzung in das Register des Sitzes desjenigen Rechtsträgers, dessen Gläubiger sie sind, nach § 19  Abs.  3 UmwG als bekannt gemacht gilt, ihren Anspruch nach Grund und Höhe schriftlich anmelden, Sicherheit zu leisten, soweit sie nicht Befriedigung verlangen können. Dieses Recht steht den Gläubigern jedoch nur zu, wenn sie glaubhaft machen, dass durch die Verschmelzung die Erfüllung der Forderung gefährdet wird."
    },
    {
      "date": "2025-11-05",
      "id": "136400",
      "original_text": "Löschungsankündigung\nNiedersachsen Amtsgericht Lüneburg HRB 209460\nESG GmbH – Undeloh",
      "type": "Löschungsankündigung",
      "state": "Niedersachsen",
      "amtsgericht": "Amtsgericht Lüneburg",
      "registernummer": "HRB 209460",
      "registerart": "HRB",
      "company_name": "ESG GmbH",
      "company_seat": "Undeloh",
      "details": "05.11.2025 (Bekanntmachungsdatum)\n\nNiedersachsen Amtsgericht Lüneburg HRB 209460\nLöschungsankündigung\n\nESG GmbH\nGesellschaft mit beschränkter Haftung\nUndeloh\n\nDas Registergericht beabsichtigt, die Gesellschaft von Amts wegen nach § 394 FamFG zu löschen. Die Frist zur Erhebung eines Widerspruchs ist auf 1 Monat ab dieser Registerbekanntmachung festgesetzt."
    },
    {
      "date": "2025-11-05",
      "id": "136401",
      "original_text": "Einreichung neuer Dokumente\nBremen Amtsgericht Bremen HRB 15474\nArcelorMittal Bremen GmbH – Bremen",
      "type": "Einreichung neuer Dokumente",
      "state": "Bremen",
      "amtsgericht": "Amtsgericht Bremen",
      "registernummer": "HRB 15474",
      "registerart": "HRB",
      "company_name": "ArcelorMittal Bremen GmbH",
      "company_seat": "Bremen",
      "details": "05.11.2025 (Bekanntmachungsdatum)\n\nBremen Amtsgericht Bremen HRB 15474\nEinreichung neuer Dokumente\n\nArcelorMittal Bremen GmbH\nGesellschaft mit beschränkter Haftung\nBremen\n\nAls nicht eingetragen wird veröffentlicht: Liste des Aufsichtsrats wurde eingereicht."
    },
    {
      "date": "2025-11-05",
      "id": "136402",
      "original_text": "Löschungsankündigung\nBremen Amtsgericht Bremen HRB 30641\nCYM Handel GmbH – Bremen",
      "type": "Löschungsankündigung",
      "state": "Bremen",
      "amtsgericht": "Amtsgericht Bremen",
      "registernummer": "HRB 30641",
      "registerart": "HRB",
      "company_name": "CYM Handel GmbH",
      "company_seat": "Bremen",
      "details": "05.11.2025 (Bekanntmachungsdatum)\n\nBremen Amtsgericht Bremen HRB 30641\nLöschungsankündigung\n\nCYM Handel GmbH\nGesellschaft mit beschränkter Haftung\nBremen\n\nEs ist beabsichtigt die im Handelsregister eingetragene Gesellschaft von Amts wegen gemäß § 394 FamFG zu löschen. Gegen die Löschung kann beim AG Bremen schriftlich oder zu Protokoll der Geschäftsstelle Widerspruch eingelegt werden. Widerspruchsfrist 4 Wochen."
    },
    {
      "date": "2025-11-05",
      "id": "136403",
      "original_text": "Registerbekanntmachung nach dem Umwandlungsgesetz\nBremen Amtsgericht Bremen HRA 30702\nKutami Pascale Schmökel e.K. – Bremen",
      "type": "Registerbekanntmachung nach dem Umwandlungsgesetz",
      "state": "Bremen",
      "amtsgericht": "Amtsgericht Bremen",
      "registernummer": "HRA 30702",
      "registerart": "HRA",
      "company_name": "Kutami Pascale Schmökel e.K.",
      "company_seat": "Bremen",
      "details": "05.11.2025 (Bekanntmachungsdatum)\n\nBremen Amtsgericht Bremen HRA 30702\nRegisterbekanntmachung nach dem Umwandlungsgesetz 04.11.2025 (Eintragungsdatum)\n\nKutami Pascale Schmökel e.K.\nEinzelkaufmann / Einzelkauffrau\nBremen\n\nZu Eintragungsnummer 2 vom 04.11.2025 wird als nicht eingetragen veröffentlicht: Den Gläubigern der an der Verschmelzung beteiligten Rechtsträger ist, wenn sie binnen sechs Monaten nach dem Tag, an dem die Eintragung der Verschmelzung in das Register des Sitzes desjenigen Rechtsträgers, dessen Gläubiger sie sind, als bekannt gemacht gilt, ihren Anspruch nach Grund und Höhe schriftlich anmelden, Sicherheit zu leisten, soweit sie nicht Befriedigung verlangen können. Dieses Recht steht den Gläubigern jedoch nur zu, wenn sie glaubhaft machen, dass durch die Verschmelzung die Erfüllung ihrer Forderung gefährdet wird. Das Recht, Sicherheitsleistung zu verlangen, steht Gläubigern nicht zu, die im Falle der Insolvenz ein Recht auf vorzugsweise Befriedigung aus einer Deckungsmasse haben, die nach gesetzlicher Vorschrift zu ihrem Schutz errichtet und staatlich überwacht ist."
    },
    {
      "date": "2025-11-05",
      "id": "136404",
      "original_text": "Registerbekanntmachung nach dem Umwandlungsgesetz\nBremen Amtsgericht Bremen HRB 41714\nKutami GmbH – Bremen",
      "type": "Registerbekanntmachung nach dem Umwandlungsgesetz",
      "state": "Bremen",
      "amtsgericht": "Amtsgericht Bremen",
      "registernummer": "HRB 41714",
      "registerart": "HRB",
      "company_name": "Kutami GmbH",
      "company_seat": "Bremen",
      "details": "05.11.2025 (Bekanntmachungsdatum)\n\nBremen Amtsgericht Bremen HRB 41714\nRegisterbekanntmachung nach dem Umwandlungsgesetz 04.11.2025 (Eintragungsdatum)\n\nKutami GmbH\nGesellschaft mit beschränkter Haftung\nBremen\n\nZu Eintragungsnummer 2 vom 04.11.2025 wird als nicht eingetragen veröffentlicht: Den Gläubigern der an der Verschmelzung beteiligten Rechtsträger ist, wenn sie binnen sechs Monaten nach dem Tag, an dem die Eintragung der Verschmelzung in das Register des Sitzes desjenigen Rechtsträgers, dessen Gläubiger sie sind, als bekannt gemacht gilt, ihren Anspruch nach Grund und Höhe schriftlich anmelden, Sicherheit zu leisten, soweit sie nicht Befriedigung verlangen können. Dieses Recht steht den Gläubigern jedoch nur zu, wenn sie glaubhaft machen, dass durch die Verschmelzung die Erfüllung ihrer Forderung gefährdet wird. Das Recht, Sicherheitsleistung zu verlangen, steht Gläubigern nicht zu, die im Falle der Insolvenz ein Recht auf vorzugsweise Befriedigung aus einer Deckungsmasse haben, die nach gesetzlicher Vorschrift zu ihrem Schutz errichtet und staatlich überwacht ist."
    },
    {
      "date": "2025-11-05",
      "id": "136405",
      "original_text": "Löschungsankündigung\nRheinland-Pfalz Amtsgericht Zweibrücken HRB 30929\nI&B Immobilien und Bauservice GmbH – Hermersberg",
      "type": "Löschungsankündigung",
      "state": "Rheinland-Pfalz",
      "amtsgericht": "Amtsgericht Zweibrücken",
      "registernummer": "HRB 30929",
      "registerart": "HRB",
      "company_name": "I&B Immobilien und Bauservice GmbH",
      "company_seat": "Hermersberg",
      "details": "05.11.2025 (Bekanntmachungsdatum)\n\nRheinland-Pfalz Amtsgericht Zweibrücken HRB 30929\nLöschungsankündigung\n\nI&B Immobilien und Bauservice GmbH\nGesellschaft mit beschränkter Haftung\nHermersberg\n\nDas Registergericht beabsichtigt die Gesellschaft von Amts wegen nach § 394 FamFG zu löschen. Die Frist zur Erhebung eines Widerspruchs ist auf einen Monat festgesetzt."
    },
    {
      "date": "2025-11-05",
      "id": "136406",
      "original_text": "Löschungsankündigung\nRheinland-Pfalz Amtsgericht Montabaur HRB 21448\nCOOL JET GmbH – Liebenscheid",
      "type": "Löschungsankündigung",
      "state": "Rheinland-Pfalz",
      "amtsgericht": "Amtsgericht Montabaur",
      "registernummer": "HRB 21448",
      "registerart": "HRB",
      "company_name": "COOL JET GmbH",
      "company_seat": "Liebenscheid",
      "details": "05.11.2025 (Bekanntmachungsdatum)\n\nRheinland-Pfalz Amtsgericht Montabaur HRB 21448\nLöschungsankündigung 05.11.2025 (Eintragungsdatum)\n\nCOOL JET GmbH\nGesellschaft mit beschränkter Haftung\nLiebenscheid\n\nDas Registergericht beabsichtigt die Gesellschaft COOL JET GmbH mit Sitz in Liebenscheid von Amts wegen nach § 394 FamFG wegen Vermögenslosigkeit zu löschen. Die Frist zur Erhebung eines Widerspruchs beim Amtsgericht Montabaur -Registergericht- ist auf drei Monate ab Veröffentlichung dieser Mitteilung festgesetzt. Es ist jeder zur Erhebung des Widerspruchs berechtigt, der an der Unterlassung der Löschung ein berechtigtes Interesse hat."
    },
    {
      "date": "2025-11-05",
      "id": "136407",
      "original_text": "Löschungsankündigung\nRheinland-Pfalz Amtsgericht Bad Kreuznach HRB 24309\nDesign Home Bau GmbH – Bad Kreuznach",
      "type": "Löschungsankündigung",
      "state": "Rheinland-Pfalz",
      "amtsgericht": "Amtsgericht Bad Kreuznach",
      "registernummer": "HRB 24309",
      "registerart": "HRB",
      "company_name": "Design Home Bau GmbH",
      "company_seat": "Bad Kreuznach",
      "details": "05.11.2025 (Bekanntmachungsdatum)\n\nRheinland-Pfalz Amtsgericht Bad Kreuznach HRB 24309\nLöschungsankündigung\n\nDesign Home Bau GmbH\nGesellschaft mit beschränkter Haftung\nBad Kreuznach\n\nDas Registergericht beabsichtigt die Gesellschaft wegen Vermögenslosigkeit im Handelsregister von Amts wegen nach § 394 FamFG zu löschen. Die Frist zur Erhebung eines Widerspruchs gegen die beabsichtigte Löschung ist auf einen Monat ab Veröffentlichung bestimmt."
    },
    {
      "date": "2025-11-05",
      "id": "136408",
      "original_text": "Löschungsankündigung\nNordrhein-Westfalen Amtsgericht Aachen HRB 24567\nAS Handels GmbH – Aachen",
      "type": "Löschungsankündigung",
      "state": "Nordrhein-Westfalen",
      "amtsgericht": "Amtsgericht Aachen",
      "registernummer": "HRB 24567",
      "registerart": "HRB",
      "company_name": "AS Handels GmbH",
      "company_seat": "Aachen",
      "details": "05.11.2025 (Bekanntmachungsdatum)\n\nNordrhein-Westfalen Amtsgericht Aachen HRB 24567\nLöschungsankündigung\n\nAS Handels GmbH\nGesellschaft mit beschränkter Haftung\nAachen\n\nDas Registergericht beabsichtigt, von Amts wegen die Gesellschaft wegen Vermögenslosigkeit nach § 394 FamFG zu löschen, weil das Finanzamt Aachen-Stadt    mit Schreiben vom 17.10.2025 und 23.10.2025 Umstände mitgeteilt hat, aufgrund derer das Gericht davon überzeugt ist, dass die Gesellschaft vollständig vermögenslos ist.\n\nZur Geltendmachung des Widerspruchs gegen die beabsichtigte Löschung wird hiermit eine Frist von einem Monat ab Veröffentlichung dieser Ankündigung bestimmt.\n\nRechtsbehelfsbelehrung:\n\nGegen diese Verfügung kann Widerspruch eingelegt werden. Zum Widerspruch ist jeder berechtigt, der an der Unterlassung der Löschung ein berechtigtes Interesse hat.\n\nDer Widerspruch ist bei dem Amtsgericht Aachen, Adalbertsteinweg 92, 52070 Aachen schriftlich in deutscher Sprache oder zur Niederschrift der Geschäftsstelle einzulegen. Der Widerspruch kann auch zur Niederschrift der Geschäftsstelle eines jeden Amtsgerichtes abgegeben werden.\n\nDer Widerspruch muss spätestens innerhalb der gesetzten Frist nach der Bekanntgabe der Verfügung bei dem Amtsgericht Aachen eingegangen sein. Dies gilt auch dann, wenn der Widerspruch zur Niederschrift der Geschäftsstelle eines anderen Amtsgerichtes abgegeben wurde. Die Frist beginnt mit der Bekanntgabe der Verfügung durch Veröffentlichung. Fällt das Ende der Frist auf einen Sonntag, einen allgemeinen Feiertag oder Sonnabend, so endet die Frist mit Ablauf des nächsten Werktages.\n\nDer Widerspruch muss die Bezeichnung der angefochtenen Verfügung sowie die Erklärung enthalten, dass Widerspruch gegen diese Verfügung eingelegt wird. Er ist zu unterzeichnen und soll begründet werden.\n\nDie Einlegung ist auch durch Übertragung eines elektronischen Dokuments an die elektronische Poststelle des Gerichts möglich. Das elektronische Dokument muss für die Bearbeitung durch das Gericht geeignet und mit einer qualifizierten elektronischen Signatur der verantwortenden Person versehen sein oder von der verantwortenden Person signiert und auf einem sicheren Übermittlungsweg gemäß § 130 a ZPO nach näherer Maßgabe der Verordnung über die technischen Rahmenbedingungen des elektronischen Rechtsverkehrs und über das besondere elektronische Behördenpostfach (BGBl. I, S. 3803) eingereicht werden. Weitere Informationen erhalten Sie auf der Internetseite www.justiz.de."
    },
    {
      "date": "2025-11-05",
      "id": "136409",
      "original_text": "Löschungsankündigung\nNordrhein-Westfalen Amtsgericht Gelsenkirchen HRB 17954\nYONGLI UG (haftungsbeschränkt) – Gelsenkirchen",
      "type": "Löschungsankündigung",
      "state": "Nordrhein-Westfalen",
      "amtsgericht": "Amtsgericht Gelsenkirchen",
      "registernummer": "HRB 17954",
      "registerart": "HRB",
      "company_name": "YONGLI UG (haftungsbeschränkt)",
      "company_seat": "Gelsenkirchen",
      "details": "05.11.2025 (Bekanntmachungsdatum)\n\nNordrhein-Westfalen Amtsgericht Gelsenkirchen HRB 17954\nLöschungsankündigung\n\nYONGLI UG (haftungsbeschränkt)\nGesellschaft mit beschränkter Haftung\nGelsenkirchen\n\nDas Gericht beabsichtigt, die Gesellschaft YONGLI UG (haftungsbeschränkt) mit Sitz in Gelsenkirchen, HRB 17954 Amtsgericht Gelsenkirchen, wegen Vermögenslosigkeit zu löschen.\n\nHiermit wird denjenigen, die an der Unterlassung der Löschung ein berechtigtes Interesse haben, gem. § 394 Abs. 2 FamFG Gelegenheit gegeben, gegen dieses Vorhaben binnen eines Monats nach dieser Bekanntmachung Widerspruch einzulegen. Der Widerspruch kann schriftlich oder zu Protokoll der Geschäftsstelle erhoben werden."
    },
    {
      "date": "2025-11-05",
      "id": "136410",
      "original_text": "Registerbekanntmachung nach dem Umwandlungsgesetz\nNordrhein-Westfalen Amtsgericht Essen HRB 34885\nCPM Beteiligungs GmbH – Essen",
      "type": "Registerbekanntmachung nach dem Umwandlungsgesetz",
      "state": "Nordrhein-Westfalen",
      "amtsgericht": "Amtsgericht Essen",
      "registernummer": "HRB 34885",
      "registerart": "HRB",
      "company_name": "CPM Beteiligungs GmbH",
      "company_seat": "Essen",
      "details": "05.11.2025 (Bekanntmachungsdatum)\n\nNordrhein-Westfalen Amtsgericht Essen HRB 34885\nRegisterbekanntmachung nach dem Umwandlungsgesetz 05.11.2025 (Eintragungsdatum)\n\nCPM Beteiligungs GmbH\nGesellschaft mit beschränkter Haftung\nEssen\n\nDen Gläubigern der an der Verschmelzung beteiligten Rechtsträger ist, wenn sie binnen sechs Monaten nach dem Tag, an dem die Eintragung der Verschmelzung in das Register des Sitzes desjenigen Rechtsträgers, dessen Gläubiger sie sind, nach § 19 Absatz 3 UmwG als bekanntgemacht gilt, ihren Anspruch nach Grund und Höhe schriftlich anmelden, Sicherheit zu leisten, soweit sie nicht Befriedigung verlangen können. Dieses Recht steht den Gläubigern jedoch nur zu, wenn sie glaubhaft machen, dass durch die Verschmelzung die Erfüllung ihrer Forderung gefährdet wird."
    },
    {
      "date": "2025-11-05",
      "id": "136411",
      "original_text": "Registerbekanntmachung nach dem Umwandlungsgesetz\nNordrhein-Westfalen Amtsgericht Aachen VR 4026\nForschungsinstitut für Ökosystemanalyse und -bewertung an der RWTH Aachen e. V. – Aachen",
      "type": "Registerbekanntmachung nach dem Umwandlungsgesetz",
      "state": "Nordrhein-Westfalen",
      "amtsgericht": "Amtsgericht Aachen",
      "registernummer": "VR 4026",
      "registerart": "VR",
      "company_name": "Forschungsinstitut für Ökosystemanalyse und -bewertung an der RWTH Aachen e. V.",
      "company_seat": "Aachen",
      "details": "05.11.2025 (Bekanntmachungsdatum)\n\nNordrhein-Westfalen Amtsgericht Aachen VR 4026\nRegisterbekanntmachung nach dem Umwandlungsgesetz 05.11.2025 (Eintragungsdatum)\n\nForschungsinstitut für Ökosystemanalyse und -bewertung an der RWTH Aachen e. V.\neingetragener Verein\nAachen\n\nDen Gläubigern der an der Ausgliederung beteiligten Rechtsträger ist, wenn sie binnen sechs Monaten nach dem Tag, an dem die Eintragung der Ausgliederung in das Register des Sitzes desjenigen Rechtsträgers, dessen Gläubiger sie sind, nach § 19 Absatz 3 UmwG als bekanntgemacht gilt, ihren Anspruch nach Grund und Höhe schriftlich anmelden, Sicherheit zu leisten, soweit sie nicht Befriedigung verlangen können. Dieses Recht steht den Gläubigern jedoch nur zu, wenn sie glaubhaft machen, dass durch die Ausgliederung die Erfüllung ihrer Forderung gefährdet wird."
    },
    {
      "date": "2025-11-05",
      "id": "136412",
      "original_text": "Löschungsankündigung\nNordrhein-Westfalen Amtsgericht Dortmund HRB 33790\nTSHandel UG (haftungsbeschränkt) – Dortmund",
      "type": "Löschungsankündigung",
      "state": "Nordrhein-Westfalen",
      "amtsgericht": "Amtsgericht Dortmund",
      "registernummer": "HRB 33790",
      "registerart": "HRB",
      "company_name": "TSHandel UG (haftungsbeschränkt)",
      "company_seat": "Dortmund",
      "details": "05.11.2025 (Bekanntmachungsdatum)\n\nNordrhein-Westfalen Amtsgericht Dortmund HRB 33790\nLöschungsankündigung\n\nTSHandel UG (haftungsbeschränkt)\nGesellschaft mit beschränkter Haftung\nDortmund\n\nDas Registergericht beabsichtigt die Gesellschaft von Amts wegen nach § 394 FamFG zu löschen. Die Frist zur Erhebung eines Widerspruchs ist auf einen Monat festgesetzt."
    },
    {
      "date": "2025-11-05",
      "id": "136413",
      "original_text": "Registerbekanntmachung nach dem Umwandlungsgesetz\nNordrhein-Westfalen Amtsgericht Siegburg HRB 19079\nOptik Arndt by Jonen GmbH – Eitorf",
      "type": "Registerbekanntmachung nach dem Umwandlungsgesetz",
      "state": "Nordrhein-Westfalen",
      "amtsgericht": "Amtsgericht Siegburg",
      "registernummer": "HRB 19079",
      "registerart": "HRB",
      "company_name": "Optik Arndt by Jonen GmbH",
      "company_seat": "Eitorf",
      "details": "05.11.2025 (Bekanntmachungsdatum)\n\nNordrhein-Westfalen Amtsgericht Siegburg HRB 19079\nRegisterbekanntmachung nach dem Umwandlungsgesetz 05.11.2025 (Eintragungsdatum)\n\nOptik Arndt by Jonen GmbH\nGesellschaft mit beschränkter Haftung\nEitorf\n\nDen Gläubigern der an der Verschmelzung beteiligten Rechtsträger ist, wenn sie binnen sechs Monaten nach dem Tag, an dem die Eintragung der Verschmelzung in das Register des Sitzes desjenigen Rechtsträgers, dessen Gläubiger sie sind, nach § 19 Absatz 3 UmwG als bekanntgemacht gilt, ihren Anspruch nach Grund und Höhe schriftlich anmelden, Sicherheit zu leisten, soweit sie nicht Befriedigung verlangen können. Dieses Recht steht den Gläubigern jedoch nur zu, wenn sie glaubhaft machen, dass durch die Verschmelzung die Erfüllung ihrer Forderung gefährdet wird."
    },
    {
      "date": "2025-11-05",
      "id": "136414",
      "original_text": "Registerbekanntmachung nach dem Umwandlungsgesetz\nNordrhein-Westfalen Amtsgericht Köln HRA 37664\nEUROSAAL DÜGÜN SALONU, MEHMET DOGAN e.K. – Köln",
      "type": "Registerbekanntmachung nach dem Umwandlungsgesetz",
      "state": "Nordrhein-Westfalen",
      "amtsgericht": "Amtsgericht Köln",
      "registernummer": "HRA 37664",
      "registerart": "HRA",
      "company_name": "EUROSAAL DÜGÜN SALONU, MEHMET DOGAN e.K.",
      "company_seat": "Köln",
      "details": "05.11.2025 (Bekanntmachungsdatum)\n\nNordrhein-Westfalen Amtsgericht Köln HRA 37664\nRegisterbekanntmachung nach dem Umwandlungsgesetz 05.11.2025 (Eintragungsdatum)\n\nEUROSAAL DÜGÜN SALONU, MEHMET DOGAN e.K.\nEinzelkaufmann / Einzelkauffrau\nKöln\n\nDen Gläubigern der an der Ausgliederung beteiligten Rechtsträger ist, wenn sie binnen sechs Monaten nach dem Tag, an dem die Eintragung der Ausgliederung in das Register des Sitzes desjenigen Rechtsträgers, dessen Gläubiger sie sind, nach § 19 Absatz 3 UmwG als bekanntgemacht gilt, ihren Anspruch nach Grund und Höhe schriftlich anmelden, Sicherheit zu leisten, soweit sie nicht Befriedigung verlangen können. Dieses Recht steht den Gläubigern jedoch nur zu, wenn sie glaubhaft machen, dass durch die Ausgliederung die Erfüllung ihrer Forderung gefährdet wird."
    },
    {
      "date": "2025-11-05",
      "id": "136415",
      "original_text": "Löschungsankündigung\nNordrhein-Westfalen Amtsgericht Bochum HRB 15456\nAu-Ca MRO Rostock one GmbH – Herne",
      "type": "Löschungsankündigung",
      "state": "Nordrhein-Westfalen",
      "amtsgericht": "Amtsgericht Bochum",
      "registernummer": "HRB 15456",
      "registerart": "HRB",
      "company_name": "Au-Ca MRO Rostock one GmbH",
      "company_seat": "Herne",
      "details": "05.11.2025 (Bekanntmachungsdatum)\n\nNordrhein-Westfalen Amtsgericht Bochum HRB 15456\nLöschungsankündigung 06.11.2025 (Eintragungsdatum)\n\nAu-Ca MRO Rostock one GmbH\nGesellschaft mit beschränkter Haftung\nHerne\n\nDas Registergericht beabsichtigt die Gesellschaft von Amts wegen nach § 394 FamFG zu löschen. Die Frist zur Erhebung eines Widerspruchs ist auf drei Monate festgesetzt."
    },
    {
      "date": "2025-11-05",
      "id": "136416",
      "original_text": "Registerbekanntmachung nach dem Umwandlungsgesetz\nNordrhein-Westfalen Amtsgericht Siegburg HRB 18706\nDr. Buhl Consulting GmbH – Siegburg",
      "type": "Registerbekanntmachung nach dem Umwandlungsgesetz",
      "state": "Nordrhein-Westfalen",
      "amtsgericht": "Amtsgericht Siegburg",
      "registernummer": "HRB 18706",
      "registerart": "HRB",
      "company_name": "Dr. Buhl Consulting GmbH",
      "company_seat": "Siegburg",
      "details": "05.11.2025 (Bekanntmachungsdatum)\n\nNordrhein-Westfalen Amtsgericht Siegburg HRB 18706\nRegisterbekanntmachung nach dem Umwandlungsgesetz 05.11.2025 (Eintragungsdatum)\n\nDr. Buhl Consulting GmbH\nGesellschaft mit beschränkter Haftung\nSiegburg\n\nDen Gläubigern der an der formwechselnden Umwandlung beteiligten Rechtsträger ist, wenn sie binnen sechs Monaten nach dem Tag, an dem die Eintragung der formwechselnden Umwandlung in das Register des Sitzes desjenigen Rechtsträgers, dessen Gläubiger sie sind, nach § 19 Absatz 3 UmwG als bekanntgemacht gilt, ihren Anspruch nach Grund und Höhe schriftlich anmelden, Sicherheit zu leisten, soweit sie nicht Befriedigung verlangen können. Dieses Recht steht den Gläubigern jedoch nur zu, wenn sie glaubhaft machen, dass durch die formwechselnden Umwandlung die Erfüllung ihrer Forderung gefährdet wird."
    },
    {
      "date": "2025-11-05",
      "id": "136417",
      "original_text": "Registerbekanntmachung nach dem Umwandlungsgesetz\nNordrhein-Westfalen Amtsgericht Iserlohn HRB 11371\nListertaler Busbetrieb GmbH – Meinerzhagen",
      "type": "Registerbekanntmachung nach dem Umwandlungsgesetz",
      "state": "Nordrhein-Westfalen",
      "amtsgericht": "Amtsgericht Iserlohn",
      "registernummer": "HRB 11371",
      "registerart": "HRB",
      "company_name": "Listertaler Busbetrieb GmbH",
      "company_seat": "Meinerzhagen",
      "details": "05.11.2025 (Bekanntmachungsdatum)\n\nNordrhein-Westfalen Amtsgericht Iserlohn HRB 11371\nRegisterbekanntmachung nach dem Umwandlungsgesetz 03.11.2025 (Eintragungsdatum)\n\nListertaler Busbetrieb GmbH\nGesellschaft mit beschränkter Haftung\nMeinerzhagen\n\nDen Gläubigern der an der Ausgliederung beteiligten Rechtsträger ist, wenn sie binnen sechs Monaten nach dem Tag, an dem die Eintragung der Ausgliederung in das Register des Sitzes desjenigen Rechtsträgers, dessen Gläubiger sie sind, nach § 19 Absatz 3 UmwG als bekanntgemacht gilt, ihren Anspruch nach Grund und Höhe schriftlich anmelden, Sicherheit zu leisten, soweit sie nicht Befriedigung verlangen können. Dieses Recht steht den Gläubigern jedoch nur zu, wenn sie glaubhaft machen, dass durch die Ausgliederung die Erfüllung ihrer Forderung gefährdet wird."
    },
    {
      "date": "2025-11-05",
      "id": "136418",
      "original_text": "Löschungsankündigung\nNordrhein-Westfalen Amtsgericht Gelsenkirchen HRB 15842\nSubau UG (haftungsbeschränkt) – Gelsenkirchen",
      "type": "Löschungsankündigung",
      "state": "Nordrhein-Westfalen",
      "amtsgericht": "Amtsgericht Gelsenkirchen",
      "registernummer": "HRB 15842",
      "registerart": "HRB",
      "company_name": "Subau UG (haftungsbeschränkt)",
      "company_seat": "Gelsenkirchen",
      "details": "05.11.2025 (Bekanntmachungsdatum)\n\nNordrhein-Westfalen Amtsgericht Gelsenkirchen HRB 15842\nLöschungsankündigung\n\nSubau UG (haftungsbeschränkt)\nGesellschaft mit beschränkter Haftung\nGelsenkirchen\n\nDas Gericht beabsichtigt, die Gesellschaft Subau UG (haftungsbeschränkt) mit Sitz in Gelsenkirchen, HRB 15842 Amtsgericht Gelsenkirchen, wegen Vermögenslosigkeit zu löschen.\n\nHiermit wird denjenigen, die an der Unterlassung der Löschung ein berechtigtes Interesse haben, gem. § 394 Abs. 2 FamFG Gelegenheit gegeben, gegen dieses Vorhaben binnen eines Monats nach dieser Bekanntmachung Widerspruch einzulegen. Der Widerspruch kann schriftlich oder zu Protokoll der Geschäftsstelle erhoben werden."
    },
    {
      "date": "2025-11-05",
      "id": "136419",
      "original_text": "Löschungsankündigung\nNordrhein-Westfalen Amtsgericht Hamm HRB 9999\nB&B UG (haftungsbeschränkt) - Buchhaltung und Büromanagement – Bergkamen",
      "type": "Löschungsankündigung",
      "state": "Nordrhein-Westfalen",
      "amtsgericht": "Amtsgericht Hamm",
      "registernummer": "HRB 9999",
      "registerart": "HRB",
      "company_name": "B&B UG (haftungsbeschränkt) - Buchhaltung und Büromanagement",
      "company_seat": "Bergkamen",
      "details": "05.11.2025 (Bekanntmachungsdatum)\n\nNordrhein-Westfalen Amtsgericht Hamm HRB 9999\nLöschungsankündigung\n\nB&B UG (haftungsbeschränkt) - Buchhaltung und Büromanagement\nGesellschaft mit beschränkter Haftung\nBergkamen\n\nDas Registergericht beabsichtigt die Gesellschaft von Amts wegen nach § 394 FamFG zu löschen. Die Frist zur Erhebung eines Widerspruchs ist auf drei Monate festgesetzt."
    },
    {
      "date": "2025-11-05",
      "id": "136420",
      "original_text": "Registerbekanntmachung nach dem Umwandlungsgesetz\nNordrhein-Westfalen Amtsgericht Düsseldorf HRA 14989\nNaxos Grundbesitz SARL & Co. KG – Düsseldorf",
      "type": "Registerbekanntmachung nach dem Umwandlungsgesetz",
      "state": "Nordrhein-Westfalen",
      "amtsgericht": "Amtsgericht Düsseldorf",
      "registernummer": "HRA 14989",
      "registerart": "HRA",
      "company_name": "Naxos Grundbesitz SARL & Co. KG",
      "company_seat": "Düsseldorf",
      "details": "05.11.2025 (Bekanntmachungsdatum)\n\nNordrhein-Westfalen Amtsgericht Düsseldorf HRA 14989\nRegisterbekanntmachung nach dem Umwandlungsgesetz 05.11.2025 (Eintragungsdatum)\n\nNaxos Grundbesitz SARL & Co. KG\nKommanditgesellschaft\nDüsseldorf\n\nDen Gläubigern der an der Ausgliederung beteiligten Rechtsträger ist, wenn sie binnen sechs Monaten nach dem Tag, an dem die Eintragung der Ausgliederung in das Register des Sitzes desjenigen Rechtsträgers, dessen Gläubiger sie sind, nach § 19 Absatz 3 UmwG als bekanntgemacht gilt, ihren Anspruch nach Grund und Höhe schriftlich anmelden, Sicherheit zu leisten, soweit sie nicht Befriedigung verlangen können. Dieses Recht steht den Gläubigern jedoch nur zu, wenn sie glaubhaft machen, dass durch die Ausgliederung die Erfüllung ihrer Forderung gefährdet wird."
    },
    {
      "date": "2025-11-05",
      "id": "136421",
      "original_text": "Löschungsankündigung\nNordrhein-Westfalen Amtsgericht Bonn HRB 16444\nOmuri GmbH – Wachtberg",
      "type": "Löschungsankündigung",
      "state": "Nordrhein-Westfalen",
      "amtsgericht": "Amtsgericht Bonn",
      "registernummer": "HRB 16444",
      "registerart": "HRB",
      "company_name": "Omuri GmbH",
      "company_seat": "Wachtberg",
      "details": "05.11.2025 (Bekanntmachungsdatum)\n\nNordrhein-Westfalen Amtsgericht Bonn HRB 16444\nLöschungsankündigung\n\nOmuri GmbH\nGesellschaft mit beschränkter Haftung\nWachtberg\n\nDas Registergericht beabsichtigt die Gesellschaft von Amts wegen nach § 394 FamFG zu löschen. Die Frist zur Erhebung eines Widerspruchs ist auf einen Monat festgesetzt."
    },
    {
      "date": "2025-11-05",
      "id": "136422",
      "original_text": "Registerbekanntmachung nach dem Umwandlungsgesetz\nNordrhein-Westfalen Amtsgericht Köln HRB 125392\nEUROSAAL DÜGÜN SALONU GmbH – Köln",
      "type": "Registerbekanntmachung nach dem Umwandlungsgesetz",
      "state": "Nordrhein-Westfalen",
      "amtsgericht": "Amtsgericht Köln",
      "registernummer": "HRB 125392",
      "registerart": "HRB",
      "company_name": "EUROSAAL DÜGÜN SALONU GmbH",
      "company_seat": "Köln",
      "details": "05.11.2025 (Bekanntmachungsdatum)\n\nNordrhein-Westfalen Amtsgericht Köln HRB 125392\nRegisterbekanntmachung nach dem Umwandlungsgesetz 05.11.2025 (Eintragungsdatum)\n\nEUROSAAL DÜGÜN SALONU GmbH\nGesellschaft mit beschränkter Haftung\nKöln\n\nDen Gläubigern der an der Ausgliederung beteiligten Rechtsträger ist, wenn sie binnen sechs Monaten nach dem Tag, an dem die Eintragung der Ausgliederung in das Register des Sitzes desjenigen Rechtsträgers, dessen Gläubiger sie sind, nach § 19 Absatz 3 UmwG als bekanntgemacht gilt, ihren Anspruch nach Grund und Höhe schriftlich anmelden, Sicherheit zu leisten, soweit sie nicht Befriedigung verlangen können. Dieses Recht steht den Gläubigern jedoch nur zu, wenn sie glaubhaft machen, dass durch die Ausgliederung die Erfüllung ihrer Forderung gefährdet wird."
    },
    {
      "date": "2025-11-05",
      "id": "136423",
      "original_text": "Registerbekanntmachung nach dem Umwandlungsgesetz\nThüringen Amtsgericht Jena HRB 517216\ne:tec Pohle GmbH – Schmölln",
      "type": "Registerbekanntmachung nach dem Umwandlungsgesetz",
      "state": "Thüringen",
      "amtsgericht": "Amtsgericht Jena",
      "registernummer": "HRB 517216",
      "registerart": "HRB",
      "company_name": "e:tec Pohle GmbH",
      "company_seat": "Schmölln",
      "details": "05.11.2025 (Bekanntmachungsdatum)\n\nThüringen Amtsgericht Jena HRB 517216\nRegisterbekanntmachung nach dem Umwandlungsgesetz 05.11.2025 (Eintragungsdatum)\n\ne:tec Pohle GmbH\nGesellschaft mit beschränkter Haftung\nSchmölln\n\nNicht eingetragen: Den Gläubigern der an der Verschmelzung beteiligten Rechtsträger, ist wenn sie binnen sechs Monaten nach dem Tag, an dem die Eintragung der Verschmelzung in das Register des Sitzes desjenigen Rechtsträgers, dessen Gläubiger sie sind,  nach § 19 Abs. 3 UmwG als bekanntgemacht gilt, ihren Anspruch nach Grund und Höhe schriftlich anmelden, Sicherheit zu leisten, soweit sie nicht Befriedigung verlangen können. Dieses Recht steht ihnen jedoch nur zu, wenn sie glaubhaft machen, daß durch die Verschmelzung die Erfüllung ihrer Forderung gefährdet wird."
    },
    {
      "date": "2025-11-05",
      "id": "136424",
      "original_text": "Löschungsankündigung\nHessen Amtsgericht Darmstadt HRB 96203\nStoval GmbH – Münster",
      "type": "Löschungsankündigung",
      "state": "Hessen",
      "amtsgericht": "Amtsgericht Darmstadt",
      "registernummer": "HRB 96203",
      "registerart": "HRB",
      "company_name": "Stoval GmbH",
      "company_seat": "Münster",
      "details": "05.11.2025 (Bekanntmachungsdatum)\n\nHessen Amtsgericht Darmstadt HRB 96203\nLöschungsankündigung\n\nStoval GmbH\nGesellschaft mit beschränkter Haftung\nMünster\n\nDas Registergericht beabsichtigt die im Handelsregister eingetragene Gesellschaft von Amts wegen nach § 394 FamFG zu löschen. Die Frist zur Erhebung eines Widerspruchs gegen die beabsichtigte Löschung wird auf 3 Monate festgesetzt."
    },
    {
      "date": "2025-11-05",
      "id": "136425",
      "original_text": "Registerbekanntmachung nach dem Umwandlungsgesetz\nHessen Amtsgericht Gießen HRA 5052\nUwe Reuber e.K. – Herbstein",
      "type": "Registerbekanntmachung nach dem Umwandlungsgesetz",
      "state": "Hessen",
      "amtsgericht": "Amtsgericht Gießen",
      "registernummer": "HRA 5052",
      "registerart": "HRA",
      "company_name": "Uwe Reuber e.K.",
      "company_seat": "Herbstein",
      "details": "05.11.2025 (Bekanntmachungsdatum)\n\nHessen Amtsgericht Gießen HRA 5052\nRegisterbekanntmachung nach dem Umwandlungsgesetz 05.11.2025 (Eintragungsdatum)\n\nUwe Reuber e.K.\nEinzelkaufmann / Einzelkauffrau\nHerbstein\n\nDen Gläubigern der an der Ausgliederung beteiligten Rechtsträger ist, wenn sie binnen sechs Monaten nach dem Tag, an dem die Eintragung der Ausgliederung in das Register des Sitzes desjenigen Rechtsträgers, dessen Gläubiger sie sind, nach §§ 125, 19 Absatz 3 UmwG bekannt gemacht worden ist, ihren Anspruch nach Grund und Höhe schriftlich anmelden, Sicherheit zu leisten, soweit sie nicht Befriedigung verlangen können. Dieses Recht steht den Gläubigern jedoch nur zu, wenn sie glaubhaft machen, dass durch die Ausgliederung die Erfüllung ihrer Forderung gefährdet wird."
    },
    {
      "date": "2025-11-05",
      "id": "136426",
      "original_text": "Registerbekanntmachung nach dem Umwandlungsgesetz\nHessen Amtsgericht Hanau HRB 100809\nDr. Priess GmbH – Bruchköbel",
      "type": "Registerbekanntmachung nach dem Umwandlungsgesetz",
      "state": "Hessen",
      "amtsgericht": "Amtsgericht Hanau",
      "registernummer": "HRB 100809",
      "registerart": "HRB",
      "company_name": "Dr. Priess GmbH",
      "company_seat": "Bruchköbel",
      "details": "05.11.2025 (Bekanntmachungsdatum)\n\nHessen Amtsgericht Hanau HRB 100809\nRegisterbekanntmachung nach dem Umwandlungsgesetz 05.11.2025 (Eintragungsdatum)\n\nDr. Priess GmbH\nGesellschaft mit beschränkter Haftung\nBruchköbel\n\nDen Gläubigern der an der Ausgliederung beteiligten Rechtsträger ist, wenn sie binnen sechs Monaten nach dem Tag, an dem die Eintragung der Ausgliederung in das Register des Sitzes desjenigen Rechtsträgers, dessen Gläubiger sie sind, nach §§ 125, 19 Absatz 3 UmwG bekannt gemacht worden ist, ihren Anspruch nach Grund und Höhe schriftlich anmelden, Sicherheit zu leisten, soweit sie nicht Befriedigung verlangen können. Dieses Recht steht den Gläubigern jedoch nur zu, wenn sie glaubhaft machen, dass durch die Ausgliederung die Erfüllung ihrer Forderung gefährdet wird."
    },
    {
      "date": "2025-11-05",
      "id": "136427",
      "original_text": "Löschungsankündigung\nHessen Amtsgericht Limburg HRB 5671\nFugentechnik - Schäfer & Kaynak GmbH – Weilburg",
      "type": "Löschungsankündigung",
      "state": "Hessen",
      "amtsgericht": "Amtsgericht Limburg",
      "registernummer": "HRB 5671",
      "registerart": "HRB",
      "company_name": "Fugentechnik - Schäfer & Kaynak GmbH",
      "company_seat": "Weilburg",
      "details": "05.11.2025 (Bekanntmachungsdatum)\n\nHessen Amtsgericht Limburg HRB 5671\nLöschungsankündigung\n\nFugentechnik - Schäfer & Kaynak GmbH\nGesellschaft mit beschränkter Haftung\nWeilburg\n\nDas Registergericht beabsichtigt die im Handelsregister eingetragene Gesellschaft von Amts wegen nach § 394 FamFG zu löschen. Die Frist zur Erhebung eines Widerspruchs gegen die beabsichtigte Löschung wird auf 1 Monat festgesetzt."
    },
    {
      "date": "2025-11-05",
      "id": "136428",
      "original_text": "Einreichung neuer Dokumente\nHessen Amtsgericht Offenbach am Main HRB 57170\nProxalto Lebensversicherung Aktiengesellschaft – Neu-Isenburg",
      "type": "Einreichung neuer Dokumente",
      "state": "Hessen",
      "amtsgericht": "Amtsgericht Offenbach am Main",
      "registernummer": "HRB 57170",
      "registerart": "HRB",
      "company_name": "Proxalto Lebensversicherung Aktiengesellschaft",
      "company_seat": "Neu-Isenburg",
      "details": "05.11.2025 (Bekanntmachungsdatum)\n\nHessen Amtsgericht Offenbach am Main HRB 57170\nEinreichung neuer Dokumente 05.11.2025 (Eintragungsdatum)\n\nProxalto Lebensversicherung Aktiengesellschaft\nAktiengesellschaft\nNeu-Isenburg\n\nDurch eine Änderung in den Personen der Aufsichtsratsmitglieder ist eine Liste der Mitglieder des Aufsichtsrates zum Handelsregister eingereicht worden."
    },
    {
      "date": "2025-11-05",
      "id": "136429",
      "original_text": "Registerbekanntmachung nach dem Umwandlungsgesetz\nHessen Amtsgericht Limburg HRB 6931\nM2 Beteiligungsgesellschaft mbH – Brechen",
      "type": "Registerbekanntmachung nach dem Umwandlungsgesetz",
      "state": "Hessen",
      "amtsgericht": "Amtsgericht Limburg",
      "registernummer": "HRB 6931",
      "registerart": "HRB",
      "company_name": "M2 Beteiligungsgesellschaft mbH",
      "company_seat": "Brechen",
      "details": "05.11.2025 (Bekanntmachungsdatum)\n\nHessen Amtsgericht Limburg HRB 6931\nRegisterbekanntmachung nach dem Umwandlungsgesetz 05.11.2025 (Eintragungsdatum)\n\nM2 Beteiligungsgesellschaft mbH\nGesellschaft mit beschränkter Haftung\nBrechen\n\nDen Gläubigern der an der Verschmelzung beteiligten Rechtsträger ist, wenn sie binnen sechs Monaten nach dem Tag, an dem die Eintragung der Verschmelzung in das Register des Sitzes desjenigen Rechtsträgers, dessen Gläubiger sie sind, nach § 19 Absatz 3 UmwG bekannt gemacht worden ist, ihren Anspruch nach Grund und Höhe schriftlich anmelden, Sicherheit zu leisten, soweit sie nicht Befriedigung verlangen können. Dieses Recht steht den Gläubigern jedoch nur zu, wenn sie glaubhaft machen, dass durch die Verschmelzung die Erfüllung ihrer Forderung gefährdet wird."
    },
    {
      "date": "2025-11-05",
      "id": "136430",
      "original_text": "Einreichung neuer Dokumente\nHessen Amtsgericht Frankfurt am Main HRB 140645\nd-fine Verwaltungs SE – Frankfurt am Main",
      "type": "Einreichung neuer Dokumente",
      "state": "Hessen",
      "amtsgericht": "Amtsgericht Frankfurt am Main",
      "registernummer": "HRB 140645",
      "registerart": "HRB",
      "company_name": "d-fine Verwaltungs SE",
      "company_seat": "Frankfurt am Main",
      "details": "05.11.2025 (Bekanntmachungsdatum)\n\nHessen Amtsgericht Frankfurt am Main HRB 140645\nEinreichung neuer Dokumente 05.11.2025 (Eintragungsdatum)\n\nd-fine Verwaltungs SE\nEuropäische Aktiengesellschaft (SE)\nFrankfurt am Main\n\nDurch eine Änderung in den Personen der Aufsichtsratsmitglieder ist eine Liste der Mitglieder des Aufsichtsrates zum Handelsregister eingereicht worden."
    },
    {
      "date": "2025-11-05",
      "id": "136431",
      "original_text": "Löschungsankündigung\nHessen Amtsgericht Wiesbaden HRB 32116\nEScooter-Merta UG (haftungsbeschränkt) – Taunusstein",
      "type": "Löschungsankündigung",
      "state": "Hessen",
      "amtsgericht": "Amtsgericht Wiesbaden",
      "registernummer": "HRB 32116",
      "registerart": "HRB",
      "company_name": "EScooter-Merta UG (haftungsbeschränkt)",
      "company_seat": "Taunusstein",
      "details": "05.11.2025 (Bekanntmachungsdatum)\n\nHessen Amtsgericht Wiesbaden HRB 32116\nLöschungsankündigung\n\nEScooter-Merta UG (haftungsbeschränkt)\nGesellschaft mit beschränkter Haftung\nTaunusstein\n\nDas Registergericht beabsichtigt die im Handelsregister eingetragene Gesellschaft von Amts wegen nach § 394 FamFG zu löschen. Die Frist zur Erhebung eines Widerspruchs gegen die beabsichtigte Löschung wird auf 3 Monate festgesetzt."
    },
    {
      "date": "2025-11-05",
      "id": "136432",
      "original_text": "Einreichung neuer Dokumente\nHessen Amtsgericht Offenbach am Main HRB 4593\nEnergieversorgung Offenbach Aktiengesellschaft – Offenbach am Main",
      "type": "Einreichung neuer Dokumente",
      "state": "Hessen",
      "amtsgericht": "Amtsgericht Offenbach am Main",
      "registernummer": "HRB 4593",
      "registerart": "HRB",
      "company_name": "Energieversorgung Offenbach Aktiengesellschaft",
      "company_seat": "Offenbach am Main",
      "details": "05.11.2025 (Bekanntmachungsdatum)\n\nHessen Amtsgericht Offenbach am Main HRB 4593\nEinreichung neuer Dokumente\n\nEnergieversorgung Offenbach Aktiengesellschaft\nAktiengesellschaft\nOffenbach am Main\n\nDurch eine Änderung in den Personen der Aufsichtsratsmitglieder ist eine Liste der Mitglieder des Aufsichtsrates zum Handelsregister eingereicht worden."
    },
    {
      "date": "2025-11-05",
      "id": "136433",
      "original_text": "Einreichung neuer Dokumente\nHessen Amtsgericht Wiesbaden HRB 12913\nArjo Deutschland GmbH – Wiesbaden",
      "type": "Einreichung neuer Dokumente",
      "state": "Hessen",
      "amtsgericht": "Amtsgericht Wiesbaden",
      "registernummer": "HRB 12913",
      "registerart": "HRB",
      "company_name": "Arjo Deutschland GmbH",
      "company_seat": "Wiesbaden",
      "details": "05.11.2025 (Bekanntmachungsdatum)\n\nHessen Amtsgericht Wiesbaden HRB 12913\nEinreichung neuer Dokumente\n\nArjo Deutschland GmbH\nGesellschaft mit beschränkter Haftung\nWiesbaden\n\nDurch eine Änderung in den Personen der Aufsichtsratsmitglieder ist eine Liste der Mitglieder des Aufsichtsrates zum Handelsregister eingereicht worden."
    },
    {
      "date": "2025-11-05",
      "id": "136434",
      "original_text": "Registerbekanntmachung nach dem Umwandlungsgesetz\nHessen Amtsgericht Hanau HRA 94325\nDr. Priess Produktionsmanagement und Health Solutions e.K. – Bruchköbel",
      "type": "Registerbekanntmachung nach dem Umwandlungsgesetz",
      "state": "Hessen",
      "amtsgericht": "Amtsgericht Hanau",
      "registernummer": "HRA 94325",
      "registerart": "HRA",
      "company_name": "Dr. Priess Produktionsmanagement und Health Solutions e.K.",
      "company_seat": "Bruchköbel",
      "details": "05.11.2025 (Bekanntmachungsdatum)\n\nHessen Amtsgericht Hanau HRA 94325\nRegisterbekanntmachung nach dem Umwandlungsgesetz 05.11.2025 (Eintragungsdatum)\n\nDr. Priess Produktionsmanagement und Health Solutions e.K.\nEinzelkaufmann / Einzelkauffrau\nBruchköbel\n\nDen Gläubigern der an der Ausgliederung beteiligten Rechtsträger ist, wenn sie binnen sechs Monaten nach dem Tag, an dem die Eintragung der Ausgliederung in das Register des Sitzes desjenigen Rechtsträgers, dessen Gläubiger sie sind, nach §§ 125, 19 Absatz 3 UmwG bekannt gemacht worden ist, ihren Anspruch nach Grund und Höhe schriftlich anmelden, Sicherheit zu leisten, soweit sie nicht Befriedigung verlangen können. Dieses Recht steht den Gläubigern jedoch nur zu, wenn sie glaubhaft machen, dass durch die Ausgliederung die Erfüllung ihrer Forderung gefährdet wird."
    },
    {
      "date": "2025-11-05",
      "id": "136435",
      "original_text": "Registerbekanntmachung nach dem Umwandlungsgesetz\nHessen Amtsgericht Gießen HRA 5559\nReuber OHG – Herbstein",
      "type": "Registerbekanntmachung nach dem Umwandlungsgesetz",
      "state": "Hessen",
      "amtsgericht": "Amtsgericht Gießen",
      "registernummer": "HRA 5559",
      "registerart": "HRA",
      "company_name": "Reuber OHG",
      "company_seat": "Herbstein",
      "details": "05.11.2025 (Bekanntmachungsdatum)\n\nHessen Amtsgericht Gießen HRA 5559\nRegisterbekanntmachung nach dem Umwandlungsgesetz 05.11.2025 (Eintragungsdatum)\n\nReuber OHG\nOffene Handelsgesellschaft\nHerbstein\n\nDen Gläubigern der an der Ausgliederung beteiligten Rechtsträger ist, wenn sie binnen sechs Monaten nach dem Tag, an dem die Eintragung der Ausgliederung in das Register des Sitzes desjenigen Rechtsträgers, dessen Gläubiger sie sind, nach §§ 125, 19 Absatz 3 UmwG bekannt gemacht worden ist, ihren Anspruch nach Grund und Höhe schriftlich anmelden, Sicherheit zu leisten, soweit sie nicht Befriedigung verlangen können. Dieses Recht steht den Gläubigern jedoch nur zu, wenn sie glaubhaft machen, dass durch die Ausgliederung die Erfüllung ihrer Forderung gefährdet wird."
    },
    {
      "date": "2025-11-05",
      "id": "136436",
      "original_text": "Registerbekanntmachung nach dem Umwandlungsgesetz\nHessen Amtsgericht Wetzlar HRB 9521\nHeimann Vermietungs- und Verpachtungs GmbH – Leun",
      "type": "Registerbekanntmachung nach dem Umwandlungsgesetz",
      "state": "Hessen",
      "amtsgericht": "Amtsgericht Wetzlar",
      "registernummer": "HRB 9521",
      "registerart": "HRB",
      "company_name": "Heimann Vermietungs- und Verpachtungs GmbH",
      "company_seat": "Leun",
      "details": "05.11.2025 (Bekanntmachungsdatum)\n\nHessen Amtsgericht Wetzlar HRB 9521\nRegisterbekanntmachung nach dem Umwandlungsgesetz 05.11.2025 (Eintragungsdatum)\n\nHeimann Vermietungs- und Verpachtungs GmbH\nGesellschaft mit beschränkter Haftung\nLeun\n\nDen Gläubigern der an der Abspaltung beteiligten Rechtsträger ist, wenn sie binnen sechs Monaten nach dem Tag, an dem die Eintragung der Abspaltung in das Register des Sitzes desjenigen Rechtsträgers, dessen Gläubiger sie sind, nach §§ 125, 19 Absatz 3 UmwG bekannt gemacht worden ist, ihren Anspruch nach Grund und Höhe schriftlich anmelden, Sicherheit zu leisten, soweit sie nicht Befriedigung verlangen können. Dieses Recht steht den Gläubigern jedoch nur zu, wenn sie glaubhaft machen, dass durch die Abspaltung die Erfüllung ihrer Forderung gefährdet wird."
    },
    {
      "date": "2025-11-05",
      "id": "136437",
      "original_text": "Löschungsankündigung\nHessen Amtsgericht Frankfurt am Main HRB 112017\nDefraq Ventures AG – Frankfurt am Main",
      "type": "Löschungsankündigung",
      "state": "Hessen",
      "amtsgericht": "Amtsgericht Frankfurt am Main",
      "registernummer": "HRB 112017",
      "registerart": "HRB",
      "company_name": "Defraq Ventures AG",
      "company_seat": "Frankfurt am Main",
      "details": "05.11.2025 (Bekanntmachungsdatum)\n\nHessen Amtsgericht Frankfurt am Main HRB 112017\nLöschungsankündigung\n\nDefraq Ventures AG\nAktiengesellschaft\nFrankfurt am Main\n\nEs ist beabsichtigt die Gesellschaft wegen Vermögenslosigkeit gemäß § 394 FamFG von Amts wegen zu löschen. Hiergegen kann innerhalb eines Monats nach dieser Veröffentlichung Widerspruch bei dem Amtsgericht Frankfurt am Main eingelegt werden."
    },
    {
      "date": "2025-11-05",
      "id": "136438",
      "original_text": "Löschungsankündigung\nHessen Amtsgericht Frankfurt am Main HRB 98574\nBulliBurrito Frankfurt GmbH – Frankfurt am Main",
      "type": "Löschungsankündigung",
      "state": "Hessen",
      "amtsgericht": "Amtsgericht Frankfurt am Main",
      "registernummer": "HRB 98574",
      "registerart": "HRB",
      "company_name": "BulliBurrito Frankfurt GmbH",
      "company_seat": "Frankfurt am Main",
      "details": "05.11.2025 (Bekanntmachungsdatum)\n\nHessen Amtsgericht Frankfurt am Main HRB 98574\nLöschungsankündigung\n\nBulliBurrito Frankfurt GmbH\nGesellschaft mit beschränkter Haftung\nFrankfurt am Main\n\nDas Registergericht beabsichtigt die im Handelsregister eingetragene Gesellschaft von Amts wegen nach § 394 FamFG zu löschen. Die Frist zur Erhebung eines Widerspruchs gegen die beabsichtigte Löschung wird auf 1 Monate festgesetzt."
    },
    {
      "date": "2025-11-05",
      "id": "136439",
      "original_text": "Sonstige Registerbekanntmachung\nHessen Amtsgericht Darmstadt HRB 91821\nOpel Automobile GmbH – Rüsselsheim",
      "type": "Sonstige Registerbekanntmachung",
      "state": "Hessen",
      "amtsgericht": "Amtsgericht Darmstadt",
      "registernummer": "HRB 91821",
      "registerart": "HRB",
      "company_name": "Opel Automobile GmbH",
      "company_seat": "Rüsselsheim",
      "details": "05.11.2025 (Bekanntmachungsdatum)\n\nHessen Amtsgericht Darmstadt HRB 91821\nSonstige Registerbekanntmachung 05.11.2025 (Eintragungsdatum)\n\nOpel Automobile GmbH\nGesellschaft mit beschränkter Haftung\nRüsselsheim\n\nDurch eine Änderung in den Personen der Aufsichtsratsmitglieder ist eine Liste der Mitglieder des Aufsichtsrates zum Handelsregister eingereicht worden."
    },
    {
      "date": "2025-11-05",
      "id": "136440",
      "original_text": "Registerbekanntmachung nach dem Umwandlungsgesetz\nHessen Amtsgericht Wetzlar HRA 8204\nHeimann Grundstücks GmbH & Co.KG – Leun",
      "type": "Registerbekanntmachung nach dem Umwandlungsgesetz",
      "state": "Hessen",
      "amtsgericht": "Amtsgericht Wetzlar",
      "registernummer": "HRA 8204",
      "registerart": "HRA",
      "company_name": "Heimann Grundstücks GmbH & Co.KG",
      "company_seat": "Leun",
      "details": "05.11.2025 (Bekanntmachungsdatum)\n\nHessen Amtsgericht Wetzlar HRA 8204\nRegisterbekanntmachung nach dem Umwandlungsgesetz 05.11.2025 (Eintragungsdatum)\n\nHeimann Grundstücks GmbH & Co.KG\nKommanditgesellschaft\nLeun\n\nDen Gläubigern der an der Abspaltung beteiligten Rechtsträger ist, wenn sie binnen sechs Monaten nach dem Tag, an dem die Eintragung der Abspaltung in das Register des Sitzes desjenigen Rechtsträgers, dessen Gläubiger sie sind, nach §§ 125, 19 Absatz 3 UmwG bekannt gemacht worden ist, ihren Anspruch nach Grund und Höhe schriftlich anmelden, Sicherheit zu leisten, soweit sie nicht Befriedigung verlangen können. Dieses Recht steht den Gläubigern jedoch nur zu, wenn sie glaubhaft machen, dass durch die Abspaltung die Erfüllung ihrer Forderung gefährdet wird."
    }
  ]
}