{
  "date": "2025-11-10",
  "date_of_scrape": "2025-11-11T04:12:46.786Z",
  "tool_version": "0.2.0",
  "number_of_announcements": 147,
  "announcements": [
    {
      "date": "2025-11-10",
      "id": "136731",
      "original_text": "Registerbekanntmachung nach dem Umwandlungsgesetz\nBaden-Württemberg Amtsgericht Ulm HRB 748244\nHeimyo Deutschland AG – Wangen im Allgäu",
      "type": "Registerbekanntmachung nach dem Umwandlungsgesetz",
      "state": "Baden-Württemberg",
      "amtsgericht": "Amtsgericht Ulm",
      "registernummer": "HRB 748244",
      "registerart": "HRB",
      "company_name": "Heimyo Deutschland AG",
      "company_seat": "Wangen im Allgäu",
      "details": "10.11.2025 (Bekanntmachungsdatum)\n\nBaden-Württemberg Amtsgericht Ulm HRB 748244\nRegisterbekanntmachung nach dem Umwandlungsgesetz 04.11.2025 (Eintragungsdatum)\n\nHeimyo Deutschland AG\nAktiengesellschaft\nWangen im Allgäu\n\nAls nicht eingetragen wird bekanntgemacht:\nDen Gläubigern des an dem Formwechsel beteiligten Rechtsträgers ist, wenn sie binnen sechs Monaten nach dem Tag, an dem die Eintragung des Formwechsels in das Register des Sitzes desjenigen Rechtsträgers, dessen Gläubiger sie sind, nach § 19 Abs. 3 UmwG als bekanntgemacht gilt, ihren Anspruch nach Grund und Höhe schriftlich anmelden, Sicherheit zu leisten, soweit sie nicht Befriedigung verlangen können. Dieses Recht steht den Gläubigern jedoch nur zu, wenn sie glaubhaft machen, dass durch den Formwechsel die Erfüllung ihrer Forderung gefährdet wird."
    },
    {
      "date": "2025-11-10",
      "id": "136732",
      "original_text": "Einreichung neuer Dokumente\nBrandenburg Amtsgericht Neuruppin HRB 10018\nPCK Raffinerie GmbH – Schwedt/Oder",
      "type": "Einreichung neuer Dokumente",
      "state": "Brandenburg",
      "amtsgericht": "Amtsgericht Neuruppin",
      "registernummer": "HRB 10018",
      "registerart": "HRB",
      "company_name": "PCK Raffinerie GmbH",
      "company_seat": "Schwedt/Oder",
      "details": "10.11.2025 (Bekanntmachungsdatum)\n\nBrandenburg Amtsgericht Neuruppin HRB 10018\nEinreichung neuer Dokumente\n\nPCK Raffinerie GmbH\nGesellschaft mit beschränkter Haftung\nSchwedt/Oder\n\nAls nicht eingetragen wird veröffentlicht: Eine Liste der Mitglieder des Aufsichtsrates wurde zum Handelsregister eingereicht."
    },
    {
      "date": "2025-11-10",
      "id": "136733",
      "original_text": "Einreichung neuer Dokumente\nBerlin Amtsgericht Berlin (Charlottenburg) HRB 232662\nDaimler Truck Financial Services Deutschland GmbH – Berlin",
      "type": "Einreichung neuer Dokumente",
      "state": "Berlin",
      "amtsgericht": "Amtsgericht Berlin (Charlottenburg)",
      "registernummer": "HRB 232662",
      "registerart": "HRB",
      "company_name": "Daimler Truck Financial Services Deutschland GmbH",
      "company_seat": "Berlin",
      "details": "10.11.2025 (Bekanntmachungsdatum)\n\nBerlin Amtsgericht Berlin (Charlottenburg) HRB 232662\nEinreichung neuer Dokumente\n\nDaimler Truck Financial Services Deutschland GmbH\nGesellschaft mit beschränkter Haftung\nBerlin\n\nAls nicht eingetragen wird veröffentlicht: Es wurde eine neue Liste der Aufsichtsratsmitglieder eingereicht (§52 GmbHG)."
    },
    {
      "date": "2025-11-10",
      "id": "136734",
      "original_text": "Einreichung neuer Dokumente\nSachsen-Anhalt Amtsgericht Stendal HRB 35191\ne-HET GmbH – Hettstedt",
      "type": "Einreichung neuer Dokumente",
      "state": "Sachsen-Anhalt",
      "amtsgericht": "Amtsgericht Stendal",
      "registernummer": "HRB 35191",
      "registerart": "HRB",
      "company_name": "e-HET GmbH",
      "company_seat": "Hettstedt",
      "details": "10.11.2025 (Bekanntmachungsdatum)\n\nSachsen-Anhalt Amtsgericht Stendal HRB 35191\nEinreichung neuer Dokumente 10.11.2025 (Eintragungsdatum)\n\ne-HET GmbH\nGesellschaft mit beschränkter Haftung\nHettstedt\n\nEine Liste der Mitglieder des Aufsichtsrates wurde zum Handelsregister eingereicht."
    },
    {
      "date": "2025-11-10",
      "id": "136735",
      "original_text": "Sonstige Registerbekanntmachung\nBaden-Württemberg Amtsgericht Stuttgart HRB 590424\nCSS-Connect GmbH – Künzelsau",
      "type": "Sonstige Registerbekanntmachung",
      "state": "Baden-Württemberg",
      "amtsgericht": "Amtsgericht Stuttgart",
      "registernummer": "HRB 590424",
      "registerart": "HRB",
      "company_name": "CSS-Connect GmbH",
      "company_seat": "Künzelsau",
      "details": "10.11.2025 (Bekanntmachungsdatum)\n\nBaden-Württemberg Amtsgericht Stuttgart HRB 590424\nSonstige Registerbekanntmachung 10.11.2025 (Eintragungsdatum)\n\nCSS-Connect GmbH\nGesellschaft mit beschränkter Haftung\nKünzelsau\n\nAls nicht eingetragen wird bekanntgemacht:\nDen Gläubigern der Gesellschaft, deren Forderungen begründet worden sind, bevor die Eintragung der Beendigung des Vertrages in das Handelsregister nach § 10 HGB als bekanntgemacht gilt, ist vom anderen Vertragsteil Sicherheit zu leisten, wenn sie sich binnen sechs Monaten nach der Bekanntmachung zu diesem Zweck bei ihm melden."
    },
    {
      "date": "2025-11-10",
      "id": "136736",
      "original_text": "Einreichung neuer Dokumente\nBaden-Württemberg Amtsgericht Stuttgart HRB 760883\nTELENORMA Holding AG – Albstadt",
      "type": "Einreichung neuer Dokumente",
      "state": "Baden-Württemberg",
      "amtsgericht": "Amtsgericht Stuttgart",
      "registernummer": "HRB 760883",
      "registerart": "HRB",
      "company_name": "TELENORMA Holding AG",
      "company_seat": "Albstadt",
      "details": "10.11.2025 (Bekanntmachungsdatum)\n\nBaden-Württemberg Amtsgericht Stuttgart HRB 760883\nEinreichung neuer Dokumente\n\nTELENORMA Holding AG\nAktiengesellschaft\nAlbstadt\n\nDie Gesellschaft hat am 05.11.2025 die Liste über die Zusammensetzung des Aufsichtsrats zum Handelsregister eingereicht."
    },
    {
      "date": "2025-11-10",
      "id": "136737",
      "original_text": "Registerbekanntmachung nach dem Umwandlungsgesetz\nHamburg Amtsgericht Hamburg HRB 96102\nAmplifon Deutschland GmbH – Hamburg",
      "type": "Registerbekanntmachung nach dem Umwandlungsgesetz",
      "state": "Hamburg",
      "amtsgericht": "Amtsgericht Hamburg",
      "registernummer": "HRB 96102",
      "registerart": "HRB",
      "company_name": "Amplifon Deutschland GmbH",
      "company_seat": "Hamburg",
      "details": "10.11.2025 (Bekanntmachungsdatum)\n\nHamburg Amtsgericht Hamburg HRB 96102\nRegisterbekanntmachung nach dem Umwandlungsgesetz 10.11.2025 (Eintragungsdatum)\n\nAmplifon Deutschland GmbH\nGesellschaft mit beschränkter Haftung\nHamburg\n\nAls nicht eingetragen wird bekannt gemacht:\nDen Gläubigern der an der Verschmelzung beteiligten Gesellschaften ist, wenn sie binnen sechs Monaten nach dem Tag, an dem die Eintragung der Verschmelzung in das Register des Sitzes desjenigen Rechtsträgers, dessen Gläubiger sie sind, nach § 19 Absatz 3 UmwG als bekannt gemacht gilt, ihren Anspruch nach Grund und Höhe schriftlich anmelden, Sicherheit zu leisten, soweit sie nicht Befriedigung verlangen können. Dieses Recht steht den Gläubigern jedoch nur zu, wenn sie glaubhaft machen, dass durch die Verschmelzung die Erfüllung ihrer Forderung gefährdet wird."
    },
    {
      "date": "2025-11-10",
      "id": "136738",
      "original_text": "Einreichung neuer Dokumente\nBaden-Württemberg Amtsgericht Freiburg HRB 541043\nBEMACO AG – Singen Hohentwiel",
      "type": "Einreichung neuer Dokumente",
      "state": "Baden-Württemberg",
      "amtsgericht": "Amtsgericht Freiburg",
      "registernummer": "HRB 541043",
      "registerart": "HRB",
      "company_name": "BEMACO AG",
      "company_seat": "Singen Hohentwiel",
      "details": "10.11.2025 (Bekanntmachungsdatum)\n\nBaden-Württemberg Amtsgericht Freiburg HRB 541043\nEinreichung neuer Dokumente 10.11.2025 (Eintragungsdatum)\n\nBEMACO AG\nAktiengesellschaft\nSingen Hohentwiel\n\nAls nicht eingetragen wird bekanntgemacht:\nDie Gesellschaft hat am 08.11.2025 die Liste über die Zusammensetzung des Aufsichtsrats zum Handelsregister eingereicht."
    },
    {
      "date": "2025-11-10",
      "id": "136739",
      "original_text": "Einreichung neuer Dokumente\nSaarland Amtsgericht Saarbrücken HRB 103769\nNeodigital Versicherung AG – St. Ingbert",
      "type": "Einreichung neuer Dokumente",
      "state": "Saarland",
      "amtsgericht": "Amtsgericht Saarbrücken",
      "registernummer": "HRB 103769",
      "registerart": "HRB",
      "company_name": "Neodigital Versicherung AG",
      "company_seat": "St. Ingbert",
      "details": "10.11.2025 (Bekanntmachungsdatum)\n\nSaarland Amtsgericht Saarbrücken HRB 103769\nEinreichung neuer Dokumente\n\nNeodigital Versicherung AG\nAktiengesellschaft\nSt. Ingbert\n\nDer Vorstand der Gesellschaft hat eine Liste der Mitglieder des Aufsichtsrats zum Handelsregister eingereicht (§ 106 AktG)."
    },
    {
      "date": "2025-11-10",
      "id": "136740",
      "original_text": "Registerbekanntmachung nach dem Umwandlungsgesetz\nHamburg Amtsgericht Hamburg HRB 127904\nTurbopass GmbH – Hamburg",
      "type": "Registerbekanntmachung nach dem Umwandlungsgesetz",
      "state": "Hamburg",
      "amtsgericht": "Amtsgericht Hamburg",
      "registernummer": "HRB 127904",
      "registerart": "HRB",
      "company_name": "Turbopass GmbH",
      "company_seat": "Hamburg",
      "details": "10.11.2025 (Bekanntmachungsdatum)\n\nHamburg Amtsgericht Hamburg HRB 127904\nRegisterbekanntmachung nach dem Umwandlungsgesetz 10.11.2025 (Eintragungsdatum)\n\nTurbopass GmbH\nGesellschaft mit beschränkter Haftung\nHamburg\n\nAls nicht eingetragen wird bekannt gemacht:\nDen Gläubigern der an der Verschmelzung beteiligten Gesellschaften ist, wenn sie binnen sechs Monaten nach dem Tag, an dem die Eintragung der Verschmelzung in das Register des Sitzes desjenigen Rechtsträgers, dessen Gläubiger sie sind, nach § 19 Absatz 3 UmwG als bekannt gemacht gilt, ihren Anspruch nach Grund und Höhe schriftlich anmelden, Sicherheit zu leisten, soweit sie nicht Befriedigung verlangen können. Dieses Recht steht den Gläubigern jedoch nur zu, wenn sie glaubhaft machen, dass durch die Verschmelzung die Erfüllung ihrer Forderung gefährdet wird."
    },
    {
      "date": "2025-11-10",
      "id": "136741",
      "original_text": "Registerbekanntmachung nach dem Umwandlungsgesetz\nHamburg Amtsgericht Hamburg HRB 149051\nTurboTicket GmbH – Hamburg",
      "type": "Registerbekanntmachung nach dem Umwandlungsgesetz",
      "state": "Hamburg",
      "amtsgericht": "Amtsgericht Hamburg",
      "registernummer": "HRB 149051",
      "registerart": "HRB",
      "company_name": "TurboTicket GmbH",
      "company_seat": "Hamburg",
      "details": "10.11.2025 (Bekanntmachungsdatum)\n\nHamburg Amtsgericht Hamburg HRB 149051\nRegisterbekanntmachung nach dem Umwandlungsgesetz 10.11.2025 (Eintragungsdatum)\n\nTurboTicket GmbH\nGesellschaft mit beschränkter Haftung\nHamburg\n\nAls nicht eingetragen wird bekannt gemacht:\nDen Gläubigern der an der Verschmelzung beteiligten Gesellschaften ist, wenn sie binnen sechs Monaten nach dem Tag, an dem die Eintragung der Verschmelzung in das Register des Sitzes desjenigen Rechtsträgers, dessen Gläubiger sie sind, nach § 19 Absatz 3 UmwG als bekannt gemacht gilt, ihren Anspruch nach Grund und Höhe schriftlich anmelden, Sicherheit zu leisten, soweit sie nicht Befriedigung verlangen können. Dieses Recht steht den Gläubigern jedoch nur zu, wenn sie glaubhaft machen, dass durch die Verschmelzung die Erfüllung ihrer Forderung gefährdet wird."
    },
    {
      "date": "2025-11-10",
      "id": "136742",
      "original_text": "Registerbekanntmachung nach dem Umwandlungsgesetz\nBaden-Württemberg Amtsgericht Ulm HRB 721856\nWinCan Deutschland GmbH – Langenargen",
      "type": "Registerbekanntmachung nach dem Umwandlungsgesetz",
      "state": "Baden-Württemberg",
      "amtsgericht": "Amtsgericht Ulm",
      "registernummer": "HRB 721856",
      "registerart": "HRB",
      "company_name": "WinCan Deutschland GmbH",
      "company_seat": "Langenargen",
      "details": "10.11.2025 (Bekanntmachungsdatum)\n\nBaden-Württemberg Amtsgericht Ulm HRB 721856\nRegisterbekanntmachung nach dem Umwandlungsgesetz 10.11.2025 (Eintragungsdatum)\n\nWinCan Deutschland GmbH\nGesellschaft mit beschränkter Haftung\nLangenargen\n\nAls nicht eingetragen wird bekanntgemacht:\nDen Gläubigern der an der Verschmelzung beteiligten Rechtsträger ist, wenn sie binnen sechs Monaten nach dem Tag, an dem die Eintragung der Verschmelzung in das Register des Sitzes desjenigen Rechtsträgers, dessen Gläubiger sie sind, nach § 19 Abs. 3 UmwG als bekanntgemacht gilt, ihren Anspruch nach Grund und Höhe schriftlich anmelden, Sicherheit zu leisten, soweit sie nicht Befriedigung verlangen können. Dieses Recht steht den Gläubigern jedoch nur zu, wenn sie glaubhaft machen, dass durch die Verschmelzung die Erfüllung ihrer Forderung gefährdet wird."
    },
    {
      "date": "2025-11-10",
      "id": "136743",
      "original_text": "Löschungsankündigung\nHamburg Amtsgericht Hamburg HRA 121971\nImage Solutions GmbH & Co. KG – Hamburg",
      "type": "Löschungsankündigung",
      "state": "Hamburg",
      "amtsgericht": "Amtsgericht Hamburg",
      "registernummer": "HRA 121971",
      "registerart": "HRA",
      "company_name": "Image Solutions GmbH & Co. KG",
      "company_seat": "Hamburg",
      "details": "10.11.2025 (Bekanntmachungsdatum)\n\nHamburg Amtsgericht Hamburg HRA 121971\nLöschungsankündigung\n\nImage Solutions GmbH & Co. KG\nKommanditgesellschaft\nHamburg\n\nDas Registergericht beabsichtigt, die im Handelsregister eingetragene Firma von Amts wegen nach § 31 Abs. 2 HBG zu löschen. Die Frist zur Erhebung eines Widerspruchs gegen die beabsichtigte Löschung wird auf 3 Monate festgesetzt."
    },
    {
      "date": "2025-11-10",
      "id": "136744",
      "original_text": "Einreichung neuer Dokumente\nBerlin Amtsgericht Berlin (Charlottenburg) HRB 182023\nScope SE & Co. KGaA – Berlin",
      "type": "Einreichung neuer Dokumente",
      "state": "Berlin",
      "amtsgericht": "Amtsgericht Berlin (Charlottenburg)",
      "registernummer": "HRB 182023",
      "registerart": "HRB",
      "company_name": "Scope SE & Co. KGaA",
      "company_seat": "Berlin",
      "details": "10.11.2025 (Bekanntmachungsdatum)\n\nBerlin Amtsgericht Berlin (Charlottenburg) HRB 182023\nEinreichung neuer Dokumente\n\nScope SE & Co. KGaA\nKommanditgesellschaft auf Aktien\nBerlin\n\nAls nicht eingetragen wird veröffentlicht: Es wurde eine neue Liste der Aufsichtsratsmitglieder eingereicht (§ 106 AktG)."
    },
    {
      "date": "2025-11-10",
      "id": "136745",
      "original_text": "Registerbekanntmachung nach dem Umwandlungsgesetz\nBerlin Amtsgericht Berlin (Charlottenburg) HRB 231326\nVindie GmbH – Berlin",
      "type": "Registerbekanntmachung nach dem Umwandlungsgesetz",
      "state": "Berlin",
      "amtsgericht": "Amtsgericht Berlin (Charlottenburg)",
      "registernummer": "HRB 231326",
      "registerart": "HRB",
      "company_name": "Vindie GmbH",
      "company_seat": "Berlin",
      "details": "10.11.2025 (Bekanntmachungsdatum)\n\nBerlin Amtsgericht Berlin (Charlottenburg) HRB 231326\nRegisterbekanntmachung nach dem Umwandlungsgesetz 07.11.2025 (Eintragungsdatum)\n\nVindie GmbH\nGesellschaft mit beschränkter Haftung\nBerlin\n\nZu Eintragungsnummer 3 vom 07.11.2025 wird als nicht eingetragen veröffentlicht: Den Gläubigern der an der Verschmelzung beteiligten Rechtsträger ist, wenn sie binnen sechs Monaten nach dem Tag, an dem die Eintragung der Verschmelzung in das Register des Sitzes desjenigen Rechtsträgers, dessen Gläubiger sie sind, als bekannt gemacht gilt, ihren Anspruch nach Grund und Höhe schriftlich anmelden, Sicherheit zu leisten, soweit sie nicht Befriedigung verlangen können. Dieses Recht steht den Gläubigern jedoch nur zu, wenn sie glaubhaft machen, dass durch die Verschmelzung die Erfüllung ihrer Forderung gefährdet wird. Das Recht, Sicherheitsleistung zu verlangen, steht Gläubigern nicht zu, die im Falle der Insolvenz ein Recht auf vorzugsweise Befriedigung aus einer Deckungsmasse haben, die nach gesetzlicher Vorschrift zu ihrem Schutz errichtet und staatlich überwacht ist."
    },
    {
      "date": "2025-11-10",
      "id": "136746",
      "original_text": "Registerbekanntmachung nach dem Umwandlungsgesetz\nBaden-Württemberg Amtsgericht Freiburg HRA 708824\nMetzger Versicherungsmakler e.K. – Bad Säckingen",
      "type": "Registerbekanntmachung nach dem Umwandlungsgesetz",
      "state": "Baden-Württemberg",
      "amtsgericht": "Amtsgericht Freiburg",
      "registernummer": "HRA 708824",
      "registerart": "HRA",
      "company_name": "Metzger Versicherungsmakler e.K.",
      "company_seat": "Bad Säckingen",
      "details": "10.11.2025 (Bekanntmachungsdatum)\n\nBaden-Württemberg Amtsgericht Freiburg HRA 708824\nRegisterbekanntmachung nach dem Umwandlungsgesetz 10.11.2025 (Eintragungsdatum)\n\nMetzger Versicherungsmakler e.K.\nEinzelkaufmann / Einzelkauffrau\nBad Säckingen\n\nAls nicht eingetragen wird bekanntgemacht:\nDen Gläubigern der an der Ausgliederung beteiligten Rechtsträger ist, wenn sie binnen sechs Monaten nach dem Tag, an dem die Eintragung der Ausgliederung in das Register des Sitzes desjenigen Rechtsträgers, dessen Gläubiger sie sind, nach § 19 Abs. 3 UmwG als bekanntgemacht gilt, ihren Anspruch nach Grund und Höhe schriftlich anmelden, Sicherheit zu leisten, soweit sie nicht Befriedigung verlangen können. Dieses Recht steht den Gläubigern jedoch nur zu, wenn sie glaubhaft machen, dass durch die Ausgliederung die Erfüllung ihrer Forderung gefährdet wird."
    },
    {
      "date": "2025-11-10",
      "id": "136747",
      "original_text": "Sonstige Registerbekanntmachung\nBaden-Württemberg Amtsgericht Freiburg HRB 719519\nProjektbau Rheinfelden II UG (haftungsbeschränkt) – Emmendingen",
      "type": "Sonstige Registerbekanntmachung",
      "state": "Baden-Württemberg",
      "amtsgericht": "Amtsgericht Freiburg",
      "registernummer": "HRB 719519",
      "registerart": "HRB",
      "company_name": "Projektbau Rheinfelden II UG (haftungsbeschränkt)",
      "company_seat": "Emmendingen",
      "details": "10.11.2025 (Bekanntmachungsdatum)\n\nBaden-Württemberg Amtsgericht Freiburg HRB 719519\nSonstige Registerbekanntmachung 07.11.2025 (Eintragungsdatum)\n\nProjektbau Rheinfelden II UG (haftungsbeschränkt)\nGesellschaft mit beschränkter Haftung\nEmmendingen\n\nAls nicht eingetragen wird bekanntgemacht:\nDen Gläubigern der Gesellschaft, deren Forderungen begründet worden sind, bevor die Eintragung der Beendigung des Vertrages in das Handelsregister nach § 10 HGB als bekanntgemacht gilt, ist vom anderen Vertragsteil Sicherheit zu leisten, wenn sie sich binnen sechs Monaten nach der Bekanntmachung zu diesem Zweck bei ihm melden."
    },
    {
      "date": "2025-11-10",
      "id": "136748",
      "original_text": "Sonstige Registerbekanntmachung\nBaden-Württemberg Amtsgericht Freiburg HRB 719519\nProjektbau Rheinfelden II UG (haftungsbeschränkt) – Emmendingen",
      "type": "Sonstige Registerbekanntmachung",
      "state": "Baden-Württemberg",
      "amtsgericht": "Amtsgericht Freiburg",
      "registernummer": "HRB 719519",
      "registerart": "HRB",
      "company_name": "Projektbau Rheinfelden II UG (haftungsbeschränkt)",
      "company_seat": "Emmendingen",
      "details": "10.11.2025 (Bekanntmachungsdatum)\n\nBaden-Württemberg Amtsgericht Freiburg HRB 719519\nSonstige Registerbekanntmachung 07.11.2025 (Eintragungsdatum)\n\nProjektbau Rheinfelden II UG (haftungsbeschränkt)\nGesellschaft mit beschränkter Haftung\nEmmendingen\n\nAls nicht eingetragen wird bekanntgemacht:\nDen Gläubigern der Gesellschaft, deren Forderungen begründet worden sind, bevor die Eintragung der Beendigung des Vertrages in das Handelsregister nach § 10 HGB als bekanntgemacht gilt, ist vom anderen Vertragsteil Sicherheit zu leisten, wenn sie sich binnen sechs Monaten nach der Bekanntmachung zu diesem Zweck bei ihm melden."
    },
    {
      "date": "2025-11-10",
      "id": "136749",
      "original_text": "Löschungsankündigung\nBaden-Württemberg Amtsgericht Stuttgart HRA 738893\nJoker Care GmbH & Co. KG – Calw",
      "type": "Löschungsankündigung",
      "state": "Baden-Württemberg",
      "amtsgericht": "Amtsgericht Stuttgart",
      "registernummer": "HRA 738893",
      "registerart": "HRA",
      "company_name": "Joker Care GmbH & Co. KG",
      "company_seat": "Calw",
      "details": "10.11.2025 (Bekanntmachungsdatum)\n\nBaden-Württemberg Amtsgericht Stuttgart HRA 738893\nLöschungsankündigung\n\nJoker Care GmbH & Co. KG\nKommanditgesellschaft\nCalw\n\nAls nicht eingetragen wird bekanntgemacht:\nDas Gericht beabsichtigt, die Gesellschaft wegen Vermögenslosigkeit im Handelsregister von Amts wegen nach § 394 FamFG zu löschen. Die Frist zur Geltendmachung eines Widerspruchs gegen die beabsichtigte Löschung ist auf zwei Monate ab Veröffentlichung bestimmt."
    },
    {
      "date": "2025-11-10",
      "id": "136750",
      "original_text": "Registerbekanntmachung nach dem Umwandlungsgesetz\nBerlin Amtsgericht Berlin (Charlottenburg) HRB 229976\nNicholas Stricker UG (haftungsbeschränkt) – Berlin",
      "type": "Registerbekanntmachung nach dem Umwandlungsgesetz",
      "state": "Berlin",
      "amtsgericht": "Amtsgericht Berlin (Charlottenburg)",
      "registernummer": "HRB 229976",
      "registerart": "HRB",
      "company_name": "Nicholas Stricker UG (haftungsbeschränkt)",
      "company_seat": "Berlin",
      "details": "10.11.2025 (Bekanntmachungsdatum)\n\nBerlin Amtsgericht Berlin (Charlottenburg) HRB 229976\nRegisterbekanntmachung nach dem Umwandlungsgesetz 07.11.2025 (Eintragungsdatum)\n\nNicholas Stricker UG (haftungsbeschränkt)\nGesellschaft mit beschränkter Haftung\nBerlin\n\nZu Eintragungsnummer 2 vom 07.11.2025 wird als nicht eingetragen veröffentlicht: Den Gläubigern der an der Verschmelzung beteiligten Rechtsträger ist, wenn sie binnen sechs Monaten nach dem Tag, an dem die Eintragung der Verschmelzung in das Register des Sitzes desjenigen Rechtsträgers, dessen Gläubiger sie sind, als bekannt gemacht gilt, ihren Anspruch nach Grund und Höhe schriftlich anmelden, Sicherheit zu leisten, soweit sie nicht Befriedigung verlangen können. Dieses Recht steht den Gläubigern jedoch nur zu, wenn sie glaubhaft machen, dass durch die Verschmelzung die Erfüllung ihrer Forderung gefährdet wird. Das Recht, Sicherheitsleistung zu verlangen, steht Gläubigern nicht zu, die im Falle der Insolvenz ein Recht auf vorzugsweise Befriedigung aus einer Deckungsmasse haben, die nach gesetzlicher Vorschrift zu ihrem Schutz errichtet und staatlich überwacht ist."
    },
    {
      "date": "2025-11-10",
      "id": "136751",
      "original_text": "Registerbekanntmachung nach dem Umwandlungsgesetz\nHamburg Amtsgericht Hamburg HRB 137154\nZack Holding GmbH – Hamburg",
      "type": "Registerbekanntmachung nach dem Umwandlungsgesetz",
      "state": "Hamburg",
      "amtsgericht": "Amtsgericht Hamburg",
      "registernummer": "HRB 137154",
      "registerart": "HRB",
      "company_name": "Zack Holding GmbH",
      "company_seat": "Hamburg",
      "details": "10.11.2025 (Bekanntmachungsdatum)\n\nHamburg Amtsgericht Hamburg HRB 137154\nRegisterbekanntmachung nach dem Umwandlungsgesetz 07.11.2025 (Eintragungsdatum)\n\nZack Holding GmbH\nGesellschaft mit beschränkter Haftung\nHamburg\n\nAls nicht eingetragen wird bekannt gemacht:\nDen Gläubigern der an der Verschmelzung beteiligten Gesellschaften ist, wenn sie binnen sechs Monaten nach dem Tag, an dem die Eintragung der Verschmelzung in das Register des Sitzes desjenigen Rechtsträgers, dessen Gläubiger sie sind, nach § 19 Absatz 3 UmwG als bekannt gemacht gilt, ihren Anspruch nach Grund und Höhe schriftlich anmelden, Sicherheit zu leisten, soweit sie nicht Befriedigung verlangen können. Dieses Recht steht den Gläubigern jedoch nur zu, wenn sie glaubhaft machen, dass durch die Verschmelzung die Erfüllung ihrer Forderung gefährdet wird."
    },
    {
      "date": "2025-11-10",
      "id": "136752",
      "original_text": "Löschungsankündigung\nBerlin Amtsgericht Berlin (Charlottenburg) HRB 236075\nCaladeon Energy GmbH – Berlin",
      "type": "Löschungsankündigung",
      "state": "Berlin",
      "amtsgericht": "Amtsgericht Berlin (Charlottenburg)",
      "registernummer": "HRB 236075",
      "registerart": "HRB",
      "company_name": "Caladeon Energy GmbH",
      "company_seat": "Berlin",
      "details": "10.11.2025 (Bekanntmachungsdatum)\n\nBerlin Amtsgericht Berlin (Charlottenburg) HRB 236075\nLöschungsankündigung\n\nCaladeon Energy GmbH\nGesellschaft mit beschränkter Haftung\nBerlin\n\nBei der nachstehenden Gesellschaft wird das Amtslöschungsverfahren gemäß § 394 FamFG eingeleitet. Widerspruchsfrist 6 Wochen"
    },
    {
      "date": "2025-11-10",
      "id": "136753",
      "original_text": "Löschungsankündigung\nMecklenburg-Vorpommern Amtsgericht Rostock HRB 14767\nSchokoladerie Juillet de Prie GmbH in Abwicklung – Rostock",
      "type": "Löschungsankündigung",
      "state": "Mecklenburg-Vorpommern",
      "amtsgericht": "Amtsgericht Rostock",
      "registernummer": "HRB 14767",
      "registerart": "HRB",
      "company_name": "Schokoladerie Juillet de Prie GmbH in Abwicklung",
      "company_seat": "Rostock",
      "details": "10.11.2025 (Bekanntmachungsdatum)\n\nMecklenburg-Vorpommern Amtsgericht Rostock HRB 14767\nLöschungsankündigung\n\nSchokoladerie Juillet de Prie GmbH in Abwicklung\nGesellschaft mit beschränkter Haftung\nRostock\n\nDas Registergericht beabsichtigt, die im Handelsregister eingetragene Gesellschaft von Amts wegen nach § 394 FamFG zu löschen. Die Frist zur Erhebung eines Widerspruchs gegen die beabsichtigte Löschung wird auf einen Monat festgesetzt."
    },
    {
      "date": "2025-11-10",
      "id": "136754",
      "original_text": "Sonstige Registerbekanntmachung\nBerlin Amtsgericht Berlin (Charlottenburg) HRB 127205\nMAGIX Software GmbH – Berlin",
      "type": "Sonstige Registerbekanntmachung",
      "state": "Berlin",
      "amtsgericht": "Amtsgericht Berlin (Charlottenburg)",
      "registernummer": "HRB 127205",
      "registerart": "HRB",
      "company_name": "MAGIX Software GmbH",
      "company_seat": "Berlin",
      "details": "10.11.2025 (Bekanntmachungsdatum)\n\nBerlin Amtsgericht Berlin (Charlottenburg) HRB 127205\nSonstige Registerbekanntmachung\n\nMAGIX Software GmbH\nGesellschaft mit beschränkter Haftung\nBerlin\n\nAls nicht eingetragen wird veröffentlicht:Der andere Vertragsteil hat den Gläubigern dieses Rechtsträgers, deren Forderungen begründet worden sind, bevor die Eintragung der Beendigung dieses Vertrages in das Handelsregister nach § 10 des Handelsgesetzbuches als bekannt gemacht gilt, Sicherheit zu leisten, wenn sie sich binnen sechs Monaten nach der Bekanntmachung der Eintragung zu diesem Zweck bei ihm melden. Dieses Recht steht den Gläubigern nicht zu, die im Fall des Insolvenzverfahrens ein Recht auf vorzugsweise Befriedigung aus der Deckungsmasse haben, die nach gesetzlicher Vorschrift zu ihrem Schutz errichtet und staatlich überwacht ist."
    },
    {
      "date": "2025-11-10",
      "id": "136755",
      "original_text": "Sonstige Registerbekanntmachung\nBrandenburg Amtsgericht Frankfurt/Oder HRB 14035\nProthetik GmbH Schewski – Panketal",
      "type": "Sonstige Registerbekanntmachung",
      "state": "Brandenburg",
      "amtsgericht": "Amtsgericht Frankfurt/Oder",
      "registernummer": "HRB 14035",
      "registerart": "HRB",
      "company_name": "Prothetik GmbH Schewski",
      "company_seat": "Panketal",
      "details": "10.11.2025 (Bekanntmachungsdatum)\n\nBrandenburg Amtsgericht Frankfurt/Oder HRB 14035\nSonstige Registerbekanntmachung\n\nProthetik GmbH Schewski\nGesellschaft mit beschränkter Haftung\nPanketal\n\nAls nicht eingetragen wird veröffentlicht:\nDen Gläubigern der an der Verschmelzung beteiligten Rechtsträger ist, wenn sie binnen sechs Monaten nach dem Tag, an dem die Eintragung der Verschmelzung in das Register des Sitzes desjenigen Rechtsträgers, dessen Gläubiger sie sind, als bekannt gemacht gilt, ihren Anspruch nach Grund und Höhe schriftlich anmelden, Sicherheit zu leisten, soweit sie nicht Befriedigung verlangen können. Dieses Recht steht den Gläubigern jedoch nur zu, wenn sie glaubhaft machen, dass durch die Verschmelzung die Erfüllung ihrer Forderung gefährdet wird"
    },
    {
      "date": "2025-11-10",
      "id": "136756",
      "original_text": "Sonstige Registerbekanntmachung\nBerlin Amtsgericht Berlin (Charlottenburg) HRB 171083\noptilyz GmbH – Berlin",
      "type": "Sonstige Registerbekanntmachung",
      "state": "Berlin",
      "amtsgericht": "Amtsgericht Berlin (Charlottenburg)",
      "registernummer": "HRB 171083",
      "registerart": "HRB",
      "company_name": "optilyz GmbH",
      "company_seat": "Berlin",
      "details": "10.11.2025 (Bekanntmachungsdatum)\n\nBerlin Amtsgericht Berlin (Charlottenburg) HRB 171083\nSonstige Registerbekanntmachung\n\noptilyz GmbH\nGesellschaft mit beschränkter Haftung\nBerlin\n\nAls nicht eingetragen wird veröffentlicht: Es wurde eine neue Liste der Aufsichtsratsmitglieder eingereicht (§52 GmbHG)."
    },
    {
      "date": "2025-11-10",
      "id": "136757",
      "original_text": "Sonstige Registerbekanntmachung\nBaden-Württemberg Amtsgericht Mannheim HRB 338007\nHeidelberger Beteiligungsholding AG – Heidelberg",
      "type": "Sonstige Registerbekanntmachung",
      "state": "Baden-Württemberg",
      "amtsgericht": "Amtsgericht Mannheim",
      "registernummer": "HRB 338007",
      "registerart": "HRB",
      "company_name": "Heidelberger Beteiligungsholding AG",
      "company_seat": "Heidelberg",
      "details": "10.11.2025 (Bekanntmachungsdatum)\n\nBaden-Württemberg Amtsgericht Mannheim HRB 338007\nSonstige Registerbekanntmachung 10.11.2025 (Eintragungsdatum)\n\nHeidelberger Beteiligungsholding AG\nAktiengesellschaft\nHeidelberg\n\nDen Gläubigern, deren Forderungen begründet worden sind, bevor die Eintragung des Beschlusses bekanntgemacht worden ist, ist, wenn sie sich binnen sechs Monaten nach der Bekanntmachung zu diesem Zweck melden, Sicherheit zu leisten, soweit sie nicht Befriedigung verlangen können."
    },
    {
      "date": "2025-11-10",
      "id": "136758",
      "original_text": "Registerbekanntmachung nach dem Umwandlungsgesetz\nBrandenburg Amtsgericht Potsdam HRA 8333\nMatthäi Bauunternehmen GmbH & Co. KG – Michendorf",
      "type": "Registerbekanntmachung nach dem Umwandlungsgesetz",
      "state": "Brandenburg",
      "amtsgericht": "Amtsgericht Potsdam",
      "registernummer": "HRA 8333",
      "registerart": "HRA",
      "company_name": "Matthäi Bauunternehmen GmbH & Co. KG",
      "company_seat": "Michendorf",
      "details": "10.11.2025 (Bekanntmachungsdatum)\n\nBrandenburg Amtsgericht Potsdam HRA 8333\nRegisterbekanntmachung nach dem Umwandlungsgesetz 07.11.2025 (Eintragungsdatum)\n\nMatthäi Bauunternehmen GmbH & Co. KG\nKommanditgesellschaft\nMichendorf\n\nZu Eintragungsnummer 2 vom 07.11.2025 wird als nicht eingetragen veröffentlicht: Den Gläubigern der an der Verschmelzung beteiligten Rechtsträger ist, wenn sie binnen sechs Monaten nach dem Tag, an dem die Eintragung der Verschmelzung in das Register des Sitzes desjenigen Rechtsträgers, dessen Gläubiger sie sind, als bekannt gemacht gilt, ihren Anspruch nach Grund und Höhe schriftlich anmelden, Sicherheit zu leisten, soweit sie nicht Befriedigung verlangen können. Dieses Recht steht den Gläubigern jedoch nur zu, wenn sie glaubhaft machen, dass durch die Verschmelzung die Erfüllung ihrer Forderung gefährdet wird."
    },
    {
      "date": "2025-11-10",
      "id": "136759",
      "original_text": "Einreichung neuer Dokumente\nThüringen Amtsgericht Jena HRB 209127\nBöttcher AG – Jena",
      "type": "Einreichung neuer Dokumente",
      "state": "Thüringen",
      "amtsgericht": "Amtsgericht Jena",
      "registernummer": "HRB 209127",
      "registerart": "HRB",
      "company_name": "Böttcher AG",
      "company_seat": "Jena",
      "details": "10.11.2025 (Bekanntmachungsdatum)\n\nThüringen Amtsgericht Jena HRB 209127\nEinreichung neuer Dokumente\n\nBöttcher AG\nAktiengesellschaft\nJena\n\nBekanntmachung gem. § 106 AktG: Aufgrund einer Veränderung in den Personen der Aufsichtsratsmitglieder ist durch den Vorstand eine neue Liste zum Handelsregister eingereicht worden."
    },
    {
      "date": "2025-11-10",
      "id": "136760",
      "original_text": "Registerbekanntmachung nach dem Umwandlungsgesetz\nBrandenburg Amtsgericht Neuruppin HRA 1537\nENERTRAG Windfeld Spitzer Berg GmbH & Co. KG – Dauerthal",
      "type": "Registerbekanntmachung nach dem Umwandlungsgesetz",
      "state": "Brandenburg",
      "amtsgericht": "Amtsgericht Neuruppin",
      "registernummer": "HRA 1537",
      "registerart": "HRA",
      "company_name": "ENERTRAG Windfeld Spitzer Berg GmbH & Co. KG",
      "company_seat": "Dauerthal",
      "details": "10.11.2025 (Bekanntmachungsdatum)\n\nBrandenburg Amtsgericht Neuruppin HRA 1537\nRegisterbekanntmachung nach dem Umwandlungsgesetz 07.11.2025 (Eintragungsdatum)\n\nENERTRAG Windfeld Spitzer Berg GmbH & Co. KG\nKommanditgesellschaft\nDauerthal\n\nZu Eintragungsnummer 8 vom 07.11.2025 wird als nicht eingetragen veröffentlicht:\nDen Gläubigern der an der Umwandlung beteiligten Rechtsträger ist, wenn sie binnen sechs Monaten nach dem Tag, an dem die Eintragung der Umwandlung in das Register des Sitzes desjenigen Rechtsträgers, dessen Gläubiger sie sind, als bekannt gemacht gilt, ihren Anspruch nach Grund und Höhe schriftlich anmelden, Sicherheit zu leisten, soweit sie nicht Befriedigung verlangen können. Dieses Recht steht den Gläubigern jedoch nur zu, wenn sie glaubhaft machen, dass durch die Umwandlung die Erfüllung ihrer Forderung gefährdet wird"
    },
    {
      "date": "2025-11-10",
      "id": "136761",
      "original_text": "Registerbekanntmachung nach dem Umwandlungsgesetz\nHamburg Amtsgericht Hamburg HRA 128104\nGJS Grundstücksgesellschaft Jürgen-Siemsen-Straße mbH & Co. KG – Hamburg",
      "type": "Registerbekanntmachung nach dem Umwandlungsgesetz",
      "state": "Hamburg",
      "amtsgericht": "Amtsgericht Hamburg",
      "registernummer": "HRA 128104",
      "registerart": "HRA",
      "company_name": "GJS Grundstücksgesellschaft Jürgen-Siemsen-Straße mbH & Co. KG",
      "company_seat": "Hamburg",
      "details": "10.11.2025 (Bekanntmachungsdatum)\n\nHamburg Amtsgericht Hamburg HRA 128104\nRegisterbekanntmachung nach dem Umwandlungsgesetz 10.11.2025 (Eintragungsdatum)\n\nGJS Grundstücksgesellschaft Jürgen-Siemsen-Straße mbH & Co. KG\nKommanditgesellschaft\nHamburg\n\nAls nicht eingetragen wird bekannt gemacht:\nDen Gläubigern der an der formwechselnden Umwandlung beteiligten Gesellschaften ist, wenn sie binnen sechs Monaten nach dem Tag, an dem die Eintragung der formwechselnden Umwandlung in das Register des Sitzes desjenigen Rechtsträgers, dessen Gläubiger sie sind, nach § 19 Absatz 3 UmwG als bekannt gemacht gilt, ihren Anspruch nach Grund und Höhe schriftlich anmelden, Sicherheit zu leisten, soweit sie nicht Befriedigung verlangen können. Dieses Recht steht den Gläubigern jedoch nur zu, wenn sie glaubhaft machen, dass durch die formwechselnde Umwandlung die Erfüllung ihrer Forderung gefährdet wird."
    },
    {
      "date": "2025-11-10",
      "id": "136762",
      "original_text": "Löschungsankündigung\nBerlin Amtsgericht Berlin (Charlottenburg) HRB 114892\nEasy Spiel Spielhallen GmbH – Berlin",
      "type": "Löschungsankündigung",
      "state": "Berlin",
      "amtsgericht": "Amtsgericht Berlin (Charlottenburg)",
      "registernummer": "HRB 114892",
      "registerart": "HRB",
      "company_name": "Easy Spiel Spielhallen GmbH",
      "company_seat": "Berlin",
      "details": "10.11.2025 (Bekanntmachungsdatum)\n\nBerlin Amtsgericht Berlin (Charlottenburg) HRB 114892\nLöschungsankündigung\n\nEasy Spiel Spielhallen GmbH\nGesellschaft mit beschränkter Haftung\nBerlin\n\nBei der nachstehenden Gesellschaft wird das Amtslöschungsverfahren gemäß § 394 FamFG eingeleitet. Widerspruchsfrist 6 Wochen"
    },
    {
      "date": "2025-11-10",
      "id": "136763",
      "original_text": "Löschungsankündigung\nBerlin Amtsgericht Berlin (Charlottenburg) HRB 135914\nH.K. Services GmbH – Berlin",
      "type": "Löschungsankündigung",
      "state": "Berlin",
      "amtsgericht": "Amtsgericht Berlin (Charlottenburg)",
      "registernummer": "HRB 135914",
      "registerart": "HRB",
      "company_name": "H.K. Services GmbH",
      "company_seat": "Berlin",
      "details": "10.11.2025 (Bekanntmachungsdatum)\n\nBerlin Amtsgericht Berlin (Charlottenburg) HRB 135914\nLöschungsankündigung\n\nH.K. Services GmbH\nGesellschaft mit beschränkter Haftung\nBerlin\n\nBei der nachstehenden Gesellschaft wird das Amtslöschungsverfahren gemäß § 394 FamFG eingeleitet. Widerspruchsfrist 6 Wochen"
    },
    {
      "date": "2025-11-10",
      "id": "136764",
      "original_text": "Löschungsankündigung\nBerlin Amtsgericht Berlin (Charlottenburg) HRB 208923\nLIKA Baugesellschaft mbH – Berlin",
      "type": "Löschungsankündigung",
      "state": "Berlin",
      "amtsgericht": "Amtsgericht Berlin (Charlottenburg)",
      "registernummer": "HRB 208923",
      "registerart": "HRB",
      "company_name": "LIKA Baugesellschaft mbH",
      "company_seat": "Berlin",
      "details": "10.11.2025 (Bekanntmachungsdatum)\n\nBerlin Amtsgericht Berlin (Charlottenburg) HRB 208923\nLöschungsankündigung\n\nLIKA Baugesellschaft mbH\nGesellschaft mit beschränkter Haftung\nBerlin\n\nBei der nachstehenden Gesellschaft wird das Amtslöschungsverfahren gemäß § 394 FamFG eingeleitet. Widerspruchsfrist 6 Wochen"
    },
    {
      "date": "2025-11-10",
      "id": "136765",
      "original_text": "Löschungsankündigung\nBerlin Amtsgericht Berlin (Charlottenburg) HRB 224931\nBATTIEN Capital Management GmbH – Berlin",
      "type": "Löschungsankündigung",
      "state": "Berlin",
      "amtsgericht": "Amtsgericht Berlin (Charlottenburg)",
      "registernummer": "HRB 224931",
      "registerart": "HRB",
      "company_name": "BATTIEN Capital Management GmbH",
      "company_seat": "Berlin",
      "details": "10.11.2025 (Bekanntmachungsdatum)\n\nBerlin Amtsgericht Berlin (Charlottenburg) HRB 224931\nLöschungsankündigung\n\nBATTIEN Capital Management GmbH\nGesellschaft mit beschränkter Haftung\nBerlin\n\nBei der nachstehenden Gesellschaft wird das Amtslöschungsverfahren gemäß § 394 FamFG eingeleitet. Widerspruchsfrist 6 Wochen"
    },
    {
      "date": "2025-11-10",
      "id": "136766",
      "original_text": "Löschungsankündigung\nBerlin Amtsgericht Berlin (Charlottenburg) HRB 202901\nTAGIT Generalbau GmbH – Berlin",
      "type": "Löschungsankündigung",
      "state": "Berlin",
      "amtsgericht": "Amtsgericht Berlin (Charlottenburg)",
      "registernummer": "HRB 202901",
      "registerart": "HRB",
      "company_name": "TAGIT Generalbau GmbH",
      "company_seat": "Berlin",
      "details": "10.11.2025 (Bekanntmachungsdatum)\n\nBerlin Amtsgericht Berlin (Charlottenburg) HRB 202901\nLöschungsankündigung\n\nTAGIT Generalbau GmbH\nGesellschaft mit beschränkter Haftung\nBerlin\n\nBei der nachstehenden Gesellschaft wird das Amtslöschungsverfahren gemäß § 394 FamFG eingeleitet. Widerspruchsfrist 6 Wochen"
    },
    {
      "date": "2025-11-10",
      "id": "136767",
      "original_text": "Löschungsankündigung\nSachsen-Anhalt Amtsgericht Stendal VR 20030\n\"Verband der Pudelfreunde Deutschlan e.V. (VDP)\" – Halle/Saale",
      "type": "Löschungsankündigung",
      "state": "Sachsen-Anhalt",
      "amtsgericht": "Amtsgericht Stendal",
      "registernummer": "VR 20030",
      "registerart": "VR",
      "company_name": "\"Verband der Pudelfreunde Deutschlan e.V. (VDP)\"",
      "company_seat": "Halle/Saale",
      "details": "10.11.2025 (Bekanntmachungsdatum)\n\nSachsen-Anhalt Amtsgericht Stendal VR 20030\nLöschungsankündigung\n\n\"Verband der Pudelfreunde Deutschlan e.V. (VDP)\"\neingetragener Verein\nHalle/Saale\n\nDas Registergericht beabsichtigt, vorstehenden Verein infolge Wegfalls sämtlicher Mitglieder bzw. vollständiger Aufgabe des Vereinszwecks v.A.w. zu löschen. Die Frist zur Erhebung eines Widerspruchs gegen die beabsichtigte Löschung wird auf drei Monate festgesetzt."
    },
    {
      "date": "2025-11-10",
      "id": "136768",
      "original_text": "Löschungsankündigung\nBrandenburg Amtsgericht Potsdam HRB 31894\nFINIAQ GmbH – Kleinmachnow",
      "type": "Löschungsankündigung",
      "state": "Brandenburg",
      "amtsgericht": "Amtsgericht Potsdam",
      "registernummer": "HRB 31894",
      "registerart": "HRB",
      "company_name": "FINIAQ GmbH",
      "company_seat": "Kleinmachnow",
      "details": "10.11.2025 (Bekanntmachungsdatum)\n\nBrandenburg Amtsgericht Potsdam HRB 31894\nLöschungsankündigung\n\nFINIAQ GmbH\nGesellschaft mit beschränkter Haftung\nKleinmachnow\n\nBei der nachstehenden Gesellschaft wird das Amtslöschungsverfahren gemäß § 394 FamFG eingeleitet. Widerspruchsfrist 8 Wochen."
    },
    {
      "date": "2025-11-10",
      "id": "136769",
      "original_text": "Einreichung neuer Dokumente\nSchleswig-Holstein Amtsgericht Lübeck HRB 21622\nMinimax GmbH – Bad Oldesloe",
      "type": "Einreichung neuer Dokumente",
      "state": "Schleswig-Holstein",
      "amtsgericht": "Amtsgericht Lübeck",
      "registernummer": "HRB 21622",
      "registerart": "HRB",
      "company_name": "Minimax GmbH",
      "company_seat": "Bad Oldesloe",
      "details": "10.11.2025 (Bekanntmachungsdatum)\n\nSchleswig-Holstein Amtsgericht Lübeck HRB 21622\nEinreichung neuer Dokumente\n\nMinimax GmbH\nGesellschaft mit beschränkter Haftung\nBad Oldesloe\n\nAls nicht eingetragen wird veröffentlicht: Die Gesellschaft hat eine aktuelle Liste der Mitglieder des Aufsichtsrats beim Handelsregister hinterlegt."
    },
    {
      "date": "2025-11-10",
      "id": "136770",
      "original_text": "Löschungsankündigung\nBaden-Württemberg Amtsgericht Stuttgart HRB 747675\nGrünenwald & Castiglione UG (haftungsbeschränkt) – Bietigheim-Bissingen",
      "type": "Löschungsankündigung",
      "state": "Baden-Württemberg",
      "amtsgericht": "Amtsgericht Stuttgart",
      "registernummer": "HRB 747675",
      "registerart": "HRB",
      "company_name": "Grünenwald & Castiglione UG (haftungsbeschränkt)",
      "company_seat": "Bietigheim-Bissingen",
      "details": "10.11.2025 (Bekanntmachungsdatum)\n\nBaden-Württemberg Amtsgericht Stuttgart HRB 747675\nLöschungsankündigung\n\nGrünenwald & Castiglione UG (haftungsbeschränkt)\nGesellschaft mit beschränkter Haftung\nBietigheim-Bissingen\n\nDas Gericht beabsichtigt, die Gesellschaft wegen Vermögenslosigkeit im Handelsregister von Amts wegen nach § 394 FamFG zu löschen. Die Frist zur Geltendmachung eines Widerspruchs gegen die beabsichtigte Löschung ist auf zwei Monate ab Veröffentlichung bestimmt."
    },
    {
      "date": "2025-11-10",
      "id": "136771",
      "original_text": "Löschungsankündigung\nSchleswig-Holstein Amtsgericht Flensburg HRB 10988\nVerwaltung Reedereigesellschaft London GmbH – Niebüll",
      "type": "Löschungsankündigung",
      "state": "Schleswig-Holstein",
      "amtsgericht": "Amtsgericht Flensburg",
      "registernummer": "HRB 10988",
      "registerart": "HRB",
      "company_name": "Verwaltung Reedereigesellschaft London GmbH",
      "company_seat": "Niebüll",
      "details": "10.11.2025 (Bekanntmachungsdatum)\n\nSchleswig-Holstein Amtsgericht Flensburg HRB 10988\nLöschungsankündigung\n\nVerwaltung Reedereigesellschaft London GmbH\nGesellschaft mit beschränkter Haftung\nNiebüll\n\nEs ist die Löschung der nachstehenden Gesellschaft wegen Vermögenslosigkeit gemäß § 394 FamFG beabsichtigt.\nWiderspruchsfrist: 2 Monate."
    },
    {
      "date": "2025-11-10",
      "id": "136772",
      "original_text": "Löschungsankündigung\nBerlin Amtsgericht Berlin (Charlottenburg) HRB 240820\nA-Max GmbH – Berlin",
      "type": "Löschungsankündigung",
      "state": "Berlin",
      "amtsgericht": "Amtsgericht Berlin (Charlottenburg)",
      "registernummer": "HRB 240820",
      "registerart": "HRB",
      "company_name": "A-Max GmbH",
      "company_seat": "Berlin",
      "details": "10.11.2025 (Bekanntmachungsdatum)\n\nBerlin Amtsgericht Berlin (Charlottenburg) HRB 240820\nLöschungsankündigung\n\nA-Max GmbH\nGesellschaft mit beschränkter Haftung\nBerlin\n\nBei der nachstehenden Gesellschaft wird das Amtslöschungsverfahren gemäß § 394 FamFG eingeleitet. Widerspruchsfrist 6 Wochen"
    },
    {
      "date": "2025-11-10",
      "id": "136773",
      "original_text": "Registerbekanntmachung nach dem Umwandlungsgesetz\nSchleswig-Holstein Amtsgericht Lübeck HRB 26804\nBauidee Projektplanung GmbH – Reinbek",
      "type": "Registerbekanntmachung nach dem Umwandlungsgesetz",
      "state": "Schleswig-Holstein",
      "amtsgericht": "Amtsgericht Lübeck",
      "registernummer": "HRB 26804",
      "registerart": "HRB",
      "company_name": "Bauidee Projektplanung GmbH",
      "company_seat": "Reinbek",
      "details": "10.11.2025 (Bekanntmachungsdatum)\n\nSchleswig-Holstein Amtsgericht Lübeck HRB 26804\nRegisterbekanntmachung nach dem Umwandlungsgesetz 10.11.2025 (Eintragungsdatum)\n\nBauidee Projektplanung GmbH\nGesellschaft mit beschränkter Haftung\nReinbek\n\nZu Eintragungsnummer 1 vom 10.11.2025 wird als nicht eingetragen veröffentlicht:  Den Gläubigern der an der Ausgliederung beteiligten Rechtsträger ist, wenn sie binnen sechs Monaten nach dem Tag, an dem die Eintragung der Ausgliederung in das Register des Sitzes desjenigen Rechtsträgers, dessen Gläubiger sie sind, als bekannt gemacht gilt, ihren Anspruch nach Grund und Höhe schriftlich anmelden, Sicherheit zu leisten, soweit sie nicht Befriedigung verlangen können. Dieses Recht steht den Gläubigern jedoch nur zu, wenn sie glaubhaft machen, dass durch die Ausgliederung die Erfüllung ihrer Forderung gefährdet wird."
    },
    {
      "date": "2025-11-10",
      "id": "136774",
      "original_text": "Löschungsankündigung\nBerlin Amtsgericht Berlin (Charlottenburg) HRB 235483\nGIC German IT Consulting UG (haftungsbeschränkt) – Berlin",
      "type": "Löschungsankündigung",
      "state": "Berlin",
      "amtsgericht": "Amtsgericht Berlin (Charlottenburg)",
      "registernummer": "HRB 235483",
      "registerart": "HRB",
      "company_name": "GIC German IT Consulting UG (haftungsbeschränkt)",
      "company_seat": "Berlin",
      "details": "10.11.2025 (Bekanntmachungsdatum)\n\nBerlin Amtsgericht Berlin (Charlottenburg) HRB 235483\nLöschungsankündigung\n\nGIC German IT Consulting UG (haftungsbeschränkt)\nGesellschaft mit beschränkter Haftung\nBerlin\n\nBei der nachstehenden Gesellschaft wird das Amtslöschungsverfahren gemäß § 394 FamFG eingeleitet. Widerspruchsfrist 6 Wochen"
    },
    {
      "date": "2025-11-10",
      "id": "136775",
      "original_text": "Registerbekanntmachung nach dem Umwandlungsgesetz\nSchleswig-Holstein Amtsgericht Lübeck HRA 11481\nBauidee Projektplanung e.K. – Reinbek",
      "type": "Registerbekanntmachung nach dem Umwandlungsgesetz",
      "state": "Schleswig-Holstein",
      "amtsgericht": "Amtsgericht Lübeck",
      "registernummer": "HRA 11481",
      "registerart": "HRA",
      "company_name": "Bauidee Projektplanung e.K.",
      "company_seat": "Reinbek",
      "details": "10.11.2025 (Bekanntmachungsdatum)\n\nSchleswig-Holstein Amtsgericht Lübeck HRA 11481\nRegisterbekanntmachung nach dem Umwandlungsgesetz 10.11.2025 (Eintragungsdatum)\n\nBauidee Projektplanung e.K.\nEinzelkaufmann / Einzelkauffrau\nReinbek\n\nZu Eintragungsnummer 2 vom 10.11.2025 wird als nicht eingetragen veröffentlicht: Den Gläubigern der an der Ausgliederung beteiligten Rechtsträger ist, wenn sie binnen sechs Monaten nach dem Tag, an dem die Eintragung der Ausgliederung in das Register des Sitzes desjenigen Rechtsträgers, dessen Gläubiger sie sind, als bekannt gemacht gilt, ihren Anspruch nach Grund und Höhe schriftlich anmelden, Sicherheit zu leisten, soweit sie nicht Befriedigung verlangen können. Dieses Recht steht den Gläubigern jedoch nur zu, wenn sie glaubhaft machen, dass durch die Ausgliederung die Erfüllung ihrer Forderung gefährdet wird."
    },
    {
      "date": "2025-11-10",
      "id": "136776",
      "original_text": "Löschungsankündigung\nBaden-Württemberg Amtsgericht Stuttgart HRB 773382\nEuropjob GmbH – Wendlingen am Neckar",
      "type": "Löschungsankündigung",
      "state": "Baden-Württemberg",
      "amtsgericht": "Amtsgericht Stuttgart",
      "registernummer": "HRB 773382",
      "registerart": "HRB",
      "company_name": "Europjob GmbH",
      "company_seat": "Wendlingen am Neckar",
      "details": "10.11.2025 (Bekanntmachungsdatum)\n\nBaden-Württemberg Amtsgericht Stuttgart HRB 773382\nLöschungsankündigung\n\nEuropjob GmbH\nGesellschaft mit beschränkter Haftung\nWendlingen am Neckar\n\nAls nicht eingetragen wird bekanntgemacht:\nDas Gericht beabsichtigt, die Gesellschaft wegen Vermögenslosigkeit im Handelsregister von Amts wegen nach § 394 FamFG zu löschen. Die Frist zur Geltendmachung eines Widerspruchs gegen die beabsichtigte Löschung ist auf zwei Monate ab Veröffentlichung bestimmt."
    },
    {
      "date": "2025-11-10",
      "id": "136777",
      "original_text": "Registerbekanntmachung nach dem Umwandlungsgesetz\nSchleswig-Holstein Amtsgericht Lübeck HRB 21912\nBIHR GmbH – Glinde",
      "type": "Registerbekanntmachung nach dem Umwandlungsgesetz",
      "state": "Schleswig-Holstein",
      "amtsgericht": "Amtsgericht Lübeck",
      "registernummer": "HRB 21912",
      "registerart": "HRB",
      "company_name": "BIHR GmbH",
      "company_seat": "Glinde",
      "details": "10.11.2025 (Bekanntmachungsdatum)\n\nSchleswig-Holstein Amtsgericht Lübeck HRB 21912\nRegisterbekanntmachung nach dem Umwandlungsgesetz 10.11.2025 (Eintragungsdatum)\n\nBIHR GmbH\nGesellschaft mit beschränkter Haftung\nGlinde\n\nZu Eintragungsnummer 6 vom 10.11.2025 wird als nicht eingetragen veröffentlicht:  Den Gläubigern der an der Verschmelzung beteiligten Rechtsträger ist, wenn sie binnen sechs Monaten nach dem Tag, an dem die Eintragung der Verschmelzung in das Register des Sitzes desjenigen Rechtsträgers, dessen Gläubiger sie sind, als bekannt gemacht gilt, ihren Anspruch nach Grund und Höhe schriftlich anmelden, Sicherheit zu leisten, soweit sie nicht Befriedigung verlangen können. Dieses Recht steht den Gläubigern jedoch nur zu, wenn sie glaubhaft machen, dass durch die Verschmelzung die Erfüllung ihrer Forderung gefährdet wird."
    },
    {
      "date": "2025-11-10",
      "id": "136778",
      "original_text": "Registerbekanntmachung nach dem Umwandlungsgesetz\nBaden-Württemberg Amtsgericht Mannheim HRB 720021\nPerformance One AG – Mannheim",
      "type": "Registerbekanntmachung nach dem Umwandlungsgesetz",
      "state": "Baden-Württemberg",
      "amtsgericht": "Amtsgericht Mannheim",
      "registernummer": "HRB 720021",
      "registerart": "HRB",
      "company_name": "Performance One AG",
      "company_seat": "Mannheim",
      "details": "10.11.2025 (Bekanntmachungsdatum)\n\nBaden-Württemberg Amtsgericht Mannheim HRB 720021\nRegisterbekanntmachung nach dem Umwandlungsgesetz\n\nPerformance One AG\nAktiengesellschaft\nMannheim\n\nDie Gesellschaft hat am 07.11.2025 den Entwurf des Ausgliederungs- und Übernahmevertrag zwischen \"PERFORMANCE ONE HEART GmbH\", Mannheim (Amtsgericht Mannheim HRB 735618) und der hiesigen Gesellschaft (übertragender Rechtsträger) zum Handelsregister eingereicht."
    },
    {
      "date": "2025-11-10",
      "id": "136779",
      "original_text": "Registerbekanntmachung nach dem Umwandlungsgesetz\nBaden-Württemberg Amtsgericht Stuttgart HRA 742261\nHennefarth Mechanik OHG – Neuweiler",
      "type": "Registerbekanntmachung nach dem Umwandlungsgesetz",
      "state": "Baden-Württemberg",
      "amtsgericht": "Amtsgericht Stuttgart",
      "registernummer": "HRA 742261",
      "registerart": "HRA",
      "company_name": "Hennefarth Mechanik OHG",
      "company_seat": "Neuweiler",
      "details": "10.11.2025 (Bekanntmachungsdatum)\n\nBaden-Württemberg Amtsgericht Stuttgart HRA 742261\nRegisterbekanntmachung nach dem Umwandlungsgesetz 10.11.2025 (Eintragungsdatum)\n\nHennefarth Mechanik OHG\nOffene Handelsgesellschaft\nNeuweiler\n\nAls nicht eingetragen wird bekanntgemacht:\nDen Gläubigern des an dem Formwechsel beteiligten Rechtsträgers ist, wenn sie binnen sechs Monaten nach dem Tag, an dem die Eintragung des Formwechsels in das Register des Sitzes desjenigen Rechtsträgers, dessen Gläubiger sie sind, nach § 19 Abs. 3 UmwG als bekanntgemacht gilt, ihren Anspruch nach Grund und Höhe schriftlich anmelden, Sicherheit zu leisten, soweit sie nicht Befriedigung verlangen können. Dieses Recht steht den Gläubigern jedoch nur zu, wenn sie glaubhaft machen, dass durch den Formwechsel die Erfüllung ihrer Forderung gefährdet wird."
    },
    {
      "date": "2025-11-10",
      "id": "136780",
      "original_text": "Registerbekanntmachung nach dem Umwandlungsgesetz\nBaden-Württemberg Amtsgericht Stuttgart HRB 802482\nHennefarth Mechanik GmbH – Neuweiler",
      "type": "Registerbekanntmachung nach dem Umwandlungsgesetz",
      "state": "Baden-Württemberg",
      "amtsgericht": "Amtsgericht Stuttgart",
      "registernummer": "HRB 802482",
      "registerart": "HRB",
      "company_name": "Hennefarth Mechanik GmbH",
      "company_seat": "Neuweiler",
      "details": "10.11.2025 (Bekanntmachungsdatum)\n\nBaden-Württemberg Amtsgericht Stuttgart HRB 802482\nRegisterbekanntmachung nach dem Umwandlungsgesetz 10.11.2025 (Eintragungsdatum)\n\nHennefarth Mechanik GmbH\nGesellschaft mit beschränkter Haftung\nNeuweiler\n\nAls nicht eingetragen wird bekanntgemacht:\nDen Gläubigern des an dem Formwechsel beteiligten Rechtsträgers ist, wenn sie binnen sechs Monaten nach dem Tag, an dem die Eintragung des Formwechsels in das Register des Sitzes desjenigen Rechtsträgers, dessen Gläubiger sie sind, nach § 19 Abs. 3 UmwG als bekanntgemacht gilt, ihren Anspruch nach Grund und Höhe schriftlich anmelden, Sicherheit zu leisten, soweit sie nicht Befriedigung verlangen können. Dieses Recht steht den Gläubigern jedoch nur zu, wenn sie glaubhaft machen, dass durch den Formwechsel die Erfüllung ihrer Forderung gefährdet wird."
    },
    {
      "date": "2025-11-10",
      "id": "136781",
      "original_text": "Löschungsankündigung\nSachsen Amtsgericht Dresden HRB 36677\nSebastian Siola UG (haftungsbeschränkt) – Görlitz",
      "type": "Löschungsankündigung",
      "state": "Sachsen",
      "amtsgericht": "Amtsgericht Dresden",
      "registernummer": "HRB 36677",
      "registerart": "HRB",
      "company_name": "Sebastian Siola UG (haftungsbeschränkt)",
      "company_seat": "Görlitz",
      "details": "10.11.2025 (Bekanntmachungsdatum)\n\nSachsen Amtsgericht Dresden HRB 36677\nLöschungsankündigung\n\nSebastian Siola UG (haftungsbeschränkt)\nGesellschaft mit beschränkter Haftung\nGörlitz\n\nDas Registergericht beabsichtigt, die im Handelsregister eingetragene Gesellschaft von Amts wegen nach § 394 FamFG zu löschen. Die Frist zu Erhebung eines Widerspruchs gegen die beabsichtigte Löschung wird auf einen Monat festgesetzt."
    },
    {
      "date": "2025-11-10",
      "id": "136782",
      "original_text": "Registerbekanntmachung nach dem Umwandlungsgesetz\nSachsen Amtsgericht Chemnitz HRA 10044\nKRONOS Gesellschaft für Handelslösungen mbH & Co. KG – Chemnitz",
      "type": "Registerbekanntmachung nach dem Umwandlungsgesetz",
      "state": "Sachsen",
      "amtsgericht": "Amtsgericht Chemnitz",
      "registernummer": "HRA 10044",
      "registerart": "HRA",
      "company_name": "KRONOS Gesellschaft für Handelslösungen mbH & Co. KG",
      "company_seat": "Chemnitz",
      "details": "10.11.2025 (Bekanntmachungsdatum)\n\nSachsen Amtsgericht Chemnitz HRA 10044\nRegisterbekanntmachung nach dem Umwandlungsgesetz 10.11.2025 (Eintragungsdatum)\n\nKRONOS Gesellschaft für Handelslösungen mbH & Co. KG\nKommanditgesellschaft\nChemnitz\n\nDen Gläubigern der an der Verschmelzung beteiligten Rechtsträger ist, wenn sie binnen sechs Monaten nach dem Tag, an dem die Eintragung der Verschmelzung in das Register des Sitzes desjenigen Rechtsträgers, dessen Gläubiger sie sind, nach § 19 Abs. 3 UmwG als bekannt gemacht gilt, ihren Anspruch nach Grund und Höhe in Textform anmelden, Sicherheit zu leisten, soweit sie nicht Befriedigung verlangen können. Dieses Recht steht den Gläubigern jedoch nur zu, wenn sie glaubhaft machen, dass durch die Verschmelzung die Erfüllung der Forderung gefährdet wird."
    },
    {
      "date": "2025-11-10",
      "id": "136783",
      "original_text": "Registerbekanntmachung nach dem Umwandlungsgesetz\nSachsen Amtsgericht Chemnitz HRA 10212\nVersicherungsmakler Kunzmann GmbH & Co. KG – Breitenbrunn/Erzgeb.",
      "type": "Registerbekanntmachung nach dem Umwandlungsgesetz",
      "state": "Sachsen",
      "amtsgericht": "Amtsgericht Chemnitz",
      "registernummer": "HRA 10212",
      "registerart": "HRA",
      "company_name": "Versicherungsmakler Kunzmann GmbH & Co. KG",
      "company_seat": "Breitenbrunn/Erzgeb.",
      "details": "10.11.2025 (Bekanntmachungsdatum)\n\nSachsen Amtsgericht Chemnitz HRA 10212\nRegisterbekanntmachung nach dem Umwandlungsgesetz 10.11.2025 (Eintragungsdatum)\n\nVersicherungsmakler Kunzmann GmbH & Co. KG\nKommanditgesellschaft\nBreitenbrunn/Erzgeb.\n\nDen Gläubigern der an der Ausgliederung beteiligten Rechtsträger ist, wenn sie binnen sechs Monaten nach dem Tag, an dem die Eintragung der Ausgliederung in das Register des Sitzes desjenigen Rechtsträgers, dessen Gläubiger sie sind, nach § 19 Abs. 3 UmwG als bekannt gemacht gilt, ihren Anspruch nach Grund und Höhe in Textform anmelden, Sicherheit zu leisten, soweit sie nicht Befriedigung verlangen können. Dieses Recht steht den Gläubigern jedoch nur zu, wenn sie glaubhaft machen, dass durch die Ausgliederung die Erfüllung der Forderung gefährdet wird."
    },
    {
      "date": "2025-11-10",
      "id": "136784",
      "original_text": "Registerbekanntmachung nach dem Umwandlungsgesetz\nSachsen Amtsgericht Dresden HRB 35791\nautoladen-dresden.de GmbH – Heidenau",
      "type": "Registerbekanntmachung nach dem Umwandlungsgesetz",
      "state": "Sachsen",
      "amtsgericht": "Amtsgericht Dresden",
      "registernummer": "HRB 35791",
      "registerart": "HRB",
      "company_name": "autoladen-dresden.de GmbH",
      "company_seat": "Heidenau",
      "details": "10.11.2025 (Bekanntmachungsdatum)\n\nSachsen Amtsgericht Dresden HRB 35791\nRegisterbekanntmachung nach dem Umwandlungsgesetz 10.11.2025 (Eintragungsdatum)\n\nautoladen-dresden.de GmbH\nGesellschaft mit beschränkter Haftung\nHeidenau\n\nDen Gläubigern der an der Verschmelzung beteiligten Rechtsträger ist, wenn sie binnen sechs Monaten nach dem Tag, an dem die Eintragung der Verschmelzung in das Register des Sitzes desjenigen Rechtsträgers, dessen Gläubiger sie sind, nach § 19 Abs. 3 UmwG als bekannt gemacht gilt, ihren Anspruch nach Grund und Höhe in Textform anmelden, Sicherheit zu leisten, soweit sie nicht Befriedigung verlangen können. Dieses Recht steht den Gläubigern jedoch nur zu, wenn sie glaubhaft machen, dass durch die Verschmelzung die Erfüllung der Forderung gefährdet wird."
    },
    {
      "date": "2025-11-10",
      "id": "136785",
      "original_text": "Löschungsankündigung\nSachsen Amtsgericht Leipzig HRB 30514\nSmart Minds UG (haftungsbeschränkt) – Leipzig",
      "type": "Löschungsankündigung",
      "state": "Sachsen",
      "amtsgericht": "Amtsgericht Leipzig",
      "registernummer": "HRB 30514",
      "registerart": "HRB",
      "company_name": "Smart Minds UG (haftungsbeschränkt)",
      "company_seat": "Leipzig",
      "details": "10.11.2025 (Bekanntmachungsdatum)\n\nSachsen Amtsgericht Leipzig HRB 30514\nLöschungsankündigung 10.11.2025 (Eintragungsdatum)\n\nSmart Minds UG (haftungsbeschränkt)\nGesellschaft mit beschränkter Haftung\nLeipzig\n\nDas Registergericht beabsichtigt, die im Handelsregister eingetragene Gesellschaft von Amts wegen nach § 394 FamFG zu löschen. Die Frist zu Erhebung eines Widerspruchs gegen die beabsichtigte Löschung wird auf einen Monat festgesetzt."
    },
    {
      "date": "2025-11-10",
      "id": "136786",
      "original_text": "Löschungsankündigung\nSachsen Amtsgericht Chemnitz HRB 29686\nHammer Management UG (haftungsbeschränkt) – Neuhausen/Erzgeb.",
      "type": "Löschungsankündigung",
      "state": "Sachsen",
      "amtsgericht": "Amtsgericht Chemnitz",
      "registernummer": "HRB 29686",
      "registerart": "HRB",
      "company_name": "Hammer Management UG (haftungsbeschränkt)",
      "company_seat": "Neuhausen/Erzgeb.",
      "details": "10.11.2025 (Bekanntmachungsdatum)\n\nSachsen Amtsgericht Chemnitz HRB 29686\nLöschungsankündigung\n\nHammer Management UG (haftungsbeschränkt)\nGesellschaft mit beschränkter Haftung\nNeuhausen/Erzgeb.\n\nDas Registergericht beabsichtigt, die im Handelsregister eingetragene Gesellschaft von Amts wegen nach § 394 FamFG zu löschen. Die Frist zu Erhebung eines Widerspruchs gegen die beabsichtigte Löschung wird auf einen Monat festgesetzt."
    },
    {
      "date": "2025-11-10",
      "id": "136787",
      "original_text": "Registerbekanntmachung nach dem Umwandlungsgesetz\nSachsen Amtsgericht Leipzig HRB 31814\nZ Immobilien GmbH – Delitzsch",
      "type": "Registerbekanntmachung nach dem Umwandlungsgesetz",
      "state": "Sachsen",
      "amtsgericht": "Amtsgericht Leipzig",
      "registernummer": "HRB 31814",
      "registerart": "HRB",
      "company_name": "Z Immobilien GmbH",
      "company_seat": "Delitzsch",
      "details": "10.11.2025 (Bekanntmachungsdatum)\n\nSachsen Amtsgericht Leipzig HRB 31814\nRegisterbekanntmachung nach dem Umwandlungsgesetz 10.11.2025 (Eintragungsdatum)\n\nZ Immobilien GmbH\nGesellschaft mit beschränkter Haftung\nDelitzsch\n\nDen Gläubigern der an der Verschmelzung beteiligten Rechtsträger ist, wenn sie binnen sechs Monaten nach dem Tag, an dem die Eintragung der Verschmelzung in das Register des Sitzes desjenigen Rechtsträgers, dessen Gläubiger sie sind, nach § 19 Abs. 3 UmwG als bekannt gemacht gilt, ihren Anspruch nach Grund und Höhe in Textform anmelden, Sicherheit zu leisten, soweit sie nicht Befriedigung verlangen können. Dieses Recht steht den Gläubigern jedoch nur zu, wenn sie glaubhaft machen, dass durch die Verschmelzung die Erfüllung der Forderung gefährdet wird."
    },
    {
      "date": "2025-11-10",
      "id": "136788",
      "original_text": "Einreichung neuer Dokumente\nSachsen Amtsgericht Chemnitz HRB 651\nChemnitzer Verkehrs-Aktiengesellschaft – Chemnitz",
      "type": "Einreichung neuer Dokumente",
      "state": "Sachsen",
      "amtsgericht": "Amtsgericht Chemnitz",
      "registernummer": "HRB 651",
      "registerart": "HRB",
      "company_name": "Chemnitzer Verkehrs-Aktiengesellschaft",
      "company_seat": "Chemnitz",
      "details": "10.11.2025 (Bekanntmachungsdatum)\n\nSachsen Amtsgericht Chemnitz HRB 651\nEinreichung neuer Dokumente\n\nChemnitzer Verkehrs-Aktiengesellschaft\nAktiengesellschaft\nChemnitz\n\nAm 06.11.2025 wurde beim Handelsregister des Amtsgerichts Chemnitz die Liste der Mitglieder des Aufsichtsrats gemäß § 106 AktG eingereicht."
    },
    {
      "date": "2025-11-10",
      "id": "136789",
      "original_text": "Registerbekanntmachung nach dem Umwandlungsgesetz\nSachsen Amtsgericht Chemnitz HRA 10043\nMonika Kunzmann Versicherungsmaklerin e.K. – Breitenbrunn/Erzgeb.",
      "type": "Registerbekanntmachung nach dem Umwandlungsgesetz",
      "state": "Sachsen",
      "amtsgericht": "Amtsgericht Chemnitz",
      "registernummer": "HRA 10043",
      "registerart": "HRA",
      "company_name": "Monika Kunzmann Versicherungsmaklerin e.K.",
      "company_seat": "Breitenbrunn/Erzgeb.",
      "details": "10.11.2025 (Bekanntmachungsdatum)\n\nSachsen Amtsgericht Chemnitz HRA 10043\nRegisterbekanntmachung nach dem Umwandlungsgesetz 10.11.2025 (Eintragungsdatum)\n\nMonika Kunzmann Versicherungsmaklerin e.K.\nEinzelkaufmann / Einzelkauffrau\nBreitenbrunn/Erzgeb.\n\nDen Gläubigern der an der Ausgliederung beteiligten Rechtsträger ist, wenn sie binnen sechs Monaten nach dem Tag, an dem die Eintragung der Ausgliederung in das Register des Sitzes desjenigen Rechtsträgers, dessen Gläubiger sie sind, nach § 19 Abs. 3 UmwG als bekannt gemacht gilt, ihren Anspruch nach Grund und Höhe in Textform anmelden, Sicherheit zu leisten, soweit sie nicht Befriedigung verlangen können. Dieses Recht steht den Gläubigern jedoch nur zu, wenn sie glaubhaft machen, dass durch die Ausgliederung die Erfüllung der Forderung gefährdet wird."
    },
    {
      "date": "2025-11-10",
      "id": "136790",
      "original_text": "Registerbekanntmachung nach dem Umwandlungsgesetz\nSachsen Amtsgericht Dresden HRA 9283\nautoladen-dresden.de GmbH & Co. KG – Heidenau",
      "type": "Registerbekanntmachung nach dem Umwandlungsgesetz",
      "state": "Sachsen",
      "amtsgericht": "Amtsgericht Dresden",
      "registernummer": "HRA 9283",
      "registerart": "HRA",
      "company_name": "autoladen-dresden.de GmbH & Co. KG",
      "company_seat": "Heidenau",
      "details": "10.11.2025 (Bekanntmachungsdatum)\n\nSachsen Amtsgericht Dresden HRA 9283\nRegisterbekanntmachung nach dem Umwandlungsgesetz 10.11.2025 (Eintragungsdatum)\n\nautoladen-dresden.de GmbH & Co. KG\nKommanditgesellschaft\nHeidenau\n\nDen Gläubigern der an der Verschmelzung beteiligten Rechtsträger ist, wenn sie binnen sechs Monaten nach dem Tag, an dem die Eintragung der Verschmelzung in das Register des Sitzes desjenigen Rechtsträgers, dessen Gläubiger sie sind, nach § 19 Abs. 3 UmwG als bekannt gemacht gilt, ihren Anspruch nach Grund und Höhe in Textform anmelden, Sicherheit zu leisten, soweit sie nicht Befriedigung verlangen können. Dieses Recht steht den Gläubigern jedoch nur zu, wenn sie glaubhaft machen, dass durch die Verschmelzung die Erfüllung der Forderung gefährdet wird."
    },
    {
      "date": "2025-11-10",
      "id": "136791",
      "original_text": "Registerbekanntmachung nach dem Umwandlungsgesetz\nSachsen Amtsgericht Leipzig HRB 28423\nMGH Mitteldeutsche Grundbesitz Holding GmbH – Delitzsch",
      "type": "Registerbekanntmachung nach dem Umwandlungsgesetz",
      "state": "Sachsen",
      "amtsgericht": "Amtsgericht Leipzig",
      "registernummer": "HRB 28423",
      "registerart": "HRB",
      "company_name": "MGH Mitteldeutsche Grundbesitz Holding GmbH",
      "company_seat": "Delitzsch",
      "details": "10.11.2025 (Bekanntmachungsdatum)\n\nSachsen Amtsgericht Leipzig HRB 28423\nRegisterbekanntmachung nach dem Umwandlungsgesetz 10.11.2025 (Eintragungsdatum)\n\nMGH Mitteldeutsche Grundbesitz Holding GmbH\nGesellschaft mit beschränkter Haftung\nDelitzsch\n\nDen Gläubigern der an der Verschmelzung beteiligten Rechtsträger ist, wenn sie binnen sechs Monaten nach dem Tag, an dem die Eintragung der Verschmelzung in das Register des Sitzes desjenigen Rechtsträgers, dessen Gläubiger sie sind, nach § 19 Abs. 3 UmwG als bekannt gemacht gilt, ihren Anspruch nach Grund und Höhe in Textform anmelden, Sicherheit zu leisten, soweit sie nicht Befriedigung verlangen können. Dieses Recht steht den Gläubigern jedoch nur zu, wenn sie glaubhaft machen, dass durch die Verschmelzung die Erfüllung der Forderung gefährdet wird."
    },
    {
      "date": "2025-11-10",
      "id": "136792",
      "original_text": "Registerbekanntmachung nach dem Umwandlungsgesetz\nNiedersachsen Amtsgericht Osnabrück HRA 209750\nJannik Vinke DerGrilltyp e.K. – Hilter a.T.W.",
      "type": "Registerbekanntmachung nach dem Umwandlungsgesetz",
      "state": "Niedersachsen",
      "amtsgericht": "Amtsgericht Osnabrück",
      "registernummer": "HRA 209750",
      "registerart": "HRA",
      "company_name": "Jannik Vinke DerGrilltyp e.K.",
      "company_seat": "Hilter a.T.W.",
      "details": "10.11.2025 (Bekanntmachungsdatum)\n\nNiedersachsen Amtsgericht Osnabrück HRA 209750\nRegisterbekanntmachung nach dem Umwandlungsgesetz 10.11.2025 (Eintragungsdatum)\n\nJannik Vinke DerGrilltyp e.K.\nEinzelkaufmann / Einzelkauffrau\nHilter a.T.W.\n\nDen Gläubigern der an der Ausgliederung beteiligten Rechtsträger ist, wenn sie binnen sechs Monaten nach dem Tag, an dem die Eintragung der Ausgliederung in das Register des Sitzes desjenigen Rechtsträgers, dessen Gläubiger sie sind, nach § 19 Abs. 3 UmwG als bekannt gemacht gilt, ihren Anspruch nach Grund und Höhe schriftlich anmelden, Sicherheit zu leisten, soweit sie nicht Befriedigung verlangen können. Dieses Recht steht den Gläubigern jedoch nur zu, wenn sie glaubhaft machen, dass durch die Ausgliederung die Erfüllung der Forderung gefährdet wird."
    },
    {
      "date": "2025-11-10",
      "id": "136793",
      "original_text": "Löschungsankündigung\nNiedersachsen Amtsgericht Hannover HRB 214218\nGaDe Bau GmbH – Laatzen",
      "type": "Löschungsankündigung",
      "state": "Niedersachsen",
      "amtsgericht": "Amtsgericht Hannover",
      "registernummer": "HRB 214218",
      "registerart": "HRB",
      "company_name": "GaDe Bau GmbH",
      "company_seat": "Laatzen",
      "details": "10.11.2025 (Bekanntmachungsdatum)\n\nNiedersachsen Amtsgericht Hannover HRB 214218\nLöschungsankündigung 10.11.2025 (Eintragungsdatum)\n\nGaDe Bau GmbH\nGesellschaft mit beschränkter Haftung\nLaatzen\n\nDas Registergericht beabsichtigt, die Gesellschaft von Amts wegen nach § 394 FamFG zu löschen. Die Frist zur Erhebung eines Widerspruchs ist auf 1 Monat ab dieser Registerbekanntmachung festgesetzt."
    },
    {
      "date": "2025-11-10",
      "id": "136794",
      "original_text": "Löschungsankündigung\nNiedersachsen Amtsgericht Braunschweig HRA 100225 früher Amtsgericht Wolfsburg\nProjekto kaufmännisches Planungsbüro GmbH & Co. KG – Wolfsburg",
      "type": "Löschungsankündigung",
      "state": "Niedersachsen",
      "amtsgericht": "Amtsgericht Braunschweig",
      "registernummer": "HRA 100225",
      "registerart": "HRA",
      "company_name": "Projekto kaufmännisches Planungsbüro GmbH & Co. KG",
      "company_seat": "Wolfsburg",
      "former_amtsgericht": "Wolfsburg",
      "details": "10.11.2025 (Bekanntmachungsdatum)\n\nNiedersachsen Amtsgericht Braunschweig HRA 100225 früher Amtsgericht Wolfsburg\nLöschungsankündigung\n\nProjekto kaufmännisches Planungsbüro GmbH & Co. KG\nKommanditgesellschaft\nWolfsburg\n\nDas Registergericht beabsichtigt, die Firma von Amts wegen nach §§ 31 HGB, 393 FamFG zu löschen. Die Frist zur Erhebung eines Widerspruchs ist auf 1 Monat ab dieser Registerbekanntmachung festgesetzt."
    },
    {
      "date": "2025-11-10",
      "id": "136795",
      "original_text": "Löschungsankündigung\nNiedersachsen Amtsgericht Braunschweig HRB 203743\nTannhof UG (haftungsbeschränkt) – Vienenburg",
      "type": "Löschungsankündigung",
      "state": "Niedersachsen",
      "amtsgericht": "Amtsgericht Braunschweig",
      "registernummer": "HRB 203743",
      "registerart": "HRB",
      "company_name": "Tannhof UG (haftungsbeschränkt)",
      "company_seat": "Vienenburg",
      "details": "10.11.2025 (Bekanntmachungsdatum)\n\nNiedersachsen Amtsgericht Braunschweig HRB 203743\nLöschungsankündigung\n\nTannhof UG (haftungsbeschränkt)\nGesellschaft mit beschränkter Haftung\nVienenburg\n\nDas Registergericht beabsichtigt, die Gesellschaft von Amts wegen nach § 394 FamFG zu löschen. Die Frist zur Erhebung eines Widerspruchs ist auf 1 Monat ab dieser Registerbekanntmachung festgesetzt."
    },
    {
      "date": "2025-11-10",
      "id": "136796",
      "original_text": "Löschungsankündigung\nNiedersachsen Amtsgericht Osnabrück HRB 216850\nInstruct me UG (haftungsbeschränkt) – Schüttorf",
      "type": "Löschungsankündigung",
      "state": "Niedersachsen",
      "amtsgericht": "Amtsgericht Osnabrück",
      "registernummer": "HRB 216850",
      "registerart": "HRB",
      "company_name": "Instruct me UG (haftungsbeschränkt)",
      "company_seat": "Schüttorf",
      "details": "10.11.2025 (Bekanntmachungsdatum)\n\nNiedersachsen Amtsgericht Osnabrück HRB 216850\nLöschungsankündigung\n\nInstruct me UG (haftungsbeschränkt)\nGesellschaft mit beschränkter Haftung\nSchüttorf\n\nDas Registergericht beabsichtigt, die Gesellschaft von Amts wegen nach § 394 FamFG wegen Vermögenslosigkeit zu löschen. Die Frist zur Erhebung eines Widerspruchs ist auf 1 Monat ab dieser Registerbekanntmachung festgesetzt."
    },
    {
      "date": "2025-11-10",
      "id": "136797",
      "original_text": "Registerbekanntmachung nach dem Umwandlungsgesetz\nNiedersachsen Amtsgericht Walsrode HRB 209093\nJupiter Beteiligungsgesellschaft mbH – Nienburg",
      "type": "Registerbekanntmachung nach dem Umwandlungsgesetz",
      "state": "Niedersachsen",
      "amtsgericht": "Amtsgericht Walsrode",
      "registernummer": "HRB 209093",
      "registerart": "HRB",
      "company_name": "Jupiter Beteiligungsgesellschaft mbH",
      "company_seat": "Nienburg",
      "details": "10.11.2025 (Bekanntmachungsdatum)\n\nNiedersachsen Amtsgericht Walsrode HRB 209093\nRegisterbekanntmachung nach dem Umwandlungsgesetz 10.11.2025 (Eintragungsdatum)\n\nJupiter Beteiligungsgesellschaft mbH\nGesellschaft mit beschränkter Haftung\nNienburg\n\nDen Gläubigern der an der Verschmelzung beteiligten Rechtsträger ist, wenn sie binnen sechs Monaten nach dem Tag, an dem die Eintragung der Verschmelzung in das Register des Sitzes desjenigen Rechtsträgers, dessen Gläubiger sie sind, nach § 19  Abs.  3 UmwG als bekannt gemacht gilt, ihren Anspruch nach Grund und Höhe schriftlich anmelden, Sicherheit zu leisten, soweit sie nicht Befriedigung verlangen können. Dieses Recht steht den Gläubigern jedoch nur zu, wenn sie glaubhaft machen, dass durch die Verschmelzung die Erfüllung der Forderung gefährdet wird."
    },
    {
      "date": "2025-11-10",
      "id": "136798",
      "original_text": "Registerbekanntmachung nach dem Umwandlungsgesetz\nNiedersachsen Amtsgericht Walsrode HRA 205700\nAlpha Crew Security e.K. – Scheeßel",
      "type": "Registerbekanntmachung nach dem Umwandlungsgesetz",
      "state": "Niedersachsen",
      "amtsgericht": "Amtsgericht Walsrode",
      "registernummer": "HRA 205700",
      "registerart": "HRA",
      "company_name": "Alpha Crew Security e.K.",
      "company_seat": "Scheeßel",
      "details": "10.11.2025 (Bekanntmachungsdatum)\n\nNiedersachsen Amtsgericht Walsrode HRA 205700\nRegisterbekanntmachung nach dem Umwandlungsgesetz 10.11.2025 (Eintragungsdatum)\n\nAlpha Crew Security e.K.\nEinzelkaufmann / Einzelkauffrau\nScheeßel\n\nDen Gläubigern der an der Ausgliederung beteiligten Rechtsträger ist, wenn sie binnen sechs Monaten nach dem Tag, an dem die Eintragung der Ausgliederung in das Register des Sitzes desjenigen Rechtsträgers, dessen Gläubiger sie sind, nach § 19 Abs. 3 UmwG als bekannt gemacht gilt, ihren Anspruch nach Grund und Höhe schriftlich anmelden, Sicherheit zu leisten, soweit sie nicht Befriedigung verlangen können. Dieses Recht steht den Gläubigern jedoch nur zu, wenn sie glaubhaft machen, dass durch die Ausgliederung die Erfüllung der Forderung gefährdet wird."
    },
    {
      "date": "2025-11-10",
      "id": "136799",
      "original_text": "Einreichung neuer Dokumente\nNiedersachsen Amtsgericht Göttingen HRB 201578\nServicegesellschaft der Kfz-Innung-Northeim-Einbeck-Duderstadt mbH – Northeim",
      "type": "Einreichung neuer Dokumente",
      "state": "Niedersachsen",
      "amtsgericht": "Amtsgericht Göttingen",
      "registernummer": "HRB 201578",
      "registerart": "HRB",
      "company_name": "Servicegesellschaft der Kfz-Innung-Northeim-Einbeck-Duderstadt mbH",
      "company_seat": "Northeim",
      "details": "10.11.2025 (Bekanntmachungsdatum)\n\nNiedersachsen Amtsgericht Göttingen HRB 201578\nEinreichung neuer Dokumente 10.11.2025 (Eintragungsdatum)\n\nServicegesellschaft der Kfz-Innung-Northeim-Einbeck-Duderstadt mbH\nGesellschaft mit beschränkter Haftung\nNortheim\n\nEine Liste des Aufsichtsrats ist zum Handelsregister eingereicht."
    },
    {
      "date": "2025-11-10",
      "id": "136800",
      "original_text": "Löschungsankündigung\nNiedersachsen Amtsgericht Tostedt HRB 203162\nFerienpark Freizeit Domizil GmbH – Dorum",
      "type": "Löschungsankündigung",
      "state": "Niedersachsen",
      "amtsgericht": "Amtsgericht Tostedt",
      "registernummer": "HRB 203162",
      "registerart": "HRB",
      "company_name": "Ferienpark Freizeit Domizil GmbH",
      "company_seat": "Dorum",
      "details": "10.11.2025 (Bekanntmachungsdatum)\n\nNiedersachsen Amtsgericht Tostedt HRB 203162\nLöschungsankündigung\n\nFerienpark Freizeit Domizil GmbH\nGesellschaft mit beschränkter Haftung\nDorum\n\nDas Registergericht beabsichtigt, die Gesellschaft von Amts wegen nach § 394 FamFG zu löschen. Die Frist zur Erhebung eines Widerspruchs ist auf 1 Monat ab dieser Registerbekanntmachung festgesetzt."
    },
    {
      "date": "2025-11-10",
      "id": "136801",
      "original_text": "Registerbekanntmachung nach dem Umwandlungsgesetz\nNiedersachsen Amtsgericht Hildesheim HRB 2322\nKelvion PHE GmbH – Sarstedt",
      "type": "Registerbekanntmachung nach dem Umwandlungsgesetz",
      "state": "Niedersachsen",
      "amtsgericht": "Amtsgericht Hildesheim",
      "registernummer": "HRB 2322",
      "registerart": "HRB",
      "company_name": "Kelvion PHE GmbH",
      "company_seat": "Sarstedt",
      "details": "10.11.2025 (Bekanntmachungsdatum)\n\nNiedersachsen Amtsgericht Hildesheim HRB 2322\nRegisterbekanntmachung nach dem Umwandlungsgesetz 10.11.2025 (Eintragungsdatum)\n\nKelvion PHE GmbH\nGesellschaft mit beschränkter Haftung\nSarstedt\n\nDen Gläubigern der an der Abspaltung beteiligten Rechtsträger ist, wenn sie binnen sechs Monaten nach dem Tag, an dem die Eintragung der Abspaltung in das Register des Sitzes desjenigen Rechtsträgers, dessen Gläubiger sie sind, nach § 19 Abs. 3 UmwG als bekannt gemacht gilt, ihren Anspruch nach Grund und Höhe schriftlich anmelden, Sicherheit zu leisten, soweit sie nicht Befriedigung verlangen können. Dieses Recht steht den Gläubigern jedoch nur zu, wenn sie glaubhaft machen, dass durch die Abspaltung die Erfüllung der Forderung gefährdet wird."
    },
    {
      "date": "2025-11-10",
      "id": "136802",
      "original_text": "Registerbekanntmachung nach dem Umwandlungsgesetz\nNiedersachsen Amtsgericht Oldenburg (Oldenburg) HRB 217608\n5am Nutrition GmbH – Oldenburg",
      "type": "Registerbekanntmachung nach dem Umwandlungsgesetz",
      "state": "Niedersachsen",
      "amtsgericht": "Amtsgericht Oldenburg (Oldenburg)",
      "registernummer": "HRB 217608",
      "registerart": "HRB",
      "company_name": "5am Nutrition GmbH",
      "company_seat": "Oldenburg",
      "details": "10.11.2025 (Bekanntmachungsdatum)\n\nNiedersachsen Amtsgericht Oldenburg (Oldenburg) HRB 217608\nRegisterbekanntmachung nach dem Umwandlungsgesetz 10.11.2025 (Eintragungsdatum)\n\n5am Nutrition GmbH\nGesellschaft mit beschränkter Haftung\nOldenburg\n\nDen Gläubigern der an der Verschmelzung beteiligten Rechtsträger ist, wenn sie binnen sechs Monaten nach dem Tag, an dem die Eintragung der Verschmelzung in das Register des Sitzes desjenigen Rechtsträgers, dessen Gläubiger sie sind, nach § 19  Abs.  3 UmwG als bekannt gemacht gilt, ihren Anspruch nach Grund und Höhe schriftlich anmelden, Sicherheit zu leisten, soweit sie nicht Befriedigung verlangen können. Dieses Recht steht den Gläubigern jedoch nur zu, wenn sie glaubhaft machen, dass durch die Verschmelzung die Erfüllung der Forderung gefährdet wird."
    },
    {
      "date": "2025-11-10",
      "id": "136803",
      "original_text": "Löschungsankündigung\nNiedersachsen Amtsgericht Lüneburg HRB 203311\nProTable GmbH – Wriedel OT Wettenbostel",
      "type": "Löschungsankündigung",
      "state": "Niedersachsen",
      "amtsgericht": "Amtsgericht Lüneburg",
      "registernummer": "HRB 203311",
      "registerart": "HRB",
      "company_name": "ProTable GmbH",
      "company_seat": "Wriedel OT Wettenbostel",
      "details": "10.11.2025 (Bekanntmachungsdatum)\n\nNiedersachsen Amtsgericht Lüneburg HRB 203311\nLöschungsankündigung\n\nProTable GmbH\nGesellschaft mit beschränkter Haftung\nWriedel OT Wettenbostel\n\nDas Registergericht beabsichtigt, die Gesellschaft von Amts wegen nach § 394 FamFG zu löschen. Die Frist zur Erhebung eines Widerspruchs ist auf 1 Monat ab dieser Registerbekanntmachung festgesetzt."
    },
    {
      "date": "2025-11-10",
      "id": "136804",
      "original_text": "Löschungsankündigung\nNiedersachsen Amtsgericht Osnabrück HRB 215035\nBRT - Handelsunternehmen UG (haftungsbeschränkt) – Emlichheim",
      "type": "Löschungsankündigung",
      "state": "Niedersachsen",
      "amtsgericht": "Amtsgericht Osnabrück",
      "registernummer": "HRB 215035",
      "registerart": "HRB",
      "company_name": "BRT - Handelsunternehmen UG (haftungsbeschränkt)",
      "company_seat": "Emlichheim",
      "details": "10.11.2025 (Bekanntmachungsdatum)\n\nNiedersachsen Amtsgericht Osnabrück HRB 215035\nLöschungsankündigung\n\nBRT - Handelsunternehmen UG (haftungsbeschränkt)\nGesellschaft mit beschränkter Haftung\nEmlichheim\n\nDas Registergericht beabsichtigt, die Gesellschaft von Amts wegen nach § 394 FamFG wegen Vermögenslosigkeit zu löschen. Die Frist zur Erhebung eines Widerspruchs ist auf 1 Monat ab dieser Registerbekanntmachung festgesetzt."
    },
    {
      "date": "2025-11-10",
      "id": "136805",
      "original_text": "Löschungsankündigung\nNiedersachsen Amtsgericht Osnabrück HRB 221902\nOleg Service GmbH – Lähden",
      "type": "Löschungsankündigung",
      "state": "Niedersachsen",
      "amtsgericht": "Amtsgericht Osnabrück",
      "registernummer": "HRB 221902",
      "registerart": "HRB",
      "company_name": "Oleg Service GmbH",
      "company_seat": "Lähden",
      "details": "10.11.2025 (Bekanntmachungsdatum)\n\nNiedersachsen Amtsgericht Osnabrück HRB 221902\nLöschungsankündigung\n\nOleg Service GmbH\nGesellschaft mit beschränkter Haftung\nLähden\n\nDas Registergericht beabsichtigt, die Gesellschaft von Amts wegen nach § 394 FamFG wegen Vermögenslosigkeit zu löschen. Die Frist zur Erhebung eines Widerspruchs ist auf 1 Monat ab dieser Registerbekanntmachung festgesetzt."
    },
    {
      "date": "2025-11-10",
      "id": "136806",
      "original_text": "Registerbekanntmachung nach dem Umwandlungsgesetz\nNiedersachsen Amtsgericht Hildesheim HRB 208560\nPabsch Ingenieure GmbH – Hildesheim",
      "type": "Registerbekanntmachung nach dem Umwandlungsgesetz",
      "state": "Niedersachsen",
      "amtsgericht": "Amtsgericht Hildesheim",
      "registernummer": "HRB 208560",
      "registerart": "HRB",
      "company_name": "Pabsch Ingenieure GmbH",
      "company_seat": "Hildesheim",
      "details": "10.11.2025 (Bekanntmachungsdatum)\n\nNiedersachsen Amtsgericht Hildesheim HRB 208560\nRegisterbekanntmachung nach dem Umwandlungsgesetz 10.11.2025 (Eintragungsdatum)\n\nPabsch Ingenieure GmbH\nGesellschaft mit beschränkter Haftung\nHildesheim\n\nDen Gläubigern der an der Verschmelzung beteiligten Rechtsträger ist, wenn sie binnen sechs Monaten nach dem Tag, an dem die Eintragung der Verschmelzung in das Register des Sitzes desjenigen Rechtsträgers, dessen Gläubiger sie sind, nach § 19  Abs.  3 UmwG als bekannt gemacht gilt, ihren Anspruch nach Grund und Höhe schriftlich anmelden, Sicherheit zu leisten, soweit sie nicht Befriedigung verlangen können. Dieses Recht steht den Gläubigern jedoch nur zu, wenn sie glaubhaft machen, dass durch die Verschmelzung die Erfüllung der Forderung gefährdet wird."
    },
    {
      "date": "2025-11-10",
      "id": "136807",
      "original_text": "Löschungsankündigung\nNiedersachsen Amtsgericht Osnabrück HRB 208440\nMIO Vertriebs GmbH – Bad Bentheim",
      "type": "Löschungsankündigung",
      "state": "Niedersachsen",
      "amtsgericht": "Amtsgericht Osnabrück",
      "registernummer": "HRB 208440",
      "registerart": "HRB",
      "company_name": "MIO Vertriebs GmbH",
      "company_seat": "Bad Bentheim",
      "details": "10.11.2025 (Bekanntmachungsdatum)\n\nNiedersachsen Amtsgericht Osnabrück HRB 208440\nLöschungsankündigung\n\nMIO Vertriebs GmbH\nGesellschaft mit beschränkter Haftung\nBad Bentheim\n\nDas Registergericht beabsichtigt, die Gesellschaft von Amts wegen nach § 394 FamFG wegen Vermögenslosigkeit zu löschen. Die Frist zur Erhebung eines Widerspruchs ist auf 1 Monat ab dieser Registerbekanntmachung festgesetzt."
    },
    {
      "date": "2025-11-10",
      "id": "136808",
      "original_text": "Registerbekanntmachung nach dem Umwandlungsgesetz\nNiedersachsen Amtsgericht Oldenburg (Oldenburg) HRB 121088 früher Amtsgericht Westerstede\nKLARAU GmbH – Westerstede-Linswege",
      "type": "Registerbekanntmachung nach dem Umwandlungsgesetz",
      "state": "Niedersachsen",
      "amtsgericht": "Amtsgericht Oldenburg (Oldenburg)",
      "registernummer": "HRB 121088",
      "registerart": "HRB",
      "company_name": "KLARAU GmbH",
      "company_seat": "Westerstede-Linswege",
      "former_amtsgericht": "Westerstede",
      "details": "10.11.2025 (Bekanntmachungsdatum)\n\nNiedersachsen Amtsgericht Oldenburg (Oldenburg) HRB 121088 früher Amtsgericht Westerstede\nRegisterbekanntmachung nach dem Umwandlungsgesetz 10.11.2025 (Eintragungsdatum)\n\nKLARAU GmbH\nGesellschaft mit beschränkter Haftung\nWesterstede-Linswege\n\nDen Gläubigern der an der Verschmelzung beteiligten Rechtsträger ist, wenn sie binnen sechs Monaten nach dem Tag, an dem die Eintragung der Verschmelzung in das Register des Sitzes desjenigen Rechtsträgers, dessen Gläubiger sie sind, nach § 19  Abs.  3 UmwG als bekannt gemacht gilt, ihren Anspruch nach Grund und Höhe schriftlich anmelden, Sicherheit zu leisten, soweit sie nicht Befriedigung verlangen können. Dieses Recht steht den Gläubigern jedoch nur zu, wenn sie glaubhaft machen, dass durch die Verschmelzung die Erfüllung der Forderung gefährdet wird."
    },
    {
      "date": "2025-11-10",
      "id": "136809",
      "original_text": "Registerbekanntmachung nach dem Umwandlungsgesetz\nNiedersachsen Amtsgericht Osnabrück HRB 163\nAkademie Überlingen N. Glasmeyer GmbH – Osnabrück",
      "type": "Registerbekanntmachung nach dem Umwandlungsgesetz",
      "state": "Niedersachsen",
      "amtsgericht": "Amtsgericht Osnabrück",
      "registernummer": "HRB 163",
      "registerart": "HRB",
      "company_name": "Akademie Überlingen N. Glasmeyer GmbH",
      "company_seat": "Osnabrück",
      "details": "10.11.2025 (Bekanntmachungsdatum)\n\nNiedersachsen Amtsgericht Osnabrück HRB 163\nRegisterbekanntmachung nach dem Umwandlungsgesetz 10.11.2025 (Eintragungsdatum)\n\nAkademie Überlingen N. Glasmeyer GmbH\nGesellschaft mit beschränkter Haftung\nOsnabrück\n\nDen Gläubigern der an der Verschmelzung beteiligten Rechtsträger ist, wenn sie binnen sechs Monaten nach dem Tag, an dem die Eintragung der Verschmelzung in das Register des Sitzes desjenigen Rechtsträgers, dessen Gläubiger sie sind, nach § 19  Abs.  3 UmwG als bekannt gemacht gilt, ihren Anspruch nach Grund und Höhe schriftlich anmelden, Sicherheit zu leisten, soweit sie nicht Befriedigung verlangen können. Dieses Recht steht den Gläubigern jedoch nur zu, wenn sie glaubhaft machen, dass durch die Verschmelzung die Erfüllung der Forderung gefährdet wird."
    },
    {
      "date": "2025-11-10",
      "id": "136810",
      "original_text": "Sonstige Registerbekanntmachung\nNiedersachsen Amtsgericht Stadthagen HRB 109\nKreiswohnungsbaugesellschaft mit beschränkter Haftung Schaumburg – Stadthagen",
      "type": "Sonstige Registerbekanntmachung",
      "state": "Niedersachsen",
      "amtsgericht": "Amtsgericht Stadthagen",
      "registernummer": "HRB 109",
      "registerart": "HRB",
      "company_name": "Kreiswohnungsbaugesellschaft mit beschränkter Haftung Schaumburg",
      "company_seat": "Stadthagen",
      "details": "10.11.2025 (Bekanntmachungsdatum)\n\nNiedersachsen Amtsgericht Stadthagen HRB 109\nSonstige Registerbekanntmachung 04.11.2025 (Eintragungsdatum)\n\nKreiswohnungsbaugesellschaft mit beschränkter Haftung Schaumburg\nGesellschaft mit beschränkter Haftung\nStadthagen\n\nDie Liste der Mitglieder des Aufsichtsrats wurde beim Registergericht eingereicht."
    },
    {
      "date": "2025-11-10",
      "id": "136811",
      "original_text": "Einreichung neuer Dokumente\nNiedersachsen Amtsgericht Braunschweig HRB 100486 früher Amtsgericht Wolfsburg\nVfL Wolfsburg-Fußball GmbH – Wolfsburg",
      "type": "Einreichung neuer Dokumente",
      "state": "Niedersachsen",
      "amtsgericht": "Amtsgericht Braunschweig",
      "registernummer": "HRB 100486",
      "registerart": "HRB",
      "company_name": "VfL Wolfsburg-Fußball GmbH",
      "company_seat": "Wolfsburg",
      "former_amtsgericht": "Wolfsburg",
      "details": "10.11.2025 (Bekanntmachungsdatum)\n\nNiedersachsen Amtsgericht Braunschweig HRB 100486 früher Amtsgericht Wolfsburg\nEinreichung neuer Dokumente\n\nVfL Wolfsburg-Fußball GmbH\nGesellschaft mit beschränkter Haftung\nWolfsburg\n\nDie Liste der Mitglieder des Aufsichtsrats wurde beim Registergericht eingereicht."
    },
    {
      "date": "2025-11-10",
      "id": "136812",
      "original_text": "Registerbekanntmachung nach dem Umwandlungsgesetz\nNiedersachsen Amtsgericht Oldenburg (Oldenburg) HRB 213520\nBAUMDICK Holding GmbH – Friesoythe",
      "type": "Registerbekanntmachung nach dem Umwandlungsgesetz",
      "state": "Niedersachsen",
      "amtsgericht": "Amtsgericht Oldenburg (Oldenburg)",
      "registernummer": "HRB 213520",
      "registerart": "HRB",
      "company_name": "BAUMDICK Holding GmbH",
      "company_seat": "Friesoythe",
      "details": "10.11.2025 (Bekanntmachungsdatum)\n\nNiedersachsen Amtsgericht Oldenburg (Oldenburg) HRB 213520\nRegisterbekanntmachung nach dem Umwandlungsgesetz 10.11.2025 (Eintragungsdatum)\n\nBAUMDICK Holding GmbH\nGesellschaft mit beschränkter Haftung\nFriesoythe\n\nDen Gläubigern der an der Verschmelzung beteiligten Rechtsträger ist, wenn sie binnen sechs Monaten nach dem Tag, an dem die Eintragung der Verschmelzung in das Register des Sitzes desjenigen Rechtsträgers, dessen Gläubiger sie sind, nach § 19  Abs.  3 UmwG als bekannt gemacht gilt, ihren Anspruch nach Grund und Höhe schriftlich anmelden, Sicherheit zu leisten, soweit sie nicht Befriedigung verlangen können. Dieses Recht steht den Gläubigern jedoch nur zu, wenn sie glaubhaft machen, dass durch die Verschmelzung die Erfüllung der Forderung gefährdet wird."
    },
    {
      "date": "2025-11-10",
      "id": "136813",
      "original_text": "Registerbekanntmachung nach dem Umwandlungsgesetz\nNiedersachsen Amtsgericht Hildesheim HRB 110204 früher Amtsgericht Alfeld\nIngenieurbüro Keuntje GmbH – Freden (Leine)",
      "type": "Registerbekanntmachung nach dem Umwandlungsgesetz",
      "state": "Niedersachsen",
      "amtsgericht": "Amtsgericht Hildesheim",
      "registernummer": "HRB 110204",
      "registerart": "HRB",
      "company_name": "Ingenieurbüro Keuntje GmbH",
      "company_seat": "Freden (Leine)",
      "former_amtsgericht": "Alfeld",
      "details": "10.11.2025 (Bekanntmachungsdatum)\n\nNiedersachsen Amtsgericht Hildesheim HRB 110204 früher Amtsgericht Alfeld\nRegisterbekanntmachung nach dem Umwandlungsgesetz 10.11.2025 (Eintragungsdatum)\n\nIngenieurbüro Keuntje GmbH\nGesellschaft mit beschränkter Haftung\nFreden (Leine)\n\nDen Gläubigern der an der Verschmelzung beteiligten Rechtsträger ist, wenn sie binnen sechs Monaten nach dem Tag, an dem die Eintragung der Verschmelzung in das Register des Sitzes desjenigen Rechtsträgers, dessen Gläubiger sie sind, nach § 19  Abs.  3 UmwG als bekannt gemacht gilt, ihren Anspruch nach Grund und Höhe schriftlich anmelden, Sicherheit zu leisten, soweit sie nicht Befriedigung verlangen können. Dieses Recht steht den Gläubigern jedoch nur zu, wenn sie glaubhaft machen, dass durch die Verschmelzung die Erfüllung der Forderung gefährdet wird."
    },
    {
      "date": "2025-11-10",
      "id": "136814",
      "original_text": "Einreichung neuer Dokumente\nNiedersachsen Amtsgericht Hannover HRB 223931\nInfrastrukturgesellschaft Stadt Garbsen GmbH – Garbsen",
      "type": "Einreichung neuer Dokumente",
      "state": "Niedersachsen",
      "amtsgericht": "Amtsgericht Hannover",
      "registernummer": "HRB 223931",
      "registerart": "HRB",
      "company_name": "Infrastrukturgesellschaft Stadt Garbsen GmbH",
      "company_seat": "Garbsen",
      "details": "10.11.2025 (Bekanntmachungsdatum)\n\nNiedersachsen Amtsgericht Hannover HRB 223931\nEinreichung neuer Dokumente 10.11.2025 (Eintragungsdatum)\n\nInfrastrukturgesellschaft Stadt Garbsen GmbH\nGesellschaft mit beschränkter Haftung\nGarbsen\n\nDie Liste der Mitglieder des Aufsichtsrats wurde beim Registergericht eingereicht."
    },
    {
      "date": "2025-11-10",
      "id": "136815",
      "original_text": "Registerbekanntmachung nach dem Umwandlungsgesetz\nNiedersachsen Amtsgericht Osnabrück HRA 209720\nSteinmetz Bastian Korves e.K. – Lingen (Ems)",
      "type": "Registerbekanntmachung nach dem Umwandlungsgesetz",
      "state": "Niedersachsen",
      "amtsgericht": "Amtsgericht Osnabrück",
      "registernummer": "HRA 209720",
      "registerart": "HRA",
      "company_name": "Steinmetz Bastian Korves e.K.",
      "company_seat": "Lingen (Ems)",
      "details": "10.11.2025 (Bekanntmachungsdatum)\n\nNiedersachsen Amtsgericht Osnabrück HRA 209720\nRegisterbekanntmachung nach dem Umwandlungsgesetz 10.11.2025 (Eintragungsdatum)\n\nSteinmetz Bastian Korves e.K.\nEinzelkaufmann / Einzelkauffrau\nLingen (Ems)\n\nDen Gläubigern der an der Ausgliederung beteiligten Rechtsträger ist, wenn sie binnen sechs Monaten nach dem Tag, an dem die Eintragung der Ausgliederung in das Register des Sitzes desjenigen Rechtsträgers, dessen Gläubiger sie sind, nach § 19 Abs. 3 UmwG als bekannt gemacht gilt, ihren Anspruch nach Grund und Höhe schriftlich anmelden, Sicherheit zu leisten, soweit sie nicht Befriedigung verlangen können. Dieses Recht steht den Gläubigern jedoch nur zu, wenn sie glaubhaft machen, dass durch die Ausgliederung die Erfüllung der Forderung gefährdet wird."
    },
    {
      "date": "2025-11-10",
      "id": "136816",
      "original_text": "Löschungsankündigung\nNiedersachsen Amtsgericht Braunschweig HRB 4648\nGFW GmbH – Braunschweig",
      "type": "Löschungsankündigung",
      "state": "Niedersachsen",
      "amtsgericht": "Amtsgericht Braunschweig",
      "registernummer": "HRB 4648",
      "registerart": "HRB",
      "company_name": "GFW GmbH",
      "company_seat": "Braunschweig",
      "details": "10.11.2025 (Bekanntmachungsdatum)\n\nNiedersachsen Amtsgericht Braunschweig HRB 4648\nLöschungsankündigung\n\nGFW GmbH\nGesellschaft mit beschränkter Haftung\nBraunschweig\n\nDas Registergericht beabsichtigt, die Gesellschaft von Amts wegen nach § 394 FamFG zu löschen. Die Frist zur Erhebung eines Widerspruchs ist auf 1 Monat ab dieser Registerbekanntmachung festgesetzt."
    },
    {
      "date": "2025-11-10",
      "id": "136817",
      "original_text": "Registerbekanntmachung nach dem Umwandlungsgesetz\nNiedersachsen Amtsgericht Walsrode HRB 213124\nAlpha Crew Security GmbH – Scheeßel",
      "type": "Registerbekanntmachung nach dem Umwandlungsgesetz",
      "state": "Niedersachsen",
      "amtsgericht": "Amtsgericht Walsrode",
      "registernummer": "HRB 213124",
      "registerart": "HRB",
      "company_name": "Alpha Crew Security GmbH",
      "company_seat": "Scheeßel",
      "details": "10.11.2025 (Bekanntmachungsdatum)\n\nNiedersachsen Amtsgericht Walsrode HRB 213124\nRegisterbekanntmachung nach dem Umwandlungsgesetz 10.11.2025 (Eintragungsdatum)\n\nAlpha Crew Security GmbH\nGesellschaft mit beschränkter Haftung\nScheeßel\n\nDen Gläubigern der an der Ausgliederung beteiligten Rechtsträger ist, wenn sie binnen sechs Monaten nach dem Tag, an dem die Eintragung der Ausgliederung in das Register des Sitzes desjenigen Rechtsträgers, dessen Gläubiger sie sind, nach § 19 Abs. 3 UmwG als bekannt gemacht gilt, ihren Anspruch nach Grund und Höhe schriftlich anmelden, Sicherheit zu leisten, soweit sie nicht Befriedigung verlangen können. Dieses Recht steht den Gläubigern jedoch nur zu, wenn sie glaubhaft machen, dass durch die Ausgliederung die Erfüllung der Forderung gefährdet wird."
    },
    {
      "date": "2025-11-10",
      "id": "136818",
      "original_text": "Registerbekanntmachung nach dem Umwandlungsgesetz\nNiedersachsen Amtsgericht Walsrode HRB 30086\nChr. Hansen GmbH – Nienburg/Weser",
      "type": "Registerbekanntmachung nach dem Umwandlungsgesetz",
      "state": "Niedersachsen",
      "amtsgericht": "Amtsgericht Walsrode",
      "registernummer": "HRB 30086",
      "registerart": "HRB",
      "company_name": "Chr. Hansen GmbH",
      "company_seat": "Nienburg/Weser",
      "details": "10.11.2025 (Bekanntmachungsdatum)\n\nNiedersachsen Amtsgericht Walsrode HRB 30086\nRegisterbekanntmachung nach dem Umwandlungsgesetz 10.11.2025 (Eintragungsdatum)\n\nChr. Hansen GmbH\nGesellschaft mit beschränkter Haftung\nNienburg/Weser\n\nDen Gläubigern der an der Verschmelzung beteiligten Rechtsträger ist, wenn sie binnen sechs Monaten nach dem Tag, an dem die Eintragung der Verschmelzung in das Register des Sitzes desjenigen Rechtsträgers, dessen Gläubiger sie sind, nach § 19  Abs.  3 UmwG als bekannt gemacht gilt, ihren Anspruch nach Grund und Höhe schriftlich anmelden, Sicherheit zu leisten, soweit sie nicht Befriedigung verlangen können. Dieses Recht steht den Gläubigern jedoch nur zu, wenn sie glaubhaft machen, dass durch die Verschmelzung die Erfüllung der Forderung gefährdet wird."
    },
    {
      "date": "2025-11-10",
      "id": "136819",
      "original_text": "Registerbekanntmachung nach dem Umwandlungsgesetz\nHamburg Amtsgericht Hamburg HRA 131471\nLF1 Treuhandtransfer UG (haftungsbeschränkt) & Co. KG – Hamburg",
      "type": "Registerbekanntmachung nach dem Umwandlungsgesetz",
      "state": "Hamburg",
      "amtsgericht": "Amtsgericht Hamburg",
      "registernummer": "HRA 131471",
      "registerart": "HRA",
      "company_name": "LF1 Treuhandtransfer UG (haftungsbeschränkt) & Co. KG",
      "company_seat": "Hamburg",
      "details": "10.11.2025 (Bekanntmachungsdatum)\n\nHamburg Amtsgericht Hamburg HRA 131471\nRegisterbekanntmachung nach dem Umwandlungsgesetz 10.11.2025 (Eintragungsdatum)\n\nLF1 Treuhandtransfer UG (haftungsbeschränkt) & Co. KG\nKommanditgesellschaft\nHamburg\n\nAls nicht eingetragen wird bekannt gemacht:\nDen Gläubigern der an der Ausgliederung beteiligten Gesellschaften ist, wenn sie binnen sechs Monaten nach dem Tag, an dem die Eintragung der Ausgliederung in das Register des Sitzes desjenigen Rechtsträgers, dessen Gläubiger sie sind, nach § 19 Absatz 3 UmwG als bekannt gemacht gilt, ihren Anspruch nach Grund und Höhe schriftlich anmelden, Sicherheit zu leisten, soweit sie nicht Befriedigung verlangen können. Dieses Recht steht den Gläubigern jedoch nur zu, wenn sie glaubhaft machen, dass durch die Ausgliederung die Erfüllung ihrer Forderung gefährdet wird."
    },
    {
      "date": "2025-11-10",
      "id": "136820",
      "original_text": "Registerbekanntmachung nach dem Umwandlungsgesetz\nRheinland-Pfalz Amtsgericht Ludwigshafen a.Rhein (Ludwigshafen) HRB 68106\nPhysioMed Speyer GmbH – Speyer",
      "type": "Registerbekanntmachung nach dem Umwandlungsgesetz",
      "state": "Rheinland-Pfalz",
      "amtsgericht": "Amtsgericht Ludwigshafen a.Rhein (Ludwigshafen)",
      "registernummer": "HRB 68106",
      "registerart": "HRB",
      "company_name": "PhysioMed Speyer GmbH",
      "company_seat": "Speyer",
      "details": "10.11.2025 (Bekanntmachungsdatum)\n\nRheinland-Pfalz Amtsgericht Ludwigshafen a.Rhein (Ludwigshafen) HRB 68106\nRegisterbekanntmachung nach dem Umwandlungsgesetz 10.11.2025 (Eintragungsdatum)\n\nPhysioMed Speyer GmbH\nGesellschaft mit beschränkter Haftung\nSpeyer\n\nAls nicht eingetragen wird veröffentlicht: Den Gläubigern der an der Verschmelzung beteiligten Rechtsträger ist, wenn sie binnen sechs Monaten nach dem Tag, an dem die Eintragung der Verschmelzung in das Register des Sitzes desjenigen Rechtsträgers, dessen Gläubiger sie sind, nach § 19 Abs. 3 UmwG als bekannt gemacht gilt, ihren Anspruch nach Grund und Höhe schriftlich anmelden, Sicherheit zu leisten, soweit sie nicht Befriedigung verlangen können. Dieses Recht steht den Gläubigern jedoch nur zu, wenn sie glaubhaft machen, dass durch die Verschmelzung die Erfüllung der Forderung gefährdet wird."
    },
    {
      "date": "2025-11-10",
      "id": "136821",
      "original_text": "Löschungsankündigung\nRheinland-Pfalz Amtsgericht Ludwigshafen a.Rhein (Ludwigshafen) HRB 63111\nFDL Personentransporte Ludwigshafen UG (haftungsbeschränkt) – Ludwigshafen/Rhein",
      "type": "Löschungsankündigung",
      "state": "Rheinland-Pfalz",
      "amtsgericht": "Amtsgericht Ludwigshafen a.Rhein (Ludwigshafen)",
      "registernummer": "HRB 63111",
      "registerart": "HRB",
      "company_name": "FDL Personentransporte Ludwigshafen UG (haftungsbeschränkt)",
      "company_seat": "Ludwigshafen/Rhein",
      "details": "10.11.2025 (Bekanntmachungsdatum)\n\nRheinland-Pfalz Amtsgericht Ludwigshafen a.Rhein (Ludwigshafen) HRB 63111\nLöschungsankündigung\n\nFDL Personentransporte Ludwigshafen UG (haftungsbeschränkt)\nGesellschaft mit beschränkter Haftung\nLudwigshafen/Rhein\n\nDas Registergericht beabsichtigt die Gesellschaft von Amts wegen nach § 394 FamFG zu löschen. Die Frist zur Erhebung eines Widerspruchs ist auf einen Monat festgesetzt."
    },
    {
      "date": "2025-11-10",
      "id": "136822",
      "original_text": "Löschungsankündigung\nRheinland-Pfalz Amtsgericht Ludwigshafen a.Rhein (Ludwigshafen) HRB 66251\nAB Rückbau Verwaltungs GmbH – Ludwigshafen am Rhein",
      "type": "Löschungsankündigung",
      "state": "Rheinland-Pfalz",
      "amtsgericht": "Amtsgericht Ludwigshafen a.Rhein (Ludwigshafen)",
      "registernummer": "HRB 66251",
      "registerart": "HRB",
      "company_name": "AB Rückbau Verwaltungs GmbH",
      "company_seat": "Ludwigshafen am Rhein",
      "details": "10.11.2025 (Bekanntmachungsdatum)\n\nRheinland-Pfalz Amtsgericht Ludwigshafen a.Rhein (Ludwigshafen) HRB 66251\nLöschungsankündigung\n\nAB Rückbau Verwaltungs GmbH\nGesellschaft mit beschränkter Haftung\nLudwigshafen am Rhein\n\nDas Registergericht beabsichtigt die Gesellschaft von Amts wegen nach § 394 FamFG zu löschen. Die Frist zur Erhebung eines Widerspruchs ist auf einen Monat festgesetzt."
    },
    {
      "date": "2025-11-10",
      "id": "136823",
      "original_text": "Sonstige Registerbekanntmachung\nRheinland-Pfalz Amtsgericht Koblenz HRB 13990\nThyssenKrupp Rasselstein GmbH – Andernach",
      "type": "Sonstige Registerbekanntmachung",
      "state": "Rheinland-Pfalz",
      "amtsgericht": "Amtsgericht Koblenz",
      "registernummer": "HRB 13990",
      "registerart": "HRB",
      "company_name": "ThyssenKrupp Rasselstein GmbH",
      "company_seat": "Andernach",
      "details": "10.11.2025 (Bekanntmachungsdatum)\n\nRheinland-Pfalz Amtsgericht Koblenz HRB 13990\nSonstige Registerbekanntmachung\n\nThyssenKrupp Rasselstein GmbH\nGesellschaft mit beschränkter Haftung\nAndernach\n\nDem Registergericht ist eine neue Liste der Mitglieder des Aufsichtsrates eingereicht worden."
    },
    {
      "date": "2025-11-10",
      "id": "136824",
      "original_text": "Registerbekanntmachung nach dem Umwandlungsgesetz\nBremen Amtsgericht Bremen HRB 31124\nT + T Treuhand und Asset Management GmbH – Bremen",
      "type": "Registerbekanntmachung nach dem Umwandlungsgesetz",
      "state": "Bremen",
      "amtsgericht": "Amtsgericht Bremen",
      "registernummer": "HRB 31124",
      "registerart": "HRB",
      "company_name": "T + T Treuhand und Asset Management GmbH",
      "company_seat": "Bremen",
      "details": "10.11.2025 (Bekanntmachungsdatum)\n\nBremen Amtsgericht Bremen HRB 31124\nRegisterbekanntmachung nach dem Umwandlungsgesetz 07.11.2025 (Eintragungsdatum)\n\nT + T Treuhand und Asset Management GmbH\nGesellschaft mit beschränkter Haftung\nBremen\n\nZu Eintragungsnummer 4 vom 07.11.2025 wird als nicht eingetragen veröffentlicht:  Den Gläubigern der an der Verschmelzung beteiligten Rechtsträger ist, wenn sie binnen sechs Monaten nach dem Tag, an dem die Eintragung der Verschmelzung in das Register des Sitzes desjenigen Rechtsträgers, dessen Gläubiger sie sind, als bekannt gemacht gilt, ihren Anspruch nach Grund und Höhe schriftlich anmelden, Sicherheit zu leisten, soweit sie nicht Befriedigung verlangen können. Dieses Recht steht den Gläubigern jedoch nur zu, wenn sie glaubhaft machen, dass durch die Verschmelzung die Erfüllung ihrer Forderung gefährdet wird. Das Recht, Sicherheitsleistung zu verlangen, steht Gläubigern nicht zu, die im Falle der Insolvenz ein Recht auf vorzugsweise Befriedigung aus einer Deckungsmasse haben, die nach gesetzlicher Vorschrift zu ihrem Schutz errichtet und staatlich überwacht ist."
    },
    {
      "date": "2025-11-10",
      "id": "136825",
      "original_text": "Registerbekanntmachung nach dem Umwandlungsgesetz\nRheinland-Pfalz Amtsgericht Koblenz HRA 11473\nPhilipp Specht Gerüstbau Inh. Rosa Specht e.K. – Mülheim-Kärlich",
      "type": "Registerbekanntmachung nach dem Umwandlungsgesetz",
      "state": "Rheinland-Pfalz",
      "amtsgericht": "Amtsgericht Koblenz",
      "registernummer": "HRA 11473",
      "registerart": "HRA",
      "company_name": "Philipp Specht Gerüstbau Inh. Rosa Specht e.K.",
      "company_seat": "Mülheim-Kärlich",
      "details": "10.11.2025 (Bekanntmachungsdatum)\n\nRheinland-Pfalz Amtsgericht Koblenz HRA 11473\nRegisterbekanntmachung nach dem Umwandlungsgesetz 10.11.2025 (Eintragungsdatum)\n\nPhilipp Specht Gerüstbau Inh. Rosa Specht e.K.\nEinzelkaufmann / Einzelkauffrau\nMülheim-Kärlich\n\nAls nicht eingetragen wird veröffentlicht: Den Gläubigern der an der Ausgliederung beteiligten Rechtsträger ist, wenn sie binnen sechs Monaten nac hdem Tag, an dem die Eintragung der Ausgliederung in das Register des Sitzes desjenigen Rechtsträgers,dessen Gläubiger sie sind, nach § 19 Abs. 3 UmwG als bekannt gemacht gilt, ihren Anspruch nach Grund und Höhe schriftlich anmelden, Sicherheit zu leisten, soweit sie nicht Befriedigung verlangen können. Dieses Recht steht den Gläubigern jedoch nur zu, wenn sie glaubhaft machen, dass durch die Ausgliederung die Erfüllung der Forderung gefährdet wird."
    },
    {
      "date": "2025-11-10",
      "id": "136826",
      "original_text": "Registerbekanntmachung nach dem Umwandlungsgesetz\nRheinland-Pfalz Amtsgericht Bad Kreuznach HRB 21596\nCySa-Invest GmbH – Rheinböllen",
      "type": "Registerbekanntmachung nach dem Umwandlungsgesetz",
      "state": "Rheinland-Pfalz",
      "amtsgericht": "Amtsgericht Bad Kreuznach",
      "registernummer": "HRB 21596",
      "registerart": "HRB",
      "company_name": "CySa-Invest GmbH",
      "company_seat": "Rheinböllen",
      "details": "10.11.2025 (Bekanntmachungsdatum)\n\nRheinland-Pfalz Amtsgericht Bad Kreuznach HRB 21596\nRegisterbekanntmachung nach dem Umwandlungsgesetz 10.11.2025 (Eintragungsdatum)\n\nCySa-Invest GmbH\nGesellschaft mit beschränkter Haftung\nRheinböllen\n\nAls nicht eingetragen wird veröffentlicht: Den Gläubigern der an der Ausgliederung beteiligten Rechtsträger ist, wenn sie binnen sechs Monaten nach dem Tag, an dem die Eintragung der Ausgliederung in das Register des Sitzes desjenigen Rechtsträgers, dessen Gläubiger sie sind, nach § 19 Abs. 3 UmwG als bekannt gemacht gilt, ihren Anspruch nach Grund und Höhe schriftlich anmelden, Sicherheit zu leisten, soweit sie nicht Befriedigung verlangen können. Dieses Recht steht den Gläubigern jedoch nur zu, wenn sie glaubhaft machen, dass durch die Ausgliederung die Erfüllung der Forderung gefährdet wird."
    },
    {
      "date": "2025-11-10",
      "id": "136827",
      "original_text": "Registerbekanntmachung nach dem Umwandlungsgesetz\nRheinland-Pfalz Amtsgericht Mainz HRB 53194\nHealAdvisor GmbH – Mainz",
      "type": "Registerbekanntmachung nach dem Umwandlungsgesetz",
      "state": "Rheinland-Pfalz",
      "amtsgericht": "Amtsgericht Mainz",
      "registernummer": "HRB 53194",
      "registerart": "HRB",
      "company_name": "HealAdvisor GmbH",
      "company_seat": "Mainz",
      "details": "10.11.2025 (Bekanntmachungsdatum)\n\nRheinland-Pfalz Amtsgericht Mainz HRB 53194\nRegisterbekanntmachung nach dem Umwandlungsgesetz 10.11.2025 (Eintragungsdatum)\n\nHealAdvisor GmbH\nGesellschaft mit beschränkter Haftung\nMainz\n\nAls nicht eingetragen wird veröffentlicht:\nDen Gläubigern der an der Verschmelzung beteiligten Rechtsträger ist, wenn sie binnen sechs Monaten nach dem Tag, an dem die Eintragung der Verschmelzung in das Register des Sitzes desjenigen Rechtsträgers, dessen Gläubiger sie sind, nach § 19 Abs. 3 UmwG als bekannt gemacht gilt, ihren Anspruch nach Grund und Höhe schriftlich anmelden, Sicherheit zu leisten, soweit sie nicht Befriedigung verlangen können. Dieses Recht steht den Gläubigern jedoch nur zu, wenn sie glaubhaft machen, dass durch die Verschmelzung die Erfüllung der Forderung gefährdet wird."
    },
    {
      "date": "2025-11-10",
      "id": "136828",
      "original_text": "Löschungsankündigung\nRheinland-Pfalz Amtsgericht Ludwigshafen a.Rhein (Ludwigshafen) HRA 61481\nAWAutomobile GmbH & Co. KG – Neustadt an der Weinstraße",
      "type": "Löschungsankündigung",
      "state": "Rheinland-Pfalz",
      "amtsgericht": "Amtsgericht Ludwigshafen a.Rhein (Ludwigshafen)",
      "registernummer": "HRA 61481",
      "registerart": "HRA",
      "company_name": "AWAutomobile GmbH & Co. KG",
      "company_seat": "Neustadt an der Weinstraße",
      "details": "10.11.2025 (Bekanntmachungsdatum)\n\nRheinland-Pfalz Amtsgericht Ludwigshafen a.Rhein (Ludwigshafen) HRA 61481\nLöschungsankündigung\n\nAWAutomobile GmbH & Co. KG\nKommanditgesellschaft\nNeustadt an der Weinstraße\n\nDas Registergericht beabsichtigt die Firma von Amts wegen nach § 31 Abs. 2 HGB, § 393 FamFG zu löschen. Die Frist zur Erhebung eines Widerspruchs ist auf  einen Monat festgesetzt."
    },
    {
      "date": "2025-11-10",
      "id": "136829",
      "original_text": "Registerbekanntmachung nach dem Umwandlungsgesetz\nRheinland-Pfalz Amtsgericht Koblenz HRB 31468\nGerüstbau Specht GmbH – Mülheim-Kärlich",
      "type": "Registerbekanntmachung nach dem Umwandlungsgesetz",
      "state": "Rheinland-Pfalz",
      "amtsgericht": "Amtsgericht Koblenz",
      "registernummer": "HRB 31468",
      "registerart": "HRB",
      "company_name": "Gerüstbau Specht GmbH",
      "company_seat": "Mülheim-Kärlich",
      "details": "10.11.2025 (Bekanntmachungsdatum)\n\nRheinland-Pfalz Amtsgericht Koblenz HRB 31468\nRegisterbekanntmachung nach dem Umwandlungsgesetz 10.11.2025 (Eintragungsdatum)\n\nGerüstbau Specht GmbH\nGesellschaft mit beschränkter Haftung\nMülheim-Kärlich\n\nAls nicht eingetragen wird veröffentlicht: Den Gläubigern der an der Ausgliederung beteiligten Rechtsträger ist, wenn sie binnen sechs Monaten nac hdem Tag, an dem die Eintragung der Ausgliederung in das Register des Sitzes desjenigen Rechtsträgers,dessen Gläubiger sie sind, nach § 19 Abs. 3 UmwG als bekannt gemacht gilt, ihren Anspruch nach Grund und Höhe schriftlich anmelden, Sicherheit zu leisten, soweit sie nicht Befriedigung verlangen können. Dieses Recht steht den Gläubigern jedoch nur zu, wenn sie glaubhaft machen, dass durch die Ausgliederung die Erfüllung der Forderung gefährdet wird."
    },
    {
      "date": "2025-11-10",
      "id": "136830",
      "original_text": "Löschungsankündigung\nRheinland-Pfalz Amtsgericht Bad Kreuznach HRA 21268\nPerfume Performance Trading OHG – Bad Kreuznach",
      "type": "Löschungsankündigung",
      "state": "Rheinland-Pfalz",
      "amtsgericht": "Amtsgericht Bad Kreuznach",
      "registernummer": "HRA 21268",
      "registerart": "HRA",
      "company_name": "Perfume Performance Trading OHG",
      "company_seat": "Bad Kreuznach",
      "details": "10.11.2025 (Bekanntmachungsdatum)\n\nRheinland-Pfalz Amtsgericht Bad Kreuznach HRA 21268\nLöschungsankündigung\n\nPerfume Performance Trading OHG\nOffene Handelsgesellschaft\nBad Kreuznach\n\nDas Registergericht beabsichtigt die Eintragung der Emusca GmbH als persönlich haftende Gesellschafterin und die Eintragung der Gesellschaft von Amts wegen nach § 395 FamFG zu löschen.\nDie Frist zur Erhebung eines Widerspruchs ist auf einen Monat festgesetzt."
    },
    {
      "date": "2025-11-10",
      "id": "136831",
      "original_text": "Löschungsankündigung\nRheinland-Pfalz Amtsgericht Mainz HRB 53201\nENG GmbH – Worms",
      "type": "Löschungsankündigung",
      "state": "Rheinland-Pfalz",
      "amtsgericht": "Amtsgericht Mainz",
      "registernummer": "HRB 53201",
      "registerart": "HRB",
      "company_name": "ENG GmbH",
      "company_seat": "Worms",
      "details": "10.11.2025 (Bekanntmachungsdatum)\n\nRheinland-Pfalz Amtsgericht Mainz HRB 53201\nLöschungsankündigung\n\nENG GmbH\nGesellschaft mit beschränkter Haftung\nWorms\n\nDas Registergericht beabsichtigt die Gesellschaft von Amts wegen nach § 394 FamFG zu löschen. Die Frist zur Erhebung eines Widerspruchs ist auf einen Monat festgesetzt."
    },
    {
      "date": "2025-11-10",
      "id": "136832",
      "original_text": "Registerbekanntmachung nach dem Umwandlungsgesetz\nRheinland-Pfalz Amtsgericht Koblenz HRB 31385\nBBT Region Koblenz-Saffig gGmbH – Koblenz",
      "type": "Registerbekanntmachung nach dem Umwandlungsgesetz",
      "state": "Rheinland-Pfalz",
      "amtsgericht": "Amtsgericht Koblenz",
      "registernummer": "HRB 31385",
      "registerart": "HRB",
      "company_name": "BBT Region Koblenz-Saffig gGmbH",
      "company_seat": "Koblenz",
      "details": "10.11.2025 (Bekanntmachungsdatum)\n\nRheinland-Pfalz Amtsgericht Koblenz HRB 31385\nRegisterbekanntmachung nach dem Umwandlungsgesetz 10.11.2025 (Eintragungsdatum)\n\nBBT Region Koblenz-Saffig gGmbH\nGesellschaft mit beschränkter Haftung\nKoblenz\n\nAls nicht eingetragen wird veröffentlicht: Den Gläubigern der an der Ausgliederung beteiligten Rechtsträger ist, wenn sie binnen sechs Monaten nach dem Tag, an dem die Eintragung der Ausgliederung in das Register des Sitzes desjenigen Rechtsträgers,dessen Gläubiger sie sind, nach § 19 Abs. 3 UmwG als bekannt gemacht gilt, ihren Anspruch nach Grund und Höhe schriftlich anmelden, Sicherheit zu leisten, soweit sie nicht Befriedigung verlangen können. Dieses Recht steht den Gläubigern jedoch nur zu, wenn sie glaubhaft machen, dass durch die Ausgliederung die Erfüllung der Forderung gefährdet wird."
    },
    {
      "date": "2025-11-10",
      "id": "136833",
      "original_text": "Registerbekanntmachung nach dem Umwandlungsgesetz\nNordrhein-Westfalen Amtsgericht Düsseldorf HRB 110840\nNaldera Materials & Environmental Technologies GmbH – Düsseldorf",
      "type": "Registerbekanntmachung nach dem Umwandlungsgesetz",
      "state": "Nordrhein-Westfalen",
      "amtsgericht": "Amtsgericht Düsseldorf",
      "registernummer": "HRB 110840",
      "registerart": "HRB",
      "company_name": "Naldera Materials & Environmental Technologies GmbH",
      "company_seat": "Düsseldorf",
      "details": "10.11.2025 (Bekanntmachungsdatum)\n\nNordrhein-Westfalen Amtsgericht Düsseldorf HRB 110840\nRegisterbekanntmachung nach dem Umwandlungsgesetz 10.11.2025 (Eintragungsdatum)\n\nNaldera Materials & Environmental Technologies GmbH\nGesellschaft mit beschränkter Haftung\nDüsseldorf\n\nDen Gläubigern der an der Verschmelzung beteiligten Rechtsträger ist, wenn sie binnen sechs Monaten nach dem Tag, an dem die Eintragung der Verschmelzung in das Register des Sitzes desjenigen Rechtsträgers, dessen Gläubiger sie sind, nach § 19 Absatz 3 UmwG als bekanntgemacht gilt, ihren Anspruch nach Grund und Höhe schriftlich anmelden, Sicherheit zu leisten, soweit sie nicht Befriedigung verlangen können. Dieses Recht steht den Gläubigern jedoch nur zu, wenn sie glaubhaft machen, dass durch die Verschmelzung die Erfüllung ihrer Forderung gefährdet wird."
    },
    {
      "date": "2025-11-10",
      "id": "136834",
      "original_text": "Löschungsankündigung\nNordrhein-Westfalen Amtsgericht Iserlohn HRB 8075\nLilias Ambulanter Pflegedienst GmbH – Kierspe",
      "type": "Löschungsankündigung",
      "state": "Nordrhein-Westfalen",
      "amtsgericht": "Amtsgericht Iserlohn",
      "registernummer": "HRB 8075",
      "registerart": "HRB",
      "company_name": "Lilias Ambulanter Pflegedienst GmbH",
      "company_seat": "Kierspe",
      "details": "10.11.2025 (Bekanntmachungsdatum)\n\nNordrhein-Westfalen Amtsgericht Iserlohn HRB 8075\nLöschungsankündigung\n\nLilias Ambulanter Pflegedienst GmbH\nGesellschaft mit beschränkter Haftung\nKierspe\n\nDas Registergericht beabsichtigt die im Handelsregister eingetragene Gesellschaft nach § 394 Absatz 1 FamFG wegen Vermögenslosigkeit von Amts wegen zu löschen. Die Frist zur Erhebung eines Widerspruchs gegen die beabsichtigte Löschung ist auf zwei Monate festgesetzt.\n\nRechtsbehelfsbelehrung:\nGegen diese Verfügung können Sie Widerspruch einlegen.\nDer Widerspruch ist bei dem Amtsgericht Iserlohn, Friedrichstraße 108-110, 58636 Iserlohn in deutscher Sprache oder zur Niederschrift der Geschäftsstelle einzulegen. Der Widerspruch muss spätestens innerhalb der gesetzten Frist bei dem Amtsgericht Iserlohn eingegangen sein. Dies gilt auch dann, wenn der Widerspruch zur Niederschrift der Geschäftsstelle eines anderen Amtsgerichts abgegeben wurde. Die Frist beginnt mit der Veröffentlichung. Fällt das Ende der Frist auf einen Sonntag, einen allgemeinen Feiertag oder Sonnabend, so endet die Frist mit Ablauf des nächsten Werktages.\nDer Widerspruch muss die Bezeichnung der angefochtenen Verfügung sowie die Erklärung enthalten, dass Widerspruch gegen diese Verfügung eingelegt wird. Er ist zu unterzeichnen und soll begründet werden."
    },
    {
      "date": "2025-11-10",
      "id": "136835",
      "original_text": "Löschungsankündigung\nNordrhein-Westfalen Amtsgericht Aachen VR 60197 früher Amtsgericht Geilenkirchen\nKaninchenzuchtverein 1928 e.V – Geilenkirchen-Gillrath",
      "type": "Löschungsankündigung",
      "state": "Nordrhein-Westfalen",
      "amtsgericht": "Amtsgericht Aachen",
      "registernummer": "VR 60197",
      "registerart": "VR",
      "company_name": "Kaninchenzuchtverein 1928 e.V",
      "company_seat": "Geilenkirchen-Gillrath",
      "former_amtsgericht": "Geilenkirchen",
      "details": "10.11.2025 (Bekanntmachungsdatum)\n\nNordrhein-Westfalen Amtsgericht Aachen VR 60197 früher Amtsgericht Geilenkirchen\nLöschungsankündigung\n\nKaninchenzuchtverein 1928 e.V\neingetragener Verein\nGeilenkirchen-Gillrath\n\nDas Registergericht beabsichtigt, von Amts wegen den Verein wegen Wegfall aller Mitglieder wegen Unzulässigkeit nach § 395 FamFG zu löschen.\n\nZur Geltendmachung des Widerspruchs gegen die beabsichtigte Löschung wird hiermit eine Frist von einem Monat ab Veröffentlichung dieser Ankündigung bestimmt.\n\nRechtsbehelfsbelehrung:\n\nGegen diese Verfügung kann Widerspruch eingelegt werden. Zum Widerspruch ist jeder berechtigt, der an der Unterlassung der Löschung ein berechtigtes Interesse hat.\n\nDer Widerspruch ist bei dem Amtsgericht Aachen, Adalbertsteinweg 92, 52070 Aachen schriftlich in deutscher Sprache oder zur Niederschrift der Geschäftsstelle einzulegen. Der Widerspruch kann auch zur Niederschrift der Geschäftsstelle eines jeden Amtsgerichtes abgegeben werden.\n\nDer Widerspruch muss spätestens innerhalb der gesetzten Frist nach der Bekanntgabe der Verfügung bei dem Amtsgericht Aachen eingegangen sein. Dies gilt auch dann, wenn der Widerspruch zur Niederschrift der Geschäftsstelle eines anderen Amtsgerichtes abgegeben wurde. Die Frist beginnt mit der Bekanntgabe der Verfügung durch Veröffentlichung. Fällt das Ende der Frist auf einen Sonntag, einen allgemeinen Feiertag oder Sonnabend, so endet die Frist mit Ablauf des nächsten Werktages.\n\nDer Widerspruch muss die Bezeichnung der angefochtenen Verfügung sowie die Erklärung enthalten, dass Widerspruch gegen diese Verfügung eingelegt wird. Er ist zu unterzeichnen und soll begründet werden.\n\nDie Einlegung ist auch durch Übertragung eines elektronischen Dokuments an die elektronische Poststelle des Gerichts möglich. Das elektronische Dokument muss für die Bearbeitung durch das Gericht geeignet und mit einer qualifizierten elektronischen Signatur der verantwortenden Person versehen sein oder von der verantwortenden Person signiert und auf einem sicheren Übermittlungsweg gemäß § 130 a ZPO nach näherer Maßgabe der Verordnung über die technischen Rahmenbedingungen des elektronischen Rechtsverkehrs und über das besondere elektronische Behördenpostfach (BGBl. I, S. 3803) eingereicht werden. Weitere Informationen erhalten Sie auf der Internetseite www.justiz.de."
    },
    {
      "date": "2025-11-10",
      "id": "136836",
      "original_text": "Registerbekanntmachung nach dem Umwandlungsgesetz\nNordrhein-Westfalen Amtsgericht Köln HRB 73392\naugenschein Filmproduktion GmbH – Köln",
      "type": "Registerbekanntmachung nach dem Umwandlungsgesetz",
      "state": "Nordrhein-Westfalen",
      "amtsgericht": "Amtsgericht Köln",
      "registernummer": "HRB 73392",
      "registerart": "HRB",
      "company_name": "augenschein Filmproduktion GmbH",
      "company_seat": "Köln",
      "details": "10.11.2025 (Bekanntmachungsdatum)\n\nNordrhein-Westfalen Amtsgericht Köln HRB 73392\nRegisterbekanntmachung nach dem Umwandlungsgesetz 10.11.2025 (Eintragungsdatum)\n\naugenschein Filmproduktion GmbH\nGesellschaft mit beschränkter Haftung\nKöln\n\nDen Gläubigern der an der Verschmelzung beteiligten Rechtsträger ist, wenn sie binnen sechs Monaten nach dem Tag, an dem die Eintragung der Verschmelzung in das Register des Sitzes desjenigen Rechtsträgers, dessen Gläubiger sie sind, nach § 19 Absatz 3 UmwG als bekanntgemacht gilt, ihren Anspruch nach Grund und Höhe schriftlich anmelden, Sicherheit zu leisten, soweit sie nicht Befriedigung verlangen können. Dieses Recht steht den Gläubigern jedoch nur zu, wenn sie glaubhaft machen, dass durch die Verschmelzung die Erfüllung ihrer Forderung gefährdet wird."
    },
    {
      "date": "2025-11-10",
      "id": "136837",
      "original_text": "Registerbekanntmachung nach dem Umwandlungsgesetz\nNordrhein-Westfalen Amtsgericht Siegen HRB 6525\nBirkelbach Kondensatortechnik GmbH – Erndtebrück",
      "type": "Registerbekanntmachung nach dem Umwandlungsgesetz",
      "state": "Nordrhein-Westfalen",
      "amtsgericht": "Amtsgericht Siegen",
      "registernummer": "HRB 6525",
      "registerart": "HRB",
      "company_name": "Birkelbach Kondensatortechnik GmbH",
      "company_seat": "Erndtebrück",
      "details": "10.11.2025 (Bekanntmachungsdatum)\n\nNordrhein-Westfalen Amtsgericht Siegen HRB 6525\nRegisterbekanntmachung nach dem Umwandlungsgesetz\n\nBirkelbach Kondensatortechnik GmbH\nGesellschaft mit beschränkter Haftung\nErndtebrück\n\nDen Gläubigern der an der Verschmelzung beteiligten Rechtsträger ist, wenn sie binnen sechs Monaten nach dem Tag, an dem die Eintragung der Verschmelzung in das Register des Sitzes derjenigen Rechtsträger deren Gläubiger sie sind, nach § 19 Absatz 3 UmwG als bekanntgemacht gilt, ihren Anspruch nach Grund und Höhe schriftlich anmelden, Sicherheit zu leisten, soweit sie nicht Befriedigung verlangen können. Dieses Recht steht den Gläubigern jedoch nur zu, wenn sie glaubhaft machen, dass durch die Verschmelzung die Erfüllung ihrer Forderung gefährdet wird."
    },
    {
      "date": "2025-11-10",
      "id": "136838",
      "original_text": "Löschungsankündigung\nNordrhein-Westfalen Amtsgericht Hamm HRB 9912\nInnoX GmbH – Bönen",
      "type": "Löschungsankündigung",
      "state": "Nordrhein-Westfalen",
      "amtsgericht": "Amtsgericht Hamm",
      "registernummer": "HRB 9912",
      "registerart": "HRB",
      "company_name": "InnoX GmbH",
      "company_seat": "Bönen",
      "details": "10.11.2025 (Bekanntmachungsdatum)\n\nNordrhein-Westfalen Amtsgericht Hamm HRB 9912\nLöschungsankündigung\n\nInnoX GmbH\nGesellschaft mit beschränkter Haftung\nBönen\n\nDas Registergericht beabsichtigt die Gesellschaft von Amts wegen nach § 394 FamFG zu löschen. Die Frist zur Erhebung eines Widerspruchs ist auf drei Monate festgesetzt."
    },
    {
      "date": "2025-11-10",
      "id": "136839",
      "original_text": "Löschungsankündigung\nNordrhein-Westfalen Amtsgericht Wuppertal HRA 18704\nCrull & Co. Nachf. Inh. Marlies Margarete Goldbach e. K. – Erkrath",
      "type": "Löschungsankündigung",
      "state": "Nordrhein-Westfalen",
      "amtsgericht": "Amtsgericht Wuppertal",
      "registernummer": "HRA 18704",
      "registerart": "HRA",
      "company_name": "Crull & Co. Nachf. Inh. Marlies Margarete Goldbach e. K.",
      "company_seat": "Erkrath",
      "details": "10.11.2025 (Bekanntmachungsdatum)\n\nNordrhein-Westfalen Amtsgericht Wuppertal HRA 18704\nLöschungsankündigung\n\nCrull & Co. Nachf. Inh. Marlies Margarete Goldbach e. K.\nEinzelkaufmann / Einzelkauffrau\nErkrath\n\nDas Registergericht beabsichtigt die Firma von Amts wegen nach § 31 Abs. 2 HGB, § 393 FamFG zu löschen. Die Frist zur Erhebung eines Widerspruchs ist auf drei Monate festgesetzt."
    },
    {
      "date": "2025-11-10",
      "id": "136840",
      "original_text": "Registerbekanntmachung nach dem Umwandlungsgesetz\nNordrhein-Westfalen Amtsgericht Bochum HRB 22383\nBrüggemann Vertriebs-GmbH – Herne",
      "type": "Registerbekanntmachung nach dem Umwandlungsgesetz",
      "state": "Nordrhein-Westfalen",
      "amtsgericht": "Amtsgericht Bochum",
      "registernummer": "HRB 22383",
      "registerart": "HRB",
      "company_name": "Brüggemann Vertriebs-GmbH",
      "company_seat": "Herne",
      "details": "10.11.2025 (Bekanntmachungsdatum)\n\nNordrhein-Westfalen Amtsgericht Bochum HRB 22383\nRegisterbekanntmachung nach dem Umwandlungsgesetz 06.11.2025 (Eintragungsdatum)\n\nBrüggemann Vertriebs-GmbH\nGesellschaft mit beschränkter Haftung\nHerne\n\nDen Gläubigern der an der Ausgliederung beteiligten Rechtsträger ist, wenn sie binnen sechs Monaten nach dem Tag, an dem die Eintragung der Ausgliederung in das Register des Sitzes derjenigen Rechtsträger deren Gläubiger sie sind, nach § 19 Absatz 3 UmwG als bekanntgemacht gilt, ihren Anspruch nach Grund und Höhe schriftlich anmelden, Sicherheit zu leisten, soweit sie nicht Befriedigung verlangen können. Dieses Recht steht den Gläubigern jedoch nur zu, wenn sie glaubhaft machen, dass durch die Ausgliederung die Erfüllung ihrer Forderung gefährdet wird."
    },
    {
      "date": "2025-11-10",
      "id": "136841",
      "original_text": "Einreichung neuer Dokumente\nNordrhein-Westfalen Amtsgericht Düsseldorf HRB 60970\nEurobond-Immo AG – Düsseldorf",
      "type": "Einreichung neuer Dokumente",
      "state": "Nordrhein-Westfalen",
      "amtsgericht": "Amtsgericht Düsseldorf",
      "registernummer": "HRB 60970",
      "registerart": "HRB",
      "company_name": "Eurobond-Immo AG",
      "company_seat": "Düsseldorf",
      "details": "10.11.2025 (Bekanntmachungsdatum)\n\nNordrhein-Westfalen Amtsgericht Düsseldorf HRB 60970\nEinreichung neuer Dokumente 10.11.2025 (Eintragungsdatum)\n\nEurobond-Immo AG\nAktiengesellschaft\nDüsseldorf\n\nDem Registergericht ist eine neue Liste der Mitglieder des Aufsichtsrates eingereicht worden."
    },
    {
      "date": "2025-11-10",
      "id": "136842",
      "original_text": "Löschungsankündigung\nNordrhein-Westfalen Amtsgericht Bonn HRB 28788\nParedia Service GmbH – Bonn",
      "type": "Löschungsankündigung",
      "state": "Nordrhein-Westfalen",
      "amtsgericht": "Amtsgericht Bonn",
      "registernummer": "HRB 28788",
      "registerart": "HRB",
      "company_name": "Paredia Service GmbH",
      "company_seat": "Bonn",
      "details": "10.11.2025 (Bekanntmachungsdatum)\n\nNordrhein-Westfalen Amtsgericht Bonn HRB 28788\nLöschungsankündigung\n\nParedia Service GmbH\nGesellschaft mit beschränkter Haftung\nBonn\n\nDas Registergericht beabsichtigt die Gesellschaft von Amts wegen nach § 394 FamFG zu löschen. Die Frist zur Erhebung eines Widerspruchs ist auf einen Monat festgesetzt."
    },
    {
      "date": "2025-11-10",
      "id": "136843",
      "original_text": "Löschungsankündigung\nNordrhein-Westfalen Amtsgericht Gelsenkirchen HRB 15239\nSiderite GmbH – Gladbeck",
      "type": "Löschungsankündigung",
      "state": "Nordrhein-Westfalen",
      "amtsgericht": "Amtsgericht Gelsenkirchen",
      "registernummer": "HRB 15239",
      "registerart": "HRB",
      "company_name": "Siderite GmbH",
      "company_seat": "Gladbeck",
      "details": "10.11.2025 (Bekanntmachungsdatum)\n\nNordrhein-Westfalen Amtsgericht Gelsenkirchen HRB 15239\nLöschungsankündigung\n\nSiderite GmbH\nGesellschaft mit beschränkter Haftung\nGladbeck\n\nDas Amtsgericht Gelsenkirchen als Registergericht beabsichtigt, die Gesellschaft Siderite GmbH mit Sitz in Gladbeck, HRB 15239 Amtsgericht Gelsenkirchen, wegen Vermögenslosigkeit zu löschen.\nHiermit wird denjenigen, die an der Unterlassung der Löschung ein berechtigtes Interesse haben, gem. § 394 Abs. 2 FamFG Gelegenheit gegeben, gegen dieses Vorhaben binnen eines Monats nach dieser Bekanntmachung Widerspruch einzulegen. Der Widerspruch kann schriftlich oder zu Protokoll der Geschäftsstelle erhoben werden"
    },
    {
      "date": "2025-11-10",
      "id": "136844",
      "original_text": "Einreichung neuer Dokumente\nNordrhein-Westfalen Amtsgericht Bonn HRB 29764\ndai data analytics institute AG – Bonn",
      "type": "Einreichung neuer Dokumente",
      "state": "Nordrhein-Westfalen",
      "amtsgericht": "Amtsgericht Bonn",
      "registernummer": "HRB 29764",
      "registerart": "HRB",
      "company_name": "dai data analytics institute AG",
      "company_seat": "Bonn",
      "details": "10.11.2025 (Bekanntmachungsdatum)\n\nNordrhein-Westfalen Amtsgericht Bonn HRB 29764\nEinreichung neuer Dokumente 10.11.2025 (Eintragungsdatum)\n\ndai data analytics institute AG\nAktiengesellschaft\nBonn\n\nDem Registergericht ist eine neue Liste der Mitglieder des Aufsichtsrates eingereicht worden."
    },
    {
      "date": "2025-11-10",
      "id": "136845",
      "original_text": "Löschungsankündigung\nNordrhein-Westfalen Amtsgericht Dortmund HRB 9742\nHermstrüwer GmbH – Dortmund",
      "type": "Löschungsankündigung",
      "state": "Nordrhein-Westfalen",
      "amtsgericht": "Amtsgericht Dortmund",
      "registernummer": "HRB 9742",
      "registerart": "HRB",
      "company_name": "Hermstrüwer GmbH",
      "company_seat": "Dortmund",
      "details": "10.11.2025 (Bekanntmachungsdatum)\n\nNordrhein-Westfalen Amtsgericht Dortmund HRB 9742\nLöschungsankündigung 10.11.2025 (Eintragungsdatum)\n\nHermstrüwer GmbH\nGesellschaft mit beschränkter Haftung\nDortmund\n\nDas Registergericht beabsichtigt die Gesellschaft von Amts wegen nach § 394 FamFG zu löschen. Die Frist zur Erhebung eines Widerspruchs ist auf zwei Monate festgesetzt."
    },
    {
      "date": "2025-11-10",
      "id": "136846",
      "original_text": "Löschungsankündigung\nNordrhein-Westfalen Amtsgericht Gelsenkirchen HRB 16770\nS.W. Bau UG (haftungsbeschränkt) – Gelsenkirchen",
      "type": "Löschungsankündigung",
      "state": "Nordrhein-Westfalen",
      "amtsgericht": "Amtsgericht Gelsenkirchen",
      "registernummer": "HRB 16770",
      "registerart": "HRB",
      "company_name": "S.W. Bau UG (haftungsbeschränkt)",
      "company_seat": "Gelsenkirchen",
      "details": "10.11.2025 (Bekanntmachungsdatum)\n\nNordrhein-Westfalen Amtsgericht Gelsenkirchen HRB 16770\nLöschungsankündigung\n\nS.W. Bau UG (haftungsbeschränkt)\nGesellschaft mit beschränkter Haftung\nGelsenkirchen\n\nDas Gericht beabsichtigt, die Gesellschaft S.W. Bau UG (haftungsbeschränkt) mit Sitz in Gelsenkirchen, HRB 16770 Amtsgericht Gelsenkirchen, wegen Vermögenslosigkeit zu löschen.\n\nHiermit wird denjenigen, die an der Unterlassung der Löschung ein berechtigtes Interesse haben, gem. § 394 Abs. 2 FamFG Gelegenheit gegeben, gegen dieses Vorhaben binnen eines Monats nach dieser Bekanntmachung Widerspruch einzulegen. Der Widerspruch kann schriftlich oder zu Protokoll der Geschäftsstelle erhoben werden."
    },
    {
      "date": "2025-11-10",
      "id": "136847",
      "original_text": "Löschungsankündigung\nNordrhein-Westfalen Amtsgericht Dortmund HRB 33312\nGIACOMO Kaffeehandel GmbH – Dortmund",
      "type": "Löschungsankündigung",
      "state": "Nordrhein-Westfalen",
      "amtsgericht": "Amtsgericht Dortmund",
      "registernummer": "HRB 33312",
      "registerart": "HRB",
      "company_name": "GIACOMO Kaffeehandel GmbH",
      "company_seat": "Dortmund",
      "details": "10.11.2025 (Bekanntmachungsdatum)\n\nNordrhein-Westfalen Amtsgericht Dortmund HRB 33312\nLöschungsankündigung 10.11.2025 (Eintragungsdatum)\n\nGIACOMO Kaffeehandel GmbH\nGesellschaft mit beschränkter Haftung\nDortmund\n\nDas Registergericht beabsichtigt die Gesellschaft von Amts wegen nach § 394 FamFG zu löschen. Die Frist zur Erhebung eines Widerspruchs ist auf zwei Monate festgesetzt."
    },
    {
      "date": "2025-11-10",
      "id": "136848",
      "original_text": "Einreichung neuer Dokumente\nNordrhein-Westfalen Amtsgericht Bonn HRB 17337\nPostbank Direkt GmbH – Bonn",
      "type": "Einreichung neuer Dokumente",
      "state": "Nordrhein-Westfalen",
      "amtsgericht": "Amtsgericht Bonn",
      "registernummer": "HRB 17337",
      "registerart": "HRB",
      "company_name": "Postbank Direkt GmbH",
      "company_seat": "Bonn",
      "details": "10.11.2025 (Bekanntmachungsdatum)\n\nNordrhein-Westfalen Amtsgericht Bonn HRB 17337\nEinreichung neuer Dokumente\n\nPostbank Direkt GmbH\nGesellschaft mit beschränkter Haftung\nBonn\n\nDem Registergericht ist eine neue Liste der Mitglieder des Aufsichtsrates eingereicht worden."
    },
    {
      "date": "2025-11-10",
      "id": "136849",
      "original_text": "Registerbekanntmachung nach dem Umwandlungsgesetz\nNordrhein-Westfalen Amtsgericht Düsseldorf HRA 2400\nJames Cloppenburg Real Estate Holding SARL & Co. KG – Düsseldorf",
      "type": "Registerbekanntmachung nach dem Umwandlungsgesetz",
      "state": "Nordrhein-Westfalen",
      "amtsgericht": "Amtsgericht Düsseldorf",
      "registernummer": "HRA 2400",
      "registerart": "HRA",
      "company_name": "James Cloppenburg Real Estate Holding SARL & Co. KG",
      "company_seat": "Düsseldorf",
      "details": "10.11.2025 (Bekanntmachungsdatum)\n\nNordrhein-Westfalen Amtsgericht Düsseldorf HRA 2400\nRegisterbekanntmachung nach dem Umwandlungsgesetz 10.11.2025 (Eintragungsdatum)\n\nJames Cloppenburg Real Estate Holding SARL & Co. KG\nKommanditgesellschaft\nDüsseldorf\n\nDen Gläubigern der an der Ausgliederung beteiligten Rechtsträger ist, wenn sie binnen sechs Monaten nach dem Tag, an dem die Eintragung der Ausgliederung in das Register des Sitzes desjenigen Rechtsträgers, dessen Gläubiger sie sind, nach § 19 Absatz 3 UmwG als bekanntgemacht gilt, ihren Anspruch nach Grund und Höhe schriftlich anmelden, Sicherheit zu leisten, soweit sie nicht Befriedigung verlangen können. Dieses Recht steht den Gläubigern jedoch nur zu, wenn sie glaubhaft machen, dass durch die Ausgliederung die Erfüllung ihrer Forderung gefährdet wird."
    },
    {
      "date": "2025-11-10",
      "id": "136850",
      "original_text": "Registerbekanntmachung nach dem Umwandlungsgesetz\nNordrhein-Westfalen Amtsgericht Köln HRB 114822\nTA Co-Production GmbH – Köln",
      "type": "Registerbekanntmachung nach dem Umwandlungsgesetz",
      "state": "Nordrhein-Westfalen",
      "amtsgericht": "Amtsgericht Köln",
      "registernummer": "HRB 114822",
      "registerart": "HRB",
      "company_name": "TA Co-Production GmbH",
      "company_seat": "Köln",
      "details": "10.11.2025 (Bekanntmachungsdatum)\n\nNordrhein-Westfalen Amtsgericht Köln HRB 114822\nRegisterbekanntmachung nach dem Umwandlungsgesetz 10.11.2025 (Eintragungsdatum)\n\nTA Co-Production GmbH\nGesellschaft mit beschränkter Haftung\nKöln\n\nDen Gläubigern der an der Verschmelzung beteiligten Rechtsträger ist, wenn sie binnen sechs Monaten nach dem Tag, an dem die Eintragung der Verschmelzung in das Register des Sitzes desjenigen Rechtsträgers, dessen Gläubiger sie sind, nach § 19 Absatz 3 UmwG als bekanntgemacht gilt, ihren Anspruch nach Grund und Höhe schriftlich anmelden, Sicherheit zu leisten, soweit sie nicht Befriedigung verlangen können. Dieses Recht steht den Gläubigern jedoch nur zu, wenn sie glaubhaft machen, dass durch die Verschmelzung die Erfüllung ihrer Forderung gefährdet wird."
    },
    {
      "date": "2025-11-10",
      "id": "136851",
      "original_text": "Einreichung neuer Dokumente\nNordrhein-Westfalen Amtsgericht Bonn HRB 14654\nPostbank Filialvertrieb AG – Bonn",
      "type": "Einreichung neuer Dokumente",
      "state": "Nordrhein-Westfalen",
      "amtsgericht": "Amtsgericht Bonn",
      "registernummer": "HRB 14654",
      "registerart": "HRB",
      "company_name": "Postbank Filialvertrieb AG",
      "company_seat": "Bonn",
      "details": "10.11.2025 (Bekanntmachungsdatum)\n\nNordrhein-Westfalen Amtsgericht Bonn HRB 14654\nEinreichung neuer Dokumente\n\nPostbank Filialvertrieb AG\nAktiengesellschaft\nBonn\n\nDem Registergericht ist eine neue Liste der Mitglieder des Aufsichtsrates eingereicht worden."
    },
    {
      "date": "2025-11-10",
      "id": "136852",
      "original_text": "Einreichung neuer Dokumente\nNordrhein-Westfalen Amtsgericht Essen HRB 27613\nPCC Services GmbH der Deutschen Bank – Essen",
      "type": "Einreichung neuer Dokumente",
      "state": "Nordrhein-Westfalen",
      "amtsgericht": "Amtsgericht Essen",
      "registernummer": "HRB 27613",
      "registerart": "HRB",
      "company_name": "PCC Services GmbH der Deutschen Bank",
      "company_seat": "Essen",
      "details": "10.11.2025 (Bekanntmachungsdatum)\n\nNordrhein-Westfalen Amtsgericht Essen HRB 27613\nEinreichung neuer Dokumente\n\nPCC Services GmbH der Deutschen Bank\nGesellschaft mit beschränkter Haftung\nEssen\n\nDem Registergericht ist eine neue Liste der Mitglieder des Aufsichtsrates eingereicht worden."
    },
    {
      "date": "2025-11-10",
      "id": "136853",
      "original_text": "Löschungsankündigung\nNordrhein-Westfalen Amtsgericht Dortmund HRB 29906\nDOMADI UG (haftungsbeschränkt) – Dortmund",
      "type": "Löschungsankündigung",
      "state": "Nordrhein-Westfalen",
      "amtsgericht": "Amtsgericht Dortmund",
      "registernummer": "HRB 29906",
      "registerart": "HRB",
      "company_name": "DOMADI UG (haftungsbeschränkt)",
      "company_seat": "Dortmund",
      "details": "10.11.2025 (Bekanntmachungsdatum)\n\nNordrhein-Westfalen Amtsgericht Dortmund HRB 29906\nLöschungsankündigung\n\nDOMADI UG (haftungsbeschränkt)\nGesellschaft mit beschränkter Haftung\nDortmund\n\nDas Registergericht beabsichtigt die Gesellschaft von Amts wegen nach § 394 FamFG zu löschen. Die Frist zur Erhebung eines Widerspruchs ist auf zwei Monate festgesetzt."
    },
    {
      "date": "2025-11-10",
      "id": "136854",
      "original_text": "Löschungsankündigung\nNordrhein-Westfalen Amtsgericht Düsseldorf HRB 73163\nSmartran Business Consulting GmbH – Düsseldorf",
      "type": "Löschungsankündigung",
      "state": "Nordrhein-Westfalen",
      "amtsgericht": "Amtsgericht Düsseldorf",
      "registernummer": "HRB 73163",
      "registerart": "HRB",
      "company_name": "Smartran Business Consulting GmbH",
      "company_seat": "Düsseldorf",
      "details": "10.11.2025 (Bekanntmachungsdatum)\n\nNordrhein-Westfalen Amtsgericht Düsseldorf HRB 73163\nLöschungsankündigung\n\nSmartran Business Consulting GmbH\nGesellschaft mit beschränkter Haftung\nDüsseldorf\n\nDas Registergericht beabsichtigt die Gesellschaft von Amts wegen nach § 394 FamFG zu löschen. Die Frist zur Erhebung eines Widerspruchs ist auf 3 Wochen festgesetzt.\n\nRechtsbehelfsbelehrung:\nDas Widerspruchsrecht steht jedem zu, der an der Unterlassung der Löschung ein berechtigtes Interesse hat. Der Widerspruch ist bei dem Amtsgericht Düsseldorf -Registergericht-, Werdener Straße 1, 40227 Düsseldorf schriftlich in deutscher Sprache oder zur Niederschrift der Geschäftsstelle einzulegen. Der Widerspruch kann auch zur Niederschrift der Geschäftsstelle eines jeden Amtsgerichtes abgegeben werden. Die Einlegung ist auch durch Übertragung eines elektronischen Dokuments an die elektronische Poststelle des Gerichts möglich. Das elektronische Dokument muss für die Bearbeitung durch das Gericht geeignet und mit einer qualifizierten elektronischen Signatur der verantwortenden Person versehen sein oder von der verantwortenden Person signiert und auf einem sicheren Übermittlungsweg gemäß § 130a ZPO nach näherer Maßgabe der Verordnung über die technischen Rahmenbedingungen des elektronischen Rechtsverkehrs und über das besondere elektronische Behördenpostfach (BGBl. I, S.3803) eingereicht werden. Weitere Informationen erhalten Sie auf der Internetseite www.justiz.de.\nDer Widerspruch muss spätestens innerhalb der gesetzten Frist nach dem Datum der Bekanntmachung der Löschungsankündigung bei dem Amtsgericht - Registergericht - Düsseldorf eingegangen sein.  Dies gilt auch dann, wenn der Widerspruch zur Niederschrift der Geschäftsstelle eines anderen Amtsgerichtes abgegeben wurde. Die Frist beginnt mit dem Tage der Bekanntmachung der Löschungsankündigung in dem für die Bekanntmachung der Eintragungen in das Handelsregister bestimmten elektronischen Informations- und Kommunikationssystem nach § 10 des Handelsgesetzbuches. Fällt das Ende der Frist auf einen Sonntag, einen allgemeinen Feiertag oder Sonnabend, so endet die Frist mit Ablauf des nächsten Werktages.\nDer Widerspruch muss die Bezeichnung der angefochtenen Löschungsankündigung sowie die Erklärung enthalten, dass Widerspruch gegen diese Löschungsankündigung eingelegt wird. Er ist zu unterzeichnen und soll begründet werden."
    },
    {
      "date": "2025-11-10",
      "id": "136855",
      "original_text": "Einreichung neuer Dokumente\nNordrhein-Westfalen Amtsgericht Siegburg HRB 11500\nSiegwerk Druckfarben AG & Co. KGaA – Siegburg",
      "type": "Einreichung neuer Dokumente",
      "state": "Nordrhein-Westfalen",
      "amtsgericht": "Amtsgericht Siegburg",
      "registernummer": "HRB 11500",
      "registerart": "HRB",
      "company_name": "Siegwerk Druckfarben AG & Co. KGaA",
      "company_seat": "Siegburg",
      "details": "10.11.2025 (Bekanntmachungsdatum)\n\nNordrhein-Westfalen Amtsgericht Siegburg HRB 11500\nEinreichung neuer Dokumente 10.11.2025 (Eintragungsdatum)\n\nSiegwerk Druckfarben AG & Co. KGaA\nKommanditgesellschaft auf Aktien\nSiegburg\n\nDem Registergericht ist eine neue Liste der Mitglieder des Aufsichtsrates eingereicht worden."
    },
    {
      "date": "2025-11-10",
      "id": "136856",
      "original_text": "Registerbekanntmachung nach dem Umwandlungsgesetz\nNordrhein-Westfalen Amtsgericht Düsseldorf HRB 93162\nAPONTIS PHARMA AG – Monheim am Rhein",
      "type": "Registerbekanntmachung nach dem Umwandlungsgesetz",
      "state": "Nordrhein-Westfalen",
      "amtsgericht": "Amtsgericht Düsseldorf",
      "registernummer": "HRB 93162",
      "registerart": "HRB",
      "company_name": "APONTIS PHARMA AG",
      "company_seat": "Monheim am Rhein",
      "details": "10.11.2025 (Bekanntmachungsdatum)\n\nNordrhein-Westfalen Amtsgericht Düsseldorf HRB 93162\nRegisterbekanntmachung nach dem Umwandlungsgesetz 10.11.2025 (Eintragungsdatum)\n\nAPONTIS PHARMA AG\nAktiengesellschaft\nMonheim am Rhein\n\nDen Gläubigern der an der Verschmelzung beteiligten Rechtsträger ist, wenn sie binnen sechs Monaten nach dem Tag, an dem die Eintragung der Verschmelzung in das Register des Sitzes desjenigen Rechtsträgers, dessen Gläubiger sie sind, nach § 19 Absatz 3 UmwG als bekanntgemacht gilt, ihren Anspruch nach Grund und Höhe schriftlich anmelden, Sicherheit zu leisten, soweit sie nicht Befriedigung verlangen können. Dieses Recht steht den Gläubigern jedoch nur zu, wenn sie glaubhaft machen, dass durch die Verschmelzung die Erfüllung ihrer Forderung gefährdet wird."
    },
    {
      "date": "2025-11-10",
      "id": "136857",
      "original_text": "Registerbekanntmachung nach dem Umwandlungsgesetz\nHamburg Amtsgericht Hamburg HRA 132559\nMD Rathje Fashion e.K. – Hamburg",
      "type": "Registerbekanntmachung nach dem Umwandlungsgesetz",
      "state": "Hamburg",
      "amtsgericht": "Amtsgericht Hamburg",
      "registernummer": "HRA 132559",
      "registerart": "HRA",
      "company_name": "MD Rathje Fashion e.K.",
      "company_seat": "Hamburg",
      "details": "10.11.2025 (Bekanntmachungsdatum)\n\nHamburg Amtsgericht Hamburg HRA 132559\nRegisterbekanntmachung nach dem Umwandlungsgesetz 10.11.2025 (Eintragungsdatum)\n\nMD Rathje Fashion e.K.\nEinzelkaufmann\nHamburg\n\nAls nicht eingetragen wird bekannt gemacht:\nDen Gläubigern der an der Ausgliederung beteiligten Gesellschaften ist, wenn sie binnen sechs Monaten nach dem Tag, an dem die Eintragung der Ausgliederung in das Register des Sitzes desjenigen Rechtsträgers, dessen Gläubiger sie sind, nach § 19 Absatz 3 UmwG als bekannt gemacht gilt, ihren Anspruch nach Grund und Höhe schriftlich anmelden, Sicherheit zu leisten, soweit sie nicht Befriedigung verlangen können. Dieses Recht steht den Gläubigern jedoch nur zu, wenn sie glaubhaft machen, dass durch die Ausgliederung die Erfüllung ihrer Forderung gefährdet wird."
    },
    {
      "date": "2025-11-10",
      "id": "136858",
      "original_text": "Registerbekanntmachung nach dem Umwandlungsgesetz\nThüringen Amtsgericht Jena HRB 517031\nREUSS Gelenkwellen GmbH – Drei Gleichen",
      "type": "Registerbekanntmachung nach dem Umwandlungsgesetz",
      "state": "Thüringen",
      "amtsgericht": "Amtsgericht Jena",
      "registernummer": "HRB 517031",
      "registerart": "HRB",
      "company_name": "REUSS Gelenkwellen GmbH",
      "company_seat": "Drei Gleichen",
      "details": "10.11.2025 (Bekanntmachungsdatum)\n\nThüringen Amtsgericht Jena HRB 517031\nRegisterbekanntmachung nach dem Umwandlungsgesetz 10.11.2025 (Eintragungsdatum)\n\nREUSS Gelenkwellen GmbH\nGesellschaft mit beschränkter Haftung\nDrei Gleichen\n\nNicht eingetragen: Den Gläubigern der an der Ausgliederung beteiligten Rechtsträger, ist wenn sie binnen sechs Monaten nach dem Tag, an dem die Eintragung der Ausgliederung in das Register des Sitzes desjenigen Rechtsträgers, dessen Gläubiger sie sind, nach §§125, 19 Abs. 3 UmwG als bekanntgemacht gilt, ihren Anspruch nach Grund und Höhe schriftlich anmelden, Sicherheit zu leisten, soweit sie nicht Befriedigung verlangen können. Dieses Recht steht ihnen jedoch nur zu, wenn sie glaubhaft machen, daß durch die Ausgliederung die Erfüllung ihrer Forderung gefährdet wird."
    },
    {
      "date": "2025-11-10",
      "id": "136859",
      "original_text": "Registerbekanntmachung nach dem Umwandlungsgesetz\nThüringen Amtsgericht Jena HRA 505476\nREUSS Gelenkwellen Thüringen e.K. – Drei Gleichen",
      "type": "Registerbekanntmachung nach dem Umwandlungsgesetz",
      "state": "Thüringen",
      "amtsgericht": "Amtsgericht Jena",
      "registernummer": "HRA 505476",
      "registerart": "HRA",
      "company_name": "REUSS Gelenkwellen Thüringen e.K.",
      "company_seat": "Drei Gleichen",
      "details": "10.11.2025 (Bekanntmachungsdatum)\n\nThüringen Amtsgericht Jena HRA 505476\nRegisterbekanntmachung nach dem Umwandlungsgesetz 10.11.2025 (Eintragungsdatum)\n\nREUSS Gelenkwellen Thüringen e.K.\nEinzelkaufmann / Einzelkauffrau\nDrei Gleichen\n\nNicht eingetragen: Den Gläubigern der an der Ausgliederung beteiligten Rechtsträger, ist wenn sie binnen sechs Monaten nach dem Tag, an dem die Eintragung der Ausgliederung in das Register des Sitzes desjenigen Rechtsträgers, dessen Gläubiger sie sind, nach §§125, 19 Abs. 3 UmwG als bekanntgemacht gilt, ihren Anspruch nach Grund und Höhe schriftlich anmelden, Sicherheit zu leisten, soweit sie nicht Befriedigung verlangen können. Dieses Recht steht ihnen jedoch nur zu, wenn sie glaubhaft machen, daß durch die Ausgliederung die Erfüllung ihrer Forderung gefährdet wird."
    },
    {
      "date": "2025-11-10",
      "id": "136860",
      "original_text": "Sonstige Registerbekanntmachung\nHessen Amtsgericht Frankfurt am Main HRB 25668\nDWS Grundbesitz GmbH – Frankfurt am Main",
      "type": "Sonstige Registerbekanntmachung",
      "state": "Hessen",
      "amtsgericht": "Amtsgericht Frankfurt am Main",
      "registernummer": "HRB 25668",
      "registerart": "HRB",
      "company_name": "DWS Grundbesitz GmbH",
      "company_seat": "Frankfurt am Main",
      "details": "10.11.2025 (Bekanntmachungsdatum)\n\nHessen Amtsgericht Frankfurt am Main HRB 25668\nSonstige Registerbekanntmachung\n\nDWS Grundbesitz GmbH\nGesellschaft mit beschränkter Haftung\nFrankfurt am Main\n\nDurch eine Änderung in den Personen der Aufsichtsratsmitglieder ist eine Liste der Mitglieder des Aufsichtsrates zum Handelsregister eingereicht worden."
    },
    {
      "date": "2025-11-10",
      "id": "136861",
      "original_text": "Einreichung neuer Dokumente\nHessen Amtsgericht Frankfurt am Main HRB 77306\nOYAK ANKER Bank GmbH – Frankfurt am Main",
      "type": "Einreichung neuer Dokumente",
      "state": "Hessen",
      "amtsgericht": "Amtsgericht Frankfurt am Main",
      "registernummer": "HRB 77306",
      "registerart": "HRB",
      "company_name": "OYAK ANKER Bank GmbH",
      "company_seat": "Frankfurt am Main",
      "details": "10.11.2025 (Bekanntmachungsdatum)\n\nHessen Amtsgericht Frankfurt am Main HRB 77306\nEinreichung neuer Dokumente 07.11.2025 (Eintragungsdatum)\n\nOYAK ANKER Bank GmbH\nGesellschaft mit beschränkter Haftung\nFrankfurt am Main\n\nDurch eine Änderung in den Personen der Aufsichtsratsmitglieder ist eine Liste der Mitglieder des Aufsichtsrates zum Handelsregister eingereicht worden."
    },
    {
      "date": "2025-11-10",
      "id": "136862",
      "original_text": "Löschungsankündigung\nHessen Amtsgericht Frankfurt am Main HRB 112893\nAMZQ-Alba UG (haftungsbeschränkt) – Frankfurt am Main",
      "type": "Löschungsankündigung",
      "state": "Hessen",
      "amtsgericht": "Amtsgericht Frankfurt am Main",
      "registernummer": "HRB 112893",
      "registerart": "HRB",
      "company_name": "AMZQ-Alba UG (haftungsbeschränkt)",
      "company_seat": "Frankfurt am Main",
      "details": "10.11.2025 (Bekanntmachungsdatum)\n\nHessen Amtsgericht Frankfurt am Main HRB 112893\nLöschungsankündigung\n\nAMZQ-Alba UG (haftungsbeschränkt)\nGesellschaft mit beschränkter Haftung\nFrankfurt am Main\n\nDas Registergericht beabsichtigt die im Handelsregister eingetragene Gesellschaft von Amts wegen nach § 394 FamFG zu löschen. Die Frist zur Erhebung eines Widerspruchs gegen die beabsichtigte Löschung wird auf 1 Monat festgesetzt."
    },
    {
      "date": "2025-11-10",
      "id": "136863",
      "original_text": "Löschungsankündigung\nHessen Amtsgericht Frankfurt am Main HRA 42113\nJocks Bock Development GmbH & Co. Frankfurt Deutschherrnufer Süd KG – Frankfurt am Main",
      "type": "Löschungsankündigung",
      "state": "Hessen",
      "amtsgericht": "Amtsgericht Frankfurt am Main",
      "registernummer": "HRA 42113",
      "registerart": "HRA",
      "company_name": "Jocks Bock Development GmbH & Co. Frankfurt Deutschherrnufer Süd KG",
      "company_seat": "Frankfurt am Main",
      "details": "10.11.2025 (Bekanntmachungsdatum)\n\nHessen Amtsgericht Frankfurt am Main HRA 42113\nLöschungsankündigung\n\nJocks Bock Development GmbH & Co. Frankfurt Deutschherrnufer Süd KG\nKommanditgesellschaft\nFrankfurt am Main\n\nDas Registergericht beabsichtigt die im Handelsregister eingetragene Firma von Amts wegen nach § 394 FamFG zu löschen. Die Frist zur Erhebung eines Widerspruchs gegen die beabsichtigte Löschung wird auf 1 Monat festgesetzt."
    },
    {
      "date": "2025-11-10",
      "id": "136864",
      "original_text": "Sonstige Registerbekanntmachung\nHessen Amtsgericht Kassel VR 5410\nTabletop Gilde e.V. – Baunatal",
      "type": "Sonstige Registerbekanntmachung",
      "state": "Hessen",
      "amtsgericht": "Amtsgericht Kassel",
      "registernummer": "VR 5410",
      "registerart": "VR",
      "company_name": "Tabletop Gilde e.V.",
      "company_seat": "Baunatal",
      "details": "10.11.2025 (Bekanntmachungsdatum)\n\nHessen Amtsgericht Kassel VR 5410\nSonstige Registerbekanntmachung 10.11.2025 (Eintragungsdatum)\n\nTabletop Gilde e.V.\neingetragener Verein\nBaunatal\n\nDer Verein ist aufgelöst und liquidationslos erloschen."
    },
    {
      "date": "2025-11-10",
      "id": "136865",
      "original_text": "Registerbekanntmachung nach dem Umwandlungsgesetz\nHessen Amtsgericht Darmstadt GsR 494\nHD Elektro Plus eGbR – Griesheim",
      "type": "Registerbekanntmachung nach dem Umwandlungsgesetz",
      "state": "Hessen",
      "amtsgericht": "Amtsgericht Darmstadt",
      "registernummer": "GsR 494",
      "registerart": "GsR",
      "company_name": "HD Elektro Plus eGbR",
      "company_seat": "Griesheim",
      "details": "10.11.2025 (Bekanntmachungsdatum)\n\nHessen Amtsgericht Darmstadt GsR 494\nRegisterbekanntmachung nach dem Umwandlungsgesetz 09.11.2025 (Eintragungsdatum)\n\nHD Elektro Plus eGbR\nGesellschaft bürgerlichen Rechts\nGriesheim\n\nDen Gläubigern der an der formwechselnden Umwandlung beteiligten Rechtsträger ist, wenn sie binnen sechs Monaten nach dem Tag, an dem die Eintragung der formwechselnden Umwandlung in das Register des Sitzes desjenigen Rechtsträgers, dessen Gläubiger sie sind, nach § 201 UmwG bekannt gemacht worden ist, ihren Anspruch nach Grund und Höhe schriftlich anmelden, Sicherheit zu leisten, soweit sie nicht Befriedigung verlangen können. Dieses Recht steht den Gläubigern jedoch nur zu, wenn sie glaubhaft machen, dass durch die formwechselnden Umwandlung die Erfüllung ihrer Forderung gefährdet wird."
    },
    {
      "date": "2025-11-10",
      "id": "136866",
      "original_text": "Sonstige Registerbekanntmachung\nHessen Amtsgericht Frankfurt am Main HRB 83173\nDB Fernverkehr Aktiengesellschaft – Frankfurt am Main",
      "type": "Sonstige Registerbekanntmachung",
      "state": "Hessen",
      "amtsgericht": "Amtsgericht Frankfurt am Main",
      "registernummer": "HRB 83173",
      "registerart": "HRB",
      "company_name": "DB Fernverkehr Aktiengesellschaft",
      "company_seat": "Frankfurt am Main",
      "details": "10.11.2025 (Bekanntmachungsdatum)\n\nHessen Amtsgericht Frankfurt am Main HRB 83173\nSonstige Registerbekanntmachung\n\nDB Fernverkehr Aktiengesellschaft\nAktiengesellschaft\nFrankfurt am Main\n\nDurch eine Änderung in den Personen der Aufsichtsratsmitglieder ist eine Liste der Mitglieder des Aufsichtsrates zum Handelsregister eingereicht worden."
    },
    {
      "date": "2025-11-10",
      "id": "136867",
      "original_text": "Sonstige Registerbekanntmachung\nHessen Amtsgericht Bad Homburg v.d.H. VR 2337\n750 Jahre Anspach und Westerfeld e.V. – Neu-Anspach",
      "type": "Sonstige Registerbekanntmachung",
      "state": "Hessen",
      "amtsgericht": "Amtsgericht Bad Homburg v.d.H.",
      "registernummer": "VR 2337",
      "registerart": "VR",
      "company_name": "750 Jahre Anspach und Westerfeld e.V.",
      "company_seat": "Neu-Anspach",
      "details": "10.11.2025 (Bekanntmachungsdatum)\n\nHessen Amtsgericht Bad Homburg v.d.H. VR 2337\nSonstige Registerbekanntmachung 10.11.2025 (Eintragungsdatum)\n\n750 Jahre Anspach und Westerfeld e.V.\neingetragener Verein\nNeu-Anspach\n\nDer Verein ist aufgelöst."
    },
    {
      "date": "2025-11-10",
      "id": "136868",
      "original_text": "Löschungsankündigung\nHessen Amtsgericht Offenbach am Main HRB 51264\nDEFNE Bau und Reinigung UG (haftungsbeschränkt) – Dreieich",
      "type": "Löschungsankündigung",
      "state": "Hessen",
      "amtsgericht": "Amtsgericht Offenbach am Main",
      "registernummer": "HRB 51264",
      "registerart": "HRB",
      "company_name": "DEFNE Bau und Reinigung UG (haftungsbeschränkt)",
      "company_seat": "Dreieich",
      "details": "10.11.2025 (Bekanntmachungsdatum)\n\nHessen Amtsgericht Offenbach am Main HRB 51264\nLöschungsankündigung\n\nDEFNE Bau und Reinigung UG (haftungsbeschränkt)\nGesellschaft mit beschränkter Haftung\nDreieich\n\nDas Registergericht beabsichtigt die im Handelsregister eingetragene Gesellschaft von Amts wegen nach § 394 FamFG zu löschen. Die Frist zur Erhebung eines Widerspruchs gegen die beabsichtigte Löschung wird auf 3 Monate festgesetzt."
    },
    {
      "date": "2025-11-10",
      "id": "136869",
      "original_text": "Registerbekanntmachung nach dem Umwandlungsgesetz\nHessen Amtsgericht Frankfurt am Main HRB 28003\nTAXI-RUF FRANKFURT GMBH – Frankfurt am Main",
      "type": "Registerbekanntmachung nach dem Umwandlungsgesetz",
      "state": "Hessen",
      "amtsgericht": "Amtsgericht Frankfurt am Main",
      "registernummer": "HRB 28003",
      "registerart": "HRB",
      "company_name": "TAXI-RUF FRANKFURT GMBH",
      "company_seat": "Frankfurt am Main",
      "details": "10.11.2025 (Bekanntmachungsdatum)\n\nHessen Amtsgericht Frankfurt am Main HRB 28003\nRegisterbekanntmachung nach dem Umwandlungsgesetz 10.11.2025 (Eintragungsdatum)\n\nTAXI-RUF FRANKFURT GMBH\nGesellschaft mit beschränkter Haftung\nFrankfurt am Main\n\nDen Gläubigern der an der Verschmelzung beteiligten Rechtsträger ist, wenn sie binnen sechs Monaten nach dem Tag, an dem die Eintragung der Verschmelzung in das Register des Sitzes desjenigen Rechtsträgers, dessen Gläubiger sie sind, nach § 19 Absatz 3 UmwG bekannt gemacht worden ist, ihren Anspruch nach Grund und Höhe schriftlich anmelden, Sicherheit zu leisten, soweit sie nicht Befriedigung verlangen können. Dieses Recht steht den Gläubigern jedoch nur zu, wenn sie glaubhaft machen, dass durch die Verschmelzung die Erfüllung ihrer Forderung gefährdet wird."
    },
    {
      "date": "2025-11-10",
      "id": "136870",
      "original_text": "Löschungsankündigung\nHessen Amtsgericht Wiesbaden HRB 34227\nNEOTEC GmbH – Wiesbaden",
      "type": "Löschungsankündigung",
      "state": "Hessen",
      "amtsgericht": "Amtsgericht Wiesbaden",
      "registernummer": "HRB 34227",
      "registerart": "HRB",
      "company_name": "NEOTEC GmbH",
      "company_seat": "Wiesbaden",
      "details": "10.11.2025 (Bekanntmachungsdatum)\n\nHessen Amtsgericht Wiesbaden HRB 34227\nLöschungsankündigung\n\nNEOTEC GmbH\nGesellschaft mit beschränkter Haftung\nWiesbaden\n\nDas Registergericht beabsichtigt die im Handelsregister eingetragene Gesellschaft von Amts wegen nach § 394 FamFG zu löschen. Die Frist zur Erhebung eines Widerspruchs gegen die beabsichtigte Löschung wird auf 3 Monate festgesetzt."
    },
    {
      "date": "2025-11-10",
      "id": "136871",
      "original_text": "Sonstige Registerbekanntmachung\nHessen Amtsgericht Marburg VR 5328\nMännergesangverein Liedertafel Frankenberg 1902 und Schreufa 1875 – Frankenberg (Eder)",
      "type": "Sonstige Registerbekanntmachung",
      "state": "Hessen",
      "amtsgericht": "Amtsgericht Marburg",
      "registernummer": "VR 5328",
      "registerart": "VR",
      "company_name": "Männergesangverein Liedertafel Frankenberg 1902 und Schreufa 1875",
      "company_seat": "Frankenberg (Eder)",
      "details": "10.11.2025 (Bekanntmachungsdatum)\n\nHessen Amtsgericht Marburg VR 5328\nSonstige Registerbekanntmachung 31.10.2025 (Eintragungsdatum)\n\nMännergesangverein Liedertafel Frankenberg 1902 und Schreufa 1875\neingetragener Verein\nFrankenberg (Eder)\n\nDer Verein ist aufgelöst."
    },
    {
      "date": "2025-11-10",
      "id": "136872",
      "original_text": "Löschungsankündigung\nHessen Amtsgericht Darmstadt HRB 92110\nHandling Service GmbH – Raunheim",
      "type": "Löschungsankündigung",
      "state": "Hessen",
      "amtsgericht": "Amtsgericht Darmstadt",
      "registernummer": "HRB 92110",
      "registerart": "HRB",
      "company_name": "Handling Service GmbH",
      "company_seat": "Raunheim",
      "details": "10.11.2025 (Bekanntmachungsdatum)\n\nHessen Amtsgericht Darmstadt HRB 92110\nLöschungsankündigung\n\nHandling Service GmbH\nGesellschaft mit beschränkter Haftung\nRaunheim\n\nDas Registergericht beabsichtigt die im Handelsregister eingetragene Gesellschaft von Amts wegen nach § 394 FamFG zu löschen. Die Frist zur Erhebung eines Widerspruchs gegen die beabsichtigte Löschung wird auf 3 Monate festgesetzt."
    },
    {
      "date": "2025-11-10",
      "id": "136873",
      "original_text": "Registerbekanntmachung nach dem Umwandlungsgesetz\nHessen Amtsgericht Marburg HRB 7601\nAdvanced Food GmbH – Marburg",
      "type": "Registerbekanntmachung nach dem Umwandlungsgesetz",
      "state": "Hessen",
      "amtsgericht": "Amtsgericht Marburg",
      "registernummer": "HRB 7601",
      "registerart": "HRB",
      "company_name": "Advanced Food GmbH",
      "company_seat": "Marburg",
      "details": "10.11.2025 (Bekanntmachungsdatum)\n\nHessen Amtsgericht Marburg HRB 7601\nRegisterbekanntmachung nach dem Umwandlungsgesetz 10.11.2025 (Eintragungsdatum)\n\nAdvanced Food GmbH\nGesellschaft mit beschränkter Haftung\nMarburg\n\nDen Gläubigern der an der formwechselnden Umwandlung beteiligten Rechtsträger ist, wenn sie binnen sechs Monaten nach dem Tag, an dem die Eintragung der formwechselnden Umwandlung in das Register des Sitzes desjenigen Rechtsträgers, dessen Gläubiger sie sind, nach § 201 UmwG bekannt gemacht worden ist, ihren Anspruch nach Grund und Höhe schriftlich anmelden, Sicherheit zu leisten, soweit sie nicht Befriedigung verlangen können. Dieses Recht steht den Gläubigern jedoch nur zu, wenn sie glaubhaft machen, dass durch die formwechselnden Umwandlung die Erfüllung ihrer Forderung gefährdet wird."
    },
    {
      "date": "2025-11-10",
      "id": "136874",
      "original_text": "Registerbekanntmachung nach dem Umwandlungsgesetz\nHessen Amtsgericht Wiesbaden GsR 65\nConfluentia eGbR – Wiesbaden",
      "type": "Registerbekanntmachung nach dem Umwandlungsgesetz",
      "state": "Hessen",
      "amtsgericht": "Amtsgericht Wiesbaden",
      "registernummer": "GsR 65",
      "registerart": "GsR",
      "company_name": "Confluentia eGbR",
      "company_seat": "Wiesbaden",
      "details": "10.11.2025 (Bekanntmachungsdatum)\n\nHessen Amtsgericht Wiesbaden GsR 65\nRegisterbekanntmachung nach dem Umwandlungsgesetz 10.11.2025 (Eintragungsdatum)\n\nConfluentia eGbR\nGesellschaft bürgerlichen Rechts\nWiesbaden\n\nDen Gläubigern der an der formwechselnden Umwandlung beteiligten Rechtsträger ist, wenn sie binnen sechs Monaten nach dem Tag, an dem die Eintragung der formwechselnden Umwandlung in das Register des Sitzes derjenigen Rechtsträger deren Gläubiger sie sind, nach § 201 UmwG bekannt gemacht worden ist, ihren Anspruch nach Grund und Höhe schriftlich anmelden, Sicherheit zu leisten, soweit sie nicht Befriedigung verlangen können. Dieses Recht steht den Gläubigern jedoch nur zu, wenn sie glaubhaft machen, dass durch die formwechselnden Umwandlung die Erfüllung ihrer Forderung gefährdet wird."
    },
    {
      "date": "2025-11-10",
      "id": "136875",
      "original_text": "Sonstige Registerbekanntmachung\nHessen Amtsgericht Kassel VR 5484\nInitiative für wirtschaftliche Jugendbildung e.V. – Kassel",
      "type": "Sonstige Registerbekanntmachung",
      "state": "Hessen",
      "amtsgericht": "Amtsgericht Kassel",
      "registernummer": "VR 5484",
      "registerart": "VR",
      "company_name": "Initiative für wirtschaftliche Jugendbildung e.V.",
      "company_seat": "Kassel",
      "details": "10.11.2025 (Bekanntmachungsdatum)\n\nHessen Amtsgericht Kassel VR 5484\nSonstige Registerbekanntmachung 09.11.2025 (Eintragungsdatum)\n\nInitiative für wirtschaftliche Jugendbildung e.V.\neingetragener Verein\nKassel\n\nDer Verein ist aufgelöst."
    },
    {
      "date": "2025-11-10",
      "id": "136876",
      "original_text": "Registerbekanntmachung nach dem Umwandlungsgesetz\nHessen Amtsgericht Darmstadt HRB 108535\nHD Elektro Plus GmbH – Darmstadt",
      "type": "Registerbekanntmachung nach dem Umwandlungsgesetz",
      "state": "Hessen",
      "amtsgericht": "Amtsgericht Darmstadt",
      "registernummer": "HRB 108535",
      "registerart": "HRB",
      "company_name": "HD Elektro Plus GmbH",
      "company_seat": "Darmstadt",
      "details": "10.11.2025 (Bekanntmachungsdatum)\n\nHessen Amtsgericht Darmstadt HRB 108535\nRegisterbekanntmachung nach dem Umwandlungsgesetz 09.11.2025 (Eintragungsdatum)\n\nHD Elektro Plus GmbH\nGesellschaft mit beschränkter Haftung\nDarmstadt\n\nDen Gläubigern der an der formwechselnden Umwandlung beteiligten Rechtsträger ist, wenn sie binnen sechs Monaten nach dem Tag, an dem die Eintragung der formwechselnden Umwandlung in das Register des Sitzes desjenigen Rechtsträgers, dessen Gläubiger sie sind, nach § 201 UmwG bekannt gemacht worden ist, ihren Anspruch nach Grund und Höhe schriftlich anmelden, Sicherheit zu leisten, soweit sie nicht Befriedigung verlangen können. Dieses Recht steht den Gläubigern jedoch nur zu, wenn sie glaubhaft machen, dass durch die formwechselnden Umwandlung die Erfüllung ihrer Forderung gefährdet wird."
    },
    {
      "date": "2025-11-10",
      "id": "136877",
      "original_text": "Registerbekanntmachung nach dem Umwandlungsgesetz\nHessen Amtsgericht Wiesbaden HRA 10159\nORGLMEISTER Infrarot-Systeme GmbH & Co. KG – Walluf",
      "type": "Registerbekanntmachung nach dem Umwandlungsgesetz",
      "state": "Hessen",
      "amtsgericht": "Amtsgericht Wiesbaden",
      "registernummer": "HRA 10159",
      "registerart": "HRA",
      "company_name": "ORGLMEISTER Infrarot-Systeme GmbH & Co. KG",
      "company_seat": "Walluf",
      "details": "10.11.2025 (Bekanntmachungsdatum)\n\nHessen Amtsgericht Wiesbaden HRA 10159\nRegisterbekanntmachung nach dem Umwandlungsgesetz 10.11.2025 (Eintragungsdatum)\n\nORGLMEISTER Infrarot-Systeme GmbH & Co. KG\nKommanditgesellschaft\nWalluf\n\nDen Gläubigern der an der Verschmelzung beteiligten Rechtsträger ist, wenn sie binnen sechs Monaten nach dem Tag, an dem die Eintragung der Verschmelzung in das Register des Sitzes desjenigen Rechtsträgers, dessen Gläubiger sie sind, nach § 19 Absatz 3 UmwG bekannt gemacht worden ist, ihren Anspruch nach Grund und Höhe schriftlich anmelden, Sicherheit zu leisten, soweit sie nicht Befriedigung verlangen können. Dieses Recht steht den Gläubigern jedoch nur zu, wenn sie glaubhaft machen, dass durch die Verschmelzung die Erfüllung ihrer Forderung gefährdet wird."
    }
  ]
}