{
  "date": "2025-11-14",
  "date_of_scrape": "2025-11-15T04:08:48.614Z",
  "tool_version": "0.2.0",
  "number_of_announcements": 115,
  "announcements": [
    {
      "date": "2025-11-14",
      "id": "137299",
      "original_text": "Registerbekanntmachung nach dem Umwandlungsgesetz\nBayern Amtsgericht Nürnberg HRA 20473\nOprea Ioan-Adrian e.K. – Freystadt",
      "type": "Registerbekanntmachung nach dem Umwandlungsgesetz",
      "state": "Bayern",
      "amtsgericht": "Amtsgericht Nürnberg",
      "registernummer": "HRA 20473",
      "registerart": "HRA",
      "company_name": "Oprea Ioan-Adrian e.K.",
      "company_seat": "Freystadt",
      "details": "14.11.2025 (Bekanntmachungsdatum)\n\nBayern Amtsgericht Nürnberg HRA 20473\nRegisterbekanntmachung nach dem Umwandlungsgesetz 13.11.2025 (Eintragungsdatum)\n\nOprea Ioan-Adrian e.K.\nEinzelkaufmann / Einzelkauffrau\nFreystadt\n\nDen Gläubigern der an der Ausgliederung beteiligten Rechtsträger ist, wenn sie binnen sechs Monaten nach dem Tag, an dem die Eintragung der Ausgliederung in das Register des Sitzes desjenigen Rechtsträgers, dessen Gläubiger sie sind, nach §§ 125, 19 Abs. 3 UmwG als bekannt gemacht gilt, ihren Anspruch nach Grund und Höhe in Textform anmelden, Sicherheit zu leisten, soweit sie nicht Befriedigung verlangen können. Dieses Recht steht den Gläubigern jedoch nur zu, wenn sie glaubhaft machen, dass durch die Ausgliederung die Erfüllung ihrer Forderung gefährdet wird."
    },
    {
      "date": "2025-11-14",
      "id": "137300",
      "original_text": "Registerbekanntmachung nach dem Umwandlungsgesetz\nBayern Amtsgericht Nürnberg HRB 38503\nLEISTRITZ Entwicklungsgesellschaft mbH – Nürnberg",
      "type": "Registerbekanntmachung nach dem Umwandlungsgesetz",
      "state": "Bayern",
      "amtsgericht": "Amtsgericht Nürnberg",
      "registernummer": "HRB 38503",
      "registerart": "HRB",
      "company_name": "LEISTRITZ Entwicklungsgesellschaft mbH",
      "company_seat": "Nürnberg",
      "details": "14.11.2025 (Bekanntmachungsdatum)\n\nBayern Amtsgericht Nürnberg HRB 38503\nRegisterbekanntmachung nach dem Umwandlungsgesetz 13.11.2025 (Eintragungsdatum)\n\nLEISTRITZ Entwicklungsgesellschaft mbH\nGesellschaft mit beschränkter Haftung\nNürnberg\n\nDen Gläubigern der an der Verschmelzung beteiligten Rechtsträger ist, wenn sie binnen sechs Monaten nach dem Tag, an dem die Eintragung der Verschmelzung in das Register des Sitzes desjenigen Rechtsträgers, dessen Gläubiger sie sind, nach § 19 Abs. 3 UmwG als bekannt gemacht gilt, ihren Anspruch nach Grund und Höhe in Textform anmelden, Sicherheit zu leisten, soweit sie nicht Befriedigung verlangen können. Dieses Recht steht den Gläubigern jedoch nur zu, wenn sie glaubhaft machen, dass durch die Verschmelzung die Erfüllung ihrer Forderung gefährdet wird."
    },
    {
      "date": "2025-11-14",
      "id": "137301",
      "original_text": "Registerbekanntmachung nach dem Umwandlungsgesetz\nBayern Amtsgericht München HRB 304686\nXOLARIS Solution GmbH – München",
      "type": "Registerbekanntmachung nach dem Umwandlungsgesetz",
      "state": "Bayern",
      "amtsgericht": "Amtsgericht München",
      "registernummer": "HRB 304686",
      "registerart": "HRB",
      "company_name": "XOLARIS Solution GmbH",
      "company_seat": "München",
      "details": "14.11.2025 (Bekanntmachungsdatum)\n\nBayern Amtsgericht München HRB 304686\nRegisterbekanntmachung nach dem Umwandlungsgesetz 13.11.2025 (Eintragungsdatum)\n\nXOLARIS Solution GmbH\nGesellschaft mit beschränkter Haftung\nMünchen\n\nDen Gläubigern der an der Ausgliederung beteiligten Rechtsträger ist, wenn sie binnen sechs Monaten nach dem Tag, an dem die Eintragung der Ausgliederung in das Register des Sitzes desjenigen Rechtsträgers, dessen Gläubiger sie sind, nach §§ 125, 19 Abs. 3 UmwG als bekannt gemacht gilt, ihren Anspruch nach Grund und Höhe in Textform anmelden, Sicherheit zu leisten, soweit sie nicht Befriedigung verlangen können. Dieses Recht steht den Gläubigern jedoch nur zu, wenn sie glaubhaft machen, dass durch die Ausgliederung die Erfüllung ihrer Forderung gefährdet wird."
    },
    {
      "date": "2025-11-14",
      "id": "137302",
      "original_text": "Löschungsankündigung\nBayern Amtsgericht Augsburg HRB 30614\nFBT Deutschland GmbH – Augsburg",
      "type": "Löschungsankündigung",
      "state": "Bayern",
      "amtsgericht": "Amtsgericht Augsburg",
      "registernummer": "HRB 30614",
      "registerart": "HRB",
      "company_name": "FBT Deutschland GmbH",
      "company_seat": "Augsburg",
      "details": "14.11.2025 (Bekanntmachungsdatum)\n\nBayern Amtsgericht Augsburg HRB 30614\nLöschungsankündigung\n\nFBT Deutschland GmbH\nGesellschaft mit beschränkter Haftung\nAugsburg\n\nDas Registergericht beabsichtigt, die im Handelsregister eingetragene Gesellschaft wegen Vermögenslosigkeit von Amts wegen nach § 394 FamFG zu löschen. Die Frist zur Erhebung eines Widerspruchs ist auf einen Monat festgesetzt."
    },
    {
      "date": "2025-11-14",
      "id": "137303",
      "original_text": "Registerbekanntmachung nach dem Umwandlungsgesetz\nBayern Amtsgericht München HRB 281936\nPNZ C23 Beteiligungs UG (haftungsbeschränkt) – München",
      "type": "Registerbekanntmachung nach dem Umwandlungsgesetz",
      "state": "Bayern",
      "amtsgericht": "Amtsgericht München",
      "registernummer": "HRB 281936",
      "registerart": "HRB",
      "company_name": "PNZ C23 Beteiligungs UG (haftungsbeschränkt)",
      "company_seat": "München",
      "details": "14.11.2025 (Bekanntmachungsdatum)\n\nBayern Amtsgericht München HRB 281936\nRegisterbekanntmachung nach dem Umwandlungsgesetz 13.11.2025 (Eintragungsdatum)\n\nPNZ C23 Beteiligungs UG (haftungsbeschränkt)\nGesellschaft mit beschränkter Haftung\nMünchen\n\nDen Gläubigern der an der Verschmelzung beteiligten Rechtsträger ist, wenn sie binnen sechs Monaten nach dem Tag, an dem die Eintragung der Verschmelzung in das Register des Sitzes desjenigen Rechtsträgers, dessen Gläubiger sie sind, nach § 19 Abs. 3 UmwG als bekannt gemacht gilt, ihren Anspruch nach Grund und Höhe in Textform anmelden, Sicherheit zu leisten, soweit sie nicht Befriedigung verlangen können. Dieses Recht steht den Gläubigern jedoch nur zu, wenn sie glaubhaft machen, dass durch die Verschmelzung die Erfüllung ihrer Forderung gefährdet wird."
    },
    {
      "date": "2025-11-14",
      "id": "137304",
      "original_text": "Löschungsankündigung\nBayern Amtsgericht München HRB 165595\nTeam RZ IT-Dienstleistungen GmbH – Hohenbrunn",
      "type": "Löschungsankündigung",
      "state": "Bayern",
      "amtsgericht": "Amtsgericht München",
      "registernummer": "HRB 165595",
      "registerart": "HRB",
      "company_name": "Team RZ IT-Dienstleistungen GmbH",
      "company_seat": "Hohenbrunn",
      "details": "14.11.2025 (Bekanntmachungsdatum)\n\nBayern Amtsgericht München HRB 165595\nLöschungsankündigung\n\nTeam RZ IT-Dienstleistungen GmbH\nGesellschaft mit beschränkter Haftung\nHohenbrunn\n\nDas Registergericht beabsichtigt, die im Handelsregister eingetragene Gesellschaft wegen Vermögenslosigkeit von Amts wegen nach § 394 FamFG zu löschen. Die Frist zur Erhebung eines Widerspruchs ist auf drei Monate festgesetzt."
    },
    {
      "date": "2025-11-14",
      "id": "137305",
      "original_text": "Einreichung neuer Dokumente\nBayern Amtsgericht Kempten (Allgäu) HRB 5650\nStadtwerke Lindenberg GmbH – Lindenberg i. Allgäu",
      "type": "Einreichung neuer Dokumente",
      "state": "Bayern",
      "amtsgericht": "Amtsgericht Kempten (Allgäu)",
      "registernummer": "HRB 5650",
      "registerart": "HRB",
      "company_name": "Stadtwerke Lindenberg GmbH",
      "company_seat": "Lindenberg i. Allgäu",
      "details": "14.11.2025 (Bekanntmachungsdatum)\n\nBayern Amtsgericht Kempten (Allgäu) HRB 5650\nEinreichung neuer Dokumente 10.11.2025 (Eintragungsdatum)\n\nStadtwerke Lindenberg GmbH\nGesellschaft mit beschränkter Haftung\nLindenberg i. Allgäu\n\nDem Amtsgericht Kempten (Allgäu) -Registergericht- ist eine Liste der Mitglieder des Aufsichtsrats eingereicht worden, § 52 Abs. 3 S. 2 GmbHG."
    },
    {
      "date": "2025-11-14",
      "id": "137306",
      "original_text": "Einreichung neuer Dokumente\nBayern Amtsgericht Würzburg HRB 109\nKoenig & Bauer AG – Würzburg",
      "type": "Einreichung neuer Dokumente",
      "state": "Bayern",
      "amtsgericht": "Amtsgericht Würzburg",
      "registernummer": "HRB 109",
      "registerart": "HRB",
      "company_name": "Koenig & Bauer AG",
      "company_seat": "Würzburg",
      "details": "14.11.2025 (Bekanntmachungsdatum)\n\nBayern Amtsgericht Würzburg HRB 109\nEinreichung neuer Dokumente\n\nKoenig & Bauer AG\nAktiengesellschaft\nWürzburg\n\nDem Amtsgericht Würzburg -Registergericht- ist eine Liste der Mitglieder des Aufsichtsrats eingereicht worden, § 106 AktG."
    },
    {
      "date": "2025-11-14",
      "id": "137307",
      "original_text": "Einreichung neuer Dokumente\nBayern Amtsgericht München HRB 279857\nSW Immo AG – Grünwald",
      "type": "Einreichung neuer Dokumente",
      "state": "Bayern",
      "amtsgericht": "Amtsgericht München",
      "registernummer": "HRB 279857",
      "registerart": "HRB",
      "company_name": "SW Immo AG",
      "company_seat": "Grünwald",
      "details": "14.11.2025 (Bekanntmachungsdatum)\n\nBayern Amtsgericht München HRB 279857\nEinreichung neuer Dokumente\n\nSW Immo AG\nAktiengesellschaft\nGrünwald\n\nDem Amtsgericht München -Registergericht- ist eine Liste der Mitglieder des Aufsichtsrats eingereicht worden, § 106 AktG."
    },
    {
      "date": "2025-11-14",
      "id": "137308",
      "original_text": "Einreichung neuer Dokumente\nBayern Amtsgericht München HRB 132989\nMEAG MUNICH ERGO Kapitalanlagegesellschaft mbH – München",
      "type": "Einreichung neuer Dokumente",
      "state": "Bayern",
      "amtsgericht": "Amtsgericht München",
      "registernummer": "HRB 132989",
      "registerart": "HRB",
      "company_name": "MEAG MUNICH ERGO Kapitalanlagegesellschaft mbH",
      "company_seat": "München",
      "details": "14.11.2025 (Bekanntmachungsdatum)\n\nBayern Amtsgericht München HRB 132989\nEinreichung neuer Dokumente\n\nMEAG MUNICH ERGO Kapitalanlagegesellschaft mbH\nGesellschaft mit beschränkter Haftung\nMünchen\n\nDem #Re.Name ist eine Liste der Mitglieder des Aufsichtsrats eingereicht worden, § 52 Abs. 3 S. 2 GmbHG."
    },
    {
      "date": "2025-11-14",
      "id": "137309",
      "original_text": "Löschungsankündigung\nBayern Amtsgericht München HRA 112981\nSDS DE Dreiundzwanzig Immobilien GmbH & Co. KG – München",
      "type": "Löschungsankündigung",
      "state": "Bayern",
      "amtsgericht": "Amtsgericht München",
      "registernummer": "HRA 112981",
      "registerart": "HRA",
      "company_name": "SDS DE Dreiundzwanzig Immobilien GmbH & Co. KG",
      "company_seat": "München",
      "details": "14.11.2025 (Bekanntmachungsdatum)\n\nBayern Amtsgericht München HRA 112981\nLöschungsankündigung\n\nSDS DE Dreiundzwanzig Immobilien GmbH & Co. KG\nKommanditgesellschaft\nMünchen\n\nDas Registergericht beabsichtigt, die im Handelsregister eingetragene Firma von Amts wegen nach § 31 Abs. 2 HGB zu löschen. Die Frist zur Erhebung eines Widerspruchs ist auf drei Monate festgesetzt."
    },
    {
      "date": "2025-11-14",
      "id": "137310",
      "original_text": "Einreichung neuer Dokumente\nBayern Amtsgericht München HRB 59888\nThüga Aktiengesellschaft – München",
      "type": "Einreichung neuer Dokumente",
      "state": "Bayern",
      "amtsgericht": "Amtsgericht München",
      "registernummer": "HRB 59888",
      "registerart": "HRB",
      "company_name": "Thüga Aktiengesellschaft",
      "company_seat": "München",
      "details": "14.11.2025 (Bekanntmachungsdatum)\n\nBayern Amtsgericht München HRB 59888\nEinreichung neuer Dokumente\n\nThüga Aktiengesellschaft\nAktiengesellschaft\nMünchen\n\nDem Amtsgericht München -Registergericht- ist eine Liste der Mitglieder des Aufsichtsrats eingereicht worden, § 106 AktG."
    },
    {
      "date": "2025-11-14",
      "id": "137311",
      "original_text": "Einreichung neuer Dokumente\nBayern Amtsgericht Kempten (Allgäu) HRB 6408\nADC Automotive Distance Control Systems GmbH – Lindau (B)",
      "type": "Einreichung neuer Dokumente",
      "state": "Bayern",
      "amtsgericht": "Amtsgericht Kempten (Allgäu)",
      "registernummer": "HRB 6408",
      "registerart": "HRB",
      "company_name": "ADC Automotive Distance Control Systems GmbH",
      "company_seat": "Lindau (B)",
      "details": "14.11.2025 (Bekanntmachungsdatum)\n\nBayern Amtsgericht Kempten (Allgäu) HRB 6408\nEinreichung neuer Dokumente 13.11.2025 (Eintragungsdatum)\n\nADC Automotive Distance Control Systems GmbH\nGesellschaft mit beschränkter Haftung\nLindau (B)\n\nDem Amtsgericht Kempten (Allgäu) -Registergericht- ist eine Liste der Mitglieder des Aufsichtsrats eingereicht worden, § 52 Abs. 3 S. 2 GmbHG."
    },
    {
      "date": "2025-11-14",
      "id": "137312",
      "original_text": "Registerbekanntmachung nach dem Umwandlungsgesetz\nBayern Amtsgericht Nürnberg HRB 34507\nmaisells Verwaltungs GmbH – Lauf a.d.Pegnitz",
      "type": "Registerbekanntmachung nach dem Umwandlungsgesetz",
      "state": "Bayern",
      "amtsgericht": "Amtsgericht Nürnberg",
      "registernummer": "HRB 34507",
      "registerart": "HRB",
      "company_name": "maisells Verwaltungs GmbH",
      "company_seat": "Lauf a.d.Pegnitz",
      "details": "14.11.2025 (Bekanntmachungsdatum)\n\nBayern Amtsgericht Nürnberg HRB 34507\nRegisterbekanntmachung nach dem Umwandlungsgesetz 13.11.2025 (Eintragungsdatum)\n\nmaisells Verwaltungs GmbH\nGesellschaft mit beschränkter Haftung\nLauf a.d.Pegnitz\n\nDen Gläubigern der an der Verschmelzung beteiligten Rechtsträger ist, wenn sie binnen sechs Monaten nach dem Tag, an dem die Eintragung der Verschmelzung in das Register des Sitzes desjenigen Rechtsträgers, dessen Gläubiger sie sind, nach § 19 Abs. 3 UmwG als bekannt gemacht gilt, ihren Anspruch nach Grund und Höhe in Textform anmelden, Sicherheit zu leisten, soweit sie nicht Befriedigung verlangen können. Dieses Recht steht den Gläubigern jedoch nur zu, wenn sie glaubhaft machen, dass durch die Verschmelzung die Erfüllung ihrer Forderung gefährdet wird."
    },
    {
      "date": "2025-11-14",
      "id": "137313",
      "original_text": "Registerbekanntmachung nach dem Umwandlungsgesetz\nBayern Amtsgericht Augsburg HRB 41848\nPP Media MidCo GmbH – Kissing",
      "type": "Registerbekanntmachung nach dem Umwandlungsgesetz",
      "state": "Bayern",
      "amtsgericht": "Amtsgericht Augsburg",
      "registernummer": "HRB 41848",
      "registerart": "HRB",
      "company_name": "PP Media MidCo GmbH",
      "company_seat": "Kissing",
      "details": "14.11.2025 (Bekanntmachungsdatum)\n\nBayern Amtsgericht Augsburg HRB 41848\nRegisterbekanntmachung nach dem Umwandlungsgesetz 13.11.2025 (Eintragungsdatum)\n\nPP Media MidCo GmbH\nGesellschaft mit beschränkter Haftung\nKissing\n\nDen Gläubigern des formwechselnden Rechtsträgers ist, wenn sie binnen sechs Monaten nach dem Tag, an dem die Eintragung des Formwechsels nach § 201 UmwG als bekannt gemacht gilt, ihren Anspruch nach Grund und Höhe in Textform anmelden, Sicherheit zu leisten, soweit sie nicht Befriedigung verlangen können. Dieses Recht steht den Gläubigern jedoch nur zu, wenn sie glaubhaft machen, dass durch den Formwechsel die Erfüllung ihrer Forderung gefährdet wird."
    },
    {
      "date": "2025-11-14",
      "id": "137314",
      "original_text": "Registerbekanntmachung nach dem Umwandlungsgesetz\nBayern Amtsgericht Nürnberg HRB 44833\nNisoma Holding GmbH – Nürnberg",
      "type": "Registerbekanntmachung nach dem Umwandlungsgesetz",
      "state": "Bayern",
      "amtsgericht": "Amtsgericht Nürnberg",
      "registernummer": "HRB 44833",
      "registerart": "HRB",
      "company_name": "Nisoma Holding GmbH",
      "company_seat": "Nürnberg",
      "details": "14.11.2025 (Bekanntmachungsdatum)\n\nBayern Amtsgericht Nürnberg HRB 44833\nRegisterbekanntmachung nach dem Umwandlungsgesetz 13.11.2025 (Eintragungsdatum)\n\nNisoma Holding GmbH\nGesellschaft mit beschränkter Haftung\nNürnberg\n\nDen Gläubigern der an der Ausgliederung beteiligten Rechtsträger ist, wenn sie binnen sechs Monaten nach dem Tag, an dem die Eintragung der Ausgliederung in das Register des Sitzes desjenigen Rechtsträgers, dessen Gläubiger sie sind, nach §§ 125, 19 Abs. 3 UmwG als bekannt gemacht gilt, ihren Anspruch nach Grund und Höhe in Textform anmelden, Sicherheit zu leisten, soweit sie nicht Befriedigung verlangen können. Dieses Recht steht den Gläubigern jedoch nur zu, wenn sie glaubhaft machen, dass durch die Ausgliederung die Erfüllung ihrer Forderung gefährdet wird."
    },
    {
      "date": "2025-11-14",
      "id": "137315",
      "original_text": "Registerbekanntmachung nach dem Umwandlungsgesetz\nBayern Amtsgericht München HRB 304107\nFizard Automation GmbH – München",
      "type": "Registerbekanntmachung nach dem Umwandlungsgesetz",
      "state": "Bayern",
      "amtsgericht": "Amtsgericht München",
      "registernummer": "HRB 304107",
      "registerart": "HRB",
      "company_name": "Fizard Automation GmbH",
      "company_seat": "München",
      "details": "14.11.2025 (Bekanntmachungsdatum)\n\nBayern Amtsgericht München HRB 304107\nRegisterbekanntmachung nach dem Umwandlungsgesetz 13.11.2025 (Eintragungsdatum)\n\nFizard Automation GmbH\nGesellschaft mit beschränkter Haftung\nMünchen\n\nDen Gläubigern der an der Verschmelzung beteiligten Rechtsträger ist, wenn sie binnen sechs Monaten nach dem Tag, an dem die Eintragung der Verschmelzung in das Register des Sitzes desjenigen Rechtsträgers, dessen Gläubiger sie sind, nach § 19 Abs. 3 UmwG als bekannt gemacht gilt, ihren Anspruch nach Grund und Höhe in Textform anmelden, Sicherheit zu leisten, soweit sie nicht Befriedigung verlangen können. Dieses Recht steht den Gläubigern jedoch nur zu, wenn sie glaubhaft machen, dass durch die Verschmelzung die Erfüllung ihrer Forderung gefährdet wird."
    },
    {
      "date": "2025-11-14",
      "id": "137316",
      "original_text": "Registerbekanntmachung nach dem Umwandlungsgesetz\nBayern Amtsgericht Nürnberg HRA 20443\nAndreas Gödel e.K. – Schwabach",
      "type": "Registerbekanntmachung nach dem Umwandlungsgesetz",
      "state": "Bayern",
      "amtsgericht": "Amtsgericht Nürnberg",
      "registernummer": "HRA 20443",
      "registerart": "HRA",
      "company_name": "Andreas Gödel e.K.",
      "company_seat": "Schwabach",
      "details": "14.11.2025 (Bekanntmachungsdatum)\n\nBayern Amtsgericht Nürnberg HRA 20443\nRegisterbekanntmachung nach dem Umwandlungsgesetz 13.11.2025 (Eintragungsdatum)\n\nAndreas Gödel e.K.\nEinzelkaufmann / Einzelkauffrau\nSchwabach\n\nDen Gläubigern der an der Ausgliederung beteiligten Rechtsträger ist, wenn sie binnen sechs Monaten nach dem Tag, an dem die Eintragung der Ausgliederung in das Register des Sitzes desjenigen Rechtsträgers, dessen Gläubiger sie sind, nach §§ 125, 19 Abs. 3 UmwG als bekannt gemacht gilt, ihren Anspruch nach Grund und Höhe in Textform anmelden, Sicherheit zu leisten, soweit sie nicht Befriedigung verlangen können. Dieses Recht steht den Gläubigern jedoch nur zu, wenn sie glaubhaft machen, dass durch die Ausgliederung die Erfüllung ihrer Forderung gefährdet wird."
    },
    {
      "date": "2025-11-14",
      "id": "137317",
      "original_text": "Sonstige Registerbekanntmachung\nBayern Amtsgericht Bayreuth HRB 1025\nS.A.G. Service und Anlagen GmbH – Neudrossenfeld",
      "type": "Sonstige Registerbekanntmachung",
      "state": "Bayern",
      "amtsgericht": "Amtsgericht Bayreuth",
      "registernummer": "HRB 1025",
      "registerart": "HRB",
      "company_name": "S.A.G. Service und Anlagen GmbH",
      "company_seat": "Neudrossenfeld",
      "details": "14.11.2025 (Bekanntmachungsdatum)\n\nBayern Amtsgericht Bayreuth HRB 1025\nSonstige Registerbekanntmachung 13.11.2025 (Eintragungsdatum)\n\nS.A.G. Service und Anlagen GmbH\nGesellschaft mit beschränkter Haftung\nNeudrossenfeld\n\nDen Gläubigern der an der Verschmelzung beteiligten Rechtsträger ist, wenn sie binnen sechs Monaten nach dem Tag, an dem die Eintragung der Verschmelzung in das Register des Sitzes desjenigen Rechtsträgers, dessen Gläubiger sie sind, nach § 19 Abs. 3 UmwG als bekannt gemacht gilt, ihren Anspruch nach Grund und Höhe in Textform anmelden, Sicherheit zu leisten, soweit sie nicht Befriedigung verlangen können. Dieses Recht steht den Gläubigern jedoch nur zu, wenn sie glaubhaft machen, dass durch die Verschmelzung die Erfüllung ihrer Forderung gefährdet wird."
    },
    {
      "date": "2025-11-14",
      "id": "137318",
      "original_text": "Registerbekanntmachung nach dem Umwandlungsgesetz\nBayern Amtsgericht Nürnberg HRA 19251\nINOVA.HAUS Immobilienverwaltung e.K. – Nürnberg",
      "type": "Registerbekanntmachung nach dem Umwandlungsgesetz",
      "state": "Bayern",
      "amtsgericht": "Amtsgericht Nürnberg",
      "registernummer": "HRA 19251",
      "registerart": "HRA",
      "company_name": "INOVA.HAUS Immobilienverwaltung e.K.",
      "company_seat": "Nürnberg",
      "details": "14.11.2025 (Bekanntmachungsdatum)\n\nBayern Amtsgericht Nürnberg HRA 19251\nRegisterbekanntmachung nach dem Umwandlungsgesetz 13.11.2025 (Eintragungsdatum)\n\nINOVA.HAUS Immobilienverwaltung e.K.\nEinzelkaufmann / Einzelkauffrau\nNürnberg\n\nDen Gläubigern der an der Ausgliederung beteiligten Rechtsträger ist, wenn sie binnen sechs Monaten nach dem Tag, an dem die Eintragung der Ausgliederung in das Register des Sitzes desjenigen Rechtsträgers, dessen Gläubiger sie sind, nach §§ 125, 19 Abs. 3 UmwG als bekannt gemacht gilt, ihren Anspruch nach Grund und Höhe in Textform anmelden, Sicherheit zu leisten, soweit sie nicht Befriedigung verlangen können. Dieses Recht steht den Gläubigern jedoch nur zu, wenn sie glaubhaft machen, dass durch die Ausgliederung die Erfüllung ihrer Forderung gefährdet wird."
    },
    {
      "date": "2025-11-14",
      "id": "137319",
      "original_text": "Löschungsankündigung\nBayern Amtsgericht Würzburg HRB 1700\nSchenkel Wohnbau GmbH – Kitzingen",
      "type": "Löschungsankündigung",
      "state": "Bayern",
      "amtsgericht": "Amtsgericht Würzburg",
      "registernummer": "HRB 1700",
      "registerart": "HRB",
      "company_name": "Schenkel Wohnbau GmbH",
      "company_seat": "Kitzingen",
      "details": "14.11.2025 (Bekanntmachungsdatum)\n\nBayern Amtsgericht Würzburg HRB 1700\nLöschungsankündigung\n\nSchenkel Wohnbau GmbH\nGesellschaft mit beschränkter Haftung\nKitzingen\n\nDas Registergericht beabsichtigt, die im Handelsregister eingetragene Gesellschaft wegen Vermögenslosigkeit von Amts wegen nach § 394 FamFG zu löschen. Die Frist zur Erhebung eines Widerspruchs ist auf drei Monate festgesetzt."
    },
    {
      "date": "2025-11-14",
      "id": "137320",
      "original_text": "Registerbekanntmachung nach dem Umwandlungsgesetz\nBayern Amtsgericht München HRB 281936\nPNZ C23 Beteiligungs UG (haftungsbeschränkt) – München",
      "type": "Registerbekanntmachung nach dem Umwandlungsgesetz",
      "state": "Bayern",
      "amtsgericht": "Amtsgericht München",
      "registernummer": "HRB 281936",
      "registerart": "HRB",
      "company_name": "PNZ C23 Beteiligungs UG (haftungsbeschränkt)",
      "company_seat": "München",
      "details": "14.11.2025 (Bekanntmachungsdatum)\n\nBayern Amtsgericht München HRB 281936\nRegisterbekanntmachung nach dem Umwandlungsgesetz 13.11.2025 (Eintragungsdatum)\n\nPNZ C23 Beteiligungs UG (haftungsbeschränkt)\nGesellschaft mit beschränkter Haftung\nMünchen\n\nDen Gläubigern der an der Verschmelzung beteiligten Rechtsträger ist, wenn sie binnen sechs Monaten nach dem Tag, an dem die Eintragung der Verschmelzung in das Register des Sitzes desjenigen Rechtsträgers, dessen Gläubiger sie sind, nach § 19 Abs. 3 UmwG als bekannt gemacht gilt, ihren Anspruch nach Grund und Höhe in Textform anmelden, Sicherheit zu leisten, soweit sie nicht Befriedigung verlangen können. Dieses Recht steht den Gläubigern jedoch nur zu, wenn sie glaubhaft machen, dass durch die Verschmelzung die Erfüllung ihrer Forderung gefährdet wird."
    },
    {
      "date": "2025-11-14",
      "id": "137321",
      "original_text": "Löschungsankündigung\nBayern Amtsgericht München HRB 237189\nSVV-Bau GmbH – Aßling",
      "type": "Löschungsankündigung",
      "state": "Bayern",
      "amtsgericht": "Amtsgericht München",
      "registernummer": "HRB 237189",
      "registerart": "HRB",
      "company_name": "SVV-Bau GmbH",
      "company_seat": "Aßling",
      "details": "14.11.2025 (Bekanntmachungsdatum)\n\nBayern Amtsgericht München HRB 237189\nLöschungsankündigung\n\nSVV-Bau GmbH\nGesellschaft mit beschränkter Haftung\nAßling\n\nDas Registergericht beabsichtigt, die im Handelsregister eingetragene Gesellschaft wegen Vermögenslosigkeit von Amts wegen nach § 394 FamFG zu löschen. Die Frist zur Erhebung eines Widerspruchs ist auf drei Monate festgesetzt."
    },
    {
      "date": "2025-11-14",
      "id": "137322",
      "original_text": "Registerbekanntmachung nach dem Umwandlungsgesetz\nBayern Amtsgericht München HRB 264635\nPanaleo GP GmbH – München",
      "type": "Registerbekanntmachung nach dem Umwandlungsgesetz",
      "state": "Bayern",
      "amtsgericht": "Amtsgericht München",
      "registernummer": "HRB 264635",
      "registerart": "HRB",
      "company_name": "Panaleo GP GmbH",
      "company_seat": "München",
      "details": "14.11.2025 (Bekanntmachungsdatum)\n\nBayern Amtsgericht München HRB 264635\nRegisterbekanntmachung nach dem Umwandlungsgesetz 13.11.2025 (Eintragungsdatum)\n\nPanaleo GP GmbH\nGesellschaft mit beschränkter Haftung\nMünchen\n\nDen Gläubigern der an der Verschmelzung beteiligten Rechtsträger ist, wenn sie binnen sechs Monaten nach dem Tag, an dem die Eintragung der Verschmelzung in das Register des Sitzes desjenigen Rechtsträgers, dessen Gläubiger sie sind, nach § 19 Abs. 3 UmwG als bekannt gemacht gilt, ihren Anspruch nach Grund und Höhe in Textform anmelden, Sicherheit zu leisten, soweit sie nicht Befriedigung verlangen können. Dieses Recht steht den Gläubigern jedoch nur zu, wenn sie glaubhaft machen, dass durch die Verschmelzung die Erfüllung ihrer Forderung gefährdet wird."
    },
    {
      "date": "2025-11-14",
      "id": "137323",
      "original_text": "Einreichung neuer Dokumente\nBerlin Amtsgericht Berlin (Charlottenburg) HRB 189716\nMOIA GmbH – Berlin",
      "type": "Einreichung neuer Dokumente",
      "state": "Berlin",
      "amtsgericht": "Amtsgericht Berlin (Charlottenburg)",
      "registernummer": "HRB 189716",
      "registerart": "HRB",
      "company_name": "MOIA GmbH",
      "company_seat": "Berlin",
      "details": "14.11.2025 (Bekanntmachungsdatum)\n\nBerlin Amtsgericht Berlin (Charlottenburg) HRB 189716\nEinreichung neuer Dokumente\n\nMOIA GmbH\nGesellschaft mit beschränkter Haftung\nBerlin\n\nAls nicht eingetragen wird veröffentlicht: Es wurde eine neue Liste der Aufsichtsratsmitglieder eingereicht (§52 GmbHG)."
    },
    {
      "date": "2025-11-14",
      "id": "137324",
      "original_text": "Löschungsankündigung\nBerlin Amtsgericht Berlin (Charlottenburg) HRB 221701\nBini GmbH – Berlin",
      "type": "Löschungsankündigung",
      "state": "Berlin",
      "amtsgericht": "Amtsgericht Berlin (Charlottenburg)",
      "registernummer": "HRB 221701",
      "registerart": "HRB",
      "company_name": "Bini GmbH",
      "company_seat": "Berlin",
      "details": "14.11.2025 (Bekanntmachungsdatum)\n\nBerlin Amtsgericht Berlin (Charlottenburg) HRB 221701\nLöschungsankündigung\n\nBini GmbH\nGesellschaft mit beschränkter Haftung\nBerlin\n\nBei der nachstehenden Gesellschaft wird das Amtslöschungsverfahren gemäß § 394 FamFG eingeleitet. Widerspruchsfrist 6 Wochen"
    },
    {
      "date": "2025-11-14",
      "id": "137325",
      "original_text": "Löschungsankündigung\nBerlin Amtsgericht Berlin (Charlottenburg) HRB 198285\nStern Design GmbH – Berlin",
      "type": "Löschungsankündigung",
      "state": "Berlin",
      "amtsgericht": "Amtsgericht Berlin (Charlottenburg)",
      "registernummer": "HRB 198285",
      "registerart": "HRB",
      "company_name": "Stern Design GmbH",
      "company_seat": "Berlin",
      "details": "14.11.2025 (Bekanntmachungsdatum)\n\nBerlin Amtsgericht Berlin (Charlottenburg) HRB 198285\nLöschungsankündigung\n\nStern Design GmbH\nGesellschaft mit beschränkter Haftung\nBerlin\n\nEs ist beabsichtigt, die Eintragung der Geschäftsführerin Zuzanna Teresa Stern wegen Mangels einer wesentlichen Voraussetzung gemäß § 395 FamFG von Amts wegen zu löschen. Widerspruchsfrist: 2 Wochen."
    },
    {
      "date": "2025-11-14",
      "id": "137326",
      "original_text": "Löschungsankündigung\nBerlin Amtsgericht Berlin (Charlottenburg) HRB 100375\nObjekt-Marketing & Development AG – Berlin",
      "type": "Löschungsankündigung",
      "state": "Berlin",
      "amtsgericht": "Amtsgericht Berlin (Charlottenburg)",
      "registernummer": "HRB 100375",
      "registerart": "HRB",
      "company_name": "Objekt-Marketing & Development AG",
      "company_seat": "Berlin",
      "details": "14.11.2025 (Bekanntmachungsdatum)\n\nBerlin Amtsgericht Berlin (Charlottenburg) HRB 100375\nLöschungsankündigung\n\nObjekt-Marketing & Development AG\nAktiengesellschaft\nBerlin\n\nBei der nachstehenden Gesellschaft wird das Amtslöschungsverfahren gemäß § 394 FamFG eingeleitet. Widerspruchsfrist 6 Wochen"
    },
    {
      "date": "2025-11-14",
      "id": "137327",
      "original_text": "Löschungsankündigung\nBerlin Amtsgericht Berlin (Charlottenburg) HRB 251374\nCycle medical GmbH – Berlin",
      "type": "Löschungsankündigung",
      "state": "Berlin",
      "amtsgericht": "Amtsgericht Berlin (Charlottenburg)",
      "registernummer": "HRB 251374",
      "registerart": "HRB",
      "company_name": "Cycle medical GmbH",
      "company_seat": "Berlin",
      "details": "14.11.2025 (Bekanntmachungsdatum)\n\nBerlin Amtsgericht Berlin (Charlottenburg) HRB 251374\nLöschungsankündigung\n\nCycle medical GmbH\nGesellschaft mit beschränkter Haftung\nBerlin\n\nBei der nachstehenden Gesellschaft wird das Amtslöschungsverfahren gemäß § 394 FamFG eingeleitet. Widerspruchsfrist 6 Wochen"
    },
    {
      "date": "2025-11-14",
      "id": "137328",
      "original_text": "Löschungsankündigung\nBerlin Amtsgericht Berlin (Charlottenburg) HRB 257336\nKM-Industrie GmbH – Berlin",
      "type": "Löschungsankündigung",
      "state": "Berlin",
      "amtsgericht": "Amtsgericht Berlin (Charlottenburg)",
      "registernummer": "HRB 257336",
      "registerart": "HRB",
      "company_name": "KM-Industrie GmbH",
      "company_seat": "Berlin",
      "details": "14.11.2025 (Bekanntmachungsdatum)\n\nBerlin Amtsgericht Berlin (Charlottenburg) HRB 257336\nLöschungsankündigung\n\nKM-Industrie GmbH\nGesellschaft mit beschränkter Haftung\nBerlin\n\nBei der nachstehenden Gesellschaft wird das Amtslöschungsverfahren gemäß § 394 FamFG eingeleitet. Widerspruchsfrist 6 Wochen"
    },
    {
      "date": "2025-11-14",
      "id": "137329",
      "original_text": "Löschungsankündigung\nBerlin Amtsgericht Berlin (Charlottenburg) HRB 109736\nClean Air Bike GmbH – Berlin",
      "type": "Löschungsankündigung",
      "state": "Berlin",
      "amtsgericht": "Amtsgericht Berlin (Charlottenburg)",
      "registernummer": "HRB 109736",
      "registerart": "HRB",
      "company_name": "Clean Air Bike GmbH",
      "company_seat": "Berlin",
      "details": "14.11.2025 (Bekanntmachungsdatum)\n\nBerlin Amtsgericht Berlin (Charlottenburg) HRB 109736\nLöschungsankündigung\n\nClean Air Bike GmbH\nGesellschaft mit beschränkter Haftung\nBerlin\n\nBei der nachstehenden Gesellschaft wird das Amtslöschungsverfahren gemäß § 394 FamFG eingeleitet. Widerspruchsfrist 6 Wochen"
    },
    {
      "date": "2025-11-14",
      "id": "137330",
      "original_text": "Löschungsankündigung\nBerlin Amtsgericht Berlin (Charlottenburg) HRB 213737\nPoke Mana VMT UG (haftungsbeschränkt) – Berlin",
      "type": "Löschungsankündigung",
      "state": "Berlin",
      "amtsgericht": "Amtsgericht Berlin (Charlottenburg)",
      "registernummer": "HRB 213737",
      "registerart": "HRB",
      "company_name": "Poke Mana VMT UG (haftungsbeschränkt)",
      "company_seat": "Berlin",
      "details": "14.11.2025 (Bekanntmachungsdatum)\n\nBerlin Amtsgericht Berlin (Charlottenburg) HRB 213737\nLöschungsankündigung\n\nPoke Mana VMT UG (haftungsbeschränkt)\nGesellschaft mit beschränkter Haftung\nBerlin\n\nBei der nachstehenden Gesellschaft wird das Amtslöschungsverfahren gemäß § 394 FamFG eingeleitet. Widerspruchsfrist 6 Wochen"
    },
    {
      "date": "2025-11-14",
      "id": "137331",
      "original_text": "Löschungsankündigung\nBerlin Amtsgericht Berlin (Charlottenburg) HRB 144033\nCadus Consulting UG (haftungsbeschränkt) – Berlin",
      "type": "Löschungsankündigung",
      "state": "Berlin",
      "amtsgericht": "Amtsgericht Berlin (Charlottenburg)",
      "registernummer": "HRB 144033",
      "registerart": "HRB",
      "company_name": "Cadus Consulting UG (haftungsbeschränkt)",
      "company_seat": "Berlin",
      "details": "14.11.2025 (Bekanntmachungsdatum)\n\nBerlin Amtsgericht Berlin (Charlottenburg) HRB 144033\nLöschungsankündigung\n\nCadus Consulting UG (haftungsbeschränkt)\nGesellschaft mit beschränkter Haftung\nBerlin\n\nBei der nachstehenden Gesellschaft wird das Amtslöschungsverfahren gemäß § 394 FamFG eingeleitet. Widerspruchsfrist 6 Wochen"
    },
    {
      "date": "2025-11-14",
      "id": "137332",
      "original_text": "Registerbekanntmachung nach dem Umwandlungsgesetz\nBaden-Württemberg Amtsgericht Mannheim HRA 712351\nAutohaus Bader Nadin Badr e.K. – Hockenheim",
      "type": "Registerbekanntmachung nach dem Umwandlungsgesetz",
      "state": "Baden-Württemberg",
      "amtsgericht": "Amtsgericht Mannheim",
      "registernummer": "HRA 712351",
      "registerart": "HRA",
      "company_name": "Autohaus Bader Nadin Badr e.K.",
      "company_seat": "Hockenheim",
      "details": "14.11.2025 (Bekanntmachungsdatum)\n\nBaden-Württemberg Amtsgericht Mannheim HRA 712351\nRegisterbekanntmachung nach dem Umwandlungsgesetz 14.11.2025 (Eintragungsdatum)\n\nAutohaus Bader Nadin Badr e.K.\nEinzelkaufmann / Einzelkauffrau\nHockenheim\n\nAls nicht eingetragen wird bekanntgemacht:\nDen Gläubigern der an der Ausgliederung beteiligten Rechtsträger ist, wenn sie binnen sechs Monaten nach dem Tag, an dem die Eintragung der Ausgliederung in das Register des Sitzes desjenigen Rechtsträgers, dessen Gläubiger sie sind, nach § 19 Abs. 3 UmwG als bekanntgemacht gilt, ihren Anspruch nach Grund und Höhe schriftlich anmelden, Sicherheit zu leisten, soweit sie nicht Befriedigung verlangen können. Dieses Recht steht den Gläubigern jedoch nur zu, wenn sie glaubhaft machen, dass durch die Ausgliederung die Erfüllung ihrer Forderung gefährdet wird."
    },
    {
      "date": "2025-11-14",
      "id": "137333",
      "original_text": "Einreichung neuer Dokumente\nBaden-Württemberg Amtsgericht Stuttgart HRB 570105\nBausparkasse Schwäbisch Hall Aktiengesellschaft - Bausparkasse der Volksbanken und Raiffeisenbanken - – Schwäbisch Hall",
      "type": "Einreichung neuer Dokumente",
      "state": "Baden-Württemberg",
      "amtsgericht": "Amtsgericht Stuttgart",
      "registernummer": "HRB 570105",
      "registerart": "HRB",
      "company_name": "Bausparkasse Schwäbisch Hall Aktiengesellschaft - Bausparkasse der Volksbanken und Raiffeisenbanken -",
      "company_seat": "Schwäbisch Hall",
      "details": "14.11.2025 (Bekanntmachungsdatum)\n\nBaden-Württemberg Amtsgericht Stuttgart HRB 570105\nEinreichung neuer Dokumente\n\nBausparkasse Schwäbisch Hall Aktiengesellschaft - Bausparkasse der Volksbanken und Raiffeisenbanken -\nAktiengesellschaft\nSchwäbisch Hall\n\nDie Gesellschaft hat am 13.11.2025 die Liste über die Zusammensetzung des Aufsichtsrats zum Handelsregister eingereicht."
    },
    {
      "date": "2025-11-14",
      "id": "137334",
      "original_text": "Registerbekanntmachung nach dem Umwandlungsgesetz\nBaden-Württemberg Amtsgericht Mannheim HRB 754192\nBader Automobile GmbH – Hockenheim",
      "type": "Registerbekanntmachung nach dem Umwandlungsgesetz",
      "state": "Baden-Württemberg",
      "amtsgericht": "Amtsgericht Mannheim",
      "registernummer": "HRB 754192",
      "registerart": "HRB",
      "company_name": "Bader Automobile GmbH",
      "company_seat": "Hockenheim",
      "details": "14.11.2025 (Bekanntmachungsdatum)\n\nBaden-Württemberg Amtsgericht Mannheim HRB 754192\nRegisterbekanntmachung nach dem Umwandlungsgesetz 14.11.2025 (Eintragungsdatum)\n\nBader Automobile GmbH\nGesellschaft mit beschränkter Haftung\nHockenheim\n\nAls nicht eingetragen wird bekanntgemacht:\nDen Gläubigern der an der Ausgliederung beteiligten Rechtsträger ist, wenn sie binnen sechs Monaten nach dem Tag, an dem die Eintragung der Ausgliederung in das Register des Sitzes desjenigen Rechtsträgers, dessen Gläubiger sie sind, nach § 19 Abs. 3 UmwG als bekanntgemacht gilt, ihren Anspruch nach Grund und Höhe schriftlich anmelden, Sicherheit zu leisten, soweit sie nicht Befriedigung verlangen können. Dieses Recht steht den Gläubigern jedoch nur zu, wenn sie glaubhaft machen, dass durch die Ausgliederung die Erfüllung ihrer Forderung gefährdet wird."
    },
    {
      "date": "2025-11-14",
      "id": "137335",
      "original_text": "Einreichung neuer Dokumente\nBerlin Amtsgericht Berlin (Charlottenburg) HRB 57494\nTotalEnergies Marketing Deutschland GmbH – Berlin",
      "type": "Einreichung neuer Dokumente",
      "state": "Berlin",
      "amtsgericht": "Amtsgericht Berlin (Charlottenburg)",
      "registernummer": "HRB 57494",
      "registerart": "HRB",
      "company_name": "TotalEnergies Marketing Deutschland GmbH",
      "company_seat": "Berlin",
      "details": "14.11.2025 (Bekanntmachungsdatum)\n\nBerlin Amtsgericht Berlin (Charlottenburg) HRB 57494\nEinreichung neuer Dokumente\n\nTotalEnergies Marketing Deutschland GmbH\nGesellschaft mit beschränkter Haftung\nBerlin\n\nAls nicht eingetragen wird veröffentlicht: Es wurde eine neue Liste der Aufsichtsratsmitglieder eingereicht (§52 GmbHG)."
    },
    {
      "date": "2025-11-14",
      "id": "137336",
      "original_text": "Registerbekanntmachung nach dem Umwandlungsgesetz\nBaden-Württemberg Amtsgericht Stuttgart HRB 798690\nWhyConsult UG (haftungsbeschränkt) – Ludwigsburg",
      "type": "Registerbekanntmachung nach dem Umwandlungsgesetz",
      "state": "Baden-Württemberg",
      "amtsgericht": "Amtsgericht Stuttgart",
      "registernummer": "HRB 798690",
      "registerart": "HRB",
      "company_name": "WhyConsult UG (haftungsbeschränkt)",
      "company_seat": "Ludwigsburg",
      "details": "14.11.2025 (Bekanntmachungsdatum)\n\nBaden-Württemberg Amtsgericht Stuttgart HRB 798690\nRegisterbekanntmachung nach dem Umwandlungsgesetz 14.11.2025 (Eintragungsdatum)\n\nWhyConsult UG (haftungsbeschränkt)\nGesellschaft mit beschränkter Haftung\nLudwigsburg\n\nAls nicht eingetragen wird bekanntgemacht:\nDen Gläubigern der an der Verschmelzung beteiligten Rechtsträger ist, wenn sie binnen sechs Monaten nach dem Tag, an dem die Eintragung der Verschmelzung in das Register des Sitzes desjenigen Rechtsträgers, dessen Gläubiger sie sind, nach § 19 Abs. 3 UmwG als bekanntgemacht gilt, ihren Anspruch nach Grund und Höhe schriftlich anmelden, Sicherheit zu leisten, soweit sie nicht Befriedigung verlangen können. Dieses Recht steht den Gläubigern jedoch nur zu, wenn sie glaubhaft machen, dass durch die Verschmelzung die Erfüllung ihrer Forderung gefährdet wird."
    },
    {
      "date": "2025-11-14",
      "id": "137337",
      "original_text": "Registerbekanntmachung nach dem Umwandlungsgesetz\nHamburg Amtsgericht Hamburg HRB 46289\nPaaschburg & Wunderlich GmbH – Hamburg",
      "type": "Registerbekanntmachung nach dem Umwandlungsgesetz",
      "state": "Hamburg",
      "amtsgericht": "Amtsgericht Hamburg",
      "registernummer": "HRB 46289",
      "registerart": "HRB",
      "company_name": "Paaschburg & Wunderlich GmbH",
      "company_seat": "Hamburg",
      "details": "14.11.2025 (Bekanntmachungsdatum)\n\nHamburg Amtsgericht Hamburg HRB 46289\nRegisterbekanntmachung nach dem Umwandlungsgesetz 14.11.2025 (Eintragungsdatum)\n\nPaaschburg & Wunderlich GmbH\nGesellschaft mit beschränkter Haftung\nHamburg\n\nAls nicht eingetragen wird bekannt gemacht:\nDen Gläubigern der an der Verschmelzung beteiligten Gesellschaften ist, wenn sie binnen sechs Monaten nach dem Tag, an dem die Eintragung der Verschmelzung in das Register des Sitzes desjenigen Rechtsträgers, dessen Gläubiger sie sind, nach § 19 Absatz 3 UmwG als bekannt gemacht gilt, ihren Anspruch nach Grund und Höhe schriftlich anmelden, Sicherheit zu leisten, soweit sie nicht Befriedigung verlangen können. Dieses Recht steht den Gläubigern jedoch nur zu, wenn sie glaubhaft machen, dass durch die Verschmelzung die Erfüllung ihrer Forderung gefährdet wird."
    },
    {
      "date": "2025-11-14",
      "id": "137338",
      "original_text": "Löschungsankündigung\nSchleswig-Holstein Amtsgericht Lübeck HRA 9512\nTaxi Harms Travemünde UG (haftungsbeschränkt) & Co. KG – Lübeck",
      "type": "Löschungsankündigung",
      "state": "Schleswig-Holstein",
      "amtsgericht": "Amtsgericht Lübeck",
      "registernummer": "HRA 9512",
      "registerart": "HRA",
      "company_name": "Taxi Harms Travemünde UG (haftungsbeschränkt) & Co. KG",
      "company_seat": "Lübeck",
      "details": "14.11.2025 (Bekanntmachungsdatum)\n\nSchleswig-Holstein Amtsgericht Lübeck HRA 9512\nLöschungsankündigung\n\nTaxi Harms Travemünde UG (haftungsbeschränkt) & Co. KG\nKommanditgesellschaft\nLübeck\n\nEs ist die Löschung der nachstehenden Gesellschaft wegen Vermögenslosigkeit gemäß § 394 FamFG beabsichtigt.\nWiderspruchsfrist: 1 Monat."
    },
    {
      "date": "2025-11-14",
      "id": "137339",
      "original_text": "Registerbekanntmachung nach dem Umwandlungsgesetz\nBaden-Württemberg Amtsgericht Mannheim HRB 756302\nEDI AKTIENGESELLSCHAFT – Karlsruhe",
      "type": "Registerbekanntmachung nach dem Umwandlungsgesetz",
      "state": "Baden-Württemberg",
      "amtsgericht": "Amtsgericht Mannheim",
      "registernummer": "HRB 756302",
      "registerart": "HRB",
      "company_name": "EDI AKTIENGESELLSCHAFT",
      "company_seat": "Karlsruhe",
      "details": "14.11.2025 (Bekanntmachungsdatum)\n\nBaden-Württemberg Amtsgericht Mannheim HRB 756302\nRegisterbekanntmachung nach dem Umwandlungsgesetz 14.11.2025 (Eintragungsdatum)\n\nEDI AKTIENGESELLSCHAFT\nAktiengesellschaft\nKarlsruhe\n\nAls nicht eingetragen wird bekanntgemacht:\nDen Gläubigern des an dem Formwechsel beteiligten Rechtsträgers ist, wenn sie binnen sechs Monaten nach dem Tag, an dem die Eintragung des Formwechsels in das Register des Sitzes desjenigen Rechtsträgers, dessen Gläubiger sie sind, nach § 19 Abs. 3 UmwG als bekanntgemacht gilt, ihren Anspruch nach Grund und Höhe schriftlich anmelden, Sicherheit zu leisten, soweit sie nicht Befriedigung verlangen können. Dieses Recht steht den Gläubigern jedoch nur zu, wenn sie glaubhaft machen, dass durch den Formwechsel die Erfüllung ihrer Forderung gefährdet wird."
    },
    {
      "date": "2025-11-14",
      "id": "137340",
      "original_text": "Registerbekanntmachung nach dem Umwandlungsgesetz\nHamburg Amtsgericht Hamburg HRA 132816\nKretschmann Gebäudemanagement Hamburg GmbH & Co. KG – Hamburg",
      "type": "Registerbekanntmachung nach dem Umwandlungsgesetz",
      "state": "Hamburg",
      "amtsgericht": "Amtsgericht Hamburg",
      "registernummer": "HRA 132816",
      "registerart": "HRA",
      "company_name": "Kretschmann Gebäudemanagement Hamburg GmbH & Co. KG",
      "company_seat": "Hamburg",
      "details": "14.11.2025 (Bekanntmachungsdatum)\n\nHamburg Amtsgericht Hamburg HRA 132816\nRegisterbekanntmachung nach dem Umwandlungsgesetz 14.11.2025 (Eintragungsdatum)\n\nKretschmann Gebäudemanagement Hamburg GmbH & Co. KG\nKommanditgesellschaft\nHamburg\n\nAls nicht eingetragen wird bekannt gemacht:\nDen Gläubigern der an der Ausgliederung beteiligten Gesellschaften ist, wenn sie binnen sechs Monaten nach dem Tag, an dem die Eintragung der Ausgliederung in das Register des Sitzes desjenigen Rechtsträgers, dessen Gläubiger sie sind, nach § 19 Absatz 3 UmwG als bekannt gemacht gilt, ihren Anspruch nach Grund und Höhe schriftlich anmelden, Sicherheit zu leisten, soweit sie nicht Befriedigung verlangen können. Dieses Recht steht den Gläubigern jedoch nur zu, wenn sie glaubhaft machen, dass durch die Ausgliederung die Erfüllung ihrer Forderung gefährdet wird."
    },
    {
      "date": "2025-11-14",
      "id": "137341",
      "original_text": "Registerbekanntmachung nach dem Umwandlungsgesetz\nHamburg Amtsgericht Hamburg HRA 131883\nKretschmann Gebäudemanagement e.K. – Hamburg",
      "type": "Registerbekanntmachung nach dem Umwandlungsgesetz",
      "state": "Hamburg",
      "amtsgericht": "Amtsgericht Hamburg",
      "registernummer": "HRA 131883",
      "registerart": "HRA",
      "company_name": "Kretschmann Gebäudemanagement e.K.",
      "company_seat": "Hamburg",
      "details": "14.11.2025 (Bekanntmachungsdatum)\n\nHamburg Amtsgericht Hamburg HRA 131883\nRegisterbekanntmachung nach dem Umwandlungsgesetz 14.11.2025 (Eintragungsdatum)\n\nKretschmann Gebäudemanagement e.K.\nEinzelkaufmann\nHamburg\n\nAls nicht eingetragen wird bekannt gemacht:\nDen Gläubigern der an der Ausgliederung beteiligten Gesellschaften ist, wenn sie binnen sechs Monaten nach dem Tag, an dem die Eintragung der Ausgliederung in das Register des Sitzes desjenigen Rechtsträgers, dessen Gläubiger sie sind, nach § 19 Absatz 3 UmwG als bekannt gemacht gilt, ihren Anspruch nach Grund und Höhe schriftlich anmelden, Sicherheit zu leisten, soweit sie nicht Befriedigung verlangen können. Dieses Recht steht den Gläubigern jedoch nur zu, wenn sie glaubhaft machen, dass durch die Ausgliederung die Erfüllung ihrer Forderung gefährdet wird."
    },
    {
      "date": "2025-11-14",
      "id": "137342",
      "original_text": "Löschungsankündigung\nBerlin Amtsgericht Berlin (Charlottenburg) HRB 203156\nBau 37 GmbH – Berlin",
      "type": "Löschungsankündigung",
      "state": "Berlin",
      "amtsgericht": "Amtsgericht Berlin (Charlottenburg)",
      "registernummer": "HRB 203156",
      "registerart": "HRB",
      "company_name": "Bau 37 GmbH",
      "company_seat": "Berlin",
      "details": "14.11.2025 (Bekanntmachungsdatum)\n\nBerlin Amtsgericht Berlin (Charlottenburg) HRB 203156\nLöschungsankündigung\n\nBau 37 GmbH\nGesellschaft mit beschränkter Haftung\nBerlin\n\nBei der nachstehenden Gesellschaft wird das Amtslöschungsverfahren gemäß § 394 FamFG eingeleitet. Widerspruchsfrist 6 Wochen"
    },
    {
      "date": "2025-11-14",
      "id": "137343",
      "original_text": "Löschungsankündigung\nBerlin Amtsgericht Berlin (Charlottenburg) HRB 205151\nK & T Versorgungstechnik GmbH – Berlin",
      "type": "Löschungsankündigung",
      "state": "Berlin",
      "amtsgericht": "Amtsgericht Berlin (Charlottenburg)",
      "registernummer": "HRB 205151",
      "registerart": "HRB",
      "company_name": "K & T Versorgungstechnik GmbH",
      "company_seat": "Berlin",
      "details": "14.11.2025 (Bekanntmachungsdatum)\n\nBerlin Amtsgericht Berlin (Charlottenburg) HRB 205151\nLöschungsankündigung\n\nK & T Versorgungstechnik GmbH\nGesellschaft mit beschränkter Haftung\nBerlin\n\nBei der nachstehenden Gesellschaft wird das Amtslöschungsverfahren gemäß § 394 FamFG eingeleitet. Widerspruchsfrist 6 Wochen"
    },
    {
      "date": "2025-11-14",
      "id": "137344",
      "original_text": "Registerbekanntmachung nach dem Umwandlungsgesetz\nBerlin Amtsgericht Berlin (Charlottenburg) HRB 264843\nZentiva AG – Berlin",
      "type": "Registerbekanntmachung nach dem Umwandlungsgesetz",
      "state": "Berlin",
      "amtsgericht": "Amtsgericht Berlin (Charlottenburg)",
      "registernummer": "HRB 264843",
      "registerart": "HRB",
      "company_name": "Zentiva AG",
      "company_seat": "Berlin",
      "details": "14.11.2025 (Bekanntmachungsdatum)\n\nBerlin Amtsgericht Berlin (Charlottenburg) HRB 264843\nRegisterbekanntmachung nach dem Umwandlungsgesetz 13.11.2025 (Eintragungsdatum)\n\nZentiva AG\nAktiengesellschaft\nBerlin\n\nZu Eintragungsnummer 5 vom 13.11.2025 wird als nichDen Gläubigern der an der Verschmelzung beteiligten Rechtsträger ist, wenn sie binnen sechs Monaten nach dem Tag, an dem die Eintragung der Verschmelzung in das Register des Sitzes desjenigen Rechtsträgers, dessen Gläubiger sie sind, als bekannt gemacht gilt, ihren Anspruch nach Grund und Höhe schriftlich anmelden, Sicherheit zu leisten, soweit sie nicht Befriedigung verlangen können. Dieses Recht steht den Gläubigern jedoch nur zu, wenn sie glaubhaft machen, dass durch die Verschmelzung die Erfüllung ihrer Forderung gefährdet wird. Das Recht, Sicherheitsleistung zu verlangen, steht Gläubigern nicht zu, die im Falle der Insolvenz ein Recht auf vorzugsweise Befriedigung aus einer Deckungsmasse haben, die nach gesetzlicher Vorschrift zu ihrem Schutz errichtet und staatlich überwacht ist. eingetragen veröffentlicht:"
    },
    {
      "date": "2025-11-14",
      "id": "137345",
      "original_text": "Registerbekanntmachung nach dem Umwandlungsgesetz\nBaden-Württemberg Amtsgericht Mannheim HRB 723936\nEDI GmbH – Karlsruhe",
      "type": "Registerbekanntmachung nach dem Umwandlungsgesetz",
      "state": "Baden-Württemberg",
      "amtsgericht": "Amtsgericht Mannheim",
      "registernummer": "HRB 723936",
      "registerart": "HRB",
      "company_name": "EDI GmbH",
      "company_seat": "Karlsruhe",
      "details": "14.11.2025 (Bekanntmachungsdatum)\n\nBaden-Württemberg Amtsgericht Mannheim HRB 723936\nRegisterbekanntmachung nach dem Umwandlungsgesetz 14.11.2025 (Eintragungsdatum)\n\nEDI GmbH\nGesellschaft mit beschränkter Haftung\nKarlsruhe\n\nAls nicht eingetragen wird bekanntgemacht:\nDen Gläubigern des an dem Formwechsel beteiligten Rechtsträgers ist, wenn sie binnen sechs Monaten nach dem Tag, an dem die Eintragung des Formwechsels in das Register des Sitzes desjenigen Rechtsträgers, dessen Gläubiger sie sind, nach § 19 Abs. 3 UmwG als bekanntgemacht gilt, ihren Anspruch nach Grund und Höhe schriftlich anmelden, Sicherheit zu leisten, soweit sie nicht Befriedigung verlangen können. Dieses Recht steht den Gläubigern jedoch nur zu, wenn sie glaubhaft machen, dass durch den Formwechsel die Erfüllung ihrer Forderung gefährdet wird."
    },
    {
      "date": "2025-11-14",
      "id": "137346",
      "original_text": "Registerbekanntmachung nach dem Umwandlungsgesetz\nBerlin Amtsgericht Berlin (Charlottenburg) HRB 172200\nThe Reed GmbH – Berlin",
      "type": "Registerbekanntmachung nach dem Umwandlungsgesetz",
      "state": "Berlin",
      "amtsgericht": "Amtsgericht Berlin (Charlottenburg)",
      "registernummer": "HRB 172200",
      "registerart": "HRB",
      "company_name": "The Reed GmbH",
      "company_seat": "Berlin",
      "details": "14.11.2025 (Bekanntmachungsdatum)\n\nBerlin Amtsgericht Berlin (Charlottenburg) HRB 172200\nRegisterbekanntmachung nach dem Umwandlungsgesetz 13.11.2025 (Eintragungsdatum)\n\nThe Reed GmbH\nGesellschaft mit beschränkter Haftung\nBerlin\n\nZu Eintragungsnummer 8 vom 13.11.2025 wird als nicht eingetragen veröffentlicht: Den Gläubigern der an der Verschmelzung beteiligten Rechtsträger ist, wenn sie binnen sechs Monaten nach dem Tag, an dem die Eintragung der Verschmelzung in das Register des Sitzes desjenigen Rechtsträgers, dessen Gläubiger sie sind, als bekannt gemacht gilt, ihren Anspruch nach Grund und Höhe schriftlich anmelden, Sicherheit zu leisten, soweit sie nicht Befriedigung verlangen können. Dieses Recht steht den Gläubigern jedoch nur zu, wenn sie glaubhaft machen, dass durch die Verschmelzung die Erfüllung ihrer Forderung gefährdet wird. Das Recht, Sicherheitsleistung zu verlangen, steht Gläubigern nicht zu, die im Falle der Insolvenz ein Recht auf vorzugsweise Befriedigung aus einer Deckungsmasse haben, die nach gesetzlicher Vorschrift zu ihrem Schutz errichtet und staatlich überwacht ist."
    },
    {
      "date": "2025-11-14",
      "id": "137347",
      "original_text": "Löschungsankündigung\nBrandenburg Amtsgericht Potsdam HRB 13442\nBGW - Bäder- und Gasheizungsbau/Wartungsservice - GmbH – Kleinmachnow",
      "type": "Löschungsankündigung",
      "state": "Brandenburg",
      "amtsgericht": "Amtsgericht Potsdam",
      "registernummer": "HRB 13442",
      "registerart": "HRB",
      "company_name": "BGW - Bäder- und Gasheizungsbau/Wartungsservice - GmbH",
      "company_seat": "Kleinmachnow",
      "details": "14.11.2025 (Bekanntmachungsdatum)\n\nBrandenburg Amtsgericht Potsdam HRB 13442\nLöschungsankündigung\n\nBGW - Bäder- und Gasheizungsbau/Wartungsservice - GmbH\nGesellschaft mit beschränkter Haftung\nKleinmachnow\n\nBei der nachstehenden Gesellschaft wird das Amtslöschungsverfahren gemäß § 394 FamFG eingeleitet. Widerspruchsfrist: 8 Wochen"
    },
    {
      "date": "2025-11-14",
      "id": "137348",
      "original_text": "Löschungsankündigung\nBaden-Württemberg Amtsgericht Freiburg HRA 703126\nSiegler Bau & Dach GmbH & Co. KG – Überlingen",
      "type": "Löschungsankündigung",
      "state": "Baden-Württemberg",
      "amtsgericht": "Amtsgericht Freiburg",
      "registernummer": "HRA 703126",
      "registerart": "HRA",
      "company_name": "Siegler Bau & Dach GmbH & Co. KG",
      "company_seat": "Überlingen",
      "details": "14.11.2025 (Bekanntmachungsdatum)\n\nBaden-Württemberg Amtsgericht Freiburg HRA 703126\nLöschungsankündigung\n\nSiegler Bau & Dach GmbH & Co. KG\nKommanditgesellschaft\nÜberlingen\n\nAls nicht eingetragen wird bekanntgemacht:\nDas Gericht beabsichtigt, die Gesellschaft wegen Vermögenslosigkeit im Handelsregister von Amts wegen nach § 394 FamFG zu löschen. Die Frist zur Geltendmachung eines Widerspruchs gegen die beabsichtigte Löschung ist auf einen Monat ab Veröffentlichung bestimmt."
    },
    {
      "date": "2025-11-14",
      "id": "137349",
      "original_text": "Registerbekanntmachung nach dem Umwandlungsgesetz\nSachsen-Anhalt Amtsgericht Stendal HRA 3013\nPHO B GmbH & Co. KG – Weißenfels",
      "type": "Registerbekanntmachung nach dem Umwandlungsgesetz",
      "state": "Sachsen-Anhalt",
      "amtsgericht": "Amtsgericht Stendal",
      "registernummer": "HRA 3013",
      "registerart": "HRA",
      "company_name": "PHO B GmbH & Co. KG",
      "company_seat": "Weißenfels",
      "details": "14.11.2025 (Bekanntmachungsdatum)\n\nSachsen-Anhalt Amtsgericht Stendal HRA 3013\nRegisterbekanntmachung nach dem Umwandlungsgesetz 14.11.2025 (Eintragungsdatum)\n\nPHO B GmbH & Co. KG\nKommanditgesellschaft\nWeißenfels\n\nNicht eingetragen:\nDen Gläubigern der an der Spaltung beteiligten Rechtsträger, ist wenn sie binnen sechs Monaten nach dem Tag, an dem die Eintragung der Spaltung nach §§ 125, 19 Abs. 3 UmwG als bekanntgemacht gilt, ihren Anspruch nach Grund und Höhe schriftlich anmelden, Sicherheit zu leisten, soweit sie nicht Befriedigung verlangen können. Dieses Recht steht ihnen jedoch nur zu, wenn sie glaubhaft machen, daß durch die Spaltung die Erfüllung ihrer Forderung gefährdet wird."
    },
    {
      "date": "2025-11-14",
      "id": "137350",
      "original_text": "Sonstige Registerbekanntmachung\nBaden-Württemberg Amtsgericht Mannheim HRB 748607\nNEA Netzentgelt und Energieabrechnungsgesellschaft mbH – Mannheim",
      "type": "Sonstige Registerbekanntmachung",
      "state": "Baden-Württemberg",
      "amtsgericht": "Amtsgericht Mannheim",
      "registernummer": "HRB 748607",
      "registerart": "HRB",
      "company_name": "NEA Netzentgelt und Energieabrechnungsgesellschaft mbH",
      "company_seat": "Mannheim",
      "details": "14.11.2025 (Bekanntmachungsdatum)\n\nBaden-Württemberg Amtsgericht Mannheim HRB 748607\nSonstige Registerbekanntmachung 14.11.2025 (Eintragungsdatum)\n\nNEA Netzentgelt und Energieabrechnungsgesellschaft mbH\nGesellschaft mit beschränkter Haftung\nMannheim\n\nDen Gläubigern der Gesellschaft, deren Forderungen begründet worden sind, bevor die Eintragung der Beendigung des Vertrages in das Handelsregister nach § 10 HGB als bekanntgemacht gilt, ist vom anderen Vertragsteil Sicherheit zu leisten, wenn sie sich binnen sechs Monaten nach der Bekanntmachung zu diesem Zweck bei ihm melden."
    },
    {
      "date": "2025-11-14",
      "id": "137351",
      "original_text": "Löschungsankündigung\nBerlin Amtsgericht Berlin (Charlottenburg) HRB 263420\nTHE BAG- AND PHONE-HOUSE GMBH – Berlin",
      "type": "Löschungsankündigung",
      "state": "Berlin",
      "amtsgericht": "Amtsgericht Berlin (Charlottenburg)",
      "registernummer": "HRB 263420",
      "registerart": "HRB",
      "company_name": "THE BAG- AND PHONE-HOUSE GMBH",
      "company_seat": "Berlin",
      "details": "14.11.2025 (Bekanntmachungsdatum)\n\nBerlin Amtsgericht Berlin (Charlottenburg) HRB 263420\nLöschungsankündigung\n\nTHE BAG- AND PHONE-HOUSE GMBH\nGesellschaft mit beschränkter Haftung\nBerlin\n\nBei der nachstehenden Gesellschaft wird das Amtslöschungsverfahren gemäß § 394 FamFG eingeleitet. Widerspruchsfrist\n6 Wochen."
    },
    {
      "date": "2025-11-14",
      "id": "137352",
      "original_text": "Registerbekanntmachung nach dem Umwandlungsgesetz\nBerlin Amtsgericht Berlin (Charlottenburg) HRB 270718\nRA Vermögensverwaltung GmbH – Berlin",
      "type": "Registerbekanntmachung nach dem Umwandlungsgesetz",
      "state": "Berlin",
      "amtsgericht": "Amtsgericht Berlin (Charlottenburg)",
      "registernummer": "HRB 270718",
      "registerart": "HRB",
      "company_name": "RA Vermögensverwaltung GmbH",
      "company_seat": "Berlin",
      "details": "14.11.2025 (Bekanntmachungsdatum)\n\nBerlin Amtsgericht Berlin (Charlottenburg) HRB 270718\nRegisterbekanntmachung nach dem Umwandlungsgesetz 13.11.2025 (Eintragungsdatum)\n\nRA Vermögensverwaltung GmbH\nGesellschaft mit beschränkter Haftung\nBerlin\n\nZu Eintragungsnummer 2 vom 13.11.2025 wird als nicht eingetragen veröffentlicht: Den Gläubigern der an der Verschmelzung beteiligten Rechtsträger ist, wenn sie binnen sechs Monaten nach dem Tag, an dem die Eintragung der Verschmelzung in das Register des Sitzes desjenigen Rechtsträgers, dessen Gläubiger sie sind, als bekannt gemacht gilt, ihren Anspruch nach Grund und Höhe schriftlich anmelden, Sicherheit zu leisten, soweit sie nicht Befriedigung verlangen können. Dieses Recht steht den Gläubigern jedoch nur zu, wenn sie glaubhaft machen, dass durch die Verschmelzung die Erfüllung ihrer Forderung gefährdet wird. Das Recht, Sicherheitsleistung zu verlangen, steht Gläubigern nicht zu, die im Falle der Insolvenz ein Recht auf vorzugsweise Befriedigung aus einer Deckungsmasse haben, die nach gesetzlicher Vorschrift zu ihrem Schutz errichtet und staatlich überwacht ist."
    },
    {
      "date": "2025-11-14",
      "id": "137353",
      "original_text": "Registerbekanntmachung nach dem Umwandlungsgesetz\nBaden-Württemberg Amtsgericht Mannheim HRA 712842\nNikolaos Yannopoulos e.K. – Mühlacker",
      "type": "Registerbekanntmachung nach dem Umwandlungsgesetz",
      "state": "Baden-Württemberg",
      "amtsgericht": "Amtsgericht Mannheim",
      "registernummer": "HRA 712842",
      "registerart": "HRA",
      "company_name": "Nikolaos Yannopoulos e.K.",
      "company_seat": "Mühlacker",
      "details": "14.11.2025 (Bekanntmachungsdatum)\n\nBaden-Württemberg Amtsgericht Mannheim HRA 712842\nRegisterbekanntmachung nach dem Umwandlungsgesetz 14.11.2025 (Eintragungsdatum)\n\nNikolaos Yannopoulos e.K.\nEinzelkaufmann / Einzelkauffrau\nMühlacker\n\nAls nicht eingetragen wird bekanntgemacht:\nDen Gläubigern der an der Ausgliederung beteiligten Rechtsträger ist, wenn sie binnen sechs Monaten nach dem Tag, an dem die Eintragung der Ausgliederung in das Register des Sitzes desjenigen Rechtsträgers, dessen Gläubiger sie sind, nach § 19 Abs. 3 UmwG als bekanntgemacht gilt, ihren Anspruch nach Grund und Höhe schriftlich anmelden, Sicherheit zu leisten, soweit sie nicht Befriedigung verlangen können. Dieses Recht steht den Gläubigern jedoch nur zu, wenn sie glaubhaft machen, dass durch die Ausgliederung die Erfüllung ihrer Forderung gefährdet wird."
    },
    {
      "date": "2025-11-14",
      "id": "137354",
      "original_text": "Einreichung neuer Dokumente\nBaden-Württemberg Amtsgericht Stuttgart HRB 779472\nStadtwerke Öhringen GmbH – Öhringen",
      "type": "Einreichung neuer Dokumente",
      "state": "Baden-Württemberg",
      "amtsgericht": "Amtsgericht Stuttgart",
      "registernummer": "HRB 779472",
      "registerart": "HRB",
      "company_name": "Stadtwerke Öhringen GmbH",
      "company_seat": "Öhringen",
      "details": "14.11.2025 (Bekanntmachungsdatum)\n\nBaden-Württemberg Amtsgericht Stuttgart HRB 779472\nEinreichung neuer Dokumente\n\nStadtwerke Öhringen GmbH\nGesellschaft mit beschränkter Haftung\nÖhringen\n\nDie Gesellschaft hat am 12.11.2025 die Liste über die Zusammensetzung des Aufsichtsrats zum Handelsregister eingereicht."
    },
    {
      "date": "2025-11-14",
      "id": "137355",
      "original_text": "Registerbekanntmachung nach dem Umwandlungsgesetz\nBaden-Württemberg Amtsgericht Ulm HRA 729838\nUltramarin - Die Meichle + Mohr Marina GmbH & Co. KG – Immenstaad am Bodensee",
      "type": "Registerbekanntmachung nach dem Umwandlungsgesetz",
      "state": "Baden-Württemberg",
      "amtsgericht": "Amtsgericht Ulm",
      "registernummer": "HRA 729838",
      "registerart": "HRA",
      "company_name": "Ultramarin - Die Meichle + Mohr Marina GmbH & Co. KG",
      "company_seat": "Immenstaad am Bodensee",
      "details": "14.11.2025 (Bekanntmachungsdatum)\n\nBaden-Württemberg Amtsgericht Ulm HRA 729838\nRegisterbekanntmachung nach dem Umwandlungsgesetz 14.11.2025 (Eintragungsdatum)\n\nUltramarin - Die Meichle + Mohr Marina GmbH & Co. KG\nKommanditgesellschaft\nImmenstaad am Bodensee\n\nAls nicht eingetragen wird bekanntgemacht:\nDen Gläubigern der an der Abspaltung beteiligten Rechtsträger ist, wenn sie binnen sechs Monaten nach dem Tag, an dem die Eintragung der Abspaltung in das Register des Sitzes desjenigen Rechtsträgers, dessen Gläubiger sie sind, nach § 19 Abs. 3 UmwG als bekanntgemacht gilt, ihren Anspruch nach Grund und Höhe schriftlich anmelden, Sicherheit zu leisten, soweit sie nicht Befriedigung verlangen können. Dieses Recht steht den Gläubigern jedoch nur zu, wenn sie glaubhaft machen, dass durch die Abspaltung die Erfüllung ihrer Forderung gefährdet wird."
    },
    {
      "date": "2025-11-14",
      "id": "137356",
      "original_text": "Registerbekanntmachung nach dem Umwandlungsgesetz\nBaden-Württemberg Amtsgericht Ulm HRB 630642\nMeichle & Mohr GmbH – Immenstaad am Bodensee",
      "type": "Registerbekanntmachung nach dem Umwandlungsgesetz",
      "state": "Baden-Württemberg",
      "amtsgericht": "Amtsgericht Ulm",
      "registernummer": "HRB 630642",
      "registerart": "HRB",
      "company_name": "Meichle & Mohr GmbH",
      "company_seat": "Immenstaad am Bodensee",
      "details": "14.11.2025 (Bekanntmachungsdatum)\n\nBaden-Württemberg Amtsgericht Ulm HRB 630642\nRegisterbekanntmachung nach dem Umwandlungsgesetz 14.11.2025 (Eintragungsdatum)\n\nMeichle & Mohr GmbH\nGesellschaft mit beschränkter Haftung\nImmenstaad am Bodensee\n\nAls nicht eingetragen wird bekanntgemacht:\nDen Gläubigern der an der Abspaltung beteiligten Rechtsträger ist, wenn sie binnen sechs Monaten nach dem Tag, an dem die Eintragung der Abspaltung in das Register des Sitzes desjenigen Rechtsträgers, dessen Gläubiger sie sind, nach § 19 Abs. 3 UmwG als bekanntgemacht gilt, ihren Anspruch nach Grund und Höhe schriftlich anmelden, Sicherheit zu leisten, soweit sie nicht Befriedigung verlangen können. Dieses Recht steht den Gläubigern jedoch nur zu, wenn sie glaubhaft machen, dass durch die Abspaltung die Erfüllung ihrer Forderung gefährdet wird."
    },
    {
      "date": "2025-11-14",
      "id": "137357",
      "original_text": "Löschungsankündigung\nBerlin Amtsgericht Berlin (Charlottenburg) HRA 56441\nAPMIS Handels GmbH & Co. KG – Berlin",
      "type": "Löschungsankündigung",
      "state": "Berlin",
      "amtsgericht": "Amtsgericht Berlin (Charlottenburg)",
      "registernummer": "HRA 56441",
      "registerart": "HRA",
      "company_name": "APMIS Handels GmbH & Co. KG",
      "company_seat": "Berlin",
      "details": "14.11.2025 (Bekanntmachungsdatum)\n\nBerlin Amtsgericht Berlin (Charlottenburg) HRA 56441\nLöschungsankündigung\n\nAPMIS Handels GmbH & Co. KG\nKommanditgesellschaft\nBerlin\n\nBei dem nachstehenden Unternehmen / der nachstehenden Gesellschaft wird das Amtslöschungsverfahren gemäß § 31 Abs. 2 HGB eingeleitet. Widerspruchsfrist 2 Monate"
    },
    {
      "date": "2025-11-14",
      "id": "137358",
      "original_text": "Registerbekanntmachung nach dem Umwandlungsgesetz\nThüringen Amtsgericht Jena HRB 202820\nOstthüringer Regionaler Telefonbuch-Verlag GmbH – Gera",
      "type": "Registerbekanntmachung nach dem Umwandlungsgesetz",
      "state": "Thüringen",
      "amtsgericht": "Amtsgericht Jena",
      "registernummer": "HRB 202820",
      "registerart": "HRB",
      "company_name": "Ostthüringer Regionaler Telefonbuch-Verlag GmbH",
      "company_seat": "Gera",
      "details": "14.11.2025 (Bekanntmachungsdatum)\n\nThüringen Amtsgericht Jena HRB 202820\nRegisterbekanntmachung nach dem Umwandlungsgesetz 11.11.2025 (Eintragungsdatum)\n\nOstthüringer Regionaler Telefonbuch-Verlag GmbH\nGesellschaft mit beschränkter Haftung\nGera\n\nNicht eingetragen: Den Gläubigern der an der Verschmelzung beteiligten Rechtsträger, ist wenn sie binnen sechs Monaten nach dem Tag, an dem die Eintragung der Verschmelzung in das Register des Sitzes desjenigen Rechtsträgers, dessen Gläubiger sie sind,  nach § 19 Abs. 3 UmwG als bekanntgemacht gilt, ihren Anspruch nach Grund und Höhe schriftlich anmelden, Sicherheit zu leisten, soweit sie nicht Befriedigung verlangen können. Dieses Recht steht ihnen jedoch nur zu, wenn sie glaubhaft machen, daß durch die Verschmelzung die Erfüllung ihrer Forderung gefährdet wird."
    },
    {
      "date": "2025-11-14",
      "id": "137359",
      "original_text": "Registerbekanntmachung nach dem Umwandlungsgesetz\nSchleswig-Holstein Amtsgericht Pinneberg HRB 12768\nImKoDé GmbH – Ellerbek",
      "type": "Registerbekanntmachung nach dem Umwandlungsgesetz",
      "state": "Schleswig-Holstein",
      "amtsgericht": "Amtsgericht Pinneberg",
      "registernummer": "HRB 12768",
      "registerart": "HRB",
      "company_name": "ImKoDé GmbH",
      "company_seat": "Ellerbek",
      "details": "14.11.2025 (Bekanntmachungsdatum)\n\nSchleswig-Holstein Amtsgericht Pinneberg HRB 12768\nRegisterbekanntmachung nach dem Umwandlungsgesetz 12.11.2025 (Eintragungsdatum)\n\nImKoDé GmbH\nGesellschaft mit beschränkter Haftung\nEllerbek\n\nZu Eintragungsnummer 3 vom 12.11.2025 wird als nicht eingetragen veröffentlicht: Als nicht eingetragen wird veröffentlicht: Den Gläubigern der an der Verschmelzung beteiligten Rechtsträger ist, wenn sie binnen sechs Monaten nach dem Tag, an dem die Eintragung der Verschmelzung in das Register des Sitzes desjenigen Rechtsträgers, dessen Gläubiger sie sind, als bekannt gemacht gilt, ihren Anspruch nach Grund und Höhe schriftlich anmelden, Sicherheit zu leisten, soweit sie nicht Befriedigung verlangen können. Dieses Recht steht den Gläubigern jedoch nur zu, wenn sie glaubhaft machen, dass durch die Verschmelzung die Erfüllung ihrer Forderung gefährdet wird. Das Recht, Sicherheitsleistung zu verlangen, steht Gläubigern nicht zu, die im Falle der Insolvenz ein Recht auf vorzugsweise Befriedigung aus einer Deckungsmasse haben, die nach gesetzlicher Vorschrift zu ihrem Schutz errichtet und staatlich überwacht ist."
    },
    {
      "date": "2025-11-14",
      "id": "137360",
      "original_text": "Sonstige Registerbekanntmachung\nBerlin Amtsgericht Berlin (Charlottenburg) HRB 96548\nBERINTREG GmbH – Berlin",
      "type": "Sonstige Registerbekanntmachung",
      "state": "Berlin",
      "amtsgericht": "Amtsgericht Berlin (Charlottenburg)",
      "registernummer": "HRB 96548",
      "registerart": "HRB",
      "company_name": "BERINTREG GmbH",
      "company_seat": "Berlin",
      "details": "14.11.2025 (Bekanntmachungsdatum)\n\nBerlin Amtsgericht Berlin (Charlottenburg) HRB 96548\nSonstige Registerbekanntmachung\n\nBERINTREG GmbH\nGesellschaft mit beschränkter Haftung\nBerlin\n\nAls nicht eingetragen wird veröffentlicht: Dem Registergericht liegt ein Antrag auf Bestellung eines Nachtragsliquidators (§ 273 AktG analog) für die bereits 05.01.2021 gelöschte Gesellschaft in Firma BERINTREG GmbH vom 15.10.2025 vor.\n\nEs ist beabsichtigt, Herrn Rechtsanwalt Sascha Borowksi, c/o Buchalik Brömmekamp Rechtsanwaltsgesellschaft mbH, Prinzenallee 15, 40549 Düsseldorf, als Nachtragsliquidator für die gelöschte Gesellschaft mit folgendem Wirkungskreis zu bestellen:\n\nDer Wirkungskreis des Nachtragsliquidators ist beschränkt auf die Vertretung und Wahrnehmung der Rechte und Pflichten der gelöschten Gesellschaft hinsichtlich der Zustimmung zur Freigabe des bei dem Amtsgericht München, Hinterlegungsstelle, unter dem Aktenzeichen HL 083 800 10 hinterlegten Geldbetrages in Höhe von 3.760,80 €.\n\nEtwaige Widersprüche gegen die beabsichtigte Bestellung sind binnen eines Monats ab Bekanntmachung schriftlich beim Amtsgericht Charlottenburg (zur HR-Nr. HRB 96548) zu erklären. Der Widerspruch ist zu begründen."
    },
    {
      "date": "2025-11-14",
      "id": "137361",
      "original_text": "Registerbekanntmachung nach dem Umwandlungsgesetz\nNordrhein-Westfalen Amtsgericht Coesfeld HRA 10286\nDziuba & Tepferd UG (haftungsbeschränkt) & Co. KG – Südlohn",
      "type": "Registerbekanntmachung nach dem Umwandlungsgesetz",
      "state": "Nordrhein-Westfalen",
      "amtsgericht": "Amtsgericht Coesfeld",
      "registernummer": "HRA 10286",
      "registerart": "HRA",
      "company_name": "Dziuba & Tepferd UG (haftungsbeschränkt) & Co. KG",
      "company_seat": "Südlohn",
      "details": "14.11.2025 (Bekanntmachungsdatum)\n\nNordrhein-Westfalen Amtsgericht Coesfeld HRA 10286\nRegisterbekanntmachung nach dem Umwandlungsgesetz 14.11.2025 (Eintragungsdatum)\n\nDziuba & Tepferd UG (haftungsbeschränkt) & Co. KG\nKommanditgesellschaft\nSüdlohn\n\nAls nicht eingetragen wird bekanntgemacht: Den Gläubigern der an der Verschmelzung beteiligten Rechtsträger ist, wenn sie binnen sechs Monaten nach dem Tag, an dem die Eintragung der Verschmelzung in das Register des Sitzes desjenigen Rechtsträgers, dessen Gläubiger sie sind, nach § 19 Absatz 3 UmwG als bekanntgemacht gilt, ihren Anspruch nach Grund und Höhe schriftlich anmelden, Sicherheit zu leisten, soweit sie nicht Befriedigung verlangen können. Dieses Recht steht den Gläubigern jedoch nur zu, wenn sie glaubhaft machen, dass durch die Verschmelzung die Erfüllung ihrer Forderung gefährdet wird. Das Recht, Sicherheitsleistung zu verlangen, steht Gläubigern nicht zu, die im Fall des Insolvenzverfahrens ein Recht auf vorzugsweise Befriedigung aus einer Deckungsmasse haben, die nach gesetzlicher Vorschrift zu ihrem Schutz errichtet und staatlich überwacht ist."
    },
    {
      "date": "2025-11-14",
      "id": "137362",
      "original_text": "Registerbekanntmachung nach dem Umwandlungsgesetz\nNordrhein-Westfalen Amtsgericht Coesfeld HRA 9620\nPalettenhandel Niehoff e.K., Inhaber Sven Stöckle – Nordkirchen",
      "type": "Registerbekanntmachung nach dem Umwandlungsgesetz",
      "state": "Nordrhein-Westfalen",
      "amtsgericht": "Amtsgericht Coesfeld",
      "registernummer": "HRA 9620",
      "registerart": "HRA",
      "company_name": "Palettenhandel Niehoff e.K., Inhaber Sven Stöckle",
      "company_seat": "Nordkirchen",
      "details": "14.11.2025 (Bekanntmachungsdatum)\n\nNordrhein-Westfalen Amtsgericht Coesfeld HRA 9620\nRegisterbekanntmachung nach dem Umwandlungsgesetz 14.11.2025 (Eintragungsdatum)\n\nPalettenhandel Niehoff e.K., Inhaber Sven Stöckle\nEinzelkaufmann\nNordkirchen\n\nDen Gläubigern der an der Ausgliederung beteiligten Rechtsträger ist, wenn sie binnen sechs Monaten nach dem Tag, an dem die Eintragung der Ausgliederung in das Register des Sitzes desjenigen Rechtsträgers, dessen Gläubiger sie sind, nach § 19 Absatz 3 UmwG als bekanntgemacht gilt, ihren Anspruch nach Grund und Höhe schriftlich anmelden, Sicherheit zu leisten, soweit sie nicht Befriedigung verlangen können. Dieses Recht steht den Gläubigern jedoch nur zu, wenn sie glaubhaft machen, dass durch die Ausgliederung die Erfüllung ihrer Forderung gefährdet wird."
    },
    {
      "date": "2025-11-14",
      "id": "137363",
      "original_text": "Einreichung neuer Dokumente\nHamburg Amtsgericht Hamburg HRB 117676\nErneuerbare Energien Hamburg Clusteragentur GmbH – Hamburg",
      "type": "Einreichung neuer Dokumente",
      "state": "Hamburg",
      "amtsgericht": "Amtsgericht Hamburg",
      "registernummer": "HRB 117676",
      "registerart": "HRB",
      "company_name": "Erneuerbare Energien Hamburg Clusteragentur GmbH",
      "company_seat": "Hamburg",
      "details": "14.11.2025 (Bekanntmachungsdatum)\n\nHamburg Amtsgericht Hamburg HRB 117676\nEinreichung neuer Dokumente\n\nErneuerbare Energien Hamburg Clusteragentur GmbH\nGesellschaft mit beschränkter Haftung\nHamburg\n\nAls nicht eingetragen wird bekannt gemacht: Liste des Aufsichtsrats wurde eingereicht."
    },
    {
      "date": "2025-11-14",
      "id": "137364",
      "original_text": "Löschungsankündigung\nSchleswig-Holstein Amtsgericht Kiel HRB 13742\nti mediaconcept UG (haftungsbeschränkt) – Norderstedt",
      "type": "Löschungsankündigung",
      "state": "Schleswig-Holstein",
      "amtsgericht": "Amtsgericht Kiel",
      "registernummer": "HRB 13742",
      "registerart": "HRB",
      "company_name": "ti mediaconcept UG (haftungsbeschränkt)",
      "company_seat": "Norderstedt",
      "details": "14.11.2025 (Bekanntmachungsdatum)\n\nSchleswig-Holstein Amtsgericht Kiel HRB 13742\nLöschungsankündigung\n\nti mediaconcept UG (haftungsbeschränkt)\nGesellschaft mit beschränkter Haftung\nNorderstedt\n\nEs ist die Löschung der nachstehenden Gesellschaft wegen Vermögenslosigkeit gemäß § 394 FamFG beabsichtigt. Widerspruchsfrist: 1 Monat."
    },
    {
      "date": "2025-11-14",
      "id": "137365",
      "original_text": "Löschungsankündigung\nBrandenburg Amtsgericht Potsdam HRB 27915\nEisenhardt Veranstaltungs GmbH – Potsdam",
      "type": "Löschungsankündigung",
      "state": "Brandenburg",
      "amtsgericht": "Amtsgericht Potsdam",
      "registernummer": "HRB 27915",
      "registerart": "HRB",
      "company_name": "Eisenhardt Veranstaltungs GmbH",
      "company_seat": "Potsdam",
      "details": "14.11.2025 (Bekanntmachungsdatum)\n\nBrandenburg Amtsgericht Potsdam HRB 27915\nLöschungsankündigung\n\nEisenhardt Veranstaltungs GmbH\nGesellschaft mit beschränkter Haftung\nPotsdam\n\nBei der nachstehenden Gesellschaft wird das Amtslöschungsverfahren gemäß § 394 FamFG eingeleitet. Widerspruchsfrist: 8 Wochen."
    },
    {
      "date": "2025-11-14",
      "id": "137366",
      "original_text": "Löschungsankündigung\nSachsen Amtsgericht Dresden HRA 5472\nCH Werbungsabwicklungsgesellschaft mbH & Co. KG – Dresden",
      "type": "Löschungsankündigung",
      "state": "Sachsen",
      "amtsgericht": "Amtsgericht Dresden",
      "registernummer": "HRA 5472",
      "registerart": "HRA",
      "company_name": "CH Werbungsabwicklungsgesellschaft mbH & Co. KG",
      "company_seat": "Dresden",
      "details": "14.11.2025 (Bekanntmachungsdatum)\n\nSachsen Amtsgericht Dresden HRA 5472\nLöschungsankündigung 14.11.2025 (Eintragungsdatum)\n\nCH Werbungsabwicklungsgesellschaft mbH & Co. KG\nKommanditgesellschaft\nDresden\n\nDas Registergericht beabsichtigt, die im Handelsregister eingetragene Gesellschaft von Amts wegen nach § 394 FamFG zu löschen. Die Frist zu Erhebung eines Widerspruchs gegen die beabsichtigte Löschung wird auf einen Monat festgesetzt."
    },
    {
      "date": "2025-11-14",
      "id": "137367",
      "original_text": "Registerbekanntmachung nach dem Umwandlungsgesetz\nSachsen Amtsgericht Chemnitz HRA 10307\nMP Finanzmakler e.K. Inh. Philipp Flade – Chemnitz",
      "type": "Registerbekanntmachung nach dem Umwandlungsgesetz",
      "state": "Sachsen",
      "amtsgericht": "Amtsgericht Chemnitz",
      "registernummer": "HRA 10307",
      "registerart": "HRA",
      "company_name": "MP Finanzmakler e.K. Inh. Philipp Flade",
      "company_seat": "Chemnitz",
      "details": "14.11.2025 (Bekanntmachungsdatum)\n\nSachsen Amtsgericht Chemnitz HRA 10307\nRegisterbekanntmachung nach dem Umwandlungsgesetz 14.11.2025 (Eintragungsdatum)\n\nMP Finanzmakler e.K. Inh. Philipp Flade\nEinzelkaufmann / Einzelkauffrau\nChemnitz\n\nDen Gläubigern der an der Ausgliederung beteiligten Rechtsträger ist, wenn sie binnen sechs Monaten nach dem Tag, an dem die Eintragung der Ausgliederung in das Register des Sitzes desjenigen Rechtsträgers, dessen Gläubiger sie sind, nach § 19 Abs. 3 UmwG als bekannt gemacht gilt, ihren Anspruch nach Grund und Höhe in Textform anmelden, Sicherheit zu leisten, soweit sie nicht Befriedigung verlangen können. Dieses Recht steht den Gläubigern jedoch nur zu, wenn sie glaubhaft machen, dass durch die Ausgliederung die Erfüllung der Forderung gefährdet wird."
    },
    {
      "date": "2025-11-14",
      "id": "137368",
      "original_text": "Registerbekanntmachung nach dem Umwandlungsgesetz\nNiedersachsen Amtsgericht Osnabrück HRB 221798\nDerGrilltyp GmbH – Hilter a.T.W.",
      "type": "Registerbekanntmachung nach dem Umwandlungsgesetz",
      "state": "Niedersachsen",
      "amtsgericht": "Amtsgericht Osnabrück",
      "registernummer": "HRB 221798",
      "registerart": "HRB",
      "company_name": "DerGrilltyp GmbH",
      "company_seat": "Hilter a.T.W.",
      "details": "14.11.2025 (Bekanntmachungsdatum)\n\nNiedersachsen Amtsgericht Osnabrück HRB 221798\nRegisterbekanntmachung nach dem Umwandlungsgesetz 14.11.2025 (Eintragungsdatum)\n\nDerGrilltyp GmbH\nGesellschaft mit beschränkter Haftung\nHilter a.T.W.\n\nDen Gläubigern der an der Ausgliederung beteiligten Rechtsträger ist, wenn sie binnen sechs Monaten nach dem Tag, an dem die Eintragung der Ausgliederung in das Register des Sitzes desjenigen Rechtsträgers, dessen Gläubiger sie sind, nach § 19 Abs. 3 UmwG als bekannt gemacht gilt, ihren Anspruch nach Grund und Höhe schriftlich anmelden, Sicherheit zu leisten, soweit sie nicht Befriedigung verlangen können. Dieses Recht steht den Gläubigern jedoch nur zu, wenn sie glaubhaft machen, dass durch die Ausgliederung die Erfüllung der Forderung gefährdet wird."
    },
    {
      "date": "2025-11-14",
      "id": "137369",
      "original_text": "Registerbekanntmachung nach dem Umwandlungsgesetz\nNiedersachsen Amtsgericht Walsrode GnR 200068\nPeak & Power eG – Scheeßel",
      "type": "Registerbekanntmachung nach dem Umwandlungsgesetz",
      "state": "Niedersachsen",
      "amtsgericht": "Amtsgericht Walsrode",
      "registernummer": "GnR 200068",
      "registerart": "GnR",
      "company_name": "Peak & Power eG",
      "company_seat": "Scheeßel",
      "details": "14.11.2025 (Bekanntmachungsdatum)\n\nNiedersachsen Amtsgericht Walsrode GnR 200068\nRegisterbekanntmachung nach dem Umwandlungsgesetz 14.11.2025 (Eintragungsdatum)\n\nPeak & Power eG\neingetragene Genossenschaft\nScheeßel\n\nDen Gläubigern der an der formwechselnden Umwandlung beteiligten Rechtsträger ist, wenn sie binnen sechs Monaten nach dem Tag, an dem die Eintragung der Umwandlung in das Register des Sitzes desjenigen Rechtsträgers, dessen Gläubiger sie sind, nach § 19 Abs. 3 UmwG als bekannt gemacht gilt, ihren Anspruch nach Grund und Höhe schriftlich anmelden, Sicherheit zu leisten, soweit sie nicht Befriedigung verlangen können. Dieses Recht steht den Gläubigern jedoch nur zu, wenn sie glaubhaft machen, dass durch die formwechselnde Umwandlung die Erfüllung der Forderung gefährdet wird."
    },
    {
      "date": "2025-11-14",
      "id": "137370",
      "original_text": "Registerbekanntmachung nach dem Umwandlungsgesetz\nNiedersachsen Amtsgericht Lüneburg HRB 213309\nMG Management Germany AG – Lüneburg",
      "type": "Registerbekanntmachung nach dem Umwandlungsgesetz",
      "state": "Niedersachsen",
      "amtsgericht": "Amtsgericht Lüneburg",
      "registernummer": "HRB 213309",
      "registerart": "HRB",
      "company_name": "MG Management Germany AG",
      "company_seat": "Lüneburg",
      "details": "14.11.2025 (Bekanntmachungsdatum)\n\nNiedersachsen Amtsgericht Lüneburg HRB 213309\nRegisterbekanntmachung nach dem Umwandlungsgesetz 14.11.2025 (Eintragungsdatum)\n\nMG Management Germany AG\nAktiengesellschaft\nLüneburg\n\nDen Gläubigern der an der formwechselnden Umwandlung beteiligten Rechtsträger ist, wenn sie binnen sechs Monaten nach dem Tag, an dem die Eintragung der Umwandlung in das Register des Sitzes desjenigen Rechtsträgers, dessen Gläubiger sie sind, nach § 19 Abs. 3 UmwG als bekannt gemacht gilt, ihren Anspruch nach Grund und Höhe schriftlich anmelden, Sicherheit zu leisten, soweit sie nicht Befriedigung verlangen können. Dieses Recht steht den Gläubigern jedoch nur zu, wenn sie glaubhaft machen, dass durch die formwechselnde Umwandlung die Erfüllung der Forderung gefährdet wird."
    },
    {
      "date": "2025-11-14",
      "id": "137371",
      "original_text": "Einreichung neuer Dokumente\nNiedersachsen Amtsgericht Hannover HRB 217148\nMOIA Operations Germany GmbH – Hannover",
      "type": "Einreichung neuer Dokumente",
      "state": "Niedersachsen",
      "amtsgericht": "Amtsgericht Hannover",
      "registernummer": "HRB 217148",
      "registerart": "HRB",
      "company_name": "MOIA Operations Germany GmbH",
      "company_seat": "Hannover",
      "details": "14.11.2025 (Bekanntmachungsdatum)\n\nNiedersachsen Amtsgericht Hannover HRB 217148\nEinreichung neuer Dokumente\n\nMOIA Operations Germany GmbH\nGesellschaft mit beschränkter Haftung\nHannover\n\nDie Liste der Mitglieder des Aufsichtsrats wurde beim Registergericht eingereicht."
    },
    {
      "date": "2025-11-14",
      "id": "137372",
      "original_text": "Registerbekanntmachung nach dem Umwandlungsgesetz\nNiedersachsen Amtsgericht Osnabrück HRB 220519\nBohnenkamp SE – Osnabrück",
      "type": "Registerbekanntmachung nach dem Umwandlungsgesetz",
      "state": "Niedersachsen",
      "amtsgericht": "Amtsgericht Osnabrück",
      "registernummer": "HRB 220519",
      "registerart": "HRB",
      "company_name": "Bohnenkamp SE",
      "company_seat": "Osnabrück",
      "details": "14.11.2025 (Bekanntmachungsdatum)\n\nNiedersachsen Amtsgericht Osnabrück HRB 220519\nRegisterbekanntmachung nach dem Umwandlungsgesetz 14.11.2025 (Eintragungsdatum)\n\nBohnenkamp SE\nEuropäische Aktiengesellschaft (SE)\nOsnabrück\n\nDen Gläubigern der an der Verschmelzung beteiligten Rechtsträger ist, wenn sie binnen sechs Monaten nach dem Tag, an dem die Eintragung der Verschmelzung in das Register des Sitzes desjenigen Rechtsträgers, dessen Gläubiger sie sind, nach § 19  Abs.  3 UmwG als bekannt gemacht gilt, ihren Anspruch nach Grund und Höhe schriftlich anmelden, Sicherheit zu leisten, soweit sie nicht Befriedigung verlangen können. Dieses Recht steht den Gläubigern jedoch nur zu, wenn sie glaubhaft machen, dass durch die Verschmelzung die Erfüllung der Forderung gefährdet wird."
    },
    {
      "date": "2025-11-14",
      "id": "137373",
      "original_text": "Einreichung neuer Dokumente\nNiedersachsen Amtsgericht Hildesheim HRB 3259\nWirtschaftsförderungsgesellschaft Hildesheim Region (HI-REG) mbH – Hildesheim",
      "type": "Einreichung neuer Dokumente",
      "state": "Niedersachsen",
      "amtsgericht": "Amtsgericht Hildesheim",
      "registernummer": "HRB 3259",
      "registerart": "HRB",
      "company_name": "Wirtschaftsförderungsgesellschaft Hildesheim Region (HI-REG) mbH",
      "company_seat": "Hildesheim",
      "details": "14.11.2025 (Bekanntmachungsdatum)\n\nNiedersachsen Amtsgericht Hildesheim HRB 3259\nEinreichung neuer Dokumente\n\nWirtschaftsförderungsgesellschaft Hildesheim Region (HI-REG) mbH\nGesellschaft mit beschränkter Haftung\nHildesheim\n\nDie Liste der Mitglieder des Aufsichtsrats wurde beim Registergericht eingereicht."
    },
    {
      "date": "2025-11-14",
      "id": "137374",
      "original_text": "Registerbekanntmachung nach dem Umwandlungsgesetz\nNiedersachsen Amtsgericht Lüneburg HRB 200885\nMathias Schulz Management GmbH – Lüneburg",
      "type": "Registerbekanntmachung nach dem Umwandlungsgesetz",
      "state": "Niedersachsen",
      "amtsgericht": "Amtsgericht Lüneburg",
      "registernummer": "HRB 200885",
      "registerart": "HRB",
      "company_name": "Mathias Schulz Management GmbH",
      "company_seat": "Lüneburg",
      "details": "14.11.2025 (Bekanntmachungsdatum)\n\nNiedersachsen Amtsgericht Lüneburg HRB 200885\nRegisterbekanntmachung nach dem Umwandlungsgesetz 14.11.2025 (Eintragungsdatum)\n\nMathias Schulz Management GmbH\nGesellschaft mit beschränkter Haftung\nLüneburg\n\nDen Gläubigern der an der formwechselnden Umwandlung beteiligten Rechtsträger ist, wenn sie binnen sechs Monaten nach dem Tag, an dem die Eintragung der Umwandlung in das Register des Sitzes desjenigen Rechtsträgers, dessen Gläubiger sie sind, nach § 19 Abs. 3 UmwG als bekannt gemacht gilt, ihren Anspruch nach Grund und Höhe schriftlich anmelden, Sicherheit zu leisten, soweit sie nicht Befriedigung verlangen können. Dieses Recht steht den Gläubigern jedoch nur zu, wenn sie glaubhaft machen, dass durch die formwechselnde Umwandlung die Erfüllung der Forderung gefährdet wird."
    },
    {
      "date": "2025-11-14",
      "id": "137375",
      "original_text": "Registerbekanntmachung nach dem Umwandlungsgesetz\nNiedersachsen Amtsgericht Walsrode HRB 212562\nPeak & Power GmbH – Scheeßel",
      "type": "Registerbekanntmachung nach dem Umwandlungsgesetz",
      "state": "Niedersachsen",
      "amtsgericht": "Amtsgericht Walsrode",
      "registernummer": "HRB 212562",
      "registerart": "HRB",
      "company_name": "Peak & Power GmbH",
      "company_seat": "Scheeßel",
      "details": "14.11.2025 (Bekanntmachungsdatum)\n\nNiedersachsen Amtsgericht Walsrode HRB 212562\nRegisterbekanntmachung nach dem Umwandlungsgesetz 14.11.2025 (Eintragungsdatum)\n\nPeak & Power GmbH\nGesellschaft mit beschränkter Haftung\nScheeßel\n\nDen Gläubigern der an der Verschmelzung beteiligten Rechtsträger ist, wenn sie binnen sechs Monaten nach dem Tag, an dem die Eintragung der Verschmelzung in das Register des Sitzes desjenigen Rechtsträgers, dessen Gläubiger sie sind, nach § 19  Abs.  3 UmwG als bekannt gemacht gilt, ihren Anspruch nach Grund und Höhe schriftlich anmelden, Sicherheit zu leisten, soweit sie nicht Befriedigung verlangen können. Dieses Recht steht den Gläubigern jedoch nur zu, wenn sie glaubhaft machen, dass durch die Verschmelzung die Erfüllung der Forderung gefährdet wird."
    },
    {
      "date": "2025-11-14",
      "id": "137376",
      "original_text": "Löschungsankündigung\nRheinland-Pfalz Amtsgericht Bad Kreuznach HRB 21966\nVital- und Nährstoffcenter Sàrl – Bundenbach",
      "type": "Löschungsankündigung",
      "state": "Rheinland-Pfalz",
      "amtsgericht": "Amtsgericht Bad Kreuznach",
      "registernummer": "HRB 21966",
      "registerart": "HRB",
      "company_name": "Vital- und Nährstoffcenter Sàrl",
      "company_seat": "Bundenbach",
      "details": "14.11.2025 (Bekanntmachungsdatum)\n\nRheinland-Pfalz Amtsgericht Bad Kreuznach HRB 21966\nLöschungsankündigung\n\nVital- und Nährstoffcenter Sàrl\nRechtsform ausländischen Rechts HRB\nBundenbach\n\nDas Registergericht beabsichtigt die Zweigniederlassung der ausländischen Hauptniederlassung von Amts wegen nach § 395 FamFG zu löschen.\nDie Frist zur Erhebung eines Widerspruchs ist auf  einen Monat  festgesetzt."
    },
    {
      "date": "2025-11-14",
      "id": "137377",
      "original_text": "Registerbekanntmachung nach dem Umwandlungsgesetz\nRheinland-Pfalz Amtsgericht Bad Kreuznach HRB 1181\nFLEISCHHAUER Autozentrum Verwaltungsgesellschaft mbH – Bad Kreuznach",
      "type": "Registerbekanntmachung nach dem Umwandlungsgesetz",
      "state": "Rheinland-Pfalz",
      "amtsgericht": "Amtsgericht Bad Kreuznach",
      "registernummer": "HRB 1181",
      "registerart": "HRB",
      "company_name": "FLEISCHHAUER Autozentrum Verwaltungsgesellschaft mbH",
      "company_seat": "Bad Kreuznach",
      "details": "14.11.2025 (Bekanntmachungsdatum)\n\nRheinland-Pfalz Amtsgericht Bad Kreuznach HRB 1181\nRegisterbekanntmachung nach dem Umwandlungsgesetz 14.11.2025 (Eintragungsdatum)\n\nFLEISCHHAUER  Autozentrum Verwaltungsgesellschaft mbH\nGesellschaft mit beschränkter Haftung\nBad Kreuznach\n\nDem Registergericht ist eine Liste der Mitglieder des Aufsichtsrates eingereicht worden. Als nicht eingetragen wird veröffentlicht: Den Gläubigern der an der Verschmelzung beteiligten Rechtsträger ist, wenn sie binnen sechs Monaten nach dem Tag, an dem die Eintragung der Verschmelzung in das Register des Sitzes desjenigen Rechtsträgers,dessen Gläubiger sie sind, nach § 19 Abs. 3 UmwG als bekannt gemacht gilt, ihren Anspruch nach Grund und Höhe schriftlich anmelden, Sicherheit zu leisten, soweit sie nicht Befriedigung verlangen können. Dieses Recht steht den Gläubigern jedoch nur zu, wenn sie glaubhaft machen, dass durch die Verschmelzung die Erfüllung der Forderung gefährdet wird."
    },
    {
      "date": "2025-11-14",
      "id": "137378",
      "original_text": "Registerbekanntmachung nach dem Umwandlungsgesetz\nNordrhein-Westfalen Amtsgericht Duisburg HRA 12846\nBedachungen Göven e.K. – Duisburg",
      "type": "Registerbekanntmachung nach dem Umwandlungsgesetz",
      "state": "Nordrhein-Westfalen",
      "amtsgericht": "Amtsgericht Duisburg",
      "registernummer": "HRA 12846",
      "registerart": "HRA",
      "company_name": "Bedachungen Göven e.K.",
      "company_seat": "Duisburg",
      "details": "14.11.2025 (Bekanntmachungsdatum)\n\nNordrhein-Westfalen Amtsgericht Duisburg HRA 12846\nRegisterbekanntmachung nach dem Umwandlungsgesetz 14.11.2025 (Eintragungsdatum)\n\nBedachungen Göven e.K.\nEinzelkaufmann / Einzelkauffrau\nDuisburg\n\nDen Gläubigern der an der Ausgliederung beteiligten Rechtsträger ist, wenn sie binnen sechs Monaten nach dem Tag, an dem die Eintragung der Ausgliederung in das Register des Sitzes desjenigen Rechtsträgers, dessen Gläubiger sie sind, nach § 19 Absatz 3 UmwG als bekanntgemacht gilt, ihren Anspruch nach Grund und Höhe schriftlich anmelden, Sicherheit zu leisten, soweit sie nicht Befriedigung verlangen können. Dieses Recht steht den Gläubigern jedoch nur zu, wenn sie glaubhaft machen, dass durch die Ausgliederung die Erfüllung ihrer Forderung gefährdet wird."
    },
    {
      "date": "2025-11-14",
      "id": "137379",
      "original_text": "Registerbekanntmachung nach dem Umwandlungsgesetz\nNordrhein-Westfalen Amtsgericht Bochum HRB 17800\nHeinrich Stratmann Verwaltungs-GmbH – Witten",
      "type": "Registerbekanntmachung nach dem Umwandlungsgesetz",
      "state": "Nordrhein-Westfalen",
      "amtsgericht": "Amtsgericht Bochum",
      "registernummer": "HRB 17800",
      "registerart": "HRB",
      "company_name": "Heinrich Stratmann Verwaltungs-GmbH",
      "company_seat": "Witten",
      "details": "14.11.2025 (Bekanntmachungsdatum)\n\nNordrhein-Westfalen Amtsgericht Bochum HRB 17800\nRegisterbekanntmachung nach dem Umwandlungsgesetz 13.11.2025 (Eintragungsdatum)\n\nHeinrich Stratmann Verwaltungs-GmbH\nGesellschaft mit beschränkter Haftung\nWitten\n\nDen Gläubigern der an der Verschmelzung beteiligten Rechtsträger ist, wenn sie binnen sechs Monaten nach dem Tag, an dem die Eintragung der Verschmelzung in das Register des Sitzes desjenigen Rechtsträgers, dessen Gläubiger sie sind, nach § 19 Absatz 3 UmwG als bekanntgemacht gilt, ihren Anspruch nach Grund und Höhe schriftlich anmelden, Sicherheit zu leisten, soweit sie nicht Befriedigung verlangen können. Dieses Recht steht den Gläubigern jedoch nur zu, wenn sie glaubhaft machen, dass durch die Verschmelzung die Erfüllung ihrer Forderung gefährdet wird."
    },
    {
      "date": "2025-11-14",
      "id": "137380",
      "original_text": "Löschungsankündigung\nNordrhein-Westfalen Amtsgericht Hagen HRB 13112\nA.B.S. Bau UG (haftungsbeschränkt) – Hagen",
      "type": "Löschungsankündigung",
      "state": "Nordrhein-Westfalen",
      "amtsgericht": "Amtsgericht Hagen",
      "registernummer": "HRB 13112",
      "registerart": "HRB",
      "company_name": "A.B.S. Bau UG (haftungsbeschränkt)",
      "company_seat": "Hagen",
      "details": "14.11.2025 (Bekanntmachungsdatum)\n\nNordrhein-Westfalen Amtsgericht Hagen HRB 13112\nLöschungsankündigung\n\nA.B.S. Bau UG (haftungsbeschränkt)\nGesellschaft mit beschränkter Haftung\nHagen\n\nDas Registergericht beabsichtigt, die im Handelsregister eingetragene Gesellschaft gemäß § 394 Absatz 1 FamFG wegen Vermögenslosigkeit von Amts wegen zu löschen.  Gegen diese Verfügung kann Widerspruch eingelegt werden. Die Frist zur Erhebung eines Widerspruchs gegen die beabsichtigte Löschung von Amts wegen ist auf drei Monate festgesetzt.\n\nRechtsbehelfsbelehrung:\nGegen diese Verfügung können Sie Widerspruch einlegen.\n\nDer Widerspruch ist bei dem Amtsgericht Hagen, Heinitzstraße 42, 58097 Hagen schriftlich in deutscher Sprache oder zur Niederschrift der Geschäftsstelle einzulegen. Der Widerspruch kann auch zur Niederschrift der Geschäftsstelle eines jeden Amtsgerichtes abgegeben werden.\n\nDer Widerspruch muss spätestens innerhalb der gesetzten Frist bei dem Amtsgericht Hagen eingegangen sein. Dies gilt auch dann, wenn der Widerspruch zur Niederschrift der Geschäftsstelle eines anderen Amtsgerichtes abgegeben wurde. Die Frist beginnt mit der Veröffentlichung. Fällt das Ende der Frist auf einen Sonntag, einen allgemeinen Feiertag oder Sonnabend, so endet die Frist mit Ablauf des nächsten Werktages.\n\nDer Widerspruch muss die Bezeichnung der angefochtenen Verfügung sowie die Erklärung enthalten, dass Widerspruch gegen diese Verfügung eingelegt wird. Er ist zu unterzeichnen und soll begründet werden."
    },
    {
      "date": "2025-11-14",
      "id": "137381",
      "original_text": "Registerbekanntmachung nach dem Umwandlungsgesetz\nNordrhein-Westfalen Amtsgericht Düren HRB 6224\n5flow GmbH – Jülich",
      "type": "Registerbekanntmachung nach dem Umwandlungsgesetz",
      "state": "Nordrhein-Westfalen",
      "amtsgericht": "Amtsgericht Düren",
      "registernummer": "HRB 6224",
      "registerart": "HRB",
      "company_name": "5flow GmbH",
      "company_seat": "Jülich",
      "details": "14.11.2025 (Bekanntmachungsdatum)\n\nNordrhein-Westfalen Amtsgericht Düren HRB 6224\nRegisterbekanntmachung nach dem Umwandlungsgesetz 10.11.2025 (Eintragungsdatum)\n\n5flow GmbH\nGesellschaft mit beschränkter Haftung\nJülich\n\nAls nicht eingetragen wird veröffentlicht: Den Gläubigern der Gesellschaft, deren Forderungen begründet worden sind bevor die Eintragung der Beendigung des Beherrschungs- und Gewinnabführungsvertrages  in das Handelsregister nach § 10 des Handelsgesetzbuches als bekanntgemacht gilt, hat der andere Vertragsteil Sicherheit zu leisten, wenn sie sich binnen sechs Monaten nach der Bekanntmachung der Eintragung zu diesem Zweck bei ihm melden."
    },
    {
      "date": "2025-11-14",
      "id": "137382",
      "original_text": "Löschungsankündigung\nNordrhein-Westfalen Amtsgericht Wuppertal HRB 30857\nHandyonkel GmbH – Wuppertal",
      "type": "Löschungsankündigung",
      "state": "Nordrhein-Westfalen",
      "amtsgericht": "Amtsgericht Wuppertal",
      "registernummer": "HRB 30857",
      "registerart": "HRB",
      "company_name": "Handyonkel GmbH",
      "company_seat": "Wuppertal",
      "details": "14.11.2025 (Bekanntmachungsdatum)\n\nNordrhein-Westfalen Amtsgericht Wuppertal HRB 30857\nLöschungsankündigung\n\nHandyonkel GmbH\nGesellschaft mit beschränkter Haftung\nWuppertal\n\nDas Registergericht beabsichtigt die Gesellschaft von Amts wegen nach § 394 FamFG zu löschen. Die Frist zur Erhebung eines Widerspruchs ist auf einen Monat festgesetzt."
    },
    {
      "date": "2025-11-14",
      "id": "137383",
      "original_text": "Einreichung neuer Dokumente\nNordrhein-Westfalen Amtsgericht Duisburg HRB 36109\nEvangelische Dienste Duisburg gGmbH – Duisburg",
      "type": "Einreichung neuer Dokumente",
      "state": "Nordrhein-Westfalen",
      "amtsgericht": "Amtsgericht Duisburg",
      "registernummer": "HRB 36109",
      "registerart": "HRB",
      "company_name": "Evangelische Dienste Duisburg gGmbH",
      "company_seat": "Duisburg",
      "details": "14.11.2025 (Bekanntmachungsdatum)\n\nNordrhein-Westfalen Amtsgericht Duisburg HRB 36109\nEinreichung neuer Dokumente 14.11.2025 (Eintragungsdatum)\n\nEvangelische Dienste Duisburg gGmbH\nGesellschaft mit beschränkter Haftung\nDuisburg\n\nDem Registergericht ist eine Liste der Mitglieder des Aufsichtsrates eingereicht worden."
    },
    {
      "date": "2025-11-14",
      "id": "137384",
      "original_text": "Registerbekanntmachung nach dem Umwandlungsgesetz\nNordrhein-Westfalen Amtsgericht Duisburg HRA 13541\nAydöner Immobilien e.K. – Duisburg",
      "type": "Registerbekanntmachung nach dem Umwandlungsgesetz",
      "state": "Nordrhein-Westfalen",
      "amtsgericht": "Amtsgericht Duisburg",
      "registernummer": "HRA 13541",
      "registerart": "HRA",
      "company_name": "Aydöner Immobilien e.K.",
      "company_seat": "Duisburg",
      "details": "14.11.2025 (Bekanntmachungsdatum)\n\nNordrhein-Westfalen Amtsgericht Duisburg HRA 13541\nRegisterbekanntmachung nach dem Umwandlungsgesetz 14.11.2025 (Eintragungsdatum)\n\nAydöner Immobilien e.K.\nEinzelkaufmann / Einzelkauffrau\nDuisburg\n\nDen Gläubigern der an der Ausgliederung beteiligten Rechtsträger ist, wenn sie binnen sechs Monaten nach dem Tag, an dem die Eintragung der Ausgliederung in das Register des Sitzes desjenigen Rechtsträgers, dessen Gläubiger sie sind, nach § 19 Absatz 3 UmwG als bekanntgemacht gilt, ihren Anspruch nach Grund und Höhe schriftlich anmelden, Sicherheit zu leisten, soweit sie nicht Befriedigung verlangen können. Dieses Recht steht den Gläubigern jedoch nur zu, wenn sie glaubhaft machen, dass durch die Ausgliederung die Erfüllung ihrer Forderung gefährdet wird."
    },
    {
      "date": "2025-11-14",
      "id": "137385",
      "original_text": "Registerbekanntmachung nach dem Umwandlungsgesetz\nNordrhein-Westfalen Amtsgericht Bonn GsR 727\nRick-Remmel Immobilien eGbR – Bonn",
      "type": "Registerbekanntmachung nach dem Umwandlungsgesetz",
      "state": "Nordrhein-Westfalen",
      "amtsgericht": "Amtsgericht Bonn",
      "registernummer": "GsR 727",
      "registerart": "GsR",
      "company_name": "Rick-Remmel Immobilien eGbR",
      "company_seat": "Bonn",
      "details": "14.11.2025 (Bekanntmachungsdatum)\n\nNordrhein-Westfalen Amtsgericht Bonn GsR 727\nRegisterbekanntmachung nach dem Umwandlungsgesetz 12.11.2025 (Eintragungsdatum)\n\nRick-Remmel Immobilien eGbR\nGesellschaft bürgerlichen Rechts\nBonn\n\nDen Gläubigern der an der formwechselnden Umwandlung beteiligten Rechtsträger ist, wenn sie binnen sechs Monaten nach dem Tag, an dem die Eintragung der formwechselnden Umwandlung in das Register des Sitzes desjenigen Rechtsträgers, dessen Gläubiger sie sind, nach § 19 Absatz 3 UmwG als bekanntgemacht gilt, ihren Anspruch nach Grund und Höhe schriftlich anmelden, Sicherheit zu leisten, soweit sie nicht Befriedigung verlangen können. Dieses Recht steht den Gläubigern jedoch nur zu, wenn sie glaubhaft machen, dass durch die formwechselnden Umwandlung die Erfüllung ihrer Forderung gefährdet wird."
    },
    {
      "date": "2025-11-14",
      "id": "137386",
      "original_text": "Registerbekanntmachung nach dem Umwandlungsgesetz\nNordrhein-Westfalen Amtsgericht Bochum HRB 22639\nGlubo Immobilien GmbH – Bochum",
      "type": "Registerbekanntmachung nach dem Umwandlungsgesetz",
      "state": "Nordrhein-Westfalen",
      "amtsgericht": "Amtsgericht Bochum",
      "registernummer": "HRB 22639",
      "registerart": "HRB",
      "company_name": "Glubo Immobilien GmbH",
      "company_seat": "Bochum",
      "details": "14.11.2025 (Bekanntmachungsdatum)\n\nNordrhein-Westfalen Amtsgericht Bochum HRB 22639\nRegisterbekanntmachung nach dem Umwandlungsgesetz 13.11.2025 (Eintragungsdatum)\n\nGlubo Immobilien GmbH\nGesellschaft mit beschränkter Haftung\nBochum\n\nDen Gläubigern der an der Ausgliederung beteiligten Rechtsträger ist, wenn sie binnen sechs Monaten nach dem Tag, an dem die Eintragung der Ausgliederung in das Register des Sitzes desjenigen Rechtsträgers, dessen Gläubiger sie sind, nach § 19 Absatz 3 UmwG als bekanntgemacht gilt, ihren Anspruch nach Grund und Höhe schriftlich anmelden, Sicherheit zu leisten, soweit sie nicht Befriedigung verlangen können. Dieses Recht steht den Gläubigern jedoch nur zu, wenn sie glaubhaft machen, dass durch die Ausgliederung die Erfüllung ihrer Forderung gefährdet wird."
    },
    {
      "date": "2025-11-14",
      "id": "137387",
      "original_text": "Löschungsankündigung\nNordrhein-Westfalen Amtsgericht Dortmund HRB 23192\nDMWD GmbH – Castrop-Rauxel",
      "type": "Löschungsankündigung",
      "state": "Nordrhein-Westfalen",
      "amtsgericht": "Amtsgericht Dortmund",
      "registernummer": "HRB 23192",
      "registerart": "HRB",
      "company_name": "DMWD GmbH",
      "company_seat": "Castrop-Rauxel",
      "details": "14.11.2025 (Bekanntmachungsdatum)\n\nNordrhein-Westfalen Amtsgericht Dortmund HRB 23192\nLöschungsankündigung 14.11.2025 (Eintragungsdatum)\n\nDMWD GmbH\nGesellschaft mit beschränkter Haftung\nCastrop-Rauxel\n\nDas Registergericht beabsichtigt die Gesellschaft von Amts wegen nach § 394 FamFG zu löschen. Die Frist zur Erhebung eines Widerspruchs ist auf zwei Monate festgesetzt."
    },
    {
      "date": "2025-11-14",
      "id": "137388",
      "original_text": "Löschungsankündigung\nNordrhein-Westfalen Amtsgericht Mönchengladbach HRB 19027\nBSG UG (haftungsbeschränkt) – Mönchengladbach",
      "type": "Löschungsankündigung",
      "state": "Nordrhein-Westfalen",
      "amtsgericht": "Amtsgericht Mönchengladbach",
      "registernummer": "HRB 19027",
      "registerart": "HRB",
      "company_name": "BSG UG (haftungsbeschränkt)",
      "company_seat": "Mönchengladbach",
      "details": "14.11.2025 (Bekanntmachungsdatum)\n\nNordrhein-Westfalen Amtsgericht Mönchengladbach HRB 19027\nLöschungsankündigung\n\nBSG UG (haftungsbeschränkt)\nGesellschaft mit beschränkter Haftung\nMönchengladbach\n\nIst nur ein Test"
    },
    {
      "date": "2025-11-14",
      "id": "137389",
      "original_text": "Registerbekanntmachung nach dem Umwandlungsgesetz\nNordrhein-Westfalen Amtsgericht Duisburg HRA 13733\nGÖVEN Bedachungen GmbH & Co. KG – Duisburg",
      "type": "Registerbekanntmachung nach dem Umwandlungsgesetz",
      "state": "Nordrhein-Westfalen",
      "amtsgericht": "Amtsgericht Duisburg",
      "registernummer": "HRA 13733",
      "registerart": "HRA",
      "company_name": "GÖVEN Bedachungen GmbH & Co. KG",
      "company_seat": "Duisburg",
      "details": "14.11.2025 (Bekanntmachungsdatum)\n\nNordrhein-Westfalen Amtsgericht Duisburg HRA 13733\nRegisterbekanntmachung nach dem Umwandlungsgesetz 14.11.2025 (Eintragungsdatum)\n\nGÖVEN Bedachungen GmbH & Co. KG\nKommanditgesellschaft\nDuisburg\n\nDen Gläubigern der an der Ausgliederung beteiligten Rechtsträger ist, wenn sie binnen sechs Monaten nach dem Tag, an dem die Eintragung der Ausgliederung in das Register des Sitzes desjenigen Rechtsträgers, dessen Gläubiger sie sind, nach § 19 Absatz 3 UmwG als bekanntgemacht gilt, ihren Anspruch nach Grund und Höhe schriftlich anmelden, Sicherheit zu leisten, soweit sie nicht Befriedigung verlangen können. Dieses Recht steht den Gläubigern jedoch nur zu, wenn sie glaubhaft machen, dass durch die Ausgliederung die Erfüllung ihrer Forderung gefährdet wird."
    },
    {
      "date": "2025-11-14",
      "id": "137390",
      "original_text": "Löschungsankündigung\nNordrhein-Westfalen Amtsgericht Dortmund HRB 28922\nAB Fashion & Brand GmbH – Dortmund",
      "type": "Löschungsankündigung",
      "state": "Nordrhein-Westfalen",
      "amtsgericht": "Amtsgericht Dortmund",
      "registernummer": "HRB 28922",
      "registerart": "HRB",
      "company_name": "AB Fashion & Brand GmbH",
      "company_seat": "Dortmund",
      "details": "14.11.2025 (Bekanntmachungsdatum)\n\nNordrhein-Westfalen Amtsgericht Dortmund HRB 28922\nLöschungsankündigung 14.11.2025 (Eintragungsdatum)\n\nAB Fashion & Brand GmbH\nGesellschaft mit beschränkter Haftung\nDortmund\n\nDas Registergericht beabsichtigt die Gesellschaft von Amts wegen nach § 394 FamFG zu löschen. Die Frist zur Erhebung eines Widerspruchs ist auf zwei Monate festgesetzt."
    },
    {
      "date": "2025-11-14",
      "id": "137391",
      "original_text": "Löschungsankündigung\nNordrhein-Westfalen Amtsgericht Wuppertal HRB 29177\ndergruenegaumen gastro UG (haftungsbeschränkt) – Mettmann",
      "type": "Löschungsankündigung",
      "state": "Nordrhein-Westfalen",
      "amtsgericht": "Amtsgericht Wuppertal",
      "registernummer": "HRB 29177",
      "registerart": "HRB",
      "company_name": "dergruenegaumen gastro UG (haftungsbeschränkt)",
      "company_seat": "Mettmann",
      "details": "14.11.2025 (Bekanntmachungsdatum)\n\nNordrhein-Westfalen Amtsgericht Wuppertal HRB 29177\nLöschungsankündigung\n\ndergruenegaumen gastro UG (haftungsbeschränkt)\nGesellschaft mit beschränkter Haftung\nMettmann\n\nDas Registergericht beabsichtigt die Gesellschaft von Amts wegen nach § 394 FamFG zu löschen. Die Frist zur Erhebung eines Widerspruchs ist auf einen Monat festgesetzt."
    },
    {
      "date": "2025-11-14",
      "id": "137392",
      "original_text": "Löschungsankündigung\nNordrhein-Westfalen Amtsgericht Wuppertal HRB 27518\nGBM - Gebäude-Bau-Management GmbH – Velbert",
      "type": "Löschungsankündigung",
      "state": "Nordrhein-Westfalen",
      "amtsgericht": "Amtsgericht Wuppertal",
      "registernummer": "HRB 27518",
      "registerart": "HRB",
      "company_name": "GBM - Gebäude-Bau-Management GmbH",
      "company_seat": "Velbert",
      "details": "14.11.2025 (Bekanntmachungsdatum)\n\nNordrhein-Westfalen Amtsgericht Wuppertal HRB 27518\nLöschungsankündigung 13.11.2025 (Eintragungsdatum)\n\nGBM - Gebäude-Bau-Management GmbH\nGesellschaft mit beschränkter Haftung\nVelbert\n\nDas Registergericht beabsichtigt die Gesellschaft von Amts wegen nach § 394 FamFG zu löschen. Die Frist zur Erhebung eines Widerspruchs ist auf einen Monat festgesetzt."
    },
    {
      "date": "2025-11-14",
      "id": "137393",
      "original_text": "Löschungsankündigung\nNordrhein-Westfalen Amtsgericht Bochum HRB 18361\nOchO GmbH – Bochum",
      "type": "Löschungsankündigung",
      "state": "Nordrhein-Westfalen",
      "amtsgericht": "Amtsgericht Bochum",
      "registernummer": "HRB 18361",
      "registerart": "HRB",
      "company_name": "OchO GmbH",
      "company_seat": "Bochum",
      "details": "14.11.2025 (Bekanntmachungsdatum)\n\nNordrhein-Westfalen Amtsgericht Bochum HRB 18361\nLöschungsankündigung\n\nOchO GmbH\nGesellschaft mit beschränkter Haftung\nBochum\n\nDas Registergericht beabsichtigt die Gesellschaft von Amts wegen nach § 394 FamFG zu löschen. Die Frist zur Erhebung eines Widerspruchs ist auf drei Monate festgesetzt."
    },
    {
      "date": "2025-11-14",
      "id": "137394",
      "original_text": "Löschungsankündigung\nNordrhein-Westfalen Amtsgericht Kleve HRA 4413\nPhoenix Grundbesitz Ltd. & Co. KG – Goch",
      "type": "Löschungsankündigung",
      "state": "Nordrhein-Westfalen",
      "amtsgericht": "Amtsgericht Kleve",
      "registernummer": "HRA 4413",
      "registerart": "HRA",
      "company_name": "Phoenix Grundbesitz Ltd. & Co. KG",
      "company_seat": "Goch",
      "details": "14.11.2025 (Bekanntmachungsdatum)\n\nNordrhein-Westfalen Amtsgericht Kleve HRA 4413\nLöschungsankündigung 25.11.2019 (Eintragungsdatum)\n\nPhoenix Grundbesitz Ltd. & Co. KG\nKommanditgesellschaft\nGoch\n\nDas Registergericht beabsichtigt, die mit \"Südring 52, 47574 Goch\" eingetragene Geschäftsanschrift von Amts wegen nach § 395 FamFG zu löschen, da sie unzutreffend ist. Die Anmeldepflichtige hat bisher eine Anmeldung unterlassen und ist derzeit unbekannten Aufenthalts.Die Frist zur Erhebung eines Widerspruchs ist auf einen Monat festgesetzt."
    },
    {
      "date": "2025-11-14",
      "id": "137395",
      "original_text": "Registerbekanntmachung nach dem Umwandlungsgesetz\nNordrhein-Westfalen Amtsgericht Duisburg HRA 13698\nMMA Immobilien GmbH & Co. KG – Duisburg",
      "type": "Registerbekanntmachung nach dem Umwandlungsgesetz",
      "state": "Nordrhein-Westfalen",
      "amtsgericht": "Amtsgericht Duisburg",
      "registernummer": "HRA 13698",
      "registerart": "HRA",
      "company_name": "MMA Immobilien GmbH & Co. KG",
      "company_seat": "Duisburg",
      "details": "14.11.2025 (Bekanntmachungsdatum)\n\nNordrhein-Westfalen Amtsgericht Duisburg HRA 13698\nRegisterbekanntmachung nach dem Umwandlungsgesetz 14.11.2025 (Eintragungsdatum)\n\nMMA Immobilien GmbH & Co. KG\nKommanditgesellschaft\nDuisburg\n\nDen Gläubigern der an der Ausgliederung beteiligten Rechtsträger ist, wenn sie binnen sechs Monaten nach dem Tag, an dem die Eintragung der Ausgliederung in das Register des Sitzes desjenigen Rechtsträgers, dessen Gläubiger sie sind, nach § 19 Absatz 3 UmwG als bekanntgemacht gilt, ihren Anspruch nach Grund und Höhe schriftlich anmelden, Sicherheit zu leisten, soweit sie nicht Befriedigung verlangen können. Dieses Recht steht den Gläubigern jedoch nur zu, wenn sie glaubhaft machen, dass durch die Ausgliederung die Erfüllung ihrer Forderung gefährdet wird."
    },
    {
      "date": "2025-11-14",
      "id": "137396",
      "original_text": "Registerbekanntmachung nach dem Umwandlungsgesetz\nNordrhein-Westfalen Amtsgericht Hamm HRA 4320\nC. Kuhlmann Elektrotechnik GmbH & Co. KG – Hamm",
      "type": "Registerbekanntmachung nach dem Umwandlungsgesetz",
      "state": "Nordrhein-Westfalen",
      "amtsgericht": "Amtsgericht Hamm",
      "registernummer": "HRA 4320",
      "registerart": "HRA",
      "company_name": "C. Kuhlmann Elektrotechnik GmbH & Co. KG",
      "company_seat": "Hamm",
      "details": "14.11.2025 (Bekanntmachungsdatum)\n\nNordrhein-Westfalen Amtsgericht Hamm HRA 4320\nRegisterbekanntmachung nach dem Umwandlungsgesetz 14.11.2025 (Eintragungsdatum)\n\nC. Kuhlmann Elektrotechnik GmbH & Co. KG\nKommanditgesellschaft\nHamm\n\nDen Gläubigern der an der formwechselnden Umwandlung beteiligten Rechtsträger ist, wenn sie binnen sechs Monaten nach dem Tag, an dem die Eintragung der formwechselnden Umwandlung in das Register des Sitzes derjenigen Rechtsträger deren Gläubiger sie sind, nach § 19 Absatz 3 UmwG als bekanntgemacht gilt, ihren Anspruch nach Grund und Höhe schriftlich anmelden, Sicherheit zu leisten, soweit sie nicht Befriedigung verlangen können. Dieses Recht steht den Gläubigern jedoch nur zu, wenn sie glaubhaft machen, dass durch die formwechselnden Umwandlung die Erfüllung ihrer Forderung gefährdet wird."
    },
    {
      "date": "2025-11-14",
      "id": "137397",
      "original_text": "Registerbekanntmachung nach dem Umwandlungsgesetz\nNordrhein-Westfalen Amtsgericht Düsseldorf HRB 85996\nGatter 3 EMS GmbH – Düsseldorf",
      "type": "Registerbekanntmachung nach dem Umwandlungsgesetz",
      "state": "Nordrhein-Westfalen",
      "amtsgericht": "Amtsgericht Düsseldorf",
      "registernummer": "HRB 85996",
      "registerart": "HRB",
      "company_name": "Gatter 3 EMS GmbH",
      "company_seat": "Düsseldorf",
      "details": "14.11.2025 (Bekanntmachungsdatum)\n\nNordrhein-Westfalen Amtsgericht Düsseldorf HRB 85996\nRegisterbekanntmachung nach dem Umwandlungsgesetz 14.11.2025 (Eintragungsdatum)\n\nGatter 3 EMS GmbH\nGesellschaft mit beschränkter Haftung\nDüsseldorf\n\nDen Gläubigern der an der Verschmelzung beteiligten Rechtsträger ist, wenn sie binnen sechs Monaten nach dem Tag, an dem die Eintragung der Verschmelzung in das Register des Sitzes desjenigen Rechtsträgers, dessen Gläubiger sie sind, nach § 19 Absatz 3 UmwG als bekanntgemacht gilt, ihren Anspruch nach Grund und Höhe schriftlich anmelden, Sicherheit zu leisten, soweit sie nicht Befriedigung verlangen können. Dieses Recht steht den Gläubigern jedoch nur zu, wenn sie glaubhaft machen, dass durch die Verschmelzung die Erfüllung ihrer Forderung gefährdet wird."
    },
    {
      "date": "2025-11-14",
      "id": "137398",
      "original_text": "Löschungsankündigung\nNordrhein-Westfalen Amtsgericht Düsseldorf HRB 92811\nALPHA VITALITY GmbH – Düsseldorf",
      "type": "Löschungsankündigung",
      "state": "Nordrhein-Westfalen",
      "amtsgericht": "Amtsgericht Düsseldorf",
      "registernummer": "HRB 92811",
      "registerart": "HRB",
      "company_name": "ALPHA VITALITY GmbH",
      "company_seat": "Düsseldorf",
      "details": "14.11.2025 (Bekanntmachungsdatum)\n\nNordrhein-Westfalen Amtsgericht Düsseldorf HRB 92811\nLöschungsankündigung\n\nALPHA VITALITY GmbH\nGesellschaft mit beschränkter Haftung\nDüsseldorf\n\nDas Registergericht beabsichtigt die Gesellschaft von Amts wegen nach § 394 FamFG zu löschen. Die Frist zur Erhebung eines Widerspruchs ist auf 3 Wochen festgesetzt.\n\nRechtsbehelfsbelehrung:\nDas Widerspruchsrecht steht jedem zu, der an der Unterlassung der Löschung ein berechtigtes Interesse hat. Der Widerspruch ist bei dem Amtsgericht Düsseldorf -Registergericht-, Werdener Straße 1, 40227 Düsseldorf schriftlich in deutscher Sprache oder zur Niederschrift der Geschäftsstelle einzulegen. Der Widerspruch kann auch zur Niederschrift der Geschäftsstelle eines jeden Amtsgerichtes abgegeben werden. Die Einlegung ist auch durch Übertragung eines elektronischen Dokuments an die elektronische Poststelle des Gerichts möglich. Das elektronische Dokument muss für die Bearbeitung durch das Gericht geeignet und mit einer qualifizierten elektronischen Signatur der verantwortenden Person versehen sein oder von der verantwortenden Person signiert und auf einem sicheren Übermittlungsweg gemäß § 130a ZPO nach näherer Maßgabe der Verordnung über die technischen Rahmenbedingungen des elektronischen Rechtsverkehrs und über das besondere elektronische Behördenpostfach (BGBl. I, S.3803) eingereicht werden. Weitere Informationen erhalten Sie auf der Internetseite www.justiz.de.\nDer Widerspruch muss spätestens innerhalb der gesetzten Frist nach dem Datum der Bekanntmachung der Löschungsankündigung bei dem Amtsgericht - Registergericht - Düsseldorf eingegangen sein.  Dies gilt auch dann, wenn der Widerspruch zur Niederschrift der Geschäftsstelle eines anderen Amtsgerichtes abgegeben wurde. Die Frist beginnt mit dem Tage der Bekanntmachung der Löschungsankündigung in dem für die Bekanntmachung der Eintragungen in das Handelsregister bestimmten elektronischen Informations- und Kommunikationssystem nach § 10 des Handelsgesetzbuches. Fällt das Ende der Frist auf einen Sonntag, einen allgemeinen Feiertag oder Sonnabend, so endet die Frist mit Ablauf des nächsten Werktages.\nDer Widerspruch muss die Bezeichnung der angefochtenen Löschungsankündigung sowie die Erklärung enthalten, dass Widerspruch gegen diese Löschungsankündigung eingelegt wird. Er ist zu unterzeichnen und soll begründet werden."
    },
    {
      "date": "2025-11-14",
      "id": "137399",
      "original_text": "Löschungsankündigung\nHessen Amtsgericht Wiesbaden HRB 35262\nLionswerk GmbH – Wiesbaden",
      "type": "Löschungsankündigung",
      "state": "Hessen",
      "amtsgericht": "Amtsgericht Wiesbaden",
      "registernummer": "HRB 35262",
      "registerart": "HRB",
      "company_name": "Lionswerk GmbH",
      "company_seat": "Wiesbaden",
      "details": "14.11.2025 (Bekanntmachungsdatum)\n\nHessen Amtsgericht Wiesbaden HRB 35262\nLöschungsankündigung\n\nLionswerk GmbH\nGesellschaft mit beschränkter Haftung\nWiesbaden\n\nDas Registergericht beabsichtigt die im Handelsregister eingetragene Gesellschaft von Amts wegen nach § 394 FamFG zu löschen. Die Frist zur Erhebung eines Widerspruchs gegen die beabsichtigte Löschung wird auf 3 Monate festgesetzt."
    },
    {
      "date": "2025-11-14",
      "id": "137400",
      "original_text": "Registerbekanntmachung nach dem Umwandlungsgesetz\nHessen Amtsgericht Fulda HRA 6730\nPeter Gering Metallbau e. K. – Hosenfeld",
      "type": "Registerbekanntmachung nach dem Umwandlungsgesetz",
      "state": "Hessen",
      "amtsgericht": "Amtsgericht Fulda",
      "registernummer": "HRA 6730",
      "registerart": "HRA",
      "company_name": "Peter Gering Metallbau e. K.",
      "company_seat": "Hosenfeld",
      "details": "14.11.2025 (Bekanntmachungsdatum)\n\nHessen Amtsgericht Fulda HRA 6730\nRegisterbekanntmachung nach dem Umwandlungsgesetz 14.11.2025 (Eintragungsdatum)\n\nPeter Gering Metallbau e. K.\nEinzelkaufmann / Einzelkauffrau\nHosenfeld\n\nDen Gläubigern der an der Verschmelzung beteiligten Rechtsträger ist, wenn sie binnen sechs Monaten nach dem Tag, an dem die Eintragung der Verschmelzung in das Register des Sitzes desjenigen Rechtsträgers, dessen Gläubiger sie sind, nach § 19 Absatz 3 UmwG bekannt gemacht worden ist, ihren Anspruch nach Grund und Höhe schriftlich anmelden, Sicherheit zu leisten, soweit sie nicht Befriedigung verlangen können. Dieses Recht steht den Gläubigern jedoch nur zu, wenn sie glaubhaft machen, dass durch die Verschmelzung die Erfüllung ihrer Forderung gefährdet wird."
    },
    {
      "date": "2025-11-14",
      "id": "137401",
      "original_text": "Registerbekanntmachung nach dem Umwandlungsgesetz\nHessen Amtsgericht Bad Homburg v.d.H. HRB 10232\nPBVE Verwaltung und Entwicklung GmbH – Bad Homburg v. d. Höhe",
      "type": "Registerbekanntmachung nach dem Umwandlungsgesetz",
      "state": "Hessen",
      "amtsgericht": "Amtsgericht Bad Homburg v.d.H.",
      "registernummer": "HRB 10232",
      "registerart": "HRB",
      "company_name": "PBVE Verwaltung und Entwicklung GmbH",
      "company_seat": "Bad Homburg v. d. Höhe",
      "details": "14.11.2025 (Bekanntmachungsdatum)\n\nHessen Amtsgericht Bad Homburg v.d.H. HRB 10232\nRegisterbekanntmachung nach dem Umwandlungsgesetz 14.11.2025 (Eintragungsdatum)\n\nPBVE Verwaltung und Entwicklung GmbH\nGesellschaft mit beschränkter Haftung\nBad Homburg v. d. Höhe\n\nDen Gläubigern der an der Verschmelzung beteiligten Rechtsträger ist, wenn sie binnen sechs Monaten nach dem Tag, an dem die Eintragung der Verschmelzung in das Register des Sitzes desjenigen Rechtsträgers, dessen Gläubiger sie sind, nach § 19 Absatz 3 UmwG bekannt gemacht worden ist, ihren Anspruch nach Grund und Höhe schriftlich anmelden, Sicherheit zu leisten, soweit sie nicht Befriedigung verlangen können. Dieses Recht steht den Gläubigern jedoch nur zu, wenn sie glaubhaft machen, dass durch die Verschmelzung die Erfüllung ihrer Forderung gefährdet wird."
    },
    {
      "date": "2025-11-14",
      "id": "137402",
      "original_text": "Löschungsankündigung\nHessen Amtsgericht Frankfurt am Main HRB 76417\nLEI Anterra Germany Holding GmbH – Frankfurt am Main",
      "type": "Löschungsankündigung",
      "state": "Hessen",
      "amtsgericht": "Amtsgericht Frankfurt am Main",
      "registernummer": "HRB 76417",
      "registerart": "HRB",
      "company_name": "LEI Anterra Germany Holding GmbH",
      "company_seat": "Frankfurt am Main",
      "details": "14.11.2025 (Bekanntmachungsdatum)\n\nHessen Amtsgericht Frankfurt am Main HRB 76417\nLöschungsankündigung\n\nLEI Anterra Germany Holding GmbH\nGesellschaft mit beschränkter Haftung\nFrankfurt am Main\n\nDas Registergericht beabsichtigt die im Handelsregister eingetragene Gesellschaft von Amts wegen nach § 394 FamFG zu löschen. Die Frist zur Erhebung eines Widerspruchs gegen die beabsichtigte Löschung wird auf 1 Monat festgesetzt."
    },
    {
      "date": "2025-11-14",
      "id": "137403",
      "original_text": "Registerbekanntmachung nach dem Umwandlungsgesetz\nHessen Amtsgericht Bad Homburg v.d.H. HRB 14995\nPBBV Beteiligungs GmbH – Bad Homburg v. d. Höhe",
      "type": "Registerbekanntmachung nach dem Umwandlungsgesetz",
      "state": "Hessen",
      "amtsgericht": "Amtsgericht Bad Homburg v.d.H.",
      "registernummer": "HRB 14995",
      "registerart": "HRB",
      "company_name": "PBBV Beteiligungs GmbH",
      "company_seat": "Bad Homburg v. d. Höhe",
      "details": "14.11.2025 (Bekanntmachungsdatum)\n\nHessen Amtsgericht Bad Homburg v.d.H. HRB 14995\nRegisterbekanntmachung nach dem Umwandlungsgesetz 14.11.2025 (Eintragungsdatum)\n\nPBBV Beteiligungs GmbH\nGesellschaft mit beschränkter Haftung\nBad Homburg v. d. Höhe\n\nDen Gläubigern der an der Verschmelzung beteiligten Rechtsträger ist, wenn sie binnen sechs Monaten nach dem Tag, an dem die Eintragung der Verschmelzung in das Register des Sitzes desjenigen Rechtsträgers, dessen Gläubiger sie sind, nach § 19 Absatz 3 UmwG bekannt gemacht worden ist, ihren Anspruch nach Grund und Höhe schriftlich anmelden, Sicherheit zu leisten, soweit sie nicht Befriedigung verlangen können. Dieses Recht steht den Gläubigern jedoch nur zu, wenn sie glaubhaft machen, dass durch die Verschmelzung die Erfüllung ihrer Forderung gefährdet wird."
    },
    {
      "date": "2025-11-14",
      "id": "137404",
      "original_text": "Löschungsankündigung\nHessen Amtsgericht Offenbach am Main HRB 46957\nZ-H-U Fashion GmbH – Dreieich",
      "type": "Löschungsankündigung",
      "state": "Hessen",
      "amtsgericht": "Amtsgericht Offenbach am Main",
      "registernummer": "HRB 46957",
      "registerart": "HRB",
      "company_name": "Z-H-U Fashion GmbH",
      "company_seat": "Dreieich",
      "details": "14.11.2025 (Bekanntmachungsdatum)\n\nHessen Amtsgericht Offenbach am Main HRB 46957\nLöschungsankündigung\n\nZ-H-U Fashion GmbH\nGesellschaft mit beschränkter Haftung\nDreieich\n\nDas Registergericht beabsichtigt die im Handelsregister eingetragene Gesellschaft von Amts wegen nach § 394 FamFG zu löschen. Die Frist zur Erhebung eines Widerspruchs gegen die beabsichtigte Löschung wird auf 3 Monate festgesetzt."
    },
    {
      "date": "2025-11-14",
      "id": "137405",
      "original_text": "Registerbekanntmachung nach dem Umwandlungsgesetz\nHessen Amtsgericht Frankfurt am Main HRB 125586\nbicycles & more Holding GmbH – Frankfurt am Main",
      "type": "Registerbekanntmachung nach dem Umwandlungsgesetz",
      "state": "Hessen",
      "amtsgericht": "Amtsgericht Frankfurt am Main",
      "registernummer": "HRB 125586",
      "registerart": "HRB",
      "company_name": "bicycles & more Holding GmbH",
      "company_seat": "Frankfurt am Main",
      "details": "14.11.2025 (Bekanntmachungsdatum)\n\nHessen Amtsgericht Frankfurt am Main HRB 125586\nRegisterbekanntmachung nach dem Umwandlungsgesetz 14.11.2025 (Eintragungsdatum)\n\nbicycles & more Holding GmbH\nGesellschaft mit beschränkter Haftung\nFrankfurt am Main\n\nDen Gläubigern der an der Verschmelzung beteiligten Rechtsträger ist, wenn sie binnen sechs Monaten nach dem Tag, an dem die Eintragung der Verschmelzung in das Register des Sitzes derjenigen Rechtsträger deren Gläubiger sie sind, nach § 19 Absatz 3 UmwG bekannt gemacht worden ist, ihren Anspruch nach Grund und Höhe schriftlich anmelden, Sicherheit zu leisten, soweit sie nicht Befriedigung verlangen können. Dieses Recht steht den Gläubigern jedoch nur zu, wenn sie glaubhaft machen, dass durch die Verschmelzung die Erfüllung ihrer Forderung gefährdet wird."
    },
    {
      "date": "2025-11-14",
      "id": "137406",
      "original_text": "Löschungsankündigung\nHessen Amtsgericht Frankfurt am Main HRB 125156\nYakub Bau GmbH – Frankfurt am Main",
      "type": "Löschungsankündigung",
      "state": "Hessen",
      "amtsgericht": "Amtsgericht Frankfurt am Main",
      "registernummer": "HRB 125156",
      "registerart": "HRB",
      "company_name": "Yakub Bau GmbH",
      "company_seat": "Frankfurt am Main",
      "details": "14.11.2025 (Bekanntmachungsdatum)\n\nHessen Amtsgericht Frankfurt am Main HRB 125156\nLöschungsankündigung\n\nYakub Bau GmbH\nGesellschaft mit beschränkter Haftung\nFrankfurt am Main\n\nes ist beabsichtigt, den Geschäftsführer Aldin Yakub gemäß § 395 FamFG von Amts wegen im Handelsregister zu löschen, da eine rechtskräftige Gewerbeuntersagung gegen den Geschäftsführer vorliegt.\nHiergegen kann innerhalb eines Zeitraums von 1 Monat nach Veröffentlichung dieser Verfügung Widerspruch bei dem Amtsgericht Frankfurt am Main eingelegt werden."
    },
    {
      "date": "2025-11-14",
      "id": "137407",
      "original_text": "Registerbekanntmachung nach dem Umwandlungsgesetz\nHessen Amtsgericht Frankfurt am Main HRA 53854\nHunky Dory Bar eK – Frankfurt am Main",
      "type": "Registerbekanntmachung nach dem Umwandlungsgesetz",
      "state": "Hessen",
      "amtsgericht": "Amtsgericht Frankfurt am Main",
      "registernummer": "HRA 53854",
      "registerart": "HRA",
      "company_name": "Hunky Dory Bar eK",
      "company_seat": "Frankfurt am Main",
      "details": "14.11.2025 (Bekanntmachungsdatum)\n\nHessen Amtsgericht Frankfurt am Main HRA 53854\nRegisterbekanntmachung nach dem Umwandlungsgesetz 14.11.2025 (Eintragungsdatum)\n\nHunky Dory Bar eK\nEinzelkaufmann / Einzelkauffrau\nFrankfurt am Main\n\nDen Gläubigern der an der Vermögensübertragung beteiligten Rechtsträger ist, wenn sie binnen sechs Monaten nach dem Tag, an dem die Eintragung der Vermögensübertragung in das Register des Sitzes desjenigen Rechtsträgers, dessen Gläubiger sie sind, nach §§ 125, 19 Absatz 3 UmwG bekannt gemacht worden ist, ihren Anspruch nach Grund und Höhe schriftlich anmelden, Sicherheit zu leisten, soweit sie nicht Befriedigung verlangen können. Dieses Recht steht den Gläubigern jedoch nur zu, wenn sie glaubhaft machen, dass durch die Vermögensübertragung die Erfüllung ihrer Forderung gefährdet wird."
    },
    {
      "date": "2025-11-14",
      "id": "137408",
      "original_text": "Registerbekanntmachung nach dem Umwandlungsgesetz\nHessen Amtsgericht Fulda HRB 1171\nPeter Gering Metallbau GmbH – Hosenfeld",
      "type": "Registerbekanntmachung nach dem Umwandlungsgesetz",
      "state": "Hessen",
      "amtsgericht": "Amtsgericht Fulda",
      "registernummer": "HRB 1171",
      "registerart": "HRB",
      "company_name": "Peter Gering Metallbau GmbH",
      "company_seat": "Hosenfeld",
      "details": "14.11.2025 (Bekanntmachungsdatum)\n\nHessen Amtsgericht Fulda HRB 1171\nRegisterbekanntmachung nach dem Umwandlungsgesetz 14.11.2025 (Eintragungsdatum)\n\nPeter Gering Metallbau GmbH\nGesellschaft mit beschränkter Haftung\nHosenfeld\n\nDen Gläubigern der an der Verschmelzung beteiligten Rechtsträger ist, wenn sie binnen sechs Monaten nach dem Tag, an dem die Eintragung der Verschmelzung in das Register des Sitzes desjenigen Rechtsträgers, dessen Gläubiger sie sind, nach § 19 Absatz 3 UmwG bekannt gemacht worden ist, ihren Anspruch nach Grund und Höhe schriftlich anmelden, Sicherheit zu leisten, soweit sie nicht Befriedigung verlangen können. Dieses Recht steht den Gläubigern jedoch nur zu, wenn sie glaubhaft machen, dass durch die Verschmelzung die Erfüllung ihrer Forderung gefährdet wird."
    },
    {
      "date": "2025-11-14",
      "id": "137409",
      "original_text": "Registerbekanntmachung nach dem Umwandlungsgesetz\nHessen Amtsgericht Bad Hersfeld HRA 1993\nEgbert Ries Sanitär und Heizungsbau und Bauklempnerei GmbH & Co KG – Wildeck-Obersuhl",
      "type": "Registerbekanntmachung nach dem Umwandlungsgesetz",
      "state": "Hessen",
      "amtsgericht": "Amtsgericht Bad Hersfeld",
      "registernummer": "HRA 1993",
      "registerart": "HRA",
      "company_name": "Egbert Ries Sanitär und Heizungsbau und Bauklempnerei GmbH & Co KG",
      "company_seat": "Wildeck-Obersuhl",
      "details": "14.11.2025 (Bekanntmachungsdatum)\n\nHessen Amtsgericht Bad Hersfeld HRA 1993\nRegisterbekanntmachung nach dem Umwandlungsgesetz 14.11.2025 (Eintragungsdatum)\n\nEgbert Ries Sanitär und Heizungsbau und Bauklempnerei GmbH & Co KG\nKommanditgesellschaft\nWildeck-Obersuhl\n\nDen Gläubigern der an der Ausgliederung beteiligten Rechtsträger ist, wenn sie binnen sechs Monaten nach dem Tag, an dem die Eintragung der Ausgliederung in das Register des Sitzes desjenigen Rechtsträgers, dessen Gläubiger sie sind, nach §§ 125, 19 Absatz 3 UmwG bekannt gemacht worden ist, ihren Anspruch nach Grund und Höhe schriftlich anmelden, Sicherheit zu leisten, soweit sie nicht Befriedigung verlangen können. Dieses Recht steht den Gläubigern jedoch nur zu, wenn sie glaubhaft machen, dass durch die Ausgliederung die Erfüllung ihrer Forderung gefährdet wird."
    },
    {
      "date": "2025-11-14",
      "id": "137410",
      "original_text": "Sonstige Registerbekanntmachung\nHessen Amtsgericht Wiesbaden VR 7490\nWohnprojekt Klarenthal e.V. – Wiesbaden",
      "type": "Sonstige Registerbekanntmachung",
      "state": "Hessen",
      "amtsgericht": "Amtsgericht Wiesbaden",
      "registernummer": "VR 7490",
      "registerart": "VR",
      "company_name": "Wohnprojekt Klarenthal e.V.",
      "company_seat": "Wiesbaden",
      "details": "14.11.2025 (Bekanntmachungsdatum)\n\nHessen Amtsgericht Wiesbaden VR 7490\nSonstige Registerbekanntmachung 14.11.2025 (Eintragungsdatum)\n\nWohnprojekt Klarenthal e.V.\neingetragener Verein\nWiesbaden\n\nDer Verein ist aufgelöst."
    },
    {
      "date": "2025-11-14",
      "id": "137411",
      "original_text": "Registerbekanntmachung nach dem Umwandlungsgesetz\nHessen Amtsgericht Bad Hersfeld HRA 1983\nRies Sanitär Heizung e.K. – Wildeck",
      "type": "Registerbekanntmachung nach dem Umwandlungsgesetz",
      "state": "Hessen",
      "amtsgericht": "Amtsgericht Bad Hersfeld",
      "registernummer": "HRA 1983",
      "registerart": "HRA",
      "company_name": "Ries Sanitär Heizung e.K.",
      "company_seat": "Wildeck",
      "details": "14.11.2025 (Bekanntmachungsdatum)\n\nHessen Amtsgericht Bad Hersfeld HRA 1983\nRegisterbekanntmachung nach dem Umwandlungsgesetz 14.11.2025 (Eintragungsdatum)\n\nRies Sanitär Heizung e.K.\nEinzelkaufmann / Einzelkauffrau\nWildeck\n\nDen Gläubigern der an der Ausgliederung beteiligten Rechtsträger ist, wenn sie binnen sechs Monaten nach dem Tag, an dem die Eintragung der Ausgliederung in das Register des Sitzes desjenigen Rechtsträgers, dessen Gläubiger sie sind, nach §§ 125, 19 Absatz 3 UmwG bekannt gemacht worden ist, ihren Anspruch nach Grund und Höhe schriftlich anmelden, Sicherheit zu leisten, soweit sie nicht Befriedigung verlangen können. Dieses Recht steht den Gläubigern jedoch nur zu, wenn sie glaubhaft machen, dass durch die Ausgliederung die Erfüllung ihrer Forderung gefährdet wird."
    },
    {
      "date": "2025-11-14",
      "id": "137412",
      "original_text": "Registerbekanntmachung nach dem Umwandlungsgesetz\nHessen Amtsgericht Offenbach am Main HRA 43113\nDS VV GmbH & Co. KG – Offenbach am Main",
      "type": "Registerbekanntmachung nach dem Umwandlungsgesetz",
      "state": "Hessen",
      "amtsgericht": "Amtsgericht Offenbach am Main",
      "registernummer": "HRA 43113",
      "registerart": "HRA",
      "company_name": "DS VV GmbH & Co. KG",
      "company_seat": "Offenbach am Main",
      "details": "14.11.2025 (Bekanntmachungsdatum)\n\nHessen Amtsgericht Offenbach am Main HRA 43113\nRegisterbekanntmachung nach dem Umwandlungsgesetz 14.11.2025 (Eintragungsdatum)\n\nDS VV GmbH & Co. KG\nKommanditgesellschaft\nOffenbach am Main\n\nDen Gläubigern der an der Verschmelzung beteiligten Rechtsträger ist, wenn sie binnen sechs Monaten nach dem Tag, an dem die Eintragung der Verschmelzung in das Register des Sitzes desjenigen Rechtsträgers, dessen Gläubiger sie sind, nach § 19 Absatz 3 UmwG bekannt gemacht worden ist, ihren Anspruch nach Grund und Höhe schriftlich anmelden, Sicherheit zu leisten, soweit sie nicht Befriedigung verlangen können. Dieses Recht steht den Gläubigern jedoch nur zu, wenn sie glaubhaft machen, dass durch die Verschmelzung die Erfüllung ihrer Forderung gefährdet wird."
    },
    {
      "date": "2025-11-14",
      "id": "137413",
      "original_text": "Sonstige Registerbekanntmachung\nHessen Amtsgericht Offenbach am Main VR 1801\n\"Offenbacher-Bildungs-Akademie\" – Offenbach am Main",
      "type": "Sonstige Registerbekanntmachung",
      "state": "Hessen",
      "amtsgericht": "Amtsgericht Offenbach am Main",
      "registernummer": "VR 1801",
      "registerart": "VR",
      "company_name": "\"Offenbacher-Bildungs-Akademie\"",
      "company_seat": "Offenbach am Main",
      "details": "14.11.2025 (Bekanntmachungsdatum)\n\nHessen Amtsgericht Offenbach am Main VR 1801\nSonstige Registerbekanntmachung 19.10.2023 (Eintragungsdatum)\n\n\"Offenbacher-Bildungs-Akademie\"\neingetragener Verein\nOffenbach am Main\n\nDer Verein ist aufgelöst."
    }
  ]
}