{
  "date": "2025-11-24",
  "date_of_scrape": "2025-11-25T04:12:01.284Z",
  "tool_version": "0.2.0",
  "number_of_announcements": 82,
  "announcements": [
    {
      "date": "2025-11-24",
      "id": "138077",
      "original_text": "Einreichung neuer Dokumente\nBerlin Amtsgericht Berlin (Charlottenburg) HRB 21280\nIAV GmbH Ingenieurgesellschaft Auto und Verkehr – Berlin",
      "type": "Einreichung neuer Dokumente",
      "state": "Berlin",
      "amtsgericht": "Amtsgericht Berlin (Charlottenburg)",
      "registernummer": "HRB 21280",
      "registerart": "HRB",
      "company_name": "IAV GmbH Ingenieurgesellschaft Auto und Verkehr",
      "company_seat": "Berlin",
      "details": "24.11.2025 (Bekanntmachungsdatum)\n\nBerlin Amtsgericht Berlin (Charlottenburg) HRB 21280\nEinreichung neuer Dokumente\n\nIAV GmbH Ingenieurgesellschaft Auto und Verkehr\nGesellschaft mit beschränkter Haftung\nBerlin\n\nAls nicht eingetragen wird veröffentlicht: Es wurde eine neue Liste der Aufsichtsratsmitglieder eingereicht (§52 GmbHG)."
    },
    {
      "date": "2025-11-24",
      "id": "138078",
      "original_text": "Löschungsankündigung\nBerlin Amtsgericht Berlin (Charlottenburg) HRB 183348\nFastFwd GmbH – Berlin",
      "type": "Löschungsankündigung",
      "state": "Berlin",
      "amtsgericht": "Amtsgericht Berlin (Charlottenburg)",
      "registernummer": "HRB 183348",
      "registerart": "HRB",
      "company_name": "FastFwd GmbH",
      "company_seat": "Berlin",
      "details": "24.11.2025 (Bekanntmachungsdatum)\n\nBerlin Amtsgericht Berlin (Charlottenburg) HRB 183348\nLöschungsankündigung\n\nFastFwd GmbH\nGesellschaft mit beschränkter Haftung\nBerlin\n\nBei der nachstehenden Gesellschaft wird das Amtslöschungsverfahren gemäß § 394 FamFG eingeleitet. Widerspruchsfrist 6 Wochen"
    },
    {
      "date": "2025-11-24",
      "id": "138079",
      "original_text": "Registerbekanntmachung nach dem Umwandlungsgesetz\nBaden-Württemberg Amtsgericht Ulm HRA 724966\nEva Geiselmann Finanzen e.K. – Geislingen an der Steige",
      "type": "Registerbekanntmachung nach dem Umwandlungsgesetz",
      "state": "Baden-Württemberg",
      "amtsgericht": "Amtsgericht Ulm",
      "registernummer": "HRA 724966",
      "registerart": "HRA",
      "company_name": "Eva Geiselmann Finanzen e.K.",
      "company_seat": "Geislingen an der Steige",
      "details": "24.11.2025 (Bekanntmachungsdatum)\n\nBaden-Württemberg Amtsgericht Ulm HRA 724966\nRegisterbekanntmachung nach dem Umwandlungsgesetz 24.11.2025 (Eintragungsdatum)\n\nEva Geiselmann Finanzen e.K.\nEinzelkaufmann / Einzelkauffrau\nGeislingen an der Steige\n\nAls nicht eingetragen wird bekanntgemacht:\nDen Gläubigern der an der Ausgliederung beteiligten Rechtsträger ist, wenn sie binnen sechs Monaten nach dem Tag, an dem die Eintragung der Ausgliederung in das Register des Sitzes desjenigen Rechtsträgers, dessen Gläubiger sie sind, nach § 19 Abs. 3 UmwG als bekanntgemacht gilt, ihren Anspruch nach Grund und Höhe schriftlich anmelden, Sicherheit zu leisten, soweit sie nicht Befriedigung verlangen können. Dieses Recht steht den Gläubigern jedoch nur zu, wenn sie glaubhaft machen, dass durch die Ausgliederung die Erfüllung ihrer Forderung gefährdet wird."
    },
    {
      "date": "2025-11-24",
      "id": "138080",
      "original_text": "Registerbekanntmachung nach dem Umwandlungsgesetz\nBaden-Württemberg Amtsgericht Ulm HRB 748621\nEva Geiselmann GmbH – Geislingen an der Steige",
      "type": "Registerbekanntmachung nach dem Umwandlungsgesetz",
      "state": "Baden-Württemberg",
      "amtsgericht": "Amtsgericht Ulm",
      "registernummer": "HRB 748621",
      "registerart": "HRB",
      "company_name": "Eva Geiselmann GmbH",
      "company_seat": "Geislingen an der Steige",
      "details": "24.11.2025 (Bekanntmachungsdatum)\n\nBaden-Württemberg Amtsgericht Ulm HRB 748621\nRegisterbekanntmachung nach dem Umwandlungsgesetz 24.11.2025 (Eintragungsdatum)\n\nEva Geiselmann GmbH\nGesellschaft mit beschränkter Haftung\nGeislingen an der Steige\n\nAls nicht eingetragen wird bekanntgemacht:\nDen Gläubigern der an der Ausgliederung beteiligten Rechtsträger ist, wenn sie binnen sechs Monaten nach dem Tag, an dem die Eintragung der Ausgliederung in das Register des Sitzes desjenigen Rechtsträgers, dessen Gläubiger sie sind, nach § 19 Abs. 3 UmwG als bekanntgemacht gilt, ihren Anspruch nach Grund und Höhe schriftlich anmelden, Sicherheit zu leisten, soweit sie nicht Befriedigung verlangen können. Dieses Recht steht den Gläubigern jedoch nur zu, wenn sie glaubhaft machen, dass durch die Ausgliederung die Erfüllung ihrer Forderung gefährdet wird."
    },
    {
      "date": "2025-11-24",
      "id": "138081",
      "original_text": "Löschungsankündigung\nBrandenburg Amtsgericht Potsdam HRB 35039\nDLP Entwicklungs- und Beteiligungsgesellschaft mbH – Blankenfelde-Mahlow",
      "type": "Löschungsankündigung",
      "state": "Brandenburg",
      "amtsgericht": "Amtsgericht Potsdam",
      "registernummer": "HRB 35039",
      "registerart": "HRB",
      "company_name": "DLP Entwicklungs- und Beteiligungsgesellschaft mbH",
      "company_seat": "Blankenfelde-Mahlow",
      "details": "24.11.2025 (Bekanntmachungsdatum)\n\nBrandenburg Amtsgericht Potsdam HRB 35039\nLöschungsankündigung\n\nDLP Entwicklungs- und Beteiligungsgesellschaft mbH\nGesellschaft mit beschränkter Haftung\nBlankenfelde-Mahlow\n\nBei der nachstehenden Gesellschaft wird das Amtslöschungsverfahren gemäß § 394 FamFG eingeleitet. Widerspruchsfrist 8 Wochen."
    },
    {
      "date": "2025-11-24",
      "id": "138082",
      "original_text": "Löschungsankündigung\nBrandenburg Amtsgericht Potsdam HRB 19549\nTechnik-, Stahl- & Lichtmastenbau Limited – Seddiner See",
      "type": "Löschungsankündigung",
      "state": "Brandenburg",
      "amtsgericht": "Amtsgericht Potsdam",
      "registernummer": "HRB 19549",
      "registerart": "HRB",
      "company_name": "Technik-, Stahl- & Lichtmastenbau Limited",
      "company_seat": "Seddiner See",
      "details": "24.11.2025 (Bekanntmachungsdatum)\n\nBrandenburg Amtsgericht Potsdam HRB 19549\nLöschungsankündigung\n\nTechnik-, Stahl- & Lichtmastenbau Limited\nRechtsform ausländischen Rechts HRB\nSeddiner See\n\nBei der nachstehenden Gesellschaft wird das Amtslöschungsverfahren gemäß § 395 FamFG eingeleitet. Widerspruchsfrist 4 Wochen."
    },
    {
      "date": "2025-11-24",
      "id": "138083",
      "original_text": "Sonstige Registerbekanntmachung\nMecklenburg-Vorpommern Amtsgericht Rostock HRB 11275\nKARO AG (gemeinnützig) – Rostock",
      "type": "Sonstige Registerbekanntmachung",
      "state": "Mecklenburg-Vorpommern",
      "amtsgericht": "Amtsgericht Rostock",
      "registernummer": "HRB 11275",
      "registerart": "HRB",
      "company_name": "KARO AG (gemeinnützig)",
      "company_seat": "Rostock",
      "details": "24.11.2025 (Bekanntmachungsdatum)\n\nMecklenburg-Vorpommern Amtsgericht Rostock HRB 11275\nSonstige Registerbekanntmachung\n\nKARO AG (gemeinnützig)\nAktiengesellschaft\nRostock\n\nEine Liste der Mitglieder des Aufsichtsrats ist zum Handelsregister eingereicht worden."
    },
    {
      "date": "2025-11-24",
      "id": "138084",
      "original_text": "Registerbekanntmachung nach dem Umwandlungsgesetz\nSachsen-Anhalt Amtsgericht Stendal HRA 3013\nPHO B GmbH & Co. KG – Weißenfels",
      "type": "Registerbekanntmachung nach dem Umwandlungsgesetz",
      "state": "Sachsen-Anhalt",
      "amtsgericht": "Amtsgericht Stendal",
      "registernummer": "HRA 3013",
      "registerart": "HRA",
      "company_name": "PHO B GmbH & Co. KG",
      "company_seat": "Weißenfels",
      "details": "24.11.2025 (Bekanntmachungsdatum)\n\nSachsen-Anhalt Amtsgericht Stendal HRA 3013\nRegisterbekanntmachung nach dem Umwandlungsgesetz 24.11.2025 (Eintragungsdatum)\n\nPHO B GmbH & Co. KG\nKommanditgesellschaft\nWeißenfels\n\nNicht eingetragen:\nDen Gläubigern der an der Spaltung beteiligten Rechtsträger, ist wenn sie binnen sechs Monaten nach dem Tag, an dem die Eintragung der Spaltung nach §§ 125, 19 Abs. 3 UmwG als bekanntgemacht gilt, ihren Anspruch nach Grund und Höhe schriftlich anmelden, Sicherheit zu leisten, soweit sie nicht Befriedigung verlangen können. Dieses Recht steht ihnen jedoch nur zu, wenn sie glaubhaft machen, daß durch die Spaltung die Erfüllung ihrer Forderung gefährdet wird."
    },
    {
      "date": "2025-11-24",
      "id": "138085",
      "original_text": "Löschungsankündigung\nBrandenburg Amtsgericht Potsdam HRB 29996\nCarFit Kfz-Service Unternehmergesellschaft (haftungsbeschränkt) – Großbeeren",
      "type": "Löschungsankündigung",
      "state": "Brandenburg",
      "amtsgericht": "Amtsgericht Potsdam",
      "registernummer": "HRB 29996",
      "registerart": "HRB",
      "company_name": "CarFit Kfz-Service Unternehmergesellschaft (haftungsbeschränkt)",
      "company_seat": "Großbeeren",
      "details": "24.11.2025 (Bekanntmachungsdatum)\n\nBrandenburg Amtsgericht Potsdam HRB 29996\nLöschungsankündigung\n\nCarFit Kfz-Service Unternehmergesellschaft (haftungsbeschränkt)\nGesellschaft mit beschränkter Haftung\nGroßbeeren\n\nBei der nachstehenden Gesellschaft wird das Amtslöschungsverfahren gemäß § 394 FamFG eingeleitet. Widerspurchsfrist 8 Wochen."
    },
    {
      "date": "2025-11-24",
      "id": "138086",
      "original_text": "Einreichung neuer Dokumente\nBaden-Württemberg Amtsgericht Freiburg HRB 602434\nNexus AG – Donaueschingen",
      "type": "Einreichung neuer Dokumente",
      "state": "Baden-Württemberg",
      "amtsgericht": "Amtsgericht Freiburg",
      "registernummer": "HRB 602434",
      "registerart": "HRB",
      "company_name": "Nexus AG",
      "company_seat": "Donaueschingen",
      "details": "24.11.2025 (Bekanntmachungsdatum)\n\nBaden-Württemberg Amtsgericht Freiburg HRB 602434\nEinreichung neuer Dokumente 24.11.2025 (Eintragungsdatum)\n\nNexus AG\nAktiengesellschaft\nDonaueschingen\n\nDie Gesellschaft hat am 20.11.2025 die Liste über die Zusammensetzung des Aufsichtsrats zum Handelsregister eingereicht."
    },
    {
      "date": "2025-11-24",
      "id": "138087",
      "original_text": "Einreichung neuer Dokumente\nBaden-Württemberg Amtsgericht Freiburg HRB 541043\nBEMACO AG – Singen Hohentwiel",
      "type": "Einreichung neuer Dokumente",
      "state": "Baden-Württemberg",
      "amtsgericht": "Amtsgericht Freiburg",
      "registernummer": "HRB 541043",
      "registerart": "HRB",
      "company_name": "BEMACO AG",
      "company_seat": "Singen Hohentwiel",
      "details": "24.11.2025 (Bekanntmachungsdatum)\n\nBaden-Württemberg Amtsgericht Freiburg HRB 541043\nEinreichung neuer Dokumente 24.11.2025 (Eintragungsdatum)\n\nBEMACO AG\nAktiengesellschaft\nSingen Hohentwiel\n\nAls nicht eingetragen wird bekanntgemacht:\nDie Gesellschaft hat am 21.11.2025 die Liste über die Zusammensetzung des Aufsichtsrats zum Handelsregister eingereicht."
    },
    {
      "date": "2025-11-24",
      "id": "138088",
      "original_text": "Registerbekanntmachung nach dem Umwandlungsgesetz\nBaden-Württemberg Amtsgericht Mannheim HRB 460267\nBonn Beteiligungs GmbH – Walldürn",
      "type": "Registerbekanntmachung nach dem Umwandlungsgesetz",
      "state": "Baden-Württemberg",
      "amtsgericht": "Amtsgericht Mannheim",
      "registernummer": "HRB 460267",
      "registerart": "HRB",
      "company_name": "Bonn Beteiligungs GmbH",
      "company_seat": "Walldürn",
      "details": "24.11.2025 (Bekanntmachungsdatum)\n\nBaden-Württemberg Amtsgericht Mannheim HRB 460267\nRegisterbekanntmachung nach dem Umwandlungsgesetz 24.11.2025 (Eintragungsdatum)\n\nBonn Beteiligungs GmbH\nGesellschaft mit beschränkter Haftung\nWalldürn\n\nDen Gläubigern der an der Verschmelzung beteiligten Rechtsträger ist, wenn sie binnen sechs Monaten nach dem Tag, an dem die Eintragung der Verschmelzung in das Register des Sitzes desjenigen Rechtsträgers, dessen Gläubiger sie sind, nach § 19 Abs. 3 UmwG als bekanntgemacht gilt, ihren Anspruch nach Grund und Höhe schriftlich anmelden, Sicherheit zu leisten, soweit sie nicht Befriedigung verlangen können. Dieses Recht steht den Gläubigern jedoch nur zu, wenn sie glaubhaft machen, dass durch die Verschmelzung die Erfüllung ihrer Forderung gefährdet wird."
    },
    {
      "date": "2025-11-24",
      "id": "138089",
      "original_text": "Registerbekanntmachung nach dem Umwandlungsgesetz\nBaden-Württemberg Amtsgericht Mannheim HRB 460195\nW. und G. Bonn GmbH – Walldürn",
      "type": "Registerbekanntmachung nach dem Umwandlungsgesetz",
      "state": "Baden-Württemberg",
      "amtsgericht": "Amtsgericht Mannheim",
      "registernummer": "HRB 460195",
      "registerart": "HRB",
      "company_name": "W. und G. Bonn GmbH",
      "company_seat": "Walldürn",
      "details": "24.11.2025 (Bekanntmachungsdatum)\n\nBaden-Württemberg Amtsgericht Mannheim HRB 460195\nRegisterbekanntmachung nach dem Umwandlungsgesetz 24.11.2025 (Eintragungsdatum)\n\nW. und G. Bonn GmbH\nGesellschaft mit beschränkter Haftung\nWalldürn\n\nAls nicht eingetragen wird bekanntgemacht:\nDen Gläubigern der an der Verschmelzung beteiligten Rechtsträger ist, wenn sie binnen sechs Monaten nach dem Tag, an dem die Eintragung der Verschmelzung in das Register des Sitzes desjenigen Rechtsträgers, dessen Gläubiger sie sind, nach § 19 Abs. 3 UmwG als bekanntgemacht gilt, ihren Anspruch nach Grund und Höhe schriftlich anmelden, Sicherheit zu leisten, soweit sie nicht Befriedigung verlangen können. Dieses Recht steht den Gläubigern jedoch nur zu, wenn sie glaubhaft machen, dass durch die Verschmelzung die Erfüllung ihrer Forderung gefährdet wird."
    },
    {
      "date": "2025-11-24",
      "id": "138090",
      "original_text": "Löschungsankündigung\nBaden-Württemberg Amtsgericht Freiburg HRB 725788\nBLACK FOREST CONSTRUCTION GmbH – Lahr",
      "type": "Löschungsankündigung",
      "state": "Baden-Württemberg",
      "amtsgericht": "Amtsgericht Freiburg",
      "registernummer": "HRB 725788",
      "registerart": "HRB",
      "company_name": "BLACK FOREST CONSTRUCTION GmbH",
      "company_seat": "Lahr",
      "details": "24.11.2025 (Bekanntmachungsdatum)\n\nBaden-Württemberg Amtsgericht Freiburg HRB 725788\nLöschungsankündigung\n\nBLACK FOREST CONSTRUCTION GmbH\nGesellschaft mit beschränkter Haftung\nLahr\n\nAls nicht eingetragen wird bekanntgemacht:\nDas Gericht beabsichtigt, die Gesellschaft wegen Vermögenslosigkeit im Handelsregister von Amts wegen nach § 394 FamFG zu löschen. Die Frist zur Geltendmachung eines Widerspruchs gegen die beabsichtigte Löschung ist auf einen Monat ab Veröffentlichung bestimmt."
    },
    {
      "date": "2025-11-24",
      "id": "138091",
      "original_text": "Löschungsankündigung\nSchleswig-Holstein Amtsgericht Lübeck HRA 10807\nWerdin Beteiligungs GmbH & Co. KG – Lübeck",
      "type": "Löschungsankündigung",
      "state": "Schleswig-Holstein",
      "amtsgericht": "Amtsgericht Lübeck",
      "registernummer": "HRA 10807",
      "registerart": "HRA",
      "company_name": "Werdin Beteiligungs GmbH & Co. KG",
      "company_seat": "Lübeck",
      "details": "24.11.2025 (Bekanntmachungsdatum)\n\nSchleswig-Holstein Amtsgericht Lübeck HRA 10807\nLöschungsankündigung\n\nWerdin Beteiligungs GmbH & Co. KG\nKommanditgesellschaft\nLübeck\n\nEs ist die Löschung der nachstehenden Gesellschaft wegen Vermögenslosigkeit gemäß § 394 FamFG beabsichtigt:\nWerdin Beteiligungs GmbH & Co. KG\nKönigstraße 79\n23552 Lübeck\nIn der Handelsregistersache der Werdin Beteiligungs GmbH & Co. KG\nergeben sich aus den mir vorliegenden Unterlagen Anhaltspunkte dafür, dass die Gesellschaft vermögenslos ist:\nLöschung der persönlich haftenden Gesellschafterin aufgrund Vermögenslosigkeit.\nIch beabsichtige daher, die Gesellschaft wegen Vermögenslosigkeit gemäß § 394 FamFG zu löschen.\nIch bestimme eine Frist von einem Monat zur Geltendmachung eines Widerspruchs gegen die Löschung, § 394 Abs. 2 S. 1 FamFG.\nWeiter bitte ich Sie, mir binnen derselben Frist mitzuteilen, ob die genannte Gesellschaft noch Vermögen hat, ggf. welche Vermögensgegenstände sie besitzt, ob die Gesellschaft noch Partei eines noch nicht rechtskräftig abgeschlossenen Rechtsstreits ist oder ob sonst noch eine Abwicklung stattfindet.\nNach Fristablauf ohne Widerspruch von Ihnen oder anderer Seite wird die Gesellschaft gelöscht.\nAmtsgericht Lübeck, Abt. 6\nBender, Rechtspflegerin"
    },
    {
      "date": "2025-11-24",
      "id": "138092",
      "original_text": "Löschungsankündigung\nBerlin Amtsgericht Berlin (Charlottenburg) HRB 87564\nSBB 2 Services GmbH – Berlin",
      "type": "Löschungsankündigung",
      "state": "Berlin",
      "amtsgericht": "Amtsgericht Berlin (Charlottenburg)",
      "registernummer": "HRB 87564",
      "registerart": "HRB",
      "company_name": "SBB 2 Services GmbH",
      "company_seat": "Berlin",
      "details": "24.11.2025 (Bekanntmachungsdatum)\n\nBerlin Amtsgericht Berlin (Charlottenburg) HRB 87564\nLöschungsankündigung\n\nSBB 2 Services GmbH\nGesellschaft mit beschränkter Haftung\nBerlin\n\nBei der nachstehenden Gesellschaft wird das Amtslöschungsverfahren gemäß § 394 FamFG eingeleitet. Widerspruchsfrist 6 Wochen"
    },
    {
      "date": "2025-11-24",
      "id": "138093",
      "original_text": "Registerbekanntmachung nach dem Umwandlungsgesetz\nBaden-Württemberg Amtsgericht Stuttgart HRB 751522\nMinol Beteiligungen GmbH – Leinfelden-Echterdingen",
      "type": "Registerbekanntmachung nach dem Umwandlungsgesetz",
      "state": "Baden-Württemberg",
      "amtsgericht": "Amtsgericht Stuttgart",
      "registernummer": "HRB 751522",
      "registerart": "HRB",
      "company_name": "Minol Beteiligungen GmbH",
      "company_seat": "Leinfelden-Echterdingen",
      "details": "24.11.2025 (Bekanntmachungsdatum)\n\nBaden-Württemberg Amtsgericht Stuttgart HRB 751522\nRegisterbekanntmachung nach dem Umwandlungsgesetz 24.11.2025 (Eintragungsdatum)\n\nMinol Beteiligungen GmbH\nGesellschaft mit beschränkter Haftung\nLeinfelden-Echterdingen\n\nAls nicht eingetragen wird bekanntgemacht:\nDen Gläubigern der an der Verschmelzung beteiligten Rechtsträger ist, wenn sie binnen sechs Monaten nach dem Tag, an dem die Eintragung der Verschmelzung in das Register des Sitzes desjenigen Rechtsträgers, dessen Gläubiger sie sind, nach § 19 Abs. 3 UmwG als bekanntgemacht gilt, ihren Anspruch nach Grund und Höhe schriftlich anmelden, Sicherheit zu leisten, soweit sie nicht Befriedigung verlangen können. Dieses Recht steht den Gläubigern jedoch nur zu, wenn sie glaubhaft machen, dass durch die Verschmelzung die Erfüllung ihrer Forderung gefährdet wird."
    },
    {
      "date": "2025-11-24",
      "id": "138094",
      "original_text": "Einreichung neuer Dokumente\nBaden-Württemberg Amtsgericht Mannheim HRB 7904\nEngelhorn GmbH & Co. KGaA – Mannheim",
      "type": "Einreichung neuer Dokumente",
      "state": "Baden-Württemberg",
      "amtsgericht": "Amtsgericht Mannheim",
      "registernummer": "HRB 7904",
      "registerart": "HRB",
      "company_name": "Engelhorn GmbH & Co. KGaA",
      "company_seat": "Mannheim",
      "details": "24.11.2025 (Bekanntmachungsdatum)\n\nBaden-Württemberg Amtsgericht Mannheim HRB 7904\nEinreichung neuer Dokumente\n\nEngelhorn GmbH & Co. KGaA\nKommanditgesellschaft auf Aktien\nMannheim\n\nDie Gesellschaft hat am 21.11.2025 die Liste über die Zusammensetzung des Aufsichtsrats zum Handelsregister eingereicht."
    },
    {
      "date": "2025-11-24",
      "id": "138095",
      "original_text": "Löschungsankündigung\nThüringen Amtsgericht Jena HRB 106534\nGutenberg Druckerei GmbH Weimar – Weimar",
      "type": "Löschungsankündigung",
      "state": "Thüringen",
      "amtsgericht": "Amtsgericht Jena",
      "registernummer": "HRB 106534",
      "registerart": "HRB",
      "company_name": "Gutenberg Druckerei GmbH Weimar",
      "company_seat": "Weimar",
      "details": "24.11.2025 (Bekanntmachungsdatum)\n\nThüringen Amtsgericht Jena HRB 106534\nLöschungsankündigung\n\nGutenberg Druckerei GmbH Weimar\nGesellschaft mit beschränkter Haftung\nWeimar\n\nDas Registergericht beabsichtigt, die im Handelsregister eingetragene Gesellschaft wegen Vermögenslosigkeit nach § 394 FamFG von Amts wegen zu löschen. Die Frist zur Erhebung eines Widerspruchs gegen die beabsichtigte Löschung wird auf 6 Wochen festgesetzt."
    },
    {
      "date": "2025-11-24",
      "id": "138096",
      "original_text": "Löschungsankündigung\nThüringen Amtsgericht Jena HRB 504455\nBIO Energie Saara GmbH – Saara",
      "type": "Löschungsankündigung",
      "state": "Thüringen",
      "amtsgericht": "Amtsgericht Jena",
      "registernummer": "HRB 504455",
      "registerart": "HRB",
      "company_name": "BIO Energie Saara GmbH",
      "company_seat": "Saara",
      "details": "24.11.2025 (Bekanntmachungsdatum)\n\nThüringen Amtsgericht Jena HRB 504455\nLöschungsankündigung\n\nBIO Energie Saara GmbH\nGesellschaft mit beschränkter Haftung\nSaara\n\nDas Registergericht beabsichtigt, die im Handelsregister eingetragene Gesellschaft wegen Vermögenslosigkeit nach § 394 FamFG von Amts wegen zu löschen. Die Frist zur Erhebung eines Widerspruchs gegen die beabsichtigte Löschung wird auf 6 Wochen festgesetzt."
    },
    {
      "date": "2025-11-24",
      "id": "138097",
      "original_text": "Löschungsankündigung\nBaden-Württemberg Amtsgericht Mannheim HRB 337671\nProtectSecurity Sicherheitsdienste GmbH – Eppelheim",
      "type": "Löschungsankündigung",
      "state": "Baden-Württemberg",
      "amtsgericht": "Amtsgericht Mannheim",
      "registernummer": "HRB 337671",
      "registerart": "HRB",
      "company_name": "ProtectSecurity Sicherheitsdienste GmbH",
      "company_seat": "Eppelheim",
      "details": "24.11.2025 (Bekanntmachungsdatum)\n\nBaden-Württemberg Amtsgericht Mannheim HRB 337671\nLöschungsankündigung\n\nProtectSecurity Sicherheitsdienste GmbH\nGesellschaft mit beschränkter Haftung\nEppelheim\n\nAls nicht eingetragen wird bekanntgemacht: Das Gericht beabsichtigt, die Gesellschaft wegen Vermögenslosigkeit im Handelsregister von Amts wegen nach § 394 FamFG zu löschen. Die Frist zur Geltendmachung eines Widerspruchs gegen die beabsichtigte Löschung ist auf einen Monat ab Veröffentlichung bestimmt."
    },
    {
      "date": "2025-11-24",
      "id": "138098",
      "original_text": "Registerbekanntmachung nach dem Umwandlungsgesetz\nBerlin Amtsgericht Berlin (Charlottenburg) HRB 281489\nSarah Erichsen Holding GmbH – Berlin",
      "type": "Registerbekanntmachung nach dem Umwandlungsgesetz",
      "state": "Berlin",
      "amtsgericht": "Amtsgericht Berlin (Charlottenburg)",
      "registernummer": "HRB 281489",
      "registerart": "HRB",
      "company_name": "Sarah Erichsen Holding GmbH",
      "company_seat": "Berlin",
      "details": "24.11.2025 (Bekanntmachungsdatum)\n\nBerlin Amtsgericht Berlin (Charlottenburg) HRB 281489\nRegisterbekanntmachung nach dem Umwandlungsgesetz 21.11.2025 (Eintragungsdatum)\n\nSarah Erichsen Holding GmbH\nGesellschaft mit beschränkter Haftung\nBerlin\n\nZu Eintragungsnummer 1 vom 21.11.2025 wird als nicht eingetragen veröffentlicht:\nDen Gläubigern ist, wenn sie binnen sechs Monaten nach dem Tag, an dem die Eintragung der Umwandlung als bekannt gemacht gilt, ihren Anspruch nach Grund und Höhe schriftlich anmelden, Sicherheit zu leisten, soweit sie nicht Befriedigung verlangen können. Dieses Recht steht den Gläubigern jedoch nur zu, wenn sie glaubhaft machen, dass durch die Umwandlung die Erfüllung ihrer Forderung gefährdet wird. Das Recht, Sicherheitsleistung zu verlangen, steht Gläubigern nicht zu, die im Falle der Insolvenz ein Recht auf vorzugsweise Befriedigung aus einer Deckungsmasse haben, die nach gesetzlicher Vorschrift zu ihrem Schutz errichtet und staatlich überwacht ist."
    },
    {
      "date": "2025-11-24",
      "id": "138099",
      "original_text": "Registerbekanntmachung nach dem Umwandlungsgesetz\nBerlin Amtsgericht Berlin (Charlottenburg) HRA 63525\nSE Umbrella Holding GmbH & Co. KG – Berlin",
      "type": "Registerbekanntmachung nach dem Umwandlungsgesetz",
      "state": "Berlin",
      "amtsgericht": "Amtsgericht Berlin (Charlottenburg)",
      "registernummer": "HRA 63525",
      "registerart": "HRA",
      "company_name": "SE Umbrella Holding GmbH & Co. KG",
      "company_seat": "Berlin",
      "details": "24.11.2025 (Bekanntmachungsdatum)\n\nBerlin Amtsgericht Berlin (Charlottenburg) HRA 63525\nRegisterbekanntmachung nach dem Umwandlungsgesetz 21.11.2025 (Eintragungsdatum)\n\nSE Umbrella Holding GmbH & Co. KG\nKommanditgesellschaft\nBerlin\n\nZu Eintragungsnummer 2 vom 21.11.2025 wird als nicht eingetragen veröffentlicht:\nDen Gläubigern ist, wenn sie binnen sechs Monaten nach dem Tag, an dem die Eintragung der Umwandlung als bekannt gemacht gilt, ihren Anspruch nach Grund und Höhe schriftlich anmelden, Sicherheit zu leisten, soweit sie nicht Befriedigung verlangen können. Dieses Recht steht den Gläubigern jedoch nur zu, wenn sie glaubhaft machen, dass durch die Umwandlung die Erfüllung ihrer Forderung gefährdet wird. Das Recht, Sicherheitsleistung zu verlangen, steht Gläubigern nicht zu, die im Falle der Insolvenz ein Recht auf vorzugsweise Befriedigung aus einer Deckungsmasse haben, die nach gesetzlicher Vorschrift zu ihrem Schutz errichtet und staatlich überwacht ist."
    },
    {
      "date": "2025-11-24",
      "id": "138100",
      "original_text": "Löschungsankündigung\nSchleswig-Holstein Amtsgericht Pinneberg HRB 14355\nSeven Hand GmbH – Hasloh",
      "type": "Löschungsankündigung",
      "state": "Schleswig-Holstein",
      "amtsgericht": "Amtsgericht Pinneberg",
      "registernummer": "HRB 14355",
      "registerart": "HRB",
      "company_name": "Seven Hand GmbH",
      "company_seat": "Hasloh",
      "details": "24.11.2025 (Bekanntmachungsdatum)\n\nSchleswig-Holstein Amtsgericht Pinneberg HRB 14355\nLöschungsankündigung\n\nSeven Hand GmbH\nGesellschaft mit beschränkter Haftung\nHasloh\n\nEs ist die Löschung der nachstehenden Gesellschaft wegen Vermögenslosigkeit gemäß § 394 FamFG beabsichtigt. Widerspruchsfrist: 2 Monate."
    },
    {
      "date": "2025-11-24",
      "id": "138101",
      "original_text": "Sonstige Registerbekanntmachung\nHamburg Amtsgericht Hamburg HRB 166229\nAirbus Logistik GmbH – Hamburg",
      "type": "Sonstige Registerbekanntmachung",
      "state": "Hamburg",
      "amtsgericht": "Amtsgericht Hamburg",
      "registernummer": "HRB 166229",
      "registerart": "HRB",
      "company_name": "Airbus Logistik GmbH",
      "company_seat": "Hamburg",
      "details": "24.11.2025 (Bekanntmachungsdatum)\n\nHamburg Amtsgericht Hamburg HRB 166229\nSonstige Registerbekanntmachung\n\nAirbus Logistik GmbH\nGesellschaft mit beschränkter Haftung\nHamburg\n\nAls nicht eingetragen wird bekannt gemacht: Liste des Aufsichtsrats wurde eingereicht."
    },
    {
      "date": "2025-11-24",
      "id": "138102",
      "original_text": "Löschungsankündigung\nBaden-Württemberg Amtsgericht Mannheim HRB 362094\nFS SCHNAITER GmbH – Straubenhardt",
      "type": "Löschungsankündigung",
      "state": "Baden-Württemberg",
      "amtsgericht": "Amtsgericht Mannheim",
      "registernummer": "HRB 362094",
      "registerart": "HRB",
      "company_name": "FS SCHNAITER GmbH",
      "company_seat": "Straubenhardt",
      "details": "24.11.2025 (Bekanntmachungsdatum)\n\nBaden-Württemberg Amtsgericht Mannheim HRB 362094\nLöschungsankündigung\n\nFS SCHNAITER GmbH\nGesellschaft mit beschränkter Haftung\nStraubenhardt\n\nDas Gericht beabsichtigt, die Gesellschaft wegen Vermögenslosigkeit im Handelsregister von Amts wegen nach § 394 FamFG zu löschen. Die Frist zur Geltendmachung eines Widerspruchs gegen die beabsichtigte Löschung ist auf einen Monat ab Veröffentlichung bestimmt."
    },
    {
      "date": "2025-11-24",
      "id": "138103",
      "original_text": "Registerbekanntmachung nach dem Umwandlungsgesetz\nBaden-Württemberg Amtsgericht Stuttgart GsR 3331\nAlbPhysio eGbR – Münsingen",
      "type": "Registerbekanntmachung nach dem Umwandlungsgesetz",
      "state": "Baden-Württemberg",
      "amtsgericht": "Amtsgericht Stuttgart",
      "registernummer": "GsR 3331",
      "registerart": "GsR",
      "company_name": "AlbPhysio eGbR",
      "company_seat": "Münsingen",
      "details": "24.11.2025 (Bekanntmachungsdatum)\n\nBaden-Württemberg Amtsgericht Stuttgart GsR 3331\nRegisterbekanntmachung nach dem Umwandlungsgesetz 24.11.2025 (Eintragungsdatum)\n\nAlbPhysio eGbR\nGesellschaft bürgerlichen Rechts\nMünsingen\n\nDen Gläubigern des an dem Formwechsel beteiligten Rechtsträgers ist, wenn sie binnen sechs Monaten nach dem Tag, an dem die Eintragung des Formwechsels in das Register des Sitzes desjenigen Rechtsträgers, dessen Gläubiger sie sind, nach § 19 Abs. 3 UmwG als bekanntgemacht gilt, ihren Anspruch nach Grund und Höhe schriftlich anmelden, Sicherheit zu leisten, soweit sie nicht Befriedigung verlangen können. Dieses Recht steht den Gläubigern jedoch nur zu, wenn sie glaubhaft machen, dass durch den Formwechsel die Erfüllung ihrer Forderung gefährdet wird."
    },
    {
      "date": "2025-11-24",
      "id": "138104",
      "original_text": "Registerbekanntmachung nach dem Umwandlungsgesetz\nSchleswig-Holstein Amtsgericht Pinneberg HRB 13368\nUhl Trucks Handels GmbH – Hemmingstedt",
      "type": "Registerbekanntmachung nach dem Umwandlungsgesetz",
      "state": "Schleswig-Holstein",
      "amtsgericht": "Amtsgericht Pinneberg",
      "registernummer": "HRB 13368",
      "registerart": "HRB",
      "company_name": "Uhl Trucks Handels GmbH",
      "company_seat": "Hemmingstedt",
      "details": "24.11.2025 (Bekanntmachungsdatum)\n\nSchleswig-Holstein Amtsgericht Pinneberg HRB 13368\nRegisterbekanntmachung nach dem Umwandlungsgesetz 19.11.2025 (Eintragungsdatum)\n\nUhl Trucks Handels GmbH\nGesellschaft mit beschränkter Haftung\nHemmingstedt\n\nZu Eintragungsnummer 5 vom 19.11.2025 wird als nicht eingetragen veröffentlicht:  Als nicht eingetragen wird veröffentlicht: Den Gläubigern der an der Verschmelzung beteiligten Rechtsträger ist, wenn sie binnen sechs Monaten nach dem Tag, an dem die Eintragung der Verschmelzung in das Register des Sitzes desjenigen Rechtsträgers, dessen Gläubiger sie sind, als bekannt gemacht gilt, ihren Anspruch nach Grund und Höhe schriftlich anmelden, Sicherheit zu leisten, soweit sie nicht Befriedigung verlangen können. Dieses Recht steht den Gläubigern jedoch nur zu, wenn sie glaubhaft machen, dass durch die Verschmelzung die Erfüllung ihrer Forderung gefährdet wird. Das Recht, Sicherheitsleistung zu verlangen, steht Gläubigern nicht zu, die im Falle der Insolvenz ein Recht auf vorzugsweise Befriedigung aus einer Deckungsmasse haben, die nach gesetzlicher Vorschrift zu ihrem Schutz errichtet und staatlich überwacht ist."
    },
    {
      "date": "2025-11-24",
      "id": "138105",
      "original_text": "Löschungsankündigung\nBrandenburg Amtsgericht Potsdam HRB 32148\nmsb - baububen GmbH – Falkensee",
      "type": "Löschungsankündigung",
      "state": "Brandenburg",
      "amtsgericht": "Amtsgericht Potsdam",
      "registernummer": "HRB 32148",
      "registerart": "HRB",
      "company_name": "msb - baububen GmbH",
      "company_seat": "Falkensee",
      "details": "24.11.2025 (Bekanntmachungsdatum)\n\nBrandenburg Amtsgericht Potsdam HRB 32148\nLöschungsankündigung\n\nmsb - baububen GmbH\nGesellschaft mit beschränkter Haftung\nFalkensee\n\nBei der nachstehenden Gesellschaft wird das Amtslöschungsverfahren gemäß § 394 FamFG eingeleitet. Widerspruchsfrist: 8 Wochen."
    },
    {
      "date": "2025-11-24",
      "id": "138106",
      "original_text": "Löschungsankündigung\nSchleswig-Holstein Amtsgericht Kiel HRB 26210\nPV Ranger GmbH – Norderstedt",
      "type": "Löschungsankündigung",
      "state": "Schleswig-Holstein",
      "amtsgericht": "Amtsgericht Kiel",
      "registernummer": "HRB 26210",
      "registerart": "HRB",
      "company_name": "PV Ranger GmbH",
      "company_seat": "Norderstedt",
      "details": "24.11.2025 (Bekanntmachungsdatum)\n\nSchleswig-Holstein Amtsgericht Kiel HRB 26210\nLöschungsankündigung\n\nPV Ranger GmbH\nGesellschaft mit beschränkter Haftung\nNorderstedt\n\nEs ist die Löschung der nachstehenden Gesellschaft wegen Vermögenslosigkeit gemäß § 394 FamFG beabsichtigt. Widerspruchsfrist: 2 Monate."
    },
    {
      "date": "2025-11-24",
      "id": "138107",
      "original_text": "Löschungsankündigung\nBerlin Amtsgericht Berlin (Charlottenburg) HRB 228804\nOZ Solutions GmbH – Berlin",
      "type": "Löschungsankündigung",
      "state": "Berlin",
      "amtsgericht": "Amtsgericht Berlin (Charlottenburg)",
      "registernummer": "HRB 228804",
      "registerart": "HRB",
      "company_name": "OZ Solutions GmbH",
      "company_seat": "Berlin",
      "details": "24.11.2025 (Bekanntmachungsdatum)\n\nBerlin Amtsgericht Berlin (Charlottenburg) HRB 228804\nLöschungsankündigung\n\nOZ Solutions GmbH\nGesellschaft mit beschränkter Haftung\nBerlin\n\nBei der nachstehenden Gesellschaft wird das Amtslöschungsverfahren gemäß § 394 FamFG eingeleitet. Widerspruchsfrist 6 Wochen"
    },
    {
      "date": "2025-11-24",
      "id": "138108",
      "original_text": "Registerbekanntmachung nach dem Umwandlungsgesetz\nSachsen-Anhalt Amtsgericht Stendal HRB 26041\nGrewe Magdeburg GmbH – Magdeburg",
      "type": "Registerbekanntmachung nach dem Umwandlungsgesetz",
      "state": "Sachsen-Anhalt",
      "amtsgericht": "Amtsgericht Stendal",
      "registernummer": "HRB 26041",
      "registerart": "HRB",
      "company_name": "Grewe Magdeburg GmbH",
      "company_seat": "Magdeburg",
      "details": "24.11.2025 (Bekanntmachungsdatum)\n\nSachsen-Anhalt Amtsgericht Stendal HRB 26041\nRegisterbekanntmachung nach dem Umwandlungsgesetz 24.11.2025 (Eintragungsdatum)\n\nGrewe Magdeburg GmbH\nGesellschaft mit beschränkter Haftung\nMagdeburg\n\nNicht eingetragen:\nDen Gläubigern der an der Verschmelzung beteiligten Rechtsträger ist, wenn sie binnen sechs Monaten nach dem Tag, an dem die Eintragung der Verschmelzung nach § 19 Abs. 3 UmwG als bekanntgemacht gilt, ihren Anspruch nach Grund und Höhe schriftlich anmelden, Sicherheit zu leisten, soweit sie nicht Befriedigung verlangen können. Dieses Recht steht ihnen jedoch nur zu, wenn sie glaubhaft machen, dass durch die Verschmelzung die Erfüllung ihrer Forderung gefährdet wird."
    },
    {
      "date": "2025-11-24",
      "id": "138109",
      "original_text": "Einreichung neuer Dokumente\nSchleswig-Holstein Amtsgericht Pinneberg HRB 1547 IZ\nVishay Siliconix Itzehoe GmbH – Itzehoe",
      "type": "Einreichung neuer Dokumente",
      "state": "Schleswig-Holstein",
      "amtsgericht": "Amtsgericht Pinneberg",
      "registernummer": "HRB 1547 IZ",
      "registerart": "HRB",
      "company_name": "Vishay Siliconix Itzehoe GmbH",
      "company_seat": "Itzehoe",
      "details": "24.11.2025 (Bekanntmachungsdatum)\n\nSchleswig-Holstein Amtsgericht Pinneberg HRB 1547 IZ\nEinreichung neuer Dokumente\n\nVishay Siliconix Itzehoe GmbH\nGesellschaft mit beschränkter Haftung\nItzehoe\n\nEs wurde eine neue Liste der Aufsichtsratsmitglieder gem. § 106 AktG zum Handelsregister eingereicht."
    },
    {
      "date": "2025-11-24",
      "id": "138110",
      "original_text": "Einreichung neuer Dokumente\nBaden-Württemberg Amtsgericht Freiburg HRB 729081\nIdana AG – Freiburg im Breisgau",
      "type": "Einreichung neuer Dokumente",
      "state": "Baden-Württemberg",
      "amtsgericht": "Amtsgericht Freiburg",
      "registernummer": "HRB 729081",
      "registerart": "HRB",
      "company_name": "Idana AG",
      "company_seat": "Freiburg im Breisgau",
      "details": "24.11.2025 (Bekanntmachungsdatum)\n\nBaden-Württemberg Amtsgericht Freiburg HRB 729081\nEinreichung neuer Dokumente\n\nIdana AG\nAktiengesellschaft\nFreiburg im Breisgau\n\nDie Gesellschaft hat am 24.11.2025 die Liste über die Zusammensetzung des Aufsichtsrats zum Handelsregister eingereicht."
    },
    {
      "date": "2025-11-24",
      "id": "138111",
      "original_text": "Löschungsankündigung\nBaden-Württemberg Amtsgericht Freiburg HRB 717836\nSolAround GmbH – Konstanz",
      "type": "Löschungsankündigung",
      "state": "Baden-Württemberg",
      "amtsgericht": "Amtsgericht Freiburg",
      "registernummer": "HRB 717836",
      "registerart": "HRB",
      "company_name": "SolAround GmbH",
      "company_seat": "Konstanz",
      "details": "24.11.2025 (Bekanntmachungsdatum)\n\nBaden-Württemberg Amtsgericht Freiburg HRB 717836\nLöschungsankündigung\n\nSolAround GmbH\nGesellschaft mit beschränkter Haftung\nKonstanz\n\nAls nicht eingetragen wird bekanntgemacht:\nDas Gericht beabsichtigt, die Gesellschaft wegen Vermögenslosigkeit im Handelsregister von Amts wegen nach § 394 FamFG zu löschen. Die Frist zur Geltendmachung eines Widerspruchs gegen die beabsichtigte Löschung ist auf einen Monat ab Veröffentlichung bestimmt."
    },
    {
      "date": "2025-11-24",
      "id": "138112",
      "original_text": "Löschungsankündigung\nSachsen Amtsgericht Dresden HRB 24512\nSNB Industrie GmbH – Boxdorf",
      "type": "Löschungsankündigung",
      "state": "Sachsen",
      "amtsgericht": "Amtsgericht Dresden",
      "registernummer": "HRB 24512",
      "registerart": "HRB",
      "company_name": "SNB Industrie GmbH",
      "company_seat": "Boxdorf",
      "details": "24.11.2025 (Bekanntmachungsdatum)\n\nSachsen Amtsgericht Dresden HRB 24512\nLöschungsankündigung\n\nSNB Industrie GmbH\nGesellschaft mit beschränkter Haftung\nBoxdorf\n\nDas Registergericht beabsichtigt, die im Handelsregister eingetragene Gesellschaft von Amts wegen nach § 394 FamFG zu löschen. Die Frist zu Erhebung eines Widerspruchs gegen die beabsichtigte Löschung wird auf einen Monat festgesetzt."
    },
    {
      "date": "2025-11-24",
      "id": "138113",
      "original_text": "Löschungsankündigung\nSachsen Amtsgericht Chemnitz HRB 1311\ng + f - Elektro- und Heizungs-GmbH – Reinsdorf",
      "type": "Löschungsankündigung",
      "state": "Sachsen",
      "amtsgericht": "Amtsgericht Chemnitz",
      "registernummer": "HRB 1311",
      "registerart": "HRB",
      "company_name": "g + f - Elektro- und Heizungs-GmbH",
      "company_seat": "Reinsdorf",
      "details": "24.11.2025 (Bekanntmachungsdatum)\n\nSachsen Amtsgericht Chemnitz HRB 1311\nLöschungsankündigung 24.11.2025 (Eintragungsdatum)\n\ng + f - Elektro- und Heizungs-GmbH\nGesellschaft mit beschränkter Haftung\nReinsdorf\n\nDas Registergericht beabsichtigt, die im Handelsregister eingetragene Gesellschaft von Amts wegen nach § 394 FamFG zu löschen. Die Frist zu Erhebung eines Widerspruchs gegen die beabsichtigte Löschung wird auf einen Monat festgesetzt."
    },
    {
      "date": "2025-11-24",
      "id": "138114",
      "original_text": "Löschungsankündigung\nNiedersachsen Amtsgericht Lüneburg HRB 110660 früher Amtsgericht Winsen\n\"Ihr Bäcker Sasse\" Bäckerei-Konditorei GmbH – Seevetal",
      "type": "Löschungsankündigung",
      "state": "Niedersachsen",
      "amtsgericht": "Amtsgericht Lüneburg",
      "registernummer": "HRB 110660",
      "registerart": "HRB",
      "company_name": "\"Ihr Bäcker Sasse\" Bäckerei-Konditorei GmbH",
      "company_seat": "Seevetal",
      "former_amtsgericht": "Winsen",
      "details": "24.11.2025 (Bekanntmachungsdatum)\n\nNiedersachsen Amtsgericht Lüneburg HRB 110660 früher Amtsgericht Winsen\nLöschungsankündigung\n\n\"Ihr Bäcker Sasse\" Bäckerei-Konditorei GmbH\nGesellschaft mit beschränkter Haftung\nSeevetal\n\nDas Registergericht beabsichtigt, die Gesellschaft von Amts wegen nach § 394 FamFG zu löschen. Die Frist zur Erhebung eines Widerspruchs ist auf 1 Monat ab dieser Registerbekanntmachung festgesetzt."
    },
    {
      "date": "2025-11-24",
      "id": "138115",
      "original_text": "Löschungsankündigung\nNiedersachsen Amtsgericht Hildesheim HRB 3330\nKSG Kanal-GmbH – Algermissen",
      "type": "Löschungsankündigung",
      "state": "Niedersachsen",
      "amtsgericht": "Amtsgericht Hildesheim",
      "registernummer": "HRB 3330",
      "registerart": "HRB",
      "company_name": "KSG Kanal-GmbH",
      "company_seat": "Algermissen",
      "details": "24.11.2025 (Bekanntmachungsdatum)\n\nNiedersachsen Amtsgericht Hildesheim HRB 3330\nLöschungsankündigung\n\nKSG Kanal-GmbH\nGesellschaft mit beschränkter Haftung\nAlgermissen\n\nDas Registergericht beabsichtigt, die Gesellschaft von Amts wegen nach § 394 FamFG zu löschen. Die Frist zur Erhebung eines Widerspruchs ist auf 1 Monat ab dieser Registerbekanntmachung festgesetzt."
    },
    {
      "date": "2025-11-24",
      "id": "138116",
      "original_text": "Löschungsankündigung\nNiedersachsen Amtsgericht Hildesheim HRB 101074 früher Amtsgericht Gifhorn\nHenkel Klinikservice GmbH – Adenstedt",
      "type": "Löschungsankündigung",
      "state": "Niedersachsen",
      "amtsgericht": "Amtsgericht Hildesheim",
      "registernummer": "HRB 101074",
      "registerart": "HRB",
      "company_name": "Henkel Klinikservice GmbH",
      "company_seat": "Adenstedt",
      "former_amtsgericht": "Gifhorn",
      "details": "24.11.2025 (Bekanntmachungsdatum)\n\nNiedersachsen Amtsgericht Hildesheim HRB 101074 früher Amtsgericht Gifhorn\nLöschungsankündigung\n\nHenkel Klinikservice GmbH\nGesellschaft mit beschränkter Haftung\nAdenstedt\n\nDas Registergericht beabsichtigt, die Gesellschaft von Amts wegen nach § 394 FamFG zu löschen. Die Frist zur Erhebung eines Widerspruchs ist auf 1 Monat ab dieser Registerbekanntmachung festgesetzt."
    },
    {
      "date": "2025-11-24",
      "id": "138117",
      "original_text": "Löschungsankündigung\nNiedersachsen Amtsgericht Hannover HRB 200635\nNegbe GmbH – Wedemark",
      "type": "Löschungsankündigung",
      "state": "Niedersachsen",
      "amtsgericht": "Amtsgericht Hannover",
      "registernummer": "HRB 200635",
      "registerart": "HRB",
      "company_name": "Negbe GmbH",
      "company_seat": "Wedemark",
      "details": "24.11.2025 (Bekanntmachungsdatum)\n\nNiedersachsen Amtsgericht Hannover HRB 200635\nLöschungsankündigung\n\nNegbe GmbH\nGesellschaft mit beschränkter Haftung\nWedemark\n\nDas Registergericht beabsichtigt, die Gesellschaft von Amts wegen nach § 394 FamFG zu löschen. Die Frist zur Erhebung eines Widerspruchs ist auf 1 Monat ab dieser Registerbekanntmachung festgesetzt."
    },
    {
      "date": "2025-11-24",
      "id": "138118",
      "original_text": "Einreichung neuer Dokumente\nNiedersachsen Amtsgericht Hannover HRB 59983\nArnold Jäger Holding GmbH – Hannover",
      "type": "Einreichung neuer Dokumente",
      "state": "Niedersachsen",
      "amtsgericht": "Amtsgericht Hannover",
      "registernummer": "HRB 59983",
      "registerart": "HRB",
      "company_name": "Arnold Jäger Holding GmbH",
      "company_seat": "Hannover",
      "details": "24.11.2025 (Bekanntmachungsdatum)\n\nNiedersachsen Amtsgericht Hannover HRB 59983\nEinreichung neuer Dokumente\n\nArnold Jäger Holding GmbH\nGesellschaft mit beschränkter Haftung\nHannover\n\nDie Liste der Mitglieder des Aufsichtsrats wurde beim Registergericht eingereicht."
    },
    {
      "date": "2025-11-24",
      "id": "138119",
      "original_text": "Registerbekanntmachung nach dem Umwandlungsgesetz\nNiedersachsen Amtsgericht Osnabrück HRA 7488\nLohmann Deutschland Junghennen GmbH & Co. KG – Ankum",
      "type": "Registerbekanntmachung nach dem Umwandlungsgesetz",
      "state": "Niedersachsen",
      "amtsgericht": "Amtsgericht Osnabrück",
      "registernummer": "HRA 7488",
      "registerart": "HRA",
      "company_name": "Lohmann Deutschland Junghennen GmbH & Co. KG",
      "company_seat": "Ankum",
      "details": "24.11.2025 (Bekanntmachungsdatum)\n\nNiedersachsen Amtsgericht Osnabrück HRA 7488\nRegisterbekanntmachung nach dem Umwandlungsgesetz 24.11.2025 (Eintragungsdatum)\n\nLohmann Deutschland Junghennen GmbH & Co. KG\nKommanditgesellschaft\nAnkum\n\nDen Gläubigern der an der Verschmelzung beteiligten Rechtsträger ist, wenn sie binnen sechs Monaten nach dem Tag, an dem die Eintragung der Verschmelzung in das Register des Sitzes desjenigen Rechtsträgers, dessen Gläubiger sie sind, nach § 19  Abs.  3 UmwG als bekannt gemacht gilt, ihren Anspruch nach Grund und Höhe schriftlich anmelden, Sicherheit zu leisten, soweit sie nicht Befriedigung verlangen können. Dieses Recht steht den Gläubigern jedoch nur zu, wenn sie glaubhaft machen, dass durch die Verschmelzung die Erfüllung der Forderung gefährdet wird."
    },
    {
      "date": "2025-11-24",
      "id": "138120",
      "original_text": "Registerbekanntmachung nach dem Umwandlungsgesetz\nNiedersachsen Amtsgericht Oldenburg (Oldenburg) HRB 201781\nVION Emstek GmbH – Emstek",
      "type": "Registerbekanntmachung nach dem Umwandlungsgesetz",
      "state": "Niedersachsen",
      "amtsgericht": "Amtsgericht Oldenburg (Oldenburg)",
      "registernummer": "HRB 201781",
      "registerart": "HRB",
      "company_name": "VION Emstek GmbH",
      "company_seat": "Emstek",
      "details": "24.11.2025 (Bekanntmachungsdatum)\n\nNiedersachsen Amtsgericht Oldenburg (Oldenburg) HRB 201781\nRegisterbekanntmachung nach dem Umwandlungsgesetz\n\nVION Emstek GmbH\nGesellschaft mit beschränkter Haftung\nEmstek\n\nDen Gläubigern der an der Verschmelzung beteiligten Rechtsträger ist, wenn sie binnen sechs Monaten nach dem Tag, an dem die Eintragung der Verschmelzung in das Register des Sitzes desjenigen Rechtsträgers, dessen Gläubiger sie sind, nach § 19  Abs.  3 UmwG als bekannt gemacht gilt, ihren Anspruch nach Grund und Höhe schriftlich anmelden, Sicherheit zu leisten, soweit sie nicht Befriedigung verlangen können. Dieses Recht steht den Gläubigern jedoch nur zu, wenn sie glaubhaft machen, dass durch die Verschmelzung die Erfüllung der Forderung gefährdet wird."
    },
    {
      "date": "2025-11-24",
      "id": "138121",
      "original_text": "Registerbekanntmachung nach dem Umwandlungsgesetz\nRheinland-Pfalz Amtsgericht Wittlich HRA 20728\nAsphaltmischwerk Ürzig Juchem GmbH & Co. KG. – Ürzig",
      "type": "Registerbekanntmachung nach dem Umwandlungsgesetz",
      "state": "Rheinland-Pfalz",
      "amtsgericht": "Amtsgericht Wittlich",
      "registernummer": "HRA 20728",
      "registerart": "HRA",
      "company_name": "Asphaltmischwerk Ürzig Juchem GmbH & Co. KG.",
      "company_seat": "Ürzig",
      "details": "24.11.2025 (Bekanntmachungsdatum)\n\nRheinland-Pfalz Amtsgericht Wittlich HRA 20728\nRegisterbekanntmachung nach dem Umwandlungsgesetz 24.11.2025 (Eintragungsdatum)\n\nAsphaltmischwerk Ürzig Juchem GmbH & Co. KG.\nKommanditgesellschaft\nÜrzig\n\nDie Gesellschaft hat Gläubigern, deren Forderungen vor dieser Bekanntmachung begründet worden sind, Sicherheit zu leisten, soweit sie nicht Befriedigung verlangen können, wenn sie sich binnen sechs Monaten zu diesem Zweck melden. Gläubigern der an der Verschmelzung beteiligten Rechtsträger ist unter den Voraussetzungen des § 22 UmwG Sicherheit zu leisten."
    },
    {
      "date": "2025-11-24",
      "id": "138122",
      "original_text": "Löschungsankündigung\nBremen Amtsgericht Bremen HRB 29924\nCargo Ship Parts GmbH – Bremen",
      "type": "Löschungsankündigung",
      "state": "Bremen",
      "amtsgericht": "Amtsgericht Bremen",
      "registernummer": "HRB 29924",
      "registerart": "HRB",
      "company_name": "Cargo Ship Parts GmbH",
      "company_seat": "Bremen",
      "details": "24.11.2025 (Bekanntmachungsdatum)\n\nBremen Amtsgericht Bremen HRB 29924\nLöschungsankündigung\n\nCargo Ship Parts GmbH\nGesellschaft mit beschränkter Haftung\nBremen\n\nEs ist beabsichtigt die im Handelsregister eingetragene Gesellschaft von Amts wegen gemäß § 394 FamFG zu löschen. Gegen die Löschung kann beim AG Bremen schriftlich oder zu Protokoll der Geschäftsstelle Widerspruch eingelegt werden. Widerspruchsfrist 4 Wochen."
    },
    {
      "date": "2025-11-24",
      "id": "138123",
      "original_text": "Registerbekanntmachung nach dem Umwandlungsgesetz\nNordrhein-Westfalen Amtsgericht Düsseldorf VR 30397 früher Amtsgericht Langenfeld\nSKFM Hilden-Haan e.V. – Hilden",
      "type": "Registerbekanntmachung nach dem Umwandlungsgesetz",
      "state": "Nordrhein-Westfalen",
      "amtsgericht": "Amtsgericht Düsseldorf",
      "registernummer": "VR 30397",
      "registerart": "VR",
      "company_name": "SKFM Hilden-Haan e.V.",
      "company_seat": "Hilden",
      "former_amtsgericht": "Langenfeld",
      "details": "24.11.2025 (Bekanntmachungsdatum)\n\nNordrhein-Westfalen Amtsgericht Düsseldorf VR 30397 früher Amtsgericht Langenfeld\nRegisterbekanntmachung nach dem Umwandlungsgesetz 24.11.2025 (Eintragungsdatum)\n\nSKFM Hilden-Haan e.V.\neingetragener Verein\nHilden\n\nDen Gläubigern der an der Verschmelzung beteiligten Rechtsträger ist, wenn sie binnen sechs Monaten nach dem Tag, an dem die Eintragung der Verschmelzung in das Register des Sitzes desjenigen Rechtsträgers, dessen Gläubiger sie sind, nach § 19 Absatz 3 UmwG als bekanntgemacht gilt, ihren Anspruch nach Grund und Höhe schriftlich anmelden, Sicherheit zu leisten, soweit sie nicht Befriedigung verlangen können. Dieses Recht steht den Gläubigern jedoch nur zu, wenn sie glaubhaft machen, dass durch die Verschmelzung die Erfüllung ihrer Forderung gefährdet wird."
    },
    {
      "date": "2025-11-24",
      "id": "138124",
      "original_text": "Löschungsankündigung\nNordrhein-Westfalen Amtsgericht Essen HRB 30650\nVFX Vegan Food XPress GmbH – Essen",
      "type": "Löschungsankündigung",
      "state": "Nordrhein-Westfalen",
      "amtsgericht": "Amtsgericht Essen",
      "registernummer": "HRB 30650",
      "registerart": "HRB",
      "company_name": "VFX Vegan Food XPress GmbH",
      "company_seat": "Essen",
      "details": "24.11.2025 (Bekanntmachungsdatum)\n\nNordrhein-Westfalen Amtsgericht Essen HRB 30650\nLöschungsankündigung\n\nVFX Vegan Food XPress GmbH\nGesellschaft mit beschränkter Haftung\nEssen\n\nDas Registergericht beabsichtigt die Gesellschaft von Amts wegen nach § 394 FamFG zu löschen. Die Frist zur Erhebung eines Widerspruchs ist auf einen Monat festgesetzt."
    },
    {
      "date": "2025-11-24",
      "id": "138125",
      "original_text": "Registerbekanntmachung nach dem Umwandlungsgesetz\nNordrhein-Westfalen Amtsgericht Düsseldorf HRB 90216\nSND GmbH – Düsseldorf",
      "type": "Registerbekanntmachung nach dem Umwandlungsgesetz",
      "state": "Nordrhein-Westfalen",
      "amtsgericht": "Amtsgericht Düsseldorf",
      "registernummer": "HRB 90216",
      "registerart": "HRB",
      "company_name": "SND GmbH",
      "company_seat": "Düsseldorf",
      "details": "24.11.2025 (Bekanntmachungsdatum)\n\nNordrhein-Westfalen Amtsgericht Düsseldorf HRB 90216\nRegisterbekanntmachung nach dem Umwandlungsgesetz 24.11.2025 (Eintragungsdatum)\n\nSND GmbH\nGesellschaft mit beschränkter Haftung\nDüsseldorf\n\nDen Gläubigern der an der Verschmelzung beteiligten Rechtsträger ist, wenn sie binnen sechs Monaten nach dem Tag, an dem die Eintragung der Verschmelzung in das Register des Sitzes desjenigen Rechtsträgers, dessen Gläubiger sie sind, nach § 19 Absatz 3 UmwG als bekanntgemacht gilt, ihren Anspruch nach Grund und Höhe schriftlich anmelden, Sicherheit zu leisten, soweit sie nicht Befriedigung verlangen können. Dieses Recht steht den Gläubigern jedoch nur zu, wenn sie glaubhaft machen, dass durch die Verschmelzung die Erfüllung ihrer Forderung gefährdet wird."
    },
    {
      "date": "2025-11-24",
      "id": "138126",
      "original_text": "Registerbekanntmachung nach dem Umwandlungsgesetz\nNordrhein-Westfalen Amtsgericht Duisburg HRA 5114\nHark GmbH & Co KG Kamin- u. Kachelofenbau – Duisburg",
      "type": "Registerbekanntmachung nach dem Umwandlungsgesetz",
      "state": "Nordrhein-Westfalen",
      "amtsgericht": "Amtsgericht Duisburg",
      "registernummer": "HRA 5114",
      "registerart": "HRA",
      "company_name": "Hark GmbH & Co KG Kamin- u. Kachelofenbau",
      "company_seat": "Duisburg",
      "details": "24.11.2025 (Bekanntmachungsdatum)\n\nNordrhein-Westfalen Amtsgericht Duisburg HRA 5114\nRegisterbekanntmachung nach dem Umwandlungsgesetz 24.11.2025 (Eintragungsdatum)\n\nHark GmbH & Co KG Kamin- u. Kachelofenbau\nKommanditgesellschaft\nDuisburg\n\nDen Gläubigern der an der Ausgliederung beteiligten Rechtsträger ist, wenn sie binnen sechs Monaten nach dem Tag, an dem die Eintragung der Ausgliederung in das Register des Sitzes desjenigen Rechtsträgers, dessen Gläubiger sie sind, nach § 19 Absatz 3 UmwG als bekanntgemacht gilt, ihren Anspruch nach Grund und Höhe schriftlich anmelden, Sicherheit zu leisten, soweit sie nicht Befriedigung verlangen können. Dieses Recht steht den Gläubigern jedoch nur zu, wenn sie glaubhaft machen, dass durch die Ausgliederung die Erfüllung ihrer Forderung gefährdet wird."
    },
    {
      "date": "2025-11-24",
      "id": "138127",
      "original_text": "Registerbekanntmachung nach dem Umwandlungsgesetz\nNordrhein-Westfalen Amtsgericht Düsseldorf HRB 98883\nKK Vermietung GmbH – Düsseldorf",
      "type": "Registerbekanntmachung nach dem Umwandlungsgesetz",
      "state": "Nordrhein-Westfalen",
      "amtsgericht": "Amtsgericht Düsseldorf",
      "registernummer": "HRB 98883",
      "registerart": "HRB",
      "company_name": "KK Vermietung GmbH",
      "company_seat": "Düsseldorf",
      "details": "24.11.2025 (Bekanntmachungsdatum)\n\nNordrhein-Westfalen Amtsgericht Düsseldorf HRB 98883\nRegisterbekanntmachung nach dem Umwandlungsgesetz 24.11.2025 (Eintragungsdatum)\n\nKK Vermietung GmbH\nGesellschaft mit beschränkter Haftung\nDüsseldorf\n\nDen Gläubigern der an der Verschmelzung beteiligten Rechtsträger ist, wenn sie binnen sechs Monaten nach dem Tag, an dem die Eintragung der Verschmelzung in das Register des Sitzes desjenigen Rechtsträgers, dessen Gläubiger sie sind, nach § 19 Absatz 3 UmwG als bekanntgemacht gilt, ihren Anspruch nach Grund und Höhe schriftlich anmelden, Sicherheit zu leisten, soweit sie nicht Befriedigung verlangen können. Dieses Recht steht den Gläubigern jedoch nur zu, wenn sie glaubhaft machen, dass durch die Verschmelzung die Erfüllung ihrer Forderung gefährdet wird."
    },
    {
      "date": "2025-11-24",
      "id": "138128",
      "original_text": "Registerbekanntmachung nach dem Umwandlungsgesetz\nNordrhein-Westfalen Amtsgericht Düsseldorf HRB 95413\nExostark GmbH – Monheim am Rhein",
      "type": "Registerbekanntmachung nach dem Umwandlungsgesetz",
      "state": "Nordrhein-Westfalen",
      "amtsgericht": "Amtsgericht Düsseldorf",
      "registernummer": "HRB 95413",
      "registerart": "HRB",
      "company_name": "Exostark GmbH",
      "company_seat": "Monheim am Rhein",
      "details": "24.11.2025 (Bekanntmachungsdatum)\n\nNordrhein-Westfalen Amtsgericht Düsseldorf HRB 95413\nRegisterbekanntmachung nach dem Umwandlungsgesetz 24.11.2025 (Eintragungsdatum)\n\nExostark GmbH\nGesellschaft mit beschränkter Haftung\nMonheim am Rhein\n\nDen Gläubigern der an der Verschmelzung beteiligten Rechtsträger ist, wenn sie binnen sechs Monaten nach dem Tag, an dem die Eintragung der Verschmelzung in das Register des Sitzes desjenigen Rechtsträgers, dessen Gläubiger sie sind, nach § 19 Absatz 3 UmwG als bekanntgemacht gilt, ihren Anspruch nach Grund und Höhe schriftlich anmelden, Sicherheit zu leisten, soweit sie nicht Befriedigung verlangen können. Dieses Recht steht den Gläubigern jedoch nur zu, wenn sie glaubhaft machen, dass durch die Verschmelzung die Erfüllung ihrer Forderung gefährdet wird."
    },
    {
      "date": "2025-11-24",
      "id": "138129",
      "original_text": "Löschungsankündigung\nNordrhein-Westfalen Amtsgericht Köln HRB 107093\nDPI Deutsche Premium Investment GmbH – Köln",
      "type": "Löschungsankündigung",
      "state": "Nordrhein-Westfalen",
      "amtsgericht": "Amtsgericht Köln",
      "registernummer": "HRB 107093",
      "registerart": "HRB",
      "company_name": "DPI Deutsche Premium Investment GmbH",
      "company_seat": "Köln",
      "details": "24.11.2025 (Bekanntmachungsdatum)\n\nNordrhein-Westfalen Amtsgericht Köln HRB 107093\nLöschungsankündigung\n\nDPI Deutsche Premium Investment GmbH\nGesellschaft mit beschränkter Haftung\nKöln\n\nDas Registergericht beabsichtigt die Gesellschaft von Amts wegen nach § 394 FamFG zu löschen. Die Frist zur Erhebung eines Widerspruchs ist auf einen Monat festgesetzt."
    },
    {
      "date": "2025-11-24",
      "id": "138130",
      "original_text": "Löschungsankündigung\nNordrhein-Westfalen Amtsgericht Dortmund HRB 31508\nWohnungsbaugesellschaft West mbH – Werne",
      "type": "Löschungsankündigung",
      "state": "Nordrhein-Westfalen",
      "amtsgericht": "Amtsgericht Dortmund",
      "registernummer": "HRB 31508",
      "registerart": "HRB",
      "company_name": "Wohnungsbaugesellschaft West mbH",
      "company_seat": "Werne",
      "details": "24.11.2025 (Bekanntmachungsdatum)\n\nNordrhein-Westfalen Amtsgericht Dortmund HRB 31508\nLöschungsankündigung\n\nWohnungsbaugesellschaft West mbH\nGesellschaft mit beschränkter Haftung\nWerne\n\nDas Registergericht beabsichtigt die Gesellschaft von Amts wegen nach § 394 FamFG zu löschen. Die Frist zur Erhebung eines Widerspruchs ist auf zwei Monate festgesetzt."
    },
    {
      "date": "2025-11-24",
      "id": "138131",
      "original_text": "Löschungsankündigung\nNordrhein-Westfalen Amtsgericht Köln HRB 95934\nUB Gastronomie GmbH – Köln",
      "type": "Löschungsankündigung",
      "state": "Nordrhein-Westfalen",
      "amtsgericht": "Amtsgericht Köln",
      "registernummer": "HRB 95934",
      "registerart": "HRB",
      "company_name": "UB Gastronomie GmbH",
      "company_seat": "Köln",
      "details": "24.11.2025 (Bekanntmachungsdatum)\n\nNordrhein-Westfalen Amtsgericht Köln HRB 95934\nLöschungsankündigung\n\nUB Gastronomie GmbH\nGesellschaft mit beschränkter Haftung\nKöln\n\nDas Registergericht beabsichtigt die Gesellschaft von Amts wegen nach § 394 FamFG zu löschen. Die Frist zur Erhebung eines Widerspruchs ist auf einen Monat festgesetzt."
    },
    {
      "date": "2025-11-24",
      "id": "138132",
      "original_text": "Löschungsankündigung\nNordrhein-Westfalen Amtsgericht Dortmund HRB 22938\nVerwaltungsgesellschaft Hildebrandstraße Dortmund UG (haftungsbeschränkt) – Dortmund",
      "type": "Löschungsankündigung",
      "state": "Nordrhein-Westfalen",
      "amtsgericht": "Amtsgericht Dortmund",
      "registernummer": "HRB 22938",
      "registerart": "HRB",
      "company_name": "Verwaltungsgesellschaft Hildebrandstraße Dortmund UG (haftungsbeschränkt)",
      "company_seat": "Dortmund",
      "details": "24.11.2025 (Bekanntmachungsdatum)\n\nNordrhein-Westfalen Amtsgericht Dortmund HRB 22938\nLöschungsankündigung\n\nVerwaltungsgesellschaft Hildebrandstraße Dortmund UG (haftungsbeschränkt)\nGesellschaft mit beschränkter Haftung\nDortmund\n\nDas Registergericht beabsichtigt die Gesellschaft von Amts wegen nach § 394 FamFG zu löschen. Die Frist zur Erhebung eines Widerspruchs ist auf zwei Monate festgesetzt."
    },
    {
      "date": "2025-11-24",
      "id": "138133",
      "original_text": "Löschungsankündigung\nNordrhein-Westfalen Amtsgericht Dortmund HRB 22938\nVerwaltungsgesellschaft Hildebrandstraße Dortmund UG (haftungsbeschränkt) – Dortmund",
      "type": "Löschungsankündigung",
      "state": "Nordrhein-Westfalen",
      "amtsgericht": "Amtsgericht Dortmund",
      "registernummer": "HRB 22938",
      "registerart": "HRB",
      "company_name": "Verwaltungsgesellschaft Hildebrandstraße Dortmund UG (haftungsbeschränkt)",
      "company_seat": "Dortmund",
      "details": "24.11.2025 (Bekanntmachungsdatum)\n\nNordrhein-Westfalen Amtsgericht Dortmund HRB 22938\nLöschungsankündigung\n\nVerwaltungsgesellschaft Hildebrandstraße Dortmund UG (haftungsbeschränkt)\nGesellschaft mit beschränkter Haftung\nDortmund\n\nDas Registergericht beabsichtigt die Gesellschaft von Amts wegen nach § 394 FamFG zu löschen. Die Frist zur Erhebung eines Widerspruchs ist auf zwei Monate festgesetzt."
    },
    {
      "date": "2025-11-24",
      "id": "138134",
      "original_text": "Registerbekanntmachung nach dem Umwandlungsgesetz\nNordrhein-Westfalen Amtsgericht Köln HRB 122234\nFaM Holding GmbH – Köln",
      "type": "Registerbekanntmachung nach dem Umwandlungsgesetz",
      "state": "Nordrhein-Westfalen",
      "amtsgericht": "Amtsgericht Köln",
      "registernummer": "HRB 122234",
      "registerart": "HRB",
      "company_name": "FaM Holding GmbH",
      "company_seat": "Köln",
      "details": "24.11.2025 (Bekanntmachungsdatum)\n\nNordrhein-Westfalen Amtsgericht Köln HRB 122234\nRegisterbekanntmachung nach dem Umwandlungsgesetz 24.11.2025 (Eintragungsdatum)\n\nFaM Holding GmbH\nGesellschaft mit beschränkter Haftung\nKöln\n\nDen Gläubigern der an der Verschmelzung beteiligten Rechtsträger ist, wenn sie binnen sechs Monaten nach dem Tag, an dem die Eintragung der Verschmelzung in das Register des Sitzes desjenigen Rechtsträgers, dessen Gläubiger sie sind, nach § 19 Absatz 3 UmwG als bekanntgemacht gilt, ihren Anspruch nach Grund und Höhe schriftlich anmelden, Sicherheit zu leisten, soweit sie nicht Befriedigung verlangen können. Dieses Recht steht den Gläubigern jedoch nur zu, wenn sie glaubhaft machen, dass durch die Verschmelzung die Erfüllung ihrer Forderung gefährdet wird."
    },
    {
      "date": "2025-11-24",
      "id": "138135",
      "original_text": "Registerbekanntmachung nach dem Umwandlungsgesetz\nNordrhein-Westfalen Amtsgericht Duisburg HRA 13711\nHark GmbH & Co. KG Keramikmanufaktur – Duisburg",
      "type": "Registerbekanntmachung nach dem Umwandlungsgesetz",
      "state": "Nordrhein-Westfalen",
      "amtsgericht": "Amtsgericht Duisburg",
      "registernummer": "HRA 13711",
      "registerart": "HRA",
      "company_name": "Hark GmbH & Co. KG Keramikmanufaktur",
      "company_seat": "Duisburg",
      "details": "24.11.2025 (Bekanntmachungsdatum)\n\nNordrhein-Westfalen Amtsgericht Duisburg HRA 13711\nRegisterbekanntmachung nach dem Umwandlungsgesetz 24.11.2025 (Eintragungsdatum)\n\nHark GmbH & Co. KG Keramikmanufaktur\nKommanditgesellschaft\nDuisburg\n\nDen Gläubigern der an der Ausgliederung beteiligten Rechtsträger ist, wenn sie binnen sechs Monaten nach dem Tag, an dem die Eintragung der Ausgliederung in das Register des Sitzes desjenigen Rechtsträgers, dessen Gläubiger sie sind, nach § 19 Absatz 3 UmwG als bekanntgemacht gilt, ihren Anspruch nach Grund und Höhe schriftlich anmelden, Sicherheit zu leisten, soweit sie nicht Befriedigung verlangen können. Dieses Recht steht den Gläubigern jedoch nur zu, wenn sie glaubhaft machen, dass durch die Ausgliederung die Erfüllung ihrer Forderung gefährdet wird."
    },
    {
      "date": "2025-11-24",
      "id": "138136",
      "original_text": "Löschungsankündigung\nNordrhein-Westfalen Amtsgericht Köln HRB 70042\nStradina UG (haftungsbeschränkt) – Köln",
      "type": "Löschungsankündigung",
      "state": "Nordrhein-Westfalen",
      "amtsgericht": "Amtsgericht Köln",
      "registernummer": "HRB 70042",
      "registerart": "HRB",
      "company_name": "Stradina UG (haftungsbeschränkt)",
      "company_seat": "Köln",
      "details": "24.11.2025 (Bekanntmachungsdatum)\n\nNordrhein-Westfalen Amtsgericht Köln HRB 70042\nLöschungsankündigung\n\nStradina UG (haftungsbeschränkt)\nGesellschaft mit beschränkter Haftung\nKöln\n\nDas Registergericht beabsichtigt die Gesellschaft von Amts wegen nach § 394 FamFG zu löschen. Die Frist zur Erhebung eines Widerspruchs ist auf einen Monat festgesetzt."
    },
    {
      "date": "2025-11-24",
      "id": "138137",
      "original_text": "Einreichung neuer Dokumente\nNordrhein-Westfalen Amtsgericht Köln HRB 43262\nGWG Wohnungsgesellschaft mit beschränkter Haftung Rhein-Erft – Hürth",
      "type": "Einreichung neuer Dokumente",
      "state": "Nordrhein-Westfalen",
      "amtsgericht": "Amtsgericht Köln",
      "registernummer": "HRB 43262",
      "registerart": "HRB",
      "company_name": "GWG Wohnungsgesellschaft mit beschränkter Haftung Rhein-Erft",
      "company_seat": "Hürth",
      "details": "24.11.2025 (Bekanntmachungsdatum)\n\nNordrhein-Westfalen Amtsgericht Köln HRB 43262\nEinreichung neuer Dokumente\n\nGWG Wohnungsgesellschaft mit beschränkter Haftung Rhein-Erft\nGesellschaft mit beschränkter Haftung\nHürth\n\nDem Registergericht ist eine Liste der Mitglieder des Aufsichtsrates eingereicht worden."
    },
    {
      "date": "2025-11-24",
      "id": "138138",
      "original_text": "Registerbekanntmachung nach dem Umwandlungsgesetz\nNordrhein-Westfalen Amtsgericht Düsseldorf HRA 11122\nDelos Grundbesitz SARL & Co. KG – Düsseldorf",
      "type": "Registerbekanntmachung nach dem Umwandlungsgesetz",
      "state": "Nordrhein-Westfalen",
      "amtsgericht": "Amtsgericht Düsseldorf",
      "registernummer": "HRA 11122",
      "registerart": "HRA",
      "company_name": "Delos Grundbesitz SARL & Co. KG",
      "company_seat": "Düsseldorf",
      "details": "24.11.2025 (Bekanntmachungsdatum)\n\nNordrhein-Westfalen Amtsgericht Düsseldorf HRA 11122\nRegisterbekanntmachung nach dem Umwandlungsgesetz 24.11.2025 (Eintragungsdatum)\n\nDelos Grundbesitz SARL & Co. KG\nKommanditgesellschaft\nDüsseldorf\n\nDen Gläubigern der an der formwechselnden Umwandlung beteiligten Rechtsträger ist, wenn sie binnen sechs Monaten nach dem Tag, an dem die Eintragung der formwechselnden Umwandlung in das Register des Sitzes desjenigen Rechtsträgers, dessen Gläubiger sie sind, nach § 19 Absatz 3 UmwG als bekanntgemacht gilt, ihren Anspruch nach Grund und Höhe schriftlich anmelden, Sicherheit zu leisten, soweit sie nicht Befriedigung verlangen können. Dieses Recht steht den Gläubigern jedoch nur zu, wenn sie glaubhaft machen, dass durch die formwechselnden Umwandlung die Erfüllung ihrer Forderung gefährdet wird."
    },
    {
      "date": "2025-11-24",
      "id": "138139",
      "original_text": "Registerbekanntmachung nach dem Umwandlungsgesetz\nNordrhein-Westfalen Amtsgericht Neuss HRB 16158\nSAFE-TEC Consulting GmbH – Kaarst",
      "type": "Registerbekanntmachung nach dem Umwandlungsgesetz",
      "state": "Nordrhein-Westfalen",
      "amtsgericht": "Amtsgericht Neuss",
      "registernummer": "HRB 16158",
      "registerart": "HRB",
      "company_name": "SAFE-TEC Consulting GmbH",
      "company_seat": "Kaarst",
      "details": "24.11.2025 (Bekanntmachungsdatum)\n\nNordrhein-Westfalen Amtsgericht Neuss HRB 16158\nRegisterbekanntmachung nach dem Umwandlungsgesetz 24.11.2025 (Eintragungsdatum)\n\nSAFE-TEC Consulting GmbH\nGesellschaft mit beschränkter Haftung\nKaarst\n\nDen Gläubigern der an der Verschmelzung beteiligten Rechtsträger ist, wenn sie binnen sechs Monaten nach dem Tag, an dem die Eintragung der Verschmelzung in das Register des Sitzes desjenigen Rechtsträgers, dessen Gläubiger sie sind, nach § 19 Absatz 3 UmwG als bekanntgemacht gilt, ihren Anspruch nach Grund und Höhe schriftlich anmelden, Sicherheit zu leisten, soweit sie nicht Befriedigung verlangen können. Dieses Recht steht den Gläubigern jedoch nur zu, wenn sie glaubhaft machen, dass durch die Verschmelzung die Erfüllung ihrer Forderung gefährdet wird."
    },
    {
      "date": "2025-11-24",
      "id": "138140",
      "original_text": "Löschungsankündigung\nNordrhein-Westfalen Amtsgericht Duisburg HRB 33199\nOceanwide Shipping Services GmbH – Mülheim an der Ruhr",
      "type": "Löschungsankündigung",
      "state": "Nordrhein-Westfalen",
      "amtsgericht": "Amtsgericht Duisburg",
      "registernummer": "HRB 33199",
      "registerart": "HRB",
      "company_name": "Oceanwide Shipping Services GmbH",
      "company_seat": "Mülheim an der Ruhr",
      "details": "24.11.2025 (Bekanntmachungsdatum)\n\nNordrhein-Westfalen Amtsgericht Duisburg HRB 33199\nLöschungsankündigung 24.11.2025 (Eintragungsdatum)\n\nOceanwide Shipping Services GmbH\nGesellschaft mit beschränkter Haftung\nMülheim an der Ruhr\n\nHRB 33199:\nOceanwide Shipping Services GmbH, Mülheim an der Ruhr\nTannenstraße 46, 45478 Mülheim an der Ruhr.\nDas Registergericht beabsichtigt, die im Handelsregister eingetragene Gesellschaft gemäß § 394 FamFG wegen Vermögenslosigkeit von Amts wegen zu löschen. Gegen diese Verfügung kann Widerspruch eingelegt werden. Die Frist zur Erhebung eines Widerspruchs gegen die beabsichtigte Löschung von Amts wegen ist auf drei Monate festgesetzt.\nRechtsbehelfsbelehrung Der Widerspruch ist bei dem Amtsgericht Duisburg, Kardinal-Galen-Str. 124-132, 47058 Duisburg schriftlich in deutscher Sprache oder zur Niederschrift der Geschäftsstelle einzulegen. Der Widerspruch kann auch zur Niederschrift der Geschäftsstelle eines jeden Amtsgerichtes abgegeben werden. Die Einlegung ist auch durch Übertragung eines elektronischen Dokuments an die elektronische Poststelle des Gerichts möglich. Das elektronische Dokument muss für die Bearbeitung durch das Gericht geeignet und mit einer qualifizierten elektronischen Signatur der verantwortenden Person versehen sein oder von der verantwortenden Person signiert und auf einem sicheren Übermittlungsweg gemäß § 130 a ZPO nach näherer Maßgabe der Verordnung über die technischen Rahmenbedingungen des elektronischen Rechtsverkehrs und über das besondere elektronische Behördenpostfach (BGBl. I, S. 3803) eingereicht werden. Weitere Informationen erhalten Sie auf der Internetseite www.justiz.de <http://www.justiz.de>. Der Widerspruch muss spätestens innerhalb der gesetzten Frist bei dem Amtsgericht Duisburg eingegangen sein. Dies gilt auch dann, wenn der Widerspruch zur Niederschrift der Geschäftsstelle eines anderen Amtsgerichtes abgegeben wurde. Die Frist beginnt mit der Veröffentlichung. Fällt das Ende der Frist auf einen Sonntag, einen allgemeinen Feiertag oder Sonnabend, so endet die Frist mit Ablauf des nächsten Werktages. Der Widerspruch muss die Bezeichnung der angefochtenen Verfügung sowie die Erklärung enthalten, dass Widerspruch gegen diese Verfügung eingelegt wird. Er ist zu unterzeichnen und soll begründet werden."
    },
    {
      "date": "2025-11-24",
      "id": "138141",
      "original_text": "Löschungsankündigung\nNordrhein-Westfalen Amtsgericht Köln HRB 118125\nRykalski Bau UG (haftungsbeschränkt) – Leverkusen",
      "type": "Löschungsankündigung",
      "state": "Nordrhein-Westfalen",
      "amtsgericht": "Amtsgericht Köln",
      "registernummer": "HRB 118125",
      "registerart": "HRB",
      "company_name": "Rykalski Bau UG (haftungsbeschränkt)",
      "company_seat": "Leverkusen",
      "details": "24.11.2025 (Bekanntmachungsdatum)\n\nNordrhein-Westfalen Amtsgericht Köln HRB 118125\nLöschungsankündigung\n\nRykalski Bau UG (haftungsbeschränkt)\nGesellschaft mit beschränkter Haftung\nLeverkusen\n\nDas Registergericht beabsichtigt die Gesellschaft von Amts wegen nach § 394 FamFG zu löschen. Die Frist zur Erhebung eines Widerspruchs ist auf einen Monat festgesetzt."
    },
    {
      "date": "2025-11-24",
      "id": "138142",
      "original_text": "Löschungsankündigung\nNordrhein-Westfalen Amtsgericht Düsseldorf HRB 100086\nEFE Logistik UG (haftungsbeschränkt) – Düsseldorf",
      "type": "Löschungsankündigung",
      "state": "Nordrhein-Westfalen",
      "amtsgericht": "Amtsgericht Düsseldorf",
      "registernummer": "HRB 100086",
      "registerart": "HRB",
      "company_name": "EFE Logistik UG (haftungsbeschränkt)",
      "company_seat": "Düsseldorf",
      "details": "24.11.2025 (Bekanntmachungsdatum)\n\nNordrhein-Westfalen Amtsgericht Düsseldorf HRB 100086\nLöschungsankündigung\n\nEFE Logistik UG (haftungsbeschränkt)\nGesellschaft mit beschränkter Haftung\nDüsseldorf\n\nDas Registergericht beabsichtigt die Gesellschaft von Amts wegen nach § 394 FamFG zu löschen. Die Frist zur Erhebung eines Widerspruchs ist auf 3 Wochen festgesetzt.\n\nRechtsbehelfsbelehrung:\nDas Widerspruchsrecht steht jedem zu, der an der Unterlassung der Löschung ein berechtigtes Interesse hat. Der Widerspruch ist bei dem Amtsgericht Düsseldorf -Registergericht-, Werdener Straße 1, 40227 Düsseldorf schriftlich in deutscher Sprache oder zur Niederschrift der Geschäftsstelle einzulegen. Der Widerspruch kann auch zur Niederschrift der Geschäftsstelle eines jeden Amtsgerichtes abgegeben werden. Die Einlegung ist auch durch Übertragung eines elektronischen Dokuments an die elektronische Poststelle des Gerichts möglich. Das elektronische Dokument muss für die Bearbeitung durch das Gericht geeignet und mit einer qualifizierten elektronischen Signatur der verantwortenden Person versehen sein oder von der verantwortenden Person signiert und auf einem sicheren Übermittlungsweg gemäß § 130a ZPO nach näherer Maßgabe der Verordnung über die technischen Rahmenbedingungen des elektronischen Rechtsverkehrs und über das besondere elektronische Behördenpostfach (BGBl. I, S.3803) eingereicht werden. Weitere Informationen erhalten Sie auf der Internetseite www.justiz.de.\nDer Widerspruch muss spätestens innerhalb der gesetzten Frist nach dem Datum der Bekanntmachung der Löschungsankündigung bei dem Amtsgericht - Registergericht - Düsseldorf eingegangen sein.  Dies gilt auch dann, wenn der Widerspruch zur Niederschrift der Geschäftsstelle eines anderen Amtsgerichtes abgegeben wurde. Die Frist beginnt mit dem Tage der Bekanntmachung der Löschungsankündigung in dem für die Bekanntmachung der Eintragungen in das Handelsregister bestimmten elektronischen Informations- und Kommunikationssystem nach § 10 des Handelsgesetzbuches. Fällt das Ende der Frist auf einen Sonntag, einen allgemeinen Feiertag oder Sonnabend, so endet die Frist mit Ablauf des nächsten Werktages.\nDer Widerspruch muss die Bezeichnung der angefochtenen Löschungsankündigung sowie die Erklärung enthalten, dass Widerspruch gegen diese Löschungsankündigung eingelegt wird. Er ist zu unterzeichnen und soll begründet werden."
    },
    {
      "date": "2025-11-24",
      "id": "138143",
      "original_text": "Löschungsankündigung\nNordrhein-Westfalen Amtsgericht Düsseldorf HRB 93176\nRheinland Fruchtgroßhandel GmbH – Düsseldorf",
      "type": "Löschungsankündigung",
      "state": "Nordrhein-Westfalen",
      "amtsgericht": "Amtsgericht Düsseldorf",
      "registernummer": "HRB 93176",
      "registerart": "HRB",
      "company_name": "Rheinland Fruchtgroßhandel GmbH",
      "company_seat": "Düsseldorf",
      "details": "24.11.2025 (Bekanntmachungsdatum)\n\nNordrhein-Westfalen Amtsgericht Düsseldorf HRB 93176\nLöschungsankündigung\n\nRheinland Fruchtgroßhandel GmbH\nGesellschaft mit beschränkter Haftung\nDüsseldorf\n\nDas Registergericht beabsichtigt die Gesellschaft von Amts wegen nach § 394 Abs. 1 FamFG zu löschen. Die Frist zur Erhebung eines Widerspruchs ist auf 3 Wochen festgesetzt.\n\nRechtsbehelfsbelehrung:\nDas Widerspruchsrecht steht jedem zu, der an der Unterlassung der Löschung ein berechtigtes Interesse hat. Der Widerspruch ist bei dem Amtsgericht Düsseldorf -Registergericht-, Werdener Straße 1, 40227 Düsseldorf schriftlich in deutscher Sprache oder zur Niederschrift der Geschäftsstelle einzulegen. Der Widerspruch kann auch zur Niederschrift der Geschäftsstelle eines jeden Amtsgerichtes abgegeben werden. Die Einlegung ist auch durch Übertragung eines elektronischen Dokuments an die elektronische Poststelle des Gerichts möglich. Das elektronische Dokument muss für die Bearbeitung durch das Gericht geeignet und mit einer qualifizierten elektronischen Signatur der verantwortenden Person versehen sein oder von der verantwortenden Person signiert und auf einem sicheren Übermittlungsweg gemäß § 130a ZPO nach näherer Maßgabe der Verordnung über die technischen Rahmenbedingungen des elektronischen Rechtsverkehrs und über das besondere elektronische Behördenpostfach (BGBl. I, S.3803) eingereicht werden. Weitere Informationen erhalten Sie auf der Internetseite www.justiz.de.\nDer Widerspruch muss spätestens innerhalb der gesetzten Frist nach dem Datum der Bekanntmachung der Löschungsankündigung bei dem Amtsgericht - Registergericht - Düsseldorf eingegangen sein.  Dies gilt auch dann, wenn der Widerspruch zur Niederschrift der Geschäftsstelle eines anderen Amtsgerichtes abgegeben wurde. Die Frist beginnt mit dem Tage der Bekanntmachung der Löschungsankündigung in dem für die Bekanntmachung der Eintragungen in das Handelsregister bestimmten elektronischen Informations- und Kommunikationssystem nach § 10 des Handelsgesetzbuches. Fällt das Ende der Frist auf einen Sonntag, einen allgemeinen Feiertag oder Sonnabend, so endet die Frist mit Ablauf des nächsten Werktages.\nDer Widerspruch muss die Bezeichnung der angefochtenen Löschungsankündigung sowie die Erklärung enthalten, dass Widerspruch gegen diese Löschungsankündigung eingelegt wird. Er ist zu unterzeichnen und soll begründet werden."
    },
    {
      "date": "2025-11-24",
      "id": "138144",
      "original_text": "Löschungsankündigung\nNordrhein-Westfalen Amtsgericht Bochum HRB 19520\nKETO GmbH – Bochum",
      "type": "Löschungsankündigung",
      "state": "Nordrhein-Westfalen",
      "amtsgericht": "Amtsgericht Bochum",
      "registernummer": "HRB 19520",
      "registerart": "HRB",
      "company_name": "KETO GmbH",
      "company_seat": "Bochum",
      "details": "24.11.2025 (Bekanntmachungsdatum)\n\nNordrhein-Westfalen Amtsgericht Bochum HRB 19520\nLöschungsankündigung\n\nKETO GmbH\nGesellschaft mit beschränkter Haftung\nBochum\n\nDas Registergericht beabsichtigt die Gesellschaft von Amts wegen nach § 394 FamFG zu löschen. Die Frist zur Erhebung eines Widerspruchs ist auf drei Monate festgesetzt."
    },
    {
      "date": "2025-11-24",
      "id": "138145",
      "original_text": "Löschungsankündigung\nNordrhein-Westfalen Amtsgericht Münster HRA 6488\nBernhard Beckmann GmbH & Co. Kommanditgesellschaft – Ahlen",
      "type": "Löschungsankündigung",
      "state": "Nordrhein-Westfalen",
      "amtsgericht": "Amtsgericht Münster",
      "registernummer": "HRA 6488",
      "registerart": "HRA",
      "company_name": "Bernhard Beckmann GmbH & Co. Kommanditgesellschaft",
      "company_seat": "Ahlen",
      "details": "24.11.2025 (Bekanntmachungsdatum)\n\nNordrhein-Westfalen Amtsgericht Münster HRA 6488\nLöschungsankündigung 24.10.2025 (Eintragungsdatum)\n\nBernhard Beckmann GmbH & Co. Kommanditgesellschaft\nKommanditgesellschaft\nAhlen\n\nDas Registergericht beabsichtigt die Firma von Amts wegen nach § 394 FamFG zu löschen. Die Frist zur Erhebung eines Widerspruchs ist auf einen Monat festgesetzt."
    },
    {
      "date": "2025-11-24",
      "id": "138146",
      "original_text": "Löschungsankündigung\nNordrhein-Westfalen Amtsgericht Bochum HRB 22363\nNowak GmbH – Bochum",
      "type": "Löschungsankündigung",
      "state": "Nordrhein-Westfalen",
      "amtsgericht": "Amtsgericht Bochum",
      "registernummer": "HRB 22363",
      "registerart": "HRB",
      "company_name": "Nowak GmbH",
      "company_seat": "Bochum",
      "details": "24.11.2025 (Bekanntmachungsdatum)\n\nNordrhein-Westfalen Amtsgericht Bochum HRB 22363\nLöschungsankündigung\n\nNowak GmbH\nGesellschaft mit beschränkter Haftung\nBochum\n\nDas Registergericht beabsichtigt die Gesellschaft von Amts wegen nach § 394 FamFG zu löschen. Die Frist zur Erhebung eines Widerspruchs ist auf drei Monate festgesetzt."
    },
    {
      "date": "2025-11-24",
      "id": "138147",
      "original_text": "Registerbekanntmachung nach dem Umwandlungsgesetz\nNordrhein-Westfalen Amtsgericht Düsseldorf HRB 95303\nHoliday Scouts GmbH – Monheim am Rhein",
      "type": "Registerbekanntmachung nach dem Umwandlungsgesetz",
      "state": "Nordrhein-Westfalen",
      "amtsgericht": "Amtsgericht Düsseldorf",
      "registernummer": "HRB 95303",
      "registerart": "HRB",
      "company_name": "Holiday Scouts GmbH",
      "company_seat": "Monheim am Rhein",
      "details": "24.11.2025 (Bekanntmachungsdatum)\n\nNordrhein-Westfalen Amtsgericht Düsseldorf HRB 95303\nRegisterbekanntmachung nach dem Umwandlungsgesetz 24.11.2025 (Eintragungsdatum)\n\nHoliday Scouts GmbH\nGesellschaft mit beschränkter Haftung\nMonheim am Rhein\n\nDen Gläubigern der an der Verschmelzung beteiligten Rechtsträger ist, wenn sie binnen sechs Monaten nach dem Tag, an dem die Eintragung der Verschmelzung in das Register des Sitzes desjenigen Rechtsträgers, dessen Gläubiger sie sind, nach § 19 Absatz 3 UmwG als bekanntgemacht gilt, ihren Anspruch nach Grund und Höhe schriftlich anmelden, Sicherheit zu leisten, soweit sie nicht Befriedigung verlangen können. Dieses Recht steht den Gläubigern jedoch nur zu, wenn sie glaubhaft machen, dass durch die Verschmelzung die Erfüllung ihrer Forderung gefährdet wird."
    },
    {
      "date": "2025-11-24",
      "id": "138148",
      "original_text": "Löschungsankündigung\nHessen Amtsgericht Frankfurt am Main HRB 132925\nGDA GmbH – Frankfurt am Main",
      "type": "Löschungsankündigung",
      "state": "Hessen",
      "amtsgericht": "Amtsgericht Frankfurt am Main",
      "registernummer": "HRB 132925",
      "registerart": "HRB",
      "company_name": "GDA GmbH",
      "company_seat": "Frankfurt am Main",
      "details": "24.11.2025 (Bekanntmachungsdatum)\n\nHessen Amtsgericht Frankfurt am Main HRB 132925\nLöschungsankündigung\n\nGDA GmbH\nGesellschaft mit beschränkter Haftung\nFrankfurt am Main\n\nDas Registergericht beabsichtigt die im Handelsregister eingetragene Gesellschaft von Amts wegen nach § 394 FamFG zu löschen. Die Frist zur Erhebung eines Widerspruchs gegen die beabsichtigte Löschung wird auf 1 Monat festgesetzt."
    },
    {
      "date": "2025-11-24",
      "id": "138149",
      "original_text": "Einreichung neuer Dokumente\nHessen Amtsgericht Frankfurt am Main HRB 79744\nKfW IPEX-Bank GmbH – Frankfurt am Main",
      "type": "Einreichung neuer Dokumente",
      "state": "Hessen",
      "amtsgericht": "Amtsgericht Frankfurt am Main",
      "registernummer": "HRB 79744",
      "registerart": "HRB",
      "company_name": "KfW IPEX-Bank GmbH",
      "company_seat": "Frankfurt am Main",
      "details": "24.11.2025 (Bekanntmachungsdatum)\n\nHessen Amtsgericht Frankfurt am Main HRB 79744\nEinreichung neuer Dokumente\n\nKfW IPEX-Bank GmbH\nGesellschaft mit beschränkter Haftung\nFrankfurt am Main\n\nDurch eine Änderung in den Personen der Aufsichtsratsmitglieder ist eine Liste der Mitglieder des Aufsichtsrates zum Handelsregister eingereicht worden."
    },
    {
      "date": "2025-11-24",
      "id": "138150",
      "original_text": "Einreichung neuer Dokumente\nHessen Amtsgericht Offenbach am Main HRB 51609\nViridium Rückversicherung AG – Neu-Isenburg",
      "type": "Einreichung neuer Dokumente",
      "state": "Hessen",
      "amtsgericht": "Amtsgericht Offenbach am Main",
      "registernummer": "HRB 51609",
      "registerart": "HRB",
      "company_name": "Viridium Rückversicherung AG",
      "company_seat": "Neu-Isenburg",
      "details": "24.11.2025 (Bekanntmachungsdatum)\n\nHessen Amtsgericht Offenbach am Main HRB 51609\nEinreichung neuer Dokumente\n\nViridium Rückversicherung AG\nAktiengesellschaft\nNeu-Isenburg\n\nDurch eine Änderung in den Personen der Aufsichtsratsmitglieder ist eine Liste der Mitglieder des Aufsichtsrates zum Handelsregister eingereicht worden."
    },
    {
      "date": "2025-11-24",
      "id": "138151",
      "original_text": "Löschungsankündigung\nHessen Amtsgericht Darmstadt HRB 100064\nTATSAN GmbH – Mörfelden-Walldorf",
      "type": "Löschungsankündigung",
      "state": "Hessen",
      "amtsgericht": "Amtsgericht Darmstadt",
      "registernummer": "HRB 100064",
      "registerart": "HRB",
      "company_name": "TATSAN GmbH",
      "company_seat": "Mörfelden-Walldorf",
      "details": "24.11.2025 (Bekanntmachungsdatum)\n\nHessen Amtsgericht Darmstadt HRB 100064\nLöschungsankündigung 24.11.2025 (Eintragungsdatum)\n\nTATSAN GmbH\nGesellschaft mit beschränkter Haftung\nMörfelden-Walldorf\n\nDas Registergericht beabsichtigt die im Handelsregister eingetragene Gesellschaft von Amts wegen nach § 394 FamFG zu löschen. Die Frist zur Erhebung eines Widerspruchs gegen die beabsichtigte Löschung wird auf 3 Monate festgesetzt."
    },
    {
      "date": "2025-11-24",
      "id": "138152",
      "original_text": "Einreichung neuer Dokumente\nHessen Amtsgericht Frankfurt am Main HRB 108462\nDCCP Deutsche Credit Capital AG – Frankfurt am Main",
      "type": "Einreichung neuer Dokumente",
      "state": "Hessen",
      "amtsgericht": "Amtsgericht Frankfurt am Main",
      "registernummer": "HRB 108462",
      "registerart": "HRB",
      "company_name": "DCCP Deutsche Credit Capital AG",
      "company_seat": "Frankfurt am Main",
      "details": "24.11.2025 (Bekanntmachungsdatum)\n\nHessen Amtsgericht Frankfurt am Main HRB 108462\nEinreichung neuer Dokumente 24.11.2025 (Eintragungsdatum)\n\nDCCP Deutsche Credit Capital AG\nAktiengesellschaft\nFrankfurt am Main\n\nDurch eine Änderung in den Personen der Aufsichtsratsmitglieder ist eine Liste der Mitglieder des Aufsichtsrates zum Handelsregister eingereicht worden."
    },
    {
      "date": "2025-11-24",
      "id": "138153",
      "original_text": "Registerbekanntmachung nach dem Umwandlungsgesetz\nHessen Amtsgericht Darmstadt GsR 152\nJan Germann u. Sascha Riedle eGbR – Groß-Rohrheim",
      "type": "Registerbekanntmachung nach dem Umwandlungsgesetz",
      "state": "Hessen",
      "amtsgericht": "Amtsgericht Darmstadt",
      "registernummer": "GsR 152",
      "registerart": "GsR",
      "company_name": "Jan Germann u. Sascha Riedle eGbR",
      "company_seat": "Groß-Rohrheim",
      "details": "24.11.2025 (Bekanntmachungsdatum)\n\nHessen Amtsgericht Darmstadt GsR 152\nRegisterbekanntmachung nach dem Umwandlungsgesetz 24.11.2025 (Eintragungsdatum)\n\nJan Germann u. Sascha Riedle eGbR\nGesellschaft bürgerlichen Rechts\nGroß-Rohrheim\n\nDen Gläubigern der an der formwechselnden Umwandlung beteiligten Rechtsträger ist, wenn sie binnen sechs Monaten nach dem Tag, an dem die Eintragung der formwechselnden Umwandlung in das Register des Sitzes desjenigen Rechtsträgers, dessen Gläubiger sie sind, nach § 201 UmwG bekannt gemacht worden ist, ihren Anspruch nach Grund und Höhe schriftlich anmelden, Sicherheit zu leisten, soweit sie nicht Befriedigung verlangen können. Dieses Recht steht den Gläubigern jedoch nur zu, wenn sie glaubhaft machen, dass durch die formwechselnden Umwandlung die Erfüllung ihrer Forderung gefährdet wird."
    },
    {
      "date": "2025-11-24",
      "id": "138154",
      "original_text": "Registerbekanntmachung nach dem Umwandlungsgesetz\nHessen Amtsgericht Darmstadt HRB 108585\nRieger Solarkonzepte GmbH – Biebesheim",
      "type": "Registerbekanntmachung nach dem Umwandlungsgesetz",
      "state": "Hessen",
      "amtsgericht": "Amtsgericht Darmstadt",
      "registernummer": "HRB 108585",
      "registerart": "HRB",
      "company_name": "Rieger Solarkonzepte GmbH",
      "company_seat": "Biebesheim",
      "details": "24.11.2025 (Bekanntmachungsdatum)\n\nHessen Amtsgericht Darmstadt HRB 108585\nRegisterbekanntmachung nach dem Umwandlungsgesetz 24.11.2025 (Eintragungsdatum)\n\nRieger Solarkonzepte GmbH\nGesellschaft mit beschränkter Haftung\nBiebesheim\n\nDen Gläubigern der an der formwechselnden Umwandlung beteiligten Rechtsträger ist, wenn sie binnen sechs Monaten nach dem Tag, an dem die Eintragung der formwechselnden Umwandlung in das Register des Sitzes desjenigen Rechtsträgers, dessen Gläubiger sie sind, nach § 201 UmwG bekannt gemacht worden ist, ihren Anspruch nach Grund und Höhe schriftlich anmelden, Sicherheit zu leisten, soweit sie nicht Befriedigung verlangen können. Dieses Recht steht den Gläubigern jedoch nur zu, wenn sie glaubhaft machen, dass durch die formwechselnden Umwandlung die Erfüllung ihrer Forderung gefährdet wird."
    },
    {
      "date": "2025-11-24",
      "id": "138155",
      "original_text": "Registerbekanntmachung nach dem Umwandlungsgesetz\nHessen Amtsgericht Frankfurt am Main HRB 138140\nUNA 629. Equity Management GmbH – Frankfurt am Main",
      "type": "Registerbekanntmachung nach dem Umwandlungsgesetz",
      "state": "Hessen",
      "amtsgericht": "Amtsgericht Frankfurt am Main",
      "registernummer": "HRB 138140",
      "registerart": "HRB",
      "company_name": "UNA 629. Equity Management GmbH",
      "company_seat": "Frankfurt am Main",
      "details": "24.11.2025 (Bekanntmachungsdatum)\n\nHessen Amtsgericht Frankfurt am Main HRB 138140\nRegisterbekanntmachung nach dem Umwandlungsgesetz 24.11.2025 (Eintragungsdatum)\n\nUNA 629. Equity Management GmbH\nGesellschaft mit beschränkter Haftung\nFrankfurt am Main\n\nDen Gläubigern der an der Verschmelzung beteiligten Rechtsträger ist, wenn sie binnen sechs Monaten nach dem Tag, an dem die Eintragung der Verschmelzung in das Register des Sitzes desjenigen Rechtsträgers, dessen Gläubiger sie sind, nach § 19 Absatz 3 UmwG bekannt gemacht worden ist, ihren Anspruch nach Grund und Höhe schriftlich anmelden, Sicherheit zu leisten, soweit sie nicht Befriedigung verlangen können. Dieses Recht steht den Gläubigern jedoch nur zu, wenn sie glaubhaft machen, dass durch die Verschmelzung die Erfüllung ihrer Forderung gefährdet wird."
    },
    {
      "date": "2025-11-24",
      "id": "138156",
      "original_text": "Registerbekanntmachung nach dem Umwandlungsgesetz\nHessen Amtsgericht Königstein HRA 4310\nFlorian Böhm e. K. – Kelkheim (Taunus)",
      "type": "Registerbekanntmachung nach dem Umwandlungsgesetz",
      "state": "Hessen",
      "amtsgericht": "Amtsgericht Königstein",
      "registernummer": "HRA 4310",
      "registerart": "HRA",
      "company_name": "Florian Böhm e. K.",
      "company_seat": "Kelkheim (Taunus)",
      "details": "24.11.2025 (Bekanntmachungsdatum)\n\nHessen Amtsgericht Königstein HRA 4310\nRegisterbekanntmachung nach dem Umwandlungsgesetz 24.11.2025 (Eintragungsdatum)\n\nFlorian Böhm e. K.\nEinzelkaufmann / Einzelkauffrau\nKelkheim (Taunus)\n\nDen Gläubigern der an der Ausgliederung beteiligten Rechtsträger ist, wenn sie binnen sechs Monaten nach dem Tag, an dem die Eintragung der Ausgliederung in das Register des Sitzes desjenigen Rechtsträgers, dessen Gläubiger sie sind, nach §§ 125, 19 Absatz 3 UmwG bekannt gemacht worden ist, ihren Anspruch nach Grund und Höhe schriftlich anmelden, Sicherheit zu leisten, soweit sie nicht Befriedigung verlangen können. Dieses Recht steht den Gläubigern jedoch nur zu, wenn sie glaubhaft machen, dass durch die Ausgliederung die Erfüllung ihrer Forderung gefährdet wird."
    },
    {
      "date": "2025-11-24",
      "id": "138157",
      "original_text": "Einreichung neuer Dokumente\nHessen Amtsgericht Frankfurt am Main HRB 75042\nivm GmbH (Integriertes Verkehrs- und Mobilitätsmanagement Region Frankfurt Rhein-Main) – Frankfurt am Main",
      "type": "Einreichung neuer Dokumente",
      "state": "Hessen",
      "amtsgericht": "Amtsgericht Frankfurt am Main",
      "registernummer": "HRB 75042",
      "registerart": "HRB",
      "company_name": "ivm GmbH (Integriertes Verkehrs- und Mobilitätsmanagement Region Frankfurt Rhein-Main)",
      "company_seat": "Frankfurt am Main",
      "details": "24.11.2025 (Bekanntmachungsdatum)\n\nHessen Amtsgericht Frankfurt am Main HRB 75042\nEinreichung neuer Dokumente\n\nivm GmbH (Integriertes Verkehrs- und Mobilitätsmanagement Region Frankfurt Rhein-Main)\nGesellschaft mit beschränkter Haftung\nFrankfurt am Main\n\nDurch eine Änderung in den Personen der Aufsichtsratsmitglieder ist eine Liste der Mitglieder des Aufsichtsrates zum Handelsregister eingereicht worden."
    },
    {
      "date": "2025-11-24",
      "id": "138158",
      "original_text": "Sonstige Registerbekanntmachung\nHessen Amtsgericht Frankfurt am Main HRB 138376\nPerle 50. AG – Frankfurt am Main",
      "type": "Sonstige Registerbekanntmachung",
      "state": "Hessen",
      "amtsgericht": "Amtsgericht Frankfurt am Main",
      "registernummer": "HRB 138376",
      "registerart": "HRB",
      "company_name": "Perle 50. AG",
      "company_seat": "Frankfurt am Main",
      "details": "24.11.2025 (Bekanntmachungsdatum)\n\nHessen Amtsgericht Frankfurt am Main HRB 138376\nSonstige Registerbekanntmachung 24.11.2025 (Eintragungsdatum)\n\nPerle 50. AG\nAktiengesellschaft\nFrankfurt am Main\n\nDurch eine Änderung in den Personen der Aufsichtsratsmitglieder ist eine Liste der Mitglieder des Aufsichtsrates zum Handelsregister eingereicht worden."
    }
  ]
}