{
  "date": "2025-11-25",
  "date_of_scrape": "2025-11-26T04:12:19.255Z",
  "tool_version": "0.2.0",
  "number_of_announcements": 137,
  "announcements": [
    {
      "date": "2025-11-25",
      "id": "138159",
      "original_text": "Löschungsankündigung\nBayern Amtsgericht Landshut HRB 9619\nPolzmacher Tobacco Group / PTG UG (haftungsbeschränkt) – Schalkham",
      "type": "Löschungsankündigung",
      "state": "Bayern",
      "amtsgericht": "Amtsgericht Landshut",
      "registernummer": "HRB 9619",
      "registerart": "HRB",
      "company_name": "Polzmacher Tobacco Group / PTG UG (haftungsbeschränkt)",
      "company_seat": "Schalkham",
      "details": "25.11.2025 (Bekanntmachungsdatum)\n\nBayern Amtsgericht Landshut HRB 9619\nLöschungsankündigung\n\nPolzmacher Tobacco Group / PTG UG (haftungsbeschränkt)\nGesellschaft mit beschränkter Haftung\nSchalkham\n\nDas Registergericht beabsichtigt, die im Handelsregister eingetragene Gesellschaft wegen Vermögenslosigkeit von Amts wegen nach § 394 FamFG zu löschen. Die Frist zur Erhebung eines Widerspruchs ist auf einen Monat festgesetzt."
    },
    {
      "date": "2025-11-25",
      "id": "138160",
      "original_text": "Löschungsankündigung\nBayern Amtsgericht Landshut HRB 9470\nKonstruTec GmbH – Altdorf",
      "type": "Löschungsankündigung",
      "state": "Bayern",
      "amtsgericht": "Amtsgericht Landshut",
      "registernummer": "HRB 9470",
      "registerart": "HRB",
      "company_name": "KonstruTec GmbH",
      "company_seat": "Altdorf",
      "details": "25.11.2025 (Bekanntmachungsdatum)\n\nBayern Amtsgericht Landshut HRB 9470\nLöschungsankündigung\n\nKonstruTec GmbH\nGesellschaft mit beschränkter Haftung\nAltdorf\n\nDas Registergericht beabsichtigt, die im Handelsregister eingetragene Gesellschaft wegen Vermögenslosigkeit von Amts wegen nach § 394 FamFG zu löschen. Die Frist zur Erhebung eines Widerspruchs ist auf einen Monat festgesetzt."
    },
    {
      "date": "2025-11-25",
      "id": "138161",
      "original_text": "Löschungsankündigung\nBayern Amtsgericht Bayreuth VR 200388\nAKONS e.V. – Bayreuth",
      "type": "Löschungsankündigung",
      "state": "Bayern",
      "amtsgericht": "Amtsgericht Bayreuth",
      "registernummer": "VR 200388",
      "registerart": "VR",
      "company_name": "AKONS e.V.",
      "company_seat": "Bayreuth",
      "details": "25.11.2025 (Bekanntmachungsdatum)\n\nBayern Amtsgericht Bayreuth VR 200388\nLöschungsankündigung\n\nAKONS e.V.\neingetragener Verein\nBayreuth\n\nDas Registergericht beabsichtigt, den im Vereinsregister eingetragenen Verein von Amts wegen nach § 395 FamFG wegen Wegfalls aller Mitglieder zu löschen. Die Frist zur Erhebung eines Widerspruchs ist auf einen Monat festgesetzt."
    },
    {
      "date": "2025-11-25",
      "id": "138162",
      "original_text": "Löschungsankündigung\nBayern Amtsgericht Landshut HRB 9260\nDRA-Renovierungs+Hausmeister GmbH – Tann",
      "type": "Löschungsankündigung",
      "state": "Bayern",
      "amtsgericht": "Amtsgericht Landshut",
      "registernummer": "HRB 9260",
      "registerart": "HRB",
      "company_name": "DRA-Renovierungs+Hausmeister GmbH",
      "company_seat": "Tann",
      "details": "25.11.2025 (Bekanntmachungsdatum)\n\nBayern Amtsgericht Landshut HRB 9260\nLöschungsankündigung\n\nDRA-Renovierungs+Hausmeister GmbH\nGesellschaft mit beschränkter Haftung\nTann\n\nDas Registergericht beabsichtigt, die im Handelsregister eingetragene Gesellschaft wegen Vermögenslosigkeit von Amts wegen nach § 394 FamFG zu löschen. Die Frist zur Erhebung eines Widerspruchs ist auf einen Monat festgesetzt."
    },
    {
      "date": "2025-11-25",
      "id": "138163",
      "original_text": "Registerbekanntmachung nach dem Umwandlungsgesetz\nBayern Amtsgericht Nürnberg HRA 20345\nSECO e.K. – Schwabach",
      "type": "Registerbekanntmachung nach dem Umwandlungsgesetz",
      "state": "Bayern",
      "amtsgericht": "Amtsgericht Nürnberg",
      "registernummer": "HRA 20345",
      "registerart": "HRA",
      "company_name": "SECO e.K.",
      "company_seat": "Schwabach",
      "details": "25.11.2025 (Bekanntmachungsdatum)\n\nBayern Amtsgericht Nürnberg HRA 20345\nRegisterbekanntmachung nach dem Umwandlungsgesetz 22.11.2025 (Eintragungsdatum)\n\nSECO e.K.\nEinzelkaufmann / Einzelkauffrau\nSchwabach\n\nDen Gläubigern des formwechselnden Rechtsträgers ist, wenn sie binnen sechs Monaten nach dem Tag, an dem die Eintragung des Formwechsels nach § 201 UmwG als bekannt gemacht gilt, ihren Anspruch nach Grund und Höhe in Textform anmelden, Sicherheit zu leisten, soweit sie nicht Befriedigung verlangen können. Dieses Recht steht den Gläubigern jedoch nur zu, wenn sie glaubhaft machen, dass durch den Formwechsel die Erfüllung ihrer Forderung gefährdet wird."
    },
    {
      "date": "2025-11-25",
      "id": "138164",
      "original_text": "Registerbekanntmachung nach dem Umwandlungsgesetz\nBayern Amtsgericht Nürnberg HRB 45269\nSECO Bauconcept GmbH – Nürnberg",
      "type": "Registerbekanntmachung nach dem Umwandlungsgesetz",
      "state": "Bayern",
      "amtsgericht": "Amtsgericht Nürnberg",
      "registernummer": "HRB 45269",
      "registerart": "HRB",
      "company_name": "SECO Bauconcept GmbH",
      "company_seat": "Nürnberg",
      "details": "25.11.2025 (Bekanntmachungsdatum)\n\nBayern Amtsgericht Nürnberg HRB 45269\nRegisterbekanntmachung nach dem Umwandlungsgesetz 22.11.2025 (Eintragungsdatum)\n\nSECO Bauconcept GmbH\nGesellschaft mit beschränkter Haftung\nNürnberg\n\nDen Gläubigern des formwechselnden Rechtsträgers ist, wenn sie binnen sechs Monaten nach dem Tag, an dem die Eintragung des Formwechsels nach § 201 UmwG als bekannt gemacht gilt, ihren Anspruch nach Grund und Höhe in Textform anmelden, Sicherheit zu leisten, soweit sie nicht Befriedigung verlangen können. Dieses Recht steht den Gläubigern jedoch nur zu, wenn sie glaubhaft machen, dass durch den Formwechsel die Erfüllung ihrer Forderung gefährdet wird."
    },
    {
      "date": "2025-11-25",
      "id": "138165",
      "original_text": "Löschungsankündigung\nBayern Amtsgericht Kempten (Allgäu) HRB 14034\nWKU UG (haftungsbeschränkt) – Germaringen",
      "type": "Löschungsankündigung",
      "state": "Bayern",
      "amtsgericht": "Amtsgericht Kempten (Allgäu)",
      "registernummer": "HRB 14034",
      "registerart": "HRB",
      "company_name": "WKU UG (haftungsbeschränkt)",
      "company_seat": "Germaringen",
      "details": "25.11.2025 (Bekanntmachungsdatum)\n\nBayern Amtsgericht Kempten (Allgäu) HRB 14034\nLöschungsankündigung\n\nWKU UG (haftungsbeschränkt)\nGesellschaft mit beschränkter Haftung\nGermaringen\n\nDas Registergericht beabsichtigt, die im Handelsregister eingetragene Gesellschaft wegen Vermögenslosigkeit von Amts wegen nach § 394 FamFG zu löschen. Die Frist zur Erhebung eines Widerspruchs ist auf einen Monat festgesetzt."
    },
    {
      "date": "2025-11-25",
      "id": "138166",
      "original_text": "Einreichung neuer Dokumente\nBayern Amtsgericht München HRB 258262\nLR Health & Beauty SE – München",
      "type": "Einreichung neuer Dokumente",
      "state": "Bayern",
      "amtsgericht": "Amtsgericht München",
      "registernummer": "HRB 258262",
      "registerart": "HRB",
      "company_name": "LR Health & Beauty SE",
      "company_seat": "München",
      "details": "25.11.2025 (Bekanntmachungsdatum)\n\nBayern Amtsgericht München HRB 258262\nEinreichung neuer Dokumente\n\nLR Health & Beauty SE\nEuropäische Aktiengesellschaft (SE)\nMünchen\n\nDem Amtsgericht München -Registergericht- ist eine Liste der Mitglieder des Aufsichtsrats eingereicht worden, Art. 9 Abs. 1 Buchst. c (ii) SE-VO i.V.m. § 106 AktG."
    },
    {
      "date": "2025-11-25",
      "id": "138167",
      "original_text": "Registerbekanntmachung nach dem Umwandlungsgesetz\nBayern Amtsgericht München HRB 280708\nThe SMART Mobility Transformation Group GmbH – München",
      "type": "Registerbekanntmachung nach dem Umwandlungsgesetz",
      "state": "Bayern",
      "amtsgericht": "Amtsgericht München",
      "registernummer": "HRB 280708",
      "registerart": "HRB",
      "company_name": "The SMART Mobility Transformation Group GmbH",
      "company_seat": "München",
      "details": "25.11.2025 (Bekanntmachungsdatum)\n\nBayern Amtsgericht München HRB 280708\nRegisterbekanntmachung nach dem Umwandlungsgesetz 24.11.2025 (Eintragungsdatum)\n\nThe SMART Mobility Transformation Group GmbH\nGesellschaft mit beschränkter Haftung\nMünchen\n\nDen Gläubigern der an der Ausgliederung beteiligten Rechtsträger ist, wenn sie binnen sechs Monaten nach dem Tag, an dem die Eintragung der Ausgliederung in das Register des Sitzes desjenigen Rechtsträgers, dessen Gläubiger sie sind, nach §§ 125, 19 Abs. 3 UmwG als bekannt gemacht gilt, ihren Anspruch nach Grund und Höhe in Textform anmelden, Sicherheit zu leisten, soweit sie nicht Befriedigung verlangen können. Dieses Recht steht den Gläubigern jedoch nur zu, wenn sie glaubhaft machen, dass durch die Ausgliederung die Erfüllung ihrer Forderung gefährdet wird."
    },
    {
      "date": "2025-11-25",
      "id": "138168",
      "original_text": "Registerbekanntmachung nach dem Umwandlungsgesetz\nBayern Amtsgericht München HRB 238229\nTHOHR II MPP Verwaltungs GmbH – München",
      "type": "Registerbekanntmachung nach dem Umwandlungsgesetz",
      "state": "Bayern",
      "amtsgericht": "Amtsgericht München",
      "registernummer": "HRB 238229",
      "registerart": "HRB",
      "company_name": "THOHR II MPP Verwaltungs GmbH",
      "company_seat": "München",
      "details": "25.11.2025 (Bekanntmachungsdatum)\n\nBayern Amtsgericht München HRB 238229\nRegisterbekanntmachung nach dem Umwandlungsgesetz 24.11.2025 (Eintragungsdatum)\n\nTHOHR II MPP Verwaltungs GmbH\nGesellschaft mit beschränkter Haftung\nMünchen\n\nDen Gläubigern der an der Verschmelzung beteiligten Rechtsträger ist, wenn sie binnen sechs Monaten nach dem Tag, an dem die Eintragung der Verschmelzung in das Register des Sitzes desjenigen Rechtsträgers, dessen Gläubiger sie sind, nach § 19 Abs. 3 UmwG als bekannt gemacht gilt, ihren Anspruch nach Grund und Höhe in Textform anmelden, Sicherheit zu leisten, soweit sie nicht Befriedigung verlangen können. Dieses Recht steht den Gläubigern jedoch nur zu, wenn sie glaubhaft machen, dass durch die Verschmelzung die Erfüllung ihrer Forderung gefährdet wird."
    },
    {
      "date": "2025-11-25",
      "id": "138169",
      "original_text": "Registerbekanntmachung nach dem Umwandlungsgesetz\nBayern Amtsgericht Bamberg HRA 10488\nLorenz Schneider e.K. – Poxdorf",
      "type": "Registerbekanntmachung nach dem Umwandlungsgesetz",
      "state": "Bayern",
      "amtsgericht": "Amtsgericht Bamberg",
      "registernummer": "HRA 10488",
      "registerart": "HRA",
      "company_name": "Lorenz Schneider e.K.",
      "company_seat": "Poxdorf",
      "details": "25.11.2025 (Bekanntmachungsdatum)\n\nBayern Amtsgericht Bamberg HRA 10488\nRegisterbekanntmachung nach dem Umwandlungsgesetz 24.11.2025 (Eintragungsdatum)\n\nLorenz Schneider e.K.\nEinzelkaufmann / Einzelkauffrau\nPoxdorf\n\nDen Gläubigern der an der Ausgliederung beteiligten Rechtsträger ist, wenn sie binnen sechs Monaten nach dem Tag, an dem die Eintragung der Ausgliederung in das Register des Sitzes desjenigen Rechtsträgers, dessen Gläubiger sie sind, nach §§ 125, 19 Abs. 3 UmwG als bekannt gemacht gilt, ihren Anspruch nach Grund und Höhe in Textform anmelden, Sicherheit zu leisten, soweit sie nicht Befriedigung verlangen können. Dieses Recht steht den Gläubigern jedoch nur zu, wenn sie glaubhaft machen, dass durch die Ausgliederung die Erfüllung ihrer Forderung gefährdet wird."
    },
    {
      "date": "2025-11-25",
      "id": "138170",
      "original_text": "Registerbekanntmachung nach dem Umwandlungsgesetz\nBayern Amtsgericht München HRB 305478\nDeubner Holding GmbH – München",
      "type": "Registerbekanntmachung nach dem Umwandlungsgesetz",
      "state": "Bayern",
      "amtsgericht": "Amtsgericht München",
      "registernummer": "HRB 305478",
      "registerart": "HRB",
      "company_name": "Deubner Holding GmbH",
      "company_seat": "München",
      "details": "25.11.2025 (Bekanntmachungsdatum)\n\nBayern Amtsgericht München HRB 305478\nRegisterbekanntmachung nach dem Umwandlungsgesetz 24.11.2025 (Eintragungsdatum)\n\nDeubner Holding GmbH\nGesellschaft mit beschränkter Haftung\nMünchen\n\nDen Gläubigern der an der Spaltung beteiligten Rechtsträger ist, wenn sie binnen sechs Monaten nach dem Tag, an dem die Eintragung der Spaltung in das Register des Sitzes desjenigen Rechtsträgers, dessen Gläubiger sie sind, nach §§ 125, 19 Abs. 3 UmwG als bekannt gemacht gilt, ihren Anspruch nach Grund und Höhe in Textform anmelden, Sicherheit zu leisten, soweit sie nicht Befriedigung verlangen können. Dieses Recht steht den Gläubigern jedoch nur zu, wenn sie glaubhaft machen, dass durch die Spaltung die Erfüllung ihrer Forderung gefährdet wird."
    },
    {
      "date": "2025-11-25",
      "id": "138171",
      "original_text": "Löschungsankündigung\nBayern Amtsgericht München HRB 127974\nKCI Consulting GmbH – München",
      "type": "Löschungsankündigung",
      "state": "Bayern",
      "amtsgericht": "Amtsgericht München",
      "registernummer": "HRB 127974",
      "registerart": "HRB",
      "company_name": "KCI Consulting GmbH",
      "company_seat": "München",
      "details": "25.11.2025 (Bekanntmachungsdatum)\n\nBayern Amtsgericht München HRB 127974\nLöschungsankündigung\n\nKCI Consulting GmbH\nGesellschaft mit beschränkter Haftung\nMünchen\n\nDas Registergericht beabsichtigt, die im Handelsregister eingetragene Gesellschaft wegen Vermögenslosigkeit von Amts wegen nach § 394 FamFG zu löschen. Die Frist zur Erhebung eines Widerspruchs ist auf drei Monate festgesetzt."
    },
    {
      "date": "2025-11-25",
      "id": "138172",
      "original_text": "Löschungsankündigung\nBayern Amtsgericht Landshut HRB 10159\nIF * Inventions Finest GmbH – Simbach am Inn",
      "type": "Löschungsankündigung",
      "state": "Bayern",
      "amtsgericht": "Amtsgericht Landshut",
      "registernummer": "HRB 10159",
      "registerart": "HRB",
      "company_name": "IF * Inventions Finest GmbH",
      "company_seat": "Simbach am Inn",
      "details": "25.11.2025 (Bekanntmachungsdatum)\n\nBayern Amtsgericht Landshut HRB 10159\nLöschungsankündigung\n\nIF * Inventions Finest GmbH\nGesellschaft mit beschränkter Haftung\nSimbach am Inn\n\nDas Registergericht beabsichtigt, die im Handelsregister eingetragene Gesellschaft wegen Vermögenslosigkeit von Amts wegen nach § 394 FamFG zu löschen. Die Frist zur Erhebung eines Widerspruchs ist auf einen Monat festgesetzt."
    },
    {
      "date": "2025-11-25",
      "id": "138173",
      "original_text": "Löschungsankündigung\nBayern Amtsgericht Augsburg HRB 33429\nSMT24 UG (haftungsbeschränkt) – Augsburg",
      "type": "Löschungsankündigung",
      "state": "Bayern",
      "amtsgericht": "Amtsgericht Augsburg",
      "registernummer": "HRB 33429",
      "registerart": "HRB",
      "company_name": "SMT24 UG (haftungsbeschränkt)",
      "company_seat": "Augsburg",
      "details": "25.11.2025 (Bekanntmachungsdatum)\n\nBayern Amtsgericht Augsburg HRB 33429\nLöschungsankündigung\n\nSMT24 UG (haftungsbeschränkt)\nGesellschaft mit beschränkter Haftung\nAugsburg\n\nDas Registergericht beabsichtigt, die im Handelsregister eingetragene Gesellschaft wegen Vermögenslosigkeit von Amts wegen nach § 394 FamFG zu löschen. Die Frist zur Erhebung eines Widerspruchs ist auf einen Monat festgesetzt."
    },
    {
      "date": "2025-11-25",
      "id": "138174",
      "original_text": "Registerbekanntmachung nach dem Umwandlungsgesetz\nBayern Amtsgericht München HRB 163575\nHackett Deutschland GmbH – München",
      "type": "Registerbekanntmachung nach dem Umwandlungsgesetz",
      "state": "Bayern",
      "amtsgericht": "Amtsgericht München",
      "registernummer": "HRB 163575",
      "registerart": "HRB",
      "company_name": "Hackett Deutschland GmbH",
      "company_seat": "München",
      "details": "25.11.2025 (Bekanntmachungsdatum)\n\nBayern Amtsgericht München HRB 163575\nRegisterbekanntmachung nach dem Umwandlungsgesetz 24.11.2025 (Eintragungsdatum)\n\nHackett Deutschland GmbH\nGesellschaft mit beschränkter Haftung\nMünchen\n\nDen Gläubigern der an der Verschmelzung beteiligten Rechtsträger ist, wenn sie binnen sechs Monaten nach dem Tag, an dem die Eintragung der Verschmelzung in das Register des Sitzes desjenigen Rechtsträgers, dessen Gläubiger sie sind, nach § 19 Abs. 3 UmwG als bekannt gemacht gilt, ihren Anspruch nach Grund und Höhe in Textform anmelden, Sicherheit zu leisten, soweit sie nicht Befriedigung verlangen können. Dieses Recht steht den Gläubigern jedoch nur zu, wenn sie glaubhaft machen, dass durch die Verschmelzung die Erfüllung ihrer Forderung gefährdet wird."
    },
    {
      "date": "2025-11-25",
      "id": "138175",
      "original_text": "Registerbekanntmachung nach dem Umwandlungsgesetz\nBayern Amtsgericht München HRB 218634\nDataStax Germany GmbH – München",
      "type": "Registerbekanntmachung nach dem Umwandlungsgesetz",
      "state": "Bayern",
      "amtsgericht": "Amtsgericht München",
      "registernummer": "HRB 218634",
      "registerart": "HRB",
      "company_name": "DataStax Germany GmbH",
      "company_seat": "München",
      "details": "25.11.2025 (Bekanntmachungsdatum)\n\nBayern Amtsgericht München HRB 218634\nRegisterbekanntmachung nach dem Umwandlungsgesetz 24.11.2025 (Eintragungsdatum)\n\nDataStax Germany GmbH\nGesellschaft mit beschränkter Haftung\nMünchen\n\nDen Gläubigern der an der Verschmelzung beteiligten Rechtsträger ist, wenn sie binnen sechs Monaten nach dem Tag, an dem die Eintragung der Verschmelzung in das Register des Sitzes desjenigen Rechtsträgers, dessen Gläubiger sie sind, nach § 19 Abs. 3 UmwG als bekannt gemacht gilt, ihren Anspruch nach Grund und Höhe in Textform anmelden, Sicherheit zu leisten, soweit sie nicht Befriedigung verlangen können. Dieses Recht steht den Gläubigern jedoch nur zu, wenn sie glaubhaft machen, dass durch die Verschmelzung die Erfüllung ihrer Forderung gefährdet wird."
    },
    {
      "date": "2025-11-25",
      "id": "138176",
      "original_text": "Löschungsankündigung\nBayern Amtsgericht München HRB 257894\nSANG Immobilien GmbH – München",
      "type": "Löschungsankündigung",
      "state": "Bayern",
      "amtsgericht": "Amtsgericht München",
      "registernummer": "HRB 257894",
      "registerart": "HRB",
      "company_name": "SANG Immobilien GmbH",
      "company_seat": "München",
      "details": "25.11.2025 (Bekanntmachungsdatum)\n\nBayern Amtsgericht München HRB 257894\nLöschungsankündigung\n\nSANG Immobilien GmbH\nGesellschaft mit beschränkter Haftung\nMünchen\n\nDas Registergericht beabsichtigt, die im Handelsregister eingetragene Gesellschaft wegen Vermögenslosigkeit von Amts wegen nach § 394 FamFG zu löschen. Die Frist zur Erhebung eines Widerspruchs ist auf drei Monate festgesetzt."
    },
    {
      "date": "2025-11-25",
      "id": "138177",
      "original_text": "Registerbekanntmachung nach dem Umwandlungsgesetz\nBayern Amtsgericht München HRB 179586\nlifecon GmbH – München",
      "type": "Registerbekanntmachung nach dem Umwandlungsgesetz",
      "state": "Bayern",
      "amtsgericht": "Amtsgericht München",
      "registernummer": "HRB 179586",
      "registerart": "HRB",
      "company_name": "lifecon GmbH",
      "company_seat": "München",
      "details": "25.11.2025 (Bekanntmachungsdatum)\n\nBayern Amtsgericht München HRB 179586\nRegisterbekanntmachung nach dem Umwandlungsgesetz 24.11.2025 (Eintragungsdatum)\n\nlifecon GmbH\nGesellschaft mit beschränkter Haftung\nMünchen\n\nDen Gläubigern der an der Verschmelzung beteiligten Rechtsträger ist, wenn sie binnen sechs Monaten nach dem Tag, an dem die Eintragung der Verschmelzung in das Register des Sitzes desjenigen Rechtsträgers, dessen Gläubiger sie sind, nach § 19 Abs. 3 UmwG als bekannt gemacht gilt, ihren Anspruch nach Grund und Höhe in Textform anmelden, Sicherheit zu leisten, soweit sie nicht Befriedigung verlangen können. Dieses Recht steht den Gläubigern jedoch nur zu, wenn sie glaubhaft machen, dass durch die Verschmelzung die Erfüllung ihrer Forderung gefährdet wird."
    },
    {
      "date": "2025-11-25",
      "id": "138178",
      "original_text": "Registerbekanntmachung nach dem Umwandlungsgesetz\nBayern Amtsgericht Augsburg HRB 38322\nMilana Marks Holding UG (haftungsbeschränkt) – Augsburg",
      "type": "Registerbekanntmachung nach dem Umwandlungsgesetz",
      "state": "Bayern",
      "amtsgericht": "Amtsgericht Augsburg",
      "registernummer": "HRB 38322",
      "registerart": "HRB",
      "company_name": "Milana Marks Holding UG (haftungsbeschränkt)",
      "company_seat": "Augsburg",
      "details": "25.11.2025 (Bekanntmachungsdatum)\n\nBayern Amtsgericht Augsburg HRB 38322\nRegisterbekanntmachung nach dem Umwandlungsgesetz 22.11.2025 (Eintragungsdatum)\n\nMilana Marks Holding UG (haftungsbeschränkt)\nGesellschaft mit beschränkter Haftung\nAugsburg\n\nDen Gläubigern der an der Verschmelzung beteiligten Rechtsträger ist, wenn sie binnen sechs Monaten nach dem Tag, an dem die Eintragung der Verschmelzung in das Register des Sitzes desjenigen Rechtsträgers, dessen Gläubiger sie sind, nach § 19 Abs. 3 UmwG als bekannt gemacht gilt, ihren Anspruch nach Grund und Höhe in Textform anmelden, Sicherheit zu leisten, soweit sie nicht Befriedigung verlangen können. Dieses Recht steht den Gläubigern jedoch nur zu, wenn sie glaubhaft machen, dass durch die Verschmelzung die Erfüllung ihrer Forderung gefährdet wird."
    },
    {
      "date": "2025-11-25",
      "id": "138179",
      "original_text": "Einreichung neuer Dokumente\nBayern Amtsgericht Augsburg HRB 16508\nAIRBUS HELICOPTERS DEUTSCHLAND GmbH – Donauwörth",
      "type": "Einreichung neuer Dokumente",
      "state": "Bayern",
      "amtsgericht": "Amtsgericht Augsburg",
      "registernummer": "HRB 16508",
      "registerart": "HRB",
      "company_name": "AIRBUS HELICOPTERS DEUTSCHLAND GmbH",
      "company_seat": "Donauwörth",
      "details": "25.11.2025 (Bekanntmachungsdatum)\n\nBayern Amtsgericht Augsburg HRB 16508\nEinreichung neuer Dokumente\n\nAIRBUS HELICOPTERS DEUTSCHLAND GmbH\nGesellschaft mit beschränkter Haftung\nDonauwörth\n\nDem Amtsgericht Augsburg -Registergericht- ist eine Liste der Mitglieder des Aufsichtsrats eingereicht worden, § 52 Abs. 3 S. 2 GmbHG."
    },
    {
      "date": "2025-11-25",
      "id": "138180",
      "original_text": "Registerbekanntmachung nach dem Umwandlungsgesetz\nBayern Amtsgericht Augsburg HRB 38359\nheyfam GmbH – Augsburg",
      "type": "Registerbekanntmachung nach dem Umwandlungsgesetz",
      "state": "Bayern",
      "amtsgericht": "Amtsgericht Augsburg",
      "registernummer": "HRB 38359",
      "registerart": "HRB",
      "company_name": "heyfam GmbH",
      "company_seat": "Augsburg",
      "details": "25.11.2025 (Bekanntmachungsdatum)\n\nBayern Amtsgericht Augsburg HRB 38359\nRegisterbekanntmachung nach dem Umwandlungsgesetz 22.11.2025 (Eintragungsdatum)\n\nheyfam GmbH\nGesellschaft mit beschränkter Haftung\nAugsburg\n\nDen Gläubigern der an der Verschmelzung beteiligten Rechtsträger ist, wenn sie binnen sechs Monaten nach dem Tag, an dem die Eintragung der Verschmelzung in das Register des Sitzes desjenigen Rechtsträgers, dessen Gläubiger sie sind, nach § 19 Abs. 3 UmwG als bekannt gemacht gilt, ihren Anspruch nach Grund und Höhe in Textform anmelden, Sicherheit zu leisten, soweit sie nicht Befriedigung verlangen können. Dieses Recht steht den Gläubigern jedoch nur zu, wenn sie glaubhaft machen, dass durch die Verschmelzung die Erfüllung ihrer Forderung gefährdet wird."
    },
    {
      "date": "2025-11-25",
      "id": "138181",
      "original_text": "Löschungsankündigung\nBayern Amtsgericht Ingolstadt HRB 9912\nInxint GmbH – Denkendorf",
      "type": "Löschungsankündigung",
      "state": "Bayern",
      "amtsgericht": "Amtsgericht Ingolstadt",
      "registernummer": "HRB 9912",
      "registerart": "HRB",
      "company_name": "Inxint GmbH",
      "company_seat": "Denkendorf",
      "details": "25.11.2025 (Bekanntmachungsdatum)\n\nBayern Amtsgericht Ingolstadt HRB 9912\nLöschungsankündigung\n\nInxint GmbH\nGesellschaft mit beschränkter Haftung\nDenkendorf\n\nDas Registergericht beabsichtigt, die im Handelsregister eingetragene Gesellschaft wegen Vermögenslosigkeit von Amts wegen nach § 394 FamFG zu löschen. Die Frist zur Erhebung eines Widerspruchs ist auf einen Monat festgesetzt."
    },
    {
      "date": "2025-11-25",
      "id": "138182",
      "original_text": "Löschungsankündigung\nBayern Amtsgericht Amberg HRB 989\nAnlagen- und Umwelttechnologie A I - A III - B GmbH – Sulzbach-Rosenberg",
      "type": "Löschungsankündigung",
      "state": "Bayern",
      "amtsgericht": "Amtsgericht Amberg",
      "registernummer": "HRB 989",
      "registerart": "HRB",
      "company_name": "Anlagen- und Umwelttechnologie A I - A III - B GmbH",
      "company_seat": "Sulzbach-Rosenberg",
      "details": "25.11.2025 (Bekanntmachungsdatum)\n\nBayern Amtsgericht Amberg HRB 989\nLöschungsankündigung\n\nAnlagen- und Umwelttechnologie A I - A III - B GmbH\nGesellschaft mit beschränkter Haftung\nSulzbach-Rosenberg\n\nDas Registergericht beabsichtigt, die im Handelsregister eingetragene Gesellschaft wegen Vermögenslosigkeit von Amts wegen nach § 394 FamFG zu löschen. Die Frist zur Erhebung eines Widerspruchs ist auf einen Monat festgesetzt."
    },
    {
      "date": "2025-11-25",
      "id": "138183",
      "original_text": "Löschungsankündigung\nBrandenburg Amtsgericht Potsdam HRB 27876\nRemix Management UG (haftungsbeschränkt) – Niedergörsdorf",
      "type": "Löschungsankündigung",
      "state": "Brandenburg",
      "amtsgericht": "Amtsgericht Potsdam",
      "registernummer": "HRB 27876",
      "registerart": "HRB",
      "company_name": "Remix Management UG (haftungsbeschränkt)",
      "company_seat": "Niedergörsdorf",
      "details": "25.11.2025 (Bekanntmachungsdatum)\n\nBrandenburg Amtsgericht Potsdam HRB 27876\nLöschungsankündigung\n\nRemix Management UG (haftungsbeschränkt)\nGesellschaft mit beschränkter Haftung\nNiedergörsdorf\n\nBei der nachstehenden Gesellschaft wird das Amtslöschungsverfahren gemäß § 394 FamFG eingeleitet. Widerspruchsfrist: 8 Wochen."
    },
    {
      "date": "2025-11-25",
      "id": "138184",
      "original_text": "Löschungsankündigung\nBerlin Amtsgericht Berlin (Charlottenburg) HRB 169820\naramys Beteiligungen Unternehmergesellschaft (haftungsbeschränkt) – Berlin",
      "type": "Löschungsankündigung",
      "state": "Berlin",
      "amtsgericht": "Amtsgericht Berlin (Charlottenburg)",
      "registernummer": "HRB 169820",
      "registerart": "HRB",
      "company_name": "aramys Beteiligungen Unternehmergesellschaft (haftungsbeschränkt)",
      "company_seat": "Berlin",
      "details": "25.11.2025 (Bekanntmachungsdatum)\n\nBerlin Amtsgericht Berlin (Charlottenburg) HRB 169820\nLöschungsankündigung\n\naramys Beteiligungen Unternehmergesellschaft (haftungsbeschränkt)\nGesellschaft mit beschränkter Haftung\nBerlin\n\nBei der nachstehenden Gesellschaft wird das Amtslöschungsverfahren gemäß § 394 FamFG eingeleitet. Widerspruchsfrist 6 Wochen"
    },
    {
      "date": "2025-11-25",
      "id": "138185",
      "original_text": "Löschungsankündigung\nBaden-Württemberg Amtsgericht Mannheim HRB 104585\nComputer-Control-Software-Entwicklungs-Gesellschaft mit beschränkter Haftung – Karlsruhe",
      "type": "Löschungsankündigung",
      "state": "Baden-Württemberg",
      "amtsgericht": "Amtsgericht Mannheim",
      "registernummer": "HRB 104585",
      "registerart": "HRB",
      "company_name": "Computer-Control-Software-Entwicklungs-Gesellschaft mit beschränkter Haftung",
      "company_seat": "Karlsruhe",
      "details": "25.11.2025 (Bekanntmachungsdatum)\n\nBaden-Württemberg Amtsgericht Mannheim HRB 104585\nLöschungsankündigung\n\nComputer-Control-Software-Entwicklungs-Gesellschaft mit beschränkter Haftung\nGesellschaft mit beschränkter Haftung\nKarlsruhe\n\nDas Gericht beabsichtigt, die Gesellschaft wegen Vermögenslosigkeit im Handelsregister von Amts wegen nach § 394 FamFG zu löschen. Die Frist zur Geltendmachung eines Widerspruchs gegen die beabsichtigte Löschung ist auf einen Monat ab Veröffentlichung bestimmt."
    },
    {
      "date": "2025-11-25",
      "id": "138186",
      "original_text": "Registerbekanntmachung nach dem Umwandlungsgesetz\nHamburg Amtsgericht Hamburg HRB 195138\nTREGG AG – Hamburg",
      "type": "Registerbekanntmachung nach dem Umwandlungsgesetz",
      "state": "Hamburg",
      "amtsgericht": "Amtsgericht Hamburg",
      "registernummer": "HRB 195138",
      "registerart": "HRB",
      "company_name": "TREGG AG",
      "company_seat": "Hamburg",
      "details": "25.11.2025 (Bekanntmachungsdatum)\n\nHamburg Amtsgericht Hamburg HRB 195138\nRegisterbekanntmachung nach dem Umwandlungsgesetz\n\nTREGG AG\nAktiengesellschaft\nHamburg\n\nAls nicht eingetragen wird bekanntgemacht:\nEs wird darauf hingewiesen, dass ein Verschmelzungsplan oder sein Entwurf über eine grenzüberschreitende Verschmelzung zur Aufnahme mit der TransRe Europe S.A. mit Sitz in Luxemburg/Luxemburg (Registre de commerce et des sociétés B235795) (société anonyme - Aktiengesellschaft nach luxemburgischem Recht) als übernehmender Rechtsträger und der TREGG AG mit Sitz in Hamburg/Bundesrepublik Deutschland (Amtsgericht Hamburg HRB 195138) (Aktiengesellschaft) als übertragender Rechtsträger beim Handelsregister eingereicht worden ist.\nDie Anteilsinhaber, die Gläubiger sowie die zuständigen Betriebsräte der an der grenzüberschreitenden Verschmelzung beteiligten Gesellschaften oder, soweit es keinen Betriebsrat gibt, die Arbeitnehmer der an der grenzüberschreitenden Verschmelzung beteiligten Gesellschaften, können der jeweiligen Gesellschaft spätestens fünf Arbeitstage vor dem Tag der Hauptversammlung Bemerkungen zum Verschmelzungsplan übermitteln."
    },
    {
      "date": "2025-11-25",
      "id": "138187",
      "original_text": "Registerbekanntmachung nach dem Umwandlungsgesetz\nSachsen-Anhalt Amtsgericht Stendal HRB 26440\nBetsy Peymann UG (haftungsbeschränkt) – Magdeburg",
      "type": "Registerbekanntmachung nach dem Umwandlungsgesetz",
      "state": "Sachsen-Anhalt",
      "amtsgericht": "Amtsgericht Stendal",
      "registernummer": "HRB 26440",
      "registerart": "HRB",
      "company_name": "Betsy Peymann UG (haftungsbeschränkt)",
      "company_seat": "Magdeburg",
      "details": "25.11.2025 (Bekanntmachungsdatum)\n\nSachsen-Anhalt Amtsgericht Stendal HRB 26440\nRegisterbekanntmachung nach dem Umwandlungsgesetz 25.11.2025 (Eintragungsdatum)\n\nBetsy Peymann UG (haftungsbeschränkt)\nGesellschaft mit beschränkter Haftung\nMagdeburg\n\nNicht eingetragen:\nDen Gläubigern der an der Verschmelzung beteiligten Rechtsträger ist, wenn sie binnen sechs Monaten nach dem Tag, an dem die Eintragung der Verschmelzung nach § 19 Abs. 3 UmwG als bekanntgemacht gilt, ihren Anspruch nach Grund und Höhe schriftlich anmelden, Sicherheit zu leisten, soweit sie nicht Befriedigung verlangen können. Dieses Recht steht ihnen jedoch nur zu, wenn sie glaubhaft machen, dass durch die Verschmelzung die Erfüllung ihrer Forderung gefährdet wird."
    },
    {
      "date": "2025-11-25",
      "id": "138188",
      "original_text": "Registerbekanntmachung nach dem Umwandlungsgesetz\nSachsen-Anhalt Amtsgericht Stendal HRA 8378\nBetsy Peymann e.K. – Magdeburg",
      "type": "Registerbekanntmachung nach dem Umwandlungsgesetz",
      "state": "Sachsen-Anhalt",
      "amtsgericht": "Amtsgericht Stendal",
      "registernummer": "HRA 8378",
      "registerart": "HRA",
      "company_name": "Betsy Peymann e.K.",
      "company_seat": "Magdeburg",
      "details": "25.11.2025 (Bekanntmachungsdatum)\n\nSachsen-Anhalt Amtsgericht Stendal HRA 8378\nRegisterbekanntmachung nach dem Umwandlungsgesetz 25.11.2025 (Eintragungsdatum)\n\nBetsy Peymann e.K.\nEinzelkaufmann / Einzelkauffrau\nMagdeburg\n\nNicht eingetragen:\nDen Gläubigern der an der Verschmelzung beteiligten Rechtsträger ist, wenn sie binnen sechs Monaten nach dem Tag, an dem die Eintragung der Verschmelzung nach § 19 Abs. 3 UmwG als bekanntgemacht gilt, ihren Anspruch nach Grund und Höhe schriftlich anmelden, Sicherheit zu leisten, soweit sie nicht Befriedigung verlangen können. Dieses Recht steht ihnen jedoch nur zu, wenn sie glaubhaft machen, dass durch die Verschmelzung die Erfüllung ihrer Forderung gefährdet wird."
    },
    {
      "date": "2025-11-25",
      "id": "138189",
      "original_text": "Löschungsankündigung\nBerlin Amtsgericht Berlin (Charlottenburg) HRB 167380\nSH Medtech Investment GmbH – Berlin",
      "type": "Löschungsankündigung",
      "state": "Berlin",
      "amtsgericht": "Amtsgericht Berlin (Charlottenburg)",
      "registernummer": "HRB 167380",
      "registerart": "HRB",
      "company_name": "SH Medtech Investment GmbH",
      "company_seat": "Berlin",
      "details": "25.11.2025 (Bekanntmachungsdatum)\n\nBerlin Amtsgericht Berlin (Charlottenburg) HRB 167380\nLöschungsankündigung\n\nSH Medtech Investment GmbH\nGesellschaft mit beschränkter Haftung\nBerlin\n\nEs ist beabsichtigt, die Eintragung des Stefan Kindler als Geschäftsführer wegen Mangels einer wesentlichen Voraussetzung gemäß § 395 FamFG von Amts wegen zu löschen. Widerspruchsfrist 3 Wochen"
    },
    {
      "date": "2025-11-25",
      "id": "138190",
      "original_text": "Einreichung neuer Dokumente\nHamburg Amtsgericht Hamburg HRB 186826\nSTERNPARTNER ANDERS Management SE – Hamburg",
      "type": "Einreichung neuer Dokumente",
      "state": "Hamburg",
      "amtsgericht": "Amtsgericht Hamburg",
      "registernummer": "HRB 186826",
      "registerart": "HRB",
      "company_name": "STERNPARTNER ANDERS Management SE",
      "company_seat": "Hamburg",
      "details": "25.11.2025 (Bekanntmachungsdatum)\n\nHamburg Amtsgericht Hamburg HRB 186826\nEinreichung neuer Dokumente 24.11.2025 (Eintragungsdatum)\n\nSTERNPARTNER ANDERS Management SE\nEuropäische Aktiengesellschaft (SE)\nHamburg\n\nAls nicht eingetragen wird bekannt gemacht: Liste des Aufsichtsrats wurde eingereicht."
    },
    {
      "date": "2025-11-25",
      "id": "138191",
      "original_text": "Löschungsankündigung\nBaden-Württemberg Amtsgericht Freiburg HRB 707325\nMD Leasing GmbH – Kehl",
      "type": "Löschungsankündigung",
      "state": "Baden-Württemberg",
      "amtsgericht": "Amtsgericht Freiburg",
      "registernummer": "HRB 707325",
      "registerart": "HRB",
      "company_name": "MD Leasing GmbH",
      "company_seat": "Kehl",
      "details": "25.11.2025 (Bekanntmachungsdatum)\n\nBaden-Württemberg Amtsgericht Freiburg HRB 707325\nLöschungsankündigung\n\nMD Leasing GmbH\nGesellschaft mit beschränkter Haftung\nKehl\n\nAls nicht eingetragen wird bekanntgemacht:\nDas Gericht beabsichtigt, die Gesellschaft wegen Vermögenslosigkeit im Handelsregister von Amts wegen nach § 394 FamFG zu löschen. Die Frist zur Geltendmachung eines Widerspruchs gegen die beabsichtigte Löschung ist auf einen Monat ab Veröffentlichung bestimmt."
    },
    {
      "date": "2025-11-25",
      "id": "138192",
      "original_text": "Registerbekanntmachung nach dem Umwandlungsgesetz\nBaden-Württemberg Amtsgericht Mannheim HRB 756401\nWagner Management Consulting GmbH – Ketsch",
      "type": "Registerbekanntmachung nach dem Umwandlungsgesetz",
      "state": "Baden-Württemberg",
      "amtsgericht": "Amtsgericht Mannheim",
      "registernummer": "HRB 756401",
      "registerart": "HRB",
      "company_name": "Wagner Management Consulting GmbH",
      "company_seat": "Ketsch",
      "details": "25.11.2025 (Bekanntmachungsdatum)\n\nBaden-Württemberg Amtsgericht Mannheim HRB 756401\nRegisterbekanntmachung nach dem Umwandlungsgesetz 25.11.2025 (Eintragungsdatum)\n\nWagner Management Consulting GmbH\nGesellschaft mit beschränkter Haftung\nKetsch\n\nAls nicht eingetragen wird bekanntgemacht:\nDen Gläubigern der an der Ausgliederung beteiligten Rechtsträger ist, wenn sie binnen sechs Monaten nach dem Tag, an dem die Eintragung der Ausgliederung in das Register des Sitzes desjenigen Rechtsträgers, dessen Gläubiger sie sind, nach § 19 Abs. 3 UmwG als bekanntgemacht gilt, ihren Anspruch nach Grund und Höhe schriftlich anmelden, Sicherheit zu leisten, soweit sie nicht Befriedigung verlangen können. Dieses Recht steht den Gläubigern jedoch nur zu, wenn sie glaubhaft machen, dass durch die Ausgliederung die Erfüllung ihrer Forderung gefährdet wird."
    },
    {
      "date": "2025-11-25",
      "id": "138193",
      "original_text": "Einreichung neuer Dokumente\nBrandenburg Amtsgericht Cottbus HRB 687\nBASF Schwarzheide GmbH – Schwarzheide",
      "type": "Einreichung neuer Dokumente",
      "state": "Brandenburg",
      "amtsgericht": "Amtsgericht Cottbus",
      "registernummer": "HRB 687",
      "registerart": "HRB",
      "company_name": "BASF Schwarzheide GmbH",
      "company_seat": "Schwarzheide",
      "details": "25.11.2025 (Bekanntmachungsdatum)\n\nBrandenburg Amtsgericht Cottbus HRB 687\nEinreichung neuer Dokumente\n\nBASF Schwarzheide GmbH\nGesellschaft mit beschränkter Haftung\nSchwarzheide\n\nDer Geschäftsführer hat eine Liste der Aufsichtsratsmitglieder gem. § 52 Abs. 2 Satz 2 GmbHG zum Handelsregister eingereicht."
    },
    {
      "date": "2025-11-25",
      "id": "138194",
      "original_text": "Löschungsankündigung\nBerlin Amtsgericht Berlin (Charlottenburg) HRB 119715\nAkbaba Handels GmbH – Berlin",
      "type": "Löschungsankündigung",
      "state": "Berlin",
      "amtsgericht": "Amtsgericht Berlin (Charlottenburg)",
      "registernummer": "HRB 119715",
      "registerart": "HRB",
      "company_name": "Akbaba Handels GmbH",
      "company_seat": "Berlin",
      "details": "25.11.2025 (Bekanntmachungsdatum)\n\nBerlin Amtsgericht Berlin (Charlottenburg) HRB 119715\nLöschungsankündigung\n\nAkbaba Handels GmbH\nGesellschaft mit beschränkter Haftung\nBerlin\n\nBei der nachstehenden Gesellschaft wird das Amtslöschungsverfahren gemäß § 394 FamFG eingeleitet. Widerspruchsfrist 6 Wochen"
    },
    {
      "date": "2025-11-25",
      "id": "138195",
      "original_text": "Einreichung neuer Dokumente\nSachsen-Anhalt Amtsgericht Stendal HRB 36375\nH2 Green Power & Logistics AG – Magdeburg",
      "type": "Einreichung neuer Dokumente",
      "state": "Sachsen-Anhalt",
      "amtsgericht": "Amtsgericht Stendal",
      "registernummer": "HRB 36375",
      "registerart": "HRB",
      "company_name": "H2 Green Power & Logistics AG",
      "company_seat": "Magdeburg",
      "details": "25.11.2025 (Bekanntmachungsdatum)\n\nSachsen-Anhalt Amtsgericht Stendal HRB 36375\nEinreichung neuer Dokumente 25.11.2025 (Eintragungsdatum)\n\nH2 Green Power & Logistics AG\nAktiengesellschaft\nMagdeburg\n\nEine Liste der Mitglieder des Aufsichtsrates wurde zum Handelsregister eingereicht."
    },
    {
      "date": "2025-11-25",
      "id": "138196",
      "original_text": "Einreichung neuer Dokumente\nHamburg Amtsgericht Hamburg HRB 189825\nABOUT YOU Holding AG – Hamburg",
      "type": "Einreichung neuer Dokumente",
      "state": "Hamburg",
      "amtsgericht": "Amtsgericht Hamburg",
      "registernummer": "HRB 189825",
      "registerart": "HRB",
      "company_name": "ABOUT YOU Holding AG",
      "company_seat": "Hamburg",
      "details": "25.11.2025 (Bekanntmachungsdatum)\n\nHamburg Amtsgericht Hamburg HRB 189825\nEinreichung neuer Dokumente 19.11.2025 (Eintragungsdatum)\n\nABOUT YOU Holding AG\nAktiengesellschaft\nHamburg\n\nAls nicht eingetragen wird bekannt gemacht: Liste des Aufsichtsrats wurde eingereicht."
    },
    {
      "date": "2025-11-25",
      "id": "138197",
      "original_text": "Löschungsankündigung\nBerlin Amtsgericht Berlin (Charlottenburg) HRB 212295\nS.O.S. Gutachten und Handel GmbH – Berlin",
      "type": "Löschungsankündigung",
      "state": "Berlin",
      "amtsgericht": "Amtsgericht Berlin (Charlottenburg)",
      "registernummer": "HRB 212295",
      "registerart": "HRB",
      "company_name": "S.O.S. Gutachten und Handel GmbH",
      "company_seat": "Berlin",
      "details": "25.11.2025 (Bekanntmachungsdatum)\n\nBerlin Amtsgericht Berlin (Charlottenburg) HRB 212295\nLöschungsankündigung\n\nS.O.S. Gutachten und Handel GmbH\nGesellschaft mit beschränkter Haftung\nBerlin\n\nBei der nachstehenden Gesellschaft wird das Amtslöschungsverfahren gemäß § 394 FamFG eingeleitet. Widerspruchsfrist\n6 Wochen."
    },
    {
      "date": "2025-11-25",
      "id": "138198",
      "original_text": "Sonstige Registerbekanntmachung\nHamburg Amtsgericht Hamburg HRB 182884\nErste PLS Solution GmbH – Hamburg",
      "type": "Sonstige Registerbekanntmachung",
      "state": "Hamburg",
      "amtsgericht": "Amtsgericht Hamburg",
      "registernummer": "HRB 182884",
      "registerart": "HRB",
      "company_name": "Erste PLS Solution GmbH",
      "company_seat": "Hamburg",
      "details": "25.11.2025 (Bekanntmachungsdatum)\n\nHamburg Amtsgericht Hamburg HRB 182884\nSonstige Registerbekanntmachung 25.11.2025 (Eintragungsdatum)\n\nErste PLS Solution GmbH\nGesellschaft mit beschränkter Haftung\nHamburg\n\nAls nicht eingetragen wird bekannt gemacht:  Den Gläubigern der Gesellschaft, deren Forderungen begründet worden sind, bevor die Eintragung der Vertragsbeendigung in das Handelsregister nach § 10 HGB als bekannt gemacht gilt, ist vom anderen Vertragsteil Sicherheit zu leisten, wenn sie sich binnen 6 Monaten nach Bekanntmachung der Eintragung zu diesem Zweck bei ihm melden."
    },
    {
      "date": "2025-11-25",
      "id": "138199",
      "original_text": "Einreichung neuer Dokumente\nHamburg Amtsgericht Hamburg HRB 176714\nLennertz & Co. Capital GmbH – Hamburg",
      "type": "Einreichung neuer Dokumente",
      "state": "Hamburg",
      "amtsgericht": "Amtsgericht Hamburg",
      "registernummer": "HRB 176714",
      "registerart": "HRB",
      "company_name": "Lennertz & Co. Capital GmbH",
      "company_seat": "Hamburg",
      "details": "25.11.2025 (Bekanntmachungsdatum)\n\nHamburg Amtsgericht Hamburg HRB 176714\nEinreichung neuer Dokumente 25.11.2025 (Eintragungsdatum)\n\nLennertz & Co. Capital GmbH\nGesellschaft mit beschränkter Haftung\nHamburg\n\nAls nicht eingetragen wird bekannt gemacht: Liste des Aufsichtsrats wurde eingereicht."
    },
    {
      "date": "2025-11-25",
      "id": "138200",
      "original_text": "Löschungsankündigung\nBerlin Amtsgericht Berlin (Charlottenburg) HRB 207784\nFURKATSCH Business GmbH – Berlin",
      "type": "Löschungsankündigung",
      "state": "Berlin",
      "amtsgericht": "Amtsgericht Berlin (Charlottenburg)",
      "registernummer": "HRB 207784",
      "registerart": "HRB",
      "company_name": "FURKATSCH Business GmbH",
      "company_seat": "Berlin",
      "details": "25.11.2025 (Bekanntmachungsdatum)\n\nBerlin Amtsgericht Berlin (Charlottenburg) HRB 207784\nLöschungsankündigung\n\nFURKATSCH Business GmbH\nGesellschaft mit beschränkter Haftung\nBerlin\n\nBei der nachstehenden Gesellschaft wird das Amtslöschungsverfahren gemäß § 394 FamFG eingeleitet. Widerspruchsfrist 6 Wochen"
    },
    {
      "date": "2025-11-25",
      "id": "138201",
      "original_text": "Löschungsankündigung\nBaden-Württemberg Amtsgericht Mannheim HRB 726699\nHeid Zaunsysteme GmbH – Nußloch",
      "type": "Löschungsankündigung",
      "state": "Baden-Württemberg",
      "amtsgericht": "Amtsgericht Mannheim",
      "registernummer": "HRB 726699",
      "registerart": "HRB",
      "company_name": "Heid Zaunsysteme GmbH",
      "company_seat": "Nußloch",
      "details": "25.11.2025 (Bekanntmachungsdatum)\n\nBaden-Württemberg Amtsgericht Mannheim HRB 726699\nLöschungsankündigung\n\nHeid Zaunsysteme GmbH\nGesellschaft mit beschränkter Haftung\nNußloch\n\nDas Gericht beabsichtigt, die Gesellschaft wegen Vermögenslosigkeit im Handelsregister von Amts wegen nach § 394 FamFG zu löschen. Die Frist zur Geltendmachung eines Widerspruchs gegen die beabsichtigte Löschung ist auf einen Monat ab Veröffentlichung bestimmt."
    },
    {
      "date": "2025-11-25",
      "id": "138202",
      "original_text": "Registerbekanntmachung nach dem Umwandlungsgesetz\nBaden-Württemberg Amtsgericht Mannheim HRB 735508\nKUNZE Living GmbH – Schwetzingen",
      "type": "Registerbekanntmachung nach dem Umwandlungsgesetz",
      "state": "Baden-Württemberg",
      "amtsgericht": "Amtsgericht Mannheim",
      "registernummer": "HRB 735508",
      "registerart": "HRB",
      "company_name": "KUNZE Living GmbH",
      "company_seat": "Schwetzingen",
      "details": "25.11.2025 (Bekanntmachungsdatum)\n\nBaden-Württemberg Amtsgericht Mannheim HRB 735508\nRegisterbekanntmachung nach dem Umwandlungsgesetz 25.11.2025 (Eintragungsdatum)\n\nKUNZE Living GmbH\nGesellschaft mit beschränkter Haftung\nSchwetzingen\n\nDen Gläubigern der an der Verschmelzung beteiligten Rechtsträger ist, wenn sie binnen sechs Monaten nach dem Tag, an dem die Eintragung der Verschmelzung in das Register des Sitzes desjenigen Rechtsträgers, dessen Gläubiger sie sind, nach § 19 Abs. 3 UmwG als bekanntgemacht gilt, ihren Anspruch nach Grund und Höhe schriftlich anmelden, Sicherheit zu leisten, soweit sie nicht Befriedigung verlangen können. Dieses Recht steht den Gläubigern jedoch nur zu, wenn sie glaubhaft machen, dass durch die Verschmelzung die Erfüllung ihrer Forderung gefährdet wird."
    },
    {
      "date": "2025-11-25",
      "id": "138203",
      "original_text": "Registerbekanntmachung nach dem Umwandlungsgesetz\nBaden-Württemberg Amtsgericht Mannheim HRB 440503\nKernkraftwerk Obrigheim GmbH (KWO) – Obrigheim",
      "type": "Registerbekanntmachung nach dem Umwandlungsgesetz",
      "state": "Baden-Württemberg",
      "amtsgericht": "Amtsgericht Mannheim",
      "registernummer": "HRB 440503",
      "registerart": "HRB",
      "company_name": "Kernkraftwerk Obrigheim GmbH (KWO)",
      "company_seat": "Obrigheim",
      "details": "25.11.2025 (Bekanntmachungsdatum)\n\nBaden-Württemberg Amtsgericht Mannheim HRB 440503\nRegisterbekanntmachung nach dem Umwandlungsgesetz 25.11.2025 (Eintragungsdatum)\n\nKernkraftwerk Obrigheim GmbH (KWO)\nGesellschaft mit beschränkter Haftung\nObrigheim\n\nAls nicht eingetragen wird bekanntgemacht:\nDen Gläubigern der an der Verschmelzung beteiligten Rechtsträger ist, wenn sie binnen sechs Monaten nach dem Tag, an dem die Eintragung der Verschmelzung in das Register des Sitzes desjenigen Rechtsträgers, dessen Gläubiger sie sind, nach § 19 Abs. 3 UmwG als bekanntgemacht gilt, ihren Anspruch nach Grund und Höhe schriftlich anmelden, Sicherheit zu leisten, soweit sie nicht Befriedigung verlangen können. Dieses Recht steht den Gläubigern jedoch nur zu, wenn sie glaubhaft machen, dass durch die Verschmelzung die Erfüllung ihrer Forderung gefährdet wird."
    },
    {
      "date": "2025-11-25",
      "id": "138204",
      "original_text": "Löschungsankündigung\nBaden-Württemberg Amtsgericht Mannheim HRB 740433\nINOshkservis GmbH – Hockenheim",
      "type": "Löschungsankündigung",
      "state": "Baden-Württemberg",
      "amtsgericht": "Amtsgericht Mannheim",
      "registernummer": "HRB 740433",
      "registerart": "HRB",
      "company_name": "INOshkservis GmbH",
      "company_seat": "Hockenheim",
      "details": "25.11.2025 (Bekanntmachungsdatum)\n\nBaden-Württemberg Amtsgericht Mannheim HRB 740433\nLöschungsankündigung\n\nINOshkservis GmbH\nGesellschaft mit beschränkter Haftung\nHockenheim\n\nAls nicht eingetragen wird bekanntgemacht:\nDas Gericht beabsichtigt, die Gesellschaft wegen Vermögenslosigkeit im Handelsregister von Amts wegen nach § 394 FamFG zu löschen. Die Frist zur Geltendmachung eines Widerspruchs gegen die beabsichtigte Löschung ist auf einen Monat ab Veröffentlichung bestimmt."
    },
    {
      "date": "2025-11-25",
      "id": "138205",
      "original_text": "Löschungsankündigung\nBerlin Amtsgericht Berlin (Charlottenburg) HRB 226415\nEasybaumanagement GmbH – Berlin",
      "type": "Löschungsankündigung",
      "state": "Berlin",
      "amtsgericht": "Amtsgericht Berlin (Charlottenburg)",
      "registernummer": "HRB 226415",
      "registerart": "HRB",
      "company_name": "Easybaumanagement GmbH",
      "company_seat": "Berlin",
      "details": "25.11.2025 (Bekanntmachungsdatum)\n\nBerlin Amtsgericht Berlin (Charlottenburg) HRB 226415\nLöschungsankündigung\n\nEasybaumanagement GmbH\nGesellschaft mit beschränkter Haftung\nBerlin\n\nBei der nachstehenden Gesellschaft wird das Amtslöschungsverfahren gemäß § 394 FamFG eingeleitet. Widerspruchsfrist\n6 Wochen."
    },
    {
      "date": "2025-11-25",
      "id": "138206",
      "original_text": "Sonstige Registerbekanntmachung\nMecklenburg-Vorpommern Amtsgericht Rostock HRB 14379\nBACKOFFICE International AG – Rostock",
      "type": "Sonstige Registerbekanntmachung",
      "state": "Mecklenburg-Vorpommern",
      "amtsgericht": "Amtsgericht Rostock",
      "registernummer": "HRB 14379",
      "registerart": "HRB",
      "company_name": "BACKOFFICE International AG",
      "company_seat": "Rostock",
      "details": "25.11.2025 (Bekanntmachungsdatum)\n\nMecklenburg-Vorpommern Amtsgericht Rostock HRB 14379\nSonstige Registerbekanntmachung 25.11.2025 (Eintragungsdatum)\n\nBACKOFFICE International AG\nAktiengesellschaft\nRostock\n\nEine Liste der Mitglieder des Aufsichtsrats ist zum Handelsregister eingereicht worden."
    },
    {
      "date": "2025-11-25",
      "id": "138207",
      "original_text": "Einreichung neuer Dokumente\nThüringen Amtsgericht Jena HRB 513963\nElevion Deutschland Holding GmbH – Jena",
      "type": "Einreichung neuer Dokumente",
      "state": "Thüringen",
      "amtsgericht": "Amtsgericht Jena",
      "registernummer": "HRB 513963",
      "registerart": "HRB",
      "company_name": "Elevion Deutschland Holding GmbH",
      "company_seat": "Jena",
      "details": "25.11.2025 (Bekanntmachungsdatum)\n\nThüringen Amtsgericht Jena HRB 513963\nEinreichung neuer Dokumente 25.11.2025 (Eintragungsdatum)\n\nElevion Deutschland Holding GmbH\nGesellschaft mit beschränkter Haftung\nJena\n\nBekanntmachung gem. § 52 Abs. 3 Satz 2 GmbHG: Aufgrund einer Veränderung in den Personen der Aufsichtsratsmitglieder ist durch die Geschäftsführer eine neue Liste zum Handelsregister eingereicht worden."
    },
    {
      "date": "2025-11-25",
      "id": "138208",
      "original_text": "Löschungsankündigung\nSachsen-Anhalt Amtsgericht Stendal VR 50421\n\"Ortsteil-Entwicklungsverein Hohenwarthe-Waldschänke\" e.V. – Hohenwarthe - OT Waldschänke",
      "type": "Löschungsankündigung",
      "state": "Sachsen-Anhalt",
      "amtsgericht": "Amtsgericht Stendal",
      "registernummer": "VR 50421",
      "registerart": "VR",
      "company_name": "\"Ortsteil-Entwicklungsverein Hohenwarthe-Waldschänke\" e.V.",
      "company_seat": "Hohenwarthe - OT Waldschänke",
      "details": "25.11.2025 (Bekanntmachungsdatum)\n\nSachsen-Anhalt Amtsgericht Stendal VR 50421\nLöschungsankündigung\n\n\"Ortsteil-Entwicklungsverein Hohenwarthe-Waldschänke\" e.V.\neingetragener Verein\nHohenwarthe - OT Waldschänke\n\nDas Registergericht beabsichtigt, dem nachfolgenden Verein gemäß § 73 BGB die Rechtsfähigkeit zu entziehen. Die Frist zu Erhebung eines Widerspruchs wird auf einen Monat festgesetzt."
    },
    {
      "date": "2025-11-25",
      "id": "138209",
      "original_text": "Registerbekanntmachung nach dem Umwandlungsgesetz\nBerlin Amtsgericht Berlin (Charlottenburg) HRB 198280\nEpicode Germany GmbH – Berlin",
      "type": "Registerbekanntmachung nach dem Umwandlungsgesetz",
      "state": "Berlin",
      "amtsgericht": "Amtsgericht Berlin (Charlottenburg)",
      "registernummer": "HRB 198280",
      "registerart": "HRB",
      "company_name": "Epicode Germany GmbH",
      "company_seat": "Berlin",
      "details": "25.11.2025 (Bekanntmachungsdatum)\n\nBerlin Amtsgericht Berlin (Charlottenburg) HRB 198280\nRegisterbekanntmachung nach dem Umwandlungsgesetz 24.11.2025 (Eintragungsdatum)\n\nEpicode Germany GmbH\nGesellschaft mit beschränkter Haftung\nBerlin\n\nZu Eintragungsnummer 5 vom 24.11.2025 wird als nicht eingetragen veröffentlicht: Den Gläubigern der an der Verschmelzung beteiligten Rechtsträger ist, wenn sie binnen sechs Monaten nach dem Tag, an dem die Eintragung der Verschmelzung in das Register des Sitzes desjenigen Rechtsträgers, dessen Gläubiger sie sind, als bekannt gemacht gilt, ihren Anspruch nach Grund und Höhe schriftlich anmelden, Sicherheit zu leisten, soweit sie nicht Befriedigung verlangen können. Dieses Recht steht den Gläubigern jedoch nur zu, wenn sie glaubhaft machen, dass durch die Verschmelzung die Erfüllung ihrer Forderung gefährdet wird. Das Recht, Sicherheitsleistung zu verlangen, steht Gläubigern nicht zu, die im Falle der Insolvenz ein Recht auf vorzugsweise Befriedigung aus einer Deckungsmasse haben, die nach gesetzlicher Vorschrift zu ihrem Schutz errichtet und staatlich überwacht ist."
    },
    {
      "date": "2025-11-25",
      "id": "138210",
      "original_text": "Einreichung neuer Dokumente\nBrandenburg Amtsgericht Cottbus HRB 3116\nBASF InfraService & Solutions Lausitz GmbH – Schwarzheide",
      "type": "Einreichung neuer Dokumente",
      "state": "Brandenburg",
      "amtsgericht": "Amtsgericht Cottbus",
      "registernummer": "HRB 3116",
      "registerart": "HRB",
      "company_name": "BASF InfraService & Solutions Lausitz GmbH",
      "company_seat": "Schwarzheide",
      "details": "25.11.2025 (Bekanntmachungsdatum)\n\nBrandenburg Amtsgericht Cottbus HRB 3116\nEinreichung neuer Dokumente\n\nBASF InfraService & Solutions Lausitz GmbH\nGesellschaft mit beschränkter Haftung\nSchwarzheide\n\nAls nicht eingetragen wird veröffentlicht:  Der Geschäftsführer hat eine Liste der Aufsichtsratsmitglieder gem. § 52 Abs. 3 Satz 2 GmbHG zum Handelsregister eingereicht."
    },
    {
      "date": "2025-11-25",
      "id": "138211",
      "original_text": "Löschungsankündigung\nBrandenburg Amtsgericht Potsdam HRB 32418\nNGB Neuhofer Grundbesitz UG (haftungsbeschränkt) – Zossen",
      "type": "Löschungsankündigung",
      "state": "Brandenburg",
      "amtsgericht": "Amtsgericht Potsdam",
      "registernummer": "HRB 32418",
      "registerart": "HRB",
      "company_name": "NGB Neuhofer Grundbesitz UG (haftungsbeschränkt)",
      "company_seat": "Zossen",
      "details": "25.11.2025 (Bekanntmachungsdatum)\n\nBrandenburg Amtsgericht Potsdam HRB 32418\nLöschungsankündigung\n\nNGB Neuhofer Grundbesitz UG (haftungsbeschränkt)\nGesellschaft mit beschränkter Haftung\nZossen\n\nBei der nachstehenden Gesellschaft wird das Amtslöschungsverfahren gemäß § 394 FamFG eingeleitet. Widerspruchsfrist: 8 Wochen."
    },
    {
      "date": "2025-11-25",
      "id": "138212",
      "original_text": "Einreichung neuer Dokumente\nBaden-Württemberg Amtsgericht Stuttgart HRB 787507\nDS Hotel gGmbH – Herrenberg",
      "type": "Einreichung neuer Dokumente",
      "state": "Baden-Württemberg",
      "amtsgericht": "Amtsgericht Stuttgart",
      "registernummer": "HRB 787507",
      "registerart": "HRB",
      "company_name": "DS Hotel gGmbH",
      "company_seat": "Herrenberg",
      "details": "25.11.2025 (Bekanntmachungsdatum)\n\nBaden-Württemberg Amtsgericht Stuttgart HRB 787507\nEinreichung neuer Dokumente\n\nDS Hotel gGmbH\nGesellschaft mit beschränkter Haftung\nHerrenberg\n\nDie Gesellschaft hat am 21.11.2025 die Liste über die Zusammensetzung des Aufsichtsrats zum Handelsregister eingereicht."
    },
    {
      "date": "2025-11-25",
      "id": "138213",
      "original_text": "Sonstige Registerbekanntmachung\nBerlin Amtsgericht Berlin (Charlottenburg) HRB 78064\nDussmann Stiftung & Co. Kommanditgesellschaft auf Aktien – Berlin",
      "type": "Sonstige Registerbekanntmachung",
      "state": "Berlin",
      "amtsgericht": "Amtsgericht Berlin (Charlottenburg)",
      "registernummer": "HRB 78064",
      "registerart": "HRB",
      "company_name": "Dussmann Stiftung & Co. Kommanditgesellschaft auf Aktien",
      "company_seat": "Berlin",
      "details": "25.11.2025 (Bekanntmachungsdatum)\n\nBerlin Amtsgericht Berlin (Charlottenburg) HRB 78064\nSonstige Registerbekanntmachung\n\nDussmann Stiftung & Co. Kommanditgesellschaft auf Aktien\nKommanditgesellschaft auf Aktien\nBerlin\n\nAls nicht eingetragen wird veröffentlicht: Es wurde eine neue Liste der Aufsichtsratsmitglieder eingereicht (§ 106 AktG)."
    },
    {
      "date": "2025-11-25",
      "id": "138214",
      "original_text": "Löschungsankündigung\nBaden-Württemberg Amtsgericht Mannheim HRB 500979\nSchwemmle Bauunternehmen GmbH – Keltern",
      "type": "Löschungsankündigung",
      "state": "Baden-Württemberg",
      "amtsgericht": "Amtsgericht Mannheim",
      "registernummer": "HRB 500979",
      "registerart": "HRB",
      "company_name": "Schwemmle Bauunternehmen GmbH",
      "company_seat": "Keltern",
      "details": "25.11.2025 (Bekanntmachungsdatum)\n\nBaden-Württemberg Amtsgericht Mannheim HRB 500979\nLöschungsankündigung\n\nSchwemmle Bauunternehmen GmbH\nGesellschaft mit beschränkter Haftung\nKeltern\n\nAls nicht eingetragen wird bekanntgemacht:\nDas Gericht beabsichtigt, die Gesellschaft wegen Vermögenslosigkeit im Handelsregister von Amts wegen nach § 394 FamFG zu löschen. Die Frist zur Geltendmachung eines Widerspruchs gegen die beabsichtigte Löschung ist auf einen Monat ab Veröffentlichung bestimmt."
    },
    {
      "date": "2025-11-25",
      "id": "138215",
      "original_text": "Registerbekanntmachung nach dem Umwandlungsgesetz\nBerlin Amtsgericht Berlin (Charlottenburg) HRB 68135\nSWS Sophienhaus Wohnbetreuungs- und Servicegesellschaft mbH – Berlin",
      "type": "Registerbekanntmachung nach dem Umwandlungsgesetz",
      "state": "Berlin",
      "amtsgericht": "Amtsgericht Berlin (Charlottenburg)",
      "registernummer": "HRB 68135",
      "registerart": "HRB",
      "company_name": "SWS Sophienhaus Wohnbetreuungs- und Servicegesellschaft mbH",
      "company_seat": "Berlin",
      "details": "25.11.2025 (Bekanntmachungsdatum)\n\nBerlin Amtsgericht Berlin (Charlottenburg) HRB 68135\nRegisterbekanntmachung nach dem Umwandlungsgesetz 24.11.2025 (Eintragungsdatum)\n\nSWS Sophienhaus Wohnbetreuungs- und Servicegesellschaft mbH\nGesellschaft mit beschränkter Haftung\nBerlin\n\nZu Eintragungsnummer 12 vom 24.11.2025 wird als nicht eingetragen veröffentlicht: Den Gläubigern der an der Spaltung beteiligten Rechtsträger ist, wenn sie binnen sechs Monaten nach dem Tag, an dem die Eintragung der Spaltung in das Register des Sitzes desjenigen Rechtsträgers, dessen Gläubiger sie sind, als bekannt gemacht gilt, ihren Anspruch nach Grund und Höhe schriftlich anmelden, Sicherheit zu leisten, soweit sie nicht Befriedigung verlangen können. Dieses Recht steht den Gläubigern jedoch nur zu, wenn sie glaubhaft machen, dass durch die Spaltung die Erfüllung ihrer Forderung gefährdet wird. Das Recht, Sicherheitsleistung zu verlangen, steht Gläubigern nicht zu, die im Falle der Insolvenz ein Recht auf vorzugsweise Befriedigung aus einer Deckungsmasse haben, die nach gesetzlicher Vorschrift zu ihrem Schutz errichtet und staatlich überwacht ist."
    },
    {
      "date": "2025-11-25",
      "id": "138216",
      "original_text": "Einreichung neuer Dokumente\nBaden-Württemberg Amtsgericht Ulm HRB 490594\nSchick Beteiligungsgesellschaft mbH – Allmendingen",
      "type": "Einreichung neuer Dokumente",
      "state": "Baden-Württemberg",
      "amtsgericht": "Amtsgericht Ulm",
      "registernummer": "HRB 490594",
      "registerart": "HRB",
      "company_name": "Schick Beteiligungsgesellschaft mbH",
      "company_seat": "Allmendingen",
      "details": "25.11.2025 (Bekanntmachungsdatum)\n\nBaden-Württemberg Amtsgericht Ulm HRB 490594\nEinreichung neuer Dokumente 25.11.2025 (Eintragungsdatum)\n\nSchick Beteiligungsgesellschaft mbH\nGesellschaft mit beschränkter Haftung\nAllmendingen\n\nDie Gesellschaft hat am 11.11.2025 die Liste über die Zusammensetzung des Aufsichtsrats zum Handelsregister eingereicht."
    },
    {
      "date": "2025-11-25",
      "id": "138217",
      "original_text": "Registerbekanntmachung nach dem Umwandlungsgesetz\nBerlin Amtsgericht Berlin (Charlottenburg) HRB 99947\nAGAPLESION BETHANIEN SERVICE & WOHNEN gemeinnützige GmbH – Berlin",
      "type": "Registerbekanntmachung nach dem Umwandlungsgesetz",
      "state": "Berlin",
      "amtsgericht": "Amtsgericht Berlin (Charlottenburg)",
      "registernummer": "HRB 99947",
      "registerart": "HRB",
      "company_name": "AGAPLESION BETHANIEN SERVICE & WOHNEN gemeinnützige GmbH",
      "company_seat": "Berlin",
      "details": "25.11.2025 (Bekanntmachungsdatum)\n\nBerlin Amtsgericht Berlin (Charlottenburg) HRB 99947\nRegisterbekanntmachung nach dem Umwandlungsgesetz 24.11.2025 (Eintragungsdatum)\n\nAGAPLESION BETHANIEN SERVICE & WOHNEN gemeinnützige GmbH\nGesellschaft mit beschränkter Haftung\nBerlin\n\nZu Eintragungsnummer 8 vom 24.11.2025 wird als nicht eingetragen veröffentlicht: Den Gläubigern der an der Spaltung beteiligten Rechtsträger ist, wenn sie binnen sechs Monaten nach dem Tag, an dem die Eintragung der Spaltung in das Register des Sitzes desjenigen Rechtsträgers, dessen Gläubiger sie sind, als bekannt gemacht gilt, ihren Anspruch nach Grund und Höhe schriftlich anmelden, Sicherheit zu leisten, soweit sie nicht Befriedigung verlangen können. Dieses Recht steht den Gläubigern jedoch nur zu, wenn sie glaubhaft machen, dass durch die Spaltung die Erfüllung ihrer Forderung gefährdet wird. Das Recht, Sicherheitsleistung zu verlangen, steht Gläubigern nicht zu, die im Falle der Insolvenz ein Recht auf vorzugsweise Befriedigung aus einer Deckungsmasse haben, die nach gesetzlicher Vorschrift zu ihrem Schutz errichtet und staatlich überwacht ist."
    },
    {
      "date": "2025-11-25",
      "id": "138218",
      "original_text": "Registerbekanntmachung nach dem Umwandlungsgesetz\nNordrhein-Westfalen Amtsgericht Coesfeld HRB 16013\nHof Grothues-Potthoff GmbH – Senden",
      "type": "Registerbekanntmachung nach dem Umwandlungsgesetz",
      "state": "Nordrhein-Westfalen",
      "amtsgericht": "Amtsgericht Coesfeld",
      "registernummer": "HRB 16013",
      "registerart": "HRB",
      "company_name": "Hof Grothues-Potthoff GmbH",
      "company_seat": "Senden",
      "details": "25.11.2025 (Bekanntmachungsdatum)\n\nNordrhein-Westfalen Amtsgericht Coesfeld HRB 16013\nRegisterbekanntmachung nach dem Umwandlungsgesetz 25.11.2025 (Eintragungsdatum)\n\nHof Grothues-Potthoff GmbH\nGesellschaft mit beschränkter Haftung\nSenden\n\nDen Gläubigern des an dem Formwechsel beteiligten Rechtsträgers ist, wenn sie binnen sechs Monaten nach dem Tag, an dem die Eintragung des Formwechsels in das Register des Sitzes desjenigen Rechtsträgers, dessen Gläubiger sie sind, nach § 19 Absatz 3 UmwG als bekanntgemacht gilt, ihren Anspruch nach Grund und Höhe schriftlich anmelden, Sicherheit zu leisten, soweit sie nicht Befriedigung verlangen können. Dieses Recht steht den Gläubigern jedoch nur zu, wenn sie glaubhaft machen, dass durch den Formwechsel die Erfüllung ihrer Forderung gefährdet wird."
    },
    {
      "date": "2025-11-25",
      "id": "138219",
      "original_text": "Registerbekanntmachung nach dem Umwandlungsgesetz\nHamburg Amtsgericht Hamburg HRB 93806\nHealth Coevo AG – Hamburg",
      "type": "Registerbekanntmachung nach dem Umwandlungsgesetz",
      "state": "Hamburg",
      "amtsgericht": "Amtsgericht Hamburg",
      "registernummer": "HRB 93806",
      "registerart": "HRB",
      "company_name": "Health Coevo AG",
      "company_seat": "Hamburg",
      "details": "25.11.2025 (Bekanntmachungsdatum)\n\nHamburg Amtsgericht Hamburg HRB 93806\nRegisterbekanntmachung nach dem Umwandlungsgesetz 25.11.2025 (Eintragungsdatum)\n\nHealth Coevo AG\nAktiengesellschaft\nHamburg\n\nAls nicht eingetragen wird bekanntgemacht:\n\n1.\tDie Health Coevo AG, mit Geschäftsanschrift in Lübeckertordamm 1-3, 20099 Hamburg, eingetragen im Handelsregister des Amtsgerichts Hamburg unter HRB 93806, hat am 17. November 2025 den Entwurf eines Verschmelzungsplans über ihre Verschmelzung mit der BAWAG P.S.K. Bank für Arbeit und Wirtschaft und Österreichische Postsparkasse Aktiengesellschaft mit dem Sitz in Wien, Österreich (Firmenbuch, FN 205340x) beim Handelsregister des Amtsgerichts Hamburg eingereicht.\n\n2.\tRechtsform, Firma und Sitz der an der grenzüberschreitenden Verschmelzung beteiligten Gesellschaften:\n\n2.1 Health Coevo AG (übertragende Rechtsträgerin):\n(a)Rechtsform: Aktiengesellschaft\n(b)Firma: Health Coevo AG\n(c)Sitz: Hamburg, Deutschland\n(d)Geschäftsanschrift: Lübeckertordamm 1-3, 20099 Hamburg.\n\n2.2\tBAWAG P.S.K. Bank für Arbeit und Wirtschaft und Österreichische Postsparkasse    Aktiengesellschaft (übernehmende Rechtsträgerin):\n(a)Rechtsform: Österreichische Aktiengesellschaft (Aktiengesellschaft)\n(b)Firma: BAWAG P.S.K. Bank für Arbeit und Wirtschaft und Österreichische Postsparkasse Aktiengesellschaft\n(c)Sitz: Wien, Österreich\n(d)Geschäftsanschrift: Wiedner Gürtel 11, 1100 Wien (Österreich).\n\n3. \tDie an der Verschmelzung beteiligten Gesellschaften sind bei nachstehenden      Registern unter folgenden Registernummern eingetragen:\n3.1 \tHealth Coevo AG:\nHandelsregister des Amtsgerichts Hamburg unter der Registernummer HRB 93806.\n3.2 \tBAWAG P.S.K. Bank für Arbeit und Wirtschaft und Österreichische Postsparkasse Aktiengesellschaft:\nFirmenbuch des Handelsgerichts Wien unter FN 205340x.\n\n4.\tHinweis an die Anteilsinhaber, Gläubiger und Betriebsräte (bzw. Arbeitnehmer)\nGemäß § 308 Abs. 1 Satz 2 Nr. 4 UmwG sind (i) die Anteilsinhaber und Gläubiger der an der grenzüberschreitenden Verschmelzung beteiligten Gesellschaften und (ii) die zuständigen Betriebsräte der an der grenzüberschreitenden Verschmelzung beteiligten Gesellschaften oder, soweit es keinen Betriebsrat gibt, die Arbeitnehmer der an der grenzüberschreitenden Verschmelzung beteiligten Gesellschaften darauf hinzuweisen, dass sie der jeweiligen Gesellschaft spätestens fünf Arbeitstage vor dem Tag der Gesellschafterversammlung Bemerkungen zum Verschmelzungsplan übermitteln können. Da es sich im vorliegenden Fall um eine Konzernverschmelzung der Enkelgesellschaft auf ihre Großmuttergesellschaft (§ 307 Abs. 3 Nr. 2 lit. c UmwG) handelt, ist ein Verschmelzungsbeschluss der Anteilsinhaber der übertragenden Gesellschaft gem. § 312 Abs. 2 UmwG nicht erforderlich. Gleichwohl wird die Hauptversammlung der Health Coevo AG einen Verschmelzungsbeschluss fassen. Die Hauptversammlung der BAWAG P.S.K. Bank für Arbeit und Wirtschaft und Österreichische Postsparkasse Aktiengesellschaft wird ebenfalls, voraussichtlich am selben Tag, einen Verschmelzungsbeschluss fassen. Für die Frist für die Übermittlung von Bemerkungen ist damit an den Tag der Durchführung der Hauptversammlungen anzuknüpfen.\n\nUnter folgender Anschrift können Bemerkungen seitens der Anteilsinhaber, der \tGläubiger sowie der zuständigen Betriebsräte bzw. der Arbeitnehmer der \t\tbeteiligten Gesellschaften bis spätestens fünf Tage vor den \t\t\t\tHauptversammlungen der Health Coevo AG und der BAWAG P.S.K. Bank für \tArbeit und Wirtschaft und Österreichische Postsparkasse Aktiengesellschaft, die \tvoraussichtlich am 12. Januar 2026 stattfinden werden, übermittelt werden:\nHealth Coevo AG, Lübeckertordamm 1-3, 20099 Hamburg (Deutschland).\n\nBAWAG P.S.K. Bank für Arbeit und Wirtschaft und Österreichische \t\t\tPostsparkasse Aktiengesellschaft, Wiedner Gürtel 11, 1100 Wien (Österreich)."
    },
    {
      "date": "2025-11-25",
      "id": "138220",
      "original_text": "Registerbekanntmachung nach dem Umwandlungsgesetz\nSaarland Amtsgericht Saarbrücken HRB 43621\nMichel Verlag GmbH – Ottweiler",
      "type": "Registerbekanntmachung nach dem Umwandlungsgesetz",
      "state": "Saarland",
      "amtsgericht": "Amtsgericht Saarbrücken",
      "registernummer": "HRB 43621",
      "registerart": "HRB",
      "company_name": "Michel Verlag GmbH",
      "company_seat": "Ottweiler",
      "details": "25.11.2025 (Bekanntmachungsdatum)\n\nSaarland Amtsgericht Saarbrücken HRB 43621\nRegisterbekanntmachung nach dem Umwandlungsgesetz 25.11.2025 (Eintragungsdatum)\n\nMichel Verlag GmbH\nGesellschaft mit beschränkter Haftung\nOttweiler\n\nAls nicht eingetragen wird bekannt gemacht: Den Gläubigern der an der Verschmelzung beteiligten Gesellschaften ist, wenn sie binnen sechs Monaten nach dem Tag, an dem die Eintragung der Verschmelzung in das Register des Sitzes desjenigen Rechtsträgers, dessen Gläubiger sie sind, nach § 19 Absatz 3 UmwG bekannt gemacht worden ist, ihren Anspruch nach Grund und Höhe schriftlich anmelden, Sicherheit zu leisten, soweit sie nicht Befriedigung verlangen können. Dieses Recht steht den Gläubigern jedoch nur zu, wenn sie glaubhaft machen, dass durch die Verschmelzung die Erfüllung ihrer Forderung gefährdet wird."
    },
    {
      "date": "2025-11-25",
      "id": "138221",
      "original_text": "Registerbekanntmachung nach dem Umwandlungsgesetz\nSaarland Amtsgericht Saarbrücken HRB 102704\nMichel Verlag Vertriebs-GmbH – Ottweiler",
      "type": "Registerbekanntmachung nach dem Umwandlungsgesetz",
      "state": "Saarland",
      "amtsgericht": "Amtsgericht Saarbrücken",
      "registernummer": "HRB 102704",
      "registerart": "HRB",
      "company_name": "Michel Verlag Vertriebs-GmbH",
      "company_seat": "Ottweiler",
      "details": "25.11.2025 (Bekanntmachungsdatum)\n\nSaarland Amtsgericht Saarbrücken HRB 102704\nRegisterbekanntmachung nach dem Umwandlungsgesetz 25.11.2025 (Eintragungsdatum)\n\nMichel Verlag Vertriebs-GmbH\nGesellschaft mit beschränkter Haftung\nOttweiler\n\nAls nicht eingetragen wird bekannt gemacht: Den Gläubigern der an der Verschmelzung beteiligten Gesellschaften ist, wenn sie binnen sechs Monaten nach dem Tag, an dem die Eintragung der Verschmelzung in das Register des Sitzes desjenigen Rechtsträgers, dessen Gläubiger sie sind, nach § 19 Absatz 3 UmwG bekannt gemacht worden ist, ihren Anspruch nach Grund und Höhe schriftlich anmelden, Sicherheit zu leisten, soweit sie nicht Befriedigung verlangen können. Dieses Recht steht den Gläubigern jedoch nur zu, wenn sie glaubhaft machen, dass durch die Verschmelzung die Erfüllung ihrer Forderung gefährdet wird."
    },
    {
      "date": "2025-11-25",
      "id": "138222",
      "original_text": "Einreichung neuer Dokumente\nBaden-Württemberg Amtsgericht Stuttgart HRB 224887\nGrün-Company Gesellschaft zur Förderung des Garten- und Landschaftsbaues in Baden-Württemberg GmbH – Leinfelden-Echterdingen",
      "type": "Einreichung neuer Dokumente",
      "state": "Baden-Württemberg",
      "amtsgericht": "Amtsgericht Stuttgart",
      "registernummer": "HRB 224887",
      "registerart": "HRB",
      "company_name": "Grün-Company Gesellschaft zur Förderung des Garten- und Landschaftsbaues in Baden-Württemberg GmbH",
      "company_seat": "Leinfelden-Echterdingen",
      "details": "25.11.2025 (Bekanntmachungsdatum)\n\nBaden-Württemberg Amtsgericht Stuttgart HRB 224887\nEinreichung neuer Dokumente\n\nGrün-Company Gesellschaft zur Förderung des Garten- und Landschaftsbaues in Baden-Württemberg GmbH\nGesellschaft mit beschränkter Haftung\nLeinfelden-Echterdingen\n\nDie Gesellschaft hat am 12.11.2025 die Liste über die Zusammensetzung des Aufsichtsrats zum Handelsregister eingereicht."
    },
    {
      "date": "2025-11-25",
      "id": "138223",
      "original_text": "Registerbekanntmachung nach dem Umwandlungsgesetz\nBerlin Amtsgericht Berlin (Charlottenburg) HRB 246850\ncmp international UG (haftungsbeschränkt) – Berlin",
      "type": "Registerbekanntmachung nach dem Umwandlungsgesetz",
      "state": "Berlin",
      "amtsgericht": "Amtsgericht Berlin (Charlottenburg)",
      "registernummer": "HRB 246850",
      "registerart": "HRB",
      "company_name": "cmp international UG (haftungsbeschränkt)",
      "company_seat": "Berlin",
      "details": "25.11.2025 (Bekanntmachungsdatum)\n\nBerlin Amtsgericht Berlin (Charlottenburg) HRB 246850\nRegisterbekanntmachung nach dem Umwandlungsgesetz 25.11.2025 (Eintragungsdatum)\n\ncmp international UG (haftungsbeschränkt)\nGesellschaft mit beschränkter Haftung\nBerlin\n\nZu Eintragungsnummer 4 vom 25.11.2025 wird als nicht eingetragen veröffentlicht: Den Gläubigern der an der Verschmelzung beteiligten Rechtsträger ist, wenn sie binnen sechs Monaten nach dem Tag, an dem die Eintragung der Verschmelzung in das Register des Sitzes desjenigen Rechtsträgers, dessen Gläubiger sie sind, als bekannt gemacht gilt, ihren Anspruch nach Grund und Höhe schriftlich anmelden, Sicherheit zu leisten, soweit sie nicht Befriedigung verlangen können. Dieses Recht steht den Gläubigern jedoch nur zu, wenn sie glaubhaft machen, dass durch die Verschmelzung die Erfüllung ihrer Forderung gefährdet wird. Das Recht, Sicherheitsleistung zu verlangen, steht Gläubigern nicht zu, die im Falle der Insolvenz ein Recht auf vorzugsweise Befriedigung aus einer Deckungsmasse haben, die nach gesetzlicher Vorschrift zu ihrem Schutz errichtet und staatlich überwacht ist."
    },
    {
      "date": "2025-11-25",
      "id": "138224",
      "original_text": "Löschungsankündigung\nSaarland Amtsgericht Saarbrücken HRB 8765\nAdam Künzer Metallrecycling GmbH – Völklingen",
      "type": "Löschungsankündigung",
      "state": "Saarland",
      "amtsgericht": "Amtsgericht Saarbrücken",
      "registernummer": "HRB 8765",
      "registerart": "HRB",
      "company_name": "Adam Künzer Metallrecycling GmbH",
      "company_seat": "Völklingen",
      "details": "25.11.2025 (Bekanntmachungsdatum)\n\nSaarland Amtsgericht Saarbrücken HRB 8765\nLöschungsankündigung\n\nAdam Künzer Metallrecycling GmbH\nGesellschaft mit beschränkter Haftung\nVölklingen\n\nEs ist beabsichtigt, die Gesellschaft von Amts wegen gemäß § 394 FamFG wegen Vermögenslosigkeit zu löschen.\nGegen die Löschung von Amts wegen ist das Rechtsmittel des Widerspruchs statthaft. Der Widerspruch ist binnen einer Frist drei Monaten beginnend mit dem Tag dieser Veröffentlichung durch Einreichen eines Widerspruchsschreibens -schriftlich oder zur Niederschrift der Geschäftsstelle beim Amtsgericht Saarbrücken, -zentrales Handelsregister-, Mainzerstr.178, 66121 Saarbrücken einzulegen.\nDer Widerspruch muss die Bezeichnung der angefochtenen Löschungsankündigung enthalten sowie die Erklärung, dass Widerspruch eingelegt wird. Er ist vom Widerspruchsführer oder seinem Bevollmächtigten zu unterzeichnen.\nDas Widerspruchsschreiben kann auch in der Form eines elektronischen Dokumentes eingereicht werden, das mit einer qualifizierten elektronischen Signatur nach dem Signaturgesetz versehen sein muss (§§ 14 Abs. 2 FamFG, 130a, 298 ZPO)."
    },
    {
      "date": "2025-11-25",
      "id": "138225",
      "original_text": "Sonstige Registerbekanntmachung\nSchleswig-Holstein Amtsgericht Pinneberg HRB 491 IZ\nItzehoer Lebensversicherungs-Aktiengesellschaft – Itzehoe",
      "type": "Sonstige Registerbekanntmachung",
      "state": "Schleswig-Holstein",
      "amtsgericht": "Amtsgericht Pinneberg",
      "registernummer": "HRB 491 IZ",
      "registerart": "HRB",
      "company_name": "Itzehoer Lebensversicherungs-Aktiengesellschaft",
      "company_seat": "Itzehoe",
      "details": "25.11.2025 (Bekanntmachungsdatum)\n\nSchleswig-Holstein Amtsgericht Pinneberg HRB 491 IZ\nSonstige Registerbekanntmachung\n\nItzehoer Lebensversicherungs-Aktiengesellschaft\nAktiengesellschaft\nItzehoe\n\nAls nicht eingetragen wird veröffentlicht:\nEs wurde gemäß §10 HBG eine neue Liste der Aufsichtsratmitglieder zum Register eingereicht."
    },
    {
      "date": "2025-11-25",
      "id": "138226",
      "original_text": "Löschungsankündigung\nSaarland Amtsgericht Saarbrücken HRB 6387\nWEYANT Gesellschaft mit beschränkter Haftung – Saarbrücken",
      "type": "Löschungsankündigung",
      "state": "Saarland",
      "amtsgericht": "Amtsgericht Saarbrücken",
      "registernummer": "HRB 6387",
      "registerart": "HRB",
      "company_name": "WEYANT Gesellschaft mit beschränkter Haftung",
      "company_seat": "Saarbrücken",
      "details": "25.11.2025 (Bekanntmachungsdatum)\n\nSaarland Amtsgericht Saarbrücken HRB 6387\nLöschungsankündigung\n\nWEYANT Gesellschaft mit beschränkter Haftung\nGesellschaft mit beschränkter Haftung\nSaarbrücken\n\nEs ist beabsichtigt, die Gesellschaft von Amts wegen gemäß § 394 FamFG wegen Vermögenslosigkeit zu löschen.\nGegen die Löschung von Amts wegen ist das Rechtsmittel des Widerspruchs statthaft. Der Widerspruch ist binnen einer Frist zwei Monaten beginnend mit dem Tag dieser Veröffentlichung durch Einreichen eines Widerspruchsschreibens -schriftlich oder zur Niederschrift der Geschäftsstelle beim Amtsgericht Saarbrücken, -zentrales Handelsregister-, Mainzerstr.178, 66121 Saarbrücken einzulegen.\nDer Widerspruch muss die Bezeichnung der angefochtenen Löschungsankündigung enthalten sowie die Erklärung, dass Widerspruch eingelegt wird. Er ist vom Widerspruchsführer oder seinem Bevollmächtigten zu unterzeichnen.\nDas Widerspruchsschreiben kann auch in der Form eines elektronischen Dokumentes eingereicht werden, das mit einer qualifizierten elektronischen Signatur nach dem Signaturgesetz versehen sein muss (§§ 14 Abs. 2 FamFG, 130a, 298 ZPO)."
    },
    {
      "date": "2025-11-25",
      "id": "138227",
      "original_text": "Löschungsankündigung\nBrandenburg Amtsgericht Potsdam HRB 32499\nKCW Grundstücksgesellschaft mbH – Werder (Havel)",
      "type": "Löschungsankündigung",
      "state": "Brandenburg",
      "amtsgericht": "Amtsgericht Potsdam",
      "registernummer": "HRB 32499",
      "registerart": "HRB",
      "company_name": "KCW Grundstücksgesellschaft mbH",
      "company_seat": "Werder (Havel)",
      "details": "25.11.2025 (Bekanntmachungsdatum)\n\nBrandenburg Amtsgericht Potsdam HRB 32499\nLöschungsankündigung\n\nKCW Grundstücksgesellschaft mbH\nGesellschaft mit beschränkter Haftung\nWerder (Havel)\n\nBei der nachstehenden Gesellschaft wird das Amtslöschungsverfahren gemäß § 394 FamFG eingeleitet. Widerspruchsfrist 8 Wochen."
    },
    {
      "date": "2025-11-25",
      "id": "138228",
      "original_text": "Registerbekanntmachung nach dem Umwandlungsgesetz\nBaden-Württemberg Amtsgericht Mannheim HRB 730955\nMidvale Holding GmbH – Karlsruhe",
      "type": "Registerbekanntmachung nach dem Umwandlungsgesetz",
      "state": "Baden-Württemberg",
      "amtsgericht": "Amtsgericht Mannheim",
      "registernummer": "HRB 730955",
      "registerart": "HRB",
      "company_name": "Midvale Holding GmbH",
      "company_seat": "Karlsruhe",
      "details": "25.11.2025 (Bekanntmachungsdatum)\n\nBaden-Württemberg Amtsgericht Mannheim HRB 730955\nRegisterbekanntmachung nach dem Umwandlungsgesetz 25.11.2025 (Eintragungsdatum)\n\nMidvale Holding GmbH\nGesellschaft mit beschränkter Haftung\nKarlsruhe\n\nDen Gläubigern der an der Verschmelzung beteiligten Rechtsträger ist, wenn sie binnen sechs Monaten nach dem Tag, an dem die Eintragung der Verschmelzung in das Register des Sitzes desjenigen Rechtsträgers, dessen Gläubiger sie sind, nach § 19 Abs. 3 UmwG als bekanntgemacht gilt, ihren Anspruch nach Grund und Höhe schriftlich anmelden, Sicherheit zu leisten, soweit sie nicht Befriedigung verlangen können. Dieses Recht steht den Gläubigern jedoch nur zu, wenn sie glaubhaft machen, dass durch die Verschmelzung die Erfüllung ihrer Forderung gefährdet wird."
    },
    {
      "date": "2025-11-25",
      "id": "138229",
      "original_text": "Registerbekanntmachung nach dem Umwandlungsgesetz\nBrandenburg Amtsgericht Potsdam HRB 35073\nMK Trading GmbH – Falkensee",
      "type": "Registerbekanntmachung nach dem Umwandlungsgesetz",
      "state": "Brandenburg",
      "amtsgericht": "Amtsgericht Potsdam",
      "registernummer": "HRB 35073",
      "registerart": "HRB",
      "company_name": "MK Trading GmbH",
      "company_seat": "Falkensee",
      "details": "25.11.2025 (Bekanntmachungsdatum)\n\nBrandenburg Amtsgericht Potsdam HRB 35073\nRegisterbekanntmachung nach dem Umwandlungsgesetz 24.11.2025 (Eintragungsdatum)\n\nMK Trading GmbH\nGesellschaft mit beschränkter Haftung\nFalkensee\n\nZu Eintragungsnummer 2 vom 24.11.2025 wird als nicht eingetragen veröffentlicht: Den Gläubigern der an der Verschmelzung beteiligten Rechtsträger ist, wenn sie binnen sechs Monaten nach dem Tag, an dem die Eintragung der Verschmelzung in das Register des Sitzes desjenigen Rechtsträgers, dessen Gläubiger sie sind, als bekannt gemacht gilt, ihren Anspruch nach Grund und Höhe schriftlich anmelden, Sicherheit zu leisten, soweit sie nicht Befriedigung verlangen können. Dieses Recht steht den Gläubigern jedoch nur zu, wenn sie glaubhaft machen, dass durch die Verschmelzung die Erfüllung ihrer Forderung gefährdet wird."
    },
    {
      "date": "2025-11-25",
      "id": "138230",
      "original_text": "Einreichung neuer Dokumente\nBrandenburg Amtsgericht Potsdam HRB 19166\nE.ON Energie Dialog GmbH – Potsdam",
      "type": "Einreichung neuer Dokumente",
      "state": "Brandenburg",
      "amtsgericht": "Amtsgericht Potsdam",
      "registernummer": "HRB 19166",
      "registerart": "HRB",
      "company_name": "E.ON Energie Dialog GmbH",
      "company_seat": "Potsdam",
      "details": "25.11.2025 (Bekanntmachungsdatum)\n\nBrandenburg Amtsgericht Potsdam HRB 19166\nEinreichung neuer Dokumente\n\nE.ON Energie Dialog GmbH\nGesellschaft mit beschränkter Haftung\nPotsdam\n\nAls nicht eingetragen wird veröffentlicht: Eine Liste der Mitglieder des Aufsichtsrates wurde zum Handelsregister eingereicht."
    },
    {
      "date": "2025-11-25",
      "id": "138231",
      "original_text": "Löschungsankündigung\nSachsen Amtsgericht Dresden HRB 6143\nWebutex-Textilpflege GmbH – Zittau",
      "type": "Löschungsankündigung",
      "state": "Sachsen",
      "amtsgericht": "Amtsgericht Dresden",
      "registernummer": "HRB 6143",
      "registerart": "HRB",
      "company_name": "Webutex-Textilpflege GmbH",
      "company_seat": "Zittau",
      "details": "25.11.2025 (Bekanntmachungsdatum)\n\nSachsen Amtsgericht Dresden HRB 6143\nLöschungsankündigung\n\nWebutex-Textilpflege GmbH\nGesellschaft mit beschränkter Haftung\nZittau\n\nDas Registergericht beabsichtigt, die im Handelsregister eingetragene Gesellschaft von Amts wegen nach § 394 FamFG zu löschen. Die Frist zu Erhebung eines Widerspruchs gegen die beabsichtigte Löschung wird auf einen Monat festgesetzt."
    },
    {
      "date": "2025-11-25",
      "id": "138232",
      "original_text": "Löschungsankündigung\nSachsen Amtsgericht Leipzig VR 5583\nBundesverband der Erinnerungskultur im Sport e.V. – Leipzig",
      "type": "Löschungsankündigung",
      "state": "Sachsen",
      "amtsgericht": "Amtsgericht Leipzig",
      "registernummer": "VR 5583",
      "registerart": "VR",
      "company_name": "Bundesverband der Erinnerungskultur im Sport e.V.",
      "company_seat": "Leipzig",
      "details": "25.11.2025 (Bekanntmachungsdatum)\n\nSachsen Amtsgericht Leipzig VR 5583\nLöschungsankündigung\n\nBundesverband der Erinnerungskultur im Sport e.V.\neingetragener Verein\nLeipzig\n\nDas Gericht beabsichtigt, gemäß § 4 Absatz 2 Ziffer 1 der Verordnung über das Vereinsregister das Registerblatt  des Vereins zu schließen, da nach Mitteilung eines ehemaligen Vorstandsmitgliedes sämtliche Mitglieder aus dem Verein ausgeschieden sind. Zur Geltendmachung eines Widerspruchs gegen die beabsichtigte Schließung wird eine Frist von einem Monat nach der Veröffentlichung bestimmt."
    },
    {
      "date": "2025-11-25",
      "id": "138233",
      "original_text": "Registerbekanntmachung nach dem Umwandlungsgesetz\nNiedersachsen Amtsgericht Walsrode HRA 205706\nHans-Ludwig Seebode Grundstücksverpachtung e.K. – Marklohe",
      "type": "Registerbekanntmachung nach dem Umwandlungsgesetz",
      "state": "Niedersachsen",
      "amtsgericht": "Amtsgericht Walsrode",
      "registernummer": "HRA 205706",
      "registerart": "HRA",
      "company_name": "Hans-Ludwig Seebode Grundstücksverpachtung e.K.",
      "company_seat": "Marklohe",
      "details": "25.11.2025 (Bekanntmachungsdatum)\n\nNiedersachsen Amtsgericht Walsrode HRA 205706\nRegisterbekanntmachung nach dem Umwandlungsgesetz 25.11.2025 (Eintragungsdatum)\n\nHans-Ludwig Seebode Grundstücksverpachtung e.K.\nEinzelkaufmann / Einzelkauffrau\nMarklohe\n\nDen Gläubigern der an der Ausgliederung beteiligten Rechtsträger ist, wenn sie binnen sechs Monaten nach dem Tag, an dem die Eintragung der Ausgliederung in das Register des Sitzes desjenigen Rechtsträgers, dessen Gläubiger sie sind, nach § 19 Abs. 3 UmwG als bekannt gemacht gilt, ihren Anspruch nach Grund und Höhe schriftlich anmelden, Sicherheit zu leisten, soweit sie nicht Befriedigung verlangen können. Dieses Recht steht den Gläubigern jedoch nur zu, wenn sie glaubhaft machen, dass durch die Ausgliederung die Erfüllung der Forderung gefährdet wird."
    },
    {
      "date": "2025-11-25",
      "id": "138234",
      "original_text": "Registerbekanntmachung nach dem Umwandlungsgesetz\nNiedersachsen Amtsgericht Walsrode HRA 205666\nGrenkowski e.K. – Oyten",
      "type": "Registerbekanntmachung nach dem Umwandlungsgesetz",
      "state": "Niedersachsen",
      "amtsgericht": "Amtsgericht Walsrode",
      "registernummer": "HRA 205666",
      "registerart": "HRA",
      "company_name": "Grenkowski e.K.",
      "company_seat": "Oyten",
      "details": "25.11.2025 (Bekanntmachungsdatum)\n\nNiedersachsen Amtsgericht Walsrode HRA 205666\nRegisterbekanntmachung nach dem Umwandlungsgesetz 25.11.2025 (Eintragungsdatum)\n\nGrenkowski e.K.\nEinzelkaufmann / Einzelkauffrau\nOyten\n\nDen Gläubigern der an der Ausgliederung beteiligten Rechtsträger ist, wenn sie binnen sechs Monaten nach dem Tag, an dem die Eintragung der Ausgliederung in das Register des Sitzes desjenigen Rechtsträgers, dessen Gläubiger sie sind, nach § 19 Abs. 3 UmwG als bekannt gemacht gilt, ihren Anspruch nach Grund und Höhe schriftlich anmelden, Sicherheit zu leisten, soweit sie nicht Befriedigung verlangen können. Dieses Recht steht den Gläubigern jedoch nur zu, wenn sie glaubhaft machen, dass durch die Ausgliederung die Erfüllung der Forderung gefährdet wird."
    },
    {
      "date": "2025-11-25",
      "id": "138235",
      "original_text": "Registerbekanntmachung nach dem Umwandlungsgesetz\nNiedersachsen Amtsgericht Walsrode HRA 205763\nKrone Immobilien & Beteiligungen GmbH & Co. KG – Achim",
      "type": "Registerbekanntmachung nach dem Umwandlungsgesetz",
      "state": "Niedersachsen",
      "amtsgericht": "Amtsgericht Walsrode",
      "registernummer": "HRA 205763",
      "registerart": "HRA",
      "company_name": "Krone Immobilien & Beteiligungen GmbH & Co. KG",
      "company_seat": "Achim",
      "details": "25.11.2025 (Bekanntmachungsdatum)\n\nNiedersachsen Amtsgericht Walsrode HRA 205763\nRegisterbekanntmachung nach dem Umwandlungsgesetz 25.11.2025 (Eintragungsdatum)\n\nKrone Immobilien & Beteiligungen GmbH & Co. KG\nKommanditgesellschaft\nAchim\n\nDen Gläubigern der an der Ausgliederung beteiligten Rechtsträger ist, wenn sie binnen sechs Monaten nach dem Tag, an dem die Eintragung der Ausgliederung in das Register des Sitzes desjenigen Rechtsträgers, dessen Gläubiger sie sind, nach § 19 Abs. 3 UmwG als bekannt gemacht gilt, ihren Anspruch nach Grund und Höhe schriftlich anmelden, Sicherheit zu leisten, soweit sie nicht Befriedigung verlangen können. Dieses Recht steht den Gläubigern jedoch nur zu, wenn sie glaubhaft machen, dass durch die Ausgliederung die Erfüllung der Forderung gefährdet wird."
    },
    {
      "date": "2025-11-25",
      "id": "138236",
      "original_text": "Registerbekanntmachung nach dem Umwandlungsgesetz\nNiedersachsen Amtsgericht Walsrode HRA 205727\nSeebode Familien GmbH & Co. KG – Marklohe",
      "type": "Registerbekanntmachung nach dem Umwandlungsgesetz",
      "state": "Niedersachsen",
      "amtsgericht": "Amtsgericht Walsrode",
      "registernummer": "HRA 205727",
      "registerart": "HRA",
      "company_name": "Seebode Familien GmbH & Co. KG",
      "company_seat": "Marklohe",
      "details": "25.11.2025 (Bekanntmachungsdatum)\n\nNiedersachsen Amtsgericht Walsrode HRA 205727\nRegisterbekanntmachung nach dem Umwandlungsgesetz 25.11.2025 (Eintragungsdatum)\n\nSeebode Familien GmbH & Co. KG\nKommanditgesellschaft\nMarklohe\n\nDen Gläubigern der an der Ausgliederung beteiligten Rechtsträger ist, wenn sie binnen sechs Monaten nach dem Tag, an dem die Eintragung der Ausgliederung in das Register des Sitzes desjenigen Rechtsträgers, dessen Gläubiger sie sind, nach § 19 Abs. 3 UmwG als bekannt gemacht gilt, ihren Anspruch nach Grund und Höhe schriftlich anmelden, Sicherheit zu leisten, soweit sie nicht Befriedigung verlangen können. Dieses Recht steht den Gläubigern jedoch nur zu, wenn sie glaubhaft machen, dass durch die Ausgliederung die Erfüllung der Forderung gefährdet wird."
    },
    {
      "date": "2025-11-25",
      "id": "138237",
      "original_text": "Löschungsankündigung\nNiedersachsen Amtsgericht Braunschweig HRB 208959\nHE Bau GmbH – Braunschweig",
      "type": "Löschungsankündigung",
      "state": "Niedersachsen",
      "amtsgericht": "Amtsgericht Braunschweig",
      "registernummer": "HRB 208959",
      "registerart": "HRB",
      "company_name": "HE Bau GmbH",
      "company_seat": "Braunschweig",
      "details": "25.11.2025 (Bekanntmachungsdatum)\n\nNiedersachsen Amtsgericht Braunschweig HRB 208959\nLöschungsankündigung 25.11.2025 (Eintragungsdatum)\n\nHE Bau GmbH\nGesellschaft mit beschränkter Haftung\nBraunschweig\n\nDas Registergericht beabsichtigt, den Geschäftsführer von Amts wegen nach § 395 FamFG zu löschen. Die Frist zur Erhebung eines Widerspruchs ist auf 1 Monat ab dieser Registerbekanntmachung festgesetzt."
    },
    {
      "date": "2025-11-25",
      "id": "138238",
      "original_text": "Löschungsankündigung\nNiedersachsen Amtsgericht Osnabrück HRB 217272\nRB Management GmbH – Bad Bentheim",
      "type": "Löschungsankündigung",
      "state": "Niedersachsen",
      "amtsgericht": "Amtsgericht Osnabrück",
      "registernummer": "HRB 217272",
      "registerart": "HRB",
      "company_name": "RB Management GmbH",
      "company_seat": "Bad Bentheim",
      "details": "25.11.2025 (Bekanntmachungsdatum)\n\nNiedersachsen Amtsgericht Osnabrück HRB 217272\nLöschungsankündigung\n\nRB Management GmbH\nGesellschaft mit beschränkter Haftung\nBad Bentheim\n\nDas Registergericht beabsichtigt, die Gesellschaft von Amts wegen nach § 394 FamFG wegen Vermögenslosigkeit zu löschen. Die Frist zur Erhebung eines Widerspruchs ist auf 1 Monat ab dieser Registerbekanntmachung festgesetzt."
    },
    {
      "date": "2025-11-25",
      "id": "138239",
      "original_text": "Registerbekanntmachung nach dem Umwandlungsgesetz\nNiedersachsen Amtsgericht Walsrode HRA 205716\nRainer Krone Immobilien e.K., Inhaber Rainer Krone – Achim",
      "type": "Registerbekanntmachung nach dem Umwandlungsgesetz",
      "state": "Niedersachsen",
      "amtsgericht": "Amtsgericht Walsrode",
      "registernummer": "HRA 205716",
      "registerart": "HRA",
      "company_name": "Rainer Krone Immobilien e.K., Inhaber Rainer Krone",
      "company_seat": "Achim",
      "details": "25.11.2025 (Bekanntmachungsdatum)\n\nNiedersachsen Amtsgericht Walsrode HRA 205716\nRegisterbekanntmachung nach dem Umwandlungsgesetz 25.11.2025 (Eintragungsdatum)\n\nRainer Krone Immobilien e.K., Inhaber Rainer Krone\nEinzelkaufmann / Einzelkauffrau\nAchim\n\nDen Gläubigern der an der Ausgliederung beteiligten Rechtsträger ist, wenn sie binnen sechs Monaten nach dem Tag, an dem die Eintragung der Ausgliederung in das Register des Sitzes desjenigen Rechtsträgers, dessen Gläubiger sie sind, nach § 19 Abs. 3 UmwG als bekannt gemacht gilt, ihren Anspruch nach Grund und Höhe schriftlich anmelden, Sicherheit zu leisten, soweit sie nicht Befriedigung verlangen können. Dieses Recht steht den Gläubigern jedoch nur zu, wenn sie glaubhaft machen, dass durch die Ausgliederung die Erfüllung der Forderung gefährdet wird."
    },
    {
      "date": "2025-11-25",
      "id": "138240",
      "original_text": "Löschungsankündigung\nNiedersachsen Amtsgericht Hildesheim HRB 203033\nBayar Industrieservice und Schleiftechnik UG (haftungsbeschränkt) – Holzminden",
      "type": "Löschungsankündigung",
      "state": "Niedersachsen",
      "amtsgericht": "Amtsgericht Hildesheim",
      "registernummer": "HRB 203033",
      "registerart": "HRB",
      "company_name": "Bayar Industrieservice und Schleiftechnik UG (haftungsbeschränkt)",
      "company_seat": "Holzminden",
      "details": "25.11.2025 (Bekanntmachungsdatum)\n\nNiedersachsen Amtsgericht Hildesheim HRB 203033\nLöschungsankündigung\n\nBayar Industrieservice und Schleiftechnik UG (haftungsbeschränkt)\nGesellschaft mit beschränkter Haftung\nHolzminden\n\nDas Registergericht beabsichtigt, die Gesellschaft von Amts wegen nach § 394 FamFG zu löschen. Die Frist zur Erhebung eines Widerspruchs ist auf 1 Monat ab dieser Registerbekanntmachung festgesetzt."
    },
    {
      "date": "2025-11-25",
      "id": "138241",
      "original_text": "Löschungsankündigung\nNiedersachsen Amtsgericht Hildesheim HRB 209493\nMarketing Service International GmbH – Ilsede",
      "type": "Löschungsankündigung",
      "state": "Niedersachsen",
      "amtsgericht": "Amtsgericht Hildesheim",
      "registernummer": "HRB 209493",
      "registerart": "HRB",
      "company_name": "Marketing Service International GmbH",
      "company_seat": "Ilsede",
      "details": "25.11.2025 (Bekanntmachungsdatum)\n\nNiedersachsen Amtsgericht Hildesheim HRB 209493\nLöschungsankündigung\n\nMarketing Service International GmbH\nGesellschaft mit beschränkter Haftung\nIlsede\n\nDas Registergericht beabsichtigt, die Gesellschaft von Amts wegen nach § 394 FamFG zu löschen. Die Frist zur Erhebung eines Widerspruchs ist auf 1 Monat ab dieser Registerbekanntmachung festgesetzt."
    },
    {
      "date": "2025-11-25",
      "id": "138242",
      "original_text": "Einreichung neuer Dokumente\nNiedersachsen Amtsgericht Göttingen HRB 204369\nVHS Göttingen Osterode gGmbH – Göttingen",
      "type": "Einreichung neuer Dokumente",
      "state": "Niedersachsen",
      "amtsgericht": "Amtsgericht Göttingen",
      "registernummer": "HRB 204369",
      "registerart": "HRB",
      "company_name": "VHS Göttingen Osterode gGmbH",
      "company_seat": "Göttingen",
      "details": "25.11.2025 (Bekanntmachungsdatum)\n\nNiedersachsen Amtsgericht Göttingen HRB 204369\nEinreichung neuer Dokumente\n\nVHS Göttingen Osterode gGmbH\nGesellschaft mit beschränkter Haftung\nGöttingen\n\nDie Liste der Mitglieder des Aufsichtsrats wurde beim Registergericht eingereicht."
    },
    {
      "date": "2025-11-25",
      "id": "138243",
      "original_text": "Registerbekanntmachung nach dem Umwandlungsgesetz\nNiedersachsen Amtsgericht Walsrode HRA 205725\nGrenimex GmbH & Co. KG – Oyten",
      "type": "Registerbekanntmachung nach dem Umwandlungsgesetz",
      "state": "Niedersachsen",
      "amtsgericht": "Amtsgericht Walsrode",
      "registernummer": "HRA 205725",
      "registerart": "HRA",
      "company_name": "Grenimex GmbH & Co. KG",
      "company_seat": "Oyten",
      "details": "25.11.2025 (Bekanntmachungsdatum)\n\nNiedersachsen Amtsgericht Walsrode HRA 205725\nRegisterbekanntmachung nach dem Umwandlungsgesetz 25.11.2025 (Eintragungsdatum)\n\nGrenimex GmbH & Co. KG\nKommanditgesellschaft\nOyten\n\nDen Gläubigern der an der Ausgliederung beteiligten Rechtsträger ist, wenn sie binnen sechs Monaten nach dem Tag, an dem die Eintragung der Ausgliederung in das Register des Sitzes desjenigen Rechtsträgers, dessen Gläubiger sie sind, nach § 19 Abs. 3 UmwG als bekannt gemacht gilt, ihren Anspruch nach Grund und Höhe schriftlich anmelden, Sicherheit zu leisten, soweit sie nicht Befriedigung verlangen können. Dieses Recht steht den Gläubigern jedoch nur zu, wenn sie glaubhaft machen, dass durch die Ausgliederung die Erfüllung der Forderung gefährdet wird."
    },
    {
      "date": "2025-11-25",
      "id": "138244",
      "original_text": "Einreichung neuer Dokumente\nRheinland-Pfalz Amtsgericht Wittlich HRB 32499\nTix AG – Irrel",
      "type": "Einreichung neuer Dokumente",
      "state": "Rheinland-Pfalz",
      "amtsgericht": "Amtsgericht Wittlich",
      "registernummer": "HRB 32499",
      "registerart": "HRB",
      "company_name": "Tix AG",
      "company_seat": "Irrel",
      "details": "25.11.2025 (Bekanntmachungsdatum)\n\nRheinland-Pfalz Amtsgericht Wittlich HRB 32499\nEinreichung neuer Dokumente\n\nTix AG\nAktiengesellschaft\nIrrel\n\nDem Registergericht ist eine neue Liste der Mitglieder des Aufsichtsrates eingereicht worden."
    },
    {
      "date": "2025-11-25",
      "id": "138245",
      "original_text": "Registerbekanntmachung nach dem Umwandlungsgesetz\nRheinland-Pfalz Amtsgericht Mainz HRB 53067\nSportMed Wollmann GmbH – Nieder-Olm",
      "type": "Registerbekanntmachung nach dem Umwandlungsgesetz",
      "state": "Rheinland-Pfalz",
      "amtsgericht": "Amtsgericht Mainz",
      "registernummer": "HRB 53067",
      "registerart": "HRB",
      "company_name": "SportMed Wollmann GmbH",
      "company_seat": "Nieder-Olm",
      "details": "25.11.2025 (Bekanntmachungsdatum)\n\nRheinland-Pfalz Amtsgericht Mainz HRB 53067\nRegisterbekanntmachung nach dem Umwandlungsgesetz 25.11.2025 (Eintragungsdatum)\n\nSportMed Wollmann GmbH\nGesellschaft mit beschränkter Haftung\nNieder-Olm\n\nDen Gläubigern der an der Verschmelzung beteiligten Gesellschaften ist, wenn sie binnen sechs Monaten nach dem Tag, an dem die Eintragung der Verschmelzung in das Register des Sitzes desjenigen Rechtsträgers, dessen Gläubiger sie sind, nach § 19 Absatz 3 UmwG als bekanntgemacht gilt, ihren Anspruch nach Grund und Höhe schriftlich anmelden, Sicherheit zu leisten, soweit sie nicht Befriedigung verlangen können. Dieses Recht steht den Gläubigern jedoch nur zu, wenn sie glaubhaft machen, dass durch die Verschmelzung die Erfüllung ihrer Forderung gefährdet wird."
    },
    {
      "date": "2025-11-25",
      "id": "138246",
      "original_text": "Registerbekanntmachung nach dem Umwandlungsgesetz\nRheinland-Pfalz Amtsgericht Koblenz HRB 21018\nECOBAT Logistics Germany GmbH – Braubach",
      "type": "Registerbekanntmachung nach dem Umwandlungsgesetz",
      "state": "Rheinland-Pfalz",
      "amtsgericht": "Amtsgericht Koblenz",
      "registernummer": "HRB 21018",
      "registerart": "HRB",
      "company_name": "ECOBAT Logistics Germany GmbH",
      "company_seat": "Braubach",
      "details": "25.11.2025 (Bekanntmachungsdatum)\n\nRheinland-Pfalz Amtsgericht Koblenz HRB 21018\nRegisterbekanntmachung nach dem Umwandlungsgesetz 25.11.2025 (Eintragungsdatum)\n\nECOBAT Logistics Germany GmbH\nGesellschaft mit beschränkter Haftung\nBraubach\n\nAls nicht eingetragen wird veröffentlicht: Den Gläubigern der an der Verschmelzung beteiligten Rechtsträger ist, wenn sie binnen sechs Monaten nach dem Tag, an dem die Eintragung der Verschmelzung in das Register des Sitzes desjenigen Rechtsträgers,dessen Gläubiger sie sind, nach § 19 Abs. 3 UmwG als bekannt gemacht gilt, ihren Anspruch nach Grund und Höhe schriftlich anmelden, Sicherheit zu leisten, soweit sie nicht Befriedigung verlangen können. Dieses Recht steht den Gläubigern jedoch nur zu, wenn sie glaubhaft machen, dass durch die Verschmelzung die Erfüllungd er Forderung gefährdet wird."
    },
    {
      "date": "2025-11-25",
      "id": "138247",
      "original_text": "Registerbekanntmachung nach dem Umwandlungsgesetz\nRheinland-Pfalz Amtsgericht Mainz HRB 53067\nSportMed Wollmann GmbH – Nieder-Olm",
      "type": "Registerbekanntmachung nach dem Umwandlungsgesetz",
      "state": "Rheinland-Pfalz",
      "amtsgericht": "Amtsgericht Mainz",
      "registernummer": "HRB 53067",
      "registerart": "HRB",
      "company_name": "SportMed Wollmann GmbH",
      "company_seat": "Nieder-Olm",
      "details": "25.11.2025 (Bekanntmachungsdatum)\n\nRheinland-Pfalz Amtsgericht Mainz HRB 53067\nRegisterbekanntmachung nach dem Umwandlungsgesetz 25.11.2025 (Eintragungsdatum)\n\nSportMed Wollmann GmbH\nGesellschaft mit beschränkter Haftung\nNieder-Olm\n\nDen Gläubigern der an der Verschmelzung beteiligten Gesellschaften ist, wenn sie binnen sechs Monaten nach dem Tag, an dem die Eintragung der Verschmelzung in das Register des Sitzes desjenigen Rechtsträgers, dessen Gläubiger sie sind, nach § 19 Absatz 3 UmwG als bekanntgemacht gilt, ihren Anspruch nach Grund und Höhe schriftlich anmelden, Sicherheit zu leisten, soweit sie nicht Befriedigung verlangen können. Dieses Recht steht den Gläubigern jedoch nur zu, wenn sie glaubhaft machen, dass durch die Verschmelzung die Erfüllung ihrer Forderung gefährdet wird."
    },
    {
      "date": "2025-11-25",
      "id": "138248",
      "original_text": "Registerbekanntmachung nach dem Umwandlungsgesetz\nRheinland-Pfalz Amtsgericht Mainz HRB 46630\nEindhoven-Allee Projekt GmbH – Mainz",
      "type": "Registerbekanntmachung nach dem Umwandlungsgesetz",
      "state": "Rheinland-Pfalz",
      "amtsgericht": "Amtsgericht Mainz",
      "registernummer": "HRB 46630",
      "registerart": "HRB",
      "company_name": "Eindhoven-Allee Projekt GmbH",
      "company_seat": "Mainz",
      "details": "25.11.2025 (Bekanntmachungsdatum)\n\nRheinland-Pfalz Amtsgericht Mainz HRB 46630\nRegisterbekanntmachung nach dem Umwandlungsgesetz 25.11.2025 (Eintragungsdatum)\n\nEindhoven-Allee Projekt GmbH\nGesellschaft mit beschränkter Haftung\nMainz\n\nAls nicht eingetragen wird veröffentlicht: Den Gläubigern der an der Verschmelzung beteiligten Rechtsträger ist, wenn sie binnen sechs Monaten nach dem Tag, an dem die Eintragung der Verschmelzung in das Register des Sitzes desjenigen Rechtsträgers, dessen Gläubiger sie sind, nach § 19 Abs. 3 UmwG als bekannt gemacht gilt, ihren Anspruch nach Grund und Höhe schriftlich anmelden, Sicherheit zu leisten, soweit sie nicht Befriedigung verlangen können. Dieses Recht steht den Gläubigern jedoch nur zu, wenn sie glaubhaft machen, dass durch die Verschmelzung die Erfüllung ihrer Forderung gefährdet wird."
    },
    {
      "date": "2025-11-25",
      "id": "138249",
      "original_text": "Löschungsankündigung\nRheinland-Pfalz Amtsgericht Koblenz HRB 27518\nTOKA GmbH – Koblenz",
      "type": "Löschungsankündigung",
      "state": "Rheinland-Pfalz",
      "amtsgericht": "Amtsgericht Koblenz",
      "registernummer": "HRB 27518",
      "registerart": "HRB",
      "company_name": "TOKA GmbH",
      "company_seat": "Koblenz",
      "details": "25.11.2025 (Bekanntmachungsdatum)\n\nRheinland-Pfalz Amtsgericht Koblenz HRB 27518\nLöschungsankündigung\n\nTOKA GmbH\nGesellschaft mit beschränkter Haftung\nKoblenz\n\nDas Registergericht beabsichtigt die Gesellschaft von Amts wegen nach § 394 FamFG zu löschen. Die Frist zur Erhebung eines Widerspruchs ist auf zwei Monate festgesetzt."
    },
    {
      "date": "2025-11-25",
      "id": "138250",
      "original_text": "Registerbekanntmachung nach dem Umwandlungsgesetz\nRheinland-Pfalz Amtsgericht Mainz HRB 52111\nSportMed Rheinhessen GmbH – Klein-Winternheim",
      "type": "Registerbekanntmachung nach dem Umwandlungsgesetz",
      "state": "Rheinland-Pfalz",
      "amtsgericht": "Amtsgericht Mainz",
      "registernummer": "HRB 52111",
      "registerart": "HRB",
      "company_name": "SportMed Rheinhessen GmbH",
      "company_seat": "Klein-Winternheim",
      "details": "25.11.2025 (Bekanntmachungsdatum)\n\nRheinland-Pfalz Amtsgericht Mainz HRB 52111\nRegisterbekanntmachung nach dem Umwandlungsgesetz 25.11.2025 (Eintragungsdatum)\n\nSportMed Rheinhessen GmbH\nGesellschaft mit beschränkter Haftung\nKlein-Winternheim\n\nDen Gläubigern der an der Verschmelzung beteiligten Gesellschaften ist, wenn sie binnen sechs Monaten nach dem Tag, an dem die Eintragung der Verschmelzung in das Register des Sitzes desjenigen Rechtsträgers, dessen Gläubiger sie sind, nach § 19 Absatz 3 UmwG als bekanntgemacht gilt, ihren Anspruch nach Grund und Höhe schriftlich anmelden, Sicherheit zu leisten, soweit sie nicht Befriedigung verlangen können. Dieses Recht steht den Gläubigern jedoch nur zu, wenn sie glaubhaft machen, dass durch die Verschmelzung die Erfüllung ihrer Forderung gefährdet wird."
    },
    {
      "date": "2025-11-25",
      "id": "138251",
      "original_text": "Registerbekanntmachung nach dem Umwandlungsgesetz\nRheinland-Pfalz Amtsgericht Montabaur HRB 30385\nFries-Aufzüge Verwaltungs GmbH – Hillscheid",
      "type": "Registerbekanntmachung nach dem Umwandlungsgesetz",
      "state": "Rheinland-Pfalz",
      "amtsgericht": "Amtsgericht Montabaur",
      "registernummer": "HRB 30385",
      "registerart": "HRB",
      "company_name": "Fries-Aufzüge Verwaltungs GmbH",
      "company_seat": "Hillscheid",
      "details": "25.11.2025 (Bekanntmachungsdatum)\n\nRheinland-Pfalz Amtsgericht Montabaur HRB 30385\nRegisterbekanntmachung nach dem Umwandlungsgesetz 25.11.2025 (Eintragungsdatum)\n\nFries-Aufzüge Verwaltungs GmbH\nGesellschaft mit beschränkter Haftung\nHillscheid\n\nAls nicht eingetragen wird veröffentlicht: Den Gläubigern der an der Verschmelzung beteiligten Rechtsträger ist, wenn sie binnen sechs Monaten nach dem Tag, an dem die Eintragung der Verschmelzung in das Register des Sitzes desjenigen Rechtsträgers, dessen Gläubiger sie sind, nach § 19 Abs. 3 UmwG als bekannt gemacht gilt, ihren Anspruch nach Grund und Höhe schriftlich anmelden, Sicherheit zu leisten, soweit sie nicht Befriedigung verlangen können. Dieses Recht steht den Gläubigern jedoch nur zu, wenn sie glaubhaft machen, dass durch die Verschmelzung die Erfüllung der Forderung gefährdet wird."
    },
    {
      "date": "2025-11-25",
      "id": "138252",
      "original_text": "Einreichung neuer Dokumente\nRheinland-Pfalz Amtsgericht Koblenz HRB 10189\nBrohltal-Eisenbahn-Gesellschaft m.b.H. – Niederzissen",
      "type": "Einreichung neuer Dokumente",
      "state": "Rheinland-Pfalz",
      "amtsgericht": "Amtsgericht Koblenz",
      "registernummer": "HRB 10189",
      "registerart": "HRB",
      "company_name": "Brohltal-Eisenbahn-Gesellschaft m.b.H.",
      "company_seat": "Niederzissen",
      "details": "25.11.2025 (Bekanntmachungsdatum)\n\nRheinland-Pfalz Amtsgericht Koblenz HRB 10189\nEinreichung neuer Dokumente\n\nBrohltal-Eisenbahn-Gesellschaft m.b.H.\nGesellschaft mit beschränkter Haftung\nNiederzissen\n\nDem Registergericht ist eine Liste der Mitglieder des Aufsichtsrates eingereicht worden."
    },
    {
      "date": "2025-11-25",
      "id": "138253",
      "original_text": "Löschungsankündigung\nRheinland-Pfalz Amtsgericht Mainz HRB 46303\nN & H Gastromanagement GmbH – Mainz",
      "type": "Löschungsankündigung",
      "state": "Rheinland-Pfalz",
      "amtsgericht": "Amtsgericht Mainz",
      "registernummer": "HRB 46303",
      "registerart": "HRB",
      "company_name": "N & H Gastromanagement GmbH",
      "company_seat": "Mainz",
      "details": "25.11.2025 (Bekanntmachungsdatum)\n\nRheinland-Pfalz Amtsgericht Mainz HRB 46303\nLöschungsankündigung\n\nN & H Gastromanagement GmbH\nGesellschaft mit beschränkter Haftung\nMainz\n\nDas Registergericht beabsichtigt die Gesellschaft von Amts wegen nach § 394 FamFG zu löschen. Die Frist zur Erhebung eines Widerspruchs ist auf einen Monat festgesetzt."
    },
    {
      "date": "2025-11-25",
      "id": "138254",
      "original_text": "Registerbekanntmachung nach dem Umwandlungsgesetz\nRheinland-Pfalz Amtsgericht Ludwigshafen a.Rhein (Ludwigshafen) HRA 62451\nSpandl Techno-Service e.K. – Bobenheim am Berg",
      "type": "Registerbekanntmachung nach dem Umwandlungsgesetz",
      "state": "Rheinland-Pfalz",
      "amtsgericht": "Amtsgericht Ludwigshafen a.Rhein (Ludwigshafen)",
      "registernummer": "HRA 62451",
      "registerart": "HRA",
      "company_name": "Spandl Techno-Service e.K.",
      "company_seat": "Bobenheim am Berg",
      "details": "25.11.2025 (Bekanntmachungsdatum)\n\nRheinland-Pfalz Amtsgericht Ludwigshafen a.Rhein (Ludwigshafen) HRA 62451\nRegisterbekanntmachung nach dem Umwandlungsgesetz 25.11.2025 (Eintragungsdatum)\n\nSpandl Techno-Service e.K.\nEinzelkaufmann / Einzelkauffrau\nBobenheim am Berg\n\nAls nicht eingetragen wird veröffentlicht: Den Gläubigern der an der Verschmelzung beteiligten Rechtsträger ist, wenn sie binnen sechs Monaten nach dem Tag, an dem die Eintragung der Verschmelzung in das Register des Sitzes desjenigen Rechtsträgers,dessen Gläubiger sie sind, nach § 19 Abs. 3 UmwG als bekannt gemacht gilt, ihren Anspruch nach Grund und Höhe schriftlich anmelden, Sicherheit zu leisten, soweit sie nicht Befriedigung verlangen können. Dieses Recht steht den Gläubigern jedoch nur zu, wenn sie glaubhaft machen, dass durch die Verschmelzung die Erfüllung der Forderung gefährdet wird."
    },
    {
      "date": "2025-11-25",
      "id": "138255",
      "original_text": "Registerbekanntmachung nach dem Umwandlungsgesetz\nRheinland-Pfalz Amtsgericht Ludwigshafen a.Rhein (Ludwigshafen) HRB 11548\nWinklbauer Techno-Service GmbH – Bobenheim am Berg",
      "type": "Registerbekanntmachung nach dem Umwandlungsgesetz",
      "state": "Rheinland-Pfalz",
      "amtsgericht": "Amtsgericht Ludwigshafen a.Rhein (Ludwigshafen)",
      "registernummer": "HRB 11548",
      "registerart": "HRB",
      "company_name": "Winklbauer Techno-Service GmbH",
      "company_seat": "Bobenheim am Berg",
      "details": "25.11.2025 (Bekanntmachungsdatum)\n\nRheinland-Pfalz Amtsgericht Ludwigshafen a.Rhein (Ludwigshafen) HRB 11548\nRegisterbekanntmachung nach dem Umwandlungsgesetz 25.11.2025 (Eintragungsdatum)\n\nWinklbauer Techno-Service GmbH\nGesellschaft mit beschränkter Haftung\nBobenheim am Berg\n\nAls nicht eingetragen wird veröffentlicht: Den Gläubigern der an der Verschmelzung beteiligten Rechtsträger ist, wenn sie binnen sechs Monaten nach dem Tag, an dem die Eintragung der Verschmelzung in das Register des Sitzes desjenigen Rechtsträgers,dessen Gläubiger sie sind, nach § 19 Abs. 3 UmwG als bekannt gemacht gilt, ihren Anspruch nach Grund und Höhe schriftlich anmelden, Sicherheit zu leisten, soweit sie nicht Befriedigung verlangen können. Dieses Recht steht den Gläubigern jedoch nur zu, wenn sie glaubhaft machen, dass durch die Verschmelzung die Erfüllungd er Forderung gefährdet wird."
    },
    {
      "date": "2025-11-25",
      "id": "138256",
      "original_text": "Löschungsankündigung\nBremen Amtsgericht Bremen HRB 39746\nMK Hansebau GmbH – Bremen",
      "type": "Löschungsankündigung",
      "state": "Bremen",
      "amtsgericht": "Amtsgericht Bremen",
      "registernummer": "HRB 39746",
      "registerart": "HRB",
      "company_name": "MK Hansebau GmbH",
      "company_seat": "Bremen",
      "details": "25.11.2025 (Bekanntmachungsdatum)\n\nBremen Amtsgericht Bremen HRB 39746\nLöschungsankündigung\n\nMK Hansebau GmbH\nGesellschaft mit beschränkter Haftung\nBremen\n\nEs ist beabsichtigt die im Handelsregister eingetragene Gesellschaft von Amts wegen gemäß § 394 FamFG zu löschen. Gegen die Löschung kann beim AG Bremen schriftlich oder zu Protokoll der Geschäftsstelle Widerspruch eingelegt werden. Widerspruchsfrist 4 Wochen."
    },
    {
      "date": "2025-11-25",
      "id": "138257",
      "original_text": "Registerbekanntmachung nach dem Umwandlungsgesetz\nBremen Amtsgericht Bremen HRA 16689\nHanseaten-Beton GmbH & Co. Kommanditgesellschaft für Betonwaren – Bremen",
      "type": "Registerbekanntmachung nach dem Umwandlungsgesetz",
      "state": "Bremen",
      "amtsgericht": "Amtsgericht Bremen",
      "registernummer": "HRA 16689",
      "registerart": "HRA",
      "company_name": "Hanseaten-Beton GmbH & Co. Kommanditgesellschaft für Betonwaren",
      "company_seat": "Bremen",
      "details": "25.11.2025 (Bekanntmachungsdatum)\n\nBremen Amtsgericht Bremen HRA 16689\nRegisterbekanntmachung nach dem Umwandlungsgesetz 19.11.2025 (Eintragungsdatum)\n\nHanseaten-Beton GmbH & Co. Kommanditgesellschaft für Betonwaren\nKommanditgesellschaft\nBremen\n\nZu Eintragungsnummer 7 vom 19.11.2025 wird als nicht eingetragen veröffentlicht: Den Gläubigern der an der Verschmelzung beteiligten Rechtsträger ist, wenn sie binnen sechs Monaten nach dem Tag, an dem die Eintragung der Verschmelzung in das Register des Sitzes desjenigen Rechtsträgers, dessen Gläubiger sie sind, als bekannt gemacht gilt, ihren Anspruch nach Grund und Höhe schriftlich anmelden, Sicherheit zu leisten, soweit sie nicht Befriedigung verlangen können. Dieses Recht steht den Gläubigern jedoch nur zu, wenn sie glaubhaft machen, dass durch die Verschmelzung die Erfüllung ihrer Forderung gefährdet wird. Das Recht, Sicherheitsleistung zu verlangen, steht Gläubigern nicht zu, die im Falle der Insolvenz ein Recht auf vorzugsweise Befriedigung aus einer Deckungsmasse haben, die nach gesetzlicher Vorschrift zu ihrem Schutz errichtet und staatlich überwacht ist."
    },
    {
      "date": "2025-11-25",
      "id": "138258",
      "original_text": "Löschungsankündigung\nBremen Amtsgericht Bremen HRB 38950\nStart Vertriebs GmbH – Bremen",
      "type": "Löschungsankündigung",
      "state": "Bremen",
      "amtsgericht": "Amtsgericht Bremen",
      "registernummer": "HRB 38950",
      "registerart": "HRB",
      "company_name": "Start Vertriebs GmbH",
      "company_seat": "Bremen",
      "details": "25.11.2025 (Bekanntmachungsdatum)\n\nBremen Amtsgericht Bremen HRB 38950\nLöschungsankündigung\n\nStart Vertriebs GmbH\nGesellschaft mit beschränkter Haftung\nBremen\n\nEs ist beabsichtigt die im Handelsregister eingetragene Gesellschaft von Amts wegen gemäß § 394 FamFG zu löschen. Gegen die Löschung kann beim AG Bremen schriftlich oder zu Protokoll der Geschäftsstelle Widerspruch eingelegt werden. Widerspruchsfrist 4 Wochen."
    },
    {
      "date": "2025-11-25",
      "id": "138259",
      "original_text": "Registerbekanntmachung nach dem Umwandlungsgesetz\nRheinland-Pfalz Amtsgericht Koblenz HRB 5532\nECOBAT Resources Germany GmbH – Braubach",
      "type": "Registerbekanntmachung nach dem Umwandlungsgesetz",
      "state": "Rheinland-Pfalz",
      "amtsgericht": "Amtsgericht Koblenz",
      "registernummer": "HRB 5532",
      "registerart": "HRB",
      "company_name": "ECOBAT Resources Germany GmbH",
      "company_seat": "Braubach",
      "details": "25.11.2025 (Bekanntmachungsdatum)\n\nRheinland-Pfalz Amtsgericht Koblenz HRB 5532\nRegisterbekanntmachung nach dem Umwandlungsgesetz 25.11.2025 (Eintragungsdatum)\n\nECOBAT Resources Germany GmbH\nGesellschaft mit beschränkter Haftung\nBraubach\n\nAls nicht eingetragen wird veröffentlicht: Den Gläubigern der an der Verschmelzung beteiligten Rechtsträger ist, wenn sie binnen sechs Monaten nach dem Tag, an dem die Eintragung der Verschmelzung in das Register des Sitzes desjenigen Rechtsträgers,dessen Gläubiger sie sind, nach § 19 Abs. 3 UmwG als bekannt gemacht gilt, ihren Anspruch nach Grund und Höhe schriftlich anmelden, Sicherheit zu leisten, soweit sie nicht Befriedigung verlangen können. Dieses Recht steht den Gläubigern jedoch nur zu, wenn sie glaubhaft machen, dass durch die Verschmelzung die Erfüllungd er Forderung gefährdet wird."
    },
    {
      "date": "2025-11-25",
      "id": "138260",
      "original_text": "Registerbekanntmachung nach dem Umwandlungsgesetz\nRheinland-Pfalz Amtsgericht Mainz HRB 52334\nKarrié Projektentwicklung GmbH – Mainz",
      "type": "Registerbekanntmachung nach dem Umwandlungsgesetz",
      "state": "Rheinland-Pfalz",
      "amtsgericht": "Amtsgericht Mainz",
      "registernummer": "HRB 52334",
      "registerart": "HRB",
      "company_name": "Karrié Projektentwicklung GmbH",
      "company_seat": "Mainz",
      "details": "25.11.2025 (Bekanntmachungsdatum)\n\nRheinland-Pfalz Amtsgericht Mainz HRB 52334\nRegisterbekanntmachung nach dem Umwandlungsgesetz 25.11.2025 (Eintragungsdatum)\n\nKarrié Projektentwicklung GmbH\nGesellschaft mit beschränkter Haftung\nMainz\n\nAls nicht eingetragen wird veröffentlicht: Den Gläubigern der an der Verschmelzung beteiligten Rechtsträger ist, wenn sie binnen sechs Monaten nach dem Tag, an dem die Eintragung der Verschmelzung in das Register des Sitzes desjenigen Rechtsträgers, dessen Gläubiger sie sind, nach § 19 Abs. 3 UmwG als bekannt gemacht gilt, ihren Anspruch nach Grund und Höhe schriftlich anmelden, Sicherheit zu leisten, soweit sie nicht Befriedigung verlangen können. Dieses Recht steht den Gläubigern jedoch nur zu, wenn sie glaubhaft machen, dass durch die Verschmelzung die Erfüllung ihrer Forderung gefährdet wird."
    },
    {
      "date": "2025-11-25",
      "id": "138261",
      "original_text": "Löschungsankündigung\nNordrhein-Westfalen Amtsgericht Köln HRB 108445\nIL Fusion GmbH – Köln",
      "type": "Löschungsankündigung",
      "state": "Nordrhein-Westfalen",
      "amtsgericht": "Amtsgericht Köln",
      "registernummer": "HRB 108445",
      "registerart": "HRB",
      "company_name": "IL Fusion GmbH",
      "company_seat": "Köln",
      "details": "25.11.2025 (Bekanntmachungsdatum)\n\nNordrhein-Westfalen Amtsgericht Köln HRB 108445\nLöschungsankündigung\n\nIL Fusion GmbH\nGesellschaft mit beschränkter Haftung\nKöln\n\nDas Registergericht beabsichtigt die Gesellschaft von Amts wegen nach § 394 FamFG zu löschen. Die Frist zur Erhebung eines Widerspruchs ist auf einen Monat festgesetzt."
    },
    {
      "date": "2025-11-25",
      "id": "138262",
      "original_text": "Löschungsankündigung\nNordrhein-Westfalen Amtsgericht Krefeld HRB 19060\nNuestro Altmetallhandel & KFZ-Teile GmbH – Willich",
      "type": "Löschungsankündigung",
      "state": "Nordrhein-Westfalen",
      "amtsgericht": "Amtsgericht Krefeld",
      "registernummer": "HRB 19060",
      "registerart": "HRB",
      "company_name": "Nuestro Altmetallhandel & KFZ-Teile GmbH",
      "company_seat": "Willich",
      "details": "25.11.2025 (Bekanntmachungsdatum)\n\nNordrhein-Westfalen Amtsgericht Krefeld HRB 19060\nLöschungsankündigung\n\nNuestro Altmetallhandel & KFZ-Teile GmbH\nGesellschaft mit beschränkter Haftung\nWillich\n\nDas Registergericht beabsichtigt die Gesellschaft von Amts wegen nach § 394 FamFG zu löschen. Die Frist zur Erhebung eines Widerspruchs ist auf einen Monat festgesetzt."
    },
    {
      "date": "2025-11-25",
      "id": "138263",
      "original_text": "Löschungsankündigung\nNordrhein-Westfalen Amtsgericht Siegen HRA 4116\nWilhelm Weinbrenner GmbH und Co KG – Kreuztal-Junkernhees",
      "type": "Löschungsankündigung",
      "state": "Nordrhein-Westfalen",
      "amtsgericht": "Amtsgericht Siegen",
      "registernummer": "HRA 4116",
      "registerart": "HRA",
      "company_name": "Wilhelm Weinbrenner GmbH und Co KG",
      "company_seat": "Kreuztal-Junkernhees",
      "details": "25.11.2025 (Bekanntmachungsdatum)\n\nNordrhein-Westfalen Amtsgericht Siegen HRA 4116\nLöschungsankündigung\n\nWilhelm Weinbrenner GmbH und Co KG\nKommanditgesellschaft\nKreuztal-Junkernhees\n\nDas Registergericht beabsichtigt die Firma von Amts wegen nach § 394 FamFG zu löschen. Die Frist zur Erhebung eines Widerspruchs ist auf einen Monat festgesetzt."
    },
    {
      "date": "2025-11-25",
      "id": "138264",
      "original_text": "Registerbekanntmachung nach dem Umwandlungsgesetz\nNordrhein-Westfalen Amtsgericht Münster HRB 20238\nCafe Extrablatt Salzstraße Gastro GmbH – Münster",
      "type": "Registerbekanntmachung nach dem Umwandlungsgesetz",
      "state": "Nordrhein-Westfalen",
      "amtsgericht": "Amtsgericht Münster",
      "registernummer": "HRB 20238",
      "registerart": "HRB",
      "company_name": "Cafe Extrablatt Salzstraße Gastro GmbH",
      "company_seat": "Münster",
      "details": "25.11.2025 (Bekanntmachungsdatum)\n\nNordrhein-Westfalen Amtsgericht Münster HRB 20238\nRegisterbekanntmachung nach dem Umwandlungsgesetz 25.11.2025 (Eintragungsdatum)\n\nCafe Extrablatt Salzstraße Gastro GmbH\nGesellschaft mit beschränkter Haftung\nMünster\n\nDen Gläubigern der an der Verschmelzung beteiligten Rechtsträger ist, wenn sie binnen sechs Monaten nach dem Tag, an dem die Eintragung der Verschmelzung in das Register des Sitzes desjenigen Rechtsträgers, dessen Gläubiger sie sind, nach § 19 Absatz 3 UmwG als bekanntgemacht gilt, ihren Anspruch nach Grund und Höhe schriftlich anmelden, Sicherheit zu leisten, soweit sie nicht Befriedigung verlangen können. Dieses Recht steht den Gläubigern jedoch nur zu, wenn sie glaubhaft machen, dass durch die Verschmelzung die Erfüllung ihrer Forderung gefährdet wird.Den Gläubigern der an der Verschmelzung beteiligten Rechtsträger ist, wenn sie binnen sechs Monaten nach dem Tag, an dem die Eintragung der Verschmelzung in das Register des Sitzes desjenigen Rechtsträgers, dessen Gläubiger sie sind, nach § 19 Absatz 3 UmwG als bekanntgemacht gilt, ihren Anspruch nach Grund und Höhe schriftlich anmelden, Sicherheit zu leisten, soweit sie nicht Befriedigung verlangen können. Dieses Recht steht den Gläubigern jedoch nur zu, wenn sie glaubhaft machen, dass durch die Verschmelzung die Erfüllung ihrer Forderung gefährdet wird."
    },
    {
      "date": "2025-11-25",
      "id": "138265",
      "original_text": "Löschungsankündigung\nNordrhein-Westfalen Amtsgericht Wuppertal HRB 20956\nC.P.S. (Car Protection Solutions) Vertriebs- und Entwicklungs-GmbH – Haan",
      "type": "Löschungsankündigung",
      "state": "Nordrhein-Westfalen",
      "amtsgericht": "Amtsgericht Wuppertal",
      "registernummer": "HRB 20956",
      "registerart": "HRB",
      "company_name": "C.P.S. (Car Protection Solutions) Vertriebs- und Entwicklungs-GmbH",
      "company_seat": "Haan",
      "details": "25.11.2025 (Bekanntmachungsdatum)\n\nNordrhein-Westfalen Amtsgericht Wuppertal HRB 20956\nLöschungsankündigung\n\nC.P.S. (Car Protection Solutions) Vertriebs- und Entwicklungs-GmbH\nGesellschaft mit beschränkter Haftung\nHaan\n\nDas Registergericht beabsichtigt die Gesellschaft von Amts wegen nach § 394 FamFG zu löschen. Die Frist zur Erhebung eines Widerspruchs ist auf einen Monat festgesetzt."
    },
    {
      "date": "2025-11-25",
      "id": "138266",
      "original_text": "Registerbekanntmachung nach dem Umwandlungsgesetz\nNordrhein-Westfalen Amtsgericht Düsseldorf HRA 27730\nLysiros Aachen ME SARL & Co. KG – Düsseldorf",
      "type": "Registerbekanntmachung nach dem Umwandlungsgesetz",
      "state": "Nordrhein-Westfalen",
      "amtsgericht": "Amtsgericht Düsseldorf",
      "registernummer": "HRA 27730",
      "registerart": "HRA",
      "company_name": "Lysiros Aachen ME SARL & Co. KG",
      "company_seat": "Düsseldorf",
      "details": "25.11.2025 (Bekanntmachungsdatum)\n\nNordrhein-Westfalen Amtsgericht Düsseldorf HRA 27730\nRegisterbekanntmachung nach dem Umwandlungsgesetz 25.11.2025 (Eintragungsdatum)\n\nLysiros Aachen ME SARL & Co. KG\nKommanditgesellschaft\nDüsseldorf\n\nDen Gläubigern der an der formwechselnden Umwandlung beteiligten Rechtsträger ist, wenn sie binnen sechs Monaten nach dem Tag, an dem die Eintragung der formwechselnden Umwandlung in das Register des Sitzes desjenigen Rechtsträgers, dessen Gläubiger sie sind, nach § 19 Absatz 3 UmwG als bekanntgemacht gilt, ihren Anspruch nach Grund und Höhe schriftlich anmelden, Sicherheit zu leisten, soweit sie nicht Befriedigung verlangen können. Dieses Recht steht den Gläubigern jedoch nur zu, wenn sie glaubhaft machen, dass durch die formwechselnden Umwandlung die Erfüllung ihrer Forderung gefährdet wird."
    },
    {
      "date": "2025-11-25",
      "id": "138267",
      "original_text": "Sonstige Registerbekanntmachung\nNordrhein-Westfalen Amtsgericht Aachen HRB 5119\nISRA PARSYTEC GmbH – Aachen",
      "type": "Sonstige Registerbekanntmachung",
      "state": "Nordrhein-Westfalen",
      "amtsgericht": "Amtsgericht Aachen",
      "registernummer": "HRB 5119",
      "registerart": "HRB",
      "company_name": "ISRA PARSYTEC GmbH",
      "company_seat": "Aachen",
      "details": "25.11.2025 (Bekanntmachungsdatum)\n\nNordrhein-Westfalen Amtsgericht Aachen HRB 5119\nSonstige Registerbekanntmachung 25.11.2025 (Eintragungsdatum)\n\nISRA PARSYTEC GmbH\nGesellschaft mit beschränkter Haftung\nAachen\n\nAls nicht eingetragen wird veröffentlicht: Den Gläubigern der Gesellschaft, deren Forderungen begründet worden sind bevor die Eintragung der Beendigung des Beherrschungs- und Gewinnabführungsvertrages  in das Handelsregister nach § 10 des Handelsgesetzbuches als bekanntgemacht gilt, hat der andere Vertragsteil Sicherheit zu leisten, wenn sie sich binnen sechs Monaten nach der Bekanntmachung der Eintragung zu diesem Zweck bei ihm melden."
    },
    {
      "date": "2025-11-25",
      "id": "138268",
      "original_text": "Löschungsankündigung\nNordrhein-Westfalen Amtsgericht Köln HRB 95014\nESH GmbH – Köln",
      "type": "Löschungsankündigung",
      "state": "Nordrhein-Westfalen",
      "amtsgericht": "Amtsgericht Köln",
      "registernummer": "HRB 95014",
      "registerart": "HRB",
      "company_name": "ESH GmbH",
      "company_seat": "Köln",
      "details": "25.11.2025 (Bekanntmachungsdatum)\n\nNordrhein-Westfalen Amtsgericht Köln HRB 95014\nLöschungsankündigung\n\nESH GmbH\nGesellschaft mit beschränkter Haftung\nKöln\n\nDas Registergericht beabsichtigt die Gesellschaft von Amts wegen nach § 394 FamFG zu löschen. Die Frist zur Erhebung eines Widerspruchs ist auf einen Monat festgesetzt."
    },
    {
      "date": "2025-11-25",
      "id": "138269",
      "original_text": "Löschungsankündigung\nNordrhein-Westfalen Amtsgericht Kleve HRB 10408\nSQL consultants GmbH – Emmerich am Rhein",
      "type": "Löschungsankündigung",
      "state": "Nordrhein-Westfalen",
      "amtsgericht": "Amtsgericht Kleve",
      "registernummer": "HRB 10408",
      "registerart": "HRB",
      "company_name": "SQL consultants GmbH",
      "company_seat": "Emmerich am Rhein",
      "details": "25.11.2025 (Bekanntmachungsdatum)\n\nNordrhein-Westfalen Amtsgericht Kleve HRB 10408\nLöschungsankündigung\n\nSQL consultants GmbH\nGesellschaft mit beschränkter Haftung\nEmmerich am Rhein\n\nDas Registergericht beabsichtigt die Gesellschaft von Amts wegen nach § 394 FamFG zu löschen. Die Frist zur Erhebung eines Widerspruchs ist auf einen Monat festgesetzt."
    },
    {
      "date": "2025-11-25",
      "id": "138270",
      "original_text": "Registerbekanntmachung nach dem Umwandlungsgesetz\nNordrhein-Westfalen Amtsgericht Bielefeld HRB 35294\nStockmeier Food Verwaltungs GmbH – Bielefeld",
      "type": "Registerbekanntmachung nach dem Umwandlungsgesetz",
      "state": "Nordrhein-Westfalen",
      "amtsgericht": "Amtsgericht Bielefeld",
      "registernummer": "HRB 35294",
      "registerart": "HRB",
      "company_name": "Stockmeier Food Verwaltungs GmbH",
      "company_seat": "Bielefeld",
      "details": "25.11.2025 (Bekanntmachungsdatum)\n\nNordrhein-Westfalen Amtsgericht Bielefeld HRB 35294\nRegisterbekanntmachung nach dem Umwandlungsgesetz 25.11.2025 (Eintragungsdatum)\n\nStockmeier Food Verwaltungs GmbH\nGesellschaft mit beschränkter Haftung\nBielefeld\n\nDen Gläubigern der an der Verschmelzung beteiligten Rechtsträger ist, wenn sie binnen sechs Monaten nach dem Tag, an dem die Eintragung der Verschmelzung in das Register des Sitzes desjenigen Rechtsträgers, dessen Gläubiger sie sind, nach § 19 Absatz 3 UmwG als bekanntgemacht gilt, ihren Anspruch nach Grund und Höhe schriftlich anmelden, Sicherheit zu leisten, soweit sie nicht Befriedigung verlangen können. Dieses Recht steht den Gläubigern jedoch nur zu, wenn sie glaubhaft machen, dass durch die Verschmelzung die Erfüllung ihrer Forderung gefährdet wird."
    },
    {
      "date": "2025-11-25",
      "id": "138271",
      "original_text": "Registerbekanntmachung nach dem Umwandlungsgesetz\nNordrhein-Westfalen Amtsgericht Düsseldorf HRA 20320\nNABORO SARL & Co. KG – Düsseldorf",
      "type": "Registerbekanntmachung nach dem Umwandlungsgesetz",
      "state": "Nordrhein-Westfalen",
      "amtsgericht": "Amtsgericht Düsseldorf",
      "registernummer": "HRA 20320",
      "registerart": "HRA",
      "company_name": "NABORO SARL & Co. KG",
      "company_seat": "Düsseldorf",
      "details": "25.11.2025 (Bekanntmachungsdatum)\n\nNordrhein-Westfalen Amtsgericht Düsseldorf HRA 20320\nRegisterbekanntmachung nach dem Umwandlungsgesetz 25.11.2025 (Eintragungsdatum)\n\nNABORO SARL & Co. KG\nKommanditgesellschaft\nDüsseldorf\n\nDen Gläubigern der an der formwechselnden Umwandlung beteiligten Rechtsträger ist, wenn sie binnen sechs Monaten nach dem Tag, an dem die Eintragung der formwechselnden Umwandlung in das Register des Sitzes desjenigen Rechtsträgers, dessen Gläubiger sie sind, nach § 19 Absatz 3 UmwG als bekanntgemacht gilt, ihren Anspruch nach Grund und Höhe schriftlich anmelden, Sicherheit zu leisten, soweit sie nicht Befriedigung verlangen können. Dieses Recht steht den Gläubigern jedoch nur zu, wenn sie glaubhaft machen, dass durch die formwechselnden Umwandlung die Erfüllung ihrer Forderung gefährdet wird."
    },
    {
      "date": "2025-11-25",
      "id": "138272",
      "original_text": "Löschungsankündigung\nNordrhein-Westfalen Amtsgericht Köln HRB 107364\nTextec 8 GmbH – Köln",
      "type": "Löschungsankündigung",
      "state": "Nordrhein-Westfalen",
      "amtsgericht": "Amtsgericht Köln",
      "registernummer": "HRB 107364",
      "registerart": "HRB",
      "company_name": "Textec 8 GmbH",
      "company_seat": "Köln",
      "details": "25.11.2025 (Bekanntmachungsdatum)\n\nNordrhein-Westfalen Amtsgericht Köln HRB 107364\nLöschungsankündigung\n\nTextec 8 GmbH\nGesellschaft mit beschränkter Haftung\nKöln\n\nDas Registergericht beabsichtigt die Gesellschaft von Amts wegen nach § 394 FamFG zu löschen. Die Frist zur Erhebung eines Widerspruchs ist auf einen Monat festgesetzt."
    },
    {
      "date": "2025-11-25",
      "id": "138273",
      "original_text": "Einreichung neuer Dokumente\nNordrhein-Westfalen Amtsgericht Bonn HRB 20117\nemetriq GmbH – Bonn",
      "type": "Einreichung neuer Dokumente",
      "state": "Nordrhein-Westfalen",
      "amtsgericht": "Amtsgericht Bonn",
      "registernummer": "HRB 20117",
      "registerart": "HRB",
      "company_name": "emetriq GmbH",
      "company_seat": "Bonn",
      "details": "25.11.2025 (Bekanntmachungsdatum)\n\nNordrhein-Westfalen Amtsgericht Bonn HRB 20117\nEinreichung neuer Dokumente\n\nemetriq GmbH\nGesellschaft mit beschränkter Haftung\nBonn\n\nDem Registergericht ist eine neue Liste der Mitglieder des Aufsichtsrates eingereicht worden."
    },
    {
      "date": "2025-11-25",
      "id": "138274",
      "original_text": "Löschungsankündigung\nNordrhein-Westfalen Amtsgericht Duisburg HRB 39008\nTickoria UG (haftungsbeschränkt) – Wesel",
      "type": "Löschungsankündigung",
      "state": "Nordrhein-Westfalen",
      "amtsgericht": "Amtsgericht Duisburg",
      "registernummer": "HRB 39008",
      "registerart": "HRB",
      "company_name": "Tickoria UG (haftungsbeschränkt)",
      "company_seat": "Wesel",
      "details": "25.11.2025 (Bekanntmachungsdatum)\n\nNordrhein-Westfalen Amtsgericht Duisburg HRB 39008\nLöschungsankündigung 25.11.2025 (Eintragungsdatum)\n\nTickoria UG (haftungsbeschränkt)\nGesellschaft mit beschränkter Haftung\nWesel\n\nHRB 39008:\nTickoria UG (haftungsbeschränkt), Wesel\nBoschstraße 16, 47533 Kleve.\nDas Registergericht beabsichtigt, die im Handelsregister eingetragene Gesellschaft gemäß § 394 FamFG wegen Vermögenslosigkeit von Amts wegen zu löschen. Gegen diese Verfügung kann Widerspruch eingelegt werden. Die Frist zur Erhebung eines Widerspruchs gegen die beabsichtigte Löschung von Amts wegen ist auf drei Monate festgesetzt.\nRechtsbehelfsbelehrung Der Widerspruch ist bei dem Amtsgericht Duisburg, Kardinal-Galen-Str. 124-132, 47058 Duisburg schriftlich in deutscher Sprache oder zur Niederschrift der Geschäftsstelle einzulegen. Der Widerspruch kann auch zur Niederschrift der Geschäftsstelle eines jeden Amtsgerichtes abgegeben werden. Die Einlegung ist auch durch Übertragung eines elektronischen Dokuments an die elektronische Poststelle des Gerichts möglich. Das elektronische Dokument muss für die Bearbeitung durch das Gericht geeignet und mit einer qualifizierten elektronischen Signatur der verantwortenden Person versehen sein oder von der verantwortenden Person signiert und auf einem sicheren Übermittlungsweg gemäß § 130 a ZPO nach näherer Maßgabe der Verordnung über die technischen Rahmenbedingungen des elektronischen Rechtsverkehrs und über das besondere elektronische Behördenpostfach (BGBl. I, S. 3803) eingereicht werden. Weitere Informationen erhalten Sie auf der Internetseite www.justiz.de <http://www.justiz.de>. Der Widerspruch muss spätestens innerhalb der gesetzten Frist bei dem Amtsgericht Duisburg eingegangen sein. Dies gilt auch dann, wenn der Widerspruch zur Niederschrift der Geschäftsstelle eines anderen Amtsgerichtes abgegeben wurde. Die Frist beginnt mit der Veröffentlichung. Fällt das Ende der Frist auf einen Sonntag, einen allgemeinen Feiertag oder Sonnabend, so endet die Frist mit Ablauf des nächsten Werktages. Der Widerspruch muss die Bezeichnung der angefochtenen Verfügung sowie die Erklärung enthalten, dass Widerspruch gegen diese Verfügung eingelegt wird. Er ist zu unterzeichnen und soll begründet werden."
    },
    {
      "date": "2025-11-25",
      "id": "138275",
      "original_text": "Einreichung neuer Dokumente\nNordrhein-Westfalen Amtsgericht Dortmund HRB 20214\nADLER Versicherung AG – Dortmund",
      "type": "Einreichung neuer Dokumente",
      "state": "Nordrhein-Westfalen",
      "amtsgericht": "Amtsgericht Dortmund",
      "registernummer": "HRB 20214",
      "registerart": "HRB",
      "company_name": "ADLER Versicherung AG",
      "company_seat": "Dortmund",
      "details": "25.11.2025 (Bekanntmachungsdatum)\n\nNordrhein-Westfalen Amtsgericht Dortmund HRB 20214\nEinreichung neuer Dokumente 22.11.2025 (Eintragungsdatum)\n\nADLER Versicherung AG\nAktiengesellschaft\nDortmund\n\nDem Registergericht ist eine Liste der Mitglieder des Aufsichtsrates eingereicht worden."
    },
    {
      "date": "2025-11-25",
      "id": "138276",
      "original_text": "Registerbekanntmachung nach dem Umwandlungsgesetz\nNordrhein-Westfalen Amtsgericht Düsseldorf HRA 27608\nPaxos Braunschweig SARL & Co. KG – Düsseldorf",
      "type": "Registerbekanntmachung nach dem Umwandlungsgesetz",
      "state": "Nordrhein-Westfalen",
      "amtsgericht": "Amtsgericht Düsseldorf",
      "registernummer": "HRA 27608",
      "registerart": "HRA",
      "company_name": "Paxos Braunschweig SARL & Co. KG",
      "company_seat": "Düsseldorf",
      "details": "25.11.2025 (Bekanntmachungsdatum)\n\nNordrhein-Westfalen Amtsgericht Düsseldorf HRA 27608\nRegisterbekanntmachung nach dem Umwandlungsgesetz 25.11.2025 (Eintragungsdatum)\n\nPaxos Braunschweig SARL & Co. KG\nKommanditgesellschaft\nDüsseldorf\n\nDen Gläubigern der an der formwechselnden Umwandlung beteiligten Rechtsträger ist, wenn sie binnen sechs Monaten nach dem Tag, an dem die Eintragung der formwechselnden Umwandlung in das Register des Sitzes desjenigen Rechtsträgers, dessen Gläubiger sie sind, nach § 19 Absatz 3 UmwG als bekanntgemacht gilt, ihren Anspruch nach Grund und Höhe schriftlich anmelden, Sicherheit zu leisten, soweit sie nicht Befriedigung verlangen können. Dieses Recht steht den Gläubigern jedoch nur zu, wenn sie glaubhaft machen, dass durch die formwechselnden Umwandlung die Erfüllung ihrer Forderung gefährdet wird."
    },
    {
      "date": "2025-11-25",
      "id": "138277",
      "original_text": "Einreichung neuer Dokumente\nNordrhein-Westfalen Amtsgericht Hamm HRB 11565\nSolventum Germany GmbH – Kamen",
      "type": "Einreichung neuer Dokumente",
      "state": "Nordrhein-Westfalen",
      "amtsgericht": "Amtsgericht Hamm",
      "registernummer": "HRB 11565",
      "registerart": "HRB",
      "company_name": "Solventum Germany GmbH",
      "company_seat": "Kamen",
      "details": "25.11.2025 (Bekanntmachungsdatum)\n\nNordrhein-Westfalen Amtsgericht Hamm HRB 11565\nEinreichung neuer Dokumente 25.11.2025 (Eintragungsdatum)\n\nSolventum Germany GmbH\nGesellschaft mit beschränkter Haftung\nKamen\n\nDem Registergericht ist eine neue Liste der Mitglieder des Aufsichtsrates eingereicht worden."
    },
    {
      "date": "2025-11-25",
      "id": "138278",
      "original_text": "Registerbekanntmachung nach dem Umwandlungsgesetz\nNordrhein-Westfalen Amtsgericht Düsseldorf HRA 20613\nNaxos Objekt Lüdenscheid SARL & Co. KG – Düsseldorf",
      "type": "Registerbekanntmachung nach dem Umwandlungsgesetz",
      "state": "Nordrhein-Westfalen",
      "amtsgericht": "Amtsgericht Düsseldorf",
      "registernummer": "HRA 20613",
      "registerart": "HRA",
      "company_name": "Naxos Objekt Lüdenscheid SARL & Co. KG",
      "company_seat": "Düsseldorf",
      "details": "25.11.2025 (Bekanntmachungsdatum)\n\nNordrhein-Westfalen Amtsgericht Düsseldorf HRA 20613\nRegisterbekanntmachung nach dem Umwandlungsgesetz 25.11.2025 (Eintragungsdatum)\n\nNaxos Objekt Lüdenscheid SARL & Co. KG\nKommanditgesellschaft\nDüsseldorf\n\nDen Gläubigern der an der formwechselnden Umwandlung beteiligten Rechtsträger ist, wenn sie binnen sechs Monaten nach dem Tag, an dem die Eintragung der formwechselnden Umwandlung in das Register des Sitzes desjenigen Rechtsträgers, dessen Gläubiger sie sind, nach § 19 Absatz 3 UmwG als bekanntgemacht gilt, ihren Anspruch nach Grund und Höhe schriftlich anmelden, Sicherheit zu leisten, soweit sie nicht Befriedigung verlangen können. Dieses Recht steht den Gläubigern jedoch nur zu, wenn sie glaubhaft machen, dass durch die formwechselnden Umwandlung die Erfüllung ihrer Forderung gefährdet wird."
    },
    {
      "date": "2025-11-25",
      "id": "138279",
      "original_text": "Einreichung neuer Dokumente\nNordrhein-Westfalen Amtsgericht Mönchengladbach HRB 9523\nViersener Aktien-Baugesellschaft, Aktiengesellschaft – Viersen",
      "type": "Einreichung neuer Dokumente",
      "state": "Nordrhein-Westfalen",
      "amtsgericht": "Amtsgericht Mönchengladbach",
      "registernummer": "HRB 9523",
      "registerart": "HRB",
      "company_name": "Viersener Aktien-Baugesellschaft, Aktiengesellschaft",
      "company_seat": "Viersen",
      "details": "25.11.2025 (Bekanntmachungsdatum)\n\nNordrhein-Westfalen Amtsgericht Mönchengladbach HRB 9523\nEinreichung neuer Dokumente 14.11.2025 (Eintragungsdatum)\n\nViersener Aktien-Baugesellschaft, Aktiengesellschaft\nAktiengesellschaft\nViersen\n\n106 AktG\nDem Registergericht ist eine Liste der Mitglieder des Aufsichtsrates eingereicht worden."
    },
    {
      "date": "2025-11-25",
      "id": "138280",
      "original_text": "Löschungsankündigung\nNordrhein-Westfalen Amtsgericht Neuss HRB 21443\nAS Geflügel & Fleischhandel GmbH – Neuss",
      "type": "Löschungsankündigung",
      "state": "Nordrhein-Westfalen",
      "amtsgericht": "Amtsgericht Neuss",
      "registernummer": "HRB 21443",
      "registerart": "HRB",
      "company_name": "AS Geflügel & Fleischhandel GmbH",
      "company_seat": "Neuss",
      "details": "25.11.2025 (Bekanntmachungsdatum)\n\nNordrhein-Westfalen Amtsgericht Neuss HRB 21443\nLöschungsankündigung 25.11.2025 (Eintragungsdatum)\n\nAS Geflügel & Fleischhandel GmbH\nGesellschaft mit beschränkter Haftung\nNeuss\n\nDas Registergericht beabsichtigt die Gesellschaft wegen Vermögenslosigkeit aufgrund des § 394 Abs. 1 FamFG zu löschen. Frist zur Geltendmachung eines Widerspruchs: 1 Monat.\nRechtsbehelfsbelehrung:\nGegen diese Verfügung können Sie Widerspruch einlegen.\nDer Widerspruch ist bei dem Amtsgericht Neuss - Registergericht -, Breite Str. 48, 41460 Neuss schriftlich in deutscher Sprache oder zur Niederschrift der Geschäftsstelle einzulegen.\nDer Widerspruch kann auch zur Niederschrift der Geschäftsstelle eines jeden Amtsgerichtes abgegeben werden.\nDie Einlegung ist auch durch Übertragung eines elektronischen Dokuments an die elektronische Poststelle des Gerichts möglich. Das elektronische Dokument muss für die Bearbeitung durch das Gericht geeignet und mit einer qualifizierten elektronischen Signatur der verantwortenden Person versehen sein oder von der verantwortenden Person signiert und auf einem sicheren Übermittlungsweg gemäß § 130a ZPO nach näherer Maßgabe der Verordnung über die technischen Rahmenbedingungen des elektronischen Rechtsverkehrs und über das besondere elektronische Behördenpostfach (BGBl. I, S.3803) eingereicht werden. Weitere Informationen erhalten Sie auf der Internetseite www.justiz.de.\nDer Widerspruch muss spätestens innerhalb der gesetzten Frist nach der schriftlichen Bekanntgabe der Verfügung bei dem Amtsgericht - Registergericht - Neuss eingegangen sein. Dies gilt auch dann, wenn der Widerspruch zur Niederschrift der Geschäftsstelle eines anderen Amtsgerichtes abgegeben wurde. Die Frist beginnt mit der schriftlichen Bekanntgabe der Verfügung. Die Bekanntgabe ist entweder durch Zustellung oder am dritten Tage nach Aufgabe zur Post bewirkt. Fällt das Ende der Frist auf einen Sonntag, einen allgemeinen Feiertag oder Sonnabend, so endet die Frist mit Ablauf des nächsten Werktages.\nDer Widerspruch muss die Bezeichnung der angefochtenen Verfügung sowie die Erklärung enthalten, dass Widerspruch gegen diese Verfügung eingelegt wird. Er ist zu unterzeichnen und soll begründet werden."
    },
    {
      "date": "2025-11-25",
      "id": "138281",
      "original_text": "Registerbekanntmachung nach dem Umwandlungsgesetz\nNordrhein-Westfalen Amtsgericht Düsseldorf HRA 26808\nKELIOS Grundstücks SARL & Co. KG – Düsseldorf",
      "type": "Registerbekanntmachung nach dem Umwandlungsgesetz",
      "state": "Nordrhein-Westfalen",
      "amtsgericht": "Amtsgericht Düsseldorf",
      "registernummer": "HRA 26808",
      "registerart": "HRA",
      "company_name": "KELIOS Grundstücks SARL & Co. KG",
      "company_seat": "Düsseldorf",
      "details": "25.11.2025 (Bekanntmachungsdatum)\n\nNordrhein-Westfalen Amtsgericht Düsseldorf HRA 26808\nRegisterbekanntmachung nach dem Umwandlungsgesetz 25.11.2025 (Eintragungsdatum)\n\nKELIOS Grundstücks SARL & Co. KG\nKommanditgesellschaft\nDüsseldorf\n\nDen Gläubigern der an der formwechselnden Umwandlung beteiligten Rechtsträger ist, wenn sie binnen sechs Monaten nach dem Tag, an dem die Eintragung der formwechselnden Umwandlung in das Register des Sitzes desjenigen Rechtsträgers, dessen Gläubiger sie sind, nach § 19 Absatz 3 UmwG als bekanntgemacht gilt, ihren Anspruch nach Grund und Höhe schriftlich anmelden, Sicherheit zu leisten, soweit sie nicht Befriedigung verlangen können. Dieses Recht steht den Gläubigern jedoch nur zu, wenn sie glaubhaft machen, dass durch die formwechselnden Umwandlung die Erfüllung ihrer Forderung gefährdet wird."
    },
    {
      "date": "2025-11-25",
      "id": "138282",
      "original_text": "Löschungsankündigung\nNordrhein-Westfalen Amtsgericht Wuppertal HRB 30240\nADVO AVIATION UG (haftungsbeschränkt) – Wuppertal",
      "type": "Löschungsankündigung",
      "state": "Nordrhein-Westfalen",
      "amtsgericht": "Amtsgericht Wuppertal",
      "registernummer": "HRB 30240",
      "registerart": "HRB",
      "company_name": "ADVO AVIATION UG (haftungsbeschränkt)",
      "company_seat": "Wuppertal",
      "details": "25.11.2025 (Bekanntmachungsdatum)\n\nNordrhein-Westfalen Amtsgericht Wuppertal HRB 30240\nLöschungsankündigung 24.11.2025 (Eintragungsdatum)\n\nADVO AVIATION UG (haftungsbeschränkt)\nGesellschaft mit beschränkter Haftung\nWuppertal\n\nDas Registergericht beabsichtigt die Gesellschaft von Amts wegen nach § 394 FamFG zu löschen. Die Frist zur Erhebung eines Widerspruchs ist auf einen Monat festgesetzt."
    },
    {
      "date": "2025-11-25",
      "id": "138283",
      "original_text": "Löschungsankündigung\nNordrhein-Westfalen Amtsgericht Köln HRB 72546\nHRL European River Cruise Ventures II GmbH – Köln",
      "type": "Löschungsankündigung",
      "state": "Nordrhein-Westfalen",
      "amtsgericht": "Amtsgericht Köln",
      "registernummer": "HRB 72546",
      "registerart": "HRB",
      "company_name": "HRL European River Cruise Ventures II GmbH",
      "company_seat": "Köln",
      "details": "25.11.2025 (Bekanntmachungsdatum)\n\nNordrhein-Westfalen Amtsgericht Köln HRB 72546\nLöschungsankündigung\n\nHRL European River Cruise Ventures II GmbH\nGesellschaft mit beschränkter Haftung\nKöln\n\nDas Registergericht beabsichtigt die Gesellschaft von Amts wegen nach § 394 FamFG zu löschen. Die Frist zur Erhebung eines Widerspruchs ist auf einen Monat festgesetzt."
    },
    {
      "date": "2025-11-25",
      "id": "138284",
      "original_text": "Löschungsankündigung\nNordrhein-Westfalen Amtsgericht Dortmund HRB 26436\nBBC GmbH Brinkmann Building Company – Dortmund",
      "type": "Löschungsankündigung",
      "state": "Nordrhein-Westfalen",
      "amtsgericht": "Amtsgericht Dortmund",
      "registernummer": "HRB 26436",
      "registerart": "HRB",
      "company_name": "BBC GmbH Brinkmann Building Company",
      "company_seat": "Dortmund",
      "details": "25.11.2025 (Bekanntmachungsdatum)\n\nNordrhein-Westfalen Amtsgericht Dortmund HRB 26436\nLöschungsankündigung\n\nBBC GmbH Brinkmann Building Company\nGesellschaft mit beschränkter Haftung\nDortmund\n\nDas Registergericht beabsichtigt die Gesellschaft von Amts wegen nach § 394 FamFG zu löschen. Die Frist zur Erhebung eines Widerspruchs ist auf zwei Monate festgesetzt."
    },
    {
      "date": "2025-11-25",
      "id": "138285",
      "original_text": "Löschungsankündigung\nNordrhein-Westfalen Amtsgericht Duisburg HRB 26416\nKäse-Partners GmbH – Oberhausen",
      "type": "Löschungsankündigung",
      "state": "Nordrhein-Westfalen",
      "amtsgericht": "Amtsgericht Duisburg",
      "registernummer": "HRB 26416",
      "registerart": "HRB",
      "company_name": "Käse-Partners GmbH",
      "company_seat": "Oberhausen",
      "details": "25.11.2025 (Bekanntmachungsdatum)\n\nNordrhein-Westfalen Amtsgericht Duisburg HRB 26416\nLöschungsankündigung\n\nKäse-Partners GmbH\nGesellschaft mit beschränkter Haftung\nOberhausen\n\nAmtsgericht Duisburg\nHRB 26416\nKäse-Partners GmbH, Oberhausen\nDas Registergericht beabsichtigt, die im Handelsregister eingetragene Gesellschaft gemäß § 394 Absatz 1 FamFG wegen Vermögenslosigkeit von Amts wegen zu löschen. Gegen diese Verfügung kann Widerspruch eingelegt werden. Die Frist zur Erhebung eines Widerspruchs gegen die beabsichtigte Löschung von Amts wegen ist auf drei Monate festgesetzt. Rechtsbehelfsbelehrung Der Widerspruch ist bei dem Amtsgericht Duisburg, Kardinal-Galen-Str. 124-132, 47058 Duisburg schriftlich in deutscher Sprache oder zur Niederschrift der Geschäftsstelle einzulegen. Der Widerspruch kann auch zur Niederschrift der Geschäftsstelle eines jeden Amtsgerichtes abgegeben werden. Die Einlegung ist auch durch Übertragung eines elektronischen Dokuments an die elektronische Poststelle des Gerichts möglich. Das elektronische Dokument muss für die Bearbeitung durch das Gericht geeignet und mit einer qualifizierten elektronischen Signatur der verantwortenden Person versehen sein oder von der verantwortenden Person signiert und auf einem sicheren Übermittlungsweg gemäß § 130 a ZPO nach näherer Maßgabe der Verordnung über die technischen Rahmenbedingungen des elektronischen Rechtsverkehrs und über das besondere elektronische Behördenpostfach (BGBl. I, S. 3803) eingereicht werden. Weitere Informationen erhalten Sie auf der Internetseite www.justiz.de <http://www.justiz.de>. Der Widerspruch muss spätestens innerhalb der gesetzten Frist bei dem Amtsgericht Duisburg eingegangen sein. Dies gilt auch dann, wenn der Widerspruch zur Niederschrift der Geschäftsstelle eines anderen Amtsgerichtes abgegeben wurde. Die Frist beginnt mit der Veröffentlichung. Fällt das Ende der Frist auf einen Sonntag, einen allgemeinen Feiertag oder Sonnabend, so endet die Frist mit Ablauf des nächsten Werktages. Der Widerspruch muss die Bezeichnung der angefochtenen Verfügung sowie die Erklärung enthalten, dass Widerspruch gegen diese Verfügung eingelegt wird. Er ist zu unterzeichnen und soll begründet werden."
    },
    {
      "date": "2025-11-25",
      "id": "138286",
      "original_text": "Registerbekanntmachung nach dem Umwandlungsgesetz\nNordrhein-Westfalen Amtsgericht Bochum HRB 15301\nUni-Liga GmbH – Bochum",
      "type": "Registerbekanntmachung nach dem Umwandlungsgesetz",
      "state": "Nordrhein-Westfalen",
      "amtsgericht": "Amtsgericht Bochum",
      "registernummer": "HRB 15301",
      "registerart": "HRB",
      "company_name": "Uni-Liga GmbH",
      "company_seat": "Bochum",
      "details": "25.11.2025 (Bekanntmachungsdatum)\n\nNordrhein-Westfalen Amtsgericht Bochum HRB 15301\nRegisterbekanntmachung nach dem Umwandlungsgesetz 24.11.2025 (Eintragungsdatum)\n\nUni-Liga GmbH\nGesellschaft mit beschränkter Haftung\nBochum\n\nDen Gläubigern der an der Verschmelzung beteiligten Rechtsträger ist, wenn sie binnen sechs Monaten nach dem Tag, an dem die Eintragung der Verschmelzung in das Register des Sitzes desjenigen Rechtsträgers, dessen Gläubiger sie sind, nach § 19 Absatz 3 UmwG als bekanntgemacht gilt, ihren Anspruch nach Grund und Höhe schriftlich anmelden, Sicherheit zu leisten, soweit sie nicht Befriedigung verlangen können. Dieses Recht steht den Gläubigern jedoch nur zu, wenn sie glaubhaft machen, dass durch die Verschmelzung die Erfüllung ihrer Forderung gefährdet wird."
    },
    {
      "date": "2025-11-25",
      "id": "138287",
      "original_text": "Löschungsankündigung\nNordrhein-Westfalen Amtsgericht Köln HRA 18187\nDieter Schmale Consulting e.K. – Bergheim",
      "type": "Löschungsankündigung",
      "state": "Nordrhein-Westfalen",
      "amtsgericht": "Amtsgericht Köln",
      "registernummer": "HRA 18187",
      "registerart": "HRA",
      "company_name": "Dieter Schmale Consulting e.K.",
      "company_seat": "Bergheim",
      "details": "25.11.2025 (Bekanntmachungsdatum)\n\nNordrhein-Westfalen Amtsgericht Köln HRA 18187\nLöschungsankündigung 25.11.2025 (Eintragungsdatum)\n\nDieter Schmale Consulting e.K.\nEinzelkaufmann / Einzelkauffrau\nBergheim\n\nDas Registergericht beabsichtigt nachfolgende Firmen von Amts wegen nach § 31 Abs. 2 HGB zu löschen. Die Frist zur Erhebung eines Widerspruchs ist auf 1 Monate festgesetzt."
    },
    {
      "date": "2025-11-25",
      "id": "138288",
      "original_text": "Registerbekanntmachung nach dem Umwandlungsgesetz\nNordrhein-Westfalen Amtsgericht Düsseldorf HRA 21954\nNaxos Erste Objekt SARL & Co. KG – Düsseldorf",
      "type": "Registerbekanntmachung nach dem Umwandlungsgesetz",
      "state": "Nordrhein-Westfalen",
      "amtsgericht": "Amtsgericht Düsseldorf",
      "registernummer": "HRA 21954",
      "registerart": "HRA",
      "company_name": "Naxos Erste Objekt SARL & Co. KG",
      "company_seat": "Düsseldorf",
      "details": "25.11.2025 (Bekanntmachungsdatum)\n\nNordrhein-Westfalen Amtsgericht Düsseldorf HRA 21954\nRegisterbekanntmachung nach dem Umwandlungsgesetz 25.11.2025 (Eintragungsdatum)\n\nNaxos Erste Objekt SARL & Co. KG\nKommanditgesellschaft\nDüsseldorf\n\nDen Gläubigern der an der formwechselnden Umwandlung beteiligten Rechtsträger ist, wenn sie binnen sechs Monaten nach dem Tag, an dem die Eintragung der formwechselnden Umwandlung in das Register des Sitzes desjenigen Rechtsträgers, dessen Gläubiger sie sind, nach § 19 Absatz 3 UmwG als bekanntgemacht gilt, ihren Anspruch nach Grund und Höhe schriftlich anmelden, Sicherheit zu leisten, soweit sie nicht Befriedigung verlangen können. Dieses Recht steht den Gläubigern jedoch nur zu, wenn sie glaubhaft machen, dass durch die formwechselnden Umwandlung die Erfüllung ihrer Forderung gefährdet wird."
    },
    {
      "date": "2025-11-25",
      "id": "138289",
      "original_text": "Löschungsankündigung\nNordrhein-Westfalen Amtsgericht Köln HRB 112240\nBBVK Handels UG (haftungsbeschränkt) – Köln",
      "type": "Löschungsankündigung",
      "state": "Nordrhein-Westfalen",
      "amtsgericht": "Amtsgericht Köln",
      "registernummer": "HRB 112240",
      "registerart": "HRB",
      "company_name": "BBVK Handels UG (haftungsbeschränkt)",
      "company_seat": "Köln",
      "details": "25.11.2025 (Bekanntmachungsdatum)\n\nNordrhein-Westfalen Amtsgericht Köln HRB 112240\nLöschungsankündigung\n\nBBVK Handels UG (haftungsbeschränkt)\nGesellschaft mit beschränkter Haftung\nKöln\n\nDas Registergericht beabsichtigt die Gesellschaft von Amts wegen nach § 394 FamFG zu löschen. Die Frist zur Erhebung eines Widerspruchs ist auf einen Monat festgesetzt."
    },
    {
      "date": "2025-11-25",
      "id": "138290",
      "original_text": "Löschungsankündigung\nNordrhein-Westfalen Amtsgericht Köln HRB 111769\n!mmunetrue GmbH – Köln",
      "type": "Löschungsankündigung",
      "state": "Nordrhein-Westfalen",
      "amtsgericht": "Amtsgericht Köln",
      "registernummer": "HRB 111769",
      "registerart": "HRB",
      "company_name": "!mmunetrue GmbH",
      "company_seat": "Köln",
      "details": "25.11.2025 (Bekanntmachungsdatum)\n\nNordrhein-Westfalen Amtsgericht Köln HRB 111769\nLöschungsankündigung\n\n!mmunetrue GmbH\nGesellschaft mit beschränkter Haftung\nKöln\n\nDas Registergericht beabsichtigt die Gesellschaft von Amts wegen nach § 394 FamFG zu löschen. Die Frist zur Erhebung eines Widerspruchs ist auf einen Monat festgesetzt."
    },
    {
      "date": "2025-11-25",
      "id": "138291",
      "original_text": "Löschungsankündigung\nHessen Amtsgericht Darmstadt HRA 87156\nALL Rückbau GmbH & Co. KG – Wald-Michelbach",
      "type": "Löschungsankündigung",
      "state": "Hessen",
      "amtsgericht": "Amtsgericht Darmstadt",
      "registernummer": "HRA 87156",
      "registerart": "HRA",
      "company_name": "ALL Rückbau GmbH & Co. KG",
      "company_seat": "Wald-Michelbach",
      "details": "25.11.2025 (Bekanntmachungsdatum)\n\nHessen Amtsgericht Darmstadt HRA 87156\nLöschungsankündigung 22.11.2025 (Eintragungsdatum)\n\nALL Rückbau GmbH & Co. KG\nKommanditgesellschaft\nWald-Michelbach\n\nDas Registergericht beabsichtigt die im Handelsregister eingetragene Firma von Amts wegen nach § 395 FamFG zu löschen. Die Frist zur Erhebung eines Widerspruchs gegen die beabsichtigte Löschung wird auf 3 Monate festgesetzt."
    },
    {
      "date": "2025-11-25",
      "id": "138292",
      "original_text": "Einreichung neuer Dokumente\nHessen Amtsgericht Darmstadt HRB 101686\nAviapharm GmbH – Kelsterbach",
      "type": "Einreichung neuer Dokumente",
      "state": "Hessen",
      "amtsgericht": "Amtsgericht Darmstadt",
      "registernummer": "HRB 101686",
      "registerart": "HRB",
      "company_name": "Aviapharm GmbH",
      "company_seat": "Kelsterbach",
      "details": "25.11.2025 (Bekanntmachungsdatum)\n\nHessen Amtsgericht Darmstadt HRB 101686\nEinreichung neuer Dokumente\n\nAviapharm GmbH\nGesellschaft mit beschränkter Haftung\nKelsterbach\n\nWegen Änderungen in den Personen der Aufsichtsratsmitglieder ist eine Liste der Mitglieder des Aufsichtsrates zum Handelsregister eingereicht worden."
    },
    {
      "date": "2025-11-25",
      "id": "138293",
      "original_text": "Einreichung neuer Dokumente\nHessen Amtsgericht Frankfurt am Main HRB 74165\nPricewaterhouseCoopers Legal Aktiengesellschaft Rechtsanwaltsgesellschaft – Frankfurt am Main",
      "type": "Einreichung neuer Dokumente",
      "state": "Hessen",
      "amtsgericht": "Amtsgericht Frankfurt am Main",
      "registernummer": "HRB 74165",
      "registerart": "HRB",
      "company_name": "PricewaterhouseCoopers Legal Aktiengesellschaft Rechtsanwaltsgesellschaft",
      "company_seat": "Frankfurt am Main",
      "details": "25.11.2025 (Bekanntmachungsdatum)\n\nHessen Amtsgericht Frankfurt am Main HRB 74165\nEinreichung neuer Dokumente 25.11.2025 (Eintragungsdatum)\n\nPricewaterhouseCoopers Legal Aktiengesellschaft Rechtsanwaltsgesellschaft\nAktiengesellschaft\nFrankfurt am Main\n\nDurch eine Änderung in den Personen der Aufsichtsratsmitglieder ist eine Liste der Mitglieder des Aufsichtsrates zum Handelsregister eingereicht worden."
    },
    {
      "date": "2025-11-25",
      "id": "138294",
      "original_text": "Registerbekanntmachung nach dem Umwandlungsgesetz\nHessen Amtsgericht Bad Hersfeld HRB 3244\nBickhardt Bau SE – Kirchheim",
      "type": "Registerbekanntmachung nach dem Umwandlungsgesetz",
      "state": "Hessen",
      "amtsgericht": "Amtsgericht Bad Hersfeld",
      "registernummer": "HRB 3244",
      "registerart": "HRB",
      "company_name": "Bickhardt Bau SE",
      "company_seat": "Kirchheim",
      "details": "25.11.2025 (Bekanntmachungsdatum)\n\nHessen Amtsgericht Bad Hersfeld HRB 3244\nRegisterbekanntmachung nach dem Umwandlungsgesetz 25.11.2025 (Eintragungsdatum)\n\nBickhardt Bau SE\nEuropäische Aktiengesellschaft (SE)\nKirchheim\n\nDen Gläubigern der an der Verschmelzung beteiligten Rechtsträger ist, wenn sie binnen sechs Monaten nach dem Tag, an dem die Eintragung der Verschmelzung in das Register des Sitzes desjenigen Rechtsträgers, dessen Gläubiger sie sind, nach § 19 Absatz 3 UmwG bekannt gemacht worden ist, ihren Anspruch nach Grund und Höhe schriftlich anmelden, Sicherheit zu leisten, soweit sie nicht Befriedigung verlangen können. Dieses Recht steht den Gläubigern jedoch nur zu, wenn sie glaubhaft machen, dass durch die Verschmelzung die Erfüllung ihrer Forderung gefährdet wird."
    },
    {
      "date": "2025-11-25",
      "id": "138295",
      "original_text": "Sonstige Registerbekanntmachung\nHessen Amtsgericht Frankfurt am Main HRB 89384\nHouse of Logistics & Mobility (HOLM) GmbH – Frankfurt am Main",
      "type": "Sonstige Registerbekanntmachung",
      "state": "Hessen",
      "amtsgericht": "Amtsgericht Frankfurt am Main",
      "registernummer": "HRB 89384",
      "registerart": "HRB",
      "company_name": "House of Logistics & Mobility (HOLM) GmbH",
      "company_seat": "Frankfurt am Main",
      "details": "25.11.2025 (Bekanntmachungsdatum)\n\nHessen Amtsgericht Frankfurt am Main HRB 89384\nSonstige Registerbekanntmachung 25.11.2025 (Eintragungsdatum)\n\nHouse of Logistics & Mobility (HOLM) GmbH\nGesellschaft mit beschränkter Haftung\nFrankfurt am Main\n\nDurch eine Änderung in den Personen der Aufsichtsratsmitglieder ist eine Liste der Mitglieder des Aufsichtsrates zum Handelsregister eingereicht worden."
    }
  ]
}