{
  "date": "2025-11-18",
  "date_of_scrape": "2025-11-19T04:11:45.653Z",
  "tool_version": "0.2.0",
  "number_of_announcements": 145,
  "announcements": [
    {
      "date": "2025-11-18",
      "id": "137571",
      "original_text": "Registerbekanntmachung nach dem Umwandlungsgesetz\nBayern Amtsgericht München HRB 145837\nVodafone Deutschland GmbH – Unterföhring",
      "type": "Registerbekanntmachung nach dem Umwandlungsgesetz",
      "state": "Bayern",
      "amtsgericht": "Amtsgericht München",
      "registernummer": "HRB 145837",
      "registerart": "HRB",
      "company_name": "Vodafone Deutschland GmbH",
      "company_seat": "Unterföhring",
      "details": "18.11.2025 (Bekanntmachungsdatum)\n\nBayern Amtsgericht München HRB 145837\nRegisterbekanntmachung nach dem Umwandlungsgesetz 17.11.2025 (Eintragungsdatum)\n\nVodafone Deutschland GmbH\nGesellschaft mit beschränkter Haftung\nUnterföhring\n\nDen Gläubigern der an der Verschmelzung beteiligten Rechtsträger ist, wenn sie binnen sechs Monaten nach dem Tag, an dem die Eintragung der Verschmelzung in das Register des Sitzes desjenigen Rechtsträgers, dessen Gläubiger sie sind, nach § 19 Abs. 3 UmwG als bekannt gemacht gilt, ihren Anspruch nach Grund und Höhe in Textform anmelden, Sicherheit zu leisten, soweit sie nicht Befriedigung verlangen können. Dieses Recht steht den Gläubigern jedoch nur zu, wenn sie glaubhaft machen, dass durch die Verschmelzung die Erfüllung ihrer Forderung gefährdet wird."
    },
    {
      "date": "2025-11-18",
      "id": "137572",
      "original_text": "Registerbekanntmachung nach dem Umwandlungsgesetz\nBayern Amtsgericht Bamberg HRA 12989\nZauritz ATC Schwaig OHG – Bamberg",
      "type": "Registerbekanntmachung nach dem Umwandlungsgesetz",
      "state": "Bayern",
      "amtsgericht": "Amtsgericht Bamberg",
      "registernummer": "HRA 12989",
      "registerart": "HRA",
      "company_name": "Zauritz ATC Schwaig OHG",
      "company_seat": "Bamberg",
      "details": "18.11.2025 (Bekanntmachungsdatum)\n\nBayern Amtsgericht Bamberg HRA 12989\nRegisterbekanntmachung nach dem Umwandlungsgesetz 17.11.2025 (Eintragungsdatum)\n\nZauritz ATC Schwaig OHG\nOffene Handelsgesellschaft\nBamberg\n\nDen Gläubigern der an der Verschmelzung beteiligten Rechtsträger ist, wenn sie binnen sechs Monaten nach dem Tag, an dem die Eintragung der Verschmelzung in das Register des Sitzes desjenigen Rechtsträgers, dessen Gläubiger sie sind, nach § 19 Abs. 3 UmwG als bekannt gemacht gilt, ihren Anspruch nach Grund und Höhe in Textform anmelden, Sicherheit zu leisten, soweit sie nicht Befriedigung verlangen können. Dieses Recht steht den Gläubigern jedoch nur zu, wenn sie glaubhaft machen, dass durch die Verschmelzung die Erfüllung ihrer Forderung gefährdet wird."
    },
    {
      "date": "2025-11-18",
      "id": "137573",
      "original_text": "Einreichung neuer Dokumente\nBayern Amtsgericht München HRB 288766\nSyndeo AG – München",
      "type": "Einreichung neuer Dokumente",
      "state": "Bayern",
      "amtsgericht": "Amtsgericht München",
      "registernummer": "HRB 288766",
      "registerart": "HRB",
      "company_name": "Syndeo AG",
      "company_seat": "München",
      "details": "18.11.2025 (Bekanntmachungsdatum)\n\nBayern Amtsgericht München HRB 288766\nEinreichung neuer Dokumente\n\nSyndeo AG\nAktiengesellschaft\nMünchen\n\nDem Amtsgericht München -Registergericht- ist eine Liste der Mitglieder des Aufsichtsrats eingereicht worden, § 106 AktG."
    },
    {
      "date": "2025-11-18",
      "id": "137574",
      "original_text": "Registerbekanntmachung nach dem Umwandlungsgesetz\nBayern Amtsgericht München HRB 304099\none3 Operations GmbH – München",
      "type": "Registerbekanntmachung nach dem Umwandlungsgesetz",
      "state": "Bayern",
      "amtsgericht": "Amtsgericht München",
      "registernummer": "HRB 304099",
      "registerart": "HRB",
      "company_name": "one3 Operations GmbH",
      "company_seat": "München",
      "details": "18.11.2025 (Bekanntmachungsdatum)\n\nBayern Amtsgericht München HRB 304099\nRegisterbekanntmachung nach dem Umwandlungsgesetz 17.11.2025 (Eintragungsdatum)\n\none3 Operations GmbH\nGesellschaft mit beschränkter Haftung\nMünchen\n\nDen Gläubigern der an der Ausgliederung beteiligten Rechtsträger ist, wenn sie binnen sechs Monaten nach dem Tag, an dem die Eintragung der Ausgliederung in das Register des Sitzes desjenigen Rechtsträgers, dessen Gläubiger sie sind, nach §§ 125, 19 Abs. 3 UmwG als bekannt gemacht gilt, ihren Anspruch nach Grund und Höhe in Textform anmelden, Sicherheit zu leisten, soweit sie nicht Befriedigung verlangen können. Dieses Recht steht den Gläubigern jedoch nur zu, wenn sie glaubhaft machen, dass durch die Ausgliederung die Erfüllung ihrer Forderung gefährdet wird."
    },
    {
      "date": "2025-11-18",
      "id": "137575",
      "original_text": "Löschungsankündigung\nBayern Amtsgericht Schweinfurt HRA 10697\nHealth, Care and More GmbH & Co. KG – Bischofsheim i.d.Rhön",
      "type": "Löschungsankündigung",
      "state": "Bayern",
      "amtsgericht": "Amtsgericht Schweinfurt",
      "registernummer": "HRA 10697",
      "registerart": "HRA",
      "company_name": "Health, Care and More GmbH & Co. KG",
      "company_seat": "Bischofsheim i.d.Rhön",
      "details": "18.11.2025 (Bekanntmachungsdatum)\n\nBayern Amtsgericht Schweinfurt HRA 10697\nLöschungsankündigung\n\nHealth, Care and More GmbH & Co. KG\nKommanditgesellschaft\nBischofsheim i.d.Rhön\n\nDas Registergericht beabsichtigt, die im Handelsregister eingetragene Firma von Amts wegen nach § 395 FamFG zu löschen. Die Frist zur Erhebung eines Widerspruchs ist auf einen Monat festgesetzt."
    },
    {
      "date": "2025-11-18",
      "id": "137576",
      "original_text": "Registerbekanntmachung nach dem Umwandlungsgesetz\nBayern Amtsgericht Fürth HRB 2766\nLauer-Fischer GmbH – Fürth",
      "type": "Registerbekanntmachung nach dem Umwandlungsgesetz",
      "state": "Bayern",
      "amtsgericht": "Amtsgericht Fürth",
      "registernummer": "HRB 2766",
      "registerart": "HRB",
      "company_name": "Lauer-Fischer GmbH",
      "company_seat": "Fürth",
      "details": "18.11.2025 (Bekanntmachungsdatum)\n\nBayern Amtsgericht Fürth HRB 2766\nRegisterbekanntmachung nach dem Umwandlungsgesetz 17.11.2025 (Eintragungsdatum)\n\nLauer-Fischer GmbH\nGesellschaft mit beschränkter Haftung\nFürth\n\nDen Gläubigern der an der Verschmelzung beteiligten Rechtsträger ist, wenn sie binnen sechs Monaten nach dem Tag, an dem die Eintragung der Verschmelzung in das Register des Sitzes desjenigen Rechtsträgers, dessen Gläubiger sie sind, nach § 19 Abs. 3 UmwG als bekannt gemacht gilt, ihren Anspruch nach Grund und Höhe in Textform anmelden, Sicherheit zu leisten, soweit sie nicht Befriedigung verlangen können. Dieses Recht steht den Gläubigern jedoch nur zu, wenn sie glaubhaft machen, dass durch die Verschmelzung die Erfüllung ihrer Forderung gefährdet wird."
    },
    {
      "date": "2025-11-18",
      "id": "137577",
      "original_text": "Löschungsankündigung\nBayern Amtsgericht München HRB 253415\nHSM Transport GmbH – Garching b.München",
      "type": "Löschungsankündigung",
      "state": "Bayern",
      "amtsgericht": "Amtsgericht München",
      "registernummer": "HRB 253415",
      "registerart": "HRB",
      "company_name": "HSM Transport GmbH",
      "company_seat": "Garching b.München",
      "details": "18.11.2025 (Bekanntmachungsdatum)\n\nBayern Amtsgericht München HRB 253415\nLöschungsankündigung 17.11.2025 (Eintragungsdatum)\n\nHSM Transport GmbH\nGesellschaft mit beschränkter Haftung\nGarching b.München\n\nDas Registergericht beabsichtigt, die im Handelsregister eingetragene Gesellschaft wegen Vermögenslosigkeit von Amts wegen nach § 394 FamFG zu löschen. Die Frist zur Erhebung eines Widerspruchs ist auf drei Monate festgesetzt."
    },
    {
      "date": "2025-11-18",
      "id": "137578",
      "original_text": "Registerbekanntmachung nach dem Umwandlungsgesetz\nBayern Amtsgericht Bamberg HRB 11287\nFranz-Ludwig-Straße Zauritz GmbH – Bamberg",
      "type": "Registerbekanntmachung nach dem Umwandlungsgesetz",
      "state": "Bayern",
      "amtsgericht": "Amtsgericht Bamberg",
      "registernummer": "HRB 11287",
      "registerart": "HRB",
      "company_name": "Franz-Ludwig-Straße Zauritz GmbH",
      "company_seat": "Bamberg",
      "details": "18.11.2025 (Bekanntmachungsdatum)\n\nBayern Amtsgericht Bamberg HRB 11287\nRegisterbekanntmachung nach dem Umwandlungsgesetz 17.11.2025 (Eintragungsdatum)\n\nFranz-Ludwig-Straße Zauritz GmbH\nGesellschaft mit beschränkter Haftung\nBamberg\n\nDen Gläubigern der an der Verschmelzung beteiligten Rechtsträger ist, wenn sie binnen sechs Monaten nach dem Tag, an dem die Eintragung der Verschmelzung in das Register des Sitzes desjenigen Rechtsträgers, dessen Gläubiger sie sind, nach § 19 Abs. 3 UmwG als bekannt gemacht gilt, ihren Anspruch nach Grund und Höhe in Textform anmelden, Sicherheit zu leisten, soweit sie nicht Befriedigung verlangen können. Dieses Recht steht den Gläubigern jedoch nur zu, wenn sie glaubhaft machen, dass durch die Verschmelzung die Erfüllung ihrer Forderung gefährdet wird."
    },
    {
      "date": "2025-11-18",
      "id": "137579",
      "original_text": "Einreichung neuer Dokumente\nBayern Amtsgericht München HRB 283069\nCater Immobilien AG – Grünwald",
      "type": "Einreichung neuer Dokumente",
      "state": "Bayern",
      "amtsgericht": "Amtsgericht München",
      "registernummer": "HRB 283069",
      "registerart": "HRB",
      "company_name": "Cater Immobilien AG",
      "company_seat": "Grünwald",
      "details": "18.11.2025 (Bekanntmachungsdatum)\n\nBayern Amtsgericht München HRB 283069\nEinreichung neuer Dokumente\n\nCater Immobilien AG\nAktiengesellschaft\nGrünwald\n\nDem Amtsgericht München -Registergericht- ist eine Liste der Mitglieder des Aufsichtsrats eingereicht worden, § 106 AktG."
    },
    {
      "date": "2025-11-18",
      "id": "137580",
      "original_text": "Löschungsankündigung\nBayern Amtsgericht München HRB 257259\nBrokermax Immoconsult GmbH – München",
      "type": "Löschungsankündigung",
      "state": "Bayern",
      "amtsgericht": "Amtsgericht München",
      "registernummer": "HRB 257259",
      "registerart": "HRB",
      "company_name": "Brokermax Immoconsult GmbH",
      "company_seat": "München",
      "details": "18.11.2025 (Bekanntmachungsdatum)\n\nBayern Amtsgericht München HRB 257259\nLöschungsankündigung 17.11.2025 (Eintragungsdatum)\n\nBrokermax Immoconsult GmbH\nGesellschaft mit beschränkter Haftung\nMünchen\n\nDas Registergericht beabsichtigt, die im Handelsregister eingetragene Gesellschaft wegen Vermögenslosigkeit von Amts wegen nach § 394 FamFG zu löschen. Die Frist zur Erhebung eines Widerspruchs ist auf drei Monate festgesetzt."
    },
    {
      "date": "2025-11-18",
      "id": "137581",
      "original_text": "Registerbekanntmachung nach dem Umwandlungsgesetz\nBayern Amtsgericht München HRB 264635\nPanaleo GP GmbH – München",
      "type": "Registerbekanntmachung nach dem Umwandlungsgesetz",
      "state": "Bayern",
      "amtsgericht": "Amtsgericht München",
      "registernummer": "HRB 264635",
      "registerart": "HRB",
      "company_name": "Panaleo GP GmbH",
      "company_seat": "München",
      "details": "18.11.2025 (Bekanntmachungsdatum)\n\nBayern Amtsgericht München HRB 264635\nRegisterbekanntmachung nach dem Umwandlungsgesetz 17.11.2025 (Eintragungsdatum)\n\nPanaleo GP GmbH\nGesellschaft mit beschränkter Haftung\nMünchen\n\nDen Gläubigern der an der Verschmelzung beteiligten Rechtsträger ist, wenn sie binnen sechs Monaten nach dem Tag, an dem die Eintragung der Verschmelzung in das Register des Sitzes desjenigen Rechtsträgers, dessen Gläubiger sie sind, nach § 19 Abs. 3 UmwG als bekannt gemacht gilt, ihren Anspruch nach Grund und Höhe in Textform anmelden, Sicherheit zu leisten, soweit sie nicht Befriedigung verlangen können. Dieses Recht steht den Gläubigern jedoch nur zu, wenn sie glaubhaft machen, dass durch die Verschmelzung die Erfüllung ihrer Forderung gefährdet wird."
    },
    {
      "date": "2025-11-18",
      "id": "137582",
      "original_text": "Registerbekanntmachung nach dem Umwandlungsgesetz\nBayern Amtsgericht Würzburg HRB 13258\nBrandEverest Basis GmbH – Würzburg",
      "type": "Registerbekanntmachung nach dem Umwandlungsgesetz",
      "state": "Bayern",
      "amtsgericht": "Amtsgericht Würzburg",
      "registernummer": "HRB 13258",
      "registerart": "HRB",
      "company_name": "BrandEverest Basis GmbH",
      "company_seat": "Würzburg",
      "details": "18.11.2025 (Bekanntmachungsdatum)\n\nBayern Amtsgericht Würzburg HRB 13258\nRegisterbekanntmachung nach dem Umwandlungsgesetz 17.11.2025 (Eintragungsdatum)\n\nBrandEverest Basis GmbH\nGesellschaft mit beschränkter Haftung\nWürzburg\n\nDen Gläubigern der an der Verschmelzung beteiligten Rechtsträger ist, wenn sie binnen sechs Monaten nach dem Tag, an dem die Eintragung der Verschmelzung in das Register des Sitzes desjenigen Rechtsträgers, dessen Gläubiger sie sind, nach § 19 Abs. 3 UmwG als bekannt gemacht gilt, ihren Anspruch nach Grund und Höhe in Textform anmelden, Sicherheit zu leisten, soweit sie nicht Befriedigung verlangen können. Dieses Recht steht den Gläubigern jedoch nur zu, wenn sie glaubhaft machen, dass durch die Verschmelzung die Erfüllung ihrer Forderung gefährdet wird."
    },
    {
      "date": "2025-11-18",
      "id": "137583",
      "original_text": "Löschungsankündigung\nBayern Amtsgericht Bayreuth HRB 6234\nBIB Bamberger Immobau GmbH – Kulmbach",
      "type": "Löschungsankündigung",
      "state": "Bayern",
      "amtsgericht": "Amtsgericht Bayreuth",
      "registernummer": "HRB 6234",
      "registerart": "HRB",
      "company_name": "BIB Bamberger Immobau GmbH",
      "company_seat": "Kulmbach",
      "details": "18.11.2025 (Bekanntmachungsdatum)\n\nBayern Amtsgericht Bayreuth HRB 6234\nLöschungsankündigung\n\nBIB Bamberger Immobau GmbH\nGesellschaft mit beschränkter Haftung\nKulmbach\n\nDas Registergericht beabsichtigt, den im Handelsregister eingetragenen Geschäftsführer wegen fehlender Eignung nach § 395 FamFG zu löschen. Die Frist zur Erhebung eines Widerspruchs ist auf einen Monat festgesetzt."
    },
    {
      "date": "2025-11-18",
      "id": "137584",
      "original_text": "Registerbekanntmachung nach dem Umwandlungsgesetz\nBayern Amtsgericht Aschaffenburg HRB 15183\nEFT-Systems GmbH – Kleinostheim",
      "type": "Registerbekanntmachung nach dem Umwandlungsgesetz",
      "state": "Bayern",
      "amtsgericht": "Amtsgericht Aschaffenburg",
      "registernummer": "HRB 15183",
      "registerart": "HRB",
      "company_name": "EFT-Systems GmbH",
      "company_seat": "Kleinostheim",
      "details": "18.11.2025 (Bekanntmachungsdatum)\n\nBayern Amtsgericht Aschaffenburg HRB 15183\nRegisterbekanntmachung nach dem Umwandlungsgesetz 17.11.2025 (Eintragungsdatum)\n\nEFT-Systems GmbH\nGesellschaft mit beschränkter Haftung\nKleinostheim\n\nDen Gläubigern der an der Spaltung beteiligten Rechtsträger ist, wenn sie binnen sechs Monaten nach dem Tag, an dem die Eintragung der Spaltung in das Register des Sitzes desjenigen Rechtsträgers, dessen Gläubiger sie sind, nach §§ 125, 19 Abs. 3 UmwG als bekannt gemacht gilt, ihren Anspruch nach Grund und Höhe in Textform anmelden, Sicherheit zu leisten, soweit sie nicht Befriedigung verlangen können. Dieses Recht steht den Gläubigern jedoch nur zu, wenn sie glaubhaft machen, dass durch die Spaltung die Erfüllung ihrer Forderung gefährdet wird."
    },
    {
      "date": "2025-11-18",
      "id": "137585",
      "original_text": "Registerbekanntmachung nach dem Umwandlungsgesetz\nBayern Amtsgericht Coburg HRB 7445\nFranz Fischer Holding AG – Neustadt bei Coburg",
      "type": "Registerbekanntmachung nach dem Umwandlungsgesetz",
      "state": "Bayern",
      "amtsgericht": "Amtsgericht Coburg",
      "registernummer": "HRB 7445",
      "registerart": "HRB",
      "company_name": "Franz Fischer Holding AG",
      "company_seat": "Neustadt bei Coburg",
      "details": "18.11.2025 (Bekanntmachungsdatum)\n\nBayern Amtsgericht Coburg HRB 7445\nRegisterbekanntmachung nach dem Umwandlungsgesetz 14.11.2025 (Eintragungsdatum)\n\nFranz Fischer Holding AG\nAktiengesellschaft\nNeustadt bei Coburg\n\nBeim Amtsgericht Coburg -Registergericht- ist am 11.11.2025 ein Verschmelzungsplan über die geplante Verschmelzung der Gesellschaft als übernehmendem Rechtsträger mit der Aktiengesellschaft österreichischen Rechts unter der FISHBULL Beteiligungs AG mit Sitz in Wien/Österreich (Firmenbuch des Handelsgerichts Wien, Firmenbuchnummer 643788 y) als übertragender Rechtsträger eingereicht worden. Die vollständigen Auskünfte über diese Modalitäten können kostenlos eingeholt werden im \"Gemeinsamen Registerportal der Länder\"."
    },
    {
      "date": "2025-11-18",
      "id": "137586",
      "original_text": "Löschungsankündigung\nBayern Amtsgericht Landshut HRB 10339\nLA-CARAVANING UG (haftungsbeschränkt) – Furth bei Landshut",
      "type": "Löschungsankündigung",
      "state": "Bayern",
      "amtsgericht": "Amtsgericht Landshut",
      "registernummer": "HRB 10339",
      "registerart": "HRB",
      "company_name": "LA-CARAVANING UG (haftungsbeschränkt)",
      "company_seat": "Furth bei Landshut",
      "details": "18.11.2025 (Bekanntmachungsdatum)\n\nBayern Amtsgericht Landshut HRB 10339\nLöschungsankündigung\n\nLA-CARAVANING UG (haftungsbeschränkt)\nGesellschaft mit beschränkter Haftung\nFurth bei Landshut\n\nDas Registergericht beabsichtigt, die im Handelsregister eingetragene Gesellschaft wegen Vermögenslosigkeit von Amts wegen nach § 394 FamFG zu löschen. Die Frist zur Erhebung eines Widerspruchs ist auf einen Monat festgesetzt."
    },
    {
      "date": "2025-11-18",
      "id": "137587",
      "original_text": "Registerbekanntmachung nach dem Umwandlungsgesetz\nBayern Amtsgericht München HRB 283293\nMoRa Equities GmbH – München",
      "type": "Registerbekanntmachung nach dem Umwandlungsgesetz",
      "state": "Bayern",
      "amtsgericht": "Amtsgericht München",
      "registernummer": "HRB 283293",
      "registerart": "HRB",
      "company_name": "MoRa Equities GmbH",
      "company_seat": "München",
      "details": "18.11.2025 (Bekanntmachungsdatum)\n\nBayern Amtsgericht München HRB 283293\nRegisterbekanntmachung nach dem Umwandlungsgesetz 17.11.2025 (Eintragungsdatum)\n\nMoRa Equities GmbH\nGesellschaft mit beschränkter Haftung\nMünchen\n\nDen Gläubigern der an der Verschmelzung beteiligten Rechtsträger ist, wenn sie binnen sechs Monaten nach dem Tag, an dem die Eintragung der Verschmelzung in das Register des Sitzes desjenigen Rechtsträgers, dessen Gläubiger sie sind, nach § 19 Abs. 3 UmwG als bekannt gemacht gilt, ihren Anspruch nach Grund und Höhe in Textform anmelden, Sicherheit zu leisten, soweit sie nicht Befriedigung verlangen können. Dieses Recht steht den Gläubigern jedoch nur zu, wenn sie glaubhaft machen, dass durch die Verschmelzung die Erfüllung ihrer Forderung gefährdet wird."
    },
    {
      "date": "2025-11-18",
      "id": "137588",
      "original_text": "Löschungsankündigung\nBayern Amtsgericht Passau HRB 11040\nY & T Leaders GmbH – Hauzenberg",
      "type": "Löschungsankündigung",
      "state": "Bayern",
      "amtsgericht": "Amtsgericht Passau",
      "registernummer": "HRB 11040",
      "registerart": "HRB",
      "company_name": "Y & T Leaders GmbH",
      "company_seat": "Hauzenberg",
      "details": "18.11.2025 (Bekanntmachungsdatum)\n\nBayern Amtsgericht Passau HRB 11040\nLöschungsankündigung\n\nY & T Leaders GmbH\nGesellschaft mit beschränkter Haftung\nHauzenberg\n\nDas Registergericht beabsichtigt, die im Handelsregister eingetragene Gesellschaft wegen Vermögenslosigkeit von Amts wegen nach § 394 FamFG zu löschen. Die Frist zur Erhebung eines Widerspruchs ist auf einen Monat festgesetzt."
    },
    {
      "date": "2025-11-18",
      "id": "137589",
      "original_text": "Registerbekanntmachung nach dem Umwandlungsgesetz\nBayern Amtsgericht Nürnberg HRA 18691\nKlinkhammer Holding GmbH & Co. KG – Nürnberg",
      "type": "Registerbekanntmachung nach dem Umwandlungsgesetz",
      "state": "Bayern",
      "amtsgericht": "Amtsgericht Nürnberg",
      "registernummer": "HRA 18691",
      "registerart": "HRA",
      "company_name": "Klinkhammer Holding GmbH & Co. KG",
      "company_seat": "Nürnberg",
      "details": "18.11.2025 (Bekanntmachungsdatum)\n\nBayern Amtsgericht Nürnberg HRA 18691\nRegisterbekanntmachung nach dem Umwandlungsgesetz 17.11.2025 (Eintragungsdatum)\n\nKlinkhammer Holding GmbH & Co. KG\nKommanditgesellschaft\nNürnberg\n\nDen Gläubigern des formwechselnden Rechtsträgers ist, wenn sie binnen sechs Monaten nach dem Tag, an dem die Eintragung des Formwechsels nach § 201 UmwG als bekannt gemacht gilt, ihren Anspruch nach Grund und Höhe in Textform anmelden, Sicherheit zu leisten, soweit sie nicht Befriedigung verlangen können. Dieses Recht steht den Gläubigern jedoch nur zu, wenn sie glaubhaft machen, dass durch den Formwechsel die Erfüllung ihrer Forderung gefährdet wird.Den Gläubigern des formwechselnden Rechtsträgers ist, wenn sie binnen sechs Monaten nach dem Tag, an dem die Eintragung des Formwechsels nach § 201 UmwG als bekannt gemacht gilt, ihren Anspruch nach Grund und Höhe in Textform anmelden, Sicherheit zu leisten, soweit sie nicht Befriedigung verlangen können. Dieses Recht steht den Gläubigern jedoch nur zu, wenn sie glaubhaft machen, dass durch den Formwechsel die Erfüllung ihrer Forderung gefährdet wird."
    },
    {
      "date": "2025-11-18",
      "id": "137590",
      "original_text": "Löschungsankündigung\nBayern Amtsgericht Passau HRA 11171\nInn Apotheke Apothekerin Maria Melz e.K. – Neuburg am Inn",
      "type": "Löschungsankündigung",
      "state": "Bayern",
      "amtsgericht": "Amtsgericht Passau",
      "registernummer": "HRA 11171",
      "registerart": "HRA",
      "company_name": "Inn Apotheke Apothekerin Maria Melz e.K.",
      "company_seat": "Neuburg am Inn",
      "details": "18.11.2025 (Bekanntmachungsdatum)\n\nBayern Amtsgericht Passau HRA 11171\nLöschungsankündigung\n\nInn Apotheke Apothekerin Maria Melz e.K.\nEinzelkaufmann / Einzelkauffrau\nNeuburg am Inn\n\nDas Registergericht beabsichtigt, die im Handelsregister A eingetragene Firma von Amts wegen nach § 31 Abs. 2 HGB zu löschen. Die Frist zur Erhebung eines Widerspruchs ist auf einen Monat festgesetzt."
    },
    {
      "date": "2025-11-18",
      "id": "137591",
      "original_text": "Registerbekanntmachung nach dem Umwandlungsgesetz\nBayern Amtsgericht Bamberg HRB 3145\nRSG Group GmbH – Schlüsselfeld",
      "type": "Registerbekanntmachung nach dem Umwandlungsgesetz",
      "state": "Bayern",
      "amtsgericht": "Amtsgericht Bamberg",
      "registernummer": "HRB 3145",
      "registerart": "HRB",
      "company_name": "RSG Group GmbH",
      "company_seat": "Schlüsselfeld",
      "details": "18.11.2025 (Bekanntmachungsdatum)\n\nBayern Amtsgericht Bamberg HRB 3145\nRegisterbekanntmachung nach dem Umwandlungsgesetz 17.11.2025 (Eintragungsdatum)\n\nRSG Group GmbH\nGesellschaft mit beschränkter Haftung\nSchlüsselfeld\n\nDen Gläubigern der an der Verschmelzung beteiligten Rechtsträger ist, wenn sie binnen sechs Monaten nach dem Tag, an dem die Eintragung der Verschmelzung in das Register des Sitzes desjenigen Rechtsträgers, dessen Gläubiger sie sind, nach § 19 Abs. 3 UmwG als bekannt gemacht gilt, ihren Anspruch nach Grund und Höhe in Textform anmelden, Sicherheit zu leisten, soweit sie nicht Befriedigung verlangen können. Dieses Recht steht den Gläubigern jedoch nur zu, wenn sie glaubhaft machen, dass durch die Verschmelzung die Erfüllung ihrer Forderung gefährdet wird."
    },
    {
      "date": "2025-11-18",
      "id": "137592",
      "original_text": "Löschungsankündigung\nBerlin Amtsgericht Berlin (Charlottenburg) HRB 230512\nCodexPro GmbH – Berlin",
      "type": "Löschungsankündigung",
      "state": "Berlin",
      "amtsgericht": "Amtsgericht Berlin (Charlottenburg)",
      "registernummer": "HRB 230512",
      "registerart": "HRB",
      "company_name": "CodexPro GmbH",
      "company_seat": "Berlin",
      "details": "18.11.2025 (Bekanntmachungsdatum)\n\nBerlin Amtsgericht Berlin (Charlottenburg) HRB 230512\nLöschungsankündigung\n\nCodexPro GmbH\nGesellschaft mit beschränkter Haftung\nBerlin\n\nBei der nachstehenden Gesellschaft wird das Amtslöschungsverfahren gemäß § 394 FamFG eingeleitet. Widerspruchsfrist 5 Wochen"
    },
    {
      "date": "2025-11-18",
      "id": "137593",
      "original_text": "Löschungsankündigung\nBerlin Amtsgericht Berlin (Charlottenburg) HRB 190464\nEco Ceramics UG (haftungsbeschränkt) – Berlin",
      "type": "Löschungsankündigung",
      "state": "Berlin",
      "amtsgericht": "Amtsgericht Berlin (Charlottenburg)",
      "registernummer": "HRB 190464",
      "registerart": "HRB",
      "company_name": "Eco Ceramics UG (haftungsbeschränkt)",
      "company_seat": "Berlin",
      "details": "18.11.2025 (Bekanntmachungsdatum)\n\nBerlin Amtsgericht Berlin (Charlottenburg) HRB 190464\nLöschungsankündigung\n\nEco Ceramics UG (haftungsbeschränkt)\nGesellschaft mit beschränkter Haftung\nBerlin\n\nBei der nachstehenden Gesellschaft wird das Amtslöschungsverfahren gemäß § 394 FamFG eingeleitet. Widerspruchsfrist 6 Wochen"
    },
    {
      "date": "2025-11-18",
      "id": "137594",
      "original_text": "Sonstige Registerbekanntmachung\nHamburg Amtsgericht Hamburg HRB 181379\nAirbus GmbH – Hamburg",
      "type": "Sonstige Registerbekanntmachung",
      "state": "Hamburg",
      "amtsgericht": "Amtsgericht Hamburg",
      "registernummer": "HRB 181379",
      "registerart": "HRB",
      "company_name": "Airbus GmbH",
      "company_seat": "Hamburg",
      "details": "18.11.2025 (Bekanntmachungsdatum)\n\nHamburg Amtsgericht Hamburg HRB 181379\nSonstige Registerbekanntmachung 18.11.2025 (Eintragungsdatum)\n\nAirbus GmbH\nGesellschaft mit beschränkter Haftung\nHamburg\n\nAls nicht eingetragen wird bekannt gemacht: Liste des Aufsichtsrats wurde eingereicht."
    },
    {
      "date": "2025-11-18",
      "id": "137595",
      "original_text": "Löschungsankündigung\nBerlin Amtsgericht Berlin (Charlottenburg) HRB 249829\nBeauty Port GmbH – Berlin",
      "type": "Löschungsankündigung",
      "state": "Berlin",
      "amtsgericht": "Amtsgericht Berlin (Charlottenburg)",
      "registernummer": "HRB 249829",
      "registerart": "HRB",
      "company_name": "Beauty Port GmbH",
      "company_seat": "Berlin",
      "details": "18.11.2025 (Bekanntmachungsdatum)\n\nBerlin Amtsgericht Berlin (Charlottenburg) HRB 249829\nLöschungsankündigung\n\nBeauty Port GmbH\nGesellschaft mit beschränkter Haftung\nBerlin\n\nEs ist beabsichtigt, die Eintragung des Herrn Tayyar Yildiz als Geschäftsführer der Gesellschaft wegen Mangels einer wesentlichen Voraussetzung gemäß § 395 FamFG von Amts wegen zu löschen. Widerspruchsfrist 3 Wochen."
    },
    {
      "date": "2025-11-18",
      "id": "137596",
      "original_text": "Registerbekanntmachung nach dem Umwandlungsgesetz\nBaden-Württemberg Amtsgericht Mannheim HRB 720294\nWolfgang und Gerhard Bonn gemeinnützige GmbH – Walldürn",
      "type": "Registerbekanntmachung nach dem Umwandlungsgesetz",
      "state": "Baden-Württemberg",
      "amtsgericht": "Amtsgericht Mannheim",
      "registernummer": "HRB 720294",
      "registerart": "HRB",
      "company_name": "Wolfgang und Gerhard Bonn gemeinnützige GmbH",
      "company_seat": "Walldürn",
      "details": "18.11.2025 (Bekanntmachungsdatum)\n\nBaden-Württemberg Amtsgericht Mannheim HRB 720294\nRegisterbekanntmachung nach dem Umwandlungsgesetz 18.11.2025 (Eintragungsdatum)\n\nWolfgang und Gerhard Bonn gemeinnützige GmbH\nGesellschaft mit beschränkter Haftung\nWalldürn\n\nAls nicht eingetragen wird bekanntgemacht:\nDen Gläubigern der an der Verschmelzung beteiligten Rechtsträger ist, wenn sie binnen sechs Monaten nach dem Tag, an dem die Eintragung der Verschmelzung in das Register des Sitzes desjenigen Rechtsträgers, dessen Gläubiger sie sind, nach § 19 Abs. 3 UmwG als bekanntgemacht gilt, ihren Anspruch nach Grund und Höhe schriftlich anmelden, Sicherheit zu leisten, soweit sie nicht Befriedigung verlangen können. Dieses Recht steht den Gläubigern jedoch nur zu, wenn sie glaubhaft machen, dass durch die Verschmelzung die Erfüllung ihrer Forderung gefährdet wird."
    },
    {
      "date": "2025-11-18",
      "id": "137597",
      "original_text": "Löschungsankündigung\nBerlin Amtsgericht Berlin (Charlottenburg) HRB 197809\nKeyheroes Produktdesign Beteiligungs GmbH – Berlin",
      "type": "Löschungsankündigung",
      "state": "Berlin",
      "amtsgericht": "Amtsgericht Berlin (Charlottenburg)",
      "registernummer": "HRB 197809",
      "registerart": "HRB",
      "company_name": "Keyheroes Produktdesign Beteiligungs GmbH",
      "company_seat": "Berlin",
      "details": "18.11.2025 (Bekanntmachungsdatum)\n\nBerlin Amtsgericht Berlin (Charlottenburg) HRB 197809\nLöschungsankündigung\n\nKeyheroes Produktdesign Beteiligungs GmbH\nGesellschaft mit beschränkter Haftung\nBerlin\n\nBei der nachstehenden Gesellschaft wird das Amtslöschungsverfahren gemäß § 394 FamFG eingeleitet. Widerspruchsfrist 6 Wochen"
    },
    {
      "date": "2025-11-18",
      "id": "137598",
      "original_text": "Löschungsankündigung\nBerlin Amtsgericht Berlin (Charlottenburg) HRB 205805\nAM Facility Management GmbH – Berlin",
      "type": "Löschungsankündigung",
      "state": "Berlin",
      "amtsgericht": "Amtsgericht Berlin (Charlottenburg)",
      "registernummer": "HRB 205805",
      "registerart": "HRB",
      "company_name": "AM Facility Management GmbH",
      "company_seat": "Berlin",
      "details": "18.11.2025 (Bekanntmachungsdatum)\n\nBerlin Amtsgericht Berlin (Charlottenburg) HRB 205805\nLöschungsankündigung\n\nAM Facility Management GmbH\nGesellschaft mit beschränkter Haftung\nBerlin\n\nBei der nachstehenden Gesellschaft wird das Amtslöschungsverfahren gemäß § 394 FamFG eingeleitet. Widerspruchsfrist 6 Wochen"
    },
    {
      "date": "2025-11-18",
      "id": "137599",
      "original_text": "Löschungsankündigung\nBerlin Amtsgericht Berlin (Charlottenburg) HRB 180221\nSVS-Sicherheitsdienst GmbH – Berlin",
      "type": "Löschungsankündigung",
      "state": "Berlin",
      "amtsgericht": "Amtsgericht Berlin (Charlottenburg)",
      "registernummer": "HRB 180221",
      "registerart": "HRB",
      "company_name": "SVS-Sicherheitsdienst GmbH",
      "company_seat": "Berlin",
      "details": "18.11.2025 (Bekanntmachungsdatum)\n\nBerlin Amtsgericht Berlin (Charlottenburg) HRB 180221\nLöschungsankündigung\n\nSVS-Sicherheitsdienst GmbH\nGesellschaft mit beschränkter Haftung\nBerlin\n\nBei der nachstehenden Gesellschaft wird das Amtslöschungsverfahren gemäß § 394 FamFG eingeleitet. Widerspruchsfrist 6 Wochen"
    },
    {
      "date": "2025-11-18",
      "id": "137600",
      "original_text": "Registerbekanntmachung nach dem Umwandlungsgesetz\nHamburg Amtsgericht Hamburg HRB 158395\nQUEST Stiftstraße Verwaltungs GmbH – Hamburg",
      "type": "Registerbekanntmachung nach dem Umwandlungsgesetz",
      "state": "Hamburg",
      "amtsgericht": "Amtsgericht Hamburg",
      "registernummer": "HRB 158395",
      "registerart": "HRB",
      "company_name": "QUEST Stiftstraße Verwaltungs GmbH",
      "company_seat": "Hamburg",
      "details": "18.11.2025 (Bekanntmachungsdatum)\n\nHamburg Amtsgericht Hamburg HRB 158395\nRegisterbekanntmachung nach dem Umwandlungsgesetz 18.11.2025 (Eintragungsdatum)\n\nQUEST Stiftstraße Verwaltungs GmbH\nGesellschaft mit beschränkter Haftung\nHamburg\n\nAls nicht eingetragen wird bekannt gemacht:\nDen Gläubigern der an der Verschmelzung beteiligten Gesellschaften ist, wenn sie binnen sechs Monaten nach dem Tag, an dem die Eintragung der Verschmelzung in das Register des Sitzes desjenigen Rechtsträgers, dessen Gläubiger sie sind, nach § 19 Absatz 3 UmwG als bekannt gemacht gilt, ihren Anspruch nach Grund und Höhe schriftlich anmelden, Sicherheit zu leisten, soweit sie nicht Befriedigung verlangen können. Dieses Recht steht den Gläubigern jedoch nur zu, wenn sie glaubhaft machen, dass durch die Verschmelzung die Erfüllung ihrer Forderung gefährdet wird."
    },
    {
      "date": "2025-11-18",
      "id": "137601",
      "original_text": "Registerbekanntmachung nach dem Umwandlungsgesetz\nHamburg Amtsgericht Hamburg HRB 165752\nQUEST Sellerstraße Beteiligungs GmbH – Hamburg",
      "type": "Registerbekanntmachung nach dem Umwandlungsgesetz",
      "state": "Hamburg",
      "amtsgericht": "Amtsgericht Hamburg",
      "registernummer": "HRB 165752",
      "registerart": "HRB",
      "company_name": "QUEST Sellerstraße Beteiligungs GmbH",
      "company_seat": "Hamburg",
      "details": "18.11.2025 (Bekanntmachungsdatum)\n\nHamburg Amtsgericht Hamburg HRB 165752\nRegisterbekanntmachung nach dem Umwandlungsgesetz 18.11.2025 (Eintragungsdatum)\n\nQUEST Sellerstraße Beteiligungs GmbH\nGesellschaft mit beschränkter Haftung\nHamburg\n\nAls nicht eingetragen wird bekannt gemacht:\nDen Gläubigern der an der Verschmelzung beteiligten Gesellschaften ist, wenn sie binnen sechs Monaten nach dem Tag, an dem die Eintragung der Verschmelzung in das Register des Sitzes desjenigen Rechtsträgers, dessen Gläubiger sie sind, nach § 19 Absatz 3 UmwG als bekannt gemacht gilt, ihren Anspruch nach Grund und Höhe schriftlich anmelden, Sicherheit zu leisten, soweit sie nicht Befriedigung verlangen können. Dieses Recht steht den Gläubigern jedoch nur zu, wenn sie glaubhaft machen, dass durch die Verschmelzung die Erfüllung ihrer Forderung gefährdet wird."
    },
    {
      "date": "2025-11-18",
      "id": "137602",
      "original_text": "Registerbekanntmachung nach dem Umwandlungsgesetz\nBaden-Württemberg Amtsgericht Ulm HRB 750847\nGrundstücksgemeinschaft Walzer GmbH – Mengen",
      "type": "Registerbekanntmachung nach dem Umwandlungsgesetz",
      "state": "Baden-Württemberg",
      "amtsgericht": "Amtsgericht Ulm",
      "registernummer": "HRB 750847",
      "registerart": "HRB",
      "company_name": "Grundstücksgemeinschaft Walzer GmbH",
      "company_seat": "Mengen",
      "details": "18.11.2025 (Bekanntmachungsdatum)\n\nBaden-Württemberg Amtsgericht Ulm HRB 750847\nRegisterbekanntmachung nach dem Umwandlungsgesetz 18.11.2025 (Eintragungsdatum)\n\nGrundstücksgemeinschaft Walzer GmbH\nGesellschaft mit beschränkter Haftung\nMengen\n\nAls nicht eingetragen wird bekanntgemacht:\nDen Gläubigern des an dem Formwechsel beteiligten Rechtsträgers ist, wenn sie binnen sechs Monaten nach dem Tag, an dem die Eintragung des Formwechsels in das Register des Sitzes desjenigen Rechtsträgers, dessen Gläubiger sie sind, nach § 19 Abs. 3 UmwG als bekanntgemacht gilt, ihren Anspruch nach Grund und Höhe schriftlich anmelden, Sicherheit zu leisten, soweit sie nicht Befriedigung verlangen können. Dieses Recht steht den Gläubigern jedoch nur zu, wenn sie glaubhaft machen, dass durch den Formwechsel die Erfüllung ihrer Forderung gefährdet wird."
    },
    {
      "date": "2025-11-18",
      "id": "137603",
      "original_text": "Einreichung neuer Dokumente\nBerlin Amtsgericht Berlin (Charlottenburg) HRB 108758\nWhite Owl Capital AG – Berlin",
      "type": "Einreichung neuer Dokumente",
      "state": "Berlin",
      "amtsgericht": "Amtsgericht Berlin (Charlottenburg)",
      "registernummer": "HRB 108758",
      "registerart": "HRB",
      "company_name": "White Owl Capital AG",
      "company_seat": "Berlin",
      "details": "18.11.2025 (Bekanntmachungsdatum)\n\nBerlin Amtsgericht Berlin (Charlottenburg) HRB 108758\nEinreichung neuer Dokumente\n\nWhite Owl Capital AG\nAktiengesellschaft\nBerlin\n\nAls nicht eingetragen wird veröffentlicht: Es wurde eine neue Liste der Aufsichtsratsmitglieder eingereicht (§ 106 AktG)."
    },
    {
      "date": "2025-11-18",
      "id": "137604",
      "original_text": "Registerbekanntmachung nach dem Umwandlungsgesetz\nBaden-Württemberg Amtsgericht Ulm GsR 1580\nGrundstücksgemeinschaft Britta und Kai-Uwe Walzer eGbR – Mengen",
      "type": "Registerbekanntmachung nach dem Umwandlungsgesetz",
      "state": "Baden-Württemberg",
      "amtsgericht": "Amtsgericht Ulm",
      "registernummer": "GsR 1580",
      "registerart": "GsR",
      "company_name": "Grundstücksgemeinschaft Britta und Kai-Uwe Walzer eGbR",
      "company_seat": "Mengen",
      "details": "18.11.2025 (Bekanntmachungsdatum)\n\nBaden-Württemberg Amtsgericht Ulm GsR 1580\nRegisterbekanntmachung nach dem Umwandlungsgesetz 18.11.2025 (Eintragungsdatum)\n\nGrundstücksgemeinschaft Britta und Kai-Uwe Walzer eGbR\nGesellschaft bürgerlichen Rechts\nMengen\n\nDen Gläubigern des an dem Formwechsel beteiligten Rechtsträgers ist, wenn sie binnen sechs Monaten nach dem Tag, an dem die Eintragung des Formwechsels in das Register des Sitzes desjenigen Rechtsträgers, dessen Gläubiger sie sind, nach § 19 Abs. 3 UmwG als bekanntgemacht gilt, ihren Anspruch nach Grund und Höhe schriftlich anmelden, Sicherheit zu leisten, soweit sie nicht Befriedigung verlangen können. Dieses Recht steht den Gläubigern jedoch nur zu, wenn sie glaubhaft machen, dass durch den Formwechsel die Erfüllung ihrer Forderung gefährdet wird."
    },
    {
      "date": "2025-11-18",
      "id": "137605",
      "original_text": "Löschungsankündigung\nBaden-Württemberg Amtsgericht Freiburg HRB 710725\ntechnologies and more GmbH – Konstanz",
      "type": "Löschungsankündigung",
      "state": "Baden-Württemberg",
      "amtsgericht": "Amtsgericht Freiburg",
      "registernummer": "HRB 710725",
      "registerart": "HRB",
      "company_name": "technologies and more GmbH",
      "company_seat": "Konstanz",
      "details": "18.11.2025 (Bekanntmachungsdatum)\n\nBaden-Württemberg Amtsgericht Freiburg HRB 710725\nLöschungsankündigung\n\ntechnologies and more GmbH\nGesellschaft mit beschränkter Haftung\nKonstanz\n\nAls nicht eingetragen wird bekanntgemacht:\nDas Gericht beabsichtigt, die Gesellschaft wegen Vermögenslosigkeit im Handelsregister von Amts wegen nach § 394 FamFG zu löschen. Die Frist zur Geltendmachung eines Widerspruchs gegen die beabsichtigte Löschung ist auf einen Monat ab Veröffentlichung bestimmt."
    },
    {
      "date": "2025-11-18",
      "id": "137606",
      "original_text": "Löschungsankündigung\nSchleswig-Holstein Amtsgericht Lübeck HRB 12798\nYasmina Flughafenmanagement GmbH – Lübeck",
      "type": "Löschungsankündigung",
      "state": "Schleswig-Holstein",
      "amtsgericht": "Amtsgericht Lübeck",
      "registernummer": "HRB 12798",
      "registerart": "HRB",
      "company_name": "Yasmina Flughafenmanagement GmbH",
      "company_seat": "Lübeck",
      "details": "18.11.2025 (Bekanntmachungsdatum)\n\nSchleswig-Holstein Amtsgericht Lübeck HRB 12798\nLöschungsankündigung\n\nYasmina Flughafenmanagement GmbH\nGesellschaft mit beschränkter Haftung\nLübeck\n\nEs ist die Löschung der nachstehenden Gesellschaft wegen Vermögenslosigkeit gemäß § 394 FamFG beabsichtigt."
    },
    {
      "date": "2025-11-18",
      "id": "137607",
      "original_text": "Registerbekanntmachung nach dem Umwandlungsgesetz\nBaden-Württemberg Amtsgericht Mannheim HRB 740532\nBREMER Süd GmbH – Karlsruhe",
      "type": "Registerbekanntmachung nach dem Umwandlungsgesetz",
      "state": "Baden-Württemberg",
      "amtsgericht": "Amtsgericht Mannheim",
      "registernummer": "HRB 740532",
      "registerart": "HRB",
      "company_name": "BREMER Süd GmbH",
      "company_seat": "Karlsruhe",
      "details": "18.11.2025 (Bekanntmachungsdatum)\n\nBaden-Württemberg Amtsgericht Mannheim HRB 740532\nRegisterbekanntmachung nach dem Umwandlungsgesetz 18.11.2025 (Eintragungsdatum)\n\nBREMER Süd GmbH\nGesellschaft mit beschränkter Haftung\nKarlsruhe\n\nAls nicht eingetragen wird bekanntgemacht:\nDen Gläubigern der an der Verschmelzung beteiligten Rechtsträger ist, wenn sie binnen sechs Monaten nach dem Tag, an dem die Eintragung der Verschmelzung in das Register des Sitzes desjenigen Rechtsträgers, dessen Gläubiger sie sind, nach § 19 Abs. 3 UmwG als bekanntgemacht gilt, ihren Anspruch nach Grund und Höhe schriftlich anmelden, Sicherheit zu leisten, soweit sie nicht Befriedigung verlangen können. Dieses Recht steht den Gläubigern jedoch nur zu, wenn sie glaubhaft machen, dass durch die Verschmelzung die Erfüllung ihrer Forderung gefährdet wird."
    },
    {
      "date": "2025-11-18",
      "id": "137608",
      "original_text": "Löschungsankündigung\nSachsen-Anhalt Amtsgericht Stendal VR 42705\nVokalgruppe Ars Vivendi Wernigerode e.V. – Wernigerode",
      "type": "Löschungsankündigung",
      "state": "Sachsen-Anhalt",
      "amtsgericht": "Amtsgericht Stendal",
      "registernummer": "VR 42705",
      "registerart": "VR",
      "company_name": "Vokalgruppe Ars Vivendi Wernigerode e.V.",
      "company_seat": "Wernigerode",
      "details": "18.11.2025 (Bekanntmachungsdatum)\n\nSachsen-Anhalt Amtsgericht Stendal VR 42705\nLöschungsankündigung\n\nVokalgruppe Ars Vivendi Wernigerode e.V.\neingetragener Verein\nWernigerode\n\nDas Registergericht beabsichtigt, nachfolgenden Verein wegen Mitgliederlosigkeit von Amts wegen zu löschen. Die Frist zur Erhebung eines Widerspruchs gegen die beabsichtigte Löschung wird auf drei Monate festgesetzt."
    },
    {
      "date": "2025-11-18",
      "id": "137609",
      "original_text": "Registerbekanntmachung nach dem Umwandlungsgesetz\nSchleswig-Holstein Amtsgericht Lübeck HRA 11389\nWishi Kapoor e.K. – Glinde",
      "type": "Registerbekanntmachung nach dem Umwandlungsgesetz",
      "state": "Schleswig-Holstein",
      "amtsgericht": "Amtsgericht Lübeck",
      "registernummer": "HRA 11389",
      "registerart": "HRA",
      "company_name": "Wishi Kapoor e.K.",
      "company_seat": "Glinde",
      "details": "18.11.2025 (Bekanntmachungsdatum)\n\nSchleswig-Holstein Amtsgericht Lübeck HRA 11389\nRegisterbekanntmachung nach dem Umwandlungsgesetz 14.11.2025 (Eintragungsdatum)\n\nWishi Kapoor e.K.\nEinzelkaufmann / Einzelkauffrau\nGlinde\n\nZu Eintragungsnummer 2 vom 14.11.2025 wird als nicht eingetragen veröffentlicht: Den Gläubigern der an der Ausgliederung beteiligten Rechtsträger ist, wenn sie binnen sechs Monaten nach dem Tag, an dem die Eintragung der Ausgliederung in das Register des Sitzes desjenigen Rechtsträgers, dessen Gläubiger sie sind, als bekannt gemacht gilt, ihren Anspruch nach Grund und Höhe schriftlich anmelden, Sicherheit zu leisten, soweit sie nicht Befriedigung verlangen können. Dieses Recht steht den Gläubigern jedoch nur zu, wenn sie glaubhaft machen, dass durch die Ausgliederung die Erfüllung ihrer Forderung gefährdet wird."
    },
    {
      "date": "2025-11-18",
      "id": "137610",
      "original_text": "Registerbekanntmachung nach dem Umwandlungsgesetz\nSchleswig-Holstein Amtsgericht Pinneberg HRA 9880\nIrmak Containerdienst e.K. – Pinneberg",
      "type": "Registerbekanntmachung nach dem Umwandlungsgesetz",
      "state": "Schleswig-Holstein",
      "amtsgericht": "Amtsgericht Pinneberg",
      "registernummer": "HRA 9880",
      "registerart": "HRA",
      "company_name": "Irmak Containerdienst e.K.",
      "company_seat": "Pinneberg",
      "details": "18.11.2025 (Bekanntmachungsdatum)\n\nSchleswig-Holstein Amtsgericht Pinneberg HRA 9880\nRegisterbekanntmachung nach dem Umwandlungsgesetz 11.11.2025 (Eintragungsdatum)\n\nIrmak Containerdienst e.K.\nEinzelkaufmann / Einzelkauffrau\nPinneberg\n\nZu Eintragungsnummer 2 vom 11.11.2025 wird als nicht eingetragen veröffentlicht: Als nicht eingetragen wird veröffentlicht: Den Gläubigern der an der Spaltung beteiligten Rechtsträger ist, wenn sie binnen sechs Monaten nach dem Tag, an dem die Eintragung der Spaltung in das Register des Sitzes desjenigen Rechtsträgers, dessen Gläubiger sie sind, als bekannt gemacht gilt, ihren Anspruch nach Grund und Höhe schriftlich anmelden, Sicherheit zu leisten, soweit sie nicht Befriedigung verlangen können. Dieses Recht steht den Gläubigern jedoch nur zu, wenn sie glaubhaft machen, dass durch die Spaltung die Erfüllung ihrer Forderung gefährdet wird. Das Recht, Sicherheitsleistung zu verlangen, steht Gläubigern nicht zu, die im Falle der Insolvenz ein Recht auf vorzugsweise Befriedigung aus einer Deckungsmasse haben, die nach gesetzlicher Vorschrift zu ihrem Schutz errichtet und staatlich überwacht ist."
    },
    {
      "date": "2025-11-18",
      "id": "137611",
      "original_text": "Löschungsankündigung\nSachsen-Anhalt Amtsgericht Stendal HRB 29859\nID-Bau GmbH – Merseburg",
      "type": "Löschungsankündigung",
      "state": "Sachsen-Anhalt",
      "amtsgericht": "Amtsgericht Stendal",
      "registernummer": "HRB 29859",
      "registerart": "HRB",
      "company_name": "ID-Bau GmbH",
      "company_seat": "Merseburg",
      "details": "18.11.2025 (Bekanntmachungsdatum)\n\nSachsen-Anhalt Amtsgericht Stendal HRB 29859\nLöschungsankündigung\n\nID-Bau GmbH\nGesellschaft mit beschränkter Haftung\nMerseburg\n\nDas Registergericht beabsichtigt, nachfolgende Gesellschaften wegen Vermögenslosigkeit von Amts wegen nach § 394 FamFG zu löschen. Die Frist zur Erhebung eines Widerspruchs gegen die beabsichtigte Löschung wird auf drei Monate festgesetzt."
    },
    {
      "date": "2025-11-18",
      "id": "137612",
      "original_text": "Löschungsankündigung\nBerlin Amtsgericht Berlin (Charlottenburg) HRB 211610\nZEPTA Grundstücksgesellschaft mbH – Berlin",
      "type": "Löschungsankündigung",
      "state": "Berlin",
      "amtsgericht": "Amtsgericht Berlin (Charlottenburg)",
      "registernummer": "HRB 211610",
      "registerart": "HRB",
      "company_name": "ZEPTA Grundstücksgesellschaft mbH",
      "company_seat": "Berlin",
      "details": "18.11.2025 (Bekanntmachungsdatum)\n\nBerlin Amtsgericht Berlin (Charlottenburg) HRB 211610\nLöschungsankündigung\n\nZEPTA Grundstücksgesellschaft mbH\nGesellschaft mit beschränkter Haftung\nBerlin\n\nBei der nachstehenden Gesellschaft wird das Amtslöschungsverfahren gemäß § 394 FamFG eingeleitet. Widerspruchsfrist 6 Wochen"
    },
    {
      "date": "2025-11-18",
      "id": "137613",
      "original_text": "Registerbekanntmachung nach dem Umwandlungsgesetz\nBaden-Württemberg Amtsgericht Mannheim HRA 705890\nBonn Immobilien GmbH & Co. KG – Walldürn",
      "type": "Registerbekanntmachung nach dem Umwandlungsgesetz",
      "state": "Baden-Württemberg",
      "amtsgericht": "Amtsgericht Mannheim",
      "registernummer": "HRA 705890",
      "registerart": "HRA",
      "company_name": "Bonn Immobilien GmbH & Co. KG",
      "company_seat": "Walldürn",
      "details": "18.11.2025 (Bekanntmachungsdatum)\n\nBaden-Württemberg Amtsgericht Mannheim HRA 705890\nRegisterbekanntmachung nach dem Umwandlungsgesetz 18.11.2025 (Eintragungsdatum)\n\nBonn Immobilien GmbH & Co. KG\nKommanditgesellschaft\nWalldürn\n\nAls nicht eingetragen wird bekanntgemacht:\nDen Gläubigern der an der Verschmelzung beteiligten Rechtsträger ist, wenn sie binnen sechs Monaten nach dem Tag, an dem die Eintragung der Verschmelzung in das Register des Sitzes desjenigen Rechtsträgers, dessen Gläubiger sie sind, nach § 19 Abs. 3 UmwG als bekanntgemacht gilt, ihren Anspruch nach Grund und Höhe schriftlich anmelden, Sicherheit zu leisten, soweit sie nicht Befriedigung verlangen können. Dieses Recht steht den Gläubigern jedoch nur zu, wenn sie glaubhaft machen, dass durch die Verschmelzung die Erfüllung ihrer Forderung gefährdet wird."
    },
    {
      "date": "2025-11-18",
      "id": "137614",
      "original_text": "Registerbekanntmachung nach dem Umwandlungsgesetz\nBaden-Württemberg Amtsgericht Mannheim HRB 460195\nW. und G. Bonn GmbH – Walldürn",
      "type": "Registerbekanntmachung nach dem Umwandlungsgesetz",
      "state": "Baden-Württemberg",
      "amtsgericht": "Amtsgericht Mannheim",
      "registernummer": "HRB 460195",
      "registerart": "HRB",
      "company_name": "W. und G. Bonn GmbH",
      "company_seat": "Walldürn",
      "details": "18.11.2025 (Bekanntmachungsdatum)\n\nBaden-Württemberg Amtsgericht Mannheim HRB 460195\nRegisterbekanntmachung nach dem Umwandlungsgesetz 18.11.2025 (Eintragungsdatum)\n\nW. und G. Bonn GmbH\nGesellschaft mit beschränkter Haftung\nWalldürn\n\nAls nicht eingetragen wird bekanntgemacht:\nDen Gläubigern der an der Verschmelzung beteiligten Rechtsträger ist, wenn sie binnen sechs Monaten nach dem Tag, an dem die Eintragung der Verschmelzung in das Register des Sitzes desjenigen Rechtsträgers, dessen Gläubiger sie sind, nach § 19 Abs. 3 UmwG als bekanntgemacht gilt, ihren Anspruch nach Grund und Höhe schriftlich anmelden, Sicherheit zu leisten, soweit sie nicht Befriedigung verlangen können. Dieses Recht steht den Gläubigern jedoch nur zu, wenn sie glaubhaft machen, dass durch die Verschmelzung die Erfüllung ihrer Forderung gefährdet wird."
    },
    {
      "date": "2025-11-18",
      "id": "137615",
      "original_text": "Registerbekanntmachung nach dem Umwandlungsgesetz\nBaden-Württemberg Amtsgericht Mannheim HRB 460195\nW. und G. Bonn GmbH – Walldürn",
      "type": "Registerbekanntmachung nach dem Umwandlungsgesetz",
      "state": "Baden-Württemberg",
      "amtsgericht": "Amtsgericht Mannheim",
      "registernummer": "HRB 460195",
      "registerart": "HRB",
      "company_name": "W. und G. Bonn GmbH",
      "company_seat": "Walldürn",
      "details": "18.11.2025 (Bekanntmachungsdatum)\n\nBaden-Württemberg Amtsgericht Mannheim HRB 460195\nRegisterbekanntmachung nach dem Umwandlungsgesetz 18.11.2025 (Eintragungsdatum)\n\nW. und G. Bonn GmbH\nGesellschaft mit beschränkter Haftung\nWalldürn\n\nAls nicht eingetragen wird bekanntgemacht:\nDen Gläubigern der an der Verschmelzung beteiligten Rechtsträger ist, wenn sie binnen sechs Monaten nach dem Tag, an dem die Eintragung der Verschmelzung in das Register des Sitzes desjenigen Rechtsträgers, dessen Gläubiger sie sind, nach § 19 Abs. 3 UmwG als bekanntgemacht gilt, ihren Anspruch nach Grund und Höhe schriftlich anmelden, Sicherheit zu leisten, soweit sie nicht Befriedigung verlangen können. Dieses Recht steht den Gläubigern jedoch nur zu, wenn sie glaubhaft machen, dass durch die Verschmelzung die Erfüllung ihrer Forderung gefährdet wird."
    },
    {
      "date": "2025-11-18",
      "id": "137616",
      "original_text": "Löschungsankündigung\nBrandenburg Amtsgericht Frankfurt/Oder HRB 19681\nDesinfekt Schädlingsbekämpfung UG (haftungsbeschränkt) – Rüdersdorf bei Berlin",
      "type": "Löschungsankündigung",
      "state": "Brandenburg",
      "amtsgericht": "Amtsgericht Frankfurt/Oder",
      "registernummer": "HRB 19681",
      "registerart": "HRB",
      "company_name": "Desinfekt Schädlingsbekämpfung UG (haftungsbeschränkt)",
      "company_seat": "Rüdersdorf bei Berlin",
      "details": "18.11.2025 (Bekanntmachungsdatum)\n\nBrandenburg Amtsgericht Frankfurt/Oder HRB 19681\nLöschungsankündigung\n\nDesinfekt Schädlingsbekämpfung UG (haftungsbeschränkt)\nGesellschaft mit beschränkter Haftung\nRüdersdorf bei Berlin\n\nBei der nachstehenden Gesellschaft wird das Amtslöschungsverfahren gemäß § 394 FamFG eingeleitet."
    },
    {
      "date": "2025-11-18",
      "id": "137617",
      "original_text": "Sonstige Registerbekanntmachung\nHamburg Amtsgericht Hamburg HRB 91799\nDeutsche EuroShop AG – Hamburg",
      "type": "Sonstige Registerbekanntmachung",
      "state": "Hamburg",
      "amtsgericht": "Amtsgericht Hamburg",
      "registernummer": "HRB 91799",
      "registerart": "HRB",
      "company_name": "Deutsche EuroShop AG",
      "company_seat": "Hamburg",
      "details": "18.11.2025 (Bekanntmachungsdatum)\n\nHamburg Amtsgericht Hamburg HRB 91799\nSonstige Registerbekanntmachung 18.11.2025 (Eintragungsdatum)\n\nDeutsche EuroShop AG\nAktiengesellschaft\nHamburg\n\nGläubiger, deren Forderungen begründet worden sind, bevor die Eintragung der Kapitalherabsetzung bekanntgemacht worden ist, haben das Recht, Sicherheit zu verlangen, soweit sie nicht Befriedigung verlangen können, wenn sie sich binnen sechs Monaten nach der Bekanntmachung der Kapitalherabsetzung zu diesem Zweck melden."
    },
    {
      "date": "2025-11-18",
      "id": "137618",
      "original_text": "Registerbekanntmachung nach dem Umwandlungsgesetz\nBaden-Württemberg Amtsgericht Stuttgart HRB 801231\nCarbonschmide GmbH – Grafenberg",
      "type": "Registerbekanntmachung nach dem Umwandlungsgesetz",
      "state": "Baden-Württemberg",
      "amtsgericht": "Amtsgericht Stuttgart",
      "registernummer": "HRB 801231",
      "registerart": "HRB",
      "company_name": "Carbonschmide GmbH",
      "company_seat": "Grafenberg",
      "details": "18.11.2025 (Bekanntmachungsdatum)\n\nBaden-Württemberg Amtsgericht Stuttgart HRB 801231\nRegisterbekanntmachung nach dem Umwandlungsgesetz 18.11.2025 (Eintragungsdatum)\n\nCarbonschmide GmbH\nGesellschaft mit beschränkter Haftung\nGrafenberg\n\nDen Gläubigern der an der Ausgliederung beteiligten Rechtsträger ist, wenn sie binnen sechs Monaten nach dem Tag, an dem die Eintragung der Ausgliederung in das Register des Sitzes desjenigen Rechtsträgers, dessen Gläubiger sie sind, nach § 19 Abs. 3 UmwG als bekanntgemacht gilt, ihren Anspruch nach Grund und Höhe schriftlich anmelden, Sicherheit zu leisten, soweit sie nicht Befriedigung verlangen können. Dieses Recht steht den Gläubigern jedoch nur zu, wenn sie glaubhaft machen, dass durch die Ausgliederung die Erfüllung ihrer Forderung gefährdet wird."
    },
    {
      "date": "2025-11-18",
      "id": "137619",
      "original_text": "Löschungsankündigung\nBrandenburg Amtsgericht Frankfurt/Oder HRB 13502\nFCC Franke Coal-Trading International GmbH – Woltersdorf",
      "type": "Löschungsankündigung",
      "state": "Brandenburg",
      "amtsgericht": "Amtsgericht Frankfurt/Oder",
      "registernummer": "HRB 13502",
      "registerart": "HRB",
      "company_name": "FCC Franke Coal-Trading International GmbH",
      "company_seat": "Woltersdorf",
      "details": "18.11.2025 (Bekanntmachungsdatum)\n\nBrandenburg Amtsgericht Frankfurt/Oder HRB 13502\nLöschungsankündigung\n\nFCC Franke Coal-Trading International GmbH\nGesellschaft mit beschränkter Haftung\nWoltersdorf\n\nBei der nachstehenden Gesellschaft wird das Amtslöschungsverfahren gemäß § 394 FamFG eingeleitet."
    },
    {
      "date": "2025-11-18",
      "id": "137620",
      "original_text": "Registerbekanntmachung nach dem Umwandlungsgesetz\nBaden-Württemberg Amtsgericht Stuttgart HRA 726565\nCarbon-Schmide Ulrich Schmid e.K. – Grafenberg",
      "type": "Registerbekanntmachung nach dem Umwandlungsgesetz",
      "state": "Baden-Württemberg",
      "amtsgericht": "Amtsgericht Stuttgart",
      "registernummer": "HRA 726565",
      "registerart": "HRA",
      "company_name": "Carbon-Schmide Ulrich Schmid e.K.",
      "company_seat": "Grafenberg",
      "details": "18.11.2025 (Bekanntmachungsdatum)\n\nBaden-Württemberg Amtsgericht Stuttgart HRA 726565\nRegisterbekanntmachung nach dem Umwandlungsgesetz 18.11.2025 (Eintragungsdatum)\n\nCarbon-Schmide Ulrich Schmid e.K.\nEinzelkaufmann / Einzelkauffrau\nGrafenberg\n\nAls nicht eingetragen wird bekanntgemacht:\nDen Gläubigern der an der Ausgliederung beteiligten Rechtsträger ist, wenn sie binnen sechs Monaten nach dem Tag, an dem die Eintragung der Ausgliederung in das Register des Sitzes desjenigen Rechtsträgers, dessen Gläubiger sie sind, nach § 19 Abs. 3 UmwG als bekanntgemacht gilt, ihren Anspruch nach Grund und Höhe schriftlich anmelden, Sicherheit zu leisten, soweit sie nicht Befriedigung verlangen können. Dieses Recht steht den Gläubigern jedoch nur zu, wenn sie glaubhaft machen, dass durch die Ausgliederung die Erfüllung ihrer Forderung gefährdet wird."
    },
    {
      "date": "2025-11-18",
      "id": "137621",
      "original_text": "Registerbekanntmachung nach dem Umwandlungsgesetz\nThüringen Amtsgericht Jena HRB 305587\nMondi Sonneberg GmbH – Sonneberg",
      "type": "Registerbekanntmachung nach dem Umwandlungsgesetz",
      "state": "Thüringen",
      "amtsgericht": "Amtsgericht Jena",
      "registernummer": "HRB 305587",
      "registerart": "HRB",
      "company_name": "Mondi Sonneberg GmbH",
      "company_seat": "Sonneberg",
      "details": "18.11.2025 (Bekanntmachungsdatum)\n\nThüringen Amtsgericht Jena HRB 305587\nRegisterbekanntmachung nach dem Umwandlungsgesetz 18.11.2025 (Eintragungsdatum)\n\nMondi Sonneberg GmbH\nGesellschaft mit beschränkter Haftung\nSonneberg\n\nNicht eingetragen: Den Gläubigern der an der Verschmelzung beteiligten Rechtsträger, ist wenn sie binnen sechs Monaten nach dem Tag, an dem die Eintragung der Verschmelzung in das Register des Sitzes desjenigen Rechtsträgers, dessen Gläubiger sie sind,  nach § 19 Abs. 3 UmwG als bekanntgemacht gilt, ihren Anspruch nach Grund und Höhe schriftlich anmelden, Sicherheit zu leisten, soweit sie nicht Befriedigung verlangen können. Dieses Recht steht ihnen jedoch nur zu, wenn sie glaubhaft machen, daß durch die Verschmelzung die Erfüllung ihrer Forderung gefährdet wird."
    },
    {
      "date": "2025-11-18",
      "id": "137622",
      "original_text": "Registerbekanntmachung nach dem Umwandlungsgesetz\nThüringen Amtsgericht Jena HRB 305584\nLUCE Verwaltungs- und Beteiligungs-GmbH – Sonneberg",
      "type": "Registerbekanntmachung nach dem Umwandlungsgesetz",
      "state": "Thüringen",
      "amtsgericht": "Amtsgericht Jena",
      "registernummer": "HRB 305584",
      "registerart": "HRB",
      "company_name": "LUCE Verwaltungs- und Beteiligungs-GmbH",
      "company_seat": "Sonneberg",
      "details": "18.11.2025 (Bekanntmachungsdatum)\n\nThüringen Amtsgericht Jena HRB 305584\nRegisterbekanntmachung nach dem Umwandlungsgesetz 18.11.2025 (Eintragungsdatum)\n\nLUCE Verwaltungs- und Beteiligungs-GmbH\nGesellschaft mit beschränkter Haftung\nSonneberg\n\nNicht eingetragen: Den Gläubigern der an der Verschmelzung beteiligten Rechtsträger, ist wenn sie binnen sechs Monaten nach dem Tag, an dem die Eintragung der Verschmelzung in das Register des Sitzes desjenigen Rechtsträgers, dessen Gläubiger sie sind,  nach § 19 Abs. 3 UmwG als bekanntgemacht gilt, ihren Anspruch nach Grund und Höhe schriftlich anmelden, Sicherheit zu leisten, soweit sie nicht Befriedigung verlangen können. Dieses Recht steht ihnen jedoch nur zu, wenn sie glaubhaft machen, daß durch die Verschmelzung die Erfüllung ihrer Forderung gefährdet wird."
    },
    {
      "date": "2025-11-18",
      "id": "137623",
      "original_text": "Löschungsankündigung\nBaden-Württemberg Amtsgericht Stuttgart HRB 789506\nAvoncourt Partners GmbH – Stuttgart",
      "type": "Löschungsankündigung",
      "state": "Baden-Württemberg",
      "amtsgericht": "Amtsgericht Stuttgart",
      "registernummer": "HRB 789506",
      "registerart": "HRB",
      "company_name": "Avoncourt Partners GmbH",
      "company_seat": "Stuttgart",
      "details": "18.11.2025 (Bekanntmachungsdatum)\n\nBaden-Württemberg Amtsgericht Stuttgart HRB 789506\nLöschungsankündigung\n\nAvoncourt Partners GmbH\nGesellschaft mit beschränkter Haftung\nStuttgart\n\nAls nicht eingetragen wird bekanntgemacht:\nDas Gericht beabsichtigt, die Gesellschaft wegen Vermögenslosigkeit im Handelsregister von Amts wegen nach § 394 FamFG zu löschen. Die Frist zur Geltendmachung eines Widerspruchs gegen die beabsichtigte Löschung ist auf zwei Monate ab Veröffentlichung bestimmt."
    },
    {
      "date": "2025-11-18",
      "id": "137624",
      "original_text": "Registerbekanntmachung nach dem Umwandlungsgesetz\nBerlin Amtsgericht Berlin (Charlottenburg) HRA 64933\nBening Consulting Advisory e.K. – Berlin",
      "type": "Registerbekanntmachung nach dem Umwandlungsgesetz",
      "state": "Berlin",
      "amtsgericht": "Amtsgericht Berlin (Charlottenburg)",
      "registernummer": "HRA 64933",
      "registerart": "HRA",
      "company_name": "Bening Consulting Advisory e.K.",
      "company_seat": "Berlin",
      "details": "18.11.2025 (Bekanntmachungsdatum)\n\nBerlin Amtsgericht Berlin (Charlottenburg) HRA 64933\nRegisterbekanntmachung nach dem Umwandlungsgesetz 17.11.2025 (Eintragungsdatum)\n\nBening Consulting Advisory e.K.\nEinzelkaufmann / Einzelkauffrau\nBerlin\n\nZu Eintragungsnummer 2 vom 17.11.2025 wird als nicht eingetragen veröffentlicht: Den Gläubigern der an der Spaltung beteiligten Rechtsträger ist, wenn sie binnen sechs Monaten nach dem Tag, an dem die Eintragung der Spaltung in das Register des Sitzes desjenigen Rechtsträgers, dessen Gläubiger sie sind, als bekannt gemacht gilt, ihren Anspruch nach Grund und Höhe schriftlich anmelden, Sicherheit zu leisten, soweit sie nicht Befriedigung verlangen können. Dieses Recht steht den Gläubigern jedoch nur zu, wenn sie glaubhaft machen, dass durch die Spaltung die Erfüllung ihrer Forderung gefährdet wird. Das Recht, Sicherheitsleistung zu verlangen, steht Gläubigern nicht zu, die im Falle der Insolvenz ein Recht auf vorzugsweise Befriedigung aus einer Deckungsmasse haben, die nach gesetzlicher Vorschrift zu ihrem Schutz errichtet und staatlich überwacht ist."
    },
    {
      "date": "2025-11-18",
      "id": "137625",
      "original_text": "Registerbekanntmachung nach dem Umwandlungsgesetz\nBerlin Amtsgericht Berlin (Charlottenburg) HRB 281294\nBening Consulting Advisory GmbH – Berlin",
      "type": "Registerbekanntmachung nach dem Umwandlungsgesetz",
      "state": "Berlin",
      "amtsgericht": "Amtsgericht Berlin (Charlottenburg)",
      "registernummer": "HRB 281294",
      "registerart": "HRB",
      "company_name": "Bening Consulting Advisory GmbH",
      "company_seat": "Berlin",
      "details": "18.11.2025 (Bekanntmachungsdatum)\n\nBerlin Amtsgericht Berlin (Charlottenburg) HRB 281294\nRegisterbekanntmachung nach dem Umwandlungsgesetz 17.11.2025 (Eintragungsdatum)\n\nBening Consulting Advisory GmbH\nGesellschaft mit beschränkter Haftung\nBerlin\n\nZu Eintragungsnummer 1 vom 17.11.2025 wird als nicht eingetragen veröffentlicht: Den Gläubigern der an der Spaltung beteiligten Rechtsträger ist, wenn sie binnen sechs Monaten nach dem Tag, an dem die Eintragung der Spaltung in das Register des Sitzes desjenigen Rechtsträgers, dessen Gläubiger sie sind, als bekannt gemacht gilt, ihren Anspruch nach Grund und Höhe schriftlich anmelden, Sicherheit zu leisten, soweit sie nicht Befriedigung verlangen können. Dieses Recht steht den Gläubigern jedoch nur zu, wenn sie glaubhaft machen, dass durch die Spaltung die Erfüllung ihrer Forderung gefährdet wird. Das Recht, Sicherheitsleistung zu verlangen, steht Gläubigern nicht zu, die im Falle der Insolvenz ein Recht auf vorzugsweise Befriedigung aus einer Deckungsmasse haben, die nach gesetzlicher Vorschrift zu ihrem Schutz errichtet und staatlich überwacht ist."
    },
    {
      "date": "2025-11-18",
      "id": "137626",
      "original_text": "Löschungsankündigung\nBaden-Württemberg Amtsgericht Stuttgart HRB 785535\nLA Holding GmbH – Ludwigsburg",
      "type": "Löschungsankündigung",
      "state": "Baden-Württemberg",
      "amtsgericht": "Amtsgericht Stuttgart",
      "registernummer": "HRB 785535",
      "registerart": "HRB",
      "company_name": "LA Holding GmbH",
      "company_seat": "Ludwigsburg",
      "details": "18.11.2025 (Bekanntmachungsdatum)\n\nBaden-Württemberg Amtsgericht Stuttgart HRB 785535\nLöschungsankündigung\n\nLA Holding GmbH\nGesellschaft mit beschränkter Haftung\nLudwigsburg\n\nAls nicht eingetragen wird bekanntgemacht:\nDas Gericht beabsichtigt, die Gesellschaft wegen Vermögenslosigkeit im Handelsregister von Amts wegen nach § 394 FamFG zu löschen. Die Frist zur Geltendmachung eines Widerspruchs gegen die beabsichtigte Löschung ist auf zwei Monate ab Veröffentlichung bestimmt."
    },
    {
      "date": "2025-11-18",
      "id": "137627",
      "original_text": "Registerbekanntmachung nach dem Umwandlungsgesetz\nBerlin Amtsgericht Berlin (Charlottenburg) HRA 64700\nElektro Sandner e. K. – Berlin",
      "type": "Registerbekanntmachung nach dem Umwandlungsgesetz",
      "state": "Berlin",
      "amtsgericht": "Amtsgericht Berlin (Charlottenburg)",
      "registernummer": "HRA 64700",
      "registerart": "HRA",
      "company_name": "Elektro Sandner e. K.",
      "company_seat": "Berlin",
      "details": "18.11.2025 (Bekanntmachungsdatum)\n\nBerlin Amtsgericht Berlin (Charlottenburg) HRA 64700\nRegisterbekanntmachung nach dem Umwandlungsgesetz 17.11.2025 (Eintragungsdatum)\n\nElektro Sandner e. K.\nEinzelkaufmann / Einzelkauffrau\nBerlin\n\nZu Eintragungsnummer 2 vom 17.11.2025 wird als nicht eingetragen veröffentlicht:\nDen Gläubigern der an der Verschmelzung beteiligten Rechtsträger ist, wenn sie binnen sechs Monaten nach dem Tag, an dem die Eintragung der Verschmelzung in das Register des Sitzes desjenigen Rechtsträgers, dessen Gläubiger sie sind, als bekannt gemacht gilt, ihren Anspruch nach Grund und Höhe schriftlich anmelden, Sicherheit zu leisten, soweit sie nicht Befriedigung verlangen können. Dieses Recht steht den Gläubigern jedoch nur zu, wenn sie glaubhaft machen, dass durch die Verschmelzung die Erfüllung ihrer Forderung gefährdet wird. Das Recht, Sicherheitsleistung zu verlangen, steht Gläubigern nicht zu, die im Falle der Insolvenz ein Recht auf vorzugsweise Befriedigung aus einer Deckungsmasse haben, die nach gesetzlicher Vorschrift zu ihrem Schutz errichtet und staatlich überwacht ist."
    },
    {
      "date": "2025-11-18",
      "id": "137628",
      "original_text": "Registerbekanntmachung nach dem Umwandlungsgesetz\nBaden-Württemberg Amtsgericht Ulm HRB 750385\nAztecai GmbH – Laupheim",
      "type": "Registerbekanntmachung nach dem Umwandlungsgesetz",
      "state": "Baden-Württemberg",
      "amtsgericht": "Amtsgericht Ulm",
      "registernummer": "HRB 750385",
      "registerart": "HRB",
      "company_name": "Aztecai GmbH",
      "company_seat": "Laupheim",
      "details": "18.11.2025 (Bekanntmachungsdatum)\n\nBaden-Württemberg Amtsgericht Ulm HRB 750385\nRegisterbekanntmachung nach dem Umwandlungsgesetz 18.11.2025 (Eintragungsdatum)\n\nAztecai GmbH\nGesellschaft mit beschränkter Haftung\nLaupheim\n\nAls nicht eingetragen wird bekanntgemacht:\nDen Gläubigern der an der Ausgliederung beteiligten Rechtsträger ist, wenn sie binnen sechs Monaten nach dem Tag, an dem die Eintragung der Ausgliederung in das Register des Sitzes desjenigen Rechtsträgers, dessen Gläubiger sie sind, nach § 19 Abs. 3 UmwG als bekanntgemacht gilt, ihren Anspruch nach Grund und Höhe schriftlich anmelden, Sicherheit zu leisten, soweit sie nicht Befriedigung verlangen können. Dieses Recht steht den Gläubigern jedoch nur zu, wenn sie glaubhaft machen, dass durch die Ausgliederung die Erfüllung ihrer Forderung gefährdet wird."
    },
    {
      "date": "2025-11-18",
      "id": "137629",
      "original_text": "Registerbekanntmachung nach dem Umwandlungsgesetz\nBaden-Württemberg Amtsgericht Stuttgart HRA 742151\nLidl 405 GmbH & Co. KG – Bad Wimpfen",
      "type": "Registerbekanntmachung nach dem Umwandlungsgesetz",
      "state": "Baden-Württemberg",
      "amtsgericht": "Amtsgericht Stuttgart",
      "registernummer": "HRA 742151",
      "registerart": "HRA",
      "company_name": "Lidl 405 GmbH & Co. KG",
      "company_seat": "Bad Wimpfen",
      "details": "18.11.2025 (Bekanntmachungsdatum)\n\nBaden-Württemberg Amtsgericht Stuttgart HRA 742151\nRegisterbekanntmachung nach dem Umwandlungsgesetz 18.11.2025 (Eintragungsdatum)\n\nLidl 405 GmbH & Co. KG\nKommanditgesellschaft\nBad Wimpfen\n\nDen Gläubigern der an der Ausgliederung beteiligten Rechtsträger ist, wenn sie binnen sechs Monaten nach dem Tag, an dem die Eintragung der Ausgliederung in das Register des Sitzes desjenigen Rechtsträgers, dessen Gläubiger sie sind, nach § 19 Abs. 3 UmwG als bekanntgemacht gilt, ihren Anspruch nach Grund und Höhe schriftlich anmelden, Sicherheit zu leisten, soweit sie nicht Befriedigung verlangen können. Dieses Recht steht den Gläubigern jedoch nur zu, wenn sie glaubhaft machen, dass durch die Ausgliederung die Erfüllung ihrer Forderung gefährdet wird."
    },
    {
      "date": "2025-11-18",
      "id": "137630",
      "original_text": "Registerbekanntmachung nach dem Umwandlungsgesetz\nBaden-Württemberg Amtsgericht Ulm HRA 729711\nAztecAI Solutions Jaime Pena e.K. – Laupheim",
      "type": "Registerbekanntmachung nach dem Umwandlungsgesetz",
      "state": "Baden-Württemberg",
      "amtsgericht": "Amtsgericht Ulm",
      "registernummer": "HRA 729711",
      "registerart": "HRA",
      "company_name": "AztecAI Solutions Jaime Pena e.K.",
      "company_seat": "Laupheim",
      "details": "18.11.2025 (Bekanntmachungsdatum)\n\nBaden-Württemberg Amtsgericht Ulm HRA 729711\nRegisterbekanntmachung nach dem Umwandlungsgesetz 18.11.2025 (Eintragungsdatum)\n\nAztecAI Solutions Jaime Pena e.K.\nEinzelkaufmann / Einzelkauffrau\nLaupheim\n\nAls nicht eingetragen wird bekanntgemacht:\nDen Gläubigern der an der Ausgliederung beteiligten Rechtsträger ist, wenn sie binnen sechs Monaten nach dem Tag, an dem die Eintragung der Ausgliederung in das Register des Sitzes desjenigen Rechtsträgers, dessen Gläubiger sie sind, nach § 19 Abs. 3 UmwG als bekanntgemacht gilt, ihren Anspruch nach Grund und Höhe schriftlich anmelden, Sicherheit zu leisten, soweit sie nicht Befriedigung verlangen können. Dieses Recht steht den Gläubigern jedoch nur zu, wenn sie glaubhaft machen, dass durch die Ausgliederung die Erfüllung ihrer Forderung gefährdet wird."
    },
    {
      "date": "2025-11-18",
      "id": "137631",
      "original_text": "Löschungsankündigung\nBerlin Amtsgericht Berlin (Charlottenburg) HRB 148616\nMr.KEY.de SICHERHEITSTECHNIKFACHGESCHÄFT, SCHLÜSSELDIENST, SCHLÜSSELDIENSTZUBEHÖR GmbH – Berlin",
      "type": "Löschungsankündigung",
      "state": "Berlin",
      "amtsgericht": "Amtsgericht Berlin (Charlottenburg)",
      "registernummer": "HRB 148616",
      "registerart": "HRB",
      "company_name": "Mr.KEY.de SICHERHEITSTECHNIKFACHGESCHÄFT, SCHLÜSSELDIENST, SCHLÜSSELDIENSTZUBEHÖR GmbH",
      "company_seat": "Berlin",
      "details": "18.11.2025 (Bekanntmachungsdatum)\n\nBerlin Amtsgericht Berlin (Charlottenburg) HRB 148616\nLöschungsankündigung\n\nMr.KEY.de SICHERHEITSTECHNIKFACHGESCHÄFT, SCHLÜSSELDIENST, SCHLÜSSELDIENSTZUBEHÖR GmbH\nGesellschaft mit beschränkter Haftung\nBerlin\n\nBei der nachstehenden Gesellschaft wird das Amtslöschungsverfahren gemäß § 394 FamFG eingeleitet. Widerspruchsfrist 6 Wochen"
    },
    {
      "date": "2025-11-18",
      "id": "137632",
      "original_text": "Löschungsankündigung\nBerlin Amtsgericht Berlin (Charlottenburg) HRB 231605\nSafe45 GmbH – Berlin",
      "type": "Löschungsankündigung",
      "state": "Berlin",
      "amtsgericht": "Amtsgericht Berlin (Charlottenburg)",
      "registernummer": "HRB 231605",
      "registerart": "HRB",
      "company_name": "Safe45 GmbH",
      "company_seat": "Berlin",
      "details": "18.11.2025 (Bekanntmachungsdatum)\n\nBerlin Amtsgericht Berlin (Charlottenburg) HRB 231605\nLöschungsankündigung\n\nSafe45 GmbH\nGesellschaft mit beschränkter Haftung\nBerlin\n\nBei der nachstehenden Gesellschaft wird das Amtslöschungsverfahren gemäß § 394 FamFG eingeleitet. Widerspruchsfrist 6 Wochen"
    },
    {
      "date": "2025-11-18",
      "id": "137633",
      "original_text": "Löschungsankündigung\nBerlin Amtsgericht Berlin (Charlottenburg) HRB 237744\nEuá Management UG (haftungsbeschränkt) – Berlin",
      "type": "Löschungsankündigung",
      "state": "Berlin",
      "amtsgericht": "Amtsgericht Berlin (Charlottenburg)",
      "registernummer": "HRB 237744",
      "registerart": "HRB",
      "company_name": "Euá Management UG (haftungsbeschränkt)",
      "company_seat": "Berlin",
      "details": "18.11.2025 (Bekanntmachungsdatum)\n\nBerlin Amtsgericht Berlin (Charlottenburg) HRB 237744\nLöschungsankündigung\n\nEuá Management UG (haftungsbeschränkt)\nGesellschaft mit beschränkter Haftung\nBerlin\n\nBei der nachstehenden Gesellschaft wird das Amtslöschungsverfahren gemäß § 394 FamFG eingeleitet. Widerspruchsfrist 6 Wochen"
    },
    {
      "date": "2025-11-18",
      "id": "137634",
      "original_text": "Registerbekanntmachung nach dem Umwandlungsgesetz\nSchleswig-Holstein Amtsgericht Lübeck HRB 24931\nTjara Leipzig GmbH – Lübeck",
      "type": "Registerbekanntmachung nach dem Umwandlungsgesetz",
      "state": "Schleswig-Holstein",
      "amtsgericht": "Amtsgericht Lübeck",
      "registernummer": "HRB 24931",
      "registerart": "HRB",
      "company_name": "Tjara Leipzig GmbH",
      "company_seat": "Lübeck",
      "details": "18.11.2025 (Bekanntmachungsdatum)\n\nSchleswig-Holstein Amtsgericht Lübeck HRB 24931\nRegisterbekanntmachung nach dem Umwandlungsgesetz 17.11.2025 (Eintragungsdatum)\n\nTjara Leipzig GmbH\nGesellschaft mit beschränkter Haftung\nLübeck\n\nZu Eintragungsnummer 4 vom 17.11.2025 wird als nicht eingetragen veröffentlicht:  Als nicht eingetragen wird veröffentlicht: Den Gläubigern der an der Verschmelzung beteiligten Rechtsträger ist, wenn sie binnen sechs Monaten nach dem Tag, an dem die Eintragung der Verschmelzung in das Register des Sitzes desjenigen Rechtsträgers, dessen Gläubiger sie sind, als bekannt gemacht gilt, ihren Anspruch nach Grund und Höhe schriftlich anmelden, Sicherheit zu leisten, soweit sie nicht Befriedigung verlangen können. Dieses Recht steht den Gläubigern jedoch nur zu, wenn sie glaubhaft machen, dass durch die Verschmelzung die Erfüllung ihrer Forderung gefährdet wird."
    },
    {
      "date": "2025-11-18",
      "id": "137635",
      "original_text": "Registerbekanntmachung nach dem Umwandlungsgesetz\nHamburg Amtsgericht Hamburg HRB 153996\nEMS Verwaltungsgesellschaft mbH – Hamburg",
      "type": "Registerbekanntmachung nach dem Umwandlungsgesetz",
      "state": "Hamburg",
      "amtsgericht": "Amtsgericht Hamburg",
      "registernummer": "HRB 153996",
      "registerart": "HRB",
      "company_name": "EMS Verwaltungsgesellschaft mbH",
      "company_seat": "Hamburg",
      "details": "18.11.2025 (Bekanntmachungsdatum)\n\nHamburg Amtsgericht Hamburg HRB 153996\nRegisterbekanntmachung nach dem Umwandlungsgesetz 18.11.2025 (Eintragungsdatum)\n\nEMS Verwaltungsgesellschaft mbH\nGesellschaft mit beschränkter Haftung\nHamburg\n\nAls nicht eingetragen wird bekannt gemacht:\nDen Gläubigern der an der Verschmelzung beteiligten Gesellschaften ist, wenn sie binnen sechs Monaten nach dem Tag, an dem die Eintragung der Verschmelzung in das Register des Sitzes desjenigen Rechtsträgers, dessen Gläubiger sie sind, nach § 19 Absatz 3 UmwG als bekannt gemacht gilt, ihren Anspruch nach Grund und Höhe schriftlich anmelden, Sicherheit zu leisten, soweit sie nicht Befriedigung verlangen können. Dieses Recht steht den Gläubigern jedoch nur zu, wenn sie glaubhaft machen, dass durch die Verschmelzung die Erfüllung ihrer Forderung gefährdet wird."
    },
    {
      "date": "2025-11-18",
      "id": "137636",
      "original_text": "Sonstige Registerbekanntmachung\nHamburg Amtsgericht Hamburg HRB 82190\nShell Deutschland GmbH – Hamburg",
      "type": "Sonstige Registerbekanntmachung",
      "state": "Hamburg",
      "amtsgericht": "Amtsgericht Hamburg",
      "registernummer": "HRB 82190",
      "registerart": "HRB",
      "company_name": "Shell Deutschland GmbH",
      "company_seat": "Hamburg",
      "details": "18.11.2025 (Bekanntmachungsdatum)\n\nHamburg Amtsgericht Hamburg HRB 82190\nSonstige Registerbekanntmachung\n\nShell Deutschland GmbH\nGesellschaft mit beschränkter Haftung\nHamburg\n\nAls nicht eingetragen wird bekannt gemacht: Liste des Aufsichtsrats wurde eingereicht."
    },
    {
      "date": "2025-11-18",
      "id": "137637",
      "original_text": "Einreichung neuer Dokumente\nHamburg Amtsgericht Hamburg HRB 2697\nSAGA Siedlungs-Aktiengesellschaft Hamburg – Hamburg",
      "type": "Einreichung neuer Dokumente",
      "state": "Hamburg",
      "amtsgericht": "Amtsgericht Hamburg",
      "registernummer": "HRB 2697",
      "registerart": "HRB",
      "company_name": "SAGA Siedlungs-Aktiengesellschaft Hamburg",
      "company_seat": "Hamburg",
      "details": "18.11.2025 (Bekanntmachungsdatum)\n\nHamburg Amtsgericht Hamburg HRB 2697\nEinreichung neuer Dokumente\n\nSAGA Siedlungs-Aktiengesellschaft Hamburg\nAktiengesellschaft\nHamburg\n\nAls nicht eingetragen wird bekannt gemacht: Liste des Aufsichtsrats wurde eingereicht."
    },
    {
      "date": "2025-11-18",
      "id": "137638",
      "original_text": "Registerbekanntmachung nach dem Umwandlungsgesetz\nBaden-Württemberg Amtsgericht Stuttgart HRA 742122\nLidl 403 GmbH & Co. KG – Bad Wimpfen",
      "type": "Registerbekanntmachung nach dem Umwandlungsgesetz",
      "state": "Baden-Württemberg",
      "amtsgericht": "Amtsgericht Stuttgart",
      "registernummer": "HRA 742122",
      "registerart": "HRA",
      "company_name": "Lidl 403 GmbH & Co. KG",
      "company_seat": "Bad Wimpfen",
      "details": "18.11.2025 (Bekanntmachungsdatum)\n\nBaden-Württemberg Amtsgericht Stuttgart HRA 742122\nRegisterbekanntmachung nach dem Umwandlungsgesetz 17.11.2025 (Eintragungsdatum)\n\nLidl 403 GmbH & Co. KG\nKommanditgesellschaft\nBad Wimpfen\n\nAls nicht eingetragen wird bekanntgemacht:\nDen Gläubigern der an der Ausgliederung beteiligten Rechtsträger ist, wenn sie binnen sechs Monaten nach dem Tag, an dem die Eintragung der Ausgliederung in das Register des Sitzes desjenigen Rechtsträgers, dessen Gläubiger sie sind, nach § 19 Abs. 3 UmwG als bekanntgemacht gilt, ihren Anspruch nach Grund und Höhe schriftlich anmelden, Sicherheit zu leisten, soweit sie nicht Befriedigung verlangen können. Dieses Recht steht den Gläubigern jedoch nur zu, wenn sie glaubhaft machen, dass durch die Ausgliederung die Erfüllung ihrer Forderung gefährdet wird."
    },
    {
      "date": "2025-11-18",
      "id": "137639",
      "original_text": "Registerbekanntmachung nach dem Umwandlungsgesetz\nBaden-Württemberg Amtsgericht Stuttgart HRA 742099\nLidl 418 GmbH & Co. KG – Bad Wimpfen",
      "type": "Registerbekanntmachung nach dem Umwandlungsgesetz",
      "state": "Baden-Württemberg",
      "amtsgericht": "Amtsgericht Stuttgart",
      "registernummer": "HRA 742099",
      "registerart": "HRA",
      "company_name": "Lidl 418 GmbH & Co. KG",
      "company_seat": "Bad Wimpfen",
      "details": "18.11.2025 (Bekanntmachungsdatum)\n\nBaden-Württemberg Amtsgericht Stuttgart HRA 742099\nRegisterbekanntmachung nach dem Umwandlungsgesetz 18.11.2025 (Eintragungsdatum)\n\nLidl 418 GmbH & Co. KG\nKommanditgesellschaft\nBad Wimpfen\n\nAls nicht eingetragen wird bekanntgemacht:\nDen Gläubigern der an der Ausgliederung beteiligten Rechtsträger ist, wenn sie binnen sechs Monaten nach dem Tag, an dem die Eintragung der Ausgliederung in das Register des Sitzes desjenigen Rechtsträgers, dessen Gläubiger sie sind, nach § 19 Abs. 3 UmwG als bekanntgemacht gilt, ihren Anspruch nach Grund und Höhe schriftlich anmelden, Sicherheit zu leisten, soweit sie nicht Befriedigung verlangen können. Dieses Recht steht den Gläubigern jedoch nur zu, wenn sie glaubhaft machen, dass durch die Ausgliederung die Erfüllung ihrer Forderung gefährdet wird."
    },
    {
      "date": "2025-11-18",
      "id": "137640",
      "original_text": "Registerbekanntmachung nach dem Umwandlungsgesetz\nHamburg Amtsgericht Hamburg HRB 155353\nEverest Verwaltungsgesellschaft mbH – Hamburg",
      "type": "Registerbekanntmachung nach dem Umwandlungsgesetz",
      "state": "Hamburg",
      "amtsgericht": "Amtsgericht Hamburg",
      "registernummer": "HRB 155353",
      "registerart": "HRB",
      "company_name": "Everest Verwaltungsgesellschaft mbH",
      "company_seat": "Hamburg",
      "details": "18.11.2025 (Bekanntmachungsdatum)\n\nHamburg Amtsgericht Hamburg HRB 155353\nRegisterbekanntmachung nach dem Umwandlungsgesetz 18.11.2025 (Eintragungsdatum)\n\nEverest Verwaltungsgesellschaft mbH\nGesellschaft mit beschränkter Haftung\nHamburg\n\nAls nicht eingetragen wird bekannt gemacht:\nDen Gläubigern der an der Verschmelzung beteiligten Gesellschaften ist, wenn sie binnen sechs Monaten nach dem Tag, an dem die Eintragung der Verschmelzung in das Register des Sitzes desjenigen Rechtsträgers, dessen Gläubiger sie sind, nach § 19 Absatz 3 UmwG als bekannt gemacht gilt, ihren Anspruch nach Grund und Höhe schriftlich anmelden, Sicherheit zu leisten, soweit sie nicht Befriedigung verlangen können. Dieses Recht steht den Gläubigern jedoch nur zu, wenn sie glaubhaft machen, dass durch die Verschmelzung die Erfüllung ihrer Forderung gefährdet wird."
    },
    {
      "date": "2025-11-18",
      "id": "137641",
      "original_text": "Löschungsankündigung\nBerlin Amtsgericht Berlin (Charlottenburg) HRB 265741\nJ. F. Ideal Bau GmbH – Berlin",
      "type": "Löschungsankündigung",
      "state": "Berlin",
      "amtsgericht": "Amtsgericht Berlin (Charlottenburg)",
      "registernummer": "HRB 265741",
      "registerart": "HRB",
      "company_name": "J. F. Ideal Bau GmbH",
      "company_seat": "Berlin",
      "details": "18.11.2025 (Bekanntmachungsdatum)\n\nBerlin Amtsgericht Berlin (Charlottenburg) HRB 265741\nLöschungsankündigung\n\nJ. F. Ideal Bau GmbH\nGesellschaft mit beschränkter Haftung\nBerlin\n\nBei der nachstehenden Gesellschaft wird das Amtslöschungsverfahren gemäß § 394 FamFG eingeleitet. Widerspruchsfrist 6 Wochen"
    },
    {
      "date": "2025-11-18",
      "id": "137642",
      "original_text": "Registerbekanntmachung nach dem Umwandlungsgesetz\nBerlin Amtsgericht Berlin (Charlottenburg) HRB 167356\nETL Business Services Steuerberatungsgesellschaft mbH – Berlin",
      "type": "Registerbekanntmachung nach dem Umwandlungsgesetz",
      "state": "Berlin",
      "amtsgericht": "Amtsgericht Berlin (Charlottenburg)",
      "registernummer": "HRB 167356",
      "registerart": "HRB",
      "company_name": "ETL Business Services Steuerberatungsgesellschaft mbH",
      "company_seat": "Berlin",
      "details": "18.11.2025 (Bekanntmachungsdatum)\n\nBerlin Amtsgericht Berlin (Charlottenburg) HRB 167356\nRegisterbekanntmachung nach dem Umwandlungsgesetz 18.11.2025 (Eintragungsdatum)\n\nETL Business Services Steuerberatungsgesellschaft mbH\nGesellschaft mit beschränkter Haftung\nBerlin\n\nZu Eintragungsnummer 11 vom 18.11.2025 wird als nicht eingetragen veröffentlicht: Den Gläubigern der an der Verschmelzung beteiligten Rechtsträger ist, wenn sie binnen sechs Monaten nach dem Tag, an dem die Eintragung der Verschmelzung in das Register des Sitzes desjenigen Rechtsträgers, dessen Gläubiger sie sind, als bekannt gemacht gilt, ihren Anspruch nach Grund und Höhe schriftlich anmelden, Sicherheit zu leisten, soweit sie nicht Befriedigung verlangen können. Dieses Recht steht den Gläubigern jedoch nur zu, wenn sie glaubhaft machen, dass durch die Verschmelzung die Erfüllung ihrer Forderung gefährdet wird. Das Recht, Sicherheitsleistung zu verlangen, steht Gläubigern nicht zu, die im Falle der Insolvenz ein Recht auf vorzugsweise Befriedigung aus einer Deckungsmasse haben, die nach gesetzlicher Vorschrift zu ihrem Schutz errichtet und staatlich überwacht ist."
    },
    {
      "date": "2025-11-18",
      "id": "137643",
      "original_text": "Löschungsankündigung\nBaden-Württemberg Amtsgericht Mannheim HRB 109472\nISOTECH Süd GmbH – Karlsruhe",
      "type": "Löschungsankündigung",
      "state": "Baden-Württemberg",
      "amtsgericht": "Amtsgericht Mannheim",
      "registernummer": "HRB 109472",
      "registerart": "HRB",
      "company_name": "ISOTECH Süd GmbH",
      "company_seat": "Karlsruhe",
      "details": "18.11.2025 (Bekanntmachungsdatum)\n\nBaden-Württemberg Amtsgericht Mannheim HRB 109472\nLöschungsankündigung\n\nISOTECH Süd GmbH\nGesellschaft mit beschränkter Haftung\nKarlsruhe\n\nDas Gericht beabsichtigt, die Gesellschaft wegen Vermögenslosigkeit im Handelsregister von Amts wegen nach § 394 FamFG zu löschen. Die Frist zur Geltendmachung eines Widerspruchs gegen die beabsichtigte Löschung ist auf einen Monat ab Veröffentlichung bestimmt."
    },
    {
      "date": "2025-11-18",
      "id": "137644",
      "original_text": "Löschungsankündigung\nSachsen Amtsgericht Dresden HRB 38810\nRoj Cargo Unternehmergesellschaft (haftungsbeschränkt) – Görlitz",
      "type": "Löschungsankündigung",
      "state": "Sachsen",
      "amtsgericht": "Amtsgericht Dresden",
      "registernummer": "HRB 38810",
      "registerart": "HRB",
      "company_name": "Roj Cargo Unternehmergesellschaft (haftungsbeschränkt)",
      "company_seat": "Görlitz",
      "details": "18.11.2025 (Bekanntmachungsdatum)\n\nSachsen Amtsgericht Dresden HRB 38810\nLöschungsankündigung\n\nRoj Cargo Unternehmergesellschaft (haftungsbeschränkt)\nGesellschaft mit beschränkter Haftung\nGörlitz\n\nDas Registergericht beabsichtigt, die im Handelsregister eingetragene Gesellschaft von Amts wegen nach § 394 FamFG zu löschen. Die Frist zu Erhebung eines Widerspruchs gegen die beabsichtigte Löschung wird auf einen Monat festgesetzt."
    },
    {
      "date": "2025-11-18",
      "id": "137645",
      "original_text": "Einreichung neuer Dokumente\nSachsen Amtsgericht Dresden HRB 9902\nStadtwerke Elbtal GmbH – Radebeul",
      "type": "Einreichung neuer Dokumente",
      "state": "Sachsen",
      "amtsgericht": "Amtsgericht Dresden",
      "registernummer": "HRB 9902",
      "registerart": "HRB",
      "company_name": "Stadtwerke Elbtal GmbH",
      "company_seat": "Radebeul",
      "details": "18.11.2025 (Bekanntmachungsdatum)\n\nSachsen Amtsgericht Dresden HRB 9902\nEinreichung neuer Dokumente\n\nStadtwerke Elbtal GmbH\nGesellschaft mit beschränkter Haftung\nRadebeul\n\nAm 14.11.2025 wurde beim Handelsregister des Amtsgerichts Dresden die Liste der Mitglieder des Aufsichtsrats gemäß § 52 GmbHG eingereicht."
    },
    {
      "date": "2025-11-18",
      "id": "137646",
      "original_text": "Löschungsankündigung\nSachsen Amtsgericht Dresden HRB 31412\nLankom Bau GmbH – Dresden",
      "type": "Löschungsankündigung",
      "state": "Sachsen",
      "amtsgericht": "Amtsgericht Dresden",
      "registernummer": "HRB 31412",
      "registerart": "HRB",
      "company_name": "Lankom Bau GmbH",
      "company_seat": "Dresden",
      "details": "18.11.2025 (Bekanntmachungsdatum)\n\nSachsen Amtsgericht Dresden HRB 31412\nLöschungsankündigung\n\nLankom Bau GmbH\nGesellschaft mit beschränkter Haftung\nDresden\n\nDas Registergericht beabsichtigt, die im Handelsregister eingetragene Gesellschaft von Amts wegen nach § 394 FamFG zu löschen. Die Frist zu Erhebung eines Widerspruchs gegen die beabsichtigte Löschung wird auf einen Monat festgesetzt."
    },
    {
      "date": "2025-11-18",
      "id": "137647",
      "original_text": "Registerbekanntmachung nach dem Umwandlungsgesetz\nSachsen Amtsgericht Chemnitz HRA 10280\nKatharina Lehmann e. K. – Chemnitz",
      "type": "Registerbekanntmachung nach dem Umwandlungsgesetz",
      "state": "Sachsen",
      "amtsgericht": "Amtsgericht Chemnitz",
      "registernummer": "HRA 10280",
      "registerart": "HRA",
      "company_name": "Katharina Lehmann e. K.",
      "company_seat": "Chemnitz",
      "details": "18.11.2025 (Bekanntmachungsdatum)\n\nSachsen Amtsgericht Chemnitz HRA 10280\nRegisterbekanntmachung nach dem Umwandlungsgesetz 18.11.2025 (Eintragungsdatum)\n\nKatharina Lehmann e. K.\nEinzelkaufmann / Einzelkauffrau\nChemnitz\n\nDen Gläubigern der an der Ausgliederung beteiligten Rechtsträger ist, wenn sie binnen sechs Monaten nach dem Tag, an dem die Eintragung der Ausgliederung in das Register des Sitzes desjenigen Rechtsträgers, dessen Gläubiger sie sind, nach § 19 Abs. 3 UmwG als bekannt gemacht gilt, ihren Anspruch nach Grund und Höhe in Textform anmelden, Sicherheit zu leisten, soweit sie nicht Befriedigung verlangen können. Dieses Recht steht den Gläubigern jedoch nur zu, wenn sie glaubhaft machen, dass durch die Ausgliederung die Erfüllung der Forderung gefährdet wird."
    },
    {
      "date": "2025-11-18",
      "id": "137648",
      "original_text": "Registerbekanntmachung nach dem Umwandlungsgesetz\nSachsen Amtsgericht Chemnitz HRA 8819\nKathi Kunterbunt GmbH & Co. KG. – Chemnitz",
      "type": "Registerbekanntmachung nach dem Umwandlungsgesetz",
      "state": "Sachsen",
      "amtsgericht": "Amtsgericht Chemnitz",
      "registernummer": "HRA 8819",
      "registerart": "HRA",
      "company_name": "Kathi Kunterbunt GmbH & Co. KG.",
      "company_seat": "Chemnitz",
      "details": "18.11.2025 (Bekanntmachungsdatum)\n\nSachsen Amtsgericht Chemnitz HRA 8819\nRegisterbekanntmachung nach dem Umwandlungsgesetz 18.11.2025 (Eintragungsdatum)\n\nKathi Kunterbunt GmbH & Co. KG.\nKommanditgesellschaft\nChemnitz\n\nDen Gläubigern der an der Ausgliederung beteiligten Rechtsträger ist, wenn sie binnen sechs Monaten nach dem Tag, an dem die Eintragung der Ausgliederung in das Register des Sitzes desjenigen Rechtsträgers, dessen Gläubiger sie sind, nach § 19 Abs. 3 UmwG als bekannt gemacht gilt, ihren Anspruch nach Grund und Höhe in Textform anmelden, Sicherheit zu leisten, soweit sie nicht Befriedigung verlangen können. Dieses Recht steht den Gläubigern jedoch nur zu, wenn sie glaubhaft machen, dass durch die Ausgliederung die Erfüllung der Forderung gefährdet wird."
    },
    {
      "date": "2025-11-18",
      "id": "137649",
      "original_text": "Löschungsankündigung\nSachsen Amtsgericht Dresden HRB 40940\nKober & Company GmbH – Dresden",
      "type": "Löschungsankündigung",
      "state": "Sachsen",
      "amtsgericht": "Amtsgericht Dresden",
      "registernummer": "HRB 40940",
      "registerart": "HRB",
      "company_name": "Kober & Company GmbH",
      "company_seat": "Dresden",
      "details": "18.11.2025 (Bekanntmachungsdatum)\n\nSachsen Amtsgericht Dresden HRB 40940\nLöschungsankündigung\n\nKober & Company GmbH\nGesellschaft mit beschränkter Haftung\nDresden\n\nDas Registergericht beabsichtigt, die im Handelsregister eingetragene Gesellschaft von Amts wegen nach § 394 FamFG zu löschen. Die Frist zu Erhebung eines Widerspruchs gegen die beabsichtigte Löschung wird auf einen Monat festgesetzt."
    },
    {
      "date": "2025-11-18",
      "id": "137650",
      "original_text": "Löschungsankündigung\nSachsen Amtsgericht Leipzig VR 30986\nTierwohlleben e.V. – Taucha",
      "type": "Löschungsankündigung",
      "state": "Sachsen",
      "amtsgericht": "Amtsgericht Leipzig",
      "registernummer": "VR 30986",
      "registerart": "VR",
      "company_name": "Tierwohlleben e.V.",
      "company_seat": "Taucha",
      "details": "18.11.2025 (Bekanntmachungsdatum)\n\nSachsen Amtsgericht Leipzig VR 30986\nLöschungsankündigung\n\nTierwohlleben e.V.\neingetragener Verein\nTaucha\n\nDas Gericht beabsichtigt, gemäß § 4 Absatz 2 Ziffer 1 der Verordnung über das Vereinsregister das Registerblatt  des Vereins zu schließen, da nach Mitteilung eines bisherigen Vorstandsmitglieds sämtliche Mitglieder aus dem Verein ausgeschieden sind. Zur Geltendmachung eines Widerspruchs gegen die beabsichtigte Schließung wird eine Frist von einem Monat nach der Veröffentlichung bestimmt."
    },
    {
      "date": "2025-11-18",
      "id": "137651",
      "original_text": "Löschungsankündigung\nNiedersachsen Amtsgericht Braunschweig HRB 204465\nProjektgesellschaft am See mbH – Bad Gandersheim",
      "type": "Löschungsankündigung",
      "state": "Niedersachsen",
      "amtsgericht": "Amtsgericht Braunschweig",
      "registernummer": "HRB 204465",
      "registerart": "HRB",
      "company_name": "Projektgesellschaft am See mbH",
      "company_seat": "Bad Gandersheim",
      "details": "18.11.2025 (Bekanntmachungsdatum)\n\nNiedersachsen Amtsgericht Braunschweig HRB 204465\nLöschungsankündigung 18.11.2025 (Eintragungsdatum)\n\nProjektgesellschaft am See mbH\nGesellschaft mit beschränkter Haftung\nBad Gandersheim\n\nDas Registergericht beabsichtigt, die Gesellschaft von Amts wegen nach § 394 FamFG zu löschen. Die Frist zur Erhebung eines Widerspruchs ist auf 1 Monat ab dieser Registerbekanntmachung festgesetzt."
    },
    {
      "date": "2025-11-18",
      "id": "137652",
      "original_text": "Löschungsankündigung\nNiedersachsen Amtsgericht Osnabrück HRB 205852\nGebäudetechnik Berger GmbH – Lahn",
      "type": "Löschungsankündigung",
      "state": "Niedersachsen",
      "amtsgericht": "Amtsgericht Osnabrück",
      "registernummer": "HRB 205852",
      "registerart": "HRB",
      "company_name": "Gebäudetechnik Berger GmbH",
      "company_seat": "Lahn",
      "details": "18.11.2025 (Bekanntmachungsdatum)\n\nNiedersachsen Amtsgericht Osnabrück HRB 205852\nLöschungsankündigung\n\nGebäudetechnik Berger GmbH\nGesellschaft mit beschränkter Haftung\nLahn\n\nDas Registergericht beabsichtigt, die Gesellschaft von Amts wegen nach § 394 FamFG wegen Vermögenslosigkeit zu löschen. Die Frist zur Erhebung eines Widerspruchs ist auf 1 Monat ab dieser Registerbekanntmachung festgesetzt."
    },
    {
      "date": "2025-11-18",
      "id": "137653",
      "original_text": "Löschungsankündigung\nNiedersachsen Amtsgericht Hannover HRB 223847\nContempo House - Atelier für Innendekoration - GmbH – Emmerthal",
      "type": "Löschungsankündigung",
      "state": "Niedersachsen",
      "amtsgericht": "Amtsgericht Hannover",
      "registernummer": "HRB 223847",
      "registerart": "HRB",
      "company_name": "Contempo House - Atelier für Innendekoration - GmbH",
      "company_seat": "Emmerthal",
      "details": "18.11.2025 (Bekanntmachungsdatum)\n\nNiedersachsen Amtsgericht Hannover HRB 223847\nLöschungsankündigung\n\nContempo House - Atelier für Innendekoration - GmbH\nGesellschaft mit beschränkter Haftung\nEmmerthal\n\nDas Registergericht beabsichtigt, die Gesellschaft von Amts wegen nach § 394 FamFG zu löschen. Die Frist zur Erhebung eines Widerspruchs ist auf 1 Monat ab dieser Registerbekanntmachung festgesetzt."
    },
    {
      "date": "2025-11-18",
      "id": "137654",
      "original_text": "Löschungsankündigung\nNiedersachsen Amtsgericht Osnabrück HRB 209506\nAYYapi GmbH – Osnabrück",
      "type": "Löschungsankündigung",
      "state": "Niedersachsen",
      "amtsgericht": "Amtsgericht Osnabrück",
      "registernummer": "HRB 209506",
      "registerart": "HRB",
      "company_name": "AYYapi GmbH",
      "company_seat": "Osnabrück",
      "details": "18.11.2025 (Bekanntmachungsdatum)\n\nNiedersachsen Amtsgericht Osnabrück HRB 209506\nLöschungsankündigung\n\nAYYapi GmbH\nGesellschaft mit beschränkter Haftung\nOsnabrück\n\nDas Registergericht beabsichtigt, die Gesellschaft von Amts wegen nach § 394 FamFG wegen Vermögenslosigkeit zu löschen. Die Frist zur Erhebung eines Widerspruchs ist auf 1 Monat ab dieser Registerbekanntmachung festgesetzt."
    },
    {
      "date": "2025-11-18",
      "id": "137655",
      "original_text": "Löschungsankündigung\nNiedersachsen Amtsgericht Braunschweig HRB 999\nElektrotechnik Rolf Lüders GmbH – Braunschweig",
      "type": "Löschungsankündigung",
      "state": "Niedersachsen",
      "amtsgericht": "Amtsgericht Braunschweig",
      "registernummer": "HRB 999",
      "registerart": "HRB",
      "company_name": "Elektrotechnik Rolf Lüders GmbH",
      "company_seat": "Braunschweig",
      "details": "18.11.2025 (Bekanntmachungsdatum)\n\nNiedersachsen Amtsgericht Braunschweig HRB 999\nLöschungsankündigung 18.11.2025 (Eintragungsdatum)\n\nElektrotechnik Rolf Lüders GmbH\nGesellschaft mit beschränkter Haftung\nBraunschweig\n\nDas Registergericht beabsichtigt, die Gesellschaft von Amts wegen nach § 394 FamFG zu löschen. Die Frist zur Erhebung eines Widerspruchs ist auf 1 Monat ab dieser Registerbekanntmachung festgesetzt."
    },
    {
      "date": "2025-11-18",
      "id": "137656",
      "original_text": "Registerbekanntmachung nach dem Umwandlungsgesetz\nNiedersachsen Amtsgericht Walsrode HRB 212463\nMEDICAL FX Germany GmbH – Kirchlinteln",
      "type": "Registerbekanntmachung nach dem Umwandlungsgesetz",
      "state": "Niedersachsen",
      "amtsgericht": "Amtsgericht Walsrode",
      "registernummer": "HRB 212463",
      "registerart": "HRB",
      "company_name": "MEDICAL FX Germany GmbH",
      "company_seat": "Kirchlinteln",
      "details": "18.11.2025 (Bekanntmachungsdatum)\n\nNiedersachsen Amtsgericht Walsrode HRB 212463\nRegisterbekanntmachung nach dem Umwandlungsgesetz 18.11.2025 (Eintragungsdatum)\n\nMEDICAL FX Germany GmbH\nGesellschaft mit beschränkter Haftung\nKirchlinteln\n\nDen Gläubigern der an der Ausgliederung beteiligten Rechtsträger ist, wenn sie binnen sechs Monaten nach dem Tag, an dem die Eintragung der Ausgliederung in das Register des Sitzes desjenigen Rechtsträgers, dessen Gläubiger sie sind, nach § 19 Abs. 3 UmwG als bekannt gemacht gilt, ihren Anspruch nach Grund und Höhe schriftlich anmelden, Sicherheit zu leisten, soweit sie nicht Befriedigung verlangen können. Dieses Recht steht den Gläubigern jedoch nur zu, wenn sie glaubhaft machen, dass durch die Ausgliederung die Erfüllung der Forderung gefährdet wird."
    },
    {
      "date": "2025-11-18",
      "id": "137657",
      "original_text": "Registerbekanntmachung nach dem Umwandlungsgesetz\nNiedersachsen Amtsgericht Braunschweig GnR 331\nDachdecker-Einkauf Ost eG – Braunschweig",
      "type": "Registerbekanntmachung nach dem Umwandlungsgesetz",
      "state": "Niedersachsen",
      "amtsgericht": "Amtsgericht Braunschweig",
      "registernummer": "GnR 331",
      "registerart": "GnR",
      "company_name": "Dachdecker-Einkauf Ost eG",
      "company_seat": "Braunschweig",
      "details": "18.11.2025 (Bekanntmachungsdatum)\n\nNiedersachsen Amtsgericht Braunschweig GnR 331\nRegisterbekanntmachung nach dem Umwandlungsgesetz 18.11.2025 (Eintragungsdatum)\n\nDachdecker-Einkauf Ost eG\neingetragene Genossenschaft\nBraunschweig\n\nDen Gläubigern der an der Verschmelzung beteiligten Rechtsträger ist, wenn sie binnen sechs Monaten nach dem Tag, an dem die Eintragung der Verschmelzung in das Register des Sitzes desjenigen Rechtsträgers, dessen Gläubiger sie sind, nach § 19  Abs.  3 UmwG als bekannt gemacht gilt, ihren Anspruch nach Grund und Höhe schriftlich anmelden, Sicherheit zu leisten, soweit sie nicht Befriedigung verlangen können. Dieses Recht steht den Gläubigern jedoch nur zu, wenn sie glaubhaft machen, dass durch die Verschmelzung die Erfüllung der Forderung gefährdet wird."
    },
    {
      "date": "2025-11-18",
      "id": "137658",
      "original_text": "Registerbekanntmachung nach dem Umwandlungsgesetz\nNiedersachsen Amtsgericht Walsrode HRA 205602\nMEDICAL FX Germany e.K. – Kirchlinteln",
      "type": "Registerbekanntmachung nach dem Umwandlungsgesetz",
      "state": "Niedersachsen",
      "amtsgericht": "Amtsgericht Walsrode",
      "registernummer": "HRA 205602",
      "registerart": "HRA",
      "company_name": "MEDICAL FX Germany e.K.",
      "company_seat": "Kirchlinteln",
      "details": "18.11.2025 (Bekanntmachungsdatum)\n\nNiedersachsen Amtsgericht Walsrode HRA 205602\nRegisterbekanntmachung nach dem Umwandlungsgesetz 18.11.2025 (Eintragungsdatum)\n\nMEDICAL FX Germany e.K.\nEinzelkaufmann / Einzelkauffrau\nKirchlinteln\n\nDen Gläubigern der an der Ausgliederung beteiligten Rechtsträger ist, wenn sie binnen sechs Monaten nach dem Tag, an dem die Eintragung der Ausgliederung in das Register des Sitzes desjenigen Rechtsträgers, dessen Gläubiger sie sind, nach § 19 Abs. 3 UmwG als bekannt gemacht gilt, ihren Anspruch nach Grund und Höhe schriftlich anmelden, Sicherheit zu leisten, soweit sie nicht Befriedigung verlangen können. Dieses Recht steht den Gläubigern jedoch nur zu, wenn sie glaubhaft machen, dass durch die Ausgliederung die Erfüllung der Forderung gefährdet wird."
    },
    {
      "date": "2025-11-18",
      "id": "137659",
      "original_text": "Registerbekanntmachung nach dem Umwandlungsgesetz\nNiedersachsen Amtsgericht Hildesheim HRB 203503\nBetontechnik Nord GmbH – Sehnde",
      "type": "Registerbekanntmachung nach dem Umwandlungsgesetz",
      "state": "Niedersachsen",
      "amtsgericht": "Amtsgericht Hildesheim",
      "registernummer": "HRB 203503",
      "registerart": "HRB",
      "company_name": "Betontechnik Nord GmbH",
      "company_seat": "Sehnde",
      "details": "18.11.2025 (Bekanntmachungsdatum)\n\nNiedersachsen Amtsgericht Hildesheim HRB 203503\nRegisterbekanntmachung nach dem Umwandlungsgesetz 18.11.2025 (Eintragungsdatum)\n\nBetontechnik Nord GmbH\nGesellschaft mit beschränkter Haftung\nSehnde\n\nDen Gläubigern der an der Verschmelzung beteiligten Rechtsträger ist, wenn sie binnen sechs Monaten nach dem Tag, an dem die Eintragung der Verschmelzung in das Register des Sitzes desjenigen Rechtsträgers, dessen Gläubiger sie sind, nach § 19  Abs.  3 UmwG als bekannt gemacht gilt, ihren Anspruch nach Grund und Höhe schriftlich anmelden, Sicherheit zu leisten, soweit sie nicht Befriedigung verlangen können. Dieses Recht steht den Gläubigern jedoch nur zu, wenn sie glaubhaft machen, dass durch die Verschmelzung die Erfüllung der Forderung gefährdet wird."
    },
    {
      "date": "2025-11-18",
      "id": "137660",
      "original_text": "Löschungsankündigung\nNiedersachsen Amtsgericht Hannover HRB 217615\nHanseatische Commissions & Bau GmbH – Hannover",
      "type": "Löschungsankündigung",
      "state": "Niedersachsen",
      "amtsgericht": "Amtsgericht Hannover",
      "registernummer": "HRB 217615",
      "registerart": "HRB",
      "company_name": "Hanseatische Commissions & Bau GmbH",
      "company_seat": "Hannover",
      "details": "18.11.2025 (Bekanntmachungsdatum)\n\nNiedersachsen Amtsgericht Hannover HRB 217615\nLöschungsankündigung 13.11.2025 (Eintragungsdatum)\n\nHanseatische Commissions & Bau GmbH\nGesellschaft mit beschränkter Haftung\nHannover\n\nDas Registergericht beabsichtigt, die Gesellschaft von Amts wegen nach § 394 FamFG zu löschen. Die Frist zur Erhebung eines Widerspruchs ist auf 1 Monat ab dieser Registerbekanntmachung festgesetzt."
    },
    {
      "date": "2025-11-18",
      "id": "137661",
      "original_text": "Einreichung neuer Dokumente\nBaden-Württemberg Amtsgericht Stuttgart HRB 771624\nTüBus GmbH – Tübingen",
      "type": "Einreichung neuer Dokumente",
      "state": "Baden-Württemberg",
      "amtsgericht": "Amtsgericht Stuttgart",
      "registernummer": "HRB 771624",
      "registerart": "HRB",
      "company_name": "TüBus GmbH",
      "company_seat": "Tübingen",
      "details": "18.11.2025 (Bekanntmachungsdatum)\n\nBaden-Württemberg Amtsgericht Stuttgart HRB 771624\nEinreichung neuer Dokumente\n\nTüBus GmbH\nGesellschaft mit beschränkter Haftung\nTübingen\n\nDie Gesellschaft hat am 17.11.2025 die Liste über die Zusammensetzung des Aufsichtsrats zum Handelsregister eingereicht."
    },
    {
      "date": "2025-11-18",
      "id": "137662",
      "original_text": "Registerbekanntmachung nach dem Umwandlungsgesetz\nNiedersachsen Amtsgericht Osnabrück HRB 222032\nMarketing Machine GmbH – Hagen a.T.W.",
      "type": "Registerbekanntmachung nach dem Umwandlungsgesetz",
      "state": "Niedersachsen",
      "amtsgericht": "Amtsgericht Osnabrück",
      "registernummer": "HRB 222032",
      "registerart": "HRB",
      "company_name": "Marketing Machine GmbH",
      "company_seat": "Hagen a.T.W.",
      "details": "18.11.2025 (Bekanntmachungsdatum)\n\nNiedersachsen Amtsgericht Osnabrück HRB 222032\nRegisterbekanntmachung nach dem Umwandlungsgesetz 18.11.2025 (Eintragungsdatum)\n\nMarketing Machine GmbH\nGesellschaft mit beschränkter Haftung\nHagen a.T.W.\n\nDen Gläubigern der an der Ausgliederung beteiligten Rechtsträger ist, wenn sie binnen sechs Monaten nach dem Tag, an dem die Eintragung der Ausgliederung in das Register des Sitzes desjenigen Rechtsträgers, dessen Gläubiger sie sind, nach § 19 Abs. 3 UmwG als bekannt gemacht gilt, ihren Anspruch nach Grund und Höhe schriftlich anmelden, Sicherheit zu leisten, soweit sie nicht Befriedigung verlangen können. Dieses Recht steht den Gläubigern jedoch nur zu, wenn sie glaubhaft machen, dass durch die Ausgliederung die Erfüllung der Forderung gefährdet wird."
    },
    {
      "date": "2025-11-18",
      "id": "137663",
      "original_text": "Löschungsankündigung\nNiedersachsen Amtsgericht Osnabrück HRB 130798 früher Amtsgericht Nordhorn\nIFT International Forming Technology GmbH – Bad Bentheim",
      "type": "Löschungsankündigung",
      "state": "Niedersachsen",
      "amtsgericht": "Amtsgericht Osnabrück",
      "registernummer": "HRB 130798",
      "registerart": "HRB",
      "company_name": "IFT International Forming Technology GmbH",
      "company_seat": "Bad Bentheim",
      "former_amtsgericht": "Nordhorn",
      "details": "18.11.2025 (Bekanntmachungsdatum)\n\nNiedersachsen Amtsgericht Osnabrück HRB 130798 früher Amtsgericht Nordhorn\nLöschungsankündigung\n\nIFT International Forming Technology GmbH\nGesellschaft mit beschränkter Haftung\nBad Bentheim\n\nDas Registergericht beabsichtigt, die Gesellschaft von Amts wegen nach § 394 FamFG wegen Vermögenslosigkeit zu löschen. Die Frist zur Erhebung eines Widerspruchs ist auf 1 Monat ab dieser Registerbekanntmachung festgesetzt."
    },
    {
      "date": "2025-11-18",
      "id": "137664",
      "original_text": "Registerbekanntmachung nach dem Umwandlungsgesetz\nRheinland-Pfalz Amtsgericht Koblenz HRB 27712\nW&W Experience GmbH – Kalt",
      "type": "Registerbekanntmachung nach dem Umwandlungsgesetz",
      "state": "Rheinland-Pfalz",
      "amtsgericht": "Amtsgericht Koblenz",
      "registernummer": "HRB 27712",
      "registerart": "HRB",
      "company_name": "W&W Experience GmbH",
      "company_seat": "Kalt",
      "details": "18.11.2025 (Bekanntmachungsdatum)\n\nRheinland-Pfalz Amtsgericht Koblenz HRB 27712\nRegisterbekanntmachung nach dem Umwandlungsgesetz 18.11.2025 (Eintragungsdatum)\n\nW&W Experience GmbH\nGesellschaft mit beschränkter Haftung\nKalt\n\nAls nicht eingetragen wird veröffentlicht: Den Gläubigern der an der Verschmelzung beteiligten Rechtsträger ist, wenn sie binnen sechs Monaten nach dem Tag, an dem die Eintragung der Verschmelzung in das Register des Sitzes desjenigen Rechtsträgers,dessen Gläubiger sie sind, nach § 19 Abs. 3 UmwG als bekannt gemacht gilt, ihren Anspruch nach Grund und Höhe schriftlich anmelden, Sicherheit zu leisten, soweit sie nicht Befriedigung verlangen können. Dieses Recht steht den Gläubigern jedoch nur zu, wenn sie glaubhaft machen, dass durch die Verschmelzung die Erfüllungd er Forderung gefährdet wird."
    },
    {
      "date": "2025-11-18",
      "id": "137665",
      "original_text": "Einreichung neuer Dokumente\nRheinland-Pfalz Amtsgericht Ludwigshafen a.Rhein (Ludwigshafen) HRA 3373\nRheinland-Pfälzische Rundfunk GmbH & Co. KG – Ludwigshafen/Rhein",
      "type": "Einreichung neuer Dokumente",
      "state": "Rheinland-Pfalz",
      "amtsgericht": "Amtsgericht Ludwigshafen a.Rhein (Ludwigshafen)",
      "registernummer": "HRA 3373",
      "registerart": "HRA",
      "company_name": "Rheinland-Pfälzische Rundfunk GmbH & Co. KG",
      "company_seat": "Ludwigshafen/Rhein",
      "details": "18.11.2025 (Bekanntmachungsdatum)\n\nRheinland-Pfalz Amtsgericht Ludwigshafen a.Rhein (Ludwigshafen) HRA 3373\nEinreichung neuer Dokumente 18.11.2025 (Eintragungsdatum)\n\nRheinland-Pfälzische Rundfunk GmbH & Co. KG\nKommanditgesellschaft\nLudwigshafen/Rhein\n\nDie Gesellschaft hat eine geänderte Liste der Beiratsmitglieder zum Handelsregister Ludwigshafen eingereicht."
    },
    {
      "date": "2025-11-18",
      "id": "137666",
      "original_text": "Löschungsankündigung\nBremen Amtsgericht Bremen HRB 26137\nP P Personal-Profi GmbH – Bremen",
      "type": "Löschungsankündigung",
      "state": "Bremen",
      "amtsgericht": "Amtsgericht Bremen",
      "registernummer": "HRB 26137",
      "registerart": "HRB",
      "company_name": "P P Personal-Profi GmbH",
      "company_seat": "Bremen",
      "details": "18.11.2025 (Bekanntmachungsdatum)\n\nBremen Amtsgericht Bremen HRB 26137\nLöschungsankündigung\n\nP P Personal-Profi GmbH\nGesellschaft mit beschränkter Haftung\nBremen\n\nEs ist beabsichtigt die im Handelsregister eingetragene Gesellschaft von Amts wegen gemäß § 394 FamFG zu löschen. Gegen die Löschung kann beim AG Bremen schriftlich oder zu Protokoll der Geschäftsstelle Widerspruch eingelegt werden. Widerspruchsfrist 4 Wochen."
    },
    {
      "date": "2025-11-18",
      "id": "137667",
      "original_text": "Einreichung neuer Dokumente\nBremen Amtsgericht Bremen HRB 27735\nJean Pierre Rosselet Cosmetics AG – Bremen",
      "type": "Einreichung neuer Dokumente",
      "state": "Bremen",
      "amtsgericht": "Amtsgericht Bremen",
      "registernummer": "HRB 27735",
      "registerart": "HRB",
      "company_name": "Jean Pierre Rosselet Cosmetics AG",
      "company_seat": "Bremen",
      "details": "18.11.2025 (Bekanntmachungsdatum)\n\nBremen Amtsgericht Bremen HRB 27735\nEinreichung neuer Dokumente\n\nJean Pierre Rosselet Cosmetics AG\nAktiengesellschaft\nBremen\n\nAls nicht eingetragen wird veröffentlicht: Liste des Aufsichtsrats wurde eingereicht."
    },
    {
      "date": "2025-11-18",
      "id": "137668",
      "original_text": "Registerbekanntmachung nach dem Umwandlungsgesetz\nBremen Amtsgericht Bremen HRB 23629\nHomeStyle Betriebs GmbH – Bremen",
      "type": "Registerbekanntmachung nach dem Umwandlungsgesetz",
      "state": "Bremen",
      "amtsgericht": "Amtsgericht Bremen",
      "registernummer": "HRB 23629",
      "registerart": "HRB",
      "company_name": "HomeStyle Betriebs GmbH",
      "company_seat": "Bremen",
      "details": "18.11.2025 (Bekanntmachungsdatum)\n\nBremen Amtsgericht Bremen HRB 23629\nRegisterbekanntmachung nach dem Umwandlungsgesetz 12.11.2025 (Eintragungsdatum)\n\nHomeStyle Betriebs GmbH\nGesellschaft mit beschränkter Haftung\nBremen\n\nZu Eintragungsnummer 3 vom 12.11.2025 wird als nicht eingetragen veröffentlicht: Den Gläubigern der an der Verschmelzung beteiligten Rechtsträger ist, wenn sie binnen sechs Monaten nach dem Tag, an dem die Eintragung der Verschmelzung in das Register des Sitzes desjenigen Rechtsträgers, dessen Gläubiger sie sind, als bekannt gemacht gilt, ihren Anspruch nach Grund und Höhe schriftlich anmelden, Sicherheit zu leisten, soweit sie nicht Befriedigung verlangen können. Dieses Recht steht den Gläubigern jedoch nur zu, wenn sie glaubhaft machen, dass durch die Verschmelzung die Erfüllung ihrer Forderung gefährdet wird. Das Recht, Sicherheitsleistung zu verlangen, steht Gläubigern nicht zu, die im Falle der Insolvenz ein Recht auf vorzugsweise Befriedigung aus einer Deckungsmasse haben, die nach gesetzlicher Vorschrift zu ihrem Schutz errichtet und staatlich überwacht ist."
    },
    {
      "date": "2025-11-18",
      "id": "137669",
      "original_text": "Registerbekanntmachung nach dem Umwandlungsgesetz\nBremen Amtsgericht Bremen HRA 26262\nHomeStyle Bremen GmbH & Co. KG – Bremen",
      "type": "Registerbekanntmachung nach dem Umwandlungsgesetz",
      "state": "Bremen",
      "amtsgericht": "Amtsgericht Bremen",
      "registernummer": "HRA 26262",
      "registerart": "HRA",
      "company_name": "HomeStyle Bremen GmbH & Co. KG",
      "company_seat": "Bremen",
      "details": "18.11.2025 (Bekanntmachungsdatum)\n\nBremen Amtsgericht Bremen HRA 26262\nRegisterbekanntmachung nach dem Umwandlungsgesetz 12.11.2025 (Eintragungsdatum)\n\nHomeStyle Bremen GmbH & Co. KG\nKommanditgesellschaft\nBremen\n\nZu Eintragungsnummer 5 vom 12.11.2025 wird als nicht eingetragen veröffentlicht: Den Gläubigern der an der Verschmelzung beteiligten Rechtsträger ist, wenn sie binnen sechs Monaten nach dem Tag, an dem die Eintragung der Verschmelzung in das Register des Sitzes desjenigen Rechtsträgers, dessen Gläubiger sie sind, als bekannt gemacht gilt, ihren Anspruch nach Grund und Höhe schriftlich anmelden, Sicherheit zu leisten, soweit sie nicht Befriedigung verlangen können. Dieses Recht steht den Gläubigern jedoch nur zu, wenn sie glaubhaft machen, dass durch die Verschmelzung die Erfüllung ihrer Forderung gefährdet wird. Das Recht, Sicherheitsleistung zu verlangen, steht Gläubigern nicht zu, die im Falle der Insolvenz ein Recht auf vorzugsweise Befriedigung aus einer Deckungsmasse haben, die nach gesetzlicher Vorschrift zu ihrem Schutz errichtet und staatlich überwacht ist."
    },
    {
      "date": "2025-11-18",
      "id": "137670",
      "original_text": "Registerbekanntmachung nach dem Umwandlungsgesetz\nBremen Amtsgericht Bremen HRB 39430\nDynastes GmbH – Bremen",
      "type": "Registerbekanntmachung nach dem Umwandlungsgesetz",
      "state": "Bremen",
      "amtsgericht": "Amtsgericht Bremen",
      "registernummer": "HRB 39430",
      "registerart": "HRB",
      "company_name": "Dynastes GmbH",
      "company_seat": "Bremen",
      "details": "18.11.2025 (Bekanntmachungsdatum)\n\nBremen Amtsgericht Bremen HRB 39430\nRegisterbekanntmachung nach dem Umwandlungsgesetz 13.11.2025 (Eintragungsdatum)\n\nDynastes GmbH\nGesellschaft mit beschränkter Haftung\nBremen\n\nZu Eintragungsnummer 2 vom 13.11.2025 wird als nicht eingetragen veröffentlicht: Den Gläubigern der an der Verschmelzung beteiligten Rechtsträger ist, wenn sie binnen sechs Monaten nach dem Tag, an dem die Eintragung der Verschmelzung in das Register des Sitzes desjenigen Rechtsträgers, dessen Gläubiger sie sind, als bekannt gemacht gilt, ihren Anspruch nach Grund und Höhe schriftlich anmelden, Sicherheit zu leisten, soweit sie nicht Befriedigung verlangen können. Dieses Recht steht den Gläubigern jedoch nur zu, wenn sie glaubhaft machen, dass durch die Verschmelzung die Erfüllung ihrer Forderung gefährdet wird. Das Recht, Sicherheitsleistung zu verlangen, steht Gläubigern nicht zu, die im Falle der Insolvenz ein Recht auf vorzugsweise Befriedigung aus einer Deckungsmasse haben, die nach gesetzlicher Vorschrift zu ihrem Schutz errichtet und staatlich überwacht ist."
    },
    {
      "date": "2025-11-18",
      "id": "137671",
      "original_text": "Löschungsankündigung\nBremen Amtsgericht Bremen HRB 31736\nQCL Logistik Bremen GmbH – Bremen",
      "type": "Löschungsankündigung",
      "state": "Bremen",
      "amtsgericht": "Amtsgericht Bremen",
      "registernummer": "HRB 31736",
      "registerart": "HRB",
      "company_name": "QCL Logistik Bremen GmbH",
      "company_seat": "Bremen",
      "details": "18.11.2025 (Bekanntmachungsdatum)\n\nBremen Amtsgericht Bremen HRB 31736\nLöschungsankündigung\n\nQCL Logistik Bremen GmbH\nGesellschaft mit beschränkter Haftung\nBremen\n\nEs ist beabsichtigt die im Handelsregister eingetragene Gesellschaft von Amts wegen gemäß § 394 FamFG zu löschen. Gegen die Löschung kann beim AG Bremen schriftlich oder zu Protokoll der Geschäftsstelle Widerspruch eingelegt werden. Widerspruchsfrist 4 Wochen."
    },
    {
      "date": "2025-11-18",
      "id": "137672",
      "original_text": "Löschungsankündigung\nRheinland-Pfalz Amtsgericht Montabaur HRB 27001\nHeizungslager Gesellschaft für Haustechnik mbH – Pleckhausen",
      "type": "Löschungsankündigung",
      "state": "Rheinland-Pfalz",
      "amtsgericht": "Amtsgericht Montabaur",
      "registernummer": "HRB 27001",
      "registerart": "HRB",
      "company_name": "Heizungslager Gesellschaft für Haustechnik mbH",
      "company_seat": "Pleckhausen",
      "details": "18.11.2025 (Bekanntmachungsdatum)\n\nRheinland-Pfalz Amtsgericht Montabaur HRB 27001\nLöschungsankündigung\n\nHeizungslager Gesellschaft für Haustechnik mbH\nGesellschaft mit beschränkter Haftung\nPleckhausen\n\nDas Registergericht beabsichtigt die Gesellschaft von Amts wegen nach § 394 FamFG zu löschen. Die Frist zur Erhebung eines Widerspruchs ist auf einen Monat festgesetzt."
    },
    {
      "date": "2025-11-18",
      "id": "137673",
      "original_text": "Registerbekanntmachung nach dem Umwandlungsgesetz\nNordrhein-Westfalen Amtsgericht Bad Oeynhausen HRB 15262\nBack-System GmbH – Löhne",
      "type": "Registerbekanntmachung nach dem Umwandlungsgesetz",
      "state": "Nordrhein-Westfalen",
      "amtsgericht": "Amtsgericht Bad Oeynhausen",
      "registernummer": "HRB 15262",
      "registerart": "HRB",
      "company_name": "Back-System GmbH",
      "company_seat": "Löhne",
      "details": "18.11.2025 (Bekanntmachungsdatum)\n\nNordrhein-Westfalen Amtsgericht Bad Oeynhausen HRB 15262\nRegisterbekanntmachung nach dem Umwandlungsgesetz 18.11.2025 (Eintragungsdatum)\n\nBack-System GmbH\nGesellschaft mit beschränkter Haftung\nLöhne\n\nDen Gläubigern der an der Verschmelzung beteiligten Rechtsträger ist, wenn sie binnen sechs Monaten nach dem Tag, an dem die Eintragung der Verschmelzung in das Register des Sitzes derjenigen Rechtsträger deren Gläubiger sie sind, nach § 19 Absatz 3 UmwG als bekanntgemacht gilt, ihren Anspruch nach Grund und Höhe schriftlich anmelden, Sicherheit zu leisten, soweit sie nicht Befriedigung verlangen können. Dieses Recht steht den Gläubigern jedoch nur zu, wenn sie glaubhaft machen, dass durch die Verschmelzung die Erfüllung ihrer Forderung gefährdet wird."
    },
    {
      "date": "2025-11-18",
      "id": "137674",
      "original_text": "Löschungsankündigung\nNordrhein-Westfalen Amtsgericht Krefeld HRB 18231\nIGZ Getränkehandel GmbH – Brüggen",
      "type": "Löschungsankündigung",
      "state": "Nordrhein-Westfalen",
      "amtsgericht": "Amtsgericht Krefeld",
      "registernummer": "HRB 18231",
      "registerart": "HRB",
      "company_name": "IGZ Getränkehandel GmbH",
      "company_seat": "Brüggen",
      "details": "18.11.2025 (Bekanntmachungsdatum)\n\nNordrhein-Westfalen Amtsgericht Krefeld HRB 18231\nLöschungsankündigung\n\nIGZ Getränkehandel GmbH\nGesellschaft mit beschränkter Haftung\nBrüggen\n\nDas Registergericht beabsichtigt die Gesellschaft von Amts wegen nach § 394 FamFG zu löschen. Die Frist zur Erhebung eines Widerspruchs ist auf einen Monat festgesetzt."
    },
    {
      "date": "2025-11-18",
      "id": "137675",
      "original_text": "Registerbekanntmachung nach dem Umwandlungsgesetz\nNordrhein-Westfalen Amtsgericht Dortmund HRB 37771\nDui Sushi Dortmund GmbH – Dortmund",
      "type": "Registerbekanntmachung nach dem Umwandlungsgesetz",
      "state": "Nordrhein-Westfalen",
      "amtsgericht": "Amtsgericht Dortmund",
      "registernummer": "HRB 37771",
      "registerart": "HRB",
      "company_name": "Dui Sushi Dortmund GmbH",
      "company_seat": "Dortmund",
      "details": "18.11.2025 (Bekanntmachungsdatum)\n\nNordrhein-Westfalen Amtsgericht Dortmund HRB 37771\nRegisterbekanntmachung nach dem Umwandlungsgesetz 12.11.2025 (Eintragungsdatum)\n\nDui Sushi Dortmund GmbH\nGesellschaft mit beschränkter Haftung\nDortmund\n\nDen Gläubigern der an der Ausgliederung beteiligten Rechtsträger ist, wenn sie binnen sechs Monaten nach dem Tag, an dem die Eintragung der Ausgliederung in das Register des Sitzes desjenigen Rechtsträgers, dessen Gläubiger sie sind, nach § 19 Absatz 3 UmwG als bekanntgemacht gilt, ihren Anspruch nach Grund und Höhe schriftlich anmelden, Sicherheit zu leisten, soweit sie nicht Befriedigung verlangen können. Dieses Recht steht den Gläubigern jedoch nur zu, wenn sie glaubhaft machen, dass durch die Ausgliederung die Erfüllung ihrer Forderung gefährdet wird."
    },
    {
      "date": "2025-11-18",
      "id": "137676",
      "original_text": "Registerbekanntmachung nach dem Umwandlungsgesetz\nNordrhein-Westfalen Amtsgericht Arnsberg HRA 9408\nWagener Holzwaren e. K., Inhaber Klaus Wagener – Meschede",
      "type": "Registerbekanntmachung nach dem Umwandlungsgesetz",
      "state": "Nordrhein-Westfalen",
      "amtsgericht": "Amtsgericht Arnsberg",
      "registernummer": "HRA 9408",
      "registerart": "HRA",
      "company_name": "Wagener Holzwaren e. K., Inhaber Klaus Wagener",
      "company_seat": "Meschede",
      "details": "18.11.2025 (Bekanntmachungsdatum)\n\nNordrhein-Westfalen Amtsgericht Arnsberg HRA 9408\nRegisterbekanntmachung nach dem Umwandlungsgesetz 18.11.2025 (Eintragungsdatum)\n\nWagener Holzwaren e. K., Inhaber Klaus Wagener\nEinzelkaufmann / Einzelkauffrau\nMeschede\n\nDen Gläubigern der an der Verschmelzung beteiligten Rechtsträger ist, wenn sie binnen sechs Monaten nach dem Tag, an dem die Eintragung der Verschmelzung in das Register des Sitzes desjenigen Rechtsträgers, dessen Gläubiger sie sind, nach § 19 Absatz 3 UmwG als bekanntgemacht gilt, ihren Anspruch nach Grund und Höhe schriftlich anmelden, Sicherheit zu leisten, soweit sie nicht Befriedigung verlangen können. Dieses Recht steht den Gläubigern jedoch nur zu, wenn sie glaubhaft machen, dass durch die Verschmelzung die Erfüllung ihrer Forderung gefährdet wird."
    },
    {
      "date": "2025-11-18",
      "id": "137677",
      "original_text": "Einreichung neuer Dokumente\nNordrhein-Westfalen Amtsgericht Münster HRB 15623\nCOMPO EXPERT Holding GmbH – Münster",
      "type": "Einreichung neuer Dokumente",
      "state": "Nordrhein-Westfalen",
      "amtsgericht": "Amtsgericht Münster",
      "registernummer": "HRB 15623",
      "registerart": "HRB",
      "company_name": "COMPO EXPERT Holding GmbH",
      "company_seat": "Münster",
      "details": "18.11.2025 (Bekanntmachungsdatum)\n\nNordrhein-Westfalen Amtsgericht Münster HRB 15623\nEinreichung neuer Dokumente\n\nCOMPO EXPERT Holding GmbH\nGesellschaft mit beschränkter Haftung\nMünster\n\nDem Registergericht ist eine neue Liste der Mitglieder des Aufsichtsrates eingereicht worden."
    },
    {
      "date": "2025-11-18",
      "id": "137678",
      "original_text": "Registerbekanntmachung nach dem Umwandlungsgesetz\nNordrhein-Westfalen Amtsgericht Arnsberg HRB 3213\nWagener Holzwaren GmbH – Meschede",
      "type": "Registerbekanntmachung nach dem Umwandlungsgesetz",
      "state": "Nordrhein-Westfalen",
      "amtsgericht": "Amtsgericht Arnsberg",
      "registernummer": "HRB 3213",
      "registerart": "HRB",
      "company_name": "Wagener Holzwaren GmbH",
      "company_seat": "Meschede",
      "details": "18.11.2025 (Bekanntmachungsdatum)\n\nNordrhein-Westfalen Amtsgericht Arnsberg HRB 3213\nRegisterbekanntmachung nach dem Umwandlungsgesetz 18.11.2025 (Eintragungsdatum)\n\nWagener Holzwaren GmbH\nGesellschaft mit beschränkter Haftung\nMeschede\n\nDen Gläubigern der an der Verschmelzung beteiligten Rechtsträger ist, wenn sie binnen sechs Monaten nach dem Tag, an dem die Eintragung der Verschmelzung in das Register des Sitzes desjenigen Rechtsträgers, dessen Gläubiger sie sind, nach § 19 Absatz 3 UmwG als bekanntgemacht gilt, ihren Anspruch nach Grund und Höhe schriftlich anmelden, Sicherheit zu leisten, soweit sie nicht Befriedigung verlangen können. Dieses Recht steht den Gläubigern jedoch nur zu, wenn sie glaubhaft machen, dass durch die Verschmelzung die Erfüllung ihrer Forderung gefährdet wird."
    },
    {
      "date": "2025-11-18",
      "id": "137679",
      "original_text": "Registerbekanntmachung nach dem Umwandlungsgesetz\nNordrhein-Westfalen Amtsgericht Düsseldorf HRB 110941\nBuhr & Team Akademie für Führung und Vertrieb GmbH – Düsseldorf",
      "type": "Registerbekanntmachung nach dem Umwandlungsgesetz",
      "state": "Nordrhein-Westfalen",
      "amtsgericht": "Amtsgericht Düsseldorf",
      "registernummer": "HRB 110941",
      "registerart": "HRB",
      "company_name": "Buhr & Team Akademie für Führung und Vertrieb GmbH",
      "company_seat": "Düsseldorf",
      "details": "18.11.2025 (Bekanntmachungsdatum)\n\nNordrhein-Westfalen Amtsgericht Düsseldorf HRB 110941\nRegisterbekanntmachung nach dem Umwandlungsgesetz 18.11.2025 (Eintragungsdatum)\n\nBuhr & Team Akademie für Führung und Vertrieb GmbH\nGesellschaft mit beschränkter Haftung\nDüsseldorf\n\nDen Gläubigern der an der formwechselnden Umwandlung beteiligten Rechtsträger ist, wenn sie binnen sechs Monaten nach dem Tag, an dem die Eintragung der formwechselnden Umwandlung in das Register des Sitzes desjenigen Rechtsträgers, dessen Gläubiger sie sind, nach § 19 Absatz 3 UmwG als bekanntgemacht gilt, ihren Anspruch nach Grund und Höhe schriftlich anmelden, Sicherheit zu leisten, soweit sie nicht Befriedigung verlangen können. Dieses Recht steht den Gläubigern jedoch nur zu, wenn sie glaubhaft machen, dass durch die formwechselnden Umwandlung die Erfüllung ihrer Forderung gefährdet wird."
    },
    {
      "date": "2025-11-18",
      "id": "137680",
      "original_text": "Löschungsankündigung\nNordrhein-Westfalen Amtsgericht Krefeld HRB 4706\nHeinz Lang GmbH Bauunternehmung – Krefeld",
      "type": "Löschungsankündigung",
      "state": "Nordrhein-Westfalen",
      "amtsgericht": "Amtsgericht Krefeld",
      "registernummer": "HRB 4706",
      "registerart": "HRB",
      "company_name": "Heinz Lang GmbH Bauunternehmung",
      "company_seat": "Krefeld",
      "details": "18.11.2025 (Bekanntmachungsdatum)\n\nNordrhein-Westfalen Amtsgericht Krefeld HRB 4706\nLöschungsankündigung\n\nHeinz Lang GmbH Bauunternehmung\nGesellschaft mit beschränkter Haftung\nKrefeld\n\nDas Registergericht beabsichtigt die Gesellschaft von Amts wegen nach § 394 FamFG zu löschen. Die Frist zur Erhebung eines Widerspruchs ist auf einen Monat festgesetzt."
    },
    {
      "date": "2025-11-18",
      "id": "137681",
      "original_text": "Registerbekanntmachung nach dem Umwandlungsgesetz\nNordrhein-Westfalen Amtsgericht Essen HRB 20562\nWLH Beteiligungs-GmbH – Hattingen",
      "type": "Registerbekanntmachung nach dem Umwandlungsgesetz",
      "state": "Nordrhein-Westfalen",
      "amtsgericht": "Amtsgericht Essen",
      "registernummer": "HRB 20562",
      "registerart": "HRB",
      "company_name": "WLH Beteiligungs-GmbH",
      "company_seat": "Hattingen",
      "details": "18.11.2025 (Bekanntmachungsdatum)\n\nNordrhein-Westfalen Amtsgericht Essen HRB 20562\nRegisterbekanntmachung nach dem Umwandlungsgesetz 18.11.2025 (Eintragungsdatum)\n\nWLH Beteiligungs-GmbH\nGesellschaft mit beschränkter Haftung\nHattingen\n\nDen Gläubigern der an der Verschmelzung beteiligten Rechtsträger ist, wenn sie binnen sechs Monaten nach dem Tag, an dem die Eintragung der Verschmelzung in das Register des Sitzes desjenigen Rechtsträgers, dessen Gläubiger sie sind, nach § 19 Absatz 3 UmwG als bekanntgemacht gilt, ihren Anspruch nach Grund und Höhe schriftlich anmelden, Sicherheit zu leisten, soweit sie nicht Befriedigung verlangen können. Dieses Recht steht den Gläubigern jedoch nur zu, wenn sie glaubhaft machen, dass durch die Verschmelzung die Erfüllung ihrer Forderung gefährdet wird."
    },
    {
      "date": "2025-11-18",
      "id": "137682",
      "original_text": "Registerbekanntmachung nach dem Umwandlungsgesetz\nNordrhein-Westfalen Amtsgericht Duisburg HRB 8894\nBRENNTAG GmbH – Duisburg",
      "type": "Registerbekanntmachung nach dem Umwandlungsgesetz",
      "state": "Nordrhein-Westfalen",
      "amtsgericht": "Amtsgericht Duisburg",
      "registernummer": "HRB 8894",
      "registerart": "HRB",
      "company_name": "BRENNTAG GmbH",
      "company_seat": "Duisburg",
      "details": "18.11.2025 (Bekanntmachungsdatum)\n\nNordrhein-Westfalen Amtsgericht Duisburg HRB 8894\nRegisterbekanntmachung nach dem Umwandlungsgesetz 18.11.2025 (Eintragungsdatum)\n\nBRENNTAG GmbH\nGesellschaft mit beschränkter Haftung\nDuisburg\n\nDie Gesellschaft hat Gläubigern, deren Forderungen vor dieser Bekanntmachung begründet worden sind, Sicherheit zu leisten, soweit sie nicht Befriedigung verlangen können, wenn sie sich binnen sechs Monaten zu diesem Zweck melden."
    },
    {
      "date": "2025-11-18",
      "id": "137683",
      "original_text": "Registerbekanntmachung nach dem Umwandlungsgesetz\nNordrhein-Westfalen Amtsgericht Dortmund HRB 37789\nPRO DIMI Healthcare GmbH – Dortmund",
      "type": "Registerbekanntmachung nach dem Umwandlungsgesetz",
      "state": "Nordrhein-Westfalen",
      "amtsgericht": "Amtsgericht Dortmund",
      "registernummer": "HRB 37789",
      "registerart": "HRB",
      "company_name": "PRO DIMI Healthcare GmbH",
      "company_seat": "Dortmund",
      "details": "18.11.2025 (Bekanntmachungsdatum)\n\nNordrhein-Westfalen Amtsgericht Dortmund HRB 37789\nRegisterbekanntmachung nach dem Umwandlungsgesetz 18.11.2025 (Eintragungsdatum)\n\nPRO DIMI Healthcare GmbH\nGesellschaft mit beschränkter Haftung\nDortmund\n\nDen Gläubigern der an der formwechselnden Umwandlung beteiligten Rechtsträger ist, wenn sie binnen sechs Monaten nach dem Tag, an dem die Eintragung der formwechselnden Umwandlung in das Register des Sitzes desjenigen Rechtsträgers, dessen Gläubiger sie sind, nach § 19 Absatz 3 UmwG als bekanntgemacht gilt, ihren Anspruch nach Grund und Höhe schriftlich anmelden, Sicherheit zu leisten, soweit sie nicht Befriedigung verlangen können. Dieses Recht steht den Gläubigern jedoch nur zu, wenn sie glaubhaft machen, dass durch die formwechselnden Umwandlung die Erfüllung ihrer Forderung gefährdet wird."
    },
    {
      "date": "2025-11-18",
      "id": "137684",
      "original_text": "Registerbekanntmachung nach dem Umwandlungsgesetz\nNordrhein-Westfalen Amtsgericht Bielefeld HRB 44578\nGOLDBECK Bauelemente Bielefeld GmbH – Bielefeld",
      "type": "Registerbekanntmachung nach dem Umwandlungsgesetz",
      "state": "Nordrhein-Westfalen",
      "amtsgericht": "Amtsgericht Bielefeld",
      "registernummer": "HRB 44578",
      "registerart": "HRB",
      "company_name": "GOLDBECK Bauelemente Bielefeld GmbH",
      "company_seat": "Bielefeld",
      "details": "18.11.2025 (Bekanntmachungsdatum)\n\nNordrhein-Westfalen Amtsgericht Bielefeld HRB 44578\nRegisterbekanntmachung nach dem Umwandlungsgesetz 18.11.2025 (Eintragungsdatum)\n\nGOLDBECK Bauelemente Bielefeld GmbH\nGesellschaft mit beschränkter Haftung\nBielefeld\n\nDen Gläubigern der an der Abspaltung beteiligten Rechtsträger ist, wenn sie binnen sechs Monaten nach dem Tag, an dem die Eintragung der Abspaltung in das Register des Sitzes desjenigen Rechtsträgers, dessen Gläubiger sie sind, nach § 19 Absatz 3 UmwG als bekanntgemacht gilt, ihren Anspruch nach Grund und Höhe schriftlich anmelden, Sicherheit zu leisten, soweit sie nicht Befriedigung verlangen können. Dieses Recht steht den Gläubigern jedoch nur zu, wenn sie glaubhaft machen, dass durch die Abspaltung die Erfüllung ihrer Forderung gefährdet wird."
    },
    {
      "date": "2025-11-18",
      "id": "137685",
      "original_text": "Löschungsankündigung\nNordrhein-Westfalen Amtsgericht Düsseldorf HRB 99224\nKOWTECH GmbH – Düsseldorf",
      "type": "Löschungsankündigung",
      "state": "Nordrhein-Westfalen",
      "amtsgericht": "Amtsgericht Düsseldorf",
      "registernummer": "HRB 99224",
      "registerart": "HRB",
      "company_name": "KOWTECH GmbH",
      "company_seat": "Düsseldorf",
      "details": "18.11.2025 (Bekanntmachungsdatum)\n\nNordrhein-Westfalen Amtsgericht Düsseldorf HRB 99224\nLöschungsankündigung\n\nKOWTECH GmbH\nGesellschaft mit beschränkter Haftung\nDüsseldorf\n\nDas Registergericht beabsichtigt die Gesellschaft von Amts wegen nach § 394 FamFG zu löschen. Die Frist zur Erhebung eines Widerspruchs ist auf 3 Wochen festgesetzt.\n\nRechtsbehelfsbelehrung:\nDas Widerspruchsrecht steht jedem zu, der an der Unterlassung der Löschung ein berechtigtes Interesse hat. Der Widerspruch ist bei dem Amtsgericht Düsseldorf -Registergericht-, Werdener Straße 1, 40227 Düsseldorf schriftlich in deutscher Sprache oder zur Niederschrift der Geschäftsstelle einzulegen. Der Widerspruch kann auch zur Niederschrift der Geschäftsstelle eines jeden Amtsgerichtes abgegeben werden. Die Einlegung ist auch durch Übertragung eines elektronischen Dokuments an die elektronische Poststelle des Gerichts möglich. Das elektronische Dokument muss für die Bearbeitung durch das Gericht geeignet und mit einer qualifizierten elektronischen Signatur der verantwortenden Person versehen sein oder von der verantwortenden Person signiert und auf einem sicheren Übermittlungsweg gemäß § 130a ZPO nach näherer Maßgabe der Verordnung über die technischen Rahmenbedingungen des elektronischen Rechtsverkehrs und über das besondere elektronische Behördenpostfach (BGBl. I, S.3803) eingereicht werden. Weitere Informationen erhalten Sie auf der Internetseite www.justiz.de.\nDer Widerspruch muss spätestens innerhalb der gesetzten Frist nach dem Datum der Bekanntmachung der Löschungsankündigung bei dem Amtsgericht - Registergericht - Düsseldorf eingegangen sein.  Dies gilt auch dann, wenn der Widerspruch zur Niederschrift der Geschäftsstelle eines anderen Amtsgerichtes abgegeben wurde. Die Frist beginnt mit dem Tage der Bekanntmachung der Löschungsankündigung in dem für die Bekanntmachung der Eintragungen in das Handelsregister bestimmten elektronischen Informations- und Kommunikationssystem nach § 10 des Handelsgesetzbuches. Fällt das Ende der Frist auf einen Sonntag, einen allgemeinen Feiertag oder Sonnabend, so endet die Frist mit Ablauf des nächsten Werktages.\nDer Widerspruch muss die Bezeichnung der angefochtenen Löschungsankündigung sowie die Erklärung enthalten, dass Widerspruch gegen diese Löschungsankündigung eingelegt wird. Er ist zu unterzeichnen und soll begründet werden."
    },
    {
      "date": "2025-11-18",
      "id": "137686",
      "original_text": "Löschungsankündigung\nNordrhein-Westfalen Amtsgericht Krefeld HRB 16065\nSOTTOSCALA UG (haftungsbeschränkt) – Willich",
      "type": "Löschungsankündigung",
      "state": "Nordrhein-Westfalen",
      "amtsgericht": "Amtsgericht Krefeld",
      "registernummer": "HRB 16065",
      "registerart": "HRB",
      "company_name": "SOTTOSCALA UG (haftungsbeschränkt)",
      "company_seat": "Willich",
      "details": "18.11.2025 (Bekanntmachungsdatum)\n\nNordrhein-Westfalen Amtsgericht Krefeld HRB 16065\nLöschungsankündigung\n\nSOTTOSCALA UG (haftungsbeschränkt)\nGesellschaft mit beschränkter Haftung\nWillich\n\nDas Registergericht beabsichtigt die Gesellschaft von Amts wegen nach § 394 FamFG zu löschen. Die Frist zur Erhebung eines Widerspruchs ist auf einen Monat festgesetzt."
    },
    {
      "date": "2025-11-18",
      "id": "137687",
      "original_text": "Einreichung neuer Dokumente\nNordrhein-Westfalen Amtsgericht Düsseldorf HRB 92244\nVantage Towers AG – Düsseldorf",
      "type": "Einreichung neuer Dokumente",
      "state": "Nordrhein-Westfalen",
      "amtsgericht": "Amtsgericht Düsseldorf",
      "registernummer": "HRB 92244",
      "registerart": "HRB",
      "company_name": "Vantage Towers AG",
      "company_seat": "Düsseldorf",
      "details": "18.11.2025 (Bekanntmachungsdatum)\n\nNordrhein-Westfalen Amtsgericht Düsseldorf HRB 92244\nEinreichung neuer Dokumente 18.11.2025 (Eintragungsdatum)\n\nVantage Towers AG\nAktiengesellschaft\nDüsseldorf\n\nDem Registergericht ist eine Liste der Mitglieder des Aufsichtsrates eingereicht worden."
    },
    {
      "date": "2025-11-18",
      "id": "137688",
      "original_text": "Einreichung neuer Dokumente\nNordrhein-Westfalen Amtsgericht Münster HRB 14034\nCOMPO EXPERT GmbH – Münster",
      "type": "Einreichung neuer Dokumente",
      "state": "Nordrhein-Westfalen",
      "amtsgericht": "Amtsgericht Münster",
      "registernummer": "HRB 14034",
      "registerart": "HRB",
      "company_name": "COMPO EXPERT GmbH",
      "company_seat": "Münster",
      "details": "18.11.2025 (Bekanntmachungsdatum)\n\nNordrhein-Westfalen Amtsgericht Münster HRB 14034\nEinreichung neuer Dokumente\n\nCOMPO EXPERT GmbH\nGesellschaft mit beschränkter Haftung\nMünster\n\nDem Registergericht ist eine Liste der Mitglieder des Aufsichtsrates eingereicht worden."
    },
    {
      "date": "2025-11-18",
      "id": "137689",
      "original_text": "Löschungsankündigung\nNordrhein-Westfalen Amtsgericht Wuppertal HRB 28709\nByberi GmbH – Mettmann",
      "type": "Löschungsankündigung",
      "state": "Nordrhein-Westfalen",
      "amtsgericht": "Amtsgericht Wuppertal",
      "registernummer": "HRB 28709",
      "registerart": "HRB",
      "company_name": "Byberi GmbH",
      "company_seat": "Mettmann",
      "details": "18.11.2025 (Bekanntmachungsdatum)\n\nNordrhein-Westfalen Amtsgericht Wuppertal HRB 28709\nLöschungsankündigung\n\nByberi GmbH\nGesellschaft mit beschränkter Haftung\nMettmann\n\nDas Registergericht beabsichtigt die Gesellschaft von Amts wegen nach § 394 FamFG zu löschen. Die Frist zur Erhebung eines Widerspruchs ist auf einen Monat festgesetzt."
    },
    {
      "date": "2025-11-18",
      "id": "137690",
      "original_text": "Löschungsankündigung\nNordrhein-Westfalen Amtsgericht Köln HRB 118575\nBeulen Entferner GmbH – Leverkusen",
      "type": "Löschungsankündigung",
      "state": "Nordrhein-Westfalen",
      "amtsgericht": "Amtsgericht Köln",
      "registernummer": "HRB 118575",
      "registerart": "HRB",
      "company_name": "Beulen Entferner GmbH",
      "company_seat": "Leverkusen",
      "details": "18.11.2025 (Bekanntmachungsdatum)\n\nNordrhein-Westfalen Amtsgericht Köln HRB 118575\nLöschungsankündigung 18.11.2025 (Eintragungsdatum)\n\nBeulen Entferner GmbH\nGesellschaft mit beschränkter Haftung\nLeverkusen\n\nDas Registergericht beabsichtigt die Gesellschaft von Amts wegen nach § 394 FamFG zu löschen. Die Frist zur Erhebung eines Widerspruchs ist auf einen Monat festgesetzt."
    },
    {
      "date": "2025-11-18",
      "id": "137691",
      "original_text": "Registerbekanntmachung nach dem Umwandlungsgesetz\nNordrhein-Westfalen Amtsgericht Bochum HRA 8143\nBrüggemann Dienstleistungen e.K. – Herne",
      "type": "Registerbekanntmachung nach dem Umwandlungsgesetz",
      "state": "Nordrhein-Westfalen",
      "amtsgericht": "Amtsgericht Bochum",
      "registernummer": "HRA 8143",
      "registerart": "HRA",
      "company_name": "Brüggemann Dienstleistungen e.K.",
      "company_seat": "Herne",
      "details": "18.11.2025 (Bekanntmachungsdatum)\n\nNordrhein-Westfalen Amtsgericht Bochum HRA 8143\nRegisterbekanntmachung nach dem Umwandlungsgesetz 17.11.2025 (Eintragungsdatum)\n\nBrüggemann Dienstleistungen e.K.\nEinzelkaufmann / Einzelkauffrau\nHerne\n\nDen Gläubigern der an der Ausgliederung beteiligten Rechtsträger ist, wenn sie binnen sechs Monaten nach dem Tag, an dem die Eintragung der Ausgliederung in das Register des Sitzes desjenigen Rechtsträgers, dessen Gläubiger sie sind, nach § 19 Absatz 3 UmwG als bekanntgemacht gilt, ihren Anspruch nach Grund und Höhe schriftlich anmelden, Sicherheit zu leisten, soweit sie nicht Befriedigung verlangen können. Dieses Recht steht den Gläubigern jedoch nur zu, wenn sie glaubhaft machen, dass durch die Ausgliederung die Erfüllung ihrer Forderung gefährdet wird."
    },
    {
      "date": "2025-11-18",
      "id": "137692",
      "original_text": "Einreichung neuer Dokumente\nNordrhein-Westfalen Amtsgericht Dortmund HRB 15280\nacardo group AG – Dortmund",
      "type": "Einreichung neuer Dokumente",
      "state": "Nordrhein-Westfalen",
      "amtsgericht": "Amtsgericht Dortmund",
      "registernummer": "HRB 15280",
      "registerart": "HRB",
      "company_name": "acardo group AG",
      "company_seat": "Dortmund",
      "details": "18.11.2025 (Bekanntmachungsdatum)\n\nNordrhein-Westfalen Amtsgericht Dortmund HRB 15280\nEinreichung neuer Dokumente\n\nacardo group AG\nAktiengesellschaft\nDortmund\n\nDem Registergericht ist eine neue Liste der Mitglieder des Aufsichtsrates eingereicht worden."
    },
    {
      "date": "2025-11-18",
      "id": "137693",
      "original_text": "Registerbekanntmachung nach dem Umwandlungsgesetz\nNordrhein-Westfalen Amtsgericht Hamm HRB 12038\nC. Kuhlmann Elektrotechnik GmbH – Hamm",
      "type": "Registerbekanntmachung nach dem Umwandlungsgesetz",
      "state": "Nordrhein-Westfalen",
      "amtsgericht": "Amtsgericht Hamm",
      "registernummer": "HRB 12038",
      "registerart": "HRB",
      "company_name": "C. Kuhlmann Elektrotechnik GmbH",
      "company_seat": "Hamm",
      "details": "18.11.2025 (Bekanntmachungsdatum)\n\nNordrhein-Westfalen Amtsgericht Hamm HRB 12038\nRegisterbekanntmachung nach dem Umwandlungsgesetz 12.11.2025 (Eintragungsdatum)\n\nC. Kuhlmann Elektrotechnik GmbH\nGesellschaft mit beschränkter Haftung\nHamm\n\nDen Gläubigern der an der formwechselnden Umwandlung beteiligten Rechtsträger ist, wenn sie binnen sechs Monaten nach dem Tag, an dem die Eintragung der formwechselnden Umwandlung in das Register des Sitzes derjenigen Rechtsträger deren Gläubiger sie sind, nach § 19 Absatz 3 UmwG als bekanntgemacht gilt, ihren Anspruch nach Grund und Höhe schriftlich anmelden, Sicherheit zu leisten, soweit sie nicht Befriedigung verlangen können. Dieses Recht steht den Gläubigern jedoch nur zu, wenn sie glaubhaft machen, dass durch die formwechselnden Umwandlung die Erfüllung ihrer Forderung gefährdet wird."
    },
    {
      "date": "2025-11-18",
      "id": "137694",
      "original_text": "Sonstige Registerbekanntmachung\nNordrhein-Westfalen Amtsgericht Siegburg HRB 18832\nSMINA GmbH – Troisdorf",
      "type": "Sonstige Registerbekanntmachung",
      "state": "Nordrhein-Westfalen",
      "amtsgericht": "Amtsgericht Siegburg",
      "registernummer": "HRB 18832",
      "registerart": "HRB",
      "company_name": "SMINA GmbH",
      "company_seat": "Troisdorf",
      "details": "18.11.2025 (Bekanntmachungsdatum)\n\nNordrhein-Westfalen Amtsgericht Siegburg HRB 18832\nSonstige Registerbekanntmachung 18.11.2025 (Eintragungsdatum)\n\nSMINA GmbH\nGesellschaft mit beschränkter Haftung\nTroisdorf\n\nAls nicht eingetragen wird veröffentlicht: Den Gläubigern der Gesellschaft, deren Forderungen begründet worden sind bevor die Eintragung der Beendigung des Gewinnabführungsvertrages  in das Handelsregister nach § 10 des Handelsgesetzbuches als bekanntgemacht gilt, hat der andere Vertragsteil Sicherheit zu leisten, wenn sie sich binnen sechs Monaten nach der Bekanntmachung der Eintragung zu diesem Zweck bei ihm melden."
    },
    {
      "date": "2025-11-18",
      "id": "137695",
      "original_text": "Registerbekanntmachung nach dem Umwandlungsgesetz\nNordrhein-Westfalen Amtsgericht Dortmund HRB 37786\nHMF Food Production GmbH – Dortmund",
      "type": "Registerbekanntmachung nach dem Umwandlungsgesetz",
      "state": "Nordrhein-Westfalen",
      "amtsgericht": "Amtsgericht Dortmund",
      "registernummer": "HRB 37786",
      "registerart": "HRB",
      "company_name": "HMF Food Production GmbH",
      "company_seat": "Dortmund",
      "details": "18.11.2025 (Bekanntmachungsdatum)\n\nNordrhein-Westfalen Amtsgericht Dortmund HRB 37786\nRegisterbekanntmachung nach dem Umwandlungsgesetz 18.11.2025 (Eintragungsdatum)\n\nHMF Food Production GmbH\nGesellschaft mit beschränkter Haftung\nDortmund\n\nDen Gläubigern der an der formwechselnden Umwandlung beteiligten Rechtsträger ist, wenn sie binnen sechs Monaten nach dem Tag, an dem die Eintragung der formwechselnden Umwandlung in das Register des Sitzes desjenigen Rechtsträgers, dessen Gläubiger sie sind, nach § 19 Absatz 3 UmwG als bekanntgemacht gilt, ihren Anspruch nach Grund und Höhe schriftlich anmelden, Sicherheit zu leisten, soweit sie nicht Befriedigung verlangen können. Dieses Recht steht den Gläubigern jedoch nur zu, wenn sie glaubhaft machen, dass durch die formwechselnden Umwandlung die Erfüllung ihrer Forderung gefährdet wird."
    },
    {
      "date": "2025-11-18",
      "id": "137696",
      "original_text": "Einreichung neuer Dokumente\nNordrhein-Westfalen Amtsgericht Essen HRB 24298\nVier Gas Services Management GmbH – Essen",
      "type": "Einreichung neuer Dokumente",
      "state": "Nordrhein-Westfalen",
      "amtsgericht": "Amtsgericht Essen",
      "registernummer": "HRB 24298",
      "registerart": "HRB",
      "company_name": "Vier Gas Services Management GmbH",
      "company_seat": "Essen",
      "details": "18.11.2025 (Bekanntmachungsdatum)\n\nNordrhein-Westfalen Amtsgericht Essen HRB 24298\nEinreichung neuer Dokumente 18.11.2025 (Eintragungsdatum)\n\nVier Gas Services Management GmbH\nGesellschaft mit beschränkter Haftung\nEssen\n\nDem Registergericht ist eine neue Liste der Mitglieder des Aufsichtsrates eingereicht worden."
    },
    {
      "date": "2025-11-18",
      "id": "137697",
      "original_text": "Einreichung neuer Dokumente\nNordrhein-Westfalen Amtsgericht Köln HRB 27124\nTÜV Rheinland Kraftfahrt GmbH – Köln",
      "type": "Einreichung neuer Dokumente",
      "state": "Nordrhein-Westfalen",
      "amtsgericht": "Amtsgericht Köln",
      "registernummer": "HRB 27124",
      "registerart": "HRB",
      "company_name": "TÜV Rheinland Kraftfahrt GmbH",
      "company_seat": "Köln",
      "details": "18.11.2025 (Bekanntmachungsdatum)\n\nNordrhein-Westfalen Amtsgericht Köln HRB 27124\nEinreichung neuer Dokumente\n\nTÜV Rheinland Kraftfahrt GmbH\nGesellschaft mit beschränkter Haftung\nKöln\n\nDem Registergericht ist eine neue Liste der Mitglieder des Aufsichtsrates eingereicht worden."
    },
    {
      "date": "2025-11-18",
      "id": "137698",
      "original_text": "Registerbekanntmachung nach dem Umwandlungsgesetz\nNordrhein-Westfalen Amtsgericht Düsseldorf HRB 30698\nSHOEI (EUROPA) GMBH – Düsseldorf",
      "type": "Registerbekanntmachung nach dem Umwandlungsgesetz",
      "state": "Nordrhein-Westfalen",
      "amtsgericht": "Amtsgericht Düsseldorf",
      "registernummer": "HRB 30698",
      "registerart": "HRB",
      "company_name": "SHOEI (EUROPA) GMBH",
      "company_seat": "Düsseldorf",
      "details": "18.11.2025 (Bekanntmachungsdatum)\n\nNordrhein-Westfalen Amtsgericht Düsseldorf HRB 30698\nRegisterbekanntmachung nach dem Umwandlungsgesetz 18.11.2025 (Eintragungsdatum)\n\nSHOEI (EUROPA) GMBH\nGesellschaft mit beschränkter Haftung\nDüsseldorf\n\nDen Gläubigern der an der Verschmelzung beteiligten Rechtsträger ist, wenn sie binnen sechs Monaten nach dem Tag, an dem die Eintragung der Verschmelzung in das Register des Sitzes desjenigen Rechtsträgers, dessen Gläubiger sie sind, nach § 19 Absatz 3 UmwG als bekanntgemacht gilt, ihren Anspruch nach Grund und Höhe schriftlich anmelden, Sicherheit zu leisten, soweit sie nicht Befriedigung verlangen können. Dieses Recht steht den Gläubigern jedoch nur zu, wenn sie glaubhaft machen, dass durch die Verschmelzung die Erfüllung ihrer Forderung gefährdet wird."
    },
    {
      "date": "2025-11-18",
      "id": "137699",
      "original_text": "Registerbekanntmachung nach dem Umwandlungsgesetz\nNordrhein-Westfalen Amtsgericht Düsseldorf HRB 62698\nBuhr & Team Akademie für Führung und Vertrieb AG – Düsseldorf",
      "type": "Registerbekanntmachung nach dem Umwandlungsgesetz",
      "state": "Nordrhein-Westfalen",
      "amtsgericht": "Amtsgericht Düsseldorf",
      "registernummer": "HRB 62698",
      "registerart": "HRB",
      "company_name": "Buhr & Team Akademie für Führung und Vertrieb AG",
      "company_seat": "Düsseldorf",
      "details": "18.11.2025 (Bekanntmachungsdatum)\n\nNordrhein-Westfalen Amtsgericht Düsseldorf HRB 62698\nRegisterbekanntmachung nach dem Umwandlungsgesetz 18.11.2025 (Eintragungsdatum)\n\nBuhr & Team Akademie für Führung und Vertrieb AG\nAktiengesellschaft\nDüsseldorf\n\nDen Gläubigern der an der formwechselnden Umwandlung beteiligten Rechtsträger ist, wenn sie binnen sechs Monaten nach dem Tag, an dem die Eintragung der formwechselnden Umwandlung in das Register des Sitzes desjenigen Rechtsträgers, dessen Gläubiger sie sind, nach § 19 Absatz 3 UmwG als bekanntgemacht gilt, ihren Anspruch nach Grund und Höhe schriftlich anmelden, Sicherheit zu leisten, soweit sie nicht Befriedigung verlangen können. Dieses Recht steht den Gläubigern jedoch nur zu, wenn sie glaubhaft machen, dass durch die formwechselnden Umwandlung die Erfüllung ihrer Forderung gefährdet wird."
    },
    {
      "date": "2025-11-18",
      "id": "137700",
      "original_text": "Löschungsankündigung\nNordrhein-Westfalen Amtsgericht Mönchengladbach HRB 10878\nGeoplan Werbeservice GmbH – Mönchengladbach",
      "type": "Löschungsankündigung",
      "state": "Nordrhein-Westfalen",
      "amtsgericht": "Amtsgericht Mönchengladbach",
      "registernummer": "HRB 10878",
      "registerart": "HRB",
      "company_name": "Geoplan Werbeservice GmbH",
      "company_seat": "Mönchengladbach",
      "details": "18.11.2025 (Bekanntmachungsdatum)\n\nNordrhein-Westfalen Amtsgericht Mönchengladbach HRB 10878\nLöschungsankündigung 18.11.2025 (Eintragungsdatum)\n\nGeoplan Werbeservice GmbH\nGesellschaft mit beschränkter Haftung\nMönchengladbach\n\nDas Registergericht beabsichtigt, die im Handelsregister eingetragene Gesellschaft gemäß § 394 Absatz 1 FamFG wegen Vermögenslosigkeit von Amts wegen zu löschen. Gegen diese Verfügung kann Widerspruch eingelegt werden. Die Frist zur Erhebung eines Widerspruchs gegen die beabsichtigte Löschung von Amts wegen ist auf drei Monate festgesetzt."
    },
    {
      "date": "2025-11-18",
      "id": "137701",
      "original_text": "Registerbekanntmachung nach dem Umwandlungsgesetz\nNordrhein-Westfalen Amtsgericht Düsseldorf HRB 41489\nShoei Distribution GmbH – Düsseldorf",
      "type": "Registerbekanntmachung nach dem Umwandlungsgesetz",
      "state": "Nordrhein-Westfalen",
      "amtsgericht": "Amtsgericht Düsseldorf",
      "registernummer": "HRB 41489",
      "registerart": "HRB",
      "company_name": "Shoei Distribution GmbH",
      "company_seat": "Düsseldorf",
      "details": "18.11.2025 (Bekanntmachungsdatum)\n\nNordrhein-Westfalen Amtsgericht Düsseldorf HRB 41489\nRegisterbekanntmachung nach dem Umwandlungsgesetz 18.11.2025 (Eintragungsdatum)\n\nShoei Distribution GmbH\nGesellschaft mit beschränkter Haftung\nDüsseldorf\n\nDen Gläubigern der an der Verschmelzung beteiligten Rechtsträger ist, wenn sie binnen sechs Monaten nach dem Tag, an dem die Eintragung der Verschmelzung in das Register des Sitzes desjenigen Rechtsträgers, dessen Gläubiger sie sind, nach § 19 Absatz 3 UmwG als bekanntgemacht gilt, ihren Anspruch nach Grund und Höhe schriftlich anmelden, Sicherheit zu leisten, soweit sie nicht Befriedigung verlangen können. Dieses Recht steht den Gläubigern jedoch nur zu, wenn sie glaubhaft machen, dass durch die Verschmelzung die Erfüllung ihrer Forderung gefährdet wird."
    },
    {
      "date": "2025-11-18",
      "id": "137702",
      "original_text": "Löschungsankündigung\nNordrhein-Westfalen Amtsgericht Duisburg HRA 12882\nZeki Kara Tiefbau - Straßenbau e.K. – Duisburg",
      "type": "Löschungsankündigung",
      "state": "Nordrhein-Westfalen",
      "amtsgericht": "Amtsgericht Duisburg",
      "registernummer": "HRA 12882",
      "registerart": "HRA",
      "company_name": "Zeki Kara Tiefbau - Straßenbau e.K.",
      "company_seat": "Duisburg",
      "details": "18.11.2025 (Bekanntmachungsdatum)\n\nNordrhein-Westfalen Amtsgericht Duisburg HRA 12882\nLöschungsankündigung\n\nZeki Kara Tiefbau - Straßenbau e.K.\nEinzelkaufmann / Einzelkauffrau\nDuisburg\n\nDas Registergericht beabsichtigt die Firma von Amts wegen nach § 31 Abs. 2 HGB, § 393 FamFG zu löschen. Die Frist zur Erhebung eines Widerspruchs ist auf drei Monate festgesetzt."
    },
    {
      "date": "2025-11-18",
      "id": "137703",
      "original_text": "Löschungsankündigung\nNordrhein-Westfalen Amtsgericht Krefeld HRB 20155\nSchmuckliebling UG (haftungsbeschränkt) – Brüggen",
      "type": "Löschungsankündigung",
      "state": "Nordrhein-Westfalen",
      "amtsgericht": "Amtsgericht Krefeld",
      "registernummer": "HRB 20155",
      "registerart": "HRB",
      "company_name": "Schmuckliebling UG (haftungsbeschränkt)",
      "company_seat": "Brüggen",
      "details": "18.11.2025 (Bekanntmachungsdatum)\n\nNordrhein-Westfalen Amtsgericht Krefeld HRB 20155\nLöschungsankündigung\n\nSchmuckliebling UG (haftungsbeschränkt)\nGesellschaft mit beschränkter Haftung\nBrüggen\n\nDas Registergericht beabsichtigt die Gesellschaft von Amts wegen nach § 394 FamFG zu löschen. Die Frist zur Erhebung eines Widerspruchs ist auf einen Monat festgesetzt."
    },
    {
      "date": "2025-11-18",
      "id": "137704",
      "original_text": "Registerbekanntmachung nach dem Umwandlungsgesetz\nNordrhein-Westfalen Amtsgericht Essen HRB 25556\nINTELLEGOO GmbH – Essen",
      "type": "Registerbekanntmachung nach dem Umwandlungsgesetz",
      "state": "Nordrhein-Westfalen",
      "amtsgericht": "Amtsgericht Essen",
      "registernummer": "HRB 25556",
      "registerart": "HRB",
      "company_name": "INTELLEGOO GmbH",
      "company_seat": "Essen",
      "details": "18.11.2025 (Bekanntmachungsdatum)\n\nNordrhein-Westfalen Amtsgericht Essen HRB 25556\nRegisterbekanntmachung nach dem Umwandlungsgesetz 18.11.2025 (Eintragungsdatum)\n\nINTELLEGOO GmbH\nGesellschaft mit beschränkter Haftung\nEssen\n\nDen Gläubigern der an der Verschmelzung beteiligten Rechtsträger ist, wenn sie binnen sechs Monaten nach dem Tag, an dem die Eintragung der Verschmelzung in das Register des Sitzes desjenigen Rechtsträgers, dessen Gläubiger sie sind, nach § 19 Absatz 3 UmwG als bekanntgemacht gilt, ihren Anspruch nach Grund und Höhe schriftlich anmelden, Sicherheit zu leisten, soweit sie nicht Befriedigung verlangen können. Dieses Recht steht den Gläubigern jedoch nur zu, wenn sie glaubhaft machen, dass durch die Verschmelzung die Erfüllung ihrer Forderung gefährdet wird."
    },
    {
      "date": "2025-11-18",
      "id": "137705",
      "original_text": "Sonstige Registerbekanntmachung\nThüringen Amtsgericht Jena HRB 401918\nStadtwerke Mühlhausen GmbH – Mühlhausen",
      "type": "Sonstige Registerbekanntmachung",
      "state": "Thüringen",
      "amtsgericht": "Amtsgericht Jena",
      "registernummer": "HRB 401918",
      "registerart": "HRB",
      "company_name": "Stadtwerke Mühlhausen GmbH",
      "company_seat": "Mühlhausen",
      "details": "18.11.2025 (Bekanntmachungsdatum)\n\nThüringen Amtsgericht Jena HRB 401918\nSonstige Registerbekanntmachung\n\nStadtwerke Mühlhausen GmbH\nGesellschaft mit beschränkter Haftung\nMühlhausen\n\nBekanntmachung gem. § 52 Abs. 3 Satz 2 GmbHG: Aufgrund einer Veränderung in den Personen der Aufsichtsratsmitglieder ist durch die Geschäftsführer eine neue Liste zum Handelsregister eingereicht worden."
    },
    {
      "date": "2025-11-18",
      "id": "137706",
      "original_text": "Einreichung neuer Dokumente\nHessen Amtsgericht Kassel HRB 5592\nVerkehrsverbund und Fördergesellschaft Nordhessen mbH – Kassel",
      "type": "Einreichung neuer Dokumente",
      "state": "Hessen",
      "amtsgericht": "Amtsgericht Kassel",
      "registernummer": "HRB 5592",
      "registerart": "HRB",
      "company_name": "Verkehrsverbund und Fördergesellschaft Nordhessen mbH",
      "company_seat": "Kassel",
      "details": "18.11.2025 (Bekanntmachungsdatum)\n\nHessen Amtsgericht Kassel HRB 5592\nEinreichung neuer Dokumente\n\nVerkehrsverbund und Fördergesellschaft Nordhessen mbH\nGesellschaft mit beschränkter Haftung\nKassel\n\nDurch eine Änderung in den Personen der Aufsichtsratsmitglieder ist eine Liste der Mitglieder des Aufsichtsrates zum Handelsregister eingereicht worden."
    },
    {
      "date": "2025-11-18",
      "id": "137707",
      "original_text": "Registerbekanntmachung nach dem Umwandlungsgesetz\nHessen Amtsgericht Marburg HRA 5474\nWilli und Torsten Glittenberg GmbH & Co. KG – Frankenberg",
      "type": "Registerbekanntmachung nach dem Umwandlungsgesetz",
      "state": "Hessen",
      "amtsgericht": "Amtsgericht Marburg",
      "registernummer": "HRA 5474",
      "registerart": "HRA",
      "company_name": "Willi und Torsten Glittenberg GmbH & Co. KG",
      "company_seat": "Frankenberg",
      "details": "18.11.2025 (Bekanntmachungsdatum)\n\nHessen Amtsgericht Marburg HRA 5474\nRegisterbekanntmachung nach dem Umwandlungsgesetz 14.11.2025 (Eintragungsdatum)\n\nWilli und Torsten Glittenberg GmbH & Co. KG\nKommanditgesellschaft\nFrankenberg\n\nDen Gläubigern der an der formwechselnden Umwandlung beteiligten Rechtsträger ist, wenn sie binnen sechs Monaten nach dem Tag, an dem die Eintragung der formwechselnden Umwandlung in das Register des Sitzes desjenigen Rechtsträgers, dessen Gläubiger sie sind, nach § 201 UmwG bekannt gemacht worden ist, ihren Anspruch nach Grund und Höhe schriftlich anmelden, Sicherheit zu leisten, soweit sie nicht Befriedigung verlangen können. Dieses Recht steht den Gläubigern jedoch nur zu, wenn sie glaubhaft machen, dass durch die formwechselnden Umwandlung die Erfüllung ihrer Forderung gefährdet wird."
    },
    {
      "date": "2025-11-18",
      "id": "137708",
      "original_text": "Registerbekanntmachung nach dem Umwandlungsgesetz\nHessen Amtsgericht Frankfurt am Main HRB 53505\nCA Immo Deutschland GmbH – Frankfurt am Main",
      "type": "Registerbekanntmachung nach dem Umwandlungsgesetz",
      "state": "Hessen",
      "amtsgericht": "Amtsgericht Frankfurt am Main",
      "registernummer": "HRB 53505",
      "registerart": "HRB",
      "company_name": "CA Immo Deutschland GmbH",
      "company_seat": "Frankfurt am Main",
      "details": "18.11.2025 (Bekanntmachungsdatum)\n\nHessen Amtsgericht Frankfurt am Main HRB 53505\nRegisterbekanntmachung nach dem Umwandlungsgesetz 18.11.2025 (Eintragungsdatum)\n\nCA Immo Deutschland GmbH\nGesellschaft mit beschränkter Haftung\nFrankfurt am Main\n\nDen Gläubigern der an der Verschmelzung beteiligten Rechtsträger ist, wenn sie binnen sechs Monaten nach dem Tag, an dem die Eintragung der Verschmelzung in das Register des Sitzes desjenigen Rechtsträgers, dessen Gläubiger sie sind, nach § 19 Absatz 3 UmwG bekannt gemacht worden ist, ihren Anspruch nach Grund und Höhe schriftlich anmelden, Sicherheit zu leisten, soweit sie nicht Befriedigung verlangen können. Dieses Recht steht den Gläubigern jedoch nur zu, wenn sie glaubhaft machen, dass durch die Verschmelzung die Erfüllung ihrer Forderung gefährdet wird."
    },
    {
      "date": "2025-11-18",
      "id": "137709",
      "original_text": "Registerbekanntmachung nach dem Umwandlungsgesetz\nHessen Amtsgericht Kassel HRB 20472\nGlobal Assekuranz Nordhessen GmbH – Kassel",
      "type": "Registerbekanntmachung nach dem Umwandlungsgesetz",
      "state": "Hessen",
      "amtsgericht": "Amtsgericht Kassel",
      "registernummer": "HRB 20472",
      "registerart": "HRB",
      "company_name": "Global Assekuranz Nordhessen GmbH",
      "company_seat": "Kassel",
      "details": "18.11.2025 (Bekanntmachungsdatum)\n\nHessen Amtsgericht Kassel HRB 20472\nRegisterbekanntmachung nach dem Umwandlungsgesetz 18.11.2025 (Eintragungsdatum)\n\nGlobal Assekuranz Nordhessen GmbH\nGesellschaft mit beschränkter Haftung\nKassel\n\nDen Gläubigern der an der formwechselnden Umwandlung beteiligten Rechtsträger ist, wenn sie binnen sechs Monaten nach dem Tag, an dem die Eintragung der formwechselnden Umwandlung in das Register des Sitzes desjenigen Rechtsträgers, dessen Gläubiger sie sind, nach § 201 UmwG bekannt gemacht worden ist, ihren Anspruch nach Grund und Höhe schriftlich anmelden, Sicherheit zu leisten, soweit sie nicht Befriedigung verlangen können. Dieses Recht steht den Gläubigern jedoch nur zu, wenn sie glaubhaft machen, dass durch die formwechselnden Umwandlung die Erfüllung ihrer Forderung gefährdet wird."
    },
    {
      "date": "2025-11-18",
      "id": "137710",
      "original_text": "Registerbekanntmachung nach dem Umwandlungsgesetz\nHessen Amtsgericht Frankfurt am Main HRB 53505\nCA Immo Deutschland GmbH – Frankfurt am Main",
      "type": "Registerbekanntmachung nach dem Umwandlungsgesetz",
      "state": "Hessen",
      "amtsgericht": "Amtsgericht Frankfurt am Main",
      "registernummer": "HRB 53505",
      "registerart": "HRB",
      "company_name": "CA Immo Deutschland GmbH",
      "company_seat": "Frankfurt am Main",
      "details": "18.11.2025 (Bekanntmachungsdatum)\n\nHessen Amtsgericht Frankfurt am Main HRB 53505\nRegisterbekanntmachung nach dem Umwandlungsgesetz 18.11.2025 (Eintragungsdatum)\n\nCA Immo Deutschland GmbH\nGesellschaft mit beschränkter Haftung\nFrankfurt am Main\n\nDen Gläubigern der an der Verschmelzung beteiligten Rechtsträger ist, wenn sie binnen sechs Monaten nach dem Tag, an dem die Eintragung der Verschmelzung in das Register des Sitzes desjenigen Rechtsträgers, dessen Gläubiger sie sind, nach § 19 Absatz 3 UmwG bekannt gemacht worden ist, ihren Anspruch nach Grund und Höhe schriftlich anmelden, Sicherheit zu leisten, soweit sie nicht Befriedigung verlangen können. Dieses Recht steht den Gläubigern jedoch nur zu, wenn sie glaubhaft machen, dass durch die Verschmelzung die Erfüllung ihrer Forderung gefährdet wird."
    },
    {
      "date": "2025-11-18",
      "id": "137711",
      "original_text": "Löschungsankündigung\nHessen Amtsgericht Darmstadt HRB 95998\nSilver Light Technik GmbH – Darmstadt",
      "type": "Löschungsankündigung",
      "state": "Hessen",
      "amtsgericht": "Amtsgericht Darmstadt",
      "registernummer": "HRB 95998",
      "registerart": "HRB",
      "company_name": "Silver Light Technik GmbH",
      "company_seat": "Darmstadt",
      "details": "18.11.2025 (Bekanntmachungsdatum)\n\nHessen Amtsgericht Darmstadt HRB 95998\nLöschungsankündigung\n\nSilver Light Technik GmbH\nGesellschaft mit beschränkter Haftung\nDarmstadt\n\nDas Registergericht beabsichtigt die im Handelsregister eingetragene Gesellschaft von Amts wegen nach § 394 FamFG zu löschen. Die Frist zur Erhebung eines Widerspruchs gegen die beabsichtigte Löschung wird auf 3 Monate festgesetzt."
    },
    {
      "date": "2025-11-18",
      "id": "137712",
      "original_text": "Löschungsankündigung\nHessen Amtsgericht Darmstadt HRB 5675\nRieso Getränke GmbH – Pfungstadt",
      "type": "Löschungsankündigung",
      "state": "Hessen",
      "amtsgericht": "Amtsgericht Darmstadt",
      "registernummer": "HRB 5675",
      "registerart": "HRB",
      "company_name": "Rieso Getränke GmbH",
      "company_seat": "Pfungstadt",
      "details": "18.11.2025 (Bekanntmachungsdatum)\n\nHessen Amtsgericht Darmstadt HRB 5675\nLöschungsankündigung\n\nRieso Getränke GmbH\nGesellschaft mit beschränkter Haftung\nPfungstadt\n\nDas Registergericht beabsichtigt die im Handelsregister eingetragene Gesellschaft von Amts wegen nach § 394 FamFG zu löschen. Die Frist zur Erhebung eines Widerspruchs gegen die beabsichtigte Löschung wird auf 3 Monate festgesetzt."
    },
    {
      "date": "2025-11-18",
      "id": "137713",
      "original_text": "Löschungsankündigung\nHessen Amtsgericht Bad Hersfeld HRB 2855\nHelm Trophy Management GmbH – Friedewald",
      "type": "Löschungsankündigung",
      "state": "Hessen",
      "amtsgericht": "Amtsgericht Bad Hersfeld",
      "registernummer": "HRB 2855",
      "registerart": "HRB",
      "company_name": "Helm Trophy Management GmbH",
      "company_seat": "Friedewald",
      "details": "18.11.2025 (Bekanntmachungsdatum)\n\nHessen Amtsgericht Bad Hersfeld HRB 2855\nLöschungsankündigung\n\nHelm Trophy Management GmbH\nGesellschaft mit beschränkter Haftung\nFriedewald\n\nDas Registergericht beabsichtigt die im Handelsregister eingetragene Gesellschaft von Amts wegen nach § 394 FamFG zu löschen. Die Frist zur Erhebung eines Widerspruchs gegen die beabsichtigte Löschung wird auf 6 Wochen festgesetzt."
    },
    {
      "date": "2025-11-18",
      "id": "137714",
      "original_text": "Löschungsankündigung\nHessen Amtsgericht Frankfurt am Main HRB 105816\nAJB Marketing Media & Consulting UG (haftungsbeschränkt) – Frankfurt am Main",
      "type": "Löschungsankündigung",
      "state": "Hessen",
      "amtsgericht": "Amtsgericht Frankfurt am Main",
      "registernummer": "HRB 105816",
      "registerart": "HRB",
      "company_name": "AJB Marketing Media & Consulting UG (haftungsbeschränkt)",
      "company_seat": "Frankfurt am Main",
      "details": "18.11.2025 (Bekanntmachungsdatum)\n\nHessen Amtsgericht Frankfurt am Main HRB 105816\nLöschungsankündigung\n\nAJB Marketing Media & Consulting UG (haftungsbeschränkt)\nGesellschaft mit beschränkter Haftung\nFrankfurt am Main\n\nEs ist beabsichtigt die Gesellschaft wegen Vermögenslosigkeit gemäß § 394 FamFG von Amts wegen zu löschen. Hiergegen kann innerhalb eines Monats nach dieser Veröffentlichung Widerspruch bei dem Amtsgericht Frankfurt am Main eingelegt werden."
    },
    {
      "date": "2025-11-18",
      "id": "137715",
      "original_text": "Löschungsankündigung\nHessen Amtsgericht Darmstadt HRB 95071\nYASSIX Personal Power GmbH – Viernheim",
      "type": "Löschungsankündigung",
      "state": "Hessen",
      "amtsgericht": "Amtsgericht Darmstadt",
      "registernummer": "HRB 95071",
      "registerart": "HRB",
      "company_name": "YASSIX Personal Power GmbH",
      "company_seat": "Viernheim",
      "details": "18.11.2025 (Bekanntmachungsdatum)\n\nHessen Amtsgericht Darmstadt HRB 95071\nLöschungsankündigung 18.11.2025 (Eintragungsdatum)\n\nYASSIX Personal Power GmbH\nGesellschaft mit beschränkter Haftung\nViernheim\n\nDas Registergericht beabsichtigt die im Handelsregister eingetragene Gesellschaft von Amts wegen nach § 394 FamFG zu löschen. Die Frist zur Erhebung eines Widerspruchs gegen die beabsichtigte Löschung wird auf 3 Monate festgesetzt."
    }
  ]
}