{
  "date": "2025-11-29",
  "date_of_scrape": "2025-11-30T04:15:36.278Z",
  "tool_version": "0.2.0",
  "number_of_announcements": 15,
  "announcements": [
    {
      "date": "2025-11-29",
      "id": "138640",
      "original_text": "Löschungsankündigung\nBayern Amtsgericht Memmingen HRB 21086\nAK Stern Bau GmbH – Bad Wörishofen",
      "type": "Löschungsankündigung",
      "state": "Bayern",
      "amtsgericht": "Amtsgericht Memmingen",
      "registernummer": "HRB 21086",
      "registerart": "HRB",
      "company_name": "AK Stern Bau GmbH",
      "company_seat": "Bad Wörishofen",
      "details": "29.11.2025 (Bekanntmachungsdatum)\n\nBayern Amtsgericht Memmingen HRB 21086\nLöschungsankündigung\n\nAK Stern Bau GmbH\nGesellschaft mit beschränkter Haftung\nBad Wörishofen\n\nDas Registergericht beabsichtigt, die im Handelsregister eingetragene Gesellschaft wegen Vermögenslosigkeit von Amts wegen nach § 394 FamFG zu löschen. Die Frist zur Erhebung eines Widerspruchs ist auf einen Monat festgesetzt."
    },
    {
      "date": "2025-11-29",
      "id": "138641",
      "original_text": "Registerbekanntmachung nach dem Umwandlungsgesetz\nBayern Amtsgericht Traunstein HRB 30104\nGut Moierhof Betriebs GmbH – Grabenstätt",
      "type": "Registerbekanntmachung nach dem Umwandlungsgesetz",
      "state": "Bayern",
      "amtsgericht": "Amtsgericht Traunstein",
      "registernummer": "HRB 30104",
      "registerart": "HRB",
      "company_name": "Gut Moierhof Betriebs GmbH",
      "company_seat": "Grabenstätt",
      "details": "29.11.2025 (Bekanntmachungsdatum)\n\nBayern Amtsgericht Traunstein HRB 30104\nRegisterbekanntmachung nach dem Umwandlungsgesetz 28.11.2025 (Eintragungsdatum)\n\nGut Moierhof Betriebs GmbH\nGesellschaft mit beschränkter Haftung\nGrabenstätt\n\nDen Gläubigern der an der Verschmelzung beteiligten Rechtsträger ist, wenn sie binnen sechs Monaten nach dem Tag, an dem die Eintragung der Verschmelzung in das Register des Sitzes desjenigen Rechtsträgers, dessen Gläubiger sie sind, nach § 19 Abs. 3 UmwG als bekannt gemacht gilt, ihren Anspruch nach Grund und Höhe in Textform anmelden, Sicherheit zu leisten, soweit sie nicht Befriedigung verlangen können. Dieses Recht steht den Gläubigern jedoch nur zu, wenn sie glaubhaft machen, dass durch die Verschmelzung die Erfüllung ihrer Forderung gefährdet wird."
    },
    {
      "date": "2025-11-29",
      "id": "138642",
      "original_text": "Registerbekanntmachung nach dem Umwandlungsgesetz\nBayern Amtsgericht München HRA 16270\nRohde & Schwarz GmbH & Co. Kommanditgesellschaft – München",
      "type": "Registerbekanntmachung nach dem Umwandlungsgesetz",
      "state": "Bayern",
      "amtsgericht": "Amtsgericht München",
      "registernummer": "HRA 16270",
      "registerart": "HRA",
      "company_name": "Rohde & Schwarz GmbH & Co. Kommanditgesellschaft",
      "company_seat": "München",
      "details": "29.11.2025 (Bekanntmachungsdatum)\n\nBayern Amtsgericht München HRA 16270\nRegisterbekanntmachung nach dem Umwandlungsgesetz 28.11.2025 (Eintragungsdatum)\n\nRohde & Schwarz GmbH & Co. Kommanditgesellschaft\nKommanditgesellschaft\nMünchen\n\nDen Gläubigern der an der Verschmelzung beteiligten Rechtsträger ist, wenn sie binnen sechs Monaten nach dem Tag, an dem die Eintragung der Verschmelzung in das Register des Sitzes desjenigen Rechtsträgers, dessen Gläubiger sie sind, nach § 19 Abs. 3 UmwG als bekannt gemacht gilt, ihren Anspruch nach Grund und Höhe in Textform anmelden, Sicherheit zu leisten, soweit sie nicht Befriedigung verlangen können. Dieses Recht steht den Gläubigern jedoch nur zu, wenn sie glaubhaft machen, dass durch die Verschmelzung die Erfüllung ihrer Forderung gefährdet wird."
    },
    {
      "date": "2025-11-29",
      "id": "138643",
      "original_text": "Registerbekanntmachung nach dem Umwandlungsgesetz\nBayern Amtsgericht München HRB 275275\nHELMECA Immobilien 2 GmbH – München",
      "type": "Registerbekanntmachung nach dem Umwandlungsgesetz",
      "state": "Bayern",
      "amtsgericht": "Amtsgericht München",
      "registernummer": "HRB 275275",
      "registerart": "HRB",
      "company_name": "HELMECA Immobilien 2 GmbH",
      "company_seat": "München",
      "details": "29.11.2025 (Bekanntmachungsdatum)\n\nBayern Amtsgericht München HRB 275275\nRegisterbekanntmachung nach dem Umwandlungsgesetz 28.11.2025 (Eintragungsdatum)\n\nHELMECA Immobilien 2 GmbH\nGesellschaft mit beschränkter Haftung\nMünchen\n\nDen Gläubigern der an der Verschmelzung beteiligten Rechtsträger ist, wenn sie binnen sechs Monaten nach dem Tag, an dem die Eintragung der Verschmelzung in das Register des Sitzes desjenigen Rechtsträgers, dessen Gläubiger sie sind, nach § 19 Abs. 3 UmwG als bekannt gemacht gilt, ihren Anspruch nach Grund und Höhe in Textform anmelden, Sicherheit zu leisten, soweit sie nicht Befriedigung verlangen können. Dieses Recht steht den Gläubigern jedoch nur zu, wenn sie glaubhaft machen, dass durch die Verschmelzung die Erfüllung ihrer Forderung gefährdet wird."
    },
    {
      "date": "2025-11-29",
      "id": "138644",
      "original_text": "Einreichung neuer Dokumente\nBayern Amtsgericht München HRB 182906\nMünchner Wohnen GmbH – München",
      "type": "Einreichung neuer Dokumente",
      "state": "Bayern",
      "amtsgericht": "Amtsgericht München",
      "registernummer": "HRB 182906",
      "registerart": "HRB",
      "company_name": "Münchner Wohnen GmbH",
      "company_seat": "München",
      "details": "29.11.2025 (Bekanntmachungsdatum)\n\nBayern Amtsgericht München HRB 182906\nEinreichung neuer Dokumente\n\nMünchner Wohnen GmbH\nGesellschaft mit beschränkter Haftung\nMünchen\n\nDem Amtsgericht München -Registergericht- ist eine Liste der Mitglieder des Aufsichtsrats eingereicht worden, § 52 Abs. 3 S. 2 GmbHG."
    },
    {
      "date": "2025-11-29",
      "id": "138645",
      "original_text": "Löschungsankündigung\nBayern Amtsgericht Bayreuth HRA 3067\necole mode e.K. – Bindlach",
      "type": "Löschungsankündigung",
      "state": "Bayern",
      "amtsgericht": "Amtsgericht Bayreuth",
      "registernummer": "HRA 3067",
      "registerart": "HRA",
      "company_name": "ecole mode e.K.",
      "company_seat": "Bindlach",
      "details": "29.11.2025 (Bekanntmachungsdatum)\n\nBayern Amtsgericht Bayreuth HRA 3067\nLöschungsankündigung\n\necole mode e.K.\nEinzelkaufmann / Einzelkauffrau\nBindlach\n\nDas Registergericht beabsichtigt, die im Handelsregister eingetragene Firma von Amts wegen nach § 31 Abs. 2 HGB zu löschen. Die Frist zur Erhebung eines Widerspruchs ist auf sechs Wochen festgesetzt."
    },
    {
      "date": "2025-11-29",
      "id": "138646",
      "original_text": "Löschungsankündigung\nBayern Amtsgericht Bayreuth HRA 3067\necole mode e.K. – Bindlach",
      "type": "Löschungsankündigung",
      "state": "Bayern",
      "amtsgericht": "Amtsgericht Bayreuth",
      "registernummer": "HRA 3067",
      "registerart": "HRA",
      "company_name": "ecole mode e.K.",
      "company_seat": "Bindlach",
      "details": "29.11.2025 (Bekanntmachungsdatum)\n\nBayern Amtsgericht Bayreuth HRA 3067\nLöschungsankündigung\n\necole mode e.K.\nEinzelkaufmann / Einzelkauffrau\nBindlach\n\nDas Registergericht beabsichtigt, die im Handelsregister eingetragene Firma von Amts wegen nach § 31 Abs. 2 HGB zu löschen. Die Frist zur Erhebung eines Widerspruchs ist auf sechs Wochen festgesetzt."
    },
    {
      "date": "2025-11-29",
      "id": "138647",
      "original_text": "Einreichung neuer Dokumente\nBayern Amtsgericht Ingolstadt HRB 8055\nDigitales Gründerzentrum der Region Ingolstadt GmbH – Ingolstadt",
      "type": "Einreichung neuer Dokumente",
      "state": "Bayern",
      "amtsgericht": "Amtsgericht Ingolstadt",
      "registernummer": "HRB 8055",
      "registerart": "HRB",
      "company_name": "Digitales Gründerzentrum der Region Ingolstadt GmbH",
      "company_seat": "Ingolstadt",
      "details": "29.11.2025 (Bekanntmachungsdatum)\n\nBayern Amtsgericht Ingolstadt HRB 8055\nEinreichung neuer Dokumente 28.11.2025 (Eintragungsdatum)\n\nDigitales Gründerzentrum der Region Ingolstadt GmbH\nGesellschaft mit beschränkter Haftung\nIngolstadt\n\nDem Amtsgericht Ingolstadt -Registergericht- ist eine Liste der Mitglieder des Aufsichtsrats eingereicht worden, § 52 Abs. 3 S. 2 GmbHG."
    },
    {
      "date": "2025-11-29",
      "id": "138648",
      "original_text": "Einreichung neuer Dokumente\nBayern Amtsgericht München HRB 132279\npmOne AG – München",
      "type": "Einreichung neuer Dokumente",
      "state": "Bayern",
      "amtsgericht": "Amtsgericht München",
      "registernummer": "HRB 132279",
      "registerart": "HRB",
      "company_name": "pmOne AG",
      "company_seat": "München",
      "details": "29.11.2025 (Bekanntmachungsdatum)\n\nBayern Amtsgericht München HRB 132279\nEinreichung neuer Dokumente\n\npmOne AG\nAktiengesellschaft\nMünchen\n\nDem #Re.Name ist eine Liste der Mitglieder des Aufsichtsrats eingereicht worden, § 106 AktG."
    },
    {
      "date": "2025-11-29",
      "id": "138649",
      "original_text": "Löschungsankündigung\nBayern Amtsgericht München HRB 211905\nAmbulanter Pflegedienst \"Irena\" GmbH – München",
      "type": "Löschungsankündigung",
      "state": "Bayern",
      "amtsgericht": "Amtsgericht München",
      "registernummer": "HRB 211905",
      "registerart": "HRB",
      "company_name": "Ambulanter Pflegedienst \"Irena\" GmbH",
      "company_seat": "München",
      "details": "29.11.2025 (Bekanntmachungsdatum)\n\nBayern Amtsgericht München HRB 211905\nLöschungsankündigung 29.11.2025 (Eintragungsdatum)\n\nAmbulanter Pflegedienst \"Irena\" GmbH\nGesellschaft mit beschränkter Haftung\nMünchen\n\nDas Registergericht beabsichtigt, die im Handelsregister eingetragene Gesellschaft wegen Vermögenslosigkeit von Amts wegen nach § 394 FamFG zu löschen. Die Frist zur Erhebung eines Widerspruchs ist auf drei Monate festgesetzt."
    },
    {
      "date": "2025-11-29",
      "id": "138650",
      "original_text": "Registerbekanntmachung nach dem Umwandlungsgesetz\nBayern Amtsgericht München HRB 295896\nBlitz 24-218 GmbH – München",
      "type": "Registerbekanntmachung nach dem Umwandlungsgesetz",
      "state": "Bayern",
      "amtsgericht": "Amtsgericht München",
      "registernummer": "HRB 295896",
      "registerart": "HRB",
      "company_name": "Blitz 24-218 GmbH",
      "company_seat": "München",
      "details": "29.11.2025 (Bekanntmachungsdatum)\n\nBayern Amtsgericht München HRB 295896\nRegisterbekanntmachung nach dem Umwandlungsgesetz 28.11.2025 (Eintragungsdatum)\n\nBlitz 24-218 GmbH\nGesellschaft mit beschränkter Haftung\nMünchen\n\nDen Gläubigern der an der Verschmelzung beteiligten Rechtsträger ist, wenn sie binnen sechs Monaten nach dem Tag, an dem die Eintragung der Verschmelzung in das Register des Sitzes desjenigen Rechtsträgers, dessen Gläubiger sie sind, nach § 19 Abs. 3 UmwG als bekannt gemacht gilt, ihren Anspruch nach Grund und Höhe in Textform anmelden, Sicherheit zu leisten, soweit sie nicht Befriedigung verlangen können. Dieses Recht steht den Gläubigern jedoch nur zu, wenn sie glaubhaft machen, dass durch die Verschmelzung die Erfüllung ihrer Forderung gefährdet wird."
    },
    {
      "date": "2025-11-29",
      "id": "138651",
      "original_text": "Einreichung neuer Dokumente\nBayern Amtsgericht Würzburg HRB 7409\nFlexus AG – Würzburg",
      "type": "Einreichung neuer Dokumente",
      "state": "Bayern",
      "amtsgericht": "Amtsgericht Würzburg",
      "registernummer": "HRB 7409",
      "registerart": "HRB",
      "company_name": "Flexus AG",
      "company_seat": "Würzburg",
      "details": "29.11.2025 (Bekanntmachungsdatum)\n\nBayern Amtsgericht Würzburg HRB 7409\nEinreichung neuer Dokumente\n\nFlexus AG\nAktiengesellschaft\nWürzburg\n\nDem Amtsgericht Würzburg -Registergericht- ist eine Liste der Mitglieder des Aufsichtsrats eingereicht worden, § 106 AktG."
    },
    {
      "date": "2025-11-29",
      "id": "138652",
      "original_text": "Registerbekanntmachung nach dem Umwandlungsgesetz\nBayern Amtsgericht München HRB 111075\nBlue Yonder Technologies GmbH – München",
      "type": "Registerbekanntmachung nach dem Umwandlungsgesetz",
      "state": "Bayern",
      "amtsgericht": "Amtsgericht München",
      "registernummer": "HRB 111075",
      "registerart": "HRB",
      "company_name": "Blue Yonder Technologies GmbH",
      "company_seat": "München",
      "details": "29.11.2025 (Bekanntmachungsdatum)\n\nBayern Amtsgericht München HRB 111075\nRegisterbekanntmachung nach dem Umwandlungsgesetz 28.11.2025 (Eintragungsdatum)\n\nBlue Yonder Technologies GmbH\nGesellschaft mit beschränkter Haftung\nMünchen\n\nDen Gläubigern der an der Verschmelzung beteiligten Rechtsträger ist, wenn sie binnen sechs Monaten nach dem Tag, an dem die Eintragung der Verschmelzung in das Register des Sitzes desjenigen Rechtsträgers, dessen Gläubiger sie sind, nach § 19 Abs. 3 UmwG als bekannt gemacht gilt, ihren Anspruch nach Grund und Höhe in Textform anmelden, Sicherheit zu leisten, soweit sie nicht Befriedigung verlangen können. Dieses Recht steht den Gläubigern jedoch nur zu, wenn sie glaubhaft machen, dass durch die Verschmelzung die Erfüllung ihrer Forderung gefährdet wird."
    },
    {
      "date": "2025-11-29",
      "id": "138653",
      "original_text": "Registerbekanntmachung nach dem Umwandlungsgesetz\nBayern Amtsgericht München VR 20407\nMontessori Dachau e.V. – Dachau",
      "type": "Registerbekanntmachung nach dem Umwandlungsgesetz",
      "state": "Bayern",
      "amtsgericht": "Amtsgericht München",
      "registernummer": "VR 20407",
      "registerart": "VR",
      "company_name": "Montessori Dachau e.V.",
      "company_seat": "Dachau",
      "details": "29.11.2025 (Bekanntmachungsdatum)\n\nBayern Amtsgericht München VR 20407\nRegisterbekanntmachung nach dem Umwandlungsgesetz 28.11.2025 (Eintragungsdatum)\n\nMontessori Dachau e.V.\neingetragener Verein\nDachau\n\nDen Gläubigern der an der Ausgliederung beteiligten Rechtsträger ist, wenn sie binnen sechs Monaten nach dem Tag, an dem die Eintragung der Ausgliederung in das Register des Sitzes desjenigen Rechtsträgers, dessen Gläubiger sie sind, nach §§ 125, 19 Abs. 3 UmwG als bekannt gemacht gilt, ihren Anspruch nach Grund und Höhe in Textform anmelden, Sicherheit zu leisten, soweit sie nicht Befriedigung verlangen können. Dieses Recht steht den Gläubigern jedoch nur zu, wenn sie glaubhaft machen, dass durch die Ausgliederung die Erfüllung ihrer Forderung gefährdet wird."
    },
    {
      "date": "2025-11-29",
      "id": "138654",
      "original_text": "Registerbekanntmachung nach dem Umwandlungsgesetz\nNiedersachsen Amtsgericht Hildesheim HRB 201202\nH&B Norddeutsche Bauträger GmbH – Hildesheim",
      "type": "Registerbekanntmachung nach dem Umwandlungsgesetz",
      "state": "Niedersachsen",
      "amtsgericht": "Amtsgericht Hildesheim",
      "registernummer": "HRB 201202",
      "registerart": "HRB",
      "company_name": "H&B Norddeutsche Bauträger GmbH",
      "company_seat": "Hildesheim",
      "details": "29.11.2025 (Bekanntmachungsdatum)\n\nNiedersachsen Amtsgericht Hildesheim HRB 201202\nRegisterbekanntmachung nach dem Umwandlungsgesetz 29.11.2025 (Eintragungsdatum)\n\nH&B Norddeutsche Bauträger GmbH\nGesellschaft mit beschränkter Haftung\nHildesheim\n\nDen Gläubigern der an der Verschmelzung beteiligten Rechtsträger ist, wenn sie binnen sechs Monaten nach dem Tag, an dem die Eintragung der Verschmelzung in das Register des Sitzes desjenigen Rechtsträgers, dessen Gläubiger sie sind, nach § 19  Abs.  3 UmwG als bekannt gemacht gilt, ihren Anspruch nach Grund und Höhe schriftlich anmelden, Sicherheit zu leisten, soweit sie nicht Befriedigung verlangen können. Dieses Recht steht den Gläubigern jedoch nur zu, wenn sie glaubhaft machen, dass durch die Verschmelzung die Erfüllung der Forderung gefährdet wird."
    }
  ]
}