{
  "date": "2025-11-26",
  "date_of_scrape": "2025-11-27T04:09:41.106Z",
  "tool_version": "0.2.0",
  "number_of_announcements": 114,
  "announcements": [
    {
      "date": "2025-11-26",
      "id": "138296",
      "original_text": "Einreichung neuer Dokumente\nBayern Amtsgericht Traunstein HRB 34554\nMEGGLE Holding SE – Wasserburg a.Inn",
      "type": "Einreichung neuer Dokumente",
      "state": "Bayern",
      "amtsgericht": "Amtsgericht Traunstein",
      "registernummer": "HRB 34554",
      "registerart": "HRB",
      "company_name": "MEGGLE Holding SE",
      "company_seat": "Wasserburg a.Inn",
      "details": "26.11.2025 (Bekanntmachungsdatum)\n\nBayern Amtsgericht Traunstein HRB 34554\nEinreichung neuer Dokumente\n\nMEGGLE Holding SE\nEuropäische Aktiengesellschaft (SE)\nWasserburg a.Inn\n\nDem Amtsgericht Traunstein -Registergericht- ist eine Liste der Mitglieder des Aufsichtsrats eingereicht worden, Art. 9 Abs. 1 Buchst. c (ii) SE-VO i.V.m. § 106 AktG."
    },
    {
      "date": "2025-11-26",
      "id": "138297",
      "original_text": "Einreichung neuer Dokumente\nBayern Amtsgericht München HRB 263135\nCertina Consumer Concepts AG – Grünwald",
      "type": "Einreichung neuer Dokumente",
      "state": "Bayern",
      "amtsgericht": "Amtsgericht München",
      "registernummer": "HRB 263135",
      "registerart": "HRB",
      "company_name": "Certina Consumer Concepts AG",
      "company_seat": "Grünwald",
      "details": "26.11.2025 (Bekanntmachungsdatum)\n\nBayern Amtsgericht München HRB 263135\nEinreichung neuer Dokumente\n\nCertina Consumer Concepts AG\nAktiengesellschaft\nGrünwald\n\nDem Amtsgericht München -Registergericht- ist eine Liste der Mitglieder des Aufsichtsrats eingereicht worden, § 106 AktG."
    },
    {
      "date": "2025-11-26",
      "id": "138298",
      "original_text": "Löschungsankündigung\nBayern Amtsgericht München HRB 248320\nSUNRISE GASTRO UG (haftungsbeschränkt) – München",
      "type": "Löschungsankündigung",
      "state": "Bayern",
      "amtsgericht": "Amtsgericht München",
      "registernummer": "HRB 248320",
      "registerart": "HRB",
      "company_name": "SUNRISE GASTRO UG (haftungsbeschränkt)",
      "company_seat": "München",
      "details": "26.11.2025 (Bekanntmachungsdatum)\n\nBayern Amtsgericht München HRB 248320\nLöschungsankündigung 25.11.2025 (Eintragungsdatum)\n\nSUNRISE GASTRO UG (haftungsbeschränkt)\nGesellschaft mit beschränkter Haftung\nMünchen\n\nDas Registergericht beabsichtigt, die im Handelsregister eingetragene Gesellschaft wegen Vermögenslosigkeit von Amts wegen nach § 394 FamFG zu löschen. Die Frist zur Erhebung eines Widerspruchs ist auf drei Monate festgesetzt."
    },
    {
      "date": "2025-11-26",
      "id": "138299",
      "original_text": "Löschungsankündigung\nBayern Amtsgericht München HRB 182904\nmelcon Management & Holding GmbH – München",
      "type": "Löschungsankündigung",
      "state": "Bayern",
      "amtsgericht": "Amtsgericht München",
      "registernummer": "HRB 182904",
      "registerart": "HRB",
      "company_name": "melcon Management & Holding GmbH",
      "company_seat": "München",
      "details": "26.11.2025 (Bekanntmachungsdatum)\n\nBayern Amtsgericht München HRB 182904\nLöschungsankündigung 25.11.2025 (Eintragungsdatum)\n\nmelcon Management & Holding GmbH\nGesellschaft mit beschränkter Haftung\nMünchen\n\nDas Registergericht beabsichtigt, den im Handelsregister eingetragenen Geschäftsführer wegen fehlender Eignung nach § 395 FamFG zu löschen. Die Frist zur Erhebung eines Widerspruchs ist auf drei Monate festgesetzt."
    },
    {
      "date": "2025-11-26",
      "id": "138300",
      "original_text": "Einreichung neuer Dokumente\nBayern Amtsgericht Memmingen HRB 21145\nCentus AG – Neu-Ulm",
      "type": "Einreichung neuer Dokumente",
      "state": "Bayern",
      "amtsgericht": "Amtsgericht Memmingen",
      "registernummer": "HRB 21145",
      "registerart": "HRB",
      "company_name": "Centus AG",
      "company_seat": "Neu-Ulm",
      "details": "26.11.2025 (Bekanntmachungsdatum)\n\nBayern Amtsgericht Memmingen HRB 21145\nEinreichung neuer Dokumente\n\nCentus AG\nAktiengesellschaft\nNeu-Ulm\n\nDem Amtsgericht Memmingen -Registergericht- ist eine Liste der Mitglieder des Aufsichtsrats eingereicht worden, § 106 AktG."
    },
    {
      "date": "2025-11-26",
      "id": "138301",
      "original_text": "Registerbekanntmachung nach dem Umwandlungsgesetz\nBayern Amtsgericht München HRB 307444\nContemporary Amperex Technology AG – München",
      "type": "Registerbekanntmachung nach dem Umwandlungsgesetz",
      "state": "Bayern",
      "amtsgericht": "Amtsgericht München",
      "registernummer": "HRB 307444",
      "registerart": "HRB",
      "company_name": "Contemporary Amperex Technology AG",
      "company_seat": "München",
      "details": "26.11.2025 (Bekanntmachungsdatum)\n\nBayern Amtsgericht München HRB 307444\nRegisterbekanntmachung nach dem Umwandlungsgesetz 25.11.2025 (Eintragungsdatum)\n\nContemporary Amperex Technology AG\nAktiengesellschaft\nMünchen\n\nDen Gläubigern des formwechselnden Rechtsträgers ist, wenn sie binnen sechs Monaten nach dem Tag, an dem die Eintragung des Formwechsels nach § 201 UmwG als bekannt gemacht gilt, ihren Anspruch nach Grund und Höhe in Textform anmelden, Sicherheit zu leisten, soweit sie nicht Befriedigung verlangen können. Dieses Recht steht den Gläubigern jedoch nur zu, wenn sie glaubhaft machen, dass durch den Formwechsel die Erfüllung ihrer Forderung gefährdet wird."
    },
    {
      "date": "2025-11-26",
      "id": "138302",
      "original_text": "Registerbekanntmachung nach dem Umwandlungsgesetz\nBayern Amtsgericht Nürnberg HRA 13645\nALLROUND DIENSTLEISTUNGEN e.K. – Nürnberg",
      "type": "Registerbekanntmachung nach dem Umwandlungsgesetz",
      "state": "Bayern",
      "amtsgericht": "Amtsgericht Nürnberg",
      "registernummer": "HRA 13645",
      "registerart": "HRA",
      "company_name": "ALLROUND DIENSTLEISTUNGEN e.K.",
      "company_seat": "Nürnberg",
      "details": "26.11.2025 (Bekanntmachungsdatum)\n\nBayern Amtsgericht Nürnberg HRA 13645\nRegisterbekanntmachung nach dem Umwandlungsgesetz 25.11.2025 (Eintragungsdatum)\n\nALLROUND DIENSTLEISTUNGEN e.K.\nEinzelkaufmann / Einzelkauffrau\nNürnberg\n\nDen Gläubigern der an der Ausgliederung beteiligten Rechtsträger ist, wenn sie binnen sechs Monaten nach dem Tag, an dem die Eintragung der Ausgliederung in das Register des Sitzes desjenigen Rechtsträgers, dessen Gläubiger sie sind, nach §§ 125, 19 Abs. 3 UmwG als bekannt gemacht gilt, ihren Anspruch nach Grund und Höhe in Textform anmelden, Sicherheit zu leisten, soweit sie nicht Befriedigung verlangen können. Dieses Recht steht den Gläubigern jedoch nur zu, wenn sie glaubhaft machen, dass durch die Ausgliederung die Erfüllung ihrer Forderung gefährdet wird."
    },
    {
      "date": "2025-11-26",
      "id": "138303",
      "original_text": "Einreichung neuer Dokumente\nBayern Amtsgericht Kempten (Allgäu) HRB 10739\nSWW - Beteiligungs- und Verwaltungs GmbH – Sonthofen",
      "type": "Einreichung neuer Dokumente",
      "state": "Bayern",
      "amtsgericht": "Amtsgericht Kempten (Allgäu)",
      "registernummer": "HRB 10739",
      "registerart": "HRB",
      "company_name": "SWW - Beteiligungs- und Verwaltungs GmbH",
      "company_seat": "Sonthofen",
      "details": "26.11.2025 (Bekanntmachungsdatum)\n\nBayern Amtsgericht Kempten (Allgäu) HRB 10739\nEinreichung neuer Dokumente 25.11.2025 (Eintragungsdatum)\n\nSWW - Beteiligungs- und Verwaltungs GmbH\nGesellschaft mit beschränkter Haftung\nSonthofen\n\nDem Amtsgericht Kempten (Allgäu) -Registergericht- ist eine Liste der Mitglieder des Aufsichtsrats eingereicht worden, § 52 Abs. 3 S. 2 GmbHG."
    },
    {
      "date": "2025-11-26",
      "id": "138304",
      "original_text": "Einreichung neuer Dokumente\nBayern Amtsgericht München HRB 101699\nWLF- Wohnungsbau GmbH im Landkreis Freising – Freising",
      "type": "Einreichung neuer Dokumente",
      "state": "Bayern",
      "amtsgericht": "Amtsgericht München",
      "registernummer": "HRB 101699",
      "registerart": "HRB",
      "company_name": "WLF- Wohnungsbau GmbH im Landkreis Freising",
      "company_seat": "Freising",
      "details": "26.11.2025 (Bekanntmachungsdatum)\n\nBayern Amtsgericht München HRB 101699\nEinreichung neuer Dokumente 25.11.2025 (Eintragungsdatum)\n\nWLF- Wohnungsbau GmbH im Landkreis Freising\nGesellschaft mit beschränkter Haftung\nFreising\n\nDem Amtsgericht München -Registergericht- ist eine Liste der Mitglieder des Aufsichtsrats eingereicht worden, § 52 Abs. 3 S. 2 GmbHG."
    },
    {
      "date": "2025-11-26",
      "id": "138305",
      "original_text": "Registerbekanntmachung nach dem Umwandlungsgesetz\nBayern Amtsgericht München HRB 210883\nContemporary Amperex Technology GmbH – München",
      "type": "Registerbekanntmachung nach dem Umwandlungsgesetz",
      "state": "Bayern",
      "amtsgericht": "Amtsgericht München",
      "registernummer": "HRB 210883",
      "registerart": "HRB",
      "company_name": "Contemporary Amperex Technology GmbH",
      "company_seat": "München",
      "details": "26.11.2025 (Bekanntmachungsdatum)\n\nBayern Amtsgericht München HRB 210883\nRegisterbekanntmachung nach dem Umwandlungsgesetz 25.11.2025 (Eintragungsdatum)\n\nContemporary Amperex Technology GmbH\nGesellschaft mit beschränkter Haftung\nMünchen\n\nDen Gläubigern des formwechselnden Rechtsträgers ist, wenn sie binnen sechs Monaten nach dem Tag, an dem die Eintragung des Formwechsels nach § 201 UmwG als bekannt gemacht gilt, ihren Anspruch nach Grund und Höhe in Textform anmelden, Sicherheit zu leisten, soweit sie nicht Befriedigung verlangen können. Dieses Recht steht den Gläubigern jedoch nur zu, wenn sie glaubhaft machen, dass durch den Formwechsel die Erfüllung ihrer Forderung gefährdet wird."
    },
    {
      "date": "2025-11-26",
      "id": "138306",
      "original_text": "Löschungsankündigung\nBayern Amtsgericht Amberg HRB 5194\nP&M FINMAR UG (haftungsbeschränkt) – Ebermannsdorf",
      "type": "Löschungsankündigung",
      "state": "Bayern",
      "amtsgericht": "Amtsgericht Amberg",
      "registernummer": "HRB 5194",
      "registerart": "HRB",
      "company_name": "P&M FINMAR UG (haftungsbeschränkt)",
      "company_seat": "Ebermannsdorf",
      "details": "26.11.2025 (Bekanntmachungsdatum)\n\nBayern Amtsgericht Amberg HRB 5194\nLöschungsankündigung\n\nP&M FINMAR UG (haftungsbeschränkt)\nGesellschaft mit beschränkter Haftung\nEbermannsdorf\n\nDas Registergericht beabsichtigt, die im Handelsregister eingetragene Gesellschaft wegen Vermögenslosigkeit von Amts wegen nach § 394 FamFG zu löschen. Die Frist zur Erhebung eines Widerspruchs ist auf einen Monat festgesetzt."
    },
    {
      "date": "2025-11-26",
      "id": "138307",
      "original_text": "Löschungsankündigung\nBayern Amtsgericht Kempten (Allgäu) HRB 17722\nFast Transporte UG (haftungsbeschränkt) – Kempten (Allgäu)",
      "type": "Löschungsankündigung",
      "state": "Bayern",
      "amtsgericht": "Amtsgericht Kempten (Allgäu)",
      "registernummer": "HRB 17722",
      "registerart": "HRB",
      "company_name": "Fast Transporte UG (haftungsbeschränkt)",
      "company_seat": "Kempten (Allgäu)",
      "details": "26.11.2025 (Bekanntmachungsdatum)\n\nBayern Amtsgericht Kempten (Allgäu) HRB 17722\nLöschungsankündigung\n\nFast Transporte UG (haftungsbeschränkt)\nGesellschaft mit beschränkter Haftung\nKempten (Allgäu)\n\nDas Registergericht beabsichtigt, die im Handelsregister eingetragene Gesellschaft wegen Vermögenslosigkeit von Amts wegen nach § 394 FamFG zu löschen. Die Frist zur Erhebung eines Widerspruchs ist auf einen Monat festgesetzt."
    },
    {
      "date": "2025-11-26",
      "id": "138308",
      "original_text": "Registerbekanntmachung nach dem Umwandlungsgesetz\nBayern Amtsgericht München HRB 269868\nHalifax Management Advisory AG – Grünwald",
      "type": "Registerbekanntmachung nach dem Umwandlungsgesetz",
      "state": "Bayern",
      "amtsgericht": "Amtsgericht München",
      "registernummer": "HRB 269868",
      "registerart": "HRB",
      "company_name": "Halifax Management Advisory AG",
      "company_seat": "Grünwald",
      "details": "26.11.2025 (Bekanntmachungsdatum)\n\nBayern Amtsgericht München HRB 269868\nRegisterbekanntmachung nach dem Umwandlungsgesetz 25.11.2025 (Eintragungsdatum)\n\nHalifax Management Advisory AG\nAktiengesellschaft\nGrünwald\n\nDen Gläubigern des formwechselnden Rechtsträgers ist, wenn sie binnen sechs Monaten nach dem Tag, an dem die Eintragung des Formwechsels nach § 201 UmwG als bekannt gemacht gilt, ihren Anspruch nach Grund und Höhe in Textform anmelden, Sicherheit zu leisten, soweit sie nicht Befriedigung verlangen können. Dieses Recht steht den Gläubigern jedoch nur zu, wenn sie glaubhaft machen, dass durch den Formwechsel die Erfüllung ihrer Forderung gefährdet wird."
    },
    {
      "date": "2025-11-26",
      "id": "138309",
      "original_text": "Einreichung neuer Dokumente\nBayern Amtsgericht Augsburg HRB 21345\nC L Holding AG – Stadtbergen",
      "type": "Einreichung neuer Dokumente",
      "state": "Bayern",
      "amtsgericht": "Amtsgericht Augsburg",
      "registernummer": "HRB 21345",
      "registerart": "HRB",
      "company_name": "C L Holding AG",
      "company_seat": "Stadtbergen",
      "details": "26.11.2025 (Bekanntmachungsdatum)\n\nBayern Amtsgericht Augsburg HRB 21345\nEinreichung neuer Dokumente\n\nC L Holding AG\nAktiengesellschaft\nStadtbergen\n\nDem Amtsgericht Augsburg -Registergericht- ist eine Liste der Mitglieder des Aufsichtsrats eingereicht worden, § 106 AktG."
    },
    {
      "date": "2025-11-26",
      "id": "138310",
      "original_text": "Registerbekanntmachung nach dem Umwandlungsgesetz\nBayern Amtsgericht Nürnberg HRB 45277\nAllround Dienstleistung Bayern GmbH – Nürnberg",
      "type": "Registerbekanntmachung nach dem Umwandlungsgesetz",
      "state": "Bayern",
      "amtsgericht": "Amtsgericht Nürnberg",
      "registernummer": "HRB 45277",
      "registerart": "HRB",
      "company_name": "Allround Dienstleistung Bayern GmbH",
      "company_seat": "Nürnberg",
      "details": "26.11.2025 (Bekanntmachungsdatum)\n\nBayern Amtsgericht Nürnberg HRB 45277\nRegisterbekanntmachung nach dem Umwandlungsgesetz 25.11.2025 (Eintragungsdatum)\n\nAllround Dienstleistung Bayern GmbH\nGesellschaft mit beschränkter Haftung\nNürnberg\n\nDen Gläubigern der an der Ausgliederung beteiligten Rechtsträger ist, wenn sie binnen sechs Monaten nach dem Tag, an dem die Eintragung der Ausgliederung in das Register des Sitzes desjenigen Rechtsträgers, dessen Gläubiger sie sind, nach §§ 125, 19 Abs. 3 UmwG als bekannt gemacht gilt, ihren Anspruch nach Grund und Höhe in Textform anmelden, Sicherheit zu leisten, soweit sie nicht Befriedigung verlangen können. Dieses Recht steht den Gläubigern jedoch nur zu, wenn sie glaubhaft machen, dass durch die Ausgliederung die Erfüllung ihrer Forderung gefährdet wird."
    },
    {
      "date": "2025-11-26",
      "id": "138311",
      "original_text": "Registerbekanntmachung nach dem Umwandlungsgesetz\nBayern Amtsgericht München HRB 307462\nHalifax Management Advisory GmbH – Grünwald",
      "type": "Registerbekanntmachung nach dem Umwandlungsgesetz",
      "state": "Bayern",
      "amtsgericht": "Amtsgericht München",
      "registernummer": "HRB 307462",
      "registerart": "HRB",
      "company_name": "Halifax Management Advisory GmbH",
      "company_seat": "Grünwald",
      "details": "26.11.2025 (Bekanntmachungsdatum)\n\nBayern Amtsgericht München HRB 307462\nRegisterbekanntmachung nach dem Umwandlungsgesetz 25.11.2025 (Eintragungsdatum)\n\nHalifax Management Advisory GmbH\nGesellschaft mit beschränkter Haftung\nGrünwald\n\nDen Gläubigern des formwechselnden Rechtsträgers ist, wenn sie binnen sechs Monaten nach dem Tag, an dem die Eintragung des Formwechsels nach § 201 UmwG als bekannt gemacht gilt, ihren Anspruch nach Grund und Höhe in Textform anmelden, Sicherheit zu leisten, soweit sie nicht Befriedigung verlangen können. Dieses Recht steht den Gläubigern jedoch nur zu, wenn sie glaubhaft machen, dass durch den Formwechsel die Erfüllung ihrer Forderung gefährdet wird."
    },
    {
      "date": "2025-11-26",
      "id": "138312",
      "original_text": "Löschungsankündigung\nBayern Amtsgericht Passau HRB 543\n\"GRIESBACHER HOF\" Verwaltungs GmbH – Bad Griesbach i. Rottal",
      "type": "Löschungsankündigung",
      "state": "Bayern",
      "amtsgericht": "Amtsgericht Passau",
      "registernummer": "HRB 543",
      "registerart": "HRB",
      "company_name": "\"GRIESBACHER HOF\" Verwaltungs GmbH",
      "company_seat": "Bad Griesbach i. Rottal",
      "details": "26.11.2025 (Bekanntmachungsdatum)\n\nBayern Amtsgericht Passau HRB 543\nLöschungsankündigung\n\n\"GRIESBACHER HOF\" Verwaltungs GmbH\nGesellschaft mit beschränkter Haftung\nBad Griesbach i. Rottal\n\nDas Registergericht beabsichtigt, die im Handelsregister eingetragene Gesellschaft wegen Vermögenslosigkeit von Amts wegen nach § 394 FamFG zu löschen. Die Frist zur Erhebung eines Widerspruchs ist auf einen Monat festgesetzt."
    },
    {
      "date": "2025-11-26",
      "id": "138313",
      "original_text": "Registerbekanntmachung nach dem Umwandlungsgesetz\nBayern Amtsgericht München HRB 299715\nLufthansa Aviation GmbH – München",
      "type": "Registerbekanntmachung nach dem Umwandlungsgesetz",
      "state": "Bayern",
      "amtsgericht": "Amtsgericht München",
      "registernummer": "HRB 299715",
      "registerart": "HRB",
      "company_name": "Lufthansa Aviation GmbH",
      "company_seat": "München",
      "details": "26.11.2025 (Bekanntmachungsdatum)\n\nBayern Amtsgericht München HRB 299715\nRegisterbekanntmachung nach dem Umwandlungsgesetz 25.11.2025 (Eintragungsdatum)\n\nLufthansa Aviation GmbH\nGesellschaft mit beschränkter Haftung\nMünchen\n\nDen Gläubigern der an der Spaltung beteiligten Rechtsträger ist, wenn sie binnen sechs Monaten nach dem Tag, an dem die Eintragung der Spaltung in das Register des Sitzes desjenigen Rechtsträgers, dessen Gläubiger sie sind, nach §§ 125, 19 Abs. 3 UmwG als bekannt gemacht gilt, ihren Anspruch nach Grund und Höhe in Textform anmelden, Sicherheit zu leisten, soweit sie nicht Befriedigung verlangen können. Dieses Recht steht den Gläubigern jedoch nur zu, wenn sie glaubhaft machen, dass durch die Spaltung die Erfüllung ihrer Forderung gefährdet wird."
    },
    {
      "date": "2025-11-26",
      "id": "138314",
      "original_text": "Registerbekanntmachung nach dem Umwandlungsgesetz\nBerlin Amtsgericht Berlin (Charlottenburg) HRB 39599\nPro Video Handelsgesellschaft mbH Berlin Broadcast- und Konferenztechnik – Berlin",
      "type": "Registerbekanntmachung nach dem Umwandlungsgesetz",
      "state": "Berlin",
      "amtsgericht": "Amtsgericht Berlin (Charlottenburg)",
      "registernummer": "HRB 39599",
      "registerart": "HRB",
      "company_name": "Pro Video Handelsgesellschaft mbH Berlin Broadcast- und Konferenztechnik",
      "company_seat": "Berlin",
      "details": "26.11.2025 (Bekanntmachungsdatum)\n\nBerlin Amtsgericht Berlin (Charlottenburg) HRB 39599\nRegisterbekanntmachung nach dem Umwandlungsgesetz 25.11.2025 (Eintragungsdatum)\n\nPro Video Handelsgesellschaft mbH Berlin Broadcast- und Konferenztechnik\nGesellschaft mit beschränkter Haftung\nBerlin\n\nZu Eintragungsnummer 7 vom 25.11.2025 wird als nicht eingetragen veröffentlicht: Den Gläubigern der an der Verschmelzung beteiligten Rechtsträger ist, wenn sie binnen sechs Monaten nach dem Tag, an dem die Eintragung der Verschmelzung in das Register des Sitzes desjenigen Rechtsträgers, dessen Gläubiger sie sind, als bekannt gemacht gilt, ihren Anspruch nach Grund und Höhe schriftlich anmelden, Sicherheit zu leisten, soweit sie nicht Befriedigung verlangen können. Dieses Recht steht den Gläubigern jedoch nur zu, wenn sie glaubhaft machen, dass durch die Verschmelzung die Erfüllung ihrer Forderung gefährdet wird. Das Recht, Sicherheitsleistung zu verlangen, steht Gläubigern nicht zu, die im Falle der Insolvenz ein Recht auf vorzugsweise Befriedigung aus einer Deckungsmasse haben, die nach gesetzlicher Vorschrift zu ihrem Schutz errichtet und staatlich überwacht ist."
    },
    {
      "date": "2025-11-26",
      "id": "138315",
      "original_text": "Einreichung neuer Dokumente\nSaarland Amtsgericht Saarbrücken HRB 11231\nSaarländische Wagnisfinanzierungsgesellschaft mbH – Saarbrücken",
      "type": "Einreichung neuer Dokumente",
      "state": "Saarland",
      "amtsgericht": "Amtsgericht Saarbrücken",
      "registernummer": "HRB 11231",
      "registerart": "HRB",
      "company_name": "Saarländische Wagnisfinanzierungsgesellschaft mbH",
      "company_seat": "Saarbrücken",
      "details": "26.11.2025 (Bekanntmachungsdatum)\n\nSaarland Amtsgericht Saarbrücken HRB 11231\nEinreichung neuer Dokumente\n\nSaarländische Wagnisfinanzierungsgesellschaft mbH\nGesellschaft mit beschränkter Haftung\nSaarbrücken\n\nDie Geschäftsführung der Gesellschaft hat eine Liste der Mitglieder des Aufsichtsrats zum Handelsregister eingereicht (§ 52 Abs. 3 Satz 2 GmbHG)."
    },
    {
      "date": "2025-11-26",
      "id": "138316",
      "original_text": "Löschungsankündigung\nBrandenburg Amtsgericht Potsdam HRB 30602\nSaleschap Verwaltungs UG (haftungsbeschränkt) – Potsdam",
      "type": "Löschungsankündigung",
      "state": "Brandenburg",
      "amtsgericht": "Amtsgericht Potsdam",
      "registernummer": "HRB 30602",
      "registerart": "HRB",
      "company_name": "Saleschap Verwaltungs UG (haftungsbeschränkt)",
      "company_seat": "Potsdam",
      "details": "26.11.2025 (Bekanntmachungsdatum)\n\nBrandenburg Amtsgericht Potsdam HRB 30602\nLöschungsankündigung\n\nSaleschap Verwaltungs UG (haftungsbeschränkt)\nGesellschaft mit beschränkter Haftung\nPotsdam\n\nBei der nachstehenden Gesellschaft wird das Amtslöschungsverfahren gemäß § 394 FamFG eingeleitet. Widerspruchsfrist: 8 Wochen"
    },
    {
      "date": "2025-11-26",
      "id": "138317",
      "original_text": "Löschungsankündigung\nBerlin Amtsgericht Berlin (Charlottenburg) HRB 137311\nVisito GmbH – Berlin",
      "type": "Löschungsankündigung",
      "state": "Berlin",
      "amtsgericht": "Amtsgericht Berlin (Charlottenburg)",
      "registernummer": "HRB 137311",
      "registerart": "HRB",
      "company_name": "Visito GmbH",
      "company_seat": "Berlin",
      "details": "26.11.2025 (Bekanntmachungsdatum)\n\nBerlin Amtsgericht Berlin (Charlottenburg) HRB 137311\nLöschungsankündigung\n\nVisito GmbH\nGesellschaft mit beschränkter Haftung\nBerlin\n\nBei der nachstehenden Gesellschaft wird das Amtslöschungsverfahren gemäß § 394 FamFG eingeleitet. Widerspruchsfrist 6 Wochen"
    },
    {
      "date": "2025-11-26",
      "id": "138318",
      "original_text": "Löschungsankündigung\nBerlin Amtsgericht Berlin (Charlottenburg) HRB 252268\nC.M. Michelangelo Verwaltung UG (haftungsbeschränkt) – Berlin",
      "type": "Löschungsankündigung",
      "state": "Berlin",
      "amtsgericht": "Amtsgericht Berlin (Charlottenburg)",
      "registernummer": "HRB 252268",
      "registerart": "HRB",
      "company_name": "C.M. Michelangelo Verwaltung UG (haftungsbeschränkt)",
      "company_seat": "Berlin",
      "details": "26.11.2025 (Bekanntmachungsdatum)\n\nBerlin Amtsgericht Berlin (Charlottenburg) HRB 252268\nLöschungsankündigung\n\nC.M. Michelangelo Verwaltung UG (haftungsbeschränkt)\nGesellschaft mit beschränkter Haftung\nBerlin\n\nBei der nachstehenden Gesellschaft wird das Amtslöschungsverfahren gemäß § 394 FamFG eingeleitet. Widerspruchsfrist: 6 Wochen."
    },
    {
      "date": "2025-11-26",
      "id": "138319",
      "original_text": "Registerbekanntmachung nach dem Umwandlungsgesetz\nBaden-Württemberg Amtsgericht Freiburg HRA 706540\nA&R Erdarbeiten e.K. – Nordrach",
      "type": "Registerbekanntmachung nach dem Umwandlungsgesetz",
      "state": "Baden-Württemberg",
      "amtsgericht": "Amtsgericht Freiburg",
      "registernummer": "HRA 706540",
      "registerart": "HRA",
      "company_name": "A&R Erdarbeiten e.K.",
      "company_seat": "Nordrach",
      "details": "26.11.2025 (Bekanntmachungsdatum)\n\nBaden-Württemberg Amtsgericht Freiburg HRA 706540\nRegisterbekanntmachung nach dem Umwandlungsgesetz 26.11.2025 (Eintragungsdatum)\n\nA&R Erdarbeiten e.K.\nEinzelkaufmann / Einzelkauffrau\nNordrach\n\nAls nicht eingetragen wird bekanntgemacht:\nDen Gläubigern der an der Ausgliederung beteiligten Rechtsträger ist, wenn sie binnen sechs Monaten nach dem Tag, an dem die Eintragung der Ausgliederung in das Register des Sitzes desjenigen Rechtsträgers, dessen Gläubiger sie sind, nach § 19 Abs. 3 UmwG als bekanntgemacht gilt, ihren Anspruch nach Grund und Höhe schriftlich anmelden, Sicherheit zu leisten, soweit sie nicht Befriedigung verlangen können. Dieses Recht steht den Gläubigern jedoch nur zu, wenn sie glaubhaft machen, dass durch die Ausgliederung die Erfüllung ihrer Forderung gefährdet wird."
    },
    {
      "date": "2025-11-26",
      "id": "138320",
      "original_text": "Löschungsankündigung\nBerlin Amtsgericht Berlin (Charlottenburg) HRB 185151\nJylan GmbH – Berlin",
      "type": "Löschungsankündigung",
      "state": "Berlin",
      "amtsgericht": "Amtsgericht Berlin (Charlottenburg)",
      "registernummer": "HRB 185151",
      "registerart": "HRB",
      "company_name": "Jylan GmbH",
      "company_seat": "Berlin",
      "details": "26.11.2025 (Bekanntmachungsdatum)\n\nBerlin Amtsgericht Berlin (Charlottenburg) HRB 185151\nLöschungsankündigung\n\nJylan GmbH\nGesellschaft mit beschränkter Haftung\nBerlin\n\nBei der nachstehenden Gesellschaft wird das Amtslöschungsverfahren gemäß § 394 FamFG eingeleitet. Widerspruchsfrist 6 Wochen"
    },
    {
      "date": "2025-11-26",
      "id": "138321",
      "original_text": "Einreichung neuer Dokumente\nMecklenburg-Vorpommern Amtsgericht Neubrandenburg HRB 5975\nHELIO Aktiengesellschaft – Stuer",
      "type": "Einreichung neuer Dokumente",
      "state": "Mecklenburg-Vorpommern",
      "amtsgericht": "Amtsgericht Neubrandenburg",
      "registernummer": "HRB 5975",
      "registerart": "HRB",
      "company_name": "HELIO Aktiengesellschaft",
      "company_seat": "Stuer",
      "details": "26.11.2025 (Bekanntmachungsdatum)\n\nMecklenburg-Vorpommern Amtsgericht Neubrandenburg HRB 5975\nEinreichung neuer Dokumente 26.11.2025 (Eintragungsdatum)\n\nHELIO Aktiengesellschaft\nAktiengesellschaft\nStuer\n\nEine Liste der Mitglieder des Aufsichtsrats ist zum Handelsregister eingereicht worden."
    },
    {
      "date": "2025-11-26",
      "id": "138322",
      "original_text": "Registerbekanntmachung nach dem Umwandlungsgesetz\nSachsen-Anhalt Amtsgericht Stendal GsR 1121\nMVZ Hausarztteam eGbR – Schönebeck (Elbe)",
      "type": "Registerbekanntmachung nach dem Umwandlungsgesetz",
      "state": "Sachsen-Anhalt",
      "amtsgericht": "Amtsgericht Stendal",
      "registernummer": "GsR 1121",
      "registerart": "GsR",
      "company_name": "MVZ Hausarztteam eGbR",
      "company_seat": "Schönebeck (Elbe)",
      "details": "26.11.2025 (Bekanntmachungsdatum)\n\nSachsen-Anhalt Amtsgericht Stendal GsR 1121\nRegisterbekanntmachung nach dem Umwandlungsgesetz 26.11.2025 (Eintragungsdatum)\n\nMVZ Hausarztteam eGbR\nGesellschaft bürgerlichen Rechts\nSchönebeck (Elbe)\n\nNicht eingetragen:\nDen Gläubigern des formwechselnden Rechtsträgers ist, wenn sie binnen sechs Monaten nach dem Tag, an dem die Eintragung des Formwechsels nach § 201 UmwG als bekanntgemacht gilt, ihren Anspruch nach Grund und Höhe schriftlich anmelden, Sicherheit zu leisten, soweit sie nicht Befriedigung verlangen können. Dieses Recht steht ihnen jedoch nur zu, wenn sie glaubhaft machen, dass durch den Formwechsel die Erfüllung ihrer Forderung gefährdet wird."
    },
    {
      "date": "2025-11-26",
      "id": "138323",
      "original_text": "Löschungsankündigung\nBrandenburg Amtsgericht Potsdam HRB 33199\nWaldchamp UG (haftungsbeschränkt) – Niederer Fläming",
      "type": "Löschungsankündigung",
      "state": "Brandenburg",
      "amtsgericht": "Amtsgericht Potsdam",
      "registernummer": "HRB 33199",
      "registerart": "HRB",
      "company_name": "Waldchamp UG (haftungsbeschränkt)",
      "company_seat": "Niederer Fläming",
      "details": "26.11.2025 (Bekanntmachungsdatum)\n\nBrandenburg Amtsgericht Potsdam HRB 33199\nLöschungsankündigung\n\nWaldchamp UG (haftungsbeschränkt)\nGesellschaft mit beschränkter Haftung\nNiederer Fläming\n\nBei der nachstehenden Gesellschaft wird das Amtslöschungsverfahren gemäß § 394 FamFG eingeleitet. Widerspruchsfrist 8 Wochen."
    },
    {
      "date": "2025-11-26",
      "id": "138324",
      "original_text": "Löschungsankündigung\nBerlin Amtsgericht Berlin (Charlottenburg) HRB 220495\nWir Medical UG (haftungsbeschränkt) – Berlin",
      "type": "Löschungsankündigung",
      "state": "Berlin",
      "amtsgericht": "Amtsgericht Berlin (Charlottenburg)",
      "registernummer": "HRB 220495",
      "registerart": "HRB",
      "company_name": "Wir Medical UG (haftungsbeschränkt)",
      "company_seat": "Berlin",
      "details": "26.11.2025 (Bekanntmachungsdatum)\n\nBerlin Amtsgericht Berlin (Charlottenburg) HRB 220495\nLöschungsankündigung\n\nWir Medical UG (haftungsbeschränkt)\nGesellschaft mit beschränkter Haftung\nBerlin\n\nBei der nachstehenden Gesellschaft wird das Amtslöschungsverfahren gemäß § 394 FamFG eingeleitet. Widerspruchsfrist 6 Wochen"
    },
    {
      "date": "2025-11-26",
      "id": "138325",
      "original_text": "Löschungsankündigung\nBerlin Amtsgericht Berlin (Charlottenburg) HRB 240672\nK&H Mietwagenbetrieb GmbH – Berlin",
      "type": "Löschungsankündigung",
      "state": "Berlin",
      "amtsgericht": "Amtsgericht Berlin (Charlottenburg)",
      "registernummer": "HRB 240672",
      "registerart": "HRB",
      "company_name": "K&H Mietwagenbetrieb GmbH",
      "company_seat": "Berlin",
      "details": "26.11.2025 (Bekanntmachungsdatum)\n\nBerlin Amtsgericht Berlin (Charlottenburg) HRB 240672\nLöschungsankündigung\n\nK&H Mietwagenbetrieb GmbH\nGesellschaft mit beschränkter Haftung\nBerlin\n\nBei der nachstehenden Gesellschaft wird das Amtslöschungsverfahren gemäß § 394 FamFG eingeleitet. Widerspruchsfrist 6 Wochen"
    },
    {
      "date": "2025-11-26",
      "id": "138326",
      "original_text": "Registerbekanntmachung nach dem Umwandlungsgesetz\nBerlin Amtsgericht Berlin (Charlottenburg) HRB 280580\ntrlyr 31 UG (haftungsbeschränkt) – Berlin",
      "type": "Registerbekanntmachung nach dem Umwandlungsgesetz",
      "state": "Berlin",
      "amtsgericht": "Amtsgericht Berlin (Charlottenburg)",
      "registernummer": "HRB 280580",
      "registerart": "HRB",
      "company_name": "trlyr 31 UG (haftungsbeschränkt)",
      "company_seat": "Berlin",
      "details": "26.11.2025 (Bekanntmachungsdatum)\n\nBerlin Amtsgericht Berlin (Charlottenburg) HRB 280580\nRegisterbekanntmachung nach dem Umwandlungsgesetz 26.11.2025 (Eintragungsdatum)\n\ntrlyr 31 UG (haftungsbeschränkt)\nGesellschaft mit beschränkter Haftung\nBerlin\n\nZu Eintragungsnummer 3 vom 26.11.2025 wird als nicht eingetragen veröffentlicht: Den Gläubigern ist, wenn sie binnen sechs Monaten nach dem Tag, an dem die Eintragung der Umwandlung als bekannt gemacht gilt, ihren Anspruch nach Grund und Höhe schriftlich anmelden, Sicherheit zu leisten, soweit sie nicht Befriedigung verlangen können. Dieses Recht steht den Gläubigern jedoch nur zu, wenn sie glaubhaft machen, dass durch die Umwandlung die Erfüllung ihrer Forderung gefährdet wird. Das Recht, Sicherheitsleistung zu verlangen, steht Gläubigern nicht zu, die im Falle der Insolvenz ein Recht auf vorzugsweise Befriedigung aus einer Deckungsmasse haben, die nach gesetzlicher Vorschrift zu ihrem Schutz errichtet und staatlich überwacht ist."
    },
    {
      "date": "2025-11-26",
      "id": "138327",
      "original_text": "Registerbekanntmachung nach dem Umwandlungsgesetz\nBerlin Amtsgericht Berlin (Charlottenburg) HRA 64971\ntrlyr 31 GmbH & Co. KG – Berlin",
      "type": "Registerbekanntmachung nach dem Umwandlungsgesetz",
      "state": "Berlin",
      "amtsgericht": "Amtsgericht Berlin (Charlottenburg)",
      "registernummer": "HRA 64971",
      "registerart": "HRA",
      "company_name": "trlyr 31 GmbH & Co. KG",
      "company_seat": "Berlin",
      "details": "26.11.2025 (Bekanntmachungsdatum)\n\nBerlin Amtsgericht Berlin (Charlottenburg) HRA 64971\nRegisterbekanntmachung nach dem Umwandlungsgesetz 26.11.2025 (Eintragungsdatum)\n\ntrlyr 31 GmbH & Co. KG\nKommanditgesellschaft\nBerlin\n\nZu Eintragungsnummer 1 vom 26.11.2025 wird als nicht eingetragen veröffentlicht: Den Gläubigern ist, wenn sie binnen sechs Monaten nach dem Tag, an dem die Eintragung der Umwandlung als bekannt gemacht gilt, ihren Anspruch nach Grund und Höhe schriftlich anmelden, Sicherheit zu leisten, soweit sie nicht Befriedigung verlangen können. Dieses Recht steht den Gläubigern jedoch nur zu, wenn sie glaubhaft machen, dass durch die Umwandlung die Erfüllung ihrer Forderung gefährdet wird. Das Recht, Sicherheitsleistung zu verlangen, steht Gläubigern nicht zu, die im Falle der Insolvenz ein Recht auf vorzugsweise Befriedigung aus einer Deckungsmasse haben, die nach gesetzlicher Vorschrift zu ihrem Schutz errichtet und staatlich überwacht ist."
    },
    {
      "date": "2025-11-26",
      "id": "138328",
      "original_text": "Löschungsankündigung\nBrandenburg Amtsgericht Potsdam HRB 30826\nVendato Handels UG (haftungsbeschränkt) – Falkensee",
      "type": "Löschungsankündigung",
      "state": "Brandenburg",
      "amtsgericht": "Amtsgericht Potsdam",
      "registernummer": "HRB 30826",
      "registerart": "HRB",
      "company_name": "Vendato Handels UG (haftungsbeschränkt)",
      "company_seat": "Falkensee",
      "details": "26.11.2025 (Bekanntmachungsdatum)\n\nBrandenburg Amtsgericht Potsdam HRB 30826\nLöschungsankündigung\n\nVendato Handels UG (haftungsbeschränkt)\nGesellschaft mit beschränkter Haftung\nFalkensee\n\nBei der nachstehenden Gesellschaft wird das Amtslöschungsverfahren gemäß § 394 FamFG eingeleitet. Widerspruchsfrist: 8 Wochen."
    },
    {
      "date": "2025-11-26",
      "id": "138329",
      "original_text": "Registerbekanntmachung nach dem Umwandlungsgesetz\nBerlin Amtsgericht Berlin (Charlottenburg) HRB 268729\nVita Online Versandhandel UG (haftungsbeschränkt) – Berlin",
      "type": "Registerbekanntmachung nach dem Umwandlungsgesetz",
      "state": "Berlin",
      "amtsgericht": "Amtsgericht Berlin (Charlottenburg)",
      "registernummer": "HRB 268729",
      "registerart": "HRB",
      "company_name": "Vita Online Versandhandel UG (haftungsbeschränkt)",
      "company_seat": "Berlin",
      "details": "26.11.2025 (Bekanntmachungsdatum)\n\nBerlin Amtsgericht Berlin (Charlottenburg) HRB 268729\nRegisterbekanntmachung nach dem Umwandlungsgesetz 25.11.2025 (Eintragungsdatum)\n\nVita Online Versandhandel UG (haftungsbeschränkt)\nGesellschaft mit beschränkter Haftung\nBerlin\n\nZu Eintragungsnummer 3 vom 25.11.2025 wird als nicht eingetragen veröffentlicht: Den Gläubigern der an der Verschmelzung beteiligten Rechtsträger ist, wenn sie binnen sechs Monaten nach dem Tag, an dem die Eintragung der Verschmelzung in das Register des Sitzes desjenigen Rechtsträgers, dessen Gläubiger sie sind, als bekannt gemacht gilt, ihren Anspruch nach Grund und Höhe schriftlich anmelden, Sicherheit zu leisten, soweit sie nicht Befriedigung verlangen können. Dieses Recht steht den Gläubigern jedoch nur zu, wenn sie glaubhaft machen, dass durch die Verschmelzung die Erfüllung ihrer Forderung gefährdet wird. Das Recht, Sicherheitsleistung zu verlangen, steht Gläubigern nicht zu, die im Falle der Insolvenz ein Recht auf vorzugsweise Befriedigung aus einer Deckungsmasse haben, die nach gesetzlicher Vorschrift zu ihrem Schutz errichtet und staatlich überwacht ist."
    },
    {
      "date": "2025-11-26",
      "id": "138330",
      "original_text": "Registerbekanntmachung nach dem Umwandlungsgesetz\nThüringen Amtsgericht Sömmerda VR 150210\nTerritorialverband \"Thüringer Becken\" der Gartenfreunde e.V. – Sömmerda",
      "type": "Registerbekanntmachung nach dem Umwandlungsgesetz",
      "state": "Thüringen",
      "amtsgericht": "Amtsgericht Sömmerda",
      "registernummer": "VR 150210",
      "registerart": "VR",
      "company_name": "Territorialverband \"Thüringer Becken\" der Gartenfreunde e.V.",
      "company_seat": "Sömmerda",
      "details": "26.11.2025 (Bekanntmachungsdatum)\n\nThüringen Amtsgericht Sömmerda VR 150210\nRegisterbekanntmachung nach dem Umwandlungsgesetz 26.11.2025 (Eintragungsdatum)\n\nTerritorialverband \"Thüringer Becken\" der Gartenfreunde e.V.\neingetragener Verein\nSömmerda\n\nNicht eingetragen: Den Gläubigern der an der Verschmelzung beteiligten Rechtsträger, ist wenn sie binnen sechs Monaten nach dem Tag, an dem die Eintragung der Verschmelzung in das Register des Sitzes desjenigen Rechtsträgers, dessen Gläubiger sie sind,  nach § 19 Abs. 3 UmwG als bekanntgemacht gilt, ihren Anspruch nach Grund und Höhe schriftlich anmelden, Sicherheit zu leisten, soweit sie nicht Befriedigung verlangen können. Dieses Recht steht ihnen jedoch nur zu, wenn sie glaubhaft machen, daß durch die Verschmelzung die Erfüllung ihrer Forderung gefährdet wird."
    },
    {
      "date": "2025-11-26",
      "id": "138331",
      "original_text": "Löschungsankündigung\nThüringen Amtsgericht Jena HRB 514750\nRubels und Velde GmbH – Erfurt",
      "type": "Löschungsankündigung",
      "state": "Thüringen",
      "amtsgericht": "Amtsgericht Jena",
      "registernummer": "HRB 514750",
      "registerart": "HRB",
      "company_name": "Rubels und Velde GmbH",
      "company_seat": "Erfurt",
      "details": "26.11.2025 (Bekanntmachungsdatum)\n\nThüringen Amtsgericht Jena HRB 514750\nLöschungsankündigung\n\nRubels und Velde GmbH\nGesellschaft mit beschränkter Haftung\nErfurt\n\nDas Registergericht beabsichtigt, die im Handelsregister eingetragene Gesellschaft wegen Vermögenslosigkeit nach § 394 FamFG von Amts wegen zu löschen. Die Frist zur Erhebung eines Widerspruchs gegen die beabsichtigte Löschung wird auf 6 Wochen festgesetzt."
    },
    {
      "date": "2025-11-26",
      "id": "138332",
      "original_text": "Registerbekanntmachung nach dem Umwandlungsgesetz\nThüringen Amtsgericht Jena HRB 510510\nTZVZ Holding GmbH – Erfurt",
      "type": "Registerbekanntmachung nach dem Umwandlungsgesetz",
      "state": "Thüringen",
      "amtsgericht": "Amtsgericht Jena",
      "registernummer": "HRB 510510",
      "registerart": "HRB",
      "company_name": "TZVZ Holding GmbH",
      "company_seat": "Erfurt",
      "details": "26.11.2025 (Bekanntmachungsdatum)\n\nThüringen Amtsgericht Jena HRB 510510\nRegisterbekanntmachung nach dem Umwandlungsgesetz 26.11.2025 (Eintragungsdatum)\n\nTZVZ Holding GmbH\nGesellschaft mit beschränkter Haftung\nErfurt\n\nNicht eingetragen: Den Gläubigern der an der Ausgliederung beteiligten Rechtsträger, ist wenn sie binnen sechs Monaten nach dem Tag, an dem die Eintragung der Ausgliederung in das Register des Sitzes desjenigen Rechtsträgers, dessen Gläubiger sie sind, nach §§125, 19 Abs. 3 UmwG als bekanntgemacht gilt, ihren Anspruch nach Grund und Höhe schriftlich anmelden, Sicherheit zu leisten, soweit sie nicht Befriedigung verlangen können. Dieses Recht steht ihnen jedoch nur zu, wenn sie glaubhaft machen, daß durch die Ausgliederung die Erfüllung ihrer Forderung gefährdet wird."
    },
    {
      "date": "2025-11-26",
      "id": "138333",
      "original_text": "Löschungsankündigung\nThüringen Amtsgericht Jena HRB 508310\nK.O.B.S. Verwaltungs GmbH – Altenburg",
      "type": "Löschungsankündigung",
      "state": "Thüringen",
      "amtsgericht": "Amtsgericht Jena",
      "registernummer": "HRB 508310",
      "registerart": "HRB",
      "company_name": "K.O.B.S. Verwaltungs GmbH",
      "company_seat": "Altenburg",
      "details": "26.11.2025 (Bekanntmachungsdatum)\n\nThüringen Amtsgericht Jena HRB 508310\nLöschungsankündigung\n\nK.O.B.S. Verwaltungs GmbH\nGesellschaft mit beschränkter Haftung\nAltenburg\n\nDas Registergericht beabsichtigt, die im Handelsregister eingetragene Gesellschaft wegen Vermögenslosigkeit nach § 394 FamFG von Amts wegen zu löschen. Die Frist zur Erhebung eines Widerspruchs gegen die beabsichtigte Löschung wird auf 6 Wochen festgesetzt."
    },
    {
      "date": "2025-11-26",
      "id": "138334",
      "original_text": "Löschungsankündigung\nThüringen Amtsgericht Jena HRB 305124\nRücker Umweltservice GmbH – Suhl",
      "type": "Löschungsankündigung",
      "state": "Thüringen",
      "amtsgericht": "Amtsgericht Jena",
      "registernummer": "HRB 305124",
      "registerart": "HRB",
      "company_name": "Rücker Umweltservice GmbH",
      "company_seat": "Suhl",
      "details": "26.11.2025 (Bekanntmachungsdatum)\n\nThüringen Amtsgericht Jena HRB 305124\nLöschungsankündigung\n\nRücker Umweltservice GmbH\nGesellschaft mit beschränkter Haftung\nSuhl\n\nDas Registergericht beabsichtigt, die im Handelsregister eingetragene Gesellschaft wegen Vermögenslosigkeit nach § 394 FamFG von Amts wegen zu löschen. Die Frist zur Erhebung eines Widerspruchs gegen die beabsichtigte Löschung wird auf 6 Wochen festgesetzt."
    },
    {
      "date": "2025-11-26",
      "id": "138335",
      "original_text": "Löschungsankündigung\nThüringen Amtsgericht Jena HRB 513093\nConcept-Immobilien GmbH – Gößnitz",
      "type": "Löschungsankündigung",
      "state": "Thüringen",
      "amtsgericht": "Amtsgericht Jena",
      "registernummer": "HRB 513093",
      "registerart": "HRB",
      "company_name": "Concept-Immobilien GmbH",
      "company_seat": "Gößnitz",
      "details": "26.11.2025 (Bekanntmachungsdatum)\n\nThüringen Amtsgericht Jena HRB 513093\nLöschungsankündigung 26.11.2025 (Eintragungsdatum)\n\nConcept-Immobilien GmbH\nGesellschaft mit beschränkter Haftung\nGößnitz\n\nDas Verfahren zur Löschung von Amts wegen gem. § 394 FamFG vom 07.10.2025 wird aufgehoben."
    },
    {
      "date": "2025-11-26",
      "id": "138336",
      "original_text": "Löschungsankündigung\nThüringen Amtsgericht Jena HRA 502792\nK.O.B.S Projektentwicklungs GmbH & Co. KG – Altenburg",
      "type": "Löschungsankündigung",
      "state": "Thüringen",
      "amtsgericht": "Amtsgericht Jena",
      "registernummer": "HRA 502792",
      "registerart": "HRA",
      "company_name": "K.O.B.S Projektentwicklungs GmbH & Co. KG",
      "company_seat": "Altenburg",
      "details": "26.11.2025 (Bekanntmachungsdatum)\n\nThüringen Amtsgericht Jena HRA 502792\nLöschungsankündigung\n\nK.O.B.S Projektentwicklungs GmbH & Co. KG\nKommanditgesellschaft\nAltenburg\n\nDas Registergericht beabsichtigt, die im Handelsregister eingetragene Gesellschaft wegen Vermögenslosigkeit nach § 394 FamFG von Amts wegen zu löschen. Die Frist zur Erhebung eines Widerspruchs gegen die beabsichtigte Löschung wird auf 6 Wochen festgesetzt."
    },
    {
      "date": "2025-11-26",
      "id": "138337",
      "original_text": "Registerbekanntmachung nach dem Umwandlungsgesetz\nThüringen Amtsgericht Sömmerda VR 150898\nRegionales-Kleingärtner-Management-Sömmerda e.V. – Sömmerda",
      "type": "Registerbekanntmachung nach dem Umwandlungsgesetz",
      "state": "Thüringen",
      "amtsgericht": "Amtsgericht Sömmerda",
      "registernummer": "VR 150898",
      "registerart": "VR",
      "company_name": "Regionales-Kleingärtner-Management-Sömmerda e.V.",
      "company_seat": "Sömmerda",
      "details": "26.11.2025 (Bekanntmachungsdatum)\n\nThüringen Amtsgericht Sömmerda VR 150898\nRegisterbekanntmachung nach dem Umwandlungsgesetz 26.11.2025 (Eintragungsdatum)\n\nRegionales-Kleingärtner-Management-Sömmerda e.V.\neingetragener Verein\nSömmerda\n\nNicht eingetragen: Den Gläubigern der an der Verschmelzung beteiligten Rechtsträger, ist wenn sie binnen sechs Monaten nach dem Tag, an dem die Eintragung der Verschmelzung in das Register des Sitzes desjenigen Rechtsträgers, dessen Gläubiger sie sind,  nach § 19 Abs. 3 UmwG als bekanntgemacht gilt, ihren Anspruch nach Grund und Höhe schriftlich anmelden, Sicherheit zu leisten, soweit sie nicht Befriedigung verlangen können. Dieses Recht steht ihnen jedoch nur zu, wenn sie glaubhaft machen, daß durch die Verschmelzung die Erfüllung ihrer Forderung gefährdet wird."
    },
    {
      "date": "2025-11-26",
      "id": "138338",
      "original_text": "Löschungsankündigung\nBrandenburg Amtsgericht Frankfurt/Oder HRB 651\nBaer und Co Bau GmbH – Zepernick",
      "type": "Löschungsankündigung",
      "state": "Brandenburg",
      "amtsgericht": "Amtsgericht Frankfurt/Oder",
      "registernummer": "HRB 651",
      "registerart": "HRB",
      "company_name": "Baer und Co Bau GmbH",
      "company_seat": "Zepernick",
      "details": "26.11.2025 (Bekanntmachungsdatum)\n\nBrandenburg Amtsgericht Frankfurt/Oder HRB 651\nLöschungsankündigung\n\nBaer und Co Bau GmbH\nGesellschaft mit beschränkter Haftung\nZepernick\n\nBei der nachstehenden Gesellschaft wird das Amtslöschungsverfahren gemäß § 394 FamFG eingeleitet."
    },
    {
      "date": "2025-11-26",
      "id": "138339",
      "original_text": "Registerbekanntmachung nach dem Umwandlungsgesetz\nBerlin Amtsgericht Berlin (Charlottenburg) HRA 64968\nRHO Berlin GmbH & Co. KG – Berlin",
      "type": "Registerbekanntmachung nach dem Umwandlungsgesetz",
      "state": "Berlin",
      "amtsgericht": "Amtsgericht Berlin (Charlottenburg)",
      "registernummer": "HRA 64968",
      "registerart": "HRA",
      "company_name": "RHO Berlin GmbH & Co. KG",
      "company_seat": "Berlin",
      "details": "26.11.2025 (Bekanntmachungsdatum)\n\nBerlin Amtsgericht Berlin (Charlottenburg) HRA 64968\nRegisterbekanntmachung nach dem Umwandlungsgesetz 25.11.2025 (Eintragungsdatum)\n\nRHO Berlin GmbH & Co. KG\nKommanditgesellschaft\nBerlin\n\nZu Eintragungsnummer 1 vom 25.11.2025 wird als nicht eingetragen veröffentlicht: Den Gläubigern ist, wenn sie binnen sechs Monaten nach dem Tag, an dem die Eintragung der Umwandlung als bekannt gemacht gilt, ihren Anspruch nach Grund und Höhe schriftlich anmelden, Sicherheit zu leisten, soweit sie nicht Befriedigung verlangen können. Dieses Recht steht den Gläubigern jedoch nur zu, wenn sie glaubhaft machen, dass durch die Umwandlung die Erfüllung ihrer Forderung gefährdet wird. Das Recht, Sicherheitsleistung zu verlangen, steht Gläubigern nicht zu, die im Falle der Insolvenz ein Recht auf vorzugsweise Befriedigung aus einer Deckungsmasse haben, die nach gesetzlicher Vorschrift zu ihrem Schutz errichtet und staatlich überwacht ist."
    },
    {
      "date": "2025-11-26",
      "id": "138340",
      "original_text": "Löschungsankündigung\nBerlin Amtsgericht Berlin (Charlottenburg) HRB 219062\nGÜNDABKA GmbH – Berlin",
      "type": "Löschungsankündigung",
      "state": "Berlin",
      "amtsgericht": "Amtsgericht Berlin (Charlottenburg)",
      "registernummer": "HRB 219062",
      "registerart": "HRB",
      "company_name": "GÜNDABKA GmbH",
      "company_seat": "Berlin",
      "details": "26.11.2025 (Bekanntmachungsdatum)\n\nBerlin Amtsgericht Berlin (Charlottenburg) HRB 219062\nLöschungsankündigung\n\nGÜNDABKA GmbH\nGesellschaft mit beschränkter Haftung\nBerlin\n\nBei der nachstehenden Gesellschaft wird das Amtslöschungsverfahren gemäß § 394 FamFG eingeleitet. Widerspruchsfrist 6 Wochen"
    },
    {
      "date": "2025-11-26",
      "id": "138341",
      "original_text": "Löschungsankündigung\nBerlin Amtsgericht Berlin (Charlottenburg) HRB 260063\nHeckenkönig UG (haftungsbeschränkt) – Berlin",
      "type": "Löschungsankündigung",
      "state": "Berlin",
      "amtsgericht": "Amtsgericht Berlin (Charlottenburg)",
      "registernummer": "HRB 260063",
      "registerart": "HRB",
      "company_name": "Heckenkönig UG (haftungsbeschränkt)",
      "company_seat": "Berlin",
      "details": "26.11.2025 (Bekanntmachungsdatum)\n\nBerlin Amtsgericht Berlin (Charlottenburg) HRB 260063\nLöschungsankündigung\n\nHeckenkönig UG (haftungsbeschränkt)\nGesellschaft mit beschränkter Haftung\nBerlin\n\nBei der nachstehenden Gesellschaft wird das Amtslöschungsverfahren gemäß § 394 FamFG eingeleitet. Widerspruchsfrist 6 Wochen"
    },
    {
      "date": "2025-11-26",
      "id": "138342",
      "original_text": "Löschungsankündigung\nBrandenburg Amtsgericht Frankfurt/Oder HRB 20212\nMWH Import UG (haftungsbeschränkt) – Neuenhagen bei Berlin",
      "type": "Löschungsankündigung",
      "state": "Brandenburg",
      "amtsgericht": "Amtsgericht Frankfurt/Oder",
      "registernummer": "HRB 20212",
      "registerart": "HRB",
      "company_name": "MWH Import UG (haftungsbeschränkt)",
      "company_seat": "Neuenhagen bei Berlin",
      "details": "26.11.2025 (Bekanntmachungsdatum)\n\nBrandenburg Amtsgericht Frankfurt/Oder HRB 20212\nLöschungsankündigung\n\nMWH Import UG (haftungsbeschränkt)\nGesellschaft mit beschränkter Haftung\nNeuenhagen bei Berlin\n\nBei der nachstehenden Gesellschaft wird das Amtslöschungsverfahren gemäß § 394 FamFG eingeleitet."
    },
    {
      "date": "2025-11-26",
      "id": "138343",
      "original_text": "Einreichung neuer Dokumente\nBaden-Württemberg Amtsgericht Stuttgart HRB 773078\nProBasket Tübingen AG – Tübingen",
      "type": "Einreichung neuer Dokumente",
      "state": "Baden-Württemberg",
      "amtsgericht": "Amtsgericht Stuttgart",
      "registernummer": "HRB 773078",
      "registerart": "HRB",
      "company_name": "ProBasket Tübingen AG",
      "company_seat": "Tübingen",
      "details": "26.11.2025 (Bekanntmachungsdatum)\n\nBaden-Württemberg Amtsgericht Stuttgart HRB 773078\nEinreichung neuer Dokumente\n\nProBasket Tübingen AG\nAktiengesellschaft\nTübingen\n\nDie Gesellschaft hat am 25.11.2025 die Liste über die Zusammensetzung des Aufsichtsrats zum Handelsregister eingereicht."
    },
    {
      "date": "2025-11-26",
      "id": "138344",
      "original_text": "Registerbekanntmachung nach dem Umwandlungsgesetz\nBaden-Württemberg Amtsgericht Stuttgart HRB 801978\nDr. Stefan Hövel Vermögensverwaltung GmbH – Stuttgart",
      "type": "Registerbekanntmachung nach dem Umwandlungsgesetz",
      "state": "Baden-Württemberg",
      "amtsgericht": "Amtsgericht Stuttgart",
      "registernummer": "HRB 801978",
      "registerart": "HRB",
      "company_name": "Dr. Stefan Hövel Vermögensverwaltung GmbH",
      "company_seat": "Stuttgart",
      "details": "26.11.2025 (Bekanntmachungsdatum)\n\nBaden-Württemberg Amtsgericht Stuttgart HRB 801978\nRegisterbekanntmachung nach dem Umwandlungsgesetz 26.11.2025 (Eintragungsdatum)\n\nDr. Stefan Hövel Vermögensverwaltung GmbH\nGesellschaft mit beschränkter Haftung\nStuttgart\n\nAls nicht eingetragen wird bekanntgemacht:\nDen Gläubigern der an der Abspaltung beteiligten Rechtsträger ist, wenn sie binnen sechs Monaten nach dem Tag, an dem die Eintragung der Abspaltung in das Register des Sitzes desjenigen Rechtsträgers, dessen Gläubiger sie sind, nach § 19 Abs. 3 UmwG als bekanntgemacht gilt, ihren Anspruch nach Grund und Höhe schriftlich anmelden, Sicherheit zu leisten, soweit sie nicht Befriedigung verlangen können. Dieses Recht steht den Gläubigern jedoch nur zu, wenn sie glaubhaft machen, dass durch die Abspaltung die Erfüllung ihrer Forderung gefährdet wird."
    },
    {
      "date": "2025-11-26",
      "id": "138345",
      "original_text": "Löschungsankündigung\nBerlin Amtsgericht Berlin (Charlottenburg) HRB 231901\nCity eats GmbH – Berlin",
      "type": "Löschungsankündigung",
      "state": "Berlin",
      "amtsgericht": "Amtsgericht Berlin (Charlottenburg)",
      "registernummer": "HRB 231901",
      "registerart": "HRB",
      "company_name": "City eats GmbH",
      "company_seat": "Berlin",
      "details": "26.11.2025 (Bekanntmachungsdatum)\n\nBerlin Amtsgericht Berlin (Charlottenburg) HRB 231901\nLöschungsankündigung\n\nCity eats GmbH\nGesellschaft mit beschränkter Haftung\nBerlin\n\nBei der nachstehenden Gesellschaft wird das Amtslöschungsverfahren gemäß § 394 FamFG eingeleitet. Widerspruchsfrist 6 Wochen"
    },
    {
      "date": "2025-11-26",
      "id": "138346",
      "original_text": "Löschungsankündigung\nBaden-Württemberg Amtsgericht Stuttgart HRB 791564\nCIM Nordic Bau Infrastruktur UG (haftungsbeschränkt) – Stuttgart",
      "type": "Löschungsankündigung",
      "state": "Baden-Württemberg",
      "amtsgericht": "Amtsgericht Stuttgart",
      "registernummer": "HRB 791564",
      "registerart": "HRB",
      "company_name": "CIM Nordic Bau Infrastruktur UG (haftungsbeschränkt)",
      "company_seat": "Stuttgart",
      "details": "26.11.2025 (Bekanntmachungsdatum)\n\nBaden-Württemberg Amtsgericht Stuttgart HRB 791564\nLöschungsankündigung\n\nCIM Nordic Bau Infrastruktur UG (haftungsbeschränkt)\nGesellschaft mit beschränkter Haftung\nStuttgart\n\nDas Gericht beabsichtigt, die Gesellschaft wegen Vermögenslosigkeit im Handelsregister von Amts wegen nach § 394 FamFG zu löschen. Die Frist zur Geltendmachung eines Widerspruchs gegen die beabsichtigte Löschung ist auf zwei Monate ab Veröffentlichung bestimmt."
    },
    {
      "date": "2025-11-26",
      "id": "138347",
      "original_text": "Löschungsankündigung\nSchleswig-Holstein Amtsgericht Flensburg HRB 13170\nMindstormers International UG (haftungsbeschränkt) – Flensburg",
      "type": "Löschungsankündigung",
      "state": "Schleswig-Holstein",
      "amtsgericht": "Amtsgericht Flensburg",
      "registernummer": "HRB 13170",
      "registerart": "HRB",
      "company_name": "Mindstormers International UG (haftungsbeschränkt)",
      "company_seat": "Flensburg",
      "details": "26.11.2025 (Bekanntmachungsdatum)\n\nSchleswig-Holstein Amtsgericht Flensburg HRB 13170\nLöschungsankündigung\n\nMindstormers International UG (haftungsbeschränkt)\nGesellschaft mit beschränkter Haftung\nFlensburg\n\nEs ist die Löschung der nachstehenden Gesellschaft wegen Vermögenslosigkeit gemäß § 394 FamFG beabsichtigt.\nWiderspruchsfrist: 2 Monate."
    },
    {
      "date": "2025-11-26",
      "id": "138348",
      "original_text": "Registerbekanntmachung nach dem Umwandlungsgesetz\nHamburg Amtsgericht Hamburg HRB 139449\nHolcim (Deutschland) GmbH – Hamburg",
      "type": "Registerbekanntmachung nach dem Umwandlungsgesetz",
      "state": "Hamburg",
      "amtsgericht": "Amtsgericht Hamburg",
      "registernummer": "HRB 139449",
      "registerart": "HRB",
      "company_name": "Holcim (Deutschland) GmbH",
      "company_seat": "Hamburg",
      "details": "26.11.2025 (Bekanntmachungsdatum)\n\nHamburg Amtsgericht Hamburg HRB 139449\nRegisterbekanntmachung nach dem Umwandlungsgesetz 26.11.2025 (Eintragungsdatum)\n\nHolcim (Deutschland) GmbH\nGesellschaft mit beschränkter Haftung\nHamburg\n\nAls nicht eingetragen wird bekannt gemacht:\nDen Gläubigern der an der Verschmelzung beteiligten Gesellschaften ist, wenn sie binnen sechs Monaten nach dem Tag, an dem die Eintragung der Verschmelzung in das Register des Sitzes desjenigen Rechtsträgers, dessen Gläubiger sie sind, nach § 19 Absatz 3 UmwG als bekannt gemacht gilt, ihren Anspruch nach Grund und Höhe schriftlich anmelden, Sicherheit zu leisten, soweit sie nicht Befriedigung verlangen können. Dieses Recht steht den Gläubigern jedoch nur zu, wenn sie glaubhaft machen, dass durch die Verschmelzung die Erfüllung ihrer Forderung gefährdet wird."
    },
    {
      "date": "2025-11-26",
      "id": "138349",
      "original_text": "Löschungsankündigung\nBerlin Amtsgericht Berlin (Charlottenburg) HRB 168714\nSektor7 UG (haftungsbeschränkt) – Berlin",
      "type": "Löschungsankündigung",
      "state": "Berlin",
      "amtsgericht": "Amtsgericht Berlin (Charlottenburg)",
      "registernummer": "HRB 168714",
      "registerart": "HRB",
      "company_name": "Sektor7 UG (haftungsbeschränkt)",
      "company_seat": "Berlin",
      "details": "26.11.2025 (Bekanntmachungsdatum)\n\nBerlin Amtsgericht Berlin (Charlottenburg) HRB 168714\nLöschungsankündigung\n\nSektor7 UG (haftungsbeschränkt)\nGesellschaft mit beschränkter Haftung\nBerlin\n\nBei der nachstehenden Gesellschaft wird das Amtslöschungsverfahren gemäß § 394 FamFG eingeleitet. Widerspruchsfrist 6 Wochen"
    },
    {
      "date": "2025-11-26",
      "id": "138350",
      "original_text": "Löschungsankündigung\nBaden-Württemberg Amtsgericht Ulm HRB 736938\nG&J Gebäudeservice UG (haftungsbeschränkt) – Kuchen",
      "type": "Löschungsankündigung",
      "state": "Baden-Württemberg",
      "amtsgericht": "Amtsgericht Ulm",
      "registernummer": "HRB 736938",
      "registerart": "HRB",
      "company_name": "G&J Gebäudeservice UG (haftungsbeschränkt)",
      "company_seat": "Kuchen",
      "details": "26.11.2025 (Bekanntmachungsdatum)\n\nBaden-Württemberg Amtsgericht Ulm HRB 736938\nLöschungsankündigung\n\nG&J Gebäudeservice UG (haftungsbeschränkt)\nGesellschaft mit beschränkter Haftung\nKuchen\n\nDas Gericht beabsichtigt, die Gesellschaft wegen Vermögenslosigkeit im Handelsregister von Amts wegen nach § 394 FamFG zu löschen. Die Frist zur Geltendmachung eines Widerspruchs gegen die beabsichtigte Löschung ist auf  einen Monat ab Veröffentlichung bestimmt."
    },
    {
      "date": "2025-11-26",
      "id": "138351",
      "original_text": "Löschungsankündigung\nBerlin Amtsgericht Berlin (Charlottenburg) HRB 174172\nHimmel Gebäudereinigung GmbH – Berlin",
      "type": "Löschungsankündigung",
      "state": "Berlin",
      "amtsgericht": "Amtsgericht Berlin (Charlottenburg)",
      "registernummer": "HRB 174172",
      "registerart": "HRB",
      "company_name": "Himmel Gebäudereinigung GmbH",
      "company_seat": "Berlin",
      "details": "26.11.2025 (Bekanntmachungsdatum)\n\nBerlin Amtsgericht Berlin (Charlottenburg) HRB 174172\nLöschungsankündigung\n\nHimmel Gebäudereinigung GmbH\nGesellschaft mit beschränkter Haftung\nBerlin\n\nBei der nachstehenden Gesellschaft wird das Amtslöschungsverfahren gemäß § 394 FamFG eingeleitet. Widerspruchsfrist 6 Wochen"
    },
    {
      "date": "2025-11-26",
      "id": "138352",
      "original_text": "Löschungsankündigung\nSachsen Amtsgericht Leipzig HRA 1293\nGebr. Schrader – Leipzig",
      "type": "Löschungsankündigung",
      "state": "Sachsen",
      "amtsgericht": "Amtsgericht Leipzig",
      "registernummer": "HRA 1293",
      "registerart": "HRA",
      "company_name": "Gebr. Schrader",
      "company_seat": "Leipzig",
      "details": "26.11.2025 (Bekanntmachungsdatum)\n\nSachsen Amtsgericht Leipzig HRA 1293\nLöschungsankündigung\n\nGebr. Schrader\nKommanditgesellschaft\nLeipzig\n\nDas Registergericht beabsichtigt, die im Handelsregister eingetragene Firma von Amts wegen nach § 31 Abs. 2 HGB, 393 FamFG zu löschen. Die Frist zur Erhebung eines Widerspruchs gegen die beabsichtigte Löschung wird auf einen Monat festgesetzt."
    },
    {
      "date": "2025-11-26",
      "id": "138353",
      "original_text": "Sonstige Registerbekanntmachung\nSachsen Amtsgericht Leipzig HRB 10251\nSachsen Medien GmbH – Leipzig",
      "type": "Sonstige Registerbekanntmachung",
      "state": "Sachsen",
      "amtsgericht": "Amtsgericht Leipzig",
      "registernummer": "HRB 10251",
      "registerart": "HRB",
      "company_name": "Sachsen Medien GmbH",
      "company_seat": "Leipzig",
      "details": "26.11.2025 (Bekanntmachungsdatum)\n\nSachsen Amtsgericht Leipzig HRB 10251\nSonstige Registerbekanntmachung 26.11.2025 (Eintragungsdatum)\n\nSachsen Medien GmbH\nGesellschaft mit beschränkter Haftung\nLeipzig\n\nDen Gläubigern der Gesellschaft, deren Forderungen begründet worden sind bevor die Eintragung der Beendigung des Beherrschungs- und Gewinnabführungsvertrages in das Handelsregister nach § 10 des Handelsgesetzbuches als bekanntgemacht gilt, hat der andere Vertragsteil Sicherheit zu leisten, wenn sie sich binnen sechs Monaten nach der Bekanntmachung der Eintragung zu diesem Zweck bei ihm melden."
    },
    {
      "date": "2025-11-26",
      "id": "138354",
      "original_text": "Löschungsankündigung\nSachsen Amtsgericht Chemnitz HRB 8231\nCFC Marketing und Stadionbetrieb GmbH – Chemnitz",
      "type": "Löschungsankündigung",
      "state": "Sachsen",
      "amtsgericht": "Amtsgericht Chemnitz",
      "registernummer": "HRB 8231",
      "registerart": "HRB",
      "company_name": "CFC Marketing und Stadionbetrieb GmbH",
      "company_seat": "Chemnitz",
      "details": "26.11.2025 (Bekanntmachungsdatum)\n\nSachsen Amtsgericht Chemnitz HRB 8231\nLöschungsankündigung 26.11.2025 (Eintragungsdatum)\n\nCFC Marketing und Stadionbetrieb GmbH\nGesellschaft mit beschränkter Haftung\nChemnitz\n\nDas Registergericht beabsichtigt, die im Handelsregister eingetragene Gesellschaft von Amts wegen nach § 394 FamFG zu löschen. Die Frist zu Erhebung eines Widerspruchs gegen die beabsichtigte Löschung wird auf einen Monat festgesetzt."
    },
    {
      "date": "2025-11-26",
      "id": "138355",
      "original_text": "Löschungsankündigung\nNiedersachsen Amtsgericht Osnabrück HRB 213789\nJN MONT UG (haftungsbeschränkt) – Belm",
      "type": "Löschungsankündigung",
      "state": "Niedersachsen",
      "amtsgericht": "Amtsgericht Osnabrück",
      "registernummer": "HRB 213789",
      "registerart": "HRB",
      "company_name": "JN MONT UG (haftungsbeschränkt)",
      "company_seat": "Belm",
      "details": "26.11.2025 (Bekanntmachungsdatum)\n\nNiedersachsen Amtsgericht Osnabrück HRB 213789\nLöschungsankündigung\n\nJN MONT UG (haftungsbeschränkt)\nGesellschaft mit beschränkter Haftung\nBelm\n\nDas Registergericht beabsichtigt, die Gesellschaft von Amts wegen nach § 394 FamFG wegen Vermögenslosigkeit zu löschen. Die Frist zur Erhebung eines Widerspruchs ist auf 1 Monat ab dieser Registerbekanntmachung festgesetzt."
    },
    {
      "date": "2025-11-26",
      "id": "138356",
      "original_text": "Registerbekanntmachung nach dem Umwandlungsgesetz\nNiedersachsen Amtsgericht Lüneburg HRB 210632\nSimon Tischlerei & Sportgerätewartung GmbH – Drage",
      "type": "Registerbekanntmachung nach dem Umwandlungsgesetz",
      "state": "Niedersachsen",
      "amtsgericht": "Amtsgericht Lüneburg",
      "registernummer": "HRB 210632",
      "registerart": "HRB",
      "company_name": "Simon Tischlerei & Sportgerätewartung GmbH",
      "company_seat": "Drage",
      "details": "26.11.2025 (Bekanntmachungsdatum)\n\nNiedersachsen Amtsgericht Lüneburg HRB 210632\nRegisterbekanntmachung nach dem Umwandlungsgesetz 19.11.2025 (Eintragungsdatum)\n\nSimon Tischlerei & Sportgerätewartung GmbH\nGesellschaft mit beschränkter Haftung\nDrage\n\nDen Gläubigern der an der Ausgliederung beteiligten Rechtsträger ist, wenn sie binnen sechs Monaten nach dem Tag, an dem die Eintragung der Ausgliederung in das Register des Sitzes desjenigen Rechtsträgers, dessen Gläubiger sie sind, nach § 19 Abs. 3 UmwG als bekannt gemacht gilt, ihren Anspruch nach Grund und Höhe schriftlich anmelden, Sicherheit zu leisten, soweit sie nicht Befriedigung verlangen können. Dieses Recht steht den Gläubigern jedoch nur zu, wenn sie glaubhaft machen, dass durch die Ausgliederung die Erfüllung der Forderung gefährdet wird."
    },
    {
      "date": "2025-11-26",
      "id": "138357",
      "original_text": "Registerbekanntmachung nach dem Umwandlungsgesetz\nNiedersachsen Amtsgericht Walsrode HRB 204006\nKlatte Tiefbau GmbH – Rotenburg",
      "type": "Registerbekanntmachung nach dem Umwandlungsgesetz",
      "state": "Niedersachsen",
      "amtsgericht": "Amtsgericht Walsrode",
      "registernummer": "HRB 204006",
      "registerart": "HRB",
      "company_name": "Klatte Tiefbau GmbH",
      "company_seat": "Rotenburg",
      "details": "26.11.2025 (Bekanntmachungsdatum)\n\nNiedersachsen Amtsgericht Walsrode HRB 204006\nRegisterbekanntmachung nach dem Umwandlungsgesetz 26.11.2025 (Eintragungsdatum)\n\nKlatte Tiefbau GmbH\nGesellschaft mit beschränkter Haftung\nRotenburg\n\nDen Gläubigern der an der Verschmelzung beteiligten Rechtsträger ist, wenn sie binnen sechs Monaten nach dem Tag, an dem die Eintragung der Verschmelzung in das Register des Sitzes desjenigen Rechtsträgers, dessen Gläubiger sie sind, nach § 19  Abs.  3 UmwG als bekannt gemacht gilt, ihren Anspruch nach Grund und Höhe schriftlich anmelden, Sicherheit zu leisten, soweit sie nicht Befriedigung verlangen können. Dieses Recht steht den Gläubigern jedoch nur zu, wenn sie glaubhaft machen, dass durch die Verschmelzung die Erfüllung der Forderung gefährdet wird."
    },
    {
      "date": "2025-11-26",
      "id": "138358",
      "original_text": "Einreichung neuer Dokumente\nNiedersachsen Amtsgericht Osnabrück HRB 220137\nHeemann Vermögensverwaltung AG – Nordhorn",
      "type": "Einreichung neuer Dokumente",
      "state": "Niedersachsen",
      "amtsgericht": "Amtsgericht Osnabrück",
      "registernummer": "HRB 220137",
      "registerart": "HRB",
      "company_name": "Heemann Vermögensverwaltung AG",
      "company_seat": "Nordhorn",
      "details": "26.11.2025 (Bekanntmachungsdatum)\n\nNiedersachsen Amtsgericht Osnabrück HRB 220137\nEinreichung neuer Dokumente\n\nHeemann Vermögensverwaltung AG\nAktiengesellschaft\nNordhorn\n\nDie Liste der Mitglieder des Aufsichtsrats wurde beim Registergericht eingereicht."
    },
    {
      "date": "2025-11-26",
      "id": "138359",
      "original_text": "Registerbekanntmachung nach dem Umwandlungsgesetz\nNiedersachsen Amtsgericht Braunschweig HRB 206424\nAmilla Marketing GmbH – Braunschweig",
      "type": "Registerbekanntmachung nach dem Umwandlungsgesetz",
      "state": "Niedersachsen",
      "amtsgericht": "Amtsgericht Braunschweig",
      "registernummer": "HRB 206424",
      "registerart": "HRB",
      "company_name": "Amilla Marketing GmbH",
      "company_seat": "Braunschweig",
      "details": "26.11.2025 (Bekanntmachungsdatum)\n\nNiedersachsen Amtsgericht Braunschweig HRB 206424\nRegisterbekanntmachung nach dem Umwandlungsgesetz 26.11.2025 (Eintragungsdatum)\n\nAmilla Marketing GmbH\nGesellschaft mit beschränkter Haftung\nBraunschweig\n\nDen Gläubigern der an der Verschmelzung beteiligten Rechtsträger ist, wenn sie binnen sechs Monaten nach dem Tag, an dem die Eintragung der Verschmelzung in das Register des Sitzes desjenigen Rechtsträgers, dessen Gläubiger sie sind, nach § 19  Abs.  3 UmwG als bekannt gemacht gilt, ihren Anspruch nach Grund und Höhe schriftlich anmelden, Sicherheit zu leisten, soweit sie nicht Befriedigung verlangen können. Dieses Recht steht den Gläubigern jedoch nur zu, wenn sie glaubhaft machen, dass durch die Verschmelzung die Erfüllung der Forderung gefährdet wird."
    },
    {
      "date": "2025-11-26",
      "id": "138360",
      "original_text": "Registerbekanntmachung nach dem Umwandlungsgesetz\nBremen Amtsgericht Bremen HRB 22644\nHÄNJES Verlagsdienstleistungen GmbH – Bremen",
      "type": "Registerbekanntmachung nach dem Umwandlungsgesetz",
      "state": "Bremen",
      "amtsgericht": "Amtsgericht Bremen",
      "registernummer": "HRB 22644",
      "registerart": "HRB",
      "company_name": "HÄNJES Verlagsdienstleistungen GmbH",
      "company_seat": "Bremen",
      "details": "26.11.2025 (Bekanntmachungsdatum)\n\nBremen Amtsgericht Bremen HRB 22644\nRegisterbekanntmachung nach dem Umwandlungsgesetz 24.11.2025 (Eintragungsdatum)\n\nHÄNJES Verlagsdienstleistungen GmbH\nGesellschaft mit beschränkter Haftung\nBremen\n\nZu Eintragungsnummer 7 vom 24.11.2025 wird als nicht eingetragen veröffentlicht: Den Gläubigern der an der Spaltung beteiligten Rechtsträger ist, wenn sie binnen sechs Monaten nach dem Tag, an dem die Eintragung der Spaltung in das Register des Sitzes desjenigen Rechtsträgers, dessen Gläubiger sie sind, als bekannt gemacht gilt, ihren Anspruch nach Grund und Höhe schriftlich anmelden, Sicherheit zu leisten, soweit sie nicht Befriedigung verlangen können. Dieses Recht steht den Gläubigern jedoch nur zu, wenn sie glaubhaft machen, dass durch die Spaltung die Erfüllung ihrer Forderung gefährdet wird. Das Recht, Sicherheitsleistung zu verlangen, steht Gläubigern nicht zu, die im Falle der Insolvenz ein Recht auf vorzugsweise Befriedigung aus einer Deckungsmasse haben, die nach gesetzlicher Vorschrift zu ihrem Schutz errichtet und staatlich überwacht ist."
    },
    {
      "date": "2025-11-26",
      "id": "138361",
      "original_text": "Registerbekanntmachung nach dem Umwandlungsgesetz\nBremen Amtsgericht Bremen HRB 37668\nHÄNJES digital GmbH – Bremen",
      "type": "Registerbekanntmachung nach dem Umwandlungsgesetz",
      "state": "Bremen",
      "amtsgericht": "Amtsgericht Bremen",
      "registernummer": "HRB 37668",
      "registerart": "HRB",
      "company_name": "HÄNJES digital GmbH",
      "company_seat": "Bremen",
      "details": "26.11.2025 (Bekanntmachungsdatum)\n\nBremen Amtsgericht Bremen HRB 37668\nRegisterbekanntmachung nach dem Umwandlungsgesetz 24.11.2025 (Eintragungsdatum)\n\nHÄNJES digital GmbH\nGesellschaft mit beschränkter Haftung\nBremen\n\nZu Eintragungsnummer 4 vom 24.11.2025 wird als nicht eingetragen veröffentlicht: Den Gläubigern der an der Spaltung beteiligten Rechtsträger ist, wenn sie binnen sechs Monaten nach dem Tag, an dem die Eintragung der Spaltung in das Register des Sitzes desjenigen Rechtsträgers, dessen Gläubiger sie sind, als bekannt gemacht gilt, ihren Anspruch nach Grund und Höhe schriftlich anmelden, Sicherheit zu leisten, soweit sie nicht Befriedigung verlangen können. Dieses Recht steht den Gläubigern jedoch nur zu, wenn sie glaubhaft machen, dass durch die Spaltung die Erfüllung ihrer Forderung gefährdet wird. Das Recht, Sicherheitsleistung zu verlangen, steht Gläubigern nicht zu, die im Falle der Insolvenz ein Recht auf vorzugsweise Befriedigung aus einer Deckungsmasse haben, die nach gesetzlicher Vorschrift zu ihrem Schutz errichtet und staatlich überwacht ist."
    },
    {
      "date": "2025-11-26",
      "id": "138362",
      "original_text": "Registerbekanntmachung nach dem Umwandlungsgesetz\nBremen Amtsgericht Bremen HRB 5633\nTERRATRANS Internationale Spedition GmbH – Bremen",
      "type": "Registerbekanntmachung nach dem Umwandlungsgesetz",
      "state": "Bremen",
      "amtsgericht": "Amtsgericht Bremen",
      "registernummer": "HRB 5633",
      "registerart": "HRB",
      "company_name": "TERRATRANS Internationale Spedition GmbH",
      "company_seat": "Bremen",
      "details": "26.11.2025 (Bekanntmachungsdatum)\n\nBremen Amtsgericht Bremen HRB 5633\nRegisterbekanntmachung nach dem Umwandlungsgesetz 24.11.2025 (Eintragungsdatum)\n\nTERRATRANS Internationale Spedition GmbH\nGesellschaft mit beschränkter Haftung\nBremen\n\nZu Eintragungsnummer 9 vom 24.11.2025 wird als nicht eingetragen veröffentlicht: Den Gläubigern der an der Verschmelzung beteiligten Rechtsträger ist, wenn sie binnen sechs Monaten nach dem Tag, an dem die Eintragung der Verschmelzung in das Register des Sitzes desjenigen Rechtsträgers, dessen Gläubiger sie sind, als bekannt gemacht gilt, ihren Anspruch nach Grund und Höhe schriftlich anmelden, Sicherheit zu leisten, soweit sie nicht Befriedigung verlangen können. Dieses Recht steht den Gläubigern jedoch nur zu, wenn sie glaubhaft machen, dass durch die Verschmelzung die Erfüllung ihrer Forderung gefährdet wird. Das Recht, Sicherheitsleistung zu verlangen, steht Gläubigern nicht zu, die im Falle der Insolvenz ein Recht auf vorzugsweise Befriedigung aus einer Deckungsmasse haben, die nach gesetzlicher Vorschrift zu ihrem Schutz errichtet und staatlich überwacht ist."
    },
    {
      "date": "2025-11-26",
      "id": "138363",
      "original_text": "Einreichung neuer Dokumente\nRheinland-Pfalz Amtsgericht Zweibrücken HRB 23025\nWirtschaftsförderungsgesellschaft Südwestpfalz mbH – Pirmasens",
      "type": "Einreichung neuer Dokumente",
      "state": "Rheinland-Pfalz",
      "amtsgericht": "Amtsgericht Zweibrücken",
      "registernummer": "HRB 23025",
      "registerart": "HRB",
      "company_name": "Wirtschaftsförderungsgesellschaft Südwestpfalz mbH",
      "company_seat": "Pirmasens",
      "details": "26.11.2025 (Bekanntmachungsdatum)\n\nRheinland-Pfalz Amtsgericht Zweibrücken HRB 23025\nEinreichung neuer Dokumente\n\nWirtschaftsförderungsgesellschaft Südwestpfalz mbH\nGesellschaft mit beschränkter Haftung\nPirmasens\n\nDem Registergericht ist eine Liste der Mitglieder des Aufsichtsrates eingereicht worden."
    },
    {
      "date": "2025-11-26",
      "id": "138364",
      "original_text": "Registerbekanntmachung nach dem Umwandlungsgesetz\nRheinland-Pfalz Amtsgericht Koblenz HRB 31503\nBildungscampus am Katholischen Klinikum Koblenz gGmbH – Koblenz",
      "type": "Registerbekanntmachung nach dem Umwandlungsgesetz",
      "state": "Rheinland-Pfalz",
      "amtsgericht": "Amtsgericht Koblenz",
      "registernummer": "HRB 31503",
      "registerart": "HRB",
      "company_name": "Bildungscampus am Katholischen Klinikum Koblenz gGmbH",
      "company_seat": "Koblenz",
      "details": "26.11.2025 (Bekanntmachungsdatum)\n\nRheinland-Pfalz Amtsgericht Koblenz HRB 31503\nRegisterbekanntmachung nach dem Umwandlungsgesetz 26.11.2025 (Eintragungsdatum)\n\nBildungscampus am Katholischen Klinikum Koblenz gGmbH\nGesellschaft mit beschränkter Haftung\nKoblenz\n\nAls nicht eingetragen wird veröffentlicht: Den Gläubigern der an der Ausgliederung beteiligten Rechtsträger ist, wenn sie binnen sechs Monaten nach dem Tag, an dem die Eintragung der Ausgliederung in das Register des Sitzes desjenigen Rechtsträgers, dessen Gläubiger sie sind, nach § 19 Abs. 3 UmwG als bekannt gemacht gilt, ihren Anspruch nach Grund und Höhe schriftlich anmelden, Sicherheit zu leisten, soweit sie nicht Befriedigung verlangen können. Dieses Recht steht den Gläubigern jedoch nur zu, wenn sie glaubhaft machen, dass durch die Ausgliederung die Erfüllung der Forderung gefährdet wird."
    },
    {
      "date": "2025-11-26",
      "id": "138365",
      "original_text": "Löschungsankündigung\nRheinland-Pfalz Amtsgericht Ludwigshafen a.Rhein (Ludwigshafen) VR 60792\nBundesverband Deutscher Tierkrematorien e.V. – Neustadt/Wstr.",
      "type": "Löschungsankündigung",
      "state": "Rheinland-Pfalz",
      "amtsgericht": "Amtsgericht Ludwigshafen a.Rhein (Ludwigshafen)",
      "registernummer": "VR 60792",
      "registerart": "VR",
      "company_name": "Bundesverband Deutscher Tierkrematorien e.V.",
      "company_seat": "Neustadt/Wstr.",
      "details": "26.11.2025 (Bekanntmachungsdatum)\n\nRheinland-Pfalz Amtsgericht Ludwigshafen a.Rhein (Ludwigshafen) VR 60792\nLöschungsankündigung 26.11.2025 (Eintragungsdatum)\n\nBundesverband Deutscher Tierkrematorien e.V.\neingetragener Verein\nNeustadt/Wstr.\n\nDas Gericht beabsichtigt, den Verein wegen Einstellung des Vereinszwecks und somit Wegfalls aller Mitglieder von Amts wegen zu löschen. Die Frist zur Geltendmachung eines Widerspruchs gegen die beabsichtigte Löschung ist auf einen Monat ab Veröffentlichung bestimmt."
    },
    {
      "date": "2025-11-26",
      "id": "138366",
      "original_text": "Löschungsankündigung\nRheinland-Pfalz Amtsgericht Zweibrücken HRB 31806\nRoTaPlastes GmbH – Waldmohr",
      "type": "Löschungsankündigung",
      "state": "Rheinland-Pfalz",
      "amtsgericht": "Amtsgericht Zweibrücken",
      "registernummer": "HRB 31806",
      "registerart": "HRB",
      "company_name": "RoTaPlastes GmbH",
      "company_seat": "Waldmohr",
      "details": "26.11.2025 (Bekanntmachungsdatum)\n\nRheinland-Pfalz Amtsgericht Zweibrücken HRB 31806\nLöschungsankündigung\n\nRoTaPlastes GmbH\nGesellschaft mit beschränkter Haftung\nWaldmohr\n\nDas Registergericht beabsichtigt die Gesellschaft von Amts wegen nach § 394 FamFG zu löschen. Die Frist zur Erhebung eines Widerspruchs ist auf einen Monat festgesetzt."
    },
    {
      "date": "2025-11-26",
      "id": "138367",
      "original_text": "Löschungsankündigung\nNordrhein-Westfalen Amtsgericht Essen HRB 35707\nWH-Multiservice GmbH – Essen",
      "type": "Löschungsankündigung",
      "state": "Nordrhein-Westfalen",
      "amtsgericht": "Amtsgericht Essen",
      "registernummer": "HRB 35707",
      "registerart": "HRB",
      "company_name": "WH-Multiservice GmbH",
      "company_seat": "Essen",
      "details": "26.11.2025 (Bekanntmachungsdatum)\n\nNordrhein-Westfalen Amtsgericht Essen HRB 35707\nLöschungsankündigung\n\nWH-Multiservice GmbH\nGesellschaft mit beschränkter Haftung\nEssen\n\nDas Registergericht beabsichtigt die Gesellschaft von Amts wegen nach § 394 FamFG zu löschen. Die Frist zur Erhebung eines Widerspruchs ist auf einen Monat festgesetzt."
    },
    {
      "date": "2025-11-26",
      "id": "138368",
      "original_text": "Registerbekanntmachung nach dem Umwandlungsgesetz\nNordrhein-Westfalen Amtsgericht Köln HRB 122428\nFornito & Team GmbH – Leverkusen",
      "type": "Registerbekanntmachung nach dem Umwandlungsgesetz",
      "state": "Nordrhein-Westfalen",
      "amtsgericht": "Amtsgericht Köln",
      "registernummer": "HRB 122428",
      "registerart": "HRB",
      "company_name": "Fornito & Team GmbH",
      "company_seat": "Leverkusen",
      "details": "26.11.2025 (Bekanntmachungsdatum)\n\nNordrhein-Westfalen Amtsgericht Köln HRB 122428\nRegisterbekanntmachung nach dem Umwandlungsgesetz 26.11.2025 (Eintragungsdatum)\n\nFornito & Team GmbH\nGesellschaft mit beschränkter Haftung\nLeverkusen\n\nDen Gläubigern der an der Ausgliederung beteiligten Rechtsträger ist, wenn sie binnen sechs Monaten nach dem Tag, an dem die Eintragung der Ausgliederung in das Register des Sitzes desjenigen Rechtsträgers, dessen Gläubiger sie sind, nach § 19 Absatz 3 UmwG als bekanntgemacht gilt, ihren Anspruch nach Grund und Höhe schriftlich anmelden, Sicherheit zu leisten, soweit sie nicht Befriedigung verlangen können. Dieses Recht steht den Gläubigern jedoch nur zu, wenn sie glaubhaft machen, dass durch die Ausgliederung die Erfüllung ihrer Forderung gefährdet wird."
    },
    {
      "date": "2025-11-26",
      "id": "138369",
      "original_text": "Einreichung neuer Dokumente\nNordrhein-Westfalen Amtsgericht Iserlohn HRB 5093\nAltenaer Baugesellschaft Aktiengesellschaft – Altena/Westf.",
      "type": "Einreichung neuer Dokumente",
      "state": "Nordrhein-Westfalen",
      "amtsgericht": "Amtsgericht Iserlohn",
      "registernummer": "HRB 5093",
      "registerart": "HRB",
      "company_name": "Altenaer Baugesellschaft Aktiengesellschaft",
      "company_seat": "Altena/Westf.",
      "details": "26.11.2025 (Bekanntmachungsdatum)\n\nNordrhein-Westfalen Amtsgericht Iserlohn HRB 5093\nEinreichung neuer Dokumente 26.11.2025 (Eintragungsdatum)\n\nAltenaer Baugesellschaft Aktiengesellschaft\nAktiengesellschaft\nAltena/Westf.\n\nDem Registergericht ist eine neue Liste der Mitglieder des Aufsichtsrates eingereicht worden."
    },
    {
      "date": "2025-11-26",
      "id": "138370",
      "original_text": "Löschungsankündigung\nNordrhein-Westfalen Amtsgericht Köln HRB 121025\nTeamwork Dienstleistungen GmbH – Köln",
      "type": "Löschungsankündigung",
      "state": "Nordrhein-Westfalen",
      "amtsgericht": "Amtsgericht Köln",
      "registernummer": "HRB 121025",
      "registerart": "HRB",
      "company_name": "Teamwork Dienstleistungen GmbH",
      "company_seat": "Köln",
      "details": "26.11.2025 (Bekanntmachungsdatum)\n\nNordrhein-Westfalen Amtsgericht Köln HRB 121025\nLöschungsankündigung\n\nTeamwork Dienstleistungen GmbH\nGesellschaft mit beschränkter Haftung\nKöln\n\nDas Registergericht beabsichtigt die Gesellschaft von Amts wegen nach § 394 FamFG zu löschen. Die Frist zur Erhebung eines Widerspruchs ist auf einen Monat festgesetzt."
    },
    {
      "date": "2025-11-26",
      "id": "138371",
      "original_text": "Registerbekanntmachung nach dem Umwandlungsgesetz\nNordrhein-Westfalen Amtsgericht Köln HRA 38473\nkommIT Gesellschaft für Informationstechnik mbH & Co. KG – Köln",
      "type": "Registerbekanntmachung nach dem Umwandlungsgesetz",
      "state": "Nordrhein-Westfalen",
      "amtsgericht": "Amtsgericht Köln",
      "registernummer": "HRA 38473",
      "registerart": "HRA",
      "company_name": "kommIT Gesellschaft für Informationstechnik mbH & Co. KG",
      "company_seat": "Köln",
      "details": "26.11.2025 (Bekanntmachungsdatum)\n\nNordrhein-Westfalen Amtsgericht Köln HRA 38473\nRegisterbekanntmachung nach dem Umwandlungsgesetz 26.11.2025 (Eintragungsdatum)\n\nkommIT Gesellschaft für Informationstechnik mbH & Co. KG\nKommanditgesellschaft\nKöln\n\nDen Gläubigern der an der formwechselnden Umwandlung beteiligten Rechtsträger ist, wenn sie binnen sechs Monaten nach dem Tag, an dem die Eintragung der formwechselnden Umwandlung in das Register des Sitzes desjenigen Rechtsträgers, dessen Gläubiger sie sind, nach § 19 Absatz 3 UmwG als bekanntgemacht gilt, ihren Anspruch nach Grund und Höhe schriftlich anmelden, Sicherheit zu leisten, soweit sie nicht Befriedigung verlangen können. Dieses Recht steht den Gläubigern jedoch nur zu, wenn sie glaubhaft machen, dass durch die formwechselnden Umwandlung die Erfüllung ihrer Forderung gefährdet wird."
    },
    {
      "date": "2025-11-26",
      "id": "138372",
      "original_text": "Registerbekanntmachung nach dem Umwandlungsgesetz\nNordrhein-Westfalen Amtsgericht Düsseldorf HRA 25453\nTausendfensterhaus Objekt SARL & Co. KG – Düsseldorf",
      "type": "Registerbekanntmachung nach dem Umwandlungsgesetz",
      "state": "Nordrhein-Westfalen",
      "amtsgericht": "Amtsgericht Düsseldorf",
      "registernummer": "HRA 25453",
      "registerart": "HRA",
      "company_name": "Tausendfensterhaus Objekt SARL & Co. KG",
      "company_seat": "Düsseldorf",
      "details": "26.11.2025 (Bekanntmachungsdatum)\n\nNordrhein-Westfalen Amtsgericht Düsseldorf HRA 25453\nRegisterbekanntmachung nach dem Umwandlungsgesetz 26.11.2025 (Eintragungsdatum)\n\nTausendfensterhaus Objekt SARL & Co. KG\nKommanditgesellschaft\nDüsseldorf\n\nDen Gläubigern der an der formwechselnden Umwandlung beteiligten Rechtsträger ist, wenn sie binnen sechs Monaten nach dem Tag, an dem die Eintragung der formwechselnden Umwandlung in das Register des Sitzes desjenigen Rechtsträgers, dessen Gläubiger sie sind, nach § 19 Absatz 3 UmwG als bekanntgemacht gilt, ihren Anspruch nach Grund und Höhe schriftlich anmelden, Sicherheit zu leisten, soweit sie nicht Befriedigung verlangen können. Dieses Recht steht den Gläubigern jedoch nur zu, wenn sie glaubhaft machen, dass durch die formwechselnden Umwandlung die Erfüllung ihrer Forderung gefährdet wird."
    },
    {
      "date": "2025-11-26",
      "id": "138373",
      "original_text": "Registerbekanntmachung nach dem Umwandlungsgesetz\nNordrhein-Westfalen Amtsgericht Köln HRA 37856\nFornito Versicherungsvermittlung e.K. – Leverkusen",
      "type": "Registerbekanntmachung nach dem Umwandlungsgesetz",
      "state": "Nordrhein-Westfalen",
      "amtsgericht": "Amtsgericht Köln",
      "registernummer": "HRA 37856",
      "registerart": "HRA",
      "company_name": "Fornito Versicherungsvermittlung e.K.",
      "company_seat": "Leverkusen",
      "details": "26.11.2025 (Bekanntmachungsdatum)\n\nNordrhein-Westfalen Amtsgericht Köln HRA 37856\nRegisterbekanntmachung nach dem Umwandlungsgesetz 26.11.2025 (Eintragungsdatum)\n\nFornito Versicherungsvermittlung e.K.\nEinzelkaufmann / Einzelkauffrau\nLeverkusen\n\nDen Gläubigern der an der Ausgliederung beteiligten Rechtsträger ist, wenn sie binnen sechs Monaten nach dem Tag, an dem die Eintragung der Ausgliederung in das Register des Sitzes desjenigen Rechtsträgers, dessen Gläubiger sie sind, nach § 19 Absatz 3 UmwG als bekanntgemacht gilt, ihren Anspruch nach Grund und Höhe schriftlich anmelden, Sicherheit zu leisten, soweit sie nicht Befriedigung verlangen können. Dieses Recht steht den Gläubigern jedoch nur zu, wenn sie glaubhaft machen, dass durch die Ausgliederung die Erfüllung ihrer Forderung gefährdet wird."
    },
    {
      "date": "2025-11-26",
      "id": "138374",
      "original_text": "Registerbekanntmachung nach dem Umwandlungsgesetz\nNordrhein-Westfalen Amtsgericht Essen HRB 32024\nLincoln Electric GmbH – Essen",
      "type": "Registerbekanntmachung nach dem Umwandlungsgesetz",
      "state": "Nordrhein-Westfalen",
      "amtsgericht": "Amtsgericht Essen",
      "registernummer": "HRB 32024",
      "registerart": "HRB",
      "company_name": "Lincoln Electric GmbH",
      "company_seat": "Essen",
      "details": "26.11.2025 (Bekanntmachungsdatum)\n\nNordrhein-Westfalen Amtsgericht Essen HRB 32024\nRegisterbekanntmachung nach dem Umwandlungsgesetz 26.11.2025 (Eintragungsdatum)\n\nLincoln Electric GmbH\nGesellschaft mit beschränkter Haftung\nEssen\n\nDen Gläubigern der an der Verschmelzung beteiligten Rechtsträger ist, wenn sie binnen sechs Monaten nach dem Tag, an dem die Eintragung der Verschmelzung in das Register des Sitzes derjenigen Rechtsträger deren Gläubiger sie sind, nach § 19 Absatz 3 UmwG als bekanntgemacht gilt, ihren Anspruch nach Grund und Höhe schriftlich anmelden, Sicherheit zu leisten, soweit sie nicht Befriedigung verlangen können. Dieses Recht steht den Gläubigern jedoch nur zu, wenn sie glaubhaft machen, dass durch die Verschmelzung die Erfüllung ihrer Forderung gefährdet wird."
    },
    {
      "date": "2025-11-26",
      "id": "138375",
      "original_text": "Löschungsankündigung\nNordrhein-Westfalen Amtsgericht Neuss HRA 7820\nLPM Lions Performance Management GmbH & Co. KG – Dormagen",
      "type": "Löschungsankündigung",
      "state": "Nordrhein-Westfalen",
      "amtsgericht": "Amtsgericht Neuss",
      "registernummer": "HRA 7820",
      "registerart": "HRA",
      "company_name": "LPM Lions Performance Management GmbH & Co. KG",
      "company_seat": "Dormagen",
      "details": "26.11.2025 (Bekanntmachungsdatum)\n\nNordrhein-Westfalen Amtsgericht Neuss HRA 7820\nLöschungsankündigung 25.11.2025 (Eintragungsdatum)\n\nLPM Lions Performance Management GmbH & Co. KG\nKommanditgesellschaft\nDormagen\n\nDas Registergericht beabsichtigt, die Gesellschaft gemäß § 31 Absatz II HGB i.V. m § 394 Absatz IV  FamFG im Handelsregister zu löschen.\nGegen die Löschung kann binnen eines Monats jeder Widerspruch erheben, der an der Unterlassung der Löschung ein berechtigtes Interesse hat."
    },
    {
      "date": "2025-11-26",
      "id": "138376",
      "original_text": "Registerbekanntmachung nach dem Umwandlungsgesetz\nNordrhein-Westfalen Amtsgericht Siegburg HRA 7254\nReifenhandel Onitchenko e.K. – Hennef",
      "type": "Registerbekanntmachung nach dem Umwandlungsgesetz",
      "state": "Nordrhein-Westfalen",
      "amtsgericht": "Amtsgericht Siegburg",
      "registernummer": "HRA 7254",
      "registerart": "HRA",
      "company_name": "Reifenhandel Onitchenko e.K.",
      "company_seat": "Hennef",
      "details": "26.11.2025 (Bekanntmachungsdatum)\n\nNordrhein-Westfalen Amtsgericht Siegburg HRA 7254\nRegisterbekanntmachung nach dem Umwandlungsgesetz 26.11.2025 (Eintragungsdatum)\n\nReifenhandel Onitchenko e.K.\nEinzelkaufmann / Einzelkauffrau\nHennef\n\nDen Gläubigern der an der Ausgliederung beteiligten Rechtsträger ist, wenn sie binnen sechs Monaten nach dem Tag, an dem die Eintragung der Ausgliederung in das Register des Sitzes desjenigen Rechtsträgers, dessen Gläubiger sie sind, nach § 19 Absatz 3 UmwG als bekanntgemacht gilt, ihren Anspruch nach Grund und Höhe schriftlich anmelden, Sicherheit zu leisten, soweit sie nicht Befriedigung verlangen können. Dieses Recht steht den Gläubigern jedoch nur zu, wenn sie glaubhaft machen, dass durch die Ausgliederung die Erfüllung ihrer Forderung gefährdet wird."
    },
    {
      "date": "2025-11-26",
      "id": "138377",
      "original_text": "Registerbekanntmachung nach dem Umwandlungsgesetz\nNordrhein-Westfalen Amtsgericht Kleve HRA 5857\nThun Immobilien e.K. – Kleve",
      "type": "Registerbekanntmachung nach dem Umwandlungsgesetz",
      "state": "Nordrhein-Westfalen",
      "amtsgericht": "Amtsgericht Kleve",
      "registernummer": "HRA 5857",
      "registerart": "HRA",
      "company_name": "Thun Immobilien e.K.",
      "company_seat": "Kleve",
      "details": "26.11.2025 (Bekanntmachungsdatum)\n\nNordrhein-Westfalen Amtsgericht Kleve HRA 5857\nRegisterbekanntmachung nach dem Umwandlungsgesetz 26.11.2025 (Eintragungsdatum)\n\nThun Immobilien e.K.\nEinzelkaufmann / Einzelkauffrau\nKleve\n\nDen Gläubigern der an der Ausgliederung beteiligten Rechtsträger ist, wenn sie binnen sechs Monaten nach dem Tag, an dem die Eintragung der Ausgliederung in das Register des Sitzes desjenigen Rechtsträgers, dessen Gläubiger sie sind, nach § 19 Absatz 3 UmwG als bekanntgemacht gilt, ihren Anspruch nach Grund und Höhe schriftlich anmelden, Sicherheit zu leisten, soweit sie nicht Befriedigung verlangen können. Dieses Recht steht den Gläubigern jedoch nur zu, wenn sie glaubhaft machen, dass durch die Ausgliederung die Erfüllung ihrer Forderung gefährdet wird."
    },
    {
      "date": "2025-11-26",
      "id": "138378",
      "original_text": "Löschungsankündigung\nNordrhein-Westfalen Amtsgericht Münster HRB 15829\nGargano Immobilien GmbH – Münster",
      "type": "Löschungsankündigung",
      "state": "Nordrhein-Westfalen",
      "amtsgericht": "Amtsgericht Münster",
      "registernummer": "HRB 15829",
      "registerart": "HRB",
      "company_name": "Gargano Immobilien GmbH",
      "company_seat": "Münster",
      "details": "26.11.2025 (Bekanntmachungsdatum)\n\nNordrhein-Westfalen Amtsgericht Münster HRB 15829\nLöschungsankündigung\n\nGargano Immobilien GmbH\nGesellschaft mit beschränkter Haftung\nMünster\n\nDas Registergericht beabsichtigt die Gesellschaft von Amts wegen nach § 394 FamFG zu löschen. Die Frist zur Erhebung eines Widerspruchs ist auf einen Monat festgesetzt.\n\nRechtsbehelfsbelehrung:\n\nGegen diese Verfügung können Sie Widerspruch einlegen.\n\nDer Widerspruch ist bei dem Amtsgericht Münster, Gerichtsstraße 2 bis 6, 48149 Münster schriftlich in deutscher Sprache oder zur Niederschrift der Geschäftsstelle eines jeden Amtsgerichtes abgegeben werden.\nDie Einlegung ist auch durch Übertragung eine elektronischen Dokuments an die elektronische Poststelle des Gerichts möglich. Das elektronische Dokument muss für die Bearbeitung durch das Gericht geeignet und mit einer qualifizierten elektronischen Signatur der verantwortenden Person versehen sein oder von der verantwortenden Person signiert und auf einem sicheren Übermittlungsweg gem. §130a ZPO nach nähere Maßgabe der Verordnung über die technischen Rahmenbedingungen des elektronischen Rechtsverkehrs und über das besondere elektronische Behördenpostfach (BGBI. I. S.3808) eingereicht werden. Weitere Informationen erhalten Sie auf der Internetseite www.justiz.de\n\nDer Widerspruch muss spätestens innerhalb der gesetzten Frist nach der schriftlichen Bekanntgabe der Verfügung bei dem Amtsgericht Münster eingegangen sein. Dies gilt auch dann, wenn der Widerspruch zur Niederschrift der Geschäftsstelle eines anderen Amtsgerichtes abgegeben wurde. Die Frist beginnt mit der schriftlichen Bekanntgabe der Verfügung, spätestens mit Ablauf von fünf Monaten nach Erlass der Verfügung. Die Bekanntgabe ist entweder durch Zustellung oder am dritten Tage nach Aufgabe zur Post bewirkt. Fällt das Ende der First auf einen Sonntag, einen allgemeinen Feiertag oder Sonnabend, so endet die Frist mit Ablauf des nächsten Werktages.\n\nDer Widerspruch muss die Bezeichnung der angefochtenen Verfügung sowie die Erklärung enthalten, dass Widerspruch gegen diese Verfügung eingelegt wird. Er ist zu unterzeichnen und soll begründet werden."
    },
    {
      "date": "2025-11-26",
      "id": "138379",
      "original_text": "Löschungsankündigung\nNordrhein-Westfalen Amtsgericht Essen HRB 24922\nBWS-Sanitec UG (haftungsbeschränkt) – Essen",
      "type": "Löschungsankündigung",
      "state": "Nordrhein-Westfalen",
      "amtsgericht": "Amtsgericht Essen",
      "registernummer": "HRB 24922",
      "registerart": "HRB",
      "company_name": "BWS-Sanitec UG (haftungsbeschränkt)",
      "company_seat": "Essen",
      "details": "26.11.2025 (Bekanntmachungsdatum)\n\nNordrhein-Westfalen Amtsgericht Essen HRB 24922\nLöschungsankündigung\n\nBWS-Sanitec UG (haftungsbeschränkt)\nGesellschaft mit beschränkter Haftung\nEssen\n\nDas Registergericht beabsichtigt die Gesellschaft von Amts wegen nach § 394 FamFG zu löschen. Die Frist zur Erhebung eines Widerspruchs ist auf einen Monat festgesetzt."
    },
    {
      "date": "2025-11-26",
      "id": "138380",
      "original_text": "Löschungsankündigung\nNordrhein-Westfalen Amtsgericht Recklinghausen HRA 4423\nGüth Rolladenbau e.K. – Recklinghausen",
      "type": "Löschungsankündigung",
      "state": "Nordrhein-Westfalen",
      "amtsgericht": "Amtsgericht Recklinghausen",
      "registernummer": "HRA 4423",
      "registerart": "HRA",
      "company_name": "Güth Rolladenbau e.K.",
      "company_seat": "Recklinghausen",
      "details": "26.11.2025 (Bekanntmachungsdatum)\n\nNordrhein-Westfalen Amtsgericht Recklinghausen HRA 4423\nLöschungsankündigung 26.11.2025 (Eintragungsdatum)\n\nGüth Rolladenbau e.K.\nEinzelkaufmann / Einzelkauffrau\nRecklinghausen\n\nDas Registergericht beabsichtigt die Firma von Amts wegen nach § 31 Abs. 2 HGB, § 393 FamFG zu löschen. Die Frist zur Erhebung eines Widerspruchs ist auf einen Monat festgesetzt."
    },
    {
      "date": "2025-11-26",
      "id": "138381",
      "original_text": "Löschungsankündigung\nNordrhein-Westfalen Amtsgericht Mönchengladbach HRB 18130\nXijon GmbH – Viersen",
      "type": "Löschungsankündigung",
      "state": "Nordrhein-Westfalen",
      "amtsgericht": "Amtsgericht Mönchengladbach",
      "registernummer": "HRB 18130",
      "registerart": "HRB",
      "company_name": "Xijon GmbH",
      "company_seat": "Viersen",
      "details": "26.11.2025 (Bekanntmachungsdatum)\n\nNordrhein-Westfalen Amtsgericht Mönchengladbach HRB 18130\nLöschungsankündigung\n\nXijon GmbH\nGesellschaft mit beschränkter Haftung\nViersen\n\nDas Registergericht beabsichtigt die Gesellschaft von Amts wegen nach § 394 FamFG zu löschen. Die Frist zur Erhebung eines Widerspruchs ist auf drei Monate festgesetzt."
    },
    {
      "date": "2025-11-26",
      "id": "138382",
      "original_text": "Registerbekanntmachung nach dem Umwandlungsgesetz\nNordrhein-Westfalen Amtsgericht Düsseldorf HRA 24882\nCASSIUS BASTEI Objekt SARL & Co. KG – Düsseldorf",
      "type": "Registerbekanntmachung nach dem Umwandlungsgesetz",
      "state": "Nordrhein-Westfalen",
      "amtsgericht": "Amtsgericht Düsseldorf",
      "registernummer": "HRA 24882",
      "registerart": "HRA",
      "company_name": "CASSIUS BASTEI Objekt SARL & Co. KG",
      "company_seat": "Düsseldorf",
      "details": "26.11.2025 (Bekanntmachungsdatum)\n\nNordrhein-Westfalen Amtsgericht Düsseldorf HRA 24882\nRegisterbekanntmachung nach dem Umwandlungsgesetz 26.11.2025 (Eintragungsdatum)\n\nCASSIUS BASTEI Objekt SARL & Co. KG\nKommanditgesellschaft\nDüsseldorf\n\nDen Gläubigern der an der formwechselnden Umwandlung beteiligten Rechtsträger ist, wenn sie binnen sechs Monaten nach dem Tag, an dem die Eintragung der formwechselnden Umwandlung in das Register des Sitzes desjenigen Rechtsträgers, dessen Gläubiger sie sind, nach § 19 Absatz 3 UmwG als bekanntgemacht gilt, ihren Anspruch nach Grund und Höhe schriftlich anmelden, Sicherheit zu leisten, soweit sie nicht Befriedigung verlangen können. Dieses Recht steht den Gläubigern jedoch nur zu, wenn sie glaubhaft machen, dass durch die formwechselnden Umwandlung die Erfüllung ihrer Forderung gefährdet wird."
    },
    {
      "date": "2025-11-26",
      "id": "138383",
      "original_text": "Einreichung neuer Dokumente\nNordrhein-Westfalen Amtsgericht Neuss HRB 12071\nPierburg GmbH – Neuss",
      "type": "Einreichung neuer Dokumente",
      "state": "Nordrhein-Westfalen",
      "amtsgericht": "Amtsgericht Neuss",
      "registernummer": "HRB 12071",
      "registerart": "HRB",
      "company_name": "Pierburg GmbH",
      "company_seat": "Neuss",
      "details": "26.11.2025 (Bekanntmachungsdatum)\n\nNordrhein-Westfalen Amtsgericht Neuss HRB 12071\nEinreichung neuer Dokumente\n\nPierburg GmbH\nGesellschaft mit beschränkter Haftung\nNeuss\n\nDem Registergericht ist eine neue Liste der Mitglieder des Aufsichtsrates eingereicht worden."
    },
    {
      "date": "2025-11-26",
      "id": "138384",
      "original_text": "Löschungsankündigung\nNordrhein-Westfalen Amtsgericht Duisburg HRB 35398\nCORDIT Personal UG (haftungsbeschränkt) – Oberhausen",
      "type": "Löschungsankündigung",
      "state": "Nordrhein-Westfalen",
      "amtsgericht": "Amtsgericht Duisburg",
      "registernummer": "HRB 35398",
      "registerart": "HRB",
      "company_name": "CORDIT Personal UG (haftungsbeschränkt)",
      "company_seat": "Oberhausen",
      "details": "26.11.2025 (Bekanntmachungsdatum)\n\nNordrhein-Westfalen Amtsgericht Duisburg HRB 35398\nLöschungsankündigung 26.11.2025 (Eintragungsdatum)\n\nCORDIT Personal UG (haftungsbeschränkt)\nGesellschaft mit beschränkter Haftung\nOberhausen\n\nHRB 35398:\nCORDIT Personal UG (haftungsbeschränkt), Oberhausen\nPfalzgrafenstraße 61, 46147 Oberhausen.\nDas Registergericht beabsichtigt, die im Handelsregister eingetragene Gesellschaft gemäß § 394 FamFG wegen Vermögenslosigkeit von Amts wegen zu löschen. Gegen diese Verfügung kann Widerspruch eingelegt werden. Die Frist zur Erhebung eines Widerspruchs gegen die beabsichtigte Löschung von Amts wegen ist auf drei Monate festgesetzt.\nRechtsbehelfsbelehrung Der Widerspruch ist bei dem Amtsgericht Duisburg, Kardinal-Galen-Str. 124-132, 47058 Duisburg schriftlich in deutscher Sprache oder zur Niederschrift der Geschäftsstelle einzulegen. Der Widerspruch kann auch zur Niederschrift der Geschäftsstelle eines jeden Amtsgerichtes abgegeben werden. Die Einlegung ist auch durch Übertragung eines elektronischen Dokuments an die elektronische Poststelle des Gerichts möglich. Das elektronische Dokument muss für die Bearbeitung durch das Gericht geeignet und mit einer qualifizierten elektronischen Signatur der verantwortenden Person versehen sein oder von der verantwortenden Person signiert und auf einem sicheren Übermittlungsweg gemäß § 130 a ZPO nach näherer Maßgabe der Verordnung über die technischen Rahmenbedingungen des elektronischen Rechtsverkehrs und über das besondere elektronische Behördenpostfach (BGBl. I, S. 3803) eingereicht werden. Weitere Informationen erhalten Sie auf der Internetseite www.justiz.de. Der Widerspruch muss spätestens innerhalb der gesetzten Frist bei dem Amtsgericht Duisburg eingegangen sein. Dies gilt auch dann, wenn der Widerspruch zur Niederschrift der Geschäftsstelle eines anderen Amtsgerichtes abgegeben wurde. Die Frist beginnt mit der Veröffentlichung. Fällt das Ende der Frist auf einen Sonntag, einen allgemeinen Feiertag oder Sonnabend, so endet die Frist mit Ablauf des nächsten Werktages. Der Widerspruch muss die Bezeichnung der angefochtenen Verfügung sowie die Erklärung enthalten, dass Widerspruch gegen diese Verfügung eingelegt wird. Er ist zu unterzeichnen und soll begründet werden."
    },
    {
      "date": "2025-11-26",
      "id": "138385",
      "original_text": "Registerbekanntmachung nach dem Umwandlungsgesetz\nNordrhein-Westfalen Amtsgericht Düsseldorf HRA 27092\nPaxos Düsseldorf BA8 SARL & Co. KG – Düsseldorf",
      "type": "Registerbekanntmachung nach dem Umwandlungsgesetz",
      "state": "Nordrhein-Westfalen",
      "amtsgericht": "Amtsgericht Düsseldorf",
      "registernummer": "HRA 27092",
      "registerart": "HRA",
      "company_name": "Paxos Düsseldorf BA8 SARL & Co. KG",
      "company_seat": "Düsseldorf",
      "details": "26.11.2025 (Bekanntmachungsdatum)\n\nNordrhein-Westfalen Amtsgericht Düsseldorf HRA 27092\nRegisterbekanntmachung nach dem Umwandlungsgesetz 26.11.2025 (Eintragungsdatum)\n\nPaxos Düsseldorf BA8 SARL & Co. KG\nKommanditgesellschaft\nDüsseldorf\n\nDen Gläubigern der an der formwechselnden Umwandlung beteiligten Rechtsträger ist, wenn sie binnen sechs Monaten nach dem Tag, an dem die Eintragung der formwechselnden Umwandlung in das Register des Sitzes desjenigen Rechtsträgers, dessen Gläubiger sie sind, nach § 19 Absatz 3 UmwG als bekanntgemacht gilt, ihren Anspruch nach Grund und Höhe schriftlich anmelden, Sicherheit zu leisten, soweit sie nicht Befriedigung verlangen können. Dieses Recht steht den Gläubigern jedoch nur zu, wenn sie glaubhaft machen, dass durch die formwechselnden Umwandlung die Erfüllung ihrer Forderung gefährdet wird."
    },
    {
      "date": "2025-11-26",
      "id": "138386",
      "original_text": "Löschungsankündigung\nNordrhein-Westfalen Amtsgericht Hamm HRB 9813\nmo`libertatem UG (haftungsbeschränkt) – Kamen",
      "type": "Löschungsankündigung",
      "state": "Nordrhein-Westfalen",
      "amtsgericht": "Amtsgericht Hamm",
      "registernummer": "HRB 9813",
      "registerart": "HRB",
      "company_name": "mo`libertatem UG (haftungsbeschränkt)",
      "company_seat": "Kamen",
      "details": "26.11.2025 (Bekanntmachungsdatum)\n\nNordrhein-Westfalen Amtsgericht Hamm HRB 9813\nLöschungsankündigung\n\nmo`libertatem UG (haftungsbeschränkt)\nGesellschaft mit beschränkter Haftung\nKamen\n\nDas Registergericht beabsichtigt die Gesellschaft von Amts wegen nach § 394 FamFG zu löschen. Die Frist zur Erhebung eines Widerspruchs ist auf drei Monate festgesetzt."
    },
    {
      "date": "2025-11-26",
      "id": "138387",
      "original_text": "Löschungsankündigung\nThüringen Amtsgericht Jena HRB 510191\nZSG Zustell UG (haftungsbeschränkt) – Neustadt an der Orla",
      "type": "Löschungsankündigung",
      "state": "Thüringen",
      "amtsgericht": "Amtsgericht Jena",
      "registernummer": "HRB 510191",
      "registerart": "HRB",
      "company_name": "ZSG Zustell UG (haftungsbeschränkt)",
      "company_seat": "Neustadt an der Orla",
      "details": "26.11.2025 (Bekanntmachungsdatum)\n\nThüringen Amtsgericht Jena HRB 510191\nLöschungsankündigung\n\nZSG Zustell UG (haftungsbeschränkt)\nGesellschaft mit beschränkter Haftung\nNeustadt an der Orla\n\nDas Registergericht beabsichtigt, die im Handelsregister eingetragene Gesellschaft wegen Vermögenslosigkeit nach § 394 FamFG von Amts wegen zu löschen. Die Frist zur Erhebung eines Widerspruchs gegen die beabsichtigte Löschung wird auf 6 Wochen festgesetzt."
    },
    {
      "date": "2025-11-26",
      "id": "138388",
      "original_text": "Registerbekanntmachung nach dem Umwandlungsgesetz\nHessen Amtsgericht Frankfurt am Main HRB 72269\nHoffmann Motors Verwaltungs GmbH – Karben",
      "type": "Registerbekanntmachung nach dem Umwandlungsgesetz",
      "state": "Hessen",
      "amtsgericht": "Amtsgericht Frankfurt am Main",
      "registernummer": "HRB 72269",
      "registerart": "HRB",
      "company_name": "Hoffmann Motors Verwaltungs GmbH",
      "company_seat": "Karben",
      "details": "26.11.2025 (Bekanntmachungsdatum)\n\nHessen Amtsgericht Frankfurt am Main HRB 72269\nRegisterbekanntmachung nach dem Umwandlungsgesetz 26.11.2025 (Eintragungsdatum)\n\nHoffmann Motors Verwaltungs GmbH\nGesellschaft mit beschränkter Haftung\nKarben\n\nDen Gläubigern der an der Verschmelzung beteiligten Rechtsträger ist, wenn sie binnen sechs Monaten nach dem Tag, an dem die Eintragung der Verschmelzung in das Register des Sitzes desjenigen Rechtsträgers, dessen Gläubiger sie sind, nach § 19 Absatz 3 UmwG bekannt gemacht worden ist, ihren Anspruch nach Grund und Höhe schriftlich anmelden, Sicherheit zu leisten, soweit sie nicht Befriedigung verlangen können. Dieses Recht steht den Gläubigern jedoch nur zu, wenn sie glaubhaft machen, dass durch die Verschmelzung die Erfüllung ihrer Forderung gefährdet wird."
    },
    {
      "date": "2025-11-26",
      "id": "138389",
      "original_text": "Registerbekanntmachung nach dem Umwandlungsgesetz\nHessen Amtsgericht Frankfurt am Main HRB 112270\nRes Publica Verwaltungs GmbH – Frankfurt am Main",
      "type": "Registerbekanntmachung nach dem Umwandlungsgesetz",
      "state": "Hessen",
      "amtsgericht": "Amtsgericht Frankfurt am Main",
      "registernummer": "HRB 112270",
      "registerart": "HRB",
      "company_name": "Res Publica Verwaltungs GmbH",
      "company_seat": "Frankfurt am Main",
      "details": "26.11.2025 (Bekanntmachungsdatum)\n\nHessen Amtsgericht Frankfurt am Main HRB 112270\nRegisterbekanntmachung nach dem Umwandlungsgesetz 26.11.2025 (Eintragungsdatum)\n\nRes Publica Verwaltungs GmbH\nGesellschaft mit beschränkter Haftung\nFrankfurt am Main\n\nDen Gläubigern der an der Verschmelzung beteiligten Rechtsträger ist, wenn sie binnen sechs Monaten nach dem Tag, an dem die Eintragung der Verschmelzung in das Register des Sitzes desjenigen Rechtsträgers, dessen Gläubiger sie sind, nach § 19 Absatz 3 UmwG bekannt gemacht worden ist, ihren Anspruch nach Grund und Höhe schriftlich anmelden, Sicherheit zu leisten, soweit sie nicht Befriedigung verlangen können. Dieses Recht steht den Gläubigern jedoch nur zu, wenn sie glaubhaft machen, dass durch die Verschmelzung die Erfüllung ihrer Forderung gefährdet wird."
    },
    {
      "date": "2025-11-26",
      "id": "138390",
      "original_text": "Registerbekanntmachung nach dem Umwandlungsgesetz\nHessen Amtsgericht Frankfurt am Main HRB 118840\nRemedium Verwaltungs GmbH – Frankfurt am Main",
      "type": "Registerbekanntmachung nach dem Umwandlungsgesetz",
      "state": "Hessen",
      "amtsgericht": "Amtsgericht Frankfurt am Main",
      "registernummer": "HRB 118840",
      "registerart": "HRB",
      "company_name": "Remedium Verwaltungs GmbH",
      "company_seat": "Frankfurt am Main",
      "details": "26.11.2025 (Bekanntmachungsdatum)\n\nHessen Amtsgericht Frankfurt am Main HRB 118840\nRegisterbekanntmachung nach dem Umwandlungsgesetz 26.11.2025 (Eintragungsdatum)\n\nRemedium Verwaltungs GmbH\nGesellschaft mit beschränkter Haftung\nFrankfurt am Main\n\nDen Gläubigern der an der Verschmelzung beteiligten Rechtsträger ist, wenn sie binnen sechs Monaten nach dem Tag, an dem die Eintragung der Verschmelzung in das Register des Sitzes desjenigen Rechtsträgers, dessen Gläubiger sie sind, nach § 19 Absatz 3 UmwG bekannt gemacht worden ist, ihren Anspruch nach Grund und Höhe schriftlich anmelden, Sicherheit zu leisten, soweit sie nicht Befriedigung verlangen können. Dieses Recht steht den Gläubigern jedoch nur zu, wenn sie glaubhaft machen, dass durch die Verschmelzung die Erfüllung ihrer Forderung gefährdet wird."
    },
    {
      "date": "2025-11-26",
      "id": "138391",
      "original_text": "Löschungsankündigung\nHessen Amtsgericht Königstein HRB 10339\nMonte Linas GmbH – Schwalbach am Taunus",
      "type": "Löschungsankündigung",
      "state": "Hessen",
      "amtsgericht": "Amtsgericht Königstein",
      "registernummer": "HRB 10339",
      "registerart": "HRB",
      "company_name": "Monte Linas GmbH",
      "company_seat": "Schwalbach am Taunus",
      "details": "26.11.2025 (Bekanntmachungsdatum)\n\nHessen Amtsgericht Königstein HRB 10339\nLöschungsankündigung\n\nMonte Linas GmbH\nGesellschaft mit beschränkter Haftung\nSchwalbach am Taunus\n\nDas Registergericht beabsichtigt die im Handelsregister eingetragene Gesellschaft von Amts wegen nach § 394 FamFG zu löschen. Die Frist zur Erhebung eines Widerspruchs gegen die beabsichtigte Löschung wird auf 3 Monate festgesetzt."
    },
    {
      "date": "2025-11-26",
      "id": "138392",
      "original_text": "Sonstige Registerbekanntmachung\nHessen Amtsgericht Königstein VR 1148\nWaldkindergarten Wiesel e.V. – Bad Soden am Taunus",
      "type": "Sonstige Registerbekanntmachung",
      "state": "Hessen",
      "amtsgericht": "Amtsgericht Königstein",
      "registernummer": "VR 1148",
      "registerart": "VR",
      "company_name": "Waldkindergarten Wiesel e.V.",
      "company_seat": "Bad Soden am Taunus",
      "details": "26.11.2025 (Bekanntmachungsdatum)\n\nHessen Amtsgericht Königstein VR 1148\nSonstige Registerbekanntmachung 26.11.2025 (Eintragungsdatum)\n\nWaldkindergarten Wiesel e.V.\neingetragener Verein\nBad Soden am Taunus\n\nDer Verein ist aufgelöst."
    },
    {
      "date": "2025-11-26",
      "id": "138393",
      "original_text": "Löschungsankündigung\nHessen Amtsgericht Frankfurt am Main HRB 128816\nT & N GmbH – Franfurt am Main",
      "type": "Löschungsankündigung",
      "state": "Hessen",
      "amtsgericht": "Amtsgericht Frankfurt am Main",
      "registernummer": "HRB 128816",
      "registerart": "HRB",
      "company_name": "T & N GmbH",
      "company_seat": "Franfurt am Main",
      "details": "26.11.2025 (Bekanntmachungsdatum)\n\nHessen Amtsgericht Frankfurt am Main HRB 128816\nLöschungsankündigung\n\nT & N GmbH\nGesellschaft mit beschränkter Haftung\nFranfurt am Main\n\nEs ist beabsichtigt, die Gesellschaft wegen Vermögenslosigkeit gemäß § 394 FamFG von Amts wegen im Handelsregister zu löschen. Hiergegen kann innerhalb eines Monats nach dieser Veröffentlichung Widerspruch bei dem Amtsgericht Frankfurt am Main eingelegt werden."
    },
    {
      "date": "2025-11-26",
      "id": "138394",
      "original_text": "Löschungsankündigung\nHessen Amtsgericht Wiesbaden HRB 30611\nMAIDA Bau und Transport GmbH – Wiesbaden",
      "type": "Löschungsankündigung",
      "state": "Hessen",
      "amtsgericht": "Amtsgericht Wiesbaden",
      "registernummer": "HRB 30611",
      "registerart": "HRB",
      "company_name": "MAIDA Bau und Transport GmbH",
      "company_seat": "Wiesbaden",
      "details": "26.11.2025 (Bekanntmachungsdatum)\n\nHessen Amtsgericht Wiesbaden HRB 30611\nLöschungsankündigung\n\nMAIDA Bau und Transport GmbH\nGesellschaft mit beschränkter Haftung\nWiesbaden\n\nDas Registergericht beabsichtigt die im Handelsregister eingetragene Gesellschaft von Amts wegen nach § 394 FamFG zu löschen. Die Frist zur Erhebung eines Widerspruchs gegen die beabsichtigte Löschung wird auf 3 Monate festgesetzt."
    },
    {
      "date": "2025-11-26",
      "id": "138395",
      "original_text": "Löschungsankündigung\nHessen Amtsgericht Wiesbaden HRB 29576\nM-Energy Services UG (haftungsbeschränkt) – Oestrich-Winkel",
      "type": "Löschungsankündigung",
      "state": "Hessen",
      "amtsgericht": "Amtsgericht Wiesbaden",
      "registernummer": "HRB 29576",
      "registerart": "HRB",
      "company_name": "M-Energy Services UG (haftungsbeschränkt)",
      "company_seat": "Oestrich-Winkel",
      "details": "26.11.2025 (Bekanntmachungsdatum)\n\nHessen Amtsgericht Wiesbaden HRB 29576\nLöschungsankündigung\n\nM-Energy Services UG (haftungsbeschränkt)\nGesellschaft mit beschränkter Haftung\nOestrich-Winkel\n\nDas Registergericht beabsichtigt die im Handelsregister eingetragene Gesellschaft von Amts wegen nach § 394 FamFG zu löschen. Die Frist zur Erhebung eines Widerspruchs gegen die beabsichtigte Löschung wird auf 3 Monate festgesetzt."
    },
    {
      "date": "2025-11-26",
      "id": "138396",
      "original_text": "Löschungsankündigung\nHessen Amtsgericht Fulda HRB 1880\nAPM Informationstechnologie GmbH – Fulda",
      "type": "Löschungsankündigung",
      "state": "Hessen",
      "amtsgericht": "Amtsgericht Fulda",
      "registernummer": "HRB 1880",
      "registerart": "HRB",
      "company_name": "APM Informationstechnologie GmbH",
      "company_seat": "Fulda",
      "details": "26.11.2025 (Bekanntmachungsdatum)\n\nHessen Amtsgericht Fulda HRB 1880\nLöschungsankündigung\n\nAPM Informationstechnologie GmbH\nGesellschaft mit beschränkter Haftung\nFulda\n\nDas Registergericht beabsichtigt die im Handelsregister eingetragene Gesellschaft von Amts wegen nach § 394 FamFG zu löschen. Die Frist zur Erhebung eines Widerspruchs gegen die beabsichtigte Löschung wird auf 3 Monate festgesetzt."
    },
    {
      "date": "2025-11-26",
      "id": "138397",
      "original_text": "Registerbekanntmachung nach dem Umwandlungsgesetz\nHessen Amtsgericht Frankfurt am Main HRB 118841\nRemedium Warehouse GmbH – Frankfurt am Main",
      "type": "Registerbekanntmachung nach dem Umwandlungsgesetz",
      "state": "Hessen",
      "amtsgericht": "Amtsgericht Frankfurt am Main",
      "registernummer": "HRB 118841",
      "registerart": "HRB",
      "company_name": "Remedium Warehouse GmbH",
      "company_seat": "Frankfurt am Main",
      "details": "26.11.2025 (Bekanntmachungsdatum)\n\nHessen Amtsgericht Frankfurt am Main HRB 118841\nRegisterbekanntmachung nach dem Umwandlungsgesetz 26.11.2025 (Eintragungsdatum)\n\nRemedium Warehouse GmbH\nGesellschaft mit beschränkter Haftung\nFrankfurt am Main\n\nDen Gläubigern der an der Verschmelzung beteiligten Rechtsträger ist, wenn sie binnen sechs Monaten nach dem Tag, an dem die Eintragung der Verschmelzung in das Register des Sitzes desjenigen Rechtsträgers, dessen Gläubiger sie sind, nach § 19 Absatz 3 UmwG bekannt gemacht worden ist, ihren Anspruch nach Grund und Höhe schriftlich anmelden, Sicherheit zu leisten, soweit sie nicht Befriedigung verlangen können. Dieses Recht steht den Gläubigern jedoch nur zu, wenn sie glaubhaft machen, dass durch die Verschmelzung die Erfüllung ihrer Forderung gefährdet wird."
    },
    {
      "date": "2025-11-26",
      "id": "138398",
      "original_text": "Registerbekanntmachung nach dem Umwandlungsgesetz\nHessen Amtsgericht Marburg HRB 7783\nShifts Apparel GmbH – Gemünden (Wohra)",
      "type": "Registerbekanntmachung nach dem Umwandlungsgesetz",
      "state": "Hessen",
      "amtsgericht": "Amtsgericht Marburg",
      "registernummer": "HRB 7783",
      "registerart": "HRB",
      "company_name": "Shifts Apparel GmbH",
      "company_seat": "Gemünden (Wohra)",
      "details": "26.11.2025 (Bekanntmachungsdatum)\n\nHessen Amtsgericht Marburg HRB 7783\nRegisterbekanntmachung nach dem Umwandlungsgesetz 26.11.2025 (Eintragungsdatum)\n\nShifts Apparel GmbH\nGesellschaft mit beschränkter Haftung\nGemünden (Wohra)\n\nDen Gläubigern der an der Verschmelzung beteiligten Rechtsträger ist, wenn sie binnen sechs Monaten nach dem Tag, an dem die Eintragung der Verschmelzung in das Register des Sitzes desjenigen Rechtsträgers, dessen Gläubiger sie sind, nach § 19 Absatz 3 UmwG bekannt gemacht worden ist, ihren Anspruch nach Grund und Höhe schriftlich anmelden, Sicherheit zu leisten, soweit sie nicht Befriedigung verlangen können. Dieses Recht steht den Gläubigern jedoch nur zu, wenn sie glaubhaft machen, dass durch die Verschmelzung die Erfüllung ihrer Forderung gefährdet wird."
    },
    {
      "date": "2025-11-26",
      "id": "138399",
      "original_text": "Löschungsankündigung\nHessen Amtsgericht Wiesbaden HRB 30426\nI 2 Consult GmbH – Taunusstein",
      "type": "Löschungsankündigung",
      "state": "Hessen",
      "amtsgericht": "Amtsgericht Wiesbaden",
      "registernummer": "HRB 30426",
      "registerart": "HRB",
      "company_name": "I 2 Consult GmbH",
      "company_seat": "Taunusstein",
      "details": "26.11.2025 (Bekanntmachungsdatum)\n\nHessen Amtsgericht Wiesbaden HRB 30426\nLöschungsankündigung\n\nI 2 Consult GmbH\nGesellschaft mit beschränkter Haftung\nTaunusstein\n\nDas Registergericht beabsichtigt die im Handelsregister eingetragene Gesellschaft von Amts wegen nach § 394 FamFG zu löschen. Die Frist zur Erhebung eines Widerspruchs gegen die beabsichtigte Löschung wird auf 3 Monate festgesetzt."
    },
    {
      "date": "2025-11-26",
      "id": "138400",
      "original_text": "Registerbekanntmachung nach dem Umwandlungsgesetz\nHessen Amtsgericht Frankfurt am Main HRA 53991\nBrian Hoffmann Motors e.K. – Karben",
      "type": "Registerbekanntmachung nach dem Umwandlungsgesetz",
      "state": "Hessen",
      "amtsgericht": "Amtsgericht Frankfurt am Main",
      "registernummer": "HRA 53991",
      "registerart": "HRA",
      "company_name": "Brian Hoffmann Motors e.K.",
      "company_seat": "Karben",
      "details": "26.11.2025 (Bekanntmachungsdatum)\n\nHessen Amtsgericht Frankfurt am Main HRA 53991\nRegisterbekanntmachung nach dem Umwandlungsgesetz 26.11.2025 (Eintragungsdatum)\n\nBrian Hoffmann Motors e.K.\nEinzelkaufmann / Einzelkauffrau\nKarben\n\nDen Gläubigern der an der Verschmelzung beteiligten Rechtsträger ist, wenn sie binnen sechs Monaten nach dem Tag, an dem die Eintragung der Verschmelzung in das Register des Sitzes desjenigen Rechtsträgers, dessen Gläubiger sie sind, nach § 19 Absatz 3 UmwG bekannt gemacht worden ist, ihren Anspruch nach Grund und Höhe schriftlich anmelden, Sicherheit zu leisten, soweit sie nicht Befriedigung verlangen können. Dieses Recht steht den Gläubigern jedoch nur zu, wenn sie glaubhaft machen, dass durch die Verschmelzung die Erfüllung ihrer Forderung gefährdet wird."
    },
    {
      "date": "2025-11-26",
      "id": "138401",
      "original_text": "Löschungsankündigung\nHessen Amtsgericht Limburg HRB 6054\nEbamo Limburg UG (haftungsbeschränkt) – Dornburg",
      "type": "Löschungsankündigung",
      "state": "Hessen",
      "amtsgericht": "Amtsgericht Limburg",
      "registernummer": "HRB 6054",
      "registerart": "HRB",
      "company_name": "Ebamo Limburg UG (haftungsbeschränkt)",
      "company_seat": "Dornburg",
      "details": "26.11.2025 (Bekanntmachungsdatum)\n\nHessen Amtsgericht Limburg HRB 6054\nLöschungsankündigung\n\nEbamo Limburg UG (haftungsbeschränkt)\nGesellschaft mit beschränkter Haftung\nDornburg\n\nDas Registergericht beabsichtigt die im Handelsregister eingetragene Gesellschaft von Amts wegen nach § 394 FamFG zu löschen. Die Frist zur Erhebung eines Widerspruchs gegen die beabsichtigte Löschung wird auf 3 Monate festgesetzt."
    },
    {
      "date": "2025-11-26",
      "id": "138402",
      "original_text": "Sonstige Registerbekanntmachung\nHessen Amtsgericht Fritzlar VR 3941\nBelegschaftskasse - Poresta systems e.V. – Bad Wildungen",
      "type": "Sonstige Registerbekanntmachung",
      "state": "Hessen",
      "amtsgericht": "Amtsgericht Fritzlar",
      "registernummer": "VR 3941",
      "registerart": "VR",
      "company_name": "Belegschaftskasse - Poresta systems e.V.",
      "company_seat": "Bad Wildungen",
      "details": "26.11.2025 (Bekanntmachungsdatum)\n\nHessen Amtsgericht Fritzlar VR 3941\nSonstige Registerbekanntmachung 26.11.2025 (Eintragungsdatum)\n\nBelegschaftskasse - Poresta systems e.V.\neingetragener Verein\nBad Wildungen\n\nDer Verein ist aufgelöst."
    },
    {
      "date": "2025-11-26",
      "id": "138403",
      "original_text": "Löschungsankündigung\nHessen Amtsgericht Fulda HRB 7518\nMedical4Life GmbH – Fulda",
      "type": "Löschungsankündigung",
      "state": "Hessen",
      "amtsgericht": "Amtsgericht Fulda",
      "registernummer": "HRB 7518",
      "registerart": "HRB",
      "company_name": "Medical4Life GmbH",
      "company_seat": "Fulda",
      "details": "26.11.2025 (Bekanntmachungsdatum)\n\nHessen Amtsgericht Fulda HRB 7518\nLöschungsankündigung\n\nMedical4Life GmbH\nGesellschaft mit beschränkter Haftung\nFulda\n\nDas Registergericht beabsichtigt die im Handelsregister eingetragene Gesellschaft von Amts wegen nach § 394 FamFG zu löschen. Die Frist zur Erhebung eines Widerspruchs gegen die beabsichtigte Löschung wird auf 2 Monate festgesetzt."
    },
    {
      "date": "2025-11-26",
      "id": "138404",
      "original_text": "Registerbekanntmachung nach dem Umwandlungsgesetz\nHessen Amtsgericht Frankfurt am Main HRB 113630\nRes Publica Warehouse GmbH – Frankfurt am Main",
      "type": "Registerbekanntmachung nach dem Umwandlungsgesetz",
      "state": "Hessen",
      "amtsgericht": "Amtsgericht Frankfurt am Main",
      "registernummer": "HRB 113630",
      "registerart": "HRB",
      "company_name": "Res Publica Warehouse GmbH",
      "company_seat": "Frankfurt am Main",
      "details": "26.11.2025 (Bekanntmachungsdatum)\n\nHessen Amtsgericht Frankfurt am Main HRB 113630\nRegisterbekanntmachung nach dem Umwandlungsgesetz 26.11.2025 (Eintragungsdatum)\n\nRes Publica Warehouse GmbH\nGesellschaft mit beschränkter Haftung\nFrankfurt am Main\n\nDen Gläubigern der an der Verschmelzung beteiligten Rechtsträger ist, wenn sie binnen sechs Monaten nach dem Tag, an dem die Eintragung der Verschmelzung in das Register des Sitzes desjenigen Rechtsträgers, dessen Gläubiger sie sind, nach § 19 Absatz 3 UmwG bekannt gemacht worden ist, ihren Anspruch nach Grund und Höhe schriftlich anmelden, Sicherheit zu leisten, soweit sie nicht Befriedigung verlangen können. Dieses Recht steht den Gläubigern jedoch nur zu, wenn sie glaubhaft machen, dass durch die Verschmelzung die Erfüllung ihrer Forderung gefährdet wird."
    },
    {
      "date": "2025-11-26",
      "id": "138405",
      "original_text": "Registerbekanntmachung nach dem Umwandlungsgesetz\nHessen Amtsgericht Marburg HRB 7719\nFeijoa Capital UG (haftungsbeschränkt) – Gemünden (Wohra)",
      "type": "Registerbekanntmachung nach dem Umwandlungsgesetz",
      "state": "Hessen",
      "amtsgericht": "Amtsgericht Marburg",
      "registernummer": "HRB 7719",
      "registerart": "HRB",
      "company_name": "Feijoa Capital UG (haftungsbeschränkt)",
      "company_seat": "Gemünden (Wohra)",
      "details": "26.11.2025 (Bekanntmachungsdatum)\n\nHessen Amtsgericht Marburg HRB 7719\nRegisterbekanntmachung nach dem Umwandlungsgesetz 26.11.2025 (Eintragungsdatum)\n\nFeijoa Capital UG (haftungsbeschränkt)\nGesellschaft mit beschränkter Haftung\nGemünden (Wohra)\n\nDen Gläubigern der an der Verschmelzung beteiligten Rechtsträger ist, wenn sie binnen sechs Monaten nach dem Tag, an dem die Eintragung der Verschmelzung in das Register des Sitzes desjenigen Rechtsträgers, dessen Gläubiger sie sind, nach § 19 Absatz 3 UmwG bekannt gemacht worden ist, ihren Anspruch nach Grund und Höhe schriftlich anmelden, Sicherheit zu leisten, soweit sie nicht Befriedigung verlangen können. Dieses Recht steht den Gläubigern jedoch nur zu, wenn sie glaubhaft machen, dass durch die Verschmelzung die Erfüllung ihrer Forderung gefährdet wird."
    },
    {
      "date": "2025-11-26",
      "id": "138406",
      "original_text": "Einreichung neuer Dokumente\nHessen Amtsgericht Frankfurt am Main HRB 125755\nLupo Verwaltungs GmbH & Co. KGaA – Frankfurt am Main",
      "type": "Einreichung neuer Dokumente",
      "state": "Hessen",
      "amtsgericht": "Amtsgericht Frankfurt am Main",
      "registernummer": "HRB 125755",
      "registerart": "HRB",
      "company_name": "Lupo Verwaltungs GmbH & Co. KGaA",
      "company_seat": "Frankfurt am Main",
      "details": "26.11.2025 (Bekanntmachungsdatum)\n\nHessen Amtsgericht Frankfurt am Main HRB 125755\nEinreichung neuer Dokumente 26.11.2025 (Eintragungsdatum)\n\nLupo Verwaltungs GmbH & Co. KGaA\nKommanditgesellschaft auf Aktien\nFrankfurt am Main\n\nDurch eine Änderung in den Personen der Aufsichtsratsmitglieder ist eine Liste der Mitglieder des Aufsichtsrates zum Handelsregister eingereicht worden."
    },
    {
      "date": "2025-11-26",
      "id": "138407",
      "original_text": "Sonstige Registerbekanntmachung\nHessen Amtsgericht Wiesbaden HRB 10028\nHELIOS Dr. Horst Schmidt Kliniken Wiesbaden GmbH – Wiesbaden",
      "type": "Sonstige Registerbekanntmachung",
      "state": "Hessen",
      "amtsgericht": "Amtsgericht Wiesbaden",
      "registernummer": "HRB 10028",
      "registerart": "HRB",
      "company_name": "HELIOS Dr. Horst Schmidt Kliniken Wiesbaden GmbH",
      "company_seat": "Wiesbaden",
      "details": "26.11.2025 (Bekanntmachungsdatum)\n\nHessen Amtsgericht Wiesbaden HRB 10028\nSonstige Registerbekanntmachung\n\nHELIOS Dr. Horst Schmidt Kliniken Wiesbaden GmbH\nGesellschaft mit beschränkter Haftung\nWiesbaden\n\nDurch eine Änderung in den Personen der Aufsichtsratsmitglieder ist eine Liste der Mitglieder des Aufsichtsrates zum Handelsregister eingereicht worden."
    },
    {
      "date": "2025-11-26",
      "id": "138408",
      "original_text": "Registerbekanntmachung nach dem Umwandlungsgesetz\nSachsen Amtsgericht Leipzig HRB 24881\nTilia C Beteiligung GmbH – Leipzig",
      "type": "Registerbekanntmachung nach dem Umwandlungsgesetz",
      "state": "Sachsen",
      "amtsgericht": "Amtsgericht Leipzig",
      "registernummer": "HRB 24881",
      "registerart": "HRB",
      "company_name": "Tilia C Beteiligung GmbH",
      "company_seat": "Leipzig",
      "details": "26.11.2025 (Bekanntmachungsdatum)\n\nSachsen Amtsgericht Leipzig HRB 24881\nRegisterbekanntmachung nach dem Umwandlungsgesetz 26.11.2025 (Eintragungsdatum)\n\nTilia C Beteiligung GmbH\nGesellschaft mit beschränkter Haftung\nLeipzig\n\nDen Gläubigern der an der Verschmelzung beteiligten Rechtsträger ist, wenn sie binnen sechs Monaten nach dem Tag, an dem die Eintragung der Verschmelzung in das Register des Sitzes desjenigen Rechtsträgers, dessen Gläubiger sie sind, nach § 19 Abs. 3 UmwG als bekannt gemacht gilt, ihren Anspruch nach Grund und Höhe in Textform anmelden, Sicherheit zu leisten, soweit sie nicht Befriedigung verlangen können. Dieses Recht steht den Gläubigern jedoch nur zu, wenn sie glaubhaft machen, dass durch die Verschmelzung die Erfüllung der Forderung gefährdet wird."
    },
    {
      "date": "2025-11-26",
      "id": "138409",
      "original_text": "Registerbekanntmachung nach dem Umwandlungsgesetz\nSachsen Amtsgericht Leipzig HRB 25041\nTilia Group GmbH – Leipzig",
      "type": "Registerbekanntmachung nach dem Umwandlungsgesetz",
      "state": "Sachsen",
      "amtsgericht": "Amtsgericht Leipzig",
      "registernummer": "HRB 25041",
      "registerart": "HRB",
      "company_name": "Tilia Group GmbH",
      "company_seat": "Leipzig",
      "details": "26.11.2025 (Bekanntmachungsdatum)\n\nSachsen Amtsgericht Leipzig HRB 25041\nRegisterbekanntmachung nach dem Umwandlungsgesetz 26.11.2025 (Eintragungsdatum)\n\nTilia Group GmbH\nGesellschaft mit beschränkter Haftung\nLeipzig\n\nDen Gläubigern der an der Verschmelzung beteiligten Rechtsträger ist, wenn sie binnen sechs Monaten nach dem Tag, an dem die Eintragung der Verschmelzung in das Register des Sitzes desjenigen Rechtsträgers, dessen Gläubiger sie sind, nach § 19 Abs. 3 UmwG als bekannt gemacht gilt, ihren Anspruch nach Grund und Höhe in Textform anmelden, Sicherheit zu leisten, soweit sie nicht Befriedigung verlangen können. Dieses Recht steht den Gläubigern jedoch nur zu, wenn sie glaubhaft machen, dass durch die Verschmelzung die Erfüllung der Forderung gefährdet wird."
    }
  ]
}