{
  "date": "2025-11-07",
  "date_of_scrape": "2025-11-08T04:09:54.250Z",
  "tool_version": "0.2.0",
  "number_of_announcements": 125,
  "announcements": [
    {
      "date": "2025-11-07",
      "id": "136586",
      "original_text": "Registerbekanntmachung nach dem Umwandlungsgesetz\nBayern Amtsgericht München HRB 140669\nWavestone Germany AG – München",
      "type": "Registerbekanntmachung nach dem Umwandlungsgesetz",
      "state": "Bayern",
      "amtsgericht": "Amtsgericht München",
      "registernummer": "HRB 140669",
      "registerart": "HRB",
      "company_name": "Wavestone Germany AG",
      "company_seat": "München",
      "details": "07.11.2025 (Bekanntmachungsdatum)\n\nBayern Amtsgericht München HRB 140669\nRegisterbekanntmachung nach dem Umwandlungsgesetz 06.11.2025 (Eintragungsdatum)\n\nWavestone Germany AG\nAktiengesellschaft\nMünchen\n\nDen Gläubigern der an der Verschmelzung beteiligten Rechtsträger ist, wenn sie binnen sechs Monaten nach dem Tag, an dem die Eintragung der Verschmelzung in das Register des Sitzes desjenigen Rechtsträgers, dessen Gläubiger sie sind, nach § 19 Abs. 3 UmwG als bekannt gemacht gilt, ihren Anspruch nach Grund und Höhe in Textform anmelden, Sicherheit zu leisten, soweit sie nicht Befriedigung verlangen können. Dieses Recht steht den Gläubigern jedoch nur zu, wenn sie glaubhaft machen, dass durch die Verschmelzung die Erfüllung ihrer Forderung gefährdet wird."
    },
    {
      "date": "2025-11-07",
      "id": "136587",
      "original_text": "Registerbekanntmachung nach dem Umwandlungsgesetz\nBayern Amtsgericht München HRB 296027\nSublation Holding GmbH – Aschheim",
      "type": "Registerbekanntmachung nach dem Umwandlungsgesetz",
      "state": "Bayern",
      "amtsgericht": "Amtsgericht München",
      "registernummer": "HRB 296027",
      "registerart": "HRB",
      "company_name": "Sublation Holding GmbH",
      "company_seat": "Aschheim",
      "details": "07.11.2025 (Bekanntmachungsdatum)\n\nBayern Amtsgericht München HRB 296027\nRegisterbekanntmachung nach dem Umwandlungsgesetz 06.11.2025 (Eintragungsdatum)\n\nSublation Holding GmbH\nGesellschaft mit beschränkter Haftung\nAschheim\n\nDen Gläubigern der an der Ausgliederung beteiligten Rechtsträger ist, wenn sie binnen sechs Monaten nach dem Tag, an dem die Eintragung der Ausgliederung in das Register des Sitzes desjenigen Rechtsträgers, dessen Gläubiger sie sind, nach §§ 125, 19 Abs. 3 UmwG als bekannt gemacht gilt, ihren Anspruch nach Grund und Höhe in Textform anmelden, Sicherheit zu leisten, soweit sie nicht Befriedigung verlangen können. Dieses Recht steht den Gläubigern jedoch nur zu, wenn sie glaubhaft machen, dass durch die Ausgliederung die Erfüllung ihrer Forderung gefährdet wird."
    },
    {
      "date": "2025-11-07",
      "id": "136588",
      "original_text": "Einreichung neuer Dokumente\nBayern Amtsgericht Nürnberg HRB 202\nLEONI AG – Nürnberg",
      "type": "Einreichung neuer Dokumente",
      "state": "Bayern",
      "amtsgericht": "Amtsgericht Nürnberg",
      "registernummer": "HRB 202",
      "registerart": "HRB",
      "company_name": "LEONI AG",
      "company_seat": "Nürnberg",
      "details": "07.11.2025 (Bekanntmachungsdatum)\n\nBayern Amtsgericht Nürnberg HRB 202\nEinreichung neuer Dokumente 30.10.2025 (Eintragungsdatum)\n\nLEONI AG\nAktiengesellschaft\nNürnberg\n\nDem Amtsgericht Nürnberg -Registergericht- ist eine Liste der Mitglieder des Aufsichtsrats eingereicht worden, § 106 AktG."
    },
    {
      "date": "2025-11-07",
      "id": "136589",
      "original_text": "Sonstige Registerbekanntmachung\nBayern Amtsgericht Nürnberg GnR 17\nMetalleinkauf eG Nürnberg Fachgroßhandel für das metallverarbeitende Handwerk – Nürnberg",
      "type": "Sonstige Registerbekanntmachung",
      "state": "Bayern",
      "amtsgericht": "Amtsgericht Nürnberg",
      "registernummer": "GnR 17",
      "registerart": "GnR",
      "company_name": "Metalleinkauf eG Nürnberg Fachgroßhandel für das metallverarbeitende Handwerk",
      "company_seat": "Nürnberg",
      "details": "07.11.2025 (Bekanntmachungsdatum)\n\nBayern Amtsgericht Nürnberg GnR 17\nSonstige Registerbekanntmachung 06.11.2025 (Eintragungsdatum)\n\nMetalleinkauf eG Nürnberg Fachgroßhandel für das metallverarbeitende Handwerk\neingetragene Genossenschaft\nNürnberg\n\nDen Gläubigern der Genossenschaft ist gemäß §§ 22a i.V.m. 22 GenG, wenn sie sich binnen sechs Monaten nach der Bekanntmachung bei der Genossenschaft zu diesem Zweck melden, Sicherheit zu leisten, soweit sie nicht Befriedigung verlangen können.\nDie Generalversammlung vom 28.09.2024 hat die Änderung der Satzung beschlossen. Geändert wurde u.a. § 40 (Nachschusspflicht); dieser lautet nun: Eine Nachschusspflicht der Mitglieder besteht nicht."
    },
    {
      "date": "2025-11-07",
      "id": "136590",
      "original_text": "Löschungsankündigung\nBayern Amtsgericht München HRB 215693\nINAGAWA GmbH – München",
      "type": "Löschungsankündigung",
      "state": "Bayern",
      "amtsgericht": "Amtsgericht München",
      "registernummer": "HRB 215693",
      "registerart": "HRB",
      "company_name": "INAGAWA GmbH",
      "company_seat": "München",
      "details": "07.11.2025 (Bekanntmachungsdatum)\n\nBayern Amtsgericht München HRB 215693\nLöschungsankündigung\n\nINAGAWA GmbH\nGesellschaft mit beschränkter Haftung\nMünchen\n\nDas Registergericht beabsichtigt, die im Handelsregister eingetragene Gesellschaft wegen Vermögenslosigkeit von Amts wegen nach § 394 FamFG zu löschen. Die Frist zur Erhebung eines Widerspruchs ist auf drei Monate festgesetzt."
    },
    {
      "date": "2025-11-07",
      "id": "136591",
      "original_text": "Sonstige Registerbekanntmachung\nBayern Amtsgericht Fürth HRB 16370\nRS Bau UG (haftungsbeschränkt) – Fürth",
      "type": "Sonstige Registerbekanntmachung",
      "state": "Bayern",
      "amtsgericht": "Amtsgericht Fürth",
      "registernummer": "HRB 16370",
      "registerart": "HRB",
      "company_name": "RS Bau UG (haftungsbeschränkt)",
      "company_seat": "Fürth",
      "details": "07.11.2025 (Bekanntmachungsdatum)\n\nBayern Amtsgericht Fürth HRB 16370\nSonstige Registerbekanntmachung 05.11.2025 (Eintragungsdatum)\n\nRS Bau UG (haftungsbeschränkt)\nGesellschaft mit beschränkter Haftung\nFürth\n\nVon Amts wegen gelöscht gemäß § 395 FamFG:\nGeschäftsführer:\nRognean, Radu-Bogdan, Fürth / Rumänien, *17.12.1984"
    },
    {
      "date": "2025-11-07",
      "id": "136592",
      "original_text": "Löschungsankündigung\nBayern Amtsgericht Hof HRB 7057\nLebensraum Weißenstadt GmbH – Weißenstadt",
      "type": "Löschungsankündigung",
      "state": "Bayern",
      "amtsgericht": "Amtsgericht Hof",
      "registernummer": "HRB 7057",
      "registerart": "HRB",
      "company_name": "Lebensraum Weißenstadt GmbH",
      "company_seat": "Weißenstadt",
      "details": "07.11.2025 (Bekanntmachungsdatum)\n\nBayern Amtsgericht Hof HRB 7057\nLöschungsankündigung\n\nLebensraum Weißenstadt GmbH\nGesellschaft mit beschränkter Haftung\nWeißenstadt\n\nDas Registergericht beabsichtigt, die im Handelsregister eingetragene Gesellschaft wegen Vermögenslosigkeit von Amts wegen nach § 394 FamFG zu löschen. Die Frist zur Erhebung eines Widerspruchs ist auf sechs Wochen festgesetzt."
    },
    {
      "date": "2025-11-07",
      "id": "136593",
      "original_text": "Löschungsankündigung\nBayern Amtsgericht Nürnberg HRB 21367\nLeon Gastronomiebetriebe GmbH – Nürnberg",
      "type": "Löschungsankündigung",
      "state": "Bayern",
      "amtsgericht": "Amtsgericht Nürnberg",
      "registernummer": "HRB 21367",
      "registerart": "HRB",
      "company_name": "Leon Gastronomiebetriebe GmbH",
      "company_seat": "Nürnberg",
      "details": "07.11.2025 (Bekanntmachungsdatum)\n\nBayern Amtsgericht Nürnberg HRB 21367\nLöschungsankündigung\n\nLeon Gastronomiebetriebe GmbH\nGesellschaft mit beschränkter Haftung\nNürnberg\n\nDas Registergericht beabsichtigt, die im Handelsregister eingetragene Gesellschaft wegen Vermögenslosigkeit von Amts wegen nach § 394 FamFG zu löschen. Die Frist zur Erhebung eines Widerspruchs ist auf einen Monat festgesetzt."
    },
    {
      "date": "2025-11-07",
      "id": "136594",
      "original_text": "Registerbekanntmachung nach dem Umwandlungsgesetz\nBayern Amtsgericht München HRB 248679\nqdive GmbH – München",
      "type": "Registerbekanntmachung nach dem Umwandlungsgesetz",
      "state": "Bayern",
      "amtsgericht": "Amtsgericht München",
      "registernummer": "HRB 248679",
      "registerart": "HRB",
      "company_name": "qdive GmbH",
      "company_seat": "München",
      "details": "07.11.2025 (Bekanntmachungsdatum)\n\nBayern Amtsgericht München HRB 248679\nRegisterbekanntmachung nach dem Umwandlungsgesetz 06.11.2025 (Eintragungsdatum)\n\nqdive GmbH\nGesellschaft mit beschränkter Haftung\nMünchen\n\nDen Gläubigern der an der Verschmelzung beteiligten Rechtsträger ist, wenn sie binnen sechs Monaten nach dem Tag, an dem die Eintragung der Verschmelzung in das Register des Sitzes desjenigen Rechtsträgers, dessen Gläubiger sie sind, nach § 19 Abs. 3 UmwG als bekannt gemacht gilt, ihren Anspruch nach Grund und Höhe in Textform anmelden, Sicherheit zu leisten, soweit sie nicht Befriedigung verlangen können. Dieses Recht steht den Gläubigern jedoch nur zu, wenn sie glaubhaft machen, dass durch die Verschmelzung die Erfüllung ihrer Forderung gefährdet wird."
    },
    {
      "date": "2025-11-07",
      "id": "136595",
      "original_text": "Registerbekanntmachung nach dem Umwandlungsgesetz\nBayern Amtsgericht München HRB 95078\nMagnum Gewerbepark Entwicklungsgesellschaft m.b.H. – München",
      "type": "Registerbekanntmachung nach dem Umwandlungsgesetz",
      "state": "Bayern",
      "amtsgericht": "Amtsgericht München",
      "registernummer": "HRB 95078",
      "registerart": "HRB",
      "company_name": "Magnum Gewerbepark Entwicklungsgesellschaft m.b.H.",
      "company_seat": "München",
      "details": "07.11.2025 (Bekanntmachungsdatum)\n\nBayern Amtsgericht München HRB 95078\nRegisterbekanntmachung nach dem Umwandlungsgesetz 06.11.2025 (Eintragungsdatum)\n\nMagnum Gewerbepark Entwicklungsgesellschaft m.b.H.\nGesellschaft mit beschränkter Haftung\nMünchen\n\nDen Gläubigern der an der Verschmelzung beteiligten Rechtsträger ist, wenn sie binnen sechs Monaten nach dem Tag, an dem die Eintragung der Verschmelzung in das Register des Sitzes desjenigen Rechtsträgers, dessen Gläubiger sie sind, nach § 19 Abs. 3 UmwG als bekannt gemacht gilt, ihren Anspruch nach Grund und Höhe in Textform anmelden, Sicherheit zu leisten, soweit sie nicht Befriedigung verlangen können. Dieses Recht steht den Gläubigern jedoch nur zu, wenn sie glaubhaft machen, dass durch die Verschmelzung die Erfüllung ihrer Forderung gefährdet wird."
    },
    {
      "date": "2025-11-07",
      "id": "136596",
      "original_text": "Löschungsankündigung\nBayern Amtsgericht München HRB 253690\nAndreas Schmidt Beteiligungs-GmbH – Garching b.München",
      "type": "Löschungsankündigung",
      "state": "Bayern",
      "amtsgericht": "Amtsgericht München",
      "registernummer": "HRB 253690",
      "registerart": "HRB",
      "company_name": "Andreas Schmidt Beteiligungs-GmbH",
      "company_seat": "Garching b.München",
      "details": "07.11.2025 (Bekanntmachungsdatum)\n\nBayern Amtsgericht München HRB 253690\nLöschungsankündigung\n\nAndreas Schmidt Beteiligungs-GmbH\nGesellschaft mit beschränkter Haftung\nGarching b.München\n\nDas Registergericht beabsichtigt, den im Handelsregister eingetragenen Geschäftsführer Andreas Schmidt, geb. 27.03.1967, wegen fehlender Eignung nach § 395 FamFG zu löschen. Die Frist zur Erhebung eines Widerspruchs ist auf sechs Wochen festgesetzt."
    },
    {
      "date": "2025-11-07",
      "id": "136597",
      "original_text": "Löschungsankündigung\nBayern Amtsgericht München HRB 242982\nALK Baudienstleistungen UG (haftungsbeschränkt) – Planegg",
      "type": "Löschungsankündigung",
      "state": "Bayern",
      "amtsgericht": "Amtsgericht München",
      "registernummer": "HRB 242982",
      "registerart": "HRB",
      "company_name": "ALK Baudienstleistungen UG (haftungsbeschränkt)",
      "company_seat": "Planegg",
      "details": "07.11.2025 (Bekanntmachungsdatum)\n\nBayern Amtsgericht München HRB 242982\nLöschungsankündigung 06.11.2025 (Eintragungsdatum)\n\nALK Baudienstleistungen UG (haftungsbeschränkt)\nGesellschaft mit beschränkter Haftung\nPlanegg\n\nDas Registergericht beabsichtigt, die im Handelsregister eingetragene Gesellschaft wegen Vermögenslosigkeit von Amts wegen nach § 394 FamFG zu löschen. Die Frist zur Erhebung eines Widerspruchs ist auf drei Monate festgesetzt."
    },
    {
      "date": "2025-11-07",
      "id": "136598",
      "original_text": "Löschungsankündigung\nBayern Amtsgericht Ansbach HRB 6620\nSNP GLOBAL GmbH – Dinkelsbühl",
      "type": "Löschungsankündigung",
      "state": "Bayern",
      "amtsgericht": "Amtsgericht Ansbach",
      "registernummer": "HRB 6620",
      "registerart": "HRB",
      "company_name": "SNP GLOBAL GmbH",
      "company_seat": "Dinkelsbühl",
      "details": "07.11.2025 (Bekanntmachungsdatum)\n\nBayern Amtsgericht Ansbach HRB 6620\nLöschungsankündigung\n\nSNP GLOBAL GmbH\nGesellschaft mit beschränkter Haftung\nDinkelsbühl\n\nDas Registergericht beabsichtigt, die im Handelsregister eingetragene Gesellschaft wegen Vermögenslosigkeit von Amts wegen nach § 394 FamFG zu löschen. Die Frist zur Erhebung eines Widerspruchs ist auf sechs Wochen festgesetzt."
    },
    {
      "date": "2025-11-07",
      "id": "136599",
      "original_text": "Löschungsankündigung\nBayern Amtsgericht Traunstein HRB 30749\nLeaf Al UG (haftungsbeschränkt) – Rohrdorf",
      "type": "Löschungsankündigung",
      "state": "Bayern",
      "amtsgericht": "Amtsgericht Traunstein",
      "registernummer": "HRB 30749",
      "registerart": "HRB",
      "company_name": "Leaf Al UG (haftungsbeschränkt)",
      "company_seat": "Rohrdorf",
      "details": "07.11.2025 (Bekanntmachungsdatum)\n\nBayern Amtsgericht Traunstein HRB 30749\nLöschungsankündigung\n\nLeaf Al UG (haftungsbeschränkt)\nGesellschaft mit beschränkter Haftung\nRohrdorf\n\nDas Registergericht beabsichtigt, die im Handelsregister eingetragene Gesellschaft wegen Vermögenslosigkeit von Amts wegen nach § 394 FamFG zu löschen. Die Frist zur Erhebung eines Widerspruchs ist auf einen Monat festgesetzt."
    },
    {
      "date": "2025-11-07",
      "id": "136600",
      "original_text": "Registerbekanntmachung nach dem Umwandlungsgesetz\nBayern Amtsgericht Augsburg HRB 18084\nJosefine von Twickel Verwaltungsgesellschaft mbH – Schmiechen",
      "type": "Registerbekanntmachung nach dem Umwandlungsgesetz",
      "state": "Bayern",
      "amtsgericht": "Amtsgericht Augsburg",
      "registernummer": "HRB 18084",
      "registerart": "HRB",
      "company_name": "Josefine von Twickel Verwaltungsgesellschaft mbH",
      "company_seat": "Schmiechen",
      "details": "07.11.2025 (Bekanntmachungsdatum)\n\nBayern Amtsgericht Augsburg HRB 18084\nRegisterbekanntmachung nach dem Umwandlungsgesetz 06.11.2025 (Eintragungsdatum)\n\nJosefine von Twickel Verwaltungsgesellschaft mbH\nGesellschaft mit beschränkter Haftung\nSchmiechen\n\nDen Gläubigern der an der Verschmelzung beteiligten Rechtsträger ist, wenn sie binnen sechs Monaten nach dem Tag, an dem die Eintragung der Verschmelzung in das Register des Sitzes desjenigen Rechtsträgers, dessen Gläubiger sie sind, nach § 19 Abs. 3 UmwG als bekannt gemacht gilt, ihren Anspruch nach Grund und Höhe in Textform anmelden, Sicherheit zu leisten, soweit sie nicht Befriedigung verlangen können. Dieses Recht steht den Gläubigern jedoch nur zu, wenn sie glaubhaft machen, dass durch die Verschmelzung die Erfüllung ihrer Forderung gefährdet wird."
    },
    {
      "date": "2025-11-07",
      "id": "136601",
      "original_text": "Einreichung neuer Dokumente\nBayern Amtsgericht München HRB 278003\nMediatum AG – Pullach i.Isartal",
      "type": "Einreichung neuer Dokumente",
      "state": "Bayern",
      "amtsgericht": "Amtsgericht München",
      "registernummer": "HRB 278003",
      "registerart": "HRB",
      "company_name": "Mediatum AG",
      "company_seat": "Pullach i.Isartal",
      "details": "07.11.2025 (Bekanntmachungsdatum)\n\nBayern Amtsgericht München HRB 278003\nEinreichung neuer Dokumente 06.11.2025 (Eintragungsdatum)\n\nMediatum AG\nAktiengesellschaft\nPullach i.Isartal\n\nDem Amtsgericht München -Registergericht- ist eine Liste der Mitglieder des Aufsichtsrats eingereicht worden, § 106 AktG."
    },
    {
      "date": "2025-11-07",
      "id": "136602",
      "original_text": "Einreichung neuer Dokumente\nBaden-Württemberg Amtsgericht Stuttgart HRB 23388\nLBBW Immobilien Management GmbH – Stuttgart",
      "type": "Einreichung neuer Dokumente",
      "state": "Baden-Württemberg",
      "amtsgericht": "Amtsgericht Stuttgart",
      "registernummer": "HRB 23388",
      "registerart": "HRB",
      "company_name": "LBBW Immobilien Management GmbH",
      "company_seat": "Stuttgart",
      "details": "07.11.2025 (Bekanntmachungsdatum)\n\nBaden-Württemberg Amtsgericht Stuttgart HRB 23388\nEinreichung neuer Dokumente\n\nLBBW Immobilien Management GmbH\nGesellschaft mit beschränkter Haftung\nStuttgart\n\nDie Gesellschaft hat am 04.11.2025 die Liste über die Zusammensetzung des Aufsichtsrats zum Handelsregister eingereicht."
    },
    {
      "date": "2025-11-07",
      "id": "136603",
      "original_text": "Löschungsankündigung\nHamburg Amtsgericht Hamburg HRA 70376\n\"Pöseldorfer Apotheke\" Bert Assi e.K. – Hamburg",
      "type": "Löschungsankündigung",
      "state": "Hamburg",
      "amtsgericht": "Amtsgericht Hamburg",
      "registernummer": "HRA 70376",
      "registerart": "HRA",
      "company_name": "\"Pöseldorfer Apotheke\" Bert Assi e.K.",
      "company_seat": "Hamburg",
      "details": "07.11.2025 (Bekanntmachungsdatum)\n\nHamburg Amtsgericht Hamburg HRA 70376\nLöschungsankündigung\n\n\"Pöseldorfer Apotheke\" Bert Assi e.K.\nEinzelkaufmann\nHamburg\n\nDas Registergericht beabsichtigt, die im Handelsregister eingetragene Firma von Amts wegen nach § 31 Abs. 2 S. 2 HGB zu löschen. Die Frist zur Erhebung eines Widerspruchs gegen die beabsichtigte Löschung wird auf 3 Monate festgesetzt."
    },
    {
      "date": "2025-11-07",
      "id": "136604",
      "original_text": "Registerbekanntmachung nach dem Umwandlungsgesetz\nBaden-Württemberg Amtsgericht Stuttgart HRB 802014\nBJM GmbH – Reutlingen",
      "type": "Registerbekanntmachung nach dem Umwandlungsgesetz",
      "state": "Baden-Württemberg",
      "amtsgericht": "Amtsgericht Stuttgart",
      "registernummer": "HRB 802014",
      "registerart": "HRB",
      "company_name": "BJM GmbH",
      "company_seat": "Reutlingen",
      "details": "07.11.2025 (Bekanntmachungsdatum)\n\nBaden-Württemberg Amtsgericht Stuttgart HRB 802014\nRegisterbekanntmachung nach dem Umwandlungsgesetz 07.11.2025 (Eintragungsdatum)\n\nBJM GmbH\nGesellschaft mit beschränkter Haftung\nReutlingen\n\nDen Gläubigern der an der Abspaltung beteiligten Rechtsträger ist, wenn sie binnen sechs Monaten nach dem Tag, an dem die Eintragung der Abspaltung in das Register des Sitzes desjenigen Rechtsträgers, dessen Gläubiger sie sind, nach § 19 Abs. 3 UmwG als bekanntgemacht gilt, ihren Anspruch nach Grund und Höhe schriftlich anmelden, Sicherheit zu leisten, soweit sie nicht Befriedigung verlangen können. Dieses Recht steht den Gläubigern jedoch nur zu, wenn sie glaubhaft machen, dass durch die Abspaltung die Erfüllung ihrer Forderung gefährdet wird."
    },
    {
      "date": "2025-11-07",
      "id": "136605",
      "original_text": "Löschungsankündigung\nBerlin Amtsgericht Berlin (Charlottenburg) HRB 250918\nOYuan GmbH – Berlin",
      "type": "Löschungsankündigung",
      "state": "Berlin",
      "amtsgericht": "Amtsgericht Berlin (Charlottenburg)",
      "registernummer": "HRB 250918",
      "registerart": "HRB",
      "company_name": "OYuan GmbH",
      "company_seat": "Berlin",
      "details": "07.11.2025 (Bekanntmachungsdatum)\n\nBerlin Amtsgericht Berlin (Charlottenburg) HRB 250918\nLöschungsankündigung\n\nOYuan GmbH\nGesellschaft mit beschränkter Haftung\nBerlin\n\nBei der nachstehenden Gesellschaft wird das Amtslöschungsverfahren gemäß § 394 FamFG eingeleitet. Widerspruchsfrist 6 Wochen"
    },
    {
      "date": "2025-11-07",
      "id": "136606",
      "original_text": "Löschungsankündigung\nBerlin Amtsgericht Berlin (Charlottenburg) HRB 111492\nGRÜEZI Residential Properties GmbH – Berlin",
      "type": "Löschungsankündigung",
      "state": "Berlin",
      "amtsgericht": "Amtsgericht Berlin (Charlottenburg)",
      "registernummer": "HRB 111492",
      "registerart": "HRB",
      "company_name": "GRÜEZI Residential Properties GmbH",
      "company_seat": "Berlin",
      "details": "07.11.2025 (Bekanntmachungsdatum)\n\nBerlin Amtsgericht Berlin (Charlottenburg) HRB 111492\nLöschungsankündigung\n\nGRÜEZI Residential Properties GmbH\nGesellschaft mit beschränkter Haftung\nBerlin\n\nBei der nachstehenden Gesellschaft wird das Amtslöschungsverfahren gemäß § 394 FamFG eingeleitet. Widerspruchsfrist 6 Wochen"
    },
    {
      "date": "2025-11-07",
      "id": "136607",
      "original_text": "Löschungsankündigung\nBerlin Amtsgericht Berlin (Charlottenburg) HRB 157044\nMT Immobilien Verwaltungs UG (haftungsbeschränkt) – Berlin",
      "type": "Löschungsankündigung",
      "state": "Berlin",
      "amtsgericht": "Amtsgericht Berlin (Charlottenburg)",
      "registernummer": "HRB 157044",
      "registerart": "HRB",
      "company_name": "MT Immobilien Verwaltungs UG (haftungsbeschränkt)",
      "company_seat": "Berlin",
      "details": "07.11.2025 (Bekanntmachungsdatum)\n\nBerlin Amtsgericht Berlin (Charlottenburg) HRB 157044\nLöschungsankündigung\n\nMT Immobilien Verwaltungs UG (haftungsbeschränkt)\nGesellschaft mit beschränkter Haftung\nBerlin\n\nBei der nachstehenden Gesellschaft wird das Amtslöschungsverfahren gemäß § 394 FamFG eingeleitet. Widerspruchsfrist 6 Wochen"
    },
    {
      "date": "2025-11-07",
      "id": "136608",
      "original_text": "Registerbekanntmachung nach dem Umwandlungsgesetz\nSchleswig-Holstein Amtsgericht Kiel HRB 26377\nAqua-Tool GmbH – Melsdorf",
      "type": "Registerbekanntmachung nach dem Umwandlungsgesetz",
      "state": "Schleswig-Holstein",
      "amtsgericht": "Amtsgericht Kiel",
      "registernummer": "HRB 26377",
      "registerart": "HRB",
      "company_name": "Aqua-Tool GmbH",
      "company_seat": "Melsdorf",
      "details": "07.11.2025 (Bekanntmachungsdatum)\n\nSchleswig-Holstein Amtsgericht Kiel HRB 26377\nRegisterbekanntmachung nach dem Umwandlungsgesetz 06.11.2025 (Eintragungsdatum)\n\nAqua-Tool GmbH\nGesellschaft mit beschränkter Haftung\nMelsdorf\n\nZu Eintragungsnummer 3 vom 06.11.2025 wird als nicht eingetragen veröffentlicht: Den Gläubigern der an der Verschmelzung beteiligten Rechtsträger ist, wenn sie binnen sechs Monaten nach dem Tag, an dem die Eintragung der Verschmelzung in das Register des Sitzes desjenigen Rechtsträgers, dessen Gläubiger sie sind, nach § 19 Abs. 3 UmwG bekannt gemacht worden ist, ihren Anspruch nach Grund und Höhe schriftlich anmelden, Sicherheit zu leisten, soweit sie nicht Befriedigung verlangen können. Dieses Recht steht den Gläubigern jedoch nur zu, wenn sie glaubhaft machen, dass durch die Verschmelzung die Erfüllung ihrer Forderung gefährdet wird."
    },
    {
      "date": "2025-11-07",
      "id": "136609",
      "original_text": "Registerbekanntmachung nach dem Umwandlungsgesetz\nBaden-Württemberg Amtsgericht Mannheim HRB 708167\nRoche Diagnostics Deutschland GmbH – Mannheim",
      "type": "Registerbekanntmachung nach dem Umwandlungsgesetz",
      "state": "Baden-Württemberg",
      "amtsgericht": "Amtsgericht Mannheim",
      "registernummer": "HRB 708167",
      "registerart": "HRB",
      "company_name": "Roche Diagnostics Deutschland GmbH",
      "company_seat": "Mannheim",
      "details": "07.11.2025 (Bekanntmachungsdatum)\n\nBaden-Württemberg Amtsgericht Mannheim HRB 708167\nRegisterbekanntmachung nach dem Umwandlungsgesetz 07.11.2025 (Eintragungsdatum)\n\nRoche Diagnostics Deutschland GmbH\nGesellschaft mit beschränkter Haftung\nMannheim\n\nDen Gläubigern der an der Verschmelzung beteiligten Rechtsträger ist, wenn sie binnen sechs Monaten nach dem Tag, an dem die Eintragung der Verschmelzung in das Register des Sitzes desjenigen Rechtsträgers, dessen Gläubiger sie sind, nach § 19 Abs. 3 UmwG als bekanntgemacht gilt, ihren Anspruch nach Grund und Höhe schriftlich anmelden, Sicherheit zu leisten, soweit sie nicht Befriedigung verlangen können. Dieses Recht steht den Gläubigern jedoch nur zu, wenn sie glaubhaft machen, dass durch die Verschmelzung die Erfüllung ihrer Forderung gefährdet wird."
    },
    {
      "date": "2025-11-07",
      "id": "136610",
      "original_text": "Löschungsankündigung\nBaden-Württemberg Amtsgericht Stuttgart HRB 750249\nPhoenix Spirit GmbH – Stuttgart",
      "type": "Löschungsankündigung",
      "state": "Baden-Württemberg",
      "amtsgericht": "Amtsgericht Stuttgart",
      "registernummer": "HRB 750249",
      "registerart": "HRB",
      "company_name": "Phoenix Spirit GmbH",
      "company_seat": "Stuttgart",
      "details": "07.11.2025 (Bekanntmachungsdatum)\n\nBaden-Württemberg Amtsgericht Stuttgart HRB 750249\nLöschungsankündigung\n\nPhoenix Spirit GmbH\nGesellschaft mit beschränkter Haftung\nStuttgart\n\nDas Gericht beabsichtigt, die Gesellschaft wegen Vermögenslosigkeit im Handelsregister von Amts wegen nach § 394 FamFG zu löschen. Die Frist zur Geltendmachung eines Widerspruchs gegen die beabsichtigte Löschung ist auf zwei Monate ab Veröffentlichung bestimmt."
    },
    {
      "date": "2025-11-07",
      "id": "136611",
      "original_text": "Löschungsankündigung\nBaden-Württemberg Amtsgericht Stuttgart HRB 753045\nLuminology UG (haftungsbeschränkt) – Untergruppenbach",
      "type": "Löschungsankündigung",
      "state": "Baden-Württemberg",
      "amtsgericht": "Amtsgericht Stuttgart",
      "registernummer": "HRB 753045",
      "registerart": "HRB",
      "company_name": "Luminology UG (haftungsbeschränkt)",
      "company_seat": "Untergruppenbach",
      "details": "07.11.2025 (Bekanntmachungsdatum)\n\nBaden-Württemberg Amtsgericht Stuttgart HRB 753045\nLöschungsankündigung\n\nLuminology UG (haftungsbeschränkt)\nGesellschaft mit beschränkter Haftung\nUntergruppenbach\n\nDas Gericht beabsichtigt, die Gesellschaft wegen Vermögenslosigkeit im Handelsregister von Amts wegen nach § 394 FamFG zu löschen. Die Frist zur Geltendmachung eines Widerspruchs gegen die beabsichtigte Löschung ist auf zwei Monate ab Veröffentlichung bestimmt."
    },
    {
      "date": "2025-11-07",
      "id": "136612",
      "original_text": "Registerbekanntmachung nach dem Umwandlungsgesetz\nBerlin Amtsgericht Berlin (Charlottenburg) PR 130\nFacts & Files - Historisches Forschungsinstitut Berlin Drauschke - Schreiber Partnerschaftsgesellschaft - Archiv-, Geschichts- u. Literaturwissenschaftler – Berlin",
      "type": "Registerbekanntmachung nach dem Umwandlungsgesetz",
      "state": "Berlin",
      "amtsgericht": "Amtsgericht Berlin (Charlottenburg)",
      "registernummer": "PR 130",
      "registerart": "PR",
      "company_name": "Facts & Files - Historisches Forschungsinstitut Berlin Drauschke - Schreiber Partnerschaftsgesellschaft - Archiv-, Geschichts- u. Literaturwissenschaftler",
      "company_seat": "Berlin",
      "details": "07.11.2025 (Bekanntmachungsdatum)\n\nBerlin Amtsgericht Berlin (Charlottenburg) PR 130\nRegisterbekanntmachung nach dem Umwandlungsgesetz 06.11.2025 (Eintragungsdatum)\n\nFacts & Files - Historisches Forschungsinstitut Berlin Drauschke - Schreiber Partnerschaftsgesellschaft - Archiv-, Geschichts- u. Literaturwissenschaftler\nPartnerschaftsgesellschaft\nBerlin\n\nZu Eintragungsnummer 3 vom 06.11.2025 wird als nicht eingetragen veröffentlicht: Den Gläubigern ist, wenn sie binnen sechs Monaten nach dem Tag, an dem die Eintragung der Umwandlung als bekannt gemacht gilt, ihren Anspruch nach Grund und Höhe schriftlich anmelden, Sicherheit zu leisten, soweit sie nicht Befriedigung verlangen können. Dieses Recht steht den Gläubigern jedoch nur zu, wenn sie glaubhaft machen, dass durch die Umwandlung die Erfüllung ihrer Forderung gefährdet wird. Das Recht, Sicherheitsleistung zu verlangen, steht Gläubigern nicht zu, die im Falle der Insolvenz ein Recht auf vorzugsweise Befriedigung aus einer Deckungsmasse haben, die nach gesetzlicher Vorschrift zu ihrem Schutz errichtet und staatlich überwacht ist."
    },
    {
      "date": "2025-11-07",
      "id": "136613",
      "original_text": "Löschungsankündigung\nBaden-Württemberg Amtsgericht Stuttgart HRB 261690\nHeck GmbH – Berglen",
      "type": "Löschungsankündigung",
      "state": "Baden-Württemberg",
      "amtsgericht": "Amtsgericht Stuttgart",
      "registernummer": "HRB 261690",
      "registerart": "HRB",
      "company_name": "Heck GmbH",
      "company_seat": "Berglen",
      "details": "07.11.2025 (Bekanntmachungsdatum)\n\nBaden-Württemberg Amtsgericht Stuttgart HRB 261690\nLöschungsankündigung\n\nHeck GmbH\nGesellschaft mit beschränkter Haftung\nBerglen\n\nAls nicht eingetragen wird bekanntgemacht:Das Gericht beabsichtigt, die Gesellschaft wegen Vermögenslosigkeit im Handelsregister von Amts wegen nach § 394 FamFG zu löschen. Die Frist zur Geltendmachung eines Widerspruchs gegen die beabsichtigte Löschung ist auf zwei Monate ab Veröffentlichung bestimmt."
    },
    {
      "date": "2025-11-07",
      "id": "136614",
      "original_text": "Registerbekanntmachung nach dem Umwandlungsgesetz\nBerlin Amtsgericht Berlin (Charlottenburg) HRB 280958\nFacts & Files Historians GmbH – Berlin",
      "type": "Registerbekanntmachung nach dem Umwandlungsgesetz",
      "state": "Berlin",
      "amtsgericht": "Amtsgericht Berlin (Charlottenburg)",
      "registernummer": "HRB 280958",
      "registerart": "HRB",
      "company_name": "Facts & Files Historians GmbH",
      "company_seat": "Berlin",
      "details": "07.11.2025 (Bekanntmachungsdatum)\n\nBerlin Amtsgericht Berlin (Charlottenburg) HRB 280958\nRegisterbekanntmachung nach dem Umwandlungsgesetz 06.11.2025 (Eintragungsdatum)\n\nFacts & Files Historians GmbH\nGesellschaft mit beschränkter Haftung\nBerlin\n\nZu Eintragungsnummer 1 vom 06.11.2025 wird als nicht eingetragen veröffentlicht: Den Gläubigern ist, wenn sie binnen sechs Monaten nach dem Tag, an dem die Eintragung der Umwandlung als bekannt gemacht gilt, ihren Anspruch nach Grund und Höhe schriftlich anmelden, Sicherheit zu leisten, soweit sie nicht Befriedigung verlangen können. Dieses Recht steht den Gläubigern jedoch nur zu, wenn sie glaubhaft machen, dass durch die Umwandlung die Erfüllung ihrer Forderung gefährdet wird. Das Recht, Sicherheitsleistung zu verlangen, steht Gläubigern nicht zu, die im Falle der Insolvenz ein Recht auf vorzugsweise Befriedigung aus einer Deckungsmasse haben, die nach gesetzlicher Vorschrift zu ihrem Schutz errichtet und staatlich überwacht ist."
    },
    {
      "date": "2025-11-07",
      "id": "136615",
      "original_text": "Registerbekanntmachung nach dem Umwandlungsgesetz\nSchleswig-Holstein Amtsgericht Lübeck HRB 11680\nHomecare Partner GmbH – Bad Schwartau",
      "type": "Registerbekanntmachung nach dem Umwandlungsgesetz",
      "state": "Schleswig-Holstein",
      "amtsgericht": "Amtsgericht Lübeck",
      "registernummer": "HRB 11680",
      "registerart": "HRB",
      "company_name": "Homecare Partner GmbH",
      "company_seat": "Bad Schwartau",
      "details": "07.11.2025 (Bekanntmachungsdatum)\n\nSchleswig-Holstein Amtsgericht Lübeck HRB 11680\nRegisterbekanntmachung nach dem Umwandlungsgesetz 06.11.2025 (Eintragungsdatum)\n\nHomecare Partner GmbH\nGesellschaft mit beschränkter Haftung\nBad Schwartau\n\nZu Eintragungsnummer 12 vom 06.11.2025 wird als nicht eingetragen veröffentlicht:  Den Gläubigern der an der Verschmelzung beteiligten Rechtsträger ist, wenn sie binnen sechs Monaten nach dem Tag, an dem die Eintragung der Verschmelzung in das Register des Sitzes desjenigen Rechtsträgers, dessen Gläubiger sie sind, als bekannt gemacht gilt, ihren Anspruch nach Grund und Höhe schriftlich anmelden, Sicherheit zu leisten, soweit sie nicht Befriedigung verlangen können. Dieses Recht steht den Gläubigern jedoch nur zu, wenn sie glaubhaft machen, dass durch die Verschmelzung die Erfüllung ihrer Forderung gefährdet wird."
    },
    {
      "date": "2025-11-07",
      "id": "136616",
      "original_text": "Registerbekanntmachung nach dem Umwandlungsgesetz\nBrandenburg Amtsgericht Neuruppin HRB 8117\nPengalia Ship Management GmbH – Pritzwalk",
      "type": "Registerbekanntmachung nach dem Umwandlungsgesetz",
      "state": "Brandenburg",
      "amtsgericht": "Amtsgericht Neuruppin",
      "registernummer": "HRB 8117",
      "registerart": "HRB",
      "company_name": "Pengalia Ship Management GmbH",
      "company_seat": "Pritzwalk",
      "details": "07.11.2025 (Bekanntmachungsdatum)\n\nBrandenburg Amtsgericht Neuruppin HRB 8117\nRegisterbekanntmachung nach dem Umwandlungsgesetz 06.11.2025 (Eintragungsdatum)\n\nPengalia Ship Management GmbH\nGesellschaft mit beschränkter Haftung\nPritzwalk\n\nZu Eintragungsnummer 25 vom 06.11.2025 wird als nicht eingetragen veröffentlicht:\nDen Gläubigern der an der Umwandlung beteiligten Rechtsträger ist, wenn sie binnen sechs Monaten nach dem Tag, an dem die Eintragung der Umwandlung in das Register des Sitzes desjenigen Rechtsträgers, dessen Gläubiger sie sind, als bekannt gemacht gilt, ihren Anspruch nach Grund und Höhe schriftlich anmelden, Sicherheit zu leisten, soweit sie nicht Befriedigung verlangen können. Dieses Recht steht den Gläubigern jedoch nur zu, wenn sie glaubhaft machen, dass durch die Umwandlung die Erfüllung ihrer Forderung gefährdet wird"
    },
    {
      "date": "2025-11-07",
      "id": "136617",
      "original_text": "Registerbekanntmachung nach dem Umwandlungsgesetz\nBaden-Württemberg Amtsgericht Mannheim HRA 712867\nFrankfurter Wohnwerte GmbH & Co. KG – Heidelberg",
      "type": "Registerbekanntmachung nach dem Umwandlungsgesetz",
      "state": "Baden-Württemberg",
      "amtsgericht": "Amtsgericht Mannheim",
      "registernummer": "HRA 712867",
      "registerart": "HRA",
      "company_name": "Frankfurter Wohnwerte GmbH & Co. KG",
      "company_seat": "Heidelberg",
      "details": "07.11.2025 (Bekanntmachungsdatum)\n\nBaden-Württemberg Amtsgericht Mannheim HRA 712867\nRegisterbekanntmachung nach dem Umwandlungsgesetz 07.11.2025 (Eintragungsdatum)\n\nFrankfurter Wohnwerte GmbH & Co. KG\nKommanditgesellschaft\nHeidelberg\n\nDen Gläubigern der an der Verschmelzung beteiligten Rechtsträger ist, wenn sie binnen sechs Monaten nach dem Tag, an dem die Eintragung der Verschmelzung in das Register des Sitzes desjenigen Rechtsträgers, dessen Gläubiger sie sind, nach § 19 Abs. 3 UmwG als bekanntgemacht gilt, ihren Anspruch nach Grund und Höhe schriftlich anmelden, Sicherheit zu leisten, soweit sie nicht Befriedigung verlangen können. Dieses Recht steht den Gläubigern jedoch nur zu, wenn sie glaubhaft machen, dass durch die Verschmelzung die Erfüllung ihrer Forderung gefährdet wird."
    },
    {
      "date": "2025-11-07",
      "id": "136618",
      "original_text": "Registerbekanntmachung nach dem Umwandlungsgesetz\nBerlin Amtsgericht Berlin (Charlottenburg) HRB 231762\nMindgreen UG (haftungsbeschränkt) – Berlin",
      "type": "Registerbekanntmachung nach dem Umwandlungsgesetz",
      "state": "Berlin",
      "amtsgericht": "Amtsgericht Berlin (Charlottenburg)",
      "registernummer": "HRB 231762",
      "registerart": "HRB",
      "company_name": "Mindgreen UG (haftungsbeschränkt)",
      "company_seat": "Berlin",
      "details": "07.11.2025 (Bekanntmachungsdatum)\n\nBerlin Amtsgericht Berlin (Charlottenburg) HRB 231762\nRegisterbekanntmachung nach dem Umwandlungsgesetz 07.11.2025 (Eintragungsdatum)\n\nMindgreen UG (haftungsbeschränkt)\nGesellschaft mit beschränkter Haftung\nBerlin\n\nZu Eintragungsnummer 2 vom 07.11.2025 wird als nicht eingetragen veröffentlicht: Den Gläubigern der an der Verschmelzung beteiligten Rechtsträger ist, wenn sie binnen sechs Monaten nach dem Tag, an dem die Eintragung der Verschmelzung in das Register des Sitzes desjenigen Rechtsträgers, dessen Gläubiger sie sind, als bekannt gemacht gilt, ihren Anspruch nach Grund und Höhe schriftlich anmelden, Sicherheit zu leisten, soweit sie nicht Befriedigung verlangen können. Dieses Recht steht den Gläubigern jedoch nur zu, wenn sie glaubhaft machen, dass durch die Verschmelzung die Erfüllung ihrer Forderung gefährdet wird. Das Recht, Sicherheitsleistung zu verlangen, steht Gläubigern nicht zu, die im Falle der Insolvenz ein Recht auf vorzugsweise Befriedigung aus einer Deckungsmasse haben, die nach gesetzlicher Vorschrift zu ihrem Schutz errichtet und staatlich überwacht ist."
    },
    {
      "date": "2025-11-07",
      "id": "136619",
      "original_text": "Sonstige Registerbekanntmachung\nHamburg Amtsgericht Hamburg HRB 132927\nRegionalwert AG Hamburg – Hamburg",
      "type": "Sonstige Registerbekanntmachung",
      "state": "Hamburg",
      "amtsgericht": "Amtsgericht Hamburg",
      "registernummer": "HRB 132927",
      "registerart": "HRB",
      "company_name": "Regionalwert AG Hamburg",
      "company_seat": "Hamburg",
      "details": "07.11.2025 (Bekanntmachungsdatum)\n\nHamburg Amtsgericht Hamburg HRB 132927\nSonstige Registerbekanntmachung\n\nRegionalwert AG Hamburg\nAktiengesellschaft\nHamburg\n\nAls nicht eingetragen wird bekannt gemacht: Liste des Aufsichtsrats wurde eingereicht."
    },
    {
      "date": "2025-11-07",
      "id": "136620",
      "original_text": "Sonstige Registerbekanntmachung\nHamburg Amtsgericht Hamburg HRB 191406\nCircle Eleven Invest GmbH – Hamburg",
      "type": "Sonstige Registerbekanntmachung",
      "state": "Hamburg",
      "amtsgericht": "Amtsgericht Hamburg",
      "registernummer": "HRB 191406",
      "registerart": "HRB",
      "company_name": "Circle Eleven Invest GmbH",
      "company_seat": "Hamburg",
      "details": "07.11.2025 (Bekanntmachungsdatum)\n\nHamburg Amtsgericht Hamburg HRB 191406\nSonstige Registerbekanntmachung 07.11.2025 (Eintragungsdatum)\n\nCircle Eleven Invest GmbH\nGesellschaft mit beschränkter Haftung\nHamburg\n\nAls nicht eingetragen wird bekannt gemacht: Liste des Aufsichtsrats wurde eingereicht."
    },
    {
      "date": "2025-11-07",
      "id": "136621",
      "original_text": "Registerbekanntmachung nach dem Umwandlungsgesetz\nBaden-Württemberg Amtsgericht Mannheim HRA 709634\nMannheimer Wohnwerte Spinelli GmbH & Co. KG – Heidelberg",
      "type": "Registerbekanntmachung nach dem Umwandlungsgesetz",
      "state": "Baden-Württemberg",
      "amtsgericht": "Amtsgericht Mannheim",
      "registernummer": "HRA 709634",
      "registerart": "HRA",
      "company_name": "Mannheimer Wohnwerte Spinelli GmbH & Co. KG",
      "company_seat": "Heidelberg",
      "details": "07.11.2025 (Bekanntmachungsdatum)\n\nBaden-Württemberg Amtsgericht Mannheim HRA 709634\nRegisterbekanntmachung nach dem Umwandlungsgesetz 07.11.2025 (Eintragungsdatum)\n\nMannheimer Wohnwerte Spinelli GmbH & Co. KG\nKommanditgesellschaft\nHeidelberg\n\nDen Gläubigern der an der Verschmelzung beteiligten Rechtsträger ist, wenn sie binnen sechs Monaten nach dem Tag, an dem die Eintragung der Verschmelzung in das Register des Sitzes desjenigen Rechtsträgers, dessen Gläubiger sie sind, nach § 19 Abs. 3 UmwG als bekanntgemacht gilt, ihren Anspruch nach Grund und Höhe schriftlich anmelden, Sicherheit zu leisten, soweit sie nicht Befriedigung verlangen können. Dieses Recht steht den Gläubigern jedoch nur zu, wenn sie glaubhaft machen, dass durch die Verschmelzung die Erfüllung ihrer Forderung gefährdet wird."
    },
    {
      "date": "2025-11-07",
      "id": "136622",
      "original_text": "Einreichung neuer Dokumente\nSachsen-Anhalt Amtsgericht Stendal HRB 207312\nStadtwerke Hettstedt GmbH – Hettstedt",
      "type": "Einreichung neuer Dokumente",
      "state": "Sachsen-Anhalt",
      "amtsgericht": "Amtsgericht Stendal",
      "registernummer": "HRB 207312",
      "registerart": "HRB",
      "company_name": "Stadtwerke Hettstedt GmbH",
      "company_seat": "Hettstedt",
      "details": "07.11.2025 (Bekanntmachungsdatum)\n\nSachsen-Anhalt Amtsgericht Stendal HRB 207312\nEinreichung neuer Dokumente\n\nStadtwerke Hettstedt GmbH\nGesellschaft mit beschränkter Haftung\nHettstedt\n\nEine Liste der Mitglieder des Aufsichtsrates wurde zum Handelsregister eingereicht."
    },
    {
      "date": "2025-11-07",
      "id": "136623",
      "original_text": "Sonstige Registerbekanntmachung\nHamburg Amtsgericht Hamburg HRB 1787\nBeiersdorf Aktiengesellschaft – Hamburg",
      "type": "Sonstige Registerbekanntmachung",
      "state": "Hamburg",
      "amtsgericht": "Amtsgericht Hamburg",
      "registernummer": "HRB 1787",
      "registerart": "HRB",
      "company_name": "Beiersdorf Aktiengesellschaft",
      "company_seat": "Hamburg",
      "details": "07.11.2025 (Bekanntmachungsdatum)\n\nHamburg Amtsgericht Hamburg HRB 1787\nSonstige Registerbekanntmachung 07.11.2025 (Eintragungsdatum)\n\nBeiersdorf Aktiengesellschaft\nAktiengesellschaft\nHamburg\n\nGläubiger, deren Forderungen begründet worden sind, bevor die Eintragung der Kapitalherabsetzung bekanntgemacht worden ist, haben das Recht, Sicherheit zu verlangen, soweit sie nicht Befriedigung verlangen können, wenn sie sich binnen sechs Monaten nach der Bekanntmachung der Kapitalherabsetzung zu diesem Zweck melden."
    },
    {
      "date": "2025-11-07",
      "id": "136624",
      "original_text": "Löschungsankündigung\nBerlin Amtsgericht Berlin (Charlottenburg) HRB 168981\nRampante UG (haftungsbeschränkt) – Berlin",
      "type": "Löschungsankündigung",
      "state": "Berlin",
      "amtsgericht": "Amtsgericht Berlin (Charlottenburg)",
      "registernummer": "HRB 168981",
      "registerart": "HRB",
      "company_name": "Rampante UG (haftungsbeschränkt)",
      "company_seat": "Berlin",
      "details": "07.11.2025 (Bekanntmachungsdatum)\n\nBerlin Amtsgericht Berlin (Charlottenburg) HRB 168981\nLöschungsankündigung\n\nRampante UG (haftungsbeschränkt)\nGesellschaft mit beschränkter Haftung\nBerlin\n\nBei der nachstehenden Gesellschaft wird das Amtslöschungsverfahren gemäß § 394 FamFG eingeleitet. Widerspruchsfrist 6 Wochen"
    },
    {
      "date": "2025-11-07",
      "id": "136625",
      "original_text": "Löschungsankündigung\nBerlin Amtsgericht Berlin (Charlottenburg) HRA 52718\nLandwirtschaftsgesellschaft Letschin mbH & Co. KG – Berlin",
      "type": "Löschungsankündigung",
      "state": "Berlin",
      "amtsgericht": "Amtsgericht Berlin (Charlottenburg)",
      "registernummer": "HRA 52718",
      "registerart": "HRA",
      "company_name": "Landwirtschaftsgesellschaft Letschin mbH & Co. KG",
      "company_seat": "Berlin",
      "details": "07.11.2025 (Bekanntmachungsdatum)\n\nBerlin Amtsgericht Berlin (Charlottenburg) HRA 52718\nLöschungsankündigung\n\nLandwirtschaftsgesellschaft Letschin mbH & Co. KG\nKommanditgesellschaft\nBerlin\n\nBei dem nachstehenden Unternehmen / der nachstehenden Gesellschaft wird das Amtslöschungsverfahren gemäß § 31 Abs. 2 HGB eingeleitet. Widerspruchsfrist 1 Monat"
    },
    {
      "date": "2025-11-07",
      "id": "136626",
      "original_text": "Sonstige Registerbekanntmachung\nSachsen-Anhalt Amtsgericht Stendal GnR 1045\nWohnungsgenossenschaft Annaburg- Prettin e.G. – Annaburg",
      "type": "Sonstige Registerbekanntmachung",
      "state": "Sachsen-Anhalt",
      "amtsgericht": "Amtsgericht Stendal",
      "registernummer": "GnR 1045",
      "registerart": "GnR",
      "company_name": "Wohnungsgenossenschaft Annaburg- Prettin e.G.",
      "company_seat": "Annaburg",
      "details": "07.11.2025 (Bekanntmachungsdatum)\n\nSachsen-Anhalt Amtsgericht Stendal GnR 1045\nSonstige Registerbekanntmachung 07.11.2025 (Eintragungsdatum)\n\nWohnungsgenossenschaft Annaburg- Prettin e.G.\neingetragene Genossenschaft\nAnnaburg\n\nDurch Beschluss der Genossenschaftsversammlung vom 26.06.2025 wurde im Rahmen der Neufassung der Satzung die Nachschusspflicht gem. § 22a GenG. aufgehoben.\nDie Satzungsneufassung wurde am 07.11.2025 in das Genossenschaftsregister eingetragen.\n\nAls nicht eingetragen wird veröffentlicht:\n\nDen Gläubigern der Genossenschaft ist, wenn sie sich binnen 6 Monaten nach der Bekanntmachung bei der Genossenschaft zu diesem Zweck melden, Sicherheit zu leisten, soweit sie nicht Befriedigung verlangen können (§ 22 Abs. 1 bis 3 GenG)."
    },
    {
      "date": "2025-11-07",
      "id": "136627",
      "original_text": "Sonstige Registerbekanntmachung\nHamburg Amtsgericht Hamburg HRB 19695\nArbeiter-Samariter-Bund Sozialeinrichtungen (Hamburg) GmbH – Hamburg",
      "type": "Sonstige Registerbekanntmachung",
      "state": "Hamburg",
      "amtsgericht": "Amtsgericht Hamburg",
      "registernummer": "HRB 19695",
      "registerart": "HRB",
      "company_name": "Arbeiter-Samariter-Bund Sozialeinrichtungen (Hamburg) GmbH",
      "company_seat": "Hamburg",
      "details": "07.11.2025 (Bekanntmachungsdatum)\n\nHamburg Amtsgericht Hamburg HRB 19695\nSonstige Registerbekanntmachung 07.11.2025 (Eintragungsdatum)\n\nArbeiter-Samariter-Bund Sozialeinrichtungen (Hamburg) GmbH\nGesellschaft mit beschränkter Haftung\nHamburg\n\nAls nicht eingetragen wird bekannt gemacht: Liste des Aufsichtsrats wurde eingereicht."
    },
    {
      "date": "2025-11-07",
      "id": "136628",
      "original_text": "Registerbekanntmachung nach dem Umwandlungsgesetz\nHamburg Amtsgericht Hamburg HRB 66210\nBeTeG GmbH – Hamburg",
      "type": "Registerbekanntmachung nach dem Umwandlungsgesetz",
      "state": "Hamburg",
      "amtsgericht": "Amtsgericht Hamburg",
      "registernummer": "HRB 66210",
      "registerart": "HRB",
      "company_name": "BeTeG GmbH",
      "company_seat": "Hamburg",
      "details": "07.11.2025 (Bekanntmachungsdatum)\n\nHamburg Amtsgericht Hamburg HRB 66210\nRegisterbekanntmachung nach dem Umwandlungsgesetz 07.11.2025 (Eintragungsdatum)\n\nBeTeG GmbH\nGesellschaft mit beschränkter Haftung\nHamburg\n\nAls nicht eingetragen wird bekannt gemacht:\nDen Gläubigern der an der Verschmelzung beteiligten Gesellschaften ist, wenn sie binnen sechs Monaten nach dem Tag, an dem die Eintragung der Verschmelzung in das Register des Sitzes desjenigen Rechtsträgers, dessen Gläubiger sie sind, nach § 19 Absatz 3 UmwG als bekannt gemacht gilt, ihren Anspruch nach Grund und Höhe schriftlich anmelden, Sicherheit zu leisten, soweit sie nicht Befriedigung verlangen können. Dieses Recht steht den Gläubigern jedoch nur zu, wenn sie glaubhaft machen, dass durch die Verschmelzung die Erfüllung ihrer Forderung gefährdet wird."
    },
    {
      "date": "2025-11-07",
      "id": "136629",
      "original_text": "Einreichung neuer Dokumente\nHamburg Amtsgericht Hamburg HRB 16435\nAsklepios Westklinikum Hamburg GmbH – Hamburg",
      "type": "Einreichung neuer Dokumente",
      "state": "Hamburg",
      "amtsgericht": "Amtsgericht Hamburg",
      "registernummer": "HRB 16435",
      "registerart": "HRB",
      "company_name": "Asklepios Westklinikum Hamburg GmbH",
      "company_seat": "Hamburg",
      "details": "07.11.2025 (Bekanntmachungsdatum)\n\nHamburg Amtsgericht Hamburg HRB 16435\nEinreichung neuer Dokumente\n\nAsklepios Westklinikum Hamburg GmbH\nGesellschaft mit beschränkter Haftung\nHamburg\n\nAls nicht eingetragen wird bekannt gemacht: Liste des Aufsichtsrats wurde eingereicht."
    },
    {
      "date": "2025-11-07",
      "id": "136630",
      "original_text": "Löschungsankündigung\nBerlin Amtsgericht Berlin (Charlottenburg) HRB 213396\nFlying Cars & Security GmbH – Berlin",
      "type": "Löschungsankündigung",
      "state": "Berlin",
      "amtsgericht": "Amtsgericht Berlin (Charlottenburg)",
      "registernummer": "HRB 213396",
      "registerart": "HRB",
      "company_name": "Flying Cars & Security GmbH",
      "company_seat": "Berlin",
      "details": "07.11.2025 (Bekanntmachungsdatum)\n\nBerlin Amtsgericht Berlin (Charlottenburg) HRB 213396\nLöschungsankündigung\n\nFlying Cars & Security GmbH\nGesellschaft mit beschränkter Haftung\nBerlin\n\nBei der nachstehenden Gesellschaft wird das Amtslöschungsverfahren gemäß § 394 FamFG eingeleitet. Widerspruchsfrist 6 Wochen"
    },
    {
      "date": "2025-11-07",
      "id": "136631",
      "original_text": "Löschungsankündigung\nBerlin Amtsgericht Berlin (Charlottenburg) HRB 191025\nArya Immobilien GmbH – Berlin",
      "type": "Löschungsankündigung",
      "state": "Berlin",
      "amtsgericht": "Amtsgericht Berlin (Charlottenburg)",
      "registernummer": "HRB 191025",
      "registerart": "HRB",
      "company_name": "Arya Immobilien GmbH",
      "company_seat": "Berlin",
      "details": "07.11.2025 (Bekanntmachungsdatum)\n\nBerlin Amtsgericht Berlin (Charlottenburg) HRB 191025\nLöschungsankündigung\n\nArya Immobilien GmbH\nGesellschaft mit beschränkter Haftung\nBerlin\n\nBei der nachstehenden Gesellschaft wird das Amtslöschungsverfahren gemäß § 394 FamFG eingeleitet. Widerspruchsfrist 6 Wochen"
    },
    {
      "date": "2025-11-07",
      "id": "136632",
      "original_text": "Löschungsankündigung\nBerlin Amtsgericht Berlin (Charlottenburg) HRB 265026\nVegane Marianne UG (haftungsbeschränkt) – Berlin",
      "type": "Löschungsankündigung",
      "state": "Berlin",
      "amtsgericht": "Amtsgericht Berlin (Charlottenburg)",
      "registernummer": "HRB 265026",
      "registerart": "HRB",
      "company_name": "Vegane Marianne UG (haftungsbeschränkt)",
      "company_seat": "Berlin",
      "details": "07.11.2025 (Bekanntmachungsdatum)\n\nBerlin Amtsgericht Berlin (Charlottenburg) HRB 265026\nLöschungsankündigung\n\nVegane Marianne UG (haftungsbeschränkt)\nGesellschaft mit beschränkter Haftung\nBerlin\n\nBei der nachstehenden Gesellschaft wird das Amtslöschungsverfahren gemäß § 394 FamFG eingeleitet. Widerspruchsfrist 6 Wochen"
    },
    {
      "date": "2025-11-07",
      "id": "136633",
      "original_text": "Löschungsankündigung\nBerlin Amtsgericht Berlin (Charlottenburg) HRB 205125\nunique trip GmbH – Berlin",
      "type": "Löschungsankündigung",
      "state": "Berlin",
      "amtsgericht": "Amtsgericht Berlin (Charlottenburg)",
      "registernummer": "HRB 205125",
      "registerart": "HRB",
      "company_name": "unique trip GmbH",
      "company_seat": "Berlin",
      "details": "07.11.2025 (Bekanntmachungsdatum)\n\nBerlin Amtsgericht Berlin (Charlottenburg) HRB 205125\nLöschungsankündigung\n\nunique trip GmbH\nGesellschaft mit beschränkter Haftung\nBerlin\n\nBei der nachstehenden Gesellschaft wird das Amtslöschungsverfahren gemäß § 394 FamFG eingeleitet. Widerspruchsfrist 6 Wochen"
    },
    {
      "date": "2025-11-07",
      "id": "136634",
      "original_text": "Löschungsankündigung\nBaden-Württemberg Amtsgericht Mannheim HRB 741052\nL+F Gebäudetechnik GmbH – Pforzheim",
      "type": "Löschungsankündigung",
      "state": "Baden-Württemberg",
      "amtsgericht": "Amtsgericht Mannheim",
      "registernummer": "HRB 741052",
      "registerart": "HRB",
      "company_name": "L+F Gebäudetechnik GmbH",
      "company_seat": "Pforzheim",
      "details": "07.11.2025 (Bekanntmachungsdatum)\n\nBaden-Württemberg Amtsgericht Mannheim HRB 741052\nLöschungsankündigung\n\nL+F Gebäudetechnik GmbH\nGesellschaft mit beschränkter Haftung\nPforzheim\n\nDas Gericht beabsichtigt, die Gesellschaft wegen Vermögenslosigkeit im Handelsregister von Amts wegen nach § 394 FamFG zu löschen. Die Frist zur Geltendmachung eines Widerspruchs gegen die beabsichtigte Löschung ist auf einen Monat ab Veröffentlichung bestimmt."
    },
    {
      "date": "2025-11-07",
      "id": "136635",
      "original_text": "Registerbekanntmachung nach dem Umwandlungsgesetz\nHamburg Amtsgericht Hamburg HRB 180063\nSwiss Climate EcoServ GmbH – Hamburg",
      "type": "Registerbekanntmachung nach dem Umwandlungsgesetz",
      "state": "Hamburg",
      "amtsgericht": "Amtsgericht Hamburg",
      "registernummer": "HRB 180063",
      "registerart": "HRB",
      "company_name": "Swiss Climate EcoServ GmbH",
      "company_seat": "Hamburg",
      "details": "07.11.2025 (Bekanntmachungsdatum)\n\nHamburg Amtsgericht Hamburg HRB 180063\nRegisterbekanntmachung nach dem Umwandlungsgesetz 07.11.2025 (Eintragungsdatum)\n\nSwiss Climate EcoServ GmbH\nGesellschaft mit beschränkter Haftung\nHamburg\n\nAls nicht eingetragen wird bekannt gemacht:\nDen Gläubigern der an der Verschmelzung beteiligten Gesellschaften ist, wenn sie binnen sechs Monaten nach dem Tag, an dem die Eintragung der Verschmelzung in das Register des Sitzes desjenigen Rechtsträgers, dessen Gläubiger sie sind, nach § 19 Absatz 3 UmwG als bekannt gemacht gilt, ihren Anspruch nach Grund und Höhe schriftlich anmelden, Sicherheit zu leisten, soweit sie nicht Befriedigung verlangen können. Dieses Recht steht den Gläubigern jedoch nur zu, wenn sie glaubhaft machen, dass durch die Verschmelzung die Erfüllung ihrer Forderung gefährdet wird."
    },
    {
      "date": "2025-11-07",
      "id": "136636",
      "original_text": "Registerbekanntmachung nach dem Umwandlungsgesetz\nHamburg Amtsgericht Hamburg HRB 77140\nHerberg Systems GmbH – Hamburg",
      "type": "Registerbekanntmachung nach dem Umwandlungsgesetz",
      "state": "Hamburg",
      "amtsgericht": "Amtsgericht Hamburg",
      "registernummer": "HRB 77140",
      "registerart": "HRB",
      "company_name": "Herberg Systems GmbH",
      "company_seat": "Hamburg",
      "details": "07.11.2025 (Bekanntmachungsdatum)\n\nHamburg Amtsgericht Hamburg HRB 77140\nRegisterbekanntmachung nach dem Umwandlungsgesetz 07.11.2025 (Eintragungsdatum)\n\nHerberg Systems GmbH\nGesellschaft mit beschränkter Haftung\nHamburg\n\nAls nicht eingetragen wird bekannt gemacht:\nDen Gläubigern der an der Verschmelzung beteiligten Gesellschaften ist, wenn sie binnen sechs Monaten nach dem Tag, an dem die Eintragung der Verschmelzung in das Register des Sitzes desjenigen Rechtsträgers, dessen Gläubiger sie sind, nach § 19 Absatz 3 UmwG als bekannt gemacht gilt, ihren Anspruch nach Grund und Höhe schriftlich anmelden, Sicherheit zu leisten, soweit sie nicht Befriedigung verlangen können. Dieses Recht steht den Gläubigern jedoch nur zu, wenn sie glaubhaft machen, dass durch die Verschmelzung die Erfüllung ihrer Forderung gefährdet wird."
    },
    {
      "date": "2025-11-07",
      "id": "136637",
      "original_text": "Löschungsankündigung\nBerlin Amtsgericht Berlin (Charlottenburg) HRB 175378\n\"Segelzahn\" Design + Raumgestaltung UG (haftungsbeschränkt) – Berlin",
      "type": "Löschungsankündigung",
      "state": "Berlin",
      "amtsgericht": "Amtsgericht Berlin (Charlottenburg)",
      "registernummer": "HRB 175378",
      "registerart": "HRB",
      "company_name": "\"Segelzahn\" Design + Raumgestaltung UG (haftungsbeschränkt)",
      "company_seat": "Berlin",
      "details": "07.11.2025 (Bekanntmachungsdatum)\n\nBerlin Amtsgericht Berlin (Charlottenburg) HRB 175378\nLöschungsankündigung\n\n\"Segelzahn\" Design + Raumgestaltung UG (haftungsbeschränkt)\nGesellschaft mit beschränkter Haftung\nBerlin\n\nBei der nachstehenden Gesellschaft wird das Amtslöschungsverfahren gemäß § 394 FamFG eingeleitet. Widerspruchsfrist 6 Wochen"
    },
    {
      "date": "2025-11-07",
      "id": "136638",
      "original_text": "Registerbekanntmachung nach dem Umwandlungsgesetz\nSaarland Amtsgericht Saarbrücken HRB 111115\nManuel Schmitt IT GmbH – St. Wendel",
      "type": "Registerbekanntmachung nach dem Umwandlungsgesetz",
      "state": "Saarland",
      "amtsgericht": "Amtsgericht Saarbrücken",
      "registernummer": "HRB 111115",
      "registerart": "HRB",
      "company_name": "Manuel Schmitt IT GmbH",
      "company_seat": "St. Wendel",
      "details": "07.11.2025 (Bekanntmachungsdatum)\n\nSaarland Amtsgericht Saarbrücken HRB 111115\nRegisterbekanntmachung nach dem Umwandlungsgesetz 07.11.2025 (Eintragungsdatum)\n\nManuel Schmitt IT GmbH\nGesellschaft mit beschränkter Haftung\nSt. Wendel\n\nAls nicht eingetragen wird bekannt gemacht: Den Gläubigern der an der Verschmelzung beteiligten Gesellschaften ist, wenn sie binnen sechs Monaten nach dem Tag, an dem die Eintragung der Verschmelzung in das Register des Sitzes desjenigen Rechtsträgers, dessen Gläubiger sie sind, nach § 19 Absatz 3 UmwG bekannt gemacht worden ist, ihren Anspruch nach Grund und Höhe schriftlich anmelden, Sicherheit zu leisten, soweit sie nicht Befriedigung verlangen können. Dieses Recht steht den Gläubigern jedoch nur zu, wenn sie glaubhaft machen, dass durch die Verschmelzung die Erfüllung ihrer Forderung gefährdet wird."
    },
    {
      "date": "2025-11-07",
      "id": "136639",
      "original_text": "Registerbekanntmachung nach dem Umwandlungsgesetz\nSachsen-Anhalt Amtsgericht Stendal HRB 21439\nKSG Beteiligungsgesellschaft mbH – Magdeburg",
      "type": "Registerbekanntmachung nach dem Umwandlungsgesetz",
      "state": "Sachsen-Anhalt",
      "amtsgericht": "Amtsgericht Stendal",
      "registernummer": "HRB 21439",
      "registerart": "HRB",
      "company_name": "KSG Beteiligungsgesellschaft mbH",
      "company_seat": "Magdeburg",
      "details": "07.11.2025 (Bekanntmachungsdatum)\n\nSachsen-Anhalt Amtsgericht Stendal HRB 21439\nRegisterbekanntmachung nach dem Umwandlungsgesetz 07.11.2025 (Eintragungsdatum)\n\nKSG Beteiligungsgesellschaft mbH\nGesellschaft mit beschränkter Haftung\nMagdeburg\n\nNicht eingetragen:\nDen Gläubigern der an der Verschmelzung beteiligten Rechtsträger ist, wenn sie binnen sechs Monaten nach dem Tag, an dem die Eintragung der Verschmelzung nach § 19 Abs. 3 UmwG als bekanntgemacht gilt, ihren Anspruch nach Grund und Höhe schriftlich anmelden, Sicherheit zu leisten, soweit sie nicht Befriedigung verlangen können. Dieses Recht steht ihnen jedoch nur zu, wenn sie glaubhaft machen, dass durch die Verschmelzung die Erfüllung ihrer Forderung gefährdet wird."
    },
    {
      "date": "2025-11-07",
      "id": "136640",
      "original_text": "Registerbekanntmachung nach dem Umwandlungsgesetz\nBaden-Württemberg Amtsgericht Stuttgart HRB 14562\nIBM Deutschland GmbH – Ehningen",
      "type": "Registerbekanntmachung nach dem Umwandlungsgesetz",
      "state": "Baden-Württemberg",
      "amtsgericht": "Amtsgericht Stuttgart",
      "registernummer": "HRB 14562",
      "registerart": "HRB",
      "company_name": "IBM Deutschland GmbH",
      "company_seat": "Ehningen",
      "details": "07.11.2025 (Bekanntmachungsdatum)\n\nBaden-Württemberg Amtsgericht Stuttgart HRB 14562\nRegisterbekanntmachung nach dem Umwandlungsgesetz 07.11.2025 (Eintragungsdatum)\n\nIBM Deutschland GmbH\nGesellschaft mit beschränkter Haftung\nEhningen\n\nAls nicht eingetragen wird bekanntgemacht:\nDen Gläubigern der an der Verschmelzung beteiligten Rechtsträger ist, wenn sie binnen sechs Monaten nach dem Tag, an dem die Eintragung der Verschmelzung in das Register des Sitzes desjenigen Rechtsträgers, dessen Gläubiger sie sind, nach § 19 Abs. 3 UmwG als bekanntgemacht gilt, ihren Anspruch nach Grund und Höhe schriftlich anmelden, Sicherheit zu leisten, soweit sie nicht Befriedigung verlangen können. Dieses Recht steht den Gläubigern jedoch nur zu, wenn sie glaubhaft machen, dass durch die Verschmelzung die Erfüllung ihrer Forderung gefährdet wird."
    },
    {
      "date": "2025-11-07",
      "id": "136641",
      "original_text": "Registerbekanntmachung nach dem Umwandlungsgesetz\nSaarland Amtsgericht Saarbrücken HRB 19076\nmanitu GmbH – St. Wendel",
      "type": "Registerbekanntmachung nach dem Umwandlungsgesetz",
      "state": "Saarland",
      "amtsgericht": "Amtsgericht Saarbrücken",
      "registernummer": "HRB 19076",
      "registerart": "HRB",
      "company_name": "manitu GmbH",
      "company_seat": "St. Wendel",
      "details": "07.11.2025 (Bekanntmachungsdatum)\n\nSaarland Amtsgericht Saarbrücken HRB 19076\nRegisterbekanntmachung nach dem Umwandlungsgesetz 07.11.2025 (Eintragungsdatum)\n\nmanitu GmbH\nGesellschaft mit beschränkter Haftung\nSt. Wendel\n\nAls nicht eingetragen wird bekannt gemacht: Den Gläubigern der an der Verschmelzung beteiligten Gesellschaften ist, wenn sie binnen sechs Monaten nach dem Tag, an dem die Eintragung der Verschmelzung in das Register des Sitzes desjenigen Rechtsträgers, dessen Gläubiger sie sind, nach § 19 Absatz 3 UmwG bekannt gemacht worden ist, ihren Anspruch nach Grund und Höhe schriftlich anmelden, Sicherheit zu leisten, soweit sie nicht Befriedigung verlangen können. Dieses Recht steht den Gläubigern jedoch nur zu, wenn sie glaubhaft machen, dass durch die Verschmelzung die Erfüllung ihrer Forderung gefährdet wird."
    },
    {
      "date": "2025-11-07",
      "id": "136642",
      "original_text": "Registerbekanntmachung nach dem Umwandlungsgesetz\nBrandenburg Amtsgericht Neuruppin HRA 1602\nENERTRAG Windfeld Kleisthöhe Spitzer Berg GmbH & Co. KG – Schenkenberg",
      "type": "Registerbekanntmachung nach dem Umwandlungsgesetz",
      "state": "Brandenburg",
      "amtsgericht": "Amtsgericht Neuruppin",
      "registernummer": "HRA 1602",
      "registerart": "HRA",
      "company_name": "ENERTRAG Windfeld Kleisthöhe Spitzer Berg GmbH & Co. KG",
      "company_seat": "Schenkenberg",
      "details": "07.11.2025 (Bekanntmachungsdatum)\n\nBrandenburg Amtsgericht Neuruppin HRA 1602\nRegisterbekanntmachung nach dem Umwandlungsgesetz 07.11.2025 (Eintragungsdatum)\n\nENERTRAG Windfeld Kleisthöhe Spitzer Berg GmbH & Co. KG\nKommanditgesellschaft\nSchenkenberg\n\nZu Eintragungsnummer 6 vom 07.11.2025 wird als nicht eingetragen veröffentlicht:\nDen Gläubigern der an der Umwandlung beteiligten Rechtsträger ist, wenn sie binnen sechs Monaten nach dem Tag, an dem die Eintragung der Umwandlung in das Register des Sitzes desjenigen Rechtsträgers, dessen Gläubiger sie sind, als bekannt gemacht gilt, ihren Anspruch nach Grund und Höhe schriftlich anmelden, Sicherheit zu leisten, soweit sie nicht Befriedigung verlangen können. Dieses Recht steht den Gläubigern jedoch nur zu, wenn sie glaubhaft machen, dass durch die Umwandlung die Erfüllung ihrer Forderung gefährdet wird"
    },
    {
      "date": "2025-11-07",
      "id": "136643",
      "original_text": "Einreichung neuer Dokumente\nBaden-Württemberg Amtsgericht Freiburg HRB 381792\nBHS Städtebau Bodensee/Hegau GmbH – Konstanz",
      "type": "Einreichung neuer Dokumente",
      "state": "Baden-Württemberg",
      "amtsgericht": "Amtsgericht Freiburg",
      "registernummer": "HRB 381792",
      "registerart": "HRB",
      "company_name": "BHS Städtebau Bodensee/Hegau GmbH",
      "company_seat": "Konstanz",
      "details": "07.11.2025 (Bekanntmachungsdatum)\n\nBaden-Württemberg Amtsgericht Freiburg HRB 381792\nEinreichung neuer Dokumente 07.11.2025 (Eintragungsdatum)\n\nBHS Städtebau Bodensee/Hegau GmbH\nGesellschaft mit beschränkter Haftung\nKonstanz\n\nDie Gesellschaft hat am 05.11.2025 die Liste über die Zusammensetzung des Aufsichtsrats zum Handelsregister eingereicht."
    },
    {
      "date": "2025-11-07",
      "id": "136644",
      "original_text": "Löschungsankündigung\nBerlin Amtsgericht Berlin (Charlottenburg) HRB 157552\nOMA gemeinnützige Gesellschaft mbH zur Förderung der Inklusion – Berlin",
      "type": "Löschungsankündigung",
      "state": "Berlin",
      "amtsgericht": "Amtsgericht Berlin (Charlottenburg)",
      "registernummer": "HRB 157552",
      "registerart": "HRB",
      "company_name": "OMA gemeinnützige Gesellschaft mbH zur Förderung der Inklusion",
      "company_seat": "Berlin",
      "details": "07.11.2025 (Bekanntmachungsdatum)\n\nBerlin Amtsgericht Berlin (Charlottenburg) HRB 157552\nLöschungsankündigung\n\nOMA gemeinnützige Gesellschaft mbH zur Förderung der Inklusion\nGesellschaft mit beschränkter Haftung\nBerlin\n\nBei der nachstehenden Gesellschaft wird das Amtslöschungsverfahren gemäß § 394 FamFG eingeleitet. Widerspruchsfrist 6 Wochen"
    },
    {
      "date": "2025-11-07",
      "id": "136645",
      "original_text": "Registerbekanntmachung nach dem Umwandlungsgesetz\nSchleswig-Holstein Amtsgericht Kiel HRB 26608\nWindpark Betriebsgesellschaft 21. Heeck UG (haftungsbeschränkt) – Mühbrook",
      "type": "Registerbekanntmachung nach dem Umwandlungsgesetz",
      "state": "Schleswig-Holstein",
      "amtsgericht": "Amtsgericht Kiel",
      "registernummer": "HRB 26608",
      "registerart": "HRB",
      "company_name": "Windpark Betriebsgesellschaft 21. Heeck UG (haftungsbeschränkt)",
      "company_seat": "Mühbrook",
      "details": "07.11.2025 (Bekanntmachungsdatum)\n\nSchleswig-Holstein Amtsgericht Kiel HRB 26608\nRegisterbekanntmachung nach dem Umwandlungsgesetz 05.11.2025 (Eintragungsdatum)\n\nWindpark Betriebsgesellschaft 21. Heeck UG (haftungsbeschränkt)\nGesellschaft mit beschränkter Haftung\nMühbrook\n\nZu Eintragungsnummer 3 vom 05.11.2025 wird als nicht eingetragen veröffentlicht: Den Gläubigern ist, wenn sie binnen sechs Monaten nach dem Tag, an dem die Eintragung der Umwandlung bekannt gemacht worden ist, ihren Anspruch nach Grund und Höhe schriftlich anmelden, Sicherheit zu leisten, soweit sie nicht Befriedigung verlangen können. Dieses Recht steht den Gläubigern jedoch nur zu, wenn sie glaubhaft machen, dass durch die Umwandlung die Erfüllung ihrer Forderung gefährdet wird."
    },
    {
      "date": "2025-11-07",
      "id": "136646",
      "original_text": "Löschungsankündigung\nSchleswig-Holstein Amtsgericht Lübeck HRA 8758\nFolien ForYu in Abwicklung UG (haftungsbeschränkt) & Co. KG – Lübeck",
      "type": "Löschungsankündigung",
      "state": "Schleswig-Holstein",
      "amtsgericht": "Amtsgericht Lübeck",
      "registernummer": "HRA 8758",
      "registerart": "HRA",
      "company_name": "Folien ForYu in Abwicklung UG (haftungsbeschränkt) & Co. KG",
      "company_seat": "Lübeck",
      "details": "07.11.2025 (Bekanntmachungsdatum)\n\nSchleswig-Holstein Amtsgericht Lübeck HRA 8758\nLöschungsankündigung\n\nFolien ForYu in Abwicklung UG (haftungsbeschränkt) & Co. KG\nKommanditgesellschaft\nLübeck\n\nEs ist die Löschung der nachstehenden Gesellschaft wegen Vermögenslosigkeit gemäß § 394 FamFG beabsichtigt. Widerspruchsfrist: 1 Monat."
    },
    {
      "date": "2025-11-07",
      "id": "136647",
      "original_text": "Registerbekanntmachung nach dem Umwandlungsgesetz\nHamburg Amtsgericht Hamburg HRB 121464\nA.D. Verwaltungs GmbH – Hamburg",
      "type": "Registerbekanntmachung nach dem Umwandlungsgesetz",
      "state": "Hamburg",
      "amtsgericht": "Amtsgericht Hamburg",
      "registernummer": "HRB 121464",
      "registerart": "HRB",
      "company_name": "A.D. Verwaltungs GmbH",
      "company_seat": "Hamburg",
      "details": "07.11.2025 (Bekanntmachungsdatum)\n\nHamburg Amtsgericht Hamburg HRB 121464\nRegisterbekanntmachung nach dem Umwandlungsgesetz 07.11.2025 (Eintragungsdatum)\n\nA.D. Verwaltungs GmbH\nGesellschaft mit beschränkter Haftung\nHamburg\n\nAls nicht eingetragen wird bekannt gemacht:\nDen Gläubigern der an der Verschmelzung beteiligten Gesellschaften ist, wenn sie binnen sechs Monaten nach dem Tag, an dem die Eintragung der Verschmelzung in das Register des Sitzes desjenigen Rechtsträgers, dessen Gläubiger sie sind, nach § 19 Absatz 3 UmwG als bekannt gemacht gilt, ihren Anspruch nach Grund und Höhe schriftlich anmelden, Sicherheit zu leisten, soweit sie nicht Befriedigung verlangen können. Dieses Recht steht den Gläubigern jedoch nur zu, wenn sie glaubhaft machen, dass durch die Verschmelzung die Erfüllung ihrer Forderung gefährdet wird."
    },
    {
      "date": "2025-11-07",
      "id": "136648",
      "original_text": "Sonstige Registerbekanntmachung\nBaden-Württemberg Amtsgericht Freiburg HRB 719519\nProjektbau Rheinfelden II UG (haftungsbeschränkt) – Emmendingen",
      "type": "Sonstige Registerbekanntmachung",
      "state": "Baden-Württemberg",
      "amtsgericht": "Amtsgericht Freiburg",
      "registernummer": "HRB 719519",
      "registerart": "HRB",
      "company_name": "Projektbau Rheinfelden II UG (haftungsbeschränkt)",
      "company_seat": "Emmendingen",
      "details": "07.11.2025 (Bekanntmachungsdatum)\n\nBaden-Württemberg Amtsgericht Freiburg HRB 719519\nSonstige Registerbekanntmachung 07.11.2025 (Eintragungsdatum)\n\nProjektbau Rheinfelden II UG (haftungsbeschränkt)\nGesellschaft mit beschränkter Haftung\nEmmendingen\n\nAls nicht eingetragen wird bekanntgemacht:\nDen Gläubigern der Gesellschaft, deren Forderungen begründet worden sind, bevor die Eintragung der Beendigung des Vertrages in das Handelsregister nach § 10 HGB als bekanntgemacht gilt, ist vom anderen Vertragsteil Sicherheit zu leisten, wenn sie sich binnen sechs Monaten nach der Bekanntmachung zu diesem Zweck bei ihm melden."
    },
    {
      "date": "2025-11-07",
      "id": "136649",
      "original_text": "Registerbekanntmachung nach dem Umwandlungsgesetz\nBaden-Württemberg Amtsgericht Stuttgart HRB 763453\nNY Automaten GmbH – Vaihingen an der Enz",
      "type": "Registerbekanntmachung nach dem Umwandlungsgesetz",
      "state": "Baden-Württemberg",
      "amtsgericht": "Amtsgericht Stuttgart",
      "registernummer": "HRB 763453",
      "registerart": "HRB",
      "company_name": "NY Automaten GmbH",
      "company_seat": "Vaihingen an der Enz",
      "details": "07.11.2025 (Bekanntmachungsdatum)\n\nBaden-Württemberg Amtsgericht Stuttgart HRB 763453\nRegisterbekanntmachung nach dem Umwandlungsgesetz 07.11.2025 (Eintragungsdatum)\n\nNY Automaten GmbH\nGesellschaft mit beschränkter Haftung\nVaihingen an der Enz\n\nAls nicht eingetragen wird bekanntgemacht:\nDen Gläubigern der an der Ausgliederung beteiligten Rechtsträger ist, wenn sie binnen sechs Monaten nach dem Tag, an dem die Eintragung der Ausgliederung in das Register des Sitzes desjenigen Rechtsträgers, dessen Gläubiger sie sind, nach § 19 Abs. 3 UmwG als bekanntgemacht gilt, ihren Anspruch nach Grund und Höhe schriftlich anmelden, Sicherheit zu leisten, soweit sie nicht Befriedigung verlangen können. Dieses Recht steht den Gläubigern jedoch nur zu, wenn sie glaubhaft machen, dass durch die Ausgliederung die Erfüllung ihrer Forderung gefährdet wird."
    },
    {
      "date": "2025-11-07",
      "id": "136650",
      "original_text": "Registerbekanntmachung nach dem Umwandlungsgesetz\nSachsen Amtsgericht Chemnitz VR 40227\nArbeiterwohlfahrt Kreisverband Mittweida e.V. – Mittweida",
      "type": "Registerbekanntmachung nach dem Umwandlungsgesetz",
      "state": "Sachsen",
      "amtsgericht": "Amtsgericht Chemnitz",
      "registernummer": "VR 40227",
      "registerart": "VR",
      "company_name": "Arbeiterwohlfahrt Kreisverband Mittweida e.V.",
      "company_seat": "Mittweida",
      "details": "07.11.2025 (Bekanntmachungsdatum)\n\nSachsen Amtsgericht Chemnitz VR 40227\nRegisterbekanntmachung nach dem Umwandlungsgesetz 07.11.2025 (Eintragungsdatum)\n\nArbeiterwohlfahrt Kreisverband Mittweida e.V.\neingetragener Verein\nMittweida\n\nDen Gläubigern der an der Verschmelzung beteiligten Rechtsträger ist, wenn sie binnen sechs Monaten nach dem Tag, an dem die Eintragung der Verschmelzung in das Register des Sitzes desjenigen Rechtsträgers, dessen Gläubiger sie sind, nach § 19 Abs. 3 UmwG als bekannt gemacht gilt, ihren Anspruch nach Grund und Höhe in Textform anmelden, Sicherheit zu leisten, soweit sie nicht Befriedigung verlangen können. Dieses Recht steht den Gläubigern jedoch nur zu, wenn sie glaubhaft machen, dass durch die Verschmelzung die Erfüllung der Forderung gefährdet wird."
    },
    {
      "date": "2025-11-07",
      "id": "136651",
      "original_text": "Registerbekanntmachung nach dem Umwandlungsgesetz\nSachsen Amtsgericht Chemnitz VR 10193\nArbeiterwohlfahrt Kreisverband Mittelsachsen e. V. – Freiberg",
      "type": "Registerbekanntmachung nach dem Umwandlungsgesetz",
      "state": "Sachsen",
      "amtsgericht": "Amtsgericht Chemnitz",
      "registernummer": "VR 10193",
      "registerart": "VR",
      "company_name": "Arbeiterwohlfahrt Kreisverband Mittelsachsen e. V.",
      "company_seat": "Freiberg",
      "details": "07.11.2025 (Bekanntmachungsdatum)\n\nSachsen Amtsgericht Chemnitz VR 10193\nRegisterbekanntmachung nach dem Umwandlungsgesetz 07.11.2025 (Eintragungsdatum)\n\nArbeiterwohlfahrt Kreisverband Mittelsachsen e. V.\neingetragener Verein\nFreiberg\n\nDen Gläubigern der an der Verschmelzung beteiligten Rechtsträger ist, wenn sie binnen sechs Monaten nach dem Tag, an dem die Eintragung der Verschmelzung in das Register des Sitzes desjenigen Rechtsträgers, dessen Gläubiger sie sind, nach § 19 Abs. 3 UmwG als bekannt gemacht gilt, ihren Anspruch nach Grund und Höhe in Textform anmelden, Sicherheit zu leisten, soweit sie nicht Befriedigung verlangen können. Dieses Recht steht den Gläubigern jedoch nur zu, wenn sie glaubhaft machen, dass durch die Verschmelzung die Erfüllung der Forderung gefährdet wird."
    },
    {
      "date": "2025-11-07",
      "id": "136652",
      "original_text": "Registerbekanntmachung nach dem Umwandlungsgesetz\nSachsen Amtsgericht Chemnitz HRA 10300\nImmobilienbüro Kühn GmbH & Co. KG – Zwickau",
      "type": "Registerbekanntmachung nach dem Umwandlungsgesetz",
      "state": "Sachsen",
      "amtsgericht": "Amtsgericht Chemnitz",
      "registernummer": "HRA 10300",
      "registerart": "HRA",
      "company_name": "Immobilienbüro Kühn GmbH & Co. KG",
      "company_seat": "Zwickau",
      "details": "07.11.2025 (Bekanntmachungsdatum)\n\nSachsen Amtsgericht Chemnitz HRA 10300\nRegisterbekanntmachung nach dem Umwandlungsgesetz 07.11.2025 (Eintragungsdatum)\n\nImmobilienbüro Kühn GmbH & Co. KG\nKommanditgesellschaft\nZwickau\n\nDen Gläubigern der an der Ausgliederung beteiligten Rechtsträger ist, wenn sie binnen sechs Monaten nach dem Tag, an dem die Eintragung der Ausgliederung in das Register des Sitzes desjenigen Rechtsträgers, dessen Gläubiger sie sind, nach § 19 Abs. 3 UmwG als bekannt gemacht gilt, ihren Anspruch nach Grund und Höhe in Textform anmelden, Sicherheit zu leisten, soweit sie nicht Befriedigung verlangen können. Dieses Recht steht den Gläubigern jedoch nur zu, wenn sie glaubhaft machen, dass durch die Ausgliederung die Erfüllung der Forderung gefährdet wird."
    },
    {
      "date": "2025-11-07",
      "id": "136653",
      "original_text": "Registerbekanntmachung nach dem Umwandlungsgesetz\nSachsen Amtsgericht Chemnitz HRA 10286\nWolfgang Kühn e.K. – Zwickau",
      "type": "Registerbekanntmachung nach dem Umwandlungsgesetz",
      "state": "Sachsen",
      "amtsgericht": "Amtsgericht Chemnitz",
      "registernummer": "HRA 10286",
      "registerart": "HRA",
      "company_name": "Wolfgang Kühn e.K.",
      "company_seat": "Zwickau",
      "details": "07.11.2025 (Bekanntmachungsdatum)\n\nSachsen Amtsgericht Chemnitz HRA 10286\nRegisterbekanntmachung nach dem Umwandlungsgesetz 07.11.2025 (Eintragungsdatum)\n\nWolfgang Kühn e.K.\nEinzelkaufmann / Einzelkauffrau\nZwickau\n\nDen Gläubigern der an der Ausgliederung beteiligten Rechtsträger ist, wenn sie binnen sechs Monaten nach dem Tag, an dem die Eintragung der Ausgliederung in das Register des Sitzes desjenigen Rechtsträgers, dessen Gläubiger sie sind, nach § 19 Abs. 3 UmwG als bekannt gemacht gilt, ihren Anspruch nach Grund und Höhe in Textform anmelden, Sicherheit zu leisten, soweit sie nicht Befriedigung verlangen können. Dieses Recht steht den Gläubigern jedoch nur zu, wenn sie glaubhaft machen, dass durch die Ausgliederung die Erfüllung der Forderung gefährdet wird."
    },
    {
      "date": "2025-11-07",
      "id": "136654",
      "original_text": "Löschungsankündigung\nSachsen Amtsgericht Chemnitz HRB 10392\ned Wohn- und Gewerbebau GmbH – Zwickau",
      "type": "Löschungsankündigung",
      "state": "Sachsen",
      "amtsgericht": "Amtsgericht Chemnitz",
      "registernummer": "HRB 10392",
      "registerart": "HRB",
      "company_name": "ed Wohn- und Gewerbebau GmbH",
      "company_seat": "Zwickau",
      "details": "07.11.2025 (Bekanntmachungsdatum)\n\nSachsen Amtsgericht Chemnitz HRB 10392\nLöschungsankündigung\n\ned Wohn- und Gewerbebau GmbH\nGesellschaft mit beschränkter Haftung\nZwickau\n\nDas Registergericht beabsichtigt, die im Handelsregister eingetragene Gesellschaft von Amts wegen nach § 394 FamFG zu löschen. Die Frist zu Erhebung eines Widerspruchs gegen die beabsichtigte Löschung wird auf einen Monat festgesetzt."
    },
    {
      "date": "2025-11-07",
      "id": "136655",
      "original_text": "Löschungsankündigung\nNiedersachsen Amtsgericht Lüneburg VR 140136\nKühlhausgemeinschaft Borne – Uelzen/Holdenstedt",
      "type": "Löschungsankündigung",
      "state": "Niedersachsen",
      "amtsgericht": "Amtsgericht Lüneburg",
      "registernummer": "VR 140136",
      "registerart": "VR",
      "company_name": "Kühlhausgemeinschaft Borne",
      "company_seat": "Uelzen/Holdenstedt",
      "details": "07.11.2025 (Bekanntmachungsdatum)\n\nNiedersachsen Amtsgericht Lüneburg VR 140136\nLöschungsankündigung\n\nKühlhausgemeinschaft Borne\neingetragener Verein\nUelzen/Holdenstedt\n\nDas Registergericht beabsichtigt, den Verein von Amts wegen nach § 395 FamFG zu löschen. Die Frist zur Erhebung eines Widerspruchs ist auf 1 Monat ab dieser Registerbekanntmachung festgesetzt."
    },
    {
      "date": "2025-11-07",
      "id": "136656",
      "original_text": "Einreichung neuer Dokumente\nNiedersachsen Amtsgericht Hannover GnR 200061\nGemeingut eG – Hannover",
      "type": "Einreichung neuer Dokumente",
      "state": "Niedersachsen",
      "amtsgericht": "Amtsgericht Hannover",
      "registernummer": "GnR 200061",
      "registerart": "GnR",
      "company_name": "Gemeingut eG",
      "company_seat": "Hannover",
      "details": "07.11.2025 (Bekanntmachungsdatum)\n\nNiedersachsen Amtsgericht Hannover GnR 200061\nEinreichung neuer Dokumente 07.11.2025 (Eintragungsdatum)\n\nGemeingut eG\neingetragene Genossenschaft\nHannover\n\nDie Liste der Mitglieder des Aufsichtsrats wurde beim Registergericht eingereicht."
    },
    {
      "date": "2025-11-07",
      "id": "136657",
      "original_text": "Registerbekanntmachung nach dem Umwandlungsgesetz\nNiedersachsen Amtsgericht Osnabrück HRA 209692\nYSD KUNG FU SCHOOL GERMANY e.K – Lingen (Ems)",
      "type": "Registerbekanntmachung nach dem Umwandlungsgesetz",
      "state": "Niedersachsen",
      "amtsgericht": "Amtsgericht Osnabrück",
      "registernummer": "HRA 209692",
      "registerart": "HRA",
      "company_name": "YSD KUNG FU SCHOOL GERMANY e.K",
      "company_seat": "Lingen (Ems)",
      "details": "07.11.2025 (Bekanntmachungsdatum)\n\nNiedersachsen Amtsgericht Osnabrück HRA 209692\nRegisterbekanntmachung nach dem Umwandlungsgesetz 07.11.2025 (Eintragungsdatum)\n\nYSD KUNG FU SCHOOL GERMANY e.K\nEinzelkaufmann / Einzelkauffrau\nLingen (Ems)\n\nDen Gläubigern der an der Ausgliederung beteiligten Rechtsträger ist, wenn sie binnen sechs Monaten nach dem Tag, an dem die Eintragung der Ausgliederung in das Register des Sitzes desjenigen Rechtsträgers, dessen Gläubiger sie sind, nach § 19 Abs. 3 UmwG als bekannt gemacht gilt, ihren Anspruch nach Grund und Höhe schriftlich anmelden, Sicherheit zu leisten, soweit sie nicht Befriedigung verlangen können. Dieses Recht steht den Gläubigern jedoch nur zu, wenn sie glaubhaft machen, dass durch die Ausgliederung die Erfüllung der Forderung gefährdet wird."
    },
    {
      "date": "2025-11-07",
      "id": "136658",
      "original_text": "Löschungsankündigung\nNiedersachsen Amtsgericht Oldenburg (Oldenburg) HRB 216144\nButcher & Baker GmbH – Oldenburg",
      "type": "Löschungsankündigung",
      "state": "Niedersachsen",
      "amtsgericht": "Amtsgericht Oldenburg (Oldenburg)",
      "registernummer": "HRB 216144",
      "registerart": "HRB",
      "company_name": "Butcher & Baker GmbH",
      "company_seat": "Oldenburg",
      "details": "07.11.2025 (Bekanntmachungsdatum)\n\nNiedersachsen Amtsgericht Oldenburg (Oldenburg) HRB 216144\nLöschungsankündigung\n\nButcher & Baker GmbH\nGesellschaft mit beschränkter Haftung\nOldenburg\n\nDas Registergericht beabsichtigt, die Gesellschaft von Amts wegen nach § 394 FamFG zu löschen. Die Frist zur Erhebung eines Widerspruchs ist auf 1 Monat ab dieser Registerbekanntmachung festgesetzt."
    },
    {
      "date": "2025-11-07",
      "id": "136659",
      "original_text": "Registerbekanntmachung nach dem Umwandlungsgesetz\nNiedersachsen Amtsgericht Göttingen HRB 207994\nHirscher-Holz GmbH – Osterode am Harz",
      "type": "Registerbekanntmachung nach dem Umwandlungsgesetz",
      "state": "Niedersachsen",
      "amtsgericht": "Amtsgericht Göttingen",
      "registernummer": "HRB 207994",
      "registerart": "HRB",
      "company_name": "Hirscher-Holz GmbH",
      "company_seat": "Osterode am Harz",
      "details": "07.11.2025 (Bekanntmachungsdatum)\n\nNiedersachsen Amtsgericht Göttingen HRB 207994\nRegisterbekanntmachung nach dem Umwandlungsgesetz 07.11.2025 (Eintragungsdatum)\n\nHirscher-Holz GmbH\nGesellschaft mit beschränkter Haftung\nOsterode am Harz\n\nDen Gläubigern der an der Ausgliederung beteiligten Rechtsträger ist, wenn sie binnen sechs Monaten nach dem Tag, an dem die Eintragung der Ausgliederung in das Register des Sitzes desjenigen Rechtsträgers, dessen Gläubiger sie sind, nach § 19 Abs. 3 UmwG als bekannt gemacht gilt, ihren Anspruch nach Grund und Höhe schriftlich anmelden, Sicherheit zu leisten, soweit sie nicht Befriedigung verlangen können. Dieses Recht steht den Gläubigern jedoch nur zu, wenn sie glaubhaft machen, dass durch die Ausgliederung die Erfüllung der Forderung gefährdet wird."
    },
    {
      "date": "2025-11-07",
      "id": "136660",
      "original_text": "Registerbekanntmachung nach dem Umwandlungsgesetz\nNiedersachsen Amtsgericht Osnabrück HRA 209538\nUwes Grill GmbH & Co. KG – Papenburg",
      "type": "Registerbekanntmachung nach dem Umwandlungsgesetz",
      "state": "Niedersachsen",
      "amtsgericht": "Amtsgericht Osnabrück",
      "registernummer": "HRA 209538",
      "registerart": "HRA",
      "company_name": "Uwes Grill GmbH & Co. KG",
      "company_seat": "Papenburg",
      "details": "07.11.2025 (Bekanntmachungsdatum)\n\nNiedersachsen Amtsgericht Osnabrück HRA 209538\nRegisterbekanntmachung nach dem Umwandlungsgesetz 07.11.2025 (Eintragungsdatum)\n\nUwes Grill GmbH & Co. KG\nKommanditgesellschaft\nPapenburg\n\nDen Gläubigern der an der Ausgliederung beteiligten Rechtsträger ist, wenn sie binnen sechs Monaten nach dem Tag, an dem die Eintragung der Ausgliederung in das Register des Sitzes desjenigen Rechtsträgers, dessen Gläubiger sie sind, nach § 19 Abs. 3 UmwG als bekannt gemacht gilt, ihren Anspruch nach Grund und Höhe schriftlich anmelden, Sicherheit zu leisten, soweit sie nicht Befriedigung verlangen können. Dieses Recht steht den Gläubigern jedoch nur zu, wenn sie glaubhaft machen, dass durch die Ausgliederung die Erfüllung der Forderung gefährdet wird."
    },
    {
      "date": "2025-11-07",
      "id": "136661",
      "original_text": "Registerbekanntmachung nach dem Umwandlungsgesetz\nNiedersachsen Amtsgericht Hannover HRB 226889\nDiaVita Leine-Mittelweser Diakonische Gesellschaft für Pflege und Wohnen gGmbH – Neustadt am Rübenberge",
      "type": "Registerbekanntmachung nach dem Umwandlungsgesetz",
      "state": "Niedersachsen",
      "amtsgericht": "Amtsgericht Hannover",
      "registernummer": "HRB 226889",
      "registerart": "HRB",
      "company_name": "DiaVita Leine-Mittelweser Diakonische Gesellschaft für Pflege und Wohnen gGmbH",
      "company_seat": "Neustadt am Rübenberge",
      "details": "07.11.2025 (Bekanntmachungsdatum)\n\nNiedersachsen Amtsgericht Hannover HRB 226889\nRegisterbekanntmachung nach dem Umwandlungsgesetz 07.11.2025 (Eintragungsdatum)\n\nDiaVita Leine-Mittelweser Diakonische Gesellschaft für Pflege und Wohnen gGmbH\nGesellschaft mit beschränkter Haftung\nNeustadt am Rübenberge\n\nDen Gläubigern der an der Verschmelzung beteiligten Rechtsträger ist, wenn sie binnen sechs Monaten nach dem Tag, an dem die Eintragung der Verschmelzung in das Register des Sitzes desjenigen Rechtsträgers, dessen Gläubiger sie sind, nach § 19  Abs.  3 UmwG als bekannt gemacht gilt, ihren Anspruch nach Grund und Höhe schriftlich anmelden, Sicherheit zu leisten, soweit sie nicht Befriedigung verlangen können. Dieses Recht steht den Gläubigern jedoch nur zu, wenn sie glaubhaft machen, dass durch die Verschmelzung die Erfüllung der Forderung gefährdet wird."
    },
    {
      "date": "2025-11-07",
      "id": "136662",
      "original_text": "Registerbekanntmachung nach dem Umwandlungsgesetz\nRheinland-Pfalz Amtsgericht Mainz HRB 52592\nFirst Solar Holdings GmbH – Mainz",
      "type": "Registerbekanntmachung nach dem Umwandlungsgesetz",
      "state": "Rheinland-Pfalz",
      "amtsgericht": "Amtsgericht Mainz",
      "registernummer": "HRB 52592",
      "registerart": "HRB",
      "company_name": "First Solar Holdings GmbH",
      "company_seat": "Mainz",
      "details": "07.11.2025 (Bekanntmachungsdatum)\n\nRheinland-Pfalz Amtsgericht Mainz HRB 52592\nRegisterbekanntmachung nach dem Umwandlungsgesetz 07.11.2025 (Eintragungsdatum)\n\nFirst Solar Holdings GmbH\nGesellschaft mit beschränkter Haftung\nMainz\n\nAls nicht eingetragen wird veröffentlicht: Den Gläubigern der an der Verschmelzung beteiligten Rechtsträger ist, wenn sie binnen sechs Monaten nach dem Tag, an dem die Eintragung der Verschmelzung in das Register des Sitzes desjenigen Rechtsträgers, dessen Gläubiger sie sind, nach § 19 Abs. 3 UmwG als bekannt gemacht gilt, ihren Anspruch nach Grund und Höhe schriftlich anmelden, Sicherheit zu leisten, soweit sie nicht Befriedigung verlangen können. Dieses Recht steht den Gläubigern jedoch nur zu, wenn sie glaubhaft machen, dass durch die Verschmelzung die Erfüllung ihrer Forderung gefährdet wird."
    },
    {
      "date": "2025-11-07",
      "id": "136663",
      "original_text": "Registerbekanntmachung nach dem Umwandlungsgesetz\nRheinland-Pfalz Amtsgericht Mainz HRB 52575\nFirst Solar GmbH – Mainz",
      "type": "Registerbekanntmachung nach dem Umwandlungsgesetz",
      "state": "Rheinland-Pfalz",
      "amtsgericht": "Amtsgericht Mainz",
      "registernummer": "HRB 52575",
      "registerart": "HRB",
      "company_name": "First Solar GmbH",
      "company_seat": "Mainz",
      "details": "07.11.2025 (Bekanntmachungsdatum)\n\nRheinland-Pfalz Amtsgericht Mainz HRB 52575\nRegisterbekanntmachung nach dem Umwandlungsgesetz 07.11.2025 (Eintragungsdatum)\n\nFirst Solar GmbH\nGesellschaft mit beschränkter Haftung\nMainz\n\nAls nicht eingetragen wird veröffentlicht: Den Gläubigern der an der Verschmelzung beteiligten Rechtsträger ist, wenn sie binnen sechs Monaten nach dem Tag, an dem die Eintragung der Verschmelzung in das Register des Sitzes desjenigen Rechtsträgers, dessen Gläubiger sie sind, nach § 19 Abs. 3 UmwG als bekannt gemacht gilt, ihren Anspruch nach Grund und Höhe schriftlich anmelden, Sicherheit zu leisten, soweit sie nicht Befriedigung verlangen können. Dieses Recht steht den Gläubigern jedoch nur zu, wenn sie glaubhaft machen, dass durch die Verschmelzung die Erfüllung ihrer Forderung gefährdet wird."
    },
    {
      "date": "2025-11-07",
      "id": "136664",
      "original_text": "Einreichung neuer Dokumente\nRheinland-Pfalz Amtsgericht Wittlich HRB 3570\nMentor AG Betriebswirtschaftliche Beratung – Trier",
      "type": "Einreichung neuer Dokumente",
      "state": "Rheinland-Pfalz",
      "amtsgericht": "Amtsgericht Wittlich",
      "registernummer": "HRB 3570",
      "registerart": "HRB",
      "company_name": "Mentor AG Betriebswirtschaftliche Beratung",
      "company_seat": "Trier",
      "details": "07.11.2025 (Bekanntmachungsdatum)\n\nRheinland-Pfalz Amtsgericht Wittlich HRB 3570\nEinreichung neuer Dokumente\n\nMentor AG Betriebswirtschaftliche Beratung\nAktiengesellschaft\nTrier\n\nDem Registergericht ist eine neue Liste der Mitglieder des Aufsichtsrates eingereicht worden."
    },
    {
      "date": "2025-11-07",
      "id": "136665",
      "original_text": "Löschungsankündigung\nRheinland-Pfalz Amtsgericht Koblenz HRB 27510\nI.A. Stuckateurbetrieb UG (haftungsbeschränkt) – Bad Breisig",
      "type": "Löschungsankündigung",
      "state": "Rheinland-Pfalz",
      "amtsgericht": "Amtsgericht Koblenz",
      "registernummer": "HRB 27510",
      "registerart": "HRB",
      "company_name": "I.A. Stuckateurbetrieb UG (haftungsbeschränkt)",
      "company_seat": "Bad Breisig",
      "details": "07.11.2025 (Bekanntmachungsdatum)\n\nRheinland-Pfalz Amtsgericht Koblenz HRB 27510\nLöschungsankündigung\n\nI.A. Stuckateurbetrieb UG (haftungsbeschränkt)\nGesellschaft mit beschränkter Haftung\nBad Breisig\n\nDas Registergericht beabsichtigt die Gesellschaft von Amts wegen nach § 394 FamFG zu löschen. Die Frist zur Erhebung eines Widerspruchs ist auf zwei Monate festgesetzt."
    },
    {
      "date": "2025-11-07",
      "id": "136666",
      "original_text": "Registerbekanntmachung nach dem Umwandlungsgesetz\nRheinland-Pfalz Amtsgericht Mainz HRB 52629\nFirst Solar Manufacturing GmbH – Mainz",
      "type": "Registerbekanntmachung nach dem Umwandlungsgesetz",
      "state": "Rheinland-Pfalz",
      "amtsgericht": "Amtsgericht Mainz",
      "registernummer": "HRB 52629",
      "registerart": "HRB",
      "company_name": "First Solar Manufacturing GmbH",
      "company_seat": "Mainz",
      "details": "07.11.2025 (Bekanntmachungsdatum)\n\nRheinland-Pfalz Amtsgericht Mainz HRB 52629\nRegisterbekanntmachung nach dem Umwandlungsgesetz 07.11.2025 (Eintragungsdatum)\n\nFirst Solar Manufacturing GmbH\nGesellschaft mit beschränkter Haftung\nMainz\n\nAls nicht eingetragen wird veröffentlicht: Den Gläubigern der an der Verschmelzung beteiligten Rechtsträger ist, wenn sie binnen sechs Monaten nach dem Tag, an dem die Eintragung der Verschmelzung in das Register des Sitzes desjenigen Rechtsträgers, dessen Gläubiger sie sind, nach § 19 Abs. 3 UmwG als bekannt gemacht gilt, ihren Anspruch nach Grund und Höhe schriftlich anmelden, Sicherheit zu leisten, soweit sie nicht Befriedigung verlangen können. Dieses Recht steht den Gläubigern jedoch nur zu, wenn sie glaubhaft machen, dass durch die Verschmelzung die Erfüllung ihrer Forderung gefährdet wird."
    },
    {
      "date": "2025-11-07",
      "id": "136667",
      "original_text": "Registerbekanntmachung nach dem Umwandlungsgesetz\nRheinland-Pfalz Amtsgericht Mainz HRB 52592\nFirst Solar Holdings GmbH – Mainz",
      "type": "Registerbekanntmachung nach dem Umwandlungsgesetz",
      "state": "Rheinland-Pfalz",
      "amtsgericht": "Amtsgericht Mainz",
      "registernummer": "HRB 52592",
      "registerart": "HRB",
      "company_name": "First Solar Holdings GmbH",
      "company_seat": "Mainz",
      "details": "07.11.2025 (Bekanntmachungsdatum)\n\nRheinland-Pfalz Amtsgericht Mainz HRB 52592\nRegisterbekanntmachung nach dem Umwandlungsgesetz 07.11.2025 (Eintragungsdatum)\n\nFirst Solar Holdings GmbH\nGesellschaft mit beschränkter Haftung\nMainz\n\nAls nicht eingetragen wird veröffentlicht: Den Gläubigern der an der Verschmelzung beteiligten Rechtsträger ist, wenn sie binnen sechs Monaten nach dem Tag, an dem die Eintragung der Verschmelzung in das Register des Sitzes desjenigen Rechtsträgers, dessen Gläubiger sie sind, nach § 19 Abs. 3 UmwG als bekannt gemacht gilt, ihren Anspruch nach Grund und Höhe schriftlich anmelden, Sicherheit zu leisten, soweit sie nicht Befriedigung verlangen können. Dieses Recht steht den Gläubigern jedoch nur zu, wenn sie glaubhaft machen, dass durch die Verschmelzung die Erfüllung ihrer Forderung gefährdet wird."
    },
    {
      "date": "2025-11-07",
      "id": "136668",
      "original_text": "Löschungsankündigung\nRheinland-Pfalz Amtsgericht Ludwigshafen a.Rhein (Ludwigshafen) HRB 68285\nSalih Verwaltungs GmbH – Ludwigshafen / Rhein",
      "type": "Löschungsankündigung",
      "state": "Rheinland-Pfalz",
      "amtsgericht": "Amtsgericht Ludwigshafen a.Rhein (Ludwigshafen)",
      "registernummer": "HRB 68285",
      "registerart": "HRB",
      "company_name": "Salih Verwaltungs GmbH",
      "company_seat": "Ludwigshafen / Rhein",
      "details": "07.11.2025 (Bekanntmachungsdatum)\n\nRheinland-Pfalz Amtsgericht Ludwigshafen a.Rhein (Ludwigshafen) HRB 68285\nLöschungsankündigung 07.11.2025 (Eintragungsdatum)\n\nSalih Verwaltungs GmbH\nGesellschaft mit beschränkter Haftung\nLudwigshafen / Rhein\n\nDas Registergericht beabsichtigt die Gesellschaft von Amts wegen nach § 394 FamFG zu löschen. Die Frist zur Erhebung eines Widerspruchs ist auf drei Monate festgesetzt."
    },
    {
      "date": "2025-11-07",
      "id": "136669",
      "original_text": "Einreichung neuer Dokumente\nRheinland-Pfalz Amtsgericht Mainz HRB 651\nMainzer Stadtwerke AG – Mainz",
      "type": "Einreichung neuer Dokumente",
      "state": "Rheinland-Pfalz",
      "amtsgericht": "Amtsgericht Mainz",
      "registernummer": "HRB 651",
      "registerart": "HRB",
      "company_name": "Mainzer Stadtwerke AG",
      "company_seat": "Mainz",
      "details": "07.11.2025 (Bekanntmachungsdatum)\n\nRheinland-Pfalz Amtsgericht Mainz HRB 651\nEinreichung neuer Dokumente\n\nMainzer Stadtwerke AG\nAktiengesellschaft\nMainz\n\nDem Registergericht ist eine neue Liste der Mitglieder des Aufsichtsrates eingereicht worden."
    },
    {
      "date": "2025-11-07",
      "id": "136670",
      "original_text": "Einreichung neuer Dokumente\nNordrhein-Westfalen Amtsgericht Essen HRB 24353\nRWE Generation SE – Essen",
      "type": "Einreichung neuer Dokumente",
      "state": "Nordrhein-Westfalen",
      "amtsgericht": "Amtsgericht Essen",
      "registernummer": "HRB 24353",
      "registerart": "HRB",
      "company_name": "RWE Generation SE",
      "company_seat": "Essen",
      "details": "07.11.2025 (Bekanntmachungsdatum)\n\nNordrhein-Westfalen Amtsgericht Essen HRB 24353\nEinreichung neuer Dokumente\n\nRWE Generation SE\nEuropäische Aktiengesellschaft (SE)\nEssen\n\nDem Registergericht ist eine neue Liste der Mitglieder des Aufsichtsrates eingereicht worden."
    },
    {
      "date": "2025-11-07",
      "id": "136671",
      "original_text": "Löschungsankündigung\nNordrhein-Westfalen Amtsgericht Düsseldorf HRB 75672\nR & S Technology GmbH – Düsseldorf",
      "type": "Löschungsankündigung",
      "state": "Nordrhein-Westfalen",
      "amtsgericht": "Amtsgericht Düsseldorf",
      "registernummer": "HRB 75672",
      "registerart": "HRB",
      "company_name": "R & S Technology GmbH",
      "company_seat": "Düsseldorf",
      "details": "07.11.2025 (Bekanntmachungsdatum)\n\nNordrhein-Westfalen Amtsgericht Düsseldorf HRB 75672\nLöschungsankündigung\n\nR & S Technology GmbH\nGesellschaft mit beschränkter Haftung\nDüsseldorf\n\nDas Registergericht beabsichtigt die Gesellschaft von Amts wegen nach § 394 FamFG zu löschen. Die Frist zur Erhebung eines Widerspruchs ist auf 3 Wochen festgesetzt.\n\nRechtsbehelfsbelehrung:\nDas Widerspruchsrecht steht jedem zu, der an der Unterlassung der Löschung ein berechtigtes Interesse hat. Der Widerspruch ist bei dem Amtsgericht Düsseldorf -Registergericht-, Werdener Straße 1, 40227 Düsseldorf schriftlich in deutscher Sprache oder zur Niederschrift der Geschäftsstelle einzulegen. Der Widerspruch kann auch zur Niederschrift der Geschäftsstelle eines jeden Amtsgerichtes abgegeben werden. Die Einlegung ist auch durch Übertragung eines elektronischen Dokuments an die elektronische Poststelle des Gerichts möglich. Das elektronische Dokument muss für die Bearbeitung durch das Gericht geeignet und mit einer qualifizierten elektronischen Signatur der verantwortenden Person versehen sein oder von der verantwortenden Person signiert und auf einem sicheren Übermittlungsweg gemäß § 130a ZPO nach näherer Maßgabe der Verordnung über die technischen Rahmenbedingungen des elektronischen Rechtsverkehrs und über das besondere elektronische Behördenpostfach (BGBl. I, S.3803) eingereicht werden. Weitere Informationen erhalten Sie auf der Internetseite www.justiz.de.\nDer Widerspruch muss spätestens innerhalb der gesetzten Frist nach dem Datum der Bekanntmachung der Löschungsankündigung bei dem Amtsgericht - Registergericht - Düsseldorf eingegangen sein.  Dies gilt auch dann, wenn der Widerspruch zur Niederschrift der Geschäftsstelle eines anderen Amtsgerichtes abgegeben wurde. Die Frist beginnt mit dem Tage der Bekanntmachung der Löschungsankündigung in dem für die Bekanntmachung der Eintragungen in das Handelsregister bestimmten elektronischen Informations- und Kommunikationssystem nach § 10 des Handelsgesetzbuches. Fällt das Ende der Frist auf einen Sonntag, einen allgemeinen Feiertag oder Sonnabend, so endet die Frist mit Ablauf des nächsten Werktages.\nDer Widerspruch muss die Bezeichnung der angefochtenen Löschungsankündigung sowie die Erklärung enthalten, dass Widerspruch gegen diese Löschungsankündigung eingelegt wird. Er ist zu unterzeichnen und soll begründet werden."
    },
    {
      "date": "2025-11-07",
      "id": "136672",
      "original_text": "Löschungsankündigung\nNordrhein-Westfalen Amtsgericht Gelsenkirchen HRB 15145\nLivebid GmbH – Marl",
      "type": "Löschungsankündigung",
      "state": "Nordrhein-Westfalen",
      "amtsgericht": "Amtsgericht Gelsenkirchen",
      "registernummer": "HRB 15145",
      "registerart": "HRB",
      "company_name": "Livebid GmbH",
      "company_seat": "Marl",
      "details": "07.11.2025 (Bekanntmachungsdatum)\n\nNordrhein-Westfalen Amtsgericht Gelsenkirchen HRB 15145\nLöschungsankündigung\n\nLivebid GmbH\nGesellschaft mit beschränkter Haftung\nMarl\n\nDas Gericht beabsichtigt, die im Handelsregister eingetragene Livebid GmbH mit Sitz in Marl, HRB 15145, Amtsgericht Gelsenkirchen, wegen Vermögenslosigkeit zu löschen.\nHiermit wird denjenigen, die an der Unterlassung der Löschung ein berechtigtes Interesse haben, gem. § 394 Abs. 2 FamFG Gelegenheit gegeben, gegen dieses Vorhaben binnen eines Monats nach dieser Bekanntmachung Widerspruch einzulegen. Der Widerspruch kann schriftlich oder zu Protokoll der Geschäftsstelle erhoben werden."
    },
    {
      "date": "2025-11-07",
      "id": "136673",
      "original_text": "Löschungsankündigung\nNordrhein-Westfalen Amtsgericht Düsseldorf HRB 90688\nGrownext Real Estate GmbH – Düsseldorf",
      "type": "Löschungsankündigung",
      "state": "Nordrhein-Westfalen",
      "amtsgericht": "Amtsgericht Düsseldorf",
      "registernummer": "HRB 90688",
      "registerart": "HRB",
      "company_name": "Grownext Real Estate GmbH",
      "company_seat": "Düsseldorf",
      "details": "07.11.2025 (Bekanntmachungsdatum)\n\nNordrhein-Westfalen Amtsgericht Düsseldorf HRB 90688\nLöschungsankündigung\n\nGrownext Real Estate GmbH\nGesellschaft mit beschränkter Haftung\nDüsseldorf\n\nDas Registergericht beabsichtigt die Gesellschaft von Amts wegen nach § 394 FamFG zu löschen. Die Frist zur Erhebung eines Widerspruchs ist auf 3 Wochen festgesetzt.\n\nRechtsbehelfsbelehrung:\nDas Widerspruchsrecht steht jedem zu, der an der Unterlassung der Löschung ein berechtigtes Interesse hat. Der Widerspruch ist bei dem Amtsgericht Düsseldorf -Registergericht-, Werdener Straße 1, 40227 Düsseldorf schriftlich in deutscher Sprache oder zur Niederschrift der Geschäftsstelle einzulegen. Der Widerspruch kann auch zur Niederschrift der Geschäftsstelle eines jeden Amtsgerichtes abgegeben werden. Die Einlegung ist auch durch Übertragung eines elektronischen Dokuments an die elektronische Poststelle des Gerichts möglich. Das elektronische Dokument muss für die Bearbeitung durch das Gericht geeignet und mit einer qualifizierten elektronischen Signatur der verantwortenden Person versehen sein oder von der verantwortenden Person signiert und auf einem sicheren Übermittlungsweg gemäß § 130a ZPO nach näherer Maßgabe der Verordnung über die technischen Rahmenbedingungen des elektronischen Rechtsverkehrs und über das besondere elektronische Behördenpostfach (BGBl. I, S.3803) eingereicht werden. Weitere Informationen erhalten Sie auf der Internetseite www.justiz.de.\nDer Widerspruch muss spätestens innerhalb der gesetzten Frist nach dem Datum der Bekanntmachung der Löschungsankündigung bei dem Amtsgericht - Registergericht - Düsseldorf eingegangen sein.  Dies gilt auch dann, wenn der Widerspruch zur Niederschrift der Geschäftsstelle eines anderen Amtsgerichtes abgegeben wurde. Die Frist beginnt mit dem Tage der Bekanntmachung der Löschungsankündigung in dem für die Bekanntmachung der Eintragungen in das Handelsregister bestimmten elektronischen Informations- und Kommunikationssystem nach § 10 des Handelsgesetzbuches. Fällt das Ende der Frist auf einen Sonntag, einen allgemeinen Feiertag oder Sonnabend, so endet die Frist mit Ablauf des nächsten Werktages.\nDer Widerspruch muss die Bezeichnung der angefochtenen Löschungsankündigung sowie die Erklärung enthalten, dass Widerspruch gegen diese Löschungsankündigung eingelegt wird. Er ist zu unterzeichnen und soll begründet werden."
    },
    {
      "date": "2025-11-07",
      "id": "136674",
      "original_text": "Löschungsankündigung\nNordrhein-Westfalen Amtsgericht Düsseldorf HRB 90728\nA.M. Event Company GmbH – Düsseldorf",
      "type": "Löschungsankündigung",
      "state": "Nordrhein-Westfalen",
      "amtsgericht": "Amtsgericht Düsseldorf",
      "registernummer": "HRB 90728",
      "registerart": "HRB",
      "company_name": "A.M. Event Company GmbH",
      "company_seat": "Düsseldorf",
      "details": "07.11.2025 (Bekanntmachungsdatum)\n\nNordrhein-Westfalen Amtsgericht Düsseldorf HRB 90728\nLöschungsankündigung\n\nA.M. Event Company GmbH\nGesellschaft mit beschränkter Haftung\nDüsseldorf\n\nDas Registergericht beabsichtigt die Gesellschaft von Amts wegen nach § 394 FamFG zu löschen. Die Frist zur Erhebung eines Widerspruchs ist auf 3 Wochen festgesetzt.\n\nRechtsbehelfsbelehrung:\nDas Widerspruchsrecht steht jedem zu, der an der Unterlassung der Löschung ein berechtigtes Interesse hat. Der Widerspruch ist bei dem Amtsgericht Düsseldorf -Registergericht-, Werdener Straße 1, 40227 Düsseldorf schriftlich in deutscher Sprache oder zur Niederschrift der Geschäftsstelle einzulegen. Der Widerspruch kann auch zur Niederschrift der Geschäftsstelle eines jeden Amtsgerichtes abgegeben werden. Die Einlegung ist auch durch Übertragung eines elektronischen Dokuments an die elektronische Poststelle des Gerichts möglich. Das elektronische Dokument muss für die Bearbeitung durch das Gericht geeignet und mit einer qualifizierten elektronischen Signatur der verantwortenden Person versehen sein oder von der verantwortenden Person signiert und auf einem sicheren Übermittlungsweg gemäß § 130a ZPO nach näherer Maßgabe der Verordnung über die technischen Rahmenbedingungen des elektronischen Rechtsverkehrs und über das besondere elektronische Behördenpostfach (BGBl. I, S.3803) eingereicht werden. Weitere Informationen erhalten Sie auf der Internetseite www.justiz.de.\nDer Widerspruch muss spätestens innerhalb der gesetzten Frist nach dem Datum der Bekanntmachung der Löschungsankündigung bei dem Amtsgericht - Registergericht - Düsseldorf eingegangen sein.  Dies gilt auch dann, wenn der Widerspruch zur Niederschrift der Geschäftsstelle eines anderen Amtsgerichtes abgegeben wurde. Die Frist beginnt mit dem Tage der Bekanntmachung der Löschungsankündigung in dem für die Bekanntmachung der Eintragungen in das Handelsregister bestimmten elektronischen Informations- und Kommunikationssystem nach § 10 des Handelsgesetzbuches. Fällt das Ende der Frist auf einen Sonntag, einen allgemeinen Feiertag oder Sonnabend, so endet die Frist mit Ablauf des nächsten Werktages.\nDer Widerspruch muss die Bezeichnung der angefochtenen Löschungsankündigung sowie die Erklärung enthalten, dass Widerspruch gegen diese Löschungsankündigung eingelegt wird. Er ist zu unterzeichnen und soll begründet werden."
    },
    {
      "date": "2025-11-07",
      "id": "136675",
      "original_text": "Löschungsankündigung\nNordrhein-Westfalen Amtsgericht Dortmund HRB 31597\nWKP Kornblum-Bauservice UG (haftungsbeschränkt) – Dortmund",
      "type": "Löschungsankündigung",
      "state": "Nordrhein-Westfalen",
      "amtsgericht": "Amtsgericht Dortmund",
      "registernummer": "HRB 31597",
      "registerart": "HRB",
      "company_name": "WKP Kornblum-Bauservice UG (haftungsbeschränkt)",
      "company_seat": "Dortmund",
      "details": "07.11.2025 (Bekanntmachungsdatum)\n\nNordrhein-Westfalen Amtsgericht Dortmund HRB 31597\nLöschungsankündigung 07.11.2025 (Eintragungsdatum)\n\nWKP Kornblum-Bauservice UG (haftungsbeschränkt)\nGesellschaft mit beschränkter Haftung\nDortmund\n\nDas Registergericht beabsichtigt die Gesellschaft von Amts wegen nach § 394 FamFG zu löschen. Die Frist zur Erhebung eines Widerspruchs ist auf zwei Monate festgesetzt."
    },
    {
      "date": "2025-11-07",
      "id": "136676",
      "original_text": "Löschungsankündigung\nNordrhein-Westfalen Amtsgericht Dortmund HRB 32807\nPrestek GmbH – Dortmund",
      "type": "Löschungsankündigung",
      "state": "Nordrhein-Westfalen",
      "amtsgericht": "Amtsgericht Dortmund",
      "registernummer": "HRB 32807",
      "registerart": "HRB",
      "company_name": "Prestek GmbH",
      "company_seat": "Dortmund",
      "details": "07.11.2025 (Bekanntmachungsdatum)\n\nNordrhein-Westfalen Amtsgericht Dortmund HRB 32807\nLöschungsankündigung 07.11.2025 (Eintragungsdatum)\n\nPrestek GmbH\nGesellschaft mit beschränkter Haftung\nDortmund\n\nDas Registergericht beabsichtigt die Gesellschaft von Amts wegen nach § 394 FamFG zu löschen. Die Frist zur Erhebung eines Widerspruchs ist auf zwei Monate festgesetzt."
    },
    {
      "date": "2025-11-07",
      "id": "136677",
      "original_text": "Löschungsankündigung\nNordrhein-Westfalen Amtsgericht Aachen HRB 26841\nHeer indian Cuisine UG (haftungsbeschränkt) – Aachen",
      "type": "Löschungsankündigung",
      "state": "Nordrhein-Westfalen",
      "amtsgericht": "Amtsgericht Aachen",
      "registernummer": "HRB 26841",
      "registerart": "HRB",
      "company_name": "Heer indian Cuisine UG (haftungsbeschränkt)",
      "company_seat": "Aachen",
      "details": "07.11.2025 (Bekanntmachungsdatum)\n\nNordrhein-Westfalen Amtsgericht Aachen HRB 26841\nLöschungsankündigung\n\nHeer indian Cuisine UG (haftungsbeschränkt)\nGesellschaft mit beschränkter Haftung\nAachen\n\nDas Registergericht beabsichtigt, von Amts wegen die Gesellschaft wegen Vermögenslosigkeit nach § 394 FamFG zu löschen, weil das Insolvenzverfahren Amtsgericht Aachen (Az.: 92 IN 185/24) beendet und Vermögen der Gesellschaft nicht mehr erkennbar ist.\n\nZur Geltendmachung des Widerspruchs gegen die beabsichtigte Löschung wird hiermit eine Frist von einem Monat ab Veröffentlichung dieser Ankündigung bestimmt.\n\nRechtsbehelfsbelehrung:\n\nGegen diese Verfügung kann Widerspruch eingelegt werden. Zum Widerspruch ist jeder berechtigt, der an der Unterlassung der Löschung ein berechtigtes Interesse hat.\n\nDer Widerspruch ist bei dem Amtsgericht Aachen, Adalbertsteinweg 92, 52070 Aachen schriftlich in deutscher Sprache oder zur Niederschrift der Geschäftsstelle einzulegen. Der Widerspruch kann auch zur Niederschrift der Geschäftsstelle eines jeden Amtsgerichtes abgegeben werden.\n\nDer Widerspruch muss spätestens innerhalb der gesetzten Frist nach der Bekanntgabe der Verfügung bei dem Amtsgericht Aachen eingegangen sein. Dies gilt auch dann, wenn der Widerspruch zur Niederschrift der Geschäftsstelle eines anderen Amtsgerichtes abgegeben wurde. Die Frist beginnt mit der Bekanntgabe der Verfügung durch Veröffentlichung. Fällt das Ende der Frist auf einen Sonntag, einen allgemeinen Feiertag oder Sonnabend, so endet die Frist mit Ablauf des nächsten Werktages.\n\nDer Widerspruch muss die Bezeichnung der angefochtenen Verfügung sowie die Erklärung enthalten, dass Widerspruch gegen diese Verfügung eingelegt wird. Er ist zu unterzeichnen und soll begründet werden.\n\nDie Einlegung ist auch durch Übertragung eines elektronischen Dokuments an die elektronische Poststelle des Gerichts möglich. Das elektronische Dokument muss für die Bearbeitung durch das Gericht geeignet und mit einer qualifizierten elektronischen Signatur der verantwortenden Person versehen sein oder von der verantwortenden Person signiert und auf einem sicheren Übermittlungsweg gemäß § 130 a ZPO nach näherer Maßgabe der Verordnung über die technischen Rahmenbedingungen des elektronischen Rechtsverkehrs und über das besondere elektronische Behördenpostfach (BGBl. I, S. 3803) eingereicht werden. Weitere Informationen erhalten Sie auf der Internetseite www.justiz.de."
    },
    {
      "date": "2025-11-07",
      "id": "136678",
      "original_text": "Löschungsankündigung\nNordrhein-Westfalen Amtsgericht Düsseldorf HRB 84155\nPetrotex Trading Company GmbH – Düsseldorf",
      "type": "Löschungsankündigung",
      "state": "Nordrhein-Westfalen",
      "amtsgericht": "Amtsgericht Düsseldorf",
      "registernummer": "HRB 84155",
      "registerart": "HRB",
      "company_name": "Petrotex Trading Company GmbH",
      "company_seat": "Düsseldorf",
      "details": "07.11.2025 (Bekanntmachungsdatum)\n\nNordrhein-Westfalen Amtsgericht Düsseldorf HRB 84155\nLöschungsankündigung\n\nPetrotex Trading Company GmbH\nGesellschaft mit beschränkter Haftung\nDüsseldorf\n\nBetr.: Petrotex Trading Company GmbH, Stresemannallee 4B, 41460 Neuss\n\nDas Registergericht beabsichtigt die Gesellschaft von Amts wegen nach § 394 Abs. 1 FamFG zu löschen. Die Frist zur Erhebung eines Widerspruchs ist auf 3 Wochen festgesetzt.\n\nRechtsbehelfsbelehrung:\n\nDas Widerspruchsrecht steht jedem zu, der an der Unterlassung der Löschung ein berechtigtes Interesse hat. Der Widerspruch ist bei dem Amtsgericht Düsseldorf -Registergericht-, Werdener Straße 1, 40227 Düsseldorf schriftlich in deutscher Sprache oder zur Niederschrift der Geschäftsstelle einzulegen. Der Widerspruch kann auch zur Niederschrift der Geschäftsstelle eines jeden Amtsgerichtes abgegeben werden. Die Einlegung ist auch durch Übertragung eines elektronischen Dokuments an die elektronische Poststelle des Gerichts möglich. Das elektronische Dokument muss für die Bearbeitung durch das Gericht geeignet und mit einer qualifizierten elektronischen Signatur der verantwortenden Person versehen sein oder von der verantwortenden Person signiert und auf einem sicheren Übermittlungsweg gemäß § 130a ZPO nach näherer Maßgabe der Verordnung über die technischen Rahmenbedingungen des elektronischen Rechtsverkehrs und über das besondere elektronische Behördenpostfach (BGBl. I, S.3803) eingereicht werden. Weitere Informationen erhalten Sie auf der Internetseite www.justiz.de.\nDer Widerspruch muss spätestens innerhalb der gesetzten Frist nach dem Datum der Bekanntmachung der Löschungsankündigung bei dem Amtsgericht - Registergericht - Düsseldorf eingegangen sein.  Dies gilt auch dann, wenn der Widerspruch zur Niederschrift der Geschäftsstelle eines anderen Amtsgerichtes abgegeben wurde. Die Frist beginnt mit dem Tage der Bekanntmachung der Löschungsankündigung in dem für die Bekanntmachung der Eintragungen in das Handelsregister bestimmten elektronischen Informations- und Kommunikationssystem nach § 10 des Handelsgesetzbuches. Fällt das Ende der Frist auf einen Sonntag, einen allgemeinen Feiertag oder Sonnabend, so endet die Frist mit Ablauf des nächsten Werktages.\nDer Widerspruch muss die Bezeichnung der angefochtenen Löschungsankündigung sowie die Erklärung enthalten, dass Widerspruch gegen diese Löschungsankündigung eingelegt wird. Er ist zu unterzeichnen und soll begründet werden."
    },
    {
      "date": "2025-11-07",
      "id": "136679",
      "original_text": "Einreichung neuer Dokumente\nNordrhein-Westfalen Amtsgericht Köln HRB 78356\nAxalta Coating Systems Verwaltungs GmbH – Köln",
      "type": "Einreichung neuer Dokumente",
      "state": "Nordrhein-Westfalen",
      "amtsgericht": "Amtsgericht Köln",
      "registernummer": "HRB 78356",
      "registerart": "HRB",
      "company_name": "Axalta Coating Systems Verwaltungs GmbH",
      "company_seat": "Köln",
      "details": "07.11.2025 (Bekanntmachungsdatum)\n\nNordrhein-Westfalen Amtsgericht Köln HRB 78356\nEinreichung neuer Dokumente\n\nAxalta Coating Systems Verwaltungs GmbH\nGesellschaft mit beschränkter Haftung\nKöln\n\nDem Registergericht ist eine Liste der Mitglieder des Aufsichtsrates eingereicht worden."
    },
    {
      "date": "2025-11-07",
      "id": "136680",
      "original_text": "Registerbekanntmachung nach dem Umwandlungsgesetz\nNordrhein-Westfalen Amtsgericht Bochum HRA 7010\nkugellager-online GmbH & Co. KG – Bochum",
      "type": "Registerbekanntmachung nach dem Umwandlungsgesetz",
      "state": "Nordrhein-Westfalen",
      "amtsgericht": "Amtsgericht Bochum",
      "registernummer": "HRA 7010",
      "registerart": "HRA",
      "company_name": "kugellager-online GmbH & Co. KG",
      "company_seat": "Bochum",
      "details": "07.11.2025 (Bekanntmachungsdatum)\n\nNordrhein-Westfalen Amtsgericht Bochum HRA 7010\nRegisterbekanntmachung nach dem Umwandlungsgesetz 06.11.2025 (Eintragungsdatum)\n\nkugellager-online GmbH & Co. KG\nKommanditgesellschaft\nBochum\n\nDen Gläubigern der an der Verschmelzung beteiligten Rechtsträger ist, wenn sie binnen sechs Monaten nach dem Tag, an dem die Eintragung der Verschmelzung in das Register des Sitzes desjenigen Rechtsträgers, dessen Gläubiger sie sind, nach § 19 Absatz 3 UmwG als bekanntgemacht gilt, ihren Anspruch nach Grund und Höhe schriftlich anmelden, Sicherheit zu leisten, soweit sie nicht Befriedigung verlangen können. Dieses Recht steht den Gläubigern jedoch nur zu, wenn sie glaubhaft machen, dass durch die Verschmelzung die Erfüllung ihrer Forderung gefährdet wird."
    },
    {
      "date": "2025-11-07",
      "id": "136681",
      "original_text": "Einreichung neuer Dokumente\nNordrhein-Westfalen Amtsgericht Bad Oeynhausen HRB 3420\nSänger Service GmbH – Löhne",
      "type": "Einreichung neuer Dokumente",
      "state": "Nordrhein-Westfalen",
      "amtsgericht": "Amtsgericht Bad Oeynhausen",
      "registernummer": "HRB 3420",
      "registerart": "HRB",
      "company_name": "Sänger Service GmbH",
      "company_seat": "Löhne",
      "details": "07.11.2025 (Bekanntmachungsdatum)\n\nNordrhein-Westfalen Amtsgericht Bad Oeynhausen HRB 3420\nEinreichung neuer Dokumente 07.11.2025 (Eintragungsdatum)\n\nSänger Service GmbH\nGesellschaft mit beschränkter Haftung\nLöhne\n\nDem Registergericht ist eine Liste der Mitglieder des Beirates eingereicht worden."
    },
    {
      "date": "2025-11-07",
      "id": "136682",
      "original_text": "Löschungsankündigung\nNordrhein-Westfalen Amtsgericht Dortmund HRB 16650 früher Amtsgericht Castrop-Rauxel\nVallo Med Health Care GmbH – Castrop-Rauxel",
      "type": "Löschungsankündigung",
      "state": "Nordrhein-Westfalen",
      "amtsgericht": "Amtsgericht Dortmund",
      "registernummer": "HRB 16650",
      "registerart": "HRB",
      "company_name": "Vallo Med Health Care GmbH",
      "company_seat": "Castrop-Rauxel",
      "former_amtsgericht": "Castrop-Rauxel",
      "details": "07.11.2025 (Bekanntmachungsdatum)\n\nNordrhein-Westfalen Amtsgericht Dortmund HRB 16650 früher Amtsgericht Castrop-Rauxel\nLöschungsankündigung\n\nVallo Med Health Care GmbH\nGesellschaft mit beschränkter Haftung\nCastrop-Rauxel\n\nDas Registergericht beabsichtigt die Gesellschaft von Amts wegen nach § 394 FamFG zu löschen. Die Frist zur Erhebung eines Widerspruchs ist auf einen Monat festgesetzt."
    },
    {
      "date": "2025-11-07",
      "id": "136683",
      "original_text": "Löschungsankündigung\nNordrhein-Westfalen Amtsgericht Bonn HRB 28768\nSWIFT-FLOW logistics GmbH – Euskirchen",
      "type": "Löschungsankündigung",
      "state": "Nordrhein-Westfalen",
      "amtsgericht": "Amtsgericht Bonn",
      "registernummer": "HRB 28768",
      "registerart": "HRB",
      "company_name": "SWIFT-FLOW logistics GmbH",
      "company_seat": "Euskirchen",
      "details": "07.11.2025 (Bekanntmachungsdatum)\n\nNordrhein-Westfalen Amtsgericht Bonn HRB 28768\nLöschungsankündigung\n\nSWIFT-FLOW logistics GmbH\nGesellschaft mit beschränkter Haftung\nEuskirchen\n\nDas Registergericht beabsichtigt die Gesellschaft von Amts wegen nach § 394 FamFG zu löschen. Die Frist zur Erhebung eines Widerspruchs ist auf einen Monat festgesetzt."
    },
    {
      "date": "2025-11-07",
      "id": "136684",
      "original_text": "Registerbekanntmachung nach dem Umwandlungsgesetz\nNordrhein-Westfalen Amtsgericht Duisburg VR 50824\nFamilien- und Krankenpflege e.V. Mülheim an der Ruhr – Mülheim an der Ruhr",
      "type": "Registerbekanntmachung nach dem Umwandlungsgesetz",
      "state": "Nordrhein-Westfalen",
      "amtsgericht": "Amtsgericht Duisburg",
      "registernummer": "VR 50824",
      "registerart": "VR",
      "company_name": "Familien- und Krankenpflege e.V. Mülheim an der Ruhr",
      "company_seat": "Mülheim an der Ruhr",
      "details": "07.11.2025 (Bekanntmachungsdatum)\n\nNordrhein-Westfalen Amtsgericht Duisburg VR 50824\nRegisterbekanntmachung nach dem Umwandlungsgesetz 07.11.2025 (Eintragungsdatum)\n\nFamilien- und Krankenpflege e.V. Mülheim an der Ruhr\neingetragener Verein\nMülheim an der Ruhr\n\nDen Gläubigern der an der Verschmelzung beteiligten Rechtsträger ist, wenn sie binnen sechs Monaten nach dem Tag, an dem die Eintragung der Verschmelzung in das Register des Sitzes desjenigen Rechtsträgers, dessen Gläubiger sie sind, nach § 19 Absatz 3 UmwG als bekanntgemacht gilt, ihren Anspruch nach Grund und Höhe schriftlich anmelden, Sicherheit zu leisten, soweit sie nicht Befriedigung verlangen können. Dieses Recht steht den Gläubigern jedoch nur zu, wenn sie glaubhaft machen, dass durch die Verschmelzung die Erfüllung ihrer Forderung gefährdet wird."
    },
    {
      "date": "2025-11-07",
      "id": "136685",
      "original_text": "Registerbekanntmachung nach dem Umwandlungsgesetz\nNordrhein-Westfalen Amtsgericht Steinfurt HRA 3855\nWestermann GmbH & Co. KG – Ibbenbüren",
      "type": "Registerbekanntmachung nach dem Umwandlungsgesetz",
      "state": "Nordrhein-Westfalen",
      "amtsgericht": "Amtsgericht Steinfurt",
      "registernummer": "HRA 3855",
      "registerart": "HRA",
      "company_name": "Westermann GmbH & Co. KG",
      "company_seat": "Ibbenbüren",
      "details": "07.11.2025 (Bekanntmachungsdatum)\n\nNordrhein-Westfalen Amtsgericht Steinfurt HRA 3855\nRegisterbekanntmachung nach dem Umwandlungsgesetz 07.11.2025 (Eintragungsdatum)\n\nWestermann GmbH & Co. KG\nKommanditgesellschaft\nIbbenbüren\n\nDen Gläubigern der an der Verschmelzung beteiligten Rechtsträger ist, wenn sie binnen sechs Monaten nach dem Tag, an dem die Eintragung der Verschmelzung in das Register des Sitzes desjenigen Rechtsträgers, dessen Gläubiger sie sind, nach § 19 Absatz 3 UmwG als bekanntgemacht gilt, ihren Anspruch nach Grund und Höhe schriftlich anmelden, Sicherheit zu leisten, soweit sie nicht Befriedigung verlangen können. Dieses Recht steht den Gläubigern jedoch nur zu, wenn sie glaubhaft machen, dass durch die Verschmelzung die Erfüllung ihrer Forderung gefährdet wird."
    },
    {
      "date": "2025-11-07",
      "id": "136686",
      "original_text": "Einreichung neuer Dokumente\nNordrhein-Westfalen Amtsgericht Düren HRB 3498\nForschungszentrum Jülich GmbH – Jülich",
      "type": "Einreichung neuer Dokumente",
      "state": "Nordrhein-Westfalen",
      "amtsgericht": "Amtsgericht Düren",
      "registernummer": "HRB 3498",
      "registerart": "HRB",
      "company_name": "Forschungszentrum Jülich GmbH",
      "company_seat": "Jülich",
      "details": "07.11.2025 (Bekanntmachungsdatum)\n\nNordrhein-Westfalen Amtsgericht Düren HRB 3498\nEinreichung neuer Dokumente 07.11.2025 (Eintragungsdatum)\n\nForschungszentrum Jülich GmbH\nGesellschaft mit beschränkter Haftung\nJülich\n\nDem Registergericht ist eine neue Liste der Mitglieder des Aufsichtsrates eingereicht worden."
    },
    {
      "date": "2025-11-07",
      "id": "136687",
      "original_text": "Registerbekanntmachung nach dem Umwandlungsgesetz\nNordrhein-Westfalen Amtsgericht Lemgo HRA 6142\nTechniplas PD GmbH & Co. KG – Bad Salzuflen",
      "type": "Registerbekanntmachung nach dem Umwandlungsgesetz",
      "state": "Nordrhein-Westfalen",
      "amtsgericht": "Amtsgericht Lemgo",
      "registernummer": "HRA 6142",
      "registerart": "HRA",
      "company_name": "Techniplas PD GmbH & Co. KG",
      "company_seat": "Bad Salzuflen",
      "details": "07.11.2025 (Bekanntmachungsdatum)\n\nNordrhein-Westfalen Amtsgericht Lemgo HRA 6142\nRegisterbekanntmachung nach dem Umwandlungsgesetz 07.11.2025 (Eintragungsdatum)\n\nTechniplas PD GmbH & Co. KG\nKommanditgesellschaft\nBad Salzuflen\n\nDen Gläubigern der an der Verschmelzung beteiligten Rechtsträger ist, wenn sie binnen sechs Monaten nach dem Tag, an dem die Eintragung der Verschmelzung in das Register des Sitzes desjenigen Rechtsträgers, dessen Gläubiger sie sind, nach § 19 Absatz 3 UmwG als bekanntgemacht gilt, ihren Anspruch nach Grund und Höhe schriftlich anmelden, Sicherheit zu leisten, soweit sie nicht Befriedigung verlangen können. Dieses Recht steht den Gläubigern jedoch nur zu, wenn sie glaubhaft machen, dass durch die Verschmelzung die Erfüllung ihrer Forderung gefährdet wird."
    },
    {
      "date": "2025-11-07",
      "id": "136688",
      "original_text": "Registerbekanntmachung nach dem Umwandlungsgesetz\nNordrhein-Westfalen Amtsgericht Steinfurt HRB 5148\nSchmitz GmbH – Ibbenbüren",
      "type": "Registerbekanntmachung nach dem Umwandlungsgesetz",
      "state": "Nordrhein-Westfalen",
      "amtsgericht": "Amtsgericht Steinfurt",
      "registernummer": "HRB 5148",
      "registerart": "HRB",
      "company_name": "Schmitz GmbH",
      "company_seat": "Ibbenbüren",
      "details": "07.11.2025 (Bekanntmachungsdatum)\n\nNordrhein-Westfalen Amtsgericht Steinfurt HRB 5148\nRegisterbekanntmachung nach dem Umwandlungsgesetz 07.11.2025 (Eintragungsdatum)\n\nSchmitz GmbH\nGesellschaft mit beschränkter Haftung\nIbbenbüren\n\nDen Gläubigern der an der Verschmelzung beteiligten Rechtsträger ist, wenn sie binnen sechs Monaten nach dem Tag, an dem die Eintragung der Verschmelzung in das Register des Sitzes derjenigen Rechtsträger deren Gläubiger sie sind, nach § 19 Absatz 3 UmwG als bekanntgemacht gilt, ihren Anspruch nach Grund und Höhe schriftlich anmelden, Sicherheit zu leisten, soweit sie nicht Befriedigung verlangen können. Dieses Recht steht den Gläubigern jedoch nur zu, wenn sie glaubhaft machen, dass durch die Verschmelzung die Erfüllung ihrer Forderung gefährdet wird."
    },
    {
      "date": "2025-11-07",
      "id": "136689",
      "original_text": "Registerbekanntmachung nach dem Umwandlungsgesetz\nBremen Amtsgericht Bremen HRB 25601\nHöpkens Park c+e GmbH – Bremen",
      "type": "Registerbekanntmachung nach dem Umwandlungsgesetz",
      "state": "Bremen",
      "amtsgericht": "Amtsgericht Bremen",
      "registernummer": "HRB 25601",
      "registerart": "HRB",
      "company_name": "Höpkens Park c+e GmbH",
      "company_seat": "Bremen",
      "details": "07.11.2025 (Bekanntmachungsdatum)\n\nBremen Amtsgericht Bremen HRB 25601\nRegisterbekanntmachung nach dem Umwandlungsgesetz 06.11.2025 (Eintragungsdatum)\n\nHöpkens Park c+e GmbH\nGesellschaft mit beschränkter Haftung\nBremen\n\nZu Eintragungsnummer 7 vom 06.11.2025 wird als nicht eingetragen veröffentlicht: Den Gläubigern der an der Verschmelzung beteiligten Rechtsträger ist, wenn sie binnen sechs Monaten nach dem Tag, an dem die Eintragung der Verschmelzung in das Register des Sitzes desjenigen Rechtsträgers, dessen Gläubiger sie sind, als bekannt gemacht gilt, ihren Anspruch nach Grund und Höhe schriftlich anmelden, Sicherheit zu leisten, soweit sie nicht Befriedigung verlangen können. Dieses Recht steht den Gläubigern jedoch nur zu, wenn sie glaubhaft machen, dass durch die Verschmelzung die Erfüllung ihrer Forderung gefährdet wird. Das Recht, Sicherheitsleistung zu verlangen, steht Gläubigern nicht zu, die im Falle der Insolvenz ein Recht auf vorzugsweise Befriedigung aus einer Deckungsmasse haben, die nach gesetzlicher Vorschrift zu ihrem Schutz errichtet und staatlich überwacht ist."
    },
    {
      "date": "2025-11-07",
      "id": "136690",
      "original_text": "Registerbekanntmachung nach dem Umwandlungsgesetz\nBremen Amtsgericht Bremen HRB 25601\nHöpkens Park c+e GmbH – Bremen",
      "type": "Registerbekanntmachung nach dem Umwandlungsgesetz",
      "state": "Bremen",
      "amtsgericht": "Amtsgericht Bremen",
      "registernummer": "HRB 25601",
      "registerart": "HRB",
      "company_name": "Höpkens Park c+e GmbH",
      "company_seat": "Bremen",
      "details": "07.11.2025 (Bekanntmachungsdatum)\n\nBremen Amtsgericht Bremen HRB 25601\nRegisterbekanntmachung nach dem Umwandlungsgesetz 06.11.2025 (Eintragungsdatum)\n\nHöpkens Park c+e GmbH\nGesellschaft mit beschränkter Haftung\nBremen\n\nZu Eintragungsnummer 8 vom 06.11.2025 wird als nicht eingetragen veröffentlicht: Den Gläubigern der an der Verschmelzung beteiligten Rechtsträger ist, wenn sie binnen sechs Monaten nach dem Tag, an dem die Eintragung der Verschmelzung in das Register des Sitzes desjenigen Rechtsträgers, dessen Gläubiger sie sind, als bekannt gemacht gilt, ihren Anspruch nach Grund und Höhe schriftlich anmelden, Sicherheit zu leisten, soweit sie nicht Befriedigung verlangen können. Dieses Recht steht den Gläubigern jedoch nur zu, wenn sie glaubhaft machen, dass durch die Verschmelzung die Erfüllung ihrer Forderung gefährdet wird. Das Recht, Sicherheitsleistung zu verlangen, steht Gläubigern nicht zu, die im Falle der Insolvenz ein Recht auf vorzugsweise Befriedigung aus einer Deckungsmasse haben, die nach gesetzlicher Vorschrift zu ihrem Schutz errichtet und staatlich überwacht ist."
    },
    {
      "date": "2025-11-07",
      "id": "136691",
      "original_text": "Registerbekanntmachung nach dem Umwandlungsgesetz\nBremen Amtsgericht Bremen HRB 35331\nHP Holiday GmbH – Bremen",
      "type": "Registerbekanntmachung nach dem Umwandlungsgesetz",
      "state": "Bremen",
      "amtsgericht": "Amtsgericht Bremen",
      "registernummer": "HRB 35331",
      "registerart": "HRB",
      "company_name": "HP Holiday GmbH",
      "company_seat": "Bremen",
      "details": "07.11.2025 (Bekanntmachungsdatum)\n\nBremen Amtsgericht Bremen HRB 35331\nRegisterbekanntmachung nach dem Umwandlungsgesetz 06.11.2025 (Eintragungsdatum)\n\nHP Holiday GmbH\nGesellschaft mit beschränkter Haftung\nBremen\n\nZu Eintragungsnummer 2 vom 06.11.2025 wird als nicht eingetragen veröffentlicht: Den Gläubigern der an der Verschmelzung beteiligten Rechtsträger ist, wenn sie binnen sechs Monaten nach dem Tag, an dem die Eintragung der Verschmelzung in das Register des Sitzes desjenigen Rechtsträgers, dessen Gläubiger sie sind, als bekannt gemacht gilt, ihren Anspruch nach Grund und Höhe schriftlich anmelden, Sicherheit zu leisten, soweit sie nicht Befriedigung verlangen können. Dieses Recht steht den Gläubigern jedoch nur zu, wenn sie glaubhaft machen, dass durch die Verschmelzung die Erfüllung ihrer Forderung gefährdet wird. Das Recht, Sicherheitsleistung zu verlangen, steht Gläubigern nicht zu, die im Falle der Insolvenz ein Recht auf vorzugsweise Befriedigung aus einer Deckungsmasse haben, die nach gesetzlicher Vorschrift zu ihrem Schutz errichtet und staatlich überwacht ist."
    },
    {
      "date": "2025-11-07",
      "id": "136692",
      "original_text": "Registerbekanntmachung nach dem Umwandlungsgesetz\nBremen Amtsgericht Bremen HRB 38334\nHP SBW UG (haftungsbeschränkt) – Bremen",
      "type": "Registerbekanntmachung nach dem Umwandlungsgesetz",
      "state": "Bremen",
      "amtsgericht": "Amtsgericht Bremen",
      "registernummer": "HRB 38334",
      "registerart": "HRB",
      "company_name": "HP SBW UG (haftungsbeschränkt)",
      "company_seat": "Bremen",
      "details": "07.11.2025 (Bekanntmachungsdatum)\n\nBremen Amtsgericht Bremen HRB 38334\nRegisterbekanntmachung nach dem Umwandlungsgesetz 06.11.2025 (Eintragungsdatum)\n\nHP SBW UG (haftungsbeschränkt)\nGesellschaft mit beschränkter Haftung\nBremen\n\nZu Eintragungsnummer 2 vom 06.11.2025 wird als nicht eingetragen veröffentlicht: Den Gläubigern der an der Verschmelzung beteiligten Rechtsträger ist, wenn sie binnen sechs Monaten nach dem Tag, an dem die Eintragung der Verschmelzung in das Register des Sitzes desjenigen Rechtsträgers, dessen Gläubiger sie sind, als bekannt gemacht gilt, ihren Anspruch nach Grund und Höhe schriftlich anmelden, Sicherheit zu leisten, soweit sie nicht Befriedigung verlangen können. Dieses Recht steht den Gläubigern jedoch nur zu, wenn sie glaubhaft machen, dass durch die Verschmelzung die Erfüllung ihrer Forderung gefährdet wird. Das Recht, Sicherheitsleistung zu verlangen, steht Gläubigern nicht zu, die im Falle der Insolvenz ein Recht auf vorzugsweise Befriedigung aus einer Deckungsmasse haben, die nach gesetzlicher Vorschrift zu ihrem Schutz errichtet und staatlich überwacht ist."
    },
    {
      "date": "2025-11-07",
      "id": "136693",
      "original_text": "Registerbekanntmachung nach dem Umwandlungsgesetz\nThüringen Amtsgericht Jena HRB 513882\nBerger Consulting GmbH – Moßbach",
      "type": "Registerbekanntmachung nach dem Umwandlungsgesetz",
      "state": "Thüringen",
      "amtsgericht": "Amtsgericht Jena",
      "registernummer": "HRB 513882",
      "registerart": "HRB",
      "company_name": "Berger Consulting GmbH",
      "company_seat": "Moßbach",
      "details": "07.11.2025 (Bekanntmachungsdatum)\n\nThüringen Amtsgericht Jena HRB 513882\nRegisterbekanntmachung nach dem Umwandlungsgesetz 07.11.2025 (Eintragungsdatum)\n\nBerger Consulting GmbH\nGesellschaft mit beschränkter Haftung\nMoßbach\n\nDie Gesellschaft ist aufgrund des Verschmelzungsvertrages vom 13.08.2025 sowie des Beschlusses der Gesellschafterversammlung vom selben Tag mit dem Vermögen des Alleingesellschafters Berger, René, Moßbach, *09.08.1978 verschmolzen. Tag der Eintragung:07.11.2025\nNicht eingetragen: Den Gläubigern der an der Verschmelzung beteiligten Rechtsträger, ist wenn sie binnen sechs Monaten nach dem Tag, an dem die Eintragung der Verschmelzung in das Register des Sitzes desjenigen Rechtsträgers, dessen Gläubiger sie sind,  nach § 19 Abs. 3 UmwG als bekanntgemacht gilt, ihren Anspruch nach Grund und Höhe schriftlich anmelden, Sicherheit zu leisten, soweit sie nicht Befriedigung verlangen können. Dieses Recht steht ihnen jedoch nur zu, wenn sie glaubhaft machen, daß durch die Verschmelzung die Erfüllung ihrer Forderung gefährdet wird."
    },
    {
      "date": "2025-11-07",
      "id": "136694",
      "original_text": "Registerbekanntmachung nach dem Umwandlungsgesetz\nHessen Amtsgericht Eschwege HRB 3097\nENBRO GmbH – Sontra",
      "type": "Registerbekanntmachung nach dem Umwandlungsgesetz",
      "state": "Hessen",
      "amtsgericht": "Amtsgericht Eschwege",
      "registernummer": "HRB 3097",
      "registerart": "HRB",
      "company_name": "ENBRO GmbH",
      "company_seat": "Sontra",
      "details": "07.11.2025 (Bekanntmachungsdatum)\n\nHessen Amtsgericht Eschwege HRB 3097\nRegisterbekanntmachung nach dem Umwandlungsgesetz 07.11.2025 (Eintragungsdatum)\n\nENBRO GmbH\nGesellschaft mit beschränkter Haftung\nSontra\n\nDen Gläubigern der an der Verschmelzung beteiligten Rechtsträger ist, wenn sie binnen sechs Monaten nach dem Tag, an dem die Eintragung der Verschmelzung in das Register des Sitzes desjenigen Rechtsträgers, dessen Gläubiger sie sind, nach § 19 Absatz 3 UmwG bekannt gemacht worden ist, ihren Anspruch nach Grund und Höhe schriftlich anmelden, Sicherheit zu leisten, soweit sie nicht Befriedigung verlangen können. Dieses Recht steht den Gläubigern jedoch nur zu, wenn sie glaubhaft machen, dass durch die Verschmelzung die Erfüllung ihrer Forderung gefährdet wird."
    },
    {
      "date": "2025-11-07",
      "id": "136695",
      "original_text": "Sonstige Registerbekanntmachung\nHessen Amtsgericht Wetzlar VR 4794\nOttspot e. V. – Wetzlar",
      "type": "Sonstige Registerbekanntmachung",
      "state": "Hessen",
      "amtsgericht": "Amtsgericht Wetzlar",
      "registernummer": "VR 4794",
      "registerart": "VR",
      "company_name": "Ottspot e. V.",
      "company_seat": "Wetzlar",
      "details": "07.11.2025 (Bekanntmachungsdatum)\n\nHessen Amtsgericht Wetzlar VR 4794\nSonstige Registerbekanntmachung 07.11.2025 (Eintragungsdatum)\n\nOttspot e. V.\neingetragener Verein\nWetzlar\n\nDer Verein ist aufgelöst."
    },
    {
      "date": "2025-11-07",
      "id": "136696",
      "original_text": "Registerbekanntmachung nach dem Umwandlungsgesetz\nHessen Amtsgericht Frankfurt am Main HRB 85306\nVanEck (Europe) GmbH – Frankfurt am Main",
      "type": "Registerbekanntmachung nach dem Umwandlungsgesetz",
      "state": "Hessen",
      "amtsgericht": "Amtsgericht Frankfurt am Main",
      "registernummer": "HRB 85306",
      "registerart": "HRB",
      "company_name": "VanEck (Europe) GmbH",
      "company_seat": "Frankfurt am Main",
      "details": "07.11.2025 (Bekanntmachungsdatum)\n\nHessen Amtsgericht Frankfurt am Main HRB 85306\nRegisterbekanntmachung nach dem Umwandlungsgesetz 07.11.2025 (Eintragungsdatum)\n\nVanEck (Europe) GmbH\nGesellschaft mit beschränkter Haftung\nFrankfurt am Main\n\nDen Gläubigern der an der Verschmelzung beteiligten Rechtsträger ist, wenn sie binnen sechs Monaten nach dem Tag, an dem die Eintragung der Verschmelzung in das Register des Sitzes desjenigen Rechtsträgers, dessen Gläubiger sie sind, nach § 19 Absatz 3 UmwG bekannt gemacht worden ist, ihren Anspruch nach Grund und Höhe schriftlich anmelden, Sicherheit zu leisten, soweit sie nicht Befriedigung verlangen können. Dieses Recht steht den Gläubigern jedoch nur zu, wenn sie glaubhaft machen, dass durch die Verschmelzung die Erfüllung ihrer Forderung gefährdet wird."
    },
    {
      "date": "2025-11-07",
      "id": "136697",
      "original_text": "Sonstige Registerbekanntmachung\nHessen Amtsgericht Kassel VR 5554\nReitverein Sternenhof Calden e.V. – Calden",
      "type": "Sonstige Registerbekanntmachung",
      "state": "Hessen",
      "amtsgericht": "Amtsgericht Kassel",
      "registernummer": "VR 5554",
      "registerart": "VR",
      "company_name": "Reitverein Sternenhof Calden e.V.",
      "company_seat": "Calden",
      "details": "07.11.2025 (Bekanntmachungsdatum)\n\nHessen Amtsgericht Kassel VR 5554\nSonstige Registerbekanntmachung 07.11.2025 (Eintragungsdatum)\n\nReitverein Sternenhof Calden e.V.\neingetragener Verein\nCalden\n\nDer Verein ist aufgelöst."
    },
    {
      "date": "2025-11-07",
      "id": "136698",
      "original_text": "Löschungsankündigung\nHessen Amtsgericht Frankfurt am Main HRB 123932\nCreate More UG (haftungsbeschränkt) – Frankfurt am Main",
      "type": "Löschungsankündigung",
      "state": "Hessen",
      "amtsgericht": "Amtsgericht Frankfurt am Main",
      "registernummer": "HRB 123932",
      "registerart": "HRB",
      "company_name": "Create More UG (haftungsbeschränkt)",
      "company_seat": "Frankfurt am Main",
      "details": "07.11.2025 (Bekanntmachungsdatum)\n\nHessen Amtsgericht Frankfurt am Main HRB 123932\nLöschungsankündigung\n\nCreate More UG (haftungsbeschränkt)\nGesellschaft mit beschränkter Haftung\nFrankfurt am Main\n\nDas Registergericht beabsichtigt die im Handelsregister eingetragene Gesellschaft von Amts wegen nach § 394 FamFG zu löschen. Die Frist zur Erhebung eines Widerspruchs gegen die beabsichtigte Löschung wird auf 1 Monat festgesetzt."
    },
    {
      "date": "2025-11-07",
      "id": "136699",
      "original_text": "Registerbekanntmachung nach dem Umwandlungsgesetz\nHessen Amtsgericht Kassel HRA 18434\nSebastian Kermer Dachdeckermeisterbetrieb e. K. – Baunatal",
      "type": "Registerbekanntmachung nach dem Umwandlungsgesetz",
      "state": "Hessen",
      "amtsgericht": "Amtsgericht Kassel",
      "registernummer": "HRA 18434",
      "registerart": "HRA",
      "company_name": "Sebastian Kermer Dachdeckermeisterbetrieb e. K.",
      "company_seat": "Baunatal",
      "details": "07.11.2025 (Bekanntmachungsdatum)\n\nHessen Amtsgericht Kassel HRA 18434\nRegisterbekanntmachung nach dem Umwandlungsgesetz 07.11.2025 (Eintragungsdatum)\n\nSebastian Kermer Dachdeckermeisterbetrieb e. K.\nEinzelkaufmann / Einzelkauffrau\nBaunatal\n\nDen Gläubigern der an der Ausgliederung beteiligten Rechtsträger ist, wenn sie binnen sechs Monaten nach dem Tag, an dem die Eintragung der Ausgliederung in das Register des Sitzes desjenigen Rechtsträgers, dessen Gläubiger sie sind, nach §§ 125, 19 Absatz 3 UmwG bekannt gemacht worden ist, ihren Anspruch nach Grund und Höhe schriftlich anmelden, Sicherheit zu leisten, soweit sie nicht Befriedigung verlangen können. Dieses Recht steht den Gläubigern jedoch nur zu, wenn sie glaubhaft machen, dass durch die Ausgliederung die Erfüllung ihrer Forderung gefährdet wird."
    },
    {
      "date": "2025-11-07",
      "id": "136700",
      "original_text": "Einreichung neuer Dokumente\nHessen Amtsgericht Frankfurt am Main HRB 89041\nDEMIRE Deutsche Mittelstand Real Estate AG – Frankfurt am Main",
      "type": "Einreichung neuer Dokumente",
      "state": "Hessen",
      "amtsgericht": "Amtsgericht Frankfurt am Main",
      "registernummer": "HRB 89041",
      "registerart": "HRB",
      "company_name": "DEMIRE Deutsche Mittelstand Real Estate AG",
      "company_seat": "Frankfurt am Main",
      "details": "07.11.2025 (Bekanntmachungsdatum)\n\nHessen Amtsgericht Frankfurt am Main HRB 89041\nEinreichung neuer Dokumente\n\nDEMIRE Deutsche Mittelstand Real Estate AG\nAktiengesellschaft\nFrankfurt am Main\n\nDurch eine Änderung in den Personen der Aufsichtsratsmitglieder ist eine Liste der Mitglieder des Aufsichtsrates zum Handelsregister eingereicht worden."
    },
    {
      "date": "2025-11-07",
      "id": "136701",
      "original_text": "Einreichung neuer Dokumente\nHessen Amtsgericht Frankfurt am Main HRB 139246\nSweco GmbH – Frankfurt am Main",
      "type": "Einreichung neuer Dokumente",
      "state": "Hessen",
      "amtsgericht": "Amtsgericht Frankfurt am Main",
      "registernummer": "HRB 139246",
      "registerart": "HRB",
      "company_name": "Sweco GmbH",
      "company_seat": "Frankfurt am Main",
      "details": "07.11.2025 (Bekanntmachungsdatum)\n\nHessen Amtsgericht Frankfurt am Main HRB 139246\nEinreichung neuer Dokumente 07.11.2025 (Eintragungsdatum)\n\nSweco GmbH\nGesellschaft mit beschränkter Haftung\nFrankfurt am Main\n\nDurch eine Änderung in den Personen der Aufsichtsratsmitglieder ist eine Liste der Mitglieder des Aufsichtsrates zum Handelsregister eingereicht worden."
    },
    {
      "date": "2025-11-07",
      "id": "136702",
      "original_text": "Registerbekanntmachung nach dem Umwandlungsgesetz\nHessen Amtsgericht Kassel HRA 18391\nMAXMARK Immelnkämper & Ziller Marketing oHG – Kassel",
      "type": "Registerbekanntmachung nach dem Umwandlungsgesetz",
      "state": "Hessen",
      "amtsgericht": "Amtsgericht Kassel",
      "registernummer": "HRA 18391",
      "registerart": "HRA",
      "company_name": "MAXMARK Immelnkämper & Ziller Marketing oHG",
      "company_seat": "Kassel",
      "details": "07.11.2025 (Bekanntmachungsdatum)\n\nHessen Amtsgericht Kassel HRA 18391\nRegisterbekanntmachung nach dem Umwandlungsgesetz 07.11.2025 (Eintragungsdatum)\n\nMAXMARK Immelnkämper & Ziller Marketing oHG\nOffene Handelsgesellschaft\nKassel\n\nDen Gläubigern der an der formwechselnden Umwandlung beteiligten Rechtsträger ist, wenn sie binnen sechs Monaten nach dem Tag, an dem die Eintragung der formwechselnden Umwandlung in das Register des Sitzes desjenigen Rechtsträgers, dessen Gläubiger sie sind, nach § 201 UmwG bekannt gemacht worden ist, ihren Anspruch nach Grund und Höhe schriftlich anmelden, Sicherheit zu leisten, soweit sie nicht Befriedigung verlangen können. Dieses Recht steht den Gläubigern jedoch nur zu, wenn sie glaubhaft machen, dass durch die formwechselnden Umwandlung die Erfüllung ihrer Forderung gefährdet wird."
    },
    {
      "date": "2025-11-07",
      "id": "136703",
      "original_text": "Registerbekanntmachung nach dem Umwandlungsgesetz\nHessen Amtsgericht Frankfurt am Main HRB 133456\nSegMint GmbH – Frankfurt am Main",
      "type": "Registerbekanntmachung nach dem Umwandlungsgesetz",
      "state": "Hessen",
      "amtsgericht": "Amtsgericht Frankfurt am Main",
      "registernummer": "HRB 133456",
      "registerart": "HRB",
      "company_name": "SegMint GmbH",
      "company_seat": "Frankfurt am Main",
      "details": "07.11.2025 (Bekanntmachungsdatum)\n\nHessen Amtsgericht Frankfurt am Main HRB 133456\nRegisterbekanntmachung nach dem Umwandlungsgesetz 07.11.2025 (Eintragungsdatum)\n\nSegMint GmbH\nGesellschaft mit beschränkter Haftung\nFrankfurt am Main\n\nDen Gläubigern der an der Verschmelzung beteiligten Rechtsträger ist, wenn sie binnen sechs Monaten nach dem Tag, an dem die Eintragung der Verschmelzung in das Register des Sitzes desjenigen Rechtsträgers, dessen Gläubiger sie sind, nach § 19 Absatz 3 UmwG bekannt gemacht worden ist, ihren Anspruch nach Grund und Höhe schriftlich anmelden, Sicherheit zu leisten, soweit sie nicht Befriedigung verlangen können. Dieses Recht steht den Gläubigern jedoch nur zu, wenn sie glaubhaft machen, dass durch die Verschmelzung die Erfüllung ihrer Forderung gefährdet wird."
    },
    {
      "date": "2025-11-07",
      "id": "136704",
      "original_text": "Registerbekanntmachung nach dem Umwandlungsgesetz\nHessen Amtsgericht Königstein HRB 12294\nSAP Nederland Holding GmbH – Königstein im Taunus",
      "type": "Registerbekanntmachung nach dem Umwandlungsgesetz",
      "state": "Hessen",
      "amtsgericht": "Amtsgericht Königstein",
      "registernummer": "HRB 12294",
      "registerart": "HRB",
      "company_name": "SAP Nederland Holding GmbH",
      "company_seat": "Königstein im Taunus",
      "details": "07.11.2025 (Bekanntmachungsdatum)\n\nHessen Amtsgericht Königstein HRB 12294\nRegisterbekanntmachung nach dem Umwandlungsgesetz 03.11.2025 (Eintragungsdatum)\n\nSAP Nederland Holding GmbH\nGesellschaft mit beschränkter Haftung\nKönigstein im Taunus\n\nDen Gläubigern der an der Verschmelzung beteiligten Rechtsträger ist, wenn sie binnen sechs Monaten nach dem Tag, an dem die Eintragung der Verschmelzung in das Register des Sitzes desjenigen Rechtsträgers, dessen Gläubiger sie sind, nach § 19 Absatz 3 UmwG bekannt gemacht worden ist, ihren Anspruch nach Grund und Höhe schriftlich anmelden, Sicherheit zu leisten, soweit sie nicht Befriedigung verlangen können. Dieses Recht steht den Gläubigern jedoch nur zu, wenn sie glaubhaft machen, dass durch die Verschmelzung die Erfüllung ihrer Forderung gefährdet wird."
    },
    {
      "date": "2025-11-07",
      "id": "136705",
      "original_text": "Registerbekanntmachung nach dem Umwandlungsgesetz\nHessen Amtsgericht Königstein HRB 12294\nSAP Nederland Holding GmbH – Königstein im Taunus",
      "type": "Registerbekanntmachung nach dem Umwandlungsgesetz",
      "state": "Hessen",
      "amtsgericht": "Amtsgericht Königstein",
      "registernummer": "HRB 12294",
      "registerart": "HRB",
      "company_name": "SAP Nederland Holding GmbH",
      "company_seat": "Königstein im Taunus",
      "details": "07.11.2025 (Bekanntmachungsdatum)\n\nHessen Amtsgericht Königstein HRB 12294\nRegisterbekanntmachung nach dem Umwandlungsgesetz 07.11.2025 (Eintragungsdatum)\n\nSAP Nederland Holding GmbH\nGesellschaft mit beschränkter Haftung\nKönigstein im Taunus\n\nDen Gläubigern der an der Verschmelzung beteiligten Rechtsträger ist, wenn sie binnen sechs Monaten nach dem Tag, an dem die Eintragung der Verschmelzung in das Register des Sitzes desjenigen Rechtsträgers, dessen Gläubiger sie sind, nach § 19 Absatz 3 UmwG bekannt gemacht worden ist, ihren Anspruch nach Grund und Höhe schriftlich anmelden, Sicherheit zu leisten, soweit sie nicht Befriedigung verlangen können. Dieses Recht steht den Gläubigern jedoch nur zu, wenn sie glaubhaft machen, dass durch die Verschmelzung die Erfüllung ihrer Forderung gefährdet wird."
    },
    {
      "date": "2025-11-07",
      "id": "136706",
      "original_text": "Registerbekanntmachung nach dem Umwandlungsgesetz\nHessen Amtsgericht Eschwege HRB 3101\nJocoon GmbH – Sontra",
      "type": "Registerbekanntmachung nach dem Umwandlungsgesetz",
      "state": "Hessen",
      "amtsgericht": "Amtsgericht Eschwege",
      "registernummer": "HRB 3101",
      "registerart": "HRB",
      "company_name": "Jocoon GmbH",
      "company_seat": "Sontra",
      "details": "07.11.2025 (Bekanntmachungsdatum)\n\nHessen Amtsgericht Eschwege HRB 3101\nRegisterbekanntmachung nach dem Umwandlungsgesetz 07.11.2025 (Eintragungsdatum)\n\nJocoon GmbH\nGesellschaft mit beschränkter Haftung\nSontra\n\nDen Gläubigern der an der Verschmelzung beteiligten Rechtsträger ist, wenn sie binnen sechs Monaten nach dem Tag, an dem die Eintragung der Verschmelzung in das Register des Sitzes desjenigen Rechtsträgers, dessen Gläubiger sie sind, nach § 19 Absatz 3 UmwG bekannt gemacht worden ist, ihren Anspruch nach Grund und Höhe schriftlich anmelden, Sicherheit zu leisten, soweit sie nicht Befriedigung verlangen können. Dieses Recht steht den Gläubigern jedoch nur zu, wenn sie glaubhaft machen, dass durch die Verschmelzung die Erfüllung ihrer Forderung gefährdet wird."
    },
    {
      "date": "2025-11-07",
      "id": "136707",
      "original_text": "Registerbekanntmachung nach dem Umwandlungsgesetz\nHessen Amtsgericht Kassel HRB 20454\nMAXMARK GmbH – Kassel",
      "type": "Registerbekanntmachung nach dem Umwandlungsgesetz",
      "state": "Hessen",
      "amtsgericht": "Amtsgericht Kassel",
      "registernummer": "HRB 20454",
      "registerart": "HRB",
      "company_name": "MAXMARK GmbH",
      "company_seat": "Kassel",
      "details": "07.11.2025 (Bekanntmachungsdatum)\n\nHessen Amtsgericht Kassel HRB 20454\nRegisterbekanntmachung nach dem Umwandlungsgesetz 07.11.2025 (Eintragungsdatum)\n\nMAXMARK GmbH\nGesellschaft mit beschränkter Haftung\nKassel\n\nDen Gläubigern der an der formwechselnden Umwandlung beteiligten Rechtsträger ist, wenn sie binnen sechs Monaten nach dem Tag, an dem die Eintragung der formwechselnden Umwandlung in das Register des Sitzes desjenigen Rechtsträgers, dessen Gläubiger sie sind, nach § 201 UmwG bekannt gemacht worden ist, ihren Anspruch nach Grund und Höhe schriftlich anmelden, Sicherheit zu leisten, soweit sie nicht Befriedigung verlangen können. Dieses Recht steht den Gläubigern jedoch nur zu, wenn sie glaubhaft machen, dass durch die formwechselnden Umwandlung die Erfüllung ihrer Forderung gefährdet wird."
    },
    {
      "date": "2025-11-07",
      "id": "136708",
      "original_text": "Registerbekanntmachung nach dem Umwandlungsgesetz\nHessen Amtsgericht Offenbach am Main HRA 43041\nCWS Workwear Deutschland GmbH & Co. KG – Dreieich",
      "type": "Registerbekanntmachung nach dem Umwandlungsgesetz",
      "state": "Hessen",
      "amtsgericht": "Amtsgericht Offenbach am Main",
      "registernummer": "HRA 43041",
      "registerart": "HRA",
      "company_name": "CWS Workwear Deutschland GmbH & Co. KG",
      "company_seat": "Dreieich",
      "details": "07.11.2025 (Bekanntmachungsdatum)\n\nHessen Amtsgericht Offenbach am Main HRA 43041\nRegisterbekanntmachung nach dem Umwandlungsgesetz 07.11.2025 (Eintragungsdatum)\n\nCWS Workwear Deutschland GmbH & Co. KG\nKommanditgesellschaft\nDreieich\n\nDen Gläubigern der an der Abspaltung beteiligten Rechtsträger ist, wenn sie binnen sechs Monaten nach dem Tag, an dem die Eintragung der Abspaltung in das Register des Sitzes desjenigen Rechtsträgers, dessen Gläubiger sie sind, nach §§ 125, 19 Absatz 3 UmwG bekannt gemacht worden ist, ihren Anspruch nach Grund und Höhe schriftlich anmelden, Sicherheit zu leisten, soweit sie nicht Befriedigung verlangen können. Dieses Recht steht den Gläubigern jedoch nur zu, wenn sie glaubhaft machen, dass durch die Abspaltung die Erfüllung ihrer Forderung gefährdet wird."
    },
    {
      "date": "2025-11-07",
      "id": "136709",
      "original_text": "Löschungsankündigung\nHessen Amtsgericht Offenbach am Main HRB 54646\nA2 Projekt GmbH – Mühlheim am Main",
      "type": "Löschungsankündigung",
      "state": "Hessen",
      "amtsgericht": "Amtsgericht Offenbach am Main",
      "registernummer": "HRB 54646",
      "registerart": "HRB",
      "company_name": "A2 Projekt GmbH",
      "company_seat": "Mühlheim am Main",
      "details": "07.11.2025 (Bekanntmachungsdatum)\n\nHessen Amtsgericht Offenbach am Main HRB 54646\nLöschungsankündigung\n\nA2 Projekt GmbH\nGesellschaft mit beschränkter Haftung\nMühlheim am Main\n\nDas Registergericht beabsichtigt die im Handelsregister eingetragene Gesellschaft von Amts wegen nach § 394 FamFG zu löschen. Die Frist zur Erhebung eines Widerspruchs gegen die beabsichtigte Löschung wird auf 3 Monate festgesetzt."
    },
    {
      "date": "2025-11-07",
      "id": "136710",
      "original_text": "Registerbekanntmachung nach dem Umwandlungsgesetz\nHessen Amtsgericht Wiesbaden HRA 11732\nMetallbau Schneider e.K. – Wiesbaden",
      "type": "Registerbekanntmachung nach dem Umwandlungsgesetz",
      "state": "Hessen",
      "amtsgericht": "Amtsgericht Wiesbaden",
      "registernummer": "HRA 11732",
      "registerart": "HRA",
      "company_name": "Metallbau Schneider e.K.",
      "company_seat": "Wiesbaden",
      "details": "07.11.2025 (Bekanntmachungsdatum)\n\nHessen Amtsgericht Wiesbaden HRA 11732\nRegisterbekanntmachung nach dem Umwandlungsgesetz 07.11.2025 (Eintragungsdatum)\n\nMetallbau Schneider e.K.\nEinzelkaufmann / Einzelkauffrau\nWiesbaden\n\nDen Gläubigern der an der Ausgliederung beteiligten Rechtsträger ist, wenn sie binnen sechs Monaten nach dem Tag, an dem die Eintragung der Ausgliederung in das Register des Sitzes derjenigen Rechtsträger deren Gläubiger sie sind, nach §§ 125, 19 Absatz 3 UmwG bekannt gemacht worden ist, ihren Anspruch nach Grund und Höhe schriftlich anmelden, Sicherheit zu leisten, soweit sie nicht Befriedigung verlangen können. Dieses Recht steht den Gläubigern jedoch nur zu, wenn sie glaubhaft machen, dass durch die Ausgliederung die Erfüllung ihrer Forderung gefährdet wird."
    }
  ]
}