{
  "date": "2025-11-09",
  "date_of_scrape": "2025-11-10T04:09:42.469Z",
  "tool_version": "0.2.0",
  "number_of_announcements": 2,
  "announcements": [
    {
      "date": "2025-11-09",
      "id": "136729",
      "original_text": "Registerbekanntmachung nach dem Umwandlungsgesetz\nNordrhein-Westfalen Amtsgericht Coesfeld HRB 21273\nKiosk Tabakshop de Grens GmbH – Gronau",
      "type": "Registerbekanntmachung nach dem Umwandlungsgesetz",
      "state": "Nordrhein-Westfalen",
      "amtsgericht": "Amtsgericht Coesfeld",
      "registernummer": "HRB 21273",
      "registerart": "HRB",
      "company_name": "Kiosk Tabakshop de Grens GmbH",
      "company_seat": "Gronau",
      "details": "09.11.2025 (Bekanntmachungsdatum)\n\nNordrhein-Westfalen Amtsgericht Coesfeld HRB 21273\nRegisterbekanntmachung nach dem Umwandlungsgesetz 09.11.2025 (Eintragungsdatum)\n\nKiosk Tabakshop de Grens GmbH\nGesellschaft mit beschränkter Haftung\nGronau\n\nDen Gläubigern der an der Ausgliederung beteiligten Rechtsträger ist, wenn sie binnen sechs Monaten nach dem Tag, an dem die Eintragung der Ausgliederung in das Register des Sitzes derjenigen Rechtsträger deren Gläubiger sie sind, nach § 19 Absatz 3 UmwG als bekanntgemacht gilt, ihren Anspruch nach Grund und Höhe schriftlich anmelden, Sicherheit zu leisten, soweit sie nicht Befriedigung verlangen können. Dieses Recht steht den Gläubigern jedoch nur zu, wenn sie glaubhaft machen, dass durch die Ausgliederung die Erfüllung ihrer Forderung gefährdet wird."
    },
    {
      "date": "2025-11-09",
      "id": "136730",
      "original_text": "Registerbekanntmachung nach dem Umwandlungsgesetz\nBrandenburg Amtsgericht Frankfurt/Oder HRA 4560\nAppelt Reinigungsdienst e.K. – Frankfurt (Oder)",
      "type": "Registerbekanntmachung nach dem Umwandlungsgesetz",
      "state": "Brandenburg",
      "amtsgericht": "Amtsgericht Frankfurt/Oder",
      "registernummer": "HRA 4560",
      "registerart": "HRA",
      "company_name": "Appelt Reinigungsdienst e.K.",
      "company_seat": "Frankfurt (Oder)",
      "details": "09.11.2025 (Bekanntmachungsdatum)\n\nBrandenburg Amtsgericht Frankfurt/Oder HRA 4560\nRegisterbekanntmachung nach dem Umwandlungsgesetz 14.10.2025 (Eintragungsdatum)\n\nAppelt Reinigungsdienst e.K.\nEinzelkaufmann / Einzelkauffrau\nFrankfurt (Oder)\n\nZu Eintragungsnummer 2 vom 14.10.2025 wird als nicht eingetragen veröffentlicht: Den Gläubigern der an der Umwandlung beteiligten Rechtsträger ist, wenn sie binnen sechs Monaten nach dem Tag, an dem die Eintragung der Umwandlung in das Register des Sitzes desjenigen Rechtsträgers, dessen Gläubiger sie sind, als bekannt gemacht gilt, ihren Anspruch nach Grund und Höhe schriftlich anmelden, Sicherheit zu leisten, soweit sie nicht Befriedigung verlangen können. Dieses Recht steht den Gläubigern jedoch nur zu, wenn sie glaubhaft machen, dass durch die Umwandlung die Erfüllung ihrer Forderung gefährdet wird"
    }
  ]
}