{
  "date": "2025-11-21",
  "date_of_scrape": "2025-11-22T04:08:36.165Z",
  "tool_version": "0.2.0",
  "number_of_announcements": 98,
  "announcements": [
    {
      "date": "2025-11-21",
      "id": "137966",
      "original_text": "Einreichung neuer Dokumente\nBayern Amtsgericht München HRB 257354\nFarmInsect GmbH – München",
      "type": "Einreichung neuer Dokumente",
      "state": "Bayern",
      "amtsgericht": "Amtsgericht München",
      "registernummer": "HRB 257354",
      "registerart": "HRB",
      "company_name": "FarmInsect GmbH",
      "company_seat": "München",
      "details": "21.11.2025 (Bekanntmachungsdatum)\n\nBayern Amtsgericht München HRB 257354\nEinreichung neuer Dokumente 20.11.2025 (Eintragungsdatum)\n\nFarmInsect GmbH\nGesellschaft mit beschränkter Haftung\nMünchen\n\nDem Amtsgericht München -Registergericht- ist eine Liste der Mitglieder des Aufsichtsrats eingereicht worden, § 52 Abs. 3 S. 2 GmbHG."
    },
    {
      "date": "2025-11-21",
      "id": "137967",
      "original_text": "Registerbekanntmachung nach dem Umwandlungsgesetz\nBayern Amtsgericht Kempten (Allgäu) HRB 12218\ni+R Seeprojekt GmbH – Lindau (Bodensee)",
      "type": "Registerbekanntmachung nach dem Umwandlungsgesetz",
      "state": "Bayern",
      "amtsgericht": "Amtsgericht Kempten (Allgäu)",
      "registernummer": "HRB 12218",
      "registerart": "HRB",
      "company_name": "i+R Seeprojekt GmbH",
      "company_seat": "Lindau (Bodensee)",
      "details": "21.11.2025 (Bekanntmachungsdatum)\n\nBayern Amtsgericht Kempten (Allgäu) HRB 12218\nRegisterbekanntmachung nach dem Umwandlungsgesetz 20.11.2025 (Eintragungsdatum)\n\ni+R Seeprojekt GmbH\nGesellschaft mit beschränkter Haftung\nLindau (Bodensee)\n\nDen Gläubigern der an der Verschmelzung beteiligten Rechtsträger ist, wenn sie binnen sechs Monaten nach dem Tag, an dem die Eintragung der Verschmelzung in das Register des Sitzes desjenigen Rechtsträgers, dessen Gläubiger sie sind, nach § 19 Abs. 3 UmwG als bekannt gemacht gilt, ihren Anspruch nach Grund und Höhe in Textform anmelden, Sicherheit zu leisten, soweit sie nicht Befriedigung verlangen können. Dieses Recht steht den Gläubigern jedoch nur zu, wenn sie glaubhaft machen, dass durch die Verschmelzung die Erfüllung ihrer Forderung gefährdet wird."
    },
    {
      "date": "2025-11-21",
      "id": "137968",
      "original_text": "Registerbekanntmachung nach dem Umwandlungsgesetz\nBayern Amtsgericht Kempten (Allgäu) HRB 12219\ni+R Deutsche Immobilien GmbH – Lindau (Bodensee)",
      "type": "Registerbekanntmachung nach dem Umwandlungsgesetz",
      "state": "Bayern",
      "amtsgericht": "Amtsgericht Kempten (Allgäu)",
      "registernummer": "HRB 12219",
      "registerart": "HRB",
      "company_name": "i+R Deutsche Immobilien GmbH",
      "company_seat": "Lindau (Bodensee)",
      "details": "21.11.2025 (Bekanntmachungsdatum)\n\nBayern Amtsgericht Kempten (Allgäu) HRB 12219\nRegisterbekanntmachung nach dem Umwandlungsgesetz 20.11.2025 (Eintragungsdatum)\n\ni+R Deutsche Immobilien GmbH\nGesellschaft mit beschränkter Haftung\nLindau (Bodensee)\n\nDen Gläubigern der an der Verschmelzung beteiligten Rechtsträger ist, wenn sie binnen sechs Monaten nach dem Tag, an dem die Eintragung der Verschmelzung in das Register des Sitzes desjenigen Rechtsträgers, dessen Gläubiger sie sind, nach § 19 Abs. 3 UmwG als bekannt gemacht gilt, ihren Anspruch nach Grund und Höhe in Textform anmelden, Sicherheit zu leisten, soweit sie nicht Befriedigung verlangen können. Dieses Recht steht den Gläubigern jedoch nur zu, wenn sie glaubhaft machen, dass durch die Verschmelzung die Erfüllung ihrer Forderung gefährdet wird."
    },
    {
      "date": "2025-11-21",
      "id": "137969",
      "original_text": "Registerbekanntmachung nach dem Umwandlungsgesetz\nBayern Amtsgericht Augsburg HRB 38457\nGEG Bobingen Verwaltungs-GmbH – Bobingen",
      "type": "Registerbekanntmachung nach dem Umwandlungsgesetz",
      "state": "Bayern",
      "amtsgericht": "Amtsgericht Augsburg",
      "registernummer": "HRB 38457",
      "registerart": "HRB",
      "company_name": "GEG Bobingen Verwaltungs-GmbH",
      "company_seat": "Bobingen",
      "details": "21.11.2025 (Bekanntmachungsdatum)\n\nBayern Amtsgericht Augsburg HRB 38457\nRegisterbekanntmachung nach dem Umwandlungsgesetz 20.11.2025 (Eintragungsdatum)\n\nGEG Bobingen Verwaltungs-GmbH\nGesellschaft mit beschränkter Haftung\nBobingen\n\nDen Gläubigern der an der Verschmelzung beteiligten Rechtsträger ist, wenn sie binnen sechs Monaten nach dem Tag, an dem die Eintragung der Verschmelzung in das Register des Sitzes desjenigen Rechtsträgers, dessen Gläubiger sie sind, nach § 19 Abs. 3 UmwG als bekannt gemacht gilt, ihren Anspruch nach Grund und Höhe in Textform anmelden, Sicherheit zu leisten, soweit sie nicht Befriedigung verlangen können. Dieses Recht steht den Gläubigern jedoch nur zu, wenn sie glaubhaft machen, dass durch die Verschmelzung die Erfüllung ihrer Forderung gefährdet wird."
    },
    {
      "date": "2025-11-21",
      "id": "137970",
      "original_text": "Löschungsankündigung\nBayern Amtsgericht München HRB 243165\nEVEDIMA GmbH – Grasbrunn",
      "type": "Löschungsankündigung",
      "state": "Bayern",
      "amtsgericht": "Amtsgericht München",
      "registernummer": "HRB 243165",
      "registerart": "HRB",
      "company_name": "EVEDIMA GmbH",
      "company_seat": "Grasbrunn",
      "details": "21.11.2025 (Bekanntmachungsdatum)\n\nBayern Amtsgericht München HRB 243165\nLöschungsankündigung 20.11.2025 (Eintragungsdatum)\n\nEVEDIMA GmbH\nGesellschaft mit beschränkter Haftung\nGrasbrunn\n\nDas Registergericht beabsichtigt, die im Handelsregister eingetragene Gesellschaft wegen Vermögenslosigkeit von Amts wegen nach § 394 FamFG zu löschen. Die Frist zur Erhebung eines Widerspruchs ist auf drei Monate festgesetzt."
    },
    {
      "date": "2025-11-21",
      "id": "137971",
      "original_text": "Registerbekanntmachung nach dem Umwandlungsgesetz\nBayern Amtsgericht Fürth HRA 12510\nBrandl-Vitiello Schmuckhandel e.K. – Fürth",
      "type": "Registerbekanntmachung nach dem Umwandlungsgesetz",
      "state": "Bayern",
      "amtsgericht": "Amtsgericht Fürth",
      "registernummer": "HRA 12510",
      "registerart": "HRA",
      "company_name": "Brandl-Vitiello Schmuckhandel e.K.",
      "company_seat": "Fürth",
      "details": "21.11.2025 (Bekanntmachungsdatum)\n\nBayern Amtsgericht Fürth HRA 12510\nRegisterbekanntmachung nach dem Umwandlungsgesetz 20.11.2025 (Eintragungsdatum)\n\nBrandl-Vitiello Schmuckhandel e.K.\nEinzelkaufmann / Einzelkauffrau\nFürth\n\nDen Gläubigern der an der Ausgliederung beteiligten Rechtsträger ist, wenn sie binnen sechs Monaten nach dem Tag, an dem die Eintragung der Ausgliederung in das Register des Sitzes desjenigen Rechtsträgers, dessen Gläubiger sie sind, nach §§ 125, 19 Abs. 3 UmwG als bekannt gemacht gilt, ihren Anspruch nach Grund und Höhe in Textform anmelden, Sicherheit zu leisten, soweit sie nicht Befriedigung verlangen können. Dieses Recht steht den Gläubigern jedoch nur zu, wenn sie glaubhaft machen, dass durch die Ausgliederung die Erfüllung ihrer Forderung gefährdet wird."
    },
    {
      "date": "2025-11-21",
      "id": "137972",
      "original_text": "Einreichung neuer Dokumente\nBayern Amtsgericht München HRB 251185\nDomicil Real Estate AG – München",
      "type": "Einreichung neuer Dokumente",
      "state": "Bayern",
      "amtsgericht": "Amtsgericht München",
      "registernummer": "HRB 251185",
      "registerart": "HRB",
      "company_name": "Domicil Real Estate AG",
      "company_seat": "München",
      "details": "21.11.2025 (Bekanntmachungsdatum)\n\nBayern Amtsgericht München HRB 251185\nEinreichung neuer Dokumente\n\nDomicil Real Estate AG\nAktiengesellschaft\nMünchen\n\nDem Amtsgericht München -Registergericht- ist eine Liste der Mitglieder des Aufsichtsrats eingereicht worden, § 106 AktG."
    },
    {
      "date": "2025-11-21",
      "id": "137973",
      "original_text": "Registerbekanntmachung nach dem Umwandlungsgesetz\nBayern Amtsgericht München HRB 304153\nFizard GmbH – München",
      "type": "Registerbekanntmachung nach dem Umwandlungsgesetz",
      "state": "Bayern",
      "amtsgericht": "Amtsgericht München",
      "registernummer": "HRB 304153",
      "registerart": "HRB",
      "company_name": "Fizard GmbH",
      "company_seat": "München",
      "details": "21.11.2025 (Bekanntmachungsdatum)\n\nBayern Amtsgericht München HRB 304153\nRegisterbekanntmachung nach dem Umwandlungsgesetz 20.11.2025 (Eintragungsdatum)\n\nFizard GmbH\nGesellschaft mit beschränkter Haftung\nMünchen\n\nDen Gläubigern der an der Verschmelzung beteiligten Rechtsträger ist, wenn sie binnen sechs Monaten nach dem Tag, an dem die Eintragung der Verschmelzung in das Register des Sitzes desjenigen Rechtsträgers, dessen Gläubiger sie sind, nach § 19 Abs. 3 UmwG als bekannt gemacht gilt, ihren Anspruch nach Grund und Höhe in Textform anmelden, Sicherheit zu leisten, soweit sie nicht Befriedigung verlangen können. Dieses Recht steht den Gläubigern jedoch nur zu, wenn sie glaubhaft machen, dass durch die Verschmelzung die Erfüllung ihrer Forderung gefährdet wird."
    },
    {
      "date": "2025-11-21",
      "id": "137974",
      "original_text": "Registerbekanntmachung nach dem Umwandlungsgesetz\nBayern Amtsgericht Nürnberg HRB 43641\nHartmann & Mater Versicherungsmakler GmbH – Nürnberg",
      "type": "Registerbekanntmachung nach dem Umwandlungsgesetz",
      "state": "Bayern",
      "amtsgericht": "Amtsgericht Nürnberg",
      "registernummer": "HRB 43641",
      "registerart": "HRB",
      "company_name": "Hartmann & Mater Versicherungsmakler GmbH",
      "company_seat": "Nürnberg",
      "details": "21.11.2025 (Bekanntmachungsdatum)\n\nBayern Amtsgericht Nürnberg HRB 43641\nRegisterbekanntmachung nach dem Umwandlungsgesetz 20.11.2025 (Eintragungsdatum)\n\nHartmann & Mater Versicherungsmakler GmbH\nGesellschaft mit beschränkter Haftung\nNürnberg\n\nDen Gläubigern der an der Verschmelzung beteiligten Rechtsträger ist, wenn sie binnen sechs Monaten nach dem Tag, an dem die Eintragung der Verschmelzung in das Register des Sitzes desjenigen Rechtsträgers, dessen Gläubiger sie sind, nach § 19 Abs. 3 UmwG als bekannt gemacht gilt, ihren Anspruch nach Grund und Höhe in Textform anmelden, Sicherheit zu leisten, soweit sie nicht Befriedigung verlangen können. Dieses Recht steht den Gläubigern jedoch nur zu, wenn sie glaubhaft machen, dass durch die Verschmelzung die Erfüllung ihrer Forderung gefährdet wird."
    },
    {
      "date": "2025-11-21",
      "id": "137975",
      "original_text": "Registerbekanntmachung nach dem Umwandlungsgesetz\nBayern Amtsgericht München HRB 291216\none3 Holding GmbH – München",
      "type": "Registerbekanntmachung nach dem Umwandlungsgesetz",
      "state": "Bayern",
      "amtsgericht": "Amtsgericht München",
      "registernummer": "HRB 291216",
      "registerart": "HRB",
      "company_name": "one3 Holding GmbH",
      "company_seat": "München",
      "details": "21.11.2025 (Bekanntmachungsdatum)\n\nBayern Amtsgericht München HRB 291216\nRegisterbekanntmachung nach dem Umwandlungsgesetz 20.11.2025 (Eintragungsdatum)\n\none3 Holding GmbH\nGesellschaft mit beschränkter Haftung\nMünchen\n\nDen Gläubigern der an der Ausgliederung beteiligten Rechtsträger ist, wenn sie binnen sechs Monaten nach dem Tag, an dem die Eintragung der Ausgliederung in das Register des Sitzes desjenigen Rechtsträgers, dessen Gläubiger sie sind, nach §§ 125, 19 Abs. 3 UmwG als bekannt gemacht gilt, ihren Anspruch nach Grund und Höhe in Textform anmelden, Sicherheit zu leisten, soweit sie nicht Befriedigung verlangen können. Dieses Recht steht den Gläubigern jedoch nur zu, wenn sie glaubhaft machen, dass durch die Ausgliederung die Erfüllung ihrer Forderung gefährdet wird."
    },
    {
      "date": "2025-11-21",
      "id": "137976",
      "original_text": "Löschungsankündigung\nBayern Amtsgericht Traunstein HRB 31937\nBauunternehmen Bojovic UG (haftungsbeschränkt) – Rosenheim",
      "type": "Löschungsankündigung",
      "state": "Bayern",
      "amtsgericht": "Amtsgericht Traunstein",
      "registernummer": "HRB 31937",
      "registerart": "HRB",
      "company_name": "Bauunternehmen Bojovic UG (haftungsbeschränkt)",
      "company_seat": "Rosenheim",
      "details": "21.11.2025 (Bekanntmachungsdatum)\n\nBayern Amtsgericht Traunstein HRB 31937\nLöschungsankündigung\n\nBauunternehmen Bojovic UG (haftungsbeschränkt)\nGesellschaft mit beschränkter Haftung\nRosenheim\n\nDas Registergericht beabsichtigt, die im Handelsregister eingetragene Gesellschaft von Amts wegen nach § 395 FamFG zu löschen. Die Frist zur Erhebung eines Widerspruchs ist auf sechs Wochen festgesetzt."
    },
    {
      "date": "2025-11-21",
      "id": "137977",
      "original_text": "Einreichung neuer Dokumente\nBayern Amtsgericht Deggendorf HRB 2231\nOTS Informationstechnologie AG – Offenberg",
      "type": "Einreichung neuer Dokumente",
      "state": "Bayern",
      "amtsgericht": "Amtsgericht Deggendorf",
      "registernummer": "HRB 2231",
      "registerart": "HRB",
      "company_name": "OTS Informationstechnologie AG",
      "company_seat": "Offenberg",
      "details": "21.11.2025 (Bekanntmachungsdatum)\n\nBayern Amtsgericht Deggendorf HRB 2231\nEinreichung neuer Dokumente\n\nOTS Informationstechnologie AG\nAktiengesellschaft\nOffenberg\n\nDem Amtsgericht Deggendorf -Registergericht- ist eine Liste der Mitglieder des Aufsichtsrats eingereicht worden, § 106 AktG."
    },
    {
      "date": "2025-11-21",
      "id": "137978",
      "original_text": "Löschungsankündigung\nBayern Amtsgericht München HRB 247442\nSTF Technologies GmbH – München",
      "type": "Löschungsankündigung",
      "state": "Bayern",
      "amtsgericht": "Amtsgericht München",
      "registernummer": "HRB 247442",
      "registerart": "HRB",
      "company_name": "STF Technologies GmbH",
      "company_seat": "München",
      "details": "21.11.2025 (Bekanntmachungsdatum)\n\nBayern Amtsgericht München HRB 247442\nLöschungsankündigung 20.11.2025 (Eintragungsdatum)\n\nSTF Technologies GmbH\nGesellschaft mit beschränkter Haftung\nMünchen\n\nDas Registergericht beabsichtigt, die im Handelsregister eingetragene Gesellschaft wegen Vermögenslosigkeit von Amts wegen nach § 394 FamFG zu löschen. Die Frist zur Erhebung eines Widerspruchs ist auf drei Monate festgesetzt."
    },
    {
      "date": "2025-11-21",
      "id": "137979",
      "original_text": "Registerbekanntmachung nach dem Umwandlungsgesetz\nBayern Amtsgericht München HRB 245579\nAURELIUS Development Ten GmbH – Grünwald",
      "type": "Registerbekanntmachung nach dem Umwandlungsgesetz",
      "state": "Bayern",
      "amtsgericht": "Amtsgericht München",
      "registernummer": "HRB 245579",
      "registerart": "HRB",
      "company_name": "AURELIUS Development Ten GmbH",
      "company_seat": "Grünwald",
      "details": "21.11.2025 (Bekanntmachungsdatum)\n\nBayern Amtsgericht München HRB 245579\nRegisterbekanntmachung nach dem Umwandlungsgesetz 20.11.2025 (Eintragungsdatum)\n\nAURELIUS Development Ten GmbH\nGesellschaft mit beschränkter Haftung\nGrünwald\n\nDen Gläubigern des formwechselnden Rechtsträgers ist, wenn sie binnen sechs Monaten nach dem Tag, an dem die Eintragung des Formwechsels nach § 201 UmwG als bekannt gemacht gilt, ihren Anspruch nach Grund und Höhe in Textform anmelden, Sicherheit zu leisten, soweit sie nicht Befriedigung verlangen können. Dieses Recht steht den Gläubigern jedoch nur zu, wenn sie glaubhaft machen, dass durch den Formwechsel die Erfüllung ihrer Forderung gefährdet wird."
    },
    {
      "date": "2025-11-21",
      "id": "137980",
      "original_text": "Registerbekanntmachung nach dem Umwandlungsgesetz\nBayern Amtsgericht Fürth HRB 22243\nGlam & Glory Jewels GmbH – Fürth",
      "type": "Registerbekanntmachung nach dem Umwandlungsgesetz",
      "state": "Bayern",
      "amtsgericht": "Amtsgericht Fürth",
      "registernummer": "HRB 22243",
      "registerart": "HRB",
      "company_name": "Glam & Glory Jewels GmbH",
      "company_seat": "Fürth",
      "details": "21.11.2025 (Bekanntmachungsdatum)\n\nBayern Amtsgericht Fürth HRB 22243\nRegisterbekanntmachung nach dem Umwandlungsgesetz 20.11.2025 (Eintragungsdatum)\n\nGlam & Glory Jewels GmbH\nGesellschaft mit beschränkter Haftung\nFürth\n\nDen Gläubigern der an der Ausgliederung beteiligten Rechtsträger ist, wenn sie binnen sechs Monaten nach dem Tag, an dem die Eintragung der Ausgliederung in das Register des Sitzes desjenigen Rechtsträgers, dessen Gläubiger sie sind, nach §§ 125, 19 Abs. 3 UmwG als bekannt gemacht gilt, ihren Anspruch nach Grund und Höhe in Textform anmelden, Sicherheit zu leisten, soweit sie nicht Befriedigung verlangen können. Dieses Recht steht den Gläubigern jedoch nur zu, wenn sie glaubhaft machen, dass durch die Ausgliederung die Erfüllung ihrer Forderung gefährdet wird."
    },
    {
      "date": "2025-11-21",
      "id": "137981",
      "original_text": "Löschungsankündigung\nBayern Amtsgericht Passau HRB 6019\nIDEE + CONCEPT Moser GmbH – Tittling",
      "type": "Löschungsankündigung",
      "state": "Bayern",
      "amtsgericht": "Amtsgericht Passau",
      "registernummer": "HRB 6019",
      "registerart": "HRB",
      "company_name": "IDEE + CONCEPT Moser GmbH",
      "company_seat": "Tittling",
      "details": "21.11.2025 (Bekanntmachungsdatum)\n\nBayern Amtsgericht Passau HRB 6019\nLöschungsankündigung\n\nIDEE + CONCEPT Moser GmbH\nGesellschaft mit beschränkter Haftung\nTittling\n\nDas Registergericht beabsichtigt, die im Handelsregister eingetragene Gesellschaft wegen Vermögenslosigkeit von Amts wegen nach § 394 FamFG zu löschen. Die Frist zur Erhebung eines Widerspruchs ist auf einen Monat festgesetzt."
    },
    {
      "date": "2025-11-21",
      "id": "137982",
      "original_text": "Löschungsankündigung\nBayern Amtsgericht München HRB 284073\nMBaig Service UG (haftungsbeschränkt) – München",
      "type": "Löschungsankündigung",
      "state": "Bayern",
      "amtsgericht": "Amtsgericht München",
      "registernummer": "HRB 284073",
      "registerart": "HRB",
      "company_name": "MBaig Service UG (haftungsbeschränkt)",
      "company_seat": "München",
      "details": "21.11.2025 (Bekanntmachungsdatum)\n\nBayern Amtsgericht München HRB 284073\nLöschungsankündigung\n\nMBaig Service UG (haftungsbeschränkt)\nGesellschaft mit beschränkter Haftung\nMünchen\n\nDas Registergericht beabsichtigt, die im Handelsregister eingetragene Gesellschaft wegen Vermögenslosigkeit von Amts wegen nach § 394 FamFG zu löschen. Die Frist zur Erhebung eines Widerspruchs ist auf drei Monate festgesetzt."
    },
    {
      "date": "2025-11-21",
      "id": "137983",
      "original_text": "Einreichung neuer Dokumente\nBayern Amtsgericht Memmingen HRB 11896\nREINZ-Dichtungs-GmbH – Neu-Ulm",
      "type": "Einreichung neuer Dokumente",
      "state": "Bayern",
      "amtsgericht": "Amtsgericht Memmingen",
      "registernummer": "HRB 11896",
      "registerart": "HRB",
      "company_name": "REINZ-Dichtungs-GmbH",
      "company_seat": "Neu-Ulm",
      "details": "21.11.2025 (Bekanntmachungsdatum)\n\nBayern Amtsgericht Memmingen HRB 11896\nEinreichung neuer Dokumente\n\nREINZ-Dichtungs-GmbH\nGesellschaft mit beschränkter Haftung\nNeu-Ulm\n\nDem Amtsgericht Memmingen -Registergericht- ist eine Liste der Mitglieder des Aufsichtsrats eingereicht worden, § 52 Abs. 3 S. 2 GmbHG."
    },
    {
      "date": "2025-11-21",
      "id": "137984",
      "original_text": "Registerbekanntmachung nach dem Umwandlungsgesetz\nBayern Amtsgericht Schweinfurt HRB 6363\nHR India GmbH – Kolitzheim",
      "type": "Registerbekanntmachung nach dem Umwandlungsgesetz",
      "state": "Bayern",
      "amtsgericht": "Amtsgericht Schweinfurt",
      "registernummer": "HRB 6363",
      "registerart": "HRB",
      "company_name": "HR India GmbH",
      "company_seat": "Kolitzheim",
      "details": "21.11.2025 (Bekanntmachungsdatum)\n\nBayern Amtsgericht Schweinfurt HRB 6363\nRegisterbekanntmachung nach dem Umwandlungsgesetz 20.11.2025 (Eintragungsdatum)\n\nHR India GmbH\nGesellschaft mit beschränkter Haftung\nKolitzheim\n\nDen Gläubigern der an der Verschmelzung beteiligten Rechtsträger ist, wenn sie binnen sechs Monaten nach dem Tag, an dem die Eintragung der Verschmelzung in das Register des Sitzes desjenigen Rechtsträgers, dessen Gläubiger sie sind, nach § 19 Abs. 3 UmwG als bekannt gemacht gilt, ihren Anspruch nach Grund und Höhe in Textform anmelden, Sicherheit zu leisten, soweit sie nicht Befriedigung verlangen können. Dieses Recht steht den Gläubigern jedoch nur zu, wenn sie glaubhaft machen, dass durch die Verschmelzung die Erfüllung ihrer Forderung gefährdet wird."
    },
    {
      "date": "2025-11-21",
      "id": "137985",
      "original_text": "Löschungsankündigung\nBayern Amtsgericht München HRB 225571\nSchermesser Deutschland GmbH – München",
      "type": "Löschungsankündigung",
      "state": "Bayern",
      "amtsgericht": "Amtsgericht München",
      "registernummer": "HRB 225571",
      "registerart": "HRB",
      "company_name": "Schermesser Deutschland GmbH",
      "company_seat": "München",
      "details": "21.11.2025 (Bekanntmachungsdatum)\n\nBayern Amtsgericht München HRB 225571\nLöschungsankündigung\n\nSchermesser Deutschland GmbH\nGesellschaft mit beschränkter Haftung\nMünchen\n\nDas Registergericht beabsichtigt, die im Handelsregister eingetragene Gesellschaft wegen Vermögenslosigkeit von Amts wegen nach § 394 FamFG zu löschen. Die Frist zur Erhebung eines Widerspruchs ist auf drei Monate festgesetzt."
    },
    {
      "date": "2025-11-21",
      "id": "137986",
      "original_text": "Löschungsankündigung\nBayern Amtsgericht Ansbach HRB 7076\nPV-Service Lang GmbH – Geslau",
      "type": "Löschungsankündigung",
      "state": "Bayern",
      "amtsgericht": "Amtsgericht Ansbach",
      "registernummer": "HRB 7076",
      "registerart": "HRB",
      "company_name": "PV-Service Lang GmbH",
      "company_seat": "Geslau",
      "details": "21.11.2025 (Bekanntmachungsdatum)\n\nBayern Amtsgericht Ansbach HRB 7076\nLöschungsankündigung\n\nPV-Service Lang GmbH\nGesellschaft mit beschränkter Haftung\nGeslau\n\nDas Registergericht beabsichtigt, die im Handelsregister eingetragene Gesellschaft wegen Vermögenslosigkeit von Amts wegen nach § 394 FamFG zu löschen. Die Frist zur Erhebung eines Widerspruchs ist auf sechs Wochen festgesetzt."
    },
    {
      "date": "2025-11-21",
      "id": "137987",
      "original_text": "Registerbekanntmachung nach dem Umwandlungsgesetz\nBayern Amtsgericht München HRB 234829\nCSP Holding GmbH – München",
      "type": "Registerbekanntmachung nach dem Umwandlungsgesetz",
      "state": "Bayern",
      "amtsgericht": "Amtsgericht München",
      "registernummer": "HRB 234829",
      "registerart": "HRB",
      "company_name": "CSP Holding GmbH",
      "company_seat": "München",
      "details": "21.11.2025 (Bekanntmachungsdatum)\n\nBayern Amtsgericht München HRB 234829\nRegisterbekanntmachung nach dem Umwandlungsgesetz 20.11.2025 (Eintragungsdatum)\n\nCSP Holding GmbH\nGesellschaft mit beschränkter Haftung\nMünchen\n\nDen Gläubigern der an der Verschmelzung beteiligten Rechtsträger ist, wenn sie binnen sechs Monaten nach dem Tag, an dem die Eintragung der Verschmelzung in das Register des Sitzes desjenigen Rechtsträgers, dessen Gläubiger sie sind, nach § 19 Abs. 3 UmwG als bekannt gemacht gilt, ihren Anspruch nach Grund und Höhe in Textform anmelden, Sicherheit zu leisten, soweit sie nicht Befriedigung verlangen können. Dieses Recht steht den Gläubigern jedoch nur zu, wenn sie glaubhaft machen, dass durch die Verschmelzung die Erfüllung ihrer Forderung gefährdet wird."
    },
    {
      "date": "2025-11-21",
      "id": "137988",
      "original_text": "Registerbekanntmachung nach dem Umwandlungsgesetz\nBaden-Württemberg Amtsgericht Mannheim HRB 362496\nConscia Deutschland GmbH – Ettlingen",
      "type": "Registerbekanntmachung nach dem Umwandlungsgesetz",
      "state": "Baden-Württemberg",
      "amtsgericht": "Amtsgericht Mannheim",
      "registernummer": "HRB 362496",
      "registerart": "HRB",
      "company_name": "Conscia Deutschland GmbH",
      "company_seat": "Ettlingen",
      "details": "21.11.2025 (Bekanntmachungsdatum)\n\nBaden-Württemberg Amtsgericht Mannheim HRB 362496\nRegisterbekanntmachung nach dem Umwandlungsgesetz 21.11.2025 (Eintragungsdatum)\n\nConscia Deutschland GmbH\nGesellschaft mit beschränkter Haftung\nEttlingen\n\nAls nicht eingetragen wird bekanntgemacht:\nDen Gläubigern der an der Verschmelzung beteiligten Rechtsträger ist, wenn sie binnen sechs Monaten nach dem Tag, an dem die Eintragung der Verschmelzung in das Register des Sitzes desjenigen Rechtsträgers, dessen Gläubiger sie sind, nach § 19 Abs. 3 UmwG als bekanntgemacht gilt, ihren Anspruch nach Grund und Höhe schriftlich anmelden, Sicherheit zu leisten, soweit sie nicht Befriedigung verlangen können. Dieses Recht steht den Gläubigern jedoch nur zu, wenn sie glaubhaft machen, dass durch die Verschmelzung die Erfüllung ihrer Forderung gefährdet wird."
    },
    {
      "date": "2025-11-21",
      "id": "137989",
      "original_text": "Sonstige Registerbekanntmachung\nBerlin Amtsgericht Berlin (Charlottenburg) HRB 164028\nMcMakler GmbH – Berlin",
      "type": "Sonstige Registerbekanntmachung",
      "state": "Berlin",
      "amtsgericht": "Amtsgericht Berlin (Charlottenburg)",
      "registernummer": "HRB 164028",
      "registerart": "HRB",
      "company_name": "McMakler GmbH",
      "company_seat": "Berlin",
      "details": "21.11.2025 (Bekanntmachungsdatum)\n\nBerlin Amtsgericht Berlin (Charlottenburg) HRB 164028\nSonstige Registerbekanntmachung\n\nMcMakler GmbH\nGesellschaft mit beschränkter Haftung\nBerlin\n\nAls nicht eingetragen wird veröffentlicht: Es wurde eine neue Liste der Beiratsmitglieder eingereicht (§52 GmbHG)."
    },
    {
      "date": "2025-11-21",
      "id": "137990",
      "original_text": "Löschungsankündigung\nBrandenburg Amtsgericht Potsdam HRB 34263\nSedcura-Verwaltungs GmbH – Falkensee",
      "type": "Löschungsankündigung",
      "state": "Brandenburg",
      "amtsgericht": "Amtsgericht Potsdam",
      "registernummer": "HRB 34263",
      "registerart": "HRB",
      "company_name": "Sedcura-Verwaltungs GmbH",
      "company_seat": "Falkensee",
      "details": "21.11.2025 (Bekanntmachungsdatum)\n\nBrandenburg Amtsgericht Potsdam HRB 34263\nLöschungsankündigung\n\nSedcura-Verwaltungs GmbH\nGesellschaft mit beschränkter Haftung\nFalkensee\n\nBei der nachstehenden Gesellschaft wird das Amtslöschungsverfahren gemäß § 394 FamFG eingeleitet. Widerspruchsfrist: 8 Wochen."
    },
    {
      "date": "2025-11-21",
      "id": "137991",
      "original_text": "Löschungsankündigung\nBaden-Württemberg Amtsgericht Ulm HRA 726688\nTrend Sale e.K., Inhaber Steffen Klein – Neuler",
      "type": "Löschungsankündigung",
      "state": "Baden-Württemberg",
      "amtsgericht": "Amtsgericht Ulm",
      "registernummer": "HRA 726688",
      "registerart": "HRA",
      "company_name": "Trend Sale e.K., Inhaber Steffen Klein",
      "company_seat": "Neuler",
      "details": "21.11.2025 (Bekanntmachungsdatum)\n\nBaden-Württemberg Amtsgericht Ulm HRA 726688\nLöschungsankündigung\n\nTrend Sale e.K., Inhaber Steffen Klein\nEinzelkaufmann / Einzelkauffrau\nNeuler\n\nDas Registergericht beabsichtigt, die Firma im Handelsregister von Amts wegen nach § 31 Abs. 2 HGB zu löschen. Die Frist zur Geltendmachung eines Widerspruchs gegen die beabsichtigte Löschung ist auf einen Monat ab Veröffentlichung bestimmt."
    },
    {
      "date": "2025-11-21",
      "id": "137992",
      "original_text": "Löschungsankündigung\nBrandenburg Amtsgericht Potsdam HRB 37582\nS.O.L. Commerce UG (haftungsbeschränkt) – Ludwigsfelde",
      "type": "Löschungsankündigung",
      "state": "Brandenburg",
      "amtsgericht": "Amtsgericht Potsdam",
      "registernummer": "HRB 37582",
      "registerart": "HRB",
      "company_name": "S.O.L. Commerce UG (haftungsbeschränkt)",
      "company_seat": "Ludwigsfelde",
      "details": "21.11.2025 (Bekanntmachungsdatum)\n\nBrandenburg Amtsgericht Potsdam HRB 37582\nLöschungsankündigung\n\nS.O.L. Commerce UG (haftungsbeschränkt)\nGesellschaft mit beschränkter Haftung\nLudwigsfelde\n\nBei der nachstehenden Gesellschaft wird das Amtslöschungsverfahren gemäß § 394 FamFG eingeleitet. Widerspruchsfrist: 8 Wochen"
    },
    {
      "date": "2025-11-21",
      "id": "137993",
      "original_text": "Löschungsankündigung\nBaden-Württemberg Amtsgericht Ulm HRB 740514\nOBATALA BAU Zweigniederlassung der OBATALA, gradbene storitve in svetovanje, d.o.o. – Wangen im Allgäu",
      "type": "Löschungsankündigung",
      "state": "Baden-Württemberg",
      "amtsgericht": "Amtsgericht Ulm",
      "registernummer": "HRB 740514",
      "registerart": "HRB",
      "company_name": "OBATALA BAU Zweigniederlassung der OBATALA, gradbene storitve in svetovanje, d.o.o.",
      "company_seat": "Wangen im Allgäu",
      "details": "21.11.2025 (Bekanntmachungsdatum)\n\nBaden-Württemberg Amtsgericht Ulm HRB 740514\nLöschungsankündigung\n\nOBATALA BAU Zweigniederlassung der OBATALA, gradbene storitve in svetovanje, d.o.o.\nRechtsform ausländischen Rechts HRB\nWangen im Allgäu"
    },
    {
      "date": "2025-11-21",
      "id": "137994",
      "original_text": "Löschungsankündigung\nSchleswig-Holstein Amtsgericht Pinneberg HRB 17918\nZirvem GmbH – Borstel-Hohenraden",
      "type": "Löschungsankündigung",
      "state": "Schleswig-Holstein",
      "amtsgericht": "Amtsgericht Pinneberg",
      "registernummer": "HRB 17918",
      "registerart": "HRB",
      "company_name": "Zirvem GmbH",
      "company_seat": "Borstel-Hohenraden",
      "details": "21.11.2025 (Bekanntmachungsdatum)\n\nSchleswig-Holstein Amtsgericht Pinneberg HRB 17918\nLöschungsankündigung\n\nZirvem GmbH\nGesellschaft mit beschränkter Haftung\nBorstel-Hohenraden\n\nEs ist die Löschung der nachstehenden Gesellschaft wegen Vermögenslosigkeit gemäß § 394 FamFG beabsichtigt. Widerspruchsfrist: 2 Monate."
    },
    {
      "date": "2025-11-21",
      "id": "137995",
      "original_text": "Registerbekanntmachung nach dem Umwandlungsgesetz\nSachsen-Anhalt Amtsgericht Stendal HRA 8368\nPHO B Zweite GmbH & Co. KG – Weißenfels",
      "type": "Registerbekanntmachung nach dem Umwandlungsgesetz",
      "state": "Sachsen-Anhalt",
      "amtsgericht": "Amtsgericht Stendal",
      "registernummer": "HRA 8368",
      "registerart": "HRA",
      "company_name": "PHO B Zweite GmbH & Co. KG",
      "company_seat": "Weißenfels",
      "details": "21.11.2025 (Bekanntmachungsdatum)\n\nSachsen-Anhalt Amtsgericht Stendal HRA 8368\nRegisterbekanntmachung nach dem Umwandlungsgesetz 21.11.2025 (Eintragungsdatum)\n\nPHO B Zweite GmbH & Co. KG\nKommanditgesellschaft\nWeißenfels\n\nNicht eingetragen:\nDen Gläubigern der an der Spaltung beteiligten Rechtsträger, ist wenn sie binnen sechs Monaten nach dem Tag, an dem die Eintragung der Spaltung nach §§ 125, 19 Abs. 3 UmwG als bekanntgemacht gilt, ihren Anspruch nach Grund und Höhe schriftlich anmelden, Sicherheit zu leisten, soweit sie nicht Befriedigung verlangen können. Dieses Recht steht ihnen jedoch nur zu, wenn sie glaubhaft machen, daß durch die Spaltung die Erfüllung ihrer Forderung gefährdet wird."
    },
    {
      "date": "2025-11-21",
      "id": "137996",
      "original_text": "Löschungsankündigung\nBerlin Amtsgericht Berlin (Charlottenburg) HRB 188596\nThermovation UG (haftungsbeschränkt) – Berlin",
      "type": "Löschungsankündigung",
      "state": "Berlin",
      "amtsgericht": "Amtsgericht Berlin (Charlottenburg)",
      "registernummer": "HRB 188596",
      "registerart": "HRB",
      "company_name": "Thermovation UG (haftungsbeschränkt)",
      "company_seat": "Berlin",
      "details": "21.11.2025 (Bekanntmachungsdatum)\n\nBerlin Amtsgericht Berlin (Charlottenburg) HRB 188596\nLöschungsankündigung\n\nThermovation UG (haftungsbeschränkt)\nGesellschaft mit beschränkter Haftung\nBerlin\n\nBei der nachstehenden Gesellschaft wird das Amtslöschungsverfahren gemäß § 394 FamFG eingeleitet. Widerspruchsfrist 6 Wochen"
    },
    {
      "date": "2025-11-21",
      "id": "137997",
      "original_text": "Einreichung neuer Dokumente\nHamburg Amtsgericht Hamburg HRB 83351\nUlrich Stein Gesellschaft mit beschränkter Haftung – Hamburg",
      "type": "Einreichung neuer Dokumente",
      "state": "Hamburg",
      "amtsgericht": "Amtsgericht Hamburg",
      "registernummer": "HRB 83351",
      "registerart": "HRB",
      "company_name": "Ulrich Stein Gesellschaft mit beschränkter Haftung",
      "company_seat": "Hamburg",
      "details": "21.11.2025 (Bekanntmachungsdatum)\n\nHamburg Amtsgericht Hamburg HRB 83351\nEinreichung neuer Dokumente\n\nUlrich Stein Gesellschaft mit beschränkter Haftung\nGesellschaft mit beschränkter Haftung\nHamburg\n\nAls nicht eingetragen wird bekannt gemacht: Liste des Aufsichtsrats wurde eingereicht."
    },
    {
      "date": "2025-11-21",
      "id": "137998",
      "original_text": "Registerbekanntmachung nach dem Umwandlungsgesetz\nBerlin Amtsgericht Berlin (Charlottenburg) HRB 145951\nGG BRANDS GmbH – Berlin",
      "type": "Registerbekanntmachung nach dem Umwandlungsgesetz",
      "state": "Berlin",
      "amtsgericht": "Amtsgericht Berlin (Charlottenburg)",
      "registernummer": "HRB 145951",
      "registerart": "HRB",
      "company_name": "GG BRANDS GmbH",
      "company_seat": "Berlin",
      "details": "21.11.2025 (Bekanntmachungsdatum)\n\nBerlin Amtsgericht Berlin (Charlottenburg) HRB 145951\nRegisterbekanntmachung nach dem Umwandlungsgesetz 20.11.2025 (Eintragungsdatum)\n\nGG BRANDS GmbH\nGesellschaft mit beschränkter Haftung\nBerlin\n\nZu Eintragungsnummer 18 vom 20.11.2025 wird als nicht eingetragen veröffentlicht:\n\nDen Gläubigern der an der Verschmelzung beteiligten Rechtsträger ist, wenn sie binnen sechs Monaten nach dem Tag, an dem die Eintragung der Verschmelzung in das Register des Sitzes desjenigen Rechtsträgers, dessen Gläubiger sie sind, als bekannt gemacht gilt, ihren Anspruch nach Grund und Höhe schriftlich anmelden, Sicherheit zu leisten, soweit sie nicht Befriedigung verlangen können. Dieses Recht steht den Gläubigern jedoch nur zu, wenn sie glaubhaft machen, dass durch die Verschmelzung die Erfüllung ihrer Forderung gefährdet wird. Das Recht, Sicherheitsleistung zu verlangen, steht Gläubigern nicht zu, die im Falle der Insolvenz ein Recht auf vorzugsweise Befriedigung aus einer Deckungsmasse haben, die nach gesetzlicher Vorschrift zu ihrem Schutz errichtet und staatlich überwacht ist."
    },
    {
      "date": "2025-11-21",
      "id": "137999",
      "original_text": "Einreichung neuer Dokumente\nBaden-Württemberg Amtsgericht Ulm HRB 671285\necoSWITCH AG – Crailsheim",
      "type": "Einreichung neuer Dokumente",
      "state": "Baden-Württemberg",
      "amtsgericht": "Amtsgericht Ulm",
      "registernummer": "HRB 671285",
      "registerart": "HRB",
      "company_name": "ecoSWITCH AG",
      "company_seat": "Crailsheim",
      "details": "21.11.2025 (Bekanntmachungsdatum)\n\nBaden-Württemberg Amtsgericht Ulm HRB 671285\nEinreichung neuer Dokumente\n\necoSWITCH AG\nAktiengesellschaft\nCrailsheim\n\nDie Gesellschaft hat am 20.11.2025 die Liste über die Zusammensetzung des Aufsichtsrats zum Handelsregister eingereicht."
    },
    {
      "date": "2025-11-21",
      "id": "138000",
      "original_text": "Löschungsankündigung\nBerlin Amtsgericht Berlin (Charlottenburg) HRB 120837\nMs.concept GmbH – Berlin",
      "type": "Löschungsankündigung",
      "state": "Berlin",
      "amtsgericht": "Amtsgericht Berlin (Charlottenburg)",
      "registernummer": "HRB 120837",
      "registerart": "HRB",
      "company_name": "Ms.concept GmbH",
      "company_seat": "Berlin",
      "details": "21.11.2025 (Bekanntmachungsdatum)\n\nBerlin Amtsgericht Berlin (Charlottenburg) HRB 120837\nLöschungsankündigung\n\nMs.concept GmbH\nGesellschaft mit beschränkter Haftung\nBerlin\n\nBei der nachstehenden Gesellschaft wird das Amtslöschungsverfahren gemäß § 394 FamFG eingeleitet. Widerspruchsfrist 6 Wochen"
    },
    {
      "date": "2025-11-21",
      "id": "138001",
      "original_text": "Einreichung neuer Dokumente\nBerlin Amtsgericht Berlin (Charlottenburg) HRB 195227\nVELA Group SE – Berlin",
      "type": "Einreichung neuer Dokumente",
      "state": "Berlin",
      "amtsgericht": "Amtsgericht Berlin (Charlottenburg)",
      "registernummer": "HRB 195227",
      "registerart": "HRB",
      "company_name": "VELA Group SE",
      "company_seat": "Berlin",
      "details": "21.11.2025 (Bekanntmachungsdatum)\n\nBerlin Amtsgericht Berlin (Charlottenburg) HRB 195227\nEinreichung neuer Dokumente\n\nVELA Group SE\nEuropäische Aktiengesellschaft (SE)\nBerlin\n\nAls nicht eingetragen wird veröffentlicht:Es wurde eine neue Liste der Verwaltungsratsmitglieder eingereicht (§ 106 AktG)."
    },
    {
      "date": "2025-11-21",
      "id": "138002",
      "original_text": "Sonstige Registerbekanntmachung\nBerlin Amtsgericht Berlin (Charlottenburg) HRB 44424\nGeotechnisches Ingenieurbüro Dipl. Ing. Heuer und Partner GmbH – Berlin",
      "type": "Sonstige Registerbekanntmachung",
      "state": "Berlin",
      "amtsgericht": "Amtsgericht Berlin (Charlottenburg)",
      "registernummer": "HRB 44424",
      "registerart": "HRB",
      "company_name": "Geotechnisches Ingenieurbüro Dipl. Ing. Heuer und Partner GmbH",
      "company_seat": "Berlin",
      "details": "21.11.2025 (Bekanntmachungsdatum)\n\nBerlin Amtsgericht Berlin (Charlottenburg) HRB 44424\nSonstige Registerbekanntmachung 19.11.2025 (Eintragungsdatum)\n\nGeotechnisches Ingenieurbüro Dipl. Ing. Heuer und Partner GmbH\nGesellschaft mit beschränkter Haftung\nBerlin\n\nAls eingetragen wird veröffentlicht: Jeder Geschäftsführer vertritt die Gesellschaft allein. Jeder Geschäftsführer darf Rechtsgeschäfte mit sich selbst oder als Vertreter Dritter abschließen. Nicht mehr Liquidator: 1. Heuer, Bernhard, Geschäftsführer: 2. Franklin, Rigoberto Antonio Thomas, *14.02.1958, Irxleben mit der Befugnis Rechtsgeschäfte mit sich selbst oder als Vertreter Dritter abzuschließen. Durch Beschluss der Gesellschafterversammlung vom 06.11.2025 ist die Gesellschaft fortgesetzt."
    },
    {
      "date": "2025-11-21",
      "id": "138003",
      "original_text": "Registerbekanntmachung nach dem Umwandlungsgesetz\nHamburg Amtsgericht Hamburg HRB 134743\nWinterhuder Hausverwaltung GmbH – Hamburg",
      "type": "Registerbekanntmachung nach dem Umwandlungsgesetz",
      "state": "Hamburg",
      "amtsgericht": "Amtsgericht Hamburg",
      "registernummer": "HRB 134743",
      "registerart": "HRB",
      "company_name": "Winterhuder Hausverwaltung GmbH",
      "company_seat": "Hamburg",
      "details": "21.11.2025 (Bekanntmachungsdatum)\n\nHamburg Amtsgericht Hamburg HRB 134743\nRegisterbekanntmachung nach dem Umwandlungsgesetz 21.11.2025 (Eintragungsdatum)\n\nWinterhuder Hausverwaltung GmbH\nGesellschaft mit beschränkter Haftung\nHamburg\n\nAls nicht eingetragen wird bekannt gemacht:\nDen Gläubigern der an der Verschmelzung beteiligten Gesellschaften ist, wenn sie binnen sechs Monaten nach dem Tag, an dem die Eintragung der Verschmelzung in das Register des Sitzes derjenigen Rechtsträger deren Gläubiger sie sind, nach § 19 Absatz 3 UmwG als bekannt gemacht gilt, ihren Anspruch nach Grund und Höhe schriftlich anmelden, Sicherheit zu leisten, soweit sie nicht Befriedigung verlangen können. Dieses Recht steht den Gläubigern jedoch nur zu, wenn sie glaubhaft machen, dass durch die Verschmelzung die Erfüllung ihrer Forderung gefährdet wird."
    },
    {
      "date": "2025-11-21",
      "id": "138004",
      "original_text": "Registerbekanntmachung nach dem Umwandlungsgesetz\nHamburg Amtsgericht Hamburg HRB 89299\nWinterhuder Hausverwaltung GmbH – Hamburg",
      "type": "Registerbekanntmachung nach dem Umwandlungsgesetz",
      "state": "Hamburg",
      "amtsgericht": "Amtsgericht Hamburg",
      "registernummer": "HRB 89299",
      "registerart": "HRB",
      "company_name": "Winterhuder Hausverwaltung GmbH",
      "company_seat": "Hamburg",
      "details": "21.11.2025 (Bekanntmachungsdatum)\n\nHamburg Amtsgericht Hamburg HRB 89299\nRegisterbekanntmachung nach dem Umwandlungsgesetz 21.11.2025 (Eintragungsdatum)\n\nWinterhuder Hausverwaltung GmbH\nGesellschaft mit beschränkter Haftung\nHamburg\n\nAls nicht eingetragen wird bekannt gemacht:\nDen Gläubigern der an der Verschmelzung beteiligten Gesellschaften ist, wenn sie binnen sechs Monaten nach dem Tag, an dem die Eintragung der Verschmelzung in das Register des Sitzes desjenigen Rechtsträgers, dessen Gläubiger sie sind, nach § 19 Absatz 3 UmwG als bekannt gemacht gilt, ihren Anspruch nach Grund und Höhe schriftlich anmelden, Sicherheit zu leisten, soweit sie nicht Befriedigung verlangen können. Dieses Recht steht den Gläubigern jedoch nur zu, wenn sie glaubhaft machen, dass durch die Verschmelzung die Erfüllung ihrer Forderung gefährdet wird."
    },
    {
      "date": "2025-11-21",
      "id": "138005",
      "original_text": "Registerbekanntmachung nach dem Umwandlungsgesetz\nHamburg Amtsgericht Hamburg HRB 102888\nMERICA Holding GmbH – Hamburg",
      "type": "Registerbekanntmachung nach dem Umwandlungsgesetz",
      "state": "Hamburg",
      "amtsgericht": "Amtsgericht Hamburg",
      "registernummer": "HRB 102888",
      "registerart": "HRB",
      "company_name": "MERICA Holding GmbH",
      "company_seat": "Hamburg",
      "details": "21.11.2025 (Bekanntmachungsdatum)\n\nHamburg Amtsgericht Hamburg HRB 102888\nRegisterbekanntmachung nach dem Umwandlungsgesetz 21.11.2025 (Eintragungsdatum)\n\nMERICA Holding GmbH\nGesellschaft mit beschränkter Haftung\nHamburg\n\nAls nicht eingetragen wird bekannt gemacht:\nDen Gläubigern der an der Verschmelzung beteiligten Gesellschaften ist, wenn sie binnen sechs Monaten nach dem Tag, an dem die Eintragung der Verschmelzung in das Register des Sitzes desjenigen Rechtsträgers, dessen Gläubiger sie sind, nach § 19 Absatz 3 UmwG als bekannt gemacht gilt, ihren Anspruch nach Grund und Höhe schriftlich anmelden, Sicherheit zu leisten, soweit sie nicht Befriedigung verlangen können. Dieses Recht steht den Gläubigern jedoch nur zu, wenn sie glaubhaft machen, dass durch die Verschmelzung die Erfüllung ihrer Forderung gefährdet wird."
    },
    {
      "date": "2025-11-21",
      "id": "138006",
      "original_text": "Registerbekanntmachung nach dem Umwandlungsgesetz\nHamburg Amtsgericht Hamburg HRB 106729\nMERICA Technology GmbH – Hamburg",
      "type": "Registerbekanntmachung nach dem Umwandlungsgesetz",
      "state": "Hamburg",
      "amtsgericht": "Amtsgericht Hamburg",
      "registernummer": "HRB 106729",
      "registerart": "HRB",
      "company_name": "MERICA Technology GmbH",
      "company_seat": "Hamburg",
      "details": "21.11.2025 (Bekanntmachungsdatum)\n\nHamburg Amtsgericht Hamburg HRB 106729\nRegisterbekanntmachung nach dem Umwandlungsgesetz 21.11.2025 (Eintragungsdatum)\n\nMERICA Technology GmbH\nGesellschaft mit beschränkter Haftung\nHamburg\n\nAls nicht eingetragen wird bekannt gemacht:\nDen Gläubigern der an der Verschmelzung beteiligten Gesellschaften ist, wenn sie binnen sechs Monaten nach dem Tag, an dem die Eintragung der Verschmelzung in das Register des Sitzes desjenigen Rechtsträgers, dessen Gläubiger sie sind, nach § 19 Absatz 3 UmwG als bekannt gemacht gilt, ihren Anspruch nach Grund und Höhe schriftlich anmelden, Sicherheit zu leisten, soweit sie nicht Befriedigung verlangen können. Dieses Recht steht den Gläubigern jedoch nur zu, wenn sie glaubhaft machen, dass durch die Verschmelzung die Erfüllung ihrer Forderung gefährdet wird."
    },
    {
      "date": "2025-11-21",
      "id": "138007",
      "original_text": "Registerbekanntmachung nach dem Umwandlungsgesetz\nSchleswig-Holstein Amtsgericht Lübeck HRA 8321\nDIEFLEX technische produkte Stefan Seibt e K. – Barsbüttel",
      "type": "Registerbekanntmachung nach dem Umwandlungsgesetz",
      "state": "Schleswig-Holstein",
      "amtsgericht": "Amtsgericht Lübeck",
      "registernummer": "HRA 8321",
      "registerart": "HRA",
      "company_name": "DIEFLEX technische produkte Stefan Seibt e K.",
      "company_seat": "Barsbüttel",
      "details": "21.11.2025 (Bekanntmachungsdatum)\n\nSchleswig-Holstein Amtsgericht Lübeck HRA 8321\nRegisterbekanntmachung nach dem Umwandlungsgesetz 20.11.2025 (Eintragungsdatum)\n\nDIEFLEX technische produkte Stefan Seibt e K.\nEinzelkaufmann / Einzelkauffrau\nBarsbüttel\n\nZu Eintragungsnummer 2 vom 20.11.2025 wird als nicht eingetragen veröffentlicht:\nDen Gläubigern der an der Ausgliederung beteiligten Rechtsträger ist, wenn sie binnen sechs Monaten nach dem Tag, an dem die Eintragung der Ausgliederung in das Register des Sitzes desjenigen Rechtsträgers, dessen Gläubiger sie sind, als bekannt gemacht gilt, ihren Anspruch nach Grund und Höhe schriftlich anmelden, Sicherheit zu leisten, soweit sie nicht Befriedigung verlangen können. Dieses Recht steht den Gläubigern jedoch nur zu, wenn sie glaubhaft machen, dass durch die Ausgliederung die Erfüllung ihrer Forderung gefährdet wird."
    },
    {
      "date": "2025-11-21",
      "id": "138008",
      "original_text": "Registerbekanntmachung nach dem Umwandlungsgesetz\nBaden-Württemberg Amtsgericht Ulm HRB 750882\nASK Immobilien GmbH – Ulm",
      "type": "Registerbekanntmachung nach dem Umwandlungsgesetz",
      "state": "Baden-Württemberg",
      "amtsgericht": "Amtsgericht Ulm",
      "registernummer": "HRB 750882",
      "registerart": "HRB",
      "company_name": "ASK Immobilien GmbH",
      "company_seat": "Ulm",
      "details": "21.11.2025 (Bekanntmachungsdatum)\n\nBaden-Württemberg Amtsgericht Ulm HRB 750882\nRegisterbekanntmachung nach dem Umwandlungsgesetz 21.11.2025 (Eintragungsdatum)\n\nASK Immobilien GmbH\nGesellschaft mit beschränkter Haftung\nUlm\n\nAls nicht eingetragen wird bekanntgemacht:\nDen Gläubigern des an dem Formwechsel beteiligten Rechtsträgers ist, wenn sie binnen sechs Monaten nach dem Tag, an dem die Eintragung des Formwechsels in das Register des Sitzes desjenigen Rechtsträgers, dessen Gläubiger sie sind, nach § 19 Abs. 3 UmwG als bekanntgemacht gilt, ihren Anspruch nach Grund und Höhe schriftlich anmelden, Sicherheit zu leisten, soweit sie nicht Befriedigung verlangen können. Dieses Recht steht den Gläubigern jedoch nur zu, wenn sie glaubhaft machen, dass durch den Formwechsel die Erfüllung ihrer Forderung gefährdet wird."
    },
    {
      "date": "2025-11-21",
      "id": "138009",
      "original_text": "Registerbekanntmachung nach dem Umwandlungsgesetz\nBaden-Württemberg Amtsgericht Ulm HRA 728564\nASK Immobilien OHG – Ulm",
      "type": "Registerbekanntmachung nach dem Umwandlungsgesetz",
      "state": "Baden-Württemberg",
      "amtsgericht": "Amtsgericht Ulm",
      "registernummer": "HRA 728564",
      "registerart": "HRA",
      "company_name": "ASK Immobilien OHG",
      "company_seat": "Ulm",
      "details": "21.11.2025 (Bekanntmachungsdatum)\n\nBaden-Württemberg Amtsgericht Ulm HRA 728564\nRegisterbekanntmachung nach dem Umwandlungsgesetz 21.11.2025 (Eintragungsdatum)\n\nASK Immobilien OHG\nOffene Handelsgesellschaft\nUlm\n\nAls nicht eingetragen wird bekanntgemacht:\nDen Gläubigern des an dem Formwechsel beteiligten Rechtsträgers ist, wenn sie binnen sechs Monaten nach dem Tag, an dem die Eintragung des Formwechsels in das Register des Sitzes desjenigen Rechtsträgers, dessen Gläubiger sie sind, nach § 19 Abs. 3 UmwG als bekanntgemacht gilt, ihren Anspruch nach Grund und Höhe schriftlich anmelden, Sicherheit zu leisten, soweit sie nicht Befriedigung verlangen können. Dieses Recht steht den Gläubigern jedoch nur zu, wenn sie glaubhaft machen, dass durch den Formwechsel die Erfüllung ihrer Forderung gefährdet wird."
    },
    {
      "date": "2025-11-21",
      "id": "138010",
      "original_text": "Löschungsankündigung\nBerlin Amtsgericht Berlin (Charlottenburg) HRB 207842\nSF Diamonds GmbH – Berlin",
      "type": "Löschungsankündigung",
      "state": "Berlin",
      "amtsgericht": "Amtsgericht Berlin (Charlottenburg)",
      "registernummer": "HRB 207842",
      "registerart": "HRB",
      "company_name": "SF Diamonds GmbH",
      "company_seat": "Berlin",
      "details": "21.11.2025 (Bekanntmachungsdatum)\n\nBerlin Amtsgericht Berlin (Charlottenburg) HRB 207842\nLöschungsankündigung\n\nSF Diamonds GmbH\nGesellschaft mit beschränkter Haftung\nBerlin\n\nBei der nachstehenden Gesellschaft wird das Amtslöschungsverfahren gemäß § 394 FamFG eingeleitet. Widerspruchsfrist 6 Wochen"
    },
    {
      "date": "2025-11-21",
      "id": "138011",
      "original_text": "Löschungsankündigung\nBerlin Amtsgericht Berlin (Charlottenburg) HRB 142016\nVHS Visa Handling Services GmbH – Berlin",
      "type": "Löschungsankündigung",
      "state": "Berlin",
      "amtsgericht": "Amtsgericht Berlin (Charlottenburg)",
      "registernummer": "HRB 142016",
      "registerart": "HRB",
      "company_name": "VHS Visa Handling Services GmbH",
      "company_seat": "Berlin",
      "details": "21.11.2025 (Bekanntmachungsdatum)\n\nBerlin Amtsgericht Berlin (Charlottenburg) HRB 142016\nLöschungsankündigung\n\nVHS Visa Handling Services GmbH\nGesellschaft mit beschränkter Haftung\nBerlin\n\nBei der nachstehenden Gesellschaft wird das Amtslöschungsverfahren gemäß § 394 FamFG eingeleitet. Widerspruchsfrist 6 Wochen"
    },
    {
      "date": "2025-11-21",
      "id": "138012",
      "original_text": "Registerbekanntmachung nach dem Umwandlungsgesetz\nHamburg Amtsgericht Hamburg HRB 159811\nZwölfte K.G.R. Real Estate GmbH – Hamburg",
      "type": "Registerbekanntmachung nach dem Umwandlungsgesetz",
      "state": "Hamburg",
      "amtsgericht": "Amtsgericht Hamburg",
      "registernummer": "HRB 159811",
      "registerart": "HRB",
      "company_name": "Zwölfte K.G.R. Real Estate GmbH",
      "company_seat": "Hamburg",
      "details": "21.11.2025 (Bekanntmachungsdatum)\n\nHamburg Amtsgericht Hamburg HRB 159811\nRegisterbekanntmachung nach dem Umwandlungsgesetz 20.11.2025 (Eintragungsdatum)\n\nZwölfte K.G.R. Real Estate GmbH\nGesellschaft mit beschränkter Haftung\nHamburg\n\nAls nicht eingetragen wird bekannt gemacht:\nDen Gläubigern der an der Verschmelzung beteiligten Gesellschaften ist, wenn sie binnen sechs Monaten nach dem Tag, an dem die Eintragung der Verschmelzung in das Register des Sitzes desjenigen Rechtsträgers, dessen Gläubiger sie sind, nach § 19 Absatz 3 UmwG als bekannt gemacht gilt, ihren Anspruch nach Grund und Höhe schriftlich anmelden, Sicherheit zu leisten, soweit sie nicht Befriedigung verlangen können. Dieses Recht steht den Gläubigern jedoch nur zu, wenn sie glaubhaft machen, dass durch die Verschmelzung die Erfüllung ihrer Forderung gefährdet wird."
    },
    {
      "date": "2025-11-21",
      "id": "138013",
      "original_text": "Löschungsankündigung\nBerlin Amtsgericht Berlin (Charlottenburg) HRB 217746\nPPE Germany GmbH – Berlin",
      "type": "Löschungsankündigung",
      "state": "Berlin",
      "amtsgericht": "Amtsgericht Berlin (Charlottenburg)",
      "registernummer": "HRB 217746",
      "registerart": "HRB",
      "company_name": "PPE Germany GmbH",
      "company_seat": "Berlin",
      "details": "21.11.2025 (Bekanntmachungsdatum)\n\nBerlin Amtsgericht Berlin (Charlottenburg) HRB 217746\nLöschungsankündigung\n\nPPE Germany GmbH\nGesellschaft mit beschränkter Haftung\nBerlin\n\nBei der nachstehenden Gesellschaft wird das Amtslöschungsverfahren gemäß § 394 FamFG eingeleitet. Widerspruchsfrist 6 Wochen"
    },
    {
      "date": "2025-11-21",
      "id": "138014",
      "original_text": "Löschungsankündigung\nBerlin Amtsgericht Berlin (Charlottenburg) HRB 267926\nMarketingPro24 GmbH – Berlin",
      "type": "Löschungsankündigung",
      "state": "Berlin",
      "amtsgericht": "Amtsgericht Berlin (Charlottenburg)",
      "registernummer": "HRB 267926",
      "registerart": "HRB",
      "company_name": "MarketingPro24 GmbH",
      "company_seat": "Berlin",
      "details": "21.11.2025 (Bekanntmachungsdatum)\n\nBerlin Amtsgericht Berlin (Charlottenburg) HRB 267926\nLöschungsankündigung\n\nMarketingPro24 GmbH\nGesellschaft mit beschränkter Haftung\nBerlin\n\nBei der nachstehenden Gesellschaft wird das Amtslöschungsverfahren gemäß § 394 FamFG eingeleitet. Widerspruchsfrist 6 Wochen"
    },
    {
      "date": "2025-11-21",
      "id": "138015",
      "original_text": "Registerbekanntmachung nach dem Umwandlungsgesetz\nSchleswig-Holstein Amtsgericht Kiel HRB 28747\nHypion Motion Neumünster HRS GmbH – Kiel",
      "type": "Registerbekanntmachung nach dem Umwandlungsgesetz",
      "state": "Schleswig-Holstein",
      "amtsgericht": "Amtsgericht Kiel",
      "registernummer": "HRB 28747",
      "registerart": "HRB",
      "company_name": "Hypion Motion Neumünster HRS GmbH",
      "company_seat": "Kiel",
      "details": "21.11.2025 (Bekanntmachungsdatum)\n\nSchleswig-Holstein Amtsgericht Kiel HRB 28747\nRegisterbekanntmachung nach dem Umwandlungsgesetz 14.11.2025 (Eintragungsdatum)\n\nHypion Motion Neumünster HRS GmbH\nGesellschaft mit beschränkter Haftung\nKiel\n\nZu Eintragungsnummer 1 vom 14.11.2025 wird als nicht eingetragen veröffentlicht: Den Gläubigern ist, wenn sie binnen sechs Monaten nach dem Tag, an dem die Eintragung der Umwandlung bekannt gemacht worden ist, ihren Anspruch nach Grund und Höhe schriftlich anmelden, Sicherheit zu leisten, soweit sie nicht Befriedigung verlangen können. Dieses Recht steht den Gläubigern jedoch nur zu, wenn sie glaubhaft machen, dass durch die Umwandlung die Erfüllung ihrer Forderung gefährdet wird."
    },
    {
      "date": "2025-11-21",
      "id": "138016",
      "original_text": "Einreichung neuer Dokumente\nBaden-Württemberg Amtsgericht Stuttgart HRB 788254\nKS Large Bore Pistons Group GmbH – Neckarsulm",
      "type": "Einreichung neuer Dokumente",
      "state": "Baden-Württemberg",
      "amtsgericht": "Amtsgericht Stuttgart",
      "registernummer": "HRB 788254",
      "registerart": "HRB",
      "company_name": "KS Large Bore Pistons Group GmbH",
      "company_seat": "Neckarsulm",
      "details": "21.11.2025 (Bekanntmachungsdatum)\n\nBaden-Württemberg Amtsgericht Stuttgart HRB 788254\nEinreichung neuer Dokumente\n\nKS Large Bore Pistons Group GmbH\nGesellschaft mit beschränkter Haftung\nNeckarsulm\n\nDie Gesellschaft hat am 20.11.2025 die Liste über die Zusammensetzung des Aufsichtsrats zum Handelsregister eingereicht."
    },
    {
      "date": "2025-11-21",
      "id": "138017",
      "original_text": "Einreichung neuer Dokumente\nHamburg Amtsgericht Hamburg HRB 140881\nHPC Hamburg Port Consulting GmbH – Hamburg",
      "type": "Einreichung neuer Dokumente",
      "state": "Hamburg",
      "amtsgericht": "Amtsgericht Hamburg",
      "registernummer": "HRB 140881",
      "registerart": "HRB",
      "company_name": "HPC Hamburg Port Consulting GmbH",
      "company_seat": "Hamburg",
      "details": "21.11.2025 (Bekanntmachungsdatum)\n\nHamburg Amtsgericht Hamburg HRB 140881\nEinreichung neuer Dokumente\n\nHPC Hamburg Port Consulting GmbH\nGesellschaft mit beschränkter Haftung\nHamburg\n\nAls nicht eingetragen wird bekannt gemacht: Liste des Aufsichtsrats wurde eingereicht."
    },
    {
      "date": "2025-11-21",
      "id": "138018",
      "original_text": "Registerbekanntmachung nach dem Umwandlungsgesetz\nSaarland Amtsgericht Saarbrücken HRB 107783\nTechniplas NAG GmbH – Spiesen-Elversberg",
      "type": "Registerbekanntmachung nach dem Umwandlungsgesetz",
      "state": "Saarland",
      "amtsgericht": "Amtsgericht Saarbrücken",
      "registernummer": "HRB 107783",
      "registerart": "HRB",
      "company_name": "Techniplas NAG GmbH",
      "company_seat": "Spiesen-Elversberg",
      "details": "21.11.2025 (Bekanntmachungsdatum)\n\nSaarland Amtsgericht Saarbrücken HRB 107783\nRegisterbekanntmachung nach dem Umwandlungsgesetz 21.11.2025 (Eintragungsdatum)\n\nTechniplas NAG GmbH\nGesellschaft mit beschränkter Haftung\nSpiesen-Elversberg\n\nAls nicht eingetragen wird bekannt gemacht: Den Gläubigern der an der Verschmelzung beteiligten Gesellschaften ist, wenn sie binnen sechs Monaten nach dem Tag, an dem die Eintragung der Verschmelzung in das Register des Sitzes desjenigen Rechtsträgers, dessen Gläubiger sie sind, nach § 19 Absatz 3 UmwG bekannt gemacht worden ist, ihren Anspruch nach Grund und Höhe schriftlich anmelden, Sicherheit zu leisten, soweit sie nicht Befriedigung verlangen können. Dieses Recht steht den Gläubigern jedoch nur zu, wenn sie glaubhaft machen, dass durch die Verschmelzung die Erfüllung ihrer Forderung gefährdet wird."
    },
    {
      "date": "2025-11-21",
      "id": "138019",
      "original_text": "Einreichung neuer Dokumente\nSachsen Amtsgericht Leipzig HRB 22572\nAmazon Distribution GmbH – Leipzig",
      "type": "Einreichung neuer Dokumente",
      "state": "Sachsen",
      "amtsgericht": "Amtsgericht Leipzig",
      "registernummer": "HRB 22572",
      "registerart": "HRB",
      "company_name": "Amazon Distribution GmbH",
      "company_seat": "Leipzig",
      "details": "21.11.2025 (Bekanntmachungsdatum)\n\nSachsen Amtsgericht Leipzig HRB 22572\nEinreichung neuer Dokumente\n\nAmazon Distribution GmbH\nGesellschaft mit beschränkter Haftung\nLeipzig\n\nAm 18.11.2025 wurde beim Handelsregister des Amtsgerichts Leipzig die Liste der Mitglieder des Aufsichtsrats gemäß § 52 GmbHG eingereicht."
    },
    {
      "date": "2025-11-21",
      "id": "138020",
      "original_text": "Einreichung neuer Dokumente\nSachsen Amtsgericht Chemnitz HRB 22172\nVererdungsanlagen Westerzgebirge GmbH – Schwarzenberg/Erzgeb.",
      "type": "Einreichung neuer Dokumente",
      "state": "Sachsen",
      "amtsgericht": "Amtsgericht Chemnitz",
      "registernummer": "HRB 22172",
      "registerart": "HRB",
      "company_name": "Vererdungsanlagen Westerzgebirge GmbH",
      "company_seat": "Schwarzenberg/Erzgeb.",
      "details": "21.11.2025 (Bekanntmachungsdatum)\n\nSachsen Amtsgericht Chemnitz HRB 22172\nEinreichung neuer Dokumente\n\nVererdungsanlagen Westerzgebirge GmbH\nGesellschaft mit beschränkter Haftung\nSchwarzenberg/Erzgeb.\n\nAm 20.11.2025 wurde beim Handelsregister des Amtsgerichts Chemnitz die Liste der Mitglieder des Aufsichtsrats gemäß § 52 GmbHG eingereicht."
    },
    {
      "date": "2025-11-21",
      "id": "138021",
      "original_text": "Registerbekanntmachung nach dem Umwandlungsgesetz\nNiedersachsen Amtsgericht Walsrode HRA 205758\nMaren Bergen e.Kfr. – Wagenfeld",
      "type": "Registerbekanntmachung nach dem Umwandlungsgesetz",
      "state": "Niedersachsen",
      "amtsgericht": "Amtsgericht Walsrode",
      "registernummer": "HRA 205758",
      "registerart": "HRA",
      "company_name": "Maren Bergen e.Kfr.",
      "company_seat": "Wagenfeld",
      "details": "21.11.2025 (Bekanntmachungsdatum)\n\nNiedersachsen Amtsgericht Walsrode HRA 205758\nRegisterbekanntmachung nach dem Umwandlungsgesetz 21.11.2025 (Eintragungsdatum)\n\nMaren Bergen e.Kfr.\nEinzelkaufmann / Einzelkauffrau\nWagenfeld\n\nDen Gläubigern der an der Ausgliederung beteiligten Rechtsträger ist, wenn sie binnen sechs Monaten nach dem Tag, an dem die Eintragung der Ausgliederung in das Register des Sitzes desjenigen Rechtsträgers, dessen Gläubiger sie sind, nach § 19 Abs. 3 UmwG als bekannt gemacht gilt, ihren Anspruch nach Grund und Höhe schriftlich anmelden, Sicherheit zu leisten, soweit sie nicht Befriedigung verlangen können. Dieses Recht steht den Gläubigern jedoch nur zu, wenn sie glaubhaft machen, dass durch die Ausgliederung die Erfüllung der Forderung gefährdet wird."
    },
    {
      "date": "2025-11-21",
      "id": "138022",
      "original_text": "Registerbekanntmachung nach dem Umwandlungsgesetz\nNiedersachsen Amtsgericht Hildesheim HRB 210411\nbcs Management & IT - Beratung GmbH – Holle",
      "type": "Registerbekanntmachung nach dem Umwandlungsgesetz",
      "state": "Niedersachsen",
      "amtsgericht": "Amtsgericht Hildesheim",
      "registernummer": "HRB 210411",
      "registerart": "HRB",
      "company_name": "bcs Management & IT - Beratung GmbH",
      "company_seat": "Holle",
      "details": "21.11.2025 (Bekanntmachungsdatum)\n\nNiedersachsen Amtsgericht Hildesheim HRB 210411\nRegisterbekanntmachung nach dem Umwandlungsgesetz 21.11.2025 (Eintragungsdatum)\n\nbcs Management & IT - Beratung GmbH\nGesellschaft mit beschränkter Haftung\nHolle\n\nDen Gläubigern der an der formwechselnden Umwandlung beteiligten Rechtsträger ist, wenn sie binnen sechs Monaten nach dem Tag, an dem die Eintragung der Umwandlung in das Register des Sitzes desjenigen Rechtsträgers, dessen Gläubiger sie sind, nach § 19 Abs. 3 UmwG als bekannt gemacht gilt, ihren Anspruch nach Grund und Höhe schriftlich anmelden, Sicherheit zu leisten, soweit sie nicht Befriedigung verlangen können. Dieses Recht steht den Gläubigern jedoch nur zu, wenn sie glaubhaft machen, dass durch die formwechselnde Umwandlung die Erfüllung der Forderung gefährdet wird."
    },
    {
      "date": "2025-11-21",
      "id": "138023",
      "original_text": "Löschungsankündigung\nNiedersachsen Amtsgericht Hannover HRB 221911\nAKKOC Bau und Immobilien GmbH – Hannover",
      "type": "Löschungsankündigung",
      "state": "Niedersachsen",
      "amtsgericht": "Amtsgericht Hannover",
      "registernummer": "HRB 221911",
      "registerart": "HRB",
      "company_name": "AKKOC Bau und Immobilien GmbH",
      "company_seat": "Hannover",
      "details": "21.11.2025 (Bekanntmachungsdatum)\n\nNiedersachsen Amtsgericht Hannover HRB 221911\nLöschungsankündigung\n\nAKKOC Bau und Immobilien GmbH\nGesellschaft mit beschränkter Haftung\nHannover\n\nDas Registergericht beabsichtigt, die Gesellschaft von Amts wegen nach § 394 FamFG zu löschen. Die Frist zur Erhebung eines Widerspruchs ist auf 1 Monat ab dieser Registerbekanntmachung festgesetzt."
    },
    {
      "date": "2025-11-21",
      "id": "138024",
      "original_text": "Registerbekanntmachung nach dem Umwandlungsgesetz\nNiedersachsen Amtsgericht Hildesheim HRA 201648\nbcs Management & IT - Beratung GmbH & Co. KG – Holle",
      "type": "Registerbekanntmachung nach dem Umwandlungsgesetz",
      "state": "Niedersachsen",
      "amtsgericht": "Amtsgericht Hildesheim",
      "registernummer": "HRA 201648",
      "registerart": "HRA",
      "company_name": "bcs Management & IT - Beratung GmbH & Co. KG",
      "company_seat": "Holle",
      "details": "21.11.2025 (Bekanntmachungsdatum)\n\nNiedersachsen Amtsgericht Hildesheim HRA 201648\nRegisterbekanntmachung nach dem Umwandlungsgesetz 21.11.2025 (Eintragungsdatum)\n\nbcs Management & IT - Beratung GmbH & Co. KG\nKommanditgesellschaft\nHolle\n\nDen Gläubigern der an der formwechselnden Umwandlung beteiligten Rechtsträger ist, wenn sie binnen sechs Monaten nach dem Tag, an dem die Eintragung der Umwandlung in das Register des Sitzes desjenigen Rechtsträgers, dessen Gläubiger sie sind, nach § 19 Abs. 3 UmwG als bekannt gemacht gilt, ihren Anspruch nach Grund und Höhe schriftlich anmelden, Sicherheit zu leisten, soweit sie nicht Befriedigung verlangen können. Dieses Recht steht den Gläubigern jedoch nur zu, wenn sie glaubhaft machen, dass durch die formwechselnde Umwandlung die Erfüllung der Forderung gefährdet wird."
    },
    {
      "date": "2025-11-21",
      "id": "138025",
      "original_text": "Registerbekanntmachung nach dem Umwandlungsgesetz\nNiedersachsen Amtsgericht Walsrode HRA 205346\nMalte Holsten e. K. – Rotenburg (Wümme)",
      "type": "Registerbekanntmachung nach dem Umwandlungsgesetz",
      "state": "Niedersachsen",
      "amtsgericht": "Amtsgericht Walsrode",
      "registernummer": "HRA 205346",
      "registerart": "HRA",
      "company_name": "Malte Holsten e. K.",
      "company_seat": "Rotenburg (Wümme)",
      "details": "21.11.2025 (Bekanntmachungsdatum)\n\nNiedersachsen Amtsgericht Walsrode HRA 205346\nRegisterbekanntmachung nach dem Umwandlungsgesetz 21.11.2025 (Eintragungsdatum)\n\nMalte Holsten e. K.\nEinzelkaufmann / Einzelkauffrau\nRotenburg (Wümme)\n\nDen Gläubigern der an der Ausgliederung beteiligten Rechtsträger ist, wenn sie binnen sechs Monaten nach dem Tag, an dem die Eintragung der Ausgliederung in das Register des Sitzes desjenigen Rechtsträgers, dessen Gläubiger sie sind, nach § 19 Abs. 3 UmwG als bekannt gemacht gilt, ihren Anspruch nach Grund und Höhe schriftlich anmelden, Sicherheit zu leisten, soweit sie nicht Befriedigung verlangen können. Dieses Recht steht den Gläubigern jedoch nur zu, wenn sie glaubhaft machen, dass durch die Ausgliederung die Erfüllung der Forderung gefährdet wird."
    },
    {
      "date": "2025-11-21",
      "id": "138026",
      "original_text": "Löschungsankündigung\nNiedersachsen Amtsgericht Osnabrück HRB 20493\nRicke Sand und Kies GmbH – Merzen",
      "type": "Löschungsankündigung",
      "state": "Niedersachsen",
      "amtsgericht": "Amtsgericht Osnabrück",
      "registernummer": "HRB 20493",
      "registerart": "HRB",
      "company_name": "Ricke Sand und Kies GmbH",
      "company_seat": "Merzen",
      "details": "21.11.2025 (Bekanntmachungsdatum)\n\nNiedersachsen Amtsgericht Osnabrück HRB 20493\nLöschungsankündigung\n\nRicke Sand und Kies GmbH\nGesellschaft mit beschränkter Haftung\nMerzen\n\nDas Registergericht beabsichtigt, die Gesellschaft von Amts wegen nach § 394 FamFG wegen Vermögenslosigkeit zu löschen. Die Frist zur Erhebung eines Widerspruchs ist auf 1 Monat ab dieser Registerbekanntmachung festgesetzt."
    },
    {
      "date": "2025-11-21",
      "id": "138027",
      "original_text": "Registerbekanntmachung nach dem Umwandlungsgesetz\nNiedersachsen Amtsgericht Walsrode HRB 212482\nMaren Bergen Tagespflege GmbH – Wagenfeld",
      "type": "Registerbekanntmachung nach dem Umwandlungsgesetz",
      "state": "Niedersachsen",
      "amtsgericht": "Amtsgericht Walsrode",
      "registernummer": "HRB 212482",
      "registerart": "HRB",
      "company_name": "Maren Bergen Tagespflege GmbH",
      "company_seat": "Wagenfeld",
      "details": "21.11.2025 (Bekanntmachungsdatum)\n\nNiedersachsen Amtsgericht Walsrode HRB 212482\nRegisterbekanntmachung nach dem Umwandlungsgesetz 21.11.2025 (Eintragungsdatum)\n\nMaren Bergen Tagespflege GmbH\nGesellschaft mit beschränkter Haftung\nWagenfeld\n\nDen Gläubigern der an der Ausgliederung beteiligten Rechtsträger ist, wenn sie binnen sechs Monaten nach dem Tag, an dem die Eintragung der Ausgliederung in das Register des Sitzes desjenigen Rechtsträgers, dessen Gläubiger sie sind, nach § 19 Abs. 3 UmwG als bekannt gemacht gilt, ihren Anspruch nach Grund und Höhe schriftlich anmelden, Sicherheit zu leisten, soweit sie nicht Befriedigung verlangen können. Dieses Recht steht den Gläubigern jedoch nur zu, wenn sie glaubhaft machen, dass durch die Ausgliederung die Erfüllung der Forderung gefährdet wird."
    },
    {
      "date": "2025-11-21",
      "id": "138028",
      "original_text": "Löschungsankündigung\nBremen Amtsgericht Bremen HRB 30508\nHansa Net GmbH – Bremen",
      "type": "Löschungsankündigung",
      "state": "Bremen",
      "amtsgericht": "Amtsgericht Bremen",
      "registernummer": "HRB 30508",
      "registerart": "HRB",
      "company_name": "Hansa Net GmbH",
      "company_seat": "Bremen",
      "details": "21.11.2025 (Bekanntmachungsdatum)\n\nBremen Amtsgericht Bremen HRB 30508\nLöschungsankündigung\n\nHansa Net GmbH\nGesellschaft mit beschränkter Haftung\nBremen\n\nEs ist beabsichtigt die im Handelsregister eingetragene Gesellschaft von Amts wegen gemäß § 394 FamFG zu löschen. Gegen die Löschung kann beim AG Bremen schriftlich oder zu Protokoll der Geschäftsstelle Widerspruch eingelegt werden. Widerspruchsfrist 4 Wochen."
    },
    {
      "date": "2025-11-21",
      "id": "138029",
      "original_text": "Registerbekanntmachung nach dem Umwandlungsgesetz\nBremen Amtsgericht Bremen HRB 2675 BHV\nLuise Schlange GmbH – Bremerhaven",
      "type": "Registerbekanntmachung nach dem Umwandlungsgesetz",
      "state": "Bremen",
      "amtsgericht": "Amtsgericht Bremen",
      "registernummer": "HRB 2675 BHV",
      "registerart": "HRB",
      "company_name": "Luise Schlange GmbH",
      "company_seat": "Bremerhaven",
      "details": "21.11.2025 (Bekanntmachungsdatum)\n\nBremen Amtsgericht Bremen HRB 2675 BHV\nRegisterbekanntmachung nach dem Umwandlungsgesetz 18.11.2025 (Eintragungsdatum)\n\nLuise Schlange GmbH\nGesellschaft mit beschränkter Haftung\nBremerhaven\n\nAls nicht eingetragen wird veröffentlicht: Den Gläubigern der an der Verschmelzung beteiligten Rechtsträger ist, wenn sie binnen sechs Monaten nach dem Tag, an dem die Eintragung der Verschmelzung in das Register des Sitzes desjenigen Rechtsträgers, dessen Gläubiger sie sind, als bekannt gemacht gilt, ihren Anspruch nach Grund und Höhe schriftlich anmelden, Sicherheit zu leisten, soweit sie nicht Befriedigung verlangen können. Dieses Recht steht den Gläubigern jedoch nur zu, wenn sie glaubhaft machen, dass durch die Verschmelzung die Erfüllung ihrer Forderung gefährdet wird. Das Recht, Sicherheitsleistung zu verlangen, steht Gläubigern nicht zu, die im Falle der Insolvenz ein Recht auf vorzugsweise Befriedigung aus einer Deckungsmasse haben, die nach gesetzlicher Vorschrift zu ihrem Schutz errichtet und staatlich überwacht ist."
    },
    {
      "date": "2025-11-21",
      "id": "138030",
      "original_text": "Einreichung neuer Dokumente\nBremen Amtsgericht Bremen HRB 3354\nWFB Wirtschaftsförderung Bremen GmbH – Bremen",
      "type": "Einreichung neuer Dokumente",
      "state": "Bremen",
      "amtsgericht": "Amtsgericht Bremen",
      "registernummer": "HRB 3354",
      "registerart": "HRB",
      "company_name": "WFB Wirtschaftsförderung Bremen GmbH",
      "company_seat": "Bremen",
      "details": "21.11.2025 (Bekanntmachungsdatum)\n\nBremen Amtsgericht Bremen HRB 3354\nEinreichung neuer Dokumente\n\nWFB Wirtschaftsförderung Bremen GmbH\nGesellschaft mit beschränkter Haftung\nBremen\n\nAls nicht eingetragen wird veröffentlicht: Liste des Aufsichtsrats wurde eingereicht."
    },
    {
      "date": "2025-11-21",
      "id": "138031",
      "original_text": "Löschungsankündigung\nNordrhein-Westfalen Amtsgericht Gütersloh HRA 6693\nSchäfer Immobilien GmbH & Co. KG – Harsewinkel",
      "type": "Löschungsankündigung",
      "state": "Nordrhein-Westfalen",
      "amtsgericht": "Amtsgericht Gütersloh",
      "registernummer": "HRA 6693",
      "registerart": "HRA",
      "company_name": "Schäfer Immobilien GmbH & Co. KG",
      "company_seat": "Harsewinkel",
      "details": "21.11.2025 (Bekanntmachungsdatum)\n\nNordrhein-Westfalen Amtsgericht Gütersloh HRA 6693\nLöschungsankündigung\n\nSchäfer Immobilien GmbH & Co. KG\nKommanditgesellschaft\nHarsewinkel\n\nDas Registergericht beabsichtigt die Firma von Amts wegen nach § 394 FamFG zu löschen. Die Frist zur Erhebung eines Widerspruchs ist auf einen Monat festgesetzt."
    },
    {
      "date": "2025-11-21",
      "id": "138032",
      "original_text": "Einreichung neuer Dokumente\nNordrhein-Westfalen Amtsgericht Iserlohn HRB 8315\nLinamar Plettenberg GmbH – Plettenberg",
      "type": "Einreichung neuer Dokumente",
      "state": "Nordrhein-Westfalen",
      "amtsgericht": "Amtsgericht Iserlohn",
      "registernummer": "HRB 8315",
      "registerart": "HRB",
      "company_name": "Linamar Plettenberg GmbH",
      "company_seat": "Plettenberg",
      "details": "21.11.2025 (Bekanntmachungsdatum)\n\nNordrhein-Westfalen Amtsgericht Iserlohn HRB 8315\nEinreichung neuer Dokumente 21.11.2025 (Eintragungsdatum)\n\nLinamar Plettenberg GmbH\nGesellschaft mit beschränkter Haftung\nPlettenberg\n\nDem Registergericht ist eine neue Liste der Mitglieder des Aufsichtsrates eingereicht worden."
    },
    {
      "date": "2025-11-21",
      "id": "138033",
      "original_text": "Registerbekanntmachung nach dem Umwandlungsgesetz\nNordrhein-Westfalen Amtsgericht Essen HRA 11874\nDevran Tug e. K. – Essen",
      "type": "Registerbekanntmachung nach dem Umwandlungsgesetz",
      "state": "Nordrhein-Westfalen",
      "amtsgericht": "Amtsgericht Essen",
      "registernummer": "HRA 11874",
      "registerart": "HRA",
      "company_name": "Devran Tug e. K.",
      "company_seat": "Essen",
      "details": "21.11.2025 (Bekanntmachungsdatum)\n\nNordrhein-Westfalen Amtsgericht Essen HRA 11874\nRegisterbekanntmachung nach dem Umwandlungsgesetz 21.11.2025 (Eintragungsdatum)\n\nDevran Tug e. K.\nEinzelkaufmann / Einzelkauffrau\nEssen\n\nDen Gläubigern der an der Ausgliederung beteiligten Rechtsträger ist, wenn sie binnen sechs Monaten nach dem Tag, an dem die Eintragung der Ausgliederung in das Register des Sitzes desjenigen Rechtsträgers, dessen Gläubiger sie sind, nach § 19 Absatz 3 UmwG als bekanntgemacht gilt, ihren Anspruch nach Grund und Höhe schriftlich anmelden, Sicherheit zu leisten, soweit sie nicht Befriedigung verlangen können. Dieses Recht steht den Gläubigern jedoch nur zu, wenn sie glaubhaft machen, dass durch die Ausgliederung die Erfüllung ihrer Forderung gefährdet wird."
    },
    {
      "date": "2025-11-21",
      "id": "138034",
      "original_text": "Löschungsankündigung\nNordrhein-Westfalen Amtsgericht Köln HRB 118818\nAlex Service GmbH – Köln",
      "type": "Löschungsankündigung",
      "state": "Nordrhein-Westfalen",
      "amtsgericht": "Amtsgericht Köln",
      "registernummer": "HRB 118818",
      "registerart": "HRB",
      "company_name": "Alex Service GmbH",
      "company_seat": "Köln",
      "details": "21.11.2025 (Bekanntmachungsdatum)\n\nNordrhein-Westfalen Amtsgericht Köln HRB 118818\nLöschungsankündigung\n\nAlex Service GmbH\nGesellschaft mit beschränkter Haftung\nKöln\n\nDas Registergericht beabsichtigt, die im Handelsregister eingetragene Gesellschaft gemäß § 394 Absatz 1 FamFG wegen Vermögenslosigkeit von Amts wegen zu löschen. Gegen diese Verfügung kann Widerspruch eingelegt werden. Die Frist zur Erhebung eines Widerspruchs gegen die beabsichtigte Löschung von Amts wegen ist auf einen Monat festgesetzt. Rechtsbehelfsbelehrung: Gegen diese Verfügung können Sie Widerspruch einlegen. Der Widerspruch ist bei dem Amtsgericht Köln, Reichenspergerplatz 1, 50670 Köln schriftlich in deutscher Sprache oder zur Niederschrift der Geschäftsstelle einzulegen. Der Widerspruch kann auch zur Niederschrift der Geschäftsstelle eines jeden Amtsgerichtes abgegeben werden. Die Einlegung ist auch durch Übertragung eines elektronischen Dokuments an die elektronische Poststelle des Gerichts möglich. Das elektronische Dokument muss für die Bearbeitung durch das Gericht geeignet und mit einer qualifizierten elektronischen Signatur der verantwortenden Person versehen sein oder von der verantwortenden Person signiert und auf einem sicheren Übermittlungsweg gemäß § 130a ZPO nach näherer Maßgabe der Verordnung über die technischen Rahmenbedingungen des elektronischen Rechtsverkehrs und über das besondere elektronische Behördenpostfach (BGBl. I, S.3803) eingereicht werden. Weitere Informationen erhalten Sie auf der Internetseite www.justiz.de.Der Widerspruch muss spätestens innerhalb der gesetzten Frist bei dem Amtsgericht Köln eingegangen sein. Dies gilt auch dann, wenn der Widerspruch zur Niederschrift der Geschäftsstelle eines anderen Amtsgerichtes abgegeben wurde. Die Frist beginnt mit der Veröffentlichung. Fällt das Ende der Frist auf einen Sonntag, einen allgemeinen Feiertag oder Sonnabend, so endet die Frist mit Ablauf des nächsten Werktages.\n\nDer Widerspruch muss die Bezeichnung der angefochtenen Verfügung sowie die Erklärung enthalten, dass Widerspruch gegen diese Verfügung eingelegt wird. Er ist zu unterzeichnen und soll begründet werden."
    },
    {
      "date": "2025-11-21",
      "id": "138035",
      "original_text": "Registerbekanntmachung nach dem Umwandlungsgesetz\nNordrhein-Westfalen Amtsgericht Wuppertal HRB 26795\nWIMOVE GmbH – Heiligenhaus",
      "type": "Registerbekanntmachung nach dem Umwandlungsgesetz",
      "state": "Nordrhein-Westfalen",
      "amtsgericht": "Amtsgericht Wuppertal",
      "registernummer": "HRB 26795",
      "registerart": "HRB",
      "company_name": "WIMOVE GmbH",
      "company_seat": "Heiligenhaus",
      "details": "21.11.2025 (Bekanntmachungsdatum)\n\nNordrhein-Westfalen Amtsgericht Wuppertal HRB 26795\nRegisterbekanntmachung nach dem Umwandlungsgesetz 21.11.2025 (Eintragungsdatum)\n\nWIMOVE GmbH\nGesellschaft mit beschränkter Haftung\nHeiligenhaus\n\nDen Gläubigern der an der Verschmelzung beteiligten Rechtsträger ist, wenn sie binnen sechs Monaten nach dem Tag, an dem die Eintragung der Verschmelzung in das Register des Sitzes desjenigen Rechtsträgers, dessen Gläubiger sie sind, nach § 19 Absatz 3 UmwG als bekanntgemacht gilt, ihren Anspruch nach Grund und Höhe schriftlich anmelden, Sicherheit zu leisten, soweit sie nicht Befriedigung verlangen können. Dieses Recht steht den Gläubigern jedoch nur zu, wenn sie glaubhaft machen, dass durch die Verschmelzung die Erfüllung ihrer Forderung gefährdet wird."
    },
    {
      "date": "2025-11-21",
      "id": "138036",
      "original_text": "Löschungsankündigung\nNordrhein-Westfalen Amtsgericht Wuppertal HRB 22096\npearfactory GmbH – Velbert",
      "type": "Löschungsankündigung",
      "state": "Nordrhein-Westfalen",
      "amtsgericht": "Amtsgericht Wuppertal",
      "registernummer": "HRB 22096",
      "registerart": "HRB",
      "company_name": "pearfactory GmbH",
      "company_seat": "Velbert",
      "details": "21.11.2025 (Bekanntmachungsdatum)\n\nNordrhein-Westfalen Amtsgericht Wuppertal HRB 22096\nLöschungsankündigung\n\npearfactory GmbH\nGesellschaft mit beschränkter Haftung\nVelbert\n\nDas Registergericht beabsichtigt die Gesellschaft von Amts wegen nach § 394 FamFG zu löschen. Die Frist zur Erhebung eines Widerspruchs ist auf einen Monat festgesetzt."
    },
    {
      "date": "2025-11-21",
      "id": "138037",
      "original_text": "Registerbekanntmachung nach dem Umwandlungsgesetz\nNordrhein-Westfalen Amtsgericht Paderborn HRA 5572\nSideStep Solutions e.K. – Paderborn",
      "type": "Registerbekanntmachung nach dem Umwandlungsgesetz",
      "state": "Nordrhein-Westfalen",
      "amtsgericht": "Amtsgericht Paderborn",
      "registernummer": "HRA 5572",
      "registerart": "HRA",
      "company_name": "SideStep Solutions e.K.",
      "company_seat": "Paderborn",
      "details": "21.11.2025 (Bekanntmachungsdatum)\n\nNordrhein-Westfalen Amtsgericht Paderborn HRA 5572\nRegisterbekanntmachung nach dem Umwandlungsgesetz 21.11.2025 (Eintragungsdatum)\n\nSideStep Solutions e.K.\nEinzelkaufmann / Einzelkauffrau\nPaderborn\n\nDen Gläubigern der an der Ausgliederung beteiligten Rechtsträger ist, wenn sie binnen sechs Monaten nach dem Tag, an dem die Eintragung der Ausgliederung in das Register des Sitzes desjenigen Rechtsträgers, dessen Gläubiger sie sind, nach § 19 Absatz 3 UmwG als bekanntgemacht gilt, ihren Anspruch nach Grund und Höhe schriftlich anmelden, Sicherheit zu leisten, soweit sie nicht Befriedigung verlangen können. Dieses Recht steht den Gläubigern jedoch nur zu, wenn sie glaubhaft machen, dass durch die Ausgliederung die Erfüllung ihrer Forderung gefährdet wird."
    },
    {
      "date": "2025-11-21",
      "id": "138038",
      "original_text": "Löschungsankündigung\nNordrhein-Westfalen Amtsgericht Aachen HRB 26351\nCIKO-Bau UG (haftungsbeschränkt) – Aachen",
      "type": "Löschungsankündigung",
      "state": "Nordrhein-Westfalen",
      "amtsgericht": "Amtsgericht Aachen",
      "registernummer": "HRB 26351",
      "registerart": "HRB",
      "company_name": "CIKO-Bau UG (haftungsbeschränkt)",
      "company_seat": "Aachen",
      "details": "21.11.2025 (Bekanntmachungsdatum)\n\nNordrhein-Westfalen Amtsgericht Aachen HRB 26351\nLöschungsankündigung\n\nCIKO-Bau UG (haftungsbeschränkt)\nGesellschaft mit beschränkter Haftung\nAachen\n\nDas Registergericht beabsichtigt, von Amts wegen die Gesellschaft wegen Vermögenslosigkeit nach § 394 FamFG zu löschen, weil das Finanzamt Aachen-Stadt mit Schreiben vom 10.11.2025 und 14.11.2025 Umstände mitgeteilt hat, aufgrund derer das Gericht davon überzeugt ist, dass die Gesellschaft vollständig vermögenslos ist.\n\nZur Geltendmachung des Widerspruchs gegen die beabsichtigte Löschung wird hiermit eine Frist von einem Monat ab Veröffentlichung dieser Ankündigung bestimmt.\n\nRechtsbehelfsbelehrung:\n\nGegen diese Verfügung kann Widerspruch eingelegt werden. Zum Widerspruch ist jeder berechtigt, der an der Unterlassung der Löschung ein berechtigtes Interesse hat.\n\nDer Widerspruch ist bei dem Amtsgericht Aachen, Adalbertsteinweg 92, 52070 Aachen schriftlich in deutscher Sprache oder zur Niederschrift der Geschäftsstelle einzulegen. Der Widerspruch kann auch zur Niederschrift der Geschäftsstelle eines jeden Amtsgerichtes abgegeben werden.\n\nDer Widerspruch muss spätestens innerhalb der gesetzten Frist nach der Bekanntgabe der Verfügung bei dem Amtsgericht Aachen eingegangen sein. Dies gilt auch dann, wenn der Widerspruch zur Niederschrift der Geschäftsstelle eines anderen Amtsgerichtes abgegeben wurde. Die Frist beginnt mit der Bekanntgabe der Verfügung durch Veröffentlichung. Fällt das Ende der Frist auf einen Sonntag, einen allgemeinen Feiertag oder Sonnabend, so endet die Frist mit Ablauf des nächsten Werktages.\n\nDer Widerspruch muss die Bezeichnung der angefochtenen Verfügung sowie die Erklärung enthalten, dass Widerspruch gegen diese Verfügung eingelegt wird. Er ist zu unterzeichnen und soll begründet werden.\n\nDie Einlegung ist auch durch Übertragung eines elektronischen Dokuments an die elektronische Poststelle des Gerichts möglich. Das elektronische Dokument muss für die Bearbeitung durch das Gericht geeignet und mit einer qualifizierten elektronischen Signatur der verantwortenden Person versehen sein oder von der verantwortenden Person signiert und auf einem sicheren Übermittlungsweg gemäß § 130 a ZPO nach näherer Maßgabe der Verordnung über die technischen Rahmenbedingungen des elektronischen Rechtsverkehrs und über das besondere elektronische Behördenpostfach (BGBl. I, S. 3803) eingereicht werden. Weitere Informationen erhalten Sie auf der Internetseite www.justiz.de."
    },
    {
      "date": "2025-11-21",
      "id": "138039",
      "original_text": "Registerbekanntmachung nach dem Umwandlungsgesetz\nNordrhein-Westfalen Amtsgericht Duisburg HRB 9379\ndotzilla Verwaltungs GmbH – Oberhausen",
      "type": "Registerbekanntmachung nach dem Umwandlungsgesetz",
      "state": "Nordrhein-Westfalen",
      "amtsgericht": "Amtsgericht Duisburg",
      "registernummer": "HRB 9379",
      "registerart": "HRB",
      "company_name": "dotzilla Verwaltungs GmbH",
      "company_seat": "Oberhausen",
      "details": "21.11.2025 (Bekanntmachungsdatum)\n\nNordrhein-Westfalen Amtsgericht Duisburg HRB 9379\nRegisterbekanntmachung nach dem Umwandlungsgesetz 21.11.2025 (Eintragungsdatum)\n\ndotzilla Verwaltungs GmbH\nGesellschaft mit beschränkter Haftung\nOberhausen\n\nDie Gesellschaft hat Gläubigern, deren Forderungen vor dieser Bekanntmachung begründet worden sind, Sicherheit zu leisten, soweit sie nicht Befriedigung verlangen können, wenn sie sich binnen sechs Monaten zu diesem Zweck melden."
    },
    {
      "date": "2025-11-21",
      "id": "138040",
      "original_text": "Löschungsankündigung\nNordrhein-Westfalen Amtsgericht Gelsenkirchen HRB 16890\nBicer Metallschleiferei GmbH – Dorsten",
      "type": "Löschungsankündigung",
      "state": "Nordrhein-Westfalen",
      "amtsgericht": "Amtsgericht Gelsenkirchen",
      "registernummer": "HRB 16890",
      "registerart": "HRB",
      "company_name": "Bicer Metallschleiferei GmbH",
      "company_seat": "Dorsten",
      "details": "21.11.2025 (Bekanntmachungsdatum)\n\nNordrhein-Westfalen Amtsgericht Gelsenkirchen HRB 16890\nLöschungsankündigung\n\nBicer Metallschleiferei GmbH\nGesellschaft mit beschränkter Haftung\nDorsten\n\nDas Gericht beabsichtigt, die Bicer Metallschleiferei GmbH mit Sitz in Dorsten, HRB 16890, Amtsgericht Gelsenkirchen, wegen Vermögenslosigkeit zu löschen.\nHiermit wird denjenigen, die an der Unterlassung der Löschung ein berechtigtes Interesse haben, gem. § 394 Abs. 2 FamFG Gelegenheit gegeben, gegen dieses Vorhaben binnen eines Monats nach dieser Bekanntmachung Widerspruch einzulegen. Der Widerspruch kann schriftlich oder zu Protokoll der Geschäftsstelle erhoben werden."
    },
    {
      "date": "2025-11-21",
      "id": "138041",
      "original_text": "Registerbekanntmachung nach dem Umwandlungsgesetz\nNordrhein-Westfalen Amtsgericht Düsseldorf HRB 108168\nKK Steuerfachverlag GmbH – Düsseldorf",
      "type": "Registerbekanntmachung nach dem Umwandlungsgesetz",
      "state": "Nordrhein-Westfalen",
      "amtsgericht": "Amtsgericht Düsseldorf",
      "registernummer": "HRB 108168",
      "registerart": "HRB",
      "company_name": "KK Steuerfachverlag GmbH",
      "company_seat": "Düsseldorf",
      "details": "21.11.2025 (Bekanntmachungsdatum)\n\nNordrhein-Westfalen Amtsgericht Düsseldorf HRB 108168\nRegisterbekanntmachung nach dem Umwandlungsgesetz 21.11.2025 (Eintragungsdatum)\n\nKK Steuerfachverlag GmbH\nGesellschaft mit beschränkter Haftung\nDüsseldorf\n\nDen Gläubigern der an der Verschmelzung beteiligten Rechtsträger ist, wenn sie binnen sechs Monaten nach dem Tag, an dem die Eintragung der Verschmelzung in das Register des Sitzes desjenigen Rechtsträgers, dessen Gläubiger sie sind, nach § 19 Absatz 3 UmwG als bekanntgemacht gilt, ihren Anspruch nach Grund und Höhe schriftlich anmelden, Sicherheit zu leisten, soweit sie nicht Befriedigung verlangen können. Dieses Recht steht den Gläubigern jedoch nur zu, wenn sie glaubhaft machen, dass durch die Verschmelzung die Erfüllung ihrer Forderung gefährdet wird."
    },
    {
      "date": "2025-11-21",
      "id": "138042",
      "original_text": "Einreichung neuer Dokumente\nNordrhein-Westfalen Amtsgericht Köln HRB 28662\nSprint Sanierung GmbH – Köln",
      "type": "Einreichung neuer Dokumente",
      "state": "Nordrhein-Westfalen",
      "amtsgericht": "Amtsgericht Köln",
      "registernummer": "HRB 28662",
      "registerart": "HRB",
      "company_name": "Sprint Sanierung GmbH",
      "company_seat": "Köln",
      "details": "21.11.2025 (Bekanntmachungsdatum)\n\nNordrhein-Westfalen Amtsgericht Köln HRB 28662\nEinreichung neuer Dokumente\n\nSprint Sanierung GmbH\nGesellschaft mit beschränkter Haftung\nKöln\n\nDem Registergericht ist eine Liste der Mitglieder des Aufsichtsrates (Beirats) eingereicht worden."
    },
    {
      "date": "2025-11-21",
      "id": "138043",
      "original_text": "Registerbekanntmachung nach dem Umwandlungsgesetz\nNordrhein-Westfalen Amtsgericht Duisburg HRB 21065\ngroup6 GmbH – Oberhausen",
      "type": "Registerbekanntmachung nach dem Umwandlungsgesetz",
      "state": "Nordrhein-Westfalen",
      "amtsgericht": "Amtsgericht Duisburg",
      "registernummer": "HRB 21065",
      "registerart": "HRB",
      "company_name": "group6 GmbH",
      "company_seat": "Oberhausen",
      "details": "21.11.2025 (Bekanntmachungsdatum)\n\nNordrhein-Westfalen Amtsgericht Duisburg HRB 21065\nRegisterbekanntmachung nach dem Umwandlungsgesetz 21.11.2025 (Eintragungsdatum)\n\ngroup6 GmbH\nGesellschaft mit beschränkter Haftung\nOberhausen\n\nDie Gesellschaft hat Gläubigern, deren Forderungen vor dieser Bekanntmachung begründet worden sind, Sicherheit zu leisten, soweit sie nicht Befriedigung verlangen können, wenn sie sich binnen sechs Monaten zu diesem Zweck melden."
    },
    {
      "date": "2025-11-21",
      "id": "138044",
      "original_text": "Löschungsankündigung\nNordrhein-Westfalen Amtsgericht Dortmund HRB 31653\nMFC IT SERVICES LIMITED – Dortmund",
      "type": "Löschungsankündigung",
      "state": "Nordrhein-Westfalen",
      "amtsgericht": "Amtsgericht Dortmund",
      "registernummer": "HRB 31653",
      "registerart": "HRB",
      "company_name": "MFC IT SERVICES LIMITED",
      "company_seat": "Dortmund",
      "details": "21.11.2025 (Bekanntmachungsdatum)\n\nNordrhein-Westfalen Amtsgericht Dortmund HRB 31653\nLöschungsankündigung\n\nMFC IT SERVICES LIMITED\nRechtsform ausländischen Rechts HRB\nDortmund\n\nDas Registergericht beabsichtigt die Gesellschaft von Amts wegen nach § 394 FamFG zu löschen. Die Frist zur Erhebung eines Widerspruchs ist auf zwei Monate festgesetzt."
    },
    {
      "date": "2025-11-21",
      "id": "138045",
      "original_text": "Löschungsankündigung\nNordrhein-Westfalen Amtsgericht Köln HRB 91631\nGIV Gesellschaft für Innovationstransfer und -verwertung mbH – Köln",
      "type": "Löschungsankündigung",
      "state": "Nordrhein-Westfalen",
      "amtsgericht": "Amtsgericht Köln",
      "registernummer": "HRB 91631",
      "registerart": "HRB",
      "company_name": "GIV Gesellschaft für Innovationstransfer und -verwertung mbH",
      "company_seat": "Köln",
      "details": "21.11.2025 (Bekanntmachungsdatum)\n\nNordrhein-Westfalen Amtsgericht Köln HRB 91631\nLöschungsankündigung\n\nGIV Gesellschaft für Innovationstransfer und -verwertung mbH\nGesellschaft mit beschränkter Haftung\nKöln\n\nDas Registergericht beabsichtigt die Gesellschaft von Amts wegen nach § 394 FamFG zu löschen. Die Frist zur Erhebung eines Widerspruchs ist auf einen Monat festgesetzt."
    },
    {
      "date": "2025-11-21",
      "id": "138046",
      "original_text": "Löschungsankündigung\nNordrhein-Westfalen Amtsgericht Köln HRB 91631\nGIV Gesellschaft für Innovationstransfer und -verwertung mbH – Köln",
      "type": "Löschungsankündigung",
      "state": "Nordrhein-Westfalen",
      "amtsgericht": "Amtsgericht Köln",
      "registernummer": "HRB 91631",
      "registerart": "HRB",
      "company_name": "GIV Gesellschaft für Innovationstransfer und -verwertung mbH",
      "company_seat": "Köln",
      "details": "21.11.2025 (Bekanntmachungsdatum)\n\nNordrhein-Westfalen Amtsgericht Köln HRB 91631\nLöschungsankündigung\n\nGIV Gesellschaft für Innovationstransfer und -verwertung mbH\nGesellschaft mit beschränkter Haftung\nKöln\n\nDas Registergericht beabsichtigt die Gesellschaft von Amts wegen nach § 394 FamFG zu löschen. Die Frist zur Erhebung eines Widerspruchs ist auf einen Monat festgesetzt."
    },
    {
      "date": "2025-11-21",
      "id": "138047",
      "original_text": "Löschungsankündigung\nNordrhein-Westfalen Amtsgericht Duisburg HRB 34833\nTempus Mediatio UG (haftungsbeschränkt) – Dinslaken",
      "type": "Löschungsankündigung",
      "state": "Nordrhein-Westfalen",
      "amtsgericht": "Amtsgericht Duisburg",
      "registernummer": "HRB 34833",
      "registerart": "HRB",
      "company_name": "Tempus Mediatio UG (haftungsbeschränkt)",
      "company_seat": "Dinslaken",
      "details": "21.11.2025 (Bekanntmachungsdatum)\n\nNordrhein-Westfalen Amtsgericht Duisburg HRB 34833\nLöschungsankündigung\n\nTempus Mediatio UG (haftungsbeschränkt)\nGesellschaft mit beschränkter Haftung\nDinslaken\n\nHRB 34833\nTempus Mediatio UG (haftungsbeschränkt), Dinslaken,\nThyssenstraße 179, 46535 Dinslaken. Das Registergericht beabsichtigt, die im Handelsregister eingetragene Gesellschaft gemäß § 394 Absatz 1 FamFG wegen Vermögenslosigkeit von Amts wegen zu löschen. Gegen diese Verfügung kann Widerspruch eingelegt werden. Die Frist zur Erhebung eines Widerspruchs gegen die beabsichtigte Löschung von Amts wegen ist auf drei Monate festgesetzt. Rechtsbehelfsbelehrung Der Widerspruch ist bei dem Amtsgericht Duisburg, Kardinal-Galen-Str. 124-132, 47058 Duisburg schriftlich in deutscher Sprache oder zur Niederschrift der Geschäftsstelle einzulegen. Der Widerspruch kann auch zur Niederschrift der Geschäftsstelle eines jeden Amtsgerichtes abgegeben werden. Die Einlegung ist auch durch Übertragung eines elektronischen Dokuments an die elektronische Poststelle des Gerichts möglich. Das elektronische Dokument muss für die Bearbeitung durch das Gericht geeignet und mit einer qualifizierten elektronischen Signatur der verantwortenden Person versehen sein oder von der verantwortenden Person signiert und auf einem sicheren Übermittlungsweg gemäß § 130 a ZPO nach näherer Maßgabe der Verordnung über die technischen Rahmenbedingungen des elektronischen Rechtsverkehrs und über das besondere elektronische Behördenpostfach (BGBl. I, S. 3803) eingereicht werden. Weitere Informationen erhalten Sie auf der Internetseite www.justiz.de <http://www.justiz.de>. Der Widerspruch muss spätestens innerhalb der gesetzten Frist bei dem Amtsgericht Duisburg eingegangen sein. Dies gilt auch dann, wenn der Widerspruch zur Niederschrift der Geschäftsstelle eines anderen Amtsgerichtes abgegeben wurde. Die Frist beginnt mit der Veröffentlichung. Fällt das Ende der Frist auf einen Sonntag, einen allgemeinen Feiertag oder Sonnabend, so endet die Frist mit Ablauf des nächsten Werktages. Der Widerspruch muss die Bezeichnung der angefochtenen Verfügung sowie die Erklärung enthalten, dass Widerspruch gegen diese Verfügung eingelegt wird. Er ist zu unterzeichnen und soll begründet werden."
    },
    {
      "date": "2025-11-21",
      "id": "138048",
      "original_text": "Sonstige Registerbekanntmachung\nNordrhein-Westfalen Amtsgericht Gelsenkirchen HRB 12559\nKnappschaft Kliniken Bottrop GmbH – Bottrop",
      "type": "Sonstige Registerbekanntmachung",
      "state": "Nordrhein-Westfalen",
      "amtsgericht": "Amtsgericht Gelsenkirchen",
      "registernummer": "HRB 12559",
      "registerart": "HRB",
      "company_name": "Knappschaft Kliniken Bottrop GmbH",
      "company_seat": "Bottrop",
      "details": "21.11.2025 (Bekanntmachungsdatum)\n\nNordrhein-Westfalen Amtsgericht Gelsenkirchen HRB 12559\nSonstige Registerbekanntmachung 21.11.2025 (Eintragungsdatum)\n\nKnappschaft Kliniken Bottrop GmbH\nGesellschaft mit beschränkter Haftung\nBottrop\n\nDem Registergericht ist eine neue Liste der Mitglieder des Aufsichtsrates eingereicht worden."
    },
    {
      "date": "2025-11-21",
      "id": "138049",
      "original_text": "Löschungsankündigung\nNordrhein-Westfalen Amtsgericht Neuss HRB 20284\nBS Bauunternehmung GmbH – Neuss",
      "type": "Löschungsankündigung",
      "state": "Nordrhein-Westfalen",
      "amtsgericht": "Amtsgericht Neuss",
      "registernummer": "HRB 20284",
      "registerart": "HRB",
      "company_name": "BS Bauunternehmung GmbH",
      "company_seat": "Neuss",
      "details": "21.11.2025 (Bekanntmachungsdatum)\n\nNordrhein-Westfalen Amtsgericht Neuss HRB 20284\nLöschungsankündigung 17.11.2025 (Eintragungsdatum)\n\nBS Bauunternehmung GmbH\nGesellschaft mit beschränkter Haftung\nNeuss\n\nDas Registergericht beabsichtigt die Gesellschaft von Amts wegen nach § 394 FamFG zu löschen. Die Frist zur Erhebung eines Widerspruchs ist auf einen Monat festgesetzt. Rechtsbehelfsbelehrung:  Gegen diese Verfügung können Sie Widerspruch einlegen. Der Widerspruch ist bei dem Amtsgericht Neuss - Registergericht -, Breite Str. 48, 41460 Neuss schriftlich in deutscher Sprache oder zur Niederschrift der Geschäftsstelle einzulegen. Der Widerspruch kann auch zur Niederschrift der Geschäftsstelle eines jeden Amtsgerichtes abgegeben werden. Die Einlegung ist auch durch Übertragung eines elektronischen Dokuments an die elektronische Poststelle des Gerichts möglich. Das elektronische Dokument muss für die Bearbeitung durch das Gericht geeignet und mit einer qualifizierten elektronischen Signatur der verantwortenden Person versehen sein oder von der verantwortenden Person signiert und auf einem sicheren Übermittlungsweg gemäß § 130a ZPO nach näherer Maßgabe der Verordnung über die technischen Rahmenbedingungen des elektronischen Rechtsverkehrs und über das besondere elektronische Behördenpostfach (BGBl. I, S.3803) eingereicht werden. Weitere Informationen erhalten Sie auf der Internetseite www.justiz.de. Der Widerspruch muss spätestens innerhalb der gesetzten Frist nach der schriftlichen Bekanntgabe der Verfügung bei dem Amtsgericht - Registergericht - Neuss eingegangen sein. Dies gilt auch dann, wenn der Widerspruch zur Niederschrift der Geschäftsstelle eines anderen Amtsgerichtes abgegeben wurde. Die Frist beginnt mit der schriftlichen Bekanntgabe der Verfügung. Die Bekanntgabe ist entweder durch Zustellung oder am dritten Tage nach Aufgabe zur Post bewirkt. Fällt das Ende der Frist auf einen Sonntag, einen allgemeinen Feiertag oder Sonnabend, so endet die Frist mit Ablauf des nächsten Werktages. Der Widerspruch muss die Bezeichnung der angefochtenen Verfügung sowie die Erklärung enthalten, dass Widerspruch gegen diese Verfügung eingelegt wird. Er ist zu unterzeichnen und soll begründet werden."
    },
    {
      "date": "2025-11-21",
      "id": "138050",
      "original_text": "Löschungsankündigung\nHessen Amtsgericht Offenbach am Main HRB 44691\nMassivbau Rödermark GmbH – Rödermark",
      "type": "Löschungsankündigung",
      "state": "Hessen",
      "amtsgericht": "Amtsgericht Offenbach am Main",
      "registernummer": "HRB 44691",
      "registerart": "HRB",
      "company_name": "Massivbau Rödermark GmbH",
      "company_seat": "Rödermark",
      "details": "21.11.2025 (Bekanntmachungsdatum)\n\nHessen Amtsgericht Offenbach am Main HRB 44691\nLöschungsankündigung\n\nMassivbau Rödermark GmbH\nGesellschaft mit beschränkter Haftung\nRödermark\n\nDas Registergericht beabsichtigt die im Handelsregister eingetragene Gesellschaft von Amts wegen nach § 394 FamFG zu löschen. Die Frist zur Erhebung eines Widerspruchs gegen die beabsichtigte Löschung wird auf 3 Monate festgesetzt."
    },
    {
      "date": "2025-11-21",
      "id": "138051",
      "original_text": "Löschungsankündigung\nHessen Amtsgericht Offenbach am Main HRB 52771\nELCA Dienstleistungs GmbH – Langen (Hessen)",
      "type": "Löschungsankündigung",
      "state": "Hessen",
      "amtsgericht": "Amtsgericht Offenbach am Main",
      "registernummer": "HRB 52771",
      "registerart": "HRB",
      "company_name": "ELCA Dienstleistungs GmbH",
      "company_seat": "Langen (Hessen)",
      "details": "21.11.2025 (Bekanntmachungsdatum)\n\nHessen Amtsgericht Offenbach am Main HRB 52771\nLöschungsankündigung\n\nELCA Dienstleistungs GmbH\nGesellschaft mit beschränkter Haftung\nLangen (Hessen)\n\nDas Registergericht beabsichtigt die im Handelsregister eingetragene Gesellschaft von Amts wegen nach § 394 FamFG zu löschen. Die Frist zur Erhebung eines Widerspruchs gegen die beabsichtigte Löschung wird auf 3 Monate festgesetzt."
    },
    {
      "date": "2025-11-21",
      "id": "138052",
      "original_text": "Löschungsankündigung\nHessen Amtsgericht Frankfurt am Main HRB 111570\nTungsram Germany GmbH – Frankfurt am Main",
      "type": "Löschungsankündigung",
      "state": "Hessen",
      "amtsgericht": "Amtsgericht Frankfurt am Main",
      "registernummer": "HRB 111570",
      "registerart": "HRB",
      "company_name": "Tungsram Germany GmbH",
      "company_seat": "Frankfurt am Main",
      "details": "21.11.2025 (Bekanntmachungsdatum)\n\nHessen Amtsgericht Frankfurt am Main HRB 111570\nLöschungsankündigung 21.11.2025 (Eintragungsdatum)\n\nTungsram Germany GmbH\nGesellschaft mit beschränkter Haftung\nFrankfurt am Main\n\nEs ist beabsichtigt, die Gesellschaft wegen Vermögenslosigkeit gemäß § 394 FamFG von Amts wegen im Handelsregister zu löschen.\nHiergegen kann innerhalb eines Zeitraums von 1 Monat nach Zustellung dieser Verfügung Widerspruch bei dem Amtsgericht Frankfurt am Main eingelegt werden."
    },
    {
      "date": "2025-11-21",
      "id": "138053",
      "original_text": "Registerbekanntmachung nach dem Umwandlungsgesetz\nHessen Amtsgericht Frankfurt am Main HRB 140861\nAlavi Vertriebs GmbH – Frankfurt am Main",
      "type": "Registerbekanntmachung nach dem Umwandlungsgesetz",
      "state": "Hessen",
      "amtsgericht": "Amtsgericht Frankfurt am Main",
      "registernummer": "HRB 140861",
      "registerart": "HRB",
      "company_name": "Alavi Vertriebs GmbH",
      "company_seat": "Frankfurt am Main",
      "details": "21.11.2025 (Bekanntmachungsdatum)\n\nHessen Amtsgericht Frankfurt am Main HRB 140861\nRegisterbekanntmachung nach dem Umwandlungsgesetz 21.11.2025 (Eintragungsdatum)\n\nAlavi Vertriebs GmbH\nGesellschaft mit beschränkter Haftung\nFrankfurt am Main\n\nDen Gläubigern der an der Ausgliederung beteiligten Rechtsträger ist, wenn sie binnen sechs Monaten nach dem Tag, an dem die Eintragung der Ausgliederung in das Register des Sitzes desjenigen Rechtsträgers, dessen Gläubiger sie sind, nach §§ 125, 19 Absatz 3 UmwG bekannt gemacht worden ist, ihren Anspruch nach Grund und Höhe schriftlich anmelden, Sicherheit zu leisten, soweit sie nicht Befriedigung verlangen können. Dieses Recht steht den Gläubigern jedoch nur zu, wenn sie glaubhaft machen, dass durch die Ausgliederung die Erfüllung ihrer Forderung gefährdet wird."
    },
    {
      "date": "2025-11-21",
      "id": "138054",
      "original_text": "Einreichung neuer Dokumente\nHessen Amtsgericht Frankfurt am Main HRB 107843\nHRK LUNIS AG – Frankfurt am Main",
      "type": "Einreichung neuer Dokumente",
      "state": "Hessen",
      "amtsgericht": "Amtsgericht Frankfurt am Main",
      "registernummer": "HRB 107843",
      "registerart": "HRB",
      "company_name": "HRK LUNIS AG",
      "company_seat": "Frankfurt am Main",
      "details": "21.11.2025 (Bekanntmachungsdatum)\n\nHessen Amtsgericht Frankfurt am Main HRB 107843\nEinreichung neuer Dokumente\n\nHRK LUNIS AG\nAktiengesellschaft\nFrankfurt am Main\n\nDurch eine Änderung in den Personen der Aufsichtsratsmitglieder ist eine Liste der Mitglieder des Aufsichtsrates zum Handelsregister eingereicht worden."
    },
    {
      "date": "2025-11-21",
      "id": "138055",
      "original_text": "Löschungsankündigung\nHessen Amtsgericht Offenbach am Main HRB 54957\nC & C FLACHDACH- und BAUWERKSABDICHTUNG GmbH – Neu-Isenburg",
      "type": "Löschungsankündigung",
      "state": "Hessen",
      "amtsgericht": "Amtsgericht Offenbach am Main",
      "registernummer": "HRB 54957",
      "registerart": "HRB",
      "company_name": "C & C FLACHDACH- und BAUWERKSABDICHTUNG GmbH",
      "company_seat": "Neu-Isenburg",
      "details": "21.11.2025 (Bekanntmachungsdatum)\n\nHessen Amtsgericht Offenbach am Main HRB 54957\nLöschungsankündigung\n\nC & C FLACHDACH- und BAUWERKSABDICHTUNG GmbH\nGesellschaft mit beschränkter Haftung\nNeu-Isenburg\n\nDas Registergericht beabsichtigt die im Handelsregister eingetragene Gesellschaft von Amts wegen nach § 394 FamFG zu löschen. Die Frist zur Erhebung eines Widerspruchs gegen die beabsichtigte Löschung wird auf 3 Monate festgesetzt."
    },
    {
      "date": "2025-11-21",
      "id": "138056",
      "original_text": "Einreichung neuer Dokumente\nHessen Amtsgericht Königstein HRB 6593\nProcter & Gamble Service GmbH – Schwalbach am Taunus",
      "type": "Einreichung neuer Dokumente",
      "state": "Hessen",
      "amtsgericht": "Amtsgericht Königstein",
      "registernummer": "HRB 6593",
      "registerart": "HRB",
      "company_name": "Procter & Gamble Service GmbH",
      "company_seat": "Schwalbach am Taunus",
      "details": "21.11.2025 (Bekanntmachungsdatum)\n\nHessen Amtsgericht Königstein HRB 6593\nEinreichung neuer Dokumente\n\nProcter & Gamble Service GmbH\nGesellschaft mit beschränkter Haftung\nSchwalbach am Taunus\n\nDurch eine Änderung in den Personen der Aufsichtsratsmitglieder ist eine Liste der Mitglieder des Aufsichtsrates zum Handelsregister eingereicht worden."
    },
    {
      "date": "2025-11-21",
      "id": "138057",
      "original_text": "Einreichung neuer Dokumente\nHessen Amtsgericht Frankfurt am Main HRB 72513\nBIOCEUTICALS Arzneimittel Aktiengesellschaft – Bad Vilbel",
      "type": "Einreichung neuer Dokumente",
      "state": "Hessen",
      "amtsgericht": "Amtsgericht Frankfurt am Main",
      "registernummer": "HRB 72513",
      "registerart": "HRB",
      "company_name": "BIOCEUTICALS Arzneimittel Aktiengesellschaft",
      "company_seat": "Bad Vilbel",
      "details": "21.11.2025 (Bekanntmachungsdatum)\n\nHessen Amtsgericht Frankfurt am Main HRB 72513\nEinreichung neuer Dokumente 21.11.2025 (Eintragungsdatum)\n\nBIOCEUTICALS Arzneimittel Aktiengesellschaft\nAktiengesellschaft\nBad Vilbel\n\nDurch eine Änderung in den Personen der Aufsichtsratsmitglieder ist eine Liste der Mitglieder des Aufsichtsrates zum Handelsregister eingereicht worden."
    },
    {
      "date": "2025-11-21",
      "id": "138058",
      "original_text": "Registerbekanntmachung nach dem Umwandlungsgesetz\nHessen Amtsgericht Wetzlar HRB 9517\nEFT Energy Asset Management GmbH – Wetzlar",
      "type": "Registerbekanntmachung nach dem Umwandlungsgesetz",
      "state": "Hessen",
      "amtsgericht": "Amtsgericht Wetzlar",
      "registernummer": "HRB 9517",
      "registerart": "HRB",
      "company_name": "EFT Energy Asset Management GmbH",
      "company_seat": "Wetzlar",
      "details": "21.11.2025 (Bekanntmachungsdatum)\n\nHessen Amtsgericht Wetzlar HRB 9517\nRegisterbekanntmachung nach dem Umwandlungsgesetz 21.11.2025 (Eintragungsdatum)\n\nEFT Energy Asset Management GmbH\nGesellschaft mit beschränkter Haftung\nWetzlar\n\nDen Gläubigern der an der Abspaltung beteiligten Rechtsträger ist, wenn sie binnen sechs Monaten nach dem Tag, an dem die Eintragung der Abspaltung in das Register des Sitzes desjenigen Rechtsträgers, dessen Gläubiger sie sind, nach §§ 125, 19 Absatz 3 UmwG bekannt gemacht worden ist, ihren Anspruch nach Grund und Höhe schriftlich anmelden, Sicherheit zu leisten, soweit sie nicht Befriedigung verlangen können. Dieses Recht steht den Gläubigern jedoch nur zu, wenn sie glaubhaft machen, dass durch die Abspaltung die Erfüllung ihrer Forderung gefährdet wird."
    },
    {
      "date": "2025-11-21",
      "id": "138059",
      "original_text": "Löschungsankündigung\nHessen Amtsgericht Offenbach am Main HRB 52851\nSTANFIELD food GmbH – Dietzenbach",
      "type": "Löschungsankündigung",
      "state": "Hessen",
      "amtsgericht": "Amtsgericht Offenbach am Main",
      "registernummer": "HRB 52851",
      "registerart": "HRB",
      "company_name": "STANFIELD food GmbH",
      "company_seat": "Dietzenbach",
      "details": "21.11.2025 (Bekanntmachungsdatum)\n\nHessen Amtsgericht Offenbach am Main HRB 52851\nLöschungsankündigung\n\nSTANFIELD food GmbH\nGesellschaft mit beschränkter Haftung\nDietzenbach\n\nDas Registergericht beabsichtigt die im Handelsregister eingetragene Gesellschaft von Amts wegen nach § 394 FamFG zu löschen. Die Frist zur Erhebung eines Widerspruchs gegen die beabsichtigte Löschung wird auf 3 Monate festgesetzt."
    },
    {
      "date": "2025-11-21",
      "id": "138060",
      "original_text": "Einreichung neuer Dokumente\nHessen Amtsgericht Königstein HRB 5465\nProcter & Gamble Manufacturing GmbH – Schwalbach am Taunus",
      "type": "Einreichung neuer Dokumente",
      "state": "Hessen",
      "amtsgericht": "Amtsgericht Königstein",
      "registernummer": "HRB 5465",
      "registerart": "HRB",
      "company_name": "Procter & Gamble Manufacturing GmbH",
      "company_seat": "Schwalbach am Taunus",
      "details": "21.11.2025 (Bekanntmachungsdatum)\n\nHessen Amtsgericht Königstein HRB 5465\nEinreichung neuer Dokumente\n\nProcter & Gamble Manufacturing GmbH\nGesellschaft mit beschränkter Haftung\nSchwalbach am Taunus\n\nDurch eine Änderung in den Personen der Aufsichtsratsmitglieder ist eine Liste der Mitglieder des Aufsichtsrates zum Handelsregister eingereicht worden."
    },
    {
      "date": "2025-11-21",
      "id": "138061",
      "original_text": "Löschungsankündigung\nHessen Amtsgericht Frankfurt am Main HRB 98271\nSmall Generation GmbH – Frankfurt am Main",
      "type": "Löschungsankündigung",
      "state": "Hessen",
      "amtsgericht": "Amtsgericht Frankfurt am Main",
      "registernummer": "HRB 98271",
      "registerart": "HRB",
      "company_name": "Small Generation GmbH",
      "company_seat": "Frankfurt am Main",
      "details": "21.11.2025 (Bekanntmachungsdatum)\n\nHessen Amtsgericht Frankfurt am Main HRB 98271\nLöschungsankündigung 21.11.2025 (Eintragungsdatum)\n\nSmall Generation GmbH\nGesellschaft mit beschränkter Haftung\nFrankfurt am Main\n\nes ist beabsichtigt, die Gesellschaft wegen Vermögenslosigkeit gemäß § 394 FamFG von Amts wegen im Handelsregister zu löschen.\nHiergegen kann innerhalb eines Zeitraums von 1 Monat nach Zustellung dieser Verfügung Widerspruch bei dem Amtsgericht Frankfurt am Main eingelegt werden."
    },
    {
      "date": "2025-11-21",
      "id": "138062",
      "original_text": "Löschungsankündigung\nHessen Amtsgericht Frankfurt am Main HRB 109217\nRK Legal Rechtsanwaltsgesellschaft mbH – Frankfurt am Main",
      "type": "Löschungsankündigung",
      "state": "Hessen",
      "amtsgericht": "Amtsgericht Frankfurt am Main",
      "registernummer": "HRB 109217",
      "registerart": "HRB",
      "company_name": "RK Legal Rechtsanwaltsgesellschaft mbH",
      "company_seat": "Frankfurt am Main",
      "details": "21.11.2025 (Bekanntmachungsdatum)\n\nHessen Amtsgericht Frankfurt am Main HRB 109217\nLöschungsankündigung\n\nRK Legal Rechtsanwaltsgesellschaft mbH\nGesellschaft mit beschränkter Haftung\nFrankfurt am Main\n\nDas Registergericht beabsichtigt die im Handelsregister eingetragene Gesellschaft von Amts wegen nach § 394 FamFG zu löschen. Die Frist zur Erhebung eines Widerspruchs gegen die beabsichtigte Löschung wird auf 1 Monate festgesetzt."
    },
    {
      "date": "2025-11-21",
      "id": "138063",
      "original_text": "Löschungsankündigung\nHessen Amtsgericht Frankfurt am Main HRB 112183\nAsia Fine Food GmbH – Frankfurt am Main",
      "type": "Löschungsankündigung",
      "state": "Hessen",
      "amtsgericht": "Amtsgericht Frankfurt am Main",
      "registernummer": "HRB 112183",
      "registerart": "HRB",
      "company_name": "Asia Fine Food GmbH",
      "company_seat": "Frankfurt am Main",
      "details": "21.11.2025 (Bekanntmachungsdatum)\n\nHessen Amtsgericht Frankfurt am Main HRB 112183\nLöschungsankündigung\n\nAsia Fine Food GmbH\nGesellschaft mit beschränkter Haftung\nFrankfurt am Main\n\nDas Registergericht beabsichtigt die im Handelsregister eingetragene Gesellschaft von Amts wegen nach § 394 FamFG zu löschen. Die Frist zur Erhebung eines Widerspruchs gegen die beabsichtigte Löschung wird auf 1 Monat festgesetzt."
    }
  ]
}