{
  "date": "2025-11-15",
  "date_of_scrape": "2025-11-16T04:09:28.316Z",
  "tool_version": "0.2.0",
  "number_of_announcements": 28,
  "announcements": [
    {
      "date": "2025-11-15",
      "id": "137414",
      "original_text": "Registerbekanntmachung nach dem Umwandlungsgesetz\nBayern Amtsgericht Nürnberg HRA 20267\nGeorg Ziegler GmbH & Co. KG – Nürnberg",
      "type": "Registerbekanntmachung nach dem Umwandlungsgesetz",
      "state": "Bayern",
      "amtsgericht": "Amtsgericht Nürnberg",
      "registernummer": "HRA 20267",
      "registerart": "HRA",
      "company_name": "Georg Ziegler GmbH & Co. KG",
      "company_seat": "Nürnberg",
      "details": "15.11.2025 (Bekanntmachungsdatum)\n\nBayern Amtsgericht Nürnberg HRA 20267\nRegisterbekanntmachung nach dem Umwandlungsgesetz 14.11.2025 (Eintragungsdatum)\n\nGeorg Ziegler GmbH & Co. KG\nKommanditgesellschaft\nNürnberg\n\nDen Gläubigern der an der Ausgliederung beteiligten Rechtsträger ist, wenn sie binnen sechs Monaten nach dem Tag, an dem die Eintragung der Ausgliederung in das Register des Sitzes desjenigen Rechtsträgers, dessen Gläubiger sie sind, nach §§ 125, 19 Abs. 3 UmwG als bekannt gemacht gilt, ihren Anspruch nach Grund und Höhe in Textform anmelden, Sicherheit zu leisten, soweit sie nicht Befriedigung verlangen können. Dieses Recht steht den Gläubigern jedoch nur zu, wenn sie glaubhaft machen, dass durch die Ausgliederung die Erfüllung ihrer Forderung gefährdet wird."
    },
    {
      "date": "2025-11-15",
      "id": "137415",
      "original_text": "Löschungsankündigung\nBayern Amtsgericht Kempten (Allgäu) HRB 15723\nreadyCon Verwaltungs- GmbH – Immenstadt i. Allgäu",
      "type": "Löschungsankündigung",
      "state": "Bayern",
      "amtsgericht": "Amtsgericht Kempten (Allgäu)",
      "registernummer": "HRB 15723",
      "registerart": "HRB",
      "company_name": "readyCon Verwaltungs- GmbH",
      "company_seat": "Immenstadt i. Allgäu",
      "details": "15.11.2025 (Bekanntmachungsdatum)\n\nBayern Amtsgericht Kempten (Allgäu) HRB 15723\nLöschungsankündigung\n\nreadyCon Verwaltungs- GmbH\nGesellschaft mit beschränkter Haftung\nImmenstadt i. Allgäu\n\nDas Registergericht beabsichtigt, die im Handelsregister eingetragene Gesellschaft wegen Vermögenslosigkeit von Amts wegen nach § 394 FamFG zu löschen. Die Frist zur Erhebung eines Widerspruchs ist auf einen Monat festgesetzt."
    },
    {
      "date": "2025-11-15",
      "id": "137416",
      "original_text": "Registerbekanntmachung nach dem Umwandlungsgesetz\nBayern Amtsgericht Bamberg HRA 13329\nKlaus Eisfelder e.K. – Pfarrweisach",
      "type": "Registerbekanntmachung nach dem Umwandlungsgesetz",
      "state": "Bayern",
      "amtsgericht": "Amtsgericht Bamberg",
      "registernummer": "HRA 13329",
      "registerart": "HRA",
      "company_name": "Klaus Eisfelder e.K.",
      "company_seat": "Pfarrweisach",
      "details": "15.11.2025 (Bekanntmachungsdatum)\n\nBayern Amtsgericht Bamberg HRA 13329\nRegisterbekanntmachung nach dem Umwandlungsgesetz 14.11.2025 (Eintragungsdatum)\n\nKlaus Eisfelder e.K.\nEinzelkaufmann / Einzelkauffrau\nPfarrweisach\n\nDen Gläubigern der an der Ausgliederung beteiligten Rechtsträger ist, wenn sie binnen sechs Monaten nach dem Tag, an dem die Eintragung der Ausgliederung in das Register des Sitzes desjenigen Rechtsträgers, dessen Gläubiger sie sind, nach §§ 125, 19 Abs. 3 UmwG als bekannt gemacht gilt, ihren Anspruch nach Grund und Höhe in Textform anmelden, Sicherheit zu leisten, soweit sie nicht Befriedigung verlangen können. Dieses Recht steht den Gläubigern jedoch nur zu, wenn sie glaubhaft machen, dass durch die Ausgliederung die Erfüllung ihrer Forderung gefährdet wird."
    },
    {
      "date": "2025-11-15",
      "id": "137417",
      "original_text": "Löschungsankündigung\nBayern Amtsgericht München HRB 254632\nVist Transport GmbH – München",
      "type": "Löschungsankündigung",
      "state": "Bayern",
      "amtsgericht": "Amtsgericht München",
      "registernummer": "HRB 254632",
      "registerart": "HRB",
      "company_name": "Vist Transport GmbH",
      "company_seat": "München",
      "details": "15.11.2025 (Bekanntmachungsdatum)\n\nBayern Amtsgericht München HRB 254632\nLöschungsankündigung 14.11.2025 (Eintragungsdatum)\n\nVist Transport GmbH\nGesellschaft mit beschränkter Haftung\nMünchen\n\nDas Registergericht beabsichtigt, die im Handelsregister eingetragene Gesellschaft wegen Vermögenslosigkeit von Amts wegen nach § 394 FamFG zu löschen. Die Frist zur Erhebung eines Widerspruchs ist auf drei Monate festgesetzt."
    },
    {
      "date": "2025-11-15",
      "id": "137418",
      "original_text": "Registerbekanntmachung nach dem Umwandlungsgesetz\nBayern Amtsgericht München HRB 300748\nLeica Geosystems Technologies GmbH – Garching b. München",
      "type": "Registerbekanntmachung nach dem Umwandlungsgesetz",
      "state": "Bayern",
      "amtsgericht": "Amtsgericht München",
      "registernummer": "HRB 300748",
      "registerart": "HRB",
      "company_name": "Leica Geosystems Technologies GmbH",
      "company_seat": "Garching b. München",
      "details": "15.11.2025 (Bekanntmachungsdatum)\n\nBayern Amtsgericht München HRB 300748\nRegisterbekanntmachung nach dem Umwandlungsgesetz 14.11.2025 (Eintragungsdatum)\n\nLeica Geosystems Technologies GmbH\nGesellschaft mit beschränkter Haftung\nGarching b. München\n\nDen Gläubigern der an der Verschmelzung beteiligten Rechtsträger ist, wenn sie binnen sechs Monaten nach dem Tag, an dem die Eintragung der Verschmelzung in das Register des Sitzes desjenigen Rechtsträgers, dessen Gläubiger sie sind, nach § 19 Abs. 3 UmwG als bekannt gemacht gilt, ihren Anspruch nach Grund und Höhe in Textform anmelden, Sicherheit zu leisten, soweit sie nicht Befriedigung verlangen können. Dieses Recht steht den Gläubigern jedoch nur zu, wenn sie glaubhaft machen, dass durch die Verschmelzung die Erfüllung ihrer Forderung gefährdet wird."
    },
    {
      "date": "2025-11-15",
      "id": "137419",
      "original_text": "Löschungsankündigung\nBayern Amtsgericht Nürnberg HRB 16254\ni-center Beteiligungen Aktiengesellschaft – Nürnberg",
      "type": "Löschungsankündigung",
      "state": "Bayern",
      "amtsgericht": "Amtsgericht Nürnberg",
      "registernummer": "HRB 16254",
      "registerart": "HRB",
      "company_name": "i-center Beteiligungen Aktiengesellschaft",
      "company_seat": "Nürnberg",
      "details": "15.11.2025 (Bekanntmachungsdatum)\n\nBayern Amtsgericht Nürnberg HRB 16254\nLöschungsankündigung\n\ni-center Beteiligungen Aktiengesellschaft\nAktiengesellschaft\nNürnberg\n\nDas Registergericht beabsichtigt, die im Handelsregister eingetragene Gesellschaft wegen Vermögenslosigkeit von Amts wegen nach § 394 FamFG zu löschen. Die Frist zur Erhebung eines Widerspruchs ist auf einen Monat festgesetzt."
    },
    {
      "date": "2025-11-15",
      "id": "137420",
      "original_text": "Löschungsankündigung\nBayern Amtsgericht Nürnberg HRB 42075\nJones Transport GmbH – Schwabach",
      "type": "Löschungsankündigung",
      "state": "Bayern",
      "amtsgericht": "Amtsgericht Nürnberg",
      "registernummer": "HRB 42075",
      "registerart": "HRB",
      "company_name": "Jones Transport GmbH",
      "company_seat": "Schwabach",
      "details": "15.11.2025 (Bekanntmachungsdatum)\n\nBayern Amtsgericht Nürnberg HRB 42075\nLöschungsankündigung 14.11.2025 (Eintragungsdatum)\n\nJones Transport GmbH\nGesellschaft mit beschränkter Haftung\nSchwabach\n\nDas Registergericht beabsichtigt, die im Handelsregister eingetragene Gesellschaft wegen Vermögenslosigkeit von Amts wegen nach § 394 FamFG zu löschen. Die Frist zur Erhebung eines Widerspruchs ist auf einen Monat festgesetzt."
    },
    {
      "date": "2025-11-15",
      "id": "137421",
      "original_text": "Löschungsankündigung\nBayern Amtsgericht Kempten (Allgäu) HRB 16723\nSuccess Immobilien & Baumanagement GmbH – Blaichach",
      "type": "Löschungsankündigung",
      "state": "Bayern",
      "amtsgericht": "Amtsgericht Kempten (Allgäu)",
      "registernummer": "HRB 16723",
      "registerart": "HRB",
      "company_name": "Success Immobilien & Baumanagement GmbH",
      "company_seat": "Blaichach",
      "details": "15.11.2025 (Bekanntmachungsdatum)\n\nBayern Amtsgericht Kempten (Allgäu) HRB 16723\nLöschungsankündigung\n\nSuccess Immobilien & Baumanagement GmbH\nGesellschaft mit beschränkter Haftung\nBlaichach\n\nDas Registergericht beabsichtigt, die im Handelsregister eingetragene Gesellschaft wegen Vermögenslosigkeit von Amts wegen nach § 394 FamFG zu löschen. Die Frist zur Erhebung eines Widerspruchs ist auf einen Monat festgesetzt."
    },
    {
      "date": "2025-11-15",
      "id": "137422",
      "original_text": "Registerbekanntmachung nach dem Umwandlungsgesetz\nBayern Amtsgericht Nürnberg HRA 3676\nGeorg Ziegler Inh. Stefan Ziegler e.K. – Nürnberg",
      "type": "Registerbekanntmachung nach dem Umwandlungsgesetz",
      "state": "Bayern",
      "amtsgericht": "Amtsgericht Nürnberg",
      "registernummer": "HRA 3676",
      "registerart": "HRA",
      "company_name": "Georg Ziegler Inh. Stefan Ziegler e.K.",
      "company_seat": "Nürnberg",
      "details": "15.11.2025 (Bekanntmachungsdatum)\n\nBayern Amtsgericht Nürnberg HRA 3676\nRegisterbekanntmachung nach dem Umwandlungsgesetz 14.11.2025 (Eintragungsdatum)\n\nGeorg Ziegler Inh. Stefan Ziegler e.K.\nEinzelkaufmann / Einzelkauffrau\nNürnberg\n\nDen Gläubigern der an der Ausgliederung beteiligten Rechtsträger ist, wenn sie binnen sechs Monaten nach dem Tag, an dem die Eintragung der Ausgliederung in das Register des Sitzes desjenigen Rechtsträgers, dessen Gläubiger sie sind, nach §§ 125, 19 Abs. 3 UmwG als bekannt gemacht gilt, ihren Anspruch nach Grund und Höhe in Textform anmelden, Sicherheit zu leisten, soweit sie nicht Befriedigung verlangen können. Dieses Recht steht den Gläubigern jedoch nur zu, wenn sie glaubhaft machen, dass durch die Ausgliederung die Erfüllung ihrer Forderung gefährdet wird."
    },
    {
      "date": "2025-11-15",
      "id": "137423",
      "original_text": "Registerbekanntmachung nach dem Umwandlungsgesetz\nBayern Amtsgericht Fürth HRB 22219\nEiscafe Sicilia GmbH – Langenzenn",
      "type": "Registerbekanntmachung nach dem Umwandlungsgesetz",
      "state": "Bayern",
      "amtsgericht": "Amtsgericht Fürth",
      "registernummer": "HRB 22219",
      "registerart": "HRB",
      "company_name": "Eiscafe Sicilia GmbH",
      "company_seat": "Langenzenn",
      "details": "15.11.2025 (Bekanntmachungsdatum)\n\nBayern Amtsgericht Fürth HRB 22219\nRegisterbekanntmachung nach dem Umwandlungsgesetz 14.11.2025 (Eintragungsdatum)\n\nEiscafe Sicilia GmbH\nGesellschaft mit beschränkter Haftung\nLangenzenn\n\nDen Gläubigern der an der Ausgliederung beteiligten Rechtsträger ist, wenn sie binnen sechs Monaten nach dem Tag, an dem die Eintragung der Ausgliederung in das Register des Sitzes desjenigen Rechtsträgers, dessen Gläubiger sie sind, nach §§ 125, 19 Abs. 3 UmwG als bekannt gemacht gilt, ihren Anspruch nach Grund und Höhe in Textform anmelden, Sicherheit zu leisten, soweit sie nicht Befriedigung verlangen können. Dieses Recht steht den Gläubigern jedoch nur zu, wenn sie glaubhaft machen, dass durch die Ausgliederung die Erfüllung ihrer Forderung gefährdet wird."
    },
    {
      "date": "2025-11-15",
      "id": "137424",
      "original_text": "Löschungsankündigung\nBayern Amtsgericht Passau HRB 12286\nSzabo Trans mit Kraftfahrzeugen Handels UG (haftungsbeschränkt) – Pocking",
      "type": "Löschungsankündigung",
      "state": "Bayern",
      "amtsgericht": "Amtsgericht Passau",
      "registernummer": "HRB 12286",
      "registerart": "HRB",
      "company_name": "Szabo Trans mit Kraftfahrzeugen Handels UG (haftungsbeschränkt)",
      "company_seat": "Pocking",
      "details": "15.11.2025 (Bekanntmachungsdatum)\n\nBayern Amtsgericht Passau HRB 12286\nLöschungsankündigung\n\nSzabo Trans mit Kraftfahrzeugen Handels UG (haftungsbeschränkt)\nGesellschaft mit beschränkter Haftung\nPocking\n\nDas Registergericht beabsichtigt, die im Handelsregister eingetragene Gesellschaft wegen Vermögenslosigkeit von Amts wegen nach § 394 FamFG zu löschen. Die Frist zur Erhebung eines Widerspruchs ist auf einen Monat festgesetzt."
    },
    {
      "date": "2025-11-15",
      "id": "137425",
      "original_text": "Löschungsankündigung\nBayern Amtsgericht Ansbach HRB 5127\nvpool Immobilien Beteiligungs GmbH – Wörnitz",
      "type": "Löschungsankündigung",
      "state": "Bayern",
      "amtsgericht": "Amtsgericht Ansbach",
      "registernummer": "HRB 5127",
      "registerart": "HRB",
      "company_name": "vpool Immobilien Beteiligungs GmbH",
      "company_seat": "Wörnitz",
      "details": "15.11.2025 (Bekanntmachungsdatum)\n\nBayern Amtsgericht Ansbach HRB 5127\nLöschungsankündigung\n\nvpool Immobilien Beteiligungs GmbH\nGesellschaft mit beschränkter Haftung\nWörnitz\n\nDas Registergericht beabsichtigt, die im Handelsregister eingetragene Gesellschaft wegen Vermögenslosigkeit von Amts wegen nach § 394 FamFG zu löschen. Die Frist zur Erhebung eines Widerspruchs ist auf sechs Wochen festgesetzt."
    },
    {
      "date": "2025-11-15",
      "id": "137426",
      "original_text": "Löschungsankündigung\nBayern Amtsgericht Bayreuth VR 10323\nMeyerbeer-Institut e. V. – Thurnau",
      "type": "Löschungsankündigung",
      "state": "Bayern",
      "amtsgericht": "Amtsgericht Bayreuth",
      "registernummer": "VR 10323",
      "registerart": "VR",
      "company_name": "Meyerbeer-Institut e. V.",
      "company_seat": "Thurnau",
      "details": "15.11.2025 (Bekanntmachungsdatum)\n\nBayern Amtsgericht Bayreuth VR 10323\nLöschungsankündigung\n\nMeyerbeer-Institut e. V.\neingetragener Verein\nThurnau\n\nDas Registergericht beabsichtigt, den im Vereinsregister eingetragenen Verein von Amts wegen nach § 395 FamFG zu löschen. Die Frist zur Erhebung eines Widerspruchs ist auf einen Monat festgesetzt."
    },
    {
      "date": "2025-11-15",
      "id": "137427",
      "original_text": "Einreichung neuer Dokumente\nBayern Amtsgericht Traunstein HRB 31384\nMarc O'Polo SE – Stephanskirchen",
      "type": "Einreichung neuer Dokumente",
      "state": "Bayern",
      "amtsgericht": "Amtsgericht Traunstein",
      "registernummer": "HRB 31384",
      "registerart": "HRB",
      "company_name": "Marc O'Polo SE",
      "company_seat": "Stephanskirchen",
      "details": "15.11.2025 (Bekanntmachungsdatum)\n\nBayern Amtsgericht Traunstein HRB 31384\nEinreichung neuer Dokumente\n\nMarc O'Polo SE\nEuropäische Aktiengesellschaft (SE)\nStephanskirchen\n\nDem Amtsgericht Traunstein -Registergericht- ist eine Liste der Mitglieder des Aufsichtsrats eingereicht worden, Art. 9 Abs. 1 Buchst. c (ii) SE-VO i.V.m. § 106 AktG."
    },
    {
      "date": "2025-11-15",
      "id": "137428",
      "original_text": "Registerbekanntmachung nach dem Umwandlungsgesetz\nBayern Amtsgericht Fürth HRA 12599\nEiscafe Sicilia e.K. – Langenzenn",
      "type": "Registerbekanntmachung nach dem Umwandlungsgesetz",
      "state": "Bayern",
      "amtsgericht": "Amtsgericht Fürth",
      "registernummer": "HRA 12599",
      "registerart": "HRA",
      "company_name": "Eiscafe Sicilia e.K.",
      "company_seat": "Langenzenn",
      "details": "15.11.2025 (Bekanntmachungsdatum)\n\nBayern Amtsgericht Fürth HRA 12599\nRegisterbekanntmachung nach dem Umwandlungsgesetz 14.11.2025 (Eintragungsdatum)\n\nEiscafe Sicilia e.K.\nEinzelkaufmann / Einzelkauffrau\nLangenzenn\n\nDen Gläubigern der an der Ausgliederung beteiligten Rechtsträger ist, wenn sie binnen sechs Monaten nach dem Tag, an dem die Eintragung der Ausgliederung in das Register des Sitzes desjenigen Rechtsträgers, dessen Gläubiger sie sind, nach §§ 125, 19 Abs. 3 UmwG als bekannt gemacht gilt, ihren Anspruch nach Grund und Höhe in Textform anmelden, Sicherheit zu leisten, soweit sie nicht Befriedigung verlangen können. Dieses Recht steht den Gläubigern jedoch nur zu, wenn sie glaubhaft machen, dass durch die Ausgliederung die Erfüllung ihrer Forderung gefährdet wird."
    },
    {
      "date": "2025-11-15",
      "id": "137429",
      "original_text": "Einreichung neuer Dokumente\nBayern Amtsgericht Coburg HRB 3261\nIBC Solar AG – Bad Staffelstein",
      "type": "Einreichung neuer Dokumente",
      "state": "Bayern",
      "amtsgericht": "Amtsgericht Coburg",
      "registernummer": "HRB 3261",
      "registerart": "HRB",
      "company_name": "IBC Solar AG",
      "company_seat": "Bad Staffelstein",
      "details": "15.11.2025 (Bekanntmachungsdatum)\n\nBayern Amtsgericht Coburg HRB 3261\nEinreichung neuer Dokumente 14.11.2025 (Eintragungsdatum)\n\nIBC Solar AG\nAktiengesellschaft\nBad Staffelstein\n\nDem Amtsgericht Coburg -Registergericht- ist eine Liste der Mitglieder des Aufsichtsrats eingereicht worden, § 106 AktG."
    },
    {
      "date": "2025-11-15",
      "id": "137430",
      "original_text": "Löschungsankündigung\nBayern Amtsgericht Nürnberg HRB 42274\nPAK Logistic UG (haftungsbeschränkt) – Nürnberg",
      "type": "Löschungsankündigung",
      "state": "Bayern",
      "amtsgericht": "Amtsgericht Nürnberg",
      "registernummer": "HRB 42274",
      "registerart": "HRB",
      "company_name": "PAK Logistic UG (haftungsbeschränkt)",
      "company_seat": "Nürnberg",
      "details": "15.11.2025 (Bekanntmachungsdatum)\n\nBayern Amtsgericht Nürnberg HRB 42274\nLöschungsankündigung 14.11.2025 (Eintragungsdatum)\n\nPAK Logistic UG (haftungsbeschränkt)\nGesellschaft mit beschränkter Haftung\nNürnberg\n\nDas Registergericht beabsichtigt, die im Handelsregister eingetragene Gesellschaft wegen Vermögenslosigkeit von Amts wegen nach § 394 FamFG zu löschen. Die Frist zur Erhebung eines Widerspruchs ist auf einen Monat festgesetzt."
    },
    {
      "date": "2025-11-15",
      "id": "137431",
      "original_text": "Löschungsankündigung\nBayern Amtsgericht München HRB 148807\nStefan Bader Transporte GmbH – Oberau",
      "type": "Löschungsankündigung",
      "state": "Bayern",
      "amtsgericht": "Amtsgericht München",
      "registernummer": "HRB 148807",
      "registerart": "HRB",
      "company_name": "Stefan Bader Transporte GmbH",
      "company_seat": "Oberau",
      "details": "15.11.2025 (Bekanntmachungsdatum)\n\nBayern Amtsgericht München HRB 148807\nLöschungsankündigung 14.11.2025 (Eintragungsdatum)\n\nStefan Bader Transporte GmbH\nGesellschaft mit beschränkter Haftung\nOberau\n\nDas Registergericht beabsichtigt, die im Handelsregister eingetragene Gesellschaft wegen Vermögenslosigkeit von Amts wegen nach § 394 FamFG zu löschen. Die Frist zur Erhebung eines Widerspruchs ist auf drei Monate festgesetzt."
    },
    {
      "date": "2025-11-15",
      "id": "137432",
      "original_text": "Registerbekanntmachung nach dem Umwandlungsgesetz\nBayern Amtsgericht München HRB 282603\nPNZ A23 Beteiligungs GmbH – München",
      "type": "Registerbekanntmachung nach dem Umwandlungsgesetz",
      "state": "Bayern",
      "amtsgericht": "Amtsgericht München",
      "registernummer": "HRB 282603",
      "registerart": "HRB",
      "company_name": "PNZ A23 Beteiligungs GmbH",
      "company_seat": "München",
      "details": "15.11.2025 (Bekanntmachungsdatum)\n\nBayern Amtsgericht München HRB 282603\nRegisterbekanntmachung nach dem Umwandlungsgesetz 14.11.2025 (Eintragungsdatum)\n\nPNZ A23 Beteiligungs GmbH\nGesellschaft mit beschränkter Haftung\nMünchen\n\nDen Gläubigern der an der Verschmelzung beteiligten Rechtsträger ist, wenn sie binnen sechs Monaten nach dem Tag, an dem die Eintragung der Verschmelzung in das Register des Sitzes desjenigen Rechtsträgers, dessen Gläubiger sie sind, nach § 19 Abs. 3 UmwG als bekannt gemacht gilt, ihren Anspruch nach Grund und Höhe in Textform anmelden, Sicherheit zu leisten, soweit sie nicht Befriedigung verlangen können. Dieses Recht steht den Gläubigern jedoch nur zu, wenn sie glaubhaft machen, dass durch die Verschmelzung die Erfüllung ihrer Forderung gefährdet wird."
    },
    {
      "date": "2025-11-15",
      "id": "137433",
      "original_text": "Registerbekanntmachung nach dem Umwandlungsgesetz\nBayern Amtsgericht Bamberg HRA 13324\nGasthof-Hotel-Metzgerei Eisfelder GmbH & Co. KG – Pfarrweisach",
      "type": "Registerbekanntmachung nach dem Umwandlungsgesetz",
      "state": "Bayern",
      "amtsgericht": "Amtsgericht Bamberg",
      "registernummer": "HRA 13324",
      "registerart": "HRA",
      "company_name": "Gasthof-Hotel-Metzgerei Eisfelder GmbH & Co. KG",
      "company_seat": "Pfarrweisach",
      "details": "15.11.2025 (Bekanntmachungsdatum)\n\nBayern Amtsgericht Bamberg HRA 13324\nRegisterbekanntmachung nach dem Umwandlungsgesetz 14.11.2025 (Eintragungsdatum)\n\nGasthof-Hotel-Metzgerei Eisfelder GmbH & Co. KG\nKommanditgesellschaft\nPfarrweisach\n\nDen Gläubigern der an der Ausgliederung beteiligten Rechtsträger ist, wenn sie binnen sechs Monaten nach dem Tag, an dem die Eintragung der Ausgliederung in das Register des Sitzes desjenigen Rechtsträgers, dessen Gläubiger sie sind, nach §§ 125, 19 Abs. 3 UmwG als bekannt gemacht gilt, ihren Anspruch nach Grund und Höhe in Textform anmelden, Sicherheit zu leisten, soweit sie nicht Befriedigung verlangen können. Dieses Recht steht den Gläubigern jedoch nur zu, wenn sie glaubhaft machen, dass durch die Ausgliederung die Erfüllung ihrer Forderung gefährdet wird."
    },
    {
      "date": "2025-11-15",
      "id": "137434",
      "original_text": "Einreichung neuer Dokumente\nBayern Amtsgericht München HRB 201055\nTelefónica Deutschland Holding AG – München",
      "type": "Einreichung neuer Dokumente",
      "state": "Bayern",
      "amtsgericht": "Amtsgericht München",
      "registernummer": "HRB 201055",
      "registerart": "HRB",
      "company_name": "Telefónica Deutschland Holding AG",
      "company_seat": "München",
      "details": "15.11.2025 (Bekanntmachungsdatum)\n\nBayern Amtsgericht München HRB 201055\nEinreichung neuer Dokumente\n\nTelefónica Deutschland Holding AG\nAktiengesellschaft\nMünchen\n\nDem Amtsgericht München -Registergericht- ist eine Liste der Mitglieder des Aufsichtsrats eingereicht worden, § 106 AktG."
    },
    {
      "date": "2025-11-15",
      "id": "137435",
      "original_text": "Registerbekanntmachung nach dem Umwandlungsgesetz\nBayern Amtsgericht Nürnberg HRB 12282\nHenck-Immobilien GmbH – Feucht",
      "type": "Registerbekanntmachung nach dem Umwandlungsgesetz",
      "state": "Bayern",
      "amtsgericht": "Amtsgericht Nürnberg",
      "registernummer": "HRB 12282",
      "registerart": "HRB",
      "company_name": "Henck-Immobilien GmbH",
      "company_seat": "Feucht",
      "details": "15.11.2025 (Bekanntmachungsdatum)\n\nBayern Amtsgericht Nürnberg HRB 12282\nRegisterbekanntmachung nach dem Umwandlungsgesetz 14.11.2025 (Eintragungsdatum)\n\nHenck-Immobilien GmbH\nGesellschaft mit beschränkter Haftung\nFeucht\n\nDen Gläubigern der an der Verschmelzung beteiligten Rechtsträger ist, wenn sie binnen sechs Monaten nach dem Tag, an dem die Eintragung der Verschmelzung in das Register des Sitzes desjenigen Rechtsträgers, dessen Gläubiger sie sind, nach § 19 Abs. 3 UmwG als bekannt gemacht gilt, ihren Anspruch nach Grund und Höhe in Textform anmelden, Sicherheit zu leisten, soweit sie nicht Befriedigung verlangen können. Dieses Recht steht den Gläubigern jedoch nur zu, wenn sie glaubhaft machen, dass durch die Verschmelzung die Erfüllung ihrer Forderung gefährdet wird."
    },
    {
      "date": "2025-11-15",
      "id": "137436",
      "original_text": "Löschungsankündigung\nBayern Amtsgericht Fürth GnR 178\nLandwirtschaftliche Trocknungsgenossenschaft Neuhof a.d. Zenn und Umgebung eG – Neuhof a.d.Zenn",
      "type": "Löschungsankündigung",
      "state": "Bayern",
      "amtsgericht": "Amtsgericht Fürth",
      "registernummer": "GnR 178",
      "registerart": "GnR",
      "company_name": "Landwirtschaftliche Trocknungsgenossenschaft Neuhof a.d. Zenn und Umgebung eG",
      "company_seat": "Neuhof a.d.Zenn",
      "details": "15.11.2025 (Bekanntmachungsdatum)\n\nBayern Amtsgericht Fürth GnR 178\nLöschungsankündigung\n\nLandwirtschaftliche Trocknungsgenossenschaft Neuhof a.d. Zenn und Umgebung eG\neingetragene Genossenschaft\nNeuhof a.d.Zenn\n\nDas Registergericht beabsichtigt, die im Genossenschaftsregister eingetragene Genossenschaft wegen Vermögenslosigkeit von Amts wegen nach § 394 Abs. 1 FamFG zu löschen. Die Frist zur Erhebung eines Widerspruchs ist auf einen Monat festgesetzt."
    },
    {
      "date": "2025-11-15",
      "id": "137437",
      "original_text": "Registerbekanntmachung nach dem Umwandlungsgesetz\nBayern Amtsgericht München HRA 121561\nGranit Qerkinaj Garten und Landschaftsbau e.K. – München",
      "type": "Registerbekanntmachung nach dem Umwandlungsgesetz",
      "state": "Bayern",
      "amtsgericht": "Amtsgericht München",
      "registernummer": "HRA 121561",
      "registerart": "HRA",
      "company_name": "Granit Qerkinaj Garten und Landschaftsbau e.K.",
      "company_seat": "München",
      "details": "15.11.2025 (Bekanntmachungsdatum)\n\nBayern Amtsgericht München HRA 121561\nRegisterbekanntmachung nach dem Umwandlungsgesetz 14.11.2025 (Eintragungsdatum)\n\nGranit Qerkinaj Garten und Landschaftsbau e.K.\nEinzelkaufmann / Einzelkauffrau\nMünchen\n\nDen Gläubigern der an der Ausgliederung beteiligten Rechtsträger ist, wenn sie binnen sechs Monaten nach dem Tag, an dem die Eintragung der Ausgliederung in das Register des Sitzes desjenigen Rechtsträgers, dessen Gläubiger sie sind, nach §§ 125, 19 Abs. 3 UmwG als bekannt gemacht gilt, ihren Anspruch nach Grund und Höhe in Textform anmelden, Sicherheit zu leisten, soweit sie nicht Befriedigung verlangen können. Dieses Recht steht den Gläubigern jedoch nur zu, wenn sie glaubhaft machen, dass durch die Ausgliederung die Erfüllung ihrer Forderung gefährdet wird."
    },
    {
      "date": "2025-11-15",
      "id": "137438",
      "original_text": "Registerbekanntmachung nach dem Umwandlungsgesetz\nBayern Amtsgericht Nürnberg HRB 7204\n\"Zeidler\"-Wohnbau Feucht GmbH – Feucht",
      "type": "Registerbekanntmachung nach dem Umwandlungsgesetz",
      "state": "Bayern",
      "amtsgericht": "Amtsgericht Nürnberg",
      "registernummer": "HRB 7204",
      "registerart": "HRB",
      "company_name": "\"Zeidler\"-Wohnbau Feucht GmbH",
      "company_seat": "Feucht",
      "details": "15.11.2025 (Bekanntmachungsdatum)\n\nBayern Amtsgericht Nürnberg HRB 7204\nRegisterbekanntmachung nach dem Umwandlungsgesetz 14.11.2025 (Eintragungsdatum)\n\n\"Zeidler\"-Wohnbau Feucht GmbH\nGesellschaft mit beschränkter Haftung\nFeucht\n\nDen Gläubigern der an der Verschmelzung beteiligten Rechtsträger ist, wenn sie binnen sechs Monaten nach dem Tag, an dem die Eintragung der Verschmelzung in das Register des Sitzes desjenigen Rechtsträgers, dessen Gläubiger sie sind, nach § 19 Abs. 3 UmwG als bekannt gemacht gilt, ihren Anspruch nach Grund und Höhe in Textform anmelden, Sicherheit zu leisten, soweit sie nicht Befriedigung verlangen können. Dieses Recht steht den Gläubigern jedoch nur zu, wenn sie glaubhaft machen, dass durch die Verschmelzung die Erfüllung ihrer Forderung gefährdet wird."
    },
    {
      "date": "2025-11-15",
      "id": "137439",
      "original_text": "Registerbekanntmachung nach dem Umwandlungsgesetz\nHamburg Amtsgericht Hamburg HRB 155092\n2nd Level Verwaltungs UG (haftungsbeschränkt) – Hamburg",
      "type": "Registerbekanntmachung nach dem Umwandlungsgesetz",
      "state": "Hamburg",
      "amtsgericht": "Amtsgericht Hamburg",
      "registernummer": "HRB 155092",
      "registerart": "HRB",
      "company_name": "2nd Level Verwaltungs UG (haftungsbeschränkt)",
      "company_seat": "Hamburg",
      "details": "15.11.2025 (Bekanntmachungsdatum)\n\nHamburg Amtsgericht Hamburg HRB 155092\nRegisterbekanntmachung nach dem Umwandlungsgesetz 15.11.2025 (Eintragungsdatum)\n\n2nd Level Verwaltungs UG (haftungsbeschränkt)\nGesellschaft mit beschränkter Haftung\nHamburg\n\nAls nicht eingetragen wird bekannt gemacht:\nDen Gläubigern der an der Verschmelzung beteiligten Gesellschaften ist, wenn sie binnen sechs Monaten nach dem Tag, an dem die Eintragung der Verschmelzung in das Register des Sitzes desjenigen Rechtsträgers, dessen Gläubiger sie sind, nach § 19 Absatz 3 UmwG als bekannt gemacht gilt, ihren Anspruch nach Grund und Höhe schriftlich anmelden, Sicherheit zu leisten, soweit sie nicht Befriedigung verlangen können. Dieses Recht steht den Gläubigern jedoch nur zu, wenn sie glaubhaft machen, dass durch die Verschmelzung die Erfüllung ihrer Forderung gefährdet wird."
    },
    {
      "date": "2025-11-15",
      "id": "137440",
      "original_text": "Registerbekanntmachung nach dem Umwandlungsgesetz\nHamburg Amtsgericht Hamburg HRB 163312\n2nd Level Holding GmbH – Hamburg",
      "type": "Registerbekanntmachung nach dem Umwandlungsgesetz",
      "state": "Hamburg",
      "amtsgericht": "Amtsgericht Hamburg",
      "registernummer": "HRB 163312",
      "registerart": "HRB",
      "company_name": "2nd Level Holding GmbH",
      "company_seat": "Hamburg",
      "details": "15.11.2025 (Bekanntmachungsdatum)\n\nHamburg Amtsgericht Hamburg HRB 163312\nRegisterbekanntmachung nach dem Umwandlungsgesetz 15.11.2025 (Eintragungsdatum)\n\n2nd Level Holding GmbH\nGesellschaft mit beschränkter Haftung\nHamburg\n\nAls nicht eingetragen wird bekannt gemacht:\nDen Gläubigern der an der Verschmelzung beteiligten Gesellschaften ist, wenn sie binnen sechs Monaten nach dem Tag, an dem die Eintragung der Verschmelzung in das Register des Sitzes desjenigen Rechtsträgers, dessen Gläubiger sie sind, nach § 19 Absatz 3 UmwG als bekannt gemacht gilt, ihren Anspruch nach Grund und Höhe schriftlich anmelden, Sicherheit zu leisten, soweit sie nicht Befriedigung verlangen können. Dieses Recht steht den Gläubigern jedoch nur zu, wenn sie glaubhaft machen, dass durch die Verschmelzung die Erfüllung ihrer Forderung gefährdet wird."
    },
    {
      "date": "2025-11-15",
      "id": "137441",
      "original_text": "Registerbekanntmachung nach dem Umwandlungsgesetz\nNordrhein-Westfalen Amtsgericht Coesfeld HRA 10288\nSicon Industrie- und Gewerbebau GmbH & Co. KG – Gescher",
      "type": "Registerbekanntmachung nach dem Umwandlungsgesetz",
      "state": "Nordrhein-Westfalen",
      "amtsgericht": "Amtsgericht Coesfeld",
      "registernummer": "HRA 10288",
      "registerart": "HRA",
      "company_name": "Sicon Industrie- und Gewerbebau GmbH & Co. KG",
      "company_seat": "Gescher",
      "details": "15.11.2025 (Bekanntmachungsdatum)\n\nNordrhein-Westfalen Amtsgericht Coesfeld HRA 10288\nRegisterbekanntmachung nach dem Umwandlungsgesetz 15.11.2025 (Eintragungsdatum)\n\nSicon Industrie- und Gewerbebau GmbH & Co. KG\nKommanditgesellschaft\nGescher\n\nDen Gläubigern der an der Ausgliederung beteiligten Rechtsträger ist, wenn sie binnen sechs Monaten nach dem Tag, an dem die Eintragung der Ausgliederung in das Register des Sitzes desjenigen Rechtsträgers, dessen Gläubiger sie sind, nach § 19 Absatz 3 UmwG als bekanntgemacht gilt, ihren Anspruch nach Grund und Höhe schriftlich anmelden, Sicherheit zu leisten, soweit sie nicht Befriedigung verlangen können. Dieses Recht steht den Gläubigern jedoch nur zu, wenn sie glaubhaft machen, dass durch die Ausgliederung die Erfüllung ihrer Forderung gefährdet wird."
    }
  ]
}