{
  "date": "2025-11-08",
  "date_of_scrape": "2025-11-09T04:06:24.533Z",
  "tool_version": "0.2.0",
  "number_of_announcements": 18,
  "announcements": [
    {
      "date": "2025-11-08",
      "id": "136711",
      "original_text": "Registerbekanntmachung nach dem Umwandlungsgesetz\nBayern Amtsgericht München HRB 166329\nH.C. Management Verwaltungs GmbH – München",
      "type": "Registerbekanntmachung nach dem Umwandlungsgesetz",
      "state": "Bayern",
      "amtsgericht": "Amtsgericht München",
      "registernummer": "HRB 166329",
      "registerart": "HRB",
      "company_name": "H.C. Management Verwaltungs GmbH",
      "company_seat": "München",
      "details": "08.11.2025 (Bekanntmachungsdatum)\n\nBayern Amtsgericht München HRB 166329\nRegisterbekanntmachung nach dem Umwandlungsgesetz 07.11.2025 (Eintragungsdatum)\n\nH.C. Management Verwaltungs GmbH\nGesellschaft mit beschränkter Haftung\nMünchen\n\nDen Gläubigern der an der Verschmelzung beteiligten Rechtsträger ist, wenn sie binnen sechs Monaten nach dem Tag, an dem die Eintragung der Verschmelzung in das Register des Sitzes desjenigen Rechtsträgers, dessen Gläubiger sie sind, nach § 19 Abs. 3 UmwG als bekannt gemacht gilt, ihren Anspruch nach Grund und Höhe in Textform anmelden, Sicherheit zu leisten, soweit sie nicht Befriedigung verlangen können. Dieses Recht steht den Gläubigern jedoch nur zu, wenn sie glaubhaft machen, dass durch die Verschmelzung die Erfüllung ihrer Forderung gefährdet wird."
    },
    {
      "date": "2025-11-08",
      "id": "136712",
      "original_text": "Registerbekanntmachung nach dem Umwandlungsgesetz\nBayern Amtsgericht München HRB 118229\nSHS VIVEON AG – München",
      "type": "Registerbekanntmachung nach dem Umwandlungsgesetz",
      "state": "Bayern",
      "amtsgericht": "Amtsgericht München",
      "registernummer": "HRB 118229",
      "registerart": "HRB",
      "company_name": "SHS VIVEON AG",
      "company_seat": "München",
      "details": "08.11.2025 (Bekanntmachungsdatum)\n\nBayern Amtsgericht München HRB 118229\nRegisterbekanntmachung nach dem Umwandlungsgesetz 07.11.2025 (Eintragungsdatum)\n\nSHS VIVEON AG\nAktiengesellschaft\nMünchen\n\nDen Gläubigern der an der Verschmelzung beteiligten Rechtsträger ist, wenn sie binnen sechs Monaten nach dem Tag, an dem die Eintragung der Verschmelzung in das Register des Sitzes desjenigen Rechtsträgers, dessen Gläubiger sie sind, nach § 19 Abs. 3 UmwG als bekannt gemacht gilt, ihren Anspruch nach Grund und Höhe in Textform anmelden, Sicherheit zu leisten, soweit sie nicht Befriedigung verlangen können. Dieses Recht steht den Gläubigern jedoch nur zu, wenn sie glaubhaft machen, dass durch die Verschmelzung die Erfüllung ihrer Forderung gefährdet wird."
    },
    {
      "date": "2025-11-08",
      "id": "136713",
      "original_text": "Registerbekanntmachung nach dem Umwandlungsgesetz\nBayern Amtsgericht Fürth HRA 6903\nKarl Rädisch GmbH & Co KG Offsetdruck – Emskirchen",
      "type": "Registerbekanntmachung nach dem Umwandlungsgesetz",
      "state": "Bayern",
      "amtsgericht": "Amtsgericht Fürth",
      "registernummer": "HRA 6903",
      "registerart": "HRA",
      "company_name": "Karl Rädisch GmbH & Co KG Offsetdruck",
      "company_seat": "Emskirchen",
      "details": "08.11.2025 (Bekanntmachungsdatum)\n\nBayern Amtsgericht Fürth HRA 6903\nRegisterbekanntmachung nach dem Umwandlungsgesetz 07.11.2025 (Eintragungsdatum)\n\nKarl Rädisch GmbH & Co KG Offsetdruck\nKommanditgesellschaft\nEmskirchen\n\nDen Gläubigern des formwechselnden Rechtsträgers ist, wenn sie binnen sechs Monaten nach dem Tag, an dem die Eintragung des Formwechsels nach § 201 UmwG als bekannt gemacht gilt, ihren Anspruch nach Grund und Höhe in Textform anmelden, Sicherheit zu leisten, soweit sie nicht Befriedigung verlangen können. Dieses Recht steht den Gläubigern jedoch nur zu, wenn sie glaubhaft machen, dass durch den Formwechsel die Erfüllung ihrer Forderung gefährdet wird."
    },
    {
      "date": "2025-11-08",
      "id": "136714",
      "original_text": "Registerbekanntmachung nach dem Umwandlungsgesetz\nBayern Amtsgericht München HRB 166330\nH.C. Management Beteiligungs GmbH – München",
      "type": "Registerbekanntmachung nach dem Umwandlungsgesetz",
      "state": "Bayern",
      "amtsgericht": "Amtsgericht München",
      "registernummer": "HRB 166330",
      "registerart": "HRB",
      "company_name": "H.C. Management Beteiligungs GmbH",
      "company_seat": "München",
      "details": "08.11.2025 (Bekanntmachungsdatum)\n\nBayern Amtsgericht München HRB 166330\nRegisterbekanntmachung nach dem Umwandlungsgesetz 07.11.2025 (Eintragungsdatum)\n\nH.C. Management Beteiligungs GmbH\nGesellschaft mit beschränkter Haftung\nMünchen\n\nDen Gläubigern der an der Verschmelzung beteiligten Rechtsträger ist, wenn sie binnen sechs Monaten nach dem Tag, an dem die Eintragung der Verschmelzung in das Register des Sitzes desjenigen Rechtsträgers, dessen Gläubiger sie sind, nach § 19 Abs. 3 UmwG als bekannt gemacht gilt, ihren Anspruch nach Grund und Höhe in Textform anmelden, Sicherheit zu leisten, soweit sie nicht Befriedigung verlangen können. Dieses Recht steht den Gläubigern jedoch nur zu, wenn sie glaubhaft machen, dass durch die Verschmelzung die Erfüllung ihrer Forderung gefährdet wird."
    },
    {
      "date": "2025-11-08",
      "id": "136715",
      "original_text": "Sonstige Registerbekanntmachung\nBayern Amtsgericht München HRB 294288\nConti Gastronomie GmbH – München",
      "type": "Sonstige Registerbekanntmachung",
      "state": "Bayern",
      "amtsgericht": "Amtsgericht München",
      "registernummer": "HRB 294288",
      "registerart": "HRB",
      "company_name": "Conti Gastronomie GmbH",
      "company_seat": "München",
      "details": "08.11.2025 (Bekanntmachungsdatum)\n\nBayern Amtsgericht München HRB 294288\nSonstige Registerbekanntmachung 07.11.2025 (Eintragungsdatum)\n\nConti Gastronomie GmbH\nGesellschaft mit beschränkter Haftung\nMünchen\n\nDen Gläubigern der Gesellschaft, deren Forderungen begründet worden sind, bevor die Eintragung der Beendigung des Gewinnabführungsvertrages in das Handelsregister nach § 10 des Handelsgesetzbuches als bekanntgemacht gilt, hat der andere Vertragsteil Sicherheit zu leisten, wenn sie sich binnen sechs Monaten nach der Bekanntmachung der Eintragung zu diesem Zweck bei ihm melden."
    },
    {
      "date": "2025-11-08",
      "id": "136716",
      "original_text": "Löschungsankündigung\nBayern Amtsgericht Straubing HRA 2036\nF.E.L.I.X. - Verlag Helga & Helmut Gabriel KG – Perasdorf",
      "type": "Löschungsankündigung",
      "state": "Bayern",
      "amtsgericht": "Amtsgericht Straubing",
      "registernummer": "HRA 2036",
      "registerart": "HRA",
      "company_name": "F.E.L.I.X. - Verlag Helga & Helmut Gabriel KG",
      "company_seat": "Perasdorf",
      "details": "08.11.2025 (Bekanntmachungsdatum)\n\nBayern Amtsgericht Straubing HRA 2036\nLöschungsankündigung\n\nF.E.L.I.X. - Verlag Helga & Helmut Gabriel KG\nKommanditgesellschaft\nPerasdorf\n\nDas Registergericht beabsichtigt, die im Handelsregister eingetragene Firma von Amts wegen nach §§ 393 FamFG, 31 Abs. 2 HGB zu löschen. Die Frist zur Erhebung eines Widerspruchs ist auf drei Monate festgesetzt."
    },
    {
      "date": "2025-11-08",
      "id": "136717",
      "original_text": "Registerbekanntmachung nach dem Umwandlungsgesetz\nBayern Amtsgericht Fürth HRB 22190\nKarl Rädisch GmbH – Emskirchen",
      "type": "Registerbekanntmachung nach dem Umwandlungsgesetz",
      "state": "Bayern",
      "amtsgericht": "Amtsgericht Fürth",
      "registernummer": "HRB 22190",
      "registerart": "HRB",
      "company_name": "Karl Rädisch GmbH",
      "company_seat": "Emskirchen",
      "details": "08.11.2025 (Bekanntmachungsdatum)\n\nBayern Amtsgericht Fürth HRB 22190\nRegisterbekanntmachung nach dem Umwandlungsgesetz 07.11.2025 (Eintragungsdatum)\n\nKarl Rädisch GmbH\nGesellschaft mit beschränkter Haftung\nEmskirchen\n\nDen Gläubigern des formwechselnden Rechtsträgers ist, wenn sie binnen sechs Monaten nach dem Tag, an dem die Eintragung des Formwechsels nach § 201 UmwG als bekannt gemacht gilt, ihren Anspruch nach Grund und Höhe in Textform anmelden, Sicherheit zu leisten, soweit sie nicht Befriedigung verlangen können. Dieses Recht steht den Gläubigern jedoch nur zu, wenn sie glaubhaft machen, dass durch den Formwechsel die Erfüllung ihrer Forderung gefährdet wird."
    },
    {
      "date": "2025-11-08",
      "id": "136718",
      "original_text": "Registerbekanntmachung nach dem Umwandlungsgesetz\nBayern Amtsgericht Fürth GsR 351\nLeibold & Baumgärtner Immobilienbesitz und Verwaltung eGbR – Erlangen",
      "type": "Registerbekanntmachung nach dem Umwandlungsgesetz",
      "state": "Bayern",
      "amtsgericht": "Amtsgericht Fürth",
      "registernummer": "GsR 351",
      "registerart": "GsR",
      "company_name": "Leibold & Baumgärtner Immobilienbesitz und Verwaltung eGbR",
      "company_seat": "Erlangen",
      "details": "08.11.2025 (Bekanntmachungsdatum)\n\nBayern Amtsgericht Fürth GsR 351\nRegisterbekanntmachung nach dem Umwandlungsgesetz 07.11.2025 (Eintragungsdatum)\n\nLeibold & Baumgärtner Immobilienbesitz und Verwaltung eGbR\nGesellschaft bürgerlichen Rechts\nErlangen\n\nDen Gläubigern der an der Verschmelzung beteiligten Rechtsträger ist, wenn sie binnen sechs Monaten nach dem Tag, an dem die Eintragung der Verschmelzung in das Register des Sitzes desjenigen Rechtsträgers, dessen Gläubiger sie sind, nach § 19 Abs. 3 UmwG als bekannt gemacht gilt, ihren Anspruch nach Grund und Höhe in Textform anmelden, Sicherheit zu leisten, soweit sie nicht Befriedigung verlangen können. Dieses Recht steht den Gläubigern jedoch nur zu, wenn sie glaubhaft machen, dass durch die Verschmelzung die Erfüllung ihrer Forderung gefährdet wird."
    },
    {
      "date": "2025-11-08",
      "id": "136719",
      "original_text": "Registerbekanntmachung nach dem Umwandlungsgesetz\nBayern Amtsgericht München HRB 304043\nBlitz 25-461 GmbH – München",
      "type": "Registerbekanntmachung nach dem Umwandlungsgesetz",
      "state": "Bayern",
      "amtsgericht": "Amtsgericht München",
      "registernummer": "HRB 304043",
      "registerart": "HRB",
      "company_name": "Blitz 25-461 GmbH",
      "company_seat": "München",
      "details": "08.11.2025 (Bekanntmachungsdatum)\n\nBayern Amtsgericht München HRB 304043\nRegisterbekanntmachung nach dem Umwandlungsgesetz 07.11.2025 (Eintragungsdatum)\n\nBlitz 25-461 GmbH\nGesellschaft mit beschränkter Haftung\nMünchen\n\nDen Gläubigern der an den Verschmelzungen beteiligten Rechtsträger ist, wenn sie binnen sechs Monaten nach dem Tag, an dem die Eintragung der Verschmelzung in das Register des Sitzes desjenigen Rechtsträgers, dessen Gläubiger sie sind, nach § 19 Abs. 3 UmwG als bekannt gemacht gilt, ihren Anspruch nach Grund und Höhe in Textform anmelden, Sicherheit zu leisten, soweit sie nicht Befriedigung verlangen können. Dieses Recht steht den Gläubigern jedoch nur zu, wenn sie glaubhaft machen, dass durch die Verschmelzung die Erfüllung ihrer Forderung gefährdet wird."
    },
    {
      "date": "2025-11-08",
      "id": "136720",
      "original_text": "Registerbekanntmachung nach dem Umwandlungsgesetz\nBayern Amtsgericht München HRB 200781\nAlfa GmbH – München",
      "type": "Registerbekanntmachung nach dem Umwandlungsgesetz",
      "state": "Bayern",
      "amtsgericht": "Amtsgericht München",
      "registernummer": "HRB 200781",
      "registerart": "HRB",
      "company_name": "Alfa GmbH",
      "company_seat": "München",
      "details": "08.11.2025 (Bekanntmachungsdatum)\n\nBayern Amtsgericht München HRB 200781\nRegisterbekanntmachung nach dem Umwandlungsgesetz 07.11.2025 (Eintragungsdatum)\n\nAlfa GmbH\nGesellschaft mit beschränkter Haftung\nMünchen\n\nDen Gläubigern der an der Verschmelzung beteiligten Rechtsträger ist, wenn sie binnen sechs Monaten nach dem Tag, an dem die Eintragung der Verschmelzung in das Register des Sitzes desjenigen Rechtsträgers, dessen Gläubiger sie sind, nach § 19 Abs. 3 UmwG als bekannt gemacht gilt, ihren Anspruch nach Grund und Höhe in Textform anmelden, Sicherheit zu leisten, soweit sie nicht Befriedigung verlangen können. Dieses Recht steht den Gläubigern jedoch nur zu, wenn sie glaubhaft machen, dass durch die Verschmelzung die Erfüllung ihrer Forderung gefährdet wird."
    },
    {
      "date": "2025-11-08",
      "id": "136721",
      "original_text": "Registerbekanntmachung nach dem Umwandlungsgesetz\nBayern Amtsgericht Fürth HRB 7995\nA.L.E. GmbH Fenster-Türen-Sonnenschutz – Erlangen",
      "type": "Registerbekanntmachung nach dem Umwandlungsgesetz",
      "state": "Bayern",
      "amtsgericht": "Amtsgericht Fürth",
      "registernummer": "HRB 7995",
      "registerart": "HRB",
      "company_name": "A.L.E. GmbH Fenster-Türen-Sonnenschutz",
      "company_seat": "Erlangen",
      "details": "08.11.2025 (Bekanntmachungsdatum)\n\nBayern Amtsgericht Fürth HRB 7995\nRegisterbekanntmachung nach dem Umwandlungsgesetz 07.11.2025 (Eintragungsdatum)\n\nA.L.E. GmbH Fenster-Türen-Sonnenschutz\nGesellschaft mit beschränkter Haftung\nErlangen\n\nDen Gläubigern der an der Verschmelzung beteiligten Rechtsträger ist, wenn sie binnen sechs Monaten nach dem Tag, an dem die Eintragung der Verschmelzung in das Register des Sitzes desjenigen Rechtsträgers, dessen Gläubiger sie sind, nach § 19 Abs. 3 UmwG als bekannt gemacht gilt, ihren Anspruch nach Grund und Höhe in Textform anmelden, Sicherheit zu leisten, soweit sie nicht Befriedigung verlangen können. Dieses Recht steht den Gläubigern jedoch nur zu, wenn sie glaubhaft machen, dass durch die Verschmelzung die Erfüllung ihrer Forderung gefährdet wird."
    },
    {
      "date": "2025-11-08",
      "id": "136722",
      "original_text": "Registerbekanntmachung nach dem Umwandlungsgesetz\nBayern Amtsgericht Amberg HRB 7852\nCaritas-Seniorendienste-Amberg gemeinnützige GmbH – Amberg",
      "type": "Registerbekanntmachung nach dem Umwandlungsgesetz",
      "state": "Bayern",
      "amtsgericht": "Amtsgericht Amberg",
      "registernummer": "HRB 7852",
      "registerart": "HRB",
      "company_name": "Caritas-Seniorendienste-Amberg gemeinnützige GmbH",
      "company_seat": "Amberg",
      "details": "08.11.2025 (Bekanntmachungsdatum)\n\nBayern Amtsgericht Amberg HRB 7852\nRegisterbekanntmachung nach dem Umwandlungsgesetz 07.11.2025 (Eintragungsdatum)\n\nCaritas-Seniorendienste-Amberg gemeinnützige GmbH\nGesellschaft mit beschränkter Haftung\nAmberg\n\nDen Gläubigern der an der Ausgliederung beteiligten Rechtsträger ist, wenn sie binnen sechs Monaten nach dem Tag, an dem die Eintragung der Ausgliederung in das Register des Sitzes desjenigen Rechtsträgers, dessen Gläubiger sie sind, nach §§ 125, 19 Abs. 3 UmwG als bekannt gemacht gilt, ihren Anspruch nach Grund und Höhe in Textform anmelden, Sicherheit zu leisten, soweit sie nicht Befriedigung verlangen können. Dieses Recht steht den Gläubigern jedoch nur zu, wenn sie glaubhaft machen, dass durch die Ausgliederung die Erfüllung ihrer Forderung gefährdet wird."
    },
    {
      "date": "2025-11-08",
      "id": "136723",
      "original_text": "Sonstige Registerbekanntmachung\nBayern Amtsgericht Bayreuth HRB 3844\nSCD Proß GmbH – Haag OT Unternschreez",
      "type": "Sonstige Registerbekanntmachung",
      "state": "Bayern",
      "amtsgericht": "Amtsgericht Bayreuth",
      "registernummer": "HRB 3844",
      "registerart": "HRB",
      "company_name": "SCD Proß GmbH",
      "company_seat": "Haag OT Unternschreez",
      "details": "08.11.2025 (Bekanntmachungsdatum)\n\nBayern Amtsgericht Bayreuth HRB 3844\nSonstige Registerbekanntmachung 07.11.2025 (Eintragungsdatum)\n\nSCD Proß GmbH\nGesellschaft mit beschränkter Haftung\nHaag OT Unternschreez\n\nDen Gläubigern der an der Verschmelzung beteiligten Rechtsträger ist, wenn sie binnen sechs Monaten nach dem Tag, an dem die Eintragung der Verschmelzung in das Register des Sitzes desjenigen Rechtsträgers, dessen Gläubiger sie sind, nach § 19 Abs. 3 UmwG als bekannt gemacht gilt, ihren Anspruch nach Grund und Höhe in Textform anmelden, Sicherheit zu leisten, soweit sie nicht Befriedigung verlangen können. Dieses Recht steht den Gläubigern jedoch nur zu, wenn sie glaubhaft machen, dass durch die Verschmelzung die Erfüllung ihrer Forderung gefährdet wird."
    },
    {
      "date": "2025-11-08",
      "id": "136724",
      "original_text": "Einreichung neuer Dokumente\nBayern Amtsgericht München HRB 163416\nNokia Solutions and Networks Management GmbH – München",
      "type": "Einreichung neuer Dokumente",
      "state": "Bayern",
      "amtsgericht": "Amtsgericht München",
      "registernummer": "HRB 163416",
      "registerart": "HRB",
      "company_name": "Nokia Solutions and Networks Management GmbH",
      "company_seat": "München",
      "details": "08.11.2025 (Bekanntmachungsdatum)\n\nBayern Amtsgericht München HRB 163416\nEinreichung neuer Dokumente\n\nNokia Solutions and Networks Management GmbH\nGesellschaft mit beschränkter Haftung\nMünchen\n\nDem Amtsgericht München -Registergericht- ist eine Liste der Mitglieder des Aufsichtsrats eingereicht worden, § 52 Abs. 3 S. 2 GmbHG."
    },
    {
      "date": "2025-11-08",
      "id": "136725",
      "original_text": "Registerbekanntmachung nach dem Umwandlungsgesetz\nBayern Amtsgericht Amberg VR 26\nCaritasverband für die Stadt Amberg und den Landkreis Amberg-Sulzbach e.V. – Amberg",
      "type": "Registerbekanntmachung nach dem Umwandlungsgesetz",
      "state": "Bayern",
      "amtsgericht": "Amtsgericht Amberg",
      "registernummer": "VR 26",
      "registerart": "VR",
      "company_name": "Caritasverband für die Stadt Amberg und den Landkreis Amberg-Sulzbach e.V.",
      "company_seat": "Amberg",
      "details": "08.11.2025 (Bekanntmachungsdatum)\n\nBayern Amtsgericht Amberg VR 26\nRegisterbekanntmachung nach dem Umwandlungsgesetz 07.11.2025 (Eintragungsdatum)\n\nCaritasverband für die Stadt Amberg und den Landkreis Amberg-Sulzbach e.V.\neingetragener Verein\nAmberg\n\nDen Gläubigern der an der Ausgliederung beteiligten Rechtsträger ist, wenn sie binnen sechs Monaten nach dem Tag, an dem die Eintragung der Ausgliederung in das Register des Sitzes desjenigen Rechtsträgers, dessen Gläubiger sie sind, nach §§ 125, 19 Abs. 3 UmwG als bekannt gemacht gilt, ihren Anspruch nach Grund und Höhe in Textform anmelden, Sicherheit zu leisten, soweit sie nicht Befriedigung verlangen können. Dieses Recht steht den Gläubigern jedoch nur zu, wenn sie glaubhaft machen, dass durch die Ausgliederung die Erfüllung ihrer Forderung gefährdet wird."
    },
    {
      "date": "2025-11-08",
      "id": "136726",
      "original_text": "Einreichung neuer Dokumente\nBayern Amtsgericht München HRB 181035\nWTS Group AG – München",
      "type": "Einreichung neuer Dokumente",
      "state": "Bayern",
      "amtsgericht": "Amtsgericht München",
      "registernummer": "HRB 181035",
      "registerart": "HRB",
      "company_name": "WTS Group AG",
      "company_seat": "München",
      "details": "08.11.2025 (Bekanntmachungsdatum)\n\nBayern Amtsgericht München HRB 181035\nEinreichung neuer Dokumente 07.11.2025 (Eintragungsdatum)\n\nWTS Group AG\nAktiengesellschaft\nMünchen\n\nDem Amtsgericht München -Registergericht- ist eine Liste der Mitglieder des Aufsichtsrats eingereicht worden, § 106 AktG."
    },
    {
      "date": "2025-11-08",
      "id": "136727",
      "original_text": "Registerbekanntmachung nach dem Umwandlungsgesetz\nBayern Amtsgericht München HRB 274926\nBB Immobilien Invest GmbH – Grünwald",
      "type": "Registerbekanntmachung nach dem Umwandlungsgesetz",
      "state": "Bayern",
      "amtsgericht": "Amtsgericht München",
      "registernummer": "HRB 274926",
      "registerart": "HRB",
      "company_name": "BB Immobilien Invest GmbH",
      "company_seat": "Grünwald",
      "details": "08.11.2025 (Bekanntmachungsdatum)\n\nBayern Amtsgericht München HRB 274926\nRegisterbekanntmachung nach dem Umwandlungsgesetz 07.11.2025 (Eintragungsdatum)\n\nBB Immobilien Invest GmbH\nGesellschaft mit beschränkter Haftung\nGrünwald\n\nDen Gläubigern der an der Verschmelzung beteiligten Rechtsträger ist, wenn sie binnen sechs Monaten nach dem Tag, an dem die Eintragung der Verschmelzung in das Register des Sitzes desjenigen Rechtsträgers, dessen Gläubiger sie sind, nach § 19 Abs. 3 UmwG als bekannt gemacht gilt, ihren Anspruch nach Grund und Höhe in Textform anmelden, Sicherheit zu leisten, soweit sie nicht Befriedigung verlangen können. Dieses Recht steht den Gläubigern jedoch nur zu, wenn sie glaubhaft machen, dass durch die Verschmelzung die Erfüllung ihrer Forderung gefährdet wird."
    },
    {
      "date": "2025-11-08",
      "id": "136728",
      "original_text": "Einreichung neuer Dokumente\nBayern Amtsgericht München HRB 208312\nAllianz Global Corporate & Specialty SE – München",
      "type": "Einreichung neuer Dokumente",
      "state": "Bayern",
      "amtsgericht": "Amtsgericht München",
      "registernummer": "HRB 208312",
      "registerart": "HRB",
      "company_name": "Allianz Global Corporate & Specialty SE",
      "company_seat": "München",
      "details": "08.11.2025 (Bekanntmachungsdatum)\n\nBayern Amtsgericht München HRB 208312\nEinreichung neuer Dokumente\n\nAllianz Global Corporate & Specialty SE\nEuropäische Aktiengesellschaft (SE)\nMünchen\n\nDem Amtsgericht München -Registergericht- ist eine Liste der Mitglieder des Aufsichtsrats eingereicht worden, Art. 9 Abs. 1 Buchst. c (ii) SE-VO i.V.m. § 106 AktG."
    }
  ]
}