{
  "date": "2025-11-17",
  "date_of_scrape": "2025-11-18T04:10:43.742Z",
  "tool_version": "0.2.0",
  "number_of_announcements": 128,
  "announcements": [
    {
      "date": "2025-11-17",
      "id": "137443",
      "original_text": "Löschungsankündigung\nBaden-Württemberg Amtsgericht Mannheim HRB 106850\nSM-Invest-Vermittlungs GmbH Sever Muresan – Karlsruhe",
      "type": "Löschungsankündigung",
      "state": "Baden-Württemberg",
      "amtsgericht": "Amtsgericht Mannheim",
      "registernummer": "HRB 106850",
      "registerart": "HRB",
      "company_name": "SM-Invest-Vermittlungs GmbH Sever Muresan",
      "company_seat": "Karlsruhe",
      "details": "17.11.2025 (Bekanntmachungsdatum)\n\nBaden-Württemberg Amtsgericht Mannheim HRB 106850\nLöschungsankündigung\n\nSM-Invest-Vermittlungs GmbH Sever Muresan\nGesellschaft mit beschränkter Haftung\nKarlsruhe\n\nDas Gericht beabsichtigt, die Gesellschaft wegen Vermögenslosigkeit im Handelsregister von Amts wegen nach § 394 FamFG zu löschen. Die Frist zur Geltendmachung eines Widerspruchs gegen die beabsichtigte Löschung ist auf einen Monat ab Veröffentlichung bestimmt."
    },
    {
      "date": "2025-11-17",
      "id": "137444",
      "original_text": "Löschungsankündigung\nBaden-Württemberg Amtsgericht Freiburg HRB 2943\nEKS Technik GmbH – Freiburg im Breisgau",
      "type": "Löschungsankündigung",
      "state": "Baden-Württemberg",
      "amtsgericht": "Amtsgericht Freiburg",
      "registernummer": "HRB 2943",
      "registerart": "HRB",
      "company_name": "EKS Technik GmbH",
      "company_seat": "Freiburg im Breisgau",
      "details": "17.11.2025 (Bekanntmachungsdatum)\n\nBaden-Württemberg Amtsgericht Freiburg HRB 2943\nLöschungsankündigung 17.11.2025 (Eintragungsdatum)\n\nEKS Technik GmbH\nGesellschaft mit beschränkter Haftung\nFreiburg im Breisgau\n\nAls nicht eingetragen wird bekanntgemacht:\nDas Gericht beabsichtigt, die Gesellschaft wegen Vermögenslosigkeit im Handelsregister von Amts wegen nach § 394 FamFG zu löschen. Die Frist zur Geltendmachung eines Widerspruchs gegen die beabsichtigte Löschung ist auf einen Monat ab Veröffentlichung bestimmt."
    },
    {
      "date": "2025-11-17",
      "id": "137445",
      "original_text": "Einreichung neuer Dokumente\nBaden-Württemberg Amtsgericht Ulm HRB 743255\nANDRITZ Schuler GmbH – Göppingen",
      "type": "Einreichung neuer Dokumente",
      "state": "Baden-Württemberg",
      "amtsgericht": "Amtsgericht Ulm",
      "registernummer": "HRB 743255",
      "registerart": "HRB",
      "company_name": "ANDRITZ Schuler GmbH",
      "company_seat": "Göppingen",
      "details": "17.11.2025 (Bekanntmachungsdatum)\n\nBaden-Württemberg Amtsgericht Ulm HRB 743255\nEinreichung neuer Dokumente\n\nANDRITZ Schuler GmbH\nGesellschaft mit beschränkter Haftung\nGöppingen\n\nDie Gesellschaft hat am 11.11.2025 die Liste über die Zusammensetzung des Aufsichtsrats zum Handelsregister eingereicht."
    },
    {
      "date": "2025-11-17",
      "id": "137446",
      "original_text": "Löschungsankündigung\nBrandenburg Amtsgericht Potsdam HRB 34744\nETC Gauff Mobility GmbH – Potsdam",
      "type": "Löschungsankündigung",
      "state": "Brandenburg",
      "amtsgericht": "Amtsgericht Potsdam",
      "registernummer": "HRB 34744",
      "registerart": "HRB",
      "company_name": "ETC Gauff Mobility GmbH",
      "company_seat": "Potsdam",
      "details": "17.11.2025 (Bekanntmachungsdatum)\n\nBrandenburg Amtsgericht Potsdam HRB 34744\nLöschungsankündigung\n\nETC Gauff Mobility GmbH\nGesellschaft mit beschränkter Haftung\nPotsdam\n\nBei der nachstehenden Gesellschaft wird das Amtslöschungsverfahren gemäß § 394 FamFG eingeleitet. Widerspruchsfrist: 8 Wochen."
    },
    {
      "date": "2025-11-17",
      "id": "137447",
      "original_text": "Löschungsankündigung\nBrandenburg Amtsgericht Potsdam HRB 36557\nGollnow Service 24 GmbH – Stahnsdorf",
      "type": "Löschungsankündigung",
      "state": "Brandenburg",
      "amtsgericht": "Amtsgericht Potsdam",
      "registernummer": "HRB 36557",
      "registerart": "HRB",
      "company_name": "Gollnow Service 24 GmbH",
      "company_seat": "Stahnsdorf",
      "details": "17.11.2025 (Bekanntmachungsdatum)\n\nBrandenburg Amtsgericht Potsdam HRB 36557\nLöschungsankündigung\n\nGollnow Service 24 GmbH\nGesellschaft mit beschränkter Haftung\nStahnsdorf\n\nBei der nachstehenden Gesellschaft wird das Amtslöschungsverfahren gemäß § 394 FamFG eingeleitet. Widerspruchsfrist: 8 Wochen."
    },
    {
      "date": "2025-11-17",
      "id": "137448",
      "original_text": "Löschungsankündigung\nSaarland Amtsgericht Saarbrücken HRB 103229\nBAS Bauabwicklung, -service UG (haftungsbeschränkt) – Saarbrücken",
      "type": "Löschungsankündigung",
      "state": "Saarland",
      "amtsgericht": "Amtsgericht Saarbrücken",
      "registernummer": "HRB 103229",
      "registerart": "HRB",
      "company_name": "BAS Bauabwicklung, -service UG (haftungsbeschränkt)",
      "company_seat": "Saarbrücken",
      "details": "17.11.2025 (Bekanntmachungsdatum)\n\nSaarland Amtsgericht Saarbrücken HRB 103229\nLöschungsankündigung\n\nBAS Bauabwicklung, -service UG (haftungsbeschränkt)\nGesellschaft mit beschränkter Haftung\nSaarbrücken\n\nEs ist beabsichtigt, die Gesellschaft von Amts wegen gemäß § 394 FamFG wegen Vermögenslosigkeit zu löschen.\nGegen die Löschung von Amts wegen ist das Rechtsmittel des Widerspruchs statthaft. Der Widerspruch ist binnen einer Frist einem Monat beginnend mit dem Tag dieser Veröffentlichung durch Einreichen eines Widerspruchsschreibens -schriftlich oder zur Niederschrift der Geschäftsstelle beim Amtsgericht Saarbrücken, -zentrales Handelsregister-, Mainzerstr.178, 66121 Saarbrücken einzulegen.\nDer Widerspruch muss die Bezeichnung der angefochtenen Löschungsankündigung enthalten sowie die Erklärung, dass Widerspruch eingelegt wird. Er ist vom Widerspruchsführer oder seinem Bevollmächtigten zu unterzeichnen.\nDas Widerspruchsschreiben kann auch in der Form eines elektronischen Dokumentes eingereicht werden, das mit einer qualifizierten elektronischen Signatur nach dem Signaturgesetz versehen sein muss (§§ 14 Abs. 2 FamFG, 130a, 298 ZPO)."
    },
    {
      "date": "2025-11-17",
      "id": "137449",
      "original_text": "Löschungsankündigung\nBrandenburg Amtsgericht Potsdam HRB 37004\nEigenheim Union 1898 Massivbau GmbH – Zossen",
      "type": "Löschungsankündigung",
      "state": "Brandenburg",
      "amtsgericht": "Amtsgericht Potsdam",
      "registernummer": "HRB 37004",
      "registerart": "HRB",
      "company_name": "Eigenheim Union 1898 Massivbau GmbH",
      "company_seat": "Zossen",
      "details": "17.11.2025 (Bekanntmachungsdatum)\n\nBrandenburg Amtsgericht Potsdam HRB 37004\nLöschungsankündigung\n\nEigenheim Union 1898 Massivbau GmbH\nGesellschaft mit beschränkter Haftung\nZossen\n\nBei der nachstehenden Gesellschaft wird das Amtslöschungsverfahren gemäß § 394 FamFG eingeleitet. Widerspruchsfrist: 8 Wochen."
    },
    {
      "date": "2025-11-17",
      "id": "137450",
      "original_text": "Löschungsankündigung\nBrandenburg Amtsgericht Potsdam HRB 37008\nEigenheim Union 1898 zweite Massivhaus GmbH – Zossen",
      "type": "Löschungsankündigung",
      "state": "Brandenburg",
      "amtsgericht": "Amtsgericht Potsdam",
      "registernummer": "HRB 37008",
      "registerart": "HRB",
      "company_name": "Eigenheim Union 1898 zweite Massivhaus GmbH",
      "company_seat": "Zossen",
      "details": "17.11.2025 (Bekanntmachungsdatum)\n\nBrandenburg Amtsgericht Potsdam HRB 37008\nLöschungsankündigung\n\nEigenheim Union 1898 zweite Massivhaus GmbH\nGesellschaft mit beschränkter Haftung\nZossen\n\nBei der nachstehenden Gesellschaft wird das Amtslöschungsverfahren gemäß § 394 FamFG eingeleitet. Widerspruchsfrist: 8 Wochen."
    },
    {
      "date": "2025-11-17",
      "id": "137451",
      "original_text": "Einreichung neuer Dokumente\nBerlin Amtsgericht Berlin (Charlottenburg) HRB 168314\nHermannstr. 227 Grundbesitz GmbH – Berlin",
      "type": "Einreichung neuer Dokumente",
      "state": "Berlin",
      "amtsgericht": "Amtsgericht Berlin (Charlottenburg)",
      "registernummer": "HRB 168314",
      "registerart": "HRB",
      "company_name": "Hermannstr. 227 Grundbesitz GmbH",
      "company_seat": "Berlin",
      "details": "17.11.2025 (Bekanntmachungsdatum)\n\nBerlin Amtsgericht Berlin (Charlottenburg) HRB 168314\nEinreichung neuer Dokumente\n\nHermannstr. 227 Grundbesitz GmbH\nGesellschaft mit beschränkter Haftung\nBerlin\n\nAls nicht eingetragen wird veröffentlicht: Es wurde eine neue Liste der Beiratsmitglieder eingereicht (§52 GmbHG)."
    },
    {
      "date": "2025-11-17",
      "id": "137452",
      "original_text": "Löschungsankündigung\nSaarland Amtsgericht Saarbrücken HRB 102550\nM-G Freileitungsbau GmbH – Völklingen",
      "type": "Löschungsankündigung",
      "state": "Saarland",
      "amtsgericht": "Amtsgericht Saarbrücken",
      "registernummer": "HRB 102550",
      "registerart": "HRB",
      "company_name": "M-G Freileitungsbau GmbH",
      "company_seat": "Völklingen",
      "details": "17.11.2025 (Bekanntmachungsdatum)\n\nSaarland Amtsgericht Saarbrücken HRB 102550\nLöschungsankündigung\n\nM-G Freileitungsbau GmbH\nGesellschaft mit beschränkter Haftung\nVölklingen\n\nEs ist beabsichtigt, die Gesellschaft von Amts wegen gemäß § 394 FamFG wegen Vermögenslosigkeit zu löschen.\nGegen die Löschung von Amts wegen ist das Rechtsmittel des Widerspruchs statthaft. Der Widerspruch ist binnen einer Frist zwei Monaten beginnend mit dem Tag dieser Veröffentlichung durch Einreichen eines Widerspruchsschreibens -schriftlich oder zur Niederschrift der Geschäftsstelle beim Amtsgericht Saarbrücken, -zentrales Handelsregister-, Mainzerstr.178, 66121 Saarbrücken einzulegen.\nDer Widerspruch muss die Bezeichnung der angefochtenen Löschungsankündigung enthalten sowie die Erklärung, dass Widerspruch eingelegt wird. Er ist vom Widerspruchsführer oder seinem Bevollmächtigten zu unterzeichnen.\nDas Widerspruchsschreiben kann auch in der Form eines elektronischen Dokumentes eingereicht werden, das mit einer qualifizierten elektronischen Signatur nach dem Signaturgesetz versehen sein muss (§§ 14 Abs. 2 FamFG, 130a, 298 ZPO)."
    },
    {
      "date": "2025-11-17",
      "id": "137453",
      "original_text": "Löschungsankündigung\nBaden-Württemberg Amtsgericht Stuttgart HRB 770136\nRE Life UG (haftungsbeschränkt) – Esslingen am Neckar",
      "type": "Löschungsankündigung",
      "state": "Baden-Württemberg",
      "amtsgericht": "Amtsgericht Stuttgart",
      "registernummer": "HRB 770136",
      "registerart": "HRB",
      "company_name": "RE Life UG (haftungsbeschränkt)",
      "company_seat": "Esslingen am Neckar",
      "details": "17.11.2025 (Bekanntmachungsdatum)\n\nBaden-Württemberg Amtsgericht Stuttgart HRB 770136\nLöschungsankündigung\n\nRE Life UG (haftungsbeschränkt)\nGesellschaft mit beschränkter Haftung\nEsslingen am Neckar\n\nAls nicht eingetragen wird bekanntgemacht:\nDas Gericht beabsichtigt, die Gesellschaft wegen Vermögenslosigkeit im Handelsregister von Amts wegen nach § 394 FamFG zu löschen. Die Frist zur Geltendmachung eines Widerspruchs gegen die beabsichtigte Löschung ist auf zwei Monate ab Veröffentlichung bestimmt."
    },
    {
      "date": "2025-11-17",
      "id": "137454",
      "original_text": "Registerbekanntmachung nach dem Umwandlungsgesetz\nSchleswig-Holstein Amtsgericht Kiel HRA 11357\nHypion Motion Neumünster GmbH & Co. KG – Kiel",
      "type": "Registerbekanntmachung nach dem Umwandlungsgesetz",
      "state": "Schleswig-Holstein",
      "amtsgericht": "Amtsgericht Kiel",
      "registernummer": "HRA 11357",
      "registerart": "HRA",
      "company_name": "Hypion Motion Neumünster GmbH & Co. KG",
      "company_seat": "Kiel",
      "details": "17.11.2025 (Bekanntmachungsdatum)\n\nSchleswig-Holstein Amtsgericht Kiel HRA 11357\nRegisterbekanntmachung nach dem Umwandlungsgesetz 14.11.2025 (Eintragungsdatum)\n\nHypion Motion Neumünster GmbH & Co. KG\nKommanditgesellschaft\nKiel\n\nZu Eintragungsnummer 3 vom 14.11.2025 wird als nicht eingetragen veröffentlicht: Den Gläubigern ist, wenn sie binnen sechs Monaten nach dem Tag, an dem die Eintragung der Umwandlung bekannt gemacht worden ist, ihren Anspruch nach Grund und Höhe schriftlich anmelden, Sicherheit zu leisten, soweit sie nicht Befriedigung verlangen können. Dieses Recht steht den Gläubigern jedoch nur zu, wenn sie glaubhaft machen, dass durch die Umwandlung die Erfüllung ihrer Forderung gefährdet wird."
    },
    {
      "date": "2025-11-17",
      "id": "137455",
      "original_text": "Löschungsankündigung\nBaden-Württemberg Amtsgericht Freiburg HRB 722285\nMarkgräfler Weinlager UG (haftungsbeschränkt) – Moos",
      "type": "Löschungsankündigung",
      "state": "Baden-Württemberg",
      "amtsgericht": "Amtsgericht Freiburg",
      "registernummer": "HRB 722285",
      "registerart": "HRB",
      "company_name": "Markgräfler Weinlager UG (haftungsbeschränkt)",
      "company_seat": "Moos",
      "details": "17.11.2025 (Bekanntmachungsdatum)\n\nBaden-Württemberg Amtsgericht Freiburg HRB 722285\nLöschungsankündigung\n\nMarkgräfler Weinlager UG (haftungsbeschränkt)\nGesellschaft mit beschränkter Haftung\nMoos\n\nAls nicht eingetragen wird bekanntgemacht:\nDas Gericht beabsichtigt, die Gesellschaft wegen Vermögenslosigkeit im Handelsregister von Amts wegen nach § 394 FamFG zu löschen. Die Frist zur Geltendmachung eines Widerspruchs gegen die beabsichtigte Löschung ist auf einen Monat ab Veröffentlichung bestimmt."
    },
    {
      "date": "2025-11-17",
      "id": "137456",
      "original_text": "Registerbekanntmachung nach dem Umwandlungsgesetz\nSchleswig-Holstein Amtsgericht Kiel HRA 11597\n4Wolter cooperation GmbH & Co. KG – Norderstedt",
      "type": "Registerbekanntmachung nach dem Umwandlungsgesetz",
      "state": "Schleswig-Holstein",
      "amtsgericht": "Amtsgericht Kiel",
      "registernummer": "HRA 11597",
      "registerart": "HRA",
      "company_name": "4Wolter cooperation GmbH & Co. KG",
      "company_seat": "Norderstedt",
      "details": "17.11.2025 (Bekanntmachungsdatum)\n\nSchleswig-Holstein Amtsgericht Kiel HRA 11597\nRegisterbekanntmachung nach dem Umwandlungsgesetz 14.11.2025 (Eintragungsdatum)\n\n4Wolter cooperation GmbH & Co. KG\nKommanditgesellschaft\nNorderstedt\n\nZu Eintragungsnummer 5 vom 14.11.2025 wird als nicht eingetragen veröffentlicht: Den Gläubigern ist, wenn sie binnen sechs Monaten nach dem Tag, an dem die Eintragung der Umwandlung bekannt gemacht worden ist, ihren Anspruch nach Grund und Höhe schriftlich anmelden, Sicherheit zu leisten, soweit sie nicht Befriedigung verlangen können. Dieses Recht steht den Gläubigern jedoch nur zu, wenn sie glaubhaft machen, dass durch die Umwandlung die Erfüllung ihrer Forderung gefährdet wird."
    },
    {
      "date": "2025-11-17",
      "id": "137457",
      "original_text": "Registerbekanntmachung nach dem Umwandlungsgesetz\nHamburg Amtsgericht Hamburg HRA 132543\nPlan2X e. K. – Hamburg",
      "type": "Registerbekanntmachung nach dem Umwandlungsgesetz",
      "state": "Hamburg",
      "amtsgericht": "Amtsgericht Hamburg",
      "registernummer": "HRA 132543",
      "registerart": "HRA",
      "company_name": "Plan2X e. K.",
      "company_seat": "Hamburg",
      "details": "17.11.2025 (Bekanntmachungsdatum)\n\nHamburg Amtsgericht Hamburg HRA 132543\nRegisterbekanntmachung nach dem Umwandlungsgesetz 17.11.2025 (Eintragungsdatum)\n\nPlan2X e. K.\nEinzelkaufmann\nHamburg\n\nAls nicht eingetragen wird bekannt gemacht:\nDen Gläubigern der an der Ausgliederung beteiligten Gesellschaften ist, wenn sie binnen sechs Monaten nach dem Tag, an dem die Eintragung der Ausgliederung in das Register des Sitzes desjenigen Rechtsträgers, dessen Gläubiger sie sind, nach § 19 Absatz 3 UmwG als bekannt gemacht gilt, ihren Anspruch nach Grund und Höhe schriftlich anmelden, Sicherheit zu leisten, soweit sie nicht Befriedigung verlangen können. Dieses Recht steht den Gläubigern jedoch nur zu, wenn sie glaubhaft machen, dass durch die Ausgliederung die Erfüllung ihrer Forderung gefährdet wird."
    },
    {
      "date": "2025-11-17",
      "id": "137458",
      "original_text": "Registerbekanntmachung nach dem Umwandlungsgesetz\nSchleswig-Holstein Amtsgericht Lübeck HRB 26518\nFewofly GmbH – Glinde",
      "type": "Registerbekanntmachung nach dem Umwandlungsgesetz",
      "state": "Schleswig-Holstein",
      "amtsgericht": "Amtsgericht Lübeck",
      "registernummer": "HRB 26518",
      "registerart": "HRB",
      "company_name": "Fewofly GmbH",
      "company_seat": "Glinde",
      "details": "17.11.2025 (Bekanntmachungsdatum)\n\nSchleswig-Holstein Amtsgericht Lübeck HRB 26518\nRegisterbekanntmachung nach dem Umwandlungsgesetz 14.11.2025 (Eintragungsdatum)\n\nFewofly GmbH\nGesellschaft mit beschränkter Haftung\nGlinde\n\nZu Eintragungsnummer 2 vom 14.11.2025 wird als nicht eingetragen veröffentlicht:\nDen Gläubigern der an der Ausgliederung beteiligten Rechtsträger ist, wenn sie binnen sechs Monaten nach dem Tag, an dem die Eintragung der Ausgliederung in das Register des Sitzes desjenigen Rechtsträgers, dessen Gläubiger sie sind, als bekannt gemacht gilt, ihren Anspruch nach Grund und Höhe schriftlich anmelden, Sicherheit zu leisten, soweit sie nicht Befriedigung verlangen können. Dieses Recht steht den Gläubigern jedoch nur zu, wenn sie glaubhaft machen, dass durch die Ausgliederung die Erfüllung ihrer Forderung gefährdet wird."
    },
    {
      "date": "2025-11-17",
      "id": "137459",
      "original_text": "Einreichung neuer Dokumente\nBaden-Württemberg Amtsgericht Mannheim HRB 704261\nAFRY Deutschland GmbH – Mannheim",
      "type": "Einreichung neuer Dokumente",
      "state": "Baden-Württemberg",
      "amtsgericht": "Amtsgericht Mannheim",
      "registernummer": "HRB 704261",
      "registerart": "HRB",
      "company_name": "AFRY Deutschland GmbH",
      "company_seat": "Mannheim",
      "details": "17.11.2025 (Bekanntmachungsdatum)\n\nBaden-Württemberg Amtsgericht Mannheim HRB 704261\nEinreichung neuer Dokumente\n\nAFRY Deutschland GmbH\nGesellschaft mit beschränkter Haftung\nMannheim\n\nDie Gesellschaft hat am 14.11.2025 die Liste über die Zusammensetzung des Aufsichtsrats zum Handelsregister eingereicht."
    },
    {
      "date": "2025-11-17",
      "id": "137460",
      "original_text": "Löschungsankündigung\nBerlin Amtsgericht Berlin (Charlottenburg) HRB 199563\nMoe Automobile GmbH – Berlin",
      "type": "Löschungsankündigung",
      "state": "Berlin",
      "amtsgericht": "Amtsgericht Berlin (Charlottenburg)",
      "registernummer": "HRB 199563",
      "registerart": "HRB",
      "company_name": "Moe Automobile GmbH",
      "company_seat": "Berlin",
      "details": "17.11.2025 (Bekanntmachungsdatum)\n\nBerlin Amtsgericht Berlin (Charlottenburg) HRB 199563\nLöschungsankündigung\n\nMoe Automobile GmbH\nGesellschaft mit beschränkter Haftung\nBerlin\n\nBei der nachstehenden Gesellschaft wird das Amtslöschungsverfahren gemäß § 394 FamFG eingeleitet. Widerspruchsfrist 6 Wochen"
    },
    {
      "date": "2025-11-17",
      "id": "137461",
      "original_text": "Registerbekanntmachung nach dem Umwandlungsgesetz\nHamburg Amtsgericht Hamburg HRB 119042\nNeu Gas Shipping International GmbH – Hamburg",
      "type": "Registerbekanntmachung nach dem Umwandlungsgesetz",
      "state": "Hamburg",
      "amtsgericht": "Amtsgericht Hamburg",
      "registernummer": "HRB 119042",
      "registerart": "HRB",
      "company_name": "Neu Gas Shipping International GmbH",
      "company_seat": "Hamburg",
      "details": "17.11.2025 (Bekanntmachungsdatum)\n\nHamburg Amtsgericht Hamburg HRB 119042\nRegisterbekanntmachung nach dem Umwandlungsgesetz 17.11.2025 (Eintragungsdatum)\n\nNeu Gas Shipping International GmbH\nGesellschaft mit beschränkter Haftung\nHamburg\n\nAls nicht eingetragen wird bekannt gemacht:\nDen Gläubigern der an der Verschmelzung beteiligten Gesellschaften ist, wenn sie binnen sechs Monaten nach dem Tag, an dem die Eintragung der Verschmelzung in das Register des Sitzes desjenigen Rechtsträgers, dessen Gläubiger sie sind, nach § 19 Absatz 3 UmwG als bekannt gemacht gilt, ihren Anspruch nach Grund und Höhe schriftlich anmelden, Sicherheit zu leisten, soweit sie nicht Befriedigung verlangen können. Dieses Recht steht den Gläubigern jedoch nur zu, wenn sie glaubhaft machen, dass durch die Verschmelzung die Erfüllung ihrer Forderung gefährdet wird."
    },
    {
      "date": "2025-11-17",
      "id": "137462",
      "original_text": "Registerbekanntmachung nach dem Umwandlungsgesetz\nHamburg Amtsgericht Hamburg HRB 54527\nNeu Seeschiffahrt GmbH – Hamburg",
      "type": "Registerbekanntmachung nach dem Umwandlungsgesetz",
      "state": "Hamburg",
      "amtsgericht": "Amtsgericht Hamburg",
      "registernummer": "HRB 54527",
      "registerart": "HRB",
      "company_name": "Neu Seeschiffahrt GmbH",
      "company_seat": "Hamburg",
      "details": "17.11.2025 (Bekanntmachungsdatum)\n\nHamburg Amtsgericht Hamburg HRB 54527\nRegisterbekanntmachung nach dem Umwandlungsgesetz 17.11.2025 (Eintragungsdatum)\n\nNeu Seeschiffahrt GmbH\nGesellschaft mit beschränkter Haftung\nHamburg\n\nAls nicht eingetragen wird bekannt gemacht:\nDen Gläubigern der an der Verschmelzung beteiligten Gesellschaften ist, wenn sie binnen sechs Monaten nach dem Tag, an dem die Eintragung der Verschmelzung in das Register des Sitzes desjenigen Rechtsträgers, dessen Gläubiger sie sind, nach § 19 Absatz 3 UmwG als bekannt gemacht gilt, ihren Anspruch nach Grund und Höhe schriftlich anmelden, Sicherheit zu leisten, soweit sie nicht Befriedigung verlangen können. Dieses Recht steht den Gläubigern jedoch nur zu, wenn sie glaubhaft machen, dass durch die Verschmelzung die Erfüllung ihrer Forderung gefährdet wird."
    },
    {
      "date": "2025-11-17",
      "id": "137463",
      "original_text": "Registerbekanntmachung nach dem Umwandlungsgesetz\nMecklenburg-Vorpommern Amtsgericht Stralsund HRA 20972\nSicco-App Sebastian Hünnekens e.K. – Sundhagen",
      "type": "Registerbekanntmachung nach dem Umwandlungsgesetz",
      "state": "Mecklenburg-Vorpommern",
      "amtsgericht": "Amtsgericht Stralsund",
      "registernummer": "HRA 20972",
      "registerart": "HRA",
      "company_name": "Sicco-App Sebastian Hünnekens e.K.",
      "company_seat": "Sundhagen",
      "details": "17.11.2025 (Bekanntmachungsdatum)\n\nMecklenburg-Vorpommern Amtsgericht Stralsund HRA 20972\nRegisterbekanntmachung nach dem Umwandlungsgesetz 17.11.2025 (Eintragungsdatum)\n\nSicco-App Sebastian Hünnekens e.K.\nEinzelkaufmann / Einzelkauffrau\nSundhagen\n\nAls nicht eingetragen wird veröffentlicht: Den Gläubigern der an der Ausgliederung beteiligten Rechtsträger ist, wenn sie binnen sechs Monaten nach dem Tag, an dem die Eintragung der Ausgliederung in das Register des Sitzes desjenigen Rechtsträgers, dessen Gläubiger sie sind, nach § 19 Abs. 3 UmwG als bekannt gemacht gilt, ihren Anspruch nach Grund und Höhe in Textform anmelden,\nSicherheit zu leisten, soweit sie nicht Befriedigung verlangen können. Dieses Recht steht den Gläubigern jedoch nur zu, wenn sie glaubhaft machen, dass durch die Ausgliederung die Erfüllung der Forderung gefährdet wird."
    },
    {
      "date": "2025-11-17",
      "id": "137464",
      "original_text": "Registerbekanntmachung nach dem Umwandlungsgesetz\nMecklenburg-Vorpommern Amtsgericht Stralsund HRB 23019\nSicco-App GmbH – Sundhagen",
      "type": "Registerbekanntmachung nach dem Umwandlungsgesetz",
      "state": "Mecklenburg-Vorpommern",
      "amtsgericht": "Amtsgericht Stralsund",
      "registernummer": "HRB 23019",
      "registerart": "HRB",
      "company_name": "Sicco-App GmbH",
      "company_seat": "Sundhagen",
      "details": "17.11.2025 (Bekanntmachungsdatum)\n\nMecklenburg-Vorpommern Amtsgericht Stralsund HRB 23019\nRegisterbekanntmachung nach dem Umwandlungsgesetz 17.11.2025 (Eintragungsdatum)\n\nSicco-App GmbH\nGesellschaft mit beschränkter Haftung\nSundhagen\n\nAls nicht eingetragen wird veröffentlicht: Den Gläubigern der an der Ausgliederung beteiligten Rechtsträger ist, wenn sie binnen sechs Monaten nach dem Tag, an dem die Eintragung der Ausgliederung in das Register des Sitzes desjenigen Rechtsträgers, dessen Gläubiger sie sind, nach § 19 Abs. 3 UmwG als bekannt gemacht gilt, ihren Anspruch nach Grund und Höhe in Textform anmelden,\nSicherheit zu leisten, soweit sie nicht Befriedigung verlangen können. Dieses Recht steht den Gläubigern jedoch nur zu, wenn sie glaubhaft machen, dass durch die Ausgliederung die Erfüllung der Forderung gefährdet wird."
    },
    {
      "date": "2025-11-17",
      "id": "137465",
      "original_text": "Registerbekanntmachung nach dem Umwandlungsgesetz\nBerlin Amtsgericht Berlin (Charlottenburg) HRB 239329\nClark Holding SE – Berlin",
      "type": "Registerbekanntmachung nach dem Umwandlungsgesetz",
      "state": "Berlin",
      "amtsgericht": "Amtsgericht Berlin (Charlottenburg)",
      "registernummer": "HRB 239329",
      "registerart": "HRB",
      "company_name": "Clark Holding SE",
      "company_seat": "Berlin",
      "details": "17.11.2025 (Bekanntmachungsdatum)\n\nBerlin Amtsgericht Berlin (Charlottenburg) HRB 239329\nRegisterbekanntmachung nach dem Umwandlungsgesetz 27.10.2025 (Eintragungsdatum)\n\nClark Holding SE\nEuropäische Aktiengesellschaft (SE)\nBerlin\n\nAls nicht eingetragen wird veröffentlicht: Die Gesellschaft hat einen Verschmelzungsvertrag bzw. den Entwurf eines Verschmelzungsvertrages gem. § 61 UmwG zum Handelsregister eingereicht."
    },
    {
      "date": "2025-11-17",
      "id": "137466",
      "original_text": "Sonstige Registerbekanntmachung\nHamburg Amtsgericht Hamburg HRB 73071\nAlbis Leasing AG – Hamburg",
      "type": "Sonstige Registerbekanntmachung",
      "state": "Hamburg",
      "amtsgericht": "Amtsgericht Hamburg",
      "registernummer": "HRB 73071",
      "registerart": "HRB",
      "company_name": "Albis Leasing AG",
      "company_seat": "Hamburg",
      "details": "17.11.2025 (Bekanntmachungsdatum)\n\nHamburg Amtsgericht Hamburg HRB 73071\nSonstige Registerbekanntmachung\n\nAlbis Leasing AG\nAktiengesellschaft\nHamburg\n\nAls nicht eingetragen wird bekannt gemacht: Liste des Aufsichtsrats wurde eingereicht."
    },
    {
      "date": "2025-11-17",
      "id": "137467",
      "original_text": "Löschungsankündigung\nBerlin Amtsgericht Berlin (Charlottenburg) HRB 191039\nRocket Trade & Logistics GmbH – Berlin",
      "type": "Löschungsankündigung",
      "state": "Berlin",
      "amtsgericht": "Amtsgericht Berlin (Charlottenburg)",
      "registernummer": "HRB 191039",
      "registerart": "HRB",
      "company_name": "Rocket Trade & Logistics GmbH",
      "company_seat": "Berlin",
      "details": "17.11.2025 (Bekanntmachungsdatum)\n\nBerlin Amtsgericht Berlin (Charlottenburg) HRB 191039\nLöschungsankündigung\n\nRocket Trade & Logistics GmbH\nGesellschaft mit beschränkter Haftung\nBerlin\n\nBei der nachstehenden Gesellschaft wird das Amtslöschungsverfahren gemäß § 394 FamFG eingeleitet. Widerspruchsfrist 6 Wochen"
    },
    {
      "date": "2025-11-17",
      "id": "137468",
      "original_text": "Löschungsankündigung\nBerlin Amtsgericht Berlin (Charlottenburg) HRB 227693\nD.A.G. Holding UG (haftungsbeschränkt) – Berlin",
      "type": "Löschungsankündigung",
      "state": "Berlin",
      "amtsgericht": "Amtsgericht Berlin (Charlottenburg)",
      "registernummer": "HRB 227693",
      "registerart": "HRB",
      "company_name": "D.A.G. Holding UG (haftungsbeschränkt)",
      "company_seat": "Berlin",
      "details": "17.11.2025 (Bekanntmachungsdatum)\n\nBerlin Amtsgericht Berlin (Charlottenburg) HRB 227693\nLöschungsankündigung\n\nD.A.G. Holding UG (haftungsbeschränkt)\nGesellschaft mit beschränkter Haftung\nBerlin\n\nBei der nachstehenden Gesellschaft wird das Amtslöschungsverfahren gemäß § 394 FamFG eingeleitet. Widerspruchsfrist 6 Wochen"
    },
    {
      "date": "2025-11-17",
      "id": "137469",
      "original_text": "Löschungsankündigung\nSaarland Amtsgericht Saarbrücken HRB 105597\nSpengler Tf-Training & Monitoring UG (haftungsbeschränkt) – Lebach",
      "type": "Löschungsankündigung",
      "state": "Saarland",
      "amtsgericht": "Amtsgericht Saarbrücken",
      "registernummer": "HRB 105597",
      "registerart": "HRB",
      "company_name": "Spengler Tf-Training & Monitoring UG (haftungsbeschränkt)",
      "company_seat": "Lebach",
      "details": "17.11.2025 (Bekanntmachungsdatum)\n\nSaarland Amtsgericht Saarbrücken HRB 105597\nLöschungsankündigung\n\nSpengler Tf-Training & Monitoring UG (haftungsbeschränkt)\nGesellschaft mit beschränkter Haftung\nLebach\n\nEs ist beabsichtigt, die Gesellschaft von Amts wegen gemäß § 394 FamFG wegen Vermögenslosigkeit zu löschen. Gegen die Löschung von Amts wegen ist das Rechtsmittel des Widerspruchs statthaft. Der Widerspruch ist binnen einer Frist von 3 Monaten beginnend mit dem Tag dieser Veröffentlichung durch Einreichen eines Widerspruchsschreibens -schriftlich oder zur Niederschrift der Geschäftsstelle- beim Amtsgericht Saarbrücken, -zentrales Handelsregister-, Mainzerstr.178, 66121 Saarbrücken einzulegen. Der Widerspruch muss die Bezeichnung der angefochtenen Löschungsankündigung enthalten sowie die Erklärung, dass Widerspruch eingelegt wird. Er ist vom Widerspruchsführer oder seinem Bevollmächtigten zu unterzeichnen.\nDas Widerspruchsschreiben kann auch in der Form eines elektronischen Dokumentes eingereicht werden, das mit einer qualifizierten elektronischen Signatur nach dem Signaturgesetz versehen sein muss (§§ 14 Abs. 2 FamFG, 130a, 298 ZPO)."
    },
    {
      "date": "2025-11-17",
      "id": "137470",
      "original_text": "Einreichung neuer Dokumente\nHamburg Amtsgericht Hamburg HRB 171600\nHHLA Next GmbH – Hamburg",
      "type": "Einreichung neuer Dokumente",
      "state": "Hamburg",
      "amtsgericht": "Amtsgericht Hamburg",
      "registernummer": "HRB 171600",
      "registerart": "HRB",
      "company_name": "HHLA Next GmbH",
      "company_seat": "Hamburg",
      "details": "17.11.2025 (Bekanntmachungsdatum)\n\nHamburg Amtsgericht Hamburg HRB 171600\nEinreichung neuer Dokumente\n\nHHLA Next GmbH\nGesellschaft mit beschränkter Haftung\nHamburg\n\nAls nicht eingetragen wird bekannt gemacht: Liste des Aufsichtsrats wurde eingereicht."
    },
    {
      "date": "2025-11-17",
      "id": "137471",
      "original_text": "Registerbekanntmachung nach dem Umwandlungsgesetz\nHamburg Amtsgericht Hamburg HRB 13270\nCARISSA Verwaltungsgesellschaft mbH – Hamburg",
      "type": "Registerbekanntmachung nach dem Umwandlungsgesetz",
      "state": "Hamburg",
      "amtsgericht": "Amtsgericht Hamburg",
      "registernummer": "HRB 13270",
      "registerart": "HRB",
      "company_name": "CARISSA Verwaltungsgesellschaft mbH",
      "company_seat": "Hamburg",
      "details": "17.11.2025 (Bekanntmachungsdatum)\n\nHamburg Amtsgericht Hamburg HRB 13270\nRegisterbekanntmachung nach dem Umwandlungsgesetz 17.11.2025 (Eintragungsdatum)\n\nCARISSA Verwaltungsgesellschaft mbH\nGesellschaft mit beschränkter Haftung\nHamburg\n\nAls nicht eingetragen wird bekannt gemacht:\nDen Gläubigern der an der Verschmelzung beteiligten Gesellschaften ist, wenn sie binnen sechs Monaten nach dem Tag, an dem die Eintragung der Verschmelzung in das Register des Sitzes desjenigen Rechtsträgers, dessen Gläubiger sie sind, nach § 19 Absatz 3 UmwG als bekannt gemacht gilt, ihren Anspruch nach Grund und Höhe schriftlich anmelden, Sicherheit zu leisten, soweit sie nicht Befriedigung verlangen können. Dieses Recht steht den Gläubigern jedoch nur zu, wenn sie glaubhaft machen, dass durch die Verschmelzung die Erfüllung ihrer Forderung gefährdet wird."
    },
    {
      "date": "2025-11-17",
      "id": "137472",
      "original_text": "Registerbekanntmachung nach dem Umwandlungsgesetz\nHamburg Amtsgericht Hamburg HRB 13270\nCARISSA Verwaltungsgesellschaft mbH – Hamburg",
      "type": "Registerbekanntmachung nach dem Umwandlungsgesetz",
      "state": "Hamburg",
      "amtsgericht": "Amtsgericht Hamburg",
      "registernummer": "HRB 13270",
      "registerart": "HRB",
      "company_name": "CARISSA Verwaltungsgesellschaft mbH",
      "company_seat": "Hamburg",
      "details": "17.11.2025 (Bekanntmachungsdatum)\n\nHamburg Amtsgericht Hamburg HRB 13270\nRegisterbekanntmachung nach dem Umwandlungsgesetz 17.11.2025 (Eintragungsdatum)\n\nCARISSA Verwaltungsgesellschaft mbH\nGesellschaft mit beschränkter Haftung\nHamburg\n\nAls nicht eingetragen wird bekannt gemacht:\nDen Gläubigern der an der Verschmelzung beteiligten Gesellschaften ist, wenn sie binnen sechs Monaten nach dem Tag, an dem die Eintragung der Verschmelzung in das Register des Sitzes desjenigen Rechtsträgers, dessen Gläubiger sie sind, nach § 19 Absatz 3 UmwG als bekannt gemacht gilt, ihren Anspruch nach Grund und Höhe schriftlich anmelden, Sicherheit zu leisten, soweit sie nicht Befriedigung verlangen können. Dieses Recht steht den Gläubigern jedoch nur zu, wenn sie glaubhaft machen, dass durch die Verschmelzung die Erfüllung ihrer Forderung gefährdet wird."
    },
    {
      "date": "2025-11-17",
      "id": "137473",
      "original_text": "Registerbekanntmachung nach dem Umwandlungsgesetz\nHamburg Amtsgericht Hamburg HRB 186629\nCARISSA GmbH – Hamburg",
      "type": "Registerbekanntmachung nach dem Umwandlungsgesetz",
      "state": "Hamburg",
      "amtsgericht": "Amtsgericht Hamburg",
      "registernummer": "HRB 186629",
      "registerart": "HRB",
      "company_name": "CARISSA GmbH",
      "company_seat": "Hamburg",
      "details": "17.11.2025 (Bekanntmachungsdatum)\n\nHamburg Amtsgericht Hamburg HRB 186629\nRegisterbekanntmachung nach dem Umwandlungsgesetz 17.11.2025 (Eintragungsdatum)\n\nCARISSA GmbH\nGesellschaft mit beschränkter Haftung\nHamburg\n\nAls nicht eingetragen wird bekannt gemacht:\nDen Gläubigern der an der Verschmelzung beteiligten Gesellschaften ist, wenn sie binnen sechs Monaten nach dem Tag, an dem die Eintragung der Verschmelzung in das Register des Sitzes desjenigen Rechtsträgers, dessen Gläubiger sie sind, nach § 19 Absatz 3 UmwG als bekannt gemacht gilt, ihren Anspruch nach Grund und Höhe schriftlich anmelden, Sicherheit zu leisten, soweit sie nicht Befriedigung verlangen können. Dieses Recht steht den Gläubigern jedoch nur zu, wenn sie glaubhaft machen, dass durch die Verschmelzung die Erfüllung ihrer Forderung gefährdet wird."
    },
    {
      "date": "2025-11-17",
      "id": "137474",
      "original_text": "Löschungsankündigung\nBerlin Amtsgericht Berlin (Charlottenburg) HRB 272699\nARLC Lektorat & Copyediting UG (haftungsbeschränkt) – Berlin",
      "type": "Löschungsankündigung",
      "state": "Berlin",
      "amtsgericht": "Amtsgericht Berlin (Charlottenburg)",
      "registernummer": "HRB 272699",
      "registerart": "HRB",
      "company_name": "ARLC Lektorat & Copyediting UG (haftungsbeschränkt)",
      "company_seat": "Berlin",
      "details": "17.11.2025 (Bekanntmachungsdatum)\n\nBerlin Amtsgericht Berlin (Charlottenburg) HRB 272699\nLöschungsankündigung\n\nARLC Lektorat & Copyediting UG (haftungsbeschränkt)\nGesellschaft mit beschränkter Haftung\nBerlin\n\nBei der nachstehenden Gesellschaft wird das Amtslöschungsverfahren gemäß § 394 FamFG eingeleitet. Widerspruchsfrist 6 Wochen"
    },
    {
      "date": "2025-11-17",
      "id": "137475",
      "original_text": "Registerbekanntmachung nach dem Umwandlungsgesetz\nBaden-Württemberg Amtsgericht Stuttgart HRB 750476\nUntis Baden-Württemberg GmbH – Gerlingen",
      "type": "Registerbekanntmachung nach dem Umwandlungsgesetz",
      "state": "Baden-Württemberg",
      "amtsgericht": "Amtsgericht Stuttgart",
      "registernummer": "HRB 750476",
      "registerart": "HRB",
      "company_name": "Untis Baden-Württemberg GmbH",
      "company_seat": "Gerlingen",
      "details": "17.11.2025 (Bekanntmachungsdatum)\n\nBaden-Württemberg Amtsgericht Stuttgart HRB 750476\nRegisterbekanntmachung nach dem Umwandlungsgesetz 17.11.2025 (Eintragungsdatum)\n\nUntis Baden-Württemberg GmbH\nGesellschaft mit beschränkter Haftung\nGerlingen\n\nAls nicht eingetragen wird bekanntgemacht:\nDen Gläubigern der an der grenzübergreifenden Verschmelzung beteiligten Rechtsträger ist, wenn sie binnen sechs Monaten nach dem Tag, an dem die Eintragung der Verschmelzung in das Register des Sitzes desjenigen Rechtsträgers, dessen Gläubiger sie sind, nach § 19 Abs. 3 UmwG als bekanntgemacht gilt, ihren Anspruch nach Grund und Höhe schriftlich anmelden, Sicherheit zu leisten, soweit sie nicht Befriedigung verlangen können. Dieses Recht steht den Gläubigern jedoch nur zu, wenn sie glaubhaft machen, dass durch die Verschmelzung die Erfüllung ihrer Forderung gefährdet wird."
    },
    {
      "date": "2025-11-17",
      "id": "137476",
      "original_text": "Einreichung neuer Dokumente\nHamburg Amtsgericht Hamburg HRB 19372\nHHLA International GmbH – Hamburg",
      "type": "Einreichung neuer Dokumente",
      "state": "Hamburg",
      "amtsgericht": "Amtsgericht Hamburg",
      "registernummer": "HRB 19372",
      "registerart": "HRB",
      "company_name": "HHLA International GmbH",
      "company_seat": "Hamburg",
      "details": "17.11.2025 (Bekanntmachungsdatum)\n\nHamburg Amtsgericht Hamburg HRB 19372\nEinreichung neuer Dokumente\n\nHHLA International GmbH\nGesellschaft mit beschränkter Haftung\nHamburg\n\nAls nicht eingetragen wird bekannt gemacht: Liste des Aufsichtsrats wurde eingereicht."
    },
    {
      "date": "2025-11-17",
      "id": "137477",
      "original_text": "Registerbekanntmachung nach dem Umwandlungsgesetz\nBaden-Württemberg Amtsgericht Stuttgart HRB 763453\nNY Automaten GmbH – Vaihingen an der Enz",
      "type": "Registerbekanntmachung nach dem Umwandlungsgesetz",
      "state": "Baden-Württemberg",
      "amtsgericht": "Amtsgericht Stuttgart",
      "registernummer": "HRB 763453",
      "registerart": "HRB",
      "company_name": "NY Automaten GmbH",
      "company_seat": "Vaihingen an der Enz",
      "details": "17.11.2025 (Bekanntmachungsdatum)\n\nBaden-Württemberg Amtsgericht Stuttgart HRB 763453\nRegisterbekanntmachung nach dem Umwandlungsgesetz 17.11.2025 (Eintragungsdatum)\n\nNY Automaten GmbH\nGesellschaft mit beschränkter Haftung\nVaihingen an der Enz\n\nAls nicht eingetragen wird bekanntgemacht:\nDen Gläubigern der an der Ausgliederung beteiligten Rechtsträger ist, wenn sie binnen sechs Monaten nach dem Tag, an dem die Eintragung der Ausgliederung in das Register des Sitzes desjenigen Rechtsträgers, dessen Gläubiger sie sind, nach § 19 Abs. 3 UmwG als bekanntgemacht gilt, ihren Anspruch nach Grund und Höhe schriftlich anmelden, Sicherheit zu leisten, soweit sie nicht Befriedigung verlangen können. Dieses Recht steht den Gläubigern jedoch nur zu, wenn sie glaubhaft machen, dass durch die Ausgliederung die Erfüllung ihrer Forderung gefährdet wird."
    },
    {
      "date": "2025-11-17",
      "id": "137478",
      "original_text": "Löschungsankündigung\nBerlin Amtsgericht Berlin (Charlottenburg) HRB 143623\nBERKAZ GmbH – Berlin",
      "type": "Löschungsankündigung",
      "state": "Berlin",
      "amtsgericht": "Amtsgericht Berlin (Charlottenburg)",
      "registernummer": "HRB 143623",
      "registerart": "HRB",
      "company_name": "BERKAZ GmbH",
      "company_seat": "Berlin",
      "details": "17.11.2025 (Bekanntmachungsdatum)\n\nBerlin Amtsgericht Berlin (Charlottenburg) HRB 143623\nLöschungsankündigung\n\nBERKAZ GmbH\nGesellschaft mit beschränkter Haftung\nBerlin\n\nBei der nachstehenden Gesellschaft wird das Amtslöschungsverfahren gemäß § 394 FamFG eingeleitet. Widerspruchsfrist 6 Wochen"
    },
    {
      "date": "2025-11-17",
      "id": "137479",
      "original_text": "Löschungsankündigung\nHamburg Amtsgericht Hamburg HRA 117621\nVierte MLB Bulktransport GmbH & Co. KG – Hamburg",
      "type": "Löschungsankündigung",
      "state": "Hamburg",
      "amtsgericht": "Amtsgericht Hamburg",
      "registernummer": "HRA 117621",
      "registerart": "HRA",
      "company_name": "Vierte MLB Bulktransport GmbH & Co. KG",
      "company_seat": "Hamburg",
      "details": "17.11.2025 (Bekanntmachungsdatum)\n\nHamburg Amtsgericht Hamburg HRA 117621\nLöschungsankündigung\n\nVierte MLB Bulktransport GmbH & Co. KG\nKommanditgesellschaft\nHamburg\n\nDas Registergericht beabsichtigt, die im Handelsregister eingetragene Firma von Amts wegen nach § 31 Abs. 2 HBG zu löschen. Die Frist zur Erhebung eines Widerspruchs gegen die beabsichtigte Löschung wird auf 3 Monate festgesetzt."
    },
    {
      "date": "2025-11-17",
      "id": "137480",
      "original_text": "Löschungsankündigung\nHamburg Amtsgericht Hamburg HRA 121735\nTŌRNQVIST e.K. – Hamburg",
      "type": "Löschungsankündigung",
      "state": "Hamburg",
      "amtsgericht": "Amtsgericht Hamburg",
      "registernummer": "HRA 121735",
      "registerart": "HRA",
      "company_name": "TŌRNQVIST e.K.",
      "company_seat": "Hamburg",
      "details": "17.11.2025 (Bekanntmachungsdatum)\n\nHamburg Amtsgericht Hamburg HRA 121735\nLöschungsankündigung\n\nTŌRNQVIST e.K.\nEinzelkaufmann\nHamburg\n\nDas Registergericht beabsichtigt, die im Handelsregister eingetragene Firma von Amts wegen nach § 31 Abs. 2 HBG zu löschen. Die Frist zur Erhebung eines Widerspruchs gegen die beabsichtigte Löschung wird auf 3 Monate festgesetzt."
    },
    {
      "date": "2025-11-17",
      "id": "137481",
      "original_text": "Löschungsankündigung\nHamburg Amtsgericht Hamburg HRA 117622\nZweite MLB Bulktransport GmbH & Co. KG – Hamburg",
      "type": "Löschungsankündigung",
      "state": "Hamburg",
      "amtsgericht": "Amtsgericht Hamburg",
      "registernummer": "HRA 117622",
      "registerart": "HRA",
      "company_name": "Zweite MLB Bulktransport GmbH & Co. KG",
      "company_seat": "Hamburg",
      "details": "17.11.2025 (Bekanntmachungsdatum)\n\nHamburg Amtsgericht Hamburg HRA 117622\nLöschungsankündigung\n\nZweite MLB Bulktransport GmbH & Co. KG\nKommanditgesellschaft\nHamburg\n\nDas Registergericht beabsichtigt, die im Handelsregister eingetragene Firma von Amts wegen nach § 31 Abs. 2 HBG zu löschen. Die Frist zur Erhebung eines Widerspruchs gegen die beabsichtigte Löschung wird auf 3 Monate festgesetzt."
    },
    {
      "date": "2025-11-17",
      "id": "137482",
      "original_text": "Löschungsankündigung\nHamburg Amtsgericht Hamburg HRB 146007\nWarnecke Media GmbH – Hamburg",
      "type": "Löschungsankündigung",
      "state": "Hamburg",
      "amtsgericht": "Amtsgericht Hamburg",
      "registernummer": "HRB 146007",
      "registerart": "HRB",
      "company_name": "Warnecke Media GmbH",
      "company_seat": "Hamburg",
      "details": "17.11.2025 (Bekanntmachungsdatum)\n\nHamburg Amtsgericht Hamburg HRB 146007\nLöschungsankündigung\n\nWarnecke Media GmbH\nGesellschaft mit beschränkter Haftung\nHamburg\n\nDas Registergericht beabsichtigt, die im Handelsregister eingetragene Gesellschaft von Amts wegen nach § 394 FamFG zu löschen. Die Frist zur Erhebung eines Widerspruchs gegen die beabsichtigte Löschung wird auf 3 Monate festgesetzt."
    },
    {
      "date": "2025-11-17",
      "id": "137483",
      "original_text": "Löschungsankündigung\nHamburg Amtsgericht Hamburg HRB 169119\nButera Eats GmbH – Hamburg",
      "type": "Löschungsankündigung",
      "state": "Hamburg",
      "amtsgericht": "Amtsgericht Hamburg",
      "registernummer": "HRB 169119",
      "registerart": "HRB",
      "company_name": "Butera Eats GmbH",
      "company_seat": "Hamburg",
      "details": "17.11.2025 (Bekanntmachungsdatum)\n\nHamburg Amtsgericht Hamburg HRB 169119\nLöschungsankündigung\n\nButera Eats GmbH\nGesellschaft mit beschränkter Haftung\nHamburg\n\nDas Löschungsverfahren ist eingestellt."
    },
    {
      "date": "2025-11-17",
      "id": "137484",
      "original_text": "Löschungsankündigung\nHamburg Amtsgericht Hamburg HRA 85081\nJürgen Fenner, Interieur-Küchen – Hamburg",
      "type": "Löschungsankündigung",
      "state": "Hamburg",
      "amtsgericht": "Amtsgericht Hamburg",
      "registernummer": "HRA 85081",
      "registerart": "HRA",
      "company_name": "Jürgen Fenner, Interieur-Küchen",
      "company_seat": "Hamburg",
      "details": "17.11.2025 (Bekanntmachungsdatum)\n\nHamburg Amtsgericht Hamburg HRA 85081\nLöschungsankündigung\n\nJürgen Fenner, Interieur-Küchen\nEinzelkaufmann\nHamburg\n\nDas Registergericht beabsichtigt, die im Handelsregister eingetragene Firma von Amts wegen nach § 31 Abs. 2 HBG zu löschen. Die Frist zur Erhebung eines Widerspruchs gegen die beabsichtigte Löschung wird auf 3 Monate festgesetzt."
    },
    {
      "date": "2025-11-17",
      "id": "137485",
      "original_text": "Löschungsankündigung\nHamburg Amtsgericht Hamburg HRA 109302\nAMHE Administration for Medical Help in Europe EWIV – Hamburg",
      "type": "Löschungsankündigung",
      "state": "Hamburg",
      "amtsgericht": "Amtsgericht Hamburg",
      "registernummer": "HRA 109302",
      "registerart": "HRA",
      "company_name": "AMHE Administration for Medical Help in Europe EWIV",
      "company_seat": "Hamburg",
      "details": "17.11.2025 (Bekanntmachungsdatum)\n\nHamburg Amtsgericht Hamburg HRA 109302\nLöschungsankündigung\n\nAMHE Administration for Medical Help in Europe EWIV\nEuropäische wirtschaftliche Interessenvereinigung\nHamburg\n\nDas Registergericht beabsichtigt, die im Handelsregister eingetragene Firma von Amts wegen nach § 31 Abs. 2 HBG zu löschen. Die Frist zur Erhebung eines Widerspruchs gegen die beabsichtigte Löschung wird auf 3 Monate festgesetzt."
    },
    {
      "date": "2025-11-17",
      "id": "137486",
      "original_text": "Löschungsankündigung\nHamburg Amtsgericht Hamburg HRA 116718\nME MU Montage von Planen und Netzen GmbH & Co. KG – Hamburg",
      "type": "Löschungsankündigung",
      "state": "Hamburg",
      "amtsgericht": "Amtsgericht Hamburg",
      "registernummer": "HRA 116718",
      "registerart": "HRA",
      "company_name": "ME MU Montage von Planen und Netzen GmbH & Co. KG",
      "company_seat": "Hamburg",
      "details": "17.11.2025 (Bekanntmachungsdatum)\n\nHamburg Amtsgericht Hamburg HRA 116718\nLöschungsankündigung\n\nME MU Montage von Planen und Netzen GmbH & Co. KG\nKommanditgesellschaft\nHamburg\n\nDas Registergericht beabsichtigt, die im Handelsregister eingetragene Gesellschaft von Amts wegen nach § 394 FamFG zu löschen. Die Frist zur Erhebung eines Widerspruchs gegen die beabsichtigte Löschung wird auf 3 Monate festgesetzt."
    },
    {
      "date": "2025-11-17",
      "id": "137487",
      "original_text": "Löschungsankündigung\nHamburg Amtsgericht Hamburg HRB 159172\nEnigma Hamburg GmbH – Hamburg",
      "type": "Löschungsankündigung",
      "state": "Hamburg",
      "amtsgericht": "Amtsgericht Hamburg",
      "registernummer": "HRB 159172",
      "registerart": "HRB",
      "company_name": "Enigma Hamburg GmbH",
      "company_seat": "Hamburg",
      "details": "17.11.2025 (Bekanntmachungsdatum)\n\nHamburg Amtsgericht Hamburg HRB 159172\nLöschungsankündigung\n\nEnigma Hamburg GmbH\nGesellschaft mit beschränkter Haftung\nHamburg\n\nDas Registergericht beabsichtigt, die im Handelsregister eingetragene Gesellschaft von Amts wegen nach § 394 FamFG zu löschen. Die Frist zur Erhebung eines Widerspruchs gegen die beabsichtigte Löschung wird auf 3 Monate festgesetzt."
    },
    {
      "date": "2025-11-17",
      "id": "137488",
      "original_text": "Löschungsankündigung\nHamburg Amtsgericht Hamburg HRB 175229\nEmergya Wind Technologies Deutschland GmbH – Hamburg",
      "type": "Löschungsankündigung",
      "state": "Hamburg",
      "amtsgericht": "Amtsgericht Hamburg",
      "registernummer": "HRB 175229",
      "registerart": "HRB",
      "company_name": "Emergya Wind Technologies Deutschland GmbH",
      "company_seat": "Hamburg",
      "details": "17.11.2025 (Bekanntmachungsdatum)\n\nHamburg Amtsgericht Hamburg HRB 175229\nLöschungsankündigung\n\nEmergya Wind Technologies Deutschland GmbH\nGesellschaft mit beschränkter Haftung\nHamburg\n\nDas Registergericht beabsichtigt, die im Handelsregister eingetragene Gesellschaft von Amts wegen nach § 394 FamFG zu löschen. Die Frist zur Erhebung eines Widerspruchs gegen die beabsichtigte Löschung wird auf 3 Monate festgesetzt."
    },
    {
      "date": "2025-11-17",
      "id": "137489",
      "original_text": "Löschungsankündigung\nHamburg Amtsgericht Hamburg HRA 105641\nMS \"Fürth\" Schiffseigentums GmbH & Co. KG – Hamburg",
      "type": "Löschungsankündigung",
      "state": "Hamburg",
      "amtsgericht": "Amtsgericht Hamburg",
      "registernummer": "HRA 105641",
      "registerart": "HRA",
      "company_name": "MS \"Fürth\" Schiffseigentums GmbH & Co. KG",
      "company_seat": "Hamburg",
      "details": "17.11.2025 (Bekanntmachungsdatum)\n\nHamburg Amtsgericht Hamburg HRA 105641\nLöschungsankündigung\n\nMS \"Fürth\" Schiffseigentums GmbH & Co. KG\nKommanditgesellschaft\nHamburg\n\nDas Registergericht beabsichtigt, die im Handelsregister eingetragene Firma von Amts wegen nach § 31 Abs. 2 HBG zu löschen. Die Frist zur Erhebung eines Widerspruchs gegen die beabsichtigte Löschung wird auf 3 Monate festgesetzt."
    },
    {
      "date": "2025-11-17",
      "id": "137490",
      "original_text": "Löschungsankündigung\nHamburg Amtsgericht Hamburg HRA 116362\nCore Artist Management UG (haftungsbeschränkt) & Co. KG – Hamburg",
      "type": "Löschungsankündigung",
      "state": "Hamburg",
      "amtsgericht": "Amtsgericht Hamburg",
      "registernummer": "HRA 116362",
      "registerart": "HRA",
      "company_name": "Core Artist Management UG (haftungsbeschränkt) & Co. KG",
      "company_seat": "Hamburg",
      "details": "17.11.2025 (Bekanntmachungsdatum)\n\nHamburg Amtsgericht Hamburg HRA 116362\nLöschungsankündigung\n\nCore Artist Management UG (haftungsbeschränkt) & Co. KG\nKommanditgesellschaft\nHamburg\n\nDas Registergericht beabsichtigt, die im Handelsregister eingetragene Firma von Amts wegen nach § 31 Abs. 2 HBG zu löschen. Die Frist zur Erhebung eines Widerspruchs gegen die beabsichtigte Löschung wird auf 3 Monate festgesetzt."
    },
    {
      "date": "2025-11-17",
      "id": "137491",
      "original_text": "Löschungsankündigung\nThüringen Amtsgericht Jena HRB 520393\nHM-Bau GmbH – Erfurt",
      "type": "Löschungsankündigung",
      "state": "Thüringen",
      "amtsgericht": "Amtsgericht Jena",
      "registernummer": "HRB 520393",
      "registerart": "HRB",
      "company_name": "HM-Bau GmbH",
      "company_seat": "Erfurt",
      "details": "17.11.2025 (Bekanntmachungsdatum)\n\nThüringen Amtsgericht Jena HRB 520393\nLöschungsankündigung\n\nHM-Bau GmbH\nGesellschaft mit beschränkter Haftung\nErfurt\n\nDas Registergericht beabsichtigt, die im Handelsregister eingetragene Gesellschaft wegen Vermögenslosigkeit nach § 394 FamFG von Amts wegen zu löschen. Die Frist zur Erhebung eines Widerspruchs gegen die beabsichtigte Löschung wird auf 6 Wochen festgesetzt."
    },
    {
      "date": "2025-11-17",
      "id": "137492",
      "original_text": "Löschungsankündigung\nThüringen Amtsgericht Jena HRB 508824\nIbishi Eisenflechterei Unternehmergesellschaft (haftungsbeschränkt) – Gotha",
      "type": "Löschungsankündigung",
      "state": "Thüringen",
      "amtsgericht": "Amtsgericht Jena",
      "registernummer": "HRB 508824",
      "registerart": "HRB",
      "company_name": "Ibishi Eisenflechterei Unternehmergesellschaft (haftungsbeschränkt)",
      "company_seat": "Gotha",
      "details": "17.11.2025 (Bekanntmachungsdatum)\n\nThüringen Amtsgericht Jena HRB 508824\nLöschungsankündigung\n\nIbishi Eisenflechterei Unternehmergesellschaft (haftungsbeschränkt)\nGesellschaft mit beschränkter Haftung\nGotha\n\nDas Registergericht beabsichtigt, die im Handelsregister eingetragene Gesellschaft wegen Vermögenslosigkeit nach § 394 FamFG von Amts wegen zu löschen. Die Frist zur Erhebung eines Widerspruchs gegen die beabsichtigte Löschung wird auf 6 Wochen festgesetzt."
    },
    {
      "date": "2025-11-17",
      "id": "137493",
      "original_text": "Löschungsankündigung\nThüringen Amtsgericht Jena HRB 113983\nHEMAWE Fertigungstechnik GmbH – Erfurt",
      "type": "Löschungsankündigung",
      "state": "Thüringen",
      "amtsgericht": "Amtsgericht Jena",
      "registernummer": "HRB 113983",
      "registerart": "HRB",
      "company_name": "HEMAWE Fertigungstechnik GmbH",
      "company_seat": "Erfurt",
      "details": "17.11.2025 (Bekanntmachungsdatum)\n\nThüringen Amtsgericht Jena HRB 113983\nLöschungsankündigung\n\nHEMAWE Fertigungstechnik GmbH\nGesellschaft mit beschränkter Haftung\nErfurt\n\nDas Registergericht beabsichtigt, die im Handelsregister eingetragene Gesellschaft wegen Vermögenslosigkeit nach § 394 FamFG von Amts wegen zu löschen. Die Frist zur Erhebung eines Widerspruchs gegen die beabsichtigte Löschung wird auf 6 Wochen festgesetzt."
    },
    {
      "date": "2025-11-17",
      "id": "137494",
      "original_text": "Löschungsankündigung\nHamburg Amtsgericht Hamburg VR 14639\nSous- Section de RPG (Rassemblement du peuple de Guinée) á Hamburg (serpegham) e.V. – Hamburg",
      "type": "Löschungsankündigung",
      "state": "Hamburg",
      "amtsgericht": "Amtsgericht Hamburg",
      "registernummer": "VR 14639",
      "registerart": "VR",
      "company_name": "Sous- Section de RPG (Rassemblement du peuple de Guinée) á Hamburg (serpegham) e.V.",
      "company_seat": "Hamburg",
      "details": "17.11.2025 (Bekanntmachungsdatum)\n\nHamburg Amtsgericht Hamburg VR 14639\nLöschungsankündigung\n\nSous- Section de RPG (Rassemblement du peuple de Guinée) á Hamburg (serpegham) e.V.\neingetragener Verein\nHamburg\n\nDas Registergericht beabsichtigt, den im Vereinsregister eingetragenen Verein von Amts wegen nach § 395 FamFG zu löschen, da nach den angestellten  Ermittlungen dieser Verein offenbar nicht mehr besteht. Die Frist zur Erhebung eines Widerspruchs gegen die beabsichtigte Löschung wird auf 3 Monate festgesetzt."
    },
    {
      "date": "2025-11-17",
      "id": "137495",
      "original_text": "Löschungsankündigung\nHamburg Amtsgericht Hamburg VR 22291\nObjectif d'Afrique e.V. – Hamburg",
      "type": "Löschungsankündigung",
      "state": "Hamburg",
      "amtsgericht": "Amtsgericht Hamburg",
      "registernummer": "VR 22291",
      "registerart": "VR",
      "company_name": "Objectif d'Afrique e.V.",
      "company_seat": "Hamburg",
      "details": "17.11.2025 (Bekanntmachungsdatum)\n\nHamburg Amtsgericht Hamburg VR 22291\nLöschungsankündigung\n\nObjectif d'Afrique e.V.\neingetragener Verein\nHamburg\n\nDas Registergericht beabsichtigt, den im Vereinsregister eingetragenen Verein von Amts wegen nach § 395 FamFG zu löschen, da nach den angestellten  Ermittlungen dieser Verein offenbar nicht mehr besteht. Die Frist zur Erhebung eines Widerspruchs gegen die beabsichtigte Löschung wird auf 3 Monate festgesetzt."
    },
    {
      "date": "2025-11-17",
      "id": "137496",
      "original_text": "Sonstige Registerbekanntmachung\nSachsen-Anhalt Amtsgericht Stendal HRB 200030\nWohn- und Industriebau GmbH Weißenfels – Weißenfels",
      "type": "Sonstige Registerbekanntmachung",
      "state": "Sachsen-Anhalt",
      "amtsgericht": "Amtsgericht Stendal",
      "registernummer": "HRB 200030",
      "registerart": "HRB",
      "company_name": "Wohn- und Industriebau GmbH Weißenfels",
      "company_seat": "Weißenfels",
      "details": "17.11.2025 (Bekanntmachungsdatum)\n\nSachsen-Anhalt Amtsgericht Stendal HRB 200030\nSonstige Registerbekanntmachung\n\nWohn- und Industriebau GmbH Weißenfels\nGesellschaft mit beschränkter Haftung\nWeißenfels\n\nHinsichtlich der o.g. im Handelsregister am 15.08.2011 gelöschten Gesellschaft ist beabsichtigt, Herrn Rechtsanwalt Michael Knoch, dienstansässig Karl-Tauchnitz-Str. 10 in 04107 Leipzig zum Nachtragsliquidator mit  beschränktem Wirkungskreis zu bestellen.\nDer Antrag kann bei berechtigtem Interesse beim Registergericht Stendal eingesehen werden.\nDie Frist zu Einreichung etwaiger Stellungnahmen bzw. Erhebung eines Widerspruchs wird auf 1 Monat festgesetzt."
    },
    {
      "date": "2025-11-17",
      "id": "137497",
      "original_text": "Registerbekanntmachung nach dem Umwandlungsgesetz\nBerlin Amtsgericht Berlin (Charlottenburg) HRB 47871\nAntennendienst Norbert Wolff GmbH – Berlin",
      "type": "Registerbekanntmachung nach dem Umwandlungsgesetz",
      "state": "Berlin",
      "amtsgericht": "Amtsgericht Berlin (Charlottenburg)",
      "registernummer": "HRB 47871",
      "registerart": "HRB",
      "company_name": "Antennendienst Norbert Wolff GmbH",
      "company_seat": "Berlin",
      "details": "17.11.2025 (Bekanntmachungsdatum)\n\nBerlin Amtsgericht Berlin (Charlottenburg) HRB 47871\nRegisterbekanntmachung nach dem Umwandlungsgesetz 17.11.2025 (Eintragungsdatum)\n\nAntennendienst Norbert Wolff GmbH\nGesellschaft mit beschränkter Haftung\nBerlin\n\nZu Eintragungsnummer 6 vom 17.11.2025 wird als nicht eingetragen veröffentlicht: Den Gläubigern ist, wenn sie binnen sechs Monaten nach dem Tag, an dem die Eintragung der Umwandlung als bekannt gemacht gilt, ihren Anspruch nach Grund und Höhe schriftlich anmelden, Sicherheit zu leisten, soweit sie nicht Befriedigung verlangen können. Dieses Recht steht den Gläubigern jedoch nur zu, wenn sie glaubhaft machen, dass durch die Umwandlung die Erfüllung ihrer Forderung gefährdet wird. Das Recht, Sicherheitsleistung zu verlangen, steht Gläubigern nicht zu, die im Falle der Insolvenz ein Recht auf vorzugsweise Befriedigung aus einer Deckungsmasse haben, die nach gesetzlicher Vorschrift zu ihrem Schutz errichtet und staatlich überwacht ist."
    },
    {
      "date": "2025-11-17",
      "id": "137498",
      "original_text": "Einreichung neuer Dokumente\nBrandenburg Amtsgericht Neuruppin HRB 1043\nA.G.U. Agrargesellschaft Uckermark AG – Prenzlau",
      "type": "Einreichung neuer Dokumente",
      "state": "Brandenburg",
      "amtsgericht": "Amtsgericht Neuruppin",
      "registernummer": "HRB 1043",
      "registerart": "HRB",
      "company_name": "A.G.U. Agrargesellschaft Uckermark AG",
      "company_seat": "Prenzlau",
      "details": "17.11.2025 (Bekanntmachungsdatum)\n\nBrandenburg Amtsgericht Neuruppin HRB 1043\nEinreichung neuer Dokumente\n\nA.G.U. Agrargesellschaft Uckermark AG\nAktiengesellschaft\nPrenzlau\n\nAls nicht eingetragen wird veröffentlicht: Eine Liste der Mitglieder des Aufsichtsrates wurde zum Handelsregister eingereicht."
    },
    {
      "date": "2025-11-17",
      "id": "137499",
      "original_text": "Registerbekanntmachung nach dem Umwandlungsgesetz\nSchleswig-Holstein Amtsgericht Pinneberg HRB 19369\nIrmak Containerdienst GmbH – Pinneberg",
      "type": "Registerbekanntmachung nach dem Umwandlungsgesetz",
      "state": "Schleswig-Holstein",
      "amtsgericht": "Amtsgericht Pinneberg",
      "registernummer": "HRB 19369",
      "registerart": "HRB",
      "company_name": "Irmak Containerdienst GmbH",
      "company_seat": "Pinneberg",
      "details": "17.11.2025 (Bekanntmachungsdatum)\n\nSchleswig-Holstein Amtsgericht Pinneberg HRB 19369\nRegisterbekanntmachung nach dem Umwandlungsgesetz 11.11.2025 (Eintragungsdatum)\n\nIrmak Containerdienst GmbH\nGesellschaft mit beschränkter Haftung\nPinneberg\n\nZu Eintragungsnummer 1 vom 11.11.2025 wird als nicht eingetragen veröffentlicht: Den Gläubigern der an der Spaltung beteiligten Rechtsträger ist, wenn sie binnen sechs Monaten nach dem Tag, an dem die Eintragung der Spaltung in das Register des Sitzes desjenigen Rechtsträgers, dessen Gläubiger sie sind, als bekannt gemacht gilt, ihren Anspruch nach Grund und Höhe schriftlich anmelden, Sicherheit zu leisten, soweit sie nicht Befriedigung verlangen können. Dieses Recht steht den Gläubigern jedoch nur zu, wenn sie glaubhaft machen, dass durch die Spaltung die Erfüllung ihrer Forderung gefährdet wird. Das Recht, Sicherheitsleistung zu verlangen, steht Gläubigern nicht zu, die im Falle der Insolvenz ein Recht auf vorzugsweise Befriedigung aus einer Deckungsmasse haben, die nach gesetzlicher Vorschrift zu ihrem Schutz errichtet und staatlich überwacht ist."
    },
    {
      "date": "2025-11-17",
      "id": "137500",
      "original_text": "Einreichung neuer Dokumente\nHamburg Amtsgericht Hamburg HRB 139303\namedes Holding GmbH – Hamburg",
      "type": "Einreichung neuer Dokumente",
      "state": "Hamburg",
      "amtsgericht": "Amtsgericht Hamburg",
      "registernummer": "HRB 139303",
      "registerart": "HRB",
      "company_name": "amedes Holding GmbH",
      "company_seat": "Hamburg",
      "details": "17.11.2025 (Bekanntmachungsdatum)\n\nHamburg Amtsgericht Hamburg HRB 139303\nEinreichung neuer Dokumente\n\namedes Holding GmbH\nGesellschaft mit beschränkter Haftung\nHamburg\n\nAls nicht eingetragen wird bekannt gemacht: Liste des Aufsichtsrats wurde eingereicht."
    },
    {
      "date": "2025-11-17",
      "id": "137501",
      "original_text": "Einreichung neuer Dokumente\nHamburg Amtsgericht Hamburg HRB 43527\nAirbus Operations GmbH – Hamburg",
      "type": "Einreichung neuer Dokumente",
      "state": "Hamburg",
      "amtsgericht": "Amtsgericht Hamburg",
      "registernummer": "HRB 43527",
      "registerart": "HRB",
      "company_name": "Airbus Operations GmbH",
      "company_seat": "Hamburg",
      "details": "17.11.2025 (Bekanntmachungsdatum)\n\nHamburg Amtsgericht Hamburg HRB 43527\nEinreichung neuer Dokumente\n\nAirbus Operations GmbH\nGesellschaft mit beschränkter Haftung\nHamburg\n\nAls nicht eingetragen wird bekannt gemacht: Liste des Aufsichtsrats wurde eingereicht."
    },
    {
      "date": "2025-11-17",
      "id": "137502",
      "original_text": "Registerbekanntmachung nach dem Umwandlungsgesetz\nBaden-Württemberg Amtsgericht Mannheim HRB 756317\nBruker BioSpin Holding SE – Ettlingen",
      "type": "Registerbekanntmachung nach dem Umwandlungsgesetz",
      "state": "Baden-Württemberg",
      "amtsgericht": "Amtsgericht Mannheim",
      "registernummer": "HRB 756317",
      "registerart": "HRB",
      "company_name": "Bruker BioSpin Holding SE",
      "company_seat": "Ettlingen",
      "details": "17.11.2025 (Bekanntmachungsdatum)\n\nBaden-Württemberg Amtsgericht Mannheim HRB 756317\nRegisterbekanntmachung nach dem Umwandlungsgesetz 17.11.2025 (Eintragungsdatum)\n\nBruker BioSpin Holding SE\nEuropäische Aktiengesellschaft (SE)\nEttlingen\n\nAls nicht eingetragen wird bekanntgemacht:\nDen Gläubigern des an dem Formwechsel beteiligten Rechtsträgers ist, wenn sie binnen sechs Monaten nach dem Tag, an dem die Eintragung des Formwechsels in das Register des Sitzes desjenigen Rechtsträgers, dessen Gläubiger sie sind, nach § 19 Abs. 3 UmwG als bekanntgemacht gilt, ihren Anspruch nach Grund und Höhe schriftlich anmelden, Sicherheit zu leisten, soweit sie nicht Befriedigung verlangen können. Dieses Recht steht den Gläubigern jedoch nur zu, wenn sie glaubhaft machen, dass durch den Formwechsel die Erfüllung ihrer Forderung gefährdet wird."
    },
    {
      "date": "2025-11-17",
      "id": "137503",
      "original_text": "Registerbekanntmachung nach dem Umwandlungsgesetz\nBaden-Württemberg Amtsgericht Mannheim HRB 756176\nBruker BioSpin Holding AG – Ettlingen",
      "type": "Registerbekanntmachung nach dem Umwandlungsgesetz",
      "state": "Baden-Württemberg",
      "amtsgericht": "Amtsgericht Mannheim",
      "registernummer": "HRB 756176",
      "registerart": "HRB",
      "company_name": "Bruker BioSpin Holding AG",
      "company_seat": "Ettlingen",
      "details": "17.11.2025 (Bekanntmachungsdatum)\n\nBaden-Württemberg Amtsgericht Mannheim HRB 756176\nRegisterbekanntmachung nach dem Umwandlungsgesetz 17.11.2025 (Eintragungsdatum)\n\nBruker BioSpin Holding AG\nAktiengesellschaft\nEttlingen\n\nAls nicht eingetragen wird bekanntgemacht:\nDen Gläubigern des an dem Formwechsel beteiligten Rechtsträgers ist, wenn sie binnen sechs Monaten nach dem Tag, an dem die Eintragung des Formwechsels in das Register des Sitzes desjenigen Rechtsträgers, dessen Gläubiger sie sind, nach § 19 Abs. 3 UmwG als bekanntgemacht gilt, ihren Anspruch nach Grund und Höhe schriftlich anmelden, Sicherheit zu leisten, soweit sie nicht Befriedigung verlangen können. Dieses Recht steht den Gläubigern jedoch nur zu, wenn sie glaubhaft machen, dass durch den Formwechsel die Erfüllung ihrer Forderung gefährdet wird."
    },
    {
      "date": "2025-11-17",
      "id": "137504",
      "original_text": "Einreichung neuer Dokumente\nBaden-Württemberg Amtsgericht Ulm HRB 736273\nHucon AG – Heubach",
      "type": "Einreichung neuer Dokumente",
      "state": "Baden-Württemberg",
      "amtsgericht": "Amtsgericht Ulm",
      "registernummer": "HRB 736273",
      "registerart": "HRB",
      "company_name": "Hucon AG",
      "company_seat": "Heubach",
      "details": "17.11.2025 (Bekanntmachungsdatum)\n\nBaden-Württemberg Amtsgericht Ulm HRB 736273\nEinreichung neuer Dokumente\n\nHucon AG\nAktiengesellschaft\nHeubach\n\nDie Gesellschaft hat am 14.11.2025 die Liste über die Zusammensetzung des Aufsichtsrats zum Handelsregister eingereicht."
    },
    {
      "date": "2025-11-17",
      "id": "137505",
      "original_text": "Löschungsankündigung\nBrandenburg Amtsgericht Potsdam HRB 26842\nDLW Die Landwirte GmbH – Linthe",
      "type": "Löschungsankündigung",
      "state": "Brandenburg",
      "amtsgericht": "Amtsgericht Potsdam",
      "registernummer": "HRB 26842",
      "registerart": "HRB",
      "company_name": "DLW Die Landwirte GmbH",
      "company_seat": "Linthe",
      "details": "17.11.2025 (Bekanntmachungsdatum)\n\nBrandenburg Amtsgericht Potsdam HRB 26842\nLöschungsankündigung\n\nDLW Die Landwirte GmbH\nGesellschaft mit beschränkter Haftung\nLinthe\n\nBei der nachstehenden Gesellschaft wird das Amtslöschungsverfahren gemäß § 394 FamFG eingeleitet. Widerspruchsfrist: 8 Wochen"
    },
    {
      "date": "2025-11-17",
      "id": "137506",
      "original_text": "Löschungsankündigung\nBerlin Amtsgericht Berlin (Charlottenburg) HRB 134587\nALIS Bausanierung GmbH – Berlin",
      "type": "Löschungsankündigung",
      "state": "Berlin",
      "amtsgericht": "Amtsgericht Berlin (Charlottenburg)",
      "registernummer": "HRB 134587",
      "registerart": "HRB",
      "company_name": "ALIS Bausanierung GmbH",
      "company_seat": "Berlin",
      "details": "17.11.2025 (Bekanntmachungsdatum)\n\nBerlin Amtsgericht Berlin (Charlottenburg) HRB 134587\nLöschungsankündigung\n\nALIS Bausanierung GmbH\nGesellschaft mit beschränkter Haftung\nBerlin\n\nBei der nachstehenden Gesellschaft wird das Amtslöschungsverfahren gemäß § 394 FamFG eingeleitet. Widerspruchsfrist 6 Wochen"
    },
    {
      "date": "2025-11-17",
      "id": "137507",
      "original_text": "Löschungsankündigung\nBrandenburg Amtsgericht Potsdam HRB 16512\nAutomotive Surface Technology Verwaltungs GmbH – Wustermark",
      "type": "Löschungsankündigung",
      "state": "Brandenburg",
      "amtsgericht": "Amtsgericht Potsdam",
      "registernummer": "HRB 16512",
      "registerart": "HRB",
      "company_name": "Automotive Surface Technology Verwaltungs GmbH",
      "company_seat": "Wustermark",
      "details": "17.11.2025 (Bekanntmachungsdatum)\n\nBrandenburg Amtsgericht Potsdam HRB 16512\nLöschungsankündigung\n\nAutomotive Surface Technology Verwaltungs GmbH\nGesellschaft mit beschränkter Haftung\nWustermark\n\nBei der nachstehenden Gesellschaft wird das Amtslöschungsverfahren gemäß § 394 FamFG eingeleitet. Widerspruchsfrist: 8 Wochen"
    },
    {
      "date": "2025-11-17",
      "id": "137508",
      "original_text": "Löschungsankündigung\nHamburg Amtsgericht Hamburg HRB 157294\nABC Hanse Umwelttechnik UG (haftungsbeschränkt) – Hamburg",
      "type": "Löschungsankündigung",
      "state": "Hamburg",
      "amtsgericht": "Amtsgericht Hamburg",
      "registernummer": "HRB 157294",
      "registerart": "HRB",
      "company_name": "ABC Hanse Umwelttechnik UG (haftungsbeschränkt)",
      "company_seat": "Hamburg",
      "details": "17.11.2025 (Bekanntmachungsdatum)\n\nHamburg Amtsgericht Hamburg HRB 157294\nLöschungsankündigung\n\nABC Hanse Umwelttechnik UG (haftungsbeschränkt)\nGesellschaft mit beschränkter Haftung\nHamburg\n\nNach Mitteilung der Staatsanwaltschaft Hamburg wurde der Liquidator Jan Fuglsang, geb. 11.09.1959 durch Strafbefehl des Amtsgerichts Hamburg vom 23.05.2025 (Gesch.Nr. 230 Cs 36/25), rechtskräftig seit dem 11.06.2025, wegen falscher Angaben (§ 82 GmbHG) zu einer Freiheitsstrafe verurteilt.\n\nGemäß § 6 Abs. 2 S. 2 Nr. 3 lit. c) GmbHG kann dieser infolgedessen kein Liquidator mehr sein. Seine Eintragung als Liquidator ist daher wegen des Mangels einer wesentlichen Voraussetzung unzulässig geworden.\n\nDas Registergericht beabsichtigt, die Eintragung des Jan Fuglsang als Liquidator gemäß § 395 FamFG von Amts wegen aus dem Handelsregister zu löschen.\n\nGegen die beabsichtigte Löschung kann innerhalb eines Monats seit dieser Bekanntmachung Widerspruch beim\n\nAmtsgericht Hamburg - Registergericht -, Caffamacherreihe 20, 20355 Hamburg,\n\nschriftlich oder zur Niederschrift der Geschäftsstelle oder des Rechtspflegers eingelegt werden. Der Widerspruch kann auch zu Protokoll der Geschäftsstelle eines anderen Amtsgerichtes erfolgen. In diesem Falle ist die Frist nur dann gewahrt, wenn das den Widerspruch enthaltende Protokoll innerhalb der Frist bei dem Registergericht eingeht.\n\nSofern binnen der genannten Frist kein Widerspruch eingeht, wird das Gericht die Eintragung als Liquidator von Amts wegen löschen."
    },
    {
      "date": "2025-11-17",
      "id": "137509",
      "original_text": "Löschungsankündigung\nHamburg Amtsgericht Hamburg HRB 141016\nAR Aroma Kaffee GmbH – Hamburg",
      "type": "Löschungsankündigung",
      "state": "Hamburg",
      "amtsgericht": "Amtsgericht Hamburg",
      "registernummer": "HRB 141016",
      "registerart": "HRB",
      "company_name": "AR Aroma Kaffee GmbH",
      "company_seat": "Hamburg",
      "details": "17.11.2025 (Bekanntmachungsdatum)\n\nHamburg Amtsgericht Hamburg HRB 141016\nLöschungsankündigung\n\nAR Aroma Kaffee GmbH\nGesellschaft mit beschränkter Haftung\nHamburg\n\nDas Registergericht beabsichtigt, die im Handelsregister eingetragene Gesellschaft von Amts wegen nach § 394 FamFG zu löschen. Die Frist zur Erhebung eines Widerspruchs gegen die beabsichtigte Löschung wird auf 3 Monate festgesetzt."
    },
    {
      "date": "2025-11-17",
      "id": "137510",
      "original_text": "Löschungsankündigung\nNordrhein-Westfalen Amtsgericht Coesfeld HRB 21910\nMHM GmbH – Bocholt",
      "type": "Löschungsankündigung",
      "state": "Nordrhein-Westfalen",
      "amtsgericht": "Amtsgericht Coesfeld",
      "registernummer": "HRB 21910",
      "registerart": "HRB",
      "company_name": "MHM GmbH",
      "company_seat": "Bocholt",
      "details": "17.11.2025 (Bekanntmachungsdatum)\n\nNordrhein-Westfalen Amtsgericht Coesfeld HRB 21910\nLöschungsankündigung\n\nMHM GmbH\nGesellschaft mit beschränkter Haftung\nBocholt\n\nDas Registergericht beabsichtigt, den Rechtsträger wegen Vermögenslosigkeit gemäß § 394 FamFG von Amts wegen zu löschen.\n\nGegen diese Verfügung kann Widerspruch eingelegt werden. Die Frist zur Erhebung eines Widerspruchs gegen die beabsichtigte Löschung ist auf zwei Monate ab Veröffentlichung festgesetzt."
    },
    {
      "date": "2025-11-17",
      "id": "137511",
      "original_text": "Löschungsankündigung\nBerlin Amtsgericht Berlin (Charlottenburg) HRB 165588\nInDeStra UG (haftungsbeschränkt) – Berlin",
      "type": "Löschungsankündigung",
      "state": "Berlin",
      "amtsgericht": "Amtsgericht Berlin (Charlottenburg)",
      "registernummer": "HRB 165588",
      "registerart": "HRB",
      "company_name": "InDeStra UG (haftungsbeschränkt)",
      "company_seat": "Berlin",
      "details": "17.11.2025 (Bekanntmachungsdatum)\n\nBerlin Amtsgericht Berlin (Charlottenburg) HRB 165588\nLöschungsankündigung\n\nInDeStra UG (haftungsbeschränkt)\nGesellschaft mit beschränkter Haftung\nBerlin\n\nBei der nachstehenden Gesellschaft wird das Amtslöschungsverfahren gemäß § 394 FamFG eingeleitet. Widerspruchsfrist 6 Wochen"
    },
    {
      "date": "2025-11-17",
      "id": "137512",
      "original_text": "Löschungsankündigung\nSchleswig-Holstein Amtsgericht Kiel HRB 11818\nMediPed Neumünster UG (haftungsbeschränkt) – Neumünster",
      "type": "Löschungsankündigung",
      "state": "Schleswig-Holstein",
      "amtsgericht": "Amtsgericht Kiel",
      "registernummer": "HRB 11818",
      "registerart": "HRB",
      "company_name": "MediPed Neumünster UG (haftungsbeschränkt)",
      "company_seat": "Neumünster",
      "details": "17.11.2025 (Bekanntmachungsdatum)\n\nSchleswig-Holstein Amtsgericht Kiel HRB 11818\nLöschungsankündigung\n\nMediPed Neumünster UG (haftungsbeschränkt)\nGesellschaft mit beschränkter Haftung\nNeumünster\n\nEs ist die Löschung der nachstehenden Gesellschaft wegen Vermögenslosigkeit gemäß § 394 FamFG beabsichtigt. Widerspruchsfrist: 2 Monate."
    },
    {
      "date": "2025-11-17",
      "id": "137513",
      "original_text": "Einreichung neuer Dokumente\nBaden-Württemberg Amtsgericht Stuttgart HRB 767002\nRoto Frank Fenster- und Türtechnologie GmbH – Leinfelden-Echterdingen",
      "type": "Einreichung neuer Dokumente",
      "state": "Baden-Württemberg",
      "amtsgericht": "Amtsgericht Stuttgart",
      "registernummer": "HRB 767002",
      "registerart": "HRB",
      "company_name": "Roto Frank Fenster- und Türtechnologie GmbH",
      "company_seat": "Leinfelden-Echterdingen",
      "details": "17.11.2025 (Bekanntmachungsdatum)\n\nBaden-Württemberg Amtsgericht Stuttgart HRB 767002\nEinreichung neuer Dokumente\n\nRoto Frank Fenster- und Türtechnologie GmbH\nGesellschaft mit beschränkter Haftung\nLeinfelden-Echterdingen\n\nDie Gesellschaft hat am 15.11.2025 die Liste über die Zusammensetzung des Aufsichtsrats zum Handelsregister eingereicht."
    },
    {
      "date": "2025-11-17",
      "id": "137514",
      "original_text": "Löschungsankündigung\nBaden-Württemberg Amtsgericht Mannheim HRB 717252\nNTS NanoTechnologySolar GmbH – Karlsruhe",
      "type": "Löschungsankündigung",
      "state": "Baden-Württemberg",
      "amtsgericht": "Amtsgericht Mannheim",
      "registernummer": "HRB 717252",
      "registerart": "HRB",
      "company_name": "NTS NanoTechnologySolar GmbH",
      "company_seat": "Karlsruhe",
      "details": "17.11.2025 (Bekanntmachungsdatum)\n\nBaden-Württemberg Amtsgericht Mannheim HRB 717252\nLöschungsankündigung\n\nNTS NanoTechnologySolar GmbH\nGesellschaft mit beschränkter Haftung\nKarlsruhe\n\nDas Gericht beabsichtigt, die Gesellschaft wegen Vermögenslosigkeit im Handelsregister von Amts wegen nach § 394 FamFG zu löschen. Die Frist zur Geltendmachung eines Widerspruchs gegen die beabsichtigte Löschung ist auf einen Monat ab Veröffentlichung bestimmt."
    },
    {
      "date": "2025-11-17",
      "id": "137515",
      "original_text": "Löschungsankündigung\nBrandenburg Amtsgericht Potsdam HRB 26786\nFGK Fahrzeugzentrum Groß Kreutz GmbH – Groß Kreutz (Havel)",
      "type": "Löschungsankündigung",
      "state": "Brandenburg",
      "amtsgericht": "Amtsgericht Potsdam",
      "registernummer": "HRB 26786",
      "registerart": "HRB",
      "company_name": "FGK Fahrzeugzentrum Groß Kreutz GmbH",
      "company_seat": "Groß Kreutz (Havel)",
      "details": "17.11.2025 (Bekanntmachungsdatum)\n\nBrandenburg Amtsgericht Potsdam HRB 26786\nLöschungsankündigung\n\nFGK Fahrzeugzentrum Groß Kreutz GmbH\nGesellschaft mit beschränkter Haftung\nGroß Kreutz (Havel)\n\nBei der nachstehenden Gesellschaft wird das Amtslöschungsverfahren gemäß § 394 FamFG eingeleitet. Widerspruchsfrist: 8 Wochen."
    },
    {
      "date": "2025-11-17",
      "id": "137516",
      "original_text": "Löschungsankündigung\nSachsen Amtsgericht Dresden HRB 31429\nBfW Consult Verwaltungs GmbH – Dresden",
      "type": "Löschungsankündigung",
      "state": "Sachsen",
      "amtsgericht": "Amtsgericht Dresden",
      "registernummer": "HRB 31429",
      "registerart": "HRB",
      "company_name": "BfW Consult Verwaltungs GmbH",
      "company_seat": "Dresden",
      "details": "17.11.2025 (Bekanntmachungsdatum)\n\nSachsen Amtsgericht Dresden HRB 31429\nLöschungsankündigung\n\nBfW Consult Verwaltungs GmbH\nGesellschaft mit beschränkter Haftung\nDresden\n\nDas Registergericht beabsichtigt, die im Handelsregister eingetragene Gesellschaft von Amts wegen nach § 394 FamFG zu löschen. Die Frist zu Erhebung eines Widerspruchs gegen die beabsichtigte Löschung wird auf einen Monat festgesetzt."
    },
    {
      "date": "2025-11-17",
      "id": "137517",
      "original_text": "Registerbekanntmachung nach dem Umwandlungsgesetz\nSachsen Amtsgericht Chemnitz HRB 11415\nSächsische Qualifizierungsgesellschaft mbH – Plauen",
      "type": "Registerbekanntmachung nach dem Umwandlungsgesetz",
      "state": "Sachsen",
      "amtsgericht": "Amtsgericht Chemnitz",
      "registernummer": "HRB 11415",
      "registerart": "HRB",
      "company_name": "Sächsische Qualifizierungsgesellschaft mbH",
      "company_seat": "Plauen",
      "details": "17.11.2025 (Bekanntmachungsdatum)\n\nSachsen Amtsgericht Chemnitz HRB 11415\nRegisterbekanntmachung nach dem Umwandlungsgesetz 17.11.2025 (Eintragungsdatum)\n\nSächsische Qualifizierungsgesellschaft mbH\nGesellschaft mit beschränkter Haftung\nPlauen\n\nDas Registergericht beabsichtigt, die im Handelsregister eingetragene Gesellschaft von Amts wegen nach § 394 FamFG zu löschen. Die Frist zu Erhebung eines Widerspruchs gegen die beabsichtigte Löschung wird auf einen Monat festgesetzt."
    },
    {
      "date": "2025-11-17",
      "id": "137518",
      "original_text": "Löschungsankündigung\nSachsen Amtsgericht Chemnitz HRB 11415\nSächsische Qualifizierungsgesellschaft mbH – Plauen",
      "type": "Löschungsankündigung",
      "state": "Sachsen",
      "amtsgericht": "Amtsgericht Chemnitz",
      "registernummer": "HRB 11415",
      "registerart": "HRB",
      "company_name": "Sächsische Qualifizierungsgesellschaft mbH",
      "company_seat": "Plauen",
      "details": "17.11.2025 (Bekanntmachungsdatum)\n\nSachsen Amtsgericht Chemnitz HRB 11415\nLöschungsankündigung 17.11.2025 (Eintragungsdatum)\n\nSächsische Qualifizierungsgesellschaft mbH\nGesellschaft mit beschränkter Haftung\nPlauen\n\nDas Registergericht beabsichtigt, die im Handelsregister eingetragene Gesellschaft von Amts wegen nach § 394 FamFG zu löschen. Die Frist zu Erhebung eines Widerspruchs gegen die beabsichtigte Löschung wird auf einen Monat festgesetzt."
    },
    {
      "date": "2025-11-17",
      "id": "137519",
      "original_text": "Sonstige Registerbekanntmachung\nSachsen Amtsgericht Chemnitz HRA 9481\nANTAN RECONA GmbH & Co. 9. Vermögensverwaltungs KG – Schwarzenberg/Erzgeb.",
      "type": "Sonstige Registerbekanntmachung",
      "state": "Sachsen",
      "amtsgericht": "Amtsgericht Chemnitz",
      "registernummer": "HRA 9481",
      "registerart": "HRA",
      "company_name": "ANTAN RECONA GmbH & Co. 9. Vermögensverwaltungs KG",
      "company_seat": "Schwarzenberg/Erzgeb.",
      "details": "17.11.2025 (Bekanntmachungsdatum)\n\nSachsen Amtsgericht Chemnitz HRA 9481\nSonstige Registerbekanntmachung 17.11.2025 (Eintragungsdatum)\n\nANTAN RECONA GmbH & Co. 9. Vermögensverwaltungs KG\nKommanditgesellschaft\nSchwarzenberg/Erzgeb.\n\nAuf Antrag des Insolvenzverwalters wird ein Rumpfgeschäftsjahr vom 24.07.2025 bis zum 31.12.2025 festgesetzt. Ab 01.01.2026 entspricht das Geschäftsjahr dem Kalenderjahr."
    },
    {
      "date": "2025-11-17",
      "id": "137520",
      "original_text": "Löschungsankündigung\nSachsen Amtsgericht Dresden HRB 34359\nRENTA.tec GmbH – Hoyerswerda",
      "type": "Löschungsankündigung",
      "state": "Sachsen",
      "amtsgericht": "Amtsgericht Dresden",
      "registernummer": "HRB 34359",
      "registerart": "HRB",
      "company_name": "RENTA.tec GmbH",
      "company_seat": "Hoyerswerda",
      "details": "17.11.2025 (Bekanntmachungsdatum)\n\nSachsen Amtsgericht Dresden HRB 34359\nLöschungsankündigung\n\nRENTA.tec GmbH\nGesellschaft mit beschränkter Haftung\nHoyerswerda\n\nDas Registergericht beabsichtigt, die im Handelsregister eingetragene Gesellschaft von Amts wegen nach § 394 FamFG zu löschen. Die Frist zu Erhebung eines Widerspruchs gegen die beabsichtigte Löschung wird auf einen Monat festgesetzt."
    },
    {
      "date": "2025-11-17",
      "id": "137521",
      "original_text": "Einreichung neuer Dokumente\nNiedersachsen Amtsgericht Göttingen HRB 772\nNovelis Deutschland GmbH – Göttingen",
      "type": "Einreichung neuer Dokumente",
      "state": "Niedersachsen",
      "amtsgericht": "Amtsgericht Göttingen",
      "registernummer": "HRB 772",
      "registerart": "HRB",
      "company_name": "Novelis Deutschland GmbH",
      "company_seat": "Göttingen",
      "details": "17.11.2025 (Bekanntmachungsdatum)\n\nNiedersachsen Amtsgericht Göttingen HRB 772\nEinreichung neuer Dokumente\n\nNovelis Deutschland GmbH\nGesellschaft mit beschränkter Haftung\nGöttingen\n\nDie Liste der Mitglieder des Aufsichtsrats wurde beim Registergericht eingereicht."
    },
    {
      "date": "2025-11-17",
      "id": "137522",
      "original_text": "Löschungsankündigung\nNiedersachsen Amtsgericht Hannover HRB 100784 früher Amtsgericht Hameln\nCarla Romansky Hotel GmbH – Bad Pyrmont",
      "type": "Löschungsankündigung",
      "state": "Niedersachsen",
      "amtsgericht": "Amtsgericht Hannover",
      "registernummer": "HRB 100784",
      "registerart": "HRB",
      "company_name": "Carla Romansky Hotel GmbH",
      "company_seat": "Bad Pyrmont",
      "former_amtsgericht": "Hameln",
      "details": "17.11.2025 (Bekanntmachungsdatum)\n\nNiedersachsen Amtsgericht Hannover HRB 100784 früher Amtsgericht Hameln\nLöschungsankündigung\n\nCarla Romansky Hotel GmbH\nGesellschaft mit beschränkter Haftung\nBad Pyrmont\n\nDas Registergericht beabsichtigt, die Gesellschaft von Amts wegen nach § 394 FamFG zu löschen. Die Frist zur Erhebung eines Widerspruchs ist auf 1 Monat ab dieser Registerbekanntmachung festgesetzt."
    },
    {
      "date": "2025-11-17",
      "id": "137523",
      "original_text": "Einreichung neuer Dokumente\nNiedersachsen Amtsgericht Hildesheim HRB 206024\nHybrid Lidar Systems AG – Bad Salzdetfurth",
      "type": "Einreichung neuer Dokumente",
      "state": "Niedersachsen",
      "amtsgericht": "Amtsgericht Hildesheim",
      "registernummer": "HRB 206024",
      "registerart": "HRB",
      "company_name": "Hybrid Lidar Systems AG",
      "company_seat": "Bad Salzdetfurth",
      "details": "17.11.2025 (Bekanntmachungsdatum)\n\nNiedersachsen Amtsgericht Hildesheim HRB 206024\nEinreichung neuer Dokumente\n\nHybrid Lidar Systems AG\nAktiengesellschaft\nBad Salzdetfurth\n\nDie Liste der Mitglieder des Aufsichtsrats wurde beim Registergericht eingereicht."
    },
    {
      "date": "2025-11-17",
      "id": "137524",
      "original_text": "Löschungsankündigung\nNiedersachsen Amtsgericht Braunschweig HRA 202468\nBlitz, Inh. Kim Samantha Barteczko e. Kfr. – Braunschweig",
      "type": "Löschungsankündigung",
      "state": "Niedersachsen",
      "amtsgericht": "Amtsgericht Braunschweig",
      "registernummer": "HRA 202468",
      "registerart": "HRA",
      "company_name": "Blitz, Inh. Kim Samantha Barteczko e. Kfr.",
      "company_seat": "Braunschweig",
      "details": "17.11.2025 (Bekanntmachungsdatum)\n\nNiedersachsen Amtsgericht Braunschweig HRA 202468\nLöschungsankündigung 17.11.2025 (Eintragungsdatum)\n\nBlitz, Inh. Kim Samantha Barteczko e. Kfr.\nEinzelkaufmann / Einzelkauffrau\nBraunschweig\n\nDas Registergericht beabsichtigt, die Firma von Amts wegen nach § 31 Abs. 2 Satz 2 HGB, § 393 FamFG zu löschen. Die Frist zur Erhebung eines Widerspruchs ist auf 1 Monat ab dieser Registerbekanntmachung festgesetzt."
    },
    {
      "date": "2025-11-17",
      "id": "137525",
      "original_text": "Einreichung neuer Dokumente\nNiedersachsen Amtsgericht Lüneburg HRB 208850\nFMGV Holding KGaA – Soltau",
      "type": "Einreichung neuer Dokumente",
      "state": "Niedersachsen",
      "amtsgericht": "Amtsgericht Lüneburg",
      "registernummer": "HRB 208850",
      "registerart": "HRB",
      "company_name": "FMGV Holding KGaA",
      "company_seat": "Soltau",
      "details": "17.11.2025 (Bekanntmachungsdatum)\n\nNiedersachsen Amtsgericht Lüneburg HRB 208850\nEinreichung neuer Dokumente 17.11.2025 (Eintragungsdatum)\n\nFMGV Holding KGaA\nKommanditgesellschaft auf Aktien\nSoltau\n\nDie Liste der Mitglieder des Aufsichtsrats wurde beim Registergericht eingereicht."
    },
    {
      "date": "2025-11-17",
      "id": "137526",
      "original_text": "Einreichung neuer Dokumente\nRheinland-Pfalz Amtsgericht Mainz HRB 7498\nDB Cargo Aktiengesellschaft – Mainz",
      "type": "Einreichung neuer Dokumente",
      "state": "Rheinland-Pfalz",
      "amtsgericht": "Amtsgericht Mainz",
      "registernummer": "HRB 7498",
      "registerart": "HRB",
      "company_name": "DB Cargo Aktiengesellschaft",
      "company_seat": "Mainz",
      "details": "17.11.2025 (Bekanntmachungsdatum)\n\nRheinland-Pfalz Amtsgericht Mainz HRB 7498\nEinreichung neuer Dokumente 17.11.2025 (Eintragungsdatum)\n\nDB Cargo Aktiengesellschaft\nAktiengesellschaft\nMainz\n\nDem Registergericht ist eine neue Liste der Mitglieder des Aufsichtsrates eingereicht worden."
    },
    {
      "date": "2025-11-17",
      "id": "137527",
      "original_text": "Einreichung neuer Dokumente\nRheinland-Pfalz Amtsgericht Mainz HRB 51230\nSCHOTT Pharma AG & Co. KGaA – Mainz",
      "type": "Einreichung neuer Dokumente",
      "state": "Rheinland-Pfalz",
      "amtsgericht": "Amtsgericht Mainz",
      "registernummer": "HRB 51230",
      "registerart": "HRB",
      "company_name": "SCHOTT Pharma AG & Co. KGaA",
      "company_seat": "Mainz",
      "details": "17.11.2025 (Bekanntmachungsdatum)\n\nRheinland-Pfalz Amtsgericht Mainz HRB 51230\nEinreichung neuer Dokumente\n\nSCHOTT Pharma AG & Co. KGaA\nKommanditgesellschaft auf Aktien\nMainz\n\nDem Registergericht ist eine neue Liste der Mitglieder des Aufsichtsrates eingereicht worden."
    },
    {
      "date": "2025-11-17",
      "id": "137528",
      "original_text": "Registerbekanntmachung nach dem Umwandlungsgesetz\nBremen Amtsgericht Bremen HRB 34848\nG Ventures UG (haftungsbeschränkt) – Bremen",
      "type": "Registerbekanntmachung nach dem Umwandlungsgesetz",
      "state": "Bremen",
      "amtsgericht": "Amtsgericht Bremen",
      "registernummer": "HRB 34848",
      "registerart": "HRB",
      "company_name": "G Ventures UG (haftungsbeschränkt)",
      "company_seat": "Bremen",
      "details": "17.11.2025 (Bekanntmachungsdatum)\n\nBremen Amtsgericht Bremen HRB 34848\nRegisterbekanntmachung nach dem Umwandlungsgesetz 13.11.2025 (Eintragungsdatum)\n\nG Ventures UG (haftungsbeschränkt)\nGesellschaft mit beschränkter Haftung\nBremen\n\nZu Eintragungsnummer 3 vom 13.11.2025 wird als nicht eingetragen veröffentlicht: Den Gläubigern der an der Verschmelzung beteiligten Rechtsträger ist, wenn sie binnen sechs Monaten nach dem Tag, an dem die Eintragung der Verschmelzung in das Register des Sitzes desjenigen Rechtsträgers, dessen Gläubiger sie sind, als bekannt gemacht gilt, ihren Anspruch nach Grund und Höhe schriftlich anmelden, Sicherheit zu leisten, soweit sie nicht Befriedigung verlangen können. Dieses Recht steht den Gläubigern jedoch nur zu, wenn sie glaubhaft machen, dass durch die Verschmelzung die Erfüllung ihrer Forderung gefährdet wird. Das Recht, Sicherheitsleistung zu verlangen, steht Gläubigern nicht zu, die im Falle der Insolvenz ein Recht auf vorzugsweise Befriedigung aus einer Deckungsmasse haben, die nach gesetzlicher Vorschrift zu ihrem Schutz errichtet und staatlich überwacht ist."
    },
    {
      "date": "2025-11-17",
      "id": "137529",
      "original_text": "Löschungsankündigung\nBremen Amtsgericht Bremen HRB 38515\nWeMadeIt GmbH – Bremen",
      "type": "Löschungsankündigung",
      "state": "Bremen",
      "amtsgericht": "Amtsgericht Bremen",
      "registernummer": "HRB 38515",
      "registerart": "HRB",
      "company_name": "WeMadeIt GmbH",
      "company_seat": "Bremen",
      "details": "17.11.2025 (Bekanntmachungsdatum)\n\nBremen Amtsgericht Bremen HRB 38515\nLöschungsankündigung\n\nWeMadeIt GmbH\nGesellschaft mit beschränkter Haftung\nBremen\n\nEs ist beabsichtigt die im Handelsregister eingetragene Gesellschaft von Amts wegen gemäß § 394 FamFG zu löschen. Gegen die Löschung kann beim AG Bremen schriftlich oder zu Protokoll der Geschäftsstelle Widerspruch eingelegt werden. Widerspruchsfrist 4 Wochen."
    },
    {
      "date": "2025-11-17",
      "id": "137530",
      "original_text": "Registerbekanntmachung nach dem Umwandlungsgesetz\nBremen Amtsgericht Bremen HRB 36171\nEntoSys GmbH – Bremen",
      "type": "Registerbekanntmachung nach dem Umwandlungsgesetz",
      "state": "Bremen",
      "amtsgericht": "Amtsgericht Bremen",
      "registernummer": "HRB 36171",
      "registerart": "HRB",
      "company_name": "EntoSys GmbH",
      "company_seat": "Bremen",
      "details": "17.11.2025 (Bekanntmachungsdatum)\n\nBremen Amtsgericht Bremen HRB 36171\nRegisterbekanntmachung nach dem Umwandlungsgesetz 17.11.2025 (Eintragungsdatum)\n\nEntoSys GmbH\nGesellschaft mit beschränkter Haftung\nBremen\n\nZu Eintragungsnummer 3 vom 17.11.2025 wird als nicht eingetragen veröffentlicht:  Den Gläubigern der an der Verschmelzung beteiligten Rechtsträger ist, wenn sie binnen sechs Monaten nach dem Tag, an dem die Eintragung der Verschmelzung in das Register des Sitzes desjenigen Rechtsträgers, dessen Gläubiger sie sind, als bekannt gemacht gilt, ihren Anspruch nach Grund und Höhe schriftlich anmelden, Sicherheit zu leisten, soweit sie nicht Befriedigung verlangen können. Dieses Recht steht den Gläubigern jedoch nur zu, wenn sie glaubhaft machen, dass durch die Verschmelzung die Erfüllung ihrer Forderung gefährdet wird. Das Recht, Sicherheitsleistung zu verlangen, steht Gläubigern nicht zu, die im Falle der Insolvenz ein Recht auf vorzugsweise Befriedigung aus einer Deckungsmasse haben, die nach gesetzlicher Vorschrift zu ihrem Schutz errichtet und staatlich überwacht ist."
    },
    {
      "date": "2025-11-17",
      "id": "137531",
      "original_text": "Registerbekanntmachung nach dem Umwandlungsgesetz\nNordrhein-Westfalen Amtsgericht Krefeld HRA 7519\nElektroteq Pospiech & Picard OHG – Krefeld",
      "type": "Registerbekanntmachung nach dem Umwandlungsgesetz",
      "state": "Nordrhein-Westfalen",
      "amtsgericht": "Amtsgericht Krefeld",
      "registernummer": "HRA 7519",
      "registerart": "HRA",
      "company_name": "Elektroteq Pospiech & Picard OHG",
      "company_seat": "Krefeld",
      "details": "17.11.2025 (Bekanntmachungsdatum)\n\nNordrhein-Westfalen Amtsgericht Krefeld HRA 7519\nRegisterbekanntmachung nach dem Umwandlungsgesetz 17.11.2025 (Eintragungsdatum)\n\nElektroteq Pospiech & Picard OHG\nOffene Handelsgesellschaft\nKrefeld\n\nDen Gläubigern der an der formwechselnden Umwandlung beteiligten Rechtsträger ist, wenn sie binnen sechs Monaten nach dem Tag, an dem die Eintragung der formwechselnden Umwandlung in das Register des Sitzes desjenigen Rechtsträgers, dessen Gläubiger sie sind, nach § 19 Absatz 3 UmwG als bekanntgemacht gilt, ihren Anspruch nach Grund und Höhe schriftlich anmelden, Sicherheit zu leisten, soweit sie nicht Befriedigung verlangen können. Dieses Recht steht den Gläubigern jedoch nur zu, wenn sie glaubhaft machen, dass durch die formwechselnden Umwandlung die Erfüllung ihrer Forderung gefährdet wird."
    },
    {
      "date": "2025-11-17",
      "id": "137532",
      "original_text": "Registerbekanntmachung nach dem Umwandlungsgesetz\nNordrhein-Westfalen Amtsgericht Siegen HRB 11837\npmdholding gmbh – Siegen",
      "type": "Registerbekanntmachung nach dem Umwandlungsgesetz",
      "state": "Nordrhein-Westfalen",
      "amtsgericht": "Amtsgericht Siegen",
      "registernummer": "HRB 11837",
      "registerart": "HRB",
      "company_name": "pmdholding gmbh",
      "company_seat": "Siegen",
      "details": "17.11.2025 (Bekanntmachungsdatum)\n\nNordrhein-Westfalen Amtsgericht Siegen HRB 11837\nRegisterbekanntmachung nach dem Umwandlungsgesetz 22.09.2025 (Eintragungsdatum)\n\npmdholding gmbh\nGesellschaft mit beschränkter Haftung\nSiegen\n\nDen Gläubigern der an der Verschmelzung beteiligten Rechtsträger ist, wenn sie binnen sechs Monaten nach dem Tag, an dem die Eintragung der Verschmelzung in das Register des Sitzes derjenigen Rechtsträger deren Gläubiger sie sind, nach § 19 Absatz 3 UmwG als bekanntgemacht gilt, ihren Anspruch nach Grund und Höhe schriftlich anmelden, Sicherheit zu leisten, soweit sie nicht Befriedigung verlangen können. Dieses Recht steht den Gläubigern jedoch nur zu, wenn sie glaubhaft machen, dass durch die Verschmelzung die Erfüllung ihrer Forderung gefährdet wird."
    },
    {
      "date": "2025-11-17",
      "id": "137533",
      "original_text": "Löschungsankündigung\nNordrhein-Westfalen Amtsgericht Köln HRB 87025\nAutowelt Martin GmbH – Köln",
      "type": "Löschungsankündigung",
      "state": "Nordrhein-Westfalen",
      "amtsgericht": "Amtsgericht Köln",
      "registernummer": "HRB 87025",
      "registerart": "HRB",
      "company_name": "Autowelt Martin GmbH",
      "company_seat": "Köln",
      "details": "17.11.2025 (Bekanntmachungsdatum)\n\nNordrhein-Westfalen Amtsgericht Köln HRB 87025\nLöschungsankündigung\n\nAutowelt Martin GmbH\nGesellschaft mit beschränkter Haftung\nKöln\n\nDas Registergericht beabsichtigt die Gesellschaft von Amts wegen nach § 394 FamFG zu löschen. Die Frist zur Erhebung eines Widerspruchs ist auf einen Monat festgesetzt."
    },
    {
      "date": "2025-11-17",
      "id": "137534",
      "original_text": "Löschungsankündigung\nNordrhein-Westfalen Amtsgericht Düsseldorf HRB 102507\nHowe. D Handel GmbH – Düsseldorf",
      "type": "Löschungsankündigung",
      "state": "Nordrhein-Westfalen",
      "amtsgericht": "Amtsgericht Düsseldorf",
      "registernummer": "HRB 102507",
      "registerart": "HRB",
      "company_name": "Howe. D Handel GmbH",
      "company_seat": "Düsseldorf",
      "details": "17.11.2025 (Bekanntmachungsdatum)\n\nNordrhein-Westfalen Amtsgericht Düsseldorf HRB 102507\nLöschungsankündigung\n\nHowe. D Handel GmbH\nGesellschaft mit beschränkter Haftung\nDüsseldorf\n\nDas Registergericht beabsichtigt die Gesellschaft von Amts wegen nach § 394 FamFG zu löschen. Die Frist zur Erhebung eines Widerspruchs ist auf 3 Wochen festgesetzt.\n\nRechtsbehelfsbelehrung:\nDas Widerspruchsrecht steht jedem zu, der an der Unterlassung der Löschung ein berechtigtes Interesse hat. Der Widerspruch ist bei dem Amtsgericht Düsseldorf -Registergericht-, Werdener Straße 1, 40227 Düsseldorf schriftlich in deutscher Sprache oder zur Niederschrift der Geschäftsstelle einzulegen. Der Widerspruch kann auch zur Niederschrift der Geschäftsstelle eines jeden Amtsgerichtes abgegeben werden. Die Einlegung ist auch durch Übertragung eines elektronischen Dokuments an die elektronische Poststelle des Gerichts möglich. Das elektronische Dokument muss für die Bearbeitung durch das Gericht geeignet und mit einer qualifizierten elektronischen Signatur der verantwortenden Person versehen sein oder von der verantwortenden Person signiert und auf einem sicheren Übermittlungsweg gemäß § 130a ZPO nach näherer Maßgabe der Verordnung über die technischen Rahmenbedingungen des elektronischen Rechtsverkehrs und über das besondere elektronische Behördenpostfach (BGBl. I, S.3803) eingereicht werden. Weitere Informationen erhalten Sie auf der Internetseite www.justiz.de.\nDer Widerspruch muss spätestens innerhalb der gesetzten Frist nach dem Datum der Bekanntmachung der Löschungsankündigung bei dem Amtsgericht - Registergericht - Düsseldorf eingegangen sein.  Dies gilt auch dann, wenn der Widerspruch zur Niederschrift der Geschäftsstelle eines anderen Amtsgerichtes abgegeben wurde. Die Frist beginnt mit dem Tage der Bekanntmachung der Löschungsankündigung in dem für die Bekanntmachung der Eintragungen in das Handelsregister bestimmten elektronischen Informations- und Kommunikationssystem nach § 10 des Handelsgesetzbuches. Fällt das Ende der Frist auf einen Sonntag, einen allgemeinen Feiertag oder Sonnabend, so endet die Frist mit Ablauf des nächsten Werktages.\nDer Widerspruch muss die Bezeichnung der angefochtenen Löschungsankündigung sowie die Erklärung enthalten, dass Widerspruch gegen diese Löschungsankündigung eingelegt wird. Er ist zu unterzeichnen und soll begründet werden."
    },
    {
      "date": "2025-11-17",
      "id": "137535",
      "original_text": "Registerbekanntmachung nach dem Umwandlungsgesetz\nNordrhein-Westfalen Amtsgericht Bonn HRB 28103\nCONET Services GmbH – Bonn",
      "type": "Registerbekanntmachung nach dem Umwandlungsgesetz",
      "state": "Nordrhein-Westfalen",
      "amtsgericht": "Amtsgericht Bonn",
      "registernummer": "HRB 28103",
      "registerart": "HRB",
      "company_name": "CONET Services GmbH",
      "company_seat": "Bonn",
      "details": "17.11.2025 (Bekanntmachungsdatum)\n\nNordrhein-Westfalen Amtsgericht Bonn HRB 28103\nRegisterbekanntmachung nach dem Umwandlungsgesetz 17.11.2025 (Eintragungsdatum)\n\nCONET Services GmbH\nGesellschaft mit beschränkter Haftung\nBonn\n\nDen Gläubigern der an der Verschmelzung beteiligten Rechtsträger ist, wenn sie binnen sechs Monaten nach dem Tag, an dem die Eintragung der Verschmelzung in das Register des Sitzes desjenigen Rechtsträgers, dessen Gläubiger sie sind, nach § 19 Absatz 3 UmwG als bekanntgemacht gilt, ihren Anspruch nach Grund und Höhe schriftlich anmelden, Sicherheit zu leisten, soweit sie nicht Befriedigung verlangen können. Dieses Recht steht den Gläubigern jedoch nur zu, wenn sie glaubhaft machen, dass durch die Verschmelzung die Erfüllung ihrer Forderung gefährdet wird."
    },
    {
      "date": "2025-11-17",
      "id": "137536",
      "original_text": "Löschungsankündigung\nNordrhein-Westfalen Amtsgericht Krefeld HRB 16456\nMediastar Worldwide UG (haftungsbeschränkt) – Nettetal",
      "type": "Löschungsankündigung",
      "state": "Nordrhein-Westfalen",
      "amtsgericht": "Amtsgericht Krefeld",
      "registernummer": "HRB 16456",
      "registerart": "HRB",
      "company_name": "Mediastar Worldwide UG (haftungsbeschränkt)",
      "company_seat": "Nettetal",
      "details": "17.11.2025 (Bekanntmachungsdatum)\n\nNordrhein-Westfalen Amtsgericht Krefeld HRB 16456\nLöschungsankündigung\n\nMediastar Worldwide UG (haftungsbeschränkt)\nGesellschaft mit beschränkter Haftung\nNettetal\n\nDas Registergericht beabsichtigt die Gesellschaft von Amts wegen nach § 394 FamFG zu löschen. Die Frist zur Erhebung eines Widerspruchs ist auf einen Monat festgesetzt."
    },
    {
      "date": "2025-11-17",
      "id": "137537",
      "original_text": "Löschungsankündigung\nNordrhein-Westfalen Amtsgericht Köln HRB 115864\nProject Care Cologne GmbH – Köln",
      "type": "Löschungsankündigung",
      "state": "Nordrhein-Westfalen",
      "amtsgericht": "Amtsgericht Köln",
      "registernummer": "HRB 115864",
      "registerart": "HRB",
      "company_name": "Project Care Cologne GmbH",
      "company_seat": "Köln",
      "details": "17.11.2025 (Bekanntmachungsdatum)\n\nNordrhein-Westfalen Amtsgericht Köln HRB 115864\nLöschungsankündigung\n\nProject Care Cologne GmbH\nGesellschaft mit beschränkter Haftung\nKöln\n\nDas Registergericht beabsichtigt die Gesellschaft von Amts wegen nach § 394 FamFG zu löschen. Die Frist zur Erhebung eines Widerspruchs ist auf einen Monat festgesetzt."
    },
    {
      "date": "2025-11-17",
      "id": "137538",
      "original_text": "Löschungsankündigung\nNordrhein-Westfalen Amtsgericht Wuppertal HRA 8638\nH. A. K n i e p k a m p & Co. Elektr. Gesellsch. – Wuppertal",
      "type": "Löschungsankündigung",
      "state": "Nordrhein-Westfalen",
      "amtsgericht": "Amtsgericht Wuppertal",
      "registernummer": "HRA 8638",
      "registerart": "HRA",
      "company_name": "H. A. K n i e p k a m p & Co. Elektr. Gesellsch.",
      "company_seat": "Wuppertal",
      "details": "17.11.2025 (Bekanntmachungsdatum)\n\nNordrhein-Westfalen Amtsgericht Wuppertal HRA 8638\nLöschungsankündigung\n\nH. A. K n i e p k a m p & Co. Elektr. Gesellsch.\nEinzelkaufmann / Einzelkauffrau\nWuppertal\n\nDas Registergericht beabsichtigt die Firma von Amts wegen nach § 31 Abs. 2 HGB, § 393 FamFG zu löschen. Die Frist zur Erhebung eines Widerspruchs ist auf drei Monate festgesetzt."
    },
    {
      "date": "2025-11-17",
      "id": "137539",
      "original_text": "Löschungsankündigung\nNordrhein-Westfalen Amtsgericht Siegburg HRB 11334\nWiWaCasa GmbH – Königswinter",
      "type": "Löschungsankündigung",
      "state": "Nordrhein-Westfalen",
      "amtsgericht": "Amtsgericht Siegburg",
      "registernummer": "HRB 11334",
      "registerart": "HRB",
      "company_name": "WiWaCasa GmbH",
      "company_seat": "Königswinter",
      "details": "17.11.2025 (Bekanntmachungsdatum)\n\nNordrhein-Westfalen Amtsgericht Siegburg HRB 11334\nLöschungsankündigung\n\nWiWaCasa GmbH\nGesellschaft mit beschränkter Haftung\nKönigswinter\n\nDas Registergericht hat glaubhafte Kenntnis erlangt, dass die Gesellschaft vermögenslos geworden ist.\n\nEs ist daher beabsichtigt, die Gesellschaft nach § 394 FamFG im Handelsregister wegen Vermögenslosigkeit zu löschen.\nEinwände gegen die Löschung sind durch Widerspruch binnen einer Frist von 3 Monaten geltend zu machen, andernfalls die Löschung erfolgen wird.\n\nEinzulegen ist der Widerspruch bei dem Amtsgericht Siegburg, Neue Poststraße 16, 53721 Siegburg, und zwar entweder schriftlich in deutscher Sprache oder mündlich zur Niederschrift der Geschäftsstelle. Der Widerspruch kann auch zur Niederschrift der Geschäftsstelle eines jeden Amtsgerichts abgegeben werden. Der Widerspruch ist binnen der in der Verfügung bestimmten Frist einzulegen. Die Frist ist nur gewahrt, wenn der Widerspruch rechtzeitig bei dem Amtsgericht Siegburg eingeht, auch wenn der Widerspruch zur Niederschrift der Geschäftsstelle eines anderen Amtsgerichts abgegeben wurde. Die Frist beginnt jeweils mit der schriftlichen Bekanntgabe der Verfügung an die Beteiligten. Kann die schriftliche Bekanntgabe an einen Beteiligten nicht bewirkt werden, beginnt die Frist spätestens mit Ablauf von fünf Monaten nach Erlass der Verfügung. Die Bekanntgabe ist entweder durch Zustellung oder am dritten Tage nach Aufgabe zur Post bewirkt. Sofern die Löschung noch nicht erfolgt ist, kann der Widerspruch auch noch nach Ablauf der Frist eingelegt werden. Fällt das Ende der Frist auf einen Sonnabend, einen Sonntag oder einen allgemeinen Feiertag, endet die Frist mit Ablauf des nächsten Werktages. Der Widerspruch ist zu unterzeichnen. Eine Begründung des Widerspruchs ist nicht vorgeschrieben."
    },
    {
      "date": "2025-11-17",
      "id": "137540",
      "original_text": "Löschungsankündigung\nNordrhein-Westfalen Amtsgericht Dortmund HRB 28895\nPB Marketing UG (haftungsbeschränkt) – Dortmund",
      "type": "Löschungsankündigung",
      "state": "Nordrhein-Westfalen",
      "amtsgericht": "Amtsgericht Dortmund",
      "registernummer": "HRB 28895",
      "registerart": "HRB",
      "company_name": "PB Marketing UG (haftungsbeschränkt)",
      "company_seat": "Dortmund",
      "details": "17.11.2025 (Bekanntmachungsdatum)\n\nNordrhein-Westfalen Amtsgericht Dortmund HRB 28895\nLöschungsankündigung\n\nPB Marketing UG (haftungsbeschränkt)\nGesellschaft mit beschränkter Haftung\nDortmund\n\nDas Registergericht beabsichtigt die Gesellschaft von Amts wegen nach § 394 FamFG zu löschen. Die Frist zur Erhebung eines Widerspruchs ist auf zwei Monate festgesetzt."
    },
    {
      "date": "2025-11-17",
      "id": "137541",
      "original_text": "Löschungsankündigung\nNordrhein-Westfalen Amtsgericht Köln HRB 99097\nLavendelparadies GmbH – Pulheim",
      "type": "Löschungsankündigung",
      "state": "Nordrhein-Westfalen",
      "amtsgericht": "Amtsgericht Köln",
      "registernummer": "HRB 99097",
      "registerart": "HRB",
      "company_name": "Lavendelparadies GmbH",
      "company_seat": "Pulheim",
      "details": "17.11.2025 (Bekanntmachungsdatum)\n\nNordrhein-Westfalen Amtsgericht Köln HRB 99097\nLöschungsankündigung\n\nLavendelparadies GmbH\nGesellschaft mit beschränkter Haftung\nPulheim\n\nDas Registergericht beabsichtigt die Gesellschaft von Amts wegen nach § 394 FamFG zu löschen. Die Frist zur Erhebung eines Widerspruchs ist auf einen Monat festgesetzt."
    },
    {
      "date": "2025-11-17",
      "id": "137542",
      "original_text": "Löschungsankündigung\nNordrhein-Westfalen Amtsgericht Dortmund HRB 33105\nBereket ZEMANN GmbH – Dortmund",
      "type": "Löschungsankündigung",
      "state": "Nordrhein-Westfalen",
      "amtsgericht": "Amtsgericht Dortmund",
      "registernummer": "HRB 33105",
      "registerart": "HRB",
      "company_name": "Bereket ZEMANN GmbH",
      "company_seat": "Dortmund",
      "details": "17.11.2025 (Bekanntmachungsdatum)\n\nNordrhein-Westfalen Amtsgericht Dortmund HRB 33105\nLöschungsankündigung\n\nBereket ZEMANN GmbH\nGesellschaft mit beschränkter Haftung\nDortmund\n\nDas Registergericht beabsichtigt die Gesellschaft von Amts wegen nach § 394 FamFG zu löschen. Die Frist zur Erhebung eines Widerspruchs ist auf zwei Monate festgesetzt."
    },
    {
      "date": "2025-11-17",
      "id": "137543",
      "original_text": "Löschungsankündigung\nNordrhein-Westfalen Amtsgericht Siegburg GsR 211\nGewerbepark Windeck eGbR – Windeck",
      "type": "Löschungsankündigung",
      "state": "Nordrhein-Westfalen",
      "amtsgericht": "Amtsgericht Siegburg",
      "registernummer": "GsR 211",
      "registerart": "GsR",
      "company_name": "Gewerbepark Windeck eGbR",
      "company_seat": "Windeck",
      "details": "17.11.2025 (Bekanntmachungsdatum)\n\nNordrhein-Westfalen Amtsgericht Siegburg GsR 211\nLöschungsankündigung\n\nGewerbepark Windeck eGbR\nGesellschaft bürgerlichen Rechts\nWindeck\n\nNach dem Akteninhalt, auf den Bezug genommen wird, ergeben sich keine Anhaltspunkte dafür, dass die Gesellschaft noch Vermögen besitzt.  Die Voraussetzungen des § 729, 730 BGB i.v.m. § 394 Abs. 4 FamFG liegen vor.\nDie Gesellschaft soll daher wegen Vermögenslosigkeit von Amts wegen gemäß         § 394 FamFG gelöscht werden.. Ein etwaiger Widerspruch gegen die beabsichtigte Löschung ist binnen einer Frist von drei Monaten bei dem Registergericht geltend zu machen, anderenfalls wird die Löschung der Gesellschaft erfolgen."
    },
    {
      "date": "2025-11-17",
      "id": "137544",
      "original_text": "Einreichung neuer Dokumente\nNordrhein-Westfalen Amtsgericht Mönchengladbach HRB 57\nGLADBACHER BANK Aktiengesellschaft von 1922 – Mönchengladbach",
      "type": "Einreichung neuer Dokumente",
      "state": "Nordrhein-Westfalen",
      "amtsgericht": "Amtsgericht Mönchengladbach",
      "registernummer": "HRB 57",
      "registerart": "HRB",
      "company_name": "GLADBACHER BANK Aktiengesellschaft von 1922",
      "company_seat": "Mönchengladbach",
      "details": "17.11.2025 (Bekanntmachungsdatum)\n\nNordrhein-Westfalen Amtsgericht Mönchengladbach HRB 57\nEinreichung neuer Dokumente\n\nGLADBACHER BANK Aktiengesellschaft von 1922\nAktiengesellschaft\nMönchengladbach\n\nDem Registergericht ist eine neue Liste der Mitglieder des Aufsichtsrates eingereicht worden."
    },
    {
      "date": "2025-11-17",
      "id": "137545",
      "original_text": "Registerbekanntmachung nach dem Umwandlungsgesetz\nNordrhein-Westfalen Amtsgericht Köln HRA 38104\nHausverwaltung Jonas Sottek eK – Wermelskirchen",
      "type": "Registerbekanntmachung nach dem Umwandlungsgesetz",
      "state": "Nordrhein-Westfalen",
      "amtsgericht": "Amtsgericht Köln",
      "registernummer": "HRA 38104",
      "registerart": "HRA",
      "company_name": "Hausverwaltung Jonas Sottek eK",
      "company_seat": "Wermelskirchen",
      "details": "17.11.2025 (Bekanntmachungsdatum)\n\nNordrhein-Westfalen Amtsgericht Köln HRA 38104\nRegisterbekanntmachung nach dem Umwandlungsgesetz 17.11.2025 (Eintragungsdatum)\n\nHausverwaltung Jonas Sottek eK\nEinzelkaufmann / Einzelkauffrau\nWermelskirchen\n\nDen Gläubigern der an der Ausgliederung beteiligten Rechtsträger ist, wenn sie binnen sechs Monaten nach dem Tag, an dem die Eintragung der Ausgliederung in das Register des Sitzes desjenigen Rechtsträgers, dessen Gläubiger sie sind, nach § 19 Absatz 3 UmwG als bekanntgemacht gilt, ihren Anspruch nach Grund und Höhe schriftlich anmelden, Sicherheit zu leisten, soweit sie nicht Befriedigung verlangen können. Dieses Recht steht den Gläubigern jedoch nur zu, wenn sie glaubhaft machen, dass durch die Ausgliederung die Erfüllung ihrer Forderung gefährdet wird."
    },
    {
      "date": "2025-11-17",
      "id": "137546",
      "original_text": "Registerbekanntmachung nach dem Umwandlungsgesetz\nNordrhein-Westfalen Amtsgericht Köln HRB 73392\naugenschein Filmproduktion GmbH – Köln",
      "type": "Registerbekanntmachung nach dem Umwandlungsgesetz",
      "state": "Nordrhein-Westfalen",
      "amtsgericht": "Amtsgericht Köln",
      "registernummer": "HRB 73392",
      "registerart": "HRB",
      "company_name": "augenschein Filmproduktion GmbH",
      "company_seat": "Köln",
      "details": "17.11.2025 (Bekanntmachungsdatum)\n\nNordrhein-Westfalen Amtsgericht Köln HRB 73392\nRegisterbekanntmachung nach dem Umwandlungsgesetz 17.11.2025 (Eintragungsdatum)\n\naugenschein Filmproduktion GmbH\nGesellschaft mit beschränkter Haftung\nKöln\n\nDen Gläubigern der an der Verschmelzung beteiligten Rechtsträger ist, wenn sie binnen sechs Monaten nach dem Tag, an dem die Eintragung der Verschmelzung in das Register des Sitzes desjenigen Rechtsträgers, dessen Gläubiger sie sind, nach § 19 Absatz 3 UmwG als bekanntgemacht gilt, ihren Anspruch nach Grund und Höhe schriftlich anmelden, Sicherheit zu leisten, soweit sie nicht Befriedigung verlangen können. Dieses Recht steht den Gläubigern jedoch nur zu, wenn sie glaubhaft machen, dass durch die Verschmelzung die Erfüllung ihrer Forderung gefährdet wird."
    },
    {
      "date": "2025-11-17",
      "id": "137547",
      "original_text": "Registerbekanntmachung nach dem Umwandlungsgesetz\nNordrhein-Westfalen Amtsgericht Düsseldorf HRB 110924\nPeopleware GmbH – Düsseldorf",
      "type": "Registerbekanntmachung nach dem Umwandlungsgesetz",
      "state": "Nordrhein-Westfalen",
      "amtsgericht": "Amtsgericht Düsseldorf",
      "registernummer": "HRB 110924",
      "registerart": "HRB",
      "company_name": "Peopleware GmbH",
      "company_seat": "Düsseldorf",
      "details": "17.11.2025 (Bekanntmachungsdatum)\n\nNordrhein-Westfalen Amtsgericht Düsseldorf HRB 110924\nRegisterbekanntmachung nach dem Umwandlungsgesetz 17.11.2025 (Eintragungsdatum)\n\nPeopleware GmbH\nGesellschaft mit beschränkter Haftung\nDüsseldorf\n\nDen Gläubigern der an der formwechselnden Umwandlung beteiligten Rechtsträger ist, wenn sie binnen sechs Monaten nach dem Tag, an dem die Eintragung der formwechselnden Umwandlung in das Register des Sitzes desjenigen Rechtsträgers, dessen Gläubiger sie sind, nach § 19 Absatz 3 UmwG als bekanntgemacht gilt, ihren Anspruch nach Grund und Höhe schriftlich anmelden, Sicherheit zu leisten, soweit sie nicht Befriedigung verlangen können. Dieses Recht steht den Gläubigern jedoch nur zu, wenn sie glaubhaft machen, dass durch die formwechselnden Umwandlung die Erfüllung ihrer Forderung gefährdet wird."
    },
    {
      "date": "2025-11-17",
      "id": "137548",
      "original_text": "Löschungsankündigung\nNordrhein-Westfalen Amtsgericht Duisburg HRB 37427\nFormal Bau GmbH – Duisburg",
      "type": "Löschungsankündigung",
      "state": "Nordrhein-Westfalen",
      "amtsgericht": "Amtsgericht Duisburg",
      "registernummer": "HRB 37427",
      "registerart": "HRB",
      "company_name": "Formal Bau GmbH",
      "company_seat": "Duisburg",
      "details": "17.11.2025 (Bekanntmachungsdatum)\n\nNordrhein-Westfalen Amtsgericht Duisburg HRB 37427\nLöschungsankündigung\n\nFormal Bau GmbH\nGesellschaft mit beschränkter Haftung\nDuisburg\n\nDie Formal Bau GmbH soll von Amts wegen gemäß §394 FamFG wegen Vermögenslosigkeit gelöscht werden.\nDie Frist zur Erhebung eines Widerspruchs ist auf drei Monate festgesetzt.\n\nGegen diese Verfügung können Sie Widerspruch einlegen.\n\nDer Widerspruch ist bei dem Amtsgericht - Registergericht - Duisburg, Kardinal-Galen-Straße 124 - 132, 47058 Duisburg, schriftlich in deutscher Sprache oder zur Niederschrift der Geschäftsstelle einzulegen. Der Widerspruch kann auch zur Niederschrift der Geschäftsstelle eines jeden Amtsgerichtes abgegeben werden.\n\nDer Widerspruch muss spätestens innerhalb der gesetzten Frist nach der schriftlichen Bekanntgabe der Verfügung bei dem Amtsgericht Duisburg eingegangen sein. Dies gilt auch dann, wenn der Widerspruch zur Niederschrift der Geschäftsstelle eines anderen Amtsgerichtes abgegeben wurde. Die Frist beginnt mit der schriftlichen Bekanntgabe der Verfügung.\n\nDer Widerspruch muss die Bezeichnung der angefochtenen Verfügung sowie die Erklärung enthalten, dass Widerspruch gegen diese Verfügung eingelegt wird. Er ist zu unterzeichnen und soll begründet werden.\n\nDie Einlegung ist auch durch Übertragung eines elektronischen Dokuments an die elektronische Poststelle des Gerichts möglich. Das elektronische Dokument muss für die Bearbeitung durch das Gericht geeignet und mit einer qualifizierten elektronischen Signatur der verantwortenden Person versehen sein oder von der verantwortenden Person signiert und auf einem sicheren Übermittlungsweg gemäß § 130a ZPO nach näherer Maßgabe der Verordnung über die technischen Rahmenbedingungen des elektronischen Rechtsverkehrs und über das besondere elektronische Behördenpostfach (BGBl. 2017 I, S. 3803) eingereicht werden. Weitere Informationen erhalten Sie auf der Internetseite www.justiz.de."
    },
    {
      "date": "2025-11-17",
      "id": "137549",
      "original_text": "Löschungsankündigung\nNordrhein-Westfalen Amtsgericht Köln HRB 115007\nDim&J UG (haftungsbeschränkt) – Leverkusen",
      "type": "Löschungsankündigung",
      "state": "Nordrhein-Westfalen",
      "amtsgericht": "Amtsgericht Köln",
      "registernummer": "HRB 115007",
      "registerart": "HRB",
      "company_name": "Dim&J UG (haftungsbeschränkt)",
      "company_seat": "Leverkusen",
      "details": "17.11.2025 (Bekanntmachungsdatum)\n\nNordrhein-Westfalen Amtsgericht Köln HRB 115007\nLöschungsankündigung\n\nDim&J UG (haftungsbeschränkt)\nGesellschaft mit beschränkter Haftung\nLeverkusen\n\nDas Registergericht beabsichtigt die Gesellschaft von Amts wegen nach § 394 FamFG zu löschen. Die Frist zur Erhebung eines Widerspruchs ist auf einen Monat festgesetzt."
    },
    {
      "date": "2025-11-17",
      "id": "137550",
      "original_text": "Löschungsankündigung\nNordrhein-Westfalen Amtsgericht Köln HRB 117046\nCandy Town Großhandel GmbH – Köln",
      "type": "Löschungsankündigung",
      "state": "Nordrhein-Westfalen",
      "amtsgericht": "Amtsgericht Köln",
      "registernummer": "HRB 117046",
      "registerart": "HRB",
      "company_name": "Candy Town Großhandel GmbH",
      "company_seat": "Köln",
      "details": "17.11.2025 (Bekanntmachungsdatum)\n\nNordrhein-Westfalen Amtsgericht Köln HRB 117046\nLöschungsankündigung\n\nCandy Town Großhandel GmbH\nGesellschaft mit beschränkter Haftung\nKöln\n\nDas Registergericht beabsichtigt die Gesellschaft von Amts wegen nach § 394 FamFG zu löschen. Die Frist zur Erhebung eines Widerspruchs ist auf einen Monat festgesetzt."
    },
    {
      "date": "2025-11-17",
      "id": "137551",
      "original_text": "Registerbekanntmachung nach dem Umwandlungsgesetz\nNordrhein-Westfalen Amtsgericht Bonn HRB 28115\nCONET Business Consultants GmbH – Bonn",
      "type": "Registerbekanntmachung nach dem Umwandlungsgesetz",
      "state": "Nordrhein-Westfalen",
      "amtsgericht": "Amtsgericht Bonn",
      "registernummer": "HRB 28115",
      "registerart": "HRB",
      "company_name": "CONET Business Consultants GmbH",
      "company_seat": "Bonn",
      "details": "17.11.2025 (Bekanntmachungsdatum)\n\nNordrhein-Westfalen Amtsgericht Bonn HRB 28115\nRegisterbekanntmachung nach dem Umwandlungsgesetz 17.11.2025 (Eintragungsdatum)\n\nCONET Business Consultants GmbH\nGesellschaft mit beschränkter Haftung\nBonn\n\nDen Gläubigern der an der Verschmelzung beteiligten Rechtsträger ist, wenn sie binnen sechs Monaten nach dem Tag, an dem die Eintragung der Verschmelzung in das Register des Sitzes desjenigen Rechtsträgers, dessen Gläubiger sie sind, nach § 19 Absatz 3 UmwG als bekanntgemacht gilt, ihren Anspruch nach Grund und Höhe schriftlich anmelden, Sicherheit zu leisten, soweit sie nicht Befriedigung verlangen können. Dieses Recht steht den Gläubigern jedoch nur zu, wenn sie glaubhaft machen, dass durch die Verschmelzung die Erfüllung ihrer Forderung gefährdet wird."
    },
    {
      "date": "2025-11-17",
      "id": "137552",
      "original_text": "Löschungsankündigung\nNordrhein-Westfalen Amtsgericht Recklinghausen VR 2734\nThe-Happy-Danceworld e.V. – Datteln",
      "type": "Löschungsankündigung",
      "state": "Nordrhein-Westfalen",
      "amtsgericht": "Amtsgericht Recklinghausen",
      "registernummer": "VR 2734",
      "registerart": "VR",
      "company_name": "The-Happy-Danceworld e.V.",
      "company_seat": "Datteln",
      "details": "17.11.2025 (Bekanntmachungsdatum)\n\nNordrhein-Westfalen Amtsgericht Recklinghausen VR 2734\nLöschungsankündigung\n\nThe-Happy-Danceworld e.V.\neingetragener Verein\nDatteln\n\nIn das Vereinsregister soll von Amts wegen das Erlöschen des Vereins eingetragen und das Registerblatt geschlossen werden, weil der Verein nach Erkenntnis des Gerichts keine Mitglieder mehr hat (§§ 395 FamFG in Verbindung mit 4 Abs. 2 Ziff. 1 Vereinsregisterverordnung).\nZur Geltendmachung eines Widerspruchs wird eine Frist von einem Monat ab\nZustellung bestimmt."
    },
    {
      "date": "2025-11-17",
      "id": "137553",
      "original_text": "Einreichung neuer Dokumente\nNordrhein-Westfalen Amtsgericht Essen HRB 12983\nRGE Servicegesellschaft Essen mbH – Essen",
      "type": "Einreichung neuer Dokumente",
      "state": "Nordrhein-Westfalen",
      "amtsgericht": "Amtsgericht Essen",
      "registernummer": "HRB 12983",
      "registerart": "HRB",
      "company_name": "RGE Servicegesellschaft Essen mbH",
      "company_seat": "Essen",
      "details": "17.11.2025 (Bekanntmachungsdatum)\n\nNordrhein-Westfalen Amtsgericht Essen HRB 12983\nEinreichung neuer Dokumente\n\nRGE Servicegesellschaft Essen mbH\nGesellschaft mit beschränkter Haftung\nEssen\n\nDem Registergericht ist eine neue Liste der Mitglieder des Aufsichtsrates eingereicht worden."
    },
    {
      "date": "2025-11-17",
      "id": "137554",
      "original_text": "Löschungsankündigung\nNordrhein-Westfalen Amtsgericht Dortmund HRB 25235\nHübner Heizung & Sanitär GmbH – Dortmund",
      "type": "Löschungsankündigung",
      "state": "Nordrhein-Westfalen",
      "amtsgericht": "Amtsgericht Dortmund",
      "registernummer": "HRB 25235",
      "registerart": "HRB",
      "company_name": "Hübner Heizung & Sanitär GmbH",
      "company_seat": "Dortmund",
      "details": "17.11.2025 (Bekanntmachungsdatum)\n\nNordrhein-Westfalen Amtsgericht Dortmund HRB 25235\nLöschungsankündigung\n\nHübner Heizung & Sanitär GmbH\nGesellschaft mit beschränkter Haftung\nDortmund\n\nDas Registergericht beabsichtigt die Gesellschaft von Amts wegen nach § 394 FamFG zu löschen. Die Frist zur Erhebung eines Widerspruchs ist auf zwei Monate festgesetzt."
    },
    {
      "date": "2025-11-17",
      "id": "137555",
      "original_text": "Löschungsankündigung\nNordrhein-Westfalen Amtsgericht Paderborn HRB 15880\nDeep Isotope GmbH – Büren",
      "type": "Löschungsankündigung",
      "state": "Nordrhein-Westfalen",
      "amtsgericht": "Amtsgericht Paderborn",
      "registernummer": "HRB 15880",
      "registerart": "HRB",
      "company_name": "Deep Isotope GmbH",
      "company_seat": "Büren",
      "details": "17.11.2025 (Bekanntmachungsdatum)\n\nNordrhein-Westfalen Amtsgericht Paderborn HRB 15880\nLöschungsankündigung\n\nDeep Isotope GmbH\nGesellschaft mit beschränkter Haftung\nBüren\n\nDas Registergericht beabsichtigt die Gesellschaft von Amts wegen nach § 394 FamFG zu löschen. Die Frist zur Erhebung eines Widerspruchs ist auf einen Monat festgesetzt."
    },
    {
      "date": "2025-11-17",
      "id": "137556",
      "original_text": "Löschungsankündigung\nNordrhein-Westfalen Amtsgericht Dortmund HRB 28455\nmm Group Production GmbH – Dortmund",
      "type": "Löschungsankündigung",
      "state": "Nordrhein-Westfalen",
      "amtsgericht": "Amtsgericht Dortmund",
      "registernummer": "HRB 28455",
      "registerart": "HRB",
      "company_name": "mm Group Production GmbH",
      "company_seat": "Dortmund",
      "details": "17.11.2025 (Bekanntmachungsdatum)\n\nNordrhein-Westfalen Amtsgericht Dortmund HRB 28455\nLöschungsankündigung\n\nmm Group Production GmbH\nGesellschaft mit beschränkter Haftung\nDortmund\n\nDas Registergericht beabsichtigt die Gesellschaft von Amts wegen nach § 394 FamFG zu löschen. Die Frist zur Erhebung eines Widerspruchs ist auf zwei Monate festgesetzt."
    },
    {
      "date": "2025-11-17",
      "id": "137557",
      "original_text": "Registerbekanntmachung nach dem Umwandlungsgesetz\nNordrhein-Westfalen Amtsgericht Köln HRB 116142\nISL Co-Production GmbH – Köln",
      "type": "Registerbekanntmachung nach dem Umwandlungsgesetz",
      "state": "Nordrhein-Westfalen",
      "amtsgericht": "Amtsgericht Köln",
      "registernummer": "HRB 116142",
      "registerart": "HRB",
      "company_name": "ISL Co-Production GmbH",
      "company_seat": "Köln",
      "details": "17.11.2025 (Bekanntmachungsdatum)\n\nNordrhein-Westfalen Amtsgericht Köln HRB 116142\nRegisterbekanntmachung nach dem Umwandlungsgesetz 17.11.2025 (Eintragungsdatum)\n\nISL Co-Production GmbH\nGesellschaft mit beschränkter Haftung\nKöln\n\nDen Gläubigern der an der Verschmelzung beteiligten Rechtsträger ist, wenn sie binnen sechs Monaten nach dem Tag, an dem die Eintragung der Verschmelzung in das Register des Sitzes desjenigen Rechtsträgers, dessen Gläubiger sie sind, nach § 19 Absatz 3 UmwG als bekanntgemacht gilt, ihren Anspruch nach Grund und Höhe schriftlich anmelden, Sicherheit zu leisten, soweit sie nicht Befriedigung verlangen können. Dieses Recht steht den Gläubigern jedoch nur zu, wenn sie glaubhaft machen, dass durch die Verschmelzung die Erfüllung ihrer Forderung gefährdet wird."
    },
    {
      "date": "2025-11-17",
      "id": "137558",
      "original_text": "Löschungsankündigung\nNordrhein-Westfalen Amtsgericht Dortmund HRB 35361\nTreufuss Tief- und Straßenbau GmbH – Dortmund",
      "type": "Löschungsankündigung",
      "state": "Nordrhein-Westfalen",
      "amtsgericht": "Amtsgericht Dortmund",
      "registernummer": "HRB 35361",
      "registerart": "HRB",
      "company_name": "Treufuss Tief- und Straßenbau GmbH",
      "company_seat": "Dortmund",
      "details": "17.11.2025 (Bekanntmachungsdatum)\n\nNordrhein-Westfalen Amtsgericht Dortmund HRB 35361\nLöschungsankündigung\n\nTreufuss Tief- und Straßenbau GmbH\nGesellschaft mit beschränkter Haftung\nDortmund\n\nDas Registergericht beabsichtigt die Gesellschaft von Amts wegen nach § 394 FamFG zu löschen. Die Frist zur Erhebung eines Widerspruchs ist auf zwei Monate festgesetzt."
    },
    {
      "date": "2025-11-17",
      "id": "137559",
      "original_text": "Registerbekanntmachung nach dem Umwandlungsgesetz\nNordrhein-Westfalen Amtsgericht Düsseldorf HRB 44338\nInVision Aktiengesellschaft – Düsseldorf",
      "type": "Registerbekanntmachung nach dem Umwandlungsgesetz",
      "state": "Nordrhein-Westfalen",
      "amtsgericht": "Amtsgericht Düsseldorf",
      "registernummer": "HRB 44338",
      "registerart": "HRB",
      "company_name": "InVision Aktiengesellschaft",
      "company_seat": "Düsseldorf",
      "details": "17.11.2025 (Bekanntmachungsdatum)\n\nNordrhein-Westfalen Amtsgericht Düsseldorf HRB 44338\nRegisterbekanntmachung nach dem Umwandlungsgesetz 17.11.2025 (Eintragungsdatum)\n\nInVision Aktiengesellschaft\nAktiengesellschaft\nDüsseldorf\n\nDen Gläubigern der an der formwechselnden Umwandlung beteiligten Rechtsträger ist, wenn sie binnen sechs Monaten nach dem Tag, an dem die Eintragung der formwechselnden Umwandlung in das Register des Sitzes desjenigen Rechtsträgers, dessen Gläubiger sie sind, nach § 19 Absatz 3 UmwG als bekanntgemacht gilt, ihren Anspruch nach Grund und Höhe schriftlich anmelden, Sicherheit zu leisten, soweit sie nicht Befriedigung verlangen können. Dieses Recht steht den Gläubigern jedoch nur zu, wenn sie glaubhaft machen, dass durch die formwechselnden Umwandlung die Erfüllung ihrer Forderung gefährdet wird."
    },
    {
      "date": "2025-11-17",
      "id": "137560",
      "original_text": "Registerbekanntmachung nach dem Umwandlungsgesetz\nNordrhein-Westfalen Amtsgericht Hamm HRB 3530\nRhenus Mailroom Services GmbH – Holzwickede",
      "type": "Registerbekanntmachung nach dem Umwandlungsgesetz",
      "state": "Nordrhein-Westfalen",
      "amtsgericht": "Amtsgericht Hamm",
      "registernummer": "HRB 3530",
      "registerart": "HRB",
      "company_name": "Rhenus Mailroom Services GmbH",
      "company_seat": "Holzwickede",
      "details": "17.11.2025 (Bekanntmachungsdatum)\n\nNordrhein-Westfalen Amtsgericht Hamm HRB 3530\nRegisterbekanntmachung nach dem Umwandlungsgesetz 17.11.2025 (Eintragungsdatum)\n\nRhenus Mailroom Services GmbH\nGesellschaft mit beschränkter Haftung\nHolzwickede\n\nDen Gläubigern der an der Verschmelzung beteiligten Rechtsträger ist, wenn sie binnen sechs Monaten nach dem Tag, an dem die Eintragung der Verschmelzung in das Register des Sitzes desjenigen Rechtsträgers, dessen Gläubiger sie sind, nach § 19 Absatz 3 UmwG als bekanntgemacht gilt, ihren Anspruch nach Grund und Höhe schriftlich anmelden, Sicherheit zu leisten, soweit sie nicht Befriedigung verlangen können. Dieses Recht steht den Gläubigern jedoch nur zu, wenn sie glaubhaft machen, dass durch die Verschmelzung die Erfüllung ihrer Forderung gefährdet wird."
    },
    {
      "date": "2025-11-17",
      "id": "137561",
      "original_text": "Registerbekanntmachung nach dem Umwandlungsgesetz\nHessen Amtsgericht Frankfurt am Main HRB 32833\nGBG Ganzert & Kollegen Beratungsgesellschaft mbH – Frankfurt am Main",
      "type": "Registerbekanntmachung nach dem Umwandlungsgesetz",
      "state": "Hessen",
      "amtsgericht": "Amtsgericht Frankfurt am Main",
      "registernummer": "HRB 32833",
      "registerart": "HRB",
      "company_name": "GBG Ganzert & Kollegen Beratungsgesellschaft mbH",
      "company_seat": "Frankfurt am Main",
      "details": "17.11.2025 (Bekanntmachungsdatum)\n\nHessen Amtsgericht Frankfurt am Main HRB 32833\nRegisterbekanntmachung nach dem Umwandlungsgesetz 17.11.2025 (Eintragungsdatum)\n\nGBG Ganzert & Kollegen Beratungsgesellschaft mbH\nGesellschaft mit beschränkter Haftung\nFrankfurt am Main\n\nDen Gläubigern der an der Verschmelzung beteiligten Rechtsträger ist, wenn sie binnen sechs Monaten nach dem Tag, an dem die Eintragung der Verschmelzung in das Register des Sitzes derjenigen Rechtsträger deren Gläubiger sie sind, nach § 19 Absatz 3 UmwG bekannt gemacht worden ist, ihren Anspruch nach Grund und Höhe schriftlich anmelden, Sicherheit zu leisten, soweit sie nicht Befriedigung verlangen können. Dieses Recht steht den Gläubigern jedoch nur zu, wenn sie glaubhaft machen, dass durch die Verschmelzung die Erfüllung ihrer Forderung gefährdet wird."
    },
    {
      "date": "2025-11-17",
      "id": "137562",
      "original_text": "Registerbekanntmachung nach dem Umwandlungsgesetz\nHessen Amtsgericht Frankfurt am Main HRB 126043\nDöhler SE – Frankfurt am Main",
      "type": "Registerbekanntmachung nach dem Umwandlungsgesetz",
      "state": "Hessen",
      "amtsgericht": "Amtsgericht Frankfurt am Main",
      "registernummer": "HRB 126043",
      "registerart": "HRB",
      "company_name": "Döhler SE",
      "company_seat": "Frankfurt am Main",
      "details": "17.11.2025 (Bekanntmachungsdatum)\n\nHessen Amtsgericht Frankfurt am Main HRB 126043\nRegisterbekanntmachung nach dem Umwandlungsgesetz 17.11.2025 (Eintragungsdatum)\n\nDöhler SE\nEuropäische Aktiengesellschaft (SE)\nFrankfurt am Main\n\nDen Gläubigern der an der Ausgliederung beteiligten Rechtsträger ist, wenn sie binnen sechs Monaten nach dem Tag, an dem die Eintragung der Ausgliederung in das Register des Sitzes derjenigen Rechtsträger deren Gläubiger sie sind, nach §§ 125, 19 Absatz 3 UmwG bekannt gemacht worden ist, ihren Anspruch nach Grund und Höhe schriftlich anmelden, Sicherheit zu leisten, soweit sie nicht Befriedigung verlangen können. Dieses Recht steht den Gläubigern jedoch nur zu, wenn sie glaubhaft machen, dass durch die Ausgliederung die Erfüllung ihrer Forderung gefährdet wird."
    },
    {
      "date": "2025-11-17",
      "id": "137563",
      "original_text": "Sonstige Registerbekanntmachung\nHessen Amtsgericht Wetzlar VR 3338\nWanderfreunde Sinn e.V. – Sinn",
      "type": "Sonstige Registerbekanntmachung",
      "state": "Hessen",
      "amtsgericht": "Amtsgericht Wetzlar",
      "registernummer": "VR 3338",
      "registerart": "VR",
      "company_name": "Wanderfreunde Sinn e.V.",
      "company_seat": "Sinn",
      "details": "17.11.2025 (Bekanntmachungsdatum)\n\nHessen Amtsgericht Wetzlar VR 3338\nSonstige Registerbekanntmachung 17.11.2025 (Eintragungsdatum)\n\nWanderfreunde Sinn e.V.\neingetragener Verein\nSinn\n\nDer Verein ist aufgelöst."
    },
    {
      "date": "2025-11-17",
      "id": "137564",
      "original_text": "Löschungsankündigung\nHessen Amtsgericht Frankfurt am Main HRB 125894\nLOT Baugesellschaft GmbH – Frankfurt am Main",
      "type": "Löschungsankündigung",
      "state": "Hessen",
      "amtsgericht": "Amtsgericht Frankfurt am Main",
      "registernummer": "HRB 125894",
      "registerart": "HRB",
      "company_name": "LOT Baugesellschaft GmbH",
      "company_seat": "Frankfurt am Main",
      "details": "17.11.2025 (Bekanntmachungsdatum)\n\nHessen Amtsgericht Frankfurt am Main HRB 125894\nLöschungsankündigung 17.11.2025 (Eintragungsdatum)\n\nLOT Baugesellschaft GmbH\nGesellschaft mit beschränkter Haftung\nFrankfurt am Main\n\nDas Registergericht beabsichtigt die im Handelsregister eingetragene Gesellschaft von Amts wegen nach § 394 FamFG zu löschen. Die Frist zur Erhebung eines Widerspruchs gegen die beabsichtigte Löschung wird auf 1 Monat festgesetzt."
    },
    {
      "date": "2025-11-17",
      "id": "137565",
      "original_text": "Registerbekanntmachung nach dem Umwandlungsgesetz\nHessen Amtsgericht Frankfurt am Main HRA 54344\nAlexander M. Ganzert Consulting & Coaching e.K. – Frankfurt am Main",
      "type": "Registerbekanntmachung nach dem Umwandlungsgesetz",
      "state": "Hessen",
      "amtsgericht": "Amtsgericht Frankfurt am Main",
      "registernummer": "HRA 54344",
      "registerart": "HRA",
      "company_name": "Alexander M. Ganzert Consulting & Coaching e.K.",
      "company_seat": "Frankfurt am Main",
      "details": "17.11.2025 (Bekanntmachungsdatum)\n\nHessen Amtsgericht Frankfurt am Main HRA 54344\nRegisterbekanntmachung nach dem Umwandlungsgesetz 17.11.2025 (Eintragungsdatum)\n\nAlexander M. Ganzert Consulting & Coaching e.K.\nEinzelkaufmann / Einzelkauffrau\nFrankfurt am Main\n\nDen Gläubigern der an der Verschmelzung beteiligten Rechtsträger ist, wenn sie binnen sechs Monaten nach dem Tag, an dem die Eintragung der Verschmelzung in das Register des Sitzes derjenigen Rechtsträger deren Gläubiger sie sind, nach § 19 Absatz 3 UmwG bekannt gemacht worden ist, ihren Anspruch nach Grund und Höhe schriftlich anmelden, Sicherheit zu leisten, soweit sie nicht Befriedigung verlangen können. Dieses Recht steht den Gläubigern jedoch nur zu, wenn sie glaubhaft machen, dass durch die Verschmelzung die Erfüllung ihrer Forderung gefährdet wird."
    },
    {
      "date": "2025-11-17",
      "id": "137566",
      "original_text": "Registerbekanntmachung nach dem Umwandlungsgesetz\nHessen Amtsgericht Wetzlar HRB 9276\nHealy International GmbH – Wetzlar",
      "type": "Registerbekanntmachung nach dem Umwandlungsgesetz",
      "state": "Hessen",
      "amtsgericht": "Amtsgericht Wetzlar",
      "registernummer": "HRB 9276",
      "registerart": "HRB",
      "company_name": "Healy International GmbH",
      "company_seat": "Wetzlar",
      "details": "17.11.2025 (Bekanntmachungsdatum)\n\nHessen Amtsgericht Wetzlar HRB 9276\nRegisterbekanntmachung nach dem Umwandlungsgesetz 15.11.2025 (Eintragungsdatum)\n\nHealy International GmbH\nGesellschaft mit beschränkter Haftung\nWetzlar\n\nDen Gläubigern der an der Verschmelzung beteiligten Rechtsträger ist, wenn sie binnen sechs Monaten nach dem Tag, an dem die Eintragung der Verschmelzung in das Register des Sitzes desjenigen Rechtsträgers, dessen Gläubiger sie sind, nach § 19 Absatz 3 UmwG bekannt gemacht worden ist, ihren Anspruch nach Grund und Höhe schriftlich anmelden, Sicherheit zu leisten, soweit sie nicht Befriedigung verlangen können. Dieses Recht steht den Gläubigern jedoch nur zu, wenn sie glaubhaft machen, dass durch die Verschmelzung die Erfüllung ihrer Forderung gefährdet wird."
    },
    {
      "date": "2025-11-17",
      "id": "137567",
      "original_text": "Löschungsankündigung\nHessen Amtsgericht Wiesbaden HRB 19178\nPALOS CONSULT GmbH – Taunusstein",
      "type": "Löschungsankündigung",
      "state": "Hessen",
      "amtsgericht": "Amtsgericht Wiesbaden",
      "registernummer": "HRB 19178",
      "registerart": "HRB",
      "company_name": "PALOS CONSULT GmbH",
      "company_seat": "Taunusstein",
      "details": "17.11.2025 (Bekanntmachungsdatum)\n\nHessen Amtsgericht Wiesbaden HRB 19178\nLöschungsankündigung\n\nPALOS CONSULT GmbH\nGesellschaft mit beschränkter Haftung\nTaunusstein\n\nDas Registergericht beabsichtigt die im Handelsregister eingetragene Gesellschaft von Amts wegen nach § 394 FamFG zu löschen. Die Frist zur Erhebung eines Widerspruchs gegen die beabsichtigte Löschung wird auf 3 Monate festgesetzt."
    },
    {
      "date": "2025-11-17",
      "id": "137568",
      "original_text": "Registerbekanntmachung nach dem Umwandlungsgesetz\nHessen Amtsgericht Wetzlar HRB 7234\nChrilian Management GmbH – Herborn",
      "type": "Registerbekanntmachung nach dem Umwandlungsgesetz",
      "state": "Hessen",
      "amtsgericht": "Amtsgericht Wetzlar",
      "registernummer": "HRB 7234",
      "registerart": "HRB",
      "company_name": "Chrilian Management GmbH",
      "company_seat": "Herborn",
      "details": "17.11.2025 (Bekanntmachungsdatum)\n\nHessen Amtsgericht Wetzlar HRB 7234\nRegisterbekanntmachung nach dem Umwandlungsgesetz 15.11.2025 (Eintragungsdatum)\n\nChrilian Management GmbH\nGesellschaft mit beschränkter Haftung\nHerborn\n\nDen Gläubigern der an der Verschmelzung beteiligten Rechtsträger ist, wenn sie binnen sechs Monaten nach dem Tag, an dem die Eintragung der Verschmelzung in das Register des Sitzes desjenigen Rechtsträgers, dessen Gläubiger sie sind, nach § 19 Absatz 3 UmwG bekannt gemacht worden ist, ihren Anspruch nach Grund und Höhe schriftlich anmelden, Sicherheit zu leisten, soweit sie nicht Befriedigung verlangen können. Dieses Recht steht den Gläubigern jedoch nur zu, wenn sie glaubhaft machen, dass durch die Verschmelzung die Erfüllung ihrer Forderung gefährdet wird."
    },
    {
      "date": "2025-11-17",
      "id": "137569",
      "original_text": "Löschungsankündigung\nHessen Amtsgericht Frankfurt am Main HRB 93876\nB & B Club Sport GmbH – Eschborn",
      "type": "Löschungsankündigung",
      "state": "Hessen",
      "amtsgericht": "Amtsgericht Frankfurt am Main",
      "registernummer": "HRB 93876",
      "registerart": "HRB",
      "company_name": "B & B Club Sport GmbH",
      "company_seat": "Eschborn",
      "details": "17.11.2025 (Bekanntmachungsdatum)\n\nHessen Amtsgericht Frankfurt am Main HRB 93876\nLöschungsankündigung\n\nB & B Club Sport GmbH\nGesellschaft mit beschränkter Haftung\nEschborn\n\nDas Registergericht beabsichtigt die im Handelsregister eingetragene Gesellschaft von Amts wegen nach § 394 FamFG zu löschen. Die Frist zur Erhebung eines Widerspruchs gegen die beabsichtigte Löschung wird auf 1 Monat festgesetzt."
    },
    {
      "date": "2025-11-17",
      "id": "137570",
      "original_text": "Registerbekanntmachung nach dem Umwandlungsgesetz\nHessen Amtsgericht Hanau HRB 98795\nAuvictum New Care Holding GmbH – Hanau",
      "type": "Registerbekanntmachung nach dem Umwandlungsgesetz",
      "state": "Hessen",
      "amtsgericht": "Amtsgericht Hanau",
      "registernummer": "HRB 98795",
      "registerart": "HRB",
      "company_name": "Auvictum New Care Holding GmbH",
      "company_seat": "Hanau",
      "details": "17.11.2025 (Bekanntmachungsdatum)\n\nHessen Amtsgericht Hanau HRB 98795\nRegisterbekanntmachung nach dem Umwandlungsgesetz 17.11.2025 (Eintragungsdatum)\n\nAuvictum New Care Holding GmbH\nGesellschaft mit beschränkter Haftung\nHanau\n\nDen Gläubigern der an der Verschmelzung beteiligten Rechtsträger ist, wenn sie binnen sechs Monaten nach dem Tag, an dem die Eintragung der Verschmelzung in das Register des Sitzes desjenigen Rechtsträgers, dessen Gläubiger sie sind, nach § 19 Absatz 3 UmwG bekannt gemacht worden ist, ihren Anspruch nach Grund und Höhe schriftlich anmelden, Sicherheit zu leisten, soweit sie nicht Befriedigung verlangen können. Dieses Recht steht den Gläubigern jedoch nur zu, wenn sie glaubhaft machen, dass durch die Verschmelzung die Erfüllung ihrer Forderung gefährdet wird."
    }
  ]
}