{
  "date": "2025-11-28",
  "date_of_scrape": "2025-11-29T04:08:31.916Z",
  "tool_version": "0.2.0",
  "number_of_announcements": 98,
  "announcements": [
    {
      "date": "2025-11-28",
      "id": "138542",
      "original_text": "Registerbekanntmachung nach dem Umwandlungsgesetz\nBayern Amtsgericht Weiden i. d. OPf. HRA 3309\nAutohaus Ackermann Altenstadt e.K. – Altenstadt a. d. Waldnaab",
      "type": "Registerbekanntmachung nach dem Umwandlungsgesetz",
      "state": "Bayern",
      "amtsgericht": "Amtsgericht Weiden i. d. OPf.",
      "registernummer": "HRA 3309",
      "registerart": "HRA",
      "company_name": "Autohaus Ackermann Altenstadt e.K.",
      "company_seat": "Altenstadt a. d. Waldnaab",
      "details": "28.11.2025 (Bekanntmachungsdatum)\n\nBayern Amtsgericht Weiden i. d. OPf. HRA 3309\nRegisterbekanntmachung nach dem Umwandlungsgesetz 27.11.2025 (Eintragungsdatum)\n\nAutohaus Ackermann Altenstadt e.K.\nEinzelkaufmann / Einzelkauffrau\nAltenstadt a. d. Waldnaab\n\nDen Gläubigern der an der Ausgliederung beteiligten Rechtsträger ist, wenn sie binnen sechs Monaten nach dem Tag, an dem die Eintragung der Ausgliederung in das Register des Sitzes desjenigen Rechtsträgers, dessen Gläubiger sie sind, nach §§ 125, 19 Abs. 3 UmwG als bekannt gemacht gilt, ihren Anspruch nach Grund und Höhe in Textform anmelden, Sicherheit zu leisten, soweit sie nicht Befriedigung verlangen können. Dieses Recht steht den Gläubigern jedoch nur zu, wenn sie glaubhaft machen, dass durch die Ausgliederung die Erfüllung ihrer Forderung gefährdet wird."
    },
    {
      "date": "2025-11-28",
      "id": "138543",
      "original_text": "Registerbekanntmachung nach dem Umwandlungsgesetz\nBayern Amtsgericht Nürnberg HRB 42846\nDGbAV - Deutsche Gesellschaft für betriebliche Altersversorgung AG – Nürnberg",
      "type": "Registerbekanntmachung nach dem Umwandlungsgesetz",
      "state": "Bayern",
      "amtsgericht": "Amtsgericht Nürnberg",
      "registernummer": "HRB 42846",
      "registerart": "HRB",
      "company_name": "DGbAV - Deutsche Gesellschaft für betriebliche Altersversorgung AG",
      "company_seat": "Nürnberg",
      "details": "28.11.2025 (Bekanntmachungsdatum)\n\nBayern Amtsgericht Nürnberg HRB 42846\nRegisterbekanntmachung nach dem Umwandlungsgesetz 27.11.2025 (Eintragungsdatum)\n\nDGbAV - Deutsche Gesellschaft für betriebliche Altersversorgung AG\nAktiengesellschaft\nNürnberg\n\nDen Gläubigern der an der Verschmelzung beteiligten Rechtsträger ist, wenn sie binnen sechs Monaten nach dem Tag, an dem die Eintragung der Verschmelzung in das Register des Sitzes desjenigen Rechtsträgers, dessen Gläubiger sie sind, nach § 19 Abs. 3 UmwG als bekannt gemacht gilt, ihren Anspruch nach Grund und Höhe in Textform anmelden, Sicherheit zu leisten, soweit sie nicht Befriedigung verlangen können. Dieses Recht steht den Gläubigern jedoch nur zu, wenn sie glaubhaft machen, dass durch die Verschmelzung die Erfüllung ihrer Forderung gefährdet wird."
    },
    {
      "date": "2025-11-28",
      "id": "138544",
      "original_text": "Registerbekanntmachung nach dem Umwandlungsgesetz\nBayern Amtsgericht Nürnberg HRB 43484\nDGVE - Deutsche Gesellschaft für Vermögensentwicklung mbH – Nürnberg",
      "type": "Registerbekanntmachung nach dem Umwandlungsgesetz",
      "state": "Bayern",
      "amtsgericht": "Amtsgericht Nürnberg",
      "registernummer": "HRB 43484",
      "registerart": "HRB",
      "company_name": "DGVE - Deutsche Gesellschaft für Vermögensentwicklung mbH",
      "company_seat": "Nürnberg",
      "details": "28.11.2025 (Bekanntmachungsdatum)\n\nBayern Amtsgericht Nürnberg HRB 43484\nRegisterbekanntmachung nach dem Umwandlungsgesetz 27.11.2025 (Eintragungsdatum)\n\nDGVE - Deutsche Gesellschaft für Vermögensentwicklung mbH\nGesellschaft mit beschränkter Haftung\nNürnberg\n\nDen Gläubigern der an der Verschmelzung beteiligten Rechtsträger ist, wenn sie binnen sechs Monaten nach dem Tag, an dem die Eintragung der Verschmelzung in das Register des Sitzes desjenigen Rechtsträgers, dessen Gläubiger sie sind, nach § 19 Abs. 3 UmwG als bekannt gemacht gilt, ihren Anspruch nach Grund und Höhe in Textform anmelden, Sicherheit zu leisten, soweit sie nicht Befriedigung verlangen können. Dieses Recht steht den Gläubigern jedoch nur zu, wenn sie glaubhaft machen, dass durch die Verschmelzung die Erfüllung ihrer Forderung gefährdet wird."
    },
    {
      "date": "2025-11-28",
      "id": "138545",
      "original_text": "Registerbekanntmachung nach dem Umwandlungsgesetz\nBayern Amtsgericht Weiden i. d. OPf. HRA 3312\nAutohaus Ackermann GmbH & Co. KG – Altenstadt a.d.Waldnaab",
      "type": "Registerbekanntmachung nach dem Umwandlungsgesetz",
      "state": "Bayern",
      "amtsgericht": "Amtsgericht Weiden i. d. OPf.",
      "registernummer": "HRA 3312",
      "registerart": "HRA",
      "company_name": "Autohaus Ackermann GmbH & Co. KG",
      "company_seat": "Altenstadt a.d.Waldnaab",
      "details": "28.11.2025 (Bekanntmachungsdatum)\n\nBayern Amtsgericht Weiden i. d. OPf. HRA 3312\nRegisterbekanntmachung nach dem Umwandlungsgesetz 27.11.2025 (Eintragungsdatum)\n\nAutohaus Ackermann GmbH & Co. KG\nKommanditgesellschaft\nAltenstadt a.d.Waldnaab\n\nDen Gläubigern der an der Ausgliederung beteiligten Rechtsträger ist, wenn sie binnen sechs Monaten nach dem Tag, an dem die Eintragung der Ausgliederung in das Register des Sitzes desjenigen Rechtsträgers, dessen Gläubiger sie sind, nach §§ 125, 19 Abs. 3 UmwG als bekannt gemacht gilt, ihren Anspruch nach Grund und Höhe in Textform anmelden, Sicherheit zu leisten, soweit sie nicht Befriedigung verlangen können. Dieses Recht steht den Gläubigern jedoch nur zu, wenn sie glaubhaft machen, dass durch die Ausgliederung die Erfüllung ihrer Forderung gefährdet wird."
    },
    {
      "date": "2025-11-28",
      "id": "138546",
      "original_text": "Registerbekanntmachung nach dem Umwandlungsgesetz\nBayern Amtsgericht Traunstein HRB 33691\nInntaler Trachtenwelt GmbH – Kolbermoor",
      "type": "Registerbekanntmachung nach dem Umwandlungsgesetz",
      "state": "Bayern",
      "amtsgericht": "Amtsgericht Traunstein",
      "registernummer": "HRB 33691",
      "registerart": "HRB",
      "company_name": "Inntaler Trachtenwelt GmbH",
      "company_seat": "Kolbermoor",
      "details": "28.11.2025 (Bekanntmachungsdatum)\n\nBayern Amtsgericht Traunstein HRB 33691\nRegisterbekanntmachung nach dem Umwandlungsgesetz 27.11.2025 (Eintragungsdatum)\n\nInntaler Trachtenwelt GmbH\nGesellschaft mit beschränkter Haftung\nKolbermoor\n\nDen Gläubigern der an der Verschmelzung beteiligten Rechtsträger ist, wenn sie binnen sechs Monaten nach dem Tag, an dem die Eintragung der Verschmelzung in das Register des Sitzes desjenigen Rechtsträgers, dessen Gläubiger sie sind, nach § 19 Abs. 3 UmwG als bekannt gemacht gilt, ihren Anspruch nach Grund und Höhe in Textform anmelden, Sicherheit zu leisten, soweit sie nicht Befriedigung verlangen können. Dieses Recht steht den Gläubigern jedoch nur zu, wenn sie glaubhaft machen, dass durch die Verschmelzung die Erfüllung ihrer Forderung gefährdet wird."
    },
    {
      "date": "2025-11-28",
      "id": "138547",
      "original_text": "Registerbekanntmachung nach dem Umwandlungsgesetz\nBayern Amtsgericht Aschaffenburg HRA 5802\nF.L. Dessauer GmbH & Co. KG – Aschaffenburg",
      "type": "Registerbekanntmachung nach dem Umwandlungsgesetz",
      "state": "Bayern",
      "amtsgericht": "Amtsgericht Aschaffenburg",
      "registernummer": "HRA 5802",
      "registerart": "HRA",
      "company_name": "F.L. Dessauer GmbH & Co. KG",
      "company_seat": "Aschaffenburg",
      "details": "28.11.2025 (Bekanntmachungsdatum)\n\nBayern Amtsgericht Aschaffenburg HRA 5802\nRegisterbekanntmachung nach dem Umwandlungsgesetz 27.11.2025 (Eintragungsdatum)\n\nF.L. Dessauer GmbH & Co. KG\nKommanditgesellschaft\nAschaffenburg\n\nDen Gläubigern des formwechselnden Rechtsträgers ist, wenn sie binnen sechs Monaten nach dem Tag, an dem die Eintragung des Formwechsels nach § 201 UmwG als bekannt gemacht gilt, ihren Anspruch nach Grund und Höhe in Textform anmelden, Sicherheit zu leisten, soweit sie nicht Befriedigung verlangen können. Dieses Recht steht den Gläubigern jedoch nur zu, wenn sie glaubhaft machen, dass durch den Formwechsel die Erfüllung ihrer Forderung gefährdet wird."
    },
    {
      "date": "2025-11-28",
      "id": "138548",
      "original_text": "Registerbekanntmachung nach dem Umwandlungsgesetz\nBayern Amtsgericht Traunstein HRB 20803\nP.M. Verwaltungs- und Vertriebsgesellschaft Kolbermoor mbH – Kolbermoor",
      "type": "Registerbekanntmachung nach dem Umwandlungsgesetz",
      "state": "Bayern",
      "amtsgericht": "Amtsgericht Traunstein",
      "registernummer": "HRB 20803",
      "registerart": "HRB",
      "company_name": "P.M. Verwaltungs- und Vertriebsgesellschaft Kolbermoor mbH",
      "company_seat": "Kolbermoor",
      "details": "28.11.2025 (Bekanntmachungsdatum)\n\nBayern Amtsgericht Traunstein HRB 20803\nRegisterbekanntmachung nach dem Umwandlungsgesetz 27.11.2025 (Eintragungsdatum)\n\nP.M. Verwaltungs- und Vertriebsgesellschaft Kolbermoor mbH\nGesellschaft mit beschränkter Haftung\nKolbermoor\n\nDen Gläubigern der an der Verschmelzung beteiligten Rechtsträger ist, wenn sie binnen sechs Monaten nach dem Tag, an dem die Eintragung der Verschmelzung in das Register des Sitzes desjenigen Rechtsträgers, dessen Gläubiger sie sind, nach § 19 Abs. 3 UmwG als bekannt gemacht gilt, ihren Anspruch nach Grund und Höhe in Textform anmelden, Sicherheit zu leisten, soweit sie nicht Befriedigung verlangen können. Dieses Recht steht den Gläubigern jedoch nur zu, wenn sie glaubhaft machen, dass durch die Verschmelzung die Erfüllung ihrer Forderung gefährdet wird."
    },
    {
      "date": "2025-11-28",
      "id": "138549",
      "original_text": "Einreichung neuer Dokumente\nBayern Amtsgericht Hof HRB 3643\nRAUMEDIC AG – Münchberg",
      "type": "Einreichung neuer Dokumente",
      "state": "Bayern",
      "amtsgericht": "Amtsgericht Hof",
      "registernummer": "HRB 3643",
      "registerart": "HRB",
      "company_name": "RAUMEDIC AG",
      "company_seat": "Münchberg",
      "details": "28.11.2025 (Bekanntmachungsdatum)\n\nBayern Amtsgericht Hof HRB 3643\nEinreichung neuer Dokumente\n\nRAUMEDIC AG\nAktiengesellschaft\nMünchberg\n\nDem Amtsgericht Hof -Registergericht- ist eine Liste der Mitglieder des Aufsichtsrats eingereicht worden, § 106 AktG."
    },
    {
      "date": "2025-11-28",
      "id": "138550",
      "original_text": "Einreichung neuer Dokumente\nBayern Amtsgericht Augsburg HRB 22056\nEverllence SE – Augsburg",
      "type": "Einreichung neuer Dokumente",
      "state": "Bayern",
      "amtsgericht": "Amtsgericht Augsburg",
      "registernummer": "HRB 22056",
      "registerart": "HRB",
      "company_name": "Everllence SE",
      "company_seat": "Augsburg",
      "details": "28.11.2025 (Bekanntmachungsdatum)\n\nBayern Amtsgericht Augsburg HRB 22056\nEinreichung neuer Dokumente\n\nEverllence SE\nEuropäische Aktiengesellschaft (SE)\nAugsburg\n\nDem Amtsgericht Augsburg -Registergericht- ist eine Liste der Mitglieder des Aufsichtsrats eingereicht worden, Art. 9 Abs. 1 Buchst. c (ii) SE-VO i.V.m. § 106 AktG."
    },
    {
      "date": "2025-11-28",
      "id": "138551",
      "original_text": "Einreichung neuer Dokumente\nBerlin Amtsgericht Berlin (Charlottenburg) HRB 60603\nTierpark Hotel GmbH – Berlin",
      "type": "Einreichung neuer Dokumente",
      "state": "Berlin",
      "amtsgericht": "Amtsgericht Berlin (Charlottenburg)",
      "registernummer": "HRB 60603",
      "registerart": "HRB",
      "company_name": "Tierpark Hotel GmbH",
      "company_seat": "Berlin",
      "details": "28.11.2025 (Bekanntmachungsdatum)\n\nBerlin Amtsgericht Berlin (Charlottenburg) HRB 60603\nEinreichung neuer Dokumente\n\nTierpark Hotel GmbH\nGesellschaft mit beschränkter Haftung\nBerlin\n\nAls nicht eingetragen wird veröffentlicht: Die Gesellschaft hat den Entwurf eines Formwechselplans betreffend den grenzüberschreitenden, identitätswahrenden Formwechsel unter gleichzeitiger Verlegung des Satzungssitzes der Gesellschaft nach Luxemburg gemäß §§ 333 ff. UmwG zum Handelsregister des Amtsgerichts Charlottenburg eingereicht.\n1. Es wird darauf hingewiesen, dass der Formwechselplan beim hlandelsregister eingereicht worden ist.\n2. Der Formwechsel betrifft die Tierpark Hotel GmbH, eine Gesellschaft nach deutschem Recht mit Sitz in Berlin, Deutschland, die ihre Rechtsform in eine Gesellschaft luxemburgischen Rechts (S.ä r.l.) mit der künftigen Firma CREI Roots S.ä r.l. und dem künftigem Sitz in Luxemburg, Großherzogtum Luxemburg, ändert.\n3. Die Gesellschaft ist eingetragen im Handelsregister des Amtsgerichts Charlottenburg unter HRB 60603 B.\n4. Hinweise an Anteilsinhaber, Gläubiger und Arbeitnehmer der Gesellschaft:\nDie Gesellschafterversammlung findet voraussichtlich am 18. Februar 2026, nicht aber früher statt. Sie können bis spätestens fünf Arbeitstage vor dem Tag der Gesellschafterversammlung Bemerkungen zum Entwurf des Formwechselplans an die Gesellschaft übermitteln.\n5. Gläubiger der Gesellschaft können verlangen, dass ihnen Sicherheit geleistet wird für eine Forderung, die\na. vor der Bekanntmachung des Formwechselplans oder seines Entwurfs entstanden, aber im Zeitpunkt der Bekanntmachung noch nicht fällig geworden ist, und\nb. deren Erfüllung durch den Formwechsel gefährdet wird.\n\nDie Voraussetzungen des Anspruchs sind gegenüber dem zuständigen Gericht glaubhaft zu machen. Der Anspruch auf Sicherheitsleistung erlischt, wenn er nicht innerhalb von drei Monaten ab Bekanntmachung des Formwechselplans gerichtlich geltend gemacht wurde."
    },
    {
      "date": "2025-11-28",
      "id": "138552",
      "original_text": "Löschungsankündigung\nSaarland Amtsgericht Saarbrücken HRB 106641\nJost Elektrotechnik UG (haftungsbeschränkt) – Saarbrücken",
      "type": "Löschungsankündigung",
      "state": "Saarland",
      "amtsgericht": "Amtsgericht Saarbrücken",
      "registernummer": "HRB 106641",
      "registerart": "HRB",
      "company_name": "Jost Elektrotechnik UG (haftungsbeschränkt)",
      "company_seat": "Saarbrücken",
      "details": "28.11.2025 (Bekanntmachungsdatum)\n\nSaarland Amtsgericht Saarbrücken HRB 106641\nLöschungsankündigung\n\nJost Elektrotechnik UG (haftungsbeschränkt)\nGesellschaft mit beschränkter Haftung\nSaarbrücken\n\nEs ist beabsichtigt, die Gesellschaft von Amts wegen gemäß § 394 FamFG wegen Vermögenslosigkeit zu löschen.\nGegen die Löschung von Amts wegen ist das Rechtsmittel des Widerspruchs statthaft. Der Widerspruch ist binnen einer Frist zwei Monaten beginnend mit dem Tag dieser Veröffentlichung durch Einreichen eines Widerspruchsschreibens -schriftlich oder zur Niederschrift der Geschäftsstelle beim Amtsgericht Saarbrücken, -zentrales Handelsregister-, Mainzerstr.178, 66121 Saarbrücken einzulegen.\nDer Widerspruch muss die Bezeichnung der angefochtenen Löschungsankündigung enthalten sowie die Erklärung, dass Widerspruch eingelegt wird. Er ist vom Widerspruchsführer oder seinem Bevollmächtigten zu unterzeichnen.\nDas Widerspruchsschreiben kann auch in der Form eines elektronischen Dokumentes eingereicht werden, das mit einer qualifizierten elektronischen Signatur nach dem Signaturgesetz versehen sein muss (§§ 14 Abs. 2 FamFG, 130a, 298 ZPO)."
    },
    {
      "date": "2025-11-28",
      "id": "138553",
      "original_text": "Löschungsankündigung\nBaden-Württemberg Amtsgericht Stuttgart HRB 764158\nNeureka GmbH – Stuttgart",
      "type": "Löschungsankündigung",
      "state": "Baden-Württemberg",
      "amtsgericht": "Amtsgericht Stuttgart",
      "registernummer": "HRB 764158",
      "registerart": "HRB",
      "company_name": "Neureka GmbH",
      "company_seat": "Stuttgart",
      "details": "28.11.2025 (Bekanntmachungsdatum)\n\nBaden-Württemberg Amtsgericht Stuttgart HRB 764158\nLöschungsankündigung\n\nNeureka GmbH\nGesellschaft mit beschränkter Haftung\nStuttgart\n\nAls nicht eingetragen wird bekanntgemacht:\nDas Gericht beabsichtigt, die Gesellschaft wegen Vermögenslosigkeit im Handelsregister von Amts wegen nach § 394 FamFG zu löschen. Die Frist zur Geltendmachung eines Widerspruchs gegen die beabsichtigte Löschung ist auf zwei Monate ab Veröffentlichung bestimmt."
    },
    {
      "date": "2025-11-28",
      "id": "138554",
      "original_text": "Löschungsankündigung\nBerlin Amtsgericht Berlin (Charlottenburg) HRB 159045\nGreenstars GmbH – Berlin",
      "type": "Löschungsankündigung",
      "state": "Berlin",
      "amtsgericht": "Amtsgericht Berlin (Charlottenburg)",
      "registernummer": "HRB 159045",
      "registerart": "HRB",
      "company_name": "Greenstars GmbH",
      "company_seat": "Berlin",
      "details": "28.11.2025 (Bekanntmachungsdatum)\n\nBerlin Amtsgericht Berlin (Charlottenburg) HRB 159045\nLöschungsankündigung\n\nGreenstars GmbH\nGesellschaft mit beschränkter Haftung\nBerlin\n\nBei der nachstehenden Gesellschaft wird das Amtslöschungsverfahren gemäß § 394 FamFG eingeleitet. Widerspruchsfrist 6 Wochen"
    },
    {
      "date": "2025-11-28",
      "id": "138555",
      "original_text": "Löschungsankündigung\nSaarland Amtsgericht Saarbrücken HRB 12255\nM & F Internationale Transporte GmbH – Friedrichsthal",
      "type": "Löschungsankündigung",
      "state": "Saarland",
      "amtsgericht": "Amtsgericht Saarbrücken",
      "registernummer": "HRB 12255",
      "registerart": "HRB",
      "company_name": "M & F Internationale Transporte GmbH",
      "company_seat": "Friedrichsthal",
      "details": "28.11.2025 (Bekanntmachungsdatum)\n\nSaarland Amtsgericht Saarbrücken HRB 12255\nLöschungsankündigung 28.11.2025 (Eintragungsdatum)\n\nM & F Internationale Transporte GmbH\nGesellschaft mit beschränkter Haftung\nFriedrichsthal\n\nEs ist beabsichtigt, die Gesellschaft von Amts wegen gemäß § 394 FamFG wegen Vermögenslosigkeit zu löschen. Gegen die Löschung von Amts wegen ist das Rechtsmittel des Widerspruchs statthaft. Der Widerspruch ist binnen einer Frist von 2 Monaten beginnend mit dem Tag dieser Veröffentlichung durch Einreichen eines Widerspruchsschreibens -schriftlich oder zur Niederschrift der Geschäftsstelle- beim Amtsgericht Saarbrücken, -zentrales Handelsregister-, Mainzerstr.178, 66121 Saarbrücken einzulegen. Der Widerspruch muss die Bezeichnung der angefochtenen Löschungsankündigung enthalten sowie die Erklärung, dass Widerspruch eingelegt wird. Er ist vom Widerspruchsführer oder seinem Bevollmächtigten zu unterzeichnen."
    },
    {
      "date": "2025-11-28",
      "id": "138556",
      "original_text": "Einreichung neuer Dokumente\nBaden-Württemberg Amtsgericht Stuttgart HRB 107207\nHeilbronn Marketing GmbH – Heilbronn",
      "type": "Einreichung neuer Dokumente",
      "state": "Baden-Württemberg",
      "amtsgericht": "Amtsgericht Stuttgart",
      "registernummer": "HRB 107207",
      "registerart": "HRB",
      "company_name": "Heilbronn Marketing GmbH",
      "company_seat": "Heilbronn",
      "details": "28.11.2025 (Bekanntmachungsdatum)\n\nBaden-Württemberg Amtsgericht Stuttgart HRB 107207\nEinreichung neuer Dokumente\n\nHeilbronn Marketing GmbH\nGesellschaft mit beschränkter Haftung\nHeilbronn\n\nDie Gesellschaft hat am 27.11.2025 die Liste über die Zusammensetzung des Aufsichtsrats zum Handelsregister eingereicht."
    },
    {
      "date": "2025-11-28",
      "id": "138557",
      "original_text": "Löschungsankündigung\nBerlin Amtsgericht Berlin (Charlottenburg) HRB 127241\nIntermed - Enertech AG – Berlin",
      "type": "Löschungsankündigung",
      "state": "Berlin",
      "amtsgericht": "Amtsgericht Berlin (Charlottenburg)",
      "registernummer": "HRB 127241",
      "registerart": "HRB",
      "company_name": "Intermed - Enertech AG",
      "company_seat": "Berlin",
      "details": "28.11.2025 (Bekanntmachungsdatum)\n\nBerlin Amtsgericht Berlin (Charlottenburg) HRB 127241\nLöschungsankündigung\n\nIntermed - Enertech AG\nAktiengesellschaft\nBerlin\n\nBei der nachstehenden Gesellschaft wird das Amtslöschungsverfahren gemäß § 394 FamFG eingeleitet. Widerspruchsfrist 6 Wochen"
    },
    {
      "date": "2025-11-28",
      "id": "138558",
      "original_text": "Löschungsankündigung\nBerlin Amtsgericht Berlin (Charlottenburg) HRB 215864\nSBG Ventures UG (haftungsbeschränkt) – Berlin",
      "type": "Löschungsankündigung",
      "state": "Berlin",
      "amtsgericht": "Amtsgericht Berlin (Charlottenburg)",
      "registernummer": "HRB 215864",
      "registerart": "HRB",
      "company_name": "SBG Ventures UG (haftungsbeschränkt)",
      "company_seat": "Berlin",
      "details": "28.11.2025 (Bekanntmachungsdatum)\n\nBerlin Amtsgericht Berlin (Charlottenburg) HRB 215864\nLöschungsankündigung\n\nSBG Ventures UG (haftungsbeschränkt)\nGesellschaft mit beschränkter Haftung\nBerlin\n\nBei der nachstehenden Gesellschaft wird das Amtslöschungsverfahren gemäß § 394 FamFG eingeleitet. Widerspruchsfrist 6 Wochen"
    },
    {
      "date": "2025-11-28",
      "id": "138559",
      "original_text": "Registerbekanntmachung nach dem Umwandlungsgesetz\nBaden-Württemberg Amtsgericht Ulm HRB 728644\nBossard Beteiligungs GmbH – Illerrieden",
      "type": "Registerbekanntmachung nach dem Umwandlungsgesetz",
      "state": "Baden-Württemberg",
      "amtsgericht": "Amtsgericht Ulm",
      "registernummer": "HRB 728644",
      "registerart": "HRB",
      "company_name": "Bossard Beteiligungs GmbH",
      "company_seat": "Illerrieden",
      "details": "28.11.2025 (Bekanntmachungsdatum)\n\nBaden-Württemberg Amtsgericht Ulm HRB 728644\nRegisterbekanntmachung nach dem Umwandlungsgesetz 28.11.2025 (Eintragungsdatum)\n\nBossard Beteiligungs GmbH\nGesellschaft mit beschränkter Haftung\nIllerrieden\n\nAls nicht eingetragen wird bekanntgemacht:\nDen Gläubigern der an der Verschmelzung beteiligten Rechtsträger ist, wenn sie binnen sechs Monaten nach dem Tag, an dem die Eintragung der Verschmelzung in das Register des Sitzes desjenigen Rechtsträgers, dessen Gläubiger sie sind, nach § 19 Abs. 3 UmwG als bekanntgemacht gilt, ihren Anspruch nach Grund und Höhe schriftlich anmelden, Sicherheit zu leisten, soweit sie nicht Befriedigung verlangen können. Dieses Recht steht den Gläubigern jedoch nur zu, wenn sie glaubhaft machen, dass durch die Verschmelzung die Erfüllung ihrer Forderung gefährdet wird."
    },
    {
      "date": "2025-11-28",
      "id": "138560",
      "original_text": "Registerbekanntmachung nach dem Umwandlungsgesetz\nBaden-Württemberg Amtsgericht Stuttgart HRA 738898\nReusch Energietechnik GmbH & Co. KG – Metzingen",
      "type": "Registerbekanntmachung nach dem Umwandlungsgesetz",
      "state": "Baden-Württemberg",
      "amtsgericht": "Amtsgericht Stuttgart",
      "registernummer": "HRA 738898",
      "registerart": "HRA",
      "company_name": "Reusch Energietechnik GmbH & Co. KG",
      "company_seat": "Metzingen",
      "details": "28.11.2025 (Bekanntmachungsdatum)\n\nBaden-Württemberg Amtsgericht Stuttgart HRA 738898\nRegisterbekanntmachung nach dem Umwandlungsgesetz 28.11.2025 (Eintragungsdatum)\n\nReusch Energietechnik GmbH & Co. KG\nKommanditgesellschaft\nMetzingen\n\nAls nicht eingetragen wird bekanntgemacht:\nDen Gläubigern der an der Verschmelzung beteiligten Rechtsträger ist, wenn sie binnen sechs Monaten nach dem Tag, an dem die Eintragung der Verschmelzung in das Register des Sitzes desjenigen Rechtsträgers, dessen Gläubiger sie sind, nach § 19 Abs. 3 UmwG als bekanntgemacht gilt, ihren Anspruch nach Grund und Höhe schriftlich anmelden, Sicherheit zu leisten, soweit sie nicht Befriedigung verlangen können. Dieses Recht steht den Gläubigern jedoch nur zu, wenn sie glaubhaft machen, dass durch die Verschmelzung die Erfüllung ihrer Forderung gefährdet wird."
    },
    {
      "date": "2025-11-28",
      "id": "138561",
      "original_text": "Registerbekanntmachung nach dem Umwandlungsgesetz\nBaden-Württemberg Amtsgericht Stuttgart HRB 802856\nRistorante Pizzeria König GmbH – Sindelfingen",
      "type": "Registerbekanntmachung nach dem Umwandlungsgesetz",
      "state": "Baden-Württemberg",
      "amtsgericht": "Amtsgericht Stuttgart",
      "registernummer": "HRB 802856",
      "registerart": "HRB",
      "company_name": "Ristorante Pizzeria König GmbH",
      "company_seat": "Sindelfingen",
      "details": "28.11.2025 (Bekanntmachungsdatum)\n\nBaden-Württemberg Amtsgericht Stuttgart HRB 802856\nRegisterbekanntmachung nach dem Umwandlungsgesetz 28.11.2025 (Eintragungsdatum)\n\nRistorante Pizzeria König GmbH\nGesellschaft mit beschränkter Haftung\nSindelfingen\n\nDen Gläubigern der an der Ausgliederung beteiligten Rechtsträger ist, wenn sie binnen sechs Monaten nach dem Tag, an dem die Eintragung der Ausgliederung in das Register des Sitzes desjenigen Rechtsträgers, dessen Gläubiger sie sind, nach § 19 Abs. 3 UmwG als bekanntgemacht gilt, ihren Anspruch nach Grund und Höhe schriftlich anmelden, Sicherheit zu leisten, soweit sie nicht Befriedigung verlangen können. Dieses Recht steht den Gläubigern jedoch nur zu, wenn sie glaubhaft machen, dass durch die Ausgliederung die Erfüllung ihrer Forderung gefährdet wird."
    },
    {
      "date": "2025-11-28",
      "id": "138562",
      "original_text": "Registerbekanntmachung nach dem Umwandlungsgesetz\nBaden-Württemberg Amtsgericht Stuttgart HRA 742670\nRistorante Pizzeria König e.K. – Sindelfingen",
      "type": "Registerbekanntmachung nach dem Umwandlungsgesetz",
      "state": "Baden-Württemberg",
      "amtsgericht": "Amtsgericht Stuttgart",
      "registernummer": "HRA 742670",
      "registerart": "HRA",
      "company_name": "Ristorante Pizzeria König e.K.",
      "company_seat": "Sindelfingen",
      "details": "28.11.2025 (Bekanntmachungsdatum)\n\nBaden-Württemberg Amtsgericht Stuttgart HRA 742670\nRegisterbekanntmachung nach dem Umwandlungsgesetz 28.11.2025 (Eintragungsdatum)\n\nRistorante Pizzeria König e.K.\nEinzelkaufmann / Einzelkauffrau\nSindelfingen\n\nDen Gläubigern der an der Ausgliederung beteiligten Rechtsträger ist, wenn sie binnen sechs Monaten nach dem Tag, an dem die Eintragung der Ausgliederung in das Register des Sitzes desjenigen Rechtsträgers, dessen Gläubiger sie sind, nach § 19 Abs. 3 UmwG als bekanntgemacht gilt, ihren Anspruch nach Grund und Höhe schriftlich anmelden, Sicherheit zu leisten, soweit sie nicht Befriedigung verlangen können. Dieses Recht steht den Gläubigern jedoch nur zu, wenn sie glaubhaft machen, dass durch die Ausgliederung die Erfüllung ihrer Forderung gefährdet wird."
    },
    {
      "date": "2025-11-28",
      "id": "138563",
      "original_text": "Löschungsankündigung\nBerlin Amtsgericht Berlin (Charlottenburg) HRB 121138\nWPZ Planungsgesellschaft mbH – Berlin",
      "type": "Löschungsankündigung",
      "state": "Berlin",
      "amtsgericht": "Amtsgericht Berlin (Charlottenburg)",
      "registernummer": "HRB 121138",
      "registerart": "HRB",
      "company_name": "WPZ Planungsgesellschaft mbH",
      "company_seat": "Berlin",
      "details": "28.11.2025 (Bekanntmachungsdatum)\n\nBerlin Amtsgericht Berlin (Charlottenburg) HRB 121138\nLöschungsankündigung\n\nWPZ Planungsgesellschaft mbH\nGesellschaft mit beschränkter Haftung\nBerlin\n\nBei der nachstehenden Gesellschaft wird das Amtslöschungsverfahren gemäß § 394 FamFG eingeleitet. Widerspruchsfrist 6 Wochen"
    },
    {
      "date": "2025-11-28",
      "id": "138564",
      "original_text": "Sonstige Registerbekanntmachung\nSchleswig-Holstein Amtsgericht Lübeck HRB 14857\nSorgun Bau GmbH – Oststeinbek",
      "type": "Sonstige Registerbekanntmachung",
      "state": "Schleswig-Holstein",
      "amtsgericht": "Amtsgericht Lübeck",
      "registernummer": "HRB 14857",
      "registerart": "HRB",
      "company_name": "Sorgun Bau GmbH",
      "company_seat": "Oststeinbek",
      "details": "28.11.2025 (Bekanntmachungsdatum)\n\nSchleswig-Holstein Amtsgericht Lübeck HRB 14857\nSonstige Registerbekanntmachung\n\nSorgun Bau GmbH\nGesellschaft mit beschränkter Haftung\nOststeinbek\n\nAls nicht eingetragen wird veröffentlicht:\nHerrn\nJosef Kadlec\nzur Zeit unbekannten Aufenthalts:\n\nSehr geehrte Herr Kadlec,\n\nin der Handelsregistersache\nSorgun Bau GmbH\nergeben sich aus den mir vorliegenden Unterlagen Anhaltspunkte dafür, dass die Gesellschaft, als deren Geschäftsführer Sie noch eingetragen sind, vermögenslos ist:\n\nSchreiben des Bundesamtes für Justiz sowie des Finanzamts Stormarn.\n\nIch beabsichtige daher, die Gesellschaft wegen Vermögenslosigkeit gemäß § 394 FamFG zu löschen.\n\nIch bestimme eine Frist von einem Monat zur Geltendmachung eines Widerspruchs gegen die Löschung, § 394 Abs. 2 S. 1 FamFG.\n\nWeiter bitte ich Sie, mir binnen derselben Frist mitzuteilen, ob die genannte Gesellschaft noch Vermögen hat, ggf. welche Vermögensgegenstände sie besitzt, ob die Gesellschaft noch Partei eines noch nicht rechtskräftig abgeschlossenen Rechtsstreits ist oder ob sonst noch eine Abwicklung stattfindet.\n\nNach Fristablauf ohne Widerspruch von Ihnen oder anderer Seite wird die Gesellschaft gelöscht.\n\nOstermann\nDipl.-Rechtspflegerin (FH)"
    },
    {
      "date": "2025-11-28",
      "id": "138565",
      "original_text": "Registerbekanntmachung nach dem Umwandlungsgesetz\nMecklenburg-Vorpommern Amtsgericht Schwerin GnR 130\nElbtaler Agrar Krenzlin eG – Alt Krenzlin",
      "type": "Registerbekanntmachung nach dem Umwandlungsgesetz",
      "state": "Mecklenburg-Vorpommern",
      "amtsgericht": "Amtsgericht Schwerin",
      "registernummer": "GnR 130",
      "registerart": "GnR",
      "company_name": "Elbtaler Agrar Krenzlin eG",
      "company_seat": "Alt Krenzlin",
      "details": "28.11.2025 (Bekanntmachungsdatum)\n\nMecklenburg-Vorpommern Amtsgericht Schwerin GnR 130\nRegisterbekanntmachung nach dem Umwandlungsgesetz 28.11.2025 (Eintragungsdatum)\n\nElbtaler Agrar Krenzlin eG\neingetragene Genossenschaft\nAlt Krenzlin\n\nAls nicht eingetragen wird veröffentlicht: Den Gläubigern der an der Umwandlung beteiligten Rechtsträger ist, wenn sie binnen sechs\nMonaten nach dem Tag, an dem die Eintragung der Umwandlung in das Register des Sitzes desjenigen Rechtsträgers, dessen Gläubiger sie sind, nach § 19 Abs. 3 UmwG als bekannt gemacht gilt, ihren Anspruch nach Grund und Höhe in Textform anmelden, Sicherheit zu leisten, soweit sie nicht Befriedigung verlangen können. Dieses Recht steht den Gläubigern jedoch nur zu, wenn sie glaubhaft machen, dass durch die Umwandlung die Erfüllung der Forderung gefährdet wird."
    },
    {
      "date": "2025-11-28",
      "id": "138566",
      "original_text": "Löschungsankündigung\nBerlin Amtsgericht Berlin (Charlottenburg) HRB 188572\nYOUR FUTURE SERVICE24 GmbH – Berlin",
      "type": "Löschungsankündigung",
      "state": "Berlin",
      "amtsgericht": "Amtsgericht Berlin (Charlottenburg)",
      "registernummer": "HRB 188572",
      "registerart": "HRB",
      "company_name": "YOUR FUTURE SERVICE24 GmbH",
      "company_seat": "Berlin",
      "details": "28.11.2025 (Bekanntmachungsdatum)\n\nBerlin Amtsgericht Berlin (Charlottenburg) HRB 188572\nLöschungsankündigung\n\nYOUR FUTURE SERVICE24 GmbH\nGesellschaft mit beschränkter Haftung\nBerlin\n\nBei der nachstehenden Gesellschaft wird das Amtslöschungsverfahren gemäß § 394 FamFG eingeleitet. Widerspruchsfrist 6 Wochen"
    },
    {
      "date": "2025-11-28",
      "id": "138567",
      "original_text": "Registerbekanntmachung nach dem Umwandlungsgesetz\nSchleswig-Holstein Amtsgericht Kiel HRB 1955 NM\nBRIGADE Elektronik GmbH – Neumünster",
      "type": "Registerbekanntmachung nach dem Umwandlungsgesetz",
      "state": "Schleswig-Holstein",
      "amtsgericht": "Amtsgericht Kiel",
      "registernummer": "HRB 1955 NM",
      "registerart": "HRB",
      "company_name": "BRIGADE Elektronik GmbH",
      "company_seat": "Neumünster",
      "details": "28.11.2025 (Bekanntmachungsdatum)\n\nSchleswig-Holstein Amtsgericht Kiel HRB 1955 NM\nRegisterbekanntmachung nach dem Umwandlungsgesetz 24.11.2025 (Eintragungsdatum)\n\nBRIGADE Elektronik GmbH\nGesellschaft mit beschränkter Haftung\nNeumünster\n\nZu Eintragungsnummer 11 vom 24.11.2025 wird als nicht eingetragen veröffentlicht: Den Gläubigern der an der Verschmelzung beteiligten Rechtsträger ist, wenn sie binnen sechs Monaten nach dem Tag, an dem die Eintragung der Verschmelzung in das Register des Sitzes desjenigen Rechtsträgers, dessen Gläubiger sie sind, nach § 19 Abs. 3 UmwG bekannt gemacht worden ist, ihren Anspruch nach Grund und Höhe schriftlich anmelden, Sicherheit zu leisten, soweit sie nicht Befriedigung verlangen können. Dieses Recht steht den Gläubigern jedoch nur zu, wenn sie glaubhaft machen, dass durch die Verschmelzung die Erfüllung ihrer Forderung gefährdet wird."
    },
    {
      "date": "2025-11-28",
      "id": "138568",
      "original_text": "Löschungsankündigung\nBaden-Württemberg Amtsgericht Mannheim HRB 211162\nBEWECO Spedition + Logistik GmbH – Baden-Baden",
      "type": "Löschungsankündigung",
      "state": "Baden-Württemberg",
      "amtsgericht": "Amtsgericht Mannheim",
      "registernummer": "HRB 211162",
      "registerart": "HRB",
      "company_name": "BEWECO Spedition + Logistik GmbH",
      "company_seat": "Baden-Baden",
      "details": "28.11.2025 (Bekanntmachungsdatum)\n\nBaden-Württemberg Amtsgericht Mannheim HRB 211162\nLöschungsankündigung\n\nBEWECO Spedition + Logistik GmbH\nGesellschaft mit beschränkter Haftung\nBaden-Baden\n\nAls nicht eingetragen wird bekanntgemacht:\nDas Gericht beabsichtigt, die Gesellschaft wegen Vermögenslosigkeit im Handelsregister von Amts wegen nach § 394 FamFG zu löschen. Die Frist zur Geltendmachung eines Widerspruchs gegen die beabsichtigte Löschung ist auf einen Monat ab Veröffentlichung bestimmt."
    },
    {
      "date": "2025-11-28",
      "id": "138569",
      "original_text": "Registerbekanntmachung nach dem Umwandlungsgesetz\nHamburg Amtsgericht Hamburg HRB 137356\nSistemiamolo GmbH – Hamburg",
      "type": "Registerbekanntmachung nach dem Umwandlungsgesetz",
      "state": "Hamburg",
      "amtsgericht": "Amtsgericht Hamburg",
      "registernummer": "HRB 137356",
      "registerart": "HRB",
      "company_name": "Sistemiamolo GmbH",
      "company_seat": "Hamburg",
      "details": "28.11.2025 (Bekanntmachungsdatum)\n\nHamburg Amtsgericht Hamburg HRB 137356\nRegisterbekanntmachung nach dem Umwandlungsgesetz 28.11.2025 (Eintragungsdatum)\n\nSistemiamolo GmbH\nGesellschaft mit beschränkter Haftung\nHamburg\n\nAls nicht eingetragen wird bekannt gemacht:\nDen Gläubigern der an der Verschmelzung beteiligten Gesellschaften ist, wenn sie binnen sechs Monaten nach dem Tag, an dem die Eintragung der Verschmelzung in das Register des Sitzes desjenigen Rechtsträgers, dessen Gläubiger sie sind, nach § 19 Absatz 3 UmwG als bekannt gemacht gilt, ihren Anspruch nach Grund und Höhe schriftlich anmelden, Sicherheit zu leisten, soweit sie nicht Befriedigung verlangen können. Dieses Recht steht den Gläubigern jedoch nur zu, wenn sie glaubhaft machen, dass durch die Verschmelzung die Erfüllung ihrer Forderung gefährdet wird."
    },
    {
      "date": "2025-11-28",
      "id": "138570",
      "original_text": "Registerbekanntmachung nach dem Umwandlungsgesetz\nHamburg Amtsgericht Hamburg HRB 110842\nJM Document IT GmbH – Hamburg",
      "type": "Registerbekanntmachung nach dem Umwandlungsgesetz",
      "state": "Hamburg",
      "amtsgericht": "Amtsgericht Hamburg",
      "registernummer": "HRB 110842",
      "registerart": "HRB",
      "company_name": "JM Document IT GmbH",
      "company_seat": "Hamburg",
      "details": "28.11.2025 (Bekanntmachungsdatum)\n\nHamburg Amtsgericht Hamburg HRB 110842\nRegisterbekanntmachung nach dem Umwandlungsgesetz 28.11.2025 (Eintragungsdatum)\n\nJM Document IT GmbH\nGesellschaft mit beschränkter Haftung\nHamburg\n\nAls nicht eingetragen wird bekannt gemacht:\nDen Gläubigern der an der Verschmelzung beteiligten Gesellschaften ist, wenn sie binnen sechs Monaten nach dem Tag, an dem die Eintragung der Verschmelzung in das Register des Sitzes desjenigen Rechtsträgers, dessen Gläubiger sie sind, nach § 19 Absatz 3 UmwG als bekannt gemacht gilt, ihren Anspruch nach Grund und Höhe schriftlich anmelden, Sicherheit zu leisten, soweit sie nicht Befriedigung verlangen können. Dieses Recht steht den Gläubigern jedoch nur zu, wenn sie glaubhaft machen, dass durch die Verschmelzung die Erfüllung ihrer Forderung gefährdet wird."
    },
    {
      "date": "2025-11-28",
      "id": "138571",
      "original_text": "Registerbekanntmachung nach dem Umwandlungsgesetz\nHamburg Amtsgericht Hamburg HRB 169495\nSechsundzwanzigste Großer Burstah 45 GmbH – Hamburg",
      "type": "Registerbekanntmachung nach dem Umwandlungsgesetz",
      "state": "Hamburg",
      "amtsgericht": "Amtsgericht Hamburg",
      "registernummer": "HRB 169495",
      "registerart": "HRB",
      "company_name": "Sechsundzwanzigste Großer Burstah 45 GmbH",
      "company_seat": "Hamburg",
      "details": "28.11.2025 (Bekanntmachungsdatum)\n\nHamburg Amtsgericht Hamburg HRB 169495\nRegisterbekanntmachung nach dem Umwandlungsgesetz 28.11.2025 (Eintragungsdatum)\n\nSechsundzwanzigste Großer Burstah 45 GmbH\nGesellschaft mit beschränkter Haftung\nHamburg\n\nAls nicht eingetragen wird bekannt gemacht:\nDen Gläubigern der an der Verschmelzung beteiligten Gesellschaften ist, wenn sie binnen sechs Monaten nach dem Tag, an dem die Eintragung der Verschmelzung in das Register des Sitzes desjenigen Rechtsträgers, dessen Gläubiger sie sind, nach § 19 Absatz 3 UmwG als bekannt gemacht gilt, ihren Anspruch nach Grund und Höhe schriftlich anmelden, Sicherheit zu leisten, soweit sie nicht Befriedigung verlangen können. Dieses Recht steht den Gläubigern jedoch nur zu, wenn sie glaubhaft machen, dass durch die Verschmelzung die Erfüllung ihrer Forderung gefährdet wird."
    },
    {
      "date": "2025-11-28",
      "id": "138572",
      "original_text": "Registerbekanntmachung nach dem Umwandlungsgesetz\nHamburg Amtsgericht Hamburg HRB 169495\nSechsundzwanzigste Großer Burstah 45 GmbH – Hamburg",
      "type": "Registerbekanntmachung nach dem Umwandlungsgesetz",
      "state": "Hamburg",
      "amtsgericht": "Amtsgericht Hamburg",
      "registernummer": "HRB 169495",
      "registerart": "HRB",
      "company_name": "Sechsundzwanzigste Großer Burstah 45 GmbH",
      "company_seat": "Hamburg",
      "details": "28.11.2025 (Bekanntmachungsdatum)\n\nHamburg Amtsgericht Hamburg HRB 169495\nRegisterbekanntmachung nach dem Umwandlungsgesetz 28.11.2025 (Eintragungsdatum)\n\nSechsundzwanzigste Großer Burstah 45 GmbH\nGesellschaft mit beschränkter Haftung\nHamburg\n\nAls nicht eingetragen wird bekannt gemacht:\nDen Gläubigern der an der Verschmelzung beteiligten Gesellschaften ist, wenn sie binnen sechs Monaten nach dem Tag, an dem die Eintragung der Verschmelzung in das Register des Sitzes desjenigen Rechtsträgers, dessen Gläubiger sie sind, nach § 19 Absatz 3 UmwG als bekannt gemacht gilt, ihren Anspruch nach Grund und Höhe schriftlich anmelden, Sicherheit zu leisten, soweit sie nicht Befriedigung verlangen können. Dieses Recht steht den Gläubigern jedoch nur zu, wenn sie glaubhaft machen, dass durch die Verschmelzung die Erfüllung ihrer Forderung gefährdet wird."
    },
    {
      "date": "2025-11-28",
      "id": "138573",
      "original_text": "Einreichung neuer Dokumente\nBrandenburg Amtsgericht Cottbus HRB 9368\nLUTRA GmbH – Königs Wusterhausen",
      "type": "Einreichung neuer Dokumente",
      "state": "Brandenburg",
      "amtsgericht": "Amtsgericht Cottbus",
      "registernummer": "HRB 9368",
      "registerart": "HRB",
      "company_name": "LUTRA GmbH",
      "company_seat": "Königs Wusterhausen",
      "details": "28.11.2025 (Bekanntmachungsdatum)\n\nBrandenburg Amtsgericht Cottbus HRB 9368\nEinreichung neuer Dokumente\n\nLUTRA GmbH\nGesellschaft mit beschränkter Haftung\nKönigs Wusterhausen\n\nDer Geschäftsführer hat eine Liste der Aufsichtsratsmitglieder gem. § 52 Abs. 2 Satz 2 GmbHG zum Handelsregister eingereicht."
    },
    {
      "date": "2025-11-28",
      "id": "138574",
      "original_text": "Löschungsankündigung\nSchleswig-Holstein Amtsgericht Lübeck HRA 6532\nQuentor Timmendorf GmbH & Co. KG – Koberg",
      "type": "Löschungsankündigung",
      "state": "Schleswig-Holstein",
      "amtsgericht": "Amtsgericht Lübeck",
      "registernummer": "HRA 6532",
      "registerart": "HRA",
      "company_name": "Quentor Timmendorf GmbH & Co. KG",
      "company_seat": "Koberg",
      "details": "28.11.2025 (Bekanntmachungsdatum)\n\nSchleswig-Holstein Amtsgericht Lübeck HRA 6532\nLöschungsankündigung\n\nQuentor Timmendorf GmbH & Co. KG\nKommanditgesellschaft\nKoberg\n\nEs ist die Löschung der nachstehenden Gesellschaft wegen Vermögenslosigkeit gemäß § 394 FamFG beabsichtigt."
    },
    {
      "date": "2025-11-28",
      "id": "138575",
      "original_text": "Registerbekanntmachung nach dem Umwandlungsgesetz\nMecklenburg-Vorpommern Amtsgericht Schwerin GnR 18\nLandwirtschaftlicher Erzeugerring e.G. Brenz – Brenz",
      "type": "Registerbekanntmachung nach dem Umwandlungsgesetz",
      "state": "Mecklenburg-Vorpommern",
      "amtsgericht": "Amtsgericht Schwerin",
      "registernummer": "GnR 18",
      "registerart": "GnR",
      "company_name": "Landwirtschaftlicher Erzeugerring e.G. Brenz",
      "company_seat": "Brenz",
      "details": "28.11.2025 (Bekanntmachungsdatum)\n\nMecklenburg-Vorpommern Amtsgericht Schwerin GnR 18\nRegisterbekanntmachung nach dem Umwandlungsgesetz 28.11.2025 (Eintragungsdatum)\n\nLandwirtschaftlicher Erzeugerring e.G. Brenz\neingetragene Genossenschaft\nBrenz\n\nAls nicht eingetragen wird veröffentlicht: Den Gläubigern der an der Umwandlung beteiligten Rechtsträger ist, wenn sie binnen sechs\nMonaten nach dem Tag, an dem die Eintragung der Umwandlung in das Register des Sitzes desjenigen Rechtsträgers, dessen Gläubiger sie sind, nach § 19 Abs. 3 UmwG als bekannt gemacht gilt, ihren Anspruch nach Grund und Höhe in Textform anmelden, Sicherheit zu leisten, soweit sie nicht Befriedigung verlangen können. Dieses Recht steht den Gläubigern jedoch nur zu, wenn sie glaubhaft machen, dass durch die Umwandlung die Erfüllung der Forderung gefährdet wird."
    },
    {
      "date": "2025-11-28",
      "id": "138576",
      "original_text": "Registerbekanntmachung nach dem Umwandlungsgesetz\nHamburg Amtsgericht Hamburg HRB 170894\nAML Check by mplus GmbH – Hamburg",
      "type": "Registerbekanntmachung nach dem Umwandlungsgesetz",
      "state": "Hamburg",
      "amtsgericht": "Amtsgericht Hamburg",
      "registernummer": "HRB 170894",
      "registerart": "HRB",
      "company_name": "AML Check by mplus GmbH",
      "company_seat": "Hamburg",
      "details": "28.11.2025 (Bekanntmachungsdatum)\n\nHamburg Amtsgericht Hamburg HRB 170894\nRegisterbekanntmachung nach dem Umwandlungsgesetz 28.11.2025 (Eintragungsdatum)\n\nAML Check by mplus GmbH\nGesellschaft mit beschränkter Haftung\nHamburg\n\nAls nicht eingetragen wird bekannt gemacht:\nDen Gläubigern der an der Verschmelzung beteiligten Gesellschaften ist, wenn sie binnen sechs Monaten nach dem Tag, an dem die Eintragung der Verschmelzung in das Register des Sitzes desjenigen Rechtsträgers, dessen Gläubiger sie sind, nach § 19 Absatz 3 UmwG als bekannt gemacht gilt, ihren Anspruch nach Grund und Höhe schriftlich anmelden, Sicherheit zu leisten, soweit sie nicht Befriedigung verlangen können. Dieses Recht steht den Gläubigern jedoch nur zu, wenn sie glaubhaft machen, dass durch die Verschmelzung die Erfüllung ihrer Forderung gefährdet wird."
    },
    {
      "date": "2025-11-28",
      "id": "138577",
      "original_text": "Löschungsankündigung\nThüringen Amtsgericht Jena HRA 500634\nSRS Grundbesitz GmbH & Co. KG – Dermbach",
      "type": "Löschungsankündigung",
      "state": "Thüringen",
      "amtsgericht": "Amtsgericht Jena",
      "registernummer": "HRA 500634",
      "registerart": "HRA",
      "company_name": "SRS Grundbesitz GmbH & Co. KG",
      "company_seat": "Dermbach",
      "details": "28.11.2025 (Bekanntmachungsdatum)\n\nThüringen Amtsgericht Jena HRA 500634\nLöschungsankündigung\n\nSRS Grundbesitz GmbH & Co. KG\nKommanditgesellschaft\nDermbach\n\nDas Registergericht beabsichtigt, die im Handelsregister eingetragene Gesellschaft wegen Vermögenslosigkeit nach § 394 FamFG von Amts wegen zu löschen. Die Frist zur Erhebung eines Widerspruchs gegen die beabsichtigte Löschung wird auf 6 Wochen festgesetzt."
    },
    {
      "date": "2025-11-28",
      "id": "138578",
      "original_text": "Sonstige Registerbekanntmachung\nThüringen Amtsgericht Jena HRB 208401\nDeutsche Effecten- und Wechsel-Beteiligungsgesellschaft AG – Jena",
      "type": "Sonstige Registerbekanntmachung",
      "state": "Thüringen",
      "amtsgericht": "Amtsgericht Jena",
      "registernummer": "HRB 208401",
      "registerart": "HRB",
      "company_name": "Deutsche Effecten- und Wechsel-Beteiligungsgesellschaft AG",
      "company_seat": "Jena",
      "details": "28.11.2025 (Bekanntmachungsdatum)\n\nThüringen Amtsgericht Jena HRB 208401\nSonstige Registerbekanntmachung 28.11.2025 (Eintragungsdatum)\n\nDeutsche Effecten- und Wechsel-Beteiligungsgesellschaft AG\nAktiengesellschaft\nJena\n\nNicht eingetragen: Den Gläubigern der Gesellschaft ist, wenn sie binnen sechs Monaten nach dieser Bekanntmachung ihren Anspruch nach Grund und Höhe schriftlich anmelden, Sicherheit zu leisten, soweit sie nicht Befriedigung verlangen können. Dieses Recht steht ihnen jedoch nicht zu, wenn sie im Falle des Insolvenzverfahrens ein Recht auf vorzugsweise Befriedigung aus einer Deckungsmasse haben, die nach gesetzlicher Vorschrift zu ihrem Schutz errichtet und staatlich überwacht ist."
    },
    {
      "date": "2025-11-28",
      "id": "138579",
      "original_text": "Sonstige Registerbekanntmachung\nThüringen Amtsgericht Jena HRB 208401\nDeutsche Effecten- und Wechsel-Beteiligungsgesellschaft AG – Jena",
      "type": "Sonstige Registerbekanntmachung",
      "state": "Thüringen",
      "amtsgericht": "Amtsgericht Jena",
      "registernummer": "HRB 208401",
      "registerart": "HRB",
      "company_name": "Deutsche Effecten- und Wechsel-Beteiligungsgesellschaft AG",
      "company_seat": "Jena",
      "details": "28.11.2025 (Bekanntmachungsdatum)\n\nThüringen Amtsgericht Jena HRB 208401\nSonstige Registerbekanntmachung\n\nDeutsche Effecten- und Wechsel-Beteiligungsgesellschaft AG\nAktiengesellschaft\nJena\n\nBekanntmachung gem. § 106 AktG: Aufgrund einer Veränderung in den Personen der Aufsichtsratsmitglieder ist durch den Vorstand eine neue Liste zum Handelsregister eingereicht worden."
    },
    {
      "date": "2025-11-28",
      "id": "138580",
      "original_text": "Registerbekanntmachung nach dem Umwandlungsgesetz\nMecklenburg-Vorpommern Amtsgericht Schwerin HRA 4798\nWolfgang Bade Zahntechnik e.K. – Schwerin",
      "type": "Registerbekanntmachung nach dem Umwandlungsgesetz",
      "state": "Mecklenburg-Vorpommern",
      "amtsgericht": "Amtsgericht Schwerin",
      "registernummer": "HRA 4798",
      "registerart": "HRA",
      "company_name": "Wolfgang Bade Zahntechnik e.K.",
      "company_seat": "Schwerin",
      "details": "28.11.2025 (Bekanntmachungsdatum)\n\nMecklenburg-Vorpommern Amtsgericht Schwerin HRA 4798\nRegisterbekanntmachung nach dem Umwandlungsgesetz 28.11.2025 (Eintragungsdatum)\n\nWolfgang Bade Zahntechnik e.K.\nEinzelkaufmann / Einzelkauffrau\nSchwerin\n\nAls nicht eingetragen wird veröffentlicht: Den Gläubigern der an der Ausgliederung beteiligten Rechtsträger ist, wenn sie binnen sechs Monaten nach dem Tag, an dem die Eintragung der Ausgliederung in das Register des Sitzes desjenigen Rechtsträgers, dessen Gläubiger sie sind, nach § 19 Abs. 3 UmwG als bekannt gemacht gilt, ihren Anspruch nach Grund und Höhe in Textform anmelden,\nSicherheit zu leisten, soweit sie nicht Befriedigung verlangen können. Dieses Recht steht den Gläubigern jedoch nur zu, wenn sie glaubhaft machen, dass durch die Ausgliederung die Erfüllung der Forderung gefährdet wird."
    },
    {
      "date": "2025-11-28",
      "id": "138581",
      "original_text": "Registerbekanntmachung nach dem Umwandlungsgesetz\nHamburg Amtsgericht Hamburg HRB 169495\nSechsundzwanzigste Großer Burstah 45 GmbH – Hamburg",
      "type": "Registerbekanntmachung nach dem Umwandlungsgesetz",
      "state": "Hamburg",
      "amtsgericht": "Amtsgericht Hamburg",
      "registernummer": "HRB 169495",
      "registerart": "HRB",
      "company_name": "Sechsundzwanzigste Großer Burstah 45 GmbH",
      "company_seat": "Hamburg",
      "details": "28.11.2025 (Bekanntmachungsdatum)\n\nHamburg Amtsgericht Hamburg HRB 169495\nRegisterbekanntmachung nach dem Umwandlungsgesetz 28.11.2025 (Eintragungsdatum)\n\nSechsundzwanzigste Großer Burstah 45 GmbH\nGesellschaft mit beschränkter Haftung\nHamburg\n\nAls nicht eingetragen wird bekannt gemacht:\nDen Gläubigern der an der Verschmelzung beteiligten Gesellschaften ist, wenn sie binnen sechs Monaten nach dem Tag, an dem die Eintragung der Verschmelzung in das Register des Sitzes desjenigen Rechtsträgers, dessen Gläubiger sie sind, nach § 19 Absatz 3 UmwG als bekannt gemacht gilt, ihren Anspruch nach Grund und Höhe schriftlich anmelden, Sicherheit zu leisten, soweit sie nicht Befriedigung verlangen können. Dieses Recht steht den Gläubigern jedoch nur zu, wenn sie glaubhaft machen, dass durch die Verschmelzung die Erfüllung ihrer Forderung gefährdet wird."
    },
    {
      "date": "2025-11-28",
      "id": "138582",
      "original_text": "Einreichung neuer Dokumente\nBerlin Amtsgericht Berlin (Charlottenburg) HRB 103691\nAccentro Real Estate AG – Berlin",
      "type": "Einreichung neuer Dokumente",
      "state": "Berlin",
      "amtsgericht": "Amtsgericht Berlin (Charlottenburg)",
      "registernummer": "HRB 103691",
      "registerart": "HRB",
      "company_name": "Accentro Real Estate AG",
      "company_seat": "Berlin",
      "details": "28.11.2025 (Bekanntmachungsdatum)\n\nBerlin Amtsgericht Berlin (Charlottenburg) HRB 103691\nEinreichung neuer Dokumente\n\nAccentro Real Estate AG\nAktiengesellschaft\nBerlin\n\nAls nicht eingetragen wird veröffentlicht: Es wurde eine neue Liste der Aufsichtsratsmitglieder eingereicht (§ 106 AktG)."
    },
    {
      "date": "2025-11-28",
      "id": "138583",
      "original_text": "Registerbekanntmachung nach dem Umwandlungsgesetz\nBaden-Württemberg Amtsgericht Mannheim HRA 712917\nH&L Grenzenlos e.K. – Baden-Baden",
      "type": "Registerbekanntmachung nach dem Umwandlungsgesetz",
      "state": "Baden-Württemberg",
      "amtsgericht": "Amtsgericht Mannheim",
      "registernummer": "HRA 712917",
      "registerart": "HRA",
      "company_name": "H&L Grenzenlos e.K.",
      "company_seat": "Baden-Baden",
      "details": "28.11.2025 (Bekanntmachungsdatum)\n\nBaden-Württemberg Amtsgericht Mannheim HRA 712917\nRegisterbekanntmachung nach dem Umwandlungsgesetz 28.11.2025 (Eintragungsdatum)\n\nH&L Grenzenlos e.K.\nEinzelkaufmann / Einzelkauffrau\nBaden-Baden\n\nAls nicht eingetragen wird bekanntgemacht: Den Gläubigern der an der Verschmelzung beteiligten Rechtsträger ist, wenn sie binnen sechs Monaten nach dem Tag, an dem die Eintragung der Verschmelzung in das Register des Sitzes desjenigen Rechtsträgers, dessen Gläubiger sie sind, nach § 19 Abs. 3 UmwG als bekanntgemacht gilt, ihren Anspruch nach Grund und Höhe schriftlich anmelden, Sicherheit zu leisten, soweit sie nicht Befriedigung verlangen können. Dieses Recht steht den Gläubigern jedoch nur zu, wenn sie glaubhaft machen, dass durch die Verschmelzung die Erfüllung ihrer Forderung gefährdet wird."
    },
    {
      "date": "2025-11-28",
      "id": "138584",
      "original_text": "Registerbekanntmachung nach dem Umwandlungsgesetz\nNiedersachsen Amtsgericht Oldenburg (Oldenburg) HRA 208611\nRoland Zerhusen e. K. – Damme",
      "type": "Registerbekanntmachung nach dem Umwandlungsgesetz",
      "state": "Niedersachsen",
      "amtsgericht": "Amtsgericht Oldenburg (Oldenburg)",
      "registernummer": "HRA 208611",
      "registerart": "HRA",
      "company_name": "Roland Zerhusen e. K.",
      "company_seat": "Damme",
      "details": "28.11.2025 (Bekanntmachungsdatum)\n\nNiedersachsen Amtsgericht Oldenburg (Oldenburg) HRA 208611\nRegisterbekanntmachung nach dem Umwandlungsgesetz\n\nRoland Zerhusen e. K.\nEinzelkaufmann / Einzelkauffrau\nDamme\n\nDen Gläubigern der an der Ausgliederung beteiligten Rechtsträger ist, wenn sie binnen sechs Monaten nach dem Tag, an dem die Eintragung der Ausgliederung in das Register des Sitzes desjenigen Rechtsträgers, dessen Gläubiger sie sind, nach § 19 Abs. 3 UmwG als bekannt gemacht gilt, ihren Anspruch nach Grund und Höhe schriftlich anmelden, Sicherheit zu leisten, soweit sie nicht Befriedigung verlangen können. Dieses Recht steht den Gläubigern jedoch nur zu, wenn sie glaubhaft machen, dass durch die Ausgliederung die Erfüllung der Forderung gefährdet wird."
    },
    {
      "date": "2025-11-28",
      "id": "138585",
      "original_text": "Registerbekanntmachung nach dem Umwandlungsgesetz\nNiedersachsen Amtsgericht Oldenburg (Oldenburg) HRA 208762\nZerhusen Holding GmbH & Co. KG – Damme",
      "type": "Registerbekanntmachung nach dem Umwandlungsgesetz",
      "state": "Niedersachsen",
      "amtsgericht": "Amtsgericht Oldenburg (Oldenburg)",
      "registernummer": "HRA 208762",
      "registerart": "HRA",
      "company_name": "Zerhusen Holding GmbH & Co. KG",
      "company_seat": "Damme",
      "details": "28.11.2025 (Bekanntmachungsdatum)\n\nNiedersachsen Amtsgericht Oldenburg (Oldenburg) HRA 208762\nRegisterbekanntmachung nach dem Umwandlungsgesetz 28.11.2025 (Eintragungsdatum)\n\nZerhusen Holding GmbH & Co. KG\nKommanditgesellschaft\nDamme\n\nDen Gläubigern der an der Ausgliederung beteiligten Rechtsträger ist, wenn sie binnen sechs Monaten nach dem Tag, an dem die Eintragung der Ausgliederung in das Register des Sitzes desjenigen Rechtsträgers, dessen Gläubiger sie sind, nach § 19 Abs. 3 UmwG als bekannt gemacht gilt, ihren Anspruch nach Grund und Höhe schriftlich anmelden, Sicherheit zu leisten, soweit sie nicht Befriedigung verlangen können. Dieses Recht steht den Gläubigern jedoch nur zu, wenn sie glaubhaft machen, dass durch die Ausgliederung die Erfüllung der Forderung gefährdet wird."
    },
    {
      "date": "2025-11-28",
      "id": "138586",
      "original_text": "Löschungsankündigung\nNiedersachsen Amtsgericht Osnabrück HRB 220414\ncp Pro Invest GmbH – Osnabrück",
      "type": "Löschungsankündigung",
      "state": "Niedersachsen",
      "amtsgericht": "Amtsgericht Osnabrück",
      "registernummer": "HRB 220414",
      "registerart": "HRB",
      "company_name": "cp Pro Invest GmbH",
      "company_seat": "Osnabrück",
      "details": "28.11.2025 (Bekanntmachungsdatum)\n\nNiedersachsen Amtsgericht Osnabrück HRB 220414\nLöschungsankündigung\n\ncp Pro Invest GmbH\nGesellschaft mit beschränkter Haftung\nOsnabrück\n\nDas Registergericht beabsichtigt, die Gesellschaft von Amts wegen nach § 394 FamFG wegen Vermögenslosigkeit zu löschen. Die Frist zur Erhebung eines Widerspruchs ist auf 1 Monat ab dieser Registerbekanntmachung festgesetzt."
    },
    {
      "date": "2025-11-28",
      "id": "138587",
      "original_text": "Registerbekanntmachung nach dem Umwandlungsgesetz\nNiedersachsen Amtsgericht Walsrode HRB 206268\nGutsverwaltung Retzen GmbH – Süstedt",
      "type": "Registerbekanntmachung nach dem Umwandlungsgesetz",
      "state": "Niedersachsen",
      "amtsgericht": "Amtsgericht Walsrode",
      "registernummer": "HRB 206268",
      "registerart": "HRB",
      "company_name": "Gutsverwaltung Retzen GmbH",
      "company_seat": "Süstedt",
      "details": "28.11.2025 (Bekanntmachungsdatum)\n\nNiedersachsen Amtsgericht Walsrode HRB 206268\nRegisterbekanntmachung nach dem Umwandlungsgesetz 28.11.2025 (Eintragungsdatum)\n\nGutsverwaltung Retzen GmbH\nGesellschaft mit beschränkter Haftung\nSüstedt\n\nDen Gläubigern der an der Verschmelzung beteiligten Rechtsträger ist, wenn sie binnen sechs Monaten nach dem Tag, an dem die Eintragung der Verschmelzung in das Register des Sitzes desjenigen Rechtsträgers, dessen Gläubiger sie sind, nach § 19  Abs.  3 UmwG als bekannt gemacht gilt, ihren Anspruch nach Grund und Höhe schriftlich anmelden, Sicherheit zu leisten, soweit sie nicht Befriedigung verlangen können. Dieses Recht steht den Gläubigern jedoch nur zu, wenn sie glaubhaft machen, dass durch die Verschmelzung die Erfüllung der Forderung gefährdet wird."
    },
    {
      "date": "2025-11-28",
      "id": "138588",
      "original_text": "Einreichung neuer Dokumente\nNiedersachsen Amtsgericht Braunschweig HRB 204464\nALSTOM Transport Deutschland GmbH – Salzgitter",
      "type": "Einreichung neuer Dokumente",
      "state": "Niedersachsen",
      "amtsgericht": "Amtsgericht Braunschweig",
      "registernummer": "HRB 204464",
      "registerart": "HRB",
      "company_name": "ALSTOM Transport Deutschland GmbH",
      "company_seat": "Salzgitter",
      "details": "28.11.2025 (Bekanntmachungsdatum)\n\nNiedersachsen Amtsgericht Braunschweig HRB 204464\nEinreichung neuer Dokumente\n\nALSTOM Transport Deutschland GmbH\nGesellschaft mit beschränkter Haftung\nSalzgitter\n\nDie Liste der Mitglieder des Aufsichtsrats wurde beim Registergericht eingereicht."
    },
    {
      "date": "2025-11-28",
      "id": "138589",
      "original_text": "Registerbekanntmachung nach dem Umwandlungsgesetz\nNiedersachsen Amtsgericht Osnabrück VR 2035\nKatholische Erwachsenenbildung im Landkreis Osnabrück e.V. (KEB Landkreis Osnabrück) – Osnabrück",
      "type": "Registerbekanntmachung nach dem Umwandlungsgesetz",
      "state": "Niedersachsen",
      "amtsgericht": "Amtsgericht Osnabrück",
      "registernummer": "VR 2035",
      "registerart": "VR",
      "company_name": "Katholische Erwachsenenbildung im Landkreis Osnabrück e.V. (KEB Landkreis Osnabrück)",
      "company_seat": "Osnabrück",
      "details": "28.11.2025 (Bekanntmachungsdatum)\n\nNiedersachsen Amtsgericht Osnabrück VR 2035\nRegisterbekanntmachung nach dem Umwandlungsgesetz 28.11.2025 (Eintragungsdatum)\n\nKatholische Erwachsenenbildung im Landkreis Osnabrück e.V. (KEB Landkreis Osnabrück)\neingetragener Verein\nOsnabrück\n\nDen Gläubigern der an der Verschmelzung beteiligten Rechtsträger ist, wenn sie binnen sechs Monaten nach dem Tag, an dem die Eintragung der Verschmelzung in das Register des Sitzes desjenigen Rechtsträgers, dessen Gläubiger sie sind, nach § 19  Abs.  3 UmwG als bekannt gemacht gilt, ihren Anspruch nach Grund und Höhe schriftlich anmelden, Sicherheit zu leisten, soweit sie nicht Befriedigung verlangen können. Dieses Recht steht den Gläubigern jedoch nur zu, wenn sie glaubhaft machen, dass durch die Verschmelzung die Erfüllung der Forderung gefährdet wird."
    },
    {
      "date": "2025-11-28",
      "id": "138590",
      "original_text": "Registerbekanntmachung nach dem Umwandlungsgesetz\nNiedersachsen Amtsgericht Hannover HRB 101826 früher Amtsgericht Hameln\nGesellschaft für Software-Management und Consulting mbH – Barsinghausen",
      "type": "Registerbekanntmachung nach dem Umwandlungsgesetz",
      "state": "Niedersachsen",
      "amtsgericht": "Amtsgericht Hannover",
      "registernummer": "HRB 101826",
      "registerart": "HRB",
      "company_name": "Gesellschaft für Software-Management und Consulting mbH",
      "company_seat": "Barsinghausen",
      "former_amtsgericht": "Hameln",
      "details": "28.11.2025 (Bekanntmachungsdatum)\n\nNiedersachsen Amtsgericht Hannover HRB 101826 früher Amtsgericht Hameln\nRegisterbekanntmachung nach dem Umwandlungsgesetz 28.11.2025 (Eintragungsdatum)\n\nGesellschaft für Software-Management und Consulting mbH\nGesellschaft mit beschränkter Haftung\nBarsinghausen\n\nDen Gläubigern der an der Verschmelzung beteiligten Rechtsträger ist, wenn sie binnen sechs Monaten nach dem Tag, an dem die Eintragung der Verschmelzung in das Register des Sitzes desjenigen Rechtsträgers, dessen Gläubiger sie sind, nach § 19  Abs.  3 UmwG als bekannt gemacht gilt, ihren Anspruch nach Grund und Höhe schriftlich anmelden, Sicherheit zu leisten, soweit sie nicht Befriedigung verlangen können. Dieses Recht steht den Gläubigern jedoch nur zu, wenn sie glaubhaft machen, dass durch die Verschmelzung die Erfüllung der Forderung gefährdet wird."
    },
    {
      "date": "2025-11-28",
      "id": "138591",
      "original_text": "Sonstige Registerbekanntmachung\nNiedersachsen Amtsgericht Hannover HRB 110006 früher Amtsgericht Neustadt a. Rbge. (Neustadt)\nSpar-und Bauverein Havelse und Umgegend Wohnungsbaugesellschaft m.b.H. Gesellschaft mit beschränkter Haftung – Garbsen",
      "type": "Sonstige Registerbekanntmachung",
      "state": "Niedersachsen",
      "amtsgericht": "Amtsgericht Hannover",
      "registernummer": "HRB 110006",
      "registerart": "HRB",
      "company_name": "Spar-und Bauverein Havelse und Umgegend Wohnungsbaugesellschaft m.b.H. Gesellschaft mit beschränkter Haftung",
      "company_seat": "Garbsen",
      "former_amtsgericht": "Neustadt a. Rbge. (Neustadt)",
      "details": "28.11.2025 (Bekanntmachungsdatum)\n\nNiedersachsen Amtsgericht Hannover HRB 110006 früher Amtsgericht Neustadt a. Rbge. (Neustadt)\nSonstige Registerbekanntmachung\n\nSpar-und Bauverein Havelse und Umgegend Wohnungsbaugesellschaft m.b.H. Gesellschaft mit beschränkter Haftung\nGesellschaft mit beschränkter Haftung\nGarbsen\n\nDie Liste der Mitglieder des Aufsichtsrats wurde beim Registergericht eingereicht."
    },
    {
      "date": "2025-11-28",
      "id": "138592",
      "original_text": "Löschungsankündigung\nNiedersachsen Amtsgericht Aurich HRB 204405\nDehne Pflanzenwelt GmbH – Wiesmoor",
      "type": "Löschungsankündigung",
      "state": "Niedersachsen",
      "amtsgericht": "Amtsgericht Aurich",
      "registernummer": "HRB 204405",
      "registerart": "HRB",
      "company_name": "Dehne Pflanzenwelt GmbH",
      "company_seat": "Wiesmoor",
      "details": "28.11.2025 (Bekanntmachungsdatum)\n\nNiedersachsen Amtsgericht Aurich HRB 204405\nLöschungsankündigung 28.11.2025 (Eintragungsdatum)\n\nDehne Pflanzenwelt GmbH\nGesellschaft mit beschränkter Haftung\nWiesmoor\n\nDas Registergericht beabsichtigt, die Gesellschaft von Amts wegen nach § 394 FamFG zu löschen. Die Frist zur Erhebung eines Widerspruchs ist auf 1 Monat ab dieser Registerbekanntmachung festgesetzt."
    },
    {
      "date": "2025-11-28",
      "id": "138593",
      "original_text": "Löschungsankündigung\nBerlin Amtsgericht Berlin (Charlottenburg) HRB 229379\nDolphin Delivery UG (haftungsbeschränkt) – Berlin",
      "type": "Löschungsankündigung",
      "state": "Berlin",
      "amtsgericht": "Amtsgericht Berlin (Charlottenburg)",
      "registernummer": "HRB 229379",
      "registerart": "HRB",
      "company_name": "Dolphin Delivery UG (haftungsbeschränkt)",
      "company_seat": "Berlin",
      "details": "28.11.2025 (Bekanntmachungsdatum)\n\nBerlin Amtsgericht Berlin (Charlottenburg) HRB 229379\nLöschungsankündigung\n\nDolphin Delivery UG (haftungsbeschränkt)\nGesellschaft mit beschränkter Haftung\nBerlin\n\nBei der nachstehenden Gesellschaft wird das Amtslöschungsverfahren gemäß § 394 FamFG eingeleitet. Widerspruchsfrist 6 Wochen"
    },
    {
      "date": "2025-11-28",
      "id": "138594",
      "original_text": "Einreichung neuer Dokumente\nBaden-Württemberg Amtsgericht Stuttgart HRB 796017\nTüBäder GmbH – Tübingen",
      "type": "Einreichung neuer Dokumente",
      "state": "Baden-Württemberg",
      "amtsgericht": "Amtsgericht Stuttgart",
      "registernummer": "HRB 796017",
      "registerart": "HRB",
      "company_name": "TüBäder GmbH",
      "company_seat": "Tübingen",
      "details": "28.11.2025 (Bekanntmachungsdatum)\n\nBaden-Württemberg Amtsgericht Stuttgart HRB 796017\nEinreichung neuer Dokumente\n\nTüBäder GmbH\nGesellschaft mit beschränkter Haftung\nTübingen\n\nDie Gesellschaft hat am 27.11.2025 die Liste über die Zusammensetzung des Aufsichtsrats zum Handelsregister eingereicht."
    },
    {
      "date": "2025-11-28",
      "id": "138595",
      "original_text": "Löschungsankündigung\nBerlin Amtsgericht Berlin (Charlottenburg) HRB 196842\nJumpster Lab GmbH – Berlin",
      "type": "Löschungsankündigung",
      "state": "Berlin",
      "amtsgericht": "Amtsgericht Berlin (Charlottenburg)",
      "registernummer": "HRB 196842",
      "registerart": "HRB",
      "company_name": "Jumpster Lab GmbH",
      "company_seat": "Berlin",
      "details": "28.11.2025 (Bekanntmachungsdatum)\n\nBerlin Amtsgericht Berlin (Charlottenburg) HRB 196842\nLöschungsankündigung\n\nJumpster Lab GmbH\nGesellschaft mit beschränkter Haftung\nBerlin\n\nBei der nachstehenden Gesellschaft wird das Amtslöschungsverfahren gemäß § 394 FamFG eingeleitet. Widerspruchsfrist 6 Wochen"
    },
    {
      "date": "2025-11-28",
      "id": "138596",
      "original_text": "Löschungsankündigung\nBaden-Württemberg Amtsgericht Mannheim HRB 750918\nMN UG (haftungsbeschränkt) – Heidelberg",
      "type": "Löschungsankündigung",
      "state": "Baden-Württemberg",
      "amtsgericht": "Amtsgericht Mannheim",
      "registernummer": "HRB 750918",
      "registerart": "HRB",
      "company_name": "MN UG (haftungsbeschränkt)",
      "company_seat": "Heidelberg",
      "details": "28.11.2025 (Bekanntmachungsdatum)\n\nBaden-Württemberg Amtsgericht Mannheim HRB 750918\nLöschungsankündigung\n\nMN UG (haftungsbeschränkt)\nGesellschaft mit beschränkter Haftung\nHeidelberg\n\nDas Gericht beabsichtigt, die Gesellschaft wegen Vermögenslosigkeit im Handelsregister von Amts wegen nach § 394 FamFG zu löschen. Die Frist zur Geltendmachung eines Widerspruchs gegen die beabsichtigte Löschung ist auf einen Monat ab Veröffentlichung bestimmt."
    },
    {
      "date": "2025-11-28",
      "id": "138597",
      "original_text": "Registerbekanntmachung nach dem Umwandlungsgesetz\nMecklenburg-Vorpommern Amtsgericht Stralsund HRB 2434\nPetra Grünberg Getränkefachgroßhandel GmbH – Zirchow",
      "type": "Registerbekanntmachung nach dem Umwandlungsgesetz",
      "state": "Mecklenburg-Vorpommern",
      "amtsgericht": "Amtsgericht Stralsund",
      "registernummer": "HRB 2434",
      "registerart": "HRB",
      "company_name": "Petra Grünberg Getränkefachgroßhandel GmbH",
      "company_seat": "Zirchow",
      "details": "28.11.2025 (Bekanntmachungsdatum)\n\nMecklenburg-Vorpommern Amtsgericht Stralsund HRB 2434\nRegisterbekanntmachung nach dem Umwandlungsgesetz 28.11.2025 (Eintragungsdatum)\n\nPetra Grünberg Getränkefachgroßhandel GmbH\nGesellschaft mit beschränkter Haftung\nZirchow\n\nAls nicht eingetragen wird veröffentlicht: Den Gläubigern der an der Verschmelzung beteiligten Rechtsträger ist, wenn sie binnen sechs Monaten nach dem Tag, an dem die Eintragung der Verschmelzung in das Register des Sitzes desjenigen Rechtsträgers, dessen Gläubiger sie sind, nach § 19 Abs. 3 UmwG als bekannt gemacht gilt,\nihren Anspruch nach Grund und Höhe in Textform anmelden, Sicherheit zu leisten, soweit sie nicht Befriedigung verlangen können. Dieses Recht steht den Gläubigern jedoch nur zu, wenn sie glaubhaft machen, dass durch die Verschmelzung die Erfüllung der Forderung gefährdet wird."
    },
    {
      "date": "2025-11-28",
      "id": "138598",
      "original_text": "Registerbekanntmachung nach dem Umwandlungsgesetz\nMecklenburg-Vorpommern Amtsgericht Stralsund HRB 4665\nGrünberg Getränketransport- und Logistik GmbH – Zirchow",
      "type": "Registerbekanntmachung nach dem Umwandlungsgesetz",
      "state": "Mecklenburg-Vorpommern",
      "amtsgericht": "Amtsgericht Stralsund",
      "registernummer": "HRB 4665",
      "registerart": "HRB",
      "company_name": "Grünberg Getränketransport- und Logistik GmbH",
      "company_seat": "Zirchow",
      "details": "28.11.2025 (Bekanntmachungsdatum)\n\nMecklenburg-Vorpommern Amtsgericht Stralsund HRB 4665\nRegisterbekanntmachung nach dem Umwandlungsgesetz 28.11.2025 (Eintragungsdatum)\n\nGrünberg Getränketransport- und Logistik GmbH\nGesellschaft mit beschränkter Haftung\nZirchow\n\nAls nicht eingetragen wird veröffentlicht: Den Gläubigern der an der Verschmelzung beteiligten Rechtsträger ist, wenn sie binnen sechs Monaten nach dem Tag, an dem die Eintragung der Verschmelzung in das Register des Sitzes desjenigen Rechtsträgers, dessen Gläubiger sie sind, nach § 19 Abs. 3 UmwG als bekannt gemacht gilt,\nihren Anspruch nach Grund und Höhe in Textform anmelden, Sicherheit zu leisten, soweit sie nicht Befriedigung verlangen können. Dieses Recht steht den Gläubigern jedoch nur zu, wenn sie glaubhaft machen, dass durch die Verschmelzung die Erfüllung der Forderung gefährdet wird."
    },
    {
      "date": "2025-11-28",
      "id": "138599",
      "original_text": "Löschungsankündigung\nBerlin Amtsgericht Berlin (Charlottenburg) HRB 197291\nAuto Center Adler Berlin GmbH – Berlin",
      "type": "Löschungsankündigung",
      "state": "Berlin",
      "amtsgericht": "Amtsgericht Berlin (Charlottenburg)",
      "registernummer": "HRB 197291",
      "registerart": "HRB",
      "company_name": "Auto Center Adler Berlin GmbH",
      "company_seat": "Berlin",
      "details": "28.11.2025 (Bekanntmachungsdatum)\n\nBerlin Amtsgericht Berlin (Charlottenburg) HRB 197291\nLöschungsankündigung\n\nAuto Center Adler Berlin GmbH\nGesellschaft mit beschränkter Haftung\nBerlin\n\nBei der nachstehenden Gesellschaft wird das Amtslöschungsverfahren gemäß § 394 FamFG eingeleitet. Widerspruchsfrist: 6 Wochen."
    },
    {
      "date": "2025-11-28",
      "id": "138600",
      "original_text": "Löschungsankündigung\nBerlin Amtsgericht Berlin (Charlottenburg) HRB 107543\nLehmann IFM Dienstleistungs GmbH – Berlin",
      "type": "Löschungsankündigung",
      "state": "Berlin",
      "amtsgericht": "Amtsgericht Berlin (Charlottenburg)",
      "registernummer": "HRB 107543",
      "registerart": "HRB",
      "company_name": "Lehmann IFM Dienstleistungs GmbH",
      "company_seat": "Berlin",
      "details": "28.11.2025 (Bekanntmachungsdatum)\n\nBerlin Amtsgericht Berlin (Charlottenburg) HRB 107543\nLöschungsankündigung\n\nLehmann IFM Dienstleistungs GmbH\nGesellschaft mit beschränkter Haftung\nBerlin\n\nBei der nachstehenden Gesellschaft wird das Amtslöschungsverfahren gemäß § 394 FamFG eingeleitet. Widerspruchsfrist 6 Wochen"
    },
    {
      "date": "2025-11-28",
      "id": "138601",
      "original_text": "Registerbekanntmachung nach dem Umwandlungsgesetz\nBerlin Amtsgericht Berlin (Charlottenburg) HRA 64843\nMarkus Horst Hagewald, Hagewald Bau e.K. – Berlin",
      "type": "Registerbekanntmachung nach dem Umwandlungsgesetz",
      "state": "Berlin",
      "amtsgericht": "Amtsgericht Berlin (Charlottenburg)",
      "registernummer": "HRA 64843",
      "registerart": "HRA",
      "company_name": "Markus Horst Hagewald, Hagewald Bau e.K.",
      "company_seat": "Berlin",
      "details": "28.11.2025 (Bekanntmachungsdatum)\n\nBerlin Amtsgericht Berlin (Charlottenburg) HRA 64843\nRegisterbekanntmachung nach dem Umwandlungsgesetz 28.11.2025 (Eintragungsdatum)\n\nMarkus Horst Hagewald, Hagewald Bau e.K.\nEinzelkaufmann / Einzelkauffrau\nBerlin\n\nZu Eintragungsnummer 2 vom 28.11.2025 wird als nicht eingetragen veröffentlicht: Den Gläubigern der an der Spaltung beteiligten Rechtsträger ist, wenn sie binnen sechs Monaten nach dem Tag, an dem die Eintragung der Spaltung in das Register des Sitzes desjenigen Rechtsträgers, dessen Gläubiger sie sind, als bekannt gemacht gilt, ihren Anspruch nach Grund und Höhe schriftlich anmelden, Sicherheit zu leisten, soweit sie nicht Befriedigung verlangen können. Dieses Recht steht den Gläubigern jedoch nur zu, wenn sie glaubhaft machen, dass durch die Spaltung die Erfüllung ihrer Forderung gefährdet wird. Das Recht, Sicherheitsleistung zu verlangen, steht Gläubigern nicht zu, die im Falle der Insolvenz ein Recht auf vorzugsweise Befriedigung aus einer Deckungsmasse haben, die nach gesetzlicher Vorschrift zu ihrem Schutz errichtet und staatlich überwacht ist."
    },
    {
      "date": "2025-11-28",
      "id": "138602",
      "original_text": "Einreichung neuer Dokumente\nBaden-Württemberg Amtsgericht Stuttgart HRB 20654\nSPECTRUM Aktiengesellschaft – Stuttgart",
      "type": "Einreichung neuer Dokumente",
      "state": "Baden-Württemberg",
      "amtsgericht": "Amtsgericht Stuttgart",
      "registernummer": "HRB 20654",
      "registerart": "HRB",
      "company_name": "SPECTRUM Aktiengesellschaft",
      "company_seat": "Stuttgart",
      "details": "28.11.2025 (Bekanntmachungsdatum)\n\nBaden-Württemberg Amtsgericht Stuttgart HRB 20654\nEinreichung neuer Dokumente 28.11.2025 (Eintragungsdatum)\n\nSPECTRUM Aktiengesellschaft\nAktiengesellschaft\nStuttgart\n\nDie Gesellschaft hat am 28.11.2025 die Liste über die Zusammensetzung des Aufsichtsrats zum Handelsregister eingereicht."
    },
    {
      "date": "2025-11-28",
      "id": "138603",
      "original_text": "Sonstige Registerbekanntmachung\nSachsen Amtsgericht Chemnitz HRB 112272 früher Amtsgericht Leipzig\nWind Kraft Waldheim GmbH – Waldheim",
      "type": "Sonstige Registerbekanntmachung",
      "state": "Sachsen",
      "amtsgericht": "Amtsgericht Chemnitz",
      "registernummer": "HRB 112272",
      "registerart": "HRB",
      "company_name": "Wind Kraft Waldheim GmbH",
      "company_seat": "Waldheim",
      "former_amtsgericht": "Leipzig",
      "details": "28.11.2025 (Bekanntmachungsdatum)\n\nSachsen Amtsgericht Chemnitz HRB 112272 früher Amtsgericht Leipzig\nSonstige Registerbekanntmachung\n\nWind Kraft Waldheim GmbH\nGesellschaft mit beschränkter Haftung\nWaldheim\n\nFür die Wind Kraft Waldheim GmbH, ehemaliger Sitz in Waldheim, HRB 112272, liegt beim Amtsgericht Chemnitz ein Antrag auf Bestellung des Dr. Florian Scheuerlein zum Nachtragsliquidator vor.\nDie Antragsunterlagen können beim Amtsgericht Chemnitz -Registergericht- zu den Öffnungszeiten eingesehen werden.\nFür die Beteiligten (auch Erben/Rechtsnachfolger der Gesellschafter) besteht Gelegenheit zur Stellungnahme binnen 4 Wochen."
    },
    {
      "date": "2025-11-28",
      "id": "138604",
      "original_text": "Löschungsankündigung\nSachsen Amtsgericht Leipzig HRA 11757\nCBG Capitalanlagen GmbH + Co. Immobilien KG – Leipzig",
      "type": "Löschungsankündigung",
      "state": "Sachsen",
      "amtsgericht": "Amtsgericht Leipzig",
      "registernummer": "HRA 11757",
      "registerart": "HRA",
      "company_name": "CBG Capitalanlagen GmbH + Co. Immobilien KG",
      "company_seat": "Leipzig",
      "details": "28.11.2025 (Bekanntmachungsdatum)\n\nSachsen Amtsgericht Leipzig HRA 11757\nLöschungsankündigung\n\nCBG Capitalanlagen GmbH + Co. Immobilien KG\nKommanditgesellschaft\nLeipzig\n\nDas Registergericht beabsichtigt, die im Handelsregister eingetragene Gesellschaft von Amts wegen nach § 394 FamFG zu löschen. Die Frist zu Erhebung eines Widerspruchs gegen die beabsichtigte Löschung wird auf einen Monat festgesetzt."
    },
    {
      "date": "2025-11-28",
      "id": "138605",
      "original_text": "Löschungsankündigung\nSachsen Amtsgericht Chemnitz HRB 16894\nFABET GmbH – Chemnitz",
      "type": "Löschungsankündigung",
      "state": "Sachsen",
      "amtsgericht": "Amtsgericht Chemnitz",
      "registernummer": "HRB 16894",
      "registerart": "HRB",
      "company_name": "FABET GmbH",
      "company_seat": "Chemnitz",
      "details": "28.11.2025 (Bekanntmachungsdatum)\n\nSachsen Amtsgericht Chemnitz HRB 16894\nLöschungsankündigung\n\nFABET GmbH\nGesellschaft mit beschränkter Haftung\nChemnitz\n\nDas Registergericht beabsichtigt, die im Handelsregister eingetragene Gesellschaft von Amts wegen nach § 394 FamFG zu löschen. Die Frist zu Erhebung eines Widerspruchs gegen die beabsichtigte Löschung wird auf einen Monat festgesetzt."
    },
    {
      "date": "2025-11-28",
      "id": "138606",
      "original_text": "Einreichung neuer Dokumente\nBremen Amtsgericht Bremen HRB 39536\nCleverSol AG – Bremen",
      "type": "Einreichung neuer Dokumente",
      "state": "Bremen",
      "amtsgericht": "Amtsgericht Bremen",
      "registernummer": "HRB 39536",
      "registerart": "HRB",
      "company_name": "CleverSol AG",
      "company_seat": "Bremen",
      "details": "28.11.2025 (Bekanntmachungsdatum)\n\nBremen Amtsgericht Bremen HRB 39536\nEinreichung neuer Dokumente\n\nCleverSol AG\nAktiengesellschaft\nBremen\n\nAls nicht eingetragen wird bekannt gemacht: Liste des Aufsichtsrats wurde eingereicht."
    },
    {
      "date": "2025-11-28",
      "id": "138607",
      "original_text": "Registerbekanntmachung nach dem Umwandlungsgesetz\nBremen Amtsgericht Bremen HRB 39111\nactensys Nord AG – Bremerhaven",
      "type": "Registerbekanntmachung nach dem Umwandlungsgesetz",
      "state": "Bremen",
      "amtsgericht": "Amtsgericht Bremen",
      "registernummer": "HRB 39111",
      "registerart": "HRB",
      "company_name": "actensys Nord AG",
      "company_seat": "Bremerhaven",
      "details": "28.11.2025 (Bekanntmachungsdatum)\n\nBremen Amtsgericht Bremen HRB 39111\nRegisterbekanntmachung nach dem Umwandlungsgesetz 26.11.2025 (Eintragungsdatum)\n\nactensys Nord AG\nAktiengesellschaft\nBremerhaven\n\nZu Eintragungsnummer 4 vom 26.11.2025 wird als nicht eingetragen veröffentlicht: Den Gläubigern ist, wenn sie binnen sechs Monaten nach dem Tag, an dem die Eintragung der Umwandlung als bekannt gemacht gilt, ihren Anspruch nach Grund und Höhe schriftlich anmelden, Sicherheit zu leisten, soweit sie nicht Befriedigung verlangen können. Dieses Recht steht den Gläubigern jedoch nur zu, wenn sie glaubhaft machen, dass durch die Umwandlung die Erfüllung ihrer Forderung gefährdet wird. Das Recht, Sicherheitsleistung zu verlangen, steht Gläubigern nicht zu, die im Falle der Insolvenz ein Recht auf vorzugsweise Befriedigung aus einer Deckungsmasse haben, die nach gesetzlicher Vorschrift zu ihrem Schutz errichtet und staatlich überwacht ist."
    },
    {
      "date": "2025-11-28",
      "id": "138608",
      "original_text": "Löschungsankündigung\nRheinland-Pfalz Amtsgericht Ludwigshafen a.Rhein (Ludwigshafen) HRB 62072\nPACTOR Network UG (haftungsbeschränkt) – Neuleiningen",
      "type": "Löschungsankündigung",
      "state": "Rheinland-Pfalz",
      "amtsgericht": "Amtsgericht Ludwigshafen a.Rhein (Ludwigshafen)",
      "registernummer": "HRB 62072",
      "registerart": "HRB",
      "company_name": "PACTOR Network UG (haftungsbeschränkt)",
      "company_seat": "Neuleiningen",
      "details": "28.11.2025 (Bekanntmachungsdatum)\n\nRheinland-Pfalz Amtsgericht Ludwigshafen a.Rhein (Ludwigshafen) HRB 62072\nLöschungsankündigung\n\nPACTOR Network UG (haftungsbeschränkt)\nGesellschaft mit beschränkter Haftung\nNeuleiningen\n\nDas Registergericht beabsichtigt die Gesellschaft von Amts wegen nach § 394 FamFG zu löschen. Die Frist zur Erhebung eines Widerspruchs ist auf einen Monat festgesetzt."
    },
    {
      "date": "2025-11-28",
      "id": "138609",
      "original_text": "Löschungsankündigung\nRheinland-Pfalz Amtsgericht Ludwigshafen a.Rhein (Ludwigshafen) HRB 66886\nPanem Spirae GmbH – Speyer",
      "type": "Löschungsankündigung",
      "state": "Rheinland-Pfalz",
      "amtsgericht": "Amtsgericht Ludwigshafen a.Rhein (Ludwigshafen)",
      "registernummer": "HRB 66886",
      "registerart": "HRB",
      "company_name": "Panem Spirae GmbH",
      "company_seat": "Speyer",
      "details": "28.11.2025 (Bekanntmachungsdatum)\n\nRheinland-Pfalz Amtsgericht Ludwigshafen a.Rhein (Ludwigshafen) HRB 66886\nLöschungsankündigung\n\nPanem Spirae GmbH\nGesellschaft mit beschränkter Haftung\nSpeyer\n\nDas Registergericht beabsichtigt die Gesellschaft von Amts wegen nach § 394 FamFG zu löschen. Die Frist zur Erhebung eines Widerspruchs ist auf einen Monat festgesetzt."
    },
    {
      "date": "2025-11-28",
      "id": "138610",
      "original_text": "Löschungsankündigung\nNordrhein-Westfalen Amtsgericht Wuppertal HRB 31538\nMLG-Sicherheitsdienst & Service GmbH – Wuppertal",
      "type": "Löschungsankündigung",
      "state": "Nordrhein-Westfalen",
      "amtsgericht": "Amtsgericht Wuppertal",
      "registernummer": "HRB 31538",
      "registerart": "HRB",
      "company_name": "MLG-Sicherheitsdienst & Service GmbH",
      "company_seat": "Wuppertal",
      "details": "28.11.2025 (Bekanntmachungsdatum)\n\nNordrhein-Westfalen Amtsgericht Wuppertal HRB 31538\nLöschungsankündigung 27.11.2025 (Eintragungsdatum)\n\nMLG-Sicherheitsdienst & Service GmbH\nGesellschaft mit beschränkter Haftung\nWuppertal\n\nDas Registergericht beabsichtigt die Gesellschaft von Amts wegen nach § 394 FamFG zu löschen. Die Frist zur Erhebung eines Widerspruchs ist auf einen Monat festgesetzt."
    },
    {
      "date": "2025-11-28",
      "id": "138611",
      "original_text": "Einreichung neuer Dokumente\nNordrhein-Westfalen Amtsgericht Bad Oeynhausen HRB 9619\nSänger Geschäftsführungs GmbH – Löhne",
      "type": "Einreichung neuer Dokumente",
      "state": "Nordrhein-Westfalen",
      "amtsgericht": "Amtsgericht Bad Oeynhausen",
      "registernummer": "HRB 9619",
      "registerart": "HRB",
      "company_name": "Sänger Geschäftsführungs GmbH",
      "company_seat": "Löhne",
      "details": "28.11.2025 (Bekanntmachungsdatum)\n\nNordrhein-Westfalen Amtsgericht Bad Oeynhausen HRB 9619\nEinreichung neuer Dokumente 28.11.2025 (Eintragungsdatum)\n\nSänger Geschäftsführungs GmbH\nGesellschaft mit beschränkter Haftung\nLöhne\n\nDem Registergericht ist eine neue Liste der Mitglieder des Aufsichtsrates eingereicht worden."
    },
    {
      "date": "2025-11-28",
      "id": "138612",
      "original_text": "Registerbekanntmachung nach dem Umwandlungsgesetz\nNordrhein-Westfalen Amtsgericht Wuppertal VR 10605 früher Amtsgericht Mettmann\nSKFM Sozialdienst katholischer Frauen und Männer Haan e.V. – Haan",
      "type": "Registerbekanntmachung nach dem Umwandlungsgesetz",
      "state": "Nordrhein-Westfalen",
      "amtsgericht": "Amtsgericht Wuppertal",
      "registernummer": "VR 10605",
      "registerart": "VR",
      "company_name": "SKFM Sozialdienst katholischer Frauen und Männer Haan e.V.",
      "company_seat": "Haan",
      "former_amtsgericht": "Mettmann",
      "details": "28.11.2025 (Bekanntmachungsdatum)\n\nNordrhein-Westfalen Amtsgericht Wuppertal VR 10605 früher Amtsgericht Mettmann\nRegisterbekanntmachung nach dem Umwandlungsgesetz 28.11.2025 (Eintragungsdatum)\n\nSKFM Sozialdienst katholischer Frauen und Männer Haan e.V.\neingetragener Verein\nHaan\n\nDen Gläubigern der an der Verschmelzung beteiligten Rechtsträger ist, wenn sie binnen sechs Monaten nach dem Tag, an dem die Eintragung der Verschmelzung in das Register des Sitzes desjenigen Rechtsträgers, dessen Gläubiger sie sind, nach § 19 Absatz 3 UmwG als bekanntgemacht gilt, ihren Anspruch nach Grund und Höhe schriftlich anmelden, Sicherheit zu leisten, soweit sie nicht Befriedigung verlangen können. Dieses Recht steht den Gläubigern jedoch nur zu, wenn sie glaubhaft machen, dass durch die Verschmelzung die Erfüllung ihrer Forderung gefährdet wird."
    },
    {
      "date": "2025-11-28",
      "id": "138613",
      "original_text": "Registerbekanntmachung nach dem Umwandlungsgesetz\nNordrhein-Westfalen Amtsgericht Düsseldorf HRA 28341\nRestaurant Gogi e.K. – Düsseldorf",
      "type": "Registerbekanntmachung nach dem Umwandlungsgesetz",
      "state": "Nordrhein-Westfalen",
      "amtsgericht": "Amtsgericht Düsseldorf",
      "registernummer": "HRA 28341",
      "registerart": "HRA",
      "company_name": "Restaurant Gogi e.K.",
      "company_seat": "Düsseldorf",
      "details": "28.11.2025 (Bekanntmachungsdatum)\n\nNordrhein-Westfalen Amtsgericht Düsseldorf HRA 28341\nRegisterbekanntmachung nach dem Umwandlungsgesetz 28.11.2025 (Eintragungsdatum)\n\nRestaurant Gogi e.K.\nEinzelkaufmann / Einzelkauffrau\nDüsseldorf\n\nDen Gläubigern der an der Ausgliederung beteiligten Rechtsträger ist, wenn sie binnen sechs Monaten nach dem Tag, an dem die Eintragung der Ausgliederung in das Register des Sitzes desjenigen Rechtsträgers, dessen Gläubiger sie sind, nach § 19 Absatz 3 UmwG als bekanntgemacht gilt, ihren Anspruch nach Grund und Höhe schriftlich anmelden, Sicherheit zu leisten, soweit sie nicht Befriedigung verlangen können. Dieses Recht steht den Gläubigern jedoch nur zu, wenn sie glaubhaft machen, dass durch die Ausgliederung die Erfüllung ihrer Forderung gefährdet wird."
    },
    {
      "date": "2025-11-28",
      "id": "138614",
      "original_text": "Registerbekanntmachung nach dem Umwandlungsgesetz\nNordrhein-Westfalen Amtsgericht Düsseldorf HRA 22016\nPaxos Köln Cä24 SARL & Co. KG – Düsseldorf",
      "type": "Registerbekanntmachung nach dem Umwandlungsgesetz",
      "state": "Nordrhein-Westfalen",
      "amtsgericht": "Amtsgericht Düsseldorf",
      "registernummer": "HRA 22016",
      "registerart": "HRA",
      "company_name": "Paxos Köln Cä24 SARL & Co. KG",
      "company_seat": "Düsseldorf",
      "details": "28.11.2025 (Bekanntmachungsdatum)\n\nNordrhein-Westfalen Amtsgericht Düsseldorf HRA 22016\nRegisterbekanntmachung nach dem Umwandlungsgesetz 28.11.2025 (Eintragungsdatum)\n\nPaxos Köln Cä24 SARL & Co. KG\nKommanditgesellschaft\nDüsseldorf\n\nDen Gläubigern der an der formwechselnden Umwandlung beteiligten Rechtsträger ist, wenn sie binnen sechs Monaten nach dem Tag, an dem die Eintragung der formwechselnden Umwandlung in das Register des Sitzes derjenigen Rechtsträger deren Gläubiger sie sind, nach § 19 Absatz 3 UmwG als bekanntgemacht gilt, ihren Anspruch nach Grund und Höhe schriftlich anmelden, Sicherheit zu leisten, soweit sie nicht Befriedigung verlangen können. Dieses Recht steht den Gläubigern jedoch nur zu, wenn sie glaubhaft machen, dass durch die formwechselnden Umwandlung die Erfüllung ihrer Forderung gefährdet wird."
    },
    {
      "date": "2025-11-28",
      "id": "138615",
      "original_text": "Registerbekanntmachung nach dem Umwandlungsgesetz\nNordrhein-Westfalen Amtsgericht Düsseldorf HRB 84989\nProjekt Ohligsmühle Verwaltungsgesellschaft mbH – Ratingen",
      "type": "Registerbekanntmachung nach dem Umwandlungsgesetz",
      "state": "Nordrhein-Westfalen",
      "amtsgericht": "Amtsgericht Düsseldorf",
      "registernummer": "HRB 84989",
      "registerart": "HRB",
      "company_name": "Projekt Ohligsmühle Verwaltungsgesellschaft mbH",
      "company_seat": "Ratingen",
      "details": "28.11.2025 (Bekanntmachungsdatum)\n\nNordrhein-Westfalen Amtsgericht Düsseldorf HRB 84989\nRegisterbekanntmachung nach dem Umwandlungsgesetz 28.11.2025 (Eintragungsdatum)\n\nProjekt Ohligsmühle Verwaltungsgesellschaft mbH\nGesellschaft mit beschränkter Haftung\nRatingen\n\nDen Gläubigern der an der Verschmelzung beteiligten Rechtsträger ist, wenn sie binnen sechs Monaten nach dem Tag, an dem die Eintragung der Verschmelzung in das Register des Sitzes desjenigen Rechtsträgers, dessen Gläubiger sie sind, nach § 19 Absatz 3 UmwG als bekanntgemacht gilt, ihren Anspruch nach Grund und Höhe schriftlich anmelden, Sicherheit zu leisten, soweit sie nicht Befriedigung verlangen können. Dieses Recht steht den Gläubigern jedoch nur zu, wenn sie glaubhaft machen, dass durch die Verschmelzung die Erfüllung ihrer Forderung gefährdet wird."
    },
    {
      "date": "2025-11-28",
      "id": "138616",
      "original_text": "Löschungsankündigung\nNordrhein-Westfalen Amtsgericht Dortmund HRB 37062\nBadkünstler & Polen-Fenster UG (haftungsbeschränkt) – Dortmund",
      "type": "Löschungsankündigung",
      "state": "Nordrhein-Westfalen",
      "amtsgericht": "Amtsgericht Dortmund",
      "registernummer": "HRB 37062",
      "registerart": "HRB",
      "company_name": "Badkünstler & Polen-Fenster UG (haftungsbeschränkt)",
      "company_seat": "Dortmund",
      "details": "28.11.2025 (Bekanntmachungsdatum)\n\nNordrhein-Westfalen Amtsgericht Dortmund HRB 37062\nLöschungsankündigung 28.11.2025 (Eintragungsdatum)\n\nBadkünstler & Polen-Fenster UG (haftungsbeschränkt)\nGesellschaft mit beschränkter Haftung\nDortmund\n\nDas Registergericht beabsichtigt die Gesellschaft von Amts wegen nach § 394 FamFG zu löschen. Die Frist zur Erhebung eines Widerspruchs ist auf zwei Monate festgesetzt."
    },
    {
      "date": "2025-11-28",
      "id": "138617",
      "original_text": "Registerbekanntmachung nach dem Umwandlungsgesetz\nNordrhein-Westfalen Amtsgericht Bochum HRB 22194\nBleTec Beteiligungs GmbH – Bochum",
      "type": "Registerbekanntmachung nach dem Umwandlungsgesetz",
      "state": "Nordrhein-Westfalen",
      "amtsgericht": "Amtsgericht Bochum",
      "registernummer": "HRB 22194",
      "registerart": "HRB",
      "company_name": "BleTec Beteiligungs GmbH",
      "company_seat": "Bochum",
      "details": "28.11.2025 (Bekanntmachungsdatum)\n\nNordrhein-Westfalen Amtsgericht Bochum HRB 22194\nRegisterbekanntmachung nach dem Umwandlungsgesetz 27.11.2025 (Eintragungsdatum)\n\nBleTec Beteiligungs GmbH\nGesellschaft mit beschränkter Haftung\nBochum\n\nDen Gläubigern der an der Verschmelzung beteiligten Rechtsträger ist, wenn sie binnen sechs Monaten nach dem Tag, an dem die Eintragung der Verschmelzung in das Register des Sitzes derjenigen Rechtsträger deren Gläubiger sie sind, nach § 19 Absatz 3 UmwG als bekanntgemacht gilt, ihren Anspruch nach Grund und Höhe schriftlich anmelden, Sicherheit zu leisten, soweit sie nicht Befriedigung verlangen können. Dieses Recht steht den Gläubigern jedoch nur zu, wenn sie glaubhaft machen, dass durch die Verschmelzung die Erfüllung ihrer Forderung gefährdet wird."
    },
    {
      "date": "2025-11-28",
      "id": "138618",
      "original_text": "Registerbekanntmachung nach dem Umwandlungsgesetz\nNordrhein-Westfalen Amtsgericht Bonn HRB 26117\nRe-Spire GmbH – Bonn",
      "type": "Registerbekanntmachung nach dem Umwandlungsgesetz",
      "state": "Nordrhein-Westfalen",
      "amtsgericht": "Amtsgericht Bonn",
      "registernummer": "HRB 26117",
      "registerart": "HRB",
      "company_name": "Re-Spire GmbH",
      "company_seat": "Bonn",
      "details": "28.11.2025 (Bekanntmachungsdatum)\n\nNordrhein-Westfalen Amtsgericht Bonn HRB 26117\nRegisterbekanntmachung nach dem Umwandlungsgesetz 28.11.2025 (Eintragungsdatum)\n\nRe-Spire GmbH\nGesellschaft mit beschränkter Haftung\nBonn\n\nDen Gläubigern der an der Verschmelzung beteiligten Rechtsträger ist, wenn sie binnen sechs Monaten nach dem Tag, an dem die Eintragung der Verschmelzung in das Register des Sitzes desjenigen Rechtsträgers, dessen Gläubiger sie sind, nach § 19 Absatz 3 UmwG als bekanntgemacht gilt, ihren Anspruch nach Grund und Höhe schriftlich anmelden, Sicherheit zu leisten, soweit sie nicht Befriedigung verlangen können. Dieses Recht steht den Gläubigern jedoch nur zu, wenn sie glaubhaft machen, dass durch die Verschmelzung die Erfüllung ihrer Forderung gefährdet wird."
    },
    {
      "date": "2025-11-28",
      "id": "138619",
      "original_text": "Löschungsankündigung\nNordrhein-Westfalen Amtsgericht Gelsenkirchen HRB 14912\nHomes Bauunternehmung GmbH – Bottrop",
      "type": "Löschungsankündigung",
      "state": "Nordrhein-Westfalen",
      "amtsgericht": "Amtsgericht Gelsenkirchen",
      "registernummer": "HRB 14912",
      "registerart": "HRB",
      "company_name": "Homes Bauunternehmung GmbH",
      "company_seat": "Bottrop",
      "details": "28.11.2025 (Bekanntmachungsdatum)\n\nNordrhein-Westfalen Amtsgericht Gelsenkirchen HRB 14912\nLöschungsankündigung\n\nHomes Bauunternehmung GmbH\nGesellschaft mit beschränkter Haftung\nBottrop\n\nDas Gericht beabsichtigt, die im Handelsregister eingetragene Homes Bauunternehmung GmbH mit Sitz in Bottrop, HRB 14912, Amtsgericht Gelsenkirchen, wegen Vermögenslosigkeit zu löschen.\nHiermit wird denjenigen, die an der Unterlassung der Löschung ein berechtigtes Interesse haben, gem. § 394 Abs. 2 FamFG Gelegenheit gegeben, gegen dieses Vorhaben binnen eines Monats nach dieser Bekanntmachung Widerspruch einzulegen. Der Widerspruch kann schriftlich oder zu Protokoll der Geschäftsstelle erhoben werden."
    },
    {
      "date": "2025-11-28",
      "id": "138620",
      "original_text": "Einreichung neuer Dokumente\nNordrhein-Westfalen Amtsgericht Bad Oeynhausen HRA 10068\nSänger ZS GmbH & Co. KG – Löhne",
      "type": "Einreichung neuer Dokumente",
      "state": "Nordrhein-Westfalen",
      "amtsgericht": "Amtsgericht Bad Oeynhausen",
      "registernummer": "HRA 10068",
      "registerart": "HRA",
      "company_name": "Sänger ZS GmbH & Co. KG",
      "company_seat": "Löhne",
      "details": "28.11.2025 (Bekanntmachungsdatum)\n\nNordrhein-Westfalen Amtsgericht Bad Oeynhausen HRA 10068\nEinreichung neuer Dokumente\n\nSänger ZS GmbH & Co. KG\nKommanditgesellschaft\nLöhne\n\nDem Registergericht ist eine neue Liste der Mitglieder des Beirates eingereicht worden."
    },
    {
      "date": "2025-11-28",
      "id": "138621",
      "original_text": "Löschungsankündigung\nNordrhein-Westfalen Amtsgericht Aachen HRB 27500\nVR TechFun GmbH – Aachen",
      "type": "Löschungsankündigung",
      "state": "Nordrhein-Westfalen",
      "amtsgericht": "Amtsgericht Aachen",
      "registernummer": "HRB 27500",
      "registerart": "HRB",
      "company_name": "VR TechFun GmbH",
      "company_seat": "Aachen",
      "details": "28.11.2025 (Bekanntmachungsdatum)\n\nNordrhein-Westfalen Amtsgericht Aachen HRB 27500\nLöschungsankündigung\n\nVR TechFun GmbH\nGesellschaft mit beschränkter Haftung\nAachen\n\nDas Registergericht beabsichtigt, von Amts wegen die Gesellschaft wegen Vermögenslosigkeit nach § 394 FamFG zu löschen, weil das Insolvenzverfahren Amtsgericht Aachen (Az.: 93 IN 94/25) beendet und Vermögen der Gesellschaft nicht mehr erkennbar ist. Zur Geltendmachung des Widerspruchs gegen die beabsichtigte Löschung wird hiermit eine Frist von einem Monat ab Veröffentlichung dieser Ankündigung bestimmt.\nRechtsbehelfsbelehrung:\nGegen diese Verfügung kann Widerspruch eingelegt werden. Zum Widerspruch ist jeder berechtigt, der an der Unterlassung der Löschung ein berechtigtes Interesse hat.\nDer Widerspruch ist bei dem Amtsgericht Aachen, Adalbertsteinweg 92, 52070 Aachen schriftlich in deutscher Sprache oder zur Niederschrift der Geschäftsstelle einzulegen. Der Widerspruch kann auch zur Niederschrift der Geschäftsstelle eines jeden Amtsgerichtes abgegeben werden.\nDer Widerspruch muss spätestens innerhalb der gesetzten Frist nach der Bekanntgabe der Verfügung bei dem Amtsgericht Aachen eingegangen sein. Dies gilt auch dann, wenn der Widerspruch zur Niederschrift der Geschäftsstelle eines anderen Amtsgerichtes abgegeben wurde. Die Frist beginnt mit der Bekanntgabe der Verfügung durch Veröffentlichung. Fällt das Ende der Frist auf einen Sonntag, einen allgemeinen Feiertag oder Sonnabend, so endet die Frist mit Ablauf des nächsten Werktages.\nDer Widerspruch muss die Bezeichnung der angefochtenen Verfügung sowie die Erklärung enthalten, dass Widerspruch gegen diese Verfügung eingelegt wird. Er ist zu unterzeichnen und soll begründet werden.\nDie Einlegung ist auch durch Übertragung eines elektronischen Dokuments an die elektronische Poststelle des Gerichts möglich. Das elektronische Dokument muss für die Bearbeitung durch das Gericht geeignet und mit einer qualifizierten elektronischen Signatur der verantwortenden Person versehen sein oder von der verantwortenden Person signiert und auf einem sicheren Übermittlungsweg gemäß § 130 a ZPO nach näherer Maßgabe der Verordnung über die technischen Rahmenbedingungen des elektronischen Rechtsverkehrs und über das besondere elektronische Behördenpostfach (BGBl. I, S. 3803) eingereicht werden. Weitere Informationen erhalten Sie auf der Internetseite www.justiz.de."
    },
    {
      "date": "2025-11-28",
      "id": "138622",
      "original_text": "Löschungsankündigung\nNordrhein-Westfalen Amtsgericht Düsseldorf HRB 101931\nD. Nowak - Catering, Events & Projektplanung GmbH – Düsseldorf",
      "type": "Löschungsankündigung",
      "state": "Nordrhein-Westfalen",
      "amtsgericht": "Amtsgericht Düsseldorf",
      "registernummer": "HRB 101931",
      "registerart": "HRB",
      "company_name": "D. Nowak - Catering, Events & Projektplanung GmbH",
      "company_seat": "Düsseldorf",
      "details": "28.11.2025 (Bekanntmachungsdatum)\n\nNordrhein-Westfalen Amtsgericht Düsseldorf HRB 101931\nLöschungsankündigung\n\nD. Nowak - Catering, Events & Projektplanung GmbH\nGesellschaft mit beschränkter Haftung\nDüsseldorf\n\nDas Registergericht beabsichtigt die Gesellschaft von Amts wegen nach § 394 FamFG zu löschen. Die Frist zur Erhebung eines Widerspruchs ist auf 3 Wochen festgesetzt.\n\nRechtsbehelfsbelehrung:\nDas Widerspruchsrecht steht jedem zu, der an der Unterlassung der Löschung ein berechtigtes Interesse hat. Der Widerspruch ist bei dem Amtsgericht Düsseldorf -Registergericht-, Werdener Straße 1, 40227 Düsseldorf schriftlich in deutscher Sprache oder zur Niederschrift der Geschäftsstelle einzulegen. Der Widerspruch kann auch zur Niederschrift der Geschäftsstelle eines jeden Amtsgerichtes abgegeben werden. Die Einlegung ist auch durch Übertragung eines elektronischen Dokuments an die elektronische Poststelle des Gerichts möglich. Das elektronische Dokument muss für die Bearbeitung durch das Gericht geeignet und mit einer qualifizierten elektronischen Signatur der verantwortenden Person versehen sein oder von der verantwortenden Person signiert und auf einem sicheren Übermittlungsweg gemäß § 130a ZPO nach näherer Maßgabe der Verordnung über die technischen Rahmenbedingungen des elektronischen Rechtsverkehrs und über das besondere elektronische Behördenpostfach (BGBl. I, S.3803) eingereicht werden. Weitere Informationen erhalten Sie auf der Internetseite www.justiz.de.\nDer Widerspruch muss spätestens innerhalb der gesetzten Frist nach dem Datum der Bekanntmachung der Löschungsankündigung bei dem Amtsgericht - Registergericht - Düsseldorf eingegangen sein.  Dies gilt auch dann, wenn der Widerspruch zur Niederschrift der Geschäftsstelle eines anderen Amtsgerichtes abgegeben wurde. Die Frist beginnt mit dem Tage der Bekanntmachung der Löschungsankündigung in dem für die Bekanntmachung der Eintragungen in das Handelsregister bestimmten elektronischen Informations- und Kommunikationssystem nach § 10 des Handelsgesetzbuches. Fällt das Ende der Frist auf einen Sonntag, einen allgemeinen Feiertag oder Sonnabend, so endet die Frist mit Ablauf des nächsten Werktages.\nDer Widerspruch muss die Bezeichnung der angefochtenen Löschungsankündigung sowie die Erklärung enthalten, dass Widerspruch gegen diese Löschungsankündigung eingelegt wird. Er ist zu unterzeichnen und soll begründet werden."
    },
    {
      "date": "2025-11-28",
      "id": "138623",
      "original_text": "Registerbekanntmachung nach dem Umwandlungsgesetz\nNordrhein-Westfalen Amtsgericht Bad Oeynhausen HRB 19975\nStockmeier Food GmbH – Herford",
      "type": "Registerbekanntmachung nach dem Umwandlungsgesetz",
      "state": "Nordrhein-Westfalen",
      "amtsgericht": "Amtsgericht Bad Oeynhausen",
      "registernummer": "HRB 19975",
      "registerart": "HRB",
      "company_name": "Stockmeier Food GmbH",
      "company_seat": "Herford",
      "details": "28.11.2025 (Bekanntmachungsdatum)\n\nNordrhein-Westfalen Amtsgericht Bad Oeynhausen HRB 19975\nRegisterbekanntmachung nach dem Umwandlungsgesetz 28.11.2025 (Eintragungsdatum)\n\nStockmeier Food GmbH\nGesellschaft mit beschränkter Haftung\nHerford\n\nDen Gläubigern der an der Verschmelzung beteiligten Rechtsträger ist, wenn sie binnen sechs Monaten nach dem Tag, an dem die Eintragung der Verschmelzung in das Register des Sitzes desjenigen Rechtsträgers, dessen Gläubiger sie sind, nach § 19 Absatz 3 UmwG als bekanntgemacht gilt, ihren Anspruch nach Grund und Höhe schriftlich anmelden, Sicherheit zu leisten, soweit sie nicht Befriedigung verlangen können. Dieses Recht steht den Gläubigern jedoch nur zu, wenn sie glaubhaft machen, dass durch die Verschmelzung die Erfüllung ihrer Forderung gefährdet wird."
    },
    {
      "date": "2025-11-28",
      "id": "138624",
      "original_text": "Registerbekanntmachung nach dem Umwandlungsgesetz\nNordrhein-Westfalen Amtsgericht Düsseldorf HRA 27851\nPaxos Düsseldorf Goltstein19 SARL & Co. KG – Düsseldorf",
      "type": "Registerbekanntmachung nach dem Umwandlungsgesetz",
      "state": "Nordrhein-Westfalen",
      "amtsgericht": "Amtsgericht Düsseldorf",
      "registernummer": "HRA 27851",
      "registerart": "HRA",
      "company_name": "Paxos Düsseldorf Goltstein19 SARL & Co. KG",
      "company_seat": "Düsseldorf",
      "details": "28.11.2025 (Bekanntmachungsdatum)\n\nNordrhein-Westfalen Amtsgericht Düsseldorf HRA 27851\nRegisterbekanntmachung nach dem Umwandlungsgesetz 28.11.2025 (Eintragungsdatum)\n\nPaxos Düsseldorf Goltstein19 SARL & Co. KG\nKommanditgesellschaft\nDüsseldorf\n\nDen Gläubigern der an der formwechselnden Umwandlung beteiligten Rechtsträger ist, wenn sie binnen sechs Monaten nach dem Tag, an dem die Eintragung der formwechselnden Umwandlung in das Register des Sitzes derjenigen Rechtsträger deren Gläubiger sie sind, nach § 19 Absatz 3 UmwG als bekanntgemacht gilt, ihren Anspruch nach Grund und Höhe schriftlich anmelden, Sicherheit zu leisten, soweit sie nicht Befriedigung verlangen können. Dieses Recht steht den Gläubigern jedoch nur zu, wenn sie glaubhaft machen, dass durch die formwechselnden Umwandlung die Erfüllung ihrer Forderung gefährdet wird."
    },
    {
      "date": "2025-11-28",
      "id": "138625",
      "original_text": "Registerbekanntmachung nach dem Umwandlungsgesetz\nNordrhein-Westfalen Amtsgericht Bonn HRB 21454\nFORLIANCE GmbH – Bonn",
      "type": "Registerbekanntmachung nach dem Umwandlungsgesetz",
      "state": "Nordrhein-Westfalen",
      "amtsgericht": "Amtsgericht Bonn",
      "registernummer": "HRB 21454",
      "registerart": "HRB",
      "company_name": "FORLIANCE GmbH",
      "company_seat": "Bonn",
      "details": "28.11.2025 (Bekanntmachungsdatum)\n\nNordrhein-Westfalen Amtsgericht Bonn HRB 21454\nRegisterbekanntmachung nach dem Umwandlungsgesetz 28.11.2025 (Eintragungsdatum)\n\nFORLIANCE GmbH\nGesellschaft mit beschränkter Haftung\nBonn\n\nDen Gläubigern der an der Verschmelzung beteiligten Rechtsträger ist, wenn sie binnen sechs Monaten nach dem Tag, an dem die Eintragung der Verschmelzung in das Register des Sitzes desjenigen Rechtsträgers, dessen Gläubiger sie sind, nach § 19 Absatz 3 UmwG als bekanntgemacht gilt, ihren Anspruch nach Grund und Höhe schriftlich anmelden, Sicherheit zu leisten, soweit sie nicht Befriedigung verlangen können. Dieses Recht steht den Gläubigern jedoch nur zu, wenn sie glaubhaft machen, dass durch die Verschmelzung die Erfüllung ihrer Forderung gefährdet wird."
    },
    {
      "date": "2025-11-28",
      "id": "138626",
      "original_text": "Registerbekanntmachung nach dem Umwandlungsgesetz\nNordrhein-Westfalen Amtsgericht Düsseldorf HRB 111081\nKalender.digital GmbH – Düsseldorf",
      "type": "Registerbekanntmachung nach dem Umwandlungsgesetz",
      "state": "Nordrhein-Westfalen",
      "amtsgericht": "Amtsgericht Düsseldorf",
      "registernummer": "HRB 111081",
      "registerart": "HRB",
      "company_name": "Kalender.digital GmbH",
      "company_seat": "Düsseldorf",
      "details": "28.11.2025 (Bekanntmachungsdatum)\n\nNordrhein-Westfalen Amtsgericht Düsseldorf HRB 111081\nRegisterbekanntmachung nach dem Umwandlungsgesetz 28.11.2025 (Eintragungsdatum)\n\nKalender.digital GmbH\nGesellschaft mit beschränkter Haftung\nDüsseldorf\n\nDen Gläubigern der an der formwechselnden Umwandlung beteiligten Rechtsträger ist, wenn sie binnen sechs Monaten nach dem Tag, an dem die Eintragung der formwechselnden Umwandlung in das Register des Sitzes desjenigen Rechtsträgers, dessen Gläubiger sie sind, nach § 19 Absatz 3 UmwG als bekanntgemacht gilt, ihren Anspruch nach Grund und Höhe schriftlich anmelden, Sicherheit zu leisten, soweit sie nicht Befriedigung verlangen können. Dieses Recht steht den Gläubigern jedoch nur zu, wenn sie glaubhaft machen, dass durch die formwechselnden Umwandlung die Erfüllung ihrer Forderung gefährdet wird."
    },
    {
      "date": "2025-11-28",
      "id": "138627",
      "original_text": "Registerbekanntmachung nach dem Umwandlungsgesetz\nNordrhein-Westfalen Amtsgericht Bad Oeynhausen HRB 9367\nKükelhan Geschäftsführungs-GmbH – Stemwede Oppenwehe",
      "type": "Registerbekanntmachung nach dem Umwandlungsgesetz",
      "state": "Nordrhein-Westfalen",
      "amtsgericht": "Amtsgericht Bad Oeynhausen",
      "registernummer": "HRB 9367",
      "registerart": "HRB",
      "company_name": "Kükelhan Geschäftsführungs-GmbH",
      "company_seat": "Stemwede Oppenwehe",
      "details": "28.11.2025 (Bekanntmachungsdatum)\n\nNordrhein-Westfalen Amtsgericht Bad Oeynhausen HRB 9367\nRegisterbekanntmachung nach dem Umwandlungsgesetz 28.11.2025 (Eintragungsdatum)\n\nKükelhan Geschäftsführungs-GmbH\nGesellschaft mit beschränkter Haftung\nStemwede Oppenwehe\n\nDen Gläubigern der an der Verschmelzung beteiligten Rechtsträger ist, wenn sie binnen sechs Monaten nach dem Tag, an dem die Eintragung der Verschmelzung in das Register des Sitzes desjenigen Rechtsträgers, dessen Gläubiger sie sind, nach § 19 Absatz 3 UmwG als bekanntgemacht gilt, ihren Anspruch nach Grund und Höhe schriftlich anmelden, Sicherheit zu leisten, soweit sie nicht Befriedigung verlangen können. Dieses Recht steht den Gläubigern jedoch nur zu, wenn sie glaubhaft machen, dass durch die Verschmelzung die Erfüllung ihrer Forderung gefährdet wird."
    },
    {
      "date": "2025-11-28",
      "id": "138628",
      "original_text": "Einreichung neuer Dokumente\nNordrhein-Westfalen Amtsgericht Bad Oeynhausen HRA 1764\nSänger GmbH & Co. KG – Löhne",
      "type": "Einreichung neuer Dokumente",
      "state": "Nordrhein-Westfalen",
      "amtsgericht": "Amtsgericht Bad Oeynhausen",
      "registernummer": "HRA 1764",
      "registerart": "HRA",
      "company_name": "Sänger GmbH & Co. KG",
      "company_seat": "Löhne",
      "details": "28.11.2025 (Bekanntmachungsdatum)\n\nNordrhein-Westfalen Amtsgericht Bad Oeynhausen HRA 1764\nEinreichung neuer Dokumente\n\nSänger GmbH & Co. KG\nKommanditgesellschaft\nLöhne\n\nDem Registergericht ist eine neue Liste der Mitglieder des Beirates eingereicht worden."
    },
    {
      "date": "2025-11-28",
      "id": "138629",
      "original_text": "Löschungsankündigung\nNordrhein-Westfalen Amtsgericht Essen HRB 18722\nR + S Gesellschaft für Wirtschafts-Dienste mbH – Hattingen",
      "type": "Löschungsankündigung",
      "state": "Nordrhein-Westfalen",
      "amtsgericht": "Amtsgericht Essen",
      "registernummer": "HRB 18722",
      "registerart": "HRB",
      "company_name": "R + S Gesellschaft für Wirtschafts-Dienste mbH",
      "company_seat": "Hattingen",
      "details": "28.11.2025 (Bekanntmachungsdatum)\n\nNordrhein-Westfalen Amtsgericht Essen HRB 18722\nLöschungsankündigung\n\nR + S Gesellschaft für Wirtschafts-Dienste mbH\nGesellschaft mit beschränkter Haftung\nHattingen\n\nDas Registergericht beabsichtigt die Gesellschaft von Amts wegen nach § 394 FamFG zu löschen. Die Frist zur Erhebung eines Widerspruchs ist auf einen Monat festgesetzt."
    },
    {
      "date": "2025-11-28",
      "id": "138630",
      "original_text": "Registerbekanntmachung nach dem Umwandlungsgesetz\nNordrhein-Westfalen Amtsgericht Köln HRB 80387\nNähle & Zarbock Beteiligungs GmbH – Köln",
      "type": "Registerbekanntmachung nach dem Umwandlungsgesetz",
      "state": "Nordrhein-Westfalen",
      "amtsgericht": "Amtsgericht Köln",
      "registernummer": "HRB 80387",
      "registerart": "HRB",
      "company_name": "Nähle & Zarbock Beteiligungs GmbH",
      "company_seat": "Köln",
      "details": "28.11.2025 (Bekanntmachungsdatum)\n\nNordrhein-Westfalen Amtsgericht Köln HRB 80387\nRegisterbekanntmachung nach dem Umwandlungsgesetz\n\nNähle & Zarbock Beteiligungs GmbH\nGesellschaft mit beschränkter Haftung\nKöln\n\nDem Registergericht ist ein Verschmelzungsplan über die geplante Verschmelzung der Gesellschaft mit beschränkter Haftung nach niederländischem Recht (Besloten Vennootschap) unter Firma IR Logistics Holding B.V. mit Sitz in Venlo/Niederlande (Kamer van Koophandel Nr. 60465026) als übertragender Gesellschaft mit der Gesellschaft mit beschränkter Haftung nach deutschem Recht unter Firma Nähle & Zarbock Beteiligungs GmbH mit Sitz in Köln (Amtsgericht Köln HRB 80387) als übernehmender Gesellschaft eingereicht worden.\nDie Urkunden der sich verschmelzenden Gesellschaften sind jeweils hinterlegt für die IR Logistics Holding B.V. mit Sitz in Venlo/Niederlande bei der Kamer van Koophandel unter 60465026 und für die Nähle & Zarbock Beteiligungs GmbH mit Sitz in Köln/Deutschland, im deutschen Handelsregister des Amtsgerichts Köln unter HRB 80387.\nAnteilsinhaber und Gläubiger der an der grenzüberschreitenden Verschmelzung beteiligten Gesellschaften sowie Arbeitnehmer der an der grenzüberschreitenden Verschmelzung beteiligten Gesellschaften können bis spätestens fünf Arbeitstage vor dem Tag der Gesellschafterversammlung, welche voraussichtlich am 20. Januar 2026 stattfindet, Bemerkungen zu dem Verschmelzungsplan übermitteln.\nDie Bemerkungen sind zu richten an:\nBezüglich der übertragenden Gesellschaft: IR Logistics Holding B.V., Horsterweg 74, 5971NG Grubbenvorst,\nBezüglich der aufnehmenden Gesellschaft: Nähle & Zarbock Beteiligungs GmbH Wiethasestraße 54, 50933 Köln."
    },
    {
      "date": "2025-11-28",
      "id": "138631",
      "original_text": "Registerbekanntmachung nach dem Umwandlungsgesetz\nNordrhein-Westfalen Amtsgericht Bad Oeynhausen HRB 9325\nErich Kükelhan GmbH – Stemwede",
      "type": "Registerbekanntmachung nach dem Umwandlungsgesetz",
      "state": "Nordrhein-Westfalen",
      "amtsgericht": "Amtsgericht Bad Oeynhausen",
      "registernummer": "HRB 9325",
      "registerart": "HRB",
      "company_name": "Erich Kükelhan GmbH",
      "company_seat": "Stemwede",
      "details": "28.11.2025 (Bekanntmachungsdatum)\n\nNordrhein-Westfalen Amtsgericht Bad Oeynhausen HRB 9325\nRegisterbekanntmachung nach dem Umwandlungsgesetz 28.11.2025 (Eintragungsdatum)\n\nErich Kükelhan GmbH\nGesellschaft mit beschränkter Haftung\nStemwede\n\nDen Gläubigern der an der Verschmelzung beteiligten Rechtsträger ist, wenn sie binnen sechs Monaten nach dem Tag, an dem die Eintragung der Verschmelzung in das Register des Sitzes desjenigen Rechtsträgers, dessen Gläubiger sie sind, nach § 19 Absatz 3 UmwG als bekanntgemacht gilt, ihren Anspruch nach Grund und Höhe schriftlich anmelden, Sicherheit zu leisten, soweit sie nicht Befriedigung verlangen können. Dieses Recht steht den Gläubigern jedoch nur zu, wenn sie glaubhaft machen, dass durch die Verschmelzung die Erfüllung ihrer Forderung gefährdet wird."
    },
    {
      "date": "2025-11-28",
      "id": "138632",
      "original_text": "Einreichung neuer Dokumente\nNordrhein-Westfalen Amtsgericht Düsseldorf HRB 47852\nSchneider Electric GmbH – Düsseldorf",
      "type": "Einreichung neuer Dokumente",
      "state": "Nordrhein-Westfalen",
      "amtsgericht": "Amtsgericht Düsseldorf",
      "registernummer": "HRB 47852",
      "registerart": "HRB",
      "company_name": "Schneider Electric GmbH",
      "company_seat": "Düsseldorf",
      "details": "28.11.2025 (Bekanntmachungsdatum)\n\nNordrhein-Westfalen Amtsgericht Düsseldorf HRB 47852\nEinreichung neuer Dokumente\n\nSchneider Electric GmbH\nGesellschaft mit beschränkter Haftung\nDüsseldorf\n\nDem Registergericht ist eine Liste der Mitglieder des Aufsichtsrates eingereicht worden."
    },
    {
      "date": "2025-11-28",
      "id": "138633",
      "original_text": "Löschungsankündigung\nHessen Amtsgericht Frankfurt am Main HRB 101779\nAUGURAS GmbH – Frankfurt am Main",
      "type": "Löschungsankündigung",
      "state": "Hessen",
      "amtsgericht": "Amtsgericht Frankfurt am Main",
      "registernummer": "HRB 101779",
      "registerart": "HRB",
      "company_name": "AUGURAS GmbH",
      "company_seat": "Frankfurt am Main",
      "details": "28.11.2025 (Bekanntmachungsdatum)\n\nHessen Amtsgericht Frankfurt am Main HRB 101779\nLöschungsankündigung\n\nAUGURAS GmbH\nGesellschaft mit beschränkter Haftung\nFrankfurt am Main\n\nDas Registergericht beabsichtigt die im Handelsregister eingetragene Gesellschaft von Amts wegen nach § 394 FamFG zu löschen. Die Frist zur Erhebung eines Widerspruchs gegen die beabsichtigte Löschung wird auf 1 Monate festgesetzt."
    },
    {
      "date": "2025-11-28",
      "id": "138634",
      "original_text": "Registerbekanntmachung nach dem Umwandlungsgesetz\nHessen Amtsgericht Frankfurt am Main HRB 129131\nSteigenberger Hotels GmbH – Frankfurt am Main",
      "type": "Registerbekanntmachung nach dem Umwandlungsgesetz",
      "state": "Hessen",
      "amtsgericht": "Amtsgericht Frankfurt am Main",
      "registernummer": "HRB 129131",
      "registerart": "HRB",
      "company_name": "Steigenberger Hotels GmbH",
      "company_seat": "Frankfurt am Main",
      "details": "28.11.2025 (Bekanntmachungsdatum)\n\nHessen Amtsgericht Frankfurt am Main HRB 129131\nRegisterbekanntmachung nach dem Umwandlungsgesetz 28.11.2025 (Eintragungsdatum)\n\nSteigenberger Hotels GmbH\nGesellschaft mit beschränkter Haftung\nFrankfurt am Main\n\nDen Gläubigern der an der Verschmelzung beteiligten Rechtsträger ist, wenn sie binnen sechs Monaten nach dem Tag, an dem die Eintragung der Verschmelzung in das Register des Sitzes desjenigen Rechtsträgers, dessen Gläubiger sie sind, nach § 19 Absatz 3 UmwG bekannt gemacht worden ist, ihren Anspruch nach Grund und Höhe schriftlich anmelden, Sicherheit zu leisten, soweit sie nicht Befriedigung verlangen können. Dieses Recht steht den Gläubigern jedoch nur zu, wenn sie glaubhaft machen, dass durch die Verschmelzung die Erfüllung ihrer Forderung gefährdet wird."
    },
    {
      "date": "2025-11-28",
      "id": "138635",
      "original_text": "Registerbekanntmachung nach dem Umwandlungsgesetz\nHessen Amtsgericht Frankfurt am Main HRB 129131\nSteigenberger Hotels GmbH – Frankfurt am Main",
      "type": "Registerbekanntmachung nach dem Umwandlungsgesetz",
      "state": "Hessen",
      "amtsgericht": "Amtsgericht Frankfurt am Main",
      "registernummer": "HRB 129131",
      "registerart": "HRB",
      "company_name": "Steigenberger Hotels GmbH",
      "company_seat": "Frankfurt am Main",
      "details": "28.11.2025 (Bekanntmachungsdatum)\n\nHessen Amtsgericht Frankfurt am Main HRB 129131\nRegisterbekanntmachung nach dem Umwandlungsgesetz 28.11.2025 (Eintragungsdatum)\n\nSteigenberger Hotels GmbH\nGesellschaft mit beschränkter Haftung\nFrankfurt am Main\n\nDen Gläubigern der an der Verschmelzung beteiligten Rechtsträger ist, wenn sie binnen sechs Monaten nach dem Tag, an dem die Eintragung der Verschmelzung in das Register des Sitzes desjenigen Rechtsträgers, dessen Gläubiger sie sind, nach § 19 Absatz 3 UmwG bekannt gemacht worden ist, ihren Anspruch nach Grund und Höhe schriftlich anmelden, Sicherheit zu leisten, soweit sie nicht Befriedigung verlangen können. Dieses Recht steht den Gläubigern jedoch nur zu, wenn sie glaubhaft machen, dass durch die Verschmelzung die Erfüllung ihrer Forderung gefährdet wird."
    },
    {
      "date": "2025-11-28",
      "id": "138636",
      "original_text": "Registerbekanntmachung nach dem Umwandlungsgesetz\nHessen Amtsgericht Frankfurt am Main HRB 129131\nSteigenberger Hotels GmbH – Frankfurt am Main",
      "type": "Registerbekanntmachung nach dem Umwandlungsgesetz",
      "state": "Hessen",
      "amtsgericht": "Amtsgericht Frankfurt am Main",
      "registernummer": "HRB 129131",
      "registerart": "HRB",
      "company_name": "Steigenberger Hotels GmbH",
      "company_seat": "Frankfurt am Main",
      "details": "28.11.2025 (Bekanntmachungsdatum)\n\nHessen Amtsgericht Frankfurt am Main HRB 129131\nRegisterbekanntmachung nach dem Umwandlungsgesetz 28.11.2025 (Eintragungsdatum)\n\nSteigenberger Hotels GmbH\nGesellschaft mit beschränkter Haftung\nFrankfurt am Main\n\nDen Gläubigern der an der Verschmelzung beteiligten Rechtsträger ist, wenn sie binnen sechs Monaten nach dem Tag, an dem die Eintragung der Verschmelzung in das Register des Sitzes desjenigen Rechtsträgers, dessen Gläubiger sie sind, nach § 19 Absatz 3 UmwG bekannt gemacht worden ist, ihren Anspruch nach Grund und Höhe schriftlich anmelden, Sicherheit zu leisten, soweit sie nicht Befriedigung verlangen können. Dieses Recht steht den Gläubigern jedoch nur zu, wenn sie glaubhaft machen, dass durch die Verschmelzung die Erfüllung ihrer Forderung gefährdet wird."
    },
    {
      "date": "2025-11-28",
      "id": "138637",
      "original_text": "Registerbekanntmachung nach dem Umwandlungsgesetz\nHessen Amtsgericht Frankfurt am Main HRB 129131\nSteigenberger Hotels GmbH – Frankfurt am Main",
      "type": "Registerbekanntmachung nach dem Umwandlungsgesetz",
      "state": "Hessen",
      "amtsgericht": "Amtsgericht Frankfurt am Main",
      "registernummer": "HRB 129131",
      "registerart": "HRB",
      "company_name": "Steigenberger Hotels GmbH",
      "company_seat": "Frankfurt am Main",
      "details": "28.11.2025 (Bekanntmachungsdatum)\n\nHessen Amtsgericht Frankfurt am Main HRB 129131\nRegisterbekanntmachung nach dem Umwandlungsgesetz 28.11.2025 (Eintragungsdatum)\n\nSteigenberger Hotels GmbH\nGesellschaft mit beschränkter Haftung\nFrankfurt am Main\n\nDen Gläubigern der an der Verschmelzung beteiligten Rechtsträger ist, wenn sie binnen sechs Monaten nach dem Tag, an dem die Eintragung der Verschmelzung in das Register des Sitzes desjenigen Rechtsträgers, dessen Gläubiger sie sind, nach § 19 Absatz 3 UmwG bekannt gemacht worden ist, ihren Anspruch nach Grund und Höhe schriftlich anmelden, Sicherheit zu leisten, soweit sie nicht Befriedigung verlangen können. Dieses Recht steht den Gläubigern jedoch nur zu, wenn sie glaubhaft machen, dass durch die Verschmelzung die Erfüllung ihrer Forderung gefährdet wird."
    },
    {
      "date": "2025-11-28",
      "id": "138638",
      "original_text": "Löschungsankündigung\nHessen Amtsgericht Frankfurt am Main HRB 108789\nAR Germany Consulting Services UG (haftungsbeschränkt) – Eschborn",
      "type": "Löschungsankündigung",
      "state": "Hessen",
      "amtsgericht": "Amtsgericht Frankfurt am Main",
      "registernummer": "HRB 108789",
      "registerart": "HRB",
      "company_name": "AR Germany Consulting Services UG (haftungsbeschränkt)",
      "company_seat": "Eschborn",
      "details": "28.11.2025 (Bekanntmachungsdatum)\n\nHessen Amtsgericht Frankfurt am Main HRB 108789\nLöschungsankündigung\n\nAR Germany Consulting Services UG (haftungsbeschränkt)\nGesellschaft mit beschränkter Haftung\nEschborn\n\nEs ist beabsichtigt, die Gesellschaft wegen Vermögenslosigkeit gemäß § 394 FamFG von Amts wegen im Handelsregister zu löschen. Hiergegen kann innerhalb von 3 Monaten nach dieser Veröffentlichung Widerspruch bei dem Amtsgericht Frankfurt am Main eingelegt werden."
    },
    {
      "date": "2025-11-28",
      "id": "138639",
      "original_text": "Löschungsankündigung\nHessen Amtsgericht Frankfurt am Main HRB 127124\nAXM TRADE GmbH – Frankfurt am Main",
      "type": "Löschungsankündigung",
      "state": "Hessen",
      "amtsgericht": "Amtsgericht Frankfurt am Main",
      "registernummer": "HRB 127124",
      "registerart": "HRB",
      "company_name": "AXM TRADE GmbH",
      "company_seat": "Frankfurt am Main",
      "details": "28.11.2025 (Bekanntmachungsdatum)\n\nHessen Amtsgericht Frankfurt am Main HRB 127124\nLöschungsankündigung\n\nAXM TRADE GmbH\nGesellschaft mit beschränkter Haftung\nFrankfurt am Main\n\nDas Registergericht beabsichtigt die im Handelsregister eingetragene Gesellschaft von Amts wegen nach § 394 FamFG zu löschen. Die Frist zur Erhebung eines Widerspruchs gegen die beabsichtigte Löschung wird auf 1 Monat festgesetzt."
    }
  ]
}