{
  "date": "2025-11-22",
  "date_of_scrape": "2025-11-23T04:14:59.070Z",
  "tool_version": "0.2.0",
  "number_of_announcements": 12,
  "announcements": [
    {
      "date": "2025-11-22",
      "id": "138064",
      "original_text": "Einreichung neuer Dokumente\nBayern Amtsgericht München HRB 202575\n4industries AG – München",
      "type": "Einreichung neuer Dokumente",
      "state": "Bayern",
      "amtsgericht": "Amtsgericht München",
      "registernummer": "HRB 202575",
      "registerart": "HRB",
      "company_name": "4industries AG",
      "company_seat": "München",
      "details": "22.11.2025 (Bekanntmachungsdatum)\n\nBayern Amtsgericht München HRB 202575\nEinreichung neuer Dokumente\n\n4industries AG\nAktiengesellschaft\nMünchen\n\nDem Amtsgericht München -Registergericht- ist eine Liste der Mitglieder des Aufsichtsrats eingereicht worden, § 106 AktG."
    },
    {
      "date": "2025-11-22",
      "id": "138065",
      "original_text": "Registerbekanntmachung nach dem Umwandlungsgesetz\nBayern Amtsgericht München HRA 115116\n83 Family Office GmbH & Co. KG – München",
      "type": "Registerbekanntmachung nach dem Umwandlungsgesetz",
      "state": "Bayern",
      "amtsgericht": "Amtsgericht München",
      "registernummer": "HRA 115116",
      "registerart": "HRA",
      "company_name": "83 Family Office GmbH & Co. KG",
      "company_seat": "München",
      "details": "22.11.2025 (Bekanntmachungsdatum)\n\nBayern Amtsgericht München HRA 115116\nRegisterbekanntmachung nach dem Umwandlungsgesetz 21.11.2025 (Eintragungsdatum)\n\n83 Family Office GmbH & Co. KG\nKommanditgesellschaft\nMünchen\n\nDen Gläubigern des formwechselnden Rechtsträgers ist, wenn sie binnen sechs Monaten nach dem Tag, an dem die Eintragung des Formwechsels nach § 201 UmwG als bekannt gemacht gilt, ihren Anspruch nach Grund und Höhe in Textform anmelden, Sicherheit zu leisten, soweit sie nicht Befriedigung verlangen können. Dieses Recht steht den Gläubigern jedoch nur zu, wenn sie glaubhaft machen, dass durch den Formwechsel die Erfüllung ihrer Forderung gefährdet wird."
    },
    {
      "date": "2025-11-22",
      "id": "138066",
      "original_text": "Löschungsankündigung\nBayern Amtsgericht München HRA 109119\nWasserkraftanlage Obermühle Görlitz GmbH & Co. KG – München",
      "type": "Löschungsankündigung",
      "state": "Bayern",
      "amtsgericht": "Amtsgericht München",
      "registernummer": "HRA 109119",
      "registerart": "HRA",
      "company_name": "Wasserkraftanlage Obermühle Görlitz GmbH & Co. KG",
      "company_seat": "München",
      "details": "22.11.2025 (Bekanntmachungsdatum)\n\nBayern Amtsgericht München HRA 109119\nLöschungsankündigung 21.11.2025 (Eintragungsdatum)\n\nWasserkraftanlage Obermühle Görlitz GmbH & Co. KG\nKommanditgesellschaft\nMünchen\n\nDas Registergericht beabsichtigt, die im Handelsregister eingetragene Firma von Amts wegen nach § 31 Abs. 2 HGB zu löschen. Die Frist zur Erhebung eines Widerspruchs ist auf drei Monate festgesetzt."
    },
    {
      "date": "2025-11-22",
      "id": "138067",
      "original_text": "Löschungsankündigung\nBayern Amtsgericht Nürnberg HRB 33054\nLayth Trans GmbH – Nürnberg",
      "type": "Löschungsankündigung",
      "state": "Bayern",
      "amtsgericht": "Amtsgericht Nürnberg",
      "registernummer": "HRB 33054",
      "registerart": "HRB",
      "company_name": "Layth Trans GmbH",
      "company_seat": "Nürnberg",
      "details": "22.11.2025 (Bekanntmachungsdatum)\n\nBayern Amtsgericht Nürnberg HRB 33054\nLöschungsankündigung\n\nLayth Trans GmbH\nGesellschaft mit beschränkter Haftung\nNürnberg\n\nDas Registergericht beabsichtigt, die im Handelsregister eingetragene Gesellschaft wegen Vermögenslosigkeit von Amts wegen nach § 394 FamFG zu löschen. Die Frist zur Erhebung eines Widerspruchs ist auf einen Monat festgesetzt."
    },
    {
      "date": "2025-11-22",
      "id": "138068",
      "original_text": "Registerbekanntmachung nach dem Umwandlungsgesetz\nBayern Amtsgericht Memmingen HRB 21816\nOff-Highway Germany GmbH – Neu-Ulm",
      "type": "Registerbekanntmachung nach dem Umwandlungsgesetz",
      "state": "Bayern",
      "amtsgericht": "Amtsgericht Memmingen",
      "registernummer": "HRB 21816",
      "registerart": "HRB",
      "company_name": "Off-Highway Germany GmbH",
      "company_seat": "Neu-Ulm",
      "details": "22.11.2025 (Bekanntmachungsdatum)\n\nBayern Amtsgericht Memmingen HRB 21816\nRegisterbekanntmachung nach dem Umwandlungsgesetz 21.11.2025 (Eintragungsdatum)\n\nOff-Highway Germany GmbH\nGesellschaft mit beschränkter Haftung\nNeu-Ulm\n\nDen Gläubigern der an der Spaltung beteiligten Rechtsträger ist, wenn sie binnen sechs Monaten nach dem Tag, an dem die Eintragung der Spaltung in das Register des Sitzes desjenigen Rechtsträgers, dessen Gläubiger sie sind, nach §§ 125, 19 Abs. 3 UmwG als bekannt gemacht gilt, ihren Anspruch nach Grund und Höhe in Textform anmelden, Sicherheit zu leisten, soweit sie nicht Befriedigung verlangen können. Dieses Recht steht den Gläubigern jedoch nur zu, wenn sie glaubhaft machen, dass durch die Spaltung die Erfüllung ihrer Forderung gefährdet wird."
    },
    {
      "date": "2025-11-22",
      "id": "138069",
      "original_text": "Einreichung neuer Dokumente\nBayern Amtsgericht München HRB 264176\nSUSMATA Holding AG – München",
      "type": "Einreichung neuer Dokumente",
      "state": "Bayern",
      "amtsgericht": "Amtsgericht München",
      "registernummer": "HRB 264176",
      "registerart": "HRB",
      "company_name": "SUSMATA Holding AG",
      "company_seat": "München",
      "details": "22.11.2025 (Bekanntmachungsdatum)\n\nBayern Amtsgericht München HRB 264176\nEinreichung neuer Dokumente\n\nSUSMATA Holding AG\nAktiengesellschaft\nMünchen\n\nDem Amtsgericht München -Registergericht- ist eine Liste der Mitglieder des Aufsichtsrats eingereicht worden, § 106 AktG."
    },
    {
      "date": "2025-11-22",
      "id": "138070",
      "original_text": "Einreichung neuer Dokumente\nBayern Amtsgericht Regensburg HRB 11113\nCompexx Finanz AG – Regensburg",
      "type": "Einreichung neuer Dokumente",
      "state": "Bayern",
      "amtsgericht": "Amtsgericht Regensburg",
      "registernummer": "HRB 11113",
      "registerart": "HRB",
      "company_name": "Compexx Finanz AG",
      "company_seat": "Regensburg",
      "details": "22.11.2025 (Bekanntmachungsdatum)\n\nBayern Amtsgericht Regensburg HRB 11113\nEinreichung neuer Dokumente\n\nCompexx Finanz AG\nAktiengesellschaft\nRegensburg\n\nDem Amtsgericht Regensburg -Registergericht- ist eine Liste der Mitglieder des Aufsichtsrats eingereicht worden, § 106 AktG."
    },
    {
      "date": "2025-11-22",
      "id": "138071",
      "original_text": "Einreichung neuer Dokumente\nBayern Amtsgericht München HRB 228316\nACINO AG – München",
      "type": "Einreichung neuer Dokumente",
      "state": "Bayern",
      "amtsgericht": "Amtsgericht München",
      "registernummer": "HRB 228316",
      "registerart": "HRB",
      "company_name": "ACINO AG",
      "company_seat": "München",
      "details": "22.11.2025 (Bekanntmachungsdatum)\n\nBayern Amtsgericht München HRB 228316\nEinreichung neuer Dokumente\n\nACINO AG\nAktiengesellschaft\nMünchen\n\nDem Amtsgericht München -Registergericht- ist eine Liste der Mitglieder des Aufsichtsrats eingereicht worden, § 106 AktG."
    },
    {
      "date": "2025-11-22",
      "id": "138072",
      "original_text": "Einreichung neuer Dokumente\nBayern Amtsgericht München HRB 135779\nPARTNERS VermögensManagement AG – München",
      "type": "Einreichung neuer Dokumente",
      "state": "Bayern",
      "amtsgericht": "Amtsgericht München",
      "registernummer": "HRB 135779",
      "registerart": "HRB",
      "company_name": "PARTNERS VermögensManagement AG",
      "company_seat": "München",
      "details": "22.11.2025 (Bekanntmachungsdatum)\n\nBayern Amtsgericht München HRB 135779\nEinreichung neuer Dokumente\n\nPARTNERS VermögensManagement AG\nAktiengesellschaft\nMünchen\n\nDem Amtsgericht München -Registergericht- ist eine Liste der Mitglieder des Aufsichtsrats eingereicht worden, § 106 AktG."
    },
    {
      "date": "2025-11-22",
      "id": "138073",
      "original_text": "Löschungsankündigung\nBayern Amtsgericht Bayreuth VR 1175\nTanzsportgemeinschaft Bavaria, Fantaisie, Bayreuth e. V. – Bayreuth",
      "type": "Löschungsankündigung",
      "state": "Bayern",
      "amtsgericht": "Amtsgericht Bayreuth",
      "registernummer": "VR 1175",
      "registerart": "VR",
      "company_name": "Tanzsportgemeinschaft Bavaria, Fantaisie, Bayreuth e. V.",
      "company_seat": "Bayreuth",
      "details": "22.11.2025 (Bekanntmachungsdatum)\n\nBayern Amtsgericht Bayreuth VR 1175\nLöschungsankündigung\n\nTanzsportgemeinschaft Bavaria, Fantaisie, Bayreuth e. V.\neingetragener Verein\nBayreuth\n\nDas Registergericht beabsichtigt, den im Vereinsregister eingetragenen Verein von Amts wegen nach § 395 FamFG wegen Wegfalls aller Mitglieder zu löschen. Die Frist zur Erhebung eines Widerspruchs ist auf einen Monat festgesetzt."
    },
    {
      "date": "2025-11-22",
      "id": "138074",
      "original_text": "Registerbekanntmachung nach dem Umwandlungsgesetz\nBayern Amtsgericht München HRA 120917\nESTATEANFRAGE Fabian Kroner e.K. – München",
      "type": "Registerbekanntmachung nach dem Umwandlungsgesetz",
      "state": "Bayern",
      "amtsgericht": "Amtsgericht München",
      "registernummer": "HRA 120917",
      "registerart": "HRA",
      "company_name": "ESTATEANFRAGE Fabian Kroner e.K.",
      "company_seat": "München",
      "details": "22.11.2025 (Bekanntmachungsdatum)\n\nBayern Amtsgericht München HRA 120917\nRegisterbekanntmachung nach dem Umwandlungsgesetz 27.10.2025 (Eintragungsdatum)\n\nESTATEANFRAGE Fabian Kroner e.K.\nEinzelkaufmann / Einzelkauffrau\nMünchen\n\nZur Ausgliederung der ESTATEANFRAGE Fabian Kroner e.K. mit Sitz in München (Amtsgericht München, HRA 120917) auf die ESTATEANFRAGE GmbH mit Sitz in München (Amtsgericht München, HRB 304870):\nDen Gläubigern der an der Ausgliederung beteiligten Rechtsträger ist, wenn sie binnen sechs Monaten nach dem Tag, an dem die Eintragung der Ausgliederung in das Register des Sitzes desjenigen Rechtsträgers, dessen Gläubiger sie sind, nach §§ 125, 19 Abs. 3 UmwG als bekannt gemacht gilt, ihren Anspruch nach Grund und Höhe in Textform anmelden, Sicherheit zu leisten, soweit sie nicht Befriedigung verlangen können. Dieses Recht steht den Gläubigern jedoch nur zu, wenn sie glaubhaft machen, dass durch die Ausgliederung die Erfüllung ihrer Forderung gefährdet wird."
    },
    {
      "date": "2025-11-22",
      "id": "138075",
      "original_text": "Registerbekanntmachung nach dem Umwandlungsgesetz\nBayern Amtsgericht München HRA 121781\nATB Transaktionsberatung B.V. & Co. KG – München",
      "type": "Registerbekanntmachung nach dem Umwandlungsgesetz",
      "state": "Bayern",
      "amtsgericht": "Amtsgericht München",
      "registernummer": "HRA 121781",
      "registerart": "HRA",
      "company_name": "ATB Transaktionsberatung B.V. & Co. KG",
      "company_seat": "München",
      "details": "22.11.2025 (Bekanntmachungsdatum)\n\nBayern Amtsgericht München HRA 121781\nRegisterbekanntmachung nach dem Umwandlungsgesetz 22.10.2025 (Eintragungsdatum)\n\nATB Transaktionsberatung B.V. & Co. KG\nKommanditgesellschaft\nMünchen\n\nZur formwechselnden Umwandlung der AURELIUS Transaktionsberatungs AG mit Sitz in München (Amtsgericht München, HRB 180782) in die ATB Transaktionsberatung B.V. & Co. KG mit Sitz in München (Amtsgericht München HRA 121781):\nDen Gläubigern des formwechselnden Rechtsträgers ist, wenn sie binnen sechs Monaten nach dem Tag, an dem die Eintragung des Formwechsels nach § 201 UmwG als bekannt gemacht gilt, ihren Anspruch nach Grund und Höhe in Textform anmelden, Sicherheit zu leisten, soweit sie nicht Befriedigung verlangen können. Dieses Recht steht den Gläubigern jedoch nur zu, wenn sie glaubhaft machen, dass durch den Formwechsel die Erfüllung ihrer Forderung gefährdet wird."
    }
  ]
}