{
  "date": "2025-11-12",
  "date_of_scrape": "2025-11-13T04:14:14.097Z",
  "tool_version": "0.2.0",
  "number_of_announcements": 146,
  "announcements": [
    {
      "date": "2025-11-12",
      "id": "137013",
      "original_text": "Löschungsankündigung\nBayern Amtsgericht Landshut HRB 13755\nH & S Fliesen GmbH – Triftern",
      "type": "Löschungsankündigung",
      "state": "Bayern",
      "amtsgericht": "Amtsgericht Landshut",
      "registernummer": "HRB 13755",
      "registerart": "HRB",
      "company_name": "H & S Fliesen GmbH",
      "company_seat": "Triftern",
      "details": "12.11.2025 (Bekanntmachungsdatum)\n\nBayern Amtsgericht Landshut HRB 13755\nLöschungsankündigung\n\nH & S Fliesen GmbH\nGesellschaft mit beschränkter Haftung\nTriftern\n\nDas Registergericht beabsichtigt, die im Handelsregister eingetragene Gesellschaft wegen Vermögenslosigkeit von Amts wegen nach § 394 FamFG zu löschen. Die Frist zur Erhebung eines Widerspruchs ist auf einen Monat festgesetzt."
    },
    {
      "date": "2025-11-12",
      "id": "137014",
      "original_text": "Registerbekanntmachung nach dem Umwandlungsgesetz\nBayern Amtsgericht Nürnberg HRA 20262\nFrank Jäckel e.K. – Roth",
      "type": "Registerbekanntmachung nach dem Umwandlungsgesetz",
      "state": "Bayern",
      "amtsgericht": "Amtsgericht Nürnberg",
      "registernummer": "HRA 20262",
      "registerart": "HRA",
      "company_name": "Frank Jäckel e.K.",
      "company_seat": "Roth",
      "details": "12.11.2025 (Bekanntmachungsdatum)\n\nBayern Amtsgericht Nürnberg HRA 20262\nRegisterbekanntmachung nach dem Umwandlungsgesetz 11.11.2025 (Eintragungsdatum)\n\nFrank Jäckel e.K.\nEinzelkaufmann / Einzelkauffrau\nRoth\n\nDen Gläubigern der an der Ausgliederung beteiligten Rechtsträger ist, wenn sie binnen sechs Monaten nach dem Tag, an dem die Eintragung der Ausgliederung in das Register des Sitzes desjenigen Rechtsträgers, dessen Gläubiger sie sind, nach §§ 125, 19 Abs. 3 UmwG als bekannt gemacht gilt, ihren Anspruch nach Grund und Höhe in Textform anmelden, Sicherheit zu leisten, soweit sie nicht Befriedigung verlangen können. Dieses Recht steht den Gläubigern jedoch nur zu, wenn sie glaubhaft machen, dass durch die Ausgliederung die Erfüllung ihrer Forderung gefährdet wird."
    },
    {
      "date": "2025-11-12",
      "id": "137015",
      "original_text": "Löschungsankündigung\nBayern Amtsgericht Coburg HRB 4528\nIntercube GmbH – Altenkunstadt",
      "type": "Löschungsankündigung",
      "state": "Bayern",
      "amtsgericht": "Amtsgericht Coburg",
      "registernummer": "HRB 4528",
      "registerart": "HRB",
      "company_name": "Intercube GmbH",
      "company_seat": "Altenkunstadt",
      "details": "12.11.2025 (Bekanntmachungsdatum)\n\nBayern Amtsgericht Coburg HRB 4528\nLöschungsankündigung 11.11.2025 (Eintragungsdatum)\n\nIntercube GmbH\nGesellschaft mit beschränkter Haftung\nAltenkunstadt\n\nDas Registergericht beabsichtigt, die im Handelsregister eingetragene Gesellschaft wegen Vermögenslosigkeit von Amts wegen nach § 394 FamFG zu löschen. Die Frist zur Erhebung eines Widerspruchs ist auf sechs Wochen festgesetzt."
    },
    {
      "date": "2025-11-12",
      "id": "137016",
      "original_text": "Registerbekanntmachung nach dem Umwandlungsgesetz\nBayern Amtsgericht Nürnberg HRB 45204\nBF Wasch- und Spültechnik GmbH – Nürnberg",
      "type": "Registerbekanntmachung nach dem Umwandlungsgesetz",
      "state": "Bayern",
      "amtsgericht": "Amtsgericht Nürnberg",
      "registernummer": "HRB 45204",
      "registerart": "HRB",
      "company_name": "BF Wasch- und Spültechnik GmbH",
      "company_seat": "Nürnberg",
      "details": "12.11.2025 (Bekanntmachungsdatum)\n\nBayern Amtsgericht Nürnberg HRB 45204\nRegisterbekanntmachung nach dem Umwandlungsgesetz 11.11.2025 (Eintragungsdatum)\n\nBF Wasch- und Spültechnik GmbH\nGesellschaft mit beschränkter Haftung\nNürnberg\n\nDen Gläubigern der an der Ausgliederung beteiligten Rechtsträger ist, wenn sie binnen sechs Monaten nach dem Tag, an dem die Eintragung der Ausgliederung in das Register des Sitzes desjenigen Rechtsträgers, dessen Gläubiger sie sind, nach §§ 125, 19 Abs. 3 UmwG als bekannt gemacht gilt, ihren Anspruch nach Grund und Höhe in Textform anmelden, Sicherheit zu leisten, soweit sie nicht Befriedigung verlangen können. Dieses Recht steht den Gläubigern jedoch nur zu, wenn sie glaubhaft machen, dass durch die Ausgliederung die Erfüllung ihrer Forderung gefährdet wird."
    },
    {
      "date": "2025-11-12",
      "id": "137017",
      "original_text": "Registerbekanntmachung nach dem Umwandlungsgesetz\nBayern Amtsgericht Nürnberg HRA 12605\nBF Wasch- und Spültechnik Inhaber Radoslav Zovko e.Kfm. – Nürnberg",
      "type": "Registerbekanntmachung nach dem Umwandlungsgesetz",
      "state": "Bayern",
      "amtsgericht": "Amtsgericht Nürnberg",
      "registernummer": "HRA 12605",
      "registerart": "HRA",
      "company_name": "BF Wasch- und Spültechnik Inhaber Radoslav Zovko e.Kfm.",
      "company_seat": "Nürnberg",
      "details": "12.11.2025 (Bekanntmachungsdatum)\n\nBayern Amtsgericht Nürnberg HRA 12605\nRegisterbekanntmachung nach dem Umwandlungsgesetz 11.11.2025 (Eintragungsdatum)\n\nBF Wasch- und Spültechnik Inhaber Radoslav Zovko e.Kfm.\nEinzelkaufmann / Einzelkauffrau\nNürnberg\n\nDen Gläubigern der an der Ausgliederung beteiligten Rechtsträger ist, wenn sie binnen sechs Monaten nach dem Tag, an dem die Eintragung der Ausgliederung in das Register des Sitzes desjenigen Rechtsträgers, dessen Gläubiger sie sind, nach §§ 125, 19 Abs. 3 UmwG als bekannt gemacht gilt, ihren Anspruch nach Grund und Höhe in Textform anmelden, Sicherheit zu leisten, soweit sie nicht Befriedigung verlangen können. Dieses Recht steht den Gläubigern jedoch nur zu, wenn sie glaubhaft machen, dass durch die Ausgliederung die Erfüllung ihrer Forderung gefährdet wird."
    },
    {
      "date": "2025-11-12",
      "id": "137018",
      "original_text": "Löschungsankündigung\nBayern Amtsgericht Traunstein HRB 31108\nEnrico Caruso Piano UG (haftungsbeschränkt) – Amerang",
      "type": "Löschungsankündigung",
      "state": "Bayern",
      "amtsgericht": "Amtsgericht Traunstein",
      "registernummer": "HRB 31108",
      "registerart": "HRB",
      "company_name": "Enrico Caruso Piano UG (haftungsbeschränkt)",
      "company_seat": "Amerang",
      "details": "12.11.2025 (Bekanntmachungsdatum)\n\nBayern Amtsgericht Traunstein HRB 31108\nLöschungsankündigung\n\nEnrico Caruso Piano UG (haftungsbeschränkt)\nGesellschaft mit beschränkter Haftung\nAmerang\n\nDas Registergericht beabsichtigt, die im Handelsregister eingetragene Gesellschaft wegen Vermögenslosigkeit von Amts wegen nach § 394 FamFG zu löschen. Die Frist zur Erhebung eines Widerspruchs ist auf einen Monat festgesetzt."
    },
    {
      "date": "2025-11-12",
      "id": "137019",
      "original_text": "Registerbekanntmachung nach dem Umwandlungsgesetz\nBayern Amtsgericht München HRB 239235\nHashiCorp Germany GmbH – München",
      "type": "Registerbekanntmachung nach dem Umwandlungsgesetz",
      "state": "Bayern",
      "amtsgericht": "Amtsgericht München",
      "registernummer": "HRB 239235",
      "registerart": "HRB",
      "company_name": "HashiCorp Germany GmbH",
      "company_seat": "München",
      "details": "12.11.2025 (Bekanntmachungsdatum)\n\nBayern Amtsgericht München HRB 239235\nRegisterbekanntmachung nach dem Umwandlungsgesetz 11.11.2025 (Eintragungsdatum)\n\nHashiCorp Germany GmbH\nGesellschaft mit beschränkter Haftung\nMünchen\n\nDen Gläubigern der an der Verschmelzung beteiligten Rechtsträger ist, wenn sie binnen sechs Monaten nach dem Tag, an dem die Eintragung der Verschmelzung in das Register des Sitzes desjenigen Rechtsträgers, dessen Gläubiger sie sind, nach § 19 Abs. 3 UmwG als bekannt gemacht gilt, ihren Anspruch nach Grund und Höhe in Textform anmelden, Sicherheit zu leisten, soweit sie nicht Befriedigung verlangen können. Dieses Recht steht den Gläubigern jedoch nur zu, wenn sie glaubhaft machen, dass durch die Verschmelzung die Erfüllung ihrer Forderung gefährdet wird."
    },
    {
      "date": "2025-11-12",
      "id": "137020",
      "original_text": "Registerbekanntmachung nach dem Umwandlungsgesetz\nBayern Amtsgericht München HRB 181776\nKontorhaus Arnulfpark Verwaltungs GmbH – Grünwald",
      "type": "Registerbekanntmachung nach dem Umwandlungsgesetz",
      "state": "Bayern",
      "amtsgericht": "Amtsgericht München",
      "registernummer": "HRB 181776",
      "registerart": "HRB",
      "company_name": "Kontorhaus Arnulfpark Verwaltungs GmbH",
      "company_seat": "Grünwald",
      "details": "12.11.2025 (Bekanntmachungsdatum)\n\nBayern Amtsgericht München HRB 181776\nRegisterbekanntmachung nach dem Umwandlungsgesetz 11.11.2025 (Eintragungsdatum)\n\nKontorhaus Arnulfpark Verwaltungs GmbH\nGesellschaft mit beschränkter Haftung\nGrünwald\n\nDen Gläubigern der an der Verschmelzung beteiligten Rechtsträger ist, wenn sie binnen sechs Monaten nach dem Tag, an dem die Eintragung der Verschmelzung in das Register des Sitzes desjenigen Rechtsträgers, dessen Gläubiger sie sind, nach § 19 Abs. 3 UmwG als bekannt gemacht gilt, ihren Anspruch nach Grund und Höhe in Textform anmelden, Sicherheit zu leisten, soweit sie nicht Befriedigung verlangen können. Dieses Recht steht den Gläubigern jedoch nur zu, wenn sie glaubhaft machen, dass durch die Verschmelzung die Erfüllung ihrer Forderung gefährdet wird."
    },
    {
      "date": "2025-11-12",
      "id": "137021",
      "original_text": "Registerbekanntmachung nach dem Umwandlungsgesetz\nBayern Amtsgericht München HRB 307038\nKonga GmbH – München",
      "type": "Registerbekanntmachung nach dem Umwandlungsgesetz",
      "state": "Bayern",
      "amtsgericht": "Amtsgericht München",
      "registernummer": "HRB 307038",
      "registerart": "HRB",
      "company_name": "Konga GmbH",
      "company_seat": "München",
      "details": "12.11.2025 (Bekanntmachungsdatum)\n\nBayern Amtsgericht München HRB 307038\nRegisterbekanntmachung nach dem Umwandlungsgesetz 11.11.2025 (Eintragungsdatum)\n\nKonga GmbH\nGesellschaft mit beschränkter Haftung\nMünchen\n\nDen Gläubigern der an der Ausgliederung beteiligten Rechtsträger ist, wenn sie binnen sechs Monaten nach dem Tag, an dem die Eintragung der Ausgliederung in das Register des Sitzes desjenigen Rechtsträgers, dessen Gläubiger sie sind, nach §§ 125, 19 Abs. 3 UmwG als bekannt gemacht gilt, ihren Anspruch nach Grund und Höhe in Textform anmelden, Sicherheit zu leisten, soweit sie nicht Befriedigung verlangen können. Dieses Recht steht den Gläubigern jedoch nur zu, wenn sie glaubhaft machen, dass durch die Ausgliederung die Erfüllung ihrer Forderung gefährdet wird."
    },
    {
      "date": "2025-11-12",
      "id": "137022",
      "original_text": "Sonstige Registerbekanntmachung\nBayern Amtsgericht Fürth HRB 10010\nProtection Guard GmbH – Fürth",
      "type": "Sonstige Registerbekanntmachung",
      "state": "Bayern",
      "amtsgericht": "Amtsgericht Fürth",
      "registernummer": "HRB 10010",
      "registerart": "HRB",
      "company_name": "Protection Guard GmbH",
      "company_seat": "Fürth",
      "details": "12.11.2025 (Bekanntmachungsdatum)\n\nBayern Amtsgericht Fürth HRB 10010\nSonstige Registerbekanntmachung 10.11.2025 (Eintragungsdatum)\n\nProtection Guard GmbH\nGesellschaft mit beschränkter Haftung\nFürth\n\nDie Gesellschaft ist wegen Vermögenslosigkeit gemäß § 394 FamFG gelöscht. Von Amts wegen eingetragen."
    },
    {
      "date": "2025-11-12",
      "id": "137023",
      "original_text": "Registerbekanntmachung nach dem Umwandlungsgesetz\nBayern Amtsgericht München HRB 216353\nOnex Wizard MEP GP GmbH – München",
      "type": "Registerbekanntmachung nach dem Umwandlungsgesetz",
      "state": "Bayern",
      "amtsgericht": "Amtsgericht München",
      "registernummer": "HRB 216353",
      "registerart": "HRB",
      "company_name": "Onex Wizard MEP GP GmbH",
      "company_seat": "München",
      "details": "12.11.2025 (Bekanntmachungsdatum)\n\nBayern Amtsgericht München HRB 216353\nRegisterbekanntmachung nach dem Umwandlungsgesetz 11.11.2025 (Eintragungsdatum)\n\nOnex Wizard MEP GP GmbH\nGesellschaft mit beschränkter Haftung\nMünchen\n\nDen Gläubigern der an der Verschmelzung beteiligten Rechtsträger ist, wenn sie binnen sechs Monaten nach dem Tag, an dem die Eintragung der Verschmelzung in das Register des Sitzes desjenigen Rechtsträgers, dessen Gläubiger sie sind, nach § 19 Abs. 3 UmwG als bekannt gemacht gilt, ihren Anspruch nach Grund und Höhe in Textform anmelden, Sicherheit zu leisten, soweit sie nicht Befriedigung verlangen können. Dieses Recht steht den Gläubigern jedoch nur zu, wenn sie glaubhaft machen, dass durch die Verschmelzung die Erfüllung ihrer Forderung gefährdet wird."
    },
    {
      "date": "2025-11-12",
      "id": "137024",
      "original_text": "Registerbekanntmachung nach dem Umwandlungsgesetz\nBayern Amtsgericht Nürnberg HRB 44103\nJAECKEL.IT GmbH – Roth",
      "type": "Registerbekanntmachung nach dem Umwandlungsgesetz",
      "state": "Bayern",
      "amtsgericht": "Amtsgericht Nürnberg",
      "registernummer": "HRB 44103",
      "registerart": "HRB",
      "company_name": "JAECKEL.IT GmbH",
      "company_seat": "Roth",
      "details": "12.11.2025 (Bekanntmachungsdatum)\n\nBayern Amtsgericht Nürnberg HRB 44103\nRegisterbekanntmachung nach dem Umwandlungsgesetz 11.11.2025 (Eintragungsdatum)\n\nJAECKEL.IT GmbH\nGesellschaft mit beschränkter Haftung\nRoth\n\nDen Gläubigern der an der Ausgliederung beteiligten Rechtsträger ist, wenn sie binnen sechs Monaten nach dem Tag, an dem die Eintragung der Ausgliederung in das Register des Sitzes desjenigen Rechtsträgers, dessen Gläubiger sie sind, nach §§ 125, 19 Abs. 3 UmwG als bekannt gemacht gilt, ihren Anspruch nach Grund und Höhe in Textform anmelden, Sicherheit zu leisten, soweit sie nicht Befriedigung verlangen können. Dieses Recht steht den Gläubigern jedoch nur zu, wenn sie glaubhaft machen, dass durch die Ausgliederung die Erfüllung ihrer Forderung gefährdet wird."
    },
    {
      "date": "2025-11-12",
      "id": "137025",
      "original_text": "Löschungsankündigung\nBayern Amtsgericht Nürnberg HRB 5401\nAlutechnik Velden Fenster- Türen - Fassaden - GmbH – Velden",
      "type": "Löschungsankündigung",
      "state": "Bayern",
      "amtsgericht": "Amtsgericht Nürnberg",
      "registernummer": "HRB 5401",
      "registerart": "HRB",
      "company_name": "Alutechnik Velden Fenster- Türen - Fassaden - GmbH",
      "company_seat": "Velden",
      "details": "12.11.2025 (Bekanntmachungsdatum)\n\nBayern Amtsgericht Nürnberg HRB 5401\nLöschungsankündigung\n\nAlutechnik Velden Fenster- Türen - Fassaden - GmbH\nGesellschaft mit beschränkter Haftung\nVelden\n\nDas Registergericht beabsichtigt, die im Handelsregister eingetragene Gesellschaft wegen Vermögenslosigkeit von Amts wegen nach § 394 FamFG zu löschen. Die Frist zur Erhebung eines Widerspruchs ist auf einen Monat festgesetzt."
    },
    {
      "date": "2025-11-12",
      "id": "137026",
      "original_text": "Registerbekanntmachung nach dem Umwandlungsgesetz\nBayern Amtsgericht Ingolstadt HRB 12172\nHausmeisterservice R10 GmbH – Ernsgaden",
      "type": "Registerbekanntmachung nach dem Umwandlungsgesetz",
      "state": "Bayern",
      "amtsgericht": "Amtsgericht Ingolstadt",
      "registernummer": "HRB 12172",
      "registerart": "HRB",
      "company_name": "Hausmeisterservice R10 GmbH",
      "company_seat": "Ernsgaden",
      "details": "12.11.2025 (Bekanntmachungsdatum)\n\nBayern Amtsgericht Ingolstadt HRB 12172\nRegisterbekanntmachung nach dem Umwandlungsgesetz 11.11.2025 (Eintragungsdatum)\n\nHausmeisterservice R10 GmbH\nGesellschaft mit beschränkter Haftung\nErnsgaden\n\nDen Gläubigern der an der Verschmelzung beteiligten Rechtsträger ist, wenn sie binnen sechs Monaten nach dem Tag, an dem die Eintragung der Verschmelzung in das Register des Sitzes desjenigen Rechtsträgers, dessen Gläubiger sie sind, nach § 19 Abs. 3 UmwG als bekannt gemacht gilt, ihren Anspruch nach Grund und Höhe in Textform anmelden, Sicherheit zu leisten, soweit sie nicht Befriedigung verlangen können. Dieses Recht steht den Gläubigern jedoch nur zu, wenn sie glaubhaft machen, dass durch die Verschmelzung die Erfüllung ihrer Forderung gefährdet wird."
    },
    {
      "date": "2025-11-12",
      "id": "137027",
      "original_text": "Registerbekanntmachung nach dem Umwandlungsgesetz\nBayern Amtsgericht München HRB 253426\nAURELIUS H&FS Holding GmbH – Grünwald",
      "type": "Registerbekanntmachung nach dem Umwandlungsgesetz",
      "state": "Bayern",
      "amtsgericht": "Amtsgericht München",
      "registernummer": "HRB 253426",
      "registerart": "HRB",
      "company_name": "AURELIUS H&FS Holding GmbH",
      "company_seat": "Grünwald",
      "details": "12.11.2025 (Bekanntmachungsdatum)\n\nBayern Amtsgericht München HRB 253426\nRegisterbekanntmachung nach dem Umwandlungsgesetz 11.11.2025 (Eintragungsdatum)\n\nAURELIUS H&FS Holding GmbH\nGesellschaft mit beschränkter Haftung\nGrünwald\n\nDen Gläubigern der an der Verschmelzung beteiligten Rechtsträger ist, wenn sie binnen sechs Monaten nach dem Tag, an dem die Eintragung der Verschmelzung in das Register des Sitzes desjenigen Rechtsträgers, dessen Gläubiger sie sind, nach § 19 Abs. 3 UmwG als bekannt gemacht gilt, ihren Anspruch nach Grund und Höhe in Textform anmelden, Sicherheit zu leisten, soweit sie nicht Befriedigung verlangen können. Dieses Recht steht den Gläubigern jedoch nur zu, wenn sie glaubhaft machen, dass durch die Verschmelzung die Erfüllung ihrer Forderung gefährdet wird."
    },
    {
      "date": "2025-11-12",
      "id": "137028",
      "original_text": "Löschungsankündigung\nBayern Amtsgericht Fürth HRA 8332\nTaubmann Immobilien GmbH & Co. KG – Fürth",
      "type": "Löschungsankündigung",
      "state": "Bayern",
      "amtsgericht": "Amtsgericht Fürth",
      "registernummer": "HRA 8332",
      "registerart": "HRA",
      "company_name": "Taubmann Immobilien GmbH & Co. KG",
      "company_seat": "Fürth",
      "details": "12.11.2025 (Bekanntmachungsdatum)\n\nBayern Amtsgericht Fürth HRA 8332\nLöschungsankündigung\n\nTaubmann Immobilien GmbH & Co. KG\nKommanditgesellschaft\nFürth\n\nDas Registergericht beabsichtigt, die im Handelsregister eingetragene Firma wegen Vermögenslosigkeit von Amts wegen nach § 394 FamFG zu löschen. Die Frist zur Erhebung eines Widerspruchs ist auf einen Monat festgesetzt."
    },
    {
      "date": "2025-11-12",
      "id": "137029",
      "original_text": "Löschungsankündigung\nBayern Amtsgericht München HRA 109526\nGerrard-Gastronomiebetrieb GmbH & Co. KG – München",
      "type": "Löschungsankündigung",
      "state": "Bayern",
      "amtsgericht": "Amtsgericht München",
      "registernummer": "HRA 109526",
      "registerart": "HRA",
      "company_name": "Gerrard-Gastronomiebetrieb GmbH & Co. KG",
      "company_seat": "München",
      "details": "12.11.2025 (Bekanntmachungsdatum)\n\nBayern Amtsgericht München HRA 109526\nLöschungsankündigung 11.11.2025 (Eintragungsdatum)\n\nGerrard-Gastronomiebetrieb GmbH & Co. KG\nKommanditgesellschaft\nMünchen\n\nDas Registergericht beabsichtigt, die im Handelsregister eingetragene Firma wegen Vermögenslosigkeit von Amts wegen nach § 394 FamFG zu löschen. Die Frist zur Erhebung eines Widerspruchs ist auf drei Monate festgesetzt."
    },
    {
      "date": "2025-11-12",
      "id": "137030",
      "original_text": "Einreichung neuer Dokumente\nBayern Amtsgericht Traunstein HRB 19350\nPlattform Energie GmbH – Bad Aibling",
      "type": "Einreichung neuer Dokumente",
      "state": "Bayern",
      "amtsgericht": "Amtsgericht Traunstein",
      "registernummer": "HRB 19350",
      "registerart": "HRB",
      "company_name": "Plattform Energie GmbH",
      "company_seat": "Bad Aibling",
      "details": "12.11.2025 (Bekanntmachungsdatum)\n\nBayern Amtsgericht Traunstein HRB 19350\nEinreichung neuer Dokumente 11.11.2025 (Eintragungsdatum)\n\nPlattform Energie GmbH\nGesellschaft mit beschränkter Haftung\nBad Aibling\n\nDem Amtsgericht Traunstein -Registergericht- ist eine Liste der Mitglieder des Aufsichtsrats eingereicht worden, § 52 Abs. 3 S. 2 GmbHG."
    },
    {
      "date": "2025-11-12",
      "id": "137031",
      "original_text": "Registerbekanntmachung nach dem Umwandlungsgesetz\nBayern Amtsgericht München HRA 121533\nGarten- und Landschaftsbau Maximilian Littmann e.K. – Moosburg a.d.Isar",
      "type": "Registerbekanntmachung nach dem Umwandlungsgesetz",
      "state": "Bayern",
      "amtsgericht": "Amtsgericht München",
      "registernummer": "HRA 121533",
      "registerart": "HRA",
      "company_name": "Garten- und Landschaftsbau Maximilian Littmann e.K.",
      "company_seat": "Moosburg a.d.Isar",
      "details": "12.11.2025 (Bekanntmachungsdatum)\n\nBayern Amtsgericht München HRA 121533\nRegisterbekanntmachung nach dem Umwandlungsgesetz 11.11.2025 (Eintragungsdatum)\n\nGarten- und Landschaftsbau Maximilian Littmann e.K.\nEinzelkaufmann / Einzelkauffrau\nMoosburg a.d.Isar\n\nDen Gläubigern der an der Ausgliederung beteiligten Rechtsträger ist, wenn sie binnen sechs Monaten nach dem Tag, an dem die Eintragung der Ausgliederung in das Register des Sitzes desjenigen Rechtsträgers, dessen Gläubiger sie sind, nach §§ 125, 19 Abs. 3 UmwG als bekannt gemacht gilt, ihren Anspruch nach Grund und Höhe in Textform anmelden, Sicherheit zu leisten, soweit sie nicht Befriedigung verlangen können. Dieses Recht steht den Gläubigern jedoch nur zu, wenn sie glaubhaft machen, dass durch die Ausgliederung die Erfüllung ihrer Forderung gefährdet wird."
    },
    {
      "date": "2025-11-12",
      "id": "137032",
      "original_text": "Registerbekanntmachung nach dem Umwandlungsgesetz\nBayern Amtsgericht München HRB 264641\nPanaleo LP GmbH – München",
      "type": "Registerbekanntmachung nach dem Umwandlungsgesetz",
      "state": "Bayern",
      "amtsgericht": "Amtsgericht München",
      "registernummer": "HRB 264641",
      "registerart": "HRB",
      "company_name": "Panaleo LP GmbH",
      "company_seat": "München",
      "details": "12.11.2025 (Bekanntmachungsdatum)\n\nBayern Amtsgericht München HRB 264641\nRegisterbekanntmachung nach dem Umwandlungsgesetz 11.11.2025 (Eintragungsdatum)\n\nPanaleo LP GmbH\nGesellschaft mit beschränkter Haftung\nMünchen\n\nDen Gläubigern der an der Verschmelzung beteiligten Rechtsträger ist, wenn sie binnen sechs Monaten nach dem Tag, an dem die Eintragung der Verschmelzung in das Register des Sitzes desjenigen Rechtsträgers, dessen Gläubiger sie sind, nach § 19 Abs. 3 UmwG als bekannt gemacht gilt, ihren Anspruch nach Grund und Höhe in Textform anmelden, Sicherheit zu leisten, soweit sie nicht Befriedigung verlangen können. Dieses Recht steht den Gläubigern jedoch nur zu, wenn sie glaubhaft machen, dass durch die Verschmelzung die Erfüllung ihrer Forderung gefährdet wird."
    },
    {
      "date": "2025-11-12",
      "id": "137033",
      "original_text": "Registerbekanntmachung nach dem Umwandlungsgesetz\nBayern Amtsgericht München HRB 134681\nKunze Medien AG – München",
      "type": "Registerbekanntmachung nach dem Umwandlungsgesetz",
      "state": "Bayern",
      "amtsgericht": "Amtsgericht München",
      "registernummer": "HRB 134681",
      "registerart": "HRB",
      "company_name": "Kunze Medien AG",
      "company_seat": "München",
      "details": "12.11.2025 (Bekanntmachungsdatum)\n\nBayern Amtsgericht München HRB 134681\nRegisterbekanntmachung nach dem Umwandlungsgesetz 11.11.2025 (Eintragungsdatum)\n\nKunze Medien AG\nAktiengesellschaft\nMünchen\n\nDen Gläubigern der an der Verschmelzung beteiligten Rechtsträger ist, wenn sie binnen sechs Monaten nach dem Tag, an dem die Eintragung der Verschmelzung in das Register des Sitzes desjenigen Rechtsträgers, dessen Gläubiger sie sind, nach § 19 Abs. 3 UmwG als bekannt gemacht gilt, ihren Anspruch nach Grund und Höhe in Textform anmelden, Sicherheit zu leisten, soweit sie nicht Befriedigung verlangen können. Dieses Recht steht den Gläubigern jedoch nur zu, wenn sie glaubhaft machen, dass durch die Verschmelzung die Erfüllung ihrer Forderung gefährdet wird."
    },
    {
      "date": "2025-11-12",
      "id": "137034",
      "original_text": "Registerbekanntmachung nach dem Umwandlungsgesetz\nBayern Amtsgericht Nürnberg HRB 36109\nTriathlon Holding GmbH – Pyrbaum OT Seligenporten",
      "type": "Registerbekanntmachung nach dem Umwandlungsgesetz",
      "state": "Bayern",
      "amtsgericht": "Amtsgericht Nürnberg",
      "registernummer": "HRB 36109",
      "registerart": "HRB",
      "company_name": "Triathlon Holding GmbH",
      "company_seat": "Pyrbaum OT Seligenporten",
      "details": "12.11.2025 (Bekanntmachungsdatum)\n\nBayern Amtsgericht Nürnberg HRB 36109\nRegisterbekanntmachung nach dem Umwandlungsgesetz 30.10.2025 (Eintragungsdatum)\n\nTriathlon Holding GmbH\nGesellschaft mit beschränkter Haftung\nPyrbaum OT Seligenporten\n\nDen Gläubigern der an der Verschmelzung beteiligten Rechtsträger ist, wenn sie binnen sechs Monaten nach dem Tag, an dem die Eintragung der Verschmelzung in das Register des Sitzes desjenigen Rechtsträgers, dessen Gläubiger sie sind, nach § 19 Abs. 3 UmwG als bekannt gemacht gilt, ihren Anspruch nach Grund und Höhe in Textform anmelden, Sicherheit zu leisten, soweit sie nicht Befriedigung verlangen können. Dieses Recht steht den Gläubigern jedoch nur zu, wenn sie glaubhaft machen, dass durch die Verschmelzung die Erfüllung ihrer Forderung gefährdet wird."
    },
    {
      "date": "2025-11-12",
      "id": "137035",
      "original_text": "Registerbekanntmachung nach dem Umwandlungsgesetz\nBayern Amtsgericht München HRB 185937\nMS Treuhand GmbH – Tegernsee",
      "type": "Registerbekanntmachung nach dem Umwandlungsgesetz",
      "state": "Bayern",
      "amtsgericht": "Amtsgericht München",
      "registernummer": "HRB 185937",
      "registerart": "HRB",
      "company_name": "MS Treuhand GmbH",
      "company_seat": "Tegernsee",
      "details": "12.11.2025 (Bekanntmachungsdatum)\n\nBayern Amtsgericht München HRB 185937\nRegisterbekanntmachung nach dem Umwandlungsgesetz 11.11.2025 (Eintragungsdatum)\n\nMS Treuhand GmbH\nGesellschaft mit beschränkter Haftung\nTegernsee\n\nDen Gläubigern der an der Verschmelzung beteiligten Rechtsträger ist, wenn sie binnen sechs Monaten nach dem Tag, an dem die Eintragung der Verschmelzung in das Register des Sitzes desjenigen Rechtsträgers, dessen Gläubiger sie sind, nach § 19 Abs. 3 UmwG als bekannt gemacht gilt, ihren Anspruch nach Grund und Höhe in Textform anmelden, Sicherheit zu leisten, soweit sie nicht Befriedigung verlangen können. Dieses Recht steht den Gläubigern jedoch nur zu, wenn sie glaubhaft machen, dass durch die Verschmelzung die Erfüllung ihrer Forderung gefährdet wird."
    },
    {
      "date": "2025-11-12",
      "id": "137036",
      "original_text": "Registerbekanntmachung nach dem Umwandlungsgesetz\nBayern Amtsgericht München HRB 142761\nDisplay Devices Elektronik AG – Planegg",
      "type": "Registerbekanntmachung nach dem Umwandlungsgesetz",
      "state": "Bayern",
      "amtsgericht": "Amtsgericht München",
      "registernummer": "HRB 142761",
      "registerart": "HRB",
      "company_name": "Display Devices Elektronik AG",
      "company_seat": "Planegg",
      "details": "12.11.2025 (Bekanntmachungsdatum)\n\nBayern Amtsgericht München HRB 142761\nRegisterbekanntmachung nach dem Umwandlungsgesetz 11.11.2025 (Eintragungsdatum)\n\nDisplay Devices Elektronik AG\nAktiengesellschaft\nPlanegg\n\nDen Gläubigern des formwechselnden Rechtsträgers ist, wenn sie binnen sechs Monaten nach dem Tag, an dem die Eintragung des Formwechsels nach § 201 UmwG als bekannt gemacht gilt, ihren Anspruch nach Grund und Höhe in Textform anmelden, Sicherheit zu leisten, soweit sie nicht Befriedigung verlangen können. Dieses Recht steht den Gläubigern jedoch nur zu, wenn sie glaubhaft machen, dass durch den Formwechsel die Erfüllung ihrer Forderung gefährdet wird."
    },
    {
      "date": "2025-11-12",
      "id": "137037",
      "original_text": "Registerbekanntmachung nach dem Umwandlungsgesetz\nBayern Amtsgericht München HRB 222445\nSEG Kontorhaus Arnulfpark Beteiligungsgesellschaft mbH – Grünwald",
      "type": "Registerbekanntmachung nach dem Umwandlungsgesetz",
      "state": "Bayern",
      "amtsgericht": "Amtsgericht München",
      "registernummer": "HRB 222445",
      "registerart": "HRB",
      "company_name": "SEG Kontorhaus Arnulfpark Beteiligungsgesellschaft mbH",
      "company_seat": "Grünwald",
      "details": "12.11.2025 (Bekanntmachungsdatum)\n\nBayern Amtsgericht München HRB 222445\nRegisterbekanntmachung nach dem Umwandlungsgesetz 11.11.2025 (Eintragungsdatum)\n\nSEG Kontorhaus Arnulfpark Beteiligungsgesellschaft mbH\nGesellschaft mit beschränkter Haftung\nGrünwald\n\nDen Gläubigern der an der Verschmelzung beteiligten Rechtsträger ist, wenn sie binnen sechs Monaten nach dem Tag, an dem die Eintragung der Verschmelzung in das Register des Sitzes desjenigen Rechtsträgers, dessen Gläubiger sie sind, nach § 19 Abs. 3 UmwG als bekannt gemacht gilt, ihren Anspruch nach Grund und Höhe in Textform anmelden, Sicherheit zu leisten, soweit sie nicht Befriedigung verlangen können. Dieses Recht steht den Gläubigern jedoch nur zu, wenn sie glaubhaft machen, dass durch die Verschmelzung die Erfüllung ihrer Forderung gefährdet wird."
    },
    {
      "date": "2025-11-12",
      "id": "137038",
      "original_text": "Registerbekanntmachung nach dem Umwandlungsgesetz\nBayern Amtsgericht Nürnberg HRB 36109\nTriathlon Holding GmbH – Pyrbaum OT Seligenporten",
      "type": "Registerbekanntmachung nach dem Umwandlungsgesetz",
      "state": "Bayern",
      "amtsgericht": "Amtsgericht Nürnberg",
      "registernummer": "HRB 36109",
      "registerart": "HRB",
      "company_name": "Triathlon Holding GmbH",
      "company_seat": "Pyrbaum OT Seligenporten",
      "details": "12.11.2025 (Bekanntmachungsdatum)\n\nBayern Amtsgericht Nürnberg HRB 36109\nRegisterbekanntmachung nach dem Umwandlungsgesetz 30.10.2025 (Eintragungsdatum)\n\nTriathlon Holding GmbH\nGesellschaft mit beschränkter Haftung\nPyrbaum OT Seligenporten\n\nDen Gläubigern der an der Verschmelzung beteiligten Rechtsträger ist, wenn sie binnen sechs Monaten nach dem Tag, an dem die Eintragung der Verschmelzung in das Register des Sitzes desjenigen Rechtsträgers, dessen Gläubiger sie sind, nach § 19 Abs. 3 UmwG als bekannt gemacht gilt, ihren Anspruch nach Grund und Höhe in Textform anmelden, Sicherheit zu leisten, soweit sie nicht Befriedigung verlangen können. Dieses Recht steht den Gläubigern jedoch nur zu, wenn sie glaubhaft machen, dass durch die Verschmelzung die Erfüllung ihrer Forderung gefährdet wird."
    },
    {
      "date": "2025-11-12",
      "id": "137039",
      "original_text": "Löschungsankündigung\nBaden-Württemberg Amtsgericht Freiburg HRB 722578\nBrudek Infrarot GmbH – Teningen",
      "type": "Löschungsankündigung",
      "state": "Baden-Württemberg",
      "amtsgericht": "Amtsgericht Freiburg",
      "registernummer": "HRB 722578",
      "registerart": "HRB",
      "company_name": "Brudek Infrarot GmbH",
      "company_seat": "Teningen",
      "details": "12.11.2025 (Bekanntmachungsdatum)\n\nBaden-Württemberg Amtsgericht Freiburg HRB 722578\nLöschungsankündigung 12.11.2025 (Eintragungsdatum)\n\nBrudek Infrarot GmbH\nGesellschaft mit beschränkter Haftung\nTeningen\n\nAls nicht eingetragen wird bekanntgemacht:\nDas Gericht beabsichtigt, die Gesellschaft wegen Vermögenslosigkeit im Handelsregister von Amts wegen nach § 394 FamFG zu löschen. Die Frist zur Geltendmachung eines Widerspruchs gegen die beabsichtigte Löschung ist auf einen Monat ab Veröffentlichung bestimmt."
    },
    {
      "date": "2025-11-12",
      "id": "137040",
      "original_text": "Löschungsankündigung\nBerlin Amtsgericht Berlin (Charlottenburg) HRB 208375\nAlanzo Beteiligungs GmbH – Berlin",
      "type": "Löschungsankündigung",
      "state": "Berlin",
      "amtsgericht": "Amtsgericht Berlin (Charlottenburg)",
      "registernummer": "HRB 208375",
      "registerart": "HRB",
      "company_name": "Alanzo Beteiligungs GmbH",
      "company_seat": "Berlin",
      "details": "12.11.2025 (Bekanntmachungsdatum)\n\nBerlin Amtsgericht Berlin (Charlottenburg) HRB 208375\nLöschungsankündigung\n\nAlanzo Beteiligungs GmbH\nGesellschaft mit beschränkter Haftung\nBerlin\n\nBei der nachstehenden Gesellschaft wird das Amtslöschungsverfahren gemäß § 394 FamFG eingeleitet. Widerspruchsfrist 6 Wochen"
    },
    {
      "date": "2025-11-12",
      "id": "137041",
      "original_text": "Einreichung neuer Dokumente\nBaden-Württemberg Amtsgericht Mannheim HRB 202301\nlohn-ag.de Aktiengesellschaft – Baden-Baden",
      "type": "Einreichung neuer Dokumente",
      "state": "Baden-Württemberg",
      "amtsgericht": "Amtsgericht Mannheim",
      "registernummer": "HRB 202301",
      "registerart": "HRB",
      "company_name": "lohn-ag.de Aktiengesellschaft",
      "company_seat": "Baden-Baden",
      "details": "12.11.2025 (Bekanntmachungsdatum)\n\nBaden-Württemberg Amtsgericht Mannheim HRB 202301\nEinreichung neuer Dokumente 12.11.2025 (Eintragungsdatum)\n\nlohn-ag.de Aktiengesellschaft\nAktiengesellschaft\nBaden-Baden\n\nDie Gesellschaft hat am 10.09.2025 eine neue Liste über die Zusammensetzung des Aufsichtsrats zum Handelsregister eingereicht."
    },
    {
      "date": "2025-11-12",
      "id": "137042",
      "original_text": "Löschungsankündigung\nBrandenburg Amtsgericht Potsdam HRB 30049\nInterEnviroCon GmbH – Potsdam",
      "type": "Löschungsankündigung",
      "state": "Brandenburg",
      "amtsgericht": "Amtsgericht Potsdam",
      "registernummer": "HRB 30049",
      "registerart": "HRB",
      "company_name": "InterEnviroCon GmbH",
      "company_seat": "Potsdam",
      "details": "12.11.2025 (Bekanntmachungsdatum)\n\nBrandenburg Amtsgericht Potsdam HRB 30049\nLöschungsankündigung\n\nInterEnviroCon GmbH\nGesellschaft mit beschränkter Haftung\nPotsdam\n\nBei der nachstehenden Gesellschaft wird das Amtslöschungsverfahren gemäß § 394 FamFG eingeleitet. Widerspruchsfrist 8 Wochen."
    },
    {
      "date": "2025-11-12",
      "id": "137043",
      "original_text": "Sonstige Registerbekanntmachung\nHamburg Amtsgericht Hamburg HRB 75285\nReGe Hamburg Projekt-Realisierungsgesellschaft mbH – Hamburg",
      "type": "Sonstige Registerbekanntmachung",
      "state": "Hamburg",
      "amtsgericht": "Amtsgericht Hamburg",
      "registernummer": "HRB 75285",
      "registerart": "HRB",
      "company_name": "ReGe Hamburg Projekt-Realisierungsgesellschaft mbH",
      "company_seat": "Hamburg",
      "details": "12.11.2025 (Bekanntmachungsdatum)\n\nHamburg Amtsgericht Hamburg HRB 75285\nSonstige Registerbekanntmachung\n\nReGe Hamburg Projekt-Realisierungsgesellschaft mbH\nGesellschaft mit beschränkter Haftung\nHamburg\n\nAls nicht eingetragen wird bekannt gemacht: Liste des Aufsichtsrats wurde eingereicht."
    },
    {
      "date": "2025-11-12",
      "id": "137044",
      "original_text": "Löschungsankündigung\nBerlin Amtsgericht Berlin (Charlottenburg) HRB 248249\nBEX Event & Security Care UG (haftungsbeschränkt) – Berlin",
      "type": "Löschungsankündigung",
      "state": "Berlin",
      "amtsgericht": "Amtsgericht Berlin (Charlottenburg)",
      "registernummer": "HRB 248249",
      "registerart": "HRB",
      "company_name": "BEX Event & Security Care UG (haftungsbeschränkt)",
      "company_seat": "Berlin",
      "details": "12.11.2025 (Bekanntmachungsdatum)\n\nBerlin Amtsgericht Berlin (Charlottenburg) HRB 248249\nLöschungsankündigung\n\nBEX Event & Security Care UG (haftungsbeschränkt)\nGesellschaft mit beschränkter Haftung\nBerlin\n\nBei der nachstehenden Gesellschaft wird das Amtslöschungsverfahren gemäß § 394 FamFG eingeleitet. Widerspruchsfrist 6 Wochen"
    },
    {
      "date": "2025-11-12",
      "id": "137045",
      "original_text": "Löschungsankündigung\nBrandenburg Amtsgericht Potsdam HRB 23414\nSCH Nutzfahrzeuge und Baumaschinen GmbH – Werder (Havel)",
      "type": "Löschungsankündigung",
      "state": "Brandenburg",
      "amtsgericht": "Amtsgericht Potsdam",
      "registernummer": "HRB 23414",
      "registerart": "HRB",
      "company_name": "SCH Nutzfahrzeuge und Baumaschinen GmbH",
      "company_seat": "Werder (Havel)",
      "details": "12.11.2025 (Bekanntmachungsdatum)\n\nBrandenburg Amtsgericht Potsdam HRB 23414\nLöschungsankündigung\n\nSCH Nutzfahrzeuge und Baumaschinen GmbH\nGesellschaft mit beschränkter Haftung\nWerder (Havel)\n\nBei der nachstehenden Gesellschaft wird das Amtslöschungsverfahren gemäß § 394 FamFG eingeleitet. Widerspruchsfrist 8 Wochen."
    },
    {
      "date": "2025-11-12",
      "id": "137046",
      "original_text": "Löschungsankündigung\nBaden-Württemberg Amtsgericht Ulm HRA 721819\nPizza Busters UG (haftungsbeschränkt) & Co. KG – Ulm",
      "type": "Löschungsankündigung",
      "state": "Baden-Württemberg",
      "amtsgericht": "Amtsgericht Ulm",
      "registernummer": "HRA 721819",
      "registerart": "HRA",
      "company_name": "Pizza Busters UG (haftungsbeschränkt) & Co. KG",
      "company_seat": "Ulm",
      "details": "12.11.2025 (Bekanntmachungsdatum)\n\nBaden-Württemberg Amtsgericht Ulm HRA 721819\nLöschungsankündigung\n\nPizza Busters UG (haftungsbeschränkt) & Co. KG\nKommanditgesellschaft\nUlm\n\nDas Gericht beabsichtigt, die Gesellschaft wegen Vermögenslosigkeit im Handelsregister von Amts wegen nach § 394 FamFG zu löschen. Die Frist zur Geltendmachung eines Widerspruchs gegen die beabsichtigte Löschung ist auf  einen Monat ab Veröffentlichung bestimmt."
    },
    {
      "date": "2025-11-12",
      "id": "137047",
      "original_text": "Löschungsankündigung\nBrandenburg Amtsgericht Potsdam HRB 37569\nOndex GmbH – Falkensee",
      "type": "Löschungsankündigung",
      "state": "Brandenburg",
      "amtsgericht": "Amtsgericht Potsdam",
      "registernummer": "HRB 37569",
      "registerart": "HRB",
      "company_name": "Ondex GmbH",
      "company_seat": "Falkensee",
      "details": "12.11.2025 (Bekanntmachungsdatum)\n\nBrandenburg Amtsgericht Potsdam HRB 37569\nLöschungsankündigung\n\nOndex GmbH\nGesellschaft mit beschränkter Haftung\nFalkensee\n\nBei der nachstehenden Gesellschaft wird das Amtslöschungsverfahren gemäß § 394 FamFG eingeleitet. Widerspruchsfrist 8 Wochen."
    },
    {
      "date": "2025-11-12",
      "id": "137048",
      "original_text": "Registerbekanntmachung nach dem Umwandlungsgesetz\nBaden-Württemberg Amtsgericht Mannheim HRB 756269\nKurpfalz BI GmbH – Mannheim",
      "type": "Registerbekanntmachung nach dem Umwandlungsgesetz",
      "state": "Baden-Württemberg",
      "amtsgericht": "Amtsgericht Mannheim",
      "registernummer": "HRB 756269",
      "registerart": "HRB",
      "company_name": "Kurpfalz BI GmbH",
      "company_seat": "Mannheim",
      "details": "12.11.2025 (Bekanntmachungsdatum)\n\nBaden-Württemberg Amtsgericht Mannheim HRB 756269\nRegisterbekanntmachung nach dem Umwandlungsgesetz 12.11.2025 (Eintragungsdatum)\n\nKurpfalz BI GmbH\nGesellschaft mit beschränkter Haftung\nMannheim\n\nDen Gläubigern des an dem Formwechsel beteiligten Rechtsträgers ist, wenn sie binnen sechs Monaten nach dem Tag, an dem die Eintragung des Formwechsels in das Register des Sitzes desjenigen Rechtsträgers, dessen Gläubiger sie sind, nach § 19 Abs. 3 UmwG als bekanntgemacht gilt, ihren Anspruch nach Grund und Höhe schriftlich anmelden, Sicherheit zu leisten, soweit sie nicht Befriedigung verlangen können. Dieses Recht steht den Gläubigern jedoch nur zu, wenn sie glaubhaft machen, dass durch den Formwechsel die Erfüllung ihrer Forderung gefährdet wird."
    },
    {
      "date": "2025-11-12",
      "id": "137049",
      "original_text": "Löschungsankündigung\nBrandenburg Amtsgericht Cottbus HRB 10003\nMicron GmbH – Schönefeld",
      "type": "Löschungsankündigung",
      "state": "Brandenburg",
      "amtsgericht": "Amtsgericht Cottbus",
      "registernummer": "HRB 10003",
      "registerart": "HRB",
      "company_name": "Micron GmbH",
      "company_seat": "Schönefeld",
      "details": "12.11.2025 (Bekanntmachungsdatum)\n\nBrandenburg Amtsgericht Cottbus HRB 10003\nLöschungsankündigung\n\nMicron GmbH\nGesellschaft mit beschränkter Haftung\nSchönefeld\n\nIn der Handelsregistersache\n\nMicron GmbH mit Sitz in Schönefeld, vertreten durch den Liquididator Jörg Gahr, Dorfstr. 9, 12529 Schönefeld,\n\nsoll die Löschung der Gesellschaft im Handelsregister wegen Vermögenslosigkeit gemäß § 394 FamFG  erfolgen.\n\nWer an der Unterlassung der beabsichtigten Löschung ein berechtigtes Interesse hat, kann dagegen innerhalb von 1 Monat ab dieser Veröffentlichung Widerspruch beim Amtsgericht Cottbus - Handelsregisterabteilung -, Gerichtsplatz 2, 03046 Cottbus, zu HRB 10003 CB erheben.\n\nAmtsgericht Cottbus\nCottbus, den 11.11.2025"
    },
    {
      "date": "2025-11-12",
      "id": "137050",
      "original_text": "Registerbekanntmachung nach dem Umwandlungsgesetz\nBaden-Württemberg Amtsgericht Mannheim HRA 3028\nAbelein GmbH & Co KG – Mannheim",
      "type": "Registerbekanntmachung nach dem Umwandlungsgesetz",
      "state": "Baden-Württemberg",
      "amtsgericht": "Amtsgericht Mannheim",
      "registernummer": "HRA 3028",
      "registerart": "HRA",
      "company_name": "Abelein GmbH & Co KG",
      "company_seat": "Mannheim",
      "details": "12.11.2025 (Bekanntmachungsdatum)\n\nBaden-Württemberg Amtsgericht Mannheim HRA 3028\nRegisterbekanntmachung nach dem Umwandlungsgesetz 12.11.2025 (Eintragungsdatum)\n\nAbelein GmbH & Co KG\nKommanditgesellschaft\nMannheim\n\nDen Gläubigern des an dem Formwechsel beteiligten Rechtsträgers ist, wenn sie binnen sechs Monaten nach dem Tag, an dem die Eintragung des Formwechsels in das Register des Sitzes desjenigen Rechtsträgers, dessen Gläubiger sie sind, nach § 19 Abs. 3 UmwG als bekanntgemacht gilt, ihren Anspruch nach Grund und Höhe schriftlich anmelden, Sicherheit zu leisten, soweit sie nicht Befriedigung verlangen können. Dieses Recht steht den Gläubigern jedoch nur zu, wenn sie glaubhaft machen, dass durch den Formwechsel die Erfüllung ihrer Forderung gefährdet wird."
    },
    {
      "date": "2025-11-12",
      "id": "137051",
      "original_text": "Registerbekanntmachung nach dem Umwandlungsgesetz\nBerlin Amtsgericht Berlin (Charlottenburg) HRB 155381\nHomeToGo GmbH – Berlin",
      "type": "Registerbekanntmachung nach dem Umwandlungsgesetz",
      "state": "Berlin",
      "amtsgericht": "Amtsgericht Berlin (Charlottenburg)",
      "registernummer": "HRB 155381",
      "registerart": "HRB",
      "company_name": "HomeToGo GmbH",
      "company_seat": "Berlin",
      "details": "12.11.2025 (Bekanntmachungsdatum)\n\nBerlin Amtsgericht Berlin (Charlottenburg) HRB 155381\nRegisterbekanntmachung nach dem Umwandlungsgesetz 11.11.2025 (Eintragungsdatum)\n\nHomeToGo GmbH\nGesellschaft mit beschränkter Haftung\nBerlin\n\nZu Eintragungsnummer 29 vom 11.11.2025 wird als nicht eingetragen veröffentlicht: Den Gläubigern der an der Verschmelzung beteiligten Rechtsträger ist, wenn sie binnen sechs Monaten nach dem Tag, an dem die Eintragung der Verschmelzung in das Register des Sitzes desjenigen Rechtsträgers, dessen Gläubiger sie sind, als bekannt gemacht gilt, ihren Anspruch nach Grund und Höhe schriftlich anmelden, Sicherheit zu leisten, soweit sie nicht Befriedigung verlangen können. Dieses Recht steht den Gläubigern jedoch nur zu, wenn sie glaubhaft machen, dass durch die Verschmelzung die Erfüllung ihrer Forderung gefährdet wird. Das Recht, Sicherheitsleistung zu verlangen, steht Gläubigern nicht zu, die im Falle der Insolvenz ein Recht auf vorzugsweise Befriedigung aus einer Deckungsmasse haben, die nach gesetzlicher Vorschrift zu ihrem Schutz errichtet und staatlich überwacht ist."
    },
    {
      "date": "2025-11-12",
      "id": "137052",
      "original_text": "Registerbekanntmachung nach dem Umwandlungsgesetz\nBerlin Amtsgericht Berlin (Charlottenburg) HRB 251632\nSMN Verwaltungs-GmbH – Berlin",
      "type": "Registerbekanntmachung nach dem Umwandlungsgesetz",
      "state": "Berlin",
      "amtsgericht": "Amtsgericht Berlin (Charlottenburg)",
      "registernummer": "HRB 251632",
      "registerart": "HRB",
      "company_name": "SMN Verwaltungs-GmbH",
      "company_seat": "Berlin",
      "details": "12.11.2025 (Bekanntmachungsdatum)\n\nBerlin Amtsgericht Berlin (Charlottenburg) HRB 251632\nRegisterbekanntmachung nach dem Umwandlungsgesetz 11.11.2025 (Eintragungsdatum)\n\nSMN Verwaltungs-GmbH\nGesellschaft mit beschränkter Haftung\nBerlin\n\nZu Eintragungsnummer 4 vom 11.11.2025 wird als nicht eingetragen veröffentlicht: Den Gläubigern ist, wenn sie binnen sechs Monaten nach dem Tag, an dem die Eintragung der Umwandlung als bekannt gemacht gilt, ihren Anspruch nach Grund und Höhe schriftlich anmelden, Sicherheit zu leisten, soweit sie nicht Befriedigung verlangen können. Dieses Recht steht den Gläubigern jedoch nur zu, wenn sie glaubhaft machen, dass durch die Umwandlung die Erfüllung ihrer Forderung gefährdet wird. Das Recht, Sicherheitsleistung zu verlangen, steht Gläubigern nicht zu, die im Falle der Insolvenz ein Recht auf vorzugsweise Befriedigung aus einer Deckungsmasse haben, die nach gesetzlicher Vorschrift zu ihrem Schutz errichtet und staatlich überwacht ist."
    },
    {
      "date": "2025-11-12",
      "id": "137053",
      "original_text": "Löschungsankündigung\nBerlin Amtsgericht Berlin (Charlottenburg) HRA 56351\nS5 Real Estate UG (haftungsbeschränkt) & Co. KG – Berlin",
      "type": "Löschungsankündigung",
      "state": "Berlin",
      "amtsgericht": "Amtsgericht Berlin (Charlottenburg)",
      "registernummer": "HRA 56351",
      "registerart": "HRA",
      "company_name": "S5 Real Estate UG (haftungsbeschränkt) & Co. KG",
      "company_seat": "Berlin",
      "details": "12.11.2025 (Bekanntmachungsdatum)\n\nBerlin Amtsgericht Berlin (Charlottenburg) HRA 56351\nLöschungsankündigung\n\nS5 Real Estate UG (haftungsbeschränkt) & Co. KG\nKommanditgesellschaft\nBerlin\n\nBei dem nachstehenden Unternehmen / der nachstehenden Gesellschaft wird das Amtslöschungsverfahren gemäß § 31 Abs. 2 HGB eingeleitet. Widerspruchsfrist 8 Wochen."
    },
    {
      "date": "2025-11-12",
      "id": "137054",
      "original_text": "Sonstige Registerbekanntmachung\nHamburg Amtsgericht Hamburg HRB 192210\nHausVorteil AG – Hamburg",
      "type": "Sonstige Registerbekanntmachung",
      "state": "Hamburg",
      "amtsgericht": "Amtsgericht Hamburg",
      "registernummer": "HRB 192210",
      "registerart": "HRB",
      "company_name": "HausVorteil AG",
      "company_seat": "Hamburg",
      "details": "12.11.2025 (Bekanntmachungsdatum)\n\nHamburg Amtsgericht Hamburg HRB 192210\nSonstige Registerbekanntmachung\n\nHausVorteil AG\nAktiengesellschaft\nHamburg\n\nAls nicht eingetragen wird bekannt gemacht: Liste des Aufsichtsrats wurde eingereicht."
    },
    {
      "date": "2025-11-12",
      "id": "137055",
      "original_text": "Registerbekanntmachung nach dem Umwandlungsgesetz\nSchleswig-Holstein Amtsgericht Pinneberg HRB 17415\nMetis IT Consulting GmbH – Schenefeld/Krs. Pinneberg",
      "type": "Registerbekanntmachung nach dem Umwandlungsgesetz",
      "state": "Schleswig-Holstein",
      "amtsgericht": "Amtsgericht Pinneberg",
      "registernummer": "HRB 17415",
      "registerart": "HRB",
      "company_name": "Metis IT Consulting GmbH",
      "company_seat": "Schenefeld/Krs. Pinneberg",
      "details": "12.11.2025 (Bekanntmachungsdatum)\n\nSchleswig-Holstein Amtsgericht Pinneberg HRB 17415\nRegisterbekanntmachung nach dem Umwandlungsgesetz 28.10.2025 (Eintragungsdatum)\n\nMetis IT Consulting GmbH\nGesellschaft mit beschränkter Haftung\nSchenefeld/Krs. Pinneberg\n\nZu Eintragungsnummer 2 vom 28.10.2025 wird als nicht eingetragen veröffentlicht:  Den Gläubigern der an der Verschmelzung beteiligten Rechtsträger ist, wenn sie binnen sechs Monaten nach dem Tag, an dem die Eintragung der Verschmelzung in das Register des Sitzes desjenigen Rechtsträgers, dessen Gläubiger sie sind, als bekannt gemacht gilt, ihren Anspruch nach Grund und Höhe schriftlich anmelden, Sicherheit zu leisten, soweit sie nicht Befriedigung verlangen können. Dieses Recht steht den Gläubigern jedoch nur zu, wenn sie glaubhaft machen, dass durch die Verschmelzung die Erfüllung ihrer Forderung gefährdet wird. Das Recht, Sicherheitsleistung zu verlangen, steht Gläubigern nicht zu, die im Falle der Insolvenz ein Recht auf vorzugsweise Befriedigung aus einer Deckungsmasse haben, die nach gesetzlicher Vorschrift zu ihrem Schutz errichtet und staatlich überwacht ist."
    },
    {
      "date": "2025-11-12",
      "id": "137056",
      "original_text": "Löschungsankündigung\nBrandenburg Amtsgericht Potsdam HRB 25139\nBitterwolf Dachdeckerei GmbH Meisterbetrieb – Falkensee",
      "type": "Löschungsankündigung",
      "state": "Brandenburg",
      "amtsgericht": "Amtsgericht Potsdam",
      "registernummer": "HRB 25139",
      "registerart": "HRB",
      "company_name": "Bitterwolf Dachdeckerei GmbH Meisterbetrieb",
      "company_seat": "Falkensee",
      "details": "12.11.2025 (Bekanntmachungsdatum)\n\nBrandenburg Amtsgericht Potsdam HRB 25139\nLöschungsankündigung\n\nBitterwolf Dachdeckerei GmbH Meisterbetrieb\nGesellschaft mit beschränkter Haftung\nFalkensee\n\nBei der nachstehenden Gesellschaft wird das Amtslöschungsverfahren gemäß § 394 FamFG eingeleitet. Widerspruchsfrist 8 Wochen."
    },
    {
      "date": "2025-11-12",
      "id": "137057",
      "original_text": "Registerbekanntmachung nach dem Umwandlungsgesetz\nBaden-Württemberg Amtsgericht Stuttgart HRA 104707\nSB Lidl KG – Neckarsulm",
      "type": "Registerbekanntmachung nach dem Umwandlungsgesetz",
      "state": "Baden-Württemberg",
      "amtsgericht": "Amtsgericht Stuttgart",
      "registernummer": "HRA 104707",
      "registerart": "HRA",
      "company_name": "SB Lidl KG",
      "company_seat": "Neckarsulm",
      "details": "12.11.2025 (Bekanntmachungsdatum)\n\nBaden-Württemberg Amtsgericht Stuttgart HRA 104707\nRegisterbekanntmachung nach dem Umwandlungsgesetz 12.11.2025 (Eintragungsdatum)\n\nSB Lidl KG\nKommanditgesellschaft\nNeckarsulm\n\nAls nicht eingetragen wird bekanntgemacht:\nDen Gläubigern der an der Ausgliederung beteiligten Rechtsträger ist, wenn sie binnen sechs Monaten nach dem Tag, an dem die Eintragung der Ausgliederung in das Register des Sitzes desjenigen Rechtsträgers, dessen Gläubiger sie sind, nach § 19 Abs. 3 UmwG als bekanntgemacht gilt, ihren Anspruch nach Grund und Höhe schriftlich anmelden, Sicherheit zu leisten, soweit sie nicht Befriedigung verlangen können. Dieses Recht steht den Gläubigern jedoch nur zu, wenn sie glaubhaft machen, dass durch die Ausgliederung die Erfüllung ihrer Forderung gefährdet wird."
    },
    {
      "date": "2025-11-12",
      "id": "137058",
      "original_text": "Löschungsankündigung\nBerlin Amtsgericht Berlin (Charlottenburg) HRB 224397\nTENMEN GmbH – Berlin",
      "type": "Löschungsankündigung",
      "state": "Berlin",
      "amtsgericht": "Amtsgericht Berlin (Charlottenburg)",
      "registernummer": "HRB 224397",
      "registerart": "HRB",
      "company_name": "TENMEN GmbH",
      "company_seat": "Berlin",
      "details": "12.11.2025 (Bekanntmachungsdatum)\n\nBerlin Amtsgericht Berlin (Charlottenburg) HRB 224397\nLöschungsankündigung\n\nTENMEN GmbH\nGesellschaft mit beschränkter Haftung\nBerlin\n\nBei der nachstehenden Gesellschaft wird das Amtslöschungsverfahren gemäß § 394 FamFG eingeleitet. Widerspruchsfrist 6 Wochen"
    },
    {
      "date": "2025-11-12",
      "id": "137059",
      "original_text": "Löschungsankündigung\nBaden-Württemberg Amtsgericht Mannheim HRB 731776\nCID Solution GmbH – Friolzheim",
      "type": "Löschungsankündigung",
      "state": "Baden-Württemberg",
      "amtsgericht": "Amtsgericht Mannheim",
      "registernummer": "HRB 731776",
      "registerart": "HRB",
      "company_name": "CID Solution GmbH",
      "company_seat": "Friolzheim",
      "details": "12.11.2025 (Bekanntmachungsdatum)\n\nBaden-Württemberg Amtsgericht Mannheim HRB 731776\nLöschungsankündigung\n\nCID Solution GmbH\nGesellschaft mit beschränkter Haftung\nFriolzheim\n\nDas Gericht beabsichtigt, die Gesellschaft wegen Vermögenslosigkeit im Handelsregister von Amts wegen nach § 394 FamFG zu löschen. Die Frist zur Geltendmachung eines Widerspruchs gegen die beabsichtigte Löschung ist auf einen Monat ab Veröffentlichung bestimmt."
    },
    {
      "date": "2025-11-12",
      "id": "137060",
      "original_text": "Registerbekanntmachung nach dem Umwandlungsgesetz\nBaden-Württemberg Amtsgericht Freiburg HRB 732580\nAA Verwaltungs GmbH – Kehl",
      "type": "Registerbekanntmachung nach dem Umwandlungsgesetz",
      "state": "Baden-Württemberg",
      "amtsgericht": "Amtsgericht Freiburg",
      "registernummer": "HRB 732580",
      "registerart": "HRB",
      "company_name": "AA Verwaltungs GmbH",
      "company_seat": "Kehl",
      "details": "12.11.2025 (Bekanntmachungsdatum)\n\nBaden-Württemberg Amtsgericht Freiburg HRB 732580\nRegisterbekanntmachung nach dem Umwandlungsgesetz 12.11.2025 (Eintragungsdatum)\n\nAA Verwaltungs GmbH\nGesellschaft mit beschränkter Haftung\nKehl\n\nDen Gläubigern der an der Verschmelzung beteiligten Rechtsträger ist, wenn sie binnen sechs Monaten nach dem Tag, an dem die Eintragung der Verschmelzung in das Register des Sitzes desjenigen Rechtsträgers, dessen Gläubiger sie sind, nach § 19 Abs. 3 UmwG als bekanntgemacht gilt, ihren Anspruch nach Grund und Höhe schriftlich anmelden, Sicherheit zu leisten, soweit sie nicht Befriedigung verlangen können. Dieses Recht steht den Gläubigern jedoch nur zu, wenn sie glaubhaft machen, dass durch die Verschmelzung die Erfüllung ihrer Forderung gefährdet wird."
    },
    {
      "date": "2025-11-12",
      "id": "137061",
      "original_text": "Registerbekanntmachung nach dem Umwandlungsgesetz\nBaden-Württemberg Amtsgericht Stuttgart HRB 793866\nAUDERE GC Mobile Solutions GmbH – Fellbach",
      "type": "Registerbekanntmachung nach dem Umwandlungsgesetz",
      "state": "Baden-Württemberg",
      "amtsgericht": "Amtsgericht Stuttgart",
      "registernummer": "HRB 793866",
      "registerart": "HRB",
      "company_name": "AUDERE GC Mobile Solutions GmbH",
      "company_seat": "Fellbach",
      "details": "12.11.2025 (Bekanntmachungsdatum)\n\nBaden-Württemberg Amtsgericht Stuttgart HRB 793866\nRegisterbekanntmachung nach dem Umwandlungsgesetz 12.11.2025 (Eintragungsdatum)\n\nAUDERE GC Mobile Solutions GmbH\nGesellschaft mit beschränkter Haftung\nFellbach\n\nAls nicht eingetragen wird bekanntgemacht:\nDen Gläubigern der an der Verschmelzung beteiligten Rechtsträger ist, wenn sie binnen sechs Monaten nach dem Tag, an dem die Eintragung der Verschmelzung in das Register des Sitzes desjenigen Rechtsträgers, dessen Gläubiger sie sind, nach § 19 Abs. 3 UmwG als bekanntgemacht gilt, ihren Anspruch nach Grund und Höhe schriftlich anmelden, Sicherheit zu leisten, soweit sie nicht Befriedigung verlangen können. Dieses Recht steht den Gläubigern jedoch nur zu, wenn sie glaubhaft machen, dass durch die Verschmelzung die Erfüllung ihrer Forderung gefährdet wird."
    },
    {
      "date": "2025-11-12",
      "id": "137062",
      "original_text": "Sonstige Registerbekanntmachung\nBaden-Württemberg Amtsgericht Mannheim GnR 230071\nRAIFFEISENBANK HARDT-BRUHRAIN eG – Dettenheim",
      "type": "Sonstige Registerbekanntmachung",
      "state": "Baden-Württemberg",
      "amtsgericht": "Amtsgericht Mannheim",
      "registernummer": "GnR 230071",
      "registerart": "GnR",
      "company_name": "RAIFFEISENBANK HARDT-BRUHRAIN eG",
      "company_seat": "Dettenheim",
      "details": "12.11.2025 (Bekanntmachungsdatum)\n\nBaden-Württemberg Amtsgericht Mannheim GnR 230071\nSonstige Registerbekanntmachung 12.11.2025 (Eintragungsdatum)\n\nRAIFFEISENBANK HARDT-BRUHRAIN eG\neingetragene Genossenschaft\nDettenheim\n\nDie Verpflichtung der Genossen, Nachschüsse zur Insolvenzmasse zu leisten, wurde aufgehoben. Den Gläubigern der Genossenschaft ist, wenn sie sich binnen sechs Monaten nach der Bekanntmachung bei der Genossenschaft zu diesem Zweck melden, Sicherheit zu leisten, soweit sie nicht Befriedigung verlangen können."
    },
    {
      "date": "2025-11-12",
      "id": "137063",
      "original_text": "Registerbekanntmachung nach dem Umwandlungsgesetz\nBaden-Württemberg Amtsgericht Stuttgart HRB 800858\nAUDERE EduFlex TZ GmbH – Fellbach",
      "type": "Registerbekanntmachung nach dem Umwandlungsgesetz",
      "state": "Baden-Württemberg",
      "amtsgericht": "Amtsgericht Stuttgart",
      "registernummer": "HRB 800858",
      "registerart": "HRB",
      "company_name": "AUDERE EduFlex TZ GmbH",
      "company_seat": "Fellbach",
      "details": "12.11.2025 (Bekanntmachungsdatum)\n\nBaden-Württemberg Amtsgericht Stuttgart HRB 800858\nRegisterbekanntmachung nach dem Umwandlungsgesetz 12.11.2025 (Eintragungsdatum)\n\nAUDERE EduFlex TZ GmbH\nGesellschaft mit beschränkter Haftung\nFellbach\n\nAls nicht eingetragen wird bekanntgemacht:\nDen Gläubigern der an der Verschmelzung beteiligten Rechtsträger ist, wenn sie binnen sechs Monaten nach dem Tag, an dem die Eintragung der Verschmelzung in das Register des Sitzes desjenigen Rechtsträgers, dessen Gläubiger sie sind, nach § 19 Abs. 3 UmwG als bekanntgemacht gilt, ihren Anspruch nach Grund und Höhe schriftlich anmelden, Sicherheit zu leisten, soweit sie nicht Befriedigung verlangen können. Dieses Recht steht den Gläubigern jedoch nur zu, wenn sie glaubhaft machen, dass durch die Verschmelzung die Erfüllung ihrer Forderung gefährdet wird."
    },
    {
      "date": "2025-11-12",
      "id": "137064",
      "original_text": "Registerbekanntmachung nach dem Umwandlungsgesetz\nHamburg Amtsgericht Hamburg HRB 187360\nMB Energy Last Mile GmbH – Hamburg",
      "type": "Registerbekanntmachung nach dem Umwandlungsgesetz",
      "state": "Hamburg",
      "amtsgericht": "Amtsgericht Hamburg",
      "registernummer": "HRB 187360",
      "registerart": "HRB",
      "company_name": "MB Energy Last Mile GmbH",
      "company_seat": "Hamburg",
      "details": "12.11.2025 (Bekanntmachungsdatum)\n\nHamburg Amtsgericht Hamburg HRB 187360\nRegisterbekanntmachung nach dem Umwandlungsgesetz 12.11.2025 (Eintragungsdatum)\n\nMB Energy Last Mile GmbH\nGesellschaft mit beschränkter Haftung\nHamburg\n\nAls nicht eingetragen wird bekannt gemacht:\nDen Gläubigern der an der Ausgliederung beteiligten Gesellschaften ist, wenn sie binnen sechs Monaten nach dem Tag, an dem die Eintragung der Ausgliederung in das Register des Sitzes desjenigen Rechtsträgers, dessen Gläubiger sie sind, nach § 19 Absatz 3 UmwG als bekannt gemacht gilt, ihren Anspruch nach Grund und Höhe schriftlich anmelden, Sicherheit zu leisten, soweit sie nicht Befriedigung verlangen können. Dieses Recht steht den Gläubigern jedoch nur zu, wenn sie glaubhaft machen, dass durch die Ausgliederung die Erfüllung ihrer Forderung gefährdet wird."
    },
    {
      "date": "2025-11-12",
      "id": "137065",
      "original_text": "Registerbekanntmachung nach dem Umwandlungsgesetz\nHamburg Amtsgericht Hamburg HRB 121782\nZeitwohnen Hamburg GmbH – Hamburg",
      "type": "Registerbekanntmachung nach dem Umwandlungsgesetz",
      "state": "Hamburg",
      "amtsgericht": "Amtsgericht Hamburg",
      "registernummer": "HRB 121782",
      "registerart": "HRB",
      "company_name": "Zeitwohnen Hamburg GmbH",
      "company_seat": "Hamburg",
      "details": "12.11.2025 (Bekanntmachungsdatum)\n\nHamburg Amtsgericht Hamburg HRB 121782\nRegisterbekanntmachung nach dem Umwandlungsgesetz 12.11.2025 (Eintragungsdatum)\n\nZeitwohnen Hamburg GmbH\nGesellschaft mit beschränkter Haftung\nHamburg\n\nAls nicht eingetragen wird bekannt gemacht:\nDen Gläubigern der an der formwechselnden Umwandlung beteiligten Gesellschaften ist, wenn sie binnen sechs Monaten nach dem Tag, an dem die Eintragung der formwechselnden Umwandlung in das Register des Sitzes desjenigen Rechtsträgers, dessen Gläubiger sie sind, nach § 19 Absatz 3 UmwG als bekannt gemacht gilt, ihren Anspruch nach Grund und Höhe schriftlich anmelden, Sicherheit zu leisten, soweit sie nicht Befriedigung verlangen können. Dieses Recht steht den Gläubigern jedoch nur zu, wenn sie glaubhaft machen, dass durch die formwechselnde Umwandlung die Erfüllung ihrer Forderung gefährdet wird."
    },
    {
      "date": "2025-11-12",
      "id": "137066",
      "original_text": "Einreichung neuer Dokumente\nSchleswig-Holstein Amtsgericht Lübeck HRB 1314 OD\nHako GmbH – Bad Oldesloe",
      "type": "Einreichung neuer Dokumente",
      "state": "Schleswig-Holstein",
      "amtsgericht": "Amtsgericht Lübeck",
      "registernummer": "HRB 1314 OD",
      "registerart": "HRB",
      "company_name": "Hako GmbH",
      "company_seat": "Bad Oldesloe",
      "details": "12.11.2025 (Bekanntmachungsdatum)\n\nSchleswig-Holstein Amtsgericht Lübeck HRB 1314 OD\nEinreichung neuer Dokumente\n\nHako GmbH\nGesellschaft mit beschränkter Haftung\nBad Oldesloe\n\nAls nicht eingetragen wird veröffentlicht:\nDie Gesellschaft hat eine neue Liste der Aufsichtsratsmitglieder beim Handelsregister hinterlegt."
    },
    {
      "date": "2025-11-12",
      "id": "137067",
      "original_text": "Sonstige Registerbekanntmachung\nSchleswig-Holstein Amtsgericht Flensburg HRB 17034\nteam agrar GmbH – Flensburg",
      "type": "Sonstige Registerbekanntmachung",
      "state": "Schleswig-Holstein",
      "amtsgericht": "Amtsgericht Flensburg",
      "registernummer": "HRB 17034",
      "registerart": "HRB",
      "company_name": "team agrar GmbH",
      "company_seat": "Flensburg",
      "details": "12.11.2025 (Bekanntmachungsdatum)\n\nSchleswig-Holstein Amtsgericht Flensburg HRB 17034\nSonstige Registerbekanntmachung\n\nteam agrar GmbH\nGesellschaft mit beschränkter Haftung\nFlensburg\n\nAls nicht eingetragen wird veröffentlicht: Neue Aufsichtsratsliste nach Änderung eingereicht am 12.11.2025"
    },
    {
      "date": "2025-11-12",
      "id": "137068",
      "original_text": "Löschungsankündigung\nBrandenburg Amtsgericht Potsdam HRB 28987\nvorsprung RESEARCH UG (haftungsbeschränkt) – Potsdam",
      "type": "Löschungsankündigung",
      "state": "Brandenburg",
      "amtsgericht": "Amtsgericht Potsdam",
      "registernummer": "HRB 28987",
      "registerart": "HRB",
      "company_name": "vorsprung RESEARCH UG (haftungsbeschränkt)",
      "company_seat": "Potsdam",
      "details": "12.11.2025 (Bekanntmachungsdatum)\n\nBrandenburg Amtsgericht Potsdam HRB 28987\nLöschungsankündigung\n\nvorsprung RESEARCH UG (haftungsbeschränkt)\nGesellschaft mit beschränkter Haftung\nPotsdam\n\nBei der nachstehenden Gesellschaft wird das Amtslöschungsverfahren gemäß § 394 FamFG eingeleitet. Widerspruchsfrist: 8 Wochen."
    },
    {
      "date": "2025-11-12",
      "id": "137069",
      "original_text": "Löschungsankündigung\nBerlin Amtsgericht Berlin (Charlottenburg) HRB 263011\nImpulse Group GmbH – Berlin",
      "type": "Löschungsankündigung",
      "state": "Berlin",
      "amtsgericht": "Amtsgericht Berlin (Charlottenburg)",
      "registernummer": "HRB 263011",
      "registerart": "HRB",
      "company_name": "Impulse Group GmbH",
      "company_seat": "Berlin",
      "details": "12.11.2025 (Bekanntmachungsdatum)\n\nBerlin Amtsgericht Berlin (Charlottenburg) HRB 263011\nLöschungsankündigung\n\nImpulse Group GmbH\nGesellschaft mit beschränkter Haftung\nBerlin\n\nBei der nachstehenden Gesellschaft wird das Amtslöschungsverfahren gemäß § 394 FamFG eingeleitet. Widerspruchsfrist 6 Wochen"
    },
    {
      "date": "2025-11-12",
      "id": "137070",
      "original_text": "Löschungsankündigung\nBerlin Amtsgericht Berlin (Charlottenburg) HRB 160640\nStay Free Kollektiv Event & Booking UG (haftungsbeschränkt) – Berlin",
      "type": "Löschungsankündigung",
      "state": "Berlin",
      "amtsgericht": "Amtsgericht Berlin (Charlottenburg)",
      "registernummer": "HRB 160640",
      "registerart": "HRB",
      "company_name": "Stay Free Kollektiv Event & Booking UG (haftungsbeschränkt)",
      "company_seat": "Berlin",
      "details": "12.11.2025 (Bekanntmachungsdatum)\n\nBerlin Amtsgericht Berlin (Charlottenburg) HRB 160640\nLöschungsankündigung\n\nStay Free Kollektiv Event & Booking UG (haftungsbeschränkt)\nGesellschaft mit beschränkter Haftung\nBerlin\n\nBei der nachstehenden Gesellschaft wird das Amtslöschungsverfahren gemäß § 394 FamFG eingeleitet. Widerspruchsfrist 6 Wochen"
    },
    {
      "date": "2025-11-12",
      "id": "137071",
      "original_text": "Registerbekanntmachung nach dem Umwandlungsgesetz\nHamburg Amtsgericht Hamburg HRB 144370\nMETRO CLOUD Provider GmbH – Hamburg",
      "type": "Registerbekanntmachung nach dem Umwandlungsgesetz",
      "state": "Hamburg",
      "amtsgericht": "Amtsgericht Hamburg",
      "registernummer": "HRB 144370",
      "registerart": "HRB",
      "company_name": "METRO CLOUD Provider GmbH",
      "company_seat": "Hamburg",
      "details": "12.11.2025 (Bekanntmachungsdatum)\n\nHamburg Amtsgericht Hamburg HRB 144370\nRegisterbekanntmachung nach dem Umwandlungsgesetz 22.09.2025 (Eintragungsdatum)\n\nMETRO CLOUD Provider GmbH\nGesellschaft mit beschränkter Haftung\nHamburg\n\nAls nicht eingetragen wird bekannt gemacht:\nDen Gläubigern der an der Verschmelzung beteiligten Gesellschaften ist, wenn sie binnen sechs Monaten nach dem Tag, an dem die Eintragung der Verschmelzung in das Register des Sitzes desjenigen Rechtsträgers, dessen Gläubiger sie sind, nach § 19 Absatz 3 UmwG als bekannt gemacht gilt, ihren Anspruch nach Grund und Höhe schriftlich anmelden, Sicherheit zu leisten, soweit sie nicht Befriedigung verlangen können. Dieses Recht steht den Gläubigern jedoch nur zu, wenn sie glaubhaft machen, dass durch die Verschmelzung die Erfüllung ihrer Forderung gefährdet wird."
    },
    {
      "date": "2025-11-12",
      "id": "137072",
      "original_text": "Registerbekanntmachung nach dem Umwandlungsgesetz\nHamburg Amtsgericht Hamburg HRB 94278\nTom Tailor GmbH – Hamburg",
      "type": "Registerbekanntmachung nach dem Umwandlungsgesetz",
      "state": "Hamburg",
      "amtsgericht": "Amtsgericht Hamburg",
      "registernummer": "HRB 94278",
      "registerart": "HRB",
      "company_name": "Tom Tailor GmbH",
      "company_seat": "Hamburg",
      "details": "12.11.2025 (Bekanntmachungsdatum)\n\nHamburg Amtsgericht Hamburg HRB 94278\nRegisterbekanntmachung nach dem Umwandlungsgesetz 12.11.2025 (Eintragungsdatum)\n\nTom Tailor GmbH\nGesellschaft mit beschränkter Haftung\nHamburg\n\nAls nicht eingetragen wird bekannt gemacht:\nDen Gläubigern der an der Verschmelzung beteiligten Gesellschaften ist, wenn sie binnen sechs Monaten nach dem Tag, an dem die Eintragung der Verschmelzung in das Register des Sitzes desjenigen Rechtsträgers, dessen Gläubiger sie sind, nach § 19 Absatz 3 UmwG als bekannt gemacht gilt, ihren Anspruch nach Grund und Höhe schriftlich anmelden, Sicherheit zu leisten, soweit sie nicht Befriedigung verlangen können. Dieses Recht steht den Gläubigern jedoch nur zu, wenn sie glaubhaft machen, dass durch die Verschmelzung die Erfüllung ihrer Forderung gefährdet wird."
    },
    {
      "date": "2025-11-12",
      "id": "137073",
      "original_text": "Registerbekanntmachung nach dem Umwandlungsgesetz\nBaden-Württemberg Amtsgericht Stuttgart HRA 742115\nLidl 423 GmbH & Co. KG – Bad Wimpfen",
      "type": "Registerbekanntmachung nach dem Umwandlungsgesetz",
      "state": "Baden-Württemberg",
      "amtsgericht": "Amtsgericht Stuttgart",
      "registernummer": "HRA 742115",
      "registerart": "HRA",
      "company_name": "Lidl 423 GmbH & Co. KG",
      "company_seat": "Bad Wimpfen",
      "details": "12.11.2025 (Bekanntmachungsdatum)\n\nBaden-Württemberg Amtsgericht Stuttgart HRA 742115\nRegisterbekanntmachung nach dem Umwandlungsgesetz 12.11.2025 (Eintragungsdatum)\n\nLidl 423 GmbH & Co. KG\nKommanditgesellschaft\nBad Wimpfen\n\nDen Gläubigern der an der Ausgliederung beteiligten Rechtsträger ist, wenn sie binnen sechs Monaten nach dem Tag, an dem die Eintragung der Ausgliederung in das Register des Sitzes desjenigen Rechtsträgers, dessen Gläubiger sie sind, nach § 19 Abs. 3 UmwG als bekanntgemacht gilt, ihren Anspruch nach Grund und Höhe schriftlich anmelden, Sicherheit zu leisten, soweit sie nicht Befriedigung verlangen können. Dieses Recht steht den Gläubigern jedoch nur zu, wenn sie glaubhaft machen, dass durch die Ausgliederung die Erfüllung ihrer Forderung gefährdet wird."
    },
    {
      "date": "2025-11-12",
      "id": "137074",
      "original_text": "Registerbekanntmachung nach dem Umwandlungsgesetz\nBaden-Württemberg Amtsgericht Stuttgart HRA 742113\nLidl 406 GmbH & Co. KG – Bad Wimpfen",
      "type": "Registerbekanntmachung nach dem Umwandlungsgesetz",
      "state": "Baden-Württemberg",
      "amtsgericht": "Amtsgericht Stuttgart",
      "registernummer": "HRA 742113",
      "registerart": "HRA",
      "company_name": "Lidl 406 GmbH & Co. KG",
      "company_seat": "Bad Wimpfen",
      "details": "12.11.2025 (Bekanntmachungsdatum)\n\nBaden-Württemberg Amtsgericht Stuttgart HRA 742113\nRegisterbekanntmachung nach dem Umwandlungsgesetz 12.11.2025 (Eintragungsdatum)\n\nLidl 406 GmbH & Co. KG\nKommanditgesellschaft\nBad Wimpfen\n\nDen Gläubigern der an der Ausgliederung beteiligten Rechtsträger ist, wenn sie binnen sechs Monaten nach dem Tag, an dem die Eintragung der Ausgliederung in das Register des Sitzes desjenigen Rechtsträgers, dessen Gläubiger sie sind, nach § 19 Abs. 3 UmwG als bekanntgemacht gilt, ihren Anspruch nach Grund und Höhe schriftlich anmelden, Sicherheit zu leisten, soweit sie nicht Befriedigung verlangen können. Dieses Recht steht den Gläubigern jedoch nur zu, wenn sie glaubhaft machen, dass durch die Ausgliederung die Erfüllung ihrer Forderung gefährdet wird."
    },
    {
      "date": "2025-11-12",
      "id": "137075",
      "original_text": "Registerbekanntmachung nach dem Umwandlungsgesetz\nBaden-Württemberg Amtsgericht Stuttgart HRA 742098\nLidl 402 GmbH & Co. KG – Bad Wimpfen",
      "type": "Registerbekanntmachung nach dem Umwandlungsgesetz",
      "state": "Baden-Württemberg",
      "amtsgericht": "Amtsgericht Stuttgart",
      "registernummer": "HRA 742098",
      "registerart": "HRA",
      "company_name": "Lidl 402 GmbH & Co. KG",
      "company_seat": "Bad Wimpfen",
      "details": "12.11.2025 (Bekanntmachungsdatum)\n\nBaden-Württemberg Amtsgericht Stuttgart HRA 742098\nRegisterbekanntmachung nach dem Umwandlungsgesetz 12.11.2025 (Eintragungsdatum)\n\nLidl 402 GmbH & Co. KG\nKommanditgesellschaft\nBad Wimpfen\n\nAls nicht eingetragen wird bekanntgemacht:\nDen Gläubigern der an der Ausgliederung beteiligten Rechtsträger ist, wenn sie binnen sechs Monaten nach dem Tag, an dem die Eintragung der Ausgliederung in das Register des Sitzes desjenigen Rechtsträgers, dessen Gläubiger sie sind, nach § 19 Abs. 3 UmwG als bekanntgemacht gilt, ihren Anspruch nach Grund und Höhe schriftlich anmelden, Sicherheit zu leisten, soweit sie nicht Befriedigung verlangen können. Dieses Recht steht den Gläubigern jedoch nur zu, wenn sie glaubhaft machen, dass durch die Ausgliederung die Erfüllung ihrer Forderung gefährdet wird."
    },
    {
      "date": "2025-11-12",
      "id": "137076",
      "original_text": "Registerbekanntmachung nach dem Umwandlungsgesetz\nBaden-Württemberg Amtsgericht Stuttgart HRB 744679\nSplu Experts GmbH – Stuttgart",
      "type": "Registerbekanntmachung nach dem Umwandlungsgesetz",
      "state": "Baden-Württemberg",
      "amtsgericht": "Amtsgericht Stuttgart",
      "registernummer": "HRB 744679",
      "registerart": "HRB",
      "company_name": "Splu Experts GmbH",
      "company_seat": "Stuttgart",
      "details": "12.11.2025 (Bekanntmachungsdatum)\n\nBaden-Württemberg Amtsgericht Stuttgart HRB 744679\nRegisterbekanntmachung nach dem Umwandlungsgesetz 12.11.2025 (Eintragungsdatum)\n\nSplu Experts GmbH\nGesellschaft mit beschränkter Haftung\nStuttgart\n\nAls nicht eingetragen wird bekanntgemacht:\nDen Gläubigern der an der Verschmelzung beteiligten Rechtsträger ist, wenn sie binnen sechs Monaten nach dem Tag, an dem die Eintragung der Verschmelzung in das Register des Sitzes desjenigen Rechtsträgers, dessen Gläubiger sie sind, nach § 19 Abs. 3 UmwG als bekanntgemacht gilt, ihren Anspruch nach Grund und Höhe schriftlich anmelden, Sicherheit zu leisten, soweit sie nicht Befriedigung verlangen können. Dieses Recht steht den Gläubigern jedoch nur zu, wenn sie glaubhaft machen, dass durch die Verschmelzung die Erfüllung ihrer Forderung gefährdet wird."
    },
    {
      "date": "2025-11-12",
      "id": "137077",
      "original_text": "Registerbekanntmachung nach dem Umwandlungsgesetz\nBerlin Amtsgericht Berlin (Charlottenburg) HRB 221170\nTerrassendachWelten UG (haftungsbeschränkt) – Berlin",
      "type": "Registerbekanntmachung nach dem Umwandlungsgesetz",
      "state": "Berlin",
      "amtsgericht": "Amtsgericht Berlin (Charlottenburg)",
      "registernummer": "HRB 221170",
      "registerart": "HRB",
      "company_name": "TerrassendachWelten UG (haftungsbeschränkt)",
      "company_seat": "Berlin",
      "details": "12.11.2025 (Bekanntmachungsdatum)\n\nBerlin Amtsgericht Berlin (Charlottenburg) HRB 221170\nRegisterbekanntmachung nach dem Umwandlungsgesetz 12.11.2025 (Eintragungsdatum)\n\nTerrassendachWelten UG (haftungsbeschränkt)\nGesellschaft mit beschränkter Haftung\nBerlin\n\nZu Eintragungsnummer 2 vom 12.11.2025 wird als nicht eingetragen veröffentlicht: Den Gläubigern der an der Verschmelzung beteiligten Rechtsträger ist, wenn sie binnen sechs Monaten nach dem Tag, an dem die Eintragung der Verschmelzung in das Register des Sitzes desjenigen Rechtsträgers, dessen Gläubiger sie sind, als bekannt gemacht gilt, ihren Anspruch nach Grund und Höhe schriftlich anmelden, Sicherheit zu leisten, soweit sie nicht Befriedigung verlangen können. Dieses Recht steht den Gläubigern jedoch nur zu, wenn sie glaubhaft machen, dass durch die Verschmelzung die Erfüllung ihrer Forderung gefährdet wird. Das Recht, Sicherheitsleistung zu verlangen, steht Gläubigern nicht zu, die im Falle der Insolvenz ein Recht auf vorzugsweise Befriedigung aus einer Deckungsmasse haben, die nach gesetzlicher Vorschrift zu ihrem Schutz errichtet und staatlich überwacht ist."
    },
    {
      "date": "2025-11-12",
      "id": "137078",
      "original_text": "Registerbekanntmachung nach dem Umwandlungsgesetz\nBerlin Amtsgericht Berlin (Charlottenburg) HRB 222278\nBerlin Jalousien Handel & Montage GmbH – Berlin",
      "type": "Registerbekanntmachung nach dem Umwandlungsgesetz",
      "state": "Berlin",
      "amtsgericht": "Amtsgericht Berlin (Charlottenburg)",
      "registernummer": "HRB 222278",
      "registerart": "HRB",
      "company_name": "Berlin Jalousien Handel & Montage GmbH",
      "company_seat": "Berlin",
      "details": "12.11.2025 (Bekanntmachungsdatum)\n\nBerlin Amtsgericht Berlin (Charlottenburg) HRB 222278\nRegisterbekanntmachung nach dem Umwandlungsgesetz 12.11.2025 (Eintragungsdatum)\n\nBerlin Jalousien Handel & Montage GmbH\nGesellschaft mit beschränkter Haftung\nBerlin\n\nZu Eintragungsnummer 2 vom 12.11.2025 wird als nicht eingetragen veröffentlicht: Den Gläubigern der an der Verschmelzung beteiligten Rechtsträger ist, wenn sie binnen sechs Monaten nach dem Tag, an dem die Eintragung der Verschmelzung in das Register des Sitzes desjenigen Rechtsträgers, dessen Gläubiger sie sind, als bekannt gemacht gilt, ihren Anspruch nach Grund und Höhe schriftlich anmelden, Sicherheit zu leisten, soweit sie nicht Befriedigung verlangen können. Dieses Recht steht den Gläubigern jedoch nur zu, wenn sie glaubhaft machen, dass durch die Verschmelzung die Erfüllung ihrer Forderung gefährdet wird. Das Recht, Sicherheitsleistung zu verlangen, steht Gläubigern nicht zu, die im Falle der Insolvenz ein Recht auf vorzugsweise Befriedigung aus einer Deckungsmasse haben, die nach gesetzlicher Vorschrift zu ihrem Schutz errichtet und staatlich überwacht ist."
    },
    {
      "date": "2025-11-12",
      "id": "137079",
      "original_text": "Löschungsankündigung\nBaden-Württemberg Amtsgericht Stuttgart HRB 769064\nVagabundo Studios UG (haftungsbeschränkt) – Stuttgart",
      "type": "Löschungsankündigung",
      "state": "Baden-Württemberg",
      "amtsgericht": "Amtsgericht Stuttgart",
      "registernummer": "HRB 769064",
      "registerart": "HRB",
      "company_name": "Vagabundo Studios UG (haftungsbeschränkt)",
      "company_seat": "Stuttgart",
      "details": "12.11.2025 (Bekanntmachungsdatum)\n\nBaden-Württemberg Amtsgericht Stuttgart HRB 769064\nLöschungsankündigung\n\nVagabundo Studios UG (haftungsbeschränkt)\nGesellschaft mit beschränkter Haftung\nStuttgart\n\nDas Gericht beabsichtigt, die Gesellschaft wegen Vermögenslosigkeit im Handelsregister von Amts wegen nach § 394 FamFG zu löschen. Die Frist zur Geltendmachung eines Widerspruchs gegen die beabsichtigte Löschung ist auf einen Monat ab Veröffentlichung bestimmt."
    },
    {
      "date": "2025-11-12",
      "id": "137080",
      "original_text": "Registerbekanntmachung nach dem Umwandlungsgesetz\nBerlin Amtsgericht Berlin (Charlottenburg) HRB 221866\nBerlin Jalousien Vertriebs GmbH – Berlin",
      "type": "Registerbekanntmachung nach dem Umwandlungsgesetz",
      "state": "Berlin",
      "amtsgericht": "Amtsgericht Berlin (Charlottenburg)",
      "registernummer": "HRB 221866",
      "registerart": "HRB",
      "company_name": "Berlin Jalousien Vertriebs GmbH",
      "company_seat": "Berlin",
      "details": "12.11.2025 (Bekanntmachungsdatum)\n\nBerlin Amtsgericht Berlin (Charlottenburg) HRB 221866\nRegisterbekanntmachung nach dem Umwandlungsgesetz 12.11.2025 (Eintragungsdatum)\n\nBerlin Jalousien Vertriebs GmbH\nGesellschaft mit beschränkter Haftung\nBerlin\n\nZu Eintragungsnummer 3 vom 12.11.2025 wird als nicht eingetragen veröffentlicht: Den Gläubigern der an der Verschmelzung beteiligten Rechtsträger ist, wenn sie binnen sechs Monaten nach dem Tag, an dem die Eintragung der Verschmelzung in das Register des Sitzes desjenigen Rechtsträgers, dessen Gläubiger sie sind, als bekannt gemacht gilt, ihren Anspruch nach Grund und Höhe schriftlich anmelden, Sicherheit zu leisten, soweit sie nicht Befriedigung verlangen können. Dieses Recht steht den Gläubigern jedoch nur zu, wenn sie glaubhaft machen, dass durch die Verschmelzung die Erfüllung ihrer Forderung gefährdet wird. Das Recht, Sicherheitsleistung zu verlangen, steht Gläubigern nicht zu, die im Falle der Insolvenz ein Recht auf vorzugsweise Befriedigung aus einer Deckungsmasse haben, die nach gesetzlicher Vorschrift zu ihrem Schutz errichtet und staatlich überwacht ist."
    },
    {
      "date": "2025-11-12",
      "id": "137081",
      "original_text": "Registerbekanntmachung nach dem Umwandlungsgesetz\nBerlin Amtsgericht Berlin (Charlottenburg) HRB 221866\nBerlin Jalousien Vertriebs GmbH – Berlin",
      "type": "Registerbekanntmachung nach dem Umwandlungsgesetz",
      "state": "Berlin",
      "amtsgericht": "Amtsgericht Berlin (Charlottenburg)",
      "registernummer": "HRB 221866",
      "registerart": "HRB",
      "company_name": "Berlin Jalousien Vertriebs GmbH",
      "company_seat": "Berlin",
      "details": "12.11.2025 (Bekanntmachungsdatum)\n\nBerlin Amtsgericht Berlin (Charlottenburg) HRB 221866\nRegisterbekanntmachung nach dem Umwandlungsgesetz 12.11.2025 (Eintragungsdatum)\n\nBerlin Jalousien Vertriebs GmbH\nGesellschaft mit beschränkter Haftung\nBerlin\n\nZu Eintragungsnummer 4 vom 12.11.2025 wird als nicht eingetragen veröffentlicht: Den Gläubigern der an der Verschmelzung beteiligten Rechtsträger ist, wenn sie binnen sechs Monaten nach dem Tag, an dem die Eintragung der Verschmelzung in das Register des Sitzes desjenigen Rechtsträgers, dessen Gläubiger sie sind, als bekannt gemacht gilt, ihren Anspruch nach Grund und Höhe schriftlich anmelden, Sicherheit zu leisten, soweit sie nicht Befriedigung verlangen können. Dieses Recht steht den Gläubigern jedoch nur zu, wenn sie glaubhaft machen, dass durch die Verschmelzung die Erfüllung ihrer Forderung gefährdet wird. Das Recht, Sicherheitsleistung zu verlangen, steht Gläubigern nicht zu, die im Falle der Insolvenz ein Recht auf vorzugsweise Befriedigung aus einer Deckungsmasse haben, die nach gesetzlicher Vorschrift zu ihrem Schutz errichtet und staatlich überwacht ist."
    },
    {
      "date": "2025-11-12",
      "id": "137082",
      "original_text": "Löschungsankündigung\nBrandenburg Amtsgericht Frankfurt/Oder HRB 10513\nMP - TEC Verwaltungsgesellschaft mbH – Eberswalde",
      "type": "Löschungsankündigung",
      "state": "Brandenburg",
      "amtsgericht": "Amtsgericht Frankfurt/Oder",
      "registernummer": "HRB 10513",
      "registerart": "HRB",
      "company_name": "MP - TEC Verwaltungsgesellschaft mbH",
      "company_seat": "Eberswalde",
      "details": "12.11.2025 (Bekanntmachungsdatum)\n\nBrandenburg Amtsgericht Frankfurt/Oder HRB 10513\nLöschungsankündigung\n\nMP - TEC Verwaltungsgesellschaft mbH\nGesellschaft mit beschränkter Haftung\nEberswalde\n\nBei der nachstehenden Gesellschaft wird das Amtslöschungsverfahren gemäß § 394 FamFG eingeleitet."
    },
    {
      "date": "2025-11-12",
      "id": "137083",
      "original_text": "Löschungsankündigung\nSchleswig-Holstein Amtsgericht Flensburg HRB 10779\nWerbetechnik Munk GmbH – Wees",
      "type": "Löschungsankündigung",
      "state": "Schleswig-Holstein",
      "amtsgericht": "Amtsgericht Flensburg",
      "registernummer": "HRB 10779",
      "registerart": "HRB",
      "company_name": "Werbetechnik Munk GmbH",
      "company_seat": "Wees",
      "details": "12.11.2025 (Bekanntmachungsdatum)\n\nSchleswig-Holstein Amtsgericht Flensburg HRB 10779\nLöschungsankündigung\n\nWerbetechnik Munk GmbH\nGesellschaft mit beschränkter Haftung\nWees\n\nEs ist die Löschung der nachstehenden Gesellschaft wegen Vermögenslosigkeit gemäß § 394 FamFG beabsichtigt.\nWiderspruchsfrist: 2 Monate."
    },
    {
      "date": "2025-11-12",
      "id": "137084",
      "original_text": "Registerbekanntmachung nach dem Umwandlungsgesetz\nBaden-Württemberg Amtsgericht Mannheim HRB 735464\nGetsafe Insurance AG – Heidelberg",
      "type": "Registerbekanntmachung nach dem Umwandlungsgesetz",
      "state": "Baden-Württemberg",
      "amtsgericht": "Amtsgericht Mannheim",
      "registernummer": "HRB 735464",
      "registerart": "HRB",
      "company_name": "Getsafe Insurance AG",
      "company_seat": "Heidelberg",
      "details": "12.11.2025 (Bekanntmachungsdatum)\n\nBaden-Württemberg Amtsgericht Mannheim HRB 735464\nRegisterbekanntmachung nach dem Umwandlungsgesetz 12.11.2025 (Eintragungsdatum)\n\nGetsafe Insurance AG\nAktiengesellschaft\nHeidelberg\n\nDen Gläubigern der an der Verschmelzung beteiligten Rechtsträger ist, wenn sie binnen sechs Monaten nach dem Tag, an dem die Eintragung der Verschmelzung in das Register des Sitzes desjenigen Rechtsträgers, dessen Gläubiger sie sind, nach § 19 Abs. 3 UmwG als bekanntgemacht gilt, ihren Anspruch nach Grund und Höhe schriftlich anmelden, Sicherheit zu leisten, soweit sie nicht Befriedigung verlangen können. Dieses Recht steht den Gläubigern jedoch nur zu, wenn sie glaubhaft machen, dass durch die Verschmelzung die Erfüllung ihrer Forderung gefährdet wird."
    },
    {
      "date": "2025-11-12",
      "id": "137085",
      "original_text": "Registerbekanntmachung nach dem Umwandlungsgesetz\nHamburg Amtsgericht Hamburg HRB 169659\nNalo UG (haftungsbeschränkt) – Hamburg",
      "type": "Registerbekanntmachung nach dem Umwandlungsgesetz",
      "state": "Hamburg",
      "amtsgericht": "Amtsgericht Hamburg",
      "registernummer": "HRB 169659",
      "registerart": "HRB",
      "company_name": "Nalo UG (haftungsbeschränkt)",
      "company_seat": "Hamburg",
      "details": "12.11.2025 (Bekanntmachungsdatum)\n\nHamburg Amtsgericht Hamburg HRB 169659\nRegisterbekanntmachung nach dem Umwandlungsgesetz 12.11.2025 (Eintragungsdatum)\n\nNalo UG (haftungsbeschränkt)\nGesellschaft mit beschränkter Haftung\nHamburg\n\nAls nicht eingetragen wird bekannt gemacht:\nDen Gläubigern der an der Verschmelzung beteiligten Gesellschaften ist, wenn sie binnen sechs Monaten nach dem Tag, an dem die Eintragung der Verschmelzung in das Register des Sitzes desjenigen Rechtsträgers, dessen Gläubiger sie sind, nach § 19 Absatz 3 UmwG als bekannt gemacht gilt, ihren Anspruch nach Grund und Höhe schriftlich anmelden, Sicherheit zu leisten, soweit sie nicht Befriedigung verlangen können. Dieses Recht steht den Gläubigern jedoch nur zu, wenn sie glaubhaft machen, dass durch die Verschmelzung die Erfüllung ihrer Forderung gefährdet wird."
    },
    {
      "date": "2025-11-12",
      "id": "137086",
      "original_text": "Registerbekanntmachung nach dem Umwandlungsgesetz\nBrandenburg Amtsgericht Neuruppin HRA 3183\nKaufland Immobilien GmbH & Co. KG – Liebenwalde OT Kreuzbruch",
      "type": "Registerbekanntmachung nach dem Umwandlungsgesetz",
      "state": "Brandenburg",
      "amtsgericht": "Amtsgericht Neuruppin",
      "registernummer": "HRA 3183",
      "registerart": "HRA",
      "company_name": "Kaufland Immobilien GmbH & Co. KG",
      "company_seat": "Liebenwalde OT Kreuzbruch",
      "details": "12.11.2025 (Bekanntmachungsdatum)\n\nBrandenburg Amtsgericht Neuruppin HRA 3183\nRegisterbekanntmachung nach dem Umwandlungsgesetz 12.11.2025 (Eintragungsdatum)\n\nKaufland Immobilien GmbH & Co. KG\nKommanditgesellschaft\nLiebenwalde OT Kreuzbruch\n\nZu Eintragungsnummer 13 vom 12.11.2025 wird als nicht eingetragen veröffentlicht:\nDen Gläubigern der an der Umwandlung beteiligten Rechtsträger ist, wenn sie binnen sechs Monaten nach dem Tag, an dem die Eintragung der Umwandlung in das Register des Sitzes desjenigen Rechtsträgers, dessen Gläubiger sie sind, als bekannt gemacht gilt, ihren Anspruch nach Grund und Höhe schriftlich anmelden, Sicherheit zu leisten, soweit sie nicht Befriedigung verlangen können. Dieses Recht steht den Gläubigern jedoch nur zu, wenn sie glaubhaft machen, dass durch die Umwandlung die Erfüllung ihrer Forderung gefährdet wird"
    },
    {
      "date": "2025-11-12",
      "id": "137087",
      "original_text": "Löschungsankündigung\nBaden-Württemberg Amtsgericht Stuttgart HRB 789329\nRoyal Spielautomaten GmbH – Stuttgart",
      "type": "Löschungsankündigung",
      "state": "Baden-Württemberg",
      "amtsgericht": "Amtsgericht Stuttgart",
      "registernummer": "HRB 789329",
      "registerart": "HRB",
      "company_name": "Royal Spielautomaten GmbH",
      "company_seat": "Stuttgart",
      "details": "12.11.2025 (Bekanntmachungsdatum)\n\nBaden-Württemberg Amtsgericht Stuttgart HRB 789329\nLöschungsankündigung\n\nRoyal Spielautomaten GmbH\nGesellschaft mit beschränkter Haftung\nStuttgart\n\nDas Gericht beabsichtigt, die Gesellschaft wegen Vermögenslosigkeit im Handelsregister von Amts wegen nach § 394 FamFG zu löschen. Die Frist zur Geltendmachung eines Widerspruchs gegen die beabsichtigte Löschung ist auf zwei Monate ab Veröffentlichung bestimmt."
    },
    {
      "date": "2025-11-12",
      "id": "137088",
      "original_text": "Registerbekanntmachung nach dem Umwandlungsgesetz\nBaden-Württemberg Amtsgericht Mannheim HRB 725674\nGetsafe GmbH – Heidelberg",
      "type": "Registerbekanntmachung nach dem Umwandlungsgesetz",
      "state": "Baden-Württemberg",
      "amtsgericht": "Amtsgericht Mannheim",
      "registernummer": "HRB 725674",
      "registerart": "HRB",
      "company_name": "Getsafe GmbH",
      "company_seat": "Heidelberg",
      "details": "12.11.2025 (Bekanntmachungsdatum)\n\nBaden-Württemberg Amtsgericht Mannheim HRB 725674\nRegisterbekanntmachung nach dem Umwandlungsgesetz 12.11.2025 (Eintragungsdatum)\n\nGetsafe GmbH\nGesellschaft mit beschränkter Haftung\nHeidelberg\n\nDen Gläubigern der an der Verschmelzung beteiligten Rechtsträger ist, wenn sie binnen sechs Monaten nach dem Tag, an dem die Eintragung der Verschmelzung in das Register des Sitzes desjenigen Rechtsträgers, dessen Gläubiger sie sind, nach § 19 Abs. 3 UmwG als bekanntgemacht gilt, ihren Anspruch nach Grund und Höhe schriftlich anmelden, Sicherheit zu leisten, soweit sie nicht Befriedigung verlangen können. Dieses Recht steht den Gläubigern jedoch nur zu, wenn sie glaubhaft machen, dass durch die Verschmelzung die Erfüllung ihrer Forderung gefährdet wird."
    },
    {
      "date": "2025-11-12",
      "id": "137089",
      "original_text": "Registerbekanntmachung nach dem Umwandlungsgesetz\nBerlin Amtsgericht Berlin (Charlottenburg) HRB 82709\nMilner Vermögensverwaltungs GmbH – Berlin",
      "type": "Registerbekanntmachung nach dem Umwandlungsgesetz",
      "state": "Berlin",
      "amtsgericht": "Amtsgericht Berlin (Charlottenburg)",
      "registernummer": "HRB 82709",
      "registerart": "HRB",
      "company_name": "Milner Vermögensverwaltungs GmbH",
      "company_seat": "Berlin",
      "details": "12.11.2025 (Bekanntmachungsdatum)\n\nBerlin Amtsgericht Berlin (Charlottenburg) HRB 82709\nRegisterbekanntmachung nach dem Umwandlungsgesetz 11.11.2025 (Eintragungsdatum)\n\nMilner Vermögensverwaltungs GmbH\nGesellschaft mit beschränkter Haftung\nBerlin\n\nZu Eintragungsnummer 7 vom 11.11.2025 wird als nicht eingetragen veröffentlicht: Den Gläubigern der an der Verschmelzung beteiligten Rechtsträger ist, wenn sie binnen sechs Monaten nach dem Tag, an dem die Eintragung der Verschmelzung in das Register des Sitzes desjenigen Rechtsträgers, dessen Gläubiger sie sind, als bekannt gemacht gilt, ihren Anspruch nach Grund und Höhe schriftlich anmelden, Sicherheit zu leisten, soweit sie nicht Befriedigung verlangen können. Dieses Recht steht den Gläubigern jedoch nur zu, wenn sie glaubhaft machen, dass durch die Verschmelzung die Erfüllung ihrer Forderung gefährdet wird. Das Recht, Sicherheitsleistung zu verlangen, steht Gläubigern nicht zu, die im Falle der Insolvenz ein Recht auf vorzugsweise Befriedigung aus einer Deckungsmasse haben, die nach gesetzlicher Vorschrift zu ihrem Schutz errichtet und staatlich überwacht ist."
    },
    {
      "date": "2025-11-12",
      "id": "137090",
      "original_text": "Registerbekanntmachung nach dem Umwandlungsgesetz\nNordrhein-Westfalen Amtsgericht Coesfeld HRA 10228\nDziuba & Tepferd Verwaltungs OHG – Südlohn",
      "type": "Registerbekanntmachung nach dem Umwandlungsgesetz",
      "state": "Nordrhein-Westfalen",
      "amtsgericht": "Amtsgericht Coesfeld",
      "registernummer": "HRA 10228",
      "registerart": "HRA",
      "company_name": "Dziuba & Tepferd Verwaltungs OHG",
      "company_seat": "Südlohn",
      "details": "12.11.2025 (Bekanntmachungsdatum)\n\nNordrhein-Westfalen Amtsgericht Coesfeld HRA 10228\nRegisterbekanntmachung nach dem Umwandlungsgesetz 12.11.2025 (Eintragungsdatum)\n\nDziuba & Tepferd Verwaltungs OHG\nOffene Handelsgesellschaft\nSüdlohn\n\nDen Gläubigern der an der Verschmelzung beteiligten Rechtsträger ist, wenn sie binnen sechs Monaten nach dem Tag, an dem die Eintragung der Verschmelzung in das Register des Sitzes desjenigen Rechtsträgers, dessen Gläubiger sie sind, nach § 19 Absatz 3 UmwG als bekanntgemacht gilt, ihren Anspruch nach Grund und Höhe schriftlich anmelden, Sicherheit zu leisten, soweit sie nicht Befriedigung verlangen können. Dieses Recht steht den Gläubigern jedoch nur zu, wenn sie glaubhaft machen, dass durch die Verschmelzung die Erfüllung ihrer Forderung gefährdet wird."
    },
    {
      "date": "2025-11-12",
      "id": "137091",
      "original_text": "Löschungsankündigung\nBerlin Amtsgericht Berlin (Charlottenburg) HRB 262767\nFastX Logistik GmbH – Berlin",
      "type": "Löschungsankündigung",
      "state": "Berlin",
      "amtsgericht": "Amtsgericht Berlin (Charlottenburg)",
      "registernummer": "HRB 262767",
      "registerart": "HRB",
      "company_name": "FastX Logistik GmbH",
      "company_seat": "Berlin",
      "details": "12.11.2025 (Bekanntmachungsdatum)\n\nBerlin Amtsgericht Berlin (Charlottenburg) HRB 262767\nLöschungsankündigung\n\nFastX Logistik GmbH\nGesellschaft mit beschränkter Haftung\nBerlin\n\nBei der nachstehenden Gesellschaft wird das Amtslöschungsverfahren gemäß § 394 FamFG eingeleitet. Widerspruchsfrist 6 Wochen"
    },
    {
      "date": "2025-11-12",
      "id": "137092",
      "original_text": "Registerbekanntmachung nach dem Umwandlungsgesetz\nBerlin Amtsgericht Berlin (Charlottenburg) HRB 124261\npdm solutions GmbH – Berlin",
      "type": "Registerbekanntmachung nach dem Umwandlungsgesetz",
      "state": "Berlin",
      "amtsgericht": "Amtsgericht Berlin (Charlottenburg)",
      "registernummer": "HRB 124261",
      "registerart": "HRB",
      "company_name": "pdm solutions GmbH",
      "company_seat": "Berlin",
      "details": "12.11.2025 (Bekanntmachungsdatum)\n\nBerlin Amtsgericht Berlin (Charlottenburg) HRB 124261\nRegisterbekanntmachung nach dem Umwandlungsgesetz 11.11.2025 (Eintragungsdatum)\n\npdm solutions GmbH\nGesellschaft mit beschränkter Haftung\nBerlin\n\nZu Eintragungsnummer 11 vom 11.11.2025 wird als nicht eingetragen veröffentlicht: Den Gläubigern der an den Verschmelzungen beteiligten Rechtsträger ist, wenn sie binnen sechs Monaten nach dem Tag, an dem die Eintragung der jeweiligen Verschmelzung in das Register des Sitzes desjenigen Rechtsträgers, dessen Gläubiger sie sind, als bekannt gemacht gilt, ihren Anspruch nach Grund und Höhe schriftlich anmelden, Sicherheit zu leisten, soweit sie nicht Befriedigung verlangen können. Dieses Recht steht den Gläubigern jedoch nur zu, wenn sie glaubhaft machen, dass durch die jeweilige Verschmelzung die Erfüllung ihrer Forderung gefährdet wird. Das Recht, Sicherheitsleistung zu verlangen, steht Gläubigern nicht zu, die im Falle der Insolvenz ein Recht auf vorzugsweise Befriedigung aus einer Deckungsmasse haben, die nach gesetzlicher Vorschrift zu ihrem Schutz errichtet und staatlich überwacht ist."
    },
    {
      "date": "2025-11-12",
      "id": "137093",
      "original_text": "Löschungsankündigung\nSachsen Amtsgericht Dresden HRB 33854\nfamo consulting UG (haftungsbeschränkt) – Radeburg",
      "type": "Löschungsankündigung",
      "state": "Sachsen",
      "amtsgericht": "Amtsgericht Dresden",
      "registernummer": "HRB 33854",
      "registerart": "HRB",
      "company_name": "famo consulting UG (haftungsbeschränkt)",
      "company_seat": "Radeburg",
      "details": "12.11.2025 (Bekanntmachungsdatum)\n\nSachsen Amtsgericht Dresden HRB 33854\nLöschungsankündigung\n\nfamo consulting UG (haftungsbeschränkt)\nGesellschaft mit beschränkter Haftung\nRadeburg\n\nDas Registergericht beabsichtigt, die im Handelsregister eingetragene Gesellschaft von Amts wegen nach § 394 FamFG zu löschen. Die Frist zu Erhebung eines Widerspruchs gegen die beabsichtigte Löschung wird auf einen Monat festgesetzt."
    },
    {
      "date": "2025-11-12",
      "id": "137094",
      "original_text": "Registerbekanntmachung nach dem Umwandlungsgesetz\nSachsen Amtsgericht Chemnitz HRB 34949\nLota 18. GmbH – Schönheide",
      "type": "Registerbekanntmachung nach dem Umwandlungsgesetz",
      "state": "Sachsen",
      "amtsgericht": "Amtsgericht Chemnitz",
      "registernummer": "HRB 34949",
      "registerart": "HRB",
      "company_name": "Lota 18. GmbH",
      "company_seat": "Schönheide",
      "details": "12.11.2025 (Bekanntmachungsdatum)\n\nSachsen Amtsgericht Chemnitz HRB 34949\nRegisterbekanntmachung nach dem Umwandlungsgesetz 12.11.2025 (Eintragungsdatum)\n\nLota 18. GmbH\nGesellschaft mit beschränkter Haftung\nSchönheide\n\nDen Gläubigern der an der Verschmelzung beteiligten Rechtsträger ist, wenn sie binnen sechs Monaten nach dem Tag, an dem die Eintragung der Verschmelzung in das Register des Sitzes desjenigen Rechtsträgers, dessen Gläubiger sie sind, nach § 19 Abs. 3 UmwG als bekannt gemacht gilt, ihren Anspruch nach Grund und Höhe in Textform anmelden, Sicherheit zu leisten, soweit sie nicht Befriedigung verlangen können. Dieses Recht steht den Gläubigern jedoch nur zu, wenn sie glaubhaft machen, dass durch die Verschmelzung die Erfüllung der Forderung gefährdet wird."
    },
    {
      "date": "2025-11-12",
      "id": "137095",
      "original_text": "Registerbekanntmachung nach dem Umwandlungsgesetz\nSachsen Amtsgericht Dresden PR 346\nHentschel und Partner Steuerberater – Dresden",
      "type": "Registerbekanntmachung nach dem Umwandlungsgesetz",
      "state": "Sachsen",
      "amtsgericht": "Amtsgericht Dresden",
      "registernummer": "PR 346",
      "registerart": "PR",
      "company_name": "Hentschel und Partner Steuerberater",
      "company_seat": "Dresden",
      "details": "12.11.2025 (Bekanntmachungsdatum)\n\nSachsen Amtsgericht Dresden PR 346\nRegisterbekanntmachung nach dem Umwandlungsgesetz 12.11.2025 (Eintragungsdatum)\n\nHentschel und Partner Steuerberater\nPartnerschaftsgesellschaft\nDresden\n\nDen Gläubigern der an der Verschmelzung beteiligten Rechtsträger ist, wenn sie binnen sechs Monaten nach dem Tag, an dem die Eintragung der Verschmelzung in das Register des Sitzes desjenigen Rechtsträgers, dessen Gläubiger sie sind, nach § 19 Abs. 3 UmwG als bekannt gemacht gilt, ihren Anspruch nach Grund und Höhe in Textform anmelden, Sicherheit zu leisten, soweit sie nicht Befriedigung verlangen können. Dieses Recht steht den Gläubigern jedoch nur zu, wenn sie glaubhaft machen, dass durch die Verschmelzung die Erfüllung der Forderung gefährdet wird."
    },
    {
      "date": "2025-11-12",
      "id": "137096",
      "original_text": "Registerbekanntmachung nach dem Umwandlungsgesetz\nSachsen Amtsgericht Dresden HRB 40719\nCadence Holding GmbH – Dresden",
      "type": "Registerbekanntmachung nach dem Umwandlungsgesetz",
      "state": "Sachsen",
      "amtsgericht": "Amtsgericht Dresden",
      "registernummer": "HRB 40719",
      "registerart": "HRB",
      "company_name": "Cadence Holding GmbH",
      "company_seat": "Dresden",
      "details": "12.11.2025 (Bekanntmachungsdatum)\n\nSachsen Amtsgericht Dresden HRB 40719\nRegisterbekanntmachung nach dem Umwandlungsgesetz 12.11.2025 (Eintragungsdatum)\n\nCadence Holding GmbH\nGesellschaft mit beschränkter Haftung\nDresden\n\nDen Gläubigern der an der Verschmelzung beteiligten Rechtsträger ist, wenn sie binnen sechs Monaten nach dem Tag, an dem die Eintragung der Verschmelzung in das Register des Sitzes desjenigen Rechtsträgers, dessen Gläubiger sie sind, nach § 19 Abs. 3 UmwG als bekannt gemacht gilt, ihren Anspruch nach Grund und Höhe in Textform anmelden, Sicherheit zu leisten, soweit sie nicht Befriedigung verlangen können. Dieses Recht steht den Gläubigern jedoch nur zu, wenn sie glaubhaft machen, dass durch die Verschmelzung die Erfüllung der Forderung gefährdet wird."
    },
    {
      "date": "2025-11-12",
      "id": "137097",
      "original_text": "Löschungsankündigung\nBaden-Württemberg Amtsgericht Stuttgart HRB 749192\nWotaq GmbH – Stuttgart",
      "type": "Löschungsankündigung",
      "state": "Baden-Württemberg",
      "amtsgericht": "Amtsgericht Stuttgart",
      "registernummer": "HRB 749192",
      "registerart": "HRB",
      "company_name": "Wotaq GmbH",
      "company_seat": "Stuttgart",
      "details": "12.11.2025 (Bekanntmachungsdatum)\n\nBaden-Württemberg Amtsgericht Stuttgart HRB 749192\nLöschungsankündigung 12.11.2025 (Eintragungsdatum)\n\nWotaq GmbH\nGesellschaft mit beschränkter Haftung\nStuttgart\n\nAls nicht eingetragen wird bekanntgemacht:\nDas Gericht beabsichtigt, die Gesellschaft wegen Vermögenslosigkeit im Handelsregister von Amts wegen nach § 394 FamFG zu löschen. Die Frist zur Geltendmachung eines Widerspruchs gegen die beabsichtigte Löschung ist auf zwei Monate ab Veröffentlichung bestimmt."
    },
    {
      "date": "2025-11-12",
      "id": "137098",
      "original_text": "Löschungsankündigung\nNiedersachsen Amtsgericht Göttingen VR 2687\nInno Think Akademie e.V. – Göttingen",
      "type": "Löschungsankündigung",
      "state": "Niedersachsen",
      "amtsgericht": "Amtsgericht Göttingen",
      "registernummer": "VR 2687",
      "registerart": "VR",
      "company_name": "Inno Think Akademie e.V.",
      "company_seat": "Göttingen",
      "details": "12.11.2025 (Bekanntmachungsdatum)\n\nNiedersachsen Amtsgericht Göttingen VR 2687\nLöschungsankündigung\n\nInno Think Akademie e.V.\neingetragener Verein\nGöttingen\n\nDas Registergericht beabsichtigt, den Verein die Rechtsfähigkeit zu entziehen, § 73 BGB. Sollte der Verein noch bestehen und mehr als 2 Mitglieder haben, wird um diesbezügliche Mitteilung und Angabe der Mitglieder (mit Namen+ Anschrift) gebeten.\nDie Frist zur Erhebung eines Widerspruchs ist auf 1 Monat ab dieser Registerbekanntmachung festgesetzt."
    },
    {
      "date": "2025-11-12",
      "id": "137099",
      "original_text": "Löschungsankündigung\nNiedersachsen Amtsgericht Hildesheim HRB 203084\nBINOXX Defence Technologies GmbH – Schellerten",
      "type": "Löschungsankündigung",
      "state": "Niedersachsen",
      "amtsgericht": "Amtsgericht Hildesheim",
      "registernummer": "HRB 203084",
      "registerart": "HRB",
      "company_name": "BINOXX Defence Technologies GmbH",
      "company_seat": "Schellerten",
      "details": "12.11.2025 (Bekanntmachungsdatum)\n\nNiedersachsen Amtsgericht Hildesheim HRB 203084\nLöschungsankündigung\n\nBINOXX Defence Technologies GmbH\nGesellschaft mit beschränkter Haftung\nSchellerten\n\nDas Registergericht beabsichtigt, die Gesellschaft von Amts wegen nach § 394 FamFG zu löschen. Die Frist zur Erhebung eines Widerspruchs ist auf 1 Monat ab dieser Registerbekanntmachung festgesetzt."
    },
    {
      "date": "2025-11-12",
      "id": "137100",
      "original_text": "Registerbekanntmachung nach dem Umwandlungsgesetz\nNiedersachsen Amtsgericht Hildesheim HRA 203192\ngrünplus biloba, Inh. Stefan Reuter e.K. – Sibbesse",
      "type": "Registerbekanntmachung nach dem Umwandlungsgesetz",
      "state": "Niedersachsen",
      "amtsgericht": "Amtsgericht Hildesheim",
      "registernummer": "HRA 203192",
      "registerart": "HRA",
      "company_name": "grünplus biloba, Inh. Stefan Reuter e.K.",
      "company_seat": "Sibbesse",
      "details": "12.11.2025 (Bekanntmachungsdatum)\n\nNiedersachsen Amtsgericht Hildesheim HRA 203192\nRegisterbekanntmachung nach dem Umwandlungsgesetz 12.11.2025 (Eintragungsdatum)\n\ngrünplus biloba, Inh. Stefan Reuter e.K.\nEinzelkaufmann / Einzelkauffrau\nSibbesse\n\nDen Gläubigern der an der Ausgliederung beteiligten Rechtsträger ist, wenn sie binnen sechs Monaten nach dem Tag, an dem die Eintragung der Ausgliederung in das Register des Sitzes desjenigen Rechtsträgers, dessen Gläubiger sie sind, nach § 19 Abs. 3 UmwG als bekannt gemacht gilt, ihren Anspruch nach Grund und Höhe schriftlich anmelden, Sicherheit zu leisten, soweit sie nicht Befriedigung verlangen können. Dieses Recht steht den Gläubigern jedoch nur zu, wenn sie glaubhaft machen, dass durch die Ausgliederung die Erfüllung der Forderung gefährdet wird."
    },
    {
      "date": "2025-11-12",
      "id": "137101",
      "original_text": "Registerbekanntmachung nach dem Umwandlungsgesetz\nNiedersachsen Amtsgericht Göttingen HRB 1551\nSartorius Stedim Plastics GmbH – Göttingen",
      "type": "Registerbekanntmachung nach dem Umwandlungsgesetz",
      "state": "Niedersachsen",
      "amtsgericht": "Amtsgericht Göttingen",
      "registernummer": "HRB 1551",
      "registerart": "HRB",
      "company_name": "Sartorius Stedim Plastics GmbH",
      "company_seat": "Göttingen",
      "details": "12.11.2025 (Bekanntmachungsdatum)\n\nNiedersachsen Amtsgericht Göttingen HRB 1551\nRegisterbekanntmachung nach dem Umwandlungsgesetz 12.11.2025 (Eintragungsdatum)\n\nSartorius Stedim Plastics GmbH\nGesellschaft mit beschränkter Haftung\nGöttingen\n\nDen Gläubigern der an der Verschmelzung beteiligten Rechtsträger ist, wenn sie binnen sechs Monaten nach dem Tag, an dem die Eintragung der Verschmelzung in das Register des Sitzes desjenigen Rechtsträgers, dessen Gläubiger sie sind, nach § 19  Abs.  3 UmwG als bekannt gemacht gilt, ihren Anspruch nach Grund und Höhe schriftlich anmelden, Sicherheit zu leisten, soweit sie nicht Befriedigung verlangen können. Dieses Recht steht den Gläubigern jedoch nur zu, wenn sie glaubhaft machen, dass durch die Verschmelzung die Erfüllung der Forderung gefährdet wird."
    },
    {
      "date": "2025-11-12",
      "id": "137102",
      "original_text": "Registerbekanntmachung nach dem Umwandlungsgesetz\nNiedersachsen Amtsgericht Hildesheim HRB 208462\ngrünplus GmbH – Bad Salzdetfurth",
      "type": "Registerbekanntmachung nach dem Umwandlungsgesetz",
      "state": "Niedersachsen",
      "amtsgericht": "Amtsgericht Hildesheim",
      "registernummer": "HRB 208462",
      "registerart": "HRB",
      "company_name": "grünplus GmbH",
      "company_seat": "Bad Salzdetfurth",
      "details": "12.11.2025 (Bekanntmachungsdatum)\n\nNiedersachsen Amtsgericht Hildesheim HRB 208462\nRegisterbekanntmachung nach dem Umwandlungsgesetz 12.11.2025 (Eintragungsdatum)\n\ngrünplus GmbH\nGesellschaft mit beschränkter Haftung\nBad Salzdetfurth\n\nDen Gläubigern der an der Ausgliederung beteiligten Rechtsträger ist, wenn sie binnen sechs Monaten nach dem Tag, an dem die Eintragung der Ausgliederung in das Register des Sitzes desjenigen Rechtsträgers, dessen Gläubiger sie sind, nach § 19 Abs. 3 UmwG als bekannt gemacht gilt, ihren Anspruch nach Grund und Höhe schriftlich anmelden, Sicherheit zu leisten, soweit sie nicht Befriedigung verlangen können. Dieses Recht steht den Gläubigern jedoch nur zu, wenn sie glaubhaft machen, dass durch die Ausgliederung die Erfüllung der Forderung gefährdet wird."
    },
    {
      "date": "2025-11-12",
      "id": "137103",
      "original_text": "Registerbekanntmachung nach dem Umwandlungsgesetz\nNiedersachsen Amtsgericht Hildesheim VR 200993\nBündnis gegen Depression Hildesheim e.V. – Hildesheim",
      "type": "Registerbekanntmachung nach dem Umwandlungsgesetz",
      "state": "Niedersachsen",
      "amtsgericht": "Amtsgericht Hildesheim",
      "registernummer": "VR 200993",
      "registerart": "VR",
      "company_name": "Bündnis gegen Depression Hildesheim e.V.",
      "company_seat": "Hildesheim",
      "details": "12.11.2025 (Bekanntmachungsdatum)\n\nNiedersachsen Amtsgericht Hildesheim VR 200993\nRegisterbekanntmachung nach dem Umwandlungsgesetz 12.11.2025 (Eintragungsdatum)\n\nBündnis gegen Depression Hildesheim e.V.\neingetragener Verein\nHildesheim\n\nDen Gläubigern der an der Verschmelzung beteiligten Rechtsträger ist, wenn sie binnen sechs Monaten nach dem Tag, an dem die Eintragung der Verschmelzung in das Register des Sitzes desjenigen Rechtsträgers, dessen Gläubiger sie sind, nach § 19  Abs.  3 UmwG als bekannt gemacht gilt, ihren Anspruch nach Grund und Höhe schriftlich anmelden, Sicherheit zu leisten, soweit sie nicht Befriedigung verlangen können. Dieses Recht steht den Gläubigern jedoch nur zu, wenn sie glaubhaft machen, dass durch die Verschmelzung die Erfüllung der Forderung gefährdet wird."
    },
    {
      "date": "2025-11-12",
      "id": "137104",
      "original_text": "Registerbekanntmachung nach dem Umwandlungsgesetz\nNiedersachsen Amtsgericht Göttingen HRB 206648\nbootcamp.bike GmbH – Göttingen",
      "type": "Registerbekanntmachung nach dem Umwandlungsgesetz",
      "state": "Niedersachsen",
      "amtsgericht": "Amtsgericht Göttingen",
      "registernummer": "HRB 206648",
      "registerart": "HRB",
      "company_name": "bootcamp.bike GmbH",
      "company_seat": "Göttingen",
      "details": "12.11.2025 (Bekanntmachungsdatum)\n\nNiedersachsen Amtsgericht Göttingen HRB 206648\nRegisterbekanntmachung nach dem Umwandlungsgesetz 12.11.2025 (Eintragungsdatum)\n\nbootcamp.bike GmbH\nGesellschaft mit beschränkter Haftung\nGöttingen\n\nDen Gläubigern der an der Verschmelzung beteiligten Rechtsträger ist, wenn sie binnen sechs Monaten nach dem Tag, an dem die Eintragung der Verschmelzung in das Register des Sitzes desjenigen Rechtsträgers, dessen Gläubiger sie sind, nach § 19  Abs.  3 UmwG als bekannt gemacht gilt, ihren Anspruch nach Grund und Höhe schriftlich anmelden, Sicherheit zu leisten, soweit sie nicht Befriedigung verlangen können. Dieses Recht steht den Gläubigern jedoch nur zu, wenn sie glaubhaft machen, dass durch die Verschmelzung die Erfüllung der Forderung gefährdet wird."
    },
    {
      "date": "2025-11-12",
      "id": "137105",
      "original_text": "Löschungsankündigung\nNiedersachsen Amtsgericht Hannover HRB 226363\nMT Komfort Bau UG (haftungsbeschränkt) – Hannover",
      "type": "Löschungsankündigung",
      "state": "Niedersachsen",
      "amtsgericht": "Amtsgericht Hannover",
      "registernummer": "HRB 226363",
      "registerart": "HRB",
      "company_name": "MT Komfort Bau UG (haftungsbeschränkt)",
      "company_seat": "Hannover",
      "details": "12.11.2025 (Bekanntmachungsdatum)\n\nNiedersachsen Amtsgericht Hannover HRB 226363\nLöschungsankündigung\n\nMT Komfort Bau UG (haftungsbeschränkt)\nGesellschaft mit beschränkter Haftung\nHannover\n\nDas Registergericht beabsichtigt, die Gesellschaft von Amts wegen nach § 394 FamFG zu löschen. Die Frist zur Erhebung eines Widerspruchs ist auf 1 Monat ab dieser Registerbekanntmachung festgesetzt."
    },
    {
      "date": "2025-11-12",
      "id": "137106",
      "original_text": "Registerbekanntmachung nach dem Umwandlungsgesetz\nNiedersachsen Amtsgericht Göttingen HRB 200266\nSartorius Stedim Biotech GmbH – Göttingen",
      "type": "Registerbekanntmachung nach dem Umwandlungsgesetz",
      "state": "Niedersachsen",
      "amtsgericht": "Amtsgericht Göttingen",
      "registernummer": "HRB 200266",
      "registerart": "HRB",
      "company_name": "Sartorius Stedim Biotech GmbH",
      "company_seat": "Göttingen",
      "details": "12.11.2025 (Bekanntmachungsdatum)\n\nNiedersachsen Amtsgericht Göttingen HRB 200266\nRegisterbekanntmachung nach dem Umwandlungsgesetz 12.11.2025 (Eintragungsdatum)\n\nSartorius Stedim Biotech GmbH\nGesellschaft mit beschränkter Haftung\nGöttingen\n\nDen Gläubigern der an der Verschmelzung beteiligten Rechtsträger ist, wenn sie binnen sechs Monaten nach dem Tag, an dem die Eintragung der Verschmelzung in das Register des Sitzes desjenigen Rechtsträgers, dessen Gläubiger sie sind, nach § 19  Abs.  3 UmwG als bekannt gemacht gilt, ihren Anspruch nach Grund und Höhe schriftlich anmelden, Sicherheit zu leisten, soweit sie nicht Befriedigung verlangen können. Dieses Recht steht den Gläubigern jedoch nur zu, wenn sie glaubhaft machen, dass durch die Verschmelzung die Erfüllung der Forderung gefährdet wird."
    },
    {
      "date": "2025-11-12",
      "id": "137107",
      "original_text": "Löschungsankündigung\nNiedersachsen Amtsgericht Oldenburg (Oldenburg) HRB 213791\nNika Verwaltungs UG (haftungsbeschränkt) – Edewecht",
      "type": "Löschungsankündigung",
      "state": "Niedersachsen",
      "amtsgericht": "Amtsgericht Oldenburg (Oldenburg)",
      "registernummer": "HRB 213791",
      "registerart": "HRB",
      "company_name": "Nika Verwaltungs UG (haftungsbeschränkt)",
      "company_seat": "Edewecht",
      "details": "12.11.2025 (Bekanntmachungsdatum)\n\nNiedersachsen Amtsgericht Oldenburg (Oldenburg) HRB 213791\nLöschungsankündigung\n\nNika Verwaltungs UG (haftungsbeschränkt)\nGesellschaft mit beschränkter Haftung\nEdewecht\n\nDas Registergericht beabsichtigt, die Gesellschaft von Amts wegen nach § 394 FamFG zu löschen. Die Frist zur Erhebung eines Widerspruchs ist auf 1 Monat ab dieser Registerbekanntmachung festgesetzt."
    },
    {
      "date": "2025-11-12",
      "id": "137108",
      "original_text": "Registerbekanntmachung nach dem Umwandlungsgesetz\nNiedersachsen Amtsgericht Hildesheim VR 1346\nSozialpsychiatrischer Förderverein Hildesheim e. V. – Hildesheim",
      "type": "Registerbekanntmachung nach dem Umwandlungsgesetz",
      "state": "Niedersachsen",
      "amtsgericht": "Amtsgericht Hildesheim",
      "registernummer": "VR 1346",
      "registerart": "VR",
      "company_name": "Sozialpsychiatrischer Förderverein Hildesheim e. V.",
      "company_seat": "Hildesheim",
      "details": "12.11.2025 (Bekanntmachungsdatum)\n\nNiedersachsen Amtsgericht Hildesheim VR 1346\nRegisterbekanntmachung nach dem Umwandlungsgesetz 12.11.2025 (Eintragungsdatum)\n\nSozialpsychiatrischer Förderverein Hildesheim e. V.\neingetragener Verein\nHildesheim\n\nDen Gläubigern der an der Verschmelzung beteiligten Rechtsträger ist, wenn sie binnen sechs Monaten nach dem Tag, an dem die Eintragung der Verschmelzung in das Register des Sitzes desjenigen Rechtsträgers, dessen Gläubiger sie sind, nach § 19  Abs.  3 UmwG als bekannt gemacht gilt, ihren Anspruch nach Grund und Höhe schriftlich anmelden, Sicherheit zu leisten, soweit sie nicht Befriedigung verlangen können. Dieses Recht steht den Gläubigern jedoch nur zu, wenn sie glaubhaft machen, dass durch die Verschmelzung die Erfüllung der Forderung gefährdet wird."
    },
    {
      "date": "2025-11-12",
      "id": "137109",
      "original_text": "Registerbekanntmachung nach dem Umwandlungsgesetz\nNiedersachsen Amtsgericht Osnabrück HRA 209707\nAlexander Mrohs Consulting e.K. – Hagen a.T.W.",
      "type": "Registerbekanntmachung nach dem Umwandlungsgesetz",
      "state": "Niedersachsen",
      "amtsgericht": "Amtsgericht Osnabrück",
      "registernummer": "HRA 209707",
      "registerart": "HRA",
      "company_name": "Alexander Mrohs Consulting e.K.",
      "company_seat": "Hagen a.T.W.",
      "details": "12.11.2025 (Bekanntmachungsdatum)\n\nNiedersachsen Amtsgericht Osnabrück HRA 209707\nRegisterbekanntmachung nach dem Umwandlungsgesetz 12.11.2025 (Eintragungsdatum)\n\nAlexander Mrohs Consulting e.K.\nEinzelkaufmann / Einzelkauffrau\nHagen a.T.W.\n\nDen Gläubigern der an der Ausgliederung beteiligten Rechtsträger ist, wenn sie binnen sechs Monaten nach dem Tag, an dem die Eintragung der Ausgliederung in das Register des Sitzes desjenigen Rechtsträgers, dessen Gläubiger sie sind, nach § 19 Abs. 3 UmwG als bekannt gemacht gilt, ihren Anspruch nach Grund und Höhe schriftlich anmelden, Sicherheit zu leisten, soweit sie nicht Befriedigung verlangen können. Dieses Recht steht den Gläubigern jedoch nur zu, wenn sie glaubhaft machen, dass durch die Ausgliederung die Erfüllung der Forderung gefährdet wird."
    },
    {
      "date": "2025-11-12",
      "id": "137110",
      "original_text": "Einreichung neuer Dokumente\nNiedersachsen Amtsgericht Hannover HRB 3669\nAUMOVIO Germany GmbH – Hannover",
      "type": "Einreichung neuer Dokumente",
      "state": "Niedersachsen",
      "amtsgericht": "Amtsgericht Hannover",
      "registernummer": "HRB 3669",
      "registerart": "HRB",
      "company_name": "AUMOVIO Germany GmbH",
      "company_seat": "Hannover",
      "details": "12.11.2025 (Bekanntmachungsdatum)\n\nNiedersachsen Amtsgericht Hannover HRB 3669\nEinreichung neuer Dokumente\n\nAUMOVIO Germany GmbH\nGesellschaft mit beschränkter Haftung\nHannover\n\nDie Liste der Mitglieder des Aufsichtsrats wurde beim Registergericht eingereicht."
    },
    {
      "date": "2025-11-12",
      "id": "137111",
      "original_text": "Löschungsankündigung\nRheinland-Pfalz Amtsgericht Mainz HRB 51629\nSkotal UG (haftungsbechränkt) – Mainz",
      "type": "Löschungsankündigung",
      "state": "Rheinland-Pfalz",
      "amtsgericht": "Amtsgericht Mainz",
      "registernummer": "HRB 51629",
      "registerart": "HRB",
      "company_name": "Skotal UG (haftungsbechränkt)",
      "company_seat": "Mainz",
      "details": "12.11.2025 (Bekanntmachungsdatum)\n\nRheinland-Pfalz Amtsgericht Mainz HRB 51629\nLöschungsankündigung\n\nSkotal UG (haftungsbechränkt)\nGesellschaft mit beschränkter Haftung\nMainz\n\nDas Registergericht beabsichtigt die Gesellschaft von Amts wegen nach § 394 FamFG zu löschen. Die Frist zur Erhebung eines Widerspruchs ist auf 1 Monat festgesetzt."
    },
    {
      "date": "2025-11-12",
      "id": "137112",
      "original_text": "Registerbekanntmachung nach dem Umwandlungsgesetz\nRheinland-Pfalz Amtsgericht Koblenz HRB 26177\nHARIBO International GmbH – Grafschaft",
      "type": "Registerbekanntmachung nach dem Umwandlungsgesetz",
      "state": "Rheinland-Pfalz",
      "amtsgericht": "Amtsgericht Koblenz",
      "registernummer": "HRB 26177",
      "registerart": "HRB",
      "company_name": "HARIBO International GmbH",
      "company_seat": "Grafschaft",
      "details": "12.11.2025 (Bekanntmachungsdatum)\n\nRheinland-Pfalz Amtsgericht Koblenz HRB 26177\nRegisterbekanntmachung nach dem Umwandlungsgesetz 12.11.2025 (Eintragungsdatum)\n\nHARIBO International GmbH\nGesellschaft mit beschränkter Haftung\nGrafschaft\n\nAls nicht eingetragen wird veröffentlicht: Den Gläubigern der an der Umwandlung beteiligten Rechtsträger ist, wenn sie binnen sechs Monaten nach dem Tag, an dem die Eintragung der Umwandlung in das Register des Sitzes desjenigen Rechtsträgers, dessen Gläubiger sie sind, nach § 19 Abs. 3 UmwG als bekannt gemacht gilt, ihren Anspruch nach Grund und Höhe schriftlich anmelden, Sicherheit zu leisten, soweit sie nicht Befriedigung verlangen können. Dieses Recht steht den Gläubigern jedoch nur zu, wenn sie glaubhaft machen, dass durch die Umwandlung die Erfüllung der Forderung gefährdet wird."
    },
    {
      "date": "2025-11-12",
      "id": "137113",
      "original_text": "Sonstige Registerbekanntmachung\nRheinland-Pfalz Amtsgericht Montabaur HRB 28722\nSTK Turbo Technik GmbH – Hamm",
      "type": "Sonstige Registerbekanntmachung",
      "state": "Rheinland-Pfalz",
      "amtsgericht": "Amtsgericht Montabaur",
      "registernummer": "HRB 28722",
      "registerart": "HRB",
      "company_name": "STK Turbo Technik GmbH",
      "company_seat": "Hamm",
      "details": "12.11.2025 (Bekanntmachungsdatum)\n\nRheinland-Pfalz Amtsgericht Montabaur HRB 28722\nSonstige Registerbekanntmachung\n\nSTK Turbo Technik GmbH\nGesellschaft mit beschränkter Haftung\nHamm\n\nDas Registergericht beabsichtigt den Geschäftsführer von Amts wegen nach § 395 FamFG zu löschen. Die Frist zur Erhebung eines Widerspruchs ist auf einen Monat festgesetzt."
    },
    {
      "date": "2025-11-12",
      "id": "137114",
      "original_text": "Löschungsankündigung\nRheinland-Pfalz Amtsgericht Montabaur HRB 28722\nSTK Turbo Technik GmbH – Hamm",
      "type": "Löschungsankündigung",
      "state": "Rheinland-Pfalz",
      "amtsgericht": "Amtsgericht Montabaur",
      "registernummer": "HRB 28722",
      "registerart": "HRB",
      "company_name": "STK Turbo Technik GmbH",
      "company_seat": "Hamm",
      "details": "12.11.2025 (Bekanntmachungsdatum)\n\nRheinland-Pfalz Amtsgericht Montabaur HRB 28722\nLöschungsankündigung\n\nSTK Turbo Technik GmbH\nGesellschaft mit beschränkter Haftung\nHamm\n\nDas Registergericht beabsichtigt die Gesellschaft von Amts wegen nach § 394 FamFG zu löschen. Die Frist zur Erhebung eines Widerspruchs ist auf einen Monat festgesetzt."
    },
    {
      "date": "2025-11-12",
      "id": "137115",
      "original_text": "Registerbekanntmachung nach dem Umwandlungsgesetz\nNordrhein-Westfalen Amtsgericht Düsseldorf HRA 28442\nPaxos H6 I GmbH & Co. KG – Düsseldorf",
      "type": "Registerbekanntmachung nach dem Umwandlungsgesetz",
      "state": "Nordrhein-Westfalen",
      "amtsgericht": "Amtsgericht Düsseldorf",
      "registernummer": "HRA 28442",
      "registerart": "HRA",
      "company_name": "Paxos H6 I GmbH & Co. KG",
      "company_seat": "Düsseldorf",
      "details": "12.11.2025 (Bekanntmachungsdatum)\n\nNordrhein-Westfalen Amtsgericht Düsseldorf HRA 28442\nRegisterbekanntmachung nach dem Umwandlungsgesetz 12.11.2025 (Eintragungsdatum)\n\nPaxos H6 I GmbH & Co. KG\nKommanditgesellschaft\nDüsseldorf\n\nDen Gläubigern der an der Ausgliederung beteiligten Rechtsträger ist, wenn sie binnen sechs Monaten nach dem Tag, an dem die Eintragung der Ausgliederung in das Register des Sitzes desjenigen Rechtsträgers, dessen Gläubiger sie sind, nach § 19 Absatz 3 UmwG als bekanntgemacht gilt, ihren Anspruch nach Grund und Höhe schriftlich anmelden, Sicherheit zu leisten, soweit sie nicht Befriedigung verlangen können. Dieses Recht steht den Gläubigern jedoch nur zu, wenn sie glaubhaft machen, dass durch die Ausgliederung die Erfüllung ihrer Forderung gefährdet wird."
    },
    {
      "date": "2025-11-12",
      "id": "137116",
      "original_text": "Registerbekanntmachung nach dem Umwandlungsgesetz\nNordrhein-Westfalen Amtsgericht Düsseldorf HRB 109252\ncosy home Vermögensverwaltung GmbH – Düsseldorf",
      "type": "Registerbekanntmachung nach dem Umwandlungsgesetz",
      "state": "Nordrhein-Westfalen",
      "amtsgericht": "Amtsgericht Düsseldorf",
      "registernummer": "HRB 109252",
      "registerart": "HRB",
      "company_name": "cosy home Vermögensverwaltung GmbH",
      "company_seat": "Düsseldorf",
      "details": "12.11.2025 (Bekanntmachungsdatum)\n\nNordrhein-Westfalen Amtsgericht Düsseldorf HRB 109252\nRegisterbekanntmachung nach dem Umwandlungsgesetz 12.11.2025 (Eintragungsdatum)\n\ncosy home Vermögensverwaltung GmbH\nGesellschaft mit beschränkter Haftung\nDüsseldorf\n\nDen Gläubigern der an der formwechselnden Umwandlung beteiligten Rechtsträger ist, wenn sie binnen sechs Monaten nach dem Tag, an dem die Eintragung der formwechselnden Umwandlung in das Register des Sitzes desjenigen Rechtsträgers, dessen Gläubiger sie sind, nach § 19 Absatz 3 UmwG als bekanntgemacht gilt, ihren Anspruch nach Grund und Höhe schriftlich anmelden, Sicherheit zu leisten, soweit sie nicht Befriedigung verlangen können. Dieses Recht steht den Gläubigern jedoch nur zu, wenn sie glaubhaft machen, dass durch die formwechselnden Umwandlung die Erfüllung ihrer Forderung gefährdet wird."
    },
    {
      "date": "2025-11-12",
      "id": "137117",
      "original_text": "Einreichung neuer Dokumente\nNordrhein-Westfalen Amtsgericht Köln HRB 60463\nGFU Cyrus AG – Köln",
      "type": "Einreichung neuer Dokumente",
      "state": "Nordrhein-Westfalen",
      "amtsgericht": "Amtsgericht Köln",
      "registernummer": "HRB 60463",
      "registerart": "HRB",
      "company_name": "GFU Cyrus AG",
      "company_seat": "Köln",
      "details": "12.11.2025 (Bekanntmachungsdatum)\n\nNordrhein-Westfalen Amtsgericht Köln HRB 60463\nEinreichung neuer Dokumente\n\nGFU Cyrus AG\nAktiengesellschaft\nKöln\n\nDem Registergericht ist eine Liste der Mitglieder des Aufsichtsrates eingereicht worden."
    },
    {
      "date": "2025-11-12",
      "id": "137118",
      "original_text": "Registerbekanntmachung nach dem Umwandlungsgesetz\nNordrhein-Westfalen Amtsgericht Düsseldorf HRA 28340\nML-Immobilien e.K. – Düsseldorf",
      "type": "Registerbekanntmachung nach dem Umwandlungsgesetz",
      "state": "Nordrhein-Westfalen",
      "amtsgericht": "Amtsgericht Düsseldorf",
      "registernummer": "HRA 28340",
      "registerart": "HRA",
      "company_name": "ML-Immobilien e.K.",
      "company_seat": "Düsseldorf",
      "details": "12.11.2025 (Bekanntmachungsdatum)\n\nNordrhein-Westfalen Amtsgericht Düsseldorf HRA 28340\nRegisterbekanntmachung nach dem Umwandlungsgesetz 12.11.2025 (Eintragungsdatum)\n\nML-Immobilien e.K.\nEinzelkaufmann / Einzelkauffrau\nDüsseldorf\n\nDen Gläubigern der an der Ausgliederung beteiligten Rechtsträger ist, wenn sie binnen sechs Monaten nach dem Tag, an dem die Eintragung der Ausgliederung in das Register des Sitzes desjenigen Rechtsträgers, dessen Gläubiger sie sind, nach § 19 Absatz 3 UmwG als bekanntgemacht gilt, ihren Anspruch nach Grund und Höhe schriftlich anmelden, Sicherheit zu leisten, soweit sie nicht Befriedigung verlangen können. Dieses Recht steht den Gläubigern jedoch nur zu, wenn sie glaubhaft machen, dass durch die Ausgliederung die Erfüllung ihrer Forderung gefährdet wird."
    },
    {
      "date": "2025-11-12",
      "id": "137119",
      "original_text": "Löschungsankündigung\nNordrhein-Westfalen Amtsgericht Düsseldorf HRB 86996\nAbelius Capital AG – Düsseldorf",
      "type": "Löschungsankündigung",
      "state": "Nordrhein-Westfalen",
      "amtsgericht": "Amtsgericht Düsseldorf",
      "registernummer": "HRB 86996",
      "registerart": "HRB",
      "company_name": "Abelius Capital AG",
      "company_seat": "Düsseldorf",
      "details": "12.11.2025 (Bekanntmachungsdatum)\n\nNordrhein-Westfalen Amtsgericht Düsseldorf HRB 86996\nLöschungsankündigung\n\nAbelius Capital AG\nAktiengesellschaft\nDüsseldorf\n\nDas Registergericht beabsichtigt die Gesellschaft von Amts wegen nach § 394 FamFG zu löschen. Die Frist zur Erhebung eines Widerspruchs ist auf 3 Wochen festgesetzt.\n\nRechtsbehelfsbelehrung:\nDas Widerspruchsrecht steht jedem zu, der an der Unterlassung der Löschung ein berechtigtes Interesse hat. Der Widerspruch ist bei dem Amtsgericht Düsseldorf -Registergericht-, Werdener Straße 1, 40227 Düsseldorf schriftlich in deutscher Sprache oder zur Niederschrift der Geschäftsstelle einzulegen. Der Widerspruch kann auch zur Niederschrift der Geschäftsstelle eines jeden Amtsgerichtes abgegeben werden. Die Einlegung ist auch durch Übertragung eines elektronischen Dokuments an die elektronische Poststelle des Gerichts möglich. Das elektronische Dokument muss für die Bearbeitung durch das Gericht geeignet und mit einer qualifizierten elektronischen Signatur der verantwortenden Person versehen sein oder von der verantwortenden Person signiert und auf einem sicheren Übermittlungsweg gemäß § 130a ZPO nach näherer Maßgabe der Verordnung über die technischen Rahmenbedingungen des elektronischen Rechtsverkehrs und über das besondere elektronische Behördenpostfach (BGBl. I, S.3803) eingereicht werden. Weitere Informationen erhalten Sie auf der Internetseite www.justiz.de.\nDer Widerspruch muss spätestens innerhalb der gesetzten Frist nach dem Datum der Bekanntmachung der Löschungsankündigung bei dem Amtsgericht - Registergericht - Düsseldorf eingegangen sein.  Dies gilt auch dann, wenn der Widerspruch zur Niederschrift der Geschäftsstelle eines anderen Amtsgerichtes abgegeben wurde. Die Frist beginnt mit dem Tage der Bekanntmachung der Löschungsankündigung in dem für die Bekanntmachung der Eintragungen in das Handelsregister bestimmten elektronischen Informations- und Kommunikationssystem nach § 10 des Handelsgesetzbuches. Fällt das Ende der Frist auf einen Sonntag, einen allgemeinen Feiertag oder Sonnabend, so endet die Frist mit Ablauf des nächsten Werktages.\nDer Widerspruch muss die Bezeichnung der angefochtenen Löschungsankündigung sowie die Erklärung enthalten, dass Widerspruch gegen diese Löschungsankündigung eingelegt wird. Er ist zu unterzeichnen und soll begründet werden."
    },
    {
      "date": "2025-11-12",
      "id": "137120",
      "original_text": "Sonstige Registerbekanntmachung\nNordrhein-Westfalen Amtsgericht Paderborn HRB 11090\nDelbrücker Energie- und Kommunalbetriebe GmbH – Delbrück",
      "type": "Sonstige Registerbekanntmachung",
      "state": "Nordrhein-Westfalen",
      "amtsgericht": "Amtsgericht Paderborn",
      "registernummer": "HRB 11090",
      "registerart": "HRB",
      "company_name": "Delbrücker Energie- und Kommunalbetriebe GmbH",
      "company_seat": "Delbrück",
      "details": "12.11.2025 (Bekanntmachungsdatum)\n\nNordrhein-Westfalen Amtsgericht Paderborn HRB 11090\nSonstige Registerbekanntmachung\n\nDelbrücker Energie- und Kommunalbetriebe GmbH\nGesellschaft mit beschränkter Haftung\nDelbrück\n\nDem Registergericht ist eine neue Liste der Mitglieder des Aufsichtsrates eingereicht worden."
    },
    {
      "date": "2025-11-12",
      "id": "137121",
      "original_text": "Löschungsankündigung\nNordrhein-Westfalen Amtsgericht Neuss HRB 20433\nLa-Volpe UG (haftungsbeschränkt) – Kaarst",
      "type": "Löschungsankündigung",
      "state": "Nordrhein-Westfalen",
      "amtsgericht": "Amtsgericht Neuss",
      "registernummer": "HRB 20433",
      "registerart": "HRB",
      "company_name": "La-Volpe UG (haftungsbeschränkt)",
      "company_seat": "Kaarst",
      "details": "12.11.2025 (Bekanntmachungsdatum)\n\nNordrhein-Westfalen Amtsgericht Neuss HRB 20433\nLöschungsankündigung 12.11.2025 (Eintragungsdatum)\n\nLa-Volpe UG (haftungsbeschränkt)\nGesellschaft mit beschränkter Haftung\nKaarst\n\nDas Registergericht beabsichtigt die Gesellschaft wegen Vermögenslosigkeit aufgrund des § 394 Abs. 1 FamFG zu löschen. Frist zur Geltendmachung eines Widerspruchs: 1 Monat.\nRechtsbehelfsbelehrung:\nGegen diese Verfügung können Sie Widerspruch einlegen.\nDer Widerspruch ist bei dem Amtsgericht Neuss - Registergericht -, Breite Str. 48, 41460 Neuss schriftlich in deutscher Sprache oder zur Niederschrift der Geschäftsstelle einzulegen.\nDer Widerspruch kann auch zur Niederschrift der Geschäftsstelle eines jeden Amtsgerichtes abgegeben werden.\nDie Einlegung ist auch durch Übertragung eines elektronischen Dokuments an die elektronische Poststelle des Gerichts möglich. Das elektronische Dokument muss für die Bearbeitung durch das Gericht geeignet und mit einer qualifizierten elektronischen Signatur der verantwortenden Person versehen sein oder von der verantwortenden Person signiert und auf einem sicheren Übermittlungsweg gemäß § 130a ZPO nach näherer Maßgabe der Verordnung über die technischen Rahmenbedingungen des elektronischen Rechtsverkehrs und über das besondere elektronische Behördenpostfach (BGBl. I, S.3803) eingereicht werden. Weitere Informationen erhalten Sie auf der Internetseite www.justiz.de.\nDer Widerspruch muss spätestens innerhalb der gesetzten Frist nach der schriftlichen Bekanntgabe der Verfügung bei dem Amtsgericht - Registergericht - Neuss eingegangen sein. Dies gilt auch dann, wenn der Widerspruch zur Niederschrift der Geschäftsstelle eines anderen Amtsgerichtes abgegeben wurde. Die Frist beginnt mit der schriftlichen Bekanntgabe der Verfügung. Die Bekanntgabe ist entweder durch Zustellung oder am dritten Tage nach Aufgabe zur Post bewirkt. Fällt das Ende der Frist auf einen Sonntag, einen allgemeinen Feiertag oder Sonnabend, so endet die Frist mit Ablauf des nächsten Werktages.\nDer Widerspruch muss die Bezeichnung der angefochtenen Verfügung sowie die Erklärung enthalten, dass Widerspruch gegen diese Verfügung eingelegt wird. Er ist zu unterzeichnen und soll begründet werden."
    },
    {
      "date": "2025-11-12",
      "id": "137122",
      "original_text": "Einreichung neuer Dokumente\nNordrhein-Westfalen Amtsgericht Dortmund HRB 19731\nroTeg AG – Dortmund",
      "type": "Einreichung neuer Dokumente",
      "state": "Nordrhein-Westfalen",
      "amtsgericht": "Amtsgericht Dortmund",
      "registernummer": "HRB 19731",
      "registerart": "HRB",
      "company_name": "roTeg AG",
      "company_seat": "Dortmund",
      "details": "12.11.2025 (Bekanntmachungsdatum)\n\nNordrhein-Westfalen Amtsgericht Dortmund HRB 19731\nEinreichung neuer Dokumente\n\nroTeg AG\nAktiengesellschaft\nDortmund\n\nDem Registergericht ist eine neue Liste der Mitglieder des Aufsichtsrates eingereicht worden."
    },
    {
      "date": "2025-11-12",
      "id": "137123",
      "original_text": "Löschungsankündigung\nNordrhein-Westfalen Amtsgericht Wuppertal HRB 33866\nastec GmbH – Velbert",
      "type": "Löschungsankündigung",
      "state": "Nordrhein-Westfalen",
      "amtsgericht": "Amtsgericht Wuppertal",
      "registernummer": "HRB 33866",
      "registerart": "HRB",
      "company_name": "astec GmbH",
      "company_seat": "Velbert",
      "details": "12.11.2025 (Bekanntmachungsdatum)\n\nNordrhein-Westfalen Amtsgericht Wuppertal HRB 33866\nLöschungsankündigung 11.11.2025 (Eintragungsdatum)\n\nastec GmbH\nGesellschaft mit beschränkter Haftung\nVelbert\n\nDas Registergericht beabsichtigt die Gesellschaft von Amts wegen nach § 394 FamFG zu löschen. Die Frist zur Erhebung eines Widerspruchs ist auf einen Monat festgesetzt."
    },
    {
      "date": "2025-11-12",
      "id": "137124",
      "original_text": "Einreichung neuer Dokumente\nNordrhein-Westfalen Amtsgericht Duisburg HRB 277\nCarl Spaeter Gesellschaft mit beschränkter Haftung – Duisburg",
      "type": "Einreichung neuer Dokumente",
      "state": "Nordrhein-Westfalen",
      "amtsgericht": "Amtsgericht Duisburg",
      "registernummer": "HRB 277",
      "registerart": "HRB",
      "company_name": "Carl Spaeter Gesellschaft mit beschränkter Haftung",
      "company_seat": "Duisburg",
      "details": "12.11.2025 (Bekanntmachungsdatum)\n\nNordrhein-Westfalen Amtsgericht Duisburg HRB 277\nEinreichung neuer Dokumente\n\nCarl Spaeter Gesellschaft mit beschränkter Haftung\nGesellschaft mit beschränkter Haftung\nDuisburg\n\nDem Registergericht ist eine Liste der Mitglieder des Aufsichtsrates eingereicht worden."
    },
    {
      "date": "2025-11-12",
      "id": "137125",
      "original_text": "Registerbekanntmachung nach dem Umwandlungsgesetz\nNordrhein-Westfalen Amtsgericht Iserlohn HRB 5247\nhagebaumarkt Arens und Hilgert GmbH – Neuenrade",
      "type": "Registerbekanntmachung nach dem Umwandlungsgesetz",
      "state": "Nordrhein-Westfalen",
      "amtsgericht": "Amtsgericht Iserlohn",
      "registernummer": "HRB 5247",
      "registerart": "HRB",
      "company_name": "hagebaumarkt Arens und Hilgert GmbH",
      "company_seat": "Neuenrade",
      "details": "12.11.2025 (Bekanntmachungsdatum)\n\nNordrhein-Westfalen Amtsgericht Iserlohn HRB 5247\nRegisterbekanntmachung nach dem Umwandlungsgesetz 11.11.2025 (Eintragungsdatum)\n\nhagebaumarkt Arens und Hilgert GmbH\nGesellschaft mit beschränkter Haftung\nNeuenrade\n\nDen Gläubigern der an der Abspaltung beteiligten Rechtsträger ist, wenn sie binnen sechs Monaten nach dem Tag, an dem die Eintragung der Abspaltung in das Register des Sitzes desjenigen Rechtsträgers, dessen Gläubiger sie sind, nach § 19 Absatz 3 UmwG als bekanntgemacht gilt, ihren Anspruch nach Grund und Höhe schriftlich anmelden, Sicherheit zu leisten, soweit sie nicht Befriedigung verlangen können. Dieses Recht steht den Gläubigern jedoch nur zu, wenn sie glaubhaft machen, dass durch die Abspaltung die Erfüllung ihrer Forderung gefährdet wird."
    },
    {
      "date": "2025-11-12",
      "id": "137126",
      "original_text": "Registerbekanntmachung nach dem Umwandlungsgesetz\nNordrhein-Westfalen Amtsgericht Dortmund HRA 10914\nHMF Food Production GmbH & Co. KG. – Dortmund",
      "type": "Registerbekanntmachung nach dem Umwandlungsgesetz",
      "state": "Nordrhein-Westfalen",
      "amtsgericht": "Amtsgericht Dortmund",
      "registernummer": "HRA 10914",
      "registerart": "HRA",
      "company_name": "HMF Food Production GmbH & Co. KG.",
      "company_seat": "Dortmund",
      "details": "12.11.2025 (Bekanntmachungsdatum)\n\nNordrhein-Westfalen Amtsgericht Dortmund HRA 10914\nRegisterbekanntmachung nach dem Umwandlungsgesetz 12.11.2025 (Eintragungsdatum)\n\nHMF Food Production GmbH & Co. KG.\nKommanditgesellschaft\nDortmund\n\nDen Gläubigern der an der formwechselnden Umwandlung beteiligten Rechtsträger ist, wenn sie binnen sechs Monaten nach dem Tag, an dem die Eintragung der formwechselnden Umwandlung in das Register des Sitzes derjenigen Rechtsträger deren Gläubiger sie sind, nach § 19 Absatz 3 UmwG als bekanntgemacht gilt, ihren Anspruch nach Grund und Höhe schriftlich anmelden, Sicherheit zu leisten, soweit sie nicht Befriedigung verlangen können. Dieses Recht steht den Gläubigern jedoch nur zu, wenn sie glaubhaft machen, dass durch die formwechselnden Umwandlung die Erfüllung ihrer Forderung gefährdet wird."
    },
    {
      "date": "2025-11-12",
      "id": "137127",
      "original_text": "Registerbekanntmachung nach dem Umwandlungsgesetz\nNordrhein-Westfalen Amtsgericht Dortmund HRA 8215\nMERX Bellavie GmbH & Co. KG – Dortmund",
      "type": "Registerbekanntmachung nach dem Umwandlungsgesetz",
      "state": "Nordrhein-Westfalen",
      "amtsgericht": "Amtsgericht Dortmund",
      "registernummer": "HRA 8215",
      "registerart": "HRA",
      "company_name": "MERX Bellavie GmbH & Co. KG",
      "company_seat": "Dortmund",
      "details": "12.11.2025 (Bekanntmachungsdatum)\n\nNordrhein-Westfalen Amtsgericht Dortmund HRA 8215\nRegisterbekanntmachung nach dem Umwandlungsgesetz 12.11.2025 (Eintragungsdatum)\n\nMERX Bellavie GmbH & Co. KG\nKommanditgesellschaft\nDortmund\n\nDen Gläubigern der an der formwechselnden Umwandlung beteiligten Rechtsträger ist, wenn sie binnen sechs Monaten nach dem Tag, an dem die Eintragung der formwechselnden Umwandlung in das Register des Sitzes desjenigen Rechtsträgers, dessen Gläubiger sie sind, nach § 19 Absatz 3 UmwG als bekanntgemacht gilt, ihren Anspruch nach Grund und Höhe schriftlich anmelden, Sicherheit zu leisten, soweit sie nicht Befriedigung verlangen können. Dieses Recht steht den Gläubigern jedoch nur zu, wenn sie glaubhaft machen, dass durch die formwechselnden Umwandlung die Erfüllung ihrer Forderung gefährdet wird."
    },
    {
      "date": "2025-11-12",
      "id": "137128",
      "original_text": "Registerbekanntmachung nach dem Umwandlungsgesetz\nNordrhein-Westfalen Amtsgericht Gelsenkirchen HRB 7201\nHamburger Rieger Gelsenkirchen Verwaltungs GmbH – Gelsenkirchen",
      "type": "Registerbekanntmachung nach dem Umwandlungsgesetz",
      "state": "Nordrhein-Westfalen",
      "amtsgericht": "Amtsgericht Gelsenkirchen",
      "registernummer": "HRB 7201",
      "registerart": "HRB",
      "company_name": "Hamburger Rieger Gelsenkirchen Verwaltungs GmbH",
      "company_seat": "Gelsenkirchen",
      "details": "12.11.2025 (Bekanntmachungsdatum)\n\nNordrhein-Westfalen Amtsgericht Gelsenkirchen HRB 7201\nRegisterbekanntmachung nach dem Umwandlungsgesetz 12.11.2025 (Eintragungsdatum)\n\nHamburger Rieger Gelsenkirchen Verwaltungs GmbH\nGesellschaft mit beschränkter Haftung\nGelsenkirchen\n\nDen Gläubigern der an der Verschmelzung beteiligten Rechtsträger ist, wenn sie binnen sechs Monaten nach dem Tag, an dem die Eintragung der Verschmelzung in das Register des Sitzes desjenigen Rechtsträgers, dessen Gläubiger sie sind, nach § 19 Absatz 3 UmwG als bekanntgemacht gilt, ihren Anspruch nach Grund und Höhe schriftlich anmelden, Sicherheit zu leisten, soweit sie nicht Befriedigung verlangen können. Dieses Recht steht den Gläubigern jedoch nur zu, wenn sie glaubhaft machen, dass durch die Verschmelzung die Erfüllung ihrer Forderung gefährdet wird."
    },
    {
      "date": "2025-11-12",
      "id": "137129",
      "original_text": "Einreichung neuer Dokumente\nNordrhein-Westfalen Amtsgericht Düren HRB 61\nDürener Bauverein Aktiengesellschaft – Düren",
      "type": "Einreichung neuer Dokumente",
      "state": "Nordrhein-Westfalen",
      "amtsgericht": "Amtsgericht Düren",
      "registernummer": "HRB 61",
      "registerart": "HRB",
      "company_name": "Dürener Bauverein Aktiengesellschaft",
      "company_seat": "Düren",
      "details": "12.11.2025 (Bekanntmachungsdatum)\n\nNordrhein-Westfalen Amtsgericht Düren HRB 61\nEinreichung neuer Dokumente 12.11.2025 (Eintragungsdatum)\n\nDürener Bauverein Aktiengesellschaft\nAktiengesellschaft\nDüren\n\nDem Registergericht ist eine neue Liste der Mitglieder des Aufsichtsrates eingereicht worden."
    },
    {
      "date": "2025-11-12",
      "id": "137130",
      "original_text": "Einreichung neuer Dokumente\nNordrhein-Westfalen Amtsgericht Düsseldorf HRB 68906\nKFM Deutsche Mittelstand AG – Düsseldorf",
      "type": "Einreichung neuer Dokumente",
      "state": "Nordrhein-Westfalen",
      "amtsgericht": "Amtsgericht Düsseldorf",
      "registernummer": "HRB 68906",
      "registerart": "HRB",
      "company_name": "KFM Deutsche Mittelstand AG",
      "company_seat": "Düsseldorf",
      "details": "12.11.2025 (Bekanntmachungsdatum)\n\nNordrhein-Westfalen Amtsgericht Düsseldorf HRB 68906\nEinreichung neuer Dokumente 12.11.2025 (Eintragungsdatum)\n\nKFM Deutsche Mittelstand AG\nAktiengesellschaft\nDüsseldorf\n\nDem Registergericht ist eine Liste der Mitglieder des Aufsichtsrates eingereicht worden."
    },
    {
      "date": "2025-11-12",
      "id": "137131",
      "original_text": "Registerbekanntmachung nach dem Umwandlungsgesetz\nNordrhein-Westfalen Amtsgericht Gelsenkirchen HRB 19326\nHamburger Rieger Gelsenkirchen GmbH – Gelsenkirchen",
      "type": "Registerbekanntmachung nach dem Umwandlungsgesetz",
      "state": "Nordrhein-Westfalen",
      "amtsgericht": "Amtsgericht Gelsenkirchen",
      "registernummer": "HRB 19326",
      "registerart": "HRB",
      "company_name": "Hamburger Rieger Gelsenkirchen GmbH",
      "company_seat": "Gelsenkirchen",
      "details": "12.11.2025 (Bekanntmachungsdatum)\n\nNordrhein-Westfalen Amtsgericht Gelsenkirchen HRB 19326\nRegisterbekanntmachung nach dem Umwandlungsgesetz 12.11.2025 (Eintragungsdatum)\n\nHamburger Rieger Gelsenkirchen GmbH\nGesellschaft mit beschränkter Haftung\nGelsenkirchen\n\nDen Gläubigern der an der Verschmelzung beteiligten Rechtsträger ist, wenn sie binnen sechs Monaten nach dem Tag, an dem die Eintragung der Verschmelzung in das Register des Sitzes desjenigen Rechtsträgers, dessen Gläubiger sie sind, nach § 19 Absatz 3 UmwG als bekanntgemacht gilt, ihren Anspruch nach Grund und Höhe schriftlich anmelden, Sicherheit zu leisten, soweit sie nicht Befriedigung verlangen können. Dieses Recht steht den Gläubigern jedoch nur zu, wenn sie glaubhaft machen, dass durch die Verschmelzung die Erfüllung ihrer Forderung gefährdet wird."
    },
    {
      "date": "2025-11-12",
      "id": "137132",
      "original_text": "Löschungsankündigung\nNordrhein-Westfalen Amtsgericht Wuppertal HRB 15935\nGerd Reimann GmbH – Solingen",
      "type": "Löschungsankündigung",
      "state": "Nordrhein-Westfalen",
      "amtsgericht": "Amtsgericht Wuppertal",
      "registernummer": "HRB 15935",
      "registerart": "HRB",
      "company_name": "Gerd Reimann GmbH",
      "company_seat": "Solingen",
      "details": "12.11.2025 (Bekanntmachungsdatum)\n\nNordrhein-Westfalen Amtsgericht Wuppertal HRB 15935\nLöschungsankündigung\n\nGerd Reimann GmbH\nGesellschaft mit beschränkter Haftung\nSolingen\n\nDas Registergericht beabsichtigt die Gesellschaft von Amts wegen nach § 394 FamFG zu löschen. Die Frist zur Erhebung eines Widerspruchs ist auf einen Monat festgesetzt."
    },
    {
      "date": "2025-11-12",
      "id": "137133",
      "original_text": "Löschungsankündigung\nNordrhein-Westfalen Amtsgericht Recklinghausen HRB 8920\nGholam-Zadah GmbH – Recklinghausen",
      "type": "Löschungsankündigung",
      "state": "Nordrhein-Westfalen",
      "amtsgericht": "Amtsgericht Recklinghausen",
      "registernummer": "HRB 8920",
      "registerart": "HRB",
      "company_name": "Gholam-Zadah GmbH",
      "company_seat": "Recklinghausen",
      "details": "12.11.2025 (Bekanntmachungsdatum)\n\nNordrhein-Westfalen Amtsgericht Recklinghausen HRB 8920\nLöschungsankündigung\n\nGholam-Zadah GmbH\nGesellschaft mit beschränkter Haftung\nRecklinghausen\n\nDas Registergericht beabsichtigt die Gesellschaft von Amts wegen nach § 394 FamFG zu löschen. Die Frist zur Erhebung eines Widerspruchs ist auf drei Monate festgesetzt."
    },
    {
      "date": "2025-11-12",
      "id": "137134",
      "original_text": "Löschungsankündigung\nNordrhein-Westfalen Amtsgericht Kleve HRB 15887\nRMS Reitsportmesse Stuttgart UG (haftungsbeschränkt) – Xanten",
      "type": "Löschungsankündigung",
      "state": "Nordrhein-Westfalen",
      "amtsgericht": "Amtsgericht Kleve",
      "registernummer": "HRB 15887",
      "registerart": "HRB",
      "company_name": "RMS Reitsportmesse Stuttgart UG (haftungsbeschränkt)",
      "company_seat": "Xanten",
      "details": "12.11.2025 (Bekanntmachungsdatum)\n\nNordrhein-Westfalen Amtsgericht Kleve HRB 15887\nLöschungsankündigung\n\nRMS Reitsportmesse Stuttgart UG (haftungsbeschränkt)\nGesellschaft mit beschränkter Haftung\nXanten\n\nDas Registergericht beabsichtigt die Gesellschaft von Amts wegen nach § 394 FamFG zu löschen. Die Frist zur Erhebung eines Widerspruchs ist auf einen Monat festgesetzt."
    },
    {
      "date": "2025-11-12",
      "id": "137135",
      "original_text": "Registerbekanntmachung nach dem Umwandlungsgesetz\nNordrhein-Westfalen Amtsgericht Aachen HRB 21392\nScasa GmbH – Aachen",
      "type": "Registerbekanntmachung nach dem Umwandlungsgesetz",
      "state": "Nordrhein-Westfalen",
      "amtsgericht": "Amtsgericht Aachen",
      "registernummer": "HRB 21392",
      "registerart": "HRB",
      "company_name": "Scasa GmbH",
      "company_seat": "Aachen",
      "details": "12.11.2025 (Bekanntmachungsdatum)\n\nNordrhein-Westfalen Amtsgericht Aachen HRB 21392\nRegisterbekanntmachung nach dem Umwandlungsgesetz 12.11.2025 (Eintragungsdatum)\n\nScasa GmbH\nGesellschaft mit beschränkter Haftung\nAachen\n\nDen Gläubigern der an der Verschmelzung beteiligten Rechtsträger ist, wenn sie binnen sechs Monaten nach dem Tag, an dem die Eintragung der Verschmelzung in das Register des Sitzes derjenigen Rechtsträger deren Gläubiger sie sind, nach § 19 Absatz 3 UmwG als bekanntgemacht gilt, ihren Anspruch nach Grund und Höhe schriftlich anmelden, Sicherheit zu leisten, soweit sie nicht Befriedigung verlangen können. Dieses Recht steht den Gläubigern jedoch nur zu, wenn sie glaubhaft machen, dass durch die Verschmelzung die Erfüllung ihrer Forderung gefährdet wird."
    },
    {
      "date": "2025-11-12",
      "id": "137136",
      "original_text": "Löschungsankündigung\nNordrhein-Westfalen Amtsgericht Recklinghausen HRB 9195\nCassemu GmbH – Herten",
      "type": "Löschungsankündigung",
      "state": "Nordrhein-Westfalen",
      "amtsgericht": "Amtsgericht Recklinghausen",
      "registernummer": "HRB 9195",
      "registerart": "HRB",
      "company_name": "Cassemu GmbH",
      "company_seat": "Herten",
      "details": "12.11.2025 (Bekanntmachungsdatum)\n\nNordrhein-Westfalen Amtsgericht Recklinghausen HRB 9195\nLöschungsankündigung\n\nCassemu GmbH\nGesellschaft mit beschränkter Haftung\nHerten\n\nDas Registergericht beabsichtigt die Gesellschaft von Amts wegen nach § 394 FamFG zu löschen. Die Frist zur Erhebung eines Widerspruchs ist auf drei Monate festgesetzt."
    },
    {
      "date": "2025-11-12",
      "id": "137137",
      "original_text": "Löschungsankündigung\nNordrhein-Westfalen Amtsgericht Köln HRB 103362\nEl Recado UG (haftungsbeschränkt) – Köln",
      "type": "Löschungsankündigung",
      "state": "Nordrhein-Westfalen",
      "amtsgericht": "Amtsgericht Köln",
      "registernummer": "HRB 103362",
      "registerart": "HRB",
      "company_name": "El Recado UG (haftungsbeschränkt)",
      "company_seat": "Köln",
      "details": "12.11.2025 (Bekanntmachungsdatum)\n\nNordrhein-Westfalen Amtsgericht Köln HRB 103362\nLöschungsankündigung\n\nEl Recado UG (haftungsbeschränkt)\nGesellschaft mit beschränkter Haftung\nKöln\n\nDas Registergericht beabsichtigt die Gesellschaft von Amts wegen nach § 394 FamFG zu löschen. Die Frist zur Erhebung eines Widerspruchs ist auf einen Monat festgesetzt."
    },
    {
      "date": "2025-11-12",
      "id": "137138",
      "original_text": "Einreichung neuer Dokumente\nNordrhein-Westfalen Amtsgericht Essen HRB 25724\nES · FOR · IN SE – Essen",
      "type": "Einreichung neuer Dokumente",
      "state": "Nordrhein-Westfalen",
      "amtsgericht": "Amtsgericht Essen",
      "registernummer": "HRB 25724",
      "registerart": "HRB",
      "company_name": "ES · FOR · IN SE",
      "company_seat": "Essen",
      "details": "12.11.2025 (Bekanntmachungsdatum)\n\nNordrhein-Westfalen Amtsgericht Essen HRB 25724\nEinreichung neuer Dokumente\n\nES · FOR · IN SE\nEuropäische Aktiengesellschaft (SE)\nEssen\n\nDem Registergericht ist eine neue Liste der Mitglieder des Aufsichtsrates eingereicht worden."
    },
    {
      "date": "2025-11-12",
      "id": "137139",
      "original_text": "Löschungsankündigung\nNordrhein-Westfalen Amtsgericht Wuppertal HRB 30622\nCAR-OILINA Kfz-Handel GmbH – Solingen",
      "type": "Löschungsankündigung",
      "state": "Nordrhein-Westfalen",
      "amtsgericht": "Amtsgericht Wuppertal",
      "registernummer": "HRB 30622",
      "registerart": "HRB",
      "company_name": "CAR-OILINA Kfz-Handel GmbH",
      "company_seat": "Solingen",
      "details": "12.11.2025 (Bekanntmachungsdatum)\n\nNordrhein-Westfalen Amtsgericht Wuppertal HRB 30622\nLöschungsankündigung 11.11.2025 (Eintragungsdatum)\n\nCAR-OILINA Kfz-Handel GmbH\nGesellschaft mit beschränkter Haftung\nSolingen\n\nDas Registergericht beabsichtigt die Gesellschaft von Amts wegen nach § 394 FamFG zu löschen. Die Frist zur Erhebung eines Widerspruchs ist auf einen Monat festgesetzt."
    },
    {
      "date": "2025-11-12",
      "id": "137140",
      "original_text": "Löschungsankündigung\nNordrhein-Westfalen Amtsgericht Recklinghausen HRB 6699\nSH Automobile UG (haftungsbeschränkt) – Datteln",
      "type": "Löschungsankündigung",
      "state": "Nordrhein-Westfalen",
      "amtsgericht": "Amtsgericht Recklinghausen",
      "registernummer": "HRB 6699",
      "registerart": "HRB",
      "company_name": "SH Automobile UG (haftungsbeschränkt)",
      "company_seat": "Datteln",
      "details": "12.11.2025 (Bekanntmachungsdatum)\n\nNordrhein-Westfalen Amtsgericht Recklinghausen HRB 6699\nLöschungsankündigung\n\nSH Automobile UG (haftungsbeschränkt)\nGesellschaft mit beschränkter Haftung\nDatteln\n\nDas Registergericht beabsichtigt die Gesellschaft von Amts wegen nach § 394 FamFG zu löschen. Die Frist zur Erhebung eines Widerspruchs ist auf drei Monate festgesetzt."
    },
    {
      "date": "2025-11-12",
      "id": "137141",
      "original_text": "Löschungsankündigung\nNordrhein-Westfalen Amtsgericht Münster HRA 11002\nJunes GmbH & Co. KG – Münster",
      "type": "Löschungsankündigung",
      "state": "Nordrhein-Westfalen",
      "amtsgericht": "Amtsgericht Münster",
      "registernummer": "HRA 11002",
      "registerart": "HRA",
      "company_name": "Junes GmbH & Co. KG",
      "company_seat": "Münster",
      "details": "12.11.2025 (Bekanntmachungsdatum)\n\nNordrhein-Westfalen Amtsgericht Münster HRA 11002\nLöschungsankündigung\n\nJunes GmbH & Co. KG\nKommanditgesellschaft\nMünster\n\nDas Registergericht beabsichtigt die Firma von Amts wegen nach § 394 FamFG zu löschen. Die Frist zur Erhebung eines Widerspruchs ist auf einen Monat festgesetzt.\n\nRechtsbehelfsbelehrung:\n\nGegen diese Verfügung können Sie Widerspruch einlegen.\n\nDer Widerspruch ist bei dem Amtsgericht Münster, Gerichtsstraße 2 bis 6, 48149 Münster schriftlich in deutscher Sprache oder zur Niederschrift der Geschäftsstelle eines jeden Amtsgerichtes abgegeben werden.\nDie Einlegung ist auch durch Übertragung eine elektronischen Dokuments an die elektronische Poststelle des Gerichts möglich. Das elektronische Dokument muss für die Bearbeitung durch das Gericht geeignet und mit einer qualifizierten elektronischen Signatur der verantwortenden Person versehen sein oder von der verantwortenden Person signiert und auf einem sicheren Übermittlungsweg gem. §130a ZPO nach nähere Maßgabe der Verordnung über die technischen Rahmenbedingungen des elektronischen Rechtsverkehrs und über das besondere elektronische Behördenpostfach (BGBI. I. S.3808) eingereicht werden. Weitere Informationen erhalten Sie auf der Internetseite www.justiz.de\n\nDer Widerspruch muss spätestens innerhalb der gesetzten Frist nach der schriftlichen Bekanntgabe der Verfügung bei dem Amtsgericht Münster eingegangen sein. Dies gilt auch dann, wenn der Widerspruch zur Niederschrift der Geschäftsstelle eines anderen Amtsgerichtes abgegeben wurde. Die Frist beginnt mit der schriftlichen Bekanntgabe der Verfügung, spätestens mit Ablauf von fünf Monaten nach Erlass der Verfügung. Die Bekanntgabe ist entweder durch Zustellung oder am dritten Tage nach Aufgabe zur Post bewirkt. Fällt das Ende der First auf einen Sonntag, einen allgemeinen Feiertag oder Sonnabend, so endet die Frist mit Ablauf des nächsten Werktages.\n\nDer Widerspruch muss die Bezeichnung der angefochtenen Verfügung sowie die Erklärung enthalten, dass Widerspruch gegen diese Verfügung eingelegt wird. Er ist zu unterzeichnen und soll begründet werden."
    },
    {
      "date": "2025-11-12",
      "id": "137142",
      "original_text": "Löschungsankündigung\nNordrhein-Westfalen Amtsgericht Aachen HRB 23759\nARGUS Assekuranzmakler GmbH – Aachen",
      "type": "Löschungsankündigung",
      "state": "Nordrhein-Westfalen",
      "amtsgericht": "Amtsgericht Aachen",
      "registernummer": "HRB 23759",
      "registerart": "HRB",
      "company_name": "ARGUS Assekuranzmakler GmbH",
      "company_seat": "Aachen",
      "details": "12.11.2025 (Bekanntmachungsdatum)\n\nNordrhein-Westfalen Amtsgericht Aachen HRB 23759\nLöschungsankündigung\n\nARGUS Assekuranzmakler GmbH\nGesellschaft mit beschränkter Haftung\nAachen\n\nDas Registergericht beabsichtigt, von Amts wegen die Gesellschaft wegen Vermögenslosigkeit nach § 394 FamFG zu löschen, weil das Finanzamt Aachen-Stadt mit Schreiben vom 03.11.2025 Umstände mitgeteilt hat, aufgrund derer das Gericht davon überzeugt ist, dass die Gesellschaft vollständig vermögenslos ist.\n\nZur Geltendmachung des Widerspruchs gegen die beabsichtigte Löschung wird hiermit eine Frist von einem Monat ab Veröffentlichung dieser Ankündigung bestimmt.\n\nRechtsbehelfsbelehrung:\n\nGegen diese Verfügung kann Widerspruch eingelegt werden. Zum Widerspruch ist jeder berechtigt, der an der Unterlassung der Löschung ein berechtigtes Interesse hat.\n\nDer Widerspruch ist bei dem Amtsgericht Aachen, Adalbertsteinweg 92, 52070 Aachen schriftlich in deutscher Sprache oder zur Niederschrift der Geschäftsstelle einzulegen. Der Widerspruch kann auch zur Niederschrift der Geschäftsstelle eines jeden Amtsgerichtes abgegeben werden.\n\nDer Widerspruch muss spätestens innerhalb der gesetzten Frist nach der Bekanntgabe der Verfügung bei dem Amtsgericht Aachen eingegangen sein. Dies gilt auch dann, wenn der Widerspruch zur Niederschrift der Geschäftsstelle eines anderen Amtsgerichtes abgegeben wurde. Die Frist beginnt mit der Bekanntgabe der Verfügung durch Veröffentlichung. Fällt das Ende der Frist auf einen Sonntag, einen allgemeinen Feiertag oder Sonnabend, so endet die Frist mit Ablauf des nächsten Werktages.\n\nDer Widerspruch muss die Bezeichnung der angefochtenen Verfügung sowie die Erklärung enthalten, dass Widerspruch gegen diese Verfügung eingelegt wird. Er ist zu unterzeichnen und soll begründet werden.\n\nDie Einlegung ist auch durch Übertragung eines elektronischen Dokuments an die elektronische Poststelle des Gerichts möglich. Das elektronische Dokument muss für die Bearbeitung durch das Gericht geeignet und mit einer qualifizierten elektronischen Signatur der verantwortenden Person versehen sein oder von der verantwortenden Person signiert und auf einem sicheren Übermittlungsweg gemäß § 130 a ZPO nach näherer Maßgabe der Verordnung über die technischen Rahmenbedingungen des elektronischen Rechtsverkehrs und über das besondere elektronische Behördenpostfach (BGBl. I, S. 3803) eingereicht werden. Weitere Informationen erhalten Sie auf der Internetseite www.justiz.de."
    },
    {
      "date": "2025-11-12",
      "id": "137143",
      "original_text": "Löschungsankündigung\nNordrhein-Westfalen Amtsgericht Düsseldorf HRB 88697\nHöReco UG (haftungsbeschränkt) – Düsseldorf",
      "type": "Löschungsankündigung",
      "state": "Nordrhein-Westfalen",
      "amtsgericht": "Amtsgericht Düsseldorf",
      "registernummer": "HRB 88697",
      "registerart": "HRB",
      "company_name": "HöReco UG (haftungsbeschränkt)",
      "company_seat": "Düsseldorf",
      "details": "12.11.2025 (Bekanntmachungsdatum)\n\nNordrhein-Westfalen Amtsgericht Düsseldorf HRB 88697\nLöschungsankündigung\n\nHöReco UG (haftungsbeschränkt)\nGesellschaft mit beschränkter Haftung\nDüsseldorf\n\nDas Registergericht beabsichtigt die Gesellschaft von Amts wegen nach § 394 FamFG zu löschen. Die Frist zur Erhebung eines Widerspruchs ist auf 3 Wochen festgesetzt.\n\nRechtsbehelfsbelehrung:\nDas Widerspruchsrecht steht jedem zu, der an der Unterlassung der Löschung ein berechtigtes Interesse hat. Der Widerspruch ist bei dem Amtsgericht Düsseldorf -Registergericht-, Werdener Straße 1, 40227 Düsseldorf schriftlich in deutscher Sprache oder zur Niederschrift der Geschäftsstelle einzulegen. Der Widerspruch kann auch zur Niederschrift der Geschäftsstelle eines jeden Amtsgerichtes abgegeben werden. Die Einlegung ist auch durch Übertragung eines elektronischen Dokuments an die elektronische Poststelle des Gerichts möglich. Das elektronische Dokument muss für die Bearbeitung durch das Gericht geeignet und mit einer qualifizierten elektronischen Signatur der verantwortenden Person versehen sein oder von der verantwortenden Person signiert und auf einem sicheren Übermittlungsweg gemäß § 130a ZPO nach näherer Maßgabe der Verordnung über die technischen Rahmenbedingungen des elektronischen Rechtsverkehrs und über das besondere elektronische Behördenpostfach (BGBl. I, S.3803) eingereicht werden. Weitere Informationen erhalten Sie auf der Internetseite www.justiz.de.\nDer Widerspruch muss spätestens innerhalb der gesetzten Frist nach dem Datum der Bekanntmachung der Löschungsankündigung bei dem Amtsgericht - Registergericht - Düsseldorf eingegangen sein.  Dies gilt auch dann, wenn der Widerspruch zur Niederschrift der Geschäftsstelle eines anderen Amtsgerichtes abgegeben wurde. Die Frist beginnt mit dem Tage der Bekanntmachung der Löschungsankündigung in dem für die Bekanntmachung der Eintragungen in das Handelsregister bestimmten elektronischen Informations- und Kommunikationssystem nach § 10 des Handelsgesetzbuches. Fällt das Ende der Frist auf einen Sonntag, einen allgemeinen Feiertag oder Sonnabend, so endet die Frist mit Ablauf des nächsten Werktages.\nDer Widerspruch muss die Bezeichnung der angefochtenen Löschungsankündigung sowie die Erklärung enthalten, dass Widerspruch gegen diese Löschungsankündigung eingelegt wird. Er ist zu unterzeichnen und soll begründet werden."
    },
    {
      "date": "2025-11-12",
      "id": "137144",
      "original_text": "Löschungsankündigung\nBaden-Württemberg Amtsgericht Stuttgart HRB 785380\nSaros Biotech GmbH – Talheim",
      "type": "Löschungsankündigung",
      "state": "Baden-Württemberg",
      "amtsgericht": "Amtsgericht Stuttgart",
      "registernummer": "HRB 785380",
      "registerart": "HRB",
      "company_name": "Saros Biotech GmbH",
      "company_seat": "Talheim",
      "details": "12.11.2025 (Bekanntmachungsdatum)\n\nBaden-Württemberg Amtsgericht Stuttgart HRB 785380\nLöschungsankündigung\n\nSaros Biotech GmbH\nGesellschaft mit beschränkter Haftung\nTalheim\n\nAls nicht eingetragen wird bekanntgemacht:\nDas Gericht beabsichtigt, die Gesellschaft wegen Vermögenslosigkeit im Handelsregister von Amts wegen nach § 394 FamFG zu löschen. Die Frist zur Geltendmachung eines Widerspruchs gegen die beabsichtigte Löschung ist auf zwei Monate ab Veröffentlichung bestimmt."
    },
    {
      "date": "2025-11-12",
      "id": "137145",
      "original_text": "Registerbekanntmachung nach dem Umwandlungsgesetz\nThüringen Amtsgericht Jena HRB 508852\nformation ERFURT GmbH – Erfurt",
      "type": "Registerbekanntmachung nach dem Umwandlungsgesetz",
      "state": "Thüringen",
      "amtsgericht": "Amtsgericht Jena",
      "registernummer": "HRB 508852",
      "registerart": "HRB",
      "company_name": "formation ERFURT GmbH",
      "company_seat": "Erfurt",
      "details": "12.11.2025 (Bekanntmachungsdatum)\n\nThüringen Amtsgericht Jena HRB 508852\nRegisterbekanntmachung nach dem Umwandlungsgesetz 12.11.2025 (Eintragungsdatum)\n\nformation ERFURT GmbH\nGesellschaft mit beschränkter Haftung\nErfurt\n\nNicht eingetragen: Den Gläubigern der an der Verschmelzung beteiligten Rechtsträger, ist wenn sie binnen sechs Monaten nach dem Tag, an dem die Eintragung der Verschmelzung in das Register des Sitzes desjenigen Rechtsträgers, dessen Gläubiger sie sind,  nach § 19 Abs. 3 UmwG als bekanntgemacht gilt, ihren Anspruch nach Grund und Höhe schriftlich anmelden, Sicherheit zu leisten, soweit sie nicht Befriedigung verlangen können. Dieses Recht steht ihnen jedoch nur zu, wenn sie glaubhaft machen, daß durch die Verschmelzung die Erfüllung ihrer Forderung gefährdet wird."
    },
    {
      "date": "2025-11-12",
      "id": "137146",
      "original_text": "Registerbekanntmachung nach dem Umwandlungsgesetz\nThüringen Amtsgericht Jena HRA 503441\nSamt & Seidel KG – Erfurt",
      "type": "Registerbekanntmachung nach dem Umwandlungsgesetz",
      "state": "Thüringen",
      "amtsgericht": "Amtsgericht Jena",
      "registernummer": "HRA 503441",
      "registerart": "HRA",
      "company_name": "Samt & Seidel KG",
      "company_seat": "Erfurt",
      "details": "12.11.2025 (Bekanntmachungsdatum)\n\nThüringen Amtsgericht Jena HRA 503441\nRegisterbekanntmachung nach dem Umwandlungsgesetz 12.11.2025 (Eintragungsdatum)\n\nSamt & Seidel KG\nKommanditgesellschaft\nErfurt\n\nNicht eingetragen: Den Gläubigern der an der Verschmelzung beteiligten Rechtsträger, ist wenn sie binnen sechs Monaten nach dem Tag, an dem die Eintragung der Verschmelzung in das Register des Sitzes desjenigen Rechtsträgers, dessen Gläubiger sie sind,  nach § 19 Abs. 3 UmwG als bekanntgemacht gilt, ihren Anspruch nach Grund und Höhe schriftlich anmelden, Sicherheit zu leisten, soweit sie nicht Befriedigung verlangen können. Dieses Recht steht ihnen jedoch nur zu, wenn sie glaubhaft machen, daß durch die Verschmelzung die Erfüllung ihrer Forderung gefährdet wird."
    },
    {
      "date": "2025-11-12",
      "id": "137147",
      "original_text": "Einreichung neuer Dokumente\nHessen Amtsgericht Offenbach am Main HRB 49468\nViridium Holding AG – Neu-Isenburg",
      "type": "Einreichung neuer Dokumente",
      "state": "Hessen",
      "amtsgericht": "Amtsgericht Offenbach am Main",
      "registernummer": "HRB 49468",
      "registerart": "HRB",
      "company_name": "Viridium Holding AG",
      "company_seat": "Neu-Isenburg",
      "details": "12.11.2025 (Bekanntmachungsdatum)\n\nHessen Amtsgericht Offenbach am Main HRB 49468\nEinreichung neuer Dokumente 12.11.2025 (Eintragungsdatum)\n\nViridium Holding AG\nAktiengesellschaft\nNeu-Isenburg\n\nDurch eine Änderung in den Personen der Aufsichtsratsmitglieder ist eine Liste der Mitglieder des Aufsichtsrates zum Handelsregister eingereicht worden."
    },
    {
      "date": "2025-11-12",
      "id": "137148",
      "original_text": "Registerbekanntmachung nach dem Umwandlungsgesetz\nHessen Amtsgericht Darmstadt HRB 95248\nWeingut Götzinger GmbH – Bensheim",
      "type": "Registerbekanntmachung nach dem Umwandlungsgesetz",
      "state": "Hessen",
      "amtsgericht": "Amtsgericht Darmstadt",
      "registernummer": "HRB 95248",
      "registerart": "HRB",
      "company_name": "Weingut Götzinger GmbH",
      "company_seat": "Bensheim",
      "details": "12.11.2025 (Bekanntmachungsdatum)\n\nHessen Amtsgericht Darmstadt HRB 95248\nRegisterbekanntmachung nach dem Umwandlungsgesetz 12.11.2025 (Eintragungsdatum)\n\nWeingut Götzinger GmbH\nGesellschaft mit beschränkter Haftung\nBensheim\n\nDen Gläubigern der an der Verschmelzung beteiligten Rechtsträger ist, wenn sie binnen sechs Monaten nach dem Tag, an dem die Eintragung der Verschmelzung in das Register des Sitzes desjenigen Rechtsträgers, dessen Gläubiger sie sind, nach § 19 Absatz 3 UmwG bekannt gemacht worden ist, ihren Anspruch nach Grund und Höhe schriftlich anmelden, Sicherheit zu leisten, soweit sie nicht Befriedigung verlangen können. Dieses Recht steht den Gläubigern jedoch nur zu, wenn sie glaubhaft machen, dass durch die Verschmelzung die Erfüllung ihrer Forderung gefährdet wird."
    },
    {
      "date": "2025-11-12",
      "id": "137149",
      "original_text": "Einreichung neuer Dokumente\nHessen Amtsgericht Darmstadt HRB 24077\nImmundiagnostik AG – Bensheim",
      "type": "Einreichung neuer Dokumente",
      "state": "Hessen",
      "amtsgericht": "Amtsgericht Darmstadt",
      "registernummer": "HRB 24077",
      "registerart": "HRB",
      "company_name": "Immundiagnostik AG",
      "company_seat": "Bensheim",
      "details": "12.11.2025 (Bekanntmachungsdatum)\n\nHessen Amtsgericht Darmstadt HRB 24077\nEinreichung neuer Dokumente 12.11.2025 (Eintragungsdatum)\n\nImmundiagnostik AG\nAktiengesellschaft\nBensheim\n\nWegen Änderungen in den Personen der Aufsichtsratsmitglieder ist eine Liste der Mitglieder des Aufsichtsrates zum Handelsregister eingereicht worden."
    },
    {
      "date": "2025-11-12",
      "id": "137150",
      "original_text": "Löschungsankündigung\nHessen Amtsgericht Bad Homburg v.d.H. HRB 15731\nOPOS Germany GmbH – Bad Homburg v. d. Höhe",
      "type": "Löschungsankündigung",
      "state": "Hessen",
      "amtsgericht": "Amtsgericht Bad Homburg v.d.H.",
      "registernummer": "HRB 15731",
      "registerart": "HRB",
      "company_name": "OPOS Germany GmbH",
      "company_seat": "Bad Homburg v. d. Höhe",
      "details": "12.11.2025 (Bekanntmachungsdatum)\n\nHessen Amtsgericht Bad Homburg v.d.H. HRB 15731\nLöschungsankündigung\n\nOPOS Germany GmbH\nGesellschaft mit beschränkter Haftung\nBad Homburg v. d. Höhe\n\nDas Registergericht beabsichtigt die im Handelsregister eingetragene Gesellschaft von Amts wegen nach § 394 FamFG zu löschen. Die Frist zur Erhebung eines Widerspruchs gegen die beabsichtigte Löschung wird auf 3 Monate festgesetzt."
    },
    {
      "date": "2025-11-12",
      "id": "137151",
      "original_text": "Registerbekanntmachung nach dem Umwandlungsgesetz\nHessen Amtsgericht Offenbach am Main HRB 58414\nBäckerei Wolz GmbH – Seligenstadt",
      "type": "Registerbekanntmachung nach dem Umwandlungsgesetz",
      "state": "Hessen",
      "amtsgericht": "Amtsgericht Offenbach am Main",
      "registernummer": "HRB 58414",
      "registerart": "HRB",
      "company_name": "Bäckerei Wolz GmbH",
      "company_seat": "Seligenstadt",
      "details": "12.11.2025 (Bekanntmachungsdatum)\n\nHessen Amtsgericht Offenbach am Main HRB 58414\nRegisterbekanntmachung nach dem Umwandlungsgesetz 12.11.2025 (Eintragungsdatum)\n\nBäckerei Wolz GmbH\nGesellschaft mit beschränkter Haftung\nSeligenstadt\n\nDen Gläubigern der an der Ausgliederung beteiligten Rechtsträger ist, wenn sie binnen sechs Monaten nach dem Tag, an dem die Eintragung der Ausgliederung in das Register des Sitzes desjenigen Rechtsträgers, dessen Gläubiger sie sind, nach §§ 125, 19 Absatz 3 UmwG bekannt gemacht worden ist, ihren Anspruch nach Grund und Höhe schriftlich anmelden, Sicherheit zu leisten, soweit sie nicht Befriedigung verlangen können. Dieses Recht steht den Gläubigern jedoch nur zu, wenn sie glaubhaft machen, dass durch die Ausgliederung die Erfüllung ihrer Forderung gefährdet wird."
    },
    {
      "date": "2025-11-12",
      "id": "137152",
      "original_text": "Löschungsankündigung\nHessen Amtsgericht Frankfurt am Main HRB 17719\nHelco Reise Gesellschaft mit beschränkter Haftung – Frankfurt am Main",
      "type": "Löschungsankündigung",
      "state": "Hessen",
      "amtsgericht": "Amtsgericht Frankfurt am Main",
      "registernummer": "HRB 17719",
      "registerart": "HRB",
      "company_name": "Helco Reise Gesellschaft mit beschränkter Haftung",
      "company_seat": "Frankfurt am Main",
      "details": "12.11.2025 (Bekanntmachungsdatum)\n\nHessen Amtsgericht Frankfurt am Main HRB 17719\nLöschungsankündigung\n\nHelco Reise Gesellschaft mit beschränkter Haftung\nGesellschaft mit beschränkter Haftung\nFrankfurt am Main\n\nDas Registergericht beabsichtigt die im Handelsregister eingetragene Gesellschaft von Amts wegen nach § 394 FamFG zu löschen. Die Frist zur Erhebung eines Widerspruchs gegen die beabsichtigte Löschung wird auf 1 Monat festgesetzt."
    },
    {
      "date": "2025-11-12",
      "id": "137153",
      "original_text": "Registerbekanntmachung nach dem Umwandlungsgesetz\nHessen Amtsgericht Offenbach am Main HRA 43550\nBäckerei Uwe Wolz e.K. – Seligenstadt",
      "type": "Registerbekanntmachung nach dem Umwandlungsgesetz",
      "state": "Hessen",
      "amtsgericht": "Amtsgericht Offenbach am Main",
      "registernummer": "HRA 43550",
      "registerart": "HRA",
      "company_name": "Bäckerei Uwe Wolz e.K.",
      "company_seat": "Seligenstadt",
      "details": "12.11.2025 (Bekanntmachungsdatum)\n\nHessen Amtsgericht Offenbach am Main HRA 43550\nRegisterbekanntmachung nach dem Umwandlungsgesetz 12.11.2025 (Eintragungsdatum)\n\nBäckerei Uwe Wolz e.K.\nEinzelkaufmann / Einzelkauffrau\nSeligenstadt\n\nDen Gläubigern der an der Ausgliederung beteiligten Rechtsträger ist, wenn sie binnen sechs Monaten nach dem Tag, an dem die Eintragung der Ausgliederung in das Register des Sitzes desjenigen Rechtsträgers, dessen Gläubiger sie sind, nach §§ 125, 19 Absatz 3 UmwG bekannt gemacht worden ist, ihren Anspruch nach Grund und Höhe schriftlich anmelden, Sicherheit zu leisten, soweit sie nicht Befriedigung verlangen können. Dieses Recht steht den Gläubigern jedoch nur zu, wenn sie glaubhaft machen, dass durch die Ausgliederung die Erfüllung ihrer Forderung gefährdet wird."
    },
    {
      "date": "2025-11-12",
      "id": "137154",
      "original_text": "Sonstige Registerbekanntmachung\nHessen Amtsgericht Frankfurt am Main HRB 33726\nCREDIT SUISSE ASSET MANAGEMENT Real Estate GmbH – Frankfurt am Main",
      "type": "Sonstige Registerbekanntmachung",
      "state": "Hessen",
      "amtsgericht": "Amtsgericht Frankfurt am Main",
      "registernummer": "HRB 33726",
      "registerart": "HRB",
      "company_name": "CREDIT SUISSE ASSET MANAGEMENT Real Estate GmbH",
      "company_seat": "Frankfurt am Main",
      "details": "12.11.2025 (Bekanntmachungsdatum)\n\nHessen Amtsgericht Frankfurt am Main HRB 33726\nSonstige Registerbekanntmachung 12.11.2025 (Eintragungsdatum)\n\nCREDIT SUISSE ASSET MANAGEMENT Real Estate GmbH\nGesellschaft mit beschränkter Haftung\nFrankfurt am Main\n\nDie Gesellschaft hat Gläubigern, deren Forderungen vor dieser Bekanntmachung begründet worden sind, Sicherheit zu leisten, soweit sie nicht Befriedigung verlangen können, wenn sie sich binnen sechs Monaten nach dieser Bekanntmachung zu diesem Zweck melden."
    },
    {
      "date": "2025-11-12",
      "id": "137155",
      "original_text": "Registerbekanntmachung nach dem Umwandlungsgesetz\nHessen Amtsgericht Eschwege HRB 3101\nJocoon GmbH – Sontra",
      "type": "Registerbekanntmachung nach dem Umwandlungsgesetz",
      "state": "Hessen",
      "amtsgericht": "Amtsgericht Eschwege",
      "registernummer": "HRB 3101",
      "registerart": "HRB",
      "company_name": "Jocoon GmbH",
      "company_seat": "Sontra",
      "details": "12.11.2025 (Bekanntmachungsdatum)\n\nHessen Amtsgericht Eschwege HRB 3101\nRegisterbekanntmachung nach dem Umwandlungsgesetz 12.11.2025 (Eintragungsdatum)\n\nJocoon GmbH\nGesellschaft mit beschränkter Haftung\nSontra\n\nDen Gläubigern der an der Verschmelzung beteiligten Rechtsträger ist, wenn sie binnen sechs Monaten nach dem Tag, an dem die Eintragung der Verschmelzung in das Register des Sitzes desjenigen Rechtsträgers, dessen Gläubiger sie sind, nach § 19 Absatz 3 UmwG bekannt gemacht worden ist, ihren Anspruch nach Grund und Höhe schriftlich anmelden, Sicherheit zu leisten, soweit sie nicht Befriedigung verlangen können. Dieses Recht steht den Gläubigern jedoch nur zu, wenn sie glaubhaft machen, dass durch die Verschmelzung die Erfüllung ihrer Forderung gefährdet wird."
    },
    {
      "date": "2025-11-12",
      "id": "137156",
      "original_text": "Einreichung neuer Dokumente\nHessen Amtsgericht Frankfurt am Main HRB 56913\nDeutsche WertpapierService Bank AG – Frankfurt am Main",
      "type": "Einreichung neuer Dokumente",
      "state": "Hessen",
      "amtsgericht": "Amtsgericht Frankfurt am Main",
      "registernummer": "HRB 56913",
      "registerart": "HRB",
      "company_name": "Deutsche WertpapierService Bank AG",
      "company_seat": "Frankfurt am Main",
      "details": "12.11.2025 (Bekanntmachungsdatum)\n\nHessen Amtsgericht Frankfurt am Main HRB 56913\nEinreichung neuer Dokumente 12.11.2025 (Eintragungsdatum)\n\nDeutsche WertpapierService Bank AG\nAktiengesellschaft\nFrankfurt am Main\n\nDurch eine Änderung in den Personen der Aufsichtsratsmitglieder ist eine Liste der Mitglieder des Aufsichtsrates zum Handelsregister eingereicht worden."
    },
    {
      "date": "2025-11-12",
      "id": "137157",
      "original_text": "Löschungsankündigung\nHessen Amtsgericht Frankfurt am Main HRB 105420\nDaBro Bau GmbH – Frankfurt am Main",
      "type": "Löschungsankündigung",
      "state": "Hessen",
      "amtsgericht": "Amtsgericht Frankfurt am Main",
      "registernummer": "HRB 105420",
      "registerart": "HRB",
      "company_name": "DaBro Bau GmbH",
      "company_seat": "Frankfurt am Main",
      "details": "12.11.2025 (Bekanntmachungsdatum)\n\nHessen Amtsgericht Frankfurt am Main HRB 105420\nLöschungsankündigung 12.11.2025 (Eintragungsdatum)\n\nDaBro Bau GmbH\nGesellschaft mit beschränkter Haftung\nFrankfurt am Main\n\nDas Registergericht beabsichtigt die im Handelsregister eingetragene Gesellschaft von Amts wegen nach § 394 FamFG zu löschen. Die Frist zur Erhebung eines Widerspruchs gegen die beabsichtigte Löschung wird auf 1 Monat festgesetzt."
    },
    {
      "date": "2025-11-12",
      "id": "137158",
      "original_text": "Einreichung neuer Dokumente\nHessen Amtsgericht Frankfurt am Main HRB 46744\nLazard Asset Management (Deutschland) GmbH – Frankfurt am Main",
      "type": "Einreichung neuer Dokumente",
      "state": "Hessen",
      "amtsgericht": "Amtsgericht Frankfurt am Main",
      "registernummer": "HRB 46744",
      "registerart": "HRB",
      "company_name": "Lazard Asset Management (Deutschland) GmbH",
      "company_seat": "Frankfurt am Main",
      "details": "12.11.2025 (Bekanntmachungsdatum)\n\nHessen Amtsgericht Frankfurt am Main HRB 46744\nEinreichung neuer Dokumente\n\nLazard Asset Management (Deutschland) GmbH\nGesellschaft mit beschränkter Haftung\nFrankfurt am Main\n\nDurch eine Änderung in den Personen der Aufsichtsratsmitglieder ist eine Liste der Mitglieder des Aufsichtsrates zum Handelsregister eingereicht worden."
    }
  ]
}