{
  "date": "2025-11-06",
  "date_of_scrape": "2025-11-07T04:10:48.771Z",
  "tool_version": "0.2.0",
  "number_of_announcements": 145,
  "announcements": [
    {
      "date": "2025-11-06",
      "id": "136441",
      "original_text": "Löschungsankündigung\nBayern Amtsgericht Hof HRB 391\nRSH Abwicklungs GmbH – Selb",
      "type": "Löschungsankündigung",
      "state": "Bayern",
      "amtsgericht": "Amtsgericht Hof",
      "registernummer": "HRB 391",
      "registerart": "HRB",
      "company_name": "RSH Abwicklungs GmbH",
      "company_seat": "Selb",
      "details": "06.11.2025 (Bekanntmachungsdatum)\n\nBayern Amtsgericht Hof HRB 391\nLöschungsankündigung 04.11.2025 (Eintragungsdatum)\n\nRSH Abwicklungs GmbH\nGesellschaft mit beschränkter Haftung\nSelb\n\nDas Registergericht beabsichtigt, die im Handelsregister eingetragene Gesellschaft wegen Vermögenslosigkeit von Amts wegen nach § 394 FamFG zu löschen. Die Frist zur Erhebung eines Widerspruchs ist auf sechs Wochen festgesetzt."
    },
    {
      "date": "2025-11-06",
      "id": "136442",
      "original_text": "Löschungsankündigung\nBayern Amtsgericht Ansbach HRB 6747\nHindelang GmbH – Ansbach",
      "type": "Löschungsankündigung",
      "state": "Bayern",
      "amtsgericht": "Amtsgericht Ansbach",
      "registernummer": "HRB 6747",
      "registerart": "HRB",
      "company_name": "Hindelang GmbH",
      "company_seat": "Ansbach",
      "details": "06.11.2025 (Bekanntmachungsdatum)\n\nBayern Amtsgericht Ansbach HRB 6747\nLöschungsankündigung\n\nHindelang GmbH\nGesellschaft mit beschränkter Haftung\nAnsbach\n\nDas Registergericht beabsichtigt, die im Handelsregister eingetragene Gesellschaft von Amts wegen nach § 395 FamFG zu löschen. Die Frist zur Erhebung eines Widerspruchs ist auf sechs Wochen festgesetzt."
    },
    {
      "date": "2025-11-06",
      "id": "136443",
      "original_text": "Einreichung neuer Dokumente\nBayern Amtsgericht Deggendorf HRB 2231\nOTS Informationstechnologie AG – Offenberg",
      "type": "Einreichung neuer Dokumente",
      "state": "Bayern",
      "amtsgericht": "Amtsgericht Deggendorf",
      "registernummer": "HRB 2231",
      "registerart": "HRB",
      "company_name": "OTS Informationstechnologie AG",
      "company_seat": "Offenberg",
      "details": "06.11.2025 (Bekanntmachungsdatum)\n\nBayern Amtsgericht Deggendorf HRB 2231\nEinreichung neuer Dokumente\n\nOTS Informationstechnologie AG\nAktiengesellschaft\nOffenberg\n\nDem #Re.Name ist eine Liste der Mitglieder des Aufsichtsrats eingereicht worden, § 106 AktG."
    },
    {
      "date": "2025-11-06",
      "id": "136444",
      "original_text": "Einreichung neuer Dokumente\nBayern Amtsgericht München HRB 1059\nRohde & Schwarz Meßgerätebau GmbH – München",
      "type": "Einreichung neuer Dokumente",
      "state": "Bayern",
      "amtsgericht": "Amtsgericht München",
      "registernummer": "HRB 1059",
      "registerart": "HRB",
      "company_name": "Rohde & Schwarz Meßgerätebau GmbH",
      "company_seat": "München",
      "details": "06.11.2025 (Bekanntmachungsdatum)\n\nBayern Amtsgericht München HRB 1059\nEinreichung neuer Dokumente\n\nRohde & Schwarz Meßgerätebau GmbH\nGesellschaft mit beschränkter Haftung\nMünchen\n\nDem Amtsgericht München -Registergericht- ist eine Liste der Mitglieder des Aufsichtsrats eingereicht worden, § 52 Abs. 3 S. 2 GmbHG."
    },
    {
      "date": "2025-11-06",
      "id": "136445",
      "original_text": "Einreichung neuer Dokumente\nBayern Amtsgericht München HRB 114166\nMAGRAL Aktiengesellschaft Financial Brokers – München",
      "type": "Einreichung neuer Dokumente",
      "state": "Bayern",
      "amtsgericht": "Amtsgericht München",
      "registernummer": "HRB 114166",
      "registerart": "HRB",
      "company_name": "MAGRAL Aktiengesellschaft Financial Brokers",
      "company_seat": "München",
      "details": "06.11.2025 (Bekanntmachungsdatum)\n\nBayern Amtsgericht München HRB 114166\nEinreichung neuer Dokumente 05.11.2025 (Eintragungsdatum)\n\nMAGRAL Aktiengesellschaft Financial Brokers\nAktiengesellschaft\nMünchen\n\nDem Amtsgericht München -Registergericht- ist eine Liste der Mitglieder des Aufsichtsrats eingereicht worden, § 106 AktG."
    },
    {
      "date": "2025-11-06",
      "id": "136446",
      "original_text": "Löschungsankündigung\nBayern Amtsgericht Passau HRB 9358\nAW Hotels GmbH – Haidmühle",
      "type": "Löschungsankündigung",
      "state": "Bayern",
      "amtsgericht": "Amtsgericht Passau",
      "registernummer": "HRB 9358",
      "registerart": "HRB",
      "company_name": "AW Hotels GmbH",
      "company_seat": "Haidmühle",
      "details": "06.11.2025 (Bekanntmachungsdatum)\n\nBayern Amtsgericht Passau HRB 9358\nLöschungsankündigung\n\nAW Hotels GmbH\nGesellschaft mit beschränkter Haftung\nHaidmühle\n\nDas Registergericht beabsichtigt, die im Handelsregister eingetragene Gesellschaft wegen Vermögenslosigkeit von Amts wegen nach § 394 FamFG zu löschen. Die Frist zur Erhebung eines Widerspruchs ist auf einen Monat festgesetzt."
    },
    {
      "date": "2025-11-06",
      "id": "136447",
      "original_text": "Löschungsankündigung\nBayern Amtsgericht München HRB 246320\nALPHA FINANZ GmbH – Unterföhring",
      "type": "Löschungsankündigung",
      "state": "Bayern",
      "amtsgericht": "Amtsgericht München",
      "registernummer": "HRB 246320",
      "registerart": "HRB",
      "company_name": "ALPHA FINANZ GmbH",
      "company_seat": "Unterföhring",
      "details": "06.11.2025 (Bekanntmachungsdatum)\n\nBayern Amtsgericht München HRB 246320\nLöschungsankündigung 05.11.2025 (Eintragungsdatum)\n\nALPHA FINANZ GmbH\nGesellschaft mit beschränkter Haftung\nUnterföhring\n\nDem Amtsgericht München -Registergericht- ist eine Liste der Mitglieder des Aufsichtsrats eingereicht worden, § 52 Abs. 3 S. 2 GmbHG.Das Registergericht beabsichtigt, die im Handelsregister eingetragene Gesellschaft wegen Vermögenslosigkeit von Amts wegen nach § 394 FamFG zu löschen. Die Frist zur Erhebung eines Widerspruchs ist auf drei Monate festgesetzt."
    },
    {
      "date": "2025-11-06",
      "id": "136448",
      "original_text": "Löschungsankündigung\nBayern Amtsgericht München HRB 232835\nFE Deutschland GmbH – München",
      "type": "Löschungsankündigung",
      "state": "Bayern",
      "amtsgericht": "Amtsgericht München",
      "registernummer": "HRB 232835",
      "registerart": "HRB",
      "company_name": "FE Deutschland GmbH",
      "company_seat": "München",
      "details": "06.11.2025 (Bekanntmachungsdatum)\n\nBayern Amtsgericht München HRB 232835\nLöschungsankündigung 31.10.2025 (Eintragungsdatum)\n\nFE Deutschland GmbH\nGesellschaft mit beschränkter Haftung\nMünchen\n\nDas Registergericht beabsichtigt, die im Handelsregister eingetragene Gesellschaft wegen Vermögenslosigkeit von Amts wegen nach § 394 FamFG zu löschen. Die Frist zur Erhebung eines Widerspruchs ist auf drei Monate festgesetzt."
    },
    {
      "date": "2025-11-06",
      "id": "136449",
      "original_text": "Registerbekanntmachung nach dem Umwandlungsgesetz\nBayern Amtsgericht Memmingen HRB 19777\nLTG Ulm GmbH – Neu-Ulm",
      "type": "Registerbekanntmachung nach dem Umwandlungsgesetz",
      "state": "Bayern",
      "amtsgericht": "Amtsgericht Memmingen",
      "registernummer": "HRB 19777",
      "registerart": "HRB",
      "company_name": "LTG Ulm GmbH",
      "company_seat": "Neu-Ulm",
      "details": "06.11.2025 (Bekanntmachungsdatum)\n\nBayern Amtsgericht Memmingen HRB 19777\nRegisterbekanntmachung nach dem Umwandlungsgesetz 05.11.2025 (Eintragungsdatum)\n\nLTG Ulm GmbH\nGesellschaft mit beschränkter Haftung\nNeu-Ulm\n\nDen Gläubigern der an der Verschmelzung beteiligten Rechtsträger ist, wenn sie binnen sechs Monaten nach dem Tag, an dem die Eintragung der Verschmelzung in das Register des Sitzes desjenigen Rechtsträgers, dessen Gläubiger sie sind, nach § 19 Abs. 3 UmwG als bekannt gemacht gilt, ihren Anspruch nach Grund und Höhe in Textform anmelden, Sicherheit zu leisten, soweit sie nicht Befriedigung verlangen können. Dieses Recht steht den Gläubigern jedoch nur zu, wenn sie glaubhaft machen, dass durch die Verschmelzung die Erfüllung ihrer Forderung gefährdet wird."
    },
    {
      "date": "2025-11-06",
      "id": "136450",
      "original_text": "Registerbekanntmachung nach dem Umwandlungsgesetz\nBayern Amtsgericht München HRB 270847\nHELMECA Immobilien GmbH – München",
      "type": "Registerbekanntmachung nach dem Umwandlungsgesetz",
      "state": "Bayern",
      "amtsgericht": "Amtsgericht München",
      "registernummer": "HRB 270847",
      "registerart": "HRB",
      "company_name": "HELMECA Immobilien GmbH",
      "company_seat": "München",
      "details": "06.11.2025 (Bekanntmachungsdatum)\n\nBayern Amtsgericht München HRB 270847\nRegisterbekanntmachung nach dem Umwandlungsgesetz 05.11.2025 (Eintragungsdatum)\n\nHELMECA Immobilien GmbH\nGesellschaft mit beschränkter Haftung\nMünchen\n\nDen Gläubigern der an der Verschmelzung beteiligten Rechtsträger ist, wenn sie binnen sechs Monaten nach dem Tag, an dem die Eintragung der Verschmelzung in das Register des Sitzes desjenigen Rechtsträgers, dessen Gläubiger sie sind, nach § 19 Abs. 3 UmwG als bekannt gemacht gilt, ihren Anspruch nach Grund und Höhe in Textform anmelden, Sicherheit zu leisten, soweit sie nicht Befriedigung verlangen können. Dieses Recht steht den Gläubigern jedoch nur zu, wenn sie glaubhaft machen, dass durch die Verschmelzung die Erfüllung ihrer Forderung gefährdet wird."
    },
    {
      "date": "2025-11-06",
      "id": "136451",
      "original_text": "Registerbekanntmachung nach dem Umwandlungsgesetz\nBayern Amtsgericht München HRA 121522\nNicolas Lietzau-Schreiber e.K. – Aschheim",
      "type": "Registerbekanntmachung nach dem Umwandlungsgesetz",
      "state": "Bayern",
      "amtsgericht": "Amtsgericht München",
      "registernummer": "HRA 121522",
      "registerart": "HRA",
      "company_name": "Nicolas Lietzau-Schreiber e.K.",
      "company_seat": "Aschheim",
      "details": "06.11.2025 (Bekanntmachungsdatum)\n\nBayern Amtsgericht München HRA 121522\nRegisterbekanntmachung nach dem Umwandlungsgesetz 05.11.2025 (Eintragungsdatum)\n\nNicolas Lietzau-Schreiber e.K.\nEinzelkaufmann / Einzelkauffrau\nAschheim\n\nDen Gläubigern der an der Ausgliederung beteiligten Rechtsträger ist, wenn sie binnen sechs Monaten nach dem Tag, an dem die Eintragung der Ausgliederung in das Register des Sitzes desjenigen Rechtsträgers, dessen Gläubiger sie sind, nach §§ 125, 19 Abs. 3 UmwG als bekannt gemacht gilt, ihren Anspruch nach Grund und Höhe in Textform anmelden, Sicherheit zu leisten, soweit sie nicht Befriedigung verlangen können. Dieses Recht steht den Gläubigern jedoch nur zu, wenn sie glaubhaft machen, dass durch die Ausgliederung die Erfüllung ihrer Forderung gefährdet wird."
    },
    {
      "date": "2025-11-06",
      "id": "136452",
      "original_text": "Löschungsankündigung\nBayern Amtsgericht Coburg HRB 5251\nFlor & Sohn Lichtwerbung GmbH – Weidhausen",
      "type": "Löschungsankündigung",
      "state": "Bayern",
      "amtsgericht": "Amtsgericht Coburg",
      "registernummer": "HRB 5251",
      "registerart": "HRB",
      "company_name": "Flor & Sohn Lichtwerbung GmbH",
      "company_seat": "Weidhausen",
      "details": "06.11.2025 (Bekanntmachungsdatum)\n\nBayern Amtsgericht Coburg HRB 5251\nLöschungsankündigung 03.11.2025 (Eintragungsdatum)\n\nFlor & Sohn Lichtwerbung GmbH\nGesellschaft mit beschränkter Haftung\nWeidhausen\n\nDas Registergericht beabsichtigt, die im Handelsregister eingetragene Gesellschaft wegen Vermögenslosigkeit von Amts wegen nach § 394 FamFG zu löschen. Die Frist zur Erhebung eines Widerspruchs ist auf sechs Wochen festgesetzt."
    },
    {
      "date": "2025-11-06",
      "id": "136453",
      "original_text": "Registerbekanntmachung nach dem Umwandlungsgesetz\nBayern Amtsgericht Nürnberg HRB 33955\nCS Clinic-Service-GmbH – Hersbruck",
      "type": "Registerbekanntmachung nach dem Umwandlungsgesetz",
      "state": "Bayern",
      "amtsgericht": "Amtsgericht Nürnberg",
      "registernummer": "HRB 33955",
      "registerart": "HRB",
      "company_name": "CS Clinic-Service-GmbH",
      "company_seat": "Hersbruck",
      "details": "06.11.2025 (Bekanntmachungsdatum)\n\nBayern Amtsgericht Nürnberg HRB 33955\nRegisterbekanntmachung nach dem Umwandlungsgesetz 05.11.2025 (Eintragungsdatum)\n\nCS Clinic-Service-GmbH\nGesellschaft mit beschränkter Haftung\nHersbruck\n\nDen Gläubigern der an der Verschmelzung beteiligten Rechtsträger ist, wenn sie binnen sechs Monaten nach dem Tag, an dem die Eintragung der Verschmelzung in das Register des Sitzes desjenigen Rechtsträgers, dessen Gläubiger sie sind, nach § 19 Abs. 3 UmwG als bekannt gemacht gilt, ihren Anspruch nach Grund und Höhe in Textform anmelden, Sicherheit zu leisten, soweit sie nicht Befriedigung verlangen können. Dieses Recht steht den Gläubigern jedoch nur zu, wenn sie glaubhaft machen, dass durch die Verschmelzung die Erfüllung ihrer Forderung gefährdet wird."
    },
    {
      "date": "2025-11-06",
      "id": "136454",
      "original_text": "Registerbekanntmachung nach dem Umwandlungsgesetz\nBayern Amtsgericht Ingolstadt HRB 1123\nMedia-Saturn-Holding GmbH – Ingolstadt",
      "type": "Registerbekanntmachung nach dem Umwandlungsgesetz",
      "state": "Bayern",
      "amtsgericht": "Amtsgericht Ingolstadt",
      "registernummer": "HRB 1123",
      "registerart": "HRB",
      "company_name": "Media-Saturn-Holding GmbH",
      "company_seat": "Ingolstadt",
      "details": "06.11.2025 (Bekanntmachungsdatum)\n\nBayern Amtsgericht Ingolstadt HRB 1123\nRegisterbekanntmachung nach dem Umwandlungsgesetz 05.11.2025 (Eintragungsdatum)\n\nMedia-Saturn-Holding GmbH\nGesellschaft mit beschränkter Haftung\nIngolstadt\n\nDen Gläubigern der an der Verschmelzung beteiligten Rechtsträger ist, wenn sie binnen sechs Monaten nach dem Tag, an dem die Eintragung der Verschmelzung in das Register des Sitzes desjenigen Rechtsträgers, dessen Gläubiger sie sind, nach § 19 Abs. 3 UmwG als bekannt gemacht gilt, ihren Anspruch nach Grund und Höhe in Textform anmelden, Sicherheit zu leisten, soweit sie nicht Befriedigung verlangen können. Dieses Recht steht den Gläubigern jedoch nur zu, wenn sie glaubhaft machen, dass durch die Verschmelzung die Erfüllung ihrer Forderung gefährdet wird."
    },
    {
      "date": "2025-11-06",
      "id": "136455",
      "original_text": "Löschungsankündigung\nBayern Amtsgericht Aschaffenburg HRB 17252\nKGY Arbeitsvermittlungs GmbH – Alzenau",
      "type": "Löschungsankündigung",
      "state": "Bayern",
      "amtsgericht": "Amtsgericht Aschaffenburg",
      "registernummer": "HRB 17252",
      "registerart": "HRB",
      "company_name": "KGY Arbeitsvermittlungs GmbH",
      "company_seat": "Alzenau",
      "details": "06.11.2025 (Bekanntmachungsdatum)\n\nBayern Amtsgericht Aschaffenburg HRB 17252\nLöschungsankündigung\n\nKGY Arbeitsvermittlungs GmbH\nGesellschaft mit beschränkter Haftung\nAlzenau\n\nDas Registergericht beabsichtigt, die im Handelsregister eingetragene Gesellschaft wegen Vermögenslosigkeit von Amts wegen nach § 394 FamFG zu löschen. Die Frist zur Erhebung eines Widerspruchs ist auf drei Monate festgesetzt."
    },
    {
      "date": "2025-11-06",
      "id": "136456",
      "original_text": "Löschungsankündigung\nBayern Amtsgericht Aschaffenburg HRB 12717\nCGC Clever Garment Consulting UG (haftungsbeschränkt) – Aschaffenburg",
      "type": "Löschungsankündigung",
      "state": "Bayern",
      "amtsgericht": "Amtsgericht Aschaffenburg",
      "registernummer": "HRB 12717",
      "registerart": "HRB",
      "company_name": "CGC Clever Garment Consulting UG (haftungsbeschränkt)",
      "company_seat": "Aschaffenburg",
      "details": "06.11.2025 (Bekanntmachungsdatum)\n\nBayern Amtsgericht Aschaffenburg HRB 12717\nLöschungsankündigung\n\nCGC Clever Garment Consulting UG (haftungsbeschränkt)\nGesellschaft mit beschränkter Haftung\nAschaffenburg\n\nDas Registergericht beabsichtigt, die im Handelsregister eingetragene Gesellschaft wegen Vermögenslosigkeit von Amts wegen nach § 394 FamFG zu löschen. Die Frist zur Erhebung eines Widerspruchs ist auf drei Monate festgesetzt."
    },
    {
      "date": "2025-11-06",
      "id": "136457",
      "original_text": "Sonstige Registerbekanntmachung\nBayern Amtsgericht Augsburg HRB 34242\nVindelici Advisors AG – Augsburg",
      "type": "Sonstige Registerbekanntmachung",
      "state": "Bayern",
      "amtsgericht": "Amtsgericht Augsburg",
      "registernummer": "HRB 34242",
      "registerart": "HRB",
      "company_name": "Vindelici Advisors AG",
      "company_seat": "Augsburg",
      "details": "06.11.2025 (Bekanntmachungsdatum)\n\nBayern Amtsgericht Augsburg HRB 34242\nSonstige Registerbekanntmachung 05.11.2025 (Eintragungsdatum)\n\nVindelici Advisors AG\nAktiengesellschaft\nAugsburg\n\nDen Gläubigern der Gesellschaft, deren Forderungen begründet worden sind, bevor die Eintragung des Beschlusses bekanntgemacht worden ist, ist, wenn sie sich binnen sechs Monaten nach der Bekanntmachung zu diesem Zweck melden, Sicherheit zu leisten, soweit sie nicht Befriedigung verlangen können. Das Recht, Sicherheitsleistung zu verlangen, steht Gläubigern nicht zu, die im Fall des Insolvenzverfahrens ein Recht auf vorzugsweise Befriedigung aus einer Deckungsmasse haben, die nach gesetzlicher Vorschrift zu ihrem Schutz errichtet und staatlich überwacht ist."
    },
    {
      "date": "2025-11-06",
      "id": "136458",
      "original_text": "Registerbekanntmachung nach dem Umwandlungsgesetz\nBayern Amtsgericht Nürnberg HRB 9104\nPSORISOL Hautklinik GmbH – Hersbruck",
      "type": "Registerbekanntmachung nach dem Umwandlungsgesetz",
      "state": "Bayern",
      "amtsgericht": "Amtsgericht Nürnberg",
      "registernummer": "HRB 9104",
      "registerart": "HRB",
      "company_name": "PSORISOL Hautklinik GmbH",
      "company_seat": "Hersbruck",
      "details": "06.11.2025 (Bekanntmachungsdatum)\n\nBayern Amtsgericht Nürnberg HRB 9104\nRegisterbekanntmachung nach dem Umwandlungsgesetz 05.11.2025 (Eintragungsdatum)\n\nPSORISOL Hautklinik GmbH\nGesellschaft mit beschränkter Haftung\nHersbruck\n\nDen Gläubigern der an der Verschmelzung beteiligten Rechtsträger ist, wenn sie binnen sechs Monaten nach dem Tag, an dem die Eintragung der Verschmelzung in das Register des Sitzes desjenigen Rechtsträgers, dessen Gläubiger sie sind, nach § 19 Abs. 3 UmwG als bekannt gemacht gilt, ihren Anspruch nach Grund und Höhe in Textform anmelden, Sicherheit zu leisten, soweit sie nicht Befriedigung verlangen können. Dieses Recht steht den Gläubigern jedoch nur zu, wenn sie glaubhaft machen, dass durch die Verschmelzung die Erfüllung ihrer Forderung gefährdet wird."
    },
    {
      "date": "2025-11-06",
      "id": "136459",
      "original_text": "Einreichung neuer Dokumente\nBayern Amtsgericht München HRB 185340\nArabella Hospitality SE – München",
      "type": "Einreichung neuer Dokumente",
      "state": "Bayern",
      "amtsgericht": "Amtsgericht München",
      "registernummer": "HRB 185340",
      "registerart": "HRB",
      "company_name": "Arabella Hospitality SE",
      "company_seat": "München",
      "details": "06.11.2025 (Bekanntmachungsdatum)\n\nBayern Amtsgericht München HRB 185340\nEinreichung neuer Dokumente\n\nArabella Hospitality SE\nEuropäische Aktiengesellschaft (SE)\nMünchen\n\nDem Amtsgericht München -Registergericht- ist eine Liste der Mitglieder des Aufsichtsrats eingereicht worden, Art. 9 Abs. 1 Buchst. c (ii) SE-VO i.V.m. § 106 AktG."
    },
    {
      "date": "2025-11-06",
      "id": "136460",
      "original_text": "Registerbekanntmachung nach dem Umwandlungsgesetz\nBayern Amtsgericht Landshut HRB 15009\nSHIBAURA MACHINE LWB GmbH – Altdorf",
      "type": "Registerbekanntmachung nach dem Umwandlungsgesetz",
      "state": "Bayern",
      "amtsgericht": "Amtsgericht Landshut",
      "registernummer": "HRB 15009",
      "registerart": "HRB",
      "company_name": "SHIBAURA MACHINE LWB GmbH",
      "company_seat": "Altdorf",
      "details": "06.11.2025 (Bekanntmachungsdatum)\n\nBayern Amtsgericht Landshut HRB 15009\nRegisterbekanntmachung nach dem Umwandlungsgesetz 05.11.2025 (Eintragungsdatum)\n\nSHIBAURA MACHINE LWB GmbH\nGesellschaft mit beschränkter Haftung\nAltdorf\n\nDen Gläubigern der an der Verschmelzung beteiligten Rechtsträger ist, wenn sie binnen sechs Monaten nach dem Tag, an dem die Eintragung der Verschmelzung in das Register des Sitzes desjenigen Rechtsträgers, dessen Gläubiger sie sind, nach § 19 Abs. 3 UmwG als bekannt gemacht gilt, ihren Anspruch nach Grund und Höhe in Textform anmelden, Sicherheit zu leisten, soweit sie nicht Befriedigung verlangen können. Dieses Recht steht den Gläubigern jedoch nur zu, wenn sie glaubhaft machen, dass durch die Verschmelzung die Erfüllung ihrer Forderung gefährdet wird."
    },
    {
      "date": "2025-11-06",
      "id": "136461",
      "original_text": "Löschungsankündigung\nBayern Amtsgericht München HRB 220375\nGlobal Sportwetten Entertainment GmbH – München",
      "type": "Löschungsankündigung",
      "state": "Bayern",
      "amtsgericht": "Amtsgericht München",
      "registernummer": "HRB 220375",
      "registerart": "HRB",
      "company_name": "Global Sportwetten Entertainment GmbH",
      "company_seat": "München",
      "details": "06.11.2025 (Bekanntmachungsdatum)\n\nBayern Amtsgericht München HRB 220375\nLöschungsankündigung\n\nGlobal Sportwetten Entertainment GmbH\nGesellschaft mit beschränkter Haftung\nMünchen\n\nDas Registergericht beabsichtigt, die im Handelsregister eingetragene Gesellschaft wegen Vermögenslosigkeit von Amts wegen nach § 394 FamFG zu löschen. Die Frist zur Erhebung eines Widerspruchs ist auf drei Monate festgesetzt."
    },
    {
      "date": "2025-11-06",
      "id": "136462",
      "original_text": "Registerbekanntmachung nach dem Umwandlungsgesetz\nBayern Amtsgericht Landshut HRB 2091\nAlfred Steinl Verwaltungsgesellschaft mbH – Altdorf",
      "type": "Registerbekanntmachung nach dem Umwandlungsgesetz",
      "state": "Bayern",
      "amtsgericht": "Amtsgericht Landshut",
      "registernummer": "HRB 2091",
      "registerart": "HRB",
      "company_name": "Alfred Steinl Verwaltungsgesellschaft mbH",
      "company_seat": "Altdorf",
      "details": "06.11.2025 (Bekanntmachungsdatum)\n\nBayern Amtsgericht Landshut HRB 2091\nRegisterbekanntmachung nach dem Umwandlungsgesetz 05.11.2025 (Eintragungsdatum)\n\nAlfred Steinl Verwaltungsgesellschaft mbH\nGesellschaft mit beschränkter Haftung\nAltdorf\n\nDen Gläubigern der an der Verschmelzung beteiligten Rechtsträger ist, wenn sie binnen sechs Monaten nach dem Tag, an dem die Eintragung der Verschmelzung in das Register des Sitzes desjenigen Rechtsträgers, dessen Gläubiger sie sind, nach § 19 Abs. 3 UmwG als bekannt gemacht gilt, ihren Anspruch nach Grund und Höhe in Textform anmelden, Sicherheit zu leisten, soweit sie nicht Befriedigung verlangen können. Dieses Recht steht den Gläubigern jedoch nur zu, wenn sie glaubhaft machen, dass durch die Verschmelzung die Erfüllung ihrer Forderung gefährdet wird."
    },
    {
      "date": "2025-11-06",
      "id": "136463",
      "original_text": "Registerbekanntmachung nach dem Umwandlungsgesetz\nBayern Amtsgericht Nürnberg HRB 33940\nHD Hausdienstleistungs-GmbH – Hersbruck",
      "type": "Registerbekanntmachung nach dem Umwandlungsgesetz",
      "state": "Bayern",
      "amtsgericht": "Amtsgericht Nürnberg",
      "registernummer": "HRB 33940",
      "registerart": "HRB",
      "company_name": "HD Hausdienstleistungs-GmbH",
      "company_seat": "Hersbruck",
      "details": "06.11.2025 (Bekanntmachungsdatum)\n\nBayern Amtsgericht Nürnberg HRB 33940\nRegisterbekanntmachung nach dem Umwandlungsgesetz 05.11.2025 (Eintragungsdatum)\n\nHD Hausdienstleistungs-GmbH\nGesellschaft mit beschränkter Haftung\nHersbruck\n\nDen Gläubigern der an der Verschmelzung beteiligten Rechtsträger ist, wenn sie binnen sechs Monaten nach dem Tag, an dem die Eintragung der Verschmelzung in das Register des Sitzes desjenigen Rechtsträgers, dessen Gläubiger sie sind, nach § 19 Abs. 3 UmwG als bekannt gemacht gilt, ihren Anspruch nach Grund und Höhe in Textform anmelden, Sicherheit zu leisten, soweit sie nicht Befriedigung verlangen können. Dieses Recht steht den Gläubigern jedoch nur zu, wenn sie glaubhaft machen, dass durch die Verschmelzung die Erfüllung ihrer Forderung gefährdet wird."
    },
    {
      "date": "2025-11-06",
      "id": "136464",
      "original_text": "Registerbekanntmachung nach dem Umwandlungsgesetz\nBayern Amtsgericht München HRB 179586\nlifecon GmbH – München",
      "type": "Registerbekanntmachung nach dem Umwandlungsgesetz",
      "state": "Bayern",
      "amtsgericht": "Amtsgericht München",
      "registernummer": "HRB 179586",
      "registerart": "HRB",
      "company_name": "lifecon GmbH",
      "company_seat": "München",
      "details": "06.11.2025 (Bekanntmachungsdatum)\n\nBayern Amtsgericht München HRB 179586\nRegisterbekanntmachung nach dem Umwandlungsgesetz 05.11.2025 (Eintragungsdatum)\n\nlifecon GmbH\nGesellschaft mit beschränkter Haftung\nMünchen\n\nDen Gläubigern der an der Verschmelzung beteiligten Rechtsträger ist, wenn sie binnen sechs Monaten nach dem Tag, an dem die Eintragung der Verschmelzung in das Register des Sitzes desjenigen Rechtsträgers, dessen Gläubiger sie sind, nach § 19 Abs. 3 UmwG als bekannt gemacht gilt, ihren Anspruch nach Grund und Höhe in Textform anmelden, Sicherheit zu leisten, soweit sie nicht Befriedigung verlangen können. Dieses Recht steht den Gläubigern jedoch nur zu, wenn sie glaubhaft machen, dass durch die Verschmelzung die Erfüllung ihrer Forderung gefährdet wird."
    },
    {
      "date": "2025-11-06",
      "id": "136465",
      "original_text": "Einreichung neuer Dokumente\nBayern Amtsgericht München HRB 219439\nProSiebenSat.1 Media SE – Unterföhring",
      "type": "Einreichung neuer Dokumente",
      "state": "Bayern",
      "amtsgericht": "Amtsgericht München",
      "registernummer": "HRB 219439",
      "registerart": "HRB",
      "company_name": "ProSiebenSat.1 Media SE",
      "company_seat": "Unterföhring",
      "details": "06.11.2025 (Bekanntmachungsdatum)\n\nBayern Amtsgericht München HRB 219439\nEinreichung neuer Dokumente\n\nProSiebenSat.1 Media SE\nEuropäische Aktiengesellschaft (SE)\nUnterföhring\n\nDem Amtsgericht München -Registergericht- ist eine Liste der Mitglieder des Aufsichtsrats eingereicht worden, Art. 9 Abs. 1 Buchst. c (ii) SE-VO i.V.m. § 106 AktG."
    },
    {
      "date": "2025-11-06",
      "id": "136466",
      "original_text": "Löschungsankündigung\nBerlin Amtsgericht Berlin (Charlottenburg) HRB 201627\nICOME Economic Center UG (haftungsbeschränkt) – Berlin",
      "type": "Löschungsankündigung",
      "state": "Berlin",
      "amtsgericht": "Amtsgericht Berlin (Charlottenburg)",
      "registernummer": "HRB 201627",
      "registerart": "HRB",
      "company_name": "ICOME Economic Center UG (haftungsbeschränkt)",
      "company_seat": "Berlin",
      "details": "06.11.2025 (Bekanntmachungsdatum)\n\nBerlin Amtsgericht Berlin (Charlottenburg) HRB 201627\nLöschungsankündigung\n\nICOME Economic Center UG (haftungsbeschränkt)\nGesellschaft mit beschränkter Haftung\nBerlin\n\nBei der nachstehenden Gesellschaft wird das Amtslöschungsverfahren gemäß § 394 FamFG eingeleitet. Widerspruchsfrist 6 Wochen"
    },
    {
      "date": "2025-11-06",
      "id": "136467",
      "original_text": "Löschungsankündigung\nBaden-Württemberg Amtsgericht Ulm HRB 725892\nBBI Recycling GmbH – Hermaringen",
      "type": "Löschungsankündigung",
      "state": "Baden-Württemberg",
      "amtsgericht": "Amtsgericht Ulm",
      "registernummer": "HRB 725892",
      "registerart": "HRB",
      "company_name": "BBI Recycling GmbH",
      "company_seat": "Hermaringen",
      "details": "06.11.2025 (Bekanntmachungsdatum)\n\nBaden-Württemberg Amtsgericht Ulm HRB 725892\nLöschungsankündigung\n\nBBI Recycling GmbH\nGesellschaft mit beschränkter Haftung\nHermaringen\n\nDas Gericht beabsichtigt, die Gesellschaft wegen Vermögenslosigkeit im Handelsregister von Amts wegen nach § 394 FamFG zu löschen. Die Frist zur Geltendmachung eines Widerspruchs gegen die beabsichtigte Löschung ist auf  einen Monat ab Veröffentlichung bestimmt."
    },
    {
      "date": "2025-11-06",
      "id": "136468",
      "original_text": "Löschungsankündigung\nBrandenburg Amtsgericht Cottbus HRA 266\nHTS Hoch-, Tief- und Straßenbau GmbH & Co. KG – Schlieben",
      "type": "Löschungsankündigung",
      "state": "Brandenburg",
      "amtsgericht": "Amtsgericht Cottbus",
      "registernummer": "HRA 266",
      "registerart": "HRA",
      "company_name": "HTS Hoch-, Tief- und Straßenbau GmbH & Co. KG",
      "company_seat": "Schlieben",
      "details": "06.11.2025 (Bekanntmachungsdatum)\n\nBrandenburg Amtsgericht Cottbus HRA 266\nLöschungsankündigung\n\nHTS Hoch-, Tief- und Straßenbau GmbH & Co. KG\nKommanditgesellschaft\nSchlieben\n\nBei der nachstehenden Gesellschaft wird das Amtslöschungsverfahren gemäß § 394 FamFG eingeleitet. Widerspruchsfrist: 6 Wochen."
    },
    {
      "date": "2025-11-06",
      "id": "136469",
      "original_text": "Löschungsankündigung\nBerlin Amtsgericht Berlin (Charlottenburg) HRB 138943\nDom & Haus UG (haftungsbeschränkt) – Berlin",
      "type": "Löschungsankündigung",
      "state": "Berlin",
      "amtsgericht": "Amtsgericht Berlin (Charlottenburg)",
      "registernummer": "HRB 138943",
      "registerart": "HRB",
      "company_name": "Dom & Haus UG (haftungsbeschränkt)",
      "company_seat": "Berlin",
      "details": "06.11.2025 (Bekanntmachungsdatum)\n\nBerlin Amtsgericht Berlin (Charlottenburg) HRB 138943\nLöschungsankündigung\n\nDom & Haus UG (haftungsbeschränkt)\nGesellschaft mit beschränkter Haftung\nBerlin\n\nBei der nachstehenden Gesellschaft wird das Amtslöschungsverfahren gemäß § 394 FamFG eingeleitet. Widerspruchsfrist 6 Wochen"
    },
    {
      "date": "2025-11-06",
      "id": "136470",
      "original_text": "Sonstige Registerbekanntmachung\nBaden-Württemberg Amtsgericht Ulm HRB 724305\nMerckle Service GmbH – Ulm",
      "type": "Sonstige Registerbekanntmachung",
      "state": "Baden-Württemberg",
      "amtsgericht": "Amtsgericht Ulm",
      "registernummer": "HRB 724305",
      "registerart": "HRB",
      "company_name": "Merckle Service GmbH",
      "company_seat": "Ulm",
      "details": "06.11.2025 (Bekanntmachungsdatum)\n\nBaden-Württemberg Amtsgericht Ulm HRB 724305\nSonstige Registerbekanntmachung 06.11.2025 (Eintragungsdatum)\n\nMerckle Service GmbH\nGesellschaft mit beschränkter Haftung\nUlm\n\nDen Gläubigern der Gesellschaft, deren Forderungen begründet worden sind, bevor die Eintragung der Beendigung des Vertrages in das Handelsregister nach § 10 HGB als bekanntgemacht gilt, ist vom anderen Vertragsteil Sicherheit zu leisten, wenn sie sich binnen sechs Monaten nach der Bekanntmachung zu diesem Zweck bei ihm melden."
    },
    {
      "date": "2025-11-06",
      "id": "136471",
      "original_text": "Registerbekanntmachung nach dem Umwandlungsgesetz\nBaden-Württemberg Amtsgericht Stuttgart HRB 796705\nCaddie Recruiting GmbH – Sindelfingen",
      "type": "Registerbekanntmachung nach dem Umwandlungsgesetz",
      "state": "Baden-Württemberg",
      "amtsgericht": "Amtsgericht Stuttgart",
      "registernummer": "HRB 796705",
      "registerart": "HRB",
      "company_name": "Caddie Recruiting GmbH",
      "company_seat": "Sindelfingen",
      "details": "06.11.2025 (Bekanntmachungsdatum)\n\nBaden-Württemberg Amtsgericht Stuttgart HRB 796705\nRegisterbekanntmachung nach dem Umwandlungsgesetz 06.11.2025 (Eintragungsdatum)\n\nCaddie Recruiting GmbH\nGesellschaft mit beschränkter Haftung\nSindelfingen\n\nAls nicht eingetragen wird bekanntgemacht:\nDen Gläubigern der an der Ausgliederung beteiligten Rechtsträger ist, wenn sie binnen sechs Monaten nach dem Tag, an dem die Eintragung der Ausgliederung in das Register des Sitzes desjenigen Rechtsträgers, dessen Gläubiger sie sind, nach § 19 Abs. 3 UmwG als bekanntgemacht gilt, ihren Anspruch nach Grund und Höhe schriftlich anmelden, Sicherheit zu leisten, soweit sie nicht Befriedigung verlangen können. Dieses Recht steht den Gläubigern jedoch nur zu, wenn sie glaubhaft machen, dass durch die Ausgliederung die Erfüllung ihrer Forderung gefährdet wird."
    },
    {
      "date": "2025-11-06",
      "id": "136472",
      "original_text": "Registerbekanntmachung nach dem Umwandlungsgesetz\nBaden-Württemberg Amtsgericht Freiburg HRB 715333\nBau Invest Bad Krozingen UG (haftungsbeschränkt) – Merdingen",
      "type": "Registerbekanntmachung nach dem Umwandlungsgesetz",
      "state": "Baden-Württemberg",
      "amtsgericht": "Amtsgericht Freiburg",
      "registernummer": "HRB 715333",
      "registerart": "HRB",
      "company_name": "Bau Invest Bad Krozingen UG (haftungsbeschränkt)",
      "company_seat": "Merdingen",
      "details": "06.11.2025 (Bekanntmachungsdatum)\n\nBaden-Württemberg Amtsgericht Freiburg HRB 715333\nRegisterbekanntmachung nach dem Umwandlungsgesetz 06.11.2025 (Eintragungsdatum)\n\nBau Invest Bad Krozingen UG (haftungsbeschränkt)\nGesellschaft mit beschränkter Haftung\nMerdingen\n\nAls nicht eingetragen wird bekanntgemacht:\nDen Gläubigern der an der Verschmelzung beteiligten Rechtsträger ist, wenn sie binnen sechs Monaten nach dem Tag, an dem die Eintragung der Verschmelzung in das Register des Sitzes desjenigen Rechtsträgers, dessen Gläubiger sie sind, nach § 19 Abs. 3 UmwG als bekanntgemacht gilt, ihren Anspruch nach Grund und Höhe schriftlich anmelden, Sicherheit zu leisten, soweit sie nicht Befriedigung verlangen können. Dieses Recht steht den Gläubigern jedoch nur zu, wenn sie glaubhaft machen, dass durch die Verschmelzung die Erfüllung ihrer Forderung gefährdet wird."
    },
    {
      "date": "2025-11-06",
      "id": "136473",
      "original_text": "Einreichung neuer Dokumente\nBerlin Amtsgericht Berlin (Charlottenburg) HRB 242874\nDr. Knabe AG – Berlin",
      "type": "Einreichung neuer Dokumente",
      "state": "Berlin",
      "amtsgericht": "Amtsgericht Berlin (Charlottenburg)",
      "registernummer": "HRB 242874",
      "registerart": "HRB",
      "company_name": "Dr. Knabe AG",
      "company_seat": "Berlin",
      "details": "06.11.2025 (Bekanntmachungsdatum)\n\nBerlin Amtsgericht Berlin (Charlottenburg) HRB 242874\nEinreichung neuer Dokumente\n\nDr. Knabe AG\nAktiengesellschaft\nBerlin\n\nAls nicht eingetragen wird veröffentlicht: Es wurde eine neue Liste der Aufsichtsratsmitglieder eingereicht (§ 106 AktG)."
    },
    {
      "date": "2025-11-06",
      "id": "136474",
      "original_text": "Registerbekanntmachung nach dem Umwandlungsgesetz\nBaden-Württemberg Amtsgericht Mannheim HRB 736628\nLTC - Linder Technologie Campus Holding GmbH – Karlsruhe",
      "type": "Registerbekanntmachung nach dem Umwandlungsgesetz",
      "state": "Baden-Württemberg",
      "amtsgericht": "Amtsgericht Mannheim",
      "registernummer": "HRB 736628",
      "registerart": "HRB",
      "company_name": "LTC - Linder Technologie Campus Holding GmbH",
      "company_seat": "Karlsruhe",
      "details": "06.11.2025 (Bekanntmachungsdatum)\n\nBaden-Württemberg Amtsgericht Mannheim HRB 736628\nRegisterbekanntmachung nach dem Umwandlungsgesetz 06.11.2025 (Eintragungsdatum)\n\nLTC - Linder Technologie Campus Holding GmbH\nGesellschaft mit beschränkter Haftung\nKarlsruhe\n\nDen Gläubigern der an der Verschmelzung beteiligten Rechtsträger ist, wenn sie binnen sechs Monaten nach dem Tag, an dem die Eintragung der Verschmelzung in das Register des Sitzes desjenigen Rechtsträgers, dessen Gläubiger sie sind, nach § 19 Abs. 3 UmwG als bekanntgemacht gilt, ihren Anspruch nach Grund und Höhe schriftlich anmelden, Sicherheit zu leisten, soweit sie nicht Befriedigung verlangen können. Dieses Recht steht den Gläubigern jedoch nur zu, wenn sie glaubhaft machen, dass durch die Verschmelzung die Erfüllung ihrer Forderung gefährdet wird."
    },
    {
      "date": "2025-11-06",
      "id": "136475",
      "original_text": "Registerbekanntmachung nach dem Umwandlungsgesetz\nBaden-Württemberg Amtsgericht Mannheim HRB 727350\nLTC - Linder Technologie Campus GmbH – Karlsruhe",
      "type": "Registerbekanntmachung nach dem Umwandlungsgesetz",
      "state": "Baden-Württemberg",
      "amtsgericht": "Amtsgericht Mannheim",
      "registernummer": "HRB 727350",
      "registerart": "HRB",
      "company_name": "LTC - Linder Technologie Campus GmbH",
      "company_seat": "Karlsruhe",
      "details": "06.11.2025 (Bekanntmachungsdatum)\n\nBaden-Württemberg Amtsgericht Mannheim HRB 727350\nRegisterbekanntmachung nach dem Umwandlungsgesetz 06.11.2025 (Eintragungsdatum)\n\nLTC - Linder Technologie Campus GmbH\nGesellschaft mit beschränkter Haftung\nKarlsruhe\n\nDen Gläubigern der an der Verschmelzung beteiligten Rechtsträger ist, wenn sie binnen sechs Monaten nach dem Tag, an dem die Eintragung der Verschmelzung in das Register des Sitzes desjenigen Rechtsträgers, dessen Gläubiger sie sind, nach § 19 Abs. 3 UmwG als bekanntgemacht gilt, ihren Anspruch nach Grund und Höhe schriftlich anmelden, Sicherheit zu leisten, soweit sie nicht Befriedigung verlangen können. Dieses Recht steht den Gläubigern jedoch nur zu, wenn sie glaubhaft machen, dass durch die Verschmelzung die Erfüllung ihrer Forderung gefährdet wird."
    },
    {
      "date": "2025-11-06",
      "id": "136476",
      "original_text": "Registerbekanntmachung nach dem Umwandlungsgesetz\nHamburg Amtsgericht Hamburg HRB 170972\nABOUT YOU Holding SE – Hamburg",
      "type": "Registerbekanntmachung nach dem Umwandlungsgesetz",
      "state": "Hamburg",
      "amtsgericht": "Amtsgericht Hamburg",
      "registernummer": "HRB 170972",
      "registerart": "HRB",
      "company_name": "ABOUT YOU Holding SE",
      "company_seat": "Hamburg",
      "details": "06.11.2025 (Bekanntmachungsdatum)\n\nHamburg Amtsgericht Hamburg HRB 170972\nRegisterbekanntmachung nach dem Umwandlungsgesetz 06.11.2025 (Eintragungsdatum)\n\nABOUT YOU Holding SE\nEuropäische Aktiengesellschaft (SE)\nHamburg\n\nAls nicht eingetragen wird bekannt gemacht:\nDen Gläubigern der an der Verschmelzung beteiligten Gesellschaften ist, wenn sie binnen sechs Monaten nach dem Tag, an dem die Eintragung der Verschmelzung in das Register des Sitzes desjenigen Rechtsträgers, dessen Gläubiger sie sind, nach § 19 Absatz 3 UmwG als bekannt gemacht gilt, ihren Anspruch nach Grund und Höhe schriftlich anmelden, Sicherheit zu leisten, soweit sie nicht Befriedigung verlangen können. Dieses Recht steht den Gläubigern jedoch nur zu, wenn sie glaubhaft machen, dass durch die Verschmelzung die Erfüllung ihrer Forderung gefährdet wird."
    },
    {
      "date": "2025-11-06",
      "id": "136477",
      "original_text": "Registerbekanntmachung nach dem Umwandlungsgesetz\nHamburg Amtsgericht Hamburg HRB 189825\nABYxZAL Holding AG – Hamburg",
      "type": "Registerbekanntmachung nach dem Umwandlungsgesetz",
      "state": "Hamburg",
      "amtsgericht": "Amtsgericht Hamburg",
      "registernummer": "HRB 189825",
      "registerart": "HRB",
      "company_name": "ABYxZAL Holding AG",
      "company_seat": "Hamburg",
      "details": "06.11.2025 (Bekanntmachungsdatum)\n\nHamburg Amtsgericht Hamburg HRB 189825\nRegisterbekanntmachung nach dem Umwandlungsgesetz 06.11.2025 (Eintragungsdatum)\n\nABYxZAL Holding AG\nAktiengesellschaft\nHamburg\n\nAls nicht eingetragen wird bekannt gemacht:\nDen Gläubigern der an der Verschmelzung beteiligten Gesellschaften ist, wenn sie binnen sechs Monaten nach dem Tag, an dem die Eintragung der Verschmelzung in das Register des Sitzes desjenigen Rechtsträgers, dessen Gläubiger sie sind, nach § 19 Absatz 3 UmwG als bekannt gemacht gilt, ihren Anspruch nach Grund und Höhe schriftlich anmelden, Sicherheit zu leisten, soweit sie nicht Befriedigung verlangen können. Dieses Recht steht den Gläubigern jedoch nur zu, wenn sie glaubhaft machen, dass durch die Verschmelzung die Erfüllung ihrer Forderung gefährdet wird."
    },
    {
      "date": "2025-11-06",
      "id": "136478",
      "original_text": "Registerbekanntmachung nach dem Umwandlungsgesetz\nBaden-Württemberg Amtsgericht Freiburg HRA 709312\nWitt-Dental Inh. Carmen Witt e.K. – Radolfzell am Bodensee",
      "type": "Registerbekanntmachung nach dem Umwandlungsgesetz",
      "state": "Baden-Württemberg",
      "amtsgericht": "Amtsgericht Freiburg",
      "registernummer": "HRA 709312",
      "registerart": "HRA",
      "company_name": "Witt-Dental Inh. Carmen Witt e.K.",
      "company_seat": "Radolfzell am Bodensee",
      "details": "06.11.2025 (Bekanntmachungsdatum)\n\nBaden-Württemberg Amtsgericht Freiburg HRA 709312\nRegisterbekanntmachung nach dem Umwandlungsgesetz 06.11.2025 (Eintragungsdatum)\n\nWitt-Dental Inh. Carmen Witt e.K.\nEinzelkaufmann / Einzelkauffrau\nRadolfzell am Bodensee\n\nAls nicht eingetragen wird bekanntgemacht:\nDen Gläubigern der an der Verschmelzung beteiligten Rechtsträger ist, wenn sie binnen sechs Monaten nach dem Tag, an dem die Eintragung der Verschmelzung in das Register des Sitzes desjenigen Rechtsträgers, dessen Gläubiger sie sind, nach § 19 Abs. 3 UmwG als bekanntgemacht gilt, ihren Anspruch nach Grund und Höhe schriftlich anmelden, Sicherheit zu leisten, soweit sie nicht Befriedigung verlangen können. Dieses Recht steht den Gläubigern jedoch nur zu, wenn sie glaubhaft machen, dass durch die Verschmelzung die Erfüllung ihrer Forderung gefährdet wird."
    },
    {
      "date": "2025-11-06",
      "id": "136479",
      "original_text": "Registerbekanntmachung nach dem Umwandlungsgesetz\nBaden-Württemberg Amtsgericht Freiburg HRB 550710\nGünter Witt GmbH – Radolfzell am Bodensee",
      "type": "Registerbekanntmachung nach dem Umwandlungsgesetz",
      "state": "Baden-Württemberg",
      "amtsgericht": "Amtsgericht Freiburg",
      "registernummer": "HRB 550710",
      "registerart": "HRB",
      "company_name": "Günter Witt GmbH",
      "company_seat": "Radolfzell am Bodensee",
      "details": "06.11.2025 (Bekanntmachungsdatum)\n\nBaden-Württemberg Amtsgericht Freiburg HRB 550710\nRegisterbekanntmachung nach dem Umwandlungsgesetz 06.11.2025 (Eintragungsdatum)\n\nGünter Witt GmbH\nGesellschaft mit beschränkter Haftung\nRadolfzell am Bodensee\n\nAls nicht eingetragen wird bekanntgemacht:\nDen Gläubigern der an der Verschmelzung beteiligten Rechtsträger ist, wenn sie binnen sechs Monaten nach dem Tag, an dem die Eintragung der Verschmelzung in das Register des Sitzes desjenigen Rechtsträgers, dessen Gläubiger sie sind, nach § 19 Abs. 3 UmwG als bekanntgemacht gilt, ihren Anspruch nach Grund und Höhe schriftlich anmelden, Sicherheit zu leisten, soweit sie nicht Befriedigung verlangen können. Dieses Recht steht den Gläubigern jedoch nur zu, wenn sie glaubhaft machen, dass durch die Verschmelzung die Erfüllung ihrer Forderung gefährdet wird."
    },
    {
      "date": "2025-11-06",
      "id": "136480",
      "original_text": "Einreichung neuer Dokumente\nSaarland Amtsgericht Saarbrücken HRB 4344\nSaarland-Heilstätten Gesellschaft mit beschränkter Haftung – Saarbrücken",
      "type": "Einreichung neuer Dokumente",
      "state": "Saarland",
      "amtsgericht": "Amtsgericht Saarbrücken",
      "registernummer": "HRB 4344",
      "registerart": "HRB",
      "company_name": "Saarland-Heilstätten Gesellschaft mit beschränkter Haftung",
      "company_seat": "Saarbrücken",
      "details": "06.11.2025 (Bekanntmachungsdatum)\n\nSaarland Amtsgericht Saarbrücken HRB 4344\nEinreichung neuer Dokumente\n\nSaarland-Heilstätten Gesellschaft mit beschränkter Haftung\nGesellschaft mit beschränkter Haftung\nSaarbrücken\n\nDie Geschäftsführung der Gesellschaft hat eine Liste der Mitglieder des Aufsichtsrats zum Handelsregister eingereicht (§ 52 Abs. 3 Satz 2 GmbHG)."
    },
    {
      "date": "2025-11-06",
      "id": "136481",
      "original_text": "Registerbekanntmachung nach dem Umwandlungsgesetz\nBaden-Württemberg Amtsgericht Stuttgart HRA 742778\nSebahat Bayer Besitzunternehmen e.Kfr. – Wendlingen am Neckar",
      "type": "Registerbekanntmachung nach dem Umwandlungsgesetz",
      "state": "Baden-Württemberg",
      "amtsgericht": "Amtsgericht Stuttgart",
      "registernummer": "HRA 742778",
      "registerart": "HRA",
      "company_name": "Sebahat Bayer Besitzunternehmen e.Kfr.",
      "company_seat": "Wendlingen am Neckar",
      "details": "06.11.2025 (Bekanntmachungsdatum)\n\nBaden-Württemberg Amtsgericht Stuttgart HRA 742778\nRegisterbekanntmachung nach dem Umwandlungsgesetz 06.11.2025 (Eintragungsdatum)\n\nSebahat Bayer Besitzunternehmen e.Kfr.\nEinzelkaufmann / Einzelkauffrau\nWendlingen am Neckar\n\nAls nicht eingetragen wird bekanntgemacht:\nDen Gläubigern der an der Ausgliederung beteiligten Rechtsträger ist, wenn sie binnen sechs Monaten nach dem Tag, an dem die Eintragung der Ausgliederung in das Register des Sitzes desjenigen Rechtsträgers, dessen Gläubiger sie sind, nach § 19 Abs. 3 UmwG als bekanntgemacht gilt, ihren Anspruch nach Grund und Höhe schriftlich anmelden, Sicherheit zu leisten, soweit sie nicht Befriedigung verlangen können. Dieses Recht steht den Gläubigern jedoch nur zu, wenn sie glaubhaft machen, dass durch die Ausgliederung die Erfüllung ihrer Forderung gefährdet wird."
    },
    {
      "date": "2025-11-06",
      "id": "136482",
      "original_text": "Registerbekanntmachung nach dem Umwandlungsgesetz\nBaden-Württemberg Amtsgericht Ulm HRB 680553\nMarkert Rolladenbau GmbH – Bad Mergentheim",
      "type": "Registerbekanntmachung nach dem Umwandlungsgesetz",
      "state": "Baden-Württemberg",
      "amtsgericht": "Amtsgericht Ulm",
      "registernummer": "HRB 680553",
      "registerart": "HRB",
      "company_name": "Markert Rolladenbau GmbH",
      "company_seat": "Bad Mergentheim",
      "details": "06.11.2025 (Bekanntmachungsdatum)\n\nBaden-Württemberg Amtsgericht Ulm HRB 680553\nRegisterbekanntmachung nach dem Umwandlungsgesetz 06.11.2025 (Eintragungsdatum)\n\nMarkert Rolladenbau GmbH\nGesellschaft mit beschränkter Haftung\nBad Mergentheim\n\nAls nicht eingetragen wird bekanntgemacht:\nDen Gläubigern des an dem Formwechsel beteiligten Rechtsträgers ist, wenn sie binnen sechs Monaten nach dem Tag, an dem die Eintragung des Formwechsels in das Register des Sitzes desjenigen Rechtsträgers, dessen Gläubiger sie sind, nach § 19 Abs. 3 UmwG als bekanntgemacht gilt, ihren Anspruch nach Grund und Höhe schriftlich anmelden, Sicherheit zu leisten, soweit sie nicht Befriedigung verlangen können. Dieses Recht steht den Gläubigern jedoch nur zu, wenn sie glaubhaft machen, dass durch den Formwechsel die Erfüllung ihrer Forderung gefährdet wird."
    },
    {
      "date": "2025-11-06",
      "id": "136483",
      "original_text": "Löschungsankündigung\nBerlin Amtsgericht Berlin (Charlottenburg) HRA 36948\nCapricornus Investment GmbH & Co. Norddeutsche Wohnanlagen KG – Berlin",
      "type": "Löschungsankündigung",
      "state": "Berlin",
      "amtsgericht": "Amtsgericht Berlin (Charlottenburg)",
      "registernummer": "HRA 36948",
      "registerart": "HRA",
      "company_name": "Capricornus Investment GmbH & Co. Norddeutsche Wohnanlagen KG",
      "company_seat": "Berlin",
      "details": "06.11.2025 (Bekanntmachungsdatum)\n\nBerlin Amtsgericht Berlin (Charlottenburg) HRA 36948\nLöschungsankündigung\n\nCapricornus Investment GmbH & Co. Norddeutsche Wohnanlagen KG\nKommanditgesellschaft\nBerlin\n\nBei dem nachstehenden Unternehmen / der nachstehenden Gesellschaft wird das Amtslöschungsverfahren gemäß § 31 Abs. 2 HGB eingeleitet. Widerspruchsfrist 2 Monate"
    },
    {
      "date": "2025-11-06",
      "id": "136484",
      "original_text": "Löschungsankündigung\nSchleswig-Holstein Amtsgericht Flensburg HRB 14359\nVerwaltungs- und Beteiligungsgesellschaft Nord mbH – Tarp",
      "type": "Löschungsankündigung",
      "state": "Schleswig-Holstein",
      "amtsgericht": "Amtsgericht Flensburg",
      "registernummer": "HRB 14359",
      "registerart": "HRB",
      "company_name": "Verwaltungs- und Beteiligungsgesellschaft Nord mbH",
      "company_seat": "Tarp",
      "details": "06.11.2025 (Bekanntmachungsdatum)\n\nSchleswig-Holstein Amtsgericht Flensburg HRB 14359\nLöschungsankündigung\n\nVerwaltungs- und Beteiligungsgesellschaft Nord mbH\nGesellschaft mit beschränkter Haftung\nTarp\n\nEs ist die Löschung der nachstehenden Gesellschaft wegen Vermögenslosigkeit gemäß § 394 FamFG beabsichtigt.\nWiderspruchsfrist: 2 Monate"
    },
    {
      "date": "2025-11-06",
      "id": "136485",
      "original_text": "Löschungsankündigung\nBerlin Amtsgericht Berlin (Charlottenburg) HRB 89246\navege Allgemeine Vermögensgesellschaft mbH – Berlin",
      "type": "Löschungsankündigung",
      "state": "Berlin",
      "amtsgericht": "Amtsgericht Berlin (Charlottenburg)",
      "registernummer": "HRB 89246",
      "registerart": "HRB",
      "company_name": "avege Allgemeine Vermögensgesellschaft mbH",
      "company_seat": "Berlin",
      "details": "06.11.2025 (Bekanntmachungsdatum)\n\nBerlin Amtsgericht Berlin (Charlottenburg) HRB 89246\nLöschungsankündigung\n\navege Allgemeine Vermögensgesellschaft mbH\nGesellschaft mit beschränkter Haftung\nBerlin\n\nBei der nachstehenden Gesellschaft wird das Amtslöschungsverfahren gemäß § 394 FamFG eingeleitet. Widerspruchsfrist 6 Wochen"
    },
    {
      "date": "2025-11-06",
      "id": "136486",
      "original_text": "Registerbekanntmachung nach dem Umwandlungsgesetz\nHamburg Amtsgericht Hamburg HRB 75628\nGROW Agency GmbH – Hamburg",
      "type": "Registerbekanntmachung nach dem Umwandlungsgesetz",
      "state": "Hamburg",
      "amtsgericht": "Amtsgericht Hamburg",
      "registernummer": "HRB 75628",
      "registerart": "HRB",
      "company_name": "GROW Agency GmbH",
      "company_seat": "Hamburg",
      "details": "06.11.2025 (Bekanntmachungsdatum)\n\nHamburg Amtsgericht Hamburg HRB 75628\nRegisterbekanntmachung nach dem Umwandlungsgesetz 06.11.2025 (Eintragungsdatum)\n\nGROW Agency GmbH\nGesellschaft mit beschränkter Haftung\nHamburg\n\nAls nicht eingetragen wird bekannt gemacht:\nDen Gläubigern der an der Verschmelzung beteiligten Gesellschaften ist, wenn sie binnen sechs Monaten nach dem Tag, an dem die Eintragung der Verschmelzung in das Register des Sitzes desjenigen Rechtsträgers, dessen Gläubiger sie sind, nach § 19 Absatz 3 UmwG als bekannt gemacht gilt, ihren Anspruch nach Grund und Höhe schriftlich anmelden, Sicherheit zu leisten, soweit sie nicht Befriedigung verlangen können. Dieses Recht steht den Gläubigern jedoch nur zu, wenn sie glaubhaft machen, dass durch die Verschmelzung die Erfüllung ihrer Forderung gefährdet wird."
    },
    {
      "date": "2025-11-06",
      "id": "136487",
      "original_text": "Registerbekanntmachung nach dem Umwandlungsgesetz\nBaden-Württemberg Amtsgericht Mannheim HRA 3551\nPHOENIX Pharmahandel GmbH & Co KG – Mannheim",
      "type": "Registerbekanntmachung nach dem Umwandlungsgesetz",
      "state": "Baden-Württemberg",
      "amtsgericht": "Amtsgericht Mannheim",
      "registernummer": "HRA 3551",
      "registerart": "HRA",
      "company_name": "PHOENIX Pharmahandel GmbH & Co KG",
      "company_seat": "Mannheim",
      "details": "06.11.2025 (Bekanntmachungsdatum)\n\nBaden-Württemberg Amtsgericht Mannheim HRA 3551\nRegisterbekanntmachung nach dem Umwandlungsgesetz 06.11.2025 (Eintragungsdatum)\n\nPHOENIX Pharmahandel GmbH & Co KG\nKommanditgesellschaft\nMannheim\n\nAls nicht eingetragen wird bekanntgemacht:\nDen Gläubigern der an der Abspaltung beteiligten Rechtsträger ist, wenn sie binnen sechs Monaten nach dem Tag, an dem die Eintragung der Abspaltung in das Register des Sitzes desjenigen Rechtsträgers, dessen Gläubiger sie sind, nach § 19 Abs. 3 UmwG als bekanntgemacht gilt, ihren Anspruch nach Grund und Höhe schriftlich anmelden, Sicherheit zu leisten, soweit sie nicht Befriedigung verlangen können. Dieses Recht steht den Gläubigern jedoch nur zu, wenn sie glaubhaft machen, dass durch die Abspaltung die Erfüllung ihrer Forderung gefährdet wird."
    },
    {
      "date": "2025-11-06",
      "id": "136488",
      "original_text": "Einreichung neuer Dokumente\nBaden-Württemberg Amtsgericht Freiburg HRB 581544\nHELIOS Spital Überlingen GmbH – Überlingen",
      "type": "Einreichung neuer Dokumente",
      "state": "Baden-Württemberg",
      "amtsgericht": "Amtsgericht Freiburg",
      "registernummer": "HRB 581544",
      "registerart": "HRB",
      "company_name": "HELIOS Spital Überlingen GmbH",
      "company_seat": "Überlingen",
      "details": "06.11.2025 (Bekanntmachungsdatum)\n\nBaden-Württemberg Amtsgericht Freiburg HRB 581544\nEinreichung neuer Dokumente 06.11.2025 (Eintragungsdatum)\n\nHELIOS Spital Überlingen GmbH\nGesellschaft mit beschränkter Haftung\nÜberlingen\n\nAls nicht eingetragen wird bekanntgemacht:\nDie Gesellschaft hat am 05.11.2025 die Liste über die Zusammensetzung des Aufsichtsrats zum Handelsregister eingereicht."
    },
    {
      "date": "2025-11-06",
      "id": "136489",
      "original_text": "Registerbekanntmachung nach dem Umwandlungsgesetz\nSaarland Amtsgericht Saarbrücken HRB 101722\nIqony Energies Beteiligungsgesellschaft 2 mbH – Saarbrücken",
      "type": "Registerbekanntmachung nach dem Umwandlungsgesetz",
      "state": "Saarland",
      "amtsgericht": "Amtsgericht Saarbrücken",
      "registernummer": "HRB 101722",
      "registerart": "HRB",
      "company_name": "Iqony Energies Beteiligungsgesellschaft 2 mbH",
      "company_seat": "Saarbrücken",
      "details": "06.11.2025 (Bekanntmachungsdatum)\n\nSaarland Amtsgericht Saarbrücken HRB 101722\nRegisterbekanntmachung nach dem Umwandlungsgesetz 06.11.2025 (Eintragungsdatum)\n\nIqony Energies Beteiligungsgesellschaft 2 mbH\nGesellschaft mit beschränkter Haftung\nSaarbrücken\n\nAls nicht eingetragen wird bekannt gemacht: Den Gläubigern der an der Abspaltung beteiligten Gesellschaften ist, wenn sie binnen sechs Monaten nach dem Tag, an dem die Eintragung der Abspaltung  in das Register des Sitzes desjenigen Rechtsträgers, dessen Gläubiger sie sind, nach § 19 Absatz 3 UmwG bekannt gemacht worden ist, ihren Anspruch nach Grund und Höhe schriftlich anmelden, Sicherheit zu leisten, soweit sie nicht Befriedigung verlangen können. Dieses Recht steht den Gläubigern jedoch nur zu, wenn sie glaubhaft machen, dass durch die Abspaltung die Erfüllung ihrer Forderung gefährdet wird."
    },
    {
      "date": "2025-11-06",
      "id": "136490",
      "original_text": "Registerbekanntmachung nach dem Umwandlungsgesetz\nSaarland Amtsgericht Saarbrücken HRB 101815\nIqony Energies Beteiligungsgesellschaft 1 mbH – Saarbrücken",
      "type": "Registerbekanntmachung nach dem Umwandlungsgesetz",
      "state": "Saarland",
      "amtsgericht": "Amtsgericht Saarbrücken",
      "registernummer": "HRB 101815",
      "registerart": "HRB",
      "company_name": "Iqony Energies Beteiligungsgesellschaft 1 mbH",
      "company_seat": "Saarbrücken",
      "details": "06.11.2025 (Bekanntmachungsdatum)\n\nSaarland Amtsgericht Saarbrücken HRB 101815\nRegisterbekanntmachung nach dem Umwandlungsgesetz 06.11.2025 (Eintragungsdatum)\n\nIqony Energies Beteiligungsgesellschaft 1 mbH\nGesellschaft mit beschränkter Haftung\nSaarbrücken\n\nAls nicht eingetragen wird bekannt gemacht: Den Gläubigern der an der Abspaltung  beteiligten Gesellschaften ist, wenn sie binnen sechs Monaten nach dem Tag, an dem die Eintragung der Abspaltung in das Register des Sitzes desjenigen Rechtsträgers, dessen Gläubiger sie sind, nach § 19 Absatz 3 UmwG bekannt gemacht worden ist, ihren Anspruch nach Grund und Höhe schriftlich anmelden, Sicherheit zu leisten, soweit sie nicht Befriedigung verlangen können. Dieses Recht steht den Gläubigern jedoch nur zu, wenn sie glaubhaft machen, dass durch die Abspaltung  die Erfüllung ihrer Forderung gefährdet wird."
    },
    {
      "date": "2025-11-06",
      "id": "136491",
      "original_text": "Registerbekanntmachung nach dem Umwandlungsgesetz\nBaden-Württemberg Amtsgericht Mannheim HRB 361957\nLuminator Germany GmbH – Rastatt",
      "type": "Registerbekanntmachung nach dem Umwandlungsgesetz",
      "state": "Baden-Württemberg",
      "amtsgericht": "Amtsgericht Mannheim",
      "registernummer": "HRB 361957",
      "registerart": "HRB",
      "company_name": "Luminator Germany GmbH",
      "company_seat": "Rastatt",
      "details": "06.11.2025 (Bekanntmachungsdatum)\n\nBaden-Württemberg Amtsgericht Mannheim HRB 361957\nRegisterbekanntmachung nach dem Umwandlungsgesetz 06.11.2025 (Eintragungsdatum)\n\nLuminator Germany GmbH\nGesellschaft mit beschränkter Haftung\nRastatt\n\nAls nicht eingetragen wird bekanntgemacht:\nDen Gläubigern der an der Verschmelzung beteiligten Rechtsträger ist, wenn sie binnen sechs Monaten nach dem Tag, an dem die Eintragung der Verschmelzung in das Register des Sitzes desjenigen Rechtsträgers, dessen Gläubiger sie sind, nach § 19 Abs. 3 UmwG als bekanntgemacht gilt, ihren Anspruch nach Grund und Höhe schriftlich anmelden, Sicherheit zu leisten, soweit sie nicht Befriedigung verlangen können. Dieses Recht steht den Gläubigern jedoch nur zu, wenn sie glaubhaft machen, dass durch die Verschmelzung die Erfüllung ihrer Forderung gefährdet wird."
    },
    {
      "date": "2025-11-06",
      "id": "136492",
      "original_text": "Registerbekanntmachung nach dem Umwandlungsgesetz\nBaden-Württemberg Amtsgericht Stuttgart HRB 381879\nHögg Verkehrssicherung GmbH – Nehren",
      "type": "Registerbekanntmachung nach dem Umwandlungsgesetz",
      "state": "Baden-Württemberg",
      "amtsgericht": "Amtsgericht Stuttgart",
      "registernummer": "HRB 381879",
      "registerart": "HRB",
      "company_name": "Högg Verkehrssicherung GmbH",
      "company_seat": "Nehren",
      "details": "06.11.2025 (Bekanntmachungsdatum)\n\nBaden-Württemberg Amtsgericht Stuttgart HRB 381879\nRegisterbekanntmachung nach dem Umwandlungsgesetz 06.11.2025 (Eintragungsdatum)\n\nHögg Verkehrssicherung GmbH\nGesellschaft mit beschränkter Haftung\nNehren\n\nAls nicht eingetragen wird bekanntgemacht:\nDen Gläubigern des an dem Formwechsel beteiligten Rechtsträgers ist, wenn sie binnen sechs Monaten nach dem Tag, an dem die Eintragung des Formwechsels in das Register des Sitzes desjenigen Rechtsträgers, dessen Gläubiger sie sind, nach § 19 Abs. 3 UmwG als bekanntgemacht gilt, ihren Anspruch nach Grund und Höhe schriftlich anmelden, Sicherheit zu leisten, soweit sie nicht Befriedigung verlangen können. Dieses Recht steht den Gläubigern jedoch nur zu, wenn sie glaubhaft machen, dass durch den Formwechsel die Erfüllung ihrer Forderung gefährdet wird."
    },
    {
      "date": "2025-11-06",
      "id": "136493",
      "original_text": "Registerbekanntmachung nach dem Umwandlungsgesetz\nHamburg Amtsgericht Hamburg HRA 132775\nAhmed Minwer e.K. – Hamburg",
      "type": "Registerbekanntmachung nach dem Umwandlungsgesetz",
      "state": "Hamburg",
      "amtsgericht": "Amtsgericht Hamburg",
      "registernummer": "HRA 132775",
      "registerart": "HRA",
      "company_name": "Ahmed Minwer e.K.",
      "company_seat": "Hamburg",
      "details": "06.11.2025 (Bekanntmachungsdatum)\n\nHamburg Amtsgericht Hamburg HRA 132775\nRegisterbekanntmachung nach dem Umwandlungsgesetz 06.11.2025 (Eintragungsdatum)\n\nAhmed Minwer e.K.\nEinzelkaufmann\nHamburg\n\nAls nicht eingetragen wird bekannt gemacht:\nDen Gläubigern der an der Ausgliederung beteiligten Gesellschaften ist, wenn sie binnen sechs Monaten nach dem Tag, an dem die Eintragung der Ausgliederung in das Register des Sitzes desjenigen Rechtsträgers, dessen Gläubiger sie sind, nach § 19 Absatz 3 UmwG als bekannt gemacht gilt, ihren Anspruch nach Grund und Höhe schriftlich anmelden, Sicherheit zu leisten, soweit sie nicht Befriedigung verlangen können. Dieses Recht steht den Gläubigern jedoch nur zu, wenn sie glaubhaft machen, dass durch die Ausgliederung die Erfüllung ihrer Forderung gefährdet wird."
    },
    {
      "date": "2025-11-06",
      "id": "136494",
      "original_text": "Registerbekanntmachung nach dem Umwandlungsgesetz\nHamburg Amtsgericht Hamburg HRB 195221\nMinwer Auto Pflege GmbH – Hamburg",
      "type": "Registerbekanntmachung nach dem Umwandlungsgesetz",
      "state": "Hamburg",
      "amtsgericht": "Amtsgericht Hamburg",
      "registernummer": "HRB 195221",
      "registerart": "HRB",
      "company_name": "Minwer Auto Pflege GmbH",
      "company_seat": "Hamburg",
      "details": "06.11.2025 (Bekanntmachungsdatum)\n\nHamburg Amtsgericht Hamburg HRB 195221\nRegisterbekanntmachung nach dem Umwandlungsgesetz 06.11.2025 (Eintragungsdatum)\n\nMinwer Auto Pflege GmbH\nGesellschaft mit beschränkter Haftung\nHamburg\n\nAls nicht eingetragen wird bekannt gemacht:\nDen Gläubigern der an der Ausgliederung beteiligten Gesellschaften ist, wenn sie binnen sechs Monaten nach dem Tag, an dem die Eintragung der Ausgliederung in das Register des Sitzes desjenigen Rechtsträgers, dessen Gläubiger sie sind, nach § 19 Absatz 3 UmwG als bekannt gemacht gilt, ihren Anspruch nach Grund und Höhe schriftlich anmelden, Sicherheit zu leisten, soweit sie nicht Befriedigung verlangen können. Dieses Recht steht den Gläubigern jedoch nur zu, wenn sie glaubhaft machen, dass durch die Ausgliederung die Erfüllung ihrer Forderung gefährdet wird."
    },
    {
      "date": "2025-11-06",
      "id": "136495",
      "original_text": "Löschungsankündigung\nBerlin Amtsgericht Berlin (Charlottenburg) HRB 208534\nMount Cristo Records GmbH – Berlin",
      "type": "Löschungsankündigung",
      "state": "Berlin",
      "amtsgericht": "Amtsgericht Berlin (Charlottenburg)",
      "registernummer": "HRB 208534",
      "registerart": "HRB",
      "company_name": "Mount Cristo Records GmbH",
      "company_seat": "Berlin",
      "details": "06.11.2025 (Bekanntmachungsdatum)\n\nBerlin Amtsgericht Berlin (Charlottenburg) HRB 208534\nLöschungsankündigung\n\nMount Cristo Records GmbH\nGesellschaft mit beschränkter Haftung\nBerlin\n\nBei der nachstehenden Gesellschaft wird das Amtslöschungsverfahren gemäß § 394 FamFG eingeleitet. Widerspruchsfrist 6 Wochen"
    },
    {
      "date": "2025-11-06",
      "id": "136496",
      "original_text": "Löschungsankündigung\nBerlin Amtsgericht Berlin (Charlottenburg) HRA 49595\nTQ Beteiligungen Fercher Straße GmbH & Co. KG – Berlin",
      "type": "Löschungsankündigung",
      "state": "Berlin",
      "amtsgericht": "Amtsgericht Berlin (Charlottenburg)",
      "registernummer": "HRA 49595",
      "registerart": "HRA",
      "company_name": "TQ Beteiligungen Fercher Straße GmbH & Co. KG",
      "company_seat": "Berlin",
      "details": "06.11.2025 (Bekanntmachungsdatum)\n\nBerlin Amtsgericht Berlin (Charlottenburg) HRA 49595\nLöschungsankündigung\n\nTQ Beteiligungen Fercher Straße GmbH & Co. KG\nKommanditgesellschaft\nBerlin\n\nBei dem nachstehenden Unternehmen / der nachstehenden Gesellschaft wird das Amtslöschungsverfahren gemäß § 31 Abs. 2 HGB eingeleitet. Widerspruchsfrist 1 Monat"
    },
    {
      "date": "2025-11-06",
      "id": "136497",
      "original_text": "Einreichung neuer Dokumente\nThüringen Amtsgericht Jena HRB 517998\nneurocare group AG – Ilmenau",
      "type": "Einreichung neuer Dokumente",
      "state": "Thüringen",
      "amtsgericht": "Amtsgericht Jena",
      "registernummer": "HRB 517998",
      "registerart": "HRB",
      "company_name": "neurocare group AG",
      "company_seat": "Ilmenau",
      "details": "06.11.2025 (Bekanntmachungsdatum)\n\nThüringen Amtsgericht Jena HRB 517998\nEinreichung neuer Dokumente 06.11.2025 (Eintragungsdatum)\n\nneurocare group AG\nAktiengesellschaft\nIlmenau\n\nBekanntmachung gem. § 106 AktG: Aufgrund einer Veränderung in den Personen der Aufsichtsratsmitglieder ist durch den Vorstand eine neue Liste zum Handelsregister eingereicht worden."
    },
    {
      "date": "2025-11-06",
      "id": "136498",
      "original_text": "Sonstige Registerbekanntmachung\nHamburg Amtsgericht Hamburg HRB 71693\nBÖAG Beteiligungs-Aktiengesellschaft – Hamburg",
      "type": "Sonstige Registerbekanntmachung",
      "state": "Hamburg",
      "amtsgericht": "Amtsgericht Hamburg",
      "registernummer": "HRB 71693",
      "registerart": "HRB",
      "company_name": "BÖAG Beteiligungs-Aktiengesellschaft",
      "company_seat": "Hamburg",
      "details": "06.11.2025 (Bekanntmachungsdatum)\n\nHamburg Amtsgericht Hamburg HRB 71693\nSonstige Registerbekanntmachung\n\nBÖAG Beteiligungs-Aktiengesellschaft\nAktiengesellschaft\nHamburg\n\nAls nicht eingetragen wird bekannt gemacht: Liste des Aufsichtsrats wurde eingereicht."
    },
    {
      "date": "2025-11-06",
      "id": "136499",
      "original_text": "Löschungsankündigung\nBrandenburg Amtsgericht Potsdam HRB 29812\nDLZ.BB - Dienstleistungs- & Transportservice UG (haftungsbeschränkt) – Blankenfelde-Mahlow",
      "type": "Löschungsankündigung",
      "state": "Brandenburg",
      "amtsgericht": "Amtsgericht Potsdam",
      "registernummer": "HRB 29812",
      "registerart": "HRB",
      "company_name": "DLZ.BB - Dienstleistungs- & Transportservice UG (haftungsbeschränkt)",
      "company_seat": "Blankenfelde-Mahlow",
      "details": "06.11.2025 (Bekanntmachungsdatum)\n\nBrandenburg Amtsgericht Potsdam HRB 29812\nLöschungsankündigung\n\nDLZ.BB - Dienstleistungs- & Transportservice UG (haftungsbeschränkt)\nGesellschaft mit beschränkter Haftung\nBlankenfelde-Mahlow\n\nBei der nachstehenden Gesellschaft wird das Amtslöschungsverfahren gemäß § 394 FamFG eingeleitet. Widerspruchsfrist: 8 Wochen"
    },
    {
      "date": "2025-11-06",
      "id": "136500",
      "original_text": "Löschungsankündigung\nBerlin Amtsgericht Berlin (Charlottenburg) HRB 170136\nNexterday UG (haftungsbeschränkt) – Berlin",
      "type": "Löschungsankündigung",
      "state": "Berlin",
      "amtsgericht": "Amtsgericht Berlin (Charlottenburg)",
      "registernummer": "HRB 170136",
      "registerart": "HRB",
      "company_name": "Nexterday UG (haftungsbeschränkt)",
      "company_seat": "Berlin",
      "details": "06.11.2025 (Bekanntmachungsdatum)\n\nBerlin Amtsgericht Berlin (Charlottenburg) HRB 170136\nLöschungsankündigung\n\nNexterday UG (haftungsbeschränkt)\nGesellschaft mit beschränkter Haftung\nBerlin\n\nBei der nachstehenden Gesellschaft wird das Amtslöschungsverfahren gemäß § 394 FamFG eingeleitet. Widerspruchsfrist 6 Wochen"
    },
    {
      "date": "2025-11-06",
      "id": "136501",
      "original_text": "Registerbekanntmachung nach dem Umwandlungsgesetz\nBaden-Württemberg Amtsgericht Stuttgart HRB 800565\nDassault Systemes Innovation Technology GmbH – Stuttgart",
      "type": "Registerbekanntmachung nach dem Umwandlungsgesetz",
      "state": "Baden-Württemberg",
      "amtsgericht": "Amtsgericht Stuttgart",
      "registernummer": "HRB 800565",
      "registerart": "HRB",
      "company_name": "Dassault Systemes Innovation Technology GmbH",
      "company_seat": "Stuttgart",
      "details": "06.11.2025 (Bekanntmachungsdatum)\n\nBaden-Württemberg Amtsgericht Stuttgart HRB 800565\nRegisterbekanntmachung nach dem Umwandlungsgesetz 06.11.2025 (Eintragungsdatum)\n\nDassault Systemes Innovation Technology GmbH\nGesellschaft mit beschränkter Haftung\nStuttgart\n\nAls nicht eingetragen wird bekanntgemacht:\nDen Gläubigern der an der Verschmelzung beteiligten Rechtsträger ist, wenn sie binnen sechs Monaten nach dem Tag, an dem die Eintragung der Verschmelzung in das Register des Sitzes desjenigen Rechtsträgers, dessen Gläubiger sie sind, nach § 19 Abs. 3 UmwG als bekanntgemacht gilt, ihren Anspruch nach Grund und Höhe schriftlich anmelden, Sicherheit zu leisten, soweit sie nicht Befriedigung verlangen können. Dieses Recht steht den Gläubigern jedoch nur zu, wenn sie glaubhaft machen, dass durch die Verschmelzung die Erfüllung ihrer Forderung gefährdet wird."
    },
    {
      "date": "2025-11-06",
      "id": "136502",
      "original_text": "Löschungsankündigung\nBrandenburg Amtsgericht Neuruppin HRB 11273\nSBU Elbe-Weser GmbH – Schwedt/Oder",
      "type": "Löschungsankündigung",
      "state": "Brandenburg",
      "amtsgericht": "Amtsgericht Neuruppin",
      "registernummer": "HRB 11273",
      "registerart": "HRB",
      "company_name": "SBU Elbe-Weser GmbH",
      "company_seat": "Schwedt/Oder",
      "details": "06.11.2025 (Bekanntmachungsdatum)\n\nBrandenburg Amtsgericht Neuruppin HRB 11273\nLöschungsankündigung\n\nSBU Elbe-Weser GmbH\nGesellschaft mit beschränkter Haftung\nSchwedt/Oder\n\nBei der nachstehenden Gesellschaft wird das Amtslöschungsverfahren gemäß § 394 FamFG eingeleitet.\nWiderspruchsfrist: 1 Monat"
    },
    {
      "date": "2025-11-06",
      "id": "136503",
      "original_text": "Löschungsankündigung\nNordrhein-Westfalen Amtsgericht Coesfeld HRB 3505\nNEV Verwaltungsgesellschaft mbH – Vreden",
      "type": "Löschungsankündigung",
      "state": "Nordrhein-Westfalen",
      "amtsgericht": "Amtsgericht Coesfeld",
      "registernummer": "HRB 3505",
      "registerart": "HRB",
      "company_name": "NEV Verwaltungsgesellschaft mbH",
      "company_seat": "Vreden",
      "details": "06.11.2025 (Bekanntmachungsdatum)\n\nNordrhein-Westfalen Amtsgericht Coesfeld HRB 3505\nLöschungsankündigung\n\nNEV Verwaltungsgesellschaft mbH\nGesellschaft mit beschränkter Haftung\nVreden\n\nDas Registergericht beabsichtigt, den Rechtsträger wegen Vermögenslosigkeit gemäß § 394 FamFG von Amts wegen zu löschen.\n\nGegen diese Verfügung kann Widerspruch eingelegt werden. Die Frist zur Erhebung eines Widerspruchs gegen die beabsichtigte Löschung ist auf zwei Monate ab Veröffentlichung festgesetzt."
    },
    {
      "date": "2025-11-06",
      "id": "136504",
      "original_text": "Löschungsankündigung\nBaden-Württemberg Amtsgericht Mannheim HRB 729272\nB.I.G. Rohrleitungsbau und Armaturenservice GmbH – Lauda-Königshofen",
      "type": "Löschungsankündigung",
      "state": "Baden-Württemberg",
      "amtsgericht": "Amtsgericht Mannheim",
      "registernummer": "HRB 729272",
      "registerart": "HRB",
      "company_name": "B.I.G. Rohrleitungsbau und Armaturenservice GmbH",
      "company_seat": "Lauda-Königshofen",
      "details": "06.11.2025 (Bekanntmachungsdatum)\n\nBaden-Württemberg Amtsgericht Mannheim HRB 729272\nLöschungsankündigung\n\nB.I.G. Rohrleitungsbau und Armaturenservice GmbH\nGesellschaft mit beschränkter Haftung\nLauda-Königshofen\n\nDas Gericht beabsichtigt, die Gesellschaft wegen Vermögenslosigkeit im Handelsregister von Amts wegen nach § 394 FamFG zu löschen. Die Frist zur Geltendmachung eines Widerspruchs gegen die beabsichtigte Löschung ist auf einen Monat ab Veröffentlichung bestimmt."
    },
    {
      "date": "2025-11-06",
      "id": "136505",
      "original_text": "Löschungsankündigung\nBaden-Württemberg Amtsgericht Mannheim HRB 360824\nVermietungs- und Verwaltungsgesellschaft atro Akustik- und Trockenbau mbH – Ettlingen",
      "type": "Löschungsankündigung",
      "state": "Baden-Württemberg",
      "amtsgericht": "Amtsgericht Mannheim",
      "registernummer": "HRB 360824",
      "registerart": "HRB",
      "company_name": "Vermietungs- und Verwaltungsgesellschaft atro Akustik- und Trockenbau mbH",
      "company_seat": "Ettlingen",
      "details": "06.11.2025 (Bekanntmachungsdatum)\n\nBaden-Württemberg Amtsgericht Mannheim HRB 360824\nLöschungsankündigung\n\nVermietungs- und Verwaltungsgesellschaft atro Akustik- und Trockenbau mbH\nGesellschaft mit beschränkter Haftung\nEttlingen\n\nDas Gericht beabsichtigt, die Gesellschaft wegen Vermögenslosigkeit im Handelsregister von Amts wegen nach § 394 FamFG zu löschen. Die Frist zur Geltendmachung eines Widerspruchs gegen die beabsichtigte Löschung ist auf einen Monat ab Veröffentlichung bestimmt."
    },
    {
      "date": "2025-11-06",
      "id": "136506",
      "original_text": "Registerbekanntmachung nach dem Umwandlungsgesetz\nBerlin Amtsgericht Berlin (Charlottenburg) HRB 214175\nSporiTrade GmbH – Berlin",
      "type": "Registerbekanntmachung nach dem Umwandlungsgesetz",
      "state": "Berlin",
      "amtsgericht": "Amtsgericht Berlin (Charlottenburg)",
      "registernummer": "HRB 214175",
      "registerart": "HRB",
      "company_name": "SporiTrade GmbH",
      "company_seat": "Berlin",
      "details": "06.11.2025 (Bekanntmachungsdatum)\n\nBerlin Amtsgericht Berlin (Charlottenburg) HRB 214175\nRegisterbekanntmachung nach dem Umwandlungsgesetz 06.11.2025 (Eintragungsdatum)\n\nSporiTrade GmbH\nGesellschaft mit beschränkter Haftung\nBerlin\n\nZu Eintragungsnummer 25 vom 06.11.2025 wird als nicht eingetragen veröffentlicht: Den Gläubigern der an der Verschmelzung beteiligten Rechtsträger ist, wenn sie binnen sechs Monaten nach dem Tag, an dem die Eintragung der Verschmelzung in das Register des Sitzes desjenigen Rechtsträgers, dessen Gläubiger sie sind, als bekannt gemacht gilt, ihren Anspruch nach Grund und Höhe schriftlich anmelden, Sicherheit zu leisten, soweit sie nicht Befriedigung verlangen können. Dieses Recht steht den Gläubigern jedoch nur zu, wenn sie glaubhaft machen, dass durch die Verschmelzung die Erfüllung ihrer Forderung gefährdet wird. Das Recht, Sicherheitsleistung zu verlangen, steht Gläubigern nicht zu, die im Falle der Insolvenz ein Recht auf vorzugsweise Befriedigung aus einer Deckungsmasse haben, die nach gesetzlicher Vorschrift zu ihrem Schutz errichtet und staatlich überwacht ist."
    },
    {
      "date": "2025-11-06",
      "id": "136507",
      "original_text": "Registerbekanntmachung nach dem Umwandlungsgesetz\nBaden-Württemberg Amtsgericht Stuttgart HRA 742579\nHandycenter Grau e.K. – Calw",
      "type": "Registerbekanntmachung nach dem Umwandlungsgesetz",
      "state": "Baden-Württemberg",
      "amtsgericht": "Amtsgericht Stuttgart",
      "registernummer": "HRA 742579",
      "registerart": "HRA",
      "company_name": "Handycenter Grau e.K.",
      "company_seat": "Calw",
      "details": "06.11.2025 (Bekanntmachungsdatum)\n\nBaden-Württemberg Amtsgericht Stuttgart HRA 742579\nRegisterbekanntmachung nach dem Umwandlungsgesetz 06.11.2025 (Eintragungsdatum)\n\nHandycenter Grau e.K.\nEinzelkaufmann / Einzelkauffrau\nCalw\n\nAls nicht eingetragen wird bekanntgemacht:\nDen Gläubigern der an der Ausgliederung beteiligten Rechtsträger ist, wenn sie binnen sechs Monaten nach dem Tag, an dem die Eintragung der Ausgliederung in das Register des Sitzes desjenigen Rechtsträgers, dessen Gläubiger sie sind, nach § 19 Abs. 3 UmwG als bekanntgemacht gilt, ihren Anspruch nach Grund und Höhe schriftlich anmelden, Sicherheit zu leisten, soweit sie nicht Befriedigung verlangen können. Dieses Recht steht den Gläubigern jedoch nur zu, wenn sie glaubhaft machen, dass durch die Ausgliederung die Erfüllung ihrer Forderung gefährdet wird."
    },
    {
      "date": "2025-11-06",
      "id": "136508",
      "original_text": "Einreichung neuer Dokumente\nBaden-Württemberg Amtsgericht Ulm HRB 510515\nNetCom BW GmbH – Ellwangen Jagst",
      "type": "Einreichung neuer Dokumente",
      "state": "Baden-Württemberg",
      "amtsgericht": "Amtsgericht Ulm",
      "registernummer": "HRB 510515",
      "registerart": "HRB",
      "company_name": "NetCom BW GmbH",
      "company_seat": "Ellwangen Jagst",
      "details": "06.11.2025 (Bekanntmachungsdatum)\n\nBaden-Württemberg Amtsgericht Ulm HRB 510515\nEinreichung neuer Dokumente\n\nNetCom BW GmbH\nGesellschaft mit beschränkter Haftung\nEllwangen Jagst\n\nDie Gesellschaft hat am 05.11.2025 die Liste über die Zusammensetzung des Aufsichtsrats zum Handelsregister eingereicht."
    },
    {
      "date": "2025-11-06",
      "id": "136509",
      "original_text": "Sonstige Registerbekanntmachung\nBaden-Württemberg Amtsgericht Mannheim HRB 703046\nHeidelberger Straßen- und Bergbahn GmbH – Heidelberg",
      "type": "Sonstige Registerbekanntmachung",
      "state": "Baden-Württemberg",
      "amtsgericht": "Amtsgericht Mannheim",
      "registernummer": "HRB 703046",
      "registerart": "HRB",
      "company_name": "Heidelberger Straßen- und Bergbahn GmbH",
      "company_seat": "Heidelberg",
      "details": "06.11.2025 (Bekanntmachungsdatum)\n\nBaden-Württemberg Amtsgericht Mannheim HRB 703046\nSonstige Registerbekanntmachung\n\nHeidelberger Straßen- und Bergbahn GmbH\nGesellschaft mit beschränkter Haftung\nHeidelberg\n\nDie Gesellschaft hat am 05.11.2025 die Liste über die Zusammensetzung des Aufsichtsrats zum Handelsregister eingereicht."
    },
    {
      "date": "2025-11-06",
      "id": "136510",
      "original_text": "Löschungsankündigung\nBerlin Amtsgericht Berlin (Charlottenburg) HRB 127834\nASE Express (Deutschland) GmbH – Berlin",
      "type": "Löschungsankündigung",
      "state": "Berlin",
      "amtsgericht": "Amtsgericht Berlin (Charlottenburg)",
      "registernummer": "HRB 127834",
      "registerart": "HRB",
      "company_name": "ASE Express (Deutschland) GmbH",
      "company_seat": "Berlin",
      "details": "06.11.2025 (Bekanntmachungsdatum)\n\nBerlin Amtsgericht Berlin (Charlottenburg) HRB 127834\nLöschungsankündigung\n\nASE Express (Deutschland) GmbH\nGesellschaft mit beschränkter Haftung\nBerlin\n\nBei der nachstehenden Gesellschaft wird das Amtslöschungsverfahren gemäß § 394 FamFG eingeleitet. Widerspruchsfrist 6 Wochen"
    },
    {
      "date": "2025-11-06",
      "id": "136511",
      "original_text": "Löschungsankündigung\nBaden-Württemberg Amtsgericht Stuttgart HRB 733976\nIGH Immobilien-Gesellschaft-Heilbronn GmbH – Heilbronn",
      "type": "Löschungsankündigung",
      "state": "Baden-Württemberg",
      "amtsgericht": "Amtsgericht Stuttgart",
      "registernummer": "HRB 733976",
      "registerart": "HRB",
      "company_name": "IGH Immobilien-Gesellschaft-Heilbronn GmbH",
      "company_seat": "Heilbronn",
      "details": "06.11.2025 (Bekanntmachungsdatum)\n\nBaden-Württemberg Amtsgericht Stuttgart HRB 733976\nLöschungsankündigung\n\nIGH Immobilien-Gesellschaft-Heilbronn GmbH\nGesellschaft mit beschränkter Haftung\nHeilbronn\n\nDas Gericht beabsichtigt, die Gesellschaft wegen Vermögenslosigkeit im Handelsregister von Amts wegen nach § 394 FamFG zu löschen. Die Frist zur Geltendmachung eines Widerspruchs gegen die beabsichtigte Löschung ist auf zwei Monate ab Veröffentlichung bestimmt."
    },
    {
      "date": "2025-11-06",
      "id": "136512",
      "original_text": "Sonstige Registerbekanntmachung\nBerlin Amtsgericht Berlin (Charlottenburg) HRB 109706\nFattal Leonardo Royal München GmbH – Berlin",
      "type": "Sonstige Registerbekanntmachung",
      "state": "Berlin",
      "amtsgericht": "Amtsgericht Berlin (Charlottenburg)",
      "registernummer": "HRB 109706",
      "registerart": "HRB",
      "company_name": "Fattal Leonardo Royal München GmbH",
      "company_seat": "Berlin",
      "details": "06.11.2025 (Bekanntmachungsdatum)\n\nBerlin Amtsgericht Berlin (Charlottenburg) HRB 109706\nSonstige Registerbekanntmachung\n\nFattal Leonardo Royal München GmbH\nGesellschaft mit beschränkter Haftung\nBerlin\n\nAls nicht eingetragen wird veröffentlicht: Der andere Vertragsteil hat den Gläubigern dieses Rechtsträgers, deren Forderungen begründet worden sind, bevor die Eintragung der Beendigung dieses Vertrages in das Handelsregister nach § 10 des Handelsgesetzbuches als bekannt gemacht gilt, Sicherheit zu leisten, wenn sie sich binnen sechs Monaten nach der Bekanntmachung der Eintragung zu diesem Zweck bei ihm melden. Dieses Recht steht den Gläubigern nicht zu, die im Fall des Insolvenzverfahrens ein Recht auf vorzugsweise Befriedigung aus der Deckungsmasse haben, die nach gesetzlicher Vorschrift zu ihrem Schutz errichtet und staatlich überwacht ist."
    },
    {
      "date": "2025-11-06",
      "id": "136513",
      "original_text": "Registerbekanntmachung nach dem Umwandlungsgesetz\nBaden-Württemberg Amtsgericht Stuttgart HRA 742751\nSTA Beteiligungs GmbH & Co. KG – Wendlingen am Neckar",
      "type": "Registerbekanntmachung nach dem Umwandlungsgesetz",
      "state": "Baden-Württemberg",
      "amtsgericht": "Amtsgericht Stuttgart",
      "registernummer": "HRA 742751",
      "registerart": "HRA",
      "company_name": "STA Beteiligungs GmbH & Co. KG",
      "company_seat": "Wendlingen am Neckar",
      "details": "06.11.2025 (Bekanntmachungsdatum)\n\nBaden-Württemberg Amtsgericht Stuttgart HRA 742751\nRegisterbekanntmachung nach dem Umwandlungsgesetz 06.11.2025 (Eintragungsdatum)\n\nSTA Beteiligungs GmbH & Co. KG\nKommanditgesellschaft\nWendlingen am Neckar\n\nAls nicht eingetragen wird bekanntgemacht:\nDen Gläubigern der an der Ausgliederung beteiligten Rechtsträger ist, wenn sie binnen sechs Monaten nach dem Tag, an dem die Eintragung der Ausgliederung in das Register des Sitzes desjenigen Rechtsträgers, dessen Gläubiger sie sind, nach § 19 Abs. 3 UmwG als bekanntgemacht gilt, ihren Anspruch nach Grund und Höhe schriftlich anmelden, Sicherheit zu leisten, soweit sie nicht Befriedigung verlangen können. Dieses Recht steht den Gläubigern jedoch nur zu, wenn sie glaubhaft machen, dass durch die Ausgliederung die Erfüllung ihrer Forderung gefährdet wird."
    },
    {
      "date": "2025-11-06",
      "id": "136514",
      "original_text": "Einreichung neuer Dokumente\nSachsen Amtsgericht Chemnitz HRB 1666\nVolkswagen Sachsen GmbH – Zwickau",
      "type": "Einreichung neuer Dokumente",
      "state": "Sachsen",
      "amtsgericht": "Amtsgericht Chemnitz",
      "registernummer": "HRB 1666",
      "registerart": "HRB",
      "company_name": "Volkswagen Sachsen GmbH",
      "company_seat": "Zwickau",
      "details": "06.11.2025 (Bekanntmachungsdatum)\n\nSachsen Amtsgericht Chemnitz HRB 1666\nEinreichung neuer Dokumente\n\nVolkswagen Sachsen GmbH\nGesellschaft mit beschränkter Haftung\nZwickau\n\nAm 03.11.2025 wurde beim Handelsregister des Amtsgerichts Chemnitz die Liste der Mitglieder des Aufsichtsrats gemäß § 52 GmbHG eingereicht."
    },
    {
      "date": "2025-11-06",
      "id": "136515",
      "original_text": "Registerbekanntmachung nach dem Umwandlungsgesetz\nSachsen Amtsgericht Chemnitz HRB 25063\nSa-Ba-Service GmbH – Mülsen",
      "type": "Registerbekanntmachung nach dem Umwandlungsgesetz",
      "state": "Sachsen",
      "amtsgericht": "Amtsgericht Chemnitz",
      "registernummer": "HRB 25063",
      "registerart": "HRB",
      "company_name": "Sa-Ba-Service GmbH",
      "company_seat": "Mülsen",
      "details": "06.11.2025 (Bekanntmachungsdatum)\n\nSachsen Amtsgericht Chemnitz HRB 25063\nRegisterbekanntmachung nach dem Umwandlungsgesetz 06.11.2025 (Eintragungsdatum)\n\nSa-Ba-Service GmbH\nGesellschaft mit beschränkter Haftung\nMülsen\n\nDen Gläubigern der an der Verschmelzung beteiligten Rechtsträger ist, wenn sie binnen sechs Monaten nach dem Tag, an dem die Eintragung der Verschmelzung in das Register des Sitzes desjenigen Rechtsträgers, dessen Gläubiger sie sind, nach § 19 Abs. 3 UmwG als bekannt gemacht gilt, ihren Anspruch nach Grund und Höhe in Textform anmelden, Sicherheit zu leisten, soweit sie nicht Befriedigung verlangen können. Dieses Recht steht den Gläubigern jedoch nur zu, wenn sie glaubhaft machen, dass durch die Verschmelzung die Erfüllung der Forderung gefährdet wird."
    },
    {
      "date": "2025-11-06",
      "id": "136516",
      "original_text": "Registerbekanntmachung nach dem Umwandlungsgesetz\nSachsen Amtsgericht Leipzig HRB 649\nCommpanion GmbH – Leipzig",
      "type": "Registerbekanntmachung nach dem Umwandlungsgesetz",
      "state": "Sachsen",
      "amtsgericht": "Amtsgericht Leipzig",
      "registernummer": "HRB 649",
      "registerart": "HRB",
      "company_name": "Commpanion GmbH",
      "company_seat": "Leipzig",
      "details": "06.11.2025 (Bekanntmachungsdatum)\n\nSachsen Amtsgericht Leipzig HRB 649\nRegisterbekanntmachung nach dem Umwandlungsgesetz 06.11.2025 (Eintragungsdatum)\n\nCommpanion GmbH\nGesellschaft mit beschränkter Haftung\nLeipzig\n\nDen Gläubigern der an der Verschmelzung beteiligten Rechtsträger ist, wenn sie binnen sechs Monaten nach dem Tag, an dem die Eintragung der Verschmelzung in das Register des Sitzes desjenigen Rechtsträgers, dessen Gläubiger sie sind, nach § 19 Abs. 3 UmwG als bekannt gemacht gilt, ihren Anspruch nach Grund und Höhe in Textform anmelden, Sicherheit zu leisten, soweit sie nicht Befriedigung verlangen können. Dieses Recht steht den Gläubigern jedoch nur zu, wenn sie glaubhaft machen, dass durch die Verschmelzung die Erfüllung der Forderung gefährdet wird."
    },
    {
      "date": "2025-11-06",
      "id": "136517",
      "original_text": "Löschungsankündigung\nNiedersachsen Amtsgericht Hannover HRB 62367\nBlue Stripe International Security Gesellschaft mit beschränkter Haftung – Hannover",
      "type": "Löschungsankündigung",
      "state": "Niedersachsen",
      "amtsgericht": "Amtsgericht Hannover",
      "registernummer": "HRB 62367",
      "registerart": "HRB",
      "company_name": "Blue Stripe International Security Gesellschaft mit beschränkter Haftung",
      "company_seat": "Hannover",
      "details": "06.11.2025 (Bekanntmachungsdatum)\n\nNiedersachsen Amtsgericht Hannover HRB 62367\nLöschungsankündigung\n\nBlue Stripe International Security Gesellschaft mit beschränkter Haftung\nGesellschaft mit beschränkter Haftung\nHannover\n\nDas Registergericht beabsichtigt, die Gesellschaft von Amts wegen nach § 394 FamFG zu löschen. Die Frist zur Erhebung eines Widerspruchs ist auf 1 Monat ab dieser Registerbekanntmachung festgesetzt."
    },
    {
      "date": "2025-11-06",
      "id": "136518",
      "original_text": "Registerbekanntmachung nach dem Umwandlungsgesetz\nNiedersachsen Amtsgericht Hildesheim HRB 210373\nFVT Immobilien GmbH – Sehnde",
      "type": "Registerbekanntmachung nach dem Umwandlungsgesetz",
      "state": "Niedersachsen",
      "amtsgericht": "Amtsgericht Hildesheim",
      "registernummer": "HRB 210373",
      "registerart": "HRB",
      "company_name": "FVT Immobilien GmbH",
      "company_seat": "Sehnde",
      "details": "06.11.2025 (Bekanntmachungsdatum)\n\nNiedersachsen Amtsgericht Hildesheim HRB 210373\nRegisterbekanntmachung nach dem Umwandlungsgesetz 06.11.2025 (Eintragungsdatum)\n\nFVT Immobilien GmbH\nGesellschaft mit beschränkter Haftung\nSehnde\n\nDen Gläubigern der an der formwechselnden Umwandlung beteiligten Rechtsträger ist, wenn sie binnen sechs Monaten nach dem Tag, an dem die Eintragung der Umwandlung in das Register des Sitzes desjenigen Rechtsträgers, dessen Gläubiger sie sind, nach § 19 Abs. 3 UmwG als bekannt gemacht gilt, ihren Anspruch nach Grund und Höhe schriftlich anmelden, Sicherheit zu leisten, soweit sie nicht Befriedigung verlangen können. Dieses Recht steht den Gläubigern jedoch nur zu, wenn sie glaubhaft machen, dass durch die formwechselnde Umwandlung die Erfüllung der Forderung gefährdet wird."
    },
    {
      "date": "2025-11-06",
      "id": "136519",
      "original_text": "Registerbekanntmachung nach dem Umwandlungsgesetz\nNiedersachsen Amtsgericht Hannover HRA 206237\nYama Saha e.K. – Gehrden",
      "type": "Registerbekanntmachung nach dem Umwandlungsgesetz",
      "state": "Niedersachsen",
      "amtsgericht": "Amtsgericht Hannover",
      "registernummer": "HRA 206237",
      "registerart": "HRA",
      "company_name": "Yama Saha e.K.",
      "company_seat": "Gehrden",
      "details": "06.11.2025 (Bekanntmachungsdatum)\n\nNiedersachsen Amtsgericht Hannover HRA 206237\nRegisterbekanntmachung nach dem Umwandlungsgesetz 06.11.2025 (Eintragungsdatum)\n\nYama Saha e.K.\nEinzelkaufmann / Einzelkauffrau\nGehrden\n\nDen Gläubigern der an der Ausgliederung beteiligten Rechtsträger ist, wenn sie binnen sechs Monaten nach dem Tag, an dem die Eintragung der Ausgliederung in das Register des Sitzes desjenigen Rechtsträgers, dessen Gläubiger sie sind, nach § 19 Abs. 3 UmwG als bekannt gemacht gilt, ihren Anspruch nach Grund und Höhe schriftlich anmelden, Sicherheit zu leisten, soweit sie nicht Befriedigung verlangen können. Dieses Recht steht den Gläubigern jedoch nur zu, wenn sie glaubhaft machen, dass durch die Ausgliederung die Erfüllung der Forderung gefährdet wird."
    },
    {
      "date": "2025-11-06",
      "id": "136520",
      "original_text": "Registerbekanntmachung nach dem Umwandlungsgesetz\nNiedersachsen Amtsgericht Hannover HRA 206779\nAmbulante Pflege Parvari e.K. – Hannover",
      "type": "Registerbekanntmachung nach dem Umwandlungsgesetz",
      "state": "Niedersachsen",
      "amtsgericht": "Amtsgericht Hannover",
      "registernummer": "HRA 206779",
      "registerart": "HRA",
      "company_name": "Ambulante Pflege Parvari e.K.",
      "company_seat": "Hannover",
      "details": "06.11.2025 (Bekanntmachungsdatum)\n\nNiedersachsen Amtsgericht Hannover HRA 206779\nRegisterbekanntmachung nach dem Umwandlungsgesetz 06.11.2025 (Eintragungsdatum)\n\nAmbulante Pflege Parvari e.K.\nEinzelkaufmann / Einzelkauffrau\nHannover\n\nDen Gläubigern der an der Ausgliederung beteiligten Rechtsträger ist, wenn sie binnen sechs Monaten nach dem Tag, an dem die Eintragung der Ausgliederung in das Register des Sitzes desjenigen Rechtsträgers, dessen Gläubiger sie sind, nach § 19 Abs. 3 UmwG als bekannt gemacht gilt, ihren Anspruch nach Grund und Höhe schriftlich anmelden, Sicherheit zu leisten, soweit sie nicht Befriedigung verlangen können. Dieses Recht steht den Gläubigern jedoch nur zu, wenn sie glaubhaft machen, dass durch die Ausgliederung die Erfüllung der Forderung gefährdet wird."
    },
    {
      "date": "2025-11-06",
      "id": "136521",
      "original_text": "Löschungsankündigung\nNiedersachsen Amtsgericht Oldenburg (Oldenburg) HRB 207866\nRelax UG (haftungsbeschränkt) – Wilhelmshaven",
      "type": "Löschungsankündigung",
      "state": "Niedersachsen",
      "amtsgericht": "Amtsgericht Oldenburg (Oldenburg)",
      "registernummer": "HRB 207866",
      "registerart": "HRB",
      "company_name": "Relax UG (haftungsbeschränkt)",
      "company_seat": "Wilhelmshaven",
      "details": "06.11.2025 (Bekanntmachungsdatum)\n\nNiedersachsen Amtsgericht Oldenburg (Oldenburg) HRB 207866\nLöschungsankündigung\n\nRelax UG (haftungsbeschränkt)\nGesellschaft mit beschränkter Haftung\nWilhelmshaven\n\nDas Registergericht beabsichtigt, die Gesellschaft von Amts wegen nach § 394 FamFG zu löschen. Die Frist zur Erhebung eines Widerspruchs ist auf 1 Monat ab dieser Registerbekanntmachung festgesetzt."
    },
    {
      "date": "2025-11-06",
      "id": "136522",
      "original_text": "Löschungsankündigung\nNiedersachsen Amtsgericht Osnabrück HRB 121503 früher Amtsgericht Meppen\nS + G Bau GmbH – Neubörger",
      "type": "Löschungsankündigung",
      "state": "Niedersachsen",
      "amtsgericht": "Amtsgericht Osnabrück",
      "registernummer": "HRB 121503",
      "registerart": "HRB",
      "company_name": "S + G Bau GmbH",
      "company_seat": "Neubörger",
      "former_amtsgericht": "Meppen",
      "details": "06.11.2025 (Bekanntmachungsdatum)\n\nNiedersachsen Amtsgericht Osnabrück HRB 121503 früher Amtsgericht Meppen\nLöschungsankündigung\n\nS + G Bau GmbH\nGesellschaft mit beschränkter Haftung\nNeubörger\n\nDas Registergericht beabsichtigt, die Gesellschaft von Amts wegen nach § 394 FamFG wegen Vermögenslosigkeit zu löschen. Die Frist zur Erhebung eines Widerspruchs ist auf 1 Monat ab dieser Registerbekanntmachung festgesetzt."
    },
    {
      "date": "2025-11-06",
      "id": "136523",
      "original_text": "Sonstige Registerbekanntmachung\nNiedersachsen Amtsgericht Oldenburg (Oldenburg) HRB 202570\nAN Vorsorge GmbH – Großenkneten",
      "type": "Sonstige Registerbekanntmachung",
      "state": "Niedersachsen",
      "amtsgericht": "Amtsgericht Oldenburg (Oldenburg)",
      "registernummer": "HRB 202570",
      "registerart": "HRB",
      "company_name": "AN Vorsorge GmbH",
      "company_seat": "Großenkneten",
      "details": "06.11.2025 (Bekanntmachungsdatum)\n\nNiedersachsen Amtsgericht Oldenburg (Oldenburg) HRB 202570\nSonstige Registerbekanntmachung 06.11.2025 (Eintragungsdatum)\n\nAN Vorsorge GmbH\nGesellschaft mit beschränkter Haftung\nGroßenkneten\n\nDen Gläubigern der Gesellschaft, deren Forderungen begründet worden sind, bevor die Eintragung der Beendigung des Vertrages in das Handelsregister nach § 10 HGB als bekanntgemacht gilt, ist vom anderen Vertragsteil Sicherheit zu leisten, wenn sie sich binnen sechs Monaten nach der Bekanntmachung zu diesem Zweck bei ihm melden."
    },
    {
      "date": "2025-11-06",
      "id": "136524",
      "original_text": "Registerbekanntmachung nach dem Umwandlungsgesetz\nNiedersachsen Amtsgericht Braunschweig HRB 208558\nHoffmann Vermögensverwaltung GmbH – Bad Harzburg",
      "type": "Registerbekanntmachung nach dem Umwandlungsgesetz",
      "state": "Niedersachsen",
      "amtsgericht": "Amtsgericht Braunschweig",
      "registernummer": "HRB 208558",
      "registerart": "HRB",
      "company_name": "Hoffmann Vermögensverwaltung GmbH",
      "company_seat": "Bad Harzburg",
      "details": "06.11.2025 (Bekanntmachungsdatum)\n\nNiedersachsen Amtsgericht Braunschweig HRB 208558\nRegisterbekanntmachung nach dem Umwandlungsgesetz 06.11.2025 (Eintragungsdatum)\n\nHoffmann Vermögensverwaltung GmbH\nGesellschaft mit beschränkter Haftung\nBad Harzburg\n\nDen Gläubigern der an der Verschmelzung beteiligten Rechtsträger ist, wenn sie binnen sechs Monaten nach dem Tag, an dem die Eintragung der Verschmelzung in das Register des Sitzes desjenigen Rechtsträgers, dessen Gläubiger sie sind, nach § 19  Abs.  3 UmwG als bekannt gemacht gilt, ihren Anspruch nach Grund und Höhe schriftlich anmelden, Sicherheit zu leisten, soweit sie nicht Befriedigung verlangen können. Dieses Recht steht den Gläubigern jedoch nur zu, wenn sie glaubhaft machen, dass durch die Verschmelzung die Erfüllung der Forderung gefährdet wird."
    },
    {
      "date": "2025-11-06",
      "id": "136525",
      "original_text": "Registerbekanntmachung nach dem Umwandlungsgesetz\nNiedersachsen Amtsgericht Walsrode VR 170019\nDeutsches Rotes Kreuz, Kreisverband Rotenburg (Wümme) e. V. – Rotenburg (Wümme)",
      "type": "Registerbekanntmachung nach dem Umwandlungsgesetz",
      "state": "Niedersachsen",
      "amtsgericht": "Amtsgericht Walsrode",
      "registernummer": "VR 170019",
      "registerart": "VR",
      "company_name": "Deutsches Rotes Kreuz, Kreisverband Rotenburg (Wümme) e. V.",
      "company_seat": "Rotenburg (Wümme)",
      "details": "06.11.2025 (Bekanntmachungsdatum)\n\nNiedersachsen Amtsgericht Walsrode VR 170019\nRegisterbekanntmachung nach dem Umwandlungsgesetz 06.11.2025 (Eintragungsdatum)\n\nDeutsches Rotes Kreuz, Kreisverband Rotenburg (Wümme) e. V.\neingetragener Verein\nRotenburg (Wümme)\n\nDen Gläubigern der an der Verschmelzung beteiligten Rechtsträger ist, wenn sie binnen sechs Monaten nach dem Tag, an dem die Eintragung der Verschmelzung in das Register des Sitzes desjenigen Rechtsträgers, dessen Gläubiger sie sind, nach § 19  Abs.  3 UmwG als bekannt gemacht gilt, ihren Anspruch nach Grund und Höhe schriftlich anmelden, Sicherheit zu leisten, soweit sie nicht Befriedigung verlangen können. Dieses Recht steht den Gläubigern jedoch nur zu, wenn sie glaubhaft machen, dass durch die Verschmelzung die Erfüllung der Forderung gefährdet wird."
    },
    {
      "date": "2025-11-06",
      "id": "136526",
      "original_text": "Registerbekanntmachung nach dem Umwandlungsgesetz\nNiedersachsen Amtsgericht Braunschweig HRA 202910\nVolkswagen Immobilien Property GmbH & Co. KG – Wolfsburg",
      "type": "Registerbekanntmachung nach dem Umwandlungsgesetz",
      "state": "Niedersachsen",
      "amtsgericht": "Amtsgericht Braunschweig",
      "registernummer": "HRA 202910",
      "registerart": "HRA",
      "company_name": "Volkswagen Immobilien Property GmbH & Co. KG",
      "company_seat": "Wolfsburg",
      "details": "06.11.2025 (Bekanntmachungsdatum)\n\nNiedersachsen Amtsgericht Braunschweig HRA 202910\nRegisterbekanntmachung nach dem Umwandlungsgesetz 06.11.2025 (Eintragungsdatum)\n\nVolkswagen Immobilien Property GmbH & Co. KG\nKommanditgesellschaft\nWolfsburg\n\nDen Gläubigern der an der formwechselnden Umwandlung beteiligten Rechtsträger ist, wenn sie binnen sechs Monaten nach dem Tag, an dem die Eintragung der Umwandlung in das Register des Sitzes desjenigen Rechtsträgers, dessen Gläubiger sie sind, nach § 19 Abs. 3 UmwG als bekannt gemacht gilt, ihren Anspruch nach Grund und Höhe schriftlich anmelden, Sicherheit zu leisten, soweit sie nicht Befriedigung verlangen können. Dieses Recht steht den Gläubigern jedoch nur zu, wenn sie glaubhaft machen, dass durch die formwechselnde Umwandlung die Erfüllung der Forderung gefährdet wird."
    },
    {
      "date": "2025-11-06",
      "id": "136527",
      "original_text": "Registerbekanntmachung nach dem Umwandlungsgesetz\nNiedersachsen Amtsgericht Braunschweig HRB 208685\nElektro Fuxx GmbH – Bad Harzburg",
      "type": "Registerbekanntmachung nach dem Umwandlungsgesetz",
      "state": "Niedersachsen",
      "amtsgericht": "Amtsgericht Braunschweig",
      "registernummer": "HRB 208685",
      "registerart": "HRB",
      "company_name": "Elektro Fuxx GmbH",
      "company_seat": "Bad Harzburg",
      "details": "06.11.2025 (Bekanntmachungsdatum)\n\nNiedersachsen Amtsgericht Braunschweig HRB 208685\nRegisterbekanntmachung nach dem Umwandlungsgesetz 06.11.2025 (Eintragungsdatum)\n\nElektro Fuxx GmbH\nGesellschaft mit beschränkter Haftung\nBad Harzburg\n\nDen Gläubigern der an der Verschmelzung beteiligten Rechtsträger ist, wenn sie binnen sechs Monaten nach dem Tag, an dem die Eintragung der Verschmelzung in das Register des Sitzes desjenigen Rechtsträgers, dessen Gläubiger sie sind, nach § 19  Abs.  3 UmwG als bekannt gemacht gilt, ihren Anspruch nach Grund und Höhe schriftlich anmelden, Sicherheit zu leisten, soweit sie nicht Befriedigung verlangen können. Dieses Recht steht den Gläubigern jedoch nur zu, wenn sie glaubhaft machen, dass durch die Verschmelzung die Erfüllung der Forderung gefährdet wird."
    },
    {
      "date": "2025-11-06",
      "id": "136528",
      "original_text": "Registerbekanntmachung nach dem Umwandlungsgesetz\nNiedersachsen Amtsgericht Braunschweig HRB 210757\nGastro High UG (haftungsbeschränkt) – Bad Harzburg",
      "type": "Registerbekanntmachung nach dem Umwandlungsgesetz",
      "state": "Niedersachsen",
      "amtsgericht": "Amtsgericht Braunschweig",
      "registernummer": "HRB 210757",
      "registerart": "HRB",
      "company_name": "Gastro High UG (haftungsbeschränkt)",
      "company_seat": "Bad Harzburg",
      "details": "06.11.2025 (Bekanntmachungsdatum)\n\nNiedersachsen Amtsgericht Braunschweig HRB 210757\nRegisterbekanntmachung nach dem Umwandlungsgesetz 06.11.2025 (Eintragungsdatum)\n\nGastro High UG (haftungsbeschränkt)\nGesellschaft mit beschränkter Haftung\nBad Harzburg\n\nDen Gläubigern der an der Verschmelzung beteiligten Rechtsträger ist, wenn sie binnen sechs Monaten nach dem Tag, an dem die Eintragung der Verschmelzung in das Register des Sitzes desjenigen Rechtsträgers, dessen Gläubiger sie sind, nach § 19  Abs.  3 UmwG als bekannt gemacht gilt, ihren Anspruch nach Grund und Höhe schriftlich anmelden, Sicherheit zu leisten, soweit sie nicht Befriedigung verlangen können. Dieses Recht steht den Gläubigern jedoch nur zu, wenn sie glaubhaft machen, dass durch die Verschmelzung die Erfüllung der Forderung gefährdet wird."
    },
    {
      "date": "2025-11-06",
      "id": "136529",
      "original_text": "Registerbekanntmachung nach dem Umwandlungsgesetz\nNiedersachsen Amtsgericht Osnabrück HRB 214876\nA & G Handelsgesellschaft mbH – Schüttorf",
      "type": "Registerbekanntmachung nach dem Umwandlungsgesetz",
      "state": "Niedersachsen",
      "amtsgericht": "Amtsgericht Osnabrück",
      "registernummer": "HRB 214876",
      "registerart": "HRB",
      "company_name": "A & G Handelsgesellschaft mbH",
      "company_seat": "Schüttorf",
      "details": "06.11.2025 (Bekanntmachungsdatum)\n\nNiedersachsen Amtsgericht Osnabrück HRB 214876\nRegisterbekanntmachung nach dem Umwandlungsgesetz 06.11.2025 (Eintragungsdatum)\n\nA & G Handelsgesellschaft mbH\nGesellschaft mit beschränkter Haftung\nSchüttorf\n\nDen Gläubigern der an der formwechselnden Umwandlung beteiligten Rechtsträger ist, wenn sie binnen sechs Monaten nach dem Tag, an dem die Eintragung der Umwandlung in das Register des Sitzes desjenigen Rechtsträgers, dessen Gläubiger sie sind, nach § 19 Abs. 3 UmwG als bekannt gemacht gilt, ihren Anspruch nach Grund und Höhe schriftlich anmelden, Sicherheit zu leisten, soweit sie nicht Befriedigung verlangen können. Dieses Recht steht den Gläubigern jedoch nur zu, wenn sie glaubhaft machen, dass durch die formwechselnde Umwandlung die Erfüllung der Forderung gefährdet wird."
    },
    {
      "date": "2025-11-06",
      "id": "136530",
      "original_text": "Registerbekanntmachung nach dem Umwandlungsgesetz\nNiedersachsen Amtsgericht Hannover HRB 229733\nAmbulante Pflegedienst Mitra GmbH – Hannover",
      "type": "Registerbekanntmachung nach dem Umwandlungsgesetz",
      "state": "Niedersachsen",
      "amtsgericht": "Amtsgericht Hannover",
      "registernummer": "HRB 229733",
      "registerart": "HRB",
      "company_name": "Ambulante Pflegedienst Mitra GmbH",
      "company_seat": "Hannover",
      "details": "06.11.2025 (Bekanntmachungsdatum)\n\nNiedersachsen Amtsgericht Hannover HRB 229733\nRegisterbekanntmachung nach dem Umwandlungsgesetz 06.11.2025 (Eintragungsdatum)\n\nAmbulante Pflegedienst Mitra GmbH\nGesellschaft mit beschränkter Haftung\nHannover\n\nDen Gläubigern der an der Ausgliederung beteiligten Rechtsträger ist, wenn sie binnen sechs Monaten nach dem Tag, an dem die Eintragung der Ausgliederung in das Register des Sitzes desjenigen Rechtsträgers, dessen Gläubiger sie sind, nach § 19 Abs. 3 UmwG als bekannt gemacht gilt, ihren Anspruch nach Grund und Höhe schriftlich anmelden, Sicherheit zu leisten, soweit sie nicht Befriedigung verlangen können. Dieses Recht steht den Gläubigern jedoch nur zu, wenn sie glaubhaft machen, dass durch die Ausgliederung die Erfüllung der Forderung gefährdet wird."
    },
    {
      "date": "2025-11-06",
      "id": "136531",
      "original_text": "Registerbekanntmachung nach dem Umwandlungsgesetz\nNiedersachsen Amtsgericht Braunschweig HRB 207613\nBauconzept Hoffmann GmbH – Bad Harzburg",
      "type": "Registerbekanntmachung nach dem Umwandlungsgesetz",
      "state": "Niedersachsen",
      "amtsgericht": "Amtsgericht Braunschweig",
      "registernummer": "HRB 207613",
      "registerart": "HRB",
      "company_name": "Bauconzept Hoffmann GmbH",
      "company_seat": "Bad Harzburg",
      "details": "06.11.2025 (Bekanntmachungsdatum)\n\nNiedersachsen Amtsgericht Braunschweig HRB 207613\nRegisterbekanntmachung nach dem Umwandlungsgesetz 06.11.2025 (Eintragungsdatum)\n\nBauconzept Hoffmann GmbH\nGesellschaft mit beschränkter Haftung\nBad Harzburg\n\nDen Gläubigern der an der Verschmelzung beteiligten Rechtsträger ist, wenn sie binnen sechs Monaten nach dem Tag, an dem die Eintragung der Verschmelzung in das Register des Sitzes desjenigen Rechtsträgers, dessen Gläubiger sie sind, nach § 19  Abs.  3 UmwG als bekannt gemacht gilt, ihren Anspruch nach Grund und Höhe schriftlich anmelden, Sicherheit zu leisten, soweit sie nicht Befriedigung verlangen können. Dieses Recht steht den Gläubigern jedoch nur zu, wenn sie glaubhaft machen, dass durch die Verschmelzung die Erfüllung der Forderung gefährdet wird."
    },
    {
      "date": "2025-11-06",
      "id": "136532",
      "original_text": "Registerbekanntmachung nach dem Umwandlungsgesetz\nNiedersachsen Amtsgericht Oldenburg (Oldenburg) HRA 208668\nES-Design GmbH & Co. KG – Wardenburg",
      "type": "Registerbekanntmachung nach dem Umwandlungsgesetz",
      "state": "Niedersachsen",
      "amtsgericht": "Amtsgericht Oldenburg (Oldenburg)",
      "registernummer": "HRA 208668",
      "registerart": "HRA",
      "company_name": "ES-Design GmbH & Co. KG",
      "company_seat": "Wardenburg",
      "details": "06.11.2025 (Bekanntmachungsdatum)\n\nNiedersachsen Amtsgericht Oldenburg (Oldenburg) HRA 208668\nRegisterbekanntmachung nach dem Umwandlungsgesetz 06.11.2025 (Eintragungsdatum)\n\nES-Design GmbH & Co. KG\nKommanditgesellschaft\nWardenburg\n\nDen Gläubigern der an der Ausgliederung beteiligten Rechtsträger ist, wenn sie binnen sechs Monaten nach dem Tag, an dem die Eintragung der Ausgliederung in das Register des Sitzes desjenigen Rechtsträgers, dessen Gläubiger sie sind, nach § 19 Abs. 3 UmwG als bekannt gemacht gilt, ihren Anspruch nach Grund und Höhe schriftlich anmelden, Sicherheit zu leisten, soweit sie nicht Befriedigung verlangen können. Dieses Recht steht den Gläubigern jedoch nur zu, wenn sie glaubhaft machen, dass durch die Ausgliederung die Erfüllung der Forderung gefährdet wird."
    },
    {
      "date": "2025-11-06",
      "id": "136533",
      "original_text": "Einreichung neuer Dokumente\nNiedersachsen Amtsgericht Hannover HRB 53034\nVerband Evangelischer Publizistik Niedersachsen-Bremen GmbH – Hannover",
      "type": "Einreichung neuer Dokumente",
      "state": "Niedersachsen",
      "amtsgericht": "Amtsgericht Hannover",
      "registernummer": "HRB 53034",
      "registerart": "HRB",
      "company_name": "Verband Evangelischer Publizistik Niedersachsen-Bremen GmbH",
      "company_seat": "Hannover",
      "details": "06.11.2025 (Bekanntmachungsdatum)\n\nNiedersachsen Amtsgericht Hannover HRB 53034\nEinreichung neuer Dokumente 06.11.2025 (Eintragungsdatum)\n\nVerband Evangelischer Publizistik Niedersachsen-Bremen GmbH\nGesellschaft mit beschränkter Haftung\nHannover\n\nDie Liste der Mitglieder des Aufsichtsrats wurde beim Registergericht eingereicht."
    },
    {
      "date": "2025-11-06",
      "id": "136534",
      "original_text": "Registerbekanntmachung nach dem Umwandlungsgesetz\nNiedersachsen Amtsgericht Hannover HRB 211415\nLiftCom GmbH – Gehrden",
      "type": "Registerbekanntmachung nach dem Umwandlungsgesetz",
      "state": "Niedersachsen",
      "amtsgericht": "Amtsgericht Hannover",
      "registernummer": "HRB 211415",
      "registerart": "HRB",
      "company_name": "LiftCom GmbH",
      "company_seat": "Gehrden",
      "details": "06.11.2025 (Bekanntmachungsdatum)\n\nNiedersachsen Amtsgericht Hannover HRB 211415\nRegisterbekanntmachung nach dem Umwandlungsgesetz 06.11.2025 (Eintragungsdatum)\n\nLiftCom GmbH\nGesellschaft mit beschränkter Haftung\nGehrden\n\nDen Gläubigern der an der Ausgliederung beteiligten Rechtsträger ist, wenn sie binnen sechs Monaten nach dem Tag, an dem die Eintragung der Ausgliederung in das Register des Sitzes desjenigen Rechtsträgers, dessen Gläubiger sie sind, nach § 19 Abs. 3 UmwG als bekannt gemacht gilt, ihren Anspruch nach Grund und Höhe schriftlich anmelden, Sicherheit zu leisten, soweit sie nicht Befriedigung verlangen können. Dieses Recht steht den Gläubigern jedoch nur zu, wenn sie glaubhaft machen, dass durch die Ausgliederung die Erfüllung der Forderung gefährdet wird."
    },
    {
      "date": "2025-11-06",
      "id": "136535",
      "original_text": "Löschungsankündigung\nNiedersachsen Amtsgericht Hannover HRB 227497\nBauBK Hochbau GmbH – Neustadt am Rübenberge",
      "type": "Löschungsankündigung",
      "state": "Niedersachsen",
      "amtsgericht": "Amtsgericht Hannover",
      "registernummer": "HRB 227497",
      "registerart": "HRB",
      "company_name": "BauBK Hochbau GmbH",
      "company_seat": "Neustadt am Rübenberge",
      "details": "06.11.2025 (Bekanntmachungsdatum)\n\nNiedersachsen Amtsgericht Hannover HRB 227497\nLöschungsankündigung\n\nBauBK Hochbau GmbH\nGesellschaft mit beschränkter Haftung\nNeustadt am Rübenberge\n\nDas Registergericht beabsichtigt, die Gesellschaft von Amts wegen nach § 394 FamFG zu löschen. Die Frist zur Erhebung eines Widerspruchs ist auf 1 Monat ab dieser Registerbekanntmachung festgesetzt."
    },
    {
      "date": "2025-11-06",
      "id": "136536",
      "original_text": "Registerbekanntmachung nach dem Umwandlungsgesetz\nNiedersachsen Amtsgericht Oldenburg (Oldenburg) HRA 205734\nES-Design Jan Volkmann e.K. – Wardenburg",
      "type": "Registerbekanntmachung nach dem Umwandlungsgesetz",
      "state": "Niedersachsen",
      "amtsgericht": "Amtsgericht Oldenburg (Oldenburg)",
      "registernummer": "HRA 205734",
      "registerart": "HRA",
      "company_name": "ES-Design Jan Volkmann e.K.",
      "company_seat": "Wardenburg",
      "details": "06.11.2025 (Bekanntmachungsdatum)\n\nNiedersachsen Amtsgericht Oldenburg (Oldenburg) HRA 205734\nRegisterbekanntmachung nach dem Umwandlungsgesetz 06.11.2025 (Eintragungsdatum)\n\nES-Design Jan Volkmann e.K.\nEinzelkaufmann / Einzelkauffrau\nWardenburg\n\nDen Gläubigern der an der Ausgliederung beteiligten Rechtsträger ist, wenn sie binnen sechs Monaten nach dem Tag, an dem die Eintragung der Ausgliederung in das Register des Sitzes desjenigen Rechtsträgers, dessen Gläubiger sie sind, nach § 19 Abs. 3 UmwG als bekannt gemacht gilt, ihren Anspruch nach Grund und Höhe schriftlich anmelden, Sicherheit zu leisten, soweit sie nicht Befriedigung verlangen können. Dieses Recht steht den Gläubigern jedoch nur zu, wenn sie glaubhaft machen, dass durch die Ausgliederung die Erfüllung der Forderung gefährdet wird."
    },
    {
      "date": "2025-11-06",
      "id": "136537",
      "original_text": "Löschungsankündigung\nRheinland-Pfalz Amtsgericht Bad Kreuznach VR 10593\nEdelstein-Funkclub Idar-Oberstein – Idar-0berstein",
      "type": "Löschungsankündigung",
      "state": "Rheinland-Pfalz",
      "amtsgericht": "Amtsgericht Bad Kreuznach",
      "registernummer": "VR 10593",
      "registerart": "VR",
      "company_name": "Edelstein-Funkclub Idar-Oberstein",
      "company_seat": "Idar-0berstein",
      "details": "06.11.2025 (Bekanntmachungsdatum)\n\nRheinland-Pfalz Amtsgericht Bad Kreuznach VR 10593\nLöschungsankündigung\n\nEdelstein-Funkclub Idar-Oberstein\neingetragener Verein\nIdar-0berstein\n\nDas Gericht beabsichtigt, die Eintragung des Vereins im Vereinsregister wegen des Mangels einer wesentlichen Voraussetzung von Amts wegen nach § 395 FamFG als unzulässig zu löschen. Die Frist zur Geltendmachung eines Widerspruchs gegen die beabsichtigte Löschung ist auf einen Monat ab Veröffentlichung bestimmt."
    },
    {
      "date": "2025-11-06",
      "id": "136538",
      "original_text": "Löschungsankündigung\nRheinland-Pfalz Amtsgericht Koblenz HRB 21758\nU & V Stotz GmbH – Münstermaifeld",
      "type": "Löschungsankündigung",
      "state": "Rheinland-Pfalz",
      "amtsgericht": "Amtsgericht Koblenz",
      "registernummer": "HRB 21758",
      "registerart": "HRB",
      "company_name": "U & V Stotz GmbH",
      "company_seat": "Münstermaifeld",
      "details": "06.11.2025 (Bekanntmachungsdatum)\n\nRheinland-Pfalz Amtsgericht Koblenz HRB 21758\nLöschungsankündigung 06.11.2025 (Eintragungsdatum)\n\nU & V Stotz GmbH\nGesellschaft mit beschränkter Haftung\nMünstermaifeld\n\nDas Registergericht beabsichtigt die Gesellschaft von Amts wegen nach § 394 FamFG zu löschen. Die Frist zur Erhebung eines Widerspruchs ist auf zwei Monate festgesetzt."
    },
    {
      "date": "2025-11-06",
      "id": "136539",
      "original_text": "Löschungsankündigung\nRheinland-Pfalz Amtsgericht Zweibrücken HRB 31065\nRLS GmbH Reifen- u. Landmaschinenhandel u. -Service – Thaleischweiler-Fröschen",
      "type": "Löschungsankündigung",
      "state": "Rheinland-Pfalz",
      "amtsgericht": "Amtsgericht Zweibrücken",
      "registernummer": "HRB 31065",
      "registerart": "HRB",
      "company_name": "RLS GmbH Reifen- u. Landmaschinenhandel u. -Service",
      "company_seat": "Thaleischweiler-Fröschen",
      "details": "06.11.2025 (Bekanntmachungsdatum)\n\nRheinland-Pfalz Amtsgericht Zweibrücken HRB 31065\nLöschungsankündigung\n\nRLS GmbH Reifen- u. Landmaschinenhandel u. -Service\nGesellschaft mit beschränkter Haftung\nThaleischweiler-Fröschen\n\nDas Registergericht beabsichtigt die Gesellschaft von Amts wegen nach § 394 FamFG zu löschen. Die Frist zur Erhebung eines Widerspruchs ist auf einen Monat festgesetzt."
    },
    {
      "date": "2025-11-06",
      "id": "136540",
      "original_text": "Registerbekanntmachung nach dem Umwandlungsgesetz\nNordrhein-Westfalen Amtsgericht Duisburg HRA 13667\nMP Auto-Reifen-Service e.K. – Wesel",
      "type": "Registerbekanntmachung nach dem Umwandlungsgesetz",
      "state": "Nordrhein-Westfalen",
      "amtsgericht": "Amtsgericht Duisburg",
      "registernummer": "HRA 13667",
      "registerart": "HRA",
      "company_name": "MP Auto-Reifen-Service e.K.",
      "company_seat": "Wesel",
      "details": "06.11.2025 (Bekanntmachungsdatum)\n\nNordrhein-Westfalen Amtsgericht Duisburg HRA 13667\nRegisterbekanntmachung nach dem Umwandlungsgesetz 06.11.2025 (Eintragungsdatum)\n\nMP Auto-Reifen-Service e.K.\nEinzelkaufmann / Einzelkauffrau\nWesel\n\nDen Gläubigern der an der Ausgliederung beteiligten Rechtsträger ist, wenn sie binnen sechs Monaten nach dem Tag, an dem die Eintragung der Ausgliederung in das Register des Sitzes desjenigen Rechtsträgers, dessen Gläubiger sie sind, nach § 19 Absatz 3 UmwG als bekanntgemacht gilt, ihren Anspruch nach Grund und Höhe schriftlich anmelden, Sicherheit zu leisten, soweit sie nicht Befriedigung verlangen können. Dieses Recht steht den Gläubigern jedoch nur zu, wenn sie glaubhaft machen, dass durch die Ausgliederung die Erfüllung ihrer Forderung gefährdet wird."
    },
    {
      "date": "2025-11-06",
      "id": "136541",
      "original_text": "Einreichung neuer Dokumente\nNordrhein-Westfalen Amtsgericht Hagen HRB 5575\nAVU Aktiengesellschaft für Versorgungs-Unternehmen – Gevelsberg",
      "type": "Einreichung neuer Dokumente",
      "state": "Nordrhein-Westfalen",
      "amtsgericht": "Amtsgericht Hagen",
      "registernummer": "HRB 5575",
      "registerart": "HRB",
      "company_name": "AVU Aktiengesellschaft für Versorgungs-Unternehmen",
      "company_seat": "Gevelsberg",
      "details": "06.11.2025 (Bekanntmachungsdatum)\n\nNordrhein-Westfalen Amtsgericht Hagen HRB 5575\nEinreichung neuer Dokumente\n\nAVU Aktiengesellschaft für Versorgungs-Unternehmen\nAktiengesellschaft\nGevelsberg\n\nDie gesetzlichen Vertreter der Gesellschaft haben eine aktuelle Liste der Aufsichtsratsmitglieder zum Handelsregister eingereicht."
    },
    {
      "date": "2025-11-06",
      "id": "136542",
      "original_text": "Löschungsankündigung\nNordrhein-Westfalen Amtsgericht Gütersloh HRB 10656\nKowalschik Beteiligungs-GmbH – Rietberg",
      "type": "Löschungsankündigung",
      "state": "Nordrhein-Westfalen",
      "amtsgericht": "Amtsgericht Gütersloh",
      "registernummer": "HRB 10656",
      "registerart": "HRB",
      "company_name": "Kowalschik Beteiligungs-GmbH",
      "company_seat": "Rietberg",
      "details": "06.11.2025 (Bekanntmachungsdatum)\n\nNordrhein-Westfalen Amtsgericht Gütersloh HRB 10656\nLöschungsankündigung\n\nKowalschik Beteiligungs-GmbH\nGesellschaft mit beschränkter Haftung\nRietberg\n\nDas Registergericht beabsichtigt die Gesellschaft von Amts wegen nach § 394 FamFG zu löschen. Die Frist zur Erhebung eines Widerspruchs ist auf einen Monat festgesetzt."
    },
    {
      "date": "2025-11-06",
      "id": "136543",
      "original_text": "Löschungsankündigung\nNordrhein-Westfalen Amtsgericht Düren HRB 9503\nNRW-Rheingroup-Baugesellschaft mbH – Düren",
      "type": "Löschungsankündigung",
      "state": "Nordrhein-Westfalen",
      "amtsgericht": "Amtsgericht Düren",
      "registernummer": "HRB 9503",
      "registerart": "HRB",
      "company_name": "NRW-Rheingroup-Baugesellschaft mbH",
      "company_seat": "Düren",
      "details": "06.11.2025 (Bekanntmachungsdatum)\n\nNordrhein-Westfalen Amtsgericht Düren HRB 9503\nLöschungsankündigung\n\nNRW-Rheingroup-Baugesellschaft mbH\nGesellschaft mit beschränkter Haftung\nDüren\n\nDas Registergericht beabsichtigt die Gesellschaft von Amts wegen nach § 394 FamFG zu löschen. Die Frist zur Erhebung eines Widerspruchs ist auf drei Monate festgesetzt."
    },
    {
      "date": "2025-11-06",
      "id": "136544",
      "original_text": "Registerbekanntmachung nach dem Umwandlungsgesetz\nNordrhein-Westfalen Amtsgericht Duisburg HRA 13715\nMP Autoservice GmbH & Co. KG – Wesel",
      "type": "Registerbekanntmachung nach dem Umwandlungsgesetz",
      "state": "Nordrhein-Westfalen",
      "amtsgericht": "Amtsgericht Duisburg",
      "registernummer": "HRA 13715",
      "registerart": "HRA",
      "company_name": "MP Autoservice GmbH & Co. KG",
      "company_seat": "Wesel",
      "details": "06.11.2025 (Bekanntmachungsdatum)\n\nNordrhein-Westfalen Amtsgericht Duisburg HRA 13715\nRegisterbekanntmachung nach dem Umwandlungsgesetz 06.11.2025 (Eintragungsdatum)\n\nMP Autoservice GmbH & Co. KG\nKommanditgesellschaft\nWesel\n\nDen Gläubigern der an der Ausgliederung beteiligten Rechtsträger ist, wenn sie binnen sechs Monaten nach dem Tag, an dem die Eintragung der Ausgliederung in das Register des Sitzes desjenigen Rechtsträgers, dessen Gläubiger sie sind, nach § 19 Absatz 3 UmwG als bekanntgemacht gilt, ihren Anspruch nach Grund und Höhe schriftlich anmelden, Sicherheit zu leisten, soweit sie nicht Befriedigung verlangen können. Dieses Recht steht den Gläubigern jedoch nur zu, wenn sie glaubhaft machen, dass durch die Ausgliederung die Erfüllung ihrer Forderung gefährdet wird."
    },
    {
      "date": "2025-11-06",
      "id": "136545",
      "original_text": "Löschungsankündigung\nNordrhein-Westfalen Amtsgericht Köln HRB 18212\nPROHOUSE Vermögensverwaltung GmbH – Köln",
      "type": "Löschungsankündigung",
      "state": "Nordrhein-Westfalen",
      "amtsgericht": "Amtsgericht Köln",
      "registernummer": "HRB 18212",
      "registerart": "HRB",
      "company_name": "PROHOUSE Vermögensverwaltung GmbH",
      "company_seat": "Köln",
      "details": "06.11.2025 (Bekanntmachungsdatum)\n\nNordrhein-Westfalen Amtsgericht Köln HRB 18212\nLöschungsankündigung\n\nPROHOUSE Vermögensverwaltung GmbH\nGesellschaft mit beschränkter Haftung\nKöln\n\nDas Registergericht beabsichtigt die Gesellschaft von Amts wegen nach § 394 FamFG zu löschen. Die Frist zur Erhebung eines Widerspruchs ist auf einen Monat festgesetzt."
    },
    {
      "date": "2025-11-06",
      "id": "136546",
      "original_text": "Registerbekanntmachung nach dem Umwandlungsgesetz\nNordrhein-Westfalen Amtsgericht Essen HRA 8941\nKÖTTER Logistik & Service SE & Co. KG – Essen",
      "type": "Registerbekanntmachung nach dem Umwandlungsgesetz",
      "state": "Nordrhein-Westfalen",
      "amtsgericht": "Amtsgericht Essen",
      "registernummer": "HRA 8941",
      "registerart": "HRA",
      "company_name": "KÖTTER Logistik & Service SE & Co. KG",
      "company_seat": "Essen",
      "details": "06.11.2025 (Bekanntmachungsdatum)\n\nNordrhein-Westfalen Amtsgericht Essen HRA 8941\nRegisterbekanntmachung nach dem Umwandlungsgesetz 06.11.2025 (Eintragungsdatum)\n\nKÖTTER Logistik & Service SE & Co. KG\nKommanditgesellschaft\nEssen\n\nDen Gläubigern der an der Verschmelzung beteiligten Rechtsträger ist, wenn sie binnen sechs Monaten nach dem Tag, an dem die Eintragung der Verschmelzung in das Register des Sitzes desjenigen Rechtsträgers, dessen Gläubiger sie sind, nach § 19 Absatz 3 UmwG als bekanntgemacht gilt, ihren Anspruch nach Grund und Höhe schriftlich anmelden, Sicherheit zu leisten, soweit sie nicht Befriedigung verlangen können. Dieses Recht steht den Gläubigern jedoch nur zu, wenn sie glaubhaft machen, dass durch die Verschmelzung die Erfüllung ihrer Forderung gefährdet wird."
    },
    {
      "date": "2025-11-06",
      "id": "136547",
      "original_text": "Löschungsankündigung\nNordrhein-Westfalen Amtsgericht Dortmund HRB 35513\nSoulfood GmbH – Dortmund",
      "type": "Löschungsankündigung",
      "state": "Nordrhein-Westfalen",
      "amtsgericht": "Amtsgericht Dortmund",
      "registernummer": "HRB 35513",
      "registerart": "HRB",
      "company_name": "Soulfood GmbH",
      "company_seat": "Dortmund",
      "details": "06.11.2025 (Bekanntmachungsdatum)\n\nNordrhein-Westfalen Amtsgericht Dortmund HRB 35513\nLöschungsankündigung\n\nSoulfood GmbH\nGesellschaft mit beschränkter Haftung\nDortmund\n\nDas Registergericht beabsichtigt die Gesellschaft von Amts wegen nach § 394 FamFG zu löschen. Die Frist zur Erhebung eines Widerspruchs ist auf zwei Monate festgesetzt."
    },
    {
      "date": "2025-11-06",
      "id": "136548",
      "original_text": "Einreichung neuer Dokumente\nNordrhein-Westfalen Amtsgericht Paderborn HRB 7932\nAFG Natur-Energie AG – Bad Wünnenberg",
      "type": "Einreichung neuer Dokumente",
      "state": "Nordrhein-Westfalen",
      "amtsgericht": "Amtsgericht Paderborn",
      "registernummer": "HRB 7932",
      "registerart": "HRB",
      "company_name": "AFG Natur-Energie AG",
      "company_seat": "Bad Wünnenberg",
      "details": "06.11.2025 (Bekanntmachungsdatum)\n\nNordrhein-Westfalen Amtsgericht Paderborn HRB 7932\nEinreichung neuer Dokumente\n\nAFG Natur-Energie AG\nAktiengesellschaft\nBad Wünnenberg\n\nDem Registergericht ist eine neue Liste der Mitglieder des Aufsichtsrates eingereicht worden."
    },
    {
      "date": "2025-11-06",
      "id": "136549",
      "original_text": "Registerbekanntmachung nach dem Umwandlungsgesetz\nNordrhein-Westfalen Amtsgericht Düsseldorf HRA 26557\nGreenEstate - Energieprojekte GmbH & Co. KG – Düsseldorf",
      "type": "Registerbekanntmachung nach dem Umwandlungsgesetz",
      "state": "Nordrhein-Westfalen",
      "amtsgericht": "Amtsgericht Düsseldorf",
      "registernummer": "HRA 26557",
      "registerart": "HRA",
      "company_name": "GreenEstate - Energieprojekte GmbH & Co. KG",
      "company_seat": "Düsseldorf",
      "details": "06.11.2025 (Bekanntmachungsdatum)\n\nNordrhein-Westfalen Amtsgericht Düsseldorf HRA 26557\nRegisterbekanntmachung nach dem Umwandlungsgesetz 06.11.2025 (Eintragungsdatum)\n\nGreenEstate - Energieprojekte GmbH & Co. KG\nKommanditgesellschaft\nDüsseldorf\n\nDen Gläubigern der an der Verschmelzung beteiligten Rechtsträger ist, wenn sie binnen sechs Monaten nach dem Tag, an dem die Eintragung der Verschmelzung in das Register des Sitzes desjenigen Rechtsträgers, dessen Gläubiger sie sind, nach § 19 Absatz 3 UmwG als bekanntgemacht gilt, ihren Anspruch nach Grund und Höhe schriftlich anmelden, Sicherheit zu leisten, soweit sie nicht Befriedigung verlangen können. Dieses Recht steht den Gläubigern jedoch nur zu, wenn sie glaubhaft machen, dass durch die Verschmelzung die Erfüllung ihrer Forderung gefährdet wird."
    },
    {
      "date": "2025-11-06",
      "id": "136550",
      "original_text": "Registerbekanntmachung nach dem Umwandlungsgesetz\nNordrhein-Westfalen Amtsgericht Köln HRA 36878\nEDEKA Foodservice Stiftung & Co. KG – Köln",
      "type": "Registerbekanntmachung nach dem Umwandlungsgesetz",
      "state": "Nordrhein-Westfalen",
      "amtsgericht": "Amtsgericht Köln",
      "registernummer": "HRA 36878",
      "registerart": "HRA",
      "company_name": "EDEKA Foodservice Stiftung & Co. KG",
      "company_seat": "Köln",
      "details": "06.11.2025 (Bekanntmachungsdatum)\n\nNordrhein-Westfalen Amtsgericht Köln HRA 36878\nRegisterbekanntmachung nach dem Umwandlungsgesetz 06.11.2025 (Eintragungsdatum)\n\nEDEKA Foodservice Stiftung & Co. KG\nKommanditgesellschaft\nKöln\n\nDen Gläubigern der an der Verschmelzung beteiligten Rechtsträger ist, wenn sie binnen sechs Monaten nach dem Tag, an dem die Eintragung der Verschmelzung in das Register des Sitzes desjenigen Rechtsträgers, dessen Gläubiger sie sind, nach § 19 Absatz 3 UmwG als bekanntgemacht gilt, ihren Anspruch nach Grund und Höhe schriftlich anmelden, Sicherheit zu leisten, soweit sie nicht Befriedigung verlangen können. Dieses Recht steht den Gläubigern jedoch nur zu, wenn sie glaubhaft machen, dass durch die Verschmelzung die Erfüllung ihrer Forderung gefährdet wird."
    },
    {
      "date": "2025-11-06",
      "id": "136551",
      "original_text": "Einreichung neuer Dokumente\nNordrhein-Westfalen Amtsgericht Bielefeld HRB 44914\nSchüco Verwaltungs SE – Bielefeld",
      "type": "Einreichung neuer Dokumente",
      "state": "Nordrhein-Westfalen",
      "amtsgericht": "Amtsgericht Bielefeld",
      "registernummer": "HRB 44914",
      "registerart": "HRB",
      "company_name": "Schüco Verwaltungs SE",
      "company_seat": "Bielefeld",
      "details": "06.11.2025 (Bekanntmachungsdatum)\n\nNordrhein-Westfalen Amtsgericht Bielefeld HRB 44914\nEinreichung neuer Dokumente\n\nSchüco Verwaltungs SE\nEuropäische Aktiengesellschaft (SE)\nBielefeld\n\nDem Registergericht ist eine neue Liste der Mitglieder des Aufsichtsrates eingereicht worden."
    },
    {
      "date": "2025-11-06",
      "id": "136552",
      "original_text": "Registerbekanntmachung nach dem Umwandlungsgesetz\nNordrhein-Westfalen Amtsgericht Düsseldorf HRA 27258\nGreen Estate Two GmbH & Co. KG – Düsseldorf",
      "type": "Registerbekanntmachung nach dem Umwandlungsgesetz",
      "state": "Nordrhein-Westfalen",
      "amtsgericht": "Amtsgericht Düsseldorf",
      "registernummer": "HRA 27258",
      "registerart": "HRA",
      "company_name": "Green Estate Two GmbH & Co. KG",
      "company_seat": "Düsseldorf",
      "details": "06.11.2025 (Bekanntmachungsdatum)\n\nNordrhein-Westfalen Amtsgericht Düsseldorf HRA 27258\nRegisterbekanntmachung nach dem Umwandlungsgesetz 06.11.2025 (Eintragungsdatum)\n\nGreen Estate Two GmbH & Co. KG\nKommanditgesellschaft\nDüsseldorf\n\nDen Gläubigern der an der Verschmelzung beteiligten Rechtsträger ist, wenn sie binnen sechs Monaten nach dem Tag, an dem die Eintragung der Verschmelzung in das Register des Sitzes desjenigen Rechtsträgers, dessen Gläubiger sie sind, nach § 19 Absatz 3 UmwG als bekanntgemacht gilt, ihren Anspruch nach Grund und Höhe schriftlich anmelden, Sicherheit zu leisten, soweit sie nicht Befriedigung verlangen können. Dieses Recht steht den Gläubigern jedoch nur zu, wenn sie glaubhaft machen, dass durch die Verschmelzung die Erfüllung ihrer Forderung gefährdet wird."
    },
    {
      "date": "2025-11-06",
      "id": "136553",
      "original_text": "Löschungsankündigung\nNordrhein-Westfalen Amtsgericht Aachen HRA 9157\nUltima Ratio Rösrath GmbH & Co. KG – Aachen",
      "type": "Löschungsankündigung",
      "state": "Nordrhein-Westfalen",
      "amtsgericht": "Amtsgericht Aachen",
      "registernummer": "HRA 9157",
      "registerart": "HRA",
      "company_name": "Ultima Ratio Rösrath GmbH & Co. KG",
      "company_seat": "Aachen",
      "details": "06.11.2025 (Bekanntmachungsdatum)\n\nNordrhein-Westfalen Amtsgericht Aachen HRA 9157\nLöschungsankündigung\n\nUltima Ratio Rösrath GmbH & Co. KG\nKommanditgesellschaft\nAachen\n\nDas Registergericht beabsichtigt, von Amts wegen die Gesellschaft wegen Vermögenslosigkeit nach § 394 FamFG zu löschen.\n\nZur Geltendmachung des Widerspruchs gegen die beabsichtigte Löschung wird hiermit eine Frist von einem Monat ab Veröffentlichung dieser Ankündigung bestimmt.\n\nRechtsbehelfsbelehrung:\n\nGegen diese Verfügung kann Widerspruch eingelegt werden. Zum Widerspruch ist jeder berechtigt, der an der Unterlassung der Löschung ein berechtigtes Interesse hat.\n\nDer Widerspruch ist bei dem Amtsgericht Aachen, Adalbertsteinweg 92, 52070 Aachen schriftlich in deutscher Sprache oder zur Niederschrift der Geschäftsstelle einzulegen. Der Widerspruch kann auch zur Niederschrift der Geschäftsstelle eines jeden Amtsgerichtes abgegeben werden.\n\nDer Widerspruch muss spätestens innerhalb der gesetzten Frist nach der Bekanntgabe der Verfügung bei dem Amtsgericht Aachen eingegangen sein. Dies gilt auch dann, wenn der Widerspruch zur Niederschrift der Geschäftsstelle eines anderen Amtsgerichtes abgegeben wurde. Die Frist beginnt mit der Bekanntgabe der Verfügung durch Veröffentlichung. Fällt das Ende der Frist auf einen Sonntag, einen allgemeinen Feiertag oder Sonnabend, so endet die Frist mit Ablauf des nächsten Werktages.\n\nDer Widerspruch muss die Bezeichnung der angefochtenen Verfügung sowie die Erklärung enthalten, dass Widerspruch gegen diese Verfügung eingelegt wird. Er ist zu unterzeichnen und soll begründet werden.\n\nDie Einlegung ist auch durch Übertragung eines elektronischen Dokuments an die elektronische Poststelle des Gerichts möglich. Das elektronische Dokument muss für die Bearbeitung durch das Gericht geeignet und mit einer qualifizierten elektronischen Signatur der verantwortenden Person versehen sein oder von der verantwortenden Person signiert und auf einem sicheren Übermittlungsweg gemäß § 130 a ZPO nach näherer Maßgabe der Verordnung über die technischen Rahmenbedingungen des elektronischen Rechtsverkehrs und über das besondere elektronische Behördenpostfach (BGBl. I, S. 3803) eingereicht werden. Weitere Informationen erhalten Sie auf der Internetseite www.justiz.de."
    },
    {
      "date": "2025-11-06",
      "id": "136554",
      "original_text": "Registerbekanntmachung nach dem Umwandlungsgesetz\nNordrhein-Westfalen Amtsgericht Hagen HRB 9091\nhörconcept Hagen GmbH – Hagen",
      "type": "Registerbekanntmachung nach dem Umwandlungsgesetz",
      "state": "Nordrhein-Westfalen",
      "amtsgericht": "Amtsgericht Hagen",
      "registernummer": "HRB 9091",
      "registerart": "HRB",
      "company_name": "hörconcept Hagen GmbH",
      "company_seat": "Hagen",
      "details": "06.11.2025 (Bekanntmachungsdatum)\n\nNordrhein-Westfalen Amtsgericht Hagen HRB 9091\nRegisterbekanntmachung nach dem Umwandlungsgesetz 06.11.2025 (Eintragungsdatum)\n\nhörconcept Hagen GmbH\nGesellschaft mit beschränkter Haftung\nHagen\n\nDen Gläubigern der an der Verschmelzung beteiligten Rechtsträger ist, wenn sie binnen sechs Monaten nach dem Tag, an dem die Eintragung der Verschmelzung in das Register des Sitzes derjenigen Rechtsträger deren Gläubiger sie sind, nach § 19 Absatz 3 UmwG als bekanntgemacht gilt, ihren Anspruch nach Grund und Höhe schriftlich anmelden, Sicherheit zu leisten, soweit sie nicht Befriedigung verlangen können. Dieses Recht steht den Gläubigern jedoch nur zu, wenn sie glaubhaft machen, dass durch die Verschmelzung die Erfüllung ihrer Forderung gefährdet wird."
    },
    {
      "date": "2025-11-06",
      "id": "136555",
      "original_text": "Löschungsankündigung\nNordrhein-Westfalen Amtsgericht Düsseldorf HRB 55692\nKonstruktionswerk GmbH – Düsseldorf",
      "type": "Löschungsankündigung",
      "state": "Nordrhein-Westfalen",
      "amtsgericht": "Amtsgericht Düsseldorf",
      "registernummer": "HRB 55692",
      "registerart": "HRB",
      "company_name": "Konstruktionswerk GmbH",
      "company_seat": "Düsseldorf",
      "details": "06.11.2025 (Bekanntmachungsdatum)\n\nNordrhein-Westfalen Amtsgericht Düsseldorf HRB 55692\nLöschungsankündigung\n\nKonstruktionswerk GmbH\nGesellschaft mit beschränkter Haftung\nDüsseldorf\n\nDas Registergericht beabsichtigt die Gesellschaft von Amts wegen nach § 394 FamFG zu löschen. Die Frist zur Erhebung eines Widerspruchs ist auf 3 Wochen festgesetzt.\n\nRechtsbehelfsbelehrung:\nDas Widerspruchsrecht steht jedem zu, der an der Unterlassung der Löschung ein berechtigtes Interesse hat. Der Widerspruch ist bei dem Amtsgericht Düsseldorf -Registergericht-, Werdener Straße 1, 40227 Düsseldorf schriftlich in deutscher Sprache oder zur Niederschrift der Geschäftsstelle einzulegen. Der Widerspruch kann auch zur Niederschrift der Geschäftsstelle eines jeden Amtsgerichtes abgegeben werden. Die Einlegung ist auch durch Übertragung eines elektronischen Dokuments an die elektronische Poststelle des Gerichts möglich. Das elektronische Dokument muss für die Bearbeitung durch das Gericht geeignet und mit einer qualifizierten elektronischen Signatur der verantwortenden Person versehen sein oder von der verantwortenden Person signiert und auf einem sicheren Übermittlungsweg gemäß § 130a ZPO nach näherer Maßgabe der Verordnung über die technischen Rahmenbedingungen des elektronischen Rechtsverkehrs und über das besondere elektronische Behördenpostfach (BGBl. I, S.3803) eingereicht werden. Weitere Informationen erhalten Sie auf der Internetseite www.justiz.de.\nDer Widerspruch muss spätestens innerhalb der gesetzten Frist nach dem Datum der Bekanntmachung der Löschungsankündigung bei dem Amtsgericht - Registergericht - Düsseldorf eingegangen sein.  Dies gilt auch dann, wenn der Widerspruch zur Niederschrift der Geschäftsstelle eines anderen Amtsgerichtes abgegeben wurde. Die Frist beginnt mit dem Tage der Bekanntmachung der Löschungsankündigung in dem für die Bekanntmachung der Eintragungen in das Handelsregister bestimmten elektronischen Informations- und Kommunikationssystem nach § 10 des Handelsgesetzbuches. Fällt das Ende der Frist auf einen Sonntag, einen allgemeinen Feiertag oder Sonnabend, so endet die Frist mit Ablauf des nächsten Werktages.\nDer Widerspruch muss die Bezeichnung der angefochtenen Löschungsankündigung sowie die Erklärung enthalten, dass Widerspruch gegen diese Löschungsankündigung eingelegt wird. Er ist zu unterzeichnen und soll begründet werden."
    },
    {
      "date": "2025-11-06",
      "id": "136556",
      "original_text": "Einreichung neuer Dokumente\nNordrhein-Westfalen Amtsgericht Essen HRB 36278\nifm group se – Essen",
      "type": "Einreichung neuer Dokumente",
      "state": "Nordrhein-Westfalen",
      "amtsgericht": "Amtsgericht Essen",
      "registernummer": "HRB 36278",
      "registerart": "HRB",
      "company_name": "ifm group se",
      "company_seat": "Essen",
      "details": "06.11.2025 (Bekanntmachungsdatum)\n\nNordrhein-Westfalen Amtsgericht Essen HRB 36278\nEinreichung neuer Dokumente\n\nifm group se\nEuropäische Aktiengesellschaft (SE)\nEssen\n\nDem Registergericht ist eine neue Liste der Mitglieder des Aufsichtsrates eingereicht worden."
    },
    {
      "date": "2025-11-06",
      "id": "136557",
      "original_text": "Löschungsankündigung\nNordrhein-Westfalen Amtsgericht Düren HRA 1983\nWilhelm Karls, Ambulanz-Schleiden, Funktaxi Inhaber Werner Karls – Schleiden-Gemünd",
      "type": "Löschungsankündigung",
      "state": "Nordrhein-Westfalen",
      "amtsgericht": "Amtsgericht Düren",
      "registernummer": "HRA 1983",
      "registerart": "HRA",
      "company_name": "Wilhelm Karls, Ambulanz-Schleiden, Funktaxi Inhaber Werner Karls",
      "company_seat": "Schleiden-Gemünd",
      "details": "06.11.2025 (Bekanntmachungsdatum)\n\nNordrhein-Westfalen Amtsgericht Düren HRA 1983\nLöschungsankündigung 06.11.2025 (Eintragungsdatum)\n\nWilhelm Karls, Ambulanz-Schleiden, Funktaxi Inhaber Werner Karls\nEinzelkaufmann / Einzelkauffrau\nSchleiden-Gemünd\n\nDas Registergericht beabsichtigt die Firma von Amts wegen nach § 31 Abs. 2 HGB, § 393 FamFG zu löschen. Die Frist zur Erhebung eines Widerspruchs ist auf einen Monat festgesetzt."
    },
    {
      "date": "2025-11-06",
      "id": "136558",
      "original_text": "Registerbekanntmachung nach dem Umwandlungsgesetz\nNordrhein-Westfalen Amtsgericht Düsseldorf HRA 25850\nMKM Solar Invest 16 GmbH & Co. KG – Monheim am Rhein",
      "type": "Registerbekanntmachung nach dem Umwandlungsgesetz",
      "state": "Nordrhein-Westfalen",
      "amtsgericht": "Amtsgericht Düsseldorf",
      "registernummer": "HRA 25850",
      "registerart": "HRA",
      "company_name": "MKM Solar Invest 16 GmbH & Co. KG",
      "company_seat": "Monheim am Rhein",
      "details": "06.11.2025 (Bekanntmachungsdatum)\n\nNordrhein-Westfalen Amtsgericht Düsseldorf HRA 25850\nRegisterbekanntmachung nach dem Umwandlungsgesetz 06.11.2025 (Eintragungsdatum)\n\nMKM Solar Invest 16 GmbH & Co. KG\nKommanditgesellschaft\nMonheim am Rhein\n\nDen Gläubigern der an der formwechselnden Umwandlung beteiligten Rechtsträger ist, wenn sie binnen sechs Monaten nach dem Tag, an dem die Eintragung der formwechselnden Umwandlung in das Register des Sitzes desjenigen Rechtsträgers, dessen Gläubiger sie sind, nach § 19 Absatz 3 UmwG als bekanntgemacht gilt, ihren Anspruch nach Grund und Höhe schriftlich anmelden, Sicherheit zu leisten, soweit sie nicht Befriedigung verlangen können. Dieses Recht steht den Gläubigern jedoch nur zu, wenn sie glaubhaft machen, dass durch die formwechselnden Umwandlung die Erfüllung ihrer Forderung gefährdet wird."
    },
    {
      "date": "2025-11-06",
      "id": "136559",
      "original_text": "Registerbekanntmachung nach dem Umwandlungsgesetz\nNordrhein-Westfalen Amtsgericht Iserlohn HRB 1756\nB&D Bauwerkssanierung GmbH – Iserlohn",
      "type": "Registerbekanntmachung nach dem Umwandlungsgesetz",
      "state": "Nordrhein-Westfalen",
      "amtsgericht": "Amtsgericht Iserlohn",
      "registernummer": "HRB 1756",
      "registerart": "HRB",
      "company_name": "B&D Bauwerkssanierung GmbH",
      "company_seat": "Iserlohn",
      "details": "06.11.2025 (Bekanntmachungsdatum)\n\nNordrhein-Westfalen Amtsgericht Iserlohn HRB 1756\nRegisterbekanntmachung nach dem Umwandlungsgesetz 04.11.2025 (Eintragungsdatum)\n\nB&D Bauwerkssanierung GmbH\nGesellschaft mit beschränkter Haftung\nIserlohn\n\nDen Gläubigern der an der Verschmelzung beteiligten Rechtsträger ist, wenn sie binnen sechs Monaten nach dem Tag, an dem die Eintragung der Verschmelzung in das Register des Sitzes desjenigen Rechtsträgers, dessen Gläubiger sie sind, nach § 19 Absatz 3 UmwG als bekanntgemacht gilt, ihren Anspruch nach Grund und Höhe schriftlich anmelden, Sicherheit zu leisten, soweit sie nicht Befriedigung verlangen können. Dieses Recht steht den Gläubigern jedoch nur zu, wenn sie glaubhaft machen, dass durch die Verschmelzung die Erfüllung ihrer Forderung gefährdet wird."
    },
    {
      "date": "2025-11-06",
      "id": "136560",
      "original_text": "Einreichung neuer Dokumente\nNordrhein-Westfalen Amtsgericht Bielefeld HRB 36919\nAER Kooperation AG – Bielefeld",
      "type": "Einreichung neuer Dokumente",
      "state": "Nordrhein-Westfalen",
      "amtsgericht": "Amtsgericht Bielefeld",
      "registernummer": "HRB 36919",
      "registerart": "HRB",
      "company_name": "AER Kooperation AG",
      "company_seat": "Bielefeld",
      "details": "06.11.2025 (Bekanntmachungsdatum)\n\nNordrhein-Westfalen Amtsgericht Bielefeld HRB 36919\nEinreichung neuer Dokumente\n\nAER Kooperation AG\nAktiengesellschaft\nBielefeld\n\nDem Registergericht ist eine neue Liste der Mitglieder des Aufsichtsrates eingereicht worden."
    },
    {
      "date": "2025-11-06",
      "id": "136561",
      "original_text": "Einreichung neuer Dokumente\nNordrhein-Westfalen Amtsgericht Essen HRB 17487\nOpen Grid Europe GmbH – Essen",
      "type": "Einreichung neuer Dokumente",
      "state": "Nordrhein-Westfalen",
      "amtsgericht": "Amtsgericht Essen",
      "registernummer": "HRB 17487",
      "registerart": "HRB",
      "company_name": "Open Grid Europe GmbH",
      "company_seat": "Essen",
      "details": "06.11.2025 (Bekanntmachungsdatum)\n\nNordrhein-Westfalen Amtsgericht Essen HRB 17487\nEinreichung neuer Dokumente\n\nOpen Grid Europe GmbH\nGesellschaft mit beschränkter Haftung\nEssen\n\nDem Registergericht ist eine neue Liste der Mitglieder des Aufsichtsrates eingereicht worden."
    },
    {
      "date": "2025-11-06",
      "id": "136562",
      "original_text": "Registerbekanntmachung nach dem Umwandlungsgesetz\nNordrhein-Westfalen Amtsgericht Iserlohn HRB 7877\nRuhr Rent GmbH – Iserlohn",
      "type": "Registerbekanntmachung nach dem Umwandlungsgesetz",
      "state": "Nordrhein-Westfalen",
      "amtsgericht": "Amtsgericht Iserlohn",
      "registernummer": "HRB 7877",
      "registerart": "HRB",
      "company_name": "Ruhr Rent GmbH",
      "company_seat": "Iserlohn",
      "details": "06.11.2025 (Bekanntmachungsdatum)\n\nNordrhein-Westfalen Amtsgericht Iserlohn HRB 7877\nRegisterbekanntmachung nach dem Umwandlungsgesetz 04.11.2025 (Eintragungsdatum)\n\nRuhr Rent GmbH\nGesellschaft mit beschränkter Haftung\nIserlohn\n\nDen Gläubigern der an der Verschmelzung beteiligten Rechtsträger ist, wenn sie binnen sechs Monaten nach dem Tag, an dem die Eintragung der Verschmelzung in das Register des Sitzes desjenigen Rechtsträgers, dessen Gläubiger sie sind, nach § 19 Absatz 3 UmwG als bekanntgemacht gilt, ihren Anspruch nach Grund und Höhe schriftlich anmelden, Sicherheit zu leisten, soweit sie nicht Befriedigung verlangen können. Dieses Recht steht den Gläubigern jedoch nur zu, wenn sie glaubhaft machen, dass durch die Verschmelzung die Erfüllung ihrer Forderung gefährdet wird."
    },
    {
      "date": "2025-11-06",
      "id": "136563",
      "original_text": "Registerbekanntmachung nach dem Umwandlungsgesetz\nNordrhein-Westfalen Amtsgericht Köln HRB 108481\nSchäferhoff Capital GmbH – Köln",
      "type": "Registerbekanntmachung nach dem Umwandlungsgesetz",
      "state": "Nordrhein-Westfalen",
      "amtsgericht": "Amtsgericht Köln",
      "registernummer": "HRB 108481",
      "registerart": "HRB",
      "company_name": "Schäferhoff Capital GmbH",
      "company_seat": "Köln",
      "details": "06.11.2025 (Bekanntmachungsdatum)\n\nNordrhein-Westfalen Amtsgericht Köln HRB 108481\nRegisterbekanntmachung nach dem Umwandlungsgesetz 06.11.2025 (Eintragungsdatum)\n\nSchäferhoff Capital GmbH\nGesellschaft mit beschränkter Haftung\nKöln\n\nDen Gläubigern der an der Verschmelzung beteiligten Rechtsträger ist, wenn sie binnen sechs Monaten nach dem Tag, an dem die Eintragung der Verschmelzung in das Register des Sitzes desjenigen Rechtsträgers, dessen Gläubiger sie sind, nach § 19 Absatz 3 UmwG als bekanntgemacht gilt, ihren Anspruch nach Grund und Höhe schriftlich anmelden, Sicherheit zu leisten, soweit sie nicht Befriedigung verlangen können. Dieses Recht steht den Gläubigern jedoch nur zu, wenn sie glaubhaft machen, dass durch die Verschmelzung die Erfüllung ihrer Forderung gefährdet wird."
    },
    {
      "date": "2025-11-06",
      "id": "136564",
      "original_text": "Einreichung neuer Dokumente\nNordrhein-Westfalen Amtsgericht Düsseldorf HRB 858\nIndustrieterrains Düsseldorf-Reisholz Aktiengesellschaft – Düsseldorf",
      "type": "Einreichung neuer Dokumente",
      "state": "Nordrhein-Westfalen",
      "amtsgericht": "Amtsgericht Düsseldorf",
      "registernummer": "HRB 858",
      "registerart": "HRB",
      "company_name": "Industrieterrains Düsseldorf-Reisholz Aktiengesellschaft",
      "company_seat": "Düsseldorf",
      "details": "06.11.2025 (Bekanntmachungsdatum)\n\nNordrhein-Westfalen Amtsgericht Düsseldorf HRB 858\nEinreichung neuer Dokumente 06.11.2025 (Eintragungsdatum)\n\nIndustrieterrains Düsseldorf-Reisholz Aktiengesellschaft\nAktiengesellschaft\nDüsseldorf\n\nDem Registergericht ist eine neue Liste der Mitglieder des Aufsichtsrates eingereicht worden."
    },
    {
      "date": "2025-11-06",
      "id": "136565",
      "original_text": "Löschungsankündigung\nNordrhein-Westfalen Amtsgericht Dortmund HRB 31074\nGrammons Restaurant & Weinbar GmbH – Dortmund",
      "type": "Löschungsankündigung",
      "state": "Nordrhein-Westfalen",
      "amtsgericht": "Amtsgericht Dortmund",
      "registernummer": "HRB 31074",
      "registerart": "HRB",
      "company_name": "Grammons Restaurant & Weinbar GmbH",
      "company_seat": "Dortmund",
      "details": "06.11.2025 (Bekanntmachungsdatum)\n\nNordrhein-Westfalen Amtsgericht Dortmund HRB 31074\nLöschungsankündigung\n\nGrammons Restaurant & Weinbar GmbH\nGesellschaft mit beschränkter Haftung\nDortmund\n\nDas Registergericht beabsichtigt die Gesellschaft von Amts wegen nach § 394 FamFG zu löschen. Die Frist zur Erhebung eines Widerspruchs ist auf #DV.Fr(Text=\"Bitte wählen Sie die Widerspruchsfrist aus!\",Eingabe=\"einen Monat\",\"zwei Monate\",\"drei Monate\",\"#insert(Text=\"Freitext\")\"|\"freier Text\") festgesetzt."
    },
    {
      "date": "2025-11-06",
      "id": "136566",
      "original_text": "Löschungsankündigung\nNordrhein-Westfalen Amtsgericht Dortmund HRB 31074\nGrammons Restaurant & Weinbar GmbH – Dortmund",
      "type": "Löschungsankündigung",
      "state": "Nordrhein-Westfalen",
      "amtsgericht": "Amtsgericht Dortmund",
      "registernummer": "HRB 31074",
      "registerart": "HRB",
      "company_name": "Grammons Restaurant & Weinbar GmbH",
      "company_seat": "Dortmund",
      "details": "06.11.2025 (Bekanntmachungsdatum)\n\nNordrhein-Westfalen Amtsgericht Dortmund HRB 31074\nLöschungsankündigung\n\nGrammons Restaurant & Weinbar GmbH\nGesellschaft mit beschränkter Haftung\nDortmund\n\nDas Registergericht beabsichtigt die Gesellschaft von Amts wegen nach § 394 FamFG zu löschen. Die Frist zur Erhebung eines Widerspruchs ist auf zwei Monate festgesetzt."
    },
    {
      "date": "2025-11-06",
      "id": "136567",
      "original_text": "Registerbekanntmachung nach dem Umwandlungsgesetz\nNordrhein-Westfalen Amtsgericht Köln HRB 100315\nFiven GmbH – Köln",
      "type": "Registerbekanntmachung nach dem Umwandlungsgesetz",
      "state": "Nordrhein-Westfalen",
      "amtsgericht": "Amtsgericht Köln",
      "registernummer": "HRB 100315",
      "registerart": "HRB",
      "company_name": "Fiven GmbH",
      "company_seat": "Köln",
      "details": "06.11.2025 (Bekanntmachungsdatum)\n\nNordrhein-Westfalen Amtsgericht Köln HRB 100315\nRegisterbekanntmachung nach dem Umwandlungsgesetz 06.11.2025 (Eintragungsdatum)\n\nFiven GmbH\nGesellschaft mit beschränkter Haftung\nKöln\n\nDen Gläubigern der an der Verschmelzung beteiligten Rechtsträger ist, wenn sie binnen sechs Monaten nach dem Tag, an dem die Eintragung der Verschmelzung in das Register des Sitzes desjenigen Rechtsträgers, dessen Gläubiger sie sind, nach § 19 Absatz 3 UmwG als bekanntgemacht gilt, ihren Anspruch nach Grund und Höhe schriftlich anmelden, Sicherheit zu leisten, soweit sie nicht Befriedigung verlangen können. Dieses Recht steht den Gläubigern jedoch nur zu, wenn sie glaubhaft machen, dass durch die Verschmelzung die Erfüllung ihrer Forderung gefährdet wird."
    },
    {
      "date": "2025-11-06",
      "id": "136568",
      "original_text": "Registerbekanntmachung nach dem Umwandlungsgesetz\nNordrhein-Westfalen Amtsgericht Düsseldorf HRB 39473\nCECONOMY AG – Düsseldorf",
      "type": "Registerbekanntmachung nach dem Umwandlungsgesetz",
      "state": "Nordrhein-Westfalen",
      "amtsgericht": "Amtsgericht Düsseldorf",
      "registernummer": "HRB 39473",
      "registerart": "HRB",
      "company_name": "CECONOMY AG",
      "company_seat": "Düsseldorf",
      "details": "06.11.2025 (Bekanntmachungsdatum)\n\nNordrhein-Westfalen Amtsgericht Düsseldorf HRB 39473\nRegisterbekanntmachung nach dem Umwandlungsgesetz 06.11.2025 (Eintragungsdatum)\n\nCECONOMY AG\nAktiengesellschaft\nDüsseldorf\n\nDen Gläubigern der an der Verschmelzung beteiligten Rechtsträger ist, wenn sie binnen sechs Monaten nach dem Tag, an dem die Eintragung der Verschmelzung in das Register des Sitzes desjenigen Rechtsträgers, dessen Gläubiger sie sind, nach § 19 Absatz 3 UmwG als bekanntgemacht gilt, ihren Anspruch nach Grund und Höhe schriftlich anmelden, Sicherheit zu leisten, soweit sie nicht Befriedigung verlangen können. Dieses Recht steht den Gläubigern jedoch nur zu, wenn sie glaubhaft machen, dass durch die Verschmelzung die Erfüllung ihrer Forderung gefährdet wird."
    },
    {
      "date": "2025-11-06",
      "id": "136569",
      "original_text": "Löschungsankündigung\nNordrhein-Westfalen Amtsgericht Köln HRA 28482\nHauswerk-Team KG – Köln",
      "type": "Löschungsankündigung",
      "state": "Nordrhein-Westfalen",
      "amtsgericht": "Amtsgericht Köln",
      "registernummer": "HRA 28482",
      "registerart": "HRA",
      "company_name": "Hauswerk-Team KG",
      "company_seat": "Köln",
      "details": "06.11.2025 (Bekanntmachungsdatum)\n\nNordrhein-Westfalen Amtsgericht Köln HRA 28482\nLöschungsankündigung\n\nHauswerk-Team KG\nKommanditgesellschaft\nKöln\n\nDas Registergericht beabsichtigt die Firma von Amts wegen nach § 394 FamFG zu löschen. Die Frist zur Erhebung eines Widerspruchs ist auf einen Monat festgesetzt."
    },
    {
      "date": "2025-11-06",
      "id": "136570",
      "original_text": "Löschungsankündigung\nNordrhein-Westfalen Amtsgericht Köln HRA 28482\nHauswerk-Team KG – Köln",
      "type": "Löschungsankündigung",
      "state": "Nordrhein-Westfalen",
      "amtsgericht": "Amtsgericht Köln",
      "registernummer": "HRA 28482",
      "registerart": "HRA",
      "company_name": "Hauswerk-Team KG",
      "company_seat": "Köln",
      "details": "06.11.2025 (Bekanntmachungsdatum)\n\nNordrhein-Westfalen Amtsgericht Köln HRA 28482\nLöschungsankündigung\n\nHauswerk-Team KG\nKommanditgesellschaft\nKöln\n\nDas Registergericht beabsichtigt die Firma von Amts wegen nach § 394 FamFG zu löschen. Die Frist zur Erhebung eines Widerspruchs ist auf einen Monat festgesetzt."
    },
    {
      "date": "2025-11-06",
      "id": "136571",
      "original_text": "Löschungsankündigung\nThüringen Amtsgericht Jena HRB 405476\nXXL Megaprint GmbH – Heilbad Heiligenstadt",
      "type": "Löschungsankündigung",
      "state": "Thüringen",
      "amtsgericht": "Amtsgericht Jena",
      "registernummer": "HRB 405476",
      "registerart": "HRB",
      "company_name": "XXL Megaprint GmbH",
      "company_seat": "Heilbad Heiligenstadt",
      "details": "06.11.2025 (Bekanntmachungsdatum)\n\nThüringen Amtsgericht Jena HRB 405476\nLöschungsankündigung\n\nXXL Megaprint GmbH\nGesellschaft mit beschränkter Haftung\nHeilbad Heiligenstadt\n\nDas Registergericht beabsichtigt, die im Handelsregister eingetragene Gesellschaft wegen Vermögenslosigkeit nach § 394 FamFG von Amts wegen zu löschen. Die Frist zur Erhebung eines Widerspruchs gegen die beabsichtigte Löschung wird auf 6 Wochen festgesetzt."
    },
    {
      "date": "2025-11-06",
      "id": "136572",
      "original_text": "Löschungsankündigung\nHessen Amtsgericht Hanau HRB 98684\nQQ Fliesen GmbH – Bad Orb",
      "type": "Löschungsankündigung",
      "state": "Hessen",
      "amtsgericht": "Amtsgericht Hanau",
      "registernummer": "HRB 98684",
      "registerart": "HRB",
      "company_name": "QQ Fliesen GmbH",
      "company_seat": "Bad Orb",
      "details": "06.11.2025 (Bekanntmachungsdatum)\n\nHessen Amtsgericht Hanau HRB 98684\nLöschungsankündigung\n\nQQ Fliesen GmbH\nGesellschaft mit beschränkter Haftung\nBad Orb\n\nDas Registergericht beabsichtigt, den im Handelsregister eingetragenen Geschäftsführer Esad Gusinac, Bad Orb, von Amts wegen nach § 395 FamFG zu löschen. Die Frist zur Erhebung eines Widerspruchs gegen die beabsichtigte Löschung wird auf 3 Monate festgesetzt."
    },
    {
      "date": "2025-11-06",
      "id": "136573",
      "original_text": "Löschungsankündigung\nHessen Amtsgericht Wiesbaden HRB 23042\nDAT II Grundstücksverwaltungs-GmbH – Wiesbaden",
      "type": "Löschungsankündigung",
      "state": "Hessen",
      "amtsgericht": "Amtsgericht Wiesbaden",
      "registernummer": "HRB 23042",
      "registerart": "HRB",
      "company_name": "DAT II Grundstücksverwaltungs-GmbH",
      "company_seat": "Wiesbaden",
      "details": "06.11.2025 (Bekanntmachungsdatum)\n\nHessen Amtsgericht Wiesbaden HRB 23042\nLöschungsankündigung\n\nDAT II Grundstücksverwaltungs-GmbH\nGesellschaft mit beschränkter Haftung\nWiesbaden\n\nDas Registergericht beabsichtigt die im Handelsregister eingetragene Gesellschaft von Amts wegen nach § 394 FamFG zu löschen. Die Frist zur Erhebung eines Widerspruchs gegen die beabsichtigte Löschung wird auf 3 Monate festgesetzt."
    },
    {
      "date": "2025-11-06",
      "id": "136574",
      "original_text": "Löschungsankündigung\nHessen Amtsgericht Hanau HRB 97296\nMedical Beauty di stellare GmbH – Birstein",
      "type": "Löschungsankündigung",
      "state": "Hessen",
      "amtsgericht": "Amtsgericht Hanau",
      "registernummer": "HRB 97296",
      "registerart": "HRB",
      "company_name": "Medical Beauty di stellare GmbH",
      "company_seat": "Birstein",
      "details": "06.11.2025 (Bekanntmachungsdatum)\n\nHessen Amtsgericht Hanau HRB 97296\nLöschungsankündigung\n\nMedical Beauty di stellare GmbH\nGesellschaft mit beschränkter Haftung\nBirstein\n\nDas Registergericht beabsichtigt die im Handelsregister eingetragene Geschäftsführerin von Amts wegen nach § 395 FamFG zu löschen. Die Frist zur Erhebung eines Widerspruchs gegen die beabsichtigte Löschung wird auf 3 Monate festgesetzt."
    },
    {
      "date": "2025-11-06",
      "id": "136575",
      "original_text": "Einreichung neuer Dokumente\nHessen Amtsgericht Offenbach am Main HRB 53321\nSkandia Lebensversicherung Aktiengesellschaft – Neu-Isenburg",
      "type": "Einreichung neuer Dokumente",
      "state": "Hessen",
      "amtsgericht": "Amtsgericht Offenbach am Main",
      "registernummer": "HRB 53321",
      "registerart": "HRB",
      "company_name": "Skandia Lebensversicherung Aktiengesellschaft",
      "company_seat": "Neu-Isenburg",
      "details": "06.11.2025 (Bekanntmachungsdatum)\n\nHessen Amtsgericht Offenbach am Main HRB 53321\nEinreichung neuer Dokumente 06.11.2025 (Eintragungsdatum)\n\nSkandia Lebensversicherung Aktiengesellschaft\nAktiengesellschaft\nNeu-Isenburg\n\nDurch eine Änderung in den Personen der Aufsichtsratsmitglieder ist eine Liste der Mitglieder des Aufsichtsrates zum Handelsregister eingereicht worden."
    },
    {
      "date": "2025-11-06",
      "id": "136576",
      "original_text": "Einreichung neuer Dokumente\nHessen Amtsgericht Offenbach am Main HRB 54117\nEntis Lebensversicherung AG – Neu-Isenburg",
      "type": "Einreichung neuer Dokumente",
      "state": "Hessen",
      "amtsgericht": "Amtsgericht Offenbach am Main",
      "registernummer": "HRB 54117",
      "registerart": "HRB",
      "company_name": "Entis Lebensversicherung AG",
      "company_seat": "Neu-Isenburg",
      "details": "06.11.2025 (Bekanntmachungsdatum)\n\nHessen Amtsgericht Offenbach am Main HRB 54117\nEinreichung neuer Dokumente 06.11.2025 (Eintragungsdatum)\n\nEntis Lebensversicherung AG\nAktiengesellschaft\nNeu-Isenburg\n\nDurch eine Änderung in den Personen der Aufsichtsratsmitglieder ist eine Liste der Mitglieder des Aufsichtsrates zum Handelsregister eingereicht worden."
    },
    {
      "date": "2025-11-06",
      "id": "136577",
      "original_text": "Löschungsankündigung\nHessen Amtsgericht Darmstadt HRB 101097\nBelviss Bau Service UG (haftungsbeschränkt) – Münster",
      "type": "Löschungsankündigung",
      "state": "Hessen",
      "amtsgericht": "Amtsgericht Darmstadt",
      "registernummer": "HRB 101097",
      "registerart": "HRB",
      "company_name": "Belviss Bau Service UG (haftungsbeschränkt)",
      "company_seat": "Münster",
      "details": "06.11.2025 (Bekanntmachungsdatum)\n\nHessen Amtsgericht Darmstadt HRB 101097\nLöschungsankündigung\n\nBelviss Bau Service UG (haftungsbeschränkt)\nGesellschaft mit beschränkter Haftung\nMünster\n\nDas Registergericht beabsichtigt die im Handelsregister eingetragene Gesellschaft von Amts wegen nach § 394 FamFG zu löschen. Die Frist zur Erhebung eines Widerspruchs gegen die beabsichtigte Löschung wird auf 3 Monate festgesetzt."
    },
    {
      "date": "2025-11-06",
      "id": "136578",
      "original_text": "Löschungsankündigung\nHessen Amtsgericht Darmstadt HRB 93862\nThomas Becker GmbH – Groß-Gerau",
      "type": "Löschungsankündigung",
      "state": "Hessen",
      "amtsgericht": "Amtsgericht Darmstadt",
      "registernummer": "HRB 93862",
      "registerart": "HRB",
      "company_name": "Thomas Becker GmbH",
      "company_seat": "Groß-Gerau",
      "details": "06.11.2025 (Bekanntmachungsdatum)\n\nHessen Amtsgericht Darmstadt HRB 93862\nLöschungsankündigung\n\nThomas Becker GmbH\nGesellschaft mit beschränkter Haftung\nGroß-Gerau\n\nDas Registergericht beabsichtigt die im Handelsregister eingetragene Gesellschaft von Amts wegen nach § 394 FamFG zu löschen. Die Frist zur Erhebung eines Widerspruchs gegen die beabsichtigte Löschung wird auf 3 Monate festgesetzt."
    },
    {
      "date": "2025-11-06",
      "id": "136579",
      "original_text": "Sonstige Registerbekanntmachung\nHessen Amtsgericht Fritzlar VR 449\nDeutscher Mieterbund - Mieterverein Borken und Umgebung - – Borken (Hessen)",
      "type": "Sonstige Registerbekanntmachung",
      "state": "Hessen",
      "amtsgericht": "Amtsgericht Fritzlar",
      "registernummer": "VR 449",
      "registerart": "VR",
      "company_name": "Deutscher Mieterbund - Mieterverein Borken und Umgebung -",
      "company_seat": "Borken (Hessen)",
      "details": "06.11.2025 (Bekanntmachungsdatum)\n\nHessen Amtsgericht Fritzlar VR 449\nSonstige Registerbekanntmachung 06.11.2025 (Eintragungsdatum)\n\nDeutscher Mieterbund - Mieterverein Borken und Umgebung -\neingetragener Verein\nBorken (Hessen)\n\nDer Verein ist aufgelöst."
    },
    {
      "date": "2025-11-06",
      "id": "136580",
      "original_text": "Registerbekanntmachung nach dem Umwandlungsgesetz\nHessen Amtsgericht Offenbach am Main HRB 56856\nHWNK CARE GmbH – Seligenstadt",
      "type": "Registerbekanntmachung nach dem Umwandlungsgesetz",
      "state": "Hessen",
      "amtsgericht": "Amtsgericht Offenbach am Main",
      "registernummer": "HRB 56856",
      "registerart": "HRB",
      "company_name": "HWNK CARE GmbH",
      "company_seat": "Seligenstadt",
      "details": "06.11.2025 (Bekanntmachungsdatum)\n\nHessen Amtsgericht Offenbach am Main HRB 56856\nRegisterbekanntmachung nach dem Umwandlungsgesetz 06.11.2025 (Eintragungsdatum)\n\nHWNK CARE GmbH\nGesellschaft mit beschränkter Haftung\nSeligenstadt\n\nDen Gläubigern der an der Verschmelzung beteiligten Rechtsträger ist, wenn sie binnen sechs Monaten nach dem Tag, an dem die Eintragung der Verschmelzung in das Register des Sitzes desjenigen Rechtsträgers, dessen Gläubiger sie sind, nach § 19 Absatz 3 UmwG bekannt gemacht worden ist, ihren Anspruch nach Grund und Höhe schriftlich anmelden, Sicherheit zu leisten, soweit sie nicht Befriedigung verlangen können. Dieses Recht steht den Gläubigern jedoch nur zu, wenn sie glaubhaft machen, dass durch die Verschmelzung die Erfüllung ihrer Forderung gefährdet wird."
    },
    {
      "date": "2025-11-06",
      "id": "136581",
      "original_text": "Registerbekanntmachung nach dem Umwandlungsgesetz\nHessen Amtsgericht Offenbach am Main HRB 57073\nWECO Projektgesellschaft mbH – Seligenstadt",
      "type": "Registerbekanntmachung nach dem Umwandlungsgesetz",
      "state": "Hessen",
      "amtsgericht": "Amtsgericht Offenbach am Main",
      "registernummer": "HRB 57073",
      "registerart": "HRB",
      "company_name": "WECO Projektgesellschaft mbH",
      "company_seat": "Seligenstadt",
      "details": "06.11.2025 (Bekanntmachungsdatum)\n\nHessen Amtsgericht Offenbach am Main HRB 57073\nRegisterbekanntmachung nach dem Umwandlungsgesetz 06.11.2025 (Eintragungsdatum)\n\nWECO Projektgesellschaft mbH\nGesellschaft mit beschränkter Haftung\nSeligenstadt\n\nDen Gläubigern der an der Verschmelzung beteiligten Rechtsträger ist, wenn sie binnen sechs Monaten nach dem Tag, an dem die Eintragung der Verschmelzung in das Register des Sitzes desjenigen Rechtsträgers, dessen Gläubiger sie sind, nach § 19 Absatz 3 UmwG bekannt gemacht worden ist, ihren Anspruch nach Grund und Höhe schriftlich anmelden, Sicherheit zu leisten, soweit sie nicht Befriedigung verlangen können. Dieses Recht steht den Gläubigern jedoch nur zu, wenn sie glaubhaft machen, dass durch die Verschmelzung die Erfüllung ihrer Forderung gefährdet wird."
    },
    {
      "date": "2025-11-06",
      "id": "136582",
      "original_text": "Sonstige Registerbekanntmachung\nHessen Amtsgericht Fritzlar VR 1219\nFreie Funkgemeinschaft Efze – Knüllwald-Völkershain",
      "type": "Sonstige Registerbekanntmachung",
      "state": "Hessen",
      "amtsgericht": "Amtsgericht Fritzlar",
      "registernummer": "VR 1219",
      "registerart": "VR",
      "company_name": "Freie Funkgemeinschaft Efze",
      "company_seat": "Knüllwald-Völkershain",
      "details": "06.11.2025 (Bekanntmachungsdatum)\n\nHessen Amtsgericht Fritzlar VR 1219\nSonstige Registerbekanntmachung 06.11.2025 (Eintragungsdatum)\n\nFreie Funkgemeinschaft Efze\neingetragener Verein\nKnüllwald-Völkershain\n\nDer Verein ist aufgelöst."
    },
    {
      "date": "2025-11-06",
      "id": "136583",
      "original_text": "Einreichung neuer Dokumente\nHessen Amtsgericht Marburg HRB 5629\nGSK Vaccines GmbH – Marburg",
      "type": "Einreichung neuer Dokumente",
      "state": "Hessen",
      "amtsgericht": "Amtsgericht Marburg",
      "registernummer": "HRB 5629",
      "registerart": "HRB",
      "company_name": "GSK Vaccines GmbH",
      "company_seat": "Marburg",
      "details": "06.11.2025 (Bekanntmachungsdatum)\n\nHessen Amtsgericht Marburg HRB 5629\nEinreichung neuer Dokumente\n\nGSK Vaccines GmbH\nGesellschaft mit beschränkter Haftung\nMarburg\n\nDurch eine Änderung in den Personen der Aufsichtsratsmitglieder ist eine Liste der Mitglieder des Aufsichtsrates zum Handelsregister eingereicht worden."
    },
    {
      "date": "2025-11-06",
      "id": "136584",
      "original_text": "Löschungsankündigung\nHessen Amtsgericht Frankfurt am Main HRB 106598\nLodid GmbH – Hofheim am Taunus",
      "type": "Löschungsankündigung",
      "state": "Hessen",
      "amtsgericht": "Amtsgericht Frankfurt am Main",
      "registernummer": "HRB 106598",
      "registerart": "HRB",
      "company_name": "Lodid GmbH",
      "company_seat": "Hofheim am Taunus",
      "details": "06.11.2025 (Bekanntmachungsdatum)\n\nHessen Amtsgericht Frankfurt am Main HRB 106598\nLöschungsankündigung\n\nLodid GmbH\nGesellschaft mit beschränkter Haftung\nHofheim am Taunus\n\nDas Registergericht beabsichtigt die im Handelsregister eingetragene Gesellschaft von Amts wegen nach § 394 FamFG zu löschen. Die Frist zur Erhebung eines Widerspruchs gegen die beabsichtigte Löschung wird auf 2 Monate festgesetzt."
    },
    {
      "date": "2025-11-06",
      "id": "136585",
      "original_text": "Sonstige Registerbekanntmachung\nHessen Amtsgericht Marburg VR 4189\nWanderfreunde Katzbachtal Rommershausen – Schwalmstadt-Rommershausen",
      "type": "Sonstige Registerbekanntmachung",
      "state": "Hessen",
      "amtsgericht": "Amtsgericht Marburg",
      "registernummer": "VR 4189",
      "registerart": "VR",
      "company_name": "Wanderfreunde Katzbachtal Rommershausen",
      "company_seat": "Schwalmstadt-Rommershausen",
      "details": "06.11.2025 (Bekanntmachungsdatum)\n\nHessen Amtsgericht Marburg VR 4189\nSonstige Registerbekanntmachung 21.10.2025 (Eintragungsdatum)\n\nWanderfreunde Katzbachtal Rommershausen\neingetragener Verein\nSchwalmstadt-Rommershausen\n\nDer Verein ist aufgelöst."
    }
  ]
}