{
  "date": "2025-11-03",
  "date_of_scrape": "2025-11-04T04:09:46.439Z",
  "tool_version": "0.2.0",
  "number_of_announcements": 124,
  "announcements": [
    {
      "date": "2025-11-03",
      "id": "136060",
      "original_text": "Löschungsankündigung\nBerlin Amtsgericht Berlin (Charlottenburg) HRB 207183\nZero Taxi GmbH – Berlin",
      "type": "Löschungsankündigung",
      "state": "Berlin",
      "amtsgericht": "Amtsgericht Berlin (Charlottenburg)",
      "registernummer": "HRB 207183",
      "registerart": "HRB",
      "company_name": "Zero Taxi GmbH",
      "company_seat": "Berlin",
      "details": "03.11.2025 (Bekanntmachungsdatum)\n\nBerlin Amtsgericht Berlin (Charlottenburg) HRB 207183\nLöschungsankündigung\n\nZero Taxi GmbH\nGesellschaft mit beschränkter Haftung\nBerlin\n\nBei der nachstehenden Gesellschaft wird das Amtslöschungsverfahren gemäß § 394 FamFG eingeleitet. Widerspruchsfrist 6 Wochen"
    },
    {
      "date": "2025-11-03",
      "id": "136061",
      "original_text": "Einreichung neuer Dokumente\nBerlin Amtsgericht Berlin (Charlottenburg) HRB 280452\nGEHAG Vierte Beteiligung AG – Berlin",
      "type": "Einreichung neuer Dokumente",
      "state": "Berlin",
      "amtsgericht": "Amtsgericht Berlin (Charlottenburg)",
      "registernummer": "HRB 280452",
      "registerart": "HRB",
      "company_name": "GEHAG Vierte Beteiligung AG",
      "company_seat": "Berlin",
      "details": "03.11.2025 (Bekanntmachungsdatum)\n\nBerlin Amtsgericht Berlin (Charlottenburg) HRB 280452\nEinreichung neuer Dokumente\n\nGEHAG Vierte Beteiligung AG\nAktiengesellschaft\nBerlin\n\nAls nicht eingetragen wird veröffentlicht: Es wurde eine neue Liste der Aufsichtsratsmitglieder eingereicht (§ 106 AktG)."
    },
    {
      "date": "2025-11-03",
      "id": "136062",
      "original_text": "Registerbekanntmachung nach dem Umwandlungsgesetz\nHamburg Amtsgericht Hamburg HRB 82190\nShell Deutschland GmbH – Hamburg",
      "type": "Registerbekanntmachung nach dem Umwandlungsgesetz",
      "state": "Hamburg",
      "amtsgericht": "Amtsgericht Hamburg",
      "registernummer": "HRB 82190",
      "registerart": "HRB",
      "company_name": "Shell Deutschland GmbH",
      "company_seat": "Hamburg",
      "details": "03.11.2025 (Bekanntmachungsdatum)\n\nHamburg Amtsgericht Hamburg HRB 82190\nRegisterbekanntmachung nach dem Umwandlungsgesetz 03.11.2025 (Eintragungsdatum)\n\nShell Deutschland GmbH\nGesellschaft mit beschränkter Haftung\nHamburg\n\nAls nicht eingetragen wird bekannt gemacht:\nDen Gläubigern der an der Verschmelzung beteiligten Gesellschaften ist, wenn sie binnen sechs Monaten nach dem Tag, an dem die Eintragung der Verschmelzung in das Register des Sitzes desjenigen Rechtsträgers, dessen Gläubiger sie sind, nach § 19 Absatz 3 UmwG als bekannt gemacht gilt, ihren Anspruch nach Grund und Höhe schriftlich anmelden, Sicherheit zu leisten, soweit sie nicht Befriedigung verlangen können. Dieses Recht steht den Gläubigern jedoch nur zu, wenn sie glaubhaft machen, dass durch die Verschmelzung die Erfüllung ihrer Forderung gefährdet wird."
    },
    {
      "date": "2025-11-03",
      "id": "136063",
      "original_text": "Löschungsankündigung\nSaarland Amtsgericht Saarbrücken HRB 109093\nIwona Dembkowska UG (haftungsbeschränkt) – Saarbrücken",
      "type": "Löschungsankündigung",
      "state": "Saarland",
      "amtsgericht": "Amtsgericht Saarbrücken",
      "registernummer": "HRB 109093",
      "registerart": "HRB",
      "company_name": "Iwona Dembkowska UG (haftungsbeschränkt)",
      "company_seat": "Saarbrücken",
      "details": "03.11.2025 (Bekanntmachungsdatum)\n\nSaarland Amtsgericht Saarbrücken HRB 109093\nLöschungsankündigung\n\nIwona Dembkowska UG (haftungsbeschränkt)\nGesellschaft mit beschränkter Haftung\nSaarbrücken\n\nEs ist beabsichtigt, die Gesellschaft von Amts wegen gemäß § 394 FamFG wegen Vermögenslosigkeit zu löschen.\nGegen die Löschung von Amts wegen ist das Rechtsmittel des Widerspruchs statthaft. Der Widerspruch ist binnen einer Frist von drei Monaten beginnend mit dem Tag dieser Veröffentlichung durch Einreichen eines Widerspruchsschreibens -schriftlich oder zur Niederschrift der Geschäftsstelle beim Amtsgericht Saarbrücken, -zentrales Handelsregister-, Mainzerstr.178, 66121 Saarbrücken einzulegen.\nDer Widerspruch muss die Bezeichnung der angefochtenen Löschungsankündigung enthalten sowie die Erklärung, dass Widerspruch eingelegt wird. Er ist vom Widerspruchsführer oder seinem Bevollmächtigten zu unterzeichnen.\nDas Widerspruchsschreiben kann auch in der Form eines elektronischen Dokumentes eingereicht werden, das mit einer qualifizierten elektronischen Signatur nach dem Signaturgesetz versehen sein muss (§§ 14 Abs. 2 FamFG, 130a, 298 ZPO)."
    },
    {
      "date": "2025-11-03",
      "id": "136064",
      "original_text": "Löschungsankündigung\nSaarland Amtsgericht Saarbrücken HRB 105694\nMD Works GmbH – Wadern",
      "type": "Löschungsankündigung",
      "state": "Saarland",
      "amtsgericht": "Amtsgericht Saarbrücken",
      "registernummer": "HRB 105694",
      "registerart": "HRB",
      "company_name": "MD Works GmbH",
      "company_seat": "Wadern",
      "details": "03.11.2025 (Bekanntmachungsdatum)\n\nSaarland Amtsgericht Saarbrücken HRB 105694\nLöschungsankündigung\n\nMD Works GmbH\nGesellschaft mit beschränkter Haftung\nWadern\n\nEs ist beabsichtigt, die Gesellschaft von Amts wegen gemäß § 394 FamFG wegen Vermögenslosigkeit zu löschen.\nGegen die Löschung von Amts wegen ist das Rechtsmittel des Widerspruchs statthaft. Der Widerspruch ist binnen einer Frist von drei Monaten beginnend mit dem Tag dieser Veröffentlichung durch Einreichen eines Widerspruchsschreibens -schriftlich oder zur Niederschrift der Geschäftsstelle beim Amtsgericht Saarbrücken, -zentrales Handelsregister-, Mainzerstr.178, 66121 Saarbrücken einzulegen.\nDer Widerspruch muss die Bezeichnung der angefochtenen Löschungsankündigung enthalten sowie die Erklärung, dass Widerspruch eingelegt wird. Er ist vom Widerspruchsführer oder seinem Bevollmächtigten zu unterzeichnen.\nDas Widerspruchsschreiben kann auch in der Form eines elektronischen Dokumentes eingereicht werden, das mit einer qualifizierten elektronischen Signatur nach dem Signaturgesetz versehen sein muss (§§ 14 Abs. 2 FamFG, 130a, 298 ZPO)."
    },
    {
      "date": "2025-11-03",
      "id": "136065",
      "original_text": "Registerbekanntmachung nach dem Umwandlungsgesetz\nHamburg Amtsgericht Hamburg HRB 89170\neuroShell Deutschland Verwaltungsgesellschaft mbH – Hamburg",
      "type": "Registerbekanntmachung nach dem Umwandlungsgesetz",
      "state": "Hamburg",
      "amtsgericht": "Amtsgericht Hamburg",
      "registernummer": "HRB 89170",
      "registerart": "HRB",
      "company_name": "euroShell Deutschland Verwaltungsgesellschaft mbH",
      "company_seat": "Hamburg",
      "details": "03.11.2025 (Bekanntmachungsdatum)\n\nHamburg Amtsgericht Hamburg HRB 89170\nRegisterbekanntmachung nach dem Umwandlungsgesetz 03.11.2025 (Eintragungsdatum)\n\neuroShell Deutschland Verwaltungsgesellschaft mbH\nGesellschaft mit beschränkter Haftung\nHamburg\n\nAls nicht eingetragen wird bekannt gemacht:\nDen Gläubigern der an der Verschmelzung beteiligten Gesellschaften ist, wenn sie binnen sechs Monaten nach dem Tag, an dem die Eintragung der Verschmelzung in das Register des Sitzes desjenigen Rechtsträgers, dessen Gläubiger sie sind, nach § 19 Absatz 3 UmwG als bekannt gemacht gilt, ihren Anspruch nach Grund und Höhe schriftlich anmelden, Sicherheit zu leisten, soweit sie nicht Befriedigung verlangen können. Dieses Recht steht den Gläubigern jedoch nur zu, wenn sie glaubhaft machen, dass durch die Verschmelzung die Erfüllung ihrer Forderung gefährdet wird."
    },
    {
      "date": "2025-11-03",
      "id": "136066",
      "original_text": "Löschungsankündigung\nSaarland Amtsgericht Saarbrücken HRB 108662\nZOE Baushop & Service GmbH – Ottweiler",
      "type": "Löschungsankündigung",
      "state": "Saarland",
      "amtsgericht": "Amtsgericht Saarbrücken",
      "registernummer": "HRB 108662",
      "registerart": "HRB",
      "company_name": "ZOE Baushop & Service GmbH",
      "company_seat": "Ottweiler",
      "details": "03.11.2025 (Bekanntmachungsdatum)\n\nSaarland Amtsgericht Saarbrücken HRB 108662\nLöschungsankündigung\n\nZOE Baushop & Service GmbH\nGesellschaft mit beschränkter Haftung\nOttweiler\n\nEs ist beabsichtigt, die Gesellschaft von Amts wegen gemäß § 394 FamFG wegen Vermögenslosigkeit zu löschen. Gegen die Löschung von Amts wegen ist das Rechtsmittel des Widerspruchs statthaft. Der Widerspruch ist binnen einer Frist von 2 Monaten beginnend mit dem Tag dieser Veröffentlichung durch Einreichen eines Widerspruchsschreibens -schriftlich oder zur Niederschrift der Geschäftsstelle- beim Amtsgericht Saarbrücken, -zentrales Handelsregister-, Mainzerstr.178, 66121 Saarbrücken einzulegen. Der Widerspruch muss die Bezeichnung der angefochtenen Löschungsankündigung enthalten sowie die Erklärung, dass Widerspruch eingelegt wird. Er ist vom Widerspruchsführer oder seinem Bevollmächtigten zu unterzeichnen."
    },
    {
      "date": "2025-11-03",
      "id": "136067",
      "original_text": "Löschungsankündigung\nBaden-Württemberg Amtsgericht Mannheim HRB 734236\nBergmaier Hochbau UG (haftungsbeschränkt) Meisterbetrieb – Weingarten Baden",
      "type": "Löschungsankündigung",
      "state": "Baden-Württemberg",
      "amtsgericht": "Amtsgericht Mannheim",
      "registernummer": "HRB 734236",
      "registerart": "HRB",
      "company_name": "Bergmaier Hochbau UG (haftungsbeschränkt) Meisterbetrieb",
      "company_seat": "Weingarten Baden",
      "details": "03.11.2025 (Bekanntmachungsdatum)\n\nBaden-Württemberg Amtsgericht Mannheim HRB 734236\nLöschungsankündigung\n\nBergmaier Hochbau UG (haftungsbeschränkt) Meisterbetrieb\nGesellschaft mit beschränkter Haftung\nWeingarten Baden\n\nDas Gericht beabsichtigt, die Gesellschaft wegen Vermögenslosigkeit im Handelsregister von Amts wegen nach § 394 FamFG zu löschen. Die Frist zur Geltendmachung eines Widerspruchs gegen die beabsichtigte Löschung ist auf einen Monat ab Veröffentlichung bestimmt."
    },
    {
      "date": "2025-11-03",
      "id": "136068",
      "original_text": "Registerbekanntmachung nach dem Umwandlungsgesetz\nHamburg Amtsgericht Hamburg HRB 172793\nMorGen Mobility GmbH – Hamburg",
      "type": "Registerbekanntmachung nach dem Umwandlungsgesetz",
      "state": "Hamburg",
      "amtsgericht": "Amtsgericht Hamburg",
      "registernummer": "HRB 172793",
      "registerart": "HRB",
      "company_name": "MorGen Mobility GmbH",
      "company_seat": "Hamburg",
      "details": "03.11.2025 (Bekanntmachungsdatum)\n\nHamburg Amtsgericht Hamburg HRB 172793\nRegisterbekanntmachung nach dem Umwandlungsgesetz 03.11.2025 (Eintragungsdatum)\n\nMorGen Mobility GmbH\nGesellschaft mit beschränkter Haftung\nHamburg\n\nAls nicht eingetragen wird bekannt gemacht:\nDen Gläubigern des an der grenzüberschreitenden Verschmelzung beteiligten übernehmenden Rechtsträgers ist, wenn sie binnen sechs Monaten nach dem Tag, an dem die Eintragung der Verschmelzung in das Register des Sitzes desjenigen Rechtsträgers, dessen Gläubiger sie sind, nach § 19 Absatz 3 UmwG als bekanntgemacht gilt, ihren Anspruch nach Grund und Höhe schriftlich anmelden, Sicherheit zu leisten, soweit sie nicht Befriedigung verlangen können.\nDieses Recht steht den Gläubigern jedoch nur zu, wenn sie glaubhaft machen, dass durch die Verschmelzung die Erfüllung ihrer Forderung gefährdet wird."
    },
    {
      "date": "2025-11-03",
      "id": "136069",
      "original_text": "Sonstige Registerbekanntmachung\nHamburg Amtsgericht Hamburg HRB 80683\n4 Free AG – Hamburg",
      "type": "Sonstige Registerbekanntmachung",
      "state": "Hamburg",
      "amtsgericht": "Amtsgericht Hamburg",
      "registernummer": "HRB 80683",
      "registerart": "HRB",
      "company_name": "4 Free AG",
      "company_seat": "Hamburg",
      "details": "03.11.2025 (Bekanntmachungsdatum)\n\nHamburg Amtsgericht Hamburg HRB 80683\nSonstige Registerbekanntmachung 03.11.2025 (Eintragungsdatum)\n\n4 Free AG\nAktiengesellschaft\nHamburg\n\nAls nicht eingetragen wird bekannt gemacht:  Den Gläubigern der Gesellschaft, deren Forderungen begründet worden sind, bevor die Eintragung der Vertragsbeendigung in das Handelsregister nach § 10 HGB als bekannt gemacht gilt, ist vom anderen Vertragsteil Sicherheit zu leisten, wenn sie sich binnen 6 Monaten nach Bekanntmachung der Eintragung zu diesem Zweck bei ihm melden."
    },
    {
      "date": "2025-11-03",
      "id": "136070",
      "original_text": "Löschungsankündigung\nBerlin Amtsgericht Berlin (Charlottenburg) HRB 240245\nWWW Logistics GmbH – Berlin",
      "type": "Löschungsankündigung",
      "state": "Berlin",
      "amtsgericht": "Amtsgericht Berlin (Charlottenburg)",
      "registernummer": "HRB 240245",
      "registerart": "HRB",
      "company_name": "WWW Logistics GmbH",
      "company_seat": "Berlin",
      "details": "03.11.2025 (Bekanntmachungsdatum)\n\nBerlin Amtsgericht Berlin (Charlottenburg) HRB 240245\nLöschungsankündigung\n\nWWW Logistics GmbH\nGesellschaft mit beschränkter Haftung\nBerlin\n\nBei der nachstehenden Gesellschaft wird das Amtslöschungsverfahren gemäß § 394 FamFG eingeleitet. Widerspruchsfrist 6 Wochen"
    },
    {
      "date": "2025-11-03",
      "id": "136071",
      "original_text": "Registerbekanntmachung nach dem Umwandlungsgesetz\nBaden-Württemberg Amtsgericht Stuttgart HRB 802254\nWienen Holding GmbH – Hardt",
      "type": "Registerbekanntmachung nach dem Umwandlungsgesetz",
      "state": "Baden-Württemberg",
      "amtsgericht": "Amtsgericht Stuttgart",
      "registernummer": "HRB 802254",
      "registerart": "HRB",
      "company_name": "Wienen Holding GmbH",
      "company_seat": "Hardt",
      "details": "03.11.2025 (Bekanntmachungsdatum)\n\nBaden-Württemberg Amtsgericht Stuttgart HRB 802254\nRegisterbekanntmachung nach dem Umwandlungsgesetz 03.11.2025 (Eintragungsdatum)\n\nWienen Holding GmbH\nGesellschaft mit beschränkter Haftung\nHardt\n\nAls nicht eingetragen wird bekanntgemacht:\nDen Gläubigern der an der Ausgliederung beteiligten Rechtsträger ist, wenn sie binnen sechs Monaten nach dem Tag, an dem die Eintragung der Ausgliederung in das Register des Sitzes desjenigen Rechtsträgers, dessen Gläubiger sie sind, nach § 19 Abs. 3 UmwG als bekanntgemacht gilt, ihren Anspruch nach Grund und Höhe schriftlich anmelden, Sicherheit zu leisten, soweit sie nicht Befriedigung verlangen können. Dieses Recht steht den Gläubigern jedoch nur zu, wenn sie glaubhaft machen, dass durch die Ausgliederung die Erfüllung ihrer Forderung gefährdet wird."
    },
    {
      "date": "2025-11-03",
      "id": "136072",
      "original_text": "Sonstige Registerbekanntmachung\nBerlin Amtsgericht Berlin (Charlottenburg) HRB 238275\nprimasales GmbH – Berlin",
      "type": "Sonstige Registerbekanntmachung",
      "state": "Berlin",
      "amtsgericht": "Amtsgericht Berlin (Charlottenburg)",
      "registernummer": "HRB 238275",
      "registerart": "HRB",
      "company_name": "primasales GmbH",
      "company_seat": "Berlin",
      "details": "03.11.2025 (Bekanntmachungsdatum)\n\nBerlin Amtsgericht Berlin (Charlottenburg) HRB 238275\nSonstige Registerbekanntmachung\n\nprimasales GmbH\nGesellschaft mit beschränkter Haftung\nBerlin\n\nAls nicht eingetragen wird veröffentlicht: Der andere Vertragsteil hat den Gläubigern dieses Rechtsträgers, deren Forderungen begründet worden sind, bevor die Eintragung der Beendigung dieses Vertrages in das Handelsregister nach § 10 des Handelsgesetzbuches als bekannt gemacht gilt, Sicherheit zu leisten, wenn sie sich binnen sechs Monaten nach der Bekanntmachung der Eintragung zu diesem Zweck bei ihm melden. Dieses Recht steht den Gläubigern nicht zu, die im Fall des Insolvenzverfahrens ein Recht auf vorzugsweise Befriedigung aus der Deckungsmasse haben, die nach gesetzlicher Vorschrift zu ihrem Schutz errichtet und staatlich überwacht ist."
    },
    {
      "date": "2025-11-03",
      "id": "136073",
      "original_text": "Registerbekanntmachung nach dem Umwandlungsgesetz\nBerlin Amtsgericht Berlin (Charlottenburg) HRB 238275\nprimasales GmbH – Berlin",
      "type": "Registerbekanntmachung nach dem Umwandlungsgesetz",
      "state": "Berlin",
      "amtsgericht": "Amtsgericht Berlin (Charlottenburg)",
      "registernummer": "HRB 238275",
      "registerart": "HRB",
      "company_name": "primasales GmbH",
      "company_seat": "Berlin",
      "details": "03.11.2025 (Bekanntmachungsdatum)\n\nBerlin Amtsgericht Berlin (Charlottenburg) HRB 238275\nRegisterbekanntmachung nach dem Umwandlungsgesetz 31.10.2025 (Eintragungsdatum)\n\nprimasales GmbH\nGesellschaft mit beschränkter Haftung\nBerlin\n\nZu Eintragungsnummer 4 vom 31.10.2025 wird als nicht eingetragen veröffentlicht: Den Gläubigern der an der Verschmelzung beteiligten Rechtsträger ist, wenn sie binnen sechs Monaten nach dem Tag, an dem die Eintragung der Verschmelzung in das Register des Sitzes desjenigen Rechtsträgers, dessen Gläubiger sie sind, als bekannt gemacht gilt, ihren Anspruch nach Grund und Höhe schriftlich anmelden, Sicherheit zu leisten, soweit sie nicht Befriedigung verlangen können. Dieses Recht steht den Gläubigern jedoch nur zu, wenn sie glaubhaft machen, dass durch die Verschmelzung die Erfüllung ihrer Forderung gefährdet wird. Das Recht, Sicherheitsleistung zu verlangen, steht Gläubigern nicht zu, die im Falle der Insolvenz ein Recht auf vorzugsweise Befriedigung aus einer Deckungsmasse haben, die nach gesetzlicher Vorschrift zu ihrem Schutz errichtet und staatlich überwacht ist."
    },
    {
      "date": "2025-11-03",
      "id": "136074",
      "original_text": "Registerbekanntmachung nach dem Umwandlungsgesetz\nBerlin Amtsgericht Berlin (Charlottenburg) HRB 244350\nprimasecure GmbH – Berlin",
      "type": "Registerbekanntmachung nach dem Umwandlungsgesetz",
      "state": "Berlin",
      "amtsgericht": "Amtsgericht Berlin (Charlottenburg)",
      "registernummer": "HRB 244350",
      "registerart": "HRB",
      "company_name": "primasecure GmbH",
      "company_seat": "Berlin",
      "details": "03.11.2025 (Bekanntmachungsdatum)\n\nBerlin Amtsgericht Berlin (Charlottenburg) HRB 244350\nRegisterbekanntmachung nach dem Umwandlungsgesetz 31.10.2025 (Eintragungsdatum)\n\nprimasecure GmbH\nGesellschaft mit beschränkter Haftung\nBerlin\n\nZu Eintragungsnummer 3 vom 31.10.2025 wird als nicht eingetragen veröffentlicht:Den Gläubigern der an der Verschmelzung beteiligten Rechtsträger ist, wenn sie binnen sechs Monaten nach dem Tag, an dem die Eintragung der Verschmelzung in das Register des Sitzes desjenigen Rechtsträgers, dessen Gläubiger sie sind, als bekannt gemacht gilt, ihren Anspruch nach Grund und Höhe schriftlich anmelden, Sicherheit zu leisten, soweit sie nicht Befriedigung verlangen können. Dieses Recht steht den Gläubigern jedoch nur zu, wenn sie glaubhaft machen, dass durch die Verschmelzung die Erfüllung ihrer Forderung gefährdet wird. Das Recht, Sicherheitsleistung zu verlangen, steht Gläubigern nicht zu, die im Falle der Insolvenz ein Recht auf vorzugsweise Befriedigung aus einer Deckungsmasse haben, die nach gesetzlicher Vorschrift zu ihrem Schutz errichtet und staatlich überwacht ist."
    },
    {
      "date": "2025-11-03",
      "id": "136075",
      "original_text": "Einreichung neuer Dokumente\nBerlin Amtsgericht Berlin (Charlottenburg) HRB 202784\nNoxtua AG – Berlin",
      "type": "Einreichung neuer Dokumente",
      "state": "Berlin",
      "amtsgericht": "Amtsgericht Berlin (Charlottenburg)",
      "registernummer": "HRB 202784",
      "registerart": "HRB",
      "company_name": "Noxtua AG",
      "company_seat": "Berlin",
      "details": "03.11.2025 (Bekanntmachungsdatum)\n\nBerlin Amtsgericht Berlin (Charlottenburg) HRB 202784\nEinreichung neuer Dokumente\n\nNoxtua AG\nAktiengesellschaft\nBerlin\n\nAls nicht eingetragen wird veröffentlicht: Es wurde eine neue Liste der Aufsichtsratsmitglieder eingereicht (§ 106 AktG)."
    },
    {
      "date": "2025-11-03",
      "id": "136076",
      "original_text": "Registerbekanntmachung nach dem Umwandlungsgesetz\nBerlin Amtsgericht Berlin (Charlottenburg) HRB 280481\nVitalymp GmbH – Berlin",
      "type": "Registerbekanntmachung nach dem Umwandlungsgesetz",
      "state": "Berlin",
      "amtsgericht": "Amtsgericht Berlin (Charlottenburg)",
      "registernummer": "HRB 280481",
      "registerart": "HRB",
      "company_name": "Vitalymp GmbH",
      "company_seat": "Berlin",
      "details": "03.11.2025 (Bekanntmachungsdatum)\n\nBerlin Amtsgericht Berlin (Charlottenburg) HRB 280481\nRegisterbekanntmachung nach dem Umwandlungsgesetz 23.10.2025 (Eintragungsdatum)\n\nVitalymp GmbH\nGesellschaft mit beschränkter Haftung\nBerlin\n\nZu Eintragungsnummer 1 vom 23.10.2025 wird als nicht eingetragen veröffentlicht: Den Gläubigern ist, wenn sie binnen sechs Monaten nach dem Tag, an dem die Eintragung der Umwandlung als bekannt gemacht gilt, ihren Anspruch nach Grund und Höhe schriftlich anmelden, Sicherheit zu leisten, soweit sie nicht Befriedigung verlangen können. Dieses Recht steht den Gläubigern jedoch nur zu, wenn sie glaubhaft machen, dass durch die Umwandlung die Erfüllung ihrer Forderung gefährdet wird. Das Recht, Sicherheitsleistung zu verlangen, steht Gläubigern nicht zu, die im Falle der Insolvenz ein Recht auf vorzugsweise Befriedigung aus einer Deckungsmasse haben, die nach gesetzlicher Vorschrift zu ihrem Schutz errichtet und staatlich überwacht ist."
    },
    {
      "date": "2025-11-03",
      "id": "136077",
      "original_text": "Registerbekanntmachung nach dem Umwandlungsgesetz\nBerlin Amtsgericht Berlin (Charlottenburg) HRB 110517\nprimaholding GmbH – Berlin",
      "type": "Registerbekanntmachung nach dem Umwandlungsgesetz",
      "state": "Berlin",
      "amtsgericht": "Amtsgericht Berlin (Charlottenburg)",
      "registernummer": "HRB 110517",
      "registerart": "HRB",
      "company_name": "primaholding GmbH",
      "company_seat": "Berlin",
      "details": "03.11.2025 (Bekanntmachungsdatum)\n\nBerlin Amtsgericht Berlin (Charlottenburg) HRB 110517\nRegisterbekanntmachung nach dem Umwandlungsgesetz 31.10.2025 (Eintragungsdatum)\n\nprimaholding GmbH\nGesellschaft mit beschränkter Haftung\nBerlin\n\nZu Eintragungsnummer 16 vom 31.10.2025 wird als nicht eingetragen veröffentlicht: Den Gläubigern der an der Verschmelzung beteiligten Rechtsträger ist, wenn sie binnen sechs Monaten nach dem Tag, an dem die Eintragung der Verschmelzung in das Register des Sitzes desjenigen Rechtsträgers, dessen Gläubiger sie sind, als bekannt gemacht gilt, ihren Anspruch nach Grund und Höhe schriftlich anmelden, Sicherheit zu leisten, soweit sie nicht Befriedigung verlangen können. Dieses Recht steht den Gläubigern jedoch nur zu, wenn sie glaubhaft machen, dass durch die Verschmelzung die Erfüllung ihrer Forderung gefährdet wird. Das Recht, Sicherheitsleistung zu verlangen, steht Gläubigern nicht zu, die im Falle der Insolvenz ein Recht auf vorzugsweise Befriedigung aus einer Deckungsmasse haben, die nach gesetzlicher Vorschrift zu ihrem Schutz errichtet und staatlich überwacht ist."
    },
    {
      "date": "2025-11-03",
      "id": "136078",
      "original_text": "Löschungsankündigung\nBaden-Württemberg Amtsgericht Stuttgart HRB 767597\nSL-Cargo Solutions GmbH – Esslingen am Neckar",
      "type": "Löschungsankündigung",
      "state": "Baden-Württemberg",
      "amtsgericht": "Amtsgericht Stuttgart",
      "registernummer": "HRB 767597",
      "registerart": "HRB",
      "company_name": "SL-Cargo Solutions GmbH",
      "company_seat": "Esslingen am Neckar",
      "details": "03.11.2025 (Bekanntmachungsdatum)\n\nBaden-Württemberg Amtsgericht Stuttgart HRB 767597\nLöschungsankündigung\n\nSL-Cargo Solutions GmbH\nGesellschaft mit beschränkter Haftung\nEsslingen am Neckar\n\nAls nicht eingetragen wird bekanntgemacht:\nDas Gericht beabsichtigt, die Gesellschaft wegen Vermögenslosigkeit im Handelsregister von Amts wegen nach § 394 FamFG zu löschen. Die Frist zur Geltendmachung eines Widerspruchs gegen die beabsichtigte Löschung ist auf zwei Monate ab Veröffentlichung bestimmt."
    },
    {
      "date": "2025-11-03",
      "id": "136079",
      "original_text": "Registerbekanntmachung nach dem Umwandlungsgesetz\nHamburg Amtsgericht Hamburg HRB 103348\nWölbern Flight Administration 02 GmbH – Hamburg",
      "type": "Registerbekanntmachung nach dem Umwandlungsgesetz",
      "state": "Hamburg",
      "amtsgericht": "Amtsgericht Hamburg",
      "registernummer": "HRB 103348",
      "registerart": "HRB",
      "company_name": "Wölbern Flight Administration 02 GmbH",
      "company_seat": "Hamburg",
      "details": "03.11.2025 (Bekanntmachungsdatum)\n\nHamburg Amtsgericht Hamburg HRB 103348\nRegisterbekanntmachung nach dem Umwandlungsgesetz 03.11.2025 (Eintragungsdatum)\n\nWölbern Flight Administration 02 GmbH\nGesellschaft mit beschränkter Haftung\nHamburg\n\nAls nicht eingetragen wird bekannt gemacht:\nDen Gläubigern der an der Verschmelzung beteiligten Gesellschaften ist, wenn sie binnen sechs Monaten nach dem Tag, an dem die Eintragung der Verschmelzung in das Register des Sitzes desjenigen Rechtsträgers, dessen Gläubiger sie sind, nach § 19 Absatz 3 UmwG als bekannt gemacht gilt, ihren Anspruch nach Grund und Höhe schriftlich anmelden, Sicherheit zu leisten, soweit sie nicht Befriedigung verlangen können. Dieses Recht steht den Gläubigern jedoch nur zu, wenn sie glaubhaft machen, dass durch die Verschmelzung die Erfüllung ihrer Forderung gefährdet wird."
    },
    {
      "date": "2025-11-03",
      "id": "136080",
      "original_text": "Registerbekanntmachung nach dem Umwandlungsgesetz\nHamburg Amtsgericht Hamburg HRB 100611\nWölbern Flight Administration 01 GmbH – Hamburg",
      "type": "Registerbekanntmachung nach dem Umwandlungsgesetz",
      "state": "Hamburg",
      "amtsgericht": "Amtsgericht Hamburg",
      "registernummer": "HRB 100611",
      "registerart": "HRB",
      "company_name": "Wölbern Flight Administration 01 GmbH",
      "company_seat": "Hamburg",
      "details": "03.11.2025 (Bekanntmachungsdatum)\n\nHamburg Amtsgericht Hamburg HRB 100611\nRegisterbekanntmachung nach dem Umwandlungsgesetz 03.11.2025 (Eintragungsdatum)\n\nWölbern Flight Administration 01 GmbH\nGesellschaft mit beschränkter Haftung\nHamburg\n\nAls nicht eingetragen wird bekannt gemacht:\nDen Gläubigern der an der Verschmelzung beteiligten Gesellschaften ist, wenn sie binnen sechs Monaten nach dem Tag, an dem die Eintragung der Verschmelzung in das Register des Sitzes desjenigen Rechtsträgers, dessen Gläubiger sie sind, nach § 19 Absatz 3 UmwG als bekannt gemacht gilt, ihren Anspruch nach Grund und Höhe schriftlich anmelden, Sicherheit zu leisten, soweit sie nicht Befriedigung verlangen können. Dieses Recht steht den Gläubigern jedoch nur zu, wenn sie glaubhaft machen, dass durch die Verschmelzung die Erfüllung ihrer Forderung gefährdet wird."
    },
    {
      "date": "2025-11-03",
      "id": "136081",
      "original_text": "Registerbekanntmachung nach dem Umwandlungsgesetz\nHamburg Amtsgericht Hamburg HRB 104024\nVerwaltung Cofely IFH geschlossener Immobilienfonds für Holland GmbH – Hamburg",
      "type": "Registerbekanntmachung nach dem Umwandlungsgesetz",
      "state": "Hamburg",
      "amtsgericht": "Amtsgericht Hamburg",
      "registernummer": "HRB 104024",
      "registerart": "HRB",
      "company_name": "Verwaltung Cofely IFH geschlossener Immobilienfonds für Holland GmbH",
      "company_seat": "Hamburg",
      "details": "03.11.2025 (Bekanntmachungsdatum)\n\nHamburg Amtsgericht Hamburg HRB 104024\nRegisterbekanntmachung nach dem Umwandlungsgesetz 03.11.2025 (Eintragungsdatum)\n\nVerwaltung Cofely IFH geschlossener Immobilienfonds für Holland GmbH\nGesellschaft mit beschränkter Haftung\nHamburg\n\nAls nicht eingetragen wird bekannt gemacht:\nDen Gläubigern der an der Verschmelzung beteiligten Gesellschaften ist, wenn sie binnen sechs Monaten nach dem Tag, an dem die Eintragung der Verschmelzung in das Register des Sitzes desjenigen Rechtsträgers, dessen Gläubiger sie sind, nach § 19 Absatz 3 UmwG als bekannt gemacht gilt, ihren Anspruch nach Grund und Höhe schriftlich anmelden, Sicherheit zu leisten, soweit sie nicht Befriedigung verlangen können. Dieses Recht steht den Gläubigern jedoch nur zu, wenn sie glaubhaft machen, dass durch die Verschmelzung die Erfüllung ihrer Forderung gefährdet wird."
    },
    {
      "date": "2025-11-03",
      "id": "136082",
      "original_text": "Registerbekanntmachung nach dem Umwandlungsgesetz\nHamburg Amtsgericht Hamburg HRB 86841\nVerwaltung IFP Erste Immobilienfonds für Polen GmbH – Hamburg",
      "type": "Registerbekanntmachung nach dem Umwandlungsgesetz",
      "state": "Hamburg",
      "amtsgericht": "Amtsgericht Hamburg",
      "registernummer": "HRB 86841",
      "registerart": "HRB",
      "company_name": "Verwaltung IFP Erste Immobilienfonds für Polen GmbH",
      "company_seat": "Hamburg",
      "details": "03.11.2025 (Bekanntmachungsdatum)\n\nHamburg Amtsgericht Hamburg HRB 86841\nRegisterbekanntmachung nach dem Umwandlungsgesetz 03.11.2025 (Eintragungsdatum)\n\nVerwaltung IFP Erste Immobilienfonds für Polen GmbH\nGesellschaft mit beschränkter Haftung\nHamburg\n\nAls nicht eingetragen wird bekannt gemacht:\nDen Gläubigern der an der Verschmelzung beteiligten Gesellschaften ist, wenn sie binnen sechs Monaten nach dem Tag, an dem die Eintragung der Verschmelzung in das Register des Sitzes desjenigen Rechtsträgers, dessen Gläubiger sie sind, nach § 19 Absatz 3 UmwG als bekannt gemacht gilt, ihren Anspruch nach Grund und Höhe schriftlich anmelden, Sicherheit zu leisten, soweit sie nicht Befriedigung verlangen können. Dieses Recht steht den Gläubigern jedoch nur zu, wenn sie glaubhaft machen, dass durch die Verschmelzung die Erfüllung ihrer Forderung gefährdet wird."
    },
    {
      "date": "2025-11-03",
      "id": "136083",
      "original_text": "Registerbekanntmachung nach dem Umwandlungsgesetz\nHamburg Amtsgericht Hamburg HRB 105585\nVerwaltung Sechsundsechzigste IFH geschlossener Immobilienfonds für Holland GmbH – Hamburg",
      "type": "Registerbekanntmachung nach dem Umwandlungsgesetz",
      "state": "Hamburg",
      "amtsgericht": "Amtsgericht Hamburg",
      "registernummer": "HRB 105585",
      "registerart": "HRB",
      "company_name": "Verwaltung Sechsundsechzigste IFH geschlossener Immobilienfonds für Holland GmbH",
      "company_seat": "Hamburg",
      "details": "03.11.2025 (Bekanntmachungsdatum)\n\nHamburg Amtsgericht Hamburg HRB 105585\nRegisterbekanntmachung nach dem Umwandlungsgesetz 03.11.2025 (Eintragungsdatum)\n\nVerwaltung Sechsundsechzigste IFH geschlossener Immobilienfonds für Holland GmbH\nGesellschaft mit beschränkter Haftung\nHamburg\n\nAls nicht eingetragen wird bekannt gemacht:\nDen Gläubigern der an der Verschmelzung beteiligten Gesellschaften ist, wenn sie binnen sechs Monaten nach dem Tag, an dem die Eintragung der Verschmelzung in das Register des Sitzes desjenigen Rechtsträgers, dessen Gläubiger sie sind, nach § 19 Absatz 3 UmwG als bekannt gemacht gilt, ihren Anspruch nach Grund und Höhe schriftlich anmelden, Sicherheit zu leisten, soweit sie nicht Befriedigung verlangen können. Dieses Recht steht den Gläubigern jedoch nur zu, wenn sie glaubhaft machen, dass durch die Verschmelzung die Erfüllung ihrer Forderung gefährdet wird."
    },
    {
      "date": "2025-11-03",
      "id": "136084",
      "original_text": "Löschungsankündigung\nBerlin Amtsgericht Berlin (Charlottenburg) HRB 165071\nCiesar GmbH – Berlin",
      "type": "Löschungsankündigung",
      "state": "Berlin",
      "amtsgericht": "Amtsgericht Berlin (Charlottenburg)",
      "registernummer": "HRB 165071",
      "registerart": "HRB",
      "company_name": "Ciesar GmbH",
      "company_seat": "Berlin",
      "details": "03.11.2025 (Bekanntmachungsdatum)\n\nBerlin Amtsgericht Berlin (Charlottenburg) HRB 165071\nLöschungsankündigung\n\nCiesar GmbH\nGesellschaft mit beschränkter Haftung\nBerlin\n\nBei der nachstehenden Gesellschaft wird das Amtslöschungsverfahren gemäß § 394 FamFG eingeleitet. Widerspruchsfrist 6 Wochen"
    },
    {
      "date": "2025-11-03",
      "id": "136085",
      "original_text": "Löschungsankündigung\nBerlin Amtsgericht Berlin (Charlottenburg) HRB 175977\nKAPPA Bau & Handel GmbH – Berlin",
      "type": "Löschungsankündigung",
      "state": "Berlin",
      "amtsgericht": "Amtsgericht Berlin (Charlottenburg)",
      "registernummer": "HRB 175977",
      "registerart": "HRB",
      "company_name": "KAPPA Bau & Handel GmbH",
      "company_seat": "Berlin",
      "details": "03.11.2025 (Bekanntmachungsdatum)\n\nBerlin Amtsgericht Berlin (Charlottenburg) HRB 175977\nLöschungsankündigung\n\nKAPPA Bau & Handel GmbH\nGesellschaft mit beschränkter Haftung\nBerlin\n\nBei der nachstehenden Gesellschaft wird das Amtslöschungsverfahren gemäß § 394 FamFG eingeleitet. Widerspruchsfrist 6 Wochen"
    },
    {
      "date": "2025-11-03",
      "id": "136086",
      "original_text": "Registerbekanntmachung nach dem Umwandlungsgesetz\nMecklenburg-Vorpommern Amtsgericht Schwerin HRB 15377\nKS Bau GmbH – Dersenow",
      "type": "Registerbekanntmachung nach dem Umwandlungsgesetz",
      "state": "Mecklenburg-Vorpommern",
      "amtsgericht": "Amtsgericht Schwerin",
      "registernummer": "HRB 15377",
      "registerart": "HRB",
      "company_name": "KS Bau GmbH",
      "company_seat": "Dersenow",
      "details": "03.11.2025 (Bekanntmachungsdatum)\n\nMecklenburg-Vorpommern Amtsgericht Schwerin HRB 15377\nRegisterbekanntmachung nach dem Umwandlungsgesetz 03.11.2025 (Eintragungsdatum)\n\nKS Bau GmbH\nGesellschaft mit beschränkter Haftung\nDersenow\n\nDen Gläubigern der an der Ausgliederung beteiligten Rechtsträger ist, wenn sie binnen 6 Monaten nach dem Tag, an dem die Eintragung der Ausgliederung in das Register desjenigen Rechtsträgers, dessen Gläubiger sie sind, nach § 19 Abs. 3 UmwG als bekannt gemacht gilt, ihren Anspruch nach Grund und Höhe schriftlich anmelden, Sicherheit zu leisten, soweit sie nicht Befriedigung verlangen können. Dieses Recht steht ihnen jedoch nur zu, wenn sie glaubhaft machen, dass durch die Ausgliederung die Erfüllung ihrer Forderung gefährdet wird."
    },
    {
      "date": "2025-11-03",
      "id": "136087",
      "original_text": "Sonstige Registerbekanntmachung\nThüringen Amtsgericht Jena HRB 503591\nigb AG – Weimar",
      "type": "Sonstige Registerbekanntmachung",
      "state": "Thüringen",
      "amtsgericht": "Amtsgericht Jena",
      "registernummer": "HRB 503591",
      "registerart": "HRB",
      "company_name": "igb AG",
      "company_seat": "Weimar",
      "details": "03.11.2025 (Bekanntmachungsdatum)\n\nThüringen Amtsgericht Jena HRB 503591\nSonstige Registerbekanntmachung\n\nigb AG\nAktiengesellschaft\nWeimar\n\nBekanntmachung gem. § 106 AktG: Aufgrund einer Veränderung in den Personen der Aufsichtsratsmitglieder ist durch den Vorstand eine neue Liste zum Handelsregister eingereicht worden."
    },
    {
      "date": "2025-11-03",
      "id": "136088",
      "original_text": "Registerbekanntmachung nach dem Umwandlungsgesetz\nHamburg Amtsgericht Hamburg HRB 162279\nJuhobi HR Tech GmbH – Hamburg",
      "type": "Registerbekanntmachung nach dem Umwandlungsgesetz",
      "state": "Hamburg",
      "amtsgericht": "Amtsgericht Hamburg",
      "registernummer": "HRB 162279",
      "registerart": "HRB",
      "company_name": "Juhobi HR Tech GmbH",
      "company_seat": "Hamburg",
      "details": "03.11.2025 (Bekanntmachungsdatum)\n\nHamburg Amtsgericht Hamburg HRB 162279\nRegisterbekanntmachung nach dem Umwandlungsgesetz 03.11.2025 (Eintragungsdatum)\n\nJuhobi HR Tech GmbH\nGesellschaft mit beschränkter Haftung\nHamburg\n\nAls nicht eingetragen wird bekannt gemacht:\nDen Gläubigern der an der Verschmelzung beteiligten Gesellschaften ist, wenn sie binnen sechs Monaten nach dem Tag, an dem die Eintragung der Verschmelzung in das Register des Sitzes desjenigen Rechtsträgers, dessen Gläubiger sie sind, nach § 19 Absatz 3 UmwG als bekannt gemacht gilt, ihren Anspruch nach Grund und Höhe schriftlich anmelden, Sicherheit zu leisten, soweit sie nicht Befriedigung verlangen können. Dieses Recht steht den Gläubigern jedoch nur zu, wenn sie glaubhaft machen, dass durch die Verschmelzung die Erfüllung ihrer Forderung gefährdet wird."
    },
    {
      "date": "2025-11-03",
      "id": "136089",
      "original_text": "Registerbekanntmachung nach dem Umwandlungsgesetz\nHamburg Amtsgericht Hamburg HRB 167521\nNatural Doze GmbH – Hamburg",
      "type": "Registerbekanntmachung nach dem Umwandlungsgesetz",
      "state": "Hamburg",
      "amtsgericht": "Amtsgericht Hamburg",
      "registernummer": "HRB 167521",
      "registerart": "HRB",
      "company_name": "Natural Doze GmbH",
      "company_seat": "Hamburg",
      "details": "03.11.2025 (Bekanntmachungsdatum)\n\nHamburg Amtsgericht Hamburg HRB 167521\nRegisterbekanntmachung nach dem Umwandlungsgesetz 03.11.2025 (Eintragungsdatum)\n\nNatural Doze GmbH\nGesellschaft mit beschränkter Haftung\nHamburg\n\nAls nicht eingetragen wird bekannt gemacht:\nDen Gläubigern der an der Verschmelzung beteiligten Gesellschaften ist, wenn sie binnen sechs Monaten nach dem Tag, an dem die Eintragung der Verschmelzung in das Register des Sitzes desjenigen Rechtsträgers, dessen Gläubiger sie sind, nach § 19 Absatz 3 UmwG als bekannt gemacht gilt, ihren Anspruch nach Grund und Höhe schriftlich anmelden, Sicherheit zu leisten, soweit sie nicht Befriedigung verlangen können. Dieses Recht steht den Gläubigern jedoch nur zu, wenn sie glaubhaft machen, dass durch die Verschmelzung die Erfüllung ihrer Forderung gefährdet wird."
    },
    {
      "date": "2025-11-03",
      "id": "136090",
      "original_text": "Registerbekanntmachung nach dem Umwandlungsgesetz\nHamburg Amtsgericht Hamburg HRB 178384\nHanse Ventures BSJ Service GmbH – Hamburg",
      "type": "Registerbekanntmachung nach dem Umwandlungsgesetz",
      "state": "Hamburg",
      "amtsgericht": "Amtsgericht Hamburg",
      "registernummer": "HRB 178384",
      "registerart": "HRB",
      "company_name": "Hanse Ventures BSJ Service GmbH",
      "company_seat": "Hamburg",
      "details": "03.11.2025 (Bekanntmachungsdatum)\n\nHamburg Amtsgericht Hamburg HRB 178384\nRegisterbekanntmachung nach dem Umwandlungsgesetz 03.11.2025 (Eintragungsdatum)\n\nHanse Ventures BSJ Service GmbH\nGesellschaft mit beschränkter Haftung\nHamburg\n\nAls nicht eingetragen wird bekannt gemacht:\nDen Gläubigern der an der Verschmelzung beteiligten Gesellschaften ist, wenn sie binnen sechs Monaten nach dem Tag, an dem die Eintragung der Verschmelzung in das Register des Sitzes desjenigen Rechtsträgers, dessen Gläubiger sie sind, nach § 19 Absatz 3 UmwG als bekannt gemacht gilt, ihren Anspruch nach Grund und Höhe schriftlich anmelden, Sicherheit zu leisten, soweit sie nicht Befriedigung verlangen können. Dieses Recht steht den Gläubigern jedoch nur zu, wenn sie glaubhaft machen, dass durch die Verschmelzung die Erfüllung ihrer Forderung gefährdet wird."
    },
    {
      "date": "2025-11-03",
      "id": "136091",
      "original_text": "Registerbekanntmachung nach dem Umwandlungsgesetz\nHamburg Amtsgericht Hamburg HRB 188622\nNCR Invest 2 GmbH – Hamburg",
      "type": "Registerbekanntmachung nach dem Umwandlungsgesetz",
      "state": "Hamburg",
      "amtsgericht": "Amtsgericht Hamburg",
      "registernummer": "HRB 188622",
      "registerart": "HRB",
      "company_name": "NCR Invest 2 GmbH",
      "company_seat": "Hamburg",
      "details": "03.11.2025 (Bekanntmachungsdatum)\n\nHamburg Amtsgericht Hamburg HRB 188622\nRegisterbekanntmachung nach dem Umwandlungsgesetz 03.11.2025 (Eintragungsdatum)\n\nNCR Invest 2 GmbH\nGesellschaft mit beschränkter Haftung\nHamburg\n\nAls nicht eingetragen wird bekannt gemacht:\nDen Gläubigern der an der Verschmelzung beteiligten Gesellschaften ist, wenn sie binnen sechs Monaten nach dem Tag, an dem die Eintragung der Verschmelzung in das Register des Sitzes desjenigen Rechtsträgers, dessen Gläubiger sie sind, nach § 19 Absatz 3 UmwG als bekannt gemacht gilt, ihren Anspruch nach Grund und Höhe schriftlich anmelden, Sicherheit zu leisten, soweit sie nicht Befriedigung verlangen können. Dieses Recht steht den Gläubigern jedoch nur zu, wenn sie glaubhaft machen, dass durch die Verschmelzung die Erfüllung ihrer Forderung gefährdet wird."
    },
    {
      "date": "2025-11-03",
      "id": "136092",
      "original_text": "Registerbekanntmachung nach dem Umwandlungsgesetz\nSchleswig-Holstein Amtsgericht Lübeck HRB 9820\nHHE Obst und Gemüse Einzelhandels GmbH – Ahrensburg",
      "type": "Registerbekanntmachung nach dem Umwandlungsgesetz",
      "state": "Schleswig-Holstein",
      "amtsgericht": "Amtsgericht Lübeck",
      "registernummer": "HRB 9820",
      "registerart": "HRB",
      "company_name": "HHE Obst und Gemüse Einzelhandels GmbH",
      "company_seat": "Ahrensburg",
      "details": "03.11.2025 (Bekanntmachungsdatum)\n\nSchleswig-Holstein Amtsgericht Lübeck HRB 9820\nRegisterbekanntmachung nach dem Umwandlungsgesetz 30.10.2025 (Eintragungsdatum)\n\nHHE Obst und Gemüse Einzelhandels GmbH\nGesellschaft mit beschränkter Haftung\nAhrensburg\n\nZu Eintragungsnummer 3 vom 30.10.2025 wird als nicht eingetragen veröffentlicht:\nDen Gläubigern der an der Verschmelzung beteiligten Rechtsträger ist, wenn sie binnen sechs Monaten nach dem Tag, an dem die Eintragung der Verschmelzung in das Register des Sitzes desjenigen Rechtsträgers, dessen Gläubiger sie sind, als bekannt gemacht gilt, ihren Anspruch nach Grund und Höhe schriftlich anmelden, Sicherheit zu leisten, soweit sie nicht Befriedigung verlangen können. Dieses Recht steht den Gläubigern jedoch nur zu, wenn sie glaubhaft machen, dass durch die Verschmelzung die Erfüllung ihrer Forderung gefährdet wird."
    },
    {
      "date": "2025-11-03",
      "id": "136093",
      "original_text": "Sonstige Registerbekanntmachung\nBrandenburg Amtsgericht Potsdam HRB 41352\nDanpower New Energy GmbH – Potsdam",
      "type": "Sonstige Registerbekanntmachung",
      "state": "Brandenburg",
      "amtsgericht": "Amtsgericht Potsdam",
      "registernummer": "HRB 41352",
      "registerart": "HRB",
      "company_name": "Danpower New Energy GmbH",
      "company_seat": "Potsdam",
      "details": "03.11.2025 (Bekanntmachungsdatum)\n\nBrandenburg Amtsgericht Potsdam HRB 41352\nSonstige Registerbekanntmachung\n\nDanpower New Energy GmbH\nGesellschaft mit beschränkter Haftung\nPotsdam\n\nAls nicht eingetragen wird veröffentlicht: Den Gläubigern der Gesellschaft, deren Forderungen begründet worden sind, bevor die Eintragung der Beendigung des Vertrages in das Handelsregister nach § 10 des Handelsgesetzbuches als bekannt gemacht gilt, hat der andere Vertragsteil Sicherheit zu leisten, wenn sie sich binnen sechs Monaten nach der Bekanntmachung der Eintragung zu diesem Zweck bei ihm melden."
    },
    {
      "date": "2025-11-03",
      "id": "136094",
      "original_text": "Löschungsankündigung\nBaden-Württemberg Amtsgericht Mannheim HRB 736990\nFouzia Kleidungs- und Wäschedienst GmbH – Linkenheim-Hochstetten",
      "type": "Löschungsankündigung",
      "state": "Baden-Württemberg",
      "amtsgericht": "Amtsgericht Mannheim",
      "registernummer": "HRB 736990",
      "registerart": "HRB",
      "company_name": "Fouzia Kleidungs- und Wäschedienst GmbH",
      "company_seat": "Linkenheim-Hochstetten",
      "details": "03.11.2025 (Bekanntmachungsdatum)\n\nBaden-Württemberg Amtsgericht Mannheim HRB 736990\nLöschungsankündigung\n\nFouzia Kleidungs- und Wäschedienst GmbH\nGesellschaft mit beschränkter Haftung\nLinkenheim-Hochstetten\n\nDas Gericht beabsichtigt, die Gesellschaft wegen Vermögenslosigkeit im Handelsregister von Amts wegen nach § 394 FamFG zu löschen. Die Frist zur Geltendmachung eines Widerspruchs gegen die beabsichtigte Löschung ist auf einen Monat ab Veröffentlichung bestimmt."
    },
    {
      "date": "2025-11-03",
      "id": "136095",
      "original_text": "Registerbekanntmachung nach dem Umwandlungsgesetz\nBaden-Württemberg Amtsgericht Freiburg HRB 734182\nQualitypool Versicherungsmakler Service GmbH – Buggingen",
      "type": "Registerbekanntmachung nach dem Umwandlungsgesetz",
      "state": "Baden-Württemberg",
      "amtsgericht": "Amtsgericht Freiburg",
      "registernummer": "HRB 734182",
      "registerart": "HRB",
      "company_name": "Qualitypool Versicherungsmakler Service GmbH",
      "company_seat": "Buggingen",
      "details": "03.11.2025 (Bekanntmachungsdatum)\n\nBaden-Württemberg Amtsgericht Freiburg HRB 734182\nRegisterbekanntmachung nach dem Umwandlungsgesetz 03.11.2025 (Eintragungsdatum)\n\nQualitypool Versicherungsmakler Service GmbH\nGesellschaft mit beschränkter Haftung\nBuggingen\n\nAls nicht eingetragen wird bekanntgemacht:\nDen Gläubigern der an der Abspaltung beteiligten Rechtsträger ist, wenn sie binnen sechs Monaten nach dem Tag, an dem die Eintragung der Abspaltung in das Register des Sitzes desjenigen Rechtsträgers, dessen Gläubiger sie sind, nach § 19 Abs. 3 UmwG als bekanntgemacht gilt, ihren Anspruch nach Grund und Höhe schriftlich anmelden, Sicherheit zu leisten, soweit sie nicht Befriedigung verlangen können. Dieses Recht steht den Gläubigern jedoch nur zu, wenn sie glaubhaft machen, dass durch die Abspaltung die Erfüllung ihrer Forderung gefährdet wird."
    },
    {
      "date": "2025-11-03",
      "id": "136096",
      "original_text": "Löschungsankündigung\nBaden-Württemberg Amtsgericht Mannheim HRB 520235\nThermo-Bauelemente-GmbH – Rastatt",
      "type": "Löschungsankündigung",
      "state": "Baden-Württemberg",
      "amtsgericht": "Amtsgericht Mannheim",
      "registernummer": "HRB 520235",
      "registerart": "HRB",
      "company_name": "Thermo-Bauelemente-GmbH",
      "company_seat": "Rastatt",
      "details": "03.11.2025 (Bekanntmachungsdatum)\n\nBaden-Württemberg Amtsgericht Mannheim HRB 520235\nLöschungsankündigung\n\nThermo-Bauelemente-GmbH\nGesellschaft mit beschränkter Haftung\nRastatt\n\nAls nicht eingetragen wird bekanntgemacht:\nDas Gericht beabsichtigt, die Gesellschaft wegen Vermögenslosigkeit im Handelsregister von Amts wegen nach § 394 FamFG zu löschen. Die Frist zur Geltendmachung eines Widerspruchs gegen die beabsichtigte Löschung ist auf einen Monat ab Veröffentlichung bestimmt."
    },
    {
      "date": "2025-11-03",
      "id": "136097",
      "original_text": "Einreichung neuer Dokumente\nHamburg Amtsgericht Hamburg HRB 97920\nDrachenfels 30. V V AG – Hamburg",
      "type": "Einreichung neuer Dokumente",
      "state": "Hamburg",
      "amtsgericht": "Amtsgericht Hamburg",
      "registernummer": "HRB 97920",
      "registerart": "HRB",
      "company_name": "Drachenfels 30. V V AG",
      "company_seat": "Hamburg",
      "details": "03.11.2025 (Bekanntmachungsdatum)\n\nHamburg Amtsgericht Hamburg HRB 97920\nEinreichung neuer Dokumente 27.10.2025 (Eintragungsdatum)\n\nDrachenfels 30. V V AG\nAktiengesellschaft\nHamburg\n\nAls nicht eingetragen wird bekannt gemacht: Liste des Aufsichtsrats wurde eingereicht."
    },
    {
      "date": "2025-11-03",
      "id": "136098",
      "original_text": "Registerbekanntmachung nach dem Umwandlungsgesetz\nHamburg Amtsgericht Hamburg HRB 174601\nNFTrust GmbH & Co. KGaA – Hamburg",
      "type": "Registerbekanntmachung nach dem Umwandlungsgesetz",
      "state": "Hamburg",
      "amtsgericht": "Amtsgericht Hamburg",
      "registernummer": "HRB 174601",
      "registerart": "HRB",
      "company_name": "NFTrust GmbH & Co. KGaA",
      "company_seat": "Hamburg",
      "details": "03.11.2025 (Bekanntmachungsdatum)\n\nHamburg Amtsgericht Hamburg HRB 174601\nRegisterbekanntmachung nach dem Umwandlungsgesetz 03.11.2025 (Eintragungsdatum)\n\nNFTrust GmbH & Co. KGaA\nKommanditgesellschaft auf Aktien\nHamburg\n\nAls nicht eingetragen wird bekannt gemacht:\nDen Gläubigern der an der Verschmelzung beteiligten Gesellschaften ist, wenn sie binnen sechs Monaten nach dem Tag, an dem die Eintragung der Verschmelzung in das Register des Sitzes desjenigen Rechtsträgers, dessen Gläubiger sie sind, nach § 19 Absatz 3 UmwG als bekannt gemacht gilt, ihren Anspruch nach Grund und Höhe schriftlich anmelden, Sicherheit zu leisten, soweit sie nicht Befriedigung verlangen können. Dieses Recht steht den Gläubigern jedoch nur zu, wenn sie glaubhaft machen, dass durch die Verschmelzung die Erfüllung ihrer Forderung gefährdet wird."
    },
    {
      "date": "2025-11-03",
      "id": "136099",
      "original_text": "Registerbekanntmachung nach dem Umwandlungsgesetz\nHamburg Amtsgericht Hamburg HRB 173819\nNFTrust Management GmbH – Hamburg",
      "type": "Registerbekanntmachung nach dem Umwandlungsgesetz",
      "state": "Hamburg",
      "amtsgericht": "Amtsgericht Hamburg",
      "registernummer": "HRB 173819",
      "registerart": "HRB",
      "company_name": "NFTrust Management GmbH",
      "company_seat": "Hamburg",
      "details": "03.11.2025 (Bekanntmachungsdatum)\n\nHamburg Amtsgericht Hamburg HRB 173819\nRegisterbekanntmachung nach dem Umwandlungsgesetz 03.11.2025 (Eintragungsdatum)\n\nNFTrust Management GmbH\nGesellschaft mit beschränkter Haftung\nHamburg\n\nAls nicht eingetragen wird bekannt gemacht:\nDen Gläubigern der an der Verschmelzung beteiligten Gesellschaften ist, wenn sie binnen sechs Monaten nach dem Tag, an dem die Eintragung der Verschmelzung in das Register des Sitzes desjenigen Rechtsträgers, dessen Gläubiger sie sind, nach § 19 Absatz 3 UmwG als bekannt gemacht gilt, ihren Anspruch nach Grund und Höhe schriftlich anmelden, Sicherheit zu leisten, soweit sie nicht Befriedigung verlangen können. Dieses Recht steht den Gläubigern jedoch nur zu, wenn sie glaubhaft machen, dass durch die Verschmelzung die Erfüllung ihrer Forderung gefährdet wird."
    },
    {
      "date": "2025-11-03",
      "id": "136100",
      "original_text": "Löschungsankündigung\nSaarland Amtsgericht Saarbrücken HRB 106899\nHeinrich Heimfrisch GmbH – Saarwellingen",
      "type": "Löschungsankündigung",
      "state": "Saarland",
      "amtsgericht": "Amtsgericht Saarbrücken",
      "registernummer": "HRB 106899",
      "registerart": "HRB",
      "company_name": "Heinrich Heimfrisch GmbH",
      "company_seat": "Saarwellingen",
      "details": "03.11.2025 (Bekanntmachungsdatum)\n\nSaarland Amtsgericht Saarbrücken HRB 106899\nLöschungsankündigung\n\nHeinrich Heimfrisch GmbH\nGesellschaft mit beschränkter Haftung\nSaarwellingen\n\nEs ist beabsichtigt, die Gesellschaft von Amts wegen gemäß § 394 FamFG wegen Vermögenslosigkeit zu löschen.\nGegen die Löschung von Amts wegen ist das Rechtsmittel des Widerspruchs statthaft. Der Widerspruch ist binnen einer Frist von drei Monaten beginnend mit dem Tag dieser Veröffentlichung durch Einreichen eines Widerspruchsschreibens -schriftlich oder zur Niederschrift der Geschäftsstelle beim Amtsgericht Saarbrücken, -zentrales Handelsregister-, Mainzerstr.178, 66121 Saarbrücken einzulegen.\nDer Widerspruch muss die Bezeichnung der angefochtenen Löschungsankündigung enthalten sowie die Erklärung, dass Widerspruch eingelegt wird. Er ist vom Widerspruchsführer oder seinem Bevollmächtigten zu unterzeichnen.\nDas Widerspruchsschreiben kann auch in der Form eines elektronischen Dokumentes eingereicht werden, das mit einer qualifizierten elektronischen Signatur nach dem Signaturgesetz versehen sein muss (§§ 14 Abs. 2 FamFG, 130a, 298 ZPO)."
    },
    {
      "date": "2025-11-03",
      "id": "136101",
      "original_text": "Registerbekanntmachung nach dem Umwandlungsgesetz\nBaden-Württemberg Amtsgericht Mannheim HRB 756176\nBruker BioSpin Holding AG – Ettlingen",
      "type": "Registerbekanntmachung nach dem Umwandlungsgesetz",
      "state": "Baden-Württemberg",
      "amtsgericht": "Amtsgericht Mannheim",
      "registernummer": "HRB 756176",
      "registerart": "HRB",
      "company_name": "Bruker BioSpin Holding AG",
      "company_seat": "Ettlingen",
      "details": "03.11.2025 (Bekanntmachungsdatum)\n\nBaden-Württemberg Amtsgericht Mannheim HRB 756176\nRegisterbekanntmachung nach dem Umwandlungsgesetz 03.11.2025 (Eintragungsdatum)\n\nBruker BioSpin Holding AG\nAktiengesellschaft\nEttlingen\n\nAls nicht eingetragen wird bekanntgemacht: Den Gläubigern des an dem Formwechsel beteiligten Rechtsträgers ist, wenn sie binnen sechs Monaten nach dem Tag, an dem die Eintragung des Formwechsels in das Register des Sitzes desjenigen Rechtsträgers, dessen Gläubiger sie sind, nach § 19 Abs. 3 UmwG als bekanntgemacht gilt, ihren Anspruch nach Grund und Höhe schriftlich anmelden, Sicherheit zu leisten, soweit sie nicht Befriedigung verlangen können. Dieses Recht steht den Gläubigern jedoch nur zu, wenn sie glaubhaft machen, dass durch den Formwechsel die Erfüllung ihrer Forderung gefährdet wird."
    },
    {
      "date": "2025-11-03",
      "id": "136102",
      "original_text": "Registerbekanntmachung nach dem Umwandlungsgesetz\nBaden-Württemberg Amtsgericht Mannheim HRB 102368\nBruker BioSpin Holding GmbH – Ettlingen",
      "type": "Registerbekanntmachung nach dem Umwandlungsgesetz",
      "state": "Baden-Württemberg",
      "amtsgericht": "Amtsgericht Mannheim",
      "registernummer": "HRB 102368",
      "registerart": "HRB",
      "company_name": "Bruker BioSpin Holding GmbH",
      "company_seat": "Ettlingen",
      "details": "03.11.2025 (Bekanntmachungsdatum)\n\nBaden-Württemberg Amtsgericht Mannheim HRB 102368\nRegisterbekanntmachung nach dem Umwandlungsgesetz 03.11.2025 (Eintragungsdatum)\n\nBruker BioSpin Holding GmbH\nGesellschaft mit beschränkter Haftung\nEttlingen\n\nAls nicht eingetragen wird bekanntgemacht: Den Gläubigern des an dem Formwechsel beteiligten Rechtsträgers ist, wenn sie binnen sechs Monaten nach dem Tag, an dem die Eintragung des Formwechsels in das Register des Sitzes desjenigen Rechtsträgers, dessen Gläubiger sie sind, nach § 19 Abs. 3 UmwG als bekanntgemacht gilt, ihren Anspruch nach Grund und Höhe schriftlich anmelden, Sicherheit zu leisten, soweit sie nicht Befriedigung verlangen können. Dieses Recht steht den Gläubigern jedoch nur zu, wenn sie glaubhaft machen, dass durch den Formwechsel die Erfüllung ihrer Forderung gefährdet wird."
    },
    {
      "date": "2025-11-03",
      "id": "136103",
      "original_text": "Registerbekanntmachung nach dem Umwandlungsgesetz\nSchleswig-Holstein Amtsgericht Lübeck HRB 8231\nBoboly Handelsgesellschaft mbH – Ahrensburg",
      "type": "Registerbekanntmachung nach dem Umwandlungsgesetz",
      "state": "Schleswig-Holstein",
      "amtsgericht": "Amtsgericht Lübeck",
      "registernummer": "HRB 8231",
      "registerart": "HRB",
      "company_name": "Boboly Handelsgesellschaft mbH",
      "company_seat": "Ahrensburg",
      "details": "03.11.2025 (Bekanntmachungsdatum)\n\nSchleswig-Holstein Amtsgericht Lübeck HRB 8231\nRegisterbekanntmachung nach dem Umwandlungsgesetz 30.10.2025 (Eintragungsdatum)\n\nBoboly Handelsgesellschaft mbH\nGesellschaft mit beschränkter Haftung\nAhrensburg\n\nZu Eintragungsnummer 7 vom 30.10.2025 wird als nicht eingetragen veröffentlicht:  Als nicht eingetragen wird veröffentlicht: Den Gläubigern der an der Verschmelzung beteiligten Rechtsträger ist, wenn sie binnen sechs Monaten nach dem Tag, an dem die Eintragung der Verschmelzung in das Register des Sitzes desjenigen Rechtsträgers, dessen Gläubiger sie sind, als bekannt gemacht gilt, ihren Anspruch nach Grund und Höhe schriftlich anmelden, Sicherheit zu leisten, soweit sie nicht Befriedigung verlangen können. Dieses Recht steht den Gläubigern jedoch nur zu, wenn sie glaubhaft machen, dass durch die Verschmelzung die Erfüllung ihrer Forderung gefährdet wird."
    },
    {
      "date": "2025-11-03",
      "id": "136104",
      "original_text": "Sonstige Registerbekanntmachung\nSachsen-Anhalt Amtsgericht Stendal HRB 206490\nESB Beteiligungsgesellschaft mbH – Salzmünde/Schiepzig",
      "type": "Sonstige Registerbekanntmachung",
      "state": "Sachsen-Anhalt",
      "amtsgericht": "Amtsgericht Stendal",
      "registernummer": "HRB 206490",
      "registerart": "HRB",
      "company_name": "ESB Beteiligungsgesellschaft mbH",
      "company_seat": "Salzmünde/Schiepzig",
      "details": "03.11.2025 (Bekanntmachungsdatum)\n\nSachsen-Anhalt Amtsgericht Stendal HRB 206490\nSonstige Registerbekanntmachung 03.11.2025 (Eintragungsdatum)\n\nESB Beteiligungsgesellschaft mbH\nGesellschaft mit beschränkter Haftung\nSalzmünde/Schiepzig\n\nDas Registergericht beabsichtigt Frau Rechtsanwältin Susanne Schäff, geboren am 08.12.1963 zum Nachtragsliquidator zu bestellen. Die Frist zur Erhebung eines Widerspruchs wird auf 1 Monat festgesetzt."
    },
    {
      "date": "2025-11-03",
      "id": "136105",
      "original_text": "Registerbekanntmachung nach dem Umwandlungsgesetz\nSchleswig-Holstein Amtsgericht Lübeck HRA 11419\nKathrin Sievers e.K. – Glinde",
      "type": "Registerbekanntmachung nach dem Umwandlungsgesetz",
      "state": "Schleswig-Holstein",
      "amtsgericht": "Amtsgericht Lübeck",
      "registernummer": "HRA 11419",
      "registerart": "HRA",
      "company_name": "Kathrin Sievers e.K.",
      "company_seat": "Glinde",
      "details": "03.11.2025 (Bekanntmachungsdatum)\n\nSchleswig-Holstein Amtsgericht Lübeck HRA 11419\nRegisterbekanntmachung nach dem Umwandlungsgesetz 03.11.2025 (Eintragungsdatum)\n\nKathrin Sievers e.K.\nEinzelkaufmann / Einzelkauffrau\nGlinde\n\nZu Eintragungsnummer 2 vom 03.11.2025 wird als nicht eingetragen veröffentlicht:\nDen Gläubigern der an der Ausgliederung beteiligten Rechtsträger ist, wenn sie binnen sechs Monaten nach dem Tag, an dem die Eintragung der Ausgliederung in das Register des Sitzes desjenigen Rechtsträgers, dessen Gläubiger sie sind, als bekannt gemacht gilt, ihren Anspruch nach Grund und Höhe schriftlich anmelden, Sicherheit zu leisten, soweit sie nicht Befriedigung verlangen können. Dieses Recht steht den Gläubigern jedoch nur zu, wenn sie glaubhaft machen, dass durch die Ausgliederung die Erfüllung ihrer Forderung gefährdet wird."
    },
    {
      "date": "2025-11-03",
      "id": "136106",
      "original_text": "Löschungsankündigung\nBerlin Amtsgericht Berlin (Charlottenburg) HRB 174834\nNobel Security UG (haftungsbeschränkt) – Berlin",
      "type": "Löschungsankündigung",
      "state": "Berlin",
      "amtsgericht": "Amtsgericht Berlin (Charlottenburg)",
      "registernummer": "HRB 174834",
      "registerart": "HRB",
      "company_name": "Nobel Security UG (haftungsbeschränkt)",
      "company_seat": "Berlin",
      "details": "03.11.2025 (Bekanntmachungsdatum)\n\nBerlin Amtsgericht Berlin (Charlottenburg) HRB 174834\nLöschungsankündigung\n\nNobel Security UG (haftungsbeschränkt)\nGesellschaft mit beschränkter Haftung\nBerlin\n\nBei der nachstehenden Gesellschaft wird das Amtslöschungsverfahren gemäß § 394 FamFG eingeleitet. Widerspruchsfrist 6 Wochen"
    },
    {
      "date": "2025-11-03",
      "id": "136107",
      "original_text": "Registerbekanntmachung nach dem Umwandlungsgesetz\nSchleswig-Holstein Amtsgericht Lübeck HRA 11519\nLeaders Academy Petra Muchow e.K. – Neustadt in Holstein",
      "type": "Registerbekanntmachung nach dem Umwandlungsgesetz",
      "state": "Schleswig-Holstein",
      "amtsgericht": "Amtsgericht Lübeck",
      "registernummer": "HRA 11519",
      "registerart": "HRA",
      "company_name": "Leaders Academy Petra Muchow e.K.",
      "company_seat": "Neustadt in Holstein",
      "details": "03.11.2025 (Bekanntmachungsdatum)\n\nSchleswig-Holstein Amtsgericht Lübeck HRA 11519\nRegisterbekanntmachung nach dem Umwandlungsgesetz 03.11.2025 (Eintragungsdatum)\n\nLeaders Academy Petra Muchow e.K.\nEinzelkaufmann / Einzelkauffrau\nNeustadt in Holstein\n\nZu Eintragungsnummer 2 vom 03.11.2025 wird als nicht eingetragen veröffentlicht:\nDen Gläubigern der an der Ausgliedrung beteiligten Rechtsträger ist, wenn sie binnen sechs Monaten nach dem Tag, an dem die Eintragung der Ausgliedrung in das Register des Sitzes desjenigen Rechtsträgers, dessen Gläubiger sie sind, als bekannt gemacht gilt, ihren Anspruch nach Grund und Höhe schriftlich anmelden, Sicherheit zu leisten, soweit sie nicht Befriedigung verlangen können. Dieses Recht steht den Gläubigern jedoch nur zu, wenn sie glaubhaft machen, dass durch die Ausgliedrung die Erfüllung ihrer Forderung gefährdet wird."
    },
    {
      "date": "2025-11-03",
      "id": "136108",
      "original_text": "Löschungsankündigung\nBerlin Amtsgericht Berlin (Charlottenburg) HRB 247249\nHGR Service & Management GmbH – Berlin",
      "type": "Löschungsankündigung",
      "state": "Berlin",
      "amtsgericht": "Amtsgericht Berlin (Charlottenburg)",
      "registernummer": "HRB 247249",
      "registerart": "HRB",
      "company_name": "HGR Service & Management GmbH",
      "company_seat": "Berlin",
      "details": "03.11.2025 (Bekanntmachungsdatum)\n\nBerlin Amtsgericht Berlin (Charlottenburg) HRB 247249\nLöschungsankündigung\n\nHGR Service & Management GmbH\nGesellschaft mit beschränkter Haftung\nBerlin\n\nEs ist beabsichtigt, die Eintragung wegen Mangels einer wesentlichen Voraussetzung gemäß § 395 FamFG von Amts wegen zu löschen. Widerspruchsfrist 2 Wochen"
    },
    {
      "date": "2025-11-03",
      "id": "136109",
      "original_text": "Sonstige Registerbekanntmachung\nBaden-Württemberg Amtsgericht Mannheim HRB 511697\nInterservice Holding GmbH – Heimsheim",
      "type": "Sonstige Registerbekanntmachung",
      "state": "Baden-Württemberg",
      "amtsgericht": "Amtsgericht Mannheim",
      "registernummer": "HRB 511697",
      "registerart": "HRB",
      "company_name": "Interservice Holding GmbH",
      "company_seat": "Heimsheim",
      "details": "03.11.2025 (Bekanntmachungsdatum)\n\nBaden-Württemberg Amtsgericht Mannheim HRB 511697\nSonstige Registerbekanntmachung 03.11.2025 (Eintragungsdatum)\n\nInterservice Holding GmbH\nGesellschaft mit beschränkter Haftung\nHeimsheim\n\nDen Gläubigern der Gesellschaft, deren Forderungen begründet worden sind, bevor die Eintragung der Beendigung des Vertrages in das Handelsregister nach § 10 HGB als bekanntgemacht gilt, ist vom anderen Vertragsteil Sicherheit zu leisten, wenn sie sich binnen sechs Monaten nach der Bekanntmachung zu diesem Zweck bei ihm melden."
    },
    {
      "date": "2025-11-03",
      "id": "136110",
      "original_text": "Löschungsankündigung\nBrandenburg Amtsgericht Potsdam HRB 39257\nCzapla Verkehrssicherung UG (haftungsbeschränkt) – Ludwigsfelde",
      "type": "Löschungsankündigung",
      "state": "Brandenburg",
      "amtsgericht": "Amtsgericht Potsdam",
      "registernummer": "HRB 39257",
      "registerart": "HRB",
      "company_name": "Czapla Verkehrssicherung UG (haftungsbeschränkt)",
      "company_seat": "Ludwigsfelde",
      "details": "03.11.2025 (Bekanntmachungsdatum)\n\nBrandenburg Amtsgericht Potsdam HRB 39257\nLöschungsankündigung\n\nCzapla Verkehrssicherung UG (haftungsbeschränkt)\nGesellschaft mit beschränkter Haftung\nLudwigsfelde\n\nBei der nachstehenden Gesellschaft wird das Amtslöschungsverfahren gemäß § 394 FamFG eingeleitet. Widerspruchsfrist: 8 Wochen."
    },
    {
      "date": "2025-11-03",
      "id": "136111",
      "original_text": "Löschungsankündigung\nBerlin Amtsgericht Berlin (Charlottenburg) HRB 188645\nImmobilienbesitzgesellschaft Berliner41 mbH – Berlin",
      "type": "Löschungsankündigung",
      "state": "Berlin",
      "amtsgericht": "Amtsgericht Berlin (Charlottenburg)",
      "registernummer": "HRB 188645",
      "registerart": "HRB",
      "company_name": "Immobilienbesitzgesellschaft Berliner41 mbH",
      "company_seat": "Berlin",
      "details": "03.11.2025 (Bekanntmachungsdatum)\n\nBerlin Amtsgericht Berlin (Charlottenburg) HRB 188645\nLöschungsankündigung\n\nImmobilienbesitzgesellschaft Berliner41 mbH\nGesellschaft mit beschränkter Haftung\nBerlin\n\nBei der nachstehenden Gesellschaft wird das Amtslöschungsverfahren gemäß § 394 FamFG eingeleitet. Widerspruchsfrist 6 Wochen"
    },
    {
      "date": "2025-11-03",
      "id": "136112",
      "original_text": "Einreichung neuer Dokumente\nBerlin Amtsgericht Berlin (Charlottenburg) HRB 170638\nPohlCon GmbH – Berlin",
      "type": "Einreichung neuer Dokumente",
      "state": "Berlin",
      "amtsgericht": "Amtsgericht Berlin (Charlottenburg)",
      "registernummer": "HRB 170638",
      "registerart": "HRB",
      "company_name": "PohlCon GmbH",
      "company_seat": "Berlin",
      "details": "03.11.2025 (Bekanntmachungsdatum)\n\nBerlin Amtsgericht Berlin (Charlottenburg) HRB 170638\nEinreichung neuer Dokumente\n\nPohlCon GmbH\nGesellschaft mit beschränkter Haftung\nBerlin\n\nAls nicht eingetragen wird veröffentlicht: Es wurde eine neue Liste der Aufsichtsratsmitglieder eingereicht (§52 GmbHG)."
    },
    {
      "date": "2025-11-03",
      "id": "136113",
      "original_text": "Registerbekanntmachung nach dem Umwandlungsgesetz\nSchleswig-Holstein Amtsgericht Lübeck HRB 13462\nHakora Sealing Technology GmbH – Ratzeburg",
      "type": "Registerbekanntmachung nach dem Umwandlungsgesetz",
      "state": "Schleswig-Holstein",
      "amtsgericht": "Amtsgericht Lübeck",
      "registernummer": "HRB 13462",
      "registerart": "HRB",
      "company_name": "Hakora Sealing Technology GmbH",
      "company_seat": "Ratzeburg",
      "details": "03.11.2025 (Bekanntmachungsdatum)\n\nSchleswig-Holstein Amtsgericht Lübeck HRB 13462\nRegisterbekanntmachung nach dem Umwandlungsgesetz 03.11.2025 (Eintragungsdatum)\n\nHakora Sealing Technology GmbH\nGesellschaft mit beschränkter Haftung\nRatzeburg\n\nZu Eintragungsnummer 4 vom 03.11.2025 wird als nicht eingetragen veröffentlicht: Den Gläubigern der an der Ausgliederung beteiligten Rechtsträger ist, wenn sie binnen sechs Monaten nach dem Tag, an dem die Eintragung der Ausgliederung in das Register des Sitzes desjenigen Rechtsträgers, dessen Gläubiger sie sind, als bekannt gemacht gilt, ihren Anspruch nach Grund und Höhe schriftlich anmelden, Sicherheit zu leisten, soweit sie nicht Befriedigung verlangen können. Dieses Recht steht den Gläubigern jedoch nur zu, wenn sie glaubhaft machen, dass durch die Ausgliederung die Erfüllung ihrer Forderung gefährdet wird."
    },
    {
      "date": "2025-11-03",
      "id": "136114",
      "original_text": "Löschungsankündigung\nSachsen Amtsgericht Chemnitz HRB 644\nOIZ Computer GmbH – Plauen",
      "type": "Löschungsankündigung",
      "state": "Sachsen",
      "amtsgericht": "Amtsgericht Chemnitz",
      "registernummer": "HRB 644",
      "registerart": "HRB",
      "company_name": "OIZ Computer GmbH",
      "company_seat": "Plauen",
      "details": "03.11.2025 (Bekanntmachungsdatum)\n\nSachsen Amtsgericht Chemnitz HRB 644\nLöschungsankündigung 03.11.2025 (Eintragungsdatum)\n\nOIZ Computer GmbH\nGesellschaft mit beschränkter Haftung\nPlauen\n\nDas Registergericht beabsichtigt, die im Handelsregister eingetragene Gesellschaft von Amts wegen nach § 394 FamFG zu löschen. Die Frist zu Erhebung eines Widerspruchs gegen die beabsichtigte Löschung wird auf einen Monat festgesetzt."
    },
    {
      "date": "2025-11-03",
      "id": "136115",
      "original_text": "Registerbekanntmachung nach dem Umwandlungsgesetz\nSachsen Amtsgericht Chemnitz HRA 10232\nBauunternehmen Hammer e.K. – Chemnitz",
      "type": "Registerbekanntmachung nach dem Umwandlungsgesetz",
      "state": "Sachsen",
      "amtsgericht": "Amtsgericht Chemnitz",
      "registernummer": "HRA 10232",
      "registerart": "HRA",
      "company_name": "Bauunternehmen Hammer e.K.",
      "company_seat": "Chemnitz",
      "details": "03.11.2025 (Bekanntmachungsdatum)\n\nSachsen Amtsgericht Chemnitz HRA 10232\nRegisterbekanntmachung nach dem Umwandlungsgesetz 03.11.2025 (Eintragungsdatum)\n\nBauunternehmen Hammer e.K.\nEinzelkaufmann / Einzelkauffrau\nChemnitz\n\nDen Gläubigern der an der Ausgliederung beteiligten Rechtsträger ist, wenn sie binnen sechs Monaten nach dem Tag, an dem die Eintragung der Ausgliederung in das Register des Sitzes desjenigen Rechtsträgers, dessen Gläubiger sie sind, nach § 19 Abs. 3 UmwG als bekannt gemacht gilt, ihren Anspruch nach Grund und Höhe in Textform anmelden, Sicherheit zu leisten, soweit sie nicht Befriedigung verlangen können. Dieses Recht steht den Gläubigern jedoch nur zu, wenn sie glaubhaft machen, dass durch die Ausgliederung die Erfüllung der Forderung gefährdet wird."
    },
    {
      "date": "2025-11-03",
      "id": "136116",
      "original_text": "Registerbekanntmachung nach dem Umwandlungsgesetz\nSachsen Amtsgericht Chemnitz HRB 37821\nBauunternehmen Hammer GmbH – Chemnitz",
      "type": "Registerbekanntmachung nach dem Umwandlungsgesetz",
      "state": "Sachsen",
      "amtsgericht": "Amtsgericht Chemnitz",
      "registernummer": "HRB 37821",
      "registerart": "HRB",
      "company_name": "Bauunternehmen Hammer GmbH",
      "company_seat": "Chemnitz",
      "details": "03.11.2025 (Bekanntmachungsdatum)\n\nSachsen Amtsgericht Chemnitz HRB 37821\nRegisterbekanntmachung nach dem Umwandlungsgesetz 03.11.2025 (Eintragungsdatum)\n\nBauunternehmen Hammer GmbH\nGesellschaft mit beschränkter Haftung\nChemnitz"
    },
    {
      "date": "2025-11-03",
      "id": "136117",
      "original_text": "Registerbekanntmachung nach dem Umwandlungsgesetz\nSachsen Amtsgericht Chemnitz HRB 37821\nBauunternehmen Hammer GmbH – Chemnitz",
      "type": "Registerbekanntmachung nach dem Umwandlungsgesetz",
      "state": "Sachsen",
      "amtsgericht": "Amtsgericht Chemnitz",
      "registernummer": "HRB 37821",
      "registerart": "HRB",
      "company_name": "Bauunternehmen Hammer GmbH",
      "company_seat": "Chemnitz",
      "details": "03.11.2025 (Bekanntmachungsdatum)\n\nSachsen Amtsgericht Chemnitz HRB 37821\nRegisterbekanntmachung nach dem Umwandlungsgesetz 03.11.2025 (Eintragungsdatum)\n\nBauunternehmen Hammer GmbH\nGesellschaft mit beschränkter Haftung\nChemnitz\n\nDen Gläubigern der an der Ausgliederung beteiligten Rechtsträger ist, wenn sie binnen sechs Monaten nach dem Tag, an dem die Eintragung der Ausgliederung in das Register des Sitzes desjenigen Rechtsträgers, dessen Gläubiger sie sind, nach § 19 Abs. 3 UmwG als bekannt gemacht gilt, ihren Anspruch nach Grund und Höhe in Textform anmelden, Sicherheit zu leisten, soweit sie nicht Befriedigung verlangen können. Dieses Recht steht den Gläubigern jedoch nur zu, wenn sie glaubhaft machen, dass durch die Ausgliederung die Erfüllung der Forderung gefährdet wird."
    },
    {
      "date": "2025-11-03",
      "id": "136118",
      "original_text": "Registerbekanntmachung nach dem Umwandlungsgesetz\nNiedersachsen Amtsgericht Oldenburg (Oldenburg) HRB 213147\nhallo theo Delmenhorst GmbH – Delmenhorst",
      "type": "Registerbekanntmachung nach dem Umwandlungsgesetz",
      "state": "Niedersachsen",
      "amtsgericht": "Amtsgericht Oldenburg (Oldenburg)",
      "registernummer": "HRB 213147",
      "registerart": "HRB",
      "company_name": "hallo theo Delmenhorst GmbH",
      "company_seat": "Delmenhorst",
      "details": "03.11.2025 (Bekanntmachungsdatum)\n\nNiedersachsen Amtsgericht Oldenburg (Oldenburg) HRB 213147\nRegisterbekanntmachung nach dem Umwandlungsgesetz 03.11.2025 (Eintragungsdatum)\n\nhallo theo Delmenhorst GmbH\nGesellschaft mit beschränkter Haftung\nDelmenhorst\n\nDen Gläubigern der an der Verschmelzung beteiligten Rechtsträger ist, wenn sie binnen sechs Monaten nach dem Tag, an dem die Eintragung der Verschmelzung in das Register des Sitzes desjenigen Rechtsträgers, dessen Gläubiger sie sind, nach § 19  Abs.  3 UmwG als bekannt gemacht gilt, ihren Anspruch nach Grund und Höhe schriftlich anmelden, Sicherheit zu leisten, soweit sie nicht Befriedigung verlangen können. Dieses Recht steht den Gläubigern jedoch nur zu, wenn sie glaubhaft machen, dass durch die Verschmelzung die Erfüllung der Forderung gefährdet wird."
    },
    {
      "date": "2025-11-03",
      "id": "136119",
      "original_text": "Löschungsankündigung\nNiedersachsen Amtsgericht Osnabrück HRB 215793\nLunara Life GmbH – Werlte",
      "type": "Löschungsankündigung",
      "state": "Niedersachsen",
      "amtsgericht": "Amtsgericht Osnabrück",
      "registernummer": "HRB 215793",
      "registerart": "HRB",
      "company_name": "Lunara Life GmbH",
      "company_seat": "Werlte",
      "details": "03.11.2025 (Bekanntmachungsdatum)\n\nNiedersachsen Amtsgericht Osnabrück HRB 215793\nLöschungsankündigung\n\nLunara Life GmbH\nGesellschaft mit beschränkter Haftung\nWerlte\n\nDas Registergericht beabsichtigt, die Gesellschaft von Amts wegen nach § 394 FamFG wegen Vermögenslosigkeit zu löschen. Die Frist zur Erhebung eines Widerspruchs ist auf 1 Monat ab dieser Registerbekanntmachung festgesetzt."
    },
    {
      "date": "2025-11-03",
      "id": "136120",
      "original_text": "Löschungsankündigung\nNiedersachsen Amtsgericht Braunschweig HRB 209188\nMechanik Soft UG (haftungsbeschränkt) – Braunschweig",
      "type": "Löschungsankündigung",
      "state": "Niedersachsen",
      "amtsgericht": "Amtsgericht Braunschweig",
      "registernummer": "HRB 209188",
      "registerart": "HRB",
      "company_name": "Mechanik Soft UG (haftungsbeschränkt)",
      "company_seat": "Braunschweig",
      "details": "03.11.2025 (Bekanntmachungsdatum)\n\nNiedersachsen Amtsgericht Braunschweig HRB 209188\nLöschungsankündigung 03.11.2025 (Eintragungsdatum)\n\nMechanik Soft UG (haftungsbeschränkt)\nGesellschaft mit beschränkter Haftung\nBraunschweig\n\nDas Registergericht beabsichtigt, die Gesellschaft von Amts wegen nach § 394 FamFG zu löschen. Die Frist zur Erhebung eines Widerspruchs ist auf 1 Monat ab dieser Registerbekanntmachung festgesetzt."
    },
    {
      "date": "2025-11-03",
      "id": "136121",
      "original_text": "Löschungsankündigung\nNiedersachsen Amtsgericht Aurich HRB 206708\nWient GmbH – Friedeburg",
      "type": "Löschungsankündigung",
      "state": "Niedersachsen",
      "amtsgericht": "Amtsgericht Aurich",
      "registernummer": "HRB 206708",
      "registerart": "HRB",
      "company_name": "Wient GmbH",
      "company_seat": "Friedeburg",
      "details": "03.11.2025 (Bekanntmachungsdatum)\n\nNiedersachsen Amtsgericht Aurich HRB 206708\nLöschungsankündigung 03.11.2025 (Eintragungsdatum)\n\nWient GmbH\nGesellschaft mit beschränkter Haftung\nFriedeburg\n\nDas Registergericht beabsichtigt, die Gesellschaft von Amts wegen nach § 394 FamFG zu löschen. Die Frist zur Erhebung eines Widerspruchs ist auf 3 Monaten ab dieser Registerbekanntmachung festgesetzt."
    },
    {
      "date": "2025-11-03",
      "id": "136122",
      "original_text": "Registerbekanntmachung nach dem Umwandlungsgesetz\nNiedersachsen Amtsgericht Osnabrück HRB 210805\nAÜ-Impuls GmbH – Osnabrück",
      "type": "Registerbekanntmachung nach dem Umwandlungsgesetz",
      "state": "Niedersachsen",
      "amtsgericht": "Amtsgericht Osnabrück",
      "registernummer": "HRB 210805",
      "registerart": "HRB",
      "company_name": "AÜ-Impuls GmbH",
      "company_seat": "Osnabrück",
      "details": "03.11.2025 (Bekanntmachungsdatum)\n\nNiedersachsen Amtsgericht Osnabrück HRB 210805\nRegisterbekanntmachung nach dem Umwandlungsgesetz 03.11.2025 (Eintragungsdatum)\n\nAÜ-Impuls GmbH\nGesellschaft mit beschränkter Haftung\nOsnabrück\n\nDen Gläubigern der an der Verschmelzung beteiligten Rechtsträger ist, wenn sie binnen sechs Monaten nach dem Tag, an dem die Eintragung der Verschmelzung in das Register des Sitzes desjenigen Rechtsträgers, dessen Gläubiger sie sind, nach § 19  Abs.  3 UmwG als bekannt gemacht gilt, ihren Anspruch nach Grund und Höhe schriftlich anmelden, Sicherheit zu leisten, soweit sie nicht Befriedigung verlangen können. Dieses Recht steht den Gläubigern jedoch nur zu, wenn sie glaubhaft machen, dass durch die Verschmelzung die Erfüllung der Forderung gefährdet wird."
    },
    {
      "date": "2025-11-03",
      "id": "136123",
      "original_text": "Registerbekanntmachung nach dem Umwandlungsgesetz\nNiedersachsen Amtsgericht Osnabrück HRA 209372\nThorsten Schröder e.K. – Quakenbrück",
      "type": "Registerbekanntmachung nach dem Umwandlungsgesetz",
      "state": "Niedersachsen",
      "amtsgericht": "Amtsgericht Osnabrück",
      "registernummer": "HRA 209372",
      "registerart": "HRA",
      "company_name": "Thorsten Schröder e.K.",
      "company_seat": "Quakenbrück",
      "details": "03.11.2025 (Bekanntmachungsdatum)\n\nNiedersachsen Amtsgericht Osnabrück HRA 209372\nRegisterbekanntmachung nach dem Umwandlungsgesetz 03.11.2025 (Eintragungsdatum)\n\nThorsten Schröder e.K.\nEinzelkaufmann / Einzelkauffrau\nQuakenbrück\n\nDen Gläubigern der an der Ausgliederung beteiligten Rechtsträger ist, wenn sie binnen sechs Monaten nach dem Tag, an dem die Eintragung der Ausgliederung in das Register des Sitzes desjenigen Rechtsträgers, dessen Gläubiger sie sind, nach § 19 Abs. 3 UmwG als bekannt gemacht gilt, ihren Anspruch nach Grund und Höhe schriftlich anmelden, Sicherheit zu leisten, soweit sie nicht Befriedigung verlangen können. Dieses Recht steht den Gläubigern jedoch nur zu, wenn sie glaubhaft machen, dass durch die Ausgliederung die Erfüllung der Forderung gefährdet wird."
    },
    {
      "date": "2025-11-03",
      "id": "136124",
      "original_text": "Registerbekanntmachung nach dem Umwandlungsgesetz\nNiedersachsen Amtsgericht Hildesheim HRB 202124\nMEDIFOX DAN GmbH – Hildesheim",
      "type": "Registerbekanntmachung nach dem Umwandlungsgesetz",
      "state": "Niedersachsen",
      "amtsgericht": "Amtsgericht Hildesheim",
      "registernummer": "HRB 202124",
      "registerart": "HRB",
      "company_name": "MEDIFOX DAN GmbH",
      "company_seat": "Hildesheim",
      "details": "03.11.2025 (Bekanntmachungsdatum)\n\nNiedersachsen Amtsgericht Hildesheim HRB 202124\nRegisterbekanntmachung nach dem Umwandlungsgesetz 03.11.2025 (Eintragungsdatum)\n\nMEDIFOX DAN GmbH\nGesellschaft mit beschränkter Haftung\nHildesheim\n\nDen Gläubigern der an der Verschmelzung beteiligten Rechtsträger ist, wenn sie binnen sechs Monaten nach dem Tag, an dem die Eintragung der Verschmelzung in das Register des Sitzes desjenigen Rechtsträgers, dessen Gläubiger sie sind, nach § 19  Abs.  3 UmwG als bekannt gemacht gilt, ihren Anspruch nach Grund und Höhe schriftlich anmelden, Sicherheit zu leisten, soweit sie nicht Befriedigung verlangen können. Dieses Recht steht den Gläubigern jedoch nur zu, wenn sie glaubhaft machen, dass durch die Verschmelzung die Erfüllung der Forderung gefährdet wird."
    },
    {
      "date": "2025-11-03",
      "id": "136125",
      "original_text": "Löschungsankündigung\nNiedersachsen Amtsgericht Hannover HRB 220567\nMIRO PROJEKT GmbH – Hemmingen",
      "type": "Löschungsankündigung",
      "state": "Niedersachsen",
      "amtsgericht": "Amtsgericht Hannover",
      "registernummer": "HRB 220567",
      "registerart": "HRB",
      "company_name": "MIRO PROJEKT GmbH",
      "company_seat": "Hemmingen",
      "details": "03.11.2025 (Bekanntmachungsdatum)\n\nNiedersachsen Amtsgericht Hannover HRB 220567\nLöschungsankündigung\n\nMIRO PROJEKT GmbH\nGesellschaft mit beschränkter Haftung\nHemmingen\n\nDas Registergericht beabsichtigt, die Gesellschaft von Amts wegen nach § 394 FamFG zu löschen. Die Frist zur Erhebung eines Widerspruchs ist auf 1 Monat ab dieser Registerbekanntmachung festgesetzt."
    },
    {
      "date": "2025-11-03",
      "id": "136126",
      "original_text": "Löschungsankündigung\nNiedersachsen Amtsgericht Göttingen HRB 206114\nCurexsys GmbH – Göttingen",
      "type": "Löschungsankündigung",
      "state": "Niedersachsen",
      "amtsgericht": "Amtsgericht Göttingen",
      "registernummer": "HRB 206114",
      "registerart": "HRB",
      "company_name": "Curexsys GmbH",
      "company_seat": "Göttingen",
      "details": "03.11.2025 (Bekanntmachungsdatum)\n\nNiedersachsen Amtsgericht Göttingen HRB 206114\nLöschungsankündigung\n\nCurexsys GmbH\nGesellschaft mit beschränkter Haftung\nGöttingen\n\nDas Registergericht beabsichtigt, die Gesellschaft von Amts wegen nach § 394 FamFG zu löschen. Die Frist zur Erhebung eines Widerspruchs ist auf 1 Monat ab dieser Registerbekanntmachung festgesetzt."
    },
    {
      "date": "2025-11-03",
      "id": "136127",
      "original_text": "Registerbekanntmachung nach dem Umwandlungsgesetz\nNiedersachsen Amtsgericht Oldenburg (Oldenburg) HRB 217726\nhallo theo Wildeshausen GmbH – Wildeshausen",
      "type": "Registerbekanntmachung nach dem Umwandlungsgesetz",
      "state": "Niedersachsen",
      "amtsgericht": "Amtsgericht Oldenburg (Oldenburg)",
      "registernummer": "HRB 217726",
      "registerart": "HRB",
      "company_name": "hallo theo Wildeshausen GmbH",
      "company_seat": "Wildeshausen",
      "details": "03.11.2025 (Bekanntmachungsdatum)\n\nNiedersachsen Amtsgericht Oldenburg (Oldenburg) HRB 217726\nRegisterbekanntmachung nach dem Umwandlungsgesetz 03.11.2025 (Eintragungsdatum)\n\nhallo theo Wildeshausen GmbH\nGesellschaft mit beschränkter Haftung\nWildeshausen\n\nDen Gläubigern der an der Verschmelzung beteiligten Rechtsträger ist, wenn sie binnen sechs Monaten nach dem Tag, an dem die Eintragung der Verschmelzung in das Register des Sitzes desjenigen Rechtsträgers, dessen Gläubiger sie sind, nach § 19  Abs.  3 UmwG als bekannt gemacht gilt, ihren Anspruch nach Grund und Höhe schriftlich anmelden, Sicherheit zu leisten, soweit sie nicht Befriedigung verlangen können. Dieses Recht steht den Gläubigern jedoch nur zu, wenn sie glaubhaft machen, dass durch die Verschmelzung die Erfüllung der Forderung gefährdet wird."
    },
    {
      "date": "2025-11-03",
      "id": "136128",
      "original_text": "Löschungsankündigung\nBremen Amtsgericht Bremen HRB 37148\nPajer Bau GmbH – Bremen",
      "type": "Löschungsankündigung",
      "state": "Bremen",
      "amtsgericht": "Amtsgericht Bremen",
      "registernummer": "HRB 37148",
      "registerart": "HRB",
      "company_name": "Pajer Bau GmbH",
      "company_seat": "Bremen",
      "details": "03.11.2025 (Bekanntmachungsdatum)\n\nBremen Amtsgericht Bremen HRB 37148\nLöschungsankündigung\n\nPajer Bau GmbH\nGesellschaft mit beschränkter Haftung\nBremen\n\nEs ist beabsichtigt die im Handelsregister eingetragene Gesellschaft von Amts wegen gemäß § 394 FamFG zu löschen. Gegen die Löschung kann beim AG Bremen schriftlich oder zu Protokoll der Geschäftsstelle Widerspruch eingelegt werden. Widerspruchsfrist 4 Wochen."
    },
    {
      "date": "2025-11-03",
      "id": "136129",
      "original_text": "Löschungsankündigung\nBremen Amtsgericht Bremen HRB 28321\nCCD Eventcenter Cagla-Cansu-Dalga GmbH – Bremen",
      "type": "Löschungsankündigung",
      "state": "Bremen",
      "amtsgericht": "Amtsgericht Bremen",
      "registernummer": "HRB 28321",
      "registerart": "HRB",
      "company_name": "CCD Eventcenter Cagla-Cansu-Dalga GmbH",
      "company_seat": "Bremen",
      "details": "03.11.2025 (Bekanntmachungsdatum)\n\nBremen Amtsgericht Bremen HRB 28321\nLöschungsankündigung\n\nCCD Eventcenter Cagla-Cansu-Dalga GmbH\nGesellschaft mit beschränkter Haftung\nBremen\n\nEs ist beabsichtigt die im Handelsregister eingetragene Gesellschaft von Amts wegen gemäß § 394 FamFG zu löschen. Gegen die Löschung kann beim AG Bremen schriftlich oder zu Protokoll der Geschäftsstelle Widerspruch eingelegt werden. Widerspruchsfrist 4 Wochen."
    },
    {
      "date": "2025-11-03",
      "id": "136130",
      "original_text": "Löschungsankündigung\nBremen Amtsgericht Bremen HRB 34227\nMeyer Beteiligungs UG (haftungsbeschränkt) – Bremen",
      "type": "Löschungsankündigung",
      "state": "Bremen",
      "amtsgericht": "Amtsgericht Bremen",
      "registernummer": "HRB 34227",
      "registerart": "HRB",
      "company_name": "Meyer Beteiligungs UG (haftungsbeschränkt)",
      "company_seat": "Bremen",
      "details": "03.11.2025 (Bekanntmachungsdatum)\n\nBremen Amtsgericht Bremen HRB 34227\nLöschungsankündigung\n\nMeyer Beteiligungs UG (haftungsbeschränkt)\nGesellschaft mit beschränkter Haftung\nBremen\n\nEs ist beabsichtigt die im Handelsregister eingetragene Gesellschaft von Amts wegen gemäß § 394 FamFG zu löschen. Gegen die Löschung kann beim AG Bremen schriftlich oder zu Protokoll der Geschäftsstelle Widerspruch eingelegt werden. Widerspruchsfrist 4 Wochen."
    },
    {
      "date": "2025-11-03",
      "id": "136131",
      "original_text": "Einreichung neuer Dokumente\nBremen Amtsgericht Bremen HRB 28078\nBremer Werkgemeinschaft GmbH – Bremen",
      "type": "Einreichung neuer Dokumente",
      "state": "Bremen",
      "amtsgericht": "Amtsgericht Bremen",
      "registernummer": "HRB 28078",
      "registerart": "HRB",
      "company_name": "Bremer Werkgemeinschaft GmbH",
      "company_seat": "Bremen",
      "details": "03.11.2025 (Bekanntmachungsdatum)\n\nBremen Amtsgericht Bremen HRB 28078\nEinreichung neuer Dokumente\n\nBremer Werkgemeinschaft GmbH\nGesellschaft mit beschränkter Haftung\nBremen\n\nAls nicht eingetragen wird bekannt gemacht: Liste des Aufsichtsrats wurde eingereicht."
    },
    {
      "date": "2025-11-03",
      "id": "136132",
      "original_text": "Einreichung neuer Dokumente\nBremen Amtsgericht Bremen HRB 37613\nKAEFER Management SE – Bremen",
      "type": "Einreichung neuer Dokumente",
      "state": "Bremen",
      "amtsgericht": "Amtsgericht Bremen",
      "registernummer": "HRB 37613",
      "registerart": "HRB",
      "company_name": "KAEFER Management SE",
      "company_seat": "Bremen",
      "details": "03.11.2025 (Bekanntmachungsdatum)\n\nBremen Amtsgericht Bremen HRB 37613\nEinreichung neuer Dokumente\n\nKAEFER Management SE\nEuropäische Aktiengesellschaft (SE)\nBremen\n\nAls nicht eingetragen wird bekannt gemacht: Liste des Verwaltungsrats wurde eingereicht."
    },
    {
      "date": "2025-11-03",
      "id": "136133",
      "original_text": "Sonstige Registerbekanntmachung\nRheinland-Pfalz Amtsgericht Landau HRB 33703\nBestattungsinstitut Gehrlein GmbH – Lingenfeld",
      "type": "Sonstige Registerbekanntmachung",
      "state": "Rheinland-Pfalz",
      "amtsgericht": "Amtsgericht Landau",
      "registernummer": "HRB 33703",
      "registerart": "HRB",
      "company_name": "Bestattungsinstitut Gehrlein GmbH",
      "company_seat": "Lingenfeld",
      "details": "03.11.2025 (Bekanntmachungsdatum)\n\nRheinland-Pfalz Amtsgericht Landau HRB 33703\nSonstige Registerbekanntmachung 03.11.2025 (Eintragungsdatum)\n\nBestattungsinstitut Gehrlein GmbH\nGesellschaft mit beschränkter Haftung\nLingenfeld\n\nAls nicht eingetragen wird veröffentlicht: Den Gläubigern der Gesellschaft, deren Forderungen begründet worden sind, bevor die Eintragung der Beendigung des Gewinnabführungsvertrages in das Handelsregister nach § 10 des Handelsgesetzbuches als bekanntgemacht gilt, hat der andere Vertragsteil Sicherheit zu leisten, wenn sie sich binnen sechs Monaten nach der Bekanntmachung der Eintragung zu diesem Zweck bei ihm melden."
    },
    {
      "date": "2025-11-03",
      "id": "136134",
      "original_text": "Löschungsankündigung\nRheinland-Pfalz Amtsgericht Zweibrücken HRB 32195\nRoss Auto-Reifen-Service UG (haftungsbeschränkt) – Pirmasens",
      "type": "Löschungsankündigung",
      "state": "Rheinland-Pfalz",
      "amtsgericht": "Amtsgericht Zweibrücken",
      "registernummer": "HRB 32195",
      "registerart": "HRB",
      "company_name": "Ross Auto-Reifen-Service UG (haftungsbeschränkt)",
      "company_seat": "Pirmasens",
      "details": "03.11.2025 (Bekanntmachungsdatum)\n\nRheinland-Pfalz Amtsgericht Zweibrücken HRB 32195\nLöschungsankündigung\n\nRoss Auto-Reifen-Service UG (haftungsbeschränkt)\nGesellschaft mit beschränkter Haftung\nPirmasens\n\nDas Registergericht beabsichtigt die Gesellschaft von Amts wegen nach § 394 FamFG zu löschen. Die Frist zur Erhebung eines Widerspruchs ist auf einen Monat festgesetzt."
    },
    {
      "date": "2025-11-03",
      "id": "136135",
      "original_text": "Registerbekanntmachung nach dem Umwandlungsgesetz\nRheinland-Pfalz Amtsgericht Koblenz HRA 20798\nDr. Gottschalk Nahrungsmittel GmbH & Co Kommanditgesellschaft – Mendig",
      "type": "Registerbekanntmachung nach dem Umwandlungsgesetz",
      "state": "Rheinland-Pfalz",
      "amtsgericht": "Amtsgericht Koblenz",
      "registernummer": "HRA 20798",
      "registerart": "HRA",
      "company_name": "Dr. Gottschalk Nahrungsmittel GmbH & Co Kommanditgesellschaft",
      "company_seat": "Mendig",
      "details": "03.11.2025 (Bekanntmachungsdatum)\n\nRheinland-Pfalz Amtsgericht Koblenz HRA 20798\nRegisterbekanntmachung nach dem Umwandlungsgesetz 03.11.2025 (Eintragungsdatum)\n\nDr. Gottschalk Nahrungsmittel GmbH & Co Kommanditgesellschaft\nKommanditgesellschaft\nMendig\n\nAls nicht eingetragen wird veröffentlicht:\nDen Gläubigern des formwechselnden Rechtsträgers ist, wenn sie binnen sechs Monaten nach dem Tag, an dem die Eintragung des Formwechsels nach § 201 UmwG als bekannt gemacht gilt, ihren Anspruch nach Grund und Höhe schriftlich anmelden, Sicherheit zu leisten, soweit sie nicht Befriedigung verlangen können. Dieses Recht steht den Gläubigern jedoch nur zu, wenn sie glaubhaft machen, dass durch den Formwechsel die Erfüllung der Forderung gefährdet wird."
    },
    {
      "date": "2025-11-03",
      "id": "136136",
      "original_text": "Löschungsankündigung\nRheinland-Pfalz Amtsgericht Landau HRB 33616\nPlanet Staff UG (haftungsbeschränkt) – Rülzheim",
      "type": "Löschungsankündigung",
      "state": "Rheinland-Pfalz",
      "amtsgericht": "Amtsgericht Landau",
      "registernummer": "HRB 33616",
      "registerart": "HRB",
      "company_name": "Planet Staff UG (haftungsbeschränkt)",
      "company_seat": "Rülzheim",
      "details": "03.11.2025 (Bekanntmachungsdatum)\n\nRheinland-Pfalz Amtsgericht Landau HRB 33616\nLöschungsankündigung\n\nPlanet Staff UG (haftungsbeschränkt)\nGesellschaft mit beschränkter Haftung\nRülzheim\n\nDas Registergericht beabsichtigt die Gesellschaft von Amts wegen nach § 394 FamFG zu löschen. Die Frist zur Erhebung eines Widerspruchs ist auf einen Monat festgesetzt."
    },
    {
      "date": "2025-11-03",
      "id": "136137",
      "original_text": "Löschungsankündigung\nRheinland-Pfalz Amtsgericht Koblenz HRB 11098\nG. Heuser-Bau-Gesellschaft mit beschränkter Haftung – Kempenich",
      "type": "Löschungsankündigung",
      "state": "Rheinland-Pfalz",
      "amtsgericht": "Amtsgericht Koblenz",
      "registernummer": "HRB 11098",
      "registerart": "HRB",
      "company_name": "G. Heuser-Bau-Gesellschaft mit beschränkter Haftung",
      "company_seat": "Kempenich",
      "details": "03.11.2025 (Bekanntmachungsdatum)\n\nRheinland-Pfalz Amtsgericht Koblenz HRB 11098\nLöschungsankündigung 03.11.2025 (Eintragungsdatum)\n\nG. Heuser-Bau-Gesellschaft mit beschränkter Haftung\nGesellschaft mit beschränkter Haftung\nKempenich\n\nDas Registergericht beabsichtigt die Gesellschaft von Amts wegen nach § 394 FamFG zu löschen. Die Frist zur Erhebung eines Widerspruchs ist auf zwei Monate festgesetzt."
    },
    {
      "date": "2025-11-03",
      "id": "136138",
      "original_text": "Einreichung neuer Dokumente\nRheinland-Pfalz Amtsgericht Mainz HRB 53362\neCharge Budenheim GmbH – Budenheim",
      "type": "Einreichung neuer Dokumente",
      "state": "Rheinland-Pfalz",
      "amtsgericht": "Amtsgericht Mainz",
      "registernummer": "HRB 53362",
      "registerart": "HRB",
      "company_name": "eCharge Budenheim GmbH",
      "company_seat": "Budenheim",
      "details": "03.11.2025 (Bekanntmachungsdatum)\n\nRheinland-Pfalz Amtsgericht Mainz HRB 53362\nEinreichung neuer Dokumente\n\neCharge Budenheim GmbH\nGesellschaft mit beschränkter Haftung\nBudenheim"
    },
    {
      "date": "2025-11-03",
      "id": "136139",
      "original_text": "Registerbekanntmachung nach dem Umwandlungsgesetz\nNordrhein-Westfalen Amtsgericht Köln HRB 26018\nSAVANNA Ingredients GmbH – Elsdorf",
      "type": "Registerbekanntmachung nach dem Umwandlungsgesetz",
      "state": "Nordrhein-Westfalen",
      "amtsgericht": "Amtsgericht Köln",
      "registernummer": "HRB 26018",
      "registerart": "HRB",
      "company_name": "SAVANNA Ingredients GmbH",
      "company_seat": "Elsdorf",
      "details": "03.11.2025 (Bekanntmachungsdatum)\n\nNordrhein-Westfalen Amtsgericht Köln HRB 26018\nRegisterbekanntmachung nach dem Umwandlungsgesetz 03.11.2025 (Eintragungsdatum)\n\nSAVANNA Ingredients GmbH\nGesellschaft mit beschränkter Haftung\nElsdorf\n\nDen Gläubigern der an der formwechselnden Umwandlung beteiligten Rechtsträger ist, wenn sie binnen sechs Monaten nach dem Tag, an dem die Eintragung der formwechselnden Umwandlung in das Register des Sitzes desjenigen Rechtsträgers, dessen Gläubiger sie sind, nach § 19 Absatz 3 UmwG als bekanntgemacht gilt, ihren Anspruch nach Grund und Höhe schriftlich anmelden, Sicherheit zu leisten, soweit sie nicht Befriedigung verlangen können. Dieses Recht steht den Gläubigern jedoch nur zu, wenn sie glaubhaft machen, dass durch die formwechselnden Umwandlung die Erfüllung ihrer Forderung gefährdet wird."
    },
    {
      "date": "2025-11-03",
      "id": "136140",
      "original_text": "Registerbekanntmachung nach dem Umwandlungsgesetz\nNordrhein-Westfalen Amtsgericht Duisburg HRB 39220\nPUR-Ambulant Pflegedienst GmbH – Duisburg",
      "type": "Registerbekanntmachung nach dem Umwandlungsgesetz",
      "state": "Nordrhein-Westfalen",
      "amtsgericht": "Amtsgericht Duisburg",
      "registernummer": "HRB 39220",
      "registerart": "HRB",
      "company_name": "PUR-Ambulant Pflegedienst GmbH",
      "company_seat": "Duisburg",
      "details": "03.11.2025 (Bekanntmachungsdatum)\n\nNordrhein-Westfalen Amtsgericht Duisburg HRB 39220\nRegisterbekanntmachung nach dem Umwandlungsgesetz 03.11.2025 (Eintragungsdatum)\n\nPUR-Ambulant Pflegedienst GmbH\nGesellschaft mit beschränkter Haftung\nDuisburg\n\nDie Gesellschaft hat Gläubigern, deren Forderungen vor dieser Bekanntmachung begründet worden sind, Sicherheit zu leisten, soweit sie nicht Befriedigung verlangen können, wenn sie sich binnen sechs Monaten zu diesem Zweck melden."
    },
    {
      "date": "2025-11-03",
      "id": "136141",
      "original_text": "Löschungsankündigung\nNordrhein-Westfalen Amtsgericht Düsseldorf HRB 54694\nAICON Health & Fitness GmbH – Düsseldorf",
      "type": "Löschungsankündigung",
      "state": "Nordrhein-Westfalen",
      "amtsgericht": "Amtsgericht Düsseldorf",
      "registernummer": "HRB 54694",
      "registerart": "HRB",
      "company_name": "AICON Health & Fitness GmbH",
      "company_seat": "Düsseldorf",
      "details": "03.11.2025 (Bekanntmachungsdatum)\n\nNordrhein-Westfalen Amtsgericht Düsseldorf HRB 54694\nLöschungsankündigung\n\nAICON Health & Fitness GmbH\nGesellschaft mit beschränkter Haftung\nDüsseldorf\n\nDas Registergericht beabsichtigt die Gesellschaft von Amts wegen nach § 394 FamFG zu löschen. Die Frist zur Erhebung eines Widerspruchs ist auf 3 Wochen festgesetzt.\n\nRechtsbehelfsbelehrung:\nDas Widerspruchsrecht steht jedem zu, der an der Unterlassung der Löschung ein berechtigtes Interesse hat. Der Widerspruch ist bei dem Amtsgericht Düsseldorf -Registergericht-, Werdener Straße 1, 40227 Düsseldorf schriftlich in deutscher Sprache oder zur Niederschrift der Geschäftsstelle einzulegen. Der Widerspruch kann auch zur Niederschrift der Geschäftsstelle eines jeden Amtsgerichtes abgegeben werden. Die Einlegung ist auch durch Übertragung eines elektronischen Dokuments an die elektronische Poststelle des Gerichts möglich. Das elektronische Dokument muss für die Bearbeitung durch das Gericht geeignet und mit einer qualifizierten elektronischen Signatur der verantwortenden Person versehen sein oder von der verantwortenden Person signiert und auf einem sicheren Übermittlungsweg gemäß § 130a ZPO nach näherer Maßgabe der Verordnung über die technischen Rahmenbedingungen des elektronischen Rechtsverkehrs und über das besondere elektronische Behördenpostfach (BGBl. I, S.3803) eingereicht werden. Weitere Informationen erhalten Sie auf der Internetseite www.justiz.de.\nDer Widerspruch muss spätestens innerhalb der gesetzten Frist nach dem Datum der Bekanntmachung der Löschungsankündigung bei dem Amtsgericht - Registergericht - Düsseldorf eingegangen sein.  Dies gilt auch dann, wenn der Widerspruch zur Niederschrift der Geschäftsstelle eines anderen Amtsgerichtes abgegeben wurde. Die Frist beginnt mit dem Tage der Bekanntmachung der Löschungsankündigung in dem für die Bekanntmachung der Eintragungen in das Handelsregister bestimmten elektronischen Informations- und Kommunikationssystem nach § 10 des Handelsgesetzbuches. Fällt das Ende der Frist auf einen Sonntag, einen allgemeinen Feiertag oder Sonnabend, so endet die Frist mit Ablauf des nächsten Werktages.\nDer Widerspruch muss die Bezeichnung der angefochtenen Löschungsankündigung sowie die Erklärung enthalten, dass Widerspruch gegen diese Löschungsankündigung eingelegt wird. Er ist zu unterzeichnen und soll begründet werden."
    },
    {
      "date": "2025-11-03",
      "id": "136142",
      "original_text": "Löschungsankündigung\nNordrhein-Westfalen Amtsgericht Duisburg HRA 13140\nAsisi Sicherheitssysteme e.K. – Oberhausen",
      "type": "Löschungsankündigung",
      "state": "Nordrhein-Westfalen",
      "amtsgericht": "Amtsgericht Duisburg",
      "registernummer": "HRA 13140",
      "registerart": "HRA",
      "company_name": "Asisi Sicherheitssysteme e.K.",
      "company_seat": "Oberhausen",
      "details": "03.11.2025 (Bekanntmachungsdatum)\n\nNordrhein-Westfalen Amtsgericht Duisburg HRA 13140\nLöschungsankündigung\n\nAsisi Sicherheitssysteme e.K.\nEinzelkaufmann / Einzelkauffrau\nOberhausen\n\nHR A 13140\nAsisi Sicherheitssysteme e.K.,\nOberhausen,\nDuisburger Straße 81-87,\n46049 Oberhausen.\nDas Registergericht beabsichtigt, die im Handelsregister eingetragene Gesellschaft gemäß §§ 31 Abs. 2 HGB, 393 FamFG von Amts wegen zu löschen. Gegen diese Verfügung kann Widerspruch eingelegt werden. Die Frist zur Erhebung eines Widerspruchs gegen die beabsichtigte Löschung von Amts wegen ist auf drei Monate festgesetzt. Rechtsbehelfsbelehrung Der Widerspruch ist bei dem Amtsgericht Duisburg, Kardinal-Galen-Str. 124-132, 47058 Duisburg schriftlich in deutscher Sprache oder zur Niederschrift der Geschäftsstelle einzulegen. Der Widerspruch kann auch zur Niederschrift der Geschäftsstelle eines jeden Amtsgerichtes abgegeben werden. Die Einlegung ist auch durch Übertragung eines elektronischen Dokuments an die elektronische Poststelle des Gerichts möglich. Das elektronische Dokument muss für die Bearbeitung durch das Gericht geeignet und mit einer qualifizierten elektronischen Signatur der verantwortenden Person versehen sein oder von der verantwortenden Person signiert und auf einem sicheren Übermittlungsweg gemäß § 130 a ZPO nach näherer Maßgabe der Verordnung über die technischen Rahmenbedingungen des elektronischen Rechtsverkehrs und über das besondere elektronische Behördenpostfach (BGBl. I, S. 3803) eingereicht werden. Weitere Informationen erhalten Sie auf der Internetseite www.justiz.de <http://www.justiz.de>. Der Widerspruch muss spätestens innerhalb der gesetzten Frist bei dem Amtsgericht Duisburg eingegangen sein. Dies gilt auch dann, wenn der Widerspruch zur Niederschrift der Geschäftsstelle eines anderen Amtsgerichtes abgegeben wurde. Die Frist beginnt mit der Veröffentlichung. Fällt das Ende der Frist auf einen Sonntag, einen allgemeinen Feiertag oder Sonnabend, so endet die Frist mit Ablauf des nächsten Werktages. Der Widerspruch muss die Bezeichnung der angefochtenen Verfügung sowie die Erklärung enthalten, dass Widerspruch gegen diese Verfügung eingelegt wird. Er ist zu unterzeichnen und soll begründet werden."
    },
    {
      "date": "2025-11-03",
      "id": "136143",
      "original_text": "Registerbekanntmachung nach dem Umwandlungsgesetz\nNordrhein-Westfalen Amtsgericht Bonn HRB 18222\nTrauerkultur BRS GmbH – Bonn",
      "type": "Registerbekanntmachung nach dem Umwandlungsgesetz",
      "state": "Nordrhein-Westfalen",
      "amtsgericht": "Amtsgericht Bonn",
      "registernummer": "HRB 18222",
      "registerart": "HRB",
      "company_name": "Trauerkultur BRS GmbH",
      "company_seat": "Bonn",
      "details": "03.11.2025 (Bekanntmachungsdatum)\n\nNordrhein-Westfalen Amtsgericht Bonn HRB 18222\nRegisterbekanntmachung nach dem Umwandlungsgesetz 03.11.2025 (Eintragungsdatum)\n\nTrauerkultur BRS GmbH\nGesellschaft mit beschränkter Haftung\nBonn\n\nDen Gläubigern der an der Verschmelzung beteiligten Rechtsträger ist, wenn sie binnen sechs Monaten nach dem Tag, an dem die Eintragung der Verschmelzung in das Register des Sitzes desjenigen Rechtsträgers, dessen Gläubiger sie sind, nach § 19 Absatz 3 UmwG als bekanntgemacht gilt, ihren Anspruch nach Grund und Höhe schriftlich anmelden, Sicherheit zu leisten, soweit sie nicht Befriedigung verlangen können. Dieses Recht steht den Gläubigern jedoch nur zu, wenn sie glaubhaft machen, dass durch die Verschmelzung die Erfüllung ihrer Forderung gefährdet wird."
    },
    {
      "date": "2025-11-03",
      "id": "136144",
      "original_text": "Löschungsankündigung\nNordrhein-Westfalen Amtsgericht Bad Oeynhausen HRA 9375\nMDS Vlotho GmbH & Co. KG – Vlotho",
      "type": "Löschungsankündigung",
      "state": "Nordrhein-Westfalen",
      "amtsgericht": "Amtsgericht Bad Oeynhausen",
      "registernummer": "HRA 9375",
      "registerart": "HRA",
      "company_name": "MDS Vlotho GmbH & Co. KG",
      "company_seat": "Vlotho",
      "details": "03.11.2025 (Bekanntmachungsdatum)\n\nNordrhein-Westfalen Amtsgericht Bad Oeynhausen HRA 9375\nLöschungsankündigung\n\nMDS Vlotho GmbH & Co. KG\nKommanditgesellschaft\nVlotho\n\nDas Registergericht beabsichtigt die Firma von Amts wegen nach §§ 31, 6 HGB, § 393 FamFG zu löschen. Die Frist zur Erhebung eines Widerspruchs ist auf einen Monat festgesetzt."
    },
    {
      "date": "2025-11-03",
      "id": "136145",
      "original_text": "Einreichung neuer Dokumente\nNordrhein-Westfalen Amtsgericht Düsseldorf HRB 3466\nStadtwerke Düsseldorf AG – Düsseldorf",
      "type": "Einreichung neuer Dokumente",
      "state": "Nordrhein-Westfalen",
      "amtsgericht": "Amtsgericht Düsseldorf",
      "registernummer": "HRB 3466",
      "registerart": "HRB",
      "company_name": "Stadtwerke Düsseldorf AG",
      "company_seat": "Düsseldorf",
      "details": "03.11.2025 (Bekanntmachungsdatum)\n\nNordrhein-Westfalen Amtsgericht Düsseldorf HRB 3466\nEinreichung neuer Dokumente 16.10.2025 (Eintragungsdatum)\n\nStadtwerke Düsseldorf AG\nAktiengesellschaft\nDüsseldorf\n\nDem Registergericht ist eine Liste der Mitglieder des Aufsichtsrates eingereicht worden."
    },
    {
      "date": "2025-11-03",
      "id": "136146",
      "original_text": "Registerbekanntmachung nach dem Umwandlungsgesetz\nNordrhein-Westfalen Amtsgericht Bielefeld HRB 41745\nMplus Bielefeld GmbH – Bielefeld",
      "type": "Registerbekanntmachung nach dem Umwandlungsgesetz",
      "state": "Nordrhein-Westfalen",
      "amtsgericht": "Amtsgericht Bielefeld",
      "registernummer": "HRB 41745",
      "registerart": "HRB",
      "company_name": "Mplus Bielefeld GmbH",
      "company_seat": "Bielefeld",
      "details": "03.11.2025 (Bekanntmachungsdatum)\n\nNordrhein-Westfalen Amtsgericht Bielefeld HRB 41745\nRegisterbekanntmachung nach dem Umwandlungsgesetz 03.11.2025 (Eintragungsdatum)\n\nMplus Bielefeld GmbH\nGesellschaft mit beschränkter Haftung\nBielefeld\n\nDen Gläubigern der an der Verschmelzung beteiligten Rechtsträger ist, wenn sie binnen sechs Monaten nach dem Tag, an dem die Eintragung der Verschmelzung in das Register des Sitzes derjenigen Rechtsträger, deren Gläubiger sie sind, nach § 19 Absatz 3 UmwG als bekanntgemacht gilt, ihren Anspruch nach Grund und Höhe schriftlich anmelden, Sicherheit zu leisten, soweit sie nicht Befriedigung verlangen können. Dieses Recht steht den Gläubigern jedoch nur zu, wenn sie glaubhaft machen, dass durch die Verschmelzung die Erfüllung ihrer Forderung gefährdet wird."
    },
    {
      "date": "2025-11-03",
      "id": "136147",
      "original_text": "Registerbekanntmachung nach dem Umwandlungsgesetz\nNordrhein-Westfalen Amtsgericht Münster HRA 4966\nGrundstücksgesellschaft Müller-Miny KG – Münster",
      "type": "Registerbekanntmachung nach dem Umwandlungsgesetz",
      "state": "Nordrhein-Westfalen",
      "amtsgericht": "Amtsgericht Münster",
      "registernummer": "HRA 4966",
      "registerart": "HRA",
      "company_name": "Grundstücksgesellschaft Müller-Miny KG",
      "company_seat": "Münster",
      "details": "03.11.2025 (Bekanntmachungsdatum)\n\nNordrhein-Westfalen Amtsgericht Münster HRA 4966\nRegisterbekanntmachung nach dem Umwandlungsgesetz 03.11.2025 (Eintragungsdatum)\n\nGrundstücksgesellschaft Müller-Miny KG\nKommanditgesellschaft\nMünster\n\nDen Gläubigern der an der formwechselnden Umwandlung beteiligten Rechtsträger ist, wenn sie binnen sechs Monaten nach dem Tag, an dem die Eintragung der formwechselnden Umwandlung in das Register des Sitzes derjenigen Rechtsträger deren Gläubiger sie sind, nach § 19 Absatz 3 UmwG als bekanntgemacht gilt, ihren Anspruch nach Grund und Höhe schriftlich anmelden, Sicherheit zu leisten, soweit sie nicht Befriedigung verlangen können. Dieses Recht steht den Gläubigern jedoch nur zu, wenn sie glaubhaft machen, dass durch die formwechselnden Umwandlung die Erfüllung ihrer Forderung gefährdet wird."
    },
    {
      "date": "2025-11-03",
      "id": "136148",
      "original_text": "Löschungsankündigung\nNordrhein-Westfalen Amtsgericht Düsseldorf HRB 64809\nBZ Consulting GmbH – Düsseldorf",
      "type": "Löschungsankündigung",
      "state": "Nordrhein-Westfalen",
      "amtsgericht": "Amtsgericht Düsseldorf",
      "registernummer": "HRB 64809",
      "registerart": "HRB",
      "company_name": "BZ Consulting GmbH",
      "company_seat": "Düsseldorf",
      "details": "03.11.2025 (Bekanntmachungsdatum)\n\nNordrhein-Westfalen Amtsgericht Düsseldorf HRB 64809\nLöschungsankündigung\n\nBZ Consulting GmbH\nGesellschaft mit beschränkter Haftung\nDüsseldorf\n\nDas Registergericht beabsichtigt die Gesellschaft von Amts wegen nach § 394 FamFG zu löschen. Die Frist zur Erhebung eines Widerspruchs ist auf 3 Wochen festgesetzt.\n\nRechtsbehelfsbelehrung:\nDas Widerspruchsrecht steht jedem zu, der an der Unterlassung der Löschung ein berechtigtes Interesse hat. Der Widerspruch ist bei dem Amtsgericht Düsseldorf -Registergericht-, Werdener Straße 1, 40227 Düsseldorf schriftlich in deutscher Sprache oder zur Niederschrift der Geschäftsstelle einzulegen. Der Widerspruch kann auch zur Niederschrift der Geschäftsstelle eines jeden Amtsgerichtes abgegeben werden. Die Einlegung ist auch durch Übertragung eines elektronischen Dokuments an die elektronische Poststelle des Gerichts möglich. Das elektronische Dokument muss für die Bearbeitung durch das Gericht geeignet und mit einer qualifizierten elektronischen Signatur der verantwortenden Person versehen sein oder von der verantwortenden Person signiert und auf einem sicheren Übermittlungsweg gemäß § 130a ZPO nach näherer Maßgabe der Verordnung über die technischen Rahmenbedingungen des elektronischen Rechtsverkehrs und über das besondere elektronische Behördenpostfach (BGBl. I, S.3803) eingereicht werden. Weitere Informationen erhalten Sie auf der Internetseite www.justiz.de.\nDer Widerspruch muss spätestens innerhalb der gesetzten Frist nach dem Datum der Bekanntmachung der Löschungsankündigung bei dem Amtsgericht - Registergericht - Düsseldorf eingegangen sein.  Dies gilt auch dann, wenn der Widerspruch zur Niederschrift der Geschäftsstelle eines anderen Amtsgerichtes abgegeben wurde. Die Frist beginnt mit dem Tage der Bekanntmachung der Löschungsankündigung in dem für die Bekanntmachung der Eintragungen in das Handelsregister bestimmten elektronischen Informations- und Kommunikationssystem nach § 10 des Handelsgesetzbuches. Fällt das Ende der Frist auf einen Sonntag, einen allgemeinen Feiertag oder Sonnabend, so endet die Frist mit Ablauf des nächsten Werktages.\nDer Widerspruch muss die Bezeichnung der angefochtenen Löschungsankündigung sowie die Erklärung enthalten, dass Widerspruch gegen diese Löschungsankündigung eingelegt wird. Er ist zu unterzeichnen und soll begründet werden."
    },
    {
      "date": "2025-11-03",
      "id": "136149",
      "original_text": "Einreichung neuer Dokumente\nNordrhein-Westfalen Amtsgericht Düsseldorf HRB 18633\nNetzgesellschaft Düsseldorf mbH – Düsseldorf",
      "type": "Einreichung neuer Dokumente",
      "state": "Nordrhein-Westfalen",
      "amtsgericht": "Amtsgericht Düsseldorf",
      "registernummer": "HRB 18633",
      "registerart": "HRB",
      "company_name": "Netzgesellschaft Düsseldorf mbH",
      "company_seat": "Düsseldorf",
      "details": "03.11.2025 (Bekanntmachungsdatum)\n\nNordrhein-Westfalen Amtsgericht Düsseldorf HRB 18633\nEinreichung neuer Dokumente 09.10.2025 (Eintragungsdatum)\n\nNetzgesellschaft Düsseldorf mbH\nGesellschaft mit beschränkter Haftung\nDüsseldorf\n\nDem Registergericht ist eine Liste der Mitglieder des Aufsichtsrates eingereicht worden."
    },
    {
      "date": "2025-11-03",
      "id": "136150",
      "original_text": "Registerbekanntmachung nach dem Umwandlungsgesetz\nNordrhein-Westfalen Amtsgericht Siegburg HRA 7286\nAtris Gebäudetechnik e.K. – Siegburg",
      "type": "Registerbekanntmachung nach dem Umwandlungsgesetz",
      "state": "Nordrhein-Westfalen",
      "amtsgericht": "Amtsgericht Siegburg",
      "registernummer": "HRA 7286",
      "registerart": "HRA",
      "company_name": "Atris Gebäudetechnik e.K.",
      "company_seat": "Siegburg",
      "details": "03.11.2025 (Bekanntmachungsdatum)\n\nNordrhein-Westfalen Amtsgericht Siegburg HRA 7286\nRegisterbekanntmachung nach dem Umwandlungsgesetz 03.11.2025 (Eintragungsdatum)\n\nAtris Gebäudetechnik e.K.\nEinzelkaufmann / Einzelkauffrau\nSiegburg\n\nDen Gläubigern der an der Ausgliederung beteiligten Rechtsträger ist, wenn sie binnen sechs Monaten nach dem Tag, an dem die Eintragung der Ausgliederung in das Register des Sitzes desjenigen Rechtsträgers, dessen Gläubiger sie sind, nach § 19 Absatz 3 UmwG als bekanntgemacht gilt, ihren Anspruch nach Grund und Höhe schriftlich anmelden, Sicherheit zu leisten, soweit sie nicht Befriedigung verlangen können. Dieses Recht steht den Gläubigern jedoch nur zu, wenn sie glaubhaft machen, dass durch die Ausgliederung die Erfüllung ihrer Forderung gefährdet wird."
    },
    {
      "date": "2025-11-03",
      "id": "136151",
      "original_text": "Löschungsankündigung\nNordrhein-Westfalen Amtsgericht Wuppertal HRB 16905\nFF Bau GmbH – Wuppertal",
      "type": "Löschungsankündigung",
      "state": "Nordrhein-Westfalen",
      "amtsgericht": "Amtsgericht Wuppertal",
      "registernummer": "HRB 16905",
      "registerart": "HRB",
      "company_name": "FF Bau GmbH",
      "company_seat": "Wuppertal",
      "details": "03.11.2025 (Bekanntmachungsdatum)\n\nNordrhein-Westfalen Amtsgericht Wuppertal HRB 16905\nLöschungsankündigung\n\nFF Bau GmbH\nGesellschaft mit beschränkter Haftung\nWuppertal\n\nDas Registergericht beabsichtigt die Gesellschaft von Amts wegen nach § 394 FamFG zu löschen. Die Frist zur Erhebung eines Widerspruchs ist auf einen Monat festgesetzt."
    },
    {
      "date": "2025-11-03",
      "id": "136152",
      "original_text": "Löschungsankündigung\nNordrhein-Westfalen Amtsgericht Düsseldorf HRB 98943\nSE Buchhaltungs GmbH – Düsseldorf",
      "type": "Löschungsankündigung",
      "state": "Nordrhein-Westfalen",
      "amtsgericht": "Amtsgericht Düsseldorf",
      "registernummer": "HRB 98943",
      "registerart": "HRB",
      "company_name": "SE Buchhaltungs GmbH",
      "company_seat": "Düsseldorf",
      "details": "03.11.2025 (Bekanntmachungsdatum)\n\nNordrhein-Westfalen Amtsgericht Düsseldorf HRB 98943\nLöschungsankündigung\n\nSE Buchhaltungs GmbH\nGesellschaft mit beschränkter Haftung\nDüsseldorf\n\nDas Registergericht beabsichtigt die Gesellschaft von Amts wegen nach § 394 Abs. 1 FamFG zu löschen. Die Frist zur Erhebung eines Widerspruchs ist auf 3 Wochen festgesetzt.\n\nRechtsbehelfsbelehrung:\nDas Widerspruchsrecht steht jedem zu, der an der Unterlassung der Löschung ein berechtigtes Interesse hat. Der Widerspruch ist bei dem Amtsgericht Düsseldorf -Registergericht-, Werdener Straße 1, 40227 Düsseldorf schriftlich in deutscher Sprache oder zur Niederschrift der Geschäftsstelle einzulegen. Der Widerspruch kann auch zur Niederschrift der Geschäftsstelle eines jeden Amtsgerichtes abgegeben werden. Die Einlegung ist auch durch Übertragung eines elektronischen Dokuments an die elektronische Poststelle des Gerichts möglich. Das elektronische Dokument muss für die Bearbeitung durch das Gericht geeignet und mit einer qualifizierten elektronischen Signatur der verantwortenden Person versehen sein oder von der verantwortenden Person signiert und auf einem sicheren Übermittlungsweg gemäß § 130a ZPO nach näherer Maßgabe der Verordnung über die technischen Rahmenbedingungen des elektronischen Rechtsverkehrs und über das besondere elektronische Behördenpostfach (BGBl. I, S.3803) eingereicht werden. Weitere Informationen erhalten Sie auf der Internetseite www.justiz.de.\nDer Widerspruch muss spätestens innerhalb der gesetzten Frist nach dem Datum der Bekanntmachung der Löschungsankündigung bei dem Amtsgericht - Registergericht - Düsseldorf eingegangen sein.  Dies gilt auch dann, wenn der Widerspruch zur Niederschrift der Geschäftsstelle eines anderen Amtsgerichtes abgegeben wurde. Die Frist beginnt mit dem Tage der Bekanntmachung der Löschungsankündigung in dem für die Bekanntmachung der Eintragungen in das Handelsregister bestimmten elektronischen Informations- und Kommunikationssystem nach § 10 des Handelsgesetzbuches. Fällt das Ende der Frist auf einen Sonntag, einen allgemeinen Feiertag oder Sonnabend, so endet die Frist mit Ablauf des nächsten Werktages.\nDer Widerspruch muss die Bezeichnung der angefochtenen Löschungsankündigung sowie die Erklärung enthalten, dass Widerspruch gegen diese Löschungsankündigung eingelegt wird. Er ist zu unterzeichnen und soll begründet werden."
    },
    {
      "date": "2025-11-03",
      "id": "136153",
      "original_text": "Löschungsankündigung\nNordrhein-Westfalen Amtsgericht Neuss VR 2908\nWirtschafts- und Kulturförderungsverein Aserbaidschan e.V. – Kaarst",
      "type": "Löschungsankündigung",
      "state": "Nordrhein-Westfalen",
      "amtsgericht": "Amtsgericht Neuss",
      "registernummer": "VR 2908",
      "registerart": "VR",
      "company_name": "Wirtschafts- und Kulturförderungsverein Aserbaidschan e.V.",
      "company_seat": "Kaarst",
      "details": "03.11.2025 (Bekanntmachungsdatum)\n\nNordrhein-Westfalen Amtsgericht Neuss VR 2908\nLöschungsankündigung\n\nWirtschafts- und Kulturförderungsverein Aserbaidschan e.V.\neingetragener Verein\nKaarst\n\nDas Gericht beabsichtigt, den Verein gemäß § 395 FamFG im Vereinsregister zu löschen.  Gegen die Löschung kann binnen eines Monats jeder Widerspruch erheben, der an der Unterlassung der Löschung ein berechtigtes Interesse hat."
    },
    {
      "date": "2025-11-03",
      "id": "136154",
      "original_text": "Löschungsankündigung\nNordrhein-Westfalen Amtsgericht Dortmund HRB 22959\nGrégoire Verwaltungs GmbH – Dortmund",
      "type": "Löschungsankündigung",
      "state": "Nordrhein-Westfalen",
      "amtsgericht": "Amtsgericht Dortmund",
      "registernummer": "HRB 22959",
      "registerart": "HRB",
      "company_name": "Grégoire Verwaltungs GmbH",
      "company_seat": "Dortmund",
      "details": "03.11.2025 (Bekanntmachungsdatum)\n\nNordrhein-Westfalen Amtsgericht Dortmund HRB 22959\nLöschungsankündigung\n\nGrégoire Verwaltungs GmbH\nGesellschaft mit beschränkter Haftung\nDortmund\n\nDas Registergericht beabsichtigt die Gesellschaft von Amts wegen nach § 394 FamFG zu löschen. Die Frist zur Erhebung eines Widerspruchs ist auf zwei Monate festgesetzt."
    },
    {
      "date": "2025-11-03",
      "id": "136155",
      "original_text": "Registerbekanntmachung nach dem Umwandlungsgesetz\nNordrhein-Westfalen Amtsgericht Düsseldorf HRB 38633\nBabiel GmbH – Düsseldorf",
      "type": "Registerbekanntmachung nach dem Umwandlungsgesetz",
      "state": "Nordrhein-Westfalen",
      "amtsgericht": "Amtsgericht Düsseldorf",
      "registernummer": "HRB 38633",
      "registerart": "HRB",
      "company_name": "Babiel GmbH",
      "company_seat": "Düsseldorf",
      "details": "03.11.2025 (Bekanntmachungsdatum)\n\nNordrhein-Westfalen Amtsgericht Düsseldorf HRB 38633\nRegisterbekanntmachung nach dem Umwandlungsgesetz 03.11.2025 (Eintragungsdatum)\n\nBabiel GmbH\nGesellschaft mit beschränkter Haftung\nDüsseldorf\n\nDen Gläubigern der an der Verschmelzung beteiligten Rechtsträger ist, wenn sie binnen sechs Monaten nach dem Tag, an dem die Eintragung der Verschmelzung in das Register des Sitzes desjenigen Rechtsträgers, dessen Gläubiger sie sind, nach § 19 Absatz 3 UmwG als bekanntgemacht gilt, ihren Anspruch nach Grund und Höhe schriftlich anmelden, Sicherheit zu leisten, soweit sie nicht Befriedigung verlangen können. Dieses Recht steht den Gläubigern jedoch nur zu, wenn sie glaubhaft machen, dass durch die Verschmelzung die Erfüllung ihrer Forderung gefährdet wird."
    },
    {
      "date": "2025-11-03",
      "id": "136156",
      "original_text": "Registerbekanntmachung nach dem Umwandlungsgesetz\nNordrhein-Westfalen Amtsgericht Köln HRB 125344\nKulin Bau GmbH – Kerpen",
      "type": "Registerbekanntmachung nach dem Umwandlungsgesetz",
      "state": "Nordrhein-Westfalen",
      "amtsgericht": "Amtsgericht Köln",
      "registernummer": "HRB 125344",
      "registerart": "HRB",
      "company_name": "Kulin Bau GmbH",
      "company_seat": "Kerpen",
      "details": "03.11.2025 (Bekanntmachungsdatum)\n\nNordrhein-Westfalen Amtsgericht Köln HRB 125344\nRegisterbekanntmachung nach dem Umwandlungsgesetz 03.11.2025 (Eintragungsdatum)\n\nKulin Bau GmbH\nGesellschaft mit beschränkter Haftung\nKerpen\n\nDen Gläubigern der an der Ausgliederung beteiligten Rechtsträger ist, wenn sie binnen sechs Monaten nach dem Tag, an dem die Eintragung der Ausgliederung in das Register des Sitzes desjenigen Rechtsträgers, dessen Gläubiger sie sind, nach § 19 Absatz 3 UmwG als bekanntgemacht gilt, ihren Anspruch nach Grund und Höhe schriftlich anmelden, Sicherheit zu leisten, soweit sie nicht Befriedigung verlangen können. Dieses Recht steht den Gläubigern jedoch nur zu, wenn sie glaubhaft machen, dass durch die Ausgliederung die Erfüllung ihrer Forderung gefährdet wird."
    },
    {
      "date": "2025-11-03",
      "id": "136157",
      "original_text": "Registerbekanntmachung nach dem Umwandlungsgesetz\nNordrhein-Westfalen Amtsgericht Essen HRA 11979\nSpicer Gelenkwellenbau GmbH & Co.KG – Essen",
      "type": "Registerbekanntmachung nach dem Umwandlungsgesetz",
      "state": "Nordrhein-Westfalen",
      "amtsgericht": "Amtsgericht Essen",
      "registernummer": "HRA 11979",
      "registerart": "HRA",
      "company_name": "Spicer Gelenkwellenbau GmbH & Co.KG",
      "company_seat": "Essen",
      "details": "03.11.2025 (Bekanntmachungsdatum)\n\nNordrhein-Westfalen Amtsgericht Essen HRA 11979\nRegisterbekanntmachung nach dem Umwandlungsgesetz 03.11.2025 (Eintragungsdatum)\n\nSpicer Gelenkwellenbau GmbH & Co.KG\nKommanditgesellschaft\nEssen\n\nDie Gesellschaft hat Gläubigern, deren Forderungen vor dieser Bekanntmachung begründet worden sind, Sicherheit zu leisten, soweit sie nicht Befriedigung verlangen können, wenn sie sich binnen sechs Monaten zu diesem Zweck melden.Den Gläubigern der an der Abspaltung beteiligten Rechtsträger ist, wenn sie binnen sechs Monaten nach dem Tag, an dem die Eintragung der Abspaltung in das Register des Sitzes desjenigen Rechtsträgers, dessen Gläubiger sie sind, nach § 19 Absatz 3 UmwG als bekanntgemacht gilt, ihren Anspruch nach Grund und Höhe schriftlich anmelden, Sicherheit zu leisten, soweit sie nicht Befriedigung verlangen können. Dieses Recht steht den Gläubigern jedoch nur zu, wenn sie glaubhaft machen, dass durch die Abspaltung die Erfüllung ihrer Forderung gefährdet wird."
    },
    {
      "date": "2025-11-03",
      "id": "136158",
      "original_text": "Registerbekanntmachung nach dem Umwandlungsgesetz\nNordrhein-Westfalen Amtsgericht Köln HRA 38417\nSAVANNA Ingredients GmbH & Co. KG – Elsdorf",
      "type": "Registerbekanntmachung nach dem Umwandlungsgesetz",
      "state": "Nordrhein-Westfalen",
      "amtsgericht": "Amtsgericht Köln",
      "registernummer": "HRA 38417",
      "registerart": "HRA",
      "company_name": "SAVANNA Ingredients GmbH & Co. KG",
      "company_seat": "Elsdorf",
      "details": "03.11.2025 (Bekanntmachungsdatum)\n\nNordrhein-Westfalen Amtsgericht Köln HRA 38417\nRegisterbekanntmachung nach dem Umwandlungsgesetz 03.11.2025 (Eintragungsdatum)\n\nSAVANNA Ingredients GmbH & Co. KG\nKommanditgesellschaft\nElsdorf\n\nDie Gesellschaft hat Gläubigern, deren Forderungen vor dieser Bekanntmachung begründet worden sind, Sicherheit zu leisten, soweit sie nicht Befriedigung verlangen können, wenn sie sich binnen sechs Monaten zu diesem Zweck melden."
    },
    {
      "date": "2025-11-03",
      "id": "136159",
      "original_text": "Einreichung neuer Dokumente\nNordrhein-Westfalen Amtsgericht Bonn HRB 15251\nBWI GmbH – Meckenheim",
      "type": "Einreichung neuer Dokumente",
      "state": "Nordrhein-Westfalen",
      "amtsgericht": "Amtsgericht Bonn",
      "registernummer": "HRB 15251",
      "registerart": "HRB",
      "company_name": "BWI GmbH",
      "company_seat": "Meckenheim",
      "details": "03.11.2025 (Bekanntmachungsdatum)\n\nNordrhein-Westfalen Amtsgericht Bonn HRB 15251\nEinreichung neuer Dokumente\n\nBWI GmbH\nGesellschaft mit beschränkter Haftung\nMeckenheim\n\nDem Registergericht ist eine neue Liste der Mitglieder des Aufsichtsrates eingereicht worden."
    },
    {
      "date": "2025-11-03",
      "id": "136160",
      "original_text": "Löschungsankündigung\nNordrhein-Westfalen Amtsgericht Düsseldorf HRB 98413\nAK medical & beauty Zentrum GmbH – Düsseldorf",
      "type": "Löschungsankündigung",
      "state": "Nordrhein-Westfalen",
      "amtsgericht": "Amtsgericht Düsseldorf",
      "registernummer": "HRB 98413",
      "registerart": "HRB",
      "company_name": "AK medical & beauty Zentrum GmbH",
      "company_seat": "Düsseldorf",
      "details": "03.11.2025 (Bekanntmachungsdatum)\n\nNordrhein-Westfalen Amtsgericht Düsseldorf HRB 98413\nLöschungsankündigung\n\nAK medical & beauty Zentrum GmbH\nGesellschaft mit beschränkter Haftung\nDüsseldorf\n\nDas Registergericht beabsichtigt die Gesellschaft von Amts wegen nach § 394 FamFG zu löschen. Die Frist zur Erhebung eines Widerspruchs ist auf 3 Wochen festgesetzt.\n\nRechtsbehelfsbelehrung:\nDas Widerspruchsrecht steht jedem zu, der an der Unterlassung der Löschung ein berechtigtes Interesse hat. Der Widerspruch ist bei dem Amtsgericht Düsseldorf -Registergericht-, Werdener Straße 1, 40227 Düsseldorf schriftlich in deutscher Sprache oder zur Niederschrift der Geschäftsstelle einzulegen. Der Widerspruch kann auch zur Niederschrift der Geschäftsstelle eines jeden Amtsgerichtes abgegeben werden. Die Einlegung ist auch durch Übertragung eines elektronischen Dokuments an die elektronische Poststelle des Gerichts möglich. Das elektronische Dokument muss für die Bearbeitung durch das Gericht geeignet und mit einer qualifizierten elektronischen Signatur der verantwortenden Person versehen sein oder von der verantwortenden Person signiert und auf einem sicheren Übermittlungsweg gemäß § 130a ZPO nach näherer Maßgabe der Verordnung über die technischen Rahmenbedingungen des elektronischen Rechtsverkehrs und über das besondere elektronische Behördenpostfach (BGBl. I, S.3803) eingereicht werden. Weitere Informationen erhalten Sie auf der Internetseite www.justiz.de.\nDer Widerspruch muss spätestens innerhalb der gesetzten Frist nach dem Datum der Bekanntmachung der Löschungsankündigung bei dem Amtsgericht - Registergericht - Düsseldorf eingegangen sein.  Dies gilt auch dann, wenn der Widerspruch zur Niederschrift der Geschäftsstelle eines anderen Amtsgerichtes abgegeben wurde. Die Frist beginnt mit dem Tage der Bekanntmachung der Löschungsankündigung in dem für die Bekanntmachung der Eintragungen in das Handelsregister bestimmten elektronischen Informations- und Kommunikationssystem nach § 10 des Handelsgesetzbuches. Fällt das Ende der Frist auf einen Sonntag, einen allgemeinen Feiertag oder Sonnabend, so endet die Frist mit Ablauf des nächsten Werktages.\nDer Widerspruch muss die Bezeichnung der angefochtenen Löschungsankündigung sowie die Erklärung enthalten, dass Widerspruch gegen diese Löschungsankündigung eingelegt wird. Er ist zu unterzeichnen und soll begründet werden."
    },
    {
      "date": "2025-11-03",
      "id": "136161",
      "original_text": "Einreichung neuer Dokumente\nNordrhein-Westfalen Amtsgericht Köln HRB 29259\nBFS SozialFinanz AG – Berlin und Köln",
      "type": "Einreichung neuer Dokumente",
      "state": "Nordrhein-Westfalen",
      "amtsgericht": "Amtsgericht Köln",
      "registernummer": "HRB 29259",
      "registerart": "HRB",
      "company_name": "BFS SozialFinanz AG",
      "company_seat": "Berlin und Köln",
      "details": "03.11.2025 (Bekanntmachungsdatum)\n\nNordrhein-Westfalen Amtsgericht Köln HRB 29259\nEinreichung neuer Dokumente\n\nBFS SozialFinanz AG\nAktiengesellschaft\nBerlin und Köln\n\nDem Registergericht ist eine Liste der Mitglieder des Aufsichtsrates eingereicht worden."
    },
    {
      "date": "2025-11-03",
      "id": "136162",
      "original_text": "Registerbekanntmachung nach dem Umwandlungsgesetz\nNordrhein-Westfalen Amtsgericht Essen HRA 12008\nHoltkamp Bäckerei und Konditorei GmbH & Co. KG – Essen",
      "type": "Registerbekanntmachung nach dem Umwandlungsgesetz",
      "state": "Nordrhein-Westfalen",
      "amtsgericht": "Amtsgericht Essen",
      "registernummer": "HRA 12008",
      "registerart": "HRA",
      "company_name": "Holtkamp Bäckerei und Konditorei GmbH & Co. KG",
      "company_seat": "Essen",
      "details": "03.11.2025 (Bekanntmachungsdatum)\n\nNordrhein-Westfalen Amtsgericht Essen HRA 12008\nRegisterbekanntmachung nach dem Umwandlungsgesetz 03.11.2025 (Eintragungsdatum)\n\nHoltkamp Bäckerei und Konditorei GmbH & Co. KG\nKommanditgesellschaft\nEssen\n\nDen Gläubigern der an der Ausgliederung beteiligten Rechtsträger ist, wenn sie binnen sechs Monaten nach dem Tag, an dem die Eintragung der Ausgliederung in das Register des Sitzes desjenigen Rechtsträgers, dessen Gläubiger sie sind, nach § 19 Absatz 3 UmwG als bekanntgemacht gilt, ihren Anspruch nach Grund und Höhe schriftlich anmelden, Sicherheit zu leisten, soweit sie nicht Befriedigung verlangen können. Dieses Recht steht den Gläubigern jedoch nur zu, wenn sie glaubhaft machen, dass durch die Ausgliederung die Erfüllung ihrer Forderung gefährdet wird."
    },
    {
      "date": "2025-11-03",
      "id": "136163",
      "original_text": "Registerbekanntmachung nach dem Umwandlungsgesetz\nNordrhein-Westfalen Amtsgericht Münster HRB 23034\nI-MM-O GmbH – Münster",
      "type": "Registerbekanntmachung nach dem Umwandlungsgesetz",
      "state": "Nordrhein-Westfalen",
      "amtsgericht": "Amtsgericht Münster",
      "registernummer": "HRB 23034",
      "registerart": "HRB",
      "company_name": "I-MM-O GmbH",
      "company_seat": "Münster",
      "details": "03.11.2025 (Bekanntmachungsdatum)\n\nNordrhein-Westfalen Amtsgericht Münster HRB 23034\nRegisterbekanntmachung nach dem Umwandlungsgesetz 03.11.2025 (Eintragungsdatum)\n\nI-MM-O GmbH\nGesellschaft mit beschränkter Haftung\nMünster\n\nDen Gläubigern der an der formwechselnden Umwandlung beteiligten Rechtsträger ist, wenn sie binnen sechs Monaten nach dem Tag, an dem die Eintragung der formwechselnden Umwandlung in das Register des Sitzes desjenigen Rechtsträgers, dessen Gläubiger sie sind, nach § 19 Absatz 3 UmwG als bekanntgemacht gilt, ihren Anspruch nach Grund und Höhe schriftlich anmelden, Sicherheit zu leisten, soweit sie nicht Befriedigung verlangen können. Dieses Recht steht den Gläubigern jedoch nur zu, wenn sie glaubhaft machen, dass durch die formwechselnden Umwandlung die Erfüllung ihrer Forderung gefährdet wird."
    },
    {
      "date": "2025-11-03",
      "id": "136164",
      "original_text": "Löschungsankündigung\nNordrhein-Westfalen Amtsgericht Iserlohn HRB 10147\nNeeders UG (haftungsbeschränkt) – Altena",
      "type": "Löschungsankündigung",
      "state": "Nordrhein-Westfalen",
      "amtsgericht": "Amtsgericht Iserlohn",
      "registernummer": "HRB 10147",
      "registerart": "HRB",
      "company_name": "Needers UG (haftungsbeschränkt)",
      "company_seat": "Altena",
      "details": "03.11.2025 (Bekanntmachungsdatum)\n\nNordrhein-Westfalen Amtsgericht Iserlohn HRB 10147\nLöschungsankündigung\n\nNeeders UG (haftungsbeschränkt)\nGesellschaft mit beschränkter Haftung\nAltena\n\nDas Registergericht beabsichtigt die Gesellschaft von Amts wegen nach § 394 FamFG zu löschen. Die Frist zur Erhebung eines Widerspruchs ist auf zwei Monate festgesetzt."
    },
    {
      "date": "2025-11-03",
      "id": "136165",
      "original_text": "Löschungsankündigung\nNordrhein-Westfalen Amtsgericht Gütersloh HRB 13575\nCLUBHOUSE PREMIUM BRANDS UG (haftungsbeschränkt) – Gütersloh",
      "type": "Löschungsankündigung",
      "state": "Nordrhein-Westfalen",
      "amtsgericht": "Amtsgericht Gütersloh",
      "registernummer": "HRB 13575",
      "registerart": "HRB",
      "company_name": "CLUBHOUSE PREMIUM BRANDS UG (haftungsbeschränkt)",
      "company_seat": "Gütersloh",
      "details": "03.11.2025 (Bekanntmachungsdatum)\n\nNordrhein-Westfalen Amtsgericht Gütersloh HRB 13575\nLöschungsankündigung 03.11.2025 (Eintragungsdatum)\n\nCLUBHOUSE PREMIUM BRANDS UG (haftungsbeschränkt)\nGesellschaft mit beschränkter Haftung\nGütersloh\n\nDas Registergericht beabsichtigt die Gesellschaft von Amts wegen nach § 394 FamFG zu löschen. Die Frist zur Erhebung eines Widerspruchs ist auf einen Monat festgesetzt."
    },
    {
      "date": "2025-11-03",
      "id": "136166",
      "original_text": "Registerbekanntmachung nach dem Umwandlungsgesetz\nNordrhein-Westfalen Amtsgericht Bochum HRB 22658\nLotto-Tabak-Presse Costa GmbH – Bochum",
      "type": "Registerbekanntmachung nach dem Umwandlungsgesetz",
      "state": "Nordrhein-Westfalen",
      "amtsgericht": "Amtsgericht Bochum",
      "registernummer": "HRB 22658",
      "registerart": "HRB",
      "company_name": "Lotto-Tabak-Presse Costa GmbH",
      "company_seat": "Bochum",
      "details": "03.11.2025 (Bekanntmachungsdatum)\n\nNordrhein-Westfalen Amtsgericht Bochum HRB 22658\nRegisterbekanntmachung nach dem Umwandlungsgesetz 29.10.2025 (Eintragungsdatum)\n\nLotto-Tabak-Presse Costa GmbH\nGesellschaft mit beschränkter Haftung\nBochum\n\nDen Gläubigern der an der Ausgliederung beteiligten Rechtsträger ist, wenn sie binnen sechs Monaten nach dem Tag, an dem die Eintragung der Ausgliederung in das Register des Sitzes desjenigen Rechtsträgers, dessen Gläubiger sie sind, nach § 19 Absatz 3 UmwG als bekanntgemacht gilt, ihren Anspruch nach Grund und Höhe schriftlich anmelden, Sicherheit zu leisten, soweit sie nicht Befriedigung verlangen können. Dieses Recht steht den Gläubigern jedoch nur zu, wenn sie glaubhaft machen, dass durch die Ausgliederung die Erfüllung ihrer Forderung gefährdet wird."
    },
    {
      "date": "2025-11-03",
      "id": "136167",
      "original_text": "Sonstige Registerbekanntmachung\nNordrhein-Westfalen Amtsgericht Duisburg HRB 29995\nHaKu Service GmbH – Mülheim an der Ruhr",
      "type": "Sonstige Registerbekanntmachung",
      "state": "Nordrhein-Westfalen",
      "amtsgericht": "Amtsgericht Duisburg",
      "registernummer": "HRB 29995",
      "registerart": "HRB",
      "company_name": "HaKu Service GmbH",
      "company_seat": "Mülheim an der Ruhr",
      "details": "03.11.2025 (Bekanntmachungsdatum)\n\nNordrhein-Westfalen Amtsgericht Duisburg HRB 29995\nSonstige Registerbekanntmachung 03.11.2025 (Eintragungsdatum)\n\nHaKu Service GmbH\nGesellschaft mit beschränkter Haftung\nMülheim an der Ruhr\n\nAls nicht eingetragen wird veröffentlicht: Den Gläubigern der Gesellschaft, deren Forderungen begründet worden sind bevor die Eintragung der Beendigung des Ergebnisabführungsvertrages  in das Handelsregister nach § 10 des Handelsgesetzbuches als bekanntgemacht gilt, hat der andere Vertragsteil Sicherheit zu leisten, wenn sie sich binnen sechs Monaten nach der Bekanntmachung der Eintragung zu diesem Zweck bei ihm melden."
    },
    {
      "date": "2025-11-03",
      "id": "136168",
      "original_text": "Registerbekanntmachung nach dem Umwandlungsgesetz\nNordrhein-Westfalen Amtsgericht Duisburg HRA 13643\nPatrick Urbanski e.K. – Duisburg",
      "type": "Registerbekanntmachung nach dem Umwandlungsgesetz",
      "state": "Nordrhein-Westfalen",
      "amtsgericht": "Amtsgericht Duisburg",
      "registernummer": "HRA 13643",
      "registerart": "HRA",
      "company_name": "Patrick Urbanski e.K.",
      "company_seat": "Duisburg",
      "details": "03.11.2025 (Bekanntmachungsdatum)\n\nNordrhein-Westfalen Amtsgericht Duisburg HRA 13643\nRegisterbekanntmachung nach dem Umwandlungsgesetz 03.11.2025 (Eintragungsdatum)\n\nPatrick Urbanski e.K.\nEinzelkaufmann / Einzelkauffrau\nDuisburg\n\nDie Gesellschaft hat Gläubigern, deren Forderungen vor dieser Bekanntmachung begründet worden sind, Sicherheit zu leisten, soweit sie nicht Befriedigung verlangen können, wenn sie sich binnen sechs Monaten zu diesem Zweck melden."
    },
    {
      "date": "2025-11-03",
      "id": "136169",
      "original_text": "Registerbekanntmachung nach dem Umwandlungsgesetz\nNordrhein-Westfalen Amtsgericht Köln HRA 38280\nKevin Kulin e.K. – Kerpen",
      "type": "Registerbekanntmachung nach dem Umwandlungsgesetz",
      "state": "Nordrhein-Westfalen",
      "amtsgericht": "Amtsgericht Köln",
      "registernummer": "HRA 38280",
      "registerart": "HRA",
      "company_name": "Kevin Kulin e.K.",
      "company_seat": "Kerpen",
      "details": "03.11.2025 (Bekanntmachungsdatum)\n\nNordrhein-Westfalen Amtsgericht Köln HRA 38280\nRegisterbekanntmachung nach dem Umwandlungsgesetz 03.11.2025 (Eintragungsdatum)\n\nKevin Kulin e.K.\nEinzelkaufmann / Einzelkauffrau\nKerpen\n\nDen Gläubigern der an der Ausgliederung beteiligten Rechtsträger ist, wenn sie binnen sechs Monaten nach dem Tag, an dem die Eintragung der Ausgliederung in das Register des Sitzes desjenigen Rechtsträgers, dessen Gläubiger sie sind, nach § 19 Absatz 3 UmwG als bekanntgemacht gilt, ihren Anspruch nach Grund und Höhe schriftlich anmelden, Sicherheit zu leisten, soweit sie nicht Befriedigung verlangen können. Dieses Recht steht den Gläubigern jedoch nur zu, wenn sie glaubhaft machen, dass durch die Ausgliederung die Erfüllung ihrer Forderung gefährdet wird."
    },
    {
      "date": "2025-11-03",
      "id": "136170",
      "original_text": "Registerbekanntmachung nach dem Umwandlungsgesetz\nThüringen Amtsgericht Jena HRB 402003\nRUD System GmbH – Breitenworbis",
      "type": "Registerbekanntmachung nach dem Umwandlungsgesetz",
      "state": "Thüringen",
      "amtsgericht": "Amtsgericht Jena",
      "registernummer": "HRB 402003",
      "registerart": "HRB",
      "company_name": "RUD System GmbH",
      "company_seat": "Breitenworbis",
      "details": "03.11.2025 (Bekanntmachungsdatum)\n\nThüringen Amtsgericht Jena HRB 402003\nRegisterbekanntmachung nach dem Umwandlungsgesetz 03.11.2025 (Eintragungsdatum)\n\nRUD System GmbH\nGesellschaft mit beschränkter Haftung\nBreitenworbis\n\nNicht eingetragen: Den Gläubigern der an der Verschmelzung beteiligten Rechtsträger, ist wenn sie binnen sechs Monaten nach dem Tag, an dem die Eintragung der Verschmelzung in das Register des Sitzes desjenigen Rechtsträgers, dessen Gläubiger sie sind,  nach § 19 Abs. 3 UmwG als bekanntgemacht gilt, ihren Anspruch nach Grund und Höhe schriftlich anmelden, Sicherheit zu leisten, soweit sie nicht Befriedigung verlangen können. Dieses Recht steht ihnen jedoch nur zu, wenn sie glaubhaft machen, daß durch die Verschmelzung die Erfüllung ihrer Forderung gefährdet wird."
    },
    {
      "date": "2025-11-03",
      "id": "136171",
      "original_text": "Löschungsankündigung\nHessen Amtsgericht Gießen HRB 11584\nRadeva Dienstleistung UG (haftungsbeschränkt) – Gießen",
      "type": "Löschungsankündigung",
      "state": "Hessen",
      "amtsgericht": "Amtsgericht Gießen",
      "registernummer": "HRB 11584",
      "registerart": "HRB",
      "company_name": "Radeva Dienstleistung UG (haftungsbeschränkt)",
      "company_seat": "Gießen",
      "details": "03.11.2025 (Bekanntmachungsdatum)\n\nHessen Amtsgericht Gießen HRB 11584\nLöschungsankündigung\n\nRadeva Dienstleistung UG (haftungsbeschränkt)\nGesellschaft mit beschränkter Haftung\nGießen\n\nAuf Antrag des Finanzamtes ist beabsichtigt die Gesellschaft wegen Vermögenslosigkeit gem. § 394 FamFG von Amts wegen zu löschen.\n\nHiergegen kann innerhalb von drei Monaten nach dieser Veröffentlichung Widerspruch bei dem Amtsgericht Gießen eingelegt werden.\n\nSollte Widerspruch eingelegt werden, dürfte dies nur mit Begründung erfolgsversprechend sein. Insbesondere sollte vorhandenes Vermögen der Gesellschaft innerhalb der genannten Frist nachgewiesen werden."
    },
    {
      "date": "2025-11-03",
      "id": "136172",
      "original_text": "Löschungsankündigung\nHessen Amtsgericht Eschwege HRB 2523\nSterntaler-Krankenpflege-GmbH – Bad Sooden-Allendorf",
      "type": "Löschungsankündigung",
      "state": "Hessen",
      "amtsgericht": "Amtsgericht Eschwege",
      "registernummer": "HRB 2523",
      "registerart": "HRB",
      "company_name": "Sterntaler-Krankenpflege-GmbH",
      "company_seat": "Bad Sooden-Allendorf",
      "details": "03.11.2025 (Bekanntmachungsdatum)\n\nHessen Amtsgericht Eschwege HRB 2523\nLöschungsankündigung 03.11.2025 (Eintragungsdatum)\n\nSterntaler-Krankenpflege-GmbH\nGesellschaft mit beschränkter Haftung\nBad Sooden-Allendorf\n\nDurch eine Änderung in den Personen der Aufsichtsratsmitglieder ist eine Liste der Mitglieder des Aufsichtsrates zum Handelsregister eingereicht worden.Das Registergericht beabsichtigt die im Handelsregister eingetragene Gesellschaft von Amts wegen nach § 394 FamFG zu löschen. Die Frist zur Erhebung eines Widerspruchs gegen die beabsichtigte Löschung wird auf 3 Monate festgesetzt."
    },
    {
      "date": "2025-11-03",
      "id": "136173",
      "original_text": "Registerbekanntmachung nach dem Umwandlungsgesetz\nHessen Amtsgericht Frankfurt am Main HRB 120015\nScannell Deutschland No. 009 GmbH – Frankfurt am Main",
      "type": "Registerbekanntmachung nach dem Umwandlungsgesetz",
      "state": "Hessen",
      "amtsgericht": "Amtsgericht Frankfurt am Main",
      "registernummer": "HRB 120015",
      "registerart": "HRB",
      "company_name": "Scannell Deutschland No. 009 GmbH",
      "company_seat": "Frankfurt am Main",
      "details": "03.11.2025 (Bekanntmachungsdatum)\n\nHessen Amtsgericht Frankfurt am Main HRB 120015\nRegisterbekanntmachung nach dem Umwandlungsgesetz 03.11.2025 (Eintragungsdatum)\n\nScannell Deutschland No. 009 GmbH\nGesellschaft mit beschränkter Haftung\nFrankfurt am Main\n\nDen Gläubigern der an der Verschmelzung beteiligten Rechtsträger ist, wenn sie binnen sechs Monaten nach dem Tag, an dem die Eintragung der Verschmelzung in das Register des Sitzes desjenigen Rechtsträgers, dessen Gläubiger sie sind, nach §§ 122a Absatz 2, 19 Absatz 3 UmwG bekannt gemacht worden ist, ihren Anspruch nach Grund und Höhe schriftlich anmelden, Sicherheit zu leisten, soweit sie nicht Befriedigung verlangen können. Dieses Recht steht den Gläubigern jedoch nur zu, wenn sie glaubhaft machen, dass durch die Verschmelzung die Erfüllung ihrer Forderung gefährdet wird."
    },
    {
      "date": "2025-11-03",
      "id": "136174",
      "original_text": "Löschungsankündigung\nHessen Amtsgericht Wiesbaden HRB 30246\nhoganet GmbH – Wiesbaden",
      "type": "Löschungsankündigung",
      "state": "Hessen",
      "amtsgericht": "Amtsgericht Wiesbaden",
      "registernummer": "HRB 30246",
      "registerart": "HRB",
      "company_name": "hoganet GmbH",
      "company_seat": "Wiesbaden",
      "details": "03.11.2025 (Bekanntmachungsdatum)\n\nHessen Amtsgericht Wiesbaden HRB 30246\nLöschungsankündigung\n\nhoganet GmbH\nGesellschaft mit beschränkter Haftung\nWiesbaden\n\nDas Registergericht beabsichtigt die im Handelsregister eingetragene Gesellschaft von Amts wegen nach § 394 FamFG zu löschen. Die Frist zur Erhebung eines Widerspruchs gegen die beabsichtigte Löschung wird auf 3 Monate festgesetzt."
    },
    {
      "date": "2025-11-03",
      "id": "136175",
      "original_text": "Löschungsankündigung\nHessen Amtsgericht Offenbach am Main HRB 53830\nLorenz & Bond GmbH – Dietzenbach",
      "type": "Löschungsankündigung",
      "state": "Hessen",
      "amtsgericht": "Amtsgericht Offenbach am Main",
      "registernummer": "HRB 53830",
      "registerart": "HRB",
      "company_name": "Lorenz & Bond GmbH",
      "company_seat": "Dietzenbach",
      "details": "03.11.2025 (Bekanntmachungsdatum)\n\nHessen Amtsgericht Offenbach am Main HRB 53830\nLöschungsankündigung\n\nLorenz & Bond GmbH\nGesellschaft mit beschränkter Haftung\nDietzenbach\n\nDas Registergericht beabsichtigt die im Handelsregister eingetragene Gesellschaft von Amts wegen nach § 394 FamFG zu löschen. Die Frist zur Erhebung eines Widerspruchs gegen die beabsichtigte Löschung wird auf 3 Monate festgesetzt."
    },
    {
      "date": "2025-11-03",
      "id": "136176",
      "original_text": "Registerbekanntmachung nach dem Umwandlungsgesetz\nHessen Amtsgericht Frankfurt am Main HRB 75145\nChinook deSign AG – Frankfurt am Main",
      "type": "Registerbekanntmachung nach dem Umwandlungsgesetz",
      "state": "Hessen",
      "amtsgericht": "Amtsgericht Frankfurt am Main",
      "registernummer": "HRB 75145",
      "registerart": "HRB",
      "company_name": "Chinook deSign AG",
      "company_seat": "Frankfurt am Main",
      "details": "03.11.2025 (Bekanntmachungsdatum)\n\nHessen Amtsgericht Frankfurt am Main HRB 75145\nRegisterbekanntmachung nach dem Umwandlungsgesetz 03.11.2025 (Eintragungsdatum)\n\nChinook deSign AG\nAktiengesellschaft\nFrankfurt am Main\n\nDem Registergericht ist der Umwandlungsplan am 22.10.2025 betreffend die formwechselnde Umwandlung der Gesellschaft in die Rechtsform der Societas Europaea (SE) unter der Firma Chinook SE eingereicht worden.\n\nChinook deSign AG, Sitz Bad Homburg v. d. Höhe, inländische Geschäftsanschrift: Odenwaldstraße 22, 61352 Bad Homburg v. d. Höhe (Gesellschaft)"
    },
    {
      "date": "2025-11-03",
      "id": "136177",
      "original_text": "Registerbekanntmachung nach dem Umwandlungsgesetz\nHessen Amtsgericht Gießen GnR 427\nVR VerbundBank eG – Alsfeld",
      "type": "Registerbekanntmachung nach dem Umwandlungsgesetz",
      "state": "Hessen",
      "amtsgericht": "Amtsgericht Gießen",
      "registernummer": "GnR 427",
      "registerart": "GnR",
      "company_name": "VR VerbundBank eG",
      "company_seat": "Alsfeld",
      "details": "03.11.2025 (Bekanntmachungsdatum)\n\nHessen Amtsgericht Gießen GnR 427\nRegisterbekanntmachung nach dem Umwandlungsgesetz 03.11.2025 (Eintragungsdatum)\n\nVR VerbundBank eG\neingetragene Genossenschaft\nAlsfeld\n\nDen Gläubigern der an der Verschmelzung beteiligten Rechtsträger ist, wenn sie binnen sechs Monaten nach dem Tag, an dem die Eintragung der Verschmelzung in das Register des Sitzes desjenigen Rechtsträgers, dessen Gläubiger sie sind, nach § 19 Absatz 3 UmwG bekannt gemacht worden ist, ihren Anspruch nach Grund und Höhe schriftlich anmelden, Sicherheit zu leisten, soweit sie nicht Befriedigung verlangen können. Dieses Recht steht den Gläubigern jedoch nur zu, wenn sie glaubhaft machen, dass durch die Verschmelzung die Erfüllung ihrer Forderung gefährdet wird."
    },
    {
      "date": "2025-11-03",
      "id": "136178",
      "original_text": "Registerbekanntmachung nach dem Umwandlungsgesetz\nHessen Amtsgericht Darmstadt HRA 87055\nKeil e.K. – Fischbachtal",
      "type": "Registerbekanntmachung nach dem Umwandlungsgesetz",
      "state": "Hessen",
      "amtsgericht": "Amtsgericht Darmstadt",
      "registernummer": "HRA 87055",
      "registerart": "HRA",
      "company_name": "Keil e.K.",
      "company_seat": "Fischbachtal",
      "details": "03.11.2025 (Bekanntmachungsdatum)\n\nHessen Amtsgericht Darmstadt HRA 87055\nRegisterbekanntmachung nach dem Umwandlungsgesetz 03.11.2025 (Eintragungsdatum)\n\nKeil e.K.\nEinzelkaufmann / Einzelkauffrau\nFischbachtal\n\nDen Gläubigern der an der Ausgliederung beteiligten Rechtsträger ist, wenn sie binnen sechs Monaten nach dem Tag, an dem die Eintragung der Ausgliederung in das Register des Sitzes desjenigen Rechtsträgers, dessen Gläubiger sie sind, nach § 19 Absatz 3 UmwG bekannt gemacht worden ist, ihren Anspruch nach Grund und Höhe schriftlich anmelden, Sicherheit zu leisten, soweit sie nicht Befriedigung verlangen können. Dieses Recht steht den Gläubigern jedoch nur zu, wenn sie glaubhaft machen, dass durch die Ausgliederung die Erfüllung ihrer Forderung gefährdet wird."
    },
    {
      "date": "2025-11-03",
      "id": "136179",
      "original_text": "Löschungsankündigung\nHessen Amtsgericht Frankfurt am Main HRB 113856\nPopa-Bau GmbH – Frankfurt am Main",
      "type": "Löschungsankündigung",
      "state": "Hessen",
      "amtsgericht": "Amtsgericht Frankfurt am Main",
      "registernummer": "HRB 113856",
      "registerart": "HRB",
      "company_name": "Popa-Bau GmbH",
      "company_seat": "Frankfurt am Main",
      "details": "03.11.2025 (Bekanntmachungsdatum)\n\nHessen Amtsgericht Frankfurt am Main HRB 113856\nLöschungsankündigung\n\nPopa-Bau GmbH\nGesellschaft mit beschränkter Haftung\nFrankfurt am Main\n\nEs ist beabsichtigt, die Gesellschaft wegen Vermögenslosigkeit gemäß § 394 FamFG von Amts wegen im Handelsregister zu löschen. Hiergegen kann innerhalb eines Monats nach dieser Veröffentlichung Widerspruch bei dem Amtsgericht Frankfurt am Main eingelegt werden."
    },
    {
      "date": "2025-11-03",
      "id": "136180",
      "original_text": "Löschungsankündigung\nHessen Amtsgericht Hanau HRB 97071\nPB Plan Bau GmbH – Hanau",
      "type": "Löschungsankündigung",
      "state": "Hessen",
      "amtsgericht": "Amtsgericht Hanau",
      "registernummer": "HRB 97071",
      "registerart": "HRB",
      "company_name": "PB Plan Bau GmbH",
      "company_seat": "Hanau",
      "details": "03.11.2025 (Bekanntmachungsdatum)\n\nHessen Amtsgericht Hanau HRB 97071\nLöschungsankündigung\n\nPB Plan Bau GmbH\nGesellschaft mit beschränkter Haftung\nHanau\n\nDas Registergericht beabsichtigt die im Handelsregister eingetragene Gesellschaft von Amts wegen nach § 394 FamFG zu löschen. Die Frist zur Erhebung eines Widerspruchs gegen die beabsichtigte Löschung wird auf 3 Monate festgesetzt."
    },
    {
      "date": "2025-11-03",
      "id": "136181",
      "original_text": "Registerbekanntmachung nach dem Umwandlungsgesetz\nHessen Amtsgericht Gießen GnR 431\nVolksbank Lauterbach-Schlitz eG – Lauterbach (Hessen)",
      "type": "Registerbekanntmachung nach dem Umwandlungsgesetz",
      "state": "Hessen",
      "amtsgericht": "Amtsgericht Gießen",
      "registernummer": "GnR 431",
      "registerart": "GnR",
      "company_name": "Volksbank Lauterbach-Schlitz eG",
      "company_seat": "Lauterbach (Hessen)",
      "details": "03.11.2025 (Bekanntmachungsdatum)\n\nHessen Amtsgericht Gießen GnR 431\nRegisterbekanntmachung nach dem Umwandlungsgesetz 03.11.2025 (Eintragungsdatum)\n\nVolksbank Lauterbach-Schlitz eG\neingetragene Genossenschaft\nLauterbach (Hessen)\n\nDen Gläubigern der an der Verschmelzung beteiligten Rechtsträger ist, wenn sie binnen sechs Monaten nach dem Tag, an dem die Eintragung der Verschmelzung in das Register des Sitzes desjenigen Rechtsträgers, dessen Gläubiger sie sind, nach § 19 Absatz 3 UmwG bekannt gemacht worden ist, ihren Anspruch nach Grund und Höhe schriftlich anmelden, Sicherheit zu leisten, soweit sie nicht Befriedigung verlangen können. Dieses Recht steht den Gläubigern jedoch nur zu, wenn sie glaubhaft machen, dass durch die Verschmelzung die Erfüllung ihrer Forderung gefährdet wird."
    },
    {
      "date": "2025-11-03",
      "id": "136182",
      "original_text": "Einreichung neuer Dokumente\nHessen Amtsgericht Frankfurt am Main HRB 8242\nHofheimer Wohnungsbaugesellschaft mit beschränkter Haftung – Hofheim am Taunus",
      "type": "Einreichung neuer Dokumente",
      "state": "Hessen",
      "amtsgericht": "Amtsgericht Frankfurt am Main",
      "registernummer": "HRB 8242",
      "registerart": "HRB",
      "company_name": "Hofheimer Wohnungsbaugesellschaft mit beschränkter Haftung",
      "company_seat": "Hofheim am Taunus",
      "details": "03.11.2025 (Bekanntmachungsdatum)\n\nHessen Amtsgericht Frankfurt am Main HRB 8242\nEinreichung neuer Dokumente 03.11.2025 (Eintragungsdatum)\n\nHofheimer Wohnungsbaugesellschaft mit beschränkter Haftung\nGesellschaft mit beschränkter Haftung\nHofheim am Taunus\n\nDurch eine Änderung in den Personen der Aufsichtsratsmitglieder ist eine Liste der Mitglieder des Aufsichtsrates zum Handelsregister eingereicht worden."
    },
    {
      "date": "2025-11-03",
      "id": "136183",
      "original_text": "Löschungsankündigung\nHessen Amtsgericht Wiesbaden HRB 25246\nOmega Networking UG (haftungsbeschränkt) – Wiesbaden",
      "type": "Löschungsankündigung",
      "state": "Hessen",
      "amtsgericht": "Amtsgericht Wiesbaden",
      "registernummer": "HRB 25246",
      "registerart": "HRB",
      "company_name": "Omega Networking UG (haftungsbeschränkt)",
      "company_seat": "Wiesbaden",
      "details": "03.11.2025 (Bekanntmachungsdatum)\n\nHessen Amtsgericht Wiesbaden HRB 25246\nLöschungsankündigung\n\nOmega Networking UG (haftungsbeschränkt)\nGesellschaft mit beschränkter Haftung\nWiesbaden\n\nDas Registergericht beabsichtigt die im Handelsregister eingetragene Gesellschaft von Amts wegen nach § 394 FamFG zu löschen. Die Frist zur Erhebung eines Widerspruchs gegen die beabsichtigte Löschung wird auf 3 Monate festgesetzt."
    }
  ]
}