{
  "date": "2025-11-01",
  "date_of_scrape": "2025-11-02T04:07:26.288Z",
  "tool_version": "0.2.0",
  "number_of_announcements": 17,
  "announcements": [
    {
      "date": "2025-11-01",
      "id": "136041",
      "original_text": "Registerbekanntmachung nach dem Umwandlungsgesetz\nBayern Amtsgericht München HRB 256295\nPROCON IT GmbH – Garching b.München",
      "type": "Registerbekanntmachung nach dem Umwandlungsgesetz",
      "state": "Bayern",
      "amtsgericht": "Amtsgericht München",
      "registernummer": "HRB 256295",
      "registerart": "HRB",
      "company_name": "PROCON IT GmbH",
      "company_seat": "Garching b.München",
      "details": "01.11.2025 (Bekanntmachungsdatum)\n\nBayern Amtsgericht München HRB 256295\nRegisterbekanntmachung nach dem Umwandlungsgesetz 31.10.2025 (Eintragungsdatum)\n\nPROCON IT GmbH\nGesellschaft mit beschränkter Haftung\nGarching b.München\n\nDen Gläubigern der an der Verschmelzung beteiligten Rechtsträger ist, wenn sie binnen sechs Monaten nach dem Tag, an dem die Eintragung der Verschmelzung in das Register des Sitzes desjenigen Rechtsträgers, dessen Gläubiger sie sind, nach § 19 Abs. 3 UmwG als bekannt gemacht gilt, ihren Anspruch nach Grund und Höhe in Textform anmelden, Sicherheit zu leisten, soweit sie nicht Befriedigung verlangen können. Dieses Recht steht den Gläubigern jedoch nur zu, wenn sie glaubhaft machen, dass durch die Verschmelzung die Erfüllung ihrer Forderung gefährdet wird."
    },
    {
      "date": "2025-11-01",
      "id": "136042",
      "original_text": "Registerbekanntmachung nach dem Umwandlungsgesetz\nBayern Amtsgericht Hof HRA 4980\nAlexander Voith Physiotherapie und Fitnessstudio e.K. – Marktredwitz",
      "type": "Registerbekanntmachung nach dem Umwandlungsgesetz",
      "state": "Bayern",
      "amtsgericht": "Amtsgericht Hof",
      "registernummer": "HRA 4980",
      "registerart": "HRA",
      "company_name": "Alexander Voith Physiotherapie und Fitnessstudio e.K.",
      "company_seat": "Marktredwitz",
      "details": "01.11.2025 (Bekanntmachungsdatum)\n\nBayern Amtsgericht Hof HRA 4980\nRegisterbekanntmachung nach dem Umwandlungsgesetz 31.10.2025 (Eintragungsdatum)\n\nAlexander Voith Physiotherapie und Fitnessstudio e.K.\nEinzelkaufmann / Einzelkauffrau\nMarktredwitz\n\nDen Gläubigern der an der Ausgliederung beteiligten Rechtsträger ist, wenn sie binnen sechs Monaten nach dem Tag, an dem die Eintragung der Ausgliederung in das Register des Sitzes desjenigen Rechtsträgers, dessen Gläubiger sie sind, nach §§ 125, 19 Abs. 3 UmwG als bekannt gemacht gilt, ihren Anspruch nach Grund und Höhe in Textform anmelden, Sicherheit zu leisten, soweit sie nicht Befriedigung verlangen können. Dieses Recht steht den Gläubigern jedoch nur zu, wenn sie glaubhaft machen, dass durch die Ausgliederung die Erfüllung ihrer Forderung gefährdet wird."
    },
    {
      "date": "2025-11-01",
      "id": "136043",
      "original_text": "Einreichung neuer Dokumente\nBayern Amtsgericht Hof HRB 1480\nVishay Europe GmbH – Selb",
      "type": "Einreichung neuer Dokumente",
      "state": "Bayern",
      "amtsgericht": "Amtsgericht Hof",
      "registernummer": "HRB 1480",
      "registerart": "HRB",
      "company_name": "Vishay Europe GmbH",
      "company_seat": "Selb",
      "details": "01.11.2025 (Bekanntmachungsdatum)\n\nBayern Amtsgericht Hof HRB 1480\nEinreichung neuer Dokumente\n\nVishay Europe GmbH\nGesellschaft mit beschränkter Haftung\nSelb\n\nDem Amtsgericht Hof -Registergericht- ist eine Liste der Mitglieder des Aufsichtsrats eingereicht worden, § 52 Abs. 3 S. 2 GmbHG."
    },
    {
      "date": "2025-11-01",
      "id": "136044",
      "original_text": "Registerbekanntmachung nach dem Umwandlungsgesetz\nBayern Amtsgericht Fürth HRB 22170\nPurple Media Group GmbH – Baiersdorf",
      "type": "Registerbekanntmachung nach dem Umwandlungsgesetz",
      "state": "Bayern",
      "amtsgericht": "Amtsgericht Fürth",
      "registernummer": "HRB 22170",
      "registerart": "HRB",
      "company_name": "Purple Media Group GmbH",
      "company_seat": "Baiersdorf",
      "details": "01.11.2025 (Bekanntmachungsdatum)\n\nBayern Amtsgericht Fürth HRB 22170\nRegisterbekanntmachung nach dem Umwandlungsgesetz 31.10.2025 (Eintragungsdatum)\n\nPurple Media Group GmbH\nGesellschaft mit beschränkter Haftung\nBaiersdorf\n\nDen Gläubigern des formwechselnden Rechtsträgers ist, wenn sie binnen sechs Monaten nach dem Tag, an dem die Eintragung des Formwechsels nach § 201 UmwG als bekannt gemacht gilt, ihren Anspruch nach Grund und Höhe in Textform anmelden, Sicherheit zu leisten, soweit sie nicht Befriedigung verlangen können. Dieses Recht steht den Gläubigern jedoch nur zu, wenn sie glaubhaft machen, dass durch den Formwechsel die Erfüllung ihrer Forderung gefährdet wird."
    },
    {
      "date": "2025-11-01",
      "id": "136045",
      "original_text": "Löschungsankündigung\nBayern Amtsgericht Regensburg HRB 19662\nÉN, Magam Kft. Zweigniederlassung – Neutraubling",
      "type": "Löschungsankündigung",
      "state": "Bayern",
      "amtsgericht": "Amtsgericht Regensburg",
      "registernummer": "HRB 19662",
      "registerart": "HRB",
      "company_name": "ÉN, Magam Kft. Zweigniederlassung",
      "company_seat": "Neutraubling",
      "details": "01.11.2025 (Bekanntmachungsdatum)\n\nBayern Amtsgericht Regensburg HRB 19662\nLöschungsankündigung\n\nÉN, Magam Kft. Zweigniederlassung\nRechtsform ausländischen Rechts HRB\nNeutraubling\n\nDas Registergericht beabsichtigt, die im Handelsregister eingetragene Zweigniederlassung wegen Vermögenslosigkeit von Amts wegen nach § 394 FamFG zu löschen. Die Frist zur Erhebung eines Widerspruchs ist auf einen Monat festgesetzt."
    },
    {
      "date": "2025-11-01",
      "id": "136046",
      "original_text": "Einreichung neuer Dokumente\nBayern Amtsgericht München HRB 247508\nmedondo holding AG – München",
      "type": "Einreichung neuer Dokumente",
      "state": "Bayern",
      "amtsgericht": "Amtsgericht München",
      "registernummer": "HRB 247508",
      "registerart": "HRB",
      "company_name": "medondo holding AG",
      "company_seat": "München",
      "details": "01.11.2025 (Bekanntmachungsdatum)\n\nBayern Amtsgericht München HRB 247508\nEinreichung neuer Dokumente\n\nmedondo holding AG\nAktiengesellschaft\nMünchen\n\nDem Amtsgericht München -Registergericht- ist eine Liste der Mitglieder des Aufsichtsrats eingereicht worden, § 106 AktG."
    },
    {
      "date": "2025-11-01",
      "id": "136047",
      "original_text": "Einreichung neuer Dokumente\nBayern Amtsgericht Regensburg HRB 18841\nVitesco Technologies GmbH – Regensburg",
      "type": "Einreichung neuer Dokumente",
      "state": "Bayern",
      "amtsgericht": "Amtsgericht Regensburg",
      "registernummer": "HRB 18841",
      "registerart": "HRB",
      "company_name": "Vitesco Technologies GmbH",
      "company_seat": "Regensburg",
      "details": "01.11.2025 (Bekanntmachungsdatum)\n\nBayern Amtsgericht Regensburg HRB 18841\nEinreichung neuer Dokumente\n\nVitesco Technologies GmbH\nGesellschaft mit beschränkter Haftung\nRegensburg\n\nDem Amtsgericht Regensburg -Registergericht- ist eine Liste der Mitglieder des Aufsichtsrats eingereicht worden, § 52 Abs. 3 S. 2 GmbHG."
    },
    {
      "date": "2025-11-01",
      "id": "136048",
      "original_text": "Registerbekanntmachung nach dem Umwandlungsgesetz\nBayern Amtsgericht Hof HRB 7217\nPhysiofreunde GmbH – Marktredwitz",
      "type": "Registerbekanntmachung nach dem Umwandlungsgesetz",
      "state": "Bayern",
      "amtsgericht": "Amtsgericht Hof",
      "registernummer": "HRB 7217",
      "registerart": "HRB",
      "company_name": "Physiofreunde GmbH",
      "company_seat": "Marktredwitz",
      "details": "01.11.2025 (Bekanntmachungsdatum)\n\nBayern Amtsgericht Hof HRB 7217\nRegisterbekanntmachung nach dem Umwandlungsgesetz 31.10.2025 (Eintragungsdatum)\n\nPhysiofreunde GmbH\nGesellschaft mit beschränkter Haftung\nMarktredwitz\n\nDen Gläubigern der an der Ausgliederung beteiligten Rechtsträger ist, wenn sie binnen sechs Monaten nach dem Tag, an dem die Eintragung der Ausgliederung in das Register des Sitzes desjenigen Rechtsträgers, dessen Gläubiger sie sind, nach §§ 125, 19 Abs. 3 UmwG als bekannt gemacht gilt, ihren Anspruch nach Grund und Höhe in Textform anmelden, Sicherheit zu leisten, soweit sie nicht Befriedigung verlangen können. Dieses Recht steht den Gläubigern jedoch nur zu, wenn sie glaubhaft machen, dass durch die Ausgliederung die Erfüllung ihrer Forderung gefährdet wird."
    },
    {
      "date": "2025-11-01",
      "id": "136049",
      "original_text": "Registerbekanntmachung nach dem Umwandlungsgesetz\nBayern Amtsgericht Deggendorf HRB 5810\nLeonet GmbH – Deggendorf",
      "type": "Registerbekanntmachung nach dem Umwandlungsgesetz",
      "state": "Bayern",
      "amtsgericht": "Amtsgericht Deggendorf",
      "registernummer": "HRB 5810",
      "registerart": "HRB",
      "company_name": "Leonet GmbH",
      "company_seat": "Deggendorf",
      "details": "01.11.2025 (Bekanntmachungsdatum)\n\nBayern Amtsgericht Deggendorf HRB 5810\nRegisterbekanntmachung nach dem Umwandlungsgesetz 31.10.2025 (Eintragungsdatum)\n\nLeonet GmbH\nGesellschaft mit beschränkter Haftung\nDeggendorf\n\nDen Gläubigern der an der Verschmelzung beteiligten Rechtsträger ist, wenn sie binnen sechs Monaten nach dem Tag, an dem die Eintragung der Verschmelzung in das Register des Sitzes desjenigen Rechtsträgers, dessen Gläubiger sie sind, nach § 19 Abs. 3 UmwG als bekannt gemacht gilt, ihren Anspruch nach Grund und Höhe in Textform anmelden, Sicherheit zu leisten, soweit sie nicht Befriedigung verlangen können. Dieses Recht steht den Gläubigern jedoch nur zu, wenn sie glaubhaft machen, dass durch die Verschmelzung die Erfüllung ihrer Forderung gefährdet wird."
    },
    {
      "date": "2025-11-01",
      "id": "136050",
      "original_text": "Löschungsankündigung\nBayern Amtsgericht München HRB 242917\nAST Well Invest GmbH – München",
      "type": "Löschungsankündigung",
      "state": "Bayern",
      "amtsgericht": "Amtsgericht München",
      "registernummer": "HRB 242917",
      "registerart": "HRB",
      "company_name": "AST Well Invest GmbH",
      "company_seat": "München",
      "details": "01.11.2025 (Bekanntmachungsdatum)\n\nBayern Amtsgericht München HRB 242917\nLöschungsankündigung 31.10.2025 (Eintragungsdatum)\n\nAST Well Invest GmbH\nGesellschaft mit beschränkter Haftung\nMünchen\n\nDas Registergericht beabsichtigt, die im Handelsregister eingetragene Gesellschaft wegen Vermögenslosigkeit von Amts wegen nach § 394 FamFG zu löschen. Die Frist zur Erhebung eines Widerspruchs ist auf drei Monate festgesetzt."
    },
    {
      "date": "2025-11-01",
      "id": "136051",
      "original_text": "Einreichung neuer Dokumente\nBayern Amtsgericht München HRB 153658\nMPS-Treuhand AG Steuerberatungsgesellschaft – München",
      "type": "Einreichung neuer Dokumente",
      "state": "Bayern",
      "amtsgericht": "Amtsgericht München",
      "registernummer": "HRB 153658",
      "registerart": "HRB",
      "company_name": "MPS-Treuhand AG Steuerberatungsgesellschaft",
      "company_seat": "München",
      "details": "01.11.2025 (Bekanntmachungsdatum)\n\nBayern Amtsgericht München HRB 153658\nEinreichung neuer Dokumente\n\nMPS-Treuhand AG Steuerberatungsgesellschaft\nAktiengesellschaft\nMünchen\n\nDem Amtsgericht München -Registergericht- ist eine Liste der Mitglieder des Aufsichtsrats eingereicht worden, § 106 AktG."
    },
    {
      "date": "2025-11-01",
      "id": "136052",
      "original_text": "Registerbekanntmachung nach dem Umwandlungsgesetz\nBayern Amtsgericht Fürth HRA 11944\nLotter Media oHG – Baiersdorf",
      "type": "Registerbekanntmachung nach dem Umwandlungsgesetz",
      "state": "Bayern",
      "amtsgericht": "Amtsgericht Fürth",
      "registernummer": "HRA 11944",
      "registerart": "HRA",
      "company_name": "Lotter Media oHG",
      "company_seat": "Baiersdorf",
      "details": "01.11.2025 (Bekanntmachungsdatum)\n\nBayern Amtsgericht Fürth HRA 11944\nRegisterbekanntmachung nach dem Umwandlungsgesetz 31.10.2025 (Eintragungsdatum)\n\nLotter Media oHG\nOffene Handelsgesellschaft\nBaiersdorf\n\nDen Gläubigern des formwechselnden Rechtsträgers ist, wenn sie binnen sechs Monaten nach dem Tag, an dem die Eintragung des Formwechsels nach § 201 UmwG als bekannt gemacht gilt, ihren Anspruch nach Grund und Höhe in Textform anmelden, Sicherheit zu leisten, soweit sie nicht Befriedigung verlangen können. Dieses Recht steht den Gläubigern jedoch nur zu, wenn sie glaubhaft machen, dass durch den Formwechsel die Erfüllung ihrer Forderung gefährdet wird."
    },
    {
      "date": "2025-11-01",
      "id": "136053",
      "original_text": "Registerbekanntmachung nach dem Umwandlungsgesetz\nBayern Amtsgericht München HRB 275721\nAkilinda Beteiligungs UG (haftungsbeschränkt) – Gräfelfing",
      "type": "Registerbekanntmachung nach dem Umwandlungsgesetz",
      "state": "Bayern",
      "amtsgericht": "Amtsgericht München",
      "registernummer": "HRB 275721",
      "registerart": "HRB",
      "company_name": "Akilinda Beteiligungs UG (haftungsbeschränkt)",
      "company_seat": "Gräfelfing",
      "details": "01.11.2025 (Bekanntmachungsdatum)\n\nBayern Amtsgericht München HRB 275721\nRegisterbekanntmachung nach dem Umwandlungsgesetz 31.10.2025 (Eintragungsdatum)\n\nAkilinda Beteiligungs UG (haftungsbeschränkt)\nGesellschaft mit beschränkter Haftung\nGräfelfing\n\nDen Gläubigern der an der Verschmelzung beteiligten Rechtsträger ist, wenn sie binnen sechs Monaten nach dem Tag, an dem die Eintragung der Verschmelzung in das Register des Sitzes desjenigen Rechtsträgers, dessen Gläubiger sie sind, nach § 19 Abs. 3 UmwG als bekannt gemacht gilt, ihren Anspruch nach Grund und Höhe in Textform anmelden, Sicherheit zu leisten, soweit sie nicht Befriedigung verlangen können. Dieses Recht steht den Gläubigern jedoch nur zu, wenn sie glaubhaft machen, dass durch die Verschmelzung die Erfüllung ihrer Forderung gefährdet wird."
    },
    {
      "date": "2025-11-01",
      "id": "136054",
      "original_text": "Registerbekanntmachung nach dem Umwandlungsgesetz\nBayern Amtsgericht Deggendorf HRB 4708\nLeonet Group GmbH – Deggendorf",
      "type": "Registerbekanntmachung nach dem Umwandlungsgesetz",
      "state": "Bayern",
      "amtsgericht": "Amtsgericht Deggendorf",
      "registernummer": "HRB 4708",
      "registerart": "HRB",
      "company_name": "Leonet Group GmbH",
      "company_seat": "Deggendorf",
      "details": "01.11.2025 (Bekanntmachungsdatum)\n\nBayern Amtsgericht Deggendorf HRB 4708\nRegisterbekanntmachung nach dem Umwandlungsgesetz 31.10.2025 (Eintragungsdatum)\n\nLeonet Group GmbH\nGesellschaft mit beschränkter Haftung\nDeggendorf\n\nDen Gläubigern der an der Verschmelzung beteiligten Rechtsträger ist, wenn sie binnen sechs Monaten nach dem Tag, an dem die Eintragung der Verschmelzung in das Register des Sitzes desjenigen Rechtsträgers, dessen Gläubiger sie sind, nach § 19 Abs. 3 UmwG als bekannt gemacht gilt, ihren Anspruch nach Grund und Höhe in Textform anmelden, Sicherheit zu leisten, soweit sie nicht Befriedigung verlangen können. Dieses Recht steht den Gläubigern jedoch nur zu, wenn sie glaubhaft machen, dass durch die Verschmelzung die Erfüllung ihrer Forderung gefährdet wird."
    },
    {
      "date": "2025-11-01",
      "id": "136055",
      "original_text": "Einreichung neuer Dokumente\nBayern Amtsgericht München HRB 4921\nBayWa Aktiengesellschaft – München",
      "type": "Einreichung neuer Dokumente",
      "state": "Bayern",
      "amtsgericht": "Amtsgericht München",
      "registernummer": "HRB 4921",
      "registerart": "HRB",
      "company_name": "BayWa Aktiengesellschaft",
      "company_seat": "München",
      "details": "01.11.2025 (Bekanntmachungsdatum)\n\nBayern Amtsgericht München HRB 4921\nEinreichung neuer Dokumente\n\nBayWa Aktiengesellschaft\nAktiengesellschaft\nMünchen\n\nDem Amtsgericht München -Registergericht- ist eine Liste der Mitglieder des Aufsichtsrats eingereicht worden, § 106 AktG."
    },
    {
      "date": "2025-11-01",
      "id": "136056",
      "original_text": "Registerbekanntmachung nach dem Umwandlungsgesetz\nNiedersachsen Amtsgericht Göttingen HRB 200240\nW & S Immobilien Beteiligungs GmbH – Osterode",
      "type": "Registerbekanntmachung nach dem Umwandlungsgesetz",
      "state": "Niedersachsen",
      "amtsgericht": "Amtsgericht Göttingen",
      "registernummer": "HRB 200240",
      "registerart": "HRB",
      "company_name": "W & S Immobilien Beteiligungs GmbH",
      "company_seat": "Osterode",
      "details": "01.11.2025 (Bekanntmachungsdatum)\n\nNiedersachsen Amtsgericht Göttingen HRB 200240\nRegisterbekanntmachung nach dem Umwandlungsgesetz 01.11.2025 (Eintragungsdatum)\n\nW & S Immobilien Beteiligungs GmbH\nGesellschaft mit beschränkter Haftung\nOsterode\n\nDen Gläubigern der an der Verschmelzung beteiligten Rechtsträger ist, wenn sie binnen sechs Monaten nach dem Tag, an dem die Eintragung der Verschmelzung in das Register des Sitzes desjenigen Rechtsträgers, dessen Gläubiger sie sind, nach § 19  Abs.  3 UmwG als bekannt gemacht gilt, ihren Anspruch nach Grund und Höhe schriftlich anmelden, Sicherheit zu leisten, soweit sie nicht Befriedigung verlangen können. Dieses Recht steht den Gläubigern jedoch nur zu, wenn sie glaubhaft machen, dass durch die Verschmelzung die Erfüllung der Forderung gefährdet wird."
    },
    {
      "date": "2025-11-01",
      "id": "136057",
      "original_text": "Registerbekanntmachung nach dem Umwandlungsgesetz\nNiedersachsen Amtsgericht Göttingen HRB 130761 früher Amtsgericht Northeim\nWentorf Verwaltungs-GmbH – Osterode am Harz",
      "type": "Registerbekanntmachung nach dem Umwandlungsgesetz",
      "state": "Niedersachsen",
      "amtsgericht": "Amtsgericht Göttingen",
      "registernummer": "HRB 130761",
      "registerart": "HRB",
      "company_name": "Wentorf Verwaltungs-GmbH",
      "company_seat": "Osterode am Harz",
      "former_amtsgericht": "Northeim",
      "details": "01.11.2025 (Bekanntmachungsdatum)\n\nNiedersachsen Amtsgericht Göttingen HRB 130761 früher Amtsgericht Northeim\nRegisterbekanntmachung nach dem Umwandlungsgesetz 01.11.2025 (Eintragungsdatum)\n\nWentorf Verwaltungs-GmbH\nGesellschaft mit beschränkter Haftung\nOsterode am Harz\n\nDen Gläubigern der an der Verschmelzung beteiligten Rechtsträger ist, wenn sie binnen sechs Monaten nach dem Tag, an dem die Eintragung der Verschmelzung in das Register des Sitzes desjenigen Rechtsträgers, dessen Gläubiger sie sind, nach § 19  Abs.  3 UmwG als bekannt gemacht gilt, ihren Anspruch nach Grund und Höhe schriftlich anmelden, Sicherheit zu leisten, soweit sie nicht Befriedigung verlangen können. Dieses Recht steht den Gläubigern jedoch nur zu, wenn sie glaubhaft machen, dass durch die Verschmelzung die Erfüllung der Forderung gefährdet wird."
    }
  ]
}