{
  "date": "2025-11-19",
  "date_of_scrape": "2025-11-20T04:09:26.177Z",
  "tool_version": "0.2.0",
  "number_of_announcements": 114,
  "announcements": [
    {
      "date": "2025-11-19",
      "id": "137716",
      "original_text": "Registerbekanntmachung nach dem Umwandlungsgesetz\nBayern Amtsgericht Würzburg PR 87\nDr. Staub & Partner Steuerberatungsgesellschaft mbB – Partenstein",
      "type": "Registerbekanntmachung nach dem Umwandlungsgesetz",
      "state": "Bayern",
      "amtsgericht": "Amtsgericht Würzburg",
      "registernummer": "PR 87",
      "registerart": "PR",
      "company_name": "Dr. Staub & Partner Steuerberatungsgesellschaft mbB",
      "company_seat": "Partenstein",
      "details": "19.11.2025 (Bekanntmachungsdatum)\n\nBayern Amtsgericht Würzburg PR 87\nRegisterbekanntmachung nach dem Umwandlungsgesetz 18.11.2025 (Eintragungsdatum)\n\nDr. Staub & Partner Steuerberatungsgesellschaft mbB\nPartnerschaftsgesellschaft\nPartenstein\n\nDen Gläubigern des formwechselnden Rechtsträgers ist, wenn sie binnen sechs Monaten nach dem Tag, an dem die Eintragung des Formwechsels nach § 201 UmwG als bekannt gemacht gilt, ihren Anspruch nach Grund und Höhe in Textform anmelden, Sicherheit zu leisten, soweit sie nicht Befriedigung verlangen können. Dieses Recht steht den Gläubigern jedoch nur zu, wenn sie glaubhaft machen, dass durch den Formwechsel die Erfüllung ihrer Forderung gefährdet wird."
    },
    {
      "date": "2025-11-19",
      "id": "137717",
      "original_text": "Löschungsankündigung\nBayern Amtsgericht München HRB 249001\nnyxmo LAB GmbH – München",
      "type": "Löschungsankündigung",
      "state": "Bayern",
      "amtsgericht": "Amtsgericht München",
      "registernummer": "HRB 249001",
      "registerart": "HRB",
      "company_name": "nyxmo LAB GmbH",
      "company_seat": "München",
      "details": "19.11.2025 (Bekanntmachungsdatum)\n\nBayern Amtsgericht München HRB 249001\nLöschungsankündigung 18.11.2025 (Eintragungsdatum)\n\nnyxmo LAB GmbH\nGesellschaft mit beschränkter Haftung\nMünchen\n\nDas Registergericht beabsichtigt, die im Handelsregister eingetragene Gesellschaft wegen Vermögenslosigkeit von Amts wegen nach § 394 FamFG zu löschen. #insert(Text=\"zztb_V_Widerspruchsfrist\")"
    },
    {
      "date": "2025-11-19",
      "id": "137718",
      "original_text": "Registerbekanntmachung nach dem Umwandlungsgesetz\nBayern Amtsgericht Fürth HRB 16523\nIfS Sicherheitstechnik GmbH – Wachenroth",
      "type": "Registerbekanntmachung nach dem Umwandlungsgesetz",
      "state": "Bayern",
      "amtsgericht": "Amtsgericht Fürth",
      "registernummer": "HRB 16523",
      "registerart": "HRB",
      "company_name": "IfS Sicherheitstechnik GmbH",
      "company_seat": "Wachenroth",
      "details": "19.11.2025 (Bekanntmachungsdatum)\n\nBayern Amtsgericht Fürth HRB 16523\nRegisterbekanntmachung nach dem Umwandlungsgesetz 18.11.2025 (Eintragungsdatum)\n\nIfS Sicherheitstechnik GmbH\nGesellschaft mit beschränkter Haftung\nWachenroth\n\nDen Gläubigern der an der Verschmelzung beteiligten Rechtsträger ist, wenn sie binnen sechs Monaten nach dem Tag, an dem die Eintragung der Verschmelzung in das Register des Sitzes desjenigen Rechtsträgers, dessen Gläubiger sie sind, nach § 19 Abs. 3 UmwG als bekannt gemacht gilt, ihren Anspruch nach Grund und Höhe in Textform anmelden, Sicherheit zu leisten, soweit sie nicht Befriedigung verlangen können. Dieses Recht steht den Gläubigern jedoch nur zu, wenn sie glaubhaft machen, dass durch die Verschmelzung die Erfüllung ihrer Forderung gefährdet wird."
    },
    {
      "date": "2025-11-19",
      "id": "137719",
      "original_text": "Löschungsankündigung\nBayern Amtsgericht München HRB 219571\nPEAMO GmbH – Dachau",
      "type": "Löschungsankündigung",
      "state": "Bayern",
      "amtsgericht": "Amtsgericht München",
      "registernummer": "HRB 219571",
      "registerart": "HRB",
      "company_name": "PEAMO GmbH",
      "company_seat": "Dachau",
      "details": "19.11.2025 (Bekanntmachungsdatum)\n\nBayern Amtsgericht München HRB 219571\nLöschungsankündigung\n\nPEAMO GmbH\nGesellschaft mit beschränkter Haftung\nDachau\n\nDas Registergericht beabsichtigt, die im Handelsregister eingetragene Gesellschaft wegen Vermögenslosigkeit von Amts wegen nach § 394 FamFG zu löschen. Die Frist zur Erhebung eines Widerspruchs ist auf drei Monate festgesetzt."
    },
    {
      "date": "2025-11-19",
      "id": "137720",
      "original_text": "Registerbekanntmachung nach dem Umwandlungsgesetz\nBayern Amtsgericht München HRB 289218\nWagawin Europe GmbH – München",
      "type": "Registerbekanntmachung nach dem Umwandlungsgesetz",
      "state": "Bayern",
      "amtsgericht": "Amtsgericht München",
      "registernummer": "HRB 289218",
      "registerart": "HRB",
      "company_name": "Wagawin Europe GmbH",
      "company_seat": "München",
      "details": "19.11.2025 (Bekanntmachungsdatum)\n\nBayern Amtsgericht München HRB 289218\nRegisterbekanntmachung nach dem Umwandlungsgesetz 18.11.2025 (Eintragungsdatum)\n\nWagawin Europe GmbH\nGesellschaft mit beschränkter Haftung\nMünchen\n\nDen Gläubigern der an der Verschmelzung beteiligten Rechtsträger ist, wenn sie binnen sechs Monaten nach dem Tag, an dem die Eintragung der Verschmelzung in das Register des Sitzes desjenigen Rechtsträgers, dessen Gläubiger sie sind, nach § 19 Abs. 3 UmwG als bekannt gemacht gilt, ihren Anspruch nach Grund und Höhe in Textform anmelden, Sicherheit zu leisten, soweit sie nicht Befriedigung verlangen können. Dieses Recht steht den Gläubigern jedoch nur zu, wenn sie glaubhaft machen, dass durch die Verschmelzung die Erfüllung ihrer Forderung gefährdet wird."
    },
    {
      "date": "2025-11-19",
      "id": "137721",
      "original_text": "Registerbekanntmachung nach dem Umwandlungsgesetz\nBayern Amtsgericht Weiden i. d. OPf. HRA 3326\nAlla Scharnagl Dolmetscher- und Übersetzungsbüro e.K. – Wiesau",
      "type": "Registerbekanntmachung nach dem Umwandlungsgesetz",
      "state": "Bayern",
      "amtsgericht": "Amtsgericht Weiden i. d. OPf.",
      "registernummer": "HRA 3326",
      "registerart": "HRA",
      "company_name": "Alla Scharnagl Dolmetscher- und Übersetzungsbüro e.K.",
      "company_seat": "Wiesau",
      "details": "19.11.2025 (Bekanntmachungsdatum)\n\nBayern Amtsgericht Weiden i. d. OPf. HRA 3326\nRegisterbekanntmachung nach dem Umwandlungsgesetz 18.11.2025 (Eintragungsdatum)\n\nAlla Scharnagl Dolmetscher- und Übersetzungsbüro e.K.\nEinzelkaufmann / Einzelkauffrau\nWiesau\n\nDen Gläubigern der an der Ausgliederung beteiligten Rechtsträger ist, wenn sie binnen sechs Monaten nach dem Tag, an dem die Eintragung der Ausgliederung in das Register des Sitzes desjenigen Rechtsträgers, dessen Gläubiger sie sind, nach §§ 125, 19 Abs. 3 UmwG als bekannt gemacht gilt, ihren Anspruch nach Grund und Höhe in Textform anmelden, Sicherheit zu leisten, soweit sie nicht Befriedigung verlangen können. Dieses Recht steht den Gläubigern jedoch nur zu, wenn sie glaubhaft machen, dass durch die Ausgliederung die Erfüllung ihrer Forderung gefährdet wird."
    },
    {
      "date": "2025-11-19",
      "id": "137722",
      "original_text": "Registerbekanntmachung nach dem Umwandlungsgesetz\nBayern Amtsgericht München HRB 275632\nintegernsee design + interior GmbH – Gmund a.Tegernsee",
      "type": "Registerbekanntmachung nach dem Umwandlungsgesetz",
      "state": "Bayern",
      "amtsgericht": "Amtsgericht München",
      "registernummer": "HRB 275632",
      "registerart": "HRB",
      "company_name": "integernsee design + interior GmbH",
      "company_seat": "Gmund a.Tegernsee",
      "details": "19.11.2025 (Bekanntmachungsdatum)\n\nBayern Amtsgericht München HRB 275632\nRegisterbekanntmachung nach dem Umwandlungsgesetz 18.11.2025 (Eintragungsdatum)\n\nintegernsee design + interior GmbH\nGesellschaft mit beschränkter Haftung\nGmund a.Tegernsee\n\nDen Gläubigern der an der Verschmelzung beteiligten Rechtsträger ist, wenn sie binnen sechs Monaten nach dem Tag, an dem die Eintragung der Verschmelzung in das Register des Sitzes desjenigen Rechtsträgers, dessen Gläubiger sie sind, nach § 19 Abs. 3 UmwG als bekannt gemacht gilt, ihren Anspruch nach Grund und Höhe in Textform anmelden, Sicherheit zu leisten, soweit sie nicht Befriedigung verlangen können. Dieses Recht steht den Gläubigern jedoch nur zu, wenn sie glaubhaft machen, dass durch die Verschmelzung die Erfüllung ihrer Forderung gefährdet wird."
    },
    {
      "date": "2025-11-19",
      "id": "137723",
      "original_text": "Registerbekanntmachung nach dem Umwandlungsgesetz\nBayern Amtsgericht München HRB 303343\nMentex GmbH – München",
      "type": "Registerbekanntmachung nach dem Umwandlungsgesetz",
      "state": "Bayern",
      "amtsgericht": "Amtsgericht München",
      "registernummer": "HRB 303343",
      "registerart": "HRB",
      "company_name": "Mentex GmbH",
      "company_seat": "München",
      "details": "19.11.2025 (Bekanntmachungsdatum)\n\nBayern Amtsgericht München HRB 303343\nRegisterbekanntmachung nach dem Umwandlungsgesetz 18.11.2025 (Eintragungsdatum)\n\nMentex GmbH\nGesellschaft mit beschränkter Haftung\nMünchen\n\nDen Gläubigern der an der Verschmelzung beteiligten Rechtsträger ist, wenn sie binnen sechs Monaten nach dem Tag, an dem die Eintragung der Verschmelzung in das Register des Sitzes desjenigen Rechtsträgers, dessen Gläubiger sie sind, nach § 19 Abs. 3 UmwG als bekannt gemacht gilt, ihren Anspruch nach Grund und Höhe in Textform anmelden, Sicherheit zu leisten, soweit sie nicht Befriedigung verlangen können. Dieses Recht steht den Gläubigern jedoch nur zu, wenn sie glaubhaft machen, dass durch die Verschmelzung die Erfüllung ihrer Forderung gefährdet wird."
    },
    {
      "date": "2025-11-19",
      "id": "137724",
      "original_text": "Löschungsankündigung\nBayern Amtsgericht Kempten (Allgäu) HRB 14657\nfine-art Möbeldesign Inneneinrichtung GmbH – Oy-Mittelberg",
      "type": "Löschungsankündigung",
      "state": "Bayern",
      "amtsgericht": "Amtsgericht Kempten (Allgäu)",
      "registernummer": "HRB 14657",
      "registerart": "HRB",
      "company_name": "fine-art Möbeldesign Inneneinrichtung GmbH",
      "company_seat": "Oy-Mittelberg",
      "details": "19.11.2025 (Bekanntmachungsdatum)\n\nBayern Amtsgericht Kempten (Allgäu) HRB 14657\nLöschungsankündigung\n\nfine-art Möbeldesign Inneneinrichtung GmbH\nGesellschaft mit beschränkter Haftung\nOy-Mittelberg\n\nDas Registergericht beabsichtigt, die im Handelsregister eingetragene Gesellschaft wegen Vermögenslosigkeit von Amts wegen nach § 394 FamFG zu löschen. Die Frist zur Erhebung eines Widerspruchs ist auf einen Monat festgesetzt."
    },
    {
      "date": "2025-11-19",
      "id": "137725",
      "original_text": "Registerbekanntmachung nach dem Umwandlungsgesetz\nBayern Amtsgericht München HRB 146571\neconomy-control GmbH – Geretsried",
      "type": "Registerbekanntmachung nach dem Umwandlungsgesetz",
      "state": "Bayern",
      "amtsgericht": "Amtsgericht München",
      "registernummer": "HRB 146571",
      "registerart": "HRB",
      "company_name": "economy-control GmbH",
      "company_seat": "Geretsried",
      "details": "19.11.2025 (Bekanntmachungsdatum)\n\nBayern Amtsgericht München HRB 146571\nRegisterbekanntmachung nach dem Umwandlungsgesetz 18.11.2025 (Eintragungsdatum)\n\neconomy-control GmbH\nGesellschaft mit beschränkter Haftung\nGeretsried\n\nDen Gläubigern der an der Verschmelzung beteiligten Rechtsträger ist, wenn sie binnen sechs Monaten nach dem Tag, an dem die Eintragung der Verschmelzung in das Register des Sitzes desjenigen Rechtsträgers, dessen Gläubiger sie sind, nach § 19 Abs. 3 UmwG als bekannt gemacht gilt, ihren Anspruch nach Grund und Höhe in Textform anmelden, Sicherheit zu leisten, soweit sie nicht Befriedigung verlangen können. Dieses Recht steht den Gläubigern jedoch nur zu, wenn sie glaubhaft machen, dass durch die Verschmelzung die Erfüllung ihrer Forderung gefährdet wird."
    },
    {
      "date": "2025-11-19",
      "id": "137726",
      "original_text": "Registerbekanntmachung nach dem Umwandlungsgesetz\nBayern Amtsgericht Regensburg HRB 8847\nBachner Green Energy GmbH – Mainburg",
      "type": "Registerbekanntmachung nach dem Umwandlungsgesetz",
      "state": "Bayern",
      "amtsgericht": "Amtsgericht Regensburg",
      "registernummer": "HRB 8847",
      "registerart": "HRB",
      "company_name": "Bachner Green Energy GmbH",
      "company_seat": "Mainburg",
      "details": "19.11.2025 (Bekanntmachungsdatum)\n\nBayern Amtsgericht Regensburg HRB 8847\nRegisterbekanntmachung nach dem Umwandlungsgesetz 18.11.2025 (Eintragungsdatum)\n\nBachner Green Energy GmbH\nGesellschaft mit beschränkter Haftung\nMainburg\n\nDen Gläubigern der an der Verschmelzung beteiligten Rechtsträger ist, wenn sie binnen sechs Monaten nach dem Tag, an dem die Eintragung der Verschmelzung in das Register des Sitzes desjenigen Rechtsträgers, dessen Gläubiger sie sind, nach § 19 Abs. 3 UmwG als bekannt gemacht gilt, ihren Anspruch nach Grund und Höhe in Textform anmelden, Sicherheit zu leisten, soweit sie nicht Befriedigung verlangen können. Dieses Recht steht den Gläubigern jedoch nur zu, wenn sie glaubhaft machen, dass durch die Verschmelzung die Erfüllung ihrer Forderung gefährdet wird."
    },
    {
      "date": "2025-11-19",
      "id": "137727",
      "original_text": "Registerbekanntmachung nach dem Umwandlungsgesetz\nBayern Amtsgericht Fürth HRB 11941\nIfS Engineering GmbH – Wachenroth",
      "type": "Registerbekanntmachung nach dem Umwandlungsgesetz",
      "state": "Bayern",
      "amtsgericht": "Amtsgericht Fürth",
      "registernummer": "HRB 11941",
      "registerart": "HRB",
      "company_name": "IfS Engineering GmbH",
      "company_seat": "Wachenroth",
      "details": "19.11.2025 (Bekanntmachungsdatum)\n\nBayern Amtsgericht Fürth HRB 11941\nRegisterbekanntmachung nach dem Umwandlungsgesetz 18.11.2025 (Eintragungsdatum)\n\nIfS Engineering GmbH\nGesellschaft mit beschränkter Haftung\nWachenroth\n\nDen Gläubigern der an der Verschmelzung beteiligten Rechtsträger ist, wenn sie binnen sechs Monaten nach dem Tag, an dem die Eintragung der Verschmelzung in das Register des Sitzes desjenigen Rechtsträgers, dessen Gläubiger sie sind, nach § 19 Abs. 3 UmwG als bekannt gemacht gilt, ihren Anspruch nach Grund und Höhe in Textform anmelden, Sicherheit zu leisten, soweit sie nicht Befriedigung verlangen können. Dieses Recht steht den Gläubigern jedoch nur zu, wenn sie glaubhaft machen, dass durch die Verschmelzung die Erfüllung ihrer Forderung gefährdet wird."
    },
    {
      "date": "2025-11-19",
      "id": "137728",
      "original_text": "Registerbekanntmachung nach dem Umwandlungsgesetz\nBayern Amtsgericht Ingolstadt HRB 12608\nmobil.store GmbH – Neuburg a. d. Donau",
      "type": "Registerbekanntmachung nach dem Umwandlungsgesetz",
      "state": "Bayern",
      "amtsgericht": "Amtsgericht Ingolstadt",
      "registernummer": "HRB 12608",
      "registerart": "HRB",
      "company_name": "mobil.store GmbH",
      "company_seat": "Neuburg a. d. Donau",
      "details": "19.11.2025 (Bekanntmachungsdatum)\n\nBayern Amtsgericht Ingolstadt HRB 12608\nRegisterbekanntmachung nach dem Umwandlungsgesetz 18.11.2025 (Eintragungsdatum)\n\nmobil.store GmbH\nGesellschaft mit beschränkter Haftung\nNeuburg a. d. Donau\n\nDen Gläubigern des formwechselnden Rechtsträgers ist, wenn sie binnen sechs Monaten nach dem Tag, an dem die Eintragung des Formwechsels nach § 201 UmwG als bekannt gemacht gilt, ihren Anspruch nach Grund und Höhe in Textform anmelden, Sicherheit zu leisten, soweit sie nicht Befriedigung verlangen können. Dieses Recht steht den Gläubigern jedoch nur zu, wenn sie glaubhaft machen, dass durch den Formwechsel die Erfüllung ihrer Forderung gefährdet wird."
    },
    {
      "date": "2025-11-19",
      "id": "137729",
      "original_text": "Sonstige Registerbekanntmachung\nBayern Amtsgericht München HRB 264451\nSchön Klinik SE – München",
      "type": "Sonstige Registerbekanntmachung",
      "state": "Bayern",
      "amtsgericht": "Amtsgericht München",
      "registernummer": "HRB 264451",
      "registerart": "HRB",
      "company_name": "Schön Klinik SE",
      "company_seat": "München",
      "details": "19.11.2025 (Bekanntmachungsdatum)\n\nBayern Amtsgericht München HRB 264451\nSonstige Registerbekanntmachung 18.11.2025 (Eintragungsdatum)\n\nSchön Klinik SE\nEuropäische Aktiengesellschaft (SE)\nMünchen\n\nDen Gläubigern der Gesellschaft, deren Forderungen begründet worden sind, bevor die Eintragung des Beschlusses bekanntgemacht worden ist, ist, wenn sie sich binnen sechs Monaten nach der Bekanntmachung zu diesem Zweck melden, Sicherheit zu leisten, soweit sie nicht Befriedigung verlangen können. Das Recht, Sicherheitsleistung zu verlangen, steht Gläubigern nicht zu, die im Fall des Insolvenzverfahrens ein Recht auf vorzugsweise Befriedigung aus einer Deckungsmasse haben, die nach gesetzlicher Vorschrift zu ihrem Schutz errichtet und staatlich überwacht ist."
    },
    {
      "date": "2025-11-19",
      "id": "137730",
      "original_text": "Registerbekanntmachung nach dem Umwandlungsgesetz\nBayern Amtsgericht Landshut HRB 9029\nCSP IT-Business GmbH – Pilsting",
      "type": "Registerbekanntmachung nach dem Umwandlungsgesetz",
      "state": "Bayern",
      "amtsgericht": "Amtsgericht Landshut",
      "registernummer": "HRB 9029",
      "registerart": "HRB",
      "company_name": "CSP IT-Business GmbH",
      "company_seat": "Pilsting",
      "details": "19.11.2025 (Bekanntmachungsdatum)\n\nBayern Amtsgericht Landshut HRB 9029\nRegisterbekanntmachung nach dem Umwandlungsgesetz 18.11.2025 (Eintragungsdatum)\n\nCSP IT-Business GmbH\nGesellschaft mit beschränkter Haftung\nPilsting\n\nDen Gläubigern der an der Verschmelzung beteiligten Rechtsträger ist, wenn sie binnen sechs Monaten nach dem Tag, an dem die Eintragung der Verschmelzung in das Register des Sitzes desjenigen Rechtsträgers, dessen Gläubiger sie sind, nach § 19 Abs. 3 UmwG als bekannt gemacht gilt, ihren Anspruch nach Grund und Höhe in Textform anmelden, Sicherheit zu leisten, soweit sie nicht Befriedigung verlangen können. Dieses Recht steht den Gläubigern jedoch nur zu, wenn sie glaubhaft machen, dass durch die Verschmelzung die Erfüllung ihrer Forderung gefährdet wird."
    },
    {
      "date": "2025-11-19",
      "id": "137731",
      "original_text": "Löschungsankündigung\nBayern Amtsgericht München HRB 255617\nILMANN Verputz & Sanierung GmbH – Planegg",
      "type": "Löschungsankündigung",
      "state": "Bayern",
      "amtsgericht": "Amtsgericht München",
      "registernummer": "HRB 255617",
      "registerart": "HRB",
      "company_name": "ILMANN Verputz & Sanierung GmbH",
      "company_seat": "Planegg",
      "details": "19.11.2025 (Bekanntmachungsdatum)\n\nBayern Amtsgericht München HRB 255617\nLöschungsankündigung 18.11.2025 (Eintragungsdatum)\n\nILMANN Verputz & Sanierung GmbH\nGesellschaft mit beschränkter Haftung\nPlanegg\n\nDas Registergericht beabsichtigt, die im Handelsregister eingetragene Gesellschaft wegen Vermögenslosigkeit von Amts wegen nach § 394 FamFG zu löschen. Die Frist zur Erhebung eines Widerspruchs ist auf drei Monate festgesetzt."
    },
    {
      "date": "2025-11-19",
      "id": "137732",
      "original_text": "Einreichung neuer Dokumente\nBayern Amtsgericht München HRB 297229\nFirst Capital AG – München",
      "type": "Einreichung neuer Dokumente",
      "state": "Bayern",
      "amtsgericht": "Amtsgericht München",
      "registernummer": "HRB 297229",
      "registerart": "HRB",
      "company_name": "First Capital AG",
      "company_seat": "München",
      "details": "19.11.2025 (Bekanntmachungsdatum)\n\nBayern Amtsgericht München HRB 297229\nEinreichung neuer Dokumente 18.11.2025 (Eintragungsdatum)\n\nFirst Capital AG\nAktiengesellschaft\nMünchen\n\nDem Amtsgericht München -Registergericht- ist eine Liste der Mitglieder des Aufsichtsrats eingereicht worden, § 106 AktG."
    },
    {
      "date": "2025-11-19",
      "id": "137733",
      "original_text": "Registerbekanntmachung nach dem Umwandlungsgesetz\nBayern Amtsgericht Regensburg HRB 10856\nSenerTec Center Mainburg GmbH – Mainburg",
      "type": "Registerbekanntmachung nach dem Umwandlungsgesetz",
      "state": "Bayern",
      "amtsgericht": "Amtsgericht Regensburg",
      "registernummer": "HRB 10856",
      "registerart": "HRB",
      "company_name": "SenerTec Center Mainburg GmbH",
      "company_seat": "Mainburg",
      "details": "19.11.2025 (Bekanntmachungsdatum)\n\nBayern Amtsgericht Regensburg HRB 10856\nRegisterbekanntmachung nach dem Umwandlungsgesetz 18.11.2025 (Eintragungsdatum)\n\nSenerTec Center Mainburg GmbH\nGesellschaft mit beschränkter Haftung\nMainburg\n\nDen Gläubigern der an der Verschmelzung beteiligten Rechtsträger ist, wenn sie binnen sechs Monaten nach dem Tag, an dem die Eintragung der Verschmelzung in das Register des Sitzes desjenigen Rechtsträgers, dessen Gläubiger sie sind, nach § 19 Abs. 3 UmwG als bekannt gemacht gilt, ihren Anspruch nach Grund und Höhe in Textform anmelden, Sicherheit zu leisten, soweit sie nicht Befriedigung verlangen können. Dieses Recht steht den Gläubigern jedoch nur zu, wenn sie glaubhaft machen, dass durch die Verschmelzung die Erfüllung ihrer Forderung gefährdet wird."
    },
    {
      "date": "2025-11-19",
      "id": "137734",
      "original_text": "Registerbekanntmachung nach dem Umwandlungsgesetz\nBayern Amtsgericht Ingolstadt GsR 273\nmobil.store eGbR – Neuburg a. d. Donau",
      "type": "Registerbekanntmachung nach dem Umwandlungsgesetz",
      "state": "Bayern",
      "amtsgericht": "Amtsgericht Ingolstadt",
      "registernummer": "GsR 273",
      "registerart": "GsR",
      "company_name": "mobil.store eGbR",
      "company_seat": "Neuburg a. d. Donau",
      "details": "19.11.2025 (Bekanntmachungsdatum)\n\nBayern Amtsgericht Ingolstadt GsR 273\nRegisterbekanntmachung nach dem Umwandlungsgesetz 18.11.2025 (Eintragungsdatum)\n\nmobil.store eGbR\nGesellschaft bürgerlichen Rechts\nNeuburg a. d. Donau\n\nDen Gläubigern des formwechselnden Rechtsträgers ist, wenn sie binnen sechs Monaten nach dem Tag, an dem die Eintragung des Formwechsels nach § 201 UmwG als bekannt gemacht gilt, ihren Anspruch nach Grund und Höhe in Textform anmelden, Sicherheit zu leisten, soweit sie nicht Befriedigung verlangen können. Dieses Recht steht den Gläubigern jedoch nur zu, wenn sie glaubhaft machen, dass durch den Formwechsel die Erfüllung ihrer Forderung gefährdet wird."
    },
    {
      "date": "2025-11-19",
      "id": "137735",
      "original_text": "Registerbekanntmachung nach dem Umwandlungsgesetz\nBayern Amtsgericht Würzburg HRB 18190\nDr. Staub & Kollegen GmbH – Partenstein",
      "type": "Registerbekanntmachung nach dem Umwandlungsgesetz",
      "state": "Bayern",
      "amtsgericht": "Amtsgericht Würzburg",
      "registernummer": "HRB 18190",
      "registerart": "HRB",
      "company_name": "Dr. Staub & Kollegen GmbH",
      "company_seat": "Partenstein",
      "details": "19.11.2025 (Bekanntmachungsdatum)\n\nBayern Amtsgericht Würzburg HRB 18190\nRegisterbekanntmachung nach dem Umwandlungsgesetz 18.11.2025 (Eintragungsdatum)\n\nDr. Staub & Kollegen GmbH\nGesellschaft mit beschränkter Haftung\nPartenstein\n\nDen Gläubigern des formwechselnden Rechtsträgers ist, wenn sie binnen sechs Monaten nach dem Tag, an dem die Eintragung des Formwechsels nach § 201 UmwG als bekannt gemacht gilt, ihren Anspruch nach Grund und Höhe in Textform anmelden, Sicherheit zu leisten, soweit sie nicht Befriedigung verlangen können. Dieses Recht steht den Gläubigern jedoch nur zu, wenn sie glaubhaft machen, dass durch den Formwechsel die Erfüllung ihrer Forderung gefährdet wird."
    },
    {
      "date": "2025-11-19",
      "id": "137736",
      "original_text": "Registerbekanntmachung nach dem Umwandlungsgesetz\nBayern Amtsgericht München HRB 271072\nINVOX V GmbH – München",
      "type": "Registerbekanntmachung nach dem Umwandlungsgesetz",
      "state": "Bayern",
      "amtsgericht": "Amtsgericht München",
      "registernummer": "HRB 271072",
      "registerart": "HRB",
      "company_name": "INVOX V GmbH",
      "company_seat": "München",
      "details": "19.11.2025 (Bekanntmachungsdatum)\n\nBayern Amtsgericht München HRB 271072\nRegisterbekanntmachung nach dem Umwandlungsgesetz 18.11.2025 (Eintragungsdatum)\n\nINVOX V GmbH\nGesellschaft mit beschränkter Haftung\nMünchen\n\nDen Gläubigern der an der Verschmelzung beteiligten Rechtsträger ist, wenn sie binnen sechs Monaten nach dem Tag, an dem die Eintragung der Verschmelzung in das Register des Sitzes desjenigen Rechtsträgers, dessen Gläubiger sie sind, nach § 19 Abs. 3 UmwG als bekannt gemacht gilt, ihren Anspruch nach Grund und Höhe in Textform anmelden, Sicherheit zu leisten, soweit sie nicht Befriedigung verlangen können. Dieses Recht steht den Gläubigern jedoch nur zu, wenn sie glaubhaft machen, dass durch die Verschmelzung die Erfüllung ihrer Forderung gefährdet wird."
    },
    {
      "date": "2025-11-19",
      "id": "137737",
      "original_text": "Löschungsankündigung\nBayern Amtsgericht Amberg HRB 1204\nS-Cargo Lebensmittelgroßhandel GmbH – Schwandorf",
      "type": "Löschungsankündigung",
      "state": "Bayern",
      "amtsgericht": "Amtsgericht Amberg",
      "registernummer": "HRB 1204",
      "registerart": "HRB",
      "company_name": "S-Cargo Lebensmittelgroßhandel GmbH",
      "company_seat": "Schwandorf",
      "details": "19.11.2025 (Bekanntmachungsdatum)\n\nBayern Amtsgericht Amberg HRB 1204\nLöschungsankündigung\n\nS-Cargo Lebensmittelgroßhandel GmbH\nGesellschaft mit beschränkter Haftung\nSchwandorf\n\nDas Registergericht beabsichtigt, die im Handelsregister eingetragene Gesellschaft wegen Vermögenslosigkeit von Amts wegen nach § 394 FamFG zu löschen. Die Frist zur Erhebung eines Widerspruchs ist auf einen Monat festgesetzt."
    },
    {
      "date": "2025-11-19",
      "id": "137738",
      "original_text": "Löschungsankündigung\nBayern Amtsgericht Amberg HRB 4658\nWendl & Willerich GmbH – Amberg",
      "type": "Löschungsankündigung",
      "state": "Bayern",
      "amtsgericht": "Amtsgericht Amberg",
      "registernummer": "HRB 4658",
      "registerart": "HRB",
      "company_name": "Wendl & Willerich GmbH",
      "company_seat": "Amberg",
      "details": "19.11.2025 (Bekanntmachungsdatum)\n\nBayern Amtsgericht Amberg HRB 4658\nLöschungsankündigung\n\nWendl & Willerich GmbH\nGesellschaft mit beschränkter Haftung\nAmberg\n\nDas Registergericht beabsichtigt, die im Handelsregister eingetragene Gesellschaft wegen Vermögenslosigkeit von Amts wegen nach § 394 FamFG zu löschen. Die Frist zur Erhebung eines Widerspruchs ist auf einen Monat festgesetzt."
    },
    {
      "date": "2025-11-19",
      "id": "137739",
      "original_text": "Registerbekanntmachung nach dem Umwandlungsgesetz\nBayern Amtsgericht München HRB 256336\nRCP Group GmbH – München",
      "type": "Registerbekanntmachung nach dem Umwandlungsgesetz",
      "state": "Bayern",
      "amtsgericht": "Amtsgericht München",
      "registernummer": "HRB 256336",
      "registerart": "HRB",
      "company_name": "RCP Group GmbH",
      "company_seat": "München",
      "details": "19.11.2025 (Bekanntmachungsdatum)\n\nBayern Amtsgericht München HRB 256336\nRegisterbekanntmachung nach dem Umwandlungsgesetz 18.11.2025 (Eintragungsdatum)\n\nRCP Group GmbH\nGesellschaft mit beschränkter Haftung\nMünchen\n\nDen Gläubigern der an der Verschmelzung beteiligten Rechtsträger ist, wenn sie binnen sechs Monaten nach dem Tag, an dem die Eintragung der Verschmelzung in das Register des Sitzes desjenigen Rechtsträgers, dessen Gläubiger sie sind, nach § 19 Abs. 3 UmwG als bekannt gemacht gilt, ihren Anspruch nach Grund und Höhe in Textform anmelden, Sicherheit zu leisten, soweit sie nicht Befriedigung verlangen können. Dieses Recht steht den Gläubigern jedoch nur zu, wenn sie glaubhaft machen, dass durch die Verschmelzung die Erfüllung ihrer Forderung gefährdet wird."
    },
    {
      "date": "2025-11-19",
      "id": "137740",
      "original_text": "Löschungsankündigung\nBaden-Württemberg Amtsgericht Ulm HRB 738572\nHYENSYS GmbH – Eriskirch",
      "type": "Löschungsankündigung",
      "state": "Baden-Württemberg",
      "amtsgericht": "Amtsgericht Ulm",
      "registernummer": "HRB 738572",
      "registerart": "HRB",
      "company_name": "HYENSYS GmbH",
      "company_seat": "Eriskirch",
      "details": "19.11.2025 (Bekanntmachungsdatum)\n\nBaden-Württemberg Amtsgericht Ulm HRB 738572\nLöschungsankündigung\n\nHYENSYS GmbH\nGesellschaft mit beschränkter Haftung\nEriskirch\n\nDas Gericht beabsichtigt, die Gesellschaft wegen Vermögenslosigkeit im Handelsregister von Amts wegen nach § 394 FamFG zu löschen. Die Frist zur Geltendmachung eines Widerspruchs gegen die beabsichtigte Löschung ist auf  einen Monat ab Veröffentlichung bestimmt."
    },
    {
      "date": "2025-11-19",
      "id": "137741",
      "original_text": "Einreichung neuer Dokumente\nBerlin Amtsgericht Berlin (Charlottenburg) HRB 275254\nAUTOLAND Verwaltungs SE – Berlin",
      "type": "Einreichung neuer Dokumente",
      "state": "Berlin",
      "amtsgericht": "Amtsgericht Berlin (Charlottenburg)",
      "registernummer": "HRB 275254",
      "registerart": "HRB",
      "company_name": "AUTOLAND Verwaltungs SE",
      "company_seat": "Berlin",
      "details": "19.11.2025 (Bekanntmachungsdatum)\n\nBerlin Amtsgericht Berlin (Charlottenburg) HRB 275254\nEinreichung neuer Dokumente\n\nAUTOLAND Verwaltungs SE\nEuropäische Aktiengesellschaft (SE)\nBerlin\n\nAls nicht eingetragen wird veröffentlicht: Es wurde eine neue Liste der Aufsichtsratsmitglieder eingereicht (§ 106 AktG)."
    },
    {
      "date": "2025-11-19",
      "id": "137742",
      "original_text": "Einreichung neuer Dokumente\nBaden-Württemberg Amtsgericht Mannheim HRB 741455\ntrans-o-flex Express GmbH & Co. KGaA – Weinheim",
      "type": "Einreichung neuer Dokumente",
      "state": "Baden-Württemberg",
      "amtsgericht": "Amtsgericht Mannheim",
      "registernummer": "HRB 741455",
      "registerart": "HRB",
      "company_name": "trans-o-flex Express GmbH & Co. KGaA",
      "company_seat": "Weinheim",
      "details": "19.11.2025 (Bekanntmachungsdatum)\n\nBaden-Württemberg Amtsgericht Mannheim HRB 741455\nEinreichung neuer Dokumente\n\ntrans-o-flex Express GmbH & Co. KGaA\nKommanditgesellschaft auf Aktien\nWeinheim\n\nDie Gesellschaft hat am 31.10.2025 das Hauptversammlungsprotokoll vom 29.10.2025 und am 18.11.2025 die Liste über die Zusammensetzung des Aufsichtsrats zum Handelsregister eingereicht."
    },
    {
      "date": "2025-11-19",
      "id": "137743",
      "original_text": "Registerbekanntmachung nach dem Umwandlungsgesetz\nBerlin Amtsgericht Berlin (Charlottenburg) HRB 281354\nFB 43 Grundbesitz GmbH – Berlin",
      "type": "Registerbekanntmachung nach dem Umwandlungsgesetz",
      "state": "Berlin",
      "amtsgericht": "Amtsgericht Berlin (Charlottenburg)",
      "registernummer": "HRB 281354",
      "registerart": "HRB",
      "company_name": "FB 43 Grundbesitz GmbH",
      "company_seat": "Berlin",
      "details": "19.11.2025 (Bekanntmachungsdatum)\n\nBerlin Amtsgericht Berlin (Charlottenburg) HRB 281354\nRegisterbekanntmachung nach dem Umwandlungsgesetz 18.11.2025 (Eintragungsdatum)\n\nFB 43 Grundbesitz GmbH\nGesellschaft mit beschränkter Haftung\nBerlin\n\nZu Eintragungsnummer 1 vom 18.11.2025 wird als nicht eingetragen veröffentlicht: Den Gläubigern ist, wenn sie binnen sechs Monaten nach dem Tag, an dem die Eintragung der Umwandlung als bekannt gemacht gilt, ihren Anspruch nach Grund und Höhe schriftlich anmelden, Sicherheit zu leisten, soweit sie nicht Befriedigung verlangen können. Dieses Recht steht den Gläubigern jedoch nur zu, wenn sie glaubhaft machen, dass durch die Umwandlung die Erfüllung ihrer Forderung gefährdet wird. Das Recht, Sicherheitsleistung zu verlangen, steht Gläubigern nicht zu, die im Falle der Insolvenz ein Recht auf vorzugsweise Befriedigung aus einer Deckungsmasse haben, die nach gesetzlicher Vorschrift zu ihrem Schutz errichtet und staatlich überwacht ist."
    },
    {
      "date": "2025-11-19",
      "id": "137744",
      "original_text": "Registerbekanntmachung nach dem Umwandlungsgesetz\nHamburg Amtsgericht Hamburg HRB 136117\nFikensolt GmbH – Hamburg",
      "type": "Registerbekanntmachung nach dem Umwandlungsgesetz",
      "state": "Hamburg",
      "amtsgericht": "Amtsgericht Hamburg",
      "registernummer": "HRB 136117",
      "registerart": "HRB",
      "company_name": "Fikensolt GmbH",
      "company_seat": "Hamburg",
      "details": "19.11.2025 (Bekanntmachungsdatum)\n\nHamburg Amtsgericht Hamburg HRB 136117\nRegisterbekanntmachung nach dem Umwandlungsgesetz 19.11.2025 (Eintragungsdatum)\n\nFikensolt GmbH\nGesellschaft mit beschränkter Haftung\nHamburg\n\nAls nicht eingetragen wird bekannt gemacht:\nDen Gläubigern der an der Abspaltung beteiligten Gesellschaften ist, wenn sie binnen sechs Monaten nach dem Tag, an dem die Eintragung der Abspaltung in das Register des Sitzes desjenigen Rechtsträgers, dessen Gläubiger sie sind, nach § 19 Absatz 3 UmwG als bekannt gemacht gilt, ihren Anspruch nach Grund und Höhe schriftlich anmelden, Sicherheit zu leisten, soweit sie nicht Befriedigung verlangen können. Dieses Recht steht den Gläubigern jedoch nur zu, wenn sie glaubhaft machen, dass durch die Abspaltung die Erfüllung ihrer Forderung gefährdet wird."
    },
    {
      "date": "2025-11-19",
      "id": "137745",
      "original_text": "Löschungsankündigung\nBerlin Amtsgericht Berlin (Charlottenburg) HRB 269334\nMJD Service GmbH – Berlin",
      "type": "Löschungsankündigung",
      "state": "Berlin",
      "amtsgericht": "Amtsgericht Berlin (Charlottenburg)",
      "registernummer": "HRB 269334",
      "registerart": "HRB",
      "company_name": "MJD Service GmbH",
      "company_seat": "Berlin",
      "details": "19.11.2025 (Bekanntmachungsdatum)\n\nBerlin Amtsgericht Berlin (Charlottenburg) HRB 269334\nLöschungsankündigung\n\nMJD Service GmbH\nGesellschaft mit beschränkter Haftung\nBerlin\n\nBei der nachstehenden Gesellschaft wird das Amtslöschungsverfahren gemäß § 394 FamFG eingeleitet. Widerspruchsfrist 6 Wochen"
    },
    {
      "date": "2025-11-19",
      "id": "137746",
      "original_text": "Löschungsankündigung\nBerlin Amtsgericht Berlin (Charlottenburg) HRB 176310\nGatterfel GmbH – Berlin",
      "type": "Löschungsankündigung",
      "state": "Berlin",
      "amtsgericht": "Amtsgericht Berlin (Charlottenburg)",
      "registernummer": "HRB 176310",
      "registerart": "HRB",
      "company_name": "Gatterfel GmbH",
      "company_seat": "Berlin",
      "details": "19.11.2025 (Bekanntmachungsdatum)\n\nBerlin Amtsgericht Berlin (Charlottenburg) HRB 176310\nLöschungsankündigung\n\nGatterfel GmbH\nGesellschaft mit beschränkter Haftung\nBerlin\n\nBei der nachstehenden Gesellschaft wird das Amtslöschungsverfahren gemäß § 394 FamFG eingeleitet. Widerspruchsfrist 6 Wochen"
    },
    {
      "date": "2025-11-19",
      "id": "137747",
      "original_text": "Löschungsankündigung\nBerlin Amtsgericht Berlin (Charlottenburg) HRB 147553\nYaka Früchte Großhandel GmbH – Berlin",
      "type": "Löschungsankündigung",
      "state": "Berlin",
      "amtsgericht": "Amtsgericht Berlin (Charlottenburg)",
      "registernummer": "HRB 147553",
      "registerart": "HRB",
      "company_name": "Yaka Früchte Großhandel GmbH",
      "company_seat": "Berlin",
      "details": "19.11.2025 (Bekanntmachungsdatum)\n\nBerlin Amtsgericht Berlin (Charlottenburg) HRB 147553\nLöschungsankündigung\n\nYaka Früchte Großhandel GmbH\nGesellschaft mit beschränkter Haftung\nBerlin\n\nBei der nachstehenden Gesellschaft wird das Amtslöschungsverfahren gemäß § 394 FamFG eingeleitet. Widerspruchsfrist 6 Wochen"
    },
    {
      "date": "2025-11-19",
      "id": "137748",
      "original_text": "Löschungsankündigung\nBerlin Amtsgericht Berlin (Charlottenburg) HRB 133252\nJobrent POD Personalmanagement Verwaltung GmbH – Berlin",
      "type": "Löschungsankündigung",
      "state": "Berlin",
      "amtsgericht": "Amtsgericht Berlin (Charlottenburg)",
      "registernummer": "HRB 133252",
      "registerart": "HRB",
      "company_name": "Jobrent POD Personalmanagement Verwaltung GmbH",
      "company_seat": "Berlin",
      "details": "19.11.2025 (Bekanntmachungsdatum)\n\nBerlin Amtsgericht Berlin (Charlottenburg) HRB 133252\nLöschungsankündigung\n\nJobrent POD Personalmanagement Verwaltung GmbH\nGesellschaft mit beschränkter Haftung\nBerlin\n\nBei der nachstehenden Gesellschaft wird das Amtslöschungsverfahren gemäß § 394 FamFG eingeleitet. Widerspruchsfrist 6 Wochen"
    },
    {
      "date": "2025-11-19",
      "id": "137749",
      "original_text": "Löschungsankündigung\nBaden-Württemberg Amtsgericht Stuttgart HRB 726667\nSputnik Engineering GmbH – Stuttgart",
      "type": "Löschungsankündigung",
      "state": "Baden-Württemberg",
      "amtsgericht": "Amtsgericht Stuttgart",
      "registernummer": "HRB 726667",
      "registerart": "HRB",
      "company_name": "Sputnik Engineering GmbH",
      "company_seat": "Stuttgart",
      "details": "19.11.2025 (Bekanntmachungsdatum)\n\nBaden-Württemberg Amtsgericht Stuttgart HRB 726667\nLöschungsankündigung\n\nSputnik Engineering GmbH\nGesellschaft mit beschränkter Haftung\nStuttgart\n\nDas Gericht beabsichtigt, die Gesellschaft wegen Vermögenslosigkeit im Handelsregister von Amts wegen nach § 394 FamFG zu löschen. Die Frist zur Geltendmachung eines Widerspruchs gegen die beabsichtigte Löschung ist auf zwei Monate ab Veröffentlichung bestimmt."
    },
    {
      "date": "2025-11-19",
      "id": "137750",
      "original_text": "Einreichung neuer Dokumente\nBaden-Württemberg Amtsgericht Freiburg HRB 290017\nLAGERHAUS BREISACH GMBH – Breisach am Rhein",
      "type": "Einreichung neuer Dokumente",
      "state": "Baden-Württemberg",
      "amtsgericht": "Amtsgericht Freiburg",
      "registernummer": "HRB 290017",
      "registerart": "HRB",
      "company_name": "LAGERHAUS BREISACH GMBH",
      "company_seat": "Breisach am Rhein",
      "details": "19.11.2025 (Bekanntmachungsdatum)\n\nBaden-Württemberg Amtsgericht Freiburg HRB 290017\nEinreichung neuer Dokumente\n\nLAGERHAUS BREISACH GMBH\nGesellschaft mit beschränkter Haftung\nBreisach am Rhein\n\nAls nicht eingetragen wird bekanntgemacht:\nDie Gesellschaft hat am 13.11.2025 die Liste über die Zusammensetzung des Aufsichtsrats zum Handelsregister eingereicht."
    },
    {
      "date": "2025-11-19",
      "id": "137751",
      "original_text": "Registerbekanntmachung nach dem Umwandlungsgesetz\nMecklenburg-Vorpommern Amtsgericht Rostock HRB 11899\nADCO Glass International GmbH – Broderstorf",
      "type": "Registerbekanntmachung nach dem Umwandlungsgesetz",
      "state": "Mecklenburg-Vorpommern",
      "amtsgericht": "Amtsgericht Rostock",
      "registernummer": "HRB 11899",
      "registerart": "HRB",
      "company_name": "ADCO Glass International GmbH",
      "company_seat": "Broderstorf",
      "details": "19.11.2025 (Bekanntmachungsdatum)\n\nMecklenburg-Vorpommern Amtsgericht Rostock HRB 11899\nRegisterbekanntmachung nach dem Umwandlungsgesetz 14.11.2025 (Eintragungsdatum)\n\nADCO Glass International GmbH\nGesellschaft mit beschränkter Haftung\nBroderstorf\n\nAls nicht eingetragen wird veröffentlicht: Den Gläubigern der an der Verschmelzung beteiligten Rechtsträger ist, wenn sie binnen sechs Monaten nach dem Tag, an dem die Eintragung der Verschmelzung in das Register des Sitzes desjenigen Rechtsträgers, dessen Gläubiger sie sind, nach § 19 Abs. 3 UmwG als bekannt gemacht gilt,\nihren Anspruch nach Grund und Höhe in Textform anmelden, Sicherheit zu leisten, soweit sie nicht Befriedigung verlangen können. Dieses Recht steht den Gläubigern jedoch nur zu, wenn sie glaubhaft machen, dass durch die Verschmelzung die Erfüllung der Forderung gefährdet wird."
    },
    {
      "date": "2025-11-19",
      "id": "137752",
      "original_text": "Registerbekanntmachung nach dem Umwandlungsgesetz\nMecklenburg-Vorpommern Amtsgericht Rostock HRB 9038\nADCO Technik GmbH – Broderstorf",
      "type": "Registerbekanntmachung nach dem Umwandlungsgesetz",
      "state": "Mecklenburg-Vorpommern",
      "amtsgericht": "Amtsgericht Rostock",
      "registernummer": "HRB 9038",
      "registerart": "HRB",
      "company_name": "ADCO Technik GmbH",
      "company_seat": "Broderstorf",
      "details": "19.11.2025 (Bekanntmachungsdatum)\n\nMecklenburg-Vorpommern Amtsgericht Rostock HRB 9038\nRegisterbekanntmachung nach dem Umwandlungsgesetz 14.11.2025 (Eintragungsdatum)\n\nADCO Technik GmbH\nGesellschaft mit beschränkter Haftung\nBroderstorf\n\nAls nicht eingetragen wird veröffentlicht: Den Gläubigern der an der Verschmelzung beteiligten Rechtsträger ist, wenn sie binnen sechs Monaten nach dem Tag, an dem die Eintragung der Verschmelzung in das Register des Sitzes desjenigen Rechtsträgers, dessen Gläubiger sie sind, nach § 19 Abs. 3 UmwG als bekannt gemacht gilt,\nihren Anspruch nach Grund und Höhe in Textform anmelden, Sicherheit zu leisten, soweit sie nicht Befriedigung verlangen können. Dieses Recht steht den Gläubigern jedoch nur zu, wenn sie glaubhaft machen, dass durch die Verschmelzung die Erfüllung der Forderung gefährdet wird."
    },
    {
      "date": "2025-11-19",
      "id": "137753",
      "original_text": "Registerbekanntmachung nach dem Umwandlungsgesetz\nBaden-Württemberg Amtsgericht Stuttgart HRB 801978\nDr. Stefan Hövel Vermögensverwaltung GmbH – Stuttgart",
      "type": "Registerbekanntmachung nach dem Umwandlungsgesetz",
      "state": "Baden-Württemberg",
      "amtsgericht": "Amtsgericht Stuttgart",
      "registernummer": "HRB 801978",
      "registerart": "HRB",
      "company_name": "Dr. Stefan Hövel Vermögensverwaltung GmbH",
      "company_seat": "Stuttgart",
      "details": "19.11.2025 (Bekanntmachungsdatum)\n\nBaden-Württemberg Amtsgericht Stuttgart HRB 801978\nRegisterbekanntmachung nach dem Umwandlungsgesetz 19.11.2025 (Eintragungsdatum)\n\nDr. Stefan Hövel Vermögensverwaltung GmbH\nGesellschaft mit beschränkter Haftung\nStuttgart\n\nAls nicht eingetragen wird bekanntgemacht:\nDen Gläubigern der an der Abspaltung beteiligten Rechtsträger ist, wenn sie binnen sechs Monaten nach dem Tag, an dem die Eintragung der Abspaltung in das Register des Sitzes desjenigen Rechtsträgers, dessen Gläubiger sie sind, nach § 19 Abs. 3 UmwG als bekanntgemacht gilt, ihren Anspruch nach Grund und Höhe schriftlich anmelden, Sicherheit zu leisten, soweit sie nicht Befriedigung verlangen können. Dieses Recht steht den Gläubigern jedoch nur zu, wenn sie glaubhaft machen, dass durch die Abspaltung die Erfüllung ihrer Forderung gefährdet wird."
    },
    {
      "date": "2025-11-19",
      "id": "137754",
      "original_text": "Sonstige Registerbekanntmachung\nSchleswig-Holstein Amtsgericht Lübeck HRA 8758\nFolien ForYu in Abwicklung UG (haftungsbeschränkt) & Co. KG – Lübeck",
      "type": "Sonstige Registerbekanntmachung",
      "state": "Schleswig-Holstein",
      "amtsgericht": "Amtsgericht Lübeck",
      "registernummer": "HRA 8758",
      "registerart": "HRA",
      "company_name": "Folien ForYu in Abwicklung UG (haftungsbeschränkt) & Co. KG",
      "company_seat": "Lübeck",
      "details": "19.11.2025 (Bekanntmachungsdatum)\n\nSchleswig-Holstein Amtsgericht Lübeck HRA 8758\nSonstige Registerbekanntmachung\n\nFolien ForYu in Abwicklung UG (haftungsbeschränkt) & Co. KG\nKommanditgesellschaft\nLübeck\n\nAls nicht eingetragen wird veröffentlicht:\nHerrn\nTom Dietel, unbekannten Aufenthalts:\n\nSehr geehrter Herr Dietel,\n\nin der Handelsregistersache\nFolien ForYu in Abwicklung UG (haftungsbeschränkt) & Co. KG\nergeben sich aus den mir vorliegenden Unterlagen Anhaltspunkte dafür, dass die\nGesellschaft vermögenslos ist:\nBeschluss des Amtsgerichts Lübeck vom 18.09.2025 über die Aufhebung des\nInsolvenzverfahrens.\nIch beabsichtige daher, die Gesellschaft wegen Vermögenslosigkeit gemäß\n§ 394 FamFG zu löschen.\nIch bestimme eine Frist von einem Monat zur Geltendmachung eines Widerspruchs\ngegen die Löschung, § 394 Abs. 2 S. 1 FamFG.\nWeiter bitte ich Sie, mir binnen derselben Frist mitzuteilen, ob die genannte Gesellschaft\nnoch Vermögen hat, ggf. welche Vermögensgegenstände sie besitzt, ob die Gesellschaft\nnoch Partei eines noch nicht rechtskräftig abgeschlossenen Rechtsstreits ist oder ob sonst\nnoch eine Abwicklung stattfindet.\nNach Fristablauf ohne Widerspruch von Ihnen oder anderer Seite wird die Gesellschaft\ngelöscht.\n\nOstermann\nDipl.-Rechtspflegerin (FH)"
    },
    {
      "date": "2025-11-19",
      "id": "137755",
      "original_text": "Löschungsankündigung\nBerlin Amtsgericht Berlin (Charlottenburg) HRB 201974\nURBANA IMMOBAU Projektgesellschaft mbH – Berlin",
      "type": "Löschungsankündigung",
      "state": "Berlin",
      "amtsgericht": "Amtsgericht Berlin (Charlottenburg)",
      "registernummer": "HRB 201974",
      "registerart": "HRB",
      "company_name": "URBANA IMMOBAU Projektgesellschaft mbH",
      "company_seat": "Berlin",
      "details": "19.11.2025 (Bekanntmachungsdatum)\n\nBerlin Amtsgericht Berlin (Charlottenburg) HRB 201974\nLöschungsankündigung\n\nURBANA IMMOBAU Projektgesellschaft mbH\nGesellschaft mit beschränkter Haftung\nBerlin\n\nBei der nachstehenden Gesellschaft wird das Amtslöschungsverfahren gemäß § 394 FamFG eingeleitet. Widerspruchsfrist 6 Wochen"
    },
    {
      "date": "2025-11-19",
      "id": "137756",
      "original_text": "Registerbekanntmachung nach dem Umwandlungsgesetz\nBaden-Württemberg Amtsgericht Mannheim HRB 700833\nSAP Dritte Beteiligungs- und Vermögensverwaltungs GmbH – Walldorf",
      "type": "Registerbekanntmachung nach dem Umwandlungsgesetz",
      "state": "Baden-Württemberg",
      "amtsgericht": "Amtsgericht Mannheim",
      "registernummer": "HRB 700833",
      "registerart": "HRB",
      "company_name": "SAP Dritte Beteiligungs- und Vermögensverwaltungs GmbH",
      "company_seat": "Walldorf",
      "details": "19.11.2025 (Bekanntmachungsdatum)\n\nBaden-Württemberg Amtsgericht Mannheim HRB 700833\nRegisterbekanntmachung nach dem Umwandlungsgesetz 19.11.2025 (Eintragungsdatum)\n\nSAP Dritte Beteiligungs- und Vermögensverwaltungs GmbH\nGesellschaft mit beschränkter Haftung\nWalldorf\n\nDen Gläubigern der an der Verschmelzung beteiligten Rechtsträger ist, wenn sie binnen sechs Monaten nach dem Tag, an dem die Eintragung der Verschmelzung in das Register des Sitzes desjenigen Rechtsträgers, dessen Gläubiger sie sind, nach § 19 Abs. 3 UmwG als bekanntgemacht gilt, ihren Anspruch nach Grund und Höhe schriftlich anmelden, Sicherheit zu leisten, soweit sie nicht Befriedigung verlangen können. Dieses Recht steht den Gläubigern jedoch nur zu, wenn sie glaubhaft machen, dass durch die Verschmelzung die Erfüllung ihrer Forderung gefährdet wird."
    },
    {
      "date": "2025-11-19",
      "id": "137757",
      "original_text": "Löschungsankündigung\nBaden-Württemberg Amtsgericht Freiburg HRB 381231\nRegenbogen-Verlag Klaus Stromer GmbH – Konstanz",
      "type": "Löschungsankündigung",
      "state": "Baden-Württemberg",
      "amtsgericht": "Amtsgericht Freiburg",
      "registernummer": "HRB 381231",
      "registerart": "HRB",
      "company_name": "Regenbogen-Verlag Klaus Stromer GmbH",
      "company_seat": "Konstanz",
      "details": "19.11.2025 (Bekanntmachungsdatum)\n\nBaden-Württemberg Amtsgericht Freiburg HRB 381231\nLöschungsankündigung\n\nRegenbogen-Verlag Klaus Stromer GmbH\nGesellschaft mit beschränkter Haftung\nKonstanz\n\nAls nicht eingetragen wird bekanntgemacht:\nDas Gericht beabsichtigt, die Gesellschaft wegen Vermögenslosigkeit im Handelsregister von Amts wegen nach § 394 FamFG zu löschen. Die Frist zur Geltendmachung eines Widerspruchs gegen die beabsichtigte Löschung ist auf einen Monat ab Veröffentlichung bestimmt."
    },
    {
      "date": "2025-11-19",
      "id": "137758",
      "original_text": "Löschungsankündigung\nBerlin Amtsgericht Berlin (Charlottenburg) HRB 243486\nWellness Gärtner GmbH – Berlin",
      "type": "Löschungsankündigung",
      "state": "Berlin",
      "amtsgericht": "Amtsgericht Berlin (Charlottenburg)",
      "registernummer": "HRB 243486",
      "registerart": "HRB",
      "company_name": "Wellness Gärtner GmbH",
      "company_seat": "Berlin",
      "details": "19.11.2025 (Bekanntmachungsdatum)\n\nBerlin Amtsgericht Berlin (Charlottenburg) HRB 243486\nLöschungsankündigung\n\nWellness Gärtner GmbH\nGesellschaft mit beschränkter Haftung\nBerlin\n\nBei der nachstehenden Gesellschaft wird das Amtslöschungsverfahren gemäß § 394 FamFG eingeleitet. Widerspruchsfrist 6 Wochen"
    },
    {
      "date": "2025-11-19",
      "id": "137759",
      "original_text": "Einreichung neuer Dokumente\nBerlin Amtsgericht Berlin (Charlottenburg) HRB 206131\nhy Team AG – Berlin",
      "type": "Einreichung neuer Dokumente",
      "state": "Berlin",
      "amtsgericht": "Amtsgericht Berlin (Charlottenburg)",
      "registernummer": "HRB 206131",
      "registerart": "HRB",
      "company_name": "hy Team AG",
      "company_seat": "Berlin",
      "details": "19.11.2025 (Bekanntmachungsdatum)\n\nBerlin Amtsgericht Berlin (Charlottenburg) HRB 206131\nEinreichung neuer Dokumente\n\nhy Team AG\nAktiengesellschaft\nBerlin\n\nAls nicht eingetragen wird veröffentlicht: Es wurde eine neue Liste der Aufsichtsratsmitglieder eingereicht (§ 106 AktG)."
    },
    {
      "date": "2025-11-19",
      "id": "137760",
      "original_text": "Registerbekanntmachung nach dem Umwandlungsgesetz\nSchleswig-Holstein Amtsgericht Pinneberg HRB 10304\nm-u-t GmbH – Wedel",
      "type": "Registerbekanntmachung nach dem Umwandlungsgesetz",
      "state": "Schleswig-Holstein",
      "amtsgericht": "Amtsgericht Pinneberg",
      "registernummer": "HRB 10304",
      "registerart": "HRB",
      "company_name": "m-u-t GmbH",
      "company_seat": "Wedel",
      "details": "19.11.2025 (Bekanntmachungsdatum)\n\nSchleswig-Holstein Amtsgericht Pinneberg HRB 10304\nRegisterbekanntmachung nach dem Umwandlungsgesetz 11.11.2025 (Eintragungsdatum)\n\nm-u-t GmbH\nGesellschaft mit beschränkter Haftung\nWedel\n\nZu Eintragungsnummer 16 vom 11.11.2025 wird als nicht eingetragen veröffentlicht: Den Gläubigern der an der Verschmelzung beteiligten Rechtsträger ist, wenn sie binnen sechs Monaten nach dem Tag, an dem die Eintragung der Verschmelzung in das Register des Sitzes desjenigen Rechtsträgers, dessen Gläubiger sie sind, als bekannt gemacht gilt, ihren Anspruch nach Grund und Höhe schriftlich anmelden, Sicherheit zu leisten, soweit sie nicht Befriedigung verlangen können. Dieses Recht steht den Gläubigern jedoch nur zu, wenn sie glaubhaft machen, dass durch die Verschmelzung die Erfüllung ihrer Forderung gefährdet wird. Das Recht, Sicherheitsleistung zu verlangen, steht Gläubigern nicht zu, die im Falle der Insolvenz ein Recht auf vorzugsweise Befriedigung aus einer Deckungsmasse haben, die nach gesetzlicher Vorschrift zu ihrem Schutz errichtet und staatlich überwacht ist."
    },
    {
      "date": "2025-11-19",
      "id": "137761",
      "original_text": "Registerbekanntmachung nach dem Umwandlungsgesetz\nBrandenburg Amtsgericht Potsdam HRA 8685\nBiofrucht Senst Fläming GmbH & Co. KG – Wiesenburg",
      "type": "Registerbekanntmachung nach dem Umwandlungsgesetz",
      "state": "Brandenburg",
      "amtsgericht": "Amtsgericht Potsdam",
      "registernummer": "HRA 8685",
      "registerart": "HRA",
      "company_name": "Biofrucht Senst Fläming GmbH & Co. KG",
      "company_seat": "Wiesenburg",
      "details": "19.11.2025 (Bekanntmachungsdatum)\n\nBrandenburg Amtsgericht Potsdam HRA 8685\nRegisterbekanntmachung nach dem Umwandlungsgesetz 17.11.2025 (Eintragungsdatum)\n\nBiofrucht Senst Fläming GmbH & Co. KG\nKommanditgesellschaft\nWiesenburg\n\nZu Eintragungsnummer 2 vom 17.11.2025 wird als nicht eingetragen veröffentlicht:\nDen Gläubigern der an der Ausgliederung beteiligten Rechtsträger ist, wenn sie binnen sechs Monaten nach dem Tag, an dem die Eintragung der Spaltung in das Register des Sitzes desjenigen Rechtsträgers, dessen Gläubiger sie sind, als bekannt gemacht gilt, ihren Anspruch nach Grund und Höhe schriftlich anmelden, Sicherheit zu leisten, soweit sie nicht Befriedigung verlangen können. Dieses Recht steht den Gläubigern jedoch nur zu, wenn sie glaubhaft machen, dass durch die Ausgliederung die Erfüllung ihrer Forderung gefährdet wird."
    },
    {
      "date": "2025-11-19",
      "id": "137762",
      "original_text": "Löschungsankündigung\nBrandenburg Amtsgericht Potsdam HRB 41043\nVöhma Luxury Automotive GmbH – Potsdam",
      "type": "Löschungsankündigung",
      "state": "Brandenburg",
      "amtsgericht": "Amtsgericht Potsdam",
      "registernummer": "HRB 41043",
      "registerart": "HRB",
      "company_name": "Vöhma Luxury Automotive GmbH",
      "company_seat": "Potsdam",
      "details": "19.11.2025 (Bekanntmachungsdatum)\n\nBrandenburg Amtsgericht Potsdam HRB 41043\nLöschungsankündigung\n\nVöhma Luxury Automotive GmbH\nGesellschaft mit beschränkter Haftung\nPotsdam\n\nBei der nachstehenden Gesellschaft wird das Amtslöschungsverfahren gemäß § 394 FamFG eingeleitet. Widerspruchsfrist: 8 Wochen."
    },
    {
      "date": "2025-11-19",
      "id": "137763",
      "original_text": "Registerbekanntmachung nach dem Umwandlungsgesetz\nBaden-Württemberg Amtsgericht Freiburg HRA 707060\nGerwig Steuerberatungsgesellschaft mbH & Co. KG – Lörrach",
      "type": "Registerbekanntmachung nach dem Umwandlungsgesetz",
      "state": "Baden-Württemberg",
      "amtsgericht": "Amtsgericht Freiburg",
      "registernummer": "HRA 707060",
      "registerart": "HRA",
      "company_name": "Gerwig Steuerberatungsgesellschaft mbH & Co. KG",
      "company_seat": "Lörrach",
      "details": "19.11.2025 (Bekanntmachungsdatum)\n\nBaden-Württemberg Amtsgericht Freiburg HRA 707060\nRegisterbekanntmachung nach dem Umwandlungsgesetz 19.11.2025 (Eintragungsdatum)\n\nGerwig Steuerberatungsgesellschaft mbH & Co. KG\nKommanditgesellschaft\nLörrach\n\nDie Gesellschaft ist formwechselnd umgewandelt in die \"Gerwig Steuerberatungsgesellschaft mbH\" mit Sitz in Lörrach (Amtsgericht Freiburg, HRB  734378). Den Gläubigern des an dem Formwechsel beteiligten Rechtsträgers ist, wenn sie binnen sechs Monaten nach dem Tag, an dem die Eintragung des Formwechsels in das Register des Sitzes desjenigen Rechtsträgers, dessen Gläubiger sie sind, nach § 19 Abs. 3 UmwG als bekanntgemacht gilt, ihren Anspruch nach Grund und Höhe schriftlich anmelden, Sicherheit zu leisten, soweit sie nicht Befriedigung verlangen können. Dieses Recht steht den Gläubigern jedoch nur zu, wenn sie glaubhaft machen, dass durch den Formwechsel die Erfüllung ihrer Forderung gefährdet wird."
    },
    {
      "date": "2025-11-19",
      "id": "137764",
      "original_text": "Einreichung neuer Dokumente\nBerlin Amtsgericht Berlin (Charlottenburg) HRB 85737\nZentrum für Internationale Friedenseinsätze (ZIF) gGmbH – Berlin",
      "type": "Einreichung neuer Dokumente",
      "state": "Berlin",
      "amtsgericht": "Amtsgericht Berlin (Charlottenburg)",
      "registernummer": "HRB 85737",
      "registerart": "HRB",
      "company_name": "Zentrum für Internationale Friedenseinsätze (ZIF) gGmbH",
      "company_seat": "Berlin",
      "details": "19.11.2025 (Bekanntmachungsdatum)\n\nBerlin Amtsgericht Berlin (Charlottenburg) HRB 85737\nEinreichung neuer Dokumente\n\nZentrum für Internationale Friedenseinsätze (ZIF) gGmbH\nGesellschaft mit beschränkter Haftung\nBerlin\n\nAls nicht eingetragen wird veröffentlicht:\n\nEs wurde eine neue Liste der Aufsichtsratsmitglieder eingereicht (§52 GmbHG)."
    },
    {
      "date": "2025-11-19",
      "id": "137765",
      "original_text": "Registerbekanntmachung nach dem Umwandlungsgesetz\nBrandenburg Amtsgericht Potsdam GsR 625\nArnhölter Grundstücks eGbR – Falkensee",
      "type": "Registerbekanntmachung nach dem Umwandlungsgesetz",
      "state": "Brandenburg",
      "amtsgericht": "Amtsgericht Potsdam",
      "registernummer": "GsR 625",
      "registerart": "GsR",
      "company_name": "Arnhölter Grundstücks eGbR",
      "company_seat": "Falkensee",
      "details": "19.11.2025 (Bekanntmachungsdatum)\n\nBrandenburg Amtsgericht Potsdam GsR 625\nRegisterbekanntmachung nach dem Umwandlungsgesetz 14.11.2025 (Eintragungsdatum)\n\nArnhölter Grundstücks eGbR\nGesellschaft bürgerlichen Rechts\nFalkensee\n\nZu Eintragungsnummer 2 vom 14.11.2025 wird als nicht eingetragen veröffentlicht:\nDen Gläubigern der an der Umwandlung beteiligten Rechtsträger ist, wenn sie binnen sechs Monaten nach dem Tag, an dem die Eintragung der Umwandlung in das Register des Sitzes desjenigen Rechtsträgers, dessen Gläubiger sie sind, als bekannt gemacht gilt, ihren Anspruch nach Grund und Höhe schriftlich anmelden, Sicherheit zu leisten, soweit sie nicht Befriedigung verlangen können. Dieses Recht steht den Gläubigern jedoch nur zu, wenn sie glaubhaft machen, dass durch die Umwandlung die Erfüllung ihrer Forderung gefährdet wird."
    },
    {
      "date": "2025-11-19",
      "id": "137766",
      "original_text": "Löschungsankündigung\nBerlin Amtsgericht Berlin (Charlottenburg) HRA 38421\nCate & Eve Eventservice OHG – Berlin",
      "type": "Löschungsankündigung",
      "state": "Berlin",
      "amtsgericht": "Amtsgericht Berlin (Charlottenburg)",
      "registernummer": "HRA 38421",
      "registerart": "HRA",
      "company_name": "Cate & Eve Eventservice OHG",
      "company_seat": "Berlin",
      "details": "19.11.2025 (Bekanntmachungsdatum)\n\nBerlin Amtsgericht Berlin (Charlottenburg) HRA 38421\nLöschungsankündigung\n\nCate & Eve Eventservice OHG\nOffene Handelsgesellschaft\nBerlin\n\nBei dem nachstehenden Unternehmen / der nachstehenden Gesellschaft wird das Amtslöschungsverfahren gemäß § 31 Abs. 2 HGB eingeleitet. Widerspruchsfrist 2 Monate."
    },
    {
      "date": "2025-11-19",
      "id": "137767",
      "original_text": "Einreichung neuer Dokumente\nHamburg Amtsgericht Hamburg HRB 69451\nHHLA Frucht- und Kühl-Zentrum GmbH – Hamburg",
      "type": "Einreichung neuer Dokumente",
      "state": "Hamburg",
      "amtsgericht": "Amtsgericht Hamburg",
      "registernummer": "HRB 69451",
      "registerart": "HRB",
      "company_name": "HHLA Frucht- und Kühl-Zentrum GmbH",
      "company_seat": "Hamburg",
      "details": "19.11.2025 (Bekanntmachungsdatum)\n\nHamburg Amtsgericht Hamburg HRB 69451\nEinreichung neuer Dokumente\n\nHHLA Frucht- und Kühl-Zentrum GmbH\nGesellschaft mit beschränkter Haftung\nHamburg\n\nAls nicht eingetragen wird bekannt gemacht: Liste des Aufsichtsrats wurde eingereicht."
    },
    {
      "date": "2025-11-19",
      "id": "137768",
      "original_text": "Löschungsankündigung\nBaden-Württemberg Amtsgericht Ulm HRB 739601\nModellbau Maier GmbH – Schwäbisch Gmünd",
      "type": "Löschungsankündigung",
      "state": "Baden-Württemberg",
      "amtsgericht": "Amtsgericht Ulm",
      "registernummer": "HRB 739601",
      "registerart": "HRB",
      "company_name": "Modellbau Maier GmbH",
      "company_seat": "Schwäbisch Gmünd",
      "details": "19.11.2025 (Bekanntmachungsdatum)\n\nBaden-Württemberg Amtsgericht Ulm HRB 739601\nLöschungsankündigung\n\nModellbau Maier GmbH\nGesellschaft mit beschränkter Haftung\nSchwäbisch Gmünd\n\nDas Gericht beabsichtigt, die Gesellschaft wegen Vermögenslosigkeit im Handelsregister von Amts wegen nach § 394 FamFG zu löschen. Die Frist zur Geltendmachung eines Widerspruchs gegen die beabsichtigte Löschung ist auf  einen Monat ab Veröffentlichung bestimmt."
    },
    {
      "date": "2025-11-19",
      "id": "137769",
      "original_text": "Sonstige Registerbekanntmachung\nBerlin Amtsgericht Berlin (Charlottenburg) HRB 252891\nForto SE – Berlin",
      "type": "Sonstige Registerbekanntmachung",
      "state": "Berlin",
      "amtsgericht": "Amtsgericht Berlin (Charlottenburg)",
      "registernummer": "HRB 252891",
      "registerart": "HRB",
      "company_name": "Forto SE",
      "company_seat": "Berlin",
      "details": "19.11.2025 (Bekanntmachungsdatum)\n\nBerlin Amtsgericht Berlin (Charlottenburg) HRB 252891\nSonstige Registerbekanntmachung\n\nForto SE\nEuropäische Aktiengesellschaft (SE)\nBerlin\n\nAls nicht eingetragen wird veröffentlicht:\nEs wurde eine neue Liste der Aufsichtsratsmitglieder eingereicht (§ 106 AktG)."
    },
    {
      "date": "2025-11-19",
      "id": "137770",
      "original_text": "Löschungsankündigung\nBaden-Württemberg Amtsgericht Stuttgart HRB 775330\nSemi Saidi GmbH – Stuttgart",
      "type": "Löschungsankündigung",
      "state": "Baden-Württemberg",
      "amtsgericht": "Amtsgericht Stuttgart",
      "registernummer": "HRB 775330",
      "registerart": "HRB",
      "company_name": "Semi Saidi GmbH",
      "company_seat": "Stuttgart",
      "details": "19.11.2025 (Bekanntmachungsdatum)\n\nBaden-Württemberg Amtsgericht Stuttgart HRB 775330\nLöschungsankündigung\n\nSemi Saidi GmbH\nGesellschaft mit beschränkter Haftung\nStuttgart\n\nDas Gericht beabsichtigt, die Gesellschaft wegen Vermögenslosigkeit im Handelsregister von Amts wegen nach § 394 FamFG zu löschen. Die Frist zur Geltendmachung eines Widerspruchs gegen die beabsichtigte Löschung ist auf zwei Monate ab Veröffentlichung bestimmt."
    },
    {
      "date": "2025-11-19",
      "id": "137771",
      "original_text": "Löschungsankündigung\nBaden-Württemberg Amtsgericht Stuttgart HRB 737165\nForum für Informationsforschung und Kommunikation Unternehmergesellschaft (haftungsbeschränkt) – Stuttgart",
      "type": "Löschungsankündigung",
      "state": "Baden-Württemberg",
      "amtsgericht": "Amtsgericht Stuttgart",
      "registernummer": "HRB 737165",
      "registerart": "HRB",
      "company_name": "Forum für Informationsforschung und Kommunikation Unternehmergesellschaft (haftungsbeschränkt)",
      "company_seat": "Stuttgart",
      "details": "19.11.2025 (Bekanntmachungsdatum)\n\nBaden-Württemberg Amtsgericht Stuttgart HRB 737165\nLöschungsankündigung\n\nForum für Informationsforschung und Kommunikation Unternehmergesellschaft (haftungsbeschränkt)\nGesellschaft mit beschränkter Haftung\nStuttgart\n\nAls nicht eingetragen wird bekanntgemacht:\nDas Gericht beabsichtigt, die Gesellschaft wegen Vermögenslosigkeit im Handelsregister von Amts wegen nach § 394 FamFG zu löschen. Die Frist zur Geltendmachung eines Widerspruchs gegen die beabsichtigte Löschung ist auf zwei Monate ab Veröffentlichung bestimmt."
    },
    {
      "date": "2025-11-19",
      "id": "137772",
      "original_text": "Löschungsankündigung\nBaden-Württemberg Amtsgericht Stuttgart HRB 768616\nIVB - GmbH – Stuttgart",
      "type": "Löschungsankündigung",
      "state": "Baden-Württemberg",
      "amtsgericht": "Amtsgericht Stuttgart",
      "registernummer": "HRB 768616",
      "registerart": "HRB",
      "company_name": "IVB - GmbH",
      "company_seat": "Stuttgart",
      "details": "19.11.2025 (Bekanntmachungsdatum)\n\nBaden-Württemberg Amtsgericht Stuttgart HRB 768616\nLöschungsankündigung\n\nIVB - GmbH\nGesellschaft mit beschränkter Haftung\nStuttgart\n\nDas Gericht beabsichtigt, die Gesellschaft wegen Vermögenslosigkeit im Handelsregister von Amts wegen nach § 394 FamFG zu löschen. Die Frist zur Geltendmachung eines Widerspruchs gegen die beabsichtigte Löschung ist auf zwei Monate ab Veröffentlichung bestimmt."
    },
    {
      "date": "2025-11-19",
      "id": "137773",
      "original_text": "Registerbekanntmachung nach dem Umwandlungsgesetz\nNordrhein-Westfalen Amtsgericht Coesfeld HRB 9832\nSicon GmbH – Gescher",
      "type": "Registerbekanntmachung nach dem Umwandlungsgesetz",
      "state": "Nordrhein-Westfalen",
      "amtsgericht": "Amtsgericht Coesfeld",
      "registernummer": "HRB 9832",
      "registerart": "HRB",
      "company_name": "Sicon GmbH",
      "company_seat": "Gescher",
      "details": "19.11.2025 (Bekanntmachungsdatum)\n\nNordrhein-Westfalen Amtsgericht Coesfeld HRB 9832\nRegisterbekanntmachung nach dem Umwandlungsgesetz 19.11.2025 (Eintragungsdatum)\n\nSicon GmbH\nGesellschaft mit beschränkter Haftung\nGescher\n\nDen Gläubigern der an der Ausgliederung beteiligten Rechtsträger ist, wenn sie binnen sechs Monaten nach dem Tag, an dem die Eintragung der Ausgliederung in das Register des Sitzes desjenigen Rechtsträgers, dessen Gläubiger sie sind, nach § 19 Absatz 3 UmwG als bekanntgemacht gilt, ihren Anspruch nach Grund und Höhe schriftlich anmelden, Sicherheit zu leisten, soweit sie nicht Befriedigung verlangen können. Dieses Recht steht den Gläubigern jedoch nur zu, wenn sie glaubhaft machen, dass durch die Ausgliederung die Erfüllung ihrer Forderung gefährdet wird."
    },
    {
      "date": "2025-11-19",
      "id": "137774",
      "original_text": "Löschungsankündigung\nSchleswig-Holstein Amtsgericht Kiel HRB 20562\nFEB-Kurier Frischer Eil Bote Kurier UG (haftungsbeschränkt) – Hamweddel",
      "type": "Löschungsankündigung",
      "state": "Schleswig-Holstein",
      "amtsgericht": "Amtsgericht Kiel",
      "registernummer": "HRB 20562",
      "registerart": "HRB",
      "company_name": "FEB-Kurier Frischer Eil Bote Kurier UG (haftungsbeschränkt)",
      "company_seat": "Hamweddel",
      "details": "19.11.2025 (Bekanntmachungsdatum)\n\nSchleswig-Holstein Amtsgericht Kiel HRB 20562\nLöschungsankündigung\n\nFEB-Kurier Frischer Eil Bote Kurier UG (haftungsbeschränkt)\nGesellschaft mit beschränkter Haftung\nHamweddel\n\nEs ist die Löschung der nachstehenden Gesellschaft wegen Vermögenslosigkeit gemäß § 394 FamFG beabsichtigt. Widerspruchsfrist: 2 Monate."
    },
    {
      "date": "2025-11-19",
      "id": "137775",
      "original_text": "Registerbekanntmachung nach dem Umwandlungsgesetz\nSchleswig-Holstein Amtsgericht Kiel HRB 15641\nVION Zucht- und Nutzvieh GmbH – Bad Bramstedt",
      "type": "Registerbekanntmachung nach dem Umwandlungsgesetz",
      "state": "Schleswig-Holstein",
      "amtsgericht": "Amtsgericht Kiel",
      "registernummer": "HRB 15641",
      "registerart": "HRB",
      "company_name": "VION Zucht- und Nutzvieh GmbH",
      "company_seat": "Bad Bramstedt",
      "details": "19.11.2025 (Bekanntmachungsdatum)\n\nSchleswig-Holstein Amtsgericht Kiel HRB 15641\nRegisterbekanntmachung nach dem Umwandlungsgesetz 17.11.2025 (Eintragungsdatum)\n\nVION Zucht- und Nutzvieh GmbH\nGesellschaft mit beschränkter Haftung\nBad Bramstedt\n\nAls nicht eingetragen wird veröffentlicht: Den Gläubigern der an der Verschmelzung beteiligten Rechtsträger ist, wenn sie binnen sechs Monaten nach dem Tag, an dem die Eintragung der Verschmelzung in das Register des Sitzes desjenigen Rechtsträgers, dessen Gläubiger sie sind, nach § 19 Abs. 3 UmwG bekannt gemacht worden ist, ihren Anspruch nach Grund und Höhe schriftlich anmelden, Sicherheit zu leisten, soweit sie nicht Befriedigung verlangen können. Dieses Recht steht den Gläubigern jedoch nur zu, wenn sie glaubhaft machen, dass durch die Verschmelzung die Erfüllung ihrer Forderung gefährdet wird."
    },
    {
      "date": "2025-11-19",
      "id": "137776",
      "original_text": "Registerbekanntmachung nach dem Umwandlungsgesetz\nHamburg Amtsgericht Hamburg HRA 110531\nTischlerei Mirko Simon e.K. – Hamburg",
      "type": "Registerbekanntmachung nach dem Umwandlungsgesetz",
      "state": "Hamburg",
      "amtsgericht": "Amtsgericht Hamburg",
      "registernummer": "HRA 110531",
      "registerart": "HRA",
      "company_name": "Tischlerei Mirko Simon e.K.",
      "company_seat": "Hamburg",
      "details": "19.11.2025 (Bekanntmachungsdatum)\n\nHamburg Amtsgericht Hamburg HRA 110531\nRegisterbekanntmachung nach dem Umwandlungsgesetz 19.11.2025 (Eintragungsdatum)\n\nTischlerei Mirko Simon e.K.\nEinzelkaufmann\nHamburg\n\nAls nicht eingetragen wird bekannt gemacht:\nDen Gläubigern der an der Ausgliederung beteiligten Rechtsträger ist, wenn sie binnen sechs Monaten nach dem Tag, an dem die Eintragung der Ausgliederung in das Register des Sitzes desjenigen Rechtsträgers, dessen Gläubiger sie sind, nach § 19 Absatz 3 UmwG als bekannt gemacht gilt, ihren Anspruch nach Grund und Höhe schriftlich anmelden, Sicherheit zu leisten, soweit sie nicht Befriedigung verlangen können. Dieses Recht steht den Gläubigern jedoch nur zu, wenn sie glaubhaft machen, dass durch die Ausgliederung die Erfüllung ihrer Forderung gefährdet wird."
    },
    {
      "date": "2025-11-19",
      "id": "137777",
      "original_text": "Registerbekanntmachung nach dem Umwandlungsgesetz\nBaden-Württemberg Amtsgericht Stuttgart HRB 23198\nBREMER Stuttgart GmbH – Stuttgart",
      "type": "Registerbekanntmachung nach dem Umwandlungsgesetz",
      "state": "Baden-Württemberg",
      "amtsgericht": "Amtsgericht Stuttgart",
      "registernummer": "HRB 23198",
      "registerart": "HRB",
      "company_name": "BREMER Stuttgart GmbH",
      "company_seat": "Stuttgart",
      "details": "19.11.2025 (Bekanntmachungsdatum)\n\nBaden-Württemberg Amtsgericht Stuttgart HRB 23198\nRegisterbekanntmachung nach dem Umwandlungsgesetz 19.11.2025 (Eintragungsdatum)\n\nBREMER Stuttgart GmbH\nGesellschaft mit beschränkter Haftung\nStuttgart\n\nAls nicht eingetragen wird bekanntgemacht:\nDen Gläubigern der an der Verschmelzung beteiligten Rechtsträger ist, wenn sie binnen sechs Monaten nach dem Tag, an dem die Eintragung der Verschmelzung in das Register des Sitzes desjenigen Rechtsträgers, dessen Gläubiger sie sind, nach § 19 Abs. 3 UmwG als bekanntgemacht gilt, ihren Anspruch nach Grund und Höhe schriftlich anmelden, Sicherheit zu leisten, soweit sie nicht Befriedigung verlangen können. Dieses Recht steht den Gläubigern jedoch nur zu, wenn sie glaubhaft machen, dass durch die Verschmelzung die Erfüllung ihrer Forderung gefährdet wird."
    },
    {
      "date": "2025-11-19",
      "id": "137778",
      "original_text": "Löschungsankündigung\nBaden-Württemberg Amtsgericht Stuttgart HRB 758997\nGV Pipeline GmbH – Neckarsulm",
      "type": "Löschungsankündigung",
      "state": "Baden-Württemberg",
      "amtsgericht": "Amtsgericht Stuttgart",
      "registernummer": "HRB 758997",
      "registerart": "HRB",
      "company_name": "GV Pipeline GmbH",
      "company_seat": "Neckarsulm",
      "details": "19.11.2025 (Bekanntmachungsdatum)\n\nBaden-Württemberg Amtsgericht Stuttgart HRB 758997\nLöschungsankündigung\n\nGV Pipeline GmbH\nGesellschaft mit beschränkter Haftung\nNeckarsulm\n\nAls nicht eingetragen wird bekanntgemacht:\nDas Gericht beabsichtigt, die Gesellschaft wegen Vermögenslosigkeit im Handelsregister von Amts wegen nach § 394 FamFG zu löschen. Die Frist zur Geltendmachung eines Widerspruchs gegen die beabsichtigte Löschung ist auf zwei Monate ab Veröffentlichung bestimmt."
    },
    {
      "date": "2025-11-19",
      "id": "137779",
      "original_text": "Löschungsankündigung\nSachsen-Anhalt Amtsgericht Stendal VR 37175\nKleingärtner-Sparte \"Edelweiß\" e.V. – Eilenstedt",
      "type": "Löschungsankündigung",
      "state": "Sachsen-Anhalt",
      "amtsgericht": "Amtsgericht Stendal",
      "registernummer": "VR 37175",
      "registerart": "VR",
      "company_name": "Kleingärtner-Sparte \"Edelweiß\" e.V.",
      "company_seat": "Eilenstedt",
      "details": "19.11.2025 (Bekanntmachungsdatum)\n\nSachsen-Anhalt Amtsgericht Stendal VR 37175\nLöschungsankündigung\n\nKleingärtner-Sparte \"Edelweiß\" e.V.\neingetragener Verein\nEilenstedt\n\nDas Registergericht beabsichtigt, den nachfolgenden Verein wegen Mitgliederlosigkeit von Amts wegen zu löschen. Die Frist zur Erhebung eines Widerspruchs gegen die beabsichtigte Löschung wird auf drei Monate festgesetzt."
    },
    {
      "date": "2025-11-19",
      "id": "137780",
      "original_text": "Registerbekanntmachung nach dem Umwandlungsgesetz\nNiedersachsen Amtsgericht Göttingen HRA 202339\nWollborn Vermietungs- und Verwaltungsgesellschaft mbH & Co. KG – Herzberg am Harz",
      "type": "Registerbekanntmachung nach dem Umwandlungsgesetz",
      "state": "Niedersachsen",
      "amtsgericht": "Amtsgericht Göttingen",
      "registernummer": "HRA 202339",
      "registerart": "HRA",
      "company_name": "Wollborn Vermietungs- und Verwaltungsgesellschaft mbH & Co. KG",
      "company_seat": "Herzberg am Harz",
      "details": "19.11.2025 (Bekanntmachungsdatum)\n\nNiedersachsen Amtsgericht Göttingen HRA 202339\nRegisterbekanntmachung nach dem Umwandlungsgesetz 19.11.2025 (Eintragungsdatum)\n\nWollborn Vermietungs- und Verwaltungsgesellschaft mbH & Co. KG\nKommanditgesellschaft\nHerzberg am Harz\n\nDen Gläubigern der an der Ausgliederung beteiligten Rechtsträger ist, wenn sie binnen sechs Monaten nach dem Tag, an dem die Eintragung der Ausgliederung in das Register des Sitzes desjenigen Rechtsträgers, dessen Gläubiger sie sind, nach § 19 Abs. 3 UmwG als bekannt gemacht gilt, ihren Anspruch nach Grund und Höhe schriftlich anmelden, Sicherheit zu leisten, soweit sie nicht Befriedigung verlangen können. Dieses Recht steht den Gläubigern jedoch nur zu, wenn sie glaubhaft machen, dass durch die Ausgliederung die Erfüllung der Forderung gefährdet wird."
    },
    {
      "date": "2025-11-19",
      "id": "137781",
      "original_text": "Löschungsankündigung\nNiedersachsen Amtsgericht Hildesheim HRB 208292\nAutohaus Preizler GmbH – Meine",
      "type": "Löschungsankündigung",
      "state": "Niedersachsen",
      "amtsgericht": "Amtsgericht Hildesheim",
      "registernummer": "HRB 208292",
      "registerart": "HRB",
      "company_name": "Autohaus Preizler GmbH",
      "company_seat": "Meine",
      "details": "19.11.2025 (Bekanntmachungsdatum)\n\nNiedersachsen Amtsgericht Hildesheim HRB 208292\nLöschungsankündigung\n\nAutohaus Preizler GmbH\nGesellschaft mit beschränkter Haftung\nMeine\n\nDas Registergericht beabsichtigt, die Gesellschaft von Amts wegen nach § 394 FamFG zu löschen. Die Frist zur Erhebung eines Widerspruchs ist auf 1 Monat ab dieser Registerbekanntmachung festgesetzt."
    },
    {
      "date": "2025-11-19",
      "id": "137782",
      "original_text": "Löschungsankündigung\nNiedersachsen Amtsgericht Osnabrück HRB 218580\nOsna Frischen GmbH – Osnabrück",
      "type": "Löschungsankündigung",
      "state": "Niedersachsen",
      "amtsgericht": "Amtsgericht Osnabrück",
      "registernummer": "HRB 218580",
      "registerart": "HRB",
      "company_name": "Osna Frischen GmbH",
      "company_seat": "Osnabrück",
      "details": "19.11.2025 (Bekanntmachungsdatum)\n\nNiedersachsen Amtsgericht Osnabrück HRB 218580\nLöschungsankündigung 19.11.2025 (Eintragungsdatum)\n\nOsna Frischen GmbH\nGesellschaft mit beschränkter Haftung\nOsnabrück\n\nDas Registergericht beabsichtigt, die Gesellschaft von Amts wegen nach § 394 FamFG wegen Vermögenslosigkeit zu löschen. Die Frist zur Erhebung eines Widerspruchs ist auf 1 Monat ab dieser Registerbekanntmachung festgesetzt."
    },
    {
      "date": "2025-11-19",
      "id": "137783",
      "original_text": "Löschungsankündigung\nNiedersachsen Amtsgericht Osnabrück HRB 210687\nInterfeld UG (haftungsbeschränkt) – Gölenkamp",
      "type": "Löschungsankündigung",
      "state": "Niedersachsen",
      "amtsgericht": "Amtsgericht Osnabrück",
      "registernummer": "HRB 210687",
      "registerart": "HRB",
      "company_name": "Interfeld UG (haftungsbeschränkt)",
      "company_seat": "Gölenkamp",
      "details": "19.11.2025 (Bekanntmachungsdatum)\n\nNiedersachsen Amtsgericht Osnabrück HRB 210687\nLöschungsankündigung\n\nInterfeld UG (haftungsbeschränkt)\nGesellschaft mit beschränkter Haftung\nGölenkamp\n\nDas Registergericht beabsichtigt, die Gesellschaft von Amts wegen nach § 394 FamFG wegen Vermögenslosigkeit zu löschen. Die Frist zur Erhebung eines Widerspruchs ist auf 1 Monat ab dieser Registerbekanntmachung festgesetzt."
    },
    {
      "date": "2025-11-19",
      "id": "137784",
      "original_text": "Löschungsankündigung\nNiedersachsen Amtsgericht Braunschweig HRB 204374\nLivepower UG (haftungsbeschränkt) – Kissenbrück",
      "type": "Löschungsankündigung",
      "state": "Niedersachsen",
      "amtsgericht": "Amtsgericht Braunschweig",
      "registernummer": "HRB 204374",
      "registerart": "HRB",
      "company_name": "Livepower UG (haftungsbeschränkt)",
      "company_seat": "Kissenbrück",
      "details": "19.11.2025 (Bekanntmachungsdatum)\n\nNiedersachsen Amtsgericht Braunschweig HRB 204374\nLöschungsankündigung\n\nLivepower UG (haftungsbeschränkt)\nGesellschaft mit beschränkter Haftung\nKissenbrück\n\nDas Registergericht beabsichtigt, die Gesellschaft von Amts wegen nach § 394 FamFG zu löschen. Die Frist zur Erhebung eines Widerspruchs ist auf 1 Monat ab dieser Registerbekanntmachung festgesetzt."
    },
    {
      "date": "2025-11-19",
      "id": "137785",
      "original_text": "Registerbekanntmachung nach dem Umwandlungsgesetz\nNiedersachsen Amtsgericht Walsrode HRB 210922\nGrewe Maschinen GmbH – Rotenburg/Wümme",
      "type": "Registerbekanntmachung nach dem Umwandlungsgesetz",
      "state": "Niedersachsen",
      "amtsgericht": "Amtsgericht Walsrode",
      "registernummer": "HRB 210922",
      "registerart": "HRB",
      "company_name": "Grewe Maschinen GmbH",
      "company_seat": "Rotenburg/Wümme",
      "details": "19.11.2025 (Bekanntmachungsdatum)\n\nNiedersachsen Amtsgericht Walsrode HRB 210922\nRegisterbekanntmachung nach dem Umwandlungsgesetz 19.11.2025 (Eintragungsdatum)\n\nGrewe Maschinen GmbH\nGesellschaft mit beschränkter Haftung\nRotenburg/Wümme\n\nDen Gläubigern der an der Verschmelzung beteiligten Rechtsträger ist, wenn sie binnen sechs Monaten nach dem Tag, an dem die Eintragung der Verschmelzung in das Register des Sitzes desjenigen Rechtsträgers, dessen Gläubiger sie sind, nach § 19  Abs.  3 UmwG als bekannt gemacht gilt, ihren Anspruch nach Grund und Höhe schriftlich anmelden, Sicherheit zu leisten, soweit sie nicht Befriedigung verlangen können. Dieses Recht steht den Gläubigern jedoch nur zu, wenn sie glaubhaft machen, dass durch die Verschmelzung die Erfüllung der Forderung gefährdet wird."
    },
    {
      "date": "2025-11-19",
      "id": "137786",
      "original_text": "Registerbekanntmachung nach dem Umwandlungsgesetz\nNiedersachsen Amtsgericht Osnabrück HRB 209881\nH & N Deutschland GmbH – Ankum",
      "type": "Registerbekanntmachung nach dem Umwandlungsgesetz",
      "state": "Niedersachsen",
      "amtsgericht": "Amtsgericht Osnabrück",
      "registernummer": "HRB 209881",
      "registerart": "HRB",
      "company_name": "H & N Deutschland GmbH",
      "company_seat": "Ankum",
      "details": "19.11.2025 (Bekanntmachungsdatum)\n\nNiedersachsen Amtsgericht Osnabrück HRB 209881\nRegisterbekanntmachung nach dem Umwandlungsgesetz 19.11.2025 (Eintragungsdatum)\n\nH & N Deutschland GmbH\nGesellschaft mit beschränkter Haftung\nAnkum\n\nDen Gläubigern der an der Verschmelzung beteiligten Rechtsträger ist, wenn sie binnen sechs Monaten nach dem Tag, an dem die Eintragung der Verschmelzung in das Register des Sitzes desjenigen Rechtsträgers, dessen Gläubiger sie sind, nach § 19  Abs.  3 UmwG als bekannt gemacht gilt, ihren Anspruch nach Grund und Höhe schriftlich anmelden, Sicherheit zu leisten, soweit sie nicht Befriedigung verlangen können. Dieses Recht steht den Gläubigern jedoch nur zu, wenn sie glaubhaft machen, dass durch die Verschmelzung die Erfüllung der Forderung gefährdet wird."
    },
    {
      "date": "2025-11-19",
      "id": "137787",
      "original_text": "Registerbekanntmachung nach dem Umwandlungsgesetz\nRheinland-Pfalz Amtsgericht Wittlich HRB 40577\nJTI Investments GmbH – Trier",
      "type": "Registerbekanntmachung nach dem Umwandlungsgesetz",
      "state": "Rheinland-Pfalz",
      "amtsgericht": "Amtsgericht Wittlich",
      "registernummer": "HRB 40577",
      "registerart": "HRB",
      "company_name": "JTI Investments GmbH",
      "company_seat": "Trier",
      "details": "19.11.2025 (Bekanntmachungsdatum)\n\nRheinland-Pfalz Amtsgericht Wittlich HRB 40577\nRegisterbekanntmachung nach dem Umwandlungsgesetz 19.11.2025 (Eintragungsdatum)\n\nJTI Investments GmbH\nGesellschaft mit beschränkter Haftung\nTrier\n\nDen Gläubigern der an dem grenzüberschreitenden Formwechsel beteiligten übernehmenden Rechtsträger ist, wenn sie binnen sechs Monaten nach dem Tag, an dem die Eintragung des Formwechsels in das Register des Sitzes desjenigen Rechtsträgers, dessen Gläubiger sie sind, nach § 19 Absatz 3 UmwG als bekanntgemacht gilt, ihren Anspruch nach Grund und Höhe schriftlich anmelden, Sicherheit zu leisten, soweit sie nicht Befriedigung verlangen können.\n\nDieses Recht steht den Gläubigern jedoch nur zu, wenn sie glaubhaft machen, dass durch den Formwechsel die Erfüllung ihrer Forderung gefährdet wird."
    },
    {
      "date": "2025-11-19",
      "id": "137788",
      "original_text": "Löschungsankündigung\nRheinland-Pfalz Amtsgericht Ludwigshafen a.Rhein (Ludwigshafen) HRB 22002\nGOS Gesellschaft für Objektsanierung mbH – Bobenheim-Roxheim",
      "type": "Löschungsankündigung",
      "state": "Rheinland-Pfalz",
      "amtsgericht": "Amtsgericht Ludwigshafen a.Rhein (Ludwigshafen)",
      "registernummer": "HRB 22002",
      "registerart": "HRB",
      "company_name": "GOS Gesellschaft für Objektsanierung mbH",
      "company_seat": "Bobenheim-Roxheim",
      "details": "19.11.2025 (Bekanntmachungsdatum)\n\nRheinland-Pfalz Amtsgericht Ludwigshafen a.Rhein (Ludwigshafen) HRB 22002\nLöschungsankündigung\n\nGOS Gesellschaft für Objektsanierung mbH\nGesellschaft mit beschränkter Haftung\nBobenheim-Roxheim\n\nDas Registergericht beabsichtigt die Gesellschaft von Amts wegen nach § 394 FamFG zu löschen. Die Frist zur Erhebung eines Widerspruchs ist auf einen Monat festgesetzt."
    },
    {
      "date": "2025-11-19",
      "id": "137789",
      "original_text": "Einreichung neuer Dokumente\nNordrhein-Westfalen Amtsgericht Düsseldorf HRB 54231\nZCC Cutting Tools Europe GmbH – Düsseldorf",
      "type": "Einreichung neuer Dokumente",
      "state": "Nordrhein-Westfalen",
      "amtsgericht": "Amtsgericht Düsseldorf",
      "registernummer": "HRB 54231",
      "registerart": "HRB",
      "company_name": "ZCC Cutting Tools Europe GmbH",
      "company_seat": "Düsseldorf",
      "details": "19.11.2025 (Bekanntmachungsdatum)\n\nNordrhein-Westfalen Amtsgericht Düsseldorf HRB 54231\nEinreichung neuer Dokumente\n\nZCC Cutting Tools Europe GmbH\nGesellschaft mit beschränkter Haftung\nDüsseldorf\n\nDem Registergericht ist eine Liste der Mitglieder des Aufsichtsrates eingereicht worden."
    },
    {
      "date": "2025-11-19",
      "id": "137790",
      "original_text": "Registerbekanntmachung nach dem Umwandlungsgesetz\nNordrhein-Westfalen Amtsgericht Köln HRB 124933\nScannell Deutschland No. 012 GmbH – Köln",
      "type": "Registerbekanntmachung nach dem Umwandlungsgesetz",
      "state": "Nordrhein-Westfalen",
      "amtsgericht": "Amtsgericht Köln",
      "registernummer": "HRB 124933",
      "registerart": "HRB",
      "company_name": "Scannell Deutschland No. 012 GmbH",
      "company_seat": "Köln",
      "details": "19.11.2025 (Bekanntmachungsdatum)\n\nNordrhein-Westfalen Amtsgericht Köln HRB 124933\nRegisterbekanntmachung nach dem Umwandlungsgesetz\n\nScannell Deutschland No. 012 GmbH\nGesellschaft mit beschränkter Haftung\nKöln\n\nEs wird darauf hingewiesen, dass ein Formwechselplan oder sein Entwurf über einen grenzüberschreitenden Formwechsel in die Scannell Properties Hollfeld S.à r.l mit Sitz in Luxemburg/Luxemburg (société à responsabilité limitée - Gesellschaft mit beschränkter Haftung  nach luxemburgischem Recht) beim Handelsregister eingereicht worden ist.\n\nDie Anteilsinhaber, die Gläubiger sowie die zuständigen Betriebsräte der an dem grenzüberschreitenden Formwechsel beteiligten Gesellschaft oder, soweit es keinen Betriebsrat gibt, die Arbeitnehmer der an dem grenzüberschreitenden Formwechsel beteiligten Gesellschaft, können der Gesellschaft spätestens fünf Arbeitstage vor dem Tag der Gesellschafterversammlung Bemerkungen zum Formwechselplan übermitteln."
    },
    {
      "date": "2025-11-19",
      "id": "137791",
      "original_text": "Löschungsankündigung\nNordrhein-Westfalen Amtsgericht Essen HRB 23581\nGüney GmbH – Essen",
      "type": "Löschungsankündigung",
      "state": "Nordrhein-Westfalen",
      "amtsgericht": "Amtsgericht Essen",
      "registernummer": "HRB 23581",
      "registerart": "HRB",
      "company_name": "Güney GmbH",
      "company_seat": "Essen",
      "details": "19.11.2025 (Bekanntmachungsdatum)\n\nNordrhein-Westfalen Amtsgericht Essen HRB 23581\nLöschungsankündigung\n\nGüney GmbH\nGesellschaft mit beschränkter Haftung\nEssen\n\nDas Registergericht beabsichtigt die Gesellschaft von Amts wegen nach § 394 FamFG zu löschen. Die Frist zur Erhebung eines Widerspruchs ist auf einen Monat festgesetzt."
    },
    {
      "date": "2025-11-19",
      "id": "137792",
      "original_text": "Registerbekanntmachung nach dem Umwandlungsgesetz\nNordrhein-Westfalen Amtsgericht Dortmund HRB 27157\n# 3 Gatter 3 Technik GmbH – Dortmund",
      "type": "Registerbekanntmachung nach dem Umwandlungsgesetz",
      "state": "Nordrhein-Westfalen",
      "amtsgericht": "Amtsgericht Dortmund",
      "registernummer": "HRB 27157",
      "registerart": "HRB",
      "company_name": "# 3 Gatter 3 Technik GmbH",
      "company_seat": "Dortmund",
      "details": "19.11.2025 (Bekanntmachungsdatum)\n\nNordrhein-Westfalen Amtsgericht Dortmund HRB 27157\nRegisterbekanntmachung nach dem Umwandlungsgesetz 19.11.2025 (Eintragungsdatum)\n\n# 3 Gatter 3 Technik GmbH\nGesellschaft mit beschränkter Haftung\nDortmund\n\nDie Gesellschaft hat Gläubigern, deren Forderungen vor dieser Bekanntmachung begründet worden sind, Sicherheit zu leisten, soweit sie nicht Befriedigung verlangen können, wenn sie sich binnen sechs Monaten zu diesem Zweck melden."
    },
    {
      "date": "2025-11-19",
      "id": "137793",
      "original_text": "Registerbekanntmachung nach dem Umwandlungsgesetz\nNordrhein-Westfalen Amtsgericht Bonn HRB 21164\nDeutsche Post Transport GmbH – Bonn",
      "type": "Registerbekanntmachung nach dem Umwandlungsgesetz",
      "state": "Nordrhein-Westfalen",
      "amtsgericht": "Amtsgericht Bonn",
      "registernummer": "HRB 21164",
      "registerart": "HRB",
      "company_name": "Deutsche Post Transport GmbH",
      "company_seat": "Bonn",
      "details": "19.11.2025 (Bekanntmachungsdatum)\n\nNordrhein-Westfalen Amtsgericht Bonn HRB 21164\nRegisterbekanntmachung nach dem Umwandlungsgesetz 19.11.2025 (Eintragungsdatum)\n\nDeutsche Post Transport GmbH\nGesellschaft mit beschränkter Haftung\nBonn\n\nDen Gläubigern der an der Abspaltung beteiligten Rechtsträger ist, wenn sie binnen sechs Monaten nach dem Tag, an dem die Eintragung der Abspaltung in das Register des Sitzes desjenigen Rechtsträgers, dessen Gläubiger sie sind, nach § 19 Absatz 3 UmwG als bekanntgemacht gilt, ihren Anspruch nach Grund und Höhe schriftlich anmelden, Sicherheit zu leisten, soweit sie nicht Befriedigung verlangen können. Dieses Recht steht den Gläubigern jedoch nur zu, wenn sie glaubhaft machen, dass durch die Abspaltung die Erfüllung ihrer Forderung gefährdet wird."
    },
    {
      "date": "2025-11-19",
      "id": "137794",
      "original_text": "Registerbekanntmachung nach dem Umwandlungsgesetz\nNordrhein-Westfalen Amtsgericht Bochum HRB 15136\nWittener Transport-Kontor Heinrich Stratmann Gesellschaft mit beschränkter Haftung – Witten",
      "type": "Registerbekanntmachung nach dem Umwandlungsgesetz",
      "state": "Nordrhein-Westfalen",
      "amtsgericht": "Amtsgericht Bochum",
      "registernummer": "HRB 15136",
      "registerart": "HRB",
      "company_name": "Wittener Transport-Kontor Heinrich Stratmann Gesellschaft mit beschränkter Haftung",
      "company_seat": "Witten",
      "details": "19.11.2025 (Bekanntmachungsdatum)\n\nNordrhein-Westfalen Amtsgericht Bochum HRB 15136\nRegisterbekanntmachung nach dem Umwandlungsgesetz 18.11.2025 (Eintragungsdatum)\n\nWittener Transport-Kontor Heinrich Stratmann Gesellschaft mit beschränkter Haftung\nGesellschaft mit beschränkter Haftung\nWitten\n\nDen Gläubigern der an der Verschmelzung beteiligten Rechtsträger ist, wenn sie binnen sechs Monaten nach dem Tag, an dem die Eintragung der Verschmelzung in das Register des Sitzes derjenigen Rechtsträger deren Gläubiger sie sind, nach § 19 Absatz 3 UmwG als bekanntgemacht gilt, ihren Anspruch nach Grund und Höhe schriftlich anmelden, Sicherheit zu leisten, soweit sie nicht Befriedigung verlangen können. Dieses Recht steht den Gläubigern jedoch nur zu, wenn sie glaubhaft machen, dass durch die Verschmelzung die Erfüllung ihrer Forderung gefährdet wird."
    },
    {
      "date": "2025-11-19",
      "id": "137795",
      "original_text": "Löschungsankündigung\nNordrhein-Westfalen Amtsgericht Dortmund HRB 32196\nNH Service UG (haftungsbeschränkt) – Dortmund",
      "type": "Löschungsankündigung",
      "state": "Nordrhein-Westfalen",
      "amtsgericht": "Amtsgericht Dortmund",
      "registernummer": "HRB 32196",
      "registerart": "HRB",
      "company_name": "NH Service UG (haftungsbeschränkt)",
      "company_seat": "Dortmund",
      "details": "19.11.2025 (Bekanntmachungsdatum)\n\nNordrhein-Westfalen Amtsgericht Dortmund HRB 32196\nLöschungsankündigung\n\nNH Service UG (haftungsbeschränkt)\nGesellschaft mit beschränkter Haftung\nDortmund\n\nDas Registergericht beabsichtigt die Gesellschaft von Amts wegen nach § 394 FamFG zu löschen. Die Frist zur Erhebung eines Widerspruchs ist auf zwei Monate festgesetzt."
    },
    {
      "date": "2025-11-19",
      "id": "137796",
      "original_text": "Registerbekanntmachung nach dem Umwandlungsgesetz\nNordrhein-Westfalen Amtsgericht Bonn HRB 12854\nFiducia Treuhand AG – Bonn",
      "type": "Registerbekanntmachung nach dem Umwandlungsgesetz",
      "state": "Nordrhein-Westfalen",
      "amtsgericht": "Amtsgericht Bonn",
      "registernummer": "HRB 12854",
      "registerart": "HRB",
      "company_name": "Fiducia Treuhand AG",
      "company_seat": "Bonn",
      "details": "19.11.2025 (Bekanntmachungsdatum)\n\nNordrhein-Westfalen Amtsgericht Bonn HRB 12854\nRegisterbekanntmachung nach dem Umwandlungsgesetz 19.11.2025 (Eintragungsdatum)\n\nFiducia Treuhand AG\nAktiengesellschaft\nBonn\n\nDen Gläubigern der an der formwechselnden Umwandlung beteiligten Rechtsträger ist, wenn sie binnen sechs Monaten nach dem Tag, an dem die Eintragung der formwechselnden Umwandlung in das Register des Sitzes desjenigen Rechtsträgers, dessen Gläubiger sie sind, nach § 19 Absatz 3 UmwG als bekanntgemacht gilt, ihren Anspruch nach Grund und Höhe schriftlich anmelden, Sicherheit zu leisten, soweit sie nicht Befriedigung verlangen können. Dieses Recht steht den Gläubigern jedoch nur zu, wenn sie glaubhaft machen, dass durch die formwechselnden Umwandlung die Erfüllung ihrer Forderung gefährdet wird."
    },
    {
      "date": "2025-11-19",
      "id": "137797",
      "original_text": "Löschungsankündigung\nNordrhein-Westfalen Amtsgericht Düsseldorf HRB 75266\nEMS Management GmbH – Düsseldorf",
      "type": "Löschungsankündigung",
      "state": "Nordrhein-Westfalen",
      "amtsgericht": "Amtsgericht Düsseldorf",
      "registernummer": "HRB 75266",
      "registerart": "HRB",
      "company_name": "EMS Management GmbH",
      "company_seat": "Düsseldorf",
      "details": "19.11.2025 (Bekanntmachungsdatum)\n\nNordrhein-Westfalen Amtsgericht Düsseldorf HRB 75266\nLöschungsankündigung\n\nEMS Management GmbH\nGesellschaft mit beschränkter Haftung\nDüsseldorf\n\nDas Registergericht beabsichtigt die Gesellschaft von Amts wegen nach § 394 Abs. 1 FamFG zu löschen. Die Frist zur Erhebung eines Widerspruchs ist auf einen Monat festgesetzt.\n\nRechtsbehelfsbelehrung:\nDas Widerspruchsrecht steht jedem zu, der an der Unterlassung der Löschung ein berechtigtes Interesse hat. Der Widerspruch ist bei dem Amtsgericht Düsseldorf -Registergericht-, Werdener Straße 1, 40227 Düsseldorf schriftlich in deutscher Sprache oder zur Niederschrift der Geschäftsstelle einzulegen. Der Widerspruch kann auch zur Niederschrift der Geschäftsstelle eines jeden Amtsgerichtes abgegeben werden. Die Einlegung ist auch durch Übertragung eines elektronischen Dokuments an die elektronische Poststelle des Gerichts möglich. Das elektronische Dokument muss für die Bearbeitung durch das Gericht geeignet und mit einer qualifizierten elektronischen Signatur der verantwortenden Person versehen sein oder von der verantwortenden Person signiert und auf einem sicheren Übermittlungsweg gemäß § 130a ZPO nach näherer Maßgabe der Verordnung über die technischen Rahmenbedingungen des elektronischen Rechtsverkehrs und über das besondere elektronische Behördenpostfach (BGBl. I, S.3803) eingereicht werden. Weitere Informationen erhalten Sie auf der Internetseite www.justiz.de.\nDer Widerspruch muss spätestens innerhalb der gesetzten Frist nach dem Datum der Bekanntmachung der Löschungsankündigung bei dem Amtsgericht - Registergericht - Düsseldorf eingegangen sein.  Dies gilt auch dann, wenn der Widerspruch zur Niederschrift der Geschäftsstelle eines anderen Amtsgerichtes abgegeben wurde. Die Frist beginnt mit dem Tage der Bekanntmachung der Löschungsankündigung in dem für die Bekanntmachung der Eintragungen in das Handelsregister bestimmten elektronischen Informations- und Kommunikationssystem nach § 10 des Handelsgesetzbuches. Fällt das Ende der Frist auf einen Sonntag, einen allgemeinen Feiertag oder Sonnabend, so endet die Frist mit Ablauf des nächsten Werktages.\nDer Widerspruch muss die Bezeichnung der angefochtenen Löschungsankündigung sowie die Erklärung enthalten, dass Widerspruch gegen diese Löschungsankündigung eingelegt wird. Er ist zu unterzeichnen und soll begründet werden."
    },
    {
      "date": "2025-11-19",
      "id": "137798",
      "original_text": "Registerbekanntmachung nach dem Umwandlungsgesetz\nNordrhein-Westfalen Amtsgericht Düsseldorf HRB 87138\nCompanion 67 Visuelle Kommunikation GmbH – Düsseldorf",
      "type": "Registerbekanntmachung nach dem Umwandlungsgesetz",
      "state": "Nordrhein-Westfalen",
      "amtsgericht": "Amtsgericht Düsseldorf",
      "registernummer": "HRB 87138",
      "registerart": "HRB",
      "company_name": "Companion 67 Visuelle Kommunikation GmbH",
      "company_seat": "Düsseldorf",
      "details": "19.11.2025 (Bekanntmachungsdatum)\n\nNordrhein-Westfalen Amtsgericht Düsseldorf HRB 87138\nRegisterbekanntmachung nach dem Umwandlungsgesetz 19.11.2025 (Eintragungsdatum)\n\nCompanion 67 Visuelle Kommunikation GmbH\nGesellschaft mit beschränkter Haftung\nDüsseldorf\n\nDen Gläubigern der an der Verschmelzung beteiligten Rechtsträger ist, wenn sie binnen sechs Monaten nach dem Tag, an dem die Eintragung der Verschmelzung in das Register des Sitzes desjenigen Rechtsträgers, dessen Gläubiger sie sind, nach § 19 Absatz 3 UmwG als bekanntgemacht gilt, ihren Anspruch nach Grund und Höhe schriftlich anmelden, Sicherheit zu leisten, soweit sie nicht Befriedigung verlangen können. Dieses Recht steht den Gläubigern jedoch nur zu, wenn sie glaubhaft machen, dass durch die Verschmelzung die Erfüllung ihrer Forderung gefährdet wird."
    },
    {
      "date": "2025-11-19",
      "id": "137799",
      "original_text": "Löschungsankündigung\nNordrhein-Westfalen Amtsgericht Düsseldorf HRB 62625\nBaSi GmbH – Düsseldorf",
      "type": "Löschungsankündigung",
      "state": "Nordrhein-Westfalen",
      "amtsgericht": "Amtsgericht Düsseldorf",
      "registernummer": "HRB 62625",
      "registerart": "HRB",
      "company_name": "BaSi GmbH",
      "company_seat": "Düsseldorf",
      "details": "19.11.2025 (Bekanntmachungsdatum)\n\nNordrhein-Westfalen Amtsgericht Düsseldorf HRB 62625\nLöschungsankündigung\n\nBaSi GmbH\nGesellschaft mit beschränkter Haftung\nDüsseldorf\n\nBetr.: BaSi GmbH, Gladbecker Str. 10, 45141 Essen; Sitz: Düsseldorf\n\nDas Registergericht beabsichtigt die Gesellschaft von Amts wegen nach § 394 FamFG zu löschen. Die Frist zur Erhebung eines Widerspruchs ist auf 3 Wochen festgesetzt.\n\nRechtsbehelfsbelehrung:\n\nDas Widerspruchsrecht steht jedem zu, der an der Unterlassung der Löschung ein berechtigtes Interesse hat. Der Widerspruch ist bei dem Amtsgericht Düsseldorf -Registergericht-, Werdener Straße 1, 40227 Düsseldorf schriftlich in deutscher Sprache oder zur Niederschrift der Geschäftsstelle einzulegen. Der Widerspruch kann auch zur Niederschrift der Geschäftsstelle eines jeden Amtsgerichtes abgegeben werden. Die Einlegung ist auch durch Übertragung eines elektronischen Dokuments an die elektronische Poststelle des Gerichts möglich. Das elektronische Dokument muss für die Bearbeitung durch das Gericht geeignet und mit einer qualifizierten elektronischen Signatur der verantwortenden Person versehen sein oder von der verantwortenden Person signiert und auf einem sicheren Übermittlungsweg gemäß § 130a ZPO nach näherer Maßgabe der Verordnung über die technischen Rahmenbedingungen des elektronischen Rechtsverkehrs und über das besondere elektronische Behördenpostfach (BGBl. I, S.3803) eingereicht werden. Weitere Informationen erhalten Sie auf der Internetseite www.justiz.de.\nDer Widerspruch muss spätestens innerhalb der gesetzten Frist nach dem Datum der Bekanntmachung der Löschungsankündigung bei dem Amtsgericht - Registergericht - Düsseldorf eingegangen sein.  Dies gilt auch dann, wenn der Widerspruch zur Niederschrift der Geschäftsstelle eines anderen Amtsgerichtes abgegeben wurde. Die Frist beginnt mit dem Tage der Bekanntmachung der Löschungsankündigung in dem für die Bekanntmachung der Eintragungen in das Handelsregister bestimmten elektronischen Informations- und Kommunikationssystem nach § 10 des Handelsgesetzbuches. Fällt das Ende der Frist auf einen Sonntag, einen allgemeinen Feiertag oder Sonnabend, so endet die Frist mit Ablauf des nächsten Werktages.\nDer Widerspruch muss die Bezeichnung der angefochtenen Löschungsankündigung sowie die Erklärung enthalten, dass Widerspruch gegen diese Löschungsankündigung eingelegt wird. Er ist zu unterzeichnen und soll begründet werden."
    },
    {
      "date": "2025-11-19",
      "id": "137800",
      "original_text": "Einreichung neuer Dokumente\nNordrhein-Westfalen Amtsgericht Aachen HRB 9424\nEGG Entwicklungsgesellschaft Gangelt GmbH – Gangelt",
      "type": "Einreichung neuer Dokumente",
      "state": "Nordrhein-Westfalen",
      "amtsgericht": "Amtsgericht Aachen",
      "registernummer": "HRB 9424",
      "registerart": "HRB",
      "company_name": "EGG Entwicklungsgesellschaft Gangelt GmbH",
      "company_seat": "Gangelt",
      "details": "19.11.2025 (Bekanntmachungsdatum)\n\nNordrhein-Westfalen Amtsgericht Aachen HRB 9424\nEinreichung neuer Dokumente\n\nEGG Entwicklungsgesellschaft Gangelt GmbH\nGesellschaft mit beschränkter Haftung\nGangelt\n\nDem Registergericht ist eine neue Liste der Mitglieder des Aufsichtsrates eingereicht worden."
    },
    {
      "date": "2025-11-19",
      "id": "137801",
      "original_text": "Löschungsankündigung\nNordrhein-Westfalen Amtsgericht Krefeld HRB 19984\nPrima GmbH – Krefeld",
      "type": "Löschungsankündigung",
      "state": "Nordrhein-Westfalen",
      "amtsgericht": "Amtsgericht Krefeld",
      "registernummer": "HRB 19984",
      "registerart": "HRB",
      "company_name": "Prima GmbH",
      "company_seat": "Krefeld",
      "details": "19.11.2025 (Bekanntmachungsdatum)\n\nNordrhein-Westfalen Amtsgericht Krefeld HRB 19984\nLöschungsankündigung\n\nPrima GmbH\nGesellschaft mit beschränkter Haftung\nKrefeld\n\nDas Registergericht beabsichtigt die Gesellschaft von Amts wegen nach § 394 FamFG zu löschen. Die Frist zur Erhebung eines Widerspruchs ist auf einen Monat festgesetzt."
    },
    {
      "date": "2025-11-19",
      "id": "137802",
      "original_text": "Registerbekanntmachung nach dem Umwandlungsgesetz\nBremen Amtsgericht Bremen HRB 37443\nSAACKE Beteiligungs-GmbH – Bremen",
      "type": "Registerbekanntmachung nach dem Umwandlungsgesetz",
      "state": "Bremen",
      "amtsgericht": "Amtsgericht Bremen",
      "registernummer": "HRB 37443",
      "registerart": "HRB",
      "company_name": "SAACKE Beteiligungs-GmbH",
      "company_seat": "Bremen",
      "details": "19.11.2025 (Bekanntmachungsdatum)\n\nBremen Amtsgericht Bremen HRB 37443\nRegisterbekanntmachung nach dem Umwandlungsgesetz 14.11.2025 (Eintragungsdatum)\n\nSAACKE Beteiligungs-GmbH\nGesellschaft mit beschränkter Haftung\nBremen\n\nZu Eintragungsnummer 4 vom 14.11.2025 wird als nicht eingetragen veröffentlicht: Den Gläubigern der an der Verschmelzung beteiligten Rechtsträger ist, wenn sie binnen sechs Monaten nach dem Tag, an dem die Eintragung der Verschmelzung in das Register des Sitzes desjenigen Rechtsträgers, dessen Gläubiger sie sind, als bekannt gemacht gilt, ihren Anspruch nach Grund und Höhe schriftlich anmelden, Sicherheit zu leisten, soweit sie nicht Befriedigung verlangen können. Dieses Recht steht den Gläubigern jedoch nur zu, wenn sie glaubhaft machen, dass durch die Verschmelzung die Erfüllung ihrer Forderung gefährdet wird. Das Recht, Sicherheitsleistung zu verlangen, steht Gläubigern nicht zu, die im Falle der Insolvenz ein Recht auf vorzugsweise Befriedigung aus einer Deckungsmasse haben, die nach gesetzlicher Vorschrift zu ihrem Schutz errichtet und staatlich überwacht ist."
    },
    {
      "date": "2025-11-19",
      "id": "137803",
      "original_text": "Löschungsankündigung\nNordrhein-Westfalen Amtsgericht Dortmund HRA 14472\nSAG Unternehmensbeteiligungsgesellschaft MT Tatina mbH & Co. Tankschiff KG – Dortmund",
      "type": "Löschungsankündigung",
      "state": "Nordrhein-Westfalen",
      "amtsgericht": "Amtsgericht Dortmund",
      "registernummer": "HRA 14472",
      "registerart": "HRA",
      "company_name": "SAG Unternehmensbeteiligungsgesellschaft MT Tatina mbH & Co. Tankschiff KG",
      "company_seat": "Dortmund",
      "details": "19.11.2025 (Bekanntmachungsdatum)\n\nNordrhein-Westfalen Amtsgericht Dortmund HRA 14472\nLöschungsankündigung 19.11.2025 (Eintragungsdatum)\n\nSAG Unternehmensbeteiligungsgesellschaft MT Tatina mbH & Co. Tankschiff KG\nKommanditgesellschaft\nDortmund\n\nDas Registergericht beabsichtigt die Firma von Amts wegen nach § 394 FamFG zu löschen. Die Frist zur Erhebung eines Widerspruchs ist auf drei Monate festgesetzt."
    },
    {
      "date": "2025-11-19",
      "id": "137804",
      "original_text": "Registerbekanntmachung nach dem Umwandlungsgesetz\nNordrhein-Westfalen Amtsgericht Köln HRB 27158\nigus GmbH – Köln",
      "type": "Registerbekanntmachung nach dem Umwandlungsgesetz",
      "state": "Nordrhein-Westfalen",
      "amtsgericht": "Amtsgericht Köln",
      "registernummer": "HRB 27158",
      "registerart": "HRB",
      "company_name": "igus GmbH",
      "company_seat": "Köln",
      "details": "19.11.2025 (Bekanntmachungsdatum)\n\nNordrhein-Westfalen Amtsgericht Köln HRB 27158\nRegisterbekanntmachung nach dem Umwandlungsgesetz 19.11.2025 (Eintragungsdatum)\n\nigus GmbH\nGesellschaft mit beschränkter Haftung\nKöln\n\nDen Gläubigern der an der formwechselnden Umwandlung beteiligten Rechtsträger ist, wenn sie binnen sechs Monaten nach dem Tag, an dem die Eintragung der formwechselnden Umwandlung in das Register des Sitzes desjenigen Rechtsträgers, dessen Gläubiger sie sind, nach § 19 Absatz 3 UmwG als bekanntgemacht gilt, ihren Anspruch nach Grund und Höhe schriftlich anmelden, Sicherheit zu leisten, soweit sie nicht Befriedigung verlangen können. Dieses Recht steht den Gläubigern jedoch nur zu, wenn sie glaubhaft machen, dass durch die formwechselnden Umwandlung die Erfüllung ihrer Forderung gefährdet wird."
    },
    {
      "date": "2025-11-19",
      "id": "137805",
      "original_text": "Löschungsankündigung\nNordrhein-Westfalen Amtsgericht Köln HRB 116465\nPortflora Verwaltungs UG (haftungsbeschränkt) – Köln",
      "type": "Löschungsankündigung",
      "state": "Nordrhein-Westfalen",
      "amtsgericht": "Amtsgericht Köln",
      "registernummer": "HRB 116465",
      "registerart": "HRB",
      "company_name": "Portflora Verwaltungs UG (haftungsbeschränkt)",
      "company_seat": "Köln",
      "details": "19.11.2025 (Bekanntmachungsdatum)\n\nNordrhein-Westfalen Amtsgericht Köln HRB 116465\nLöschungsankündigung\n\nPortflora Verwaltungs UG (haftungsbeschränkt)\nGesellschaft mit beschränkter Haftung\nKöln\n\nDas Registergericht beabsichtigt die Gesellschaft von Amts wegen nach § 394 FamFG zu löschen. Die Frist zur Erhebung eines Widerspruchs ist auf einen Monat festgesetzt."
    },
    {
      "date": "2025-11-19",
      "id": "137806",
      "original_text": "Registerbekanntmachung nach dem Umwandlungsgesetz\nNordrhein-Westfalen Amtsgericht Münster HRB 23087\nbeneFit MS1 GmbH – Münster",
      "type": "Registerbekanntmachung nach dem Umwandlungsgesetz",
      "state": "Nordrhein-Westfalen",
      "amtsgericht": "Amtsgericht Münster",
      "registernummer": "HRB 23087",
      "registerart": "HRB",
      "company_name": "beneFit MS1 GmbH",
      "company_seat": "Münster",
      "details": "19.11.2025 (Bekanntmachungsdatum)\n\nNordrhein-Westfalen Amtsgericht Münster HRB 23087\nRegisterbekanntmachung nach dem Umwandlungsgesetz 19.11.2025 (Eintragungsdatum)\n\nbeneFit MS1 GmbH\nGesellschaft mit beschränkter Haftung\nMünster\n\nDen Gläubigern der an der Ausgliederung beteiligten Rechtsträger ist, wenn sie binnen sechs Monaten nach dem Tag, an dem die Eintragung der Ausgliederung in das Register des Sitzes desjenigen Rechtsträgers, dessen Gläubiger sie sind, nach § 19 Absatz 3 UmwG als bekanntgemacht gilt, ihren Anspruch nach Grund und Höhe schriftlich anmelden, Sicherheit zu leisten, soweit sie nicht Befriedigung verlangen können. Dieses Recht steht den Gläubigern jedoch nur zu, wenn sie glaubhaft machen, dass durch die Ausgliederung die Erfüllung ihrer Forderung gefährdet wird."
    },
    {
      "date": "2025-11-19",
      "id": "137807",
      "original_text": "Löschungsankündigung\nNordrhein-Westfalen Amtsgericht Düsseldorf HRB 66753\nBPM GmbH – Düsseldorf",
      "type": "Löschungsankündigung",
      "state": "Nordrhein-Westfalen",
      "amtsgericht": "Amtsgericht Düsseldorf",
      "registernummer": "HRB 66753",
      "registerart": "HRB",
      "company_name": "BPM GmbH",
      "company_seat": "Düsseldorf",
      "details": "19.11.2025 (Bekanntmachungsdatum)\n\nNordrhein-Westfalen Amtsgericht Düsseldorf HRB 66753\nLöschungsankündigung\n\nBPM GmbH\nGesellschaft mit beschränkter Haftung\nDüsseldorf\n\nDas Registergericht beabsichtigt die Gesellschaft von Amts wegen nach § 394 Abs. 1 FamFG zu löschen. Die Frist zur Erhebung eines Widerspruchs ist auf 3 Wochen festgesetzt.\n\nRechtsbehelfsbelehrung:\nDas Widerspruchsrecht steht jedem zu, der an der Unterlassung der Löschung ein berechtigtes Interesse hat. Der Widerspruch ist bei dem Amtsgericht Düsseldorf -Registergericht-, Werdener Straße 1, 40227 Düsseldorf schriftlich in deutscher Sprache oder zur Niederschrift der Geschäftsstelle einzulegen. Der Widerspruch kann auch zur Niederschrift der Geschäftsstelle eines jeden Amtsgerichtes abgegeben werden. Die Einlegung ist auch durch Übertragung eines elektronischen Dokuments an die elektronische Poststelle des Gerichts möglich. Das elektronische Dokument muss für die Bearbeitung durch das Gericht geeignet und mit einer qualifizierten elektronischen Signatur der verantwortenden Person versehen sein oder von der verantwortenden Person signiert und auf einem sicheren Übermittlungsweg gemäß § 130a ZPO nach näherer Maßgabe der Verordnung über die technischen Rahmenbedingungen des elektronischen Rechtsverkehrs und über das besondere elektronische Behördenpostfach (BGBl. I, S.3803) eingereicht werden. Weitere Informationen erhalten Sie auf der Internetseite www.justiz.de.\nDer Widerspruch muss spätestens innerhalb der gesetzten Frist nach dem Datum der Bekanntmachung der Löschungsankündigung bei dem Amtsgericht - Registergericht - Düsseldorf eingegangen sein.  Dies gilt auch dann, wenn der Widerspruch zur Niederschrift der Geschäftsstelle eines anderen Amtsgerichtes abgegeben wurde. Die Frist beginnt mit dem Tage der Bekanntmachung der Löschungsankündigung in dem für die Bekanntmachung der Eintragungen in das Handelsregister bestimmten elektronischen Informations- und Kommunikationssystem nach § 10 des Handelsgesetzbuches. Fällt das Ende der Frist auf einen Sonntag, einen allgemeinen Feiertag oder Sonnabend, so endet die Frist mit Ablauf des nächsten Werktages.\nDer Widerspruch muss die Bezeichnung der angefochtenen Löschungsankündigung sowie die Erklärung enthalten, dass Widerspruch gegen diese Löschungsankündigung eingelegt wird. Er ist zu unterzeichnen und soll begründet werden."
    },
    {
      "date": "2025-11-19",
      "id": "137808",
      "original_text": "Löschungsankündigung\nNordrhein-Westfalen Amtsgericht Kleve HRB 8261\nFLORIANHOF MOBILE GmbH – Rheurdt",
      "type": "Löschungsankündigung",
      "state": "Nordrhein-Westfalen",
      "amtsgericht": "Amtsgericht Kleve",
      "registernummer": "HRB 8261",
      "registerart": "HRB",
      "company_name": "FLORIANHOF MOBILE GmbH",
      "company_seat": "Rheurdt",
      "details": "19.11.2025 (Bekanntmachungsdatum)\n\nNordrhein-Westfalen Amtsgericht Kleve HRB 8261\nLöschungsankündigung\n\nFLORIANHOF MOBILE GmbH\nGesellschaft mit beschränkter Haftung\nRheurdt\n\nDas Registergericht beabsichtigt die Gesellschaft von Amts wegen nach § 394 FamFG zu löschen. Die Frist zur Erhebung eines Widerspruchs ist auf einen Monat festgesetzt."
    },
    {
      "date": "2025-11-19",
      "id": "137809",
      "original_text": "Löschungsankündigung\nNordrhein-Westfalen Amtsgericht Köln HRB 113656\nMLK trading GmbH – Köln",
      "type": "Löschungsankündigung",
      "state": "Nordrhein-Westfalen",
      "amtsgericht": "Amtsgericht Köln",
      "registernummer": "HRB 113656",
      "registerart": "HRB",
      "company_name": "MLK trading GmbH",
      "company_seat": "Köln",
      "details": "19.11.2025 (Bekanntmachungsdatum)\n\nNordrhein-Westfalen Amtsgericht Köln HRB 113656\nLöschungsankündigung\n\nMLK trading GmbH\nGesellschaft mit beschränkter Haftung\nKöln\n\nDas Registergericht beabsichtigt die Gesellschaft von Amts wegen nach § 394 FamFG zu löschen. Die Frist zur Erhebung eines Widerspruchs ist auf einen Monat festgesetzt."
    },
    {
      "date": "2025-11-19",
      "id": "137810",
      "original_text": "Einreichung neuer Dokumente\nNordrhein-Westfalen Amtsgericht Münster HRB 15618\nCOMPO EXPERT International GmbH – Münster",
      "type": "Einreichung neuer Dokumente",
      "state": "Nordrhein-Westfalen",
      "amtsgericht": "Amtsgericht Münster",
      "registernummer": "HRB 15618",
      "registerart": "HRB",
      "company_name": "COMPO EXPERT International GmbH",
      "company_seat": "Münster",
      "details": "19.11.2025 (Bekanntmachungsdatum)\n\nNordrhein-Westfalen Amtsgericht Münster HRB 15618\nEinreichung neuer Dokumente\n\nCOMPO EXPERT International GmbH\nGesellschaft mit beschränkter Haftung\nMünster\n\nDem Registergericht ist eine Liste der Mitglieder des Aufsichtsrates eingereicht worden."
    },
    {
      "date": "2025-11-19",
      "id": "137811",
      "original_text": "Einreichung neuer Dokumente\nNordrhein-Westfalen Amtsgericht Duisburg HRB 3291\nLS INVEST AG – Duisburg",
      "type": "Einreichung neuer Dokumente",
      "state": "Nordrhein-Westfalen",
      "amtsgericht": "Amtsgericht Duisburg",
      "registernummer": "HRB 3291",
      "registerart": "HRB",
      "company_name": "LS INVEST AG",
      "company_seat": "Duisburg",
      "details": "19.11.2025 (Bekanntmachungsdatum)\n\nNordrhein-Westfalen Amtsgericht Duisburg HRB 3291\nEinreichung neuer Dokumente\n\nLS INVEST AG\nAktiengesellschaft\nDuisburg\n\nDem Registergericht ist eine neue Liste der Mitglieder des Aufsichtsrates eingereicht worden."
    },
    {
      "date": "2025-11-19",
      "id": "137812",
      "original_text": "Registerbekanntmachung nach dem Umwandlungsgesetz\nNordrhein-Westfalen Amtsgericht Neuss HRB 21220\nStand and Deliver visible logistics and manufacturing GmbH – Neuss",
      "type": "Registerbekanntmachung nach dem Umwandlungsgesetz",
      "state": "Nordrhein-Westfalen",
      "amtsgericht": "Amtsgericht Neuss",
      "registernummer": "HRB 21220",
      "registerart": "HRB",
      "company_name": "Stand and Deliver visible logistics and manufacturing GmbH",
      "company_seat": "Neuss",
      "details": "19.11.2025 (Bekanntmachungsdatum)\n\nNordrhein-Westfalen Amtsgericht Neuss HRB 21220\nRegisterbekanntmachung nach dem Umwandlungsgesetz 19.11.2025 (Eintragungsdatum)\n\nStand and Deliver visible logistics and manufacturing GmbH\nGesellschaft mit beschränkter Haftung\nNeuss\n\nDen Gläubigern der an der Verschmelzung beteiligten Rechtsträger ist, wenn sie binnen sechs Monaten nach dem Tag, an dem die Eintragung der Verschmelzung in das Register des Sitzes desjenigen Rechtsträgers, dessen Gläubiger sie sind, nach § 19 Absatz 3 UmwG als bekanntgemacht gilt, ihren Anspruch nach Grund und Höhe schriftlich anmelden, Sicherheit zu leisten, soweit sie nicht Befriedigung verlangen können. Dieses Recht steht den Gläubigern jedoch nur zu, wenn sie glaubhaft machen, dass durch die Verschmelzung die Erfüllung ihrer Forderung gefährdet wird."
    },
    {
      "date": "2025-11-19",
      "id": "137813",
      "original_text": "Registerbekanntmachung nach dem Umwandlungsgesetz\nNordrhein-Westfalen Amtsgericht Köln HRA 38457\nigus SE & Co. KG – Köln",
      "type": "Registerbekanntmachung nach dem Umwandlungsgesetz",
      "state": "Nordrhein-Westfalen",
      "amtsgericht": "Amtsgericht Köln",
      "registernummer": "HRA 38457",
      "registerart": "HRA",
      "company_name": "igus SE & Co. KG",
      "company_seat": "Köln",
      "details": "19.11.2025 (Bekanntmachungsdatum)\n\nNordrhein-Westfalen Amtsgericht Köln HRA 38457\nRegisterbekanntmachung nach dem Umwandlungsgesetz 19.11.2025 (Eintragungsdatum)\n\nigus SE & Co. KG\nKommanditgesellschaft\nKöln\n\nDen Gläubigern der an der formwechselnden Umwandlung beteiligten Rechtsträger ist, wenn sie binnen sechs Monaten nach dem Tag, an dem die Eintragung der formwechselnden Umwandlung in das Register des Sitzes desjenigen Rechtsträgers, dessen Gläubiger sie sind, nach § 19 Absatz 3 UmwG als bekanntgemacht gilt, ihren Anspruch nach Grund und Höhe schriftlich anmelden, Sicherheit zu leisten, soweit sie nicht Befriedigung verlangen können. Dieses Recht steht den Gläubigern jedoch nur zu, wenn sie glaubhaft machen, dass durch die formwechselnden Umwandlung die Erfüllung ihrer Forderung gefährdet wird."
    },
    {
      "date": "2025-11-19",
      "id": "137814",
      "original_text": "Registerbekanntmachung nach dem Umwandlungsgesetz\nNordrhein-Westfalen Amtsgericht Düsseldorf HRB 10639\nFUJIFILM Europe GmbH – Ratingen",
      "type": "Registerbekanntmachung nach dem Umwandlungsgesetz",
      "state": "Nordrhein-Westfalen",
      "amtsgericht": "Amtsgericht Düsseldorf",
      "registernummer": "HRB 10639",
      "registerart": "HRB",
      "company_name": "FUJIFILM Europe GmbH",
      "company_seat": "Ratingen",
      "details": "19.11.2025 (Bekanntmachungsdatum)\n\nNordrhein-Westfalen Amtsgericht Düsseldorf HRB 10639\nRegisterbekanntmachung nach dem Umwandlungsgesetz 19.11.2025 (Eintragungsdatum)\n\nFUJIFILM Europe GmbH\nGesellschaft mit beschränkter Haftung\nRatingen\n\nDen Gläubigern der an der Verschmelzung beteiligten Rechtsträger ist, wenn sie binnen sechs Monaten nach dem Tag, an dem die Eintragung der Verschmelzung in das Register des Sitzes desjenigen Rechtsträgers, dessen Gläubiger sie sind, nach § 19 Absatz 3 UmwG als bekanntgemacht gilt, ihren Anspruch nach Grund und Höhe schriftlich anmelden, Sicherheit zu leisten, soweit sie nicht Befriedigung verlangen können. Dieses Recht steht den Gläubigern jedoch nur zu, wenn sie glaubhaft machen, dass durch die Verschmelzung die Erfüllung ihrer Forderung gefährdet wird."
    },
    {
      "date": "2025-11-19",
      "id": "137815",
      "original_text": "Registerbekanntmachung nach dem Umwandlungsgesetz\nHessen Amtsgericht Wetzlar HRB 1418\nBrück Beteiligungsgesellschaft mbH – Hohenahr-Altenkirchen",
      "type": "Registerbekanntmachung nach dem Umwandlungsgesetz",
      "state": "Hessen",
      "amtsgericht": "Amtsgericht Wetzlar",
      "registernummer": "HRB 1418",
      "registerart": "HRB",
      "company_name": "Brück Beteiligungsgesellschaft mbH",
      "company_seat": "Hohenahr-Altenkirchen",
      "details": "19.11.2025 (Bekanntmachungsdatum)\n\nHessen Amtsgericht Wetzlar HRB 1418\nRegisterbekanntmachung nach dem Umwandlungsgesetz 19.11.2025 (Eintragungsdatum)\n\nBrück Beteiligungsgesellschaft mbH\nGesellschaft mit beschränkter Haftung\nHohenahr-Altenkirchen\n\nDen Gläubigern der an der Verschmelzung beteiligten Rechtsträger ist, wenn sie binnen sechs Monaten nach dem Tag, an dem die Eintragung der Verschmelzung in das Register des Sitzes desjenigen Rechtsträgers, dessen Gläubiger sie sind, nach § 19 Absatz 3 UmwG bekannt gemacht worden ist, ihren Anspruch nach Grund und Höhe schriftlich anmelden, Sicherheit zu leisten, soweit sie nicht Befriedigung verlangen können. Dieses Recht steht den Gläubigern jedoch nur zu, wenn sie glaubhaft machen, dass durch die Verschmelzung die Erfüllung ihrer Forderung gefährdet wird."
    },
    {
      "date": "2025-11-19",
      "id": "137816",
      "original_text": "Registerbekanntmachung nach dem Umwandlungsgesetz\nHessen Amtsgericht Marburg HRB 1876\nASK Immobilien- und Gastronomie GmbH – Lahntal",
      "type": "Registerbekanntmachung nach dem Umwandlungsgesetz",
      "state": "Hessen",
      "amtsgericht": "Amtsgericht Marburg",
      "registernummer": "HRB 1876",
      "registerart": "HRB",
      "company_name": "ASK Immobilien- und Gastronomie GmbH",
      "company_seat": "Lahntal",
      "details": "19.11.2025 (Bekanntmachungsdatum)\n\nHessen Amtsgericht Marburg HRB 1876\nRegisterbekanntmachung nach dem Umwandlungsgesetz 19.11.2025 (Eintragungsdatum)\n\nASK Immobilien- und Gastronomie GmbH\nGesellschaft mit beschränkter Haftung\nLahntal\n\nDen Gläubigern der an der Verschmelzung beteiligten Rechtsträger ist, wenn sie binnen sechs Monaten nach dem Tag, an dem die Eintragung der Verschmelzung in das Register des Sitzes derjenigen Rechtsträger deren Gläubiger sie sind, nach § 19 Absatz 3 UmwG bekannt gemacht worden ist, ihren Anspruch nach Grund und Höhe schriftlich anmelden, Sicherheit zu leisten, soweit sie nicht Befriedigung verlangen können. Dieses Recht steht den Gläubigern jedoch nur zu, wenn sie glaubhaft machen, dass durch die Verschmelzung die Erfüllung ihrer Forderung gefährdet wird."
    },
    {
      "date": "2025-11-19",
      "id": "137817",
      "original_text": "Einreichung neuer Dokumente\nHessen Amtsgericht Frankfurt am Main HRB 45804\nAMADEUS FIRE AG – Frankfurt am Main",
      "type": "Einreichung neuer Dokumente",
      "state": "Hessen",
      "amtsgericht": "Amtsgericht Frankfurt am Main",
      "registernummer": "HRB 45804",
      "registerart": "HRB",
      "company_name": "AMADEUS FIRE AG",
      "company_seat": "Frankfurt am Main",
      "details": "19.11.2025 (Bekanntmachungsdatum)\n\nHessen Amtsgericht Frankfurt am Main HRB 45804\nEinreichung neuer Dokumente 18.11.2025 (Eintragungsdatum)\n\nAMADEUS FIRE AG\nAktiengesellschaft\nFrankfurt am Main\n\nDurch eine Änderung in den Personen der Aufsichtsratsmitglieder ist eine Liste der Mitglieder des Aufsichtsrates zum Handelsregister eingereicht worden."
    },
    {
      "date": "2025-11-19",
      "id": "137818",
      "original_text": "Sonstige Registerbekanntmachung\nHessen Amtsgericht Wetzlar VR 550\nHeimatkreis Römerstadt/Altvater – Wetzlar",
      "type": "Sonstige Registerbekanntmachung",
      "state": "Hessen",
      "amtsgericht": "Amtsgericht Wetzlar",
      "registernummer": "VR 550",
      "registerart": "VR",
      "company_name": "Heimatkreis Römerstadt/Altvater",
      "company_seat": "Wetzlar",
      "details": "19.11.2025 (Bekanntmachungsdatum)\n\nHessen Amtsgericht Wetzlar VR 550\nSonstige Registerbekanntmachung 19.11.2025 (Eintragungsdatum)\n\nHeimatkreis Römerstadt/Altvater\neingetragener Verein\nWetzlar\n\nDer Verein ist aufgelöst."
    },
    {
      "date": "2025-11-19",
      "id": "137819",
      "original_text": "Registerbekanntmachung nach dem Umwandlungsgesetz\nHessen Amtsgericht Frankfurt am Main HRB 140838\nDomus Sud GmbH – Frankfurt am Main",
      "type": "Registerbekanntmachung nach dem Umwandlungsgesetz",
      "state": "Hessen",
      "amtsgericht": "Amtsgericht Frankfurt am Main",
      "registernummer": "HRB 140838",
      "registerart": "HRB",
      "company_name": "Domus Sud GmbH",
      "company_seat": "Frankfurt am Main",
      "details": "19.11.2025 (Bekanntmachungsdatum)\n\nHessen Amtsgericht Frankfurt am Main HRB 140838\nRegisterbekanntmachung nach dem Umwandlungsgesetz 19.11.2025 (Eintragungsdatum)\n\nDomus Sud GmbH\nGesellschaft mit beschränkter Haftung\nFrankfurt am Main\n\nDen Gläubigern der an der Ausgliederung beteiligten Rechtsträger ist, wenn sie binnen sechs Monaten nach dem Tag, an dem die Eintragung der Ausgliederung in das Register des Sitzes desjenigen Rechtsträgers, dessen Gläubiger sie sind, nach §§ 125, 19 Absatz 3 UmwG bekannt gemacht worden ist, ihren Anspruch nach Grund und Höhe schriftlich anmelden, Sicherheit zu leisten, soweit sie nicht Befriedigung verlangen können. Dieses Recht steht den Gläubigern jedoch nur zu, wenn sie glaubhaft machen, dass durch die Ausgliederung die Erfüllung ihrer Forderung gefährdet wird."
    },
    {
      "date": "2025-11-19",
      "id": "137820",
      "original_text": "Registerbekanntmachung nach dem Umwandlungsgesetz\nHessen Amtsgericht Frankfurt am Main HRA 54336\nPizzeria Da Stefano e.K. Inhaber Daniel Nigro – Frankfurt am Main",
      "type": "Registerbekanntmachung nach dem Umwandlungsgesetz",
      "state": "Hessen",
      "amtsgericht": "Amtsgericht Frankfurt am Main",
      "registernummer": "HRA 54336",
      "registerart": "HRA",
      "company_name": "Pizzeria Da Stefano e.K. Inhaber Daniel Nigro",
      "company_seat": "Frankfurt am Main",
      "details": "19.11.2025 (Bekanntmachungsdatum)\n\nHessen Amtsgericht Frankfurt am Main HRA 54336\nRegisterbekanntmachung nach dem Umwandlungsgesetz 19.11.2025 (Eintragungsdatum)\n\nPizzeria Da Stefano e.K. Inhaber Daniel Nigro\nEinzelkaufmann / Einzelkauffrau\nFrankfurt am Main\n\nDen Gläubigern der an der Ausgliederung beteiligten Rechtsträger ist, wenn sie binnen sechs Monaten nach dem Tag, an dem die Eintragung der Ausgliederung in das Register des Sitzes desjenigen Rechtsträgers, dessen Gläubiger sie sind, nach §§ 125, 19 Absatz 3 UmwG bekannt gemacht worden ist, ihren Anspruch nach Grund und Höhe schriftlich anmelden, Sicherheit zu leisten, soweit sie nicht Befriedigung verlangen können. Dieses Recht steht den Gläubigern jedoch nur zu, wenn sie glaubhaft machen, dass durch die Ausgliederung die Erfüllung ihrer Forderung gefährdet wird."
    },
    {
      "date": "2025-11-19",
      "id": "137821",
      "original_text": "Registerbekanntmachung nach dem Umwandlungsgesetz\nHessen Amtsgericht Kassel HRA 18126\nM&L Intensivpflege & Heimbeatmung e.K., Inhaber Menase Hailu – Vellmar",
      "type": "Registerbekanntmachung nach dem Umwandlungsgesetz",
      "state": "Hessen",
      "amtsgericht": "Amtsgericht Kassel",
      "registernummer": "HRA 18126",
      "registerart": "HRA",
      "company_name": "M&L Intensivpflege & Heimbeatmung e.K., Inhaber Menase Hailu",
      "company_seat": "Vellmar",
      "details": "19.11.2025 (Bekanntmachungsdatum)\n\nHessen Amtsgericht Kassel HRA 18126\nRegisterbekanntmachung nach dem Umwandlungsgesetz 19.11.2025 (Eintragungsdatum)\n\nM&L Intensivpflege & Heimbeatmung e.K., Inhaber Menase Hailu\nEinzelkaufmann / Einzelkauffrau\nVellmar\n\nDen Gläubigern der an der Ausgliederung beteiligten Rechtsträger ist, wenn sie binnen sechs Monaten nach dem Tag, an dem die Eintragung der Ausgliederung in das Register des Sitzes desjenigen Rechtsträgers, dessen Gläubiger sie sind, nach §§ 125, 19 Absatz 3 UmwG bekannt gemacht worden ist, ihren Anspruch nach Grund und Höhe schriftlich anmelden, Sicherheit zu leisten, soweit sie nicht Befriedigung verlangen können. Dieses Recht steht den Gläubigern jedoch nur zu, wenn sie glaubhaft machen, dass durch die Ausgliederung die Erfüllung ihrer Forderung gefährdet wird."
    },
    {
      "date": "2025-11-19",
      "id": "137822",
      "original_text": "Einreichung neuer Dokumente\nHessen Amtsgericht Darmstadt HRB 9661\nSEG Stadtentwicklungsgesellschaft Ober-Ramstadt mbH – Ober-Ramstadt",
      "type": "Einreichung neuer Dokumente",
      "state": "Hessen",
      "amtsgericht": "Amtsgericht Darmstadt",
      "registernummer": "HRB 9661",
      "registerart": "HRB",
      "company_name": "SEG Stadtentwicklungsgesellschaft Ober-Ramstadt mbH",
      "company_seat": "Ober-Ramstadt",
      "details": "19.11.2025 (Bekanntmachungsdatum)\n\nHessen Amtsgericht Darmstadt HRB 9661\nEinreichung neuer Dokumente\n\nSEG Stadtentwicklungsgesellschaft Ober-Ramstadt mbH\nGesellschaft mit beschränkter Haftung\nOber-Ramstadt\n\nWegen Änderungen in den Personen der Aufsichtsratsmitglieder ist eine Liste der Mitglieder des Aufsichtsrates zum Handelsregister eingereicht worden."
    },
    {
      "date": "2025-11-19",
      "id": "137823",
      "original_text": "Einreichung neuer Dokumente\nHessen Amtsgericht Wiesbaden HRB 20279\nRüdesheim Tourist AG – Rüdesheim am Rhein",
      "type": "Einreichung neuer Dokumente",
      "state": "Hessen",
      "amtsgericht": "Amtsgericht Wiesbaden",
      "registernummer": "HRB 20279",
      "registerart": "HRB",
      "company_name": "Rüdesheim Tourist AG",
      "company_seat": "Rüdesheim am Rhein",
      "details": "19.11.2025 (Bekanntmachungsdatum)\n\nHessen Amtsgericht Wiesbaden HRB 20279\nEinreichung neuer Dokumente\n\nRüdesheim Tourist AG\nAktiengesellschaft\nRüdesheim am Rhein\n\nDurch eine Änderung in den Personen der Aufsichtsratsmitglieder ist eine Liste der Mitglieder des Aufsichtsrates zum Handelsregister eingereicht worden."
    },
    {
      "date": "2025-11-19",
      "id": "137824",
      "original_text": "Registerbekanntmachung nach dem Umwandlungsgesetz\nHessen Amtsgericht Kassel HRB 19762\nM&L Intensivpflege GmbH – Vellmar",
      "type": "Registerbekanntmachung nach dem Umwandlungsgesetz",
      "state": "Hessen",
      "amtsgericht": "Amtsgericht Kassel",
      "registernummer": "HRB 19762",
      "registerart": "HRB",
      "company_name": "M&L Intensivpflege GmbH",
      "company_seat": "Vellmar",
      "details": "19.11.2025 (Bekanntmachungsdatum)\n\nHessen Amtsgericht Kassel HRB 19762\nRegisterbekanntmachung nach dem Umwandlungsgesetz 19.11.2025 (Eintragungsdatum)\n\nM&L Intensivpflege GmbH\nGesellschaft mit beschränkter Haftung\nVellmar\n\nDen Gläubigern der an der Ausgliederung beteiligten Rechtsträger ist, wenn sie binnen sechs Monaten nach dem Tag, an dem die Eintragung der Ausgliederung in das Register des Sitzes desjenigen Rechtsträgers, dessen Gläubiger sie sind, nach §§ 125, 19 Absatz 3 UmwG bekannt gemacht worden ist, ihren Anspruch nach Grund und Höhe schriftlich anmelden, Sicherheit zu leisten, soweit sie nicht Befriedigung verlangen können. Dieses Recht steht den Gläubigern jedoch nur zu, wenn sie glaubhaft machen, dass durch die Ausgliederung die Erfüllung ihrer Forderung gefährdet wird."
    },
    {
      "date": "2025-11-19",
      "id": "137825",
      "original_text": "Löschungsankündigung\nHessen Amtsgericht Darmstadt HRB 105240\nStarkenburger SZ Personal und Dienstleistungs GmbH – Griesheim",
      "type": "Löschungsankündigung",
      "state": "Hessen",
      "amtsgericht": "Amtsgericht Darmstadt",
      "registernummer": "HRB 105240",
      "registerart": "HRB",
      "company_name": "Starkenburger SZ Personal und Dienstleistungs GmbH",
      "company_seat": "Griesheim",
      "details": "19.11.2025 (Bekanntmachungsdatum)\n\nHessen Amtsgericht Darmstadt HRB 105240\nLöschungsankündigung\n\nStarkenburger SZ Personal und Dienstleistungs GmbH\nGesellschaft mit beschränkter Haftung\nGriesheim\n\nDas Registergericht beabsichtigt die im Handelsregister eingetragene Gesellschaft von Amts wegen nach § 394 FamFG zu löschen. Die Frist zur Erhebung eines Widerspruchs gegen die beabsichtigte Löschung wird auf 3 Monate festgesetzt."
    },
    {
      "date": "2025-11-19",
      "id": "137826",
      "original_text": "Sonstige Registerbekanntmachung\nHessen Amtsgericht Fritzlar VR 3611\nHessischer Weiterbildungsverbund für Klinische Neuropsychologie (HWKN) – Bad Wildungen",
      "type": "Sonstige Registerbekanntmachung",
      "state": "Hessen",
      "amtsgericht": "Amtsgericht Fritzlar",
      "registernummer": "VR 3611",
      "registerart": "VR",
      "company_name": "Hessischer Weiterbildungsverbund für Klinische Neuropsychologie (HWKN)",
      "company_seat": "Bad Wildungen",
      "details": "19.11.2025 (Bekanntmachungsdatum)\n\nHessen Amtsgericht Fritzlar VR 3611\nSonstige Registerbekanntmachung 19.11.2025 (Eintragungsdatum)\n\nHessischer Weiterbildungsverbund für Klinische Neuropsychologie (HWKN)\neingetragener Verein\nBad Wildungen\n\nDer Verein ist aufgelöst."
    },
    {
      "date": "2025-11-19",
      "id": "137827",
      "original_text": "Löschungsankündigung\nHessen Amtsgericht Bad Homburg v.d.H. HRB 15460\nSchulz Baudienstleistungen GmbH – Steinbach (Taunus)",
      "type": "Löschungsankündigung",
      "state": "Hessen",
      "amtsgericht": "Amtsgericht Bad Homburg v.d.H.",
      "registernummer": "HRB 15460",
      "registerart": "HRB",
      "company_name": "Schulz Baudienstleistungen GmbH",
      "company_seat": "Steinbach (Taunus)",
      "details": "19.11.2025 (Bekanntmachungsdatum)\n\nHessen Amtsgericht Bad Homburg v.d.H. HRB 15460\nLöschungsankündigung\n\nSchulz Baudienstleistungen GmbH\nGesellschaft mit beschränkter Haftung\nSteinbach (Taunus)\n\nDas Registergericht beabsichtigt die im Handelsregister eingetragene Gesellschaft von Amts wegen nach § 394 FamFG zu löschen. Die Frist zur Erhebung eines Widerspruchs gegen die beabsichtigte Löschung wird auf 3 Monate festgesetzt."
    },
    {
      "date": "2025-11-19",
      "id": "137828",
      "original_text": "Registerbekanntmachung nach dem Umwandlungsgesetz\nHessen Amtsgericht Frankfurt am Main HRB 125702\nSechsundzwanzigste K.G.R. Real Estate GmbH – Frankfurt am Main",
      "type": "Registerbekanntmachung nach dem Umwandlungsgesetz",
      "state": "Hessen",
      "amtsgericht": "Amtsgericht Frankfurt am Main",
      "registernummer": "HRB 125702",
      "registerart": "HRB",
      "company_name": "Sechsundzwanzigste K.G.R. Real Estate GmbH",
      "company_seat": "Frankfurt am Main",
      "details": "19.11.2025 (Bekanntmachungsdatum)\n\nHessen Amtsgericht Frankfurt am Main HRB 125702\nRegisterbekanntmachung nach dem Umwandlungsgesetz 19.11.2025 (Eintragungsdatum)\n\nSechsundzwanzigste K.G.R. Real Estate GmbH\nGesellschaft mit beschränkter Haftung\nFrankfurt am Main\n\nDen Gläubigern der an der Verschmelzung beteiligten Rechtsträger ist, wenn sie binnen sechs Monaten nach dem Tag, an dem die Eintragung der Verschmelzung in das Register des Sitzes desjenigen Rechtsträgers, dessen Gläubiger sie sind, nach § 19 Absatz 3 UmwG bekannt gemacht worden ist, ihren Anspruch nach Grund und Höhe schriftlich anmelden, Sicherheit zu leisten, soweit sie nicht Befriedigung verlangen können. Dieses Recht steht den Gläubigern jedoch nur zu, wenn sie glaubhaft machen, dass durch die Verschmelzung die Erfüllung ihrer Forderung gefährdet wird."
    },
    {
      "date": "2025-11-19",
      "id": "137829",
      "original_text": "Registerbekanntmachung nach dem Umwandlungsgesetz\nHessen Amtsgericht Frankfurt am Main HRB 125702\nSechsundzwanzigste K.G.R. Real Estate GmbH – Frankfurt am Main",
      "type": "Registerbekanntmachung nach dem Umwandlungsgesetz",
      "state": "Hessen",
      "amtsgericht": "Amtsgericht Frankfurt am Main",
      "registernummer": "HRB 125702",
      "registerart": "HRB",
      "company_name": "Sechsundzwanzigste K.G.R. Real Estate GmbH",
      "company_seat": "Frankfurt am Main",
      "details": "19.11.2025 (Bekanntmachungsdatum)\n\nHessen Amtsgericht Frankfurt am Main HRB 125702\nRegisterbekanntmachung nach dem Umwandlungsgesetz 19.11.2025 (Eintragungsdatum)\n\nSechsundzwanzigste K.G.R. Real Estate GmbH\nGesellschaft mit beschränkter Haftung\nFrankfurt am Main\n\nDen Gläubigern der an der Verschmelzung beteiligten Rechtsträger ist, wenn sie binnen sechs Monaten nach dem Tag, an dem die Eintragung der Verschmelzung in das Register des Sitzes desjenigen Rechtsträgers, dessen Gläubiger sie sind, nach § 19 Absatz 3 UmwG bekannt gemacht worden ist, ihren Anspruch nach Grund und Höhe schriftlich anmelden, Sicherheit zu leisten, soweit sie nicht Befriedigung verlangen können. Dieses Recht steht den Gläubigern jedoch nur zu, wenn sie glaubhaft machen, dass durch die Verschmelzung die Erfüllung ihrer Forderung gefährdet wird."
    }
  ]
}