{
  "date": "2025-11-11",
  "date_of_scrape": "2025-11-12T04:11:07.040Z",
  "tool_version": "0.2.0",
  "number_of_announcements": 135,
  "announcements": [
    {
      "date": "2025-11-11",
      "id": "136878",
      "original_text": "Sonstige Registerbekanntmachung\nBayern Amtsgericht Bayreuth HRB 3844\nSCD Proß GmbH – Haag OT Unternschreez",
      "type": "Sonstige Registerbekanntmachung",
      "state": "Bayern",
      "amtsgericht": "Amtsgericht Bayreuth",
      "registernummer": "HRB 3844",
      "registerart": "HRB",
      "company_name": "SCD Proß GmbH",
      "company_seat": "Haag OT Unternschreez",
      "details": "11.11.2025 (Bekanntmachungsdatum)\n\nBayern Amtsgericht Bayreuth HRB 3844\nSonstige Registerbekanntmachung 10.11.2025 (Eintragungsdatum)\n\nSCD Proß GmbH\nGesellschaft mit beschränkter Haftung\nHaag OT Unternschreez\n\nDen Gläubigern der an der Verschmelzung beteiligten Rechtsträger ist, wenn sie binnen sechs Monaten nach dem Tag, an dem die Eintragung der Verschmelzung in das Register des Sitzes desjenigen Rechtsträgers, dessen Gläubiger sie sind, nach § 19 Abs. 3 UmwG als bekannt gemacht gilt, ihren Anspruch nach Grund und Höhe in Textform anmelden, Sicherheit zu leisten, soweit sie nicht Befriedigung verlangen können. Dieses Recht steht den Gläubigern jedoch nur zu, wenn sie glaubhaft machen, dass durch die Verschmelzung die Erfüllung ihrer Forderung gefährdet wird."
    },
    {
      "date": "2025-11-11",
      "id": "136879",
      "original_text": "Registerbekanntmachung nach dem Umwandlungsgesetz\nBayern Amtsgericht Memmingen HRA 10586\nFoto Weiß, Inh. Robert Weiß e.Kfm. – Krumbach (Schwaben)",
      "type": "Registerbekanntmachung nach dem Umwandlungsgesetz",
      "state": "Bayern",
      "amtsgericht": "Amtsgericht Memmingen",
      "registernummer": "HRA 10586",
      "registerart": "HRA",
      "company_name": "Foto Weiß, Inh. Robert Weiß e.Kfm.",
      "company_seat": "Krumbach (Schwaben)",
      "details": "11.11.2025 (Bekanntmachungsdatum)\n\nBayern Amtsgericht Memmingen HRA 10586\nRegisterbekanntmachung nach dem Umwandlungsgesetz 10.11.2025 (Eintragungsdatum)\n\nFoto Weiß, Inh. Robert Weiß e.Kfm.\nEinzelkaufmann / Einzelkauffrau\nKrumbach (Schwaben)\n\nDen Gläubigern der an der Ausgliederung beteiligten Rechtsträger ist, wenn sie binnen sechs Monaten nach dem Tag, an dem die Eintragung der Ausgliederung in das Register des Sitzes desjenigen Rechtsträgers, dessen Gläubiger sie sind, nach §§ 125, 19 Abs. 3 UmwG als bekannt gemacht gilt, ihren Anspruch nach Grund und Höhe in Textform anmelden, Sicherheit zu leisten, soweit sie nicht Befriedigung verlangen können. Dieses Recht steht den Gläubigern jedoch nur zu, wenn sie glaubhaft machen, dass durch die Ausgliederung die Erfüllung ihrer Forderung gefährdet wird."
    },
    {
      "date": "2025-11-11",
      "id": "136880",
      "original_text": "Registerbekanntmachung nach dem Umwandlungsgesetz\nBayern Amtsgericht Ansbach HRA 4876\nBioenergie Sauer e.K. – Markt Berolzheim",
      "type": "Registerbekanntmachung nach dem Umwandlungsgesetz",
      "state": "Bayern",
      "amtsgericht": "Amtsgericht Ansbach",
      "registernummer": "HRA 4876",
      "registerart": "HRA",
      "company_name": "Bioenergie Sauer e.K.",
      "company_seat": "Markt Berolzheim",
      "details": "11.11.2025 (Bekanntmachungsdatum)\n\nBayern Amtsgericht Ansbach HRA 4876\nRegisterbekanntmachung nach dem Umwandlungsgesetz 10.11.2025 (Eintragungsdatum)\n\nBioenergie Sauer e.K.\nEinzelkaufmann / Einzelkauffrau\nMarkt Berolzheim\n\nDen Gläubigern der an der Ausgliederung beteiligten Rechtsträger ist, wenn sie binnen sechs Monaten nach dem Tag, an dem die Eintragung der Ausgliederung in das Register des Sitzes desjenigen Rechtsträgers, dessen Gläubiger sie sind, nach §§ 125, 19 Abs. 3 UmwG als bekannt gemacht gilt, ihren Anspruch nach Grund und Höhe in Textform anmelden, Sicherheit zu leisten, soweit sie nicht Befriedigung verlangen können. Dieses Recht steht den Gläubigern jedoch nur zu, wenn sie glaubhaft machen, dass durch die Ausgliederung die Erfüllung ihrer Forderung gefährdet wird."
    },
    {
      "date": "2025-11-11",
      "id": "136881",
      "original_text": "Löschungsankündigung\nBayern Amtsgericht München HRB 230961\nFFS Fine Food Solutions GmbH – München",
      "type": "Löschungsankündigung",
      "state": "Bayern",
      "amtsgericht": "Amtsgericht München",
      "registernummer": "HRB 230961",
      "registerart": "HRB",
      "company_name": "FFS Fine Food Solutions GmbH",
      "company_seat": "München",
      "details": "11.11.2025 (Bekanntmachungsdatum)\n\nBayern Amtsgericht München HRB 230961\nLöschungsankündigung 10.11.2025 (Eintragungsdatum)\n\nFFS Fine Food Solutions GmbH\nGesellschaft mit beschränkter Haftung\nMünchen\n\nDas Registergericht beabsichtigt, die im Handelsregister eingetragene Gesellschaft wegen Vermögenslosigkeit von Amts wegen nach § 394 FamFG zu löschen. Die Frist zur Erhebung eines Widerspruchs ist auf drei Monate festgesetzt. Dem #Re.Name ist eine Liste der Mitglieder des Aufsichtsrats eingereicht worden, § 52 Abs. 3 S. 2 GmbHG."
    },
    {
      "date": "2025-11-11",
      "id": "136882",
      "original_text": "Registerbekanntmachung nach dem Umwandlungsgesetz\nBayern Amtsgericht Nürnberg HRB 3532\nL. Wagner Bauverwaltung GmbH – Nürnberg",
      "type": "Registerbekanntmachung nach dem Umwandlungsgesetz",
      "state": "Bayern",
      "amtsgericht": "Amtsgericht Nürnberg",
      "registernummer": "HRB 3532",
      "registerart": "HRB",
      "company_name": "L. Wagner Bauverwaltung GmbH",
      "company_seat": "Nürnberg",
      "details": "11.11.2025 (Bekanntmachungsdatum)\n\nBayern Amtsgericht Nürnberg HRB 3532\nRegisterbekanntmachung nach dem Umwandlungsgesetz 09.11.2025 (Eintragungsdatum)\n\nL. Wagner Bauverwaltung GmbH\nGesellschaft mit beschränkter Haftung\nNürnberg\n\nDen Gläubigern der an der Verschmelzung beteiligten Rechtsträger ist, wenn sie binnen sechs Monaten nach dem Tag, an dem die Eintragung der Verschmelzung in das Register des Sitzes desjenigen Rechtsträgers, dessen Gläubiger sie sind, nach § 19 Abs. 3 UmwG als bekannt gemacht gilt, ihren Anspruch nach Grund und Höhe in Textform anmelden, Sicherheit zu leisten, soweit sie nicht Befriedigung verlangen können. Dieses Recht steht den Gläubigern jedoch nur zu, wenn sie glaubhaft machen, dass durch die Verschmelzung die Erfüllung ihrer Forderung gefährdet wird."
    },
    {
      "date": "2025-11-11",
      "id": "136883",
      "original_text": "Registerbekanntmachung nach dem Umwandlungsgesetz\nBayern Amtsgericht Ansbach HRB 8118\nBioenergie Sauer GmbH – Markt Berolzheim",
      "type": "Registerbekanntmachung nach dem Umwandlungsgesetz",
      "state": "Bayern",
      "amtsgericht": "Amtsgericht Ansbach",
      "registernummer": "HRB 8118",
      "registerart": "HRB",
      "company_name": "Bioenergie Sauer GmbH",
      "company_seat": "Markt Berolzheim",
      "details": "11.11.2025 (Bekanntmachungsdatum)\n\nBayern Amtsgericht Ansbach HRB 8118\nRegisterbekanntmachung nach dem Umwandlungsgesetz 10.11.2025 (Eintragungsdatum)\n\nBioenergie Sauer GmbH\nGesellschaft mit beschränkter Haftung\nMarkt Berolzheim\n\nDen Gläubigern der an der Verschmelzung beteiligten Rechtsträger ist, wenn sie binnen sechs Monaten nach dem Tag, an dem die Eintragung der Verschmelzung in das Register des Sitzes desjenigen Rechtsträgers, dessen Gläubiger sie sind, nach § 19 Abs. 3 UmwG als bekannt gemacht gilt, ihren Anspruch nach Grund und Höhe in Textform anmelden, Sicherheit zu leisten, soweit sie nicht Befriedigung verlangen können. Dieses Recht steht den Gläubigern jedoch nur zu, wenn sie glaubhaft machen, dass durch die Verschmelzung die Erfüllung ihrer Forderung gefährdet wird."
    },
    {
      "date": "2025-11-11",
      "id": "136884",
      "original_text": "Registerbekanntmachung nach dem Umwandlungsgesetz\nBayern Amtsgericht München HRB 301888\nBrightsea GmbH – München",
      "type": "Registerbekanntmachung nach dem Umwandlungsgesetz",
      "state": "Bayern",
      "amtsgericht": "Amtsgericht München",
      "registernummer": "HRB 301888",
      "registerart": "HRB",
      "company_name": "Brightsea GmbH",
      "company_seat": "München",
      "details": "11.11.2025 (Bekanntmachungsdatum)\n\nBayern Amtsgericht München HRB 301888\nRegisterbekanntmachung nach dem Umwandlungsgesetz\n\nBrightsea GmbH\nGesellschaft mit beschränkter Haftung\nMünchen\n\nEs wird darauf hingewiesen, dass der Entwurf eines Verschmelzungsplans über eine grenzüberschreitende Verschmelzung zur Aufnahme mit der BrightSea B.V. mit Sitz in Venlo/Niederlande (Kamer van Koophandel 95237151) (besloten vennootschap met beperkte aansprakelijkheid / Gesellschaft mit beschränkter Haftung nach niederländischem Recht) beim Handelsregister eingereicht worden ist.\nWeder die BrightSea B.V. noch die Brightsea GmbH beschäftigen Arbeitnehmer und daher ist auch kein Betriebsrat bei ihnen eingerichtet.\nDie Anteilsinhaber sowie die Gläubiger der an der grenzüberschreitenden Verschmelzung beteiligten Gesellschaften können der jeweiligen Gesellschaft spätestens fünf Arbeitstage vor dem Tag der Gesellschafterversammlung Bemerkungen zum Verschmelzungsplan übermitteln. Der Verschmelzungsplan soll am 13. Februar 2026 beurkundet werden."
    },
    {
      "date": "2025-11-11",
      "id": "136885",
      "original_text": "Registerbekanntmachung nach dem Umwandlungsgesetz\nBayern Amtsgericht Fürth HRA 12589\nGerlingo, Inhaber Sonja Roskar e.K. – Zirndorf",
      "type": "Registerbekanntmachung nach dem Umwandlungsgesetz",
      "state": "Bayern",
      "amtsgericht": "Amtsgericht Fürth",
      "registernummer": "HRA 12589",
      "registerart": "HRA",
      "company_name": "Gerlingo, Inhaber Sonja Roskar e.K.",
      "company_seat": "Zirndorf",
      "details": "11.11.2025 (Bekanntmachungsdatum)\n\nBayern Amtsgericht Fürth HRA 12589\nRegisterbekanntmachung nach dem Umwandlungsgesetz 10.11.2025 (Eintragungsdatum)\n\nGerlingo, Inhaber Sonja Roskar e.K.\nEinzelkaufmann / Einzelkauffrau\nZirndorf\n\nDen Gläubigern der an der Ausgliederung beteiligten Rechtsträger ist, wenn sie binnen sechs Monaten nach dem Tag, an dem die Eintragung der Ausgliederung in das Register des Sitzes desjenigen Rechtsträgers, dessen Gläubiger sie sind, nach §§ 125, 19 Abs. 3 UmwG als bekannt gemacht gilt, ihren Anspruch nach Grund und Höhe in Textform anmelden, Sicherheit zu leisten, soweit sie nicht Befriedigung verlangen können. Dieses Recht steht den Gläubigern jedoch nur zu, wenn sie glaubhaft machen, dass durch die Ausgliederung die Erfüllung ihrer Forderung gefährdet wird."
    },
    {
      "date": "2025-11-11",
      "id": "136886",
      "original_text": "Registerbekanntmachung nach dem Umwandlungsgesetz\nBayern Amtsgericht Fürth HRB 14418\nGBI Wohnungsbau Alpha GmbH – Erlangen",
      "type": "Registerbekanntmachung nach dem Umwandlungsgesetz",
      "state": "Bayern",
      "amtsgericht": "Amtsgericht Fürth",
      "registernummer": "HRB 14418",
      "registerart": "HRB",
      "company_name": "GBI Wohnungsbau Alpha GmbH",
      "company_seat": "Erlangen",
      "details": "11.11.2025 (Bekanntmachungsdatum)\n\nBayern Amtsgericht Fürth HRB 14418\nRegisterbekanntmachung nach dem Umwandlungsgesetz 10.11.2025 (Eintragungsdatum)\n\nGBI Wohnungsbau Alpha GmbH\nGesellschaft mit beschränkter Haftung\nErlangen\n\nDen Gläubigern der an der Verschmelzung beteiligten Rechtsträger ist, wenn sie binnen sechs Monaten nach dem Tag, an dem die Eintragung der Verschmelzung in das Register des Sitzes desjenigen Rechtsträgers, dessen Gläubiger sie sind, nach § 19 Abs. 3 UmwG als bekannt gemacht gilt, ihren Anspruch nach Grund und Höhe in Textform anmelden, Sicherheit zu leisten, soweit sie nicht Befriedigung verlangen können. Dieses Recht steht den Gläubigern jedoch nur zu, wenn sie glaubhaft machen, dass durch die Verschmelzung die Erfüllung ihrer Forderung gefährdet wird."
    },
    {
      "date": "2025-11-11",
      "id": "136887",
      "original_text": "Löschungsankündigung\nBayern Amtsgericht Kempten (Allgäu) HRB 13176\nISG Verwaltungs-UG (haftungsbeschränkt) – Füssen",
      "type": "Löschungsankündigung",
      "state": "Bayern",
      "amtsgericht": "Amtsgericht Kempten (Allgäu)",
      "registernummer": "HRB 13176",
      "registerart": "HRB",
      "company_name": "ISG Verwaltungs-UG (haftungsbeschränkt)",
      "company_seat": "Füssen",
      "details": "11.11.2025 (Bekanntmachungsdatum)\n\nBayern Amtsgericht Kempten (Allgäu) HRB 13176\nLöschungsankündigung\n\nISG Verwaltungs-UG (haftungsbeschränkt)\nGesellschaft mit beschränkter Haftung\nFüssen\n\nDas Registergericht beabsichtigt, die im Handelsregister eingetragene Gesellschaft wegen Vermögenslosigkeit von Amts wegen nach § 394 FamFG zu löschen. Die Frist zur Erhebung eines Widerspruchs ist auf einen Monat festgesetzt."
    },
    {
      "date": "2025-11-11",
      "id": "136888",
      "original_text": "Registerbekanntmachung nach dem Umwandlungsgesetz\nBayern Amtsgericht München HRA 115920\nmaisells e.K. – Poing",
      "type": "Registerbekanntmachung nach dem Umwandlungsgesetz",
      "state": "Bayern",
      "amtsgericht": "Amtsgericht München",
      "registernummer": "HRA 115920",
      "registerart": "HRA",
      "company_name": "maisells e.K.",
      "company_seat": "Poing",
      "details": "11.11.2025 (Bekanntmachungsdatum)\n\nBayern Amtsgericht München HRA 115920\nRegisterbekanntmachung nach dem Umwandlungsgesetz 10.11.2025 (Eintragungsdatum)\n\nmaisells e.K.\nEinzelkaufmann / Einzelkauffrau\nPoing\n\nDen Gläubigern der an der Verschmelzung beteiligten Rechtsträger ist, wenn sie binnen sechs Monaten nach dem Tag, an dem die Eintragung der Verschmelzung in das Register des Sitzes desjenigen Rechtsträgers, dessen Gläubiger sie sind, nach § 19 Abs. 3 UmwG als bekannt gemacht gilt, ihren Anspruch nach Grund und Höhe in Textform anmelden, Sicherheit zu leisten, soweit sie nicht Befriedigung verlangen können. Dieses Recht steht den Gläubigern jedoch nur zu, wenn sie glaubhaft machen, dass durch die Verschmelzung die Erfüllung ihrer Forderung gefährdet wird."
    },
    {
      "date": "2025-11-11",
      "id": "136889",
      "original_text": "Registerbekanntmachung nach dem Umwandlungsgesetz\nBayern Amtsgericht Kempten (Allgäu) HRA 11720\nMM - Bauschlosserei Michael Metzeler e. K. – Immenstadt i. Allgäu",
      "type": "Registerbekanntmachung nach dem Umwandlungsgesetz",
      "state": "Bayern",
      "amtsgericht": "Amtsgericht Kempten (Allgäu)",
      "registernummer": "HRA 11720",
      "registerart": "HRA",
      "company_name": "MM - Bauschlosserei Michael Metzeler e. K.",
      "company_seat": "Immenstadt i. Allgäu",
      "details": "11.11.2025 (Bekanntmachungsdatum)\n\nBayern Amtsgericht Kempten (Allgäu) HRA 11720\nRegisterbekanntmachung nach dem Umwandlungsgesetz 08.11.2025 (Eintragungsdatum)\n\nMM - Bauschlosserei Michael Metzeler e. K.\nEinzelkaufmann / Einzelkauffrau\nImmenstadt i. Allgäu\n\nDen Gläubigern der an der Ausgliederung beteiligten Rechtsträger ist, wenn sie binnen sechs Monaten nach dem Tag, an dem die Eintragung der Ausgliederung in das Register des Sitzes desjenigen Rechtsträgers, dessen Gläubiger sie sind, nach §§ 125, 19 Abs. 3 UmwG als bekannt gemacht gilt, ihren Anspruch nach Grund und Höhe in Textform anmelden, Sicherheit zu leisten, soweit sie nicht Befriedigung verlangen können. Dieses Recht steht den Gläubigern jedoch nur zu, wenn sie glaubhaft machen, dass durch die Ausgliederung die Erfüllung ihrer Forderung gefährdet wird."
    },
    {
      "date": "2025-11-11",
      "id": "136890",
      "original_text": "Registerbekanntmachung nach dem Umwandlungsgesetz\nBayern Amtsgericht Nürnberg HRA 18820\nAlchemy Germany Holdco 2 GmbH & Co. KG – Velden",
      "type": "Registerbekanntmachung nach dem Umwandlungsgesetz",
      "state": "Bayern",
      "amtsgericht": "Amtsgericht Nürnberg",
      "registernummer": "HRA 18820",
      "registerart": "HRA",
      "company_name": "Alchemy Germany Holdco 2 GmbH & Co. KG",
      "company_seat": "Velden",
      "details": "11.11.2025 (Bekanntmachungsdatum)\n\nBayern Amtsgericht Nürnberg HRA 18820\nRegisterbekanntmachung nach dem Umwandlungsgesetz 10.11.2025 (Eintragungsdatum)\n\nAlchemy Germany Holdco 2 GmbH & Co. KG\nKommanditgesellschaft\nVelden\n\nDen Gläubigern der an der Verschmelzung beteiligten Rechtsträger ist, wenn sie binnen sechs Monaten nach dem Tag, an dem die Eintragung der Verschmelzung in das Register des Sitzes desjenigen Rechtsträgers, dessen Gläubiger sie sind, nach § 19 Abs. 3 UmwG als bekannt gemacht gilt, ihren Anspruch nach Grund und Höhe in Textform anmelden, Sicherheit zu leisten, soweit sie nicht Befriedigung verlangen können. Dieses Recht steht den Gläubigern jedoch nur zu, wenn sie glaubhaft machen, dass durch die Verschmelzung die Erfüllung ihrer Forderung gefährdet wird."
    },
    {
      "date": "2025-11-11",
      "id": "136891",
      "original_text": "Registerbekanntmachung nach dem Umwandlungsgesetz\nBayern Amtsgericht München HRB 245579\nAURELIUS Development Ten GmbH – Grünwald",
      "type": "Registerbekanntmachung nach dem Umwandlungsgesetz",
      "state": "Bayern",
      "amtsgericht": "Amtsgericht München",
      "registernummer": "HRB 245579",
      "registerart": "HRB",
      "company_name": "AURELIUS Development Ten GmbH",
      "company_seat": "Grünwald",
      "details": "11.11.2025 (Bekanntmachungsdatum)\n\nBayern Amtsgericht München HRB 245579\nRegisterbekanntmachung nach dem Umwandlungsgesetz 10.11.2025 (Eintragungsdatum)\n\nAURELIUS Development Ten GmbH\nGesellschaft mit beschränkter Haftung\nGrünwald\n\nDen Gläubigern des formwechselnden Rechtsträgers ist, wenn sie binnen sechs Monaten nach dem Tag, an dem die Eintragung des Formwechsels nach § 201 UmwG als bekannt gemacht gilt, ihren Anspruch nach Grund und Höhe in Textform anmelden, Sicherheit zu leisten, soweit sie nicht Befriedigung verlangen können. Dieses Recht steht den Gläubigern jedoch nur zu, wenn sie glaubhaft machen, dass durch den Formwechsel die Erfüllung ihrer Forderung gefährdet wird."
    },
    {
      "date": "2025-11-11",
      "id": "136892",
      "original_text": "Einreichung neuer Dokumente\nBayern Amtsgericht Ingolstadt HRB 5327\nBHB Brauholding Bayern-Mitte AG – Ingolstadt",
      "type": "Einreichung neuer Dokumente",
      "state": "Bayern",
      "amtsgericht": "Amtsgericht Ingolstadt",
      "registernummer": "HRB 5327",
      "registerart": "HRB",
      "company_name": "BHB Brauholding Bayern-Mitte AG",
      "company_seat": "Ingolstadt",
      "details": "11.11.2025 (Bekanntmachungsdatum)\n\nBayern Amtsgericht Ingolstadt HRB 5327\nEinreichung neuer Dokumente\n\nBHB Brauholding Bayern-Mitte AG\nAktiengesellschaft\nIngolstadt\n\nDem Amtsgericht Ingolstadt -Registergericht- ist eine Liste der Mitglieder des Aufsichtsrats eingereicht worden, § 106 AktG."
    },
    {
      "date": "2025-11-11",
      "id": "136893",
      "original_text": "Löschungsankündigung\nBayern Amtsgericht München HRB 265827\nDunja Abbruch UG (haftungsbeschränkt) – Neufahrn b.Freising",
      "type": "Löschungsankündigung",
      "state": "Bayern",
      "amtsgericht": "Amtsgericht München",
      "registernummer": "HRB 265827",
      "registerart": "HRB",
      "company_name": "Dunja Abbruch UG (haftungsbeschränkt)",
      "company_seat": "Neufahrn b.Freising",
      "details": "11.11.2025 (Bekanntmachungsdatum)\n\nBayern Amtsgericht München HRB 265827\nLöschungsankündigung 10.11.2025 (Eintragungsdatum)\n\nDunja Abbruch UG (haftungsbeschränkt)\nGesellschaft mit beschränkter Haftung\nNeufahrn b.Freising\n\nDas Registergericht beabsichtigt, die im Handelsregister eingetragene Gesellschaft wegen Vermögenslosigkeit von Amts wegen nach § 394 FamFG zu löschen. Die Frist zur Erhebung eines Widerspruchs ist auf drei Monate festgesetzt."
    },
    {
      "date": "2025-11-11",
      "id": "136894",
      "original_text": "Registerbekanntmachung nach dem Umwandlungsgesetz\nBayern Amtsgericht Memmingen HRA 14256\nRW Forst & Garten e.K. – Krumbach",
      "type": "Registerbekanntmachung nach dem Umwandlungsgesetz",
      "state": "Bayern",
      "amtsgericht": "Amtsgericht Memmingen",
      "registernummer": "HRA 14256",
      "registerart": "HRA",
      "company_name": "RW Forst & Garten e.K.",
      "company_seat": "Krumbach",
      "details": "11.11.2025 (Bekanntmachungsdatum)\n\nBayern Amtsgericht Memmingen HRA 14256\nRegisterbekanntmachung nach dem Umwandlungsgesetz 10.11.2025 (Eintragungsdatum)\n\nRW Forst & Garten e.K.\nEinzelkaufmann / Einzelkauffrau\nKrumbach\n\nDem Gläubigern der an der Ausgliederung beteiligten Rechtsträger ist, wenn sie binnen sechs Monaten nach dem Tag, an dem die Eintragung der Ausgliederung in das Register des Sitzes desjenigen Rechtsträgers, dessen Gläubiger sie sind, nach §§ 125, 19 Abs. 3 UmwG als bekannt gemacht gilt, ihren Anspruch nach Grund und Höhe in Textform anmelden, Sicherheit zu leisten, soweit sie nicht Befriedigung verlangen können. Dieses Recht steht den Gläubigern jedoch nur zu, wenn sie glaubhaft machen, dass durch die Ausgliederung die Erfüllung ihrer Forderung gefährdet wird."
    },
    {
      "date": "2025-11-11",
      "id": "136895",
      "original_text": "Registerbekanntmachung nach dem Umwandlungsgesetz\nBayern Amtsgericht Nürnberg HRB 7304\nNoris Immobilienfonds-Verwaltungsgesellschaft m.b.H. – Nürnberg",
      "type": "Registerbekanntmachung nach dem Umwandlungsgesetz",
      "state": "Bayern",
      "amtsgericht": "Amtsgericht Nürnberg",
      "registernummer": "HRB 7304",
      "registerart": "HRB",
      "company_name": "Noris Immobilienfonds-Verwaltungsgesellschaft m.b.H.",
      "company_seat": "Nürnberg",
      "details": "11.11.2025 (Bekanntmachungsdatum)\n\nBayern Amtsgericht Nürnberg HRB 7304\nRegisterbekanntmachung nach dem Umwandlungsgesetz 10.11.2025 (Eintragungsdatum)\n\nNoris Immobilienfonds-Verwaltungsgesellschaft m.b.H.\nGesellschaft mit beschränkter Haftung\nNürnberg\n\nDen Gläubigern der an der Verschmelzung beteiligten Rechtsträger ist, wenn sie binnen sechs Monaten nach dem Tag, an dem die Eintragung der Verschmelzung in das Register des Sitzes desjenigen Rechtsträgers, dessen Gläubiger sie sind, nach § 19 Abs. 3 UmwG als bekannt gemacht gilt, ihren Anspruch nach Grund und Höhe in Textform anmelden, Sicherheit zu leisten, soweit sie nicht Befriedigung verlangen können. Dieses Recht steht den Gläubigern jedoch nur zu, wenn sie glaubhaft machen, dass durch die Verschmelzung die Erfüllung ihrer Forderung gefährdet wird."
    },
    {
      "date": "2025-11-11",
      "id": "136896",
      "original_text": "Registerbekanntmachung nach dem Umwandlungsgesetz\nBayern Amtsgericht Memmingen HRB 19777\nLTG Ulm GmbH – Neu-Ulm",
      "type": "Registerbekanntmachung nach dem Umwandlungsgesetz",
      "state": "Bayern",
      "amtsgericht": "Amtsgericht Memmingen",
      "registernummer": "HRB 19777",
      "registerart": "HRB",
      "company_name": "LTG Ulm GmbH",
      "company_seat": "Neu-Ulm",
      "details": "11.11.2025 (Bekanntmachungsdatum)\n\nBayern Amtsgericht Memmingen HRB 19777\nRegisterbekanntmachung nach dem Umwandlungsgesetz 10.11.2025 (Eintragungsdatum)\n\nLTG Ulm GmbH\nGesellschaft mit beschränkter Haftung\nNeu-Ulm\n\nDen Gläubigern der an der Verschmelzung beteiligten Rechtsträger ist, wenn sie binnen sechs Monaten nach dem Tag, an dem die Eintragung der Verschmelzung in das Register des Sitzes desjenigen Rechtsträgers, dessen Gläubiger sie sind, nach § 19 Abs. 3 UmwG als bekannt gemacht gilt, ihren Anspruch nach Grund und Höhe in Textform anmelden, Sicherheit zu leisten, soweit sie nicht Befriedigung verlangen können. Dieses Recht steht den Gläubigern jedoch nur zu, wenn sie glaubhaft machen, dass durch die Verschmelzung die Erfüllung ihrer Forderung gefährdet wird."
    },
    {
      "date": "2025-11-11",
      "id": "136897",
      "original_text": "Löschungsankündigung\nBayern Amtsgericht Nürnberg HRB 24643\nTADANO FAUN Stahlbau GmbH – Lauf a.d. Pegnitz",
      "type": "Löschungsankündigung",
      "state": "Bayern",
      "amtsgericht": "Amtsgericht Nürnberg",
      "registernummer": "HRB 24643",
      "registerart": "HRB",
      "company_name": "TADANO FAUN Stahlbau GmbH",
      "company_seat": "Lauf a.d. Pegnitz",
      "details": "11.11.2025 (Bekanntmachungsdatum)\n\nBayern Amtsgericht Nürnberg HRB 24643\nLöschungsankündigung\n\nTADANO FAUN Stahlbau GmbH\nGesellschaft mit beschränkter Haftung\nLauf a.d. Pegnitz\n\nDas Registergericht beabsichtigt, die im Handelsregister eingetragene Gesellschaft wegen Vermögenslosigkeit von Amts wegen nach § 394 FamFG zu löschen. Die Frist zur Erhebung eines Widerspruchs ist auf einen Monat festgesetzt."
    },
    {
      "date": "2025-11-11",
      "id": "136898",
      "original_text": "Einreichung neuer Dokumente\nBayern Amtsgericht Traunstein HRB 10963\nWirtschaftsförderungsgesellschaft Burghausen mbH – Burghausen",
      "type": "Einreichung neuer Dokumente",
      "state": "Bayern",
      "amtsgericht": "Amtsgericht Traunstein",
      "registernummer": "HRB 10963",
      "registerart": "HRB",
      "company_name": "Wirtschaftsförderungsgesellschaft Burghausen mbH",
      "company_seat": "Burghausen",
      "details": "11.11.2025 (Bekanntmachungsdatum)\n\nBayern Amtsgericht Traunstein HRB 10963\nEinreichung neuer Dokumente\n\nWirtschaftsförderungsgesellschaft Burghausen mbH\nGesellschaft mit beschränkter Haftung\nBurghausen\n\nDem Amtsgericht Traunstein -Registergericht- ist eine Liste der Mitglieder des Aufsichtsrats eingereicht worden, § 52 Abs. 3 S. 2 GmbHG."
    },
    {
      "date": "2025-11-11",
      "id": "136899",
      "original_text": "Registerbekanntmachung nach dem Umwandlungsgesetz\nBayern Amtsgericht München HRB 248679\nqdive GmbH – München",
      "type": "Registerbekanntmachung nach dem Umwandlungsgesetz",
      "state": "Bayern",
      "amtsgericht": "Amtsgericht München",
      "registernummer": "HRB 248679",
      "registerart": "HRB",
      "company_name": "qdive GmbH",
      "company_seat": "München",
      "details": "11.11.2025 (Bekanntmachungsdatum)\n\nBayern Amtsgericht München HRB 248679\nRegisterbekanntmachung nach dem Umwandlungsgesetz 10.11.2025 (Eintragungsdatum)\n\nqdive GmbH\nGesellschaft mit beschränkter Haftung\nMünchen\n\nDen Gläubigern der an der Verschmelzung beteiligten Rechtsträger ist, wenn sie binnen sechs Monaten nach dem Tag, an dem die Eintragung der Verschmelzung in das Register des Sitzes desjenigen Rechtsträgers, dessen Gläubiger sie sind, nach § 19 Abs. 3 UmwG als bekannt gemacht gilt, ihren Anspruch nach Grund und Höhe in Textform anmelden, Sicherheit zu leisten, soweit sie nicht Befriedigung verlangen können. Dieses Recht steht den Gläubigern jedoch nur zu, wenn sie glaubhaft machen, dass durch die Verschmelzung die Erfüllung ihrer Forderung gefährdet wird."
    },
    {
      "date": "2025-11-11",
      "id": "136900",
      "original_text": "Registerbekanntmachung nach dem Umwandlungsgesetz\nBayern Amtsgericht Memmingen HRA 14320\nRW UG (haftungsbeschränkt) & Co. KG – Krumbach",
      "type": "Registerbekanntmachung nach dem Umwandlungsgesetz",
      "state": "Bayern",
      "amtsgericht": "Amtsgericht Memmingen",
      "registernummer": "HRA 14320",
      "registerart": "HRA",
      "company_name": "RW UG (haftungsbeschränkt) & Co. KG",
      "company_seat": "Krumbach",
      "details": "11.11.2025 (Bekanntmachungsdatum)\n\nBayern Amtsgericht Memmingen HRA 14320\nRegisterbekanntmachung nach dem Umwandlungsgesetz 10.11.2025 (Eintragungsdatum)\n\nRW UG (haftungsbeschränkt) & Co. KG\nKommanditgesellschaft\nKrumbach\n\nDen Gläubigern der an der Ausgliederung beteiligten Rechtsträger ist, wenn sie binnen sechs Monaten nach dem Tag, an dem die Eintragung der Ausgliederung in das Register des Sitzes desjenigen Rechtsträgers, dessen Gläubiger sie sind, nach §§ 125, 19 Abs. 3 UmwG als bekannt gemacht gilt, ihren Anspruch nach Grund und Höhe in Textform anmelden, Sicherheit zu leisten, soweit sie nicht Befriedigung verlangen können. Dieses Recht steht den Gläubigern jedoch nur zu, wenn sie glaubhaft machen, dass durch die Ausgliederung die Erfüllung ihrer Forderung gefährdet wird."
    },
    {
      "date": "2025-11-11",
      "id": "136901",
      "original_text": "Registerbekanntmachung nach dem Umwandlungsgesetz\nBayern Amtsgericht Kempten (Allgäu) HRB 18536\nMM - Bauschlosserei GmbH – Immenstadt i. Allgäu",
      "type": "Registerbekanntmachung nach dem Umwandlungsgesetz",
      "state": "Bayern",
      "amtsgericht": "Amtsgericht Kempten (Allgäu)",
      "registernummer": "HRB 18536",
      "registerart": "HRB",
      "company_name": "MM - Bauschlosserei GmbH",
      "company_seat": "Immenstadt i. Allgäu",
      "details": "11.11.2025 (Bekanntmachungsdatum)\n\nBayern Amtsgericht Kempten (Allgäu) HRB 18536\nRegisterbekanntmachung nach dem Umwandlungsgesetz 08.11.2025 (Eintragungsdatum)\n\nMM - Bauschlosserei GmbH\nGesellschaft mit beschränkter Haftung\nImmenstadt i. Allgäu\n\nDen Gläubigern der an der Ausgliederung beteiligten Rechtsträger ist, wenn sie binnen sechs Monaten nach dem Tag, an dem die Eintragung der Ausgliederung in das Register des Sitzes desjenigen Rechtsträgers, dessen Gläubiger sie sind, nach §§ 125, 19 Abs. 3 UmwG als bekannt gemacht gilt, ihren Anspruch nach Grund und Höhe in Textform anmelden, Sicherheit zu leisten, soweit sie nicht Befriedigung verlangen können. Dieses Recht steht den Gläubigern jedoch nur zu, wenn sie glaubhaft machen, dass durch die Ausgliederung die Erfüllung ihrer Forderung gefährdet wird."
    },
    {
      "date": "2025-11-11",
      "id": "136902",
      "original_text": "Löschungsankündigung\nBayern Amtsgericht Kempten (Allgäu) HRA 10488\nHBS Holzbausysteme Verwaltungs KG – Immenstadt i. Allgäu",
      "type": "Löschungsankündigung",
      "state": "Bayern",
      "amtsgericht": "Amtsgericht Kempten (Allgäu)",
      "registernummer": "HRA 10488",
      "registerart": "HRA",
      "company_name": "HBS Holzbausysteme Verwaltungs KG",
      "company_seat": "Immenstadt i. Allgäu",
      "details": "11.11.2025 (Bekanntmachungsdatum)\n\nBayern Amtsgericht Kempten (Allgäu) HRA 10488\nLöschungsankündigung\n\nHBS Holzbausysteme Verwaltungs KG\nKommanditgesellschaft\nImmenstadt i. Allgäu\n\nDas Registergericht beabsichtigt, die im Handelsregister eingetragene Gesellschaft von Amts wegen nach § 395 FamFG zu löschen. Die Frist zur Erhebung eines Widerspruchs ist auf einen Monat festgesetzt."
    },
    {
      "date": "2025-11-11",
      "id": "136903",
      "original_text": "Löschungsankündigung\nBayern Amtsgericht München HRA 117928\nSDS DE Achtunddreißig Immobilien GmbH & Co. KG – München",
      "type": "Löschungsankündigung",
      "state": "Bayern",
      "amtsgericht": "Amtsgericht München",
      "registernummer": "HRA 117928",
      "registerart": "HRA",
      "company_name": "SDS DE Achtunddreißig Immobilien GmbH & Co. KG",
      "company_seat": "München",
      "details": "11.11.2025 (Bekanntmachungsdatum)\n\nBayern Amtsgericht München HRA 117928\nLöschungsankündigung 10.11.2025 (Eintragungsdatum)\n\nSDS DE Achtunddreißig Immobilien GmbH & Co. KG\nKommanditgesellschaft\nMünchen\n\nDas Registergericht beabsichtigt, die im Handelsregister eingetragene Firma wegen Vermögenslosigkeit von Amts wegen nach § 394 FamFG zu löschen. Die Frist zur Erhebung eines Widerspruchs ist auf drei Monate festgesetzt."
    },
    {
      "date": "2025-11-11",
      "id": "136904",
      "original_text": "Einreichung neuer Dokumente\nBayern Amtsgericht Traunstein HRB 10689\nKOMRO Gesellschaft für Telekommunikation mit beschränkter Haftung – Rosenheim",
      "type": "Einreichung neuer Dokumente",
      "state": "Bayern",
      "amtsgericht": "Amtsgericht Traunstein",
      "registernummer": "HRB 10689",
      "registerart": "HRB",
      "company_name": "KOMRO Gesellschaft für Telekommunikation mit beschränkter Haftung",
      "company_seat": "Rosenheim",
      "details": "11.11.2025 (Bekanntmachungsdatum)\n\nBayern Amtsgericht Traunstein HRB 10689\nEinreichung neuer Dokumente\n\nKOMRO Gesellschaft für Telekommunikation mit beschränkter Haftung\nGesellschaft mit beschränkter Haftung\nRosenheim\n\nDem Amtsgericht Traunstein -Registergericht- ist eine Liste der Mitglieder des Aufsichtsrats eingereicht worden, § 52 Abs. 3 S. 2 GmbHG."
    },
    {
      "date": "2025-11-11",
      "id": "136905",
      "original_text": "Sonstige Registerbekanntmachung\nBayern Amtsgericht Bayreuth HRB 3706\nChristian Bär Verwaltungs-GmbH – Neudrossenfeld",
      "type": "Sonstige Registerbekanntmachung",
      "state": "Bayern",
      "amtsgericht": "Amtsgericht Bayreuth",
      "registernummer": "HRB 3706",
      "registerart": "HRB",
      "company_name": "Christian Bär Verwaltungs-GmbH",
      "company_seat": "Neudrossenfeld",
      "details": "11.11.2025 (Bekanntmachungsdatum)\n\nBayern Amtsgericht Bayreuth HRB 3706\nSonstige Registerbekanntmachung 10.11.2025 (Eintragungsdatum)\n\nChristian Bär Verwaltungs-GmbH\nGesellschaft mit beschränkter Haftung\nNeudrossenfeld\n\nDen Gläubigern der an der Verschmelzung beteiligten Rechtsträger ist, wenn sie binnen sechs Monaten nach dem Tag, an dem die Eintragung der Verschmelzung in das Register des Sitzes desjenigen Rechtsträgers, dessen Gläubiger sie sind, nach § 19 Abs. 3 UmwG als bekannt gemacht gilt, ihren Anspruch nach Grund und Höhe in Textform anmelden, Sicherheit zu leisten, soweit sie nicht Befriedigung verlangen können. Dieses Recht steht den Gläubigern jedoch nur zu, wenn sie glaubhaft machen, dass durch die Verschmelzung die Erfüllung ihrer Forderung gefährdet wird."
    },
    {
      "date": "2025-11-11",
      "id": "136906",
      "original_text": "Registerbekanntmachung nach dem Umwandlungsgesetz\nBayern Amtsgericht Memmingen HRA 14320\nRW UG (haftungsbeschränkt) & Co. KG – Krumbach",
      "type": "Registerbekanntmachung nach dem Umwandlungsgesetz",
      "state": "Bayern",
      "amtsgericht": "Amtsgericht Memmingen",
      "registernummer": "HRA 14320",
      "registerart": "HRA",
      "company_name": "RW UG (haftungsbeschränkt) & Co. KG",
      "company_seat": "Krumbach",
      "details": "11.11.2025 (Bekanntmachungsdatum)\n\nBayern Amtsgericht Memmingen HRA 14320\nRegisterbekanntmachung nach dem Umwandlungsgesetz 10.11.2025 (Eintragungsdatum)\n\nRW UG (haftungsbeschränkt) & Co. KG\nKommanditgesellschaft\nKrumbach\n\nDen Gläubigern der an der Ausgliederung beteiligten Rechtsträger ist, wenn sie binnen sechs Monaten nach dem Tag, an dem die Eintragung der Ausgliederung in das Register des Sitzes desjenigen Rechtsträgers, dessen Gläubiger sie sind, nach §§ 125, 19 Abs. 3 UmwG als bekannt gemacht gilt, ihren Anspruch nach Grund und Höhe in Textform anmelden, Sicherheit zu leisten, soweit sie nicht Befriedigung verlangen können. Dieses Recht steht den Gläubigern jedoch nur zu, wenn sie glaubhaft machen, dass durch die Ausgliederung die Erfüllung ihrer Forderung gefährdet wird."
    },
    {
      "date": "2025-11-11",
      "id": "136907",
      "original_text": "Einreichung neuer Dokumente\nBayern Amtsgericht München HRB 85840\nCONTIGAS Deutsche Energie-Aktiengesellschaft – München",
      "type": "Einreichung neuer Dokumente",
      "state": "Bayern",
      "amtsgericht": "Amtsgericht München",
      "registernummer": "HRB 85840",
      "registerart": "HRB",
      "company_name": "CONTIGAS Deutsche Energie-Aktiengesellschaft",
      "company_seat": "München",
      "details": "11.11.2025 (Bekanntmachungsdatum)\n\nBayern Amtsgericht München HRB 85840\nEinreichung neuer Dokumente\n\nCONTIGAS Deutsche Energie-Aktiengesellschaft\nAktiengesellschaft\nMünchen\n\nDem Amtsgericht München -Registergericht- ist eine Liste der Mitglieder des Aufsichtsrats eingereicht worden, § 106 AktG."
    },
    {
      "date": "2025-11-11",
      "id": "136908",
      "original_text": "Sonstige Registerbekanntmachung\nBayern Amtsgericht Bayreuth HRB 1025\nS.A.G. Service und Anlagen GmbH – Neudrossenfeld",
      "type": "Sonstige Registerbekanntmachung",
      "state": "Bayern",
      "amtsgericht": "Amtsgericht Bayreuth",
      "registernummer": "HRB 1025",
      "registerart": "HRB",
      "company_name": "S.A.G. Service und Anlagen GmbH",
      "company_seat": "Neudrossenfeld",
      "details": "11.11.2025 (Bekanntmachungsdatum)\n\nBayern Amtsgericht Bayreuth HRB 1025\nSonstige Registerbekanntmachung 10.11.2025 (Eintragungsdatum)\n\nS.A.G. Service und Anlagen GmbH\nGesellschaft mit beschränkter Haftung\nNeudrossenfeld\n\nDen Gläubigern der an der Verschmelzung beteiligten Rechtsträger ist, wenn sie binnen sechs Monaten nach dem Tag, an dem die Eintragung der Verschmelzung in das Register des Sitzes desjenigen Rechtsträgers, dessen Gläubiger sie sind, nach § 19 Abs. 3 UmwG als bekannt gemacht gilt, ihren Anspruch nach Grund und Höhe in Textform anmelden, Sicherheit zu leisten, soweit sie nicht Befriedigung verlangen können. Dieses Recht steht den Gläubigern jedoch nur zu, wenn sie glaubhaft machen, dass durch die Verschmelzung die Erfüllung ihrer Forderung gefährdet wird."
    },
    {
      "date": "2025-11-11",
      "id": "136909",
      "original_text": "Registerbekanntmachung nach dem Umwandlungsgesetz\nBaden-Württemberg Amtsgericht Stuttgart GsR 3556\nSchwalbe & Weickert eGbR – Esslingen am Neckar",
      "type": "Registerbekanntmachung nach dem Umwandlungsgesetz",
      "state": "Baden-Württemberg",
      "amtsgericht": "Amtsgericht Stuttgart",
      "registernummer": "GsR 3556",
      "registerart": "GsR",
      "company_name": "Schwalbe & Weickert eGbR",
      "company_seat": "Esslingen am Neckar",
      "details": "11.11.2025 (Bekanntmachungsdatum)\n\nBaden-Württemberg Amtsgericht Stuttgart GsR 3556\nRegisterbekanntmachung nach dem Umwandlungsgesetz 11.11.2025 (Eintragungsdatum)\n\nSchwalbe & Weickert eGbR\nGesellschaft bürgerlichen Rechts\nEsslingen am Neckar\n\nAls nicht eingetragen wird bekanntgemacht:\nDen Gläubigern des an dem Formwechsel beteiligten Rechtsträgers ist, wenn sie binnen sechs Monaten nach dem Tag, an dem die Eintragung des Formwechsels in das Register des Sitzes desjenigen Rechtsträgers, dessen Gläubiger sie sind, nach § 19 Abs. 3 UmwG als bekanntgemacht gilt, ihren Anspruch nach Grund und Höhe schriftlich anmelden, Sicherheit zu leisten, soweit sie nicht Befriedigung verlangen können. Dieses Recht steht den Gläubigern jedoch nur zu, wenn sie glaubhaft machen, dass durch den Formwechsel die Erfüllung ihrer Forderung gefährdet wird."
    },
    {
      "date": "2025-11-11",
      "id": "136910",
      "original_text": "Registerbekanntmachung nach dem Umwandlungsgesetz\nBerlin Amtsgericht Berlin (Charlottenburg) GsR 3487\n4M Solar eGbR – Berlin",
      "type": "Registerbekanntmachung nach dem Umwandlungsgesetz",
      "state": "Berlin",
      "amtsgericht": "Amtsgericht Berlin (Charlottenburg)",
      "registernummer": "GsR 3487",
      "registerart": "GsR",
      "company_name": "4M Solar eGbR",
      "company_seat": "Berlin",
      "details": "11.11.2025 (Bekanntmachungsdatum)\n\nBerlin Amtsgericht Berlin (Charlottenburg) GsR 3487\nRegisterbekanntmachung nach dem Umwandlungsgesetz 10.11.2025 (Eintragungsdatum)\n\n4M Solar eGbR\nGesellschaft bürgerlichen Rechts\nBerlin\n\nZu Eintragungsnummer 2 vom 10.11.2025 wird als nicht eingetragen veröffentlicht: Den Gläubigern der an der Spaltung beteiligten Rechtsträger ist, wenn sie binnen sechs Monaten nach dem Tag, an dem die Eintragung der Spaltung in das Register des Sitzes desjenigen Rechtsträgers, dessen Gläubiger sie sind, als bekannt gemacht gilt, ihren Anspruch nach Grund und Höhe schriftlich anmelden, Sicherheit zu leisten, soweit sie nicht Befriedigung verlangen können. Dieses Recht steht den Gläubigern jedoch nur zu, wenn sie glaubhaft machen, dass durch die Spaltung die Erfüllung ihrer Forderung gefährdet wird. Das Recht, Sicherheitsleistung zu verlangen, steht Gläubigern nicht zu, die im Falle der Insolvenz ein Recht auf vorzugsweise Befriedigung aus einer Deckungsmasse haben, die nach gesetzlicher Vorschrift zu ihrem Schutz errichtet und staatlich überwacht ist."
    },
    {
      "date": "2025-11-11",
      "id": "136911",
      "original_text": "Registerbekanntmachung nach dem Umwandlungsgesetz\nBaden-Württemberg Amtsgericht Mannheim HRB 753788\nVerkehrsgesellschaft Baden-Baden mbH – Baden-Baden",
      "type": "Registerbekanntmachung nach dem Umwandlungsgesetz",
      "state": "Baden-Württemberg",
      "amtsgericht": "Amtsgericht Mannheim",
      "registernummer": "HRB 753788",
      "registerart": "HRB",
      "company_name": "Verkehrsgesellschaft Baden-Baden mbH",
      "company_seat": "Baden-Baden",
      "details": "11.11.2025 (Bekanntmachungsdatum)\n\nBaden-Württemberg Amtsgericht Mannheim HRB 753788\nRegisterbekanntmachung nach dem Umwandlungsgesetz 11.11.2025 (Eintragungsdatum)\n\nVerkehrsgesellschaft Baden-Baden mbH\nGesellschaft mit beschränkter Haftung\nBaden-Baden\n\nDen Gläubigern der an der Ausgliederung beteiligten Rechtsträger ist, wenn sie binnen sechs Monaten nach dem Tag, an dem die Eintragung der Ausgliederung in das Register des Sitzes desjenigen Rechtsträgers, dessen Gläubiger sie sind, nach § 19 Abs. 3 UmwG als bekanntgemacht gilt, ihren Anspruch nach Grund und Höhe schriftlich anmelden, Sicherheit zu leisten, soweit sie nicht Befriedigung verlangen können. Dieses Recht steht den Gläubigern jedoch nur zu, wenn sie glaubhaft machen, dass durch die Ausgliederung die Erfüllung ihrer Forderung gefährdet wird."
    },
    {
      "date": "2025-11-11",
      "id": "136912",
      "original_text": "Registerbekanntmachung nach dem Umwandlungsgesetz\nBaden-Württemberg Amtsgericht Mannheim HRA 201400\nStadtwerke Baden-Baden – Baden-Baden",
      "type": "Registerbekanntmachung nach dem Umwandlungsgesetz",
      "state": "Baden-Württemberg",
      "amtsgericht": "Amtsgericht Mannheim",
      "registernummer": "HRA 201400",
      "registerart": "HRA",
      "company_name": "Stadtwerke Baden-Baden",
      "company_seat": "Baden-Baden",
      "details": "11.11.2025 (Bekanntmachungsdatum)\n\nBaden-Württemberg Amtsgericht Mannheim HRA 201400\nRegisterbekanntmachung nach dem Umwandlungsgesetz 11.11.2025 (Eintragungsdatum)\n\nStadtwerke Baden-Baden\nSonstige juristische Person\nBaden-Baden\n\nDen Gläubigern der an der Ausgliederung beteiligten Rechtsträger ist, wenn sie binnen sechs Monaten nach dem Tag, an dem die Eintragung der Ausgliederung in das Register des Sitzes desjenigen Rechtsträgers, dessen Gläubiger sie sind, nach § 19 Abs. 3 UmwG als bekanntgemacht gilt, ihren Anspruch nach Grund und Höhe schriftlich anmelden, Sicherheit zu leisten, soweit sie nicht Befriedigung verlangen können. Dieses Recht steht den Gläubigern jedoch nur zu, wenn sie glaubhaft machen, dass durch die Ausgliederung die Erfüllung ihrer Forderung gefährdet wird."
    },
    {
      "date": "2025-11-11",
      "id": "136913",
      "original_text": "Löschungsankündigung\nBrandenburg Amtsgericht Potsdam HRB 28178\nDr. Breitenstein Entwicklungs UG (haftungsbeschränkt) – Potsdam",
      "type": "Löschungsankündigung",
      "state": "Brandenburg",
      "amtsgericht": "Amtsgericht Potsdam",
      "registernummer": "HRB 28178",
      "registerart": "HRB",
      "company_name": "Dr. Breitenstein Entwicklungs UG (haftungsbeschränkt)",
      "company_seat": "Potsdam",
      "details": "11.11.2025 (Bekanntmachungsdatum)\n\nBrandenburg Amtsgericht Potsdam HRB 28178\nLöschungsankündigung\n\nDr. Breitenstein Entwicklungs UG (haftungsbeschränkt)\nGesellschaft mit beschränkter Haftung\nPotsdam\n\nBei der nachstehenden Gesellschaft wird das Amtslöschungsverfahren gemäß § 394 FamFG eingeleitet. Widerspruchsfrist: 8 Wochen."
    },
    {
      "date": "2025-11-11",
      "id": "136914",
      "original_text": "Registerbekanntmachung nach dem Umwandlungsgesetz\nSaarland Amtsgericht Saarbrücken HRB 110822\nKrämer IT Service GmbH – Eppelborn",
      "type": "Registerbekanntmachung nach dem Umwandlungsgesetz",
      "state": "Saarland",
      "amtsgericht": "Amtsgericht Saarbrücken",
      "registernummer": "HRB 110822",
      "registerart": "HRB",
      "company_name": "Krämer IT Service GmbH",
      "company_seat": "Eppelborn",
      "details": "11.11.2025 (Bekanntmachungsdatum)\n\nSaarland Amtsgericht Saarbrücken HRB 110822\nRegisterbekanntmachung nach dem Umwandlungsgesetz 11.11.2025 (Eintragungsdatum)\n\nKrämer IT Service GmbH\nGesellschaft mit beschränkter Haftung\nEppelborn\n\nAls nicht eingetragen wird bekannt gemacht: Den Gläubigern der an der Ausgliederung  beteiligten Gesellschaften ist, wenn sie binnen sechs Monaten nach dem Tag, an dem die Eintragung der Ausgliederung in das Register des Sitzes desjenigen Rechtsträgers, dessen Gläubiger sie sind, nach § 19 Absatz 3 UmwG bekannt gemacht worden ist, ihren Anspruch nach Grund und Höhe schriftlich anmelden, Sicherheit zu leisten, soweit sie nicht Befriedigung verlangen können. Dieses Recht steht den Gläubigern jedoch nur zu, wenn sie glaubhaft machen, dass durch die Ausgliederung  die Erfüllung ihrer Forderung gefährdet wird."
    },
    {
      "date": "2025-11-11",
      "id": "136915",
      "original_text": "Registerbekanntmachung nach dem Umwandlungsgesetz\nSaarland Amtsgericht Saarbrücken HRB 14379\nKrämer IT Solutions GmbH – Eppelborn",
      "type": "Registerbekanntmachung nach dem Umwandlungsgesetz",
      "state": "Saarland",
      "amtsgericht": "Amtsgericht Saarbrücken",
      "registernummer": "HRB 14379",
      "registerart": "HRB",
      "company_name": "Krämer IT Solutions GmbH",
      "company_seat": "Eppelborn",
      "details": "11.11.2025 (Bekanntmachungsdatum)\n\nSaarland Amtsgericht Saarbrücken HRB 14379\nRegisterbekanntmachung nach dem Umwandlungsgesetz 11.11.2025 (Eintragungsdatum)\n\nKrämer IT Solutions GmbH\nGesellschaft mit beschränkter Haftung\nEppelborn\n\nAls nicht eingetragen wird bekannt gemacht: Den Gläubigern der an der Ausgliederung beteiligten Gesellschaften ist, wenn sie binnen sechs Monaten nach dem Tag, an dem die Eintragung der Ausgliederung  in das Register des Sitzes desjenigen Rechtsträgers, dessen Gläubiger sie sind, nach § 19 Absatz 3 UmwG bekannt gemacht worden ist, ihren Anspruch nach Grund und Höhe schriftlich anmelden, Sicherheit zu leisten, soweit sie nicht Befriedigung verlangen können. Dieses Recht steht den Gläubigern jedoch nur zu, wenn sie glaubhaft machen, dass durch die Ausgliederung  die Erfüllung ihrer Forderung gefährdet wird."
    },
    {
      "date": "2025-11-11",
      "id": "136916",
      "original_text": "Löschungsankündigung\nBaden-Württemberg Amtsgericht Ulm HRB 735175\nAlgorithmX Automation GmbH – Fronreute",
      "type": "Löschungsankündigung",
      "state": "Baden-Württemberg",
      "amtsgericht": "Amtsgericht Ulm",
      "registernummer": "HRB 735175",
      "registerart": "HRB",
      "company_name": "AlgorithmX Automation GmbH",
      "company_seat": "Fronreute",
      "details": "11.11.2025 (Bekanntmachungsdatum)\n\nBaden-Württemberg Amtsgericht Ulm HRB 735175\nLöschungsankündigung\n\nAlgorithmX Automation GmbH\nGesellschaft mit beschränkter Haftung\nFronreute\n\nAls nicht eingetragen wird bekanntgemacht:\nDas Gericht beabsichtigt, die Gesellschaft wegen Vermögenslosigkeit im Handelsregister von Amts wegen nach § 394 FamFG zu löschen. Die Frist zur Geltendmachung eines Widerspruchs gegen die beabsichtigte Löschung ist auf  einen Monat ab Veröffentlichung bestimmt."
    },
    {
      "date": "2025-11-11",
      "id": "136917",
      "original_text": "Löschungsankündigung\nBerlin Amtsgericht Berlin (Charlottenburg) HRB 33675\nR. Rothe Im- & Export GmbH – Berlin",
      "type": "Löschungsankündigung",
      "state": "Berlin",
      "amtsgericht": "Amtsgericht Berlin (Charlottenburg)",
      "registernummer": "HRB 33675",
      "registerart": "HRB",
      "company_name": "R. Rothe Im- & Export GmbH",
      "company_seat": "Berlin",
      "details": "11.11.2025 (Bekanntmachungsdatum)\n\nBerlin Amtsgericht Berlin (Charlottenburg) HRB 33675\nLöschungsankündigung\n\nR. Rothe Im- & Export GmbH\nGesellschaft mit beschränkter Haftung\nBerlin\n\nBei der nachstehenden Gesellschaft wird das Amtslöschungsverfahren gemäß § 394 FamFG eingeleitet. Widerspruchsfrist 6 Wochen"
    },
    {
      "date": "2025-11-11",
      "id": "136918",
      "original_text": "Löschungsankündigung\nBerlin Amtsgericht Berlin (Charlottenburg) HRB 206285\nGoWorkaBit Germany GmbH – Berlin",
      "type": "Löschungsankündigung",
      "state": "Berlin",
      "amtsgericht": "Amtsgericht Berlin (Charlottenburg)",
      "registernummer": "HRB 206285",
      "registerart": "HRB",
      "company_name": "GoWorkaBit Germany GmbH",
      "company_seat": "Berlin",
      "details": "11.11.2025 (Bekanntmachungsdatum)\n\nBerlin Amtsgericht Berlin (Charlottenburg) HRB 206285\nLöschungsankündigung\n\nGoWorkaBit Germany GmbH\nGesellschaft mit beschränkter Haftung\nBerlin\n\nBei der nachstehenden Gesellschaft wird das Amtslöschungsverfahren gemäß § 394 FamFG eingeleitet. Widerspruchsfrist: 6 Wochen."
    },
    {
      "date": "2025-11-11",
      "id": "136919",
      "original_text": "Löschungsankündigung\nBerlin Amtsgericht Berlin (Charlottenburg) HRB 133072\nSTAN Grundstücksverwaltung GmbH – Berlin",
      "type": "Löschungsankündigung",
      "state": "Berlin",
      "amtsgericht": "Amtsgericht Berlin (Charlottenburg)",
      "registernummer": "HRB 133072",
      "registerart": "HRB",
      "company_name": "STAN Grundstücksverwaltung GmbH",
      "company_seat": "Berlin",
      "details": "11.11.2025 (Bekanntmachungsdatum)\n\nBerlin Amtsgericht Berlin (Charlottenburg) HRB 133072\nLöschungsankündigung\n\nSTAN Grundstücksverwaltung GmbH\nGesellschaft mit beschränkter Haftung\nBerlin\n\nBei der nachstehenden Gesellschaft wird das Amtslöschungsverfahren gemäß § 394 FamFG eingeleitet. Widerspruchsfrist: 6 Wochen."
    },
    {
      "date": "2025-11-11",
      "id": "136920",
      "original_text": "Löschungsankündigung\nSchleswig-Holstein Amtsgericht Lübeck HRB 17991\nRESA GmbH – Glinde",
      "type": "Löschungsankündigung",
      "state": "Schleswig-Holstein",
      "amtsgericht": "Amtsgericht Lübeck",
      "registernummer": "HRB 17991",
      "registerart": "HRB",
      "company_name": "RESA GmbH",
      "company_seat": "Glinde",
      "details": "11.11.2025 (Bekanntmachungsdatum)\n\nSchleswig-Holstein Amtsgericht Lübeck HRB 17991\nLöschungsankündigung\n\nRESA GmbH\nGesellschaft mit beschränkter Haftung\nGlinde\n\nErgeben sich aus den  vorliegenden Unterlagen Anhaltspunkte dafür, dass die Gesellschaft vermögenslos ist:\nLöschungsantrag des Bundesamtes für Justiz vom 27.08.2025 und der IHK vom 16.09.2025 mit der Begründung, dass Vermögenswerte der Gesellschaft nicht mehr vorhanden sind und die Gesellschaft und der Geschäftsführer nicht mehr erreichbar sind. Forderungen wurden teilweise bereits niedergeschlagen. Das Finanzamt hat mit Schreiben vom 02.09.2025 der Löschung zugestimmt. Auch hier wurden bereits Rückstände niedergeschlagen.\nIch beabsichtige daher, die Gesellschaft wegen Vermögenslosigkeit gemäß § 394 FamFG zu löschen.\nIch bestimme eine Frist von einem Monat zur Geltendmachung eines Widerspruchs gegen die Löschung, § 394 Abs. 2 S. 1 FamFG.\nWeiter bitte ich Sie, mir binnen derselben Frist mitzuteilen, ob die genannte Gesellschaft noch Vermögen hat, ggf. welche Vermögensgegenstände sie besitzt, ob die Gesellschaft noch Partei eines noch nicht rechtskräftig abgeschlossenen Rechtsstreits ist oder ob sonst noch eine Abwicklung stattfindet.\nNach Fristablauf ohne Widerspruch von Ihnen oder anderer Seite wird die Gesellschaft gelöscht."
    },
    {
      "date": "2025-11-11",
      "id": "136921",
      "original_text": "Löschungsankündigung\nSchleswig-Holstein Amtsgericht Kiel HRA 5746\nKöpping Reedereigesellschaft MS \"Lantau Bride\" mbH & Co. KG – Schülp",
      "type": "Löschungsankündigung",
      "state": "Schleswig-Holstein",
      "amtsgericht": "Amtsgericht Kiel",
      "registernummer": "HRA 5746",
      "registerart": "HRA",
      "company_name": "Köpping Reedereigesellschaft MS \"Lantau Bride\" mbH & Co. KG",
      "company_seat": "Schülp",
      "details": "11.11.2025 (Bekanntmachungsdatum)\n\nSchleswig-Holstein Amtsgericht Kiel HRA 5746\nLöschungsankündigung\n\nKöpping Reedereigesellschaft MS \"Lantau Bride\" mbH & Co. KG\nKommanditgesellschaft\nSchülp\n\nEs ist die Löschung der nachstehenden Gesellschaft wegen Vermögenslosigkeit gemäß § 394 FamFG beabsichtigt. Widerspruchsfrist: 2 Monate."
    },
    {
      "date": "2025-11-11",
      "id": "136922",
      "original_text": "Registerbekanntmachung nach dem Umwandlungsgesetz\nHamburg Amtsgericht Hamburg HRB 161375\nBureau L GmbH – Hamburg",
      "type": "Registerbekanntmachung nach dem Umwandlungsgesetz",
      "state": "Hamburg",
      "amtsgericht": "Amtsgericht Hamburg",
      "registernummer": "HRB 161375",
      "registerart": "HRB",
      "company_name": "Bureau L GmbH",
      "company_seat": "Hamburg",
      "details": "11.11.2025 (Bekanntmachungsdatum)\n\nHamburg Amtsgericht Hamburg HRB 161375\nRegisterbekanntmachung nach dem Umwandlungsgesetz 11.11.2025 (Eintragungsdatum)\n\nBureau L GmbH\nGesellschaft mit beschränkter Haftung\nHamburg\n\nAls nicht eingetragen wird bekannt gemacht:\nDen Gläubigern der an der Verschmelzung beteiligten Gesellschaften ist, wenn sie binnen sechs Monaten nach dem Tag, an dem die Eintragung der Verschmelzung in das Register des Sitzes desjenigen Rechtsträgers, dessen Gläubiger sie sind, nach § 19 Absatz 3 UmwG als bekannt gemacht gilt, ihren Anspruch nach Grund und Höhe schriftlich anmelden, Sicherheit zu leisten, soweit sie nicht Befriedigung verlangen können. Dieses Recht steht den Gläubigern jedoch nur zu, wenn sie glaubhaft machen, dass durch die Verschmelzung die Erfüllung ihrer Forderung gefährdet wird."
    },
    {
      "date": "2025-11-11",
      "id": "136923",
      "original_text": "Registerbekanntmachung nach dem Umwandlungsgesetz\nHamburg Amtsgericht Hamburg HRB 161052\nINVEST Lange GmbH – Hamburg",
      "type": "Registerbekanntmachung nach dem Umwandlungsgesetz",
      "state": "Hamburg",
      "amtsgericht": "Amtsgericht Hamburg",
      "registernummer": "HRB 161052",
      "registerart": "HRB",
      "company_name": "INVEST Lange GmbH",
      "company_seat": "Hamburg",
      "details": "11.11.2025 (Bekanntmachungsdatum)\n\nHamburg Amtsgericht Hamburg HRB 161052\nRegisterbekanntmachung nach dem Umwandlungsgesetz 11.11.2025 (Eintragungsdatum)\n\nINVEST Lange GmbH\nGesellschaft mit beschränkter Haftung\nHamburg\n\nAls nicht eingetragen wird bekannt gemacht:\nDen Gläubigern der an der Verschmelzung beteiligten Gesellschaften ist, wenn sie binnen sechs Monaten nach dem Tag, an dem die Eintragung der Verschmelzung in das Register des Sitzes desjenigen Rechtsträgers, dessen Gläubiger sie sind, nach § 19 Absatz 3 UmwG als bekannt gemacht gilt, ihren Anspruch nach Grund und Höhe schriftlich anmelden, Sicherheit zu leisten, soweit sie nicht Befriedigung verlangen können. Dieses Recht steht den Gläubigern jedoch nur zu, wenn sie glaubhaft machen, dass durch die Verschmelzung die Erfüllung ihrer Forderung gefährdet wird."
    },
    {
      "date": "2025-11-11",
      "id": "136924",
      "original_text": "Einreichung neuer Dokumente\nHamburg Amtsgericht Hamburg HRB 104241\nPFLEGEN & WOHNEN HAMBURG GmbH – Hamburg",
      "type": "Einreichung neuer Dokumente",
      "state": "Hamburg",
      "amtsgericht": "Amtsgericht Hamburg",
      "registernummer": "HRB 104241",
      "registerart": "HRB",
      "company_name": "PFLEGEN & WOHNEN HAMBURG GmbH",
      "company_seat": "Hamburg",
      "details": "11.11.2025 (Bekanntmachungsdatum)\n\nHamburg Amtsgericht Hamburg HRB 104241\nEinreichung neuer Dokumente 23.10.2025 (Eintragungsdatum)\n\nPFLEGEN & WOHNEN HAMBURG GmbH\nGesellschaft mit beschränkter Haftung\nHamburg\n\nAls nicht eingetragen wird bekannt gemacht: Liste des Aufsichtsrats wurde eingereicht."
    },
    {
      "date": "2025-11-11",
      "id": "136925",
      "original_text": "Registerbekanntmachung nach dem Umwandlungsgesetz\nBerlin Amtsgericht Berlin (Charlottenburg) HRB 17761\nPeak Mobility GmbH – Berlin",
      "type": "Registerbekanntmachung nach dem Umwandlungsgesetz",
      "state": "Berlin",
      "amtsgericht": "Amtsgericht Berlin (Charlottenburg)",
      "registernummer": "HRB 17761",
      "registerart": "HRB",
      "company_name": "Peak Mobility GmbH",
      "company_seat": "Berlin",
      "details": "11.11.2025 (Bekanntmachungsdatum)\n\nBerlin Amtsgericht Berlin (Charlottenburg) HRB 17761\nRegisterbekanntmachung nach dem Umwandlungsgesetz 11.11.2025 (Eintragungsdatum)\n\nPeak Mobility GmbH\nGesellschaft mit beschränkter Haftung\nBerlin\n\nZu Eintragungsnummer 22 vom 11.11.2025 wird als nicht eingetragen veröffentlicht: Den Gläubigern der an der Verschmelzung beteiligten Rechtsträger ist, wenn sie binnen sechs Monaten nach dem Tag, an dem die Eintragung der Verschmelzung in das Register des Sitzes desjenigen Rechtsträgers, dessen Gläubiger sie sind, als bekannt gemacht gilt, ihren Anspruch nach Grund und Höhe schriftlich anmelden, Sicherheit zu leisten, soweit sie nicht Befriedigung verlangen können. Dieses Recht steht den Gläubigern jedoch nur zu, wenn sie glaubhaft machen, dass durch die Verschmelzung die Erfüllung ihrer Forderung gefährdet wird. Das Recht, Sicherheitsleistung zu verlangen, steht Gläubigern nicht zu, die im Falle der Insolvenz ein Recht auf vorzugsweise Befriedigung aus einer Deckungsmasse haben, die nach gesetzlicher Vorschrift zu ihrem Schutz errichtet und staatlich überwacht ist."
    },
    {
      "date": "2025-11-11",
      "id": "136926",
      "original_text": "Registerbekanntmachung nach dem Umwandlungsgesetz\nBerlin Amtsgericht Berlin (Charlottenburg) HRA 62050\nM-Solarkraftwerk 7 GmbH & Co. KG – Berlin",
      "type": "Registerbekanntmachung nach dem Umwandlungsgesetz",
      "state": "Berlin",
      "amtsgericht": "Amtsgericht Berlin (Charlottenburg)",
      "registernummer": "HRA 62050",
      "registerart": "HRA",
      "company_name": "M-Solarkraftwerk 7 GmbH & Co. KG",
      "company_seat": "Berlin",
      "details": "11.11.2025 (Bekanntmachungsdatum)\n\nBerlin Amtsgericht Berlin (Charlottenburg) HRA 62050\nRegisterbekanntmachung nach dem Umwandlungsgesetz 10.11.2025 (Eintragungsdatum)\n\nM-Solarkraftwerk 7 GmbH & Co. KG\nKommanditgesellschaft\nBerlin\n\nZu Eintragungsnummer 4 vom 10.11.2025 wird als nicht eingetragen veröffentlicht: Den Gläubigern der an der Spaltung beteiligten Rechtsträger ist, wenn sie binnen sechs Monaten nach dem Tag, an dem die Eintragung der Spaltung in das Register des Sitzes desjenigen Rechtsträgers, dessen Gläubiger sie sind, als bekannt gemacht gilt, ihren Anspruch nach Grund und Höhe schriftlich anmelden, Sicherheit zu leisten, soweit sie nicht Befriedigung verlangen können. Dieses Recht steht den Gläubigern jedoch nur zu, wenn sie glaubhaft machen, dass durch die Spaltung die Erfüllung ihrer Forderung gefährdet wird. Das Recht, Sicherheitsleistung zu verlangen, steht Gläubigern nicht zu, die im Falle der Insolvenz ein Recht auf vorzugsweise Befriedigung aus einer Deckungsmasse haben, die nach gesetzlicher Vorschrift zu ihrem Schutz errichtet und staatlich überwacht ist."
    },
    {
      "date": "2025-11-11",
      "id": "136927",
      "original_text": "Registerbekanntmachung nach dem Umwandlungsgesetz\nBerlin Amtsgericht Berlin (Charlottenburg) HRB 37007\nVerkehrsautomatisierung Berlin GmbH – Berlin",
      "type": "Registerbekanntmachung nach dem Umwandlungsgesetz",
      "state": "Berlin",
      "amtsgericht": "Amtsgericht Berlin (Charlottenburg)",
      "registernummer": "HRB 37007",
      "registerart": "HRB",
      "company_name": "Verkehrsautomatisierung Berlin GmbH",
      "company_seat": "Berlin",
      "details": "11.11.2025 (Bekanntmachungsdatum)\n\nBerlin Amtsgericht Berlin (Charlottenburg) HRB 37007\nRegisterbekanntmachung nach dem Umwandlungsgesetz 11.11.2025 (Eintragungsdatum)\n\nVerkehrsautomatisierung Berlin GmbH\nGesellschaft mit beschränkter Haftung\nBerlin\n\nZu Eintragungsnummer 17 vom 11.11.2025 wird als nicht eingetragen veröffentlicht: Den Gläubigern der an der Verschmelzung beteiligten Rechtsträger ist, wenn sie binnen sechs Monaten nach dem Tag, an dem die Eintragung der Verschmelzung in das Register des Sitzes desjenigen Rechtsträgers, dessen Gläubiger sie sind, als bekannt gemacht gilt, ihren Anspruch nach Grund und Höhe schriftlich anmelden, Sicherheit zu leisten, soweit sie nicht Befriedigung verlangen können. Dieses Recht steht den Gläubigern jedoch nur zu, wenn sie glaubhaft machen, dass durch die Verschmelzung die Erfüllung ihrer Forderung gefährdet wird. Das Recht, Sicherheitsleistung zu verlangen, steht Gläubigern nicht zu, die im Falle der Insolvenz ein Recht auf vorzugsweise Befriedigung aus einer Deckungsmasse haben, die nach gesetzlicher Vorschrift zu ihrem Schutz errichtet und staatlich überwacht ist."
    },
    {
      "date": "2025-11-11",
      "id": "136928",
      "original_text": "Löschungsankündigung\nBerlin Amtsgericht Berlin (Charlottenburg) HRB 198309\nBundes-Späti GmbH – Berlin",
      "type": "Löschungsankündigung",
      "state": "Berlin",
      "amtsgericht": "Amtsgericht Berlin (Charlottenburg)",
      "registernummer": "HRB 198309",
      "registerart": "HRB",
      "company_name": "Bundes-Späti GmbH",
      "company_seat": "Berlin",
      "details": "11.11.2025 (Bekanntmachungsdatum)\n\nBerlin Amtsgericht Berlin (Charlottenburg) HRB 198309\nLöschungsankündigung\n\nBundes-Späti GmbH\nGesellschaft mit beschränkter Haftung\nBerlin\n\nBei der nachstehenden Gesellschaft wird das Amtslöschungsverfahren gemäß § 394 FamFG eingeleitet. Widerspruchsfrist 6 Wochen"
    },
    {
      "date": "2025-11-11",
      "id": "136929",
      "original_text": "Löschungsankündigung\nBerlin Amtsgericht Berlin (Charlottenburg) HRB 195338\nS.F.S. - Software Fast Solutions GmbH – Berlin",
      "type": "Löschungsankündigung",
      "state": "Berlin",
      "amtsgericht": "Amtsgericht Berlin (Charlottenburg)",
      "registernummer": "HRB 195338",
      "registerart": "HRB",
      "company_name": "S.F.S. - Software Fast Solutions GmbH",
      "company_seat": "Berlin",
      "details": "11.11.2025 (Bekanntmachungsdatum)\n\nBerlin Amtsgericht Berlin (Charlottenburg) HRB 195338\nLöschungsankündigung\n\nS.F.S. - Software Fast Solutions GmbH\nGesellschaft mit beschränkter Haftung\nBerlin\n\nBei der nachstehenden Gesellschaft wird das Amtslöschungsverfahren gemäß § 394 FamFG eingeleitet. Widerspruchsfrist 6 Wochen"
    },
    {
      "date": "2025-11-11",
      "id": "136930",
      "original_text": "Löschungsankündigung\nBerlin Amtsgericht Berlin (Charlottenburg) HRB 142318\nCompass Taxi GmbH – Berlin",
      "type": "Löschungsankündigung",
      "state": "Berlin",
      "amtsgericht": "Amtsgericht Berlin (Charlottenburg)",
      "registernummer": "HRB 142318",
      "registerart": "HRB",
      "company_name": "Compass Taxi GmbH",
      "company_seat": "Berlin",
      "details": "11.11.2025 (Bekanntmachungsdatum)\n\nBerlin Amtsgericht Berlin (Charlottenburg) HRB 142318\nLöschungsankündigung\n\nCompass Taxi GmbH\nGesellschaft mit beschränkter Haftung\nBerlin\n\nBei der nachstehenden Gesellschaft wird das Amtslöschungsverfahren gemäß § 394 FamFG eingeleitet. Widerspruchsfrist 6 Wochen"
    },
    {
      "date": "2025-11-11",
      "id": "136931",
      "original_text": "Sonstige Registerbekanntmachung\nBaden-Württemberg Amtsgericht Stuttgart HRB 764227\nDSS-Connect GmbH – Neckarsulm",
      "type": "Sonstige Registerbekanntmachung",
      "state": "Baden-Württemberg",
      "amtsgericht": "Amtsgericht Stuttgart",
      "registernummer": "HRB 764227",
      "registerart": "HRB",
      "company_name": "DSS-Connect GmbH",
      "company_seat": "Neckarsulm",
      "details": "11.11.2025 (Bekanntmachungsdatum)\n\nBaden-Württemberg Amtsgericht Stuttgart HRB 764227\nSonstige Registerbekanntmachung 11.11.2025 (Eintragungsdatum)\n\nDSS-Connect GmbH\nGesellschaft mit beschränkter Haftung\nNeckarsulm\n\nDen Gläubigern der Gesellschaft, deren Forderungen begründet worden sind, bevor die Eintragung der Beendigung des Vertrages in das Handelsregister nach § 10 HGB als bekanntgemacht gilt, ist vom anderen Vertragsteil Sicherheit zu leisten, wenn sie sich binnen sechs Monaten nach der Bekanntmachung zu diesem Zweck bei ihm melden."
    },
    {
      "date": "2025-11-11",
      "id": "136932",
      "original_text": "Registerbekanntmachung nach dem Umwandlungsgesetz\nBrandenburg Amtsgericht Cottbus HRB 15413\nPiwa GmbH – Schönefeld",
      "type": "Registerbekanntmachung nach dem Umwandlungsgesetz",
      "state": "Brandenburg",
      "amtsgericht": "Amtsgericht Cottbus",
      "registernummer": "HRB 15413",
      "registerart": "HRB",
      "company_name": "Piwa GmbH",
      "company_seat": "Schönefeld",
      "details": "11.11.2025 (Bekanntmachungsdatum)\n\nBrandenburg Amtsgericht Cottbus HRB 15413\nRegisterbekanntmachung nach dem Umwandlungsgesetz 11.11.2025 (Eintragungsdatum)\n\nPiwa GmbH\nGesellschaft mit beschränkter Haftung\nSchönefeld\n\nDen Gläubigern der an der Verschmelzung beteiligten Rechtsträger ist, wenn sie binnen sechs Monaten nach dem Tag, an dem die Eintragung der Verschmelzung in das Register des Sitzes desjenigen Rechtsträgers, dessen Gläubiger sie sind, als bekannt gemacht gilt, ihren Anspruch nach Grund und Höhe schriftlich anmelden, Sicherheit zu leisten, soweit sie nicht Befriedigung verlangen können. Dieses Recht steht den Gläubigern jedoch nur zu, wenn sie glaubhaft machen, dass durch die Verschmelzung die Erfüllung ihrer Forderung gefährdet wird"
    },
    {
      "date": "2025-11-11",
      "id": "136933",
      "original_text": "Registerbekanntmachung nach dem Umwandlungsgesetz\nBaden-Württemberg Amtsgericht Ulm GsR 1030\nMaihöfer und Lutz eGbR – Ellwangen (Jagst)",
      "type": "Registerbekanntmachung nach dem Umwandlungsgesetz",
      "state": "Baden-Württemberg",
      "amtsgericht": "Amtsgericht Ulm",
      "registernummer": "GsR 1030",
      "registerart": "GsR",
      "company_name": "Maihöfer und Lutz eGbR",
      "company_seat": "Ellwangen (Jagst)",
      "details": "11.11.2025 (Bekanntmachungsdatum)\n\nBaden-Württemberg Amtsgericht Ulm GsR 1030\nRegisterbekanntmachung nach dem Umwandlungsgesetz 11.11.2025 (Eintragungsdatum)\n\nMaihöfer und Lutz eGbR\nGesellschaft bürgerlichen Rechts\nEllwangen (Jagst)\n\nDen Gläubigern des an dem Formwechsel beteiligten Rechtsträgers ist, wenn sie binnen sechs Monaten nach dem Tag, an dem die Eintragung des Formwechsels in das Register des Sitzes desjenigen Rechtsträgers, dessen Gläubiger sie sind, nach § 19 Abs. 3 UmwG als bekanntgemacht gilt, ihren Anspruch nach Grund und Höhe schriftlich anmelden, Sicherheit zu leisten, soweit sie nicht Befriedigung verlangen können. Dieses Recht steht den Gläubigern jedoch nur zu, wenn sie glaubhaft machen, dass durch den Formwechsel die Erfüllung ihrer Forderung gefährdet wird."
    },
    {
      "date": "2025-11-11",
      "id": "136934",
      "original_text": "Löschungsankündigung\nBaden-Württemberg Amtsgericht Mannheim HRB 724612\nFL Service Baden GmbH – Baden-Baden",
      "type": "Löschungsankündigung",
      "state": "Baden-Württemberg",
      "amtsgericht": "Amtsgericht Mannheim",
      "registernummer": "HRB 724612",
      "registerart": "HRB",
      "company_name": "FL Service Baden GmbH",
      "company_seat": "Baden-Baden",
      "details": "11.11.2025 (Bekanntmachungsdatum)\n\nBaden-Württemberg Amtsgericht Mannheim HRB 724612\nLöschungsankündigung\n\nFL Service Baden GmbH\nGesellschaft mit beschränkter Haftung\nBaden-Baden\n\nDas Gericht beabsichtigt, die Gesellschaft wegen Vermögenslosigkeit im Handelsregister von Amts wegen nach § 394 FamFG zu löschen. Die Frist zur Geltendmachung eines Widerspruchs gegen die beabsichtigte Löschung ist auf einen Monat ab Veröffentlichung bestimmt."
    },
    {
      "date": "2025-11-11",
      "id": "136935",
      "original_text": "Registerbekanntmachung nach dem Umwandlungsgesetz\nBaden-Württemberg Amtsgericht Stuttgart HRB 748372\nEnBW Rückbauservice GmbH – Stuttgart",
      "type": "Registerbekanntmachung nach dem Umwandlungsgesetz",
      "state": "Baden-Württemberg",
      "amtsgericht": "Amtsgericht Stuttgart",
      "registernummer": "HRB 748372",
      "registerart": "HRB",
      "company_name": "EnBW Rückbauservice GmbH",
      "company_seat": "Stuttgart",
      "details": "11.11.2025 (Bekanntmachungsdatum)\n\nBaden-Württemberg Amtsgericht Stuttgart HRB 748372\nRegisterbekanntmachung nach dem Umwandlungsgesetz 11.11.2025 (Eintragungsdatum)\n\nEnBW Rückbauservice GmbH\nGesellschaft mit beschränkter Haftung\nStuttgart\n\nAls nicht eingetragen wird bekanntgemacht:\nDen Gläubigern der an der Verschmelzung beteiligten Rechtsträger ist, wenn sie binnen sechs Monaten nach dem Tag, an dem die Eintragung der Verschmelzung in das Register des Sitzes desjenigen Rechtsträgers, dessen Gläubiger sie sind, nach § 19 Abs. 3 UmwG als bekanntgemacht gilt, ihren Anspruch nach Grund und Höhe schriftlich anmelden, Sicherheit zu leisten, soweit sie nicht Befriedigung verlangen können. Dieses Recht steht den Gläubigern jedoch nur zu, wenn sie glaubhaft machen, dass durch die Verschmelzung die Erfüllung ihrer Forderung gefährdet wird."
    },
    {
      "date": "2025-11-11",
      "id": "136936",
      "original_text": "Registerbekanntmachung nach dem Umwandlungsgesetz\nNordrhein-Westfalen Amtsgericht Coesfeld HRA 10216\nJulian Völzke e. K. – Ascheberg",
      "type": "Registerbekanntmachung nach dem Umwandlungsgesetz",
      "state": "Nordrhein-Westfalen",
      "amtsgericht": "Amtsgericht Coesfeld",
      "registernummer": "HRA 10216",
      "registerart": "HRA",
      "company_name": "Julian Völzke e. K.",
      "company_seat": "Ascheberg",
      "details": "11.11.2025 (Bekanntmachungsdatum)\n\nNordrhein-Westfalen Amtsgericht Coesfeld HRA 10216\nRegisterbekanntmachung nach dem Umwandlungsgesetz 11.11.2025 (Eintragungsdatum)\n\nJulian Völzke e. K.\nEinzelkaufmann\nAscheberg\n\nDen Gläubigern der an der Ausgliederung beteiligten Rechtsträger ist, wenn sie binnen sechs Monaten nach dem Tag, an dem die Eintragung der Ausgliederung in das Register des Sitzes desjenigen Rechtsträgers, dessen Gläubiger sie sind, nach § 19 Absatz 3 UmwG als bekanntgemacht gilt, ihren Anspruch nach Grund und Höhe schriftlich anmelden, Sicherheit zu leisten, soweit sie nicht Befriedigung verlangen können. Dieses Recht steht den Gläubigern jedoch nur zu, wenn sie glaubhaft machen, dass durch die Ausgliederung die Erfüllung ihrer Forderung gefährdet wird."
    },
    {
      "date": "2025-11-11",
      "id": "136937",
      "original_text": "Registerbekanntmachung nach dem Umwandlungsgesetz\nSachsen-Anhalt Amtsgericht Stendal HRA 7468\nHeidehotel Lubast e.K. – Kemberg",
      "type": "Registerbekanntmachung nach dem Umwandlungsgesetz",
      "state": "Sachsen-Anhalt",
      "amtsgericht": "Amtsgericht Stendal",
      "registernummer": "HRA 7468",
      "registerart": "HRA",
      "company_name": "Heidehotel Lubast e.K.",
      "company_seat": "Kemberg",
      "details": "11.11.2025 (Bekanntmachungsdatum)\n\nSachsen-Anhalt Amtsgericht Stendal HRA 7468\nRegisterbekanntmachung nach dem Umwandlungsgesetz 11.11.2025 (Eintragungsdatum)\n\nHeidehotel Lubast e.K.\nEinzelkaufmann / Einzelkauffrau\nKemberg\n\nNicht eingetragen:\nDen Gläubigern der an der Ausgliederung beteiligten Rechtsträger, ist wenn sie binnen sechs Monaten nach dem Tag, an dem die Eintragung der Ausgliederung nach §§125, 19 Abs. 3 UmwG als bekanntgemacht gilt, ihren Anspruch nach Grund und Höhe schriftlich anmelden, Sicherheit zu leisten, soweit sie nicht Befriedigung verlangen können. Diese Recht steht ihnen jedoch nur zu, wenn sie glaubhaft machen, dass durch die Ausgliederung die Erfüllung ihrer Forderung gefährdet wird."
    },
    {
      "date": "2025-11-11",
      "id": "136938",
      "original_text": "Registerbekanntmachung nach dem Umwandlungsgesetz\nSachsen-Anhalt Amtsgericht Stendal HRB 36672\nHeidehotel Lubast GmbH – Kemberg",
      "type": "Registerbekanntmachung nach dem Umwandlungsgesetz",
      "state": "Sachsen-Anhalt",
      "amtsgericht": "Amtsgericht Stendal",
      "registernummer": "HRB 36672",
      "registerart": "HRB",
      "company_name": "Heidehotel Lubast GmbH",
      "company_seat": "Kemberg",
      "details": "11.11.2025 (Bekanntmachungsdatum)\n\nSachsen-Anhalt Amtsgericht Stendal HRB 36672\nRegisterbekanntmachung nach dem Umwandlungsgesetz 11.11.2025 (Eintragungsdatum)\n\nHeidehotel Lubast GmbH\nGesellschaft mit beschränkter Haftung\nKemberg\n\nEntstanden durch Ausgliederung des von Christian Weise, Kemberg, * 04.04.1982, als Inhaber unter der Firma  \"Heidehotel Lubast e.K.\" mit dem Sitz in Kemberg (Amtsgericht Stendal HRA 7468) betriebenen Unternehmens. Die Ausgliederung wurde am 11.11.2025 im Register des übertragenden Rechtsträgers eingetragen.Nicht eingetragen: Den Gläubigern der an der Ausgliederung beteiligten Rechtsträger, ist wenn sie binnen sechs Monaten nach dem Tag, an dem die Eintragung der Ausgliederung nach §§125, 19 Abs. 3 UmwG als bekanntgemacht gilt, ihren Anspruch nach Grund und Höhe schriftlich anmelden, Sicherheit zu leisten, soweit sie nicht Befriedigung verlangen können. Diese Recht steht ihnen jedoch nur zu, wenn sie glaubhaft machen, dass durch die Ausgliederung die Erfüllung ihrer Forderung gefährdet wird."
    },
    {
      "date": "2025-11-11",
      "id": "136939",
      "original_text": "Registerbekanntmachung nach dem Umwandlungsgesetz\nBaden-Württemberg Amtsgericht Mannheim HRB 745536\nJL Ventures GmbH – Karlsruhe",
      "type": "Registerbekanntmachung nach dem Umwandlungsgesetz",
      "state": "Baden-Württemberg",
      "amtsgericht": "Amtsgericht Mannheim",
      "registernummer": "HRB 745536",
      "registerart": "HRB",
      "company_name": "JL Ventures GmbH",
      "company_seat": "Karlsruhe",
      "details": "11.11.2025 (Bekanntmachungsdatum)\n\nBaden-Württemberg Amtsgericht Mannheim HRB 745536\nRegisterbekanntmachung nach dem Umwandlungsgesetz 11.11.2025 (Eintragungsdatum)\n\nJL Ventures GmbH\nGesellschaft mit beschränkter Haftung\nKarlsruhe\n\nAls nicht eingetragen wird bekanntgemacht:\nDen Gläubigern der an der Verschmelzung beteiligten Rechtsträger ist, wenn sie binnen sechs Monaten nach dem Tag, an dem die Eintragung der Verschmelzung in das Register des Sitzes desjenigen Rechtsträgers, dessen Gläubiger sie sind, nach § 19 Abs. 3 UmwG als bekanntgemacht gilt, ihren Anspruch nach Grund und Höhe schriftlich anmelden, Sicherheit zu leisten, soweit sie nicht Befriedigung verlangen können. Dieses Recht steht den Gläubigern jedoch nur zu, wenn sie glaubhaft machen, dass durch die Verschmelzung die Erfüllung ihrer Forderung gefährdet wird."
    },
    {
      "date": "2025-11-11",
      "id": "136940",
      "original_text": "Registerbekanntmachung nach dem Umwandlungsgesetz\nHamburg Amtsgericht Hamburg HRB 160090\nUhl Trucks Handels GmbH – Hamburg",
      "type": "Registerbekanntmachung nach dem Umwandlungsgesetz",
      "state": "Hamburg",
      "amtsgericht": "Amtsgericht Hamburg",
      "registernummer": "HRB 160090",
      "registerart": "HRB",
      "company_name": "Uhl Trucks Handels GmbH",
      "company_seat": "Hamburg",
      "details": "11.11.2025 (Bekanntmachungsdatum)\n\nHamburg Amtsgericht Hamburg HRB 160090\nRegisterbekanntmachung nach dem Umwandlungsgesetz 11.11.2025 (Eintragungsdatum)\n\nUhl Trucks Handels GmbH\nGesellschaft mit beschränkter Haftung\nHamburg\n\nAls nicht eingetragen wird bekannt gemacht:\nDen Gläubigern der an der Verschmelzung beteiligten Gesellschaften ist, wenn sie binnen sechs Monaten nach dem Tag, an dem die Eintragung der Verschmelzung in das Register des Sitzes desjenigen Rechtsträgers, dessen Gläubiger sie sind, nach § 19 Absatz 3 UmwG als bekannt gemacht gilt, ihren Anspruch nach Grund und Höhe schriftlich anmelden, Sicherheit zu leisten, soweit sie nicht Befriedigung verlangen können. Dieses Recht steht den Gläubigern jedoch nur zu, wenn sie glaubhaft machen, dass durch die Verschmelzung die Erfüllung ihrer Forderung gefährdet wird."
    },
    {
      "date": "2025-11-11",
      "id": "136941",
      "original_text": "Sonstige Registerbekanntmachung\nMecklenburg-Vorpommern Amtsgericht Schwerin HRB 1352\nStadtwerke Hagenow GmbH – Hagenow",
      "type": "Sonstige Registerbekanntmachung",
      "state": "Mecklenburg-Vorpommern",
      "amtsgericht": "Amtsgericht Schwerin",
      "registernummer": "HRB 1352",
      "registerart": "HRB",
      "company_name": "Stadtwerke Hagenow GmbH",
      "company_seat": "Hagenow",
      "details": "11.11.2025 (Bekanntmachungsdatum)\n\nMecklenburg-Vorpommern Amtsgericht Schwerin HRB 1352\nSonstige Registerbekanntmachung 11.11.2025 (Eintragungsdatum)\n\nStadtwerke Hagenow GmbH\nGesellschaft mit beschränkter Haftung\nHagenow\n\nEine Liste der Mitglieder des Aufsichtsrats ist zum Handelsregister eingereicht worden."
    },
    {
      "date": "2025-11-11",
      "id": "136942",
      "original_text": "Einreichung neuer Dokumente\nHamburg Amtsgericht Hamburg HRB 146298\nCFC Corporate Finance Contor GmbH – Hamburg",
      "type": "Einreichung neuer Dokumente",
      "state": "Hamburg",
      "amtsgericht": "Amtsgericht Hamburg",
      "registernummer": "HRB 146298",
      "registerart": "HRB",
      "company_name": "CFC Corporate Finance Contor GmbH",
      "company_seat": "Hamburg",
      "details": "11.11.2025 (Bekanntmachungsdatum)\n\nHamburg Amtsgericht Hamburg HRB 146298\nEinreichung neuer Dokumente 11.11.2025 (Eintragungsdatum)\n\nCFC Corporate Finance Contor GmbH\nGesellschaft mit beschränkter Haftung\nHamburg\n\nAls nicht eingetragen wird bekannt gemacht: Liste des Aufsichtsrats wurde eingereicht."
    },
    {
      "date": "2025-11-11",
      "id": "136943",
      "original_text": "Löschungsankündigung\nBaden-Württemberg Amtsgericht Freiburg HRB 719505\ne-th energie-treuhand Entwicklungs- und Verwaltungsgesellschaft UG (haftungsbeschränkt) – Bonndorf im Schwarzwald",
      "type": "Löschungsankündigung",
      "state": "Baden-Württemberg",
      "amtsgericht": "Amtsgericht Freiburg",
      "registernummer": "HRB 719505",
      "registerart": "HRB",
      "company_name": "e-th energie-treuhand Entwicklungs- und Verwaltungsgesellschaft UG (haftungsbeschränkt)",
      "company_seat": "Bonndorf im Schwarzwald",
      "details": "11.11.2025 (Bekanntmachungsdatum)\n\nBaden-Württemberg Amtsgericht Freiburg HRB 719505\nLöschungsankündigung\n\ne-th energie-treuhand Entwicklungs- und Verwaltungsgesellschaft UG (haftungsbeschränkt)\nGesellschaft mit beschränkter Haftung\nBonndorf im Schwarzwald\n\nDas Gericht beabsichtigt, die Gesellschaft wegen Vermögenslosigkeit im Handelsregister von Amts wegen nach § 394 FamFG zu löschen. Die Frist zur Geltendmachung eines Widerspruchs gegen die beabsichtigte Löschung ist auf einen Monat ab Veröffentlichung bestimmt."
    },
    {
      "date": "2025-11-11",
      "id": "136944",
      "original_text": "Registerbekanntmachung nach dem Umwandlungsgesetz\nBaden-Württemberg Amtsgericht Mannheim HRB 107956\nEnBW Energie Baden-Württemberg AG – Karlsruhe",
      "type": "Registerbekanntmachung nach dem Umwandlungsgesetz",
      "state": "Baden-Württemberg",
      "amtsgericht": "Amtsgericht Mannheim",
      "registernummer": "HRB 107956",
      "registerart": "HRB",
      "company_name": "EnBW Energie Baden-Württemberg AG",
      "company_seat": "Karlsruhe",
      "details": "11.11.2025 (Bekanntmachungsdatum)\n\nBaden-Württemberg Amtsgericht Mannheim HRB 107956\nRegisterbekanntmachung nach dem Umwandlungsgesetz 11.11.2025 (Eintragungsdatum)\n\nEnBW Energie Baden-Württemberg AG\nAktiengesellschaft\nKarlsruhe\n\nAls nicht eingetragen wird bekanntgemacht:\nDen Gläubigern der an der Verschmelzung beteiligten Rechtsträger ist, wenn sie binnen sechs Monaten nach dem Tag, an dem die Eintragung der Verschmelzung in das Register des Sitzes desjenigen Rechtsträgers, dessen Gläubiger sie sind, nach § 19 Abs. 3 UmwG als bekanntgemacht gilt, ihren Anspruch nach Grund und Höhe schriftlich anmelden, Sicherheit zu leisten, soweit sie nicht Befriedigung verlangen können. Dieses Recht steht den Gläubigern jedoch nur zu, wenn sie glaubhaft machen, dass durch die Verschmelzung die Erfüllung ihrer Forderung gefährdet wird."
    },
    {
      "date": "2025-11-11",
      "id": "136945",
      "original_text": "Einreichung neuer Dokumente\nSchleswig-Holstein Amtsgericht Kiel HRB 25461\nBRUBAKER NL Immobilien Verwaltungsgesellschaft mbH – Henstedt-Ulzburg",
      "type": "Einreichung neuer Dokumente",
      "state": "Schleswig-Holstein",
      "amtsgericht": "Amtsgericht Kiel",
      "registernummer": "HRB 25461",
      "registerart": "HRB",
      "company_name": "BRUBAKER NL Immobilien Verwaltungsgesellschaft mbH",
      "company_seat": "Henstedt-Ulzburg",
      "details": "11.11.2025 (Bekanntmachungsdatum)\n\nSchleswig-Holstein Amtsgericht Kiel HRB 25461\nEinreichung neuer Dokumente\n\nBRUBAKER NL Immobilien Verwaltungsgesellschaft mbH\nGesellschaft mit beschränkter Haftung\nHenstedt-Ulzburg\n\nAls nicht eingetragen wird veröffentlicht: Dem Registergericht ist in nachfolgender Sache ein Umwandlungsplan vom 05.11.2025 eingereicht worden.\nBRUBAKER NL Immobilien Verwaltungsgesellschaft, Sitz Henstedt-Ulzburg, HRB 25461 KI\nGemäß den §§ 336, 308 Abs. 1 Satz 2 Nr. 1 bis 4 UmwG wird in Betreff der BRUBAKER NL Immobilien Verwaltungsgesellschaft mbH mit dem Sitz in Henstedt-Ulzburg, Geschäftsanschrift: An der Alsterquelle 25, 24558 Henstedt-Ulzburg, eingetragen im Handelsregister des Amtsgerichts Kiel unter HRB 25461 KI mitgeteilt, dass ein grenzüberschreitender Rechtsformwechsel und Herausformwechsel gemäß den §§ 335 ff. UmwG der vorgenannten Gesellschaft angestrebt wird, mit dem Inhalt, dass\ndie herausformwechselnde Gesellschaft eine Gesellschaft mit beschränkter Haftung unter der Firma BRUBAKER NL Immobilien Verwaltungsgesellschaft mbH, eingetragen unter HRB 25461 KI des Amtsgerichts Kiel mit dem Sitz in Henstedt-Ulzburg ist und deren alleinige Gesellschafterin die BRUBAKER Modevertriebs- und Verwaltungsgesellschaft mbH mit Sitz in Henstedt-Ulzburg, HRB 25230 KI des Amtsgerichts Kiel ist;\nsowie\ndie alleinige Anteilsinhaberin, die BRUBAKER Modevertriebs- und Verwaltungsgesellschaft mbH mit Sitz in Henstedt-Ulzburg, HRB 25230 KI des Amtsgerichts Kiel mit Geschäftsanschrift An der Alsterquelle 25, 24558 Henstedt-Ulzburg, einen Hinweis auf ihr Anhörungsrecht erhalten hat und dass sie dieses bis spätestens fünf Arbeitstage vor dem Tag der Gesellschafterversammlung ausüben und Bemerkungen zum Verschmelzungsplan übermitteln kann."
    },
    {
      "date": "2025-11-11",
      "id": "136946",
      "original_text": "Registerbekanntmachung nach dem Umwandlungsgesetz\nHamburg Amtsgericht Hamburg HRB 150001\nStromunion AG – Hamburg",
      "type": "Registerbekanntmachung nach dem Umwandlungsgesetz",
      "state": "Hamburg",
      "amtsgericht": "Amtsgericht Hamburg",
      "registernummer": "HRB 150001",
      "registerart": "HRB",
      "company_name": "Stromunion AG",
      "company_seat": "Hamburg",
      "details": "11.11.2025 (Bekanntmachungsdatum)\n\nHamburg Amtsgericht Hamburg HRB 150001\nRegisterbekanntmachung nach dem Umwandlungsgesetz 11.11.2025 (Eintragungsdatum)\n\nStromunion AG\nAktiengesellschaft\nHamburg\n\nAls nicht eingetragen wird bekannt gemacht:\nDen Gläubigern der an der Verschmelzung beteiligten Gesellschaften ist, wenn sie binnen sechs Monaten nach dem Tag, an dem die Eintragung der Verschmelzung in das Register des Sitzes derjenigen Rechtsträger deren Gläubiger sie sind, nach § 19 Absatz 3 UmwG als bekannt gemacht gilt, ihren Anspruch nach Grund und Höhe schriftlich anmelden, Sicherheit zu leisten, soweit sie nicht Befriedigung verlangen können. Dieses Recht steht den Gläubigern jedoch nur zu, wenn sie glaubhaft machen, dass durch die Verschmelzung die Erfüllung ihrer Forderung gefährdet wird."
    },
    {
      "date": "2025-11-11",
      "id": "136947",
      "original_text": "Registerbekanntmachung nach dem Umwandlungsgesetz\nHamburg Amtsgericht Hamburg HRB 152828\nSUAG Mecklenburg-Vorpommern GmbH – Hamburg",
      "type": "Registerbekanntmachung nach dem Umwandlungsgesetz",
      "state": "Hamburg",
      "amtsgericht": "Amtsgericht Hamburg",
      "registernummer": "HRB 152828",
      "registerart": "HRB",
      "company_name": "SUAG Mecklenburg-Vorpommern GmbH",
      "company_seat": "Hamburg",
      "details": "11.11.2025 (Bekanntmachungsdatum)\n\nHamburg Amtsgericht Hamburg HRB 152828\nRegisterbekanntmachung nach dem Umwandlungsgesetz 11.11.2025 (Eintragungsdatum)\n\nSUAG Mecklenburg-Vorpommern GmbH\nGesellschaft mit beschränkter Haftung\nHamburg\n\nAls nicht eingetragen wird bekannt gemacht:\nDen Gläubigern der an der Verschmelzung beteiligten Gesellschaften ist, wenn sie binnen sechs Monaten nach dem Tag, an dem die Eintragung der Verschmelzung in das Register des Sitzes desjenigen Rechtsträgers, dessen Gläubiger sie sind, nach § 19 Absatz 3 UmwG als bekannt gemacht gilt, ihren Anspruch nach Grund und Höhe schriftlich anmelden, Sicherheit zu leisten, soweit sie nicht Befriedigung verlangen können. Dieses Recht steht den Gläubigern jedoch nur zu, wenn sie glaubhaft machen, dass durch die Verschmelzung die Erfüllung ihrer Forderung gefährdet wird."
    },
    {
      "date": "2025-11-11",
      "id": "136948",
      "original_text": "Registerbekanntmachung nach dem Umwandlungsgesetz\nHamburg Amtsgericht Hamburg HRB 149549\nSUAG Magdeburg GmbH – Hamburg",
      "type": "Registerbekanntmachung nach dem Umwandlungsgesetz",
      "state": "Hamburg",
      "amtsgericht": "Amtsgericht Hamburg",
      "registernummer": "HRB 149549",
      "registerart": "HRB",
      "company_name": "SUAG Magdeburg GmbH",
      "company_seat": "Hamburg",
      "details": "11.11.2025 (Bekanntmachungsdatum)\n\nHamburg Amtsgericht Hamburg HRB 149549\nRegisterbekanntmachung nach dem Umwandlungsgesetz 11.11.2025 (Eintragungsdatum)\n\nSUAG Magdeburg GmbH\nGesellschaft mit beschränkter Haftung\nHamburg\n\nAls nicht eingetragen wird bekannt gemacht:\nDen Gläubigern der an der Verschmelzung beteiligten Gesellschaften ist, wenn sie binnen sechs Monaten nach dem Tag, an dem die Eintragung der Verschmelzung in das Register des Sitzes desjenigen Rechtsträgers, dessen Gläubiger sie sind, nach § 19 Absatz 3 UmwG als bekannt gemacht gilt, ihren Anspruch nach Grund und Höhe schriftlich anmelden, Sicherheit zu leisten, soweit sie nicht Befriedigung verlangen können. Dieses Recht steht den Gläubigern jedoch nur zu, wenn sie glaubhaft machen, dass durch die Verschmelzung die Erfüllung ihrer Forderung gefährdet wird."
    },
    {
      "date": "2025-11-11",
      "id": "136949",
      "original_text": "Registerbekanntmachung nach dem Umwandlungsgesetz\nHamburg Amtsgericht Hamburg HRB 153943\nSUAG Ludwigslust GmbH – Hamburg",
      "type": "Registerbekanntmachung nach dem Umwandlungsgesetz",
      "state": "Hamburg",
      "amtsgericht": "Amtsgericht Hamburg",
      "registernummer": "HRB 153943",
      "registerart": "HRB",
      "company_name": "SUAG Ludwigslust GmbH",
      "company_seat": "Hamburg",
      "details": "11.11.2025 (Bekanntmachungsdatum)\n\nHamburg Amtsgericht Hamburg HRB 153943\nRegisterbekanntmachung nach dem Umwandlungsgesetz 11.11.2025 (Eintragungsdatum)\n\nSUAG Ludwigslust GmbH\nGesellschaft mit beschränkter Haftung\nHamburg\n\nAls nicht eingetragen wird bekannt gemacht:\nDen Gläubigern der an der Verschmelzung beteiligten Gesellschaften ist, wenn sie binnen sechs Monaten nach dem Tag, an dem die Eintragung der Verschmelzung in das Register des Sitzes desjenigen Rechtsträgers, dessen Gläubiger sie sind, nach § 19 Absatz 3 UmwG als bekannt gemacht gilt, ihren Anspruch nach Grund und Höhe schriftlich anmelden, Sicherheit zu leisten, soweit sie nicht Befriedigung verlangen können. Dieses Recht steht den Gläubigern jedoch nur zu, wenn sie glaubhaft machen, dass durch die Verschmelzung die Erfüllung ihrer Forderung gefährdet wird."
    },
    {
      "date": "2025-11-11",
      "id": "136950",
      "original_text": "Einreichung neuer Dokumente\nSchleswig-Holstein Amtsgericht Flensburg HRB 17786\nBeyersdorf Verwaltung SE – Flensburg",
      "type": "Einreichung neuer Dokumente",
      "state": "Schleswig-Holstein",
      "amtsgericht": "Amtsgericht Flensburg",
      "registernummer": "HRB 17786",
      "registerart": "HRB",
      "company_name": "Beyersdorf Verwaltung SE",
      "company_seat": "Flensburg",
      "details": "11.11.2025 (Bekanntmachungsdatum)\n\nSchleswig-Holstein Amtsgericht Flensburg HRB 17786\nEinreichung neuer Dokumente\n\nBeyersdorf Verwaltung SE\nEuropäische Aktiengesellschaft (SE)\nFlensburg\n\nNeue Liste der Verwaltungsratsmitglieder nach Änderung eingereicht am 05.11.2025."
    },
    {
      "date": "2025-11-11",
      "id": "136951",
      "original_text": "Löschungsankündigung\nBaden-Württemberg Amtsgericht Freiburg HRB 621344\nGisinger GmbH – Ühlingen-Birkendorf",
      "type": "Löschungsankündigung",
      "state": "Baden-Württemberg",
      "amtsgericht": "Amtsgericht Freiburg",
      "registernummer": "HRB 621344",
      "registerart": "HRB",
      "company_name": "Gisinger GmbH",
      "company_seat": "Ühlingen-Birkendorf",
      "details": "11.11.2025 (Bekanntmachungsdatum)\n\nBaden-Württemberg Amtsgericht Freiburg HRB 621344\nLöschungsankündigung 11.11.2025 (Eintragungsdatum)\n\nGisinger GmbH\nGesellschaft mit beschränkter Haftung\nÜhlingen-Birkendorf\n\nAls nicht eingetragen wird bekanntgemacht:\nDas Gericht beabsichtigt, die Gesellschaft wegen Vermögenslosigkeit im Handelsregister von Amts wegen nach § 394 FamFG zu löschen. Die Frist zur Geltendmachung eines Widerspruchs gegen die beabsichtigte Löschung ist auf einen Monat ab Veröffentlichung bestimmt."
    },
    {
      "date": "2025-11-11",
      "id": "136952",
      "original_text": "Einreichung neuer Dokumente\nBaden-Württemberg Amtsgericht Freiburg HRB 541022\nAmcor Flexibles Singen GmbH – Singen Hohentwiel",
      "type": "Einreichung neuer Dokumente",
      "state": "Baden-Württemberg",
      "amtsgericht": "Amtsgericht Freiburg",
      "registernummer": "HRB 541022",
      "registerart": "HRB",
      "company_name": "Amcor Flexibles Singen GmbH",
      "company_seat": "Singen Hohentwiel",
      "details": "11.11.2025 (Bekanntmachungsdatum)\n\nBaden-Württemberg Amtsgericht Freiburg HRB 541022\nEinreichung neuer Dokumente\n\nAmcor Flexibles Singen GmbH\nGesellschaft mit beschränkter Haftung\nSingen Hohentwiel\n\nDie Gesellschaft hat am 08.11.2025 die Liste über die Zusammensetzung des Aufsichtsrats zum Handelsregister eingereicht."
    },
    {
      "date": "2025-11-11",
      "id": "136953",
      "original_text": "Registerbekanntmachung nach dem Umwandlungsgesetz\nHamburg Amtsgericht Hamburg HRB 195344\nIntega Kaffeemaschinen GmbH – Hamburg",
      "type": "Registerbekanntmachung nach dem Umwandlungsgesetz",
      "state": "Hamburg",
      "amtsgericht": "Amtsgericht Hamburg",
      "registernummer": "HRB 195344",
      "registerart": "HRB",
      "company_name": "Intega Kaffeemaschinen GmbH",
      "company_seat": "Hamburg",
      "details": "11.11.2025 (Bekanntmachungsdatum)\n\nHamburg Amtsgericht Hamburg HRB 195344\nRegisterbekanntmachung nach dem Umwandlungsgesetz 11.11.2025 (Eintragungsdatum)\n\nIntega Kaffeemaschinen GmbH\nGesellschaft mit beschränkter Haftung\nHamburg\n\nAls nicht eingetragen wird bekannt gemacht:\nDen Gläubigern der an der Ausgliederung beteiligten Gesellschaften ist, wenn sie binnen sechs Monaten nach dem Tag, an dem die Eintragung der Ausgliederung in das Register des Sitzes desjenigen Rechtsträgers, dessen Gläubiger sie sind, nach § 19 Absatz 3 UmwG als bekannt gemacht gilt, ihren Anspruch nach Grund und Höhe schriftlich anmelden, Sicherheit zu leisten, soweit sie nicht Befriedigung verlangen können. Dieses Recht steht den Gläubigern jedoch nur zu, wenn sie glaubhaft machen, dass durch die Ausgliederung die Erfüllung ihrer Forderung gefährdet wird."
    },
    {
      "date": "2025-11-11",
      "id": "136954",
      "original_text": "Sonstige Registerbekanntmachung\nHamburg Amtsgericht Hamburg HRB 1902\nHamburger Hafen und Logistik Aktiengesellschaft – Hamburg",
      "type": "Sonstige Registerbekanntmachung",
      "state": "Hamburg",
      "amtsgericht": "Amtsgericht Hamburg",
      "registernummer": "HRB 1902",
      "registerart": "HRB",
      "company_name": "Hamburger Hafen und Logistik Aktiengesellschaft",
      "company_seat": "Hamburg",
      "details": "11.11.2025 (Bekanntmachungsdatum)\n\nHamburg Amtsgericht Hamburg HRB 1902\nSonstige Registerbekanntmachung\n\nHamburger Hafen und Logistik Aktiengesellschaft\nAktiengesellschaft\nHamburg\n\nAls nicht eingetragen wird bekannt gemacht: Liste des Aufsichtsrats wurde eingereicht."
    },
    {
      "date": "2025-11-11",
      "id": "136955",
      "original_text": "Registerbekanntmachung nach dem Umwandlungsgesetz\nHamburg Amtsgericht Hamburg HRA 90657\nIntega Kaffeemaschinen e.K. – Hamburg",
      "type": "Registerbekanntmachung nach dem Umwandlungsgesetz",
      "state": "Hamburg",
      "amtsgericht": "Amtsgericht Hamburg",
      "registernummer": "HRA 90657",
      "registerart": "HRA",
      "company_name": "Intega Kaffeemaschinen e.K.",
      "company_seat": "Hamburg",
      "details": "11.11.2025 (Bekanntmachungsdatum)\n\nHamburg Amtsgericht Hamburg HRA 90657\nRegisterbekanntmachung nach dem Umwandlungsgesetz 11.11.2025 (Eintragungsdatum)\n\nIntega Kaffeemaschinen e.K.\nEinzelkaufmann\nHamburg\n\nAls nicht eingetragen wird bekannt gemacht:\nDen Gläubigern der an der Ausgliederung beteiligten Gesellschaften ist, wenn sie binnen sechs Monaten nach dem Tag, an dem die Eintragung der Ausgliederung in das Register des Sitzes desjenigen Rechtsträgers, dessen Gläubiger sie sind, nach § 19 Absatz 3 UmwG als bekannt gemacht gilt, ihren Anspruch nach Grund und Höhe schriftlich anmelden, Sicherheit zu leisten, soweit sie nicht Befriedigung verlangen können. Dieses Recht steht den Gläubigern jedoch nur zu, wenn sie glaubhaft machen, dass durch die Ausgliederung die Erfüllung ihrer Forderung gefährdet wird."
    },
    {
      "date": "2025-11-11",
      "id": "136956",
      "original_text": "Sonstige Registerbekanntmachung\nBrandenburg Amtsgericht Cottbus HRB 15607\nPiwa Holding GmbH – Schönefeld",
      "type": "Sonstige Registerbekanntmachung",
      "state": "Brandenburg",
      "amtsgericht": "Amtsgericht Cottbus",
      "registernummer": "HRB 15607",
      "registerart": "HRB",
      "company_name": "Piwa Holding GmbH",
      "company_seat": "Schönefeld",
      "details": "11.11.2025 (Bekanntmachungsdatum)\n\nBrandenburg Amtsgericht Cottbus HRB 15607\nSonstige Registerbekanntmachung\n\nPiwa Holding GmbH\nGesellschaft mit beschränkter Haftung\nSchönefeld\n\nAls nicht eingetragen wird veröffentlicht:\nGläubigern, deren Forderungen begründet worden sind, bevor die Eintragung des Beschlusses als nach § 10 des Handelsgesetzbuches bekannt gemacht gilt, ist, wenn sie sich binnen sechs Monaten nach der Bekanntmachung zu diesem Zweck melden, Sicherheit zu leisten, soweit sie nicht Befriedigung verlangen können"
    },
    {
      "date": "2025-11-11",
      "id": "136957",
      "original_text": "Registerbekanntmachung nach dem Umwandlungsgesetz\nBrandenburg Amtsgericht Cottbus HRB 15272\nVEM Vermögensverwaltung GmbH – Schönefeld",
      "type": "Registerbekanntmachung nach dem Umwandlungsgesetz",
      "state": "Brandenburg",
      "amtsgericht": "Amtsgericht Cottbus",
      "registernummer": "HRB 15272",
      "registerart": "HRB",
      "company_name": "VEM Vermögensverwaltung GmbH",
      "company_seat": "Schönefeld",
      "details": "11.11.2025 (Bekanntmachungsdatum)\n\nBrandenburg Amtsgericht Cottbus HRB 15272\nRegisterbekanntmachung nach dem Umwandlungsgesetz 11.11.2025 (Eintragungsdatum)\n\nVEM Vermögensverwaltung GmbH\nGesellschaft mit beschränkter Haftung\nSchönefeld\n\nZu Eintragungsnummer 11 vom 11.11.2025 wird als nicht eingetragen veröffentlicht:\nAls nicht eingetragen wird veröffentlicht:\nDen Gläubigern der an der Verschmelzung beteiligten Rechtsträger ist, wenn sie binnen sechs Monaten nach dem Tag, an dem die Eintragung der Verschmelzung in das Register des Sitzes desjenigen Rechtsträgers, dessen Gläubiger sie sind, als bekannt gemacht gilt, ihren Anspruch nach Grund und Höhe schriftlich anmelden, Sicherheit zu leisten, soweit sie nicht Befriedigung verlangen können. Dieses Recht steht den Gläubigern jedoch nur zu, wenn sie glaubhaft machen, dass durch die Verschmelzung die Erfüllung ihrer Forderung gefährdet wird"
    },
    {
      "date": "2025-11-11",
      "id": "136958",
      "original_text": "Registerbekanntmachung nach dem Umwandlungsgesetz\nNiedersachsen Amtsgericht Osnabrück HRB 222032\nMarketing Machine GmbH – Hagen a.T.W.",
      "type": "Registerbekanntmachung nach dem Umwandlungsgesetz",
      "state": "Niedersachsen",
      "amtsgericht": "Amtsgericht Osnabrück",
      "registernummer": "HRB 222032",
      "registerart": "HRB",
      "company_name": "Marketing Machine GmbH",
      "company_seat": "Hagen a.T.W.",
      "details": "11.11.2025 (Bekanntmachungsdatum)\n\nNiedersachsen Amtsgericht Osnabrück HRB 222032\nRegisterbekanntmachung nach dem Umwandlungsgesetz 11.11.2025 (Eintragungsdatum)\n\nMarketing Machine GmbH\nGesellschaft mit beschränkter Haftung\nHagen a.T.W.\n\nDen Gläubigern der an der Ausgliederung beteiligten Rechtsträger ist, wenn sie binnen sechs Monaten nach dem Tag, an dem die Eintragung der Ausgliederung in das Register des Sitzes desjenigen Rechtsträgers, dessen Gläubiger sie sind, nach § 19 Abs. 3 UmwG als bekannt gemacht gilt, ihren Anspruch nach Grund und Höhe schriftlich anmelden, Sicherheit zu leisten, soweit sie nicht Befriedigung verlangen können. Dieses Recht steht den Gläubigern jedoch nur zu, wenn sie glaubhaft machen, dass durch die Ausgliederung die Erfüllung der Forderung gefährdet wird."
    },
    {
      "date": "2025-11-11",
      "id": "136959",
      "original_text": "Einreichung neuer Dokumente\nNiedersachsen Amtsgericht Tostedt HRB 100303 früher Amtsgericht Stade\nStader Versorgungs- und Bädergesellschaft mbH – Stade",
      "type": "Einreichung neuer Dokumente",
      "state": "Niedersachsen",
      "amtsgericht": "Amtsgericht Tostedt",
      "registernummer": "HRB 100303",
      "registerart": "HRB",
      "company_name": "Stader Versorgungs- und Bädergesellschaft mbH",
      "company_seat": "Stade",
      "former_amtsgericht": "Stade",
      "details": "11.11.2025 (Bekanntmachungsdatum)\n\nNiedersachsen Amtsgericht Tostedt HRB 100303 früher Amtsgericht Stade\nEinreichung neuer Dokumente 11.11.2025 (Eintragungsdatum)\n\nStader Versorgungs- und Bädergesellschaft mbH\nGesellschaft mit beschränkter Haftung\nStade\n\nDie Liste der Mitglieder des Aufsichtsrats wurde beim Registergericht eingereicht."
    },
    {
      "date": "2025-11-11",
      "id": "136960",
      "original_text": "Löschungsankündigung\nNiedersachsen Amtsgericht Osnabrück HRB 210443\nShabani Verwaltungs-UG (haftungsbeschränkt) – Lingen",
      "type": "Löschungsankündigung",
      "state": "Niedersachsen",
      "amtsgericht": "Amtsgericht Osnabrück",
      "registernummer": "HRB 210443",
      "registerart": "HRB",
      "company_name": "Shabani Verwaltungs-UG (haftungsbeschränkt)",
      "company_seat": "Lingen",
      "details": "11.11.2025 (Bekanntmachungsdatum)\n\nNiedersachsen Amtsgericht Osnabrück HRB 210443\nLöschungsankündigung\n\nShabani Verwaltungs-UG (haftungsbeschränkt)\nGesellschaft mit beschränkter Haftung\nLingen\n\nDas Registergericht beabsichtigt, die Gesellschaft von Amts wegen nach § 394 FamFG wegen Vermögenslosigkeit zu löschen. Die Frist zur Erhebung eines Widerspruchs ist auf 1 Monat ab dieser Registerbekanntmachung festgesetzt."
    },
    {
      "date": "2025-11-11",
      "id": "136961",
      "original_text": "Registerbekanntmachung nach dem Umwandlungsgesetz\nNiedersachsen Amtsgericht Hildesheim HRB 100055 früher Amtsgericht Gifhorn\nStephanshof GmbH Wild- und Weidezäune – Wittingen",
      "type": "Registerbekanntmachung nach dem Umwandlungsgesetz",
      "state": "Niedersachsen",
      "amtsgericht": "Amtsgericht Hildesheim",
      "registernummer": "HRB 100055",
      "registerart": "HRB",
      "company_name": "Stephanshof GmbH Wild- und Weidezäune",
      "company_seat": "Wittingen",
      "former_amtsgericht": "Gifhorn",
      "details": "11.11.2025 (Bekanntmachungsdatum)\n\nNiedersachsen Amtsgericht Hildesheim HRB 100055 früher Amtsgericht Gifhorn\nRegisterbekanntmachung nach dem Umwandlungsgesetz 11.11.2025 (Eintragungsdatum)\n\nStephanshof GmbH Wild- und Weidezäune\nGesellschaft mit beschränkter Haftung\nWittingen\n\nDen Gläubigern der an der Verschmelzung beteiligten Rechtsträger ist, wenn sie binnen sechs Monaten nach dem Tag, an dem die Eintragung der Verschmelzung in das Register des Sitzes desjenigen Rechtsträgers, dessen Gläubiger sie sind, nach § 19  Abs.  3 UmwG als bekannt gemacht gilt, ihren Anspruch nach Grund und Höhe schriftlich anmelden, Sicherheit zu leisten, soweit sie nicht Befriedigung verlangen können. Dieses Recht steht den Gläubigern jedoch nur zu, wenn sie glaubhaft machen, dass durch die Verschmelzung die Erfüllung der Forderung gefährdet wird."
    },
    {
      "date": "2025-11-11",
      "id": "136962",
      "original_text": "Löschungsankündigung\nNiedersachsen Amtsgericht Braunschweig HRB 206129\nWittek Baugesellschaft mbH – Helmstedt",
      "type": "Löschungsankündigung",
      "state": "Niedersachsen",
      "amtsgericht": "Amtsgericht Braunschweig",
      "registernummer": "HRB 206129",
      "registerart": "HRB",
      "company_name": "Wittek Baugesellschaft mbH",
      "company_seat": "Helmstedt",
      "details": "11.11.2025 (Bekanntmachungsdatum)\n\nNiedersachsen Amtsgericht Braunschweig HRB 206129\nLöschungsankündigung\n\nWittek Baugesellschaft mbH\nGesellschaft mit beschränkter Haftung\nHelmstedt\n\nDas Registergericht beabsichtigt, die Gesellschaft von Amts wegen nach § 394 FamFG zu löschen. Die Frist zur Erhebung eines Widerspruchs ist auf 1 Monat ab dieser Registerbekanntmachung festgesetzt."
    },
    {
      "date": "2025-11-11",
      "id": "136963",
      "original_text": "Löschungsankündigung\nNiedersachsen Amtsgericht Osnabrück HRB 18960\nConstru-CIF GmbH – Belm",
      "type": "Löschungsankündigung",
      "state": "Niedersachsen",
      "amtsgericht": "Amtsgericht Osnabrück",
      "registernummer": "HRB 18960",
      "registerart": "HRB",
      "company_name": "Constru-CIF GmbH",
      "company_seat": "Belm",
      "details": "11.11.2025 (Bekanntmachungsdatum)\n\nNiedersachsen Amtsgericht Osnabrück HRB 18960\nLöschungsankündigung\n\nConstru-CIF GmbH\nGesellschaft mit beschränkter Haftung\nBelm\n\nDas Registergericht beabsichtigt, die Gesellschaft von Amts wegen nach § 394 FamFG wegen Vermögenslosigkeit zu löschen. Die Frist zur Erhebung eines Widerspruchs ist auf 1 Monat ab dieser Registerbekanntmachung festgesetzt."
    },
    {
      "date": "2025-11-11",
      "id": "136964",
      "original_text": "Einreichung neuer Dokumente\nNiedersachsen Amtsgericht Tostedt HRB 100009 früher Amtsgericht Stade\nStadtwerke Stade GmbH – Stade",
      "type": "Einreichung neuer Dokumente",
      "state": "Niedersachsen",
      "amtsgericht": "Amtsgericht Tostedt",
      "registernummer": "HRB 100009",
      "registerart": "HRB",
      "company_name": "Stadtwerke Stade GmbH",
      "company_seat": "Stade",
      "former_amtsgericht": "Stade",
      "details": "11.11.2025 (Bekanntmachungsdatum)\n\nNiedersachsen Amtsgericht Tostedt HRB 100009 früher Amtsgericht Stade\nEinreichung neuer Dokumente 11.11.2025 (Eintragungsdatum)\n\nStadtwerke Stade GmbH\nGesellschaft mit beschränkter Haftung\nStade\n\nDie Liste der Mitglieder des Aufsichtsrats wurde beim Registergericht eingereicht."
    },
    {
      "date": "2025-11-11",
      "id": "136965",
      "original_text": "Sonstige Registerbekanntmachung\nNiedersachsen Amtsgericht Braunschweig HRB 209718\nHE Projekt GmbH – Braunschweig",
      "type": "Sonstige Registerbekanntmachung",
      "state": "Niedersachsen",
      "amtsgericht": "Amtsgericht Braunschweig",
      "registernummer": "HRB 209718",
      "registerart": "HRB",
      "company_name": "HE Projekt GmbH",
      "company_seat": "Braunschweig",
      "details": "11.11.2025 (Bekanntmachungsdatum)\n\nNiedersachsen Amtsgericht Braunschweig HRB 209718\nSonstige Registerbekanntmachung\n\nHE Projekt GmbH\nGesellschaft mit beschränkter Haftung\nBraunschweig\n\nDas Registergericht beabsichtigt, die Eintragung von Hesham Ahmed El-Rawy als Liquidator im Handelsregister auf der Grundlage von § 395 FamFG wegen Gewerbeuntersagung von Amts wegen zu löschen.\nDie Frist zur Erhebung eines Widerspruchs ist auf 1 Monat ab dieser Registerbekanntmachung festgesetzt."
    },
    {
      "date": "2025-11-11",
      "id": "136966",
      "original_text": "Registerbekanntmachung nach dem Umwandlungsgesetz\nNiedersachsen Amtsgericht Oldenburg (Oldenburg) HRB 202523\nJ. Müller Aktiengesellschaft – Brake/Unterweser",
      "type": "Registerbekanntmachung nach dem Umwandlungsgesetz",
      "state": "Niedersachsen",
      "amtsgericht": "Amtsgericht Oldenburg (Oldenburg)",
      "registernummer": "HRB 202523",
      "registerart": "HRB",
      "company_name": "J. Müller Aktiengesellschaft",
      "company_seat": "Brake/Unterweser",
      "details": "11.11.2025 (Bekanntmachungsdatum)\n\nNiedersachsen Amtsgericht Oldenburg (Oldenburg) HRB 202523\nRegisterbekanntmachung nach dem Umwandlungsgesetz 23.07.2025 (Eintragungsdatum)\n\nJ. Müller Aktiengesellschaft\nAktiengesellschaft\nBrake/Unterweser\n\nDen Gläubigern der an der grenzüberschreitenden Verschmelzung beteiligten übernehmenden Rechtsträger ist, wenn sie binnen sechs Monaten nach dem Tag, an dem die Eintragung der Verschmelzung in das Register des Sitzes desjenigen Rechtsträgers, dessen Gläubiger sie sind, nach § 19 Absatz 3 UmwG als bekanntgemacht gilt, ihren Anspruch nach Grund und Höhe schriftlich anmelden, Sicherheit zu leisten, soweit sie nicht Befriedigung verlangen können.\n\nDieses Recht steht den Gläubigern jedoch nur zu, wenn sie glaubhaft machen, dass durch die Verschmelzung die Erfüllung ihrer Forderung gefährdet wird."
    },
    {
      "date": "2025-11-11",
      "id": "136967",
      "original_text": "Registerbekanntmachung nach dem Umwandlungsgesetz\nNiedersachsen Amtsgericht Oldenburg (Oldenburg) HRB 222491\nJ. Müller SE – Brake / Unterweser",
      "type": "Registerbekanntmachung nach dem Umwandlungsgesetz",
      "state": "Niedersachsen",
      "amtsgericht": "Amtsgericht Oldenburg (Oldenburg)",
      "registernummer": "HRB 222491",
      "registerart": "HRB",
      "company_name": "J. Müller SE",
      "company_seat": "Brake / Unterweser",
      "details": "11.11.2025 (Bekanntmachungsdatum)\n\nNiedersachsen Amtsgericht Oldenburg (Oldenburg) HRB 222491\nRegisterbekanntmachung nach dem Umwandlungsgesetz 23.07.2025 (Eintragungsdatum)\n\nJ. Müller SE\nEuropäische Aktiengesellschaft (SE)\nBrake / Unterweser\n\nDen Gläubigern der an der grenzüberschreitenden Verschmelzung beteiligten übernehmenden Rechtsträger ist, wenn sie binnen sechs Monaten nach dem Tag, an dem die Eintragung der Verschmelzung in das Register des Sitzes desjenigen Rechtsträgers, dessen Gläubiger sie sind, nach § 19 Absatz 3 UmwG als bekanntgemacht gilt, ihren Anspruch nach Grund und Höhe schriftlich anmelden, Sicherheit zu leisten, soweit sie nicht Befriedigung verlangen können.\n\nDieses Recht steht den Gläubigern jedoch nur zu, wenn sie glaubhaft machen, dass durch die Verschmelzung die Erfüllung ihrer Forderung gefährdet wird."
    },
    {
      "date": "2025-11-11",
      "id": "136968",
      "original_text": "Registerbekanntmachung nach dem Umwandlungsgesetz\nNiedersachsen Amtsgericht Göttingen VR 130044\nNortheim Touristik e.V. – Northeim",
      "type": "Registerbekanntmachung nach dem Umwandlungsgesetz",
      "state": "Niedersachsen",
      "amtsgericht": "Amtsgericht Göttingen",
      "registernummer": "VR 130044",
      "registerart": "VR",
      "company_name": "Northeim Touristik e.V.",
      "company_seat": "Northeim",
      "details": "11.11.2025 (Bekanntmachungsdatum)\n\nNiedersachsen Amtsgericht Göttingen VR 130044\nRegisterbekanntmachung nach dem Umwandlungsgesetz 11.11.2025 (Eintragungsdatum)\n\nNortheim Touristik e.V.\neingetragener Verein\nNortheim\n\nDen Gläubigern der an der Verschmelzung beteiligten Rechtsträger ist, wenn sie binnen sechs Monaten nach dem Tag, an dem die Eintragung der Verschmelzung in das Register des Sitzes desjenigen Rechtsträgers, dessen Gläubiger sie sind, nach § 19  Abs.  3 UmwG als bekannt gemacht gilt, ihren Anspruch nach Grund und Höhe schriftlich anmelden, Sicherheit zu leisten, soweit sie nicht Befriedigung verlangen können. Dieses Recht steht den Gläubigern jedoch nur zu, wenn sie glaubhaft machen, dass durch die Verschmelzung die Erfüllung der Forderung gefährdet wird."
    },
    {
      "date": "2025-11-11",
      "id": "136969",
      "original_text": "Registerbekanntmachung nach dem Umwandlungsgesetz\nRheinland-Pfalz Amtsgericht Mainz VR 40732\nHandelsverband Südwest e.V. – Mainz",
      "type": "Registerbekanntmachung nach dem Umwandlungsgesetz",
      "state": "Rheinland-Pfalz",
      "amtsgericht": "Amtsgericht Mainz",
      "registernummer": "VR 40732",
      "registerart": "VR",
      "company_name": "Handelsverband Südwest e.V.",
      "company_seat": "Mainz",
      "details": "11.11.2025 (Bekanntmachungsdatum)\n\nRheinland-Pfalz Amtsgericht Mainz VR 40732\nRegisterbekanntmachung nach dem Umwandlungsgesetz 11.11.2025 (Eintragungsdatum)\n\nHandelsverband Südwest e.V.\neingetragener Verein\nMainz\n\nAls nicht eingetragen wird veröffentlicht: Den Gläubigern der an der Verschmelzung beteiligten Rechtsträger ist, wenn sie binnen sechs Monaten nach dem Tag, an dem die Eintragung der Verschmelzung in das Register des Sitzes desjenigen Rechtsträgers, dessen Gläubiger sie sind, nach § 19 Abs. 3 UmwG als bekannt gemacht gilt, ihren Anspruch nach Grund und Höhe schriftlich anmelden, Sicherheit zu leisten, soweit sie nicht Befriedigung verlangen können. Dieses Recht steht den Gläubigern jedoch nur zu, wenn sie glaubhaft machen, dass durch die Verschmelzung die Erfüllung ihrer Forderung gefährdet wird."
    },
    {
      "date": "2025-11-11",
      "id": "136970",
      "original_text": "Löschungsankündigung\nRheinland-Pfalz Amtsgericht Zweibrücken HRB 32107\nGaLaBau GBO UG (haftungsbeschränkt) – Altenkirchen",
      "type": "Löschungsankündigung",
      "state": "Rheinland-Pfalz",
      "amtsgericht": "Amtsgericht Zweibrücken",
      "registernummer": "HRB 32107",
      "registerart": "HRB",
      "company_name": "GaLaBau GBO UG (haftungsbeschränkt)",
      "company_seat": "Altenkirchen",
      "details": "11.11.2025 (Bekanntmachungsdatum)\n\nRheinland-Pfalz Amtsgericht Zweibrücken HRB 32107\nLöschungsankündigung\n\nGaLaBau GBO UG (haftungsbeschränkt)\nGesellschaft mit beschränkter Haftung\nAltenkirchen\n\nDas Registergericht beabsichtigt die Gesellschaft von Amts wegen nach § 394 FamFG zu löschen. Die Frist zur Erhebung eines Widerspruchs ist auf einen Monat festgesetzt."
    },
    {
      "date": "2025-11-11",
      "id": "136971",
      "original_text": "Löschungsankündigung\nRheinland-Pfalz Amtsgericht Mainz HRB 52116\nNEWTOWN Bauträger GmbH – Mainz",
      "type": "Löschungsankündigung",
      "state": "Rheinland-Pfalz",
      "amtsgericht": "Amtsgericht Mainz",
      "registernummer": "HRB 52116",
      "registerart": "HRB",
      "company_name": "NEWTOWN Bauträger GmbH",
      "company_seat": "Mainz",
      "details": "11.11.2025 (Bekanntmachungsdatum)\n\nRheinland-Pfalz Amtsgericht Mainz HRB 52116\nLöschungsankündigung\n\nNEWTOWN Bauträger GmbH\nGesellschaft mit beschränkter Haftung\nMainz\n\nDas Registergericht beabsichtigt die Gesellschaft von Amts wegen nach § 394 FamFG zu löschen. Die Frist zur Erhebung eines Widerspruchs ist auf einen Monat festgesetzt."
    },
    {
      "date": "2025-11-11",
      "id": "136972",
      "original_text": "Löschungsankündigung\nNordrhein-Westfalen Amtsgericht Dortmund HRB 28410\nR.W. Natursteinbau UG (haftungsbeschränkt) – Castrop-Rauxel",
      "type": "Löschungsankündigung",
      "state": "Nordrhein-Westfalen",
      "amtsgericht": "Amtsgericht Dortmund",
      "registernummer": "HRB 28410",
      "registerart": "HRB",
      "company_name": "R.W. Natursteinbau UG (haftungsbeschränkt)",
      "company_seat": "Castrop-Rauxel",
      "details": "11.11.2025 (Bekanntmachungsdatum)\n\nNordrhein-Westfalen Amtsgericht Dortmund HRB 28410\nLöschungsankündigung\n\nR.W. Natursteinbau UG (haftungsbeschränkt)\nGesellschaft mit beschränkter Haftung\nCastrop-Rauxel\n\nDas Registergericht beabsichtigt die Gesellschaft von Amts wegen nach § 394 FamFG zu löschen. Die Frist zur Erhebung eines Widerspruchs ist auf zwei Monate festgesetzt."
    },
    {
      "date": "2025-11-11",
      "id": "136973",
      "original_text": "Löschungsankündigung\nNordrhein-Westfalen Amtsgericht Düsseldorf HRB 90851\nShuttle Driver GmbH – Düsseldorf",
      "type": "Löschungsankündigung",
      "state": "Nordrhein-Westfalen",
      "amtsgericht": "Amtsgericht Düsseldorf",
      "registernummer": "HRB 90851",
      "registerart": "HRB",
      "company_name": "Shuttle Driver GmbH",
      "company_seat": "Düsseldorf",
      "details": "11.11.2025 (Bekanntmachungsdatum)\n\nNordrhein-Westfalen Amtsgericht Düsseldorf HRB 90851\nLöschungsankündigung\n\nShuttle Driver GmbH\nGesellschaft mit beschränkter Haftung\nDüsseldorf\n\nDas Registergericht beabsichtigt die Gesellschaft von Amts wegen nach § 394 FamFG zu löschen. Die Frist zur Erhebung eines Widerspruchs ist auf 3 Wochen festgesetzt.\n\nRechtsbehelfsbelehrung:\nDas Widerspruchsrecht steht jedem zu, der an der Unterlassung der Löschung ein berechtigtes Interesse hat. Der Widerspruch ist bei dem Amtsgericht Düsseldorf -Registergericht-, Werdener Straße 1, 40227 Düsseldorf schriftlich in deutscher Sprache oder zur Niederschrift der Geschäftsstelle einzulegen. Der Widerspruch kann auch zur Niederschrift der Geschäftsstelle eines jeden Amtsgerichtes abgegeben werden. Die Einlegung ist auch durch Übertragung eines elektronischen Dokuments an die elektronische Poststelle des Gerichts möglich. Das elektronische Dokument muss für die Bearbeitung durch das Gericht geeignet und mit einer qualifizierten elektronischen Signatur der verantwortenden Person versehen sein oder von der verantwortenden Person signiert und auf einem sicheren Übermittlungsweg gemäß § 130a ZPO nach näherer Maßgabe der Verordnung über die technischen Rahmenbedingungen des elektronischen Rechtsverkehrs und über das besondere elektronische Behördenpostfach (BGBl. I, S.3803) eingereicht werden. Weitere Informationen erhalten Sie auf der Internetseite www.justiz.de.\nDer Widerspruch muss spätestens innerhalb der gesetzten Frist nach dem Datum der Bekanntmachung der Löschungsankündigung bei dem Amtsgericht - Registergericht - Düsseldorf eingegangen sein.  Dies gilt auch dann, wenn der Widerspruch zur Niederschrift der Geschäftsstelle eines anderen Amtsgerichtes abgegeben wurde. Die Frist beginnt mit dem Tage der Bekanntmachung der Löschungsankündigung in dem für die Bekanntmachung der Eintragungen in das Handelsregister bestimmten elektronischen Informations- und Kommunikationssystem nach § 10 des Handelsgesetzbuches. Fällt das Ende der Frist auf einen Sonntag, einen allgemeinen Feiertag oder Sonnabend, so endet die Frist mit Ablauf des nächsten Werktages.\nDer Widerspruch muss die Bezeichnung der angefochtenen Löschungsankündigung sowie die Erklärung enthalten, dass Widerspruch gegen diese Löschungsankündigung eingelegt wird. Er ist zu unterzeichnen und soll begründet werden."
    },
    {
      "date": "2025-11-11",
      "id": "136974",
      "original_text": "Löschungsankündigung\nNordrhein-Westfalen Amtsgericht Bochum HRB 17238\nko punkt projekt Unternehmergesellschaft (haftungsbeschränkt) – Bochum",
      "type": "Löschungsankündigung",
      "state": "Nordrhein-Westfalen",
      "amtsgericht": "Amtsgericht Bochum",
      "registernummer": "HRB 17238",
      "registerart": "HRB",
      "company_name": "ko punkt projekt Unternehmergesellschaft (haftungsbeschränkt)",
      "company_seat": "Bochum",
      "details": "11.11.2025 (Bekanntmachungsdatum)\n\nNordrhein-Westfalen Amtsgericht Bochum HRB 17238\nLöschungsankündigung 11.11.2025 (Eintragungsdatum)\n\nko punkt projekt Unternehmergesellschaft (haftungsbeschränkt)\nGesellschaft mit beschränkter Haftung\nBochum\n\nDas Registergericht beabsichtigt die Gesellschaft von Amts wegen nach § 394 FamFG zu löschen. Die Frist zur Erhebung eines Widerspruchs ist auf drei Monate festgesetzt."
    },
    {
      "date": "2025-11-11",
      "id": "136975",
      "original_text": "Löschungsankündigung\nNordrhein-Westfalen Amtsgericht Kleve HRB 12847\nKöy Food GmbH – Rheurdt",
      "type": "Löschungsankündigung",
      "state": "Nordrhein-Westfalen",
      "amtsgericht": "Amtsgericht Kleve",
      "registernummer": "HRB 12847",
      "registerart": "HRB",
      "company_name": "Köy Food GmbH",
      "company_seat": "Rheurdt",
      "details": "11.11.2025 (Bekanntmachungsdatum)\n\nNordrhein-Westfalen Amtsgericht Kleve HRB 12847\nLöschungsankündigung\n\nKöy Food GmbH\nGesellschaft mit beschränkter Haftung\nRheurdt\n\nDas Registergericht beabsichtigt die Gesellschaft von Amts wegen nach § 394 FamFG zu löschen. Die Frist zur Erhebung eines Widerspruchs ist auf einen Monat festgesetzt."
    },
    {
      "date": "2025-11-11",
      "id": "136976",
      "original_text": "Löschungsankündigung\nNordrhein-Westfalen Amtsgericht Kleve HRB 17598\n4 Seasons Houses GmbH – Emmerich am Rhein",
      "type": "Löschungsankündigung",
      "state": "Nordrhein-Westfalen",
      "amtsgericht": "Amtsgericht Kleve",
      "registernummer": "HRB 17598",
      "registerart": "HRB",
      "company_name": "4 Seasons Houses GmbH",
      "company_seat": "Emmerich am Rhein",
      "details": "11.11.2025 (Bekanntmachungsdatum)\n\nNordrhein-Westfalen Amtsgericht Kleve HRB 17598\nLöschungsankündigung\n\n4 Seasons Houses GmbH\nGesellschaft mit beschränkter Haftung\nEmmerich am Rhein\n\nDas Registergericht beabsichtigt die Gesellschaft von Amts wegen nach § 394 FamFG zu löschen. Die Frist zur Erhebung eines Widerspruchs ist auf einen Monat festgesetzt."
    },
    {
      "date": "2025-11-11",
      "id": "136977",
      "original_text": "Löschungsankündigung\nNordrhein-Westfalen Amtsgericht Dortmund GnR 451\nDortmunder Wohnwert Wohnungsgenossenschaft eG – Dortmund",
      "type": "Löschungsankündigung",
      "state": "Nordrhein-Westfalen",
      "amtsgericht": "Amtsgericht Dortmund",
      "registernummer": "GnR 451",
      "registerart": "GnR",
      "company_name": "Dortmunder Wohnwert Wohnungsgenossenschaft eG",
      "company_seat": "Dortmund",
      "details": "11.11.2025 (Bekanntmachungsdatum)\n\nNordrhein-Westfalen Amtsgericht Dortmund GnR 451\nLöschungsankündigung\n\nDortmunder Wohnwert Wohnungsgenossenschaft eG\neingetragene Genossenschaft\nDortmund\n\nDas Registergericht beabsichtigt die Genossenschaft von Amts wegen nach § 394 FamFG zu löschen. Die Frist zur Erhebung eines Widerspruchs ist auf zwei Monate festgesetzt."
    },
    {
      "date": "2025-11-11",
      "id": "136978",
      "original_text": "Löschungsankündigung\nNordrhein-Westfalen Amtsgericht Köln HRA 33457\nKölner Bauprojekte GC GmbH & Co. KG – Köln",
      "type": "Löschungsankündigung",
      "state": "Nordrhein-Westfalen",
      "amtsgericht": "Amtsgericht Köln",
      "registernummer": "HRA 33457",
      "registerart": "HRA",
      "company_name": "Kölner Bauprojekte GC GmbH & Co. KG",
      "company_seat": "Köln",
      "details": "11.11.2025 (Bekanntmachungsdatum)\n\nNordrhein-Westfalen Amtsgericht Köln HRA 33457\nLöschungsankündigung 11.11.2025 (Eintragungsdatum)\n\nKölner Bauprojekte GC GmbH & Co. KG\nKommanditgesellschaft\nKöln\n\nDas Registergericht beabsichtigt nachfolgende Firmen von Amts wegen nach §§ 6,  31 Abs. 2 HGB wegen Aufgabe des Geschäftsbetriebes zu löschen. Die Frist zur Erhebung eines Widerspruchs ist auf 1 Monat festgesetzt."
    },
    {
      "date": "2025-11-11",
      "id": "136979",
      "original_text": "Löschungsankündigung\nNordrhein-Westfalen Amtsgericht Dortmund HRB 25258\nUTS Fensterbau GmbH – Dortmund",
      "type": "Löschungsankündigung",
      "state": "Nordrhein-Westfalen",
      "amtsgericht": "Amtsgericht Dortmund",
      "registernummer": "HRB 25258",
      "registerart": "HRB",
      "company_name": "UTS Fensterbau GmbH",
      "company_seat": "Dortmund",
      "details": "11.11.2025 (Bekanntmachungsdatum)\n\nNordrhein-Westfalen Amtsgericht Dortmund HRB 25258\nLöschungsankündigung\n\nUTS Fensterbau GmbH\nGesellschaft mit beschränkter Haftung\nDortmund\n\nDas Registergericht beabsichtigt die Gesellschaft von Amts wegen nach § 394 FamFG zu löschen. Die Frist zur Erhebung eines Widerspruchs ist auf zwei Monate festgesetzt."
    },
    {
      "date": "2025-11-11",
      "id": "136980",
      "original_text": "Registerbekanntmachung nach dem Umwandlungsgesetz\nNordrhein-Westfalen Amtsgericht Düsseldorf HRB 110250\nSereni Bestattungen GmbH – Düsseldorf",
      "type": "Registerbekanntmachung nach dem Umwandlungsgesetz",
      "state": "Nordrhein-Westfalen",
      "amtsgericht": "Amtsgericht Düsseldorf",
      "registernummer": "HRB 110250",
      "registerart": "HRB",
      "company_name": "Sereni Bestattungen GmbH",
      "company_seat": "Düsseldorf",
      "details": "11.11.2025 (Bekanntmachungsdatum)\n\nNordrhein-Westfalen Amtsgericht Düsseldorf HRB 110250\nRegisterbekanntmachung nach dem Umwandlungsgesetz 11.11.2025 (Eintragungsdatum)\n\nSereni Bestattungen GmbH\nGesellschaft mit beschränkter Haftung\nDüsseldorf\n\nDen Gläubigern der an der Verschmelzung beteiligten Rechtsträger ist, wenn sie binnen sechs Monaten nach dem Tag, an dem die Eintragung der Verschmelzung in das Register des Sitzes desjenigen Rechtsträgers, dessen Gläubiger sie sind, nach § 19 Absatz 3 UmwG als bekanntgemacht gilt, ihren Anspruch nach Grund und Höhe schriftlich anmelden, Sicherheit zu leisten, soweit sie nicht Befriedigung verlangen können. Dieses Recht steht den Gläubigern jedoch nur zu, wenn sie glaubhaft machen, dass durch die Verschmelzung die Erfüllung ihrer Forderung gefährdet wird."
    },
    {
      "date": "2025-11-11",
      "id": "136981",
      "original_text": "Registerbekanntmachung nach dem Umwandlungsgesetz\nNordrhein-Westfalen Amtsgericht Köln HRB 124360\nAATA Production GmbH – Köln",
      "type": "Registerbekanntmachung nach dem Umwandlungsgesetz",
      "state": "Nordrhein-Westfalen",
      "amtsgericht": "Amtsgericht Köln",
      "registernummer": "HRB 124360",
      "registerart": "HRB",
      "company_name": "AATA Production GmbH",
      "company_seat": "Köln",
      "details": "11.11.2025 (Bekanntmachungsdatum)\n\nNordrhein-Westfalen Amtsgericht Köln HRB 124360\nRegisterbekanntmachung nach dem Umwandlungsgesetz 11.11.2025 (Eintragungsdatum)\n\nAATA Production GmbH\nGesellschaft mit beschränkter Haftung\nKöln\n\nDen Gläubigern der an der Verschmelzung beteiligten Rechtsträger ist, wenn sie binnen sechs Monaten nach dem Tag, an dem die Eintragung der Verschmelzung in das Register des Sitzes desjenigen Rechtsträgers, dessen Gläubiger sie sind, nach § 19 Absatz 3 UmwG als bekanntgemacht gilt, ihren Anspruch nach Grund und Höhe schriftlich anmelden, Sicherheit zu leisten, soweit sie nicht Befriedigung verlangen können. Dieses Recht steht den Gläubigern jedoch nur zu, wenn sie glaubhaft machen, dass durch die Verschmelzung die Erfüllung ihrer Forderung gefährdet wird."
    },
    {
      "date": "2025-11-11",
      "id": "136982",
      "original_text": "Registerbekanntmachung nach dem Umwandlungsgesetz\nNordrhein-Westfalen Amtsgericht Dortmund HRA 13092\nPRO DIMI Healthcare GmbH & Co. KG. – Dortmund",
      "type": "Registerbekanntmachung nach dem Umwandlungsgesetz",
      "state": "Nordrhein-Westfalen",
      "amtsgericht": "Amtsgericht Dortmund",
      "registernummer": "HRA 13092",
      "registerart": "HRA",
      "company_name": "PRO DIMI Healthcare GmbH & Co. KG.",
      "company_seat": "Dortmund",
      "details": "11.11.2025 (Bekanntmachungsdatum)\n\nNordrhein-Westfalen Amtsgericht Dortmund HRA 13092\nRegisterbekanntmachung nach dem Umwandlungsgesetz 11.11.2025 (Eintragungsdatum)\n\nPRO DIMI Healthcare GmbH & Co. KG.\nKommanditgesellschaft\nDortmund\n\nDen Gläubigern der an der formwechselnden Umwandlung beteiligten Rechtsträger ist, wenn sie binnen sechs Monaten nach dem Tag, an dem die Eintragung der formwechselnden Umwandlung in das Register des Sitzes desjenigen Rechtsträgers, dessen Gläubiger sie sind, nach § 19 Absatz 3 UmwG als bekanntgemacht gilt, ihren Anspruch nach Grund und Höhe schriftlich anmelden, Sicherheit zu leisten, soweit sie nicht Befriedigung verlangen können. Dieses Recht steht den Gläubigern jedoch nur zu, wenn sie glaubhaft machen, dass durch die formwechselnden Umwandlung die Erfüllung ihrer Forderung gefährdet wird."
    },
    {
      "date": "2025-11-11",
      "id": "136983",
      "original_text": "Registerbekanntmachung nach dem Umwandlungsgesetz\nNordrhein-Westfalen Amtsgericht Köln HRB 114164\nJohnson UG (haftungsbeschränkt) – Köln",
      "type": "Registerbekanntmachung nach dem Umwandlungsgesetz",
      "state": "Nordrhein-Westfalen",
      "amtsgericht": "Amtsgericht Köln",
      "registernummer": "HRB 114164",
      "registerart": "HRB",
      "company_name": "Johnson UG (haftungsbeschränkt)",
      "company_seat": "Köln",
      "details": "11.11.2025 (Bekanntmachungsdatum)\n\nNordrhein-Westfalen Amtsgericht Köln HRB 114164\nRegisterbekanntmachung nach dem Umwandlungsgesetz 11.11.2025 (Eintragungsdatum)\n\nJohnson UG (haftungsbeschränkt)\nGesellschaft mit beschränkter Haftung\nKöln\n\nDen Gläubigern der an der Verschmelzung beteiligten Rechtsträger ist, wenn sie binnen sechs Monaten nach dem Tag, an dem die Eintragung der Verschmelzung in das Register des Sitzes desjenigen Rechtsträgers, dessen Gläubiger sie sind, nach § 19 Absatz 3 UmwG als bekanntgemacht gilt, ihren Anspruch nach Grund und Höhe schriftlich anmelden, Sicherheit zu leisten, soweit sie nicht Befriedigung verlangen können. Dieses Recht steht den Gläubigern jedoch nur zu, wenn sie glaubhaft machen, dass durch die Verschmelzung die Erfüllung ihrer Forderung gefährdet wird."
    },
    {
      "date": "2025-11-11",
      "id": "136984",
      "original_text": "Löschungsankündigung\nNordrhein-Westfalen Amtsgericht Dortmund HRA 17723\nTeves KG – Dortmund",
      "type": "Löschungsankündigung",
      "state": "Nordrhein-Westfalen",
      "amtsgericht": "Amtsgericht Dortmund",
      "registernummer": "HRA 17723",
      "registerart": "HRA",
      "company_name": "Teves KG",
      "company_seat": "Dortmund",
      "details": "11.11.2025 (Bekanntmachungsdatum)\n\nNordrhein-Westfalen Amtsgericht Dortmund HRA 17723\nLöschungsankündigung\n\nTeves KG\nKommanditgesellschaft\nDortmund\n\nDas Registergericht beabsichtigt die Firma von Amts wegen nach § 394 FamFG zu löschen. Die Frist zur Erhebung eines Widerspruchs ist auf drei Monate festgesetzt."
    },
    {
      "date": "2025-11-11",
      "id": "136985",
      "original_text": "Registerbekanntmachung nach dem Umwandlungsgesetz\nNordrhein-Westfalen Amtsgericht Köln HRB 93014\nTargetSpot Deutschland GmbH – Köln",
      "type": "Registerbekanntmachung nach dem Umwandlungsgesetz",
      "state": "Nordrhein-Westfalen",
      "amtsgericht": "Amtsgericht Köln",
      "registernummer": "HRB 93014",
      "registerart": "HRB",
      "company_name": "TargetSpot Deutschland GmbH",
      "company_seat": "Köln",
      "details": "11.11.2025 (Bekanntmachungsdatum)\n\nNordrhein-Westfalen Amtsgericht Köln HRB 93014\nRegisterbekanntmachung nach dem Umwandlungsgesetz 30.10.2025 (Eintragungsdatum)\n\nTargetSpot Deutschland GmbH\nGesellschaft mit beschränkter Haftung\nKöln\n\nDen Gläubigern der an der Verschmelzung beteiligten Rechtsträger ist, wenn sie binnen sechs Monaten nach dem Tag, an dem die Eintragung der Verschmelzung in das Register des Sitzes desjenigen Rechtsträgers, dessen Gläubiger sie sind, nach § 19 Absatz 3 UmwG als bekanntgemacht gilt, ihren Anspruch nach Grund und Höhe schriftlich anmelden, Sicherheit zu leisten, soweit sie nicht Befriedigung verlangen können. Dieses Recht steht den Gläubigern jedoch nur zu, wenn sie glaubhaft machen, dass durch die Verschmelzung die Erfüllung ihrer Forderung gefährdet wird."
    },
    {
      "date": "2025-11-11",
      "id": "136986",
      "original_text": "Löschungsankündigung\nNordrhein-Westfalen Amtsgericht Essen HRB 29976\nDumiSoft GmbH – Essen",
      "type": "Löschungsankündigung",
      "state": "Nordrhein-Westfalen",
      "amtsgericht": "Amtsgericht Essen",
      "registernummer": "HRB 29976",
      "registerart": "HRB",
      "company_name": "DumiSoft GmbH",
      "company_seat": "Essen",
      "details": "11.11.2025 (Bekanntmachungsdatum)\n\nNordrhein-Westfalen Amtsgericht Essen HRB 29976\nLöschungsankündigung\n\nDumiSoft GmbH\nGesellschaft mit beschränkter Haftung\nEssen\n\nDas Registergericht beabsichtigt die Gesellschaft von Amts wegen nach § 394 FamFG zu löschen. Die Frist zur Erhebung eines Widerspruchs ist auf einen Monat festgesetzt. Dem Registergericht ist eine Liste der Mitglieder des Aufsichtsrates eingereicht worden."
    },
    {
      "date": "2025-11-11",
      "id": "136987",
      "original_text": "Einreichung neuer Dokumente\nNordrhein-Westfalen Amtsgericht Paderborn HRB 3734\nACP IT Solutions AG – Paderborn",
      "type": "Einreichung neuer Dokumente",
      "state": "Nordrhein-Westfalen",
      "amtsgericht": "Amtsgericht Paderborn",
      "registernummer": "HRB 3734",
      "registerart": "HRB",
      "company_name": "ACP IT Solutions AG",
      "company_seat": "Paderborn",
      "details": "11.11.2025 (Bekanntmachungsdatum)\n\nNordrhein-Westfalen Amtsgericht Paderborn HRB 3734\nEinreichung neuer Dokumente\n\nACP IT Solutions AG\nAktiengesellschaft\nPaderborn"
    },
    {
      "date": "2025-11-11",
      "id": "136988",
      "original_text": "Registerbekanntmachung nach dem Umwandlungsgesetz\nNordrhein-Westfalen Amtsgericht Köln HRA 38237\nNöthen, Arndt & Schult GmbH & Co. OHG – Köln",
      "type": "Registerbekanntmachung nach dem Umwandlungsgesetz",
      "state": "Nordrhein-Westfalen",
      "amtsgericht": "Amtsgericht Köln",
      "registernummer": "HRA 38237",
      "registerart": "HRA",
      "company_name": "Nöthen, Arndt & Schult GmbH & Co. OHG",
      "company_seat": "Köln",
      "details": "11.11.2025 (Bekanntmachungsdatum)\n\nNordrhein-Westfalen Amtsgericht Köln HRA 38237\nRegisterbekanntmachung nach dem Umwandlungsgesetz 11.11.2025 (Eintragungsdatum)\n\nNöthen, Arndt & Schult GmbH & Co. OHG\nOffene Handelsgesellschaft\nKöln\n\nDen Gläubigern der an der formwechselnden Umwandlung beteiligten Rechtsträger ist, wenn sie binnen sechs Monaten nach dem Tag, an dem die Eintragung der formwechselnden Umwandlung in das Register des Sitzes desjenigen Rechtsträgers, dessen Gläubiger sie sind, nach § 19 Absatz 3 UmwG als bekanntgemacht gilt, ihren Anspruch nach Grund und Höhe schriftlich anmelden, Sicherheit zu leisten, soweit sie nicht Befriedigung verlangen können. Dieses Recht steht den Gläubigern jedoch nur zu, wenn sie glaubhaft machen, dass durch die formwechselnden Umwandlung die Erfüllung ihrer Forderung gefährdet wird."
    },
    {
      "date": "2025-11-11",
      "id": "136989",
      "original_text": "Löschungsankündigung\nNordrhein-Westfalen Amtsgericht Düsseldorf HRA 21272\nOffice Torgauer Platz GmbH & Co. KG – Düsseldorf",
      "type": "Löschungsankündigung",
      "state": "Nordrhein-Westfalen",
      "amtsgericht": "Amtsgericht Düsseldorf",
      "registernummer": "HRA 21272",
      "registerart": "HRA",
      "company_name": "Office Torgauer Platz GmbH & Co. KG",
      "company_seat": "Düsseldorf",
      "details": "11.11.2025 (Bekanntmachungsdatum)\n\nNordrhein-Westfalen Amtsgericht Düsseldorf HRA 21272\nLöschungsankündigung\n\nOffice Torgauer Platz GmbH & Co. KG\nKommanditgesellschaft\nDüsseldorf\n\nDas Registergericht beabsichtigt die Firma von Amts wegen nach § 394 FamFG zu löschen. Die Frist zur Erhebung eines Widerspruchs ist auf 3 Wochen festgesetzt.\n\nRechtsbehelfsbelehrung:\nDas Widerspruchsrecht steht jedem zu, der an der Unterlassung der Löschung ein berechtigtes Interesse hat. Der Widerspruch ist bei dem Amtsgericht Düsseldorf -Registergericht-, Werdener Straße 1, 40227 Düsseldorf schriftlich in deutscher Sprache oder zur Niederschrift der Geschäftsstelle einzulegen. Der Widerspruch kann auch zur Niederschrift der Geschäftsstelle eines jeden Amtsgerichtes abgegeben werden. Die Einlegung ist auch durch Übertragung eines elektronischen Dokuments an die elektronische Poststelle des Gerichts möglich. Das elektronische Dokument muss für die Bearbeitung durch das Gericht geeignet und mit einer qualifizierten elektronischen Signatur der verantwortenden Person versehen sein oder von der verantwortenden Person signiert und auf einem sicheren Übermittlungsweg gemäß § 130a ZPO nach näherer Maßgabe der Verordnung über die technischen Rahmenbedingungen des elektronischen Rechtsverkehrs und über das besondere elektronische Behördenpostfach (BGBl. I, S.3803) eingereicht werden. Weitere Informationen erhalten Sie auf der Internetseite www.justiz.de.\nDer Widerspruch muss spätestens innerhalb der gesetzten Frist nach dem Datum der Bekanntmachung der Löschungsankündigung bei dem Amtsgericht - Registergericht - Düsseldorf eingegangen sein.  Dies gilt auch dann, wenn der Widerspruch zur Niederschrift der Geschäftsstelle eines anderen Amtsgerichtes abgegeben wurde. Die Frist beginnt mit dem Tage der Bekanntmachung der Löschungsankündigung in dem für die Bekanntmachung der Eintragungen in das Handelsregister bestimmten elektronischen Informations- und Kommunikationssystem nach § 10 des Handelsgesetzbuches. Fällt das Ende der Frist auf einen Sonntag, einen allgemeinen Feiertag oder Sonnabend, so endet die Frist mit Ablauf des nächsten Werktages.\nDer Widerspruch muss die Bezeichnung der angefochtenen Löschungsankündigung sowie die Erklärung enthalten, dass Widerspruch gegen diese Löschungsankündigung eingelegt wird. Er ist zu unterzeichnen und soll begründet werden."
    },
    {
      "date": "2025-11-11",
      "id": "136990",
      "original_text": "Registerbekanntmachung nach dem Umwandlungsgesetz\nNordrhein-Westfalen Amtsgericht Dortmund HRA 9216\nProgas Gesellschaft mit beschränkter Haftung & Co. Kommanditgesellschaft – Dortmund",
      "type": "Registerbekanntmachung nach dem Umwandlungsgesetz",
      "state": "Nordrhein-Westfalen",
      "amtsgericht": "Amtsgericht Dortmund",
      "registernummer": "HRA 9216",
      "registerart": "HRA",
      "company_name": "Progas Gesellschaft mit beschränkter Haftung & Co. Kommanditgesellschaft",
      "company_seat": "Dortmund",
      "details": "11.11.2025 (Bekanntmachungsdatum)\n\nNordrhein-Westfalen Amtsgericht Dortmund HRA 9216\nRegisterbekanntmachung nach dem Umwandlungsgesetz 04.11.2025 (Eintragungsdatum)\n\nProgas Gesellschaft mit beschränkter Haftung & Co. Kommanditgesellschaft\nKommanditgesellschaft\nDortmund\n\nDen Gläubigern der an der formwechselnden Umwandlung beteiligten Rechtsträger ist, wenn sie binnen sechs Monaten nach dem Tag, an dem die   Eintragung der formwechselnden Umwandlung in das Register des Sitzes desjenigen Rechtsträgers, dessen Gläubiger sie sind, nach § 19 Absatz 3 UmwG als bekanntgemacht gilt, ihren Anspruch nach Grund und Höhe schriftlich anmelden, Sicherheit zu leisten, soweit sie nicht Befriedigung verlangen können. Dieses Recht steht den Gläubigern jedoch nur zu, wenn sie glaubhaft machen, dass durch die formwechselnde Umwandlung die Erfüllung ihrer Forderung gefährdet wird."
    },
    {
      "date": "2025-11-11",
      "id": "136991",
      "original_text": "Löschungsankündigung\nNordrhein-Westfalen Amtsgericht Krefeld HRB 17800\nNewa GmbH – Willich",
      "type": "Löschungsankündigung",
      "state": "Nordrhein-Westfalen",
      "amtsgericht": "Amtsgericht Krefeld",
      "registernummer": "HRB 17800",
      "registerart": "HRB",
      "company_name": "Newa GmbH",
      "company_seat": "Willich",
      "details": "11.11.2025 (Bekanntmachungsdatum)\n\nNordrhein-Westfalen Amtsgericht Krefeld HRB 17800\nLöschungsankündigung\n\nNewa GmbH\nGesellschaft mit beschränkter Haftung\nWillich\n\nDas Registergericht beabsichtigt die Gesellschaft von Amts wegen nach § 394 FamFG zu löschen. Die Frist zur Erhebung eines Widerspruchs ist auf einen Monat festgesetzt."
    },
    {
      "date": "2025-11-11",
      "id": "136992",
      "original_text": "Registerbekanntmachung nach dem Umwandlungsgesetz\nNordrhein-Westfalen Amtsgericht Dortmund HRB 32409\nMerkur Metall GmbH – Dortmund",
      "type": "Registerbekanntmachung nach dem Umwandlungsgesetz",
      "state": "Nordrhein-Westfalen",
      "amtsgericht": "Amtsgericht Dortmund",
      "registernummer": "HRB 32409",
      "registerart": "HRB",
      "company_name": "Merkur Metall GmbH",
      "company_seat": "Dortmund",
      "details": "11.11.2025 (Bekanntmachungsdatum)\n\nNordrhein-Westfalen Amtsgericht Dortmund HRB 32409\nRegisterbekanntmachung nach dem Umwandlungsgesetz 07.11.2025 (Eintragungsdatum)\n\nMerkur Metall GmbH\nGesellschaft mit beschränkter Haftung\nDortmund\n\nDen Gläubigern der an der Verschmelzung beteiligten Rechtsträger ist, wenn sie binnen sechs Monaten nach dem Tag, an dem die Eintragung der Verschmelzung in das Register des Sitzes desjenigen Rechtsträgers, dessen Gläubiger sie sind, nach § 19 Absatz 3 UmwG als bekanntgemacht gilt, ihren Anspruch nach Grund und Höhe schriftlich anmelden, Sicherheit zu leisten, soweit sie nicht Befriedigung verlangen können. Dieses Recht steht den Gläubigern jedoch nur zu, wenn sie glaubhaft machen, dass durch die Verschmelzung die Erfüllung ihrer Forderung gefährdet wird."
    },
    {
      "date": "2025-11-11",
      "id": "136993",
      "original_text": "Löschungsankündigung\nNordrhein-Westfalen Amtsgericht Düsseldorf HRB 86455\nElectroGiant GmbH – Monheim am Rhein",
      "type": "Löschungsankündigung",
      "state": "Nordrhein-Westfalen",
      "amtsgericht": "Amtsgericht Düsseldorf",
      "registernummer": "HRB 86455",
      "registerart": "HRB",
      "company_name": "ElectroGiant GmbH",
      "company_seat": "Monheim am Rhein",
      "details": "11.11.2025 (Bekanntmachungsdatum)\n\nNordrhein-Westfalen Amtsgericht Düsseldorf HRB 86455\nLöschungsankündigung\n\nElectroGiant GmbH\nGesellschaft mit beschränkter Haftung\nMonheim am Rhein\n\nBetr.: ElectroGiant GmbH, Niederstr. 18, 40789 Monheim am Rhein\n\nDas Registergericht beabsichtigt die Gesellschaft von Amts wegen nach § 394 FamFG zu löschen. Die Frist zur Erhebung eines Widerspruchs ist auf 3 Wochen festgesetzt.\n\nRechtsbehelfsbelehrung:\n\nDas Widerspruchsrecht steht jedem zu, der an der Unterlassung der Löschung ein berechtigtes Interesse hat. Der Widerspruch ist bei dem Amtsgericht Düsseldorf -Registergericht-, Werdener Straße 1, 40227 Düsseldorf schriftlich in deutscher Sprache oder zur Niederschrift der Geschäftsstelle einzulegen. Der Widerspruch kann auch zur Niederschrift der Geschäftsstelle eines jeden Amtsgerichtes abgegeben werden. Die Einlegung ist auch durch Übertragung eines elektronischen Dokuments an die elektronische Poststelle des Gerichts möglich. Das elektronische Dokument muss für die Bearbeitung durch das Gericht geeignet und mit einer qualifizierten elektronischen Signatur der verantwortenden Person versehen sein oder von der verantwortenden Person signiert und auf einem sicheren Übermittlungsweg gemäß § 130a ZPO nach näherer Maßgabe der Verordnung über die technischen Rahmenbedingungen des elektronischen Rechtsverkehrs und über das besondere elektronische Behördenpostfach (BGBl. I, S.3803) eingereicht werden. Weitere Informationen erhalten Sie auf der Internetseite www.justiz.de.\nDer Widerspruch muss spätestens innerhalb der gesetzten Frist nach dem Datum der Bekanntmachung der Löschungsankündigung bei dem Amtsgericht - Registergericht - Düsseldorf eingegangen sein.  Dies gilt auch dann, wenn der Widerspruch zur Niederschrift der Geschäftsstelle eines anderen Amtsgerichtes abgegeben wurde. Die Frist beginnt mit dem Tage der Bekanntmachung der Löschungsankündigung in dem für die Bekanntmachung der Eintragungen in das Handelsregister bestimmten elektronischen Informations- und Kommunikationssystem nach § 10 des Handelsgesetzbuches. Fällt das Ende der Frist auf einen Sonntag, einen allgemeinen Feiertag oder Sonnabend, so endet die Frist mit Ablauf des nächsten Werktages.\nDer Widerspruch muss die Bezeichnung der angefochtenen Löschungsankündigung sowie die Erklärung enthalten, dass Widerspruch gegen diese Löschungsankündigung eingelegt wird. Er ist zu unterzeichnen und soll begründet werden."
    },
    {
      "date": "2025-11-11",
      "id": "136994",
      "original_text": "Löschungsankündigung\nNordrhein-Westfalen Amtsgericht Krefeld HRB 19120\nCanege GmbH – Krefeld",
      "type": "Löschungsankündigung",
      "state": "Nordrhein-Westfalen",
      "amtsgericht": "Amtsgericht Krefeld",
      "registernummer": "HRB 19120",
      "registerart": "HRB",
      "company_name": "Canege GmbH",
      "company_seat": "Krefeld",
      "details": "11.11.2025 (Bekanntmachungsdatum)\n\nNordrhein-Westfalen Amtsgericht Krefeld HRB 19120\nLöschungsankündigung\n\nCanege GmbH\nGesellschaft mit beschränkter Haftung\nKrefeld\n\nDas Registergericht beabsichtigt die Gesellschaft von Amts wegen nach § 394 FamFG zu löschen. Die Frist zur Erhebung eines Widerspruchs ist auf einen Monat festgesetzt."
    },
    {
      "date": "2025-11-11",
      "id": "136995",
      "original_text": "Löschungsankündigung\nNordrhein-Westfalen Amtsgericht Dortmund HRB 8806\nH. Brühne Grundstücksgesellschaft Verwaltungs-GmbH. – Dortmund",
      "type": "Löschungsankündigung",
      "state": "Nordrhein-Westfalen",
      "amtsgericht": "Amtsgericht Dortmund",
      "registernummer": "HRB 8806",
      "registerart": "HRB",
      "company_name": "H. Brühne Grundstücksgesellschaft Verwaltungs-GmbH.",
      "company_seat": "Dortmund",
      "details": "11.11.2025 (Bekanntmachungsdatum)\n\nNordrhein-Westfalen Amtsgericht Dortmund HRB 8806\nLöschungsankündigung\n\nH. Brühne Grundstücksgesellschaft Verwaltungs-GmbH.\nGesellschaft mit beschränkter Haftung\nDortmund\n\nDas Registergericht beabsichtigt die Gesellschaft von Amts wegen nach § 394 FamFG zu löschen. Die Frist zur Erhebung eines Widerspruchs ist auf zwei Monate festgesetzt."
    },
    {
      "date": "2025-11-11",
      "id": "136996",
      "original_text": "Löschungsankündigung\nNordrhein-Westfalen Amtsgericht Paderborn HRB 12061\nBTB BioTech Beauty AG – Lichtenau",
      "type": "Löschungsankündigung",
      "state": "Nordrhein-Westfalen",
      "amtsgericht": "Amtsgericht Paderborn",
      "registernummer": "HRB 12061",
      "registerart": "HRB",
      "company_name": "BTB BioTech Beauty AG",
      "company_seat": "Lichtenau",
      "details": "11.11.2025 (Bekanntmachungsdatum)\n\nNordrhein-Westfalen Amtsgericht Paderborn HRB 12061\nLöschungsankündigung\n\nBTB BioTech Beauty AG\nAktiengesellschaft\nLichtenau\n\nHRB 12061-10.11.25-BTB BioTech Beauty AG-Lichtenau\nDas Registergericht beabsichtigt die Gesellschaft von Amts wegen nach § 394 FamFG zu löschen. Die Frist zur Erhebung eines Widerspruchs ist auf einen Monat festgesetzt."
    },
    {
      "date": "2025-11-11",
      "id": "136997",
      "original_text": "Löschungsankündigung\nNordrhein-Westfalen Amtsgericht Düsseldorf HRB 100374\nVII Token GmbH – Düsseldorf",
      "type": "Löschungsankündigung",
      "state": "Nordrhein-Westfalen",
      "amtsgericht": "Amtsgericht Düsseldorf",
      "registernummer": "HRB 100374",
      "registerart": "HRB",
      "company_name": "VII Token GmbH",
      "company_seat": "Düsseldorf",
      "details": "11.11.2025 (Bekanntmachungsdatum)\n\nNordrhein-Westfalen Amtsgericht Düsseldorf HRB 100374\nLöschungsankündigung\n\nVII Token GmbH\nGesellschaft mit beschränkter Haftung\nDüsseldorf\n\nDas Registergericht beabsichtigt die Gesellschaft von Amts wegen nach § 394 FamFG zu löschen. Die Frist zur Erhebung eines Widerspruchs ist auf 3 Wochen festgesetzt.\n\nRechtsbehelfsbelehrung:\nDas Widerspruchsrecht steht jedem zu, der an der Unterlassung der Löschung ein berechtigtes Interesse hat. Der Widerspruch ist bei dem Amtsgericht Düsseldorf -Registergericht-, Werdener Straße 1, 40227 Düsseldorf schriftlich in deutscher Sprache oder zur Niederschrift der Geschäftsstelle einzulegen. Der Widerspruch kann auch zur Niederschrift der Geschäftsstelle eines jeden Amtsgerichtes abgegeben werden. Die Einlegung ist auch durch Übertragung eines elektronischen Dokuments an die elektronische Poststelle des Gerichts möglich. Das elektronische Dokument muss für die Bearbeitung durch das Gericht geeignet und mit einer qualifizierten elektronischen Signatur der verantwortenden Person versehen sein oder von der verantwortenden Person signiert und auf einem sicheren Übermittlungsweg gemäß § 130a ZPO nach näherer Maßgabe der Verordnung über die technischen Rahmenbedingungen des elektronischen Rechtsverkehrs und über das besondere elektronische Behördenpostfach (BGBl. I, S.3803) eingereicht werden. Weitere Informationen erhalten Sie auf der Internetseite www.justiz.de.\nDer Widerspruch muss spätestens innerhalb der gesetzten Frist nach dem Datum der Bekanntmachung der Löschungsankündigung bei dem Amtsgericht - Registergericht - Düsseldorf eingegangen sein.  Dies gilt auch dann, wenn der Widerspruch zur Niederschrift der Geschäftsstelle eines anderen Amtsgerichtes abgegeben wurde. Die Frist beginnt mit dem Tage der Bekanntmachung der Löschungsankündigung in dem für die Bekanntmachung der Eintragungen in das Handelsregister bestimmten elektronischen Informations- und Kommunikationssystem nach § 10 des Handelsgesetzbuches. Fällt das Ende der Frist auf einen Sonntag, einen allgemeinen Feiertag oder Sonnabend, so endet die Frist mit Ablauf des nächsten Werktages.\nDer Widerspruch muss die Bezeichnung der angefochtenen Löschungsankündigung sowie die Erklärung enthalten, dass Widerspruch gegen diese Löschungsankündigung eingelegt wird. Er ist zu unterzeichnen und soll begründet werden."
    },
    {
      "date": "2025-11-11",
      "id": "136998",
      "original_text": "Registerbekanntmachung nach dem Umwandlungsgesetz\nNordrhein-Westfalen Amtsgericht Düsseldorf HRB 110250\nSereni Bestattungen GmbH – Düsseldorf",
      "type": "Registerbekanntmachung nach dem Umwandlungsgesetz",
      "state": "Nordrhein-Westfalen",
      "amtsgericht": "Amtsgericht Düsseldorf",
      "registernummer": "HRB 110250",
      "registerart": "HRB",
      "company_name": "Sereni Bestattungen GmbH",
      "company_seat": "Düsseldorf",
      "details": "11.11.2025 (Bekanntmachungsdatum)\n\nNordrhein-Westfalen Amtsgericht Düsseldorf HRB 110250\nRegisterbekanntmachung nach dem Umwandlungsgesetz 11.11.2025 (Eintragungsdatum)\n\nSereni Bestattungen GmbH\nGesellschaft mit beschränkter Haftung\nDüsseldorf\n\nDen Gläubigern der an der Verschmelzung beteiligten Rechtsträger ist, wenn sie binnen sechs Monaten nach dem Tag, an dem die Eintragung der Verschmelzung in das Register des Sitzes desjenigen Rechtsträgers, dessen Gläubiger sie sind, nach § 19 Absatz 3 UmwG als bekanntgemacht gilt, ihren Anspruch nach Grund und Höhe schriftlich anmelden, Sicherheit zu leisten, soweit sie nicht Befriedigung verlangen können. Dieses Recht steht den Gläubigern jedoch nur zu, wenn sie glaubhaft machen, dass durch die Verschmelzung die Erfüllung ihrer Forderung gefährdet wird."
    },
    {
      "date": "2025-11-11",
      "id": "136999",
      "original_text": "Löschungsankündigung\nNordrhein-Westfalen Amtsgericht Düsseldorf HRB 102059\nIVL-Insolvenzverwertung und Logistik GmbH – Düsseldorf",
      "type": "Löschungsankündigung",
      "state": "Nordrhein-Westfalen",
      "amtsgericht": "Amtsgericht Düsseldorf",
      "registernummer": "HRB 102059",
      "registerart": "HRB",
      "company_name": "IVL-Insolvenzverwertung und Logistik GmbH",
      "company_seat": "Düsseldorf",
      "details": "11.11.2025 (Bekanntmachungsdatum)\n\nNordrhein-Westfalen Amtsgericht Düsseldorf HRB 102059\nLöschungsankündigung\n\nIVL-Insolvenzverwertung und Logistik GmbH\nGesellschaft mit beschränkter Haftung\nDüsseldorf\n\nDas Registergericht beabsichtigt die Gesellschaft von Amts wegen nach § 394 FamFG zu löschen. Die Frist zur Erhebung eines Widerspruchs ist auf 3 Wochen festgesetzt.\n\nRechtsbehelfsbelehrung:\nDas Widerspruchsrecht steht jedem zu, der an der Unterlassung der Löschung ein berechtigtes Interesse hat. Der Widerspruch ist bei dem Amtsgericht Düsseldorf -Registergericht-, Werdener Straße 1, 40227 Düsseldorf schriftlich in deutscher Sprache oder zur Niederschrift der Geschäftsstelle einzulegen. Der Widerspruch kann auch zur Niederschrift der Geschäftsstelle eines jeden Amtsgerichtes abgegeben werden. Die Einlegung ist auch durch Übertragung eines elektronischen Dokuments an die elektronische Poststelle des Gerichts möglich. Das elektronische Dokument muss für die Bearbeitung durch das Gericht geeignet und mit einer qualifizierten elektronischen Signatur der verantwortenden Person versehen sein oder von der verantwortenden Person signiert und auf einem sicheren Übermittlungsweg gemäß § 130a ZPO nach näherer Maßgabe der Verordnung über die technischen Rahmenbedingungen des elektronischen Rechtsverkehrs und über das besondere elektronische Behördenpostfach (BGBl. I, S.3803) eingereicht werden. Weitere Informationen erhalten Sie auf der Internetseite www.justiz.de.\nDer Widerspruch muss spätestens innerhalb der gesetzten Frist nach dem Datum der Bekanntmachung der Löschungsankündigung bei dem Amtsgericht - Registergericht - Düsseldorf eingegangen sein.  Dies gilt auch dann, wenn der Widerspruch zur Niederschrift der Geschäftsstelle eines anderen Amtsgerichtes abgegeben wurde. Die Frist beginnt mit dem Tage der Bekanntmachung der Löschungsankündigung in dem für die Bekanntmachung der Eintragungen in das Handelsregister bestimmten elektronischen Informations- und Kommunikationssystem nach § 10 des Handelsgesetzbuches. Fällt das Ende der Frist auf einen Sonntag, einen allgemeinen Feiertag oder Sonnabend, so endet die Frist mit Ablauf des nächsten Werktages.\nDer Widerspruch muss die Bezeichnung der angefochtenen Löschungsankündigung sowie die Erklärung enthalten, dass Widerspruch gegen diese Löschungsankündigung eingelegt wird. Er ist zu unterzeichnen und soll begründet werden."
    },
    {
      "date": "2025-11-11",
      "id": "137000",
      "original_text": "Löschungsankündigung\nNordrhein-Westfalen Amtsgericht Köln HRB 89068\nJ2K GmbH – Köln",
      "type": "Löschungsankündigung",
      "state": "Nordrhein-Westfalen",
      "amtsgericht": "Amtsgericht Köln",
      "registernummer": "HRB 89068",
      "registerart": "HRB",
      "company_name": "J2K GmbH",
      "company_seat": "Köln",
      "details": "11.11.2025 (Bekanntmachungsdatum)\n\nNordrhein-Westfalen Amtsgericht Köln HRB 89068\nLöschungsankündigung\n\nJ2K GmbH\nGesellschaft mit beschränkter Haftung\nKöln\n\nDas Registergericht beabsichtigt, die im Handelsregister eingetragene Gesellschaft gemäß § 394 Absatz 1 FamFG wegen Vermögenslosigkeit von Amts wegen zu löschen. Gegen diese Verfügung kann Widerspruch eingelegt werden. Die Frist zur Erhebung eines Widerspruchs gegen die beabsichtigte Löschung von Amts wegen ist auf einen Monat festgesetzt. Rechtsbehelfsbelehrung: Gegen diese Verfügung können Sie Widerspruch einlegen. Der Widerspruch ist bei dem Amtsgericht Köln, Reichenspergerplatz 1, 50670 Köln schriftlich in deutscher Sprache oder zur Niederschrift der Geschäftsstelle einzulegen. Der Widerspruch kann auch zur Niederschrift der Geschäftsstelle eines jeden Amtsgerichtes abgegeben werden. Die Einlegung ist auch durch Übertragung eines elektronischen Dokuments an die elektronische Poststelle des Gerichts möglich. Das elektronische Dokument muss für die Bearbeitung durch das Gericht geeignet und mit einer qualifizierten elektronischen Signatur der verantwortenden Person versehen sein oder von der verantwortenden Person signiert und auf einem sicheren Übermittlungsweg gemäß § 130a ZPO nach näherer Maßgabe der Verordnung über die technischen Rahmenbedingungen des elektronischen Rechtsverkehrs und über das besondere elektronische Behördenpostfach (BGBl. I, S.3803) eingereicht werden. Weitere Informationen erhalten Sie auf der Internetseite www.justiz.de.Der Widerspruch muss spätestens innerhalb der gesetzten Frist bei dem Amtsgericht Köln eingegangen sein. Dies gilt auch dann, wenn der Widerspruch zur Niederschrift der Geschäftsstelle eines anderen Amtsgerichtes abgegeben wurde. Die Frist beginnt mit der Veröffentlichung. Fällt das Ende der Frist auf einen Sonntag, einen allgemeinen Feiertag oder Sonnabend, so endet die Frist mit Ablauf des nächsten Werktages.\n\nDer Widerspruch muss die Bezeichnung der angefochtenen Verfügung sowie die Erklärung enthalten, dass Widerspruch gegen diese Verfügung eingelegt wird. Er ist zu unterzeichnen und soll begründet werden."
    },
    {
      "date": "2025-11-11",
      "id": "137001",
      "original_text": "Löschungsankündigung\nNordrhein-Westfalen Amtsgericht Kleve HRB 11036\nBetmar Verwaltungs GmbH – Rheinberg",
      "type": "Löschungsankündigung",
      "state": "Nordrhein-Westfalen",
      "amtsgericht": "Amtsgericht Kleve",
      "registernummer": "HRB 11036",
      "registerart": "HRB",
      "company_name": "Betmar Verwaltungs GmbH",
      "company_seat": "Rheinberg",
      "details": "11.11.2025 (Bekanntmachungsdatum)\n\nNordrhein-Westfalen Amtsgericht Kleve HRB 11036\nLöschungsankündigung\n\nBetmar Verwaltungs GmbH\nGesellschaft mit beschränkter Haftung\nRheinberg\n\nDas Registergericht beabsichtigt die Gesellschaft von Amts wegen nach § 394 FamFG zu löschen. Die Frist zur Erhebung eines Widerspruchs ist auf einen Monat festgesetzt."
    },
    {
      "date": "2025-11-11",
      "id": "137002",
      "original_text": "Registerbekanntmachung nach dem Umwandlungsgesetz\nHessen Amtsgericht Frankfurt am Main HRB 110651\nHydro Italia Management GmbH – Frankfurt am Main",
      "type": "Registerbekanntmachung nach dem Umwandlungsgesetz",
      "state": "Hessen",
      "amtsgericht": "Amtsgericht Frankfurt am Main",
      "registernummer": "HRB 110651",
      "registerart": "HRB",
      "company_name": "Hydro Italia Management GmbH",
      "company_seat": "Frankfurt am Main",
      "details": "11.11.2025 (Bekanntmachungsdatum)\n\nHessen Amtsgericht Frankfurt am Main HRB 110651\nRegisterbekanntmachung nach dem Umwandlungsgesetz 11.11.2025 (Eintragungsdatum)\n\nHydro Italia Management GmbH\nGesellschaft mit beschränkter Haftung\nFrankfurt am Main\n\nDen Gläubigern der an der Verschmelzung beteiligten Rechtsträger ist, wenn sie binnen sechs Monaten nach dem Tag, an dem die Eintragung der Verschmelzung in das Register des Sitzes desjenigen Rechtsträgers, dessen Gläubiger sie sind, nach § 19 Absatz 3 UmwG bekannt gemacht worden ist, ihren Anspruch nach Grund und Höhe schriftlich anmelden, Sicherheit zu leisten, soweit sie nicht Befriedigung verlangen können. Dieses Recht steht den Gläubigern jedoch nur zu, wenn sie glaubhaft machen, dass durch die Verschmelzung die Erfüllung ihrer Forderung gefährdet wird."
    },
    {
      "date": "2025-11-11",
      "id": "137003",
      "original_text": "Registerbekanntmachung nach dem Umwandlungsgesetz\nHessen Amtsgericht Frankfurt am Main HRB 58090\nBurda Worldwide Technologies GmbH – Frankfurt am Main",
      "type": "Registerbekanntmachung nach dem Umwandlungsgesetz",
      "state": "Hessen",
      "amtsgericht": "Amtsgericht Frankfurt am Main",
      "registernummer": "HRB 58090",
      "registerart": "HRB",
      "company_name": "Burda Worldwide Technologies GmbH",
      "company_seat": "Frankfurt am Main",
      "details": "11.11.2025 (Bekanntmachungsdatum)\n\nHessen Amtsgericht Frankfurt am Main HRB 58090\nRegisterbekanntmachung nach dem Umwandlungsgesetz 11.11.2025 (Eintragungsdatum)\n\nBurda Worldwide Technologies GmbH\nGesellschaft mit beschränkter Haftung\nFrankfurt am Main\n\nDen Gläubigern der an der Verschmelzung beteiligten Rechtsträger ist, wenn sie binnen sechs Monaten nach dem Tag, an dem die Eintragung der Verschmelzung in das Register des Sitzes desjenigen Rechtsträgers, dessen Gläubiger sie sind, nach § 19 Absatz 3 UmwG bekannt gemacht worden ist, ihren Anspruch nach Grund und Höhe schriftlich anmelden, Sicherheit zu leisten, soweit sie nicht Befriedigung verlangen können. Dieses Recht steht den Gläubigern jedoch nur zu, wenn sie glaubhaft machen, dass durch die Verschmelzung die Erfüllung ihrer Forderung gefährdet wird."
    },
    {
      "date": "2025-11-11",
      "id": "137004",
      "original_text": "Registerbekanntmachung nach dem Umwandlungsgesetz\nHessen Amtsgericht Offenbach am Main HRA 42882\nCWS Hygiene Deutschland GmbH & Co. KG – Dreieich",
      "type": "Registerbekanntmachung nach dem Umwandlungsgesetz",
      "state": "Hessen",
      "amtsgericht": "Amtsgericht Offenbach am Main",
      "registernummer": "HRA 42882",
      "registerart": "HRA",
      "company_name": "CWS Hygiene Deutschland GmbH & Co. KG",
      "company_seat": "Dreieich",
      "details": "11.11.2025 (Bekanntmachungsdatum)\n\nHessen Amtsgericht Offenbach am Main HRA 42882\nRegisterbekanntmachung nach dem Umwandlungsgesetz 11.11.2025 (Eintragungsdatum)\n\nCWS Hygiene Deutschland GmbH & Co. KG\nKommanditgesellschaft\nDreieich\n\nDen Gläubigern der an der Abspaltung beteiligten Rechtsträger ist, wenn sie binnen sechs Monaten nach dem Tag, an dem die Eintragung der Abspaltung in das Register des Sitzes desjenigen Rechtsträgers, dessen Gläubiger sie sind, nach §§ 125, 19 Absatz 3 UmwG bekannt gemacht worden ist, ihren Anspruch nach Grund und Höhe schriftlich anmelden, Sicherheit zu leisten, soweit sie nicht Befriedigung verlangen können. Dieses Recht steht den Gläubigern jedoch nur zu, wenn sie glaubhaft machen, dass durch die Abspaltung die Erfüllung ihrer Forderung gefährdet wird."
    },
    {
      "date": "2025-11-11",
      "id": "137005",
      "original_text": "Löschungsankündigung\nHessen Amtsgericht Frankfurt am Main HRB 100789\nWaKa-Invest GmbH – Frankfurt am Main",
      "type": "Löschungsankündigung",
      "state": "Hessen",
      "amtsgericht": "Amtsgericht Frankfurt am Main",
      "registernummer": "HRB 100789",
      "registerart": "HRB",
      "company_name": "WaKa-Invest GmbH",
      "company_seat": "Frankfurt am Main",
      "details": "11.11.2025 (Bekanntmachungsdatum)\n\nHessen Amtsgericht Frankfurt am Main HRB 100789\nLöschungsankündigung\n\nWaKa-Invest GmbH\nGesellschaft mit beschränkter Haftung\nFrankfurt am Main\n\nEs ist beabsichtigt, die Gesellschaft wegen Vermögenslosigkeit gemäß § 394 FamFG von Amts wegen im Handelsregister zu löschen. Hiergegen kann innerhalb eines Monats nach dieser Veröffentlichung Widerspruch bei dem Amtsgericht Frankfurt am Main eingelegt werden."
    },
    {
      "date": "2025-11-11",
      "id": "137006",
      "original_text": "Löschungsankündigung\nHessen Amtsgericht Frankfurt am Main HRB 104027\nPROSEZ GmbH – Frankfurt am Main",
      "type": "Löschungsankündigung",
      "state": "Hessen",
      "amtsgericht": "Amtsgericht Frankfurt am Main",
      "registernummer": "HRB 104027",
      "registerart": "HRB",
      "company_name": "PROSEZ GmbH",
      "company_seat": "Frankfurt am Main",
      "details": "11.11.2025 (Bekanntmachungsdatum)\n\nHessen Amtsgericht Frankfurt am Main HRB 104027\nLöschungsankündigung\n\nPROSEZ GmbH\nGesellschaft mit beschränkter Haftung\nFrankfurt am Main\n\nEs ist beabsichtig, die Gesellschaft wegen Vermögenslosigkeit gemäß § 394 FamFG von Amts wegen im Handelsregister zu löschen. Hiergegen kann innerhalb eines Zeitraums von 1 Monat nach dieser Veröffentlichung Widerspruch bei dem Amtsgericht Frankfurt am Main eingelegt werden."
    },
    {
      "date": "2025-11-11",
      "id": "137007",
      "original_text": "Registerbekanntmachung nach dem Umwandlungsgesetz\nHessen Amtsgericht Frankfurt am Main HRA 54315\nMaximilian Scheurich e.K. – Frankfurt am Main",
      "type": "Registerbekanntmachung nach dem Umwandlungsgesetz",
      "state": "Hessen",
      "amtsgericht": "Amtsgericht Frankfurt am Main",
      "registernummer": "HRA 54315",
      "registerart": "HRA",
      "company_name": "Maximilian Scheurich e.K.",
      "company_seat": "Frankfurt am Main",
      "details": "11.11.2025 (Bekanntmachungsdatum)\n\nHessen Amtsgericht Frankfurt am Main HRA 54315\nRegisterbekanntmachung nach dem Umwandlungsgesetz 11.11.2025 (Eintragungsdatum)\n\nMaximilian Scheurich e.K.\nEinzelkaufmann / Einzelkauffrau\nFrankfurt am Main\n\nDen Gläubigern der an der formwechselnden Umwandlung beteiligten Rechtsträger ist, wenn sie binnen sechs Monaten nach dem Tag, an dem die Eintragung der formwechselnden Umwandlung in das Register des Sitzes desjenigen Rechtsträgers, dessen Gläubiger sie sind, nach § 201 UmwG bekannt gemacht worden ist, ihren Anspruch nach Grund und Höhe schriftlich anmelden, Sicherheit zu leisten, soweit sie nicht Befriedigung verlangen können. Dieses Recht steht den Gläubigern jedoch nur zu, wenn sie glaubhaft machen, dass durch die formwechselnden Umwandlung die Erfüllung ihrer Forderung gefährdet wird."
    },
    {
      "date": "2025-11-11",
      "id": "137008",
      "original_text": "Löschungsankündigung\nHessen Amtsgericht Wetzlar HRB 4746\nOmnical Kessel- und Apparatebau GmbH – Dietzhölztal",
      "type": "Löschungsankündigung",
      "state": "Hessen",
      "amtsgericht": "Amtsgericht Wetzlar",
      "registernummer": "HRB 4746",
      "registerart": "HRB",
      "company_name": "Omnical Kessel- und Apparatebau GmbH",
      "company_seat": "Dietzhölztal",
      "details": "11.11.2025 (Bekanntmachungsdatum)\n\nHessen Amtsgericht Wetzlar HRB 4746\nLöschungsankündigung\n\nOmnical Kessel- und Apparatebau GmbH\nGesellschaft mit beschränkter Haftung\nDietzhölztal\n\nDas Registergericht beabsichtigt die im Handelsregister eingetragene Gesellschaft von Amts wegen nach § 394 FamFG zu löschen. Die Frist zur Erhebung eines Widerspruchs gegen die beabsichtigte Löschung wird auf 3 Monate festgesetzt."
    },
    {
      "date": "2025-11-11",
      "id": "137009",
      "original_text": "Registerbekanntmachung nach dem Umwandlungsgesetz\nHessen Amtsgericht Offenbach am Main HRA 43113\nDS VV GmbH & Co. KG – Offenbach am Main",
      "type": "Registerbekanntmachung nach dem Umwandlungsgesetz",
      "state": "Hessen",
      "amtsgericht": "Amtsgericht Offenbach am Main",
      "registernummer": "HRA 43113",
      "registerart": "HRA",
      "company_name": "DS VV GmbH & Co. KG",
      "company_seat": "Offenbach am Main",
      "details": "11.11.2025 (Bekanntmachungsdatum)\n\nHessen Amtsgericht Offenbach am Main HRA 43113\nRegisterbekanntmachung nach dem Umwandlungsgesetz 11.11.2025 (Eintragungsdatum)\n\nDS VV GmbH & Co. KG\nKommanditgesellschaft\nOffenbach am Main\n\nDen Gläubigern der an der Verschmelzung beteiligten Rechtsträger ist, wenn sie binnen sechs Monaten nach dem Tag, an dem die Eintragung der Verschmelzung in das Register des Sitzes desjenigen Rechtsträgers, dessen Gläubiger sie sind, nach § 19 Absatz 3 UmwG bekannt gemacht worden ist, ihren Anspruch nach Grund und Höhe schriftlich anmelden, Sicherheit zu leisten, soweit sie nicht Befriedigung verlangen können. Dieses Recht steht den Gläubigern jedoch nur zu, wenn sie glaubhaft machen, dass durch die Verschmelzung die Erfüllung ihrer Forderung gefährdet wird."
    },
    {
      "date": "2025-11-11",
      "id": "137010",
      "original_text": "Registerbekanntmachung nach dem Umwandlungsgesetz\nHessen Amtsgericht Offenbach am Main HRB 49962\nDS Vermögensverwaltungsgesellschaft mbH – Offenbach am Main",
      "type": "Registerbekanntmachung nach dem Umwandlungsgesetz",
      "state": "Hessen",
      "amtsgericht": "Amtsgericht Offenbach am Main",
      "registernummer": "HRB 49962",
      "registerart": "HRB",
      "company_name": "DS Vermögensverwaltungsgesellschaft mbH",
      "company_seat": "Offenbach am Main",
      "details": "11.11.2025 (Bekanntmachungsdatum)\n\nHessen Amtsgericht Offenbach am Main HRB 49962\nRegisterbekanntmachung nach dem Umwandlungsgesetz 11.11.2025 (Eintragungsdatum)\n\nDS Vermögensverwaltungsgesellschaft mbH\nGesellschaft mit beschränkter Haftung\nOffenbach am Main\n\nDen Gläubigern der an der Verschmelzung beteiligten Rechtsträger ist, wenn sie binnen sechs Monaten nach dem Tag, an dem die Eintragung der Verschmelzung in das Register des Sitzes desjenigen Rechtsträgers, dessen Gläubiger sie sind, nach § 19 Absatz 3 UmwG bekannt gemacht worden ist, ihren Anspruch nach Grund und Höhe schriftlich anmelden, Sicherheit zu leisten, soweit sie nicht Befriedigung verlangen können. Dieses Recht steht den Gläubigern jedoch nur zu, wenn sie glaubhaft machen, dass durch die Verschmelzung die Erfüllung ihrer Forderung gefährdet wird."
    },
    {
      "date": "2025-11-11",
      "id": "137011",
      "original_text": "Sonstige Registerbekanntmachung\nHessen Amtsgericht Wetzlar HRB 2190\nSymbiont International GmbH – Ehringshausen",
      "type": "Sonstige Registerbekanntmachung",
      "state": "Hessen",
      "amtsgericht": "Amtsgericht Wetzlar",
      "registernummer": "HRB 2190",
      "registerart": "HRB",
      "company_name": "Symbiont International GmbH",
      "company_seat": "Ehringshausen",
      "details": "11.11.2025 (Bekanntmachungsdatum)\n\nHessen Amtsgericht Wetzlar HRB 2190\nSonstige Registerbekanntmachung 11.11.2025 (Eintragungsdatum)\n\nSymbiont International GmbH\nGesellschaft mit beschränkter Haftung\nEhringshausen\n\nDen Gläubigern der Gesellschaft, deren Forderungen begründet worden sind, bevor die Eintragung der Beendigung des Vertrags in das Handelsregister nach § 10 HGB bekannt gemacht worden ist, ist vom anderen Vertragsteil Sicherheit zu leisten, wenn sie sich binnen sechs Monaten nach dieser Bekanntmachung zu diesem Zweck bei ihm melden."
    },
    {
      "date": "2025-11-11",
      "id": "137012",
      "original_text": "Registerbekanntmachung nach dem Umwandlungsgesetz\nHessen Amtsgericht Frankfurt am Main HRB 139576\nmx-itsolutions GmbH – Frankfurt am Main",
      "type": "Registerbekanntmachung nach dem Umwandlungsgesetz",
      "state": "Hessen",
      "amtsgericht": "Amtsgericht Frankfurt am Main",
      "registernummer": "HRB 139576",
      "registerart": "HRB",
      "company_name": "mx-itsolutions GmbH",
      "company_seat": "Frankfurt am Main",
      "details": "11.11.2025 (Bekanntmachungsdatum)\n\nHessen Amtsgericht Frankfurt am Main HRB 139576\nRegisterbekanntmachung nach dem Umwandlungsgesetz 11.11.2025 (Eintragungsdatum)\n\nmx-itsolutions GmbH\nGesellschaft mit beschränkter Haftung\nFrankfurt am Main\n\nDen Gläubigern der an der formwechselnden Umwandlung beteiligten Rechtsträger ist, wenn sie binnen sechs Monaten nach dem Tag, an dem die Eintragung der formwechselnden Umwandlung in das Register des Sitzes desjenigen Rechtsträgers, dessen Gläubiger sie sind, nach § 201 UmwG bekannt gemacht worden ist, ihren Anspruch nach Grund und Höhe schriftlich anmelden, Sicherheit zu leisten, soweit sie nicht Befriedigung verlangen können. Dieses Recht steht den Gläubigern jedoch nur zu, wenn sie glaubhaft machen, dass durch die formwechselnden Umwandlung die Erfüllung ihrer Forderung gefährdet wird."
    }
  ]
}