{
  "date": "2025-11-13",
  "date_of_scrape": "2025-11-14T04:12:27.787Z",
  "tool_version": "0.2.0",
  "number_of_announcements": 140,
  "announcements": [
    {
      "date": "2025-11-13",
      "id": "137159",
      "original_text": "Registerbekanntmachung nach dem Umwandlungsgesetz\nBayern Amtsgericht Bamberg HRB 6926\nSchumacher Packaging Verwaltung GmbH – Forchheim",
      "type": "Registerbekanntmachung nach dem Umwandlungsgesetz",
      "state": "Bayern",
      "amtsgericht": "Amtsgericht Bamberg",
      "registernummer": "HRB 6926",
      "registerart": "HRB",
      "company_name": "Schumacher Packaging Verwaltung GmbH",
      "company_seat": "Forchheim",
      "details": "13.11.2025 (Bekanntmachungsdatum)\n\nBayern Amtsgericht Bamberg HRB 6926\nRegisterbekanntmachung nach dem Umwandlungsgesetz 12.11.2025 (Eintragungsdatum)\n\nSchumacher Packaging Verwaltung GmbH\nGesellschaft mit beschränkter Haftung\nForchheim\n\nDen Gläubigern der an der Verschmelzung beteiligten Rechtsträger ist, wenn sie binnen sechs Monaten nach dem Tag, an dem die Eintragung der Verschmelzung in das Register des Sitzes desjenigen Rechtsträgers, dessen Gläubiger sie sind, nach § 19 Abs. 3 UmwG als bekannt gemacht gilt, ihren Anspruch nach Grund und Höhe in Textform anmelden, Sicherheit zu leisten, soweit sie nicht Befriedigung verlangen können. Dieses Recht steht den Gläubigern jedoch nur zu, wenn sie glaubhaft machen, dass durch die Verschmelzung die Erfüllung ihrer Forderung gefährdet wird."
    },
    {
      "date": "2025-11-13",
      "id": "137160",
      "original_text": "Registerbekanntmachung nach dem Umwandlungsgesetz\nBayern Amtsgericht Bamberg HRB 10816\nE-C-W GmbH – Forchheim",
      "type": "Registerbekanntmachung nach dem Umwandlungsgesetz",
      "state": "Bayern",
      "amtsgericht": "Amtsgericht Bamberg",
      "registernummer": "HRB 10816",
      "registerart": "HRB",
      "company_name": "E-C-W GmbH",
      "company_seat": "Forchheim",
      "details": "13.11.2025 (Bekanntmachungsdatum)\n\nBayern Amtsgericht Bamberg HRB 10816\nRegisterbekanntmachung nach dem Umwandlungsgesetz 12.11.2025 (Eintragungsdatum)\n\nE-C-W GmbH\nGesellschaft mit beschränkter Haftung\nForchheim\n\nDen Gläubigern der an der Verschmelzung beteiligten Rechtsträger ist, wenn sie binnen sechs Monaten nach dem Tag, an dem die Eintragung der Verschmelzung in das Register des Sitzes desjenigen Rechtsträgers, dessen Gläubiger sie sind, nach § 19 Abs. 3 UmwG als bekannt gemacht gilt, ihren Anspruch nach Grund und Höhe in Textform anmelden, Sicherheit zu leisten, soweit sie nicht Befriedigung verlangen können. Dieses Recht steht den Gläubigern jedoch nur zu, wenn sie glaubhaft machen, dass durch die Verschmelzung die Erfüllung ihrer Forderung gefährdet wird."
    },
    {
      "date": "2025-11-13",
      "id": "137161",
      "original_text": "Registerbekanntmachung nach dem Umwandlungsgesetz\nBayern Amtsgericht Nürnberg HRA 20402\nSilke Reis e.K. – Wendelstein",
      "type": "Registerbekanntmachung nach dem Umwandlungsgesetz",
      "state": "Bayern",
      "amtsgericht": "Amtsgericht Nürnberg",
      "registernummer": "HRA 20402",
      "registerart": "HRA",
      "company_name": "Silke Reis e.K.",
      "company_seat": "Wendelstein",
      "details": "13.11.2025 (Bekanntmachungsdatum)\n\nBayern Amtsgericht Nürnberg HRA 20402\nRegisterbekanntmachung nach dem Umwandlungsgesetz 12.11.2025 (Eintragungsdatum)\n\nSilke Reis e.K.\nEinzelkaufmann / Einzelkauffrau\nWendelstein\n\nDen Gläubigern #dv.auswahl(Text=\"Bitte zutreffendes auswählen:\",Eingabe=\n\n\"der an der Verschmelzung beteiligten Rechtsträger ist, wenn sie binnen sechs Monaten nach dem Tag, an dem die Eintragung der Verschmelzung in das Register des Sitzes desjenigen Rechtsträgers, dessen Gläubiger sie sind, nach § 19 Abs. 3 UmwG als bekannt gemacht gilt, ihren Anspruch nach Grund und Höhe in Textform anmelden, Sicherheit zu leisten, soweit sie nicht Befriedigung verlangen können. Dieses Recht steht den Gläubigern jedoch nur zu, wenn sie glaubhaft machen, dass durch die Verschmelzung die Erfüllung ihrer Forderung gefährdet wird.\"|\"Verschmelzung\",\n\n\"der an der Spaltung beteiligten Rechtsträger ist, wenn sie binnen sechs Monaten nach dem Tag, an dem die Eintragung der Spaltung in das Register des Sitzes desjenigen Rechtsträgers, dessen Gläubiger sie sind, nach §§ 125, 19 Abs. 3 UmwG als bekannt gemacht gilt, ihren Anspruch nach Grund und Höhe in Textform anmelden, Sicherheit zu leisten, soweit sie nicht Befriedigung verlangen können. Dieses Recht steht den Gläubigern jedoch nur zu, wenn sie glaubhaft machen, dass durch die Spaltung die Erfüllung ihrer Forderung gefährdet wird.\"|\"Spaltung\",\n\n\"des formwechselnden Rechtsträgers ist, wenn sie binnen sechs Monaten nach dem Tag, an dem die Eintragung des Formwechsels nach § 201 UmwG als bekannt gemacht gilt, ihren Anspruch nach Grund und Höhe in Textform anmelden, Sicherheit zu leisten, soweit sie nicht Befriedigung verlangen können. Dieses Recht steht den Gläubigern jedoch nur zu, wenn sie glaubhaft machen, dass durch den Formwechsel die Erfüllung ihrer Forderung gefährdet wird.\"|\"formwechselnde Umwandlung\",\n\n\"der an der Ausgliederung beteiligten Rechtsträger ist, wenn sie binnen sechs Monaten nach dem Tag, an dem die Eintragung der Ausgliederung in das Register des Sitzes desjenigen Rechtsträgers, dessen Gläubiger sie sind, nach §§ 125, 19 Abs. 3 UmwG als bekannt gemacht gilt, ihren Anspruch nach Grund und Höhe in Textform anmelden, Sicherheit zu leisten, soweit sie nicht Befriedigung verlangen können. Dieses Recht steht den Gläubigern jedoch nur zu, wenn sie glaubhaft machen, dass durch die Ausgliederung die Erfüllung ihrer Forderung gefährdet wird.\"|\"Ausgliederung\")"
    },
    {
      "date": "2025-11-13",
      "id": "137162",
      "original_text": "Löschungsankündigung\nBayern Amtsgericht München HRB 146968\nSOANA GmbH – München",
      "type": "Löschungsankündigung",
      "state": "Bayern",
      "amtsgericht": "Amtsgericht München",
      "registernummer": "HRB 146968",
      "registerart": "HRB",
      "company_name": "SOANA GmbH",
      "company_seat": "München",
      "details": "13.11.2025 (Bekanntmachungsdatum)\n\nBayern Amtsgericht München HRB 146968\nLöschungsankündigung\n\nSOANA GmbH\nGesellschaft mit beschränkter Haftung\nMünchen\n\nDas Registergericht beabsichtigt, die im Handelsregister eingetragene Gesellschaft wegen Vermögenslosigkeit von Amts wegen nach § 394 FamFG zu löschen. Die Frist zur Erhebung eines Widerspruchs ist auf drei Monate festgesetzt."
    },
    {
      "date": "2025-11-13",
      "id": "137163",
      "original_text": "Registerbekanntmachung nach dem Umwandlungsgesetz\nBayern Amtsgericht München HRB 269575\nPNZ B21 Beteiligungs UG (haftungsbeschränkt) – München",
      "type": "Registerbekanntmachung nach dem Umwandlungsgesetz",
      "state": "Bayern",
      "amtsgericht": "Amtsgericht München",
      "registernummer": "HRB 269575",
      "registerart": "HRB",
      "company_name": "PNZ B21 Beteiligungs UG (haftungsbeschränkt)",
      "company_seat": "München",
      "details": "13.11.2025 (Bekanntmachungsdatum)\n\nBayern Amtsgericht München HRB 269575\nRegisterbekanntmachung nach dem Umwandlungsgesetz 12.11.2025 (Eintragungsdatum)\n\nPNZ B21 Beteiligungs UG (haftungsbeschränkt)\nGesellschaft mit beschränkter Haftung\nMünchen\n\nDen Gläubigern der an der Verschmelzung beteiligten Rechtsträger ist, wenn sie binnen sechs Monaten nach dem Tag, an dem die Eintragung der Verschmelzung in das Register des Sitzes desjenigen Rechtsträgers, dessen Gläubiger sie sind, nach § 19 Abs. 3 UmwG als bekannt gemacht gilt, ihren Anspruch nach Grund und Höhe in Textform anmelden, Sicherheit zu leisten, soweit sie nicht Befriedigung verlangen können. Dieses Recht steht den Gläubigern jedoch nur zu, wenn sie glaubhaft machen, dass durch die Verschmelzung die Erfüllung ihrer Forderung gefährdet wird."
    },
    {
      "date": "2025-11-13",
      "id": "137164",
      "original_text": "Löschungsankündigung\nBayern Amtsgericht Fürth HRB 15183\nXiXi GmbH – Stein",
      "type": "Löschungsankündigung",
      "state": "Bayern",
      "amtsgericht": "Amtsgericht Fürth",
      "registernummer": "HRB 15183",
      "registerart": "HRB",
      "company_name": "XiXi GmbH",
      "company_seat": "Stein",
      "details": "13.11.2025 (Bekanntmachungsdatum)\n\nBayern Amtsgericht Fürth HRB 15183\nLöschungsankündigung\n\nXiXi GmbH\nGesellschaft mit beschränkter Haftung\nStein\n\nDas Registergericht beabsichtigt, die im Handelsregister eingetragene Gesellschaft wegen Vermögenslosigkeit von Amts wegen nach § 394 FamFG zu löschen. Die Frist zur Erhebung eines Widerspruchs ist auf drei Monate festgesetzt."
    },
    {
      "date": "2025-11-13",
      "id": "137165",
      "original_text": "Löschungsankündigung\nBayern Amtsgericht Deggendorf HRB 5082\nKebapmann GmbH – Hengersberg",
      "type": "Löschungsankündigung",
      "state": "Bayern",
      "amtsgericht": "Amtsgericht Deggendorf",
      "registernummer": "HRB 5082",
      "registerart": "HRB",
      "company_name": "Kebapmann GmbH",
      "company_seat": "Hengersberg",
      "details": "13.11.2025 (Bekanntmachungsdatum)\n\nBayern Amtsgericht Deggendorf HRB 5082\nLöschungsankündigung\n\nKebapmann GmbH\nGesellschaft mit beschränkter Haftung\nHengersberg\n\nDas Registergericht beabsichtigt, die im Handelsregister eingetragene Gesellschaft wegen Vermögenslosigkeit von Amts wegen nach § 394 FamFG zu löschen. Die Frist zur Erhebung eines Widerspruchs ist auf einen Monat festgesetzt."
    },
    {
      "date": "2025-11-13",
      "id": "137166",
      "original_text": "Löschungsankündigung\nBayern Amtsgericht Straubing HRA 2398\nmediform - cz e.K. – Bogen",
      "type": "Löschungsankündigung",
      "state": "Bayern",
      "amtsgericht": "Amtsgericht Straubing",
      "registernummer": "HRA 2398",
      "registerart": "HRA",
      "company_name": "mediform - cz e.K.",
      "company_seat": "Bogen",
      "details": "13.11.2025 (Bekanntmachungsdatum)\n\nBayern Amtsgericht Straubing HRA 2398\nLöschungsankündigung\n\nmediform - cz e.K.\nEinzelkaufmann / Einzelkauffrau\nBogen\n\nDas Registergericht beabsichtigt, die im Handelsregister eingetragene Firma von Amts wegen nach §§ 31 Abs. 2 HGB, 393 FamFG zu löschen. Die Frist zur Erhebung eines Widerspruchs ist auf drei Monate festgesetzt."
    },
    {
      "date": "2025-11-13",
      "id": "137167",
      "original_text": "Löschungsankündigung\nBayern Amtsgericht Augsburg HRB 25409\nMenzinger Stefan UG (haftungsbeschränkt) – Augsburg",
      "type": "Löschungsankündigung",
      "state": "Bayern",
      "amtsgericht": "Amtsgericht Augsburg",
      "registernummer": "HRB 25409",
      "registerart": "HRB",
      "company_name": "Menzinger Stefan UG (haftungsbeschränkt)",
      "company_seat": "Augsburg",
      "details": "13.11.2025 (Bekanntmachungsdatum)\n\nBayern Amtsgericht Augsburg HRB 25409\nLöschungsankündigung\n\nMenzinger Stefan UG (haftungsbeschränkt)\nGesellschaft mit beschränkter Haftung\nAugsburg\n\nDas Registergericht beabsichtigt, die im Handelsregister eingetragene Gesellschaft wegen Vermögenslosigkeit von Amts wegen nach § 394 FamFG zu löschen. Die Frist zur Erhebung eines Widerspruchs ist auf einen Monat festgesetzt."
    },
    {
      "date": "2025-11-13",
      "id": "137168",
      "original_text": "Registerbekanntmachung nach dem Umwandlungsgesetz\nBayern Amtsgericht München HRB 269995\nHCS Beratungs GmbH – München",
      "type": "Registerbekanntmachung nach dem Umwandlungsgesetz",
      "state": "Bayern",
      "amtsgericht": "Amtsgericht München",
      "registernummer": "HRB 269995",
      "registerart": "HRB",
      "company_name": "HCS Beratungs GmbH",
      "company_seat": "München",
      "details": "13.11.2025 (Bekanntmachungsdatum)\n\nBayern Amtsgericht München HRB 269995\nRegisterbekanntmachung nach dem Umwandlungsgesetz 12.11.2025 (Eintragungsdatum)\n\nHCS Beratungs GmbH\nGesellschaft mit beschränkter Haftung\nMünchen\n\nDen Gläubigern der an der Verschmelzung beteiligten Rechtsträger ist, wenn sie binnen sechs Monaten nach dem Tag, an dem die Eintragung der Verschmelzung in das Register des Sitzes desjenigen Rechtsträgers, dessen Gläubiger sie sind, nach § 19 Abs. 3 UmwG als bekannt gemacht gilt, ihren Anspruch nach Grund und Höhe in Textform anmelden, Sicherheit zu leisten, soweit sie nicht Befriedigung verlangen können. Dieses Recht steht den Gläubigern jedoch nur zu, wenn sie glaubhaft machen, dass durch die Verschmelzung die Erfüllung ihrer Forderung gefährdet wird."
    },
    {
      "date": "2025-11-13",
      "id": "137169",
      "original_text": "Löschungsankündigung\nBayern Amtsgericht Traunstein HRB 34250\nWaffenhandel Hôgmoar UG (haftungsbeschränkt) – Reit im Winkl",
      "type": "Löschungsankündigung",
      "state": "Bayern",
      "amtsgericht": "Amtsgericht Traunstein",
      "registernummer": "HRB 34250",
      "registerart": "HRB",
      "company_name": "Waffenhandel Hôgmoar UG (haftungsbeschränkt)",
      "company_seat": "Reit im Winkl",
      "details": "13.11.2025 (Bekanntmachungsdatum)\n\nBayern Amtsgericht Traunstein HRB 34250\nLöschungsankündigung\n\nWaffenhandel Hôgmoar UG (haftungsbeschränkt)\nGesellschaft mit beschränkter Haftung\nReit im Winkl\n\nDas Registergericht beabsichtigt, die im Handelsregister eingetragene Gesellschaft wegen Vermögenslosigkeit von Amts wegen nach § 394 FamFG zu löschen. Die Frist zur Erhebung eines Widerspruchs ist auf einen Monat festgesetzt."
    },
    {
      "date": "2025-11-13",
      "id": "137170",
      "original_text": "Löschungsankündigung\nBayern Amtsgericht Hof HRB 4254\nCONPARTIS GmbH – Höchstädt",
      "type": "Löschungsankündigung",
      "state": "Bayern",
      "amtsgericht": "Amtsgericht Hof",
      "registernummer": "HRB 4254",
      "registerart": "HRB",
      "company_name": "CONPARTIS GmbH",
      "company_seat": "Höchstädt",
      "details": "13.11.2025 (Bekanntmachungsdatum)\n\nBayern Amtsgericht Hof HRB 4254\nLöschungsankündigung\n\nCONPARTIS GmbH\nGesellschaft mit beschränkter Haftung\nHöchstädt\n\nDas Registergericht beabsichtigt, die im Handelsregister eingetragene Geschäftsanschrift \"Fliederstraße 6, 95186 Höchstädt\" der Gesellschaft von Amts wegen nach § 395 FamFG zu löschen. Die Frist zur Erhebung eines Widerspruchs ist auf einen Monat festgesetzt."
    },
    {
      "date": "2025-11-13",
      "id": "137171",
      "original_text": "Löschungsankündigung\nBayern Amtsgericht Traunstein HRB 34249\nMunitionsherstellung Hôgmoar UG (haftungsbeschränkt) – Reit im Winkl",
      "type": "Löschungsankündigung",
      "state": "Bayern",
      "amtsgericht": "Amtsgericht Traunstein",
      "registernummer": "HRB 34249",
      "registerart": "HRB",
      "company_name": "Munitionsherstellung Hôgmoar UG (haftungsbeschränkt)",
      "company_seat": "Reit im Winkl",
      "details": "13.11.2025 (Bekanntmachungsdatum)\n\nBayern Amtsgericht Traunstein HRB 34249\nLöschungsankündigung\n\nMunitionsherstellung Hôgmoar UG (haftungsbeschränkt)\nGesellschaft mit beschränkter Haftung\nReit im Winkl\n\nDas Registergericht beabsichtigt, die im Handelsregister eingetragene Gesellschaft wegen Vermögenslosigkeit von Amts wegen nach § 394 FamFG zu löschen. Die Frist zur Erhebung eines Widerspruchs ist auf einen Monat festgesetzt."
    },
    {
      "date": "2025-11-13",
      "id": "137172",
      "original_text": "Registerbekanntmachung nach dem Umwandlungsgesetz\nBayern Amtsgericht Nürnberg HRB 44798\nisartau GmbH – Wendelstein",
      "type": "Registerbekanntmachung nach dem Umwandlungsgesetz",
      "state": "Bayern",
      "amtsgericht": "Amtsgericht Nürnberg",
      "registernummer": "HRB 44798",
      "registerart": "HRB",
      "company_name": "isartau GmbH",
      "company_seat": "Wendelstein",
      "details": "13.11.2025 (Bekanntmachungsdatum)\n\nBayern Amtsgericht Nürnberg HRB 44798\nRegisterbekanntmachung nach dem Umwandlungsgesetz 12.11.2025 (Eintragungsdatum)\n\nisartau GmbH\nGesellschaft mit beschränkter Haftung\nWendelstein\n\nDen Gläubigern der an der Ausgliederung beteiligten Rechtsträger ist, wenn sie binnen sechs Monaten nach dem Tag, an dem die Eintragung der Ausgliederung in das Register des Sitzes desjenigen Rechtsträgers, dessen Gläubiger sie sind, nach §§ 125, 19 Abs. 3 UmwG als bekannt gemacht gilt, ihren Anspruch nach Grund und Höhe in Textform anmelden, Sicherheit zu leisten, soweit sie nicht Befriedigung verlangen können. Dieses Recht steht den Gläubigern jedoch nur zu, wenn sie glaubhaft machen, dass durch die Ausgliederung die Erfüllung ihrer Forderung gefährdet wird."
    },
    {
      "date": "2025-11-13",
      "id": "137173",
      "original_text": "Löschungsankündigung\nBayern Amtsgericht Landshut HRB 13353\nIoT Technics UG (haftungsbeschränkt) – Simbach a.Inn",
      "type": "Löschungsankündigung",
      "state": "Bayern",
      "amtsgericht": "Amtsgericht Landshut",
      "registernummer": "HRB 13353",
      "registerart": "HRB",
      "company_name": "IoT Technics UG (haftungsbeschränkt)",
      "company_seat": "Simbach a.Inn",
      "details": "13.11.2025 (Bekanntmachungsdatum)\n\nBayern Amtsgericht Landshut HRB 13353\nLöschungsankündigung\n\nIoT Technics UG (haftungsbeschränkt)\nGesellschaft mit beschränkter Haftung\nSimbach a.Inn\n\nDas Registergericht beabsichtigt, die im Handelsregister eingetragene Gesellschaft von Amts wegen nach § 395 FamFG zu löschen. Die Frist zur Erhebung eines Widerspruchs ist auf einen Monat festgesetzt."
    },
    {
      "date": "2025-11-13",
      "id": "137174",
      "original_text": "Löschungsankündigung\nBayern Amtsgericht München HRB 275792\nSDS DE Vierunddreißig Management GmbH – München",
      "type": "Löschungsankündigung",
      "state": "Bayern",
      "amtsgericht": "Amtsgericht München",
      "registernummer": "HRB 275792",
      "registerart": "HRB",
      "company_name": "SDS DE Vierunddreißig Management GmbH",
      "company_seat": "München",
      "details": "13.11.2025 (Bekanntmachungsdatum)\n\nBayern Amtsgericht München HRB 275792\nLöschungsankündigung\n\nSDS DE Vierunddreißig Management GmbH\nGesellschaft mit beschränkter Haftung\nMünchen\n\nDas Registergericht beabsichtigt, die im Handelsregister eingetragene Gesellschaft wegen Vermögenslosigkeit von Amts wegen nach § 394 FamFG zu löschen. Die Frist zur Erhebung eines Widerspruchs ist auf drei Monate festgesetzt."
    },
    {
      "date": "2025-11-13",
      "id": "137175",
      "original_text": "Löschungsankündigung\nBayern Amtsgericht Nürnberg HRB 36049\nFINDIG42 GmbH – Nürnberg",
      "type": "Löschungsankündigung",
      "state": "Bayern",
      "amtsgericht": "Amtsgericht Nürnberg",
      "registernummer": "HRB 36049",
      "registerart": "HRB",
      "company_name": "FINDIG42 GmbH",
      "company_seat": "Nürnberg",
      "details": "13.11.2025 (Bekanntmachungsdatum)\n\nBayern Amtsgericht Nürnberg HRB 36049\nLöschungsankündigung\n\nFINDIG42 GmbH\nGesellschaft mit beschränkter Haftung\nNürnberg\n\nDas Registergericht beabsichtigt, die im Handelsregister eingetragene Gesellschaft wegen Vermögenslosigkeit von Amts wegen nach § 394 FamFG zu löschen. Die Frist zur Erhebung eines Widerspruchs ist auf einen Monat festgesetzt."
    },
    {
      "date": "2025-11-13",
      "id": "137176",
      "original_text": "Registerbekanntmachung nach dem Umwandlungsgesetz\nBayern Amtsgericht Bayreuth HRA 3254\nChristian Bär Bauunternehmung GmbH & Co. KG – Neudrossenfeld",
      "type": "Registerbekanntmachung nach dem Umwandlungsgesetz",
      "state": "Bayern",
      "amtsgericht": "Amtsgericht Bayreuth",
      "registernummer": "HRA 3254",
      "registerart": "HRA",
      "company_name": "Christian Bär Bauunternehmung GmbH & Co. KG",
      "company_seat": "Neudrossenfeld",
      "details": "13.11.2025 (Bekanntmachungsdatum)\n\nBayern Amtsgericht Bayreuth HRA 3254\nRegisterbekanntmachung nach dem Umwandlungsgesetz 12.11.2025 (Eintragungsdatum)\n\nChristian Bär Bauunternehmung GmbH & Co. KG\nKommanditgesellschaft\nNeudrossenfeld\n\nDen Gläubigern der an der Verschmelzung beteiligten Rechtsträger ist, wenn sie binnen sechs Monaten nach dem Tag, an dem die Eintragung der Verschmelzung in das Register des Sitzes desjenigen Rechtsträgers, dessen Gläubiger sie sind, nach § 19 Abs. 3 UmwG als bekannt gemacht gilt, ihren Anspruch nach Grund und Höhe in Textform anmelden, Sicherheit zu leisten, soweit sie nicht Befriedigung verlangen können. Dieses Recht steht den Gläubigern jedoch nur zu, wenn sie glaubhaft machen, dass durch die Verschmelzung die Erfüllung ihrer Forderung gefährdet wird."
    },
    {
      "date": "2025-11-13",
      "id": "137177",
      "original_text": "Löschungsankündigung\nBayern Amtsgericht Augsburg HRB 27636\nConcept Verwaltungs UG (haftungsbeschränkt) – Augsburg",
      "type": "Löschungsankündigung",
      "state": "Bayern",
      "amtsgericht": "Amtsgericht Augsburg",
      "registernummer": "HRB 27636",
      "registerart": "HRB",
      "company_name": "Concept Verwaltungs UG (haftungsbeschränkt)",
      "company_seat": "Augsburg",
      "details": "13.11.2025 (Bekanntmachungsdatum)\n\nBayern Amtsgericht Augsburg HRB 27636\nLöschungsankündigung\n\nConcept Verwaltungs UG (haftungsbeschränkt)\nGesellschaft mit beschränkter Haftung\nAugsburg\n\nDas Registergericht beabsichtigt, die im Handelsregister eingetragene Gesellschaft wegen Vermögenslosigkeit von Amts wegen nach § 394 FamFG zu löschen. Die Frist zur Erhebung eines Widerspruchs ist auf einen Monat festgesetzt."
    },
    {
      "date": "2025-11-13",
      "id": "137178",
      "original_text": "Registerbekanntmachung nach dem Umwandlungsgesetz\nBayern Amtsgericht München HRB 263441\nHypercampus GmbH – München",
      "type": "Registerbekanntmachung nach dem Umwandlungsgesetz",
      "state": "Bayern",
      "amtsgericht": "Amtsgericht München",
      "registernummer": "HRB 263441",
      "registerart": "HRB",
      "company_name": "Hypercampus GmbH",
      "company_seat": "München",
      "details": "13.11.2025 (Bekanntmachungsdatum)\n\nBayern Amtsgericht München HRB 263441\nRegisterbekanntmachung nach dem Umwandlungsgesetz 12.11.2025 (Eintragungsdatum)\n\nHypercampus GmbH\nGesellschaft mit beschränkter Haftung\nMünchen\n\nDen Gläubigern der an der Verschmelzung beteiligten Rechtsträger ist, wenn sie binnen sechs Monaten nach dem Tag, an dem die Eintragung der Verschmelzung in das Register des Sitzes desjenigen Rechtsträgers, dessen Gläubiger sie sind, nach § 19 Abs. 3 UmwG als bekannt gemacht gilt, ihren Anspruch nach Grund und Höhe in Textform anmelden, Sicherheit zu leisten, soweit sie nicht Befriedigung verlangen können. Dieses Recht steht den Gläubigern jedoch nur zu, wenn sie glaubhaft machen, dass durch die Verschmelzung die Erfüllung ihrer Forderung gefährdet wird."
    },
    {
      "date": "2025-11-13",
      "id": "137179",
      "original_text": "Registerbekanntmachung nach dem Umwandlungsgesetz\nBayern Amtsgericht München HRB 299290\nMWS Holding GmbH – München",
      "type": "Registerbekanntmachung nach dem Umwandlungsgesetz",
      "state": "Bayern",
      "amtsgericht": "Amtsgericht München",
      "registernummer": "HRB 299290",
      "registerart": "HRB",
      "company_name": "MWS Holding GmbH",
      "company_seat": "München",
      "details": "13.11.2025 (Bekanntmachungsdatum)\n\nBayern Amtsgericht München HRB 299290\nRegisterbekanntmachung nach dem Umwandlungsgesetz 12.11.2025 (Eintragungsdatum)\n\nMWS Holding GmbH\nGesellschaft mit beschränkter Haftung\nMünchen\n\nDen Gläubigern der an der Verschmelzung beteiligten Rechtsträger ist, wenn sie binnen sechs Monaten nach dem Tag, an dem die Eintragung der Verschmelzung in das Register des Sitzes desjenigen Rechtsträgers, dessen Gläubiger sie sind, nach § 19 Abs. 3 UmwG als bekannt gemacht gilt, ihren Anspruch nach Grund und Höhe in Textform anmelden, Sicherheit zu leisten, soweit sie nicht Befriedigung verlangen können. Dieses Recht steht den Gläubigern jedoch nur zu, wenn sie glaubhaft machen, dass durch die Verschmelzung die Erfüllung ihrer Forderung gefährdet wird."
    },
    {
      "date": "2025-11-13",
      "id": "137180",
      "original_text": "Registerbekanntmachung nach dem Umwandlungsgesetz\nBayern Amtsgericht Bamberg HRB 11980\nMondi Forchheim GmbH – Forchheim",
      "type": "Registerbekanntmachung nach dem Umwandlungsgesetz",
      "state": "Bayern",
      "amtsgericht": "Amtsgericht Bamberg",
      "registernummer": "HRB 11980",
      "registerart": "HRB",
      "company_name": "Mondi Forchheim GmbH",
      "company_seat": "Forchheim",
      "details": "13.11.2025 (Bekanntmachungsdatum)\n\nBayern Amtsgericht Bamberg HRB 11980\nRegisterbekanntmachung nach dem Umwandlungsgesetz 12.11.2025 (Eintragungsdatum)\n\nMondi Forchheim GmbH\nGesellschaft mit beschränkter Haftung\nForchheim\n\nDen Gläubigern der an der Verschmelzung beteiligten Rechtsträger ist, wenn sie binnen sechs Monaten nach dem Tag, an dem die Eintragung der Verschmelzung in das Register des Sitzes desjenigen Rechtsträgers, dessen Gläubiger sie sind, nach § 19 Abs. 3 UmwG als bekannt gemacht gilt, ihren Anspruch nach Grund und Höhe in Textform anmelden, Sicherheit zu leisten, soweit sie nicht Befriedigung verlangen können. Dieses Recht steht den Gläubigern jedoch nur zu, wenn sie glaubhaft machen, dass durch die Verschmelzung die Erfüllung ihrer Forderung gefährdet wird."
    },
    {
      "date": "2025-11-13",
      "id": "137181",
      "original_text": "Löschungsankündigung\nBayern Amtsgericht Traunstein HRB 34238\nWaffenherstellung Hôgmoar UG (haftungsbeschränkt) – Reit im Winkl",
      "type": "Löschungsankündigung",
      "state": "Bayern",
      "amtsgericht": "Amtsgericht Traunstein",
      "registernummer": "HRB 34238",
      "registerart": "HRB",
      "company_name": "Waffenherstellung Hôgmoar UG (haftungsbeschränkt)",
      "company_seat": "Reit im Winkl",
      "details": "13.11.2025 (Bekanntmachungsdatum)\n\nBayern Amtsgericht Traunstein HRB 34238\nLöschungsankündigung\n\nWaffenherstellung Hôgmoar UG (haftungsbeschränkt)\nGesellschaft mit beschränkter Haftung\nReit im Winkl\n\nDas Registergericht beabsichtigt, die im Handelsregister eingetragene Gesellschaft wegen Vermögenslosigkeit von Amts wegen nach § 394 FamFG zu löschen. Die Frist zur Erhebung eines Widerspruchs ist auf einen Monat festgesetzt."
    },
    {
      "date": "2025-11-13",
      "id": "137182",
      "original_text": "Einreichung neuer Dokumente\nBayern Amtsgericht München HRB 4834\nBavaria Film GmbH – München",
      "type": "Einreichung neuer Dokumente",
      "state": "Bayern",
      "amtsgericht": "Amtsgericht München",
      "registernummer": "HRB 4834",
      "registerart": "HRB",
      "company_name": "Bavaria Film GmbH",
      "company_seat": "München",
      "details": "13.11.2025 (Bekanntmachungsdatum)\n\nBayern Amtsgericht München HRB 4834\nEinreichung neuer Dokumente\n\nBavaria Film GmbH\nGesellschaft mit beschränkter Haftung\nMünchen\n\nDem Amtsgericht München -Registergericht- ist eine Liste der Mitglieder des Aufsichtsrats eingereicht worden, § 52 Abs. 3 S. 2 GmbHG."
    },
    {
      "date": "2025-11-13",
      "id": "137183",
      "original_text": "Löschungsankündigung\nBayern Amtsgericht Augsburg HRB 28546\nPension-Invest GmbH – Augsburg",
      "type": "Löschungsankündigung",
      "state": "Bayern",
      "amtsgericht": "Amtsgericht Augsburg",
      "registernummer": "HRB 28546",
      "registerart": "HRB",
      "company_name": "Pension-Invest GmbH",
      "company_seat": "Augsburg",
      "details": "13.11.2025 (Bekanntmachungsdatum)\n\nBayern Amtsgericht Augsburg HRB 28546\nLöschungsankündigung 12.11.2025 (Eintragungsdatum)\n\nPension-Invest GmbH\nGesellschaft mit beschränkter Haftung\nAugsburg"
    },
    {
      "date": "2025-11-13",
      "id": "137184",
      "original_text": "Einreichung neuer Dokumente\nBayern Amtsgericht München HRB 236240\nMoravia Capital Investments AG – München",
      "type": "Einreichung neuer Dokumente",
      "state": "Bayern",
      "amtsgericht": "Amtsgericht München",
      "registernummer": "HRB 236240",
      "registerart": "HRB",
      "company_name": "Moravia Capital Investments AG",
      "company_seat": "München",
      "details": "13.11.2025 (Bekanntmachungsdatum)\n\nBayern Amtsgericht München HRB 236240\nEinreichung neuer Dokumente\n\nMoravia Capital Investments AG\nAktiengesellschaft\nMünchen\n\nDem Amtsgericht München -Registergericht- ist eine Liste der Mitglieder des Aufsichtsrats eingereicht worden, § 106 AktG."
    },
    {
      "date": "2025-11-13",
      "id": "137185",
      "original_text": "Registerbekanntmachung nach dem Umwandlungsgesetz\nBayern Amtsgericht Fürth HRA 9303\nHeid Metallveredelung GmbH & Co. KG – Zirndorf",
      "type": "Registerbekanntmachung nach dem Umwandlungsgesetz",
      "state": "Bayern",
      "amtsgericht": "Amtsgericht Fürth",
      "registernummer": "HRA 9303",
      "registerart": "HRA",
      "company_name": "Heid Metallveredelung GmbH & Co. KG",
      "company_seat": "Zirndorf",
      "details": "13.11.2025 (Bekanntmachungsdatum)\n\nBayern Amtsgericht Fürth HRA 9303\nRegisterbekanntmachung nach dem Umwandlungsgesetz 12.11.2025 (Eintragungsdatum)\n\nHeid Metallveredelung GmbH & Co. KG\nKommanditgesellschaft\nZirndorf\n\nDen Gläubigern des formwechselnden Rechtsträgers ist, wenn sie binnen sechs Monaten nach dem Tag, an dem die Eintragung des Formwechsels nach § 201 UmwG als bekannt gemacht gilt, ihren Anspruch nach Grund und Höhe in Textform anmelden, Sicherheit zu leisten, soweit sie nicht Befriedigung verlangen können. Dieses Recht steht den Gläubigern jedoch nur zu, wenn sie glaubhaft machen, dass durch den Formwechsel die Erfüllung ihrer Forderung gefährdet wird."
    },
    {
      "date": "2025-11-13",
      "id": "137186",
      "original_text": "Einreichung neuer Dokumente\nBayern Amtsgericht Kempten (Allgäu) HRB 1024\nSOZIAL-WIRTSCHAFTS-WERK des Landkreises Oberallgäu Wohnungsbau-Gesellschaft mit beschränkter Haftung – Sonthofen",
      "type": "Einreichung neuer Dokumente",
      "state": "Bayern",
      "amtsgericht": "Amtsgericht Kempten (Allgäu)",
      "registernummer": "HRB 1024",
      "registerart": "HRB",
      "company_name": "SOZIAL-WIRTSCHAFTS-WERK des Landkreises Oberallgäu Wohnungsbau-Gesellschaft mit beschränkter Haftung",
      "company_seat": "Sonthofen",
      "details": "13.11.2025 (Bekanntmachungsdatum)\n\nBayern Amtsgericht Kempten (Allgäu) HRB 1024\nEinreichung neuer Dokumente 12.11.2025 (Eintragungsdatum)\n\nSOZIAL-WIRTSCHAFTS-WERK des Landkreises Oberallgäu Wohnungsbau-Gesellschaft mit beschränkter Haftung\nGesellschaft mit beschränkter Haftung\nSonthofen\n\nDem Amtsgericht Kempten (Allgäu) -Registergericht- ist eine Liste der Mitglieder des Aufsichtsrats eingereicht worden, § 52 Abs. 3 S. 2 GmbHG."
    },
    {
      "date": "2025-11-13",
      "id": "137187",
      "original_text": "Löschungsankündigung\nBayern Amtsgericht München HRB 231647\nUnited Women GmbH – München",
      "type": "Löschungsankündigung",
      "state": "Bayern",
      "amtsgericht": "Amtsgericht München",
      "registernummer": "HRB 231647",
      "registerart": "HRB",
      "company_name": "United Women GmbH",
      "company_seat": "München",
      "details": "13.11.2025 (Bekanntmachungsdatum)\n\nBayern Amtsgericht München HRB 231647\nLöschungsankündigung 12.11.2025 (Eintragungsdatum)\n\nUnited Women GmbH\nGesellschaft mit beschränkter Haftung\nMünchen\n\nDas Registergericht beabsichtigt, die im Handelsregister eingetragene Gesellschaft wegen Vermögenslosigkeit von Amts wegen nach § 394 FamFG zu löschen. Die Frist zur Erhebung eines Widerspruchs ist auf drei Monate festgesetzt."
    },
    {
      "date": "2025-11-13",
      "id": "137188",
      "original_text": "Löschungsankündigung\nBayern Amtsgericht München HRB 275676\nGlobal1 Representations UG (haftungsbeschränkt) – München",
      "type": "Löschungsankündigung",
      "state": "Bayern",
      "amtsgericht": "Amtsgericht München",
      "registernummer": "HRB 275676",
      "registerart": "HRB",
      "company_name": "Global1 Representations UG (haftungsbeschränkt)",
      "company_seat": "München",
      "details": "13.11.2025 (Bekanntmachungsdatum)\n\nBayern Amtsgericht München HRB 275676\nLöschungsankündigung\n\nGlobal1 Representations UG (haftungsbeschränkt)\nGesellschaft mit beschränkter Haftung\nMünchen\n\nDas Registergericht beabsichtigt, die im Handelsregister eingetragene Gesellschaft wegen Vermögenslosigkeit von Amts wegen nach § 394 FamFG zu löschen. Die Frist zur Erhebung eines Widerspruchs ist auf drei Monate festgesetzt."
    },
    {
      "date": "2025-11-13",
      "id": "137189",
      "original_text": "Löschungsankündigung\nSaarland Amtsgericht Saarbrücken HRB 106652\nAltin Gebäudeservice UG (haftungsbeschränkt) – Völklingen",
      "type": "Löschungsankündigung",
      "state": "Saarland",
      "amtsgericht": "Amtsgericht Saarbrücken",
      "registernummer": "HRB 106652",
      "registerart": "HRB",
      "company_name": "Altin Gebäudeservice UG (haftungsbeschränkt)",
      "company_seat": "Völklingen",
      "details": "13.11.2025 (Bekanntmachungsdatum)\n\nSaarland Amtsgericht Saarbrücken HRB 106652\nLöschungsankündigung\n\nAltin Gebäudeservice UG (haftungsbeschränkt)\nGesellschaft mit beschränkter Haftung\nVölklingen\n\nEs ist beabsichtigt, die Gesellschaft von Amts wegen gemäß § 394 FamFG wegen Vermögenslosigkeit zu löschen.\nGegen die Löschung von Amts wegen ist das Rechtsmittel des Widerspruchs statthaft. Der Widerspruch ist binnen einer Frist zwei Monaten beginnend mit dem Tag dieser Veröffentlichung durch Einreichen eines Widerspruchsschreibens -schriftlich oder zur Niederschrift der Geschäftsstelle beim Amtsgericht Saarbrücken, -zentrales Handelsregister-, Mainzerstr.178, 66121 Saarbrücken einzulegen.\nDer Widerspruch muss die Bezeichnung der angefochtenen Löschungsankündigung enthalten sowie die Erklärung, dass Widerspruch eingelegt wird. Er ist vom Widerspruchsführer oder seinem Bevollmächtigten zu unterzeichnen.\nDas Widerspruchsschreiben kann auch in der Form eines elektronischen Dokumentes eingereicht werden, das mit einer qualifizierten elektronischen Signatur nach dem Signaturgesetz versehen sein muss (§§ 14 Abs. 2 FamFG, 130a, 298 ZPO)."
    },
    {
      "date": "2025-11-13",
      "id": "137190",
      "original_text": "Registerbekanntmachung nach dem Umwandlungsgesetz\nBaden-Württemberg Amtsgericht Stuttgart HRB 783831\nAUDERE Mobile Solutions GmbH – Fellbach",
      "type": "Registerbekanntmachung nach dem Umwandlungsgesetz",
      "state": "Baden-Württemberg",
      "amtsgericht": "Amtsgericht Stuttgart",
      "registernummer": "HRB 783831",
      "registerart": "HRB",
      "company_name": "AUDERE Mobile Solutions GmbH",
      "company_seat": "Fellbach",
      "details": "13.11.2025 (Bekanntmachungsdatum)\n\nBaden-Württemberg Amtsgericht Stuttgart HRB 783831\nRegisterbekanntmachung nach dem Umwandlungsgesetz 13.11.2025 (Eintragungsdatum)\n\nAUDERE Mobile Solutions GmbH\nGesellschaft mit beschränkter Haftung\nFellbach\n\nDen Gläubigern der an der Verschmelzung beteiligten Rechtsträger ist, wenn sie binnen sechs Monaten nach dem Tag, an dem die Eintragung der Verschmelzung in das Register des Sitzes desjenigen Rechtsträgers, dessen Gläubiger sie sind, nach § 19 Abs. 3 UmwG als bekanntgemacht gilt, ihren Anspruch nach Grund und Höhe schriftlich anmelden, Sicherheit zu leisten, soweit sie nicht Befriedigung verlangen können. Dieses Recht steht den Gläubigern jedoch nur zu, wenn sie glaubhaft machen, dass durch die Verschmelzung die Erfüllung ihrer Forderung gefährdet wird."
    },
    {
      "date": "2025-11-13",
      "id": "137191",
      "original_text": "Registerbekanntmachung nach dem Umwandlungsgesetz\nBerlin Amtsgericht Berlin (Charlottenburg) HRB 124529\nReal Zw-Ho Rh-Of GmbH – Berlin",
      "type": "Registerbekanntmachung nach dem Umwandlungsgesetz",
      "state": "Berlin",
      "amtsgericht": "Amtsgericht Berlin (Charlottenburg)",
      "registernummer": "HRB 124529",
      "registerart": "HRB",
      "company_name": "Real Zw-Ho Rh-Of GmbH",
      "company_seat": "Berlin",
      "details": "13.11.2025 (Bekanntmachungsdatum)\n\nBerlin Amtsgericht Berlin (Charlottenburg) HRB 124529\nRegisterbekanntmachung nach dem Umwandlungsgesetz 12.11.2025 (Eintragungsdatum)\n\nReal Zw-Ho Rh-Of GmbH\nGesellschaft mit beschränkter Haftung\nBerlin\n\nZu Eintragungsnummer 5 vom 12.11.2025 wird als nicht eingetragen veröffentlicht: Den Gläubigern der an der Verschmelzung beteiligten Rechtsträger ist, wenn sie binnen sechs Monaten nach dem Tag, an dem die Eintragung der Verschmelzung in das Register des Sitzes desjenigen Rechtsträgers, dessen Gläubiger sie sind, als bekannt gemacht gilt, ihren Anspruch nach Grund und Höhe schriftlich anmelden, Sicherheit zu leisten, soweit sie nicht Befriedigung verlangen können. Dieses Recht steht den Gläubigern jedoch nur zu, wenn sie glaubhaft machen, dass durch die Verschmelzung die Erfüllung ihrer Forderung gefährdet wird. Das Recht, Sicherheitsleistung zu verlangen, steht Gläubigern nicht zu, die im Falle der Insolvenz ein Recht auf vorzugsweise Befriedigung aus einer Deckungsmasse haben, die nach gesetzlicher Vorschrift zu ihrem Schutz errichtet und staatlich überwacht ist."
    },
    {
      "date": "2025-11-13",
      "id": "137192",
      "original_text": "Registerbekanntmachung nach dem Umwandlungsgesetz\nBerlin Amtsgericht Berlin (Charlottenburg) HRA 64016\nD&A Ukry UG (haftungsbeschränkt) & Co. KG – Berlin",
      "type": "Registerbekanntmachung nach dem Umwandlungsgesetz",
      "state": "Berlin",
      "amtsgericht": "Amtsgericht Berlin (Charlottenburg)",
      "registernummer": "HRA 64016",
      "registerart": "HRA",
      "company_name": "D&A Ukry UG (haftungsbeschränkt) & Co. KG",
      "company_seat": "Berlin",
      "details": "13.11.2025 (Bekanntmachungsdatum)\n\nBerlin Amtsgericht Berlin (Charlottenburg) HRA 64016\nRegisterbekanntmachung nach dem Umwandlungsgesetz 12.11.2025 (Eintragungsdatum)\n\nD&A Ukry UG (haftungsbeschränkt) & Co. KG\nKommanditgesellschaft\nBerlin\n\nZu Eintragungsnummer 4 vom 12.11.2025 wird als nicht eingetragen veröffentlicht: Den Gläubigern der an der Verschmelzung beteiligten Rechtsträger ist, wenn sie binnen sechs Monaten nach dem Tag, an dem die Eintragung der Verschmelzung in das Register des Sitzes desjenigen Rechtsträgers, dessen Gläubiger sie sind, als bekannt gemacht gilt, ihren Anspruch nach Grund und Höhe schriftlich anmelden, Sicherheit zu leisten, soweit sie nicht Befriedigung verlangen können. Dieses Recht steht den Gläubigern jedoch nur zu, wenn sie glaubhaft machen, dass durch die Verschmelzung die Erfüllung ihrer Forderung gefährdet wird. Das Recht, Sicherheitsleistung zu verlangen, steht Gläubigern nicht zu, die im Falle der Insolvenz ein Recht auf vorzugsweise Befriedigung aus einer Deckungsmasse haben, die nach gesetzlicher Vorschrift zu ihrem Schutz errichtet und staatlich überwacht ist."
    },
    {
      "date": "2025-11-13",
      "id": "137193",
      "original_text": "Löschungsankündigung\nBrandenburg Amtsgericht Potsdam HRB 40159\nIZ12 Building Management Facility GmbH – Ludwigsfelde",
      "type": "Löschungsankündigung",
      "state": "Brandenburg",
      "amtsgericht": "Amtsgericht Potsdam",
      "registernummer": "HRB 40159",
      "registerart": "HRB",
      "company_name": "IZ12 Building Management Facility GmbH",
      "company_seat": "Ludwigsfelde",
      "details": "13.11.2025 (Bekanntmachungsdatum)\n\nBrandenburg Amtsgericht Potsdam HRB 40159\nLöschungsankündigung\n\nIZ12 Building Management Facility GmbH\nGesellschaft mit beschränkter Haftung\nLudwigsfelde\n\nBei der nachstehenden Gesellschaft wird das Amtslöschungsverfahren gemäß § 394 FamFG eingeleitet. Widerspruchsfrist 8 Wochen."
    },
    {
      "date": "2025-11-13",
      "id": "137194",
      "original_text": "Einreichung neuer Dokumente\nBaden-Württemberg Amtsgericht Mannheim HRB 700766\nART Holding GmbH – Hockenheim",
      "type": "Einreichung neuer Dokumente",
      "state": "Baden-Württemberg",
      "amtsgericht": "Amtsgericht Mannheim",
      "registernummer": "HRB 700766",
      "registerart": "HRB",
      "company_name": "ART Holding GmbH",
      "company_seat": "Hockenheim",
      "details": "13.11.2025 (Bekanntmachungsdatum)\n\nBaden-Württemberg Amtsgericht Mannheim HRB 700766\nEinreichung neuer Dokumente 13.11.2025 (Eintragungsdatum)\n\nART Holding GmbH\nGesellschaft mit beschränkter Haftung\nHockenheim\n\nDie Gesellschaft hat am 23.10.2025 die Liste über die Zusammensetzung des Aufsichtsrats zum Handelsregister eingereicht."
    },
    {
      "date": "2025-11-13",
      "id": "137195",
      "original_text": "Registerbekanntmachung nach dem Umwandlungsgesetz\nBaden-Württemberg Amtsgericht Mannheim HRB 750563\nSYZ Property Invest GmbH – Mannheim",
      "type": "Registerbekanntmachung nach dem Umwandlungsgesetz",
      "state": "Baden-Württemberg",
      "amtsgericht": "Amtsgericht Mannheim",
      "registernummer": "HRB 750563",
      "registerart": "HRB",
      "company_name": "SYZ Property Invest GmbH",
      "company_seat": "Mannheim",
      "details": "13.11.2025 (Bekanntmachungsdatum)\n\nBaden-Württemberg Amtsgericht Mannheim HRB 750563\nRegisterbekanntmachung nach dem Umwandlungsgesetz 13.11.2025 (Eintragungsdatum)\n\nSYZ Property Invest GmbH\nGesellschaft mit beschränkter Haftung\nMannheim\n\nAls nicht eingetragen wird bekanntgemacht:\nDen Gläubigern der an der Verschmelzung beteiligten Rechtsträger ist, wenn sie binnen sechs Monaten nach dem Tag, an dem die Eintragung der Verschmelzung in das Register des Sitzes desjenigen Rechtsträgers, dessen Gläubiger sie sind, nach § 19 Abs. 3 UmwG als bekanntgemacht gilt, ihren Anspruch nach Grund und Höhe schriftlich anmelden, Sicherheit zu leisten, soweit sie nicht Befriedigung verlangen können. Dieses Recht steht den Gläubigern jedoch nur zu, wenn sie glaubhaft machen, dass durch die Verschmelzung die Erfüllung ihrer Forderung gefährdet wird."
    },
    {
      "date": "2025-11-13",
      "id": "137196",
      "original_text": "Registerbekanntmachung nach dem Umwandlungsgesetz\nHamburg Amtsgericht Hamburg HRB 90693\nBÖAG Projektbeteiligungs GmbH – Hamburg",
      "type": "Registerbekanntmachung nach dem Umwandlungsgesetz",
      "state": "Hamburg",
      "amtsgericht": "Amtsgericht Hamburg",
      "registernummer": "HRB 90693",
      "registerart": "HRB",
      "company_name": "BÖAG Projektbeteiligungs GmbH",
      "company_seat": "Hamburg",
      "details": "13.11.2025 (Bekanntmachungsdatum)\n\nHamburg Amtsgericht Hamburg HRB 90693\nRegisterbekanntmachung nach dem Umwandlungsgesetz 13.11.2025 (Eintragungsdatum)\n\nBÖAG Projektbeteiligungs GmbH\nGesellschaft mit beschränkter Haftung\nHamburg\n\nAls nicht eingetragen wird bekannt gemacht:\nDen Gläubigern der an der Verschmelzung beteiligten Gesellschaften ist, wenn sie binnen sechs Monaten nach dem Tag, an dem die Eintragung der Verschmelzung in das Register des Sitzes desjenigen Rechtsträgers, dessen Gläubiger sie sind, nach § 19 Absatz 3 UmwG als bekannt gemacht gilt, ihren Anspruch nach Grund und Höhe schriftlich anmelden, Sicherheit zu leisten, soweit sie nicht Befriedigung verlangen können. Dieses Recht steht den Gläubigern jedoch nur zu, wenn sie glaubhaft machen, dass durch die Verschmelzung die Erfüllung ihrer Forderung gefährdet wird."
    },
    {
      "date": "2025-11-13",
      "id": "137197",
      "original_text": "Registerbekanntmachung nach dem Umwandlungsgesetz\nHamburg Amtsgericht Hamburg HRB 113789\nBöCo Beteiligungs GmbH – Hamburg",
      "type": "Registerbekanntmachung nach dem Umwandlungsgesetz",
      "state": "Hamburg",
      "amtsgericht": "Amtsgericht Hamburg",
      "registernummer": "HRB 113789",
      "registerart": "HRB",
      "company_name": "BöCo Beteiligungs GmbH",
      "company_seat": "Hamburg",
      "details": "13.11.2025 (Bekanntmachungsdatum)\n\nHamburg Amtsgericht Hamburg HRB 113789\nRegisterbekanntmachung nach dem Umwandlungsgesetz 13.11.2025 (Eintragungsdatum)\n\nBöCo Beteiligungs GmbH\nGesellschaft mit beschränkter Haftung\nHamburg\n\nAls nicht eingetragen wird bekannt gemacht:\nDen Gläubigern der an der Verschmelzung beteiligten Gesellschaften ist, wenn sie binnen sechs Monaten nach dem Tag, an dem die Eintragung der Verschmelzung in das Register des Sitzes desjenigen Rechtsträgers, dessen Gläubiger sie sind, nach § 19 Absatz 3 UmwG als bekannt gemacht gilt, ihren Anspruch nach Grund und Höhe schriftlich anmelden, Sicherheit zu leisten, soweit sie nicht Befriedigung verlangen können. Dieses Recht steht den Gläubigern jedoch nur zu, wenn sie glaubhaft machen, dass durch die Verschmelzung die Erfüllung ihrer Forderung gefährdet wird."
    },
    {
      "date": "2025-11-13",
      "id": "137198",
      "original_text": "Registerbekanntmachung nach dem Umwandlungsgesetz\nSachsen-Anhalt Amtsgericht Stendal HRA 8272\nIgepa Großhandel GmbH & Co. KG – Landsberg",
      "type": "Registerbekanntmachung nach dem Umwandlungsgesetz",
      "state": "Sachsen-Anhalt",
      "amtsgericht": "Amtsgericht Stendal",
      "registernummer": "HRA 8272",
      "registerart": "HRA",
      "company_name": "Igepa Großhandel GmbH & Co. KG",
      "company_seat": "Landsberg",
      "details": "13.11.2025 (Bekanntmachungsdatum)\n\nSachsen-Anhalt Amtsgericht Stendal HRA 8272\nRegisterbekanntmachung nach dem Umwandlungsgesetz 13.11.2025 (Eintragungsdatum)\n\nIgepa Großhandel GmbH & Co. KG\nKommanditgesellschaft\nLandsberg\n\nNicht eingetragen:\nDen Gläubigern der an der Ausgliederung beteiligten Rechtsträger, ist wenn sie binnen sechs Monaten nach dem Tag, an dem die Eintragung der Ausgliederung nach §§125, 19 Abs. 3 UmwG als bekanntgemacht gilt, ihren Anspruch nach Grund und Höhe schriftlich anmelden, Sicherheit zu leisten, soweit sie nicht Befriedigung verlangen können. Diese Recht steht ihnen jedoch nur zu, wenn sie glaubhaft machen, dass durch die Ausgliederung die Erfüllung ihrer Forderung gefährdet wird."
    },
    {
      "date": "2025-11-13",
      "id": "137199",
      "original_text": "Registerbekanntmachung nach dem Umwandlungsgesetz\nSachsen-Anhalt Amtsgericht Stendal HRB 207855\nIgepa Großhandel Beteiligungsgesellschaft mbH – Landsberg",
      "type": "Registerbekanntmachung nach dem Umwandlungsgesetz",
      "state": "Sachsen-Anhalt",
      "amtsgericht": "Amtsgericht Stendal",
      "registernummer": "HRB 207855",
      "registerart": "HRB",
      "company_name": "Igepa Großhandel Beteiligungsgesellschaft mbH",
      "company_seat": "Landsberg",
      "details": "13.11.2025 (Bekanntmachungsdatum)\n\nSachsen-Anhalt Amtsgericht Stendal HRB 207855\nRegisterbekanntmachung nach dem Umwandlungsgesetz 13.11.2025 (Eintragungsdatum)\n\nIgepa Großhandel Beteiligungsgesellschaft mbH\nGesellschaft mit beschränkter Haftung\nLandsberg\n\nNicht eingetragen:\nDen Gläubigern der an der Ausgliederung beteiligten Rechtsträger, ist wenn sie binnen sechs Monaten nach dem Tag, an dem die Eintragung der Ausgliederung nach §§125, 19 Abs. 3 UmwG als bekanntgemacht gilt, ihren Anspruch nach Grund und Höhe schriftlich anmelden, Sicherheit zu leisten, soweit sie nicht Befriedigung verlangen können. Diese Recht steht ihnen jedoch nur zu, wenn sie glaubhaft machen, dass durch die Ausgliederung die Erfüllung ihrer Forderung gefährdet wird."
    },
    {
      "date": "2025-11-13",
      "id": "137200",
      "original_text": "Registerbekanntmachung nach dem Umwandlungsgesetz\nBaden-Württemberg Amtsgericht Stuttgart HRB 761985\ninnition GmbH – Stuttgart",
      "type": "Registerbekanntmachung nach dem Umwandlungsgesetz",
      "state": "Baden-Württemberg",
      "amtsgericht": "Amtsgericht Stuttgart",
      "registernummer": "HRB 761985",
      "registerart": "HRB",
      "company_name": "innition GmbH",
      "company_seat": "Stuttgart",
      "details": "13.11.2025 (Bekanntmachungsdatum)\n\nBaden-Württemberg Amtsgericht Stuttgart HRB 761985\nRegisterbekanntmachung nach dem Umwandlungsgesetz 13.11.2025 (Eintragungsdatum)\n\ninnition GmbH\nGesellschaft mit beschränkter Haftung\nStuttgart\n\nAls nicht eingetragen wird bekanntgemacht:\nDen Gläubigern der an der Verschmelzung beteiligten Rechtsträger ist, wenn sie binnen sechs Monaten nach dem Tag, an dem die Eintragung der Verschmelzung in das Register des Sitzes desjenigen Rechtsträgers, dessen Gläubiger sie sind, nach § 19 Abs. 3 UmwG als bekanntgemacht gilt, ihren Anspruch nach Grund und Höhe schriftlich anmelden, Sicherheit zu leisten, soweit sie nicht Befriedigung verlangen können. Dieses Recht steht den Gläubigern jedoch nur zu, wenn sie glaubhaft machen, dass durch die Verschmelzung die Erfüllung ihrer Forderung gefährdet wird."
    },
    {
      "date": "2025-11-13",
      "id": "137201",
      "original_text": "Einreichung neuer Dokumente\nSachsen-Anhalt Amtsgericht Stendal HRB 111203\nThyssenKrupp Presta Schönebeck GmbH – Schönebeck",
      "type": "Einreichung neuer Dokumente",
      "state": "Sachsen-Anhalt",
      "amtsgericht": "Amtsgericht Stendal",
      "registernummer": "HRB 111203",
      "registerart": "HRB",
      "company_name": "ThyssenKrupp Presta Schönebeck GmbH",
      "company_seat": "Schönebeck",
      "details": "13.11.2025 (Bekanntmachungsdatum)\n\nSachsen-Anhalt Amtsgericht Stendal HRB 111203\nEinreichung neuer Dokumente\n\nThyssenKrupp Presta Schönebeck GmbH\nGesellschaft mit beschränkter Haftung\nSchönebeck\n\nEine Liste der Mitglieder des Aufsichtsrates wurde zum Handelsregister eingereicht."
    },
    {
      "date": "2025-11-13",
      "id": "137202",
      "original_text": "Registerbekanntmachung nach dem Umwandlungsgesetz\nBerlin Amtsgericht Berlin (Charlottenburg) HRB 226748\nVolta Charging Germany GmbH – Berlin",
      "type": "Registerbekanntmachung nach dem Umwandlungsgesetz",
      "state": "Berlin",
      "amtsgericht": "Amtsgericht Berlin (Charlottenburg)",
      "registernummer": "HRB 226748",
      "registerart": "HRB",
      "company_name": "Volta Charging Germany GmbH",
      "company_seat": "Berlin",
      "details": "13.11.2025 (Bekanntmachungsdatum)\n\nBerlin Amtsgericht Berlin (Charlottenburg) HRB 226748\nRegisterbekanntmachung nach dem Umwandlungsgesetz 12.11.2025 (Eintragungsdatum)\n\nVolta Charging Germany GmbH\nGesellschaft mit beschränkter Haftung\nBerlin\n\nZu Eintragungsnummer 14 vom 12.11.2025 wird als nicht eingetragen veröffentlicht:\n\nDen Gläubigern der an der Verschmelzung beteiligten Rechtsträger ist, wenn sie binnen sechs Monaten nach dem Tag, an dem die Eintragung der Verschmelzung in das Register des Sitzes desjenigen Rechtsträgers, dessen Gläubiger sie sind, als bekannt gemacht gilt, ihren Anspruch nach Grund und Höhe schriftlich anmelden, Sicherheit zu leisten, soweit sie nicht Befriedigung verlangen können. Dieses Recht steht den Gläubigern jedoch nur zu, wenn sie glaubhaft machen, dass durch die Verschmelzung die Erfüllung ihrer Forderung gefährdet wird. Das Recht, Sicherheitsleistung zu verlangen, steht Gläubigern nicht zu, die im Falle der Insolvenz ein Recht auf vorzugsweise Befriedigung aus einer Deckungsmasse haben, die nach gesetzlicher Vorschrift zu ihrem Schutz errichtet und staatlich überwacht ist."
    },
    {
      "date": "2025-11-13",
      "id": "137203",
      "original_text": "Registerbekanntmachung nach dem Umwandlungsgesetz\nBaden-Württemberg Amtsgericht Stuttgart HRA 102788\nKaufland 018 GmbH & Co. KG – Neckarsulm",
      "type": "Registerbekanntmachung nach dem Umwandlungsgesetz",
      "state": "Baden-Württemberg",
      "amtsgericht": "Amtsgericht Stuttgart",
      "registernummer": "HRA 102788",
      "registerart": "HRA",
      "company_name": "Kaufland 018 GmbH & Co. KG",
      "company_seat": "Neckarsulm",
      "details": "13.11.2025 (Bekanntmachungsdatum)\n\nBaden-Württemberg Amtsgericht Stuttgart HRA 102788\nRegisterbekanntmachung nach dem Umwandlungsgesetz 13.11.2025 (Eintragungsdatum)\n\nKaufland 018 GmbH & Co. KG\nKommanditgesellschaft\nNeckarsulm\n\nAls nicht eingetragen wird bekanntgemacht:\nDen Gläubigern der an der Abspaltung beteiligten Rechtsträger ist, wenn sie binnen sechs Monaten nach dem Tag, an dem die Eintragung der Abspaltung in das Register des Sitzes desjenigen Rechtsträgers, dessen Gläubiger sie sind, nach § 19 Abs. 3 UmwG als bekanntgemacht gilt, ihren Anspruch nach Grund und Höhe schriftlich anmelden, Sicherheit zu leisten, soweit sie nicht Befriedigung verlangen können. Dieses Recht steht den Gläubigern jedoch nur zu, wenn sie glaubhaft machen, dass durch die Abspaltung die Erfüllung ihrer Forderung gefährdet wird."
    },
    {
      "date": "2025-11-13",
      "id": "137204",
      "original_text": "Registerbekanntmachung nach dem Umwandlungsgesetz\nHamburg Amtsgericht Hamburg HRB 106003\nCWS-boco Deutschland GmbH – Hamburg",
      "type": "Registerbekanntmachung nach dem Umwandlungsgesetz",
      "state": "Hamburg",
      "amtsgericht": "Amtsgericht Hamburg",
      "registernummer": "HRB 106003",
      "registerart": "HRB",
      "company_name": "CWS-boco Deutschland GmbH",
      "company_seat": "Hamburg",
      "details": "13.11.2025 (Bekanntmachungsdatum)\n\nHamburg Amtsgericht Hamburg HRB 106003\nRegisterbekanntmachung nach dem Umwandlungsgesetz 13.11.2025 (Eintragungsdatum)\n\nCWS-boco Deutschland GmbH\nGesellschaft mit beschränkter Haftung\nHamburg\n\nAls nicht eingetragen wird bekannt gemacht:\nDen Gläubigern der an der Ausgliederung beteiligten Gesellschaften ist, wenn sie binnen sechs Monaten nach dem Tag, an dem die Eintragung der Ausgliederung in das Register des Sitzes desjenigen Rechtsträgers, dessen Gläubiger sie sind, nach § 19 Absatz 3 UmwG als bekannt gemacht gilt, ihren Anspruch nach Grund und Höhe schriftlich anmelden, Sicherheit zu leisten, soweit sie nicht Befriedigung verlangen können. Dieses Recht steht den Gläubigern jedoch nur zu, wenn sie glaubhaft machen, dass durch die Ausgliederung die Erfüllung ihrer Forderung gefährdet wird."
    },
    {
      "date": "2025-11-13",
      "id": "137205",
      "original_text": "Registerbekanntmachung nach dem Umwandlungsgesetz\nHamburg Amtsgericht Hamburg HRB 106003\nCWS-boco Deutschland GmbH – Hamburg",
      "type": "Registerbekanntmachung nach dem Umwandlungsgesetz",
      "state": "Hamburg",
      "amtsgericht": "Amtsgericht Hamburg",
      "registernummer": "HRB 106003",
      "registerart": "HRB",
      "company_name": "CWS-boco Deutschland GmbH",
      "company_seat": "Hamburg",
      "details": "13.11.2025 (Bekanntmachungsdatum)\n\nHamburg Amtsgericht Hamburg HRB 106003\nRegisterbekanntmachung nach dem Umwandlungsgesetz 13.11.2025 (Eintragungsdatum)\n\nCWS-boco Deutschland GmbH\nGesellschaft mit beschränkter Haftung\nHamburg\n\nAls nicht eingetragen wird bekannt gemacht:\nDen Gläubigern der an der Abspaltung beteiligten Gesellschaften ist, wenn sie binnen sechs Monaten nach dem Tag, an dem die Eintragung der Abspaltung in das Register des Sitzes desjenigen Rechtsträgers, dessen Gläubiger sie sind, nach § 19 Absatz 3 UmwG als bekannt gemacht gilt, ihren Anspruch nach Grund und Höhe schriftlich anmelden, Sicherheit zu leisten, soweit sie nicht Befriedigung verlangen können. Dieses Recht steht den Gläubigern jedoch nur zu, wenn sie glaubhaft machen, dass durch die Abspaltung die Erfüllung ihrer Forderung gefährdet wird."
    },
    {
      "date": "2025-11-13",
      "id": "137206",
      "original_text": "Einreichung neuer Dokumente\nBaden-Württemberg Amtsgericht Stuttgart HRB 400025\naswohnbau gmbh albstadt – Albstadt",
      "type": "Einreichung neuer Dokumente",
      "state": "Baden-Württemberg",
      "amtsgericht": "Amtsgericht Stuttgart",
      "registernummer": "HRB 400025",
      "registerart": "HRB",
      "company_name": "aswohnbau gmbh albstadt",
      "company_seat": "Albstadt",
      "details": "13.11.2025 (Bekanntmachungsdatum)\n\nBaden-Württemberg Amtsgericht Stuttgart HRB 400025\nEinreichung neuer Dokumente\n\naswohnbau gmbh albstadt\nGesellschaft mit beschränkter Haftung\nAlbstadt\n\nDie Gesellschaft hat am 12.11.2025 die Liste über die Zusammensetzung des Aufsichtsrats zum Handelsregister eingereicht."
    },
    {
      "date": "2025-11-13",
      "id": "137207",
      "original_text": "Registerbekanntmachung nach dem Umwandlungsgesetz\nSchleswig-Holstein Amtsgericht Lübeck HRB 16668\nGreve GmbH – Oldenburg i.H.",
      "type": "Registerbekanntmachung nach dem Umwandlungsgesetz",
      "state": "Schleswig-Holstein",
      "amtsgericht": "Amtsgericht Lübeck",
      "registernummer": "HRB 16668",
      "registerart": "HRB",
      "company_name": "Greve GmbH",
      "company_seat": "Oldenburg i.H.",
      "details": "13.11.2025 (Bekanntmachungsdatum)\n\nSchleswig-Holstein Amtsgericht Lübeck HRB 16668\nRegisterbekanntmachung nach dem Umwandlungsgesetz 12.11.2025 (Eintragungsdatum)\n\nGreve GmbH\nGesellschaft mit beschränkter Haftung\nOldenburg i.H.\n\nZu Eintragungsnummer 3 vom 12.11.2025 wird als nicht eingetragen veröffentlicht:\nDen Gläubigern der an der Verschmelzung beteiligten Rechtsträger ist, wenn sie binnen sechs Monaten nach dem Tag, an dem die Eintragung der Verschmelzung in das Register des Sitzes desjenigen Rechtsträgers, dessen Gläubiger sie sind, als bekannt gemacht gilt, ihren Anspruch nach Grund und Höhe schriftlich anmelden, Sicherheit zu leisten, soweit sie nicht Befriedigung verlangen können. Dieses Recht steht den Gläubigern jedoch nur zu, wenn sie glaubhaft machen, dass durch die Verschmelzung die Erfüllung ihrer Forderung gefährdet wird."
    },
    {
      "date": "2025-11-13",
      "id": "137208",
      "original_text": "Einreichung neuer Dokumente\nBerlin Amtsgericht Berlin (Charlottenburg) HRB 169096\nFrancotyp-Postalia Holding AG – Berlin",
      "type": "Einreichung neuer Dokumente",
      "state": "Berlin",
      "amtsgericht": "Amtsgericht Berlin (Charlottenburg)",
      "registernummer": "HRB 169096",
      "registerart": "HRB",
      "company_name": "Francotyp-Postalia Holding AG",
      "company_seat": "Berlin",
      "details": "13.11.2025 (Bekanntmachungsdatum)\n\nBerlin Amtsgericht Berlin (Charlottenburg) HRB 169096\nEinreichung neuer Dokumente\n\nFrancotyp-Postalia Holding AG\nAktiengesellschaft\nBerlin\n\nAls nicht eingetragen wird veröffentlicht: Es wurde eine neue Liste der Aufsichtsratsmitglieder eingereicht (§ 106 AktG)."
    },
    {
      "date": "2025-11-13",
      "id": "137209",
      "original_text": "Löschungsankündigung\nBerlin Amtsgericht Berlin (Charlottenburg) HRB 192244\nDe Liquido GmbH – Berlin",
      "type": "Löschungsankündigung",
      "state": "Berlin",
      "amtsgericht": "Amtsgericht Berlin (Charlottenburg)",
      "registernummer": "HRB 192244",
      "registerart": "HRB",
      "company_name": "De Liquido GmbH",
      "company_seat": "Berlin",
      "details": "13.11.2025 (Bekanntmachungsdatum)\n\nBerlin Amtsgericht Berlin (Charlottenburg) HRB 192244\nLöschungsankündigung\n\nDe Liquido GmbH\nGesellschaft mit beschränkter Haftung\nBerlin\n\nBei der nachstehenden Gesellschaft wird das Amtslöschungsverfahren gemäß § 394 FamFG eingeleitet. Widerspruchsfrist 6 Wochen"
    },
    {
      "date": "2025-11-13",
      "id": "137210",
      "original_text": "Registerbekanntmachung nach dem Umwandlungsgesetz\nSchleswig-Holstein Amtsgericht Lübeck HRB 23469\nGreve GmbH – Oldenburg i. H.",
      "type": "Registerbekanntmachung nach dem Umwandlungsgesetz",
      "state": "Schleswig-Holstein",
      "amtsgericht": "Amtsgericht Lübeck",
      "registernummer": "HRB 23469",
      "registerart": "HRB",
      "company_name": "Greve GmbH",
      "company_seat": "Oldenburg i. H.",
      "details": "13.11.2025 (Bekanntmachungsdatum)\n\nSchleswig-Holstein Amtsgericht Lübeck HRB 23469\nRegisterbekanntmachung nach dem Umwandlungsgesetz 12.11.2025 (Eintragungsdatum)\n\nGreve GmbH\nGesellschaft mit beschränkter Haftung\nOldenburg i. H.\n\nZu Eintragungsnummer 3 vom 12.11.2025 wird als nicht eingetragen veröffentlicht:  Den Gläubigern der an der Verschmelzung beteiligten Rechtsträger ist, wenn sie binnen sechs Monaten nach dem Tag, an dem die Eintragung der Verschmelzung in das Register des Sitzes desjenigen Rechtsträgers, dessen Gläubiger sie sind, als bekannt gemacht gilt, ihren Anspruch nach Grund und Höhe schriftlich anmelden, Sicherheit zu leisten, soweit sie nicht Befriedigung verlangen können. Dieses Recht steht den Gläubigern jedoch nur zu, wenn sie glaubhaft machen, dass durch die Verschmelzung die Erfüllung ihrer Forderung gefährdet wird."
    },
    {
      "date": "2025-11-13",
      "id": "137211",
      "original_text": "Löschungsankündigung\nSchleswig-Holstein Amtsgericht Flensburg HRB 7756\nReetdachdeckerei Uekermann GmbH – Sylt/OT-Tinnum",
      "type": "Löschungsankündigung",
      "state": "Schleswig-Holstein",
      "amtsgericht": "Amtsgericht Flensburg",
      "registernummer": "HRB 7756",
      "registerart": "HRB",
      "company_name": "Reetdachdeckerei Uekermann GmbH",
      "company_seat": "Sylt/OT-Tinnum",
      "details": "13.11.2025 (Bekanntmachungsdatum)\n\nSchleswig-Holstein Amtsgericht Flensburg HRB 7756\nLöschungsankündigung\n\nReetdachdeckerei Uekermann GmbH\nGesellschaft mit beschränkter Haftung\nSylt/OT-Tinnum\n\nEs ist die Löschung der nachstehenden Gesellschaft wegen Vermögenslosigkeit gemäß § 394 FamFG beabsichtigt.\nWiderspruchsfrist: 2 Monate"
    },
    {
      "date": "2025-11-13",
      "id": "137212",
      "original_text": "Registerbekanntmachung nach dem Umwandlungsgesetz\nBaden-Württemberg Amtsgericht Mannheim HRB 756291\nBruker-Physik AG – Ettlingen",
      "type": "Registerbekanntmachung nach dem Umwandlungsgesetz",
      "state": "Baden-Württemberg",
      "amtsgericht": "Amtsgericht Mannheim",
      "registernummer": "HRB 756291",
      "registerart": "HRB",
      "company_name": "Bruker-Physik AG",
      "company_seat": "Ettlingen",
      "details": "13.11.2025 (Bekanntmachungsdatum)\n\nBaden-Württemberg Amtsgericht Mannheim HRB 756291\nRegisterbekanntmachung nach dem Umwandlungsgesetz 13.11.2025 (Eintragungsdatum)\n\nBruker-Physik AG\nAktiengesellschaft\nEttlingen\n\nAls nicht eingetragen wird bekanntgemacht: Den Gläubigern des an dem Formwechsel beteiligten Rechtsträgers ist, wenn sie binnen sechs Monaten nach dem Tag, an dem die Eintragung des Formwechsels in das Register des Sitzes desjenigen Rechtsträgers, dessen Gläubiger sie sind, nach § 19 Abs. 3 UmwG als bekanntgemacht gilt, ihren Anspruch nach Grund und Höhe schriftlich anmelden, Sicherheit zu leisten, soweit sie nicht Befriedigung verlangen können. Dieses Recht steht den Gläubigern jedoch nur zu, wenn sie glaubhaft machen, dass durch den Formwechsel die Erfüllung ihrer Forderung gefährdet wird."
    },
    {
      "date": "2025-11-13",
      "id": "137213",
      "original_text": "Registerbekanntmachung nach dem Umwandlungsgesetz\nBaden-Württemberg Amtsgericht Mannheim HRB 720637\nH2Stamping Germany GmbH & Co. KGaA – Königsbach-Stein",
      "type": "Registerbekanntmachung nach dem Umwandlungsgesetz",
      "state": "Baden-Württemberg",
      "amtsgericht": "Amtsgericht Mannheim",
      "registernummer": "HRB 720637",
      "registerart": "HRB",
      "company_name": "H2Stamping Germany GmbH & Co. KGaA",
      "company_seat": "Königsbach-Stein",
      "details": "13.11.2025 (Bekanntmachungsdatum)\n\nBaden-Württemberg Amtsgericht Mannheim HRB 720637\nRegisterbekanntmachung nach dem Umwandlungsgesetz 13.11.2025 (Eintragungsdatum)\n\nH2Stamping Germany GmbH & Co. KGaA\nKommanditgesellschaft auf Aktien\nKönigsbach-Stein\n\nDen Gläubigern des an dem Formwechsel beteiligten Rechtsträgers ist, wenn sie binnen sechs Monaten nach dem Tag, an dem die Eintragung des Formwechsels in das Register des Sitzes desjenigen Rechtsträgers, dessen Gläubiger sie sind, nach § 19 Abs. 3 UmwG als bekanntgemacht gilt, ihren Anspruch nach Grund und Höhe schriftlich anmelden, Sicherheit zu leisten, soweit sie nicht Befriedigung verlangen können. Dieses Recht steht den Gläubigern jedoch nur zu, wenn sie glaubhaft machen, dass durch den Formwechsel die Erfüllung ihrer Forderung gefährdet wird."
    },
    {
      "date": "2025-11-13",
      "id": "137214",
      "original_text": "Registerbekanntmachung nach dem Umwandlungsgesetz\nBaden-Württemberg Amtsgericht Mannheim HRB 702671\nBruker-Physik GmbH – Ettlingen",
      "type": "Registerbekanntmachung nach dem Umwandlungsgesetz",
      "state": "Baden-Württemberg",
      "amtsgericht": "Amtsgericht Mannheim",
      "registernummer": "HRB 702671",
      "registerart": "HRB",
      "company_name": "Bruker-Physik GmbH",
      "company_seat": "Ettlingen",
      "details": "13.11.2025 (Bekanntmachungsdatum)\n\nBaden-Württemberg Amtsgericht Mannheim HRB 702671\nRegisterbekanntmachung nach dem Umwandlungsgesetz 13.11.2025 (Eintragungsdatum)\n\nBruker-Physik GmbH\nGesellschaft mit beschränkter Haftung\nEttlingen\n\nAls nicht eingetragen wird bekanntgemacht: Den Gläubigern des an dem Formwechsel beteiligten Rechtsträgers ist, wenn sie binnen sechs Monaten nach dem Tag, an dem die Eintragung des Formwechsels in das Register des Sitzes desjenigen Rechtsträgers, dessen Gläubiger sie sind, nach § 19 Abs. 3 UmwG als bekanntgemacht gilt, ihren Anspruch nach Grund und Höhe schriftlich anmelden, Sicherheit zu leisten, soweit sie nicht Befriedigung verlangen können. Dieses Recht steht den Gläubigern jedoch nur zu, wenn sie glaubhaft machen, dass durch den Formwechsel die Erfüllung ihrer Forderung gefährdet wird."
    },
    {
      "date": "2025-11-13",
      "id": "137215",
      "original_text": "Sonstige Registerbekanntmachung\nHamburg Amtsgericht Hamburg HRB 104072\nALCO KALO Beteiligungs GmbH – Hamburg",
      "type": "Sonstige Registerbekanntmachung",
      "state": "Hamburg",
      "amtsgericht": "Amtsgericht Hamburg",
      "registernummer": "HRB 104072",
      "registerart": "HRB",
      "company_name": "ALCO KALO Beteiligungs GmbH",
      "company_seat": "Hamburg",
      "details": "13.11.2025 (Bekanntmachungsdatum)\n\nHamburg Amtsgericht Hamburg HRB 104072\nSonstige Registerbekanntmachung 13.11.2025 (Eintragungsdatum)\n\nALCO KALO Beteiligungs GmbH\nGesellschaft mit beschränkter Haftung\nHamburg\n\nAls nicht eingetragen wird bekannt gemacht:  Den Gläubigern der Gesellschaft, deren Forderungen begründet worden sind, bevor die Eintragung der Vertragsbeendigung in das Handelsregister nach § 10 HGB als bekannt gemacht gilt, ist vom anderen Vertragsteil Sicherheit zu leisten, wenn sie sich binnen 6 Monaten nach Bekanntmachung der Eintragung zu diesem Zweck bei ihm melden."
    },
    {
      "date": "2025-11-13",
      "id": "137216",
      "original_text": "Registerbekanntmachung nach dem Umwandlungsgesetz\nBerlin Amtsgericht Berlin (Charlottenburg) HRB 193897\nReal VV2 GmbH – Berlin",
      "type": "Registerbekanntmachung nach dem Umwandlungsgesetz",
      "state": "Berlin",
      "amtsgericht": "Amtsgericht Berlin (Charlottenburg)",
      "registernummer": "HRB 193897",
      "registerart": "HRB",
      "company_name": "Real VV2 GmbH",
      "company_seat": "Berlin",
      "details": "13.11.2025 (Bekanntmachungsdatum)\n\nBerlin Amtsgericht Berlin (Charlottenburg) HRB 193897\nRegisterbekanntmachung nach dem Umwandlungsgesetz 12.11.2025 (Eintragungsdatum)\n\nReal VV2 GmbH\nGesellschaft mit beschränkter Haftung\nBerlin\n\nZu Eintragungsnummer 4 vom 12.11.2025 wird als nicht eingetragen veröffentlicht: Den Gläubigern der an der Verschmelzung beteiligten Rechtsträger ist, wenn sie binnen sechs Monaten nach dem Tag, an dem die Eintragung der Verschmelzung in das Register des Sitzes desjenigen Rechtsträgers, dessen Gläubiger sie sind, als bekannt gemacht gilt, ihren Anspruch nach Grund und Höhe schriftlich anmelden, Sicherheit zu leisten, soweit sie nicht Befriedigung verlangen können. Dieses Recht steht den Gläubigern jedoch nur zu, wenn sie glaubhaft machen, dass durch die Verschmelzung die Erfüllung ihrer Forderung gefährdet wird. Das Recht, Sicherheitsleistung zu verlangen, steht Gläubigern nicht zu, die im Falle der Insolvenz ein Recht auf vorzugsweise Befriedigung aus einer Deckungsmasse haben, die nach gesetzlicher Vorschrift zu ihrem Schutz errichtet und staatlich überwacht ist."
    },
    {
      "date": "2025-11-13",
      "id": "137217",
      "original_text": "Registerbekanntmachung nach dem Umwandlungsgesetz\nBerlin Amtsgericht Berlin (Charlottenburg) HRB 221820\nspreewater GmbH – Berlin",
      "type": "Registerbekanntmachung nach dem Umwandlungsgesetz",
      "state": "Berlin",
      "amtsgericht": "Amtsgericht Berlin (Charlottenburg)",
      "registernummer": "HRB 221820",
      "registerart": "HRB",
      "company_name": "spreewater GmbH",
      "company_seat": "Berlin",
      "details": "13.11.2025 (Bekanntmachungsdatum)\n\nBerlin Amtsgericht Berlin (Charlottenburg) HRB 221820\nRegisterbekanntmachung nach dem Umwandlungsgesetz 09.10.2025 (Eintragungsdatum)\n\nspreewater GmbH\nGesellschaft mit beschränkter Haftung\nBerlin\n\nZu Eintragungsnummer 9 vom 09.10.2025 wird als nicht eingetragen veröffentlicht: Den Gläubigern der an der Verschmelzung beteiligten Rechtsträger ist, wenn sie binnen sechs Monaten nach dem Tag, an dem die Eintragung der Verschmelzung in das Register des Sitzes desjenigen Rechtsträgers, dessen Gläubiger sie sind, als bekannt gemacht gilt, ihren Anspruch nach Grund und Höhe schriftlich anmelden, Sicherheit zu leisten, soweit sie nicht Befriedigung verlangen können. Dieses Recht steht den Gläubigern jedoch nur zu, wenn sie glaubhaft machen, dass durch die Verschmelzung die Erfüllung ihrer Forderung gefährdet wird. Das Recht, Sicherheitsleistung zu verlangen, steht Gläubigern nicht zu, die im Falle der Insolvenz ein Recht auf vorzugsweise Befriedigung aus einer Deckungsmasse haben, die nach gesetzlicher Vorschrift zu ihrem Schutz errichtet und staatlich überwacht ist."
    },
    {
      "date": "2025-11-13",
      "id": "137218",
      "original_text": "Einreichung neuer Dokumente\nBaden-Württemberg Amtsgericht Freiburg HRB 290004\nRHEINHAFEN BREISACH GMBH – Breisach am Rhein",
      "type": "Einreichung neuer Dokumente",
      "state": "Baden-Württemberg",
      "amtsgericht": "Amtsgericht Freiburg",
      "registernummer": "HRB 290004",
      "registerart": "HRB",
      "company_name": "RHEINHAFEN BREISACH GMBH",
      "company_seat": "Breisach am Rhein",
      "details": "13.11.2025 (Bekanntmachungsdatum)\n\nBaden-Württemberg Amtsgericht Freiburg HRB 290004\nEinreichung neuer Dokumente 13.11.2025 (Eintragungsdatum)\n\nRHEINHAFEN BREISACH GMBH\nGesellschaft mit beschränkter Haftung\nBreisach am Rhein\n\nDie Gesellschaft hat am 12.11.2025 die Liste über die Zusammensetzung des Aufsichtsrats zum Handelsregister eingereicht."
    },
    {
      "date": "2025-11-13",
      "id": "137219",
      "original_text": "Löschungsankündigung\nMecklenburg-Vorpommern Amtsgericht Rostock HRB 15216\nFREIE HAND.Vertrieb GmbH – Rostock",
      "type": "Löschungsankündigung",
      "state": "Mecklenburg-Vorpommern",
      "amtsgericht": "Amtsgericht Rostock",
      "registernummer": "HRB 15216",
      "registerart": "HRB",
      "company_name": "FREIE HAND.Vertrieb GmbH",
      "company_seat": "Rostock",
      "details": "13.11.2025 (Bekanntmachungsdatum)\n\nMecklenburg-Vorpommern Amtsgericht Rostock HRB 15216\nLöschungsankündigung\n\nFREIE HAND.Vertrieb GmbH\nGesellschaft mit beschränkter Haftung\nRostock\n\nDas Registergericht beabsichtigt, die im Handelsregister eingetragene Gesellschaft von Amts wegen nach § 394 FamFG zu löschen. Die Frist zur Erhebung eines Widerspruchs gegen die beabsichtigte Löschung wird auf einen Monat festgesetzt."
    },
    {
      "date": "2025-11-13",
      "id": "137220",
      "original_text": "Registerbekanntmachung nach dem Umwandlungsgesetz\nSchleswig-Holstein Amtsgericht Pinneberg HRB 8776\nAPOS GmbH – Wedel",
      "type": "Registerbekanntmachung nach dem Umwandlungsgesetz",
      "state": "Schleswig-Holstein",
      "amtsgericht": "Amtsgericht Pinneberg",
      "registernummer": "HRB 8776",
      "registerart": "HRB",
      "company_name": "APOS GmbH",
      "company_seat": "Wedel",
      "details": "13.11.2025 (Bekanntmachungsdatum)\n\nSchleswig-Holstein Amtsgericht Pinneberg HRB 8776\nRegisterbekanntmachung nach dem Umwandlungsgesetz 11.11.2025 (Eintragungsdatum)\n\nAPOS GmbH\nGesellschaft mit beschränkter Haftung\nWedel\n\nZu Eintragungsnummer 8 vom 11.11.2025 wird als nicht eingetragen veröffentlicht: Als nicht eingetragen wird veröffentlicht: Den Gläubigern der an der Verschmelzung beteiligten Rechtsträger ist, wenn sie binnen sechs Monaten nach dem Tag, an dem die Eintragung der Verschmelzung in das Register des Sitzes desjenigen Rechtsträgers, dessen Gläubiger sie sind, als bekannt gemacht gilt, ihren Anspruch nach Grund und Höhe schriftlich anmelden, Sicherheit zu leisten, soweit sie nicht Befriedigung verlangen können. Dieses Recht steht den Gläubigern jedoch nur zu, wenn sie glaubhaft machen, dass durch die Verschmelzung die Erfüllung ihrer Forderung gefährdet wird. Das Recht, Sicherheitsleistung zu verlangen, steht Gläubigern nicht zu, die im Falle der Insolvenz ein Recht auf vorzugsweise Befriedigung aus einer Deckungsmasse haben, die nach gesetzlicher Vorschrift zu ihrem Schutz errichtet und staatlich überwacht ist."
    },
    {
      "date": "2025-11-13",
      "id": "137221",
      "original_text": "Registerbekanntmachung nach dem Umwandlungsgesetz\nThüringen Amtsgericht Jena HRB 523521\nPLN Finanz GmbH – Erfurt",
      "type": "Registerbekanntmachung nach dem Umwandlungsgesetz",
      "state": "Thüringen",
      "amtsgericht": "Amtsgericht Jena",
      "registernummer": "HRB 523521",
      "registerart": "HRB",
      "company_name": "PLN Finanz GmbH",
      "company_seat": "Erfurt",
      "details": "13.11.2025 (Bekanntmachungsdatum)\n\nThüringen Amtsgericht Jena HRB 523521\nRegisterbekanntmachung nach dem Umwandlungsgesetz 13.11.2025 (Eintragungsdatum)\n\nPLN Finanz GmbH\nGesellschaft mit beschränkter Haftung\nErfurt\n\nNicht eingetragen: Den Gläubigern der an der Ausgliederung beteiligten Rechtsträger, ist wenn sie binnen sechs Monaten nach dem Tag, an dem die Eintragung der Ausgliederung in das Register des Sitzes desjenigen Rechtsträgers, dessen Gläubiger sie sind, nach §§125, 19 Abs. 3 UmwG als bekanntgemacht gilt, ihren Anspruch nach Grund und Höhe schriftlich anmelden, Sicherheit zu leisten, soweit sie nicht Befriedigung verlangen können. Dieses Recht steht ihnen jedoch nur zu, wenn sie glaubhaft machen, daß durch die Ausgliederung die Erfüllung ihrer Forderung gefährdet wird."
    },
    {
      "date": "2025-11-13",
      "id": "137222",
      "original_text": "Registerbekanntmachung nach dem Umwandlungsgesetz\nThüringen Amtsgericht Jena HRA 507123\nPhilipp Nitschke Finanzdienstleistungen e.K. – Erfurt",
      "type": "Registerbekanntmachung nach dem Umwandlungsgesetz",
      "state": "Thüringen",
      "amtsgericht": "Amtsgericht Jena",
      "registernummer": "HRA 507123",
      "registerart": "HRA",
      "company_name": "Philipp Nitschke Finanzdienstleistungen e.K.",
      "company_seat": "Erfurt",
      "details": "13.11.2025 (Bekanntmachungsdatum)\n\nThüringen Amtsgericht Jena HRA 507123\nRegisterbekanntmachung nach dem Umwandlungsgesetz 13.11.2025 (Eintragungsdatum)\n\nPhilipp Nitschke Finanzdienstleistungen e.K.\nEinzelkaufmann / Einzelkauffrau\nErfurt\n\nNicht eingetragen: Den Gläubigern der an der Ausgliederung beteiligten Rechtsträger, ist wenn sie binnen sechs Monaten nach dem Tag, an dem die Eintragung der Ausgliederung in das Register des Sitzes desjenigen Rechtsträgers, dessen Gläubiger sie sind, nach §§125, 19 Abs. 3 UmwG als bekanntgemacht gilt, ihren Anspruch nach Grund und Höhe schriftlich anmelden, Sicherheit zu leisten, soweit sie nicht Befriedigung verlangen können. Dieses Recht steht ihnen jedoch nur zu, wenn sie glaubhaft machen, daß durch die Ausgliederung die Erfüllung ihrer Forderung gefährdet wird."
    },
    {
      "date": "2025-11-13",
      "id": "137223",
      "original_text": "Löschungsankündigung\nThüringen Amtsgericht Jena HRB 206929\nUnternehmensberatung ETC GmbH – Weimar",
      "type": "Löschungsankündigung",
      "state": "Thüringen",
      "amtsgericht": "Amtsgericht Jena",
      "registernummer": "HRB 206929",
      "registerart": "HRB",
      "company_name": "Unternehmensberatung ETC GmbH",
      "company_seat": "Weimar",
      "details": "13.11.2025 (Bekanntmachungsdatum)\n\nThüringen Amtsgericht Jena HRB 206929\nLöschungsankündigung\n\nUnternehmensberatung ETC GmbH\nGesellschaft mit beschränkter Haftung\nWeimar\n\nDas Registergericht beabsichtigt, die im Handelsregister eingetragene Gesellschaft wegen Vermögenslosigkeit nach § 394 FamFG von Amts wegen zu löschen. Die Frist zur Erhebung eines Widerspruchs gegen die beabsichtigte Löschung wird auf 6 Wochen festgesetzt."
    },
    {
      "date": "2025-11-13",
      "id": "137224",
      "original_text": "Löschungsankündigung\nThüringen Amtsgericht Jena HRB 518715\nAktiv Fahrschule Wurzbacher UG (haftungsbeschränkt) – Greiz",
      "type": "Löschungsankündigung",
      "state": "Thüringen",
      "amtsgericht": "Amtsgericht Jena",
      "registernummer": "HRB 518715",
      "registerart": "HRB",
      "company_name": "Aktiv Fahrschule Wurzbacher UG (haftungsbeschränkt)",
      "company_seat": "Greiz",
      "details": "13.11.2025 (Bekanntmachungsdatum)\n\nThüringen Amtsgericht Jena HRB 518715\nLöschungsankündigung\n\nAktiv Fahrschule Wurzbacher UG (haftungsbeschränkt)\nGesellschaft mit beschränkter Haftung\nGreiz\n\nDas Registergericht beabsichtigt, die im Handelsregister eingetragene Gesellschaft wegen Vermögenslosigkeit nach § 394 FamFG von Amts wegen zu löschen. Die Frist zur Erhebung eines Widerspruchs gegen die beabsichtigte Löschung wird auf 6 Wochen festgesetzt."
    },
    {
      "date": "2025-11-13",
      "id": "137225",
      "original_text": "Einreichung neuer Dokumente\nThüringen Amtsgericht Jena HRB 107939\nAratora - Wohnungsbaugesellschaft Artern mbH – Artern",
      "type": "Einreichung neuer Dokumente",
      "state": "Thüringen",
      "amtsgericht": "Amtsgericht Jena",
      "registernummer": "HRB 107939",
      "registerart": "HRB",
      "company_name": "Aratora - Wohnungsbaugesellschaft Artern mbH",
      "company_seat": "Artern",
      "details": "13.11.2025 (Bekanntmachungsdatum)\n\nThüringen Amtsgericht Jena HRB 107939\nEinreichung neuer Dokumente 08.10.2025 (Eintragungsdatum)\n\nAratora - Wohnungsbaugesellschaft Artern mbH\nGesellschaft mit beschränkter Haftung\nArtern\n\nBekanntmachung gem. § 52 Abs. 3 Satz 2 GmbHG: Aufgrund einer Veränderung in den Personen der Aufsichtsratsmitglieder ist durch die Geschäftsführer eine neue Liste zum Handelsregister eingereicht worden."
    },
    {
      "date": "2025-11-13",
      "id": "137226",
      "original_text": "Registerbekanntmachung nach dem Umwandlungsgesetz\nHamburg Amtsgericht Hamburg HRB 102525\nA.u.K. Kapitalgesellschaft mbH – Hamburg",
      "type": "Registerbekanntmachung nach dem Umwandlungsgesetz",
      "state": "Hamburg",
      "amtsgericht": "Amtsgericht Hamburg",
      "registernummer": "HRB 102525",
      "registerart": "HRB",
      "company_name": "A.u.K. Kapitalgesellschaft mbH",
      "company_seat": "Hamburg",
      "details": "13.11.2025 (Bekanntmachungsdatum)\n\nHamburg Amtsgericht Hamburg HRB 102525\nRegisterbekanntmachung nach dem Umwandlungsgesetz 13.11.2025 (Eintragungsdatum)\n\nA.u.K. Kapitalgesellschaft mbH\nGesellschaft mit beschränkter Haftung\nHamburg\n\nAls nicht eingetragen wird bekannt gemacht:\nDen Gläubigern der an der Verschmelzung beteiligten Gesellschaften ist, wenn sie binnen sechs Monaten nach dem Tag, an dem die Eintragung der Verschmelzung in das Register des Sitzes desjenigen Rechtsträgers, dessen Gläubiger sie sind, nach § 19 Absatz 3 UmwG als bekannt gemacht gilt, ihren Anspruch nach Grund und Höhe schriftlich anmelden, Sicherheit zu leisten, soweit sie nicht Befriedigung verlangen können. Dieses Recht steht den Gläubigern jedoch nur zu, wenn sie glaubhaft machen, dass durch die Verschmelzung die Erfüllung ihrer Forderung gefährdet wird."
    },
    {
      "date": "2025-11-13",
      "id": "137227",
      "original_text": "Löschungsankündigung\nBerlin Amtsgericht Berlin (Charlottenburg) HRB 204060\nMILVIK Bau- und Projektsteuerung GmbH – Berlin",
      "type": "Löschungsankündigung",
      "state": "Berlin",
      "amtsgericht": "Amtsgericht Berlin (Charlottenburg)",
      "registernummer": "HRB 204060",
      "registerart": "HRB",
      "company_name": "MILVIK Bau- und Projektsteuerung GmbH",
      "company_seat": "Berlin",
      "details": "13.11.2025 (Bekanntmachungsdatum)\n\nBerlin Amtsgericht Berlin (Charlottenburg) HRB 204060\nLöschungsankündigung\n\nMILVIK Bau- und Projektsteuerung GmbH\nGesellschaft mit beschränkter Haftung\nBerlin\n\nBei der nachstehenden Gesellschaft wird das Amtslöschungsverfahren gemäß § 394 FamFG eingeleitet. Widerspruchsfrist 6 Wochen"
    },
    {
      "date": "2025-11-13",
      "id": "137228",
      "original_text": "Registerbekanntmachung nach dem Umwandlungsgesetz\nBerlin Amtsgericht Berlin (Charlottenburg) HRB 281140\nSchroeck IT-Consulting GmbH – Berlin",
      "type": "Registerbekanntmachung nach dem Umwandlungsgesetz",
      "state": "Berlin",
      "amtsgericht": "Amtsgericht Berlin (Charlottenburg)",
      "registernummer": "HRB 281140",
      "registerart": "HRB",
      "company_name": "Schroeck IT-Consulting GmbH",
      "company_seat": "Berlin",
      "details": "13.11.2025 (Bekanntmachungsdatum)\n\nBerlin Amtsgericht Berlin (Charlottenburg) HRB 281140\nRegisterbekanntmachung nach dem Umwandlungsgesetz 12.11.2025 (Eintragungsdatum)\n\nSchroeck IT-Consulting GmbH\nGesellschaft mit beschränkter Haftung\nBerlin\n\nZu Eintragungsnummer 1 vom 12.11.2025 wird als nicht eingetragen veröffentlicht:Den Gläubigern ist, wenn sie binnen sechs Monaten nach dem Tag, an dem die Eintragung der Umwandlung als bekannt gemacht gilt, ihren Anspruch nach Grund und Höhe schriftlich anmelden, Sicherheit zu leisten, soweit sie nicht Befriedigung verlangen können. Dieses Recht steht den Gläubigern jedoch nur zu, wenn sie glaubhaft machen, dass durch die Umwandlung die Erfüllung ihrer Forderung gefährdet wird. Das Recht, Sicherheitsleistung zu verlangen, steht Gläubigern nicht zu, die im Falle der Insolvenz ein Recht auf vorzugsweise Befriedigung aus einer Deckungsmasse haben, die nach gesetzlicher Vorschrift zu ihrem Schutz errichtet und staatlich überwacht ist."
    },
    {
      "date": "2025-11-13",
      "id": "137229",
      "original_text": "Einreichung neuer Dokumente\nBrandenburg Amtsgericht Cottbus HRB 17082\nCalypso Management & Investment AG – Schulzendorf, Landkreis Dahme-Spreewald",
      "type": "Einreichung neuer Dokumente",
      "state": "Brandenburg",
      "amtsgericht": "Amtsgericht Cottbus",
      "registernummer": "HRB 17082",
      "registerart": "HRB",
      "company_name": "Calypso Management & Investment AG",
      "company_seat": "Schulzendorf, Landkreis Dahme-Spreewald",
      "details": "13.11.2025 (Bekanntmachungsdatum)\n\nBrandenburg Amtsgericht Cottbus HRB 17082\nEinreichung neuer Dokumente\n\nCalypso Management & Investment AG\nAktiengesellschaft\nSchulzendorf, Landkreis Dahme-Spreewald\n\nAls nicht eingetragen wird veröffentlicht:\nDer Vorstand hat eine Liste der Aufsichtsratsmitglieder gem. § 106 AktG zum Handelsregister eingereicht"
    },
    {
      "date": "2025-11-13",
      "id": "137230",
      "original_text": "Einreichung neuer Dokumente\nBaden-Württemberg Amtsgericht Mannheim HRB 727795\nTELEFONBAU & NORMALZEIT AG – Oberderdingen",
      "type": "Einreichung neuer Dokumente",
      "state": "Baden-Württemberg",
      "amtsgericht": "Amtsgericht Mannheim",
      "registernummer": "HRB 727795",
      "registerart": "HRB",
      "company_name": "TELEFONBAU & NORMALZEIT AG",
      "company_seat": "Oberderdingen",
      "details": "13.11.2025 (Bekanntmachungsdatum)\n\nBaden-Württemberg Amtsgericht Mannheim HRB 727795\nEinreichung neuer Dokumente\n\nTELEFONBAU & NORMALZEIT AG\nAktiengesellschaft\nOberderdingen\n\nDie Gesellschaft hat am 28.06.2025 die Liste über die Zusammensetzung des Aufsichtsrats zum Handelsregister eingereicht."
    },
    {
      "date": "2025-11-13",
      "id": "137231",
      "original_text": "Löschungsankündigung\nBaden-Württemberg Amtsgericht Freiburg HRB 722728\nWUNDERBAR HYGIENE GmbH – Freiburg im Breisgau",
      "type": "Löschungsankündigung",
      "state": "Baden-Württemberg",
      "amtsgericht": "Amtsgericht Freiburg",
      "registernummer": "HRB 722728",
      "registerart": "HRB",
      "company_name": "WUNDERBAR HYGIENE GmbH",
      "company_seat": "Freiburg im Breisgau",
      "details": "13.11.2025 (Bekanntmachungsdatum)\n\nBaden-Württemberg Amtsgericht Freiburg HRB 722728\nLöschungsankündigung\n\nWUNDERBAR HYGIENE GmbH\nGesellschaft mit beschränkter Haftung\nFreiburg im Breisgau\n\nAls nicht eingetragen wird bekanntgemacht:\nDas Gericht beabsichtigt, die Gesellschaft wegen Vermögenslosigkeit im Handelsregister von Amts wegen nach § 394 FamFG zu löschen. Die Frist zur Geltendmachung eines Widerspruchs gegen die beabsichtigte Löschung ist auf einen Monat ab Veröffentlichung bestimmt."
    },
    {
      "date": "2025-11-13",
      "id": "137232",
      "original_text": "Registerbekanntmachung nach dem Umwandlungsgesetz\nSchleswig-Holstein Amtsgericht Pinneberg HRB 13995\nUhl Trucks & Trailer Zentrum GmbH – Hemmingstedt",
      "type": "Registerbekanntmachung nach dem Umwandlungsgesetz",
      "state": "Schleswig-Holstein",
      "amtsgericht": "Amtsgericht Pinneberg",
      "registernummer": "HRB 13995",
      "registerart": "HRB",
      "company_name": "Uhl Trucks & Trailer Zentrum GmbH",
      "company_seat": "Hemmingstedt",
      "details": "13.11.2025 (Bekanntmachungsdatum)\n\nSchleswig-Holstein Amtsgericht Pinneberg HRB 13995\nRegisterbekanntmachung nach dem Umwandlungsgesetz 23.10.2025 (Eintragungsdatum)\n\nUhl Trucks & Trailer Zentrum GmbH\nGesellschaft mit beschränkter Haftung\nHemmingstedt\n\nZu Eintragungsnummer 3 vom 23.10.2025 wird als nicht eingetragen veröffentlicht:\nDen Gläubigern der an der Verschmelzung beteiligten Rechtsträger ist, wenn sie binnen sechs Monaten nach dem Tag, an dem die Eintragung der Verschmelzung in das Register des Sitzes desjenigen Rechtsträgers, dessen Gläubiger sie sind, als bekannt gemacht gilt, ihren Anspruch nach Grund und Höhe schriftlich anmelden, Sicherheit zu leisten, soweit sie nicht Befriedigung verlangen können. Dieses Recht steht den Gläubigern jedoch nur zu, wenn sie glaubhaft machen, dass durch die Verschmelzung die Erfüllung ihrer Forderung gefährdet wird. Das Recht, Sicherheitsleistung zu verlangen, steht Gläubigern nicht zu, die im Falle der Insolvenz ein Recht auf vorzugsweise Befriedigung aus einer Deckungsmasse haben, die nach gesetzlicher Vorschrift zu ihrem Schutz errichtet und staatlich überwacht ist."
    },
    {
      "date": "2025-11-13",
      "id": "137233",
      "original_text": "Sonstige Registerbekanntmachung\nBrandenburg Amtsgericht Frankfurt/Oder HRB 19789\nDAGO Systemtechnik und Handels GmbH – Werneuchen",
      "type": "Sonstige Registerbekanntmachung",
      "state": "Brandenburg",
      "amtsgericht": "Amtsgericht Frankfurt/Oder",
      "registernummer": "HRB 19789",
      "registerart": "HRB",
      "company_name": "DAGO Systemtechnik und Handels GmbH",
      "company_seat": "Werneuchen",
      "details": "13.11.2025 (Bekanntmachungsdatum)\n\nBrandenburg Amtsgericht Frankfurt/Oder HRB 19789\nSonstige Registerbekanntmachung\n\nDAGO Systemtechnik und Handels GmbH\nGesellschaft mit beschränkter Haftung\nWerneuchen\n\nAls nicht eingetragen wird veröffentlicht: Der Insolvenzverwalter hat die Rückkehr zum satzungsgemäßen Geschäftsjahr (01.01. - 31.12.) angezeigt."
    },
    {
      "date": "2025-11-13",
      "id": "137234",
      "original_text": "Löschungsankündigung\nBrandenburg Amtsgericht Potsdam HRB 36952\nEigenheim Union 1898 fünfte Massivhaus GmbH – Zossen",
      "type": "Löschungsankündigung",
      "state": "Brandenburg",
      "amtsgericht": "Amtsgericht Potsdam",
      "registernummer": "HRB 36952",
      "registerart": "HRB",
      "company_name": "Eigenheim Union 1898 fünfte Massivhaus GmbH",
      "company_seat": "Zossen",
      "details": "13.11.2025 (Bekanntmachungsdatum)\n\nBrandenburg Amtsgericht Potsdam HRB 36952\nLöschungsankündigung\n\nEigenheim Union 1898 fünfte Massivhaus GmbH\nGesellschaft mit beschränkter Haftung\nZossen\n\nBei der nachstehenden Gesellschaft wird das Amtslöschungsverfahren gemäß § 394 FamFG eingeleitet. Widerspruchsfrist: 8 Wochen"
    },
    {
      "date": "2025-11-13",
      "id": "137235",
      "original_text": "Sonstige Registerbekanntmachung\nHamburg Amtsgericht Hamburg HRB 154071\nENERPARC Solar Invest 255 TU 14 GmbH – Hamburg",
      "type": "Sonstige Registerbekanntmachung",
      "state": "Hamburg",
      "amtsgericht": "Amtsgericht Hamburg",
      "registernummer": "HRB 154071",
      "registerart": "HRB",
      "company_name": "ENERPARC Solar Invest 255 TU 14 GmbH",
      "company_seat": "Hamburg",
      "details": "13.11.2025 (Bekanntmachungsdatum)\n\nHamburg Amtsgericht Hamburg HRB 154071\nSonstige Registerbekanntmachung 13.11.2025 (Eintragungsdatum)\n\nENERPARC Solar Invest 255 TU 14 GmbH\nGesellschaft mit beschränkter Haftung\nHamburg\n\nAls nicht eingetragen wird bekannt gemacht:  Den Gläubigern der Gesellschaft, deren Forderungen begründet worden sind, bevor die Eintragung der Vertragsbeendigung in das Handelsregister nach § 10 HGB als bekannt gemacht gilt, ist vom anderen Vertragsteil Sicherheit zu leisten, wenn sie sich binnen 6 Monaten nach Bekanntmachung der Eintragung zu diesem Zweck bei ihm melden."
    },
    {
      "date": "2025-11-13",
      "id": "137236",
      "original_text": "Löschungsankündigung\nSachsen Amtsgericht Leipzig HRA 19190\nContiMaxx Grundbesitz GmbH & Co. Harz KG – Schkeuditz",
      "type": "Löschungsankündigung",
      "state": "Sachsen",
      "amtsgericht": "Amtsgericht Leipzig",
      "registernummer": "HRA 19190",
      "registerart": "HRA",
      "company_name": "ContiMaxx Grundbesitz GmbH & Co. Harz KG",
      "company_seat": "Schkeuditz",
      "details": "13.11.2025 (Bekanntmachungsdatum)\n\nSachsen Amtsgericht Leipzig HRA 19190\nLöschungsankündigung\n\nContiMaxx Grundbesitz GmbH & Co. Harz KG\nKommanditgesellschaft\nSchkeuditz\n\nDas Registergericht beabsichtigt, die im Handelsregister eingetragene Firma von Amts wegen nach § 31 Abs. 2 HGB, 393 FamFG zu löschen. Die Frist zur Erhebung eines Widerspruchs gegen die beabsichtigte Löschung wird auf einen Monat festgesetzt."
    },
    {
      "date": "2025-11-13",
      "id": "137237",
      "original_text": "Löschungsankündigung\nSachsen Amtsgericht Dresden HRB 36369\nOFA Konstruktiv UG (haftungsbeschränkt) – Görlitz",
      "type": "Löschungsankündigung",
      "state": "Sachsen",
      "amtsgericht": "Amtsgericht Dresden",
      "registernummer": "HRB 36369",
      "registerart": "HRB",
      "company_name": "OFA Konstruktiv UG (haftungsbeschränkt)",
      "company_seat": "Görlitz",
      "details": "13.11.2025 (Bekanntmachungsdatum)\n\nSachsen Amtsgericht Dresden HRB 36369\nLöschungsankündigung\n\nOFA Konstruktiv UG (haftungsbeschränkt)\nGesellschaft mit beschränkter Haftung\nGörlitz\n\nDas Registergericht beabsichtigt, die im Handelsregister eingetragene Gesellschaft von Amts wegen nach § 394 FamFG zu löschen. Die Frist zu Erhebung eines Widerspruchs gegen die beabsichtigte Löschung wird auf einen Monat festgesetzt."
    },
    {
      "date": "2025-11-13",
      "id": "137238",
      "original_text": "Löschungsankündigung\nNiedersachsen Amtsgericht Stadthagen HRB 200602\nKGS GmbH – Bückeburg",
      "type": "Löschungsankündigung",
      "state": "Niedersachsen",
      "amtsgericht": "Amtsgericht Stadthagen",
      "registernummer": "HRB 200602",
      "registerart": "HRB",
      "company_name": "KGS GmbH",
      "company_seat": "Bückeburg",
      "details": "13.11.2025 (Bekanntmachungsdatum)\n\nNiedersachsen Amtsgericht Stadthagen HRB 200602\nLöschungsankündigung\n\nKGS GmbH\nGesellschaft mit beschränkter Haftung\nBückeburg\n\nDas Registergericht beabsichtigt, die Gesellschaft von Amts wegen nach § 394 FamFG zu löschen. Die Frist zur Erhebung eines Widerspruchs ist auf 1 Monat ab dieser Registerbekanntmachung festgesetzt."
    },
    {
      "date": "2025-11-13",
      "id": "137239",
      "original_text": "Sonstige Registerbekanntmachung\nNiedersachsen Amtsgericht Hannover HRB 200458\nKMU-Beteiligung GmbH – Hannover",
      "type": "Sonstige Registerbekanntmachung",
      "state": "Niedersachsen",
      "amtsgericht": "Amtsgericht Hannover",
      "registernummer": "HRB 200458",
      "registerart": "HRB",
      "company_name": "KMU-Beteiligung GmbH",
      "company_seat": "Hannover",
      "details": "13.11.2025 (Bekanntmachungsdatum)\n\nNiedersachsen Amtsgericht Hannover HRB 200458\nSonstige Registerbekanntmachung 13.11.2025 (Eintragungsdatum)\n\nKMU-Beteiligung GmbH\nGesellschaft mit beschränkter Haftung\nHannover\n\nDen Gläubigern der Gesellschaft, deren Forderungen begründet worden sind, bevor die Eintragung der Beendigung des Vertrages in das Handelsregister nach § 10 HGB als bekanntgemacht gilt, ist vom anderen Vertragsteil Sicherheit zu leisten, wenn sie sich binnen sechs Monaten nach der Bekanntmachung zu diesem Zweck bei ihm melden."
    },
    {
      "date": "2025-11-13",
      "id": "137240",
      "original_text": "Registerbekanntmachung nach dem Umwandlungsgesetz\nNiedersachsen Amtsgericht Braunschweig HRB 110296 früher Amtsgericht Goslar\nStadtwerke Bad Harzburg GmbH – Bad Harzburg",
      "type": "Registerbekanntmachung nach dem Umwandlungsgesetz",
      "state": "Niedersachsen",
      "amtsgericht": "Amtsgericht Braunschweig",
      "registernummer": "HRB 110296",
      "registerart": "HRB",
      "company_name": "Stadtwerke Bad Harzburg GmbH",
      "company_seat": "Bad Harzburg",
      "former_amtsgericht": "Goslar",
      "details": "13.11.2025 (Bekanntmachungsdatum)\n\nNiedersachsen Amtsgericht Braunschweig HRB 110296 früher Amtsgericht Goslar\nRegisterbekanntmachung nach dem Umwandlungsgesetz 13.11.2025 (Eintragungsdatum)\n\nStadtwerke Bad Harzburg GmbH\nGesellschaft mit beschränkter Haftung\nBad Harzburg\n\nDen Gläubigern der an der Abspaltung beteiligten Rechtsträger ist, wenn sie binnen sechs Monaten nach dem Tag, an dem die Eintragung der Abspaltung in das Register des Sitzes desjenigen Rechtsträgers, dessen Gläubiger sie sind, nach § 19 Abs. 3 UmwG als bekannt gemacht gilt, ihren Anspruch nach Grund und Höhe schriftlich anmelden, Sicherheit zu leisten, soweit sie nicht Befriedigung verlangen können. Dieses Recht steht den Gläubigern jedoch nur zu, wenn sie glaubhaft machen, dass durch die Abspaltung die Erfüllung der Forderung gefährdet wird."
    },
    {
      "date": "2025-11-13",
      "id": "137241",
      "original_text": "Löschungsankündigung\nNiedersachsen Amtsgericht Braunschweig HRB 206986\nAtelier Gastro GmbH – Braunschweig",
      "type": "Löschungsankündigung",
      "state": "Niedersachsen",
      "amtsgericht": "Amtsgericht Braunschweig",
      "registernummer": "HRB 206986",
      "registerart": "HRB",
      "company_name": "Atelier Gastro GmbH",
      "company_seat": "Braunschweig",
      "details": "13.11.2025 (Bekanntmachungsdatum)\n\nNiedersachsen Amtsgericht Braunschweig HRB 206986\nLöschungsankündigung 13.11.2025 (Eintragungsdatum)\n\nAtelier Gastro GmbH\nGesellschaft mit beschränkter Haftung\nBraunschweig\n\nDas Registergericht beabsichtigt, die Gesellschaft von Amts wegen nach § 394 FamFG zu löschen. Die Frist zur Erhebung eines Widerspruchs ist auf 1 Monat ab dieser Registerbekanntmachung festgesetzt."
    },
    {
      "date": "2025-11-13",
      "id": "137242",
      "original_text": "Löschungsankündigung\nNiedersachsen Amtsgericht Hildesheim HRB 205296\nNaxos GmbH – Ilsede",
      "type": "Löschungsankündigung",
      "state": "Niedersachsen",
      "amtsgericht": "Amtsgericht Hildesheim",
      "registernummer": "HRB 205296",
      "registerart": "HRB",
      "company_name": "Naxos GmbH",
      "company_seat": "Ilsede",
      "details": "13.11.2025 (Bekanntmachungsdatum)\n\nNiedersachsen Amtsgericht Hildesheim HRB 205296\nLöschungsankündigung 13.11.2025 (Eintragungsdatum)\n\nNaxos GmbH\nGesellschaft mit beschränkter Haftung\nIlsede\n\nDas Registergericht beabsichtigt, die Gesellschaft von Amts wegen nach § 394 FamFG zu löschen. Die Frist zur Erhebung eines Widerspruchs ist auf 1 Monat ab dieser Registerbekanntmachung festgesetzt."
    },
    {
      "date": "2025-11-13",
      "id": "137243",
      "original_text": "Löschungsankündigung\nNiedersachsen Amtsgericht Hannover HRB 1854\nKrankenbeförderung KBH -Medical Service- G.m.b.H. – Hannover",
      "type": "Löschungsankündigung",
      "state": "Niedersachsen",
      "amtsgericht": "Amtsgericht Hannover",
      "registernummer": "HRB 1854",
      "registerart": "HRB",
      "company_name": "Krankenbeförderung KBH -Medical Service- G.m.b.H.",
      "company_seat": "Hannover",
      "details": "13.11.2025 (Bekanntmachungsdatum)\n\nNiedersachsen Amtsgericht Hannover HRB 1854\nLöschungsankündigung\n\nKrankenbeförderung KBH -Medical Service- G.m.b.H.\nGesellschaft mit beschränkter Haftung\nHannover\n\nDas Registergericht beabsichtigt, die Gesellschaft von Amts wegen nach § 394 FamFG zu löschen. Die Frist zur Erhebung eines Widerspruchs ist auf 1 Monat ab dieser Registerbekanntmachung festgesetzt."
    },
    {
      "date": "2025-11-13",
      "id": "137244",
      "original_text": "Registerbekanntmachung nach dem Umwandlungsgesetz\nNiedersachsen Amtsgericht Hildesheim HRB 207356\nEF Abwassertechnologie UG (haftungsbeschränkt) – Duingen",
      "type": "Registerbekanntmachung nach dem Umwandlungsgesetz",
      "state": "Niedersachsen",
      "amtsgericht": "Amtsgericht Hildesheim",
      "registernummer": "HRB 207356",
      "registerart": "HRB",
      "company_name": "EF Abwassertechnologie UG (haftungsbeschränkt)",
      "company_seat": "Duingen",
      "details": "13.11.2025 (Bekanntmachungsdatum)\n\nNiedersachsen Amtsgericht Hildesheim HRB 207356\nRegisterbekanntmachung nach dem Umwandlungsgesetz 13.11.2025 (Eintragungsdatum)\n\nEF Abwassertechnologie UG (haftungsbeschränkt)\nGesellschaft mit beschränkter Haftung\nDuingen\n\nDas Registergericht beabsichtigt, die Gesellschaft von Amts wegen nach § 394 FamFG zu löschen. Die Frist zur Erhebung eines Widerspruchs ist auf 1 Monat ab dieser Registerbekanntmachung festgesetzt."
    },
    {
      "date": "2025-11-13",
      "id": "137245",
      "original_text": "Registerbekanntmachung nach dem Umwandlungsgesetz\nNiedersachsen Amtsgericht Osnabrück HRB 214946\nRMW Immobilien GmbH – Osnabrück",
      "type": "Registerbekanntmachung nach dem Umwandlungsgesetz",
      "state": "Niedersachsen",
      "amtsgericht": "Amtsgericht Osnabrück",
      "registernummer": "HRB 214946",
      "registerart": "HRB",
      "company_name": "RMW Immobilien GmbH",
      "company_seat": "Osnabrück",
      "details": "13.11.2025 (Bekanntmachungsdatum)\n\nNiedersachsen Amtsgericht Osnabrück HRB 214946\nRegisterbekanntmachung nach dem Umwandlungsgesetz 13.11.2025 (Eintragungsdatum)\n\nRMW Immobilien GmbH\nGesellschaft mit beschränkter Haftung\nOsnabrück\n\nDen Gläubigern der an der Verschmelzung beteiligten Rechtsträger ist, wenn sie binnen sechs Monaten nach dem Tag, an dem die Eintragung der Verschmelzung in das Register des Sitzes desjenigen Rechtsträgers, dessen Gläubiger sie sind, nach § 19  Abs.  3 UmwG als bekannt gemacht gilt, ihren Anspruch nach Grund und Höhe schriftlich anmelden, Sicherheit zu leisten, soweit sie nicht Befriedigung verlangen können. Dieses Recht steht den Gläubigern jedoch nur zu, wenn sie glaubhaft machen, dass durch die Verschmelzung die Erfüllung der Forderung gefährdet wird."
    },
    {
      "date": "2025-11-13",
      "id": "137246",
      "original_text": "Löschungsankündigung\nBremen Amtsgericht Bremen HRB 32618\nMED-EXPO GmbH – Bremen",
      "type": "Löschungsankündigung",
      "state": "Bremen",
      "amtsgericht": "Amtsgericht Bremen",
      "registernummer": "HRB 32618",
      "registerart": "HRB",
      "company_name": "MED-EXPO GmbH",
      "company_seat": "Bremen",
      "details": "13.11.2025 (Bekanntmachungsdatum)\n\nBremen Amtsgericht Bremen HRB 32618\nLöschungsankündigung\n\nMED-EXPO GmbH\nGesellschaft mit beschränkter Haftung\nBremen\n\nEs ist beabsichtigt die im Handelsregister eingetragene Gesellschaft von Amts wegen gemäß § 394 FamFG zu löschen. Gegen die Löschung kann beim AG Bremen schriftlich oder zu Protokoll der Geschäftsstelle Widerspruch eingelegt werden. Widerspruchsfrist 4 Wochen."
    },
    {
      "date": "2025-11-13",
      "id": "137247",
      "original_text": "Löschungsankündigung\nBremen Amtsgericht Bremen HRB 34732\nMGM Bau GmbH – Bremen",
      "type": "Löschungsankündigung",
      "state": "Bremen",
      "amtsgericht": "Amtsgericht Bremen",
      "registernummer": "HRB 34732",
      "registerart": "HRB",
      "company_name": "MGM Bau GmbH",
      "company_seat": "Bremen",
      "details": "13.11.2025 (Bekanntmachungsdatum)\n\nBremen Amtsgericht Bremen HRB 34732\nLöschungsankündigung\n\nMGM Bau GmbH\nGesellschaft mit beschränkter Haftung\nBremen\n\nEs ist beabsichtigt die im Handelsregister eingetragene Gesellschaft von Amts wegen gemäß § 394 FamFG zu löschen. Gegen die Löschung kann beim AG Bremen schriftlich oder zu Protokoll der Geschäftsstelle Widerspruch eingelegt werden. Widerspruchsfrist 4 Wochen."
    },
    {
      "date": "2025-11-13",
      "id": "137248",
      "original_text": "Löschungsankündigung\nRheinland-Pfalz Amtsgericht Bad Kreuznach HRB 23417\nABC - CONTACT product & production UG (haftungsbeschränkt) – Heimweiler",
      "type": "Löschungsankündigung",
      "state": "Rheinland-Pfalz",
      "amtsgericht": "Amtsgericht Bad Kreuznach",
      "registernummer": "HRB 23417",
      "registerart": "HRB",
      "company_name": "ABC - CONTACT product & production UG (haftungsbeschränkt)",
      "company_seat": "Heimweiler",
      "details": "13.11.2025 (Bekanntmachungsdatum)\n\nRheinland-Pfalz Amtsgericht Bad Kreuznach HRB 23417\nLöschungsankündigung\n\nABC - CONTACT product & production UG (haftungsbeschränkt)\nGesellschaft mit beschränkter Haftung\nHeimweiler\n\nDas Registergericht beabsichtigt die Gesellschaft wegen Vermögenslosigkeit im Handelsregister von Amts wegen nach § 394 FamFG zu löschen. Die Frist zur Erhebung eines Widerspruchs gegen die beabsichtigte Löschung ist auf einen Monat ab Veröffentlichung bestimmt."
    },
    {
      "date": "2025-11-13",
      "id": "137249",
      "original_text": "Registerbekanntmachung nach dem Umwandlungsgesetz\nRheinland-Pfalz Amtsgericht Bad Kreuznach GsR 150\nSchuch/Wendt eGbR – Schauren",
      "type": "Registerbekanntmachung nach dem Umwandlungsgesetz",
      "state": "Rheinland-Pfalz",
      "amtsgericht": "Amtsgericht Bad Kreuznach",
      "registernummer": "GsR 150",
      "registerart": "GsR",
      "company_name": "Schuch/Wendt eGbR",
      "company_seat": "Schauren",
      "details": "13.11.2025 (Bekanntmachungsdatum)\n\nRheinland-Pfalz Amtsgericht Bad Kreuznach GsR 150\nRegisterbekanntmachung nach dem Umwandlungsgesetz 13.11.2025 (Eintragungsdatum)\n\nSchuch/Wendt eGbR\nGesellschaft bürgerlichen Rechts\nSchauren\n\nAls nicht eingetragen wird veröffentlicht:\nDen Gläubigern des formwechselnden Rechtsträgers ist, wenn sie binnen sechs Monaten nach dem Tag, an dem die Eintragung des Formwechsels nach § 201 UmwG als bekannt gemacht gilt, ihren Anspruch nach Grund und Höhe schriftlich anmelden, Sicherheit zu leisten, soweit sie nicht Befriedigung verlangen können. Dieses Recht steht den Gläubigern jedoch nur zu, wenn sie glaubhaft machen, dass durch den Formwechsel die Erfüllung der Forderung gefährdet wird."
    },
    {
      "date": "2025-11-13",
      "id": "137250",
      "original_text": "Löschungsankündigung\nRheinland-Pfalz Amtsgericht Ludwigshafen a.Rhein (Ludwigshafen) HRB 62739\nDSH-Management UG (haftungsbeschränkt) – Elmstein",
      "type": "Löschungsankündigung",
      "state": "Rheinland-Pfalz",
      "amtsgericht": "Amtsgericht Ludwigshafen a.Rhein (Ludwigshafen)",
      "registernummer": "HRB 62739",
      "registerart": "HRB",
      "company_name": "DSH-Management UG (haftungsbeschränkt)",
      "company_seat": "Elmstein",
      "details": "13.11.2025 (Bekanntmachungsdatum)\n\nRheinland-Pfalz Amtsgericht Ludwigshafen a.Rhein (Ludwigshafen) HRB 62739\nLöschungsankündigung 13.11.2025 (Eintragungsdatum)\n\nDSH-Management UG (haftungsbeschränkt)\nGesellschaft mit beschränkter Haftung\nElmstein\n\nDas Registergericht beabsichtigt die Gesellschaft von Amts wegen nach § 394 FamFG zu löschen. Die Frist zur Erhebung eines Widerspruchs ist auf einen Monat festgesetzt."
    },
    {
      "date": "2025-11-13",
      "id": "137251",
      "original_text": "Löschungsankündigung\nRheinland-Pfalz Amtsgericht Ludwigshafen a.Rhein (Ludwigshafen) HRB 65552\nErhan Et GmbH – Ludwigshafen/Rhein",
      "type": "Löschungsankündigung",
      "state": "Rheinland-Pfalz",
      "amtsgericht": "Amtsgericht Ludwigshafen a.Rhein (Ludwigshafen)",
      "registernummer": "HRB 65552",
      "registerart": "HRB",
      "company_name": "Erhan Et GmbH",
      "company_seat": "Ludwigshafen/Rhein",
      "details": "13.11.2025 (Bekanntmachungsdatum)\n\nRheinland-Pfalz Amtsgericht Ludwigshafen a.Rhein (Ludwigshafen) HRB 65552\nLöschungsankündigung\n\nErhan Et GmbH\nGesellschaft mit beschränkter Haftung\nLudwigshafen/Rhein\n\nDas Registergericht beabsichtigt die Gesellschaft von Amts wegen nach § 394 FamFG zu löschen. Die Frist zur Erhebung eines Widerspruchs ist auf einen Monat festgesetzt."
    },
    {
      "date": "2025-11-13",
      "id": "137252",
      "original_text": "Löschungsankündigung\nNordrhein-Westfalen Amtsgericht Bielefeld HRB 45306\nTUVU UG (haftungsbeschränkt) – Bielefeld",
      "type": "Löschungsankündigung",
      "state": "Nordrhein-Westfalen",
      "amtsgericht": "Amtsgericht Bielefeld",
      "registernummer": "HRB 45306",
      "registerart": "HRB",
      "company_name": "TUVU UG (haftungsbeschränkt)",
      "company_seat": "Bielefeld",
      "details": "13.11.2025 (Bekanntmachungsdatum)\n\nNordrhein-Westfalen Amtsgericht Bielefeld HRB 45306\nLöschungsankündigung\n\nTUVU UG (haftungsbeschränkt)\nGesellschaft mit beschränkter Haftung\nBielefeld\n\nDas Registergericht beabsichtigt, die im Handelsregister eingetragene Gesellschaft gemäß § 394 Abs. 1 FamFG wegen Vermögenslosigkeit von Amts wegen zu löschen. Gegen diese Verfügung kann Widerspruch eingelegt werden. Die Frist zur Erhebung eines Widerspruchs gegen die beabsichtigte Löschung von Amts wegen ist auf 6 Wochen festgesetzt."
    },
    {
      "date": "2025-11-13",
      "id": "137253",
      "original_text": "Registerbekanntmachung nach dem Umwandlungsgesetz\nNordrhein-Westfalen Amtsgericht Düsseldorf HRB 38062\nVodafone GmbH – Düsseldorf",
      "type": "Registerbekanntmachung nach dem Umwandlungsgesetz",
      "state": "Nordrhein-Westfalen",
      "amtsgericht": "Amtsgericht Düsseldorf",
      "registernummer": "HRB 38062",
      "registerart": "HRB",
      "company_name": "Vodafone GmbH",
      "company_seat": "Düsseldorf",
      "details": "13.11.2025 (Bekanntmachungsdatum)\n\nNordrhein-Westfalen Amtsgericht Düsseldorf HRB 38062\nRegisterbekanntmachung nach dem Umwandlungsgesetz 13.11.2025 (Eintragungsdatum)\n\nVodafone GmbH\nGesellschaft mit beschränkter Haftung\nDüsseldorf\n\nDen Gläubigern der an der Verschmelzung beteiligten Rechtsträger ist, wenn sie binnen sechs Monaten nach dem Tag, an dem die Eintragung der Verschmelzung in das Register des Sitzes desjenigen Rechtsträgers, dessen Gläubiger sie sind, nach § 19 Absatz 3 UmwG als bekanntgemacht gilt, ihren Anspruch nach Grund und Höhe schriftlich anmelden, Sicherheit zu leisten, soweit sie nicht Befriedigung verlangen können. Dieses Recht steht den Gläubigern jedoch nur zu, wenn sie glaubhaft machen, dass durch die Verschmelzung die Erfüllung ihrer Forderung gefährdet wird."
    },
    {
      "date": "2025-11-13",
      "id": "137254",
      "original_text": "Löschungsankündigung\nNordrhein-Westfalen Amtsgericht Düsseldorf HRB 90362\nEmak Trade GmbH – Monheim am Rhein",
      "type": "Löschungsankündigung",
      "state": "Nordrhein-Westfalen",
      "amtsgericht": "Amtsgericht Düsseldorf",
      "registernummer": "HRB 90362",
      "registerart": "HRB",
      "company_name": "Emak Trade GmbH",
      "company_seat": "Monheim am Rhein",
      "details": "13.11.2025 (Bekanntmachungsdatum)\n\nNordrhein-Westfalen Amtsgericht Düsseldorf HRB 90362\nLöschungsankündigung\n\nEmak Trade GmbH\nGesellschaft mit beschränkter Haftung\nMonheim am Rhein\n\nDas Registergericht beabsichtigt die Gesellschaft von Amts wegen nach § 394 FamFG zu löschen. Die Frist zur Erhebung eines Widerspruchs ist auf 3 Wochen festgesetzt.\n\nRechtsbehelfsbelehrung:\nDas Widerspruchsrecht steht jedem zu, der an der Unterlassung der Löschung ein berechtigtes Interesse hat. Der Widerspruch ist bei dem Amtsgericht Düsseldorf -Registergericht-, Werdener Straße 1, 40227 Düsseldorf schriftlich in deutscher Sprache oder zur Niederschrift der Geschäftsstelle einzulegen. Der Widerspruch kann auch zur Niederschrift der Geschäftsstelle eines jeden Amtsgerichtes abgegeben werden. Die Einlegung ist auch durch Übertragung eines elektronischen Dokuments an die elektronische Poststelle des Gerichts möglich. Das elektronische Dokument muss für die Bearbeitung durch das Gericht geeignet und mit einer qualifizierten elektronischen Signatur der verantwortenden Person versehen sein oder von der verantwortenden Person signiert und auf einem sicheren Übermittlungsweg gemäß § 130a ZPO nach näherer Maßgabe der Verordnung über die technischen Rahmenbedingungen des elektronischen Rechtsverkehrs und über das besondere elektronische Behördenpostfach (BGBl. I, S.3803) eingereicht werden. Weitere Informationen erhalten Sie auf der Internetseite www.justiz.de.\nDer Widerspruch muss spätestens innerhalb der gesetzten Frist nach dem Datum der Bekanntmachung der Löschungsankündigung bei dem Amtsgericht - Registergericht - Düsseldorf eingegangen sein.  Dies gilt auch dann, wenn der Widerspruch zur Niederschrift der Geschäftsstelle eines anderen Amtsgerichtes abgegeben wurde. Die Frist beginnt mit dem Tage der Bekanntmachung der Löschungsankündigung in dem für die Bekanntmachung der Eintragungen in das Handelsregister bestimmten elektronischen Informations- und Kommunikationssystem nach § 10 des Handelsgesetzbuches. Fällt das Ende der Frist auf einen Sonntag, einen allgemeinen Feiertag oder Sonnabend, so endet die Frist mit Ablauf des nächsten Werktages.\nDer Widerspruch muss die Bezeichnung der angefochtenen Löschungsankündigung sowie die Erklärung enthalten, dass Widerspruch gegen diese Löschungsankündigung eingelegt wird. Er ist zu unterzeichnen und soll begründet werden."
    },
    {
      "date": "2025-11-13",
      "id": "137255",
      "original_text": "Einreichung neuer Dokumente\nNordrhein-Westfalen Amtsgericht Duisburg HRB 11278\nGemeindewerke Hünxe GmbH – Hünxe",
      "type": "Einreichung neuer Dokumente",
      "state": "Nordrhein-Westfalen",
      "amtsgericht": "Amtsgericht Duisburg",
      "registernummer": "HRB 11278",
      "registerart": "HRB",
      "company_name": "Gemeindewerke Hünxe GmbH",
      "company_seat": "Hünxe",
      "details": "13.11.2025 (Bekanntmachungsdatum)\n\nNordrhein-Westfalen Amtsgericht Duisburg HRB 11278\nEinreichung neuer Dokumente 13.11.2025 (Eintragungsdatum)\n\nGemeindewerke Hünxe GmbH\nGesellschaft mit beschränkter Haftung\nHünxe\n\nDem Registergericht ist eine Liste der Mitglieder des Aufsichtsrates eingereicht worden."
    },
    {
      "date": "2025-11-13",
      "id": "137256",
      "original_text": "Löschungsankündigung\nNordrhein-Westfalen Amtsgericht Siegburg HRA 6055\nMalerbetrieb Jungjohann & Wiebe OHG – Waldbröl",
      "type": "Löschungsankündigung",
      "state": "Nordrhein-Westfalen",
      "amtsgericht": "Amtsgericht Siegburg",
      "registernummer": "HRA 6055",
      "registerart": "HRA",
      "company_name": "Malerbetrieb Jungjohann & Wiebe OHG",
      "company_seat": "Waldbröl",
      "details": "13.11.2025 (Bekanntmachungsdatum)\n\nNordrhein-Westfalen Amtsgericht Siegburg HRA 6055\nLöschungsankündigung\n\nMalerbetrieb Jungjohann & Wiebe OHG\nOffene Handelsgesellschaft\nWaldbröl\n\nDie obige im hiesigen Handelsregister eingetragene Firma soll gemäß § 31 Absatz 2 HGB i.V.m. § 393 FamFG von Amts wegen gelöscht werden. Ein etwaiger Widerspruch gegen die beabsichtigte Löschung ist binnen einer Frist von drei Monaten bei dem Registergericht geltend zu machen, anderenfalls wird die Löschung der Firma erfolgen."
    },
    {
      "date": "2025-11-13",
      "id": "137257",
      "original_text": "Löschungsankündigung\nNordrhein-Westfalen Amtsgericht Düsseldorf HRB 86642\nWorld of Care GmbH – Ratingen",
      "type": "Löschungsankündigung",
      "state": "Nordrhein-Westfalen",
      "amtsgericht": "Amtsgericht Düsseldorf",
      "registernummer": "HRB 86642",
      "registerart": "HRB",
      "company_name": "World of Care GmbH",
      "company_seat": "Ratingen",
      "details": "13.11.2025 (Bekanntmachungsdatum)\n\nNordrhein-Westfalen Amtsgericht Düsseldorf HRB 86642\nLöschungsankündigung\n\nWorld of Care GmbH\nGesellschaft mit beschränkter Haftung\nRatingen\n\nDas Registergericht beabsichtigt die Gesellschaft von Amts wegen nach § 394 FamFG zu löschen. Die Frist zur Erhebung eines Widerspruchs ist auf 3 Wochen festgesetzt.\n\nRechtsbehelfsbelehrung:\nDas Widerspruchsrecht steht jedem zu, der an der Unterlassung der Löschung ein berechtigtes Interesse hat. Der Widerspruch ist bei dem Amtsgericht Düsseldorf -Registergericht-, Werdener Straße 1, 40227 Düsseldorf schriftlich in deutscher Sprache oder zur Niederschrift der Geschäftsstelle einzulegen. Der Widerspruch kann auch zur Niederschrift der Geschäftsstelle eines jeden Amtsgerichtes abgegeben werden. Die Einlegung ist auch durch Übertragung eines elektronischen Dokuments an die elektronische Poststelle des Gerichts möglich. Das elektronische Dokument muss für die Bearbeitung durch das Gericht geeignet und mit einer qualifizierten elektronischen Signatur der verantwortenden Person versehen sein oder von der verantwortenden Person signiert und auf einem sicheren Übermittlungsweg gemäß § 130a ZPO nach näherer Maßgabe der Verordnung über die technischen Rahmenbedingungen des elektronischen Rechtsverkehrs und über das besondere elektronische Behördenpostfach (BGBl. I, S.3803) eingereicht werden. Weitere Informationen erhalten Sie auf der Internetseite www.justiz.de.\nDer Widerspruch muss spätestens innerhalb der gesetzten Frist nach dem Datum der Bekanntmachung der Löschungsankündigung bei dem Amtsgericht - Registergericht - Düsseldorf eingegangen sein.  Dies gilt auch dann, wenn der Widerspruch zur Niederschrift der Geschäftsstelle eines anderen Amtsgerichtes abgegeben wurde. Die Frist beginnt mit dem Tage der Bekanntmachung der Löschungsankündigung in dem für die Bekanntmachung der Eintragungen in das Handelsregister bestimmten elektronischen Informations- und Kommunikationssystem nach § 10 des Handelsgesetzbuches. Fällt das Ende der Frist auf einen Sonntag, einen allgemeinen Feiertag oder Sonnabend, so endet die Frist mit Ablauf des nächsten Werktages.\nDer Widerspruch muss die Bezeichnung der angefochtenen Löschungsankündigung sowie die Erklärung enthalten, dass Widerspruch gegen diese Löschungsankündigung eingelegt wird. Er ist zu unterzeichnen und soll begründet werden."
    },
    {
      "date": "2025-11-13",
      "id": "137258",
      "original_text": "Löschungsankündigung\nNordrhein-Westfalen Amtsgericht Duisburg HRB 30856\nKhadra IT-Beratung UG (haftungsbeschränkt) – Mülheim an der Ruhr",
      "type": "Löschungsankündigung",
      "state": "Nordrhein-Westfalen",
      "amtsgericht": "Amtsgericht Duisburg",
      "registernummer": "HRB 30856",
      "registerart": "HRB",
      "company_name": "Khadra IT-Beratung UG (haftungsbeschränkt)",
      "company_seat": "Mülheim an der Ruhr",
      "details": "13.11.2025 (Bekanntmachungsdatum)\n\nNordrhein-Westfalen Amtsgericht Duisburg HRB 30856\nLöschungsankündigung\n\nKhadra IT-Beratung UG (haftungsbeschränkt)\nGesellschaft mit beschränkter Haftung\nMülheim an der Ruhr\n\nAmtsgericht Duisburg\nHRB 30856\nKhadra IT-Beratung UG (haftungsbeschränkt), Sitz Mülheim an der Ruhr\nDas Registergericht beabsichtigt, die im Handelsregister eingetragene Gesellschaft gemäß § 394 Absatz 1 FamFG wegen Vermögenslosigkeit von Amts wegen zu löschen. Gegen diese Verfügung kann Widerspruch eingelegt werden. Die Frist zur Erhebung eines Widerspruchs gegen die beabsichtigte Löschung von Amts wegen ist auf drei Monate festgesetzt. Rechtsbehelfsbelehrung Der Widerspruch ist bei dem Amtsgericht Duisburg, Kardinal-Galen-Str. 124-132, 47058 Duisburg schriftlich in deutscher Sprache oder zur Niederschrift der Geschäftsstelle einzulegen. Der Widerspruch kann auch zur Niederschrift der Geschäftsstelle eines jeden Amtsgerichtes abgegeben werden. Die Einlegung ist auch durch Übertragung eines elektronischen Dokuments an die elektronische Poststelle des Gerichts möglich. Das elektronische Dokument muss für die Bearbeitung durch das Gericht geeignet und mit einer qualifizierten elektronischen Signatur der verantwortenden Person versehen sein oder von der verantwortenden Person signiert und auf einem sicheren Übermittlungsweg gemäß § 130 a ZPO nach näherer Maßgabe der Verordnung über die technischen Rahmenbedingungen des elektronischen Rechtsverkehrs und über das besondere elektronische Behördenpostfach (BGBl. I, S. 3803) eingereicht werden. Weitere Informationen erhalten Sie auf der Internetseite www.justiz.de <http://www.justiz.de>. Der Widerspruch muss spätestens innerhalb der gesetzten Frist bei dem Amtsgericht Duisburg eingegangen sein. Dies gilt auch dann, wenn der Widerspruch zur Niederschrift der Geschäftsstelle eines anderen Amtsgerichtes abgegeben wurde. Die Frist beginnt mit der Veröffentlichung. Fällt das Ende der Frist auf einen Sonntag, einen allgemeinen Feiertag oder Sonnabend, so endet die Frist mit Ablauf des nächsten Werktages. Der Widerspruch muss die Bezeichnung der angefochtenen Verfügung sowie die Erklärung enthalten, dass Widerspruch gegen diese Verfügung eingelegt wird. Er ist zu unterzeichnen und soll begründet werden."
    },
    {
      "date": "2025-11-13",
      "id": "137259",
      "original_text": "Löschungsankündigung\nNordrhein-Westfalen Amtsgericht Siegburg HRB 16365\nAtlas Bauwerk Verwaltung GmbH – Siegburg",
      "type": "Löschungsankündigung",
      "state": "Nordrhein-Westfalen",
      "amtsgericht": "Amtsgericht Siegburg",
      "registernummer": "HRB 16365",
      "registerart": "HRB",
      "company_name": "Atlas Bauwerk Verwaltung GmbH",
      "company_seat": "Siegburg",
      "details": "13.11.2025 (Bekanntmachungsdatum)\n\nNordrhein-Westfalen Amtsgericht Siegburg HRB 16365\nLöschungsankündigung\n\nAtlas Bauwerk Verwaltung GmbH\nGesellschaft mit beschränkter Haftung\nSiegburg\n\nDas Registergericht hat glaubhafte Kenntnis erlangt, dass die Gesellschaft vermögenslos geworden ist.\n\nEs ist daher beabsichtigt, die Gesellschaft nach § 394 FamFG im Handelsregister wegen Vermögenslosigkeit zu löschen.\nEinwände gegen die Löschung sind durch Widerspruch binnen einer Frist von 3 Monaten geltend zu machen, andernfalls die Löschung erfolgen wird.\n\nEinzulegen ist der Widerspruch bei dem Amtsgericht Siegburg, Neue Poststraße 16, 53721 Siegburg, und zwar entweder schriftlich in deutscher Sprache oder mündlich zur Niederschrift der Geschäftsstelle. Der Widerspruch kann auch zur Niederschrift der Geschäftsstelle eines jeden Amtsgerichts abgegeben werden. Der Widerspruch ist binnen der in der Verfügung bestimmten Frist einzulegen. Die Frist ist nur gewahrt, wenn der Widerspruch rechtzeitig bei dem Amtsgericht Siegburg eingeht, auch wenn der Widerspruch zur Niederschrift der Geschäftsstelle eines anderen Amtsgerichts abgegeben wurde. Die Frist beginnt jeweils mit der schriftlichen Bekanntgabe der Verfügung an die Beteiligten. Kann die schriftliche Bekanntgabe an einen Beteiligten nicht bewirkt werden, beginnt die Frist spätestens mit Ablauf von fünf Monaten nach Erlass der Verfügung. Die Bekanntgabe ist entweder durch Zustellung oder am dritten Tage nach Aufgabe zur Post bewirkt. Sofern die Löschung noch nicht erfolgt ist, kann der Widerspruch auch noch nach Ablauf der Frist eingelegt werden. Fällt das Ende der Frist auf einen Sonnabend, einen Sonntag oder einen allgemeinen Feiertag, endet die Frist mit Ablauf des nächsten Werktages. Der Widerspruch ist zu unterzeichnen. Eine Begründung des Widerspruchs ist nicht vorgeschrieben."
    },
    {
      "date": "2025-11-13",
      "id": "137260",
      "original_text": "Löschungsankündigung\nNordrhein-Westfalen Amtsgericht Düsseldorf HRB 102439\nt.m.m. Capital GmbH – Düsseldorf",
      "type": "Löschungsankündigung",
      "state": "Nordrhein-Westfalen",
      "amtsgericht": "Amtsgericht Düsseldorf",
      "registernummer": "HRB 102439",
      "registerart": "HRB",
      "company_name": "t.m.m. Capital GmbH",
      "company_seat": "Düsseldorf",
      "details": "13.11.2025 (Bekanntmachungsdatum)\n\nNordrhein-Westfalen Amtsgericht Düsseldorf HRB 102439\nLöschungsankündigung\n\nt.m.m. Capital GmbH\nGesellschaft mit beschränkter Haftung\nDüsseldorf\n\nEs ist beabsichtigt, die Gesellschaft wegen Vermögenslosigkeit aufgrund des § 394 Abs. 1 FamFG zu löschen. Die Frist zur Erhebung eines Widerspruchs ist auf 3 Wochen festgesetzt.\n\nRechtsbehelfsbelehrung:\nDas Widerspruchsrecht steht jedem zu, der an der Unterlassung der Löschung ein berechtigtes Interesse hat. Der Widerspruch ist bei dem Amtsgericht Düsseldorf -Registergericht-, Werdener Straße 1, 40227 Düsseldorf schriftlich in deutscher Sprache oder zur Niederschrift der Geschäftsstelle einzulegen. Der Widerspruch kann auch zur Niederschrift der Geschäftsstelle eines jeden Amtsgerichtes abgegeben werden. Die Einlegung ist auch durch Übertragung eines elektronischen Dokuments an die elektronische Poststelle des Gerichts möglich. Das elektronische Dokument muss für die Bearbeitung durch das Gericht geeignet und mit einer qualifizierten elektronischen Signatur der verantwortenden Person versehen sein oder von der verantwortenden Person signiert und auf einem sicheren Übermittlungsweg gemäß § 130a ZPO nach näherer Maßgabe der Verordnung über die technischen Rahmenbedingungen des elektronischen Rechtsverkehrs und über das besondere elektronische Behördenpostfach (BGBl. I, S.3803) eingereicht werden. Weitere Informationen erhalten Sie auf der Internetseite www.justiz.de.\nDer Widerspruch muss spätestens innerhalb der gesetzten Frist nach dem Datum der Bekanntmachung der Löschungsankündigung bei dem Amtsgericht - Registergericht - Düsseldorf eingegangen sein.  Dies gilt auch dann, wenn der Widerspruch zur Niederschrift der Geschäftsstelle eines anderen Amtsgerichtes abgegeben wurde. Die Frist beginnt mit dem Tage der Bekanntmachung der Löschungsankündigung in dem für die Bekanntmachung der Eintragungen in das Handelsregister bestimmten elektronischen Informations- und Kommunikationssystem nach § 10 des Handelsgesetzbuches. Fällt das Ende der Frist auf einen Sonntag, einen allgemeinen Feiertag oder Sonnabend, so endet die Frist mit Ablauf des nächsten Werktages.\nDer Widerspruch muss die Bezeichnung der angefochtenen Löschungsankündigung sowie die Erklärung enthalten, dass Widerspruch gegen diese Löschungsankündigung eingelegt wird. Er ist zu unterzeichnen und soll begründet werden."
    },
    {
      "date": "2025-11-13",
      "id": "137261",
      "original_text": "Registerbekanntmachung nach dem Umwandlungsgesetz\nNordrhein-Westfalen Amtsgericht Münster HRB 22970\nElektro Service Ahlers GmbH – Drensteinfurt",
      "type": "Registerbekanntmachung nach dem Umwandlungsgesetz",
      "state": "Nordrhein-Westfalen",
      "amtsgericht": "Amtsgericht Münster",
      "registernummer": "HRB 22970",
      "registerart": "HRB",
      "company_name": "Elektro Service Ahlers GmbH",
      "company_seat": "Drensteinfurt",
      "details": "13.11.2025 (Bekanntmachungsdatum)\n\nNordrhein-Westfalen Amtsgericht Münster HRB 22970\nRegisterbekanntmachung nach dem Umwandlungsgesetz 13.11.2025 (Eintragungsdatum)\n\nElektro Service Ahlers GmbH\nGesellschaft mit beschränkter Haftung\nDrensteinfurt\n\nDen Gläubigern der an der Ausgliederung beteiligten Rechtsträger ist, wenn sie binnen sechs Monaten nach dem Tag, an dem die Eintragung der Ausgliederung in das Register des Sitzes desjenigen Rechtsträgers, dessen Gläubiger sie sind, nach § 19 Absatz 3 UmwG als bekanntgemacht gilt, ihren Anspruch nach Grund und Höhe schriftlich anmelden, Sicherheit zu leisten, soweit sie nicht Befriedigung verlangen können. Dieses Recht steht den Gläubigern jedoch nur zu, wenn sie glaubhaft machen, dass durch die Ausgliederung die Erfüllung ihrer Forderung gefährdet wird."
    },
    {
      "date": "2025-11-13",
      "id": "137262",
      "original_text": "Registerbekanntmachung nach dem Umwandlungsgesetz\nNordrhein-Westfalen Amtsgericht Bad Oeynhausen HRA 9280\nHWU Lubtec GmbH & Co. KG – Hiddenhausen",
      "type": "Registerbekanntmachung nach dem Umwandlungsgesetz",
      "state": "Nordrhein-Westfalen",
      "amtsgericht": "Amtsgericht Bad Oeynhausen",
      "registernummer": "HRA 9280",
      "registerart": "HRA",
      "company_name": "HWU Lubtec GmbH & Co. KG",
      "company_seat": "Hiddenhausen",
      "details": "13.11.2025 (Bekanntmachungsdatum)\n\nNordrhein-Westfalen Amtsgericht Bad Oeynhausen HRA 9280\nRegisterbekanntmachung nach dem Umwandlungsgesetz 04.11.2025 (Eintragungsdatum)\n\nHWU Lubtec GmbH & Co. KG\nKommanditgesellschaft\nHiddenhausen\n\nDen Gläubigern der an der Ausgliederung beteiligten Rechtsträger ist, wenn sie binnen sechs Monaten nach dem Tag, an dem die Eintragung der Ausgliederung in das Register des Sitzes desjenigen Rechtsträgers, dessen Gläubiger sie sind, nach § 19 Absatz 3 UmwG als bekanntgemacht gilt, ihren Anspruch nach Grund und Höhe schriftlich anmelden, Sicherheit zu leisten, soweit sie nicht Befriedigung verlangen können. Dieses Recht steht den Gläubigern jedoch nur zu, wenn sie glaubhaft machen, dass durch die Ausgliederung die Erfüllung ihrer Forderung gefährdet wird."
    },
    {
      "date": "2025-11-13",
      "id": "137263",
      "original_text": "Einreichung neuer Dokumente\nNordrhein-Westfalen Amtsgericht Gütersloh HRB 11088\nHIRSCH Porozell GmbH – Rheda-Wiedenbrück",
      "type": "Einreichung neuer Dokumente",
      "state": "Nordrhein-Westfalen",
      "amtsgericht": "Amtsgericht Gütersloh",
      "registernummer": "HRB 11088",
      "registerart": "HRB",
      "company_name": "HIRSCH Porozell GmbH",
      "company_seat": "Rheda-Wiedenbrück",
      "details": "13.11.2025 (Bekanntmachungsdatum)\n\nNordrhein-Westfalen Amtsgericht Gütersloh HRB 11088\nEinreichung neuer Dokumente 13.11.2025 (Eintragungsdatum)\n\nHIRSCH Porozell GmbH\nGesellschaft mit beschränkter Haftung\nRheda-Wiedenbrück\n\nDem Registergericht ist eine neue Liste der Mitglieder des Beirates eingereicht worden."
    },
    {
      "date": "2025-11-13",
      "id": "137264",
      "original_text": "Registerbekanntmachung nach dem Umwandlungsgesetz\nNordrhein-Westfalen Amtsgericht Arnsberg HRA 9246\nJost von Kuczkowski e.K. – Arnsberg",
      "type": "Registerbekanntmachung nach dem Umwandlungsgesetz",
      "state": "Nordrhein-Westfalen",
      "amtsgericht": "Amtsgericht Arnsberg",
      "registernummer": "HRA 9246",
      "registerart": "HRA",
      "company_name": "Jost von Kuczkowski e.K.",
      "company_seat": "Arnsberg",
      "details": "13.11.2025 (Bekanntmachungsdatum)\n\nNordrhein-Westfalen Amtsgericht Arnsberg HRA 9246\nRegisterbekanntmachung nach dem Umwandlungsgesetz 13.11.2025 (Eintragungsdatum)\n\nJost von Kuczkowski e.K.\nEinzelkaufmann / Einzelkauffrau\nArnsberg\n\nDen Gläubigern der an der Verschmelzung beteiligten Rechtsträger ist, wenn sie binnen sechs Monaten nach dem Tag, an dem die Eintragung der Verschmelzung in das Register des Sitzes desjenigen Rechtsträgers, dessen Gläubiger sie sind, nach § 19 Absatz 3 UmwG als bekanntgemacht gilt, ihren Anspruch nach Grund und Höhe schriftlich anmelden, Sicherheit zu leisten, soweit sie nicht Befriedigung verlangen können. Dieses Recht steht den Gläubigern jedoch nur zu, wenn sie glaubhaft machen, dass durch die Verschmelzung die Erfüllung ihrer Forderung gefährdet wird."
    },
    {
      "date": "2025-11-13",
      "id": "137265",
      "original_text": "Registerbekanntmachung nach dem Umwandlungsgesetz\nNordrhein-Westfalen Amtsgericht Bochum HRB 22209\nFlachdach Herne GmbH – Herne",
      "type": "Registerbekanntmachung nach dem Umwandlungsgesetz",
      "state": "Nordrhein-Westfalen",
      "amtsgericht": "Amtsgericht Bochum",
      "registernummer": "HRB 22209",
      "registerart": "HRB",
      "company_name": "Flachdach Herne GmbH",
      "company_seat": "Herne",
      "details": "13.11.2025 (Bekanntmachungsdatum)\n\nNordrhein-Westfalen Amtsgericht Bochum HRB 22209\nRegisterbekanntmachung nach dem Umwandlungsgesetz 13.11.2025 (Eintragungsdatum)\n\nFlachdach Herne GmbH\nGesellschaft mit beschränkter Haftung\nHerne\n\nDen Gläubigern der an der Ausgliederung beteiligten Rechtsträger ist, wenn sie binnen sechs Monaten nach dem Tag, an dem die Eintragung der Ausgliederung in das Register des Sitzes desjenigen Rechtsträgers, dessen Gläubiger sie sind, nach § 19 Absatz 3 UmwG als bekanntgemacht gilt, ihren Anspruch nach Grund und Höhe schriftlich anmelden, Sicherheit zu leisten, soweit sie nicht Befriedigung verlangen können. Dieses Recht steht den Gläubigern jedoch nur zu, wenn sie glaubhaft machen, dass durch die Ausgliederung die Erfüllung ihrer Forderung gefährdet wird."
    },
    {
      "date": "2025-11-13",
      "id": "137266",
      "original_text": "Registerbekanntmachung nach dem Umwandlungsgesetz\nNordrhein-Westfalen Amtsgericht Paderborn HRA 6909\nEger Consult GmbH & Co. KG – Lippstadt",
      "type": "Registerbekanntmachung nach dem Umwandlungsgesetz",
      "state": "Nordrhein-Westfalen",
      "amtsgericht": "Amtsgericht Paderborn",
      "registernummer": "HRA 6909",
      "registerart": "HRA",
      "company_name": "Eger Consult GmbH & Co. KG",
      "company_seat": "Lippstadt",
      "details": "13.11.2025 (Bekanntmachungsdatum)\n\nNordrhein-Westfalen Amtsgericht Paderborn HRA 6909\nRegisterbekanntmachung nach dem Umwandlungsgesetz 13.11.2025 (Eintragungsdatum)\n\nEger Consult GmbH & Co. KG\nKommanditgesellschaft\nLippstadt\n\nDen Gläubigern der an der Verschmelzung beteiligten Rechtsträger ist, wenn sie binnen sechs Monaten nach dem Tag, an dem die Eintragung der Verschmelzung in das Register des Sitzes desjenigen Rechtsträgers, dessen Gläubiger sie sind, nach § 19 Absatz 3 UmwG als bekanntgemacht gilt, ihren Anspruch nach Grund und Höhe schriftlich anmelden, Sicherheit zu leisten, soweit sie nicht Befriedigung verlangen können. Dieses Recht steht den Gläubigern jedoch nur zu, wenn sie glaubhaft machen, dass durch die Verschmelzung die Erfüllung ihrer Forderung gefährdet wird."
    },
    {
      "date": "2025-11-13",
      "id": "137267",
      "original_text": "Registerbekanntmachung nach dem Umwandlungsgesetz\nNordrhein-Westfalen Amtsgericht Dortmund HRB 37773\nMERX Bellavie GmbH – Dortmund",
      "type": "Registerbekanntmachung nach dem Umwandlungsgesetz",
      "state": "Nordrhein-Westfalen",
      "amtsgericht": "Amtsgericht Dortmund",
      "registernummer": "HRB 37773",
      "registerart": "HRB",
      "company_name": "MERX Bellavie GmbH",
      "company_seat": "Dortmund",
      "details": "13.11.2025 (Bekanntmachungsdatum)\n\nNordrhein-Westfalen Amtsgericht Dortmund HRB 37773\nRegisterbekanntmachung nach dem Umwandlungsgesetz 13.11.2025 (Eintragungsdatum)\n\nMERX Bellavie GmbH\nGesellschaft mit beschränkter Haftung\nDortmund\n\nDen Gläubigern der an der formwechselnden Umwandlung beteiligten Rechtsträger ist, wenn sie binnen sechs Monaten nach dem Tag, an dem die Eintragung der formwechselnden Umwandlung in das Register des Sitzes desjenigen Rechtsträgers, dessen Gläubiger sie sind, nach § 19 Absatz 3 UmwG als bekanntgemacht gilt, ihren Anspruch nach Grund und Höhe schriftlich anmelden, Sicherheit zu leisten, soweit sie nicht Befriedigung verlangen können. Dieses Recht steht den Gläubigern jedoch nur zu, wenn sie glaubhaft machen, dass durch die formwechselnden Umwandlung die Erfüllung ihrer Forderung gefährdet wird."
    },
    {
      "date": "2025-11-13",
      "id": "137268",
      "original_text": "Registerbekanntmachung nach dem Umwandlungsgesetz\nNordrhein-Westfalen Amtsgericht Bad Oeynhausen HRB 16762\nBureau Action UG (haftungsbeschränkt) – Hiddenhausen",
      "type": "Registerbekanntmachung nach dem Umwandlungsgesetz",
      "state": "Nordrhein-Westfalen",
      "amtsgericht": "Amtsgericht Bad Oeynhausen",
      "registernummer": "HRB 16762",
      "registerart": "HRB",
      "company_name": "Bureau Action UG (haftungsbeschränkt)",
      "company_seat": "Hiddenhausen",
      "details": "13.11.2025 (Bekanntmachungsdatum)\n\nNordrhein-Westfalen Amtsgericht Bad Oeynhausen HRB 16762\nRegisterbekanntmachung nach dem Umwandlungsgesetz 13.11.2025 (Eintragungsdatum)\n\nBureau Action UG (haftungsbeschränkt)\nGesellschaft mit beschränkter Haftung\nHiddenhausen\n\nDen Gläubigern der an der Verschmelzung beteiligten Rechtsträger ist, wenn sie binnen sechs Monaten nach dem Tag, an dem die Eintragung der Verschmelzung in das Register des Sitzes desjenigen Rechtsträgers, dessen Gläubiger sie sind, nach § 19 Absatz 3 UmwG als bekanntgemacht gilt, ihren Anspruch nach Grund und Höhe schriftlich anmelden, Sicherheit zu leisten, soweit sie nicht Befriedigung verlangen können. Dieses Recht steht den Gläubigern jedoch nur zu, wenn sie glaubhaft machen, dass durch die Verschmelzung die Erfüllung ihrer Forderung gefährdet wird."
    },
    {
      "date": "2025-11-13",
      "id": "137269",
      "original_text": "Registerbekanntmachung nach dem Umwandlungsgesetz\nNordrhein-Westfalen Amtsgericht Arnsberg HRA 9383\nÜlker Bauelemente e.K. – Menden",
      "type": "Registerbekanntmachung nach dem Umwandlungsgesetz",
      "state": "Nordrhein-Westfalen",
      "amtsgericht": "Amtsgericht Arnsberg",
      "registernummer": "HRA 9383",
      "registerart": "HRA",
      "company_name": "Ülker Bauelemente e.K.",
      "company_seat": "Menden",
      "details": "13.11.2025 (Bekanntmachungsdatum)\n\nNordrhein-Westfalen Amtsgericht Arnsberg HRA 9383\nRegisterbekanntmachung nach dem Umwandlungsgesetz 13.11.2025 (Eintragungsdatum)\n\nÜlker Bauelemente e.K.\nEinzelkaufmann / Einzelkauffrau\nMenden\n\nDen Gläubigern der an der Ausgliederung beteiligten Rechtsträger ist, wenn sie binnen sechs Monaten nach dem Tag, an dem die Eintragung der Ausgliederung in das Register des Sitzes derjenigen Rechtsträger deren Gläubiger sie sind, nach § 19 Absatz 3 UmwG als bekanntgemacht gilt, ihren Anspruch nach Grund und Höhe schriftlich anmelden, Sicherheit zu leisten, soweit sie nicht Befriedigung verlangen können. Dieses Recht steht den Gläubigern jedoch nur zu, wenn sie glaubhaft machen, dass durch die Ausgliederung die Erfüllung ihrer Forderung gefährdet wird."
    },
    {
      "date": "2025-11-13",
      "id": "137270",
      "original_text": "Registerbekanntmachung nach dem Umwandlungsgesetz\nNordrhein-Westfalen Amtsgericht Arnsberg HRB 15715\nBauelemente-58 GmbH – Menden",
      "type": "Registerbekanntmachung nach dem Umwandlungsgesetz",
      "state": "Nordrhein-Westfalen",
      "amtsgericht": "Amtsgericht Arnsberg",
      "registernummer": "HRB 15715",
      "registerart": "HRB",
      "company_name": "Bauelemente-58 GmbH",
      "company_seat": "Menden",
      "details": "13.11.2025 (Bekanntmachungsdatum)\n\nNordrhein-Westfalen Amtsgericht Arnsberg HRB 15715\nRegisterbekanntmachung nach dem Umwandlungsgesetz 13.11.2025 (Eintragungsdatum)\n\nBauelemente-58 GmbH\nGesellschaft mit beschränkter Haftung\nMenden\n\nDen Gläubigern der an der Ausgliederung beteiligten Rechtsträger ist, wenn sie binnen sechs Monaten nach dem Tag, an dem die Eintragung der Ausgliederung in das Register des Sitzes desjenigen Rechtsträgers, dessen Gläubiger sie sind, nach § 19 Absatz 3 UmwG als bekanntgemacht gilt, ihren Anspruch nach Grund und Höhe schriftlich anmelden, Sicherheit zu leisten, soweit sie nicht Befriedigung verlangen können. Dieses Recht steht den Gläubigern jedoch nur zu, wenn sie glaubhaft machen, dass durch die Ausgliederung die Erfüllung ihrer Forderung gefährdet wird."
    },
    {
      "date": "2025-11-13",
      "id": "137271",
      "original_text": "Löschungsankündigung\nNordrhein-Westfalen Amtsgericht Essen HRB 29234\nWolfgang Höfer Personenbeförderungs UG (haftungsbeschränkt) – Essen",
      "type": "Löschungsankündigung",
      "state": "Nordrhein-Westfalen",
      "amtsgericht": "Amtsgericht Essen",
      "registernummer": "HRB 29234",
      "registerart": "HRB",
      "company_name": "Wolfgang Höfer Personenbeförderungs UG (haftungsbeschränkt)",
      "company_seat": "Essen",
      "details": "13.11.2025 (Bekanntmachungsdatum)\n\nNordrhein-Westfalen Amtsgericht Essen HRB 29234\nLöschungsankündigung\n\nWolfgang Höfer Personenbeförderungs UG (haftungsbeschränkt)\nGesellschaft mit beschränkter Haftung\nEssen\n\nDas Registergericht beabsichtigt die Gesellschaft von Amts wegen nach § 394 FamFG zu löschen. Die Frist zur Erhebung eines Widerspruchs ist auf einen Monat festgesetzt."
    },
    {
      "date": "2025-11-13",
      "id": "137272",
      "original_text": "Löschungsankündigung\nNordrhein-Westfalen Amtsgericht Köln HRB 109632\nFELINO Dienstleistung UG (haftungsbeschränkt) – Köln",
      "type": "Löschungsankündigung",
      "state": "Nordrhein-Westfalen",
      "amtsgericht": "Amtsgericht Köln",
      "registernummer": "HRB 109632",
      "registerart": "HRB",
      "company_name": "FELINO Dienstleistung UG (haftungsbeschränkt)",
      "company_seat": "Köln",
      "details": "13.11.2025 (Bekanntmachungsdatum)\n\nNordrhein-Westfalen Amtsgericht Köln HRB 109632\nLöschungsankündigung\n\nFELINO Dienstleistung UG (haftungsbeschränkt)\nGesellschaft mit beschränkter Haftung\nKöln\n\nDas Registergericht beabsichtigt die Gesellschaft von Amts wegen nach § 394 FamFG zu löschen. Die Frist zur Erhebung eines Widerspruchs ist auf einen Monat festgesetzt."
    },
    {
      "date": "2025-11-13",
      "id": "137273",
      "original_text": "Löschungsankündigung\nNordrhein-Westfalen Amtsgericht Wuppertal HRB 33579\nUnitec Bauservice GmbH – Solingen",
      "type": "Löschungsankündigung",
      "state": "Nordrhein-Westfalen",
      "amtsgericht": "Amtsgericht Wuppertal",
      "registernummer": "HRB 33579",
      "registerart": "HRB",
      "company_name": "Unitec Bauservice GmbH",
      "company_seat": "Solingen",
      "details": "13.11.2025 (Bekanntmachungsdatum)\n\nNordrhein-Westfalen Amtsgericht Wuppertal HRB 33579\nLöschungsankündigung\n\nUnitec Bauservice GmbH\nGesellschaft mit beschränkter Haftung\nSolingen\n\nDas Registergericht beabsichtigt die Gesellschaft von Amts wegen nach § 394 FamFG zu löschen. Die Frist zur Erhebung eines Widerspruchs ist auf einen Monat festgesetzt."
    },
    {
      "date": "2025-11-13",
      "id": "137274",
      "original_text": "Registerbekanntmachung nach dem Umwandlungsgesetz\nNordrhein-Westfalen Amtsgericht Arnsberg HRB 10691\nLPT Metalltechnik GmbH – Meschede",
      "type": "Registerbekanntmachung nach dem Umwandlungsgesetz",
      "state": "Nordrhein-Westfalen",
      "amtsgericht": "Amtsgericht Arnsberg",
      "registernummer": "HRB 10691",
      "registerart": "HRB",
      "company_name": "LPT Metalltechnik GmbH",
      "company_seat": "Meschede",
      "details": "13.11.2025 (Bekanntmachungsdatum)\n\nNordrhein-Westfalen Amtsgericht Arnsberg HRB 10691\nRegisterbekanntmachung nach dem Umwandlungsgesetz 13.11.2025 (Eintragungsdatum)\n\nLPT Metalltechnik GmbH\nGesellschaft mit beschränkter Haftung\nMeschede\n\nDen Gläubigern der an der Ausgliederung beteiligten Rechtsträger ist, wenn sie binnen sechs Monaten nach dem Tag, an dem die Eintragung der Ausgliederung in das Register des Sitzes desjenigen Rechtsträgers, dessen Gläubiger sie sind, nach § 19 Absatz 3 UmwG als bekanntgemacht gilt, ihren Anspruch nach Grund und Höhe schriftlich anmelden, Sicherheit zu leisten, soweit sie nicht Befriedigung verlangen können. Dieses Recht steht den Gläubigern jedoch nur zu, wenn sie glaubhaft machen, dass durch die Ausgliederung die Erfüllung ihrer Forderung gefährdet wird."
    },
    {
      "date": "2025-11-13",
      "id": "137275",
      "original_text": "Löschungsankündigung\nNordrhein-Westfalen Amtsgericht Düren HRA 3871\nWapre UG (haftungsbeschränkt) & Co. KG – Nörvenich",
      "type": "Löschungsankündigung",
      "state": "Nordrhein-Westfalen",
      "amtsgericht": "Amtsgericht Düren",
      "registernummer": "HRA 3871",
      "registerart": "HRA",
      "company_name": "Wapre UG (haftungsbeschränkt) & Co. KG",
      "company_seat": "Nörvenich",
      "details": "13.11.2025 (Bekanntmachungsdatum)\n\nNordrhein-Westfalen Amtsgericht Düren HRA 3871\nLöschungsankündigung 13.11.2025 (Eintragungsdatum)\n\nWapre UG (haftungsbeschränkt) & Co. KG\nKommanditgesellschaft\nNörvenich\n\nDas Registergericht beabsichtigt die Firma von Amts wegen nach §§ 31 Absatz 2 Satz 2, 6 Absatz 1 HGB, 393 Absatz 1 FamFG zu löschen. Die Frist zur Erhebung eines Widerspruchs ist auf einen Monat festgesetzt."
    },
    {
      "date": "2025-11-13",
      "id": "137276",
      "original_text": "Einreichung neuer Dokumente\nNordrhein-Westfalen Amtsgericht Gütersloh HRB 5560\nKHW Kommunale Haus und Wohnen GmbH – Rheda-Wiedenbrück",
      "type": "Einreichung neuer Dokumente",
      "state": "Nordrhein-Westfalen",
      "amtsgericht": "Amtsgericht Gütersloh",
      "registernummer": "HRB 5560",
      "registerart": "HRB",
      "company_name": "KHW Kommunale Haus und Wohnen GmbH",
      "company_seat": "Rheda-Wiedenbrück",
      "details": "13.11.2025 (Bekanntmachungsdatum)\n\nNordrhein-Westfalen Amtsgericht Gütersloh HRB 5560\nEinreichung neuer Dokumente\n\nKHW Kommunale Haus und Wohnen GmbH\nGesellschaft mit beschränkter Haftung\nRheda-Wiedenbrück\n\nDem Registergericht ist eine neue Liste der Mitglieder des Aufsichtsrates eingereicht worden."
    },
    {
      "date": "2025-11-13",
      "id": "137277",
      "original_text": "Registerbekanntmachung nach dem Umwandlungsgesetz\nNordrhein-Westfalen Amtsgericht Iserlohn HRA 5596\nVicent Industrievertretung e.K. – Lüdenscheid",
      "type": "Registerbekanntmachung nach dem Umwandlungsgesetz",
      "state": "Nordrhein-Westfalen",
      "amtsgericht": "Amtsgericht Iserlohn",
      "registernummer": "HRA 5596",
      "registerart": "HRA",
      "company_name": "Vicent Industrievertretung e.K.",
      "company_seat": "Lüdenscheid",
      "details": "13.11.2025 (Bekanntmachungsdatum)\n\nNordrhein-Westfalen Amtsgericht Iserlohn HRA 5596\nRegisterbekanntmachung nach dem Umwandlungsgesetz 11.11.2025 (Eintragungsdatum)\n\nVicent Industrievertretung e.K.\nEinzelkaufmann / Einzelkauffrau\nLüdenscheid\n\nDen Gläubigern der an der Ausgliederung beteiligten Rechtsträger ist, wenn sie binnen sechs Monaten nach dem Tag, an dem die Eintragung der Ausgliederung in das Register des Sitzes desjenigen Rechtsträgers, dessen Gläubiger sie sind, nach § 19 Absatz 3 UmwG als bekanntgemacht gilt, ihren Anspruch nach Grund und Höhe schriftlich anmelden, Sicherheit zu leisten, soweit sie nicht Befriedigung verlangen können. Dieses Recht steht den Gläubigern jedoch nur zu, wenn sie glaubhaft machen, dass durch die Ausgliederung die Erfüllung ihrer Forderung gefährdet wird."
    },
    {
      "date": "2025-11-13",
      "id": "137278",
      "original_text": "Registerbekanntmachung nach dem Umwandlungsgesetz\nNordrhein-Westfalen Amtsgericht Gütersloh HRA 8614\nAnsgar Blauth e.K. – Verl",
      "type": "Registerbekanntmachung nach dem Umwandlungsgesetz",
      "state": "Nordrhein-Westfalen",
      "amtsgericht": "Amtsgericht Gütersloh",
      "registernummer": "HRA 8614",
      "registerart": "HRA",
      "company_name": "Ansgar Blauth e.K.",
      "company_seat": "Verl",
      "details": "13.11.2025 (Bekanntmachungsdatum)\n\nNordrhein-Westfalen Amtsgericht Gütersloh HRA 8614\nRegisterbekanntmachung nach dem Umwandlungsgesetz 13.11.2025 (Eintragungsdatum)\n\nAnsgar Blauth e.K.\nEinzelkaufmann / Einzelkauffrau\nVerl\n\nDen Gläubigern der an der Ausgliederung beteiligten Rechtsträger ist, wenn sie binnen sechs Monaten nach dem Tag, an dem die Eintragung der Ausgliederung in das Register des Sitzes desjenigen Rechtsträgers, dessen Gläubiger sie sind, nach § 19 Absatz 3 UmwG als bekanntgemacht gilt, ihren Anspruch nach Grund und Höhe schriftlich anmelden, Sicherheit zu leisten, soweit sie nicht Befriedigung verlangen können. Dieses Recht steht den Gläubigern jedoch nur zu, wenn sie glaubhaft machen, dass durch die Ausgliederung die Erfüllung ihrer Forderung gefährdet wird."
    },
    {
      "date": "2025-11-13",
      "id": "137279",
      "original_text": "Registerbekanntmachung nach dem Umwandlungsgesetz\nNordrhein-Westfalen Amtsgericht Krefeld HRB 16344\nFUJIFILM IMAGING PRODUCTS & SOLUTIONS Verwaltungs GmbH – Willich",
      "type": "Registerbekanntmachung nach dem Umwandlungsgesetz",
      "state": "Nordrhein-Westfalen",
      "amtsgericht": "Amtsgericht Krefeld",
      "registernummer": "HRB 16344",
      "registerart": "HRB",
      "company_name": "FUJIFILM IMAGING PRODUCTS & SOLUTIONS Verwaltungs GmbH",
      "company_seat": "Willich",
      "details": "13.11.2025 (Bekanntmachungsdatum)\n\nNordrhein-Westfalen Amtsgericht Krefeld HRB 16344\nRegisterbekanntmachung nach dem Umwandlungsgesetz 13.11.2025 (Eintragungsdatum)\n\nFUJIFILM IMAGING PRODUCTS & SOLUTIONS Verwaltungs GmbH\nGesellschaft mit beschränkter Haftung\nWillich\n\nDen Gläubigern der an der Verschmelzung beteiligten Rechtsträger ist, wenn sie binnen sechs Monaten nach dem Tag, an dem die Eintragung der Verschmelzung in das Register des Sitzes desjenigen Rechtsträgers, dessen Gläubiger sie sind, nach § 19 Absatz 3 UmwG als bekanntgemacht gilt, ihren Anspruch nach Grund und Höhe schriftlich anmelden, Sicherheit zu leisten, soweit sie nicht Befriedigung verlangen können. Dieses Recht steht den Gläubigern jedoch nur zu, wenn sie glaubhaft machen, dass durch die Verschmelzung die Erfüllung ihrer Forderung gefährdet wird."
    },
    {
      "date": "2025-11-13",
      "id": "137280",
      "original_text": "Löschungsankündigung\nNordrhein-Westfalen Amtsgericht Recklinghausen HRB 8106\nL.P.I. Verwaltungs GmbH – Recklinghausen",
      "type": "Löschungsankündigung",
      "state": "Nordrhein-Westfalen",
      "amtsgericht": "Amtsgericht Recklinghausen",
      "registernummer": "HRB 8106",
      "registerart": "HRB",
      "company_name": "L.P.I. Verwaltungs GmbH",
      "company_seat": "Recklinghausen",
      "details": "13.11.2025 (Bekanntmachungsdatum)\n\nNordrhein-Westfalen Amtsgericht Recklinghausen HRB 8106\nLöschungsankündigung\n\nL.P.I. Verwaltungs GmbH\nGesellschaft mit beschränkter Haftung\nRecklinghausen\n\nDas Registergericht beabsichtigt die Gesellschaft von Amts wegen nach § 394 FamFG zu löschen. Die Frist zur Erhebung eines Widerspruchs ist auf drei Monate festgesetzt."
    },
    {
      "date": "2025-11-13",
      "id": "137281",
      "original_text": "Registerbekanntmachung nach dem Umwandlungsgesetz\nNordrhein-Westfalen Amtsgericht Arnsberg HRA 9403\nWaldemar Wiebe Schweißtechnik e. K. – Meschede",
      "type": "Registerbekanntmachung nach dem Umwandlungsgesetz",
      "state": "Nordrhein-Westfalen",
      "amtsgericht": "Amtsgericht Arnsberg",
      "registernummer": "HRA 9403",
      "registerart": "HRA",
      "company_name": "Waldemar Wiebe Schweißtechnik e. K.",
      "company_seat": "Meschede",
      "details": "13.11.2025 (Bekanntmachungsdatum)\n\nNordrhein-Westfalen Amtsgericht Arnsberg HRA 9403\nRegisterbekanntmachung nach dem Umwandlungsgesetz 13.11.2025 (Eintragungsdatum)\n\nWaldemar Wiebe Schweißtechnik e. K.\nEinzelkaufmann / Einzelkauffrau\nMeschede\n\nDen Gläubigern der an der Ausgliederung beteiligten Rechtsträger ist, wenn sie binnen sechs Monaten nach dem Tag, an dem die Eintragung der Ausgliederung in das Register des Sitzes derjenigen Rechtsträger deren Gläubiger sie sind, nach § 19 Absatz 3 UmwG als bekanntgemacht gilt, ihren Anspruch nach Grund und Höhe schriftlich anmelden, Sicherheit zu leisten, soweit sie nicht Befriedigung verlangen können. Dieses Recht steht den Gläubigern jedoch nur zu, wenn sie glaubhaft machen, dass durch die Ausgliederung die Erfüllung ihrer Forderung gefährdet wird."
    },
    {
      "date": "2025-11-13",
      "id": "137282",
      "original_text": "Registerbekanntmachung nach dem Umwandlungsgesetz\nNordrhein-Westfalen Amtsgericht Gütersloh HRB 14066\nNPLAY GmbH – Verl",
      "type": "Registerbekanntmachung nach dem Umwandlungsgesetz",
      "state": "Nordrhein-Westfalen",
      "amtsgericht": "Amtsgericht Gütersloh",
      "registernummer": "HRB 14066",
      "registerart": "HRB",
      "company_name": "NPLAY GmbH",
      "company_seat": "Verl",
      "details": "13.11.2025 (Bekanntmachungsdatum)\n\nNordrhein-Westfalen Amtsgericht Gütersloh HRB 14066\nRegisterbekanntmachung nach dem Umwandlungsgesetz 13.11.2025 (Eintragungsdatum)\n\nNPLAY GmbH\nGesellschaft mit beschränkter Haftung\nVerl\n\nDen Gläubigern der an der Ausgliederung beteiligten Rechtsträger ist, wenn sie binnen sechs Monaten nach dem Tag, an dem die Eintragung der Ausgliederung in das Register des Sitzes desjenigen Rechtsträgers, dessen Gläubiger sie sind, nach § 19 Absatz 3 UmwG als bekanntgemacht gilt, ihren Anspruch nach Grund und Höhe schriftlich anmelden, Sicherheit zu leisten, soweit sie nicht Befriedigung verlangen können. Dieses Recht steht den Gläubigern jedoch nur zu, wenn sie glaubhaft machen, dass durch die Ausgliederung die Erfüllung ihrer Forderung gefährdet wird."
    },
    {
      "date": "2025-11-13",
      "id": "137283",
      "original_text": "Registerbekanntmachung nach dem Umwandlungsgesetz\nNordrhein-Westfalen Amtsgericht Arnsberg HRA 9402\nJurij Wiebe Schweißtechnik e. K. – Arnsberg",
      "type": "Registerbekanntmachung nach dem Umwandlungsgesetz",
      "state": "Nordrhein-Westfalen",
      "amtsgericht": "Amtsgericht Arnsberg",
      "registernummer": "HRA 9402",
      "registerart": "HRA",
      "company_name": "Jurij Wiebe Schweißtechnik e. K.",
      "company_seat": "Arnsberg",
      "details": "13.11.2025 (Bekanntmachungsdatum)\n\nNordrhein-Westfalen Amtsgericht Arnsberg HRA 9402\nRegisterbekanntmachung nach dem Umwandlungsgesetz 13.11.2025 (Eintragungsdatum)\n\nJurij Wiebe Schweißtechnik e. K.\nEinzelkaufmann / Einzelkauffrau\nArnsberg\n\nDen Gläubigern der an der Ausgliederung beteiligten Rechtsträger ist, wenn sie binnen sechs Monaten nach dem Tag, an dem die Eintragung der Ausgliederung in das Register des Sitzes desjenigen Rechtsträgers, dessen Gläubiger sie sind, nach § 19 Absatz 3 UmwG als bekanntgemacht gilt, ihren Anspruch nach Grund und Höhe schriftlich anmelden, Sicherheit zu leisten, soweit sie nicht Befriedigung verlangen können. Dieses Recht steht den Gläubigern jedoch nur zu, wenn sie glaubhaft machen, dass durch die Ausgliederung die Erfüllung ihrer Forderung gefährdet wird."
    },
    {
      "date": "2025-11-13",
      "id": "137284",
      "original_text": "Registerbekanntmachung nach dem Umwandlungsgesetz\nNordrhein-Westfalen Amtsgericht Hagen HRA 1369\nMeister e.K. – Hagen-Rummenohl",
      "type": "Registerbekanntmachung nach dem Umwandlungsgesetz",
      "state": "Nordrhein-Westfalen",
      "amtsgericht": "Amtsgericht Hagen",
      "registernummer": "HRA 1369",
      "registerart": "HRA",
      "company_name": "Meister e.K.",
      "company_seat": "Hagen-Rummenohl",
      "details": "13.11.2025 (Bekanntmachungsdatum)\n\nNordrhein-Westfalen Amtsgericht Hagen HRA 1369\nRegisterbekanntmachung nach dem Umwandlungsgesetz 13.11.2025 (Eintragungsdatum)\n\nMeister e.K.\nEinzelkaufmann / Einzelkauffrau\nHagen-Rummenohl\n\nDen Gläubigern der an der Ausgliederung beteiligten Rechtsträger ist, wenn sie binnen sechs Monaten nach dem Tag, an dem die Eintragung der Ausgliederung in das Register des Sitzes derjenigen Rechtsträger deren Gläubiger sie sind, nach § 19 Absatz 3 UmwG als bekanntgemacht gilt, ihren Anspruch nach Grund und Höhe schriftlich anmelden, Sicherheit zu leisten, soweit sie nicht Befriedigung verlangen können. Dieses Recht steht den Gläubigern jedoch nur zu, wenn sie glaubhaft machen, dass durch die Ausgliederung die Erfüllung ihrer Forderung gefährdet wird."
    },
    {
      "date": "2025-11-13",
      "id": "137285",
      "original_text": "Löschungsankündigung\nThüringen Amtsgericht Jena HRB 306618\nVolleyball Sonneberg GmbH – Sonneberg",
      "type": "Löschungsankündigung",
      "state": "Thüringen",
      "amtsgericht": "Amtsgericht Jena",
      "registernummer": "HRB 306618",
      "registerart": "HRB",
      "company_name": "Volleyball Sonneberg GmbH",
      "company_seat": "Sonneberg",
      "details": "13.11.2025 (Bekanntmachungsdatum)\n\nThüringen Amtsgericht Jena HRB 306618\nLöschungsankündigung\n\nVolleyball Sonneberg GmbH\nGesellschaft mit beschränkter Haftung\nSonneberg\n\nDas Registergericht beabsichtigt, die im Handelsregister eingetragene Gesellschaft wegen Vermögenslosigkeit nach § 394 FamFG von Amts wegen zu löschen. Die Frist zur Erhebung eines Widerspruchs gegen die beabsichtigte Löschung wird auf 6 Wochen festgesetzt."
    },
    {
      "date": "2025-11-13",
      "id": "137286",
      "original_text": "Registerbekanntmachung nach dem Umwandlungsgesetz\nNordrhein-Westfalen Amtsgericht Köln HRB 76999\nBrandLite GmbH – Köln",
      "type": "Registerbekanntmachung nach dem Umwandlungsgesetz",
      "state": "Nordrhein-Westfalen",
      "amtsgericht": "Amtsgericht Köln",
      "registernummer": "HRB 76999",
      "registerart": "HRB",
      "company_name": "BrandLite GmbH",
      "company_seat": "Köln",
      "details": "13.11.2025 (Bekanntmachungsdatum)\n\nNordrhein-Westfalen Amtsgericht Köln HRB 76999\nRegisterbekanntmachung nach dem Umwandlungsgesetz 13.11.2025 (Eintragungsdatum)\n\nBrandLite GmbH\nGesellschaft mit beschränkter Haftung\nKöln\n\nDen Gläubigern der an der Verschmelzung beteiligten Rechtsträger ist, wenn sie binnen sechs Monaten nach dem Tag, an dem die Eintragung der Verschmelzung in das Register des Sitzes desjenigen Rechtsträgers, dessen Gläubiger sie sind, nach § 19 Absatz 3 UmwG als bekanntgemacht gilt, ihren Anspruch nach Grund und Höhe schriftlich anmelden, Sicherheit zu leisten, soweit sie nicht Befriedigung verlangen können. Dieses Recht steht den Gläubigern jedoch nur zu, wenn sie glaubhaft machen, dass durch die Verschmelzung die Erfüllung ihrer Forderung gefährdet wird."
    },
    {
      "date": "2025-11-13",
      "id": "137287",
      "original_text": "Registerbekanntmachung nach dem Umwandlungsgesetz\nNordrhein-Westfalen Amtsgericht Köln HRB 89905\nKings & Queens GmbH – Köln",
      "type": "Registerbekanntmachung nach dem Umwandlungsgesetz",
      "state": "Nordrhein-Westfalen",
      "amtsgericht": "Amtsgericht Köln",
      "registernummer": "HRB 89905",
      "registerart": "HRB",
      "company_name": "Kings & Queens GmbH",
      "company_seat": "Köln",
      "details": "13.11.2025 (Bekanntmachungsdatum)\n\nNordrhein-Westfalen Amtsgericht Köln HRB 89905\nRegisterbekanntmachung nach dem Umwandlungsgesetz 13.11.2025 (Eintragungsdatum)\n\nKings & Queens GmbH\nGesellschaft mit beschränkter Haftung\nKöln\n\nDen Gläubigern der an der Verschmelzung beteiligten Rechtsträger ist, wenn sie binnen sechs Monaten nach dem Tag, an dem die Eintragung der Verschmelzung in das Register des Sitzes desjenigen Rechtsträgers, dessen Gläubiger sie sind, nach § 19 Absatz 3 UmwG als bekanntgemacht gilt, ihren Anspruch nach Grund und Höhe schriftlich anmelden, Sicherheit zu leisten, soweit sie nicht Befriedigung verlangen können. Dieses Recht steht den Gläubigern jedoch nur zu, wenn sie glaubhaft machen, dass durch die Verschmelzung die Erfüllung ihrer Forderung gefährdet wird."
    },
    {
      "date": "2025-11-13",
      "id": "137288",
      "original_text": "Sonstige Registerbekanntmachung\nHessen Amtsgericht Offenbach am Main VR 3722\nFörderverein Liebfrauen – Langen (Hessen)",
      "type": "Sonstige Registerbekanntmachung",
      "state": "Hessen",
      "amtsgericht": "Amtsgericht Offenbach am Main",
      "registernummer": "VR 3722",
      "registerart": "VR",
      "company_name": "Förderverein Liebfrauen",
      "company_seat": "Langen (Hessen)",
      "details": "13.11.2025 (Bekanntmachungsdatum)\n\nHessen Amtsgericht Offenbach am Main VR 3722\nSonstige Registerbekanntmachung 13.11.2025 (Eintragungsdatum)\n\nFörderverein Liebfrauen\neingetragener Verein\nLangen (Hessen)\n\nDer Verein ist aufgelöst."
    },
    {
      "date": "2025-11-13",
      "id": "137289",
      "original_text": "Registerbekanntmachung nach dem Umwandlungsgesetz\nHessen Amtsgericht Frankfurt am Main HRA 43280\nWISAG Facility Management Hessen GmbH & Co. KG – Frankfurt am Main",
      "type": "Registerbekanntmachung nach dem Umwandlungsgesetz",
      "state": "Hessen",
      "amtsgericht": "Amtsgericht Frankfurt am Main",
      "registernummer": "HRA 43280",
      "registerart": "HRA",
      "company_name": "WISAG Facility Management Hessen GmbH & Co. KG",
      "company_seat": "Frankfurt am Main",
      "details": "13.11.2025 (Bekanntmachungsdatum)\n\nHessen Amtsgericht Frankfurt am Main HRA 43280\nRegisterbekanntmachung nach dem Umwandlungsgesetz 13.11.2025 (Eintragungsdatum)\n\nWISAG Facility Management Hessen GmbH & Co. KG\nKommanditgesellschaft\nFrankfurt am Main\n\nDen Gläubigern der an der Verschmelzung beteiligten Rechtsträger ist, wenn sie binnen sechs Monaten nach dem Tag, an dem die Eintragung der Verschmelzung in das Register des Sitzes desjenigen Rechtsträgers, dessen Gläubiger sie sind, nach § 19 Absatz 3 UmwG bekannt gemacht worden ist, ihren Anspruch nach Grund und Höhe schriftlich anmelden, Sicherheit zu leisten, soweit sie nicht Befriedigung verlangen können. Dieses Recht steht den Gläubigern jedoch nur zu, wenn sie glaubhaft machen, dass durch die Verschmelzung die Erfüllung ihrer Forderung gefährdet wird."
    },
    {
      "date": "2025-11-13",
      "id": "137290",
      "original_text": "Einreichung neuer Dokumente\nHessen Amtsgericht Königstein HRB 5437\nProcter & Gamble Germany Holding GmbH – Schwalbach am Taunus",
      "type": "Einreichung neuer Dokumente",
      "state": "Hessen",
      "amtsgericht": "Amtsgericht Königstein",
      "registernummer": "HRB 5437",
      "registerart": "HRB",
      "company_name": "Procter & Gamble Germany Holding GmbH",
      "company_seat": "Schwalbach am Taunus",
      "details": "13.11.2025 (Bekanntmachungsdatum)\n\nHessen Amtsgericht Königstein HRB 5437\nEinreichung neuer Dokumente 13.11.2025 (Eintragungsdatum)\n\nProcter & Gamble Germany Holding GmbH\nGesellschaft mit beschränkter Haftung\nSchwalbach am Taunus\n\nDurch eine Änderung in den Personen der Aufsichtsratsmitglieder ist eine Liste der Mitglieder des Aufsichtsrates zum Handelsregister eingereicht worden."
    },
    {
      "date": "2025-11-13",
      "id": "137291",
      "original_text": "Einreichung neuer Dokumente\nHessen Amtsgericht Frankfurt am Main HRB 29391\nNomura Asset Management Europe KVG mbH – Frankfurt am Main",
      "type": "Einreichung neuer Dokumente",
      "state": "Hessen",
      "amtsgericht": "Amtsgericht Frankfurt am Main",
      "registernummer": "HRB 29391",
      "registerart": "HRB",
      "company_name": "Nomura Asset Management Europe KVG mbH",
      "company_seat": "Frankfurt am Main",
      "details": "13.11.2025 (Bekanntmachungsdatum)\n\nHessen Amtsgericht Frankfurt am Main HRB 29391\nEinreichung neuer Dokumente 13.11.2025 (Eintragungsdatum)\n\nNomura Asset Management Europe KVG mbH\nGesellschaft mit beschränkter Haftung\nFrankfurt am Main\n\nDurch eine Änderung in den Personen der Aufsichtsratsmitglieder ist eine Liste der Mitglieder des Aufsichtsrates zum Handelsregister eingereicht worden."
    },
    {
      "date": "2025-11-13",
      "id": "137292",
      "original_text": "Löschungsankündigung\nHessen Amtsgericht Frankfurt am Main HRB 109977\nget green plus GmbH – Frankfurt am Main",
      "type": "Löschungsankündigung",
      "state": "Hessen",
      "amtsgericht": "Amtsgericht Frankfurt am Main",
      "registernummer": "HRB 109977",
      "registerart": "HRB",
      "company_name": "get green plus GmbH",
      "company_seat": "Frankfurt am Main",
      "details": "13.11.2025 (Bekanntmachungsdatum)\n\nHessen Amtsgericht Frankfurt am Main HRB 109977\nLöschungsankündigung\n\nget green plus GmbH\nGesellschaft mit beschränkter Haftung\nFrankfurt am Main\n\nDas Registergericht beabsichtigt die im Handelsregister eingetragene Gesellschaft von Amts wegen nach § 394 FamFG zu löschen. Die Frist zur Erhebung eines Widerspruchs gegen die beabsichtigte Löschung wird auf 1 Monate festgesetzt."
    },
    {
      "date": "2025-11-13",
      "id": "137293",
      "original_text": "Registerbekanntmachung nach dem Umwandlungsgesetz\nHessen Amtsgericht Frankfurt am Main HRA 43280\nWISAG Facility Management Hessen GmbH & Co. KG – Frankfurt am Main",
      "type": "Registerbekanntmachung nach dem Umwandlungsgesetz",
      "state": "Hessen",
      "amtsgericht": "Amtsgericht Frankfurt am Main",
      "registernummer": "HRA 43280",
      "registerart": "HRA",
      "company_name": "WISAG Facility Management Hessen GmbH & Co. KG",
      "company_seat": "Frankfurt am Main",
      "details": "13.11.2025 (Bekanntmachungsdatum)\n\nHessen Amtsgericht Frankfurt am Main HRA 43280\nRegisterbekanntmachung nach dem Umwandlungsgesetz 13.11.2025 (Eintragungsdatum)\n\nWISAG Facility Management Hessen GmbH & Co. KG\nKommanditgesellschaft\nFrankfurt am Main\n\nDen Gläubigern der an der Verschmelzung beteiligten Rechtsträger ist, wenn sie binnen sechs Monaten nach dem Tag, an dem die Eintragung der Verschmelzung in das Register des Sitzes desjenigen Rechtsträgers, dessen Gläubiger sie sind, nach § 19 Absatz 3 UmwG bekannt gemacht worden ist, ihren Anspruch nach Grund und Höhe schriftlich anmelden, Sicherheit zu leisten, soweit sie nicht Befriedigung verlangen können. Dieses Recht steht den Gläubigern jedoch nur zu, wenn sie glaubhaft machen, dass durch die Verschmelzung die Erfüllung ihrer Forderung gefährdet wird."
    },
    {
      "date": "2025-11-13",
      "id": "137294",
      "original_text": "Registerbekanntmachung nach dem Umwandlungsgesetz\nHessen Amtsgericht Frankfurt am Main HRA 52661\nWISAG Facility Management Hessen Nord GmbH & Co. KG – Frankfurt am Main",
      "type": "Registerbekanntmachung nach dem Umwandlungsgesetz",
      "state": "Hessen",
      "amtsgericht": "Amtsgericht Frankfurt am Main",
      "registernummer": "HRA 52661",
      "registerart": "HRA",
      "company_name": "WISAG Facility Management Hessen Nord GmbH & Co. KG",
      "company_seat": "Frankfurt am Main",
      "details": "13.11.2025 (Bekanntmachungsdatum)\n\nHessen Amtsgericht Frankfurt am Main HRA 52661\nRegisterbekanntmachung nach dem Umwandlungsgesetz 13.11.2025 (Eintragungsdatum)\n\nWISAG Facility Management Hessen Nord GmbH & Co. KG\nKommanditgesellschaft\nFrankfurt am Main\n\nDen Gläubigern der an der Verschmelzung beteiligten Rechtsträger ist, wenn sie binnen sechs Monaten nach dem Tag, an dem die Eintragung der Verschmelzung in das Register des Sitzes desjenigen Rechtsträgers, dessen Gläubiger sie sind, nach § 19 Absatz 3 UmwG bekannt gemacht worden ist, ihren Anspruch nach Grund und Höhe schriftlich anmelden, Sicherheit zu leisten, soweit sie nicht Befriedigung verlangen können. Dieses Recht steht den Gläubigern jedoch nur zu, wenn sie glaubhaft machen, dass durch die Verschmelzung die Erfüllung ihrer Forderung gefährdet wird."
    },
    {
      "date": "2025-11-13",
      "id": "137295",
      "original_text": "Löschungsankündigung\nHessen Amtsgericht Frankfurt am Main HRB 108687\nLingda GmbH – Eschborn",
      "type": "Löschungsankündigung",
      "state": "Hessen",
      "amtsgericht": "Amtsgericht Frankfurt am Main",
      "registernummer": "HRB 108687",
      "registerart": "HRB",
      "company_name": "Lingda GmbH",
      "company_seat": "Eschborn",
      "details": "13.11.2025 (Bekanntmachungsdatum)\n\nHessen Amtsgericht Frankfurt am Main HRB 108687\nLöschungsankündigung\n\nLingda GmbH\nGesellschaft mit beschränkter Haftung\nEschborn\n\nEs ist beabsichtigt, die Gesellschaft wegen Vermögenslosigkeit gemäß § 394 FamFG von Amts wegen im Handelsregister zu löschen. Hiergegen kann innerhalb eines Monats nach dieser Veröffentlichung Widerspruch bei dem Amtsgericht Frankfurt am Main eingelegt werden."
    },
    {
      "date": "2025-11-13",
      "id": "137296",
      "original_text": "Löschungsankündigung\nHessen Amtsgericht Wetzlar HRB 8887\nRosco Fahrzeugtransporte Verschiffung & Autohandel UG (haftungsbeschränkt) – Hüttenberg",
      "type": "Löschungsankündigung",
      "state": "Hessen",
      "amtsgericht": "Amtsgericht Wetzlar",
      "registernummer": "HRB 8887",
      "registerart": "HRB",
      "company_name": "Rosco Fahrzeugtransporte Verschiffung & Autohandel UG (haftungsbeschränkt)",
      "company_seat": "Hüttenberg",
      "details": "13.11.2025 (Bekanntmachungsdatum)\n\nHessen Amtsgericht Wetzlar HRB 8887\nLöschungsankündigung\n\nRosco Fahrzeugtransporte Verschiffung & Autohandel UG (haftungsbeschränkt)\nGesellschaft mit beschränkter Haftung\nHüttenberg\n\nDas Registergericht beabsichtigt die im Handelsregister eingetragene Gesellschaft von Amts wegen nach § 394 FamFG zu löschen. Die Frist zur Erhebung eines Widerspruchs gegen die beabsichtigte Löschung wird auf 3 Monate festgesetzt."
    },
    {
      "date": "2025-11-13",
      "id": "137297",
      "original_text": "Löschungsankündigung\nHessen Amtsgericht Wetzlar HRB 5709\nPhicom GmbH – Ehringshausen-Kölschhausen",
      "type": "Löschungsankündigung",
      "state": "Hessen",
      "amtsgericht": "Amtsgericht Wetzlar",
      "registernummer": "HRB 5709",
      "registerart": "HRB",
      "company_name": "Phicom GmbH",
      "company_seat": "Ehringshausen-Kölschhausen",
      "details": "13.11.2025 (Bekanntmachungsdatum)\n\nHessen Amtsgericht Wetzlar HRB 5709\nLöschungsankündigung 13.11.2025 (Eintragungsdatum)\n\nPhicom GmbH\nGesellschaft mit beschränkter Haftung\nEhringshausen-Kölschhausen\n\nDas Registergericht beabsichtigt die im Handelsregister eingetragene Gesellschaft von Amts wegen nach § 394 FamFG zu löschen. Die Frist zur Erhebung eines Widerspruchs gegen die beabsichtigte Löschung wird auf 3 Monate festgesetzt."
    },
    {
      "date": "2025-11-13",
      "id": "137298",
      "original_text": "Löschungsankündigung\nHessen Amtsgericht Wiesbaden HRB 32288\nARAS GmbH – Oestrich-Winkel",
      "type": "Löschungsankündigung",
      "state": "Hessen",
      "amtsgericht": "Amtsgericht Wiesbaden",
      "registernummer": "HRB 32288",
      "registerart": "HRB",
      "company_name": "ARAS GmbH",
      "company_seat": "Oestrich-Winkel",
      "details": "13.11.2025 (Bekanntmachungsdatum)\n\nHessen Amtsgericht Wiesbaden HRB 32288\nLöschungsankündigung\n\nARAS GmbH\nGesellschaft mit beschränkter Haftung\nOestrich-Winkel\n\nDas Registergericht beabsichtigt die im Handelsregister eingetragene Gesellschaft von Amts wegen nach § 394 FamFG zu löschen. Die Frist zur Erhebung eines Widerspruchs gegen die beabsichtigte Löschung wird auf 3 Monate festgesetzt."
    }
  ]
}