{
  "date": "2024-12-12",
  "date_of_scrape": "2024-12-13T04:07:49.384Z",
  "tool_version": "0.2.0",
  "number_of_announcements": 126,
  "announcements": [
    {
      "date": "2024-12-12",
      "id": "67",
      "original_text": "Sonderregisterbekanntmachung OHNE Bezug zum elektr. Register\nThüringen Amtsgericht Eisenach\n2AR8/24\nFörderverein der Staatlichen Grundschule \"Fritz Erbe\" e.V.",
      "type": "Sonderregisterbekanntmachung OHNE Bezug zum elektr. Register",
      "state": "Thüringen",
      "amtsgericht": "Amtsgericht Eisenach",
      "company_name": "Förderverein der Staatlichen Grundschule \"Fritz Erbe\" e.V.",
      "sonderegister_referenz": "2AR8/24",
      "details": "12.12.2024 (Bekanntmachungsdatum)\n\nThüringen Amtsgericht Eisenach\n2AR8/24\nSonderregisterbekanntmachung OHNE Bezug zum elektr. Register\n\nFörderverein der Staatlichen Grundschule \"Fritz Erbe\" e.V.\n\nFörderverein der Staatlichen Grundschule \"Fritz Erbe\" e.V. am 17.6.24 und 22.10.24. Sitz Gerstungen, Neugründung"
    },
    {
      "date": "2024-12-12",
      "id": "96200",
      "original_text": "Löschungsankündigung\nBayern Amtsgericht München HRB 263085\nIndividualBau GmbH – München",
      "type": "Löschungsankündigung",
      "state": "Bayern",
      "amtsgericht": "Amtsgericht München",
      "registernummer": "HRB 263085",
      "registerart": "HRB",
      "company_name": "IndividualBau GmbH",
      "company_seat": "München",
      "details": "12.12.2024 (Bekanntmachungsdatum)\n\nBayern Amtsgericht München HRB 263085\nLöschungsankündigung\n\nIndividualBau GmbH\nGesellschaft mit beschränkter Haftung\nMünchen\n\nDas Registergericht beabsichtigt, den im Handelsregister eingetragenen Geschäftsführer wegen fehlender Eignung nach § 395 FamFG zu löschen. Die Frist zur Erhebung eines Widerspruchs ist auf drei Monate festgesetzt."
    },
    {
      "date": "2024-12-12",
      "id": "96201",
      "original_text": "Einreichung neuer Dokumente\nBayern Amtsgericht München HRB 242437\nLear Corporation Engineering GmbH – Oberding",
      "type": "Einreichung neuer Dokumente",
      "state": "Bayern",
      "amtsgericht": "Amtsgericht München",
      "registernummer": "HRB 242437",
      "registerart": "HRB",
      "company_name": "Lear Corporation Engineering GmbH",
      "company_seat": "Oberding",
      "details": "12.12.2024 (Bekanntmachungsdatum)\n\nBayern Amtsgericht München HRB 242437\nEinreichung neuer Dokumente 11.12.2024 (Eintragungsdatum)\n\nLear Corporation Engineering GmbH\nGesellschaft mit beschränkter Haftung\nOberding\n\nDem Amtsgericht München -Registergericht- ist eine Liste der Mitglieder des Aufsichtsrats eingereicht worden, § 52 Abs. 3 S. 2 GmbHG."
    },
    {
      "date": "2024-12-12",
      "id": "96202",
      "original_text": "Registerbekanntmachung nach dem Umwandlungsgesetz\nBayern Amtsgericht Aschaffenburg VR 200406\nSV UNSU Karate Mömlingen e.V. – Mömlingen",
      "type": "Registerbekanntmachung nach dem Umwandlungsgesetz",
      "state": "Bayern",
      "amtsgericht": "Amtsgericht Aschaffenburg",
      "registernummer": "VR 200406",
      "registerart": "VR",
      "company_name": "SV UNSU Karate Mömlingen e.V.",
      "company_seat": "Mömlingen",
      "details": "12.12.2024 (Bekanntmachungsdatum)\n\nBayern Amtsgericht Aschaffenburg VR 200406\nRegisterbekanntmachung nach dem Umwandlungsgesetz 11.12.2024 (Eintragungsdatum)\n\nSV UNSU Karate Mömlingen e.V.\neingetragener Verein\nMömlingen\n\nDen Gläubigern der an der Verschmelzung beteiligten Rechtsträger ist, wenn sie binnen sechs Monaten nach dem Tag, an dem die Eintragung der Verschmelzung in das Register des Sitzes desjenigen Rechtsträgers, dessen Gläubiger sie sind, nach § 19 Abs. 3 UmwG als bekannt gemacht gilt, ihren Anspruch nach Grund und Höhe schriftlich anmelden, Sicherheit zu leisten, soweit sie nicht Befriedigung verlangen können. Dieses Recht steht den Gläubigern jedoch nur zu, wenn sie glaubhaft machen, dass durch die Verschmelzung die Erfüllung ihrer Forderung gefährdet wird."
    },
    {
      "date": "2024-12-12",
      "id": "96203",
      "original_text": "Registerbekanntmachung nach dem Umwandlungsgesetz\nBayern Amtsgericht München HRB 246844\nprivadent GmbH – Poing",
      "type": "Registerbekanntmachung nach dem Umwandlungsgesetz",
      "state": "Bayern",
      "amtsgericht": "Amtsgericht München",
      "registernummer": "HRB 246844",
      "registerart": "HRB",
      "company_name": "privadent GmbH",
      "company_seat": "Poing",
      "details": "12.12.2024 (Bekanntmachungsdatum)\n\nBayern Amtsgericht München HRB 246844\nRegisterbekanntmachung nach dem Umwandlungsgesetz 11.12.2024 (Eintragungsdatum)\n\nprivadent GmbH\nGesellschaft mit beschränkter Haftung\nPoing\n\nDen Gläubigern der an der Verschmelzung beteiligten Rechtsträger ist, wenn sie binnen sechs Monaten nach dem Tag, an dem die Eintragung der Verschmelzung in das Register des Sitzes desjenigen Rechtsträgers, dessen Gläubiger sie sind, nach § 19 Abs. 3 UmwG als bekannt gemacht gilt, ihren Anspruch nach Grund und Höhe schriftlich anmelden, Sicherheit zu leisten, soweit sie nicht Befriedigung verlangen können. Dieses Recht steht den Gläubigern jedoch nur zu, wenn sie glaubhaft machen, dass durch die Verschmelzung die Erfüllung ihrer Forderung gefährdet wird."
    },
    {
      "date": "2024-12-12",
      "id": "96204",
      "original_text": "Löschungsankündigung\nBayern Amtsgericht Landshut HRB 5421\nthermo solar AG – Landshut",
      "type": "Löschungsankündigung",
      "state": "Bayern",
      "amtsgericht": "Amtsgericht Landshut",
      "registernummer": "HRB 5421",
      "registerart": "HRB",
      "company_name": "thermo solar AG",
      "company_seat": "Landshut",
      "details": "12.12.2024 (Bekanntmachungsdatum)\n\nBayern Amtsgericht Landshut HRB 5421\nLöschungsankündigung\n\nthermo solar AG\nAktiengesellschaft\nLandshut\n\nDas Registergericht beabsichtigt, die im Handelsregister eingetragene Gesellschaft wegen Vermögenslosigkeit von Amts wegen nach § 394 FamFG zu löschen. Die Frist zur Erhebung eines Widerspruchs ist auf einen Monat festgesetzt."
    },
    {
      "date": "2024-12-12",
      "id": "96205",
      "original_text": "Löschungsankündigung\nBayern Amtsgericht München HRB 183016\nMiaSolé GmbH – München",
      "type": "Löschungsankündigung",
      "state": "Bayern",
      "amtsgericht": "Amtsgericht München",
      "registernummer": "HRB 183016",
      "registerart": "HRB",
      "company_name": "MiaSolé GmbH",
      "company_seat": "München",
      "details": "12.12.2024 (Bekanntmachungsdatum)\n\nBayern Amtsgericht München HRB 183016\nLöschungsankündigung 11.12.2024 (Eintragungsdatum)\n\nMiaSolé GmbH\nGesellschaft mit beschränkter Haftung\nMünchen\n\nDas Registergericht beabsichtigt, die im Handelsregister eingetragene Gesellschaft wegen Vermögenslosigkeit von Amts wegen nach § 394 FamFG zu löschen. Die Frist zur Erhebung eines Widerspruchs ist auf drei Monate festgesetzt."
    },
    {
      "date": "2024-12-12",
      "id": "96206",
      "original_text": "Einreichung neuer Dokumente\nBayern Amtsgericht München HRB 57531\nBKL Baukran Logistik GmbH – Forstinning",
      "type": "Einreichung neuer Dokumente",
      "state": "Bayern",
      "amtsgericht": "Amtsgericht München",
      "registernummer": "HRB 57531",
      "registerart": "HRB",
      "company_name": "BKL Baukran Logistik GmbH",
      "company_seat": "Forstinning",
      "details": "12.12.2024 (Bekanntmachungsdatum)\n\nBayern Amtsgericht München HRB 57531\nEinreichung neuer Dokumente\n\nBKL Baukran Logistik GmbH\nGesellschaft mit beschränkter Haftung\nForstinning\n\nDem Amtsgericht München -Registergericht- ist eine Liste der Mitglieder des Aufsichtsrats eingereicht worden, § 52 Abs. 3 S. 2 GmbHG."
    },
    {
      "date": "2024-12-12",
      "id": "96207",
      "original_text": "Löschungsankündigung\nBayern Amtsgericht München HRB 252887\nPS-Kurier UG (haftungsbeschränkt) – München",
      "type": "Löschungsankündigung",
      "state": "Bayern",
      "amtsgericht": "Amtsgericht München",
      "registernummer": "HRB 252887",
      "registerart": "HRB",
      "company_name": "PS-Kurier UG (haftungsbeschränkt)",
      "company_seat": "München",
      "details": "12.12.2024 (Bekanntmachungsdatum)\n\nBayern Amtsgericht München HRB 252887\nLöschungsankündigung\n\nPS-Kurier UG (haftungsbeschränkt)\nGesellschaft mit beschränkter Haftung\nMünchen\n\nDas Registergericht beabsichtigt, die im Handelsregister eingetragene Gesellschaft wegen Vermögenslosigkeit von Amts wegen nach § 394 FamFG zu löschen. Die Frist zur Erhebung eines Widerspruchs ist auf drei Monate festgesetzt."
    },
    {
      "date": "2024-12-12",
      "id": "96208",
      "original_text": "Registerbekanntmachung nach dem Umwandlungsgesetz\nBayern Amtsgericht München HRB 238746\nFinparx Holding GmbH – München",
      "type": "Registerbekanntmachung nach dem Umwandlungsgesetz",
      "state": "Bayern",
      "amtsgericht": "Amtsgericht München",
      "registernummer": "HRB 238746",
      "registerart": "HRB",
      "company_name": "Finparx Holding GmbH",
      "company_seat": "München",
      "details": "12.12.2024 (Bekanntmachungsdatum)\n\nBayern Amtsgericht München HRB 238746\nRegisterbekanntmachung nach dem Umwandlungsgesetz 11.12.2024 (Eintragungsdatum)\n\nFinparx Holding GmbH\nGesellschaft mit beschränkter Haftung\nMünchen\n\nDen Gläubigern der an der Verschmelzung beteiligten Rechtsträger ist, wenn sie binnen sechs Monaten nach dem Tag, an dem die Eintragung der Verschmelzung in das Register des Sitzes desjenigen Rechtsträgers, dessen Gläubiger sie sind, nach § 19 Abs. 3 UmwG als bekannt gemacht gilt, ihren Anspruch nach Grund und Höhe schriftlich anmelden, Sicherheit zu leisten, soweit sie nicht Befriedigung verlangen können. Dieses Recht steht den Gläubigern jedoch nur zu, wenn sie glaubhaft machen, dass durch die Verschmelzung die Erfüllung ihrer Forderung gefährdet wird."
    },
    {
      "date": "2024-12-12",
      "id": "96209",
      "original_text": "Löschungsankündigung\nBayern Amtsgericht München HRB 235532\nE.B. Management GmbH – München",
      "type": "Löschungsankündigung",
      "state": "Bayern",
      "amtsgericht": "Amtsgericht München",
      "registernummer": "HRB 235532",
      "registerart": "HRB",
      "company_name": "E.B. Management GmbH",
      "company_seat": "München",
      "details": "12.12.2024 (Bekanntmachungsdatum)\n\nBayern Amtsgericht München HRB 235532\nLöschungsankündigung 11.12.2024 (Eintragungsdatum)\n\nE.B. Management GmbH\nGesellschaft mit beschränkter Haftung\nMünchen\n\nDas Registergericht beabsichtigt, die im Handelsregister eingetragene Gesellschaft wegen Vermögenslosigkeit von Amts wegen nach § 394 FamFG zu löschen. Die Frist zur Erhebung eines Widerspruchs ist auf drei Monate festgesetzt."
    },
    {
      "date": "2024-12-12",
      "id": "96210",
      "original_text": "Löschungsankündigung\nBayern Amtsgericht München HRB 239519\nGMB Int. Transporte GmbH – Kranzberg",
      "type": "Löschungsankündigung",
      "state": "Bayern",
      "amtsgericht": "Amtsgericht München",
      "registernummer": "HRB 239519",
      "registerart": "HRB",
      "company_name": "GMB Int. Transporte GmbH",
      "company_seat": "Kranzberg",
      "details": "12.12.2024 (Bekanntmachungsdatum)\n\nBayern Amtsgericht München HRB 239519\nLöschungsankündigung 11.12.2024 (Eintragungsdatum)\n\nGMB Int. Transporte GmbH\nGesellschaft mit beschränkter Haftung\nKranzberg\n\nDas Registergericht beabsichtigt, den im Handelsregister eingetragenen #DV.betroffen(Text=\"Bitte zutreffende Bezeichnung des zu löschenden Vertretungsberechtigten auswählen:\",Eingabe=\"Geschäftsführer\",\"Vorstand\",\"Liquidator\",\"Abwickler\") wegen fehlender Eignung nach § 395 FamFG zu löschen. #insert(Text=\"zztb_V_Widerspruchsfrist\")"
    },
    {
      "date": "2024-12-12",
      "id": "96211",
      "original_text": "Löschungsankündigung\nBayern Amtsgericht Ingolstadt HRB 7496\nantarté UG (haftungsbeschränkt) – Geisenfeld",
      "type": "Löschungsankündigung",
      "state": "Bayern",
      "amtsgericht": "Amtsgericht Ingolstadt",
      "registernummer": "HRB 7496",
      "registerart": "HRB",
      "company_name": "antarté UG (haftungsbeschränkt)",
      "company_seat": "Geisenfeld",
      "details": "12.12.2024 (Bekanntmachungsdatum)\n\nBayern Amtsgericht Ingolstadt HRB 7496\nLöschungsankündigung\n\nantarté UG (haftungsbeschränkt)\nGesellschaft mit beschränkter Haftung\nGeisenfeld\n\nDas Registergericht beabsichtigt, die im Handelsregister eingetragene Gesellschaft wegen Vermögenslosigkeit von Amts wegen nach § 394 FamFG zu löschen. Die Frist zur Erhebung eines Widerspruchs ist auf einen Monat festgesetzt."
    },
    {
      "date": "2024-12-12",
      "id": "96212",
      "original_text": "Registerbekanntmachung nach dem Umwandlungsgesetz\nBayern Amtsgericht Coburg HRA 5616\nHolzverpackung Oliver Röttger e. K. – Lautertal",
      "type": "Registerbekanntmachung nach dem Umwandlungsgesetz",
      "state": "Bayern",
      "amtsgericht": "Amtsgericht Coburg",
      "registernummer": "HRA 5616",
      "registerart": "HRA",
      "company_name": "Holzverpackung Oliver Röttger e. K.",
      "company_seat": "Lautertal",
      "details": "12.12.2024 (Bekanntmachungsdatum)\n\nBayern Amtsgericht Coburg HRA 5616\nRegisterbekanntmachung nach dem Umwandlungsgesetz 11.12.2024 (Eintragungsdatum)\n\nHolzverpackung Oliver Röttger e. K.\nEinzelkaufmann / Einzelkauffrau\nLautertal\n\nDen Gläubigern der an der Ausgliederung beteiligten Rechtsträger ist, wenn sie binnen sechs Monaten nach dem Tag, an dem die Eintragung der Ausgliederung in das Register des Sitzes desjenigen Rechtsträgers, dessen Gläubiger sie sind, nach §§ 125, 19 Abs. 3 UmwG als bekannt gemacht gilt, ihren Anspruch nach Grund und Höhe schriftlich anmelden, Sicherheit zu leisten, soweit sie nicht Befriedigung verlangen können. Dieses Recht steht den Gläubigern jedoch nur zu, wenn sie glaubhaft machen, dass durch die Ausgliederung die Erfüllung ihrer Forderung gefährdet wird."
    },
    {
      "date": "2024-12-12",
      "id": "96213",
      "original_text": "Löschungsankündigung\nBayern Amtsgericht Memmingen HRB 21121\nAba Germany GmbH – Bad Wörishofen",
      "type": "Löschungsankündigung",
      "state": "Bayern",
      "amtsgericht": "Amtsgericht Memmingen",
      "registernummer": "HRB 21121",
      "registerart": "HRB",
      "company_name": "Aba Germany GmbH",
      "company_seat": "Bad Wörishofen",
      "details": "12.12.2024 (Bekanntmachungsdatum)\n\nBayern Amtsgericht Memmingen HRB 21121\nLöschungsankündigung\n\nAba Germany GmbH\nGesellschaft mit beschränkter Haftung\nBad Wörishofen\n\nDas Registergericht beabsichtigt, die im Handelsregister eingetragene Gesellschaft wegen Vermögenslosigkeit von Amts wegen nach § 394 FamFG zu löschen. Die Frist zur Erhebung eines Widerspruchs ist auf einen Monat festgesetzt."
    },
    {
      "date": "2024-12-12",
      "id": "96214",
      "original_text": "Einreichung neuer Dokumente\nBayern Amtsgericht Fürth HRB 13460\nContentCard AG – Baiersdorf",
      "type": "Einreichung neuer Dokumente",
      "state": "Bayern",
      "amtsgericht": "Amtsgericht Fürth",
      "registernummer": "HRB 13460",
      "registerart": "HRB",
      "company_name": "ContentCard AG",
      "company_seat": "Baiersdorf",
      "details": "12.12.2024 (Bekanntmachungsdatum)\n\nBayern Amtsgericht Fürth HRB 13460\nEinreichung neuer Dokumente\n\nContentCard AG\nAktiengesellschaft\nBaiersdorf\n\nDem Amtsgericht Fürth -Registergericht- ist eine Liste der Mitglieder des Aufsichtsrats eingereicht worden, § 106 AktG."
    },
    {
      "date": "2024-12-12",
      "id": "96215",
      "original_text": "Löschungsankündigung\nBayern Amtsgericht München HRB 134517\nSaur Energietechnik GmbH – Dornach, Gem. Aschheim",
      "type": "Löschungsankündigung",
      "state": "Bayern",
      "amtsgericht": "Amtsgericht München",
      "registernummer": "HRB 134517",
      "registerart": "HRB",
      "company_name": "Saur Energietechnik GmbH",
      "company_seat": "Dornach, Gem. Aschheim",
      "details": "12.12.2024 (Bekanntmachungsdatum)\n\nBayern Amtsgericht München HRB 134517\nLöschungsankündigung 11.12.2024 (Eintragungsdatum)\n\nSaur Energietechnik GmbH\nGesellschaft mit beschränkter Haftung\nDornach, Gem. Aschheim\n\nDas Registergericht beabsichtigt, die im Handelsregister eingetragene Gesellschaft wegen Vermögenslosigkeit von Amts wegen nach § 394 FamFG zu löschen. Die Frist zur Erhebung eines Widerspruchs ist auf drei Monate festgesetzt."
    },
    {
      "date": "2024-12-12",
      "id": "96216",
      "original_text": "Registerbekanntmachung nach dem Umwandlungsgesetz\nBayern Amtsgericht München HRB 297269\nGER Linde 2 GmbH – Pullach i.Isartal",
      "type": "Registerbekanntmachung nach dem Umwandlungsgesetz",
      "state": "Bayern",
      "amtsgericht": "Amtsgericht München",
      "registernummer": "HRB 297269",
      "registerart": "HRB",
      "company_name": "GER Linde 2 GmbH",
      "company_seat": "Pullach i.Isartal",
      "details": "12.12.2024 (Bekanntmachungsdatum)\n\nBayern Amtsgericht München HRB 297269\nRegisterbekanntmachung nach dem Umwandlungsgesetz 11.12.2024 (Eintragungsdatum)\n\nGER Linde 2 GmbH\nGesellschaft mit beschränkter Haftung\nPullach i.Isartal\n\nDen Gläubigern der an der Verschmelzung beteiligten Rechtsträger ist, wenn sie binnen sechs Monaten nach dem Tag, an dem die Eintragung der Verschmelzung in das Register des Sitzes desjenigen Rechtsträgers, dessen Gläubiger sie sind, nach § 19 Abs. 3 UmwG als bekannt gemacht gilt, ihren Anspruch nach Grund und Höhe schriftlich anmelden, Sicherheit zu leisten, soweit sie nicht Befriedigung verlangen können. Dieses Recht steht den Gläubigern jedoch nur zu, wenn sie glaubhaft machen, dass durch die Verschmelzung die Erfüllung ihrer Forderung gefährdet wird."
    },
    {
      "date": "2024-12-12",
      "id": "96217",
      "original_text": "Einreichung neuer Dokumente\nBayern Amtsgericht München HRB 206013\n9. Ostdeutschland Invest GmbH – Grünwald",
      "type": "Einreichung neuer Dokumente",
      "state": "Bayern",
      "amtsgericht": "Amtsgericht München",
      "registernummer": "HRB 206013",
      "registerart": "HRB",
      "company_name": "9. Ostdeutschland Invest GmbH",
      "company_seat": "Grünwald",
      "details": "12.12.2024 (Bekanntmachungsdatum)\n\nBayern Amtsgericht München HRB 206013\nEinreichung neuer Dokumente\n\n9. Ostdeutschland Invest GmbH\nGesellschaft mit beschränkter Haftung\nGrünwald\n\nBetreffend die 9. Ostdeutschland Invest GmbH mit Sitz in Grünwald, Landkreis München, eingetragen beim Amtsgericht München unter HRB 206013: .Es wird darauf hingewiesen, dass ein Formwechselplan oder sein Entwurf über einen grenzüberschreitenden Formwechsel der o. g. Gesellschaft in die 9. OIG Limited mit Sitz in Malta/Malta, (eine kumpanija privata / private limited liability company - Gesellschaft mit beschränkter Haftung nach maltesischem Recht) beim Handelsregister eingereicht worden ist.\nDie Anteilsinhaber, die Gläubiger sowie die zuständigen Betriebsräte der an dem grenzüberschreitenden Formwechsel beteiligten Gesellschaft oder, soweit es keinen Betriebsrat gibt, die Arbeitnehmer der an dem grenzüberschreitenden Formwechsel beteiligten Gesellschaft, können der Gesellschaft spätestens fünf Arbeitstage vor dem Tag der Gesellschafterversammlung Bemerkungen zum Formwechselplan übermitteln. Die Gesellschaf terversammlung soll nach derzeitiger Planung am 30.12.2024 stattfinden. Die Bemerkungen zum Formwechselplan sind an folgende Adresse zu richten: 9. Ostdeutschland Invest GmbH Ludwig-Ganghofer-Straße 6, 82031 Grünwald."
    },
    {
      "date": "2024-12-12",
      "id": "96218",
      "original_text": "Registerbekanntmachung nach dem Umwandlungsgesetz\nBayern Amtsgericht München HRB 126082\nBayerische Filmhallen GmbH – Grünwald",
      "type": "Registerbekanntmachung nach dem Umwandlungsgesetz",
      "state": "Bayern",
      "amtsgericht": "Amtsgericht München",
      "registernummer": "HRB 126082",
      "registerart": "HRB",
      "company_name": "Bayerische Filmhallen GmbH",
      "company_seat": "Grünwald",
      "details": "12.12.2024 (Bekanntmachungsdatum)\n\nBayern Amtsgericht München HRB 126082\nRegisterbekanntmachung nach dem Umwandlungsgesetz 11.12.2024 (Eintragungsdatum)\n\nBayerische Filmhallen GmbH\nGesellschaft mit beschränkter Haftung\nGrünwald\n\nDen Gläubigern der an der Verschmelzung beteiligten Rechtsträger ist, wenn sie binnen sechs Monaten nach dem Tag, an dem die Eintragung der Verschmelzung in das Register des Sitzes desjenigen Rechtsträgers, dessen Gläubiger sie sind, nach § 19 Abs. 3 UmwG als bekannt gemacht gilt, ihren Anspruch nach Grund und Höhe schriftlich anmelden, Sicherheit zu leisten, soweit sie nicht Befriedigung verlangen können. Dieses Recht steht den Gläubigern jedoch nur zu, wenn sie glaubhaft machen, dass durch die Verschmelzung die Erfüllung ihrer Forderung gefährdet wird."
    },
    {
      "date": "2024-12-12",
      "id": "96219",
      "original_text": "Löschungsankündigung\nBayern Amtsgericht München HRB 239519\nGMB Int. Transporte GmbH – Kranzberg",
      "type": "Löschungsankündigung",
      "state": "Bayern",
      "amtsgericht": "Amtsgericht München",
      "registernummer": "HRB 239519",
      "registerart": "HRB",
      "company_name": "GMB Int. Transporte GmbH",
      "company_seat": "Kranzberg",
      "details": "12.12.2024 (Bekanntmachungsdatum)\n\nBayern Amtsgericht München HRB 239519\nLöschungsankündigung 11.12.2024 (Eintragungsdatum)\n\nGMB Int. Transporte GmbH\nGesellschaft mit beschränkter Haftung\nKranzberg\n\nDas Registergericht beabsichtigt, die im Handelsregister eingetragene Gesellschaft wegen Vermögenslosigkeit von Amts wegen nach § 394 FamFG zu löschen. #insert(Text=\"zztb_V_Widerspruchsfrist\")"
    },
    {
      "date": "2024-12-12",
      "id": "96220",
      "original_text": "Löschungsankündigung\nBayern Amtsgericht Memmingen HRB 19294\nHuber 94 Transporting & Consulting UG (haftungsbeschränkt) – Vöhringen",
      "type": "Löschungsankündigung",
      "state": "Bayern",
      "amtsgericht": "Amtsgericht Memmingen",
      "registernummer": "HRB 19294",
      "registerart": "HRB",
      "company_name": "Huber 94 Transporting & Consulting UG (haftungsbeschränkt)",
      "company_seat": "Vöhringen",
      "details": "12.12.2024 (Bekanntmachungsdatum)\n\nBayern Amtsgericht Memmingen HRB 19294\nLöschungsankündigung\n\nHuber 94 Transporting & Consulting UG (haftungsbeschränkt)\nGesellschaft mit beschränkter Haftung\nVöhringen\n\nDas Registergericht beabsichtigt, die im Handelsregister eingetragene Gesellschaft wegen Vermögenslosigkeit von Amts wegen nach § 394 FamFG zu löschen. Die Frist zur Erhebung eines Widerspruchs ist auf einen Monat festgesetzt."
    },
    {
      "date": "2024-12-12",
      "id": "96221",
      "original_text": "Registerbekanntmachung nach dem Umwandlungsgesetz\nBayern Amtsgericht Coburg HRB 7429\nHolzverpackung Röttger GmbH – Lautertal",
      "type": "Registerbekanntmachung nach dem Umwandlungsgesetz",
      "state": "Bayern",
      "amtsgericht": "Amtsgericht Coburg",
      "registernummer": "HRB 7429",
      "registerart": "HRB",
      "company_name": "Holzverpackung Röttger GmbH",
      "company_seat": "Lautertal",
      "details": "12.12.2024 (Bekanntmachungsdatum)\n\nBayern Amtsgericht Coburg HRB 7429\nRegisterbekanntmachung nach dem Umwandlungsgesetz 11.12.2024 (Eintragungsdatum)\n\nHolzverpackung Röttger GmbH\nGesellschaft mit beschränkter Haftung\nLautertal\n\nDen Gläubigern der an der Ausgliederung beteiligten Rechtsträger ist, wenn sie binnen sechs Monaten nach dem Tag, an dem die Eintragung der Ausgliederung in das Register des Sitzes desjenigen Rechtsträgers, dessen Gläubiger sie sind, nach §§ 125, 19 Abs. 3 UmwG als bekannt gemacht gilt, ihren Anspruch nach Grund und Höhe schriftlich anmelden, Sicherheit zu leisten, soweit sie nicht Befriedigung verlangen können. Dieses Recht steht den Gläubigern jedoch nur zu, wenn sie glaubhaft machen, dass durch die Ausgliederung die Erfüllung ihrer Forderung gefährdet wird."
    },
    {
      "date": "2024-12-12",
      "id": "96222",
      "original_text": "Einreichung neuer Dokumente\nBaden-Württemberg Amtsgericht Mannheim HRB 1219\nStadtpark Mannheim gemeinnützige GmbH – Mannheim",
      "type": "Einreichung neuer Dokumente",
      "state": "Baden-Württemberg",
      "amtsgericht": "Amtsgericht Mannheim",
      "registernummer": "HRB 1219",
      "registerart": "HRB",
      "company_name": "Stadtpark Mannheim gemeinnützige GmbH",
      "company_seat": "Mannheim",
      "details": "12.12.2024 (Bekanntmachungsdatum)\n\nBaden-Württemberg Amtsgericht Mannheim HRB 1219\nEinreichung neuer Dokumente\n\nStadtpark Mannheim gemeinnützige GmbH\nGesellschaft mit beschränkter Haftung\nMannheim\n\nDie Gesellschaft hat am 11.12.2024 die Liste über die Zusammensetzung des Aufsichtsrats zum Handelsregister eingereicht."
    },
    {
      "date": "2024-12-12",
      "id": "96223",
      "original_text": "Registerbekanntmachung nach dem Umwandlungsgesetz\nSchleswig-Holstein Amtsgericht Pinneberg HRB 5475\nbk medical Medizinische Systeme GmbH – Quickborn/Krs. Pinneberg",
      "type": "Registerbekanntmachung nach dem Umwandlungsgesetz",
      "state": "Schleswig-Holstein",
      "amtsgericht": "Amtsgericht Pinneberg",
      "registernummer": "HRB 5475",
      "registerart": "HRB",
      "company_name": "bk medical Medizinische Systeme GmbH",
      "company_seat": "Quickborn/Krs. Pinneberg",
      "details": "12.12.2024 (Bekanntmachungsdatum)\n\nSchleswig-Holstein Amtsgericht Pinneberg HRB 5475\nRegisterbekanntmachung nach dem Umwandlungsgesetz 11.12.2024 (Eintragungsdatum)\n\nbk medical Medizinische Systeme GmbH\nGesellschaft mit beschränkter Haftung\nQuickborn/Krs. Pinneberg\n\nZu Eintragungsnummer 7 vom 11.12.2024 wird als nicht eingetragen veröffentlicht: Als nicht eingetragen wird veröffentlicht: Den Gläubigern der an der Verschmelzung beteiligten Rechtsträger ist, wenn sie binnen sechs Monaten nach dem Tag, an dem die Eintragung der Verschmelzung in das Register des Sitzes desjenigen Rechtsträgers, dessen Gläubiger sie sind, als bekannt gemacht gilt, ihren Anspruch nach Grund und Höhe schriftlich anmelden, Sicherheit zu leisten, soweit sie nicht Befriedigung verlangen können. Dieses Recht steht den Gläubigern jedoch nur zu, wenn sie glaubhaft machen, dass durch die Verschmelzung die Erfüllung ihrer Forderung gefährdet wird. Das Recht, Sicherheitsleistung zu verlangen, steht Gläubigern nicht zu, die im Falle der Insolvenz ein Recht auf vorzugsweise Befriedigung aus einer Deckungsmasse haben, die nach gesetzlicher Vorschrift zu ihrem Schutz errichtet und staatlich überwacht ist."
    },
    {
      "date": "2024-12-12",
      "id": "96224",
      "original_text": "Löschungsankündigung\nBrandenburg Amtsgericht Neuruppin HRB 12618\nGMA Gas GmbH – Angermünde",
      "type": "Löschungsankündigung",
      "state": "Brandenburg",
      "amtsgericht": "Amtsgericht Neuruppin",
      "registernummer": "HRB 12618",
      "registerart": "HRB",
      "company_name": "GMA Gas GmbH",
      "company_seat": "Angermünde",
      "details": "12.12.2024 (Bekanntmachungsdatum)\n\nBrandenburg Amtsgericht Neuruppin HRB 12618\nLöschungsankündigung\n\nGMA Gas GmbH\nGesellschaft mit beschränkter Haftung\nAngermünde\n\nBei der nachstehenden Gesellschaft wird das Amtslöschungsverfahren gemäß § 394 FamFG eingeleitet.\nWiderspruchsfrist: 1 Monat"
    },
    {
      "date": "2024-12-12",
      "id": "96225",
      "original_text": "Registerbekanntmachung nach dem Umwandlungsgesetz\nBrandenburg Amtsgericht Potsdam HRA 8514\nTorsten Grüß e.K. – Zossen",
      "type": "Registerbekanntmachung nach dem Umwandlungsgesetz",
      "state": "Brandenburg",
      "amtsgericht": "Amtsgericht Potsdam",
      "registernummer": "HRA 8514",
      "registerart": "HRA",
      "company_name": "Torsten Grüß e.K.",
      "company_seat": "Zossen",
      "details": "12.12.2024 (Bekanntmachungsdatum)\n\nBrandenburg Amtsgericht Potsdam HRA 8514\nRegisterbekanntmachung nach dem Umwandlungsgesetz 11.12.2024 (Eintragungsdatum)\n\nTorsten Grüß e.K.\nEinzelkaufmann / Einzelkauffrau\nZossen\n\nZu Eintragungsnummer 2 vom 11.12.2024 wird als nicht eingetragen veröffentlicht: Den Gläubigern der an der Ausgliederung beteiligten Rechtsträger ist, wenn sie binnen sechs Monaten nach dem Tag, an dem die Eintragung der Ausgliederung in das Register des Sitzes desjenigen Rechtsträgers, dessen Gläubiger sie sind, nach den §§ 125, 19 Abs. 3 UmwG als bekannt gemacht gilt, ihren Anspruch nach Grund und Höhe schriftlich anmelden, Sicherheit zu leisten, soweit sie nicht Befriedigung verlangen können. Dieses Recht steht den Gläubigern jedoch nur zu, wenn sie glaubhaft machen, dass durch die Ausgliederung die Erfüllung ihrer Forderung gefährdet wird."
    },
    {
      "date": "2024-12-12",
      "id": "96226",
      "original_text": "Einreichung neuer Dokumente\nBaden-Württemberg Amtsgericht Ulm HRB 631700\nMKS Softwaremanagement AG – Friedrichshafen",
      "type": "Einreichung neuer Dokumente",
      "state": "Baden-Württemberg",
      "amtsgericht": "Amtsgericht Ulm",
      "registernummer": "HRB 631700",
      "registerart": "HRB",
      "company_name": "MKS Softwaremanagement AG",
      "company_seat": "Friedrichshafen",
      "details": "12.12.2024 (Bekanntmachungsdatum)\n\nBaden-Württemberg Amtsgericht Ulm HRB 631700\nEinreichung neuer Dokumente 12.12.2024 (Eintragungsdatum)\n\nMKS Softwaremanagement AG\nAktiengesellschaft\nFriedrichshafen\n\nDie Gesellschaft hat am 11.12.2024 die Liste über die Zusammensetzung des Aufsichtsrats zum Handelsregister eingereicht."
    },
    {
      "date": "2024-12-12",
      "id": "96227",
      "original_text": "Registerbekanntmachung nach dem Umwandlungsgesetz\nBaden-Württemberg Amtsgericht Freiburg HRB 725930\nSchwarzwaldbruder GmbH – Waldshut-Tiengen",
      "type": "Registerbekanntmachung nach dem Umwandlungsgesetz",
      "state": "Baden-Württemberg",
      "amtsgericht": "Amtsgericht Freiburg",
      "registernummer": "HRB 725930",
      "registerart": "HRB",
      "company_name": "Schwarzwaldbruder GmbH",
      "company_seat": "Waldshut-Tiengen",
      "details": "12.12.2024 (Bekanntmachungsdatum)\n\nBaden-Württemberg Amtsgericht Freiburg HRB 725930\nRegisterbekanntmachung nach dem Umwandlungsgesetz 12.12.2024 (Eintragungsdatum)\n\nSchwarzwaldbruder GmbH\nGesellschaft mit beschränkter Haftung\nWaldshut-Tiengen\n\nAls nicht eingetragen wird bekanntgemacht:\nDen Gläubigern der an der Verschmelzung beteiligten Rechtsträger ist, wenn sie binnen sechs Monaten nach dem Tag, an dem die Eintragung der Verschmelzung in das Register des Sitzes desjenigen Rechtsträgers, dessen Gläubiger sie sind, nach § 19 Abs. 3 UmwG als bekanntgemacht gilt, ihren Anspruch nach Grund und Höhe schriftlich anmelden, Sicherheit zu leisten, soweit sie nicht Befriedigung verlangen können. Dieses Recht steht den Gläubigern jedoch nur zu, wenn sie glaubhaft machen, dass durch die Verschmelzung die Erfüllung ihrer Forderung gefährdet wird."
    },
    {
      "date": "2024-12-12",
      "id": "96228",
      "original_text": "Registerbekanntmachung nach dem Umwandlungsgesetz\nBaden-Württemberg Amtsgericht Freiburg HRB 725930\nSchwarzwaldbruder GmbH – Waldshut-Tiengen",
      "type": "Registerbekanntmachung nach dem Umwandlungsgesetz",
      "state": "Baden-Württemberg",
      "amtsgericht": "Amtsgericht Freiburg",
      "registernummer": "HRB 725930",
      "registerart": "HRB",
      "company_name": "Schwarzwaldbruder GmbH",
      "company_seat": "Waldshut-Tiengen",
      "details": "12.12.2024 (Bekanntmachungsdatum)\n\nBaden-Württemberg Amtsgericht Freiburg HRB 725930\nRegisterbekanntmachung nach dem Umwandlungsgesetz 12.12.2024 (Eintragungsdatum)\n\nSchwarzwaldbruder GmbH\nGesellschaft mit beschränkter Haftung\nWaldshut-Tiengen\n\nAls nicht eingetragen wird bekanntgemacht:\nDen Gläubigern der an der Verschmelzung beteiligten Rechtsträger ist, wenn sie binnen sechs Monaten nach dem Tag, an dem die Eintragung der Verschmelzung in das Register des Sitzes desjenigen Rechtsträgers, dessen Gläubiger sie sind, nach § 19 Abs. 3 UmwG als bekanntgemacht gilt, ihren Anspruch nach Grund und Höhe schriftlich anmelden, Sicherheit zu leisten, soweit sie nicht Befriedigung verlangen können. Dieses Recht steht den Gläubigern jedoch nur zu, wenn sie glaubhaft machen, dass durch die Verschmelzung die Erfüllung ihrer Forderung gefährdet wird."
    },
    {
      "date": "2024-12-12",
      "id": "96229",
      "original_text": "Einreichung neuer Dokumente\nSaarland Amtsgericht Saarbrücken HRB 23064\nBau- und Siedlungsgesellschaft mit beschränkter Haftung Dillingen/Saar – Dillingen",
      "type": "Einreichung neuer Dokumente",
      "state": "Saarland",
      "amtsgericht": "Amtsgericht Saarbrücken",
      "registernummer": "HRB 23064",
      "registerart": "HRB",
      "company_name": "Bau- und Siedlungsgesellschaft mit beschränkter Haftung Dillingen/Saar",
      "company_seat": "Dillingen",
      "details": "12.12.2024 (Bekanntmachungsdatum)\n\nSaarland Amtsgericht Saarbrücken HRB 23064\nEinreichung neuer Dokumente\n\nBau- und Siedlungsgesellschaft mit beschränkter Haftung Dillingen/Saar\nGesellschaft mit beschränkter Haftung\nDillingen\n\nDie Geschäftsführung der Gesellschaft hat eine Liste der Mitglieder des Aufsichtsrats zum Handelsregister eingereicht (§ 52 Abs. 3 Satz 2 GmbHG)."
    },
    {
      "date": "2024-12-12",
      "id": "96230",
      "original_text": "Löschungsankündigung\nSaarland Amtsgericht Saarbrücken HRB 108214\nGK Hauskonzepte GmbH – Neunkirchen/Saar",
      "type": "Löschungsankündigung",
      "state": "Saarland",
      "amtsgericht": "Amtsgericht Saarbrücken",
      "registernummer": "HRB 108214",
      "registerart": "HRB",
      "company_name": "GK Hauskonzepte GmbH",
      "company_seat": "Neunkirchen/Saar",
      "details": "12.12.2024 (Bekanntmachungsdatum)\n\nSaarland Amtsgericht Saarbrücken HRB 108214\nLöschungsankündigung\n\nGK Hauskonzepte GmbH\nGesellschaft mit beschränkter Haftung\nNeunkirchen/Saar\n\nEs ist beabsichtigt, die Gesellschaft von Amts wegen gemäß § 394 FamFG wegen Vermögenslosigkeit zu löschen.\nGegen die Löschung von Amts wegen ist das Rechtsmittel des Widerspruchs statthaft. Der Widerspruch ist binnen einer Frist zwei Monaten beginnend mit dem Tag dieser Veröffentlichung durch Einreichen eines Widerspruchsschreibens -schriftlich oder zur Niederschrift der Geschäftsstelle beim Amtsgericht Saarbrücken, -zentrales Handelsregister-, Mainzer Str.178, 66121 Saarbrücken einzulegen.\nDer Widerspruch muss die Bezeichnung der angefochtenen Löschungsankündigung enthalten sowie die Erklärung, dass Widerspruch eingelegt wird. Er ist vom Widerspruchsführer oder seinem Bevollmächtigten zu unterzeichnen.\nDas Widerspruchsschreiben kann auch in der Form eines elektronischen Dokumentes eingereicht werden, das mit einer qualifizierten elektronischen Signatur nach dem Signaturgesetz versehen sein muss (§§ 14 Abs. 2 FamFG, 130a, 298 ZPO)."
    },
    {
      "date": "2024-12-12",
      "id": "96231",
      "original_text": "Registerbekanntmachung nach dem Umwandlungsgesetz\nBaden-Württemberg Amtsgericht Freiburg HRA 708768\nVolz-Fellmann Verpachtungs OHG – Allensbach",
      "type": "Registerbekanntmachung nach dem Umwandlungsgesetz",
      "state": "Baden-Württemberg",
      "amtsgericht": "Amtsgericht Freiburg",
      "registernummer": "HRA 708768",
      "registerart": "HRA",
      "company_name": "Volz-Fellmann Verpachtungs OHG",
      "company_seat": "Allensbach",
      "details": "12.12.2024 (Bekanntmachungsdatum)\n\nBaden-Württemberg Amtsgericht Freiburg HRA 708768\nRegisterbekanntmachung nach dem Umwandlungsgesetz 12.12.2024 (Eintragungsdatum)\n\nVolz-Fellmann Verpachtungs OHG\nOffene Handelsgesellschaft\nAllensbach\n\nAls nicht eingetragen wird bekanntgemacht:\nDen Gläubigern des an dem Formwechsel beteiligten Rechtsträgers ist, wenn sie binnen sechs Monaten nach dem Tag, an dem die Eintragung des Formwechsels in das Register des Sitzes desjenigen Rechtsträgers, dessen Gläubiger sie sind, nach § 19 Abs. 3 UmwG als bekanntgemacht gilt, ihren Anspruch nach Grund und Höhe schriftlich anmelden, Sicherheit zu leisten, soweit sie nicht Befriedigung verlangen können. Dieses Recht steht den Gläubigern jedoch nur zu, wenn sie glaubhaft machen, dass durch den Formwechsel die Erfüllung ihrer Forderung gefährdet wird."
    },
    {
      "date": "2024-12-12",
      "id": "96232",
      "original_text": "Einreichung neuer Dokumente\nBerlin Amtsgericht Berlin (Charlottenburg) HRB 161349\nTele Columbus AG – Berlin",
      "type": "Einreichung neuer Dokumente",
      "state": "Berlin",
      "amtsgericht": "Amtsgericht Berlin (Charlottenburg)",
      "registernummer": "HRB 161349",
      "registerart": "HRB",
      "company_name": "Tele Columbus AG",
      "company_seat": "Berlin",
      "details": "12.12.2024 (Bekanntmachungsdatum)\n\nBerlin Amtsgericht Berlin (Charlottenburg) HRB 161349\nEinreichung neuer Dokumente\n\nTele Columbus AG\nAktiengesellschaft\nBerlin\n\nAls nicht eingetragen wird veröffentlicht:Es wurde eine neue Liste der Aufsichtsratsmitglieder eingereicht (§ 106 AktG)."
    },
    {
      "date": "2024-12-12",
      "id": "96233",
      "original_text": "Löschungsankündigung\nSaarland Amtsgericht Saarbrücken HRB 10375\nBiG Billard-Gastronomie GmbH – Saarbrücken",
      "type": "Löschungsankündigung",
      "state": "Saarland",
      "amtsgericht": "Amtsgericht Saarbrücken",
      "registernummer": "HRB 10375",
      "registerart": "HRB",
      "company_name": "BiG Billard-Gastronomie GmbH",
      "company_seat": "Saarbrücken",
      "details": "12.12.2024 (Bekanntmachungsdatum)\n\nSaarland Amtsgericht Saarbrücken HRB 10375\nLöschungsankündigung\n\nBiG Billard-Gastronomie GmbH\nGesellschaft mit beschränkter Haftung\nSaarbrücken\n\nEs ist beabsichtigt, die Gesellschaft von Amts wegen gemäß § 394 FamFG wegen Vermögenslosigkeit zu löschen.\nGegen die Löschung von Amts wegen ist das Rechtsmittel des Widerspruchs statthaft. Der Widerspruch ist binnen einer Frist drei Monaten beginnend mit dem Tag dieser Veröffentlichung durch Einreichen eines Widerspruchsschreibens -schriftlich oder zur Niederschrift der Geschäftsstelle beim Amtsgericht Saarbrücken, -zentrales Handelsregister-, Mainzerstr.178, 66121 Saarbrücken einzulegen.\nDer Widerspruch muss die Bezeichnung der angefochtenen Löschungsankündigung enthalten sowie die Erklärung, dass Widerspruch eingelegt wird. Er ist vom Widerspruchsführer oder seinem Bevollmächtigten zu unterzeichnen.\nDas Widerspruchsschreiben kann auch in der Form eines elektronischen Dokumentes eingereicht werden, das mit einer qualifizierten elektronischen Signatur nach dem Signaturgesetz versehen sein muss (§§ 14 Abs. 2 FamFG, 130a, 298 ZPO)."
    },
    {
      "date": "2024-12-12",
      "id": "96234",
      "original_text": "Löschungsankündigung\nSaarland Amtsgericht Saarbrücken HRB 16568\nBPC Beteiligungs- und Projektentwicklungsconsulting GmbH – Saarbrücken",
      "type": "Löschungsankündigung",
      "state": "Saarland",
      "amtsgericht": "Amtsgericht Saarbrücken",
      "registernummer": "HRB 16568",
      "registerart": "HRB",
      "company_name": "BPC Beteiligungs- und Projektentwicklungsconsulting GmbH",
      "company_seat": "Saarbrücken",
      "details": "12.12.2024 (Bekanntmachungsdatum)\n\nSaarland Amtsgericht Saarbrücken HRB 16568\nLöschungsankündigung\n\nBPC Beteiligungs- und Projektentwicklungsconsulting GmbH\nGesellschaft mit beschränkter Haftung\nSaarbrücken\n\nEs ist beabsichtigt, die Gesellschaft von Amts wegen gemäß § 394 FamFG wegen Vermögenslosigkeit zu löschen.\nGegen die Löschung von Amts wegen ist das Rechtsmittel des Widerspruchs statthaft. Der Widerspruch ist binnen einer Frist drei Monaten beginnend mit dem Tag dieser Veröffentlichung durch Einreichen eines Widerspruchsschreibens -schriftlich oder zur Niederschrift der Geschäftsstelle beim Amtsgericht Saarbrücken, -zentrales Handelsregister-, Mainzerstr.178, 66121 Saarbrücken einzulegen.\nDer Widerspruch muss die Bezeichnung der angefochtenen Löschungsankündigung enthalten sowie die Erklärung, dass Widerspruch eingelegt wird. Er ist vom Widerspruchsführer oder seinem Bevollmächtigten zu unterzeichnen.\nDas Widerspruchsschreiben kann auch in der Form eines elektronischen Dokumentes eingereicht werden, das mit einer qualifizierten elektronischen Signatur nach dem Signaturgesetz versehen sein muss (§§ 14 Abs. 2 FamFG, 130a, 298 ZPO)."
    },
    {
      "date": "2024-12-12",
      "id": "96235",
      "original_text": "Einreichung neuer Dokumente\nBaden-Württemberg Amtsgericht Mannheim HRB 318\nVeranstaltungen - Tourismus - Marketing: Mannheim erleben GmbH – Mannheim",
      "type": "Einreichung neuer Dokumente",
      "state": "Baden-Württemberg",
      "amtsgericht": "Amtsgericht Mannheim",
      "registernummer": "HRB 318",
      "registerart": "HRB",
      "company_name": "Veranstaltungen - Tourismus - Marketing: Mannheim erleben GmbH",
      "company_seat": "Mannheim",
      "details": "12.12.2024 (Bekanntmachungsdatum)\n\nBaden-Württemberg Amtsgericht Mannheim HRB 318\nEinreichung neuer Dokumente\n\nVeranstaltungen - Tourismus - Marketing: Mannheim erleben GmbH\nGesellschaft mit beschränkter Haftung\nMannheim\n\nDie Gesellschaft hat am 11.12.2024 die Liste über die Zusammensetzung des Aufsichtsrats zum Handelsregister eingereicht."
    },
    {
      "date": "2024-12-12",
      "id": "96236",
      "original_text": "Registerbekanntmachung nach dem Umwandlungsgesetz\nBaden-Württemberg Amtsgericht Ulm HRB 733638\nBEB-Projekt GmbH – Aalen",
      "type": "Registerbekanntmachung nach dem Umwandlungsgesetz",
      "state": "Baden-Württemberg",
      "amtsgericht": "Amtsgericht Ulm",
      "registernummer": "HRB 733638",
      "registerart": "HRB",
      "company_name": "BEB-Projekt GmbH",
      "company_seat": "Aalen",
      "details": "12.12.2024 (Bekanntmachungsdatum)\n\nBaden-Württemberg Amtsgericht Ulm HRB 733638\nRegisterbekanntmachung nach dem Umwandlungsgesetz 12.12.2024 (Eintragungsdatum)\n\nBEB-Projekt GmbH\nGesellschaft mit beschränkter Haftung\nAalen\n\nAls nicht eingetragen wird bekanntgemacht:\nDen Gläubigern der an der Verschmelzung beteiligten Rechtsträger ist, wenn sie binnen sechs Monaten nach dem Tag, an dem die Eintragung der Verschmelzung in das Register des Sitzes desjenigen Rechtsträgers, dessen Gläubiger sie sind, nach § 19 Abs. 3 UmwG als bekanntgemacht gilt, ihren Anspruch nach Grund und Höhe schriftlich anmelden, Sicherheit zu leisten, soweit sie nicht Befriedigung verlangen können. Dieses Recht steht den Gläubigern jedoch nur zu, wenn sie glaubhaft machen, dass durch die Verschmelzung die Erfüllung ihrer Forderung gefährdet wird."
    },
    {
      "date": "2024-12-12",
      "id": "96237",
      "original_text": "Einreichung neuer Dokumente\nBerlin Amtsgericht Berlin (Charlottenburg) HRB 162426\nICE International Copyright Enterprise Germany GmbH – Berlin",
      "type": "Einreichung neuer Dokumente",
      "state": "Berlin",
      "amtsgericht": "Amtsgericht Berlin (Charlottenburg)",
      "registernummer": "HRB 162426",
      "registerart": "HRB",
      "company_name": "ICE International Copyright Enterprise Germany GmbH",
      "company_seat": "Berlin",
      "details": "12.12.2024 (Bekanntmachungsdatum)\n\nBerlin Amtsgericht Berlin (Charlottenburg) HRB 162426\nEinreichung neuer Dokumente\n\nICE International Copyright Enterprise Germany GmbH\nGesellschaft mit beschränkter Haftung\nBerlin\n\nAls nicht eingetragen wird veröffentlicht: Es wurde eine neue Liste der Aufsichtsratsmitglieder eingereicht (§52 GmbHG)."
    },
    {
      "date": "2024-12-12",
      "id": "96238",
      "original_text": "Registerbekanntmachung nach dem Umwandlungsgesetz\nBaden-Württemberg Amtsgericht Ulm HRB 730609\ni-live Bau GmbH – Aalen",
      "type": "Registerbekanntmachung nach dem Umwandlungsgesetz",
      "state": "Baden-Württemberg",
      "amtsgericht": "Amtsgericht Ulm",
      "registernummer": "HRB 730609",
      "registerart": "HRB",
      "company_name": "i-live Bau GmbH",
      "company_seat": "Aalen",
      "details": "12.12.2024 (Bekanntmachungsdatum)\n\nBaden-Württemberg Amtsgericht Ulm HRB 730609\nRegisterbekanntmachung nach dem Umwandlungsgesetz 12.12.2024 (Eintragungsdatum)\n\ni-live Bau GmbH\nGesellschaft mit beschränkter Haftung\nAalen\n\nAls nicht eingetragen wird bekanntgemacht:\nDen Gläubigern der an der Verschmelzung beteiligten Rechtsträger ist, wenn sie binnen sechs Monaten nach dem Tag, an dem die Eintragung der Verschmelzung in das Register des Sitzes desjenigen Rechtsträgers, dessen Gläubiger sie sind, nach § 19 Abs. 3 UmwG als bekanntgemacht gilt, ihren Anspruch nach Grund und Höhe schriftlich anmelden, Sicherheit zu leisten, soweit sie nicht Befriedigung verlangen können. Dieses Recht steht den Gläubigern jedoch nur zu, wenn sie glaubhaft machen, dass durch die Verschmelzung die Erfüllung ihrer Forderung gefährdet wird."
    },
    {
      "date": "2024-12-12",
      "id": "96239",
      "original_text": "Löschungsankündigung\nBaden-Württemberg Amtsgericht Ulm HRB 736826\nvapooor Online UG (haftungsbeschränkt) – Göppingen",
      "type": "Löschungsankündigung",
      "state": "Baden-Württemberg",
      "amtsgericht": "Amtsgericht Ulm",
      "registernummer": "HRB 736826",
      "registerart": "HRB",
      "company_name": "vapooor Online UG (haftungsbeschränkt)",
      "company_seat": "Göppingen",
      "details": "12.12.2024 (Bekanntmachungsdatum)\n\nBaden-Württemberg Amtsgericht Ulm HRB 736826\nLöschungsankündigung\n\nvapooor Online UG (haftungsbeschränkt)\nGesellschaft mit beschränkter Haftung\nGöppingen\n\nDas Gericht beabsichtigt, die Gesellschaft wegen Vermögenslosigkeit im Handelsregister von Amts wegen nach § 394 FamFG zu löschen. Die Frist zur Geltendmachung eines Widerspruchs gegen die beabsichtigte Löschung ist auf  einen Monat ab Veröffentlichung bestimmt."
    },
    {
      "date": "2024-12-12",
      "id": "96240",
      "original_text": "Registerbekanntmachung nach dem Umwandlungsgesetz\nHamburg Amtsgericht Hamburg HRB 136981\nMPC Capital Zweite Beteiligungsgesellschaft mbH – Hamburg",
      "type": "Registerbekanntmachung nach dem Umwandlungsgesetz",
      "state": "Hamburg",
      "amtsgericht": "Amtsgericht Hamburg",
      "registernummer": "HRB 136981",
      "registerart": "HRB",
      "company_name": "MPC Capital Zweite Beteiligungsgesellschaft mbH",
      "company_seat": "Hamburg",
      "details": "12.12.2024 (Bekanntmachungsdatum)\n\nHamburg Amtsgericht Hamburg HRB 136981\nRegisterbekanntmachung nach dem Umwandlungsgesetz 12.12.2024 (Eintragungsdatum)\n\nMPC Capital Zweite Beteiligungsgesellschaft mbH\nGesellschaft mit beschränkter Haftung\nHamburg\n\nAls nicht eingetragen wird bekannt gemacht:\nDen Gläubigern der an der Verschmelzung beteiligten Gesellschaften ist, wenn sie binnen sechs Monaten nach dem Tag, an dem die Eintragung der Verschmelzung in das Register des Sitzes desjenigen Rechtsträgers, dessen Gläubiger sie sind, nach § 19 Absatz 3 UmwG als bekannt gemacht gilt, ihren Anspruch nach Grund und Höhe schriftlich anmelden, Sicherheit zu leisten, soweit sie nicht Befriedigung verlangen können. Dieses Recht steht den Gläubigern jedoch nur zu, wenn sie glaubhaft machen, dass durch die Verschmelzung die Erfüllung ihrer Forderung gefährdet wird."
    },
    {
      "date": "2024-12-12",
      "id": "96241",
      "original_text": "Registerbekanntmachung nach dem Umwandlungsgesetz\nHamburg Amtsgericht Hamburg HRB 147002\nMPC CCEF Participation GmbH – Hamburg",
      "type": "Registerbekanntmachung nach dem Umwandlungsgesetz",
      "state": "Hamburg",
      "amtsgericht": "Amtsgericht Hamburg",
      "registernummer": "HRB 147002",
      "registerart": "HRB",
      "company_name": "MPC CCEF Participation GmbH",
      "company_seat": "Hamburg",
      "details": "12.12.2024 (Bekanntmachungsdatum)\n\nHamburg Amtsgericht Hamburg HRB 147002\nRegisterbekanntmachung nach dem Umwandlungsgesetz 12.12.2024 (Eintragungsdatum)\n\nMPC CCEF Participation GmbH\nGesellschaft mit beschränkter Haftung\nHamburg\n\nAls nicht eingetragen wird bekannt gemacht:\nDen Gläubigern der an der Verschmelzung beteiligten Gesellschaften ist, wenn sie binnen sechs Monaten nach dem Tag, an dem die Eintragung der Verschmelzung in das Register des Sitzes desjenigen Rechtsträgers, dessen Gläubiger sie sind, nach § 19 Absatz 3 UmwG als bekannt gemacht gilt, ihren Anspruch nach Grund und Höhe schriftlich anmelden, Sicherheit zu leisten, soweit sie nicht Befriedigung verlangen können. Dieses Recht steht den Gläubigern jedoch nur zu, wenn sie glaubhaft machen, dass durch die Verschmelzung die Erfüllung ihrer Forderung gefährdet wird."
    },
    {
      "date": "2024-12-12",
      "id": "96242",
      "original_text": "Sonstige Registerbekanntmachung\nMecklenburg-Vorpommern Amtsgericht Rostock HRB 142\nVerwaltungsgesellschaft Lotto und Toto in Mecklenburg-Vorpommern mbH – Rostock",
      "type": "Sonstige Registerbekanntmachung",
      "state": "Mecklenburg-Vorpommern",
      "amtsgericht": "Amtsgericht Rostock",
      "registernummer": "HRB 142",
      "registerart": "HRB",
      "company_name": "Verwaltungsgesellschaft Lotto und Toto in Mecklenburg-Vorpommern mbH",
      "company_seat": "Rostock",
      "details": "12.12.2024 (Bekanntmachungsdatum)\n\nMecklenburg-Vorpommern Amtsgericht Rostock HRB 142\nSonstige Registerbekanntmachung 12.12.2024 (Eintragungsdatum)\n\nVerwaltungsgesellschaft Lotto und Toto in Mecklenburg-Vorpommern mbH\nGesellschaft mit beschränkter Haftung\nRostock\n\nEine Liste der Mitglieder des Aufsichtsrats ist zum Handelsregister eingereicht worden."
    },
    {
      "date": "2024-12-12",
      "id": "96243",
      "original_text": "Einreichung neuer Dokumente\nMecklenburg-Vorpommern Amtsgericht Neubrandenburg HRB 465\nNeubrandenburger Wohnungsgesellschaft mbH – Neubrandenburg",
      "type": "Einreichung neuer Dokumente",
      "state": "Mecklenburg-Vorpommern",
      "amtsgericht": "Amtsgericht Neubrandenburg",
      "registernummer": "HRB 465",
      "registerart": "HRB",
      "company_name": "Neubrandenburger Wohnungsgesellschaft mbH",
      "company_seat": "Neubrandenburg",
      "details": "12.12.2024 (Bekanntmachungsdatum)\n\nMecklenburg-Vorpommern Amtsgericht Neubrandenburg HRB 465\nEinreichung neuer Dokumente 16.09.2024 (Eintragungsdatum)\n\nNeubrandenburger Wohnungsgesellschaft mbH\nGesellschaft mit beschränkter Haftung\nNeubrandenburg\n\nEine Liste der Mitglieder des Aufsichtsrats ist zum Handelsregister eingereicht worden."
    },
    {
      "date": "2024-12-12",
      "id": "96244",
      "original_text": "Sonstige Registerbekanntmachung\nBerlin Amtsgericht Berlin (Charlottenburg) HRB 182813\nCURATA Sozialbetriebe GmbH – Berlin",
      "type": "Sonstige Registerbekanntmachung",
      "state": "Berlin",
      "amtsgericht": "Amtsgericht Berlin (Charlottenburg)",
      "registernummer": "HRB 182813",
      "registerart": "HRB",
      "company_name": "CURATA Sozialbetriebe GmbH",
      "company_seat": "Berlin",
      "details": "12.12.2024 (Bekanntmachungsdatum)\n\nBerlin Amtsgericht Berlin (Charlottenburg) HRB 182813\nSonstige Registerbekanntmachung\n\nCURATA Sozialbetriebe GmbH\nGesellschaft mit beschränkter Haftung\nBerlin\n\nAls nicht eingetragen wird veröffentlicht:\n\nDer andere Vertragsteil hat den Gläubigern dieses Rechtsträgers, deren Forderungen begründet worden sind, bevor die Eintragung der Beendigung dieses Vertrages in das Handelsregister nach § 10 des Handelsgesetzbuches als bekannt gemacht gilt, Sicherheit zu leisten, wenn sie sich binnen sechs Monaten nach der Bekanntmachung der Eintragung zu diesem Zweck bei ihm melden. Dieses Recht steht den Gläubigern nicht zu, die im Fall des Insolvenzverfahrens ein Recht auf vorzugsweise Befriedigung aus der Deckungsmasse haben, die nach gesetzlicher Vorschrift zu ihrem Schutz errichtet und staatlich überwacht ist."
    },
    {
      "date": "2024-12-12",
      "id": "96245",
      "original_text": "Registerbekanntmachung nach dem Umwandlungsgesetz\nBaden-Württemberg Amtsgericht Stuttgart GnR 720081\nVermittlungsstelle für Nachbarschaftshilfe in der Landwirtschaft - Kraichgau eG (VNL Kraichgau eG) – Gemmingen",
      "type": "Registerbekanntmachung nach dem Umwandlungsgesetz",
      "state": "Baden-Württemberg",
      "amtsgericht": "Amtsgericht Stuttgart",
      "registernummer": "GnR 720081",
      "registerart": "GnR",
      "company_name": "Vermittlungsstelle für Nachbarschaftshilfe in der Landwirtschaft - Kraichgau eG (VNL Kraichgau eG)",
      "company_seat": "Gemmingen",
      "details": "12.12.2024 (Bekanntmachungsdatum)\n\nBaden-Württemberg Amtsgericht Stuttgart GnR 720081\nRegisterbekanntmachung nach dem Umwandlungsgesetz 12.12.2024 (Eintragungsdatum)\n\nVermittlungsstelle für Nachbarschaftshilfe in der Landwirtschaft - Kraichgau eG (VNL Kraichgau eG)\neingetragene Genossenschaft\nGemmingen\n\nAls nicht eingetragen wird bekanntgemacht:\nDen Gläubigern der an der Verschmelzung beteiligten Rechtsträger ist, wenn sie binnen sechs Monaten nach dem Tag, an dem die Eintragung der Verschmelzung in das Register des Sitzes desjenigen Rechtsträgers, dessen Gläubiger sie sind, nach § 19 Abs. 3 UmwG als bekanntgemacht gilt, ihren Anspruch nach Grund und Höhe schriftlich anmelden, Sicherheit zu leisten, soweit sie nicht Befriedigung verlangen können. Dieses Recht steht den Gläubigern jedoch nur zu, wenn sie glaubhaft machen, dass durch die Verschmelzung die Erfüllung ihrer Forderung gefährdet wird."
    },
    {
      "date": "2024-12-12",
      "id": "96246",
      "original_text": "Registerbekanntmachung nach dem Umwandlungsgesetz\nBaden-Württemberg Amtsgericht Stuttgart GnR 720004\nLandwirtschaftliche Maschinengemeinschaft (LMG) Kraichgau eG – Eppingen",
      "type": "Registerbekanntmachung nach dem Umwandlungsgesetz",
      "state": "Baden-Württemberg",
      "amtsgericht": "Amtsgericht Stuttgart",
      "registernummer": "GnR 720004",
      "registerart": "GnR",
      "company_name": "Landwirtschaftliche Maschinengemeinschaft (LMG) Kraichgau eG",
      "company_seat": "Eppingen",
      "details": "12.12.2024 (Bekanntmachungsdatum)\n\nBaden-Württemberg Amtsgericht Stuttgart GnR 720004\nRegisterbekanntmachung nach dem Umwandlungsgesetz 12.12.2024 (Eintragungsdatum)\n\nLandwirtschaftliche Maschinengemeinschaft (LMG) Kraichgau eG\neingetragene Genossenschaft\nEppingen\n\nDen Gläubigern der an der Verschmelzung beteiligten Rechtsträger ist, wenn sie binnen sechs Monaten nach dem Tag, an dem die Eintragung der Verschmelzung in das Register des Sitzes desjenigen Rechtsträgers, dessen Gläubiger sie sind, nach § 19 Abs. 3 UmwG als bekanntgemacht gilt, ihren Anspruch nach Grund und Höhe schriftlich anmelden, Sicherheit zu leisten, soweit sie nicht Befriedigung verlangen können. Dieses Recht steht den Gläubigern jedoch nur zu, wenn sie glaubhaft machen, dass durch die Verschmelzung die Erfüllung ihrer Forderung gefährdet wird."
    },
    {
      "date": "2024-12-12",
      "id": "96247",
      "original_text": "Löschungsankündigung\nMecklenburg-Vorpommern Amtsgericht Rostock HRB 14293\nWestoph Sicherheitsakademie GmbH – Güstrow",
      "type": "Löschungsankündigung",
      "state": "Mecklenburg-Vorpommern",
      "amtsgericht": "Amtsgericht Rostock",
      "registernummer": "HRB 14293",
      "registerart": "HRB",
      "company_name": "Westoph Sicherheitsakademie GmbH",
      "company_seat": "Güstrow",
      "details": "12.12.2024 (Bekanntmachungsdatum)\n\nMecklenburg-Vorpommern Amtsgericht Rostock HRB 14293\nLöschungsankündigung\n\nWestoph Sicherheitsakademie GmbH\nGesellschaft mit beschränkter Haftung\nGüstrow\n\nDas Registergericht beabsichtigt, die im Handelsregister eingetragene Gesellschaft von Amts wegen nach § 394 FamFG zu löschen. Die Frist zur Erhebung eines Widerspruchs gegen die beabsichtigte Löschung wird auf 1 Monat festgesetzt."
    },
    {
      "date": "2024-12-12",
      "id": "96248",
      "original_text": "Löschungsankündigung\nBerlin Amtsgericht Berlin (Charlottenburg) HRB 145221\nMedius System GmbH – Berlin",
      "type": "Löschungsankündigung",
      "state": "Berlin",
      "amtsgericht": "Amtsgericht Berlin (Charlottenburg)",
      "registernummer": "HRB 145221",
      "registerart": "HRB",
      "company_name": "Medius System GmbH",
      "company_seat": "Berlin",
      "details": "12.12.2024 (Bekanntmachungsdatum)\n\nBerlin Amtsgericht Berlin (Charlottenburg) HRB 145221\nLöschungsankündigung\n\nMedius System GmbH\nGesellschaft mit beschränkter Haftung\nBerlin\n\nBei der nachstehenden Gesellschaft wird das Amtslöschungsverfahren gemäß § 394 FamFG eingeleitet. Widerspruchsfrist 6 Wochen"
    },
    {
      "date": "2024-12-12",
      "id": "96249",
      "original_text": "Löschungsankündigung\nBerlin Amtsgericht Berlin (Charlottenburg) HRB 179605\nCAVA-Bau GmbH – Berlin",
      "type": "Löschungsankündigung",
      "state": "Berlin",
      "amtsgericht": "Amtsgericht Berlin (Charlottenburg)",
      "registernummer": "HRB 179605",
      "registerart": "HRB",
      "company_name": "CAVA-Bau GmbH",
      "company_seat": "Berlin",
      "details": "12.12.2024 (Bekanntmachungsdatum)\n\nBerlin Amtsgericht Berlin (Charlottenburg) HRB 179605\nLöschungsankündigung\n\nCAVA-Bau GmbH\nGesellschaft mit beschränkter Haftung\nBerlin\n\nBei der nachstehenden Gesellschaft wird das Amtslöschungsverfahren gemäß § 394 FamFG eingeleitet. Widerspruchsfrist 6 Wochen"
    },
    {
      "date": "2024-12-12",
      "id": "96250",
      "original_text": "Registerbekanntmachung nach dem Umwandlungsgesetz\nNordrhein-Westfalen Amtsgericht Coesfeld HRA 7564\nFrede, Stengel & Malyga OHG – Nottuln",
      "type": "Registerbekanntmachung nach dem Umwandlungsgesetz",
      "state": "Nordrhein-Westfalen",
      "amtsgericht": "Amtsgericht Coesfeld",
      "registernummer": "HRA 7564",
      "registerart": "HRA",
      "company_name": "Frede, Stengel & Malyga OHG",
      "company_seat": "Nottuln",
      "details": "12.12.2024 (Bekanntmachungsdatum)\n\nNordrhein-Westfalen Amtsgericht Coesfeld HRA 7564\nRegisterbekanntmachung nach dem Umwandlungsgesetz 12.12.2024 (Eintragungsdatum)\n\nFrede, Stengel & Malyga OHG\nOffene Handelsgesellschaft\nNottuln\n\nAls nicht eingetragen wird bekanntgemacht: Den Gläubigern der an der Ausgliederung beteiligten Rechtsträger ist, wenn sie binnen sechs Monaten nach dem Tag, an dem die Eintragung der Ausgliederung in das Register des Sitzes desjenigen Rechtsträgers, dessen Gläubiger sie sind, nach § 19 Absatz 3 UmwG als bekanntgemacht gilt, ihren Anspruch nach Grund und Höhe schriftlich anmelden, Sicherheit zu leisten, soweit sie nicht Befriedigung verlangen können. Dieses Recht steht den Gläubigern jedoch nur zu, wenn sie glaubhaft machen, dass durch die Ausgliederung die Erfüllung ihrer Forderung gefährdet wird. Das Recht, Sicherheitsleistung zu verlangen, steht Gläubigern nicht zu, die im Fall des Insolvenzverfahrens ein Recht auf vorzugsweise Befriedigung aus einer Deckungsmasse haben, die nach gesetzlicher Vorschrift zu ihrem Schutz errichtet und staatlich überwacht ist."
    },
    {
      "date": "2024-12-12",
      "id": "96251",
      "original_text": "Löschungsankündigung\nBerlin Amtsgericht Berlin (Charlottenburg) HRB 207199\nprima ausbau GmbH – Berlin",
      "type": "Löschungsankündigung",
      "state": "Berlin",
      "amtsgericht": "Amtsgericht Berlin (Charlottenburg)",
      "registernummer": "HRB 207199",
      "registerart": "HRB",
      "company_name": "prima ausbau GmbH",
      "company_seat": "Berlin",
      "details": "12.12.2024 (Bekanntmachungsdatum)\n\nBerlin Amtsgericht Berlin (Charlottenburg) HRB 207199\nLöschungsankündigung\n\nprima ausbau GmbH\nGesellschaft mit beschränkter Haftung\nBerlin\n\nBei der nachstehenden Gesellschaft wird das Amtslöschungsverfahren gemäß § 394 FamFG eingeleitet. Widerspruchsfrist 6 Wochen"
    },
    {
      "date": "2024-12-12",
      "id": "96252",
      "original_text": "Registerbekanntmachung nach dem Umwandlungsgesetz\nBrandenburg Amtsgericht Potsdam HRB 38480\nKWD HOLDING GmbH – Potsdam",
      "type": "Registerbekanntmachung nach dem Umwandlungsgesetz",
      "state": "Brandenburg",
      "amtsgericht": "Amtsgericht Potsdam",
      "registernummer": "HRB 38480",
      "registerart": "HRB",
      "company_name": "KWD HOLDING GmbH",
      "company_seat": "Potsdam",
      "details": "12.12.2024 (Bekanntmachungsdatum)\n\nBrandenburg Amtsgericht Potsdam HRB 38480\nRegisterbekanntmachung nach dem Umwandlungsgesetz 12.12.2024 (Eintragungsdatum)\n\nKWD HOLDING GmbH\nGesellschaft mit beschränkter Haftung\nPotsdam\n\nZu Eintragungsnummer 3 vom 12.12.2024 wird als nicht eingetragen veröffentlicht: Den Gläubigern der an der Ausgliederung beteiligten Rechtsträger ist, wenn sie binnen sechs Monaten nach dem Tag, an dem die Eintragung die Ausgliederung in das Register des Sitzes desjenigen Rechtsträgers, dessen Gläubiger sie sind, nach den §§ 125, 19 Abs. 3UmwG als bekannt gemacht gilt, ihren Anspruch nach Grund und Höhe schriftlich anmelden, Sicherheit zu leisten, soweit sie nicht Befriedigung verlangen können. Dieses Recht steht den Gläubigern jedoch nur zu, wenn sie glaubhaft machen, dass durch die Ausgliederung die Erfüllung ihrer Forderung gefährdet wird."
    },
    {
      "date": "2024-12-12",
      "id": "96253",
      "original_text": "Registerbekanntmachung nach dem Umwandlungsgesetz\nBrandenburg Amtsgericht Potsdam HRB 38480\nKWD HOLDING GmbH – Potsdam",
      "type": "Registerbekanntmachung nach dem Umwandlungsgesetz",
      "state": "Brandenburg",
      "amtsgericht": "Amtsgericht Potsdam",
      "registernummer": "HRB 38480",
      "registerart": "HRB",
      "company_name": "KWD HOLDING GmbH",
      "company_seat": "Potsdam",
      "details": "12.12.2024 (Bekanntmachungsdatum)\n\nBrandenburg Amtsgericht Potsdam HRB 38480\nRegisterbekanntmachung nach dem Umwandlungsgesetz 12.12.2024 (Eintragungsdatum)\n\nKWD HOLDING GmbH\nGesellschaft mit beschränkter Haftung\nPotsdam\n\nZu Eintragungsnummer 3 vom 12.12.2024 wird als nicht eingetragen veröffentlicht: Den Gläubigern der an der Ausgliederung beteiligten Rechtsträger ist, wenn sie binnen sechs Monaten nach dem Tag, an dem die Eintragung der Ausgliederung in das Register des Sitzes desjenigen Rechtsträgers, dessen Gläubiger sie sind, nach den §§ 125, 19 Abs. 3 UmwG als bekannt gemacht gilt, ihren Anspruch nach Grund und Höhe schriftlich anmelden, Sicherheit zu leisten, soweit sie nicht Befriedigung verlangen können. Dieses Recht steht den Gläubigern jedoch nur zu, wenn sie glaubhaft machen, dass durch die Ausgliederung die Erfüllung ihrer Forderung gefährdet wird."
    },
    {
      "date": "2024-12-12",
      "id": "96254",
      "original_text": "Registerbekanntmachung nach dem Umwandlungsgesetz\nBrandenburg Amtsgericht Potsdam HRB 38480\nKWD HOLDING GmbH – Potsdam",
      "type": "Registerbekanntmachung nach dem Umwandlungsgesetz",
      "state": "Brandenburg",
      "amtsgericht": "Amtsgericht Potsdam",
      "registernummer": "HRB 38480",
      "registerart": "HRB",
      "company_name": "KWD HOLDING GmbH",
      "company_seat": "Potsdam",
      "details": "12.12.2024 (Bekanntmachungsdatum)\n\nBrandenburg Amtsgericht Potsdam HRB 38480\nRegisterbekanntmachung nach dem Umwandlungsgesetz 12.12.2024 (Eintragungsdatum)\n\nKWD HOLDING GmbH\nGesellschaft mit beschränkter Haftung\nPotsdam\n\nZu Eintragungsnummer 2 vom 12.12.2024 wird als nicht eingetragen veröffentlicht: Den Gläubigern der an der Ausgliederung beteiligten Rechtsträger ist, wenn sie binnen sechs Monaten nach dem Tag, an dem die Eintragung die Ausgliederung in das Register des Sitzes desjenigen Rechtsträgers, dessen Gläubiger sie sind, nach den §§ 125, 19 Abs. 3UmwG als bekannt gemacht gilt, ihren Anspruch nach Grund und Höhe schriftlich anmelden, Sicherheit zu leisten, soweit sie nicht Befriedigung verlangen können. Dieses Recht steht den Gläubigern jedoch nur zu, wenn sie glaubhaft machen, dass durch die Ausgliederung die Erfüllung ihrer Forderung gefährdet wird."
    },
    {
      "date": "2024-12-12",
      "id": "96255",
      "original_text": "Einreichung neuer Dokumente\nBerlin Amtsgericht Berlin (Charlottenburg) HRB 54603\nVBB Verkehrsverbund Berlin-Brandenburg GmbH – Berlin",
      "type": "Einreichung neuer Dokumente",
      "state": "Berlin",
      "amtsgericht": "Amtsgericht Berlin (Charlottenburg)",
      "registernummer": "HRB 54603",
      "registerart": "HRB",
      "company_name": "VBB Verkehrsverbund Berlin-Brandenburg GmbH",
      "company_seat": "Berlin",
      "details": "12.12.2024 (Bekanntmachungsdatum)\n\nBerlin Amtsgericht Berlin (Charlottenburg) HRB 54603\nEinreichung neuer Dokumente\n\nVBB Verkehrsverbund Berlin-Brandenburg GmbH\nGesellschaft mit beschränkter Haftung\nBerlin\n\nAls nicht eingetragen wird veröffentlicht: Es wurde eine neue Liste der Aufsichtsratsmitglieder eingereicht (§52 GmbHG)."
    },
    {
      "date": "2024-12-12",
      "id": "96256",
      "original_text": "Sonstige Registerbekanntmachung\nBaden-Württemberg Amtsgericht Mannheim HRB 720637\nH2Stamping Germany GmbH & Co. KGaA – Königsbach-Stein",
      "type": "Sonstige Registerbekanntmachung",
      "state": "Baden-Württemberg",
      "amtsgericht": "Amtsgericht Mannheim",
      "registernummer": "HRB 720637",
      "registerart": "HRB",
      "company_name": "H2Stamping Germany GmbH & Co. KGaA",
      "company_seat": "Königsbach-Stein",
      "details": "12.12.2024 (Bekanntmachungsdatum)\n\nBaden-Württemberg Amtsgericht Mannheim HRB 720637\nSonstige Registerbekanntmachung\n\nH2Stamping Germany GmbH & Co. KGaA\nKommanditgesellschaft auf Aktien\nKönigsbach-Stein\n\nDie Gesellschaft hat am 11.12.2024 die Liste über die Zusammensetzung des Aufsichtsrats zum Handelsregister eingereicht."
    },
    {
      "date": "2024-12-12",
      "id": "96257",
      "original_text": "Einreichung neuer Dokumente\nBaden-Württemberg Amtsgericht Mannheim HRB 570058\nStadtentwicklungsgesellschaft Wertheim mit beschränkter Haftung – Wertheim",
      "type": "Einreichung neuer Dokumente",
      "state": "Baden-Württemberg",
      "amtsgericht": "Amtsgericht Mannheim",
      "registernummer": "HRB 570058",
      "registerart": "HRB",
      "company_name": "Stadtentwicklungsgesellschaft Wertheim mit beschränkter Haftung",
      "company_seat": "Wertheim",
      "details": "12.12.2024 (Bekanntmachungsdatum)\n\nBaden-Württemberg Amtsgericht Mannheim HRB 570058\nEinreichung neuer Dokumente\n\nStadtentwicklungsgesellschaft Wertheim mit beschränkter Haftung\nGesellschaft mit beschränkter Haftung\nWertheim\n\nDie Gesellschaft hat am 28.11.2024 die Liste über die Zusammensetzung des Aufsichtsrats zum Handelsregister eingereicht."
    },
    {
      "date": "2024-12-12",
      "id": "96258",
      "original_text": "Einreichung neuer Dokumente\nBaden-Württemberg Amtsgericht Stuttgart HRB 301795\nValeo Schalter und Sensoren GmbH – Bietigheim-Bissingen",
      "type": "Einreichung neuer Dokumente",
      "state": "Baden-Württemberg",
      "amtsgericht": "Amtsgericht Stuttgart",
      "registernummer": "HRB 301795",
      "registerart": "HRB",
      "company_name": "Valeo Schalter und Sensoren GmbH",
      "company_seat": "Bietigheim-Bissingen",
      "details": "12.12.2024 (Bekanntmachungsdatum)\n\nBaden-Württemberg Amtsgericht Stuttgart HRB 301795\nEinreichung neuer Dokumente\n\nValeo Schalter und Sensoren GmbH\nGesellschaft mit beschränkter Haftung\nBietigheim-Bissingen\n\nDie Gesellschaft hat am 12.12.2024 die Liste über die Zusammensetzung des Aufsichtsrats zum Handelsregister eingereicht."
    },
    {
      "date": "2024-12-12",
      "id": "96259",
      "original_text": "Sonstige Registerbekanntmachung\nHamburg Amtsgericht Hamburg HRB 154075\nENERPARC Solar Invest 180 GmbH – Hamburg",
      "type": "Sonstige Registerbekanntmachung",
      "state": "Hamburg",
      "amtsgericht": "Amtsgericht Hamburg",
      "registernummer": "HRB 154075",
      "registerart": "HRB",
      "company_name": "ENERPARC Solar Invest 180 GmbH",
      "company_seat": "Hamburg",
      "details": "12.12.2024 (Bekanntmachungsdatum)\n\nHamburg Amtsgericht Hamburg HRB 154075\nSonstige Registerbekanntmachung 12.12.2024 (Eintragungsdatum)\n\nENERPARC Solar Invest 180 GmbH\nGesellschaft mit beschränkter Haftung\nHamburg\n\nAls nicht eingetragen wird bekannt gemacht:  Den Gläubigern der Gesellschaft, deren Forderungen begründet worden sind, bevor die Eintragung der Vertragsbeendigung in das Handelsregister nach § 10 HGB als bekannt gemacht gilt, ist vom anderen Vertragsteil Sicherheit zu leisten, wenn sie sich binnen 6 Monaten nach Bekanntmachung der Eintragung zu diesem Zweck bei ihm melden."
    },
    {
      "date": "2024-12-12",
      "id": "96260",
      "original_text": "Löschungsankündigung\nBerlin Amtsgericht Berlin (Charlottenburg) HRB 173513\nebab UG (haftungsbeschränkt) – Berlin",
      "type": "Löschungsankündigung",
      "state": "Berlin",
      "amtsgericht": "Amtsgericht Berlin (Charlottenburg)",
      "registernummer": "HRB 173513",
      "registerart": "HRB",
      "company_name": "ebab UG (haftungsbeschränkt)",
      "company_seat": "Berlin",
      "details": "12.12.2024 (Bekanntmachungsdatum)\n\nBerlin Amtsgericht Berlin (Charlottenburg) HRB 173513\nLöschungsankündigung\n\nebab UG (haftungsbeschränkt)\nGesellschaft mit beschränkter Haftung\nBerlin\n\nBei der nachstehenden Gesellschaft wird das Amtslöschungsverfahren gemäß § 394 FamFG eingeleitet. Widerspruchsfrist: 6 Wochen."
    },
    {
      "date": "2024-12-12",
      "id": "96261",
      "original_text": "Einreichung neuer Dokumente\nMecklenburg-Vorpommern Amtsgericht Stralsund HRB 60 früher Amtsgericht Rostock\nSWS Seehafen Stralsund GmbH – Stralsund",
      "type": "Einreichung neuer Dokumente",
      "state": "Mecklenburg-Vorpommern",
      "amtsgericht": "Amtsgericht Stralsund",
      "registernummer": "HRB 60",
      "registerart": "HRB",
      "company_name": "SWS Seehafen Stralsund GmbH",
      "company_seat": "Stralsund",
      "former_amtsgericht": "Rostock",
      "details": "12.12.2024 (Bekanntmachungsdatum)\n\nMecklenburg-Vorpommern Amtsgericht Stralsund HRB 60 früher Amtsgericht Rostock\nEinreichung neuer Dokumente\n\nSWS Seehafen Stralsund GmbH\nGesellschaft mit beschränkter Haftung\nStralsund\n\nEine Liste der Mitglieder des Aufsichtsrats ist zum Handelsregister eingereicht worden."
    },
    {
      "date": "2024-12-12",
      "id": "96262",
      "original_text": "Einreichung neuer Dokumente\nSachsen Amtsgericht Chemnitz HRB 8310\nVerkehrslandeplatz Chemnitz/Jahnsdorf Gesellschaft mit beschränkter Haftung – Jahnsdorf/Erzgeb.",
      "type": "Einreichung neuer Dokumente",
      "state": "Sachsen",
      "amtsgericht": "Amtsgericht Chemnitz",
      "registernummer": "HRB 8310",
      "registerart": "HRB",
      "company_name": "Verkehrslandeplatz Chemnitz/Jahnsdorf Gesellschaft mit beschränkter Haftung",
      "company_seat": "Jahnsdorf/Erzgeb.",
      "details": "12.12.2024 (Bekanntmachungsdatum)\n\nSachsen Amtsgericht Chemnitz HRB 8310\nEinreichung neuer Dokumente 11.12.2024 (Eintragungsdatum)\n\nVerkehrslandeplatz Chemnitz/Jahnsdorf Gesellschaft mit beschränkter Haftung\nGesellschaft mit beschränkter Haftung\nJahnsdorf/Erzgeb.\n\nAm 11.12.2024 wurde beim Handelsregister des Amtsgerichts Chemnitz die Liste der Mitglieder des Aufsichtsrats gemäß § 52 GmbHG eingereicht."
    },
    {
      "date": "2024-12-12",
      "id": "96263",
      "original_text": "Registerbekanntmachung nach dem Umwandlungsgesetz\nSachsen Amtsgericht Leipzig VR 2622\nEuropäisches Bildungswerk für Beruf und Gesellschaft e.V. – Leipzig",
      "type": "Registerbekanntmachung nach dem Umwandlungsgesetz",
      "state": "Sachsen",
      "amtsgericht": "Amtsgericht Leipzig",
      "registernummer": "VR 2622",
      "registerart": "VR",
      "company_name": "Europäisches Bildungswerk für Beruf und Gesellschaft e.V.",
      "company_seat": "Leipzig",
      "details": "12.12.2024 (Bekanntmachungsdatum)\n\nSachsen Amtsgericht Leipzig VR 2622\nRegisterbekanntmachung nach dem Umwandlungsgesetz 12.12.2024 (Eintragungsdatum)\n\nEuropäisches Bildungswerk für Beruf und Gesellschaft e.V.\neingetragener Verein\nLeipzig\n\nDen Gläubigern der an der Verschmelzung beteiligten Rechtsträger ist, wenn sie binnen sechs Monaten nach dem Tag, an dem die Eintragung der Verschmelzung in das Register des Sitzes desjenigen Rechtsträgers, dessen Gläubiger sie sind, nach § 19 Abs. 3 UmwG als bekannt gemacht gilt, ihren Anspruch nach Grund und Höhe schriftlich anmelden, Sicherheit zu leisten, soweit sie nicht Befriedigung verlangen können. Dieses Recht steht den Gläubigern jedoch nur zu, wenn sie glaubhaft machen, dass durch die Verschmelzung die Erfüllung der Forderung gefährdet wird."
    },
    {
      "date": "2024-12-12",
      "id": "96264",
      "original_text": "Registerbekanntmachung nach dem Umwandlungsgesetz\nSachsen Amtsgericht Dresden HRB 31154\nSunfire GmbH – Dresden",
      "type": "Registerbekanntmachung nach dem Umwandlungsgesetz",
      "state": "Sachsen",
      "amtsgericht": "Amtsgericht Dresden",
      "registernummer": "HRB 31154",
      "registerart": "HRB",
      "company_name": "Sunfire GmbH",
      "company_seat": "Dresden",
      "details": "12.12.2024 (Bekanntmachungsdatum)\n\nSachsen Amtsgericht Dresden HRB 31154\nRegisterbekanntmachung nach dem Umwandlungsgesetz 12.12.2024 (Eintragungsdatum)\n\nSunfire GmbH\nGesellschaft mit beschränkter Haftung\nDresden\n\nDen Gläubigern der an der Umwandlung beteiligten Rechtsträger ist, wenn sie binnen sechs Monaten nach dem Tag, an dem die Eintragung der Umwandlung  in das Register des Sitzes desjenigen Rechtsträgers, dessen Gläubiger sie sind, nach § 19 Abs. 3 UmwG als bekannt gemacht gilt, ihren Anspruch nach Grund und Höhe schriftlich anmelden, Sicherheit zu leisten, soweit sie nicht Befriedigung verlangen können. Dieses Recht steht den Gläubigern jedoch nur zu, wenn sie glaubhaft machen, dass durch die Umwandlung die Erfüllung der Forderung gefährdet wird."
    },
    {
      "date": "2024-12-12",
      "id": "96265",
      "original_text": "Einreichung neuer Dokumente\nSachsen Amtsgericht Leipzig HRB 3058\nStadtwerke Leipzig GmbH – Leipzig",
      "type": "Einreichung neuer Dokumente",
      "state": "Sachsen",
      "amtsgericht": "Amtsgericht Leipzig",
      "registernummer": "HRB 3058",
      "registerart": "HRB",
      "company_name": "Stadtwerke Leipzig GmbH",
      "company_seat": "Leipzig",
      "details": "12.12.2024 (Bekanntmachungsdatum)\n\nSachsen Amtsgericht Leipzig HRB 3058\nEinreichung neuer Dokumente\n\nStadtwerke Leipzig GmbH\nGesellschaft mit beschränkter Haftung\nLeipzig\n\nAm 10.12.2024 wurde beim Handelsregister des Amtsgerichts Leipzig die Liste der Mitglieder des Aufsichtsrats gemäß § 52 GmbHG eingereicht."
    },
    {
      "date": "2024-12-12",
      "id": "96266",
      "original_text": "Löschungsankündigung\nBrandenburg Amtsgericht Potsdam HRB 33485\nTRD UG (haftungsbeschränkt) – Zossen",
      "type": "Löschungsankündigung",
      "state": "Brandenburg",
      "amtsgericht": "Amtsgericht Potsdam",
      "registernummer": "HRB 33485",
      "registerart": "HRB",
      "company_name": "TRD UG (haftungsbeschränkt)",
      "company_seat": "Zossen",
      "details": "12.12.2024 (Bekanntmachungsdatum)\n\nBrandenburg Amtsgericht Potsdam HRB 33485\nLöschungsankündigung\n\nTRD UG (haftungsbeschränkt)\nGesellschaft mit beschränkter Haftung\nZossen\n\nBei der nachstehenden Gesellschaft wird das Amtslöschungsverfahren gemäß § 394 FamFG eingeleitet."
    },
    {
      "date": "2024-12-12",
      "id": "96267",
      "original_text": "Löschungsankündigung\nBrandenburg Amtsgericht Potsdam HRB 36255\nFWD Construction GmbH – Ludwigsfelde",
      "type": "Löschungsankündigung",
      "state": "Brandenburg",
      "amtsgericht": "Amtsgericht Potsdam",
      "registernummer": "HRB 36255",
      "registerart": "HRB",
      "company_name": "FWD Construction GmbH",
      "company_seat": "Ludwigsfelde",
      "details": "12.12.2024 (Bekanntmachungsdatum)\n\nBrandenburg Amtsgericht Potsdam HRB 36255\nLöschungsankündigung\n\nFWD Construction GmbH\nGesellschaft mit beschränkter Haftung\nLudwigsfelde\n\nBei der nachstehenden Gesellschaft wird das Amtslöschungsverfahren gemäß § 394 FamFG eingeleitet."
    },
    {
      "date": "2024-12-12",
      "id": "96268",
      "original_text": "Registerbekanntmachung nach dem Umwandlungsgesetz\nNiedersachsen Amtsgericht Hannover HRB 214106\nMSN 1359 GmbH – Hannover",
      "type": "Registerbekanntmachung nach dem Umwandlungsgesetz",
      "state": "Niedersachsen",
      "amtsgericht": "Amtsgericht Hannover",
      "registernummer": "HRB 214106",
      "registerart": "HRB",
      "company_name": "MSN 1359 GmbH",
      "company_seat": "Hannover",
      "details": "12.12.2024 (Bekanntmachungsdatum)\n\nNiedersachsen Amtsgericht Hannover HRB 214106\nRegisterbekanntmachung nach dem Umwandlungsgesetz 12.12.2024 (Eintragungsdatum)\n\nMSN 1359 GmbH\nGesellschaft mit beschränkter Haftung\nHannover\n\nDen Gläubigern der an der formwechselnden Umwandlung beteiligten Rechtsträger ist, wenn sie binnen sechs Monaten nach dem Tag, an dem die Eintragung der Umwandlung in das Register des Sitzes desjenigen Rechtsträgers, dessen Gläubiger sie sind, nach § 19 Abs. 3 UmwG als bekannt gemacht gilt, ihren Anspruch nach Grund und Höhe schriftlich anmelden, Sicherheit zu leisten, soweit sie nicht Befriedigung verlangen können. Dieses Recht steht den Gläubigern jedoch nur zu, wenn sie glaubhaft machen, dass durch die formwechselnde Umwandlung die Erfüllung der Forderung gefährdet wird."
    },
    {
      "date": "2024-12-12",
      "id": "96269",
      "original_text": "Registerbekanntmachung nach dem Umwandlungsgesetz\nNiedersachsen Amtsgericht Osnabrück HRB 202584\nakzent Küchen GmbH – Nordhorn",
      "type": "Registerbekanntmachung nach dem Umwandlungsgesetz",
      "state": "Niedersachsen",
      "amtsgericht": "Amtsgericht Osnabrück",
      "registernummer": "HRB 202584",
      "registerart": "HRB",
      "company_name": "akzent Küchen GmbH",
      "company_seat": "Nordhorn",
      "details": "12.12.2024 (Bekanntmachungsdatum)\n\nNiedersachsen Amtsgericht Osnabrück HRB 202584\nRegisterbekanntmachung nach dem Umwandlungsgesetz 12.12.2024 (Eintragungsdatum)\n\nakzent Küchen GmbH\nGesellschaft mit beschränkter Haftung\nNordhorn\n\nDen Gläubigern der an der formwechselnden Umwandlung beteiligten Rechtsträger ist, wenn sie binnen sechs Monaten nach dem Tag, an dem die Eintragung der Umwandlung in das Register des Sitzes desjenigen Rechtsträgers, dessen Gläubiger sie sind, nach § 19 Abs. 3 UmwG als bekannt gemacht gilt, ihren Anspruch nach Grund und Höhe schriftlich anmelden, Sicherheit zu leisten, soweit sie nicht Befriedigung verlangen können. Dieses Recht steht den Gläubigern jedoch nur zu, wenn sie glaubhaft machen, dass durch die formwechselnde Umwandlung die Erfüllung der Forderung gefährdet wird."
    },
    {
      "date": "2024-12-12",
      "id": "96270",
      "original_text": "Löschungsankündigung\nNiedersachsen Amtsgericht Hannover HRB 211397\nThe Exotica Company GmbH – Hannover",
      "type": "Löschungsankündigung",
      "state": "Niedersachsen",
      "amtsgericht": "Amtsgericht Hannover",
      "registernummer": "HRB 211397",
      "registerart": "HRB",
      "company_name": "The Exotica Company GmbH",
      "company_seat": "Hannover",
      "details": "12.12.2024 (Bekanntmachungsdatum)\n\nNiedersachsen Amtsgericht Hannover HRB 211397\nLöschungsankündigung\n\nThe Exotica Company GmbH\nGesellschaft mit beschränkter Haftung\nHannover\n\nDas Registergericht beabsichtigt, die Gesellschaft von Amts wegen nach § 394 FamFG zu löschen. Die Frist zur Erhebung eines Widerspruchs ist auf 1 Monat ab dieser Registerbekanntmachung festgesetzt."
    },
    {
      "date": "2024-12-12",
      "id": "96271",
      "original_text": "Einreichung neuer Dokumente\nNiedersachsen Amtsgericht Hannover HRB 208046\nChannel 21 Holding AG – Hannover",
      "type": "Einreichung neuer Dokumente",
      "state": "Niedersachsen",
      "amtsgericht": "Amtsgericht Hannover",
      "registernummer": "HRB 208046",
      "registerart": "HRB",
      "company_name": "Channel 21 Holding AG",
      "company_seat": "Hannover",
      "details": "12.12.2024 (Bekanntmachungsdatum)\n\nNiedersachsen Amtsgericht Hannover HRB 208046\nEinreichung neuer Dokumente 12.12.2024 (Eintragungsdatum)\n\nChannel 21 Holding AG\nAktiengesellschaft\nHannover\n\nDie Liste der Mitglieder des Aufsichtsrats wurde beim Registergericht eingereicht."
    },
    {
      "date": "2024-12-12",
      "id": "96272",
      "original_text": "Löschungsankündigung\nNiedersachsen Amtsgericht Osnabrück HRB 217025\nGlobal Lease Seta GmbH – Dissen a.T.W.",
      "type": "Löschungsankündigung",
      "state": "Niedersachsen",
      "amtsgericht": "Amtsgericht Osnabrück",
      "registernummer": "HRB 217025",
      "registerart": "HRB",
      "company_name": "Global Lease Seta GmbH",
      "company_seat": "Dissen a.T.W.",
      "details": "12.12.2024 (Bekanntmachungsdatum)\n\nNiedersachsen Amtsgericht Osnabrück HRB 217025\nLöschungsankündigung\n\nGlobal Lease Seta GmbH\nGesellschaft mit beschränkter Haftung\nDissen a.T.W.\n\nDas Registergericht beabsichtigt, die Gesellschaft von Amts wegen nach § 394 FamFG wegen Vermögenslosigkeit zu löschen. Die Frist zur Erhebung eines Widerspruchs ist auf 1 Monat ab dieser Registerbekanntmachung festgesetzt."
    },
    {
      "date": "2024-12-12",
      "id": "96273",
      "original_text": "Registerbekanntmachung nach dem Umwandlungsgesetz\nNiedersachsen Amtsgericht Walsrode HRA 205500\nGerd Landwermann GmbH & Co. KG – Nienburg",
      "type": "Registerbekanntmachung nach dem Umwandlungsgesetz",
      "state": "Niedersachsen",
      "amtsgericht": "Amtsgericht Walsrode",
      "registernummer": "HRA 205500",
      "registerart": "HRA",
      "company_name": "Gerd Landwermann GmbH & Co. KG",
      "company_seat": "Nienburg",
      "details": "12.12.2024 (Bekanntmachungsdatum)\n\nNiedersachsen Amtsgericht Walsrode HRA 205500\nRegisterbekanntmachung nach dem Umwandlungsgesetz 12.12.2024 (Eintragungsdatum)\n\nGerd Landwermann GmbH & Co. KG\nKommanditgesellschaft\nNienburg\n\nDen Gläubigern der an der Ausgliederung beteiligten Rechtsträger ist, wenn sie binnen sechs Monaten nach dem Tag, an dem die Eintragung der Ausgliederung in das Register des Sitzes desjenigen Rechtsträgers, dessen Gläubiger sie sind, nach § 19 Abs. 3 UmwG als bekannt gemacht gilt, ihren Anspruch nach Grund und Höhe schriftlich anmelden, Sicherheit zu leisten, soweit sie nicht Befriedigung verlangen können. Dieses Recht steht den Gläubigern jedoch nur zu, wenn sie glaubhaft machen, dass durch die Ausgliederung die Erfüllung der Forderung gefährdet wird."
    },
    {
      "date": "2024-12-12",
      "id": "96274",
      "original_text": "Einreichung neuer Dokumente\nSaarland Amtsgericht Saarbrücken HRB 108025\nNext2Sun AG – Dillingen/Saar",
      "type": "Einreichung neuer Dokumente",
      "state": "Saarland",
      "amtsgericht": "Amtsgericht Saarbrücken",
      "registernummer": "HRB 108025",
      "registerart": "HRB",
      "company_name": "Next2Sun AG",
      "company_seat": "Dillingen/Saar",
      "details": "12.12.2024 (Bekanntmachungsdatum)\n\nSaarland Amtsgericht Saarbrücken HRB 108025\nEinreichung neuer Dokumente 11.12.2024 (Eintragungsdatum)\n\nNext2Sun AG\nAktiengesellschaft\nDillingen/Saar\n\nDer Vorstand der Gesellschaft hat eine Liste der Mitglieder des Aufsichtsrats zum Handelsregister eingereicht (§ 106 AktG)."
    },
    {
      "date": "2024-12-12",
      "id": "96275",
      "original_text": "Einreichung neuer Dokumente\nSaarland Amtsgericht Saarbrücken HRB 104799\nEVS BioMasse Zentrum GmbH (EVS BMZ GmbH) – Saarbrücken",
      "type": "Einreichung neuer Dokumente",
      "state": "Saarland",
      "amtsgericht": "Amtsgericht Saarbrücken",
      "registernummer": "HRB 104799",
      "registerart": "HRB",
      "company_name": "EVS BioMasse Zentrum GmbH (EVS BMZ GmbH)",
      "company_seat": "Saarbrücken",
      "details": "12.12.2024 (Bekanntmachungsdatum)\n\nSaarland Amtsgericht Saarbrücken HRB 104799\nEinreichung neuer Dokumente\n\nEVS BioMasse Zentrum GmbH (EVS BMZ GmbH)\nGesellschaft mit beschränkter Haftung\nSaarbrücken\n\nDie Geschäftsführung der Gesellschaft hat eine Liste der Mitglieder des Aufsichtsrats zum Handelsregister eingereicht (§ 52 Abs. 3 Satz 2 GmbHG)."
    },
    {
      "date": "2024-12-12",
      "id": "96276",
      "original_text": "Löschungsankündigung\nRheinland-Pfalz Amtsgericht Montabaur HRB 4751\nKempf Verwaltungsgesellschaft mbH – Müschenbach",
      "type": "Löschungsankündigung",
      "state": "Rheinland-Pfalz",
      "amtsgericht": "Amtsgericht Montabaur",
      "registernummer": "HRB 4751",
      "registerart": "HRB",
      "company_name": "Kempf Verwaltungsgesellschaft mbH",
      "company_seat": "Müschenbach",
      "details": "12.12.2024 (Bekanntmachungsdatum)\n\nRheinland-Pfalz Amtsgericht Montabaur HRB 4751\nLöschungsankündigung\n\nKempf Verwaltungsgesellschaft mbH\nGesellschaft mit beschränkter Haftung\nMüschenbach\n\nDas Registergericht beabsichtigt die Gesellschaft von Amts wegen nach § 394 FamFG zu löschen. Die Frist zur Erhebung eines Widerspruchs ist auf einen Monat festgesetzt."
    },
    {
      "date": "2024-12-12",
      "id": "96277",
      "original_text": "Registerbekanntmachung nach dem Umwandlungsgesetz\nRheinland-Pfalz Amtsgericht Kaiserslautern HRA 30946\nRüger Eberle Besitzunternehmen e.K. – Kirchheimbolanden",
      "type": "Registerbekanntmachung nach dem Umwandlungsgesetz",
      "state": "Rheinland-Pfalz",
      "amtsgericht": "Amtsgericht Kaiserslautern",
      "registernummer": "HRA 30946",
      "registerart": "HRA",
      "company_name": "Rüger Eberle Besitzunternehmen e.K.",
      "company_seat": "Kirchheimbolanden",
      "details": "12.12.2024 (Bekanntmachungsdatum)\n\nRheinland-Pfalz Amtsgericht Kaiserslautern HRA 30946\nRegisterbekanntmachung nach dem Umwandlungsgesetz 12.12.2024 (Eintragungsdatum)\n\nRüger Eberle Besitzunternehmen e.K.\nEinzelkaufmann / Einzelkauffrau\nKirchheimbolanden\n\nAls nicht eingetragen wird veröffentlicht: Den Gläubigern der an der Ausgliederung beteiligten Rechtsträger ist, wenn sie binnen sechs Monaten nach dem Tag, an dem die Eintragung der Ausgliederung in das Register des Sitzes desjenigen Rechtsträgers, dessen Gläubiger sie sind, nach § 19 Abs. 3 UmwG als bekannt gemacht gilt, ihren Anspruch nach Grund und Höhe schriftlich anmelden, Sicherheit zu leisten, soweit sie nicht Befriedigung verlangen können. Dieses Recht steht den Gläubigern jedoch nur zu, wenn sie glaubhaft machen, dass durch die Ausgliederung die Erfüllung der Forderung gefährdet wird."
    },
    {
      "date": "2024-12-12",
      "id": "96278",
      "original_text": "Registerbekanntmachung nach dem Umwandlungsgesetz\nRheinland-Pfalz Amtsgericht Montabaur HRA 4224\nResi Kranz Grundbesitz GmbH & Co.KG – Nauroth",
      "type": "Registerbekanntmachung nach dem Umwandlungsgesetz",
      "state": "Rheinland-Pfalz",
      "amtsgericht": "Amtsgericht Montabaur",
      "registernummer": "HRA 4224",
      "registerart": "HRA",
      "company_name": "Resi Kranz Grundbesitz GmbH & Co.KG",
      "company_seat": "Nauroth",
      "details": "12.12.2024 (Bekanntmachungsdatum)\n\nRheinland-Pfalz Amtsgericht Montabaur HRA 4224\nRegisterbekanntmachung nach dem Umwandlungsgesetz 12.12.2024 (Eintragungsdatum)\n\nResi Kranz Grundbesitz GmbH & Co.KG\nKommanditgesellschaft\nNauroth\n\nAls nicht eingetragen wird veröffentlicht: Den Gläubigern der an der Verschmelzung beteiligten Rechtsträger ist, wenn sie binnen sechs Monaten nach dem Tag, an dem die Eintragung der Verschmelzung in das Register des Sitzes desjenigen Rechtsträgers, dessen Gläubiger sie sind, nach § 19 Abs. 3 UmwG als bekannt gemacht gilt, ihren Anspruch nach Grund und Höhe schriftlich anmelden, Sicherheit zu leisten, soweit sie nicht Befriedigung verlangen können. Dieses Recht steht den Gläubigern jedoch nur zu, wenn sie glaubhaft machen, dass durch die Verschmelzung die Erfüllung der Forderung gefährdet wird."
    },
    {
      "date": "2024-12-12",
      "id": "96279",
      "original_text": "Registerbekanntmachung nach dem Umwandlungsgesetz\nRheinland-Pfalz Amtsgericht Montabaur HRA 4221\nPeter Kranz Grundbesitz GmbH & Co.KG – Nauroth",
      "type": "Registerbekanntmachung nach dem Umwandlungsgesetz",
      "state": "Rheinland-Pfalz",
      "amtsgericht": "Amtsgericht Montabaur",
      "registernummer": "HRA 4221",
      "registerart": "HRA",
      "company_name": "Peter Kranz Grundbesitz GmbH & Co.KG",
      "company_seat": "Nauroth",
      "details": "12.12.2024 (Bekanntmachungsdatum)\n\nRheinland-Pfalz Amtsgericht Montabaur HRA 4221\nRegisterbekanntmachung nach dem Umwandlungsgesetz 12.12.2024 (Eintragungsdatum)\n\nPeter Kranz Grundbesitz GmbH & Co.KG\nKommanditgesellschaft\nNauroth\n\nAls nicht eingetragen wird veröffentlicht: Den Gläubigern der an der Verschmelzung beteiligten Rechtsträger ist, wenn sie binnen sechs Monaten nach dem Tag, an dem die Eintragung der Verschmelzung in das Register des Sitzes desjenigen Rechtsträgers, dessen Gläubiger sie sind, nach § 19 Abs. 3 UmwG als bekannt gemacht gilt, ihren Anspruch nach Grund und Höhe schriftlich anmelden, Sicherheit zu leisten, soweit sie nicht Befriedigung verlangen können. Dieses Recht steht den Gläubigern jedoch nur zu, wenn sie glaubhaft machen, dass durch die Verschmelzung die Erfüllung der Forderung gefährdet wird."
    },
    {
      "date": "2024-12-12",
      "id": "96280",
      "original_text": "Registerbekanntmachung nach dem Umwandlungsgesetz\nRheinland-Pfalz Amtsgericht Kaiserslautern HRA 11410\nRS TANK- und WASCH GmbH & Co. KG – Kirchheimbolanden",
      "type": "Registerbekanntmachung nach dem Umwandlungsgesetz",
      "state": "Rheinland-Pfalz",
      "amtsgericht": "Amtsgericht Kaiserslautern",
      "registernummer": "HRA 11410",
      "registerart": "HRA",
      "company_name": "RS TANK- und WASCH GmbH & Co. KG",
      "company_seat": "Kirchheimbolanden",
      "details": "12.12.2024 (Bekanntmachungsdatum)\n\nRheinland-Pfalz Amtsgericht Kaiserslautern HRA 11410\nRegisterbekanntmachung nach dem Umwandlungsgesetz 12.12.2024 (Eintragungsdatum)\n\nRS TANK- und WASCH GmbH & Co. KG\nKommanditgesellschaft\nKirchheimbolanden\n\nAls nicht eingetragen wird veröffentlicht: Den Gläubigern der an der Ausgliederung beteiligten Rechtsträger ist, wenn sie binnen sechs Monaten nach dem Tag, an dem die Eintragung der Ausgliederung in das Register des Sitzes desjenigen Rechtsträgers, dessen Gläubiger sie sind, nach § 19 Abs. 3 UmwG als bekannt gemacht gilt, ihren Anspruch nach Grund und Höhe schriftlich anmelden, Sicherheit zu leisten, soweit sie nicht Befriedigung verlangen können. Dieses Recht steht den Gläubigern jedoch nur zu, wenn sie glaubhaft machen, dass durch die Ausgliederung die Erfüllung der Forderung gefährdet wird."
    },
    {
      "date": "2024-12-12",
      "id": "96281",
      "original_text": "Löschungsankündigung\nRheinland-Pfalz Amtsgericht Mainz HRB 46537\nAzur GmbH – Mainz",
      "type": "Löschungsankündigung",
      "state": "Rheinland-Pfalz",
      "amtsgericht": "Amtsgericht Mainz",
      "registernummer": "HRB 46537",
      "registerart": "HRB",
      "company_name": "Azur GmbH",
      "company_seat": "Mainz",
      "details": "12.12.2024 (Bekanntmachungsdatum)\n\nRheinland-Pfalz Amtsgericht Mainz HRB 46537\nLöschungsankündigung\n\nAzur GmbH\nGesellschaft mit beschränkter Haftung\nMainz\n\nDas Registergericht beabsichtigt die Gesellschaft von Amts wegen nach § 394 FamFG zu löschen. Die Frist zur Erhebung eines Widerspruchs ist auf einen Monat festgesetzt."
    },
    {
      "date": "2024-12-12",
      "id": "96282",
      "original_text": "Löschungsankündigung\nNordrhein-Westfalen Amtsgericht Steinfurt HRB 13783\nsinus Performance GmbH – Westerkappeln",
      "type": "Löschungsankündigung",
      "state": "Nordrhein-Westfalen",
      "amtsgericht": "Amtsgericht Steinfurt",
      "registernummer": "HRB 13783",
      "registerart": "HRB",
      "company_name": "sinus Performance GmbH",
      "company_seat": "Westerkappeln",
      "details": "12.12.2024 (Bekanntmachungsdatum)\n\nNordrhein-Westfalen Amtsgericht Steinfurt HRB 13783\nLöschungsankündigung\n\nsinus Performance GmbH\nGesellschaft mit beschränkter Haftung\nWesterkappeln\n\nDas Registergericht beabsichtigt, die im Handelsregister eingetragene Gesellschaft gemäß § 394 Absatz 1 FamFG wegen Vermögenslosigkeit von Amts wegen zu löschen.\n\nGegen diese Verfügung kann Widerspruch eingelegt werden. Die Frist zur Erhebung eines Widerspruchs gegen die beabsichtigte Löschung von Amts wegen ist auf einen Monat festgesetzt.\n\nRechtsbehelfsbelehrung:\n\nGegen diese Verfügung können Sie Widerspruch einlegen.\n\nDer Widerspruch ist bei dem Amtsgericht Steinfurt, Gerichtstraße 2, 48565 Steinfurt schriftlich in deutscher Sprache oder zur Niederschrift der Geschäftsstelle einzulegen. Der Widerspruch kann auch zur Niederschrift der Geschäftsstelle eines jeden Amtsgerichtes abgegeben werden.\nDie Einlegung ist auch durch Übertragung eines elektronischen Dokuments an die elektronische Poststelle des Gerichts möglich. Das elektronische Dokument muss für die Bearbeitung durch das Gericht geeignet und mit einer qualifizierten elektronischen Signatur der verantwortenden Person versehen sein oder von der verantwortenden Person signiert und auf einem sicheren Übermittlungsweg gemäß § 130 a ZPO nach näherer Maßgabe der Verordnung über die technischen Rahmenbedingungen des elektronischen Rechtsverkehrs und über das besondere elektronische Behördenpostfach (BGBl. I, S.3803) eingereicht werden. Weitere Informationen erhalten Sie auf der Internetseite www.justiz.de.\n\nDer Widerspruch muss spätestens innerhalb der gesetzten Frist bei dem Amtsgericht Steinfurt eingegangen sein. Dies gilt auch dann, wenn der Widerspruch zur Niederschrift der Geschäftsstelle eines anderen Amtsgerichtes abgegeben wurde. Die Frist beginnt mit der Veröffentlichung. Fällt das Ende der Frist auf einen Sonntag, einen allgemeinen Feiertag oder Sonnabend, so endet die Frist mit Ablauf des nächsten Werktages.\n\nDer Widerspruch muss die Bezeichnung der angefochtenen Verfügung sowie die Erklärung enthalten, dass Widerspruch gegen diese Verfügung eingelegt wird. Er ist zu unterzeichnen und soll begründet werden."
    },
    {
      "date": "2024-12-12",
      "id": "96283",
      "original_text": "Löschungsankündigung\nNordrhein-Westfalen Amtsgericht Dortmund HRB 32135\nResidenz-Bau GmbH – Dortmund",
      "type": "Löschungsankündigung",
      "state": "Nordrhein-Westfalen",
      "amtsgericht": "Amtsgericht Dortmund",
      "registernummer": "HRB 32135",
      "registerart": "HRB",
      "company_name": "Residenz-Bau GmbH",
      "company_seat": "Dortmund",
      "details": "12.12.2024 (Bekanntmachungsdatum)\n\nNordrhein-Westfalen Amtsgericht Dortmund HRB 32135\nLöschungsankündigung 12.12.2024 (Eintragungsdatum)\n\nResidenz-Bau GmbH\nGesellschaft mit beschränkter Haftung\nDortmund\n\nDas Registergericht beabsichtigt die Gesellschaft von Amts wegen nach § 394 FamFG zu löschen. Die Frist zur Erhebung eines Widerspruchs ist auf zwei Monate festgesetzt."
    },
    {
      "date": "2024-12-12",
      "id": "96284",
      "original_text": "Registerbekanntmachung nach dem Umwandlungsgesetz\nNordrhein-Westfalen Amtsgericht Düsseldorf HRB 103631\nUnibail-Rodamco-Westfield Real Estate Management GmbH – Düsseldorf",
      "type": "Registerbekanntmachung nach dem Umwandlungsgesetz",
      "state": "Nordrhein-Westfalen",
      "amtsgericht": "Amtsgericht Düsseldorf",
      "registernummer": "HRB 103631",
      "registerart": "HRB",
      "company_name": "Unibail-Rodamco-Westfield Real Estate Management GmbH",
      "company_seat": "Düsseldorf",
      "details": "12.12.2024 (Bekanntmachungsdatum)\n\nNordrhein-Westfalen Amtsgericht Düsseldorf HRB 103631\nRegisterbekanntmachung nach dem Umwandlungsgesetz 12.12.2024 (Eintragungsdatum)\n\nUnibail-Rodamco-Westfield Real Estate Management GmbH\nGesellschaft mit beschränkter Haftung\nDüsseldorf\n\nDen Gläubigern der an der Abspaltung beteiligten Rechtsträger ist, wenn sie binnen sechs Monaten nach dem Tag, an dem die Eintragung der Abspaltung in das Register des Sitzes desjenigen Rechtsträgers, dessen Gläubiger sie sind, nach § 19 Absatz 3 UmwG als bekanntgemacht gilt, ihren Anspruch nach Grund und Höhe schriftlich anmelden, Sicherheit zu leisten, soweit sie nicht Befriedigung verlangen können. Dieses Recht steht den Gläubigern jedoch nur zu, wenn sie glaubhaft machen, dass durch die Abspaltung die Erfüllung ihrer Forderung gefährdet wird."
    },
    {
      "date": "2024-12-12",
      "id": "96285",
      "original_text": "Löschungsankündigung\nNordrhein-Westfalen Amtsgericht Recklinghausen HRB 8350\nLST LOGISTIK UG (haftungsbeschränkt) – Waltrop",
      "type": "Löschungsankündigung",
      "state": "Nordrhein-Westfalen",
      "amtsgericht": "Amtsgericht Recklinghausen",
      "registernummer": "HRB 8350",
      "registerart": "HRB",
      "company_name": "LST LOGISTIK UG (haftungsbeschränkt)",
      "company_seat": "Waltrop",
      "details": "12.12.2024 (Bekanntmachungsdatum)\n\nNordrhein-Westfalen Amtsgericht Recklinghausen HRB 8350\nLöschungsankündigung\n\nLST LOGISTIK UG (haftungsbeschränkt)\nGesellschaft mit beschränkter Haftung\nWaltrop\n\nDas Registergericht beabsichtigt die Gesellschaft von Amts wegen nach § 394 FamFG zu löschen. Die Frist zur Erhebung eines Widerspruchs ist auf zwei Monate festgesetzt."
    },
    {
      "date": "2024-12-12",
      "id": "96286",
      "original_text": "Löschungsankündigung\nNordrhein-Westfalen Amtsgericht Steinfurt HRB 10520\nCP Unitech Fenster und Türen GmbH – Hörstel",
      "type": "Löschungsankündigung",
      "state": "Nordrhein-Westfalen",
      "amtsgericht": "Amtsgericht Steinfurt",
      "registernummer": "HRB 10520",
      "registerart": "HRB",
      "company_name": "CP Unitech Fenster und Türen GmbH",
      "company_seat": "Hörstel",
      "details": "12.12.2024 (Bekanntmachungsdatum)\n\nNordrhein-Westfalen Amtsgericht Steinfurt HRB 10520\nLöschungsankündigung\n\nCP Unitech Fenster und Türen GmbH\nGesellschaft mit beschränkter Haftung\nHörstel\n\nDas Registergericht beabsichtigt, die im Handelsregister eingetragene Gesellschaft gemäß § 394 Absatz 1 FamFG wegen Vermögenslosigkeit von Amts wegen zu löschen.\n\nGegen diese Verfügung kann Widerspruch eingelegt werden. Die Frist zur Erhebung eines Widerspruchs gegen die beabsichtigte Löschung von Amts wegen ist auf einen Monat festgesetzt.\n\nRechtsbehelfsbelehrung:\n\nGegen diese Verfügung können Sie Widerspruch einlegen.\n\nDer Widerspruch ist bei dem Amtsgericht Steinfurt, Gerichtstraße 2, 48565 Steinfurt schriftlich in deutscher Sprache oder zur Niederschrift der Geschäftsstelle einzulegen. Der Widerspruch kann auch zur Niederschrift der Geschäftsstelle eines jeden Amtsgerichtes abgegeben werden.\nDie Einlegung ist auch durch Übertragung eines elektronischen Dokuments an die elektronische Poststelle des Gerichts möglich. Das elektronische Dokument muss für die Bearbeitung durch das Gericht geeignet und mit einer qualifizierten elektronischen Signatur der verantwortenden Person versehen sein oder von der verantwortenden Person signiert und auf einem sicheren Übermittlungsweg gemäß § 130 a ZPO nach näherer Maßgabe der Verordnung über die technischen Rahmenbedingungen des elektronischen Rechtsverkehrs und über das besondere elektronische Behördenpostfach (BGBl. I, S.3803) eingereicht werden. Weitere Informationen erhalten Sie auf der Internetseite www.justiz.de.\n\nDer Widerspruch muss spätestens innerhalb der gesetzten Frist bei dem Amtsgericht Steinfurt eingegangen sein. Dies gilt auch dann, wenn der Widerspruch zur Niederschrift der Geschäftsstelle eines anderen Amtsgerichtes abgegeben wurde. Die Frist beginnt mit der Veröffentlichung. Fällt das Ende der Frist auf einen Sonntag, einen allgemeinen Feiertag oder Sonnabend, so endet die Frist mit Ablauf des nächsten Werktages.\n\nDer Widerspruch muss die Bezeichnung der angefochtenen Verfügung sowie die Erklärung enthalten, dass Widerspruch gegen diese Verfügung eingelegt wird. Er ist zu unterzeichnen und soll begründet werden."
    },
    {
      "date": "2024-12-12",
      "id": "96287",
      "original_text": "Registerbekanntmachung nach dem Umwandlungsgesetz\nNordrhein-Westfalen Amtsgericht Düsseldorf HRB 76028\nmfi Shopping Center Management GmbH – Düsseldorf",
      "type": "Registerbekanntmachung nach dem Umwandlungsgesetz",
      "state": "Nordrhein-Westfalen",
      "amtsgericht": "Amtsgericht Düsseldorf",
      "registernummer": "HRB 76028",
      "registerart": "HRB",
      "company_name": "mfi Shopping Center Management GmbH",
      "company_seat": "Düsseldorf",
      "details": "12.12.2024 (Bekanntmachungsdatum)\n\nNordrhein-Westfalen Amtsgericht Düsseldorf HRB 76028\nRegisterbekanntmachung nach dem Umwandlungsgesetz 12.12.2024 (Eintragungsdatum)\n\nmfi Shopping Center Management GmbH\nGesellschaft mit beschränkter Haftung\nDüsseldorf\n\nDen Gläubigern der an der Abspaltung beteiligten Rechtsträger ist, wenn sie binnen sechs Monaten nach dem Tag, an dem die Eintragung der Abspaltung in das Register des Sitzes desjenigen Rechtsträgers, dessen Gläubiger sie sind, nach § 19 Absatz 3 UmwG als bekanntgemacht gilt, ihren Anspruch nach Grund und Höhe schriftlich anmelden, Sicherheit zu leisten, soweit sie nicht Befriedigung verlangen können. Dieses Recht steht den Gläubigern jedoch nur zu, wenn sie glaubhaft machen, dass durch die Abspaltung die Erfüllung ihrer Forderung gefährdet wird."
    },
    {
      "date": "2024-12-12",
      "id": "96288",
      "original_text": "Registerbekanntmachung nach dem Umwandlungsgesetz\nNordrhein-Westfalen Amtsgericht Arnsberg HRA 9249\nElemente Bau Aust e.K. – Menden",
      "type": "Registerbekanntmachung nach dem Umwandlungsgesetz",
      "state": "Nordrhein-Westfalen",
      "amtsgericht": "Amtsgericht Arnsberg",
      "registernummer": "HRA 9249",
      "registerart": "HRA",
      "company_name": "Elemente Bau Aust e.K.",
      "company_seat": "Menden",
      "details": "12.12.2024 (Bekanntmachungsdatum)\n\nNordrhein-Westfalen Amtsgericht Arnsberg HRA 9249\nRegisterbekanntmachung nach dem Umwandlungsgesetz 12.12.2024 (Eintragungsdatum)\n\nElemente Bau Aust e.K.\nEinzelkaufmann / Einzelkauffrau\nMenden\n\nDen Gläubigern der an der Ausgliederung beteiligten Rechtsträger ist, wenn sie binnen sechs Monaten nach dem Tag, an dem die Eintragung der Ausgliederung in das Register des Sitzes desjenigen Rechtsträgers, dessen Gläubiger sie sind, nach § 19 Absatz 3 UmwG als bekanntgemacht gilt, ihren Anspruch nach Grund und Höhe schriftlich anmelden, Sicherheit zu leisten, soweit sie nicht Befriedigung verlangen können. Dieses Recht steht den Gläubigern jedoch nur zu, wenn sie glaubhaft machen, dass durch die Ausgliederung die Erfüllung ihrer Forderung gefährdet wird."
    },
    {
      "date": "2024-12-12",
      "id": "96289",
      "original_text": "Löschungsankündigung\nNordrhein-Westfalen Amtsgericht Wuppertal HRB 21372\nTrümper GmbH – Wülfrath",
      "type": "Löschungsankündigung",
      "state": "Nordrhein-Westfalen",
      "amtsgericht": "Amtsgericht Wuppertal",
      "registernummer": "HRB 21372",
      "registerart": "HRB",
      "company_name": "Trümper GmbH",
      "company_seat": "Wülfrath",
      "details": "12.12.2024 (Bekanntmachungsdatum)\n\nNordrhein-Westfalen Amtsgericht Wuppertal HRB 21372\nLöschungsankündigung\n\nTrümper GmbH\nGesellschaft mit beschränkter Haftung\nWülfrath\n\nDas Registergericht beabsichtigt die Gesellschaft von Amts wegen nach § 394 FamFG zu löschen. Die Frist zur Erhebung eines Widerspruchs ist auf einen Monat festgesetzt."
    },
    {
      "date": "2024-12-12",
      "id": "96290",
      "original_text": "Löschungsankündigung\nNordrhein-Westfalen Amtsgericht Krefeld HRB 15642\nMedia Sales Verwaltungs GmbH – Krefeld",
      "type": "Löschungsankündigung",
      "state": "Nordrhein-Westfalen",
      "amtsgericht": "Amtsgericht Krefeld",
      "registernummer": "HRB 15642",
      "registerart": "HRB",
      "company_name": "Media Sales Verwaltungs GmbH",
      "company_seat": "Krefeld",
      "details": "12.12.2024 (Bekanntmachungsdatum)\n\nNordrhein-Westfalen Amtsgericht Krefeld HRB 15642\nLöschungsankündigung\n\nMedia Sales Verwaltungs GmbH\nGesellschaft mit beschränkter Haftung\nKrefeld\n\nDas Registergericht beabsichtigt die Gesellschaft von Amts wegen nach § 394 FamFG zu löschen. Die Frist zur Erhebung eines Widerspruchs ist auf einen Monat festgesetzt."
    },
    {
      "date": "2024-12-12",
      "id": "96291",
      "original_text": "Löschungsankündigung\nNordrhein-Westfalen Amtsgericht Düsseldorf HRB 99233\nIVA-Tech GmbH – Düsseldorf",
      "type": "Löschungsankündigung",
      "state": "Nordrhein-Westfalen",
      "amtsgericht": "Amtsgericht Düsseldorf",
      "registernummer": "HRB 99233",
      "registerart": "HRB",
      "company_name": "IVA-Tech GmbH",
      "company_seat": "Düsseldorf",
      "details": "12.12.2024 (Bekanntmachungsdatum)\n\nNordrhein-Westfalen Amtsgericht Düsseldorf HRB 99233\nLöschungsankündigung\n\nIVA-Tech GmbH\nGesellschaft mit beschränkter Haftung\nDüsseldorf\n\nDas Registergericht beabsichtigt die Gesellschaft von Amts wegen nach § 394 FamFG zu löschen. Die Frist zur Erhebung eines Widerspruchs ist auf 3 Wochen festgesetzt.\n\nRechtsbehelfsbelehrung:\nDas Widerspruchsrecht steht jedem zu, der an der Unterlassung der Löschung ein berechtigtes Interesse hat. Der Widerspruch ist bei dem Amtsgericht Düsseldorf -Registergericht-, Werdener Straße 1, 40227 Düsseldorf schriftlich in deutscher Sprache oder zur Niederschrift der Geschäftsstelle einzulegen. Der Widerspruch kann auch zur Niederschrift der Geschäftsstelle eines jeden Amtsgerichtes abgegeben werden. Die Einlegung ist auch durch Übertragung eines elektronischen Dokuments an die elektronische Poststelle des Gerichts möglich. Das elektronische Dokument muss für die Bearbeitung durch das Gericht geeignet und mit einer qualifizierten elektronischen Signatur der verantwortenden Person versehen sein oder von der verantwortenden Person signiert und auf einem sicheren Übermittlungsweg gemäß § 130a ZPO nach näherer Maßgabe der Verordnung über die technischen Rahmenbedingungen des elektronischen Rechtsverkehrs und über das besondere elektronische Behördenpostfach (BGBl. I, S.3803) eingereicht werden. Weitere Informationen erhalten Sie auf der Internetseite www.justiz.de.\nDer Widerspruch muss spätestens innerhalb der gesetzten Frist nach dem Datum der Bekanntmachung der Löschungsankündigung bei dem Amtsgericht - Registergericht - Düsseldorf eingegangen sein.  Dies gilt auch dann, wenn der Widerspruch zur Niederschrift der Geschäftsstelle eines anderen Amtsgerichtes abgegeben wurde. Die Frist beginnt mit dem Tage der Bekanntmachung der Löschungsankündigung in dem für die Bekanntmachung der Eintragungen in das Handelsregister bestimmten elektronischen Informations- und Kommunikationssystem nach § 10 des Handelsgesetzbuches. Fällt das Ende der Frist auf einen Sonntag, einen allgemeinen Feiertag oder Sonnabend, so endet die Frist mit Ablauf des nächsten Werktages.\nDer Widerspruch muss die Bezeichnung der angefochtenen Löschungsankündigung sowie die Erklärung enthalten, dass Widerspruch gegen diese Löschungsankündigung eingelegt wird. Er ist zu unterzeichnen und soll begründet werden."
    },
    {
      "date": "2024-12-12",
      "id": "96292",
      "original_text": "Registerbekanntmachung nach dem Umwandlungsgesetz\nNordrhein-Westfalen Amtsgericht Köln HRB 109614\nAIRE Neckarsulm PropCo GmbH – Köln",
      "type": "Registerbekanntmachung nach dem Umwandlungsgesetz",
      "state": "Nordrhein-Westfalen",
      "amtsgericht": "Amtsgericht Köln",
      "registernummer": "HRB 109614",
      "registerart": "HRB",
      "company_name": "AIRE Neckarsulm PropCo GmbH",
      "company_seat": "Köln",
      "details": "12.12.2024 (Bekanntmachungsdatum)\n\nNordrhein-Westfalen Amtsgericht Köln HRB 109614\nRegisterbekanntmachung nach dem Umwandlungsgesetz 12.12.2024 (Eintragungsdatum)\n\nAIRE Neckarsulm PropCo GmbH\nGesellschaft mit beschränkter Haftung\nKöln\n\nDen Gläubigern der an der Verschmelzung beteiligten Rechtsträger ist, wenn sie binnen sechs Monaten nach dem Tag, an dem die Eintragung der Verschmelzung in das Register des Sitzes desjenigen Rechtsträgers, dessen Gläubiger sie sind, nach § 19 Absatz 3 UmwG als bekanntgemacht gilt, ihren Anspruch nach Grund und Höhe schriftlich anmelden, Sicherheit zu leisten, soweit sie nicht Befriedigung verlangen können. Dieses Recht steht den Gläubigern jedoch nur zu, wenn sie glaubhaft machen, dass durch die Verschmelzung die Erfüllung ihrer Forderung gefährdet wird."
    },
    {
      "date": "2024-12-12",
      "id": "96293",
      "original_text": "Einreichung neuer Dokumente\nNordrhein-Westfalen Amtsgericht Essen HRB 32725\nthyssenkrupp Automotive Body Solutions GmbH – Essen",
      "type": "Einreichung neuer Dokumente",
      "state": "Nordrhein-Westfalen",
      "amtsgericht": "Amtsgericht Essen",
      "registernummer": "HRB 32725",
      "registerart": "HRB",
      "company_name": "thyssenkrupp Automotive Body Solutions GmbH",
      "company_seat": "Essen",
      "details": "12.12.2024 (Bekanntmachungsdatum)\n\nNordrhein-Westfalen Amtsgericht Essen HRB 32725\nEinreichung neuer Dokumente\n\nthyssenkrupp Automotive Body Solutions GmbH\nGesellschaft mit beschränkter Haftung\nEssen\n\nDem Registergericht ist eine neue Liste der Mitglieder des Aufsichtsrates eingereicht worden."
    },
    {
      "date": "2024-12-12",
      "id": "96294",
      "original_text": "Löschungsankündigung\nNordrhein-Westfalen Amtsgericht Mönchengladbach HRB 14279\nBeeck Industriedienste GmbH – Mönchengladbach",
      "type": "Löschungsankündigung",
      "state": "Nordrhein-Westfalen",
      "amtsgericht": "Amtsgericht Mönchengladbach",
      "registernummer": "HRB 14279",
      "registerart": "HRB",
      "company_name": "Beeck Industriedienste GmbH",
      "company_seat": "Mönchengladbach",
      "details": "12.12.2024 (Bekanntmachungsdatum)\n\nNordrhein-Westfalen Amtsgericht Mönchengladbach HRB 14279\nLöschungsankündigung\n\nBeeck Industriedienste GmbH\nGesellschaft mit beschränkter Haftung\nMönchengladbach\n\nBeeck Industriedienste GmbH, Mönchengladbach (Amtsgericht Mönchengladbach, HRB 14279)\nDas Registergericht beabsichtigt, die im Handelsregister eingetragene Gesellschaft gemäß § 394 Absatz 1 FamFG wegen Vermögenslosigkeit von Amts wegen zu löschen. Gegen diese Verfügung kann Widerspruch eingelegt werden. Die Frist zur Erhebung eines Widerspruchs gegen die beabsichtigte Löschung von Amts wegen ist auf drei Monate festgesetzt."
    },
    {
      "date": "2024-12-12",
      "id": "96295",
      "original_text": "Löschungsankündigung\nNordrhein-Westfalen Amtsgericht Steinfurt HRB 14010\nX-Dit Wholesale UG (haftungsbeschränkt) – Ibbenbüren",
      "type": "Löschungsankündigung",
      "state": "Nordrhein-Westfalen",
      "amtsgericht": "Amtsgericht Steinfurt",
      "registernummer": "HRB 14010",
      "registerart": "HRB",
      "company_name": "X-Dit Wholesale UG (haftungsbeschränkt)",
      "company_seat": "Ibbenbüren",
      "details": "12.12.2024 (Bekanntmachungsdatum)\n\nNordrhein-Westfalen Amtsgericht Steinfurt HRB 14010\nLöschungsankündigung\n\nX-Dit Wholesale UG (haftungsbeschränkt)\nGesellschaft mit beschränkter Haftung\nIbbenbüren\n\nDas Registergericht beabsichtigt, die im Handelsregister eingetragene Gesellschaft gemäß § 394 Absatz 1 FamFG wegen Vermögenslosigkeit von Amts wegen zu löschen.\n\nGegen diese Verfügung kann Widerspruch eingelegt werden. Die Frist zur Erhebung eines Widerspruchs gegen die beabsichtigte Löschung von Amts wegen ist auf einen Monat festgesetzt.\n\nRechtsbehelfsbelehrung:\n\nGegen diese Verfügung können Sie Widerspruch einlegen.\n\nDer Widerspruch ist bei dem Amtsgericht Steinfurt, Gerichtstraße 2, 48565 Steinfurt schriftlich in deutscher Sprache oder zur Niederschrift der Geschäftsstelle einzulegen. Der Widerspruch kann auch zur Niederschrift der Geschäftsstelle eines jeden Amtsgerichtes abgegeben werden.\nDie Einlegung ist auch durch Übertragung eines elektronischen Dokuments an die elektronische Poststelle des Gerichts möglich. Das elektronische Dokument muss für die Bearbeitung durch das Gericht geeignet und mit einer qualifizierten elektronischen Signatur der verantwortenden Person versehen sein oder von der verantwortenden Person signiert und auf einem sicheren Übermittlungsweg gemäß § 130 a ZPO nach näherer Maßgabe der Verordnung über die technischen Rahmenbedingungen des elektronischen Rechtsverkehrs und über das besondere elektronische Behördenpostfach (BGBl. I, S.3803) eingereicht werden. Weitere Informationen erhalten Sie auf der Internetseite www.justiz.de.\n\nDer Widerspruch muss spätestens innerhalb der gesetzten Frist bei dem Amtsgericht Steinfurt eingegangen sein. Dies gilt auch dann, wenn der Widerspruch zur Niederschrift der Geschäftsstelle eines anderen Amtsgerichtes abgegeben wurde. Die Frist beginnt mit der Veröffentlichung. Fällt das Ende der Frist auf einen Sonntag, einen allgemeinen Feiertag oder Sonnabend, so endet die Frist mit Ablauf des nächsten Werktages.\n\nDer Widerspruch muss die Bezeichnung der angefochtenen Verfügung sowie die Erklärung enthalten, dass Widerspruch gegen diese Verfügung eingelegt wird. Er ist zu unterzeichnen und soll begründet werden."
    },
    {
      "date": "2024-12-12",
      "id": "96296",
      "original_text": "Registerbekanntmachung nach dem Umwandlungsgesetz\nNordrhein-Westfalen Amtsgericht Düsseldorf HRB 98626\nCONVALID Analytics GmbH – Düsseldorf",
      "type": "Registerbekanntmachung nach dem Umwandlungsgesetz",
      "state": "Nordrhein-Westfalen",
      "amtsgericht": "Amtsgericht Düsseldorf",
      "registernummer": "HRB 98626",
      "registerart": "HRB",
      "company_name": "CONVALID Analytics GmbH",
      "company_seat": "Düsseldorf",
      "details": "12.12.2024 (Bekanntmachungsdatum)\n\nNordrhein-Westfalen Amtsgericht Düsseldorf HRB 98626\nRegisterbekanntmachung nach dem Umwandlungsgesetz 12.12.2024 (Eintragungsdatum)\n\nCONVALID Analytics GmbH\nGesellschaft mit beschränkter Haftung\nDüsseldorf\n\nDen Gläubigern der an der Verschmelzung beteiligten Rechtsträger ist, wenn sie binnen sechs Monaten nach dem Tag, an dem die Eintragung der Verschmelzung in das Register des Sitzes desjenigen Rechtsträgers, dessen Gläubiger sie sind, nach § 19 Absatz 3 UmwG als bekanntgemacht gilt, ihren Anspruch nach Grund und Höhe schriftlich anmelden, Sicherheit zu leisten, soweit sie nicht Befriedigung verlangen können. Dieses Recht steht den Gläubigern jedoch nur zu, wenn sie glaubhaft machen, dass durch die Verschmelzung die Erfüllung ihrer Forderung gefährdet wird."
    },
    {
      "date": "2024-12-12",
      "id": "96297",
      "original_text": "Einreichung neuer Dokumente\nNordrhein-Westfalen Amtsgericht Duisburg HRB 20299\nThyssenKrupp MillServices & Systems GmbH – Duisburg",
      "type": "Einreichung neuer Dokumente",
      "state": "Nordrhein-Westfalen",
      "amtsgericht": "Amtsgericht Duisburg",
      "registernummer": "HRB 20299",
      "registerart": "HRB",
      "company_name": "ThyssenKrupp MillServices & Systems GmbH",
      "company_seat": "Duisburg",
      "details": "12.12.2024 (Bekanntmachungsdatum)\n\nNordrhein-Westfalen Amtsgericht Duisburg HRB 20299\nEinreichung neuer Dokumente\n\nThyssenKrupp MillServices & Systems GmbH\nGesellschaft mit beschränkter Haftung\nDuisburg\n\nDem Registergericht ist eine neue Liste der Mitglieder des Aufsichtsrates eingereicht worden."
    },
    {
      "date": "2024-12-12",
      "id": "96298",
      "original_text": "Registerbekanntmachung nach dem Umwandlungsgesetz\nNordrhein-Westfalen Amtsgericht Siegburg HRB 6311\nAtos Medical GmbH – Troisdorf",
      "type": "Registerbekanntmachung nach dem Umwandlungsgesetz",
      "state": "Nordrhein-Westfalen",
      "amtsgericht": "Amtsgericht Siegburg",
      "registernummer": "HRB 6311",
      "registerart": "HRB",
      "company_name": "Atos Medical GmbH",
      "company_seat": "Troisdorf",
      "details": "12.12.2024 (Bekanntmachungsdatum)\n\nNordrhein-Westfalen Amtsgericht Siegburg HRB 6311\nRegisterbekanntmachung nach dem Umwandlungsgesetz 12.12.2024 (Eintragungsdatum)\n\nAtos Medical GmbH\nGesellschaft mit beschränkter Haftung\nTroisdorf\n\nDen Gläubigern der an der Verschmelzung beteiligten Rechtsträger ist, wenn sie binnen sechs Monaten nach dem Tag, an dem die Eintragung der Verschmelzung in das Register des Sitzes desjenigen Rechtsträgers, dessen Gläubiger sie sind, nach § 19 Absatz 3 UmwG als bekanntgemacht gilt, ihren Anspruch nach Grund und Höhe schriftlich anmelden, Sicherheit zu leisten, soweit sie nicht Befriedigung verlangen können. Dieses Recht steht den Gläubigern jedoch nur zu, wenn sie glaubhaft machen, dass durch die Verschmelzung die Erfüllung ihrer Forderung gefährdet wird."
    },
    {
      "date": "2024-12-12",
      "id": "96299",
      "original_text": "Registerbekanntmachung nach dem Umwandlungsgesetz\nNordrhein-Westfalen Amtsgericht Paderborn HRB 5196\nHaupt Immobilien GmbH – Lippstadt-Lipperbruch",
      "type": "Registerbekanntmachung nach dem Umwandlungsgesetz",
      "state": "Nordrhein-Westfalen",
      "amtsgericht": "Amtsgericht Paderborn",
      "registernummer": "HRB 5196",
      "registerart": "HRB",
      "company_name": "Haupt Immobilien GmbH",
      "company_seat": "Lippstadt-Lipperbruch",
      "details": "12.12.2024 (Bekanntmachungsdatum)\n\nNordrhein-Westfalen Amtsgericht Paderborn HRB 5196\nRegisterbekanntmachung nach dem Umwandlungsgesetz 12.12.2024 (Eintragungsdatum)\n\nHaupt Immobilien GmbH\nGesellschaft mit beschränkter Haftung\nLippstadt-Lipperbruch\n\nDie Gesellschaft hat Gläubigern, deren Forderungen vor dieser Bekanntmachung begründet worden sind, Sicherheit zu leisten, soweit sie nicht Befriedigung verlangen können, wenn sie sich binnen sechs Monaten zu diesem Zweck melden."
    },
    {
      "date": "2024-12-12",
      "id": "96300",
      "original_text": "Einreichung neuer Dokumente\nNordrhein-Westfalen Amtsgericht Köln HRB 39357\nA.S. Création Tapeten AG – Gummersbach",
      "type": "Einreichung neuer Dokumente",
      "state": "Nordrhein-Westfalen",
      "amtsgericht": "Amtsgericht Köln",
      "registernummer": "HRB 39357",
      "registerart": "HRB",
      "company_name": "A.S. Création Tapeten AG",
      "company_seat": "Gummersbach",
      "details": "12.12.2024 (Bekanntmachungsdatum)\n\nNordrhein-Westfalen Amtsgericht Köln HRB 39357\nEinreichung neuer Dokumente\n\nA.S. Création Tapeten AG\nAktiengesellschaft\nGummersbach\n\nDem Registergericht ist eine Liste der Mitglieder des Aufsichtsrates eingereicht worden."
    },
    {
      "date": "2024-12-12",
      "id": "96301",
      "original_text": "Registerbekanntmachung nach dem Umwandlungsgesetz\nNordrhein-Westfalen Amtsgericht Wuppertal HRB 28307\nBöhme & Weihs GmbH Verwaltung. – Wuppertal",
      "type": "Registerbekanntmachung nach dem Umwandlungsgesetz",
      "state": "Nordrhein-Westfalen",
      "amtsgericht": "Amtsgericht Wuppertal",
      "registernummer": "HRB 28307",
      "registerart": "HRB",
      "company_name": "Böhme & Weihs GmbH Verwaltung.",
      "company_seat": "Wuppertal",
      "details": "12.12.2024 (Bekanntmachungsdatum)\n\nNordrhein-Westfalen Amtsgericht Wuppertal HRB 28307\nRegisterbekanntmachung nach dem Umwandlungsgesetz 12.12.2024 (Eintragungsdatum)\n\nBöhme & Weihs GmbH Verwaltung.\nGesellschaft mit beschränkter Haftung\nWuppertal\n\nDen Gläubigern der an der Verschmelzung beteiligten Rechtsträger ist, wenn sie binnen sechs Monaten nach dem Tag, an dem die Eintragung der Verschmelzung in das Register des Sitzes desjenigen Rechtsträgers, dessen Gläubiger sie sind, nach § 19 Absatz 3 UmwG als bekanntgemacht gilt, ihren Anspruch nach Grund und Höhe schriftlich anmelden, Sicherheit zu leisten, soweit sie nicht Befriedigung verlangen können. Dieses Recht steht den Gläubigern jedoch nur zu, wenn sie glaubhaft machen, dass durch die Verschmelzung die Erfüllung ihrer Forderung gefährdet wird."
    },
    {
      "date": "2024-12-12",
      "id": "96302",
      "original_text": "Löschungsankündigung\nNordrhein-Westfalen Amtsgericht Wuppertal HRB 28152\nMSA Logistic GmbH – Wuppertal",
      "type": "Löschungsankündigung",
      "state": "Nordrhein-Westfalen",
      "amtsgericht": "Amtsgericht Wuppertal",
      "registernummer": "HRB 28152",
      "registerart": "HRB",
      "company_name": "MSA Logistic GmbH",
      "company_seat": "Wuppertal",
      "details": "12.12.2024 (Bekanntmachungsdatum)\n\nNordrhein-Westfalen Amtsgericht Wuppertal HRB 28152\nLöschungsankündigung\n\nMSA Logistic GmbH\nGesellschaft mit beschränkter Haftung\nWuppertal\n\nDas Registergericht beabsichtigt die Gesellschaft von Amts wegen nach § 394 FamFG zu löschen. Die Frist zur Erhebung eines Widerspruchs ist auf einen Monat festgesetzt."
    },
    {
      "date": "2024-12-12",
      "id": "96303",
      "original_text": "Registerbekanntmachung nach dem Umwandlungsgesetz\nNordrhein-Westfalen Amtsgericht Paderborn HRA 8602\nFunke Metallbau e.K. – Delbrück",
      "type": "Registerbekanntmachung nach dem Umwandlungsgesetz",
      "state": "Nordrhein-Westfalen",
      "amtsgericht": "Amtsgericht Paderborn",
      "registernummer": "HRA 8602",
      "registerart": "HRA",
      "company_name": "Funke Metallbau e.K.",
      "company_seat": "Delbrück",
      "details": "12.12.2024 (Bekanntmachungsdatum)\n\nNordrhein-Westfalen Amtsgericht Paderborn HRA 8602\nRegisterbekanntmachung nach dem Umwandlungsgesetz 12.12.2024 (Eintragungsdatum)\n\nFunke Metallbau e.K.\nEinzelkaufmann / Einzelkauffrau\nDelbrück\n\nDen Gläubigern der an der Ausgliederung beteiligten Rechtsträger ist, wenn sie binnen sechs Monaten nach dem Tag, an dem die Eintragung der Ausgliederung in das Register des Sitzes desjenigen Rechtsträgers, dessen Gläubiger sie sind, nach § 19 Absatz 3 UmwG als bekanntgemacht gilt, ihren Anspruch nach Grund und Höhe schriftlich anmelden, Sicherheit zu leisten, soweit sie nicht Befriedigung verlangen können. Dieses Recht steht den Gläubigern jedoch nur zu, wenn sie glaubhaft machen, dass durch die Ausgliederung die Erfüllung ihrer Forderung gefährdet wird."
    },
    {
      "date": "2024-12-12",
      "id": "96304",
      "original_text": "Löschungsankündigung\nNordrhein-Westfalen Amtsgericht Dortmund HRA 18575\nGrill Store Arneckestraße Dortmund UG (haftungsbeschränkt) & Co. KG – Dortmund",
      "type": "Löschungsankündigung",
      "state": "Nordrhein-Westfalen",
      "amtsgericht": "Amtsgericht Dortmund",
      "registernummer": "HRA 18575",
      "registerart": "HRA",
      "company_name": "Grill Store Arneckestraße Dortmund UG (haftungsbeschränkt) & Co. KG",
      "company_seat": "Dortmund",
      "details": "12.12.2024 (Bekanntmachungsdatum)\n\nNordrhein-Westfalen Amtsgericht Dortmund HRA 18575\nLöschungsankündigung 12.12.2024 (Eintragungsdatum)\n\nGrill Store Arneckestraße Dortmund UG (haftungsbeschränkt) & Co. KG\nKommanditgesellschaft\nDortmund\n\nDas Registergericht beabsichtigt die Firma von Amts wegen nach §§ 31 Abs. 2 HGB, 393 FamFG zu löschen. Die Frist zur Erhebung eines Widerspruchs ist auf zwei Monate festgesetzt."
    },
    {
      "date": "2024-12-12",
      "id": "96305",
      "original_text": "Registerbekanntmachung nach dem Umwandlungsgesetz\nNordrhein-Westfalen Amtsgericht Essen PR 3091\nOsteoviva Praxis für Osteopathie & Physiotherapie Tillmann & Mülders Heilpraktiker (Physiotherapie) & Physiotherapeuten Partnerschaftsgesellschaft – Kerpen",
      "type": "Registerbekanntmachung nach dem Umwandlungsgesetz",
      "state": "Nordrhein-Westfalen",
      "amtsgericht": "Amtsgericht Essen",
      "registernummer": "PR 3091",
      "registerart": "PR",
      "company_name": "Osteoviva Praxis für Osteopathie & Physiotherapie Tillmann & Mülders Heilpraktiker (Physiotherapie) & Physiotherapeuten Partnerschaftsgesellschaft",
      "company_seat": "Kerpen",
      "details": "12.12.2024 (Bekanntmachungsdatum)\n\nNordrhein-Westfalen Amtsgericht Essen PR 3091\nRegisterbekanntmachung nach dem Umwandlungsgesetz 12.12.2024 (Eintragungsdatum)\n\nOsteoviva Praxis für Osteopathie & Physiotherapie Tillmann & Mülders Heilpraktiker (Physiotherapie) & Physiotherapeuten Partnerschaftsgesellschaft\nPartnerschaftsgesellschaft\nKerpen\n\nDen Gläubigern der an der formwechselnden Umwandlung beteiligten Rechtsträger ist, wenn sie binnen sechs Monaten nach dem Tag, an dem die Eintragung der formwechselnden Umwandlung in das Register des Sitzes desjenigen Rechtsträgers, dessen Gläubiger sie sind, nach § 19 Absatz 3 UmwG als bekanntgemacht gilt, ihren Anspruch nach Grund und Höhe schriftlich anmelden, Sicherheit zu leisten, soweit sie nicht Befriedigung verlangen können. Dieses Recht steht den Gläubigern jedoch nur zu, wenn sie glaubhaft machen, dass durch die formwechselnden Umwandlung die Erfüllung ihrer Forderung gefährdet wird."
    },
    {
      "date": "2024-12-12",
      "id": "96306",
      "original_text": "Registerbekanntmachung nach dem Umwandlungsgesetz\nNordrhein-Westfalen Amtsgericht Siegburg HRB 6311\nAtos Medical GmbH – Troisdorf",
      "type": "Registerbekanntmachung nach dem Umwandlungsgesetz",
      "state": "Nordrhein-Westfalen",
      "amtsgericht": "Amtsgericht Siegburg",
      "registernummer": "HRB 6311",
      "registerart": "HRB",
      "company_name": "Atos Medical GmbH",
      "company_seat": "Troisdorf",
      "details": "12.12.2024 (Bekanntmachungsdatum)\n\nNordrhein-Westfalen Amtsgericht Siegburg HRB 6311\nRegisterbekanntmachung nach dem Umwandlungsgesetz 12.12.2024 (Eintragungsdatum)\n\nAtos Medical GmbH\nGesellschaft mit beschränkter Haftung\nTroisdorf\n\nDen Gläubigern der an der Verschmelzung beteiligten Rechtsträger ist, wenn sie binnen sechs Monaten nach dem Tag, an dem die Eintragung der Verschmelzung in das Register des Sitzes desjenigen Rechtsträgers, dessen Gläubiger sie sind, nach § 19 Absatz 3 UmwG als bekanntgemacht gilt, ihren Anspruch nach Grund und Höhe schriftlich anmelden, Sicherheit zu leisten, soweit sie nicht Befriedigung verlangen können. Dieses Recht steht den Gläubigern jedoch nur zu, wenn sie glaubhaft machen, dass durch die Verschmelzung die Erfüllung ihrer Forderung gefährdet wird."
    },
    {
      "date": "2024-12-12",
      "id": "96307",
      "original_text": "Registerbekanntmachung nach dem Umwandlungsgesetz\nNordrhein-Westfalen Amtsgericht Wuppertal HRB 34767\nBöhme & Weihs GmbH – Wuppertal",
      "type": "Registerbekanntmachung nach dem Umwandlungsgesetz",
      "state": "Nordrhein-Westfalen",
      "amtsgericht": "Amtsgericht Wuppertal",
      "registernummer": "HRB 34767",
      "registerart": "HRB",
      "company_name": "Böhme & Weihs GmbH",
      "company_seat": "Wuppertal",
      "details": "12.12.2024 (Bekanntmachungsdatum)\n\nNordrhein-Westfalen Amtsgericht Wuppertal HRB 34767\nRegisterbekanntmachung nach dem Umwandlungsgesetz 12.12.2024 (Eintragungsdatum)\n\nBöhme & Weihs GmbH\nGesellschaft mit beschränkter Haftung\nWuppertal\n\nDen Gläubigern der an der Verschmelzung beteiligten Rechtsträger ist, wenn sie binnen sechs Monaten nach dem Tag, an dem die Eintragung der Verschmelzung in das Register des Sitzes desjenigen Rechtsträgers, dessen Gläubiger sie sind, nach § 19 Absatz 3 UmwG als bekanntgemacht gilt, ihren Anspruch nach Grund und Höhe schriftlich anmelden, Sicherheit zu leisten, soweit sie nicht Befriedigung verlangen können. Dieses Recht steht den Gläubigern jedoch nur zu, wenn sie glaubhaft machen, dass durch die Verschmelzung die Erfüllung ihrer Forderung gefährdet wird."
    },
    {
      "date": "2024-12-12",
      "id": "96308",
      "original_text": "Registerbekanntmachung nach dem Umwandlungsgesetz\nNordrhein-Westfalen Amtsgericht Düsseldorf HRB 76965\nNeumarkt 14 Projekt Verwaltungs GmbH – Düsseldorf",
      "type": "Registerbekanntmachung nach dem Umwandlungsgesetz",
      "state": "Nordrhein-Westfalen",
      "amtsgericht": "Amtsgericht Düsseldorf",
      "registernummer": "HRB 76965",
      "registerart": "HRB",
      "company_name": "Neumarkt 14 Projekt Verwaltungs GmbH",
      "company_seat": "Düsseldorf",
      "details": "12.12.2024 (Bekanntmachungsdatum)\n\nNordrhein-Westfalen Amtsgericht Düsseldorf HRB 76965\nRegisterbekanntmachung nach dem Umwandlungsgesetz 12.12.2024 (Eintragungsdatum)\n\nNeumarkt 14 Projekt Verwaltungs GmbH\nGesellschaft mit beschränkter Haftung\nDüsseldorf\n\nDen Gläubigern der an der Verschmelzung beteiligten Rechtsträger ist, wenn sie binnen sechs Monaten nach dem Tag, an dem die Eintragung der Verschmelzung in das Register des Sitzes desjenigen Rechtsträgers, dessen Gläubiger sie sind, nach § 19 Absatz 3 UmwG als bekanntgemacht gilt, ihren Anspruch nach Grund und Höhe schriftlich anmelden, Sicherheit zu leisten, soweit sie nicht Befriedigung verlangen können. Dieses Recht steht den Gläubigern jedoch nur zu, wenn sie glaubhaft machen, dass durch die Verschmelzung die Erfüllung ihrer Forderung gefährdet wird."
    },
    {
      "date": "2024-12-12",
      "id": "96309",
      "original_text": "Löschungsankündigung\nNordrhein-Westfalen Amtsgericht Düren HRB 8812\nQi fusion GmbH – Düren",
      "type": "Löschungsankündigung",
      "state": "Nordrhein-Westfalen",
      "amtsgericht": "Amtsgericht Düren",
      "registernummer": "HRB 8812",
      "registerart": "HRB",
      "company_name": "Qi fusion GmbH",
      "company_seat": "Düren",
      "details": "12.12.2024 (Bekanntmachungsdatum)\n\nNordrhein-Westfalen Amtsgericht Düren HRB 8812\nLöschungsankündigung\n\nQi fusion GmbH\nGesellschaft mit beschränkter Haftung\nDüren\n\nDas Registergericht beabsichtigt die Gesellschaft von Amts wegen nach § 394 FamFG zu löschen. Die Frist zur Erhebung eines Widerspruchs ist auf drei Monate festgesetzt."
    },
    {
      "date": "2024-12-12",
      "id": "96310",
      "original_text": "Löschungsankündigung\nNordrhein-Westfalen Amtsgericht Hamm HRB 8508\nPeter Kiefer Transport UG (haftungsbeschränkt) – Unna",
      "type": "Löschungsankündigung",
      "state": "Nordrhein-Westfalen",
      "amtsgericht": "Amtsgericht Hamm",
      "registernummer": "HRB 8508",
      "registerart": "HRB",
      "company_name": "Peter Kiefer Transport UG (haftungsbeschränkt)",
      "company_seat": "Unna",
      "details": "12.12.2024 (Bekanntmachungsdatum)\n\nNordrhein-Westfalen Amtsgericht Hamm HRB 8508\nLöschungsankündigung\n\nPeter Kiefer Transport UG (haftungsbeschränkt)\nGesellschaft mit beschränkter Haftung\nUnna\n\nDas Registergericht beabsichtigt die Gesellschaft von Amts wegen nach § 394 FamFG zu löschen. Die Frist zur Erhebung eines Widerspruchs ist auf drei Monate festgesetzt."
    },
    {
      "date": "2024-12-12",
      "id": "96311",
      "original_text": "Löschungsankündigung\nNordrhein-Westfalen Amtsgericht Krefeld HRB 5011\nGrifka Orthopädieschuhtechnik, Sanitätshaus, medizinische und medizinisch-technische Produkte, Bequemschuhhaus GmbH – Krefeld",
      "type": "Löschungsankündigung",
      "state": "Nordrhein-Westfalen",
      "amtsgericht": "Amtsgericht Krefeld",
      "registernummer": "HRB 5011",
      "registerart": "HRB",
      "company_name": "Grifka Orthopädieschuhtechnik, Sanitätshaus, medizinische und medizinisch-technische Produkte, Bequemschuhhaus GmbH",
      "company_seat": "Krefeld",
      "details": "12.12.2024 (Bekanntmachungsdatum)\n\nNordrhein-Westfalen Amtsgericht Krefeld HRB 5011\nLöschungsankündigung\n\nGrifka Orthopädieschuhtechnik, Sanitätshaus, medizinische und medizinisch-technische Produkte, Bequemschuhhaus GmbH\nGesellschaft mit beschränkter Haftung\nKrefeld\n\nDas Registergericht beabsichtigt die Gesellschaft von Amts wegen nach § 394 FamFG zu löschen. Die Frist zur Erhebung eines Widerspruchs ist auf einen Monat festgesetzt."
    },
    {
      "date": "2024-12-12",
      "id": "96312",
      "original_text": "Löschungsankündigung\nNordrhein-Westfalen Amtsgericht Krefeld HRB 10398\nZeit und Raum Veranstaltungs GmbH – Krefeld",
      "type": "Löschungsankündigung",
      "state": "Nordrhein-Westfalen",
      "amtsgericht": "Amtsgericht Krefeld",
      "registernummer": "HRB 10398",
      "registerart": "HRB",
      "company_name": "Zeit und Raum Veranstaltungs GmbH",
      "company_seat": "Krefeld",
      "details": "12.12.2024 (Bekanntmachungsdatum)\n\nNordrhein-Westfalen Amtsgericht Krefeld HRB 10398\nLöschungsankündigung\n\nZeit und Raum Veranstaltungs GmbH\nGesellschaft mit beschränkter Haftung\nKrefeld\n\nDas Registergericht beabsichtigt die Gesellschaft von Amts wegen nach § 394 FamFG zu löschen. Die Frist zur Erhebung eines Widerspruchs ist auf einen Monat festgesetzt."
    },
    {
      "date": "2024-12-12",
      "id": "96313",
      "original_text": "Löschungsankündigung\nSaarland Amtsgericht Saarbrücken HRB 105898\nVAG GmbH – Riegelsberg",
      "type": "Löschungsankündigung",
      "state": "Saarland",
      "amtsgericht": "Amtsgericht Saarbrücken",
      "registernummer": "HRB 105898",
      "registerart": "HRB",
      "company_name": "VAG GmbH",
      "company_seat": "Riegelsberg",
      "details": "12.12.2024 (Bekanntmachungsdatum)\n\nSaarland Amtsgericht Saarbrücken HRB 105898\nLöschungsankündigung 31.05.2024 (Eintragungsdatum)\n\nVAG GmbH\nGesellschaft mit beschränkter Haftung\nRiegelsberg\n\nEs ist beabsichtigt, die Gesellschaft von Amts wegen gemäß § 394 FamFG wegen Vermögenslosigkeit zu löschen. Gegen die Löschung von Amts wegen ist das Rechtsmittel des Widerspruchs statthaft. Der Widerspruch ist binnen einer Frist von 1 Monat beginnend mit dem Tag dieser Veröffentlichung durch Einreichen eines Widerspruchsschreibens -schriftlich oder zur Niederschrift der Geschäftsstelle- beim Amtsgericht Saarbrücken, -zentrales Handelsregister-, Mainzerstr.178, 66121 Saarbrücken einzulegen. Der Widerspruch muss die Bezeichnung der angefochtenen Löschungsankündigung enthalten sowie die Erklärung, dass Widerspruch eingelegt wird. Er ist vom Widerspruchsführer oder seinem Bevollmächtigten zu unterzeichnen."
    },
    {
      "date": "2024-12-12",
      "id": "96314",
      "original_text": "Einreichung neuer Dokumente\nThüringen Amtsgericht Jena HRB 203356\nDiako Wohn- und Seniorenzentrum Käthe-Kollwitz gemeinnützige GmbH – Jena",
      "type": "Einreichung neuer Dokumente",
      "state": "Thüringen",
      "amtsgericht": "Amtsgericht Jena",
      "registernummer": "HRB 203356",
      "registerart": "HRB",
      "company_name": "Diako Wohn- und Seniorenzentrum Käthe-Kollwitz gemeinnützige GmbH",
      "company_seat": "Jena",
      "details": "12.12.2024 (Bekanntmachungsdatum)\n\nThüringen Amtsgericht Jena HRB 203356\nEinreichung neuer Dokumente\n\nDiako Wohn- und Seniorenzentrum Käthe-Kollwitz gemeinnützige GmbH\nGesellschaft mit beschränkter Haftung\nJena\n\nBekanntmachung gem. § 52 Abs. 3 Satz 2 GmbHG: Aufgrund einer Veränderung in den Personen der Aufsichtsratsmitglieder ist durch die Geschäftsführer eine neue Liste zum Handelsregister eingereicht worden."
    },
    {
      "date": "2024-12-12",
      "id": "96315",
      "original_text": "Registerbekanntmachung nach dem Umwandlungsgesetz\nHessen Amtsgericht Frankfurt am Main HRB 135128\nMaintal GmbH – Frankfurt am Main",
      "type": "Registerbekanntmachung nach dem Umwandlungsgesetz",
      "state": "Hessen",
      "amtsgericht": "Amtsgericht Frankfurt am Main",
      "registernummer": "HRB 135128",
      "registerart": "HRB",
      "company_name": "Maintal GmbH",
      "company_seat": "Frankfurt am Main",
      "details": "12.12.2024 (Bekanntmachungsdatum)\n\nHessen Amtsgericht Frankfurt am Main HRB 135128\nRegisterbekanntmachung nach dem Umwandlungsgesetz 12.12.2024 (Eintragungsdatum)\n\nMaintal GmbH\nGesellschaft mit beschränkter Haftung\nFrankfurt am Main\n\nDen Gläubigern der an der Verschmelzung beteiligten Rechtsträger ist, wenn sie binnen sechs Monaten nach dem Tag, an dem die Eintragung der Verschmelzung in das Register des Sitzes derjenigen Rechtsträger deren Gläubiger sie sind, nach § 19 Absatz 3 UmwG bekannt gemacht worden ist, ihren Anspruch nach Grund und Höhe schriftlich anmelden, Sicherheit zu leisten, soweit sie nicht Befriedigung verlangen können. Dieses Recht steht den Gläubigern jedoch nur zu, wenn sie glaubhaft machen, dass durch die Verschmelzung die Erfüllung ihrer Forderung gefährdet wird."
    },
    {
      "date": "2024-12-12",
      "id": "96316",
      "original_text": "Löschungsankündigung\nHessen Amtsgericht Darmstadt HRB 96830\nQiu Kunst GmbH – Darmstadt",
      "type": "Löschungsankündigung",
      "state": "Hessen",
      "amtsgericht": "Amtsgericht Darmstadt",
      "registernummer": "HRB 96830",
      "registerart": "HRB",
      "company_name": "Qiu Kunst GmbH",
      "company_seat": "Darmstadt",
      "details": "12.12.2024 (Bekanntmachungsdatum)\n\nHessen Amtsgericht Darmstadt HRB 96830\nLöschungsankündigung\n\nQiu Kunst GmbH\nGesellschaft mit beschränkter Haftung\nDarmstadt\n\nDas Registergericht beabsichtigt die im Handelsregister eingetragene Gesellschaft von Amts wegen nach § 394 FamFG zu löschen. Die Frist zur Erhebung eines Widerspruchs gegen die beabsichtigte Löschung wird auf 3 Monate festgesetzt."
    },
    {
      "date": "2024-12-12",
      "id": "96317",
      "original_text": "Registerbekanntmachung nach dem Umwandlungsgesetz\nHessen Amtsgericht Fritzlar HRB 11312\nB.Braun Medical Aktiengesellschaft – Melsungen",
      "type": "Registerbekanntmachung nach dem Umwandlungsgesetz",
      "state": "Hessen",
      "amtsgericht": "Amtsgericht Fritzlar",
      "registernummer": "HRB 11312",
      "registerart": "HRB",
      "company_name": "B.Braun Medical Aktiengesellschaft",
      "company_seat": "Melsungen",
      "details": "12.12.2024 (Bekanntmachungsdatum)\n\nHessen Amtsgericht Fritzlar HRB 11312\nRegisterbekanntmachung nach dem Umwandlungsgesetz 12.12.2024 (Eintragungsdatum)\n\nB.Braun Medical Aktiengesellschaft\nAktiengesellschaft\nMelsungen\n\nDen Gläubigern der an der Verschmelzung beteiligten Rechtsträger ist, wenn sie binnen sechs Monaten nach dem Tag, an dem die Eintragung der Verschmelzung in das Register des Sitzes desjenigen Rechtsträgers, dessen Gläubiger sie sind, nach § 19 Absatz 3 UmwG bekannt gemacht worden ist, ihren Anspruch nach Grund und Höhe schriftlich anmelden, Sicherheit zu leisten, soweit sie nicht Befriedigung verlangen können. Dieses Recht steht den Gläubigern jedoch nur zu, wenn sie glaubhaft machen, dass durch die Verschmelzung die Erfüllung ihrer Forderung gefährdet wird."
    },
    {
      "date": "2024-12-12",
      "id": "96318",
      "original_text": "Registerbekanntmachung nach dem Umwandlungsgesetz\nHessen Amtsgericht Frankfurt am Main HRB 135130\nLiederbach GmbH – Frankfurt am Main",
      "type": "Registerbekanntmachung nach dem Umwandlungsgesetz",
      "state": "Hessen",
      "amtsgericht": "Amtsgericht Frankfurt am Main",
      "registernummer": "HRB 135130",
      "registerart": "HRB",
      "company_name": "Liederbach GmbH",
      "company_seat": "Frankfurt am Main",
      "details": "12.12.2024 (Bekanntmachungsdatum)\n\nHessen Amtsgericht Frankfurt am Main HRB 135130\nRegisterbekanntmachung nach dem Umwandlungsgesetz 12.12.2024 (Eintragungsdatum)\n\nLiederbach GmbH\nGesellschaft mit beschränkter Haftung\nFrankfurt am Main\n\nDen Gläubigern der an der Verschmelzung beteiligten Rechtsträger ist, wenn sie binnen sechs Monaten nach dem Tag, an dem die Eintragung der Verschmelzung in das Register des Sitzes derjenigen Rechtsträger deren Gläubiger sie sind, nach § 19 Absatz 3 UmwG bekannt gemacht worden ist, ihren Anspruch nach Grund und Höhe schriftlich anmelden, Sicherheit zu leisten, soweit sie nicht Befriedigung verlangen können. Dieses Recht steht den Gläubigern jedoch nur zu, wenn sie glaubhaft machen, dass durch die Verschmelzung die Erfüllung ihrer Forderung gefährdet wird."
    },
    {
      "date": "2024-12-12",
      "id": "96319",
      "original_text": "Registerbekanntmachung nach dem Umwandlungsgesetz\nHessen Amtsgericht Friedberg HRB 7632\nSIMPSON STRONG-TIE GmbH – Bad Nauheim",
      "type": "Registerbekanntmachung nach dem Umwandlungsgesetz",
      "state": "Hessen",
      "amtsgericht": "Amtsgericht Friedberg",
      "registernummer": "HRB 7632",
      "registerart": "HRB",
      "company_name": "SIMPSON STRONG-TIE GmbH",
      "company_seat": "Bad Nauheim",
      "details": "12.12.2024 (Bekanntmachungsdatum)\n\nHessen Amtsgericht Friedberg HRB 7632\nRegisterbekanntmachung nach dem Umwandlungsgesetz 12.12.2024 (Eintragungsdatum)\n\nSIMPSON STRONG-TIE GmbH\nGesellschaft mit beschränkter Haftung\nBad Nauheim\n\nDen Gläubigern der an der Verschmelzung beteiligten Rechtsträger ist, wenn sie binnen sechs Monaten nach dem Tag, an dem die Eintragung der Verschmelzung in das Register des Sitzes desjenigen Rechtsträgers, dessen Gläubiger sie sind, nach § 19 Absatz 3 UmwG bekannt gemacht worden ist, ihren Anspruch nach Grund und Höhe schriftlich anmelden, Sicherheit zu leisten, soweit sie nicht Befriedigung verlangen können. Dieses Recht steht den Gläubigern jedoch nur zu, wenn sie glaubhaft machen, dass durch die Verschmelzung die Erfüllung ihrer Forderung gefährdet wird."
    },
    {
      "date": "2024-12-12",
      "id": "96320",
      "original_text": "Registerbekanntmachung nach dem Umwandlungsgesetz\nHessen Amtsgericht Offenbach am Main HRB 50187\nDVS TECHNOLOGY AG – Dietzenbach",
      "type": "Registerbekanntmachung nach dem Umwandlungsgesetz",
      "state": "Hessen",
      "amtsgericht": "Amtsgericht Offenbach am Main",
      "registernummer": "HRB 50187",
      "registerart": "HRB",
      "company_name": "DVS TECHNOLOGY AG",
      "company_seat": "Dietzenbach",
      "details": "12.12.2024 (Bekanntmachungsdatum)\n\nHessen Amtsgericht Offenbach am Main HRB 50187\nRegisterbekanntmachung nach dem Umwandlungsgesetz\n\nDVS TECHNOLOGY AG\nAktiengesellschaft\nDietzenbach\n\nDie Gesellschaft hat den Verschmelzungsvertrag zwischen ihr und der DVS Technology Europe GmbH, Dietzenbach (Amtsgericht Offenbach am Main HRB 53893) beim Amtsgericht Offenbach am Main (Registergericht) zur Einsichtnahme eingereicht."
    },
    {
      "date": "2024-12-12",
      "id": "96321",
      "original_text": "Sonstige Registerbekanntmachung\nHessen Amtsgericht Darmstadt VR 70703\nArbeitsgemeinschaft Schienenverkehr Odenwald – Erbach",
      "type": "Sonstige Registerbekanntmachung",
      "state": "Hessen",
      "amtsgericht": "Amtsgericht Darmstadt",
      "registernummer": "VR 70703",
      "registerart": "VR",
      "company_name": "Arbeitsgemeinschaft Schienenverkehr Odenwald",
      "company_seat": "Erbach",
      "details": "12.12.2024 (Bekanntmachungsdatum)\n\nHessen Amtsgericht Darmstadt VR 70703\nSonstige Registerbekanntmachung 12.12.2024 (Eintragungsdatum)\n\nArbeitsgemeinschaft Schienenverkehr Odenwald\neingetragener Verein\nErbach\n\nDer Verein ist aufgelöst."
    },
    {
      "date": "2024-12-12",
      "id": "96322",
      "original_text": "Einreichung neuer Dokumente\nHessen Amtsgericht Frankfurt am Main HRB 79808\nDB Vertrieb GmbH – Frankfurt am Main",
      "type": "Einreichung neuer Dokumente",
      "state": "Hessen",
      "amtsgericht": "Amtsgericht Frankfurt am Main",
      "registernummer": "HRB 79808",
      "registerart": "HRB",
      "company_name": "DB Vertrieb GmbH",
      "company_seat": "Frankfurt am Main",
      "details": "12.12.2024 (Bekanntmachungsdatum)\n\nHessen Amtsgericht Frankfurt am Main HRB 79808\nEinreichung neuer Dokumente 12.12.2024 (Eintragungsdatum)\n\nDB Vertrieb GmbH\nGesellschaft mit beschränkter Haftung\nFrankfurt am Main\n\nDurch eine Änderung in den Personen der Aufsichtsratsmitglieder ist eine Liste der Mitglieder des Aufsichtsrates zum Handelsregister eingereicht worden."
    },
    {
      "date": "2024-12-12",
      "id": "96323",
      "original_text": "Registerbekanntmachung nach dem Umwandlungsgesetz\nHessen Amtsgericht Frankfurt am Main HRB 134985\nFrankfurt Wohnland GmbH – Frankfurt am Main",
      "type": "Registerbekanntmachung nach dem Umwandlungsgesetz",
      "state": "Hessen",
      "amtsgericht": "Amtsgericht Frankfurt am Main",
      "registernummer": "HRB 134985",
      "registerart": "HRB",
      "company_name": "Frankfurt Wohnland GmbH",
      "company_seat": "Frankfurt am Main",
      "details": "12.12.2024 (Bekanntmachungsdatum)\n\nHessen Amtsgericht Frankfurt am Main HRB 134985\nRegisterbekanntmachung nach dem Umwandlungsgesetz 12.12.2024 (Eintragungsdatum)\n\nFrankfurt Wohnland GmbH\nGesellschaft mit beschränkter Haftung\nFrankfurt am Main\n\nDen Gläubigern der an der Verschmelzung beteiligten Rechtsträger ist, wenn sie binnen sechs Monaten nach dem Tag, an dem die Eintragung der Verschmelzung in das Register des Sitzes derjenigen Rechtsträger deren Gläubiger sie sind, nach § 19 Absatz 3 UmwG bekannt gemacht worden ist, ihren Anspruch nach Grund und Höhe schriftlich anmelden, Sicherheit zu leisten, soweit sie nicht Befriedigung verlangen können. Dieses Recht steht den Gläubigern jedoch nur zu, wenn sie glaubhaft machen, dass durch die Verschmelzung die Erfüllung ihrer Forderung gefährdet wird."
    },
    {
      "date": "2024-12-12",
      "id": "96324",
      "original_text": "Registerbekanntmachung nach dem Umwandlungsgesetz\nHessen Amtsgericht Frankfurt am Main HRB 135129\nOberursel GmbH – Frankfurt am Main",
      "type": "Registerbekanntmachung nach dem Umwandlungsgesetz",
      "state": "Hessen",
      "amtsgericht": "Amtsgericht Frankfurt am Main",
      "registernummer": "HRB 135129",
      "registerart": "HRB",
      "company_name": "Oberursel GmbH",
      "company_seat": "Frankfurt am Main",
      "details": "12.12.2024 (Bekanntmachungsdatum)\n\nHessen Amtsgericht Frankfurt am Main HRB 135129\nRegisterbekanntmachung nach dem Umwandlungsgesetz 12.12.2024 (Eintragungsdatum)\n\nOberursel GmbH\nGesellschaft mit beschränkter Haftung\nFrankfurt am Main\n\nDen Gläubigern der an der Verschmelzung beteiligten Rechtsträger ist, wenn sie binnen sechs Monaten nach dem Tag, an dem die Eintragung der Verschmelzung in das Register des Sitzes derjenigen Rechtsträger deren Gläubiger sie sind, nach § 19 Absatz 3 UmwG bekannt gemacht worden ist, ihren Anspruch nach Grund und Höhe schriftlich anmelden, Sicherheit zu leisten, soweit sie nicht Befriedigung verlangen können. Dieses Recht steht den Gläubigern jedoch nur zu, wenn sie glaubhaft machen, dass durch die Verschmelzung die Erfüllung ihrer Forderung gefährdet wird."
    }
  ]
}