{
  "date": "2024-12-21",
  "date_of_scrape": "2024-12-22T04:03:02.288Z",
  "tool_version": "0.2.0",
  "number_of_announcements": 16,
  "announcements": [
    {
      "date": "2024-12-21",
      "id": "97223",
      "original_text": "Sonstige Registerbekanntmachung\nBayern Amtsgericht Nürnberg HRB 20603\nElectrolux Hausgeräte GmbH – Nürnberg",
      "type": "Sonstige Registerbekanntmachung",
      "state": "Bayern",
      "amtsgericht": "Amtsgericht Nürnberg",
      "registernummer": "HRB 20603",
      "registerart": "HRB",
      "company_name": "Electrolux Hausgeräte GmbH",
      "company_seat": "Nürnberg",
      "details": "21.12.2024 (Bekanntmachungsdatum)\n\nBayern Amtsgericht Nürnberg HRB 20603\nSonstige Registerbekanntmachung\n\nElectrolux Hausgeräte GmbH\nGesellschaft mit beschränkter Haftung\nNürnberg\n\nDem Amtsgericht Nürnberg -Registergericht- ist eine Liste der Mitglieder des Aufsichtsrats eingereicht worden, § 52 Abs. 3 S. 2 GmbHG."
    },
    {
      "date": "2024-12-21",
      "id": "97224",
      "original_text": "Einreichung neuer Dokumente\nBayern Amtsgericht München HRB 221100\nAUR Portfolio III SE & Co. KGaA – Grünwald",
      "type": "Einreichung neuer Dokumente",
      "state": "Bayern",
      "amtsgericht": "Amtsgericht München",
      "registernummer": "HRB 221100",
      "registerart": "HRB",
      "company_name": "AUR Portfolio III SE & Co. KGaA",
      "company_seat": "Grünwald",
      "details": "21.12.2024 (Bekanntmachungsdatum)\n\nBayern Amtsgericht München HRB 221100\nEinreichung neuer Dokumente\n\nAUR Portfolio III SE & Co. KGaA\nKommanditgesellschaft auf Aktien\nGrünwald\n\nDem Amtsgericht München -Registergericht- isteine Liste der Mitglieder des Aufsichtsrats eingereicht worden, §§ 278 Abs. 3, 106 AktG.Dem Amtsgericht München -Registergericht- isteine Liste der Mitglieder des Aufsichtsrats eingereicht worden, §§ 278 Abs. 3, 106 AktG."
    },
    {
      "date": "2024-12-21",
      "id": "97225",
      "original_text": "Löschungsankündigung\nBayern Amtsgericht München HRB 240912\nPAVERIN GmbH – München",
      "type": "Löschungsankündigung",
      "state": "Bayern",
      "amtsgericht": "Amtsgericht München",
      "registernummer": "HRB 240912",
      "registerart": "HRB",
      "company_name": "PAVERIN GmbH",
      "company_seat": "München",
      "details": "21.12.2024 (Bekanntmachungsdatum)\n\nBayern Amtsgericht München HRB 240912\nLöschungsankündigung 20.12.2024 (Eintragungsdatum)\n\nPAVERIN GmbH\nGesellschaft mit beschränkter Haftung\nMünchen\n\nDas Registergericht beabsichtigt, die im Handelsregister eingetragene Gesellschaft wegen Vermögenslosigkeit von Amts wegen nach § 394 FamFG zu löschen. Die Frist zur Erhebung eines Widerspruchs ist auf drei Monate festgesetzt."
    },
    {
      "date": "2024-12-21",
      "id": "97226",
      "original_text": "Löschungsankündigung\nBayern Amtsgericht München HRB 191310\nFARMAKOM - Deutschland GmbH – München",
      "type": "Löschungsankündigung",
      "state": "Bayern",
      "amtsgericht": "Amtsgericht München",
      "registernummer": "HRB 191310",
      "registerart": "HRB",
      "company_name": "FARMAKOM - Deutschland GmbH",
      "company_seat": "München",
      "details": "21.12.2024 (Bekanntmachungsdatum)\n\nBayern Amtsgericht München HRB 191310\nLöschungsankündigung 20.12.2024 (Eintragungsdatum)\n\nFARMAKOM - Deutschland GmbH\nGesellschaft mit beschränkter Haftung\nMünchen\n\nDas Registergericht beabsichtigt, die im Handelsregister eingetragene Gesellschaft wegen Vermögenslosigkeit von Amts wegen nach § 394 FamFG zu löschen. Die Frist zur Erhebung eines Widerspruchs ist auf drei Monate festgesetzt."
    },
    {
      "date": "2024-12-21",
      "id": "97227",
      "original_text": "Registerbekanntmachung nach dem Umwandlungsgesetz\nBayern Amtsgericht Ingolstadt HRB 8009\nUFH Verwaltung GmbH – Neuburg a. d. Donau",
      "type": "Registerbekanntmachung nach dem Umwandlungsgesetz",
      "state": "Bayern",
      "amtsgericht": "Amtsgericht Ingolstadt",
      "registernummer": "HRB 8009",
      "registerart": "HRB",
      "company_name": "UFH Verwaltung GmbH",
      "company_seat": "Neuburg a. d. Donau",
      "details": "21.12.2024 (Bekanntmachungsdatum)\n\nBayern Amtsgericht Ingolstadt HRB 8009\nRegisterbekanntmachung nach dem Umwandlungsgesetz 20.12.2024 (Eintragungsdatum)\n\nUFH Verwaltung GmbH\nGesellschaft mit beschränkter Haftung\nNeuburg a. d. Donau\n\nDen Gläubigern der an der Verschmelzung beteiligten Rechtsträger ist, wenn sie binnen sechs Monaten nach dem Tag, an dem die Eintragung der Verschmelzung in das Register des Sitzes desjenigen Rechtsträgers, dessen Gläubiger sie sind, nach § 19 Abs. 3 UmwG als bekannt gemacht gilt, ihren Anspruch nach Grund und Höhe schriftlich anmelden, Sicherheit zu leisten, soweit sie nicht Befriedigung verlangen können. Dieses Recht steht den Gläubigern jedoch nur zu, wenn sie glaubhaft machen, dass durch die Verschmelzung die Erfüllung ihrer Forderung gefährdet wird"
    },
    {
      "date": "2024-12-21",
      "id": "97228",
      "original_text": "Registerbekanntmachung nach dem Umwandlungsgesetz\nBayern Amtsgericht Memmingen HRB 11350\nGebrüder Weiss GmbH – Memmingen",
      "type": "Registerbekanntmachung nach dem Umwandlungsgesetz",
      "state": "Bayern",
      "amtsgericht": "Amtsgericht Memmingen",
      "registernummer": "HRB 11350",
      "registerart": "HRB",
      "company_name": "Gebrüder Weiss GmbH",
      "company_seat": "Memmingen",
      "details": "21.12.2024 (Bekanntmachungsdatum)\n\nBayern Amtsgericht Memmingen HRB 11350\nRegisterbekanntmachung nach dem Umwandlungsgesetz 20.12.2024 (Eintragungsdatum)\n\nGebrüder Weiss GmbH\nGesellschaft mit beschränkter Haftung\nMemmingen\n\nDen Gläubigern der an der Verschmelzung beteiligten Rechtsträger ist, wenn sie binnen sechs Monaten nach dem Tag, an dem die Eintragung der Verschmelzung in das Register des Sitzes desjenigen Rechtsträgers, dessen Gläubiger sie sind, nach § 19 Abs. 3 UmwG als bekannt gemacht gilt, ihren Anspruch nach Grund und Höhe schriftlich anmelden, Sicherheit zu leisten, soweit sie nicht Befriedigung verlangen können. Dieses Recht steht den Gläubigern jedoch nur zu, wenn sie glaubhaft machen, dass durch die Verschmelzung die Erfüllung ihrer Forderung gefährdet wird."
    },
    {
      "date": "2024-12-21",
      "id": "97229",
      "original_text": "Einreichung neuer Dokumente\nBayern Amtsgericht München HRB 128019\nIT Works AG – München",
      "type": "Einreichung neuer Dokumente",
      "state": "Bayern",
      "amtsgericht": "Amtsgericht München",
      "registernummer": "HRB 128019",
      "registerart": "HRB",
      "company_name": "IT Works AG",
      "company_seat": "München",
      "details": "21.12.2024 (Bekanntmachungsdatum)\n\nBayern Amtsgericht München HRB 128019\nEinreichung neuer Dokumente 20.12.2024 (Eintragungsdatum)\n\nIT Works AG\nAktiengesellschaft\nMünchen\n\nDem Amtsgericht München -Registergericht- ist eine Liste der Mitglieder des Aufsichtsrats eingereicht worden, § 106 AktG."
    },
    {
      "date": "2024-12-21",
      "id": "97230",
      "original_text": "Registerbekanntmachung nach dem Umwandlungsgesetz\nBayern Amtsgericht München HRB 277425\nENTRO Invest GmbH – München",
      "type": "Registerbekanntmachung nach dem Umwandlungsgesetz",
      "state": "Bayern",
      "amtsgericht": "Amtsgericht München",
      "registernummer": "HRB 277425",
      "registerart": "HRB",
      "company_name": "ENTRO Invest GmbH",
      "company_seat": "München",
      "details": "21.12.2024 (Bekanntmachungsdatum)\n\nBayern Amtsgericht München HRB 277425\nRegisterbekanntmachung nach dem Umwandlungsgesetz 20.12.2024 (Eintragungsdatum)\n\nENTRO Invest GmbH\nGesellschaft mit beschränkter Haftung\nMünchen\n\nDen Gläubigern der an der Verschmelzung beteiligten Rechtsträger ist, wenn sie binnen sechs Monaten nach dem Tag, an dem die Eintragung der Verschmelzung in das Register des Sitzes desjenigen Rechtsträgers, dessen Gläubiger sie sind, nach § 19 Abs. 3 UmwG als bekannt gemacht gilt, ihren Anspruch nach Grund und Höhe schriftlich anmelden, Sicherheit zu leisten, soweit sie nicht Befriedigung verlangen können. Dieses Recht steht den Gläubigern jedoch nur zu, wenn sie glaubhaft machen, dass durch die Verschmelzung die Erfüllung ihrer Forderung gefährdet wird."
    },
    {
      "date": "2024-12-21",
      "id": "97231",
      "original_text": "Registerbekanntmachung nach dem Umwandlungsgesetz\nBayern Amtsgericht Hof HRB 7036\nInlife Werbetechnik GmbH – Helmbrechts",
      "type": "Registerbekanntmachung nach dem Umwandlungsgesetz",
      "state": "Bayern",
      "amtsgericht": "Amtsgericht Hof",
      "registernummer": "HRB 7036",
      "registerart": "HRB",
      "company_name": "Inlife Werbetechnik GmbH",
      "company_seat": "Helmbrechts",
      "details": "21.12.2024 (Bekanntmachungsdatum)\n\nBayern Amtsgericht Hof HRB 7036\nRegisterbekanntmachung nach dem Umwandlungsgesetz 20.12.2024 (Eintragungsdatum)\n\nInlife Werbetechnik GmbH\nGesellschaft mit beschränkter Haftung\nHelmbrechts\n\nDen Gläubigern der an der Ausgliederung beteiligten Rechtsträger ist, wenn sie binnen sechs Monaten nach dem Tag, an dem die Eintragung der Ausgliederung in das Register des Sitzes desjenigen Rechtsträgers, dessen Gläubiger sie sind, nach §§ 125, 19 Abs. 3 UmwG als bekannt gemacht gilt, ihren Anspruch nach Grund und Höhe schriftlich anmelden, Sicherheit zu leisten, soweit sie nicht Befriedigung verlangen können. Dieses Recht steht den Gläubigern jedoch nur zu, wenn sie glaubhaft machen, dass durch die Ausgliederung die Erfüllung ihrer Forderung gefährdet wird."
    },
    {
      "date": "2024-12-21",
      "id": "97232",
      "original_text": "Registerbekanntmachung nach dem Umwandlungsgesetz\nBayern Amtsgericht Hof HRA 4929\nInlife Werbeservice e.K. – Münchberg",
      "type": "Registerbekanntmachung nach dem Umwandlungsgesetz",
      "state": "Bayern",
      "amtsgericht": "Amtsgericht Hof",
      "registernummer": "HRA 4929",
      "registerart": "HRA",
      "company_name": "Inlife Werbeservice e.K.",
      "company_seat": "Münchberg",
      "details": "21.12.2024 (Bekanntmachungsdatum)\n\nBayern Amtsgericht Hof HRA 4929\nRegisterbekanntmachung nach dem Umwandlungsgesetz 20.12.2024 (Eintragungsdatum)\n\nInlife Werbeservice e.K.\nEinzelkaufmann / Einzelkauffrau\nMünchberg\n\nDen Gläubigern der an der Ausgliederung beteiligten Rechtsträger ist, wenn sie binnen sechs Monaten nach dem Tag, an dem die Eintragung der Ausgliederung in das Register des Sitzes desjenigen Rechtsträgers, dessen Gläubiger sie sind, nach §§ 125, 19 Abs. 3 UmwG als bekannt gemacht gilt, ihren Anspruch nach Grund und Höhe schriftlich anmelden, Sicherheit zu leisten, soweit sie nicht Befriedigung verlangen können. Dieses Recht steht den Gläubigern jedoch nur zu, wenn sie glaubhaft machen, dass durch die Ausgliederung die Erfüllung ihrer Forderung gefährdet wird."
    },
    {
      "date": "2024-12-21",
      "id": "97233",
      "original_text": "Registerbekanntmachung nach dem Umwandlungsgesetz\nBayern Amtsgericht München HRB 283451\nMack Immobilien GmbH – Münsing",
      "type": "Registerbekanntmachung nach dem Umwandlungsgesetz",
      "state": "Bayern",
      "amtsgericht": "Amtsgericht München",
      "registernummer": "HRB 283451",
      "registerart": "HRB",
      "company_name": "Mack Immobilien GmbH",
      "company_seat": "Münsing",
      "details": "21.12.2024 (Bekanntmachungsdatum)\n\nBayern Amtsgericht München HRB 283451\nRegisterbekanntmachung nach dem Umwandlungsgesetz 20.12.2024 (Eintragungsdatum)\n\nMack Immobilien GmbH\nGesellschaft mit beschränkter Haftung\nMünsing\n\nDen Gläubigern der an der Ausgliederung beteiligten Rechtsträger ist, wenn sie binnen sechs Monaten nach dem Tag, an dem die Eintragung der Ausgliederung in das Register des Sitzes desjenigen Rechtsträgers, dessen Gläubiger sie sind, nach §§ 125, 19 Abs. 3 UmwG als bekannt gemacht gilt, ihren Anspruch nach Grund und Höhe schriftlich anmelden, Sicherheit zu leisten, soweit sie nicht Befriedigung verlangen können. Dieses Recht steht den Gläubigern jedoch nur zu, wenn sie glaubhaft machen, dass durch die Ausgliederung die Erfüllung ihrer Forderung gefährdet wird."
    },
    {
      "date": "2024-12-21",
      "id": "97234",
      "original_text": "Einreichung neuer Dokumente\nBayern Amtsgericht München HRB 3824\nSPINNER GmbH – München",
      "type": "Einreichung neuer Dokumente",
      "state": "Bayern",
      "amtsgericht": "Amtsgericht München",
      "registernummer": "HRB 3824",
      "registerart": "HRB",
      "company_name": "SPINNER GmbH",
      "company_seat": "München",
      "details": "21.12.2024 (Bekanntmachungsdatum)\n\nBayern Amtsgericht München HRB 3824\nEinreichung neuer Dokumente 13.12.2024 (Eintragungsdatum)\n\nSPINNER GmbH\nGesellschaft mit beschränkter Haftung\nMünchen\n\nDem #Re.Name ist eine Liste der Mitglieder des Aufsichtsrats eingereicht worden, § 52 Abs. 3 S. 2 GmbHG."
    },
    {
      "date": "2024-12-21",
      "id": "97235",
      "original_text": "Registerbekanntmachung nach dem Umwandlungsgesetz\nBayern Amtsgericht München HRB 276978\nBecker Capital Management UG (haftungsbeschränkt) – München",
      "type": "Registerbekanntmachung nach dem Umwandlungsgesetz",
      "state": "Bayern",
      "amtsgericht": "Amtsgericht München",
      "registernummer": "HRB 276978",
      "registerart": "HRB",
      "company_name": "Becker Capital Management UG (haftungsbeschränkt)",
      "company_seat": "München",
      "details": "21.12.2024 (Bekanntmachungsdatum)\n\nBayern Amtsgericht München HRB 276978\nRegisterbekanntmachung nach dem Umwandlungsgesetz 20.12.2024 (Eintragungsdatum)\n\nBecker Capital Management UG (haftungsbeschränkt)\nGesellschaft mit beschränkter Haftung\nMünchen\n\nDen Gläubigern der an der Verschmelzung beteiligten Rechtsträger ist, wenn sie binnen sechs Monaten nach dem Tag, an dem die Eintragung der Verschmelzung in das Register des Sitzes desjenigen Rechtsträgers, dessen Gläubiger sie sind, nach § 19 Abs. 3 UmwG als bekannt gemacht gilt, ihren Anspruch nach Grund und Höhe schriftlich anmelden, Sicherheit zu leisten, soweit sie nicht Befriedigung verlangen können. Dieses Recht steht den Gläubigern jedoch nur zu, wenn sie glaubhaft machen, dass durch die Verschmelzung die Erfüllung ihrer Forderung gefährdet wird."
    },
    {
      "date": "2024-12-21",
      "id": "97236",
      "original_text": "Registerbekanntmachung nach dem Umwandlungsgesetz\nBayern Amtsgericht Ingolstadt HRB 11132\nVIB Fund Management GmbH – Neuburg a.d.Donau",
      "type": "Registerbekanntmachung nach dem Umwandlungsgesetz",
      "state": "Bayern",
      "amtsgericht": "Amtsgericht Ingolstadt",
      "registernummer": "HRB 11132",
      "registerart": "HRB",
      "company_name": "VIB Fund Management GmbH",
      "company_seat": "Neuburg a.d.Donau",
      "details": "21.12.2024 (Bekanntmachungsdatum)\n\nBayern Amtsgericht Ingolstadt HRB 11132\nRegisterbekanntmachung nach dem Umwandlungsgesetz 20.12.2024 (Eintragungsdatum)\n\nVIB Fund Management GmbH\nGesellschaft mit beschränkter Haftung\nNeuburg a.d.Donau\n\nDen Gläubigern der an der Verschmelzung beteiligten Rechtsträger ist, wenn sie binnen sechs Monaten nach dem Tag, an dem die Eintragung der Verschmelzung in das Register des Sitzes desjenigen Rechtsträgers, dessen Gläubiger sie sind, nach § 19 Abs. 3 UmwG als bekannt gemacht gilt, ihren Anspruch nach Grund und Höhe schriftlich anmelden, Sicherheit zu leisten, soweit sie nicht Befriedigung verlangen können. Dieses Recht steht den Gläubigern jedoch nur zu, wenn sie glaubhaft machen, dass durch die Verschmelzung die Erfüllung ihrer Forderung gefährdet wird."
    },
    {
      "date": "2024-12-21",
      "id": "97237",
      "original_text": "Löschungsankündigung\nBayern Amtsgericht Straubing HRA 1437\nJohann Baptist Stierstorfer – Geiselhöring",
      "type": "Löschungsankündigung",
      "state": "Bayern",
      "amtsgericht": "Amtsgericht Straubing",
      "registernummer": "HRA 1437",
      "registerart": "HRA",
      "company_name": "Johann Baptist Stierstorfer",
      "company_seat": "Geiselhöring",
      "details": "21.12.2024 (Bekanntmachungsdatum)\n\nBayern Amtsgericht Straubing HRA 1437\nLöschungsankündigung\n\nJohann Baptist Stierstorfer\nEinzelkaufmann / Einzelkauffrau\nGeiselhöring\n\nDas Registergericht beabsichtigt, die im Handelsregister eingetragene Firma von Amts wegen nach § 31 Abs. 2 HGB zu löschen. Die Frist zur Erhebung eines Widerspruchs ist auf drei Monate festgesetzt."
    },
    {
      "date": "2024-12-21",
      "id": "97238",
      "original_text": "Löschungsankündigung\nBayern Amtsgericht Aschaffenburg HRB 16599\nSteuerbüro Alexander Blank Steuerberatungsgesellschaft UG (haftungsbeschränkt) – Mespelbrunn",
      "type": "Löschungsankündigung",
      "state": "Bayern",
      "amtsgericht": "Amtsgericht Aschaffenburg",
      "registernummer": "HRB 16599",
      "registerart": "HRB",
      "company_name": "Steuerbüro Alexander Blank Steuerberatungsgesellschaft UG (haftungsbeschränkt)",
      "company_seat": "Mespelbrunn",
      "details": "21.12.2024 (Bekanntmachungsdatum)\n\nBayern Amtsgericht Aschaffenburg HRB 16599\nLöschungsankündigung\n\nSteuerbüro Alexander Blank Steuerberatungsgesellschaft UG (haftungsbeschränkt)\nGesellschaft mit beschränkter Haftung\nMespelbrunn\n\nDas Registergericht beabsichtigt, die im Handelsregister eingetragene Gesellschaft wegen Vermögenslosigkeit von Amts wegen nach § 394 FamFG zu löschen. Die Frist zur Erhebung eines Widerspruchs ist auf drei Monate festgesetzt."
    }
  ]
}