{
  "date": "2024-12-11",
  "date_of_scrape": "2024-12-12T04:10:51.585Z",
  "tool_version": "0.2.0",
  "number_of_announcements": 177,
  "announcements": [
    {
      "date": "2024-12-11",
      "id": "96023",
      "original_text": "Registerbekanntmachung nach dem Umwandlungsgesetz\nBayern Amtsgericht Nürnberg HRB 32129\ncargo support Service GmbH – Nürnberg",
      "type": "Registerbekanntmachung nach dem Umwandlungsgesetz",
      "state": "Bayern",
      "amtsgericht": "Amtsgericht Nürnberg",
      "registernummer": "HRB 32129",
      "registerart": "HRB",
      "company_name": "cargo support Service GmbH",
      "company_seat": "Nürnberg",
      "details": "11.12.2024 (Bekanntmachungsdatum)\n\nBayern Amtsgericht Nürnberg HRB 32129\nRegisterbekanntmachung nach dem Umwandlungsgesetz 10.12.2024 (Eintragungsdatum)\n\ncargo support Service GmbH\nGesellschaft mit beschränkter Haftung\nNürnberg\n\nDen Gläubigern der an der Verschmelzung beteiligten Rechtsträger ist, wenn sie binnen sechs Monaten nach dem Tag, an dem die Eintragung der Verschmelzung in das Register des Sitzes desjenigen Rechtsträgers, dessen Gläubiger sie sind, nach § 19 Abs. 3 UmwG als bekannt gemacht gilt, ihren Anspruch nach Grund und Höhe schriftlich anmelden, Sicherheit zu leisten, soweit sie nicht Befriedigung verlangen können. Dieses Recht steht den Gläubigern jedoch nur zu, wenn sie glaubhaft machen, dass durch die Verschmelzung die Erfüllung ihrer Forderung gefährdet wird."
    },
    {
      "date": "2024-12-11",
      "id": "96024",
      "original_text": "Registerbekanntmachung nach dem Umwandlungsgesetz\nBayern Amtsgericht Nürnberg HRB 28416\nTroFilms GmbH – Georgensgmünd",
      "type": "Registerbekanntmachung nach dem Umwandlungsgesetz",
      "state": "Bayern",
      "amtsgericht": "Amtsgericht Nürnberg",
      "registernummer": "HRB 28416",
      "registerart": "HRB",
      "company_name": "TroFilms GmbH",
      "company_seat": "Georgensgmünd",
      "details": "11.12.2024 (Bekanntmachungsdatum)\n\nBayern Amtsgericht Nürnberg HRB 28416\nRegisterbekanntmachung nach dem Umwandlungsgesetz 10.12.2024 (Eintragungsdatum)\n\nTroFilms GmbH\nGesellschaft mit beschränkter Haftung\nGeorgensgmünd\n\nDen Gläubigern der an der Verschmelzung beteiligten Rechtsträger ist, wenn sie binnen sechs Monaten nach dem Tag, an dem die Eintragung der Verschmelzung in das Register des Sitzes desjenigen Rechtsträgers, dessen Gläubiger sie sind, nach § 19 Abs. 3 UmwG als bekannt gemacht gilt, ihren Anspruch nach Grund und Höhe schriftlich anmelden, Sicherheit zu leisten, soweit sie nicht Befriedigung verlangen können. Dieses Recht steht den Gläubigern jedoch nur zu, wenn sie glaubhaft machen, dass durch die Verschmelzung die Erfüllung ihrer Forderung gefährdet wird."
    },
    {
      "date": "2024-12-11",
      "id": "96025",
      "original_text": "Löschungsankündigung\nBayern Amtsgericht Aschaffenburg HRB 14676\nFranz Kohl Transport GmbH – Mömbris",
      "type": "Löschungsankündigung",
      "state": "Bayern",
      "amtsgericht": "Amtsgericht Aschaffenburg",
      "registernummer": "HRB 14676",
      "registerart": "HRB",
      "company_name": "Franz Kohl Transport GmbH",
      "company_seat": "Mömbris",
      "details": "11.12.2024 (Bekanntmachungsdatum)\n\nBayern Amtsgericht Aschaffenburg HRB 14676\nLöschungsankündigung\n\nFranz Kohl Transport GmbH\nGesellschaft mit beschränkter Haftung\nMömbris\n\nDas Registergericht beabsichtigt, die im Handelsregister eingetragene Gesellschaft wegen Vermögenslosigkeit von Amts wegen nach § 394 FamFG zu löschen. Die Frist zur Erhebung eines Widerspruchs ist auf drei Monate festgesetzt."
    },
    {
      "date": "2024-12-11",
      "id": "96026",
      "original_text": "Löschungsankündigung\nBayern Amtsgericht München HRB 217620\nJAVES Gebäudemanagement GmbH – Ismaning",
      "type": "Löschungsankündigung",
      "state": "Bayern",
      "amtsgericht": "Amtsgericht München",
      "registernummer": "HRB 217620",
      "registerart": "HRB",
      "company_name": "JAVES Gebäudemanagement GmbH",
      "company_seat": "Ismaning",
      "details": "11.12.2024 (Bekanntmachungsdatum)\n\nBayern Amtsgericht München HRB 217620\nLöschungsankündigung 10.12.2024 (Eintragungsdatum)\n\nJAVES Gebäudemanagement GmbH\nGesellschaft mit beschränkter Haftung\nIsmaning\n\nDas Registergericht beabsichtigt, die im Handelsregister eingetragene Gesellschaft wegen Vermögenslosigkeit von Amts wegen nach § 394 FamFG zu löschen. Die Frist zur Erhebung eines Widerspruchs ist auf drei Monate festgesetzt."
    },
    {
      "date": "2024-12-11",
      "id": "96027",
      "original_text": "Einreichung neuer Dokumente\nBayern Amtsgericht München HRB 131747\nTOPIX Business Software AG – Hohenbrunn",
      "type": "Einreichung neuer Dokumente",
      "state": "Bayern",
      "amtsgericht": "Amtsgericht München",
      "registernummer": "HRB 131747",
      "registerart": "HRB",
      "company_name": "TOPIX Business Software AG",
      "company_seat": "Hohenbrunn",
      "details": "11.12.2024 (Bekanntmachungsdatum)\n\nBayern Amtsgericht München HRB 131747\nEinreichung neuer Dokumente 10.12.2024 (Eintragungsdatum)\n\nTOPIX Business Software AG\nAktiengesellschaft\nHohenbrunn\n\nDem Amtsgericht München -Registergericht- ist eine Liste der Mitglieder des Aufsichtsrats eingereicht worden, § 106 AktG."
    },
    {
      "date": "2024-12-11",
      "id": "96028",
      "original_text": "Löschungsankündigung\nBayern Amtsgericht Aschaffenburg HRB 17616\nCatalin GmbH – Karlstein am Main",
      "type": "Löschungsankündigung",
      "state": "Bayern",
      "amtsgericht": "Amtsgericht Aschaffenburg",
      "registernummer": "HRB 17616",
      "registerart": "HRB",
      "company_name": "Catalin GmbH",
      "company_seat": "Karlstein am Main",
      "details": "11.12.2024 (Bekanntmachungsdatum)\n\nBayern Amtsgericht Aschaffenburg HRB 17616\nLöschungsankündigung\n\nCatalin GmbH\nGesellschaft mit beschränkter Haftung\nKarlstein am Main\n\nDas Registergericht beabsichtigt, die im Handelsregister eingetragene Gesellschaft wegen Vermögenslosigkeit von Amts wegen nach § 394 FamFG zu löschen. Die Frist zur Erhebung eines Widerspruchs ist auf drei Monate festgesetzt."
    },
    {
      "date": "2024-12-11",
      "id": "96029",
      "original_text": "Einreichung neuer Dokumente\nBayern Amtsgericht Kempten (Allgäu) HRB 1795\nHochland Deutschland GmbH – Heimenkirch i. Allgäu",
      "type": "Einreichung neuer Dokumente",
      "state": "Bayern",
      "amtsgericht": "Amtsgericht Kempten (Allgäu)",
      "registernummer": "HRB 1795",
      "registerart": "HRB",
      "company_name": "Hochland Deutschland GmbH",
      "company_seat": "Heimenkirch i. Allgäu",
      "details": "11.12.2024 (Bekanntmachungsdatum)\n\nBayern Amtsgericht Kempten (Allgäu) HRB 1795\nEinreichung neuer Dokumente 06.12.2024 (Eintragungsdatum)\n\nHochland Deutschland GmbH\nGesellschaft mit beschränkter Haftung\nHeimenkirch i. Allgäu\n\nDem Amtsgericht Kempten (Allgäu) -Registergericht- ist eine Liste der Mitglieder des Aufsichtsrats eingereicht worden, § 52 Abs. 3 S. 2 GmbHG."
    },
    {
      "date": "2024-12-11",
      "id": "96030",
      "original_text": "Löschungsankündigung\nBayern Amtsgericht München HRB 250315\nB&B Logistics UG (haftungsbeschränkt) – Au i.d.Hallertau",
      "type": "Löschungsankündigung",
      "state": "Bayern",
      "amtsgericht": "Amtsgericht München",
      "registernummer": "HRB 250315",
      "registerart": "HRB",
      "company_name": "B&B Logistics UG (haftungsbeschränkt)",
      "company_seat": "Au i.d.Hallertau",
      "details": "11.12.2024 (Bekanntmachungsdatum)\n\nBayern Amtsgericht München HRB 250315\nLöschungsankündigung 10.12.2024 (Eintragungsdatum)\n\nB&B Logistics UG (haftungsbeschränkt)\nGesellschaft mit beschränkter Haftung\nAu i.d.Hallertau\n\nDas Registergericht beabsichtigt, die im Handelsregister eingetragene Gesellschaft wegen Vermögenslosigkeit von Amts wegen nach § 394 FamFG zu löschen. Die Frist zur Erhebung eines Widerspruchs ist auf drei Monate festgesetzt."
    },
    {
      "date": "2024-12-11",
      "id": "96031",
      "original_text": "Registerbekanntmachung nach dem Umwandlungsgesetz\nBayern Amtsgericht Aschaffenburg HRB 9632\nOhmEx Industrielle Elektrowärme GmbH – Großwallstadt",
      "type": "Registerbekanntmachung nach dem Umwandlungsgesetz",
      "state": "Bayern",
      "amtsgericht": "Amtsgericht Aschaffenburg",
      "registernummer": "HRB 9632",
      "registerart": "HRB",
      "company_name": "OhmEx Industrielle Elektrowärme GmbH",
      "company_seat": "Großwallstadt",
      "details": "11.12.2024 (Bekanntmachungsdatum)\n\nBayern Amtsgericht Aschaffenburg HRB 9632\nRegisterbekanntmachung nach dem Umwandlungsgesetz 10.12.2024 (Eintragungsdatum)\n\nOhmEx Industrielle Elektrowärme GmbH\nGesellschaft mit beschränkter Haftung\nGroßwallstadt\n\nDen Gläubigern der an der Verschmelzung beteiligten Rechtsträger ist, wenn sie binnen sechs Monaten nach dem Tag, an dem die Eintragung der Verschmelzung in das Register des Sitzes desjenigen Rechtsträgers, dessen Gläubiger sie sind, nach § 19 Abs. 3 UmwG als bekannt gemacht gilt, ihren Anspruch nach Grund und Höhe schriftlich anmelden, Sicherheit zu leisten, soweit sie nicht Befriedigung verlangen können. Dieses Recht steht den Gläubigern jedoch nur zu, wenn sie glaubhaft machen, dass durch die Verschmelzung die Erfüllung ihrer Forderung gefährdet wird."
    },
    {
      "date": "2024-12-11",
      "id": "96032",
      "original_text": "Registerbekanntmachung nach dem Umwandlungsgesetz\nBayern Amtsgericht Fürth HRA 12286\nBlockheizkraftwerk ambulant betreute Wohngemeinschaft Langenfeld OHG – Langenfeld",
      "type": "Registerbekanntmachung nach dem Umwandlungsgesetz",
      "state": "Bayern",
      "amtsgericht": "Amtsgericht Fürth",
      "registernummer": "HRA 12286",
      "registerart": "HRA",
      "company_name": "Blockheizkraftwerk ambulant betreute Wohngemeinschaft Langenfeld OHG",
      "company_seat": "Langenfeld",
      "details": "11.12.2024 (Bekanntmachungsdatum)\n\nBayern Amtsgericht Fürth HRA 12286\nRegisterbekanntmachung nach dem Umwandlungsgesetz 10.12.2024 (Eintragungsdatum)\n\nBlockheizkraftwerk ambulant betreute Wohngemeinschaft Langenfeld OHG\nOffene Handelsgesellschaft\nLangenfeld\n\nDen Gläubigern des formwechselnden Rechtsträgers ist, wenn sie binnen sechs Monaten nach dem Tag, an dem die Eintragung des Formwechsels nach § 201 UmwG als bekannt gemacht gilt, ihren Anspruch nach Grund und Höhe schriftlich anmelden, Sicherheit zu leisten, soweit sie nicht Befriedigung verlangen können. Dieses Recht steht den Gläubigern jedoch nur zu, wenn sie glaubhaft machen, dass durch den Formwechsel die Erfüllung ihrer Forderung gefährdet wird."
    },
    {
      "date": "2024-12-11",
      "id": "96033",
      "original_text": "Registerbekanntmachung nach dem Umwandlungsgesetz\nBayern Amtsgericht Fürth GsR 320\nWein-Plus Solutions eGbR – Erlangen",
      "type": "Registerbekanntmachung nach dem Umwandlungsgesetz",
      "state": "Bayern",
      "amtsgericht": "Amtsgericht Fürth",
      "registernummer": "GsR 320",
      "registerart": "GsR",
      "company_name": "Wein-Plus Solutions eGbR",
      "company_seat": "Erlangen",
      "details": "11.12.2024 (Bekanntmachungsdatum)\n\nBayern Amtsgericht Fürth GsR 320\nRegisterbekanntmachung nach dem Umwandlungsgesetz 10.12.2024 (Eintragungsdatum)\n\nWein-Plus Solutions eGbR\nGesellschaft bürgerlichen Rechts\nErlangen\n\nDen Gläubigern des formwechselnden Rechtsträgers ist, wenn sie binnen sechs Monaten nach dem Tag, an dem die Eintragung des Formwechsels nach § 201 UmwG als bekannt gemacht gilt, ihren Anspruch nach Grund und Höhe schriftlich anmelden, Sicherheit zu leisten, soweit sie nicht Befriedigung verlangen können. Dieses Recht steht den Gläubigern jedoch nur zu, wenn sie glaubhaft machen, dass durch den Formwechsel die Erfüllung ihrer Forderung gefährdet wird."
    },
    {
      "date": "2024-12-11",
      "id": "96034",
      "original_text": "Löschungsankündigung\nBayern Amtsgericht Coburg HRB 5381\nAVA Express GmbH – Coburg",
      "type": "Löschungsankündigung",
      "state": "Bayern",
      "amtsgericht": "Amtsgericht Coburg",
      "registernummer": "HRB 5381",
      "registerart": "HRB",
      "company_name": "AVA Express GmbH",
      "company_seat": "Coburg",
      "details": "11.12.2024 (Bekanntmachungsdatum)\n\nBayern Amtsgericht Coburg HRB 5381\nLöschungsankündigung 06.12.2024 (Eintragungsdatum)\n\nAVA Express GmbH\nGesellschaft mit beschränkter Haftung\nCoburg\n\nDas Registergericht beabsichtigt, die im Handelsregister eingetragene Gesellschaft wegen Vermögenslosigkeit von Amts wegen nach § 394 FamFG zu löschen. Die Frist zur Erhebung eines Widerspruchs ist auf sechs Wochen festgesetzt."
    },
    {
      "date": "2024-12-11",
      "id": "96035",
      "original_text": "Registerbekanntmachung nach dem Umwandlungsgesetz\nBayern Amtsgericht München HRA 103514\nSecuTrans e.K. – Bergkirchen",
      "type": "Registerbekanntmachung nach dem Umwandlungsgesetz",
      "state": "Bayern",
      "amtsgericht": "Amtsgericht München",
      "registernummer": "HRA 103514",
      "registerart": "HRA",
      "company_name": "SecuTrans e.K.",
      "company_seat": "Bergkirchen",
      "details": "11.12.2024 (Bekanntmachungsdatum)\n\nBayern Amtsgericht München HRA 103514\nRegisterbekanntmachung nach dem Umwandlungsgesetz 10.12.2024 (Eintragungsdatum)\n\nSecuTrans e.K.\nEinzelkaufmann / Einzelkauffrau\nBergkirchen\n\nZur Ausgliederung des Unternehmens aus dem Vermögen des Inhabers betr. die SecuTrans e.K.mit Sitz in Bergkirchen, eingetragen beim Amtsgericht München unter HRA 103514,  auf die SecuTrans Sicherheitslogistik GmbH mit Sitz in Bergkirchen, Amtsgericht München, HRB 294997: Den Gläubigern der an der Ausgliederung beteiligten Rechtsträger ist, wenn sie binnen sechs Monaten nach dem Tag, an dem die Eintragung der Ausgliederung in das Register des Sitzes desjenigen Rechtsträgers, dessen Gläubiger sie sind, nach §§ 125, 19 Abs. 3 UmwG als bekannt gemacht gilt, ihren Anspruch nach Grund und Höhe schriftlich anmelden, Sicherheit zu leisten, soweit sie nicht Befriedigung verlangen können. Dieses Recht steht den Gläubigern jedoch nur zu, wenn sie glaubhaft machen, dass durch die Ausgliederung die Erfüllung ihrer Forderung gefährdet wird."
    },
    {
      "date": "2024-12-11",
      "id": "96036",
      "original_text": "Einreichung neuer Dokumente\nBayern Amtsgericht Bayreuth HRB 50\nWilhelm Kneitz Aktiengesellschaft, Textilwerke – Wirsberg",
      "type": "Einreichung neuer Dokumente",
      "state": "Bayern",
      "amtsgericht": "Amtsgericht Bayreuth",
      "registernummer": "HRB 50",
      "registerart": "HRB",
      "company_name": "Wilhelm Kneitz Aktiengesellschaft, Textilwerke",
      "company_seat": "Wirsberg",
      "details": "11.12.2024 (Bekanntmachungsdatum)\n\nBayern Amtsgericht Bayreuth HRB 50\nEinreichung neuer Dokumente\n\nWilhelm  Kneitz Aktiengesellschaft, Textilwerke\nAktiengesellschaft\nWirsberg\n\nDem Amtsgericht Bayreuth -Registergericht- ist eine Liste der Mitglieder des Aufsichtsrats eingereicht worden, § 106 AktG."
    },
    {
      "date": "2024-12-11",
      "id": "96037",
      "original_text": "Einreichung neuer Dokumente\nBayern Amtsgericht München HRB 206806\nPrice f(x) AG – Pfaffenhofen a.d.Glonn",
      "type": "Einreichung neuer Dokumente",
      "state": "Bayern",
      "amtsgericht": "Amtsgericht München",
      "registernummer": "HRB 206806",
      "registerart": "HRB",
      "company_name": "Price f(x) AG",
      "company_seat": "Pfaffenhofen a.d.Glonn",
      "details": "11.12.2024 (Bekanntmachungsdatum)\n\nBayern Amtsgericht München HRB 206806\nEinreichung neuer Dokumente 10.12.2024 (Eintragungsdatum)\n\nPrice f(x) AG\nAktiengesellschaft\nPfaffenhofen a.d.Glonn\n\nDem Amtsgericht München -Registergericht- ist eine Liste der Mitglieder des Aufsichtsrats eingereicht worden, § 106 AktG."
    },
    {
      "date": "2024-12-11",
      "id": "96038",
      "original_text": "Registerbekanntmachung nach dem Umwandlungsgesetz\nBayern Amtsgericht Fürth HRB 21482\nBlockheizkraftwerk ambulant betreute Wohngemeinschaft Langenfeld GmbH – Langenfeld",
      "type": "Registerbekanntmachung nach dem Umwandlungsgesetz",
      "state": "Bayern",
      "amtsgericht": "Amtsgericht Fürth",
      "registernummer": "HRB 21482",
      "registerart": "HRB",
      "company_name": "Blockheizkraftwerk ambulant betreute Wohngemeinschaft Langenfeld GmbH",
      "company_seat": "Langenfeld",
      "details": "11.12.2024 (Bekanntmachungsdatum)\n\nBayern Amtsgericht Fürth HRB 21482\nRegisterbekanntmachung nach dem Umwandlungsgesetz 10.12.2024 (Eintragungsdatum)\n\nBlockheizkraftwerk ambulant betreute Wohngemeinschaft Langenfeld GmbH\nGesellschaft mit beschränkter Haftung\nLangenfeld\n\nDen Gläubigern des formwechselnden Rechtsträgers ist, wenn sie binnen sechs Monaten nach dem Tag, an dem die Eintragung des Formwechsels nach § 201 UmwG als bekannt gemacht gilt, ihren Anspruch nach Grund und Höhe schriftlich anmelden, Sicherheit zu leisten, soweit sie nicht Befriedigung verlangen können. Dieses Recht steht den Gläubigern jedoch nur zu, wenn sie glaubhaft machen, dass durch den Formwechsel die Erfüllung ihrer Forderung gefährdet wird."
    },
    {
      "date": "2024-12-11",
      "id": "96039",
      "original_text": "Löschungsankündigung\nBayern Amtsgericht Traunstein HRB 29230\nRIRO UG (haftungsbeschränkt) – Pfaffing",
      "type": "Löschungsankündigung",
      "state": "Bayern",
      "amtsgericht": "Amtsgericht Traunstein",
      "registernummer": "HRB 29230",
      "registerart": "HRB",
      "company_name": "RIRO UG (haftungsbeschränkt)",
      "company_seat": "Pfaffing",
      "details": "11.12.2024 (Bekanntmachungsdatum)\n\nBayern Amtsgericht Traunstein HRB 29230\nLöschungsankündigung\n\nRIRO UG (haftungsbeschränkt)\nGesellschaft mit beschränkter Haftung\nPfaffing\n\nDas Registergericht beabsichtigt, die im Handelsregister eingetragene Gesellschaft wegen Vermögenslosigkeit von Amts wegen nach § 394 FamFG zu löschen. Die Frist zur Erhebung eines Widerspruchs ist auf einen Monat festgesetzt."
    },
    {
      "date": "2024-12-11",
      "id": "96040",
      "original_text": "Registerbekanntmachung nach dem Umwandlungsgesetz\nBayern Amtsgericht Bayreuth HRA 1043\nSaum & Viebahn GmbH & Co. KG – Kulmbach",
      "type": "Registerbekanntmachung nach dem Umwandlungsgesetz",
      "state": "Bayern",
      "amtsgericht": "Amtsgericht Bayreuth",
      "registernummer": "HRA 1043",
      "registerart": "HRA",
      "company_name": "Saum & Viebahn GmbH & Co. KG",
      "company_seat": "Kulmbach",
      "details": "11.12.2024 (Bekanntmachungsdatum)\n\nBayern Amtsgericht Bayreuth HRA 1043\nRegisterbekanntmachung nach dem Umwandlungsgesetz 10.12.2024 (Eintragungsdatum)\n\nSaum & Viebahn GmbH & Co. KG\nKommanditgesellschaft\nKulmbach\n\nDen Gläubigern der an der Verschmelzung beteiligten Rechtsträger ist, wenn sie binnen sechs Monaten nach dem Tag, an dem die Eintragung der Verschmelzung in das Register des Sitzes desjenigen Rechtsträgers, dessen Gläubiger sie sind, nach § 19 Abs. 3 UmwG als bekannt gemacht gilt, ihren Anspruch nach Grund und Höhe schriftlich anmelden, Sicherheit zu leisten, soweit sie nicht Befriedigung verlangen können. Dieses Recht steht den Gläubigern jedoch nur zu, wenn sie glaubhaft machen, dass durch die Verschmelzung die Erfüllung ihrer Forderung gefährdet wird."
    },
    {
      "date": "2024-12-11",
      "id": "96041",
      "original_text": "Löschungsankündigung\nBayern Amtsgericht München HRB 182050\nKyklades GmbH – München",
      "type": "Löschungsankündigung",
      "state": "Bayern",
      "amtsgericht": "Amtsgericht München",
      "registernummer": "HRB 182050",
      "registerart": "HRB",
      "company_name": "Kyklades GmbH",
      "company_seat": "München",
      "details": "11.12.2024 (Bekanntmachungsdatum)\n\nBayern Amtsgericht München HRB 182050\nLöschungsankündigung 10.12.2024 (Eintragungsdatum)\n\nKyklades GmbH\nGesellschaft mit beschränkter Haftung\nMünchen\n\nDas Registergericht beabsichtigt, die im Handelsregister eingetragene Gesellschaft wegen Vermögenslosigkeit von Amts wegen nach § 394 FamFG zu löschen. Die Frist zur Erhebung eines Widerspruchs ist auf drei Monate festgesetzt."
    },
    {
      "date": "2024-12-11",
      "id": "96042",
      "original_text": "Registerbekanntmachung nach dem Umwandlungsgesetz\nBayern Amtsgericht Augsburg HRB 11581\nNCR GmbH – Augsburg",
      "type": "Registerbekanntmachung nach dem Umwandlungsgesetz",
      "state": "Bayern",
      "amtsgericht": "Amtsgericht Augsburg",
      "registernummer": "HRB 11581",
      "registerart": "HRB",
      "company_name": "NCR GmbH",
      "company_seat": "Augsburg",
      "details": "11.12.2024 (Bekanntmachungsdatum)\n\nBayern Amtsgericht Augsburg HRB 11581\nRegisterbekanntmachung nach dem Umwandlungsgesetz 10.12.2024 (Eintragungsdatum)\n\nNCR GmbH\nGesellschaft mit beschränkter Haftung\nAugsburg\n\nDen Gläubigern der an der Ausgliederung beteiligten Rechtsträger ist, wenn sie binnen sechs Monaten nach dem Tag, an dem die Eintragung der Ausgliederung in das Register des Sitzes desjenigen Rechtsträgers, dessen Gläubiger sie sind, nach §§ 125, 19 Abs. 3 UmwG als bekannt gemacht gilt, ihren Anspruch nach Grund und Höhe schriftlich anmelden, Sicherheit zu leisten, soweit sie nicht Befriedigung verlangen können. Dieses Recht steht den Gläubigern jedoch nur zu, wenn sie glaubhaft machen, dass durch die Ausgliederung die Erfüllung ihrer Forderung gefährdet wird."
    },
    {
      "date": "2024-12-11",
      "id": "96043",
      "original_text": "Registerbekanntmachung nach dem Umwandlungsgesetz\nBayern Amtsgericht Memmingen HRB 19611\nGoldhofer Airport Technology GmbH – Memmingen",
      "type": "Registerbekanntmachung nach dem Umwandlungsgesetz",
      "state": "Bayern",
      "amtsgericht": "Amtsgericht Memmingen",
      "registernummer": "HRB 19611",
      "registerart": "HRB",
      "company_name": "Goldhofer Airport Technology GmbH",
      "company_seat": "Memmingen",
      "details": "11.12.2024 (Bekanntmachungsdatum)\n\nBayern Amtsgericht Memmingen HRB 19611\nRegisterbekanntmachung nach dem Umwandlungsgesetz 10.12.2024 (Eintragungsdatum)\n\nGoldhofer Airport Technology GmbH\nGesellschaft mit beschränkter Haftung\nMemmingen\n\nDen Gläubigern des formwechselnden Rechtsträgers ist, wenn sie binnen sechs Monaten nach dem Tag, an dem die Eintragung des Formwechsels nach § 201 UmwG als bekannt gemacht gilt, ihren Anspruch nach Grund und Höhe schriftlich anmelden, Sicherheit zu leisten, soweit sie nicht Befriedigung verlangen können. Dieses Recht steht den Gläubigern jedoch nur zu, wenn sie glaubhaft machen, dass durch den Formwechsel die Erfüllung ihrer Forderung gefährdet wird."
    },
    {
      "date": "2024-12-11",
      "id": "96044",
      "original_text": "Registerbekanntmachung nach dem Umwandlungsgesetz\nBayern Amtsgericht München HRB 279817\nGansemer GmbH – München",
      "type": "Registerbekanntmachung nach dem Umwandlungsgesetz",
      "state": "Bayern",
      "amtsgericht": "Amtsgericht München",
      "registernummer": "HRB 279817",
      "registerart": "HRB",
      "company_name": "Gansemer GmbH",
      "company_seat": "München",
      "details": "11.12.2024 (Bekanntmachungsdatum)\n\nBayern Amtsgericht München HRB 279817\nRegisterbekanntmachung nach dem Umwandlungsgesetz 10.12.2024 (Eintragungsdatum)\n\nGansemer GmbH\nGesellschaft mit beschränkter Haftung\nMünchen\n\nDen Gläubigern der an der Verschmelzung beteiligten Rechtsträger ist, wenn sie binnen sechs Monaten nach dem Tag, an dem die Eintragung der Verschmelzung in das Register des Sitzes desjenigen Rechtsträgers, dessen Gläubiger sie sind, nach § 19 Abs. 3 UmwG als bekannt gemacht gilt, ihren Anspruch nach Grund und Höhe schriftlich anmelden, Sicherheit zu leisten, soweit sie nicht Befriedigung verlangen können. Dieses Recht steht den Gläubigern jedoch nur zu, wenn sie glaubhaft machen, dass durch die Verschmelzung die Erfüllung ihrer Forderung gefährdet wird."
    },
    {
      "date": "2024-12-11",
      "id": "96045",
      "original_text": "Löschungsankündigung\nBayern Amtsgericht München HRB 230963\nBRA´S Entertainment GmbH – München",
      "type": "Löschungsankündigung",
      "state": "Bayern",
      "amtsgericht": "Amtsgericht München",
      "registernummer": "HRB 230963",
      "registerart": "HRB",
      "company_name": "BRA´S Entertainment GmbH",
      "company_seat": "München",
      "details": "11.12.2024 (Bekanntmachungsdatum)\n\nBayern Amtsgericht München HRB 230963\nLöschungsankündigung 10.12.2024 (Eintragungsdatum)\n\nBRA´S Entertainment GmbH\nGesellschaft mit beschränkter Haftung\nMünchen\n\nDas Registergericht beabsichtigt, die im Handelsregister eingetragene Gesellschaft wegen Vermögenslosigkeit von Amts wegen nach § 394 FamFG zu löschen. Die Frist zur Erhebung eines Widerspruchs ist auf drei Monate festgesetzt."
    },
    {
      "date": "2024-12-11",
      "id": "96046",
      "original_text": "Registerbekanntmachung nach dem Umwandlungsgesetz\nBayern Amtsgericht Augsburg HRB 37449\nStraßer & Partner Versicherungsmakler GmbH – Igling",
      "type": "Registerbekanntmachung nach dem Umwandlungsgesetz",
      "state": "Bayern",
      "amtsgericht": "Amtsgericht Augsburg",
      "registernummer": "HRB 37449",
      "registerart": "HRB",
      "company_name": "Straßer & Partner Versicherungsmakler GmbH",
      "company_seat": "Igling",
      "details": "11.12.2024 (Bekanntmachungsdatum)\n\nBayern Amtsgericht Augsburg HRB 37449\nRegisterbekanntmachung nach dem Umwandlungsgesetz 10.12.2024 (Eintragungsdatum)\n\nStraßer & Partner Versicherungsmakler GmbH\nGesellschaft mit beschränkter Haftung\nIgling\n\nDen Gläubigern der an der Verschmelzung beteiligten Rechtsträger ist, wenn sie binnen sechs Monaten nach dem Tag, an dem die Eintragung der Verschmelzung in das Register des Sitzes desjenigen Rechtsträgers, dessen Gläubiger sie sind, nach § 19 Abs. 3 UmwG als bekannt gemacht gilt, ihren Anspruch nach Grund und Höhe schriftlich anmelden, Sicherheit zu leisten, soweit sie nicht Befriedigung verlangen können. Dieses Recht steht den Gläubigern jedoch nur zu, wenn sie glaubhaft machen, dass durch die Verschmelzung die Erfüllung ihrer Forderung gefährdet wird."
    },
    {
      "date": "2024-12-11",
      "id": "96047",
      "original_text": "Löschungsankündigung\nBayern Amtsgericht München HRB 226964\nStein Connecting UG (haftungsbeschränkt) – München",
      "type": "Löschungsankündigung",
      "state": "Bayern",
      "amtsgericht": "Amtsgericht München",
      "registernummer": "HRB 226964",
      "registerart": "HRB",
      "company_name": "Stein Connecting UG (haftungsbeschränkt)",
      "company_seat": "München",
      "details": "11.12.2024 (Bekanntmachungsdatum)\n\nBayern Amtsgericht München HRB 226964\nLöschungsankündigung 10.12.2024 (Eintragungsdatum)\n\nStein Connecting UG (haftungsbeschränkt)\nGesellschaft mit beschränkter Haftung\nMünchen\n\nDas Registergericht beabsichtigt, die im Handelsregister eingetragene Gesellschaft wegen Vermögenslosigkeit von Amts wegen nach § 394 FamFG zu löschen. Die Frist zur Erhebung eines Widerspruchs ist auf drei Monate festgesetzt."
    },
    {
      "date": "2024-12-11",
      "id": "96048",
      "original_text": "Registerbekanntmachung nach dem Umwandlungsgesetz\nBayern Amtsgericht Nürnberg HRB 31988\nR.U. Troyer Verwaltungs-GmbH – Georgensgmünd",
      "type": "Registerbekanntmachung nach dem Umwandlungsgesetz",
      "state": "Bayern",
      "amtsgericht": "Amtsgericht Nürnberg",
      "registernummer": "HRB 31988",
      "registerart": "HRB",
      "company_name": "R.U. Troyer Verwaltungs-GmbH",
      "company_seat": "Georgensgmünd",
      "details": "11.12.2024 (Bekanntmachungsdatum)\n\nBayern Amtsgericht Nürnberg HRB 31988\nRegisterbekanntmachung nach dem Umwandlungsgesetz 10.12.2024 (Eintragungsdatum)\n\nR.U. Troyer Verwaltungs-GmbH\nGesellschaft mit beschränkter Haftung\nGeorgensgmünd\n\nDen Gläubigern der an der Verschmelzung beteiligten Rechtsträger ist, wenn sie binnen sechs Monaten nach dem Tag, an dem die Eintragung der Verschmelzung in das Register des Sitzes desjenigen Rechtsträgers, dessen Gläubiger sie sind, nach § 19 Abs. 3 UmwG als bekannt gemacht gilt, ihren Anspruch nach Grund und Höhe schriftlich anmelden, Sicherheit zu leisten, soweit sie nicht Befriedigung verlangen können. Dieses Recht steht den Gläubigern jedoch nur zu, wenn sie glaubhaft machen, dass durch die Verschmelzung die Erfüllung ihrer Forderung gefährdet wird."
    },
    {
      "date": "2024-12-11",
      "id": "96049",
      "original_text": "Löschungsankündigung\nBayern Amtsgericht Schweinfurt HRB 7304\nDelija UG (haftungsbeschränkt) – Schweinfurt",
      "type": "Löschungsankündigung",
      "state": "Bayern",
      "amtsgericht": "Amtsgericht Schweinfurt",
      "registernummer": "HRB 7304",
      "registerart": "HRB",
      "company_name": "Delija UG (haftungsbeschränkt)",
      "company_seat": "Schweinfurt",
      "details": "11.12.2024 (Bekanntmachungsdatum)\n\nBayern Amtsgericht Schweinfurt HRB 7304\nLöschungsankündigung\n\nDelija UG (haftungsbeschränkt)\nGesellschaft mit beschränkter Haftung\nSchweinfurt\n\nDas Registergericht beabsichtigt, die im Handelsregister eingetragene Gesellschaft wegen Vermögenslosigkeit von Amts wegen nach § 394 FamFG zu löschen. Die Frist zur Erhebung eines Widerspruchs ist auf einen Monat festgesetzt."
    },
    {
      "date": "2024-12-11",
      "id": "96050",
      "original_text": "Registerbekanntmachung nach dem Umwandlungsgesetz\nBayern Amtsgericht Nürnberg HRB 20826\nNEFtv GmbH – Nürnberg",
      "type": "Registerbekanntmachung nach dem Umwandlungsgesetz",
      "state": "Bayern",
      "amtsgericht": "Amtsgericht Nürnberg",
      "registernummer": "HRB 20826",
      "registerart": "HRB",
      "company_name": "NEFtv GmbH",
      "company_seat": "Nürnberg",
      "details": "11.12.2024 (Bekanntmachungsdatum)\n\nBayern Amtsgericht Nürnberg HRB 20826\nRegisterbekanntmachung nach dem Umwandlungsgesetz 10.12.2024 (Eintragungsdatum)\n\nNEFtv GmbH\nGesellschaft mit beschränkter Haftung\nNürnberg\n\nDen Gläubigern der an der Verschmelzung beteiligten Rechtsträger ist, wenn sie binnen sechs Monaten nach dem Tag, an dem die Eintragung der Verschmelzung in das Register des Sitzes desjenigen Rechtsträgers, dessen Gläubiger sie sind, nach § 19 Abs. 3 UmwG als bekannt gemacht gilt, ihren Anspruch nach Grund und Höhe schriftlich anmelden, Sicherheit zu leisten, soweit sie nicht Befriedigung verlangen können. Dieses Recht steht den Gläubigern jedoch nur zu, wenn sie glaubhaft machen, dass durch die Verschmelzung die Erfüllung ihrer Forderung gefährdet wird."
    },
    {
      "date": "2024-12-11",
      "id": "96051",
      "original_text": "Einreichung neuer Dokumente\nBayern Amtsgericht Kempten (Allgäu) HRB 528\nImmobiliengesellschaft der Allgäuer Volksbank GmbH. – Kempten",
      "type": "Einreichung neuer Dokumente",
      "state": "Bayern",
      "amtsgericht": "Amtsgericht Kempten (Allgäu)",
      "registernummer": "HRB 528",
      "registerart": "HRB",
      "company_name": "Immobiliengesellschaft der Allgäuer Volksbank GmbH.",
      "company_seat": "Kempten",
      "details": "11.12.2024 (Bekanntmachungsdatum)\n\nBayern Amtsgericht Kempten (Allgäu) HRB 528\nEinreichung neuer Dokumente 09.12.2024 (Eintragungsdatum)\n\nImmobiliengesellschaft der Allgäuer Volksbank GmbH.\nGesellschaft mit beschränkter Haftung\nKempten\n\nDem Amtsgericht Kempten (Allgäu) -Registergericht- ist eine Liste der Mitglieder des Aufsichtsrats eingereicht worden, § 52 Abs. 3 S. 2 GmbHG."
    },
    {
      "date": "2024-12-11",
      "id": "96052",
      "original_text": "Löschungsankündigung\nBayern Amtsgericht Coburg HRB 6971\nReEnPro GmbH – Coburg",
      "type": "Löschungsankündigung",
      "state": "Bayern",
      "amtsgericht": "Amtsgericht Coburg",
      "registernummer": "HRB 6971",
      "registerart": "HRB",
      "company_name": "ReEnPro GmbH",
      "company_seat": "Coburg",
      "details": "11.12.2024 (Bekanntmachungsdatum)\n\nBayern Amtsgericht Coburg HRB 6971\nLöschungsankündigung 06.12.2024 (Eintragungsdatum)\n\nReEnPro GmbH\nGesellschaft mit beschränkter Haftung\nCoburg\n\nDas Registergericht beabsichtigt, die im Handelsregister eingetragene Gesellschaft wegen Vermögenslosigkeit von Amts wegen nach § 394 FamFG zu löschen. Die Frist zur Erhebung eines Widerspruchs ist auf sechs Wochen festgesetzt."
    },
    {
      "date": "2024-12-11",
      "id": "96053",
      "original_text": "Registerbekanntmachung nach dem Umwandlungsgesetz\nBayern Amtsgericht Aschaffenburg HRB 17014\neqe Deutschland GmbH – Großwallstadt",
      "type": "Registerbekanntmachung nach dem Umwandlungsgesetz",
      "state": "Bayern",
      "amtsgericht": "Amtsgericht Aschaffenburg",
      "registernummer": "HRB 17014",
      "registerart": "HRB",
      "company_name": "eqe Deutschland GmbH",
      "company_seat": "Großwallstadt",
      "details": "11.12.2024 (Bekanntmachungsdatum)\n\nBayern Amtsgericht Aschaffenburg HRB 17014\nRegisterbekanntmachung nach dem Umwandlungsgesetz 10.12.2024 (Eintragungsdatum)\n\neqe Deutschland GmbH\nGesellschaft mit beschränkter Haftung\nGroßwallstadt\n\nDen Gläubigern der an der Verschmelzung beteiligten Rechtsträger ist, wenn sie binnen sechs Monaten nach dem Tag, an dem die Eintragung der Verschmelzung in das Register des Sitzes desjenigen Rechtsträgers, dessen Gläubiger sie sind, nach § 19 Abs. 3 UmwG als bekannt gemacht gilt, ihren Anspruch nach Grund und Höhe schriftlich anmelden, Sicherheit zu leisten, soweit sie nicht Befriedigung verlangen können. Dieses Recht steht den Gläubigern jedoch nur zu, wenn sie glaubhaft machen, dass durch die Verschmelzung die Erfüllung ihrer Forderung gefährdet wird."
    },
    {
      "date": "2024-12-11",
      "id": "96054",
      "original_text": "Löschungsankündigung\nBayern Amtsgericht München HRB 207150\nHolzinger Beteiligungs GmbH – München",
      "type": "Löschungsankündigung",
      "state": "Bayern",
      "amtsgericht": "Amtsgericht München",
      "registernummer": "HRB 207150",
      "registerart": "HRB",
      "company_name": "Holzinger Beteiligungs GmbH",
      "company_seat": "München",
      "details": "11.12.2024 (Bekanntmachungsdatum)\n\nBayern Amtsgericht München HRB 207150\nLöschungsankündigung 10.12.2024 (Eintragungsdatum)\n\nHolzinger Beteiligungs GmbH\nGesellschaft mit beschränkter Haftung\nMünchen\n\nDas Registergericht beabsichtigt, die im Handelsregister eingetragene Gesellschaft wegen Vermögenslosigkeit von Amts wegen nach § 394 FamFG zu löschen. Die Frist zur Erhebung eines Widerspruchs ist auf drei Monate festgesetzt."
    },
    {
      "date": "2024-12-11",
      "id": "96055",
      "original_text": "Registerbekanntmachung nach dem Umwandlungsgesetz\nBaden-Württemberg Amtsgericht Ulm HRB 660674\nPersis GmbH – Heidenheim an der Brenz",
      "type": "Registerbekanntmachung nach dem Umwandlungsgesetz",
      "state": "Baden-Württemberg",
      "amtsgericht": "Amtsgericht Ulm",
      "registernummer": "HRB 660674",
      "registerart": "HRB",
      "company_name": "Persis GmbH",
      "company_seat": "Heidenheim an der Brenz",
      "details": "11.12.2024 (Bekanntmachungsdatum)\n\nBaden-Württemberg Amtsgericht Ulm HRB 660674\nRegisterbekanntmachung nach dem Umwandlungsgesetz 11.12.2024 (Eintragungsdatum)\n\nPersis GmbH\nGesellschaft mit beschränkter Haftung\nHeidenheim an der Brenz\n\nAls nicht eingetragen wird bekanntgemacht:\nDen Gläubigern der an der Verschmelzung beteiligten Rechtsträger ist, wenn sie binnen sechs Monaten nach dem Tag, an dem die Eintragung der Verschmelzung in das Register des Sitzes desjenigen Rechtsträgers, dessen Gläubiger sie sind, nach § 19 Abs. 3 UmwG als bekanntgemacht gilt, ihren Anspruch nach Grund und Höhe schriftlich anmelden, Sicherheit zu leisten, soweit sie nicht Befriedigung verlangen können. Dieses Recht steht den Gläubigern jedoch nur zu, wenn sie glaubhaft machen, dass durch die Verschmelzung die Erfüllung ihrer Forderung gefährdet wird."
    },
    {
      "date": "2024-12-11",
      "id": "96056",
      "original_text": "Löschungsankündigung\nHamburg Amtsgericht Hamburg HRA 100320\nMS \"Otto Schulte\" GmbH & Co. KG – Hamburg",
      "type": "Löschungsankündigung",
      "state": "Hamburg",
      "amtsgericht": "Amtsgericht Hamburg",
      "registernummer": "HRA 100320",
      "registerart": "HRA",
      "company_name": "MS \"Otto Schulte\" GmbH & Co. KG",
      "company_seat": "Hamburg",
      "details": "11.12.2024 (Bekanntmachungsdatum)\n\nHamburg Amtsgericht Hamburg HRA 100320\nLöschungsankündigung\n\nMS \"Otto Schulte\" GmbH & Co. KG\nKommanditgesellschaft\nHamburg\n\nDas Registergericht beabsichtigt, die im Handelsregister eingetragene Gesellschaft von Amts wegen nach § 394 FamFG zu löschen. Die Frist zur Erhebung eines Widerspruchs gegen die beabsichtigte Löschung wird auf 3 Monate festgesetzt."
    },
    {
      "date": "2024-12-11",
      "id": "96057",
      "original_text": "Registerbekanntmachung nach dem Umwandlungsgesetz\nBrandenburg Amtsgericht Potsdam HRB 26490\nBellevue Property GmbH – Zossen",
      "type": "Registerbekanntmachung nach dem Umwandlungsgesetz",
      "state": "Brandenburg",
      "amtsgericht": "Amtsgericht Potsdam",
      "registernummer": "HRB 26490",
      "registerart": "HRB",
      "company_name": "Bellevue Property GmbH",
      "company_seat": "Zossen",
      "details": "11.12.2024 (Bekanntmachungsdatum)\n\nBrandenburg Amtsgericht Potsdam HRB 26490\nRegisterbekanntmachung nach dem Umwandlungsgesetz 10.12.2024 (Eintragungsdatum)\n\nBellevue Property GmbH\nGesellschaft mit beschränkter Haftung\nZossen\n\nZu Eintragungsnummer 3 vom 10.12.2024 wird als nicht eingetragen veröffentlicht: Den Gläubigern der an der Verschmelzung beteiligten Rechtsträger ist, wenn sie binnen sechs Monaten nach dem Tag, an dem die Eintragung der Verschmelzung in das Register des Sitzes desjenigen Rechtsträgers, dessen Gläubiger sie sind, als bekannt gemacht gilt, ihren Anspruch nach Grund und Höhe schriftlich anmelden, Sicherheit zu leisten, soweit sie nicht Befriedigung verlangen können. Dieses Recht steht den Gläubigern jedoch nur zu, wenn sie glaubhaft machen, dass durch die Verschmelzung die Erfüllung ihrer Forderung gefährdet wird."
    },
    {
      "date": "2024-12-11",
      "id": "96058",
      "original_text": "Einreichung neuer Dokumente\nBaden-Württemberg Amtsgericht Freiburg HRB 280396\nStadtwerke Waldkirch GmbH – Waldkirch",
      "type": "Einreichung neuer Dokumente",
      "state": "Baden-Württemberg",
      "amtsgericht": "Amtsgericht Freiburg",
      "registernummer": "HRB 280396",
      "registerart": "HRB",
      "company_name": "Stadtwerke Waldkirch GmbH",
      "company_seat": "Waldkirch",
      "details": "11.12.2024 (Bekanntmachungsdatum)\n\nBaden-Württemberg Amtsgericht Freiburg HRB 280396\nEinreichung neuer Dokumente\n\nStadtwerke Waldkirch GmbH\nGesellschaft mit beschränkter Haftung\nWaldkirch\n\nAls nicht eingetragen wird bekanntgemacht:\nDie Gesellschaft hat am 10.12.2024 die Liste über die Zusammensetzung des Aufsichtsrats zum Handelsregister eingereicht."
    },
    {
      "date": "2024-12-11",
      "id": "96059",
      "original_text": "Löschungsankündigung\nBerlin Amtsgericht Berlin (Charlottenburg) HRB 124970\nDELUXE BACK BERLIN GmbH – Berlin",
      "type": "Löschungsankündigung",
      "state": "Berlin",
      "amtsgericht": "Amtsgericht Berlin (Charlottenburg)",
      "registernummer": "HRB 124970",
      "registerart": "HRB",
      "company_name": "DELUXE BACK BERLIN GmbH",
      "company_seat": "Berlin",
      "details": "11.12.2024 (Bekanntmachungsdatum)\n\nBerlin Amtsgericht Berlin (Charlottenburg) HRB 124970\nLöschungsankündigung\n\nDELUXE BACK BERLIN GmbH\nGesellschaft mit beschränkter Haftung\nBerlin\n\nBei der nachstehenden Gesellschaft wird das Amtslöschungsverfahren gemäß § 394 FamFG eingeleitet. Widerspruchsfrist 6 Wochen"
    },
    {
      "date": "2024-12-11",
      "id": "96060",
      "original_text": "Löschungsankündigung\nBerlin Amtsgericht Berlin (Charlottenburg) HRB 174280\nSOROS Dienstleistung GmbH – Berlin",
      "type": "Löschungsankündigung",
      "state": "Berlin",
      "amtsgericht": "Amtsgericht Berlin (Charlottenburg)",
      "registernummer": "HRB 174280",
      "registerart": "HRB",
      "company_name": "SOROS Dienstleistung GmbH",
      "company_seat": "Berlin",
      "details": "11.12.2024 (Bekanntmachungsdatum)\n\nBerlin Amtsgericht Berlin (Charlottenburg) HRB 174280\nLöschungsankündigung\n\nSOROS Dienstleistung GmbH\nGesellschaft mit beschränkter Haftung\nBerlin\n\nBei der nachstehenden Gesellschaft wird das Amtslöschungsverfahren gemäß § 394 FamFG eingeleitet. Widerspruchsfrist\n6 Wochen"
    },
    {
      "date": "2024-12-11",
      "id": "96061",
      "original_text": "Löschungsankündigung\nBerlin Amtsgericht Berlin (Charlottenburg) HRB 203278\nNicolaus Perfekt UG (haftungsbeschränkt) – Berlin",
      "type": "Löschungsankündigung",
      "state": "Berlin",
      "amtsgericht": "Amtsgericht Berlin (Charlottenburg)",
      "registernummer": "HRB 203278",
      "registerart": "HRB",
      "company_name": "Nicolaus Perfekt UG (haftungsbeschränkt)",
      "company_seat": "Berlin",
      "details": "11.12.2024 (Bekanntmachungsdatum)\n\nBerlin Amtsgericht Berlin (Charlottenburg) HRB 203278\nLöschungsankündigung\n\nNicolaus Perfekt UG (haftungsbeschränkt)\nGesellschaft mit beschränkter Haftung\nBerlin\n\nBei der nachstehenden Gesellschaft wird das Amtslöschungsverfahren gemäß § 394 FamFG eingeleitet. Widerspruchsfrist\n6 Wochen"
    },
    {
      "date": "2024-12-11",
      "id": "96062",
      "original_text": "Einreichung neuer Dokumente\nBaden-Württemberg Amtsgericht Freiburg HRB 704638\nad notam AG – Hilzingen",
      "type": "Einreichung neuer Dokumente",
      "state": "Baden-Württemberg",
      "amtsgericht": "Amtsgericht Freiburg",
      "registernummer": "HRB 704638",
      "registerart": "HRB",
      "company_name": "ad notam AG",
      "company_seat": "Hilzingen",
      "details": "11.12.2024 (Bekanntmachungsdatum)\n\nBaden-Württemberg Amtsgericht Freiburg HRB 704638\nEinreichung neuer Dokumente 11.12.2024 (Eintragungsdatum)\n\nad notam AG\nAktiengesellschaft\nHilzingen\n\nDie Gesellschaft hat am 10.12.2024 die Liste über die Zusammensetzung des Aufsichtsrats zum Handelsregister eingereicht."
    },
    {
      "date": "2024-12-11",
      "id": "96063",
      "original_text": "Registerbekanntmachung nach dem Umwandlungsgesetz\nSchleswig-Holstein Amtsgericht Kiel HRA 12297\nSOMIKON Zukunftsenergie 11 GmbH & Co. KG – Schönkirchen",
      "type": "Registerbekanntmachung nach dem Umwandlungsgesetz",
      "state": "Schleswig-Holstein",
      "amtsgericht": "Amtsgericht Kiel",
      "registernummer": "HRA 12297",
      "registerart": "HRA",
      "company_name": "SOMIKON Zukunftsenergie 11 GmbH & Co. KG",
      "company_seat": "Schönkirchen",
      "details": "11.12.2024 (Bekanntmachungsdatum)\n\nSchleswig-Holstein Amtsgericht Kiel HRA 12297\nRegisterbekanntmachung nach dem Umwandlungsgesetz 10.12.2024 (Eintragungsdatum)\n\nSOMIKON Zukunftsenergie 11 GmbH & Co. KG\nKommanditgesellschaft\nSchönkirchen\n\nZu Eintragungsnummer 2 vom 10.12.2024 wird als nicht eingetragen veröffentlicht: Den Gläubigern der an der Spaltung beteiligten Rechtsträger ist, wenn sie binnen sechs Monaten nach dem Tag, an dem die Eintragung der Spaltung in das Register des Sitzes desjenigen Rechtsträgers, dessen Gläubiger sie sind,  bekannt gemacht worden ist, ihren Anspruch nach Grund und Höhe schriftlich anmelden, Sicherheit zu leisten, soweit sie nicht Befriedigung verlangen können. Dieses Recht steht den Gläubigern jedoch nur zu, wenn sie glaubhaft machen, dass durch die Spaltung die Erfüllung ihrer Forderung gefährdet wird."
    },
    {
      "date": "2024-12-11",
      "id": "96064",
      "original_text": "Einreichung neuer Dokumente\nSaarland Amtsgericht Saarbrücken HRB 4032\nSaarbrücker Zeitung Medienhaus GmbH – Saarbrücken",
      "type": "Einreichung neuer Dokumente",
      "state": "Saarland",
      "amtsgericht": "Amtsgericht Saarbrücken",
      "registernummer": "HRB 4032",
      "registerart": "HRB",
      "company_name": "Saarbrücker Zeitung Medienhaus GmbH",
      "company_seat": "Saarbrücken",
      "details": "11.12.2024 (Bekanntmachungsdatum)\n\nSaarland Amtsgericht Saarbrücken HRB 4032\nEinreichung neuer Dokumente\n\nSaarbrücker Zeitung Medienhaus GmbH\nGesellschaft mit beschränkter Haftung\nSaarbrücken\n\nDie Geschäftsführung der Gesellschaft hat eine Liste der Mitglieder des Aufsichtsrats zum Handelsregister eingereicht (§ 52 Abs. 3 Satz 2 GmbHG)."
    },
    {
      "date": "2024-12-11",
      "id": "96065",
      "original_text": "Einreichung neuer Dokumente\nHamburg Amtsgericht Hamburg HRB 8991\nAugust Prien Verwaltung GmbH – Hamburg",
      "type": "Einreichung neuer Dokumente",
      "state": "Hamburg",
      "amtsgericht": "Amtsgericht Hamburg",
      "registernummer": "HRB 8991",
      "registerart": "HRB",
      "company_name": "August Prien Verwaltung GmbH",
      "company_seat": "Hamburg",
      "details": "11.12.2024 (Bekanntmachungsdatum)\n\nHamburg Amtsgericht Hamburg HRB 8991\nEinreichung neuer Dokumente 09.12.2024 (Eintragungsdatum)\n\nAugust Prien Verwaltung GmbH\nGesellschaft mit beschränkter Haftung\nHamburg\n\nAls nicht eingetragen wird bekannt gemacht: Liste des Aufsichtsrats wurde eingereicht."
    },
    {
      "date": "2024-12-11",
      "id": "96066",
      "original_text": "Einreichung neuer Dokumente\nSaarland Amtsgericht Saarbrücken HRB 420\nHydac Fluidtechnik GmbH – Sulzbach",
      "type": "Einreichung neuer Dokumente",
      "state": "Saarland",
      "amtsgericht": "Amtsgericht Saarbrücken",
      "registernummer": "HRB 420",
      "registerart": "HRB",
      "company_name": "Hydac Fluidtechnik GmbH",
      "company_seat": "Sulzbach",
      "details": "11.12.2024 (Bekanntmachungsdatum)\n\nSaarland Amtsgericht Saarbrücken HRB 420\nEinreichung neuer Dokumente\n\nHydac Fluidtechnik GmbH\nGesellschaft mit beschränkter Haftung\nSulzbach\n\nDie Geschäftsführung der Gesellschaft hat eine Liste der Mitglieder des Beirats zum Handelsregister eingereicht (§ 52 Abs. 3 Satz 2 GmbHG)."
    },
    {
      "date": "2024-12-11",
      "id": "96067",
      "original_text": "Löschungsankündigung\nBerlin Amtsgericht Berlin (Charlottenburg) HRB 194556\nThe Bridge Berlin GmbH – Berlin",
      "type": "Löschungsankündigung",
      "state": "Berlin",
      "amtsgericht": "Amtsgericht Berlin (Charlottenburg)",
      "registernummer": "HRB 194556",
      "registerart": "HRB",
      "company_name": "The Bridge Berlin GmbH",
      "company_seat": "Berlin",
      "details": "11.12.2024 (Bekanntmachungsdatum)\n\nBerlin Amtsgericht Berlin (Charlottenburg) HRB 194556\nLöschungsankündigung\n\nThe Bridge Berlin GmbH\nGesellschaft mit beschränkter Haftung\nBerlin\n\nBei der nachstehenden Gesellschaft wird das Amtslöschungsverfahren gemäß § 394 FamFG eingeleitet. Widerspruchsfrist 6 Wochen"
    },
    {
      "date": "2024-12-11",
      "id": "96068",
      "original_text": "Löschungsankündigung\nSchleswig-Holstein Amtsgericht Lübeck HRB 15427\nPOLpress GmbH – Bad Oldesloe",
      "type": "Löschungsankündigung",
      "state": "Schleswig-Holstein",
      "amtsgericht": "Amtsgericht Lübeck",
      "registernummer": "HRB 15427",
      "registerart": "HRB",
      "company_name": "POLpress GmbH",
      "company_seat": "Bad Oldesloe",
      "details": "11.12.2024 (Bekanntmachungsdatum)\n\nSchleswig-Holstein Amtsgericht Lübeck HRB 15427\nLöschungsankündigung\n\nPOLpress GmbH\nGesellschaft mit beschränkter Haftung\nBad Oldesloe\n\nEs ist die Löschung der nachstehenden Gesellschaft wegen Vermögenslosigkeit gemäß § 394 FamFG beabsichtigt.\nWiderspruchsfrist: 1 Monat."
    },
    {
      "date": "2024-12-11",
      "id": "96069",
      "original_text": "Registerbekanntmachung nach dem Umwandlungsgesetz\nBaden-Württemberg Amtsgericht Mannheim HRB 749865\nGEROTO Verwaltung GmbH – Sinsheim",
      "type": "Registerbekanntmachung nach dem Umwandlungsgesetz",
      "state": "Baden-Württemberg",
      "amtsgericht": "Amtsgericht Mannheim",
      "registernummer": "HRB 749865",
      "registerart": "HRB",
      "company_name": "GEROTO Verwaltung GmbH",
      "company_seat": "Sinsheim",
      "details": "11.12.2024 (Bekanntmachungsdatum)\n\nBaden-Württemberg Amtsgericht Mannheim HRB 749865\nRegisterbekanntmachung nach dem Umwandlungsgesetz 11.12.2024 (Eintragungsdatum)\n\nGEROTO Verwaltung GmbH\nGesellschaft mit beschränkter Haftung\nSinsheim\n\nAls nicht eingetragen wird bekanntgemacht:\nDen Gläubigern der an der Verschmelzung beteiligten Rechtsträger ist, wenn sie binnen sechs Monaten nach dem Tag, an dem die Eintragung der Verschmelzung in das Register des Sitzes desjenigen Rechtsträgers, dessen Gläubiger sie sind, nach § 19 Abs. 3 UmwG als bekanntgemacht gilt, ihren Anspruch nach Grund und Höhe schriftlich anmelden, Sicherheit zu leisten, soweit sie nicht Befriedigung verlangen können. Dieses Recht steht den Gläubigern jedoch nur zu, wenn sie glaubhaft machen, dass durch die Verschmelzung die Erfüllung ihrer Forderung gefährdet wird."
    },
    {
      "date": "2024-12-11",
      "id": "96070",
      "original_text": "Löschungsankündigung\nSchleswig-Holstein Amtsgericht Lübeck HRB 6570\nHolzideen Tischlerei GmbH – Bargteheide",
      "type": "Löschungsankündigung",
      "state": "Schleswig-Holstein",
      "amtsgericht": "Amtsgericht Lübeck",
      "registernummer": "HRB 6570",
      "registerart": "HRB",
      "company_name": "Holzideen Tischlerei GmbH",
      "company_seat": "Bargteheide",
      "details": "11.12.2024 (Bekanntmachungsdatum)\n\nSchleswig-Holstein Amtsgericht Lübeck HRB 6570\nLöschungsankündigung\n\nHolzideen Tischlerei GmbH\nGesellschaft mit beschränkter Haftung\nBargteheide\n\nEs ist die Löschung der nachstehenden Gesellschaft wegen Vermögenslosigkeit gemäß § 394 FamFG beabsichtigt.\nWiderspruchsfrist: 1 Monat."
    },
    {
      "date": "2024-12-11",
      "id": "96071",
      "original_text": "Einreichung neuer Dokumente\nSaarland Amtsgericht Saarbrücken HRB 3540\nGesellschaft für Arbeit und Qualifizierung im Saarpfalz-Kreis mbH – Homburg",
      "type": "Einreichung neuer Dokumente",
      "state": "Saarland",
      "amtsgericht": "Amtsgericht Saarbrücken",
      "registernummer": "HRB 3540",
      "registerart": "HRB",
      "company_name": "Gesellschaft für Arbeit und Qualifizierung im Saarpfalz-Kreis mbH",
      "company_seat": "Homburg",
      "details": "11.12.2024 (Bekanntmachungsdatum)\n\nSaarland Amtsgericht Saarbrücken HRB 3540\nEinreichung neuer Dokumente\n\nGesellschaft für Arbeit und Qualifizierung im Saarpfalz-Kreis mbH\nGesellschaft mit beschränkter Haftung\nHomburg\n\nDie Geschäftsführung der Gesellschaft hat eine Liste der Mitglieder des Aufsichtsrats zum Handelsregister eingereicht (§ 52 Abs. 3 Satz 2 GmbHG)."
    },
    {
      "date": "2024-12-11",
      "id": "96072",
      "original_text": "Registerbekanntmachung nach dem Umwandlungsgesetz\nSachsen-Anhalt Amtsgericht Stendal HRB 34782\nhabit.art GmbH – Halle (Saale)",
      "type": "Registerbekanntmachung nach dem Umwandlungsgesetz",
      "state": "Sachsen-Anhalt",
      "amtsgericht": "Amtsgericht Stendal",
      "registernummer": "HRB 34782",
      "registerart": "HRB",
      "company_name": "habit.art GmbH",
      "company_seat": "Halle (Saale)",
      "details": "11.12.2024 (Bekanntmachungsdatum)\n\nSachsen-Anhalt Amtsgericht Stendal HRB 34782\nRegisterbekanntmachung nach dem Umwandlungsgesetz 11.12.2024 (Eintragungsdatum)\n\nhabit.art GmbH\nGesellschaft mit beschränkter Haftung\nHalle (Saale)\n\nNicht eingetragen:\nDen Gläubigern der an der Ausgliederung beteiligten Rechtsträger, ist wenn sie binnen sechs Monaten nach dem Tag, an dem die Eintragung der Ausgliederung nach §§125, 19 Abs. 3 UmwG als bekanntgemacht gilt, ihren Anspruch nach Grund und Höhe schriftlich anmelden, Sicherheit zu leisten, soweit sie nicht Befriedigung verlangen können. Diese Recht steht ihnen jedoch nur zu, wenn sie glaubhaft machen, dass durch die Ausgliederung die Erfüllung ihrer Forderung gefährdet wird."
    },
    {
      "date": "2024-12-11",
      "id": "96073",
      "original_text": "Registerbekanntmachung nach dem Umwandlungsgesetz\nSachsen-Anhalt Amtsgericht Stendal HRA 7981\nGuido Mundt e.K – Halle (Saale)",
      "type": "Registerbekanntmachung nach dem Umwandlungsgesetz",
      "state": "Sachsen-Anhalt",
      "amtsgericht": "Amtsgericht Stendal",
      "registernummer": "HRA 7981",
      "registerart": "HRA",
      "company_name": "Guido Mundt e.K",
      "company_seat": "Halle (Saale)",
      "details": "11.12.2024 (Bekanntmachungsdatum)\n\nSachsen-Anhalt Amtsgericht Stendal HRA 7981\nRegisterbekanntmachung nach dem Umwandlungsgesetz 11.12.2024 (Eintragungsdatum)\n\nGuido Mundt e.K\nEinzelkaufmann / Einzelkauffrau\nHalle (Saale)\n\nNicht eingetragen:\nDen Gläubigern der an der Ausgliederung beteiligten Rechtsträger, ist wenn sie binnen sechs Monaten nach dem Tag, an dem die Eintragung der Ausgliederung nach §§125, 19 Abs. 3 UmwG als bekanntgemacht gilt, ihren Anspruch nach Grund und Höhe schriftlich anmelden, Sicherheit zu leisten, soweit sie nicht Befriedigung verlangen können. Diese Recht steht ihnen jedoch nur zu, wenn sie glaubhaft machen, dass durch die Ausgliederung die Erfüllung ihrer Forderung gefährdet wird."
    },
    {
      "date": "2024-12-11",
      "id": "96074",
      "original_text": "Registerbekanntmachung nach dem Umwandlungsgesetz\nBaden-Württemberg Amtsgericht Mannheim HRB 340915\nOtto Zimmermann, Maschinen- und Apparatebaugesellschaft mit beschränkter Haftung – Sinsheim",
      "type": "Registerbekanntmachung nach dem Umwandlungsgesetz",
      "state": "Baden-Württemberg",
      "amtsgericht": "Amtsgericht Mannheim",
      "registernummer": "HRB 340915",
      "registerart": "HRB",
      "company_name": "Otto Zimmermann, Maschinen- und Apparatebaugesellschaft mit beschränkter Haftung",
      "company_seat": "Sinsheim",
      "details": "11.12.2024 (Bekanntmachungsdatum)\n\nBaden-Württemberg Amtsgericht Mannheim HRB 340915\nRegisterbekanntmachung nach dem Umwandlungsgesetz 11.12.2024 (Eintragungsdatum)\n\nOtto Zimmermann, Maschinen- und Apparatebaugesellschaft mit beschränkter Haftung\nGesellschaft mit beschränkter Haftung\nSinsheim\n\nAls nicht eingetragen wird bekanntgemacht:\nDen Gläubigern der an der Verschmelzung beteiligten Rechtsträger ist, wenn sie binnen sechs Monaten nach dem Tag, an dem die Eintragung der Verschmelzung in das Register des Sitzes desjenigen Rechtsträgers, dessen Gläubiger sie sind, nach § 19 Abs. 3 UmwG als bekanntgemacht gilt, ihren Anspruch nach Grund und Höhe schriftlich anmelden, Sicherheit zu leisten, soweit sie nicht Befriedigung verlangen können. Dieses Recht steht den Gläubigern jedoch nur zu, wenn sie glaubhaft machen, dass durch die Verschmelzung die Erfüllung ihrer Forderung gefährdet wird."
    },
    {
      "date": "2024-12-11",
      "id": "96075",
      "original_text": "Sonstige Registerbekanntmachung\nSchleswig-Holstein Amtsgericht Kiel HRB 16 EC\nSiemsen Transportbeton Gesellschaft mit beschränkter Haftung – Eckernförde",
      "type": "Sonstige Registerbekanntmachung",
      "state": "Schleswig-Holstein",
      "amtsgericht": "Amtsgericht Kiel",
      "registernummer": "HRB 16 EC",
      "registerart": "HRB",
      "company_name": "Siemsen Transportbeton Gesellschaft mit beschränkter Haftung",
      "company_seat": "Eckernförde",
      "details": "11.12.2024 (Bekanntmachungsdatum)\n\nSchleswig-Holstein Amtsgericht Kiel HRB 16 EC\nSonstige Registerbekanntmachung\n\nSiemsen Transportbeton Gesellschaft mit beschränkter Haftung\nGesellschaft mit beschränkter Haftung\nEckernförde\n\nAls nicht eingetragen wird veröffentlicht:\nDen Gläubigern der Gesellschaft, deren Forderungen begründet worden sind, bevor die Eintragung der Beendigung des Vertrages in das Handelsregister nach § 10 HGB bekannt gemacht worden ist, ist vom anderen Vertragspartner Sicherheit zu leisten, wenn sie sich binnen sechs Monaten nach Bekanntmachung der Eintragung zu diesem Zweck bei ihm melden."
    },
    {
      "date": "2024-12-11",
      "id": "96076",
      "original_text": "Registerbekanntmachung nach dem Umwandlungsgesetz\nSachsen-Anhalt Amtsgericht Stendal HRB 10637\nELSTA-Mosdorfer Deutschland GmbH – Dessau-Roßlau",
      "type": "Registerbekanntmachung nach dem Umwandlungsgesetz",
      "state": "Sachsen-Anhalt",
      "amtsgericht": "Amtsgericht Stendal",
      "registernummer": "HRB 10637",
      "registerart": "HRB",
      "company_name": "ELSTA-Mosdorfer Deutschland GmbH",
      "company_seat": "Dessau-Roßlau",
      "details": "11.12.2024 (Bekanntmachungsdatum)\n\nSachsen-Anhalt Amtsgericht Stendal HRB 10637\nRegisterbekanntmachung nach dem Umwandlungsgesetz 11.12.2024 (Eintragungsdatum)\n\nELSTA-Mosdorfer Deutschland GmbH\nGesellschaft mit beschränkter Haftung\nDessau-Roßlau\n\nDie ELSTA-Mosdorfer Deutschland GmbH mit dem Sitz in Lich (Amtsgericht Gießen HRB 8332)ist auf Grund des Verschmelzungsvertrages vom 27.11.2024 und der Beschlüsse der Gesellschafterversammlungen vom selben Tag mit der Gesellschaft verschmolzen. Nicht eingetragen:Den Gläubigern der an der Verschmelzung beteiligten Rechtsträger ist, wenn sie binnen sechs Monaten nach dem Tag, an dem die Eintragung der Verschmelzung nach § 19 Abs. 3 UmwG als bekanntgemacht gilt, ihren Anspruch nach Grund und Höhe schriftlich anmelden, Sicherheit zu leisten, soweit sie nicht Befriedigung verlangen können. Dieses Recht steht ihnen jedoch nur zu, wenn sie glaubhaft machen, dass durch die Verschmelzung die Erfüllung ihrer Forderung gefährdet wird."
    },
    {
      "date": "2024-12-11",
      "id": "96077",
      "original_text": "Registerbekanntmachung nach dem Umwandlungsgesetz\nBerlin Amtsgericht Berlin (Charlottenburg) HRB 110132\nbks production gmbh – Berlin",
      "type": "Registerbekanntmachung nach dem Umwandlungsgesetz",
      "state": "Berlin",
      "amtsgericht": "Amtsgericht Berlin (Charlottenburg)",
      "registernummer": "HRB 110132",
      "registerart": "HRB",
      "company_name": "bks production gmbh",
      "company_seat": "Berlin",
      "details": "11.12.2024 (Bekanntmachungsdatum)\n\nBerlin Amtsgericht Berlin (Charlottenburg) HRB 110132\nRegisterbekanntmachung nach dem Umwandlungsgesetz 10.12.2024 (Eintragungsdatum)\n\nbks production gmbh\nGesellschaft mit beschränkter Haftung\nBerlin\n\nZu Eintragungsnummer 6 vom 10.12.2024 wird als nicht eingetragen veröffentlicht: Den Gläubigern der an der Verschmelzung beteiligten Rechtsträger ist, wenn sie binnen sechs Monaten nach dem Tag, an dem die Eintragung der Verschmelzung in das Register des Sitzes desjenigen Rechtsträgers, dessen Gläubiger sie sind, als bekannt gemacht gilt, ihren Anspruch nach Grund und Höhe schriftlich anmelden, Sicherheit zu leisten, soweit sie nicht Befriedigung verlangen können. Dieses Recht steht den Gläubigern jedoch nur zu, wenn sie glaubhaft machen, dass durch die Verschmelzung die Erfüllung ihrer Forderung gefährdet wird. Das Recht, Sicherheitsleistung zu verlangen, steht Gläubigern nicht zu, die im Falle der Insolvenz ein Recht auf vorzugsweise Befriedigung aus einer Deckungsmasse haben, die nach gesetzlicher Vorschrift zu ihrem Schutz errichtet und staatlich überwacht ist."
    },
    {
      "date": "2024-12-11",
      "id": "96078",
      "original_text": "Sonstige Registerbekanntmachung\nBaden-Württemberg Amtsgericht Mannheim HRB 703046\nHeidelberger Straßen- und Bergbahn GmbH – Heidelberg",
      "type": "Sonstige Registerbekanntmachung",
      "state": "Baden-Württemberg",
      "amtsgericht": "Amtsgericht Mannheim",
      "registernummer": "HRB 703046",
      "registerart": "HRB",
      "company_name": "Heidelberger Straßen- und Bergbahn GmbH",
      "company_seat": "Heidelberg",
      "details": "11.12.2024 (Bekanntmachungsdatum)\n\nBaden-Württemberg Amtsgericht Mannheim HRB 703046\nSonstige Registerbekanntmachung\n\nHeidelberger Straßen- und Bergbahn GmbH\nGesellschaft mit beschränkter Haftung\nHeidelberg\n\nDie Gesellschaft hat am 09.12.2024 die Liste über die Zusammensetzung des Aufsichtsrats zum Handelsregister eingereicht."
    },
    {
      "date": "2024-12-11",
      "id": "96079",
      "original_text": "Registerbekanntmachung nach dem Umwandlungsgesetz\nSachsen-Anhalt Amtsgericht Stendal HRA 8044\nFrank Brauer Systembetreuer e.K. – Lutherstadt Wittenberg",
      "type": "Registerbekanntmachung nach dem Umwandlungsgesetz",
      "state": "Sachsen-Anhalt",
      "amtsgericht": "Amtsgericht Stendal",
      "registernummer": "HRA 8044",
      "registerart": "HRA",
      "company_name": "Frank Brauer Systembetreuer e.K.",
      "company_seat": "Lutherstadt Wittenberg",
      "details": "11.12.2024 (Bekanntmachungsdatum)\n\nSachsen-Anhalt Amtsgericht Stendal HRA 8044\nRegisterbekanntmachung nach dem Umwandlungsgesetz 11.12.2024 (Eintragungsdatum)\n\nFrank Brauer Systembetreuer e.K.\nEinzelkaufmann / Einzelkauffrau\nLutherstadt Wittenberg\n\nNicht eingetragen:\nDen Gläubigern der an der Ausgliederung beteiligten Rechtsträger, ist wenn sie binnen sechs Monaten nach dem Tag, an dem die Eintragung der Ausgliederung nach §§125, 19 Abs. 3 UmwG als bekanntgemacht gilt, ihren Anspruch nach Grund und Höhe schriftlich anmelden, Sicherheit zu leisten, soweit sie nicht Befriedigung verlangen können. Diese Recht steht ihnen jedoch nur zu, wenn sie glaubhaft machen, dass durch die Ausgliederung die Erfüllung ihrer Forderung gefährdet wird."
    },
    {
      "date": "2024-12-11",
      "id": "96080",
      "original_text": "Löschungsankündigung\nBerlin Amtsgericht Berlin (Charlottenburg) HRB 162564\nSemilton IT Solutions UG (haftungsbeschränkt) – Berlin",
      "type": "Löschungsankündigung",
      "state": "Berlin",
      "amtsgericht": "Amtsgericht Berlin (Charlottenburg)",
      "registernummer": "HRB 162564",
      "registerart": "HRB",
      "company_name": "Semilton IT Solutions UG (haftungsbeschränkt)",
      "company_seat": "Berlin",
      "details": "11.12.2024 (Bekanntmachungsdatum)\n\nBerlin Amtsgericht Berlin (Charlottenburg) HRB 162564\nLöschungsankündigung\n\nSemilton IT Solutions UG (haftungsbeschränkt)\nGesellschaft mit beschränkter Haftung\nBerlin\n\nBei der nachstehenden Gesellschaft wird das Amtslöschungsverfahren gemäß § 394 FamFG eingeleitet. Widerspruchsfrist 6 Wochen"
    },
    {
      "date": "2024-12-11",
      "id": "96081",
      "original_text": "Registerbekanntmachung nach dem Umwandlungsgesetz\nBrandenburg Amtsgericht Cottbus HRB 16609\nIREL Berlin GmbH – Schönefeld",
      "type": "Registerbekanntmachung nach dem Umwandlungsgesetz",
      "state": "Brandenburg",
      "amtsgericht": "Amtsgericht Cottbus",
      "registernummer": "HRB 16609",
      "registerart": "HRB",
      "company_name": "IREL Berlin GmbH",
      "company_seat": "Schönefeld",
      "details": "11.12.2024 (Bekanntmachungsdatum)\n\nBrandenburg Amtsgericht Cottbus HRB 16609\nRegisterbekanntmachung nach dem Umwandlungsgesetz 09.12.2024 (Eintragungsdatum)\n\nIREL Berlin GmbH\nGesellschaft mit beschränkter Haftung\nSchönefeld\n\nDen Gläubigern der an der Verschmelzung beteiligten Rechtsträger ist, wenn sie binnen sechs Monaten nach dem Tag, an dem die Eintragung der Verschmelzung in das Register des Sitzes desjenigen Rechtsträgers, dessen Gläubiger sie sind, als bekannt gemacht gilt, ihren Anspruch nach Grund und Höhe schriftlich anmelden, Sicherheit zu leisten, soweit sie nicht Befriedigung verlangen können. Dieses Recht steht den Gläubigern jedoch nur zu, wenn sie glaubhaft machen, dass durch die Verschmelzung die Erfüllung ihrer Forderung gefährdet wird"
    },
    {
      "date": "2024-12-11",
      "id": "96082",
      "original_text": "Registerbekanntmachung nach dem Umwandlungsgesetz\nSaarland Amtsgericht Saarbrücken HRB 64301\nL + S Transport und Baumaschinenvermietungs GmbH – Losheim am See",
      "type": "Registerbekanntmachung nach dem Umwandlungsgesetz",
      "state": "Saarland",
      "amtsgericht": "Amtsgericht Saarbrücken",
      "registernummer": "HRB 64301",
      "registerart": "HRB",
      "company_name": "L + S Transport und Baumaschinenvermietungs GmbH",
      "company_seat": "Losheim am See",
      "details": "11.12.2024 (Bekanntmachungsdatum)\n\nSaarland Amtsgericht Saarbrücken HRB 64301\nRegisterbekanntmachung nach dem Umwandlungsgesetz 11.12.2024 (Eintragungsdatum)\n\nL + S Transport und Baumaschinenvermietungs GmbH\nGesellschaft mit beschränkter Haftung\nLosheim am See\n\nAls nicht eingetragen wird bekannt gemacht: Den Gläubigern der an der Verschmelzung beteiligten Gesellschaften ist, wenn sie binnen sechs Monaten nach dem Tag, an dem die Eintragung der Verschmelzung in das Register des Sitzes desjenigen Rechtsträgers, dessen Gläubiger sie sind, nach § 19 Absatz 3 UmwG bekannt gemacht worden ist, ihren Anspruch nach Grund und Höhe schriftlich anmelden, Sicherheit zu leisten, soweit sie nicht Befriedigung verlangen können. Dieses Recht steht den Gläubigern jedoch nur zu, wenn sie glaubhaft machen, dass durch die Verschmelzung die Erfüllung ihrer Forderung gefährdet wird."
    },
    {
      "date": "2024-12-11",
      "id": "96083",
      "original_text": "Registerbekanntmachung nach dem Umwandlungsgesetz\nBerlin Amtsgericht Berlin (Charlottenburg) HRB 27085\nUniversal Holding GmbH – Hofbieber",
      "type": "Registerbekanntmachung nach dem Umwandlungsgesetz",
      "state": "Berlin",
      "amtsgericht": "Amtsgericht Berlin (Charlottenburg)",
      "registernummer": "HRB 27085",
      "registerart": "HRB",
      "company_name": "Universal Holding GmbH",
      "company_seat": "Hofbieber",
      "details": "11.12.2024 (Bekanntmachungsdatum)\n\nBerlin Amtsgericht Berlin (Charlottenburg) HRB 27085\nRegisterbekanntmachung nach dem Umwandlungsgesetz 09.12.2013 (Eintragungsdatum)\n\nUniversal Holding GmbH\nGesellschaft mit beschränkter Haftung\nHofbieber\n\nZu Eintragungsnummer 5 vom 09.12.2013 wird als nicht eingetragen veröffentlicht:Den Gläubigern ist, wenn sie binnen sechs Monaten nach dem Tag, an dem die Eintragung der Umwandlung als bekannt gemacht gilt, ihren Anspruch nach Grund und Höhe schriftlich anmelden, Sicherheit zu leisten, soweit sie nicht Befriedigung verlangen können. Dieses Recht steht den Gläubigern jedoch nur zu, wenn sie glaubhaft machen, dass durch die Umwandlung die Erfüllung ihrer Forderung gefährdet wird. Das Recht, Sicherheitsleistung zu verlangen, steht Gläubigern nicht zu, die im Falle der Insolvenz ein Recht auf vorzugsweise Befriedigung aus einer Deckungsmasse haben, die nach gesetzlicher Vorschrift zu ihrem Schutz errichtet und staatlich überwacht ist."
    },
    {
      "date": "2024-12-11",
      "id": "96084",
      "original_text": "Einreichung neuer Dokumente\nBerlin Amtsgericht Berlin (Charlottenburg) HRB 5011\nHilfswerk-Siedlung Gesellschaft mit beschränkter Haftung Evangelisches Wohnungsunternehmen in Berlin – Berlin",
      "type": "Einreichung neuer Dokumente",
      "state": "Berlin",
      "amtsgericht": "Amtsgericht Berlin (Charlottenburg)",
      "registernummer": "HRB 5011",
      "registerart": "HRB",
      "company_name": "Hilfswerk-Siedlung Gesellschaft mit beschränkter Haftung Evangelisches Wohnungsunternehmen in Berlin",
      "company_seat": "Berlin",
      "details": "11.12.2024 (Bekanntmachungsdatum)\n\nBerlin Amtsgericht Berlin (Charlottenburg) HRB 5011\nEinreichung neuer Dokumente\n\nHilfswerk-Siedlung Gesellschaft mit beschränkter Haftung Evangelisches Wohnungsunternehmen in Berlin\nGesellschaft mit beschränkter Haftung\nBerlin\n\nAls nicht eingetragen wird veröffentlicht: Es wurde eine neue Liste der Aufsichtsratsmitglieder eingereicht (§52 GmbHG)."
    },
    {
      "date": "2024-12-11",
      "id": "96085",
      "original_text": "Registerbekanntmachung nach dem Umwandlungsgesetz\nSaarland Amtsgericht Saarbrücken HRB 63678\nLaux Tiefbau GmbH – Losheim am See",
      "type": "Registerbekanntmachung nach dem Umwandlungsgesetz",
      "state": "Saarland",
      "amtsgericht": "Amtsgericht Saarbrücken",
      "registernummer": "HRB 63678",
      "registerart": "HRB",
      "company_name": "Laux Tiefbau GmbH",
      "company_seat": "Losheim am See",
      "details": "11.12.2024 (Bekanntmachungsdatum)\n\nSaarland Amtsgericht Saarbrücken HRB 63678\nRegisterbekanntmachung nach dem Umwandlungsgesetz 11.12.2024 (Eintragungsdatum)\n\nLaux Tiefbau GmbH\nGesellschaft mit beschränkter Haftung\nLosheim am See\n\nAls nicht eingetragen wird bekannt gemacht: Den Gläubigern der an der Verschmelzung beteiligten Gesellschaften ist, wenn sie binnen sechs Monaten nach dem Tag, an dem die Eintragung der Verschmelzung in das Register des Sitzes desjenigen Rechtsträgers, dessen Gläubiger sie sind, nach § 19 Absatz 3 UmwG bekannt gemacht worden ist, ihren Anspruch nach Grund und Höhe schriftlich anmelden, Sicherheit zu leisten, soweit sie nicht Befriedigung verlangen können. Dieses Recht steht den Gläubigern jedoch nur zu, wenn sie glaubhaft machen, dass durch die Verschmelzung die Erfüllung ihrer Forderung gefährdet wird."
    },
    {
      "date": "2024-12-11",
      "id": "96086",
      "original_text": "Löschungsankündigung\nBrandenburg Amtsgericht Frankfurt/Oder HRB 13717\nKERMS UG (haftungsbeschränkt) – Woltersdorf",
      "type": "Löschungsankündigung",
      "state": "Brandenburg",
      "amtsgericht": "Amtsgericht Frankfurt/Oder",
      "registernummer": "HRB 13717",
      "registerart": "HRB",
      "company_name": "KERMS UG (haftungsbeschränkt)",
      "company_seat": "Woltersdorf",
      "details": "11.12.2024 (Bekanntmachungsdatum)\n\nBrandenburg Amtsgericht Frankfurt/Oder HRB 13717\nLöschungsankündigung\n\nKERMS UG (haftungsbeschränkt)\nGesellschaft mit beschränkter Haftung\nWoltersdorf\n\nBei der nachstehenden Gesellschaft wird das Amtslöschungsverfahren gemäß § 394 Abs. 1 FamFG eingeleitet."
    },
    {
      "date": "2024-12-11",
      "id": "96087",
      "original_text": "Registerbekanntmachung nach dem Umwandlungsgesetz\nBerlin Amtsgericht Berlin (Charlottenburg) HRA 63687\nUIW Lux Berlin 6 GmbH & Co. KG – Berlin",
      "type": "Registerbekanntmachung nach dem Umwandlungsgesetz",
      "state": "Berlin",
      "amtsgericht": "Amtsgericht Berlin (Charlottenburg)",
      "registernummer": "HRA 63687",
      "registerart": "HRA",
      "company_name": "UIW Lux Berlin 6 GmbH & Co. KG",
      "company_seat": "Berlin",
      "details": "11.12.2024 (Bekanntmachungsdatum)\n\nBerlin Amtsgericht Berlin (Charlottenburg) HRA 63687\nRegisterbekanntmachung nach dem Umwandlungsgesetz 10.12.2024 (Eintragungsdatum)\n\nUIW Lux Berlin 6 GmbH & Co. KG\nKommanditgesellschaft\nBerlin\n\nZu Eintragungsnummer 2 vom 10.12.2024 wird als nicht eingetragen veröffentlicht:\nDen Gläubigern ist, wenn sie binnen sechs Monaten nach dem Tag, an dem die Eintragung der Umwandlung als bekannt gemacht gilt, ihren Anspruch nach Grund und Höhe schriftlich anmelden, Sicherheit zu leisten, soweit sie nicht Befriedigung verlangen können. Dieses Recht steht den Gläubigern jedoch nur zu, wenn sie glaubhaft machen, dass durch die Umwandlung die Erfüllung ihrer Forderung gefährdet wird. Das Recht, Sicherheitsleistung zu verlangen, steht Gläubigern nicht zu, die im Falle der Insolvenz ein Recht auf vorzugsweise Befriedigung aus einer Deckungsmasse haben, die nach gesetzlicher Vorschrift zu ihrem Schutz errichtet und staatlich überwacht ist."
    },
    {
      "date": "2024-12-11",
      "id": "96088",
      "original_text": "Registerbekanntmachung nach dem Umwandlungsgesetz\nThüringen Amtsgericht Jena HRB 401086\nJuB-Creative Product GmbH – Seebach",
      "type": "Registerbekanntmachung nach dem Umwandlungsgesetz",
      "state": "Thüringen",
      "amtsgericht": "Amtsgericht Jena",
      "registernummer": "HRB 401086",
      "registerart": "HRB",
      "company_name": "JuB-Creative Product GmbH",
      "company_seat": "Seebach",
      "details": "11.12.2024 (Bekanntmachungsdatum)\n\nThüringen Amtsgericht Jena HRB 401086\nRegisterbekanntmachung nach dem Umwandlungsgesetz 11.12.2024 (Eintragungsdatum)\n\nJuB-Creative Product GmbH\nGesellschaft mit beschränkter Haftung\nSeebach\n\nNicht eingetragen: Den Gläubigern der an der Verschmelzung beteiligten Rechtsträger, ist wenn sie binnen sechs Monaten nach dem Tag, an dem die Eintragung der Verschmelzung in das Register des Sitzes desjenigen Rechtsträgers, dessen Gläubiger sie sind,  nach § 19 Abs. 3 UmwG als bekanntgemacht gilt, ihren Anspruch nach Grund und Höhe schriftlich anmelden, Sicherheit zu leisten, soweit sie nicht Befriedigung verlangen können. Dieses Recht steht ihnen jedoch nur zu, wenn sie glaubhaft machen, daß durch die Verschmelzung die Erfüllung ihrer Forderung gefährdet wird."
    },
    {
      "date": "2024-12-11",
      "id": "96089",
      "original_text": "Registerbekanntmachung nach dem Umwandlungsgesetz\nThüringen Amtsgericht Jena HRB 521460\nThomas Wenzel Vermögensverwaltung GmbH – Seebach",
      "type": "Registerbekanntmachung nach dem Umwandlungsgesetz",
      "state": "Thüringen",
      "amtsgericht": "Amtsgericht Jena",
      "registernummer": "HRB 521460",
      "registerart": "HRB",
      "company_name": "Thomas Wenzel Vermögensverwaltung GmbH",
      "company_seat": "Seebach",
      "details": "11.12.2024 (Bekanntmachungsdatum)\n\nThüringen Amtsgericht Jena HRB 521460\nRegisterbekanntmachung nach dem Umwandlungsgesetz 11.12.2024 (Eintragungsdatum)\n\nThomas Wenzel Vermögensverwaltung GmbH\nGesellschaft mit beschränkter Haftung\nSeebach\n\nNicht eingetragen: Den Gläubigern der an der Verschmelzung beteiligten Rechtsträger, ist wenn sie binnen sechs Monaten nach dem Tag, an dem die Eintragung der Verschmelzung in das Register des Sitzes desjenigen Rechtsträgers, dessen Gläubiger sie sind,  nach § 19 Abs. 3 UmwG als bekanntgemacht gilt, ihren Anspruch nach Grund und Höhe schriftlich anmelden, Sicherheit zu leisten, soweit sie nicht Befriedigung verlangen können. Dieses Recht steht ihnen jedoch nur zu, wenn sie glaubhaft machen, daß durch die Verschmelzung die Erfüllung ihrer Forderung gefährdet wird."
    },
    {
      "date": "2024-12-11",
      "id": "96090",
      "original_text": "Einreichung neuer Dokumente\nBaden-Württemberg Amtsgericht Mannheim HRB 100147\nKarlsruher Messe- und Kongress GmbH – Karlsruhe",
      "type": "Einreichung neuer Dokumente",
      "state": "Baden-Württemberg",
      "amtsgericht": "Amtsgericht Mannheim",
      "registernummer": "HRB 100147",
      "registerart": "HRB",
      "company_name": "Karlsruher Messe- und Kongress GmbH",
      "company_seat": "Karlsruhe",
      "details": "11.12.2024 (Bekanntmachungsdatum)\n\nBaden-Württemberg Amtsgericht Mannheim HRB 100147\nEinreichung neuer Dokumente\n\nKarlsruher Messe- und Kongress GmbH\nGesellschaft mit beschränkter Haftung\nKarlsruhe\n\nDie Gesellschaft hat am 05.12.2024 die Liste über die Zusammensetzung des Aufsichtsrats zum Handelsregister eingereicht."
    },
    {
      "date": "2024-12-11",
      "id": "96091",
      "original_text": "Registerbekanntmachung nach dem Umwandlungsgesetz\nBerlin Amtsgericht Berlin (Charlottenburg) HRA 63691\nUIW Lux Berlin 3 GmbH & Co. KG – Berlin",
      "type": "Registerbekanntmachung nach dem Umwandlungsgesetz",
      "state": "Berlin",
      "amtsgericht": "Amtsgericht Berlin (Charlottenburg)",
      "registernummer": "HRA 63691",
      "registerart": "HRA",
      "company_name": "UIW Lux Berlin 3 GmbH & Co. KG",
      "company_seat": "Berlin",
      "details": "11.12.2024 (Bekanntmachungsdatum)\n\nBerlin Amtsgericht Berlin (Charlottenburg) HRA 63691\nRegisterbekanntmachung nach dem Umwandlungsgesetz 10.12.2024 (Eintragungsdatum)\n\nUIW Lux Berlin 3 GmbH & Co. KG\nKommanditgesellschaft\nBerlin\n\nZu Eintragungsnummer 2 vom 10.12.2024 wird als nicht eingetragen veröffentlicht:\nDen Gläubigern ist, wenn sie binnen sechs Monaten nach dem Tag, an dem die Eintragung der Umwandlung als bekannt gemacht gilt, ihren Anspruch nach Grund und Höhe schriftlich anmelden, Sicherheit zu leisten, soweit sie nicht Befriedigung verlangen können. Dieses Recht steht den Gläubigern jedoch nur zu, wenn sie glaubhaft machen, dass durch die Umwandlung die Erfüllung ihrer Forderung gefährdet wird. Das Recht, Sicherheitsleistung zu verlangen, steht Gläubigern nicht zu, die im Falle der Insolvenz ein Recht auf vorzugsweise Befriedigung aus einer Deckungsmasse haben, die nach gesetzlicher Vorschrift zu ihrem Schutz errichtet und staatlich überwacht ist."
    },
    {
      "date": "2024-12-11",
      "id": "96092",
      "original_text": "Löschungsankündigung\nBerlin Amtsgericht Berlin (Charlottenburg) HRB 160267\nGePe Geoservice GmbH – Berlin",
      "type": "Löschungsankündigung",
      "state": "Berlin",
      "amtsgericht": "Amtsgericht Berlin (Charlottenburg)",
      "registernummer": "HRB 160267",
      "registerart": "HRB",
      "company_name": "GePe Geoservice GmbH",
      "company_seat": "Berlin",
      "details": "11.12.2024 (Bekanntmachungsdatum)\n\nBerlin Amtsgericht Berlin (Charlottenburg) HRB 160267\nLöschungsankündigung\n\nGePe Geoservice GmbH\nGesellschaft mit beschränkter Haftung\nBerlin\n\nBei der nachstehenden Gesellschaft wird das Amtslöschungsverfahren gemäß § 394 FamFG eingeleitet. Widerspruchsfrist 6 Wochen"
    },
    {
      "date": "2024-12-11",
      "id": "96093",
      "original_text": "Registerbekanntmachung nach dem Umwandlungsgesetz\nSchleswig-Holstein Amtsgericht Kiel HRA 11324\nSOMIKON Zukunftsenergie 8 GmbH & Co. KG – Schönkirchen",
      "type": "Registerbekanntmachung nach dem Umwandlungsgesetz",
      "state": "Schleswig-Holstein",
      "amtsgericht": "Amtsgericht Kiel",
      "registernummer": "HRA 11324",
      "registerart": "HRA",
      "company_name": "SOMIKON Zukunftsenergie 8 GmbH & Co. KG",
      "company_seat": "Schönkirchen",
      "details": "11.12.2024 (Bekanntmachungsdatum)\n\nSchleswig-Holstein Amtsgericht Kiel HRA 11324\nRegisterbekanntmachung nach dem Umwandlungsgesetz 10.12.2024 (Eintragungsdatum)\n\nSOMIKON Zukunftsenergie 8 GmbH & Co. KG\nKommanditgesellschaft\nSchönkirchen\n\nZu Eintragungsnummer 2 vom 10.12.2024 wird als nicht eingetragen veröffentlicht: Den Gläubigern der an der Spaltung beteiligten Rechtsträger ist, wenn sie binnen sechs Monaten nach dem Tag, an dem die Eintragung der Spaltung in das Register des Sitzes desjenigen Rechtsträgers, dessen Gläubiger sie sind,  bekannt gemacht worden ist, ihren Anspruch nach Grund und Höhe schriftlich anmelden, Sicherheit zu leisten, soweit sie nicht Befriedigung verlangen können. Dieses Recht steht den Gläubigern jedoch nur zu, wenn sie glaubhaft machen, dass durch die Spaltung die Erfüllung ihrer Forderung gefährdet wird."
    },
    {
      "date": "2024-12-11",
      "id": "96094",
      "original_text": "Löschungsankündigung\nBerlin Amtsgericht Berlin (Charlottenburg) HRB 166324\nTakeeateasy.DE GmbH – Berlin",
      "type": "Löschungsankündigung",
      "state": "Berlin",
      "amtsgericht": "Amtsgericht Berlin (Charlottenburg)",
      "registernummer": "HRB 166324",
      "registerart": "HRB",
      "company_name": "Takeeateasy.DE GmbH",
      "company_seat": "Berlin",
      "details": "11.12.2024 (Bekanntmachungsdatum)\n\nBerlin Amtsgericht Berlin (Charlottenburg) HRB 166324\nLöschungsankündigung\n\nTakeeateasy.DE GmbH\nGesellschaft mit beschränkter Haftung\nBerlin\n\nBei der nachstehenden Gesellschaft wird das Amtslöschungsverfahren gemäß § 394 FamFG eingeleitet. Widerspruchsfrist 6 Wochen"
    },
    {
      "date": "2024-12-11",
      "id": "96095",
      "original_text": "Löschungsankündigung\nSchleswig-Holstein Amtsgericht Lübeck HRB 22834\nAutowerk Glinde GmbH – Glinde",
      "type": "Löschungsankündigung",
      "state": "Schleswig-Holstein",
      "amtsgericht": "Amtsgericht Lübeck",
      "registernummer": "HRB 22834",
      "registerart": "HRB",
      "company_name": "Autowerk Glinde GmbH",
      "company_seat": "Glinde",
      "details": "11.12.2024 (Bekanntmachungsdatum)\n\nSchleswig-Holstein Amtsgericht Lübeck HRB 22834\nLöschungsankündigung\n\nAutowerk Glinde GmbH\nGesellschaft mit beschränkter Haftung\nGlinde\n\nEs ist die Löschung der nachstehenden Gesellschaft wegen Vermögenslosigkeit gemäß § 394 FamFG beabsichtigt."
    },
    {
      "date": "2024-12-11",
      "id": "96096",
      "original_text": "Löschungsankündigung\nBerlin Amtsgericht Berlin (Charlottenburg) HRB 239650\nVOCA Immobilien UG (haftungsbeschränkt) – Berlin",
      "type": "Löschungsankündigung",
      "state": "Berlin",
      "amtsgericht": "Amtsgericht Berlin (Charlottenburg)",
      "registernummer": "HRB 239650",
      "registerart": "HRB",
      "company_name": "VOCA Immobilien UG (haftungsbeschränkt)",
      "company_seat": "Berlin",
      "details": "11.12.2024 (Bekanntmachungsdatum)\n\nBerlin Amtsgericht Berlin (Charlottenburg) HRB 239650\nLöschungsankündigung\n\nVOCA Immobilien UG (haftungsbeschränkt)\nGesellschaft mit beschränkter Haftung\nBerlin\n\nBei der nachstehenden Gesellschaft wird das Amtslöschungsverfahren gemäß § 394 FamFG eingeleitet. Widerspruchsfrist 6 Wochen"
    },
    {
      "date": "2024-12-11",
      "id": "96097",
      "original_text": "Einreichung neuer Dokumente\nMecklenburg-Vorpommern Amtsgericht Stralsund HRB 241 früher Amtsgericht Rostock\nFährhafen Sassnitz Gesellschaft mit beschränkter Haftung – Sassnitz",
      "type": "Einreichung neuer Dokumente",
      "state": "Mecklenburg-Vorpommern",
      "amtsgericht": "Amtsgericht Stralsund",
      "registernummer": "HRB 241",
      "registerart": "HRB",
      "company_name": "Fährhafen Sassnitz Gesellschaft mit beschränkter Haftung",
      "company_seat": "Sassnitz",
      "former_amtsgericht": "Rostock",
      "details": "11.12.2024 (Bekanntmachungsdatum)\n\nMecklenburg-Vorpommern Amtsgericht Stralsund HRB 241 früher Amtsgericht Rostock\nEinreichung neuer Dokumente\n\nFährhafen Sassnitz Gesellschaft mit beschränkter Haftung\nGesellschaft mit beschränkter Haftung\nSassnitz\n\nEine Liste der Mitglieder des Aufsichtsrats ist zum Handelsregister eingereicht worden."
    },
    {
      "date": "2024-12-11",
      "id": "96098",
      "original_text": "Einreichung neuer Dokumente\nSchleswig-Holstein Amtsgericht Pinneberg HRB 8093\nORLEN Deutschland GmbH – Elmshorn",
      "type": "Einreichung neuer Dokumente",
      "state": "Schleswig-Holstein",
      "amtsgericht": "Amtsgericht Pinneberg",
      "registernummer": "HRB 8093",
      "registerart": "HRB",
      "company_name": "ORLEN Deutschland GmbH",
      "company_seat": "Elmshorn",
      "details": "11.12.2024 (Bekanntmachungsdatum)\n\nSchleswig-Holstein Amtsgericht Pinneberg HRB 8093\nEinreichung neuer Dokumente\n\nORLEN Deutschland GmbH\nGesellschaft mit beschränkter Haftung\nElmshorn\n\nAls nicht eingetragen wird veröffentlicht: Eine Aufsichtsratsliste wurde gemäß § 52 GmbHG zum Handelsregister eingereicht."
    },
    {
      "date": "2024-12-11",
      "id": "96099",
      "original_text": "Einreichung neuer Dokumente\nHamburg Amtsgericht Hamburg HRB 102614\nDURAG Holding AG – Hamburg",
      "type": "Einreichung neuer Dokumente",
      "state": "Hamburg",
      "amtsgericht": "Amtsgericht Hamburg",
      "registernummer": "HRB 102614",
      "registerart": "HRB",
      "company_name": "DURAG Holding AG",
      "company_seat": "Hamburg",
      "details": "11.12.2024 (Bekanntmachungsdatum)\n\nHamburg Amtsgericht Hamburg HRB 102614\nEinreichung neuer Dokumente\n\nDURAG Holding AG\nAktiengesellschaft\nHamburg\n\nAls nicht eingetragen wird bekannt gemacht: Liste des Aufsichtsrats wurde eingereicht."
    },
    {
      "date": "2024-12-11",
      "id": "96100",
      "original_text": "Einreichung neuer Dokumente\nHamburg Amtsgericht Hamburg HRB 75783\n\"Hanseatic Brokerhouse Securities AG\" – Hamburg",
      "type": "Einreichung neuer Dokumente",
      "state": "Hamburg",
      "amtsgericht": "Amtsgericht Hamburg",
      "registernummer": "HRB 75783",
      "registerart": "HRB",
      "company_name": "\"Hanseatic Brokerhouse Securities AG\"",
      "company_seat": "Hamburg",
      "details": "11.12.2024 (Bekanntmachungsdatum)\n\nHamburg Amtsgericht Hamburg HRB 75783\nEinreichung neuer Dokumente\n\n\"Hanseatic Brokerhouse Securities AG\"\nAktiengesellschaft\nHamburg\n\nAls nicht eingetragen wird bekannt gemacht: Liste des Aufsichtsrats wurde eingereicht."
    },
    {
      "date": "2024-12-11",
      "id": "96101",
      "original_text": "Löschungsankündigung\nBerlin Amtsgericht Berlin (Charlottenburg) HRB 216266\nMiray Pflegedienst GmbH – Berlin",
      "type": "Löschungsankündigung",
      "state": "Berlin",
      "amtsgericht": "Amtsgericht Berlin (Charlottenburg)",
      "registernummer": "HRB 216266",
      "registerart": "HRB",
      "company_name": "Miray Pflegedienst GmbH",
      "company_seat": "Berlin",
      "details": "11.12.2024 (Bekanntmachungsdatum)\n\nBerlin Amtsgericht Berlin (Charlottenburg) HRB 216266\nLöschungsankündigung\n\nMiray Pflegedienst GmbH\nGesellschaft mit beschränkter Haftung\nBerlin\n\nBei der nachstehenden Gesellschaft wird das Amtslöschungsverfahren gemäß § 394 FamFG eingeleitet. Widerspruchsfrist 6 Wochen"
    },
    {
      "date": "2024-12-11",
      "id": "96102",
      "original_text": "Löschungsankündigung\nBaden-Württemberg Amtsgericht Stuttgart HRB 767934\nCCVV GmbH – Bad Rappenau",
      "type": "Löschungsankündigung",
      "state": "Baden-Württemberg",
      "amtsgericht": "Amtsgericht Stuttgart",
      "registernummer": "HRB 767934",
      "registerart": "HRB",
      "company_name": "CCVV GmbH",
      "company_seat": "Bad Rappenau",
      "details": "11.12.2024 (Bekanntmachungsdatum)\n\nBaden-Württemberg Amtsgericht Stuttgart HRB 767934\nLöschungsankündigung\n\nCCVV GmbH\nGesellschaft mit beschränkter Haftung\nBad Rappenau\n\nAls nicht eingetragen wird bekanntgemacht:\nDas Gericht beabsichtigt, die Gesellschaft wegen Vermögenslosigkeit im Handelsregister von Amts wegen nach § 394 FamFG zu löschen. Die Frist zur Geltendmachung eines Widerspruchs gegen die beabsichtigte Löschung ist auf zwei Monate ab Veröffentlichung bestimmt."
    },
    {
      "date": "2024-12-11",
      "id": "96103",
      "original_text": "Einreichung neuer Dokumente\nHamburg Amtsgericht Hamburg HRB 82102\nSmurfit Westrock GmbH – Hamburg",
      "type": "Einreichung neuer Dokumente",
      "state": "Hamburg",
      "amtsgericht": "Amtsgericht Hamburg",
      "registernummer": "HRB 82102",
      "registerart": "HRB",
      "company_name": "Smurfit Westrock GmbH",
      "company_seat": "Hamburg",
      "details": "11.12.2024 (Bekanntmachungsdatum)\n\nHamburg Amtsgericht Hamburg HRB 82102\nEinreichung neuer Dokumente\n\nSmurfit Westrock GmbH\nGesellschaft mit beschränkter Haftung\nHamburg\n\nAls nicht eingetragen wird bekannt gemacht: Liste des Aufsichtsrats wurde eingereicht."
    },
    {
      "date": "2024-12-11",
      "id": "96104",
      "original_text": "Einreichung neuer Dokumente\nHamburg Amtsgericht Hamburg HRB 135499\nScandlines Deutschland GmbH – Hamburg",
      "type": "Einreichung neuer Dokumente",
      "state": "Hamburg",
      "amtsgericht": "Amtsgericht Hamburg",
      "registernummer": "HRB 135499",
      "registerart": "HRB",
      "company_name": "Scandlines Deutschland GmbH",
      "company_seat": "Hamburg",
      "details": "11.12.2024 (Bekanntmachungsdatum)\n\nHamburg Amtsgericht Hamburg HRB 135499\nEinreichung neuer Dokumente\n\nScandlines Deutschland GmbH\nGesellschaft mit beschränkter Haftung\nHamburg\n\nAls nicht eingetragen wird bekannt gemacht: Liste des Aufsichtsrats wurde eingereicht."
    },
    {
      "date": "2024-12-11",
      "id": "96105",
      "original_text": "Registerbekanntmachung nach dem Umwandlungsgesetz\nHamburg Amtsgericht Hamburg HRB 67337\nMS \"NORTHERN DIVERSITY\" Schiffahrtsgesellschaft mbH – Hamburg",
      "type": "Registerbekanntmachung nach dem Umwandlungsgesetz",
      "state": "Hamburg",
      "amtsgericht": "Amtsgericht Hamburg",
      "registernummer": "HRB 67337",
      "registerart": "HRB",
      "company_name": "MS \"NORTHERN DIVERSITY\" Schiffahrtsgesellschaft mbH",
      "company_seat": "Hamburg",
      "details": "11.12.2024 (Bekanntmachungsdatum)\n\nHamburg Amtsgericht Hamburg HRB 67337\nRegisterbekanntmachung nach dem Umwandlungsgesetz 11.12.2024 (Eintragungsdatum)\n\nMS \"NORTHERN DIVERSITY\" Schiffahrtsgesellschaft mbH\nGesellschaft mit beschränkter Haftung\nHamburg\n\nAls nicht eingetragen wird bekannt gemacht:\nDen Gläubigern der an der Verschmelzung beteiligten Gesellschaften ist, wenn sie binnen sechs Monaten nach dem Tag, an dem die Eintragung der Verschmelzung in das Register des Sitzes desjenigen Rechtsträgers, dessen Gläubiger sie sind, nach § 19 Absatz 3 UmwG als bekannt gemacht gilt, ihren Anspruch nach Grund und Höhe schriftlich anmelden, Sicherheit zu leisten, soweit sie nicht Befriedigung verlangen können. Dieses Recht steht den Gläubigern jedoch nur zu, wenn sie glaubhaft machen, dass durch die Verschmelzung die Erfüllung ihrer Forderung gefährdet wird."
    },
    {
      "date": "2024-12-11",
      "id": "96106",
      "original_text": "Registerbekanntmachung nach dem Umwandlungsgesetz\nHamburg Amtsgericht Hamburg HRB 67346\nMS \"NORTHERN DIVINITY\" Schiffahrtsgesellschaft mbH – Hamburg",
      "type": "Registerbekanntmachung nach dem Umwandlungsgesetz",
      "state": "Hamburg",
      "amtsgericht": "Amtsgericht Hamburg",
      "registernummer": "HRB 67346",
      "registerart": "HRB",
      "company_name": "MS \"NORTHERN DIVINITY\" Schiffahrtsgesellschaft mbH",
      "company_seat": "Hamburg",
      "details": "11.12.2024 (Bekanntmachungsdatum)\n\nHamburg Amtsgericht Hamburg HRB 67346\nRegisterbekanntmachung nach dem Umwandlungsgesetz 11.12.2024 (Eintragungsdatum)\n\nMS \"NORTHERN DIVINITY\" Schiffahrtsgesellschaft mbH\nGesellschaft mit beschränkter Haftung\nHamburg\n\nAls nicht eingetragen wird bekannt gemacht:\nDen Gläubigern der an der Verschmelzung beteiligten Gesellschaften ist, wenn sie binnen sechs Monaten nach dem Tag, an dem die Eintragung der Verschmelzung in das Register des Sitzes desjenigen Rechtsträgers, dessen Gläubiger sie sind, nach § 19 Absatz 3 UmwG als bekannt gemacht gilt, ihren Anspruch nach Grund und Höhe schriftlich anmelden, Sicherheit zu leisten, soweit sie nicht Befriedigung verlangen können. Dieses Recht steht den Gläubigern jedoch nur zu, wenn sie glaubhaft machen, dass durch die Verschmelzung die Erfüllung ihrer Forderung gefährdet wird."
    },
    {
      "date": "2024-12-11",
      "id": "96107",
      "original_text": "Registerbekanntmachung nach dem Umwandlungsgesetz\nHamburg Amtsgericht Hamburg HRA 93345\nNorddeutsche Reederei Holding GmbH & Co. KG – Hamburg",
      "type": "Registerbekanntmachung nach dem Umwandlungsgesetz",
      "state": "Hamburg",
      "amtsgericht": "Amtsgericht Hamburg",
      "registernummer": "HRA 93345",
      "registerart": "HRA",
      "company_name": "Norddeutsche Reederei Holding GmbH & Co. KG",
      "company_seat": "Hamburg",
      "details": "11.12.2024 (Bekanntmachungsdatum)\n\nHamburg Amtsgericht Hamburg HRA 93345\nRegisterbekanntmachung nach dem Umwandlungsgesetz 11.12.2024 (Eintragungsdatum)\n\nNorddeutsche Reederei Holding GmbH & Co. KG\nKommanditgesellschaft\nHamburg\n\nAls nicht eingetragen wird bekannt gemacht:\nDen Gläubigern der an der Verschmelzung beteiligten Gesellschaften ist, wenn sie binnen sechs Monaten nach dem Tag, an dem die Eintragung der Verschmelzung in das Register des Sitzes derjenigen Rechtsträger deren Gläubiger sie sind, nach § 19 Absatz 3 UmwG als bekannt gemacht gilt, ihren Anspruch nach Grund und Höhe schriftlich anmelden, Sicherheit zu leisten, soweit sie nicht Befriedigung verlangen können. Dieses Recht steht den Gläubigern jedoch nur zu, wenn sie glaubhaft machen, dass durch die Verschmelzung die Erfüllung ihrer Forderung gefährdet wird."
    },
    {
      "date": "2024-12-11",
      "id": "96108",
      "original_text": "Registerbekanntmachung nach dem Umwandlungsgesetz\nHamburg Amtsgericht Hamburg HRA 93345\nNorddeutsche Reederei Holding GmbH & Co. KG – Hamburg",
      "type": "Registerbekanntmachung nach dem Umwandlungsgesetz",
      "state": "Hamburg",
      "amtsgericht": "Amtsgericht Hamburg",
      "registernummer": "HRA 93345",
      "registerart": "HRA",
      "company_name": "Norddeutsche Reederei Holding GmbH & Co. KG",
      "company_seat": "Hamburg",
      "details": "11.12.2024 (Bekanntmachungsdatum)\n\nHamburg Amtsgericht Hamburg HRA 93345\nRegisterbekanntmachung nach dem Umwandlungsgesetz 11.12.2024 (Eintragungsdatum)\n\nNorddeutsche Reederei Holding GmbH & Co. KG\nKommanditgesellschaft\nHamburg\n\nAls nicht eingetragen wird bekannt gemacht:\nDen Gläubigern der an der Verschmelzung beteiligten Gesellschaften ist, wenn sie binnen sechs Monaten nach dem Tag, an dem die Eintragung der Verschmelzung in das Register des Sitzes desjenigen Rechtsträgers, dessen Gläubiger sie sind, nach § 19 Absatz 3 UmwG als bekannt gemacht gilt, ihren Anspruch nach Grund und Höhe schriftlich anmelden, Sicherheit zu leisten, soweit sie nicht Befriedigung verlangen können. Dieses Recht steht den Gläubigern jedoch nur zu, wenn sie glaubhaft machen, dass durch die Verschmelzung die Erfüllung ihrer Forderung gefährdet wird."
    },
    {
      "date": "2024-12-11",
      "id": "96109",
      "original_text": "Registerbekanntmachung nach dem Umwandlungsgesetz\nHamburg Amtsgericht Hamburg HRB 69510\nMS \"NORTHERN GRANDOUR\" Schiffahrtsgesellschaft mbH – Hamburg",
      "type": "Registerbekanntmachung nach dem Umwandlungsgesetz",
      "state": "Hamburg",
      "amtsgericht": "Amtsgericht Hamburg",
      "registernummer": "HRB 69510",
      "registerart": "HRB",
      "company_name": "MS \"NORTHERN GRANDOUR\" Schiffahrtsgesellschaft mbH",
      "company_seat": "Hamburg",
      "details": "11.12.2024 (Bekanntmachungsdatum)\n\nHamburg Amtsgericht Hamburg HRB 69510\nRegisterbekanntmachung nach dem Umwandlungsgesetz 11.12.2024 (Eintragungsdatum)\n\nMS \"NORTHERN GRANDOUR\" Schiffahrtsgesellschaft mbH\nGesellschaft mit beschränkter Haftung\nHamburg\n\nAls nicht eingetragen wird bekannt gemacht:\nDen Gläubigern der an der Verschmelzung beteiligten Gesellschaften ist, wenn sie binnen sechs Monaten nach dem Tag, an dem die Eintragung der Verschmelzung in das Register des Sitzes desjenigen Rechtsträgers, dessen Gläubiger sie sind, nach § 19 Absatz 3 UmwG als bekannt gemacht gilt, ihren Anspruch nach Grund und Höhe schriftlich anmelden, Sicherheit zu leisten, soweit sie nicht Befriedigung verlangen können. Dieses Recht steht den Gläubigern jedoch nur zu, wenn sie glaubhaft machen, dass durch die Verschmelzung die Erfüllung ihrer Forderung gefährdet wird."
    },
    {
      "date": "2024-12-11",
      "id": "96110",
      "original_text": "Registerbekanntmachung nach dem Umwandlungsgesetz\nHamburg Amtsgericht Hamburg HRB 61943\nMS \"NORTHERN GLORY\" Schiffahrtsgesellschaft mbH – Hamburg",
      "type": "Registerbekanntmachung nach dem Umwandlungsgesetz",
      "state": "Hamburg",
      "amtsgericht": "Amtsgericht Hamburg",
      "registernummer": "HRB 61943",
      "registerart": "HRB",
      "company_name": "MS \"NORTHERN GLORY\" Schiffahrtsgesellschaft mbH",
      "company_seat": "Hamburg",
      "details": "11.12.2024 (Bekanntmachungsdatum)\n\nHamburg Amtsgericht Hamburg HRB 61943\nRegisterbekanntmachung nach dem Umwandlungsgesetz 11.12.2024 (Eintragungsdatum)\n\nMS \"NORTHERN GLORY\" Schiffahrtsgesellschaft mbH\nGesellschaft mit beschränkter Haftung\nHamburg\n\nAls nicht eingetragen wird bekannt gemacht:\nDen Gläubigern der an der Verschmelzung beteiligten Gesellschaften ist, wenn sie binnen sechs Monaten nach dem Tag, an dem die Eintragung der Verschmelzung in das Register des Sitzes desjenigen Rechtsträgers, dessen Gläubiger sie sind, nach § 19 Absatz 3 UmwG als bekannt gemacht gilt, ihren Anspruch nach Grund und Höhe schriftlich anmelden, Sicherheit zu leisten, soweit sie nicht Befriedigung verlangen können. Dieses Recht steht den Gläubigern jedoch nur zu, wenn sie glaubhaft machen, dass durch die Verschmelzung die Erfüllung ihrer Forderung gefährdet wird."
    },
    {
      "date": "2024-12-11",
      "id": "96111",
      "original_text": "Registerbekanntmachung nach dem Umwandlungsgesetz\nHamburg Amtsgericht Hamburg HRB 80116\nMS \"NORTHERN ENTERPRISE\" Schiffahrtsgesellschaft mbH – Hamburg",
      "type": "Registerbekanntmachung nach dem Umwandlungsgesetz",
      "state": "Hamburg",
      "amtsgericht": "Amtsgericht Hamburg",
      "registernummer": "HRB 80116",
      "registerart": "HRB",
      "company_name": "MS \"NORTHERN ENTERPRISE\" Schiffahrtsgesellschaft mbH",
      "company_seat": "Hamburg",
      "details": "11.12.2024 (Bekanntmachungsdatum)\n\nHamburg Amtsgericht Hamburg HRB 80116\nRegisterbekanntmachung nach dem Umwandlungsgesetz 11.12.2024 (Eintragungsdatum)\n\nMS \"NORTHERN ENTERPRISE\" Schiffahrtsgesellschaft mbH\nGesellschaft mit beschränkter Haftung\nHamburg\n\nAls nicht eingetragen wird bekannt gemacht:\nDen Gläubigern der an der Verschmelzung beteiligten Gesellschaften ist, wenn sie binnen sechs Monaten nach dem Tag, an dem die Eintragung der Verschmelzung in das Register des Sitzes desjenigen Rechtsträgers, dessen Gläubiger sie sind, nach § 19 Absatz 3 UmwG als bekannt gemacht gilt, ihren Anspruch nach Grund und Höhe schriftlich anmelden, Sicherheit zu leisten, soweit sie nicht Befriedigung verlangen können. Dieses Recht steht den Gläubigern jedoch nur zu, wenn sie glaubhaft machen, dass durch die Verschmelzung die Erfüllung ihrer Forderung gefährdet wird."
    },
    {
      "date": "2024-12-11",
      "id": "96112",
      "original_text": "Registerbekanntmachung nach dem Umwandlungsgesetz\nHamburg Amtsgericht Hamburg HRA 93345\nNorddeutsche Reederei Holding GmbH & Co. KG – Hamburg",
      "type": "Registerbekanntmachung nach dem Umwandlungsgesetz",
      "state": "Hamburg",
      "amtsgericht": "Amtsgericht Hamburg",
      "registernummer": "HRA 93345",
      "registerart": "HRA",
      "company_name": "Norddeutsche Reederei Holding GmbH & Co. KG",
      "company_seat": "Hamburg",
      "details": "11.12.2024 (Bekanntmachungsdatum)\n\nHamburg Amtsgericht Hamburg HRA 93345\nRegisterbekanntmachung nach dem Umwandlungsgesetz 11.12.2024 (Eintragungsdatum)\n\nNorddeutsche Reederei Holding GmbH & Co. KG\nKommanditgesellschaft\nHamburg\n\nAls nicht eingetragen wird bekannt gemacht:\nDen Gläubigern der an der Verschmelzung beteiligten Gesellschaften ist, wenn sie binnen sechs Monaten nach dem Tag, an dem die Eintragung der Verschmelzung in das Register des Sitzes desjenigen Rechtsträgers, dessen Gläubiger sie sind, nach § 19 Absatz 3 UmwG als bekannt gemacht gilt, ihren Anspruch nach Grund und Höhe schriftlich anmelden, Sicherheit zu leisten, soweit sie nicht Befriedigung verlangen können. Dieses Recht steht den Gläubigern jedoch nur zu, wenn sie glaubhaft machen, dass durch die Verschmelzung die Erfüllung ihrer Forderung gefährdet wird."
    },
    {
      "date": "2024-12-11",
      "id": "96113",
      "original_text": "Registerbekanntmachung nach dem Umwandlungsgesetz\nHamburg Amtsgericht Hamburg HRB 61933\nMS \"NORTHERN GRACE\" Schiffahrtsgesellschaft mbH – Hamburg",
      "type": "Registerbekanntmachung nach dem Umwandlungsgesetz",
      "state": "Hamburg",
      "amtsgericht": "Amtsgericht Hamburg",
      "registernummer": "HRB 61933",
      "registerart": "HRB",
      "company_name": "MS \"NORTHERN GRACE\" Schiffahrtsgesellschaft mbH",
      "company_seat": "Hamburg",
      "details": "11.12.2024 (Bekanntmachungsdatum)\n\nHamburg Amtsgericht Hamburg HRB 61933\nRegisterbekanntmachung nach dem Umwandlungsgesetz 11.12.2024 (Eintragungsdatum)\n\nMS \"NORTHERN GRACE\" Schiffahrtsgesellschaft mbH\nGesellschaft mit beschränkter Haftung\nHamburg\n\nAls nicht eingetragen wird bekannt gemacht:\nDen Gläubigern der an der Verschmelzung beteiligten Gesellschaften ist, wenn sie binnen sechs Monaten nach dem Tag, an dem die Eintragung der Verschmelzung in das Register des Sitzes desjenigen Rechtsträgers, dessen Gläubiger sie sind, nach § 19 Absatz 3 UmwG als bekannt gemacht gilt, ihren Anspruch nach Grund und Höhe schriftlich anmelden, Sicherheit zu leisten, soweit sie nicht Befriedigung verlangen können. Dieses Recht steht den Gläubigern jedoch nur zu, wenn sie glaubhaft machen, dass durch die Verschmelzung die Erfüllung ihrer Forderung gefährdet wird."
    },
    {
      "date": "2024-12-11",
      "id": "96114",
      "original_text": "Registerbekanntmachung nach dem Umwandlungsgesetz\nHamburg Amtsgericht Hamburg HRB 65809\nMS \"NORTHERN GLANCE\" Schiffahrtsgesellschaft mbH – Hamburg",
      "type": "Registerbekanntmachung nach dem Umwandlungsgesetz",
      "state": "Hamburg",
      "amtsgericht": "Amtsgericht Hamburg",
      "registernummer": "HRB 65809",
      "registerart": "HRB",
      "company_name": "MS \"NORTHERN GLANCE\" Schiffahrtsgesellschaft mbH",
      "company_seat": "Hamburg",
      "details": "11.12.2024 (Bekanntmachungsdatum)\n\nHamburg Amtsgericht Hamburg HRB 65809\nRegisterbekanntmachung nach dem Umwandlungsgesetz 11.12.2024 (Eintragungsdatum)\n\nMS \"NORTHERN GLANCE\" Schiffahrtsgesellschaft mbH\nGesellschaft mit beschränkter Haftung\nHamburg\n\nAls nicht eingetragen wird bekannt gemacht:\nDen Gläubigern der an der Verschmelzung beteiligten Gesellschaften ist, wenn sie binnen sechs Monaten nach dem Tag, an dem die Eintragung der Verschmelzung in das Register des Sitzes desjenigen Rechtsträgers, dessen Gläubiger sie sind, nach § 19 Absatz 3 UmwG als bekannt gemacht gilt, ihren Anspruch nach Grund und Höhe schriftlich anmelden, Sicherheit zu leisten, soweit sie nicht Befriedigung verlangen können. Dieses Recht steht den Gläubigern jedoch nur zu, wenn sie glaubhaft machen, dass durch die Verschmelzung die Erfüllung ihrer Forderung gefährdet wird."
    },
    {
      "date": "2024-12-11",
      "id": "96115",
      "original_text": "Registerbekanntmachung nach dem Umwandlungsgesetz\nHamburg Amtsgericht Hamburg HRB 45894\nMS \"NORTHERN DELICACY\" Schiffahrtsgesellschaft mbH – Hamburg",
      "type": "Registerbekanntmachung nach dem Umwandlungsgesetz",
      "state": "Hamburg",
      "amtsgericht": "Amtsgericht Hamburg",
      "registernummer": "HRB 45894",
      "registerart": "HRB",
      "company_name": "MS \"NORTHERN DELICACY\" Schiffahrtsgesellschaft mbH",
      "company_seat": "Hamburg",
      "details": "11.12.2024 (Bekanntmachungsdatum)\n\nHamburg Amtsgericht Hamburg HRB 45894\nRegisterbekanntmachung nach dem Umwandlungsgesetz 11.12.2024 (Eintragungsdatum)\n\nMS \"NORTHERN DELICACY\" Schiffahrtsgesellschaft mbH\nGesellschaft mit beschränkter Haftung\nHamburg\n\nAls nicht eingetragen wird bekannt gemacht:\nDen Gläubigern der an der Verschmelzung beteiligten Gesellschaften ist, wenn sie binnen sechs Monaten nach dem Tag, an dem die Eintragung der Verschmelzung in das Register des Sitzes desjenigen Rechtsträgers, dessen Gläubiger sie sind, nach § 19 Absatz 3 UmwG als bekannt gemacht gilt, ihren Anspruch nach Grund und Höhe schriftlich anmelden, Sicherheit zu leisten, soweit sie nicht Befriedigung verlangen können. Dieses Recht steht den Gläubigern jedoch nur zu, wenn sie glaubhaft machen, dass durch die Verschmelzung die Erfüllung ihrer Forderung gefährdet wird."
    },
    {
      "date": "2024-12-11",
      "id": "96116",
      "original_text": "Einreichung neuer Dokumente\nBerlin Amtsgericht Berlin (Charlottenburg) HRB 180723\nEverphone GmbH – Berlin",
      "type": "Einreichung neuer Dokumente",
      "state": "Berlin",
      "amtsgericht": "Amtsgericht Berlin (Charlottenburg)",
      "registernummer": "HRB 180723",
      "registerart": "HRB",
      "company_name": "Everphone GmbH",
      "company_seat": "Berlin",
      "details": "11.12.2024 (Bekanntmachungsdatum)\n\nBerlin Amtsgericht Berlin (Charlottenburg) HRB 180723\nEinreichung neuer Dokumente\n\nEverphone GmbH\nGesellschaft mit beschränkter Haftung\nBerlin\n\nAls nicht eingetragen wird veröffentlicht: Es wurde eine neue Liste der Beiratsmitglieder eingereicht (§52 GmbHG)."
    },
    {
      "date": "2024-12-11",
      "id": "96117",
      "original_text": "Registerbekanntmachung nach dem Umwandlungsgesetz\nHamburg Amtsgericht Hamburg HRA 93345\nNorddeutsche Reederei Holding GmbH & Co. KG – Hamburg",
      "type": "Registerbekanntmachung nach dem Umwandlungsgesetz",
      "state": "Hamburg",
      "amtsgericht": "Amtsgericht Hamburg",
      "registernummer": "HRA 93345",
      "registerart": "HRA",
      "company_name": "Norddeutsche Reederei Holding GmbH & Co. KG",
      "company_seat": "Hamburg",
      "details": "11.12.2024 (Bekanntmachungsdatum)\n\nHamburg Amtsgericht Hamburg HRA 93345\nRegisterbekanntmachung nach dem Umwandlungsgesetz 11.12.2024 (Eintragungsdatum)\n\nNorddeutsche Reederei Holding GmbH & Co. KG\nKommanditgesellschaft\nHamburg\n\nAls nicht eingetragen wird bekannt gemacht:\nDen Gläubigern der an der Verschmelzung beteiligten Gesellschaften ist, wenn sie binnen sechs Monaten nach dem Tag, an dem die Eintragung der Verschmelzung in das Register des Sitzes desjenigen Rechtsträgers, dessen Gläubiger sie sind, nach § 19 Absatz 3 UmwG als bekannt gemacht gilt, ihren Anspruch nach Grund und Höhe schriftlich anmelden, Sicherheit zu leisten, soweit sie nicht Befriedigung verlangen können. Dieses Recht steht den Gläubigern jedoch nur zu, wenn sie glaubhaft machen, dass durch die Verschmelzung die Erfüllung ihrer Forderung gefährdet wird."
    },
    {
      "date": "2024-12-11",
      "id": "96118",
      "original_text": "Registerbekanntmachung nach dem Umwandlungsgesetz\nHamburg Amtsgericht Hamburg HRA 93345\nNorddeutsche Reederei Holding GmbH & Co. KG – Hamburg",
      "type": "Registerbekanntmachung nach dem Umwandlungsgesetz",
      "state": "Hamburg",
      "amtsgericht": "Amtsgericht Hamburg",
      "registernummer": "HRA 93345",
      "registerart": "HRA",
      "company_name": "Norddeutsche Reederei Holding GmbH & Co. KG",
      "company_seat": "Hamburg",
      "details": "11.12.2024 (Bekanntmachungsdatum)\n\nHamburg Amtsgericht Hamburg HRA 93345\nRegisterbekanntmachung nach dem Umwandlungsgesetz 11.12.2024 (Eintragungsdatum)\n\nNorddeutsche Reederei Holding GmbH & Co. KG\nKommanditgesellschaft\nHamburg\n\nAls nicht eingetragen wird bekannt gemacht:\nDen Gläubigern der an der Verschmelzung beteiligten Gesellschaften ist, wenn sie binnen sechs Monaten nach dem Tag, an dem die Eintragung der Verschmelzung in das Register des Sitzes desjenigen Rechtsträgers, dessen Gläubiger sie sind, nach § 19 Absatz 3 UmwG als bekannt gemacht gilt, ihren Anspruch nach Grund und Höhe schriftlich anmelden, Sicherheit zu leisten, soweit sie nicht Befriedigung verlangen können. Dieses Recht steht den Gläubigern jedoch nur zu, wenn sie glaubhaft machen, dass durch die Verschmelzung die Erfüllung ihrer Forderung gefährdet wird."
    },
    {
      "date": "2024-12-11",
      "id": "96119",
      "original_text": "Registerbekanntmachung nach dem Umwandlungsgesetz\nHamburg Amtsgericht Hamburg HRA 93345\nNorddeutsche Reederei Holding GmbH & Co. KG – Hamburg",
      "type": "Registerbekanntmachung nach dem Umwandlungsgesetz",
      "state": "Hamburg",
      "amtsgericht": "Amtsgericht Hamburg",
      "registernummer": "HRA 93345",
      "registerart": "HRA",
      "company_name": "Norddeutsche Reederei Holding GmbH & Co. KG",
      "company_seat": "Hamburg",
      "details": "11.12.2024 (Bekanntmachungsdatum)\n\nHamburg Amtsgericht Hamburg HRA 93345\nRegisterbekanntmachung nach dem Umwandlungsgesetz 11.12.2024 (Eintragungsdatum)\n\nNorddeutsche Reederei Holding GmbH & Co. KG\nKommanditgesellschaft\nHamburg\n\nAls nicht eingetragen wird bekannt gemacht:\nDen Gläubigern der an der Verschmelzung beteiligten Gesellschaften ist, wenn sie binnen sechs Monaten nach dem Tag, an dem die Eintragung der Verschmelzung in das Register des Sitzes desjenigen Rechtsträgers, dessen Gläubiger sie sind, nach § 19 Absatz 3 UmwG als bekannt gemacht gilt, ihren Anspruch nach Grund und Höhe schriftlich anmelden, Sicherheit zu leisten, soweit sie nicht Befriedigung verlangen können. Dieses Recht steht den Gläubigern jedoch nur zu, wenn sie glaubhaft machen, dass durch die Verschmelzung die Erfüllung ihrer Forderung gefährdet wird."
    },
    {
      "date": "2024-12-11",
      "id": "96120",
      "original_text": "Registerbekanntmachung nach dem Umwandlungsgesetz\nHamburg Amtsgericht Hamburg HRA 93345\nNorddeutsche Reederei Holding GmbH & Co. KG – Hamburg",
      "type": "Registerbekanntmachung nach dem Umwandlungsgesetz",
      "state": "Hamburg",
      "amtsgericht": "Amtsgericht Hamburg",
      "registernummer": "HRA 93345",
      "registerart": "HRA",
      "company_name": "Norddeutsche Reederei Holding GmbH & Co. KG",
      "company_seat": "Hamburg",
      "details": "11.12.2024 (Bekanntmachungsdatum)\n\nHamburg Amtsgericht Hamburg HRA 93345\nRegisterbekanntmachung nach dem Umwandlungsgesetz 11.12.2024 (Eintragungsdatum)\n\nNorddeutsche Reederei Holding GmbH & Co. KG\nKommanditgesellschaft\nHamburg\n\nAls nicht eingetragen wird bekannt gemacht:\nDen Gläubigern der an der Verschmelzung beteiligten Gesellschaften ist, wenn sie binnen sechs Monaten nach dem Tag, an dem die Eintragung der Verschmelzung in das Register des Sitzes desjenigen Rechtsträgers, dessen Gläubiger sie sind, nach § 19 Absatz 3 UmwG als bekannt gemacht gilt, ihren Anspruch nach Grund und Höhe schriftlich anmelden, Sicherheit zu leisten, soweit sie nicht Befriedigung verlangen können. Dieses Recht steht den Gläubigern jedoch nur zu, wenn sie glaubhaft machen, dass durch die Verschmelzung die Erfüllung ihrer Forderung gefährdet wird."
    },
    {
      "date": "2024-12-11",
      "id": "96121",
      "original_text": "Registerbekanntmachung nach dem Umwandlungsgesetz\nSchleswig-Holstein Amtsgericht Pinneberg HRB 3101\nHans Wörmcke GmbH – Heist",
      "type": "Registerbekanntmachung nach dem Umwandlungsgesetz",
      "state": "Schleswig-Holstein",
      "amtsgericht": "Amtsgericht Pinneberg",
      "registernummer": "HRB 3101",
      "registerart": "HRB",
      "company_name": "Hans Wörmcke GmbH",
      "company_seat": "Heist",
      "details": "11.12.2024 (Bekanntmachungsdatum)\n\nSchleswig-Holstein Amtsgericht Pinneberg HRB 3101\nRegisterbekanntmachung nach dem Umwandlungsgesetz 05.12.2024 (Eintragungsdatum)\n\nHans Wörmcke GmbH\nGesellschaft mit beschränkter Haftung\nHeist\n\nZu Eintragungsnummer 6 vom 05.12.2024 wird als nicht eingetragen veröffentlicht:  Als nicht eingetragen wird veröffentlicht: Den Gläubigern der an der Spaltung beteiligten Rechtsträger ist, wenn sie binnen sechs Monaten nach dem Tag, an dem die Eintragung der Spaltung in das Register des Sitzes desjenigen Rechtsträgers, dessen Gläubiger sie sind, als bekannt gemacht gilt, ihren Anspruch nach Grund und Höhe schriftlich anmelden, Sicherheit zu leisten, soweit sie nicht Befriedigung verlangen können. Dieses Recht steht den Gläubigern jedoch nur zu, wenn sie glaubhaft machen, dass durch die Spaltung die Erfüllung ihrer Forderung gefährdet wird. Das Recht, Sicherheitsleistung zu verlangen, steht Gläubigern nicht zu, die im Falle der Insolvenz ein Recht auf vorzugsweise Befriedigung aus einer Deckungsmasse haben, die nach gesetzlicher Vorschrift zu ihrem Schutz errichtet und staatlich überwacht ist."
    },
    {
      "date": "2024-12-11",
      "id": "96122",
      "original_text": "Registerbekanntmachung nach dem Umwandlungsgesetz\nMecklenburg-Vorpommern Amtsgericht Stralsund HRB 21860\nFT Mukran Concrete GmbH – Sassnitz",
      "type": "Registerbekanntmachung nach dem Umwandlungsgesetz",
      "state": "Mecklenburg-Vorpommern",
      "amtsgericht": "Amtsgericht Stralsund",
      "registernummer": "HRB 21860",
      "registerart": "HRB",
      "company_name": "FT Mukran Concrete GmbH",
      "company_seat": "Sassnitz",
      "details": "11.12.2024 (Bekanntmachungsdatum)\n\nMecklenburg-Vorpommern Amtsgericht Stralsund HRB 21860\nRegisterbekanntmachung nach dem Umwandlungsgesetz 11.12.2024 (Eintragungsdatum)\n\nFT Mukran Concrete GmbH\nGesellschaft mit beschränkter Haftung\nSassnitz\n\nAls nicht eingetragen wird veröffentlicht: Den Gläubigern der an der Verschmelzung beteiligten Rechtsträger ist, wenn sie binnen sechs Monaten nach dem Tag, an dem die Eintragung der Verschmelzung in das Register des Sitzes desjenigen Rechtsträgers, dessen Gläubiger sie sind, nach § 19 Abs. 3 UmwG als bekannt gemacht gilt,\nihren Anspruch nach Grund und Höhe schriftlich anmelden, Sicherheit zu leisten, soweit sie nicht Befriedigung verlangen können. Dieses Recht steht den Gläubigern jedoch nur zu, wenn sie glaubhaft machen, dass durch die Verschmelzung die Erfüllung der Forderung gefährdet wird."
    },
    {
      "date": "2024-12-11",
      "id": "96123",
      "original_text": "Registerbekanntmachung nach dem Umwandlungsgesetz\nMecklenburg-Vorpommern Amtsgericht Rostock HRA 5145\nUGE Kemmen Eins GmbH & Co. KG Umweltgerechte Energie – Lohmen",
      "type": "Registerbekanntmachung nach dem Umwandlungsgesetz",
      "state": "Mecklenburg-Vorpommern",
      "amtsgericht": "Amtsgericht Rostock",
      "registernummer": "HRA 5145",
      "registerart": "HRA",
      "company_name": "UGE Kemmen Eins GmbH & Co. KG Umweltgerechte Energie",
      "company_seat": "Lohmen",
      "details": "11.12.2024 (Bekanntmachungsdatum)\n\nMecklenburg-Vorpommern Amtsgericht Rostock HRA 5145\nRegisterbekanntmachung nach dem Umwandlungsgesetz 11.12.2024 (Eintragungsdatum)\n\nUGE Kemmen Eins GmbH & Co. KG Umweltgerechte Energie\nKommanditgesellschaft\nLohmen\n\nAls nicht eingetragen wird veröffentlicht: Den Gläubigern der an der Verschmelzung beteiligten Rechtsträger ist, wenn sie binnen sechs Monaten nach dem Tag, an dem die Eintragung der Verschmelzung in das Register des Sitzes desjenigen Rechtsträgers, dessen Gläubiger sie sind, nach § 19 Abs. 3 UmwG als bekannt gemacht gilt,\nihren Anspruch nach Grund und Höhe schriftlich anmelden, Sicherheit zu leisten, soweit sie nicht Befriedigung verlangen können. Dieses Recht steht den Gläubigern jedoch nur zu, wenn sie glaubhaft machen, dass durch die Verschmelzung die Erfüllung der Forderung gefährdet wird."
    },
    {
      "date": "2024-12-11",
      "id": "96124",
      "original_text": "Registerbekanntmachung nach dem Umwandlungsgesetz\nMecklenburg-Vorpommern Amtsgericht Rostock HRA 5148\nUGE Kemmen Drei GmbH & Co. KG Umweltgerechte Energie – Lohmen",
      "type": "Registerbekanntmachung nach dem Umwandlungsgesetz",
      "state": "Mecklenburg-Vorpommern",
      "amtsgericht": "Amtsgericht Rostock",
      "registernummer": "HRA 5148",
      "registerart": "HRA",
      "company_name": "UGE Kemmen Drei GmbH & Co. KG Umweltgerechte Energie",
      "company_seat": "Lohmen",
      "details": "11.12.2024 (Bekanntmachungsdatum)\n\nMecklenburg-Vorpommern Amtsgericht Rostock HRA 5148\nRegisterbekanntmachung nach dem Umwandlungsgesetz 11.12.2024 (Eintragungsdatum)\n\nUGE Kemmen Drei GmbH & Co. KG Umweltgerechte Energie\nKommanditgesellschaft\nLohmen\n\nAls nicht eingetragen wird veröffentlicht: Den Gläubigern der an der Verschmelzung beteiligten Rechtsträger ist, wenn sie binnen sechs Monaten nach dem Tag, an dem die Eintragung der Verschmelzung in das Register des Sitzes desjenigen Rechtsträgers, dessen Gläubiger sie sind, nach § 19 Abs. 3 UmwG als bekannt gemacht gilt,\nihren Anspruch nach Grund und Höhe schriftlich anmelden, Sicherheit zu leisten, soweit sie nicht Befriedigung verlangen können. Dieses Recht steht den Gläubigern jedoch nur zu, wenn sie glaubhaft machen, dass durch die Verschmelzung die Erfüllung der Forderung gefährdet wird."
    },
    {
      "date": "2024-12-11",
      "id": "96125",
      "original_text": "Registerbekanntmachung nach dem Umwandlungsgesetz\nMecklenburg-Vorpommern Amtsgericht Rostock HRA 5147\nUGE Kemmen Zwei GmbH & Co. KG Umweltgerechte Energie – Lohmen",
      "type": "Registerbekanntmachung nach dem Umwandlungsgesetz",
      "state": "Mecklenburg-Vorpommern",
      "amtsgericht": "Amtsgericht Rostock",
      "registernummer": "HRA 5147",
      "registerart": "HRA",
      "company_name": "UGE Kemmen Zwei GmbH & Co. KG Umweltgerechte Energie",
      "company_seat": "Lohmen",
      "details": "11.12.2024 (Bekanntmachungsdatum)\n\nMecklenburg-Vorpommern Amtsgericht Rostock HRA 5147\nRegisterbekanntmachung nach dem Umwandlungsgesetz 11.12.2024 (Eintragungsdatum)\n\nUGE Kemmen Zwei GmbH & Co. KG Umweltgerechte Energie\nKommanditgesellschaft\nLohmen\n\nAls nicht eingetragen wird veröffentlicht: Den Gläubigern der an der Verschmelzung beteiligten Rechtsträger ist, wenn sie binnen sechs Monaten nach dem Tag, an dem die Eintragung der Verschmelzung in das Register des Sitzes desjenigen Rechtsträgers, dessen Gläubiger sie sind, nach § 19 Abs. 3 UmwG als bekannt gemacht gilt,\nihren Anspruch nach Grund und Höhe schriftlich anmelden, Sicherheit zu leisten, soweit sie nicht Befriedigung verlangen können. Dieses Recht steht den Gläubigern jedoch nur zu, wenn sie glaubhaft machen, dass durch die Verschmelzung die Erfüllung der Forderung gefährdet wird."
    },
    {
      "date": "2024-12-11",
      "id": "96126",
      "original_text": "Löschungsankündigung\nSachsen Amtsgericht Chemnitz HRB 24898\nEHG-tec. UG (haftungsbeschränkt) – Bad Schlema",
      "type": "Löschungsankündigung",
      "state": "Sachsen",
      "amtsgericht": "Amtsgericht Chemnitz",
      "registernummer": "HRB 24898",
      "registerart": "HRB",
      "company_name": "EHG-tec. UG (haftungsbeschränkt)",
      "company_seat": "Bad Schlema",
      "details": "11.12.2024 (Bekanntmachungsdatum)\n\nSachsen Amtsgericht Chemnitz HRB 24898\nLöschungsankündigung\n\nEHG-tec. UG (haftungsbeschränkt)\nGesellschaft mit beschränkter Haftung\nBad Schlema\n\nDas Registergericht beabsichtigt, die im Handelsregister eingetragene Gesellschaft von Amts wegen nach § 394 FamFG zu löschen. Die Frist zu Erhebung eines Widerspruchs gegen die beabsichtigte Löschung wird auf einen Monat festgesetzt."
    },
    {
      "date": "2024-12-11",
      "id": "96127",
      "original_text": "Registerbekanntmachung nach dem Umwandlungsgesetz\nSachsen Amtsgericht Chemnitz HRB 27371\nM. Simon Beteiligungs GmbH – Grünhainichen",
      "type": "Registerbekanntmachung nach dem Umwandlungsgesetz",
      "state": "Sachsen",
      "amtsgericht": "Amtsgericht Chemnitz",
      "registernummer": "HRB 27371",
      "registerart": "HRB",
      "company_name": "M. Simon Beteiligungs GmbH",
      "company_seat": "Grünhainichen",
      "details": "11.12.2024 (Bekanntmachungsdatum)\n\nSachsen Amtsgericht Chemnitz HRB 27371\nRegisterbekanntmachung nach dem Umwandlungsgesetz 11.12.2024 (Eintragungsdatum)\n\nM. Simon Beteiligungs GmbH\nGesellschaft mit beschränkter Haftung\nGrünhainichen\n\nDen Gläubigern der an der Verschmelzung beteiligten Rechtsträger ist, wenn sie binnen sechs Monaten nach dem Tag, an dem die Eintragung der Verschmelzung in das Register des Sitzes desjenigen Rechtsträgers, dessen Gläubiger sie sind, nach § 19 Abs. 3 UmwG als bekannt gemacht gilt, ihren Anspruch nach Grund und Höhe schriftlich anmelden, Sicherheit zu leisten, soweit sie nicht Befriedigung verlangen können. Dieses Recht steht den Gläubigern jedoch nur zu, wenn sie glaubhaft machen, dass durch die Verschmelzung die Erfüllung der Forderung gefährdet wird."
    },
    {
      "date": "2024-12-11",
      "id": "96128",
      "original_text": "Einreichung neuer Dokumente\nSachsen Amtsgericht Chemnitz HRB 22943\nGemeinnützige Servicegesellschaft Seniorenheime Freiberg mit beschränkter Haftung – Freiberg",
      "type": "Einreichung neuer Dokumente",
      "state": "Sachsen",
      "amtsgericht": "Amtsgericht Chemnitz",
      "registernummer": "HRB 22943",
      "registerart": "HRB",
      "company_name": "Gemeinnützige Servicegesellschaft Seniorenheime Freiberg mit beschränkter Haftung",
      "company_seat": "Freiberg",
      "details": "11.12.2024 (Bekanntmachungsdatum)\n\nSachsen Amtsgericht Chemnitz HRB 22943\nEinreichung neuer Dokumente\n\nGemeinnützige Servicegesellschaft Seniorenheime Freiberg mit beschränkter Haftung\nGesellschaft mit beschränkter Haftung\nFreiberg\n\nAm 04.12.2024 wurde beim Handelsregister des Amtsgerichts Chemnitz die Liste der Mitglieder des Aufsichtsrats gemäß § 52 GmbHG eingereicht."
    },
    {
      "date": "2024-12-11",
      "id": "96129",
      "original_text": "Einreichung neuer Dokumente\nSachsen Amtsgericht Chemnitz HRB 103628 früher Amtsgericht Leipzig\nWaldheimer Wohnungsbau- und Verwaltungsgesellschaft mbH – Waldheim",
      "type": "Einreichung neuer Dokumente",
      "state": "Sachsen",
      "amtsgericht": "Amtsgericht Chemnitz",
      "registernummer": "HRB 103628",
      "registerart": "HRB",
      "company_name": "Waldheimer Wohnungsbau- und Verwaltungsgesellschaft mbH",
      "company_seat": "Waldheim",
      "former_amtsgericht": "Leipzig",
      "details": "11.12.2024 (Bekanntmachungsdatum)\n\nSachsen Amtsgericht Chemnitz HRB 103628 früher Amtsgericht Leipzig\nEinreichung neuer Dokumente 09.12.2024 (Eintragungsdatum)\n\nWaldheimer Wohnungsbau- und Verwaltungsgesellschaft mbH\nGesellschaft mit beschränkter Haftung\nWaldheim\n\nAm 09.12.2024 wurde beim Handelsregister des Amtsgerichts Chemnitz die Liste der Mitglieder des Aufsichtsrats gemäß § 52 GmbHG eingereicht."
    },
    {
      "date": "2024-12-11",
      "id": "96130",
      "original_text": "Löschungsankündigung\nSachsen Amtsgericht Dresden HRB 25952\nD.R. Handels GmbH – Dresden",
      "type": "Löschungsankündigung",
      "state": "Sachsen",
      "amtsgericht": "Amtsgericht Dresden",
      "registernummer": "HRB 25952",
      "registerart": "HRB",
      "company_name": "D.R. Handels GmbH",
      "company_seat": "Dresden",
      "details": "11.12.2024 (Bekanntmachungsdatum)\n\nSachsen Amtsgericht Dresden HRB 25952\nLöschungsankündigung\n\nD.R. Handels GmbH\nGesellschaft mit beschränkter Haftung\nDresden\n\nDas Registergericht beabsichtigt, die im Handelsregister eingetragene Gesellschaft von Amts wegen nach § 394 FamFG zu löschen. Die Frist zu Erhebung eines Widerspruchs gegen die beabsichtigte Löschung wird auf einen Monat festgesetzt."
    },
    {
      "date": "2024-12-11",
      "id": "96131",
      "original_text": "Registerbekanntmachung nach dem Umwandlungsgesetz\nSachsen Amtsgericht Chemnitz HRA 7489\nM. Simon Gebäudemanagement GmbH & Co. KG – Grünhainichen",
      "type": "Registerbekanntmachung nach dem Umwandlungsgesetz",
      "state": "Sachsen",
      "amtsgericht": "Amtsgericht Chemnitz",
      "registernummer": "HRA 7489",
      "registerart": "HRA",
      "company_name": "M. Simon Gebäudemanagement GmbH & Co. KG",
      "company_seat": "Grünhainichen",
      "details": "11.12.2024 (Bekanntmachungsdatum)\n\nSachsen Amtsgericht Chemnitz HRA 7489\nRegisterbekanntmachung nach dem Umwandlungsgesetz 11.12.2024 (Eintragungsdatum)\n\nM. Simon Gebäudemanagement GmbH & Co. KG\nKommanditgesellschaft\nGrünhainichen\n\nDen Gläubigern der an der Verschmelzung beteiligten Rechtsträger ist, wenn sie binnen sechs Monaten nach dem Tag, an dem die Eintragung der Verschmelzung in das Register des Sitzes desjenigen Rechtsträgers, dessen Gläubiger sie sind, nach § 19 Abs. 3 UmwG als bekannt gemacht gilt, ihren Anspruch nach Grund und Höhe schriftlich anmelden, Sicherheit zu leisten, soweit sie nicht Befriedigung verlangen können. Dieses Recht steht den Gläubigern jedoch nur zu, wenn sie glaubhaft machen, dass durch die Verschmelzung die Erfüllung der Forderung gefährdet wird."
    },
    {
      "date": "2024-12-11",
      "id": "96132",
      "original_text": "Einreichung neuer Dokumente\nSachsen Amtsgericht Chemnitz HRB 6992\nZEZ Elektronik - Zentrum - Zwickau GmbH – Zwickau",
      "type": "Einreichung neuer Dokumente",
      "state": "Sachsen",
      "amtsgericht": "Amtsgericht Chemnitz",
      "registernummer": "HRB 6992",
      "registerart": "HRB",
      "company_name": "ZEZ Elektronik - Zentrum - Zwickau GmbH",
      "company_seat": "Zwickau",
      "details": "11.12.2024 (Bekanntmachungsdatum)\n\nSachsen Amtsgericht Chemnitz HRB 6992\nEinreichung neuer Dokumente 11.12.2024 (Eintragungsdatum)\n\nZEZ Elektronik - Zentrum - Zwickau GmbH\nGesellschaft mit beschränkter Haftung\nZwickau\n\nAm 10.12.2024 wurde beim Handelsregister des Amtsgerichts Chemnitz die Liste der Mitglieder des Aufsichtsrats gemäß § 52 GmbHG eingereicht."
    },
    {
      "date": "2024-12-11",
      "id": "96133",
      "original_text": "Registerbekanntmachung nach dem Umwandlungsgesetz\nSachsen Amtsgericht Dresden HRB 4132\nLandwirtschaftsgesellschaft \"Am Schwarzwasser\"mbH – Göda",
      "type": "Registerbekanntmachung nach dem Umwandlungsgesetz",
      "state": "Sachsen",
      "amtsgericht": "Amtsgericht Dresden",
      "registernummer": "HRB 4132",
      "registerart": "HRB",
      "company_name": "Landwirtschaftsgesellschaft \"Am Schwarzwasser\"mbH",
      "company_seat": "Göda",
      "details": "11.12.2024 (Bekanntmachungsdatum)\n\nSachsen Amtsgericht Dresden HRB 4132\nRegisterbekanntmachung nach dem Umwandlungsgesetz 11.12.2024 (Eintragungsdatum)\n\nLandwirtschaftsgesellschaft \"Am Schwarzwasser\"mbH\nGesellschaft mit beschränkter Haftung\nGöda\n\nDen Gläubigern der an der Verschmelzung beteiligten Rechtsträger ist, wenn sie binnen sechs Monaten nach dem Tag, an dem die Eintragung der Verschmelzung in das Register des Sitzes desjenigen Rechtsträgers, dessen Gläubiger sie sind, nach § 19 Abs. 3 UmwG als bekannt gemacht gilt, ihren Anspruch nach Grund und Höhe schriftlich anmelden, Sicherheit zu leisten, soweit sie nicht Befriedigung verlangen können. Dieses Recht steht den Gläubigern jedoch nur zu, wenn sie glaubhaft machen, dass durch die Verschmelzung die Erfüllung der Forderung gefährdet wird."
    },
    {
      "date": "2024-12-11",
      "id": "96134",
      "original_text": "Registerbekanntmachung nach dem Umwandlungsgesetz\nSachsen Amtsgericht Dresden HRB 4125\nBudissa Agrarprodukte Preititz/Kleinbautzen GmbH – Malschwitz",
      "type": "Registerbekanntmachung nach dem Umwandlungsgesetz",
      "state": "Sachsen",
      "amtsgericht": "Amtsgericht Dresden",
      "registernummer": "HRB 4125",
      "registerart": "HRB",
      "company_name": "Budissa Agrarprodukte Preititz/Kleinbautzen GmbH",
      "company_seat": "Malschwitz",
      "details": "11.12.2024 (Bekanntmachungsdatum)\n\nSachsen Amtsgericht Dresden HRB 4125\nRegisterbekanntmachung nach dem Umwandlungsgesetz 11.12.2024 (Eintragungsdatum)\n\nBudissa Agrarprodukte Preititz/Kleinbautzen GmbH\nGesellschaft mit beschränkter Haftung\nMalschwitz\n\nDen Gläubigern der an der Verschmelzung beteiligten Rechtsträger ist, wenn sie binnen sechs Monaten nach dem Tag, an dem die Eintragung der Verschmelzung in das Register des Sitzes desjenigen Rechtsträgers, dessen Gläubiger sie sind, nach § 19 Abs. 3 UmwG als bekannt gemacht gilt, ihren Anspruch nach Grund und Höhe schriftlich anmelden, Sicherheit zu leisten, soweit sie nicht Befriedigung verlangen können. Dieses Recht steht den Gläubigern jedoch nur zu, wenn sie glaubhaft machen, dass durch die Verschmelzung die Erfüllung der Forderung gefährdet wird."
    },
    {
      "date": "2024-12-11",
      "id": "96135",
      "original_text": "Löschungsankündigung\nSchleswig-Holstein Amtsgericht Lübeck HRB 23516\nCAPSL GmbH – Reinfeld",
      "type": "Löschungsankündigung",
      "state": "Schleswig-Holstein",
      "amtsgericht": "Amtsgericht Lübeck",
      "registernummer": "HRB 23516",
      "registerart": "HRB",
      "company_name": "CAPSL GmbH",
      "company_seat": "Reinfeld",
      "details": "11.12.2024 (Bekanntmachungsdatum)\n\nSchleswig-Holstein Amtsgericht Lübeck HRB 23516\nLöschungsankündigung\n\nCAPSL GmbH\nGesellschaft mit beschränkter Haftung\nReinfeld\n\nHerrn\nMohsen Al Ziheiri\n\nPer Veröffentlichung\n\nSehr geehrter Herr Al Ziheiri,\n\nin der Handelsregistersache der\n\nCAPSL GmbH\n\nergeben sich aus den mir vorliegenden Unterlagen Anhaltspunkte dafür, dass die Gesellschaft, als deren Geschäftsführer Sie noch eingetragen sind, vermögenslos ist:\n\nDas Finanzamt Stormarn hat mit Schreiben vom 05.11.2024 die Löschung der obigen Firma aufgrund Vermögenslosigkeit beantragt.\n\nEs ist daher beabsichtigt, die Gesellschaft wegen Vermögenslosigkeit gemäß § 394 FamFG zu löschen.\n\nEs wird eine   Frist von drei Monaten   zur Geltendmachung eines Widerspruchs gegen die Löschung bestimmt, § 394 Abs. 2 S. 1 FamFG.\n\nNach Fristablauf ohne Widerspruch von Ihnen oder anderer Seite wird die Gesellschaft gelöscht.\n\nMit freundlichen Grüßen\n\nSchuppenhauer\nDipl.-Rechtspflegerin (FH)"
    },
    {
      "date": "2024-12-11",
      "id": "96136",
      "original_text": "Registerbekanntmachung nach dem Umwandlungsgesetz\nMecklenburg-Vorpommern Amtsgericht Rostock HRB 16792\nH.J. Meyer Feuerverzinkungs GmbH – Satow",
      "type": "Registerbekanntmachung nach dem Umwandlungsgesetz",
      "state": "Mecklenburg-Vorpommern",
      "amtsgericht": "Amtsgericht Rostock",
      "registernummer": "HRB 16792",
      "registerart": "HRB",
      "company_name": "H.J. Meyer Feuerverzinkungs GmbH",
      "company_seat": "Satow",
      "details": "11.12.2024 (Bekanntmachungsdatum)\n\nMecklenburg-Vorpommern Amtsgericht Rostock HRB 16792\nRegisterbekanntmachung nach dem Umwandlungsgesetz 11.12.2024 (Eintragungsdatum)\n\nH.J. Meyer Feuerverzinkungs GmbH\nGesellschaft mit beschränkter Haftung\nSatow\n\nAls nicht eingetragen wird veröffentlicht: Den Gläubigern der an der Umwandlung beteiligten Rechtsträger ist, wenn sie binnen sechs\nMonaten nach dem Tag, an dem die Eintragung der Umwandlung in das Register des Sitzes desjenigen Rechtsträgers, dessen Gläubiger sie sind, nach § 19 Abs. 3 UmwG als bekannt gemacht gilt, ihren Anspruch nach Grund und Höhe schriftlich anmelden, Sicherheit zu leisten, soweit sie nicht Befriedigung verlangen können. Dieses Recht steht den Gläubigern jedoch nur zu, wenn sie glaubhaft machen, dass durch die Umwandlung die Erfüllung der Forderung gefährdet wird."
    },
    {
      "date": "2024-12-11",
      "id": "96137",
      "original_text": "Registerbekanntmachung nach dem Umwandlungsgesetz\nMecklenburg-Vorpommern Amtsgericht Rostock HRA 973\nHans-Joachim Meyer Feuerverzinkungs GmbH & Co KG – Hohen Luckow",
      "type": "Registerbekanntmachung nach dem Umwandlungsgesetz",
      "state": "Mecklenburg-Vorpommern",
      "amtsgericht": "Amtsgericht Rostock",
      "registernummer": "HRA 973",
      "registerart": "HRA",
      "company_name": "Hans-Joachim Meyer Feuerverzinkungs GmbH & Co KG",
      "company_seat": "Hohen Luckow",
      "details": "11.12.2024 (Bekanntmachungsdatum)\n\nMecklenburg-Vorpommern Amtsgericht Rostock HRA 973\nRegisterbekanntmachung nach dem Umwandlungsgesetz 11.12.2024 (Eintragungsdatum)\n\nHans-Joachim Meyer Feuerverzinkungs GmbH & Co KG\nKommanditgesellschaft\nHohen Luckow\n\nAls nicht eingetragen wird veröffentlicht: Den Gläubigern der an der Umwandlung beteiligten Rechtsträger ist, wenn sie binnen sechs\nMonaten nach dem Tag, an dem die Eintragung der Umwandlung in das Register des Sitzes desjenigen Rechtsträgers, dessen Gläubiger sie sind, nach § 19 Abs. 3 UmwG als bekannt gemacht gilt, ihren Anspruch nach Grund und Höhe schriftlich anmelden, Sicherheit zu leisten, soweit sie nicht Befriedigung verlangen können. Dieses Recht steht den Gläubigern jedoch nur zu, wenn sie glaubhaft machen, dass durch die Umwandlung die Erfüllung der Forderung gefährdet wird."
    },
    {
      "date": "2024-12-11",
      "id": "96138",
      "original_text": "Registerbekanntmachung nach dem Umwandlungsgesetz\nNiedersachsen Amtsgericht Aurich HRA 204005\nBolhuis Wasserbau GmbH & Co. KG – Leezdorf",
      "type": "Registerbekanntmachung nach dem Umwandlungsgesetz",
      "state": "Niedersachsen",
      "amtsgericht": "Amtsgericht Aurich",
      "registernummer": "HRA 204005",
      "registerart": "HRA",
      "company_name": "Bolhuis Wasserbau GmbH & Co. KG",
      "company_seat": "Leezdorf",
      "details": "11.12.2024 (Bekanntmachungsdatum)\n\nNiedersachsen Amtsgericht Aurich HRA 204005\nRegisterbekanntmachung nach dem Umwandlungsgesetz 03.12.2024 (Eintragungsdatum)\n\nBolhuis Wasserbau GmbH & Co. KG\nKommanditgesellschaft\nLeezdorf\n\nDen Gläubigern der an der Vermögensübertragung beteiligten Rechtsträger ist, wenn sie binnen sechs Monaten nach dem Tag, an dem die Eintragung der Spaltung in das Register des Sitzes desjenigen Rechtsträgers, dessen Gläubiger sie sind, nach § 19 Abs. 3 UmwG als bekannt gemacht gilt, ihren Anspruch nach Grund und Höhe schriftlich anmelden, Sicherheit zu leisten, soweit sie nicht Befriedigung verlangen können. Dieses Recht steht den Gläubigern jedoch nur zu, wenn sie glaubhaft machen, dass durch die Spaltung die Erfüllung der Forderung gefährdet wird."
    },
    {
      "date": "2024-12-11",
      "id": "96139",
      "original_text": "Löschungsankündigung\nNiedersachsen Amtsgericht Hildesheim HRB 1440\nAutohaus Dammann GmbH – Hildesheim",
      "type": "Löschungsankündigung",
      "state": "Niedersachsen",
      "amtsgericht": "Amtsgericht Hildesheim",
      "registernummer": "HRB 1440",
      "registerart": "HRB",
      "company_name": "Autohaus Dammann GmbH",
      "company_seat": "Hildesheim",
      "details": "11.12.2024 (Bekanntmachungsdatum)\n\nNiedersachsen Amtsgericht Hildesheim HRB 1440\nLöschungsankündigung\n\nAutohaus Dammann GmbH\nGesellschaft mit beschränkter Haftung\nHildesheim\n\nDas Registergericht beabsichtigt, die Gesellschaft von Amts wegen nach § 394 FamFG zu löschen. Die Frist zur Erhebung eines Widerspruchs ist auf 1 Monat ab dieser Registerbekanntmachung festgesetzt."
    },
    {
      "date": "2024-12-11",
      "id": "96140",
      "original_text": "Löschungsankündigung\nNiedersachsen Amtsgericht Oldenburg (Oldenburg) HRA 207321\nFeuerstein Pizza GmbH & Co.KG – Oldenburg",
      "type": "Löschungsankündigung",
      "state": "Niedersachsen",
      "amtsgericht": "Amtsgericht Oldenburg (Oldenburg)",
      "registernummer": "HRA 207321",
      "registerart": "HRA",
      "company_name": "Feuerstein Pizza GmbH & Co.KG",
      "company_seat": "Oldenburg",
      "details": "11.12.2024 (Bekanntmachungsdatum)\n\nNiedersachsen Amtsgericht Oldenburg (Oldenburg) HRA 207321\nLöschungsankündigung\n\nFeuerstein Pizza GmbH & Co.KG\nKommanditgesellschaft\nOldenburg\n\nDas Registergericht beabsichtigt, die Firma von Amts wegen nach § 31 Abs. 2 Satz 2 HGB, § 393 FamFG zu löschen. Die Frist zur Erhebung eines Widerspruchs ist auf 1 Monat ab dieser Registerbekanntmachung festgesetzt."
    },
    {
      "date": "2024-12-11",
      "id": "96141",
      "original_text": "Registerbekanntmachung nach dem Umwandlungsgesetz\nNiedersachsen Amtsgericht Osnabrück GsR 700\nPhilipp Kraus und Nick Gärtner eGbR – Ostercappeln",
      "type": "Registerbekanntmachung nach dem Umwandlungsgesetz",
      "state": "Niedersachsen",
      "amtsgericht": "Amtsgericht Osnabrück",
      "registernummer": "GsR 700",
      "registerart": "GsR",
      "company_name": "Philipp Kraus und Nick Gärtner eGbR",
      "company_seat": "Ostercappeln",
      "details": "11.12.2024 (Bekanntmachungsdatum)\n\nNiedersachsen Amtsgericht Osnabrück GsR 700\nRegisterbekanntmachung nach dem Umwandlungsgesetz 11.12.2024 (Eintragungsdatum)\n\nPhilipp Kraus und Nick Gärtner eGbR\nGesellschaft bürgerlichen Rechts\nOstercappeln\n\nDen Gläubigern der an der formwechselnden Umwandlung beteiligten Rechtsträger ist, wenn sie binnen sechs Monaten nach dem Tag, an dem die Eintragung der Umwandlung in das Register des Sitzes desjenigen Rechtsträgers, dessen Gläubiger sie sind, nach § 19 Abs. 3 UmwG als bekannt gemacht gilt, ihren Anspruch nach Grund und Höhe schriftlich anmelden, Sicherheit zu leisten, soweit sie nicht Befriedigung verlangen können. Dieses Recht steht den Gläubigern jedoch nur zu, wenn sie glaubhaft machen, dass durch die formwechselnde Umwandlung die Erfüllung der Forderung gefährdet wird."
    },
    {
      "date": "2024-12-11",
      "id": "96142",
      "original_text": "Einreichung neuer Dokumente\nNiedersachsen Amtsgericht Braunschweig HRB 100769 früher Amtsgericht Wolfsburg\nAvacon AG – Helmstedt",
      "type": "Einreichung neuer Dokumente",
      "state": "Niedersachsen",
      "amtsgericht": "Amtsgericht Braunschweig",
      "registernummer": "HRB 100769",
      "registerart": "HRB",
      "company_name": "Avacon AG",
      "company_seat": "Helmstedt",
      "former_amtsgericht": "Wolfsburg",
      "details": "11.12.2024 (Bekanntmachungsdatum)\n\nNiedersachsen Amtsgericht Braunschweig HRB 100769 früher Amtsgericht Wolfsburg\nEinreichung neuer Dokumente 11.12.2024 (Eintragungsdatum)\n\nAvacon AG\nAktiengesellschaft\nHelmstedt\n\nDie Liste der Mitglieder des Aufsichtsrats wurde beim Registergericht eingereicht."
    },
    {
      "date": "2024-12-11",
      "id": "96143",
      "original_text": "Registerbekanntmachung nach dem Umwandlungsgesetz\nNiedersachsen Amtsgericht Hildesheim HRB 205371\nIndividuelle Projektentwicklung Integrat UG (haftungsbeschränkt) – Holle",
      "type": "Registerbekanntmachung nach dem Umwandlungsgesetz",
      "state": "Niedersachsen",
      "amtsgericht": "Amtsgericht Hildesheim",
      "registernummer": "HRB 205371",
      "registerart": "HRB",
      "company_name": "Individuelle Projektentwicklung Integrat UG (haftungsbeschränkt)",
      "company_seat": "Holle",
      "details": "11.12.2024 (Bekanntmachungsdatum)\n\nNiedersachsen Amtsgericht Hildesheim HRB 205371\nRegisterbekanntmachung nach dem Umwandlungsgesetz 11.12.2024 (Eintragungsdatum)\n\nIndividuelle Projektentwicklung Integrat UG (haftungsbeschränkt)\nGesellschaft mit beschränkter Haftung\nHolle\n\nDen Gläubigern der an der Verschmelzung beteiligten Rechtsträger ist, wenn sie binnen sechs Monaten nach dem Tag, an dem die Eintragung der Verschmelzung in das Register des Sitzes desjenigen Rechtsträgers, dessen Gläubiger sie sind, nach § 19  Abs.  3 UmwG als bekannt gemacht gilt, ihren Anspruch nach Grund und Höhe schriftlich anmelden, Sicherheit zu leisten, soweit sie nicht Befriedigung verlangen können. Dieses Recht steht den Gläubigern jedoch nur zu, wenn sie glaubhaft machen, dass durch die Verschmelzung die Erfüllung der Forderung gefährdet wird."
    },
    {
      "date": "2024-12-11",
      "id": "96144",
      "original_text": "Einreichung neuer Dokumente\nNiedersachsen Amtsgericht Hannover HRB 3768\nNiedersächsische Landgesellschaft mbH – Hannover",
      "type": "Einreichung neuer Dokumente",
      "state": "Niedersachsen",
      "amtsgericht": "Amtsgericht Hannover",
      "registernummer": "HRB 3768",
      "registerart": "HRB",
      "company_name": "Niedersächsische Landgesellschaft mbH",
      "company_seat": "Hannover",
      "details": "11.12.2024 (Bekanntmachungsdatum)\n\nNiedersachsen Amtsgericht Hannover HRB 3768\nEinreichung neuer Dokumente\n\nNiedersächsische Landgesellschaft mbH\nGesellschaft mit beschränkter Haftung\nHannover\n\nDie Liste der Mitglieder des Aufsichtsrats wurde beim Registergericht eingereicht."
    },
    {
      "date": "2024-12-11",
      "id": "96145",
      "original_text": "Registerbekanntmachung nach dem Umwandlungsgesetz\nNiedersachsen Amtsgericht Tostedt HRB 211227\niDesign GmbH – Buxtehude",
      "type": "Registerbekanntmachung nach dem Umwandlungsgesetz",
      "state": "Niedersachsen",
      "amtsgericht": "Amtsgericht Tostedt",
      "registernummer": "HRB 211227",
      "registerart": "HRB",
      "company_name": "iDesign GmbH",
      "company_seat": "Buxtehude",
      "details": "11.12.2024 (Bekanntmachungsdatum)\n\nNiedersachsen Amtsgericht Tostedt HRB 211227\nRegisterbekanntmachung nach dem Umwandlungsgesetz 11.12.2024 (Eintragungsdatum)\n\niDesign GmbH\nGesellschaft mit beschränkter Haftung\nBuxtehude\n\nDen Gläubigern der an der Ausgliederung beteiligten Rechtsträger ist, wenn sie binnen sechs Monaten nach dem Tag, an dem die Eintragung der Ausgliederung in das Register des Sitzes desjenigen Rechtsträgers, dessen Gläubiger sie sind, nach § 19 Abs. 3 UmwG als bekannt gemacht gilt, ihren Anspruch nach Grund und Höhe schriftlich anmelden, Sicherheit zu leisten, soweit sie nicht Befriedigung verlangen können. Dieses Recht steht den Gläubigern jedoch nur zu, wenn sie glaubhaft machen, dass durch die Ausgliederung die Erfüllung der Forderung gefährdet wird."
    },
    {
      "date": "2024-12-11",
      "id": "96146",
      "original_text": "Registerbekanntmachung nach dem Umwandlungsgesetz\nNiedersachsen Amtsgericht Osnabrück HRB 212696\nbrandence Verwaltungsgesellschaft mbH – Osnabrück",
      "type": "Registerbekanntmachung nach dem Umwandlungsgesetz",
      "state": "Niedersachsen",
      "amtsgericht": "Amtsgericht Osnabrück",
      "registernummer": "HRB 212696",
      "registerart": "HRB",
      "company_name": "brandence Verwaltungsgesellschaft mbH",
      "company_seat": "Osnabrück",
      "details": "11.12.2024 (Bekanntmachungsdatum)\n\nNiedersachsen Amtsgericht Osnabrück HRB 212696\nRegisterbekanntmachung nach dem Umwandlungsgesetz 11.12.2024 (Eintragungsdatum)\n\nbrandence Verwaltungsgesellschaft mbH\nGesellschaft mit beschränkter Haftung\nOsnabrück\n\nDen Gläubigern der an der Verschmelzung beteiligten Rechtsträger ist, wenn sie binnen sechs Monaten nach dem Tag, an dem die Eintragung der Verschmelzung in das Register des Sitzes desjenigen Rechtsträgers, dessen Gläubiger sie sind, nach § 19  Abs.  3 UmwG als bekannt gemacht gilt, ihren Anspruch nach Grund und Höhe schriftlich anmelden, Sicherheit zu leisten, soweit sie nicht Befriedigung verlangen können. Dieses Recht steht den Gläubigern jedoch nur zu, wenn sie glaubhaft machen, dass durch die Verschmelzung die Erfüllung der Forderung gefährdet wird."
    },
    {
      "date": "2024-12-11",
      "id": "96147",
      "original_text": "Registerbekanntmachung nach dem Umwandlungsgesetz\nNiedersachsen Amtsgericht Aurich HRA 204003\nRobert Bolhuis e. K. Kultur-Tiefbau – Leezdorf",
      "type": "Registerbekanntmachung nach dem Umwandlungsgesetz",
      "state": "Niedersachsen",
      "amtsgericht": "Amtsgericht Aurich",
      "registernummer": "HRA 204003",
      "registerart": "HRA",
      "company_name": "Robert Bolhuis e. K. Kultur-Tiefbau",
      "company_seat": "Leezdorf",
      "details": "11.12.2024 (Bekanntmachungsdatum)\n\nNiedersachsen Amtsgericht Aurich HRA 204003\nRegisterbekanntmachung nach dem Umwandlungsgesetz 03.12.2024 (Eintragungsdatum)\n\nRobert Bolhuis e. K. Kultur-Tiefbau\nEinzelkaufmann / Einzelkauffrau\nLeezdorf\n\nDen Gläubigern der an der Vermögensübertragung beteiligten Rechtsträger ist, wenn sie binnen sechs Monaten nach dem Tag, an dem die Eintragung der Spaltung in das Register des Sitzes desjenigen Rechtsträgers, dessen Gläubiger sie sind, nach § 19 Abs. 3 UmwG als bekannt gemacht gilt, ihren Anspruch nach Grund und Höhe schriftlich anmelden, Sicherheit zu leisten, soweit sie nicht Befriedigung verlangen können. Dieses Recht steht den Gläubigern jedoch nur zu, wenn sie glaubhaft machen, dass durch die Spaltung die Erfüllung der Forderung gefährdet wird."
    },
    {
      "date": "2024-12-11",
      "id": "96148",
      "original_text": "Registerbekanntmachung nach dem Umwandlungsgesetz\nNiedersachsen Amtsgericht Osnabrück HRB 221135\nFebix GmbH – Ostercappeln",
      "type": "Registerbekanntmachung nach dem Umwandlungsgesetz",
      "state": "Niedersachsen",
      "amtsgericht": "Amtsgericht Osnabrück",
      "registernummer": "HRB 221135",
      "registerart": "HRB",
      "company_name": "Febix GmbH",
      "company_seat": "Ostercappeln",
      "details": "11.12.2024 (Bekanntmachungsdatum)\n\nNiedersachsen Amtsgericht Osnabrück HRB 221135\nRegisterbekanntmachung nach dem Umwandlungsgesetz 11.12.2024 (Eintragungsdatum)\n\nFebix GmbH\nGesellschaft mit beschränkter Haftung\nOstercappeln\n\nDen Gläubigern der an der formwechselnden Umwandlung beteiligten Rechtsträger ist, wenn sie binnen sechs Monaten nach dem Tag, an dem die Eintragung der Umwandlung in das Register des Sitzes desjenigen Rechtsträgers, dessen Gläubiger sie sind, nach § 19 Abs. 3 UmwG als bekannt gemacht gilt, ihren Anspruch nach Grund und Höhe schriftlich anmelden, Sicherheit zu leisten, soweit sie nicht Befriedigung verlangen können. Dieses Recht steht den Gläubigern jedoch nur zu, wenn sie glaubhaft machen, dass durch die formwechselnde Umwandlung die Erfüllung der Forderung gefährdet wird."
    },
    {
      "date": "2024-12-11",
      "id": "96149",
      "original_text": "Registerbekanntmachung nach dem Umwandlungsgesetz\nNiedersachsen Amtsgericht Tostedt HRA 205422\nUgur Ipek Design e.K. – Buxtehude",
      "type": "Registerbekanntmachung nach dem Umwandlungsgesetz",
      "state": "Niedersachsen",
      "amtsgericht": "Amtsgericht Tostedt",
      "registernummer": "HRA 205422",
      "registerart": "HRA",
      "company_name": "Ugur Ipek Design e.K.",
      "company_seat": "Buxtehude",
      "details": "11.12.2024 (Bekanntmachungsdatum)\n\nNiedersachsen Amtsgericht Tostedt HRA 205422\nRegisterbekanntmachung nach dem Umwandlungsgesetz 11.12.2024 (Eintragungsdatum)\n\nUgur Ipek Design e.K.\nEinzelkaufmann / Einzelkauffrau\nBuxtehude\n\nDen Gläubigern der an der Ausgliederung beteiligten Rechtsträger ist, wenn sie binnen sechs Monaten nach dem Tag, an dem die Eintragung der Ausgliederung in das Register des Sitzes desjenigen Rechtsträgers, dessen Gläubiger sie sind, nach § 19 Abs. 3 UmwG als bekannt gemacht gilt, ihren Anspruch nach Grund und Höhe schriftlich anmelden, Sicherheit zu leisten, soweit sie nicht Befriedigung verlangen können. Dieses Recht steht den Gläubigern jedoch nur zu, wenn sie glaubhaft machen, dass durch die Ausgliederung die Erfüllung der Forderung gefährdet wird."
    },
    {
      "date": "2024-12-11",
      "id": "96150",
      "original_text": "Registerbekanntmachung nach dem Umwandlungsgesetz\nBremen Amtsgericht Bremen HRB 40968\nFEEMAX GmbH – Bremen",
      "type": "Registerbekanntmachung nach dem Umwandlungsgesetz",
      "state": "Bremen",
      "amtsgericht": "Amtsgericht Bremen",
      "registernummer": "HRB 40968",
      "registerart": "HRB",
      "company_name": "FEEMAX GmbH",
      "company_seat": "Bremen",
      "details": "11.12.2024 (Bekanntmachungsdatum)\n\nBremen Amtsgericht Bremen HRB 40968\nRegisterbekanntmachung nach dem Umwandlungsgesetz 09.12.2024 (Eintragungsdatum)\n\nFEEMAX GmbH\nGesellschaft mit beschränkter Haftung\nBremen\n\nZu Eintragungsnummer 1 vom 09.12.2024 wird als nicht eingetragen veröffentlicht: Den Gläubigern der an der Spaltung beteiligten Rechtsträger ist, wenn sie binnen sechs Monaten nach dem Tag, an dem die Eintragung der Spaltung in das Register des Sitzes desjenigen Rechtsträgers, dessen Gläubiger sie sind, als bekannt gemacht gilt, ihren Anspruch nach Grund und Höhe schriftlich anmelden, Sicherheit zu leisten, soweit sie nicht Befriedigung verlangen können. Dieses Recht steht den Gläubigern jedoch nur zu, wenn sie glaubhaft machen, dass durch die Spaltung die Erfüllung ihrer Forderung gefährdet wird. Das Recht, Sicherheitsleistung zu verlangen, steht Gläubigern nicht zu, die im Falle der Insolvenz ein Recht auf vorzugsweise Befriedigung aus einer Deckungsmasse haben, die nach gesetzlicher Vorschrift zu ihrem Schutz errichtet und staatlich überwacht ist."
    },
    {
      "date": "2024-12-11",
      "id": "96151",
      "original_text": "Registerbekanntmachung nach dem Umwandlungsgesetz\nBremen Amtsgericht Bremen HRA 30284\nFEEMAX e.Kfr. – Bremen",
      "type": "Registerbekanntmachung nach dem Umwandlungsgesetz",
      "state": "Bremen",
      "amtsgericht": "Amtsgericht Bremen",
      "registernummer": "HRA 30284",
      "registerart": "HRA",
      "company_name": "FEEMAX e.Kfr.",
      "company_seat": "Bremen",
      "details": "11.12.2024 (Bekanntmachungsdatum)\n\nBremen Amtsgericht Bremen HRA 30284\nRegisterbekanntmachung nach dem Umwandlungsgesetz 09.12.2024 (Eintragungsdatum)\n\nFEEMAX e.Kfr.\nEinzelkaufmann / Einzelkauffrau\nBremen\n\nZu Eintragungsnummer 2 vom 09.12.2024 wird als nicht eingetragen veröffentlicht: Den Gläubigern der an der Spaltung beteiligten Rechtsträger ist, wenn sie binnen sechs Monaten nach dem Tag, an dem die Eintragung der Spaltung in das Register des Sitzes desjenigen Rechtsträgers, dessen Gläubiger sie sind, als bekannt gemacht gilt, ihren Anspruch nach Grund und Höhe schriftlich anmelden, Sicherheit zu leisten, soweit sie nicht Befriedigung verlangen können. Dieses Recht steht den Gläubigern jedoch nur zu, wenn sie glaubhaft machen, dass durch die Spaltung die Erfüllung ihrer Forderung gefährdet wird. Das Recht, Sicherheitsleistung zu verlangen, steht Gläubigern nicht zu, die im Falle der Insolvenz ein Recht auf vorzugsweise Befriedigung aus einer Deckungsmasse haben, die nach gesetzlicher Vorschrift zu ihrem Schutz errichtet und staatlich überwacht ist."
    },
    {
      "date": "2024-12-11",
      "id": "96152",
      "original_text": "Löschungsankündigung\nRheinland-Pfalz Amtsgericht Zweibrücken HRA 30189\nWASA Wohnen GmbH & Co KG – Waldfischbach-Burgalben",
      "type": "Löschungsankündigung",
      "state": "Rheinland-Pfalz",
      "amtsgericht": "Amtsgericht Zweibrücken",
      "registernummer": "HRA 30189",
      "registerart": "HRA",
      "company_name": "WASA Wohnen GmbH & Co KG",
      "company_seat": "Waldfischbach-Burgalben",
      "details": "11.12.2024 (Bekanntmachungsdatum)\n\nRheinland-Pfalz Amtsgericht Zweibrücken HRA 30189\nLöschungsankündigung\n\nWASA Wohnen GmbH & Co KG\nKommanditgesellschaft\nWaldfischbach-Burgalben\n\nDas Registergericht beabsichtigt die Firma von Amts wegen nach § 394 FamFG zu löschen. Die Frist zur Erhebung eines Widerspruchs ist auf einen Monat festgesetzt."
    },
    {
      "date": "2024-12-11",
      "id": "96153",
      "original_text": "Registerbekanntmachung nach dem Umwandlungsgesetz\nRheinland-Pfalz Amtsgericht Wittlich HRB 31220\nTheodor Riewer Handelsgesellschaft mbH – Bitburg",
      "type": "Registerbekanntmachung nach dem Umwandlungsgesetz",
      "state": "Rheinland-Pfalz",
      "amtsgericht": "Amtsgericht Wittlich",
      "registernummer": "HRB 31220",
      "registerart": "HRB",
      "company_name": "Theodor Riewer Handelsgesellschaft mbH",
      "company_seat": "Bitburg",
      "details": "11.12.2024 (Bekanntmachungsdatum)\n\nRheinland-Pfalz Amtsgericht Wittlich HRB 31220\nRegisterbekanntmachung nach dem Umwandlungsgesetz 11.12.2024 (Eintragungsdatum)\n\nTheodor Riewer Handelsgesellschaft mbH\nGesellschaft mit beschränkter Haftung\nBitburg\n\nAls nicht eingetragen wird veröffentlicht: Den Gläubigern der an der Verschmelzung beteiligten Rechtsträger ist, wenn sie binnen sechs Monaten nach dem Tag, an dem die Eintragung der Verschmelzung in das Register des Sitzes desjenigen Rechtsträgers,dessen Gläubiger sie sind, nach § 19 Abs. 3 UmwG als bekannt gemacht gilt, ihren Anspruch nach Grund und Höhe schriftlich anmelden, Sicherheit zu leisten, soweit sie nicht Befriedigung verlangen können. Dieses Recht steht den Gläubigern jedoch nur zu, wenn sie glaubhaft machen, dass durch die Verschmelzung die Erfüllung der Forderung gefährdet wird."
    },
    {
      "date": "2024-12-11",
      "id": "96154",
      "original_text": "Einreichung neuer Dokumente\nRheinland-Pfalz Amtsgericht Mainz HRB 10092\nWohnungsbau GmbH Worms – Worms",
      "type": "Einreichung neuer Dokumente",
      "state": "Rheinland-Pfalz",
      "amtsgericht": "Amtsgericht Mainz",
      "registernummer": "HRB 10092",
      "registerart": "HRB",
      "company_name": "Wohnungsbau GmbH Worms",
      "company_seat": "Worms",
      "details": "11.12.2024 (Bekanntmachungsdatum)\n\nRheinland-Pfalz Amtsgericht Mainz HRB 10092\nEinreichung neuer Dokumente\n\nWohnungsbau GmbH Worms\nGesellschaft mit beschränkter Haftung\nWorms\n\nDem Registergericht ist eine neue Liste der Mitglieder des Aufsichtsrates eingereicht worden."
    },
    {
      "date": "2024-12-11",
      "id": "96155",
      "original_text": "Löschungsankündigung\nNordrhein-Westfalen Amtsgericht Hamm HRB 4584\nFausto Geschenkartikel und Wohnaccessoires GmbH – Kamen",
      "type": "Löschungsankündigung",
      "state": "Nordrhein-Westfalen",
      "amtsgericht": "Amtsgericht Hamm",
      "registernummer": "HRB 4584",
      "registerart": "HRB",
      "company_name": "Fausto Geschenkartikel und Wohnaccessoires GmbH",
      "company_seat": "Kamen",
      "details": "11.12.2024 (Bekanntmachungsdatum)\n\nNordrhein-Westfalen Amtsgericht Hamm HRB 4584\nLöschungsankündigung\n\nFausto Geschenkartikel und Wohnaccessoires GmbH\nGesellschaft mit beschränkter Haftung\nKamen\n\nDas Registergericht beabsichtigt die Gesellschaft von Amts wegen nach § 394 FamFG zu löschen. Die Frist zur Erhebung eines Widerspruchs ist auf drei Monate festgesetzt."
    },
    {
      "date": "2024-12-11",
      "id": "96156",
      "original_text": "Löschungsankündigung\nNordrhein-Westfalen Amtsgericht Siegburg HRB 13696\nLas Vegas 1 Spielhallenbetriebe UG (haftungsbeschränkt) – Waldbröl",
      "type": "Löschungsankündigung",
      "state": "Nordrhein-Westfalen",
      "amtsgericht": "Amtsgericht Siegburg",
      "registernummer": "HRB 13696",
      "registerart": "HRB",
      "company_name": "Las Vegas 1 Spielhallenbetriebe UG (haftungsbeschränkt)",
      "company_seat": "Waldbröl",
      "details": "11.12.2024 (Bekanntmachungsdatum)\n\nNordrhein-Westfalen Amtsgericht Siegburg HRB 13696\nLöschungsankündigung\n\nLas Vegas 1 Spielhallenbetriebe UG (haftungsbeschränkt)\nGesellschaft mit beschränkter Haftung\nWaldbröl\n\nDas Registergericht hat glaubhafte Kenntnis erlangt, dass die Gesellschaft vermögenslos geworden ist, da ein Insolvenzverfahren wegen Masselosigkeit nach § 207 InsO eingestellt wurde.\nEs ist daher beabsichtigt, die Gesellschaft nach § 394 FamFG im Handelsregister wegen Vermögenslosigkeit zu löschen.\nEinwände gegen die Löschung sind durch Widerspruch binnen einer Frist von 3 Monaten geltend zu machen, andernfalls die Löschung erfolgen wird.\nEinzulegen ist der Widerspruch bei dem Amtsgericht Siegburg, Neue Poststraße 16, 53721 Siegburg, und zwar entweder schriftlich in deutscher Sprache oder mündlich zur Niederschrift der Geschäftsstelle. Der Widerspruch kann auch zur Niederschrift der Geschäftsstelle eines jeden Amtsgerichts abgegeben werden. Der Widerspruch ist binnen der in der Verfügung bestimmten Frist einzulegen. Die Frist ist nur gewahrt, wenn der Widerspruch rechtzeitig bei dem Amtsgericht Siegburg eingeht, auch wenn der Widerspruch zur Niederschrift der Geschäftsstelle eines anderen Amtsgerichts abgegeben wurde. Die Frist beginnt jeweils mit der schriftlichen Bekanntgabe der Verfügung an die Beteiligten. Kann die schriftliche Bekanntgabe an einen Beteiligten nicht bewirkt werden, beginnt die Frist spätestens mit Ablauf von fünf Monaten nach Erlass der Verfügung. Die Bekanntgabe ist entweder durch Zustellung oder am dritten Tage nach Aufgabe zur Post bewirkt.\nSofern die Löschung noch nicht erfolgt ist, kann der Widerspruch auch noch nach Ablauf der Frist eingelegt werden. Fällt das Ende der Frist auf einen Sonnabend, einen Sonntag oder einen allgemeinen Feiertag, endet die Frist mit Ablauf des nächsten Werktages. Der Widerspruch ist zu unterzeichnen. Eine Begründung des Widerspruchs ist nicht vorgeschrieben."
    },
    {
      "date": "2024-12-11",
      "id": "96157",
      "original_text": "Registerbekanntmachung nach dem Umwandlungsgesetz\nNordrhein-Westfalen Amtsgericht Paderborn HRA 8800\nConven System GmbH & Co. KG – Delbrück",
      "type": "Registerbekanntmachung nach dem Umwandlungsgesetz",
      "state": "Nordrhein-Westfalen",
      "amtsgericht": "Amtsgericht Paderborn",
      "registernummer": "HRA 8800",
      "registerart": "HRA",
      "company_name": "Conven System GmbH & Co. KG",
      "company_seat": "Delbrück",
      "details": "11.12.2024 (Bekanntmachungsdatum)\n\nNordrhein-Westfalen Amtsgericht Paderborn HRA 8800\nRegisterbekanntmachung nach dem Umwandlungsgesetz 11.12.2024 (Eintragungsdatum)\n\nConven System GmbH & Co. KG\nKommanditgesellschaft\nDelbrück\n\nDen Gläubigern der an der formwechselnden Umwandlung beteiligten Rechtsträger ist, wenn sie binnen sechs Monaten nach dem Tag, an dem die Eintragung der formwechselnden Umwandlung in das Register des Sitzes desjenigen Rechtsträgers, dessen Gläubiger sie sind, nach § 19 Absatz 3 UmwG als bekanntgemacht gilt, ihren Anspruch nach Grund und Höhe schriftlich anmelden, Sicherheit zu leisten, soweit sie nicht Befriedigung verlangen können. Dieses Recht steht den Gläubigern jedoch nur zu, wenn sie glaubhaft machen, dass durch die formwechselnden Umwandlung die Erfüllung ihrer Forderung gefährdet wird."
    },
    {
      "date": "2024-12-11",
      "id": "96158",
      "original_text": "Löschungsankündigung\nNordrhein-Westfalen Amtsgericht Mönchengladbach HRB 21345\nBKP Verwaltungs GmbH – Grevenbroich",
      "type": "Löschungsankündigung",
      "state": "Nordrhein-Westfalen",
      "amtsgericht": "Amtsgericht Mönchengladbach",
      "registernummer": "HRB 21345",
      "registerart": "HRB",
      "company_name": "BKP Verwaltungs GmbH",
      "company_seat": "Grevenbroich",
      "details": "11.12.2024 (Bekanntmachungsdatum)\n\nNordrhein-Westfalen Amtsgericht Mönchengladbach HRB 21345\nLöschungsankündigung\n\nBKP Verwaltungs GmbH\nGesellschaft mit beschränkter Haftung\nGrevenbroich\n\nDas Registergericht beabsichtigt, die im Handelsregister eingetragene Gesellschaft gemäß § 394 Absatz 1 FamFG wegen Vermögenslosigkeit von Amts wegen zu löschen. Gegen diese Verfügung kann Widerspruch eingelegt werden. Die Frist zur Erhebung eines Widerspruchs gegen die beabsichtigte Löschung von Amts wegen ist auf drei Monate festgesetzt."
    },
    {
      "date": "2024-12-11",
      "id": "96159",
      "original_text": "Löschungsankündigung\nNordrhein-Westfalen Amtsgericht Köln HRB 111282\ndeluxe food trading GmbH – Kerpen",
      "type": "Löschungsankündigung",
      "state": "Nordrhein-Westfalen",
      "amtsgericht": "Amtsgericht Köln",
      "registernummer": "HRB 111282",
      "registerart": "HRB",
      "company_name": "deluxe food trading GmbH",
      "company_seat": "Kerpen",
      "details": "11.12.2024 (Bekanntmachungsdatum)\n\nNordrhein-Westfalen Amtsgericht Köln HRB 111282\nLöschungsankündigung\n\ndeluxe food trading GmbH\nGesellschaft mit beschränkter Haftung\nKerpen\n\nDas Registergericht beabsichtigt die Gesellschaft von Amts wegen nach § 394 FamFG zu löschen. Die Frist zur Erhebung eines Widerspruchs ist auf einen Monat festgesetzt."
    },
    {
      "date": "2024-12-11",
      "id": "96160",
      "original_text": "Registerbekanntmachung nach dem Umwandlungsgesetz\nNordrhein-Westfalen Amtsgericht Duisburg HRA 13521\nBehmer Grundbesitz GmbH & Co. KG – Oberhausen",
      "type": "Registerbekanntmachung nach dem Umwandlungsgesetz",
      "state": "Nordrhein-Westfalen",
      "amtsgericht": "Amtsgericht Duisburg",
      "registernummer": "HRA 13521",
      "registerart": "HRA",
      "company_name": "Behmer Grundbesitz GmbH & Co. KG",
      "company_seat": "Oberhausen",
      "details": "11.12.2024 (Bekanntmachungsdatum)\n\nNordrhein-Westfalen Amtsgericht Duisburg HRA 13521\nRegisterbekanntmachung nach dem Umwandlungsgesetz 11.12.2024 (Eintragungsdatum)\n\nBehmer Grundbesitz GmbH & Co. KG\nKommanditgesellschaft\nOberhausen\n\nDen Gläubigern der an der Ausgliederung beteiligten Rechtsträger ist, wenn sie binnen sechs Monaten nach dem Tag, an dem die Eintragung der Ausgliederung in das Register des Sitzes desjenigen Rechtsträgers, dessen Gläubiger sie sind, nach § 19 Absatz 3 UmwG als bekanntgemacht gilt, ihren Anspruch nach Grund und Höhe schriftlich anmelden, Sicherheit zu leisten, soweit sie nicht Befriedigung verlangen können. Dieses Recht steht den Gläubigern jedoch nur zu, wenn sie glaubhaft machen, dass durch die Ausgliederung die Erfüllung ihrer Forderung gefährdet wird."
    },
    {
      "date": "2024-12-11",
      "id": "96161",
      "original_text": "Registerbekanntmachung nach dem Umwandlungsgesetz\nNordrhein-Westfalen Amtsgericht Dortmund HRA 19741\nZyuleyha Hasanova e.K. – Dortmund",
      "type": "Registerbekanntmachung nach dem Umwandlungsgesetz",
      "state": "Nordrhein-Westfalen",
      "amtsgericht": "Amtsgericht Dortmund",
      "registernummer": "HRA 19741",
      "registerart": "HRA",
      "company_name": "Zyuleyha Hasanova e.K.",
      "company_seat": "Dortmund",
      "details": "11.12.2024 (Bekanntmachungsdatum)\n\nNordrhein-Westfalen Amtsgericht Dortmund HRA 19741\nRegisterbekanntmachung nach dem Umwandlungsgesetz 11.12.2024 (Eintragungsdatum)\n\nZyuleyha Hasanova e.K.\nEinzelkaufmann / Einzelkauffrau\nDortmund\n\nDen Gläubigern der an der Ausgliederung beteiligten Rechtsträger ist, wenn sie binnen sechs Monaten nach dem Tag, an dem die Eintragung der Ausgliederung in das Register des Sitzes desjenigen Rechtsträgers, dessen Gläubiger sie sind, nach § 19 Absatz 3 UmwG als bekanntgemacht gilt, ihren Anspruch nach Grund und Höhe schriftlich anmelden, Sicherheit zu leisten, soweit sie nicht Befriedigung verlangen können. Dieses Recht steht den Gläubigern jedoch nur zu, wenn sie glaubhaft machen, dass durch die Ausgliederung die Erfüllung ihrer Forderung gefährdet wird."
    },
    {
      "date": "2024-12-11",
      "id": "96162",
      "original_text": "Einreichung neuer Dokumente\nNordrhein-Westfalen Amtsgericht Köln HRB 36041\nDEVK Pensionsfonds Aktiengesellschaft – Köln",
      "type": "Einreichung neuer Dokumente",
      "state": "Nordrhein-Westfalen",
      "amtsgericht": "Amtsgericht Köln",
      "registernummer": "HRB 36041",
      "registerart": "HRB",
      "company_name": "DEVK Pensionsfonds Aktiengesellschaft",
      "company_seat": "Köln",
      "details": "11.12.2024 (Bekanntmachungsdatum)\n\nNordrhein-Westfalen Amtsgericht Köln HRB 36041\nEinreichung neuer Dokumente\n\nDEVK Pensionsfonds Aktiengesellschaft\nAktiengesellschaft\nKöln\n\nDem Registergericht ist eine Liste der Mitglieder des Aufsichtsrates eingereicht worden."
    },
    {
      "date": "2024-12-11",
      "id": "96163",
      "original_text": "Löschungsankündigung\nNordrhein-Westfalen Amtsgericht Siegburg HRB 15960\nBETRIEBSwerk Unternehmensberatung UG (haftungsbeschränkt) – Hennef",
      "type": "Löschungsankündigung",
      "state": "Nordrhein-Westfalen",
      "amtsgericht": "Amtsgericht Siegburg",
      "registernummer": "HRB 15960",
      "registerart": "HRB",
      "company_name": "BETRIEBSwerk Unternehmensberatung UG (haftungsbeschränkt)",
      "company_seat": "Hennef",
      "details": "11.12.2024 (Bekanntmachungsdatum)\n\nNordrhein-Westfalen Amtsgericht Siegburg HRB 15960\nLöschungsankündigung\n\nBETRIEBSwerk Unternehmensberatung UG (haftungsbeschränkt)\nGesellschaft mit beschränkter Haftung\nHennef\n\nDas Registergericht hat glaubhafte Kenntnis erlangt, dass die Gesellschaft vermögenslos geworden ist, da ein Insolvenzeröffnungsantrag mangels Masse nach § 26 InsO zurückgewiesen wurde.\n\nEs ist daher beabsichtigt, die Gesellschaft nach § 394 FamFG im Handelsregister wegen Vermögenslosigkeit zu löschen.\n\nEinwände gegen die Löschung sind durch Widerspruch binnen einer Frist von 3 Monaten geltend zu machen, andernfalls die Löschung erfolgen wird.\n\nEinzulegen ist der Widerspruch bei dem Amtsgericht Siegburg, Neue Poststraße 16, 53721 Siegburg, und zwar entweder schriftlich in deutscher Sprache oder mündlich zur Niederschrift der Geschäftsstelle. Der Widerspruch kann auch zur Niederschrift der Geschäftsstelle eines jeden Amtsgerichts abgegeben werden. Der Widerspruch ist binnen der in der Verfügung bestimmten Frist einzulegen. Die Frist ist nur gewahrt, wenn der Widerspruch rechtzeitig bei dem Amtsgericht Siegburg eingeht, auch wenn der Widerspruch zur Niederschrift der Geschäftsstelle eines anderen Amtsgerichts abgegeben wurde. Die Frist beginnt jeweils mit der schriftlichen Bekanntgabe der Verfügung an die Beteiligten. Kann die schriftliche Bekanntgabe an einen Beteiligten nicht bewirkt werden, beginnt die Frist spätestens mit Ablauf von fünf Monaten nach Erlass der Verfügung. Die Bekanntgabe ist entweder durch Zustellung oder am dritten Tage nach Aufgabe zur Post bewirkt. Sofern die Löschung noch nicht erfolgt ist, kann der Widerspruch auch noch nach Ablauf der Frist eingelegt werden. Fällt das Ende der Frist auf einen Sonnabend, einen Sonntag oder einen allgemeinen Feiertag, endet die Frist mit Ablauf des nächsten Werktages. Der Widerspruch ist zu unterzeichnen. Eine Begründung des Widerspruchs ist nicht vorgeschrieben."
    },
    {
      "date": "2024-12-11",
      "id": "96164",
      "original_text": "Registerbekanntmachung nach dem Umwandlungsgesetz\nNordrhein-Westfalen Amtsgericht Düsseldorf HRB 103631\nUnibail-Rodamco-Westfield Real Estate Management GmbH – Düsseldorf",
      "type": "Registerbekanntmachung nach dem Umwandlungsgesetz",
      "state": "Nordrhein-Westfalen",
      "amtsgericht": "Amtsgericht Düsseldorf",
      "registernummer": "HRB 103631",
      "registerart": "HRB",
      "company_name": "Unibail-Rodamco-Westfield Real Estate Management GmbH",
      "company_seat": "Düsseldorf",
      "details": "11.12.2024 (Bekanntmachungsdatum)\n\nNordrhein-Westfalen Amtsgericht Düsseldorf HRB 103631\nRegisterbekanntmachung nach dem Umwandlungsgesetz 11.12.2024 (Eintragungsdatum)\n\nUnibail-Rodamco-Westfield Real Estate Management GmbH\nGesellschaft mit beschränkter Haftung\nDüsseldorf\n\nDen Gläubigern der an der Abspaltung beteiligten Rechtsträger ist, wenn sie binnen sechs Monaten nach dem Tag, an dem die Eintragung der Abspaltung in das Register des Sitzes desjenigen Rechtsträgers, dessen Gläubiger sie sind, nach § 19 Absatz 3 UmwG als bekanntgemacht gilt, ihren Anspruch nach Grund und Höhe schriftlich anmelden, Sicherheit zu leisten, soweit sie nicht Befriedigung verlangen können. Dieses Recht steht den Gläubigern jedoch nur zu, wenn sie glaubhaft machen, dass durch die Abspaltung die Erfüllung ihrer Forderung gefährdet wird."
    },
    {
      "date": "2024-12-11",
      "id": "96165",
      "original_text": "Registerbekanntmachung nach dem Umwandlungsgesetz\nNordrhein-Westfalen Amtsgericht Paderborn HRB 15799\nConven System GmbH – Delbrück",
      "type": "Registerbekanntmachung nach dem Umwandlungsgesetz",
      "state": "Nordrhein-Westfalen",
      "amtsgericht": "Amtsgericht Paderborn",
      "registernummer": "HRB 15799",
      "registerart": "HRB",
      "company_name": "Conven System GmbH",
      "company_seat": "Delbrück",
      "details": "11.12.2024 (Bekanntmachungsdatum)\n\nNordrhein-Westfalen Amtsgericht Paderborn HRB 15799\nRegisterbekanntmachung nach dem Umwandlungsgesetz 11.12.2024 (Eintragungsdatum)\n\nConven System GmbH\nGesellschaft mit beschränkter Haftung\nDelbrück\n\nDen Gläubigern der an der formwechselnden Umwandlung beteiligten Rechtsträger ist, wenn sie binnen sechs Monaten nach dem Tag, an dem die Eintragung der formwechselnden Umwandlung in das Register des Sitzes desjenigen Rechtsträgers, dessen Gläubiger sie sind, nach § 19 Absatz 3 UmwG als bekanntgemacht gilt, ihren Anspruch nach Grund und Höhe schriftlich anmelden, Sicherheit zu leisten, soweit sie nicht Befriedigung verlangen können. Dieses Recht steht den Gläubigern jedoch nur zu, wenn sie glaubhaft machen, dass durch die formwechselnden Umwandlung die Erfüllung ihrer Forderung gefährdet wird."
    },
    {
      "date": "2024-12-11",
      "id": "96166",
      "original_text": "Registerbekanntmachung nach dem Umwandlungsgesetz\nNordrhein-Westfalen Amtsgericht Düsseldorf HRB 103631\nUnibail-Rodamco-Westfield Real Estate Management GmbH – Düsseldorf",
      "type": "Registerbekanntmachung nach dem Umwandlungsgesetz",
      "state": "Nordrhein-Westfalen",
      "amtsgericht": "Amtsgericht Düsseldorf",
      "registernummer": "HRB 103631",
      "registerart": "HRB",
      "company_name": "Unibail-Rodamco-Westfield Real Estate Management GmbH",
      "company_seat": "Düsseldorf",
      "details": "11.12.2024 (Bekanntmachungsdatum)\n\nNordrhein-Westfalen Amtsgericht Düsseldorf HRB 103631\nRegisterbekanntmachung nach dem Umwandlungsgesetz 11.12.2024 (Eintragungsdatum)\n\nUnibail-Rodamco-Westfield Real Estate Management GmbH\nGesellschaft mit beschränkter Haftung\nDüsseldorf\n\nDen Gläubigern der an der Abspaltung beteiligten Rechtsträger ist, wenn sie binnen sechs Monaten nach dem Tag, an dem die Eintragung der Abspaltung in das Register des Sitzes desjenigen Rechtsträgers, dessen Gläubiger sie sind, nach § 19 Absatz 3 UmwG als bekanntgemacht gilt, ihren Anspruch nach Grund und Höhe schriftlich anmelden, Sicherheit zu leisten, soweit sie nicht Befriedigung verlangen können. Dieses Recht steht den Gläubigern jedoch nur zu, wenn sie glaubhaft machen, dass durch die Abspaltung die Erfüllung ihrer Forderung gefährdet wird."
    },
    {
      "date": "2024-12-11",
      "id": "96167",
      "original_text": "Löschungsankündigung\nNordrhein-Westfalen Amtsgericht Duisburg HRB 23161\nDC Projects GmbH – Duisburg",
      "type": "Löschungsankündigung",
      "state": "Nordrhein-Westfalen",
      "amtsgericht": "Amtsgericht Duisburg",
      "registernummer": "HRB 23161",
      "registerart": "HRB",
      "company_name": "DC Projects GmbH",
      "company_seat": "Duisburg",
      "details": "11.12.2024 (Bekanntmachungsdatum)\n\nNordrhein-Westfalen Amtsgericht Duisburg HRB 23161\nLöschungsankündigung\n\nDC Projects GmbH\nGesellschaft mit beschränkter Haftung\nDuisburg\n\nDas Registergericht beabsichtigt, die im Handelsregister unter HRB 23161  eingetragene Gesellschaft DC Projects GmbH gemäß § 394 FamFG wegen Vermögenslosigkeit von Amts wegen zu löschen. Gegen diese Verfügung kann Widerspruch eingelegt werden. Die Frist zur Erhebung eines Widerspruchs gegen die beabsichtigte Löschung von Amts wegen ist auf drei Monate festgesetzt. Rechtsbehelfsbelehrung Der Widerspruch ist bei dem Amtsgericht Duisburg, Kardinal-Galen-Str. 124-132, 47058 Duisburg schriftlich in deutscher Sprache oder zur Niederschrift der Geschäftsstelle einzulegen. Der Widerspruch kann auch zur Niederschrift der Geschäftsstelle eines jeden Amtsgerichtes abgegeben werden. Die Einlegung ist auch durch Übertragung eines elektronischen Dokuments an die elektronische Poststelle des Gerichts möglich. Das elektronische Dokument muss für die Bearbeitung durch das Gericht geeignet und mit einer qualifizierten elektronischen Signatur der verantwortenden Person versehen sein oder von der verantwortenden Person signiert und auf einem sicheren Übermittlungsweg gemäß § 130 a ZPO nach näherer Maßgabe der Verordnung über die technischen Rahmenbedingungen des elektronischen Rechtsverkehrs und über das besondere elektronische Behördenpostfach (BGBl. I, S. 3803) eingereicht werden. Weitere Informationen erhalten Sie auf der Internetseite www.justiz.de <http://www.justiz.de>. Der Widerspruch muss spätestens innerhalb der gesetzten Frist bei dem Amtsgericht Duisburg eingegangen sein. Dies gilt auch dann, wenn der Widerspruch zur Niederschrift der Geschäftsstelle eines anderen Amtsgerichtes abgegeben wurde. Die Frist beginnt mit der Veröffentlichung. Fällt das Ende der Frist auf einen Sonntag, einen allgemeinen Feiertag oder Sonnabend, so endet die Frist mit Ablauf des nächsten Werktages. Der Widerspruch muss die Bezeichnung der angefochtenen Verfügung sowie die Erklärung enthalten, dass Widerspruch gegen diese Verfügung eingelegt wird. Er ist zu unterzeichnen und soll begründet werden."
    },
    {
      "date": "2024-12-11",
      "id": "96168",
      "original_text": "Einreichung neuer Dokumente\nNordrhein-Westfalen Amtsgericht Wuppertal HRB 21733\nZWILLING J. A. Henckels Aktiengesellschaft – Solingen",
      "type": "Einreichung neuer Dokumente",
      "state": "Nordrhein-Westfalen",
      "amtsgericht": "Amtsgericht Wuppertal",
      "registernummer": "HRB 21733",
      "registerart": "HRB",
      "company_name": "ZWILLING J. A. Henckels Aktiengesellschaft",
      "company_seat": "Solingen",
      "details": "11.12.2024 (Bekanntmachungsdatum)\n\nNordrhein-Westfalen Amtsgericht Wuppertal HRB 21733\nEinreichung neuer Dokumente\n\nZWILLING J. A. Henckels Aktiengesellschaft\nAktiengesellschaft\nSolingen\n\nDem Registergericht ist eine Liste der Mitglieder des Aufsichtsrates eingereicht worden."
    },
    {
      "date": "2024-12-11",
      "id": "96169",
      "original_text": "Registerbekanntmachung nach dem Umwandlungsgesetz\nNordrhein-Westfalen Amtsgericht Düsseldorf HRB 74811\nRefondo Main II GmbH – Düsseldorf",
      "type": "Registerbekanntmachung nach dem Umwandlungsgesetz",
      "state": "Nordrhein-Westfalen",
      "amtsgericht": "Amtsgericht Düsseldorf",
      "registernummer": "HRB 74811",
      "registerart": "HRB",
      "company_name": "Refondo Main II GmbH",
      "company_seat": "Düsseldorf",
      "details": "11.12.2024 (Bekanntmachungsdatum)\n\nNordrhein-Westfalen Amtsgericht Düsseldorf HRB 74811\nRegisterbekanntmachung nach dem Umwandlungsgesetz 11.12.2024 (Eintragungsdatum)\n\nRefondo Main II GmbH\nGesellschaft mit beschränkter Haftung\nDüsseldorf\n\nDen Gläubigern der an der Verschmelzung beteiligten Rechtsträger ist, wenn sie binnen sechs Monaten nach dem Tag, an dem die Eintragung der Verschmelzung in das Register des Sitzes desjenigen Rechtsträgers, dessen Gläubiger sie sind, nach § 19 Absatz 3 UmwG als bekanntgemacht gilt, ihren Anspruch nach Grund und Höhe schriftlich anmelden, Sicherheit zu leisten, soweit sie nicht Befriedigung verlangen können. Dieses Recht steht den Gläubigern jedoch nur zu, wenn sie glaubhaft machen, dass durch die Verschmelzung die Erfüllung ihrer Forderung gefährdet wird."
    },
    {
      "date": "2024-12-11",
      "id": "96170",
      "original_text": "Registerbekanntmachung nach dem Umwandlungsgesetz\nNordrhein-Westfalen Amtsgericht Duisburg HRA 7815\nOtto Horstmann e.K. Inhaber Mario Behmer – Oberhausen",
      "type": "Registerbekanntmachung nach dem Umwandlungsgesetz",
      "state": "Nordrhein-Westfalen",
      "amtsgericht": "Amtsgericht Duisburg",
      "registernummer": "HRA 7815",
      "registerart": "HRA",
      "company_name": "Otto Horstmann e.K. Inhaber Mario Behmer",
      "company_seat": "Oberhausen",
      "details": "11.12.2024 (Bekanntmachungsdatum)\n\nNordrhein-Westfalen Amtsgericht Duisburg HRA 7815\nRegisterbekanntmachung nach dem Umwandlungsgesetz 11.12.2024 (Eintragungsdatum)\n\nOtto Horstmann e.K. Inhaber Mario Behmer\nEinzelkaufmann / Einzelkauffrau\nOberhausen\n\nDen Gläubigern der an der Ausgliederung beteiligten Rechtsträger ist, wenn sie binnen sechs Monaten nach dem Tag, an dem die Eintragung der Ausgliederung in das Register des Sitzes desjenigen Rechtsträgers, dessen Gläubiger sie sind, nach § 19 Absatz 3 UmwG als bekanntgemacht gilt, ihren Anspruch nach Grund und Höhe schriftlich anmelden, Sicherheit zu leisten, soweit sie nicht Befriedigung verlangen können. Dieses Recht steht den Gläubigern jedoch nur zu, wenn sie glaubhaft machen, dass durch die Ausgliederung die Erfüllung ihrer Forderung gefährdet wird."
    },
    {
      "date": "2024-12-11",
      "id": "96171",
      "original_text": "Löschungsankündigung\nNordrhein-Westfalen Amtsgericht Siegburg HRB 14450\nAdmin UG (haftungsbeschränkt) – Königswinter",
      "type": "Löschungsankündigung",
      "state": "Nordrhein-Westfalen",
      "amtsgericht": "Amtsgericht Siegburg",
      "registernummer": "HRB 14450",
      "registerart": "HRB",
      "company_name": "Admin UG (haftungsbeschränkt)",
      "company_seat": "Königswinter",
      "details": "11.12.2024 (Bekanntmachungsdatum)\n\nNordrhein-Westfalen Amtsgericht Siegburg HRB 14450\nLöschungsankündigung\n\nAdmin UG (haftungsbeschränkt)\nGesellschaft mit beschränkter Haftung\nKönigswinter\n\nDas Registergericht hat glaubhafte Kenntnis erlangt, dass die Gesellschaft vermögenslos geworden ist.\n\nEs ist daher beabsichtigt, die Gesellschaft nach § 394 FamFG im Handelsregister wegen Vermögenslosigkeit zu löschen.\n\nEinwände gegen die Löschung sind durch Widerspruch binnen einer Frist von 3 Monaten geltend zu machen, andernfalls die Löschung erfolgen wird.\n\nEinzulegen ist der Widerspruch bei dem Amtsgericht Siegburg, Neue Poststraße 16, 53721 Siegburg, und zwar entweder schriftlich in deutscher Sprache oder mündlich zur Niederschrift der Geschäftsstelle. Der Widerspruch kann auch zur Niederschrift der Geschäftsstelle eines jeden Amtsgerichts abgegeben werden. Der Widerspruch ist binnen der in der Verfügung bestimmten Frist einzulegen. Die Frist ist nur gewahrt, wenn der Widerspruch rechtzeitig bei dem Amtsgericht Siegburg eingeht, auch wenn der Widerspruch zur Niederschrift der Geschäftsstelle eines anderen Amtsgerichts abgegeben wurde. Die Frist beginnt jeweils mit der schriftlichen Bekanntgabe der Verfügung an die Beteiligten. Kann die schriftliche Bekanntgabe an einen Beteiligten nicht bewirkt werden, beginnt die Frist spätestens mit Ablauf von fünf Monaten nach Erlass der Verfügung. Die Bekanntgabe ist entweder durch Zustellung oder am dritten Tage nach Aufgabe zur Post bewirkt. Sofern die Löschung noch nicht erfolgt ist, kann der Widerspruch auch noch nach Ablauf der Frist eingelegt werden. Fällt das Ende der Frist auf einen Sonnabend, einen Sonntag oder einen allgemeinen Feiertag, endet die Frist mit Ablauf des nächsten Werktages. Der Widerspruch ist zu unterzeichnen. Eine Begründung des Widerspruchs ist nicht vorgeschrieben."
    },
    {
      "date": "2024-12-11",
      "id": "96172",
      "original_text": "Registerbekanntmachung nach dem Umwandlungsgesetz\nNordrhein-Westfalen Amtsgericht Düsseldorf HRB 75814\nmfi Development GmbH – Düsseldorf",
      "type": "Registerbekanntmachung nach dem Umwandlungsgesetz",
      "state": "Nordrhein-Westfalen",
      "amtsgericht": "Amtsgericht Düsseldorf",
      "registernummer": "HRB 75814",
      "registerart": "HRB",
      "company_name": "mfi Development GmbH",
      "company_seat": "Düsseldorf",
      "details": "11.12.2024 (Bekanntmachungsdatum)\n\nNordrhein-Westfalen Amtsgericht Düsseldorf HRB 75814\nRegisterbekanntmachung nach dem Umwandlungsgesetz 11.12.2024 (Eintragungsdatum)\n\nmfi Development GmbH\nGesellschaft mit beschränkter Haftung\nDüsseldorf\n\nDen Gläubigern der an der Abspaltung beteiligten Rechtsträger ist, wenn sie binnen sechs Monaten nach dem Tag, an dem die Eintragung der Abspaltung in das Register des Sitzes desjenigen Rechtsträgers, dessen Gläubiger sie sind, nach § 19 Absatz 3 UmwG als bekanntgemacht gilt, ihren Anspruch nach Grund und Höhe schriftlich anmelden, Sicherheit zu leisten, soweit sie nicht Befriedigung verlangen können. Dieses Recht steht den Gläubigern jedoch nur zu, wenn sie glaubhaft machen, dass durch die Abspaltung die Erfüllung ihrer Forderung gefährdet wird."
    },
    {
      "date": "2024-12-11",
      "id": "96173",
      "original_text": "Löschungsankündigung\nNordrhein-Westfalen Amtsgericht Düsseldorf HRB 97589\nCell System UG (haftungsbeschränkt) – Düsseldorf",
      "type": "Löschungsankündigung",
      "state": "Nordrhein-Westfalen",
      "amtsgericht": "Amtsgericht Düsseldorf",
      "registernummer": "HRB 97589",
      "registerart": "HRB",
      "company_name": "Cell System UG (haftungsbeschränkt)",
      "company_seat": "Düsseldorf",
      "details": "11.12.2024 (Bekanntmachungsdatum)\n\nNordrhein-Westfalen Amtsgericht Düsseldorf HRB 97589\nLöschungsankündigung\n\nCell System UG (haftungsbeschränkt)\nGesellschaft mit beschränkter Haftung\nDüsseldorf\n\nDas Registergericht beabsichtigt die Gesellschaft von Amts wegen nach § 394 Abs. 1 FamFG zu löschen. Die Frist zur Erhebung eines Widerspruchs ist auf 3 Wochen festgesetzt.\n\nRechtsbehelfsbelehrung:\nDas Widerspruchsrecht steht jedem zu, der an der Unterlassung der Löschung ein berechtigtes Interesse hat. Der Widerspruch ist bei dem Amtsgericht Düsseldorf -Registergericht-, Werdener Straße 1, 40227 Düsseldorf schriftlich in deutscher Sprache oder zur Niederschrift der Geschäftsstelle einzulegen. Der Widerspruch kann auch zur Niederschrift der Geschäftsstelle eines jeden Amtsgerichtes abgegeben werden. Die Einlegung ist auch durch Übertragung eines elektronischen Dokuments an die elektronische Poststelle des Gerichts möglich. Das elektronische Dokument muss für die Bearbeitung durch das Gericht geeignet und mit einer qualifizierten elektronischen Signatur der verantwortenden Person versehen sein oder von der verantwortenden Person signiert und auf einem sicheren Übermittlungsweg gemäß § 130a ZPO nach näherer Maßgabe der Verordnung über die technischen Rahmenbedingungen des elektronischen Rechtsverkehrs und über das besondere elektronische Behördenpostfach (BGBl. I, S.3803) eingereicht werden. Weitere Informationen erhalten Sie auf der Internetseite www.justiz.de.\nDer Widerspruch muss spätestens innerhalb der gesetzten Frist nach dem Datum der Bekanntmachung der Löschungsankündigung bei dem Amtsgericht - Registergericht - Düsseldorf eingegangen sein.  Dies gilt auch dann, wenn der Widerspruch zur Niederschrift der Geschäftsstelle eines anderen Amtsgerichtes abgegeben wurde. Die Frist beginnt mit dem Tage der Bekanntmachung der Löschungsankündigung in dem für die Bekanntmachung der Eintragungen in das Handelsregister bestimmten elektronischen Informations- und Kommunikationssystem nach § 10 des Handelsgesetzbuches. Fällt das Ende der Frist auf einen Sonntag, einen allgemeinen Feiertag oder Sonnabend, so endet die Frist mit Ablauf des nächsten Werktages.\nDer Widerspruch muss die Bezeichnung der angefochtenen Löschungsankündigung sowie die Erklärung enthalten, dass Widerspruch gegen diese Löschungsankündigung eingelegt wird. Er ist zu unterzeichnen und soll begründet werden."
    },
    {
      "date": "2024-12-11",
      "id": "96174",
      "original_text": "Löschungsankündigung\nNordrhein-Westfalen Amtsgericht Köln HRB 107550\nCar free Deutschland GmbH – Köln",
      "type": "Löschungsankündigung",
      "state": "Nordrhein-Westfalen",
      "amtsgericht": "Amtsgericht Köln",
      "registernummer": "HRB 107550",
      "registerart": "HRB",
      "company_name": "Car free Deutschland GmbH",
      "company_seat": "Köln",
      "details": "11.12.2024 (Bekanntmachungsdatum)\n\nNordrhein-Westfalen Amtsgericht Köln HRB 107550\nLöschungsankündigung\n\nCar free Deutschland GmbH\nGesellschaft mit beschränkter Haftung\nKöln\n\nDas Registergericht beabsichtigt die Gesellschaft von Amts wegen nach § 394 FamFG zu löschen. Die Frist zur Erhebung eines Widerspruchs ist auf einen Monat festgesetzt."
    },
    {
      "date": "2024-12-11",
      "id": "96175",
      "original_text": "Löschungsankündigung\nNordrhein-Westfalen Amtsgericht Köln HRB 43453\nSENIORENRESIDENZ BRÜHL Nitsche gemeinnützige Gesellschaft mbH – Brühl",
      "type": "Löschungsankündigung",
      "state": "Nordrhein-Westfalen",
      "amtsgericht": "Amtsgericht Köln",
      "registernummer": "HRB 43453",
      "registerart": "HRB",
      "company_name": "SENIORENRESIDENZ BRÜHL Nitsche gemeinnützige Gesellschaft mbH",
      "company_seat": "Brühl",
      "details": "11.12.2024 (Bekanntmachungsdatum)\n\nNordrhein-Westfalen Amtsgericht Köln HRB 43453\nLöschungsankündigung\n\nSENIORENRESIDENZ BRÜHL Nitsche gemeinnützige Gesellschaft mbH\nGesellschaft mit beschränkter Haftung\nBrühl\n\nDas Registergericht beabsichtigt die Gesellschaft von Amts wegen nach § 394 FamFG zu löschen. Die Frist zur Erhebung eines Widerspruchs ist auf einen Monat festgesetzt."
    },
    {
      "date": "2024-12-11",
      "id": "96176",
      "original_text": "Löschungsankündigung\nNordrhein-Westfalen Amtsgericht Mönchengladbach HRB 21535\nCleantech Gebäudereinigung GmbH – Mönchengladbach",
      "type": "Löschungsankündigung",
      "state": "Nordrhein-Westfalen",
      "amtsgericht": "Amtsgericht Mönchengladbach",
      "registernummer": "HRB 21535",
      "registerart": "HRB",
      "company_name": "Cleantech Gebäudereinigung GmbH",
      "company_seat": "Mönchengladbach",
      "details": "11.12.2024 (Bekanntmachungsdatum)\n\nNordrhein-Westfalen Amtsgericht Mönchengladbach HRB 21535\nLöschungsankündigung\n\nCleantech Gebäudereinigung GmbH\nGesellschaft mit beschränkter Haftung\nMönchengladbach\n\nDas Registergericht beabsichtigt, die im Handelsregister eingetragene Gesellschaft gemäß § 394 Absatz 1 FamFG wegen Vermögenslosigkeit von Amts wegen zu löschen. Gegen diese Verfügung kann Widerspruch eingelegt werden. Die Frist zur Erhebung eines Widerspruchs gegen die beabsichtigte Löschung von Amts wegen ist auf drei Monate festgesetzt."
    },
    {
      "date": "2024-12-11",
      "id": "96177",
      "original_text": "Löschungsankündigung\nNordrhein-Westfalen Amtsgericht Hamm HRB 10025\nJK Gastro UG (haftungsbeschränkt) – Hamm",
      "type": "Löschungsankündigung",
      "state": "Nordrhein-Westfalen",
      "amtsgericht": "Amtsgericht Hamm",
      "registernummer": "HRB 10025",
      "registerart": "HRB",
      "company_name": "JK Gastro UG (haftungsbeschränkt)",
      "company_seat": "Hamm",
      "details": "11.12.2024 (Bekanntmachungsdatum)\n\nNordrhein-Westfalen Amtsgericht Hamm HRB 10025\nLöschungsankündigung\n\nJK Gastro UG (haftungsbeschränkt)\nGesellschaft mit beschränkter Haftung\nHamm\n\nDas Registergericht beabsichtigt die Gesellschaft von Amts wegen nach § 394 FamFG zu löschen. Die Frist zur Erhebung eines Widerspruchs ist auf drei Monate festgesetzt."
    },
    {
      "date": "2024-12-11",
      "id": "96178",
      "original_text": "Löschungsankündigung\nNordrhein-Westfalen Amtsgericht Hamm HRB 10233\nEckel GmbH – Hamm",
      "type": "Löschungsankündigung",
      "state": "Nordrhein-Westfalen",
      "amtsgericht": "Amtsgericht Hamm",
      "registernummer": "HRB 10233",
      "registerart": "HRB",
      "company_name": "Eckel GmbH",
      "company_seat": "Hamm",
      "details": "11.12.2024 (Bekanntmachungsdatum)\n\nNordrhein-Westfalen Amtsgericht Hamm HRB 10233\nLöschungsankündigung\n\nEckel GmbH\nGesellschaft mit beschränkter Haftung\nHamm\n\nDas Registergericht beabsichtigt die Gesellschaft von Amts wegen nach § 394 FamFG zu löschen. Die Frist zur Erhebung eines Widerspruchs ist auf drei Monate festgesetzt."
    },
    {
      "date": "2024-12-11",
      "id": "96179",
      "original_text": "Registerbekanntmachung nach dem Umwandlungsgesetz\nNordrhein-Westfalen Amtsgericht Gelsenkirchen GnR 204\n\"Eigenhaus\" Baugenossenschaft Gelsenkirchen eG – Gelsenkirchen",
      "type": "Registerbekanntmachung nach dem Umwandlungsgesetz",
      "state": "Nordrhein-Westfalen",
      "amtsgericht": "Amtsgericht Gelsenkirchen",
      "registernummer": "GnR 204",
      "registerart": "GnR",
      "company_name": "\"Eigenhaus\" Baugenossenschaft Gelsenkirchen eG",
      "company_seat": "Gelsenkirchen",
      "details": "11.12.2024 (Bekanntmachungsdatum)\n\nNordrhein-Westfalen Amtsgericht Gelsenkirchen GnR 204\nRegisterbekanntmachung nach dem Umwandlungsgesetz 11.12.2024 (Eintragungsdatum)\n\n\"Eigenhaus\" Baugenossenschaft Gelsenkirchen eG\neingetragene Genossenschaft\nGelsenkirchen\n\nDie Gesellschaft hat Gläubigern, deren Forderungen vor dieser Bekanntmachung begründet worden sind, Sicherheit zu leisten, soweit sie nicht Befriedigung verlangen können, wenn sie sich binnen sechs Monaten zu diesem Zweck melden."
    },
    {
      "date": "2024-12-11",
      "id": "96180",
      "original_text": "Löschungsankündigung\nNordrhein-Westfalen Amtsgericht Siegburg HRB 13430\nKA-Bauunternehmung GmbH – Troisdorf",
      "type": "Löschungsankündigung",
      "state": "Nordrhein-Westfalen",
      "amtsgericht": "Amtsgericht Siegburg",
      "registernummer": "HRB 13430",
      "registerart": "HRB",
      "company_name": "KA-Bauunternehmung GmbH",
      "company_seat": "Troisdorf",
      "details": "11.12.2024 (Bekanntmachungsdatum)\n\nNordrhein-Westfalen Amtsgericht Siegburg HRB 13430\nLöschungsankündigung\n\nKA-Bauunternehmung GmbH\nGesellschaft mit beschränkter Haftung\nTroisdorf\n\nDas Registergericht hat glaubhafte Kenntnis erlangt, dass die Gesellschaft vermögenslos geworden ist, da ein Insolvenzverfahren durchgeführt und nach § 200 InsO aufgehoben wurde.\n\nEs ist daher beabsichtigt, die Gesellschaft nach § 394 FamFG im Handelsregister wegen Vermögenslosigkeit zu löschen.\nEinwände gegen die Löschung sind durch Widerspruch binnen einer Frist von 3 Monaten geltend zu machen, andernfalls die Löschung erfolgen wird.\n\nEinzulegen ist der Widerspruch bei dem Amtsgericht Siegburg, Neue Poststraße 16, 53721 Siegburg, und zwar entweder schriftlich in deutscher Sprache oder mündlich zur Niederschrift der Geschäftsstelle. Der Widerspruch kann auch zur Niederschrift der Geschäftsstelle eines jeden Amtsgerichts abgegeben werden. Der Widerspruch ist binnen der in der Verfügung bestimmten Frist einzulegen. Die Frist ist nur gewahrt, wenn der Widerspruch rechtzeitig bei dem Amtsgericht Siegburg eingeht, auch wenn der Widerspruch zur Niederschrift der Geschäftsstelle eines anderen Amtsgerichts abgegeben wurde. Die Frist beginnt jeweils mit der schriftlichen Bekanntgabe der Verfügung an die Beteiligten. Kann die schriftliche Bekanntgabe an einen Beteiligten nicht bewirkt werden, beginnt die Frist spätestens mit Ablauf von fünf Monaten nach Erlass der Verfügung. Die Bekanntgabe ist entweder durch Zustellung oder am dritten Tage nach Aufgabe zur Post bewirkt. Sofern die Löschung noch nicht erfolgt ist, kann der Widerspruch auch noch nach Ablauf der Frist eingelegt werden. Fällt das Ende der Frist auf einen Sonnabend, einen Sonntag oder einen allgemeinen Feiertag, endet die Frist mit Ablauf des nächsten Werktages. Der Widerspruch ist zu unterzeichnen. Eine Begründung des Widerspruchs ist nicht vorgeschrieben."
    },
    {
      "date": "2024-12-11",
      "id": "96181",
      "original_text": "Registerbekanntmachung nach dem Umwandlungsgesetz\nNordrhein-Westfalen Amtsgericht Köln HRB 85075\nObjektgesellschaft Hafen 1 mbH – Köln",
      "type": "Registerbekanntmachung nach dem Umwandlungsgesetz",
      "state": "Nordrhein-Westfalen",
      "amtsgericht": "Amtsgericht Köln",
      "registernummer": "HRB 85075",
      "registerart": "HRB",
      "company_name": "Objektgesellschaft Hafen 1 mbH",
      "company_seat": "Köln",
      "details": "11.12.2024 (Bekanntmachungsdatum)\n\nNordrhein-Westfalen Amtsgericht Köln HRB 85075\nRegisterbekanntmachung nach dem Umwandlungsgesetz 11.12.2024 (Eintragungsdatum)\n\nObjektgesellschaft Hafen 1 mbH\nGesellschaft mit beschränkter Haftung\nKöln\n\nDen Gläubigern der an der Verschmelzung beteiligten Rechtsträger ist, wenn sie binnen sechs Monaten nach dem Tag, an dem die Eintragung der Verschmelzung in das Register des Sitzes desjenigen Rechtsträgers, dessen Gläubiger sie sind, nach § 19 Absatz 3 UmwG als bekanntgemacht gilt, ihren Anspruch nach Grund und Höhe schriftlich anmelden, Sicherheit zu leisten, soweit sie nicht Befriedigung verlangen können. Dieses Recht steht den Gläubigern jedoch nur zu, wenn sie glaubhaft machen, dass durch die Verschmelzung die Erfüllung ihrer Forderung gefährdet wird."
    },
    {
      "date": "2024-12-11",
      "id": "96182",
      "original_text": "Registerbekanntmachung nach dem Umwandlungsgesetz\nNordrhein-Westfalen Amtsgericht Dortmund HRB 15814\nBRAINSTORM GmbH – Dortmund",
      "type": "Registerbekanntmachung nach dem Umwandlungsgesetz",
      "state": "Nordrhein-Westfalen",
      "amtsgericht": "Amtsgericht Dortmund",
      "registernummer": "HRB 15814",
      "registerart": "HRB",
      "company_name": "BRAINSTORM GmbH",
      "company_seat": "Dortmund",
      "details": "11.12.2024 (Bekanntmachungsdatum)\n\nNordrhein-Westfalen Amtsgericht Dortmund HRB 15814\nRegisterbekanntmachung nach dem Umwandlungsgesetz 14.11.2024 (Eintragungsdatum)\n\nBRAINSTORM GmbH\nGesellschaft mit beschränkter Haftung\nDortmund\n\nDen Gläubigern der an der formwechselnden Umwandlung beteiligten Rechtsträger ist, wenn sie binnen sechs Monaten nach dem Tag, an dem die Eintragung der formwechselnden Umwandlung in das Register des Sitzes desjenigen Rechtsträgers, dessen Gläubiger sie sind, nach § 19 Absatz 3 UmwG als bekanntgemacht gilt, ihren Anspruch nach Grund und Höhe schriftlich anmelden, Sicherheit zu leisten, soweit sie nicht Befriedigung verlangen können. Dieses Recht steht den Gläubigern jedoch nur zu, wenn sie glaubhaft machen, dass durch die formwechselnden Umwandlung die Erfüllung ihrer Forderung gefährdet wird."
    },
    {
      "date": "2024-12-11",
      "id": "96183",
      "original_text": "Löschungsankündigung\nNordrhein-Westfalen Amtsgericht Hamm HRB 6480\nIngenieurbüro Decius GmbH – Hamm",
      "type": "Löschungsankündigung",
      "state": "Nordrhein-Westfalen",
      "amtsgericht": "Amtsgericht Hamm",
      "registernummer": "HRB 6480",
      "registerart": "HRB",
      "company_name": "Ingenieurbüro Decius GmbH",
      "company_seat": "Hamm",
      "details": "11.12.2024 (Bekanntmachungsdatum)\n\nNordrhein-Westfalen Amtsgericht Hamm HRB 6480\nLöschungsankündigung\n\nIngenieurbüro Decius GmbH\nGesellschaft mit beschränkter Haftung\nHamm\n\nDas Registergericht beabsichtigt die Gesellschaft von Amts wegen nach § 394 FamFG zu löschen. Die Frist zur Erhebung eines Widerspruchs ist auf drei Monate festgesetzt."
    },
    {
      "date": "2024-12-11",
      "id": "96184",
      "original_text": "Registerbekanntmachung nach dem Umwandlungsgesetz\nNordrhein-Westfalen Amtsgericht Bochum HRB 21809\nKuchar IVI GmbH – Witten",
      "type": "Registerbekanntmachung nach dem Umwandlungsgesetz",
      "state": "Nordrhein-Westfalen",
      "amtsgericht": "Amtsgericht Bochum",
      "registernummer": "HRB 21809",
      "registerart": "HRB",
      "company_name": "Kuchar IVI GmbH",
      "company_seat": "Witten",
      "details": "11.12.2024 (Bekanntmachungsdatum)\n\nNordrhein-Westfalen Amtsgericht Bochum HRB 21809\nRegisterbekanntmachung nach dem Umwandlungsgesetz 06.12.2024 (Eintragungsdatum)\n\nKuchar IVI GmbH\nGesellschaft mit beschränkter Haftung\nWitten\n\nDen Gläubigern der an der Abspaltung beteiligten Rechtsträger ist, wenn sie binnen sechs Monaten nach dem Tag, an dem die Eintragung der Abspaltung in das Register des Sitzes desjenigen Rechtsträgers, dessen Gläubiger sie sind, nach § 19 Absatz 3 UmwG als bekanntgemacht gilt, ihren Anspruch nach Grund und Höhe schriftlich anmelden, Sicherheit zu leisten, soweit sie nicht Befriedigung verlangen können. Dieses Recht steht den Gläubigern jedoch nur zu, wenn sie glaubhaft machen, dass durch die Abspaltung die Erfüllung ihrer Forderung gefährdet wird."
    },
    {
      "date": "2024-12-11",
      "id": "96185",
      "original_text": "Registerbekanntmachung nach dem Umwandlungsgesetz\nHessen Amtsgericht Fritzlar HRB 12836\nGELIMER Verwaltungsgesellschaft mbH – Melsungen",
      "type": "Registerbekanntmachung nach dem Umwandlungsgesetz",
      "state": "Hessen",
      "amtsgericht": "Amtsgericht Fritzlar",
      "registernummer": "HRB 12836",
      "registerart": "HRB",
      "company_name": "GELIMER Verwaltungsgesellschaft mbH",
      "company_seat": "Melsungen",
      "details": "11.12.2024 (Bekanntmachungsdatum)\n\nHessen Amtsgericht Fritzlar HRB 12836\nRegisterbekanntmachung nach dem Umwandlungsgesetz 11.12.2024 (Eintragungsdatum)\n\nGELIMER Verwaltungsgesellschaft mbH\nGesellschaft mit beschränkter Haftung\nMelsungen\n\nDen Gläubigern der an der Verschmelzung beteiligten Rechtsträger ist, wenn sie binnen sechs Monaten nach dem Tag, an dem die Eintragung der Verschmelzung in das Register des Sitzes desjenigen Rechtsträgers, dessen Gläubiger sie sind, nach § 19 Absatz 3 UmwG bekannt gemacht worden ist, ihren Anspruch nach Grund und Höhe schriftlich anmelden, Sicherheit zu leisten, soweit sie nicht Befriedigung verlangen können. Dieses Recht steht den Gläubigern jedoch nur zu, wenn sie glaubhaft machen, dass durch die Verschmelzung die Erfüllung ihrer Forderung gefährdet wird."
    },
    {
      "date": "2024-12-11",
      "id": "96186",
      "original_text": "Löschungsankündigung\nHessen Amtsgericht Frankfurt am Main HRB 91320\nCapital & Regional (Europe GP 5) Verwaltungs-GmbH – Frankfurt am Main",
      "type": "Löschungsankündigung",
      "state": "Hessen",
      "amtsgericht": "Amtsgericht Frankfurt am Main",
      "registernummer": "HRB 91320",
      "registerart": "HRB",
      "company_name": "Capital & Regional (Europe GP 5) Verwaltungs-GmbH",
      "company_seat": "Frankfurt am Main",
      "details": "11.12.2024 (Bekanntmachungsdatum)\n\nHessen Amtsgericht Frankfurt am Main HRB 91320\nLöschungsankündigung\n\nCapital & Regional (Europe GP 5) Verwaltungs-GmbH\nGesellschaft mit beschränkter Haftung\nFrankfurt am Main\n\nDas Registergericht beabsichtigt die im Handelsregister eingetragene Gesellschaft von Amts wegen nach § 394 FamFG zu löschen. Die Frist zur Erhebung eines Widerspruchs gegen die beabsichtigte Löschung wird auf 1 Monat festgesetzt."
    },
    {
      "date": "2024-12-11",
      "id": "96187",
      "original_text": "Registerbekanntmachung nach dem Umwandlungsgesetz\nHessen Amtsgericht Offenbach am Main HRB 53791\nLogicalis Siticom GmbH – Neu-Isenburg",
      "type": "Registerbekanntmachung nach dem Umwandlungsgesetz",
      "state": "Hessen",
      "amtsgericht": "Amtsgericht Offenbach am Main",
      "registernummer": "HRB 53791",
      "registerart": "HRB",
      "company_name": "Logicalis Siticom GmbH",
      "company_seat": "Neu-Isenburg",
      "details": "11.12.2024 (Bekanntmachungsdatum)\n\nHessen Amtsgericht Offenbach am Main HRB 53791\nRegisterbekanntmachung nach dem Umwandlungsgesetz 11.12.2024 (Eintragungsdatum)\n\nLogicalis Siticom GmbH\nGesellschaft mit beschränkter Haftung\nNeu-Isenburg\n\nDen Gläubigern der an der Verschmelzung beteiligten Rechtsträger ist, wenn sie binnen sechs Monaten nach dem Tag, an dem die Eintragung der Verschmelzung in das Register des Sitzes desjenigen Rechtsträgers, dessen Gläubiger sie sind, nach § 19 Absatz 3 UmwG bekannt gemacht worden ist, ihren Anspruch nach Grund und Höhe schriftlich anmelden, Sicherheit zu leisten, soweit sie nicht Befriedigung verlangen können. Dieses Recht steht den Gläubigern jedoch nur zu, wenn sie glaubhaft machen, dass durch die Verschmelzung die Erfüllung ihrer Forderung gefährdet wird."
    },
    {
      "date": "2024-12-11",
      "id": "96188",
      "original_text": "Registerbekanntmachung nach dem Umwandlungsgesetz\nHessen Amtsgericht Frankfurt am Main HRB 35814\nGMV-Gesellschaft für medizintechnische Versorgung mbH – Hofheim am Taunus",
      "type": "Registerbekanntmachung nach dem Umwandlungsgesetz",
      "state": "Hessen",
      "amtsgericht": "Amtsgericht Frankfurt am Main",
      "registernummer": "HRB 35814",
      "registerart": "HRB",
      "company_name": "GMV-Gesellschaft für medizintechnische Versorgung mbH",
      "company_seat": "Hofheim am Taunus",
      "details": "11.12.2024 (Bekanntmachungsdatum)\n\nHessen Amtsgericht Frankfurt am Main HRB 35814\nRegisterbekanntmachung nach dem Umwandlungsgesetz 11.12.2024 (Eintragungsdatum)\n\nGMV-Gesellschaft für medizintechnische Versorgung mbH\nGesellschaft mit beschränkter Haftung\nHofheim am Taunus\n\nDen Gläubigern der an der Verschmelzung beteiligten Rechtsträger ist, wenn sie binnen sechs Monaten nach dem Tag, an dem die Eintragung der Verschmelzung in das Register des Sitzes derjenigen Rechtsträger deren Gläubiger sie sind, nach § 19 Absatz 3 UmwG bekannt gemacht worden ist, ihren Anspruch nach Grund und Höhe schriftlich anmelden, Sicherheit zu leisten, soweit sie nicht Befriedigung verlangen können. Dieses Recht steht den Gläubigern jedoch nur zu, wenn sie glaubhaft machen, dass durch die Verschmelzung die Erfüllung ihrer Forderung gefährdet wird."
    },
    {
      "date": "2024-12-11",
      "id": "96189",
      "original_text": "Registerbekanntmachung nach dem Umwandlungsgesetz\nHessen Amtsgericht Frankfurt am Main PR 2800\nSüss Beratende Ingenieure PartG mbB Frankfurt – Frankfurt am Main",
      "type": "Registerbekanntmachung nach dem Umwandlungsgesetz",
      "state": "Hessen",
      "amtsgericht": "Amtsgericht Frankfurt am Main",
      "registernummer": "PR 2800",
      "registerart": "PR",
      "company_name": "Süss Beratende Ingenieure PartG mbB Frankfurt",
      "company_seat": "Frankfurt am Main",
      "details": "11.12.2024 (Bekanntmachungsdatum)\n\nHessen Amtsgericht Frankfurt am Main PR 2800\nRegisterbekanntmachung nach dem Umwandlungsgesetz 11.12.2024 (Eintragungsdatum)\n\nSüss Beratende Ingenieure PartG mbB Frankfurt\nPartnerschaftsgesellschaft\nFrankfurt am Main\n\nDen Gläubigern der an der formwechselnden Umwandlung beteiligten Rechtsträger ist, wenn sie binnen sechs Monaten nach dem Tag, an dem die Eintragung der formwechselnden Umwandlung in das Register des Sitzes desjenigen Rechtsträgers, dessen Gläubiger sie sind, nach § 201 UmwG bekannt gemacht worden ist, ihren Anspruch nach Grund und Höhe schriftlich anmelden, Sicherheit zu leisten, soweit sie nicht Befriedigung verlangen können. Dieses Recht steht den Gläubigern jedoch nur zu, wenn sie glaubhaft machen, dass durch die formwechselnden Umwandlung die Erfüllung ihrer Forderung gefährdet wird."
    },
    {
      "date": "2024-12-11",
      "id": "96190",
      "original_text": "Registerbekanntmachung nach dem Umwandlungsgesetz\nHessen Amtsgericht Friedberg HRA 1451\nHornig Investments, Inh. Dennis Bodo Hornig e. Kfm. – Rosbach v.d. Höhe",
      "type": "Registerbekanntmachung nach dem Umwandlungsgesetz",
      "state": "Hessen",
      "amtsgericht": "Amtsgericht Friedberg",
      "registernummer": "HRA 1451",
      "registerart": "HRA",
      "company_name": "Hornig Investments, Inh. Dennis Bodo Hornig e. Kfm.",
      "company_seat": "Rosbach v.d. Höhe",
      "details": "11.12.2024 (Bekanntmachungsdatum)\n\nHessen Amtsgericht Friedberg HRA 1451\nRegisterbekanntmachung nach dem Umwandlungsgesetz 11.12.2024 (Eintragungsdatum)\n\nHornig Investments, Inh. Dennis Bodo Hornig e. Kfm.\nEinzelkaufmann / Einzelkauffrau\nRosbach v.d. Höhe\n\nDen Gläubigern der an der Ausgliederung beteiligten Rechtsträger ist, wenn sie binnen sechs Monaten nach dem Tag, an dem die Eintragung der Ausgliederung in das Register des Sitzes desjenigen Rechtsträgers, dessen Gläubiger sie sind, nach §§ 125, 19 Absatz 3 UmwG bekannt gemacht worden ist, ihren Anspruch nach Grund und Höhe schriftlich anmelden, Sicherheit zu leisten, soweit sie nicht Befriedigung verlangen können. Dieses Recht steht den Gläubigern jedoch nur zu, wenn sie glaubhaft machen, dass durch die Ausgliederung die Erfüllung ihrer Forderung gefährdet wird."
    },
    {
      "date": "2024-12-11",
      "id": "96191",
      "original_text": "Sonstige Registerbekanntmachung\nHessen Amtsgericht Wiesbaden HRB 23667\nSV Wehen 1926 Wiesbaden GmbH – Wiesbaden",
      "type": "Sonstige Registerbekanntmachung",
      "state": "Hessen",
      "amtsgericht": "Amtsgericht Wiesbaden",
      "registernummer": "HRB 23667",
      "registerart": "HRB",
      "company_name": "SV Wehen 1926 Wiesbaden GmbH",
      "company_seat": "Wiesbaden",
      "details": "11.12.2024 (Bekanntmachungsdatum)\n\nHessen Amtsgericht Wiesbaden HRB 23667\nSonstige Registerbekanntmachung 11.12.2024 (Eintragungsdatum)\n\nSV Wehen 1926 Wiesbaden GmbH\nGesellschaft mit beschränkter Haftung\nWiesbaden\n\nDurch eine Änderung in den Personen der Aufsichtsratsmitglieder ist eine Liste der Mitglieder des Aufsichtsrates zum Handelsregister eingereicht worden."
    },
    {
      "date": "2024-12-11",
      "id": "96192",
      "original_text": "Sonstige Registerbekanntmachung\nHessen Amtsgericht Wetzlar VR 4498\nKultur- und Naturverein Oberes Lemptal e.V. – Asslar-Oberlemp",
      "type": "Sonstige Registerbekanntmachung",
      "state": "Hessen",
      "amtsgericht": "Amtsgericht Wetzlar",
      "registernummer": "VR 4498",
      "registerart": "VR",
      "company_name": "Kultur- und Naturverein Oberes Lemptal e.V.",
      "company_seat": "Asslar-Oberlemp",
      "details": "11.12.2024 (Bekanntmachungsdatum)\n\nHessen Amtsgericht Wetzlar VR 4498\nSonstige Registerbekanntmachung 11.12.2024 (Eintragungsdatum)\n\nKultur- und Naturverein Oberes Lemptal e.V.\neingetragener Verein\nAsslar-Oberlemp\n\nDer Verein ist aufgelöst."
    },
    {
      "date": "2024-12-11",
      "id": "96193",
      "original_text": "Löschungsankündigung\nHessen Amtsgericht Frankfurt am Main HRB 98989\nOPM Projekt Bieber GmbH – Frankfurt am Main",
      "type": "Löschungsankündigung",
      "state": "Hessen",
      "amtsgericht": "Amtsgericht Frankfurt am Main",
      "registernummer": "HRB 98989",
      "registerart": "HRB",
      "company_name": "OPM Projekt Bieber GmbH",
      "company_seat": "Frankfurt am Main",
      "details": "11.12.2024 (Bekanntmachungsdatum)\n\nHessen Amtsgericht Frankfurt am Main HRB 98989\nLöschungsankündigung 11.12.2024 (Eintragungsdatum)\n\nOPM Projekt Bieber GmbH\nGesellschaft mit beschränkter Haftung\nFrankfurt am Main\n\nEs ist beabsichtigt die Gesellschaft wegen Vermögenslosigkeit gemäß § 394 FamFG von Amts wegen zu löschen. Hiergegen kann innerhalb eines Monats nach dieser Veröffentlichung Widerspruch bei dem Amtsgericht Frankfurt am Main eingelegt werden."
    },
    {
      "date": "2024-12-11",
      "id": "96194",
      "original_text": "Sonstige Registerbekanntmachung\nHessen Amtsgericht Wiesbaden VR 5376\nKranken- und Altersversorgungsverein der Ursulinen Geisenheim – Geisenheim",
      "type": "Sonstige Registerbekanntmachung",
      "state": "Hessen",
      "amtsgericht": "Amtsgericht Wiesbaden",
      "registernummer": "VR 5376",
      "registerart": "VR",
      "company_name": "Kranken- und Altersversorgungsverein der Ursulinen Geisenheim",
      "company_seat": "Geisenheim",
      "details": "11.12.2024 (Bekanntmachungsdatum)\n\nHessen Amtsgericht Wiesbaden VR 5376\nSonstige Registerbekanntmachung 11.12.2024 (Eintragungsdatum)\n\nKranken- und Altersversorgungsverein der Ursulinen Geisenheim\neingetragener Verein\nGeisenheim\n\nDer Verein ist aufgelöst."
    },
    {
      "date": "2024-12-11",
      "id": "96195",
      "original_text": "Sonstige Registerbekanntmachung\nHessen Amtsgericht Fritzlar VR 3379\nFit und Fun - Selbsthilfegruppe gegen Zivilisationskrankheiten – Melsungen",
      "type": "Sonstige Registerbekanntmachung",
      "state": "Hessen",
      "amtsgericht": "Amtsgericht Fritzlar",
      "registernummer": "VR 3379",
      "registerart": "VR",
      "company_name": "Fit und Fun - Selbsthilfegruppe gegen Zivilisationskrankheiten",
      "company_seat": "Melsungen",
      "details": "11.12.2024 (Bekanntmachungsdatum)\n\nHessen Amtsgericht Fritzlar VR 3379\nSonstige Registerbekanntmachung 11.12.2024 (Eintragungsdatum)\n\nFit und Fun - Selbsthilfegruppe gegen Zivilisationskrankheiten\neingetragener Verein\nMelsungen\n\nDer Verein ist aufgelöst."
    },
    {
      "date": "2024-12-11",
      "id": "96196",
      "original_text": "Registerbekanntmachung nach dem Umwandlungsgesetz\nHessen Amtsgericht Frankfurt am Main HRB 136958\nSüss Beratende Ingenieure GmbH Frankfurt – Frankfurt am Main",
      "type": "Registerbekanntmachung nach dem Umwandlungsgesetz",
      "state": "Hessen",
      "amtsgericht": "Amtsgericht Frankfurt am Main",
      "registernummer": "HRB 136958",
      "registerart": "HRB",
      "company_name": "Süss Beratende Ingenieure GmbH Frankfurt",
      "company_seat": "Frankfurt am Main",
      "details": "11.12.2024 (Bekanntmachungsdatum)\n\nHessen Amtsgericht Frankfurt am Main HRB 136958\nRegisterbekanntmachung nach dem Umwandlungsgesetz 11.12.2024 (Eintragungsdatum)\n\nSüss Beratende Ingenieure GmbH Frankfurt\nGesellschaft mit beschränkter Haftung\nFrankfurt am Main\n\nDen Gläubigern der an der formwechselnden Umwandlung beteiligten Rechtsträger ist, wenn sie binnen sechs Monaten nach dem Tag, an dem die Eintragung der formwechselnden Umwandlung in das Register des Sitzes desjenigen Rechtsträgers, dessen Gläubiger sie sind, nach § 201 UmwG bekannt gemacht worden ist, ihren Anspruch nach Grund und Höhe schriftlich anmelden, Sicherheit zu leisten, soweit sie nicht Befriedigung verlangen können. Dieses Recht steht den Gläubigern jedoch nur zu, wenn sie glaubhaft machen, dass durch die formwechselnden Umwandlung die Erfüllung ihrer Forderung gefährdet wird."
    },
    {
      "date": "2024-12-11",
      "id": "96197",
      "original_text": "Löschungsankündigung\nHessen Amtsgericht Frankfurt am Main HRB 85989\nJPK Projektentwicklung GmbH – Frankfurt am Main",
      "type": "Löschungsankündigung",
      "state": "Hessen",
      "amtsgericht": "Amtsgericht Frankfurt am Main",
      "registernummer": "HRB 85989",
      "registerart": "HRB",
      "company_name": "JPK Projektentwicklung GmbH",
      "company_seat": "Frankfurt am Main",
      "details": "11.12.2024 (Bekanntmachungsdatum)\n\nHessen Amtsgericht Frankfurt am Main HRB 85989\nLöschungsankündigung 11.12.2024 (Eintragungsdatum)\n\nJPK Projektentwicklung GmbH\nGesellschaft mit beschränkter Haftung\nFrankfurt am Main\n\nEs ist beabsichtigt die Gesellschaft wegen Vermögenslosigkeit gemäß § 394 FamFG von Amts wegen zu löschen. Hiergegen kann innerhalb eines Monats nach dieser Veröffentlichung Widerspruch bei dem Amtsgericht Frankfurt am Main eingelegt werden."
    },
    {
      "date": "2024-12-11",
      "id": "96198",
      "original_text": "Löschungsankündigung\nHessen Amtsgericht Frankfurt am Main HRB 112527\nKL Hoch- und Tiefbau GmbH – Frankfurt am Main",
      "type": "Löschungsankündigung",
      "state": "Hessen",
      "amtsgericht": "Amtsgericht Frankfurt am Main",
      "registernummer": "HRB 112527",
      "registerart": "HRB",
      "company_name": "KL Hoch- und Tiefbau GmbH",
      "company_seat": "Frankfurt am Main",
      "details": "11.12.2024 (Bekanntmachungsdatum)\n\nHessen Amtsgericht Frankfurt am Main HRB 112527\nLöschungsankündigung\n\nKL Hoch- und Tiefbau GmbH\nGesellschaft mit beschränkter Haftung\nFrankfurt am Main\n\nEs ist beabsichtigt die Gesellschaft wegen Vermögenslosigkeit gemäß § 394 FamFG von Amts wegen zu löschen. Hiergegen kann innerhalb eines Monats nach dieser Veröffentlichung Widerspruch bei dem Amtsgericht Frankfurt am Main eingelegt werden."
    },
    {
      "date": "2024-12-11",
      "id": "96199",
      "original_text": "Sonstige Registerbekanntmachung\nHessen Amtsgericht Darmstadt VR 60452\nUnterstützungsfonds des Litauischen Gymnasiums – Lampertheim-Hüttenfeld",
      "type": "Sonstige Registerbekanntmachung",
      "state": "Hessen",
      "amtsgericht": "Amtsgericht Darmstadt",
      "registernummer": "VR 60452",
      "registerart": "VR",
      "company_name": "Unterstützungsfonds des Litauischen Gymnasiums",
      "company_seat": "Lampertheim-Hüttenfeld",
      "details": "11.12.2024 (Bekanntmachungsdatum)\n\nHessen Amtsgericht Darmstadt VR 60452\nSonstige Registerbekanntmachung 11.12.2024 (Eintragungsdatum)\n\nUnterstützungsfonds des Litauischen Gymnasiums\neingetragener Verein\nLampertheim-Hüttenfeld\n\nDer Verein ist aufgelöst."
    }
  ]
}