{
  "date": "2024-12-31",
  "date_of_scrape": "2025-01-01T04:03:21.138Z",
  "tool_version": "0.2.0",
  "number_of_announcements": 24,
  "announcements": [
    {
      "date": "2024-12-31",
      "id": "97560",
      "original_text": "Registerbekanntmachung nach dem Umwandlungsgesetz\nBayern Amtsgericht Nürnberg HRB 39588\nStädtler Logistik GmbH – Nürnberg",
      "type": "Registerbekanntmachung nach dem Umwandlungsgesetz",
      "state": "Bayern",
      "amtsgericht": "Amtsgericht Nürnberg",
      "registernummer": "HRB 39588",
      "registerart": "HRB",
      "company_name": "Städtler Logistik GmbH",
      "company_seat": "Nürnberg",
      "details": "31.12.2024 (Bekanntmachungsdatum)\n\nBayern Amtsgericht Nürnberg HRB 39588\nRegisterbekanntmachung nach dem Umwandlungsgesetz 30.12.2024 (Eintragungsdatum)\n\nStädtler Logistik GmbH\nGesellschaft mit beschränkter Haftung\nNürnberg\n\nDen Gläubigern der Gesellschaft, deren Forderungen begründet worden sind, bevor die Eintragung der Beendigung des Beherrschungs- und Gewinnabführungsvertrages in das Handelsregister nach § 10 des Handelsgesetzbuches als bekanntgemacht gilt, hat der andere Vertragsteil Sicherheit zu leisten, wenn sie sich binnen sechs Monaten nach der Bekanntmachung der Eintragung zu diesem Zweck bei ihm melden."
    },
    {
      "date": "2024-12-31",
      "id": "97561",
      "original_text": "Registerbekanntmachung nach dem Umwandlungsgesetz\nBayern Amtsgericht Nürnberg HRB 5143\nWerbestudio Focus Karl Pfeifer GmbH – Nürnberg",
      "type": "Registerbekanntmachung nach dem Umwandlungsgesetz",
      "state": "Bayern",
      "amtsgericht": "Amtsgericht Nürnberg",
      "registernummer": "HRB 5143",
      "registerart": "HRB",
      "company_name": "Werbestudio Focus Karl Pfeifer GmbH",
      "company_seat": "Nürnberg",
      "details": "31.12.2024 (Bekanntmachungsdatum)\n\nBayern Amtsgericht Nürnberg HRB 5143\nRegisterbekanntmachung nach dem Umwandlungsgesetz 30.12.2024 (Eintragungsdatum)\n\nWerbestudio Focus Karl Pfeifer GmbH\nGesellschaft mit beschränkter Haftung\nNürnberg\n\nDen Gläubigern der an der Verschmelzung beteiligten Rechtsträger ist, wenn sie binnen sechs Monaten nach dem Tag, an dem die Eintragung der Verschmelzung in das Register des Sitzes desjenigen Rechtsträgers, dessen Gläubiger sie sind, nach § 19 Abs. 3 UmwG als bekannt gemacht gilt, ihren Anspruch nach Grund und Höhe schriftlich anmelden, Sicherheit zu leisten, soweit sie nicht Befriedigung verlangen können. Dieses Recht steht den Gläubigern jedoch nur zu, wenn sie glaubhaft machen, dass durch die Verschmelzung die Erfüllung ihrer Forderung gefährdet wird."
    },
    {
      "date": "2024-12-31",
      "id": "97562",
      "original_text": "Registerbekanntmachung nach dem Umwandlungsgesetz\nBayern Amtsgericht Nürnberg HRA 19958\nWerbeagentur Focus Karl Pfeifer e.K. – Nürnberg",
      "type": "Registerbekanntmachung nach dem Umwandlungsgesetz",
      "state": "Bayern",
      "amtsgericht": "Amtsgericht Nürnberg",
      "registernummer": "HRA 19958",
      "registerart": "HRA",
      "company_name": "Werbeagentur Focus Karl Pfeifer e.K.",
      "company_seat": "Nürnberg",
      "details": "31.12.2024 (Bekanntmachungsdatum)\n\nBayern Amtsgericht Nürnberg HRA 19958\nRegisterbekanntmachung nach dem Umwandlungsgesetz 30.12.2024 (Eintragungsdatum)\n\nWerbeagentur Focus Karl Pfeifer e.K.\nEinzelkaufmann / Einzelkauffrau\nNürnberg\n\nDen Gläubigern der an der Verschmelzung beteiligten Rechtsträger ist, wenn sie binnen sechs Monaten nach dem Tag, an dem die Eintragung der Verschmelzung in das Register des Sitzes desjenigen Rechtsträgers, dessen Gläubiger sie sind, nach § 19 Abs. 3 UmwG als bekannt gemacht gilt, ihren Anspruch nach Grund und Höhe schriftlich anmelden, Sicherheit zu leisten, soweit sie nicht Befriedigung verlangen können. Dieses Recht steht den Gläubigern jedoch nur zu, wenn sie glaubhaft machen, dass durch die Verschmelzung die Erfüllung ihrer Forderung gefährdet wird."
    },
    {
      "date": "2024-12-31",
      "id": "97563",
      "original_text": "Einreichung neuer Dokumente\nBayern Amtsgericht Memmingen HRB 7394\nNUWOG - Dienstleistungs- und Betreuungs-GmbH – Neu-Ulm",
      "type": "Einreichung neuer Dokumente",
      "state": "Bayern",
      "amtsgericht": "Amtsgericht Memmingen",
      "registernummer": "HRB 7394",
      "registerart": "HRB",
      "company_name": "NUWOG - Dienstleistungs- und Betreuungs-GmbH",
      "company_seat": "Neu-Ulm",
      "details": "31.12.2024 (Bekanntmachungsdatum)\n\nBayern Amtsgericht Memmingen HRB 7394\nEinreichung neuer Dokumente\n\nNUWOG - Dienstleistungs- und Betreuungs-GmbH\nGesellschaft mit beschränkter Haftung\nNeu-Ulm\n\nDem Amtsgericht Memmingen -Registergericht- ist eine Liste der Mitglieder des Aufsichtsrats eingereicht worden, § 52 Abs. 3 S. 2 GmbHG."
    },
    {
      "date": "2024-12-31",
      "id": "97564",
      "original_text": "Einreichung neuer Dokumente\nBayern Amtsgericht Fürth HRB 14738\nSchaeffler AG – Herzogenaurach",
      "type": "Einreichung neuer Dokumente",
      "state": "Bayern",
      "amtsgericht": "Amtsgericht Fürth",
      "registernummer": "HRB 14738",
      "registerart": "HRB",
      "company_name": "Schaeffler AG",
      "company_seat": "Herzogenaurach",
      "details": "31.12.2024 (Bekanntmachungsdatum)\n\nBayern Amtsgericht Fürth HRB 14738\nEinreichung neuer Dokumente\n\nSchaeffler AG\nAktiengesellschaft\nHerzogenaurach\n\nDem Amtsgericht Fürth -Registergericht- ist eine Liste der Mitglieder des Aufsichtsrats eingereicht worden, § 106 AktG."
    },
    {
      "date": "2024-12-31",
      "id": "97565",
      "original_text": "Registerbekanntmachung nach dem Umwandlungsgesetz\nBayern Amtsgericht Deggendorf HRA 3668\nUrsula Köllnberger Hausverwaltung e.K. – Osterhofen",
      "type": "Registerbekanntmachung nach dem Umwandlungsgesetz",
      "state": "Bayern",
      "amtsgericht": "Amtsgericht Deggendorf",
      "registernummer": "HRA 3668",
      "registerart": "HRA",
      "company_name": "Ursula Köllnberger Hausverwaltung e.K.",
      "company_seat": "Osterhofen",
      "details": "31.12.2024 (Bekanntmachungsdatum)\n\nBayern Amtsgericht Deggendorf HRA 3668\nRegisterbekanntmachung nach dem Umwandlungsgesetz 17.12.2024 (Eintragungsdatum)\n\nUrsula Köllnberger Hausverwaltung e.K.\nEinzelkaufmann / Einzelkauffrau\nOsterhofen\n\nDen Gläubigern der an der Ausgliederung beteiligten Rechtsträger ist, wenn sie binnen sechs Monaten nach dem Tag, an dem die Eintragung der Ausgliederung in das Register des Sitzes desjenigen Rechtsträgers, dessen Gläubiger sie sind, nach §§ 125, 19 Abs. 3 UmwG als bekannt gemacht gilt, ihren Anspruch nach Grund und Höhe schriftlich anmelden, Sicherheit zu leisten, soweit sie nicht Befriedigung verlangen können. Dieses Recht steht den Gläubigern jedoch nur zu, wenn sie glaubhaft machen, dass durch die Ausgliederung die Erfüllung ihrer Forderung gefährdet wird."
    },
    {
      "date": "2024-12-31",
      "id": "97566",
      "original_text": "Registerbekanntmachung nach dem Umwandlungsgesetz\nBayern Amtsgericht München HRB 174388\nmantro GmbH – München",
      "type": "Registerbekanntmachung nach dem Umwandlungsgesetz",
      "state": "Bayern",
      "amtsgericht": "Amtsgericht München",
      "registernummer": "HRB 174388",
      "registerart": "HRB",
      "company_name": "mantro GmbH",
      "company_seat": "München",
      "details": "31.12.2024 (Bekanntmachungsdatum)\n\nBayern Amtsgericht München HRB 174388\nRegisterbekanntmachung nach dem Umwandlungsgesetz 30.12.2024 (Eintragungsdatum)\n\nmantro GmbH\nGesellschaft mit beschränkter Haftung\nMünchen\n\nDen Gläubigern der an der Verschmelzung beteiligten Rechtsträger ist, wenn sie binnen sechs Monaten nach dem Tag, an dem die Eintragung der Verschmelzung in das Register des Sitzes desjenigen Rechtsträgers, dessen Gläubiger sie sind, nach § 19 Abs. 3 UmwG als bekannt gemacht gilt, ihren Anspruch nach Grund und Höhe schriftlich anmelden, Sicherheit zu leisten, soweit sie nicht Befriedigung verlangen können. Dieses Recht steht den Gläubigern jedoch nur zu, wenn sie glaubhaft machen, dass durch die Verschmelzung die Erfüllung ihrer Forderung gefährdet wird."
    },
    {
      "date": "2024-12-31",
      "id": "97567",
      "original_text": "Registerbekanntmachung nach dem Umwandlungsgesetz\nBayern Amtsgericht München HRB 230390\nMJM Investments GmbH – München",
      "type": "Registerbekanntmachung nach dem Umwandlungsgesetz",
      "state": "Bayern",
      "amtsgericht": "Amtsgericht München",
      "registernummer": "HRB 230390",
      "registerart": "HRB",
      "company_name": "MJM Investments GmbH",
      "company_seat": "München",
      "details": "31.12.2024 (Bekanntmachungsdatum)\n\nBayern Amtsgericht München HRB 230390\nRegisterbekanntmachung nach dem Umwandlungsgesetz 30.12.2024 (Eintragungsdatum)\n\nMJM Investments GmbH\nGesellschaft mit beschränkter Haftung\nMünchen\n\nDen Gläubigern der an der Verschmelzung beteiligten Rechtsträger ist, wenn sie binnen sechs Monaten nach dem Tag, an dem die Eintragung der Verschmelzung in das Register des Sitzes desjenigen Rechtsträgers, dessen Gläubiger sie sind, nach § 19 Abs. 3 UmwG als bekannt gemacht gilt, ihren Anspruch nach Grund und Höhe schriftlich anmelden, Sicherheit zu leisten, soweit sie nicht Befriedigung verlangen können. Dieses Recht steht den Gläubigern jedoch nur zu, wenn sie glaubhaft machen, dass durch die Verschmelzung die Erfüllung ihrer Forderung gefährdet wird."
    },
    {
      "date": "2024-12-31",
      "id": "97568",
      "original_text": "Löschungsankündigung\nBayern Amtsgericht München HRB 237639\nVIKINX GmbH – München",
      "type": "Löschungsankündigung",
      "state": "Bayern",
      "amtsgericht": "Amtsgericht München",
      "registernummer": "HRB 237639",
      "registerart": "HRB",
      "company_name": "VIKINX GmbH",
      "company_seat": "München",
      "details": "31.12.2024 (Bekanntmachungsdatum)\n\nBayern Amtsgericht München HRB 237639\nLöschungsankündigung 30.12.2024 (Eintragungsdatum)\n\nVIKINX GmbH\nGesellschaft mit beschränkter Haftung\nMünchen\n\nDas Registergericht beabsichtigt, die im Handelsregister eingetragene Gesellschaft wegen Vermögenslosigkeit von Amts wegen nach § 394 FamFG zu löschen. Die Frist zur Erhebung eines Widerspruchs ist auf drei Monate festgesetzt."
    },
    {
      "date": "2024-12-31",
      "id": "97569",
      "original_text": "Sonstige Registerbekanntmachung\nBayern Amtsgericht Nürnberg HRB 27198\nBosch Sicherheitssysteme Engineering GmbH – Nürnberg",
      "type": "Sonstige Registerbekanntmachung",
      "state": "Bayern",
      "amtsgericht": "Amtsgericht Nürnberg",
      "registernummer": "HRB 27198",
      "registerart": "HRB",
      "company_name": "Bosch Sicherheitssysteme Engineering GmbH",
      "company_seat": "Nürnberg",
      "details": "31.12.2024 (Bekanntmachungsdatum)\n\nBayern Amtsgericht Nürnberg HRB 27198\nSonstige Registerbekanntmachung 30.12.2024 (Eintragungsdatum)\n\nBosch Sicherheitssysteme Engineering GmbH\nGesellschaft mit beschränkter Haftung\nNürnberg\n\nDen Gläubigern der Gesellschaft, deren Forderungen begründet worden sind, bevor die Eintragung der Beendigung des Beherrschungs- und Gewinnabführungsvertrages in das Handelsregister nach § 10 des Handelsgesetzbuches als bekanntgemacht gilt, hat der andere Vertragsteil Sicherheit zu leisten, wenn sie sich binnen sechs Monaten nach der Bekanntmachung der Eintragung zu diesem Zweck bei ihm melden."
    },
    {
      "date": "2024-12-31",
      "id": "97570",
      "original_text": "Registerbekanntmachung nach dem Umwandlungsgesetz\nBayern Amtsgericht München HRB 157821\nHugendubel Beteiligungs Verwaltungs GmbH – München",
      "type": "Registerbekanntmachung nach dem Umwandlungsgesetz",
      "state": "Bayern",
      "amtsgericht": "Amtsgericht München",
      "registernummer": "HRB 157821",
      "registerart": "HRB",
      "company_name": "Hugendubel Beteiligungs Verwaltungs GmbH",
      "company_seat": "München",
      "details": "31.12.2024 (Bekanntmachungsdatum)\n\nBayern Amtsgericht München HRB 157821\nRegisterbekanntmachung nach dem Umwandlungsgesetz 30.12.2024 (Eintragungsdatum)\n\nHugendubel Beteiligungs Verwaltungs GmbH\nGesellschaft mit beschränkter Haftung\nMünchen\n\nDen Gläubigern der an der Verschmelzung beteiligten Rechtsträger ist, wenn sie binnen sechs Monaten nach dem Tag, an dem die Eintragung der Verschmelzung in das Register des Sitzes desjenigen Rechtsträgers, dessen Gläubiger sie sind, nach § 19 Abs. 3 UmwG als bekannt gemacht gilt, ihren Anspruch nach Grund und Höhe schriftlich anmelden, Sicherheit zu leisten, soweit sie nicht Befriedigung verlangen können. Dieses Recht steht den Gläubigern jedoch nur zu, wenn sie glaubhaft machen, dass durch die Verschmelzung die Erfüllung ihrer Forderung gefährdet wird."
    },
    {
      "date": "2024-12-31",
      "id": "97571",
      "original_text": "Einreichung neuer Dokumente\nBayern Amtsgericht München HRB 114750\nSYSCOMTEC DISTRIBUTION Aktiengesellschaft – Oberhaching",
      "type": "Einreichung neuer Dokumente",
      "state": "Bayern",
      "amtsgericht": "Amtsgericht München",
      "registernummer": "HRB 114750",
      "registerart": "HRB",
      "company_name": "SYSCOMTEC DISTRIBUTION Aktiengesellschaft",
      "company_seat": "Oberhaching",
      "details": "31.12.2024 (Bekanntmachungsdatum)\n\nBayern Amtsgericht München HRB 114750\nEinreichung neuer Dokumente\n\nSYSCOMTEC DISTRIBUTION Aktiengesellschaft\nAktiengesellschaft\nOberhaching\n\nDem Amtsgericht München -Registergericht- ist eine Liste der Mitglieder des Aufsichtsrats eingereicht worden, § 106 AktG."
    },
    {
      "date": "2024-12-31",
      "id": "97572",
      "original_text": "Registerbekanntmachung nach dem Umwandlungsgesetz\nBayern Amtsgericht München HRB 123355\nCloud SG Germany GmbH – München",
      "type": "Registerbekanntmachung nach dem Umwandlungsgesetz",
      "state": "Bayern",
      "amtsgericht": "Amtsgericht München",
      "registernummer": "HRB 123355",
      "registerart": "HRB",
      "company_name": "Cloud SG Germany GmbH",
      "company_seat": "München",
      "details": "31.12.2024 (Bekanntmachungsdatum)\n\nBayern Amtsgericht München HRB 123355\nRegisterbekanntmachung nach dem Umwandlungsgesetz 30.12.2024 (Eintragungsdatum)\n\nCloud SG Germany GmbH\nGesellschaft mit beschränkter Haftung\nMünchen\n\nDen Gläubigern der an der Verschmelzung beteiligten Rechtsträger ist, wenn sie binnen sechs Monaten nach dem Tag, an dem die Eintragung der Verschmelzung in das Register des Sitzes desjenigen Rechtsträgers, dessen Gläubiger sie sind, nach § 19 Abs. 3 UmwG als bekannt gemacht gilt, ihren Anspruch nach Grund und Höhe schriftlich anmelden, Sicherheit zu leisten, soweit sie nicht Befriedigung verlangen können. Dieses Recht steht den Gläubigern jedoch nur zu, wenn sie glaubhaft machen, dass durch die Verschmelzung die Erfüllung ihrer Forderung gefährdet wird."
    },
    {
      "date": "2024-12-31",
      "id": "97573",
      "original_text": "Löschungsankündigung\nBayern Amtsgericht München HRB 205906\nsvisser GmbH – München",
      "type": "Löschungsankündigung",
      "state": "Bayern",
      "amtsgericht": "Amtsgericht München",
      "registernummer": "HRB 205906",
      "registerart": "HRB",
      "company_name": "svisser GmbH",
      "company_seat": "München",
      "details": "31.12.2024 (Bekanntmachungsdatum)\n\nBayern Amtsgericht München HRB 205906\nLöschungsankündigung 30.12.2024 (Eintragungsdatum)\n\nsvisser GmbH\nGesellschaft mit beschränkter Haftung\nMünchen\n\nDas Registergericht beabsichtigt, die im Handelsregister eingetragene Gesellschaft wegen Vermögenslosigkeit von Amts wegen nach § 394 FamFG zu löschen. Die Frist zur Erhebung eines Widerspruchs ist auf drei Monate festgesetzt."
    },
    {
      "date": "2024-12-31",
      "id": "97574",
      "original_text": "Einreichung neuer Dokumente\nBayern Amtsgericht Memmingen HRB 11809\nGSI Gebäudeservice und Immobilienverwaltung Neu-Ulm GmbH – Neu-Ulm",
      "type": "Einreichung neuer Dokumente",
      "state": "Bayern",
      "amtsgericht": "Amtsgericht Memmingen",
      "registernummer": "HRB 11809",
      "registerart": "HRB",
      "company_name": "GSI Gebäudeservice und Immobilienverwaltung Neu-Ulm GmbH",
      "company_seat": "Neu-Ulm",
      "details": "31.12.2024 (Bekanntmachungsdatum)\n\nBayern Amtsgericht Memmingen HRB 11809\nEinreichung neuer Dokumente\n\nGSI Gebäudeservice und Immobilienverwaltung Neu-Ulm GmbH\nGesellschaft mit beschränkter Haftung\nNeu-Ulm\n\nDem Amtsgericht Memmingen -Registergericht- ist eine Liste der Mitglieder des Aufsichtsrats eingereicht worden, § 52 Abs. 3 S. 2 GmbHG."
    },
    {
      "date": "2024-12-31",
      "id": "97575",
      "original_text": "Sonstige Registerbekanntmachung\nBayern Amtsgericht München HRB 282266\nL.W.A. Services GmbH – Garching b.München",
      "type": "Sonstige Registerbekanntmachung",
      "state": "Bayern",
      "amtsgericht": "Amtsgericht München",
      "registernummer": "HRB 282266",
      "registerart": "HRB",
      "company_name": "L.W.A. Services GmbH",
      "company_seat": "Garching b.München",
      "details": "31.12.2024 (Bekanntmachungsdatum)\n\nBayern Amtsgericht München HRB 282266\nSonstige Registerbekanntmachung 30.12.2024 (Eintragungsdatum)\n\nL.W.A. Services GmbH\nGesellschaft mit beschränkter Haftung\nGarching b.München\n\nDen Gläubigern der Gesellschaft, deren Forderungen begründet worden sind, bevor die Eintragung der Beendigung des Beherrschungs- und Gewinnabführungsvertrages in das Handelsregister nach § 10 des Handelsgesetzbuches als bekanntgemacht gilt, hat der andere Vertragsteil Sicherheit zu leisten, wenn sie sich binnen sechs Monaten nach der Bekanntmachung der Eintragung zu diesem Zweck bei ihm melden."
    },
    {
      "date": "2024-12-31",
      "id": "97576",
      "original_text": "Registerbekanntmachung nach dem Umwandlungsgesetz\nBayern Amtsgericht München HRB 269433\nHi!Care Personal GmbH – München",
      "type": "Registerbekanntmachung nach dem Umwandlungsgesetz",
      "state": "Bayern",
      "amtsgericht": "Amtsgericht München",
      "registernummer": "HRB 269433",
      "registerart": "HRB",
      "company_name": "Hi!Care Personal GmbH",
      "company_seat": "München",
      "details": "31.12.2024 (Bekanntmachungsdatum)\n\nBayern Amtsgericht München HRB 269433\nRegisterbekanntmachung nach dem Umwandlungsgesetz 30.12.2024 (Eintragungsdatum)\n\nHi!Care Personal GmbH\nGesellschaft mit beschränkter Haftung\nMünchen\n\nDen Gläubigern der an der Verschmelzung beteiligten Rechtsträger ist, wenn sie binnen sechs Monaten nach dem Tag, an dem die Eintragung der Verschmelzung in das Register des Sitzes desjenigen Rechtsträgers, dessen Gläubiger sie sind, nach § 19 Abs. 3 UmwG als bekannt gemacht gilt, ihren Anspruch nach Grund und Höhe schriftlich anmelden, Sicherheit zu leisten, soweit sie nicht Befriedigung verlangen können. Dieses Recht steht den Gläubigern jedoch nur zu, wenn sie glaubhaft machen, dass durch die Verschmelzung die Erfüllung ihrer Forderung gefährdet wird."
    },
    {
      "date": "2024-12-31",
      "id": "97577",
      "original_text": "Registerbekanntmachung nach dem Umwandlungsgesetz\nBayern Amtsgericht Amberg HRB 6138\nGS-Klinker-Bau UG (haftungsbeschränkt) – Schwandorf",
      "type": "Registerbekanntmachung nach dem Umwandlungsgesetz",
      "state": "Bayern",
      "amtsgericht": "Amtsgericht Amberg",
      "registernummer": "HRB 6138",
      "registerart": "HRB",
      "company_name": "GS-Klinker-Bau UG (haftungsbeschränkt)",
      "company_seat": "Schwandorf",
      "details": "31.12.2024 (Bekanntmachungsdatum)\n\nBayern Amtsgericht Amberg HRB 6138\nRegisterbekanntmachung nach dem Umwandlungsgesetz 30.12.2024 (Eintragungsdatum)\n\nGS-Klinker-Bau UG (haftungsbeschränkt)\nGesellschaft mit beschränkter Haftung\nSchwandorf\n\nDen Gläubigern der an der Verschmelzung beteiligten Rechtsträger ist, wenn sie binnen sechs Monaten nach dem Tag, an dem die Eintragung der Verschmelzung in das Register des Sitzes desjenigen Rechtsträgers, dessen Gläubiger sie sind, nach § 19 Abs. 3 UmwG als bekannt gemacht gilt, ihren Anspruch nach Grund und Höhe schriftlich anmelden, Sicherheit zu leisten, soweit sie nicht Befriedigung verlangen können. Dieses Recht steht den Gläubigern jedoch nur zu, wenn sie glaubhaft machen, dass durch die Verschmelzung die Erfüllung ihrer Forderung gefährdet wird."
    },
    {
      "date": "2024-12-31",
      "id": "97578",
      "original_text": "Registerbekanntmachung nach dem Umwandlungsgesetz\nBayern Amtsgericht München HRA 113195\nNagelImmo Nord GmbH & Co. KG – Erding",
      "type": "Registerbekanntmachung nach dem Umwandlungsgesetz",
      "state": "Bayern",
      "amtsgericht": "Amtsgericht München",
      "registernummer": "HRA 113195",
      "registerart": "HRA",
      "company_name": "NagelImmo Nord GmbH & Co. KG",
      "company_seat": "Erding",
      "details": "31.12.2024 (Bekanntmachungsdatum)\n\nBayern Amtsgericht München HRA 113195\nRegisterbekanntmachung nach dem Umwandlungsgesetz 30.12.2024 (Eintragungsdatum)\n\nNagelImmo Nord GmbH & Co. KG\nKommanditgesellschaft\nErding\n\nDen Gläubigern der an der Verschmelzung beteiligten Rechtsträger ist, wenn sie binnen sechs Monaten nach dem Tag, an dem die Eintragung der Verschmelzung in das Register des Sitzes desjenigen Rechtsträgers, dessen Gläubiger sie sind, nach § 19 Abs. 3 UmwG als bekannt gemacht gilt, ihren Anspruch nach Grund und Höhe schriftlich anmelden, Sicherheit zu leisten, soweit sie nicht Befriedigung verlangen können. Dieses Recht steht den Gläubigern jedoch nur zu, wenn sie glaubhaft machen, dass durch die Verschmelzung die Erfüllung ihrer Forderung gefährdet wird."
    },
    {
      "date": "2024-12-31",
      "id": "97579",
      "original_text": "Löschungsankündigung\nBayern Amtsgericht München HRB 153201\nTranseuroplast Produktions- und Handelsgesellschaft mit beschränkter Haftung – München",
      "type": "Löschungsankündigung",
      "state": "Bayern",
      "amtsgericht": "Amtsgericht München",
      "registernummer": "HRB 153201",
      "registerart": "HRB",
      "company_name": "Transeuroplast Produktions- und Handelsgesellschaft mit beschränkter Haftung",
      "company_seat": "München",
      "details": "31.12.2024 (Bekanntmachungsdatum)\n\nBayern Amtsgericht München HRB 153201\nLöschungsankündigung 30.12.2024 (Eintragungsdatum)\n\nTranseuroplast Produktions- und Handelsgesellschaft mit beschränkter Haftung\nGesellschaft mit beschränkter Haftung\nMünchen\n\nDas Registergericht beabsichtigt, die im Handelsregister eingetragene Gesellschaft wegen Vermögenslosigkeit von Amts wegen nach § 394 FamFG zu löschen. Die Frist zur Erhebung eines Widerspruchs ist auf drei Monate festgesetzt."
    },
    {
      "date": "2024-12-31",
      "id": "97580",
      "original_text": "Einreichung neuer Dokumente\nBayern Amtsgericht Memmingen HRB 6974\nNUWOG - Wohnungsgesellschaft der Stadt Neu-Ulm GmbH – Neu-Ulm",
      "type": "Einreichung neuer Dokumente",
      "state": "Bayern",
      "amtsgericht": "Amtsgericht Memmingen",
      "registernummer": "HRB 6974",
      "registerart": "HRB",
      "company_name": "NUWOG - Wohnungsgesellschaft der Stadt Neu-Ulm GmbH",
      "company_seat": "Neu-Ulm",
      "details": "31.12.2024 (Bekanntmachungsdatum)\n\nBayern Amtsgericht Memmingen HRB 6974\nEinreichung neuer Dokumente\n\nNUWOG - Wohnungsgesellschaft der Stadt Neu-Ulm GmbH\nGesellschaft mit beschränkter Haftung\nNeu-Ulm\n\nDem Amtsgericht Memmingen -Registergericht- ist eine Liste der Mitglieder des Aufsichtsrats eingereicht worden, § 52 Abs. 3 S. 2 GmbHG."
    },
    {
      "date": "2024-12-31",
      "id": "97581",
      "original_text": "Löschungsankündigung\nBayern Amtsgericht München HRB 281603\nachtBär UG (haftungsbeschränkt) – München",
      "type": "Löschungsankündigung",
      "state": "Bayern",
      "amtsgericht": "Amtsgericht München",
      "registernummer": "HRB 281603",
      "registerart": "HRB",
      "company_name": "achtBär UG (haftungsbeschränkt)",
      "company_seat": "München",
      "details": "31.12.2024 (Bekanntmachungsdatum)\n\nBayern Amtsgericht München HRB 281603\nLöschungsankündigung 30.12.2024 (Eintragungsdatum)\n\nachtBär UG (haftungsbeschränkt)\nGesellschaft mit beschränkter Haftung\nMünchen\n\nDas Registergericht beabsichtigt, die im Handelsregister eingetragene Gesellschaft wegen Vermögenslosigkeit von Amts wegen nach § 394 FamFG zu löschen. Die Frist zur Erhebung eines Widerspruchs ist auf drei Monate festgesetzt."
    },
    {
      "date": "2024-12-31",
      "id": "97582",
      "original_text": "Registerbekanntmachung nach dem Umwandlungsgesetz\nHessen Amtsgericht Frankfurt am Main HRB 56693\nAdenza Germany GmbH – Frankfurt am Main",
      "type": "Registerbekanntmachung nach dem Umwandlungsgesetz",
      "state": "Hessen",
      "amtsgericht": "Amtsgericht Frankfurt am Main",
      "registernummer": "HRB 56693",
      "registerart": "HRB",
      "company_name": "Adenza Germany GmbH",
      "company_seat": "Frankfurt am Main",
      "details": "31.12.2024 (Bekanntmachungsdatum)\n\nHessen Amtsgericht Frankfurt am Main HRB 56693\nRegisterbekanntmachung nach dem Umwandlungsgesetz 31.12.2024 (Eintragungsdatum)\n\nAdenza Germany GmbH\nGesellschaft mit beschränkter Haftung\nFrankfurt am Main\n\nDen Gläubigern der an der Verschmelzung beteiligten Rechtsträger ist, wenn sie binnen sechs Monaten nach dem Tag, an dem die Eintragung der Verschmelzung in das Register des Sitzes desjenigen Rechtsträgers, dessen Gläubiger sie sind, nach § 19 Absatz 3 UmwG bekannt gemacht worden ist, ihren Anspruch nach Grund und Höhe schriftlich anmelden, Sicherheit zu leisten, soweit sie nicht Befriedigung verlangen können. Dieses Recht steht den Gläubigern jedoch nur zu, wenn sie glaubhaft machen, dass durch die Verschmelzung die Erfüllung ihrer Forderung gefährdet wird."
    },
    {
      "date": "2024-12-31",
      "id": "97583",
      "original_text": "Registerbekanntmachung nach dem Umwandlungsgesetz\nHessen Amtsgericht Frankfurt am Main HRB 110077\nNasdaq Germany GmbH – Frankfurt am Main",
      "type": "Registerbekanntmachung nach dem Umwandlungsgesetz",
      "state": "Hessen",
      "amtsgericht": "Amtsgericht Frankfurt am Main",
      "registernummer": "HRB 110077",
      "registerart": "HRB",
      "company_name": "Nasdaq Germany GmbH",
      "company_seat": "Frankfurt am Main",
      "details": "31.12.2024 (Bekanntmachungsdatum)\n\nHessen Amtsgericht Frankfurt am Main HRB 110077\nRegisterbekanntmachung nach dem Umwandlungsgesetz 31.12.2024 (Eintragungsdatum)\n\nNasdaq Germany GmbH\nGesellschaft mit beschränkter Haftung\nFrankfurt am Main\n\nDen Gläubigern der an der Verschmelzung beteiligten Rechtsträger ist, wenn sie binnen sechs Monaten nach dem Tag, an dem die Eintragung der Verschmelzung in das Register des Sitzes desjenigen Rechtsträgers, dessen Gläubiger sie sind, nach § 19 Absatz 3 UmwG bekannt gemacht worden ist, ihren Anspruch nach Grund und Höhe schriftlich anmelden, Sicherheit zu leisten, soweit sie nicht Befriedigung verlangen können. Dieses Recht steht den Gläubigern jedoch nur zu, wenn sie glaubhaft machen, dass durch die Verschmelzung die Erfüllung ihrer Forderung gefährdet wird."
    }
  ]
}