{
  "date": "2024-12-03",
  "date_of_scrape": "2024-12-04T04:08:12.012Z",
  "tool_version": "0.2.0",
  "number_of_announcements": 124,
  "announcements": [
    {
      "date": "2024-12-03",
      "id": "95194",
      "original_text": "Registerbekanntmachung nach dem Umwandlungsgesetz\nBayern Amtsgericht München HRB 150384\nSEP Aktiengesellschaft – Holzkirchen",
      "type": "Registerbekanntmachung nach dem Umwandlungsgesetz",
      "state": "Bayern",
      "amtsgericht": "Amtsgericht München",
      "registernummer": "HRB 150384",
      "registerart": "HRB",
      "company_name": "SEP Aktiengesellschaft",
      "company_seat": "Holzkirchen",
      "details": "03.12.2024 (Bekanntmachungsdatum)\n\nBayern Amtsgericht München HRB 150384\nRegisterbekanntmachung nach dem Umwandlungsgesetz 02.12.2024 (Eintragungsdatum)\n\nSEP Aktiengesellschaft\nAktiengesellschaft\nHolzkirchen\n\nDen Gläubigern des formwechselnden Rechtsträgers ist, wenn sie binnen sechs Monaten nach dem Tag, an dem die Eintragung des Formwechsels nach § 201 UmwG als bekannt gemacht gilt, ihren Anspruch nach Grund und Höhe schriftlich anmelden, Sicherheit zu leisten, soweit sie nicht Befriedigung verlangen können. Dieses Recht steht den Gläubigern jedoch nur zu, wenn sie glaubhaft machen, dass durch den Formwechsel die Erfüllung ihrer Forderung gefährdet wird."
    },
    {
      "date": "2024-12-03",
      "id": "95195",
      "original_text": "Registerbekanntmachung nach dem Umwandlungsgesetz\nBayern Amtsgericht Nürnberg HRB 43449\nDGAPI - Deutsche Gesellschaft für attraktive Personalinstrumente mbH – Nürnberg",
      "type": "Registerbekanntmachung nach dem Umwandlungsgesetz",
      "state": "Bayern",
      "amtsgericht": "Amtsgericht Nürnberg",
      "registernummer": "HRB 43449",
      "registerart": "HRB",
      "company_name": "DGAPI - Deutsche Gesellschaft für attraktive Personalinstrumente mbH",
      "company_seat": "Nürnberg",
      "details": "03.12.2024 (Bekanntmachungsdatum)\n\nBayern Amtsgericht Nürnberg HRB 43449\nRegisterbekanntmachung nach dem Umwandlungsgesetz 02.12.2024 (Eintragungsdatum)\n\nDGAPI - Deutsche Gesellschaft für attraktive Personalinstrumente mbH\nGesellschaft mit beschränkter Haftung\nNürnberg\n\nDen Gläubigern der an der Verschmelzung beteiligten Rechtsträger ist, wenn sie binnen sechs Monaten nach dem Tag, an dem die Eintragung der Verschmelzung in das Register des Sitzes desjenigen Rechtsträgers, dessen Gläubiger sie sind, nach § 19 Abs. 3 UmwG als bekannt gemacht gilt, ihren Anspruch nach Grund und Höhe schriftlich anmelden, Sicherheit zu leisten, soweit sie nicht Befriedigung verlangen können. Dieses Recht steht den Gläubigern jedoch nur zu, wenn sie glaubhaft machen, dass durch die Verschmelzung die Erfüllung ihrer Forderung gefährdet wird."
    },
    {
      "date": "2024-12-03",
      "id": "95196",
      "original_text": "Registerbekanntmachung nach dem Umwandlungsgesetz\nBayern Amtsgericht Nürnberg HRB 43502\nDGEO - Deutsche Gesellschaft für Entgeltoptimierung mbH – Nürnberg",
      "type": "Registerbekanntmachung nach dem Umwandlungsgesetz",
      "state": "Bayern",
      "amtsgericht": "Amtsgericht Nürnberg",
      "registernummer": "HRB 43502",
      "registerart": "HRB",
      "company_name": "DGEO - Deutsche Gesellschaft für Entgeltoptimierung mbH",
      "company_seat": "Nürnberg",
      "details": "03.12.2024 (Bekanntmachungsdatum)\n\nBayern Amtsgericht Nürnberg HRB 43502\nRegisterbekanntmachung nach dem Umwandlungsgesetz 02.12.2024 (Eintragungsdatum)\n\nDGEO - Deutsche Gesellschaft für Entgeltoptimierung mbH\nGesellschaft mit beschränkter Haftung\nNürnberg\n\nDen Gläubigern der an der Verschmelzung beteiligten Rechtsträger ist, wenn sie binnen sechs Monaten nach dem Tag, an dem die Eintragung der Verschmelzung in das Register des Sitzes desjenigen Rechtsträgers, dessen Gläubiger sie sind, nach § 19 Abs. 3 UmwG als bekannt gemacht gilt, ihren Anspruch nach Grund und Höhe schriftlich anmelden, Sicherheit zu leisten, soweit sie nicht Befriedigung verlangen können. Dieses Recht steht den Gläubigern jedoch nur zu, wenn sie glaubhaft machen, dass durch die Verschmelzung die Erfüllung ihrer Forderung gefährdet wird."
    },
    {
      "date": "2024-12-03",
      "id": "95197",
      "original_text": "Sonstige Registerbekanntmachung\nBayern Amtsgericht Nürnberg HRB 23465\nJohnson Outdoors Vertriebsgesellschaft mbH – Nürnberg",
      "type": "Sonstige Registerbekanntmachung",
      "state": "Bayern",
      "amtsgericht": "Amtsgericht Nürnberg",
      "registernummer": "HRB 23465",
      "registerart": "HRB",
      "company_name": "Johnson Outdoors Vertriebsgesellschaft mbH",
      "company_seat": "Nürnberg",
      "details": "03.12.2024 (Bekanntmachungsdatum)\n\nBayern Amtsgericht Nürnberg HRB 23465\nSonstige Registerbekanntmachung 02.12.2024 (Eintragungsdatum)\n\nJohnson Outdoors Vertriebsgesellschaft mbH\nGesellschaft mit beschränkter Haftung\nNürnberg\n\nDen Gläubigern der Gesellschaft, deren Forderungen begründet worden sind, bevor die Eintragung der Beendigung des Beherrschungs- und Gewinnabführungsvertrages in das Handelsregister nach § 10 des Handelsgesetzbuches als bekanntgemacht gilt, hat der andere Vertragsteil Sicherheit zu leisten, wenn sie sich binnen sechs Monaten nach der Bekanntmachung der Eintragung zu diesem Zweck bei ihm melden."
    },
    {
      "date": "2024-12-03",
      "id": "95198",
      "original_text": "Löschungsankündigung\nBayern Amtsgericht Nürnberg HRB 27354\nLoth Solar GmbH – Neumarkt i.d.OPf.",
      "type": "Löschungsankündigung",
      "state": "Bayern",
      "amtsgericht": "Amtsgericht Nürnberg",
      "registernummer": "HRB 27354",
      "registerart": "HRB",
      "company_name": "Loth Solar GmbH",
      "company_seat": "Neumarkt i.d.OPf.",
      "details": "03.12.2024 (Bekanntmachungsdatum)\n\nBayern Amtsgericht Nürnberg HRB 27354\nLöschungsankündigung\n\nLoth Solar GmbH\nGesellschaft mit beschränkter Haftung\nNeumarkt i.d.OPf.\n\nDas Registergericht beabsichtigt, die im Handelsregister eingetragene Gesellschaft wegen Vermögenslosigkeit von Amts wegen nach § 394 FamFG zu löschen. Die Frist zur Erhebung eines Widerspruchs ist auf einen Monat festgesetzt."
    },
    {
      "date": "2024-12-03",
      "id": "95199",
      "original_text": "Registerbekanntmachung nach dem Umwandlungsgesetz\nBayern Amtsgericht München HRB 177695\nAP Solutions GmbH – München",
      "type": "Registerbekanntmachung nach dem Umwandlungsgesetz",
      "state": "Bayern",
      "amtsgericht": "Amtsgericht München",
      "registernummer": "HRB 177695",
      "registerart": "HRB",
      "company_name": "AP Solutions GmbH",
      "company_seat": "München",
      "details": "03.12.2024 (Bekanntmachungsdatum)\n\nBayern Amtsgericht München HRB 177695\nRegisterbekanntmachung nach dem Umwandlungsgesetz 02.12.2024 (Eintragungsdatum)\n\nAP Solutions GmbH\nGesellschaft mit beschränkter Haftung\nMünchen\n\nDen Gläubigern der an der grenzüberschreitenden Ausgliederung beteiligten übernehmenden Rechtsträger ist, wenn sie binnen sechs Monaten nach dem Tag, an dem die Eintragung der Spaltung in das Register des Sitzes desjenigen Rechtsträgers, dessen Gläubiger sie sind, nach §§ 125, 19 Abs. 3 UmwG als bekannt gemacht gilt, ihren Anspruch nach Grund und Höhe schriftlich anmelden, Sicherheit zu leisten, soweit sie nicht Befriedigung verlangen können. Dieses Recht steht den Gläubigern jedoch nur zu, wenn sie glaubhaft machen, dass durch die Spaltung die Erfüllung ihrer Forderung gefährdet wird."
    },
    {
      "date": "2024-12-03",
      "id": "95200",
      "original_text": "Registerbekanntmachung nach dem Umwandlungsgesetz\nBayern Amtsgericht München HRB 282314\nHotel am Binger Hafenpark Mobilien GmbH – Bad Wiessee",
      "type": "Registerbekanntmachung nach dem Umwandlungsgesetz",
      "state": "Bayern",
      "amtsgericht": "Amtsgericht München",
      "registernummer": "HRB 282314",
      "registerart": "HRB",
      "company_name": "Hotel am Binger Hafenpark Mobilien GmbH",
      "company_seat": "Bad Wiessee",
      "details": "03.12.2024 (Bekanntmachungsdatum)\n\nBayern Amtsgericht München HRB 282314\nRegisterbekanntmachung nach dem Umwandlungsgesetz 02.12.2024 (Eintragungsdatum)\n\nHotel am Binger Hafenpark Mobilien GmbH\nGesellschaft mit beschränkter Haftung\nBad Wiessee\n\nDen Gläubigern der an der Verschmelzung beteiligten Rechtsträger ist, wenn sie binnen sechs Monaten nach dem Tag, an dem die Eintragung der Verschmelzung in das Register des Sitzes desjenigen Rechtsträgers, dessen Gläubiger sie sind, nach § 19 Abs. 3 UmwG als bekannt gemacht gilt, ihren Anspruch nach Grund und Höhe schriftlich anmelden, Sicherheit zu leisten, soweit sie nicht Befriedigung verlangen können. Dieses Recht steht den Gläubigern jedoch nur zu, wenn sie glaubhaft machen, dass durch die Verschmelzung die Erfüllung ihrer Forderung gefährdet wird."
    },
    {
      "date": "2024-12-03",
      "id": "95201",
      "original_text": "Registerbekanntmachung nach dem Umwandlungsgesetz\nBayern Amtsgericht München HRB 251232\nTion Renewables AG – München",
      "type": "Registerbekanntmachung nach dem Umwandlungsgesetz",
      "state": "Bayern",
      "amtsgericht": "Amtsgericht München",
      "registernummer": "HRB 251232",
      "registerart": "HRB",
      "company_name": "Tion Renewables AG",
      "company_seat": "München",
      "details": "03.12.2024 (Bekanntmachungsdatum)\n\nBayern Amtsgericht München HRB 251232\nRegisterbekanntmachung nach dem Umwandlungsgesetz 02.12.2024 (Eintragungsdatum)\n\nTion Renewables AG\nAktiengesellschaft\nMünchen\n\nDen Gläubigern des formwechselnden Rechtsträgers ist, wenn sie binnen sechs Monaten nach dem Tag, an dem die Eintragung des Formwechsels nach § 201 UmwG als bekannt gemacht gilt, ihren Anspruch nach Grund und Höhe schriftlich anmelden, Sicherheit zu leisten, soweit sie nicht Befriedigung verlangen können. Dieses Recht steht den Gläubigern jedoch nur zu, wenn sie glaubhaft machen, dass durch den Formwechsel die Erfüllung ihrer Forderung gefährdet wird."
    },
    {
      "date": "2024-12-03",
      "id": "95202",
      "original_text": "Einreichung neuer Dokumente\nBayern Amtsgericht Bamberg HRB 10655\nCleantech Innovation Park GmbH – Hallstadt",
      "type": "Einreichung neuer Dokumente",
      "state": "Bayern",
      "amtsgericht": "Amtsgericht Bamberg",
      "registernummer": "HRB 10655",
      "registerart": "HRB",
      "company_name": "Cleantech Innovation Park GmbH",
      "company_seat": "Hallstadt",
      "details": "03.12.2024 (Bekanntmachungsdatum)\n\nBayern Amtsgericht Bamberg HRB 10655\nEinreichung neuer Dokumente\n\nCleantech Innovation Park GmbH\nGesellschaft mit beschränkter Haftung\nHallstadt\n\nDem Amtsgericht Bamberg -Registergericht- ist eine Liste der Mitglieder des Aufsichtsrats eingereicht worden, § 52 Abs. 3 S. 2 GmbHG."
    },
    {
      "date": "2024-12-03",
      "id": "95203",
      "original_text": "Registerbekanntmachung nach dem Umwandlungsgesetz\nBayern Amtsgericht München HRB 177695\nAP Solutions GmbH – München",
      "type": "Registerbekanntmachung nach dem Umwandlungsgesetz",
      "state": "Bayern",
      "amtsgericht": "Amtsgericht München",
      "registernummer": "HRB 177695",
      "registerart": "HRB",
      "company_name": "AP Solutions GmbH",
      "company_seat": "München",
      "details": "03.12.2024 (Bekanntmachungsdatum)\n\nBayern Amtsgericht München HRB 177695\nRegisterbekanntmachung nach dem Umwandlungsgesetz 02.12.2024 (Eintragungsdatum)\n\nAP Solutions GmbH\nGesellschaft mit beschränkter Haftung\nMünchen\n\nDen Gläubigern der an der Verschmelzung beteiligten Rechtsträger ist, wenn sie binnen sechs Monaten nach dem Tag, an dem die Eintragung der Verschmelzung in das Register des Sitzes desjenigen Rechtsträgers, dessen Gläubiger sie sind, nach § 19 Abs. 3 UmwG als bekannt gemacht gilt, ihren Anspruch nach Grund und Höhe schriftlich anmelden, Sicherheit zu leisten, soweit sie nicht Befriedigung verlangen können. Dieses Recht steht den Gläubigern jedoch nur zu, wenn sie glaubhaft machen, dass durch die Verschmelzung die Erfüllung ihrer Forderung gefährdet wird."
    },
    {
      "date": "2024-12-03",
      "id": "95204",
      "original_text": "Registerbekanntmachung nach dem Umwandlungsgesetz\nBayern Amtsgericht München HRB 298001\nSEP GmbH – Holzkirchen",
      "type": "Registerbekanntmachung nach dem Umwandlungsgesetz",
      "state": "Bayern",
      "amtsgericht": "Amtsgericht München",
      "registernummer": "HRB 298001",
      "registerart": "HRB",
      "company_name": "SEP GmbH",
      "company_seat": "Holzkirchen",
      "details": "03.12.2024 (Bekanntmachungsdatum)\n\nBayern Amtsgericht München HRB 298001\nRegisterbekanntmachung nach dem Umwandlungsgesetz 02.12.2024 (Eintragungsdatum)\n\nSEP GmbH\nGesellschaft mit beschränkter Haftung\nHolzkirchen\n\nDen Gläubigern des formwechselnden Rechtsträgers ist, wenn sie binnen sechs Monaten nach dem Tag, an dem die Eintragung des Formwechsels nach § 201 UmwG als bekannt gemacht gilt, ihren Anspruch nach Grund und Höhe schriftlich anmelden, Sicherheit zu leisten, soweit sie nicht Befriedigung verlangen können. Dieses Recht steht den Gläubigern jedoch nur zu, wenn sie glaubhaft machen, dass durch den Formwechsel die Erfüllung ihrer Forderung gefährdet wird."
    },
    {
      "date": "2024-12-03",
      "id": "95205",
      "original_text": "Einreichung neuer Dokumente\nBayern Amtsgericht Coburg HRB 2373\nValeo Klimasysteme GmbH – Bad Rodach",
      "type": "Einreichung neuer Dokumente",
      "state": "Bayern",
      "amtsgericht": "Amtsgericht Coburg",
      "registernummer": "HRB 2373",
      "registerart": "HRB",
      "company_name": "Valeo Klimasysteme GmbH",
      "company_seat": "Bad Rodach",
      "details": "03.12.2024 (Bekanntmachungsdatum)\n\nBayern Amtsgericht Coburg HRB 2373\nEinreichung neuer Dokumente\n\nValeo Klimasysteme GmbH\nGesellschaft mit beschränkter Haftung\nBad Rodach\n\nDem Amtsgericht Coburg -Registergericht- ist eine Liste der Mitglieder des Aufsichtsrats eingereicht worden, § 52 Abs. 3 S. 2 GmbHG."
    },
    {
      "date": "2024-12-03",
      "id": "95206",
      "original_text": "Löschungsankündigung\nBayern Amtsgericht München HRB 156584\niPass Deutschland GmbH – München",
      "type": "Löschungsankündigung",
      "state": "Bayern",
      "amtsgericht": "Amtsgericht München",
      "registernummer": "HRB 156584",
      "registerart": "HRB",
      "company_name": "iPass Deutschland GmbH",
      "company_seat": "München",
      "details": "03.12.2024 (Bekanntmachungsdatum)\n\nBayern Amtsgericht München HRB 156584\nLöschungsankündigung\n\niPass Deutschland GmbH\nGesellschaft mit beschränkter Haftung\nMünchen\n\nDas Registergericht beabsichtigt, die im Handelsregister eingetragene Gesellschaft wegen Vermögenslosigkeit von Amts wegen nach § 394 FamFG zu löschen. Die Frist zur Erhebung eines Widerspruchs ist auf drei Monate festgesetzt."
    },
    {
      "date": "2024-12-03",
      "id": "95207",
      "original_text": "Registerbekanntmachung nach dem Umwandlungsgesetz\nBayern Amtsgericht Hof HRB 2018\nFondsdepot Bank GmbH – Hof",
      "type": "Registerbekanntmachung nach dem Umwandlungsgesetz",
      "state": "Bayern",
      "amtsgericht": "Amtsgericht Hof",
      "registernummer": "HRB 2018",
      "registerart": "HRB",
      "company_name": "Fondsdepot Bank GmbH",
      "company_seat": "Hof",
      "details": "03.12.2024 (Bekanntmachungsdatum)\n\nBayern Amtsgericht Hof HRB 2018\nRegisterbekanntmachung nach dem Umwandlungsgesetz 02.12.2024 (Eintragungsdatum)\n\nFondsdepot Bank GmbH\nGesellschaft mit beschränkter Haftung\nHof\n\nDen Gläubigern der an der Spaltung beteiligten Rechtsträger ist, wenn sie binnen sechs Monaten nach dem Tag, an dem die Eintragung der Spaltung in das Register des Sitzes desjenigen Rechtsträgers, dessen Gläubiger sie sind, nach §§ 125, 19 Abs. 3 UmwG als bekannt gemacht gilt, ihren Anspruch nach Grund und Höhe schriftlich anmelden, Sicherheit zu leisten, soweit sie nicht Befriedigung verlangen können. Dieses Recht steht den Gläubigern jedoch nur zu, wenn sie glaubhaft machen, dass durch die Spaltung die Erfüllung ihrer Forderung gefährdet wird."
    },
    {
      "date": "2024-12-03",
      "id": "95208",
      "original_text": "Registerbekanntmachung nach dem Umwandlungsgesetz\nBayern Amtsgericht Ingolstadt HRB 11845\nHubert + Freihart Ingenieure GmbH – Eichstätt",
      "type": "Registerbekanntmachung nach dem Umwandlungsgesetz",
      "state": "Bayern",
      "amtsgericht": "Amtsgericht Ingolstadt",
      "registernummer": "HRB 11845",
      "registerart": "HRB",
      "company_name": "Hubert + Freihart Ingenieure GmbH",
      "company_seat": "Eichstätt",
      "details": "03.12.2024 (Bekanntmachungsdatum)\n\nBayern Amtsgericht Ingolstadt HRB 11845\nRegisterbekanntmachung nach dem Umwandlungsgesetz 02.12.2024 (Eintragungsdatum)\n\nHubert + Freihart Ingenieure GmbH\nGesellschaft mit beschränkter Haftung\nEichstätt\n\nDen Gläubigern der an der Spaltung beteiligten Rechtsträger ist, wenn sie binnen sechs Monaten nach dem Tag, an dem die Eintragung der Spaltung in das Register des Sitzes desjenigen Rechtsträgers, dessen Gläubiger sie sind, nach §§ 125, 19 Abs. 3 UmwG als bekannt gemacht gilt, ihren Anspruch nach Grund und Höhe schriftlich anmelden, Sicherheit zu leisten, soweit sie nicht Befriedigung verlangen können. Dieses Recht steht den Gläubigern jedoch nur zu, wenn sie glaubhaft machen, dass durch die Spaltung die Erfüllung ihrer Forderung gefährdet wird."
    },
    {
      "date": "2024-12-03",
      "id": "95209",
      "original_text": "Registerbekanntmachung nach dem Umwandlungsgesetz\nBayern Amtsgericht Traunstein HRB 18491\nKölbl & Vogl GmbH – Rohrdorf",
      "type": "Registerbekanntmachung nach dem Umwandlungsgesetz",
      "state": "Bayern",
      "amtsgericht": "Amtsgericht Traunstein",
      "registernummer": "HRB 18491",
      "registerart": "HRB",
      "company_name": "Kölbl & Vogl GmbH",
      "company_seat": "Rohrdorf",
      "details": "03.12.2024 (Bekanntmachungsdatum)\n\nBayern Amtsgericht Traunstein HRB 18491\nRegisterbekanntmachung nach dem Umwandlungsgesetz 02.12.2024 (Eintragungsdatum)\n\nKölbl & Vogl GmbH\nGesellschaft mit beschränkter Haftung\nRohrdorf\n\nDen Gläubigern der an der Verschmelzung beteiligten Rechtsträger ist, wenn sie binnen sechs Monaten nach dem Tag, an dem die Eintragung der Verschmelzung in das Register des Sitzes desjenigen Rechtsträgers, dessen Gläubiger sie sind, nach § 19 Abs. 3 UmwG als bekannt gemacht gilt, ihren Anspruch nach Grund und Höhe schriftlich anmelden, Sicherheit zu leisten, soweit sie nicht Befriedigung verlangen können. Dieses Recht steht den Gläubigern jedoch nur zu, wenn sie glaubhaft machen, dass durch die Verschmelzung die Erfüllung ihrer Forderung gefährdet wird."
    },
    {
      "date": "2024-12-03",
      "id": "95210",
      "original_text": "Einreichung neuer Dokumente\nBayern Amtsgericht Bamberg HRB 11417\nCleantech Cluster GmbH – Hallstadt",
      "type": "Einreichung neuer Dokumente",
      "state": "Bayern",
      "amtsgericht": "Amtsgericht Bamberg",
      "registernummer": "HRB 11417",
      "registerart": "HRB",
      "company_name": "Cleantech Cluster GmbH",
      "company_seat": "Hallstadt",
      "details": "03.12.2024 (Bekanntmachungsdatum)\n\nBayern Amtsgericht Bamberg HRB 11417\nEinreichung neuer Dokumente\n\nCleantech Cluster GmbH\nGesellschaft mit beschränkter Haftung\nHallstadt\n\nDem Amtsgericht Bamberg -Registergericht- ist eine Liste der Mitglieder des Aufsichtsrats eingereicht worden, § 52 Abs. 3 S. 2 GmbHG."
    },
    {
      "date": "2024-12-03",
      "id": "95211",
      "original_text": "Registerbekanntmachung nach dem Umwandlungsgesetz\nBayern Amtsgericht München HRB 298005\n089 Fahrschule München GmbH – München",
      "type": "Registerbekanntmachung nach dem Umwandlungsgesetz",
      "state": "Bayern",
      "amtsgericht": "Amtsgericht München",
      "registernummer": "HRB 298005",
      "registerart": "HRB",
      "company_name": "089 Fahrschule München GmbH",
      "company_seat": "München",
      "details": "03.12.2024 (Bekanntmachungsdatum)\n\nBayern Amtsgericht München HRB 298005\nRegisterbekanntmachung nach dem Umwandlungsgesetz 02.12.2024 (Eintragungsdatum)\n\n089 Fahrschule München GmbH\nGesellschaft mit beschränkter Haftung\nMünchen\n\nDen Gläubigern der an der Ausgliederung beteiligten Rechtsträger ist, wenn sie binnen sechs Monaten nach dem Tag, an dem die Eintragung der Ausgliederung in das Register des Sitzes desjenigen Rechtsträgers, dessen Gläubiger sie sind, nach §§ 125, 19 Abs. 3 UmwG als bekannt gemacht gilt, ihren Anspruch nach Grund und Höhe schriftlich anmelden, Sicherheit zu leisten, soweit sie nicht Befriedigung verlangen können. Dieses Recht steht den Gläubigern jedoch nur zu, wenn sie glaubhaft machen, dass durch die Ausgliederung die Erfüllung ihrer Forderung gefährdet wird."
    },
    {
      "date": "2024-12-03",
      "id": "95212",
      "original_text": "Löschungsankündigung\nBayern Amtsgericht Landshut HRB 9682\nAlphagold GmbH, Zweigniederlassung Deutschland – Landshut",
      "type": "Löschungsankündigung",
      "state": "Bayern",
      "amtsgericht": "Amtsgericht Landshut",
      "registernummer": "HRB 9682",
      "registerart": "HRB",
      "company_name": "Alphagold GmbH, Zweigniederlassung Deutschland",
      "company_seat": "Landshut",
      "details": "03.12.2024 (Bekanntmachungsdatum)\n\nBayern Amtsgericht Landshut HRB 9682\nLöschungsankündigung\n\nAlphagold GmbH, Zweigniederlassung Deutschland\nRechtsform ausländischen Rechts HRB\nLandshut\n\nDas Registergericht beabsichtigt, die im Handelsregister B eingetragene Zweigniederlassung von Amts wegen nach § 395 FamFG zu löschen. Die Frist zur Erhebung eines Widerspruchs ist auf einen Monat festgesetzt."
    },
    {
      "date": "2024-12-03",
      "id": "95213",
      "original_text": "Löschungsankündigung\nBayern Amtsgericht Landshut HRB 9318\nDLVHG GmbH – Massing",
      "type": "Löschungsankündigung",
      "state": "Bayern",
      "amtsgericht": "Amtsgericht Landshut",
      "registernummer": "HRB 9318",
      "registerart": "HRB",
      "company_name": "DLVHG GmbH",
      "company_seat": "Massing",
      "details": "03.12.2024 (Bekanntmachungsdatum)\n\nBayern Amtsgericht Landshut HRB 9318\nLöschungsankündigung\n\nDLVHG GmbH\nGesellschaft mit beschränkter Haftung\nMassing\n\nDas Registergericht beabsichtigt, die im Handelsregister eingetragene Gesellschaft wegen Vermögenslosigkeit von Amts wegen nach § 394 FamFG zu löschen. Die Frist zur Erhebung eines Widerspruchs ist auf einen Monat festgesetzt."
    },
    {
      "date": "2024-12-03",
      "id": "95214",
      "original_text": "Registerbekanntmachung nach dem Umwandlungsgesetz\nBayern Amtsgericht München HRB 177695\nAP Solutions GmbH – München",
      "type": "Registerbekanntmachung nach dem Umwandlungsgesetz",
      "state": "Bayern",
      "amtsgericht": "Amtsgericht München",
      "registernummer": "HRB 177695",
      "registerart": "HRB",
      "company_name": "AP Solutions GmbH",
      "company_seat": "München",
      "details": "03.12.2024 (Bekanntmachungsdatum)\n\nBayern Amtsgericht München HRB 177695\nRegisterbekanntmachung nach dem Umwandlungsgesetz 02.12.2024 (Eintragungsdatum)\n\nAP Solutions GmbH\nGesellschaft mit beschränkter Haftung\nMünchen\n\nDen Gläubigern der an der grenzüberschreitenden Ausgliederung beteiligten übernehmenden Rechtsträger ist, wenn sie binnen sechs Monaten nach dem Tag, an dem die Eintragung der Spaltung in das Register des Sitzes desjenigen Rechtsträgers, dessen Gläubiger sie sind, nach §§ 125, 19 Abs. 3 UmwG als bekannt gemacht gilt, ihren Anspruch nach Grund und Höhe schriftlich anmelden, Sicherheit zu leisten, soweit sie nicht Befriedigung verlangen können. Dieses Recht steht den Gläubigern jedoch nur zu, wenn sie glaubhaft machen, dass durch die Spaltung die Erfüllung ihrer Forderung gefährdet wird."
    },
    {
      "date": "2024-12-03",
      "id": "95215",
      "original_text": "Löschungsankündigung\nBayern Amtsgericht Kempten (Allgäu) HRB 5127\nMauerstettener Wohnbau GmbH – Mauerstetten",
      "type": "Löschungsankündigung",
      "state": "Bayern",
      "amtsgericht": "Amtsgericht Kempten (Allgäu)",
      "registernummer": "HRB 5127",
      "registerart": "HRB",
      "company_name": "Mauerstettener Wohnbau GmbH",
      "company_seat": "Mauerstetten",
      "details": "03.12.2024 (Bekanntmachungsdatum)\n\nBayern Amtsgericht Kempten (Allgäu) HRB 5127\nLöschungsankündigung\n\nMauerstettener Wohnbau GmbH\nGesellschaft mit beschränkter Haftung\nMauerstetten\n\nDas Registergericht beabsichtigt, die im Handelsregister eingetragene Gesellschaft wegen Vermögenslosigkeit von Amts wegen nach § 394 FamFG zu löschen. Die Frist zur Erhebung eines Widerspruchs ist auf einen Monat festgesetzt."
    },
    {
      "date": "2024-12-03",
      "id": "95216",
      "original_text": "Registerbekanntmachung nach dem Umwandlungsgesetz\nBayern Amtsgericht München HRB 74755\nWittmann Entsorgungswirtschaft GmbH – Gräfelfing",
      "type": "Registerbekanntmachung nach dem Umwandlungsgesetz",
      "state": "Bayern",
      "amtsgericht": "Amtsgericht München",
      "registernummer": "HRB 74755",
      "registerart": "HRB",
      "company_name": "Wittmann Entsorgungswirtschaft GmbH",
      "company_seat": "Gräfelfing",
      "details": "03.12.2024 (Bekanntmachungsdatum)\n\nBayern Amtsgericht München HRB 74755\nRegisterbekanntmachung nach dem Umwandlungsgesetz 02.12.2024 (Eintragungsdatum)\n\nWittmann Entsorgungswirtschaft GmbH\nGesellschaft mit beschränkter Haftung\nGräfelfing\n\nDen Gläubigern der an der Verschmelzung beteiligten Rechtsträger ist, wenn sie binnen sechs Monaten nach dem Tag, an dem die Eintragung der Verschmelzung in das Register des Sitzes desjenigen Rechtsträgers, dessen Gläubiger sie sind, nach § 19 Abs. 3 UmwG als bekannt gemacht gilt, ihren Anspruch nach Grund und Höhe schriftlich anmelden, Sicherheit zu leisten, soweit sie nicht Befriedigung verlangen können. Dieses Recht steht den Gläubigern jedoch nur zu, wenn sie glaubhaft machen, dass durch die Verschmelzung die Erfüllung ihrer Forderung gefährdet wird."
    },
    {
      "date": "2024-12-03",
      "id": "95217",
      "original_text": "Löschungsankündigung\nBaden-Württemberg Amtsgericht Freiburg HRB 718451\nHALITI-BAU GmbH – Singen Hohentwiel",
      "type": "Löschungsankündigung",
      "state": "Baden-Württemberg",
      "amtsgericht": "Amtsgericht Freiburg",
      "registernummer": "HRB 718451",
      "registerart": "HRB",
      "company_name": "HALITI-BAU GmbH",
      "company_seat": "Singen Hohentwiel",
      "details": "03.12.2024 (Bekanntmachungsdatum)\n\nBaden-Württemberg Amtsgericht Freiburg HRB 718451\nLöschungsankündigung 03.12.2024 (Eintragungsdatum)\n\nHALITI-BAU GmbH\nGesellschaft mit beschränkter Haftung\nSingen Hohentwiel\n\nAls nicht eingetragen wird bekanntgemacht:\nDas Gericht beabsichtigt, die Gesellschaft wegen Vermögenslosigkeit im Handelsregister von Amts wegen nach § 394 FamFG zu löschen. Die Frist zur Geltendmachung eines Widerspruchs gegen die beabsichtigte Löschung ist auf einen Monat ab Veröffentlichung bestimmt."
    },
    {
      "date": "2024-12-03",
      "id": "95218",
      "original_text": "Registerbekanntmachung nach dem Umwandlungsgesetz\nBaden-Württemberg Amtsgericht Mannheim HRB 715217\nSiefermann Elektrotechnik GmbH – Achern",
      "type": "Registerbekanntmachung nach dem Umwandlungsgesetz",
      "state": "Baden-Württemberg",
      "amtsgericht": "Amtsgericht Mannheim",
      "registernummer": "HRB 715217",
      "registerart": "HRB",
      "company_name": "Siefermann Elektrotechnik GmbH",
      "company_seat": "Achern",
      "details": "03.12.2024 (Bekanntmachungsdatum)\n\nBaden-Württemberg Amtsgericht Mannheim HRB 715217\nRegisterbekanntmachung nach dem Umwandlungsgesetz 03.12.2024 (Eintragungsdatum)\n\nSiefermann Elektrotechnik GmbH\nGesellschaft mit beschränkter Haftung\nAchern\n\nDen Gläubigern der an der Verschmelzung beteiligten Rechtsträger ist, wenn sie binnen sechs Monaten nach dem Tag, an dem die Eintragung der Verschmelzung in das Register des Sitzes desjenigen Rechtsträgers, dessen Gläubiger sie sind, nach § 19 Abs. 3 UmwG als bekanntgemacht gilt, ihren Anspruch nach Grund und Höhe schriftlich anmelden, Sicherheit zu leisten, soweit sie nicht Befriedigung verlangen können. Dieses Recht steht den Gläubigern jedoch nur zu, wenn sie glaubhaft machen, dass durch die Verschmelzung die Erfüllung ihrer Forderung gefährdet wird."
    },
    {
      "date": "2024-12-03",
      "id": "95219",
      "original_text": "Registerbekanntmachung nach dem Umwandlungsgesetz\nSchleswig-Holstein Amtsgericht Kiel HRA 1103 PL\nFrank Druck GmbH & Co. KG – Preetz",
      "type": "Registerbekanntmachung nach dem Umwandlungsgesetz",
      "state": "Schleswig-Holstein",
      "amtsgericht": "Amtsgericht Kiel",
      "registernummer": "HRA 1103 PL",
      "registerart": "HRA",
      "company_name": "Frank Druck GmbH & Co. KG",
      "company_seat": "Preetz",
      "details": "03.12.2024 (Bekanntmachungsdatum)\n\nSchleswig-Holstein Amtsgericht Kiel HRA 1103 PL\nRegisterbekanntmachung nach dem Umwandlungsgesetz 28.11.2024 (Eintragungsdatum)\n\nFrank Druck GmbH & Co. KG\nKommanditgesellschaft\nPreetz\n\nAls nicht eingetragen wird veröffentlicht: Den Gläubigern der an der Verschmelzung beteiligten Rechtsträger ist, wenn sie binnen sechs Monaten nach dem Tag, an dem die Eintragung der Verschmelzung in das Register des Sitzes desjenigen Rechtsträgers, dessen Gläubiger sie sind, nach § 19 Abs. 3 UmwG bekannt gemacht worden ist, ihren Anspruch nach Grund und Höhe schriftlich anmelden, Sicherheit zu leisten, soweit sie nicht Befriedigung verlangen können. Dieses Recht steht den Gläubigern jedoch nur zu, wenn sie glaubhaft machen, dass durch die Verschmelzung die Erfüllung ihrer Forderung gefährdet wird."
    },
    {
      "date": "2024-12-03",
      "id": "95220",
      "original_text": "Löschungsankündigung\nBerlin Amtsgericht Berlin (Charlottenburg) HRB 177420\nAdvanced Liquid Fuel UG (haftungsbeschränkt) – Berlin",
      "type": "Löschungsankündigung",
      "state": "Berlin",
      "amtsgericht": "Amtsgericht Berlin (Charlottenburg)",
      "registernummer": "HRB 177420",
      "registerart": "HRB",
      "company_name": "Advanced Liquid Fuel UG (haftungsbeschränkt)",
      "company_seat": "Berlin",
      "details": "03.12.2024 (Bekanntmachungsdatum)\n\nBerlin Amtsgericht Berlin (Charlottenburg) HRB 177420\nLöschungsankündigung\n\nAdvanced Liquid Fuel UG (haftungsbeschränkt)\nGesellschaft mit beschränkter Haftung\nBerlin\n\nBei der nachstehenden Gesellschaft wird das Amtslöschungsverfahren gemäß § 394 FamFG eingeleitet. Widerspruchsfrist 6 Wochen"
    },
    {
      "date": "2024-12-03",
      "id": "95221",
      "original_text": "Registerbekanntmachung nach dem Umwandlungsgesetz\nBaden-Württemberg Amtsgericht Mannheim HRA 712204\nHans Jürgen Siefermann Elektrotechnik e.K. – Achern",
      "type": "Registerbekanntmachung nach dem Umwandlungsgesetz",
      "state": "Baden-Württemberg",
      "amtsgericht": "Amtsgericht Mannheim",
      "registernummer": "HRA 712204",
      "registerart": "HRA",
      "company_name": "Hans Jürgen Siefermann Elektrotechnik e.K.",
      "company_seat": "Achern",
      "details": "03.12.2024 (Bekanntmachungsdatum)\n\nBaden-Württemberg Amtsgericht Mannheim HRA 712204\nRegisterbekanntmachung nach dem Umwandlungsgesetz 03.12.2024 (Eintragungsdatum)\n\nHans Jürgen Siefermann Elektrotechnik e.K.\nEinzelkaufmann / Einzelkauffrau\nAchern\n\nAls nicht eingetragen wird bekanntgemacht:\nDen Gläubigern der an der Verschmelzung beteiligten Rechtsträger ist, wenn sie binnen sechs Monaten nach dem Tag, an dem die Eintragung der Verschmelzung in das Register des Sitzes desjenigen Rechtsträgers, dessen Gläubiger sie sind, nach § 19 Abs. 3 UmwG als bekanntgemacht gilt, ihren Anspruch nach Grund und Höhe schriftlich anmelden, Sicherheit zu leisten, soweit sie nicht Befriedigung verlangen können. Dieses Recht steht den Gläubigern jedoch nur zu, wenn sie glaubhaft machen, dass durch die Verschmelzung die Erfüllung ihrer Forderung gefährdet wird."
    },
    {
      "date": "2024-12-03",
      "id": "95222",
      "original_text": "Löschungsankündigung\nBaden-Württemberg Amtsgericht Mannheim HRB 740991\nWA-Immobilien UG (haftungsbeschränkt) – Ketsch",
      "type": "Löschungsankündigung",
      "state": "Baden-Württemberg",
      "amtsgericht": "Amtsgericht Mannheim",
      "registernummer": "HRB 740991",
      "registerart": "HRB",
      "company_name": "WA-Immobilien UG (haftungsbeschränkt)",
      "company_seat": "Ketsch",
      "details": "03.12.2024 (Bekanntmachungsdatum)\n\nBaden-Württemberg Amtsgericht Mannheim HRB 740991\nLöschungsankündigung\n\nWA-Immobilien UG (haftungsbeschränkt)\nGesellschaft mit beschränkter Haftung\nKetsch\n\nAls nicht eingetragen wird bekanntgemacht:\nDas Gericht beabsichtigt, die Gesellschaft wegen Vermögenslosigkeit im Handelsregister von Amts wegen nach § 394 FamFG zu löschen. Die Frist zur Geltendmachung eines Widerspruchs gegen die beabsichtigte Löschung ist auf einen Monat ab Veröffentlichung bestimmt."
    },
    {
      "date": "2024-12-03",
      "id": "95223",
      "original_text": "Löschungsankündigung\nSchleswig-Holstein Amtsgericht Flensburg HRB 11929\nService-Point-Sylt-GmbH – Sylt",
      "type": "Löschungsankündigung",
      "state": "Schleswig-Holstein",
      "amtsgericht": "Amtsgericht Flensburg",
      "registernummer": "HRB 11929",
      "registerart": "HRB",
      "company_name": "Service-Point-Sylt-GmbH",
      "company_seat": "Sylt",
      "details": "03.12.2024 (Bekanntmachungsdatum)\n\nSchleswig-Holstein Amtsgericht Flensburg HRB 11929\nLöschungsankündigung\n\nService-Point-Sylt-GmbH\nGesellschaft mit beschränkter Haftung\nSylt\n\nEs ist die Löschung der nachstehenden Gesellschaft wegen Vermögenslosigkeit gemäß § 394 FamFG beabsichtigt.\nWiderspruchsfrist: 2 Monate"
    },
    {
      "date": "2024-12-03",
      "id": "95224",
      "original_text": "Löschungsankündigung\nBaden-Württemberg Amtsgericht Ulm HRB 724196\nFWB Hausverwaltungen UG (haftungsbeschränkt) – Heubach",
      "type": "Löschungsankündigung",
      "state": "Baden-Württemberg",
      "amtsgericht": "Amtsgericht Ulm",
      "registernummer": "HRB 724196",
      "registerart": "HRB",
      "company_name": "FWB Hausverwaltungen UG (haftungsbeschränkt)",
      "company_seat": "Heubach",
      "details": "03.12.2024 (Bekanntmachungsdatum)\n\nBaden-Württemberg Amtsgericht Ulm HRB 724196\nLöschungsankündigung\n\nFWB Hausverwaltungen UG (haftungsbeschränkt)\nGesellschaft mit beschränkter Haftung\nHeubach\n\nDas Gericht beabsichtigt, die Gesellschaft wegen Vermögenslosigkeit im Handelsregister von Amts wegen nach § 394 FamFG zu löschen. Die Frist zur Geltendmachung eines Widerspruchs gegen die beabsichtigte Löschung ist auf  einen Monat ab Veröffentlichung bestimmt."
    },
    {
      "date": "2024-12-03",
      "id": "95225",
      "original_text": "Löschungsankündigung\nSchleswig-Holstein Amtsgericht Flensburg HRB 14943\nGoStrategy! GmbH – Flensburg",
      "type": "Löschungsankündigung",
      "state": "Schleswig-Holstein",
      "amtsgericht": "Amtsgericht Flensburg",
      "registernummer": "HRB 14943",
      "registerart": "HRB",
      "company_name": "GoStrategy! GmbH",
      "company_seat": "Flensburg",
      "details": "03.12.2024 (Bekanntmachungsdatum)\n\nSchleswig-Holstein Amtsgericht Flensburg HRB 14943\nLöschungsankündigung\n\nGoStrategy! GmbH\nGesellschaft mit beschränkter Haftung\nFlensburg\n\nEs ist die Löschung der nachstehenden Gesellschaft wegen Vermögenslosigkeit gemäß § 394 FamFG beabsichtigt.\nWiderspruchsfrist: 2 Monate."
    },
    {
      "date": "2024-12-03",
      "id": "95226",
      "original_text": "Registerbekanntmachung nach dem Umwandlungsgesetz\nBaden-Württemberg Amtsgericht Stuttgart HRA 203200\nErwin Berger e.K. – Korntal-Münchingen",
      "type": "Registerbekanntmachung nach dem Umwandlungsgesetz",
      "state": "Baden-Württemberg",
      "amtsgericht": "Amtsgericht Stuttgart",
      "registernummer": "HRA 203200",
      "registerart": "HRA",
      "company_name": "Erwin Berger e.K.",
      "company_seat": "Korntal-Münchingen",
      "details": "03.12.2024 (Bekanntmachungsdatum)\n\nBaden-Württemberg Amtsgericht Stuttgart HRA 203200\nRegisterbekanntmachung nach dem Umwandlungsgesetz 03.12.2024 (Eintragungsdatum)\n\nErwin Berger e.K.\nEinzelkaufmann / Einzelkauffrau\nKorntal-Münchingen\n\nDen Gläubigern der an der Ausgliederung beteiligten Rechtsträger ist, wenn sie binnen sechs Monaten nach dem Tag, an dem die Eintragung der Ausgliederung in das Register des Sitzes desjenigen Rechtsträgers, dessen Gläubiger sie sind, nach § 19 Abs. 3 UmwG als bekanntgemacht gilt, ihren Anspruch nach Grund und Höhe schriftlich anmelden, Sicherheit zu leisten, soweit sie nicht Befriedigung verlangen können. Dieses Recht steht den Gläubigern jedoch nur zu, wenn sie glaubhaft machen, dass durch die Ausgliederung die Erfüllung ihrer Forderung gefährdet wird."
    },
    {
      "date": "2024-12-03",
      "id": "95227",
      "original_text": "Einreichung neuer Dokumente\nNordrhein-Westfalen Amtsgericht Coesfeld HRB 5478\nGERMANIA-EPE Aktiengesellschaft – Gronau",
      "type": "Einreichung neuer Dokumente",
      "state": "Nordrhein-Westfalen",
      "amtsgericht": "Amtsgericht Coesfeld",
      "registernummer": "HRB 5478",
      "registerart": "HRB",
      "company_name": "GERMANIA-EPE Aktiengesellschaft",
      "company_seat": "Gronau",
      "details": "03.12.2024 (Bekanntmachungsdatum)\n\nNordrhein-Westfalen Amtsgericht Coesfeld HRB 5478\nEinreichung neuer Dokumente\n\nGERMANIA-EPE Aktiengesellschaft\nAktiengesellschaft\nGronau\n\nDie Liste der Mitglieder des Aufsichtsrates ist zum Handelsregister eingereicht worden."
    },
    {
      "date": "2024-12-03",
      "id": "95228",
      "original_text": "Registerbekanntmachung nach dem Umwandlungsgesetz\nSaarland Amtsgericht Saarbrücken HRB 110825\nDirk Hargarter Schreinerarbeiten und Montageservice GmbH – Merzig",
      "type": "Registerbekanntmachung nach dem Umwandlungsgesetz",
      "state": "Saarland",
      "amtsgericht": "Amtsgericht Saarbrücken",
      "registernummer": "HRB 110825",
      "registerart": "HRB",
      "company_name": "Dirk Hargarter Schreinerarbeiten und Montageservice GmbH",
      "company_seat": "Merzig",
      "details": "03.12.2024 (Bekanntmachungsdatum)\n\nSaarland Amtsgericht Saarbrücken HRB 110825\nRegisterbekanntmachung nach dem Umwandlungsgesetz 03.12.2024 (Eintragungsdatum)\n\nDirk Hargarter Schreinerarbeiten und Montageservice GmbH\nGesellschaft mit beschränkter Haftung\nMerzig\n\nAls nicht eingetragen wird bekannt gemacht: Den Gläubigern der an der Ausgliederung beteiligten Gesellschaften ist, wenn sie binnen sechs Monaten nach dem Tag, an dem die Eintragung der Ausgliederung in das Register des Sitzes desjenigen Rechtsträgers, dessen Gläubiger sie sind, nach § 19 Absatz 3 UmwG bekannt gemacht worden ist, ihren Anspruch nach Grund und Höhe schriftlich anmelden, Sicherheit zu leisten, soweit sie nicht Befriedigung verlangen können. Dieses Recht steht den Gläubigern jedoch nur zu, wenn sie glaubhaft machen, dass durch die Ausgliederung die Erfüllung ihrer Forderung gefährdet wird."
    },
    {
      "date": "2024-12-03",
      "id": "95229",
      "original_text": "Registerbekanntmachung nach dem Umwandlungsgesetz\nSaarland Amtsgericht Saarbrücken HRA 13556\nDirk Hargarter Schreinerarbeiten und Montageservice Inhaber Dirk Hargarter e.K. – Merzig",
      "type": "Registerbekanntmachung nach dem Umwandlungsgesetz",
      "state": "Saarland",
      "amtsgericht": "Amtsgericht Saarbrücken",
      "registernummer": "HRA 13556",
      "registerart": "HRA",
      "company_name": "Dirk Hargarter Schreinerarbeiten und Montageservice Inhaber Dirk Hargarter e.K.",
      "company_seat": "Merzig",
      "details": "03.12.2024 (Bekanntmachungsdatum)\n\nSaarland Amtsgericht Saarbrücken HRA 13556\nRegisterbekanntmachung nach dem Umwandlungsgesetz 03.12.2024 (Eintragungsdatum)\n\nDirk Hargarter Schreinerarbeiten und Montageservice Inhaber Dirk Hargarter e.K.\nEinzelkaufmann / Einzelkauffrau\nMerzig\n\nAls nicht eingetragen wird bekannt gemacht: Den Gläubigern der an der Ausgliederung beteiligten Gesellschaften ist, wenn sie binnen sechs Monaten nach dem Tag, an dem die Eintragung der Ausgliederung in das Register des Sitzes desjenigen Rechtsträgers, dessen Gläubiger sie sind, nach § 19 Absatz 3 UmwG bekannt gemacht worden ist, ihren Anspruch nach Grund und Höhe schriftlich anmelden, Sicherheit zu leisten, soweit sie nicht Befriedigung verlangen können. Dieses Recht steht den Gläubigern jedoch nur zu, wenn sie glaubhaft machen, dass durch die Ausgliederung die Erfüllung ihrer Forderung gefährdet wird."
    },
    {
      "date": "2024-12-03",
      "id": "95230",
      "original_text": "Registerbekanntmachung nach dem Umwandlungsgesetz\nBerlin Amtsgericht Berlin (Charlottenburg) HRB 164900\nDefshop GmbH – Berlin",
      "type": "Registerbekanntmachung nach dem Umwandlungsgesetz",
      "state": "Berlin",
      "amtsgericht": "Amtsgericht Berlin (Charlottenburg)",
      "registernummer": "HRB 164900",
      "registerart": "HRB",
      "company_name": "Defshop GmbH",
      "company_seat": "Berlin",
      "details": "03.12.2024 (Bekanntmachungsdatum)\n\nBerlin Amtsgericht Berlin (Charlottenburg) HRB 164900\nRegisterbekanntmachung nach dem Umwandlungsgesetz 02.12.2024 (Eintragungsdatum)\n\nDefshop GmbH\nGesellschaft mit beschränkter Haftung\nBerlin\n\nZu Eintragungsnummer 17 vom 02.12.2024 wird als nicht eingetragen veröffentlicht:\n\nDen Gläubigern der an der Verschmelzung beteiligten Rechtsträger ist, wenn sie binnen sechs Monaten nach dem Tag, an dem die Eintragung der Verschmelzung in das Register des Sitzes desjenigen Rechtsträgers, dessen Gläubiger sie sind, als bekannt gemacht gilt, ihren Anspruch nach Grund und Höhe schriftlich anmelden, Sicherheit zu leisten, soweit sie nicht Befriedigung verlangen können. Dieses Recht steht den Gläubigern jedoch nur zu, wenn sie glaubhaft machen, dass durch die Verschmelzung die Erfüllung ihrer Forderung gefährdet wird. Das Recht, Sicherheitsleistung zu verlangen, steht Gläubigern nicht zu, die im Falle der Insolvenz ein Recht auf vorzugsweise Befriedigung aus einer Deckungsmasse haben, die nach gesetzlicher Vorschrift zu ihrem Schutz errichtet und staatlich überwacht ist."
    },
    {
      "date": "2024-12-03",
      "id": "95231",
      "original_text": "Einreichung neuer Dokumente\nThüringen Amtsgericht Jena HRB 300357\nSuhler Stadtbetrieb GmbH – Suhl",
      "type": "Einreichung neuer Dokumente",
      "state": "Thüringen",
      "amtsgericht": "Amtsgericht Jena",
      "registernummer": "HRB 300357",
      "registerart": "HRB",
      "company_name": "Suhler Stadtbetrieb GmbH",
      "company_seat": "Suhl",
      "details": "03.12.2024 (Bekanntmachungsdatum)\n\nThüringen Amtsgericht Jena HRB 300357\nEinreichung neuer Dokumente 03.12.2024 (Eintragungsdatum)\n\nSuhler Stadtbetrieb GmbH\nGesellschaft mit beschränkter Haftung\nSuhl\n\nBekanntmachung gem. § 52 Abs. 3 Satz 2 GmbHG: Aufgrund einer Veränderung in den Personen der Aufsichtsratsmitglieder ist durch die Geschäftsführer eine neue Liste zum Handelsregister eingereicht worden."
    },
    {
      "date": "2024-12-03",
      "id": "95232",
      "original_text": "Registerbekanntmachung nach dem Umwandlungsgesetz\nBaden-Württemberg Amtsgericht Mannheim HRB 752829\nEmodrom Group Holding GmbH – Hockenheim",
      "type": "Registerbekanntmachung nach dem Umwandlungsgesetz",
      "state": "Baden-Württemberg",
      "amtsgericht": "Amtsgericht Mannheim",
      "registernummer": "HRB 752829",
      "registerart": "HRB",
      "company_name": "Emodrom Group Holding GmbH",
      "company_seat": "Hockenheim",
      "details": "03.12.2024 (Bekanntmachungsdatum)\n\nBaden-Württemberg Amtsgericht Mannheim HRB 752829\nRegisterbekanntmachung nach dem Umwandlungsgesetz 03.12.2024 (Eintragungsdatum)\n\nEmodrom Group Holding GmbH\nGesellschaft mit beschränkter Haftung\nHockenheim\n\nAls nicht eingetragen wird bekanntgemacht:\nDen Gläubigern des an dem Formwechsel beteiligten Rechtsträgers ist, wenn sie binnen sechs Monaten nach dem Tag, an dem die Eintragung des Formwechsels in das Register des Sitzes desjenigen Rechtsträgers, dessen Gläubiger sie sind, nach § 19 Abs. 3 UmwG als bekanntgemacht gilt, ihren Anspruch nach Grund und Höhe schriftlich anmelden, Sicherheit zu leisten, soweit sie nicht Befriedigung verlangen können. Dieses Recht steht den Gläubigern jedoch nur zu, wenn sie glaubhaft machen, dass durch den Formwechsel die Erfüllung ihrer Forderung gefährdet wird."
    },
    {
      "date": "2024-12-03",
      "id": "95233",
      "original_text": "Registerbekanntmachung nach dem Umwandlungsgesetz\nBaden-Württemberg Amtsgericht Mannheim HRB 752830\nEmodrom Marketing GmbH – Hockenheim",
      "type": "Registerbekanntmachung nach dem Umwandlungsgesetz",
      "state": "Baden-Württemberg",
      "amtsgericht": "Amtsgericht Mannheim",
      "registernummer": "HRB 752830",
      "registerart": "HRB",
      "company_name": "Emodrom Marketing GmbH",
      "company_seat": "Hockenheim",
      "details": "03.12.2024 (Bekanntmachungsdatum)\n\nBaden-Württemberg Amtsgericht Mannheim HRB 752830\nRegisterbekanntmachung nach dem Umwandlungsgesetz 03.12.2024 (Eintragungsdatum)\n\nEmodrom Marketing GmbH\nGesellschaft mit beschränkter Haftung\nHockenheim\n\nDen Gläubigern des an dem Formwechsel beteiligten Rechtsträgers ist, wenn sie binnen sechs Monaten nach dem Tag, an dem die Eintragung des Formwechsels in das Register des Sitzes desjenigen Rechtsträgers, dessen Gläubiger sie sind, nach § 19 Abs. 3 UmwG als bekanntgemacht gilt, ihren Anspruch nach Grund und Höhe schriftlich anmelden, Sicherheit zu leisten, soweit sie nicht Befriedigung verlangen können. Dieses Recht steht den Gläubigern jedoch nur zu, wenn sie glaubhaft machen, dass durch den Formwechsel die Erfüllung ihrer Forderung gefährdet wird."
    },
    {
      "date": "2024-12-03",
      "id": "95234",
      "original_text": "Einreichung neuer Dokumente\nBerlin Amtsgericht Berlin (Charlottenburg) HRB 151121\nMarket Logic Software AG – Berlin",
      "type": "Einreichung neuer Dokumente",
      "state": "Berlin",
      "amtsgericht": "Amtsgericht Berlin (Charlottenburg)",
      "registernummer": "HRB 151121",
      "registerart": "HRB",
      "company_name": "Market Logic Software AG",
      "company_seat": "Berlin",
      "details": "03.12.2024 (Bekanntmachungsdatum)\n\nBerlin Amtsgericht Berlin (Charlottenburg) HRB 151121\nEinreichung neuer Dokumente\n\nMarket Logic Software AG\nAktiengesellschaft\nBerlin\n\nAls nicht eingetragen wird veröffentlicht:Es wurde eine neue Liste der Aufsichtsratsmitglieder eingereicht (§ 106 AktG)."
    },
    {
      "date": "2024-12-03",
      "id": "95235",
      "original_text": "Einreichung neuer Dokumente\nBerlin Amtsgericht Berlin (Charlottenburg) HRB 269288\nDIHA Immobilien und Hausverwaltungs GmbH – Berlin",
      "type": "Einreichung neuer Dokumente",
      "state": "Berlin",
      "amtsgericht": "Amtsgericht Berlin (Charlottenburg)",
      "registernummer": "HRB 269288",
      "registerart": "HRB",
      "company_name": "DIHA Immobilien und Hausverwaltungs GmbH",
      "company_seat": "Berlin",
      "details": "03.12.2024 (Bekanntmachungsdatum)\n\nBerlin Amtsgericht Berlin (Charlottenburg) HRB 269288\nEinreichung neuer Dokumente\n\nDIHA Immobilien und Hausverwaltungs GmbH\nGesellschaft mit beschränkter Haftung\nBerlin\n\nAls nicht eingetragen wird veröffentlicht: Es wurde eine neue Liste der Beisratsmitglieder eingereicht (§§ 52 Abs. 3 GmbHG, 10 HGB GmbHG)."
    },
    {
      "date": "2024-12-03",
      "id": "95236",
      "original_text": "Löschungsankündigung\nBrandenburg Amtsgericht Potsdam HRB 17921\nPrismaplex Beteiligungsgesellschaft mbH – Beetzsee",
      "type": "Löschungsankündigung",
      "state": "Brandenburg",
      "amtsgericht": "Amtsgericht Potsdam",
      "registernummer": "HRB 17921",
      "registerart": "HRB",
      "company_name": "Prismaplex Beteiligungsgesellschaft mbH",
      "company_seat": "Beetzsee",
      "details": "03.12.2024 (Bekanntmachungsdatum)\n\nBrandenburg Amtsgericht Potsdam HRB 17921\nLöschungsankündigung\n\nPrismaplex Beteiligungsgesellschaft mbH\nGesellschaft mit beschränkter Haftung\nBeetzsee\n\nBei der nachstehenden Gesellschaft wird das Amtslöschungsverfahren gemäß § 394 FamFG eingeleitet. Widerspruchsfrist: 8 Wochen"
    },
    {
      "date": "2024-12-03",
      "id": "95237",
      "original_text": "Registerbekanntmachung nach dem Umwandlungsgesetz\nSchleswig-Holstein Amtsgericht Kiel HRA 12451\nRistorante Al Porto, Inhaber: Dirk Lettmann, e.K. – Eckernförde",
      "type": "Registerbekanntmachung nach dem Umwandlungsgesetz",
      "state": "Schleswig-Holstein",
      "amtsgericht": "Amtsgericht Kiel",
      "registernummer": "HRA 12451",
      "registerart": "HRA",
      "company_name": "Ristorante Al Porto, Inhaber: Dirk Lettmann, e.K.",
      "company_seat": "Eckernförde",
      "details": "03.12.2024 (Bekanntmachungsdatum)\n\nSchleswig-Holstein Amtsgericht Kiel HRA 12451\nRegisterbekanntmachung nach dem Umwandlungsgesetz 20.11.2024 (Eintragungsdatum)\n\nRistorante Al Porto, Inhaber: Dirk Lettmann, e.K.\nEinzelkaufmann / Einzelkauffrau\nEckernförde\n\nZu Eintragungsnummer 2 vom 20.11.2024 wird als nicht eingetragen veröffentlicht:  Als nicht eingetragen wird veröffentlicht: Den Gläubigern der an der Spaltung beteiligten Rechtsträger ist, wenn sie binnen sechs Monaten nach dem Tag, an dem die Eintragung der Spaltung in das Register des Sitzes desjenigen Rechtsträgers, dessen Gläubiger sie sind,  bekannt gemacht worden ist, ihren Anspruch nach Grund und Höhe schriftlich anmelden, Sicherheit zu leisten, soweit sie nicht Befriedigung verlangen können. Dieses Recht steht den Gläubigern jedoch nur zu, wenn sie glaubhaft machen, dass durch die Spaltung die Erfüllung ihrer Forderung gefährdet wird."
    },
    {
      "date": "2024-12-03",
      "id": "95238",
      "original_text": "Sonstige Registerbekanntmachung\nSchleswig-Holstein Amtsgericht Kiel HRB 205\nUCA United Canal Agency GmbH – Kiel",
      "type": "Sonstige Registerbekanntmachung",
      "state": "Schleswig-Holstein",
      "amtsgericht": "Amtsgericht Kiel",
      "registernummer": "HRB 205",
      "registerart": "HRB",
      "company_name": "UCA United Canal Agency GmbH",
      "company_seat": "Kiel",
      "details": "03.12.2024 (Bekanntmachungsdatum)\n\nSchleswig-Holstein Amtsgericht Kiel HRB 205\nSonstige Registerbekanntmachung 02.12.2024 (Eintragungsdatum)\n\nUCA United Canal Agency GmbH\nGesellschaft mit beschränkter Haftung\nKiel\n\nAls nicht eingetragen wird veröffentlicht:  Den Gläubigern der Gesellschaft, deren Forderungen begründet worden sind, bevor die Eintragung der Beendigung des Vertrages in das Handelsregister nach § 10 HGB bekannt gemacht worden ist, ist vom anderen Vertragspartner Sicherheit zu leisten, wenn sie sich binnen sechs Monaten nach Bekanntmachung der Eintragung zu diesem Zweck bei ihm melden."
    },
    {
      "date": "2024-12-03",
      "id": "95239",
      "original_text": "Registerbekanntmachung nach dem Umwandlungsgesetz\nBaden-Württemberg Amtsgericht Ulm HRB 3078\nPITEX INTERNATIONAL Beteiligungsgesellschaft mbH – Laichingen",
      "type": "Registerbekanntmachung nach dem Umwandlungsgesetz",
      "state": "Baden-Württemberg",
      "amtsgericht": "Amtsgericht Ulm",
      "registernummer": "HRB 3078",
      "registerart": "HRB",
      "company_name": "PITEX INTERNATIONAL Beteiligungsgesellschaft mbH",
      "company_seat": "Laichingen",
      "details": "03.12.2024 (Bekanntmachungsdatum)\n\nBaden-Württemberg Amtsgericht Ulm HRB 3078\nRegisterbekanntmachung nach dem Umwandlungsgesetz 03.12.2024 (Eintragungsdatum)\n\nPITEX INTERNATIONAL Beteiligungsgesellschaft mbH\nGesellschaft mit beschränkter Haftung\nLaichingen\n\nAls nicht eingetragen wird bekanntgemacht:\nDen Gläubigern der an der Verschmelzung beteiligten Rechtsträger ist, wenn sie binnen sechs Monaten nach dem Tag, an dem die Eintragung der Verschmelzung in das Register des Sitzes desjenigen Rechtsträgers, dessen Gläubiger sie sind, nach § 19 Abs. 3 UmwG als bekanntgemacht gilt, ihren Anspruch nach Grund und Höhe schriftlich anmelden, Sicherheit zu leisten, soweit sie nicht Befriedigung verlangen können. Dieses Recht steht den Gläubigern jedoch nur zu, wenn sie glaubhaft machen, dass durch die Verschmelzung die Erfüllung ihrer Forderung gefährdet wird."
    },
    {
      "date": "2024-12-03",
      "id": "95240",
      "original_text": "Sonstige Registerbekanntmachung\nHamburg Amtsgericht Hamburg HRB 11788\nBerendsohn Aktiengesellschaft – Hamburg",
      "type": "Sonstige Registerbekanntmachung",
      "state": "Hamburg",
      "amtsgericht": "Amtsgericht Hamburg",
      "registernummer": "HRB 11788",
      "registerart": "HRB",
      "company_name": "Berendsohn Aktiengesellschaft",
      "company_seat": "Hamburg",
      "details": "03.12.2024 (Bekanntmachungsdatum)\n\nHamburg Amtsgericht Hamburg HRB 11788\nSonstige Registerbekanntmachung\n\nBerendsohn Aktiengesellschaft\nAktiengesellschaft\nHamburg\n\nAls nicht eingetragen wird bekannt gemacht: Liste des Aufsichtsrats wurde eingereicht."
    },
    {
      "date": "2024-12-03",
      "id": "95241",
      "original_text": "Registerbekanntmachung nach dem Umwandlungsgesetz\nBaden-Württemberg Amtsgericht Ulm HRB 740695\nPichler-Park Verwaltungs GmbH – Laichingen",
      "type": "Registerbekanntmachung nach dem Umwandlungsgesetz",
      "state": "Baden-Württemberg",
      "amtsgericht": "Amtsgericht Ulm",
      "registernummer": "HRB 740695",
      "registerart": "HRB",
      "company_name": "Pichler-Park Verwaltungs GmbH",
      "company_seat": "Laichingen",
      "details": "03.12.2024 (Bekanntmachungsdatum)\n\nBaden-Württemberg Amtsgericht Ulm HRB 740695\nRegisterbekanntmachung nach dem Umwandlungsgesetz 03.12.2024 (Eintragungsdatum)\n\nPichler-Park Verwaltungs GmbH\nGesellschaft mit beschränkter Haftung\nLaichingen\n\nAls nicht eingetragen wird bekanntgemacht:\nDen Gläubigern der an der Verschmelzung beteiligten Rechtsträger ist, wenn sie binnen sechs Monaten nach dem Tag, an dem die Eintragung der Verschmelzung in das Register des Sitzes desjenigen Rechtsträgers, dessen Gläubiger sie sind, nach § 19 Abs. 3 UmwG als bekanntgemacht gilt, ihren Anspruch nach Grund und Höhe schriftlich anmelden, Sicherheit zu leisten, soweit sie nicht Befriedigung verlangen können. Dieses Recht steht den Gläubigern jedoch nur zu, wenn sie glaubhaft machen, dass durch die Verschmelzung die Erfüllung ihrer Forderung gefährdet wird."
    },
    {
      "date": "2024-12-03",
      "id": "95242",
      "original_text": "Registerbekanntmachung nach dem Umwandlungsgesetz\nBaden-Württemberg Amtsgericht Freiburg HRB 721096\nFBRK GmbH – Überlingen",
      "type": "Registerbekanntmachung nach dem Umwandlungsgesetz",
      "state": "Baden-Württemberg",
      "amtsgericht": "Amtsgericht Freiburg",
      "registernummer": "HRB 721096",
      "registerart": "HRB",
      "company_name": "FBRK GmbH",
      "company_seat": "Überlingen",
      "details": "03.12.2024 (Bekanntmachungsdatum)\n\nBaden-Württemberg Amtsgericht Freiburg HRB 721096\nRegisterbekanntmachung nach dem Umwandlungsgesetz 03.12.2024 (Eintragungsdatum)\n\nFBRK GmbH\nGesellschaft mit beschränkter Haftung\nÜberlingen\n\nDen Gläubigern der an der Verschmelzung beteiligten Rechtsträger ist, wenn sie binnen sechs Monaten nach dem Tag, an dem die Eintragung der Verschmelzung in das Register des Sitzes desjenigen Rechtsträgers, dessen Gläubiger sie sind, nach § 19 Abs. 3 UmwG als bekanntgemacht gilt, ihren Anspruch nach Grund und Höhe schriftlich anmelden, Sicherheit zu leisten, soweit sie nicht Befriedigung verlangen können. Dieses Recht steht den Gläubigern jedoch nur zu, wenn sie glaubhaft machen, dass durch die Verschmelzung die Erfüllung ihrer Forderung gefährdet wird."
    },
    {
      "date": "2024-12-03",
      "id": "95243",
      "original_text": "Sonstige Registerbekanntmachung\nBerlin Amtsgericht Berlin (Charlottenburg) HRB 201535\nCultBay GmbH – Berlin",
      "type": "Sonstige Registerbekanntmachung",
      "state": "Berlin",
      "amtsgericht": "Amtsgericht Berlin (Charlottenburg)",
      "registernummer": "HRB 201535",
      "registerart": "HRB",
      "company_name": "CultBay GmbH",
      "company_seat": "Berlin",
      "details": "03.12.2024 (Bekanntmachungsdatum)\n\nBerlin Amtsgericht Berlin (Charlottenburg) HRB 201535\nSonstige Registerbekanntmachung\n\nCultBay GmbH\nGesellschaft mit beschränkter Haftung\nBerlin\n\nAls nicht eingetragen wird veröffentlicht: Der andere Vertragsteil hat den Gläubigern dieses Rechtsträgers, deren Forderungen begründet worden sind, bevor die Eintragung der Beendigung dieses Vertrages in das Handelsregister nach § 10 des Handelsgesetzbuches als bekannt gemacht gilt, Sicherheit zu leisten, wenn sie sich binnen sechs Monaten nach der Bekanntmachung der Eintragung zu diesem Zweck bei ihm melden. Dieses Recht steht den Gläubigern nicht zu, die im Fall des Insolvenzverfahrens ein Recht auf vorzugsweise Befriedigung aus der Deckungsmasse haben, die nach gesetzlicher Vorschrift zu ihrem Schutz errichtet und staatlich überwacht ist."
    },
    {
      "date": "2024-12-03",
      "id": "95244",
      "original_text": "Sonstige Registerbekanntmachung\nBerlin Amtsgericht Berlin (Charlottenburg) HRB 201545\nCultSwitch GmbH – Berlin",
      "type": "Sonstige Registerbekanntmachung",
      "state": "Berlin",
      "amtsgericht": "Amtsgericht Berlin (Charlottenburg)",
      "registernummer": "HRB 201545",
      "registerart": "HRB",
      "company_name": "CultSwitch GmbH",
      "company_seat": "Berlin",
      "details": "03.12.2024 (Bekanntmachungsdatum)\n\nBerlin Amtsgericht Berlin (Charlottenburg) HRB 201545\nSonstige Registerbekanntmachung\n\nCultSwitch GmbH\nGesellschaft mit beschränkter Haftung\nBerlin\n\nAls nicht eingetragen wird veröffentlicht: Der andere Vertragsteil hat den Gläubigern dieses Rechtsträgers, deren Forderungen begründet worden sind, bevor die Eintragung der Beendigung dieses Vertrages in das Handelsregister nach § 10 des Handelsgesetzbuches als bekannt gemacht gilt, Sicherheit zu leisten, wenn sie sich binnen sechs Monaten nach der Bekanntmachung der Eintragung zu diesem Zweck bei ihm melden. Dieses Recht steht den Gläubigern nicht zu, die im Fall des Insolvenzverfahrens ein Recht auf vorzugsweise Befriedigung aus der Deckungsmasse haben, die nach gesetzlicher Vorschrift zu ihrem Schutz errichtet und staatlich überwacht ist."
    },
    {
      "date": "2024-12-03",
      "id": "95245",
      "original_text": "Registerbekanntmachung nach dem Umwandlungsgesetz\nBaden-Württemberg Amtsgericht Mannheim HRB 727055\nKAIROS Partners GmbH – Mannheim",
      "type": "Registerbekanntmachung nach dem Umwandlungsgesetz",
      "state": "Baden-Württemberg",
      "amtsgericht": "Amtsgericht Mannheim",
      "registernummer": "HRB 727055",
      "registerart": "HRB",
      "company_name": "KAIROS Partners GmbH",
      "company_seat": "Mannheim",
      "details": "03.12.2024 (Bekanntmachungsdatum)\n\nBaden-Württemberg Amtsgericht Mannheim HRB 727055\nRegisterbekanntmachung nach dem Umwandlungsgesetz 03.12.2024 (Eintragungsdatum)\n\nKAIROS Partners GmbH\nGesellschaft mit beschränkter Haftung\nMannheim\n\nDen Gläubigern der an der Verschmelzung beteiligten Rechtsträger ist, wenn sie binnen sechs Monaten nach dem Tag, an dem die Eintragung der Verschmelzung in das Register des Sitzes desjenigen Rechtsträgers, dessen Gläubiger sie sind, nach § 19 Abs. 3 UmwG als bekanntgemacht gilt, ihren Anspruch nach Grund und Höhe schriftlich anmelden, Sicherheit zu leisten, soweit sie nicht Befriedigung verlangen können. Dieses Recht steht den Gläubigern jedoch nur zu, wenn sie glaubhaft machen, dass durch die Verschmelzung die Erfüllung ihrer Forderung gefährdet wird."
    },
    {
      "date": "2024-12-03",
      "id": "95246",
      "original_text": "Registerbekanntmachung nach dem Umwandlungsgesetz\nSaarland Amtsgericht Saarbrücken HRB 110826\nHG Müller GmbH – Saarbrücken",
      "type": "Registerbekanntmachung nach dem Umwandlungsgesetz",
      "state": "Saarland",
      "amtsgericht": "Amtsgericht Saarbrücken",
      "registernummer": "HRB 110826",
      "registerart": "HRB",
      "company_name": "HG Müller GmbH",
      "company_seat": "Saarbrücken",
      "details": "03.12.2024 (Bekanntmachungsdatum)\n\nSaarland Amtsgericht Saarbrücken HRB 110826\nRegisterbekanntmachung nach dem Umwandlungsgesetz 03.12.2024 (Eintragungsdatum)\n\nHG Müller GmbH\nGesellschaft mit beschränkter Haftung\nSaarbrücken\n\nAls nicht eingetragen wird bekannt gemacht: Den Gläubigern der an der Ausgliederung beteiligten Gesellschaften ist, wenn sie binnen sechs Monaten nach dem Tag, an dem die Eintragung der Ausgliederung in das Register des Sitzes desjenigen Rechtsträgers, dessen Gläubiger sie sind, nach § 19 Absatz 3 UmwG bekannt gemacht worden ist, ihren Anspruch nach Grund und Höhe schriftlich anmelden, Sicherheit zu leisten, soweit sie nicht Befriedigung verlangen können. Dieses Recht steht den Gläubigern jedoch nur zu, wenn sie glaubhaft machen, dass durch die Ausgliederung die Erfüllung ihrer Forderung gefährdet wird."
    },
    {
      "date": "2024-12-03",
      "id": "95247",
      "original_text": "Registerbekanntmachung nach dem Umwandlungsgesetz\nSaarland Amtsgericht Saarbrücken HRA 13501\nMüller Holding GmbH & Co. KG – Saarbrücken",
      "type": "Registerbekanntmachung nach dem Umwandlungsgesetz",
      "state": "Saarland",
      "amtsgericht": "Amtsgericht Saarbrücken",
      "registernummer": "HRA 13501",
      "registerart": "HRA",
      "company_name": "Müller Holding GmbH & Co. KG",
      "company_seat": "Saarbrücken",
      "details": "03.12.2024 (Bekanntmachungsdatum)\n\nSaarland Amtsgericht Saarbrücken HRA 13501\nRegisterbekanntmachung nach dem Umwandlungsgesetz 03.12.2024 (Eintragungsdatum)\n\nMüller Holding GmbH & Co. KG\nKommanditgesellschaft\nSaarbrücken\n\nAls nicht eingetragen wird bekannt gemacht: Den Gläubigern der an der Ausgliederung beteiligten Gesellschaften ist, wenn sie binnen sechs Monaten nach dem Tag, an dem die Eintragung der Ausgliederung in das Register des Sitzes desjenigen Rechtsträgers, dessen Gläubiger sie sind, nach § 19 Absatz 3 UmwG bekannt gemacht worden ist, ihren Anspruch nach Grund und Höhe schriftlich anmelden, Sicherheit zu leisten, soweit sie nicht Befriedigung verlangen können. Dieses Recht steht den Gläubigern jedoch nur zu, wenn sie glaubhaft machen, dass durch die Ausgliederung die Erfüllung ihrer Forderung gefährdet wird."
    },
    {
      "date": "2024-12-03",
      "id": "95248",
      "original_text": "Registerbekanntmachung nach dem Umwandlungsgesetz\nBerlin Amtsgericht Berlin (Charlottenburg) HRB 269947\nPBI Projektgesellschaft Wartenberg mbH – Berlin",
      "type": "Registerbekanntmachung nach dem Umwandlungsgesetz",
      "state": "Berlin",
      "amtsgericht": "Amtsgericht Berlin (Charlottenburg)",
      "registernummer": "HRB 269947",
      "registerart": "HRB",
      "company_name": "PBI Projektgesellschaft Wartenberg mbH",
      "company_seat": "Berlin",
      "details": "03.12.2024 (Bekanntmachungsdatum)\n\nBerlin Amtsgericht Berlin (Charlottenburg) HRB 269947\nRegisterbekanntmachung nach dem Umwandlungsgesetz 02.12.2024 (Eintragungsdatum)\n\nPBI Projektgesellschaft Wartenberg mbH\nGesellschaft mit beschränkter Haftung\nBerlin\n\nZu Eintragungsnummer 1 vom 02.12.2024 wird als nicht eingetragen veröffentlicht: Den Gläubigern der an der Spaltung beteiligten Rechtsträger ist, wenn sie binnen sechs Monaten nach dem Tag, an dem die Eintragung der Spaltung in das Register des Sitzes desjenigen Rechtsträgers, dessen Gläubiger sie sind, als bekannt gemacht gilt, ihren Anspruch nach Grund und Höhe schriftlich anmelden, Sicherheit zu leisten, soweit sie nicht Befriedigung verlangen können. Dieses Recht steht den Gläubigern jedoch nur zu, wenn sie glaubhaft machen, dass durch die Spaltung die Erfüllung ihrer Forderung gefährdet wird. Das Recht, Sicherheitsleistung zu verlangen, steht Gläubigern nicht zu, die im Falle der Insolvenz ein Recht auf vorzugsweise Befriedigung aus einer Deckungsmasse haben, die nach gesetzlicher Vorschrift zu ihrem Schutz errichtet und staatlich überwacht ist."
    },
    {
      "date": "2024-12-03",
      "id": "95249",
      "original_text": "Löschungsankündigung\nBaden-Württemberg Amtsgericht Ulm HRB 724983\nBiegger GmbH Baumaschinen – Weingarten",
      "type": "Löschungsankündigung",
      "state": "Baden-Württemberg",
      "amtsgericht": "Amtsgericht Ulm",
      "registernummer": "HRB 724983",
      "registerart": "HRB",
      "company_name": "Biegger GmbH Baumaschinen",
      "company_seat": "Weingarten",
      "details": "03.12.2024 (Bekanntmachungsdatum)\n\nBaden-Württemberg Amtsgericht Ulm HRB 724983\nLöschungsankündigung\n\nBiegger GmbH Baumaschinen\nGesellschaft mit beschränkter Haftung\nWeingarten\n\nDas Gericht beabsichtigt, die Gesellschaft wegen Vermögenslosigkeit im Handelsregister von Amts wegen nach § 394 FamFG zu löschen. Die Frist zur Geltendmachung eines Widerspruchs gegen die beabsichtigte Löschung ist auf  einen Monat ab Veröffentlichung bestimmt."
    },
    {
      "date": "2024-12-03",
      "id": "95250",
      "original_text": "Einreichung neuer Dokumente\nBaden-Württemberg Amtsgericht Stuttgart HRB 354073\nStaRT Stadtmarketing und Tourismus Reutlingen GmbH – Reutlingen",
      "type": "Einreichung neuer Dokumente",
      "state": "Baden-Württemberg",
      "amtsgericht": "Amtsgericht Stuttgart",
      "registernummer": "HRB 354073",
      "registerart": "HRB",
      "company_name": "StaRT Stadtmarketing und Tourismus Reutlingen GmbH",
      "company_seat": "Reutlingen",
      "details": "03.12.2024 (Bekanntmachungsdatum)\n\nBaden-Württemberg Amtsgericht Stuttgart HRB 354073\nEinreichung neuer Dokumente\n\nStaRT Stadtmarketing und Tourismus Reutlingen GmbH\nGesellschaft mit beschränkter Haftung\nReutlingen\n\nDie Gesellschaft hat am 03.12.2024 die Liste über die Zusammensetzung des Aufsichtsrats zum Handelsregister eingereicht."
    },
    {
      "date": "2024-12-03",
      "id": "95251",
      "original_text": "Registerbekanntmachung nach dem Umwandlungsgesetz\nBrandenburg Amtsgericht Cottbus HRB 15906\nKLB Kötitzer Beteiligungen GmbH – Schönefeld",
      "type": "Registerbekanntmachung nach dem Umwandlungsgesetz",
      "state": "Brandenburg",
      "amtsgericht": "Amtsgericht Cottbus",
      "registernummer": "HRB 15906",
      "registerart": "HRB",
      "company_name": "KLB Kötitzer Beteiligungen GmbH",
      "company_seat": "Schönefeld",
      "details": "03.12.2024 (Bekanntmachungsdatum)\n\nBrandenburg Amtsgericht Cottbus HRB 15906\nRegisterbekanntmachung nach dem Umwandlungsgesetz 29.11.2024 (Eintragungsdatum)\n\nKLB Kötitzer Beteiligungen GmbH\nGesellschaft mit beschränkter Haftung\nSchönefeld\n\nAls nicht eingetragen wird veröffentlicht:\nDen Gläubigern der an der Verschmelzung beteiligten Rechtsträger ist, wenn sie binnen sechs Monaten nach dem Tag, an dem die Eintragung der Verschmelzung in das Register des Sitzes desjenigen Rechtsträgers, dessen Gläubiger sie sind, als bekannt gemacht gilt, ihren Anspruch nach Grund und Höhe schriftlich anmelden, Sicherheit zu leisten, soweit sie nicht Befriedigung verlangen können. Dieses Recht steht den Gläubigern jedoch nur zu, wenn sie glaubhaft machen, dass durch die Verschmelzung die Erfüllung ihrer Forderung gefährdet wird"
    },
    {
      "date": "2024-12-03",
      "id": "95252",
      "original_text": "Löschungsankündigung\nSachsen Amtsgericht Dresden HRB 24075\nWohnen am Alaunpark Beteiligungs GmbH – Dresden",
      "type": "Löschungsankündigung",
      "state": "Sachsen",
      "amtsgericht": "Amtsgericht Dresden",
      "registernummer": "HRB 24075",
      "registerart": "HRB",
      "company_name": "Wohnen am Alaunpark Beteiligungs GmbH",
      "company_seat": "Dresden",
      "details": "03.12.2024 (Bekanntmachungsdatum)\n\nSachsen Amtsgericht Dresden HRB 24075\nLöschungsankündigung\n\nWohnen am Alaunpark Beteiligungs GmbH\nGesellschaft mit beschränkter Haftung\nDresden\n\nDas Registergericht beabsichtigt, die im Handelsregister eingetragene Gesellschaft von Amts wegen nach § 394 FamFG zu löschen. Die Frist zu Erhebung eines Widerspruchs gegen die beabsichtigte Löschung wird auf einen Monat festgesetzt."
    },
    {
      "date": "2024-12-03",
      "id": "95253",
      "original_text": "Einreichung neuer Dokumente\nSachsen Amtsgericht Chemnitz HRB 24393\nBeschäftigungsförderung Zwickau Service GmbH – Zwickau",
      "type": "Einreichung neuer Dokumente",
      "state": "Sachsen",
      "amtsgericht": "Amtsgericht Chemnitz",
      "registernummer": "HRB 24393",
      "registerart": "HRB",
      "company_name": "Beschäftigungsförderung Zwickau Service GmbH",
      "company_seat": "Zwickau",
      "details": "03.12.2024 (Bekanntmachungsdatum)\n\nSachsen Amtsgericht Chemnitz HRB 24393\nEinreichung neuer Dokumente\n\nBeschäftigungsförderung Zwickau Service GmbH\nGesellschaft mit beschränkter Haftung\nZwickau\n\nAm 02.12.2024 wurde beim Handelsregister des Amtsgerichts Chemnitz die Liste der Mitglieder des Aufsichtsrats gemäß § 52 GmbHG eingereicht."
    },
    {
      "date": "2024-12-03",
      "id": "95254",
      "original_text": "Sonstige Registerbekanntmachung\nSachsen Amtsgericht Leipzig HRB 22478\nsprd.net AG – Leipzig",
      "type": "Sonstige Registerbekanntmachung",
      "state": "Sachsen",
      "amtsgericht": "Amtsgericht Leipzig",
      "registernummer": "HRB 22478",
      "registerart": "HRB",
      "company_name": "sprd.net AG",
      "company_seat": "Leipzig",
      "details": "03.12.2024 (Bekanntmachungsdatum)\n\nSachsen Amtsgericht Leipzig HRB 22478\nSonstige Registerbekanntmachung\n\nsprd.net AG\nAktiengesellschaft\nLeipzig\n\nAm 29.11.2024 wurde beim Handelsregister des Amtsgerichts Leipzig die Liste der Mitglieder des Aufsichtsrats gemäß § 106 AktG eingereicht."
    },
    {
      "date": "2024-12-03",
      "id": "95255",
      "original_text": "Registerbekanntmachung nach dem Umwandlungsgesetz\nSachsen Amtsgericht Dresden HRB 14809\nKerkmann & Berthel GmbH – Dresden",
      "type": "Registerbekanntmachung nach dem Umwandlungsgesetz",
      "state": "Sachsen",
      "amtsgericht": "Amtsgericht Dresden",
      "registernummer": "HRB 14809",
      "registerart": "HRB",
      "company_name": "Kerkmann & Berthel GmbH",
      "company_seat": "Dresden",
      "details": "03.12.2024 (Bekanntmachungsdatum)\n\nSachsen Amtsgericht Dresden HRB 14809\nRegisterbekanntmachung nach dem Umwandlungsgesetz 03.12.2024 (Eintragungsdatum)\n\nKerkmann & Berthel GmbH\nGesellschaft mit beschränkter Haftung\nDresden\n\nDen Gläubigern der an der Verschmelzung beteiligten Rechtsträger ist, wenn sie binnen sechs Monaten nach dem Tag, an dem die Eintragung der Verschmelzung in das Register des Sitzes desjenigen Rechtsträgers, dessen Gläubiger sie sind, nach § 19 Abs. 3 UmwG als bekannt gemacht gilt, ihren Anspruch nach Grund und Höhe schriftlich anmelden, Sicherheit zu leisten, soweit sie nicht Befriedigung verlangen können. Dieses Recht steht den Gläubigern jedoch nur zu, wenn sie glaubhaft machen, dass durch die Verschmelzung die Erfüllung der Forderung gefährdet wird."
    },
    {
      "date": "2024-12-03",
      "id": "95256",
      "original_text": "Registerbekanntmachung nach dem Umwandlungsgesetz\nSachsen Amtsgericht Dresden HRB 28299\nCTH Dresden GmbH – Dresden",
      "type": "Registerbekanntmachung nach dem Umwandlungsgesetz",
      "state": "Sachsen",
      "amtsgericht": "Amtsgericht Dresden",
      "registernummer": "HRB 28299",
      "registerart": "HRB",
      "company_name": "CTH Dresden GmbH",
      "company_seat": "Dresden",
      "details": "03.12.2024 (Bekanntmachungsdatum)\n\nSachsen Amtsgericht Dresden HRB 28299\nRegisterbekanntmachung nach dem Umwandlungsgesetz 03.12.2024 (Eintragungsdatum)\n\nCTH Dresden GmbH\nGesellschaft mit beschränkter Haftung\nDresden\n\nDen Gläubigern der an der Verschmelzung beteiligten Rechtsträger ist, wenn sie binnen sechs Monaten nach dem Tag, an dem die Eintragung der Verschmelzung in das Register des Sitzes desjenigen Rechtsträgers, dessen Gläubiger sie sind, nach § 19 Abs. 3 UmwG als bekannt gemacht gilt, ihren Anspruch nach Grund und Höhe schriftlich anmelden, Sicherheit zu leisten, soweit sie nicht Befriedigung verlangen können. Dieses Recht steht den Gläubigern jedoch nur zu, wenn sie glaubhaft machen, dass durch die Verschmelzung die Erfüllung der Forderung gefährdet wird."
    },
    {
      "date": "2024-12-03",
      "id": "95257",
      "original_text": "Löschungsankündigung\nSachsen Amtsgericht Dresden HRB 36266\nZschoner Mühle MKE UG (haftungsbeschränkt) – Dresden",
      "type": "Löschungsankündigung",
      "state": "Sachsen",
      "amtsgericht": "Amtsgericht Dresden",
      "registernummer": "HRB 36266",
      "registerart": "HRB",
      "company_name": "Zschoner Mühle MKE UG (haftungsbeschränkt)",
      "company_seat": "Dresden",
      "details": "03.12.2024 (Bekanntmachungsdatum)\n\nSachsen Amtsgericht Dresden HRB 36266\nLöschungsankündigung\n\nZschoner Mühle MKE UG (haftungsbeschränkt)\nGesellschaft mit beschränkter Haftung\nDresden\n\nDas Registergericht beabsichtigt, die im Handelsregister eingetragene Gesellschaft von Amts wegen nach § 394 FamFG zu löschen. Die Frist zu Erhebung eines Widerspruchs gegen die beabsichtigte Löschung wird auf einen Monat festgesetzt."
    },
    {
      "date": "2024-12-03",
      "id": "95258",
      "original_text": "Einreichung neuer Dokumente\nSachsen Amtsgericht Leipzig HRB 9064\nGrimmaer Wohnungs- und Baugesellschaft mbH – Grimma",
      "type": "Einreichung neuer Dokumente",
      "state": "Sachsen",
      "amtsgericht": "Amtsgericht Leipzig",
      "registernummer": "HRB 9064",
      "registerart": "HRB",
      "company_name": "Grimmaer Wohnungs- und Baugesellschaft mbH",
      "company_seat": "Grimma",
      "details": "03.12.2024 (Bekanntmachungsdatum)\n\nSachsen Amtsgericht Leipzig HRB 9064\nEinreichung neuer Dokumente\n\nGrimmaer Wohnungs- und Baugesellschaft mbH\nGesellschaft mit beschränkter Haftung\nGrimma\n\nAm 02.12.2024 wurde beim Handelsregister des Amtsgerichts Leipzig die Liste der Mitglieder des Aufsichtsrats gemäß § 52 GmbHG eingereicht."
    },
    {
      "date": "2024-12-03",
      "id": "95259",
      "original_text": "Löschungsankündigung\nNiedersachsen Amtsgericht Göttingen HRB 204260\nSösetalbau GmbH – Göttingen",
      "type": "Löschungsankündigung",
      "state": "Niedersachsen",
      "amtsgericht": "Amtsgericht Göttingen",
      "registernummer": "HRB 204260",
      "registerart": "HRB",
      "company_name": "Sösetalbau GmbH",
      "company_seat": "Göttingen",
      "details": "03.12.2024 (Bekanntmachungsdatum)\n\nNiedersachsen Amtsgericht Göttingen HRB 204260\nLöschungsankündigung\n\nSösetalbau GmbH\nGesellschaft mit beschränkter Haftung\nGöttingen\n\nDas Registergericht beabsichtigt, die im Handelsregister eingetragene Gesellschaft wegen Vermögenslosigkeit von Amts wegen nach § 394 FamFG zu löschen. Die Frist zur Erhebung eines Widerspruchs gegen die beabsichtigte Löschung wird auf einen Monat festgesetzt."
    },
    {
      "date": "2024-12-03",
      "id": "95260",
      "original_text": "Registerbekanntmachung nach dem Umwandlungsgesetz\nNiedersachsen Amtsgericht Hildesheim HRB 209727\n3G Zweite Grundstücksgesellschaft mbH – Gifhorn",
      "type": "Registerbekanntmachung nach dem Umwandlungsgesetz",
      "state": "Niedersachsen",
      "amtsgericht": "Amtsgericht Hildesheim",
      "registernummer": "HRB 209727",
      "registerart": "HRB",
      "company_name": "3G Zweite Grundstücksgesellschaft mbH",
      "company_seat": "Gifhorn",
      "details": "03.12.2024 (Bekanntmachungsdatum)\n\nNiedersachsen Amtsgericht Hildesheim HRB 209727\nRegisterbekanntmachung nach dem Umwandlungsgesetz 03.12.2024 (Eintragungsdatum)\n\n3G Zweite Grundstücksgesellschaft mbH\nGesellschaft mit beschränkter Haftung\nGifhorn\n\nDen Gläubigern der an der formwechselnden Umwandlung beteiligten Rechtsträger ist, wenn sie binnen sechs Monaten nach dem Tag, an dem die Eintragung der Umwandlung in das Register des Sitzes desjenigen Rechtsträgers, dessen Gläubiger sie sind, nach § 19 Abs. 3 UmwG als bekannt gemacht gilt, ihren Anspruch nach Grund und Höhe schriftlich anmelden, Sicherheit zu leisten, soweit sie nicht Befriedigung verlangen können. Dieses Recht steht den Gläubigern jedoch nur zu, wenn sie glaubhaft machen, dass durch die formwechselnde Umwandlung die Erfüllung der Forderung gefährdet wird."
    },
    {
      "date": "2024-12-03",
      "id": "95261",
      "original_text": "Registerbekanntmachung nach dem Umwandlungsgesetz\nNiedersachsen Amtsgericht Hildesheim GsR 183\nGGG Grundstücksgesellschaft Breiter Weg/Steinweg eGbR – Gifhorn",
      "type": "Registerbekanntmachung nach dem Umwandlungsgesetz",
      "state": "Niedersachsen",
      "amtsgericht": "Amtsgericht Hildesheim",
      "registernummer": "GsR 183",
      "registerart": "GsR",
      "company_name": "GGG Grundstücksgesellschaft Breiter Weg/Steinweg eGbR",
      "company_seat": "Gifhorn",
      "details": "03.12.2024 (Bekanntmachungsdatum)\n\nNiedersachsen Amtsgericht Hildesheim GsR 183\nRegisterbekanntmachung nach dem Umwandlungsgesetz 03.12.2024 (Eintragungsdatum)\n\nGGG Grundstücksgesellschaft Breiter Weg/Steinweg eGbR\nGesellschaft bürgerlichen Rechts\nGifhorn\n\nDen Gläubigern der an der formwechselnden Umwandlung beteiligten Rechtsträger ist, wenn sie binnen sechs Monaten nach dem Tag, an dem die Eintragung der Umwandlung in das Register des Sitzes desjenigen Rechtsträgers, dessen Gläubiger sie sind, nach § 19 Abs. 3 UmwG als bekannt gemacht gilt, ihren Anspruch nach Grund und Höhe schriftlich anmelden, Sicherheit zu leisten, soweit sie nicht Befriedigung verlangen können. Dieses Recht steht den Gläubigern jedoch nur zu, wenn sie glaubhaft machen, dass durch die formwechselnde Umwandlung die Erfüllung der Forderung gefährdet wird."
    },
    {
      "date": "2024-12-03",
      "id": "95262",
      "original_text": "Einreichung neuer Dokumente\nNiedersachsen Amtsgericht Hannover HRB 55697\nHoneywell Specialty Chemicals Seelze GmbH – Seelze",
      "type": "Einreichung neuer Dokumente",
      "state": "Niedersachsen",
      "amtsgericht": "Amtsgericht Hannover",
      "registernummer": "HRB 55697",
      "registerart": "HRB",
      "company_name": "Honeywell Specialty Chemicals Seelze GmbH",
      "company_seat": "Seelze",
      "details": "03.12.2024 (Bekanntmachungsdatum)\n\nNiedersachsen Amtsgericht Hannover HRB 55697\nEinreichung neuer Dokumente\n\nHoneywell Specialty Chemicals Seelze GmbH\nGesellschaft mit beschränkter Haftung\nSeelze\n\nDie Liste der Mitglieder des Aufsichtsrats wurde beim Registergericht eingereicht."
    },
    {
      "date": "2024-12-03",
      "id": "95263",
      "original_text": "Einreichung neuer Dokumente\nNiedersachsen Amtsgericht Oldenburg (Oldenburg) HRB 202516\nBAD Bäderbetriebsgesellschaft mbH – Delmenhorst",
      "type": "Einreichung neuer Dokumente",
      "state": "Niedersachsen",
      "amtsgericht": "Amtsgericht Oldenburg (Oldenburg)",
      "registernummer": "HRB 202516",
      "registerart": "HRB",
      "company_name": "BAD Bäderbetriebsgesellschaft mbH",
      "company_seat": "Delmenhorst",
      "details": "03.12.2024 (Bekanntmachungsdatum)\n\nNiedersachsen Amtsgericht Oldenburg (Oldenburg) HRB 202516\nEinreichung neuer Dokumente\n\nBAD Bäderbetriebsgesellschaft mbH\nGesellschaft mit beschränkter Haftung\nDelmenhorst\n\nDie Liste der Mitglieder des Aufsichtsrats wurde beim Registergericht eingereicht."
    },
    {
      "date": "2024-12-03",
      "id": "95264",
      "original_text": "Registerbekanntmachung nach dem Umwandlungsgesetz\nNiedersachsen Amtsgericht Osnabrück HRB 220761\nFip Holding GmbH – Osnabrück",
      "type": "Registerbekanntmachung nach dem Umwandlungsgesetz",
      "state": "Niedersachsen",
      "amtsgericht": "Amtsgericht Osnabrück",
      "registernummer": "HRB 220761",
      "registerart": "HRB",
      "company_name": "Fip Holding GmbH",
      "company_seat": "Osnabrück",
      "details": "03.12.2024 (Bekanntmachungsdatum)\n\nNiedersachsen Amtsgericht Osnabrück HRB 220761\nRegisterbekanntmachung nach dem Umwandlungsgesetz 03.12.2024 (Eintragungsdatum)\n\nFip Holding GmbH\nGesellschaft mit beschränkter Haftung\nOsnabrück\n\nDen Gläubigern der an der Verschmelzung beteiligten Rechtsträger ist, wenn sie binnen sechs Monaten nach dem Tag, an dem die Eintragung der Verschmelzung in das Register des Sitzes desjenigen Rechtsträgers, dessen Gläubiger sie sind, nach § 19  Abs.  3 UmwG als bekannt gemacht gilt, ihren Anspruch nach Grund und Höhe schriftlich anmelden, Sicherheit zu leisten, soweit sie nicht Befriedigung verlangen können. Dieses Recht steht den Gläubigern jedoch nur zu, wenn sie glaubhaft machen, dass durch die Verschmelzung die Erfüllung der Forderung gefährdet wird."
    },
    {
      "date": "2024-12-03",
      "id": "95265",
      "original_text": "Löschungsankündigung\nNiedersachsen Amtsgericht Hildesheim HRB 35526\nSieco Software GmbH – Sehnde",
      "type": "Löschungsankündigung",
      "state": "Niedersachsen",
      "amtsgericht": "Amtsgericht Hildesheim",
      "registernummer": "HRB 35526",
      "registerart": "HRB",
      "company_name": "Sieco Software GmbH",
      "company_seat": "Sehnde",
      "details": "03.12.2024 (Bekanntmachungsdatum)\n\nNiedersachsen Amtsgericht Hildesheim HRB 35526\nLöschungsankündigung\n\nSieco Software GmbH\nGesellschaft mit beschränkter Haftung\nSehnde\n\nDas Registergericht beabsichtigt, die Gesellschaft von Amts wegen nach § 394 FamFG zu löschen. Die Frist zur Erhebung eines Widerspruchs ist auf 1 Monat ab dieser Registerbekanntmachung festgesetzt."
    },
    {
      "date": "2024-12-03",
      "id": "95266",
      "original_text": "Registerbekanntmachung nach dem Umwandlungsgesetz\nNiedersachsen Amtsgericht Hannover HRB 223248\nRÜTER Invest GmbH – Hannover",
      "type": "Registerbekanntmachung nach dem Umwandlungsgesetz",
      "state": "Niedersachsen",
      "amtsgericht": "Amtsgericht Hannover",
      "registernummer": "HRB 223248",
      "registerart": "HRB",
      "company_name": "RÜTER Invest GmbH",
      "company_seat": "Hannover",
      "details": "03.12.2024 (Bekanntmachungsdatum)\n\nNiedersachsen Amtsgericht Hannover HRB 223248\nRegisterbekanntmachung nach dem Umwandlungsgesetz 03.12.2024 (Eintragungsdatum)\n\nRÜTER Invest GmbH\nGesellschaft mit beschränkter Haftung\nHannover\n\nDen Gläubigern der an der formwechselnden Umwandlung beteiligten Rechtsträger ist, wenn sie binnen sechs Monaten nach dem Tag, an dem die Eintragung der Umwandlung in das Register des Sitzes desjenigen Rechtsträgers, dessen Gläubiger sie sind, nach § 19 Abs. 3 UmwG als bekannt gemacht gilt, ihren Anspruch nach Grund und Höhe schriftlich anmelden, Sicherheit zu leisten, soweit sie nicht Befriedigung verlangen können. Dieses Recht steht den Gläubigern jedoch nur zu, wenn sie glaubhaft machen, dass durch die formwechselnde Umwandlung die Erfüllung der Forderung gefährdet wird."
    },
    {
      "date": "2024-12-03",
      "id": "95267",
      "original_text": "Löschungsankündigung\nNiedersachsen Amtsgericht Walsrode HRA 203400\nJakob Schmalz e.K. – Bassum",
      "type": "Löschungsankündigung",
      "state": "Niedersachsen",
      "amtsgericht": "Amtsgericht Walsrode",
      "registernummer": "HRA 203400",
      "registerart": "HRA",
      "company_name": "Jakob Schmalz e.K.",
      "company_seat": "Bassum",
      "details": "03.12.2024 (Bekanntmachungsdatum)\n\nNiedersachsen Amtsgericht Walsrode HRA 203400\nLöschungsankündigung\n\nJakob Schmalz e.K.\nEinzelkaufmann / Einzelkauffrau\nBassum\n\nDas Registergericht beabsichtigt, die Firma von Amts wegen nach § 31 Abs. 2 S. 2 HGB, § 395 FamFG zu löschen. Die Frist zur Erhebung eines Widerspruchs ist auf 1 Monat ab dieser Registerbekanntmachung festgesetzt."
    },
    {
      "date": "2024-12-03",
      "id": "95268",
      "original_text": "Löschungsankündigung\nNiedersachsen Amtsgericht Hannover HRB 218941\nZamans´kyy Hannover News UG (haftungsbeschränkt) – Isernhagen",
      "type": "Löschungsankündigung",
      "state": "Niedersachsen",
      "amtsgericht": "Amtsgericht Hannover",
      "registernummer": "HRB 218941",
      "registerart": "HRB",
      "company_name": "Zamans´kyy Hannover News UG (haftungsbeschränkt)",
      "company_seat": "Isernhagen",
      "details": "03.12.2024 (Bekanntmachungsdatum)\n\nNiedersachsen Amtsgericht Hannover HRB 218941\nLöschungsankündigung\n\nZamans´kyy Hannover News UG (haftungsbeschränkt)\nGesellschaft mit beschränkter Haftung\nIsernhagen\n\nDas Registergericht beabsichtigt, die Gesellschaft von Amts wegen nach § 394 FamFG zu löschen. Die Frist zur Erhebung eines Widerspruchs ist auf 1 Monat ab dieser Registerbekanntmachung festgesetzt."
    },
    {
      "date": "2024-12-03",
      "id": "95269",
      "original_text": "Registerbekanntmachung nach dem Umwandlungsgesetz\nNiedersachsen Amtsgericht Hannover GsR 525\nRÜTER Immobilien II eGbR – Hannover",
      "type": "Registerbekanntmachung nach dem Umwandlungsgesetz",
      "state": "Niedersachsen",
      "amtsgericht": "Amtsgericht Hannover",
      "registernummer": "GsR 525",
      "registerart": "GsR",
      "company_name": "RÜTER Immobilien II eGbR",
      "company_seat": "Hannover",
      "details": "03.12.2024 (Bekanntmachungsdatum)\n\nNiedersachsen Amtsgericht Hannover GsR 525\nRegisterbekanntmachung nach dem Umwandlungsgesetz 03.12.2024 (Eintragungsdatum)\n\nRÜTER Immobilien II eGbR\nGesellschaft bürgerlichen Rechts\nHannover\n\nDen Gläubigern der an der formwechselnden Umwandlung beteiligten Rechtsträger ist, wenn sie binnen sechs Monaten nach dem Tag, an dem die Eintragung der Umwandlung in das Register des Sitzes desjenigen Rechtsträgers, dessen Gläubiger sie sind, nach § 19 Abs. 3 UmwG als bekannt gemacht gilt, ihren Anspruch nach Grund und Höhe schriftlich anmelden, Sicherheit zu leisten, soweit sie nicht Befriedigung verlangen können. Dieses Recht steht den Gläubigern jedoch nur zu, wenn sie glaubhaft machen, dass durch die formwechselnde Umwandlung die Erfüllung der Forderung gefährdet wird."
    },
    {
      "date": "2024-12-03",
      "id": "95270",
      "original_text": "Löschungsankündigung\nRheinland-Pfalz Amtsgericht Zweibrücken HRB 31716\nWeihmann GmbH – Ramstein-Miesenbach",
      "type": "Löschungsankündigung",
      "state": "Rheinland-Pfalz",
      "amtsgericht": "Amtsgericht Zweibrücken",
      "registernummer": "HRB 31716",
      "registerart": "HRB",
      "company_name": "Weihmann GmbH",
      "company_seat": "Ramstein-Miesenbach",
      "details": "03.12.2024 (Bekanntmachungsdatum)\n\nRheinland-Pfalz Amtsgericht Zweibrücken HRB 31716\nLöschungsankündigung\n\nWeihmann GmbH\nGesellschaft mit beschränkter Haftung\nRamstein-Miesenbach\n\nDas Registergericht beabsichtigt die Gesellschaft von Amts wegen nach § 394 FamFG zu löschen. Die Frist zur Erhebung eines Widerspruchs ist auf einen Monat festgesetzt."
    },
    {
      "date": "2024-12-03",
      "id": "95271",
      "original_text": "Registerbekanntmachung nach dem Umwandlungsgesetz\nRheinland-Pfalz Amtsgericht Wittlich HRA 31009\nTheodor Riewer GmbH & Co. KG – Bitburg",
      "type": "Registerbekanntmachung nach dem Umwandlungsgesetz",
      "state": "Rheinland-Pfalz",
      "amtsgericht": "Amtsgericht Wittlich",
      "registernummer": "HRA 31009",
      "registerart": "HRA",
      "company_name": "Theodor Riewer GmbH & Co. KG",
      "company_seat": "Bitburg",
      "details": "03.12.2024 (Bekanntmachungsdatum)\n\nRheinland-Pfalz Amtsgericht Wittlich HRA 31009\nRegisterbekanntmachung nach dem Umwandlungsgesetz 03.12.2024 (Eintragungsdatum)\n\nTheodor Riewer GmbH & Co. KG\nKommanditgesellschaft\nBitburg\n\nAls nicht eingetragen wird veröffentlicht: Den Gläubigern der an der Verschmelzung beteiligten Rechtsträger ist, wenn sie binnen sechs Monaten nach dem Tag, an dem die Eintragung der Verschmelzung in das Register des Sitzes desjenigen Rechtsträgers,dessen Gläubiger sie sind, nach § 19 Abs. 3 UmwG als bekannt gemacht gilt, ihren Anspruch nach Grund und Höhe schriftlich anmelden, Sicherheit zu leisten, soweit sie nicht Befriedigung verlangen können. Dieses Recht steht den Gläubigern jedoch nur zu, wenn sie glaubhaft machen, dass durch die Verschmelzung die Erfüllung der Forderung gefährdet wird."
    },
    {
      "date": "2024-12-03",
      "id": "95272",
      "original_text": "Einreichung neuer Dokumente\nRheinland-Pfalz Amtsgericht Kaiserslautern HRB 11857\nDonnersberger konzepte GmbH – Rockenhausen",
      "type": "Einreichung neuer Dokumente",
      "state": "Rheinland-Pfalz",
      "amtsgericht": "Amtsgericht Kaiserslautern",
      "registernummer": "HRB 11857",
      "registerart": "HRB",
      "company_name": "Donnersberger konzepte GmbH",
      "company_seat": "Rockenhausen",
      "details": "03.12.2024 (Bekanntmachungsdatum)\n\nRheinland-Pfalz Amtsgericht Kaiserslautern HRB 11857\nEinreichung neuer Dokumente\n\nDonnersberger konzepte GmbH\nGesellschaft mit beschränkter Haftung\nRockenhausen\n\nDem Registergericht ist eine neue Liste der Mitglieder des Aufsichtsrates eingereicht worden."
    },
    {
      "date": "2024-12-03",
      "id": "95273",
      "original_text": "Löschungsankündigung\nNordrhein-Westfalen Amtsgericht Köln HRB 98251\nCAN - AY Cash & Carry GmbH – Köln",
      "type": "Löschungsankündigung",
      "state": "Nordrhein-Westfalen",
      "amtsgericht": "Amtsgericht Köln",
      "registernummer": "HRB 98251",
      "registerart": "HRB",
      "company_name": "CAN - AY Cash & Carry GmbH",
      "company_seat": "Köln",
      "details": "03.12.2024 (Bekanntmachungsdatum)\n\nNordrhein-Westfalen Amtsgericht Köln HRB 98251\nLöschungsankündigung\n\nCAN - AY Cash & Carry GmbH\nGesellschaft mit beschränkter Haftung\nKöln\n\nDas Registergericht beabsichtigt die Gesellschaft von Amts wegen nach § 394 FamFG zu löschen. Die Frist zur Erhebung eines Widerspruchs ist auf einen Monat festgesetzt."
    },
    {
      "date": "2024-12-03",
      "id": "95274",
      "original_text": "Löschungsankündigung\nNordrhein-Westfalen Amtsgericht Siegburg HRB 13371\nMYRob Engineering GmbH – Troisdorf",
      "type": "Löschungsankündigung",
      "state": "Nordrhein-Westfalen",
      "amtsgericht": "Amtsgericht Siegburg",
      "registernummer": "HRB 13371",
      "registerart": "HRB",
      "company_name": "MYRob Engineering GmbH",
      "company_seat": "Troisdorf",
      "details": "03.12.2024 (Bekanntmachungsdatum)\n\nNordrhein-Westfalen Amtsgericht Siegburg HRB 13371\nLöschungsankündigung\n\nMYRob Engineering GmbH\nGesellschaft mit beschränkter Haftung\nTroisdorf\n\nDas Registergericht hat glaubhafte Kenntnis erlangt, dass die Gesellschaft vermögenslos geworden ist, da ein Insolvenzeröffnungsantrag mangels Masse nach § 26 InsO zurückgewiesen wurde.\n\nEs ist daher beabsichtigt, die Gesellschaft nach § 394 FamFG im Handelsregister wegen Vermögenslosigkeit zu löschen.\nEinwände gegen die Löschung sind durch Widerspruch binnen einer Frist von 3 Monaten geltend zu machen, andernfalls die Löschung erfolgen wird.\n\nEinzulegen ist der Widerspruch bei dem Amtsgericht Siegburg, Neue Poststraße 16, 53721 Siegburg, und zwar entweder schriftlich in deutscher Sprache oder mündlich zur Niederschrift der Geschäftsstelle. Der Widerspruch kann auch zur Niederschrift der Geschäftsstelle eines jeden Amtsgerichts abgegeben werden. Der Widerspruch ist binnen der in der Verfügung bestimmten Frist einzulegen. Die Frist ist nur gewahrt, wenn der Widerspruch rechtzeitig bei dem Amtsgericht Siegburg eingeht, auch wenn der Widerspruch zur Niederschrift der Geschäftsstelle eines anderen Amtsgerichts abgegeben wurde. Die Frist beginnt jeweils mit der schriftlichen Bekanntgabe der Verfügung an die Beteiligten. Kann die schriftliche Bekanntgabe an einen Beteiligten nicht bewirkt werden, beginnt die Frist spätestens mit Ablauf von fünf Monaten nach Erlass der Verfügung. Die Bekanntgabe ist entweder durch Zustellung oder am dritten Tage nach Aufgabe zur Post bewirkt. Sofern die Löschung noch nicht erfolgt ist, kann der Widerspruch auch noch nach Ablauf der Frist eingelegt werden. Fällt das Ende der Frist auf einen Sonnabend, einen Sonntag oder einen allgemeinen Feiertag, endet die Frist mit Ablauf des nächsten Werktages. Der Widerspruch ist zu unterzeichnen. Eine Begründung des Widerspruchs ist nicht vorgeschrieben."
    },
    {
      "date": "2024-12-03",
      "id": "95275",
      "original_text": "Löschungsankündigung\nNordrhein-Westfalen Amtsgericht Wuppertal HRB 21639\nGuthan GmbH – Wuppertal",
      "type": "Löschungsankündigung",
      "state": "Nordrhein-Westfalen",
      "amtsgericht": "Amtsgericht Wuppertal",
      "registernummer": "HRB 21639",
      "registerart": "HRB",
      "company_name": "Guthan GmbH",
      "company_seat": "Wuppertal",
      "details": "03.12.2024 (Bekanntmachungsdatum)\n\nNordrhein-Westfalen Amtsgericht Wuppertal HRB 21639\nLöschungsankündigung 02.12.2024 (Eintragungsdatum)\n\nGuthan GmbH\nGesellschaft mit beschränkter Haftung\nWuppertal\n\nDas Registergericht beabsichtigt die Gesellschaft von Amts wegen nach § 394 FamFG zu löschen. Die Frist zur Erhebung eines Widerspruchs ist auf einen Monat festgesetzt."
    },
    {
      "date": "2024-12-03",
      "id": "95276",
      "original_text": "Löschungsankündigung\nNordrhein-Westfalen Amtsgericht Dortmund HRB 29781\nNowak Bau GmbH – Dortmund",
      "type": "Löschungsankündigung",
      "state": "Nordrhein-Westfalen",
      "amtsgericht": "Amtsgericht Dortmund",
      "registernummer": "HRB 29781",
      "registerart": "HRB",
      "company_name": "Nowak Bau GmbH",
      "company_seat": "Dortmund",
      "details": "03.12.2024 (Bekanntmachungsdatum)\n\nNordrhein-Westfalen Amtsgericht Dortmund HRB 29781\nLöschungsankündigung\n\nNowak Bau GmbH\nGesellschaft mit beschränkter Haftung\nDortmund\n\nDas Registergericht beabsichtigt die Gesellschaft von Amts wegen nach § 394 FamFG zu löschen. Die Frist zur Erhebung eines Widerspruchs ist auf zwei Monate festgesetzt."
    },
    {
      "date": "2024-12-03",
      "id": "95277",
      "original_text": "Löschungsankündigung\nNordrhein-Westfalen Amtsgericht Bonn HRB 23880\nImza GmbH – Bonn",
      "type": "Löschungsankündigung",
      "state": "Nordrhein-Westfalen",
      "amtsgericht": "Amtsgericht Bonn",
      "registernummer": "HRB 23880",
      "registerart": "HRB",
      "company_name": "Imza GmbH",
      "company_seat": "Bonn",
      "details": "03.12.2024 (Bekanntmachungsdatum)\n\nNordrhein-Westfalen Amtsgericht Bonn HRB 23880\nLöschungsankündigung\n\nImza GmbH\nGesellschaft mit beschränkter Haftung\nBonn\n\nDas Registergericht beabsichtigt die im Handelsregister beim Amtsgericht Bonn in Abt. B unter Nr. 23880 eingetragene Gesellschaft  Imza GmbH mit Sitz in Bonn von Amts wegen nach § 394 FamFG zu löschen. Die Frist zur Erhebung eines Widerspruchs ist auf einen Monat festgesetzt."
    },
    {
      "date": "2024-12-03",
      "id": "95278",
      "original_text": "Löschungsankündigung\nNordrhein-Westfalen Amtsgericht Düsseldorf HRA 26212\nKnaack´s Büdchen KG – Hilden",
      "type": "Löschungsankündigung",
      "state": "Nordrhein-Westfalen",
      "amtsgericht": "Amtsgericht Düsseldorf",
      "registernummer": "HRA 26212",
      "registerart": "HRA",
      "company_name": "Knaack´s Büdchen KG",
      "company_seat": "Hilden",
      "details": "03.12.2024 (Bekanntmachungsdatum)\n\nNordrhein-Westfalen Amtsgericht Düsseldorf HRA 26212\nLöschungsankündigung\n\nKnaack´s Büdchen KG\nKommanditgesellschaft\nHilden\n\nDas Registergericht beabsichtigt die Firma von Amts wegen nach § 31 Abs. 2 HGB zu löschen, da kein Gewerbe mehr betrieben wird. Die Frist zur Erhebung eines Widerspruchs ist auf drei Monate festgesetzt.\n\nRechtsbehelfsbelehrung:\nDas Widerspruchsrecht steht jedem zu, der an der Unterlassung der Löschung ein berechtigtes Interesse hat. Der Widerspruch ist bei dem Amtsgericht Düsseldorf -Registergericht-, Werdener Straße 1, 40227 Düsseldorf schriftlich in deutscher Sprache oder zur Niederschrift der Geschäftsstelle einzulegen. Der Widerspruch kann auch zur Niederschrift der Geschäftsstelle eines jeden Amtsgerichtes abgegeben werden. Die Einlegung ist auch durch Übertragung eines elektronischen Dokuments an die elektronische Poststelle des Gerichts möglich. Das elektronische Dokument muss für die Bearbeitung durch das Gericht geeignet und mit einer qualifizierten elektronischen Signatur der verantwortenden Person versehen sein oder von der verantwortenden Person signiert und auf einem sicheren Übermittlungsweg gemäß § 130a ZPO nach näherer Maßgabe der Verordnung über die technischen Rahmenbedingungen des elektronischen Rechtsverkehrs und über das besondere elektronische Behördenpostfach (BGBl. I, S.3803) eingereicht werden. Weitere Informationen erhalten Sie auf der Internetseite www.justiz.de.\nDer Widerspruch muss spätestens innerhalb der gesetzten Frist nach dem Datum der Bekanntmachung der Löschungsankündigung bei dem Amtsgericht - Registergericht - Düsseldorf eingegangen sein.  Dies gilt auch dann, wenn der Widerspruch zur Niederschrift der Geschäftsstelle eines anderen Amtsgerichtes abgegeben wurde. Die Frist beginnt mit dem Tage der Bekanntmachung der Löschungsankündigung in dem für die Bekanntmachung der Eintragungen in das Handelsregister bestimmten elektronischen Informations- und Kommunikationssystem nach § 10 des Handelsgesetzbuches. Fällt das Ende der Frist auf einen Sonntag, einen allgemeinen Feiertag oder Sonnabend, so endet die Frist mit Ablauf des nächsten Werktages.\nDer Widerspruch muss die Bezeichnung der angefochtenen Löschungsankündigung sowie die Erklärung enthalten, dass Widerspruch gegen diese Löschungsankündigung eingelegt wird. Er ist zu unterzeichnen und soll begründet werden."
    },
    {
      "date": "2024-12-03",
      "id": "95279",
      "original_text": "Einreichung neuer Dokumente\nNordrhein-Westfalen Amtsgericht Köln HRB 80300\nStadtentwicklungsgesellschaft Wesseling mbH – Wesseling",
      "type": "Einreichung neuer Dokumente",
      "state": "Nordrhein-Westfalen",
      "amtsgericht": "Amtsgericht Köln",
      "registernummer": "HRB 80300",
      "registerart": "HRB",
      "company_name": "Stadtentwicklungsgesellschaft Wesseling mbH",
      "company_seat": "Wesseling",
      "details": "03.12.2024 (Bekanntmachungsdatum)\n\nNordrhein-Westfalen Amtsgericht Köln HRB 80300\nEinreichung neuer Dokumente 03.12.2024 (Eintragungsdatum)\n\nStadtentwicklungsgesellschaft Wesseling mbH\nGesellschaft mit beschränkter Haftung\nWesseling\n\nDem Registergericht ist eine Liste der Mitglieder des Aufsichtsrates eingereicht worden."
    },
    {
      "date": "2024-12-03",
      "id": "95280",
      "original_text": "Registerbekanntmachung nach dem Umwandlungsgesetz\nBremen Amtsgericht Bremen HRB 31556\nTaiwan offshore Holding GmbH – Bremen",
      "type": "Registerbekanntmachung nach dem Umwandlungsgesetz",
      "state": "Bremen",
      "amtsgericht": "Amtsgericht Bremen",
      "registernummer": "HRB 31556",
      "registerart": "HRB",
      "company_name": "Taiwan offshore Holding GmbH",
      "company_seat": "Bremen",
      "details": "03.12.2024 (Bekanntmachungsdatum)\n\nBremen Amtsgericht Bremen HRB 31556\nRegisterbekanntmachung nach dem Umwandlungsgesetz 02.12.2024 (Eintragungsdatum)\n\nTaiwan offshore Holding GmbH\nGesellschaft mit beschränkter Haftung\nBremen\n\nZu Eintragungsnummer 7 vom 02.12.2024 wird als nicht eingetragen veröffentlicht: Den Gläubigern der an der Verschmelzung beteiligten Rechtsträger ist, wenn sie binnen sechs Monaten nach dem Tag, an dem die Eintragung der Verschmelzung in das Register des Sitzes desjenigen Rechtsträgers, dessen Gläubiger sie sind, als bekannt gemacht gilt, ihren Anspruch nach Grund und Höhe schriftlich anmelden, Sicherheit zu leisten, soweit sie nicht Befriedigung verlangen können. Dieses Recht steht den Gläubigern jedoch nur zu, wenn sie glaubhaft machen, dass durch die Verschmelzung die Erfüllung ihrer Forderung gefährdet wird. Das Recht, Sicherheitsleistung zu verlangen, steht Gläubigern nicht zu, die im Falle der Insolvenz ein Recht auf vorzugsweise Befriedigung aus einer Deckungsmasse haben, die nach gesetzlicher Vorschrift zu ihrem Schutz errichtet und staatlich überwacht ist."
    },
    {
      "date": "2024-12-03",
      "id": "95281",
      "original_text": "Registerbekanntmachung nach dem Umwandlungsgesetz\nBremen Amtsgericht Bremen HRB 31556\nTaiwan offshore Holding GmbH – Bremen",
      "type": "Registerbekanntmachung nach dem Umwandlungsgesetz",
      "state": "Bremen",
      "amtsgericht": "Amtsgericht Bremen",
      "registernummer": "HRB 31556",
      "registerart": "HRB",
      "company_name": "Taiwan offshore Holding GmbH",
      "company_seat": "Bremen",
      "details": "03.12.2024 (Bekanntmachungsdatum)\n\nBremen Amtsgericht Bremen HRB 31556\nRegisterbekanntmachung nach dem Umwandlungsgesetz 02.12.2024 (Eintragungsdatum)\n\nTaiwan offshore Holding GmbH\nGesellschaft mit beschränkter Haftung\nBremen\n\nZu Eintragungsnummer 6 vom 02.12.2024 wird als nicht eingetragen veröffentlicht:  Den Gläubigern der an der Verschmelzung beteiligten Rechtsträger ist, wenn sie binnen sechs Monaten nach dem Tag, an dem die Eintragung der Verschmelzung in das Register des Sitzes desjenigen Rechtsträgers, dessen Gläubiger sie sind, als bekannt gemacht gilt, ihren Anspruch nach Grund und Höhe schriftlich anmelden, Sicherheit zu leisten, soweit sie nicht Befriedigung verlangen können. Dieses Recht steht den Gläubigern jedoch nur zu, wenn sie glaubhaft machen, dass durch die Verschmelzung die Erfüllung ihrer Forderung gefährdet wird. Das Recht, Sicherheitsleistung zu verlangen, steht Gläubigern nicht zu, die im Falle der Insolvenz ein Recht auf vorzugsweise Befriedigung aus einer Deckungsmasse haben, die nach gesetzlicher Vorschrift zu ihrem Schutz errichtet und staatlich überwacht ist."
    },
    {
      "date": "2024-12-03",
      "id": "95282",
      "original_text": "Registerbekanntmachung nach dem Umwandlungsgesetz\nBremen Amtsgericht Bremen HRB 37475\nOWF Taichung Holding GmbH – Bremen",
      "type": "Registerbekanntmachung nach dem Umwandlungsgesetz",
      "state": "Bremen",
      "amtsgericht": "Amtsgericht Bremen",
      "registernummer": "HRB 37475",
      "registerart": "HRB",
      "company_name": "OWF Taichung Holding GmbH",
      "company_seat": "Bremen",
      "details": "03.12.2024 (Bekanntmachungsdatum)\n\nBremen Amtsgericht Bremen HRB 37475\nRegisterbekanntmachung nach dem Umwandlungsgesetz 02.12.2024 (Eintragungsdatum)\n\nOWF Taichung Holding GmbH\nGesellschaft mit beschränkter Haftung\nBremen\n\nZu Eintragungsnummer 6 vom 02.12.2024 wird als nicht eingetragen veröffentlicht: Den Gläubigern der an der Verschmelzung beteiligten Rechtsträger ist, wenn sie binnen sechs Monaten nach dem Tag, an dem die Eintragung der Verschmelzung in das Register des Sitzes desjenigen Rechtsträgers, dessen Gläubiger sie sind, als bekannt gemacht gilt, ihren Anspruch nach Grund und Höhe schriftlich anmelden, Sicherheit zu leisten, soweit sie nicht Befriedigung verlangen können. Dieses Recht steht den Gläubigern jedoch nur zu, wenn sie glaubhaft machen, dass durch die Verschmelzung die Erfüllung ihrer Forderung gefährdet wird. Das Recht, Sicherheitsleistung zu verlangen, steht Gläubigern nicht zu, die im Falle der Insolvenz ein Recht auf vorzugsweise Befriedigung aus einer Deckungsmasse haben, die nach gesetzlicher Vorschrift zu ihrem Schutz errichtet und staatlich überwacht ist."
    },
    {
      "date": "2024-12-03",
      "id": "95283",
      "original_text": "Registerbekanntmachung nach dem Umwandlungsgesetz\nBremen Amtsgericht Bremen HRB 37453\nOWF Miaoli Holding GmbH – Bremen",
      "type": "Registerbekanntmachung nach dem Umwandlungsgesetz",
      "state": "Bremen",
      "amtsgericht": "Amtsgericht Bremen",
      "registernummer": "HRB 37453",
      "registerart": "HRB",
      "company_name": "OWF Miaoli Holding GmbH",
      "company_seat": "Bremen",
      "details": "03.12.2024 (Bekanntmachungsdatum)\n\nBremen Amtsgericht Bremen HRB 37453\nRegisterbekanntmachung nach dem Umwandlungsgesetz 02.12.2024 (Eintragungsdatum)\n\nOWF Miaoli Holding GmbH\nGesellschaft mit beschränkter Haftung\nBremen\n\nZu Eintragungsnummer 6 vom 02.12.2024 wird als nicht eingetragen veröffentlicht: Den Gläubigern der an der Verschmelzung beteiligten Rechtsträger ist, wenn sie binnen sechs Monaten nach dem Tag, an dem die Eintragung der Verschmelzung in das Register des Sitzes desjenigen Rechtsträgers, dessen Gläubiger sie sind, als bekannt gemacht gilt, ihren Anspruch nach Grund und Höhe schriftlich anmelden, Sicherheit zu leisten, soweit sie nicht Befriedigung verlangen können. Dieses Recht steht den Gläubigern jedoch nur zu, wenn sie glaubhaft machen, dass durch die Verschmelzung die Erfüllung ihrer Forderung gefährdet wird. Das Recht, Sicherheitsleistung zu verlangen, steht Gläubigern nicht zu, die im Falle der Insolvenz ein Recht auf vorzugsweise Befriedigung aus einer Deckungsmasse haben, die nach gesetzlicher Vorschrift zu ihrem Schutz errichtet und staatlich überwacht ist."
    },
    {
      "date": "2024-12-03",
      "id": "95284",
      "original_text": "Einreichung neuer Dokumente\nNordrhein-Westfalen Amtsgericht Paderborn HRB 2997\nCampus Consult Projektmanagement GmbH – Paderborn",
      "type": "Einreichung neuer Dokumente",
      "state": "Nordrhein-Westfalen",
      "amtsgericht": "Amtsgericht Paderborn",
      "registernummer": "HRB 2997",
      "registerart": "HRB",
      "company_name": "Campus Consult Projektmanagement GmbH",
      "company_seat": "Paderborn",
      "details": "03.12.2024 (Bekanntmachungsdatum)\n\nNordrhein-Westfalen Amtsgericht Paderborn HRB 2997\nEinreichung neuer Dokumente 03.12.2024 (Eintragungsdatum)\n\nCampus Consult Projektmanagement GmbH\nGesellschaft mit beschränkter Haftung\nPaderborn\n\nDem Registergericht ist eine neue Liste der Mitglieder des Aufsichtsrates eingereicht worden."
    },
    {
      "date": "2024-12-03",
      "id": "95285",
      "original_text": "Registerbekanntmachung nach dem Umwandlungsgesetz\nNordrhein-Westfalen Amtsgericht Bad Oeynhausen HRB 19561\nHäusliche Kranken- und Altenpflege GmbH – Löhne",
      "type": "Registerbekanntmachung nach dem Umwandlungsgesetz",
      "state": "Nordrhein-Westfalen",
      "amtsgericht": "Amtsgericht Bad Oeynhausen",
      "registernummer": "HRB 19561",
      "registerart": "HRB",
      "company_name": "Häusliche Kranken- und Altenpflege GmbH",
      "company_seat": "Löhne",
      "details": "03.12.2024 (Bekanntmachungsdatum)\n\nNordrhein-Westfalen Amtsgericht Bad Oeynhausen HRB 19561\nRegisterbekanntmachung nach dem Umwandlungsgesetz 03.12.2024 (Eintragungsdatum)\n\nHäusliche Kranken- und Altenpflege GmbH\nGesellschaft mit beschränkter Haftung\nLöhne\n\nDen Gläubigern der an der Ausgliederung beteiligten Rechtsträger ist, wenn sie binnen sechs Monaten nach dem Tag, an dem die Eintragung der Ausgliederung in das Register des Sitzes desjenigen Rechtsträgers, dessen Gläubiger sie sind, nach § 19 Absatz 3 UmwG als bekanntgemacht gilt, ihren Anspruch nach Grund und Höhe schriftlich anmelden, Sicherheit zu leisten, soweit sie nicht Befriedigung verlangen können. Dieses Recht steht den Gläubigern jedoch nur zu, wenn sie glaubhaft machen, dass durch die Ausgliederung die Erfüllung ihrer Forderung gefährdet wird."
    },
    {
      "date": "2024-12-03",
      "id": "95286",
      "original_text": "Löschungsankündigung\nNordrhein-Westfalen Amtsgericht Düsseldorf HRB 93372\nTaco Comer Galeano Gonzalez UG (haftungsbeschränkt) – Düsseldorf",
      "type": "Löschungsankündigung",
      "state": "Nordrhein-Westfalen",
      "amtsgericht": "Amtsgericht Düsseldorf",
      "registernummer": "HRB 93372",
      "registerart": "HRB",
      "company_name": "Taco Comer Galeano Gonzalez UG (haftungsbeschränkt)",
      "company_seat": "Düsseldorf",
      "details": "03.12.2024 (Bekanntmachungsdatum)\n\nNordrhein-Westfalen Amtsgericht Düsseldorf HRB 93372\nLöschungsankündigung\n\nTaco Comer Galeano Gonzalez UG (haftungsbeschränkt)\nGesellschaft mit beschränkter Haftung\nDüsseldorf\n\nDas Registergericht beabsichtigt die Gesellschaft von Amts wegen nach § 394 FamFG zu löschen. Die Frist zur Erhebung eines Widerspruchs ist auf 3 Wochen festgesetzt.\n\nRechtsbehelfsbelehrung:\nDas Widerspruchsrecht steht jedem zu, der an der Unterlassung der Löschung ein berechtigtes Interesse hat. Der Widerspruch ist bei dem Amtsgericht Düsseldorf -Registergericht-, Werdener Straße 1, 40227 Düsseldorf schriftlich in deutscher Sprache oder zur Niederschrift der Geschäftsstelle einzulegen. Der Widerspruch kann auch zur Niederschrift der Geschäftsstelle eines jeden Amtsgerichtes abgegeben werden. Die Einlegung ist auch durch Übertragung eines elektronischen Dokuments an die elektronische Poststelle des Gerichts möglich. Das elektronische Dokument muss für die Bearbeitung durch das Gericht geeignet und mit einer qualifizierten elektronischen Signatur der verantwortenden Person versehen sein oder von der verantwortenden Person signiert und auf einem sicheren Übermittlungsweg gemäß § 130a ZPO nach näherer Maßgabe der Verordnung über die technischen Rahmenbedingungen des elektronischen Rechtsverkehrs und über das besondere elektronische Behördenpostfach (BGBl. I, S.3803) eingereicht werden. Weitere Informationen erhalten Sie auf der Internetseite www.justiz.de.\nDer Widerspruch muss spätestens innerhalb der gesetzten Frist nach dem Datum der Bekanntmachung der Löschungsankündigung bei dem Amtsgericht - Registergericht - Düsseldorf eingegangen sein.  Dies gilt auch dann, wenn der Widerspruch zur Niederschrift der Geschäftsstelle eines anderen Amtsgerichtes abgegeben wurde. Die Frist beginnt mit dem Tage der Bekanntmachung der Löschungsankündigung in dem für die Bekanntmachung der Eintragungen in das Handelsregister bestimmten elektronischen Informations- und Kommunikationssystem nach § 10 des Handelsgesetzbuches. Fällt das Ende der Frist auf einen Sonntag, einen allgemeinen Feiertag oder Sonnabend, so endet die Frist mit Ablauf des nächsten Werktages.\nDer Widerspruch muss die Bezeichnung der angefochtenen Löschungsankündigung sowie die Erklärung enthalten, dass Widerspruch gegen diese Löschungsankündigung eingelegt wird. Er ist zu unterzeichnen und soll begründet werden."
    },
    {
      "date": "2024-12-03",
      "id": "95287",
      "original_text": "Löschungsankündigung\nNordrhein-Westfalen Amtsgericht Gütersloh HRB 10304\nFeinkost Menzi GmbH – Versmold",
      "type": "Löschungsankündigung",
      "state": "Nordrhein-Westfalen",
      "amtsgericht": "Amtsgericht Gütersloh",
      "registernummer": "HRB 10304",
      "registerart": "HRB",
      "company_name": "Feinkost Menzi GmbH",
      "company_seat": "Versmold",
      "details": "03.12.2024 (Bekanntmachungsdatum)\n\nNordrhein-Westfalen Amtsgericht Gütersloh HRB 10304\nLöschungsankündigung 03.12.2024 (Eintragungsdatum)\n\nFeinkost Menzi GmbH\nGesellschaft mit beschränkter Haftung\nVersmold\n\nDas Registergericht beabsichtigt die Gesellschaft von Amts wegen nach § 394 FamFG zu löschen. Die Frist zur Erhebung eines Widerspruchs ist auf einen Monat festgesetzt."
    },
    {
      "date": "2024-12-03",
      "id": "95288",
      "original_text": "Löschungsankündigung\nNordrhein-Westfalen Amtsgericht Gelsenkirchen HRA 5177\nFork Innovationsbäckerei Bochum GmbH & Co. KG – Gelsenkirchen",
      "type": "Löschungsankündigung",
      "state": "Nordrhein-Westfalen",
      "amtsgericht": "Amtsgericht Gelsenkirchen",
      "registernummer": "HRA 5177",
      "registerart": "HRA",
      "company_name": "Fork Innovationsbäckerei Bochum GmbH & Co. KG",
      "company_seat": "Gelsenkirchen",
      "details": "03.12.2024 (Bekanntmachungsdatum)\n\nNordrhein-Westfalen Amtsgericht Gelsenkirchen HRA 5177\nLöschungsankündigung\n\nFork Innovationsbäckerei Bochum GmbH & Co. KG\nKommanditgesellschaft\nGelsenkirchen\n\nDas Registergericht beabsichtigt die Firma von Amts wegen nach § 394 FamFG zu löschen. Die Frist zur Erhebung eines Widerspruchs ist auf 1 Monat  festgesetzt."
    },
    {
      "date": "2024-12-03",
      "id": "95289",
      "original_text": "Löschungsankündigung\nNordrhein-Westfalen Amtsgericht Mönchengladbach HRB 11775\nH.T.A. GmbH Haustechnische Anlagen – Mönchengladbach",
      "type": "Löschungsankündigung",
      "state": "Nordrhein-Westfalen",
      "amtsgericht": "Amtsgericht Mönchengladbach",
      "registernummer": "HRB 11775",
      "registerart": "HRB",
      "company_name": "H.T.A. GmbH Haustechnische Anlagen",
      "company_seat": "Mönchengladbach",
      "details": "03.12.2024 (Bekanntmachungsdatum)\n\nNordrhein-Westfalen Amtsgericht Mönchengladbach HRB 11775\nLöschungsankündigung\n\nH.T.A. GmbH Haustechnische Anlagen\nGesellschaft mit beschränkter Haftung\nMönchengladbach\n\nH.T.A. GmbH Haustechnische Anlagen, Mönchengladbach (Amtsgericht Mönchengladbach, HRB 11775)\nDas Registergericht beabsichtigt, die im Handelsregister eingetragene Gesellschaft gemäß § 394 Absatz 1 FamFG wegen Vermögenslosigkeit von Amts wegen zu löschen. Gegen diese Verfügung kann Widerspruch eingelegt werden. Die Frist zur Erhebung eines Widerspruchs gegen die beabsichtigte Löschung von Amts wegen ist auf drei Monate festgesetzt."
    },
    {
      "date": "2024-12-03",
      "id": "95290",
      "original_text": "Löschungsankündigung\nNordrhein-Westfalen Amtsgericht Düren HRB 9645\nHof GutLeut GmbH – Düren",
      "type": "Löschungsankündigung",
      "state": "Nordrhein-Westfalen",
      "amtsgericht": "Amtsgericht Düren",
      "registernummer": "HRB 9645",
      "registerart": "HRB",
      "company_name": "Hof GutLeut GmbH",
      "company_seat": "Düren",
      "details": "03.12.2024 (Bekanntmachungsdatum)\n\nNordrhein-Westfalen Amtsgericht Düren HRB 9645\nLöschungsankündigung\n\nHof GutLeut GmbH\nGesellschaft mit beschränkter Haftung\nDüren\n\nDas Registergericht beabsichtigt die Gesellschaft von Amts wegen nach § 394 FamFG zu löschen. Die Frist zur Erhebung eines Widerspruchs ist auf drei Monate festgesetzt."
    },
    {
      "date": "2024-12-03",
      "id": "95291",
      "original_text": "Einreichung neuer Dokumente\nNordrhein-Westfalen Amtsgericht Bad Oeynhausen HRB 9705\nMedizinisches Versorgungszentrum (MVZ) am Klinikum Herford GmbH – Herford",
      "type": "Einreichung neuer Dokumente",
      "state": "Nordrhein-Westfalen",
      "amtsgericht": "Amtsgericht Bad Oeynhausen",
      "registernummer": "HRB 9705",
      "registerart": "HRB",
      "company_name": "Medizinisches Versorgungszentrum (MVZ) am Klinikum Herford GmbH",
      "company_seat": "Herford",
      "details": "03.12.2024 (Bekanntmachungsdatum)\n\nNordrhein-Westfalen Amtsgericht Bad Oeynhausen HRB 9705\nEinreichung neuer Dokumente 03.12.2024 (Eintragungsdatum)\n\nMedizinisches Versorgungszentrum (MVZ) am Klinikum Herford GmbH\nGesellschaft mit beschränkter Haftung\nHerford\n\nDem Registergericht ist eine neue Liste der Mitglieder des Aufsichtsrates eingereicht worden."
    },
    {
      "date": "2024-12-03",
      "id": "95292",
      "original_text": "Löschungsankündigung\nNordrhein-Westfalen Amtsgericht Köln HRB 111226\nOLLEVO UG (haftungsbeschränkt) – Köln",
      "type": "Löschungsankündigung",
      "state": "Nordrhein-Westfalen",
      "amtsgericht": "Amtsgericht Köln",
      "registernummer": "HRB 111226",
      "registerart": "HRB",
      "company_name": "OLLEVO UG (haftungsbeschränkt)",
      "company_seat": "Köln",
      "details": "03.12.2024 (Bekanntmachungsdatum)\n\nNordrhein-Westfalen Amtsgericht Köln HRB 111226\nLöschungsankündigung\n\nOLLEVO UG (haftungsbeschränkt)\nGesellschaft mit beschränkter Haftung\nKöln\n\nDas Registergericht beabsichtigt die Gesellschaft von Amts wegen nach § 394 FamFG zu löschen. Die Frist zur Erhebung eines Widerspruchs ist auf einen Monat festgesetzt."
    },
    {
      "date": "2024-12-03",
      "id": "95293",
      "original_text": "Löschungsankündigung\nNordrhein-Westfalen Amtsgericht Gelsenkirchen HRB 17358\nAYAZ-Fenster und Bauelemente GmbH – Gelsenkirchen",
      "type": "Löschungsankündigung",
      "state": "Nordrhein-Westfalen",
      "amtsgericht": "Amtsgericht Gelsenkirchen",
      "registernummer": "HRB 17358",
      "registerart": "HRB",
      "company_name": "AYAZ-Fenster und Bauelemente GmbH",
      "company_seat": "Gelsenkirchen",
      "details": "03.12.2024 (Bekanntmachungsdatum)\n\nNordrhein-Westfalen Amtsgericht Gelsenkirchen HRB 17358\nLöschungsankündigung\n\nAYAZ-Fenster und Bauelemente GmbH\nGesellschaft mit beschränkter Haftung\nGelsenkirchen\n\nDas Gericht beabsichtigt, die eingetragene AYAZ-Fenster und Bauelemente GmbH mit Sitz in Gelsenkirchen, HRB 17358, Amtsgericht Gelsenkirchen, wegen Vermögenslosigkeit zu löschen.\nHiermit wird denjenigen, die an der Unterlassung der Löschung ein berechtigtes Interesse haben, gem. § 394 Abs. 2 FamFG Gelegenheit gegeben, gegen dieses Vorhaben binnen eines Monats nach dieser Bekanntmachung Widerspruch einzulegen. Der Widerspruch kann schriftlich oder zu Protokoll der Geschäftsstelle erhoben werden."
    },
    {
      "date": "2024-12-03",
      "id": "95294",
      "original_text": "Registerbekanntmachung nach dem Umwandlungsgesetz\nNordrhein-Westfalen Amtsgericht Köln HRA 37796\nSulyok Immobilien e.K. – Leverkusen",
      "type": "Registerbekanntmachung nach dem Umwandlungsgesetz",
      "state": "Nordrhein-Westfalen",
      "amtsgericht": "Amtsgericht Köln",
      "registernummer": "HRA 37796",
      "registerart": "HRA",
      "company_name": "Sulyok Immobilien e.K.",
      "company_seat": "Leverkusen",
      "details": "03.12.2024 (Bekanntmachungsdatum)\n\nNordrhein-Westfalen Amtsgericht Köln HRA 37796\nRegisterbekanntmachung nach dem Umwandlungsgesetz 03.12.2024 (Eintragungsdatum)\n\nSulyok Immobilien e.K.\nEinzelkaufmann / Einzelkauffrau\nLeverkusen\n\nDie Gesellschaft hat Gläubigern, deren Forderungen vor dieser Bekanntmachung begründet worden sind, Sicherheit zu leisten, soweit sie nicht Befriedigung verlangen können, wenn sie sich binnen sechs Monaten zu diesem Zweck melden."
    },
    {
      "date": "2024-12-03",
      "id": "95295",
      "original_text": "Einreichung neuer Dokumente\nThüringen Amtsgericht Jena HRB 400069\nSCHACHTBAU NORDHAUSEN GmbH – Nordhausen",
      "type": "Einreichung neuer Dokumente",
      "state": "Thüringen",
      "amtsgericht": "Amtsgericht Jena",
      "registernummer": "HRB 400069",
      "registerart": "HRB",
      "company_name": "SCHACHTBAU NORDHAUSEN GmbH",
      "company_seat": "Nordhausen",
      "details": "03.12.2024 (Bekanntmachungsdatum)\n\nThüringen Amtsgericht Jena HRB 400069\nEinreichung neuer Dokumente\n\nSCHACHTBAU NORDHAUSEN GmbH\nGesellschaft mit beschränkter Haftung\nNordhausen\n\nBekanntmachung gem. § 52 Abs. 3 Satz 2 GmbHG: Aufgrund einer Veränderung in den Personen der Aufsichtsratsmitglieder ist durch die Geschäftsführer eine neue Liste zum Handelsregister eingereicht worden."
    },
    {
      "date": "2024-12-03",
      "id": "95296",
      "original_text": "Löschungsankündigung\nThüringen Amtsgericht Jena HRB 505234\nM.D.B. UG (haftungsbeschränkt) – Hörsel",
      "type": "Löschungsankündigung",
      "state": "Thüringen",
      "amtsgericht": "Amtsgericht Jena",
      "registernummer": "HRB 505234",
      "registerart": "HRB",
      "company_name": "M.D.B. UG (haftungsbeschränkt)",
      "company_seat": "Hörsel",
      "details": "03.12.2024 (Bekanntmachungsdatum)\n\nThüringen Amtsgericht Jena HRB 505234\nLöschungsankündigung\n\nM.D.B. UG (haftungsbeschränkt)\nGesellschaft mit beschränkter Haftung\nHörsel\n\nDas Registergericht beabsichtigt, die im Handelsregister eingetragene Gesellschaft wegen Vermögenslosigkeit nach § 394 FamFG von Amts wegen zu löschen. Die Frist zur Erhebung eines Widerspruchs gegen die beabsichtigte Löschung wird auf 6 Wochen festgesetzt."
    },
    {
      "date": "2024-12-03",
      "id": "95297",
      "original_text": "Löschungsankündigung\nHessen Amtsgericht Offenbach am Main HRB 40979\nErdogan GmbH – Offenbach am Main",
      "type": "Löschungsankündigung",
      "state": "Hessen",
      "amtsgericht": "Amtsgericht Offenbach am Main",
      "registernummer": "HRB 40979",
      "registerart": "HRB",
      "company_name": "Erdogan GmbH",
      "company_seat": "Offenbach am Main",
      "details": "03.12.2024 (Bekanntmachungsdatum)\n\nHessen Amtsgericht Offenbach am Main HRB 40979\nLöschungsankündigung\n\nErdogan GmbH\nGesellschaft mit beschränkter Haftung\nOffenbach am Main\n\nDas Registergericht beabsichtigt die im Handelsregister eingetragene Gesellschaft von Amts wegen nach § 394 FamFG zu löschen. Die Frist zur Erhebung eines Widerspruchs gegen die beabsichtigte Löschung wird auf 3 Monate festgesetzt."
    },
    {
      "date": "2024-12-03",
      "id": "95298",
      "original_text": "Löschungsankündigung\nHessen Amtsgericht Frankfurt am Main HRB 94914\nKRS Gebäudeservice GmbH – Frankfurt am Main",
      "type": "Löschungsankündigung",
      "state": "Hessen",
      "amtsgericht": "Amtsgericht Frankfurt am Main",
      "registernummer": "HRB 94914",
      "registerart": "HRB",
      "company_name": "KRS Gebäudeservice GmbH",
      "company_seat": "Frankfurt am Main",
      "details": "03.12.2024 (Bekanntmachungsdatum)\n\nHessen Amtsgericht Frankfurt am Main HRB 94914\nLöschungsankündigung\n\nKRS Gebäudeservice GmbH\nGesellschaft mit beschränkter Haftung\nFrankfurt am Main\n\nDas Registergericht beabsichtigt die im Handelsregister eingetragene Gesellschaft von Amts wegen nach § 394 FamFG zu löschen. Die Frist zur Erhebung eines Widerspruchs gegen die beabsichtigte Löschung wird auf 1 Monat festgesetzt."
    },
    {
      "date": "2024-12-03",
      "id": "95299",
      "original_text": "Löschungsankündigung\nHessen Amtsgericht Hanau HRB 99077\nTN Productions UG (haftungsbeschränkt) – Gelnhausen",
      "type": "Löschungsankündigung",
      "state": "Hessen",
      "amtsgericht": "Amtsgericht Hanau",
      "registernummer": "HRB 99077",
      "registerart": "HRB",
      "company_name": "TN Productions UG (haftungsbeschränkt)",
      "company_seat": "Gelnhausen",
      "details": "03.12.2024 (Bekanntmachungsdatum)\n\nHessen Amtsgericht Hanau HRB 99077\nLöschungsankündigung 03.12.2024 (Eintragungsdatum)\n\nTN Productions UG (haftungsbeschränkt)\nGesellschaft mit beschränkter Haftung\nGelnhausen\n\nDen Gläubigern der an der Verschmelzung beteiligten Rechtsträger ist, wenn sie binnen sechs Monaten nach dem Tag, an dem die Eintragung der Verschmelzung in das Register des Sitzes desjenigen Rechtsträgers, dessen Gläubiger sie sind, nach § 19 Absatz 3 UmwG bekannt gemacht worden ist, ihren Anspruch nach Grund und Höhe schriftlich anmelden, Sicherheit zu leisten, soweit sie nicht Befriedigung verlangen können. Dieses Recht steht den Gläubigern jedoch nur zu, wenn sie glaubhaft machen, dass durch die Verschmelzung die Erfüllung ihrer Forderung gefährdet wird."
    },
    {
      "date": "2024-12-03",
      "id": "95300",
      "original_text": "Registerbekanntmachung nach dem Umwandlungsgesetz\nHessen Amtsgericht Offenbach am Main HRB 53044\nBDG Trockenbau- und Hausmeister Service UG (haftungsbeschränkt) – Rödermark",
      "type": "Registerbekanntmachung nach dem Umwandlungsgesetz",
      "state": "Hessen",
      "amtsgericht": "Amtsgericht Offenbach am Main",
      "registernummer": "HRB 53044",
      "registerart": "HRB",
      "company_name": "BDG Trockenbau- und Hausmeister Service UG (haftungsbeschränkt)",
      "company_seat": "Rödermark",
      "details": "03.12.2024 (Bekanntmachungsdatum)\n\nHessen Amtsgericht Offenbach am Main HRB 53044\nRegisterbekanntmachung nach dem Umwandlungsgesetz 03.12.2024 (Eintragungsdatum)\n\nBDG Trockenbau- und Hausmeister Service UG (haftungsbeschränkt)\nGesellschaft mit beschränkter Haftung\nRödermark\n\nDen Gläubigern der an der Verschmelzung beteiligten Rechtsträger ist, wenn sie binnen sechs Monaten nach dem Tag, an dem die Eintragung der Verschmelzung in das Register des Sitzes desjenigen Rechtsträgers, dessen Gläubiger sie sind, nach § 19 Absatz 3 UmwG bekannt gemacht worden ist, ihren Anspruch nach Grund und Höhe schriftlich anmelden, Sicherheit zu leisten, soweit sie nicht Befriedigung verlangen können. Dieses Recht steht den Gläubigern jedoch nur zu, wenn sie glaubhaft machen, dass durch die Verschmelzung die Erfüllung ihrer Forderung gefährdet wird."
    },
    {
      "date": "2024-12-03",
      "id": "95301",
      "original_text": "Registerbekanntmachung nach dem Umwandlungsgesetz\nHessen Amtsgericht Frankfurt am Main HRA 53562\nDirk Rönz e.K. – Frankfurt am Main",
      "type": "Registerbekanntmachung nach dem Umwandlungsgesetz",
      "state": "Hessen",
      "amtsgericht": "Amtsgericht Frankfurt am Main",
      "registernummer": "HRA 53562",
      "registerart": "HRA",
      "company_name": "Dirk Rönz e.K.",
      "company_seat": "Frankfurt am Main",
      "details": "03.12.2024 (Bekanntmachungsdatum)\n\nHessen Amtsgericht Frankfurt am Main HRA 53562\nRegisterbekanntmachung nach dem Umwandlungsgesetz 03.12.2024 (Eintragungsdatum)\n\nDirk Rönz e.K.\nEinzelkaufmann / Einzelkauffrau\nFrankfurt am Main\n\nDen Gläubigern der an der Ausgliederung beteiligten Rechtsträger ist, wenn sie binnen sechs Monaten nach dem Tag, an dem die Eintragung der Ausgliederung in das Register des Sitzes desjenigen Rechtsträgers, dessen Gläubiger sie sind, nach §§ 125, 19 Absatz 3 UmwG bekannt gemacht worden ist, ihren Anspruch nach Grund und Höhe schriftlich anmelden, Sicherheit zu leisten, soweit sie nicht Befriedigung verlangen können. Dieses Recht steht den Gläubigern jedoch nur zu, wenn sie glaubhaft machen, dass durch die Ausgliederung die Erfüllung ihrer Forderung gefährdet wird."
    },
    {
      "date": "2024-12-03",
      "id": "95302",
      "original_text": "Registerbekanntmachung nach dem Umwandlungsgesetz\nHessen Amtsgericht Frankfurt am Main HRB 114088\nDEMIRE Ankauf 9 GmbH – Frankfurt am Main",
      "type": "Registerbekanntmachung nach dem Umwandlungsgesetz",
      "state": "Hessen",
      "amtsgericht": "Amtsgericht Frankfurt am Main",
      "registernummer": "HRB 114088",
      "registerart": "HRB",
      "company_name": "DEMIRE Ankauf 9 GmbH",
      "company_seat": "Frankfurt am Main",
      "details": "03.12.2024 (Bekanntmachungsdatum)\n\nHessen Amtsgericht Frankfurt am Main HRB 114088\nRegisterbekanntmachung nach dem Umwandlungsgesetz 03.12.2024 (Eintragungsdatum)\n\nDEMIRE Ankauf 9 GmbH\nGesellschaft mit beschränkter Haftung\nFrankfurt am Main\n\nDen Gläubigern der an der Verschmelzung beteiligten Rechtsträger ist, wenn sie binnen sechs Monaten nach dem Tag, an dem die Eintragung der Verschmelzung in das Register des Sitzes desjenigen Rechtsträgers, dessen Gläubiger sie sind, nach § 19 Absatz 3 UmwG bekannt gemacht worden ist, ihren Anspruch nach Grund und Höhe schriftlich anmelden, Sicherheit zu leisten, soweit sie nicht Befriedigung verlangen können. Dieses Recht steht den Gläubigern jedoch nur zu, wenn sie glaubhaft machen, dass durch die Verschmelzung die Erfüllung ihrer Forderung gefährdet wird."
    },
    {
      "date": "2024-12-03",
      "id": "95303",
      "original_text": "Registerbekanntmachung nach dem Umwandlungsgesetz\nHessen Amtsgericht Königstein HRB 5920\nAccenture GmbH – Kronberg im Taunus",
      "type": "Registerbekanntmachung nach dem Umwandlungsgesetz",
      "state": "Hessen",
      "amtsgericht": "Amtsgericht Königstein",
      "registernummer": "HRB 5920",
      "registerart": "HRB",
      "company_name": "Accenture GmbH",
      "company_seat": "Kronberg im Taunus",
      "details": "03.12.2024 (Bekanntmachungsdatum)\n\nHessen Amtsgericht Königstein HRB 5920\nRegisterbekanntmachung nach dem Umwandlungsgesetz 03.12.2024 (Eintragungsdatum)\n\nAccenture GmbH\nGesellschaft mit beschränkter Haftung\nKronberg im Taunus\n\nDen Gläubigern der an der Verschmelzung beteiligten Rechtsträger ist, wenn sie binnen sechs Monaten nach dem Tag, an dem die Eintragung der Verschmelzung in das Register des Sitzes desjenigen Rechtsträgers, dessen Gläubiger sie sind, nach § 19 Absatz 3 UmwG bekannt gemacht worden ist, ihren Anspruch nach Grund und Höhe schriftlich anmelden, Sicherheit zu leisten, soweit sie nicht Befriedigung verlangen können. Dieses Recht steht den Gläubigern jedoch nur zu, wenn sie glaubhaft machen, dass durch die Verschmelzung die Erfüllung ihrer Forderung gefährdet wird."
    },
    {
      "date": "2024-12-03",
      "id": "95304",
      "original_text": "Registerbekanntmachung nach dem Umwandlungsgesetz\nHessen Amtsgericht Darmstadt HRB 107158\nSIGNUM Warenwirtschaftssysteme GmbH – Darmstadt",
      "type": "Registerbekanntmachung nach dem Umwandlungsgesetz",
      "state": "Hessen",
      "amtsgericht": "Amtsgericht Darmstadt",
      "registernummer": "HRB 107158",
      "registerart": "HRB",
      "company_name": "SIGNUM Warenwirtschaftssysteme GmbH",
      "company_seat": "Darmstadt",
      "details": "03.12.2024 (Bekanntmachungsdatum)\n\nHessen Amtsgericht Darmstadt HRB 107158\nRegisterbekanntmachung nach dem Umwandlungsgesetz 03.12.2024 (Eintragungsdatum)\n\nSIGNUM Warenwirtschaftssysteme GmbH\nGesellschaft mit beschränkter Haftung\nDarmstadt\n\nDen Gläubigern der an der formwechselnden Umwandlung beteiligten Rechtsträger ist, wenn sie binnen sechs Monaten nach dem Tag, an dem die Eintragung der formwechselnden Umwandlung in das Register des Sitzes derjenigen Rechtsträger deren Gläubiger sie sind, nach § 201 UmwG bekannt gemacht worden ist, ihren Anspruch nach Grund und Höhe schriftlich anmelden, Sicherheit zu leisten, soweit sie nicht Befriedigung verlangen können. Dieses Recht steht den Gläubigern jedoch nur zu, wenn sie glaubhaft machen, dass durch die formwechselnden Umwandlung die Erfüllung ihrer Forderung gefährdet wird."
    },
    {
      "date": "2024-12-03",
      "id": "95305",
      "original_text": "Registerbekanntmachung nach dem Umwandlungsgesetz\nHessen Amtsgericht Marburg HRB 7562\nViessmann Climate Solutions SE – Allendorf (Eder)",
      "type": "Registerbekanntmachung nach dem Umwandlungsgesetz",
      "state": "Hessen",
      "amtsgericht": "Amtsgericht Marburg",
      "registernummer": "HRB 7562",
      "registerart": "HRB",
      "company_name": "Viessmann Climate Solutions SE",
      "company_seat": "Allendorf (Eder)",
      "details": "03.12.2024 (Bekanntmachungsdatum)\n\nHessen Amtsgericht Marburg HRB 7562\nRegisterbekanntmachung nach dem Umwandlungsgesetz 03.12.2024 (Eintragungsdatum)\n\nViessmann Climate Solutions SE\nEuropäische Aktiengesellschaft (SE)\nAllendorf (Eder)\n\nDen Gläubigern der an der formwechselnden Umwandlung beteiligten Rechtsträger ist, wenn sie binnen sechs Monaten nach dem Tag, an dem die Eintragung der formwechselnden Umwandlung in das Register des Sitzes desjenigen Rechtsträgers, dessen Gläubiger sie sind, nach § 201 UmwG bekannt gemacht worden ist, ihren Anspruch nach Grund und Höhe schriftlich anmelden, Sicherheit zu leisten, soweit sie nicht Befriedigung verlangen können. Dieses Recht steht den Gläubigern jedoch nur zu, wenn sie glaubhaft machen, dass durch die formwechselnden Umwandlung die Erfüllung ihrer Forderung gefährdet wird."
    },
    {
      "date": "2024-12-03",
      "id": "95306",
      "original_text": "Registerbekanntmachung nach dem Umwandlungsgesetz\nHessen Amtsgericht Fritzlar HRA 16546\nDietmar Jung e. K. – Melsungen",
      "type": "Registerbekanntmachung nach dem Umwandlungsgesetz",
      "state": "Hessen",
      "amtsgericht": "Amtsgericht Fritzlar",
      "registernummer": "HRA 16546",
      "registerart": "HRA",
      "company_name": "Dietmar Jung e. K.",
      "company_seat": "Melsungen",
      "details": "03.12.2024 (Bekanntmachungsdatum)\n\nHessen Amtsgericht Fritzlar HRA 16546\nRegisterbekanntmachung nach dem Umwandlungsgesetz 03.12.2024 (Eintragungsdatum)\n\nDietmar Jung e. K.\nEinzelkaufmann / Einzelkauffrau\nMelsungen\n\nDen Gläubigern der an der Ausgliederung beteiligten Rechtsträger ist, wenn sie binnen sechs Monaten nach dem Tag, an dem die Eintragung der Ausgliederung in das Register des Sitzes desjenigen Rechtsträgers, dessen Gläubiger sie sind, nach §§ 125, 19 Absatz 3 UmwG bekannt gemacht worden ist, ihren Anspruch nach Grund und Höhe schriftlich anmelden, Sicherheit zu leisten, soweit sie nicht Befriedigung verlangen können. Dieses Recht steht den Gläubigern jedoch nur zu, wenn sie glaubhaft machen, dass durch die Ausgliederung die Erfüllung ihrer Forderung gefährdet wird."
    },
    {
      "date": "2024-12-03",
      "id": "95307",
      "original_text": "Löschungsankündigung\nHessen Amtsgericht Frankfurt am Main HRB 106840\nMJ Hudson PERACS GmbH – Frankfurt am Main",
      "type": "Löschungsankündigung",
      "state": "Hessen",
      "amtsgericht": "Amtsgericht Frankfurt am Main",
      "registernummer": "HRB 106840",
      "registerart": "HRB",
      "company_name": "MJ Hudson PERACS GmbH",
      "company_seat": "Frankfurt am Main",
      "details": "03.12.2024 (Bekanntmachungsdatum)\n\nHessen Amtsgericht Frankfurt am Main HRB 106840\nLöschungsankündigung 03.12.2024 (Eintragungsdatum)\n\nMJ Hudson PERACS GmbH\nGesellschaft mit beschränkter Haftung\nFrankfurt am Main\n\nDas Registergericht beabsichtigt die im Handelsregister eingetragene Gesellschaft von Amts wegen nach § 394 FamFG zu löschen. Die Frist zur Erhebung eines Widerspruchs gegen die beabsichtigte Löschung wird auf 1 Monat festgesetzt."
    },
    {
      "date": "2024-12-03",
      "id": "95308",
      "original_text": "Registerbekanntmachung nach dem Umwandlungsgesetz\nHessen Amtsgericht Offenbach am Main HRA 43457\nGeorgieva Dienstleistungen e.K. – Rödermark",
      "type": "Registerbekanntmachung nach dem Umwandlungsgesetz",
      "state": "Hessen",
      "amtsgericht": "Amtsgericht Offenbach am Main",
      "registernummer": "HRA 43457",
      "registerart": "HRA",
      "company_name": "Georgieva Dienstleistungen e.K.",
      "company_seat": "Rödermark",
      "details": "03.12.2024 (Bekanntmachungsdatum)\n\nHessen Amtsgericht Offenbach am Main HRA 43457\nRegisterbekanntmachung nach dem Umwandlungsgesetz 03.12.2024 (Eintragungsdatum)\n\nGeorgieva Dienstleistungen e.K.\nEinzelkaufmann / Einzelkauffrau\nRödermark\n\nDen Gläubigern der an der Verschmelzung beteiligten Rechtsträger ist, wenn sie binnen sechs Monaten nach dem Tag, an dem die Eintragung der Verschmelzung in das Register des Sitzes desjenigen Rechtsträgers, dessen Gläubiger sie sind, nach § 19 Absatz 3 UmwG bekannt gemacht worden ist, ihren Anspruch nach Grund und Höhe schriftlich anmelden, Sicherheit zu leisten, soweit sie nicht Befriedigung verlangen können. Dieses Recht steht den Gläubigern jedoch nur zu, wenn sie glaubhaft machen, dass durch die Verschmelzung die Erfüllung ihrer Forderung gefährdet wird."
    },
    {
      "date": "2024-12-03",
      "id": "95309",
      "original_text": "Registerbekanntmachung nach dem Umwandlungsgesetz\nHessen Amtsgericht Darmstadt HRB 100600\nSIGNUM Warenwirtschaftssysteme AG – Darmstadt",
      "type": "Registerbekanntmachung nach dem Umwandlungsgesetz",
      "state": "Hessen",
      "amtsgericht": "Amtsgericht Darmstadt",
      "registernummer": "HRB 100600",
      "registerart": "HRB",
      "company_name": "SIGNUM Warenwirtschaftssysteme AG",
      "company_seat": "Darmstadt",
      "details": "03.12.2024 (Bekanntmachungsdatum)\n\nHessen Amtsgericht Darmstadt HRB 100600\nRegisterbekanntmachung nach dem Umwandlungsgesetz 03.12.2024 (Eintragungsdatum)\n\nSIGNUM Warenwirtschaftssysteme AG\nAktiengesellschaft\nDarmstadt\n\nDen Gläubigern der an der formwechselnden Umwandlung beteiligten Rechtsträger ist, wenn sie binnen sechs Monaten nach dem Tag, an dem die Eintragung der formwechselnden Umwandlung in das Register des Sitzes derjenigen Rechtsträger deren Gläubiger sie sind, nach § 201 UmwG bekannt gemacht worden ist, ihren Anspruch nach Grund und Höhe schriftlich anmelden, Sicherheit zu leisten, soweit sie nicht Befriedigung verlangen können. Dieses Recht steht den Gläubigern jedoch nur zu, wenn sie glaubhaft machen, dass durch die formwechselnden Umwandlung die Erfüllung ihrer Forderung gefährdet wird."
    },
    {
      "date": "2024-12-03",
      "id": "95310",
      "original_text": "Registerbekanntmachung nach dem Umwandlungsgesetz\nHessen Amtsgericht Offenbach am Main HRB 53044\nBDG Trockenbau- und Hausmeister Service UG (haftungsbeschränkt) – Rödermark",
      "type": "Registerbekanntmachung nach dem Umwandlungsgesetz",
      "state": "Hessen",
      "amtsgericht": "Amtsgericht Offenbach am Main",
      "registernummer": "HRB 53044",
      "registerart": "HRB",
      "company_name": "BDG Trockenbau- und Hausmeister Service UG (haftungsbeschränkt)",
      "company_seat": "Rödermark",
      "details": "03.12.2024 (Bekanntmachungsdatum)\n\nHessen Amtsgericht Offenbach am Main HRB 53044\nRegisterbekanntmachung nach dem Umwandlungsgesetz 03.12.2024 (Eintragungsdatum)\n\nBDG Trockenbau- und Hausmeister Service UG (haftungsbeschränkt)\nGesellschaft mit beschränkter Haftung\nRödermark\n\nDen Gläubigern der an der Verschmelzung beteiligten Rechtsträger ist, wenn sie binnen sechs Monaten nach dem Tag, an dem die Eintragung der Verschmelzung in das Register des Sitzes desjenigen Rechtsträgers, dessen Gläubiger sie sind, nach § 19 Absatz 3 UmwG bekannt gemacht worden ist, ihren Anspruch nach Grund und Höhe schriftlich anmelden, Sicherheit zu leisten, soweit sie nicht Befriedigung verlangen können. Dieses Recht steht den Gläubigern jedoch nur zu, wenn sie glaubhaft machen, dass durch die Verschmelzung die Erfüllung ihrer Forderung gefährdet wird."
    },
    {
      "date": "2024-12-03",
      "id": "95311",
      "original_text": "Löschungsankündigung\nHessen Amtsgericht Frankfurt am Main HRB 107849\nGlobe Commodities International GmbH – Frankfurt am Main",
      "type": "Löschungsankündigung",
      "state": "Hessen",
      "amtsgericht": "Amtsgericht Frankfurt am Main",
      "registernummer": "HRB 107849",
      "registerart": "HRB",
      "company_name": "Globe Commodities International GmbH",
      "company_seat": "Frankfurt am Main",
      "details": "03.12.2024 (Bekanntmachungsdatum)\n\nHessen Amtsgericht Frankfurt am Main HRB 107849\nLöschungsankündigung\n\nGlobe Commodities International GmbH\nGesellschaft mit beschränkter Haftung\nFrankfurt am Main\n\nEs ist beabsichtigt, die Gesellschaft wegen Vermögenslosigkeit gemäß § 394 FamFG von Amts wegen im Handelsregister zu löschen. Hiergegen kann innerhalb von drei Monaten nach dieser Veröffentlichung Widerspruch bei dem Amtsgericht Frankfurt am Main eingelegt werden."
    },
    {
      "date": "2024-12-03",
      "id": "95312",
      "original_text": "Registerbekanntmachung nach dem Umwandlungsgesetz\nHessen Amtsgericht Frankfurt am Main HRB 118704\nDEMIRE Leipzig Am alten Flughafen 1 GmbH – Frankfurt am Main",
      "type": "Registerbekanntmachung nach dem Umwandlungsgesetz",
      "state": "Hessen",
      "amtsgericht": "Amtsgericht Frankfurt am Main",
      "registernummer": "HRB 118704",
      "registerart": "HRB",
      "company_name": "DEMIRE Leipzig Am alten Flughafen 1 GmbH",
      "company_seat": "Frankfurt am Main",
      "details": "03.12.2024 (Bekanntmachungsdatum)\n\nHessen Amtsgericht Frankfurt am Main HRB 118704\nRegisterbekanntmachung nach dem Umwandlungsgesetz 03.12.2024 (Eintragungsdatum)\n\nDEMIRE Leipzig Am alten Flughafen 1 GmbH\nGesellschaft mit beschränkter Haftung\nFrankfurt am Main\n\nDen Gläubigern der an der Verschmelzung beteiligten Rechtsträger ist, wenn sie binnen sechs Monaten nach dem Tag, an dem die Eintragung der Verschmelzung in das Register des Sitzes desjenigen Rechtsträgers, dessen Gläubiger sie sind, nach § 19 Absatz 3 UmwG bekannt gemacht worden ist, ihren Anspruch nach Grund und Höhe schriftlich anmelden, Sicherheit zu leisten, soweit sie nicht Befriedigung verlangen können. Dieses Recht steht den Gläubigern jedoch nur zu, wenn sie glaubhaft machen, dass durch die Verschmelzung die Erfüllung ihrer Forderung gefährdet wird."
    },
    {
      "date": "2024-12-03",
      "id": "95313",
      "original_text": "Löschungsankündigung\nHessen Amtsgericht Wiesbaden HRB 27805\nG & K Konditoreibetriebs UG (haftungsbeschränkt) – Wiesbaden",
      "type": "Löschungsankündigung",
      "state": "Hessen",
      "amtsgericht": "Amtsgericht Wiesbaden",
      "registernummer": "HRB 27805",
      "registerart": "HRB",
      "company_name": "G & K Konditoreibetriebs UG (haftungsbeschränkt)",
      "company_seat": "Wiesbaden",
      "details": "03.12.2024 (Bekanntmachungsdatum)\n\nHessen Amtsgericht Wiesbaden HRB 27805\nLöschungsankündigung\n\nG & K Konditoreibetriebs UG (haftungsbeschränkt)\nGesellschaft mit beschränkter Haftung\nWiesbaden\n\nDas Registergericht beabsichtigt die im Handelsregister eingetragene Gesellschaft von Amts wegen nach § 394 FamFG zu löschen. Die Frist zur Erhebung eines Widerspruchs gegen die beabsichtigte Löschung wird auf 3 Monate festgesetzt."
    },
    {
      "date": "2024-12-03",
      "id": "95314",
      "original_text": "Löschungsankündigung\nHessen Amtsgericht Friedberg HRB 1637\nEMU Public Relations-Veranstaltungs- und Service GmbH – Wöllstadt",
      "type": "Löschungsankündigung",
      "state": "Hessen",
      "amtsgericht": "Amtsgericht Friedberg",
      "registernummer": "HRB 1637",
      "registerart": "HRB",
      "company_name": "EMU Public Relations-Veranstaltungs- und Service GmbH",
      "company_seat": "Wöllstadt",
      "details": "03.12.2024 (Bekanntmachungsdatum)\n\nHessen Amtsgericht Friedberg HRB 1637\nLöschungsankündigung\n\nEMU Public Relations-Veranstaltungs- und Service GmbH\nGesellschaft mit beschränkter Haftung\nWöllstadt\n\nDas Registergericht beabsichtigt die im Handelsregister eingetragene Gesellschaft von Amts wegen nach § 394 FamFG zu löschen. Die Gesellschaft ist aufgelöst. Die Liquidatorin ist nicht mehr zu erreichen. Die Frist zur Erhebung eines Widerspruchs gegen die beabsichtigte Löschung wird auf 3 Monate festgesetzt."
    },
    {
      "date": "2024-12-03",
      "id": "95315",
      "original_text": "Löschungsankündigung\nHessen Amtsgericht Hanau HRB 98199\nBVH GmbH – Hanau",
      "type": "Löschungsankündigung",
      "state": "Hessen",
      "amtsgericht": "Amtsgericht Hanau",
      "registernummer": "HRB 98199",
      "registerart": "HRB",
      "company_name": "BVH GmbH",
      "company_seat": "Hanau",
      "details": "03.12.2024 (Bekanntmachungsdatum)\n\nHessen Amtsgericht Hanau HRB 98199\nLöschungsankündigung\n\nBVH GmbH\nGesellschaft mit beschränkter Haftung\nHanau\n\nDas Registergericht beabsichtigt die im Handelsregister eingetragene Gesellschaft von Amts wegen nach § 394 FamFG zu löschen. Die Frist zur Erhebung eines Widerspruchs gegen die beabsichtigte Löschung wird auf 3 Monate festgesetzt."
    },
    {
      "date": "2024-12-03",
      "id": "95316",
      "original_text": "Registerbekanntmachung nach dem Umwandlungsgesetz\nHessen Amtsgericht Königstein HRB 5920\nAccenture GmbH – Kronberg im Taunus",
      "type": "Registerbekanntmachung nach dem Umwandlungsgesetz",
      "state": "Hessen",
      "amtsgericht": "Amtsgericht Königstein",
      "registernummer": "HRB 5920",
      "registerart": "HRB",
      "company_name": "Accenture GmbH",
      "company_seat": "Kronberg im Taunus",
      "details": "03.12.2024 (Bekanntmachungsdatum)\n\nHessen Amtsgericht Königstein HRB 5920\nRegisterbekanntmachung nach dem Umwandlungsgesetz 03.12.2024 (Eintragungsdatum)\n\nAccenture GmbH\nGesellschaft mit beschränkter Haftung\nKronberg im Taunus\n\nDen Gläubigern der an der Verschmelzung beteiligten Rechtsträger ist, wenn sie binnen sechs Monaten nach dem Tag, an dem die Eintragung der Verschmelzung in das Register des Sitzes desjenigen Rechtsträgers, dessen Gläubiger sie sind, nach § 19 Absatz 3 UmwG bekannt gemacht worden ist, ihren Anspruch nach Grund und Höhe schriftlich anmelden, Sicherheit zu leisten, soweit sie nicht Befriedigung verlangen können. Dieses Recht steht den Gläubigern jedoch nur zu, wenn sie glaubhaft machen, dass durch die Verschmelzung die Erfüllung ihrer Forderung gefährdet wird."
    },
    {
      "date": "2024-12-03",
      "id": "95317",
      "original_text": "Löschungsankündigung\nHessen Amtsgericht Darmstadt HRB 94313\nCCS - Cargo City Süd GmbH – Mörfelden-Walldorf",
      "type": "Löschungsankündigung",
      "state": "Hessen",
      "amtsgericht": "Amtsgericht Darmstadt",
      "registernummer": "HRB 94313",
      "registerart": "HRB",
      "company_name": "CCS - Cargo City Süd GmbH",
      "company_seat": "Mörfelden-Walldorf",
      "details": "03.12.2024 (Bekanntmachungsdatum)\n\nHessen Amtsgericht Darmstadt HRB 94313\nLöschungsankündigung 03.12.2024 (Eintragungsdatum)\n\nCCS - Cargo City Süd GmbH\nGesellschaft mit beschränkter Haftung\nMörfelden-Walldorf\n\nDas Registergericht beabsichtigt die im Handelsregister eingetragene Gesellschaft von Amts wegen nach § 394 FamFG zu löschen. Die Frist zur Erhebung eines Widerspruchs gegen die beabsichtigte Löschung wird auf 3 Monate festgesetzt."
    }
  ]
}