{
  "date": "2024-12-24",
  "date_of_scrape": "2024-12-25T04:03:02.071Z",
  "tool_version": "0.2.0",
  "number_of_announcements": 17,
  "announcements": [
    {
      "date": "2024-12-24",
      "id": "97325",
      "original_text": "Registerbekanntmachung nach dem Umwandlungsgesetz\nBayern Amtsgericht Hof HRB 396\nSchürr Schuhvertrieb Gesellschaft mit beschränkter Haftung – Schwarzenbach/Saale",
      "type": "Registerbekanntmachung nach dem Umwandlungsgesetz",
      "state": "Bayern",
      "amtsgericht": "Amtsgericht Hof",
      "registernummer": "HRB 396",
      "registerart": "HRB",
      "company_name": "Schürr Schuhvertrieb Gesellschaft mit beschränkter Haftung",
      "company_seat": "Schwarzenbach/Saale",
      "details": "24.12.2024 (Bekanntmachungsdatum)\n\nBayern Amtsgericht Hof HRB 396\nRegisterbekanntmachung nach dem Umwandlungsgesetz 23.12.2024 (Eintragungsdatum)\n\nSchürr Schuhvertrieb Gesellschaft mit beschränkter Haftung\nGesellschaft mit beschränkter Haftung\nSchwarzenbach/Saale\n\nDen Gläubigern der an der Verschmelzung beteiligten Rechtsträger ist, wenn sie binnen sechs Monaten nach dem Tag, an dem die Eintragung der Verschmelzung in das Register des Sitzes desjenigen Rechtsträgers, dessen Gläubiger sie sind, nach § 19 Abs. 3 UmwG als bekannt gemacht gilt, ihren Anspruch nach Grund und Höhe schriftlich anmelden, Sicherheit zu leisten, soweit sie nicht Befriedigung verlangen können. Dieses Recht steht den Gläubigern jedoch nur zu, wenn sie glaubhaft machen, dass durch die Verschmelzung die Erfüllung ihrer Forderung gefährdet wird."
    },
    {
      "date": "2024-12-24",
      "id": "97326",
      "original_text": "Registerbekanntmachung nach dem Umwandlungsgesetz\nBayern Amtsgericht Hof HRB 1103\nA.W. SCHÜRR GmbH – Schwarzenbach a.d. Saale",
      "type": "Registerbekanntmachung nach dem Umwandlungsgesetz",
      "state": "Bayern",
      "amtsgericht": "Amtsgericht Hof",
      "registernummer": "HRB 1103",
      "registerart": "HRB",
      "company_name": "A.W. SCHÜRR GmbH",
      "company_seat": "Schwarzenbach a.d. Saale",
      "details": "24.12.2024 (Bekanntmachungsdatum)\n\nBayern Amtsgericht Hof HRB 1103\nRegisterbekanntmachung nach dem Umwandlungsgesetz 23.12.2024 (Eintragungsdatum)\n\nA.W. SCHÜRR GmbH\nGesellschaft mit beschränkter Haftung\nSchwarzenbach a.d.  Saale\n\nDen Gläubigern der an der Verschmelzung beteiligten Rechtsträger ist, wenn sie binnen sechs Monaten nach dem Tag, an dem die Eintragung der Verschmelzung in das Register des Sitzes desjenigen Rechtsträgers, dessen Gläubiger sie sind, nach § 19 Abs. 3 UmwG als bekannt gemacht gilt, ihren Anspruch nach Grund und Höhe schriftlich anmelden, Sicherheit zu leisten, soweit sie nicht Befriedigung verlangen können. Dieses Recht steht den Gläubigern jedoch nur zu, wenn sie glaubhaft machen, dass durch die Verschmelzung die Erfüllung ihrer Forderung gefährdet wird."
    },
    {
      "date": "2024-12-24",
      "id": "97327",
      "original_text": "Einreichung neuer Dokumente\nBayern Amtsgericht Fürth HRB 17661\nEvoCare Holding AG – Fürth",
      "type": "Einreichung neuer Dokumente",
      "state": "Bayern",
      "amtsgericht": "Amtsgericht Fürth",
      "registernummer": "HRB 17661",
      "registerart": "HRB",
      "company_name": "EvoCare Holding AG",
      "company_seat": "Fürth",
      "details": "24.12.2024 (Bekanntmachungsdatum)\n\nBayern Amtsgericht Fürth HRB 17661\nEinreichung neuer Dokumente 23.12.2024 (Eintragungsdatum)\n\nEvoCare Holding AG\nAktiengesellschaft\nFürth\n\nDem Amtsgericht Fürth -Registergericht- ist eine Liste der Mitglieder des Aufsichtsrats eingereicht worden, § 106 AktG."
    },
    {
      "date": "2024-12-24",
      "id": "97328",
      "original_text": "Registerbekanntmachung nach dem Umwandlungsgesetz\nBayern Amtsgericht Schweinfurt HRB 8121\nMARA Management UG (haftungsbeschränkt) – Dingolshausen",
      "type": "Registerbekanntmachung nach dem Umwandlungsgesetz",
      "state": "Bayern",
      "amtsgericht": "Amtsgericht Schweinfurt",
      "registernummer": "HRB 8121",
      "registerart": "HRB",
      "company_name": "MARA Management UG (haftungsbeschränkt)",
      "company_seat": "Dingolshausen",
      "details": "24.12.2024 (Bekanntmachungsdatum)\n\nBayern Amtsgericht Schweinfurt HRB 8121\nRegisterbekanntmachung nach dem Umwandlungsgesetz 23.12.2024 (Eintragungsdatum)\n\nMARA Management UG (haftungsbeschränkt)\nGesellschaft mit beschränkter Haftung\nDingolshausen\n\nDen Gläubigern der an der Verschmelzung beteiligten Rechtsträger ist, wenn sie binnen sechs Monaten nach dem Tag, an dem die Eintragung der Verschmelzung in das Register des Sitzes desjenigen Rechtsträgers, dessen Gläubiger sie sind, nach § 19 Abs. 3 UmwG als bekannt gemacht gilt, ihren Anspruch nach Grund und Höhe schriftlich anmelden, Sicherheit zu leisten, soweit sie nicht Befriedigung verlangen können. Dieses Recht steht den Gläubigern jedoch nur zu, wenn sie glaubhaft machen, dass durch die Verschmelzung die Erfüllung ihrer Forderung gefährdet wird."
    },
    {
      "date": "2024-12-24",
      "id": "97329",
      "original_text": "Registerbekanntmachung nach dem Umwandlungsgesetz\nBayern Amtsgericht Nürnberg GsR 266\nM&M Logistik eGbR – Nürnberg",
      "type": "Registerbekanntmachung nach dem Umwandlungsgesetz",
      "state": "Bayern",
      "amtsgericht": "Amtsgericht Nürnberg",
      "registernummer": "GsR 266",
      "registerart": "GsR",
      "company_name": "M&M Logistik eGbR",
      "company_seat": "Nürnberg",
      "details": "24.12.2024 (Bekanntmachungsdatum)\n\nBayern Amtsgericht Nürnberg GsR 266\nRegisterbekanntmachung nach dem Umwandlungsgesetz 22.12.2024 (Eintragungsdatum)\n\nM&M Logistik eGbR\nGesellschaft bürgerlichen Rechts\nNürnberg\n\nDen Gläubigern des formwechselnden Rechtsträgers ist, wenn sie binnen sechs Monaten nach dem Tag, an dem die Eintragung des Formwechsels nach § 201 UmwG als bekannt gemacht gilt, ihren Anspruch nach Grund und Höhe schriftlich anmelden, Sicherheit zu leisten, soweit sie nicht Befriedigung verlangen können. Dieses Recht steht den Gläubigern jedoch nur zu, wenn sie glaubhaft machen, dass durch den Formwechsel die Erfüllung ihrer Forderung gefährdet wird."
    },
    {
      "date": "2024-12-24",
      "id": "97330",
      "original_text": "Sonstige Registerbekanntmachung\nBayern Amtsgericht München HRB 129523\nServicezentrum für das Pflegeheim Wollomoos/Altomünster GmbH – Altomünster",
      "type": "Sonstige Registerbekanntmachung",
      "state": "Bayern",
      "amtsgericht": "Amtsgericht München",
      "registernummer": "HRB 129523",
      "registerart": "HRB",
      "company_name": "Servicezentrum für das Pflegeheim Wollomoos/Altomünster GmbH",
      "company_seat": "Altomünster",
      "details": "24.12.2024 (Bekanntmachungsdatum)\n\nBayern Amtsgericht München HRB 129523\nSonstige Registerbekanntmachung 23.12.2024 (Eintragungsdatum)\n\nServicezentrum für das Pflegeheim Wollomoos/Altomünster GmbH\nGesellschaft mit beschränkter Haftung\nAltomünster\n\nDen Gläubigern der Gesellschaft, deren Forderungen begründet worden sind, bevor die Eintragung der Beendigung des Beherrschungs- und Gewinnabführungsvertrages in das Handelsregister nach § 10 des Handelsgesetzbuches als bekanntgemacht gilt, hat der andere Vertragsteil Sicherheit zu leisten, wenn sie sich binnen sechs Monaten nach der Bekanntmachung der Eintragung zu diesem Zweck bei ihm melden."
    },
    {
      "date": "2024-12-24",
      "id": "97331",
      "original_text": "Löschungsankündigung\nBayern Amtsgericht München HRB 204850\nHuber Consult UG (haftungsbeschränkt) – München",
      "type": "Löschungsankündigung",
      "state": "Bayern",
      "amtsgericht": "Amtsgericht München",
      "registernummer": "HRB 204850",
      "registerart": "HRB",
      "company_name": "Huber Consult UG (haftungsbeschränkt)",
      "company_seat": "München",
      "details": "24.12.2024 (Bekanntmachungsdatum)\n\nBayern Amtsgericht München HRB 204850\nLöschungsankündigung 23.12.2024 (Eintragungsdatum)\n\nHuber Consult UG (haftungsbeschränkt)\nGesellschaft mit beschränkter Haftung\nMünchen\n\nDas Registergericht beabsichtigt, die im Handelsregister eingetragene Gesellschaft wegen Vermögenslosigkeit von Amts wegen nach § 394 FamFG zu löschen. Die Frist zur Erhebung eines Widerspruchs ist auf drei Monate festgesetzt."
    },
    {
      "date": "2024-12-24",
      "id": "97332",
      "original_text": "Registerbekanntmachung nach dem Umwandlungsgesetz\nBayern Amtsgericht Nürnberg HRB 25017\nDiehl Röthenbach Verwaltungs GmbH – Nürnberg",
      "type": "Registerbekanntmachung nach dem Umwandlungsgesetz",
      "state": "Bayern",
      "amtsgericht": "Amtsgericht Nürnberg",
      "registernummer": "HRB 25017",
      "registerart": "HRB",
      "company_name": "Diehl Röthenbach Verwaltungs GmbH",
      "company_seat": "Nürnberg",
      "details": "24.12.2024 (Bekanntmachungsdatum)\n\nBayern Amtsgericht Nürnberg HRB 25017\nRegisterbekanntmachung nach dem Umwandlungsgesetz 23.12.2024 (Eintragungsdatum)\n\nDiehl Röthenbach Verwaltungs GmbH\nGesellschaft mit beschränkter Haftung\nNürnberg\n\nDen Gläubigern der an der Verschmelzung beteiligten Rechtsträger ist, wenn sie binnen sechs Monaten nach dem Tag, an dem die Eintragung der Verschmelzung in das Register des Sitzes desjenigen Rechtsträgers, dessen Gläubiger sie sind, nach § 19 Abs. 3 UmwG als bekannt gemacht gilt, ihren Anspruch nach Grund und Höhe schriftlich anmelden, Sicherheit zu leisten, soweit sie nicht Befriedigung verlangen können. Dieses Recht steht den Gläubigern jedoch nur zu, wenn sie glaubhaft machen, dass durch die Verschmelzung die Erfüllung ihrer Forderung gefährdet wird."
    },
    {
      "date": "2024-12-24",
      "id": "97333",
      "original_text": "Löschungsankündigung\nBayern Amtsgericht München HRB 215154\nHP Media GmbH – München",
      "type": "Löschungsankündigung",
      "state": "Bayern",
      "amtsgericht": "Amtsgericht München",
      "registernummer": "HRB 215154",
      "registerart": "HRB",
      "company_name": "HP Media GmbH",
      "company_seat": "München",
      "details": "24.12.2024 (Bekanntmachungsdatum)\n\nBayern Amtsgericht München HRB 215154\nLöschungsankündigung 23.12.2024 (Eintragungsdatum)\n\nHP Media GmbH\nGesellschaft mit beschränkter Haftung\nMünchen\n\nDas Registergericht beabsichtigt, die im Handelsregister eingetragene Geschäftsführerin Kulisheva, Miglena, geb. 13.04.1981, wegen fehlender Eignung nach § 395 FamFG zu löschen. Die Frist zur Erhebung eines Widerspruchs ist auf drei Monate festgesetzt."
    },
    {
      "date": "2024-12-24",
      "id": "97334",
      "original_text": "Löschungsankündigung\nBayern Amtsgericht München HRB 208962\nStegre GmbH – München",
      "type": "Löschungsankündigung",
      "state": "Bayern",
      "amtsgericht": "Amtsgericht München",
      "registernummer": "HRB 208962",
      "registerart": "HRB",
      "company_name": "Stegre GmbH",
      "company_seat": "München",
      "details": "24.12.2024 (Bekanntmachungsdatum)\n\nBayern Amtsgericht München HRB 208962\nLöschungsankündigung 23.12.2024 (Eintragungsdatum)\n\nStegre GmbH\nGesellschaft mit beschränkter Haftung\nMünchen\n\nDas Registergericht beabsichtigt, die im Handelsregister eingetragene Gesellschaft wegen Vermögenslosigkeit von Amts wegen nach § 394 FamFG zu löschen. Die Frist zur Erhebung eines Widerspruchs ist auf drei Monate festgesetzt."
    },
    {
      "date": "2024-12-24",
      "id": "97335",
      "original_text": "Registerbekanntmachung nach dem Umwandlungsgesetz\nBayern Amtsgericht Würzburg HRA 8868\nMetall- und Zaunbau Häusler Benedikt e.K. – Thüngersheim",
      "type": "Registerbekanntmachung nach dem Umwandlungsgesetz",
      "state": "Bayern",
      "amtsgericht": "Amtsgericht Würzburg",
      "registernummer": "HRA 8868",
      "registerart": "HRA",
      "company_name": "Metall- und Zaunbau Häusler Benedikt e.K.",
      "company_seat": "Thüngersheim",
      "details": "24.12.2024 (Bekanntmachungsdatum)\n\nBayern Amtsgericht Würzburg HRA 8868\nRegisterbekanntmachung nach dem Umwandlungsgesetz 23.12.2024 (Eintragungsdatum)\n\nMetall- und Zaunbau Häusler Benedikt e.K.\nEinzelkaufmann / Einzelkauffrau\nThüngersheim\n\nDen Gläubigern der an der Ausgliederung beteiligten Rechtsträger ist, wenn sie binnen sechs Monaten nach dem Tag, an dem die Eintragung der Ausgliederung in das Register des Sitzes desjenigen Rechtsträgers, dessen Gläubiger sie sind, nach §§ 125, 19 Abs. 3 UmwG als bekannt gemacht gilt, ihren Anspruch nach Grund und Höhe schriftlich anmelden, Sicherheit zu leisten, soweit sie nicht Befriedigung verlangen können. Dieses Recht steht den Gläubigern jedoch nur zu, wenn sie glaubhaft machen, dass durch die Ausgliederung die Erfüllung ihrer Forderung gefährdet wird."
    },
    {
      "date": "2024-12-24",
      "id": "97336",
      "original_text": "Löschungsankündigung\nBayern Amtsgericht München HRB 263250\nAtcom Advanced Technologies UG (haftungsbeschränkt) – München",
      "type": "Löschungsankündigung",
      "state": "Bayern",
      "amtsgericht": "Amtsgericht München",
      "registernummer": "HRB 263250",
      "registerart": "HRB",
      "company_name": "Atcom Advanced Technologies UG (haftungsbeschränkt)",
      "company_seat": "München",
      "details": "24.12.2024 (Bekanntmachungsdatum)\n\nBayern Amtsgericht München HRB 263250\nLöschungsankündigung 23.12.2024 (Eintragungsdatum)\n\nAtcom Advanced Technologies UG (haftungsbeschränkt)\nGesellschaft mit beschränkter Haftung\nMünchen\n\nDas Registergericht beabsichtigt, die im Handelsregister eingetragene Gesellschaft wegen Vermögenslosigkeit von Amts wegen nach § 394 FamFG zu löschen. Die Frist zur Erhebung eines Widerspruchs ist auf drei Monate festgesetzt."
    },
    {
      "date": "2024-12-24",
      "id": "97337",
      "original_text": "Einreichung neuer Dokumente\nBayern Amtsgericht Schweinfurt HRB 4040\nSKF Holding Deutschland GmbH – Schweinfurt",
      "type": "Einreichung neuer Dokumente",
      "state": "Bayern",
      "amtsgericht": "Amtsgericht Schweinfurt",
      "registernummer": "HRB 4040",
      "registerart": "HRB",
      "company_name": "SKF Holding Deutschland GmbH",
      "company_seat": "Schweinfurt",
      "details": "24.12.2024 (Bekanntmachungsdatum)\n\nBayern Amtsgericht Schweinfurt HRB 4040\nEinreichung neuer Dokumente 23.12.2024 (Eintragungsdatum)\n\nSKF Holding Deutschland GmbH\nGesellschaft mit beschränkter Haftung\nSchweinfurt\n\nDem Amtsgericht Schweinfurt -Registergericht- ist eine Liste der Mitglieder des Aufsichtsrats eingereicht worden, § 52 Abs. 3 S. 2 GmbHG."
    },
    {
      "date": "2024-12-24",
      "id": "97338",
      "original_text": "Registerbekanntmachung nach dem Umwandlungsgesetz\nBayern Amtsgericht München HRB 168706\nHugendubel Verwaltungs GmbH – München",
      "type": "Registerbekanntmachung nach dem Umwandlungsgesetz",
      "state": "Bayern",
      "amtsgericht": "Amtsgericht München",
      "registernummer": "HRB 168706",
      "registerart": "HRB",
      "company_name": "Hugendubel Verwaltungs GmbH",
      "company_seat": "München",
      "details": "24.12.2024 (Bekanntmachungsdatum)\n\nBayern Amtsgericht München HRB 168706\nRegisterbekanntmachung nach dem Umwandlungsgesetz 23.12.2024 (Eintragungsdatum)\n\nHugendubel Verwaltungs GmbH\nGesellschaft mit beschränkter Haftung\nMünchen\n\nDen Gläubigern der an der Verschmelzung beteiligten Rechtsträger ist, wenn sie binnen sechs Monaten nach dem Tag, an dem die Eintragung der Verschmelzung in das Register des Sitzes desjenigen Rechtsträgers, dessen Gläubiger sie sind, nach § 19 Abs. 3 UmwG als bekannt gemacht gilt, ihren Anspruch nach Grund und Höhe schriftlich anmelden, Sicherheit zu leisten, soweit sie nicht Befriedigung verlangen können. Dieses Recht steht den Gläubigern jedoch nur zu, wenn sie glaubhaft machen, dass durch die Verschmelzung die Erfüllung ihrer Forderung gefährdet wird."
    },
    {
      "date": "2024-12-24",
      "id": "97339",
      "original_text": "Registerbekanntmachung nach dem Umwandlungsgesetz\nBayern Amtsgericht Nürnberg HRB 43526\nMahlknecht GmbH – Rednitzhembach",
      "type": "Registerbekanntmachung nach dem Umwandlungsgesetz",
      "state": "Bayern",
      "amtsgericht": "Amtsgericht Nürnberg",
      "registernummer": "HRB 43526",
      "registerart": "HRB",
      "company_name": "Mahlknecht GmbH",
      "company_seat": "Rednitzhembach",
      "details": "24.12.2024 (Bekanntmachungsdatum)\n\nBayern Amtsgericht Nürnberg HRB 43526\nRegisterbekanntmachung nach dem Umwandlungsgesetz 23.12.2024 (Eintragungsdatum)\n\nMahlknecht GmbH\nGesellschaft mit beschränkter Haftung\nRednitzhembach\n\nDen Gläubigern der an der Spaltung beteiligten Rechtsträger ist, wenn sie binnen sechs Monaten nach dem Tag, an dem die Eintragung der Spaltung in das Register des Sitzes desjenigen Rechtsträgers, dessen Gläubiger sie sind, nach §§ 125, 19 Abs. 3 UmwG als bekannt gemacht gilt, ihren Anspruch nach Grund und Höhe schriftlich anmelden, Sicherheit zu leisten, soweit sie nicht Befriedigung verlangen können. Dieses Recht steht den Gläubigern jedoch nur zu, wenn sie glaubhaft machen, dass durch die Spaltung die Erfüllung ihrer Forderung gefährdet wird."
    },
    {
      "date": "2024-12-24",
      "id": "97340",
      "original_text": "Registerbekanntmachung nach dem Umwandlungsgesetz\nBayern Amtsgericht München HRA 119225\nMack Immobilien e.K. – Münsing",
      "type": "Registerbekanntmachung nach dem Umwandlungsgesetz",
      "state": "Bayern",
      "amtsgericht": "Amtsgericht München",
      "registernummer": "HRA 119225",
      "registerart": "HRA",
      "company_name": "Mack Immobilien e.K.",
      "company_seat": "Münsing",
      "details": "24.12.2024 (Bekanntmachungsdatum)\n\nBayern Amtsgericht München HRA 119225\nRegisterbekanntmachung nach dem Umwandlungsgesetz 23.12.2024 (Eintragungsdatum)\n\nMack Immobilien e.K.\nEinzelkaufmann / Einzelkauffrau\nMünsing\n\nDen Gläubigern der an der Ausgliederung beteiligten Rechtsträger ist, wenn sie binnen sechs Monaten nach dem Tag, an dem die Eintragung der Ausgliederung in das Register des Sitzes desjenigen Rechtsträgers, dessen Gläubiger sie sind, nach §§ 125, 19 Abs. 3 UmwG als bekannt gemacht gilt, ihren Anspruch nach Grund und Höhe schriftlich anmelden, Sicherheit zu leisten, soweit sie nicht Befriedigung verlangen können. Dieses Recht steht den Gläubigern jedoch nur zu, wenn sie glaubhaft machen, dass durch die Ausgliederung die Erfüllung ihrer Forderung gefährdet wird."
    },
    {
      "date": "2024-12-24",
      "id": "97341",
      "original_text": "Einreichung neuer Dokumente\nBayern Amtsgericht Schweinfurt HRB 5\nSKF GmbH – Schweinfurt",
      "type": "Einreichung neuer Dokumente",
      "state": "Bayern",
      "amtsgericht": "Amtsgericht Schweinfurt",
      "registernummer": "HRB 5",
      "registerart": "HRB",
      "company_name": "SKF GmbH",
      "company_seat": "Schweinfurt",
      "details": "24.12.2024 (Bekanntmachungsdatum)\n\nBayern Amtsgericht Schweinfurt HRB 5\nEinreichung neuer Dokumente 23.12.2024 (Eintragungsdatum)\n\nSKF GmbH\nGesellschaft mit beschränkter Haftung\nSchweinfurt\n\nDem Amtsgericht Schweinfurt -Registergericht- ist eine Liste der Mitglieder des Aufsichtsrats eingereicht worden, § 52 Abs. 3 S. 2 GmbHG."
    }
  ]
}