{
  "date": "2024-12-19",
  "date_of_scrape": "2024-12-20T04:12:46.285Z",
  "tool_version": "0.2.0",
  "number_of_announcements": 198,
  "announcements": [
    {
      "date": "2024-12-19",
      "id": "96912",
      "original_text": "Löschungsankündigung\nBayern Amtsgericht München HRB 179487\nTeloxx GmbH – München",
      "type": "Löschungsankündigung",
      "state": "Bayern",
      "amtsgericht": "Amtsgericht München",
      "registernummer": "HRB 179487",
      "registerart": "HRB",
      "company_name": "Teloxx GmbH",
      "company_seat": "München",
      "details": "19.12.2024 (Bekanntmachungsdatum)\n\nBayern Amtsgericht München HRB 179487\nLöschungsankündigung\n\nTeloxx GmbH\nGesellschaft mit beschränkter Haftung\nMünchen\n\nDas Registergericht beabsichtigt, die im Handelsregister eingetragene Gesellschaft wegen Vermögenslosigkeit von Amts wegen nach § 394 FamFG zu löschen. Die Frist zur Erhebung eines Widerspruchs ist auf drei Monate festgesetzt."
    },
    {
      "date": "2024-12-19",
      "id": "96913",
      "original_text": "Registerbekanntmachung nach dem Umwandlungsgesetz\nBayern Amtsgericht Fürth HRB 13073\nNiersberger Gebäudeausrüstung GmbH – Erlangen",
      "type": "Registerbekanntmachung nach dem Umwandlungsgesetz",
      "state": "Bayern",
      "amtsgericht": "Amtsgericht Fürth",
      "registernummer": "HRB 13073",
      "registerart": "HRB",
      "company_name": "Niersberger Gebäudeausrüstung GmbH",
      "company_seat": "Erlangen",
      "details": "19.12.2024 (Bekanntmachungsdatum)\n\nBayern Amtsgericht Fürth HRB 13073\nRegisterbekanntmachung nach dem Umwandlungsgesetz 18.12.2024 (Eintragungsdatum)\n\nNiersberger Gebäudeausrüstung GmbH\nGesellschaft mit beschränkter Haftung\nErlangen\n\nDen Gläubigern der an der Verschmelzung beteiligten Rechtsträger ist, wenn sie binnen sechs Monaten nach dem Tag, an dem die Eintragung der Verschmelzung in das Register des Sitzes desjenigen Rechtsträgers, dessen Gläubiger sie sind, nach § 19 Abs. 3 UmwG als bekannt gemacht gilt, ihren Anspruch nach Grund und Höhe schriftlich anmelden, Sicherheit zu leisten, soweit sie nicht Befriedigung verlangen können. Dieses Recht steht den Gläubigern jedoch nur zu, wenn sie glaubhaft machen, dass durch die Verschmelzung die Erfüllung ihrer Forderung gefährdet wird."
    },
    {
      "date": "2024-12-19",
      "id": "96914",
      "original_text": "Registerbekanntmachung nach dem Umwandlungsgesetz\nBayern Amtsgericht München HRB 298424\nHowden Deutschland Holding GmbH – München",
      "type": "Registerbekanntmachung nach dem Umwandlungsgesetz",
      "state": "Bayern",
      "amtsgericht": "Amtsgericht München",
      "registernummer": "HRB 298424",
      "registerart": "HRB",
      "company_name": "Howden Deutschland Holding GmbH",
      "company_seat": "München",
      "details": "19.12.2024 (Bekanntmachungsdatum)\n\nBayern Amtsgericht München HRB 298424\nRegisterbekanntmachung nach dem Umwandlungsgesetz 18.12.2024 (Eintragungsdatum)\n\nHowden Deutschland Holding GmbH\nGesellschaft mit beschränkter Haftung\nMünchen\n\nDen Gläubigern des formwechselnden Rechtsträgers ist, wenn sie binnen sechs Monaten nach dem Tag, an dem die Eintragung des Formwechsels nach § 201 UmwG als bekannt gemacht gilt, ihren Anspruch nach Grund und Höhe schriftlich anmelden, Sicherheit zu leisten, soweit sie nicht Befriedigung verlangen können. Dieses Recht steht den Gläubigern jedoch nur zu, wenn sie glaubhaft machen, dass durch den Formwechsel die Erfüllung ihrer Forderung gefährdet wird."
    },
    {
      "date": "2024-12-19",
      "id": "96915",
      "original_text": "Einreichung neuer Dokumente\nBayern Amtsgericht Traunstein HRB 33\nBerchtesgadener Bergbahn Aktiengesellschaft – Schönau a.Königssee",
      "type": "Einreichung neuer Dokumente",
      "state": "Bayern",
      "amtsgericht": "Amtsgericht Traunstein",
      "registernummer": "HRB 33",
      "registerart": "HRB",
      "company_name": "Berchtesgadener Bergbahn Aktiengesellschaft",
      "company_seat": "Schönau a.Königssee",
      "details": "19.12.2024 (Bekanntmachungsdatum)\n\nBayern Amtsgericht Traunstein HRB 33\nEinreichung neuer Dokumente\n\nBerchtesgadener Bergbahn Aktiengesellschaft\nAktiengesellschaft\nSchönau a.Königssee\n\nDem Amtsgericht Traunstein -Registergericht- ist eine Liste der Mitglieder des Aufsichtsrats eingereicht worden, § 106 AktG."
    },
    {
      "date": "2024-12-19",
      "id": "96916",
      "original_text": "Einreichung neuer Dokumente\nBayern Amtsgericht Passau HRB 6182\nFP Finanzpartner AG – Vilshofen an der Donau",
      "type": "Einreichung neuer Dokumente",
      "state": "Bayern",
      "amtsgericht": "Amtsgericht Passau",
      "registernummer": "HRB 6182",
      "registerart": "HRB",
      "company_name": "FP Finanzpartner AG",
      "company_seat": "Vilshofen an der Donau",
      "details": "19.12.2024 (Bekanntmachungsdatum)\n\nBayern Amtsgericht Passau HRB 6182\nEinreichung neuer Dokumente\n\nFP Finanzpartner AG\nAktiengesellschaft\nVilshofen an der Donau\n\nDem Amtsgericht Passau -Registergericht- ist eine Liste der Mitglieder des Aufsichtsrats eingereicht worden, § 106 AktG."
    },
    {
      "date": "2024-12-19",
      "id": "96917",
      "original_text": "Löschungsankündigung\nBayern Amtsgericht Aschaffenburg HRB 15847\nIMEX-CO GmbH – Kleinostheim",
      "type": "Löschungsankündigung",
      "state": "Bayern",
      "amtsgericht": "Amtsgericht Aschaffenburg",
      "registernummer": "HRB 15847",
      "registerart": "HRB",
      "company_name": "IMEX-CO GmbH",
      "company_seat": "Kleinostheim",
      "details": "19.12.2024 (Bekanntmachungsdatum)\n\nBayern Amtsgericht Aschaffenburg HRB 15847\nLöschungsankündigung\n\nIMEX-CO GmbH\nGesellschaft mit beschränkter Haftung\nKleinostheim\n\nDas Registergericht beabsichtigt, die im Handelsregister eingetragene Gesellschaft wegen Vermögenslosigkeit von Amts wegen nach § 394 FamFG zu löschen. Die Frist zur Erhebung eines Widerspruchs ist auf drei Monate festgesetzt."
    },
    {
      "date": "2024-12-19",
      "id": "96918",
      "original_text": "Löschungsankündigung\nBayern Amtsgericht München HRA 106453\nPANNTUM Wohnbau Mühlanger GmbH & Co. KG – Grünwald",
      "type": "Löschungsankündigung",
      "state": "Bayern",
      "amtsgericht": "Amtsgericht München",
      "registernummer": "HRA 106453",
      "registerart": "HRA",
      "company_name": "PANNTUM Wohnbau Mühlanger GmbH & Co. KG",
      "company_seat": "Grünwald",
      "details": "19.12.2024 (Bekanntmachungsdatum)\n\nBayern Amtsgericht München HRA 106453\nLöschungsankündigung 18.12.2024 (Eintragungsdatum)\n\nPANNTUM Wohnbau Mühlanger GmbH & Co. KG\nKommanditgesellschaft\nGrünwald\n\nDas Registergericht beabsichtigt, die im Handelsregister eingetragene Firma wegen Vermögenslosigkeit von Amts wegen nach § 394 FamFG zu löschen. Die Frist zur Erhebung eines Widerspruchs ist auf drei Monate festgesetzt."
    },
    {
      "date": "2024-12-19",
      "id": "96919",
      "original_text": "Registerbekanntmachung nach dem Umwandlungsgesetz\nBayern Amtsgericht Traunstein HRB 22067\nmefro GmbH – Rohrdorf",
      "type": "Registerbekanntmachung nach dem Umwandlungsgesetz",
      "state": "Bayern",
      "amtsgericht": "Amtsgericht Traunstein",
      "registernummer": "HRB 22067",
      "registerart": "HRB",
      "company_name": "mefro GmbH",
      "company_seat": "Rohrdorf",
      "details": "19.12.2024 (Bekanntmachungsdatum)\n\nBayern Amtsgericht Traunstein HRB 22067\nRegisterbekanntmachung nach dem Umwandlungsgesetz 18.12.2024 (Eintragungsdatum)\n\nmefro GmbH\nGesellschaft mit beschränkter Haftung\nRohrdorf\n\nDen Gläubigern der an der Verschmelzung beteiligten Rechtsträger ist, wenn sie binnen sechs Monaten nach dem Tag, an dem die Eintragung der Verschmelzung in das Register des Sitzes desjenigen Rechtsträgers, dessen Gläubiger sie sind, nach § 19 Abs. 3 UmwG als bekannt gemacht gilt, ihren Anspruch nach Grund und Höhe schriftlich anmelden, Sicherheit zu leisten, soweit sie nicht Befriedigung verlangen können. Dieses Recht steht den Gläubigern jedoch nur zu, wenn sie glaubhaft machen, dass durch die Verschmelzung die Erfüllung ihrer Forderung gefährdet wird."
    },
    {
      "date": "2024-12-19",
      "id": "96920",
      "original_text": "Einreichung neuer Dokumente\nBayern Amtsgericht München HRB 261996\nEMSON Invest AG – München",
      "type": "Einreichung neuer Dokumente",
      "state": "Bayern",
      "amtsgericht": "Amtsgericht München",
      "registernummer": "HRB 261996",
      "registerart": "HRB",
      "company_name": "EMSON Invest AG",
      "company_seat": "München",
      "details": "19.12.2024 (Bekanntmachungsdatum)\n\nBayern Amtsgericht München HRB 261996\nEinreichung neuer Dokumente\n\nEMSON Invest AG\nAktiengesellschaft\nMünchen\n\nDem Amtsgericht München -Registergericht- ist eine Liste der Mitglieder des Aufsichtsrats eingereicht worden, § 106 AktG."
    },
    {
      "date": "2024-12-19",
      "id": "96921",
      "original_text": "Sonstige Registerbekanntmachung\nBayern Amtsgericht Nürnberg HRB 35108\nSandoz Deutschland GmbH – Nürnberg",
      "type": "Sonstige Registerbekanntmachung",
      "state": "Bayern",
      "amtsgericht": "Amtsgericht Nürnberg",
      "registernummer": "HRB 35108",
      "registerart": "HRB",
      "company_name": "Sandoz Deutschland GmbH",
      "company_seat": "Nürnberg",
      "details": "19.12.2024 (Bekanntmachungsdatum)\n\nBayern Amtsgericht Nürnberg HRB 35108\nSonstige Registerbekanntmachung\n\nSandoz Deutschland GmbH\nGesellschaft mit beschränkter Haftung\nNürnberg\n\nDem Amtsgericht Nürnberg -Registergericht- ist eine Liste der Mitglieder des Aufsichtsrats eingereicht worden, § 52 Abs. 3 S. 2 GmbHG."
    },
    {
      "date": "2024-12-19",
      "id": "96922",
      "original_text": "Registerbekanntmachung nach dem Umwandlungsgesetz\nBayern Amtsgericht Traunstein HRB 2415\nmefro Metallwarenfabrik Fischbacher GmbH – Rohrdorf",
      "type": "Registerbekanntmachung nach dem Umwandlungsgesetz",
      "state": "Bayern",
      "amtsgericht": "Amtsgericht Traunstein",
      "registernummer": "HRB 2415",
      "registerart": "HRB",
      "company_name": "mefro Metallwarenfabrik Fischbacher GmbH",
      "company_seat": "Rohrdorf",
      "details": "19.12.2024 (Bekanntmachungsdatum)\n\nBayern Amtsgericht Traunstein HRB 2415\nRegisterbekanntmachung nach dem Umwandlungsgesetz 18.12.2024 (Eintragungsdatum)\n\nmefro Metallwarenfabrik Fischbacher GmbH\nGesellschaft mit beschränkter Haftung\nRohrdorf\n\nDen Gläubigern der an der Verschmelzung beteiligten Rechtsträger ist, wenn sie binnen sechs Monaten nach dem Tag, an dem die Eintragung der Verschmelzung in das Register des Sitzes desjenigen Rechtsträgers, dessen Gläubiger sie sind, nach § 19 Abs. 3 UmwG als bekannt gemacht gilt, ihren Anspruch nach Grund und Höhe schriftlich anmelden, Sicherheit zu leisten, soweit sie nicht Befriedigung verlangen können. Dieses Recht steht den Gläubigern jedoch nur zu, wenn sie glaubhaft machen, dass durch die Verschmelzung die Erfüllung ihrer Forderung gefährdet wird."
    },
    {
      "date": "2024-12-19",
      "id": "96923",
      "original_text": "Registerbekanntmachung nach dem Umwandlungsgesetz\nBayern Amtsgericht Aschaffenburg HRB 9890\nLow & Bonar Production GmbH – Erlenbach am Main",
      "type": "Registerbekanntmachung nach dem Umwandlungsgesetz",
      "state": "Bayern",
      "amtsgericht": "Amtsgericht Aschaffenburg",
      "registernummer": "HRB 9890",
      "registerart": "HRB",
      "company_name": "Low & Bonar Production GmbH",
      "company_seat": "Erlenbach am Main",
      "details": "19.12.2024 (Bekanntmachungsdatum)\n\nBayern Amtsgericht Aschaffenburg HRB 9890\nRegisterbekanntmachung nach dem Umwandlungsgesetz 18.12.2024 (Eintragungsdatum)\n\nLow & Bonar Production GmbH\nGesellschaft mit beschränkter Haftung\nErlenbach am Main\n\nDen Gläubigern der an der Verschmelzung beteiligten Rechtsträger ist, wenn sie binnen sechs Monaten nach dem Tag, an dem die Eintragung der Verschmelzung in das Register des Sitzes desjenigen Rechtsträgers, dessen Gläubiger sie sind, nach § 19 Abs. 3 UmwG als bekannt gemacht gilt, ihren Anspruch nach Grund und Höhe schriftlich anmelden, Sicherheit zu leisten, soweit sie nicht Befriedigung verlangen können. Dieses Recht steht den Gläubigern jedoch nur zu, wenn sie glaubhaft machen, dass durch die Verschmelzung die Erfüllung ihrer Forderung gefährdet wird."
    },
    {
      "date": "2024-12-19",
      "id": "96924",
      "original_text": "Registerbekanntmachung nach dem Umwandlungsgesetz\nBayern Amtsgericht Bamberg HRA 13263\nRudolf Weyrauther e.K. – Bamberg",
      "type": "Registerbekanntmachung nach dem Umwandlungsgesetz",
      "state": "Bayern",
      "amtsgericht": "Amtsgericht Bamberg",
      "registernummer": "HRA 13263",
      "registerart": "HRA",
      "company_name": "Rudolf Weyrauther e.K.",
      "company_seat": "Bamberg",
      "details": "19.12.2024 (Bekanntmachungsdatum)\n\nBayern Amtsgericht Bamberg HRA 13263\nRegisterbekanntmachung nach dem Umwandlungsgesetz 18.12.2024 (Eintragungsdatum)\n\nRudolf Weyrauther e.K.\nEinzelkaufmann / Einzelkauffrau\nBamberg\n\nDen Gläubigern der an der Ausgliederung beteiligten Rechtsträger ist, wenn sie binnen sechs Monaten nach dem Tag, an dem die Eintragung der Ausgliederung in das Register des Sitzes desjenigen Rechtsträgers, dessen Gläubiger sie sind, nach §§ 125, 19 Abs. 3 UmwG als bekannt gemacht gilt, ihren Anspruch nach Grund und Höhe schriftlich anmelden, Sicherheit zu leisten, soweit sie nicht Befriedigung verlangen können. Dieses Recht steht den Gläubigern jedoch nur zu, wenn sie glaubhaft machen, dass durch die Ausgliederung die Erfüllung ihrer Forderung gefährdet wird."
    },
    {
      "date": "2024-12-19",
      "id": "96925",
      "original_text": "Registerbekanntmachung nach dem Umwandlungsgesetz\nBayern Amtsgericht München HRB 227081\nWealthCap Objekt-Vorrat 20 Komplementär GmbH – München",
      "type": "Registerbekanntmachung nach dem Umwandlungsgesetz",
      "state": "Bayern",
      "amtsgericht": "Amtsgericht München",
      "registernummer": "HRB 227081",
      "registerart": "HRB",
      "company_name": "WealthCap Objekt-Vorrat 20 Komplementär GmbH",
      "company_seat": "München",
      "details": "19.12.2024 (Bekanntmachungsdatum)\n\nBayern Amtsgericht München HRB 227081\nRegisterbekanntmachung nach dem Umwandlungsgesetz 18.12.2024 (Eintragungsdatum)\n\nWealthCap Objekt-Vorrat 20 Komplementär GmbH\nGesellschaft mit beschränkter Haftung\nMünchen\n\nDen Gläubigern der an der Verschmelzung beteiligten Rechtsträger ist, wenn sie binnen sechs Monaten nach dem Tag, an dem die Eintragung der Verschmelzung in das Register des Sitzes desjenigen Rechtsträgers, dessen Gläubiger sie sind, nach § 19 Abs. 3 UmwG als bekannt gemacht gilt, ihren Anspruch nach Grund und Höhe schriftlich anmelden, Sicherheit zu leisten, soweit sie nicht Befriedigung verlangen können. Dieses Recht steht den Gläubigern jedoch nur zu, wenn sie glaubhaft machen, dass durch die Verschmelzung die Erfüllung ihrer Forderung gefährdet wird."
    },
    {
      "date": "2024-12-19",
      "id": "96926",
      "original_text": "Einreichung neuer Dokumente\nBayern Amtsgericht Ingolstadt HRB 10385\nELEGEND AG – Beilngries",
      "type": "Einreichung neuer Dokumente",
      "state": "Bayern",
      "amtsgericht": "Amtsgericht Ingolstadt",
      "registernummer": "HRB 10385",
      "registerart": "HRB",
      "company_name": "ELEGEND AG",
      "company_seat": "Beilngries",
      "details": "19.12.2024 (Bekanntmachungsdatum)\n\nBayern Amtsgericht Ingolstadt HRB 10385\nEinreichung neuer Dokumente\n\nELEGEND AG\nAktiengesellschaft\nBeilngries\n\nDem Amtsgericht Ingolstadt -Registergericht- sind drei Listen der Mitglieder des Aufsichtsrats eingereicht worden, § 106 AktG."
    },
    {
      "date": "2024-12-19",
      "id": "96927",
      "original_text": "Registerbekanntmachung nach dem Umwandlungsgesetz\nBayern Amtsgericht Coburg HRA 5629\nScerox erodiertechnik GmbH & Co. KG – Redwitz a.d. Rodach",
      "type": "Registerbekanntmachung nach dem Umwandlungsgesetz",
      "state": "Bayern",
      "amtsgericht": "Amtsgericht Coburg",
      "registernummer": "HRA 5629",
      "registerart": "HRA",
      "company_name": "Scerox erodiertechnik GmbH & Co. KG",
      "company_seat": "Redwitz a.d. Rodach",
      "details": "19.12.2024 (Bekanntmachungsdatum)\n\nBayern Amtsgericht Coburg HRA 5629\nRegisterbekanntmachung nach dem Umwandlungsgesetz 18.12.2024 (Eintragungsdatum)\n\nScerox erodiertechnik GmbH & Co. KG\nKommanditgesellschaft\nRedwitz a.d. Rodach\n\nDen Gläubigern des formwechselnden Rechtsträgers ist, wenn sie binnen sechs Monaten nach dem Tag, an dem die Eintragung des Formwechsels nach § 201 UmwG als bekannt gemacht gilt, ihren Anspruch nach Grund und Höhe schriftlich anmelden, Sicherheit zu leisten, soweit sie nicht Befriedigung verlangen können. Dieses Recht steht den Gläubigern jedoch nur zu, wenn sie glaubhaft machen, dass durch den Formwechsel die Erfüllung ihrer Forderung gefährdet wird."
    },
    {
      "date": "2024-12-19",
      "id": "96928",
      "original_text": "Löschungsankündigung\nBayern Amtsgericht Hof HRB 5169\nMenkraft GmbH Pflege-Daheim – Wunsiedel",
      "type": "Löschungsankündigung",
      "state": "Bayern",
      "amtsgericht": "Amtsgericht Hof",
      "registernummer": "HRB 5169",
      "registerart": "HRB",
      "company_name": "Menkraft GmbH Pflege-Daheim",
      "company_seat": "Wunsiedel",
      "details": "19.12.2024 (Bekanntmachungsdatum)\n\nBayern Amtsgericht Hof HRB 5169\nLöschungsankündigung\n\nMenkraft GmbH Pflege-Daheim\nGesellschaft mit beschränkter Haftung\nWunsiedel\n\nDas Registergericht beabsichtigt, die im Handelsregister eingetragene Gesellschaft wegen Vermögenslosigkeit von Amts wegen nach § 394 FamFG zu löschen. Die Frist zur Erhebung eines Widerspruchs ist auf sechs Wochen festgesetzt."
    },
    {
      "date": "2024-12-19",
      "id": "96929",
      "original_text": "Registerbekanntmachung nach dem Umwandlungsgesetz\nBayern Amtsgericht München HRB 244390\nWealthcap Objekt-Vorrat 25 Komplementär GmbH – München",
      "type": "Registerbekanntmachung nach dem Umwandlungsgesetz",
      "state": "Bayern",
      "amtsgericht": "Amtsgericht München",
      "registernummer": "HRB 244390",
      "registerart": "HRB",
      "company_name": "Wealthcap Objekt-Vorrat 25 Komplementär GmbH",
      "company_seat": "München",
      "details": "19.12.2024 (Bekanntmachungsdatum)\n\nBayern Amtsgericht München HRB 244390\nRegisterbekanntmachung nach dem Umwandlungsgesetz 18.12.2024 (Eintragungsdatum)\n\nWealthcap Objekt-Vorrat 25 Komplementär GmbH\nGesellschaft mit beschränkter Haftung\nMünchen\n\nDen Gläubigern der an der Verschmelzung beteiligten Rechtsträger ist, wenn sie binnen sechs Monaten nach dem Tag, an dem die Eintragung der Verschmelzung in das Register des Sitzes desjenigen Rechtsträgers, dessen Gläubiger sie sind, nach § 19 Abs. 3 UmwG als bekannt gemacht gilt, ihren Anspruch nach Grund und Höhe schriftlich anmelden, Sicherheit zu leisten, soweit sie nicht Befriedigung verlangen können. Dieses Recht steht den Gläubigern jedoch nur zu, wenn sie glaubhaft machen, dass durch die Verschmelzung die Erfüllung ihrer Forderung gefährdet wird."
    },
    {
      "date": "2024-12-19",
      "id": "96930",
      "original_text": "Löschungsankündigung\nBayern Amtsgericht Amberg HRB 5061\nPerfect Teleshopping GmbH – Sulzbach-Rosenberg",
      "type": "Löschungsankündigung",
      "state": "Bayern",
      "amtsgericht": "Amtsgericht Amberg",
      "registernummer": "HRB 5061",
      "registerart": "HRB",
      "company_name": "Perfect Teleshopping GmbH",
      "company_seat": "Sulzbach-Rosenberg",
      "details": "19.12.2024 (Bekanntmachungsdatum)\n\nBayern Amtsgericht Amberg HRB 5061\nLöschungsankündigung\n\nPerfect Teleshopping GmbH\nGesellschaft mit beschränkter Haftung\nSulzbach-Rosenberg\n\nDas Registergericht beabsichtigt, die im Handelsregister eingetragene Gesellschaft wegen Vermögenslosigkeit von Amts wegen nach § 394 FamFG zu löschen. Die Frist zur Erhebung eines Widerspruchs ist auf einen Monat festgesetzt."
    },
    {
      "date": "2024-12-19",
      "id": "96931",
      "original_text": "Registerbekanntmachung nach dem Umwandlungsgesetz\nBayern Amtsgericht Coburg HRB 4217\nScerox erodiertechnik GmbH – Redwitz a.d. Rodach",
      "type": "Registerbekanntmachung nach dem Umwandlungsgesetz",
      "state": "Bayern",
      "amtsgericht": "Amtsgericht Coburg",
      "registernummer": "HRB 4217",
      "registerart": "HRB",
      "company_name": "Scerox erodiertechnik GmbH",
      "company_seat": "Redwitz a.d. Rodach",
      "details": "19.12.2024 (Bekanntmachungsdatum)\n\nBayern Amtsgericht Coburg HRB 4217\nRegisterbekanntmachung nach dem Umwandlungsgesetz 18.12.2024 (Eintragungsdatum)\n\nScerox erodiertechnik GmbH\nGesellschaft mit beschränkter Haftung\nRedwitz a.d. Rodach\n\nDen Gläubigern des formwechselnden Rechtsträgers ist, wenn sie binnen sechs Monaten nach dem Tag, an dem die Eintragung des Formwechsels nach § 201 UmwG als bekannt gemacht gilt, ihren Anspruch nach Grund und Höhe schriftlich anmelden, Sicherheit zu leisten, soweit sie nicht Befriedigung verlangen können. Dieses Recht steht den Gläubigern jedoch nur zu, wenn sie glaubhaft machen, dass durch den Formwechsel die Erfüllung ihrer Forderung gefährdet wird."
    },
    {
      "date": "2024-12-19",
      "id": "96932",
      "original_text": "Registerbekanntmachung nach dem Umwandlungsgesetz\nBayern Amtsgericht Bamberg HRA 13285\nWEYPA GmbH & Co. KG – Bamberg",
      "type": "Registerbekanntmachung nach dem Umwandlungsgesetz",
      "state": "Bayern",
      "amtsgericht": "Amtsgericht Bamberg",
      "registernummer": "HRA 13285",
      "registerart": "HRA",
      "company_name": "WEYPA GmbH & Co. KG",
      "company_seat": "Bamberg",
      "details": "19.12.2024 (Bekanntmachungsdatum)\n\nBayern Amtsgericht Bamberg HRA 13285\nRegisterbekanntmachung nach dem Umwandlungsgesetz 18.12.2024 (Eintragungsdatum)\n\nWEYPA GmbH & Co. KG\nKommanditgesellschaft\nBamberg\n\nDen Gläubigern der an der Ausgliederung beteiligten Rechtsträger ist, wenn sie binnen sechs Monaten nach dem Tag, an dem die Eintragung der Ausgliederung in das Register des Sitzes desjenigen Rechtsträgers, dessen Gläubiger sie sind, nach §§ 125, 19 Abs. 3 UmwG als bekannt gemacht gilt, ihren Anspruch nach Grund und Höhe schriftlich anmelden, Sicherheit zu leisten, soweit sie nicht Befriedigung verlangen können. Dieses Recht steht den Gläubigern jedoch nur zu, wenn sie glaubhaft machen, dass durch die Ausgliederung die Erfüllung ihrer Forderung gefährdet wird."
    },
    {
      "date": "2024-12-19",
      "id": "96933",
      "original_text": "Registerbekanntmachung nach dem Umwandlungsgesetz\nBayern Amtsgericht Fürth HRB 12157\nNiersberger Servicegesellschaft mbH – Erlangen",
      "type": "Registerbekanntmachung nach dem Umwandlungsgesetz",
      "state": "Bayern",
      "amtsgericht": "Amtsgericht Fürth",
      "registernummer": "HRB 12157",
      "registerart": "HRB",
      "company_name": "Niersberger Servicegesellschaft mbH",
      "company_seat": "Erlangen",
      "details": "19.12.2024 (Bekanntmachungsdatum)\n\nBayern Amtsgericht Fürth HRB 12157\nRegisterbekanntmachung nach dem Umwandlungsgesetz 18.12.2024 (Eintragungsdatum)\n\nNiersberger Servicegesellschaft mbH\nGesellschaft mit beschränkter Haftung\nErlangen\n\nDen Gläubigern der an der Verschmelzung beteiligten Rechtsträger ist, wenn sie binnen sechs Monaten nach dem Tag, an dem die Eintragung der Verschmelzung in das Register des Sitzes desjenigen Rechtsträgers, dessen Gläubiger sie sind, nach § 19 Abs. 3 UmwG als bekannt gemacht gilt, ihren Anspruch nach Grund und Höhe schriftlich anmelden, Sicherheit zu leisten, soweit sie nicht Befriedigung verlangen können. Dieses Recht steht den Gläubigern jedoch nur zu, wenn sie glaubhaft machen, dass durch die Verschmelzung die Erfüllung ihrer Forderung gefährdet wird."
    },
    {
      "date": "2024-12-19",
      "id": "96934",
      "original_text": "Einreichung neuer Dokumente\nBaden-Württemberg Amtsgericht Mannheim HRB 705991\nRKH Kliniken des Landkreises Karlsruhe gemeinnützige GmbH – Bruchsal",
      "type": "Einreichung neuer Dokumente",
      "state": "Baden-Württemberg",
      "amtsgericht": "Amtsgericht Mannheim",
      "registernummer": "HRB 705991",
      "registerart": "HRB",
      "company_name": "RKH Kliniken des Landkreises Karlsruhe gemeinnützige GmbH",
      "company_seat": "Bruchsal",
      "details": "19.12.2024 (Bekanntmachungsdatum)\n\nBaden-Württemberg Amtsgericht Mannheim HRB 705991\nEinreichung neuer Dokumente\n\nRKH Kliniken des Landkreises Karlsruhe gemeinnützige GmbH\nGesellschaft mit beschränkter Haftung\nBruchsal\n\nDie Gesellschaft hat am 18.12.2024 die Liste über die Zusammensetzung des Aufsichtsrats zum Handelsregister eingereicht."
    },
    {
      "date": "2024-12-19",
      "id": "96935",
      "original_text": "Löschungsankündigung\nSaarland Amtsgericht Saarbrücken HRB 19805\nS - P Logistik GmbH – Spiesen-Elversberg",
      "type": "Löschungsankündigung",
      "state": "Saarland",
      "amtsgericht": "Amtsgericht Saarbrücken",
      "registernummer": "HRB 19805",
      "registerart": "HRB",
      "company_name": "S - P Logistik GmbH",
      "company_seat": "Spiesen-Elversberg",
      "details": "19.12.2024 (Bekanntmachungsdatum)\n\nSaarland Amtsgericht Saarbrücken HRB 19805\nLöschungsankündigung\n\nS - P Logistik GmbH\nGesellschaft mit beschränkter Haftung\nSpiesen-Elversberg\n\nEs ist beabsichtigt, die Gesellschaft von Amts wegen gemäß § 394 FamFG wegen Vermögenslosigkeit zu löschen.\nGegen die Löschung von Amts wegen ist das Rechtsmittel des Widerspruchs statthaft. Der Widerspruch ist binnen einer Frist drei Monaten beginnend mit dem Tag dieser Veröffentlichung durch Einreichen eines Widerspruchsschreibens -schriftlich oder zur Niederschrift der Geschäftsstelle beim Amtsgericht Saarbrücken, -zentrales Handelsregister-, Mainzerstr.178, 66121 Saarbrücken einzulegen.\nDer Widerspruch muss die Bezeichnung der angefochtenen Löschungsankündigung enthalten sowie die Erklärung, dass Widerspruch eingelegt wird. Er ist vom Widerspruchsführer oder seinem Bevollmächtigten zu unterzeichnen.\nDas Widerspruchsschreiben kann auch in der Form eines elektronischen Dokumentes eingereicht werden, das mit einer qualifizierten elektronischen Signatur nach dem Signaturgesetz versehen sein muss (§§ 14 Abs. 2 FamFG, 130a, 298 ZPO)."
    },
    {
      "date": "2024-12-19",
      "id": "96936",
      "original_text": "Löschungsankündigung\nBerlin Amtsgericht Berlin (Charlottenburg) HRB 222958\nTOLUS Gebäudeservice GmbH – Berlin",
      "type": "Löschungsankündigung",
      "state": "Berlin",
      "amtsgericht": "Amtsgericht Berlin (Charlottenburg)",
      "registernummer": "HRB 222958",
      "registerart": "HRB",
      "company_name": "TOLUS Gebäudeservice GmbH",
      "company_seat": "Berlin",
      "details": "19.12.2024 (Bekanntmachungsdatum)\n\nBerlin Amtsgericht Berlin (Charlottenburg) HRB 222958\nLöschungsankündigung\n\nTOLUS Gebäudeservice GmbH\nGesellschaft mit beschränkter Haftung\nBerlin\n\nBei der nachstehenden Gesellschaft wird das Amtslöschungsverfahren gemäß § 394 FamFG eingeleitet. Widerspruchsfrist 6 Wochen"
    },
    {
      "date": "2024-12-19",
      "id": "96937",
      "original_text": "Löschungsankündigung\nBerlin Amtsgericht Berlin (Charlottenburg) HRB 210193\nCredit Royal Deutschland GmbH – Berlin",
      "type": "Löschungsankündigung",
      "state": "Berlin",
      "amtsgericht": "Amtsgericht Berlin (Charlottenburg)",
      "registernummer": "HRB 210193",
      "registerart": "HRB",
      "company_name": "Credit Royal Deutschland GmbH",
      "company_seat": "Berlin",
      "details": "19.12.2024 (Bekanntmachungsdatum)\n\nBerlin Amtsgericht Berlin (Charlottenburg) HRB 210193\nLöschungsankündigung\n\nCredit Royal Deutschland GmbH\nGesellschaft mit beschränkter Haftung\nBerlin\n\nBei der nachstehenden Gesellschaft wird das Amtslöschungsverfahren gemäß § 394 FamFG eingeleitet. Widerspruchsfrist 6 Wochen"
    },
    {
      "date": "2024-12-19",
      "id": "96938",
      "original_text": "Registerbekanntmachung nach dem Umwandlungsgesetz\nBerlin Amtsgericht Berlin (Charlottenburg) HRB 236238\nATH Rail Transport Beteiligungsgesellschaft Deutschland GmbH – Berlin",
      "type": "Registerbekanntmachung nach dem Umwandlungsgesetz",
      "state": "Berlin",
      "amtsgericht": "Amtsgericht Berlin (Charlottenburg)",
      "registernummer": "HRB 236238",
      "registerart": "HRB",
      "company_name": "ATH Rail Transport Beteiligungsgesellschaft Deutschland GmbH",
      "company_seat": "Berlin",
      "details": "19.12.2024 (Bekanntmachungsdatum)\n\nBerlin Amtsgericht Berlin (Charlottenburg) HRB 236238\nRegisterbekanntmachung nach dem Umwandlungsgesetz 18.12.2024 (Eintragungsdatum)\n\nATH Rail Transport Beteiligungsgesellschaft Deutschland GmbH\nGesellschaft mit beschränkter Haftung\nBerlin\n\nZu Eintragungsnummer 8 vom 18.12.2024 wird als nicht eingetragen veröffentlicht:Den Gläubigern ist, wenn sie binnen sechs Monaten nach dem Tag, an dem die Eintragung der Umwandlung als bekannt gemacht gilt, ihren Anspruch nach Grund und Höhe schriftlich anmelden, Sicherheit zu leisten, soweit sie nicht Befriedigung verlangen können. Dieses Recht steht den Gläubigern jedoch nur zu, wenn sie glaubhaft machen, dass durch die Umwandlung die Erfüllung ihrer Forderung gefährdet wird. Das Recht, Sicherheitsleistung zu verlangen, steht Gläubigern nicht zu, die im Falle der Insolvenz ein Recht auf vorzugsweise Befriedigung aus einer Deckungsmasse haben, die nach gesetzlicher Vorschrift zu ihrem Schutz errichtet und staatlich überwacht ist."
    },
    {
      "date": "2024-12-19",
      "id": "96939",
      "original_text": "Registerbekanntmachung nach dem Umwandlungsgesetz\nBerlin Amtsgericht Berlin (Charlottenburg) HRA 63735\nATH Rail Transport Beteiligungsgesellschaft GmbH & Co. KG – Berlin",
      "type": "Registerbekanntmachung nach dem Umwandlungsgesetz",
      "state": "Berlin",
      "amtsgericht": "Amtsgericht Berlin (Charlottenburg)",
      "registernummer": "HRA 63735",
      "registerart": "HRA",
      "company_name": "ATH Rail Transport Beteiligungsgesellschaft GmbH & Co. KG",
      "company_seat": "Berlin",
      "details": "19.12.2024 (Bekanntmachungsdatum)\n\nBerlin Amtsgericht Berlin (Charlottenburg) HRA 63735\nRegisterbekanntmachung nach dem Umwandlungsgesetz 18.12.2024 (Eintragungsdatum)\n\nATH Rail Transport Beteiligungsgesellschaft GmbH & Co. KG\nKommanditgesellschaft\nBerlin\n\nZu Eintragungsnummer 1 vom 18.12.2024 wird als nicht eingetragen veröffentlicht: Den Gläubigern ist, wenn sie binnen sechs Monaten nach dem Tag, an dem die Eintragung der Umwandlung als bekannt gemacht gilt, ihren Anspruch nach Grund und Höhe schriftlich anmelden, Sicherheit zu leisten, soweit sie nicht Befriedigung verlangen können. Dieses Recht steht den Gläubigern jedoch nur zu, wenn sie glaubhaft machen, dass durch die Umwandlung die Erfüllung ihrer Forderung gefährdet wird. Das Recht, Sicherheitsleistung zu verlangen, steht Gläubigern nicht zu, die im Falle der Insolvenz ein Recht auf vorzugsweise Befriedigung aus einer Deckungsmasse haben, die nach gesetzlicher Vorschrift zu ihrem Schutz errichtet und staatlich überwacht ist."
    },
    {
      "date": "2024-12-19",
      "id": "96940",
      "original_text": "Sonstige Registerbekanntmachung\nBaden-Württemberg Amtsgericht Ulm HRB 733376\nRITZ Regionales Innovations- und Technologietransfer Zentrum GmbH – Friedrichshafen",
      "type": "Sonstige Registerbekanntmachung",
      "state": "Baden-Württemberg",
      "amtsgericht": "Amtsgericht Ulm",
      "registernummer": "HRB 733376",
      "registerart": "HRB",
      "company_name": "RITZ Regionales Innovations- und Technologietransfer Zentrum GmbH",
      "company_seat": "Friedrichshafen",
      "details": "19.12.2024 (Bekanntmachungsdatum)\n\nBaden-Württemberg Amtsgericht Ulm HRB 733376\nSonstige Registerbekanntmachung\n\nRITZ Regionales Innovations- und Technologietransfer Zentrum GmbH\nGesellschaft mit beschränkter Haftung\nFriedrichshafen\n\nDie Gesellschaft hat am 18.12.2024 die Liste über die Zusammensetzung des Aufsichtsrats zum Handelsregister eingereicht."
    },
    {
      "date": "2024-12-19",
      "id": "96941",
      "original_text": "Sonstige Registerbekanntmachung\nHamburg Amtsgericht Hamburg HRB 125052\nENERPARC Solar Invest 255 TU 1 GmbH – Hamburg",
      "type": "Sonstige Registerbekanntmachung",
      "state": "Hamburg",
      "amtsgericht": "Amtsgericht Hamburg",
      "registernummer": "HRB 125052",
      "registerart": "HRB",
      "company_name": "ENERPARC Solar Invest 255 TU 1 GmbH",
      "company_seat": "Hamburg",
      "details": "19.12.2024 (Bekanntmachungsdatum)\n\nHamburg Amtsgericht Hamburg HRB 125052\nSonstige Registerbekanntmachung 19.12.2024 (Eintragungsdatum)\n\nENERPARC Solar Invest 255 TU 1 GmbH\nGesellschaft mit beschränkter Haftung\nHamburg\n\nAls nicht eingetragen wird bekannt gemacht:  Den Gläubigern der Gesellschaft, deren Forderungen begründet worden sind, bevor die Eintragung der Vertragsbeendigung in das Handelsregister nach § 10 HGB als bekannt gemacht gilt, ist vom anderen Vertragsteil Sicherheit zu leisten, wenn sie sich binnen 6 Monaten nach Bekanntmachung der Eintragung zu diesem Zweck bei ihm melden."
    },
    {
      "date": "2024-12-19",
      "id": "96942",
      "original_text": "Registerbekanntmachung nach dem Umwandlungsgesetz\nBaden-Württemberg Amtsgericht Mannheim HRA 712311\nSTARVERT Energy GmbH & Co. KG – Mannheim",
      "type": "Registerbekanntmachung nach dem Umwandlungsgesetz",
      "state": "Baden-Württemberg",
      "amtsgericht": "Amtsgericht Mannheim",
      "registernummer": "HRA 712311",
      "registerart": "HRA",
      "company_name": "STARVERT Energy GmbH & Co. KG",
      "company_seat": "Mannheim",
      "details": "19.12.2024 (Bekanntmachungsdatum)\n\nBaden-Württemberg Amtsgericht Mannheim HRA 712311\nRegisterbekanntmachung nach dem Umwandlungsgesetz 19.12.2024 (Eintragungsdatum)\n\nSTARVERT Energy GmbH & Co. KG\nKommanditgesellschaft\nMannheim\n\nDen Gläubigern des an dem Formwechsel beteiligten Rechtsträgers ist, wenn sie binnen sechs Monaten nach dem Tag, an dem die Eintragung des Formwechsels in das Register des Sitzes desjenigen Rechtsträgers, dessen Gläubiger sie sind, nach § 19 Abs. 3 UmwG als bekanntgemacht gilt, ihren Anspruch nach Grund und Höhe schriftlich anmelden, Sicherheit zu leisten, soweit sie nicht Befriedigung verlangen können. Dieses Recht steht den Gläubigern jedoch nur zu, wenn sie glaubhaft machen, dass durch den Formwechsel die Erfüllung ihrer Forderung gefährdet wird."
    },
    {
      "date": "2024-12-19",
      "id": "96943",
      "original_text": "Registerbekanntmachung nach dem Umwandlungsgesetz\nBaden-Württemberg Amtsgericht Mannheim HRB 718322\nSTARVERT Energy GmbH – Mannheim",
      "type": "Registerbekanntmachung nach dem Umwandlungsgesetz",
      "state": "Baden-Württemberg",
      "amtsgericht": "Amtsgericht Mannheim",
      "registernummer": "HRB 718322",
      "registerart": "HRB",
      "company_name": "STARVERT Energy GmbH",
      "company_seat": "Mannheim",
      "details": "19.12.2024 (Bekanntmachungsdatum)\n\nBaden-Württemberg Amtsgericht Mannheim HRB 718322\nRegisterbekanntmachung nach dem Umwandlungsgesetz 19.12.2024 (Eintragungsdatum)\n\nSTARVERT Energy GmbH\nGesellschaft mit beschränkter Haftung\nMannheim\n\nDen Gläubigern des an dem Formwechsel beteiligten Rechtsträgers ist, wenn sie binnen sechs Monaten nach dem Tag, an dem die Eintragung des Formwechsels in das Register des Sitzes desjenigen Rechtsträgers, dessen Gläubiger sie sind, nach § 19 Abs. 3 UmwG als bekanntgemacht gilt, ihren Anspruch nach Grund und Höhe schriftlich anmelden, Sicherheit zu leisten, soweit sie nicht Befriedigung verlangen können. Dieses Recht steht den Gläubigern jedoch nur zu, wenn sie glaubhaft machen, dass durch den Formwechsel die Erfüllung ihrer Forderung gefährdet wird."
    },
    {
      "date": "2024-12-19",
      "id": "96944",
      "original_text": "Sonstige Registerbekanntmachung\nBaden-Württemberg Amtsgericht Stuttgart HRB 780919\nViva Immobilien GmbH – Vaihingen an der Enz",
      "type": "Sonstige Registerbekanntmachung",
      "state": "Baden-Württemberg",
      "amtsgericht": "Amtsgericht Stuttgart",
      "registernummer": "HRB 780919",
      "registerart": "HRB",
      "company_name": "Viva Immobilien GmbH",
      "company_seat": "Vaihingen an der Enz",
      "details": "19.12.2024 (Bekanntmachungsdatum)\n\nBaden-Württemberg Amtsgericht Stuttgart HRB 780919\nSonstige Registerbekanntmachung 19.12.2024 (Eintragungsdatum)\n\nViva Immobilien GmbH\nGesellschaft mit beschränkter Haftung\nVaihingen an der Enz\n\nAls nicht eingetragen wird bekanntgemacht:\nDen Gläubigern der Gesellschaft, deren Forderungen begründet worden sind, bevor die Eintragung der Beendigung des Vertrages in das Handelsregister nach § 10 HGB als bekanntgemacht gilt, ist vom anderen Vertragsteil Sicherheit zu leisten, wenn sie sich binnen sechs Monaten nach der Bekanntmachung zu diesem Zweck bei ihm melden."
    },
    {
      "date": "2024-12-19",
      "id": "96945",
      "original_text": "Registerbekanntmachung nach dem Umwandlungsgesetz\nBaden-Württemberg Amtsgericht Stuttgart HRA 729431\nJetter GmbH & Co. KG – Rosenfeld",
      "type": "Registerbekanntmachung nach dem Umwandlungsgesetz",
      "state": "Baden-Württemberg",
      "amtsgericht": "Amtsgericht Stuttgart",
      "registernummer": "HRA 729431",
      "registerart": "HRA",
      "company_name": "Jetter GmbH & Co. KG",
      "company_seat": "Rosenfeld",
      "details": "19.12.2024 (Bekanntmachungsdatum)\n\nBaden-Württemberg Amtsgericht Stuttgart HRA 729431\nRegisterbekanntmachung nach dem Umwandlungsgesetz 19.12.2024 (Eintragungsdatum)\n\nJetter GmbH & Co. KG\nKommanditgesellschaft\nRosenfeld\n\nDen Gläubigern der an der Verschmelzung beteiligten Rechtsträger ist, wenn sie binnen sechs Monaten nach dem Tag, an dem die Eintragung der Verschmelzung in das Register des Sitzes desjenigen Rechtsträgers, dessen Gläubiger sie sind, nach § 19 Abs. 3 UmwG als bekanntgemacht gilt, ihren Anspruch nach Grund und Höhe schriftlich anmelden, Sicherheit zu leisten, soweit sie nicht Befriedigung verlangen können. Dieses Recht steht den Gläubigern jedoch nur zu, wenn sie glaubhaft machen, dass durch die Verschmelzung die Erfüllung ihrer Forderung gefährdet wird."
    },
    {
      "date": "2024-12-19",
      "id": "96946",
      "original_text": "Registerbekanntmachung nach dem Umwandlungsgesetz\nBaden-Württemberg Amtsgericht Stuttgart HRB 747290\nJetter Holding GmbH – Rosenfeld",
      "type": "Registerbekanntmachung nach dem Umwandlungsgesetz",
      "state": "Baden-Württemberg",
      "amtsgericht": "Amtsgericht Stuttgart",
      "registernummer": "HRB 747290",
      "registerart": "HRB",
      "company_name": "Jetter Holding GmbH",
      "company_seat": "Rosenfeld",
      "details": "19.12.2024 (Bekanntmachungsdatum)\n\nBaden-Württemberg Amtsgericht Stuttgart HRB 747290\nRegisterbekanntmachung nach dem Umwandlungsgesetz 19.12.2024 (Eintragungsdatum)\n\nJetter Holding GmbH\nGesellschaft mit beschränkter Haftung\nRosenfeld\n\nAls nicht eingetragen wird bekanntgemacht:Den Gläubigern der an der Verschmelzung beteiligten Rechtsträger ist, wenn sie binnen sechs Monaten nach dem Tag, an dem die Eintragung der Verschmelzung in das Register des Sitzes desjenigen Rechtsträgers, dessen Gläubiger sie sind, nach § 19 Abs. 3 UmwG als bekanntgemacht gilt, ihren Anspruch nach Grund und Höhe schriftlich anmelden, Sicherheit zu leisten, soweit sie nicht Befriedigung verlangen können. Dieses Recht steht den Gläubigern jedoch nur zu, wenn sie glaubhaft machen, dass durch die Verschmelzung die Erfüllung ihrer Forderung gefährdet wird."
    },
    {
      "date": "2024-12-19",
      "id": "96947",
      "original_text": "Registerbekanntmachung nach dem Umwandlungsgesetz\nNordrhein-Westfalen Amtsgericht Coesfeld HRB 1503\nEHG GF-D GmbH – Coesfeld",
      "type": "Registerbekanntmachung nach dem Umwandlungsgesetz",
      "state": "Nordrhein-Westfalen",
      "amtsgericht": "Amtsgericht Coesfeld",
      "registernummer": "HRB 1503",
      "registerart": "HRB",
      "company_name": "EHG GF-D GmbH",
      "company_seat": "Coesfeld",
      "details": "19.12.2024 (Bekanntmachungsdatum)\n\nNordrhein-Westfalen Amtsgericht Coesfeld HRB 1503\nRegisterbekanntmachung nach dem Umwandlungsgesetz 19.12.2024 (Eintragungsdatum)\n\nEHG GF-D GmbH\nGesellschaft mit beschränkter Haftung\nCoesfeld\n\nDen Gläubigern der an der Verschmelzung beteiligten Rechtsträger ist, wenn sie binnen sechs Monaten nach dem Tag, an dem die Eintragung der Verschmelzung in das Register des Sitzes derjenigen Rechtsträger deren Gläubiger sie sind, nach § 19 Absatz 3 UmwG als bekanntgemacht gilt, ihren Anspruch nach Grund und Höhe schriftlich anmelden, Sicherheit zu leisten, soweit sie nicht Befriedigung verlangen können. Dieses Recht steht den Gläubigern jedoch nur zu, wenn sie glaubhaft machen, dass durch die Verschmelzung die Erfüllung ihrer Forderung gefährdet wird."
    },
    {
      "date": "2024-12-19",
      "id": "96948",
      "original_text": "Registerbekanntmachung nach dem Umwandlungsgesetz\nHamburg Amtsgericht Hamburg HRB 93451\nGLANDER & CIE. Beteiligung GmbH – Hamburg",
      "type": "Registerbekanntmachung nach dem Umwandlungsgesetz",
      "state": "Hamburg",
      "amtsgericht": "Amtsgericht Hamburg",
      "registernummer": "HRB 93451",
      "registerart": "HRB",
      "company_name": "GLANDER & CIE. Beteiligung GmbH",
      "company_seat": "Hamburg",
      "details": "19.12.2024 (Bekanntmachungsdatum)\n\nHamburg Amtsgericht Hamburg HRB 93451\nRegisterbekanntmachung nach dem Umwandlungsgesetz 19.12.2024 (Eintragungsdatum)\n\nGLANDER & CIE. Beteiligung GmbH\nGesellschaft mit beschränkter Haftung\nHamburg\n\nAls nicht eingetragen wird bekannt gemacht:\nDen Gläubigern der an der Verschmelzung beteiligten Gesellschaften ist, wenn sie binnen sechs Monaten nach dem Tag, an dem die Eintragung der Verschmelzung in das Register des Sitzes desjenigen Rechtsträgers, dessen Gläubiger sie sind, nach § 19 Absatz 3 UmwG als bekannt gemacht gilt, ihren Anspruch nach Grund und Höhe schriftlich anmelden, Sicherheit zu leisten, soweit sie nicht Befriedigung verlangen können. Dieses Recht steht den Gläubigern jedoch nur zu, wenn sie glaubhaft machen, dass durch die Verschmelzung die Erfüllung ihrer Forderung gefährdet wird."
    },
    {
      "date": "2024-12-19",
      "id": "96949",
      "original_text": "Registerbekanntmachung nach dem Umwandlungsgesetz\nHamburg Amtsgericht Hamburg HRB 167751\nELBGRUND Immobilien GmbH – Hamburg",
      "type": "Registerbekanntmachung nach dem Umwandlungsgesetz",
      "state": "Hamburg",
      "amtsgericht": "Amtsgericht Hamburg",
      "registernummer": "HRB 167751",
      "registerart": "HRB",
      "company_name": "ELBGRUND Immobilien GmbH",
      "company_seat": "Hamburg",
      "details": "19.12.2024 (Bekanntmachungsdatum)\n\nHamburg Amtsgericht Hamburg HRB 167751\nRegisterbekanntmachung nach dem Umwandlungsgesetz 19.12.2024 (Eintragungsdatum)\n\nELBGRUND Immobilien GmbH\nGesellschaft mit beschränkter Haftung\nHamburg\n\nAls nicht eingetragen wird bekannt gemacht:\nDen Gläubigern der an der Verschmelzung beteiligten Gesellschaften ist, wenn sie binnen sechs Monaten nach dem Tag, an dem die Eintragung der Verschmelzung in das Register des Sitzes desjenigen Rechtsträgers, dessen Gläubiger sie sind, nach § 19 Absatz 3 UmwG als bekannt gemacht gilt, ihren Anspruch nach Grund und Höhe schriftlich anmelden, Sicherheit zu leisten, soweit sie nicht Befriedigung verlangen können. Dieses Recht steht den Gläubigern jedoch nur zu, wenn sie glaubhaft machen, dass durch die Verschmelzung die Erfüllung ihrer Forderung gefährdet wird."
    },
    {
      "date": "2024-12-19",
      "id": "96950",
      "original_text": "Einreichung neuer Dokumente\nMecklenburg-Vorpommern Amtsgericht Schwerin HRB 828\nBürgschaftsbank Mecklenburg-Vorpommern GmbH – Schwerin",
      "type": "Einreichung neuer Dokumente",
      "state": "Mecklenburg-Vorpommern",
      "amtsgericht": "Amtsgericht Schwerin",
      "registernummer": "HRB 828",
      "registerart": "HRB",
      "company_name": "Bürgschaftsbank Mecklenburg-Vorpommern GmbH",
      "company_seat": "Schwerin",
      "details": "19.12.2024 (Bekanntmachungsdatum)\n\nMecklenburg-Vorpommern Amtsgericht Schwerin HRB 828\nEinreichung neuer Dokumente 19.12.2024 (Eintragungsdatum)\n\nBürgschaftsbank Mecklenburg-Vorpommern GmbH\nGesellschaft mit beschränkter Haftung\nSchwerin\n\nEine Liste der Mitglieder des Aufsichtsrats ist zum Handelsregister eingereicht worden."
    },
    {
      "date": "2024-12-19",
      "id": "96951",
      "original_text": "Sonstige Registerbekanntmachung\nBaden-Württemberg Amtsgericht Freiburg HRB 708758\nNutriens GmbH – Bad Krozingen",
      "type": "Sonstige Registerbekanntmachung",
      "state": "Baden-Württemberg",
      "amtsgericht": "Amtsgericht Freiburg",
      "registernummer": "HRB 708758",
      "registerart": "HRB",
      "company_name": "Nutriens GmbH",
      "company_seat": "Bad Krozingen",
      "details": "19.12.2024 (Bekanntmachungsdatum)\n\nBaden-Württemberg Amtsgericht Freiburg HRB 708758\nSonstige Registerbekanntmachung 19.12.2024 (Eintragungsdatum)\n\nNutriens GmbH\nGesellschaft mit beschränkter Haftung\nBad Krozingen\n\nDer mit der \"ACZEPTA Holding GmbH\" (Amtsgericht Freiburg, HRB 708739) abgeschlossene Unternehmensvertrag ist zum 31.12.2023 beendet. Den Gläubigern der Gesellschaft, deren Forderungen begründet worden sind, bevor die Eintragung der Beendigung des Vertrages in das Handelsregister nach § 10 HGB als bekanntgemacht gilt, ist vom anderen Vertragsteil Sicherheit zu leisten, wenn sie sich binnen sechs Monaten nach der Bekanntmachung zu diesem Zweck bei ihm melden."
    },
    {
      "date": "2024-12-19",
      "id": "96952",
      "original_text": "Löschungsankündigung\nMecklenburg-Vorpommern Amtsgericht Rostock HRB 13271\nPflegedienst Teterow Schwester Kathrin GmbH – Teterow",
      "type": "Löschungsankündigung",
      "state": "Mecklenburg-Vorpommern",
      "amtsgericht": "Amtsgericht Rostock",
      "registernummer": "HRB 13271",
      "registerart": "HRB",
      "company_name": "Pflegedienst Teterow Schwester Kathrin GmbH",
      "company_seat": "Teterow",
      "details": "19.12.2024 (Bekanntmachungsdatum)\n\nMecklenburg-Vorpommern Amtsgericht Rostock HRB 13271\nLöschungsankündigung\n\nPflegedienst Teterow Schwester Kathrin GmbH\nGesellschaft mit beschränkter Haftung\nTeterow\n\nDas Registergericht beabsichtigt, die im Handelsregister eingetragene Gesellschaft von Amts wegen nach § 394 FamFG zu löschen. Die Frist zur Erhebung eines Widerspruchs gegen die beabsichtigte Löschung wird auf 1  Monat festgesetzt."
    },
    {
      "date": "2024-12-19",
      "id": "96953",
      "original_text": "Sonstige Registerbekanntmachung\nMecklenburg-Vorpommern Amtsgericht Schwerin HRB 4301\nNeukloster Wohnungsgesellschaft mbH – Neukloster",
      "type": "Sonstige Registerbekanntmachung",
      "state": "Mecklenburg-Vorpommern",
      "amtsgericht": "Amtsgericht Schwerin",
      "registernummer": "HRB 4301",
      "registerart": "HRB",
      "company_name": "Neukloster Wohnungsgesellschaft mbH",
      "company_seat": "Neukloster",
      "details": "19.12.2024 (Bekanntmachungsdatum)\n\nMecklenburg-Vorpommern Amtsgericht Schwerin HRB 4301\nSonstige Registerbekanntmachung 19.12.2024 (Eintragungsdatum)\n\nNeukloster Wohnungsgesellschaft mbH\nGesellschaft mit beschränkter Haftung\nNeukloster\n\nEine Liste der Mitglieder des Aufsichtsrats ist zum Handelsregister eingereicht worden."
    },
    {
      "date": "2024-12-19",
      "id": "96954",
      "original_text": "Sonstige Registerbekanntmachung\nBerlin Amtsgericht Berlin (Charlottenburg) HRB 185321\nLCP Rechtsanwaltsgesellschaft mbH – Berlin",
      "type": "Sonstige Registerbekanntmachung",
      "state": "Berlin",
      "amtsgericht": "Amtsgericht Berlin (Charlottenburg)",
      "registernummer": "HRB 185321",
      "registerart": "HRB",
      "company_name": "LCP Rechtsanwaltsgesellschaft mbH",
      "company_seat": "Berlin",
      "details": "19.12.2024 (Bekanntmachungsdatum)\n\nBerlin Amtsgericht Berlin (Charlottenburg) HRB 185321\nSonstige Registerbekanntmachung\n\nLCP Rechtsanwaltsgesellschaft mbH\nGesellschaft mit beschränkter Haftung\nBerlin\n\nAls nicht eingetragen wird veröffentlicht:  Es ist beabsichtigt, gemäß § 397 die Nichtigkeit der Gesellschaft einzutragen bzw. gemäß § 399 FamFG den Mangel der Satzung festzustellen. Widerspruchsfrist: 6 Wochen"
    },
    {
      "date": "2024-12-19",
      "id": "96955",
      "original_text": "Löschungsankündigung\nBaden-Württemberg Amtsgericht Stuttgart HRB 787480\nBAAF GmbH – Talheim",
      "type": "Löschungsankündigung",
      "state": "Baden-Württemberg",
      "amtsgericht": "Amtsgericht Stuttgart",
      "registernummer": "HRB 787480",
      "registerart": "HRB",
      "company_name": "BAAF GmbH",
      "company_seat": "Talheim",
      "details": "19.12.2024 (Bekanntmachungsdatum)\n\nBaden-Württemberg Amtsgericht Stuttgart HRB 787480\nLöschungsankündigung\n\nBAAF GmbH\nGesellschaft mit beschränkter Haftung\nTalheim\n\nAls nicht eingetragen wird bekanntgemacht:\nDas Gericht beabsichtigt, die Gesellschaft wegen Vermögenslosigkeit im Handelsregister von Amts wegen nach § 394 FamFG zu löschen. Die Frist zur Geltendmachung eines Widerspruchs gegen die beabsichtigte Löschung ist auf zwei Monate ab Veröffentlichung bestimmt."
    },
    {
      "date": "2024-12-19",
      "id": "96956",
      "original_text": "Löschungsankündigung\nBerlin Amtsgericht Berlin (Charlottenburg) HRB 82266\nAHA Grundstücksentwicklungs GmbH – Berlin",
      "type": "Löschungsankündigung",
      "state": "Berlin",
      "amtsgericht": "Amtsgericht Berlin (Charlottenburg)",
      "registernummer": "HRB 82266",
      "registerart": "HRB",
      "company_name": "AHA Grundstücksentwicklungs GmbH",
      "company_seat": "Berlin",
      "details": "19.12.2024 (Bekanntmachungsdatum)\n\nBerlin Amtsgericht Berlin (Charlottenburg) HRB 82266\nLöschungsankündigung\n\nAHA Grundstücksentwicklungs GmbH\nGesellschaft mit beschränkter Haftung\nBerlin\n\nBei der nachstehenden Gesellschaft wird das Amtslöschungsverfahren gemäß § 394 FamFG eingeleitet. Widerspruchsfrist 6 Wochen"
    },
    {
      "date": "2024-12-19",
      "id": "96957",
      "original_text": "Löschungsankündigung\nSachsen-Anhalt Amtsgericht Stendal HRA 31623\nWERTCYCLINA Wertstoffrecyclinganlage LEUNA GmbH & Co. KG Leuna – Leuna",
      "type": "Löschungsankündigung",
      "state": "Sachsen-Anhalt",
      "amtsgericht": "Amtsgericht Stendal",
      "registernummer": "HRA 31623",
      "registerart": "HRA",
      "company_name": "WERTCYCLINA Wertstoffrecyclinganlage LEUNA GmbH & Co. KG Leuna",
      "company_seat": "Leuna",
      "details": "19.12.2024 (Bekanntmachungsdatum)\n\nSachsen-Anhalt Amtsgericht Stendal HRA 31623\nLöschungsankündigung\n\nWERTCYCLINA Wertstoffrecyclinganlage LEUNA GmbH & Co. KG Leuna\nKommanditgesellschaft\nLeuna\n\nDas Registergericht beabsichtigt, nachfolgende im Handelregister eingetragenen Firmen von Amts wegen nach § 394 FamFG zu löschen. Die Frist zu Erhebung eines Widerspruchs wird auf drei Monate festgesetzt."
    },
    {
      "date": "2024-12-19",
      "id": "96958",
      "original_text": "Registerbekanntmachung nach dem Umwandlungsgesetz\nMecklenburg-Vorpommern Amtsgericht Schwerin GnR 470\nMarktfruchtanbau-Genossenschaft Eldena e.G. – Eldena",
      "type": "Registerbekanntmachung nach dem Umwandlungsgesetz",
      "state": "Mecklenburg-Vorpommern",
      "amtsgericht": "Amtsgericht Schwerin",
      "registernummer": "GnR 470",
      "registerart": "GnR",
      "company_name": "Marktfruchtanbau-Genossenschaft Eldena e.G.",
      "company_seat": "Eldena",
      "details": "19.12.2024 (Bekanntmachungsdatum)\n\nMecklenburg-Vorpommern Amtsgericht Schwerin GnR 470\nRegisterbekanntmachung nach dem Umwandlungsgesetz 19.12.2024 (Eintragungsdatum)\n\nMarktfruchtanbau-Genossenschaft Eldena e.G.\neingetragene Genossenschaft\nEldena\n\nAls nicht eingetragen wird veröffentlicht: Den Gläubigern der an der Verschmelzung beteiligten Rechtsträger ist, wenn sie binnen sechs Monaten nach dem Tag, an dem die Eintragung der Verschmelzung in das Register des Sitzes desjenigen Rechtsträgers, dessen Gläubiger sie sind, nach § 19 Abs. 3 UmwG als bekannt gemacht gilt,\nihren Anspruch nach Grund und Höhe schriftlich anmelden, Sicherheit zu leisten, soweit sie nicht Befriedigung verlangen können. Dieses Recht steht den Gläubigern jedoch nur zu, wenn sie glaubhaft machen, dass durch die Verschmelzung die Erfüllung der Forderung gefährdet wird."
    },
    {
      "date": "2024-12-19",
      "id": "96959",
      "original_text": "Löschungsankündigung\nHamburg Amtsgericht Hamburg HRA 85390\nALCOR Film + TV GmbH & Co. Produktions KG – Hamburg",
      "type": "Löschungsankündigung",
      "state": "Hamburg",
      "amtsgericht": "Amtsgericht Hamburg",
      "registernummer": "HRA 85390",
      "registerart": "HRA",
      "company_name": "ALCOR Film + TV GmbH & Co. Produktions KG",
      "company_seat": "Hamburg",
      "details": "19.12.2024 (Bekanntmachungsdatum)\n\nHamburg Amtsgericht Hamburg HRA 85390\nLöschungsankündigung\n\nALCOR Film + TV GmbH & Co. Produktions KG\nKommanditgesellschaft\nHamburg\n\nDas Registergericht beabsichtigt, die im Handelsregister eingetragene Gesellschaft von Amts wegen nach § 394 FamFG zu löschen. Die Frist zur Erhebung eines Widerspruchs gegen die beabsichtigte Löschung wird auf 3 Monate festgesetzt."
    },
    {
      "date": "2024-12-19",
      "id": "96960",
      "original_text": "Einreichung neuer Dokumente\nThüringen Amtsgericht Jena HRB 520983\ndotSource SE – Jena",
      "type": "Einreichung neuer Dokumente",
      "state": "Thüringen",
      "amtsgericht": "Amtsgericht Jena",
      "registernummer": "HRB 520983",
      "registerart": "HRB",
      "company_name": "dotSource SE",
      "company_seat": "Jena",
      "details": "19.12.2024 (Bekanntmachungsdatum)\n\nThüringen Amtsgericht Jena HRB 520983\nEinreichung neuer Dokumente 19.12.2024 (Eintragungsdatum)\n\ndotSource SE\nEuropäische Aktiengesellschaft (SE)\nJena\n\nBekanntmachung gem. § 106 AktG i.V.m. § 46 Abs.1 SEAG: Aufgrund einer Veränderung in den Personen der Verwaltungsratsmitglieder ist durch den geschäftsführenden Dirketor eine neue Liste zum Handelsregister eingereicht worden."
    },
    {
      "date": "2024-12-19",
      "id": "96961",
      "original_text": "Einreichung neuer Dokumente\nThüringen Amtsgericht Jena HRB 520983\ndotSource SE – Jena",
      "type": "Einreichung neuer Dokumente",
      "state": "Thüringen",
      "amtsgericht": "Amtsgericht Jena",
      "registernummer": "HRB 520983",
      "registerart": "HRB",
      "company_name": "dotSource SE",
      "company_seat": "Jena",
      "details": "19.12.2024 (Bekanntmachungsdatum)\n\nThüringen Amtsgericht Jena HRB 520983\nEinreichung neuer Dokumente 19.12.2024 (Eintragungsdatum)\n\ndotSource SE\nEuropäische Aktiengesellschaft (SE)\nJena\n\nBekanntmachung gem. § 106 AktG i.V.m. § 46 Abs.1 SEAG : Aufgrund einer Veränderung in den Personen der Verwaltungsratsmitglieder ist durch den geschäftsführenden Direktor eine neue Liste zum Handelsregister eingereicht worden."
    },
    {
      "date": "2024-12-19",
      "id": "96962",
      "original_text": "Einreichung neuer Dokumente\nThüringen Amtsgericht Jena HRB 103660\nKaisersaal Erfurt GmbH – Erfurt",
      "type": "Einreichung neuer Dokumente",
      "state": "Thüringen",
      "amtsgericht": "Amtsgericht Jena",
      "registernummer": "HRB 103660",
      "registerart": "HRB",
      "company_name": "Kaisersaal Erfurt GmbH",
      "company_seat": "Erfurt",
      "details": "19.12.2024 (Bekanntmachungsdatum)\n\nThüringen Amtsgericht Jena HRB 103660\nEinreichung neuer Dokumente\n\nKaisersaal Erfurt GmbH\nGesellschaft mit beschränkter Haftung\nErfurt\n\nBekanntmachung gem. § 52 Abs. 3 Satz 2 GmbHG: Aufgrund einer Veränderung in den Personen der Aufsichtsratsmitglieder ist durch die Geschäftsführer eine neue Liste zum Handelsregister eingereicht worden."
    },
    {
      "date": "2024-12-19",
      "id": "96963",
      "original_text": "Löschungsankündigung\nThüringen Amtsgericht Jena HRB 509011\nfalk PERSONALDIENSTLEISTUNGEN GmbH – Eisenach",
      "type": "Löschungsankündigung",
      "state": "Thüringen",
      "amtsgericht": "Amtsgericht Jena",
      "registernummer": "HRB 509011",
      "registerart": "HRB",
      "company_name": "falk PERSONALDIENSTLEISTUNGEN GmbH",
      "company_seat": "Eisenach",
      "details": "19.12.2024 (Bekanntmachungsdatum)\n\nThüringen Amtsgericht Jena HRB 509011\nLöschungsankündigung\n\nfalk PERSONALDIENSTLEISTUNGEN GmbH\nGesellschaft mit beschränkter Haftung\nEisenach\n\nDas Registergericht beabsichtigt, die im Handelsregister eingetragene Gesellschaft wegen Vermögenslosigkeit nach § 394 FamFG von Amts wegen zu löschen. Die Frist zur Erhebung eines Widerspruchs gegen die beabsichtigte Löschung wird auf 6 Wochen festgesetzt."
    },
    {
      "date": "2024-12-19",
      "id": "96964",
      "original_text": "Registerbekanntmachung nach dem Umwandlungsgesetz\nThüringen Amtsgericht Jena HRA 506655\nWerner Fenn Bagger- und Fuhrunternehmen e. K. – Großbreitenbach",
      "type": "Registerbekanntmachung nach dem Umwandlungsgesetz",
      "state": "Thüringen",
      "amtsgericht": "Amtsgericht Jena",
      "registernummer": "HRA 506655",
      "registerart": "HRA",
      "company_name": "Werner Fenn Bagger- und Fuhrunternehmen e. K.",
      "company_seat": "Großbreitenbach",
      "details": "19.12.2024 (Bekanntmachungsdatum)\n\nThüringen Amtsgericht Jena HRA 506655\nRegisterbekanntmachung nach dem Umwandlungsgesetz 19.12.2024 (Eintragungsdatum)\n\nWerner Fenn Bagger- und Fuhrunternehmen e. K.\nEinzelkaufmann / Einzelkauffrau\nGroßbreitenbach\n\nNicht eingetragen: Den Gläubigern der an der Ausgliederung beteiligten Rechtsträger, ist wenn sie binnen sechs Monaten nach dem Tag, an dem die Eintragung der Ausgliederung in das Register des Sitzes desjenigen Rechtsträgers, dessen Gläubiger sie sind, nach §§125, 19 Abs. 3 UmwG als bekanntgemacht gilt, ihren Anspruch nach Grund und Höhe schriftlich anmelden, Sicherheit zu leisten, soweit sie nicht Befriedigung verlangen können. Dieses Recht steht ihnen jedoch nur zu, wenn sie glaubhaft machen, daß durch die Ausgliederung die Erfüllung ihrer Forderung gefährdet wird."
    },
    {
      "date": "2024-12-19",
      "id": "96965",
      "original_text": "Registerbekanntmachung nach dem Umwandlungsgesetz\nThüringen Amtsgericht Jena HRA 506810\nFenn Vermietung und Service GmbH & Co. KG – Großbreitenbach",
      "type": "Registerbekanntmachung nach dem Umwandlungsgesetz",
      "state": "Thüringen",
      "amtsgericht": "Amtsgericht Jena",
      "registernummer": "HRA 506810",
      "registerart": "HRA",
      "company_name": "Fenn Vermietung und Service GmbH & Co. KG",
      "company_seat": "Großbreitenbach",
      "details": "19.12.2024 (Bekanntmachungsdatum)\n\nThüringen Amtsgericht Jena HRA 506810\nRegisterbekanntmachung nach dem Umwandlungsgesetz 19.12.2024 (Eintragungsdatum)\n\nFenn Vermietung und Service GmbH & Co. KG\nKommanditgesellschaft\nGroßbreitenbach\n\nNicht eingetragen: Den Gläubigern der an der Ausgliederung beteiligten Rechtsträger, ist wenn sie binnen sechs Monaten nach dem Tag, an dem die Eintragung der Ausgliederung in das Register des Sitzes desjenigen Rechtsträgers, dessen Gläubiger sie sind, nach §§125, 19 Abs. 3 UmwG als bekanntgemacht gilt, ihren Anspruch nach Grund und Höhe schriftlich anmelden, Sicherheit zu leisten, soweit sie nicht Befriedigung verlangen können. Dieses Recht steht ihnen jedoch nur zu, wenn sie glaubhaft machen, daß durch die Ausgliederung die Erfüllung ihrer Forderung gefährdet wird."
    },
    {
      "date": "2024-12-19",
      "id": "96966",
      "original_text": "Registerbekanntmachung nach dem Umwandlungsgesetz\nThüringen Amtsgericht Jena HRB 518190\nFilWa GmbH – Bad Berka",
      "type": "Registerbekanntmachung nach dem Umwandlungsgesetz",
      "state": "Thüringen",
      "amtsgericht": "Amtsgericht Jena",
      "registernummer": "HRB 518190",
      "registerart": "HRB",
      "company_name": "FilWa GmbH",
      "company_seat": "Bad Berka",
      "details": "19.12.2024 (Bekanntmachungsdatum)\n\nThüringen Amtsgericht Jena HRB 518190\nRegisterbekanntmachung nach dem Umwandlungsgesetz 19.12.2024 (Eintragungsdatum)\n\nFilWa GmbH\nGesellschaft mit beschränkter Haftung\nBad Berka\n\nNicht eingetragen: Den Gläubigern des formwechselnden  Rechtsträgers, ist wenn sie binnen sechs Monaten nach dem Tag, an dem die Eintragung des Formwechsels nach § 201 UmwG als bekanntgemacht gilt, ihren Anspruch nach Grund und Höhe schriftlich anmelden, Sicherheit zu leisten, soweit sie nicht Befriedigung verlangen können. Dieses Recht steht ihnen jedoch nur zu, wenn sie glaubhaft machen, daß durch den Formwechsel die Erfüllung ihrer Forderung gefährdet wird."
    },
    {
      "date": "2024-12-19",
      "id": "96967",
      "original_text": "Einreichung neuer Dokumente\nThüringen Amtsgericht Jena HRB 400696\nEichsfeldwerke GmbH – Heilbad Heiligenstadt",
      "type": "Einreichung neuer Dokumente",
      "state": "Thüringen",
      "amtsgericht": "Amtsgericht Jena",
      "registernummer": "HRB 400696",
      "registerart": "HRB",
      "company_name": "Eichsfeldwerke GmbH",
      "company_seat": "Heilbad Heiligenstadt",
      "details": "19.12.2024 (Bekanntmachungsdatum)\n\nThüringen Amtsgericht Jena HRB 400696\nEinreichung neuer Dokumente\n\nEichsfeldwerke GmbH\nGesellschaft mit beschränkter Haftung\nHeilbad Heiligenstadt\n\nBekanntmachung gem. § 52 Abs. 3 Satz 2 GmbHG: Aufgrund einer Veränderung in den Personen der Aufsichtsratsmitglieder ist durch die Geschäftsführer eine neue Liste zum Handelsregister eingereicht worden."
    },
    {
      "date": "2024-12-19",
      "id": "96968",
      "original_text": "Registerbekanntmachung nach dem Umwandlungsgesetz\nSchleswig-Holstein Amtsgericht Lübeck HRB 16371\nMeyer Menü Verwaltungs-GmbH – Siek",
      "type": "Registerbekanntmachung nach dem Umwandlungsgesetz",
      "state": "Schleswig-Holstein",
      "amtsgericht": "Amtsgericht Lübeck",
      "registernummer": "HRB 16371",
      "registerart": "HRB",
      "company_name": "Meyer Menü Verwaltungs-GmbH",
      "company_seat": "Siek",
      "details": "19.12.2024 (Bekanntmachungsdatum)\n\nSchleswig-Holstein Amtsgericht Lübeck HRB 16371\nRegisterbekanntmachung nach dem Umwandlungsgesetz 19.12.2024 (Eintragungsdatum)\n\nMeyer Menü Verwaltungs-GmbH\nGesellschaft mit beschränkter Haftung\nSiek\n\nZu Eintragungsnummer 2 vom 19.12.2024 wird als nicht eingetragen veröffentlicht:\nDen Gläubigern der an der Verschmelzung beteiligten Rechtsträger ist, wenn sie binnen sechs Monaten nach dem Tag, an dem die Eintragung der Verschmelzung in das Register des Sitzes desjenigen Rechtsträgers, dessen Gläubiger sie sind, als bekannt gemacht gilt, ihren Anspruch nach Grund und Höhe schriftlich anmelden, Sicherheit zu leisten, soweit sie nicht Befriedigung verlangen können. Dieses Recht steht den Gläubigern jedoch nur zu, wenn sie glaubhaft machen, dass durch die Verschmelzung die Erfüllung ihrer Forderung gefährdet wird."
    },
    {
      "date": "2024-12-19",
      "id": "96969",
      "original_text": "Registerbekanntmachung nach dem Umwandlungsgesetz\nBaden-Württemberg Amtsgericht Stuttgart HRB 785319\nLeNi Houses Immobilien GmbH – Lichtenwald",
      "type": "Registerbekanntmachung nach dem Umwandlungsgesetz",
      "state": "Baden-Württemberg",
      "amtsgericht": "Amtsgericht Stuttgart",
      "registernummer": "HRB 785319",
      "registerart": "HRB",
      "company_name": "LeNi Houses Immobilien GmbH",
      "company_seat": "Lichtenwald",
      "details": "19.12.2024 (Bekanntmachungsdatum)\n\nBaden-Württemberg Amtsgericht Stuttgart HRB 785319\nRegisterbekanntmachung nach dem Umwandlungsgesetz 19.12.2024 (Eintragungsdatum)\n\nLeNi Houses Immobilien GmbH\nGesellschaft mit beschränkter Haftung\nLichtenwald\n\nAls nicht eingetragen wird bekanntgemacht:\nDen Gläubigern der an der Verschmelzung beteiligten Rechtsträger ist, wenn sie binnen sechs Monaten nach dem Tag, an dem die Eintragung der Verschmelzung in das Register des Sitzes desjenigen Rechtsträgers, dessen Gläubiger sie sind, nach § 19 Abs. 3 UmwG als bekanntgemacht gilt, ihren Anspruch nach Grund und Höhe schriftlich anmelden, Sicherheit zu leisten, soweit sie nicht Befriedigung verlangen können. Dieses Recht steht den Gläubigern jedoch nur zu, wenn sie glaubhaft machen, dass durch die Verschmelzung die Erfüllung ihrer Forderung gefährdet wird."
    },
    {
      "date": "2024-12-19",
      "id": "96970",
      "original_text": "Registerbekanntmachung nach dem Umwandlungsgesetz\nSchleswig-Holstein Amtsgericht Lübeck HRB 25667\nWeißbuchenhof Immobilien GmbH – Schwarzenbek",
      "type": "Registerbekanntmachung nach dem Umwandlungsgesetz",
      "state": "Schleswig-Holstein",
      "amtsgericht": "Amtsgericht Lübeck",
      "registernummer": "HRB 25667",
      "registerart": "HRB",
      "company_name": "Weißbuchenhof Immobilien GmbH",
      "company_seat": "Schwarzenbek",
      "details": "19.12.2024 (Bekanntmachungsdatum)\n\nSchleswig-Holstein Amtsgericht Lübeck HRB 25667\nRegisterbekanntmachung nach dem Umwandlungsgesetz 19.12.2024 (Eintragungsdatum)\n\nWeißbuchenhof Immobilien GmbH\nGesellschaft mit beschränkter Haftung\nSchwarzenbek\n\nZu Eintragungsnummer 1 vom 19.12.2024 wird als nicht eingetragen veröffentlicht:  Den Gläubigern ist, wenn sie binnen sechs Monaten nach dem Tag, an dem die Eintragung der Umwandlung als bekannt gemacht gilt, ihren Anspruch nach Grund und Höhe schriftlich anmelden, Sicherheit zu leisten, soweit sie nicht Befriedigung verlangen können. Dieses Recht steht den Gläubigern jedoch nur zu, wenn sie glaubhaft machen, dass durch die Umwandlung die Erfüllung ihrer Forderung gefährdet wird."
    },
    {
      "date": "2024-12-19",
      "id": "96971",
      "original_text": "Registerbekanntmachung nach dem Umwandlungsgesetz\nBaden-Württemberg Amtsgericht Stuttgart HRA 730518\nJetter Beteiligung GmbH & Co. KG. – Rosenfeld",
      "type": "Registerbekanntmachung nach dem Umwandlungsgesetz",
      "state": "Baden-Württemberg",
      "amtsgericht": "Amtsgericht Stuttgart",
      "registernummer": "HRA 730518",
      "registerart": "HRA",
      "company_name": "Jetter Beteiligung GmbH & Co. KG.",
      "company_seat": "Rosenfeld",
      "details": "19.12.2024 (Bekanntmachungsdatum)\n\nBaden-Württemberg Amtsgericht Stuttgart HRA 730518\nRegisterbekanntmachung nach dem Umwandlungsgesetz 19.12.2024 (Eintragungsdatum)\n\nJetter Beteiligung GmbH & Co. KG.\nKommanditgesellschaft\nRosenfeld\n\nAls nicht eingetragen wird bekanntgemacht:\nDen Gläubigern der an der Verschmelzung beteiligten Rechtsträger ist, wenn sie binnen sechs Monaten nach dem Tag, an dem die Eintragung der Verschmelzung in das Register des Sitzes desjenigen Rechtsträgers, dessen Gläubiger sie sind, nach § 19 Abs. 3 UmwG als bekanntgemacht gilt, ihren Anspruch nach Grund und Höhe schriftlich anmelden, Sicherheit zu leisten, soweit sie nicht Befriedigung verlangen können. Dieses Recht steht den Gläubigern jedoch nur zu, wenn sie glaubhaft machen, dass durch die Verschmelzung die Erfüllung ihrer Forderung gefährdet wird."
    },
    {
      "date": "2024-12-19",
      "id": "96972",
      "original_text": "Löschungsankündigung\nSchleswig-Holstein Amtsgericht Lübeck HRB 21068\nRobin Logistik GmbH – Glinde",
      "type": "Löschungsankündigung",
      "state": "Schleswig-Holstein",
      "amtsgericht": "Amtsgericht Lübeck",
      "registernummer": "HRB 21068",
      "registerart": "HRB",
      "company_name": "Robin Logistik GmbH",
      "company_seat": "Glinde",
      "details": "19.12.2024 (Bekanntmachungsdatum)\n\nSchleswig-Holstein Amtsgericht Lübeck HRB 21068\nLöschungsankündigung\n\nRobin Logistik GmbH\nGesellschaft mit beschränkter Haftung\nGlinde\n\nHerrn\nJoszef Bartal\nper VÖ\n\nSehr geehrter Herr Bartal,\n\nin der Handelsregistersache der\nRobin Logistik GmbH\n\nergeben sich aus den mir vorliegenden Unterlagen Anhaltspunkte dafür, dass die Gesellschaft, als deren Geschäftsführer Sie noch eingetragen sind, vermögenslos ist:\n\nEs ist daher beabsichtigt, die Gesellschaft wegen Vermögenslosigkeit gemäß § 394 FamFG zu löschen.\n\nEs wird eine Frist von   drei Monaten   zur Geltendmachung eines Widerspruchs gegen die Löschung bestimmt, § 394 Abs. 2 S. 1 FamFG.\n\nNach Fristablauf ohne Widerspruch von Ihnen oder anderer Seite wird die Gesellschaft gelöscht.\n\nMit freundlichen Grüßen\n\nSchuppenhauer\nDipl.-Rechtspflegerin (FH)"
    },
    {
      "date": "2024-12-19",
      "id": "96973",
      "original_text": "Registerbekanntmachung nach dem Umwandlungsgesetz\nBaden-Württemberg Amtsgericht Freiburg HRB 728904\nAudika Management GmbH – Emmendingen",
      "type": "Registerbekanntmachung nach dem Umwandlungsgesetz",
      "state": "Baden-Württemberg",
      "amtsgericht": "Amtsgericht Freiburg",
      "registernummer": "HRB 728904",
      "registerart": "HRB",
      "company_name": "Audika Management GmbH",
      "company_seat": "Emmendingen",
      "details": "19.12.2024 (Bekanntmachungsdatum)\n\nBaden-Württemberg Amtsgericht Freiburg HRB 728904\nRegisterbekanntmachung nach dem Umwandlungsgesetz 19.12.2024 (Eintragungsdatum)\n\nAudika Management GmbH\nGesellschaft mit beschränkter Haftung\nEmmendingen\n\nDen Gläubigern der an der Verschmelzung beteiligten Rechtsträger ist, wenn sie binnen sechs Monaten nach dem Tag, an dem die Eintragung der Verschmelzung in das Register des Sitzes desjenigen Rechtsträgers, dessen Gläubiger sie sind, nach § 19 Abs. 3 UmwG als bekanntgemacht gilt, ihren Anspruch nach Grund und Höhe schriftlich anmelden, Sicherheit zu leisten, soweit sie nicht Befriedigung verlangen können. Dieses Recht steht den Gläubigern jedoch nur zu, wenn sie glaubhaft machen, dass durch die Verschmelzung die Erfüllung ihrer Forderung gefährdet wird."
    },
    {
      "date": "2024-12-19",
      "id": "96974",
      "original_text": "Löschungsankündigung\nBrandenburg Amtsgericht Potsdam HRB 26518\nCONSTRUCT42 GmbH – Potsdam",
      "type": "Löschungsankündigung",
      "state": "Brandenburg",
      "amtsgericht": "Amtsgericht Potsdam",
      "registernummer": "HRB 26518",
      "registerart": "HRB",
      "company_name": "CONSTRUCT42 GmbH",
      "company_seat": "Potsdam",
      "details": "19.12.2024 (Bekanntmachungsdatum)\n\nBrandenburg Amtsgericht Potsdam HRB 26518\nLöschungsankündigung\n\nCONSTRUCT42 GmbH\nGesellschaft mit beschränkter Haftung\nPotsdam\n\nBei der nachstehenden Gesellschaft wird das Amtslöschungsverfahren gemäß § 394 FamFG eingeleitet. Widerspruchsfrist: 8 Wochen"
    },
    {
      "date": "2024-12-19",
      "id": "96975",
      "original_text": "Löschungsankündigung\nBrandenburg Amtsgericht Potsdam HRB 27312\nLeutelt & Schröder Baugesellschaft UG (haftungsbeschränkt) – Brieselang",
      "type": "Löschungsankündigung",
      "state": "Brandenburg",
      "amtsgericht": "Amtsgericht Potsdam",
      "registernummer": "HRB 27312",
      "registerart": "HRB",
      "company_name": "Leutelt & Schröder Baugesellschaft UG (haftungsbeschränkt)",
      "company_seat": "Brieselang",
      "details": "19.12.2024 (Bekanntmachungsdatum)\n\nBrandenburg Amtsgericht Potsdam HRB 27312\nLöschungsankündigung\n\nLeutelt & Schröder Baugesellschaft UG (haftungsbeschränkt)\nGesellschaft mit beschränkter Haftung\nBrieselang\n\nBei der nachstehenden Gesellschaft wird das Amtslöschungsverfahren gemäß § 394 FamFG eingeleitet. Widerspruchsfrist: 8 Wochen."
    },
    {
      "date": "2024-12-19",
      "id": "96976",
      "original_text": "Löschungsankündigung\nSchleswig-Holstein Amtsgericht Lübeck HRB 9071\nCATUM Engineering GmbH – Lübeck",
      "type": "Löschungsankündigung",
      "state": "Schleswig-Holstein",
      "amtsgericht": "Amtsgericht Lübeck",
      "registernummer": "HRB 9071",
      "registerart": "HRB",
      "company_name": "CATUM Engineering GmbH",
      "company_seat": "Lübeck",
      "details": "19.12.2024 (Bekanntmachungsdatum)\n\nSchleswig-Holstein Amtsgericht Lübeck HRB 9071\nLöschungsankündigung\n\nCATUM  Engineering GmbH\nGesellschaft mit beschränkter Haftung\nLübeck\n\nEs ist die Löschung der nachstehenden Gesellschaft wegen Vermögenslosigkeit gemäß § 394 FamFG beabsichtigt."
    },
    {
      "date": "2024-12-19",
      "id": "96977",
      "original_text": "Registerbekanntmachung nach dem Umwandlungsgesetz\nBaden-Württemberg Amtsgericht Stuttgart HRB 782492\nSHD Ingenieure GmbH – Böblingen",
      "type": "Registerbekanntmachung nach dem Umwandlungsgesetz",
      "state": "Baden-Württemberg",
      "amtsgericht": "Amtsgericht Stuttgart",
      "registernummer": "HRB 782492",
      "registerart": "HRB",
      "company_name": "SHD Ingenieure GmbH",
      "company_seat": "Böblingen",
      "details": "19.12.2024 (Bekanntmachungsdatum)\n\nBaden-Württemberg Amtsgericht Stuttgart HRB 782492\nRegisterbekanntmachung nach dem Umwandlungsgesetz 19.12.2024 (Eintragungsdatum)\n\nSHD Ingenieure GmbH\nGesellschaft mit beschränkter Haftung\nBöblingen\n\nAls nicht eingetragen wird bekanntgemacht:\nDen Gläubigern des an dem Formwechsel beteiligten Rechtsträgers ist, wenn sie binnen sechs Monaten nach dem Tag, an dem die Eintragung des Formwechsels in das Register des Sitzes desjenigen Rechtsträgers, dessen Gläubiger sie sind, nach § 19 Abs. 3 UmwG als bekanntgemacht gilt, ihren Anspruch nach Grund und Höhe schriftlich anmelden, Sicherheit zu leisten, soweit sie nicht Befriedigung verlangen können. Dieses Recht steht den Gläubigern jedoch nur zu, wenn sie glaubhaft machen, dass durch den Formwechsel die Erfüllung ihrer Forderung gefährdet wird."
    },
    {
      "date": "2024-12-19",
      "id": "96978",
      "original_text": "Löschungsankündigung\nSchleswig-Holstein Amtsgericht Flensburg HRA 1147 NI\nKarl-Heinz Gehrig Fort- und Weiterbildungsträger – Sylt-Ost/Tinnum",
      "type": "Löschungsankündigung",
      "state": "Schleswig-Holstein",
      "amtsgericht": "Amtsgericht Flensburg",
      "registernummer": "HRA 1147 NI",
      "registerart": "HRA",
      "company_name": "Karl-Heinz Gehrig Fort- und Weiterbildungsträger",
      "company_seat": "Sylt-Ost/Tinnum",
      "details": "19.12.2024 (Bekanntmachungsdatum)\n\nSchleswig-Holstein Amtsgericht Flensburg HRA 1147 NI\nLöschungsankündigung\n\nKarl-Heinz Gehrig Fort- und Weiterbildungsträger\nEinzelkaufmann / Einzelkauffrau\nSylt-Ost/Tinnum\n\nEs ist beabsichtigt, die Firma gemäß § 31 Abs. 2 HGB von Amts wegen zu löschen. Widerspruchsfrist: 3 Monate."
    },
    {
      "date": "2024-12-19",
      "id": "96979",
      "original_text": "Löschungsankündigung\nBerlin Amtsgericht Berlin (Charlottenburg) HRB 150170\nad.agda GmbH – Berlin",
      "type": "Löschungsankündigung",
      "state": "Berlin",
      "amtsgericht": "Amtsgericht Berlin (Charlottenburg)",
      "registernummer": "HRB 150170",
      "registerart": "HRB",
      "company_name": "ad.agda GmbH",
      "company_seat": "Berlin",
      "details": "19.12.2024 (Bekanntmachungsdatum)\n\nBerlin Amtsgericht Berlin (Charlottenburg) HRB 150170\nLöschungsankündigung\n\nad.agda GmbH\nGesellschaft mit beschränkter Haftung\nBerlin\n\nBei der nachstehenden Gesellschaft wird das Amtslöschungsverfahren gemäß § 394 FamFG eingeleitet. Widerspruchsfrist 6 Wochen"
    },
    {
      "date": "2024-12-19",
      "id": "96980",
      "original_text": "Sonstige Registerbekanntmachung\nBerlin Amtsgericht Berlin (Charlottenburg) HRB 225569\nSWZ Dresden Friedrichstadt GmbH – Berlin",
      "type": "Sonstige Registerbekanntmachung",
      "state": "Berlin",
      "amtsgericht": "Amtsgericht Berlin (Charlottenburg)",
      "registernummer": "HRB 225569",
      "registerart": "HRB",
      "company_name": "SWZ Dresden Friedrichstadt GmbH",
      "company_seat": "Berlin",
      "details": "19.12.2024 (Bekanntmachungsdatum)\n\nBerlin Amtsgericht Berlin (Charlottenburg) HRB 225569\nSonstige Registerbekanntmachung 19.12.2024 (Eintragungsdatum)\n\nSWZ Dresden Friedrichstadt GmbH\nGesellschaft mit beschränkter Haftung\nBerlin\n\nAls nicht eingetragen wird veröffentlicht: Der andere Vertragsteil hat den Gläubigern dieses Rechtsträgers, deren Forderungen begründet worden sind, bevor die Eintragung der Beendigung dieses Vertrages in das Handelsregister nach § 10 des Handelsgesetzbuches als bekannt gemacht gilt, Sicherheit zu leisten, wenn sie sich binnen sechs Monaten nach der Bekanntmachung der Eintragung zu diesem Zweck bei ihm melden. Dieses Recht steht den Gläubigern nicht zu, die im Fall des Insolvenzverfahrens ein Recht auf vorzugsweise Befriedigung aus der Deckungsmasse haben, die nach gesetzlicher Vorschrift zu ihrem Schutz errichtet und staatlich überwacht ist."
    },
    {
      "date": "2024-12-19",
      "id": "96981",
      "original_text": "Registerbekanntmachung nach dem Umwandlungsgesetz\nBaden-Württemberg Amtsgericht Stuttgart HRB 776135\nSpecht Holding GmbH – Lichtenwald",
      "type": "Registerbekanntmachung nach dem Umwandlungsgesetz",
      "state": "Baden-Württemberg",
      "amtsgericht": "Amtsgericht Stuttgart",
      "registernummer": "HRB 776135",
      "registerart": "HRB",
      "company_name": "Specht Holding GmbH",
      "company_seat": "Lichtenwald",
      "details": "19.12.2024 (Bekanntmachungsdatum)\n\nBaden-Württemberg Amtsgericht Stuttgart HRB 776135\nRegisterbekanntmachung nach dem Umwandlungsgesetz 19.12.2024 (Eintragungsdatum)\n\nSpecht Holding GmbH\nGesellschaft mit beschränkter Haftung\nLichtenwald\n\nAls nicht eingetragen wird bekanntgemacht:\nDen Gläubigern der an der Verschmelzung beteiligten Rechtsträger ist, wenn sie binnen sechs Monaten nach dem Tag, an dem die Eintragung der Verschmelzung in das Register des Sitzes desjenigen Rechtsträgers, dessen Gläubiger sie sind, nach § 19 Abs. 3 UmwG als bekanntgemacht gilt, ihren Anspruch nach Grund und Höhe schriftlich anmelden, Sicherheit zu leisten, soweit sie nicht Befriedigung verlangen können. Dieses Recht steht den Gläubigern jedoch nur zu, wenn sie glaubhaft machen, dass durch die Verschmelzung die Erfüllung ihrer Forderung gefährdet wird."
    },
    {
      "date": "2024-12-19",
      "id": "96982",
      "original_text": "Einreichung neuer Dokumente\nBaden-Württemberg Amtsgericht Stuttgart HRB 570157\nStadtwerke Schwäbisch Hall GmbH – Schwäbisch Hall",
      "type": "Einreichung neuer Dokumente",
      "state": "Baden-Württemberg",
      "amtsgericht": "Amtsgericht Stuttgart",
      "registernummer": "HRB 570157",
      "registerart": "HRB",
      "company_name": "Stadtwerke Schwäbisch Hall GmbH",
      "company_seat": "Schwäbisch Hall",
      "details": "19.12.2024 (Bekanntmachungsdatum)\n\nBaden-Württemberg Amtsgericht Stuttgart HRB 570157\nEinreichung neuer Dokumente\n\nStadtwerke Schwäbisch Hall GmbH\nGesellschaft mit beschränkter Haftung\nSchwäbisch Hall\n\nDie Gesellschaft hat am 19.12.2024 die Liste über die Zusammensetzung des Aufsichtsrats zum Handelsregister eingereicht."
    },
    {
      "date": "2024-12-19",
      "id": "96983",
      "original_text": "Registerbekanntmachung nach dem Umwandlungsgesetz\nSchleswig-Holstein Amtsgericht Lübeck GsR 501\nWacker & Schirren eGbR – Schwarzenbek",
      "type": "Registerbekanntmachung nach dem Umwandlungsgesetz",
      "state": "Schleswig-Holstein",
      "amtsgericht": "Amtsgericht Lübeck",
      "registernummer": "GsR 501",
      "registerart": "GsR",
      "company_name": "Wacker & Schirren eGbR",
      "company_seat": "Schwarzenbek",
      "details": "19.12.2024 (Bekanntmachungsdatum)\n\nSchleswig-Holstein Amtsgericht Lübeck GsR 501\nRegisterbekanntmachung nach dem Umwandlungsgesetz 19.12.2024 (Eintragungsdatum)\n\nWacker & Schirren eGbR\nGesellschaft bürgerlichen Rechts\nSchwarzenbek\n\nAls nicht eingetragen wird veröffentlicht: Den Gläubigern ist, wenn sie binnen sechs Monaten nach dem Tag, an dem die Eintragung der Umwandlung als bekannt gemacht gilt, ihren Anspruch nach Grund und Höhe schriftlich anmelden, Sicherheit zu leisten, soweit sie nicht Befriedigung verlangen können. Dieses Recht steht den Gläubigern jedoch nur zu, wenn sie glaubhaft machen, dass durch die Umwandlung die Erfüllung ihrer Forderung gefährdet wird."
    },
    {
      "date": "2024-12-19",
      "id": "96984",
      "original_text": "Löschungsankündigung\nMecklenburg-Vorpommern Amtsgericht Schwerin HRB 14784\nDIEMO-Bau GmbH – Granzin",
      "type": "Löschungsankündigung",
      "state": "Mecklenburg-Vorpommern",
      "amtsgericht": "Amtsgericht Schwerin",
      "registernummer": "HRB 14784",
      "registerart": "HRB",
      "company_name": "DIEMO-Bau GmbH",
      "company_seat": "Granzin",
      "details": "19.12.2024 (Bekanntmachungsdatum)\n\nMecklenburg-Vorpommern Amtsgericht Schwerin HRB 14784\nLöschungsankündigung\n\nDIEMO-Bau GmbH\nGesellschaft mit beschränkter Haftung\nGranzin\n\nDas Registergericht beabsichtigt, die im Handelsregister eingetragene Gesellschaft von Amts wegen nach § 394 FamFG zu löschen. Die Frist zur Erhebung eines Widerspruchs gegen die beabsichtigte Löschung wird auf 1Die Gesellschaft hat Gläubigern, deren Forderungen vor dieser Bekanntmachung begründet worden sind, Sicherheit zu leisten, soweit sie nicht Befriedigung verlangen können, wenn sie sich binnen sechs Monaten zu diesem Zweck melden. Monat festgesetzt."
    },
    {
      "date": "2024-12-19",
      "id": "96985",
      "original_text": "Registerbekanntmachung nach dem Umwandlungsgesetz\nSaarland Amtsgericht Saarbrücken HRB 110870\nSFS Immo Wadern GmbH – Wadern",
      "type": "Registerbekanntmachung nach dem Umwandlungsgesetz",
      "state": "Saarland",
      "amtsgericht": "Amtsgericht Saarbrücken",
      "registernummer": "HRB 110870",
      "registerart": "HRB",
      "company_name": "SFS Immo Wadern GmbH",
      "company_seat": "Wadern",
      "details": "19.12.2024 (Bekanntmachungsdatum)\n\nSaarland Amtsgericht Saarbrücken HRB 110870\nRegisterbekanntmachung nach dem Umwandlungsgesetz 19.12.2024 (Eintragungsdatum)\n\nSFS Immo Wadern GmbH\nGesellschaft mit beschränkter Haftung\nWadern\n\nAls nicht eingetragen wird bekannt gemacht: Den Gläubigern der an der formwechselnden Umwandlung beteiligten Gesellschaften ist, wenn sie binnen sechs Monaten nach dem Tag, an dem die Eintragung der formwechselnden Umwandlung in das Register des Sitzes desjenigen Rechtsträgers, dessen Gläubiger sie sind, nach § 19 Absatz 3 UmwG bekannt gemacht worden ist, ihren Anspruch nach Grund und Höhe schriftlich anmelden, Sicherheit zu leisten, soweit sie nicht Befriedigung verlangen können. Dieses Recht steht den Gläubigern jedoch nur zu, wenn sie glaubhaft machen, dass durch die formwechselnden Umwandlung die Erfüllung ihrer Forderung gefährdet wird."
    },
    {
      "date": "2024-12-19",
      "id": "96986",
      "original_text": "Registerbekanntmachung nach dem Umwandlungsgesetz\nSaarland Amtsgericht Saarbrücken GsR 94\nSFS Immobilien eGbR – Wadern",
      "type": "Registerbekanntmachung nach dem Umwandlungsgesetz",
      "state": "Saarland",
      "amtsgericht": "Amtsgericht Saarbrücken",
      "registernummer": "GsR 94",
      "registerart": "GsR",
      "company_name": "SFS Immobilien eGbR",
      "company_seat": "Wadern",
      "details": "19.12.2024 (Bekanntmachungsdatum)\n\nSaarland Amtsgericht Saarbrücken GsR 94\nRegisterbekanntmachung nach dem Umwandlungsgesetz 19.12.2024 (Eintragungsdatum)\n\nSFS Immobilien eGbR\nGesellschaft bürgerlichen Rechts\nWadern\n\nAls nicht eingetragen wird bekannt gemacht: Den Gläubigern der an der formwechselnden Umwandlung beteiligten Gesellschaften ist, wenn sie binnen sechs Monaten nach dem Tag, an dem die Eintragung der formwechselnden Umwandlung in das Register des Sitzes desjenigen Rechtsträgers, dessen Gläubiger sie sind, nach § 19 Absatz 3 UmwG bekannt gemacht worden ist, ihren Anspruch nach Grund und Höhe schriftlich anmelden, Sicherheit zu leisten, soweit sie nicht Befriedigung verlangen können. Dieses Recht steht den Gläubigern jedoch nur zu, wenn sie glaubhaft machen, dass durch die formwechselnden Umwandlung die Erfüllung ihrer Forderung gefährdet wird."
    },
    {
      "date": "2024-12-19",
      "id": "96987",
      "original_text": "Einreichung neuer Dokumente\nSachsen-Anhalt Amtsgericht Stendal HRB 5521\nTechnologiePark Mitteldeutschland Servicegesellschaft TMS mbH – Bitterfeld-Wolfen",
      "type": "Einreichung neuer Dokumente",
      "state": "Sachsen-Anhalt",
      "amtsgericht": "Amtsgericht Stendal",
      "registernummer": "HRB 5521",
      "registerart": "HRB",
      "company_name": "TechnologiePark Mitteldeutschland Servicegesellschaft TMS mbH",
      "company_seat": "Bitterfeld-Wolfen",
      "details": "19.12.2024 (Bekanntmachungsdatum)\n\nSachsen-Anhalt Amtsgericht Stendal HRB 5521\nEinreichung neuer Dokumente\n\nTechnologiePark Mitteldeutschland Servicegesellschaft TMS mbH\nGesellschaft mit beschränkter Haftung\nBitterfeld-Wolfen\n\nEine Liste der Mitglieder des Aufsichtsrates wurde zum Handelsregister eingereicht."
    },
    {
      "date": "2024-12-19",
      "id": "96988",
      "original_text": "Einreichung neuer Dokumente\nBaden-Württemberg Amtsgericht Stuttgart HRB 741544\nWERU GmbH – Rudersberg",
      "type": "Einreichung neuer Dokumente",
      "state": "Baden-Württemberg",
      "amtsgericht": "Amtsgericht Stuttgart",
      "registernummer": "HRB 741544",
      "registerart": "HRB",
      "company_name": "WERU GmbH",
      "company_seat": "Rudersberg",
      "details": "19.12.2024 (Bekanntmachungsdatum)\n\nBaden-Württemberg Amtsgericht Stuttgart HRB 741544\nEinreichung neuer Dokumente\n\nWERU GmbH\nGesellschaft mit beschränkter Haftung\nRudersberg\n\nDie Gesellschaft hat am 18.12.2024 die Liste über die Zusammensetzung des Aufsichtsrats zum Handelsregister eingereicht."
    },
    {
      "date": "2024-12-19",
      "id": "96989",
      "original_text": "Registerbekanntmachung nach dem Umwandlungsgesetz\nBaden-Württemberg Amtsgericht Mannheim HRB 511819\nFrank & Weimann GmbH Steuerberatungsgesellschaft – Pforzheim",
      "type": "Registerbekanntmachung nach dem Umwandlungsgesetz",
      "state": "Baden-Württemberg",
      "amtsgericht": "Amtsgericht Mannheim",
      "registernummer": "HRB 511819",
      "registerart": "HRB",
      "company_name": "Frank & Weimann GmbH Steuerberatungsgesellschaft",
      "company_seat": "Pforzheim",
      "details": "19.12.2024 (Bekanntmachungsdatum)\n\nBaden-Württemberg Amtsgericht Mannheim HRB 511819\nRegisterbekanntmachung nach dem Umwandlungsgesetz 19.12.2024 (Eintragungsdatum)\n\nFrank & Weimann GmbH Steuerberatungsgesellschaft\nGesellschaft mit beschränkter Haftung\nPforzheim\n\nAls nicht eingetragen wird bekanntgemacht: Den Gläubigern der an der Aufspaltung beteiligten Rechtsträger ist, wenn sie binnen sechs Monaten nach dem Tag, an dem die Eintragung der Aufspaltung in das Register des Sitzes desjenigen Rechtsträgers, dessen Gläubiger sie sind, nach § 19 Abs. 3 UmwG als bekanntgemacht gilt, ihren Anspruch nach Grund und Höhe schriftlich anmelden, Sicherheit zu leisten, soweit sie nicht Befriedigung verlangen können. Dieses Recht steht den Gläubigern jedoch nur zu, wenn sie glaubhaft machen, dass durch die Aufspaltung die Erfüllung ihrer Forderung gefährdet wird."
    },
    {
      "date": "2024-12-19",
      "id": "96990",
      "original_text": "Einreichung neuer Dokumente\nSachsen-Anhalt Amtsgericht Stendal HRB 11090\nWIWOG Wittenberger Wohnungsbaugesellschaft mbH – Wittenberg",
      "type": "Einreichung neuer Dokumente",
      "state": "Sachsen-Anhalt",
      "amtsgericht": "Amtsgericht Stendal",
      "registernummer": "HRB 11090",
      "registerart": "HRB",
      "company_name": "WIWOG Wittenberger Wohnungsbaugesellschaft mbH",
      "company_seat": "Wittenberg",
      "details": "19.12.2024 (Bekanntmachungsdatum)\n\nSachsen-Anhalt Amtsgericht Stendal HRB 11090\nEinreichung neuer Dokumente\n\nWIWOG Wittenberger Wohnungsbaugesellschaft mbH\nGesellschaft mit beschränkter Haftung\nWittenberg\n\nEine Liste der Mitglieder des Aufsichtsrates wurde zum Handelsregister eingereicht."
    },
    {
      "date": "2024-12-19",
      "id": "96991",
      "original_text": "Einreichung neuer Dokumente\nBaden-Württemberg Amtsgericht Mannheim HRB 100565\nKerntechnische Entsorgung Karlsruhe GmbH – Eggenstein-Leopoldshafen",
      "type": "Einreichung neuer Dokumente",
      "state": "Baden-Württemberg",
      "amtsgericht": "Amtsgericht Mannheim",
      "registernummer": "HRB 100565",
      "registerart": "HRB",
      "company_name": "Kerntechnische Entsorgung Karlsruhe GmbH",
      "company_seat": "Eggenstein-Leopoldshafen",
      "details": "19.12.2024 (Bekanntmachungsdatum)\n\nBaden-Württemberg Amtsgericht Mannheim HRB 100565\nEinreichung neuer Dokumente\n\nKerntechnische Entsorgung Karlsruhe GmbH\nGesellschaft mit beschränkter Haftung\nEggenstein-Leopoldshafen\n\nDie Gesellschaft hat am 16.12.2024 die Liste über die Zusammensetzung des Aufsichtsrats zum Handelsregister eingereicht."
    },
    {
      "date": "2024-12-19",
      "id": "96992",
      "original_text": "Löschungsankündigung\nBaden-Württemberg Amtsgericht Stuttgart HRA 471022\nStimmler GmbH & Co. KG – Rottweil",
      "type": "Löschungsankündigung",
      "state": "Baden-Württemberg",
      "amtsgericht": "Amtsgericht Stuttgart",
      "registernummer": "HRA 471022",
      "registerart": "HRA",
      "company_name": "Stimmler GmbH & Co. KG",
      "company_seat": "Rottweil",
      "details": "19.12.2024 (Bekanntmachungsdatum)\n\nBaden-Württemberg Amtsgericht Stuttgart HRA 471022\nLöschungsankündigung\n\nStimmler GmbH & Co. KG\nKommanditgesellschaft\nRottweil\n\nAls nicht eingetragen wird bekanntgemacht:\nDas Gericht beabsichtigt, die Gesellschaft wegen Vermögenslosigkeit im Handelsregister von Amts wegen nach § 394 FamFG zu löschen. Die Frist zur Geltendmachung eines Widerspruchs gegen die beabsichtigte Löschung ist auf zwei Monate ab Veröffentlichung bestimmt."
    },
    {
      "date": "2024-12-19",
      "id": "96993",
      "original_text": "Registerbekanntmachung nach dem Umwandlungsgesetz\nBaden-Württemberg Amtsgericht Freiburg HRA 471526\nMediClin GmbH & Co. KG – Offenburg",
      "type": "Registerbekanntmachung nach dem Umwandlungsgesetz",
      "state": "Baden-Württemberg",
      "amtsgericht": "Amtsgericht Freiburg",
      "registernummer": "HRA 471526",
      "registerart": "HRA",
      "company_name": "MediClin GmbH & Co. KG",
      "company_seat": "Offenburg",
      "details": "19.12.2024 (Bekanntmachungsdatum)\n\nBaden-Württemberg Amtsgericht Freiburg HRA 471526\nRegisterbekanntmachung nach dem Umwandlungsgesetz 19.12.2024 (Eintragungsdatum)\n\nMediClin GmbH & Co. KG\nKommanditgesellschaft\nOffenburg\n\nAls nicht eingetragen wird bekanntgemacht:\nDen Gläubigern der an der Abspaltung beteiligten Rechtsträger ist, wenn sie binnen sechs Monaten nach dem Tag, an dem die Eintragung der Abspaltung in das Register des Sitzes desjenigen Rechtsträgers, dessen Gläubiger sie sind, nach § 19 Abs. 3 UmwG als bekanntgemacht gilt, ihren Anspruch nach Grund und Höhe schriftlich anmelden, Sicherheit zu leisten, soweit sie nicht Befriedigung verlangen können. Dieses Recht steht den Gläubigern jedoch nur zu, wenn sie glaubhaft machen, dass durch die Abspaltung die Erfüllung ihrer Forderung gefährdet wird."
    },
    {
      "date": "2024-12-19",
      "id": "96994",
      "original_text": "Registerbekanntmachung nach dem Umwandlungsgesetz\nBaden-Württemberg Amtsgericht Freiburg HRB 728524\nMediClin BAV GmbH – Offenburg",
      "type": "Registerbekanntmachung nach dem Umwandlungsgesetz",
      "state": "Baden-Württemberg",
      "amtsgericht": "Amtsgericht Freiburg",
      "registernummer": "HRB 728524",
      "registerart": "HRB",
      "company_name": "MediClin BAV GmbH",
      "company_seat": "Offenburg",
      "details": "19.12.2024 (Bekanntmachungsdatum)\n\nBaden-Württemberg Amtsgericht Freiburg HRB 728524\nRegisterbekanntmachung nach dem Umwandlungsgesetz 19.12.2024 (Eintragungsdatum)\n\nMediClin BAV GmbH\nGesellschaft mit beschränkter Haftung\nOffenburg\n\nAls nicht eingetragen wird bekanntgemacht:\nDen Gläubigern der an der Abspaltung beteiligten Rechtsträger ist, wenn sie binnen sechs Monaten nach dem Tag, an dem die Eintragung der Abspaltung in das Register des Sitzes desjenigen Rechtsträgers, dessen Gläubiger sie sind, nach § 19 Abs. 3 UmwG als bekanntgemacht gilt, ihren Anspruch nach Grund und Höhe schriftlich anmelden, Sicherheit zu leisten, soweit sie nicht Befriedigung verlangen können. Dieses Recht steht den Gläubigern jedoch nur zu, wenn sie glaubhaft machen, dass durch die Abspaltung die Erfüllung ihrer Forderung gefährdet wird."
    },
    {
      "date": "2024-12-19",
      "id": "96995",
      "original_text": "Registerbekanntmachung nach dem Umwandlungsgesetz\nBaden-Württemberg Amtsgericht Stuttgart HRB 797672\nflexis GmbH – Stuttgart",
      "type": "Registerbekanntmachung nach dem Umwandlungsgesetz",
      "state": "Baden-Württemberg",
      "amtsgericht": "Amtsgericht Stuttgart",
      "registernummer": "HRB 797672",
      "registerart": "HRB",
      "company_name": "flexis GmbH",
      "company_seat": "Stuttgart",
      "details": "19.12.2024 (Bekanntmachungsdatum)\n\nBaden-Württemberg Amtsgericht Stuttgart HRB 797672\nRegisterbekanntmachung nach dem Umwandlungsgesetz 19.12.2024 (Eintragungsdatum)\n\nflexis GmbH\nGesellschaft mit beschränkter Haftung\nStuttgart\n\nDen Gläubigern des an dem Formwechsel beteiligten Rechtsträgers ist, wenn sie binnen sechs Monaten nach dem Tag, an dem die Eintragung des Formwechsels in das Register des Sitzes desjenigen Rechtsträgers, dessen Gläubiger sie sind, nach § 19 Abs. 3 UmwG als bekanntgemacht gilt, ihren Anspruch nach Grund und Höhe schriftlich anmelden, Sicherheit zu leisten, soweit sie nicht Befriedigung verlangen können. Dieses Recht steht den Gläubigern jedoch nur zu, wenn sie glaubhaft machen, dass durch den Formwechsel die Erfüllung ihrer Forderung gefährdet wird."
    },
    {
      "date": "2024-12-19",
      "id": "96996",
      "original_text": "Registerbekanntmachung nach dem Umwandlungsgesetz\nBaden-Württemberg Amtsgericht Stuttgart HRB 21229\nflexis AG – Stuttgart",
      "type": "Registerbekanntmachung nach dem Umwandlungsgesetz",
      "state": "Baden-Württemberg",
      "amtsgericht": "Amtsgericht Stuttgart",
      "registernummer": "HRB 21229",
      "registerart": "HRB",
      "company_name": "flexis AG",
      "company_seat": "Stuttgart",
      "details": "19.12.2024 (Bekanntmachungsdatum)\n\nBaden-Württemberg Amtsgericht Stuttgart HRB 21229\nRegisterbekanntmachung nach dem Umwandlungsgesetz 19.12.2024 (Eintragungsdatum)\n\nflexis AG\nAktiengesellschaft\nStuttgart\n\nDen Gläubigern des an dem Formwechsel beteiligten Rechtsträgers ist, wenn sie binnen sechs Monaten nach dem Tag, an dem die Eintragung des Formwechsels in das Register des Sitzes desjenigen Rechtsträgers, dessen Gläubiger sie sind, nach § 19 Abs. 3 UmwG als bekanntgemacht gilt, ihren Anspruch nach Grund und Höhe schriftlich anmelden, Sicherheit zu leisten, soweit sie nicht Befriedigung verlangen können. Dieses Recht steht den Gläubigern jedoch nur zu, wenn sie glaubhaft machen, dass durch den Formwechsel die Erfüllung ihrer Forderung gefährdet wird."
    },
    {
      "date": "2024-12-19",
      "id": "96997",
      "original_text": "Registerbekanntmachung nach dem Umwandlungsgesetz\nMecklenburg-Vorpommern Amtsgericht Neubrandenburg HRA 3197\nMatthias Constien Immobilien e.K. – Hohenmocker",
      "type": "Registerbekanntmachung nach dem Umwandlungsgesetz",
      "state": "Mecklenburg-Vorpommern",
      "amtsgericht": "Amtsgericht Neubrandenburg",
      "registernummer": "HRA 3197",
      "registerart": "HRA",
      "company_name": "Matthias Constien Immobilien e.K.",
      "company_seat": "Hohenmocker",
      "details": "19.12.2024 (Bekanntmachungsdatum)\n\nMecklenburg-Vorpommern Amtsgericht Neubrandenburg HRA 3197\nRegisterbekanntmachung nach dem Umwandlungsgesetz 19.12.2024 (Eintragungsdatum)\n\nMatthias Constien Immobilien e.K.\nEinzelkaufmann / Einzelkauffrau\nHohenmocker\n\nDen Gläubigern der an der Ausgliederung beteiligten Rechtsträger ist, wenn sie binnen sechs Monaten nach dem Tag, an dem die Eintragung der Ausgliederung in das Register des Sitzes desjenigen Rechtsträgers, dessen Gläubiger sie sind, nach § 19 Abs. 3 UmwG bekannt gemacht worden ist, ihren Anspruch nach Grund und Höhe schriftlich anmelden, Sicherheit zu leisten, soweit sie nicht Befriedigung verlangen können. Dieses Recht steht den Gläubigern jedoch nur zu, wenn sie glaubhaft machen, dass durch die Ausgliederung die Erfüllung ihrer Forderung gefährdet wird."
    },
    {
      "date": "2024-12-19",
      "id": "96998",
      "original_text": "Registerbekanntmachung nach dem Umwandlungsgesetz\nMecklenburg-Vorpommern Amtsgericht Neubrandenburg HRA 3193\nSternfelder Land KG – Hohenmocker",
      "type": "Registerbekanntmachung nach dem Umwandlungsgesetz",
      "state": "Mecklenburg-Vorpommern",
      "amtsgericht": "Amtsgericht Neubrandenburg",
      "registernummer": "HRA 3193",
      "registerart": "HRA",
      "company_name": "Sternfelder Land KG",
      "company_seat": "Hohenmocker",
      "details": "19.12.2024 (Bekanntmachungsdatum)\n\nMecklenburg-Vorpommern Amtsgericht Neubrandenburg HRA 3193\nRegisterbekanntmachung nach dem Umwandlungsgesetz 19.12.2024 (Eintragungsdatum)\n\nSternfelder Land KG\nKommanditgesellschaft\nHohenmocker\n\nDen Gläubigern der an der Ausgliederung beteiligten Rechtsträger ist, wenn sie binnen sechs Monaten nach dem Tag, an dem die Eintragung der Ausgliederung in das Register des Sitzes desjenigen Rechtsträgers, dessen Gläubiger sie sind, nach § 19 Abs. 3 UmwG bekannt gemacht worden ist, ihren Anspruch nach Grund und Höhe schriftlich anmelden, Sicherheit zu leisten, soweit sie nicht Befriedigung verlangen können. Dieses Recht steht den Gläubigern jedoch nur zu, wenn sie glaubhaft machen, dass durch die Ausgliederung die Erfüllung ihrer Forderung gefährdet wird."
    },
    {
      "date": "2024-12-19",
      "id": "96999",
      "original_text": "Registerbekanntmachung nach dem Umwandlungsgesetz\nSachsen Amtsgericht Leipzig HRA 19602\nASH UG (haftungsbeschränkt) & Co. KG – Borna",
      "type": "Registerbekanntmachung nach dem Umwandlungsgesetz",
      "state": "Sachsen",
      "amtsgericht": "Amtsgericht Leipzig",
      "registernummer": "HRA 19602",
      "registerart": "HRA",
      "company_name": "ASH UG (haftungsbeschränkt) & Co. KG",
      "company_seat": "Borna",
      "details": "19.12.2024 (Bekanntmachungsdatum)\n\nSachsen Amtsgericht Leipzig HRA 19602\nRegisterbekanntmachung nach dem Umwandlungsgesetz 19.12.2024 (Eintragungsdatum)\n\nASH UG (haftungsbeschränkt) & Co. KG\nKommanditgesellschaft\nBorna\n\nDen Gläubigern der an der Ausgliederung beteiligten Rechtsträger ist, wenn sie binnen sechs Monaten nach dem Tag, an dem die Eintragung der Ausgliederung in das Register des Sitzes desjenigen Rechtsträgers, dessen Gläubiger sie sind, nach § 19 Abs. 3 UmwG als bekannt gemacht gilt, ihren Anspruch nach Grund und Höhe schriftlich anmelden, Sicherheit zu leisten, soweit sie nicht Befriedigung verlangen können. Dieses Recht steht den Gläubigern jedoch nur zu, wenn sie glaubhaft machen, dass durch die Ausgliederung die Erfüllung der Forderung gefährdet wird."
    },
    {
      "date": "2024-12-19",
      "id": "97000",
      "original_text": "Löschungsankündigung\nSachsen Amtsgericht Chemnitz HRB 13622\nINSORA Integration Sozialer Randgruppen gemeinnützige GmbH Soziale Betriebe und Dienste – Zwickau",
      "type": "Löschungsankündigung",
      "state": "Sachsen",
      "amtsgericht": "Amtsgericht Chemnitz",
      "registernummer": "HRB 13622",
      "registerart": "HRB",
      "company_name": "INSORA Integration Sozialer Randgruppen gemeinnützige GmbH Soziale Betriebe und Dienste",
      "company_seat": "Zwickau",
      "details": "19.12.2024 (Bekanntmachungsdatum)\n\nSachsen Amtsgericht Chemnitz HRB 13622\nLöschungsankündigung\n\nINSORA Integration Sozialer Randgruppen gemeinnützige GmbH Soziale Betriebe und Dienste\nGesellschaft mit beschränkter Haftung\nZwickau\n\nDas Registergericht beabsichtigt, die im Handelsregister eingetragene Gesellschaft von Amts wegen nach § 394 FamFG zu löschen. Die Frist zu Erhebung eines Widerspruchs gegen die beabsichtigte Löschung wird auf einen Monat festgesetzt."
    },
    {
      "date": "2024-12-19",
      "id": "97001",
      "original_text": "Löschungsankündigung\nSachsen Amtsgericht Chemnitz HRB 25203\nDieckmann GmbH – Chemnitz",
      "type": "Löschungsankündigung",
      "state": "Sachsen",
      "amtsgericht": "Amtsgericht Chemnitz",
      "registernummer": "HRB 25203",
      "registerart": "HRB",
      "company_name": "Dieckmann GmbH",
      "company_seat": "Chemnitz",
      "details": "19.12.2024 (Bekanntmachungsdatum)\n\nSachsen Amtsgericht Chemnitz HRB 25203\nLöschungsankündigung\n\nDieckmann GmbH\nGesellschaft mit beschränkter Haftung\nChemnitz\n\nDas Registergericht beabsichtigt, die im Handelsregister eingetragene Gesellschaft von Amts wegen nach § 394 FamFG zu löschen. Die Frist zu Erhebung eines Widerspruchs gegen die beabsichtigte Löschung wird auf einen Monat festgesetzt."
    },
    {
      "date": "2024-12-19",
      "id": "97002",
      "original_text": "Einreichung neuer Dokumente\nSachsen Amtsgericht Dresden HRB 21385\nManagementgesellschaft Gesundheitszentrum des Landkreises Görlitz mbH – Zittau",
      "type": "Einreichung neuer Dokumente",
      "state": "Sachsen",
      "amtsgericht": "Amtsgericht Dresden",
      "registernummer": "HRB 21385",
      "registerart": "HRB",
      "company_name": "Managementgesellschaft Gesundheitszentrum des Landkreises Görlitz mbH",
      "company_seat": "Zittau",
      "details": "19.12.2024 (Bekanntmachungsdatum)\n\nSachsen Amtsgericht Dresden HRB 21385\nEinreichung neuer Dokumente\n\nManagementgesellschaft Gesundheitszentrum des Landkreises Görlitz mbH\nGesellschaft mit beschränkter Haftung\nZittau\n\nAm 18.12.2024 wurde beim Handelsregister des Amtsgerichts Dresden die Liste der Mitglieder des Aufsichtsrats gemäß § 52 GmbHG eingereicht."
    },
    {
      "date": "2024-12-19",
      "id": "97003",
      "original_text": "Löschungsankündigung\nSachsen Amtsgericht Dresden HRB 23408\nGeorg Nartschik GmbH – Wilsdruff",
      "type": "Löschungsankündigung",
      "state": "Sachsen",
      "amtsgericht": "Amtsgericht Dresden",
      "registernummer": "HRB 23408",
      "registerart": "HRB",
      "company_name": "Georg Nartschik GmbH",
      "company_seat": "Wilsdruff",
      "details": "19.12.2024 (Bekanntmachungsdatum)\n\nSachsen Amtsgericht Dresden HRB 23408\nLöschungsankündigung\n\nGeorg Nartschik GmbH\nGesellschaft mit beschränkter Haftung\nWilsdruff\n\nDas Registergericht beabsichtigt, die im Handelsregister eingetragene Gesellschaft von Amts wegen nach § 394 FamFG zu löschen. Die Frist zu Erhebung eines Widerspruchs gegen die beabsichtigte Löschung wird auf einen Monat festgesetzt."
    },
    {
      "date": "2024-12-19",
      "id": "97004",
      "original_text": "Registerbekanntmachung nach dem Umwandlungsgesetz\nSachsen Amtsgericht Chemnitz HRA 10042\nH&G GmbH & Co. KG – Reichenbach im Vogtland",
      "type": "Registerbekanntmachung nach dem Umwandlungsgesetz",
      "state": "Sachsen",
      "amtsgericht": "Amtsgericht Chemnitz",
      "registernummer": "HRA 10042",
      "registerart": "HRA",
      "company_name": "H&G GmbH & Co. KG",
      "company_seat": "Reichenbach im Vogtland",
      "details": "19.12.2024 (Bekanntmachungsdatum)\n\nSachsen Amtsgericht Chemnitz HRA 10042\nRegisterbekanntmachung nach dem Umwandlungsgesetz 19.12.2024 (Eintragungsdatum)\n\nH&G GmbH & Co. KG\nKommanditgesellschaft\nReichenbach im Vogtland\n\nDen Gläubigern der an der Ausgliederung beteiligten Rechtsträger ist, wenn sie binnen sechs Monaten nach dem Tag, an dem die Eintragung der Ausgliederung in das Register des Sitzes desjenigen Rechtsträgers, dessen Gläubiger sie sind, nach § 19 Abs. 3 UmwG als bekannt gemacht gilt, ihren Anspruch nach Grund und Höhe schriftlich anmelden, Sicherheit zu leisten, soweit sie nicht Befriedigung verlangen können. Dieses Recht steht den Gläubigern jedoch nur zu, wenn sie glaubhaft machen, dass durch die Ausgliederung die Erfüllung der Forderung gefährdet wird."
    },
    {
      "date": "2024-12-19",
      "id": "97005",
      "original_text": "Einreichung neuer Dokumente\nSachsen Amtsgericht Chemnitz HRB 20040\nKBE Kommunale Beteiligungsgesellschaft mbH an der envia – Chemnitz",
      "type": "Einreichung neuer Dokumente",
      "state": "Sachsen",
      "amtsgericht": "Amtsgericht Chemnitz",
      "registernummer": "HRB 20040",
      "registerart": "HRB",
      "company_name": "KBE Kommunale Beteiligungsgesellschaft mbH an der envia",
      "company_seat": "Chemnitz",
      "details": "19.12.2024 (Bekanntmachungsdatum)\n\nSachsen Amtsgericht Chemnitz HRB 20040\nEinreichung neuer Dokumente\n\nKBE Kommunale Beteiligungsgesellschaft mbH an der envia\nGesellschaft mit beschränkter Haftung\nChemnitz\n\nAm 17.12.2024 wurde beim Handelsregister des Amtsgerichts Chemnitz die Liste der Mitglieder des Aufsichtsrats gemäß § 52 GmbHG eingereicht."
    },
    {
      "date": "2024-12-19",
      "id": "97006",
      "original_text": "Registerbekanntmachung nach dem Umwandlungsgesetz\nSachsen Amtsgericht Chemnitz HRA 10041\nFrank Goy e.K. – Reichenbach im Vogtland",
      "type": "Registerbekanntmachung nach dem Umwandlungsgesetz",
      "state": "Sachsen",
      "amtsgericht": "Amtsgericht Chemnitz",
      "registernummer": "HRA 10041",
      "registerart": "HRA",
      "company_name": "Frank Goy e.K.",
      "company_seat": "Reichenbach im Vogtland",
      "details": "19.12.2024 (Bekanntmachungsdatum)\n\nSachsen Amtsgericht Chemnitz HRA 10041\nRegisterbekanntmachung nach dem Umwandlungsgesetz 19.12.2024 (Eintragungsdatum)\n\nFrank Goy e.K.\nEinzelkaufmann / Einzelkauffrau\nReichenbach im Vogtland\n\nDen Gläubigern der an der Ausgliederung beteiligten Rechtsträger ist, wenn sie binnen sechs Monaten nach dem Tag, an dem die Eintragung der Ausgliederung in das Register des Sitzes desjenigen Rechtsträgers, dessen Gläubiger sie sind, nach § 19 Abs. 3 UmwG als bekannt gemacht gilt, ihren Anspruch nach Grund und Höhe schriftlich anmelden, Sicherheit zu leisten, soweit sie nicht Befriedigung verlangen können. Dieses Recht steht den Gläubigern jedoch nur zu, wenn sie glaubhaft machen, dass durch die Ausgliederung die Erfüllung der Forderung gefährdet wird."
    },
    {
      "date": "2024-12-19",
      "id": "97007",
      "original_text": "Einreichung neuer Dokumente\nSachsen Amtsgericht Chemnitz HRB 17200\nErzgebirgsklinikum gGmbH – Annaberg-Buchholz",
      "type": "Einreichung neuer Dokumente",
      "state": "Sachsen",
      "amtsgericht": "Amtsgericht Chemnitz",
      "registernummer": "HRB 17200",
      "registerart": "HRB",
      "company_name": "Erzgebirgsklinikum gGmbH",
      "company_seat": "Annaberg-Buchholz",
      "details": "19.12.2024 (Bekanntmachungsdatum)\n\nSachsen Amtsgericht Chemnitz HRB 17200\nEinreichung neuer Dokumente\n\nErzgebirgsklinikum gGmbH\nGesellschaft mit beschränkter Haftung\nAnnaberg-Buchholz\n\nAm 17.12.2024 wurde beim Handelsregister des Amtsgerichts Chemnitz die Liste der Mitglieder des Aufsichtsrats gemäß § 52 GmbHG eingereicht."
    },
    {
      "date": "2024-12-19",
      "id": "97008",
      "original_text": "Registerbekanntmachung nach dem Umwandlungsgesetz\nSachsen Amtsgericht Leipzig HRA 19586\nAndreas Thede e.K. – Leipzig",
      "type": "Registerbekanntmachung nach dem Umwandlungsgesetz",
      "state": "Sachsen",
      "amtsgericht": "Amtsgericht Leipzig",
      "registernummer": "HRA 19586",
      "registerart": "HRA",
      "company_name": "Andreas Thede e.K.",
      "company_seat": "Leipzig",
      "details": "19.12.2024 (Bekanntmachungsdatum)\n\nSachsen Amtsgericht Leipzig HRA 19586\nRegisterbekanntmachung nach dem Umwandlungsgesetz 19.12.2024 (Eintragungsdatum)\n\nAndreas Thede e.K.\nEinzelkaufmann / Einzelkauffrau\nLeipzig\n\nDen Gläubigern der an der Ausgliederung beteiligten Rechtsträger ist, wenn sie binnen sechs Monaten nach dem Tag, an dem die Eintragung der Ausgliederung in das Register des Sitzes desjenigen Rechtsträgers, dessen Gläubiger sie sind, nach § 19 Abs. 3 UmwG als bekannt gemacht gilt, ihren Anspruch nach Grund und Höhe schriftlich anmelden, Sicherheit zu leisten, soweit sie nicht Befriedigung verlangen können. Dieses Recht steht den Gläubigern jedoch nur zu, wenn sie glaubhaft machen, dass durch die Ausgliederung die Erfüllung der Forderung gefährdet wird."
    },
    {
      "date": "2024-12-19",
      "id": "97009",
      "original_text": "Löschungsankündigung\nSachsen Amtsgericht Dresden HRB 31001\nJO-NE GmbH – Dresden",
      "type": "Löschungsankündigung",
      "state": "Sachsen",
      "amtsgericht": "Amtsgericht Dresden",
      "registernummer": "HRB 31001",
      "registerart": "HRB",
      "company_name": "JO-NE GmbH",
      "company_seat": "Dresden",
      "details": "19.12.2024 (Bekanntmachungsdatum)\n\nSachsen Amtsgericht Dresden HRB 31001\nLöschungsankündigung\n\nJO-NE GmbH\nGesellschaft mit beschränkter Haftung\nDresden\n\nDas Registergericht beabsichtigt, die im Handelsregister eingetragene Gesellschaft von Amts wegen nach § 394 FamFG zu löschen. Die Frist zu Erhebung eines Widerspruchs gegen die beabsichtigte Löschung wird auf einen Monat festgesetzt."
    },
    {
      "date": "2024-12-19",
      "id": "97010",
      "original_text": "Registerbekanntmachung nach dem Umwandlungsgesetz\nSachsen Amtsgericht Leipzig HRA 19575\nAxel-Seeger-Helbach e.K. – Borna",
      "type": "Registerbekanntmachung nach dem Umwandlungsgesetz",
      "state": "Sachsen",
      "amtsgericht": "Amtsgericht Leipzig",
      "registernummer": "HRA 19575",
      "registerart": "HRA",
      "company_name": "Axel-Seeger-Helbach e.K.",
      "company_seat": "Borna",
      "details": "19.12.2024 (Bekanntmachungsdatum)\n\nSachsen Amtsgericht Leipzig HRA 19575\nRegisterbekanntmachung nach dem Umwandlungsgesetz 19.12.2024 (Eintragungsdatum)\n\nAxel-Seeger-Helbach e.K.\nEinzelkaufmann / Einzelkauffrau\nBorna\n\nDen Gläubigern der an der Ausgliederung beteiligten Rechtsträger ist, wenn sie binnen sechs Monaten nach dem Tag, an dem die Eintragung der Ausgliederung in das Register des Sitzes desjenigen Rechtsträgers, dessen Gläubiger sie sind, nach § 19 Abs. 3 UmwG als bekannt gemacht gilt, ihren Anspruch nach Grund und Höhe schriftlich anmelden, Sicherheit zu leisten, soweit sie nicht Befriedigung verlangen können. Dieses Recht steht den Gläubigern jedoch nur zu, wenn sie glaubhaft machen, dass durch die Ausgliederung die Erfüllung der Forderung gefährdet wird."
    },
    {
      "date": "2024-12-19",
      "id": "97011",
      "original_text": "Registerbekanntmachung nach dem Umwandlungsgesetz\nSachsen Amtsgericht Leipzig HRA 19606\nChristoph Scholz e.K. – Leipzig",
      "type": "Registerbekanntmachung nach dem Umwandlungsgesetz",
      "state": "Sachsen",
      "amtsgericht": "Amtsgericht Leipzig",
      "registernummer": "HRA 19606",
      "registerart": "HRA",
      "company_name": "Christoph Scholz e.K.",
      "company_seat": "Leipzig",
      "details": "19.12.2024 (Bekanntmachungsdatum)\n\nSachsen Amtsgericht Leipzig HRA 19606\nRegisterbekanntmachung nach dem Umwandlungsgesetz 19.12.2024 (Eintragungsdatum)\n\nChristoph Scholz e.K.\nEinzelkaufmann / Einzelkauffrau\nLeipzig\n\nDen Gläubigern der an der Ausgliederung beteiligten Rechtsträger ist, wenn sie binnen sechs Monaten nach dem Tag, an dem die Eintragung der Ausgliederung in das Register des Sitzes desjenigen Rechtsträgers, dessen Gläubiger sie sind, nach § 19 Abs. 3 UmwG als bekannt gemacht gilt, ihren Anspruch nach Grund und Höhe schriftlich anmelden, Sicherheit zu leisten, soweit sie nicht Befriedigung verlangen können. Dieses Recht steht den Gläubigern jedoch nur zu, wenn sie glaubhaft machen, dass durch die Ausgliederung die Erfüllung der Forderung gefährdet wird."
    },
    {
      "date": "2024-12-19",
      "id": "97012",
      "original_text": "Löschungsankündigung\nSachsen Amtsgericht Chemnitz HRB 15318\nGerd Dachsel GmbH - Handelsvertretung orthopädischer Hilfsmittel – Niederwiesa",
      "type": "Löschungsankündigung",
      "state": "Sachsen",
      "amtsgericht": "Amtsgericht Chemnitz",
      "registernummer": "HRB 15318",
      "registerart": "HRB",
      "company_name": "Gerd Dachsel GmbH - Handelsvertretung orthopädischer Hilfsmittel",
      "company_seat": "Niederwiesa",
      "details": "19.12.2024 (Bekanntmachungsdatum)\n\nSachsen Amtsgericht Chemnitz HRB 15318\nLöschungsankündigung\n\nGerd Dachsel GmbH - Handelsvertretung orthopädischer Hilfsmittel\nGesellschaft mit beschränkter Haftung\nNiederwiesa\n\nDas Registergericht beabsichtigt, die im Handelsregister eingetragene Gesellschaft von Amts wegen nach § 394 FamFG zu löschen. Die Frist zu Erhebung eines Widerspruchs gegen die beabsichtigte Löschung wird auf einen Monat festgesetzt."
    },
    {
      "date": "2024-12-19",
      "id": "97013",
      "original_text": "Registerbekanntmachung nach dem Umwandlungsgesetz\nSachsen Amtsgericht Dresden HRA 12127\nJens Jähnig Baumaschinen e. K. – Dorfhain",
      "type": "Registerbekanntmachung nach dem Umwandlungsgesetz",
      "state": "Sachsen",
      "amtsgericht": "Amtsgericht Dresden",
      "registernummer": "HRA 12127",
      "registerart": "HRA",
      "company_name": "Jens Jähnig Baumaschinen e. K.",
      "company_seat": "Dorfhain",
      "details": "19.12.2024 (Bekanntmachungsdatum)\n\nSachsen Amtsgericht Dresden HRA 12127\nRegisterbekanntmachung nach dem Umwandlungsgesetz 19.12.2024 (Eintragungsdatum)\n\nJens Jähnig Baumaschinen e. K.\nEinzelkaufmann / Einzelkauffrau\nDorfhain\n\nDen Gläubigern der an der Ausgliederung beteiligten Rechtsträger ist, wenn sie binnen sechs Monaten nach dem Tag, an dem die Eintragung der Ausgliederung in das Register des Sitzes desjenigen Rechtsträgers, dessen Gläubiger sie sind, nach § 19 Abs. 3 UmwG als bekannt gemacht gilt, ihren Anspruch nach Grund und Höhe schriftlich anmelden, Sicherheit zu leisten, soweit sie nicht Befriedigung verlangen können. Dieses Recht steht den Gläubigern jedoch nur zu, wenn sie glaubhaft machen, dass durch die Ausgliederung die Erfüllung der Forderung gefährdet wird."
    },
    {
      "date": "2024-12-19",
      "id": "97014",
      "original_text": "Registerbekanntmachung nach dem Umwandlungsgesetz\nSachsen Amtsgericht Leipzig HRB 43297\nAndreas Thede Consulting GmbH – Leipzig",
      "type": "Registerbekanntmachung nach dem Umwandlungsgesetz",
      "state": "Sachsen",
      "amtsgericht": "Amtsgericht Leipzig",
      "registernummer": "HRB 43297",
      "registerart": "HRB",
      "company_name": "Andreas Thede Consulting GmbH",
      "company_seat": "Leipzig",
      "details": "19.12.2024 (Bekanntmachungsdatum)\n\nSachsen Amtsgericht Leipzig HRB 43297\nRegisterbekanntmachung nach dem Umwandlungsgesetz 19.12.2024 (Eintragungsdatum)\n\nAndreas Thede Consulting GmbH\nGesellschaft mit beschränkter Haftung\nLeipzig\n\nDen Gläubigern der an der Ausgliederung beteiligten Rechtsträger ist, wenn sie binnen sechs Monaten nach dem Tag, an dem die Eintragung der Ausgliederung in das Register des Sitzes desjenigen Rechtsträgers, dessen Gläubiger sie sind, nach § 19 Abs. 3 UmwG als bekannt gemacht gilt, ihren Anspruch nach Grund und Höhe schriftlich anmelden, Sicherheit zu leisten, soweit sie nicht Befriedigung verlangen können. Dieses Recht steht den Gläubigern jedoch nur zu, wenn sie glaubhaft machen, dass durch die Ausgliederung die Erfüllung der Forderung gefährdet wird."
    },
    {
      "date": "2024-12-19",
      "id": "97015",
      "original_text": "Löschungsankündigung\nSachsen Amtsgericht Leipzig HRB 29172\nElektronik-Eldorado GmbH – Leipzig",
      "type": "Löschungsankündigung",
      "state": "Sachsen",
      "amtsgericht": "Amtsgericht Leipzig",
      "registernummer": "HRB 29172",
      "registerart": "HRB",
      "company_name": "Elektronik-Eldorado GmbH",
      "company_seat": "Leipzig",
      "details": "19.12.2024 (Bekanntmachungsdatum)\n\nSachsen Amtsgericht Leipzig HRB 29172\nLöschungsankündigung\n\nElektronik-Eldorado GmbH\nGesellschaft mit beschränkter Haftung\nLeipzig\n\nDas Registergericht beabsichtigt, die im Handelsregister eingetragene Gesellschaft von Amts wegen nach § 394 FamFG zu löschen. Die Frist zu Erhebung eines Widerspruchs gegen die beabsichtigte Löschung wird auf einen Monat festgesetzt."
    },
    {
      "date": "2024-12-19",
      "id": "97016",
      "original_text": "Löschungsankündigung\nSachsen Amtsgericht Dresden HRB 39881\nRPM Projektgesellschaft Lausitz UG (haftungsbeschränkt) – Bischofswerda",
      "type": "Löschungsankündigung",
      "state": "Sachsen",
      "amtsgericht": "Amtsgericht Dresden",
      "registernummer": "HRB 39881",
      "registerart": "HRB",
      "company_name": "RPM Projektgesellschaft Lausitz UG (haftungsbeschränkt)",
      "company_seat": "Bischofswerda",
      "details": "19.12.2024 (Bekanntmachungsdatum)\n\nSachsen Amtsgericht Dresden HRB 39881\nLöschungsankündigung\n\nRPM Projektgesellschaft Lausitz UG (haftungsbeschränkt)\nGesellschaft mit beschränkter Haftung\nBischofswerda\n\nDas Registergericht beabsichtigt, die im Handelsregister eingetragene Gesellschaft von Amts wegen nach § 394 FamFG zu löschen. Die Frist zu Erhebung eines Widerspruchs gegen die beabsichtigte Löschung wird auf einen Monat festgesetzt."
    },
    {
      "date": "2024-12-19",
      "id": "97017",
      "original_text": "Registerbekanntmachung nach dem Umwandlungsgesetz\nNiedersachsen Amtsgericht Göttingen HRA 202005\nmyKonzept Holding Deutschland GmbH & Co. KG – Göttingen",
      "type": "Registerbekanntmachung nach dem Umwandlungsgesetz",
      "state": "Niedersachsen",
      "amtsgericht": "Amtsgericht Göttingen",
      "registernummer": "HRA 202005",
      "registerart": "HRA",
      "company_name": "myKonzept Holding Deutschland GmbH & Co. KG",
      "company_seat": "Göttingen",
      "details": "19.12.2024 (Bekanntmachungsdatum)\n\nNiedersachsen Amtsgericht Göttingen HRA 202005\nRegisterbekanntmachung nach dem Umwandlungsgesetz 19.12.2024 (Eintragungsdatum)\n\nmyKonzept Holding Deutschland GmbH & Co. KG\nKommanditgesellschaft\nGöttingen\n\nDen Gläubigern der an der Verschmelzung beteiligten Rechtsträger ist, wenn sie binnen sechs Monaten nach dem Tag, an dem die Eintragung der Verschmelzung in das Register des Sitzes desjenigen Rechtsträgers, dessen Gläubiger sie sind, nach § 19  Abs.  3 UmwG als bekannt gemacht gilt, ihren Anspruch nach Grund und Höhe schriftlich anmelden, Sicherheit zu leisten, soweit sie nicht Befriedigung verlangen können. Dieses Recht steht den Gläubigern jedoch nur zu, wenn sie glaubhaft machen, dass durch die Verschmelzung die Erfüllung der Forderung gefährdet wird."
    },
    {
      "date": "2024-12-19",
      "id": "97018",
      "original_text": "Einreichung neuer Dokumente\nNiedersachsen Amtsgericht Walsrode HRB 110144\nAbfallwirtschaftsgesellschaft mbH (AWG) – Bassum",
      "type": "Einreichung neuer Dokumente",
      "state": "Niedersachsen",
      "amtsgericht": "Amtsgericht Walsrode",
      "registernummer": "HRB 110144",
      "registerart": "HRB",
      "company_name": "Abfallwirtschaftsgesellschaft mbH (AWG)",
      "company_seat": "Bassum",
      "details": "19.12.2024 (Bekanntmachungsdatum)\n\nNiedersachsen Amtsgericht Walsrode HRB 110144\nEinreichung neuer Dokumente\n\nAbfallwirtschaftsgesellschaft mbH (AWG)\nGesellschaft mit beschränkter Haftung\nBassum\n\nDie Liste der Mitglieder des Aufsichtsrats wurde beim Registergericht eingereicht."
    },
    {
      "date": "2024-12-19",
      "id": "97019",
      "original_text": "Registerbekanntmachung nach dem Umwandlungsgesetz\nNiedersachsen Amtsgericht Oldenburg (Oldenburg) HRB 221409\nMöhlmann Automobil-Logistik GmbH – Zetel - Neuenburg",
      "type": "Registerbekanntmachung nach dem Umwandlungsgesetz",
      "state": "Niedersachsen",
      "amtsgericht": "Amtsgericht Oldenburg (Oldenburg)",
      "registernummer": "HRB 221409",
      "registerart": "HRB",
      "company_name": "Möhlmann Automobil-Logistik GmbH",
      "company_seat": "Zetel - Neuenburg",
      "details": "19.12.2024 (Bekanntmachungsdatum)\n\nNiedersachsen Amtsgericht Oldenburg (Oldenburg) HRB 221409\nRegisterbekanntmachung nach dem Umwandlungsgesetz 19.12.2024 (Eintragungsdatum)\n\nMöhlmann Automobil-Logistik GmbH\nGesellschaft mit beschränkter Haftung\nZetel - Neuenburg\n\nDen Gläubigern der an der Verschmelzung beteiligten Rechtsträger ist, wenn sie binnen sechs Monaten nach dem Tag, an dem die Eintragung der Verschmelzung in das Register des Sitzes desjenigen Rechtsträgers, dessen Gläubiger sie sind, nach § 19  Abs.  3 UmwG als bekannt gemacht gilt, ihren Anspruch nach Grund und Höhe schriftlich anmelden, Sicherheit zu leisten, soweit sie nicht Befriedigung verlangen können. Dieses Recht steht den Gläubigern jedoch nur zu, wenn sie glaubhaft machen, dass durch die Verschmelzung die Erfüllung der Forderung gefährdet wird."
    },
    {
      "date": "2024-12-19",
      "id": "97020",
      "original_text": "Registerbekanntmachung nach dem Umwandlungsgesetz\nNiedersachsen Amtsgericht Aurich HRB 100092 früher Amtsgericht Emden\nSHK Handels GmbH – Emden",
      "type": "Registerbekanntmachung nach dem Umwandlungsgesetz",
      "state": "Niedersachsen",
      "amtsgericht": "Amtsgericht Aurich",
      "registernummer": "HRB 100092",
      "registerart": "HRB",
      "company_name": "SHK Handels GmbH",
      "company_seat": "Emden",
      "former_amtsgericht": "Emden",
      "details": "19.12.2024 (Bekanntmachungsdatum)\n\nNiedersachsen Amtsgericht Aurich HRB 100092 früher Amtsgericht Emden\nRegisterbekanntmachung nach dem Umwandlungsgesetz 19.12.2024 (Eintragungsdatum)\n\nSHK Handels GmbH\nGesellschaft mit beschränkter Haftung\nEmden\n\nDen Gläubigern der an der Verschmelzung beteiligten Rechtsträger ist, wenn sie binnen sechs Monaten nach dem Tag, an dem die Eintragung der Verschmelzung in das Register des Sitzes desjenigen Rechtsträgers, dessen Gläubiger sie sind, nach § 19  Abs.  3 UmwG als bekannt gemacht gilt, ihren Anspruch nach Grund und Höhe schriftlich anmelden, Sicherheit zu leisten, soweit sie nicht Befriedigung verlangen können. Dieses Recht steht den Gläubigern jedoch nur zu, wenn sie glaubhaft machen, dass durch die Verschmelzung die Erfüllung der Forderung gefährdet wird."
    },
    {
      "date": "2024-12-19",
      "id": "97021",
      "original_text": "Registerbekanntmachung nach dem Umwandlungsgesetz\nNiedersachsen Amtsgericht Aurich HRB 100467 früher Amtsgericht Emden\nW. Tebbenjohanns Nachf. GmbH – Emden",
      "type": "Registerbekanntmachung nach dem Umwandlungsgesetz",
      "state": "Niedersachsen",
      "amtsgericht": "Amtsgericht Aurich",
      "registernummer": "HRB 100467",
      "registerart": "HRB",
      "company_name": "W. Tebbenjohanns Nachf. GmbH",
      "company_seat": "Emden",
      "former_amtsgericht": "Emden",
      "details": "19.12.2024 (Bekanntmachungsdatum)\n\nNiedersachsen Amtsgericht Aurich HRB 100467 früher Amtsgericht Emden\nRegisterbekanntmachung nach dem Umwandlungsgesetz 19.12.2024 (Eintragungsdatum)\n\nW. Tebbenjohanns Nachf. GmbH\nGesellschaft mit beschränkter Haftung\nEmden\n\nDen Gläubigern der an der Verschmelzung beteiligten Rechtsträger ist, wenn sie binnen sechs Monaten nach dem Tag, an dem die Eintragung der Verschmelzung in das Register des Sitzes desjenigen Rechtsträgers, dessen Gläubiger sie sind, nach § 19  Abs.  3 UmwG als bekannt gemacht gilt, ihren Anspruch nach Grund und Höhe schriftlich anmelden, Sicherheit zu leisten, soweit sie nicht Befriedigung verlangen können. Dieses Recht steht den Gläubigern jedoch nur zu, wenn sie glaubhaft machen, dass durch die Verschmelzung die Erfüllung der Forderung gefährdet wird."
    },
    {
      "date": "2024-12-19",
      "id": "97022",
      "original_text": "Registerbekanntmachung nach dem Umwandlungsgesetz\nNiedersachsen Amtsgericht Göttingen HRA 1153\nCarl Hasselbach GmbH & Co. KG – Rosdorf",
      "type": "Registerbekanntmachung nach dem Umwandlungsgesetz",
      "state": "Niedersachsen",
      "amtsgericht": "Amtsgericht Göttingen",
      "registernummer": "HRA 1153",
      "registerart": "HRA",
      "company_name": "Carl Hasselbach GmbH & Co. KG",
      "company_seat": "Rosdorf",
      "details": "19.12.2024 (Bekanntmachungsdatum)\n\nNiedersachsen Amtsgericht Göttingen HRA 1153\nRegisterbekanntmachung nach dem Umwandlungsgesetz 19.12.2024 (Eintragungsdatum)\n\nCarl Hasselbach GmbH & Co. KG\nKommanditgesellschaft\nRosdorf\n\nDen Gläubigern der an der Verschmelzung beteiligten Rechtsträger ist, wenn sie binnen sechs Monaten nach dem Tag, an dem die Eintragung der Verschmelzung in das Register des Sitzes desjenigen Rechtsträgers, dessen Gläubiger sie sind, nach § 19  Abs.  3 UmwG als bekannt gemacht gilt, ihren Anspruch nach Grund und Höhe schriftlich anmelden, Sicherheit zu leisten, soweit sie nicht Befriedigung verlangen können. Dieses Recht steht den Gläubigern jedoch nur zu, wenn sie glaubhaft machen, dass durch die Verschmelzung die Erfüllung der Forderung gefährdet wird."
    },
    {
      "date": "2024-12-19",
      "id": "97023",
      "original_text": "Löschungsankündigung\nNiedersachsen Amtsgericht Braunschweig HRB 209124\nZOB - Fernbusticketcenter UG (haftungsbeschränkt) – Braunschweig",
      "type": "Löschungsankündigung",
      "state": "Niedersachsen",
      "amtsgericht": "Amtsgericht Braunschweig",
      "registernummer": "HRB 209124",
      "registerart": "HRB",
      "company_name": "ZOB - Fernbusticketcenter UG (haftungsbeschränkt)",
      "company_seat": "Braunschweig",
      "details": "19.12.2024 (Bekanntmachungsdatum)\n\nNiedersachsen Amtsgericht Braunschweig HRB 209124\nLöschungsankündigung\n\nZOB - Fernbusticketcenter UG (haftungsbeschränkt)\nGesellschaft mit beschränkter Haftung\nBraunschweig\n\nDas Registergericht beabsichtigt, die Gesellschaft von Amts wegen nach § 394 FamFG zu löschen. Die Frist zur Erhebung eines Widerspruchs ist auf 1 Monat ab dieser Registerbekanntmachung festgesetzt."
    },
    {
      "date": "2024-12-19",
      "id": "97024",
      "original_text": "Registerbekanntmachung nach dem Umwandlungsgesetz\nNiedersachsen Amtsgericht Osnabrück HRA 4508\nebm elektro-bau-montage GmbH & Co. KG – Osnabrück",
      "type": "Registerbekanntmachung nach dem Umwandlungsgesetz",
      "state": "Niedersachsen",
      "amtsgericht": "Amtsgericht Osnabrück",
      "registernummer": "HRA 4508",
      "registerart": "HRA",
      "company_name": "ebm elektro-bau-montage GmbH & Co. KG",
      "company_seat": "Osnabrück",
      "details": "19.12.2024 (Bekanntmachungsdatum)\n\nNiedersachsen Amtsgericht Osnabrück HRA 4508\nRegisterbekanntmachung nach dem Umwandlungsgesetz 19.12.2024 (Eintragungsdatum)\n\nebm elektro-bau-montage GmbH & Co. KG\nKommanditgesellschaft\nOsnabrück\n\nDen Gläubigern der an der formwechselnden Umwandlung beteiligten Rechtsträger ist, wenn sie binnen sechs Monaten nach dem Tag, an dem die Eintragung der Umwandlung in das Register des Sitzes desjenigen Rechtsträgers, dessen Gläubiger sie sind, nach § 19 Abs. 3 UmwG als bekannt gemacht gilt, ihren Anspruch nach Grund und Höhe schriftlich anmelden, Sicherheit zu leisten, soweit sie nicht Befriedigung verlangen können. Dieses Recht steht den Gläubigern jedoch nur zu, wenn sie glaubhaft machen, dass durch die formwechselnde Umwandlung die Erfüllung der Forderung gefährdet wird."
    },
    {
      "date": "2024-12-19",
      "id": "97025",
      "original_text": "Registerbekanntmachung nach dem Umwandlungsgesetz\nNiedersachsen Amtsgericht Osnabrück HRB 206161\nGO! Express & Logistics Osnabrück GmbH – Osnabrück",
      "type": "Registerbekanntmachung nach dem Umwandlungsgesetz",
      "state": "Niedersachsen",
      "amtsgericht": "Amtsgericht Osnabrück",
      "registernummer": "HRB 206161",
      "registerart": "HRB",
      "company_name": "GO! Express & Logistics Osnabrück GmbH",
      "company_seat": "Osnabrück",
      "details": "19.12.2024 (Bekanntmachungsdatum)\n\nNiedersachsen Amtsgericht Osnabrück HRB 206161\nRegisterbekanntmachung nach dem Umwandlungsgesetz 19.12.2024 (Eintragungsdatum)\n\nGO! Express & Logistics Osnabrück GmbH\nGesellschaft mit beschränkter Haftung\nOsnabrück\n\nDen Gläubigern der an der Verschmelzung beteiligten Rechtsträger ist, wenn sie binnen sechs Monaten nach dem Tag, an dem die Eintragung der Verschmelzung in das Register des Sitzes desjenigen Rechtsträgers, dessen Gläubiger sie sind, nach § 19  Abs.  3 UmwG als bekannt gemacht gilt, ihren Anspruch nach Grund und Höhe schriftlich anmelden, Sicherheit zu leisten, soweit sie nicht Befriedigung verlangen können. Dieses Recht steht den Gläubigern jedoch nur zu, wenn sie glaubhaft machen, dass durch die Verschmelzung die Erfüllung der Forderung gefährdet wird."
    },
    {
      "date": "2024-12-19",
      "id": "97026",
      "original_text": "Registerbekanntmachung nach dem Umwandlungsgesetz\nNiedersachsen Amtsgericht Aurich HRB 204213\nDau Immobilien Ostfriesland GmbH – Aurich",
      "type": "Registerbekanntmachung nach dem Umwandlungsgesetz",
      "state": "Niedersachsen",
      "amtsgericht": "Amtsgericht Aurich",
      "registernummer": "HRB 204213",
      "registerart": "HRB",
      "company_name": "Dau Immobilien Ostfriesland GmbH",
      "company_seat": "Aurich",
      "details": "19.12.2024 (Bekanntmachungsdatum)\n\nNiedersachsen Amtsgericht Aurich HRB 204213\nRegisterbekanntmachung nach dem Umwandlungsgesetz 19.12.2024 (Eintragungsdatum)\n\nDau Immobilien Ostfriesland GmbH\nGesellschaft mit beschränkter Haftung\nAurich\n\nDen Gläubigern der an der Verschmelzung beteiligten Rechtsträger ist, wenn sie binnen sechs Monaten nach dem Tag, an dem die Eintragung der Verschmelzung in das Register des Sitzes desjenigen Rechtsträgers, dessen Gläubiger sie sind, nach § 19  Abs.  3 UmwG als bekannt gemacht gilt, ihren Anspruch nach Grund und Höhe schriftlich anmelden, Sicherheit zu leisten, soweit sie nicht Befriedigung verlangen können. Dieses Recht steht den Gläubigern jedoch nur zu, wenn sie glaubhaft machen, dass durch die Verschmelzung die Erfüllung der Forderung gefährdet wird."
    },
    {
      "date": "2024-12-19",
      "id": "97027",
      "original_text": "Registerbekanntmachung nach dem Umwandlungsgesetz\nNiedersachsen Amtsgericht Lüneburg HRA 100991 früher Amtsgericht Celle\nPrüser Fahrzeughandel und Reparatur GmbH & Co. KG – Neuenkirchen",
      "type": "Registerbekanntmachung nach dem Umwandlungsgesetz",
      "state": "Niedersachsen",
      "amtsgericht": "Amtsgericht Lüneburg",
      "registernummer": "HRA 100991",
      "registerart": "HRA",
      "company_name": "Prüser Fahrzeughandel und Reparatur GmbH & Co. KG",
      "company_seat": "Neuenkirchen",
      "former_amtsgericht": "Celle",
      "details": "19.12.2024 (Bekanntmachungsdatum)\n\nNiedersachsen Amtsgericht Lüneburg HRA 100991 früher Amtsgericht Celle\nRegisterbekanntmachung nach dem Umwandlungsgesetz 19.12.2024 (Eintragungsdatum)\n\nPrüser Fahrzeughandel und Reparatur GmbH & Co. KG\nKommanditgesellschaft\nNeuenkirchen\n\nDen Gläubigern der an der Ausgliederung beteiligten Rechtsträger ist, wenn sie binnen sechs Monaten nach dem Tag, an dem die Eintragung der Ausgliederung in das Register des Sitzes desjenigen Rechtsträgers, dessen Gläubiger sie sind, nach § 19 Abs. 3 UmwG als bekannt gemacht gilt, ihren Anspruch nach Grund und Höhe schriftlich anmelden, Sicherheit zu leisten, soweit sie nicht Befriedigung verlangen können. Dieses Recht steht den Gläubigern jedoch nur zu, wenn sie glaubhaft machen, dass durch die Ausgliederung die Erfüllung der Forderung gefährdet wird."
    },
    {
      "date": "2024-12-19",
      "id": "97028",
      "original_text": "Löschungsankündigung\nNiedersachsen Amtsgericht Osnabrück HRB 211223\nLeGaVi UG (haftungsbeschränkt) – Hagen a.T.W.",
      "type": "Löschungsankündigung",
      "state": "Niedersachsen",
      "amtsgericht": "Amtsgericht Osnabrück",
      "registernummer": "HRB 211223",
      "registerart": "HRB",
      "company_name": "LeGaVi UG (haftungsbeschränkt)",
      "company_seat": "Hagen a.T.W.",
      "details": "19.12.2024 (Bekanntmachungsdatum)\n\nNiedersachsen Amtsgericht Osnabrück HRB 211223\nLöschungsankündigung\n\nLeGaVi UG (haftungsbeschränkt)\nGesellschaft mit beschränkter Haftung\nHagen a.T.W.\n\nDas Registergericht beabsichtigt, die Gesellschaft von Amts wegen nach § 394 FamFG wegen Vermögenslosigkeit zu löschen. Die Frist zur Erhebung eines Widerspruchs ist auf 1 Monat ab dieser Registerbekanntmachung festgesetzt."
    },
    {
      "date": "2024-12-19",
      "id": "97029",
      "original_text": "Einreichung neuer Dokumente\nNiedersachsen Amtsgericht Walsrode HRB 110118\nHumus-Vermarktungs-GmbH Bassum – Bassum",
      "type": "Einreichung neuer Dokumente",
      "state": "Niedersachsen",
      "amtsgericht": "Amtsgericht Walsrode",
      "registernummer": "HRB 110118",
      "registerart": "HRB",
      "company_name": "Humus-Vermarktungs-GmbH Bassum",
      "company_seat": "Bassum",
      "details": "19.12.2024 (Bekanntmachungsdatum)\n\nNiedersachsen Amtsgericht Walsrode HRB 110118\nEinreichung neuer Dokumente\n\nHumus-Vermarktungs-GmbH Bassum\nGesellschaft mit beschränkter Haftung\nBassum\n\nDie Liste der Mitglieder des Aufsichtsrats wurde beim Registergericht eingereicht."
    },
    {
      "date": "2024-12-19",
      "id": "97030",
      "original_text": "Einreichung neuer Dokumente\nNiedersachsen Amtsgericht Braunschweig HRB 6316\nMagna International Stanztechnik GmbH – Salzgitter",
      "type": "Einreichung neuer Dokumente",
      "state": "Niedersachsen",
      "amtsgericht": "Amtsgericht Braunschweig",
      "registernummer": "HRB 6316",
      "registerart": "HRB",
      "company_name": "Magna International Stanztechnik GmbH",
      "company_seat": "Salzgitter",
      "details": "19.12.2024 (Bekanntmachungsdatum)\n\nNiedersachsen Amtsgericht Braunschweig HRB 6316\nEinreichung neuer Dokumente 19.12.2024 (Eintragungsdatum)\n\nMagna International Stanztechnik GmbH\nGesellschaft mit beschränkter Haftung\nSalzgitter\n\nDie Liste der Mitglieder des Aufsichtsrats wurde beim Registergericht eingereicht."
    },
    {
      "date": "2024-12-19",
      "id": "97031",
      "original_text": "Registerbekanntmachung nach dem Umwandlungsgesetz\nNiedersachsen Amtsgericht Walsrode HRB 31258\nRaiffeisen Kraftfutterwerk Mittelweser Heide GmbH – Schweringen",
      "type": "Registerbekanntmachung nach dem Umwandlungsgesetz",
      "state": "Niedersachsen",
      "amtsgericht": "Amtsgericht Walsrode",
      "registernummer": "HRB 31258",
      "registerart": "HRB",
      "company_name": "Raiffeisen Kraftfutterwerk Mittelweser Heide GmbH",
      "company_seat": "Schweringen",
      "details": "19.12.2024 (Bekanntmachungsdatum)\n\nNiedersachsen Amtsgericht Walsrode HRB 31258\nRegisterbekanntmachung nach dem Umwandlungsgesetz 19.12.2024 (Eintragungsdatum)\n\nRaiffeisen Kraftfutterwerk Mittelweser Heide GmbH\nGesellschaft mit beschränkter Haftung\nSchweringen\n\nDen Gläubigern der an der Verschmelzung beteiligten Rechtsträger ist, wenn sie binnen sechs Monaten nach dem Tag, an dem die Eintragung der Verschmelzung in das Register des Sitzes desjenigen Rechtsträgers, dessen Gläubiger sie sind, nach § 19  Abs.  3 UmwG als bekannt gemacht gilt, ihren Anspruch nach Grund und Höhe schriftlich anmelden, Sicherheit zu leisten, soweit sie nicht Befriedigung verlangen können. Dieses Recht steht den Gläubigern jedoch nur zu, wenn sie glaubhaft machen, dass durch die Verschmelzung die Erfüllung der Forderung gefährdet wird."
    },
    {
      "date": "2024-12-19",
      "id": "97032",
      "original_text": "Registerbekanntmachung nach dem Umwandlungsgesetz\nNiedersachsen Amtsgericht Osnabrück HRA 209271\nSimone Vennemann Maklerbüro e.K. – Osnabrück",
      "type": "Registerbekanntmachung nach dem Umwandlungsgesetz",
      "state": "Niedersachsen",
      "amtsgericht": "Amtsgericht Osnabrück",
      "registernummer": "HRA 209271",
      "registerart": "HRA",
      "company_name": "Simone Vennemann Maklerbüro e.K.",
      "company_seat": "Osnabrück",
      "details": "19.12.2024 (Bekanntmachungsdatum)\n\nNiedersachsen Amtsgericht Osnabrück HRA 209271\nRegisterbekanntmachung nach dem Umwandlungsgesetz 19.12.2024 (Eintragungsdatum)\n\nSimone Vennemann Maklerbüro e.K.\nEinzelkaufmann / Einzelkauffrau\nOsnabrück\n\nDen Gläubigern der an der Ausgliederung beteiligten Rechtsträger ist, wenn sie binnen sechs Monaten nach dem Tag, an dem die Eintragung der Ausgliederung in das Register des Sitzes desjenigen Rechtsträgers, dessen Gläubiger sie sind, nach § 19 Abs. 3 UmwG als bekannt gemacht gilt, ihren Anspruch nach Grund und Höhe schriftlich anmelden, Sicherheit zu leisten, soweit sie nicht Befriedigung verlangen können. Dieses Recht steht den Gläubigern jedoch nur zu, wenn sie glaubhaft machen, dass durch die Ausgliederung die Erfüllung der Forderung gefährdet wird."
    },
    {
      "date": "2024-12-19",
      "id": "97033",
      "original_text": "Sonstige Registerbekanntmachung\nNiedersachsen Amtsgericht Braunschweig HRB 110296 früher Amtsgericht Goslar\nStadtwerke Bad Harzburg GmbH – Bad Harzburg",
      "type": "Sonstige Registerbekanntmachung",
      "state": "Niedersachsen",
      "amtsgericht": "Amtsgericht Braunschweig",
      "registernummer": "HRB 110296",
      "registerart": "HRB",
      "company_name": "Stadtwerke Bad Harzburg GmbH",
      "company_seat": "Bad Harzburg",
      "former_amtsgericht": "Goslar",
      "details": "19.12.2024 (Bekanntmachungsdatum)\n\nNiedersachsen Amtsgericht Braunschweig HRB 110296 früher Amtsgericht Goslar\nSonstige Registerbekanntmachung 19.12.2024 (Eintragungsdatum)\n\nStadtwerke Bad Harzburg GmbH\nGesellschaft mit beschränkter Haftung\nBad Harzburg\n\nDen Gläubigern der Gesellschaft, deren Forderungen begründet worden sind, bevor die Eintragung der Beendigung des Vertrages in das Handelsregister nach § 10 HGB als bekanntgemacht gilt, ist vom anderen Vertragsteil Sicherheit zu leisten, wenn sie sich binnen sechs Monaten nach der Bekanntmachung zu diesem Zweck bei ihm melden."
    },
    {
      "date": "2024-12-19",
      "id": "97034",
      "original_text": "Registerbekanntmachung nach dem Umwandlungsgesetz\nNiedersachsen Amtsgericht Aurich HRB 100470 früher Amtsgericht Emden\nF. Rodenburg GmbH Sanitär- und Heizungsbedarf – Emden",
      "type": "Registerbekanntmachung nach dem Umwandlungsgesetz",
      "state": "Niedersachsen",
      "amtsgericht": "Amtsgericht Aurich",
      "registernummer": "HRB 100470",
      "registerart": "HRB",
      "company_name": "F. Rodenburg GmbH Sanitär- und Heizungsbedarf",
      "company_seat": "Emden",
      "former_amtsgericht": "Emden",
      "details": "19.12.2024 (Bekanntmachungsdatum)\n\nNiedersachsen Amtsgericht Aurich HRB 100470 früher Amtsgericht Emden\nRegisterbekanntmachung nach dem Umwandlungsgesetz 19.12.2024 (Eintragungsdatum)\n\nF. Rodenburg GmbH Sanitär- und Heizungsbedarf\nGesellschaft mit beschränkter Haftung\nEmden\n\nDen Gläubigern der an der Verschmelzung beteiligten Rechtsträger ist, wenn sie binnen sechs Monaten nach dem Tag, an dem die Eintragung der Verschmelzung in das Register des Sitzes desjenigen Rechtsträgers, dessen Gläubiger sie sind, nach § 19  Abs.  3 UmwG als bekannt gemacht gilt, ihren Anspruch nach Grund und Höhe schriftlich anmelden, Sicherheit zu leisten, soweit sie nicht Befriedigung verlangen können. Dieses Recht steht den Gläubigern jedoch nur zu, wenn sie glaubhaft machen, dass durch die Verschmelzung die Erfüllung der Forderung gefährdet wird."
    },
    {
      "date": "2024-12-19",
      "id": "97035",
      "original_text": "Sonstige Registerbekanntmachung\nNiedersachsen Amtsgericht Göttingen HRB 206039\nArineo Holding GmbH – Göttingen",
      "type": "Sonstige Registerbekanntmachung",
      "state": "Niedersachsen",
      "amtsgericht": "Amtsgericht Göttingen",
      "registernummer": "HRB 206039",
      "registerart": "HRB",
      "company_name": "Arineo Holding GmbH",
      "company_seat": "Göttingen",
      "details": "19.12.2024 (Bekanntmachungsdatum)\n\nNiedersachsen Amtsgericht Göttingen HRB 206039\nSonstige Registerbekanntmachung 19.12.2024 (Eintragungsdatum)\n\nArineo Holding GmbH\nGesellschaft mit beschränkter Haftung\nGöttingen\n\nDie Liste der Mitglieder des Aufsichtsrats ist zum Handelsregister eingereicht."
    },
    {
      "date": "2024-12-19",
      "id": "97036",
      "original_text": "Registerbekanntmachung nach dem Umwandlungsgesetz\nNiedersachsen Amtsgericht Göttingen HRB 201519\nBK BeteiligungsKonzept GmbH – Göttingen",
      "type": "Registerbekanntmachung nach dem Umwandlungsgesetz",
      "state": "Niedersachsen",
      "amtsgericht": "Amtsgericht Göttingen",
      "registernummer": "HRB 201519",
      "registerart": "HRB",
      "company_name": "BK BeteiligungsKonzept GmbH",
      "company_seat": "Göttingen",
      "details": "19.12.2024 (Bekanntmachungsdatum)\n\nNiedersachsen Amtsgericht Göttingen HRB 201519\nRegisterbekanntmachung nach dem Umwandlungsgesetz 19.12.2024 (Eintragungsdatum)\n\nBK BeteiligungsKonzept GmbH\nGesellschaft mit beschränkter Haftung\nGöttingen\n\nDen Gläubigern der an der Verschmelzung beteiligten Rechtsträger ist, wenn sie binnen sechs Monaten nach dem Tag, an dem die Eintragung der Verschmelzung in das Register des Sitzes desjenigen Rechtsträgers, dessen Gläubiger sie sind, nach § 19  Abs.  3 UmwG als bekannt gemacht gilt, ihren Anspruch nach Grund und Höhe schriftlich anmelden, Sicherheit zu leisten, soweit sie nicht Befriedigung verlangen können. Dieses Recht steht den Gläubigern jedoch nur zu, wenn sie glaubhaft machen, dass durch die Verschmelzung die Erfüllung der Forderung gefährdet wird."
    },
    {
      "date": "2024-12-19",
      "id": "97037",
      "original_text": "Registerbekanntmachung nach dem Umwandlungsgesetz\nBremen Amtsgericht Bremen HRB 37464\nFriendly Finance GmbH – Bremen",
      "type": "Registerbekanntmachung nach dem Umwandlungsgesetz",
      "state": "Bremen",
      "amtsgericht": "Amtsgericht Bremen",
      "registernummer": "HRB 37464",
      "registerart": "HRB",
      "company_name": "Friendly Finance GmbH",
      "company_seat": "Bremen",
      "details": "19.12.2024 (Bekanntmachungsdatum)\n\nBremen Amtsgericht Bremen HRB 37464\nRegisterbekanntmachung nach dem Umwandlungsgesetz 18.12.2024 (Eintragungsdatum)\n\nFriendly Finance GmbH\nGesellschaft mit beschränkter Haftung\nBremen\n\nZu Eintragungsnummer 2 vom 18.12.2024 wird als nicht eingetragen veröffentlicht: Den Gläubigern der an der Verschmelzung beteiligten Rechtsträger ist, wenn sie binnen sechs Monaten nach dem Tag, an dem die Eintragung der Verschmelzung in das Register des Sitzes desjenigen Rechtsträgers, dessen Gläubiger sie sind, als bekannt gemacht gilt, ihren Anspruch nach Grund und Höhe schriftlich anmelden, Sicherheit zu leisten, soweit sie nicht Befriedigung verlangen können. Dieses Recht steht den Gläubigern jedoch nur zu, wenn sie glaubhaft machen, dass durch die Verschmelzung die Erfüllung ihrer Forderung gefährdet wird. Das Recht, Sicherheitsleistung zu verlangen, steht Gläubigern nicht zu, die im Falle der Insolvenz ein Recht auf vorzugsweise Befriedigung aus einer Deckungsmasse haben, die nach gesetzlicher Vorschrift zu ihrem Schutz errichtet und staatlich überwacht ist."
    },
    {
      "date": "2024-12-19",
      "id": "97038",
      "original_text": "Registerbekanntmachung nach dem Umwandlungsgesetz\nBremen Amtsgericht Bremen HRB 8150\nBruker Daltonik GmbH – Bremen",
      "type": "Registerbekanntmachung nach dem Umwandlungsgesetz",
      "state": "Bremen",
      "amtsgericht": "Amtsgericht Bremen",
      "registernummer": "HRB 8150",
      "registerart": "HRB",
      "company_name": "Bruker Daltonik GmbH",
      "company_seat": "Bremen",
      "details": "19.12.2024 (Bekanntmachungsdatum)\n\nBremen Amtsgericht Bremen HRB 8150\nRegisterbekanntmachung nach dem Umwandlungsgesetz 18.12.2024 (Eintragungsdatum)\n\nBruker Daltonik GmbH\nGesellschaft mit beschränkter Haftung\nBremen\n\nZu Eintragungsnummer 49 vom 18.12.2024 wird als nicht eingetragen veröffentlicht:  Den Gläubigern ist, wenn sie binnen sechs Monaten nach dem Tag, an dem die Eintragung der Umwandlung als bekannt gemacht gilt, ihren Anspruch nach Grund und Höhe schriftlich anmelden, Sicherheit zu leisten, soweit sie nicht Befriedigung verlangen können. Dieses Recht steht den Gläubigern jedoch nur zu, wenn sie glaubhaft machen, dass durch die Umwandlung die Erfüllung ihrer Forderung gefährdet wird. Das Recht, Sicherheitsleistung zu verlangen, steht Gläubigern nicht zu, die im Falle der Insolvenz ein Recht auf vorzugsweise Befriedigung aus einer Deckungsmasse haben, die nach gesetzlicher Vorschrift zu ihrem Schutz errichtet und staatlich überwacht ist."
    },
    {
      "date": "2024-12-19",
      "id": "97039",
      "original_text": "Registerbekanntmachung nach dem Umwandlungsgesetz\nBremen Amtsgericht Bremen HRB 41011\nBruker Daltonik SE – Bremen",
      "type": "Registerbekanntmachung nach dem Umwandlungsgesetz",
      "state": "Bremen",
      "amtsgericht": "Amtsgericht Bremen",
      "registernummer": "HRB 41011",
      "registerart": "HRB",
      "company_name": "Bruker Daltonik SE",
      "company_seat": "Bremen",
      "details": "19.12.2024 (Bekanntmachungsdatum)\n\nBremen Amtsgericht Bremen HRB 41011\nRegisterbekanntmachung nach dem Umwandlungsgesetz 18.12.2024 (Eintragungsdatum)\n\nBruker Daltonik SE\nEuropäische Aktiengesellschaft (SE)\nBremen\n\nZu Eintragungsnummer 1 vom 18.12.2024 wird als nicht eingetragen veröffentlicht:  Den Gläubigern ist, wenn sie binnen sechs Monaten nach dem Tag, an dem die Eintragung der Umwandlung als bekannt gemacht gilt, ihren Anspruch nach Grund und Höhe schriftlich anmelden, Sicherheit zu leisten, soweit sie nicht Befriedigung verlangen können. Dieses Recht steht den Gläubigern jedoch nur zu, wenn sie glaubhaft machen, dass durch die Umwandlung die Erfüllung ihrer Forderung gefährdet wird. Das Recht, Sicherheitsleistung zu verlangen, steht Gläubigern nicht zu, die im Falle der Insolvenz ein Recht auf vorzugsweise Befriedigung aus einer Deckungsmasse haben, die nach gesetzlicher Vorschrift zu ihrem Schutz errichtet und staatlich überwacht ist."
    },
    {
      "date": "2024-12-19",
      "id": "97040",
      "original_text": "Registerbekanntmachung nach dem Umwandlungsgesetz\nBremen Amtsgericht Bremen HRB 41010\nBruker Daltonik AG – Bremen",
      "type": "Registerbekanntmachung nach dem Umwandlungsgesetz",
      "state": "Bremen",
      "amtsgericht": "Amtsgericht Bremen",
      "registernummer": "HRB 41010",
      "registerart": "HRB",
      "company_name": "Bruker Daltonik AG",
      "company_seat": "Bremen",
      "details": "19.12.2024 (Bekanntmachungsdatum)\n\nBremen Amtsgericht Bremen HRB 41010\nRegisterbekanntmachung nach dem Umwandlungsgesetz 18.12.2024 (Eintragungsdatum)\n\nBruker Daltonik AG\nAktiengesellschaft\nBremen\n\nZu Eintragungsnummer 2 vom 18.12.2024 wird als nicht eingetragen veröffentlicht:   Den Gläubigern ist, wenn sie binnen sechs Monaten nach dem Tag, an dem die Eintragung der Umwandlung als bekannt gemacht gilt, ihren Anspruch nach Grund und Höhe schriftlich anmelden, Sicherheit zu leisten, soweit sie nicht Befriedigung verlangen können. Dieses Recht steht den Gläubigern jedoch nur zu, wenn sie glaubhaft machen, dass durch die Umwandlung die Erfüllung ihrer Forderung gefährdet wird. Das Recht, Sicherheitsleistung zu verlangen, steht Gläubigern nicht zu, die im Falle der Insolvenz ein Recht auf vorzugsweise Befriedigung aus einer Deckungsmasse haben, die nach gesetzlicher Vorschrift zu ihrem Schutz errichtet und staatlich überwacht ist."
    },
    {
      "date": "2024-12-19",
      "id": "97041",
      "original_text": "Registerbekanntmachung nach dem Umwandlungsgesetz\nBremen Amtsgericht Bremen HRB 41010\nBruker Daltonik AG – Bremen",
      "type": "Registerbekanntmachung nach dem Umwandlungsgesetz",
      "state": "Bremen",
      "amtsgericht": "Amtsgericht Bremen",
      "registernummer": "HRB 41010",
      "registerart": "HRB",
      "company_name": "Bruker Daltonik AG",
      "company_seat": "Bremen",
      "details": "19.12.2024 (Bekanntmachungsdatum)\n\nBremen Amtsgericht Bremen HRB 41010\nRegisterbekanntmachung nach dem Umwandlungsgesetz 18.12.2024 (Eintragungsdatum)\n\nBruker Daltonik AG\nAktiengesellschaft\nBremen\n\nZu Eintragungsnummer 1 vom 18.12.2024 wird als nicht eingetragen veröffentlicht: Den Gläubigern ist, wenn sie binnen sechs Monaten nach dem Tag, an dem die Eintragung der Umwandlung als bekannt gemacht gilt, ihren Anspruch nach Grund und Höhe schriftlich anmelden, Sicherheit zu leisten, soweit sie nicht Befriedigung verlangen können. Dieses Recht steht den Gläubigern jedoch nur zu, wenn sie glaubhaft machen, dass durch die Umwandlung die Erfüllung ihrer Forderung gefährdet wird. Das Recht, Sicherheitsleistung zu verlangen, steht Gläubigern nicht zu, die im Falle der Insolvenz ein Recht auf vorzugsweise Befriedigung aus einer Deckungsmasse haben, die nach gesetzlicher Vorschrift zu ihrem Schutz errichtet und staatlich überwacht ist."
    },
    {
      "date": "2024-12-19",
      "id": "97042",
      "original_text": "Löschungsankündigung\nBremen Amtsgericht Bremen HRB 37829\nGivayo Möbel GmbH – Bremen",
      "type": "Löschungsankündigung",
      "state": "Bremen",
      "amtsgericht": "Amtsgericht Bremen",
      "registernummer": "HRB 37829",
      "registerart": "HRB",
      "company_name": "Givayo Möbel GmbH",
      "company_seat": "Bremen",
      "details": "19.12.2024 (Bekanntmachungsdatum)\n\nBremen Amtsgericht Bremen HRB 37829\nLöschungsankündigung\n\nGivayo Möbel GmbH\nGesellschaft mit beschränkter Haftung\nBremen\n\nEs ist beabsichtigt die im Handelsregister eingetragene Gesellschaft von Amts wegen gemäß § 394 FamFG zu löschen. Gegen die Löschung kann beim AG Bremen schriftlich oder zu Protokoll der Geschäftsstelle Widerspruch eingelegt werden. Widerspruchsfrist 4 Wochen."
    },
    {
      "date": "2024-12-19",
      "id": "97043",
      "original_text": "Einreichung neuer Dokumente\nRheinland-Pfalz Amtsgericht Koblenz HRB 29994\nEnergie Mayschoß GmbH – Mayschoß",
      "type": "Einreichung neuer Dokumente",
      "state": "Rheinland-Pfalz",
      "amtsgericht": "Amtsgericht Koblenz",
      "registernummer": "HRB 29994",
      "registerart": "HRB",
      "company_name": "Energie Mayschoß GmbH",
      "company_seat": "Mayschoß",
      "details": "19.12.2024 (Bekanntmachungsdatum)\n\nRheinland-Pfalz Amtsgericht Koblenz HRB 29994\nEinreichung neuer Dokumente 19.12.2024 (Eintragungsdatum)\n\nEnergie Mayschoß GmbH\nGesellschaft mit beschränkter Haftung\nMayschoß\n\nDem Registergericht ist eine neue Liste der Mitglieder des Aufsichtsrates eingereicht worden."
    },
    {
      "date": "2024-12-19",
      "id": "97044",
      "original_text": "Registerbekanntmachung nach dem Umwandlungsgesetz\nRheinland-Pfalz Amtsgericht Mainz HRB 53364\nHortus Palatinus GmbH – Ingelheim am Rhein",
      "type": "Registerbekanntmachung nach dem Umwandlungsgesetz",
      "state": "Rheinland-Pfalz",
      "amtsgericht": "Amtsgericht Mainz",
      "registernummer": "HRB 53364",
      "registerart": "HRB",
      "company_name": "Hortus Palatinus GmbH",
      "company_seat": "Ingelheim am Rhein",
      "details": "19.12.2024 (Bekanntmachungsdatum)\n\nRheinland-Pfalz Amtsgericht Mainz HRB 53364\nRegisterbekanntmachung nach dem Umwandlungsgesetz 19.12.2024 (Eintragungsdatum)\n\nHortus Palatinus GmbH\nGesellschaft mit beschränkter Haftung\nIngelheim am Rhein\n\nDen Gläubigern des formwechselnden Rechtsträgers ist, wenn sie binnen sechs Monaten nach dem Tag, an dem die Eintragung des Formwechsels nach § 201 UmwG als bekannt gemacht gilt, ihren Anspruch nach Grund und Höhe schriftlich anmelden, Sicherheit zu leisten, soweit sie nicht Befriedigung verlangen können. Dieses Recht steht den Gläubigern jedoch nur zu, wenn sie glaubhaft machen, dass durch den Formwechsel die Erfüllung ihrer Forderung gefährdet wird."
    },
    {
      "date": "2024-12-19",
      "id": "97045",
      "original_text": "Registerbekanntmachung nach dem Umwandlungsgesetz\nRheinland-Pfalz Amtsgericht Montabaur HRA 23202\nB.IT Solutions e.K. – Höhr-Grenzhausen",
      "type": "Registerbekanntmachung nach dem Umwandlungsgesetz",
      "state": "Rheinland-Pfalz",
      "amtsgericht": "Amtsgericht Montabaur",
      "registernummer": "HRA 23202",
      "registerart": "HRA",
      "company_name": "B.IT Solutions e.K.",
      "company_seat": "Höhr-Grenzhausen",
      "details": "19.12.2024 (Bekanntmachungsdatum)\n\nRheinland-Pfalz Amtsgericht Montabaur HRA 23202\nRegisterbekanntmachung nach dem Umwandlungsgesetz 19.12.2024 (Eintragungsdatum)\n\nB.IT Solutions e.K.\nEinzelkaufmann / Einzelkauffrau\nHöhr-Grenzhausen\n\nAls nicht eingetragen wird veröffentlicht: Den Gläubigern der an der Ausgliederung beteiligten Rechtsträger ist, wenn sie binnen sechs Monaten nac hdem Tag, an dem die Eintragung der Ausgliederung in das Register des Sitzes desjenigen Rechtsträgers, dessen Gläubiger sie sind, nach § 19 Abs. 3 UmwG als bekannt gemacht gilt, ihren Anspruch nach Grund und Höhe schriftlich anmelden, Sicherheit zu leisten, soweit sie nicht Befriedigung verlangen können. Dieses Recht steht den Gläubigern jedoch nur zu, wenn sie glaubhaft machen, dass durch die Ausgliederung die Erfüllung der Forderung gefährdet wird."
    },
    {
      "date": "2024-12-19",
      "id": "97046",
      "original_text": "Registerbekanntmachung nach dem Umwandlungsgesetz\nRheinland-Pfalz Amtsgericht Bad Kreuznach HRA 11621\nSteinwerk Allenbach GmbH & Co KG – Allenbach",
      "type": "Registerbekanntmachung nach dem Umwandlungsgesetz",
      "state": "Rheinland-Pfalz",
      "amtsgericht": "Amtsgericht Bad Kreuznach",
      "registernummer": "HRA 11621",
      "registerart": "HRA",
      "company_name": "Steinwerk Allenbach GmbH & Co KG",
      "company_seat": "Allenbach",
      "details": "19.12.2024 (Bekanntmachungsdatum)\n\nRheinland-Pfalz Amtsgericht Bad Kreuznach HRA 11621\nRegisterbekanntmachung nach dem Umwandlungsgesetz 19.12.2024 (Eintragungsdatum)\n\nSteinwerk Allenbach GmbH & Co KG\nKommanditgesellschaft\nAllenbach\n\nAls nicht eingetragen wird veröffentlicht: Den Gläubigern der an der Verschmelzung beteiligten Rechtsträger ist, wenn sie binnen sechs Monaten nach dem Tag, an dem die Eintragung der Verschmelzung in das Register des Sitzes desjenigen Rechtsträgers, dessen Gläubiger sie sind, nach § 19 Abs. 3 UmwG als bekannt gemacht gilt, ihren Anspruch nach Grund und Höhe schriftlich anmelden, Sicherheit zu leisten, soweit sie nicht Befriedigung verlangen können. Dieses Recht steht den Gläubigern jedoch nur zu, wenn sie glaubhaft machen, dass durch die Verschmelzung die Erfüllung der Forderung gefährdet wird."
    },
    {
      "date": "2024-12-19",
      "id": "97047",
      "original_text": "Löschungsankündigung\nRheinland-Pfalz Amtsgericht Ludwigshafen a.Rhein (Ludwigshafen) HRB 68496\nAYKAD UG (haftungsbeschränkt) – Ludwigshafen am Rhein",
      "type": "Löschungsankündigung",
      "state": "Rheinland-Pfalz",
      "amtsgericht": "Amtsgericht Ludwigshafen a.Rhein (Ludwigshafen)",
      "registernummer": "HRB 68496",
      "registerart": "HRB",
      "company_name": "AYKAD UG (haftungsbeschränkt)",
      "company_seat": "Ludwigshafen am Rhein",
      "details": "19.12.2024 (Bekanntmachungsdatum)\n\nRheinland-Pfalz Amtsgericht Ludwigshafen a.Rhein (Ludwigshafen) HRB 68496\nLöschungsankündigung\n\nAYKAD UG (haftungsbeschränkt)\nGesellschaft mit beschränkter Haftung\nLudwigshafen am Rhein\n\nDas Registergericht beabsichtigt die Gesellschaft von Amts wegen nach § 394 FamFG zu löschen. Die Frist zur Erhebung eines Widerspruchs ist auf einen Monat festgesetzt."
    },
    {
      "date": "2024-12-19",
      "id": "97048",
      "original_text": "Registerbekanntmachung nach dem Umwandlungsgesetz\nRheinland-Pfalz Amtsgericht Koblenz HRB 25090\nDieter Kirstgen GmbH – Mayen",
      "type": "Registerbekanntmachung nach dem Umwandlungsgesetz",
      "state": "Rheinland-Pfalz",
      "amtsgericht": "Amtsgericht Koblenz",
      "registernummer": "HRB 25090",
      "registerart": "HRB",
      "company_name": "Dieter Kirstgen GmbH",
      "company_seat": "Mayen",
      "details": "19.12.2024 (Bekanntmachungsdatum)\n\nRheinland-Pfalz Amtsgericht Koblenz HRB 25090\nRegisterbekanntmachung nach dem Umwandlungsgesetz 19.12.2024 (Eintragungsdatum)\n\nDieter Kirstgen GmbH\nGesellschaft mit beschränkter Haftung\nMayen\n\nAls nicht eingetragen wird veröffentlicht: Den Gläubigern der an der Verschmelzung beteiligten Rechtsträger ist, wenn sie binnen sechs Monaten nach dem Tag, an dem die Eintragung der Verschmelzung in das Register des Sitzes desjenigen Rechtsträgers,dessen Gläubiger sie sind, nach § 19 Abs. 3 UmwG als bekannt gemacht gilt, ihren Anspruch nach Grund und Höhe schriftlich anmelden, Sicherheit zu leisten, soweit sie nicht Befriedigung verlangen können. Dieses Recht steht den Gläubigern jedoch nur zu, wenn sie glaubhaft machen, dass durch die Verschmelzung die Erfüllungd er Forderung gefährdet wird."
    },
    {
      "date": "2024-12-19",
      "id": "97049",
      "original_text": "Registerbekanntmachung nach dem Umwandlungsgesetz\nRheinland-Pfalz Amtsgericht Bad Kreuznach HRB 23813\nCB Ventures UG (haftungsbeschränkt) – Beltheim",
      "type": "Registerbekanntmachung nach dem Umwandlungsgesetz",
      "state": "Rheinland-Pfalz",
      "amtsgericht": "Amtsgericht Bad Kreuznach",
      "registernummer": "HRB 23813",
      "registerart": "HRB",
      "company_name": "CB Ventures UG (haftungsbeschränkt)",
      "company_seat": "Beltheim",
      "details": "19.12.2024 (Bekanntmachungsdatum)\n\nRheinland-Pfalz Amtsgericht Bad Kreuznach HRB 23813\nRegisterbekanntmachung nach dem Umwandlungsgesetz 19.12.2024 (Eintragungsdatum)\n\nCB Ventures UG (haftungsbeschränkt)\nGesellschaft mit beschränkter Haftung\nBeltheim\n\nAls nicht eingetragen wird veröffentlicht: Den Gläubigern der an der Verschmelzung beteiligten Rechtsträger ist, wenn sie binnen sechs Monaten nach dem Tag, an dem die Eintragung der Verschmelzung in das Register des Sitzes desjenigen Rechtsträgers, dessen Gläubiger sie sind, nach § 19 Abs. 3 UmwG als bekannt gemacht gilt, ihren Anspruch nach Grund und Höhe schriftlich anmelden, Sicherheit zu leisten, soweit sie nicht Befriedigung verlangen können. Dieses Recht steht den Gläubigern jedoch nur zu, wenn sie glaubhaft machen, dass durch die Verschmelzung die Erfüllung der Forderung gefährdet wird."
    },
    {
      "date": "2024-12-19",
      "id": "97050",
      "original_text": "Registerbekanntmachung nach dem Umwandlungsgesetz\nNordrhein-Westfalen Amtsgericht Bielefeld HRB 45894\nMeyer Menü BI GmbH – Bielefeld",
      "type": "Registerbekanntmachung nach dem Umwandlungsgesetz",
      "state": "Nordrhein-Westfalen",
      "amtsgericht": "Amtsgericht Bielefeld",
      "registernummer": "HRB 45894",
      "registerart": "HRB",
      "company_name": "Meyer Menü BI GmbH",
      "company_seat": "Bielefeld",
      "details": "19.12.2024 (Bekanntmachungsdatum)\n\nNordrhein-Westfalen Amtsgericht Bielefeld HRB 45894\nRegisterbekanntmachung nach dem Umwandlungsgesetz 19.12.2024 (Eintragungsdatum)\n\nMeyer Menü BI GmbH\nGesellschaft mit beschränkter Haftung\nBielefeld\n\nDen Gläubigern der an der Verschmelzung beteiligten Rechtsträger ist, wenn sie binnen sechs Monaten nach dem Tag, an dem die Eintragung der Verschmelzung in das Register des Sitzes desjenigen Rechtsträgers, dessen Gläubiger sie sind, nach § 19 Absatz 3 UmwG als bekanntgemacht gilt, ihren Anspruch nach Grund und Höhe schriftlich anmelden, Sicherheit zu leisten, soweit sie nicht Befriedigung verlangen können. Dieses Recht steht den Gläubigern jedoch nur zu, wenn sie glaubhaft machen, dass durch die Verschmelzung die Erfüllung ihrer Forderung gefährdet wird."
    },
    {
      "date": "2024-12-19",
      "id": "97051",
      "original_text": "Löschungsankündigung\nNordrhein-Westfalen Amtsgericht Köln HRB 99427\nPTL-Dienstleistungen GmbH – Kerpen",
      "type": "Löschungsankündigung",
      "state": "Nordrhein-Westfalen",
      "amtsgericht": "Amtsgericht Köln",
      "registernummer": "HRB 99427",
      "registerart": "HRB",
      "company_name": "PTL-Dienstleistungen GmbH",
      "company_seat": "Kerpen",
      "details": "19.12.2024 (Bekanntmachungsdatum)\n\nNordrhein-Westfalen Amtsgericht Köln HRB 99427\nLöschungsankündigung\n\nPTL-Dienstleistungen GmbH\nGesellschaft mit beschränkter Haftung\nKerpen\n\nDas Registergericht beabsichtigt die Gesellschaft von Amts wegen nach § 394 FamFG zu löschen. Die Frist zur Erhebung eines Widerspruchs ist auf einen Monat festgesetzt."
    },
    {
      "date": "2024-12-19",
      "id": "97052",
      "original_text": "Sonstige Registerbekanntmachung\nNordrhein-Westfalen Amtsgericht Köln HRB 56769\nGothaer Lebensversicherung Aktiengesellschaft – Köln",
      "type": "Sonstige Registerbekanntmachung",
      "state": "Nordrhein-Westfalen",
      "amtsgericht": "Amtsgericht Köln",
      "registernummer": "HRB 56769",
      "registerart": "HRB",
      "company_name": "Gothaer Lebensversicherung Aktiengesellschaft",
      "company_seat": "Köln",
      "details": "19.12.2024 (Bekanntmachungsdatum)\n\nNordrhein-Westfalen Amtsgericht Köln HRB 56769\nSonstige Registerbekanntmachung\n\nGothaer Lebensversicherung Aktiengesellschaft\nAktiengesellschaft\nKöln\n\nDem Registergericht ist eine Liste der Mitglieder des Aufsichtsrates eingereicht worden."
    },
    {
      "date": "2024-12-19",
      "id": "97053",
      "original_text": "Sonstige Registerbekanntmachung\nNordrhein-Westfalen Amtsgericht Paderborn HRB 7790\nMZG-Pflege GmbH – Bad Lippspringe",
      "type": "Sonstige Registerbekanntmachung",
      "state": "Nordrhein-Westfalen",
      "amtsgericht": "Amtsgericht Paderborn",
      "registernummer": "HRB 7790",
      "registerart": "HRB",
      "company_name": "MZG-Pflege GmbH",
      "company_seat": "Bad Lippspringe",
      "details": "19.12.2024 (Bekanntmachungsdatum)\n\nNordrhein-Westfalen Amtsgericht Paderborn HRB 7790\nSonstige Registerbekanntmachung\n\nMZG-Pflege GmbH\nGesellschaft mit beschränkter Haftung\nBad Lippspringe\n\nDem Registergericht ist eine Liste der Mitglieder des Aufsichtsrates eingereicht worden."
    },
    {
      "date": "2024-12-19",
      "id": "97054",
      "original_text": "Löschungsankündigung\nNordrhein-Westfalen Amtsgericht Dortmund HRB 3773\nBusreisen Werning GmbH. – Dortmund",
      "type": "Löschungsankündigung",
      "state": "Nordrhein-Westfalen",
      "amtsgericht": "Amtsgericht Dortmund",
      "registernummer": "HRB 3773",
      "registerart": "HRB",
      "company_name": "Busreisen Werning GmbH.",
      "company_seat": "Dortmund",
      "details": "19.12.2024 (Bekanntmachungsdatum)\n\nNordrhein-Westfalen Amtsgericht Dortmund HRB 3773\nLöschungsankündigung\n\nBusreisen Werning GmbH.\nGesellschaft mit beschränkter Haftung\nDortmund\n\nDas Registergericht beabsichtigt die Gesellschaft von Amts wegen nach § 394 FamFG zu löschen. Die Frist zur Erhebung eines Widerspruchs ist auf zwei Monate festgesetzt."
    },
    {
      "date": "2024-12-19",
      "id": "97055",
      "original_text": "Löschungsankündigung\nNordrhein-Westfalen Amtsgericht Siegburg HRB 12397\nBeneke Kapitalanlagen GmbH – Hennef",
      "type": "Löschungsankündigung",
      "state": "Nordrhein-Westfalen",
      "amtsgericht": "Amtsgericht Siegburg",
      "registernummer": "HRB 12397",
      "registerart": "HRB",
      "company_name": "Beneke Kapitalanlagen GmbH",
      "company_seat": "Hennef",
      "details": "19.12.2024 (Bekanntmachungsdatum)\n\nNordrhein-Westfalen Amtsgericht Siegburg HRB 12397\nLöschungsankündigung\n\nBeneke Kapitalanlagen GmbH\nGesellschaft mit beschränkter Haftung\nHennef\n\nDas Registergericht hat glaubhafte Kenntnis erlangt, dass die Gesellschaft vermögenslos geworden ist, da ein Insolvenzeröffnungsantrag mangels Masse nach § 26 InsO zurückgewiesen wurde.\n\nEs ist daher beabsichtigt, die Gesellschaft nach § 394 FamFG im Handelsregister wegen Vermögenslosigkeit zu löschen.\n\nEinwände gegen die Löschung sind durch Widerspruch binnen einer Frist von 3 Monaten geltend zu machen, andernfalls die Löschung erfolgen wird.\n\nEinzulegen ist der Widerspruch bei dem Amtsgericht Siegburg, Neue Poststraße 16, 53721 Siegburg, und zwar entweder schriftlich in deutscher Sprache oder mündlich zur Niederschrift der Geschäftsstelle. Der Widerspruch kann auch zur Niederschrift der Geschäftsstelle eines jeden Amtsgerichts abgegeben werden. Der Widerspruch ist binnen der in der Verfügung bestimmten Frist einzulegen. Die Frist ist nur gewahrt, wenn der Widerspruch rechtzeitig bei dem Amtsgericht Siegburg eingeht, auch wenn der Widerspruch zur Niederschrift der Geschäftsstelle eines anderen Amtsgerichts abgegeben wurde. Die Frist beginnt jeweils mit der schriftlichen Bekanntgabe der Verfügung an die Beteiligten. Kann die schriftliche Bekanntgabe an einen Beteiligten nicht bewirkt werden, beginnt die Frist spätestens mit Ablauf von fünf Monaten nach Erlass der Verfügung. Die Bekanntgabe ist entweder durch Zustellung oder am dritten Tage nach Aufgabe zur Post bewirkt. Sofern die Löschung noch nicht erfolgt ist, kann der Widerspruch auch noch nach Ablauf der Frist eingelegt werden. Fällt das Ende der Frist auf einen Sonnabend, einen Sonntag oder einen allgemeinen Feiertag, endet die Frist mit Ablauf des nächsten Werktages. Der Widerspruch ist zu unterzeichnen. Eine Begründung des Widerspruchs ist nicht vorgeschrieben."
    },
    {
      "date": "2024-12-19",
      "id": "97056",
      "original_text": "Registerbekanntmachung nach dem Umwandlungsgesetz\nNordrhein-Westfalen Amtsgericht Dortmund HRB 35649\nactive logistics GmbH – Dortmund",
      "type": "Registerbekanntmachung nach dem Umwandlungsgesetz",
      "state": "Nordrhein-Westfalen",
      "amtsgericht": "Amtsgericht Dortmund",
      "registernummer": "HRB 35649",
      "registerart": "HRB",
      "company_name": "active logistics GmbH",
      "company_seat": "Dortmund",
      "details": "19.12.2024 (Bekanntmachungsdatum)\n\nNordrhein-Westfalen Amtsgericht Dortmund HRB 35649\nRegisterbekanntmachung nach dem Umwandlungsgesetz 12.12.2024 (Eintragungsdatum)\n\nactive logistics GmbH\nGesellschaft mit beschränkter Haftung\nDortmund\n\nDen Gläubigern der an der Verschmelzung beteiligten Rechtsträger ist, wenn sie binnen sechs Monaten nach dem Tag, an dem die Eintragung der Verschmelzung in das Register des Sitzes desjenigen Rechtsträgers, dessen Gläubiger sie sind, nach § 19 Absatz 3 UmwG als bekanntgemacht gilt, ihren Anspruch nach Grund und Höhe schriftlich anmelden, Sicherheit zu leisten, soweit sie nicht Befriedigung verlangen können. Dieses Recht steht den Gläubigern jedoch nur zu, wenn sie glaubhaft machen, dass durch die Verschmelzung die Erfüllung ihrer Forderung gefährdet wird."
    },
    {
      "date": "2024-12-19",
      "id": "97057",
      "original_text": "Registerbekanntmachung nach dem Umwandlungsgesetz\nNordrhein-Westfalen Amtsgericht Arnsberg HRA 9251\nStefan Schmiebusch Betonfuchs e.K. – Rüthen",
      "type": "Registerbekanntmachung nach dem Umwandlungsgesetz",
      "state": "Nordrhein-Westfalen",
      "amtsgericht": "Amtsgericht Arnsberg",
      "registernummer": "HRA 9251",
      "registerart": "HRA",
      "company_name": "Stefan Schmiebusch Betonfuchs e.K.",
      "company_seat": "Rüthen",
      "details": "19.12.2024 (Bekanntmachungsdatum)\n\nNordrhein-Westfalen Amtsgericht Arnsberg HRA 9251\nRegisterbekanntmachung nach dem Umwandlungsgesetz 19.12.2024 (Eintragungsdatum)\n\nStefan Schmiebusch Betonfuchs e.K.\nEinzelkaufmann / Einzelkauffrau\nRüthen\n\nDen Gläubigern der an der Ausgliederung beteiligten Rechtsträger ist, wenn sie binnen sechs Monaten nach dem Tag, an dem die Eintragung der Ausgliederung in das Register des Sitzes desjenigen Rechtsträgers, dessen Gläubiger sie sind, nach § 19 Absatz 3 UmwG als bekanntgemacht gilt, ihren Anspruch nach Grund und Höhe schriftlich anmelden, Sicherheit zu leisten, soweit sie nicht Befriedigung verlangen können. Dieses Recht steht den Gläubigern jedoch nur zu, wenn sie glaubhaft machen, dass durch die Ausgliederung die Erfüllung ihrer Forderung gefährdet wird."
    },
    {
      "date": "2024-12-19",
      "id": "97058",
      "original_text": "Registerbekanntmachung nach dem Umwandlungsgesetz\nNordrhein-Westfalen Amtsgericht Köln HRA 34179\nAPM Media GmbH & Co. KG – Köln",
      "type": "Registerbekanntmachung nach dem Umwandlungsgesetz",
      "state": "Nordrhein-Westfalen",
      "amtsgericht": "Amtsgericht Köln",
      "registernummer": "HRA 34179",
      "registerart": "HRA",
      "company_name": "APM Media GmbH & Co. KG",
      "company_seat": "Köln",
      "details": "19.12.2024 (Bekanntmachungsdatum)\n\nNordrhein-Westfalen Amtsgericht Köln HRA 34179\nRegisterbekanntmachung nach dem Umwandlungsgesetz 19.12.2024 (Eintragungsdatum)\n\nAPM Media GmbH & Co. KG\nKommanditgesellschaft\nKöln\n\nDen Gläubigern der an der Verschmelzung beteiligten Rechtsträger ist, wenn sie binnen sechs Monaten nach dem Tag, an dem die Eintragung der Verschmelzung in das Register des Sitzes desjenigen Rechtsträgers, dessen Gläubiger sie sind, nach § 19 Absatz 3 UmwG als bekanntgemacht gilt, ihren Anspruch nach Grund und Höhe schriftlich anmelden, Sicherheit zu leisten, soweit sie nicht Befriedigung verlangen können. Dieses Recht steht den Gläubigern jedoch nur zu, wenn sie glaubhaft machen, dass durch die Verschmelzung die Erfüllung ihrer Forderung gefährdet wird."
    },
    {
      "date": "2024-12-19",
      "id": "97059",
      "original_text": "Einreichung neuer Dokumente\nNordrhein-Westfalen Amtsgericht Bochum HRB 18610\nDRK-Pflegedienste in Witten gemeinnützige GmbH – Witten",
      "type": "Einreichung neuer Dokumente",
      "state": "Nordrhein-Westfalen",
      "amtsgericht": "Amtsgericht Bochum",
      "registernummer": "HRB 18610",
      "registerart": "HRB",
      "company_name": "DRK-Pflegedienste in Witten gemeinnützige GmbH",
      "company_seat": "Witten",
      "details": "19.12.2024 (Bekanntmachungsdatum)\n\nNordrhein-Westfalen Amtsgericht Bochum HRB 18610\nEinreichung neuer Dokumente\n\nDRK-Pflegedienste in Witten gemeinnützige GmbH\nGesellschaft mit beschränkter Haftung\nWitten\n\nDem Registergericht ist eine Liste der Mitglieder des Aufsichtsrates eingereicht worden."
    },
    {
      "date": "2024-12-19",
      "id": "97060",
      "original_text": "Registerbekanntmachung nach dem Umwandlungsgesetz\nNordrhein-Westfalen Amtsgericht Arnsberg HRB 15670\nBetonfuchs Meisterbetrieb GmbH – Rüthen",
      "type": "Registerbekanntmachung nach dem Umwandlungsgesetz",
      "state": "Nordrhein-Westfalen",
      "amtsgericht": "Amtsgericht Arnsberg",
      "registernummer": "HRB 15670",
      "registerart": "HRB",
      "company_name": "Betonfuchs Meisterbetrieb GmbH",
      "company_seat": "Rüthen",
      "details": "19.12.2024 (Bekanntmachungsdatum)\n\nNordrhein-Westfalen Amtsgericht Arnsberg HRB 15670\nRegisterbekanntmachung nach dem Umwandlungsgesetz 19.12.2024 (Eintragungsdatum)\n\nBetonfuchs Meisterbetrieb GmbH\nGesellschaft mit beschränkter Haftung\nRüthen\n\nDen Gläubigern der an der Ausgliederung beteiligten Rechtsträger ist, wenn sie binnen sechs Monaten nach dem Tag, an dem die Eintragung der Ausgliederung in das Register des Sitzes desjenigen Rechtsträgers, dessen Gläubiger sie sind, nach § 19 Absatz 3 UmwG als bekanntgemacht gilt, ihren Anspruch nach Grund und Höhe schriftlich anmelden, Sicherheit zu leisten, soweit sie nicht Befriedigung verlangen können. Dieses Recht steht den Gläubigern jedoch nur zu, wenn sie glaubhaft machen, dass durch die Ausgliederung die Erfüllung ihrer Forderung gefährdet wird."
    },
    {
      "date": "2024-12-19",
      "id": "97061",
      "original_text": "Einreichung neuer Dokumente\nNordrhein-Westfalen Amtsgericht Köln HRB 112004\nDHD Digital Health Development AG – Köln",
      "type": "Einreichung neuer Dokumente",
      "state": "Nordrhein-Westfalen",
      "amtsgericht": "Amtsgericht Köln",
      "registernummer": "HRB 112004",
      "registerart": "HRB",
      "company_name": "DHD Digital Health Development AG",
      "company_seat": "Köln",
      "details": "19.12.2024 (Bekanntmachungsdatum)\n\nNordrhein-Westfalen Amtsgericht Köln HRB 112004\nEinreichung neuer Dokumente\n\nDHD Digital Health Development AG\nAktiengesellschaft\nKöln\n\nDem Registergericht ist eine neue Liste der Mitglieder des Aufsichtsrates eingereicht worden."
    },
    {
      "date": "2024-12-19",
      "id": "97062",
      "original_text": "Löschungsankündigung\nNordrhein-Westfalen Amtsgericht Aachen HRB 21968\nJovida Verwaltungs UG (haftungsbeschränkt) – Übach-Palenberg",
      "type": "Löschungsankündigung",
      "state": "Nordrhein-Westfalen",
      "amtsgericht": "Amtsgericht Aachen",
      "registernummer": "HRB 21968",
      "registerart": "HRB",
      "company_name": "Jovida Verwaltungs UG (haftungsbeschränkt)",
      "company_seat": "Übach-Palenberg",
      "details": "19.12.2024 (Bekanntmachungsdatum)\n\nNordrhein-Westfalen Amtsgericht Aachen HRB 21968\nLöschungsankündigung\n\nJovida Verwaltungs UG (haftungsbeschränkt)\nGesellschaft mit beschränkter Haftung\nÜbach-Palenberg\n\nDas Registergericht beabsichtigt, von Amts wegen folgende Eintragung wegen Unzulässigkeit nach § 395 FamFG zu löschen:\n\nEintragung des am 26.08.2023 verstorbenen Geschäftsführers Richard Gerullies, geb. am 04.05.1963, wohnhaft in Übach-Palenberg\n\nZur Geltendmachung des Widerspruchs gegen die beabsichtigte Löschung wird hiermit eine Frist von einem Monat ab Veröffentlichung dieser Ankündigung bestimmt.\n\nRechtsbehelfsbelehrung:\n\nGegen diese Verfügung kann Widerspruch eingelegt werden. Zum Widerspruch ist jeder berechtigt, der an der Unterlassung der Löschung ein berechtigtes Interesse hat.\n\nDer Widerspruch ist bei dem Amtsgericht Aachen, Adalbertsteinweg 92, 52070 Aachen schriftlich in deutscher Sprache oder zur Niederschrift der Geschäftsstelle einzulegen. Der Widerspruch kann auch zur Niederschrift der Geschäftsstelle eines jeden Amtsgerichtes abgegeben werden.\n\nDer Widerspruch muss spätestens innerhalb der gesetzten Frist nach der Bekanntgabe der Verfügung bei dem Amtsgericht Aachen eingegangen sein. Dies gilt auch dann, wenn der Widerspruch zur Niederschrift der Geschäftsstelle eines anderen Amtsgerichtes abgegeben wurde. Die Frist beginnt mit der Bekanntgabe der Verfügung durch Veröffentlichung. Fällt das Ende der Frist auf einen Sonntag, einen allgemeinen Feiertag oder Sonnabend, so endet die Frist mit Ablauf des nächsten Werktages.\n\nDer Widerspruch muss die Bezeichnung der angefochtenen Verfügung sowie die Erklärung enthalten, dass Widerspruch gegen diese Verfügung eingelegt wird. Er ist zu unterzeichnen und soll begründet werden.\n\nDie Einlegung ist auch durch Übertragung eines elektronischen Dokuments an die elektronische Poststelle des Gerichts möglich. Das elektronische Dokument muss für die Bearbeitung durch das Gericht geeignet und mit einer qualifizierten elektronischen Signatur der verantwortenden Person versehen sein oder von der verantwortenden Person signiert und auf einem sicheren Übermittlungsweg gemäß § 130 a ZPO nach näherer Maßgabe der Verordnung über die technischen Rahmenbedingungen des elektronischen Rechtsverkehrs und über das besondere elektronische Behördenpostfach (BGBl. I, S. 3803) eingereicht werden. Weitere Informationen erhalten Sie auf der Internetseite www.justiz.de."
    },
    {
      "date": "2024-12-19",
      "id": "97063",
      "original_text": "Registerbekanntmachung nach dem Umwandlungsgesetz\nNordrhein-Westfalen Amtsgericht Siegburg HRA 7164\nWolfgang Kemmerling e.K. – Neunkirchen-Seelscheid",
      "type": "Registerbekanntmachung nach dem Umwandlungsgesetz",
      "state": "Nordrhein-Westfalen",
      "amtsgericht": "Amtsgericht Siegburg",
      "registernummer": "HRA 7164",
      "registerart": "HRA",
      "company_name": "Wolfgang Kemmerling e.K.",
      "company_seat": "Neunkirchen-Seelscheid",
      "details": "19.12.2024 (Bekanntmachungsdatum)\n\nNordrhein-Westfalen Amtsgericht Siegburg HRA 7164\nRegisterbekanntmachung nach dem Umwandlungsgesetz 19.12.2024 (Eintragungsdatum)\n\nWolfgang Kemmerling e.K.\nEinzelkaufmann / Einzelkauffrau\nNeunkirchen-Seelscheid\n\nDen Gläubigern der an der #DV.UmF(Text=\"Bitte wählen Sie die zutreffende Art nach UmwG aus!\",Eingabe=\"Verschmelzung\",\"Aufspaltung\",\"Abspaltung\",\"Ausgliederung\",\"Vermögensübertragung\",\"formwechselnden Umwandlung\") beteiligten Rechtsträger ist, wenn sie binnen sechs Monaten nach dem Tag, an dem die Eintragung der #DV.UmF in das Register des Sitzes #DV.RTr(Text=\"Bitte wählen Sie aus, ob ein oder mehrere andere Rechtsträger betroffen sind!\",Eingabe=\"desjenigen Rechtsträgers, dessen Gläubiger\",\"derjenigen Rechtsträger deren Gläubiger\") sie sind, nach § 19 Absatz 3 UmwG als bekanntgemacht gilt, ihren Anspruch nach Grund und Höhe schriftlich anmelden, Sicherheit zu leisten, soweit sie nicht Befriedigung verlangen können. Dieses Recht steht den Gläubigern jedoch nur zu, wenn sie glaubhaft machen, dass durch die #DV.UmF die Erfüllung ihrer Forderung gefährdet wird."
    },
    {
      "date": "2024-12-19",
      "id": "97064",
      "original_text": "Löschungsankündigung\nNordrhein-Westfalen Amtsgericht Wuppertal HRB 33730\nUnitec Energieservice GmbH – Solingen",
      "type": "Löschungsankündigung",
      "state": "Nordrhein-Westfalen",
      "amtsgericht": "Amtsgericht Wuppertal",
      "registernummer": "HRB 33730",
      "registerart": "HRB",
      "company_name": "Unitec Energieservice GmbH",
      "company_seat": "Solingen",
      "details": "19.12.2024 (Bekanntmachungsdatum)\n\nNordrhein-Westfalen Amtsgericht Wuppertal HRB 33730\nLöschungsankündigung\n\nUnitec Energieservice GmbH\nGesellschaft mit beschränkter Haftung\nSolingen\n\nDas Registergericht beabsichtigt die Gesellschaft von Amts wegen nach § 394 FamFG zu löschen. Die Frist zur Erhebung eines Widerspruchs ist auf einen Monat festgesetzt."
    },
    {
      "date": "2024-12-19",
      "id": "97065",
      "original_text": "Registerbekanntmachung nach dem Umwandlungsgesetz\nNordrhein-Westfalen Amtsgericht Siegburg HRA 7174\nKemmerling Besitz UG (haftungsbeschränkt) & Co. KG – Neunkirchen-Seelscheid",
      "type": "Registerbekanntmachung nach dem Umwandlungsgesetz",
      "state": "Nordrhein-Westfalen",
      "amtsgericht": "Amtsgericht Siegburg",
      "registernummer": "HRA 7174",
      "registerart": "HRA",
      "company_name": "Kemmerling Besitz UG (haftungsbeschränkt) & Co. KG",
      "company_seat": "Neunkirchen-Seelscheid",
      "details": "19.12.2024 (Bekanntmachungsdatum)\n\nNordrhein-Westfalen Amtsgericht Siegburg HRA 7174\nRegisterbekanntmachung nach dem Umwandlungsgesetz 19.12.2024 (Eintragungsdatum)\n\nKemmerling Besitz UG (haftungsbeschränkt) & Co. KG\nKommanditgesellschaft\nNeunkirchen-Seelscheid\n\nDen Gläubigern der an der #DV.UmF(Text=\"Bitte wählen Sie die zutreffende Art nach UmwG aus!\",Eingabe=\"Verschmelzung\",\"Aufspaltung\",\"Abspaltung\",\"Ausgliederung\",\"Vermögensübertragung\",\"formwechselnden Umwandlung\") beteiligten Rechtsträger ist, wenn sie binnen sechs Monaten nach dem Tag, an dem die Eintragung der #DV.UmF in das Register des Sitzes #DV.RTr(Text=\"Bitte wählen Sie aus, ob ein oder mehrere andere Rechtsträger betroffen sind!\",Eingabe=\"desjenigen Rechtsträgers, dessen Gläubiger\",\"derjenigen Rechtsträger deren Gläubiger\") sie sind, nach § 19 Absatz 3 UmwG als bekanntgemacht gilt, ihren Anspruch nach Grund und Höhe schriftlich anmelden, Sicherheit zu leisten, soweit sie nicht Befriedigung verlangen können. Dieses Recht steht den Gläubigern jedoch nur zu, wenn sie glaubhaft machen, dass durch die #DV.UmF die Erfüllung ihrer Forderung gefährdet wird."
    },
    {
      "date": "2024-12-19",
      "id": "97066",
      "original_text": "Löschungsankündigung\nNordrhein-Westfalen Amtsgericht Köln HRB 69644\nHBB GmbH – Köln",
      "type": "Löschungsankündigung",
      "state": "Nordrhein-Westfalen",
      "amtsgericht": "Amtsgericht Köln",
      "registernummer": "HRB 69644",
      "registerart": "HRB",
      "company_name": "HBB GmbH",
      "company_seat": "Köln",
      "details": "19.12.2024 (Bekanntmachungsdatum)\n\nNordrhein-Westfalen Amtsgericht Köln HRB 69644\nLöschungsankündigung\n\nHBB GmbH\nGesellschaft mit beschränkter Haftung\nKöln\n\nDas Registergericht beabsichtigt die Gesellschaft von Amts wegen nach § 394 FamFG zu löschen. Die Frist zur Erhebung eines Widerspruchs ist auf einen Monat festgesetzt."
    },
    {
      "date": "2024-12-19",
      "id": "97067",
      "original_text": "Registerbekanntmachung nach dem Umwandlungsgesetz\nNordrhein-Westfalen Amtsgericht Dortmund HRA 19694\nOneWay Sicherung & Dienstleistung e.K. – Dortmund",
      "type": "Registerbekanntmachung nach dem Umwandlungsgesetz",
      "state": "Nordrhein-Westfalen",
      "amtsgericht": "Amtsgericht Dortmund",
      "registernummer": "HRA 19694",
      "registerart": "HRA",
      "company_name": "OneWay Sicherung & Dienstleistung e.K.",
      "company_seat": "Dortmund",
      "details": "19.12.2024 (Bekanntmachungsdatum)\n\nNordrhein-Westfalen Amtsgericht Dortmund HRA 19694\nRegisterbekanntmachung nach dem Umwandlungsgesetz 19.12.2024 (Eintragungsdatum)\n\nOneWay Sicherung & Dienstleistung e.K.\nEinzelkaufmann / Einzelkauffrau\nDortmund\n\nDen Gläubigern der an der Ausgliederung beteiligten Rechtsträger ist, wenn sie binnen sechs Monaten nach dem Tag, an dem die Eintragung der Ausgliederung in das Register des Sitzes desjenigen Rechtsträgers, dessen Gläubiger sie sind, nach § 19 Absatz 3 UmwG als bekanntgemacht gilt, ihren Anspruch nach Grund und Höhe schriftlich anmelden, Sicherheit zu leisten, soweit sie nicht Befriedigung verlangen können. Dieses Recht steht den Gläubigern jedoch nur zu, wenn sie glaubhaft machen, dass durch die Ausgliederung die Erfüllung ihrer Forderung gefährdet wird."
    },
    {
      "date": "2024-12-19",
      "id": "97068",
      "original_text": "Registerbekanntmachung nach dem Umwandlungsgesetz\nNordrhein-Westfalen Amtsgericht Dortmund HRB 35649\nactive logistics GmbH – Dortmund",
      "type": "Registerbekanntmachung nach dem Umwandlungsgesetz",
      "state": "Nordrhein-Westfalen",
      "amtsgericht": "Amtsgericht Dortmund",
      "registernummer": "HRB 35649",
      "registerart": "HRB",
      "company_name": "active logistics GmbH",
      "company_seat": "Dortmund",
      "details": "19.12.2024 (Bekanntmachungsdatum)\n\nNordrhein-Westfalen Amtsgericht Dortmund HRB 35649\nRegisterbekanntmachung nach dem Umwandlungsgesetz 18.12.2024 (Eintragungsdatum)\n\nactive logistics GmbH\nGesellschaft mit beschränkter Haftung\nDortmund\n\nDen Gläubigern der an der Verschmelzung beteiligten Rechtsträger ist, wenn sie binnen sechs Monaten nach dem Tag, an dem die Eintragung der Verschmelzung in das Register des Sitzes desjenigen Rechtsträgers, dessen Gläubiger sie sind, nach § 19 Absatz 3 UmwG als bekanntgemacht gilt, ihren Anspruch nach Grund und Höhe schriftlich anmelden, Sicherheit zu leisten, soweit sie nicht Befriedigung verlangen können. Dieses Recht steht den Gläubigern jedoch nur zu, wenn sie glaubhaft machen, dass durch die Verschmelzung die Erfüllung ihrer Forderung gefährdet wird."
    },
    {
      "date": "2024-12-19",
      "id": "97069",
      "original_text": "Löschungsankündigung\nNordrhein-Westfalen Amtsgericht Gelsenkirchen HRB 17663\nBorbo GmbH – Gelsenkirchen",
      "type": "Löschungsankündigung",
      "state": "Nordrhein-Westfalen",
      "amtsgericht": "Amtsgericht Gelsenkirchen",
      "registernummer": "HRB 17663",
      "registerart": "HRB",
      "company_name": "Borbo GmbH",
      "company_seat": "Gelsenkirchen",
      "details": "19.12.2024 (Bekanntmachungsdatum)\n\nNordrhein-Westfalen Amtsgericht Gelsenkirchen HRB 17663\nLöschungsankündigung\n\nBorbo GmbH\nGesellschaft mit beschränkter Haftung\nGelsenkirchen\n\nDas Gericht beabsichtigt, die Gesellschaft Borbo GmbH mit Sitz in Gelsenkirchen, HRB 17663 Amtsgericht Gelsenkirchen, wegen Vermögenslosigkeit zu löschen.\n\nHiermit wird denjenigen, die an der Unterlassung der Löschung ein berechtigtes Interesse haben, gem. § 394 Abs. 2 FamFG Gelegenheit gegeben, gegen dieses Vorhaben binnen eines Monats nach dieser Bekanntmachung Widerspruch einzulegen. Der Widerspruch kann schriftlich oder zu Protokoll der Geschäftsstelle erhoben werden."
    },
    {
      "date": "2024-12-19",
      "id": "97070",
      "original_text": "Löschungsankündigung\nNordrhein-Westfalen Amtsgericht Münster HRB 15067\nMTI Gastronomieservice GmbH – Warendorf",
      "type": "Löschungsankündigung",
      "state": "Nordrhein-Westfalen",
      "amtsgericht": "Amtsgericht Münster",
      "registernummer": "HRB 15067",
      "registerart": "HRB",
      "company_name": "MTI Gastronomieservice GmbH",
      "company_seat": "Warendorf",
      "details": "19.12.2024 (Bekanntmachungsdatum)\n\nNordrhein-Westfalen Amtsgericht Münster HRB 15067\nLöschungsankündigung 19.12.2024 (Eintragungsdatum)\n\nMTI Gastronomieservice GmbH\nGesellschaft mit beschränkter Haftung\nWarendorf\n\nDas Registergericht beabsichtigt die Gesellschaft von Amts wegen nach § 394 FamFG zu löschen. Die Frist zur Erhebung eines Widerspruchs ist auf einen Monat festgesetzt.\n\nRechtbehelfsbelehrung:\n\nGegen diese Verfügung können Sie Widerspruch einlegen.\n\nDer Widerspruch ist bei dem Amtsgericht Münster, Gerichtsstraße 2 bis 6, 48149 Münster schriftlich in deutscher Sprache oder zur Niederschrift der Geschäftsstelle eines jeden Amtsgerichtes abgegeben werden.\nDie Einlegung ist auch durch Übertragung eines elektronischen Dokuments an die elektronische Poststelle des Gerichts möglich. Das elektronische Dokument muss für die Bearbeitung durch das Gericht geeignet und mit einer qualifizierten elektronischen Signatur der verantwortenden Person versehen sein oder von der verantwortenden Person signiert und auf einem sicheren Übermittlungsweg gem. § 130a ZPO nach nähere Maßgabe der Verordnung über die technischen Rahmenbedingungen des elektronischen Rechtsverkehrs und über das besondere elektronische Behördenpostfach (BGBI. I. S.3808) eingereicht werden. Weitere Informationen erhalten Sie auf der Internetseite www.justiz.de.\n\nDer Widerspruch muss spätestens innerhalb der gesetzten Frist nach der schriftlichen Bekanntgabe der Verfügung bei dem Amtsgericht Münster eingegangen sein. Dies gilt auch dann, wenn der Widerspruch zur Niederschrift der Geschäftsstelle eines anderen Amtsgerichtes abgegeben wurde. Die Frist beginnt mit der schriftlichen Bekanntgabe der Verfügung, spätestens mit Ablauf von fünf Monaten nach Erlass der Verfügung. Die Bekanntgabe ist entweder durch Zustellung oder am dritten Tage nach Aufgabe zur Post bewirkt. Fällt das Ende der First auf einen Sonntag, einen allgemeinen Feiertag oder Sonnabend, so endet die Frist mit Ablauf des nächsten Werktages.\n\nDer Widerspruch muss die Bezeichnung der angefochtenen Verfügung sowie die Erklärung enthalten, dass Widerspruch gegen diese Verfügung eingelegt wird. Er ist zu unterzeichnen  und soll begründet werden."
    },
    {
      "date": "2024-12-19",
      "id": "97071",
      "original_text": "Löschungsankündigung\nNordrhein-Westfalen Amtsgericht Köln HRB 86721\nHM Taxiunternehmen UG (haftungsbeschränkt) – Köln",
      "type": "Löschungsankündigung",
      "state": "Nordrhein-Westfalen",
      "amtsgericht": "Amtsgericht Köln",
      "registernummer": "HRB 86721",
      "registerart": "HRB",
      "company_name": "HM Taxiunternehmen UG (haftungsbeschränkt)",
      "company_seat": "Köln",
      "details": "19.12.2024 (Bekanntmachungsdatum)\n\nNordrhein-Westfalen Amtsgericht Köln HRB 86721\nLöschungsankündigung\n\nHM Taxiunternehmen UG (haftungsbeschränkt)\nGesellschaft mit beschränkter Haftung\nKöln\n\nDas Registergericht beabsichtigt die Gesellschaft von Amts wegen nach § 394 FamFG zu löschen. Die Frist zur Erhebung eines Widerspruchs ist auf einen Monat festgesetzt."
    },
    {
      "date": "2024-12-19",
      "id": "97072",
      "original_text": "Einreichung neuer Dokumente\nNordrhein-Westfalen Amtsgericht Paderborn HRB 11572\nWestfalen Weser Netz GmbH – Paderborn",
      "type": "Einreichung neuer Dokumente",
      "state": "Nordrhein-Westfalen",
      "amtsgericht": "Amtsgericht Paderborn",
      "registernummer": "HRB 11572",
      "registerart": "HRB",
      "company_name": "Westfalen Weser Netz GmbH",
      "company_seat": "Paderborn",
      "details": "19.12.2024 (Bekanntmachungsdatum)\n\nNordrhein-Westfalen Amtsgericht Paderborn HRB 11572\nEinreichung neuer Dokumente\n\nWestfalen Weser Netz GmbH\nGesellschaft mit beschränkter Haftung\nPaderborn\n\nDem Registergericht ist eine Liste der Mitglieder des Aufsichtsrates eingereicht worden."
    },
    {
      "date": "2024-12-19",
      "id": "97073",
      "original_text": "Registerbekanntmachung nach dem Umwandlungsgesetz\nNordrhein-Westfalen Amtsgericht Köln HRA 36949\nAPM Media II GmbH & Co. KG – Köln",
      "type": "Registerbekanntmachung nach dem Umwandlungsgesetz",
      "state": "Nordrhein-Westfalen",
      "amtsgericht": "Amtsgericht Köln",
      "registernummer": "HRA 36949",
      "registerart": "HRA",
      "company_name": "APM Media II GmbH & Co. KG",
      "company_seat": "Köln",
      "details": "19.12.2024 (Bekanntmachungsdatum)\n\nNordrhein-Westfalen Amtsgericht Köln HRA 36949\nRegisterbekanntmachung nach dem Umwandlungsgesetz 19.12.2024 (Eintragungsdatum)\n\nAPM Media II GmbH & Co. KG\nKommanditgesellschaft\nKöln\n\nDen Gläubigern der an der Verschmelzung beteiligten Rechtsträger ist, wenn sie binnen sechs Monaten nach dem Tag, an dem die Eintragung der Verschmelzung in das Register des Sitzes desjenigen Rechtsträgers, dessen Gläubiger sie sind, nach § 19 Absatz 3 UmwG als bekanntgemacht gilt, ihren Anspruch nach Grund und Höhe schriftlich anmelden, Sicherheit zu leisten, soweit sie nicht Befriedigung verlangen können. Dieses Recht steht den Gläubigern jedoch nur zu, wenn sie glaubhaft machen, dass durch die Verschmelzung die Erfüllung ihrer Forderung gefährdet wird."
    },
    {
      "date": "2024-12-19",
      "id": "97074",
      "original_text": "Registerbekanntmachung nach dem Umwandlungsgesetz\nNordrhein-Westfalen Amtsgericht Düsseldorf HRB 106405\nclickworker Germany GmbH – Düsseldorf",
      "type": "Registerbekanntmachung nach dem Umwandlungsgesetz",
      "state": "Nordrhein-Westfalen",
      "amtsgericht": "Amtsgericht Düsseldorf",
      "registernummer": "HRB 106405",
      "registerart": "HRB",
      "company_name": "clickworker Germany GmbH",
      "company_seat": "Düsseldorf",
      "details": "19.12.2024 (Bekanntmachungsdatum)\n\nNordrhein-Westfalen Amtsgericht Düsseldorf HRB 106405\nRegisterbekanntmachung nach dem Umwandlungsgesetz 19.12.2024 (Eintragungsdatum)\n\nclickworker Germany GmbH\nGesellschaft mit beschränkter Haftung\nDüsseldorf\n\nDen Gläubigern der an der Ausgliederung beteiligten Rechtsträger ist, wenn sie binnen sechs Monaten nach dem Tag, an dem die Eintragung der Ausgliederung in das Register des Sitzes desjenigen Rechtsträgers, dessen Gläubiger sie sind, nach § 19 Absatz 3 UmwG als bekanntgemacht gilt, ihren Anspruch nach Grund und Höhe schriftlich anmelden, Sicherheit zu leisten, soweit sie nicht Befriedigung verlangen können. Dieses Recht steht den Gläubigern jedoch nur zu, wenn sie glaubhaft machen, dass durch die Ausgliederung die Erfüllung ihrer Forderung gefährdet wird."
    },
    {
      "date": "2024-12-19",
      "id": "97075",
      "original_text": "Registerbekanntmachung nach dem Umwandlungsgesetz\nNordrhein-Westfalen Amtsgericht Arnsberg HRA 9116\nKonstantin Potapov e.K. – Arnsberg",
      "type": "Registerbekanntmachung nach dem Umwandlungsgesetz",
      "state": "Nordrhein-Westfalen",
      "amtsgericht": "Amtsgericht Arnsberg",
      "registernummer": "HRA 9116",
      "registerart": "HRA",
      "company_name": "Konstantin Potapov e.K.",
      "company_seat": "Arnsberg",
      "details": "19.12.2024 (Bekanntmachungsdatum)\n\nNordrhein-Westfalen Amtsgericht Arnsberg HRA 9116\nRegisterbekanntmachung nach dem Umwandlungsgesetz 19.12.2024 (Eintragungsdatum)\n\nKonstantin Potapov e.K.\nEinzelkaufmann / Einzelkauffrau\nArnsberg\n\nDen Gläubigern der an der Ausgliederung beteiligten Rechtsträger ist, wenn sie binnen sechs Monaten nach dem Tag, an dem die Eintragung der Ausgliederung in das Register des Sitzes desjenigen Rechtsträgers, dessen Gläubiger sie sind, nach § 19 Absatz 3 UmwG als bekanntgemacht gilt, ihren Anspruch nach Grund und Höhe schriftlich anmelden, Sicherheit zu leisten, soweit sie nicht Befriedigung verlangen können. Dieses Recht steht den Gläubigern jedoch nur zu, wenn sie glaubhaft machen, dass durch die Ausgliederung die Erfüllung ihrer Forderung gefährdet wird."
    },
    {
      "date": "2024-12-19",
      "id": "97076",
      "original_text": "Einreichung neuer Dokumente\nNordrhein-Westfalen Amtsgericht Düsseldorf HRB 58648\nJohnson Controls Deutschland GmbH – Ratingen",
      "type": "Einreichung neuer Dokumente",
      "state": "Nordrhein-Westfalen",
      "amtsgericht": "Amtsgericht Düsseldorf",
      "registernummer": "HRB 58648",
      "registerart": "HRB",
      "company_name": "Johnson Controls Deutschland GmbH",
      "company_seat": "Ratingen",
      "details": "19.12.2024 (Bekanntmachungsdatum)\n\nNordrhein-Westfalen Amtsgericht Düsseldorf HRB 58648\nEinreichung neuer Dokumente\n\nJohnson Controls Deutschland GmbH\nGesellschaft mit beschränkter Haftung\nRatingen\n\nDem Registergericht ist eine neue Liste der Mitglieder des Aufsichtsrates eingereicht worden."
    },
    {
      "date": "2024-12-19",
      "id": "97077",
      "original_text": "Löschungsankündigung\nNordrhein-Westfalen Amtsgericht Dortmund HRA 15029 früher Amtsgericht Lünen\nMietwagen- und Taxenunternehmen Alfred Laakmann e.K., Inhaber Thorsten Mecklenbrauck – Lünen",
      "type": "Löschungsankündigung",
      "state": "Nordrhein-Westfalen",
      "amtsgericht": "Amtsgericht Dortmund",
      "registernummer": "HRA 15029",
      "registerart": "HRA",
      "company_name": "Mietwagen- und Taxenunternehmen Alfred Laakmann e.K., Inhaber Thorsten Mecklenbrauck",
      "company_seat": "Lünen",
      "former_amtsgericht": "Lünen",
      "details": "19.12.2024 (Bekanntmachungsdatum)\n\nNordrhein-Westfalen Amtsgericht Dortmund HRA 15029 früher Amtsgericht Lünen\nLöschungsankündigung\n\nMietwagen- und Taxenunternehmen Alfred Laakmann e.K., Inhaber Thorsten Mecklenbrauck\nEinzelkaufmann / Einzelkauffrau\nLünen\n\nDas Registergericht beabsichtigt die Firma von Amts wegen nach § 31 Abs. 2 HGB, § 393 FamFG zu löschen. Die Frist zur Erhebung eines Widerspruchs ist auf drei Monate festgesetzt."
    },
    {
      "date": "2024-12-19",
      "id": "97078",
      "original_text": "Registerbekanntmachung nach dem Umwandlungsgesetz\nNordrhein-Westfalen Amtsgericht Aachen HRB 26875\nBrandFactory GmbH – Wassenberg",
      "type": "Registerbekanntmachung nach dem Umwandlungsgesetz",
      "state": "Nordrhein-Westfalen",
      "amtsgericht": "Amtsgericht Aachen",
      "registernummer": "HRB 26875",
      "registerart": "HRB",
      "company_name": "BrandFactory GmbH",
      "company_seat": "Wassenberg",
      "details": "19.12.2024 (Bekanntmachungsdatum)\n\nNordrhein-Westfalen Amtsgericht Aachen HRB 26875\nRegisterbekanntmachung nach dem Umwandlungsgesetz\n\nBrandFactory GmbH\nGesellschaft mit beschränkter Haftung\nWassenberg\n\nDem Registergericht ist ein Formwechselplan über den geplanten grenzüberschreitenden Formwechsel der Gesellschaft mit beschränkter Haftung nach deutschem Recht unter Firma BrandFactory GmbH mit Sitz in Wassenberg (Amtsgericht Aachen HRB 26875) in die besloten vennootschap met beperkte aansprakelijkheid nach niederländischem Recht unter Firma BrandFactory B.V. mit Sitz in Amsterdam/Niederlande eingereicht worden. Anteilsinhaber, Gläubiger und Arbeitnehmer der formwechselnden Gesellschaft können der Gesellschaft bis spätestens fünf Arbeitstage vor dem Tag der über den Formwechsel beschließenden Gesellschafterversammlung Bemerkungen zum Formwechselplan übermitteln."
    },
    {
      "date": "2024-12-19",
      "id": "97079",
      "original_text": "Löschungsankündigung\nNordrhein-Westfalen Amtsgericht Neuss HRB 12174\nLucky-Style GmbH – Neuss",
      "type": "Löschungsankündigung",
      "state": "Nordrhein-Westfalen",
      "amtsgericht": "Amtsgericht Neuss",
      "registernummer": "HRB 12174",
      "registerart": "HRB",
      "company_name": "Lucky-Style GmbH",
      "company_seat": "Neuss",
      "details": "19.12.2024 (Bekanntmachungsdatum)\n\nNordrhein-Westfalen Amtsgericht Neuss HRB 12174\nLöschungsankündigung 17.12.2024 (Eintragungsdatum)\n\nLucky-Style GmbH\nGesellschaft mit beschränkter Haftung\nNeuss\n\nDas Registergericht beabsichtigt die Gesellschaft von Amts wegen nach § 394 FamFG zu löschen. Die Frist zur Erhebung eines Widerspruchs ist auf einen Monat festgesetzt. Rechtsbehelfsbelehrung: Gegen diese Verfügung können Sie Widerspruch einlegen. Der Widerspruch ist bei dem Amtsgericht Neuss - Registergericht -, Breite Str. 48, 41460 Neuss schriftlich in deutscher Sprache oder zur Niederschrift der Geschäftsstelle einzulegen. Der Widerspruch kann auch zur Niederschrift der Geschäftsstelle eines jeden Amtsgerichtes abgegeben werden. Die Einlegung ist auch durch Übertragung eines elektronischen Dokuments an die elektronische Poststelle des Gerichts möglich. Das elektronische Dokument muss für die Bearbeitung durch das Gericht geeignet und mit einer qualifizierten elektronischen Signatur der verantwortenden Person versehen sein oder von der verantwortenden Person signiert und auf einem sicheren Übermittlungsweg gemäß § 130a ZPO nach näherer Maßgabe der Verordnung über die technischen Rahmenbedingungen des elektronischen Rechtsverkehrs und über das besondere elektronische Behördenpostfach (BGBl. I, S.3803) eingereicht werden. Weitere Informationen erhalten Sie auf der Internetseite www.justiz.de. Der Widerspruch muss spätestens innerhalb der gesetzten Frist nach der schriftlichen Bekanntgabe der Verfügung bei dem Amtsgericht - Registergericht - Neuss eingegangen sein. Dies gilt auch dann, wenn der Widerspruch zur Niederschrift der Geschäftsstelle eines anderen Amtsgerichtes abgegeben wurde. Die Frist beginnt mit der schriftlichen Bekanntgabe der Verfügung. Die Bekanntgabe ist entweder durch Zustellung oder am dritten Tage nach Aufgabe zur Post bewirkt. Fällt das Ende der Frist auf einen Sonntag, einen allgemeinen Feiertag oder Sonnabend, so endet die Frist mit Ablauf des nächsten Werktages. Der Widerspruch muss die Bezeichnung der angefochtenen Verfügung sowie die Erklärung enthalten, dass Widerspruch gegen diese Verfügung eingelegt wird. Er ist zu unterzeichnen und soll begründet werden."
    },
    {
      "date": "2024-12-19",
      "id": "97080",
      "original_text": "Registerbekanntmachung nach dem Umwandlungsgesetz\nNordrhein-Westfalen Amtsgericht Bielefeld HRB 40428\nMeyer Menü Bielefeld Verwaltungs GmbH – Bielefeld",
      "type": "Registerbekanntmachung nach dem Umwandlungsgesetz",
      "state": "Nordrhein-Westfalen",
      "amtsgericht": "Amtsgericht Bielefeld",
      "registernummer": "HRB 40428",
      "registerart": "HRB",
      "company_name": "Meyer Menü Bielefeld Verwaltungs GmbH",
      "company_seat": "Bielefeld",
      "details": "19.12.2024 (Bekanntmachungsdatum)\n\nNordrhein-Westfalen Amtsgericht Bielefeld HRB 40428\nRegisterbekanntmachung nach dem Umwandlungsgesetz 19.12.2024 (Eintragungsdatum)\n\nMeyer Menü Bielefeld Verwaltungs GmbH\nGesellschaft mit beschränkter Haftung\nBielefeld\n\nDen Gläubigern der an der Verschmelzung beteiligten Rechtsträger ist, wenn sie binnen sechs Monaten nach dem Tag, an dem die Eintragung der Verschmelzung in das Register des Sitzes desjenigen Rechtsträgers, dessen Gläubiger sie sind, nach § 19 Absatz 3 UmwG als bekanntgemacht gilt, ihren Anspruch nach Grund und Höhe schriftlich anmelden, Sicherheit zu leisten, soweit sie nicht Befriedigung verlangen können. Dieses Recht steht den Gläubigern jedoch nur zu, wenn sie glaubhaft machen, dass durch die Verschmelzung die Erfüllung ihrer Forderung gefährdet wird."
    },
    {
      "date": "2024-12-19",
      "id": "97081",
      "original_text": "Registerbekanntmachung nach dem Umwandlungsgesetz\nNordrhein-Westfalen Amtsgericht Arnsberg HRB 15155\nEKO Food GmbH – Arnsberg",
      "type": "Registerbekanntmachung nach dem Umwandlungsgesetz",
      "state": "Nordrhein-Westfalen",
      "amtsgericht": "Amtsgericht Arnsberg",
      "registernummer": "HRB 15155",
      "registerart": "HRB",
      "company_name": "EKO Food GmbH",
      "company_seat": "Arnsberg",
      "details": "19.12.2024 (Bekanntmachungsdatum)\n\nNordrhein-Westfalen Amtsgericht Arnsberg HRB 15155\nRegisterbekanntmachung nach dem Umwandlungsgesetz 19.12.2024 (Eintragungsdatum)\n\nEKO Food GmbH\nGesellschaft mit beschränkter Haftung\nArnsberg\n\nDen Gläubigern der an der Ausgliederung beteiligten Rechtsträger ist, wenn sie binnen sechs Monaten nach dem Tag, an dem die Eintragung der Ausgliederung in das Register des Sitzes desjenigen Rechtsträgers, dessen Gläubiger sie sind, nach § 19 Absatz 3 UmwG als bekanntgemacht gilt, ihren Anspruch nach Grund und Höhe schriftlich anmelden, Sicherheit zu leisten, soweit sie nicht Befriedigung verlangen können. Dieses Recht steht den Gläubigern jedoch nur zu, wenn sie glaubhaft machen, dass durch die Ausgliederung die Erfüllung ihrer Forderung gefährdet wird."
    },
    {
      "date": "2024-12-19",
      "id": "97082",
      "original_text": "Sonstige Registerbekanntmachung\nNordrhein-Westfalen Amtsgericht Paderborn HRB 9830\nMZG Clean GmbH – Bad Lippspringe",
      "type": "Sonstige Registerbekanntmachung",
      "state": "Nordrhein-Westfalen",
      "amtsgericht": "Amtsgericht Paderborn",
      "registernummer": "HRB 9830",
      "registerart": "HRB",
      "company_name": "MZG Clean GmbH",
      "company_seat": "Bad Lippspringe",
      "details": "19.12.2024 (Bekanntmachungsdatum)\n\nNordrhein-Westfalen Amtsgericht Paderborn HRB 9830\nSonstige Registerbekanntmachung\n\nMZG Clean GmbH\nGesellschaft mit beschränkter Haftung\nBad Lippspringe\n\nDem Registergericht ist eine Liste der Mitglieder des Aufsichtsrates eingereicht worden."
    },
    {
      "date": "2024-12-19",
      "id": "97083",
      "original_text": "Registerbekanntmachung nach dem Umwandlungsgesetz\nNordrhein-Westfalen Amtsgericht Arnsberg HRB 14414\nAdventus Holding GmbH – Olsberg",
      "type": "Registerbekanntmachung nach dem Umwandlungsgesetz",
      "state": "Nordrhein-Westfalen",
      "amtsgericht": "Amtsgericht Arnsberg",
      "registernummer": "HRB 14414",
      "registerart": "HRB",
      "company_name": "Adventus Holding GmbH",
      "company_seat": "Olsberg",
      "details": "19.12.2024 (Bekanntmachungsdatum)\n\nNordrhein-Westfalen Amtsgericht Arnsberg HRB 14414\nRegisterbekanntmachung nach dem Umwandlungsgesetz 19.12.2024 (Eintragungsdatum)\n\nAdventus Holding GmbH\nGesellschaft mit beschränkter Haftung\nOlsberg\n\nDen Gläubigern der an der Ausgliederung beteiligten Rechtsträger ist, wenn sie binnen sechs Monaten nach dem Tag, an dem die Eintragung der Ausgliederung in das Register des Sitzes desjenigen Rechtsträgers, dessen Gläubiger sie sind, nach § 19 Absatz 3 UmwG als bekanntgemacht gilt, ihren Anspruch nach Grund und Höhe schriftlich anmelden, Sicherheit zu leisten, soweit sie nicht Befriedigung verlangen können. Dieses Recht steht den Gläubigern jedoch nur zu, wenn sie glaubhaft machen, dass durch die Ausgliederung die Erfüllung ihrer Forderung gefährdet wird."
    },
    {
      "date": "2024-12-19",
      "id": "97084",
      "original_text": "Löschungsankündigung\nNordrhein-Westfalen Amtsgericht Dortmund HRB 19950\nLottoTeam GmbH & Still. – Dortmund",
      "type": "Löschungsankündigung",
      "state": "Nordrhein-Westfalen",
      "amtsgericht": "Amtsgericht Dortmund",
      "registernummer": "HRB 19950",
      "registerart": "HRB",
      "company_name": "LottoTeam GmbH & Still.",
      "company_seat": "Dortmund",
      "details": "19.12.2024 (Bekanntmachungsdatum)\n\nNordrhein-Westfalen Amtsgericht Dortmund HRB 19950\nLöschungsankündigung\n\nLottoTeam GmbH & Still.\nGesellschaft mit beschränkter Haftung\nDortmund\n\nDas Registergericht beabsichtigt die Gesellschaft von Amts wegen nach § 394 FamFG zu löschen. Die Frist zur Erhebung eines Widerspruchs ist auf zwei Monate festgesetzt."
    },
    {
      "date": "2024-12-19",
      "id": "97085",
      "original_text": "Löschungsankündigung\nNordrhein-Westfalen Amtsgericht Köln HRA 24246\nLowartz Bedachungen GmbH & Co. KG – Köln",
      "type": "Löschungsankündigung",
      "state": "Nordrhein-Westfalen",
      "amtsgericht": "Amtsgericht Köln",
      "registernummer": "HRA 24246",
      "registerart": "HRA",
      "company_name": "Lowartz Bedachungen GmbH & Co. KG",
      "company_seat": "Köln",
      "details": "19.12.2024 (Bekanntmachungsdatum)\n\nNordrhein-Westfalen Amtsgericht Köln HRA 24246\nLöschungsankündigung 19.12.2024 (Eintragungsdatum)\n\nLowartz Bedachungen GmbH & Co. KG\nKommanditgesellschaft\nKöln\n\nDas Registergericht beabsichtigt nachfolgende Firmen von Amts wegen nach § 31 Abs. 2 HGB wegen Aufgabe des Betriebes zu löschen. Die Frist zur Erhebung eines Widerspruchs ist auf 1 Monat festgesetzt."
    },
    {
      "date": "2024-12-19",
      "id": "97086",
      "original_text": "Sonstige Registerbekanntmachung\nNordrhein-Westfalen Amtsgericht Köln HRB 55099\nGothaer Asset Management AG – Köln",
      "type": "Sonstige Registerbekanntmachung",
      "state": "Nordrhein-Westfalen",
      "amtsgericht": "Amtsgericht Köln",
      "registernummer": "HRB 55099",
      "registerart": "HRB",
      "company_name": "Gothaer Asset Management AG",
      "company_seat": "Köln",
      "details": "19.12.2024 (Bekanntmachungsdatum)\n\nNordrhein-Westfalen Amtsgericht Köln HRB 55099\nSonstige Registerbekanntmachung\n\nGothaer Asset Management AG\nAktiengesellschaft\nKöln\n\nDem Registergericht ist eine Liste der Mitglieder des Aufsichtsrates eingereicht worden."
    },
    {
      "date": "2024-12-19",
      "id": "97087",
      "original_text": "Löschungsankündigung\nNordrhein-Westfalen Amtsgericht Kleve HRB 14878\nBB Food GmbH – Xanten",
      "type": "Löschungsankündigung",
      "state": "Nordrhein-Westfalen",
      "amtsgericht": "Amtsgericht Kleve",
      "registernummer": "HRB 14878",
      "registerart": "HRB",
      "company_name": "BB Food GmbH",
      "company_seat": "Xanten",
      "details": "19.12.2024 (Bekanntmachungsdatum)\n\nNordrhein-Westfalen Amtsgericht Kleve HRB 14878\nLöschungsankündigung\n\nBB Food GmbH\nGesellschaft mit beschränkter Haftung\nXanten\n\nDas Registergericht beabsichtigt die Gesellschaft von Amts wegen nach § 394 FamFG zu löschen. Die Frist zur Erhebung eines Widerspruchs ist auf einen Monat festgesetzt."
    },
    {
      "date": "2024-12-19",
      "id": "97088",
      "original_text": "Registerbekanntmachung nach dem Umwandlungsgesetz\nNordrhein-Westfalen Amtsgericht Dortmund HRA 19748\nSolarpark Nettelsee GmbH & Co. KG – Dortmund",
      "type": "Registerbekanntmachung nach dem Umwandlungsgesetz",
      "state": "Nordrhein-Westfalen",
      "amtsgericht": "Amtsgericht Dortmund",
      "registernummer": "HRA 19748",
      "registerart": "HRA",
      "company_name": "Solarpark Nettelsee GmbH & Co. KG",
      "company_seat": "Dortmund",
      "details": "19.12.2024 (Bekanntmachungsdatum)\n\nNordrhein-Westfalen Amtsgericht Dortmund HRA 19748\nRegisterbekanntmachung nach dem Umwandlungsgesetz 19.12.2024 (Eintragungsdatum)\n\nSolarpark Nettelsee GmbH & Co. KG\nKommanditgesellschaft\nDortmund\n\nDen Gläubigern der an der Verschmelzung beteiligten Rechtsträger ist, wenn sie binnen sechs Monaten nach dem Tag, an dem die Eintragung der Verschmelzung in das Register des Sitzes, derjenigen Rechtsträger deren Gläubiger sie sind, nach § 19 Absatz 3 UmwG als bekanntgemacht gilt, ihren Anspruch nach Grund und Höhe schriftlich anmelden, Sicherheit zu leisten, soweit sie nicht Befriedigung verlangen können. Dieses Recht steht den Gläubigern jedoch nur zu, wenn sie glaubhaft machen, dass durch die Verschmelzung die Erfüllung ihrer Forderung gefährdet wird."
    },
    {
      "date": "2024-12-19",
      "id": "97089",
      "original_text": "Löschungsankündigung\nHessen Amtsgericht Frankfurt am Main HRA 50096\nSpeaktrum UG (haftungsbeschränkt) & Co. KG – Frankfurt am Main",
      "type": "Löschungsankündigung",
      "state": "Hessen",
      "amtsgericht": "Amtsgericht Frankfurt am Main",
      "registernummer": "HRA 50096",
      "registerart": "HRA",
      "company_name": "Speaktrum UG (haftungsbeschränkt) & Co. KG",
      "company_seat": "Frankfurt am Main",
      "details": "19.12.2024 (Bekanntmachungsdatum)\n\nHessen Amtsgericht Frankfurt am Main HRA 50096\nLöschungsankündigung\n\nSpeaktrum UG (haftungsbeschränkt) & Co. KG\nKommanditgesellschaft\nFrankfurt am Main\n\nEs ist beabsichtigt, die Gesellschaft gemäß § 394 FamFG wegen Vermögenslosigkeit von Amts wegen im Handelsregister zu löschen.\nHiergegen klann innerhalb von 1 Monat nach Veröffentlichung dieser Verfügung Widerspruch bei dem Amtsgericht Frankfurt am Main eingelegt werden."
    },
    {
      "date": "2024-12-19",
      "id": "97090",
      "original_text": "Registerbekanntmachung nach dem Umwandlungsgesetz\nHessen Amtsgericht Darmstadt HRB 106631\nEHW+ Services GmbH – Viernheim",
      "type": "Registerbekanntmachung nach dem Umwandlungsgesetz",
      "state": "Hessen",
      "amtsgericht": "Amtsgericht Darmstadt",
      "registernummer": "HRB 106631",
      "registerart": "HRB",
      "company_name": "EHW+ Services GmbH",
      "company_seat": "Viernheim",
      "details": "19.12.2024 (Bekanntmachungsdatum)\n\nHessen Amtsgericht Darmstadt HRB 106631\nRegisterbekanntmachung nach dem Umwandlungsgesetz 19.12.2024 (Eintragungsdatum)\n\nEHW+ Services GmbH\nGesellschaft mit beschränkter Haftung\nViernheim\n\nDen Gläubigern der an der Ausgliederung beteiligten Rechtsträger ist, wenn sie binnen sechs Monaten nach dem Tag, an dem die Eintragung der Ausgliederung in das Register des Sitzes derjenigen Rechtsträger deren Gläubiger sie sind, nach §§ 125, 19 Absatz 3 UmwG bekannt gemacht worden ist, ihren Anspruch nach Grund und Höhe schriftlich anmelden, Sicherheit zu leisten, soweit sie nicht Befriedigung verlangen können. Dieses Recht steht den Gläubigern jedoch nur zu, wenn sie glaubhaft machen, dass durch die Ausgliederung die Erfüllung ihrer Forderung gefährdet wird."
    },
    {
      "date": "2024-12-19",
      "id": "97091",
      "original_text": "Registerbekanntmachung nach dem Umwandlungsgesetz\nHessen Amtsgericht Frankfurt am Main HRB 57160\nLuneta Braunschweig Immobilien GmbH – Frankfurt am Main",
      "type": "Registerbekanntmachung nach dem Umwandlungsgesetz",
      "state": "Hessen",
      "amtsgericht": "Amtsgericht Frankfurt am Main",
      "registernummer": "HRB 57160",
      "registerart": "HRB",
      "company_name": "Luneta Braunschweig Immobilien GmbH",
      "company_seat": "Frankfurt am Main",
      "details": "19.12.2024 (Bekanntmachungsdatum)\n\nHessen Amtsgericht Frankfurt am Main HRB 57160\nRegisterbekanntmachung nach dem Umwandlungsgesetz 19.12.2024 (Eintragungsdatum)\n\nLuneta Braunschweig Immobilien GmbH\nGesellschaft mit beschränkter Haftung\nFrankfurt am Main\n\nDem Registergericht ist der Entwurf eines Verschmelzungsplans über die geplante grenzüberschreitende Verschmelzung der Luneta Braunschweig Immobilien GmbH mit Sitz in Oberursel (Taunus) (Gesellschaft mit beschränkter Haftung, eingetragen beim Amtsgericht Frankfurt am Main unter der HRB  57160) als übertragender Rechtsträger mit der CCP 5 Matrix Holding S.a.r.l. mit Sitz in Luxemburg (s.a.r.l., eingetragen beim RCS Nummer B 238972) als übernehmender Rechtsträger eingereicht worden.\nDen Gläubigern der übertragenden Gesellschaft ist Sicherheit zu leisten, wenn sie innerhalb einer Frist von zwei Monaten nach Bekanntmachung des Verschmelzungsplans glaubhaft machen, dass durch die Verschmelzung die Erfüllung ihrer Forderung gefährdet wird. Die Anteilseigner der übertragenden Gesellschaft haben bei grenzüberschreitenden Verschmelzungen einen Anspruch auf angemessene Abfindung, sofern sie der Verschmelzung widersprochen haben; gegebenenfalls steht ihnen auch ein Anspruch auf bare Zuzahlung zu."
    },
    {
      "date": "2024-12-19",
      "id": "97092",
      "original_text": "Registerbekanntmachung nach dem Umwandlungsgesetz\nHessen Amtsgericht Darmstadt HRB 107225\nHermius GmbH – Bensheim",
      "type": "Registerbekanntmachung nach dem Umwandlungsgesetz",
      "state": "Hessen",
      "amtsgericht": "Amtsgericht Darmstadt",
      "registernummer": "HRB 107225",
      "registerart": "HRB",
      "company_name": "Hermius GmbH",
      "company_seat": "Bensheim",
      "details": "19.12.2024 (Bekanntmachungsdatum)\n\nHessen Amtsgericht Darmstadt HRB 107225\nRegisterbekanntmachung nach dem Umwandlungsgesetz 19.12.2024 (Eintragungsdatum)\n\nHermius GmbH\nGesellschaft mit beschränkter Haftung\nBensheim\n\nDen Gläubigern der an der Ausgliederung beteiligten Rechtsträger ist, wenn sie binnen sechs Monaten nach dem Tag, an dem die Eintragung der Ausgliederung in das Register des Sitzes desjenigen Rechtsträgers, dessen Gläubiger sie sind, nach §§ 125, 19 Absatz 3 UmwG bekannt gemacht worden ist, ihren Anspruch nach Grund und Höhe schriftlich anmelden, Sicherheit zu leisten, soweit sie nicht Befriedigung verlangen können. Dieses Recht steht den Gläubigern jedoch nur zu, wenn sie glaubhaft machen, dass durch die Ausgliederung die Erfüllung ihrer Forderung gefährdet wird."
    },
    {
      "date": "2024-12-19",
      "id": "97093",
      "original_text": "Registerbekanntmachung nach dem Umwandlungsgesetz\nHessen Amtsgericht Darmstadt HRA 87569\nEHW+ Service e.K. – Viernheim",
      "type": "Registerbekanntmachung nach dem Umwandlungsgesetz",
      "state": "Hessen",
      "amtsgericht": "Amtsgericht Darmstadt",
      "registernummer": "HRA 87569",
      "registerart": "HRA",
      "company_name": "EHW+ Service e.K.",
      "company_seat": "Viernheim",
      "details": "19.12.2024 (Bekanntmachungsdatum)\n\nHessen Amtsgericht Darmstadt HRA 87569\nRegisterbekanntmachung nach dem Umwandlungsgesetz 19.12.2024 (Eintragungsdatum)\n\nEHW+ Service e.K.\nEinzelkaufmann / Einzelkauffrau\nViernheim\n\nDen Gläubigern der an der Ausgliederung beteiligten Rechtsträger ist, wenn sie binnen sechs Monaten nach dem Tag, an dem die Eintragung der Ausgliederung in das Register des Sitzes derjenigen Rechtsträger deren Gläubiger sie sind, nach §§ 125, 19 Absatz 3 UmwG bekannt gemacht worden ist, ihren Anspruch nach Grund und Höhe schriftlich anmelden, Sicherheit zu leisten, soweit sie nicht Befriedigung verlangen können. Dieses Recht steht den Gläubigern jedoch nur zu, wenn sie glaubhaft machen, dass durch die Ausgliederung die Erfüllung ihrer Forderung gefährdet wird."
    },
    {
      "date": "2024-12-19",
      "id": "97094",
      "original_text": "Löschungsankündigung\nHessen Amtsgericht Frankfurt am Main HRB 107089\nWirth Security GmbH – Frankfurt am Main",
      "type": "Löschungsankündigung",
      "state": "Hessen",
      "amtsgericht": "Amtsgericht Frankfurt am Main",
      "registernummer": "HRB 107089",
      "registerart": "HRB",
      "company_name": "Wirth Security GmbH",
      "company_seat": "Frankfurt am Main",
      "details": "19.12.2024 (Bekanntmachungsdatum)\n\nHessen Amtsgericht Frankfurt am Main HRB 107089\nLöschungsankündigung\n\nWirth Security GmbH\nGesellschaft mit beschränkter Haftung\nFrankfurt am Main\n\nEs ist beabsichtigt, die Gesellschaft wegen Vermögenslosigkeit gemäß § 394 FamFG von Amts wegen im Handelsregister zu löschen. Hiergegen kann innerhalb eines Monats nach dieser Veröffentlichung Widerspruch bei dem Amtsgericht Frankfurt am Main eingelegt werden."
    },
    {
      "date": "2024-12-19",
      "id": "97095",
      "original_text": "Löschungsankündigung\nHessen Amtsgericht Frankfurt am Main HRB 129289\nNorsec Sicherheit GmbH – Frankfurt am Main",
      "type": "Löschungsankündigung",
      "state": "Hessen",
      "amtsgericht": "Amtsgericht Frankfurt am Main",
      "registernummer": "HRB 129289",
      "registerart": "HRB",
      "company_name": "Norsec Sicherheit GmbH",
      "company_seat": "Frankfurt am Main",
      "details": "19.12.2024 (Bekanntmachungsdatum)\n\nHessen Amtsgericht Frankfurt am Main HRB 129289\nLöschungsankündigung\n\nNorsec Sicherheit GmbH\nGesellschaft mit beschränkter Haftung\nFrankfurt am Main\n\nEs ist beabsichtigt, den Gegenstand der Gesellschaft gemäß § 395 FamFG von Amts wegen im Handelsregister zu löschen, weil gegen die Gesellschaft eine Gewerbeuntersagung nach § 35 Gewerbeordnung durch das Bezirksamt Hamburg-Nord (Az.: N/VS1232/128-23) verhängt wurde und diese Untersagung mit dem Unternehmensgegenstand übereinstimmt.\nHiergegen kann innerhalb von drei Wochen nach dieser Veröffentlichung Widerspruch bei dem Amtsgericht Frankfurt am Main eingelegt werden."
    },
    {
      "date": "2024-12-19",
      "id": "97096",
      "original_text": "Sonstige Registerbekanntmachung\nHessen Amtsgericht Bad Hersfeld VR 1766\nReitverein Rotenburg-Wüstefeld e. V. – Rotenburg a. d. Fulda",
      "type": "Sonstige Registerbekanntmachung",
      "state": "Hessen",
      "amtsgericht": "Amtsgericht Bad Hersfeld",
      "registernummer": "VR 1766",
      "registerart": "VR",
      "company_name": "Reitverein Rotenburg-Wüstefeld e. V.",
      "company_seat": "Rotenburg a. d. Fulda",
      "details": "19.12.2024 (Bekanntmachungsdatum)\n\nHessen Amtsgericht Bad Hersfeld VR 1766\nSonstige Registerbekanntmachung 19.12.2024 (Eintragungsdatum)\n\nReitverein Rotenburg-Wüstefeld e. V.\neingetragener Verein\nRotenburg a. d. Fulda\n\nDer Verein ist aufgelöst."
    },
    {
      "date": "2024-12-19",
      "id": "97097",
      "original_text": "Löschungsankündigung\nHessen Amtsgericht Darmstadt HRB 95244\nS&D Transportvermittlung UG (haftungsbeschränkt) – Rüsselsheim",
      "type": "Löschungsankündigung",
      "state": "Hessen",
      "amtsgericht": "Amtsgericht Darmstadt",
      "registernummer": "HRB 95244",
      "registerart": "HRB",
      "company_name": "S&D Transportvermittlung UG (haftungsbeschränkt)",
      "company_seat": "Rüsselsheim",
      "details": "19.12.2024 (Bekanntmachungsdatum)\n\nHessen Amtsgericht Darmstadt HRB 95244\nLöschungsankündigung 19.12.2024 (Eintragungsdatum)\n\nS&D Transportvermittlung UG (haftungsbeschränkt)\nGesellschaft mit beschränkter Haftung\nRüsselsheim\n\nDas Registergericht beabsichtigt die im Handelsregister eingetragene Gesellschaft von Amts wegen nach § 394 FamFG zu löschen. Die Frist zur Erhebung eines Widerspruchs gegen die beabsichtigte Löschung wird auf 3 Monate festgesetzt."
    },
    {
      "date": "2024-12-19",
      "id": "97098",
      "original_text": "Registerbekanntmachung nach dem Umwandlungsgesetz\nHessen Amtsgericht Darmstadt HRA 87686\nTobias Kipfelsberger e.K. – Bensheim",
      "type": "Registerbekanntmachung nach dem Umwandlungsgesetz",
      "state": "Hessen",
      "amtsgericht": "Amtsgericht Darmstadt",
      "registernummer": "HRA 87686",
      "registerart": "HRA",
      "company_name": "Tobias Kipfelsberger e.K.",
      "company_seat": "Bensheim",
      "details": "19.12.2024 (Bekanntmachungsdatum)\n\nHessen Amtsgericht Darmstadt HRA 87686\nRegisterbekanntmachung nach dem Umwandlungsgesetz 19.12.2024 (Eintragungsdatum)\n\nTobias Kipfelsberger e.K.\nEinzelkaufmann / Einzelkauffrau\nBensheim\n\nDen Gläubigern der an der Ausgliederung beteiligten Rechtsträger ist, wenn sie binnen sechs Monaten nach dem Tag, an dem die Eintragung der Ausgliederung in das Register des Sitzes desjenigen Rechtsträgers, dessen Gläubiger sie sind, nach §§ 125, 19 Absatz 3 UmwG bekannt gemacht worden ist, ihren Anspruch nach Grund und Höhe schriftlich anmelden, Sicherheit zu leisten, soweit sie nicht Befriedigung verlangen können. Dieses Recht steht den Gläubigern jedoch nur zu, wenn sie glaubhaft machen, dass durch die Ausgliederung die Erfüllung ihrer Forderung gefährdet wird."
    },
    {
      "date": "2024-12-19",
      "id": "97099",
      "original_text": "Registerbekanntmachung nach dem Umwandlungsgesetz\nHessen Amtsgericht Darmstadt HRB 86904\nGHT GmbH Gleis- Hoch- und Tiefbau – Mühltal",
      "type": "Registerbekanntmachung nach dem Umwandlungsgesetz",
      "state": "Hessen",
      "amtsgericht": "Amtsgericht Darmstadt",
      "registernummer": "HRB 86904",
      "registerart": "HRB",
      "company_name": "GHT GmbH Gleis- Hoch- und Tiefbau",
      "company_seat": "Mühltal",
      "details": "19.12.2024 (Bekanntmachungsdatum)\n\nHessen Amtsgericht Darmstadt HRB 86904\nRegisterbekanntmachung nach dem Umwandlungsgesetz 19.12.2024 (Eintragungsdatum)\n\nGHT GmbH Gleis- Hoch- und Tiefbau\nGesellschaft mit beschränkter Haftung\nMühltal\n\nDen Gläubigern der an der formwechselnden Umwandlung beteiligten Rechtsträger ist, wenn sie binnen sechs Monaten nach dem Tag, an dem die Eintragung der formwechselnden Umwandlung in das Register des Sitzes desjenigen Rechtsträgers, dessen Gläubiger sie sind, nach § 201 UmwG bekannt gemacht worden ist, ihren Anspruch nach Grund und Höhe schriftlich anmelden, Sicherheit zu leisten, soweit sie nicht Befriedigung verlangen können. Dieses Recht steht den Gläubigern jedoch nur zu, wenn sie glaubhaft machen, dass durch die formwechselnden Umwandlung die Erfüllung ihrer Forderung gefährdet wird."
    },
    {
      "date": "2024-12-19",
      "id": "97100",
      "original_text": "Registerbekanntmachung nach dem Umwandlungsgesetz\nHessen Amtsgericht Darmstadt HRB 90280\nFischMaster IP-Services GmbH – Trebur",
      "type": "Registerbekanntmachung nach dem Umwandlungsgesetz",
      "state": "Hessen",
      "amtsgericht": "Amtsgericht Darmstadt",
      "registernummer": "HRB 90280",
      "registerart": "HRB",
      "company_name": "FischMaster IP-Services GmbH",
      "company_seat": "Trebur",
      "details": "19.12.2024 (Bekanntmachungsdatum)\n\nHessen Amtsgericht Darmstadt HRB 90280\nRegisterbekanntmachung nach dem Umwandlungsgesetz 19.12.2024 (Eintragungsdatum)\n\nFischMaster IP-Services GmbH\nGesellschaft mit beschränkter Haftung\nTrebur\n\nDen Gläubigern der an der Verschmelzung beteiligten Rechtsträger ist, wenn sie binnen sechs Monaten nach dem Tag, an dem die Eintragung der Verschmelzung in das Register des Sitzes desjenigen Rechtsträgers, dessen Gläubiger sie sind, nach § 19 Absatz 3 UmwG bekannt gemacht worden ist, ihren Anspruch nach Grund und Höhe schriftlich anmelden, Sicherheit zu leisten, soweit sie nicht Befriedigung verlangen können. Dieses Recht steht den Gläubigern jedoch nur zu, wenn sie glaubhaft machen, dass durch die Verschmelzung die Erfüllung ihrer Forderung gefährdet wird."
    },
    {
      "date": "2024-12-19",
      "id": "97101",
      "original_text": "Registerbekanntmachung nach dem Umwandlungsgesetz\nHessen Amtsgericht Darmstadt HRA 86408\nKind-Steinmüller GmbH & Co. KG – Trebur",
      "type": "Registerbekanntmachung nach dem Umwandlungsgesetz",
      "state": "Hessen",
      "amtsgericht": "Amtsgericht Darmstadt",
      "registernummer": "HRA 86408",
      "registerart": "HRA",
      "company_name": "Kind-Steinmüller GmbH & Co. KG",
      "company_seat": "Trebur",
      "details": "19.12.2024 (Bekanntmachungsdatum)\n\nHessen Amtsgericht Darmstadt HRA 86408\nRegisterbekanntmachung nach dem Umwandlungsgesetz 19.12.2024 (Eintragungsdatum)\n\nKind-Steinmüller GmbH & Co. KG\nKommanditgesellschaft\nTrebur\n\nDen Gläubigern der an der Verschmelzung beteiligten Rechtsträger ist, wenn sie binnen sechs Monaten nach dem Tag, an dem die Eintragung der Verschmelzung in das Register des Sitzes desjenigen Rechtsträgers, dessen Gläubiger sie sind, nach § 19 Absatz 3 UmwG bekannt gemacht worden ist, ihren Anspruch nach Grund und Höhe schriftlich anmelden, Sicherheit zu leisten, soweit sie nicht Befriedigung verlangen können. Dieses Recht steht den Gläubigern jedoch nur zu, wenn sie glaubhaft machen, dass durch die Verschmelzung die Erfüllung ihrer Forderung gefährdet wird."
    },
    {
      "date": "2024-12-19",
      "id": "97102",
      "original_text": "Einreichung neuer Dokumente\nHessen Amtsgericht Frankfurt am Main HRB 49421\nEintracht Frankfurt Fußball Aktiengesellschaft – Frankfurt am Main",
      "type": "Einreichung neuer Dokumente",
      "state": "Hessen",
      "amtsgericht": "Amtsgericht Frankfurt am Main",
      "registernummer": "HRB 49421",
      "registerart": "HRB",
      "company_name": "Eintracht Frankfurt Fußball Aktiengesellschaft",
      "company_seat": "Frankfurt am Main",
      "details": "19.12.2024 (Bekanntmachungsdatum)\n\nHessen Amtsgericht Frankfurt am Main HRB 49421\nEinreichung neuer Dokumente 13.12.2024 (Eintragungsdatum)\n\nEintracht Frankfurt Fußball Aktiengesellschaft\nAktiengesellschaft\nFrankfurt am Main\n\nDurch eine Änderung in den Personen der Aufsichtsratsmitglieder ist eine Liste der Mitglieder des Aufsichtsrates zum Handelsregister eingereicht worden."
    },
    {
      "date": "2024-12-19",
      "id": "97103",
      "original_text": "Einreichung neuer Dokumente\nHessen Amtsgericht Darmstadt HRB 8374\nBAYOONET AG – Darmstadt",
      "type": "Einreichung neuer Dokumente",
      "state": "Hessen",
      "amtsgericht": "Amtsgericht Darmstadt",
      "registernummer": "HRB 8374",
      "registerart": "HRB",
      "company_name": "BAYOONET AG",
      "company_seat": "Darmstadt",
      "details": "19.12.2024 (Bekanntmachungsdatum)\n\nHessen Amtsgericht Darmstadt HRB 8374\nEinreichung neuer Dokumente\n\nBAYOONET AG\nAktiengesellschaft\nDarmstadt\n\nWegen Änderungen in den Personen der Aufsichtsratsmitglieder ist eine Liste der Mitglieder des Aufsichtsrates zum Handelsregister eingereicht worden."
    },
    {
      "date": "2024-12-19",
      "id": "97104",
      "original_text": "Registerbekanntmachung nach dem Umwandlungsgesetz\nHessen Amtsgericht Fulda HRA 667\nAlfred Wende GmbH & Co. KG – Fulda",
      "type": "Registerbekanntmachung nach dem Umwandlungsgesetz",
      "state": "Hessen",
      "amtsgericht": "Amtsgericht Fulda",
      "registernummer": "HRA 667",
      "registerart": "HRA",
      "company_name": "Alfred Wende GmbH & Co. KG",
      "company_seat": "Fulda",
      "details": "19.12.2024 (Bekanntmachungsdatum)\n\nHessen Amtsgericht Fulda HRA 667\nRegisterbekanntmachung nach dem Umwandlungsgesetz 19.12.2024 (Eintragungsdatum)\n\nAlfred Wende GmbH & Co. KG\nKommanditgesellschaft\nFulda\n\nDen Gläubigern der an der formwechselnden Umwandlung beteiligten Rechtsträger ist, wenn sie binnen sechs Monaten nach dem Tag, an dem die Eintragung der formwechselnden Umwandlung in das Register des Sitzes desjenigen Rechtsträgers, dessen Gläubiger sie sind, nach § 201 UmwG bekannt gemacht worden ist, ihren Anspruch nach Grund und Höhe schriftlich anmelden, Sicherheit zu leisten, soweit sie nicht Befriedigung verlangen können. Dieses Recht steht den Gläubigern jedoch nur zu, wenn sie glaubhaft machen, dass durch die formwechselnden Umwandlung die Erfüllung ihrer Forderung gefährdet wird."
    },
    {
      "date": "2024-12-19",
      "id": "97105",
      "original_text": "Registerbekanntmachung nach dem Umwandlungsgesetz\nHessen Amtsgericht Darmstadt HRB 107224\nGHT AG Gleis- Hoch- und Tiefbau – Mühltal",
      "type": "Registerbekanntmachung nach dem Umwandlungsgesetz",
      "state": "Hessen",
      "amtsgericht": "Amtsgericht Darmstadt",
      "registernummer": "HRB 107224",
      "registerart": "HRB",
      "company_name": "GHT AG Gleis- Hoch- und Tiefbau",
      "company_seat": "Mühltal",
      "details": "19.12.2024 (Bekanntmachungsdatum)\n\nHessen Amtsgericht Darmstadt HRB 107224\nRegisterbekanntmachung nach dem Umwandlungsgesetz 19.12.2024 (Eintragungsdatum)\n\nGHT AG Gleis- Hoch- und Tiefbau\nAktiengesellschaft\nMühltal\n\nDen Gläubigern der an der formwechselnden Umwandlung beteiligten Rechtsträger ist, wenn sie binnen sechs Monaten nach dem Tag, an dem die Eintragung der formwechselnden Umwandlung in das Register des Sitzes desjenigen Rechtsträgers, dessen Gläubiger sie sind, nach § 201 UmwG bekannt gemacht worden ist, ihren Anspruch nach Grund und Höhe schriftlich anmelden, Sicherheit zu leisten, soweit sie nicht Befriedigung verlangen können. Dieses Recht steht den Gläubigern jedoch nur zu, wenn sie glaubhaft machen, dass durch die formwechselnden Umwandlung die Erfüllung ihrer Forderung gefährdet wird."
    },
    {
      "date": "2024-12-19",
      "id": "97106",
      "original_text": "Sonstige Registerbekanntmachung\nHessen Amtsgericht Darmstadt VR 2902\nLohnsteuerhilfeverein Alpha e.V. – Pfungstadt",
      "type": "Sonstige Registerbekanntmachung",
      "state": "Hessen",
      "amtsgericht": "Amtsgericht Darmstadt",
      "registernummer": "VR 2902",
      "registerart": "VR",
      "company_name": "Lohnsteuerhilfeverein Alpha e.V.",
      "company_seat": "Pfungstadt",
      "details": "19.12.2024 (Bekanntmachungsdatum)\n\nHessen Amtsgericht Darmstadt VR 2902\nSonstige Registerbekanntmachung 19.12.2024 (Eintragungsdatum)\n\nLohnsteuerhilfeverein Alpha e.V.\neingetragener Verein\nPfungstadt\n\nDer Verein ist aufgelöst."
    },
    {
      "date": "2024-12-19",
      "id": "97107",
      "original_text": "Sonstige Registerbekanntmachung\nHessen Amtsgericht Darmstadt VR 3253\nVerein zur Förderung der Internationalen Begegnungsschule (IBS) Darmstadt – Darmstadt",
      "type": "Sonstige Registerbekanntmachung",
      "state": "Hessen",
      "amtsgericht": "Amtsgericht Darmstadt",
      "registernummer": "VR 3253",
      "registerart": "VR",
      "company_name": "Verein zur Förderung der Internationalen Begegnungsschule (IBS) Darmstadt",
      "company_seat": "Darmstadt",
      "details": "19.12.2024 (Bekanntmachungsdatum)\n\nHessen Amtsgericht Darmstadt VR 3253\nSonstige Registerbekanntmachung 19.12.2024 (Eintragungsdatum)\n\nVerein zur Förderung der Internationalen Begegnungsschule (IBS) Darmstadt\neingetragener Verein\nDarmstadt\n\nDer Verein ist aufgelöst."
    },
    {
      "date": "2024-12-19",
      "id": "97108",
      "original_text": "Einreichung neuer Dokumente\nHessen Amtsgericht Frankfurt am Main HRB 75453\nDell GmbH – Frankfurt am Main",
      "type": "Einreichung neuer Dokumente",
      "state": "Hessen",
      "amtsgericht": "Amtsgericht Frankfurt am Main",
      "registernummer": "HRB 75453",
      "registerart": "HRB",
      "company_name": "Dell GmbH",
      "company_seat": "Frankfurt am Main",
      "details": "19.12.2024 (Bekanntmachungsdatum)\n\nHessen Amtsgericht Frankfurt am Main HRB 75453\nEinreichung neuer Dokumente 02.04.2012 (Eintragungsdatum)\n\nDell GmbH\nGesellschaft mit beschränkter Haftung\nFrankfurt am Main\n\nDurch eine Änderung in den Personen der Aufsichtsratsmitglieder ist eine Liste der Mitglieder des Aufsichtsrates zum Handelsregister eingereicht worden."
    },
    {
      "date": "2024-12-19",
      "id": "97109",
      "original_text": "Löschungsankündigung\nHessen Amtsgericht Frankfurt am Main HRB 127128\nM.A.K MAIN Service & Dienstleistungs GmbH – Hattersheim am Main",
      "type": "Löschungsankündigung",
      "state": "Hessen",
      "amtsgericht": "Amtsgericht Frankfurt am Main",
      "registernummer": "HRB 127128",
      "registerart": "HRB",
      "company_name": "M.A.K MAIN Service & Dienstleistungs GmbH",
      "company_seat": "Hattersheim am Main",
      "details": "19.12.2024 (Bekanntmachungsdatum)\n\nHessen Amtsgericht Frankfurt am Main HRB 127128\nLöschungsankündigung\n\nM.A.K MAIN Service & Dienstleistungs GmbH\nGesellschaft mit beschränkter Haftung\nHattersheim am Main\n\nEs ist beabsichtigt die Gesellschaft wegen Vermögenslosigkeit gemäß § 394 FamFG von Amts wegen zu löschen. Hiergegen kann innerhalb eines Monats nach dieser Veröffentlichung Widerspruch bei dem Amtsgericht Frankfurt am Main eingelegt werden."
    }
  ]
}