{
  "date": "2024-12-09",
  "date_of_scrape": "2024-12-10T04:08:45.899Z",
  "tool_version": "0.2.0",
  "number_of_announcements": 138,
  "announcements": [
    {
      "date": "2024-12-09",
      "id": "95715",
      "original_text": "Einreichung neuer Dokumente\nSaarland Amtsgericht Saarbrücken HRB 15250\nSaarländische Nahverkehrs-Service GmbH, abgekürzt: SNS GmbH – Völklingen",
      "type": "Einreichung neuer Dokumente",
      "state": "Saarland",
      "amtsgericht": "Amtsgericht Saarbrücken",
      "registernummer": "HRB 15250",
      "registerart": "HRB",
      "company_name": "Saarländische Nahverkehrs-Service GmbH, abgekürzt: SNS GmbH",
      "company_seat": "Völklingen",
      "details": "09.12.2024 (Bekanntmachungsdatum)\n\nSaarland Amtsgericht Saarbrücken HRB 15250\nEinreichung neuer Dokumente\n\nSaarländische Nahverkehrs-Service GmbH, abgekürzt: SNS GmbH\nGesellschaft mit beschränkter Haftung\nVölklingen\n\nDie Geschäftsführung der Gesellschaft hat eine Liste der Mitglieder des Aufsichtsrats zum Handelsregister eingereicht (§ 52 Abs. 3 Satz 2 GmbHG)."
    },
    {
      "date": "2024-12-09",
      "id": "95716",
      "original_text": "Löschungsankündigung\nBerlin Amtsgericht Berlin (Charlottenburg) HRB 123758\nINtegrated Art I Holding AG – Berlin",
      "type": "Löschungsankündigung",
      "state": "Berlin",
      "amtsgericht": "Amtsgericht Berlin (Charlottenburg)",
      "registernummer": "HRB 123758",
      "registerart": "HRB",
      "company_name": "INtegrated Art I Holding AG",
      "company_seat": "Berlin",
      "details": "09.12.2024 (Bekanntmachungsdatum)\n\nBerlin Amtsgericht Berlin (Charlottenburg) HRB 123758\nLöschungsankündigung\n\nINtegrated Art I Holding AG\nAktiengesellschaft\nBerlin\n\nBei der nachstehenden Gesellschaft wird das Amtslöschungsverfahren gemäß § 394 FamFG eingeleitet. Widerspruchsfrist 6 Wochen"
    },
    {
      "date": "2024-12-09",
      "id": "95717",
      "original_text": "Registerbekanntmachung nach dem Umwandlungsgesetz\nBaden-Württemberg Amtsgericht Mannheim HRA 709360\nMannheimer Wohnwerte Collini GmbH & Co. KG – Heidelberg",
      "type": "Registerbekanntmachung nach dem Umwandlungsgesetz",
      "state": "Baden-Württemberg",
      "amtsgericht": "Amtsgericht Mannheim",
      "registernummer": "HRA 709360",
      "registerart": "HRA",
      "company_name": "Mannheimer Wohnwerte Collini GmbH & Co. KG",
      "company_seat": "Heidelberg",
      "details": "09.12.2024 (Bekanntmachungsdatum)\n\nBaden-Württemberg Amtsgericht Mannheim HRA 709360\nRegisterbekanntmachung nach dem Umwandlungsgesetz 09.12.2024 (Eintragungsdatum)\n\nMannheimer Wohnwerte Collini GmbH & Co. KG\nKommanditgesellschaft\nHeidelberg\n\nDen Gläubigern der an der Verschmelzung beteiligten Rechtsträger ist, wenn sie binnen sechs Monaten nach dem Tag, an dem die Eintragung der Verschmelzung in das Register des Sitzes desjenigen Rechtsträgers, dessen Gläubiger sie sind, nach § 19 Abs. 3 UmwG als bekanntgemacht gilt, ihren Anspruch nach Grund und Höhe schriftlich anmelden, Sicherheit zu leisten, soweit sie nicht Befriedigung verlangen können. Dieses Recht steht den Gläubigern jedoch nur zu, wenn sie glaubhaft machen, dass durch die Verschmelzung die Erfüllung ihrer Forderung gefährdet wird."
    },
    {
      "date": "2024-12-09",
      "id": "95718",
      "original_text": "Registerbekanntmachung nach dem Umwandlungsgesetz\nBaden-Württemberg Amtsgericht Mannheim HRA 706589\nFrankfurter Wohnwerte Invest 2 GmbH & Co. KG – Heidelberg",
      "type": "Registerbekanntmachung nach dem Umwandlungsgesetz",
      "state": "Baden-Württemberg",
      "amtsgericht": "Amtsgericht Mannheim",
      "registernummer": "HRA 706589",
      "registerart": "HRA",
      "company_name": "Frankfurter Wohnwerte Invest 2 GmbH & Co. KG",
      "company_seat": "Heidelberg",
      "details": "09.12.2024 (Bekanntmachungsdatum)\n\nBaden-Württemberg Amtsgericht Mannheim HRA 706589\nRegisterbekanntmachung nach dem Umwandlungsgesetz 09.12.2024 (Eintragungsdatum)\n\nFrankfurter Wohnwerte Invest 2 GmbH & Co. KG\nKommanditgesellschaft\nHeidelberg\n\nAls nicht eingetragen wird bekanntgemacht:\nDen Gläubigern der an der Verschmelzung beteiligten Rechtsträger ist, wenn sie binnen sechs Monaten nach dem Tag, an dem die Eintragung der Verschmelzung in das Register des Sitzes desjenigen Rechtsträgers, dessen Gläubiger sie sind, nach § 19 Abs. 3 UmwG als bekanntgemacht gilt, ihren Anspruch nach Grund und Höhe schriftlich anmelden, Sicherheit zu leisten, soweit sie nicht Befriedigung verlangen können. Dieses Recht steht den Gläubigern jedoch nur zu, wenn sie glaubhaft machen, dass durch die Verschmelzung die Erfüllung ihrer Forderung gefährdet wird."
    },
    {
      "date": "2024-12-09",
      "id": "95719",
      "original_text": "Registerbekanntmachung nach dem Umwandlungsgesetz\nBaden-Württemberg Amtsgericht Stuttgart HRA 2712\nJosef Blässinger GmbH + Co. KG – Stuttgart",
      "type": "Registerbekanntmachung nach dem Umwandlungsgesetz",
      "state": "Baden-Württemberg",
      "amtsgericht": "Amtsgericht Stuttgart",
      "registernummer": "HRA 2712",
      "registerart": "HRA",
      "company_name": "Josef Blässinger GmbH + Co. KG",
      "company_seat": "Stuttgart",
      "details": "09.12.2024 (Bekanntmachungsdatum)\n\nBaden-Württemberg Amtsgericht Stuttgart HRA 2712\nRegisterbekanntmachung nach dem Umwandlungsgesetz 09.12.2024 (Eintragungsdatum)\n\nJosef Blässinger GmbH + Co. KG\nKommanditgesellschaft\nStuttgart\n\nAls nicht eingetragen wird bekanntgemacht:\nDen Gläubigern der an der Verschmelzung beteiligten Rechtsträger ist, wenn sie binnen sechs Monaten nach dem Tag, an dem die Eintragung der Verschmelzung in das Register des Sitzes desjenigen Rechtsträgers, dessen Gläubiger sie sind, nach § 19 Abs. 3 UmwG als bekanntgemacht gilt, ihren Anspruch nach Grund und Höhe schriftlich anmelden, Sicherheit zu leisten, soweit sie nicht Befriedigung verlangen können. Dieses Recht steht den Gläubigern jedoch nur zu, wenn sie glaubhaft machen, dass durch die Verschmelzung die Erfüllung ihrer Forderung gefährdet wird."
    },
    {
      "date": "2024-12-09",
      "id": "95720",
      "original_text": "Löschungsankündigung\nMecklenburg-Vorpommern Amtsgericht Stralsund HRB 7752\nBBB Holliday Konzept GmbH – Ückeritz",
      "type": "Löschungsankündigung",
      "state": "Mecklenburg-Vorpommern",
      "amtsgericht": "Amtsgericht Stralsund",
      "registernummer": "HRB 7752",
      "registerart": "HRB",
      "company_name": "BBB Holliday Konzept GmbH",
      "company_seat": "Ückeritz",
      "details": "09.12.2024 (Bekanntmachungsdatum)\n\nMecklenburg-Vorpommern Amtsgericht Stralsund HRB 7752\nLöschungsankündigung\n\nBBB Holliday Konzept GmbH\nGesellschaft mit beschränkter Haftung\nÜckeritz\n\nDas Registergericht beabsichtigt, die Firma von Amts wegen nach § 394 FamFG zu löschen. Die Frist zur Erhebung eines Widerspruchs ist auf 1 Monat festgesetzt."
    },
    {
      "date": "2024-12-09",
      "id": "95721",
      "original_text": "Löschungsankündigung\nBerlin Amtsgericht Berlin (Charlottenburg) HRB 255409\nOnline Marketplace SY UG (haftungsbeschränkt) – Berlin",
      "type": "Löschungsankündigung",
      "state": "Berlin",
      "amtsgericht": "Amtsgericht Berlin (Charlottenburg)",
      "registernummer": "HRB 255409",
      "registerart": "HRB",
      "company_name": "Online Marketplace SY UG (haftungsbeschränkt)",
      "company_seat": "Berlin",
      "details": "09.12.2024 (Bekanntmachungsdatum)\n\nBerlin Amtsgericht Berlin (Charlottenburg) HRB 255409\nLöschungsankündigung\n\nOnline Marketplace SY UG (haftungsbeschränkt)\nGesellschaft mit beschränkter Haftung\nBerlin\n\nBei der nachstehenden Gesellschaft wird das Amtslöschungsverfahren gemäß § 394 FamFG eingeleitet. Widerspruchsfrist 6 Wochen"
    },
    {
      "date": "2024-12-09",
      "id": "95722",
      "original_text": "Löschungsankündigung\nBerlin Amtsgericht Berlin (Charlottenburg) HRB 159368\nMBW-Werbemittel Vertriebs UG (haftungsbeschränkt) – Berlin",
      "type": "Löschungsankündigung",
      "state": "Berlin",
      "amtsgericht": "Amtsgericht Berlin (Charlottenburg)",
      "registernummer": "HRB 159368",
      "registerart": "HRB",
      "company_name": "MBW-Werbemittel Vertriebs UG (haftungsbeschränkt)",
      "company_seat": "Berlin",
      "details": "09.12.2024 (Bekanntmachungsdatum)\n\nBerlin Amtsgericht Berlin (Charlottenburg) HRB 159368\nLöschungsankündigung\n\nMBW-Werbemittel Vertriebs UG (haftungsbeschränkt)\nGesellschaft mit beschränkter Haftung\nBerlin\n\nBei der nachstehenden Gesellschaft wird das Amtslöschungsverfahren gemäß § 394 FamFG eingeleitet. Widerspruchsfrist 6 Wochen"
    },
    {
      "date": "2024-12-09",
      "id": "95723",
      "original_text": "Sonstige Registerbekanntmachung\nHamburg Amtsgericht Hamburg HRB 82237\nMMKH - Multimedia Kontor Hamburg Gesellschaft mit beschränkter Haftung – Hamburg",
      "type": "Sonstige Registerbekanntmachung",
      "state": "Hamburg",
      "amtsgericht": "Amtsgericht Hamburg",
      "registernummer": "HRB 82237",
      "registerart": "HRB",
      "company_name": "MMKH - Multimedia Kontor Hamburg Gesellschaft mit beschränkter Haftung",
      "company_seat": "Hamburg",
      "details": "09.12.2024 (Bekanntmachungsdatum)\n\nHamburg Amtsgericht Hamburg HRB 82237\nSonstige Registerbekanntmachung\n\nMMKH - Multimedia Kontor Hamburg Gesellschaft mit beschränkter Haftung\nGesellschaft mit beschränkter Haftung\nHamburg\n\nAls nicht eingetragen wird bekannt gemacht: Liste des Aufsichtsrats wurde eingereicht."
    },
    {
      "date": "2024-12-09",
      "id": "95724",
      "original_text": "Löschungsankündigung\nBerlin Amtsgericht Berlin (Charlottenburg) HRB 225422\nIoTAL GmbH – Berlin",
      "type": "Löschungsankündigung",
      "state": "Berlin",
      "amtsgericht": "Amtsgericht Berlin (Charlottenburg)",
      "registernummer": "HRB 225422",
      "registerart": "HRB",
      "company_name": "IoTAL GmbH",
      "company_seat": "Berlin",
      "details": "09.12.2024 (Bekanntmachungsdatum)\n\nBerlin Amtsgericht Berlin (Charlottenburg) HRB 225422\nLöschungsankündigung\n\nIoTAL GmbH\nGesellschaft mit beschränkter Haftung\nBerlin\n\nBei der nachstehenden Gesellschaft wird das Amtslöschungsverfahren gemäß § 394 FamFG eingeleitet. Widerspruchsfrist 6 Wochen"
    },
    {
      "date": "2024-12-09",
      "id": "95725",
      "original_text": "Löschungsankündigung\nBerlin Amtsgericht Berlin (Charlottenburg) HRB 244303\nASPRO BioTec GmbH – Berlin",
      "type": "Löschungsankündigung",
      "state": "Berlin",
      "amtsgericht": "Amtsgericht Berlin (Charlottenburg)",
      "registernummer": "HRB 244303",
      "registerart": "HRB",
      "company_name": "ASPRO BioTec GmbH",
      "company_seat": "Berlin",
      "details": "09.12.2024 (Bekanntmachungsdatum)\n\nBerlin Amtsgericht Berlin (Charlottenburg) HRB 244303\nLöschungsankündigung\n\nASPRO BioTec GmbH\nGesellschaft mit beschränkter Haftung\nBerlin\n\nBei der nachstehenden Gesellschaft wird das Amtslöschungsverfahren gemäß § 394 FamFG eingeleitet. Widerspruchsfrist 6 Wochen"
    },
    {
      "date": "2024-12-09",
      "id": "95726",
      "original_text": "Einreichung neuer Dokumente\nHamburg Amtsgericht Hamburg HRB 132441\nSprinkenhof GmbH – Hamburg",
      "type": "Einreichung neuer Dokumente",
      "state": "Hamburg",
      "amtsgericht": "Amtsgericht Hamburg",
      "registernummer": "HRB 132441",
      "registerart": "HRB",
      "company_name": "Sprinkenhof GmbH",
      "company_seat": "Hamburg",
      "details": "09.12.2024 (Bekanntmachungsdatum)\n\nHamburg Amtsgericht Hamburg HRB 132441\nEinreichung neuer Dokumente\n\nSprinkenhof GmbH\nGesellschaft mit beschränkter Haftung\nHamburg\n\nAls nicht eingetragen wird bekannt gemacht: Liste des Aufsichtsrats wurde eingereicht."
    },
    {
      "date": "2024-12-09",
      "id": "95727",
      "original_text": "Sonstige Registerbekanntmachung\nHamburg Amtsgericht Hamburg HRB 80070\nNetGain Aktiengesellschaft – Hamburg",
      "type": "Sonstige Registerbekanntmachung",
      "state": "Hamburg",
      "amtsgericht": "Amtsgericht Hamburg",
      "registernummer": "HRB 80070",
      "registerart": "HRB",
      "company_name": "NetGain Aktiengesellschaft",
      "company_seat": "Hamburg",
      "details": "09.12.2024 (Bekanntmachungsdatum)\n\nHamburg Amtsgericht Hamburg HRB 80070\nSonstige Registerbekanntmachung\n\nNetGain Aktiengesellschaft\nAktiengesellschaft\nHamburg\n\nAls nicht eingetragen wird bekannt gemacht: Liste des Aufsichtsrats wurde eingereicht."
    },
    {
      "date": "2024-12-09",
      "id": "95728",
      "original_text": "Registerbekanntmachung nach dem Umwandlungsgesetz\nBerlin Amtsgericht Berlin (Charlottenburg) HRB 245468\nFT Beteiligung GmbH – Berlin",
      "type": "Registerbekanntmachung nach dem Umwandlungsgesetz",
      "state": "Berlin",
      "amtsgericht": "Amtsgericht Berlin (Charlottenburg)",
      "registernummer": "HRB 245468",
      "registerart": "HRB",
      "company_name": "FT Beteiligung GmbH",
      "company_seat": "Berlin",
      "details": "09.12.2024 (Bekanntmachungsdatum)\n\nBerlin Amtsgericht Berlin (Charlottenburg) HRB 245468\nRegisterbekanntmachung nach dem Umwandlungsgesetz 05.12.2024 (Eintragungsdatum)\n\nFT Beteiligung GmbH\nGesellschaft mit beschränkter Haftung\nBerlin\n\nZu Eintragungsnummer 3 vom 05.12.2024 wird als nicht eingetragen veröffentlicht: Den Gläubigern der an der Verschmelzung beteiligten Rechtsträger ist, wenn sie binnen sechs Monaten nach dem Tag, an dem die Eintragung der Verschmelzung in das Register des Sitzes desjenigen Rechtsträgers, dessen Gläubiger sie sind, als bekannt gemacht gilt, ihren Anspruch nach Grund und Höhe schriftlich anmelden, Sicherheit zu leisten, soweit sie nicht Befriedigung verlangen können. Dieses Recht steht den Gläubigern jedoch nur zu, wenn sie glaubhaft machen, dass durch die Verschmelzung die Erfüllung ihrer Forderung gefährdet wird. Das Recht, Sicherheitsleistung zu verlangen, steht Gläubigern nicht zu, die im Falle der Insolvenz ein Recht auf vorzugsweise Befriedigung aus einer Deckungsmasse haben, die nach gesetzlicher Vorschrift zu ihrem Schutz errichtet und staatlich überwacht ist."
    },
    {
      "date": "2024-12-09",
      "id": "95729",
      "original_text": "Löschungsankündigung\nBerlin Amtsgericht Berlin (Charlottenburg) HRB 104596\nVedranel neunundzwanzigste Immobilienbesitz Verwaltungs GmbH – Berlin",
      "type": "Löschungsankündigung",
      "state": "Berlin",
      "amtsgericht": "Amtsgericht Berlin (Charlottenburg)",
      "registernummer": "HRB 104596",
      "registerart": "HRB",
      "company_name": "Vedranel neunundzwanzigste Immobilienbesitz Verwaltungs GmbH",
      "company_seat": "Berlin",
      "details": "09.12.2024 (Bekanntmachungsdatum)\n\nBerlin Amtsgericht Berlin (Charlottenburg) HRB 104596\nLöschungsankündigung\n\nVedranel neunundzwanzigste Immobilienbesitz Verwaltungs GmbH\nGesellschaft mit beschränkter Haftung\nBerlin\n\nBei der nachstehenden Gesellschaft wird das Amtslöschungsverfahren gemäß § 394 FamFG eingeleitet. Widerspruchsfrist 6 Wochen"
    },
    {
      "date": "2024-12-09",
      "id": "95730",
      "original_text": "Löschungsankündigung\nBerlin Amtsgericht Berlin (Charlottenburg) HRB 167614\nDEPHARMA GmbH – Berlin",
      "type": "Löschungsankündigung",
      "state": "Berlin",
      "amtsgericht": "Amtsgericht Berlin (Charlottenburg)",
      "registernummer": "HRB 167614",
      "registerart": "HRB",
      "company_name": "DEPHARMA GmbH",
      "company_seat": "Berlin",
      "details": "09.12.2024 (Bekanntmachungsdatum)\n\nBerlin Amtsgericht Berlin (Charlottenburg) HRB 167614\nLöschungsankündigung\n\nDEPHARMA GmbH\nGesellschaft mit beschränkter Haftung\nBerlin\n\nBei der nachstehenden Gesellschaft wird das Amtslöschungsverfahren gemäß § 394 FamFG eingeleitet. Widerspruchsfrist 6 Wochen"
    },
    {
      "date": "2024-12-09",
      "id": "95731",
      "original_text": "Einreichung neuer Dokumente\nHamburg Amtsgericht Hamburg HRB 90813\nSmurfit Westrock Deutschland GmbH – Hamburg",
      "type": "Einreichung neuer Dokumente",
      "state": "Hamburg",
      "amtsgericht": "Amtsgericht Hamburg",
      "registernummer": "HRB 90813",
      "registerart": "HRB",
      "company_name": "Smurfit Westrock Deutschland GmbH",
      "company_seat": "Hamburg",
      "details": "09.12.2024 (Bekanntmachungsdatum)\n\nHamburg Amtsgericht Hamburg HRB 90813\nEinreichung neuer Dokumente\n\nSmurfit Westrock Deutschland GmbH\nGesellschaft mit beschränkter Haftung\nHamburg\n\nAls nicht eingetragen wird bekannt gemacht: Liste des Aufsichtsrats wurde eingereicht."
    },
    {
      "date": "2024-12-09",
      "id": "95732",
      "original_text": "Einreichung neuer Dokumente\nBerlin Amtsgericht Berlin (Charlottenburg) HRB 209607\nAMBOSS GmbH – Berlin",
      "type": "Einreichung neuer Dokumente",
      "state": "Berlin",
      "amtsgericht": "Amtsgericht Berlin (Charlottenburg)",
      "registernummer": "HRB 209607",
      "registerart": "HRB",
      "company_name": "AMBOSS GmbH",
      "company_seat": "Berlin",
      "details": "09.12.2024 (Bekanntmachungsdatum)\n\nBerlin Amtsgericht Berlin (Charlottenburg) HRB 209607\nEinreichung neuer Dokumente\n\nAMBOSS GmbH\nGesellschaft mit beschränkter Haftung\nBerlin\n\nAls nicht eingetragen wird veröffentlicht: Es wurde eine neue Liste der Aufsichtsratsmitglieder eingereicht (§52 GmbHG)."
    },
    {
      "date": "2024-12-09",
      "id": "95733",
      "original_text": "Löschungsankündigung\nSchleswig-Holstein Amtsgericht Flensburg HRB 15485\nJC Global Advisory GmbH – Flensburg",
      "type": "Löschungsankündigung",
      "state": "Schleswig-Holstein",
      "amtsgericht": "Amtsgericht Flensburg",
      "registernummer": "HRB 15485",
      "registerart": "HRB",
      "company_name": "JC Global Advisory GmbH",
      "company_seat": "Flensburg",
      "details": "09.12.2024 (Bekanntmachungsdatum)\n\nSchleswig-Holstein Amtsgericht Flensburg HRB 15485\nLöschungsankündigung\n\nJC Global Advisory GmbH\nGesellschaft mit beschränkter Haftung\nFlensburg\n\nEs ist die Löschung der nachstehenden Gesellschaft wegen Vermögenslosigkeit gemäß § 394 FamFG beabsichtigt.\nWiderspruchsfrist: 2 Monate."
    },
    {
      "date": "2024-12-09",
      "id": "95734",
      "original_text": "Löschungsankündigung\nBerlin Amtsgericht Berlin (Charlottenburg) HRB 173752\nGreen Bike Berlin GmbH – Berlin",
      "type": "Löschungsankündigung",
      "state": "Berlin",
      "amtsgericht": "Amtsgericht Berlin (Charlottenburg)",
      "registernummer": "HRB 173752",
      "registerart": "HRB",
      "company_name": "Green Bike Berlin GmbH",
      "company_seat": "Berlin",
      "details": "09.12.2024 (Bekanntmachungsdatum)\n\nBerlin Amtsgericht Berlin (Charlottenburg) HRB 173752\nLöschungsankündigung\n\nGreen Bike Berlin GmbH\nGesellschaft mit beschränkter Haftung\nBerlin\n\nBei der nachstehenden Gesellschaft wird das Amtslöschungsverfahren gemäß § 394 FamFG eingeleitet. Widerspruchsfrist 6 Wochen"
    },
    {
      "date": "2024-12-09",
      "id": "95735",
      "original_text": "Einreichung neuer Dokumente\nBaden-Württemberg Amtsgericht Ulm HRB 500002\nWohnungsbau Aalen Gesellschaft mit beschränkter Haftung – Aalen",
      "type": "Einreichung neuer Dokumente",
      "state": "Baden-Württemberg",
      "amtsgericht": "Amtsgericht Ulm",
      "registernummer": "HRB 500002",
      "registerart": "HRB",
      "company_name": "Wohnungsbau Aalen Gesellschaft mit beschränkter Haftung",
      "company_seat": "Aalen",
      "details": "09.12.2024 (Bekanntmachungsdatum)\n\nBaden-Württemberg Amtsgericht Ulm HRB 500002\nEinreichung neuer Dokumente\n\nWohnungsbau Aalen Gesellschaft mit beschränkter Haftung\nGesellschaft mit beschränkter Haftung\nAalen\n\nDie Gesellschaft hat am 05.12.2024 die Liste über die Zusammensetzung des Aufsichtsrats zum Handelsregister eingereicht."
    },
    {
      "date": "2024-12-09",
      "id": "95736",
      "original_text": "Registerbekanntmachung nach dem Umwandlungsgesetz\nSchleswig-Holstein Amtsgericht Kiel HRB 24006\nPV Konzept UG (haftungsbeschränkt) – Nettelsee",
      "type": "Registerbekanntmachung nach dem Umwandlungsgesetz",
      "state": "Schleswig-Holstein",
      "amtsgericht": "Amtsgericht Kiel",
      "registernummer": "HRB 24006",
      "registerart": "HRB",
      "company_name": "PV Konzept UG (haftungsbeschränkt)",
      "company_seat": "Nettelsee",
      "details": "09.12.2024 (Bekanntmachungsdatum)\n\nSchleswig-Holstein Amtsgericht Kiel HRB 24006\nRegisterbekanntmachung nach dem Umwandlungsgesetz 05.12.2024 (Eintragungsdatum)\n\nPV Konzept UG (haftungsbeschränkt)\nGesellschaft mit beschränkter Haftung\nNettelsee\n\nZu Eintragungsnummer 4 vom 05.12.2024 wird als nicht eingetragen veröffentlicht: Den Gläubigern der an der Verschmelzung beteiligten Rechtsträger ist, wenn sie binnen sechs Monaten nach dem Tag, an dem die Eintragung der Verschmelzung in das Register des Sitzes desjenigen Rechtsträgers, dessen Gläubiger sie sind, nach § 19 Abs. 3 UmwG bekannt gemacht worden ist, ihren Anspruch nach Grund und Höhe schriftlich anmelden, Sicherheit zu leisten, soweit sie nicht Befriedigung verlangen können. Dieses Recht steht den Gläubigern jedoch nur zu, wenn sie glaubhaft machen, dass durch die Verschmelzung die Erfüllung ihrer Forderung gefährdet wird."
    },
    {
      "date": "2024-12-09",
      "id": "95737",
      "original_text": "Sonstige Registerbekanntmachung\nSchleswig-Holstein Amtsgericht Kiel HRA 6089\nMS \"O.M. Iridium\" GmbH & Co. KG – Groß Wittensee",
      "type": "Sonstige Registerbekanntmachung",
      "state": "Schleswig-Holstein",
      "amtsgericht": "Amtsgericht Kiel",
      "registernummer": "HRA 6089",
      "registerart": "HRA",
      "company_name": "MS \"O.M. Iridium\" GmbH & Co. KG",
      "company_seat": "Groß Wittensee",
      "details": "09.12.2024 (Bekanntmachungsdatum)\n\nSchleswig-Holstein Amtsgericht Kiel HRA 6089\nSonstige Registerbekanntmachung 09.12.2024 (Eintragungsdatum)\n\nMS \"O.M. Iridium\" GmbH & Co. KG\nKommanditgesellschaft\nGroß Wittensee\n\nDie Firma ist erloschen. Von Amts wegen eingetragen auf Grund des § 31 Abs. 2 HGB."
    },
    {
      "date": "2024-12-09",
      "id": "95738",
      "original_text": "Registerbekanntmachung nach dem Umwandlungsgesetz\nSchleswig-Holstein Amtsgericht Kiel HRB 1616 RD\nMS \"NORTHERN DIGNITY\" Schiffahrtsgesellschaft mbH – Rendsburg",
      "type": "Registerbekanntmachung nach dem Umwandlungsgesetz",
      "state": "Schleswig-Holstein",
      "amtsgericht": "Amtsgericht Kiel",
      "registernummer": "HRB 1616 RD",
      "registerart": "HRB",
      "company_name": "MS \"NORTHERN DIGNITY\" Schiffahrtsgesellschaft mbH",
      "company_seat": "Rendsburg",
      "details": "09.12.2024 (Bekanntmachungsdatum)\n\nSchleswig-Holstein Amtsgericht Kiel HRB 1616 RD\nRegisterbekanntmachung nach dem Umwandlungsgesetz 05.12.2024 (Eintragungsdatum)\n\nMS \"NORTHERN DIGNITY\" Schiffahrtsgesellschaft mbH\nGesellschaft mit beschränkter Haftung\nRendsburg\n\nZu Eintragungsnummer 13 vom 05.12.2024 wird als nicht eingetragen veröffentlicht: Den Gläubigern der an der Verschmelzung beteiligten Rechtsträger ist, wenn sie binnen sechs Monaten nach dem Tag, an dem die Eintragung der Verschmelzung in das Register des Sitzes desjenigen Rechtsträgers, dessen Gläubiger sie sind, nach § 19 Abs. 3 UmwG bekannt gemacht worden ist, ihren Anspruch nach Grund und Höhe schriftlich anmelden, Sicherheit zu leisten, soweit sie nicht Befriedigung verlangen können. Dieses Recht steht den Gläubigern jedoch nur zu, wenn sie glaubhaft machen, dass durch die Verschmelzung die Erfüllung ihrer Forderung gefährdet wird."
    },
    {
      "date": "2024-12-09",
      "id": "95739",
      "original_text": "Registerbekanntmachung nach dem Umwandlungsgesetz\nSchleswig-Holstein Amtsgericht Kiel HRB 1739 RD\nMS \"NORTHERN VITALITY\" Schiffahrtsgesellschaft mbH – Rendsburg",
      "type": "Registerbekanntmachung nach dem Umwandlungsgesetz",
      "state": "Schleswig-Holstein",
      "amtsgericht": "Amtsgericht Kiel",
      "registernummer": "HRB 1739 RD",
      "registerart": "HRB",
      "company_name": "MS \"NORTHERN VITALITY\" Schiffahrtsgesellschaft mbH",
      "company_seat": "Rendsburg",
      "details": "09.12.2024 (Bekanntmachungsdatum)\n\nSchleswig-Holstein Amtsgericht Kiel HRB 1739 RD\nRegisterbekanntmachung nach dem Umwandlungsgesetz 05.12.2024 (Eintragungsdatum)\n\nMS \"NORTHERN VITALITY\" Schiffahrtsgesellschaft mbH\nGesellschaft mit beschränkter Haftung\nRendsburg\n\nZu Eintragungsnummer 12 vom 05.12.2024 wird als nicht eingetragen veröffentlicht: Den Gläubigern der an der Verschmelzung beteiligten Rechtsträger ist, wenn sie binnen sechs Monaten nach dem Tag, an dem die Eintragung der Verschmelzung in das Register des Sitzes desjenigen Rechtsträgers, dessen Gläubiger sie sind, nach § 19 Abs. 3 UmwG bekannt gemacht worden ist, ihren Anspruch nach Grund und Höhe schriftlich anmelden, Sicherheit zu leisten, soweit sie nicht Befriedigung verlangen können. Dieses Recht steht den Gläubigern jedoch nur zu, wenn sie glaubhaft machen, dass durch die Verschmelzung die Erfüllung ihrer Forderung gefährdet wird."
    },
    {
      "date": "2024-12-09",
      "id": "95740",
      "original_text": "Registerbekanntmachung nach dem Umwandlungsgesetz\nBaden-Württemberg Amtsgericht Stuttgart HRB 720839\nGulde Verwaltungs GmbH – Stuttgart",
      "type": "Registerbekanntmachung nach dem Umwandlungsgesetz",
      "state": "Baden-Württemberg",
      "amtsgericht": "Amtsgericht Stuttgart",
      "registernummer": "HRB 720839",
      "registerart": "HRB",
      "company_name": "Gulde Verwaltungs GmbH",
      "company_seat": "Stuttgart",
      "details": "09.12.2024 (Bekanntmachungsdatum)\n\nBaden-Württemberg Amtsgericht Stuttgart HRB 720839\nRegisterbekanntmachung nach dem Umwandlungsgesetz 09.12.2024 (Eintragungsdatum)\n\nGulde Verwaltungs GmbH\nGesellschaft mit beschränkter Haftung\nStuttgart\n\nAls nicht eingetragen wird bekanntgemacht:\nDen Gläubigern der an der Verschmelzung beteiligten Rechtsträger ist, wenn sie binnen sechs Monaten nach dem Tag, an dem die Eintragung der Verschmelzung in das Register des Sitzes desjenigen Rechtsträgers, dessen Gläubiger sie sind, nach § 19 Abs. 3 UmwG als bekanntgemacht gilt, ihren Anspruch nach Grund und Höhe schriftlich anmelden, Sicherheit zu leisten, soweit sie nicht Befriedigung verlangen können. Dieses Recht steht den Gläubigern jedoch nur zu, wenn sie glaubhaft machen, dass durch die Verschmelzung die Erfüllung ihrer Forderung gefährdet wird."
    },
    {
      "date": "2024-12-09",
      "id": "95741",
      "original_text": "Registerbekanntmachung nach dem Umwandlungsgesetz\nSchleswig-Holstein Amtsgericht Kiel HRB 1798 RD\nMS \"NORTHERN VICTORY\" Schiffahrtsgesellschaft mbH – Rendsburg",
      "type": "Registerbekanntmachung nach dem Umwandlungsgesetz",
      "state": "Schleswig-Holstein",
      "amtsgericht": "Amtsgericht Kiel",
      "registernummer": "HRB 1798 RD",
      "registerart": "HRB",
      "company_name": "MS \"NORTHERN VICTORY\" Schiffahrtsgesellschaft mbH",
      "company_seat": "Rendsburg",
      "details": "09.12.2024 (Bekanntmachungsdatum)\n\nSchleswig-Holstein Amtsgericht Kiel HRB 1798 RD\nRegisterbekanntmachung nach dem Umwandlungsgesetz 09.12.2024 (Eintragungsdatum)\n\nMS \"NORTHERN VICTORY\" Schiffahrtsgesellschaft mbH\nGesellschaft mit beschränkter Haftung\nRendsburg\n\nZu Eintragungsnummer 11 vom 09.12.2024 wird als nicht eingetragen veröffentlicht: Den Gläubigern der an der Verschmelzung beteiligten Rechtsträger ist, wenn sie binnen sechs Monaten nach dem Tag, an dem die Eintragung der Verschmelzung in das Register des Sitzes desjenigen Rechtsträgers, dessen Gläubiger sie sind, nach § 19 Abs. 3 UmwG bekannt gemacht worden ist, ihren Anspruch nach Grund und Höhe schriftlich anmelden, Sicherheit zu leisten, soweit sie nicht Befriedigung verlangen können. Dieses Recht steht den Gläubigern jedoch nur zu, wenn sie glaubhaft machen, dass durch die Verschmelzung die Erfüllung ihrer Forderung gefährdet wird."
    },
    {
      "date": "2024-12-09",
      "id": "95742",
      "original_text": "Sonstige Registerbekanntmachung\nSchleswig-Holstein Amtsgericht Lübeck HRB 387 AH\nLANtana Gesellschaft für angewandte Daten- und Netzwerktechnik mbH – Ahrensburg",
      "type": "Sonstige Registerbekanntmachung",
      "state": "Schleswig-Holstein",
      "amtsgericht": "Amtsgericht Lübeck",
      "registernummer": "HRB 387 AH",
      "registerart": "HRB",
      "company_name": "LANtana Gesellschaft für angewandte Daten- und Netzwerktechnik mbH",
      "company_seat": "Ahrensburg",
      "details": "09.12.2024 (Bekanntmachungsdatum)\n\nSchleswig-Holstein Amtsgericht Lübeck HRB 387 AH\nSonstige Registerbekanntmachung\n\nLANtana Gesellschaft für angewandte Daten- und Netzwerktechnik mbH\nGesellschaft mit beschränkter Haftung\nAhrensburg\n\nAls nicht eingetragen wird veröffentlicht: Den Gläubigern der Gesellschaft, deren Forderungen begründet worden sind, bevor die Eintragung der Beendigung des Vertrages in das Handelsregister nach § 10 HGB bekannt gemacht worden ist, ist vom anderen Vertragspartner Sicherheit zu leisten, wenn sie sich binnen sechs Monaten nach Bekanntmachung der Eintragung zu diesem Zweck bei ihm melden."
    },
    {
      "date": "2024-12-09",
      "id": "95743",
      "original_text": "Einreichung neuer Dokumente\nThüringen Amtsgericht Jena HRB 300926\nWohnungsgesellschaft mbH Schleusingen – Schleusingen",
      "type": "Einreichung neuer Dokumente",
      "state": "Thüringen",
      "amtsgericht": "Amtsgericht Jena",
      "registernummer": "HRB 300926",
      "registerart": "HRB",
      "company_name": "Wohnungsgesellschaft mbH Schleusingen",
      "company_seat": "Schleusingen",
      "details": "09.12.2024 (Bekanntmachungsdatum)\n\nThüringen Amtsgericht Jena HRB 300926\nEinreichung neuer Dokumente\n\nWohnungsgesellschaft mbH Schleusingen\nGesellschaft mit beschränkter Haftung\nSchleusingen\n\nBekanntmachung gem. § 52 Abs. 3 Satz 2 GmbHG: Aufgrund einer Veränderung in den Personen der Aufsichtsratsmitglieder ist durch die Geschäftsführer eine neue Liste zum Handelsregister eingereicht worden."
    },
    {
      "date": "2024-12-09",
      "id": "95744",
      "original_text": "Sonstige Registerbekanntmachung\nSchleswig-Holstein Amtsgericht Kiel HRA 2389 NO\nHübner & Lorenzen (GmbH & Co.) KG – Norderstedt",
      "type": "Sonstige Registerbekanntmachung",
      "state": "Schleswig-Holstein",
      "amtsgericht": "Amtsgericht Kiel",
      "registernummer": "HRA 2389 NO",
      "registerart": "HRA",
      "company_name": "Hübner & Lorenzen (GmbH & Co.) KG",
      "company_seat": "Norderstedt",
      "details": "09.12.2024 (Bekanntmachungsdatum)\n\nSchleswig-Holstein Amtsgericht Kiel HRA 2389 NO\nSonstige Registerbekanntmachung 09.12.2024 (Eintragungsdatum)\n\nHübner & Lorenzen (GmbH & Co.) KG\nKommanditgesellschaft\nNorderstedt\n\nDie Firma ist erloschen. Von Amts wegen eingetragen aufgrund des § 31 Abs. 2 HGB."
    },
    {
      "date": "2024-12-09",
      "id": "95745",
      "original_text": "Löschungsankündigung\nBerlin Amtsgericht Berlin (Charlottenburg) HRB 179374\nDSD Datenspeicher Deutschland GmbH – Berlin",
      "type": "Löschungsankündigung",
      "state": "Berlin",
      "amtsgericht": "Amtsgericht Berlin (Charlottenburg)",
      "registernummer": "HRB 179374",
      "registerart": "HRB",
      "company_name": "DSD Datenspeicher Deutschland GmbH",
      "company_seat": "Berlin",
      "details": "09.12.2024 (Bekanntmachungsdatum)\n\nBerlin Amtsgericht Berlin (Charlottenburg) HRB 179374\nLöschungsankündigung\n\nDSD Datenspeicher Deutschland GmbH\nGesellschaft mit beschränkter Haftung\nBerlin\n\nBei der nachstehenden Gesellschaft wird das Amtslöschungsverfahren gemäß § 394 FamFG eingeleitet. Widerspruchsfrist 6 Wochen"
    },
    {
      "date": "2024-12-09",
      "id": "95746",
      "original_text": "Registerbekanntmachung nach dem Umwandlungsgesetz\nBrandenburg Amtsgericht Neuruppin GnR 77\nAgrargenossenschaft Wolfshagen eG – Groß Pankow (Prignitz)",
      "type": "Registerbekanntmachung nach dem Umwandlungsgesetz",
      "state": "Brandenburg",
      "amtsgericht": "Amtsgericht Neuruppin",
      "registernummer": "GnR 77",
      "registerart": "GnR",
      "company_name": "Agrargenossenschaft Wolfshagen eG",
      "company_seat": "Groß Pankow (Prignitz)",
      "details": "09.12.2024 (Bekanntmachungsdatum)\n\nBrandenburg Amtsgericht Neuruppin GnR 77\nRegisterbekanntmachung nach dem Umwandlungsgesetz 06.12.2024 (Eintragungsdatum)\n\nAgrargenossenschaft Wolfshagen eG\neingetragene Genossenschaft\nGroß Pankow (Prignitz)\n\nZu Eintragungsnummer 11 vom 06.12.2024 wird als nicht eingetragen veröffentlicht:\nDen Gläubigern der an der Umwandlung beteiligten Rechtsträger ist, wenn sie binnen sechs Monaten nach dem Tag, an dem die Eintragung der Umwandlung in das Register des Sitzes desjenigen Rechtsträgers, dessen Gläubiger sie sind, als bekannt gemacht gilt, ihren Anspruch nach Grund und Höhe schriftlich anmelden, Sicherheit zu leisten, soweit sie nicht Befriedigung verlangen können. Dieses Recht steht den Gläubigern jedoch nur zu, wenn sie glaubhaft machen, dass durch die Umwandlung die Erfüllung ihrer Forderung gefährdet wird"
    },
    {
      "date": "2024-12-09",
      "id": "95747",
      "original_text": "Löschungsankündigung\nBerlin Amtsgericht Berlin (Charlottenburg) HRB 181385\nBerHos GmbH – Berlin",
      "type": "Löschungsankündigung",
      "state": "Berlin",
      "amtsgericht": "Amtsgericht Berlin (Charlottenburg)",
      "registernummer": "HRB 181385",
      "registerart": "HRB",
      "company_name": "BerHos GmbH",
      "company_seat": "Berlin",
      "details": "09.12.2024 (Bekanntmachungsdatum)\n\nBerlin Amtsgericht Berlin (Charlottenburg) HRB 181385\nLöschungsankündigung\n\nBerHos GmbH\nGesellschaft mit beschränkter Haftung\nBerlin\n\nBei der nachstehenden Gesellschaft wird das Amtslöschungsverfahren gemäß § 394 FamFG eingeleitet. Widerspruchsfrist 6 Wochen"
    },
    {
      "date": "2024-12-09",
      "id": "95748",
      "original_text": "Einreichung neuer Dokumente\nHamburg Amtsgericht Hamburg HRB 126094\nLichtBlick SE – Hamburg",
      "type": "Einreichung neuer Dokumente",
      "state": "Hamburg",
      "amtsgericht": "Amtsgericht Hamburg",
      "registernummer": "HRB 126094",
      "registerart": "HRB",
      "company_name": "LichtBlick SE",
      "company_seat": "Hamburg",
      "details": "09.12.2024 (Bekanntmachungsdatum)\n\nHamburg Amtsgericht Hamburg HRB 126094\nEinreichung neuer Dokumente\n\nLichtBlick SE\nEuropäische Aktiengesellschaft (SE)\nHamburg\n\nAls nicht eingetragen wird bekannt gemacht: Liste des Verwaltungsrats wurde eingereicht."
    },
    {
      "date": "2024-12-09",
      "id": "95749",
      "original_text": "Einreichung neuer Dokumente\nBerlin Amtsgericht Berlin (Charlottenburg) HRB 73758\nIDEENFABRIK AKTIENGESELLSCHAFT – Berlin",
      "type": "Einreichung neuer Dokumente",
      "state": "Berlin",
      "amtsgericht": "Amtsgericht Berlin (Charlottenburg)",
      "registernummer": "HRB 73758",
      "registerart": "HRB",
      "company_name": "IDEENFABRIK AKTIENGESELLSCHAFT",
      "company_seat": "Berlin",
      "details": "09.12.2024 (Bekanntmachungsdatum)\n\nBerlin Amtsgericht Berlin (Charlottenburg) HRB 73758\nEinreichung neuer Dokumente\n\nIDEENFABRIK AKTIENGESELLSCHAFT\nAktiengesellschaft\nBerlin\n\nAls nicht eingetragen wird veröffentlicht:"
    },
    {
      "date": "2024-12-09",
      "id": "95750",
      "original_text": "Sonstige Registerbekanntmachung\nBerlin Amtsgericht Berlin (Charlottenburg) HRB 12065\nNippe Elektrohandels- Gesellschaft mit beschränkter Haftung – Berlin",
      "type": "Sonstige Registerbekanntmachung",
      "state": "Berlin",
      "amtsgericht": "Amtsgericht Berlin (Charlottenburg)",
      "registernummer": "HRB 12065",
      "registerart": "HRB",
      "company_name": "Nippe Elektrohandels- Gesellschaft mit beschränkter Haftung",
      "company_seat": "Berlin",
      "details": "09.12.2024 (Bekanntmachungsdatum)\n\nBerlin Amtsgericht Berlin (Charlottenburg) HRB 12065\nSonstige Registerbekanntmachung\n\nNippe Elektrohandels- Gesellschaft mit beschränkter Haftung\nGesellschaft mit beschränkter Haftung\nBerlin\n\nAls nicht eingetragen wird veröffentlicht: Den Gläubigern der an der Verschmelzung beteiligten Rechtsträger ist, wenn sie binnen sechs Monaten nach dem Tag, an dem die Eintragung der Verschmelzung in das Register des Sitzes desjenigen Rechtsträgers, dessen Gläubiger sie sind, als bekannt gemacht gilt, ihren Anspruch nach Grund und Höhe schriftlich anmelden, Sicherheit zu leisten, soweit sie nicht Befriedigung verlangen können. Dieses Recht steht den Gläubigern jedoch nur zu, wenn sie glaubhaft machen, dass durch die Verschmelzung die Erfüllung ihrer Forderung gefährdet wird. Das Recht, Sicherheitsleistung zu verlangen, steht Gläubigern nicht zu, die im Falle der Insolvenz ein Recht auf vorzugsweise Befriedigung aus einer Deckungsmasse haben, die nach gesetzlicher Vorschrift zu ihrem Schutz errichtet und staatlich überwacht ist."
    },
    {
      "date": "2024-12-09",
      "id": "95751",
      "original_text": "Registerbekanntmachung nach dem Umwandlungsgesetz\nBerlin Amtsgericht Berlin (Charlottenburg) HRB 252352\nAvaloq Sourcing (Europe) GmbH – Berlin",
      "type": "Registerbekanntmachung nach dem Umwandlungsgesetz",
      "state": "Berlin",
      "amtsgericht": "Amtsgericht Berlin (Charlottenburg)",
      "registernummer": "HRB 252352",
      "registerart": "HRB",
      "company_name": "Avaloq Sourcing (Europe) GmbH",
      "company_seat": "Berlin",
      "details": "09.12.2024 (Bekanntmachungsdatum)\n\nBerlin Amtsgericht Berlin (Charlottenburg) HRB 252352\nRegisterbekanntmachung nach dem Umwandlungsgesetz 05.12.2024 (Eintragungsdatum)\n\nAvaloq Sourcing (Europe) GmbH\nGesellschaft mit beschränkter Haftung\nBerlin\n\nZu Eintragungsnummer 5 vom 05.12.2024 wird als nicht eingetragen veröffentlicht:Den Gläubigern der an der Verschmelzung beteiligten Rechtsträger ist, wenn sie binnen sechs Monaten nach dem Tag, an dem die Eintragung der Verschmelzung in das Register des Sitzes desjenigen Rechtsträgers, dessen Gläubiger sie sind, als bekannt gemacht gilt, ihren Anspruch nach Grund und Höhe schriftlich anmelden, Sicherheit zu leisten, soweit sie nicht Befriedigung verlangen können. Dieses Recht steht den Gläubigern jedoch nur zu, wenn sie glaubhaft machen, dass durch die Verschmelzung die Erfüllung ihrer Forderung gefährdet wird. Das Recht, Sicherheitsleistung zu verlangen, steht Gläubigern nicht zu, die im Falle der Insolvenz ein Recht auf vorzugsweise Befriedigung aus einer Deckungsmasse haben, die nach gesetzlicher Vorschrift zu ihrem Schutz errichtet und staatlich überwacht ist."
    },
    {
      "date": "2024-12-09",
      "id": "95752",
      "original_text": "Registerbekanntmachung nach dem Umwandlungsgesetz\nSchleswig-Holstein Amtsgericht Kiel HRB 1701 RD\nMS \"NORTHERN VIRTUE\" Schiffahrtsgesellschaft mbH – Rendsburg",
      "type": "Registerbekanntmachung nach dem Umwandlungsgesetz",
      "state": "Schleswig-Holstein",
      "amtsgericht": "Amtsgericht Kiel",
      "registernummer": "HRB 1701 RD",
      "registerart": "HRB",
      "company_name": "MS \"NORTHERN VIRTUE\" Schiffahrtsgesellschaft mbH",
      "company_seat": "Rendsburg",
      "details": "09.12.2024 (Bekanntmachungsdatum)\n\nSchleswig-Holstein Amtsgericht Kiel HRB 1701 RD\nRegisterbekanntmachung nach dem Umwandlungsgesetz 09.12.2024 (Eintragungsdatum)\n\nMS \"NORTHERN VIRTUE\" Schiffahrtsgesellschaft mbH\nGesellschaft mit beschränkter Haftung\nRendsburg\n\nAls nicht eingetragen wird veröffentlicht: Den Gläubigern der an der Verschmelzung beteiligten Rechtsträger ist, wenn sie binnen sechs Monaten nach dem Tag, an dem die Eintragung der Verschmelzung in das Register des Sitzes desjenigen Rechtsträgers, dessen Gläubiger sie sind, nach § 19 Abs. 3 UmwG bekannt gemacht worden ist, ihren Anspruch nach Grund und Höhe schriftlich anmelden, Sicherheit zu leisten, soweit sie nicht Befriedigung verlangen können. Dieses Recht steht den Gläubigern jedoch nur zu, wenn sie glaubhaft machen, dass durch die Verschmelzung die Erfüllung ihrer Forderung gefährdet wird."
    },
    {
      "date": "2024-12-09",
      "id": "95753",
      "original_text": "Registerbekanntmachung nach dem Umwandlungsgesetz\nSchleswig-Holstein Amtsgericht Kiel HRB 1721 RD\nMS \"NORTHERN VALOUR\" Schiffahrtsgesellschaft mbH – Rendsburg",
      "type": "Registerbekanntmachung nach dem Umwandlungsgesetz",
      "state": "Schleswig-Holstein",
      "amtsgericht": "Amtsgericht Kiel",
      "registernummer": "HRB 1721 RD",
      "registerart": "HRB",
      "company_name": "MS \"NORTHERN VALOUR\" Schiffahrtsgesellschaft mbH",
      "company_seat": "Rendsburg",
      "details": "09.12.2024 (Bekanntmachungsdatum)\n\nSchleswig-Holstein Amtsgericht Kiel HRB 1721 RD\nRegisterbekanntmachung nach dem Umwandlungsgesetz 09.12.2024 (Eintragungsdatum)\n\nMS \"NORTHERN VALOUR\" Schiffahrtsgesellschaft mbH\nGesellschaft mit beschränkter Haftung\nRendsburg\n\nAls nicht eingetragen wird veröffentlicht: Den Gläubigern ist, wenn sie binnen sechs Monaten nach dem Tag, an dem die Eintragung der Umwandlung bekannt gemacht worden ist, ihren Anspruch nach Grund und Höhe schriftlich anmelden, Sicherheit zu leisten, soweit sie nicht Befriedigung verlangen können. Dieses Recht steht den Gläubigern jedoch nur zu, wenn sie glaubhaft machen, dass durch die Umwandlung die Erfüllung ihrer Forderung gefährdet wird."
    },
    {
      "date": "2024-12-09",
      "id": "95754",
      "original_text": "Einreichung neuer Dokumente\nSachsen-Anhalt Amtsgericht Stendal HRB 11010\nWohnungsgesellschaft Köthen mbH – Köthen (Anhalt)",
      "type": "Einreichung neuer Dokumente",
      "state": "Sachsen-Anhalt",
      "amtsgericht": "Amtsgericht Stendal",
      "registernummer": "HRB 11010",
      "registerart": "HRB",
      "company_name": "Wohnungsgesellschaft Köthen mbH",
      "company_seat": "Köthen (Anhalt)",
      "details": "09.12.2024 (Bekanntmachungsdatum)\n\nSachsen-Anhalt Amtsgericht Stendal HRB 11010\nEinreichung neuer Dokumente\n\nWohnungsgesellschaft Köthen mbH\nGesellschaft mit beschränkter Haftung\nKöthen (Anhalt)\n\nEine Liste der Mitglieder des Aufsichtsrates wurde zum Handelsregister eingereicht."
    },
    {
      "date": "2024-12-09",
      "id": "95755",
      "original_text": "Registerbekanntmachung nach dem Umwandlungsgesetz\nBerlin Amtsgericht Berlin (Charlottenburg) HRB 98393\nIDEAL Berlin Immobilienmanagement GmbH – Berlin",
      "type": "Registerbekanntmachung nach dem Umwandlungsgesetz",
      "state": "Berlin",
      "amtsgericht": "Amtsgericht Berlin (Charlottenburg)",
      "registernummer": "HRB 98393",
      "registerart": "HRB",
      "company_name": "IDEAL Berlin Immobilienmanagement GmbH",
      "company_seat": "Berlin",
      "details": "09.12.2024 (Bekanntmachungsdatum)\n\nBerlin Amtsgericht Berlin (Charlottenburg) HRB 98393\nRegisterbekanntmachung nach dem Umwandlungsgesetz 06.12.2024 (Eintragungsdatum)\n\nIDEAL Berlin Immobilienmanagement GmbH\nGesellschaft mit beschränkter Haftung\nBerlin\n\nZu Eintragungsnummer 10 vom 06.12.2024 wird als nicht eingetragen veröffentlicht: Den Gläubigern der an der Verschmelzung beteiligten Rechtsträger ist, wenn sie binnen sechs Monaten nach dem Tag, an dem die Eintragung der Verschmelzung in das Register des Sitzes desjenigen Rechtsträgers, dessen Gläubiger sie sind, als bekannt gemacht gilt, ihren Anspruch nach Grund und Höhe schriftlich anmelden, Sicherheit zu leisten, soweit sie nicht Befriedigung verlangen können. Dieses Recht steht den Gläubigern jedoch nur zu, wenn sie glaubhaft machen, dass durch die Verschmelzung die Erfüllung ihrer Forderung gefährdet wird. Das Recht, Sicherheitsleistung zu verlangen, steht Gläubigern nicht zu, die im Falle der Insolvenz ein Recht auf vorzugsweise Befriedigung aus einer Deckungsmasse haben, die nach gesetzlicher Vorschrift zu ihrem Schutz errichtet und staatlich überwacht ist."
    },
    {
      "date": "2024-12-09",
      "id": "95756",
      "original_text": "Registerbekanntmachung nach dem Umwandlungsgesetz\nBerlin Amtsgericht Berlin (Charlottenburg) HRB 98393\nIDEAL Berlin Immobilienmanagement GmbH – Berlin",
      "type": "Registerbekanntmachung nach dem Umwandlungsgesetz",
      "state": "Berlin",
      "amtsgericht": "Amtsgericht Berlin (Charlottenburg)",
      "registernummer": "HRB 98393",
      "registerart": "HRB",
      "company_name": "IDEAL Berlin Immobilienmanagement GmbH",
      "company_seat": "Berlin",
      "details": "09.12.2024 (Bekanntmachungsdatum)\n\nBerlin Amtsgericht Berlin (Charlottenburg) HRB 98393\nRegisterbekanntmachung nach dem Umwandlungsgesetz 06.12.2024 (Eintragungsdatum)\n\nIDEAL Berlin Immobilienmanagement GmbH\nGesellschaft mit beschränkter Haftung\nBerlin\n\nZu Eintragungsnummer 11 vom 06.12.2024 wird als nicht eingetragen veröffentlicht: Den Gläubigern der an der Verschmelzung beteiligten Rechtsträger ist, wenn sie binnen sechs Monaten nach dem Tag, an dem die Eintragung der Verschmelzung in das Register des Sitzes desjenigen Rechtsträgers, dessen Gläubiger sie sind, als bekannt gemacht gilt, ihren Anspruch nach Grund und Höhe schriftlich anmelden, Sicherheit zu leisten, soweit sie nicht Befriedigung verlangen können. Dieses Recht steht den Gläubigern jedoch nur zu, wenn sie glaubhaft machen, dass durch die Verschmelzung die Erfüllung ihrer Forderung gefährdet wird. Das Recht, Sicherheitsleistung zu verlangen, steht Gläubigern nicht zu, die im Falle der Insolvenz ein Recht auf vorzugsweise Befriedigung aus einer Deckungsmasse haben, die nach gesetzlicher Vorschrift zu ihrem Schutz errichtet und staatlich überwacht ist."
    },
    {
      "date": "2024-12-09",
      "id": "95757",
      "original_text": "Registerbekanntmachung nach dem Umwandlungsgesetz\nBerlin Amtsgericht Berlin (Charlottenburg) HRB 113818\nKWV 5. Wohnungsgesellschaft Ost-Berlin mbH – Berlin",
      "type": "Registerbekanntmachung nach dem Umwandlungsgesetz",
      "state": "Berlin",
      "amtsgericht": "Amtsgericht Berlin (Charlottenburg)",
      "registernummer": "HRB 113818",
      "registerart": "HRB",
      "company_name": "KWV 5. Wohnungsgesellschaft Ost-Berlin mbH",
      "company_seat": "Berlin",
      "details": "09.12.2024 (Bekanntmachungsdatum)\n\nBerlin Amtsgericht Berlin (Charlottenburg) HRB 113818\nRegisterbekanntmachung nach dem Umwandlungsgesetz 06.12.2024 (Eintragungsdatum)\n\nKWV 5. Wohnungsgesellschaft Ost-Berlin mbH\nGesellschaft mit beschränkter Haftung\nBerlin\n\nZu Eintragungsnummer 9 vom 06.12.2024 wird als nicht eingetragen veröffentlicht: Den Gläubigern der an der Verschmelzung beteiligten Rechtsträger ist, wenn sie binnen sechs Monaten nach dem Tag, an dem die Eintragung der Verschmelzung in das Register des Sitzes desjenigen Rechtsträgers, dessen Gläubiger sie sind, als bekannt gemacht gilt, ihren Anspruch nach Grund und Höhe schriftlich anmelden, Sicherheit zu leisten, soweit sie nicht Befriedigung verlangen können. Dieses Recht steht den Gläubigern jedoch nur zu, wenn sie glaubhaft machen, dass durch die Verschmelzung die Erfüllung ihrer Forderung gefährdet wird. Das Recht, Sicherheitsleistung zu verlangen, steht Gläubigern nicht zu, die im Falle der Insolvenz ein Recht auf vorzugsweise Befriedigung aus einer Deckungsmasse haben, die nach gesetzlicher Vorschrift zu ihrem Schutz errichtet und staatlich überwacht ist."
    },
    {
      "date": "2024-12-09",
      "id": "95758",
      "original_text": "Registerbekanntmachung nach dem Umwandlungsgesetz\nBerlin Amtsgericht Berlin (Charlottenburg) HRB 163572\nIDEAL Berlin Liegenschaften AG – Berlin",
      "type": "Registerbekanntmachung nach dem Umwandlungsgesetz",
      "state": "Berlin",
      "amtsgericht": "Amtsgericht Berlin (Charlottenburg)",
      "registernummer": "HRB 163572",
      "registerart": "HRB",
      "company_name": "IDEAL Berlin Liegenschaften AG",
      "company_seat": "Berlin",
      "details": "09.12.2024 (Bekanntmachungsdatum)\n\nBerlin Amtsgericht Berlin (Charlottenburg) HRB 163572\nRegisterbekanntmachung nach dem Umwandlungsgesetz 06.12.2024 (Eintragungsdatum)\n\nIDEAL Berlin Liegenschaften AG\nAktiengesellschaft\nBerlin\n\nZu Eintragungsnummer 10 vom 06.12.2024 wird als nicht eingetragen veröffentlicht: Den Gläubigern der an der Verschmelzung beteiligten Rechtsträger ist, wenn sie binnen sechs Monaten nach dem Tag, an dem die Eintragung der Verschmelzung in das Register des Sitzes desjenigen Rechtsträgers, dessen Gläubiger sie sind, als bekannt gemacht gilt, ihren Anspruch nach Grund und Höhe schriftlich anmelden, Sicherheit zu leisten, soweit sie nicht Befriedigung verlangen können. Dieses Recht steht den Gläubigern jedoch nur zu, wenn sie glaubhaft machen, dass durch die Verschmelzung die Erfüllung ihrer Forderung gefährdet wird. Das Recht, Sicherheitsleistung zu verlangen, steht Gläubigern nicht zu, die im Falle der Insolvenz ein Recht auf vorzugsweise Befriedigung aus einer Deckungsmasse haben, die nach gesetzlicher Vorschrift zu ihrem Schutz errichtet und staatlich überwacht ist."
    },
    {
      "date": "2024-12-09",
      "id": "95759",
      "original_text": "Registerbekanntmachung nach dem Umwandlungsgesetz\nBerlin Amtsgericht Berlin (Charlottenburg) HRB 161936\nAreal Invest IV. Grundstücksgesellschaft mbH – Berlin",
      "type": "Registerbekanntmachung nach dem Umwandlungsgesetz",
      "state": "Berlin",
      "amtsgericht": "Amtsgericht Berlin (Charlottenburg)",
      "registernummer": "HRB 161936",
      "registerart": "HRB",
      "company_name": "Areal Invest IV. Grundstücksgesellschaft mbH",
      "company_seat": "Berlin",
      "details": "09.12.2024 (Bekanntmachungsdatum)\n\nBerlin Amtsgericht Berlin (Charlottenburg) HRB 161936\nRegisterbekanntmachung nach dem Umwandlungsgesetz 07.12.2024 (Eintragungsdatum)\n\nAreal Invest IV. Grundstücksgesellschaft mbH\nGesellschaft mit beschränkter Haftung\nBerlin\n\nZu Eintragungsnummer 6 vom 07.12.2024 wird als nicht eingetragen veröffentlicht:\n\nDen Gläubigern ist, wenn sie binnen sechs Monaten nach dem Tag, an dem die Eintragung der Umwandlung als bekannt gemacht gilt, ihren Anspruch nach Grund und Höhe schriftlich anmelden, Sicherheit zu leisten, soweit sie nicht Befriedigung verlangen können. Dieses Recht steht den Gläubigern jedoch nur zu, wenn sie glaubhaft machen, dass durch die Umwandlung die Erfüllung ihrer Forderung gefährdet wird. Das Recht, Sicherheitsleistung zu verlangen, steht Gläubigern nicht zu, die im Falle der Insolvenz ein Recht auf vorzugsweise Befriedigung aus einer Deckungsmasse haben, die nach gesetzlicher Vorschrift zu ihrem Schutz errichtet und staatlich überwacht ist."
    },
    {
      "date": "2024-12-09",
      "id": "95760",
      "original_text": "Einreichung neuer Dokumente\nBaden-Württemberg Amtsgericht Ulm HRB 631524\nABK - Abfallwirtschaftsgesellschaft der Landkreise Bodenseekreis und Konstanz mbH – Friedrichshafen",
      "type": "Einreichung neuer Dokumente",
      "state": "Baden-Württemberg",
      "amtsgericht": "Amtsgericht Ulm",
      "registernummer": "HRB 631524",
      "registerart": "HRB",
      "company_name": "ABK - Abfallwirtschaftsgesellschaft der Landkreise Bodenseekreis und Konstanz mbH",
      "company_seat": "Friedrichshafen",
      "details": "09.12.2024 (Bekanntmachungsdatum)\n\nBaden-Württemberg Amtsgericht Ulm HRB 631524\nEinreichung neuer Dokumente\n\nABK - Abfallwirtschaftsgesellschaft der Landkreise Bodenseekreis und Konstanz mbH\nGesellschaft mit beschränkter Haftung\nFriedrichshafen\n\nDie Gesellschaft hat am 09.12.2024 die Liste über die Zusammensetzung des Aufsichtsrats zum Handelsregister eingereicht."
    },
    {
      "date": "2024-12-09",
      "id": "95761",
      "original_text": "Registerbekanntmachung nach dem Umwandlungsgesetz\nHamburg Amtsgericht Hamburg HRA 131863\nVALUES BLA 50-52 GmbH & Co. KG – Hamburg",
      "type": "Registerbekanntmachung nach dem Umwandlungsgesetz",
      "state": "Hamburg",
      "amtsgericht": "Amtsgericht Hamburg",
      "registernummer": "HRA 131863",
      "registerart": "HRA",
      "company_name": "VALUES BLA 50-52 GmbH & Co. KG",
      "company_seat": "Hamburg",
      "details": "09.12.2024 (Bekanntmachungsdatum)\n\nHamburg Amtsgericht Hamburg HRA 131863\nRegisterbekanntmachung nach dem Umwandlungsgesetz 09.12.2024 (Eintragungsdatum)\n\nVALUES BLA 50-52 GmbH & Co. KG\nKommanditgesellschaft\nHamburg\n\nAls nicht eingetragen wird bekannt gemacht:\nDen Gläubigern der an der formwechselnden Umwandlung beteiligten Gesellschaften ist, wenn sie binnen sechs Monaten nach dem Tag, an dem die Eintragung der formwechselnden Umwandlung in das Register des Sitzes desjenigen Rechtsträgers, dessen Gläubiger sie sind, nach § 19 Absatz 3 UmwG als bekannt gemacht gilt, ihren Anspruch nach Grund und Höhe schriftlich anmelden, Sicherheit zu leisten, soweit sie nicht Befriedigung verlangen können. Dieses Recht steht den Gläubigern jedoch nur zu, wenn sie glaubhaft machen, dass durch die formwechselnde Umwandlung die Erfüllung ihrer Forderung gefährdet wird."
    },
    {
      "date": "2024-12-09",
      "id": "95762",
      "original_text": "Registerbekanntmachung nach dem Umwandlungsgesetz\nBerlin Amtsgericht Berlin (Charlottenburg) HRA 63680\nUIW Lux West 4 GmbH & Co. KG – Berlin",
      "type": "Registerbekanntmachung nach dem Umwandlungsgesetz",
      "state": "Berlin",
      "amtsgericht": "Amtsgericht Berlin (Charlottenburg)",
      "registernummer": "HRA 63680",
      "registerart": "HRA",
      "company_name": "UIW Lux West 4 GmbH & Co. KG",
      "company_seat": "Berlin",
      "details": "09.12.2024 (Bekanntmachungsdatum)\n\nBerlin Amtsgericht Berlin (Charlottenburg) HRA 63680\nRegisterbekanntmachung nach dem Umwandlungsgesetz 09.12.2024 (Eintragungsdatum)\n\nUIW Lux West 4 GmbH & Co. KG\nKommanditgesellschaft\nBerlin\n\nZu Eintragungsnummer 2 vom 09.12.2024 wird als nicht eingetragen veröffentlicht:\nDen Gläubigern ist, wenn sie binnen sechs Monaten nach dem Tag, an dem die Eintragung der Umwandlung als bekannt gemacht gilt, ihren Anspruch nach Grund und Höhe schriftlich anmelden, Sicherheit zu leisten, soweit sie nicht Befriedigung verlangen können. Dieses Recht steht den Gläubigern jedoch nur zu, wenn sie glaubhaft machen, dass durch die Umwandlung die Erfüllung ihrer Forderung gefährdet wird. Das Recht, Sicherheitsleistung zu verlangen, steht Gläubigern nicht zu, die im Falle der Insolvenz ein Recht auf vorzugsweise Befriedigung aus einer Deckungsmasse haben, die nach gesetzlicher Vorschrift zu ihrem Schutz errichtet und staatlich überwacht ist."
    },
    {
      "date": "2024-12-09",
      "id": "95763",
      "original_text": "Registerbekanntmachung nach dem Umwandlungsgesetz\nHamburg Amtsgericht Hamburg HRB 168164\nVALUES BLA 50-52 GmbH – Hamburg",
      "type": "Registerbekanntmachung nach dem Umwandlungsgesetz",
      "state": "Hamburg",
      "amtsgericht": "Amtsgericht Hamburg",
      "registernummer": "HRB 168164",
      "registerart": "HRB",
      "company_name": "VALUES BLA 50-52 GmbH",
      "company_seat": "Hamburg",
      "details": "09.12.2024 (Bekanntmachungsdatum)\n\nHamburg Amtsgericht Hamburg HRB 168164\nRegisterbekanntmachung nach dem Umwandlungsgesetz 09.12.2024 (Eintragungsdatum)\n\nVALUES BLA 50-52 GmbH\nGesellschaft mit beschränkter Haftung\nHamburg\n\nAls nicht eingetragen wird bekannt gemacht:\nDen Gläubigern der an der formwechselnden Umwandlung beteiligten Gesellschaften ist, wenn sie binnen sechs Monaten nach dem Tag, an dem die Eintragung der formwechselnden Umwandlung in das Register des Sitzes desjenigen Rechtsträgers, dessen Gläubiger sie sind, nach § 19 Absatz 3 UmwG als bekannt gemacht gilt, ihren Anspruch nach Grund und Höhe schriftlich anmelden, Sicherheit zu leisten, soweit sie nicht Befriedigung verlangen können. Dieses Recht steht den Gläubigern jedoch nur zu, wenn sie glaubhaft machen, dass durch die formwechselnde Umwandlung die Erfüllung ihrer Forderung gefährdet wird."
    },
    {
      "date": "2024-12-09",
      "id": "95764",
      "original_text": "Löschungsankündigung\nBrandenburg Amtsgericht Potsdam HRB 38343\nMeda Bau UG (haftungsbeschränkt) – Teltow",
      "type": "Löschungsankündigung",
      "state": "Brandenburg",
      "amtsgericht": "Amtsgericht Potsdam",
      "registernummer": "HRB 38343",
      "registerart": "HRB",
      "company_name": "Meda Bau UG (haftungsbeschränkt)",
      "company_seat": "Teltow",
      "details": "09.12.2024 (Bekanntmachungsdatum)\n\nBrandenburg Amtsgericht Potsdam HRB 38343\nLöschungsankündigung\n\nMeda Bau UG (haftungsbeschränkt)\nGesellschaft mit beschränkter Haftung\nTeltow\n\nBei der nachstehenden Gesellschaft wird das Amtslöschungsverfahren gemäß § 394 FamFG eingeleitet. Widerspruchsfrist: 8 Wochen."
    },
    {
      "date": "2024-12-09",
      "id": "95765",
      "original_text": "Löschungsankündigung\nNordrhein-Westfalen Amtsgericht Coesfeld HRB 20999\nPastravanu Klinkerbau UG (haftungsbeschränkt) – Gronau",
      "type": "Löschungsankündigung",
      "state": "Nordrhein-Westfalen",
      "amtsgericht": "Amtsgericht Coesfeld",
      "registernummer": "HRB 20999",
      "registerart": "HRB",
      "company_name": "Pastravanu Klinkerbau UG (haftungsbeschränkt)",
      "company_seat": "Gronau",
      "details": "09.12.2024 (Bekanntmachungsdatum)\n\nNordrhein-Westfalen Amtsgericht Coesfeld HRB 20999\nLöschungsankündigung\n\nPastravanu Klinkerbau UG (haftungsbeschränkt)\nGesellschaft mit beschränkter Haftung\nGronau\n\nDas Registergericht beabsichtigt, den Rechtsträger wegen Vermögenslosigkeit gemäß § 394 FamFG von Amts wegen zu löschen.\n\nGegen diese Verfügung kann Widerspruch eingelegt werden. Die Frist zur Erhebung eines Widerspruchs gegen die beabsichtigte Löschung ist auf einen Monat ab Veröffentlichung festgesetzt."
    },
    {
      "date": "2024-12-09",
      "id": "95766",
      "original_text": "Registerbekanntmachung nach dem Umwandlungsgesetz\nSchleswig-Holstein Amtsgericht Pinneberg HRB 16972\nNutracorp Verwaltungs GmbH – Elmshorn",
      "type": "Registerbekanntmachung nach dem Umwandlungsgesetz",
      "state": "Schleswig-Holstein",
      "amtsgericht": "Amtsgericht Pinneberg",
      "registernummer": "HRB 16972",
      "registerart": "HRB",
      "company_name": "Nutracorp Verwaltungs GmbH",
      "company_seat": "Elmshorn",
      "details": "09.12.2024 (Bekanntmachungsdatum)\n\nSchleswig-Holstein Amtsgericht Pinneberg HRB 16972\nRegisterbekanntmachung nach dem Umwandlungsgesetz 09.12.2024 (Eintragungsdatum)\n\nNutracorp Verwaltungs GmbH\nGesellschaft mit beschränkter Haftung\nElmshorn\n\nZu Eintragungsnummer 6 vom 09.12.2024 wird als nicht eingetragen veröffentlicht:  Als nicht eingetragen wird veröffentlicht: Den Gläubigern der an der Verschmelzung beteiligten Rechtsträger ist, wenn sie binnen sechs Monaten nach dem Tag, an dem die Eintragung der Verschmelzung in das Register des Sitzes desjenigen Rechtsträgers, dessen Gläubiger sie sind, als bekannt gemacht gilt, ihren Anspruch nach Grund und Höhe schriftlich anmelden, Sicherheit zu leisten, soweit sie nicht Befriedigung verlangen können. Dieses Recht steht den Gläubigern jedoch nur zu, wenn sie glaubhaft machen, dass durch die Verschmelzung die Erfüllung ihrer Forderung gefährdet wird. Das Recht, Sicherheitsleistung zu verlangen, steht Gläubigern nicht zu, die im Falle der Insolvenz ein Recht auf vorzugsweise Befriedigung aus einer Deckungsmasse haben, die nach gesetzlicher Vorschrift zu ihrem Schutz errichtet und staatlich überwacht ist."
    },
    {
      "date": "2024-12-09",
      "id": "95767",
      "original_text": "Sonstige Registerbekanntmachung\nSachsen-Anhalt Amtsgericht Stendal HRB 106529\nSiepert Automobile GmbH – Schönebeck",
      "type": "Sonstige Registerbekanntmachung",
      "state": "Sachsen-Anhalt",
      "amtsgericht": "Amtsgericht Stendal",
      "registernummer": "HRB 106529",
      "registerart": "HRB",
      "company_name": "Siepert Automobile GmbH",
      "company_seat": "Schönebeck",
      "details": "09.12.2024 (Bekanntmachungsdatum)\n\nSachsen-Anhalt Amtsgericht Stendal HRB 106529\nSonstige Registerbekanntmachung\n\nSiepert Automobile GmbH\nGesellschaft mit beschränkter Haftung\nSchönebeck\n\nhinsichtlich o.g. Gesellschaft ist beabsichtigt, Herrn Ralf Adam, dienstansässig Lindenstraße 15, 06749 Bitterfeld-Wolfen zum Nachtragsliquidator zu bestellen.\nDie Frist zu Einreichung etwaiger Stellungnahmen bzw. Erhebung eines Widerspruchs beim Amtsgericht Stendal wird auf 1 Monat festgesetzt."
    },
    {
      "date": "2024-12-09",
      "id": "95768",
      "original_text": "Registerbekanntmachung nach dem Umwandlungsgesetz\nBaden-Württemberg Amtsgericht Ulm HRB 749017\nMaler Bandel GmbH – Westhausen",
      "type": "Registerbekanntmachung nach dem Umwandlungsgesetz",
      "state": "Baden-Württemberg",
      "amtsgericht": "Amtsgericht Ulm",
      "registernummer": "HRB 749017",
      "registerart": "HRB",
      "company_name": "Maler Bandel GmbH",
      "company_seat": "Westhausen",
      "details": "09.12.2024 (Bekanntmachungsdatum)\n\nBaden-Württemberg Amtsgericht Ulm HRB 749017\nRegisterbekanntmachung nach dem Umwandlungsgesetz 09.12.2024 (Eintragungsdatum)\n\nMaler Bandel GmbH\nGesellschaft mit beschränkter Haftung\nWesthausen\n\nAls nicht eingetragen wird bekanntgemacht:\nDen Gläubigern der an der Ausgliederung beteiligten Rechtsträger ist, wenn sie binnen sechs Monaten nach dem Tag, an dem die Eintragung der Ausgliederung in das Register des Sitzes desjenigen Rechtsträgers, dessen Gläubiger sie sind, nach § 19 Abs. 3 UmwG als bekanntgemacht gilt, ihren Anspruch nach Grund und Höhe schriftlich anmelden, Sicherheit zu leisten, soweit sie nicht Befriedigung verlangen können. Dieses Recht steht den Gläubigern jedoch nur zu, wenn sie glaubhaft machen, dass durch die Ausgliederung die Erfüllung ihrer Forderung gefährdet wird."
    },
    {
      "date": "2024-12-09",
      "id": "95769",
      "original_text": "Löschungsankündigung\nSchleswig-Holstein Amtsgericht Lübeck HRB 23208\nLike Cleaning UG (haftungsbeschränkt) – Neustadt in Holstein",
      "type": "Löschungsankündigung",
      "state": "Schleswig-Holstein",
      "amtsgericht": "Amtsgericht Lübeck",
      "registernummer": "HRB 23208",
      "registerart": "HRB",
      "company_name": "Like Cleaning UG (haftungsbeschränkt)",
      "company_seat": "Neustadt in Holstein",
      "details": "09.12.2024 (Bekanntmachungsdatum)\n\nSchleswig-Holstein Amtsgericht Lübeck HRB 23208\nLöschungsankündigung\n\nLike Cleaning UG (haftungsbeschränkt)\nGesellschaft mit beschränkter Haftung\nNeustadt in Holstein\n\nEs ist die Löschung der nachstehenden Gesellschaft wegen Vermögenslosigkeit gemäß § 394 FamFG beabsichtigt.\nIn der Handelsregistersache Like Cleaning UG (haftungsbeschränkt) ergeben sich aus den vorliegenden Unterlagen Anhaltspunkte dafür, dass die Gesellschaft vermögenslos ist: - Antrag der VIACTIV Krankenkasse vom 15.11.2024 auf Löschung der Gesellschaft von Amts wegen aufgrund Vermögenslosigkeit. Daher ist beabsichtigt, die Gesellschaft wegen Vermögenslosigkeit gemäß § 394 FamFG zu löschen. Es wird eine Frist von einem Monat bestimmt zur Geltendmachung eines Widerspruchs gegen die Löschung, § 394 Abs. 2 S. 1 FamFG. Weiter wird gebeten, binnen derselben Frist mitzuteilen, ob die genannte Gesellschaft noch Vermögen hat, ggf. welche Vermögensgegenstände sie besitzt, ob die Gesellschaft noch Partei eines noch nicht rechtskräftig abgeschlossenen Rechtsstreits ist oder ob sonst noch eine Abwicklung stattfindet.\nNach Fristablauf ohne Widerspruch wird die Gesellschaft gelöscht."
    },
    {
      "date": "2024-12-09",
      "id": "95770",
      "original_text": "Registerbekanntmachung nach dem Umwandlungsgesetz\nBaden-Württemberg Amtsgericht Ulm HRA 729251\nMaler Bandel e.K. – Westhausen",
      "type": "Registerbekanntmachung nach dem Umwandlungsgesetz",
      "state": "Baden-Württemberg",
      "amtsgericht": "Amtsgericht Ulm",
      "registernummer": "HRA 729251",
      "registerart": "HRA",
      "company_name": "Maler Bandel e.K.",
      "company_seat": "Westhausen",
      "details": "09.12.2024 (Bekanntmachungsdatum)\n\nBaden-Württemberg Amtsgericht Ulm HRA 729251\nRegisterbekanntmachung nach dem Umwandlungsgesetz 09.12.2024 (Eintragungsdatum)\n\nMaler Bandel e.K.\nEinzelkaufmann / Einzelkauffrau\nWesthausen\n\nAls nicht eingetragen wird bekanntgemacht:\nDen Gläubigern der an der Ausgliederung beteiligten Rechtsträger ist, wenn sie binnen sechs Monaten nach dem Tag, an dem die Eintragung der Ausgliederung in das Register des Sitzes desjenigen Rechtsträgers, dessen Gläubiger sie sind, nach § 19 Abs. 3 UmwG als bekanntgemacht gilt, ihren Anspruch nach Grund und Höhe schriftlich anmelden, Sicherheit zu leisten, soweit sie nicht Befriedigung verlangen können. Dieses Recht steht den Gläubigern jedoch nur zu, wenn sie glaubhaft machen, dass durch die Ausgliederung die Erfüllung ihrer Forderung gefährdet wird."
    },
    {
      "date": "2024-12-09",
      "id": "95771",
      "original_text": "Einreichung neuer Dokumente\nBrandenburg Amtsgericht Potsdam HRB 6373\nZossener Wohnungsbaugesellschaft mit beschränkter Haftung – Zossen",
      "type": "Einreichung neuer Dokumente",
      "state": "Brandenburg",
      "amtsgericht": "Amtsgericht Potsdam",
      "registernummer": "HRB 6373",
      "registerart": "HRB",
      "company_name": "Zossener Wohnungsbaugesellschaft mit beschränkter Haftung",
      "company_seat": "Zossen",
      "details": "09.12.2024 (Bekanntmachungsdatum)\n\nBrandenburg Amtsgericht Potsdam HRB 6373\nEinreichung neuer Dokumente\n\nZossener Wohnungsbaugesellschaft mit beschränkter Haftung\nGesellschaft mit beschränkter Haftung\nZossen\n\nAls nicht eingetragen wird veröffentlicht:  Eine Liste der Mitglieder des Aufsichtsrates wurde zum Handelsregister eingereicht."
    },
    {
      "date": "2024-12-09",
      "id": "95772",
      "original_text": "Registerbekanntmachung nach dem Umwandlungsgesetz\nSchleswig-Holstein Amtsgericht Kiel HRB 7563\naviditas GmbH – Molfsee",
      "type": "Registerbekanntmachung nach dem Umwandlungsgesetz",
      "state": "Schleswig-Holstein",
      "amtsgericht": "Amtsgericht Kiel",
      "registernummer": "HRB 7563",
      "registerart": "HRB",
      "company_name": "aviditas GmbH",
      "company_seat": "Molfsee",
      "details": "09.12.2024 (Bekanntmachungsdatum)\n\nSchleswig-Holstein Amtsgericht Kiel HRB 7563\nRegisterbekanntmachung nach dem Umwandlungsgesetz 06.12.2024 (Eintragungsdatum)\n\naviditas GmbH\nGesellschaft mit beschränkter Haftung\nMolfsee\n\nZu Eintragungsnummer 5 vom 06.12.2024 wird als nicht eingetragen veröffentlicht: Den Gläubigern der an der Verschmelzung beteiligten Rechtsträger ist, wenn sie binnen sechs Monaten nach dem Tag, an dem die Eintragung der Verschmelzung in das Register des Sitzes desjenigen Rechtsträgers, dessen Gläubiger sie sind, nach § 19 Abs. 3 UmwG bekannt gemacht worden ist, ihren Anspruch nach Grund und Höhe schriftlich anmelden, Sicherheit zu leisten, soweit sie nicht Befriedigung verlangen können. Dieses Recht steht den Gläubigern jedoch nur zu, wenn sie glaubhaft machen, dass durch die Verschmelzung die Erfüllung ihrer Forderung gefährdet wird."
    },
    {
      "date": "2024-12-09",
      "id": "95773",
      "original_text": "Einreichung neuer Dokumente\nMecklenburg-Vorpommern Amtsgericht Neubrandenburg HRB 6326\nneu-itec GmbH – Neubrandenburg",
      "type": "Einreichung neuer Dokumente",
      "state": "Mecklenburg-Vorpommern",
      "amtsgericht": "Amtsgericht Neubrandenburg",
      "registernummer": "HRB 6326",
      "registerart": "HRB",
      "company_name": "neu-itec GmbH",
      "company_seat": "Neubrandenburg",
      "details": "09.12.2024 (Bekanntmachungsdatum)\n\nMecklenburg-Vorpommern Amtsgericht Neubrandenburg HRB 6326\nEinreichung neuer Dokumente 09.12.2024 (Eintragungsdatum)\n\nneu-itec GmbH\nGesellschaft mit beschränkter Haftung\nNeubrandenburg\n\nEine Liste der Mitglieder des Aufsichtsrats ist zum Handelsregister eingereicht worden."
    },
    {
      "date": "2024-12-09",
      "id": "95774",
      "original_text": "Löschungsankündigung\nSchleswig-Holstein Amtsgericht Kiel HRA 9355\nP & T Beteiligungs GmbH & Co. KG – Neumünster",
      "type": "Löschungsankündigung",
      "state": "Schleswig-Holstein",
      "amtsgericht": "Amtsgericht Kiel",
      "registernummer": "HRA 9355",
      "registerart": "HRA",
      "company_name": "P & T Beteiligungs GmbH & Co. KG",
      "company_seat": "Neumünster",
      "details": "09.12.2024 (Bekanntmachungsdatum)\n\nSchleswig-Holstein Amtsgericht Kiel HRA 9355\nLöschungsankündigung\n\nP & T Beteiligungs GmbH & Co. KG\nKommanditgesellschaft\nNeumünster\n\nBei der nachstehenden Firma wird das Amtslöschungsverfahren gemäß § 31 Abs. 2 HGB eingeleitet. Widerspruchsfrist: 2 Monate."
    },
    {
      "date": "2024-12-09",
      "id": "95775",
      "original_text": "Löschungsankündigung\nBerlin Amtsgericht Berlin (Charlottenburg) HRB 187688\nMedical Rescue Service Berlin GmbH – Berlin",
      "type": "Löschungsankündigung",
      "state": "Berlin",
      "amtsgericht": "Amtsgericht Berlin (Charlottenburg)",
      "registernummer": "HRB 187688",
      "registerart": "HRB",
      "company_name": "Medical Rescue Service Berlin GmbH",
      "company_seat": "Berlin",
      "details": "09.12.2024 (Bekanntmachungsdatum)\n\nBerlin Amtsgericht Berlin (Charlottenburg) HRB 187688\nLöschungsankündigung\n\nMedical Rescue Service Berlin GmbH\nGesellschaft mit beschränkter Haftung\nBerlin\n\nBei der nachstehenden Gesellschaft wird das Amtslöschungsverfahren gemäß § 394 FamFG eingeleitet. Widerspruchsfrist 6 Wochen"
    },
    {
      "date": "2024-12-09",
      "id": "95776",
      "original_text": "Einreichung neuer Dokumente\nBrandenburg Amtsgericht Potsdam HRB 2807\nTechnische Werke Brandenburg an der Havel GmbH – Brandenburg an der Havel",
      "type": "Einreichung neuer Dokumente",
      "state": "Brandenburg",
      "amtsgericht": "Amtsgericht Potsdam",
      "registernummer": "HRB 2807",
      "registerart": "HRB",
      "company_name": "Technische Werke Brandenburg an der Havel GmbH",
      "company_seat": "Brandenburg an der Havel",
      "details": "09.12.2024 (Bekanntmachungsdatum)\n\nBrandenburg Amtsgericht Potsdam HRB 2807\nEinreichung neuer Dokumente\n\nTechnische Werke Brandenburg an der Havel GmbH\nGesellschaft mit beschränkter Haftung\nBrandenburg an der Havel\n\nAls nicht eingetragen wird veröffentlicht:\nEine Liste der Mitglieder des Aufsichtsrates wurde zum Handelsregister eingereicht."
    },
    {
      "date": "2024-12-09",
      "id": "95777",
      "original_text": "Einreichung neuer Dokumente\nSachsen Amtsgericht Dresden HRB 23515\nKultur- und Weiterbildungsgesellschaft mbH – Löbau",
      "type": "Einreichung neuer Dokumente",
      "state": "Sachsen",
      "amtsgericht": "Amtsgericht Dresden",
      "registernummer": "HRB 23515",
      "registerart": "HRB",
      "company_name": "Kultur- und Weiterbildungsgesellschaft mbH",
      "company_seat": "Löbau",
      "details": "09.12.2024 (Bekanntmachungsdatum)\n\nSachsen Amtsgericht Dresden HRB 23515\nEinreichung neuer Dokumente\n\nKultur- und Weiterbildungsgesellschaft mbH\nGesellschaft mit beschränkter Haftung\nLöbau\n\nAm 05.12.2024 wurde beim Handelsregister des Amtsgerichts Dresden die Liste der Mitglieder des Aufsichtsrats gemäß § 52 GmbHG eingereicht."
    },
    {
      "date": "2024-12-09",
      "id": "95778",
      "original_text": "Registerbekanntmachung nach dem Umwandlungsgesetz\nSachsen Amtsgericht Dresden HRB 30249\nPA Beteiligungs GmbH – Dresden",
      "type": "Registerbekanntmachung nach dem Umwandlungsgesetz",
      "state": "Sachsen",
      "amtsgericht": "Amtsgericht Dresden",
      "registernummer": "HRB 30249",
      "registerart": "HRB",
      "company_name": "PA Beteiligungs GmbH",
      "company_seat": "Dresden",
      "details": "09.12.2024 (Bekanntmachungsdatum)\n\nSachsen Amtsgericht Dresden HRB 30249\nRegisterbekanntmachung nach dem Umwandlungsgesetz 09.12.2024 (Eintragungsdatum)\n\nPA Beteiligungs GmbH\nGesellschaft mit beschränkter Haftung\nDresden\n\nDen Gläubigern der an der Verschmelzung beteiligten Rechtsträger ist, wenn sie binnen sechs Monaten nach dem Tag, an dem die Eintragung der Verschmelzung in das Register des Sitzes desjenigen Rechtsträgers, dessen Gläubiger sie sind, nach § 19 Abs. 3 UmwG als bekannt gemacht gilt, ihren Anspruch nach Grund und Höhe schriftlich anmelden, Sicherheit zu leisten, soweit sie nicht Befriedigung verlangen können. Dieses Recht steht den Gläubigern jedoch nur zu, wenn sie glaubhaft machen, dass durch die Verschmelzung die Erfüllung der Forderung gefährdet wird."
    },
    {
      "date": "2024-12-09",
      "id": "95779",
      "original_text": "Registerbekanntmachung nach dem Umwandlungsgesetz\nSachsen Amtsgericht Dresden HRB 30478\nWI Beteiligungs GmbH – Dresden",
      "type": "Registerbekanntmachung nach dem Umwandlungsgesetz",
      "state": "Sachsen",
      "amtsgericht": "Amtsgericht Dresden",
      "registernummer": "HRB 30478",
      "registerart": "HRB",
      "company_name": "WI Beteiligungs GmbH",
      "company_seat": "Dresden",
      "details": "09.12.2024 (Bekanntmachungsdatum)\n\nSachsen Amtsgericht Dresden HRB 30478\nRegisterbekanntmachung nach dem Umwandlungsgesetz\n\nWI Beteiligungs GmbH\nGesellschaft mit beschränkter Haftung\nDresden\n\nDen Gläubigern der an der #DV.Auswahl(Text=\"Betreffende Alternative auswählen\",Eingabe=\"Verschmelzung beteiligten Rechtsträger ist, wenn sie binnen sechs Monaten nach dem Tag, an dem die Eintragung der Verschmelzung in das Register des Sitzes desjenigen Rechtsträgers, dessen Gläubiger sie sind, nach § 19 Abs. 3 UmwG als bekannt gemacht gilt, ihren Anspruch nach Grund und Höhe schriftlich anmelden, Sicherheit zu leisten, soweit sie nicht Befriedigung verlangen können. Dieses Recht steht den Gläubigern jedoch nur zu, wenn sie glaubhaft machen, dass durch die Verschmelzung die Erfüllung der Forderung gefährdet wird.\"|\"Verschmelzung\",\"Spaltung beteiligten Rechtsträger ist, wenn sie binnen sechs Monaten nach dem Tag, an dem die Eintragung der Spaltung in das Register des Sitzes desjenigen Rechtsträgers, dessen Gläubiger sie sind, nach § 19 Abs. 3 UmwG als bekannt gemacht gilt, ihren Anspruch nach Grund und Höhe schriftlich anmelden, Sicherheit zu leisten, soweit sie nicht Befriedigung verlangen können. Dieses Recht steht den Gläubigern jedoch nur zu, wenn sie glaubhaft machen, dass durch die Spaltung die Erfüllung der Forderung gefährdet wird.\"|\"Spaltung\",\"Umwandlung beteiligten Rechtsträger ist, wenn sie binnen sechs Monaten nach dem Tag, an dem die Eintragung der Umwandlung  in das Register des Sitzes desjenigen Rechtsträgers, dessen Gläubiger sie sind, nach § 19 Abs. 3 UmwG als bekannt gemacht gilt, ihren Anspruch nach Grund und Höhe schriftlich anmelden, Sicherheit zu leisten, soweit sie nicht Befriedigung verlangen können. Dieses Recht steht den Gläubigern jedoch nur zu, wenn sie glaubhaft machen, dass durch die Umwandlung die Erfüllung der Forderung gefährdet wird.\"|\"Umwandlung\",\"Ausgliederung beteiligten Rechtsträger ist, wenn sie binnen sechs Monaten nach dem Tag, an dem die Eintragung der Ausgliederung in das Register des Sitzes desjenigen Rechtsträgers, dessen Gläubiger sie sind, nach § 19 Abs. 3 UmwG als bekannt gemacht gilt, ihren Anspruch nach Grund und Höhe schriftlich anmelden, Sicherheit zu leisten, soweit sie nicht Befriedigung verlangen können. Dieses Recht steht den Gläubigern jedoch nur zu, wenn sie glaubhaft machen, dass durch die Ausgliederung die Erfüllung der Forderung gefährdet wird.\"|\"Ausgliederung\")"
    },
    {
      "date": "2024-12-09",
      "id": "95780",
      "original_text": "Registerbekanntmachung nach dem Umwandlungsgesetz\nSachsen Amtsgericht Dresden HRB 38981\nAuto-Holding Dresden Next Mobility GmbH – Dresden",
      "type": "Registerbekanntmachung nach dem Umwandlungsgesetz",
      "state": "Sachsen",
      "amtsgericht": "Amtsgericht Dresden",
      "registernummer": "HRB 38981",
      "registerart": "HRB",
      "company_name": "Auto-Holding Dresden Next Mobility GmbH",
      "company_seat": "Dresden",
      "details": "09.12.2024 (Bekanntmachungsdatum)\n\nSachsen Amtsgericht Dresden HRB 38981\nRegisterbekanntmachung nach dem Umwandlungsgesetz\n\nAuto-Holding Dresden Next Mobility GmbH\nGesellschaft mit beschränkter Haftung\nDresden\n\nDen Gläubigern der an der #DV.Auswahl(Text=\"Betreffende Alternative auswählen\",Eingabe=\"Verschmelzung beteiligten Rechtsträger ist, wenn sie binnen sechs Monaten nach dem Tag, an dem die Eintragung der Verschmelzung in das Register des Sitzes desjenigen Rechtsträgers, dessen Gläubiger sie sind, nach § 19 Abs. 3 UmwG als bekannt gemacht gilt, ihren Anspruch nach Grund und Höhe schriftlich anmelden, Sicherheit zu leisten, soweit sie nicht Befriedigung verlangen können. Dieses Recht steht den Gläubigern jedoch nur zu, wenn sie glaubhaft machen, dass durch die Verschmelzung die Erfüllung der Forderung gefährdet wird.\"|\"Verschmelzung\",\"Spaltung beteiligten Rechtsträger ist, wenn sie binnen sechs Monaten nach dem Tag, an dem die Eintragung der Spaltung in das Register des Sitzes desjenigen Rechtsträgers, dessen Gläubiger sie sind, nach § 19 Abs. 3 UmwG als bekannt gemacht gilt, ihren Anspruch nach Grund und Höhe schriftlich anmelden, Sicherheit zu leisten, soweit sie nicht Befriedigung verlangen können. Dieses Recht steht den Gläubigern jedoch nur zu, wenn sie glaubhaft machen, dass durch die Spaltung die Erfüllung der Forderung gefährdet wird.\"|\"Spaltung\",\"Umwandlung beteiligten Rechtsträger ist, wenn sie binnen sechs Monaten nach dem Tag, an dem die Eintragung der Umwandlung  in das Register des Sitzes desjenigen Rechtsträgers, dessen Gläubiger sie sind, nach § 19 Abs. 3 UmwG als bekannt gemacht gilt, ihren Anspruch nach Grund und Höhe schriftlich anmelden, Sicherheit zu leisten, soweit sie nicht Befriedigung verlangen können. Dieses Recht steht den Gläubigern jedoch nur zu, wenn sie glaubhaft machen, dass durch die Umwandlung die Erfüllung der Forderung gefährdet wird.\"|\"Umwandlung\",\"Ausgliederung beteiligten Rechtsträger ist, wenn sie binnen sechs Monaten nach dem Tag, an dem die Eintragung der Ausgliederung in das Register des Sitzes desjenigen Rechtsträgers, dessen Gläubiger sie sind, nach § 19 Abs. 3 UmwG als bekannt gemacht gilt, ihren Anspruch nach Grund und Höhe schriftlich anmelden, Sicherheit zu leisten, soweit sie nicht Befriedigung verlangen können. Dieses Recht steht den Gläubigern jedoch nur zu, wenn sie glaubhaft machen, dass durch die Ausgliederung die Erfüllung der Forderung gefährdet wird.\"|\"Ausgliederung\")"
    },
    {
      "date": "2024-12-09",
      "id": "95781",
      "original_text": "Einreichung neuer Dokumente\nSachsen Amtsgericht Dresden HRB 23111\nService- und Beteiligungsgesellschaft Pirna mbH – Pirna",
      "type": "Einreichung neuer Dokumente",
      "state": "Sachsen",
      "amtsgericht": "Amtsgericht Dresden",
      "registernummer": "HRB 23111",
      "registerart": "HRB",
      "company_name": "Service- und Beteiligungsgesellschaft Pirna mbH",
      "company_seat": "Pirna",
      "details": "09.12.2024 (Bekanntmachungsdatum)\n\nSachsen Amtsgericht Dresden HRB 23111\nEinreichung neuer Dokumente\n\nService- und Beteiligungsgesellschaft Pirna mbH\nGesellschaft mit beschränkter Haftung\nPirna\n\nAm 06.12.2024 wurde beim Handelsregister des Amtsgerichts Dresden die Liste der Mitglieder des Aufsichtsrats gemäß § 52 GmbHG eingereicht."
    },
    {
      "date": "2024-12-09",
      "id": "95782",
      "original_text": "Registerbekanntmachung nach dem Umwandlungsgesetz\nSachsen Amtsgericht Dresden HRB 7380\nHandelshof Riesa GmbH Partner für Technik – Riesa",
      "type": "Registerbekanntmachung nach dem Umwandlungsgesetz",
      "state": "Sachsen",
      "amtsgericht": "Amtsgericht Dresden",
      "registernummer": "HRB 7380",
      "registerart": "HRB",
      "company_name": "Handelshof Riesa GmbH Partner für Technik",
      "company_seat": "Riesa",
      "details": "09.12.2024 (Bekanntmachungsdatum)\n\nSachsen Amtsgericht Dresden HRB 7380\nRegisterbekanntmachung nach dem Umwandlungsgesetz 09.12.2024 (Eintragungsdatum)\n\nHandelshof Riesa GmbH Partner für Technik\nGesellschaft mit beschränkter Haftung\nRiesa\n\nDen Gläubigern der an der Verschmelzung beteiligten Rechtsträger ist, wenn sie binnen sechs Monaten nach dem Tag, an dem die Eintragung der Verschmelzung in das Register des Sitzes desjenigen Rechtsträgers, dessen Gläubiger sie sind, nach § 19 Abs. 3 UmwG als bekannt gemacht gilt, ihren Anspruch nach Grund und Höhe schriftlich anmelden, Sicherheit zu leisten, soweit sie nicht Befriedigung verlangen können. Dieses Recht steht den Gläubigern jedoch nur zu, wenn sie glaubhaft machen, dass durch die Verschmelzung die Erfüllung der Forderung gefährdet wird."
    },
    {
      "date": "2024-12-09",
      "id": "95783",
      "original_text": "Löschungsankündigung\nSachsen Amtsgericht Dresden HRB 37134\nKRAFTBAU GmbH – Dresden",
      "type": "Löschungsankündigung",
      "state": "Sachsen",
      "amtsgericht": "Amtsgericht Dresden",
      "registernummer": "HRB 37134",
      "registerart": "HRB",
      "company_name": "KRAFTBAU GmbH",
      "company_seat": "Dresden",
      "details": "09.12.2024 (Bekanntmachungsdatum)\n\nSachsen Amtsgericht Dresden HRB 37134\nLöschungsankündigung\n\nKRAFTBAU GmbH\nGesellschaft mit beschränkter Haftung\nDresden\n\nDas Registergericht beabsichtigt, die im Handelsregister eingetragene Gesellschaft von Amts wegen nach § 394 FamFG zu löschen. Die Frist zu Erhebung eines Widerspruchs gegen die beabsichtigte Löschung wird auf einen Monat festgesetzt."
    },
    {
      "date": "2024-12-09",
      "id": "95784",
      "original_text": "Registerbekanntmachung nach dem Umwandlungsgesetz\nSachsen Amtsgericht Dresden HRB 30203\nAHG Komplementär GmbH – Dresden",
      "type": "Registerbekanntmachung nach dem Umwandlungsgesetz",
      "state": "Sachsen",
      "amtsgericht": "Amtsgericht Dresden",
      "registernummer": "HRB 30203",
      "registerart": "HRB",
      "company_name": "AHG Komplementär GmbH",
      "company_seat": "Dresden",
      "details": "09.12.2024 (Bekanntmachungsdatum)\n\nSachsen Amtsgericht Dresden HRB 30203\nRegisterbekanntmachung nach dem Umwandlungsgesetz 09.12.2024 (Eintragungsdatum)\n\nAHG Komplementär GmbH\nGesellschaft mit beschränkter Haftung\nDresden\n\nDen Gläubigern der an der Verschmelzung beteiligten Rechtsträger ist, wenn sie binnen sechs Monaten nach dem Tag, an dem die Eintragung der Verschmelzung in das Register des Sitzes desjenigen Rechtsträgers, dessen Gläubiger sie sind, nach § 19 Abs. 3 UmwG als bekannt gemacht gilt, ihren Anspruch nach Grund und Höhe schriftlich anmelden, Sicherheit zu leisten, soweit sie nicht Befriedigung verlangen können. Dieses Recht steht den Gläubigern jedoch nur zu, wenn sie glaubhaft machen, dass durch die Verschmelzung die Erfüllung der Forderung gefährdet wird."
    },
    {
      "date": "2024-12-09",
      "id": "95785",
      "original_text": "Löschungsankündigung\nSachsen Amtsgericht Dresden HRB 39131\nRB Transport und Handels GmbH – Dresden",
      "type": "Löschungsankündigung",
      "state": "Sachsen",
      "amtsgericht": "Amtsgericht Dresden",
      "registernummer": "HRB 39131",
      "registerart": "HRB",
      "company_name": "RB Transport und Handels GmbH",
      "company_seat": "Dresden",
      "details": "09.12.2024 (Bekanntmachungsdatum)\n\nSachsen Amtsgericht Dresden HRB 39131\nLöschungsankündigung\n\nRB Transport und Handels GmbH\nGesellschaft mit beschränkter Haftung\nDresden\n\nDas Registergericht beabsichtigt, die im Handelsregister eingetragene Gesellschaft von Amts wegen nach § 394 FamFG zu löschen. Die Frist zu Erhebung eines Widerspruchs gegen die beabsichtigte Löschung wird auf einen Monat festgesetzt."
    },
    {
      "date": "2024-12-09",
      "id": "95786",
      "original_text": "Sonstige Registerbekanntmachung\nSachsen Amtsgericht Leipzig VR 4855\nCineart e.V. – Leipzig",
      "type": "Sonstige Registerbekanntmachung",
      "state": "Sachsen",
      "amtsgericht": "Amtsgericht Leipzig",
      "registernummer": "VR 4855",
      "registerart": "VR",
      "company_name": "Cineart e.V.",
      "company_seat": "Leipzig",
      "details": "09.12.2024 (Bekanntmachungsdatum)\n\nSachsen Amtsgericht Leipzig VR 4855\nSonstige Registerbekanntmachung\n\nCineart e.V.\neingetragener Verein\nLeipzig\n\nDas Gericht beabsichtigt, gemäß § 4 Absatz 2 Ziffer 1 der Verordnung über das Vereinsregister das Registerblatt  des Vereins zu schließen, da nach den Ermittlungen des Gerichts sämtliche Mitglieder aus dem Verein ausgeschieden sind. Zur Geltendmachung eines Widerspruchs gegen die beabsichtigte Schließung wird eine Frist von einem Monat nach der Veröffentlichung bestimmt."
    },
    {
      "date": "2024-12-09",
      "id": "95787",
      "original_text": "Registerbekanntmachung nach dem Umwandlungsgesetz\nSachsen Amtsgericht Dresden HRB 8955\nGICON Resources GmbH – Dresden",
      "type": "Registerbekanntmachung nach dem Umwandlungsgesetz",
      "state": "Sachsen",
      "amtsgericht": "Amtsgericht Dresden",
      "registernummer": "HRB 8955",
      "registerart": "HRB",
      "company_name": "GICON Resources GmbH",
      "company_seat": "Dresden",
      "details": "09.12.2024 (Bekanntmachungsdatum)\n\nSachsen Amtsgericht Dresden HRB 8955\nRegisterbekanntmachung nach dem Umwandlungsgesetz 09.12.2024 (Eintragungsdatum)\n\nGICON Resources GmbH\nGesellschaft mit beschränkter Haftung\nDresden\n\nDen Gläubigern der an der Verschmelzung beteiligten Rechtsträger ist, wenn sie binnen sechs Monaten nach dem Tag, an dem die Eintragung der Verschmelzung in das Register des Sitzes desjenigen Rechtsträgers, dessen Gläubiger sie sind, nach § 19 Abs. 3 UmwG als bekannt gemacht gilt, ihren Anspruch nach Grund und Höhe schriftlich anmelden, Sicherheit zu leisten, soweit sie nicht Befriedigung verlangen können. Dieses Recht steht den Gläubigern jedoch nur zu, wenn sie glaubhaft machen, dass durch die Verschmelzung die Erfüllung der Forderung gefährdet wird."
    },
    {
      "date": "2024-12-09",
      "id": "95788",
      "original_text": "Einreichung neuer Dokumente\nSachsen Amtsgericht Chemnitz HRB 34370\nMUGLER SE – Oberlungwitz",
      "type": "Einreichung neuer Dokumente",
      "state": "Sachsen",
      "amtsgericht": "Amtsgericht Chemnitz",
      "registernummer": "HRB 34370",
      "registerart": "HRB",
      "company_name": "MUGLER SE",
      "company_seat": "Oberlungwitz",
      "details": "09.12.2024 (Bekanntmachungsdatum)\n\nSachsen Amtsgericht Chemnitz HRB 34370\nEinreichung neuer Dokumente\n\nMUGLER SE\nEuropäische Aktiengesellschaft (SE)\nOberlungwitz\n\nAm 09.12.2024 wurde beim Handelsregister des Amtsgerichts Chemnitz die Liste der Mitglieder des Aufsichtsrats gemäß § 106 AktG eingereicht."
    },
    {
      "date": "2024-12-09",
      "id": "95789",
      "original_text": "Sonstige Registerbekanntmachung\nSachsen Amtsgericht Leipzig HRB 6993\nLeipziger Verkehrsbetriebe (LVB) Gesellschaft mit beschränkter Haftung – Leipzig",
      "type": "Sonstige Registerbekanntmachung",
      "state": "Sachsen",
      "amtsgericht": "Amtsgericht Leipzig",
      "registernummer": "HRB 6993",
      "registerart": "HRB",
      "company_name": "Leipziger Verkehrsbetriebe (LVB) Gesellschaft mit beschränkter Haftung",
      "company_seat": "Leipzig",
      "details": "09.12.2024 (Bekanntmachungsdatum)\n\nSachsen Amtsgericht Leipzig HRB 6993\nSonstige Registerbekanntmachung\n\nLeipziger Verkehrsbetriebe (LVB) Gesellschaft mit beschränkter Haftung\nGesellschaft mit beschränkter Haftung\nLeipzig\n\nAm 06.12.2024 wurde beim Handelsregister des Amtsgerichts Leipzig die Liste der Mitglieder des Aufsichtsrats gemäß § 52 GmbHG eingereicht."
    },
    {
      "date": "2024-12-09",
      "id": "95790",
      "original_text": "Registerbekanntmachung nach dem Umwandlungsgesetz\nSachsen Amtsgericht Dresden HRB 36092\nStahlservice Riesa GmbH Partner für Technik – Riesa",
      "type": "Registerbekanntmachung nach dem Umwandlungsgesetz",
      "state": "Sachsen",
      "amtsgericht": "Amtsgericht Dresden",
      "registernummer": "HRB 36092",
      "registerart": "HRB",
      "company_name": "Stahlservice Riesa GmbH Partner für Technik",
      "company_seat": "Riesa",
      "details": "09.12.2024 (Bekanntmachungsdatum)\n\nSachsen Amtsgericht Dresden HRB 36092\nRegisterbekanntmachung nach dem Umwandlungsgesetz 09.12.2024 (Eintragungsdatum)\n\nStahlservice Riesa GmbH Partner für Technik\nGesellschaft mit beschränkter Haftung\nRiesa\n\nDen Gläubigern der an der Verschmelzung beteiligten Rechtsträger ist, wenn sie binnen sechs Monaten nach dem Tag, an dem die Eintragung der Verschmelzung in das Register des Sitzes desjenigen Rechtsträgers, dessen Gläubiger sie sind, nach § 19 Abs. 3 UmwG als bekannt gemacht gilt, ihren Anspruch nach Grund und Höhe schriftlich anmelden, Sicherheit zu leisten, soweit sie nicht Befriedigung verlangen können. Dieses Recht steht den Gläubigern jedoch nur zu, wenn sie glaubhaft machen, dass durch die Verschmelzung die Erfüllung der Forderung gefährdet wird."
    },
    {
      "date": "2024-12-09",
      "id": "95791",
      "original_text": "Registerbekanntmachung nach dem Umwandlungsgesetz\nSachsen Amtsgericht Dresden HRB 30208\nAVG Beteiligungs GmbH – Dresden",
      "type": "Registerbekanntmachung nach dem Umwandlungsgesetz",
      "state": "Sachsen",
      "amtsgericht": "Amtsgericht Dresden",
      "registernummer": "HRB 30208",
      "registerart": "HRB",
      "company_name": "AVG Beteiligungs GmbH",
      "company_seat": "Dresden",
      "details": "09.12.2024 (Bekanntmachungsdatum)\n\nSachsen Amtsgericht Dresden HRB 30208\nRegisterbekanntmachung nach dem Umwandlungsgesetz 09.12.2024 (Eintragungsdatum)\n\nAVG Beteiligungs GmbH\nGesellschaft mit beschränkter Haftung\nDresden\n\nDen Gläubigern der an der Verschmelzung beteiligten Rechtsträger ist, wenn sie binnen sechs Monaten nach dem Tag, an dem die Eintragung der Verschmelzung in das Register des Sitzes desjenigen Rechtsträgers, dessen Gläubiger sie sind, nach § 19 Abs. 3 UmwG als bekannt gemacht gilt, ihren Anspruch nach Grund und Höhe schriftlich anmelden, Sicherheit zu leisten, soweit sie nicht Befriedigung verlangen können. Dieses Recht steht den Gläubigern jedoch nur zu, wenn sie glaubhaft machen, dass durch die Verschmelzung die Erfüllung der Forderung gefährdet wird."
    },
    {
      "date": "2024-12-09",
      "id": "95792",
      "original_text": "Löschungsankündigung\nNiedersachsen Amtsgericht Hannover HRA 202201\nFHB Burgwedel KG – Burgwedel",
      "type": "Löschungsankündigung",
      "state": "Niedersachsen",
      "amtsgericht": "Amtsgericht Hannover",
      "registernummer": "HRA 202201",
      "registerart": "HRA",
      "company_name": "FHB Burgwedel KG",
      "company_seat": "Burgwedel",
      "details": "09.12.2024 (Bekanntmachungsdatum)\n\nNiedersachsen Amtsgericht Hannover HRA 202201\nLöschungsankündigung\n\nFHB Burgwedel KG\nKommanditgesellschaft\nBurgwedel\n\nDas Registergericht beabsichtigt, die Firma von Amts wegen nach § 393 FamFG i.V.m. § 31 Abs. 2 HGB zu löschen. Die Frist zur Erhebung eines Widerspruchs ist auf 1 Monat ab dieser Registerbekanntmachung festgesetzt."
    },
    {
      "date": "2024-12-09",
      "id": "95793",
      "original_text": "Löschungsankündigung\nNiedersachsen Amtsgericht Osnabrück HRB 209676\nLauer GmbH – Osnabrück",
      "type": "Löschungsankündigung",
      "state": "Niedersachsen",
      "amtsgericht": "Amtsgericht Osnabrück",
      "registernummer": "HRB 209676",
      "registerart": "HRB",
      "company_name": "Lauer GmbH",
      "company_seat": "Osnabrück",
      "details": "09.12.2024 (Bekanntmachungsdatum)\n\nNiedersachsen Amtsgericht Osnabrück HRB 209676\nLöschungsankündigung\n\nLauer GmbH\nGesellschaft mit beschränkter Haftung\nOsnabrück\n\nDas Registergericht beabsichtigt, die Gesellschaft von Amts wegen nach § 394 FamFG wegen Vermögenslosigkeit zu löschen. Die Frist zur Erhebung eines Widerspruchs ist auf 1 Monat ab dieser Registerbekanntmachung festgesetzt."
    },
    {
      "date": "2024-12-09",
      "id": "95794",
      "original_text": "Einreichung neuer Dokumente\nNiedersachsen Amtsgericht Osnabrück HRB 213357\nKME SE – Osnabrück",
      "type": "Einreichung neuer Dokumente",
      "state": "Niedersachsen",
      "amtsgericht": "Amtsgericht Osnabrück",
      "registernummer": "HRB 213357",
      "registerart": "HRB",
      "company_name": "KME SE",
      "company_seat": "Osnabrück",
      "details": "09.12.2024 (Bekanntmachungsdatum)\n\nNiedersachsen Amtsgericht Osnabrück HRB 213357\nEinreichung neuer Dokumente\n\nKME SE\nEuropäische Aktiengesellschaft (SE)\nOsnabrück\n\nDie Liste der Mitglieder des Aufsichtsrats wurde beim Registergericht eingereicht."
    },
    {
      "date": "2024-12-09",
      "id": "95795",
      "original_text": "Registerbekanntmachung nach dem Umwandlungsgesetz\nNiedersachsen Amtsgericht Walsrode HRB 212383\nFIB Vermögensverwaltungs GmbH – Lilienthal",
      "type": "Registerbekanntmachung nach dem Umwandlungsgesetz",
      "state": "Niedersachsen",
      "amtsgericht": "Amtsgericht Walsrode",
      "registernummer": "HRB 212383",
      "registerart": "HRB",
      "company_name": "FIB Vermögensverwaltungs GmbH",
      "company_seat": "Lilienthal",
      "details": "09.12.2024 (Bekanntmachungsdatum)\n\nNiedersachsen Amtsgericht Walsrode HRB 212383\nRegisterbekanntmachung nach dem Umwandlungsgesetz 09.12.2024 (Eintragungsdatum)\n\nFIB Vermögensverwaltungs GmbH\nGesellschaft mit beschränkter Haftung\nLilienthal\n\nDen Gläubigern der an der formwechselnden Umwandlung beteiligten Rechtsträger ist, wenn sie binnen sechs Monaten nach dem Tag, an dem die Eintragung der Umwandlung in das Register des Sitzes desjenigen Rechtsträgers, dessen Gläubiger sie sind, nach § 19 Abs. 3 UmwG als bekannt gemacht gilt, ihren Anspruch nach Grund und Höhe schriftlich anmelden, Sicherheit zu leisten, soweit sie nicht Befriedigung verlangen können. Dieses Recht steht den Gläubigern jedoch nur zu, wenn sie glaubhaft machen, dass durch die formwechselnde Umwandlung die Erfüllung der Forderung gefährdet wird."
    },
    {
      "date": "2024-12-09",
      "id": "95796",
      "original_text": "Registerbekanntmachung nach dem Umwandlungsgesetz\nNiedersachsen Amtsgericht Walsrode HRB 120211\nC.Heise Hausverwaltungs GmbH – Verden",
      "type": "Registerbekanntmachung nach dem Umwandlungsgesetz",
      "state": "Niedersachsen",
      "amtsgericht": "Amtsgericht Walsrode",
      "registernummer": "HRB 120211",
      "registerart": "HRB",
      "company_name": "C.Heise Hausverwaltungs GmbH",
      "company_seat": "Verden",
      "details": "09.12.2024 (Bekanntmachungsdatum)\n\nNiedersachsen Amtsgericht Walsrode HRB 120211\nRegisterbekanntmachung nach dem Umwandlungsgesetz 09.12.2024 (Eintragungsdatum)\n\nC.Heise Hausverwaltungs GmbH\nGesellschaft mit beschränkter Haftung\nVerden\n\nDen Gläubigern der an der formwechselnden Umwandlung beteiligten Rechtsträger ist, wenn sie binnen sechs Monaten nach dem Tag, an dem die Eintragung der Umwandlung in das Register des Sitzes desjenigen Rechtsträgers, dessen Gläubiger sie sind, nach § 19 Abs. 3 UmwG als bekannt gemacht gilt, ihren Anspruch nach Grund und Höhe schriftlich anmelden, Sicherheit zu leisten, soweit sie nicht Befriedigung verlangen können. Dieses Recht steht den Gläubigern jedoch nur zu, wenn sie glaubhaft machen, dass durch die formwechselnde Umwandlung die Erfüllung der Forderung gefährdet wird."
    },
    {
      "date": "2024-12-09",
      "id": "95797",
      "original_text": "Löschungsankündigung\nNiedersachsen Amtsgericht Aurich HRB 200665\nErste Bulker Verwaltungs GmbH – Leer",
      "type": "Löschungsankündigung",
      "state": "Niedersachsen",
      "amtsgericht": "Amtsgericht Aurich",
      "registernummer": "HRB 200665",
      "registerart": "HRB",
      "company_name": "Erste Bulker Verwaltungs GmbH",
      "company_seat": "Leer",
      "details": "09.12.2024 (Bekanntmachungsdatum)\n\nNiedersachsen Amtsgericht Aurich HRB 200665\nLöschungsankündigung\n\nErste Bulker Verwaltungs GmbH\nGesellschaft mit beschränkter Haftung\nLeer\n\nDas Registergericht beabsichtigt, die Gesellschaft von Amts wegen nach § 394 FamFG zu löschen. Die Frist zur Erhebung eines Widerspruchs ist auf 1 Monat ab dieser Registerbekanntmachung festgesetzt."
    },
    {
      "date": "2024-12-09",
      "id": "95798",
      "original_text": "Registerbekanntmachung nach dem Umwandlungsgesetz\nNiedersachsen Amtsgericht Walsrode HRB 210540\nFIB Vermögensverwaltungsgesellschaft AG – Lilienthal",
      "type": "Registerbekanntmachung nach dem Umwandlungsgesetz",
      "state": "Niedersachsen",
      "amtsgericht": "Amtsgericht Walsrode",
      "registernummer": "HRB 210540",
      "registerart": "HRB",
      "company_name": "FIB Vermögensverwaltungsgesellschaft AG",
      "company_seat": "Lilienthal",
      "details": "09.12.2024 (Bekanntmachungsdatum)\n\nNiedersachsen Amtsgericht Walsrode HRB 210540\nRegisterbekanntmachung nach dem Umwandlungsgesetz 09.12.2024 (Eintragungsdatum)\n\nFIB Vermögensverwaltungsgesellschaft AG\nAktiengesellschaft\nLilienthal\n\nDen Gläubigern der an der formwechselnden Umwandlung beteiligten Rechtsträger ist, wenn sie binnen sechs Monaten nach dem Tag, an dem die Eintragung der Umwandlung in das Register des Sitzes desjenigen Rechtsträgers, dessen Gläubiger sie sind, nach § 19 Abs. 3 UmwG als bekannt gemacht gilt, ihren Anspruch nach Grund und Höhe schriftlich anmelden, Sicherheit zu leisten, soweit sie nicht Befriedigung verlangen können. Dieses Recht steht den Gläubigern jedoch nur zu, wenn sie glaubhaft machen, dass durch die formwechselnde Umwandlung die Erfüllung der Forderung gefährdet wird."
    },
    {
      "date": "2024-12-09",
      "id": "95799",
      "original_text": "Einreichung neuer Dokumente\nBremen Amtsgericht Bremen HRB 3225 BHV\nEUROGATE Container Terminal Bremerhaven GmbH – Bremerhaven",
      "type": "Einreichung neuer Dokumente",
      "state": "Bremen",
      "amtsgericht": "Amtsgericht Bremen",
      "registernummer": "HRB 3225 BHV",
      "registerart": "HRB",
      "company_name": "EUROGATE Container Terminal Bremerhaven GmbH",
      "company_seat": "Bremerhaven",
      "details": "09.12.2024 (Bekanntmachungsdatum)\n\nBremen Amtsgericht Bremen HRB 3225 BHV\nEinreichung neuer Dokumente\n\nEUROGATE Container Terminal Bremerhaven GmbH\nGesellschaft mit beschränkter Haftung\nBremerhaven\n\nAls nicht eingetragen wird bekannt gemacht: Liste des Aufsichtsrats wurde eingereicht."
    },
    {
      "date": "2024-12-09",
      "id": "95800",
      "original_text": "Registerbekanntmachung nach dem Umwandlungsgesetz\nBremen Amtsgericht Bremen HRB 19300\nSkyborn Renewables GmbH – Bremen",
      "type": "Registerbekanntmachung nach dem Umwandlungsgesetz",
      "state": "Bremen",
      "amtsgericht": "Amtsgericht Bremen",
      "registernummer": "HRB 19300",
      "registerart": "HRB",
      "company_name": "Skyborn Renewables GmbH",
      "company_seat": "Bremen",
      "details": "09.12.2024 (Bekanntmachungsdatum)\n\nBremen Amtsgericht Bremen HRB 19300\nRegisterbekanntmachung nach dem Umwandlungsgesetz 05.12.2024 (Eintragungsdatum)\n\nSkyborn Renewables GmbH\nGesellschaft mit beschränkter Haftung\nBremen\n\nZu Eintragungsnummer 20 vom 05.12.2024 wird als nicht eingetragen veröffentlicht: Den Gläubigern der an der Verschmelzung beteiligten Rechtsträger ist, wenn sie binnen sechs Monaten nach dem Tag, an dem die Eintragung der Verschmelzung in das Register des Sitzes desjenigen Rechtsträgers, dessen Gläubiger sie sind, als bekannt gemacht gilt, ihren Anspruch nach Grund und Höhe schriftlich anmelden, Sicherheit zu leisten, soweit sie nicht Befriedigung verlangen können. Dieses Recht steht den Gläubigern jedoch nur zu, wenn sie glaubhaft machen, dass durch die Verschmelzung die Erfüllung ihrer Forderung gefährdet wird. Das Recht, Sicherheitsleistung zu verlangen, steht Gläubigern nicht zu, die im Falle der Insolvenz ein Recht auf vorzugsweise Befriedigung aus einer Deckungsmasse haben, die nach gesetzlicher Vorschrift zu ihrem Schutz errichtet und staatlich überwacht ist."
    },
    {
      "date": "2024-12-09",
      "id": "95801",
      "original_text": "Registerbekanntmachung nach dem Umwandlungsgesetz\nBremen Amtsgericht Bremen HRB 19300\nSkyborn Renewables GmbH – Bremen",
      "type": "Registerbekanntmachung nach dem Umwandlungsgesetz",
      "state": "Bremen",
      "amtsgericht": "Amtsgericht Bremen",
      "registernummer": "HRB 19300",
      "registerart": "HRB",
      "company_name": "Skyborn Renewables GmbH",
      "company_seat": "Bremen",
      "details": "09.12.2024 (Bekanntmachungsdatum)\n\nBremen Amtsgericht Bremen HRB 19300\nRegisterbekanntmachung nach dem Umwandlungsgesetz 05.12.2024 (Eintragungsdatum)\n\nSkyborn Renewables GmbH\nGesellschaft mit beschränkter Haftung\nBremen\n\nZu Eintragungsnummer 21 vom 05.12.2024 wird als nicht eingetragen veröffentlicht: Den Gläubigern der an der Verschmelzung beteiligten Rechtsträger ist, wenn sie binnen sechs Monaten nach dem Tag, an dem die Eintragung der Verschmelzung in das Register des Sitzes desjenigen Rechtsträgers, dessen Gläubiger sie sind, als bekannt gemacht gilt, ihren Anspruch nach Grund und Höhe schriftlich anmelden, Sicherheit zu leisten, soweit sie nicht Befriedigung verlangen können. Dieses Recht steht den Gläubigern jedoch nur zu, wenn sie glaubhaft machen, dass durch die Verschmelzung die Erfüllung ihrer Forderung gefährdet wird. Das Recht, Sicherheitsleistung zu verlangen, steht Gläubigern nicht zu, die im Falle der Insolvenz ein Recht auf vorzugsweise Befriedigung aus einer Deckungsmasse haben, die nach gesetzlicher Vorschrift zu ihrem Schutz errichtet und staatlich überwacht ist."
    },
    {
      "date": "2024-12-09",
      "id": "95802",
      "original_text": "Registerbekanntmachung nach dem Umwandlungsgesetz\nBremen Amtsgericht Bremen HRB 31624\nGuanyin Taoyuan Holding GmbH – Bremen",
      "type": "Registerbekanntmachung nach dem Umwandlungsgesetz",
      "state": "Bremen",
      "amtsgericht": "Amtsgericht Bremen",
      "registernummer": "HRB 31624",
      "registerart": "HRB",
      "company_name": "Guanyin Taoyuan Holding GmbH",
      "company_seat": "Bremen",
      "details": "09.12.2024 (Bekanntmachungsdatum)\n\nBremen Amtsgericht Bremen HRB 31624\nRegisterbekanntmachung nach dem Umwandlungsgesetz 05.12.2024 (Eintragungsdatum)\n\nGuanyin Taoyuan Holding GmbH\nGesellschaft mit beschränkter Haftung\nBremen\n\nZu Eintragungsnummer 5 vom 05.12.2024 wird als nicht eingetragen veröffentlicht: Den Gläubigern der an der Verschmelzung beteiligten Rechtsträger ist, wenn sie binnen sechs Monaten nach dem Tag, an dem die Eintragung der Verschmelzung in das Register des Sitzes desjenigen Rechtsträgers, dessen Gläubiger sie sind, als bekannt gemacht gilt, ihren Anspruch nach Grund und Höhe schriftlich anmelden, Sicherheit zu leisten, soweit sie nicht Befriedigung verlangen können. Dieses Recht steht den Gläubigern jedoch nur zu, wenn sie glaubhaft machen, dass durch die Verschmelzung die Erfüllung ihrer Forderung gefährdet wird. Das Recht, Sicherheitsleistung zu verlangen, steht Gläubigern nicht zu, die im Falle der Insolvenz ein Recht auf vorzugsweise Befriedigung aus einer Deckungsmasse haben, die nach gesetzlicher Vorschrift zu ihrem Schutz errichtet und staatlich überwacht ist."
    },
    {
      "date": "2024-12-09",
      "id": "95803",
      "original_text": "Registerbekanntmachung nach dem Umwandlungsgesetz\nBremen Amtsgericht Bremen HRB 33351\nSkyborn Renewables consulting GmbH – Bremen",
      "type": "Registerbekanntmachung nach dem Umwandlungsgesetz",
      "state": "Bremen",
      "amtsgericht": "Amtsgericht Bremen",
      "registernummer": "HRB 33351",
      "registerart": "HRB",
      "company_name": "Skyborn Renewables consulting GmbH",
      "company_seat": "Bremen",
      "details": "09.12.2024 (Bekanntmachungsdatum)\n\nBremen Amtsgericht Bremen HRB 33351\nRegisterbekanntmachung nach dem Umwandlungsgesetz 05.12.2024 (Eintragungsdatum)\n\nSkyborn Renewables consulting GmbH\nGesellschaft mit beschränkter Haftung\nBremen\n\nZu Eintragungsnummer 6 vom 05.12.2024 wird als nicht eingetragen veröffentlicht: Den Gläubigern der an der Verschmelzung beteiligten Rechtsträger ist, wenn sie binnen sechs Monaten nach dem Tag, an dem die Eintragung der Verschmelzung in das Register des Sitzes desjenigen Rechtsträgers, dessen Gläubiger sie sind, als bekannt gemacht gilt, ihren Anspruch nach Grund und Höhe schriftlich anmelden, Sicherheit zu leisten, soweit sie nicht Befriedigung verlangen können. Dieses Recht steht den Gläubigern jedoch nur zu, wenn sie glaubhaft machen, dass durch die Verschmelzung die Erfüllung ihrer Forderung gefährdet wird. Das Recht, Sicherheitsleistung zu verlangen, steht Gläubigern nicht zu, die im Falle der Insolvenz ein Recht auf vorzugsweise Befriedigung aus einer Deckungsmasse haben, die nach gesetzlicher Vorschrift zu ihrem Schutz errichtet und staatlich überwacht ist."
    },
    {
      "date": "2024-12-09",
      "id": "95804",
      "original_text": "Registerbekanntmachung nach dem Umwandlungsgesetz\nBremen Amtsgericht Bremen HRB 37699\nSkyborn Renewables India Holding GmbH – Bremen",
      "type": "Registerbekanntmachung nach dem Umwandlungsgesetz",
      "state": "Bremen",
      "amtsgericht": "Amtsgericht Bremen",
      "registernummer": "HRB 37699",
      "registerart": "HRB",
      "company_name": "Skyborn Renewables India Holding GmbH",
      "company_seat": "Bremen",
      "details": "09.12.2024 (Bekanntmachungsdatum)\n\nBremen Amtsgericht Bremen HRB 37699\nRegisterbekanntmachung nach dem Umwandlungsgesetz 05.12.2024 (Eintragungsdatum)\n\nSkyborn Renewables India Holding GmbH\nGesellschaft mit beschränkter Haftung\nBremen\n\nZu Eintragungsnummer 5 vom 05.12.2024 wird als nicht eingetragen veröffentlicht: Den Gläubigern der an der Verschmelzung beteiligten Rechtsträger ist, wenn sie binnen sechs Monaten nach dem Tag, an dem die Eintragung der Verschmelzung in das Register des Sitzes desjenigen Rechtsträgers, dessen Gläubiger sie sind, als bekannt gemacht gilt, ihren Anspruch nach Grund und Höhe schriftlich anmelden, Sicherheit zu leisten, soweit sie nicht Befriedigung verlangen können. Dieses Recht steht den Gläubigern jedoch nur zu, wenn sie glaubhaft machen, dass durch die Verschmelzung die Erfüllung ihrer Forderung gefährdet wird. Das Recht, Sicherheitsleistung zu verlangen, steht Gläubigern nicht zu, die im Falle der Insolvenz ein Recht auf vorzugsweise Befriedigung aus einer Deckungsmasse haben, die nach gesetzlicher Vorschrift zu ihrem Schutz errichtet und staatlich überwacht ist."
    },
    {
      "date": "2024-12-09",
      "id": "95805",
      "original_text": "Löschungsankündigung\nBremen Amtsgericht Bremen HRA 26874\nCap Freetime GmbH & Co. KG – Bremen",
      "type": "Löschungsankündigung",
      "state": "Bremen",
      "amtsgericht": "Amtsgericht Bremen",
      "registernummer": "HRA 26874",
      "registerart": "HRA",
      "company_name": "Cap Freetime GmbH & Co. KG",
      "company_seat": "Bremen",
      "details": "09.12.2024 (Bekanntmachungsdatum)\n\nBremen Amtsgericht Bremen HRA 26874\nLöschungsankündigung\n\nCap Freetime GmbH & Co. KG\nKommanditgesellschaft\nBremen\n\nEs ist beabsichtigt die im Handelsregister eingetragene Gesellschaft von Amts wegen gemäß § 394 FamFG zu löschen. Gegen die Löschung kann beim AG Bremen schriftlich oder zu Protokoll der Geschäftsstelle Widerspruch eingelegt werden. Widerspruchsfrist 4 Wochen."
    },
    {
      "date": "2024-12-09",
      "id": "95806",
      "original_text": "Registerbekanntmachung nach dem Umwandlungsgesetz\nRheinland-Pfalz Amtsgericht Bad Kreuznach HRA 21110\nBürowelten Schmidt e. K., Inhaber Oliver Fuhr – Idar-Oberstein",
      "type": "Registerbekanntmachung nach dem Umwandlungsgesetz",
      "state": "Rheinland-Pfalz",
      "amtsgericht": "Amtsgericht Bad Kreuznach",
      "registernummer": "HRA 21110",
      "registerart": "HRA",
      "company_name": "Bürowelten Schmidt e. K., Inhaber Oliver Fuhr",
      "company_seat": "Idar-Oberstein",
      "details": "09.12.2024 (Bekanntmachungsdatum)\n\nRheinland-Pfalz Amtsgericht Bad Kreuznach HRA 21110\nRegisterbekanntmachung nach dem Umwandlungsgesetz 09.12.2024 (Eintragungsdatum)\n\nBürowelten Schmidt e. K., Inhaber Oliver Fuhr\nEinzelkaufmann / Einzelkauffrau\nIdar-Oberstein\n\nAls nicht eingetragen wird veröffentlicht: Den Gläubigern der an der Ausgliederung beteiligten Rechtsträger ist, wenn sie binnen sechs Monaten nach dem Tag, an dem die Eintragung der Ausgliederung in das Register des Sitzes desjenigen Rechtsträgers, dessen Gläubiger sie sind, nach § 19 Abs. 3 UmwG als bekannt gemacht gilt, ihren Anspruch nach Grund und Höhe schriftlich anmelden, Sicherheit zu leisten, soweit sie nicht Befriedigung verlangen können. Dieses Recht steht den Gläubigern jedoch nur zu, wenn sie glaubhaft machen, dass durch die Ausgliederung die Erfüllung der Forderung gefährdet wird."
    },
    {
      "date": "2024-12-09",
      "id": "95807",
      "original_text": "Registerbekanntmachung nach dem Umwandlungsgesetz\nRheinland-Pfalz Amtsgericht Mainz HRB 8793\nWerner & Mertz Service & Logistik GmbH – Mainz",
      "type": "Registerbekanntmachung nach dem Umwandlungsgesetz",
      "state": "Rheinland-Pfalz",
      "amtsgericht": "Amtsgericht Mainz",
      "registernummer": "HRB 8793",
      "registerart": "HRB",
      "company_name": "Werner & Mertz Service & Logistik GmbH",
      "company_seat": "Mainz",
      "details": "09.12.2024 (Bekanntmachungsdatum)\n\nRheinland-Pfalz Amtsgericht Mainz HRB 8793\nRegisterbekanntmachung nach dem Umwandlungsgesetz 09.12.2024 (Eintragungsdatum)\n\nWerner & Mertz Service & Logistik GmbH\nGesellschaft mit beschränkter Haftung\nMainz\n\nAls nicht eingetragen wird veröffentlicht:\nDen Gläubigern der an der Verschmelzung beteiligten Rechtsträger ist, wenn sie binnen sechs Monaten nach dem Tag, an dem die Eintragung der Verschmelzung in das Register des Sitzes desjenigen Rechtsträgers, dessen Gläubiger sie sind, nach § 19 Abs. 3 UmwG als bekannt gemacht gilt, ihren Anspruch nach Grund und Höhe schriftlich anmelden, Sicherheit zu leisten, soweit sie nicht Befriedigung verlangen können. Dieses Recht steht den Gläubigern jedoch nur zu, wenn sie glaubhaft machen, dass durch die Verschmelzung die Erfüllung der Forderung gefährdet wird."
    },
    {
      "date": "2024-12-09",
      "id": "95808",
      "original_text": "Einreichung neuer Dokumente\nRheinland-Pfalz Amtsgericht Koblenz HRB 13990\nThyssenKrupp Rasselstein GmbH – Andernach",
      "type": "Einreichung neuer Dokumente",
      "state": "Rheinland-Pfalz",
      "amtsgericht": "Amtsgericht Koblenz",
      "registernummer": "HRB 13990",
      "registerart": "HRB",
      "company_name": "ThyssenKrupp Rasselstein GmbH",
      "company_seat": "Andernach",
      "details": "09.12.2024 (Bekanntmachungsdatum)\n\nRheinland-Pfalz Amtsgericht Koblenz HRB 13990\nEinreichung neuer Dokumente\n\nThyssenKrupp Rasselstein GmbH\nGesellschaft mit beschränkter Haftung\nAndernach\n\nDem Registergericht ist eine neue Liste der Mitglieder des Aufsichtsrates eingereicht worden."
    },
    {
      "date": "2024-12-09",
      "id": "95809",
      "original_text": "Registerbekanntmachung nach dem Umwandlungsgesetz\nRheinland-Pfalz Amtsgericht Mainz HRB 44546\nWerner & Mertz Immobilienverwaltungs GmbH – Mainz",
      "type": "Registerbekanntmachung nach dem Umwandlungsgesetz",
      "state": "Rheinland-Pfalz",
      "amtsgericht": "Amtsgericht Mainz",
      "registernummer": "HRB 44546",
      "registerart": "HRB",
      "company_name": "Werner & Mertz Immobilienverwaltungs GmbH",
      "company_seat": "Mainz",
      "details": "09.12.2024 (Bekanntmachungsdatum)\n\nRheinland-Pfalz Amtsgericht Mainz HRB 44546\nRegisterbekanntmachung nach dem Umwandlungsgesetz 09.12.2024 (Eintragungsdatum)\n\nWerner & Mertz Immobilienverwaltungs GmbH\nGesellschaft mit beschränkter Haftung\nMainz\n\nAls nicht eingetragen wird veröffentlicht:\nDen Gläubigern der an der Verschmelzung beteiligten Rechtsträger ist, wenn sie binnen sechs Monaten nach dem Tag, an dem die Eintragung der Verschmelzung in das Register des Sitzes desjenigen Rechtsträgers, dessen Gläubiger sie sind, nach § 19 Abs. 3 UmwG als bekannt gemacht gilt, ihren Anspruch nach Grund und Höhe schriftlich anmelden, Sicherheit zu leisten, soweit sie nicht Befriedigung verlangen können. Dieses Recht steht den Gläubigern jedoch nur zu, wenn sie glaubhaft machen, dass durch die Verschmelzung die Erfüllung der Forderung gefährdet wird."
    },
    {
      "date": "2024-12-09",
      "id": "95810",
      "original_text": "Löschungsankündigung\nRheinland-Pfalz Amtsgericht Ludwigshafen a.Rhein (Ludwigshafen) HRB 65536\nKukma UG (haftungsbeschränkt) – Ludwigshafen",
      "type": "Löschungsankündigung",
      "state": "Rheinland-Pfalz",
      "amtsgericht": "Amtsgericht Ludwigshafen a.Rhein (Ludwigshafen)",
      "registernummer": "HRB 65536",
      "registerart": "HRB",
      "company_name": "Kukma UG (haftungsbeschränkt)",
      "company_seat": "Ludwigshafen",
      "details": "09.12.2024 (Bekanntmachungsdatum)\n\nRheinland-Pfalz Amtsgericht Ludwigshafen a.Rhein (Ludwigshafen) HRB 65536\nLöschungsankündigung\n\nKukma UG (haftungsbeschränkt)\nGesellschaft mit beschränkter Haftung\nLudwigshafen\n\nDas Registergericht beabsichtigt die Gesellschaft von Amts wegen nach § 394 FamFG zu löschen. Die Frist zur Erhebung eines Widerspruchs ist auf einen Monat festgesetzt."
    },
    {
      "date": "2024-12-09",
      "id": "95811",
      "original_text": "Einreichung neuer Dokumente\nNordrhein-Westfalen Amtsgericht Köln HRB 48032\nEXTREMUS Versicherungs-Aktiengesellschaft – Köln",
      "type": "Einreichung neuer Dokumente",
      "state": "Nordrhein-Westfalen",
      "amtsgericht": "Amtsgericht Köln",
      "registernummer": "HRB 48032",
      "registerart": "HRB",
      "company_name": "EXTREMUS Versicherungs-Aktiengesellschaft",
      "company_seat": "Köln",
      "details": "09.12.2024 (Bekanntmachungsdatum)\n\nNordrhein-Westfalen Amtsgericht Köln HRB 48032\nEinreichung neuer Dokumente\n\nEXTREMUS Versicherungs-Aktiengesellschaft\nAktiengesellschaft\nKöln\n\nDem Registergericht ist eine Liste der Mitglieder des Aufsichtsrates eingereicht worden."
    },
    {
      "date": "2024-12-09",
      "id": "95812",
      "original_text": "Registerbekanntmachung nach dem Umwandlungsgesetz\nNordrhein-Westfalen Amtsgericht Gütersloh HRB 13211\nANH Invest GmbH – Gütersloh",
      "type": "Registerbekanntmachung nach dem Umwandlungsgesetz",
      "state": "Nordrhein-Westfalen",
      "amtsgericht": "Amtsgericht Gütersloh",
      "registernummer": "HRB 13211",
      "registerart": "HRB",
      "company_name": "ANH Invest GmbH",
      "company_seat": "Gütersloh",
      "details": "09.12.2024 (Bekanntmachungsdatum)\n\nNordrhein-Westfalen Amtsgericht Gütersloh HRB 13211\nRegisterbekanntmachung nach dem Umwandlungsgesetz 09.12.2024 (Eintragungsdatum)\n\nANH Invest GmbH\nGesellschaft mit beschränkter Haftung\nGütersloh\n\nDen Gläubigern der an der Verschmelzung beteiligten Rechtsträger ist, wenn sie binnen sechs Monaten nach dem Tag, an dem die Eintragung der Verschmelzung in das Register des Sitzes desjenigen Rechtsträgers, dessen Gläubiger sie sind, nach § 19 Absatz 3 UmwG als bekanntgemacht gilt, ihren Anspruch nach Grund und Höhe schriftlich anmelden, Sicherheit zu leisten, soweit sie nicht Befriedigung verlangen können. Dieses Recht steht den Gläubigern jedoch nur zu, wenn sie glaubhaft machen, dass durch die Verschmelzung die Erfüllung ihrer Forderung gefährdet wird."
    },
    {
      "date": "2024-12-09",
      "id": "95813",
      "original_text": "Löschungsankündigung\nNordrhein-Westfalen Amtsgericht Düsseldorf HRB 96518\nFrank´s Consulting + Service UG (haftungsbeschränkt) – Düsseldorf",
      "type": "Löschungsankündigung",
      "state": "Nordrhein-Westfalen",
      "amtsgericht": "Amtsgericht Düsseldorf",
      "registernummer": "HRB 96518",
      "registerart": "HRB",
      "company_name": "Frank´s Consulting + Service UG (haftungsbeschränkt)",
      "company_seat": "Düsseldorf",
      "details": "09.12.2024 (Bekanntmachungsdatum)\n\nNordrhein-Westfalen Amtsgericht Düsseldorf HRB 96518\nLöschungsankündigung\n\nFrank´s Consulting + Service UG (haftungsbeschränkt)\nGesellschaft mit beschränkter Haftung\nDüsseldorf\n\nDas Registergericht beabsichtigt die Gesellschaft von Amts wegen nach § 394 FamFG zu löschen. Die Frist zur Erhebung eines Widerspruchs ist auf 3 Wochen festgesetzt.\n\nRechtsbehelfsbelehrung:\nDas Widerspruchsrecht steht jedem zu, der an der Unterlassung der Löschung ein berechtigtes Interesse hat. Der Widerspruch ist bei dem Amtsgericht Düsseldorf -Registergericht-, Werdener Straße 1, 40227 Düsseldorf schriftlich in deutscher Sprache oder zur Niederschrift der Geschäftsstelle einzulegen. Der Widerspruch kann auch zur Niederschrift der Geschäftsstelle eines jeden Amtsgerichtes abgegeben werden. Die Einlegung ist auch durch Übertragung eines elektronischen Dokuments an die elektronische Poststelle des Gerichts möglich. Das elektronische Dokument muss für die Bearbeitung durch das Gericht geeignet und mit einer qualifizierten elektronischen Signatur der verantwortenden Person versehen sein oder von der verantwortenden Person signiert und auf einem sicheren Übermittlungsweg gemäß § 130a ZPO nach näherer Maßgabe der Verordnung über die technischen Rahmenbedingungen des elektronischen Rechtsverkehrs und über das besondere elektronische Behördenpostfach (BGBl. I, S.3803) eingereicht werden. Weitere Informationen erhalten Sie auf der Internetseite www.justiz.de.\nDer Widerspruch muss spätestens innerhalb der gesetzten Frist nach dem Datum der Bekanntmachung der Löschungsankündigung bei dem Amtsgericht - Registergericht - Düsseldorf eingegangen sein.  Dies gilt auch dann, wenn der Widerspruch zur Niederschrift der Geschäftsstelle eines anderen Amtsgerichtes abgegeben wurde. Die Frist beginnt mit dem Tage der Bekanntmachung der Löschungsankündigung in dem für die Bekanntmachung der Eintragungen in das Handelsregister bestimmten elektronischen Informations- und Kommunikationssystem nach § 10 des Handelsgesetzbuches. Fällt das Ende der Frist auf einen Sonntag, einen allgemeinen Feiertag oder Sonnabend, so endet die Frist mit Ablauf des nächsten Werktages.\nDer Widerspruch muss die Bezeichnung der angefochtenen Löschungsankündigung sowie die Erklärung enthalten, dass Widerspruch gegen diese Löschungsankündigung eingelegt wird. Er ist zu unterzeichnen und soll begründet werden."
    },
    {
      "date": "2024-12-09",
      "id": "95814",
      "original_text": "Registerbekanntmachung nach dem Umwandlungsgesetz\nNordrhein-Westfalen Amtsgericht Köln HRB 92106\nEasy Ventures GmbH – Köln",
      "type": "Registerbekanntmachung nach dem Umwandlungsgesetz",
      "state": "Nordrhein-Westfalen",
      "amtsgericht": "Amtsgericht Köln",
      "registernummer": "HRB 92106",
      "registerart": "HRB",
      "company_name": "Easy Ventures GmbH",
      "company_seat": "Köln",
      "details": "09.12.2024 (Bekanntmachungsdatum)\n\nNordrhein-Westfalen Amtsgericht Köln HRB 92106\nRegisterbekanntmachung nach dem Umwandlungsgesetz 09.12.2024 (Eintragungsdatum)\n\nEasy Ventures GmbH\nGesellschaft mit beschränkter Haftung\nKöln\n\nDen Gläubigern der an der Verschmelzung beteiligten Rechtsträger ist, wenn sie binnen sechs Monaten nach dem Tag, an dem die Eintragung der Verschmelzung in das Register des Sitzes desjenigen Rechtsträgers, dessen Gläubiger sie sind, nach § 19 Absatz 3 UmwG als bekanntgemacht gilt, ihren Anspruch nach Grund und Höhe schriftlich anmelden, Sicherheit zu leisten, soweit sie nicht Befriedigung verlangen können. Dieses Recht steht den Gläubigern jedoch nur zu, wenn sie glaubhaft machen, dass durch die Verschmelzung die Erfüllung ihrer Forderung gefährdet wird."
    },
    {
      "date": "2024-12-09",
      "id": "95815",
      "original_text": "Registerbekanntmachung nach dem Umwandlungsgesetz\nNordrhein-Westfalen Amtsgericht Dortmund HRB 36759\nOneWay Sicherung und Dienstleistung GmbH – Dortmund",
      "type": "Registerbekanntmachung nach dem Umwandlungsgesetz",
      "state": "Nordrhein-Westfalen",
      "amtsgericht": "Amtsgericht Dortmund",
      "registernummer": "HRB 36759",
      "registerart": "HRB",
      "company_name": "OneWay Sicherung und Dienstleistung GmbH",
      "company_seat": "Dortmund",
      "details": "09.12.2024 (Bekanntmachungsdatum)\n\nNordrhein-Westfalen Amtsgericht Dortmund HRB 36759\nRegisterbekanntmachung nach dem Umwandlungsgesetz 09.12.2024 (Eintragungsdatum)\n\nOneWay Sicherung und Dienstleistung GmbH\nGesellschaft mit beschränkter Haftung\nDortmund\n\nDen Gläubigern der an der Ausgliederung beteiligten Rechtsträger ist, wenn sie binnen sechs Monaten nach dem Tag, an dem die Eintragung der Ausgliederung in das Register des Sitzes desjenigen Rechtsträgers, dessen Gläubiger sie sind, nach § 19 Absatz 3 UmwG als bekanntgemacht gilt, ihren Anspruch nach Grund und Höhe schriftlich anmelden, Sicherheit zu leisten, soweit sie nicht Befriedigung verlangen können. Dieses Recht steht den Gläubigern jedoch nur zu, wenn sie glaubhaft machen, dass durch die Ausgliederung die Erfüllung ihrer Forderung gefährdet wird."
    },
    {
      "date": "2024-12-09",
      "id": "95816",
      "original_text": "Löschungsankündigung\nNordrhein-Westfalen Amtsgericht Wuppertal HRB 8581\nGIVT Gesellschaft für Innovative Video Technologie mbH – Wuppertal",
      "type": "Löschungsankündigung",
      "state": "Nordrhein-Westfalen",
      "amtsgericht": "Amtsgericht Wuppertal",
      "registernummer": "HRB 8581",
      "registerart": "HRB",
      "company_name": "GIVT Gesellschaft für Innovative Video Technologie mbH",
      "company_seat": "Wuppertal",
      "details": "09.12.2024 (Bekanntmachungsdatum)\n\nNordrhein-Westfalen Amtsgericht Wuppertal HRB 8581\nLöschungsankündigung 06.12.2024 (Eintragungsdatum)\n\nGIVT Gesellschaft für Innovative Video Technologie mbH\nGesellschaft mit beschränkter Haftung\nWuppertal\n\nDas Registergericht beabsichtigt die Gesellschaft von Amts wegen nach § 394 FamFG zu löschen. Die Frist zur Erhebung eines Widerspruchs ist auf einen Monat festgesetzt."
    },
    {
      "date": "2024-12-09",
      "id": "95817",
      "original_text": "Löschungsankündigung\nNordrhein-Westfalen Amtsgericht Dortmund HRB 23739\nEnergie-Immo-JACOBI GmbH – Werne",
      "type": "Löschungsankündigung",
      "state": "Nordrhein-Westfalen",
      "amtsgericht": "Amtsgericht Dortmund",
      "registernummer": "HRB 23739",
      "registerart": "HRB",
      "company_name": "Energie-Immo-JACOBI GmbH",
      "company_seat": "Werne",
      "details": "09.12.2024 (Bekanntmachungsdatum)\n\nNordrhein-Westfalen Amtsgericht Dortmund HRB 23739\nLöschungsankündigung\n\nEnergie-Immo-JACOBI GmbH\nGesellschaft mit beschränkter Haftung\nWerne\n\nDas Registergericht beabsichtigt die Gesellschaft von Amts wegen nach § 394 FamFG zu löschen. Die Frist zur Erhebung eines Widerspruchs ist auf zwei Monate festgesetzt."
    },
    {
      "date": "2024-12-09",
      "id": "95818",
      "original_text": "Löschungsankündigung\nNordrhein-Westfalen Amtsgericht Siegburg HRA 5440\nBST Brandschutz, Schallschutz und Trockenbau GmbH & Co. KG – Neunkirchen-Seelscheid",
      "type": "Löschungsankündigung",
      "state": "Nordrhein-Westfalen",
      "amtsgericht": "Amtsgericht Siegburg",
      "registernummer": "HRA 5440",
      "registerart": "HRA",
      "company_name": "BST Brandschutz, Schallschutz und Trockenbau GmbH & Co. KG",
      "company_seat": "Neunkirchen-Seelscheid",
      "details": "09.12.2024 (Bekanntmachungsdatum)\n\nNordrhein-Westfalen Amtsgericht Siegburg HRA 5440\nLöschungsankündigung\n\nBST Brandschutz, Schallschutz und Trockenbau GmbH & Co. KG\nKommanditgesellschaft\nNeunkirchen-Seelscheid\n\nDie im hiesigen Handelsregister eingetragene BST Brandschutz, Schallschutz und Trockenbau GmbH & Co. KG soll gemäß § 31 Absatz 2 HGB i.V.m. § 393 FamFG von Amts wegen gelöscht werden.\nEin etwaiger Widerspruch gegen die beabsichtigte Löschung ist binnen einer Frist von drei Monaten bei dem Registergericht geltend zu machen, anderenfalls wird die Löschung der Firma erfolgen."
    },
    {
      "date": "2024-12-09",
      "id": "95819",
      "original_text": "Registerbekanntmachung nach dem Umwandlungsgesetz\nNordrhein-Westfalen Amtsgericht Düsseldorf HRB 63961\nCircana GmbH – Düsseldorf",
      "type": "Registerbekanntmachung nach dem Umwandlungsgesetz",
      "state": "Nordrhein-Westfalen",
      "amtsgericht": "Amtsgericht Düsseldorf",
      "registernummer": "HRB 63961",
      "registerart": "HRB",
      "company_name": "Circana GmbH",
      "company_seat": "Düsseldorf",
      "details": "09.12.2024 (Bekanntmachungsdatum)\n\nNordrhein-Westfalen Amtsgericht Düsseldorf HRB 63961\nRegisterbekanntmachung nach dem Umwandlungsgesetz 09.12.2024 (Eintragungsdatum)\n\nCircana GmbH\nGesellschaft mit beschränkter Haftung\nDüsseldorf\n\nDen Gläubigern der an der Verschmelzung beteiligten Rechtsträger ist, wenn sie binnen sechs Monaten nach dem Tag, an dem die Eintragung der Verschmelzung in das Register des Sitzes desjenigen Rechtsträgers, dessen Gläubiger sie sind, nach § 19 Absatz 3 UmwG als bekanntgemacht gilt, ihren Anspruch nach Grund und Höhe schriftlich anmelden, Sicherheit zu leisten, soweit sie nicht Befriedigung verlangen können. Dieses Recht steht den Gläubigern jedoch nur zu, wenn sie glaubhaft machen, dass durch die Verschmelzung die Erfüllung ihrer Forderung gefährdet wird."
    },
    {
      "date": "2024-12-09",
      "id": "95820",
      "original_text": "Registerbekanntmachung nach dem Umwandlungsgesetz\nNordrhein-Westfalen Amtsgericht Siegburg HRB 6258\nVehicle Documentation Service GmbH (VDS GmbH) – Troisdorf",
      "type": "Registerbekanntmachung nach dem Umwandlungsgesetz",
      "state": "Nordrhein-Westfalen",
      "amtsgericht": "Amtsgericht Siegburg",
      "registernummer": "HRB 6258",
      "registerart": "HRB",
      "company_name": "Vehicle Documentation Service GmbH (VDS GmbH)",
      "company_seat": "Troisdorf",
      "details": "09.12.2024 (Bekanntmachungsdatum)\n\nNordrhein-Westfalen Amtsgericht Siegburg HRB 6258\nRegisterbekanntmachung nach dem Umwandlungsgesetz 09.12.2024 (Eintragungsdatum)\n\nVehicle Documentation Service GmbH (VDS GmbH)\nGesellschaft mit beschränkter Haftung\nTroisdorf\n\nDen Gläubigern der an der Verschmelzung beteiligten Rechtsträger ist, wenn sie binnen sechs Monaten nach dem Tag, an dem die Eintragung der Verschmelzung in das Register des Sitzes desjenigen Rechtsträgers, dessen Gläubiger sie sind, nach § 19 Absatz 3 UmwG als bekanntgemacht gilt, ihren Anspruch nach Grund und Höhe schriftlich anmelden, Sicherheit zu leisten, soweit sie nicht Befriedigung verlangen können. Dieses Recht steht den Gläubigern jedoch nur zu, wenn sie glaubhaft machen, dass durch die Verschmelzung die Erfüllung ihrer Forderung gefährdet wird."
    },
    {
      "date": "2024-12-09",
      "id": "95821",
      "original_text": "Löschungsankündigung\nNordrhein-Westfalen Amtsgericht Köln HRB 104247\nRescUnit UG (haftungsbeschränkt) – Leverkusen",
      "type": "Löschungsankündigung",
      "state": "Nordrhein-Westfalen",
      "amtsgericht": "Amtsgericht Köln",
      "registernummer": "HRB 104247",
      "registerart": "HRB",
      "company_name": "RescUnit UG (haftungsbeschränkt)",
      "company_seat": "Leverkusen",
      "details": "09.12.2024 (Bekanntmachungsdatum)\n\nNordrhein-Westfalen Amtsgericht Köln HRB 104247\nLöschungsankündigung\n\nRescUnit UG (haftungsbeschränkt)\nGesellschaft mit beschränkter Haftung\nLeverkusen\n\nDas Registergericht beabsichtigt, die im Handelsregister eingetragene Gesellschaft gemäß § 394 Absatz 1 FamFG wegen Vermögenslosigkeit von Amts wegen zu löschen. Gegen diese Verfügung kann Widerspruch eingelegt werden. Die Frist zur Erhebung eines Widerspruchs gegen die beabsichtigte Löschung von Amts wegen ist auf einen Monat festgesetzt. Rechtsbehelfsbelehrung: Gegen diese Verfügung können Sie Widerspruch einlegen. Der Widerspruch ist bei dem Amtsgericht Köln, Reichenspergerplatz 1, 50670 Köln schriftlich in deutscher Sprache oder zur Niederschrift der Geschäftsstelle einzulegen. Der Widerspruch kann auch zur Niederschrift der Geschäftsstelle eines jeden Amtsgerichtes abgegeben werden. Die Einlegung ist auch durch Übertragung eines elektronischen Dokuments an die elektronische Poststelle des Gerichts möglich. Das elektronische Dokument muss für die Bearbeitung durch das Gericht geeignet und mit einer qualifizierten elektronischen Signatur der verantwortenden Person versehen sein oder von der verantwortenden Person signiert und auf einem sicheren Übermittlungsweg gemäß § 130a ZPO nach näherer Maßgabe der Verordnung über die technischen Rahmenbedingungen des elektronischen Rechtsverkehrs und über das besondere elektronische Behördenpostfach (BGBl. I, S.3803) eingereicht werden. Weitere Informationen erhalten Sie auf der Internetseite www.justiz.de.Der Widerspruch muss spätestens innerhalb der gesetzten Frist bei dem Amtsgericht Köln eingegangen sein. Dies gilt auch dann, wenn der Widerspruch zur Niederschrift der Geschäftsstelle eines anderen Amtsgerichtes abgegeben wurde. Die Frist beginnt mit der Veröffentlichung. Fällt das Ende der Frist auf einen Sonntag, einen allgemeinen Feiertag oder Sonnabend, so endet die Frist mit Ablauf des nächsten Werktages.\n\nDer Widerspruch muss die Bezeichnung der angefochtenen Verfügung sowie die Erklärung enthalten, dass Widerspruch gegen diese Verfügung eingelegt wird. Er ist zu unterzeichnen und soll begründet werden."
    },
    {
      "date": "2024-12-09",
      "id": "95822",
      "original_text": "Löschungsankündigung\nNordrhein-Westfalen Amtsgericht Neuss HRB 18622\nLaModena GmbH – Neuss",
      "type": "Löschungsankündigung",
      "state": "Nordrhein-Westfalen",
      "amtsgericht": "Amtsgericht Neuss",
      "registernummer": "HRB 18622",
      "registerart": "HRB",
      "company_name": "LaModena GmbH",
      "company_seat": "Neuss",
      "details": "09.12.2024 (Bekanntmachungsdatum)\n\nNordrhein-Westfalen Amtsgericht Neuss HRB 18622\nLöschungsankündigung 09.12.2024 (Eintragungsdatum)\n\nLaModena GmbH\nGesellschaft mit beschränkter Haftung\nNeuss\n\nEs ist beabsichtigt, die Gesellschaft wegen Vermögenslosigkeit aufgrund des § 394 Abs. 1 FamFG zu löschen. Frist zur Geltendmachung eines Widerspruchs: 1 Monat.\n\nRechtsbehelfsbelehrung:\nGegen diese Verfügung können Sie Widerspruch einlegen.\nDer Widerspruch ist bei dem Amtsgericht Neuss - Registergericht -, Breite Str. 48, 41460 Neuss schriftlich in deutscher Sprache oder zur Niederschrift der Geschäftsstelle einzulegen.\nDer Widerspruch kann auch zur Niederschrift der Geschäftsstelle eines jeden Amtsgerichtes abgegeben werden.\nDie Einlegung ist auch durch Übertragung eines elektronischen Dokuments an die elektronische Poststelle des Gerichts möglich. Das elektronische Dokument muss für die Bearbeitung durch das Gericht geeignet und mit einer qualifizierten elektronischen Signatur der verantwortenden Person versehen sein oder von der verantwortenden Person signiert und auf einem sicheren Übermittlungsweg gemäß § 130a ZPO nach näherer Maßgabe der Verordnung über die technischen Rahmenbedingungen des elektronischen Rechtsverkehrs und über das besondere elektronische Behördenpostfach (BGBl. I, S.3803) eingereicht werden. Weitere Informationen erhalten Sie auf der Internetseite www.justiz.de.\nDer Widerspruch muss spätestens innerhalb der gesetzten Frist nach der schriftlichen Bekanntgabe der Verfügung bei dem Amtsgericht - Registergericht - Neuss eingegangen sein. Dies gilt auch dann, wenn der Widerspruch zur Niederschrift der Geschäftsstelle eines anderen Amtsgerichtes abgegeben wurde. Die Frist beginnt mit der schriftlichen Bekanntgabe der Verfügung. Die Bekanntgabe ist entweder durch Zustellung oder am dritten Tage nach Aufgabe zur Post bewirkt. Fällt das Ende der Frist auf einen Sonntag, einen allgemeinen Feiertag oder Sonnabend, so endet die Frist mit Ablauf des nächsten Werktages.\n\nDer Widerspruch muss die Bezeichnung der angefochtenen Verfügung sowie die Erklärung enthalten, dass Widerspruch gegen diese Verfügung eingelegt wird. Er ist zu unterzeichnen und soll begründet werden."
    },
    {
      "date": "2024-12-09",
      "id": "95823",
      "original_text": "Registerbekanntmachung nach dem Umwandlungsgesetz\nNordrhein-Westfalen Amtsgericht Bochum HRB 13726\nUhrmania UG (haftungsbeschränkt) – Bochum",
      "type": "Registerbekanntmachung nach dem Umwandlungsgesetz",
      "state": "Nordrhein-Westfalen",
      "amtsgericht": "Amtsgericht Bochum",
      "registernummer": "HRB 13726",
      "registerart": "HRB",
      "company_name": "Uhrmania UG (haftungsbeschränkt)",
      "company_seat": "Bochum",
      "details": "09.12.2024 (Bekanntmachungsdatum)\n\nNordrhein-Westfalen Amtsgericht Bochum HRB 13726\nRegisterbekanntmachung nach dem Umwandlungsgesetz 06.12.2024 (Eintragungsdatum)\n\nUhrmania UG (haftungsbeschränkt)\nGesellschaft mit beschränkter Haftung\nBochum\n\nDen Gläubigern der an der Verschmelzung beteiligten Rechtsträger ist, wenn sie binnen sechs Monaten nach dem Tag, an dem die Eintragung der Verschmelzung in das Register des Sitzes derjenigen Rechtsträger deren Gläubiger sie sind, nach § 19 Absatz 3 UmwG als bekanntgemacht gilt, ihren Anspruch nach Grund und Höhe schriftlich anmelden, Sicherheit zu leisten, soweit sie nicht Befriedigung verlangen können. Dieses Recht steht den Gläubigern jedoch nur zu, wenn sie glaubhaft machen, dass durch die Verschmelzung die Erfüllung ihrer Forderung gefährdet wird."
    },
    {
      "date": "2024-12-09",
      "id": "95824",
      "original_text": "Einreichung neuer Dokumente\nNordrhein-Westfalen Amtsgericht Düsseldorf HRB 95596\nEiffage Infra-Rail GmbH – Düsseldorf",
      "type": "Einreichung neuer Dokumente",
      "state": "Nordrhein-Westfalen",
      "amtsgericht": "Amtsgericht Düsseldorf",
      "registernummer": "HRB 95596",
      "registerart": "HRB",
      "company_name": "Eiffage Infra-Rail GmbH",
      "company_seat": "Düsseldorf",
      "details": "09.12.2024 (Bekanntmachungsdatum)\n\nNordrhein-Westfalen Amtsgericht Düsseldorf HRB 95596\nEinreichung neuer Dokumente\n\nEiffage Infra-Rail GmbH\nGesellschaft mit beschränkter Haftung\nDüsseldorf\n\nDem Registergericht ist eine Liste der Mitglieder des Aufsichtsrates eingereicht worden."
    },
    {
      "date": "2024-12-09",
      "id": "95825",
      "original_text": "Sonstige Registerbekanntmachung\nNordrhein-Westfalen Amtsgericht Düsseldorf HRA 25909\nFit Trade GmbH & Co. KG – Düsseldorf",
      "type": "Sonstige Registerbekanntmachung",
      "state": "Nordrhein-Westfalen",
      "amtsgericht": "Amtsgericht Düsseldorf",
      "registernummer": "HRA 25909",
      "registerart": "HRA",
      "company_name": "Fit Trade GmbH & Co. KG",
      "company_seat": "Düsseldorf",
      "details": "09.12.2024 (Bekanntmachungsdatum)\n\nNordrhein-Westfalen Amtsgericht Düsseldorf HRA 25909\nSonstige Registerbekanntmachung 09.12.2024 (Eintragungsdatum)\n\nFit Trade GmbH & Co. KG\nKommanditgesellschaft\nDüsseldorf\n\nAls nicht eingetragen wird bekannt gemacht:\nDer Gegenstand des Unternehmens ist nunmehr die Verwaltung eigenen Vermögens, insbesondere der Erwerb, die Entwicklung, die Verwaltung und die Verwertung von Gewerbeheimimmobilien und Grundstücken."
    },
    {
      "date": "2024-12-09",
      "id": "95826",
      "original_text": "Registerbekanntmachung nach dem Umwandlungsgesetz\nNordrhein-Westfalen Amtsgericht Duisburg HRA 10752\nSchaff Verwaltungs-KG – Mülheim an der Ruhr",
      "type": "Registerbekanntmachung nach dem Umwandlungsgesetz",
      "state": "Nordrhein-Westfalen",
      "amtsgericht": "Amtsgericht Duisburg",
      "registernummer": "HRA 10752",
      "registerart": "HRA",
      "company_name": "Schaff Verwaltungs-KG",
      "company_seat": "Mülheim an der Ruhr",
      "details": "09.12.2024 (Bekanntmachungsdatum)\n\nNordrhein-Westfalen Amtsgericht Duisburg HRA 10752\nRegisterbekanntmachung nach dem Umwandlungsgesetz 09.12.2024 (Eintragungsdatum)\n\nSchaff Verwaltungs-KG\nKommanditgesellschaft\nMülheim an der Ruhr\n\nDie Gesellschaft hat Gläubigern, deren Forderungen vor dieser Bekanntmachung begründet worden sind, Sicherheit zu leisten, soweit sie nicht Befriedigung verlangen können, wenn sie sich binnen sechs Monaten zu diesem Zweck melden."
    },
    {
      "date": "2024-12-09",
      "id": "95827",
      "original_text": "Löschungsankündigung\nNordrhein-Westfalen Amtsgericht Düsseldorf HRB 74112\nMarkwart Holding GmbH – Düsseldorf",
      "type": "Löschungsankündigung",
      "state": "Nordrhein-Westfalen",
      "amtsgericht": "Amtsgericht Düsseldorf",
      "registernummer": "HRB 74112",
      "registerart": "HRB",
      "company_name": "Markwart Holding GmbH",
      "company_seat": "Düsseldorf",
      "details": "09.12.2024 (Bekanntmachungsdatum)\n\nNordrhein-Westfalen Amtsgericht Düsseldorf HRB 74112\nLöschungsankündigung\n\nMarkwart Holding GmbH\nGesellschaft mit beschränkter Haftung\nDüsseldorf\n\nDas Registergericht beabsichtigt die Gesellschaft von Amts wegen nach § 394 FamFG zu löschen. Die Frist zur Erhebung eines Widerspruchs ist auf 3 Wochen festgesetzt.\n\nRechtsbehelfsbelehrung:\nDas Widerspruchsrecht steht jedem zu, der an der Unterlassung der Löschung ein berechtigtes Interesse hat. Der Widerspruch ist bei dem Amtsgericht Düsseldorf -Registergericht-, Werdener Straße 1, 40227 Düsseldorf schriftlich in deutscher Sprache oder zur Niederschrift der Geschäftsstelle einzulegen. Der Widerspruch kann auch zur Niederschrift der Geschäftsstelle eines jeden Amtsgerichtes abgegeben werden. Die Einlegung ist auch durch Übertragung eines elektronischen Dokuments an die elektronische Poststelle des Gerichts möglich. Das elektronische Dokument muss für die Bearbeitung durch das Gericht geeignet und mit einer qualifizierten elektronischen Signatur der verantwortenden Person versehen sein oder von der verantwortenden Person signiert und auf einem sicheren Übermittlungsweg gemäß § 130a ZPO nach näherer Maßgabe der Verordnung über die technischen Rahmenbedingungen des elektronischen Rechtsverkehrs und über das besondere elektronische Behördenpostfach (BGBl. I, S.3803) eingereicht werden. Weitere Informationen erhalten Sie auf der Internetseite www.justiz.de.\nDer Widerspruch muss spätestens innerhalb der gesetzten Frist nach dem Datum der Bekanntmachung der Löschungsankündigung bei dem Amtsgericht - Registergericht - Düsseldorf eingegangen sein.  Dies gilt auch dann, wenn der Widerspruch zur Niederschrift der Geschäftsstelle eines anderen Amtsgerichtes abgegeben wurde. Die Frist beginnt mit dem Tage der Bekanntmachung der Löschungsankündigung in dem für die Bekanntmachung der Eintragungen in das Handelsregister bestimmten elektronischen Informations- und Kommunikationssystem nach § 10 des Handelsgesetzbuches. Fällt das Ende der Frist auf einen Sonntag, einen allgemeinen Feiertag oder Sonnabend, so endet die Frist mit Ablauf des nächsten Werktages.\nDer Widerspruch muss die Bezeichnung der angefochtenen Löschungsankündigung sowie die Erklärung enthalten, dass Widerspruch gegen diese Löschungsankündigung eingelegt wird. Er ist zu unterzeichnen und soll begründet werden."
    },
    {
      "date": "2024-12-09",
      "id": "95828",
      "original_text": "Löschungsankündigung\nNordrhein-Westfalen Amtsgericht Iserlohn HRB 9810\nTBS - Technischer Bauservice UG (haftungsbeschränkt) – Lüdenscheid",
      "type": "Löschungsankündigung",
      "state": "Nordrhein-Westfalen",
      "amtsgericht": "Amtsgericht Iserlohn",
      "registernummer": "HRB 9810",
      "registerart": "HRB",
      "company_name": "TBS - Technischer Bauservice UG (haftungsbeschränkt)",
      "company_seat": "Lüdenscheid",
      "details": "09.12.2024 (Bekanntmachungsdatum)\n\nNordrhein-Westfalen Amtsgericht Iserlohn HRB 9810\nLöschungsankündigung 02.12.2024 (Eintragungsdatum)\n\nTBS - Technischer Bauservice UG (haftungsbeschränkt)\nGesellschaft mit beschränkter Haftung\nLüdenscheid\n\nDas Registergericht beabsichtigt die Gesellschaft von Amts wegen nach § 394 FamFG zu löschen. Die Frist zur Erhebung eines Widerspruchs ist auf zwei Monate festgesetzt."
    },
    {
      "date": "2024-12-09",
      "id": "95829",
      "original_text": "Löschungsankündigung\nNordrhein-Westfalen Amtsgericht Mönchengladbach HRB 997\nGEWEA Service GmbH – Mönchengladbach",
      "type": "Löschungsankündigung",
      "state": "Nordrhein-Westfalen",
      "amtsgericht": "Amtsgericht Mönchengladbach",
      "registernummer": "HRB 997",
      "registerart": "HRB",
      "company_name": "GEWEA Service GmbH",
      "company_seat": "Mönchengladbach",
      "details": "09.12.2024 (Bekanntmachungsdatum)\n\nNordrhein-Westfalen Amtsgericht Mönchengladbach HRB 997\nLöschungsankündigung\n\nGEWEA Service GmbH\nGesellschaft mit beschränkter Haftung\nMönchengladbach\n\nGEWEA Service GmbH, Mönchengladbach, (Amtsgericht Mönchengladbach, HRB 997).\nDas Registergericht beabsichtigt, die im Handelsregister eingetragene Gesellschaft gemäß § 394 Absatz 1 FamFG wegen Vermögenslosigkeit von Amts wegen zu löschen. Gegen diese Verfügung kann Widerspruch eingelegt werden. Die Frist zur Erhebung eines Widerspruchs gegen die beabsichtigte Löschung von Amts wegen ist auf drei Monate festgesetzt."
    },
    {
      "date": "2024-12-09",
      "id": "95830",
      "original_text": "Registerbekanntmachung nach dem Umwandlungsgesetz\nNordrhein-Westfalen Amtsgericht Köln HRB 112674\nbut green GmbH – Köln",
      "type": "Registerbekanntmachung nach dem Umwandlungsgesetz",
      "state": "Nordrhein-Westfalen",
      "amtsgericht": "Amtsgericht Köln",
      "registernummer": "HRB 112674",
      "registerart": "HRB",
      "company_name": "but green GmbH",
      "company_seat": "Köln",
      "details": "09.12.2024 (Bekanntmachungsdatum)\n\nNordrhein-Westfalen Amtsgericht Köln HRB 112674\nRegisterbekanntmachung nach dem Umwandlungsgesetz 09.12.2024 (Eintragungsdatum)\n\nbut green GmbH\nGesellschaft mit beschränkter Haftung\nKöln\n\nDen Gläubigern der an der Verschmelzung beteiligten Rechtsträger ist, wenn sie binnen sechs Monaten nach dem Tag, an dem die Eintragung der Verschmelzung in das Register des Sitzes desjenigen Rechtsträgers, dessen Gläubiger sie sind, nach § 19 Absatz 3 UmwG als bekanntgemacht gilt, ihren Anspruch nach Grund und Höhe schriftlich anmelden, Sicherheit zu leisten, soweit sie nicht Befriedigung verlangen können. Dieses Recht steht den Gläubigern jedoch nur zu, wenn sie glaubhaft machen, dass durch die Verschmelzung die Erfüllung ihrer Forderung gefährdet wird."
    },
    {
      "date": "2024-12-09",
      "id": "95831",
      "original_text": "Löschungsankündigung\nNordrhein-Westfalen Amtsgericht Köln HRB 77473\nDempack UG (haftungsbeschränkt) – Köln",
      "type": "Löschungsankündigung",
      "state": "Nordrhein-Westfalen",
      "amtsgericht": "Amtsgericht Köln",
      "registernummer": "HRB 77473",
      "registerart": "HRB",
      "company_name": "Dempack UG (haftungsbeschränkt)",
      "company_seat": "Köln",
      "details": "09.12.2024 (Bekanntmachungsdatum)\n\nNordrhein-Westfalen Amtsgericht Köln HRB 77473\nLöschungsankündigung\n\nDempack UG (haftungsbeschränkt)\nGesellschaft mit beschränkter Haftung\nKöln\n\nDas Registergericht beabsichtigt die Gesellschaft von Amts wegen nach § 394 FamFG zu löschen. Die Frist zur Erhebung eines Widerspruchs ist auf einen Monat festgesetzt."
    },
    {
      "date": "2024-12-09",
      "id": "95832",
      "original_text": "Einreichung neuer Dokumente\nNordrhein-Westfalen Amtsgericht Bonn HRB 10808\nEuskirchener Baugesellschaft mit beschränkter Haftung – Euskirchen",
      "type": "Einreichung neuer Dokumente",
      "state": "Nordrhein-Westfalen",
      "amtsgericht": "Amtsgericht Bonn",
      "registernummer": "HRB 10808",
      "registerart": "HRB",
      "company_name": "Euskirchener Baugesellschaft mit beschränkter Haftung",
      "company_seat": "Euskirchen",
      "details": "09.12.2024 (Bekanntmachungsdatum)\n\nNordrhein-Westfalen Amtsgericht Bonn HRB 10808\nEinreichung neuer Dokumente\n\nEuskirchener Baugesellschaft mit beschränkter Haftung\nGesellschaft mit beschränkter Haftung\nEuskirchen\n\nDem Registergericht ist eine neue Liste der Mitglieder des Aufsichtsrates eingereicht worden."
    },
    {
      "date": "2024-12-09",
      "id": "95833",
      "original_text": "Registerbekanntmachung nach dem Umwandlungsgesetz\nNordrhein-Westfalen Amtsgericht Duisburg HRB 38524\nLothar Schaff & Söhne GmbH – Mülheim an der Ruhr",
      "type": "Registerbekanntmachung nach dem Umwandlungsgesetz",
      "state": "Nordrhein-Westfalen",
      "amtsgericht": "Amtsgericht Duisburg",
      "registernummer": "HRB 38524",
      "registerart": "HRB",
      "company_name": "Lothar Schaff & Söhne GmbH",
      "company_seat": "Mülheim an der Ruhr",
      "details": "09.12.2024 (Bekanntmachungsdatum)\n\nNordrhein-Westfalen Amtsgericht Duisburg HRB 38524\nRegisterbekanntmachung nach dem Umwandlungsgesetz 09.12.2024 (Eintragungsdatum)\n\nLothar Schaff & Söhne GmbH\nGesellschaft mit beschränkter Haftung\nMülheim an der Ruhr\n\nDie Gesellschaft hat Gläubigern, deren Forderungen vor dieser Bekanntmachung begründet worden sind, Sicherheit zu leisten, soweit sie nicht Befriedigung verlangen können, wenn sie sich binnen sechs Monaten zu diesem Zweck melden."
    },
    {
      "date": "2024-12-09",
      "id": "95834",
      "original_text": "Einreichung neuer Dokumente\nThüringen Amtsgericht Jena HRB 301045\nCCS - Congress Centrum Suhl - Touristik und Congress GmbH – Suhl",
      "type": "Einreichung neuer Dokumente",
      "state": "Thüringen",
      "amtsgericht": "Amtsgericht Jena",
      "registernummer": "HRB 301045",
      "registerart": "HRB",
      "company_name": "CCS - Congress Centrum Suhl - Touristik und Congress GmbH",
      "company_seat": "Suhl",
      "details": "09.12.2024 (Bekanntmachungsdatum)\n\nThüringen Amtsgericht Jena HRB 301045\nEinreichung neuer Dokumente 09.12.2024 (Eintragungsdatum)\n\nCCS - Congress Centrum Suhl - Touristik und Congress GmbH\nGesellschaft mit beschränkter Haftung\nSuhl\n\nBekanntmachung gem. § 52 Abs. 3 Satz 2 GmbHG: Aufgrund einer Veränderung in den Personen der Aufsichtsratsmitglieder ist durch die Geschäftsführer eine neue Liste zum Handelsregister eingereicht worden."
    },
    {
      "date": "2024-12-09",
      "id": "95835",
      "original_text": "Löschungsankündigung\nHessen Amtsgericht Frankfurt am Main HRB 120689\nWerth-Immobilienmanagement GmbH – Frankfurt am Main",
      "type": "Löschungsankündigung",
      "state": "Hessen",
      "amtsgericht": "Amtsgericht Frankfurt am Main",
      "registernummer": "HRB 120689",
      "registerart": "HRB",
      "company_name": "Werth-Immobilienmanagement GmbH",
      "company_seat": "Frankfurt am Main",
      "details": "09.12.2024 (Bekanntmachungsdatum)\n\nHessen Amtsgericht Frankfurt am Main HRB 120689\nLöschungsankündigung 09.12.2024 (Eintragungsdatum)\n\nWerth-Immobilienmanagement GmbH\nGesellschaft mit beschränkter Haftung\nFrankfurt am Main\n\nDas Registergericht beabsichtigt die im Handelsregister eingetragene Gesellschaft von Amts wegen nach § 394 FamFG zu löschen. Die Frist zur Erhebung eines Widerspruchs gegen die beabsichtigte Löschung wird auf1 Monat festgesetzt."
    },
    {
      "date": "2024-12-09",
      "id": "95836",
      "original_text": "Löschungsankündigung\nHessen Amtsgericht Frankfurt am Main HRA 47785\nAdaMas 1 DE GmbH & Co. KG – Frankfurt am Main",
      "type": "Löschungsankündigung",
      "state": "Hessen",
      "amtsgericht": "Amtsgericht Frankfurt am Main",
      "registernummer": "HRA 47785",
      "registerart": "HRA",
      "company_name": "AdaMas 1 DE GmbH & Co. KG",
      "company_seat": "Frankfurt am Main",
      "details": "09.12.2024 (Bekanntmachungsdatum)\n\nHessen Amtsgericht Frankfurt am Main HRA 47785\nLöschungsankündigung 09.12.2024 (Eintragungsdatum)\n\nAdaMas 1 DE GmbH & Co. KG\nKommanditgesellschaft\nFrankfurt am Main\n\nDas Registergericht beabsichtigt die im Handelsregister eingetragene Firma von Amts wegen nach § 394 FamFG zu löschen. Die Frist zur Erhebung eines Widerspruchs gegen die beabsichtigte Löschung wird auf 1 Monat festgesetzt."
    },
    {
      "date": "2024-12-09",
      "id": "95837",
      "original_text": "Einreichung neuer Dokumente\nHessen Amtsgericht Wiesbaden HRB 28501\nAthora Deutschland Verwaltungs GmbH – Wiesbaden",
      "type": "Einreichung neuer Dokumente",
      "state": "Hessen",
      "amtsgericht": "Amtsgericht Wiesbaden",
      "registernummer": "HRB 28501",
      "registerart": "HRB",
      "company_name": "Athora Deutschland Verwaltungs GmbH",
      "company_seat": "Wiesbaden",
      "details": "09.12.2024 (Bekanntmachungsdatum)\n\nHessen Amtsgericht Wiesbaden HRB 28501\nEinreichung neuer Dokumente\n\nAthora Deutschland Verwaltungs GmbH\nGesellschaft mit beschränkter Haftung\nWiesbaden\n\nDurch eine Änderung in den Personen der Beiratsmitglieder ist eine Liste der Mitglieder des Beirates zum Handelsregister eingereicht worden."
    },
    {
      "date": "2024-12-09",
      "id": "95838",
      "original_text": "Sonstige Registerbekanntmachung\nHessen Amtsgericht Wiesbaden VR 5978\nmedFuture Verein zur Förderung des medizinischen Nachwuchses e.V. – Wiesbaden",
      "type": "Sonstige Registerbekanntmachung",
      "state": "Hessen",
      "amtsgericht": "Amtsgericht Wiesbaden",
      "registernummer": "VR 5978",
      "registerart": "VR",
      "company_name": "medFuture Verein zur Förderung des medizinischen Nachwuchses e.V.",
      "company_seat": "Wiesbaden",
      "details": "09.12.2024 (Bekanntmachungsdatum)\n\nHessen Amtsgericht Wiesbaden VR 5978\nSonstige Registerbekanntmachung 09.12.2024 (Eintragungsdatum)\n\nmedFuture Verein zur Förderung des medizinischen Nachwuchses e.V.\neingetragener Verein\nWiesbaden\n\nDer Verein ist aufgelöst."
    },
    {
      "date": "2024-12-09",
      "id": "95839",
      "original_text": "Einreichung neuer Dokumente\nHessen Amtsgericht Frankfurt am Main HRB 93206\nPrior Capital AG – Frankfurt am Main",
      "type": "Einreichung neuer Dokumente",
      "state": "Hessen",
      "amtsgericht": "Amtsgericht Frankfurt am Main",
      "registernummer": "HRB 93206",
      "registerart": "HRB",
      "company_name": "Prior Capital AG",
      "company_seat": "Frankfurt am Main",
      "details": "09.12.2024 (Bekanntmachungsdatum)\n\nHessen Amtsgericht Frankfurt am Main HRB 93206\nEinreichung neuer Dokumente 05.12.2024 (Eintragungsdatum)\n\nPrior Capital AG\nAktiengesellschaft\nFrankfurt am Main\n\nDurch eine Änderung in den Personen der Aufsichtsratsmitglieder ist eine Liste der Mitglieder des Aufsichtsrates zum Handelsregister eingereicht worden."
    },
    {
      "date": "2024-12-09",
      "id": "95840",
      "original_text": "Registerbekanntmachung nach dem Umwandlungsgesetz\nHessen Amtsgericht Darmstadt HRA 87507\nH. Can Elektrotechnik e. K., Inh. Hüseyin Can – Kelsterbach",
      "type": "Registerbekanntmachung nach dem Umwandlungsgesetz",
      "state": "Hessen",
      "amtsgericht": "Amtsgericht Darmstadt",
      "registernummer": "HRA 87507",
      "registerart": "HRA",
      "company_name": "H. Can Elektrotechnik e. K., Inh. Hüseyin Can",
      "company_seat": "Kelsterbach",
      "details": "09.12.2024 (Bekanntmachungsdatum)\n\nHessen Amtsgericht Darmstadt HRA 87507\nRegisterbekanntmachung nach dem Umwandlungsgesetz 09.12.2024 (Eintragungsdatum)\n\nH. Can Elektrotechnik e. K., Inh. Hüseyin Can\nEinzelkaufmann / Einzelkauffrau\nKelsterbach\n\nDen Gläubigern der an der Ausgliederung beteiligten Rechtsträger ist, wenn sie binnen sechs Monaten nach dem Tag, an dem die Eintragung der Ausgliederung in das Register des Sitzes derjenigen Rechtsträger deren Gläubiger sie sind, nach §§ 125, 19 Absatz 3 UmwG bekannt gemacht worden ist, ihren Anspruch nach Grund und Höhe schriftlich anmelden, Sicherheit zu leisten, soweit sie nicht Befriedigung verlangen können. Dieses Recht steht den Gläubigern jedoch nur zu, wenn sie glaubhaft machen, dass durch die Ausgliederung die Erfüllung ihrer Forderung gefährdet wird."
    },
    {
      "date": "2024-12-09",
      "id": "95841",
      "original_text": "Sonstige Registerbekanntmachung\nHessen Amtsgericht Wiesbaden HRB 10157\nAthora Deutschland Service GmbH – Wiesbaden",
      "type": "Sonstige Registerbekanntmachung",
      "state": "Hessen",
      "amtsgericht": "Amtsgericht Wiesbaden",
      "registernummer": "HRB 10157",
      "registerart": "HRB",
      "company_name": "Athora Deutschland Service GmbH",
      "company_seat": "Wiesbaden",
      "details": "09.12.2024 (Bekanntmachungsdatum)\n\nHessen Amtsgericht Wiesbaden HRB 10157\nSonstige Registerbekanntmachung 09.12.2024 (Eintragungsdatum)\n\nAthora Deutschland Service GmbH\nGesellschaft mit beschränkter Haftung\nWiesbaden\n\nDurch eine Änderung in den Personen der Beiratsmitglieder ist eine Liste der Mitglieder des Beirates zum Handelsregister eingereicht worden."
    },
    {
      "date": "2024-12-09",
      "id": "95842",
      "original_text": "Löschungsankündigung\nHessen Amtsgericht Wetzlar HRB 8519\nOArt GmbH – Haiger",
      "type": "Löschungsankündigung",
      "state": "Hessen",
      "amtsgericht": "Amtsgericht Wetzlar",
      "registernummer": "HRB 8519",
      "registerart": "HRB",
      "company_name": "OArt GmbH",
      "company_seat": "Haiger",
      "details": "09.12.2024 (Bekanntmachungsdatum)\n\nHessen Amtsgericht Wetzlar HRB 8519\nLöschungsankündigung\n\nOArt GmbH\nGesellschaft mit beschränkter Haftung\nHaiger\n\nDas Registergericht beabsichtigt die im Handelsregister eingetragene Gesellschaft von Amts wegen nach § 394 FamFG zu löschen. Die Frist zur Erhebung eines Widerspruchs gegen die beabsichtigte Löschung wird auf 3 Monate festgesetzt."
    },
    {
      "date": "2024-12-09",
      "id": "95843",
      "original_text": "Einreichung neuer Dokumente\nHessen Amtsgericht Frankfurt am Main HRB 54220\nDeutsche Immobilien Chancen AG & Co. Kommanditgesellschaft auf Aktien – Frankfurt am Main",
      "type": "Einreichung neuer Dokumente",
      "state": "Hessen",
      "amtsgericht": "Amtsgericht Frankfurt am Main",
      "registernummer": "HRB 54220",
      "registerart": "HRB",
      "company_name": "Deutsche Immobilien Chancen AG & Co. Kommanditgesellschaft auf Aktien",
      "company_seat": "Frankfurt am Main",
      "details": "09.12.2024 (Bekanntmachungsdatum)\n\nHessen Amtsgericht Frankfurt am Main HRB 54220\nEinreichung neuer Dokumente\n\nDeutsche Immobilien Chancen AG & Co. Kommanditgesellschaft auf Aktien\nKommanditgesellschaft auf Aktien\nFrankfurt am Main\n\nDurch eine Änderung in den Personen der Aufsichtsratsmitglieder ist eine Liste der Mitglieder des Aufsichtsrates zum Handelsregister eingereicht worden."
    },
    {
      "date": "2024-12-09",
      "id": "95844",
      "original_text": "Registerbekanntmachung nach dem Umwandlungsgesetz\nHessen Amtsgericht Frankfurt am Main HRB 134608\nMainsee 1544. V V GmbH – Frankfurt am Main",
      "type": "Registerbekanntmachung nach dem Umwandlungsgesetz",
      "state": "Hessen",
      "amtsgericht": "Amtsgericht Frankfurt am Main",
      "registernummer": "HRB 134608",
      "registerart": "HRB",
      "company_name": "Mainsee 1544. V V GmbH",
      "company_seat": "Frankfurt am Main",
      "details": "09.12.2024 (Bekanntmachungsdatum)\n\nHessen Amtsgericht Frankfurt am Main HRB 134608\nRegisterbekanntmachung nach dem Umwandlungsgesetz 09.12.2024 (Eintragungsdatum)\n\nMainsee 1544. V V GmbH\nGesellschaft mit beschränkter Haftung\nFrankfurt am Main\n\nDen Gläubigern der an der Verschmelzung beteiligten Rechtsträger ist, wenn sie binnen sechs Monaten nach dem Tag, an dem die Eintragung der Verschmelzung in das Register des Sitzes derjenigen Rechtsträger deren Gläubiger sie sind, nach § 19 Absatz 3 UmwG bekannt gemacht worden ist, ihren Anspruch nach Grund und Höhe schriftlich anmelden, Sicherheit zu leisten, soweit sie nicht Befriedigung verlangen können. Dieses Recht steht den Gläubigern jedoch nur zu, wenn sie glaubhaft machen, dass durch die Verschmelzung die Erfüllung ihrer Forderung gefährdet wird."
    },
    {
      "date": "2024-12-09",
      "id": "95845",
      "original_text": "Sonstige Registerbekanntmachung\nHessen Amtsgericht Frankfurt am Main HRB 9135\nDWS Investment GmbH – Frankfurt am Main",
      "type": "Sonstige Registerbekanntmachung",
      "state": "Hessen",
      "amtsgericht": "Amtsgericht Frankfurt am Main",
      "registernummer": "HRB 9135",
      "registerart": "HRB",
      "company_name": "DWS Investment GmbH",
      "company_seat": "Frankfurt am Main",
      "details": "09.12.2024 (Bekanntmachungsdatum)\n\nHessen Amtsgericht Frankfurt am Main HRB 9135\nSonstige Registerbekanntmachung\n\nDWS Investment GmbH\nGesellschaft mit beschränkter Haftung\nFrankfurt am Main\n\nDurch eine Änderung in den Personen der Aufsichtsratsmitglieder ist eine Liste der Mitglieder des Aufsichtsrates zum Handelsregister eingereicht worden."
    },
    {
      "date": "2024-12-09",
      "id": "95846",
      "original_text": "Registerbekanntmachung nach dem Umwandlungsgesetz\nHessen Amtsgericht Darmstadt HRA 87647\nElektro Can GmbH & Co. KG – Kelsterbach",
      "type": "Registerbekanntmachung nach dem Umwandlungsgesetz",
      "state": "Hessen",
      "amtsgericht": "Amtsgericht Darmstadt",
      "registernummer": "HRA 87647",
      "registerart": "HRA",
      "company_name": "Elektro Can GmbH & Co. KG",
      "company_seat": "Kelsterbach",
      "details": "09.12.2024 (Bekanntmachungsdatum)\n\nHessen Amtsgericht Darmstadt HRA 87647\nRegisterbekanntmachung nach dem Umwandlungsgesetz 09.12.2024 (Eintragungsdatum)\n\nElektro Can GmbH & Co. KG\nKommanditgesellschaft\nKelsterbach\n\nDen Gläubigern der an der Ausgliederung beteiligten Rechtsträger ist, wenn sie binnen sechs Monaten nach dem Tag, an dem die Eintragung der Ausgliederung in das Register des Sitzes derjenigen Rechtsträger deren Gläubiger sie sind, nach §§ 125, 19 Absatz 3 UmwG bekannt gemacht worden ist, ihren Anspruch nach Grund und Höhe schriftlich anmelden, Sicherheit zu leisten, soweit sie nicht Befriedigung verlangen können. Dieses Recht steht den Gläubigern jedoch nur zu, wenn sie glaubhaft machen, dass durch die Ausgliederung die Erfüllung ihrer Forderung gefährdet wird."
    },
    {
      "date": "2024-12-09",
      "id": "95847",
      "original_text": "Löschungsankündigung\nHessen Amtsgericht Frankfurt am Main HRB 78587\nKreativ GmbH – Frankfurt am Main",
      "type": "Löschungsankündigung",
      "state": "Hessen",
      "amtsgericht": "Amtsgericht Frankfurt am Main",
      "registernummer": "HRB 78587",
      "registerart": "HRB",
      "company_name": "Kreativ GmbH",
      "company_seat": "Frankfurt am Main",
      "details": "09.12.2024 (Bekanntmachungsdatum)\n\nHessen Amtsgericht Frankfurt am Main HRB 78587\nLöschungsankündigung\n\nKreativ GmbH\nGesellschaft mit beschränkter Haftung\nFrankfurt am Main\n\nDas Registergericht beabsichtigt die im Handelsregister eingetragene Gesellschaft von Amts wegen nach § 394 FamFG zu löschen. Die Frist zur Erhebung eines Widerspruchs gegen die beabsichtigte Löschung wird auf 1 Monat festgesetzt."
    },
    {
      "date": "2024-12-09",
      "id": "95848",
      "original_text": "Einreichung neuer Dokumente\nHessen Amtsgericht Frankfurt am Main HRB 6645\nHelvetia Versicherungs-Aktiengesellschaft – Frankfurt am Main",
      "type": "Einreichung neuer Dokumente",
      "state": "Hessen",
      "amtsgericht": "Amtsgericht Frankfurt am Main",
      "registernummer": "HRB 6645",
      "registerart": "HRB",
      "company_name": "Helvetia Versicherungs-Aktiengesellschaft",
      "company_seat": "Frankfurt am Main",
      "details": "09.12.2024 (Bekanntmachungsdatum)\n\nHessen Amtsgericht Frankfurt am Main HRB 6645\nEinreichung neuer Dokumente\n\nHelvetia Versicherungs-Aktiengesellschaft\nAktiengesellschaft\nFrankfurt am Main\n\nDurch eine Änderung in den Personen der Aufsichtsratsmitglieder ist eine Liste der Mitglieder des Aufsichtsrates zum Handelsregister eingereicht worden."
    },
    {
      "date": "2024-12-09",
      "id": "95849",
      "original_text": "Einreichung neuer Dokumente\nHessen Amtsgericht Frankfurt am Main HRB 55461\nLOGPAY Financial Services GmbH – Eschborn",
      "type": "Einreichung neuer Dokumente",
      "state": "Hessen",
      "amtsgericht": "Amtsgericht Frankfurt am Main",
      "registernummer": "HRB 55461",
      "registerart": "HRB",
      "company_name": "LOGPAY Financial Services GmbH",
      "company_seat": "Eschborn",
      "details": "09.12.2024 (Bekanntmachungsdatum)\n\nHessen Amtsgericht Frankfurt am Main HRB 55461\nEinreichung neuer Dokumente\n\nLOGPAY Financial Services GmbH\nGesellschaft mit beschränkter Haftung\nEschborn\n\nDurch eine Änderung in den Personen der Aufsichtsratsmitglieder ist eine Liste der Mitglieder des Aufsichtsrates zum Handelsregister eingereicht worden."
    },
    {
      "date": "2024-12-09",
      "id": "95850",
      "original_text": "Registerbekanntmachung nach dem Umwandlungsgesetz\nHessen Amtsgericht Gießen HRB 3038\nIfM Ingenieurbüro für Medizintechnik GmbH – Wettenberg",
      "type": "Registerbekanntmachung nach dem Umwandlungsgesetz",
      "state": "Hessen",
      "amtsgericht": "Amtsgericht Gießen",
      "registernummer": "HRB 3038",
      "registerart": "HRB",
      "company_name": "IfM Ingenieurbüro für Medizintechnik GmbH",
      "company_seat": "Wettenberg",
      "details": "09.12.2024 (Bekanntmachungsdatum)\n\nHessen Amtsgericht Gießen HRB 3038\nRegisterbekanntmachung nach dem Umwandlungsgesetz 09.12.2024 (Eintragungsdatum)\n\nIfM Ingenieurbüro für Medizintechnik GmbH\nGesellschaft mit beschränkter Haftung\nWettenberg\n\nDen Gläubigern der an der Verschmelzung beteiligten Rechtsträger ist, wenn sie binnen sechs Monaten nach dem Tag, an dem die Eintragung der Verschmelzung in das Register des Sitzes desjenigen Rechtsträgers, dessen Gläubiger sie sind, nach § 19 Absatz 3 UmwG bekannt gemacht worden ist, ihren Anspruch nach Grund und Höhe schriftlich anmelden, Sicherheit zu leisten, soweit sie nicht Befriedigung verlangen können. Dieses Recht steht den Gläubigern jedoch nur zu, wenn sie glaubhaft machen, dass durch die Verschmelzung die Erfüllung ihrer Forderung gefährdet wird."
    },
    {
      "date": "2024-12-09",
      "id": "95851",
      "original_text": "Löschungsankündigung\nHessen Amtsgericht Wiesbaden HRB 33963\nOPTICUM PRIME UG (haftungsbeschränkt) – Wiesbaden",
      "type": "Löschungsankündigung",
      "state": "Hessen",
      "amtsgericht": "Amtsgericht Wiesbaden",
      "registernummer": "HRB 33963",
      "registerart": "HRB",
      "company_name": "OPTICUM PRIME UG (haftungsbeschränkt)",
      "company_seat": "Wiesbaden",
      "details": "09.12.2024 (Bekanntmachungsdatum)\n\nHessen Amtsgericht Wiesbaden HRB 33963\nLöschungsankündigung\n\nOPTICUM PRIME UG (haftungsbeschränkt)\nGesellschaft mit beschränkter Haftung\nWiesbaden\n\nDas Registergericht beabsichtigt die im Handelsregister eingetragene Gesellschaft von Amts wegen nach § 394 FamFG zu löschen. Die Frist zur Erhebung eines Widerspruchs gegen die beabsichtigte Löschung wird auf 3 Monate festgesetzt."
    },
    {
      "date": "2024-12-09",
      "id": "95852",
      "original_text": "Löschungsankündigung\nHessen Amtsgericht Wiesbaden HRB 11269\nK & D Handelsgesellschaft mbH – Wiesbaden",
      "type": "Löschungsankündigung",
      "state": "Hessen",
      "amtsgericht": "Amtsgericht Wiesbaden",
      "registernummer": "HRB 11269",
      "registerart": "HRB",
      "company_name": "K & D Handelsgesellschaft mbH",
      "company_seat": "Wiesbaden",
      "details": "09.12.2024 (Bekanntmachungsdatum)\n\nHessen Amtsgericht Wiesbaden HRB 11269\nLöschungsankündigung\n\nK & D Handelsgesellschaft mbH\nGesellschaft mit beschränkter Haftung\nWiesbaden\n\nDas Registergericht beabsichtigt die im Handelsregister eingetragene Gesellschaft von Amts wegen nach § 394 FamFG zu löschen. Die Frist zur Erhebung eines Widerspruchs gegen die beabsichtigte Löschung wird auf 3 Monate festgesetzt."
    }
  ]
}