{
  "date": "2024-12-20",
  "date_of_scrape": "2024-12-21T04:08:11.774Z",
  "tool_version": "0.2.0",
  "number_of_announcements": 114,
  "announcements": [
    {
      "date": "2024-12-20",
      "id": "68",
      "original_text": "Sonderregisterbekanntmachung OHNE Bezug zum elektr. Register\nSachsen-Anhalt Amtsgericht Stendal\n65 AR 551/15\nLPG \"Oskar Schneller\" Mansfeld",
      "type": "Sonderregisterbekanntmachung OHNE Bezug zum elektr. Register",
      "state": "Sachsen-Anhalt",
      "amtsgericht": "Amtsgericht Stendal",
      "company_name": "LPG \"Oskar Schneller\" Mansfeld",
      "sonderegister_referenz": "65 AR 551/15",
      "details": "20.12.2024 (Bekanntmachungsdatum)\n\nSachsen-Anhalt Amtsgericht Stendal\n65 AR 551/15\nSonderregisterbekanntmachung OHNE Bezug zum elektr. Register\n\nLPG \"Oskar Schneller\" Mansfeld\n\nHinsichtlich der o.g. Genossenschaft LPG \"Oskar Scheller\" Mansfeld ist beabsichtigt, Herrn Michael Römermann, wh. in Klostermansfeld, zum Nachtragsliquidator mit dem beschränkten Wirkungskreis für das Gebäudeeigentum verzeichnet im Grundbuch des Amtsgerichts Eisleben von Mansfeld Blatt 3044, Gemarkung Mansfeld, zu bestellen. Das Gebäudeeigentum besteht aus: Geflügelhalle III mit einer Länge von 47,60 m und einer Breite von 12,80 m. Die Frist zur Einreichung etwaiger Stellungnahmen bzw. Erhebung eines Widerspruchs wird auf 3 Monate festgesetzt."
    },
    {
      "date": "2024-12-20",
      "id": "97110",
      "original_text": "Registerbekanntmachung nach dem Umwandlungsgesetz\nBayern Amtsgericht Nürnberg HRA 61\nBorchert & Schultheiß e.K. – Nürnberg",
      "type": "Registerbekanntmachung nach dem Umwandlungsgesetz",
      "state": "Bayern",
      "amtsgericht": "Amtsgericht Nürnberg",
      "registernummer": "HRA 61",
      "registerart": "HRA",
      "company_name": "Borchert & Schultheiß e.K.",
      "company_seat": "Nürnberg",
      "details": "20.12.2024 (Bekanntmachungsdatum)\n\nBayern Amtsgericht Nürnberg HRA 61\nRegisterbekanntmachung nach dem Umwandlungsgesetz 19.12.2024 (Eintragungsdatum)\n\nBorchert & Schultheiß e.K.\nEinzelkaufmann / Einzelkauffrau\nNürnberg\n\nDen Gläubigern der an der Ausgliederung beteiligten Rechtsträger ist, wenn sie binnen sechs Monaten nach dem Tag, an dem die Eintragung der Ausgliederung in das Register des Sitzes desjenigen Rechtsträgers, dessen Gläubiger sie sind, nach §§ 125, 19 Abs. 3 UmwG als bekannt gemacht gilt, ihren Anspruch nach Grund und Höhe schriftlich anmelden, Sicherheit zu leisten, soweit sie nicht Befriedigung verlangen können. Dieses Recht steht den Gläubigern jedoch nur zu, wenn sie glaubhaft machen, dass durch die Ausgliederung die Erfüllung ihrer Forderung gefährdet wird."
    },
    {
      "date": "2024-12-20",
      "id": "97111",
      "original_text": "Registerbekanntmachung nach dem Umwandlungsgesetz\nBayern Amtsgericht Nürnberg HRB 32906\nFAI Aviation Group Holding GmbH – Nürnberg",
      "type": "Registerbekanntmachung nach dem Umwandlungsgesetz",
      "state": "Bayern",
      "amtsgericht": "Amtsgericht Nürnberg",
      "registernummer": "HRB 32906",
      "registerart": "HRB",
      "company_name": "FAI Aviation Group Holding GmbH",
      "company_seat": "Nürnberg",
      "details": "20.12.2024 (Bekanntmachungsdatum)\n\nBayern Amtsgericht Nürnberg HRB 32906\nRegisterbekanntmachung nach dem Umwandlungsgesetz 19.12.2024 (Eintragungsdatum)\n\nFAI Aviation Group Holding GmbH\nGesellschaft mit beschränkter Haftung\nNürnberg\n\nDen Gläubigern der an der Spaltung beteiligten Rechtsträger ist, wenn sie binnen sechs Monaten nach dem Tag, an dem die Eintragung der Spaltung in das Register des Sitzes desjenigen Rechtsträgers, dessen Gläubiger sie sind, nach §§ 125, 19 Abs. 3 UmwG als bekannt gemacht gilt, ihren Anspruch nach Grund und Höhe schriftlich anmelden, Sicherheit zu leisten, soweit sie nicht Befriedigung verlangen können. Dieses Recht steht den Gläubigern jedoch nur zu, wenn sie glaubhaft machen, dass durch die Spaltung die Erfüllung ihrer Forderung gefährdet wird."
    },
    {
      "date": "2024-12-20",
      "id": "97112",
      "original_text": "Registerbekanntmachung nach dem Umwandlungsgesetz\nBayern Amtsgericht Regensburg HRB 18409\nMOTUS UG (haftungsbeschränkt) – Zeitlarn",
      "type": "Registerbekanntmachung nach dem Umwandlungsgesetz",
      "state": "Bayern",
      "amtsgericht": "Amtsgericht Regensburg",
      "registernummer": "HRB 18409",
      "registerart": "HRB",
      "company_name": "MOTUS UG (haftungsbeschränkt)",
      "company_seat": "Zeitlarn",
      "details": "20.12.2024 (Bekanntmachungsdatum)\n\nBayern Amtsgericht Regensburg HRB 18409\nRegisterbekanntmachung nach dem Umwandlungsgesetz 19.12.2024 (Eintragungsdatum)\n\nMOTUS UG (haftungsbeschränkt)\nGesellschaft mit beschränkter Haftung\nZeitlarn\n\nDen Gläubigern des formwechselnden Rechtsträgers ist, wenn sie binnen sechs Monaten nach dem Tag, an dem die Eintragung des Formwechsels nach § 201 UmwG als bekannt gemacht gilt, ihren Anspruch nach Grund und Höhe schriftlich anmelden, Sicherheit zu leisten, soweit sie nicht Befriedigung verlangen können. Dieses Recht steht den Gläubigern jedoch nur zu, wenn sie glaubhaft machen, dass durch den Formwechsel die Erfüllung ihrer Forderung gefährdet wird."
    },
    {
      "date": "2024-12-20",
      "id": "97113",
      "original_text": "Registerbekanntmachung nach dem Umwandlungsgesetz\nBayern Amtsgericht München HRB 202439\nSTADT MORGEN Holding GmbH – Grünwald",
      "type": "Registerbekanntmachung nach dem Umwandlungsgesetz",
      "state": "Bayern",
      "amtsgericht": "Amtsgericht München",
      "registernummer": "HRB 202439",
      "registerart": "HRB",
      "company_name": "STADT MORGEN Holding GmbH",
      "company_seat": "Grünwald",
      "details": "20.12.2024 (Bekanntmachungsdatum)\n\nBayern Amtsgericht München HRB 202439\nRegisterbekanntmachung nach dem Umwandlungsgesetz 19.12.2024 (Eintragungsdatum)\n\nSTADT MORGEN Holding GmbH\nGesellschaft mit beschränkter Haftung\nGrünwald\n\nDen Gläubigern der an der Ausgliederung beteiligten Rechtsträger ist, wenn sie binnen sechs Monaten nach dem Tag, an dem die Eintragung der Ausgliederung in das Register des Sitzes desjenigen Rechtsträgers, dessen Gläubiger sie sind, nach §§ 125, 19 Abs. 3 UmwG als bekannt gemacht gilt, ihren Anspruch nach Grund und Höhe schriftlich anmelden, Sicherheit zu leisten, soweit sie nicht Befriedigung verlangen können. Dieses Recht steht den Gläubigern jedoch nur zu, wenn sie glaubhaft machen, dass durch die Ausgliederung die Erfüllung ihrer Forderung gefährdet wird."
    },
    {
      "date": "2024-12-20",
      "id": "97114",
      "original_text": "Registerbekanntmachung nach dem Umwandlungsgesetz\nBayern Amtsgericht Würzburg HRB 10334\nDLKM Service GmbH – Iphofen",
      "type": "Registerbekanntmachung nach dem Umwandlungsgesetz",
      "state": "Bayern",
      "amtsgericht": "Amtsgericht Würzburg",
      "registernummer": "HRB 10334",
      "registerart": "HRB",
      "company_name": "DLKM Service GmbH",
      "company_seat": "Iphofen",
      "details": "20.12.2024 (Bekanntmachungsdatum)\n\nBayern Amtsgericht Würzburg HRB 10334\nRegisterbekanntmachung nach dem Umwandlungsgesetz 19.12.2024 (Eintragungsdatum)\n\nDLKM Service GmbH\nGesellschaft mit beschränkter Haftung\nIphofen\n\nDen Gläubigern der an der Verschmelzung beteiligten Rechtsträger ist, wenn sie binnen sechs Monaten nach dem Tag, an dem die Eintragung der Verschmelzung in das Register des Sitzes desjenigen Rechtsträgers, dessen Gläubiger sie sind, nach § 19 Abs. 3 UmwG als bekannt gemacht gilt, ihren Anspruch nach Grund und Höhe schriftlich anmelden, Sicherheit zu leisten, soweit sie nicht Befriedigung verlangen können. Dieses Recht steht den Gläubigern jedoch nur zu, wenn sie glaubhaft machen, dass durch die Verschmelzung die Erfüllung ihrer Forderung gefährdet wird."
    },
    {
      "date": "2024-12-20",
      "id": "97115",
      "original_text": "Registerbekanntmachung nach dem Umwandlungsgesetz\nBayern Amtsgericht Nürnberg HRB 31704\nKlein GmbH – Deining",
      "type": "Registerbekanntmachung nach dem Umwandlungsgesetz",
      "state": "Bayern",
      "amtsgericht": "Amtsgericht Nürnberg",
      "registernummer": "HRB 31704",
      "registerart": "HRB",
      "company_name": "Klein GmbH",
      "company_seat": "Deining",
      "details": "20.12.2024 (Bekanntmachungsdatum)\n\nBayern Amtsgericht Nürnberg HRB 31704\nRegisterbekanntmachung nach dem Umwandlungsgesetz 19.12.2024 (Eintragungsdatum)\n\nKlein GmbH\nGesellschaft mit beschränkter Haftung\nDeining\n\nDen Gläubigern der an der Verschmelzung beteiligten Rechtsträger ist, wenn sie binnen sechs Monaten nach dem Tag, an dem die Eintragung der Verschmelzung in das Register des Sitzes desjenigen Rechtsträgers, dessen Gläubiger sie sind, nach § 19 Abs. 3 UmwG als bekannt gemacht gilt, ihren Anspruch nach Grund und Höhe schriftlich anmelden, Sicherheit zu leisten, soweit sie nicht Befriedigung verlangen können. Dieses Recht steht den Gläubigern jedoch nur zu, wenn sie glaubhaft machen, dass durch die Verschmelzung die Erfüllung ihrer Forderung gefährdet wird."
    },
    {
      "date": "2024-12-20",
      "id": "97116",
      "original_text": "Registerbekanntmachung nach dem Umwandlungsgesetz\nBayern Amtsgericht Nürnberg HRA 15320\nDi Dio Fisch OHG – Nürnberg",
      "type": "Registerbekanntmachung nach dem Umwandlungsgesetz",
      "state": "Bayern",
      "amtsgericht": "Amtsgericht Nürnberg",
      "registernummer": "HRA 15320",
      "registerart": "HRA",
      "company_name": "Di Dio Fisch OHG",
      "company_seat": "Nürnberg",
      "details": "20.12.2024 (Bekanntmachungsdatum)\n\nBayern Amtsgericht Nürnberg HRA 15320\nRegisterbekanntmachung nach dem Umwandlungsgesetz 19.12.2024 (Eintragungsdatum)\n\nDi Dio Fisch OHG\nOffene Handelsgesellschaft\nNürnberg\n\nDen Gläubigern des formwechselnden Rechtsträgers ist, wenn sie binnen sechs Monaten nach dem Tag, an dem die Eintragung des Formwechsels nach § 201 UmwG als bekannt gemacht gilt, ihren Anspruch nach Grund und Höhe schriftlich anmelden, Sicherheit zu leisten, soweit sie nicht Befriedigung verlangen können. Dieses Recht steht den Gläubigern jedoch nur zu, wenn sie glaubhaft machen, dass durch den Formwechsel die Erfüllung ihrer Forderung gefährdet wird."
    },
    {
      "date": "2024-12-20",
      "id": "97117",
      "original_text": "Löschungsankündigung\nBayern Amtsgericht Augsburg VR 201947\nf.s.f. & Co e.V. – Landsberg am Lech",
      "type": "Löschungsankündigung",
      "state": "Bayern",
      "amtsgericht": "Amtsgericht Augsburg",
      "registernummer": "VR 201947",
      "registerart": "VR",
      "company_name": "f.s.f. & Co e.V.",
      "company_seat": "Landsberg am Lech",
      "details": "20.12.2024 (Bekanntmachungsdatum)\n\nBayern Amtsgericht Augsburg VR 201947\nLöschungsankündigung\n\nf.s.f. & Co e.V.\neingetragener Verein\nLandsberg am Lech\n\nDas Registergericht beabsichtigt, den im Vereinsregister eingetragenen Verein von Amts wegen nach § 395 FamFG zu löschen. Die Frist zur Erhebung eines Widerspruchs ist auf einen Monat festgesetzt."
    },
    {
      "date": "2024-12-20",
      "id": "97118",
      "original_text": "Registerbekanntmachung nach dem Umwandlungsgesetz\nBayern Amtsgericht Passau HRB 10377\nDVS Verwaltungs-GmbH – Passau",
      "type": "Registerbekanntmachung nach dem Umwandlungsgesetz",
      "state": "Bayern",
      "amtsgericht": "Amtsgericht Passau",
      "registernummer": "HRB 10377",
      "registerart": "HRB",
      "company_name": "DVS Verwaltungs-GmbH",
      "company_seat": "Passau",
      "details": "20.12.2024 (Bekanntmachungsdatum)\n\nBayern Amtsgericht Passau HRB 10377\nRegisterbekanntmachung nach dem Umwandlungsgesetz 19.12.2024 (Eintragungsdatum)\n\nDVS Verwaltungs-GmbH\nGesellschaft mit beschränkter Haftung\nPassau\n\nDen Gläubigern der an der Verschmelzung beteiligten Rechtsträger ist, wenn sie binnen sechs Monaten nach dem Tag, an dem die Eintragung der Verschmelzung in das Register des Sitzes desjenigen Rechtsträgers, dessen Gläubiger sie sind, nach § 19 Abs. 3 UmwG als bekannt gemacht gilt, ihren Anspruch nach Grund und Höhe schriftlich anmelden, Sicherheit zu leisten, soweit sie nicht Befriedigung verlangen können. Dieses Recht steht den Gläubigern jedoch nur zu, wenn sie glaubhaft machen, dass durch die Verschmelzung die Erfüllung ihrer Forderung gefährdet wird."
    },
    {
      "date": "2024-12-20",
      "id": "97119",
      "original_text": "Registerbekanntmachung nach dem Umwandlungsgesetz\nBayern Amtsgericht München HRB 160204\nCHORUS CleanTech Management GmbH – Neubiberg",
      "type": "Registerbekanntmachung nach dem Umwandlungsgesetz",
      "state": "Bayern",
      "amtsgericht": "Amtsgericht München",
      "registernummer": "HRB 160204",
      "registerart": "HRB",
      "company_name": "CHORUS CleanTech Management GmbH",
      "company_seat": "Neubiberg",
      "details": "20.12.2024 (Bekanntmachungsdatum)\n\nBayern Amtsgericht München HRB 160204\nRegisterbekanntmachung nach dem Umwandlungsgesetz 19.12.2024 (Eintragungsdatum)\n\nCHORUS CleanTech Management GmbH\nGesellschaft mit beschränkter Haftung\nNeubiberg\n\nDen Gläubigern der an der Verschmelzung beteiligten Rechtsträger ist, wenn sie binnen sechs Monaten nach dem Tag, an dem die Eintragung der Verschmelzung in das Register des Sitzes desjenigen Rechtsträgers, dessen Gläubiger sie sind, nach § 19 Abs. 3 UmwG als bekannt gemacht gilt, ihren Anspruch nach Grund und Höhe schriftlich anmelden, Sicherheit zu leisten, soweit sie nicht Befriedigung verlangen können. Dieses Recht steht den Gläubigern jedoch nur zu, wenn sie glaubhaft machen, dass durch die Verschmelzung die Erfüllung ihrer Forderung gefährdet wird."
    },
    {
      "date": "2024-12-20",
      "id": "97120",
      "original_text": "Einreichung neuer Dokumente\nBayern Amtsgericht München HRB 179913\nPC Asset Management AG – Grünwald",
      "type": "Einreichung neuer Dokumente",
      "state": "Bayern",
      "amtsgericht": "Amtsgericht München",
      "registernummer": "HRB 179913",
      "registerart": "HRB",
      "company_name": "PC Asset Management AG",
      "company_seat": "Grünwald",
      "details": "20.12.2024 (Bekanntmachungsdatum)\n\nBayern Amtsgericht München HRB 179913\nEinreichung neuer Dokumente\n\nPC Asset Management AG\nAktiengesellschaft\nGrünwald\n\nDem Amtsgericht München -Registergericht- ist eine Liste der Mitglieder des Aufsichtsrats eingereicht worden, § 106 AktG."
    },
    {
      "date": "2024-12-20",
      "id": "97121",
      "original_text": "Löschungsankündigung\nBayern Amtsgericht München HRB 272843\nAsteca Trade UG (haftungsbeschränkt) – München",
      "type": "Löschungsankündigung",
      "state": "Bayern",
      "amtsgericht": "Amtsgericht München",
      "registernummer": "HRB 272843",
      "registerart": "HRB",
      "company_name": "Asteca Trade UG (haftungsbeschränkt)",
      "company_seat": "München",
      "details": "20.12.2024 (Bekanntmachungsdatum)\n\nBayern Amtsgericht München HRB 272843\nLöschungsankündigung 19.12.2024 (Eintragungsdatum)\n\nAsteca Trade UG (haftungsbeschränkt)\nGesellschaft mit beschränkter Haftung\nMünchen\n\nDas Registergericht beabsichtigt, die im Handelsregister eingetragene Gesellschaft wegen Vermögenslosigkeit von Amts wegen nach § 394 FamFG zu löschen. Die Frist zur Erhebung eines Widerspruchs ist auf drei Monate festgesetzt."
    },
    {
      "date": "2024-12-20",
      "id": "97122",
      "original_text": "Registerbekanntmachung nach dem Umwandlungsgesetz\nBayern Amtsgericht München HRB 298484\nEurowind GmbH – München",
      "type": "Registerbekanntmachung nach dem Umwandlungsgesetz",
      "state": "Bayern",
      "amtsgericht": "Amtsgericht München",
      "registernummer": "HRB 298484",
      "registerart": "HRB",
      "company_name": "Eurowind GmbH",
      "company_seat": "München",
      "details": "20.12.2024 (Bekanntmachungsdatum)\n\nBayern Amtsgericht München HRB 298484\nRegisterbekanntmachung nach dem Umwandlungsgesetz 19.12.2024 (Eintragungsdatum)\n\nEurowind GmbH\nGesellschaft mit beschränkter Haftung\nMünchen\n\nDen Gläubigern des formwechselnden Rechtsträgers ist, wenn sie binnen sechs Monaten nach dem Tag, an dem die Eintragung des Formwechsels nach § 201 UmwG als bekannt gemacht gilt, ihren Anspruch nach Grund und Höhe schriftlich anmelden, Sicherheit zu leisten, soweit sie nicht Befriedigung verlangen können. Dieses Recht steht den Gläubigern jedoch nur zu, wenn sie glaubhaft machen, dass durch den Formwechsel die Erfüllung ihrer Forderung gefährdet wird."
    },
    {
      "date": "2024-12-20",
      "id": "97123",
      "original_text": "Registerbekanntmachung nach dem Umwandlungsgesetz\nBayern Amtsgericht München HRB 159572\nDorsch International Consultants GmbH – München",
      "type": "Registerbekanntmachung nach dem Umwandlungsgesetz",
      "state": "Bayern",
      "amtsgericht": "Amtsgericht München",
      "registernummer": "HRB 159572",
      "registerart": "HRB",
      "company_name": "Dorsch International Consultants GmbH",
      "company_seat": "München",
      "details": "20.12.2024 (Bekanntmachungsdatum)\n\nBayern Amtsgericht München HRB 159572\nRegisterbekanntmachung nach dem Umwandlungsgesetz 19.12.2024 (Eintragungsdatum)\n\nDorsch International Consultants GmbH\nGesellschaft mit beschränkter Haftung\nMünchen\n\nDen Gläubigern der an der Verschmelzung beteiligten Rechtsträger ist, wenn sie binnen sechs Monaten nach dem Tag, an dem die Eintragung der Verschmelzung in das Register des Sitzes desjenigen Rechtsträgers, dessen Gläubiger sie sind, nach § 19 Abs. 3 UmwG als bekannt gemacht gilt, ihren Anspruch nach Grund und Höhe schriftlich anmelden, Sicherheit zu leisten, soweit sie nicht Befriedigung verlangen können. Dieses Recht steht den Gläubigern jedoch nur zu, wenn sie glaubhaft machen, dass durch die Verschmelzung die Erfüllung ihrer Forderung gefährdet wird."
    },
    {
      "date": "2024-12-20",
      "id": "97124",
      "original_text": "Registerbekanntmachung nach dem Umwandlungsgesetz\nBayern Amtsgericht Passau HRA 6316\nJosef Paul GmbH & Co. KG – Vilshofen",
      "type": "Registerbekanntmachung nach dem Umwandlungsgesetz",
      "state": "Bayern",
      "amtsgericht": "Amtsgericht Passau",
      "registernummer": "HRA 6316",
      "registerart": "HRA",
      "company_name": "Josef Paul GmbH & Co. KG",
      "company_seat": "Vilshofen",
      "details": "20.12.2024 (Bekanntmachungsdatum)\n\nBayern Amtsgericht Passau HRA 6316\nRegisterbekanntmachung nach dem Umwandlungsgesetz 19.12.2024 (Eintragungsdatum)\n\nJosef Paul GmbH & Co. KG\nKommanditgesellschaft\nVilshofen\n\nDen Gläubigern der an der Verschmelzung beteiligten Rechtsträger ist, wenn sie binnen sechs Monaten nach dem Tag, an dem die Eintragung der Verschmelzung in das Register des Sitzes desjenigen Rechtsträgers, dessen Gläubiger sie sind, nach § 19 Abs. 3 UmwG als bekannt gemacht gilt, ihren Anspruch nach Grund und Höhe schriftlich anmelden, Sicherheit zu leisten, soweit sie nicht Befriedigung verlangen können. Dieses Recht steht den Gläubigern jedoch nur zu, wenn sie glaubhaft machen, dass durch die Verschmelzung die Erfüllung ihrer Forderung gefährdet wird."
    },
    {
      "date": "2024-12-20",
      "id": "97125",
      "original_text": "Registerbekanntmachung nach dem Umwandlungsgesetz\nBayern Amtsgericht Passau HRB 12581\nParadieswerkstatt GmbH – Passau",
      "type": "Registerbekanntmachung nach dem Umwandlungsgesetz",
      "state": "Bayern",
      "amtsgericht": "Amtsgericht Passau",
      "registernummer": "HRB 12581",
      "registerart": "HRB",
      "company_name": "Paradieswerkstatt GmbH",
      "company_seat": "Passau",
      "details": "20.12.2024 (Bekanntmachungsdatum)\n\nBayern Amtsgericht Passau HRB 12581\nRegisterbekanntmachung nach dem Umwandlungsgesetz 19.12.2024 (Eintragungsdatum)\n\nParadieswerkstatt GmbH\nGesellschaft mit beschränkter Haftung\nPassau\n\nDen Gläubigern der an der Ausgliederung beteiligten Rechtsträger ist, wenn sie binnen sechs Monaten nach dem Tag, an dem die Eintragung der Ausgliederung in das Register des Sitzes desjenigen Rechtsträgers, dessen Gläubiger sie sind, nach §§ 125, 19 Abs. 3 UmwG als bekannt gemacht gilt, ihren Anspruch nach Grund und Höhe schriftlich anmelden, Sicherheit zu leisten, soweit sie nicht Befriedigung verlangen können. Dieses Recht steht den Gläubigern jedoch nur zu, wenn sie glaubhaft machen, dass durch die Ausgliederung die Erfüllung ihrer Forderung gefährdet wird."
    },
    {
      "date": "2024-12-20",
      "id": "97126",
      "original_text": "Registerbekanntmachung nach dem Umwandlungsgesetz\nBayern Amtsgericht München HRB 237213\nBüchelhofer Asset Management GmbH – München",
      "type": "Registerbekanntmachung nach dem Umwandlungsgesetz",
      "state": "Bayern",
      "amtsgericht": "Amtsgericht München",
      "registernummer": "HRB 237213",
      "registerart": "HRB",
      "company_name": "Büchelhofer Asset Management GmbH",
      "company_seat": "München",
      "details": "20.12.2024 (Bekanntmachungsdatum)\n\nBayern Amtsgericht München HRB 237213\nRegisterbekanntmachung nach dem Umwandlungsgesetz 19.12.2024 (Eintragungsdatum)\n\nBüchelhofer Asset Management GmbH\nGesellschaft mit beschränkter Haftung\nMünchen\n\nDen Gläubigern der an der Verschmelzung beteiligten Rechtsträger ist, wenn sie binnen sechs Monaten nach dem Tag, an dem die Eintragung der Verschmelzung in das Register des Sitzes desjenigen Rechtsträgers, dessen Gläubiger sie sind, nach § 19 Abs. 3 UmwG als bekannt gemacht gilt, ihren Anspruch nach Grund und Höhe schriftlich anmelden, Sicherheit zu leisten, soweit sie nicht Befriedigung verlangen können. Dieses Recht steht den Gläubigern jedoch nur zu, wenn sie glaubhaft machen, dass durch die Verschmelzung die Erfüllung ihrer Forderung gefährdet wird."
    },
    {
      "date": "2024-12-20",
      "id": "97127",
      "original_text": "Löschungsankündigung\nBayern Amtsgericht Traunstein HRB 25444\nblue orange services GmbH – Bad Reichenhall",
      "type": "Löschungsankündigung",
      "state": "Bayern",
      "amtsgericht": "Amtsgericht Traunstein",
      "registernummer": "HRB 25444",
      "registerart": "HRB",
      "company_name": "blue orange services GmbH",
      "company_seat": "Bad Reichenhall",
      "details": "20.12.2024 (Bekanntmachungsdatum)\n\nBayern Amtsgericht Traunstein HRB 25444\nLöschungsankündigung\n\nblue orange services GmbH\nGesellschaft mit beschränkter Haftung\nBad Reichenhall\n\nDas Registergericht beabsichtigt, die im Handelsregister eingetragene Gesellschaft wegen Vermögenslosigkeit von Amts wegen nach § 394 FamFG zu löschen. Die Frist zur Erhebung eines Widerspruchs ist auf einen Monat festgesetzt."
    },
    {
      "date": "2024-12-20",
      "id": "97128",
      "original_text": "Registerbekanntmachung nach dem Umwandlungsgesetz\nBayern Amtsgericht München HRB 282603\nPNZ A23 Beteiligungs GmbH – München",
      "type": "Registerbekanntmachung nach dem Umwandlungsgesetz",
      "state": "Bayern",
      "amtsgericht": "Amtsgericht München",
      "registernummer": "HRB 282603",
      "registerart": "HRB",
      "company_name": "PNZ A23 Beteiligungs GmbH",
      "company_seat": "München",
      "details": "20.12.2024 (Bekanntmachungsdatum)\n\nBayern Amtsgericht München HRB 282603\nRegisterbekanntmachung nach dem Umwandlungsgesetz 19.12.2024 (Eintragungsdatum)\n\nPNZ A23 Beteiligungs GmbH\nGesellschaft mit beschränkter Haftung\nMünchen\n\nDen Gläubigern der an der Verschmelzung beteiligten Rechtsträger ist, wenn sie binnen sechs Monaten nach dem Tag, an dem die Eintragung der Verschmelzung in das Register des Sitzes desjenigen Rechtsträgers, dessen Gläubiger sie sind, nach § 19 Abs. 3 UmwG als bekannt gemacht gilt, ihren Anspruch nach Grund und Höhe schriftlich anmelden, Sicherheit zu leisten, soweit sie nicht Befriedigung verlangen können. Dieses Recht steht den Gläubigern jedoch nur zu, wenn sie glaubhaft machen, dass durch die Verschmelzung die Erfüllung ihrer Forderung gefährdet wird."
    },
    {
      "date": "2024-12-20",
      "id": "97129",
      "original_text": "Registerbekanntmachung nach dem Umwandlungsgesetz\nBayern Amtsgericht Nürnberg HRB 12317\nBorchert & Schultheiss Haustechnische Handels- und Service GmbH – Nürnberg",
      "type": "Registerbekanntmachung nach dem Umwandlungsgesetz",
      "state": "Bayern",
      "amtsgericht": "Amtsgericht Nürnberg",
      "registernummer": "HRB 12317",
      "registerart": "HRB",
      "company_name": "Borchert & Schultheiss Haustechnische Handels- und Service GmbH",
      "company_seat": "Nürnberg",
      "details": "20.12.2024 (Bekanntmachungsdatum)\n\nBayern Amtsgericht Nürnberg HRB 12317\nRegisterbekanntmachung nach dem Umwandlungsgesetz 19.12.2024 (Eintragungsdatum)\n\nBorchert & Schultheiss Haustechnische Handels- und Service GmbH\nGesellschaft mit beschränkter Haftung\nNürnberg\n\nDen Gläubigern der an der Ausgliederung beteiligten Rechtsträger ist, wenn sie binnen sechs Monaten nach dem Tag, an dem die Eintragung der Ausgliederung in das Register des Sitzes desjenigen Rechtsträgers, dessen Gläubiger sie sind, nach §§ 125, 19 Abs. 3 UmwG als bekannt gemacht gilt, ihren Anspruch nach Grund und Höhe schriftlich anmelden, Sicherheit zu leisten, soweit sie nicht Befriedigung verlangen können. Dieses Recht steht den Gläubigern jedoch nur zu, wenn sie glaubhaft machen, dass durch die Ausgliederung die Erfüllung ihrer Forderung gefährdet wird."
    },
    {
      "date": "2024-12-20",
      "id": "97130",
      "original_text": "Registerbekanntmachung nach dem Umwandlungsgesetz\nBayern Amtsgericht Nürnberg HRB 32129\ncargo support Service GmbH – Nürnberg",
      "type": "Registerbekanntmachung nach dem Umwandlungsgesetz",
      "state": "Bayern",
      "amtsgericht": "Amtsgericht Nürnberg",
      "registernummer": "HRB 32129",
      "registerart": "HRB",
      "company_name": "cargo support Service GmbH",
      "company_seat": "Nürnberg",
      "details": "20.12.2024 (Bekanntmachungsdatum)\n\nBayern Amtsgericht Nürnberg HRB 32129\nRegisterbekanntmachung nach dem Umwandlungsgesetz 19.12.2024 (Eintragungsdatum)\n\ncargo support Service GmbH\nGesellschaft mit beschränkter Haftung\nNürnberg\n\nDen Gläubigern der an der Verschmelzung beteiligten Rechtsträger ist, wenn sie binnen sechs Monaten nach dem Tag, an dem die Eintragung der Verschmelzung in das Register des Sitzes desjenigen Rechtsträgers, dessen Gläubiger sie sind, nach § 19 Abs. 3 UmwG als bekannt gemacht gilt, ihren Anspruch nach Grund und Höhe schriftlich anmelden, Sicherheit zu leisten, soweit sie nicht Befriedigung verlangen können. Dieses Recht steht den Gläubigern jedoch nur zu, wenn sie glaubhaft machen, dass durch die Verschmelzung die Erfüllung ihrer Forderung gefährdet wird."
    },
    {
      "date": "2024-12-20",
      "id": "97131",
      "original_text": "Löschungsankündigung\nBayern Amtsgericht München HRB 253000\nbaths&stars24 UG (haftungsbeschränkt) – München",
      "type": "Löschungsankündigung",
      "state": "Bayern",
      "amtsgericht": "Amtsgericht München",
      "registernummer": "HRB 253000",
      "registerart": "HRB",
      "company_name": "baths&stars24 UG (haftungsbeschränkt)",
      "company_seat": "München",
      "details": "20.12.2024 (Bekanntmachungsdatum)\n\nBayern Amtsgericht München HRB 253000\nLöschungsankündigung 19.12.2024 (Eintragungsdatum)\n\nbaths&stars24 UG (haftungsbeschränkt)\nGesellschaft mit beschränkter Haftung\nMünchen\n\nDas Registergericht beabsichtigt, die im Handelsregister eingetragene Gesellschaft wegen Vermögenslosigkeit von Amts wegen nach § 394 FamFG zu löschen. Die Frist zur Erhebung eines Widerspruchs ist auf drei Monate festgesetzt."
    },
    {
      "date": "2024-12-20",
      "id": "97132",
      "original_text": "Registerbekanntmachung nach dem Umwandlungsgesetz\nBayern Amtsgericht Nürnberg HRB 38355\nFAI rent-a-jet GmbH – Nürnberg",
      "type": "Registerbekanntmachung nach dem Umwandlungsgesetz",
      "state": "Bayern",
      "amtsgericht": "Amtsgericht Nürnberg",
      "registernummer": "HRB 38355",
      "registerart": "HRB",
      "company_name": "FAI rent-a-jet GmbH",
      "company_seat": "Nürnberg",
      "details": "20.12.2024 (Bekanntmachungsdatum)\n\nBayern Amtsgericht Nürnberg HRB 38355\nRegisterbekanntmachung nach dem Umwandlungsgesetz 19.12.2024 (Eintragungsdatum)\n\nFAI rent-a-jet GmbH\nGesellschaft mit beschränkter Haftung\nNürnberg\n\nDen Gläubigern der an der Spaltung beteiligten Rechtsträger ist, wenn sie binnen sechs Monaten nach dem Tag, an dem die Eintragung der Spaltung in das Register des Sitzes desjenigen Rechtsträgers, dessen Gläubiger sie sind, nach §§ 125, 19 Abs. 3 UmwG als bekannt gemacht gilt, ihren Anspruch nach Grund und Höhe schriftlich anmelden, Sicherheit zu leisten, soweit sie nicht Befriedigung verlangen können. Dieses Recht steht den Gläubigern jedoch nur zu, wenn sie glaubhaft machen, dass durch die Spaltung die Erfüllung ihrer Forderung gefährdet wird."
    },
    {
      "date": "2024-12-20",
      "id": "97133",
      "original_text": "Registerbekanntmachung nach dem Umwandlungsgesetz\nBayern Amtsgericht München HRB 121882\nTEMPIS Beteiligungs GmbH – Pullach i. Isartal",
      "type": "Registerbekanntmachung nach dem Umwandlungsgesetz",
      "state": "Bayern",
      "amtsgericht": "Amtsgericht München",
      "registernummer": "HRB 121882",
      "registerart": "HRB",
      "company_name": "TEMPIS Beteiligungs GmbH",
      "company_seat": "Pullach i. Isartal",
      "details": "20.12.2024 (Bekanntmachungsdatum)\n\nBayern Amtsgericht München HRB 121882\nRegisterbekanntmachung nach dem Umwandlungsgesetz 19.12.2024 (Eintragungsdatum)\n\nTEMPIS Beteiligungs GmbH\nGesellschaft mit beschränkter Haftung\nPullach i. Isartal\n\nDen Gläubigern der an der Verschmelzung beteiligten Rechtsträger ist, wenn sie binnen sechs Monaten nach dem Tag, an dem die Eintragung der Verschmelzung in das Register des Sitzes desjenigen Rechtsträgers, dessen Gläubiger sie sind, nach § 19 Abs. 3 UmwG als bekannt gemacht gilt, ihren Anspruch nach Grund und Höhe schriftlich anmelden, Sicherheit zu leisten, soweit sie nicht Befriedigung verlangen können. Dieses Recht steht den Gläubigern jedoch nur zu, wenn sie glaubhaft machen, dass durch die Verschmelzung die Erfüllung ihrer Forderung gefährdet wird."
    },
    {
      "date": "2024-12-20",
      "id": "97134",
      "original_text": "Registerbekanntmachung nach dem Umwandlungsgesetz\nBayern Amtsgericht Passau HRA 13821\nParadieswerkstatt Höllgasse e.K. – Passau",
      "type": "Registerbekanntmachung nach dem Umwandlungsgesetz",
      "state": "Bayern",
      "amtsgericht": "Amtsgericht Passau",
      "registernummer": "HRA 13821",
      "registerart": "HRA",
      "company_name": "Paradieswerkstatt Höllgasse e.K.",
      "company_seat": "Passau",
      "details": "20.12.2024 (Bekanntmachungsdatum)\n\nBayern Amtsgericht Passau HRA 13821\nRegisterbekanntmachung nach dem Umwandlungsgesetz 19.12.2024 (Eintragungsdatum)\n\nParadieswerkstatt Höllgasse e.K.\nEinzelkaufmann / Einzelkauffrau\nPassau\n\nDen Gläubigern der an der Ausgliederung beteiligten Rechtsträger ist, wenn sie binnen sechs Monaten nach dem Tag, an dem die Eintragung der Ausgliederung in das Register des Sitzes desjenigen Rechtsträgers, dessen Gläubiger sie sind, nach §§ 125, 19 Abs. 3 UmwG als bekannt gemacht gilt, ihren Anspruch nach Grund und Höhe schriftlich anmelden, Sicherheit zu leisten, soweit sie nicht Befriedigung verlangen können. Dieses Recht steht den Gläubigern jedoch nur zu, wenn sie glaubhaft machen, dass durch die Ausgliederung die Erfüllung ihrer Forderung gefährdet wird."
    },
    {
      "date": "2024-12-20",
      "id": "97135",
      "original_text": "Einreichung neuer Dokumente\nBayern Amtsgericht München HRB 240177\nInfrafibre Germany GmbH – Unterschleißheim",
      "type": "Einreichung neuer Dokumente",
      "state": "Bayern",
      "amtsgericht": "Amtsgericht München",
      "registernummer": "HRB 240177",
      "registerart": "HRB",
      "company_name": "Infrafibre Germany GmbH",
      "company_seat": "Unterschleißheim",
      "details": "20.12.2024 (Bekanntmachungsdatum)\n\nBayern Amtsgericht München HRB 240177\nEinreichung neuer Dokumente 19.12.2024 (Eintragungsdatum)\n\nInfrafibre Germany GmbH\nGesellschaft mit beschränkter Haftung\nUnterschleißheim\n\nDem Amtsgericht München -Registergericht- ist eine Liste der Mitglieder des Aufsichtsrats eingereicht worden, § 52 Abs. 3 S. 2 GmbHG."
    },
    {
      "date": "2024-12-20",
      "id": "97136",
      "original_text": "Registerbekanntmachung nach dem Umwandlungsgesetz\nBayern Amtsgericht München HRB 144881\nHADES Fünfte Verwaltung GmbH – Pullach i. Isartal",
      "type": "Registerbekanntmachung nach dem Umwandlungsgesetz",
      "state": "Bayern",
      "amtsgericht": "Amtsgericht München",
      "registernummer": "HRB 144881",
      "registerart": "HRB",
      "company_name": "HADES Fünfte Verwaltung GmbH",
      "company_seat": "Pullach i. Isartal",
      "details": "20.12.2024 (Bekanntmachungsdatum)\n\nBayern Amtsgericht München HRB 144881\nRegisterbekanntmachung nach dem Umwandlungsgesetz 19.12.2024 (Eintragungsdatum)\n\nHADES Fünfte Verwaltung GmbH\nGesellschaft mit beschränkter Haftung\nPullach i. Isartal\n\nDen Gläubigern der an der Verschmelzung beteiligten Rechtsträger ist, wenn sie binnen sechs Monaten nach dem Tag, an dem die Eintragung der Verschmelzung in das Register des Sitzes desjenigen Rechtsträgers, dessen Gläubiger sie sind, nach § 19 Abs. 3 UmwG als bekannt gemacht gilt, ihren Anspruch nach Grund und Höhe schriftlich anmelden, Sicherheit zu leisten, soweit sie nicht Befriedigung verlangen können. Dieses Recht steht den Gläubigern jedoch nur zu, wenn sie glaubhaft machen, dass durch die Verschmelzung die Erfüllung ihrer Forderung gefährdet wird."
    },
    {
      "date": "2024-12-20",
      "id": "97137",
      "original_text": "Einreichung neuer Dokumente\nBrandenburg Amtsgericht Neuruppin HRB 1787\nOstprignitz-Ruppiner-Personennahverkehrsgesellschaft mbH – Kyritz",
      "type": "Einreichung neuer Dokumente",
      "state": "Brandenburg",
      "amtsgericht": "Amtsgericht Neuruppin",
      "registernummer": "HRB 1787",
      "registerart": "HRB",
      "company_name": "Ostprignitz-Ruppiner-Personennahverkehrsgesellschaft mbH",
      "company_seat": "Kyritz",
      "details": "20.12.2024 (Bekanntmachungsdatum)\n\nBrandenburg Amtsgericht Neuruppin HRB 1787\nEinreichung neuer Dokumente\n\nOstprignitz-Ruppiner-Personennahverkehrsgesellschaft mbH\nGesellschaft mit beschränkter Haftung\nKyritz\n\nAls nicht eingetragen wird veröffentlicht: Eine Liste der Mitglieder des Aufsichtsrates wurde zum Handelsregister eingereicht."
    },
    {
      "date": "2024-12-20",
      "id": "97138",
      "original_text": "Registerbekanntmachung nach dem Umwandlungsgesetz\nBerlin Amtsgericht Berlin (Charlottenburg) HRB 70700\nABG Vermietungsgesellschaft mbH – Berlin",
      "type": "Registerbekanntmachung nach dem Umwandlungsgesetz",
      "state": "Berlin",
      "amtsgericht": "Amtsgericht Berlin (Charlottenburg)",
      "registernummer": "HRB 70700",
      "registerart": "HRB",
      "company_name": "ABG Vermietungsgesellschaft mbH",
      "company_seat": "Berlin",
      "details": "20.12.2024 (Bekanntmachungsdatum)\n\nBerlin Amtsgericht Berlin (Charlottenburg) HRB 70700\nRegisterbekanntmachung nach dem Umwandlungsgesetz 19.12.2024 (Eintragungsdatum)\n\nABG Vermietungsgesellschaft mbH\nGesellschaft mit beschränkter Haftung\nBerlin\n\nZu Eintragungsnummer 15 vom 19.12.2024 wird als nicht eingetragen veröffentlicht: Den Gläubigern der an der Spaltung beteiligten Rechtsträger ist, wenn sie binnen sechs Monaten nach dem Tag, an dem die Eintragung der Spaltung in das Register des Sitzes desjenigen Rechtsträgers, dessen Gläubiger sie sind, als bekannt gemacht gilt, ihren Anspruch nach Grund und Höhe schriftlich anmelden, Sicherheit zu leisten, soweit sie nicht Befriedigung verlangen können. Dieses Recht steht den Gläubigern jedoch nur zu, wenn sie glaubhaft machen, dass durch die Spaltung die Erfüllung ihrer Forderung gefährdet wird. Das Recht, Sicherheitsleistung zu verlangen, steht Gläubigern nicht zu, die im Falle der Insolvenz ein Recht auf vorzugsweise Befriedigung aus einer Deckungsmasse haben, die nach gesetzlicher Vorschrift zu ihrem Schutz errichtet und staatlich überwacht ist."
    },
    {
      "date": "2024-12-20",
      "id": "97139",
      "original_text": "Registerbekanntmachung nach dem Umwandlungsgesetz\nBaden-Württemberg Amtsgericht Stuttgart HRB 747290\nJetter Holding GmbH – Rosenfeld",
      "type": "Registerbekanntmachung nach dem Umwandlungsgesetz",
      "state": "Baden-Württemberg",
      "amtsgericht": "Amtsgericht Stuttgart",
      "registernummer": "HRB 747290",
      "registerart": "HRB",
      "company_name": "Jetter Holding GmbH",
      "company_seat": "Rosenfeld",
      "details": "20.12.2024 (Bekanntmachungsdatum)\n\nBaden-Württemberg Amtsgericht Stuttgart HRB 747290\nRegisterbekanntmachung nach dem Umwandlungsgesetz 20.12.2024 (Eintragungsdatum)\n\nJetter Holding GmbH\nGesellschaft mit beschränkter Haftung\nRosenfeld\n\nAls nicht eingetragen wird bekanntgemacht:\nDen Gläubigern der an der Verschmelzung beteiligten Rechtsträger ist, wenn sie binnen sechs Monaten nach dem Tag, an dem die Eintragung der Verschmelzung in das Register des Sitzes desjenigen Rechtsträgers, dessen Gläubiger sie sind, nach § 19 Abs. 3 UmwG als bekanntgemacht gilt, ihren Anspruch nach Grund und Höhe schriftlich anmelden, Sicherheit zu leisten, soweit sie nicht Befriedigung verlangen können. Dieses Recht steht den Gläubigern jedoch nur zu, wenn sie glaubhaft machen, dass durch die Verschmelzung die Erfüllung ihrer Forderung gefährdet wird."
    },
    {
      "date": "2024-12-20",
      "id": "97140",
      "original_text": "Sonstige Registerbekanntmachung\nSachsen-Anhalt Amtsgericht Stendal HRB 101639\nWasserwirtschaftsgesellschaft mbH Oschersleben – Hornhausen",
      "type": "Sonstige Registerbekanntmachung",
      "state": "Sachsen-Anhalt",
      "amtsgericht": "Amtsgericht Stendal",
      "registernummer": "HRB 101639",
      "registerart": "HRB",
      "company_name": "Wasserwirtschaftsgesellschaft mbH Oschersleben",
      "company_seat": "Hornhausen",
      "details": "20.12.2024 (Bekanntmachungsdatum)\n\nSachsen-Anhalt Amtsgericht Stendal HRB 101639\nSonstige Registerbekanntmachung\n\nWasserwirtschaftsgesellschaft mbH Oschersleben\nGesellschaft mit beschränkter Haftung\nHornhausen\n\nHinsichtlich o.g. Gesellschaft ist beabsichtigt, Herrn Peter Lorenz Heinze, Walsrode zum Nachtragsliquidator zu bestellen.Die Frist zu Einreichung etwaiger Stellungnahmen bzw. Erhebung eines Widerspruchs beim Amtsgericht Stendal wird auf 1 Monat festgesetzt."
    },
    {
      "date": "2024-12-20",
      "id": "97141",
      "original_text": "Löschungsankündigung\nBerlin Amtsgericht Berlin (Charlottenburg) HRB 240233\nPapadopoulos Baulogistik GmbH – Berlin",
      "type": "Löschungsankündigung",
      "state": "Berlin",
      "amtsgericht": "Amtsgericht Berlin (Charlottenburg)",
      "registernummer": "HRB 240233",
      "registerart": "HRB",
      "company_name": "Papadopoulos Baulogistik GmbH",
      "company_seat": "Berlin",
      "details": "20.12.2024 (Bekanntmachungsdatum)\n\nBerlin Amtsgericht Berlin (Charlottenburg) HRB 240233\nLöschungsankündigung\n\nPapadopoulos Baulogistik GmbH\nGesellschaft mit beschränkter Haftung\nBerlin\n\nBei der nachstehenden Gesellschaft wird das Amtslöschungsverfahren gemäß § 394 FamFG eingeleitet. Widerspruchsfrist 6 Wochen"
    },
    {
      "date": "2024-12-20",
      "id": "97142",
      "original_text": "Registerbekanntmachung nach dem Umwandlungsgesetz\nSaarland Amtsgericht Saarbrücken HRB 105549\nWHS Geschäftsführungsgesellschaft mbH Steuerberatungsgesellschaft Wirtschaftsprüfungsgesellschaft – Saarlouis",
      "type": "Registerbekanntmachung nach dem Umwandlungsgesetz",
      "state": "Saarland",
      "amtsgericht": "Amtsgericht Saarbrücken",
      "registernummer": "HRB 105549",
      "registerart": "HRB",
      "company_name": "WHS Geschäftsführungsgesellschaft mbH Steuerberatungsgesellschaft Wirtschaftsprüfungsgesellschaft",
      "company_seat": "Saarlouis",
      "details": "20.12.2024 (Bekanntmachungsdatum)\n\nSaarland Amtsgericht Saarbrücken HRB 105549\nRegisterbekanntmachung nach dem Umwandlungsgesetz 20.12.2024 (Eintragungsdatum)\n\nWHS Geschäftsführungsgesellschaft mbH Steuerberatungsgesellschaft Wirtschaftsprüfungsgesellschaft\nGesellschaft mit beschränkter Haftung\nSaarlouis\n\nAls nicht eingetragen wird bekannt gemacht: Den Gläubigern der an der Verschmelzung beteiligten Gesellschaften ist, wenn sie binnen sechs Monaten nach dem Tag, an dem die Eintragung der Verschmelzung in das Register des Sitzes desjenigen Rechtsträgers, dessen Gläubiger sie sind, nach § 19 Absatz 3 UmwG bekannt gemacht worden ist, ihren Anspruch nach Grund und Höhe schriftlich anmelden, Sicherheit zu leisten, soweit sie nicht Befriedigung verlangen können. Dieses Recht steht den Gläubigern jedoch nur zu, wenn sie glaubhaft machen, dass durch die Verschmelzung die Erfüllung ihrer Forderung gefährdet wird."
    },
    {
      "date": "2024-12-20",
      "id": "97143",
      "original_text": "Registerbekanntmachung nach dem Umwandlungsgesetz\nSaarland Amtsgericht Saarbrücken HRB 10240\nFörderer, Keil & Partner GmbH Wirtschaftsprüfungsgesellschaft – Saarbrücken",
      "type": "Registerbekanntmachung nach dem Umwandlungsgesetz",
      "state": "Saarland",
      "amtsgericht": "Amtsgericht Saarbrücken",
      "registernummer": "HRB 10240",
      "registerart": "HRB",
      "company_name": "Förderer, Keil & Partner GmbH Wirtschaftsprüfungsgesellschaft",
      "company_seat": "Saarbrücken",
      "details": "20.12.2024 (Bekanntmachungsdatum)\n\nSaarland Amtsgericht Saarbrücken HRB 10240\nRegisterbekanntmachung nach dem Umwandlungsgesetz 20.12.2024 (Eintragungsdatum)\n\nFörderer, Keil & Partner GmbH Wirtschaftsprüfungsgesellschaft\nGesellschaft mit beschränkter Haftung\nSaarbrücken\n\nAls nicht eingetragen wird bekannt gemacht: Den Gläubigern der an der Verschmelzung beteiligten Gesellschaften ist, wenn sie binnen sechs Monaten nach dem Tag, an dem die Eintragung der Verschmelzung in das Register des Sitzes desjenigen Rechtsträgers, dessen Gläubiger sie sind, nach § 19 Absatz 3 UmwG bekannt gemacht worden ist, ihren Anspruch nach Grund und Höhe schriftlich anmelden, Sicherheit zu leisten, soweit sie nicht Befriedigung verlangen können. Dieses Recht steht den Gläubigern jedoch nur zu, wenn sie glaubhaft machen, dass durch die Verschmelzung die Erfüllung ihrer Forderung gefährdet wird."
    },
    {
      "date": "2024-12-20",
      "id": "97144",
      "original_text": "Registerbekanntmachung nach dem Umwandlungsgesetz\nSaarland Amtsgericht Saarbrücken HRB 102841\nGSW GmbH – Kirkel",
      "type": "Registerbekanntmachung nach dem Umwandlungsgesetz",
      "state": "Saarland",
      "amtsgericht": "Amtsgericht Saarbrücken",
      "registernummer": "HRB 102841",
      "registerart": "HRB",
      "company_name": "GSW GmbH",
      "company_seat": "Kirkel",
      "details": "20.12.2024 (Bekanntmachungsdatum)\n\nSaarland Amtsgericht Saarbrücken HRB 102841\nRegisterbekanntmachung nach dem Umwandlungsgesetz 20.12.2024 (Eintragungsdatum)\n\nGSW GmbH\nGesellschaft mit beschränkter Haftung\nKirkel\n\nAls nicht eingetragen wird bekannt gemacht: Den Gläubigern der an der Verschmelzung beteiligten Gesellschaften ist, wenn sie binnen sechs Monaten nach dem Tag, an dem die Eintragung der Verschmelzung in das Register des Sitzes desjenigen Rechtsträgers, dessen Gläubiger sie sind, nach § 19 Absatz 3 UmwG bekannt gemacht worden ist, ihren Anspruch nach Grund und Höhe schriftlich anmelden, Sicherheit zu leisten, soweit sie nicht Befriedigung verlangen können. Dieses Recht steht den Gläubigern jedoch nur zu, wenn sie glaubhaft machen, dass durch die Verschmelzung die Erfüllung ihrer Forderung gefährdet wird."
    },
    {
      "date": "2024-12-20",
      "id": "97145",
      "original_text": "Registerbekanntmachung nach dem Umwandlungsgesetz\nBaden-Württemberg Amtsgericht Mannheim HRA 503601\nWB11 GmbH + Co.KG – Pforzheim",
      "type": "Registerbekanntmachung nach dem Umwandlungsgesetz",
      "state": "Baden-Württemberg",
      "amtsgericht": "Amtsgericht Mannheim",
      "registernummer": "HRA 503601",
      "registerart": "HRA",
      "company_name": "WB11 GmbH + Co.KG",
      "company_seat": "Pforzheim",
      "details": "20.12.2024 (Bekanntmachungsdatum)\n\nBaden-Württemberg Amtsgericht Mannheim HRA 503601\nRegisterbekanntmachung nach dem Umwandlungsgesetz 20.12.2024 (Eintragungsdatum)\n\nWB11 GmbH + Co.KG\nKommanditgesellschaft\nPforzheim\n\nDen Gläubigern der an der Verschmelzung beteiligten Rechtsträger ist, wenn sie binnen sechs Monaten nach dem Tag, an dem die Eintragung der Verschmelzung in das Register des Sitzes desjenigen Rechtsträgers, dessen Gläubiger sie sind, nach § 19 Abs. 3 UmwG als bekanntgemacht gilt, ihren Anspruch nach Grund und Höhe schriftlich anmelden, Sicherheit zu leisten, soweit sie nicht Befriedigung verlangen können. Dieses Recht steht den Gläubigern jedoch nur zu, wenn sie glaubhaft machen, dass durch die Verschmelzung die Erfüllung ihrer Forderung gefährdet wird."
    },
    {
      "date": "2024-12-20",
      "id": "97146",
      "original_text": "Löschungsankündigung\nSchleswig-Holstein Amtsgericht Lübeck HRB 25353\nLange Marketing- und Werbeleistungen GmbH – Börnsen",
      "type": "Löschungsankündigung",
      "state": "Schleswig-Holstein",
      "amtsgericht": "Amtsgericht Lübeck",
      "registernummer": "HRB 25353",
      "registerart": "HRB",
      "company_name": "Lange Marketing- und Werbeleistungen GmbH",
      "company_seat": "Börnsen",
      "details": "20.12.2024 (Bekanntmachungsdatum)\n\nSchleswig-Holstein Amtsgericht Lübeck HRB 25353\nLöschungsankündigung\n\nLange Marketing- und Werbeleistungen GmbH\nGesellschaft mit beschränkter Haftung\nBörnsen\n\nEs ist die Löschung der nachstehenden Gesellschaft wegen Vermögenslosigkeit gemäß § 394 FamFG beabsichtigt. Widerspruchsfrist: 1 Monat"
    },
    {
      "date": "2024-12-20",
      "id": "97147",
      "original_text": "Registerbekanntmachung nach dem Umwandlungsgesetz\nBaden-Württemberg Amtsgericht Stuttgart HRB 770845\nCannagourmet UG (haftungsbeschränkt) – Langenbrettach",
      "type": "Registerbekanntmachung nach dem Umwandlungsgesetz",
      "state": "Baden-Württemberg",
      "amtsgericht": "Amtsgericht Stuttgart",
      "registernummer": "HRB 770845",
      "registerart": "HRB",
      "company_name": "Cannagourmet UG (haftungsbeschränkt)",
      "company_seat": "Langenbrettach",
      "details": "20.12.2024 (Bekanntmachungsdatum)\n\nBaden-Württemberg Amtsgericht Stuttgart HRB 770845\nRegisterbekanntmachung nach dem Umwandlungsgesetz 20.12.2024 (Eintragungsdatum)\n\nCannagourmet UG (haftungsbeschränkt)\nGesellschaft mit beschränkter Haftung\nLangenbrettach\n\nAls nicht eingetragen wird bekanntgemacht:\nDen Gläubigern der an der Verschmelzung beteiligten Rechtsträger ist, wenn sie binnen sechs Monaten nach dem Tag, an dem die Eintragung der Verschmelzung in das Register des Sitzes desjenigen Rechtsträgers, dessen Gläubiger sie sind, nach § 19 Abs. 3 UmwG als bekanntgemacht gilt, ihren Anspruch nach Grund und Höhe schriftlich anmelden, Sicherheit zu leisten, soweit sie nicht Befriedigung verlangen können. Dieses Recht steht den Gläubigern jedoch nur zu, wenn sie glaubhaft machen, dass durch die Verschmelzung die Erfüllung ihrer Forderung gefährdet wird."
    },
    {
      "date": "2024-12-20",
      "id": "97148",
      "original_text": "Löschungsankündigung\nSaarland Amtsgericht Saarbrücken HRB 104404\nKANS GmbH – Homburg/Saar",
      "type": "Löschungsankündigung",
      "state": "Saarland",
      "amtsgericht": "Amtsgericht Saarbrücken",
      "registernummer": "HRB 104404",
      "registerart": "HRB",
      "company_name": "KANS GmbH",
      "company_seat": "Homburg/Saar",
      "details": "20.12.2024 (Bekanntmachungsdatum)\n\nSaarland Amtsgericht Saarbrücken HRB 104404\nLöschungsankündigung\n\nKANS GmbH\nGesellschaft mit beschränkter Haftung\nHomburg/Saar\n\nEs ist beabsichtigt, die Gesellschaft von Amts wegen gemäß § 394 FamFG wegen Vermögenslosigkeit zu löschen.\nGegen die Löschung von Amts wegen ist das Rechtsmittel des Widerspruchs statthaft. Der Widerspruch ist binnen einer Frist zwei Monaten beginnend mit dem Tag dieser Veröffentlichung durch Einreichen eines Widerspruchsschreibens -schriftlich oder zur Niederschrift der Geschäftsstelle beim Amtsgericht Saarbrücken, -zentrales Handelsregister-, Mainzerstr.178, 66121 Saarbrücken einzulegen.\nDer Widerspruch muss die Bezeichnung der angefochtenen Löschungsankündigung enthalten sowie die Erklärung, dass Widerspruch eingelegt wird. Er ist vom Widerspruchsführer oder seinem Bevollmächtigten zu unterzeichnen.\nDas Widerspruchsschreiben kann auch in der Form eines elektronischen Dokumentes eingereicht werden, das mit einer qualifizierten elektronischen Signatur nach dem Signaturgesetz versehen sein muss (§§ 14 Abs. 2 FamFG, 130a, 298 ZPO)."
    },
    {
      "date": "2024-12-20",
      "id": "97149",
      "original_text": "Sonstige Registerbekanntmachung\nBaden-Württemberg Amtsgericht Stuttgart HRB 213979\nReal Garant Software AG – Neuhausen auf den Fildern",
      "type": "Sonstige Registerbekanntmachung",
      "state": "Baden-Württemberg",
      "amtsgericht": "Amtsgericht Stuttgart",
      "registernummer": "HRB 213979",
      "registerart": "HRB",
      "company_name": "Real Garant Software AG",
      "company_seat": "Neuhausen auf den Fildern",
      "details": "20.12.2024 (Bekanntmachungsdatum)\n\nBaden-Württemberg Amtsgericht Stuttgart HRB 213979\nSonstige Registerbekanntmachung\n\nReal Garant Software AG\nAktiengesellschaft\nNeuhausen auf den Fildern\n\nDie Gesellschaft hat am 11.12.2024 die Liste über die Zusammensetzung des Aufsichtsrats zum Handelsregister eingereicht."
    },
    {
      "date": "2024-12-20",
      "id": "97150",
      "original_text": "Löschungsankündigung\nSchleswig-Holstein Amtsgericht Lübeck HRA 776 SB\nSTS Passivhaus Baustoffe e.K. – Büchen",
      "type": "Löschungsankündigung",
      "state": "Schleswig-Holstein",
      "amtsgericht": "Amtsgericht Lübeck",
      "registernummer": "HRA 776 SB",
      "registerart": "HRA",
      "company_name": "STS Passivhaus Baustoffe e.K.",
      "company_seat": "Büchen",
      "details": "20.12.2024 (Bekanntmachungsdatum)\n\nSchleswig-Holstein Amtsgericht Lübeck HRA 776 SB\nLöschungsankündigung\n\nSTS Passivhaus Baustoffe e.K.\nEinzelkaufmann / Einzelkauffrau\nBüchen\n\nBei der nachstehenden Firma wird das Amtslöschungsverfahren gemäß § 31 Abs. 2 HGB eingeleitet.\nSTS Passivhaus Baustoffe e.K., Inh. Stefan Schulz, Ostpreußenring 4, 21514 Büchen\nIn der Handelsregistersache der STS Passivhaus Baustoffe e.K.\nwurde seitens der Nachlasspflegerin mitgeteilt, dass der Inhaber des o.g. einzelkaufmännischen Unternehmens verstorben ist. Eine Anmeldung des Erlöschens der Firma ist nicht erfolgt und Erben sind nicht bekannt, diesbezüglich beabsichtigt das Gericht, die Firma von Amts wegen gemäß § 31 Abs. 2 HGB, § 393 FamFG zu löschen.\nSie erhalten hiermit Gelegenheit zur Erhebung eines Widerspruchs gegen die Löschungsankündigung.\nDer Widerspruch muss innerhalb von einem Monat ab Zugang dieses Schreibens schriftlich\noder zu Protokoll der Geschäftsstelle erhoben werden. Amtsgericht Lübeck, Abt. 6"
    },
    {
      "date": "2024-12-20",
      "id": "97151",
      "original_text": "Einreichung neuer Dokumente\nSaarland Amtsgericht Saarbrücken HRB 24881\nStadtwerke Saarlouis GmbH – Saarlouis",
      "type": "Einreichung neuer Dokumente",
      "state": "Saarland",
      "amtsgericht": "Amtsgericht Saarbrücken",
      "registernummer": "HRB 24881",
      "registerart": "HRB",
      "company_name": "Stadtwerke Saarlouis GmbH",
      "company_seat": "Saarlouis",
      "details": "20.12.2024 (Bekanntmachungsdatum)\n\nSaarland Amtsgericht Saarbrücken HRB 24881\nEinreichung neuer Dokumente\n\nStadtwerke Saarlouis GmbH\nGesellschaft mit beschränkter Haftung\nSaarlouis\n\nDie Geschäftsführung der Gesellschaft hat eine Liste der Mitglieder des Aufsichtsrats zum Handelsregister eingereicht (§ 52 Abs. 3 Satz 2 GmbHG)."
    },
    {
      "date": "2024-12-20",
      "id": "97152",
      "original_text": "Einreichung neuer Dokumente\nBaden-Württemberg Amtsgericht Ulm HRB 740135\nSSV Ulm 1846 Fußball GmbH & Co. KGaA – Ulm",
      "type": "Einreichung neuer Dokumente",
      "state": "Baden-Württemberg",
      "amtsgericht": "Amtsgericht Ulm",
      "registernummer": "HRB 740135",
      "registerart": "HRB",
      "company_name": "SSV Ulm 1846 Fußball GmbH & Co. KGaA",
      "company_seat": "Ulm",
      "details": "20.12.2024 (Bekanntmachungsdatum)\n\nBaden-Württemberg Amtsgericht Ulm HRB 740135\nEinreichung neuer Dokumente\n\nSSV Ulm 1846 Fußball GmbH & Co. KGaA\nKommanditgesellschaft auf Aktien\nUlm\n\nDie Gesellschaft hat am 19.12.2024 die Liste über die Zusammensetzung des Aufsichtsrats zum Handelsregister eingereicht."
    },
    {
      "date": "2024-12-20",
      "id": "97153",
      "original_text": "Einreichung neuer Dokumente\nThüringen Amtsgericht Jena HRB 106826\nBaugesellschaft Gotha mbH – Gotha",
      "type": "Einreichung neuer Dokumente",
      "state": "Thüringen",
      "amtsgericht": "Amtsgericht Jena",
      "registernummer": "HRB 106826",
      "registerart": "HRB",
      "company_name": "Baugesellschaft Gotha mbH",
      "company_seat": "Gotha",
      "details": "20.12.2024 (Bekanntmachungsdatum)\n\nThüringen Amtsgericht Jena HRB 106826\nEinreichung neuer Dokumente\n\nBaugesellschaft Gotha mbH\nGesellschaft mit beschränkter Haftung\nGotha\n\nBekanntmachung gem. § 52 Abs. 3 Satz 2 GmbHG: Aufgrund einer Veränderung in den Personen der Aufsichtsratsmitglieder ist durch die Geschäftsführer eine neue Liste zum Handelsregister eingereicht worden."
    },
    {
      "date": "2024-12-20",
      "id": "97154",
      "original_text": "Löschungsankündigung\nThüringen Amtsgericht Rudolstadt VR 260859\nIslam an der Saale e.V. – Saalfeld",
      "type": "Löschungsankündigung",
      "state": "Thüringen",
      "amtsgericht": "Amtsgericht Rudolstadt",
      "registernummer": "VR 260859",
      "registerart": "VR",
      "company_name": "Islam an der Saale e.V.",
      "company_seat": "Saalfeld",
      "details": "20.12.2024 (Bekanntmachungsdatum)\n\nThüringen Amtsgericht Rudolstadt VR 260859\nLöschungsankündigung\n\nIslam an der Saale e.V.\neingetragener Verein\nSaalfeld\n\nDas Gericht beabsichtigt, den im Vereinsregister eingetragenen Verein Islam an der Saale e.V. gemäß § 395 FamFG wegen unzulässiger Eintragung von Amts wegen zu löschen. Der Verein ist infolge Wegfalls sämtlicher Mitglieder erloschen. Die Frist zur Geltendmachung eines Widerspruch gegen die beabsichtigte Löschung wird auf einen Monat ab dieser Veröffentlichung festgesetzt."
    },
    {
      "date": "2024-12-20",
      "id": "97155",
      "original_text": "Sonstige Registerbekanntmachung\nBaden-Württemberg Amtsgericht Ulm HRB 743579\nV42 Vorratsgesellschaft SE – Ellwangen Jagst",
      "type": "Sonstige Registerbekanntmachung",
      "state": "Baden-Württemberg",
      "amtsgericht": "Amtsgericht Ulm",
      "registernummer": "HRB 743579",
      "registerart": "HRB",
      "company_name": "V42 Vorratsgesellschaft SE",
      "company_seat": "Ellwangen Jagst",
      "details": "20.12.2024 (Bekanntmachungsdatum)\n\nBaden-Württemberg Amtsgericht Ulm HRB 743579\nSonstige Registerbekanntmachung\n\nV42 Vorratsgesellschaft SE\nEuropäische Aktiengesellschaft (SE)\nEllwangen Jagst\n\nDie Gesellschaft hat am 20.12.2024 die Liste über die Zusammensetzung des Aufsichtsrats zum Handelsregister eingereicht."
    },
    {
      "date": "2024-12-20",
      "id": "97156",
      "original_text": "Löschungsankündigung\nSaarland Amtsgericht Saarbrücken HRB 104013\nRiegelsBurger UG (haftungsbeschränkt) – Riegelsberg",
      "type": "Löschungsankündigung",
      "state": "Saarland",
      "amtsgericht": "Amtsgericht Saarbrücken",
      "registernummer": "HRB 104013",
      "registerart": "HRB",
      "company_name": "RiegelsBurger UG (haftungsbeschränkt)",
      "company_seat": "Riegelsberg",
      "details": "20.12.2024 (Bekanntmachungsdatum)\n\nSaarland Amtsgericht Saarbrücken HRB 104013\nLöschungsankündigung\n\nRiegelsBurger UG (haftungsbeschränkt)\nGesellschaft mit beschränkter Haftung\nRiegelsberg\n\nEs ist beabsichtigt, die Gesellschaft von Amts wegen gemäß § 394 FamFG wegen Vermögenslosigkeit zu löschen.\nGegen die Löschung von Amts wegen ist das Rechtsmittel des Widerspruchs statthaft. Der Widerspruch ist binnen einer Frist zwei Monaten beginnend mit dem Tag dieser Veröffentlichung durch Einreichen eines Widerspruchsschreibens -schriftlich oder zur Niederschrift der Geschäftsstelle beim Amtsgericht Saarbrücken, -zentrales Handelsregister-, Mainzer Str.178, 66121 Saarbrücken einzulegen.\nDer Widerspruch muss die Bezeichnung der angefochtenen Löschungsankündigung enthalten sowie die Erklärung, dass Widerspruch eingelegt wird. Er ist vom Widerspruchsführer oder seinem Bevollmächtigten zu unterzeichnen.\nDas Widerspruchsschreiben kann auch in der Form eines elektronischen Dokumentes eingereicht werden, das mit einer qualifizierten elektronischen Signatur nach dem Signaturgesetz versehen sein muss (§§ 14 Abs. 2 FamFG, 130a, 298 ZPO)."
    },
    {
      "date": "2024-12-20",
      "id": "97157",
      "original_text": "Registerbekanntmachung nach dem Umwandlungsgesetz\nSchleswig-Holstein Amtsgericht Pinneberg HRA 9494\nPeter Viering e. K. – Rellingen",
      "type": "Registerbekanntmachung nach dem Umwandlungsgesetz",
      "state": "Schleswig-Holstein",
      "amtsgericht": "Amtsgericht Pinneberg",
      "registernummer": "HRA 9494",
      "registerart": "HRA",
      "company_name": "Peter Viering e. K.",
      "company_seat": "Rellingen",
      "details": "20.12.2024 (Bekanntmachungsdatum)\n\nSchleswig-Holstein Amtsgericht Pinneberg HRA 9494\nRegisterbekanntmachung nach dem Umwandlungsgesetz 20.12.2024 (Eintragungsdatum)\n\nPeter Viering e. K.\nEinzelkaufmann / Einzelkauffrau\nRellingen\n\nZu Eintragungsnummer 2 vom 20.12.2024 wird als nicht eingetragen veröffentlicht:  Als nicht eingetragen wird veröffentlicht: Den Gläubigern ist, wenn sie binnen sechs Monaten nach dem Tag, an dem die Eintragung der Umwandlung als bekannt gemacht gilt, ihren Anspruch nach Grund und Höhe schriftlich anmelden, Sicherheit zu leisten, soweit sie nicht Befriedigung verlangen können. Dieses Recht steht den Gläubigern jedoch nur zu, wenn sie glaubhaft machen, dass durch die Umwandlung die Erfüllung ihrer Forderung gefährdet wird. Das Recht, Sicherheitsleistung zu verlangen, steht Gläubigern nicht zu, die im Falle der Insolvenz ein Recht auf vorzugsweise Befriedigung aus einer Deckungsmasse haben, die nach gesetzlicher Vorschrift zu ihrem Schutz errichtet und staatlich überwacht ist."
    },
    {
      "date": "2024-12-20",
      "id": "97158",
      "original_text": "Registerbekanntmachung nach dem Umwandlungsgesetz\nSchleswig-Holstein Amtsgericht Pinneberg HRB 17950\nPeter Viering Baumschule und Gartengestaltung GmbH – Rellingen",
      "type": "Registerbekanntmachung nach dem Umwandlungsgesetz",
      "state": "Schleswig-Holstein",
      "amtsgericht": "Amtsgericht Pinneberg",
      "registernummer": "HRB 17950",
      "registerart": "HRB",
      "company_name": "Peter Viering Baumschule und Gartengestaltung GmbH",
      "company_seat": "Rellingen",
      "details": "20.12.2024 (Bekanntmachungsdatum)\n\nSchleswig-Holstein Amtsgericht Pinneberg HRB 17950\nRegisterbekanntmachung nach dem Umwandlungsgesetz 20.12.2024 (Eintragungsdatum)\n\nPeter Viering Baumschule und Gartengestaltung GmbH\nGesellschaft mit beschränkter Haftung\nRellingen\n\nZu Eintragungsnummer 2 vom 20.12.2024 wird als nicht eingetragen veröffentlicht: Den Gläubigern der an der Spaltung beteiligten Rechtsträger ist, wenn sie binnen sechs Monaten nach dem Tag, an dem die Eintragung der Spaltung in das Register des Sitzes desjenigen Rechtsträgers, dessen Gläubiger sie sind, als bekannt gemacht gilt, ihren Anspruch nach Grund und Höhe schriftlich anmelden, Sicherheit zu leisten, soweit sie nicht Befriedigung verlangen können. Dieses Recht steht den Gläubigern jedoch nur zu, wenn sie glaubhaft machen, dass durch die Spaltung die Erfüllung ihrer Forderung gefährdet wird. Das Recht, Sicherheitsleistung zu verlangen, steht Gläubigern nicht zu, die im Falle der Insolvenz ein Recht auf vorzugsweise Befriedigung aus einer Deckungsmasse haben, die nach gesetzlicher Vorschrift zu ihrem Schutz errichtet und staatlich überwacht ist."
    },
    {
      "date": "2024-12-20",
      "id": "97159",
      "original_text": "Sonstige Registerbekanntmachung\nHamburg Amtsgericht Hamburg HRB 125053\nENERPARC Solar Invest 255 TU 2 GmbH – Hamburg",
      "type": "Sonstige Registerbekanntmachung",
      "state": "Hamburg",
      "amtsgericht": "Amtsgericht Hamburg",
      "registernummer": "HRB 125053",
      "registerart": "HRB",
      "company_name": "ENERPARC Solar Invest 255 TU 2 GmbH",
      "company_seat": "Hamburg",
      "details": "20.12.2024 (Bekanntmachungsdatum)\n\nHamburg Amtsgericht Hamburg HRB 125053\nSonstige Registerbekanntmachung 20.12.2024 (Eintragungsdatum)\n\nENERPARC Solar Invest 255 TU 2 GmbH\nGesellschaft mit beschränkter Haftung\nHamburg\n\nAls nicht eingetragen wird bekannt gemacht:  Den Gläubigern der Gesellschaft, deren Forderungen begründet worden sind, bevor die Eintragung der Vertragsbeendigung in das Handelsregister nach § 10 HGB als bekannt gemacht gilt, ist vom anderen Vertragsteil Sicherheit zu leisten, wenn sie sich binnen 6 Monaten nach Bekanntmachung der Eintragung zu diesem Zweck bei ihm melden."
    },
    {
      "date": "2024-12-20",
      "id": "97160",
      "original_text": "Einreichung neuer Dokumente\nSaarland Amtsgericht Saarbrücken HRB 108909\ninexogy Energy Holding KGaA – Saarlouis",
      "type": "Einreichung neuer Dokumente",
      "state": "Saarland",
      "amtsgericht": "Amtsgericht Saarbrücken",
      "registernummer": "HRB 108909",
      "registerart": "HRB",
      "company_name": "inexogy Energy Holding KGaA",
      "company_seat": "Saarlouis",
      "details": "20.12.2024 (Bekanntmachungsdatum)\n\nSaarland Amtsgericht Saarbrücken HRB 108909\nEinreichung neuer Dokumente\n\ninexogy Energy Holding KGaA\nKommanditgesellschaft auf Aktien\nSaarlouis\n\nDer bzw. die persönlich haftende/n Gesellschafter der Gesellschaft haben eine Liste der Mitglieder des Aufsichtsrats zum Handelsregister eingereicht (§§ 278, 106 AktG)."
    },
    {
      "date": "2024-12-20",
      "id": "97161",
      "original_text": "Einreichung neuer Dokumente\nBrandenburg Amtsgericht Frankfurt/Oder HRB 5755\nSTAB Grundstücksentwicklungsgesellschaft mbH – Bernau bei Berlin",
      "type": "Einreichung neuer Dokumente",
      "state": "Brandenburg",
      "amtsgericht": "Amtsgericht Frankfurt/Oder",
      "registernummer": "HRB 5755",
      "registerart": "HRB",
      "company_name": "STAB Grundstücksentwicklungsgesellschaft mbH",
      "company_seat": "Bernau bei Berlin",
      "details": "20.12.2024 (Bekanntmachungsdatum)\n\nBrandenburg Amtsgericht Frankfurt/Oder HRB 5755\nEinreichung neuer Dokumente\n\nSTAB Grundstücksentwicklungsgesellschaft mbH\nGesellschaft mit beschränkter Haftung\nBernau bei Berlin\n\nAls nicht eingetragen wird veröffentlicht:\n\nEs wurde eine Liste der Aufsichtsratsmitglieder zur Akte gereicht."
    },
    {
      "date": "2024-12-20",
      "id": "97162",
      "original_text": "Registerbekanntmachung nach dem Umwandlungsgesetz\nSachsen Amtsgericht Leipzig HRA 19566\nErik Suchomlinov Transporte e.K. – Leipzig",
      "type": "Registerbekanntmachung nach dem Umwandlungsgesetz",
      "state": "Sachsen",
      "amtsgericht": "Amtsgericht Leipzig",
      "registernummer": "HRA 19566",
      "registerart": "HRA",
      "company_name": "Erik Suchomlinov Transporte e.K.",
      "company_seat": "Leipzig",
      "details": "20.12.2024 (Bekanntmachungsdatum)\n\nSachsen Amtsgericht Leipzig HRA 19566\nRegisterbekanntmachung nach dem Umwandlungsgesetz 20.12.2024 (Eintragungsdatum)\n\nErik Suchomlinov Transporte e.K.\nEinzelkaufmann / Einzelkauffrau\nLeipzig\n\nDen Gläubigern der an der Ausgliederung beteiligten Rechtsträger ist, wenn sie binnen sechs Monaten nach dem Tag, an dem die Eintragung der Ausgliederung in das Register des Sitzes desjenigen Rechtsträgers, dessen Gläubiger sie sind, nach § 19 Abs. 3 UmwG als bekannt gemacht gilt, ihren Anspruch nach Grund und Höhe schriftlich anmelden, Sicherheit zu leisten, soweit sie nicht Befriedigung verlangen können. Dieses Recht steht den Gläubigern jedoch nur zu, wenn sie glaubhaft machen, dass durch die Ausgliederung die Erfüllung der Forderung gefährdet wird."
    },
    {
      "date": "2024-12-20",
      "id": "97163",
      "original_text": "Einreichung neuer Dokumente\nSachsen Amtsgericht Dresden HRB 3973\nEntwicklungsgesellschaft Niederschlesische Oberlausitz mbH – Bad Muskau",
      "type": "Einreichung neuer Dokumente",
      "state": "Sachsen",
      "amtsgericht": "Amtsgericht Dresden",
      "registernummer": "HRB 3973",
      "registerart": "HRB",
      "company_name": "Entwicklungsgesellschaft Niederschlesische Oberlausitz mbH",
      "company_seat": "Bad Muskau",
      "details": "20.12.2024 (Bekanntmachungsdatum)\n\nSachsen Amtsgericht Dresden HRB 3973\nEinreichung neuer Dokumente 20.12.2024 (Eintragungsdatum)\n\nEntwicklungsgesellschaft Niederschlesische Oberlausitz mbH\nGesellschaft mit beschränkter Haftung\nBad Muskau\n\nAm 19.12.2024 wurde beim Handelsregister des Amtsgerichts Dresden die Liste der Mitglieder des Aufsichtsrats gemäß § 52 GmbHG eingereicht."
    },
    {
      "date": "2024-12-20",
      "id": "97164",
      "original_text": "Registerbekanntmachung nach dem Umwandlungsgesetz\nSachsen Amtsgericht Dresden HRB 40838\nPTH Outlet GmbH – Bischofswerda",
      "type": "Registerbekanntmachung nach dem Umwandlungsgesetz",
      "state": "Sachsen",
      "amtsgericht": "Amtsgericht Dresden",
      "registernummer": "HRB 40838",
      "registerart": "HRB",
      "company_name": "PTH Outlet GmbH",
      "company_seat": "Bischofswerda",
      "details": "20.12.2024 (Bekanntmachungsdatum)\n\nSachsen Amtsgericht Dresden HRB 40838\nRegisterbekanntmachung nach dem Umwandlungsgesetz 20.12.2024 (Eintragungsdatum)\n\nPTH Outlet GmbH\nGesellschaft mit beschränkter Haftung\nBischofswerda\n\nDen Gläubigern der an der Verschmelzung beteiligten Rechtsträger ist, wenn sie binnen sechs Monaten nach dem Tag, an dem die Eintragung der Verschmelzung in das Register des Sitzes desjenigen Rechtsträgers, dessen Gläubiger sie sind, nach § 19 Abs. 3 UmwG als bekannt gemacht gilt, ihren Anspruch nach Grund und Höhe schriftlich anmelden, Sicherheit zu leisten, soweit sie nicht Befriedigung verlangen können. Dieses Recht steht den Gläubigern jedoch nur zu, wenn sie glaubhaft machen, dass durch die Verschmelzung die Erfüllung der Forderung gefährdet wird."
    },
    {
      "date": "2024-12-20",
      "id": "97165",
      "original_text": "Einreichung neuer Dokumente\nSachsen Amtsgericht Chemnitz HRB 21641\nSozialbetriebe Mittleres Erzgebirge gGmbH – Olbernhau",
      "type": "Einreichung neuer Dokumente",
      "state": "Sachsen",
      "amtsgericht": "Amtsgericht Chemnitz",
      "registernummer": "HRB 21641",
      "registerart": "HRB",
      "company_name": "Sozialbetriebe Mittleres Erzgebirge gGmbH",
      "company_seat": "Olbernhau",
      "details": "20.12.2024 (Bekanntmachungsdatum)\n\nSachsen Amtsgericht Chemnitz HRB 21641\nEinreichung neuer Dokumente\n\nSozialbetriebe Mittleres Erzgebirge gGmbH\nGesellschaft mit beschränkter Haftung\nOlbernhau\n\nAm 19.12.2024 wurde beim Handelsregister des Amtsgerichts Chemnitz die Liste der Mitglieder des Aufsichtsrats gemäß § 52 GmbHG eingereicht."
    },
    {
      "date": "2024-12-20",
      "id": "97166",
      "original_text": "Registerbekanntmachung nach dem Umwandlungsgesetz\nSachsen Amtsgericht Dresden HRB 19943\nprivate textiles g.m.b.h. – Bischofswerda",
      "type": "Registerbekanntmachung nach dem Umwandlungsgesetz",
      "state": "Sachsen",
      "amtsgericht": "Amtsgericht Dresden",
      "registernummer": "HRB 19943",
      "registerart": "HRB",
      "company_name": "private textiles g.m.b.h.",
      "company_seat": "Bischofswerda",
      "details": "20.12.2024 (Bekanntmachungsdatum)\n\nSachsen Amtsgericht Dresden HRB 19943\nRegisterbekanntmachung nach dem Umwandlungsgesetz 20.12.2024 (Eintragungsdatum)\n\nprivate textiles g.m.b.h.\nGesellschaft mit beschränkter Haftung\nBischofswerda\n\nDen Gläubigern der an der Verschmelzung beteiligten Rechtsträger ist, wenn sie binnen sechs Monaten nach dem Tag, an dem die Eintragung der Verschmelzung in das Register des Sitzes desjenigen Rechtsträgers, dessen Gläubiger sie sind, nach § 19 Abs. 3 UmwG als bekannt gemacht gilt, ihren Anspruch nach Grund und Höhe schriftlich anmelden, Sicherheit zu leisten, soweit sie nicht Befriedigung verlangen können. Dieses Recht steht den Gläubigern jedoch nur zu, wenn sie glaubhaft machen, dass durch die Verschmelzung die Erfüllung der Forderung gefährdet wird."
    },
    {
      "date": "2024-12-20",
      "id": "97167",
      "original_text": "Einreichung neuer Dokumente\nSachsen Amtsgericht Leipzig HRB 42863\nEinzig:artig !nklusive gGmbH – Borna",
      "type": "Einreichung neuer Dokumente",
      "state": "Sachsen",
      "amtsgericht": "Amtsgericht Leipzig",
      "registernummer": "HRB 42863",
      "registerart": "HRB",
      "company_name": "Einzig:artig !nklusive gGmbH",
      "company_seat": "Borna",
      "details": "20.12.2024 (Bekanntmachungsdatum)\n\nSachsen Amtsgericht Leipzig HRB 42863\nEinreichung neuer Dokumente\n\nEinzig:artig !nklusive gGmbH\nGesellschaft mit beschränkter Haftung\nBorna\n\nAm 19.12.2024 wurde beim Handelsregister des Amtsgerichts Leipzig die Liste der Mitglieder des Aufsichtsrats gemäß § 52 GmbHG eingereicht."
    },
    {
      "date": "2024-12-20",
      "id": "97168",
      "original_text": "Einreichung neuer Dokumente\nSachsen Amtsgericht Dresden HRB 9042\nFlugplatz Rothenburg/ Görlitz GmbH – Rothenburg/OL",
      "type": "Einreichung neuer Dokumente",
      "state": "Sachsen",
      "amtsgericht": "Amtsgericht Dresden",
      "registernummer": "HRB 9042",
      "registerart": "HRB",
      "company_name": "Flugplatz Rothenburg/ Görlitz GmbH",
      "company_seat": "Rothenburg/OL",
      "details": "20.12.2024 (Bekanntmachungsdatum)\n\nSachsen Amtsgericht Dresden HRB 9042\nEinreichung neuer Dokumente\n\nFlugplatz Rothenburg/ Görlitz GmbH\nGesellschaft mit beschränkter Haftung\nRothenburg/OL\n\nAm 19.12.2024 wurde beim Handelsregister des Amtsgerichts Dresden die Liste der Mitglieder des Aufsichtsrats gemäß § 52 GmbHG eingereicht."
    },
    {
      "date": "2024-12-20",
      "id": "97169",
      "original_text": "Einreichung neuer Dokumente\nHamburg Amtsgericht Hamburg HRB 171306\nAirbus Aerostructures GmbH – Hamburg",
      "type": "Einreichung neuer Dokumente",
      "state": "Hamburg",
      "amtsgericht": "Amtsgericht Hamburg",
      "registernummer": "HRB 171306",
      "registerart": "HRB",
      "company_name": "Airbus Aerostructures GmbH",
      "company_seat": "Hamburg",
      "details": "20.12.2024 (Bekanntmachungsdatum)\n\nHamburg Amtsgericht Hamburg HRB 171306\nEinreichung neuer Dokumente\n\nAirbus Aerostructures GmbH\nGesellschaft mit beschränkter Haftung\nHamburg\n\nAls nicht eingetragen wird bekannt gemacht: Liste des Aufsichtsrats wurde eingereicht."
    },
    {
      "date": "2024-12-20",
      "id": "97170",
      "original_text": "Sonstige Registerbekanntmachung\nNiedersachsen Amtsgericht Hannover HRB 213496\nGemeinde Wedemark Bau- und Entwicklungsgesellschaft mbH – Wedemark",
      "type": "Sonstige Registerbekanntmachung",
      "state": "Niedersachsen",
      "amtsgericht": "Amtsgericht Hannover",
      "registernummer": "HRB 213496",
      "registerart": "HRB",
      "company_name": "Gemeinde Wedemark Bau- und Entwicklungsgesellschaft mbH",
      "company_seat": "Wedemark",
      "details": "20.12.2024 (Bekanntmachungsdatum)\n\nNiedersachsen Amtsgericht Hannover HRB 213496\nSonstige Registerbekanntmachung\n\nGemeinde Wedemark Bau- und Entwicklungsgesellschaft mbH\nGesellschaft mit beschränkter Haftung\nWedemark\n\nDie Liste der Mitglieder des Aufsichtsrats wurde beim Registergericht eingereicht."
    },
    {
      "date": "2024-12-20",
      "id": "97171",
      "original_text": "Registerbekanntmachung nach dem Umwandlungsgesetz\nNiedersachsen Amtsgericht Tostedt GsR 205\nBöhnke & Zabad eGbR – Jesteburg",
      "type": "Registerbekanntmachung nach dem Umwandlungsgesetz",
      "state": "Niedersachsen",
      "amtsgericht": "Amtsgericht Tostedt",
      "registernummer": "GsR 205",
      "registerart": "GsR",
      "company_name": "Böhnke & Zabad eGbR",
      "company_seat": "Jesteburg",
      "details": "20.12.2024 (Bekanntmachungsdatum)\n\nNiedersachsen Amtsgericht Tostedt GsR 205\nRegisterbekanntmachung nach dem Umwandlungsgesetz 20.12.2024 (Eintragungsdatum)\n\nBöhnke & Zabad eGbR\nGesellschaft bürgerlichen Rechts\nJesteburg\n\nDen Gläubigern der an der formwechselnden Umwandlung beteiligten Rechtsträger ist, wenn sie binnen sechs Monaten nach dem Tag, an dem die Eintragung der Umwandlung in das Register des Sitzes desjenigen Rechtsträgers, dessen Gläubiger sie sind, nach § 19 Abs. 3 UmwG als bekannt gemacht gilt, ihren Anspruch nach Grund und Höhe schriftlich anmelden, Sicherheit zu leisten, soweit sie nicht Befriedigung verlangen können. Dieses Recht steht den Gläubigern jedoch nur zu, wenn sie glaubhaft machen, dass durch die formwechselnde Umwandlung die Erfüllung der Forderung gefährdet wird."
    },
    {
      "date": "2024-12-20",
      "id": "97172",
      "original_text": "Einreichung neuer Dokumente\nNiedersachsen Amtsgericht Oldenburg (Oldenburg) HRB 5236\nEWE NETZ GmbH – Oldenburg",
      "type": "Einreichung neuer Dokumente",
      "state": "Niedersachsen",
      "amtsgericht": "Amtsgericht Oldenburg (Oldenburg)",
      "registernummer": "HRB 5236",
      "registerart": "HRB",
      "company_name": "EWE NETZ GmbH",
      "company_seat": "Oldenburg",
      "details": "20.12.2024 (Bekanntmachungsdatum)\n\nNiedersachsen Amtsgericht Oldenburg (Oldenburg) HRB 5236\nEinreichung neuer Dokumente\n\nEWE NETZ GmbH\nGesellschaft mit beschränkter Haftung\nOldenburg\n\nDie Liste der Mitglieder des Aufsichtsrats wurde beim Registergericht eingereicht."
    },
    {
      "date": "2024-12-20",
      "id": "97173",
      "original_text": "Registerbekanntmachung nach dem Umwandlungsgesetz\nNiedersachsen Amtsgericht Lüneburg HRA 100662 früher Amtsgericht Celle\nOtto Prüser e.K. – Neuenkirchen",
      "type": "Registerbekanntmachung nach dem Umwandlungsgesetz",
      "state": "Niedersachsen",
      "amtsgericht": "Amtsgericht Lüneburg",
      "registernummer": "HRA 100662",
      "registerart": "HRA",
      "company_name": "Otto Prüser e.K.",
      "company_seat": "Neuenkirchen",
      "former_amtsgericht": "Celle",
      "details": "20.12.2024 (Bekanntmachungsdatum)\n\nNiedersachsen Amtsgericht Lüneburg HRA 100662 früher Amtsgericht Celle\nRegisterbekanntmachung nach dem Umwandlungsgesetz 19.12.2024 (Eintragungsdatum)\n\nOtto Prüser e.K.\nEinzelkaufmann / Einzelkauffrau\nNeuenkirchen\n\nDen Gläubigern der an der Ausgliederung beteiligten Rechtsträger ist, wenn sie binnen sechs Monaten nach dem Tag, an dem die Eintragung der Ausgliederung in das Register des Sitzes desjenigen Rechtsträgers, dessen Gläubiger sie sind, nach § 19 Abs. 3 UmwG als bekannt gemacht gilt, ihren Anspruch nach Grund und Höhe schriftlich anmelden, Sicherheit zu leisten, soweit sie nicht Befriedigung verlangen können. Dieses Recht steht den Gläubigern jedoch nur zu, wenn sie glaubhaft machen, dass durch die Ausgliederung die Erfüllung der Forderung gefährdet wird."
    },
    {
      "date": "2024-12-20",
      "id": "97174",
      "original_text": "Registerbekanntmachung nach dem Umwandlungsgesetz\nNiedersachsen Amtsgericht Osnabrück VR 201577\nWissenschaftliche Gesellschaft für Krankenhaustechnik e.V. – Osnabrück",
      "type": "Registerbekanntmachung nach dem Umwandlungsgesetz",
      "state": "Niedersachsen",
      "amtsgericht": "Amtsgericht Osnabrück",
      "registernummer": "VR 201577",
      "registerart": "VR",
      "company_name": "Wissenschaftliche Gesellschaft für Krankenhaustechnik e.V.",
      "company_seat": "Osnabrück",
      "details": "20.12.2024 (Bekanntmachungsdatum)\n\nNiedersachsen Amtsgericht Osnabrück VR 201577\nRegisterbekanntmachung nach dem Umwandlungsgesetz 20.12.2024 (Eintragungsdatum)\n\nWissenschaftliche Gesellschaft für Krankenhaustechnik e.V.\neingetragener Verein\nOsnabrück\n\nDen Gläubigern der an der Verschmelzung beteiligten Rechtsträger ist, wenn sie binnen sechs Monaten nach dem Tag, an dem die Eintragung der Verschmelzung in das Register des Sitzes desjenigen Rechtsträgers, dessen Gläubiger sie sind, nach § 19  Abs.  3 UmwG als bekannt gemacht gilt, ihren Anspruch nach Grund und Höhe schriftlich anmelden, Sicherheit zu leisten, soweit sie nicht Befriedigung verlangen können. Dieses Recht steht den Gläubigern jedoch nur zu, wenn sie glaubhaft machen, dass durch die Verschmelzung die Erfüllung der Forderung gefährdet wird."
    },
    {
      "date": "2024-12-20",
      "id": "97175",
      "original_text": "Sonstige Registerbekanntmachung\nNiedersachsen Amtsgericht Göttingen VR 202437\nKiTa Förderverein Bilshausen e.V. – Bilshausen",
      "type": "Sonstige Registerbekanntmachung",
      "state": "Niedersachsen",
      "amtsgericht": "Amtsgericht Göttingen",
      "registernummer": "VR 202437",
      "registerart": "VR",
      "company_name": "KiTa Förderverein Bilshausen e.V.",
      "company_seat": "Bilshausen",
      "details": "20.12.2024 (Bekanntmachungsdatum)\n\nNiedersachsen Amtsgericht Göttingen VR 202437\nSonstige Registerbekanntmachung 20.12.2024 (Eintragungsdatum)\n\nKiTa Förderverein Bilshausen e.V.\neingetragener Verein\nBilshausen\n\nAnschrift des Vereins: c/o Vera Elbeshausen, Fabrikstraße 4, 37434 Bilshausen"
    },
    {
      "date": "2024-12-20",
      "id": "97176",
      "original_text": "Einreichung neuer Dokumente\nNiedersachsen Amtsgericht Hannover HRB 7628\nNorddeutsche Genossenschaftliche Beteiligungs-Aktiengesellschaft – Hannover",
      "type": "Einreichung neuer Dokumente",
      "state": "Niedersachsen",
      "amtsgericht": "Amtsgericht Hannover",
      "registernummer": "HRB 7628",
      "registerart": "HRB",
      "company_name": "Norddeutsche Genossenschaftliche Beteiligungs-Aktiengesellschaft",
      "company_seat": "Hannover",
      "details": "20.12.2024 (Bekanntmachungsdatum)\n\nNiedersachsen Amtsgericht Hannover HRB 7628\nEinreichung neuer Dokumente\n\nNorddeutsche Genossenschaftliche Beteiligungs-Aktiengesellschaft\nAktiengesellschaft\nHannover\n\nDie Liste der Mitglieder des Aufsichtsrats wurde beim Registergericht eingereicht."
    },
    {
      "date": "2024-12-20",
      "id": "97177",
      "original_text": "Registerbekanntmachung nach dem Umwandlungsgesetz\nNiedersachsen Amtsgericht Hildesheim HRB 200032\nLa Patria Verwaltungs GmbH – Gronau (Leine)",
      "type": "Registerbekanntmachung nach dem Umwandlungsgesetz",
      "state": "Niedersachsen",
      "amtsgericht": "Amtsgericht Hildesheim",
      "registernummer": "HRB 200032",
      "registerart": "HRB",
      "company_name": "La Patria Verwaltungs GmbH",
      "company_seat": "Gronau (Leine)",
      "details": "20.12.2024 (Bekanntmachungsdatum)\n\nNiedersachsen Amtsgericht Hildesheim HRB 200032\nRegisterbekanntmachung nach dem Umwandlungsgesetz 20.12.2024 (Eintragungsdatum)\n\nLa Patria Verwaltungs GmbH\nGesellschaft mit beschränkter Haftung\nGronau (Leine)\n\nDen Gläubigern der an der Verschmelzung beteiligten Rechtsträger ist, wenn sie binnen sechs Monaten nach dem Tag, an dem die Eintragung der Verschmelzung in das Register des Sitzes desjenigen Rechtsträgers, dessen Gläubiger sie sind, nach § 19  Abs.  3 UmwG als bekannt gemacht gilt, ihren Anspruch nach Grund und Höhe schriftlich anmelden, Sicherheit zu leisten, soweit sie nicht Befriedigung verlangen können. Dieses Recht steht den Gläubigern jedoch nur zu, wenn sie glaubhaft machen, dass durch die Verschmelzung die Erfüllung der Forderung gefährdet wird."
    },
    {
      "date": "2024-12-20",
      "id": "97178",
      "original_text": "Registerbekanntmachung nach dem Umwandlungsgesetz\nNiedersachsen Amtsgericht Hannover HRB 203682\nPM Peiner Maschinen GmbH – Hannover",
      "type": "Registerbekanntmachung nach dem Umwandlungsgesetz",
      "state": "Niedersachsen",
      "amtsgericht": "Amtsgericht Hannover",
      "registernummer": "HRB 203682",
      "registerart": "HRB",
      "company_name": "PM Peiner Maschinen GmbH",
      "company_seat": "Hannover",
      "details": "20.12.2024 (Bekanntmachungsdatum)\n\nNiedersachsen Amtsgericht Hannover HRB 203682\nRegisterbekanntmachung nach dem Umwandlungsgesetz 19.12.2024 (Eintragungsdatum)\n\nPM Peiner Maschinen GmbH\nGesellschaft mit beschränkter Haftung\nHannover\n\nDen Gläubigern der an der Verschmelzung beteiligten Rechtsträger ist, wenn sie binnen sechs Monaten nach dem Tag, an dem die Eintragung der Verschmelzung in das Register des Sitzes desjenigen Rechtsträgers, dessen Gläubiger sie sind, nach § 19  Abs.  3 UmwG als bekannt gemacht gilt, ihren Anspruch nach Grund und Höhe schriftlich anmelden, Sicherheit zu leisten, soweit sie nicht Befriedigung verlangen können. Dieses Recht steht den Gläubigern jedoch nur zu, wenn sie glaubhaft machen, dass durch die Verschmelzung die Erfüllung der Forderung gefährdet wird."
    },
    {
      "date": "2024-12-20",
      "id": "97179",
      "original_text": "Registerbekanntmachung nach dem Umwandlungsgesetz\nNiedersachsen Amtsgericht Braunschweig HRB 211202\nZukunft[s]Energie Aktiengesellschaft – Langelsheim",
      "type": "Registerbekanntmachung nach dem Umwandlungsgesetz",
      "state": "Niedersachsen",
      "amtsgericht": "Amtsgericht Braunschweig",
      "registernummer": "HRB 211202",
      "registerart": "HRB",
      "company_name": "Zukunft[s]Energie Aktiengesellschaft",
      "company_seat": "Langelsheim",
      "details": "20.12.2024 (Bekanntmachungsdatum)\n\nNiedersachsen Amtsgericht Braunschweig HRB 211202\nRegisterbekanntmachung nach dem Umwandlungsgesetz 20.12.2024 (Eintragungsdatum)\n\nZukunft[s]Energie Aktiengesellschaft\nAktiengesellschaft\nLangelsheim\n\nDen Gläubigern der an der formwechselnden Umwandlung beteiligten Rechtsträger ist, wenn sie binnen sechs Monaten nach dem Tag, an dem die Eintragung der Umwandlung in das Register des Sitzes desjenigen Rechtsträgers, dessen Gläubiger sie sind, nach § 19 Abs. 3 UmwG als bekannt gemacht gilt, ihren Anspruch nach Grund und Höhe schriftlich anmelden, Sicherheit zu leisten, soweit sie nicht Befriedigung verlangen können. Dieses Recht steht den Gläubigern jedoch nur zu, wenn sie glaubhaft machen, dass durch die formwechselnde Umwandlung die Erfüllung der Forderung gefährdet wird."
    },
    {
      "date": "2024-12-20",
      "id": "97180",
      "original_text": "Registerbekanntmachung nach dem Umwandlungsgesetz\nNiedersachsen Amtsgericht Braunschweig HRB 206731\nFernlast Verwaltungsgesellschaft mbH – Braunschweig",
      "type": "Registerbekanntmachung nach dem Umwandlungsgesetz",
      "state": "Niedersachsen",
      "amtsgericht": "Amtsgericht Braunschweig",
      "registernummer": "HRB 206731",
      "registerart": "HRB",
      "company_name": "Fernlast Verwaltungsgesellschaft mbH",
      "company_seat": "Braunschweig",
      "details": "20.12.2024 (Bekanntmachungsdatum)\n\nNiedersachsen Amtsgericht Braunschweig HRB 206731\nRegisterbekanntmachung nach dem Umwandlungsgesetz 20.12.2024 (Eintragungsdatum)\n\nFernlast Verwaltungsgesellschaft mbH\nGesellschaft mit beschränkter Haftung\nBraunschweig\n\nDen Gläubigern der an der Verschmelzung beteiligten Rechtsträger ist, wenn sie binnen sechs Monaten nach dem Tag, an dem die Eintragung der Verschmelzung in das Register des Sitzes desjenigen Rechtsträgers, dessen Gläubiger sie sind, nach § 19  Abs.  3 UmwG als bekannt gemacht gilt, ihren Anspruch nach Grund und Höhe schriftlich anmelden, Sicherheit zu leisten, soweit sie nicht Befriedigung verlangen können. Dieses Recht steht den Gläubigern jedoch nur zu, wenn sie glaubhaft machen, dass durch die Verschmelzung die Erfüllung der Forderung gefährdet wird."
    },
    {
      "date": "2024-12-20",
      "id": "97181",
      "original_text": "Registerbekanntmachung nach dem Umwandlungsgesetz\nNiedersachsen Amtsgericht Tostedt HRB 211253\nBöhnke & Zabad GmbH – Jesteburg",
      "type": "Registerbekanntmachung nach dem Umwandlungsgesetz",
      "state": "Niedersachsen",
      "amtsgericht": "Amtsgericht Tostedt",
      "registernummer": "HRB 211253",
      "registerart": "HRB",
      "company_name": "Böhnke & Zabad GmbH",
      "company_seat": "Jesteburg",
      "details": "20.12.2024 (Bekanntmachungsdatum)\n\nNiedersachsen Amtsgericht Tostedt HRB 211253\nRegisterbekanntmachung nach dem Umwandlungsgesetz 20.12.2024 (Eintragungsdatum)\n\nBöhnke & Zabad GmbH\nGesellschaft mit beschränkter Haftung\nJesteburg\n\nDen Gläubigern der an der formwechselnden Umwandlung beteiligten Rechtsträger ist, wenn sie binnen sechs Monaten nach dem Tag, an dem die Eintragung der Umwandlung in das Register des Sitzes desjenigen Rechtsträgers, dessen Gläubiger sie sind, nach § 19 Abs. 3 UmwG als bekannt gemacht gilt, ihren Anspruch nach Grund und Höhe schriftlich anmelden, Sicherheit zu leisten, soweit sie nicht Befriedigung verlangen können. Dieses Recht steht den Gläubigern jedoch nur zu, wenn sie glaubhaft machen, dass durch die formwechselnde Umwandlung die Erfüllung der Forderung gefährdet wird."
    },
    {
      "date": "2024-12-20",
      "id": "97182",
      "original_text": "Registerbekanntmachung nach dem Umwandlungsgesetz\nNiedersachsen Amtsgericht Hannover HRB 200679\nElevator-Gesellschaft mit beschränkter Haftung – Hannover",
      "type": "Registerbekanntmachung nach dem Umwandlungsgesetz",
      "state": "Niedersachsen",
      "amtsgericht": "Amtsgericht Hannover",
      "registernummer": "HRB 200679",
      "registerart": "HRB",
      "company_name": "Elevator-Gesellschaft mit beschränkter Haftung",
      "company_seat": "Hannover",
      "details": "20.12.2024 (Bekanntmachungsdatum)\n\nNiedersachsen Amtsgericht Hannover HRB 200679\nRegisterbekanntmachung nach dem Umwandlungsgesetz 19.12.2024 (Eintragungsdatum)\n\nElevator-Gesellschaft mit beschränkter Haftung\nGesellschaft mit beschränkter Haftung\nHannover\n\nDen Gläubigern der an der Verschmelzung beteiligten Rechtsträger ist, wenn sie binnen sechs Monaten nach dem Tag, an dem die Eintragung der Verschmelzung in das Register des Sitzes desjenigen Rechtsträgers, dessen Gläubiger sie sind, nach § 19  Abs.  3 UmwG als bekannt gemacht gilt, ihren Anspruch nach Grund und Höhe schriftlich anmelden, Sicherheit zu leisten, soweit sie nicht Befriedigung verlangen können. Dieses Recht steht den Gläubigern jedoch nur zu, wenn sie glaubhaft machen, dass durch die Verschmelzung die Erfüllung der Forderung gefährdet wird."
    },
    {
      "date": "2024-12-20",
      "id": "97183",
      "original_text": "Einreichung neuer Dokumente\nNiedersachsen Amtsgericht Hannover HRB 58629\nBantleon Invest AG – Hannover",
      "type": "Einreichung neuer Dokumente",
      "state": "Niedersachsen",
      "amtsgericht": "Amtsgericht Hannover",
      "registernummer": "HRB 58629",
      "registerart": "HRB",
      "company_name": "Bantleon Invest AG",
      "company_seat": "Hannover",
      "details": "20.12.2024 (Bekanntmachungsdatum)\n\nNiedersachsen Amtsgericht Hannover HRB 58629\nEinreichung neuer Dokumente\n\nBantleon Invest AG\nAktiengesellschaft\nHannover\n\nDie Liste der Mitglieder des Aufsichtsrats wurde beim Registergericht eingereicht."
    },
    {
      "date": "2024-12-20",
      "id": "97184",
      "original_text": "Registerbekanntmachung nach dem Umwandlungsgesetz\nBremen Amtsgericht Bremen HRB 40532\nTibella Projekt GmbH – Bremen",
      "type": "Registerbekanntmachung nach dem Umwandlungsgesetz",
      "state": "Bremen",
      "amtsgericht": "Amtsgericht Bremen",
      "registernummer": "HRB 40532",
      "registerart": "HRB",
      "company_name": "Tibella Projekt GmbH",
      "company_seat": "Bremen",
      "details": "20.12.2024 (Bekanntmachungsdatum)\n\nBremen Amtsgericht Bremen HRB 40532\nRegisterbekanntmachung nach dem Umwandlungsgesetz 18.12.2024 (Eintragungsdatum)\n\nTibella Projekt GmbH\nGesellschaft mit beschränkter Haftung\nBremen\n\nZu Eintragungsnummer 3 vom 18.12.2024 wird als nicht eingetragen veröffentlicht: Den Gläubigern der an der Verschmelzung beteiligten Rechtsträger ist, wenn sie binnen sechs Monaten nach dem Tag, an dem die Eintragung der Verschmelzung in das Register des Sitzes desjenigen Rechtsträgers, dessen Gläubiger sie sind, als bekannt gemacht gilt, ihren Anspruch nach Grund und Höhe schriftlich anmelden, Sicherheit zu leisten, soweit sie nicht Befriedigung verlangen können. Dieses Recht steht den Gläubigern jedoch nur zu, wenn sie glaubhaft machen, dass durch die Verschmelzung die Erfüllung ihrer Forderung gefährdet wird. Das Recht, Sicherheitsleistung zu verlangen, steht Gläubigern nicht zu, die im Falle der Insolvenz ein Recht auf vorzugsweise Befriedigung aus einer Deckungsmasse haben, die nach gesetzlicher Vorschrift zu ihrem Schutz errichtet und staatlich überwacht ist."
    },
    {
      "date": "2024-12-20",
      "id": "97185",
      "original_text": "Registerbekanntmachung nach dem Umwandlungsgesetz\nRheinland-Pfalz Amtsgericht Kaiserslautern HRB 3606\nA & T Schmitt Holdinggesellschaft mbH – Kaiserslautern",
      "type": "Registerbekanntmachung nach dem Umwandlungsgesetz",
      "state": "Rheinland-Pfalz",
      "amtsgericht": "Amtsgericht Kaiserslautern",
      "registernummer": "HRB 3606",
      "registerart": "HRB",
      "company_name": "A & T Schmitt Holdinggesellschaft mbH",
      "company_seat": "Kaiserslautern",
      "details": "20.12.2024 (Bekanntmachungsdatum)\n\nRheinland-Pfalz Amtsgericht Kaiserslautern HRB 3606\nRegisterbekanntmachung nach dem Umwandlungsgesetz 20.12.2024 (Eintragungsdatum)\n\nA & T Schmitt Holdinggesellschaft mbH\nGesellschaft mit beschränkter Haftung\nKaiserslautern\n\nAls nicht eingetragen wird veröffentlicht: Den Gläubigern der an der Verschmelzung beteiligten Rechtsträger ist, wenn sie binnen sechs Monaten nach dem Tag, an dem die Eintragung der Verschmelzung in das Register des Sitzes desjenigen Rechtsträgers, dessen Gläubiger sie sind, nach § 19 Abs. 3 UmwG als bekannt gemacht gilt, ihren Anspruch nach Grund und Höhe schriftlich anmelden, Sicherheit zu leisten, soweit sie nicht Befriedigung verlangen können. Dieses Recht steht den Gläubigern jedoch nur zu, wenn sie glaubhaft machen, dass durch die Verschmelzung die Erfüllung der Forderung gefährdet wird."
    },
    {
      "date": "2024-12-20",
      "id": "97186",
      "original_text": "Registerbekanntmachung nach dem Umwandlungsgesetz\nRheinland-Pfalz Amtsgericht Mainz HRB 40320\nEB Secco GmbH – Wörrstadt",
      "type": "Registerbekanntmachung nach dem Umwandlungsgesetz",
      "state": "Rheinland-Pfalz",
      "amtsgericht": "Amtsgericht Mainz",
      "registernummer": "HRB 40320",
      "registerart": "HRB",
      "company_name": "EB Secco GmbH",
      "company_seat": "Wörrstadt",
      "details": "20.12.2024 (Bekanntmachungsdatum)\n\nRheinland-Pfalz Amtsgericht Mainz HRB 40320\nRegisterbekanntmachung nach dem Umwandlungsgesetz 20.12.2024 (Eintragungsdatum)\n\nEB Secco GmbH\nGesellschaft mit beschränkter Haftung\nWörrstadt\n\nAls nicht eingetragen wird veröffentlicht: Den Gläubigern der an der Spaltung beteiligten Rechtsträger ist, wenn sie binnen sechs Monaten nach dem Tag, an dem die Eintragung der Spaltung in das Register des Sitzes desjenigen Rechtsträgers, dessen Gläubiger sie sind, nach § 19 Abs. 3 UmwG als bekanntgemacht gilt, ihren Anspruch nach Grund und Höhe schriftlich anmelden, Sicherheit zu leisten, soweit sie nicht Befriedigung verlangen können. Dieses Recht steht den Gläubigern jedoch nur zu, wenn sie glaubhaft machen, dass durch die Spaltung die Erfüllung der Forderung gefährdet wird."
    },
    {
      "date": "2024-12-20",
      "id": "97187",
      "original_text": "Registerbekanntmachung nach dem Umwandlungsgesetz\nRheinland-Pfalz Amtsgericht Montabaur HRB 27502\nHumano Care Nord GmbH – Vettelschoß",
      "type": "Registerbekanntmachung nach dem Umwandlungsgesetz",
      "state": "Rheinland-Pfalz",
      "amtsgericht": "Amtsgericht Montabaur",
      "registernummer": "HRB 27502",
      "registerart": "HRB",
      "company_name": "Humano Care Nord GmbH",
      "company_seat": "Vettelschoß",
      "details": "20.12.2024 (Bekanntmachungsdatum)\n\nRheinland-Pfalz Amtsgericht Montabaur HRB 27502\nRegisterbekanntmachung nach dem Umwandlungsgesetz\n\nHumano Care Nord GmbH\nGesellschaft mit beschränkter Haftung\nVettelschoß\n\nAls nicht eingetragen wird veröffentlicht: Den Gläubigern der an der Ausgliederung beteiligten Rechtsträger ist, wenn sie binnen sechs Monaten nach dem Tag, an dem die Eintragung der Ausgliederung in das Register des Sitzes desjenigen Rechtsträgers ,dessen Gläubiger sie sind, nach § 19 Abs. 3 UmwG als bekannt gemacht gilt, ihren Anspruch nach Grund und Höhe schriftlich anmelden, Sicherheit zu leisten, soweit sie nicht Befriedigung verlangen können. Dieses Recht steht den Gläubigern jedoch nur zu, wenn sie glaubhaft machen, dass durch die Ausgliederung die Erfüllung der Forderung gefährdet wird."
    },
    {
      "date": "2024-12-20",
      "id": "97188",
      "original_text": "Einreichung neuer Dokumente\nRheinland-Pfalz Amtsgericht Mainz HRB 43019\nZentrale Beteiligungsgesellschaft der Stadt Mainz mit beschränkter Haftung – Mainz",
      "type": "Einreichung neuer Dokumente",
      "state": "Rheinland-Pfalz",
      "amtsgericht": "Amtsgericht Mainz",
      "registernummer": "HRB 43019",
      "registerart": "HRB",
      "company_name": "Zentrale Beteiligungsgesellschaft der Stadt Mainz mit beschränkter Haftung",
      "company_seat": "Mainz",
      "details": "20.12.2024 (Bekanntmachungsdatum)\n\nRheinland-Pfalz Amtsgericht Mainz HRB 43019\nEinreichung neuer Dokumente\n\nZentrale Beteiligungsgesellschaft der Stadt Mainz mit beschränkter Haftung\nGesellschaft mit beschränkter Haftung\nMainz\n\nDem Registergericht ist eine neue Liste der Mitglieder des Aufsichtsrates eingereicht worden."
    },
    {
      "date": "2024-12-20",
      "id": "97189",
      "original_text": "Registerbekanntmachung nach dem Umwandlungsgesetz\nRheinland-Pfalz Amtsgericht Kaiserslautern HRB 31860\nAMS Vertriebs GmbH – Kaiserslautern",
      "type": "Registerbekanntmachung nach dem Umwandlungsgesetz",
      "state": "Rheinland-Pfalz",
      "amtsgericht": "Amtsgericht Kaiserslautern",
      "registernummer": "HRB 31860",
      "registerart": "HRB",
      "company_name": "AMS Vertriebs GmbH",
      "company_seat": "Kaiserslautern",
      "details": "20.12.2024 (Bekanntmachungsdatum)\n\nRheinland-Pfalz Amtsgericht Kaiserslautern HRB 31860\nRegisterbekanntmachung nach dem Umwandlungsgesetz 20.12.2024 (Eintragungsdatum)\n\nAMS Vertriebs GmbH\nGesellschaft mit beschränkter Haftung\nKaiserslautern\n\nAls nicht eingetragen wird veröffentlicht: Den Gläubigern der an der Verschmelzung beteiligten Rechtsträger ist, wenn sie binnen sechs Monaten nach dem Tag, an dem die Eintragung der Verschmelzung in das Register des Sitzes desjenigen Rechtsträgers, dessen Gläubiger sie sind, nach § 19 Abs. 3 UmwG als bekannt gemacht gilt, ihren Anspruch nach Grund und Höhe schriftlich anmelden, Sicherheit zu leisten, soweit sie nicht Befriedigung verlangen können. Dieses Recht steht den Gläubigern jedoch nur zu, wenn sie glaubhaft machen, dass durch die Verschmelzung die Erfüllung der Forderung gefährdet wird."
    },
    {
      "date": "2024-12-20",
      "id": "97190",
      "original_text": "Registerbekanntmachung nach dem Umwandlungsgesetz\nRheinland-Pfalz Amtsgericht Bad Kreuznach HRA 11802\nNatursteinwerk Baumholder GmbH & Co. KG – Niederwörresbach",
      "type": "Registerbekanntmachung nach dem Umwandlungsgesetz",
      "state": "Rheinland-Pfalz",
      "amtsgericht": "Amtsgericht Bad Kreuznach",
      "registernummer": "HRA 11802",
      "registerart": "HRA",
      "company_name": "Natursteinwerk Baumholder GmbH & Co. KG",
      "company_seat": "Niederwörresbach",
      "details": "20.12.2024 (Bekanntmachungsdatum)\n\nRheinland-Pfalz Amtsgericht Bad Kreuznach HRA 11802\nRegisterbekanntmachung nach dem Umwandlungsgesetz 20.12.2024 (Eintragungsdatum)\n\nNatursteinwerk Baumholder GmbH & Co. KG\nKommanditgesellschaft\nNiederwörresbach\n\nAls nicht eingetragen wird veröffentlicht: Den Gläubigern der an der Verschmelzung beteiligten Rechtsträger ist, wenn sie binnen sechs Monaten nach dem Tag, an dem die Eintragung der Verschmelzung in das Register des Sitzes desjenigen Rechtsträgers,dessen Gläubiger sie sind, nach § 19 Abs. 3 UmwG als bekannt gemacht gilt, ihren Anspruch nach Grund und Höhe schriftlich anmelden, Sicherheit zu leisten, soweit sie nicht Befriedigung verlangen können. Dieses Recht steht den Gläubigern jedoch nur zu, wenn sie glaubhaft machen, dass durch die Verschmelzung die Erfüllung der Forderung gefährdet wird."
    },
    {
      "date": "2024-12-20",
      "id": "97191",
      "original_text": "Registerbekanntmachung nach dem Umwandlungsgesetz\nRheinland-Pfalz Amtsgericht Mainz HRB 52577\nSeccoherstellung MENGEL-EPPELMANN GmbH – Stadecken-Elsheim",
      "type": "Registerbekanntmachung nach dem Umwandlungsgesetz",
      "state": "Rheinland-Pfalz",
      "amtsgericht": "Amtsgericht Mainz",
      "registernummer": "HRB 52577",
      "registerart": "HRB",
      "company_name": "Seccoherstellung MENGEL-EPPELMANN GmbH",
      "company_seat": "Stadecken-Elsheim",
      "details": "20.12.2024 (Bekanntmachungsdatum)\n\nRheinland-Pfalz Amtsgericht Mainz HRB 52577\nRegisterbekanntmachung nach dem Umwandlungsgesetz 20.12.2024 (Eintragungsdatum)\n\nSeccoherstellung MENGEL-EPPELMANN GmbH\nGesellschaft mit beschränkter Haftung\nStadecken-Elsheim\n\nAls nicht eingetragen wird veröffentlicht: Den Gläubigern der an der Spaltung beteiligten Rechtsträger ist, wenn sie binnen sechs Monaten nach dem Tag, an dem die Eintragung der Spaltung in das Register des Sitzes desjenigen Rechtsträgers, dessen Gläubiger sie sind, nach § 19 Abs. 3 UmwG als bekanntgemacht gilt, ihren Anspruch nach Grund und Höhe schriftlich anmelden, Sicherheit zu leisten, soweit sie nicht Befriedigung verlangen können. Dieses Recht steht den Gläubigern jedoch nur zu, wenn sie glaubhaft machen, dass durch die Spaltung die Erfüllung der Forderung gefährdet wird."
    },
    {
      "date": "2024-12-20",
      "id": "97192",
      "original_text": "Löschungsankündigung\nRheinland-Pfalz Amtsgericht Mainz HRB 5483\nMorlock & Partner Finanzmakler GmbH – Mainz",
      "type": "Löschungsankündigung",
      "state": "Rheinland-Pfalz",
      "amtsgericht": "Amtsgericht Mainz",
      "registernummer": "HRB 5483",
      "registerart": "HRB",
      "company_name": "Morlock & Partner Finanzmakler GmbH",
      "company_seat": "Mainz",
      "details": "20.12.2024 (Bekanntmachungsdatum)\n\nRheinland-Pfalz Amtsgericht Mainz HRB 5483\nLöschungsankündigung\n\nMorlock & Partner Finanzmakler GmbH\nGesellschaft mit beschränkter Haftung\nMainz\n\nDas Registergericht beabsichtigt die Gesellschaft von Amts wegen nach § 394 FamFG zu löschen. Die Frist zur Erhebung eines Widerspruchs ist auf einen Monat festgesetzt."
    },
    {
      "date": "2024-12-20",
      "id": "97193",
      "original_text": "Registerbekanntmachung nach dem Umwandlungsgesetz\nNordrhein-Westfalen Amtsgericht Dortmund HRB 36802\nRethmann Unternehmensbeteiligungs AG – Selm",
      "type": "Registerbekanntmachung nach dem Umwandlungsgesetz",
      "state": "Nordrhein-Westfalen",
      "amtsgericht": "Amtsgericht Dortmund",
      "registernummer": "HRB 36802",
      "registerart": "HRB",
      "company_name": "Rethmann Unternehmensbeteiligungs AG",
      "company_seat": "Selm",
      "details": "20.12.2024 (Bekanntmachungsdatum)\n\nNordrhein-Westfalen Amtsgericht Dortmund HRB 36802\nRegisterbekanntmachung nach dem Umwandlungsgesetz 20.12.2024 (Eintragungsdatum)\n\nRethmann Unternehmensbeteiligungs AG\nAktiengesellschaft\nSelm\n\nDen Gläubigern der an der formwechselnden Umwandlung beteiligten Rechtsträger ist, wenn sie binnen sechs Monaten nach dem Tag, an dem die Eintragung der formwechselnden Umwandlung in das Register des Sitzes desjenigen Rechtsträgers, dessen Gläubiger sie sind, nach § 19 Absatz 3 UmwG als bekanntgemacht gilt, ihren Anspruch nach Grund und Höhe schriftlich anmelden, Sicherheit zu leisten, soweit sie nicht Befriedigung verlangen können. Dieses Recht steht den Gläubigern jedoch nur zu, wenn sie glaubhaft machen, dass durch die formwechselnden Umwandlung die Erfüllung ihrer Forderung gefährdet wird."
    },
    {
      "date": "2024-12-20",
      "id": "97194",
      "original_text": "Registerbekanntmachung nach dem Umwandlungsgesetz\nNordrhein-Westfalen Amtsgericht Iserlohn HRA 5744\nVier Jahreszeiten e.K., Inhaber Tomislav Lavric – Werdohl",
      "type": "Registerbekanntmachung nach dem Umwandlungsgesetz",
      "state": "Nordrhein-Westfalen",
      "amtsgericht": "Amtsgericht Iserlohn",
      "registernummer": "HRA 5744",
      "registerart": "HRA",
      "company_name": "Vier Jahreszeiten e.K., Inhaber Tomislav Lavric",
      "company_seat": "Werdohl",
      "details": "20.12.2024 (Bekanntmachungsdatum)\n\nNordrhein-Westfalen Amtsgericht Iserlohn HRA 5744\nRegisterbekanntmachung nach dem Umwandlungsgesetz 20.12.2024 (Eintragungsdatum)\n\nVier Jahreszeiten e.K., Inhaber Tomislav Lavric\nEinzelkaufmann / Einzelkauffrau\nWerdohl\n\nDen Gläubigern der an der Verschmelzung beteiligten Rechtsträger ist, wenn sie binnen sechs Monaten nach dem Tag, an dem die Eintragung der Verschmelzung in das Register des Sitzes desjenigen Rechtsträgers, dessen Gläubiger sie sind, nach § 19 Absatz 3 UmwG als bekanntgemacht gilt, ihren Anspruch nach Grund und Höhe schriftlich anmelden, Sicherheit zu leisten, soweit sie nicht Befriedigung verlangen können. Dieses Recht steht den Gläubigern jedoch nur zu, wenn sie glaubhaft machen, dass durch die Verschmelzung die Erfüllung ihrer Forderung gefährdet wird."
    },
    {
      "date": "2024-12-20",
      "id": "97195",
      "original_text": "Löschungsankündigung\nNordrhein-Westfalen Amtsgericht Dortmund HRB 24312\nMD Hochbau GmbH – Dortmund",
      "type": "Löschungsankündigung",
      "state": "Nordrhein-Westfalen",
      "amtsgericht": "Amtsgericht Dortmund",
      "registernummer": "HRB 24312",
      "registerart": "HRB",
      "company_name": "MD Hochbau GmbH",
      "company_seat": "Dortmund",
      "details": "20.12.2024 (Bekanntmachungsdatum)\n\nNordrhein-Westfalen Amtsgericht Dortmund HRB 24312\nLöschungsankündigung 20.12.2024 (Eintragungsdatum)\n\nMD Hochbau GmbH\nGesellschaft mit beschränkter Haftung\nDortmund\n\nDas Registergericht beabsichtigt die Gesellschaft von Amts wegen nach § 394 FamFG zu löschen. Die Frist zur Erhebung eines Widerspruchs ist auf zwei Monate festgesetzt."
    },
    {
      "date": "2024-12-20",
      "id": "97196",
      "original_text": "Einreichung neuer Dokumente\nNordrhein-Westfalen Amtsgericht Köln HRB 50532\nFMR Grundbesitz AG – Köln",
      "type": "Einreichung neuer Dokumente",
      "state": "Nordrhein-Westfalen",
      "amtsgericht": "Amtsgericht Köln",
      "registernummer": "HRB 50532",
      "registerart": "HRB",
      "company_name": "FMR Grundbesitz AG",
      "company_seat": "Köln",
      "details": "20.12.2024 (Bekanntmachungsdatum)\n\nNordrhein-Westfalen Amtsgericht Köln HRB 50532\nEinreichung neuer Dokumente\n\nFMR Grundbesitz AG\nAktiengesellschaft\nKöln\n\nDem Registergericht ist eine Liste der Mitglieder des Aufsichtsrates eingereicht worden."
    },
    {
      "date": "2024-12-20",
      "id": "97197",
      "original_text": "Registerbekanntmachung nach dem Umwandlungsgesetz\nNordrhein-Westfalen Amtsgericht Köln HRB 86684\nveniture GmbH – Köln",
      "type": "Registerbekanntmachung nach dem Umwandlungsgesetz",
      "state": "Nordrhein-Westfalen",
      "amtsgericht": "Amtsgericht Köln",
      "registernummer": "HRB 86684",
      "registerart": "HRB",
      "company_name": "veniture GmbH",
      "company_seat": "Köln",
      "details": "20.12.2024 (Bekanntmachungsdatum)\n\nNordrhein-Westfalen Amtsgericht Köln HRB 86684\nRegisterbekanntmachung nach dem Umwandlungsgesetz 20.12.2024 (Eintragungsdatum)\n\nveniture GmbH\nGesellschaft mit beschränkter Haftung\nKöln\n\nDen Gläubigern der an der Verschmelzung beteiligten Rechtsträger ist, wenn sie binnen sechs Monaten nach dem Tag, an dem die Eintragung der Verschmelzung in das Register des Sitzes desjenigen Rechtsträgers, dessen Gläubiger sie sind, nach § 19 Absatz 3 UmwG als bekanntgemacht gilt, ihren Anspruch nach Grund und Höhe schriftlich anmelden, Sicherheit zu leisten, soweit sie nicht Befriedigung verlangen können. Dieses Recht steht den Gläubigern jedoch nur zu, wenn sie glaubhaft machen, dass durch die Verschmelzung die Erfüllung ihrer Forderung gefährdet wird."
    },
    {
      "date": "2024-12-20",
      "id": "97198",
      "original_text": "Registerbekanntmachung nach dem Umwandlungsgesetz\nNordrhein-Westfalen Amtsgericht Düsseldorf HRB 75891\nmfi Betriebsgesellschaft mbH – Düsseldorf",
      "type": "Registerbekanntmachung nach dem Umwandlungsgesetz",
      "state": "Nordrhein-Westfalen",
      "amtsgericht": "Amtsgericht Düsseldorf",
      "registernummer": "HRB 75891",
      "registerart": "HRB",
      "company_name": "mfi Betriebsgesellschaft mbH",
      "company_seat": "Düsseldorf",
      "details": "20.12.2024 (Bekanntmachungsdatum)\n\nNordrhein-Westfalen Amtsgericht Düsseldorf HRB 75891\nRegisterbekanntmachung nach dem Umwandlungsgesetz 20.12.2024 (Eintragungsdatum)\n\nmfi Betriebsgesellschaft mbH\nGesellschaft mit beschränkter Haftung\nDüsseldorf\n\nDen Gläubigern der an der Abspaltung beteiligten Rechtsträger ist, wenn sie binnen sechs Monaten nach dem Tag, an dem die Eintragung der Abspaltung in das Register des Sitzes desjenigen Rechtsträgers, dessen Gläubiger sie sind, nach § 19 Absatz 3 UmwG als bekanntgemacht gilt, ihren Anspruch nach Grund und Höhe schriftlich anmelden, Sicherheit zu leisten, soweit sie nicht Befriedigung verlangen können. Dieses Recht steht den Gläubigern jedoch nur zu, wenn sie glaubhaft machen, dass durch die Abspaltung die Erfüllung ihrer Forderung gefährdet wird."
    },
    {
      "date": "2024-12-20",
      "id": "97199",
      "original_text": "Registerbekanntmachung nach dem Umwandlungsgesetz\nNordrhein-Westfalen Amtsgericht Düsseldorf HRB 75817\nUnibail-Rodamco Beteiligungs GmbH – Düsseldorf",
      "type": "Registerbekanntmachung nach dem Umwandlungsgesetz",
      "state": "Nordrhein-Westfalen",
      "amtsgericht": "Amtsgericht Düsseldorf",
      "registernummer": "HRB 75817",
      "registerart": "HRB",
      "company_name": "Unibail-Rodamco Beteiligungs GmbH",
      "company_seat": "Düsseldorf",
      "details": "20.12.2024 (Bekanntmachungsdatum)\n\nNordrhein-Westfalen Amtsgericht Düsseldorf HRB 75817\nRegisterbekanntmachung nach dem Umwandlungsgesetz 20.12.2024 (Eintragungsdatum)\n\nUnibail-Rodamco Beteiligungs GmbH\nGesellschaft mit beschränkter Haftung\nDüsseldorf\n\nDen Gläubigern der an der Verschmelzung beteiligten Rechtsträger ist, wenn sie binnen sechs Monaten nach dem Tag, an dem die Eintragung der Verschmelzung in das Register des Sitzes desjenigen Rechtsträgers, dessen Gläubiger sie sind, nach § 19 Absatz 3 UmwG als bekanntgemacht gilt, ihren Anspruch nach Grund und Höhe schriftlich anmelden, Sicherheit zu leisten, soweit sie nicht Befriedigung verlangen können. Dieses Recht steht den Gläubigern jedoch nur zu, wenn sie glaubhaft machen, dass durch die Verschmelzung die Erfüllung ihrer Forderung gefährdet wird."
    },
    {
      "date": "2024-12-20",
      "id": "97200",
      "original_text": "Löschungsankündigung\nNordrhein-Westfalen Amtsgericht Bonn HRB 22898\nSper Sicherheitstechnik GmbH – Bonn",
      "type": "Löschungsankündigung",
      "state": "Nordrhein-Westfalen",
      "amtsgericht": "Amtsgericht Bonn",
      "registernummer": "HRB 22898",
      "registerart": "HRB",
      "company_name": "Sper Sicherheitstechnik GmbH",
      "company_seat": "Bonn",
      "details": "20.12.2024 (Bekanntmachungsdatum)\n\nNordrhein-Westfalen Amtsgericht Bonn HRB 22898\nLöschungsankündigung\n\nSper Sicherheitstechnik GmbH\nGesellschaft mit beschränkter Haftung\nBonn\n\nDas Registergericht beabsichtigt die im Handelsregister beim Amtsgericht Bonn unter HRB 22898 mit dem Sitz in Bonn eingetragene Gesellschaft Sper Sicherheitstechnik GmbH von Amts wegen nach § 394 FamFG zu löschen. Die Frist zur Erhebung eines Widerspruchs ist auf einen Monat festgesetzt."
    },
    {
      "date": "2024-12-20",
      "id": "97201",
      "original_text": "Einreichung neuer Dokumente\nNordrhein-Westfalen Amtsgericht Düsseldorf HRB 39473\nCECONOMY AG – Düsseldorf",
      "type": "Einreichung neuer Dokumente",
      "state": "Nordrhein-Westfalen",
      "amtsgericht": "Amtsgericht Düsseldorf",
      "registernummer": "HRB 39473",
      "registerart": "HRB",
      "company_name": "CECONOMY AG",
      "company_seat": "Düsseldorf",
      "details": "20.12.2024 (Bekanntmachungsdatum)\n\nNordrhein-Westfalen Amtsgericht Düsseldorf HRB 39473\nEinreichung neuer Dokumente\n\nCECONOMY AG\nAktiengesellschaft\nDüsseldorf\n\nDem Registergericht ist eine Liste der Mitglieder des Aufsichtsrates eingereicht worden."
    },
    {
      "date": "2024-12-20",
      "id": "97202",
      "original_text": "Registerbekanntmachung nach dem Umwandlungsgesetz\nNordrhein-Westfalen Amtsgericht Paderborn HRB 5744\nGeorg Haupt Bekleidungswerke GmbH – Lippstadt",
      "type": "Registerbekanntmachung nach dem Umwandlungsgesetz",
      "state": "Nordrhein-Westfalen",
      "amtsgericht": "Amtsgericht Paderborn",
      "registernummer": "HRB 5744",
      "registerart": "HRB",
      "company_name": "Georg Haupt Bekleidungswerke GmbH",
      "company_seat": "Lippstadt",
      "details": "20.12.2024 (Bekanntmachungsdatum)\n\nNordrhein-Westfalen Amtsgericht Paderborn HRB 5744\nRegisterbekanntmachung nach dem Umwandlungsgesetz 20.12.2024 (Eintragungsdatum)\n\nGeorg Haupt Bekleidungswerke GmbH\nGesellschaft mit beschränkter Haftung\nLippstadt\n\nDen Gläubigern der an der Verschmelzung beteiligten Rechtsträger ist, wenn sie binnen sechs Monaten nach dem Tag, an dem die Eintragung der Verschmelzung in das Register des Sitzes desjenigen Rechtsträgers, dessen Gläubiger sie sind, nach § 19 Absatz 3 UmwG als bekanntgemacht gilt, ihren Anspruch nach Grund und Höhe schriftlich anmelden, Sicherheit zu leisten, soweit sie nicht Befriedigung verlangen können. Dieses Recht steht den Gläubigern jedoch nur zu, wenn sie glaubhaft machen, dass durch die Verschmelzung die Erfüllung ihrer Forderung gefährdet wird."
    },
    {
      "date": "2024-12-20",
      "id": "97203",
      "original_text": "Registerbekanntmachung nach dem Umwandlungsgesetz\nNordrhein-Westfalen Amtsgericht Dortmund HRB 15932\nUNIORG Management GmbH – Dortmund",
      "type": "Registerbekanntmachung nach dem Umwandlungsgesetz",
      "state": "Nordrhein-Westfalen",
      "amtsgericht": "Amtsgericht Dortmund",
      "registernummer": "HRB 15932",
      "registerart": "HRB",
      "company_name": "UNIORG Management GmbH",
      "company_seat": "Dortmund",
      "details": "20.12.2024 (Bekanntmachungsdatum)\n\nNordrhein-Westfalen Amtsgericht Dortmund HRB 15932\nRegisterbekanntmachung nach dem Umwandlungsgesetz 20.12.2024 (Eintragungsdatum)\n\nUNIORG Management GmbH\nGesellschaft mit beschränkter Haftung\nDortmund\n\nDen Gläubigern der an der formwechselnden Umwandlung beteiligten Rechtsträger ist, wenn sie binnen sechs Monaten nach dem Tag, an dem die Eintragung der formwechselnden Umwandlung in das Register des Sitzes desjenigen Rechtsträgers, dessen Gläubiger sie sind, nach § 19 Absatz 3 UmwG als bekanntgemacht gilt, ihren Anspruch nach Grund und Höhe schriftlich anmelden, Sicherheit zu leisten, soweit sie nicht Befriedigung verlangen können. Dieses Recht steht den Gläubigern jedoch nur zu, wenn sie glaubhaft machen, dass durch die formwechselnden Umwandlung die Erfüllung ihrer Forderung gefährdet wird."
    },
    {
      "date": "2024-12-20",
      "id": "97204",
      "original_text": "Registerbekanntmachung nach dem Umwandlungsgesetz\nNordrhein-Westfalen Amtsgericht Dortmund HRB 17973 früher Amtsgericht Lünen\nRethmann Unternehmensbeteiligungs GmbH – Selm",
      "type": "Registerbekanntmachung nach dem Umwandlungsgesetz",
      "state": "Nordrhein-Westfalen",
      "amtsgericht": "Amtsgericht Dortmund",
      "registernummer": "HRB 17973",
      "registerart": "HRB",
      "company_name": "Rethmann Unternehmensbeteiligungs GmbH",
      "company_seat": "Selm",
      "former_amtsgericht": "Lünen",
      "details": "20.12.2024 (Bekanntmachungsdatum)\n\nNordrhein-Westfalen Amtsgericht Dortmund HRB 17973 früher Amtsgericht Lünen\nRegisterbekanntmachung nach dem Umwandlungsgesetz 20.12.2024 (Eintragungsdatum)\n\nRethmann Unternehmensbeteiligungs GmbH\nGesellschaft mit beschränkter Haftung\nSelm\n\nDen Gläubigern der an der formwechselnden Umwandlung beteiligten Rechtsträger ist, wenn sie binnen sechs Monaten nach dem Tag, an dem die Eintragung der formwechselnden Umwandlung in das Register des Sitzes desjenigen Rechtsträgers, dessen Gläubiger sie sind, nach § 19 Absatz 3 UmwG als bekanntgemacht gilt, ihren Anspruch nach Grund und Höhe schriftlich anmelden, Sicherheit zu leisten, soweit sie nicht Befriedigung verlangen können. Dieses Recht steht den Gläubigern jedoch nur zu, wenn sie glaubhaft machen, dass durch die formwechselnden Umwandlung die Erfüllung ihrer Forderung gefährdet wird."
    },
    {
      "date": "2024-12-20",
      "id": "97205",
      "original_text": "Registerbekanntmachung nach dem Umwandlungsgesetz\nNordrhein-Westfalen Amtsgericht Köln HRA 34367\nArt-Invest Hotels Investment GmbH & Co. KG – Köln",
      "type": "Registerbekanntmachung nach dem Umwandlungsgesetz",
      "state": "Nordrhein-Westfalen",
      "amtsgericht": "Amtsgericht Köln",
      "registernummer": "HRA 34367",
      "registerart": "HRA",
      "company_name": "Art-Invest Hotels Investment GmbH & Co. KG",
      "company_seat": "Köln",
      "details": "20.12.2024 (Bekanntmachungsdatum)\n\nNordrhein-Westfalen Amtsgericht Köln HRA 34367\nRegisterbekanntmachung nach dem Umwandlungsgesetz 20.12.2024 (Eintragungsdatum)\n\nArt-Invest Hotels Investment GmbH & Co. KG\nKommanditgesellschaft\nKöln\n\nDen Gläubigern der an der Verschmelzung beteiligten Rechtsträger ist, wenn sie binnen sechs Monaten nach dem Tag, an dem die Eintragung der Verschmelzung in das Register des Sitzes derjenigen Rechtsträger deren Gläubiger sie sind, nach § 19 Absatz 3 UmwG als bekanntgemacht gilt, ihren Anspruch nach Grund und Höhe schriftlich anmelden, Sicherheit zu leisten, soweit sie nicht Befriedigung verlangen können. Dieses Recht steht den Gläubigern jedoch nur zu, wenn sie glaubhaft machen, dass durch die Verschmelzung die Erfüllung ihrer Forderung gefährdet wird."
    },
    {
      "date": "2024-12-20",
      "id": "97206",
      "original_text": "Einreichung neuer Dokumente\nNordrhein-Westfalen Amtsgericht Köln HRB 65425\nEnergiewirtschaftliches Institut an der Universität zu Köln gGmbH – Köln",
      "type": "Einreichung neuer Dokumente",
      "state": "Nordrhein-Westfalen",
      "amtsgericht": "Amtsgericht Köln",
      "registernummer": "HRB 65425",
      "registerart": "HRB",
      "company_name": "Energiewirtschaftliches Institut an der Universität zu Köln gGmbH",
      "company_seat": "Köln",
      "details": "20.12.2024 (Bekanntmachungsdatum)\n\nNordrhein-Westfalen Amtsgericht Köln HRB 65425\nEinreichung neuer Dokumente\n\nEnergiewirtschaftliches Institut an der Universität zu Köln gGmbH\nGesellschaft mit beschränkter Haftung\nKöln\n\nDem Registergericht ist eine Liste der Mitglieder des Aufsichtsrates eingereicht worden."
    },
    {
      "date": "2024-12-20",
      "id": "97207",
      "original_text": "Sonstige Registerbekanntmachung\nNordrhein-Westfalen Amtsgericht Düsseldorf HRB 101001\nWohnquartier Barbara Höfe GmbH – Düsseldorf",
      "type": "Sonstige Registerbekanntmachung",
      "state": "Nordrhein-Westfalen",
      "amtsgericht": "Amtsgericht Düsseldorf",
      "registernummer": "HRB 101001",
      "registerart": "HRB",
      "company_name": "Wohnquartier Barbara Höfe GmbH",
      "company_seat": "Düsseldorf",
      "details": "20.12.2024 (Bekanntmachungsdatum)\n\nNordrhein-Westfalen Amtsgericht Düsseldorf HRB 101001\nSonstige Registerbekanntmachung 20.12.2024 (Eintragungsdatum)\n\nWohnquartier Barbara Höfe GmbH\nGesellschaft mit beschränkter Haftung\nDüsseldorf\n\nDie Gesellschaft ist aufgelöst. Von Amts wegen eingetragen."
    },
    {
      "date": "2024-12-20",
      "id": "97208",
      "original_text": "Löschungsankündigung\nNordrhein-Westfalen Amtsgericht Essen HRA 10581\nALFRIN GmbH & Co. KG – Essen",
      "type": "Löschungsankündigung",
      "state": "Nordrhein-Westfalen",
      "amtsgericht": "Amtsgericht Essen",
      "registernummer": "HRA 10581",
      "registerart": "HRA",
      "company_name": "ALFRIN GmbH & Co. KG",
      "company_seat": "Essen",
      "details": "20.12.2024 (Bekanntmachungsdatum)\n\nNordrhein-Westfalen Amtsgericht Essen HRA 10581\nLöschungsankündigung\n\nALFRIN GmbH & Co. KG\nKommanditgesellschaft\nEssen\n\nDas Registergericht beabsichtigt, die Firma von Amts wegen nach § 394 FamFG zu löschen. Die Frist zur Erhebung eines Widerspruchs ist auf einen Monat festgesetzt."
    },
    {
      "date": "2024-12-20",
      "id": "97209",
      "original_text": "Löschungsankündigung\nNordrhein-Westfalen Amtsgericht Steinfurt HRB 12070\nDie Hausplaner UG (haftungsbeschränkt) – Altenberge",
      "type": "Löschungsankündigung",
      "state": "Nordrhein-Westfalen",
      "amtsgericht": "Amtsgericht Steinfurt",
      "registernummer": "HRB 12070",
      "registerart": "HRB",
      "company_name": "Die Hausplaner UG (haftungsbeschränkt)",
      "company_seat": "Altenberge",
      "details": "20.12.2024 (Bekanntmachungsdatum)\n\nNordrhein-Westfalen Amtsgericht Steinfurt HRB 12070\nLöschungsankündigung\n\nDie Hausplaner UG (haftungsbeschränkt)\nGesellschaft mit beschränkter Haftung\nAltenberge\n\nDas Registergericht beabsichtigt, die im Handelsregister eingetragene Gesellschaft gemäß § 394 Absatz 1 FamFG wegen Vermögenslosigkeit von Amts wegen zu löschen.\n\nGegen diese Verfügung kann Widerspruch eingelegt werden. Die Frist zur Erhebung eines Widerspruchs gegen die beabsichtigte Löschung von Amts wegen ist auf einen Monat festgesetzt.\n\nRechtsbehelfsbelehrung:\n\nGegen diese Verfügung können Sie Widerspruch einlegen.\n\nDer Widerspruch ist bei dem Amtsgericht Steinfurt, Gerichtstraße 2, 48565 Steinfurt schriftlich in deutscher Sprache oder zur Niederschrift der Geschäftsstelle einzulegen. Der Widerspruch kann auch zur Niederschrift der Geschäftsstelle eines jeden Amtsgerichtes abgegeben werden.\nDie Einlegung ist auch durch Übertragung eines elektronischen Dokuments an die elektronische Poststelle des Gerichts möglich. Das elektronische Dokument muss für die Bearbeitung durch das Gericht geeignet und mit einer qualifizierten elektronischen Signatur der verantwortenden Person versehen sein oder von der verantwortenden Person signiert und auf einem sicheren Übermittlungsweg gemäß § 130 a ZPO nach näherer Maßgabe der Verordnung über die technischen Rahmenbedingungen des elektronischen Rechtsverkehrs und über das besondere elektronische Behördenpostfach (BGBl. I, S.3803) eingereicht werden. Weitere Informationen erhalten Sie auf der Internetseite www.justiz.de.\n\nDer Widerspruch muss spätestens innerhalb der gesetzten Frist bei dem Amtsgericht Steinfurt eingegangen sein. Dies gilt auch dann, wenn der Widerspruch zur Niederschrift der Geschäftsstelle eines anderen Amtsgerichtes abgegeben wurde. Die Frist beginnt mit der Veröffentlichung. Fällt das Ende der Frist auf einen Sonntag, einen allgemeinen Feiertag oder Sonnabend, so endet die Frist mit Ablauf des nächsten Werktages.\n\nDer Widerspruch muss die Bezeichnung der angefochtenen Verfügung sowie die Erklärung enthalten, dass Widerspruch gegen diese Verfügung eingelegt wird. Er ist zu unterzeichnen und soll begründet werden."
    },
    {
      "date": "2024-12-20",
      "id": "97210",
      "original_text": "Registerbekanntmachung nach dem Umwandlungsgesetz\nNordrhein-Westfalen Amtsgericht Duisburg HRB 36707\nVERIFINA GmbH – Mülheim an der Ruhr",
      "type": "Registerbekanntmachung nach dem Umwandlungsgesetz",
      "state": "Nordrhein-Westfalen",
      "amtsgericht": "Amtsgericht Duisburg",
      "registernummer": "HRB 36707",
      "registerart": "HRB",
      "company_name": "VERIFINA GmbH",
      "company_seat": "Mülheim an der Ruhr",
      "details": "20.12.2024 (Bekanntmachungsdatum)\n\nNordrhein-Westfalen Amtsgericht Duisburg HRB 36707\nRegisterbekanntmachung nach dem Umwandlungsgesetz 20.12.2024 (Eintragungsdatum)\n\nVERIFINA GmbH\nGesellschaft mit beschränkter Haftung\nMülheim an der Ruhr\n\nDie Gesellschaft hat Gläubigern, deren Forderungen vor dieser Bekanntmachung begründet worden sind, Sicherheit zu leisten, soweit sie nicht Befriedigung verlangen können, wenn sie sich binnen sechs Monaten zu diesem Zweck melden."
    },
    {
      "date": "2024-12-20",
      "id": "97211",
      "original_text": "Registerbekanntmachung nach dem Umwandlungsgesetz\nBaden-Württemberg Amtsgericht Stuttgart HRB 23319\nSika Deutschland GmbH – Stuttgart",
      "type": "Registerbekanntmachung nach dem Umwandlungsgesetz",
      "state": "Baden-Württemberg",
      "amtsgericht": "Amtsgericht Stuttgart",
      "registernummer": "HRB 23319",
      "registerart": "HRB",
      "company_name": "Sika Deutschland GmbH",
      "company_seat": "Stuttgart",
      "details": "20.12.2024 (Bekanntmachungsdatum)\n\nBaden-Württemberg Amtsgericht Stuttgart HRB 23319\nRegisterbekanntmachung nach dem Umwandlungsgesetz 20.12.2024 (Eintragungsdatum)\n\nSika Deutschland GmbH\nGesellschaft mit beschränkter Haftung\nStuttgart\n\nAls nicht eingetragen wird bekanntgemacht:\nDen Gläubigern der an der Verschmelzung beteiligten Rechtsträger ist, wenn sie binnen sechs Monaten nach dem Tag, an dem die Eintragung der Verschmelzung in das Register des Sitzes desjenigen Rechtsträgers, dessen Gläubiger sie sind, nach § 19 Abs. 3 UmwG als bekanntgemacht gilt, ihren Anspruch nach Grund und Höhe schriftlich anmelden, Sicherheit zu leisten, soweit sie nicht Befriedigung verlangen können. Dieses Recht steht den Gläubigern jedoch nur zu, wenn sie glaubhaft machen, dass durch die Verschmelzung die Erfüllung ihrer Forderung gefährdet wird."
    },
    {
      "date": "2024-12-20",
      "id": "97212",
      "original_text": "Registerbekanntmachung nach dem Umwandlungsgesetz\nHessen Amtsgericht Frankfurt am Main HRB 131493\nSicherheitshalber Neumann Jaremko Versicherungsmakler GmbH – Eschborn",
      "type": "Registerbekanntmachung nach dem Umwandlungsgesetz",
      "state": "Hessen",
      "amtsgericht": "Amtsgericht Frankfurt am Main",
      "registernummer": "HRB 131493",
      "registerart": "HRB",
      "company_name": "Sicherheitshalber Neumann Jaremko Versicherungsmakler GmbH",
      "company_seat": "Eschborn",
      "details": "20.12.2024 (Bekanntmachungsdatum)\n\nHessen Amtsgericht Frankfurt am Main HRB 131493\nRegisterbekanntmachung nach dem Umwandlungsgesetz 20.12.2024 (Eintragungsdatum)\n\nSicherheitshalber Neumann Jaremko Versicherungsmakler GmbH\nGesellschaft mit beschränkter Haftung\nEschborn\n\nDen Gläubigern der an der Verschmelzung beteiligten Rechtsträger ist, wenn sie binnen sechs Monaten nach dem Tag, an dem die Eintragung der Verschmelzung in das Register des Sitzes desjenigen Rechtsträgers, dessen Gläubiger sie sind, nach § 19 Absatz 3 UmwG bekannt gemacht worden ist, ihren Anspruch nach Grund und Höhe schriftlich anmelden, Sicherheit zu leisten, soweit sie nicht Befriedigung verlangen können. Dieses Recht steht den Gläubigern jedoch nur zu, wenn sie glaubhaft machen, dass durch die Verschmelzung die Erfüllung ihrer Forderung gefährdet wird."
    },
    {
      "date": "2024-12-20",
      "id": "97213",
      "original_text": "Löschungsankündigung\nHessen Amtsgericht Hanau HRB 98524\nSantek Group Europe GmbH – Hanau",
      "type": "Löschungsankündigung",
      "state": "Hessen",
      "amtsgericht": "Amtsgericht Hanau",
      "registernummer": "HRB 98524",
      "registerart": "HRB",
      "company_name": "Santek Group Europe GmbH",
      "company_seat": "Hanau",
      "details": "20.12.2024 (Bekanntmachungsdatum)\n\nHessen Amtsgericht Hanau HRB 98524\nLöschungsankündigung\n\nSantek Group Europe GmbH\nGesellschaft mit beschränkter Haftung\nHanau\n\nDas Registergericht beabsichtigt die im Handelsregister eingetragene Gesellschaft von Amts wegen nach § 394 FamFG zu löschen. Die Frist zur Erhebung eines Widerspruchs gegen die beabsichtigte Löschung wird auf 3 Monate festgesetzt."
    },
    {
      "date": "2024-12-20",
      "id": "97214",
      "original_text": "Registerbekanntmachung nach dem Umwandlungsgesetz\nHessen Amtsgericht Gießen GnR 429\nEGROH eG (Einkaufsgenossenschaft für Rehabilitationsmittel und Orthopädie-Technik Hessen) – Homberg (Ohm)",
      "type": "Registerbekanntmachung nach dem Umwandlungsgesetz",
      "state": "Hessen",
      "amtsgericht": "Amtsgericht Gießen",
      "registernummer": "GnR 429",
      "registerart": "GnR",
      "company_name": "EGROH eG (Einkaufsgenossenschaft für Rehabilitationsmittel und Orthopädie-Technik Hessen)",
      "company_seat": "Homberg (Ohm)",
      "details": "20.12.2024 (Bekanntmachungsdatum)\n\nHessen Amtsgericht Gießen GnR 429\nRegisterbekanntmachung nach dem Umwandlungsgesetz 20.12.2024 (Eintragungsdatum)\n\nEGROH eG (Einkaufsgenossenschaft für Rehabilitationsmittel und Orthopädie-Technik Hessen)\neingetragene Genossenschaft\nHomberg (Ohm)\n\nDen Gläubigern der an der Verschmelzung beteiligten Rechtsträger ist, wenn sie binnen sechs Monaten nach dem Tag, an dem die Eintragung der Verschmelzung in das Register des Sitzes desjenigen Rechtsträgers, dessen Gläubiger sie sind, nach 19 Absatz 3 UmwG bekannt gemacht worden ist, ihren Anspruch nach Grund und Höhe schriftlich anmelden, Sicherheit zu leisten, soweit sie nicht Befriedigung verlangen können. Dieses Recht steht den Gläubigern jedoch nur zu, wenn sie glaubhaft machen, dass durch die Verschmelzung die Erfüllung ihrer Forderung gefährdet wird."
    },
    {
      "date": "2024-12-20",
      "id": "97215",
      "original_text": "Sonstige Registerbekanntmachung\nHessen Amtsgericht Frankfurt am Main HRB 84069\nClariant SE – Frankfurt am Main",
      "type": "Sonstige Registerbekanntmachung",
      "state": "Hessen",
      "amtsgericht": "Amtsgericht Frankfurt am Main",
      "registernummer": "HRB 84069",
      "registerart": "HRB",
      "company_name": "Clariant SE",
      "company_seat": "Frankfurt am Main",
      "details": "20.12.2024 (Bekanntmachungsdatum)\n\nHessen Amtsgericht Frankfurt am Main HRB 84069\nSonstige Registerbekanntmachung\n\nClariant SE\nEuropäische Aktiengesellschaft (SE)\nFrankfurt am Main\n\nDurch eine Änderung in den Personen der Veraltungsratsmitglieder ist eine Liste der Mitglieder des Verwaltungsrates zum Handelsregister eingereicht worden."
    },
    {
      "date": "2024-12-20",
      "id": "97216",
      "original_text": "Registerbekanntmachung nach dem Umwandlungsgesetz\nHessen Amtsgericht Frankfurt am Main HRB 57160\nLuneta Braunschweig Immobilien GmbH – Frankfurt am Main",
      "type": "Registerbekanntmachung nach dem Umwandlungsgesetz",
      "state": "Hessen",
      "amtsgericht": "Amtsgericht Frankfurt am Main",
      "registernummer": "HRB 57160",
      "registerart": "HRB",
      "company_name": "Luneta Braunschweig Immobilien GmbH",
      "company_seat": "Frankfurt am Main",
      "details": "20.12.2024 (Bekanntmachungsdatum)\n\nHessen Amtsgericht Frankfurt am Main HRB 57160\nRegisterbekanntmachung nach dem Umwandlungsgesetz 20.12.2024 (Eintragungsdatum)\n\nLuneta Braunschweig Immobilien GmbH\nGesellschaft mit beschränkter Haftung\nFrankfurt am Main\n\nEs wird darauf hingewiesen, dass ein Verschmelzungsplan oder sein Entwurf über eine grenzüberschreitende Verschmelzung zur Aufnahme mit der CCP 5 Matrix Holding S.à.r.l mit Sitz in Luxemburg/Luxemburg (Registre de Commerce et des Sociétés B 238972) (société à responsabilité limitée) beim Handelsregister eingereicht worden ist.\nDie Anteilsinhaber, die Gläubiger sowie die zuständigen Betriebsräte der an der grenzüberschreitenden Verschmelzung beteiligten Gesellschaften oder, soweit es keinen Betriebsrat gibt, die Arbeitnehmer der an der grenzüberschreitenden Verschmelzung beteiligten Gesellschaften, können der jeweiligen Gesellschaft spätestens fünf Arbeitstage vor dem Tag der Gesellschafterversammlung Bemerkungen zum Verschmelzungsplan übermitteln.\n1.\tAn der Verschmelzung sind\na)\tals übertragende Gesellschaft die Luneta Braunschweig Immobilien GmbH, eine Gesellschaft mit beschränkter Haftung deutschen Rechts mit dem Sitz in Frankfurt am Main, Bundesrepublik Deutschland, und\nb)\tals aufnehmende Gesellschaft die CCP 5 Matrix Holding S.à.r.l., eine Gesellschaft mit beschränkter Haftung (société à responsabilité limitée) nach dem Recht von Luxemburg mit Sitz in 1 , Allée Scheffer, L-\n2520 Luxemburg, Großherzogtum Luxemburg,\n\nbeteiligt.\n2.\tDie Registerdaten der an der Verschmelzung beteiligten Gesellschaften lauten wie folgt:\na)\tDie übertragende Gesellschaft ist eingetragen im Handelsregister des Amtsgerichts Frankfurt am Main unter HRB 57160.\nb)\tDie aufnehmende Gesellschaft ist eingetragen im Handels- und Gesellschaftsregister von Luxemburg (Registre de Commerce et des Sociétés) unter B 238972.\n3.\tDie Anteilsinhaber und Gläubiger der an der grenzüberschreitenden Verschmelzung beteiligten Gesellschaften werden darauf hingewiesen, dass sie der übertragenden Gesellschaft (an c/o btu beraterpartner GmbH Steuerberatergesellschaft, Feldbergstraße 27-29, 61440 Oberursel, Bundesrepublik Deutschland) spätestens fünf Arbeitstage vor der für den 22.01.2025 vorgesehenen Gesellschafterversammlung Bemerkungen zum Verschmelzungsplan übermitteln können."
    },
    {
      "date": "2024-12-20",
      "id": "97217",
      "original_text": "Registerbekanntmachung nach dem Umwandlungsgesetz\nHessen Amtsgericht Frankfurt am Main HRB 109593\nmertus 366. GmbH – Frankfurt am Main",
      "type": "Registerbekanntmachung nach dem Umwandlungsgesetz",
      "state": "Hessen",
      "amtsgericht": "Amtsgericht Frankfurt am Main",
      "registernummer": "HRB 109593",
      "registerart": "HRB",
      "company_name": "mertus 366. GmbH",
      "company_seat": "Frankfurt am Main",
      "details": "20.12.2024 (Bekanntmachungsdatum)\n\nHessen Amtsgericht Frankfurt am Main HRB 109593\nRegisterbekanntmachung nach dem Umwandlungsgesetz 20.12.2024 (Eintragungsdatum)\n\nmertus 366. GmbH\nGesellschaft mit beschränkter Haftung\nFrankfurt am Main\n\nDen Gläubigern der an der Verschmelzung beteiligten Rechtsträger ist, wenn sie binnen sechs Monaten nach dem Tag, an dem die Eintragung der Verschmelzung in das Register des Sitzes desjenigen Rechtsträgers, dessen Gläubiger sie sind, nach § 19 Absatz 3 UmwG bekannt gemacht worden ist, ihren Anspruch nach Grund und Höhe schriftlich anmelden, Sicherheit zu leisten, soweit sie nicht Befriedigung verlangen können. Dieses Recht steht den Gläubigern jedoch nur zu, wenn sie glaubhaft machen, dass durch die Verschmelzung die Erfüllung ihrer Forderung gefährdet wird."
    },
    {
      "date": "2024-12-20",
      "id": "97218",
      "original_text": "Registerbekanntmachung nach dem Umwandlungsgesetz\nHessen Amtsgericht Offenbach am Main HRB 46721\nQuadoro GmbH – Offenbach am Main",
      "type": "Registerbekanntmachung nach dem Umwandlungsgesetz",
      "state": "Hessen",
      "amtsgericht": "Amtsgericht Offenbach am Main",
      "registernummer": "HRB 46721",
      "registerart": "HRB",
      "company_name": "Quadoro GmbH",
      "company_seat": "Offenbach am Main",
      "details": "20.12.2024 (Bekanntmachungsdatum)\n\nHessen Amtsgericht Offenbach am Main HRB 46721\nRegisterbekanntmachung nach dem Umwandlungsgesetz 20.12.2024 (Eintragungsdatum)\n\nQuadoro GmbH\nGesellschaft mit beschränkter Haftung\nOffenbach am Main\n\nDen Gläubigern der an der Verschmelzung beteiligten Rechtsträger ist, wenn sie binnen sechs Monaten nach dem Tag, an dem die Eintragung der Verschmelzung in das Register des Sitzes desjenigen Rechtsträgers, dessen Gläubiger sie sind, nach § 19 Absatz 3 UmwG bekannt gemacht worden ist, ihren Anspruch nach Grund und Höhe schriftlich anmelden, Sicherheit zu leisten, soweit sie nicht Befriedigung verlangen können. Dieses Recht steht den Gläubigern jedoch nur zu, wenn sie glaubhaft machen, dass durch die Verschmelzung die Erfüllung ihrer Forderung gefährdet wird."
    },
    {
      "date": "2024-12-20",
      "id": "97219",
      "original_text": "Löschungsankündigung\nHessen Amtsgericht Hanau HRB 99076\nFidus Logistics UG (haftungsbeschränkt) – Hanau",
      "type": "Löschungsankündigung",
      "state": "Hessen",
      "amtsgericht": "Amtsgericht Hanau",
      "registernummer": "HRB 99076",
      "registerart": "HRB",
      "company_name": "Fidus Logistics UG (haftungsbeschränkt)",
      "company_seat": "Hanau",
      "details": "20.12.2024 (Bekanntmachungsdatum)\n\nHessen Amtsgericht Hanau HRB 99076\nLöschungsankündigung\n\nFidus Logistics UG (haftungsbeschränkt)\nGesellschaft mit beschränkter Haftung\nHanau\n\nDas Registergericht beabsichtigt die im Handelsregister eingetragene Gesellschaft von Amts wegen nach § 394 FamFG zu löschen. Die Frist zur Erhebung eines Widerspruchs gegen die beabsichtigte Löschung wird auf 3 Monate festgesetzt."
    },
    {
      "date": "2024-12-20",
      "id": "97220",
      "original_text": "Sonstige Registerbekanntmachung\nHessen Amtsgericht Darmstadt HRB 1649\nInstitut Wohnen und Umwelt Gesellschaft mit beschränkter Haftung – Darmstadt",
      "type": "Sonstige Registerbekanntmachung",
      "state": "Hessen",
      "amtsgericht": "Amtsgericht Darmstadt",
      "registernummer": "HRB 1649",
      "registerart": "HRB",
      "company_name": "Institut Wohnen und Umwelt Gesellschaft mit beschränkter Haftung",
      "company_seat": "Darmstadt",
      "details": "20.12.2024 (Bekanntmachungsdatum)\n\nHessen Amtsgericht Darmstadt HRB 1649\nSonstige Registerbekanntmachung\n\nInstitut Wohnen und Umwelt Gesellschaft mit beschränkter Haftung\nGesellschaft mit beschränkter Haftung\nDarmstadt\n\nWegen Änderungen in den Personen der Aufsichtsratsmitglieder ist eine Liste der Mitglieder des Aufsichtsrates zum Handelsregister eingereicht worden."
    },
    {
      "date": "2024-12-20",
      "id": "97221",
      "original_text": "Sonstige Registerbekanntmachung\nHessen Amtsgericht Frankfurt am Main VR 14746\nDialog in der Einen Welt – Frankfurt am Main",
      "type": "Sonstige Registerbekanntmachung",
      "state": "Hessen",
      "amtsgericht": "Amtsgericht Frankfurt am Main",
      "registernummer": "VR 14746",
      "registerart": "VR",
      "company_name": "Dialog in der Einen Welt",
      "company_seat": "Frankfurt am Main",
      "details": "20.12.2024 (Bekanntmachungsdatum)\n\nHessen Amtsgericht Frankfurt am Main VR 14746\nSonstige Registerbekanntmachung 20.12.2024 (Eintragungsdatum)\n\nDialog in der Einen Welt\neingetragener Verein\nFrankfurt am Main\n\nDer Verein ist aufgelöst."
    },
    {
      "date": "2024-12-20",
      "id": "97222",
      "original_text": "Registerbekanntmachung nach dem Umwandlungsgesetz\nHessen Amtsgericht Offenbach am Main HRB 44506\nDoric Vermögensmanagement GmbH – Offenbach am Main",
      "type": "Registerbekanntmachung nach dem Umwandlungsgesetz",
      "state": "Hessen",
      "amtsgericht": "Amtsgericht Offenbach am Main",
      "registernummer": "HRB 44506",
      "registerart": "HRB",
      "company_name": "Doric Vermögensmanagement GmbH",
      "company_seat": "Offenbach am Main",
      "details": "20.12.2024 (Bekanntmachungsdatum)\n\nHessen Amtsgericht Offenbach am Main HRB 44506\nRegisterbekanntmachung nach dem Umwandlungsgesetz 20.12.2024 (Eintragungsdatum)\n\nDoric Vermögensmanagement GmbH\nGesellschaft mit beschränkter Haftung\nOffenbach am Main\n\nDen Gläubigern der an der Verschmelzung beteiligten Rechtsträger ist, wenn sie binnen sechs Monaten nach dem Tag, an dem die Eintragung der Verschmelzung in das Register des Sitzes desjenigen Rechtsträgers, dessen Gläubiger sie sind, nach § 19 Absatz 3 UmwG bekannt gemacht worden ist, ihren Anspruch nach Grund und Höhe schriftlich anmelden, Sicherheit zu leisten, soweit sie nicht Befriedigung verlangen können. Dieses Recht steht den Gläubigern jedoch nur zu, wenn sie glaubhaft machen, dass durch die Verschmelzung die Erfüllung ihrer Forderung gefährdet wird."
    }
  ]
}