{
  "date": "2024-12-02",
  "date_of_scrape": "2024-12-03T04:06:38.597Z",
  "tool_version": "0.2.0",
  "number_of_announcements": 111,
  "announcements": [
    {
      "date": "2024-12-02",
      "id": "95083",
      "original_text": "Löschungsankündigung\nSchleswig-Holstein Amtsgericht Flensburg HRB 14133\nKIT Digital UG (haftungsbeschränkt) – Flensburg",
      "type": "Löschungsankündigung",
      "state": "Schleswig-Holstein",
      "amtsgericht": "Amtsgericht Flensburg",
      "registernummer": "HRB 14133",
      "registerart": "HRB",
      "company_name": "KIT Digital UG (haftungsbeschränkt)",
      "company_seat": "Flensburg",
      "details": "02.12.2024 (Bekanntmachungsdatum)\n\nSchleswig-Holstein Amtsgericht Flensburg HRB 14133\nLöschungsankündigung\n\nKIT Digital UG (haftungsbeschränkt)\nGesellschaft mit beschränkter Haftung\nFlensburg\n\nEs ist die Löschung der nachstehenden Gesellschaft wegen Vermögenslosigkeit gemäß § 394 FamFG beabsichtigt.\nWiderspruchsfrist: 2 Monate"
    },
    {
      "date": "2024-12-02",
      "id": "95084",
      "original_text": "Einreichung neuer Dokumente\nSaarland Amtsgericht Saarbrücken HRB 9376\nIKS kommunal GmbH – Saarbrücken",
      "type": "Einreichung neuer Dokumente",
      "state": "Saarland",
      "amtsgericht": "Amtsgericht Saarbrücken",
      "registernummer": "HRB 9376",
      "registerart": "HRB",
      "company_name": "IKS kommunal GmbH",
      "company_seat": "Saarbrücken",
      "details": "02.12.2024 (Bekanntmachungsdatum)\n\nSaarland Amtsgericht Saarbrücken HRB 9376\nEinreichung neuer Dokumente\n\nIKS kommunal GmbH\nGesellschaft mit beschränkter Haftung\nSaarbrücken\n\nDie Geschäftsführung der Gesellschaft hat eine Liste der Mitglieder des Aufsichtsrats zum Handelsregister eingereicht (§ 52 Abs. 3 Satz 2 GmbHG)."
    },
    {
      "date": "2024-12-02",
      "id": "95085",
      "original_text": "Registerbekanntmachung nach dem Umwandlungsgesetz\nBaden-Württemberg Amtsgericht Freiburg HRB 611044\nMAGU Bausysteme GmbH – Hüfingen",
      "type": "Registerbekanntmachung nach dem Umwandlungsgesetz",
      "state": "Baden-Württemberg",
      "amtsgericht": "Amtsgericht Freiburg",
      "registernummer": "HRB 611044",
      "registerart": "HRB",
      "company_name": "MAGU Bausysteme GmbH",
      "company_seat": "Hüfingen",
      "details": "02.12.2024 (Bekanntmachungsdatum)\n\nBaden-Württemberg Amtsgericht Freiburg HRB 611044\nRegisterbekanntmachung nach dem Umwandlungsgesetz 02.12.2024 (Eintragungsdatum)\n\nMAGU Bausysteme GmbH\nGesellschaft mit beschränkter Haftung\nHüfingen\n\nAls nicht eingetragen wird bekanntgemacht:\nDen Gläubigern des an dem Formwechsel beteiligten Rechtsträgers ist, wenn sie binnen sechs Monaten nach dem Tag, an dem die Eintragung des Formwechsels in das Register des Sitzes desjenigen Rechtsträgers, dessen Gläubiger sie sind, nach § 19 Abs. 3 UmwG als bekanntgemacht gilt, ihren Anspruch nach Grund und Höhe schriftlich anmelden, Sicherheit zu leisten, soweit sie nicht Befriedigung verlangen können. Dieses Recht steht den Gläubigern jedoch nur zu, wenn sie glaubhaft machen, dass durch den Formwechsel die Erfüllung ihrer Forderung gefährdet wird."
    },
    {
      "date": "2024-12-02",
      "id": "95086",
      "original_text": "Löschungsankündigung\nBerlin Amtsgericht Berlin (Charlottenburg) HRB 217679\nThemis UG (haftungsbeschränkt) – Berlin",
      "type": "Löschungsankündigung",
      "state": "Berlin",
      "amtsgericht": "Amtsgericht Berlin (Charlottenburg)",
      "registernummer": "HRB 217679",
      "registerart": "HRB",
      "company_name": "Themis UG (haftungsbeschränkt)",
      "company_seat": "Berlin",
      "details": "02.12.2024 (Bekanntmachungsdatum)\n\nBerlin Amtsgericht Berlin (Charlottenburg) HRB 217679\nLöschungsankündigung\n\nThemis UG (haftungsbeschränkt)\nGesellschaft mit beschränkter Haftung\nBerlin\n\nBei der nachstehenden Gesellschaft wird das Amtslöschungsverfahren gemäß § 394 FamFG eingeleitet. Widerspruchsfrist 6 Wochen"
    },
    {
      "date": "2024-12-02",
      "id": "95087",
      "original_text": "Einreichung neuer Dokumente\nBaden-Württemberg Amtsgericht Stuttgart HRB 749419\nMedizinisches Versorgungszentrum Krankenhaus Bad Cannstatt gemeinnützige GmbH – Stuttgart",
      "type": "Einreichung neuer Dokumente",
      "state": "Baden-Württemberg",
      "amtsgericht": "Amtsgericht Stuttgart",
      "registernummer": "HRB 749419",
      "registerart": "HRB",
      "company_name": "Medizinisches Versorgungszentrum Krankenhaus Bad Cannstatt gemeinnützige GmbH",
      "company_seat": "Stuttgart",
      "details": "02.12.2024 (Bekanntmachungsdatum)\n\nBaden-Württemberg Amtsgericht Stuttgart HRB 749419\nEinreichung neuer Dokumente\n\nMedizinisches Versorgungszentrum Krankenhaus Bad Cannstatt gemeinnützige GmbH\nGesellschaft mit beschränkter Haftung\nStuttgart\n\nDie Gesellschaft hat am 27.11.2024 die Liste über die Zusammensetzung des Aufsichtsrats zum Handelsregister eingereicht."
    },
    {
      "date": "2024-12-02",
      "id": "95088",
      "original_text": "Registerbekanntmachung nach dem Umwandlungsgesetz\nBaden-Württemberg Amtsgericht Stuttgart HRB 734136\nAIT Verwaltungs-GmbH – Stuttgart",
      "type": "Registerbekanntmachung nach dem Umwandlungsgesetz",
      "state": "Baden-Württemberg",
      "amtsgericht": "Amtsgericht Stuttgart",
      "registernummer": "HRB 734136",
      "registerart": "HRB",
      "company_name": "AIT Verwaltungs-GmbH",
      "company_seat": "Stuttgart",
      "details": "02.12.2024 (Bekanntmachungsdatum)\n\nBaden-Württemberg Amtsgericht Stuttgart HRB 734136\nRegisterbekanntmachung nach dem Umwandlungsgesetz 02.12.2024 (Eintragungsdatum)\n\nAIT Verwaltungs-GmbH\nGesellschaft mit beschränkter Haftung\nStuttgart\n\nAls nicht eingetragen wird bekanntgemacht:\nDen Gläubigern der an der Verschmelzung beteiligten Rechtsträger ist, wenn sie binnen sechs Monaten nach dem Tag, an dem die Eintragung der Verschmelzung in das Register des Sitzes desjenigen Rechtsträgers, dessen Gläubiger sie sind, nach § 19 Abs. 3 UmwG als bekanntgemacht gilt, ihren Anspruch nach Grund und Höhe schriftlich anmelden, Sicherheit zu leisten, soweit sie nicht Befriedigung verlangen können. Dieses Recht steht den Gläubigern jedoch nur zu, wenn sie glaubhaft machen, dass durch die Verschmelzung die Erfüllung ihrer Forderung gefährdet wird."
    },
    {
      "date": "2024-12-02",
      "id": "95089",
      "original_text": "Einreichung neuer Dokumente\nHamburg Amtsgericht Hamburg HRB 145021\nInvago AG – Hamburg",
      "type": "Einreichung neuer Dokumente",
      "state": "Hamburg",
      "amtsgericht": "Amtsgericht Hamburg",
      "registernummer": "HRB 145021",
      "registerart": "HRB",
      "company_name": "Invago AG",
      "company_seat": "Hamburg",
      "details": "02.12.2024 (Bekanntmachungsdatum)\n\nHamburg Amtsgericht Hamburg HRB 145021\nEinreichung neuer Dokumente 02.12.2024 (Eintragungsdatum)\n\nInvago AG\nAktiengesellschaft\nHamburg\n\nAls nicht eingetragen wird bekannt gemacht: Liste des Aufsichtsrats wurde eingereicht."
    },
    {
      "date": "2024-12-02",
      "id": "95090",
      "original_text": "Sonstige Registerbekanntmachung\nMecklenburg-Vorpommern Amtsgericht Rostock HRB 12387\n\"Klärschlamm-Kooperation Mecklenburg-Vorpommern\" GmbH – Rostock",
      "type": "Sonstige Registerbekanntmachung",
      "state": "Mecklenburg-Vorpommern",
      "amtsgericht": "Amtsgericht Rostock",
      "registernummer": "HRB 12387",
      "registerart": "HRB",
      "company_name": "\"Klärschlamm-Kooperation Mecklenburg-Vorpommern\" GmbH",
      "company_seat": "Rostock",
      "details": "02.12.2024 (Bekanntmachungsdatum)\n\nMecklenburg-Vorpommern Amtsgericht Rostock HRB 12387\nSonstige Registerbekanntmachung\n\n\"Klärschlamm-Kooperation Mecklenburg-Vorpommern\" GmbH\nGesellschaft mit beschränkter Haftung\nRostock\n\nEine Liste der Mitglieder des Aufsichtsrats ist zum Handelsregister eingereicht worden."
    },
    {
      "date": "2024-12-02",
      "id": "95091",
      "original_text": "Löschungsankündigung\nBerlin Amtsgericht Berlin (Charlottenburg) HRB 126347\n\"Gimpel\" Handelsgesellschaft GmbH – Berlin",
      "type": "Löschungsankündigung",
      "state": "Berlin",
      "amtsgericht": "Amtsgericht Berlin (Charlottenburg)",
      "registernummer": "HRB 126347",
      "registerart": "HRB",
      "company_name": "\"Gimpel\" Handelsgesellschaft GmbH",
      "company_seat": "Berlin",
      "details": "02.12.2024 (Bekanntmachungsdatum)\n\nBerlin Amtsgericht Berlin (Charlottenburg) HRB 126347\nLöschungsankündigung\n\n\"Gimpel\" Handelsgesellschaft GmbH\nGesellschaft mit beschränkter Haftung\nBerlin\n\nBei der nachstehenden Gesellschaft wird das Amtslöschungsverfahren gemäß § 394 FamFG eingeleitet. Widerspruchsfrist 6 Wochen"
    },
    {
      "date": "2024-12-02",
      "id": "95092",
      "original_text": "Einreichung neuer Dokumente\nBaden-Württemberg Amtsgericht Freiburg HRB 541918\nStadtwerke Engen GmbH – Engen",
      "type": "Einreichung neuer Dokumente",
      "state": "Baden-Württemberg",
      "amtsgericht": "Amtsgericht Freiburg",
      "registernummer": "HRB 541918",
      "registerart": "HRB",
      "company_name": "Stadtwerke Engen GmbH",
      "company_seat": "Engen",
      "details": "02.12.2024 (Bekanntmachungsdatum)\n\nBaden-Württemberg Amtsgericht Freiburg HRB 541918\nEinreichung neuer Dokumente\n\nStadtwerke Engen GmbH\nGesellschaft mit beschränkter Haftung\nEngen\n\nAls nicht eingetragen wird bekanntgemacht:\nDie Gesellschaft hat am 25.11.2024 die Liste über die Zusammensetzung des Aufsichtsrats zum Handelsregister eingereicht."
    },
    {
      "date": "2024-12-02",
      "id": "95093",
      "original_text": "Sonstige Registerbekanntmachung\nSchleswig-Holstein Amtsgericht Lübeck HRB 2747 RE\nAUDIT CONSULT Bergemann & Lamp GmbH Steuerberatungsgesellschaft – Reinbek",
      "type": "Sonstige Registerbekanntmachung",
      "state": "Schleswig-Holstein",
      "amtsgericht": "Amtsgericht Lübeck",
      "registernummer": "HRB 2747 RE",
      "registerart": "HRB",
      "company_name": "AUDIT CONSULT Bergemann & Lamp GmbH Steuerberatungsgesellschaft",
      "company_seat": "Reinbek",
      "details": "02.12.2024 (Bekanntmachungsdatum)\n\nSchleswig-Holstein Amtsgericht Lübeck HRB 2747 RE\nSonstige Registerbekanntmachung\n\nAUDIT CONSULT Bergemann & Lamp GmbH Steuerberatungsgesellschaft\nGesellschaft mit beschränkter Haftung\nReinbek\n\nAls nicht eingetragen wird veröffentlicht:\nAmtsgericht Lübeck, Am Burgfeld 7, 23568 Lübeck\nHerr\nJan Bergemann\nLindenallee 60\n21465 Reinbek\n\nUnser Zeichen: HRB 2747 RE\n\nDatum: 14.11.2024\nSehr geehrte Damen und Herren,\nin der Handelsregistersache der\nAUDIT CONSULT Bergemann & Lamp GmbH Steuerberatungsgesellschaft\nergeben sich aus dem Schreiben der Steuerberaterkammer Schleswig-Holstein vom\n11.11.2024, dass die Gesellschaft mit Datum vom 09.10.2024 im Berufsregister der\nSteuerberaterkammer Schleswig-Holstein gelöscht wurde.\nIch beabsichtige daher, die Gesellschaft von Amts wegen zu löschen.\nIch bestimme eine Frist von einem Monat zur Geltendmachung eines Widerspruchs\ngegen die Löschung.\nWeiter bitte ich Sie, mir binnen derselben Frist mitzuteilen, ob die genannte Gesellschaft\nnoch Vermögen hat, ggf. welche Vermögensgegenstände sie besitzt, ob die Gesellschaft\nnoch Partei eines noch nicht rechtskräftig abgeschlossenen Rechtsstreits ist oder ob sonst\nnoch eine Abwicklung stattfindet.\nNach Fristablauf ohne Widerspruch von Ihnen oder anderer Seite wird die Gesellschaft\ngelöscht.\nMit freundlichen Grüßen\nWolski,\nDipl.-Rechtspflegerin (FH)\nBankverbindung:"
    },
    {
      "date": "2024-12-02",
      "id": "95094",
      "original_text": "Löschungsankündigung\nMecklenburg-Vorpommern Amtsgericht Stralsund HRB 8537\nHCM-GmbH – Bergen auf Rügen",
      "type": "Löschungsankündigung",
      "state": "Mecklenburg-Vorpommern",
      "amtsgericht": "Amtsgericht Stralsund",
      "registernummer": "HRB 8537",
      "registerart": "HRB",
      "company_name": "HCM-GmbH",
      "company_seat": "Bergen auf Rügen",
      "details": "02.12.2024 (Bekanntmachungsdatum)\n\nMecklenburg-Vorpommern Amtsgericht Stralsund HRB 8537\nLöschungsankündigung\n\nHCM-GmbH\nGesellschaft mit beschränkter Haftung\nBergen auf Rügen\n\nDas Registergericht beabsichtigt, die im Handelsregister eingetragene Gesellschaft von Amts wegen nach § 394 FamFG zu löschen. Die Frist zur Erhebung eines Widerspruchs gegen die beabsichtigte Löschung wird auf 1 Monat festgesetzt."
    },
    {
      "date": "2024-12-02",
      "id": "95095",
      "original_text": "Sonstige Registerbekanntmachung\nBrandenburg Amtsgericht Cottbus HRB 15268\nKötitzer Ledertuch- und Wachstuch-Werke GmbH – Schönefeld",
      "type": "Sonstige Registerbekanntmachung",
      "state": "Brandenburg",
      "amtsgericht": "Amtsgericht Cottbus",
      "registernummer": "HRB 15268",
      "registerart": "HRB",
      "company_name": "Kötitzer Ledertuch- und Wachstuch-Werke GmbH",
      "company_seat": "Schönefeld",
      "details": "02.12.2024 (Bekanntmachungsdatum)\n\nBrandenburg Amtsgericht Cottbus HRB 15268\nSonstige Registerbekanntmachung\n\nKötitzer Ledertuch- und Wachstuch-Werke GmbH\nGesellschaft mit beschränkter Haftung\nSchönefeld\n\nAls nicht eingetragen wird veröffentlicht:\nDen Gläubigern der an der Verschmelzung beteiligten Rechtsträger ist, wenn sie binnen sechs Monaten nach dem Tag, an dem die Eintragung der Verschmelzung in das Register des Sitzes desjenigen Rechtsträgers, dessen Gläubiger sie sind, als bekannt gemacht gilt, ihren Anspruch nach Grund und Höhe schriftlich anmelden, Sicherheit zu leisten, soweit sie nicht Befriedigung verlangen können. Dieses Recht steht den Gläubigern jedoch nur zu, wenn sie glaubhaft machen, dass durch die Verschmelzung die Erfüllung ihrer Forderung gefährdet wird"
    },
    {
      "date": "2024-12-02",
      "id": "95096",
      "original_text": "Löschungsankündigung\nBerlin Amtsgericht Berlin (Charlottenburg) HRB 164760\nPER-Germany Handels GmbH – Berlin",
      "type": "Löschungsankündigung",
      "state": "Berlin",
      "amtsgericht": "Amtsgericht Berlin (Charlottenburg)",
      "registernummer": "HRB 164760",
      "registerart": "HRB",
      "company_name": "PER-Germany Handels GmbH",
      "company_seat": "Berlin",
      "details": "02.12.2024 (Bekanntmachungsdatum)\n\nBerlin Amtsgericht Berlin (Charlottenburg) HRB 164760\nLöschungsankündigung\n\nPER-Germany Handels GmbH\nGesellschaft mit beschränkter Haftung\nBerlin\n\nBei der nachstehenden Gesellschaft wird das Amtslöschungsverfahren gemäß § 394 FamFG eingeleitet. Widerspruchsfrist 6 Wochen"
    },
    {
      "date": "2024-12-02",
      "id": "95097",
      "original_text": "Löschungsankündigung\nBerlin Amtsgericht Berlin (Charlottenburg) HRB 190909\nCakmak Gastronomie Betriebsgesellschaft UG (haftungsbeschränkt) – Berlin",
      "type": "Löschungsankündigung",
      "state": "Berlin",
      "amtsgericht": "Amtsgericht Berlin (Charlottenburg)",
      "registernummer": "HRB 190909",
      "registerart": "HRB",
      "company_name": "Cakmak Gastronomie Betriebsgesellschaft UG (haftungsbeschränkt)",
      "company_seat": "Berlin",
      "details": "02.12.2024 (Bekanntmachungsdatum)\n\nBerlin Amtsgericht Berlin (Charlottenburg) HRB 190909\nLöschungsankündigung\n\nCakmak Gastronomie Betriebsgesellschaft UG (haftungsbeschränkt)\nGesellschaft mit beschränkter Haftung\nBerlin\n\nBei der nachstehenden Gesellschaft wird das Amtslöschungsverfahren gemäß § 394 FamFG eingeleitet. Widerspruchsfrist 6 Wochen"
    },
    {
      "date": "2024-12-02",
      "id": "95098",
      "original_text": "Registerbekanntmachung nach dem Umwandlungsgesetz\nBaden-Württemberg Amtsgericht Stuttgart HRB 281211\nBühler GmbH – Plüderhausen",
      "type": "Registerbekanntmachung nach dem Umwandlungsgesetz",
      "state": "Baden-Württemberg",
      "amtsgericht": "Amtsgericht Stuttgart",
      "registernummer": "HRB 281211",
      "registerart": "HRB",
      "company_name": "Bühler GmbH",
      "company_seat": "Plüderhausen",
      "details": "02.12.2024 (Bekanntmachungsdatum)\n\nBaden-Württemberg Amtsgericht Stuttgart HRB 281211\nRegisterbekanntmachung nach dem Umwandlungsgesetz 02.12.2024 (Eintragungsdatum)\n\nBühler GmbH\nGesellschaft mit beschränkter Haftung\nPlüderhausen\n\nAls nicht eingetragen wird bekanntgemacht:\nDen Gläubigern der an der Verschmelzung beteiligten Rechtsträger ist, wenn sie binnen sechs Monaten nach dem Tag, an dem die Eintragung der Verschmelzung in das Register des Sitzes desjenigen Rechtsträgers, dessen Gläubiger sie sind, nach § 19 Abs. 3 UmwG als bekanntgemacht gilt, ihren Anspruch nach Grund und Höhe schriftlich anmelden, Sicherheit zu leisten, soweit sie nicht Befriedigung verlangen können. Dieses Recht steht den Gläubigern jedoch nur zu, wenn sie glaubhaft machen, dass durch die Verschmelzung die Erfüllung ihrer Forderung gefährdet wird."
    },
    {
      "date": "2024-12-02",
      "id": "95099",
      "original_text": "Registerbekanntmachung nach dem Umwandlungsgesetz\nSchleswig-Holstein Amtsgericht Flensburg HRB 13768\nSüdkap Surfing Sylt GmbH – Hörnum/Sylt",
      "type": "Registerbekanntmachung nach dem Umwandlungsgesetz",
      "state": "Schleswig-Holstein",
      "amtsgericht": "Amtsgericht Flensburg",
      "registernummer": "HRB 13768",
      "registerart": "HRB",
      "company_name": "Südkap Surfing Sylt GmbH",
      "company_seat": "Hörnum/Sylt",
      "details": "02.12.2024 (Bekanntmachungsdatum)\n\nSchleswig-Holstein Amtsgericht Flensburg HRB 13768\nRegisterbekanntmachung nach dem Umwandlungsgesetz 02.12.2024 (Eintragungsdatum)\n\nSüdkap Surfing Sylt GmbH\nGesellschaft mit beschränkter Haftung\nHörnum/Sylt\n\nZu Eintragungsnummer 2 vom 02.12.2024 wird als nicht eingetragen veröffentlicht: Den Gläubigern der an der Spaltung beteiligten Rechtsträger ist, wenn sie binnen sechs Monaten nach dem Tag, an dem die Eintragung der Spaltung in das Register des Sitzes desjenigen Rechtsträgers, dessen Gläubiger sie sind, als bekannt gemacht gilt, ihren Anspruch nach Grund und Höhe schriftlich anmelden, Sicherheit zu leisten, soweit sie nicht Befriedigung verlangen können. Dieses Recht steht den Gläubigern jedoch nur zu, wenn sie glaubhaft machen, dass durch die Spaltung die Erfüllung ihrer Forderung gefährdet wird."
    },
    {
      "date": "2024-12-02",
      "id": "95100",
      "original_text": "Löschungsankündigung\nBerlin Amtsgericht Berlin (Charlottenburg) HRB 183385\nsemper primus GmbH – Berlin",
      "type": "Löschungsankündigung",
      "state": "Berlin",
      "amtsgericht": "Amtsgericht Berlin (Charlottenburg)",
      "registernummer": "HRB 183385",
      "registerart": "HRB",
      "company_name": "semper primus GmbH",
      "company_seat": "Berlin",
      "details": "02.12.2024 (Bekanntmachungsdatum)\n\nBerlin Amtsgericht Berlin (Charlottenburg) HRB 183385\nLöschungsankündigung\n\nsemper primus GmbH\nGesellschaft mit beschränkter Haftung\nBerlin\n\nBei der nachstehenden Gesellschaft wird das Amtslöschungsverfahren gemäß § 394 FamFG eingeleitet. Widerspruchsfrist 6 Wochen"
    },
    {
      "date": "2024-12-02",
      "id": "95101",
      "original_text": "Löschungsankündigung\nMecklenburg-Vorpommern Amtsgericht Stralsund HRA 2585\nFALO Grundstücks GmbH & Co. KG – Bergen auf Rügen",
      "type": "Löschungsankündigung",
      "state": "Mecklenburg-Vorpommern",
      "amtsgericht": "Amtsgericht Stralsund",
      "registernummer": "HRA 2585",
      "registerart": "HRA",
      "company_name": "FALO Grundstücks GmbH & Co. KG",
      "company_seat": "Bergen auf Rügen",
      "details": "02.12.2024 (Bekanntmachungsdatum)\n\nMecklenburg-Vorpommern Amtsgericht Stralsund HRA 2585\nLöschungsankündigung\n\nFALO Grundstücks GmbH & Co. KG\nKommanditgesellschaft\nBergen auf Rügen\n\nDas Registergericht beabsichtigt, die im Handelsregister eingetragene Gesellschaft von Amts wegen nach § 394 FamFG zu löschen. Die Frist zur Erhebung eines Widerspruchs gegen die beabsichtigte Löschung wird auf 1 Monat festgesetzt."
    },
    {
      "date": "2024-12-02",
      "id": "95102",
      "original_text": "Registerbekanntmachung nach dem Umwandlungsgesetz\nBaden-Württemberg Amtsgericht Stuttgart HRB 760228\nparsionate Group GmbH – Stuttgart",
      "type": "Registerbekanntmachung nach dem Umwandlungsgesetz",
      "state": "Baden-Württemberg",
      "amtsgericht": "Amtsgericht Stuttgart",
      "registernummer": "HRB 760228",
      "registerart": "HRB",
      "company_name": "parsionate Group GmbH",
      "company_seat": "Stuttgart",
      "details": "02.12.2024 (Bekanntmachungsdatum)\n\nBaden-Württemberg Amtsgericht Stuttgart HRB 760228\nRegisterbekanntmachung nach dem Umwandlungsgesetz 02.12.2024 (Eintragungsdatum)\n\nparsionate Group GmbH\nGesellschaft mit beschränkter Haftung\nStuttgart\n\nDen Gläubigern der an der Verschmelzung beteiligten Rechtsträger ist, wenn sie binnen sechs Monaten nach dem Tag, an dem die Eintragung der Verschmelzung in das Register des Sitzes desjenigen Rechtsträgers, dessen Gläubiger sie sind, nach § 19 Abs. 3 UmwG als bekanntgemacht gilt, ihren Anspruch nach Grund und Höhe schriftlich anmelden, Sicherheit zu leisten, soweit sie nicht Befriedigung verlangen können. Dieses Recht steht den Gläubigern jedoch nur zu, wenn sie glaubhaft machen, dass durch die Verschmelzung die Erfüllung ihrer Forderung gefährdet wird."
    },
    {
      "date": "2024-12-02",
      "id": "95103",
      "original_text": "Löschungsankündigung\nBaden-Württemberg Amtsgericht Stuttgart HRA 734860\nDGFE Deutsche Gesellschaft für Energiekonzepte 2 GmbH & Co. KG – Stuttgart",
      "type": "Löschungsankündigung",
      "state": "Baden-Württemberg",
      "amtsgericht": "Amtsgericht Stuttgart",
      "registernummer": "HRA 734860",
      "registerart": "HRA",
      "company_name": "DGFE Deutsche Gesellschaft für Energiekonzepte 2 GmbH & Co. KG",
      "company_seat": "Stuttgart",
      "details": "02.12.2024 (Bekanntmachungsdatum)\n\nBaden-Württemberg Amtsgericht Stuttgart HRA 734860\nLöschungsankündigung\n\nDGFE Deutsche Gesellschaft für Energiekonzepte 2 GmbH & Co. KG\nKommanditgesellschaft\nStuttgart\n\nAls nicht eingetragen wird bekanntgemacht:\nDas Gericht beabsichtigt, die Gesellschaft wegen Vermögenslosigkeit im Handelsregister von Amts wegen nach § 394 FamFG zu löschen. Die Frist zur Geltendmachung eines Widerspruchs gegen die beabsichtigte Löschung ist auf zwei Monate ab Veröffentlichung bestimmt."
    },
    {
      "date": "2024-12-02",
      "id": "95104",
      "original_text": "Löschungsankündigung\nBerlin Amtsgericht Berlin (Charlottenburg) HRB 120457\nHTT Hoch- und Tiefbau Technik GmbH – Berlin",
      "type": "Löschungsankündigung",
      "state": "Berlin",
      "amtsgericht": "Amtsgericht Berlin (Charlottenburg)",
      "registernummer": "HRB 120457",
      "registerart": "HRB",
      "company_name": "HTT Hoch- und Tiefbau Technik GmbH",
      "company_seat": "Berlin",
      "details": "02.12.2024 (Bekanntmachungsdatum)\n\nBerlin Amtsgericht Berlin (Charlottenburg) HRB 120457\nLöschungsankündigung\n\nHTT Hoch- und Tiefbau Technik GmbH\nGesellschaft mit beschränkter Haftung\nBerlin\n\nBei der nachstehenden Gesellschaft wird das Amtslöschungsverfahren gemäß § 394 FamFG eingeleitet. Widerspruchsfrist 6 Wochen"
    },
    {
      "date": "2024-12-02",
      "id": "95105",
      "original_text": "Registerbekanntmachung nach dem Umwandlungsgesetz\nBrandenburg Amtsgericht Potsdam HRB 33747\nASP Beteiligungsgesellschaft mbH – Zossen",
      "type": "Registerbekanntmachung nach dem Umwandlungsgesetz",
      "state": "Brandenburg",
      "amtsgericht": "Amtsgericht Potsdam",
      "registernummer": "HRB 33747",
      "registerart": "HRB",
      "company_name": "ASP Beteiligungsgesellschaft mbH",
      "company_seat": "Zossen",
      "details": "02.12.2024 (Bekanntmachungsdatum)\n\nBrandenburg Amtsgericht Potsdam HRB 33747\nRegisterbekanntmachung nach dem Umwandlungsgesetz 29.11.2024 (Eintragungsdatum)\n\nASP Beteiligungsgesellschaft mbH\nGesellschaft mit beschränkter Haftung\nZossen\n\nZu Eintragungsnummer 2 vom 29.11.2024 wird als nicht eingetragen veröffentlicht:\nDen Gläubigern der an der Verschmelzung beteiligten Rechtsträger ist, wenn sie binnen sechs Monaten nach dem Tag, an dem die Eintragung der Verschmelzung in das Register des Sitzes desjenigen Rechtsträgers, dessen Gläubiger sie sind, als bekannt gemacht gilt, ihren Anspruch nach Grund und Höhe schriftlich anmelden, Sicherheit zu leisten, soweit sie nicht Befriedigung verlangen können. Dieses Recht steht den Gläubigern jedoch nur zu, wenn sie glaubhaft machen, dass durch die Verschmelzung die Erfüllung ihrer Forderung gefährdet wird.\nDie Frist beträgt 4 Wochen."
    },
    {
      "date": "2024-12-02",
      "id": "95106",
      "original_text": "Registerbekanntmachung nach dem Umwandlungsgesetz\nBerlin Amtsgericht Berlin (Charlottenburg) HRB 107982\nElektrotechnik F. Schulze GmbH – Berlin",
      "type": "Registerbekanntmachung nach dem Umwandlungsgesetz",
      "state": "Berlin",
      "amtsgericht": "Amtsgericht Berlin (Charlottenburg)",
      "registernummer": "HRB 107982",
      "registerart": "HRB",
      "company_name": "Elektrotechnik F. Schulze GmbH",
      "company_seat": "Berlin",
      "details": "02.12.2024 (Bekanntmachungsdatum)\n\nBerlin Amtsgericht Berlin (Charlottenburg) HRB 107982\nRegisterbekanntmachung nach dem Umwandlungsgesetz 29.11.2024 (Eintragungsdatum)\n\nElektrotechnik F. Schulze GmbH\nGesellschaft mit beschränkter Haftung\nBerlin\n\nZu Eintragungsnummer 5 vom 29.11.2024 wird als nicht eingetragen veröffentlicht: Den Gläubigern der an der Verschmelzung beteiligten Rechtsträger ist, wenn sie binnen sechs Monaten nach dem Tag, an dem die Eintragung der Verschmelzung in das Register des Sitzes desjenigen Rechtsträgers, dessen Gläubiger sie sind, als bekannt gemacht gilt, ihren Anspruch nach Grund und Höhe schriftlich anmelden, Sicherheit zu leisten, soweit sie nicht Befriedigung verlangen können. Dieses Recht steht den Gläubigern jedoch nur zu, wenn sie glaubhaft machen, dass durch die Verschmelzung die Erfüllung ihrer Forderung gefährdet wird. Das Recht, Sicherheitsleistung zu verlangen, steht Gläubigern nicht zu, die im Falle der Insolvenz ein Recht auf vorzugsweise Befriedigung aus einer Deckungsmasse haben, die nach gesetzlicher Vorschrift zu ihrem Schutz errichtet und staatlich überwacht ist."
    },
    {
      "date": "2024-12-02",
      "id": "95107",
      "original_text": "Registerbekanntmachung nach dem Umwandlungsgesetz\nBerlin Amtsgericht Berlin (Charlottenburg) HRA 63179\nJosua Bücher e. K. – Berlin",
      "type": "Registerbekanntmachung nach dem Umwandlungsgesetz",
      "state": "Berlin",
      "amtsgericht": "Amtsgericht Berlin (Charlottenburg)",
      "registernummer": "HRA 63179",
      "registerart": "HRA",
      "company_name": "Josua Bücher e. K.",
      "company_seat": "Berlin",
      "details": "02.12.2024 (Bekanntmachungsdatum)\n\nBerlin Amtsgericht Berlin (Charlottenburg) HRA 63179\nRegisterbekanntmachung nach dem Umwandlungsgesetz 29.11.2024 (Eintragungsdatum)\n\nJosua Bücher e. K.\nEinzelkaufmann / Einzelkauffrau\nBerlin\n\nZu Eintragungsnummer 2 vom 29.11.2024 wird als nicht eingetragen veröffentlicht: Den Gläubigern der an der Spaltung beteiligten Rechtsträger ist, wenn sie binnen sechs Monaten nach dem Tag, an dem die Eintragung der Spaltung in das Register des Sitzes desjenigen Rechtsträgers, dessen Gläubiger sie sind, als bekannt gemacht gilt, ihren Anspruch nach Grund und Höhe schriftlich anmelden, Sicherheit zu leisten, soweit sie nicht Befriedigung verlangen können. Dieses Recht steht den Gläubigern jedoch nur zu, wenn sie glaubhaft machen, dass durch die Spaltung die Erfüllung ihrer Forderung gefährdet wird. Das Recht, Sicherheitsleistung zu verlangen, steht Gläubigern nicht zu, die im Falle der Insolvenz ein Recht auf vorzugsweise Befriedigung aus einer Deckungsmasse haben, die nach gesetzlicher Vorschrift zu ihrem Schutz errichtet und staatlich überwacht ist."
    },
    {
      "date": "2024-12-02",
      "id": "95108",
      "original_text": "Registerbekanntmachung nach dem Umwandlungsgesetz\nBerlin Amtsgericht Berlin (Charlottenburg) HRB 255434\nNERI Kapitalbeteiligungs GmbH – Berlin",
      "type": "Registerbekanntmachung nach dem Umwandlungsgesetz",
      "state": "Berlin",
      "amtsgericht": "Amtsgericht Berlin (Charlottenburg)",
      "registernummer": "HRB 255434",
      "registerart": "HRB",
      "company_name": "NERI Kapitalbeteiligungs GmbH",
      "company_seat": "Berlin",
      "details": "02.12.2024 (Bekanntmachungsdatum)\n\nBerlin Amtsgericht Berlin (Charlottenburg) HRB 255434\nRegisterbekanntmachung nach dem Umwandlungsgesetz 29.11.2024 (Eintragungsdatum)\n\nNERI Kapitalbeteiligungs GmbH\nGesellschaft mit beschränkter Haftung\nBerlin\n\nZu Eintragungsnummer 2 vom 29.11.2024 wird als nicht eingetragen veröffentlicht: Den Gläubigern der an der Verschmelzung beteiligten Rechtsträger ist, wenn sie binnen sechs Monaten nach dem Tag, an dem die Eintragung der Verschmelzung in das Register des Sitzes desjenigen Rechtsträgers, dessen Gläubiger sie sind, als bekannt gemacht gilt, ihren Anspruch nach Grund und Höhe schriftlich anmelden, Sicherheit zu leisten, soweit sie nicht Befriedigung verlangen können. Dieses Recht steht den Gläubigern jedoch nur zu, wenn sie glaubhaft machen, dass durch die Verschmelzung die Erfüllung ihrer Forderung gefährdet wird. Das Recht, Sicherheitsleistung zu verlangen, steht Gläubigern nicht zu, die im Falle der Insolvenz ein Recht auf vorzugsweise Befriedigung aus einer Deckungsmasse haben, die nach gesetzlicher Vorschrift zu ihrem Schutz errichtet und staatlich überwacht ist."
    },
    {
      "date": "2024-12-02",
      "id": "95109",
      "original_text": "Registerbekanntmachung nach dem Umwandlungsgesetz\nBrandenburg Amtsgericht Potsdam GsR 67\nVVS Grundstücks eGbR – Brück",
      "type": "Registerbekanntmachung nach dem Umwandlungsgesetz",
      "state": "Brandenburg",
      "amtsgericht": "Amtsgericht Potsdam",
      "registernummer": "GsR 67",
      "registerart": "GsR",
      "company_name": "VVS Grundstücks eGbR",
      "company_seat": "Brück",
      "details": "02.12.2024 (Bekanntmachungsdatum)\n\nBrandenburg Amtsgericht Potsdam GsR 67\nRegisterbekanntmachung nach dem Umwandlungsgesetz 29.11.2024 (Eintragungsdatum)\n\nVVS Grundstücks eGbR\nGesellschaft bürgerlichen Rechts\nBrück\n\nZu Eintragungsnummer 2 vom 29.11.2024 wird als nicht eingetragen veröffentlicht: Den Gläubigern des formwechselnden Rechtsträgers  ist, wenn sie binnen sechs Monaten nach dem Tag, an dem die Eintragung des Formwechsels nach § 201 UmwG, als bekannt gemacht gilt, ihren Anspruch nach Grund und Höhe schriftlich anmelden, Sicherheit zu leisten, soweit sie nicht Befriedigung verlangen können. Dieses Recht steht den Gläubigern jedoch nur zu, wenn sie glaubhaft machen, dass durch den Formwechsel die Erfüllung ihrer Forderung gefährdet wird."
    },
    {
      "date": "2024-12-02",
      "id": "95110",
      "original_text": "Löschungsankündigung\nSchleswig-Holstein Amtsgericht Flensburg HRB 13029\nHS Transline GmbH – Handewitt",
      "type": "Löschungsankündigung",
      "state": "Schleswig-Holstein",
      "amtsgericht": "Amtsgericht Flensburg",
      "registernummer": "HRB 13029",
      "registerart": "HRB",
      "company_name": "HS Transline GmbH",
      "company_seat": "Handewitt",
      "details": "02.12.2024 (Bekanntmachungsdatum)\n\nSchleswig-Holstein Amtsgericht Flensburg HRB 13029\nLöschungsankündigung\n\nHS Transline GmbH\nGesellschaft mit beschränkter Haftung\nHandewitt\n\nEs ist die Löschung der nachstehenden Gesellschaft wegen Vermögenslosigkeit gemäß § 394 FamFG beabsichtigt.\nWiderspruchsfrist: 2 Monate"
    },
    {
      "date": "2024-12-02",
      "id": "95111",
      "original_text": "Einreichung neuer Dokumente\nBerlin Amtsgericht Berlin (Charlottenburg) HRB 163774\nSuhrkamp Verlag AG – Berlin",
      "type": "Einreichung neuer Dokumente",
      "state": "Berlin",
      "amtsgericht": "Amtsgericht Berlin (Charlottenburg)",
      "registernummer": "HRB 163774",
      "registerart": "HRB",
      "company_name": "Suhrkamp Verlag AG",
      "company_seat": "Berlin",
      "details": "02.12.2024 (Bekanntmachungsdatum)\n\nBerlin Amtsgericht Berlin (Charlottenburg) HRB 163774\nEinreichung neuer Dokumente\n\nSuhrkamp Verlag AG\nAktiengesellschaft\nBerlin\n\nAls nicht eingetragen wird veröffentlicht:"
    },
    {
      "date": "2024-12-02",
      "id": "95112",
      "original_text": "Löschungsankündigung\nThüringen Amtsgericht Jena HRB 515310\nSpezialtiefbau Merkwirth GmbH – Zella-Mehlis",
      "type": "Löschungsankündigung",
      "state": "Thüringen",
      "amtsgericht": "Amtsgericht Jena",
      "registernummer": "HRB 515310",
      "registerart": "HRB",
      "company_name": "Spezialtiefbau Merkwirth GmbH",
      "company_seat": "Zella-Mehlis",
      "details": "02.12.2024 (Bekanntmachungsdatum)\n\nThüringen Amtsgericht Jena HRB 515310\nLöschungsankündigung\n\nSpezialtiefbau Merkwirth GmbH\nGesellschaft mit beschränkter Haftung\nZella-Mehlis\n\nDas Registergericht beabsichtigt, die im Handelsregister eingetragene Gesellschaft wegen Vermögenslosigkeit nach § 394 FamFG von Amts wegen zu löschen. Die Frist zur Erhebung eines Widerspruchs gegen die beabsichtigte Löschung wird auf 6 Wochen festgesetzt."
    },
    {
      "date": "2024-12-02",
      "id": "95113",
      "original_text": "Registerbekanntmachung nach dem Umwandlungsgesetz\nBerlin Amtsgericht Berlin (Charlottenburg) HRB 170236\nwefox Germany Holding GmbH – Berlin",
      "type": "Registerbekanntmachung nach dem Umwandlungsgesetz",
      "state": "Berlin",
      "amtsgericht": "Amtsgericht Berlin (Charlottenburg)",
      "registernummer": "HRB 170236",
      "registerart": "HRB",
      "company_name": "wefox Germany Holding GmbH",
      "company_seat": "Berlin",
      "details": "02.12.2024 (Bekanntmachungsdatum)\n\nBerlin Amtsgericht Berlin (Charlottenburg) HRB 170236\nRegisterbekanntmachung nach dem Umwandlungsgesetz 28.11.2024 (Eintragungsdatum)\n\nwefox Germany Holding GmbH\nGesellschaft mit beschränkter Haftung\nBerlin\n\nZu Eintragungsnummer 24 vom 28.11.2024 wird als nicht eingetragen veröffentlicht:Den Gläubigern der an der Verschmelzung beteiligten Rechtsträger ist, wenn sie binnen sechs Monaten nach dem Tag, an dem die Eintragung der Verschmelzung in das Register des Sitzes desjenigen Rechtsträgers, dessen Gläubiger sie sind, als bekannt gemacht gilt, ihren Anspruch nach Grund und Höhe schriftlich anmelden, Sicherheit zu leisten, soweit sie nicht Befriedigung verlangen können. Dieses Recht steht den Gläubigern jedoch nur zu, wenn sie glaubhaft machen, dass durch die Verschmelzung die Erfüllung ihrer Forderung gefährdet wird. Das Recht, Sicherheitsleistung zu verlangen, steht Gläubigern nicht zu, die im Falle der Insolvenz ein Recht auf vorzugsweise Befriedigung aus einer Deckungsmasse haben, die nach gesetzlicher Vorschrift zu ihrem Schutz errichtet und staatlich überwacht ist."
    },
    {
      "date": "2024-12-02",
      "id": "95114",
      "original_text": "Registerbekanntmachung nach dem Umwandlungsgesetz\nBerlin Amtsgericht Berlin (Charlottenburg) HRB 227610\nExtra-wurscht Holding GmbH – Berlin",
      "type": "Registerbekanntmachung nach dem Umwandlungsgesetz",
      "state": "Berlin",
      "amtsgericht": "Amtsgericht Berlin (Charlottenburg)",
      "registernummer": "HRB 227610",
      "registerart": "HRB",
      "company_name": "Extra-wurscht Holding GmbH",
      "company_seat": "Berlin",
      "details": "02.12.2024 (Bekanntmachungsdatum)\n\nBerlin Amtsgericht Berlin (Charlottenburg) HRB 227610\nRegisterbekanntmachung nach dem Umwandlungsgesetz 02.12.2024 (Eintragungsdatum)\n\nExtra-wurscht Holding GmbH\nGesellschaft mit beschränkter Haftung\nBerlin\n\nZu Eintragungsnummer 4 vom 02.12.2024 wird als nicht eingetragen veröffentlicht: Den Gläubigern der an der Verschmelzung beteiligten Rechtsträger ist, wenn sie binnen sechs Monaten nach dem Tag, an dem die Eintragung der Verschmelzung in das Register des Sitzes desjenigen Rechtsträgers, dessen Gläubiger sie sind, als bekannt gemacht gilt, ihren Anspruch nach Grund und Höhe schriftlich anmelden, Sicherheit zu leisten, soweit sie nicht Befriedigung verlangen können. Dieses Recht steht den Gläubigern jedoch nur zu, wenn sie glaubhaft machen, dass durch die Verschmelzung die Erfüllung ihrer Forderung gefährdet wird. Das Recht, Sicherheitsleistung zu verlangen, steht Gläubigern nicht zu, die im Falle der Insolvenz ein Recht auf vorzugsweise Befriedigung aus einer Deckungsmasse haben, die nach gesetzlicher Vorschrift zu ihrem Schutz errichtet und staatlich überwacht ist."
    },
    {
      "date": "2024-12-02",
      "id": "95115",
      "original_text": "Registerbekanntmachung nach dem Umwandlungsgesetz\nBrandenburg Amtsgericht Cottbus HRB 15543\nKL Holding GmbH – Schönefeld",
      "type": "Registerbekanntmachung nach dem Umwandlungsgesetz",
      "state": "Brandenburg",
      "amtsgericht": "Amtsgericht Cottbus",
      "registernummer": "HRB 15543",
      "registerart": "HRB",
      "company_name": "KL Holding GmbH",
      "company_seat": "Schönefeld",
      "details": "02.12.2024 (Bekanntmachungsdatum)\n\nBrandenburg Amtsgericht Cottbus HRB 15543\nRegisterbekanntmachung nach dem Umwandlungsgesetz 29.11.2024 (Eintragungsdatum)\n\nKL Holding GmbH\nGesellschaft mit beschränkter Haftung\nSchönefeld\n\nDen Gläubigern der an der Verschmelzung beteiligten Rechtsträger ist, wenn sie binnen sechs Monaten nach dem Tag, an dem die Eintragung der Verschmelzung in das Register des Sitzes desjenigen Rechtsträgers, dessen Gläubiger sie sind, als bekannt gemacht gilt, ihren Anspruch nach Grund und Höhe schriftlich anmelden, Sicherheit zu leisten, soweit sie nicht Befriedigung verlangen können. Dieses Recht steht den Gläubigern jedoch nur zu, wenn sie glaubhaft machen, dass durch die Verschmelzung die Erfüllung ihrer Forderung gefährdet wird."
    },
    {
      "date": "2024-12-02",
      "id": "95116",
      "original_text": "Registerbekanntmachung nach dem Umwandlungsgesetz\nBerlin Amtsgericht Berlin (Charlottenburg) HRB 257206\nwefox Germany MGA GmbH – Berlin",
      "type": "Registerbekanntmachung nach dem Umwandlungsgesetz",
      "state": "Berlin",
      "amtsgericht": "Amtsgericht Berlin (Charlottenburg)",
      "registernummer": "HRB 257206",
      "registerart": "HRB",
      "company_name": "wefox Germany MGA GmbH",
      "company_seat": "Berlin",
      "details": "02.12.2024 (Bekanntmachungsdatum)\n\nBerlin Amtsgericht Berlin (Charlottenburg) HRB 257206\nRegisterbekanntmachung nach dem Umwandlungsgesetz 28.11.2024 (Eintragungsdatum)\n\nwefox Germany MGA GmbH\nGesellschaft mit beschränkter Haftung\nBerlin\n\nZu Eintragungsnummer 3 vom 28.11.2024 wird als nicht eingetragen veröffentlicht:Den Gläubigern der an der Verschmelzung beteiligten Rechtsträger ist, wenn sie binnen sechs Monaten nach dem Tag, an dem die Eintragung der Verschmelzung in das Register des Sitzes desjenigen Rechtsträgers, dessen Gläubiger sie sind, als bekannt gemacht gilt, ihren Anspruch nach Grund und Höhe schriftlich anmelden, Sicherheit zu leisten, soweit sie nicht Befriedigung verlangen können. Dieses Recht steht den Gläubigern jedoch nur zu, wenn sie glaubhaft machen, dass durch die Verschmelzung die Erfüllung ihrer Forderung gefährdet wird. Das Recht, Sicherheitsleistung zu verlangen, steht Gläubigern nicht zu, die im Falle der Insolvenz ein Recht auf vorzugsweise Befriedigung aus einer Deckungsmasse haben, die nach gesetzlicher Vorschrift zu ihrem Schutz errichtet und staatlich überwacht ist."
    },
    {
      "date": "2024-12-02",
      "id": "95117",
      "original_text": "Löschungsankündigung\nBerlin Amtsgericht Berlin (Charlottenburg) HRB 199529\nAnhalt & Maier Druck UG (haftungsbeschränkt) – Berlin",
      "type": "Löschungsankündigung",
      "state": "Berlin",
      "amtsgericht": "Amtsgericht Berlin (Charlottenburg)",
      "registernummer": "HRB 199529",
      "registerart": "HRB",
      "company_name": "Anhalt & Maier Druck UG (haftungsbeschränkt)",
      "company_seat": "Berlin",
      "details": "02.12.2024 (Bekanntmachungsdatum)\n\nBerlin Amtsgericht Berlin (Charlottenburg) HRB 199529\nLöschungsankündigung\n\nAnhalt & Maier Druck UG (haftungsbeschränkt)\nGesellschaft mit beschränkter Haftung\nBerlin\n\nBei der nachstehenden Gesellschaft wird das Amtslöschungsverfahren gemäß § 394 FamFG eingeleitet. Widerspruchsfrist 6 Wochen"
    },
    {
      "date": "2024-12-02",
      "id": "95118",
      "original_text": "Löschungsankündigung\nBerlin Amtsgericht Berlin (Charlottenburg) HRB 218333\nFrankly Discus UG (haftungsbeschränkt) – Berlin",
      "type": "Löschungsankündigung",
      "state": "Berlin",
      "amtsgericht": "Amtsgericht Berlin (Charlottenburg)",
      "registernummer": "HRB 218333",
      "registerart": "HRB",
      "company_name": "Frankly Discus UG (haftungsbeschränkt)",
      "company_seat": "Berlin",
      "details": "02.12.2024 (Bekanntmachungsdatum)\n\nBerlin Amtsgericht Berlin (Charlottenburg) HRB 218333\nLöschungsankündigung\n\nFrankly Discus UG (haftungsbeschränkt)\nGesellschaft mit beschränkter Haftung\nBerlin\n\nBei der nachstehenden Gesellschaft wird das Amtslöschungsverfahren gemäß § 394 FamFG eingeleitet. Widerspruchsfrist 6 Wochen"
    },
    {
      "date": "2024-12-02",
      "id": "95119",
      "original_text": "Einreichung neuer Dokumente\nBerlin Amtsgericht Berlin (Charlottenburg) HRB 252113\nWatoo Service For Rent AG – Berlin",
      "type": "Einreichung neuer Dokumente",
      "state": "Berlin",
      "amtsgericht": "Amtsgericht Berlin (Charlottenburg)",
      "registernummer": "HRB 252113",
      "registerart": "HRB",
      "company_name": "Watoo Service For Rent AG",
      "company_seat": "Berlin",
      "details": "02.12.2024 (Bekanntmachungsdatum)\n\nBerlin Amtsgericht Berlin (Charlottenburg) HRB 252113\nEinreichung neuer Dokumente\n\nWatoo Service For Rent AG\nAktiengesellschaft\nBerlin\n\nAls nicht eingetragen wird veröffentlicht: Es wurde eine neue Liste der Aufsichtsratsmitglieder eingereicht (§ 106 AktG)."
    },
    {
      "date": "2024-12-02",
      "id": "95120",
      "original_text": "Löschungsankündigung\nBaden-Württemberg Amtsgericht Mannheim HRB 712553\nSalnatura GmbH – Mannheim",
      "type": "Löschungsankündigung",
      "state": "Baden-Württemberg",
      "amtsgericht": "Amtsgericht Mannheim",
      "registernummer": "HRB 712553",
      "registerart": "HRB",
      "company_name": "Salnatura GmbH",
      "company_seat": "Mannheim",
      "details": "02.12.2024 (Bekanntmachungsdatum)\n\nBaden-Württemberg Amtsgericht Mannheim HRB 712553\nLöschungsankündigung\n\nSalnatura GmbH\nGesellschaft mit beschränkter Haftung\nMannheim\n\nDas Gericht beabsichtigt, die Gesellschaft wegen Vermögenslosigkeit im Handelsregister von Amts wegen nach § 394 FamFG zu löschen. Die Frist zur Geltendmachung eines Widerspruchs gegen die beabsichtigte Löschung ist auf einen Monat ab Veröffentlichung bestimmt."
    },
    {
      "date": "2024-12-02",
      "id": "95121",
      "original_text": "Registerbekanntmachung nach dem Umwandlungsgesetz\nBaden-Württemberg Amtsgericht Stuttgart HRB 796452\nMeyer Menü HN GmbH – Neuenstadt am Kocher",
      "type": "Registerbekanntmachung nach dem Umwandlungsgesetz",
      "state": "Baden-Württemberg",
      "amtsgericht": "Amtsgericht Stuttgart",
      "registernummer": "HRB 796452",
      "registerart": "HRB",
      "company_name": "Meyer Menü HN GmbH",
      "company_seat": "Neuenstadt am Kocher",
      "details": "02.12.2024 (Bekanntmachungsdatum)\n\nBaden-Württemberg Amtsgericht Stuttgart HRB 796452\nRegisterbekanntmachung nach dem Umwandlungsgesetz 02.12.2024 (Eintragungsdatum)\n\nMeyer Menü HN GmbH\nGesellschaft mit beschränkter Haftung\nNeuenstadt am Kocher\n\nAls nicht eingetragen wird bekanntgemacht:\nDen Gläubigern der an der Verschmelzung beteiligten Rechtsträger ist, wenn sie binnen sechs Monaten nach dem Tag, an dem die Eintragung der Verschmelzung in das Register des Sitzes desjenigen Rechtsträgers, dessen Gläubiger sie sind, nach § 19 Abs. 3 UmwG als bekanntgemacht gilt, ihren Anspruch nach Grund und Höhe schriftlich anmelden, Sicherheit zu leisten, soweit sie nicht Befriedigung verlangen können. Dieses Recht steht den Gläubigern jedoch nur zu, wenn sie glaubhaft machen, dass durch die Verschmelzung die Erfüllung ihrer Forderung gefährdet wird."
    },
    {
      "date": "2024-12-02",
      "id": "95122",
      "original_text": "Löschungsankündigung\nBerlin Amtsgericht Berlin (Charlottenburg) HRB 210141\nOktaeder vermögensverwaltende Gesellschaft mbH – Berlin",
      "type": "Löschungsankündigung",
      "state": "Berlin",
      "amtsgericht": "Amtsgericht Berlin (Charlottenburg)",
      "registernummer": "HRB 210141",
      "registerart": "HRB",
      "company_name": "Oktaeder vermögensverwaltende Gesellschaft mbH",
      "company_seat": "Berlin",
      "details": "02.12.2024 (Bekanntmachungsdatum)\n\nBerlin Amtsgericht Berlin (Charlottenburg) HRB 210141\nLöschungsankündigung\n\nOktaeder vermögensverwaltende Gesellschaft mbH\nGesellschaft mit beschränkter Haftung\nBerlin\n\nBei der nachstehenden Gesellschaft wird das Amtslöschungsverfahren gemäß § 394 FamFG eingeleitet. Widerspruchsfrist 6 Wochen"
    },
    {
      "date": "2024-12-02",
      "id": "95123",
      "original_text": "Löschungsankündigung\nBerlin Amtsgericht Berlin (Charlottenburg) HRB 136145\nBubeck Verwaltungs GmbH – Berlin",
      "type": "Löschungsankündigung",
      "state": "Berlin",
      "amtsgericht": "Amtsgericht Berlin (Charlottenburg)",
      "registernummer": "HRB 136145",
      "registerart": "HRB",
      "company_name": "Bubeck Verwaltungs GmbH",
      "company_seat": "Berlin",
      "details": "02.12.2024 (Bekanntmachungsdatum)\n\nBerlin Amtsgericht Berlin (Charlottenburg) HRB 136145\nLöschungsankündigung\n\nBubeck Verwaltungs GmbH\nGesellschaft mit beschränkter Haftung\nBerlin\n\nBei der nachstehenden Gesellschaft wird das Amtslöschungsverfahren gemäß § 394 FamFG eingeleitet. Widerspruchsfrist 6 Wochen"
    },
    {
      "date": "2024-12-02",
      "id": "95124",
      "original_text": "Löschungsankündigung\nBaden-Württemberg Amtsgericht Stuttgart HRA 724952\nKipp Elektrotechnik GmbH & Co. KG – Empfingen",
      "type": "Löschungsankündigung",
      "state": "Baden-Württemberg",
      "amtsgericht": "Amtsgericht Stuttgart",
      "registernummer": "HRA 724952",
      "registerart": "HRA",
      "company_name": "Kipp Elektrotechnik GmbH & Co. KG",
      "company_seat": "Empfingen",
      "details": "02.12.2024 (Bekanntmachungsdatum)\n\nBaden-Württemberg Amtsgericht Stuttgart HRA 724952\nLöschungsankündigung\n\nKipp Elektrotechnik GmbH & Co. KG\nKommanditgesellschaft\nEmpfingen\n\nAls nicht eingetragen wird bekanntgemacht:\nDas Gericht beabsichtigt, die Gesellschaft wegen Vermögenslosigkeit im Handelsregister von Amts wegen nach § 394 FamFG zu löschen. Die Frist zur Geltendmachung eines Widerspruchs gegen die beabsichtigte Löschung ist auf zwei Monate ab Veröffentlichung bestimmt."
    },
    {
      "date": "2024-12-02",
      "id": "95125",
      "original_text": "Löschungsankündigung\nSaarland Amtsgericht Saarbrücken HRB 17123\nIRTEC GmbH – Großrosseln",
      "type": "Löschungsankündigung",
      "state": "Saarland",
      "amtsgericht": "Amtsgericht Saarbrücken",
      "registernummer": "HRB 17123",
      "registerart": "HRB",
      "company_name": "IRTEC GmbH",
      "company_seat": "Großrosseln",
      "details": "02.12.2024 (Bekanntmachungsdatum)\n\nSaarland Amtsgericht Saarbrücken HRB 17123\nLöschungsankündigung\n\nIRTEC GmbH\nGesellschaft mit beschränkter Haftung\nGroßrosseln\n\nEs ist beabsichtigt, die Gesellschaft von Amts wegen gemäß § 394 FamFG wegen Vermögenslosigkeit zu löschen. Gegen die Löschung von Amts wegen ist das Rechtsmittel des Widerspruchs statthaft. Der Widerspruch ist binnen einer Frist von 3 Monaten beginnend mit dem Tag dieser Veröffentlichung durch Einreichen eines Widerspruchsschreibens -schriftlich oder zur Niederschrift der Geschäftsstelle- beim Amtsgericht Saarbrücken, -zentrales Handelsregister-, Mainzerstr.178, 66121 Saarbrücken einzulegen. Der Widerspruch muss die Bezeichnung der angefochtenen Löschungsankündigung enthalten sowie die Erklärung, dass Widerspruch eingelegt wird. Er ist vom Widerspruchsführer oder seinem Bevollmächtigten zu unterzeichnen."
    },
    {
      "date": "2024-12-02",
      "id": "95126",
      "original_text": "Registerbekanntmachung nach dem Umwandlungsgesetz\nBaden-Württemberg Amtsgericht Mannheim VR 502028\nDeutscher Naturheilbund e.V. – Neulingen",
      "type": "Registerbekanntmachung nach dem Umwandlungsgesetz",
      "state": "Baden-Württemberg",
      "amtsgericht": "Amtsgericht Mannheim",
      "registernummer": "VR 502028",
      "registerart": "VR",
      "company_name": "Deutscher Naturheilbund e.V.",
      "company_seat": "Neulingen",
      "details": "02.12.2024 (Bekanntmachungsdatum)\n\nBaden-Württemberg Amtsgericht Mannheim VR 502028\nRegisterbekanntmachung nach dem Umwandlungsgesetz 02.12.2024 (Eintragungsdatum)\n\nDeutscher Naturheilbund e.V.\neingetragener Verein\nNeulingen\n\nDen Gläubigern der an der Verschmelzung beteiligten Rechtsträger ist, wenn sie binnen sechs Monaten nach dem Tag, an dem die Eintragung der Verschmelzung in das Register des Sitzes desjenigen Rechtsträgers, dessen Gläubiger sie sind, nach § 19 Abs. 3 UmwG als bekanntgemacht gilt, ihren Anspruch nach Grund und Höhe schriftlich anmelden, Sicherheit zu leisten, soweit sie nicht Befriedigung verlangen können. Dieses Recht steht den Gläubigern jedoch nur zu, wenn sie glaubhaft machen, dass durch die Verschmelzung die Erfüllung ihrer Forderung gefährdet wird."
    },
    {
      "date": "2024-12-02",
      "id": "95127",
      "original_text": "Löschungsankündigung\nBerlin Amtsgericht Berlin (Charlottenburg) HRB 132025\nTEBA International Investment & Kooperation GmbH – Berlin",
      "type": "Löschungsankündigung",
      "state": "Berlin",
      "amtsgericht": "Amtsgericht Berlin (Charlottenburg)",
      "registernummer": "HRB 132025",
      "registerart": "HRB",
      "company_name": "TEBA International Investment & Kooperation GmbH",
      "company_seat": "Berlin",
      "details": "02.12.2024 (Bekanntmachungsdatum)\n\nBerlin Amtsgericht Berlin (Charlottenburg) HRB 132025\nLöschungsankündigung\n\nTEBA International Investment & Kooperation GmbH\nGesellschaft mit beschränkter Haftung\nBerlin\n\nBei der nachstehenden Gesellschaft wird das Amtslöschungsverfahren gemäß § 394 FamFG eingeleitet. Widerspruchsfrist 6 Wochen"
    },
    {
      "date": "2024-12-02",
      "id": "95128",
      "original_text": "Löschungsankündigung\nBaden-Württemberg Amtsgericht Stuttgart HRB 759468\nMTD Sales Tübingen GmbH – Tübingen",
      "type": "Löschungsankündigung",
      "state": "Baden-Württemberg",
      "amtsgericht": "Amtsgericht Stuttgart",
      "registernummer": "HRB 759468",
      "registerart": "HRB",
      "company_name": "MTD Sales Tübingen GmbH",
      "company_seat": "Tübingen",
      "details": "02.12.2024 (Bekanntmachungsdatum)\n\nBaden-Württemberg Amtsgericht Stuttgart HRB 759468\nLöschungsankündigung\n\nMTD Sales Tübingen GmbH\nGesellschaft mit beschränkter Haftung\nTübingen\n\nDas Gericht beabsichtigt, die Gesellschaft wegen Vermögenslosigkeit im Handelsregister von Amts wegen nach § 394 FamFG zu löschen. Die Frist zur Geltendmachung eines Widerspruchs gegen die beabsichtigte Löschung ist auf einen Monat ab Veröffentlichung bestimmt."
    },
    {
      "date": "2024-12-02",
      "id": "95129",
      "original_text": "Registerbekanntmachung nach dem Umwandlungsgesetz\nBerlin Amtsgericht Berlin (Charlottenburg) HRB 261451\nberatungswerk24 GmbH – Berlin",
      "type": "Registerbekanntmachung nach dem Umwandlungsgesetz",
      "state": "Berlin",
      "amtsgericht": "Amtsgericht Berlin (Charlottenburg)",
      "registernummer": "HRB 261451",
      "registerart": "HRB",
      "company_name": "beratungswerk24 GmbH",
      "company_seat": "Berlin",
      "details": "02.12.2024 (Bekanntmachungsdatum)\n\nBerlin Amtsgericht Berlin (Charlottenburg) HRB 261451\nRegisterbekanntmachung nach dem Umwandlungsgesetz 29.11.2024 (Eintragungsdatum)\n\nberatungswerk24 GmbH\nGesellschaft mit beschränkter Haftung\nBerlin\n\nZu Eintragungsnummer 5 vom 29.11.2024 wird als nicht eingetragen veröffentlicht:Den Gläubigern der an der Verschmelzung beteiligten Rechtsträger ist, wenn sie binnen sechs Monaten nach dem Tag, an dem die Eintragung der Verschmelzung in das Register des Sitzes desjenigen Rechtsträgers, dessen Gläubiger sie sind, als bekannt gemacht gilt, ihren Anspruch nach Grund und Höhe schriftlich anmelden, Sicherheit zu leisten, soweit sie nicht Befriedigung verlangen können. Dieses Recht steht den Gläubigern jedoch nur zu, wenn sie glaubhaft machen, dass durch die Verschmelzung die Erfüllung ihrer Forderung gefährdet wird. Das Recht, Sicherheitsleistung zu verlangen, steht Gläubigern nicht zu, die im Falle der Insolvenz ein Recht auf vorzugsweise Befriedigung aus einer Deckungsmasse haben, die nach gesetzlicher Vorschrift zu ihrem Schutz errichtet und staatlich überwacht ist."
    },
    {
      "date": "2024-12-02",
      "id": "95130",
      "original_text": "Registerbekanntmachung nach dem Umwandlungsgesetz\nSchleswig-Holstein Amtsgericht Lübeck HRA 11075\nTFD - Thomas Friedrich Dienstleistungen e.K. – Ratzeburg",
      "type": "Registerbekanntmachung nach dem Umwandlungsgesetz",
      "state": "Schleswig-Holstein",
      "amtsgericht": "Amtsgericht Lübeck",
      "registernummer": "HRA 11075",
      "registerart": "HRA",
      "company_name": "TFD - Thomas Friedrich Dienstleistungen e.K.",
      "company_seat": "Ratzeburg",
      "details": "02.12.2024 (Bekanntmachungsdatum)\n\nSchleswig-Holstein Amtsgericht Lübeck HRA 11075\nRegisterbekanntmachung nach dem Umwandlungsgesetz 02.12.2024 (Eintragungsdatum)\n\nTFD - Thomas Friedrich Dienstleistungen e.K.\nEinzelkaufmann / Einzelkauffrau\nRatzeburg\n\nZu Eintragungsnummer 3 vom 02.12.2024 wird als nicht eingetragen veröffentlicht:\nDen Gläubigern der an der Ausgliederung beteiligten Rechtsträger ist, wenn sie binnen sechs Monaten nach dem Tag, an dem die Eintragung der Ausgliederung in das Register des Sitzes desjenigen Rechtsträgers, dessen Gläubiger sie sind, als bekannt gemacht gilt, ihren Anspruch nach Grund und Höhe schriftlich anmelden, Sicherheit zu leisten, soweit sie nicht Befriedigung verlangen können. Dieses Recht steht den Gläubigern jedoch nur zu, wenn sie glaubhaft machen, dass durch die Ausgliederung die Erfüllung ihrer Forderung gefährdet wird."
    },
    {
      "date": "2024-12-02",
      "id": "95131",
      "original_text": "Registerbekanntmachung nach dem Umwandlungsgesetz\nSchleswig-Holstein Amtsgericht Lübeck HRB 24173\nTFI Verwaltungs GmbH – Ratzeburg",
      "type": "Registerbekanntmachung nach dem Umwandlungsgesetz",
      "state": "Schleswig-Holstein",
      "amtsgericht": "Amtsgericht Lübeck",
      "registernummer": "HRB 24173",
      "registerart": "HRB",
      "company_name": "TFI Verwaltungs GmbH",
      "company_seat": "Ratzeburg",
      "details": "02.12.2024 (Bekanntmachungsdatum)\n\nSchleswig-Holstein Amtsgericht Lübeck HRB 24173\nRegisterbekanntmachung nach dem Umwandlungsgesetz 02.12.2024 (Eintragungsdatum)\n\nTFI Verwaltungs GmbH\nGesellschaft mit beschränkter Haftung\nRatzeburg\n\nZu Eintragungsnummer 2 vom 02.12.2024 wird als nicht eingetragen veröffentlicht:\nDen Gläubigern der an der Ausgliederung beteiligten Rechtsträger ist, wenn sie binnen sechs Monaten nach dem Tag, an dem die Eintragung der Ausgliederung in das Register des Sitzes desjenigen Rechtsträgers, dessen Gläubiger sie sind, als bekannt gemacht gilt, ihren Anspruch nach Grund und Höhe schriftlich anmelden, Sicherheit zu leisten, soweit sie nicht Befriedigung verlangen können. Dieses Recht steht den Gläubigern jedoch nur zu, wenn sie glaubhaft machen, dass durch die Ausgliederung die Erfüllung ihrer Forderung gefährdet wird."
    },
    {
      "date": "2024-12-02",
      "id": "95132",
      "original_text": "Einreichung neuer Dokumente\nSachsen Amtsgericht Chemnitz HRB 7717\nEntsorgungsgesellschaft Zwickauer Land mbH – Reinsdorf",
      "type": "Einreichung neuer Dokumente",
      "state": "Sachsen",
      "amtsgericht": "Amtsgericht Chemnitz",
      "registernummer": "HRB 7717",
      "registerart": "HRB",
      "company_name": "Entsorgungsgesellschaft Zwickauer Land mbH",
      "company_seat": "Reinsdorf",
      "details": "02.12.2024 (Bekanntmachungsdatum)\n\nSachsen Amtsgericht Chemnitz HRB 7717\nEinreichung neuer Dokumente 29.11.2024 (Eintragungsdatum)\n\nEntsorgungsgesellschaft Zwickauer Land mbH\nGesellschaft mit beschränkter Haftung\nReinsdorf\n\nAm 29.11.2024 wurde beim Handelsregister des Amtsgerichts Chemnitz die Liste der Mitglieder des Aufsichtsrats gemäß § 52 GmbHG eingereicht."
    },
    {
      "date": "2024-12-02",
      "id": "95133",
      "original_text": "Sonstige Registerbekanntmachung\nSachsen Amtsgericht Leipzig HRB 1776\nLeipziger Wohnungs- und Baugesellschaft mbH – Leipzig",
      "type": "Sonstige Registerbekanntmachung",
      "state": "Sachsen",
      "amtsgericht": "Amtsgericht Leipzig",
      "registernummer": "HRB 1776",
      "registerart": "HRB",
      "company_name": "Leipziger Wohnungs- und Baugesellschaft mbH",
      "company_seat": "Leipzig",
      "details": "02.12.2024 (Bekanntmachungsdatum)\n\nSachsen Amtsgericht Leipzig HRB 1776\nSonstige Registerbekanntmachung\n\nLeipziger Wohnungs- und Baugesellschaft mbH\nGesellschaft mit beschränkter Haftung\nLeipzig\n\nAm 29.11.2024 wurde beim Handelsregister des Amtsgerichts Leipzig die Liste der Mitglieder des Aufsichtsrats gemäß § 52 GmbHG eingereicht."
    },
    {
      "date": "2024-12-02",
      "id": "95134",
      "original_text": "Löschungsankündigung\nSachsen Amtsgericht Dresden HRB 20078\nTreppenbau-Müller Verwaltungs GmbH – Riesa",
      "type": "Löschungsankündigung",
      "state": "Sachsen",
      "amtsgericht": "Amtsgericht Dresden",
      "registernummer": "HRB 20078",
      "registerart": "HRB",
      "company_name": "Treppenbau-Müller Verwaltungs GmbH",
      "company_seat": "Riesa",
      "details": "02.12.2024 (Bekanntmachungsdatum)\n\nSachsen Amtsgericht Dresden HRB 20078\nLöschungsankündigung\n\nTreppenbau-Müller Verwaltungs GmbH\nGesellschaft mit beschränkter Haftung\nRiesa\n\nDas Registergericht beabsichtigt, die im Handelsregister eingetragene Gesellschaft von Amts wegen nach § 394 FamFG zu löschen. Die Frist zu Erhebung eines Widerspruchs gegen die beabsichtigte Löschung wird auf einen Monat festgesetzt."
    },
    {
      "date": "2024-12-02",
      "id": "95135",
      "original_text": "Einreichung neuer Dokumente\nSachsen Amtsgericht Chemnitz HRB 8491\nTREUENER WOHNUNGSVERWALTUNGSGESELLSCHAFT mbH – Treuen",
      "type": "Einreichung neuer Dokumente",
      "state": "Sachsen",
      "amtsgericht": "Amtsgericht Chemnitz",
      "registernummer": "HRB 8491",
      "registerart": "HRB",
      "company_name": "TREUENER WOHNUNGSVERWALTUNGSGESELLSCHAFT mbH",
      "company_seat": "Treuen",
      "details": "02.12.2024 (Bekanntmachungsdatum)\n\nSachsen Amtsgericht Chemnitz HRB 8491\nEinreichung neuer Dokumente\n\nTREUENER WOHNUNGSVERWALTUNGSGESELLSCHAFT mbH\nGesellschaft mit beschränkter Haftung\nTreuen\n\nAm 02.12.2024 wurde beim Handelsregister des Amtsgerichts Chemnitz die Liste der Mitglieder des Aufsichtsrats gemäß § 52 GmbHG eingereicht."
    },
    {
      "date": "2024-12-02",
      "id": "95136",
      "original_text": "Löschungsankündigung\nSachsen Amtsgericht Chemnitz HRB 36117\nSöS Vorratsgesellschaft Drei mbH – Wilkau-Haßlau",
      "type": "Löschungsankündigung",
      "state": "Sachsen",
      "amtsgericht": "Amtsgericht Chemnitz",
      "registernummer": "HRB 36117",
      "registerart": "HRB",
      "company_name": "SöS Vorratsgesellschaft Drei mbH",
      "company_seat": "Wilkau-Haßlau",
      "details": "02.12.2024 (Bekanntmachungsdatum)\n\nSachsen Amtsgericht Chemnitz HRB 36117\nLöschungsankündigung\n\nSöS Vorratsgesellschaft Drei mbH\nGesellschaft mit beschränkter Haftung\nWilkau-Haßlau\n\nDas Registergericht beabsichtigt, die im Handelsregister eingetragene Gesellschaft von Amts wegen nach § 394 FamFG zu löschen. Die Frist zu Erhebung eines Widerspruchs gegen die beabsichtigte Löschung wird auf einen Monat festgesetzt."
    },
    {
      "date": "2024-12-02",
      "id": "95137",
      "original_text": "Sonstige Registerbekanntmachung\nSachsen Amtsgericht Leipzig HRB 17608\nLecos GmbH – Leipzig",
      "type": "Sonstige Registerbekanntmachung",
      "state": "Sachsen",
      "amtsgericht": "Amtsgericht Leipzig",
      "registernummer": "HRB 17608",
      "registerart": "HRB",
      "company_name": "Lecos GmbH",
      "company_seat": "Leipzig",
      "details": "02.12.2024 (Bekanntmachungsdatum)\n\nSachsen Amtsgericht Leipzig HRB 17608\nSonstige Registerbekanntmachung\n\nLecos GmbH\nGesellschaft mit beschränkter Haftung\nLeipzig\n\nAm 29.11.2024 wurde beim Handelsregister des Amtsgerichts Leipzig die Liste der Mitglieder des Aufsichtsrats gemäß § 52 GmbHG eingereicht."
    },
    {
      "date": "2024-12-02",
      "id": "95138",
      "original_text": "Registerbekanntmachung nach dem Umwandlungsgesetz\nNiedersachsen Amtsgericht Osnabrück HRA 209269\nLS Haustechnik Inh. Lutz Schacher e.K. – Uelsen",
      "type": "Registerbekanntmachung nach dem Umwandlungsgesetz",
      "state": "Niedersachsen",
      "amtsgericht": "Amtsgericht Osnabrück",
      "registernummer": "HRA 209269",
      "registerart": "HRA",
      "company_name": "LS Haustechnik Inh. Lutz Schacher e.K.",
      "company_seat": "Uelsen",
      "details": "02.12.2024 (Bekanntmachungsdatum)\n\nNiedersachsen Amtsgericht Osnabrück HRA 209269\nRegisterbekanntmachung nach dem Umwandlungsgesetz 02.12.2024 (Eintragungsdatum)\n\nLS Haustechnik Inh. Lutz Schacher e.K.\nEinzelkaufmann / Einzelkauffrau\nUelsen\n\nDen Gläubigern der an der Ausgliederung beteiligten Rechtsträger ist, wenn sie binnen sechs Monaten nach dem Tag, an dem die Eintragung der Ausgliederung in das Register des Sitzes desjenigen Rechtsträgers, dessen Gläubiger sie sind, nach § 19 Abs. 3 UmwG als bekannt gemacht gilt, ihren Anspruch nach Grund und Höhe schriftlich anmelden, Sicherheit zu leisten, soweit sie nicht Befriedigung verlangen können. Dieses Recht steht den Gläubigern jedoch nur zu, wenn sie glaubhaft machen, dass durch die Ausgliederung die Erfüllung der Forderung gefährdet wird."
    },
    {
      "date": "2024-12-02",
      "id": "95139",
      "original_text": "Löschungsankündigung\nNiedersachsen Amtsgericht Osnabrück HRB 121003 früher Amtsgericht Meppen\nHermes Solar- und Bürotechnik GmbH – Haren",
      "type": "Löschungsankündigung",
      "state": "Niedersachsen",
      "amtsgericht": "Amtsgericht Osnabrück",
      "registernummer": "HRB 121003",
      "registerart": "HRB",
      "company_name": "Hermes Solar- und Bürotechnik GmbH",
      "company_seat": "Haren",
      "former_amtsgericht": "Meppen",
      "details": "02.12.2024 (Bekanntmachungsdatum)\n\nNiedersachsen Amtsgericht Osnabrück HRB 121003 früher Amtsgericht Meppen\nLöschungsankündigung\n\nHermes Solar- und Bürotechnik GmbH\nGesellschaft mit beschränkter Haftung\nHaren\n\nDas Registergericht beabsichtigt, die Gesellschaft von Amts wegen nach § 394 FamFG wegen Vermögenslosigkeit zu löschen. Die Frist zur Erhebung eines Widerspruchs ist auf 1 Monat ab dieser Registerbekanntmachung festgesetzt."
    },
    {
      "date": "2024-12-02",
      "id": "95140",
      "original_text": "Löschungsankündigung\nNiedersachsen Amtsgericht Aurich HRB 200014\nBohlen & Doyen Bau und Service GmbH. – Wiesmoor",
      "type": "Löschungsankündigung",
      "state": "Niedersachsen",
      "amtsgericht": "Amtsgericht Aurich",
      "registernummer": "HRB 200014",
      "registerart": "HRB",
      "company_name": "Bohlen & Doyen Bau und Service GmbH.",
      "company_seat": "Wiesmoor",
      "details": "02.12.2024 (Bekanntmachungsdatum)\n\nNiedersachsen Amtsgericht Aurich HRB 200014\nLöschungsankündigung 02.12.2024 (Eintragungsdatum)\n\nBohlen & Doyen Bau und Service GmbH.\nGesellschaft mit beschränkter Haftung\nWiesmoor\n\nDas Registergericht beabsichtigt, die Gesellschaft von Amts wegen nach § 394 FamFG zu löschen. Die Frist zur Erhebung eines Widerspruchs ist auf 1 Monat ab dieser Registerbekanntmachung festgesetzt."
    },
    {
      "date": "2024-12-02",
      "id": "95141",
      "original_text": "Löschungsankündigung\nNiedersachsen Amtsgericht Osnabrück HRB 214989\nHoliday Match UG (haftungsbeschränkt) – Osnabrück",
      "type": "Löschungsankündigung",
      "state": "Niedersachsen",
      "amtsgericht": "Amtsgericht Osnabrück",
      "registernummer": "HRB 214989",
      "registerart": "HRB",
      "company_name": "Holiday Match UG (haftungsbeschränkt)",
      "company_seat": "Osnabrück",
      "details": "02.12.2024 (Bekanntmachungsdatum)\n\nNiedersachsen Amtsgericht Osnabrück HRB 214989\nLöschungsankündigung\n\nHoliday Match UG (haftungsbeschränkt)\nGesellschaft mit beschränkter Haftung\nOsnabrück\n\nDas Registergericht beabsichtigt, die Gesellschaft von Amts wegen nach § 394 FamFG wegen Vermögenslosigkeit zu löschen. Die Frist zur Erhebung eines Widerspruchs ist auf 1 Monat ab dieser Registerbekanntmachung festgesetzt."
    },
    {
      "date": "2024-12-02",
      "id": "95142",
      "original_text": "Löschungsankündigung\nNiedersachsen Amtsgericht Osnabrück HRB 215667\nDeuPla - Deutsche Plasma Gesellschaft zur Forschung, Entwicklung und Anwendung physikalischer Plasmen mbH – Bramsche",
      "type": "Löschungsankündigung",
      "state": "Niedersachsen",
      "amtsgericht": "Amtsgericht Osnabrück",
      "registernummer": "HRB 215667",
      "registerart": "HRB",
      "company_name": "DeuPla - Deutsche Plasma Gesellschaft zur Forschung, Entwicklung und Anwendung physikalischer Plasmen mbH",
      "company_seat": "Bramsche",
      "details": "02.12.2024 (Bekanntmachungsdatum)\n\nNiedersachsen Amtsgericht Osnabrück HRB 215667\nLöschungsankündigung\n\nDeuPla - Deutsche Plasma Gesellschaft zur Forschung, Entwicklung und Anwendung physikalischer Plasmen mbH\nGesellschaft mit beschränkter Haftung\nBramsche\n\nDas Registergericht beabsichtigt, die Gesellschaft von Amts wegen nach § 394 FamFG wegen Vermögenslosigkeit zu löschen. Die Frist zur Erhebung eines Widerspruchs ist auf 1 Monat ab dieser Registerbekanntmachung festgesetzt."
    },
    {
      "date": "2024-12-02",
      "id": "95143",
      "original_text": "Registerbekanntmachung nach dem Umwandlungsgesetz\nNiedersachsen Amtsgericht Osnabrück HRB 207110\nFip Beteiligungs- und Vermögensverwaltung GmbH – Osnabrück",
      "type": "Registerbekanntmachung nach dem Umwandlungsgesetz",
      "state": "Niedersachsen",
      "amtsgericht": "Amtsgericht Osnabrück",
      "registernummer": "HRB 207110",
      "registerart": "HRB",
      "company_name": "Fip Beteiligungs- und Vermögensverwaltung GmbH",
      "company_seat": "Osnabrück",
      "details": "02.12.2024 (Bekanntmachungsdatum)\n\nNiedersachsen Amtsgericht Osnabrück HRB 207110\nRegisterbekanntmachung nach dem Umwandlungsgesetz 02.12.2024 (Eintragungsdatum)\n\nFip Beteiligungs- und Vermögensverwaltung GmbH\nGesellschaft mit beschränkter Haftung\nOsnabrück\n\nDen Gläubigern der an der Verschmelzung beteiligten Rechtsträger ist, wenn sie binnen sechs Monaten nach dem Tag, an dem die Eintragung der Verschmelzung in das Register des Sitzes desjenigen Rechtsträgers, dessen Gläubiger sie sind, nach § 19  Abs.  3 UmwG als bekannt gemacht gilt, ihren Anspruch nach Grund und Höhe schriftlich anmelden, Sicherheit zu leisten, soweit sie nicht Befriedigung verlangen können. Dieses Recht steht den Gläubigern jedoch nur zu, wenn sie glaubhaft machen, dass durch die Verschmelzung die Erfüllung der Forderung gefährdet wird."
    },
    {
      "date": "2024-12-02",
      "id": "95144",
      "original_text": "Registerbekanntmachung nach dem Umwandlungsgesetz\nNiedersachsen Amtsgericht Osnabrück HRA 209319\nLS Haustechnik GmbH & Co. KG – Uelsen",
      "type": "Registerbekanntmachung nach dem Umwandlungsgesetz",
      "state": "Niedersachsen",
      "amtsgericht": "Amtsgericht Osnabrück",
      "registernummer": "HRA 209319",
      "registerart": "HRA",
      "company_name": "LS Haustechnik GmbH & Co. KG",
      "company_seat": "Uelsen",
      "details": "02.12.2024 (Bekanntmachungsdatum)\n\nNiedersachsen Amtsgericht Osnabrück HRA 209319\nRegisterbekanntmachung nach dem Umwandlungsgesetz 02.12.2024 (Eintragungsdatum)\n\nLS Haustechnik GmbH & Co. KG\nKommanditgesellschaft\nUelsen\n\nDen Gläubigern der an der Ausgliederung beteiligten Rechtsträger ist, wenn sie binnen sechs Monaten nach dem Tag, an dem die Eintragung der Ausgliederung in das Register des Sitzes desjenigen Rechtsträgers, dessen Gläubiger sie sind, nach § 19 Abs. 3 UmwG als bekannt gemacht gilt, ihren Anspruch nach Grund und Höhe schriftlich anmelden, Sicherheit zu leisten, soweit sie nicht Befriedigung verlangen können. Dieses Recht steht den Gläubigern jedoch nur zu, wenn sie glaubhaft machen, dass durch die Ausgliederung die Erfüllung der Forderung gefährdet wird."
    },
    {
      "date": "2024-12-02",
      "id": "95145",
      "original_text": "Registerbekanntmachung nach dem Umwandlungsgesetz\nNiedersachsen Amtsgericht Oldenburg (Oldenburg) HRB 206759\nKrankenhaus St. Franziskus-Hospital gemeinnützige GmbH – Lohne",
      "type": "Registerbekanntmachung nach dem Umwandlungsgesetz",
      "state": "Niedersachsen",
      "amtsgericht": "Amtsgericht Oldenburg (Oldenburg)",
      "registernummer": "HRB 206759",
      "registerart": "HRB",
      "company_name": "Krankenhaus St. Franziskus-Hospital gemeinnützige GmbH",
      "company_seat": "Lohne",
      "details": "02.12.2024 (Bekanntmachungsdatum)\n\nNiedersachsen Amtsgericht Oldenburg (Oldenburg) HRB 206759\nRegisterbekanntmachung nach dem Umwandlungsgesetz 02.12.2024 (Eintragungsdatum)\n\nKrankenhaus St. Franziskus-Hospital gemeinnützige GmbH\nGesellschaft mit beschränkter Haftung\nLohne\n\nDen Gläubigern der an der Verschmelzung beteiligten Rechtsträger ist, wenn sie binnen sechs Monaten nach dem Tag, an dem die Eintragung der Verschmelzung in das Register des Sitzes desjenigen Rechtsträgers, dessen Gläubiger sie sind, nach § 19  Abs.  3 UmwG als bekannt gemacht gilt, ihren Anspruch nach Grund und Höhe schriftlich anmelden, Sicherheit zu leisten, soweit sie nicht Befriedigung verlangen können. Dieses Recht steht den Gläubigern jedoch nur zu, wenn sie glaubhaft machen, dass durch die Verschmelzung die Erfüllung der Forderung gefährdet wird."
    },
    {
      "date": "2024-12-02",
      "id": "95146",
      "original_text": "Registerbekanntmachung nach dem Umwandlungsgesetz\nNiedersachsen Amtsgericht Oldenburg (Oldenburg) HRB 206040\nSt. Marienhospital Vechta Lohne gemeinnützige GmbH – Vechta",
      "type": "Registerbekanntmachung nach dem Umwandlungsgesetz",
      "state": "Niedersachsen",
      "amtsgericht": "Amtsgericht Oldenburg (Oldenburg)",
      "registernummer": "HRB 206040",
      "registerart": "HRB",
      "company_name": "St. Marienhospital Vechta Lohne gemeinnützige GmbH",
      "company_seat": "Vechta",
      "details": "02.12.2024 (Bekanntmachungsdatum)\n\nNiedersachsen Amtsgericht Oldenburg (Oldenburg) HRB 206040\nRegisterbekanntmachung nach dem Umwandlungsgesetz 02.12.2024 (Eintragungsdatum)\n\nSt. Marienhospital Vechta Lohne gemeinnützige GmbH\nGesellschaft mit beschränkter Haftung\nVechta\n\nDen Gläubigern der an der Verschmelzung beteiligten Rechtsträger ist, wenn sie binnen sechs Monaten nach dem Tag, an dem die Eintragung der Verschmelzung in das Register des Sitzes desjenigen Rechtsträgers, dessen Gläubiger sie sind, nach § 19  Abs.  3 UmwG als bekannt gemacht gilt, ihren Anspruch nach Grund und Höhe schriftlich anmelden, Sicherheit zu leisten, soweit sie nicht Befriedigung verlangen können. Dieses Recht steht den Gläubigern jedoch nur zu, wenn sie glaubhaft machen, dass durch die Verschmelzung die Erfüllung der Forderung gefährdet wird."
    },
    {
      "date": "2024-12-02",
      "id": "95147",
      "original_text": "Löschungsankündigung\nNiedersachsen Amtsgericht Osnabrück HRB 205757\nERBAY Unternehmens- und Wirtschaftsberatung für erneuerbare Energien und Umwelt GmbH – Osnabrück",
      "type": "Löschungsankündigung",
      "state": "Niedersachsen",
      "amtsgericht": "Amtsgericht Osnabrück",
      "registernummer": "HRB 205757",
      "registerart": "HRB",
      "company_name": "ERBAY Unternehmens- und Wirtschaftsberatung für erneuerbare Energien und Umwelt GmbH",
      "company_seat": "Osnabrück",
      "details": "02.12.2024 (Bekanntmachungsdatum)\n\nNiedersachsen Amtsgericht Osnabrück HRB 205757\nLöschungsankündigung\n\nERBAY Unternehmens- und Wirtschaftsberatung für erneuerbare Energien und Umwelt GmbH\nGesellschaft mit beschränkter Haftung\nOsnabrück\n\nDas Registergericht beabsichtigt, die Gesellschaft von Amts wegen nach § 394 FamFG wegen Vermögenslosigkeit zu löschen. Die Frist zur Erhebung eines Widerspruchs ist auf 1 Monat ab dieser Registerbekanntmachung festgesetzt."
    },
    {
      "date": "2024-12-02",
      "id": "95148",
      "original_text": "Löschungsankündigung\nBremen Amtsgericht Bremen HRB 39714\nKÖZ BASi GmbH – Bremerhaven",
      "type": "Löschungsankündigung",
      "state": "Bremen",
      "amtsgericht": "Amtsgericht Bremen",
      "registernummer": "HRB 39714",
      "registerart": "HRB",
      "company_name": "KÖZ BASi GmbH",
      "company_seat": "Bremerhaven",
      "details": "02.12.2024 (Bekanntmachungsdatum)\n\nBremen Amtsgericht Bremen HRB 39714\nLöschungsankündigung\n\nKÖZ BASi GmbH\nGesellschaft mit beschränkter Haftung\nBremerhaven\n\nEs ist beabsichtigt die im Handelsregister eingetragene Gesellschaft von Amts wegen gemäß § 394 FamFG zu löschen. Gegen die Löschung kann beim AG Bremen schriftlich oder zu Protokoll der Geschäftsstelle Widerspruch eingelegt werden. Widerspruchsfrist 4 Wochen."
    },
    {
      "date": "2024-12-02",
      "id": "95149",
      "original_text": "Löschungsankündigung\nBremen Amtsgericht Bremen HRB 40137\nKlunker Bau UG (haftungsbeschränkt) – Bremen",
      "type": "Löschungsankündigung",
      "state": "Bremen",
      "amtsgericht": "Amtsgericht Bremen",
      "registernummer": "HRB 40137",
      "registerart": "HRB",
      "company_name": "Klunker Bau UG (haftungsbeschränkt)",
      "company_seat": "Bremen",
      "details": "02.12.2024 (Bekanntmachungsdatum)\n\nBremen Amtsgericht Bremen HRB 40137\nLöschungsankündigung\n\nKlunker Bau UG (haftungsbeschränkt)\nGesellschaft mit beschränkter Haftung\nBremen\n\nEs ist beabsichtigt die im Handelsregister eingetragene Gesellschaft von Amts wegen gemäß § 394 FamFG zu löschen. Gegen die Löschung kann beim AG Bremen schriftlich oder zu Protokoll der Geschäftsstelle Widerspruch eingelegt werden. Widerspruchsfrist 4 Wochen."
    },
    {
      "date": "2024-12-02",
      "id": "95150",
      "original_text": "Einreichung neuer Dokumente\nRheinland-Pfalz Amtsgericht Montabaur HRB 29429\nIFL AG – Mogendorf",
      "type": "Einreichung neuer Dokumente",
      "state": "Rheinland-Pfalz",
      "amtsgericht": "Amtsgericht Montabaur",
      "registernummer": "HRB 29429",
      "registerart": "HRB",
      "company_name": "IFL AG",
      "company_seat": "Mogendorf",
      "details": "02.12.2024 (Bekanntmachungsdatum)\n\nRheinland-Pfalz Amtsgericht Montabaur HRB 29429\nEinreichung neuer Dokumente\n\nIFL AG\nAktiengesellschaft\nMogendorf\n\nDem Registergericht ist eine neue Liste der Mitglieder des Aufsichtsrates eingereicht worden."
    },
    {
      "date": "2024-12-02",
      "id": "95151",
      "original_text": "Löschungsankündigung\nNordrhein-Westfalen Amtsgericht Düsseldorf HRB 83128\nA+A Autoservice GmbH – Düsseldorf",
      "type": "Löschungsankündigung",
      "state": "Nordrhein-Westfalen",
      "amtsgericht": "Amtsgericht Düsseldorf",
      "registernummer": "HRB 83128",
      "registerart": "HRB",
      "company_name": "A+A Autoservice GmbH",
      "company_seat": "Düsseldorf",
      "details": "02.12.2024 (Bekanntmachungsdatum)\n\nNordrhein-Westfalen Amtsgericht Düsseldorf HRB 83128\nLöschungsankündigung\n\nA+A Autoservice GmbH\nGesellschaft mit beschränkter Haftung\nDüsseldorf\n\nBetr.: A+A Autoservice GmbH, Wittelsbacherstr. 31, 10707 Berlin;\nSitz: Düsseldorf\n\nDas Registergericht beabsichtigt die Gesellschaft von Amts wegen nach § 394 FamFG zu löschen. Die Frist zur Erhebung eines Widerspruchs ist auf 3 Wochen festgesetzt.\n\nRechtsbehelfsbelehrung:\n\nDas Widerspruchsrecht steht jedem zu, der an der Unterlassung der Löschung ein berechtigtes Interesse hat. Der Widerspruch ist bei dem Amtsgericht Düsseldorf -Registergericht-, Werdener Straße 1, 40227 Düsseldorf schriftlich in deutscher Sprache oder zur Niederschrift der Geschäftsstelle einzulegen. Der Widerspruch kann auch zur Niederschrift der Geschäftsstelle eines jeden Amtsgerichtes abgegeben werden. Die Einlegung ist auch durch Übertragung eines elektronischen Dokuments an die elektronische Poststelle des Gerichts möglich. Das elektronische Dokument muss für die Bearbeitung durch das Gericht geeignet und mit einer qualifizierten elektronischen Signatur der verantwortenden Person versehen sein oder von der verantwortenden Person signiert und auf einem sicheren Übermittlungsweg gemäß § 130a ZPO nach näherer Maßgabe der Verordnung über die technischen Rahmenbedingungen des elektronischen Rechtsverkehrs und über das besondere elektronische Behördenpostfach (BGBl. I, S.3803) eingereicht werden. Weitere Informationen erhalten Sie auf der Internetseite www.justiz.de.\nDer Widerspruch muss spätestens innerhalb der gesetzten Frist nach dem Datum der Bekanntmachung der Löschungsankündigung bei dem Amtsgericht - Registergericht - Düsseldorf eingegangen sein.  Dies gilt auch dann, wenn der Widerspruch zur Niederschrift der Geschäftsstelle eines anderen Amtsgerichtes abgegeben wurde. Die Frist beginnt mit dem Tage der Bekanntmachung der Löschungsankündigung in dem für die Bekanntmachung der Eintragungen in das Handelsregister bestimmten elektronischen Informations- und Kommunikationssystem nach § 10 des Handelsgesetzbuches. Fällt das Ende der Frist auf einen Sonntag, einen allgemeinen Feiertag oder Sonnabend, so endet die Frist mit Ablauf des nächsten Werktages.\nDer Widerspruch muss die Bezeichnung der angefochtenen Löschungsankündigung sowie die Erklärung enthalten, dass Widerspruch gegen diese Löschungsankündigung eingelegt wird. Er ist zu unterzeichnen und soll begründet werden."
    },
    {
      "date": "2024-12-02",
      "id": "95152",
      "original_text": "Löschungsankündigung\nNordrhein-Westfalen Amtsgericht Köln HRB 101174\nAmet System GmbH – Bergisch Gladbach",
      "type": "Löschungsankündigung",
      "state": "Nordrhein-Westfalen",
      "amtsgericht": "Amtsgericht Köln",
      "registernummer": "HRB 101174",
      "registerart": "HRB",
      "company_name": "Amet System GmbH",
      "company_seat": "Bergisch Gladbach",
      "details": "02.12.2024 (Bekanntmachungsdatum)\n\nNordrhein-Westfalen Amtsgericht Köln HRB 101174\nLöschungsankündigung\n\nAmet System GmbH\nGesellschaft mit beschränkter Haftung\nBergisch Gladbach\n\nDas Registergericht beabsichtigt die Gesellschaft von Amts wegen nach § 394 FamFG zu löschen. Die Frist zur Erhebung eines Widerspruchs ist auf einen Monat festgesetzt."
    },
    {
      "date": "2024-12-02",
      "id": "95153",
      "original_text": "Sonstige Registerbekanntmachung\nNordrhein-Westfalen Amtsgericht Siegburg HRB 17455\nTrinks GmbH – Hennef",
      "type": "Sonstige Registerbekanntmachung",
      "state": "Nordrhein-Westfalen",
      "amtsgericht": "Amtsgericht Siegburg",
      "registernummer": "HRB 17455",
      "registerart": "HRB",
      "company_name": "Trinks GmbH",
      "company_seat": "Hennef",
      "details": "02.12.2024 (Bekanntmachungsdatum)\n\nNordrhein-Westfalen Amtsgericht Siegburg HRB 17455\nSonstige Registerbekanntmachung\n\nTrinks GmbH\nGesellschaft mit beschränkter Haftung\nHennef"
    },
    {
      "date": "2024-12-02",
      "id": "95154",
      "original_text": "Einreichung neuer Dokumente\nNordrhein-Westfalen Amtsgericht Duisburg HRB 4716\nHüttenwerke Krupp Mannesmann Gesellschaft mit beschränkter Haftung – Duisburg",
      "type": "Einreichung neuer Dokumente",
      "state": "Nordrhein-Westfalen",
      "amtsgericht": "Amtsgericht Duisburg",
      "registernummer": "HRB 4716",
      "registerart": "HRB",
      "company_name": "Hüttenwerke Krupp Mannesmann Gesellschaft mit beschränkter Haftung",
      "company_seat": "Duisburg",
      "details": "02.12.2024 (Bekanntmachungsdatum)\n\nNordrhein-Westfalen Amtsgericht Duisburg HRB 4716\nEinreichung neuer Dokumente\n\nHüttenwerke Krupp Mannesmann Gesellschaft mit beschränkter Haftung\nGesellschaft mit beschränkter Haftung\nDuisburg\n\nDem Registergericht ist eine neue Liste der Mitglieder des Aufsichtsrates eingereicht worden."
    },
    {
      "date": "2024-12-02",
      "id": "95155",
      "original_text": "Löschungsankündigung\nNordrhein-Westfalen Amtsgericht Düsseldorf HRB 95722\nDENI Bau GmbH – Hilden",
      "type": "Löschungsankündigung",
      "state": "Nordrhein-Westfalen",
      "amtsgericht": "Amtsgericht Düsseldorf",
      "registernummer": "HRB 95722",
      "registerart": "HRB",
      "company_name": "DENI Bau GmbH",
      "company_seat": "Hilden",
      "details": "02.12.2024 (Bekanntmachungsdatum)\n\nNordrhein-Westfalen Amtsgericht Düsseldorf HRB 95722\nLöschungsankündigung\n\nDENI Bau GmbH\nGesellschaft mit beschränkter Haftung\nHilden\n\nDas Registergericht beabsichtigt die Gesellschaft von Amts wegen nach § 394 FamFG zu löschen. Die Frist zur Erhebung eines Widerspruchs ist auf 3 Wochen festgesetzt.\n\nRechtsbehelfsbelehrung:\nDas Widerspruchsrecht steht jedem zu, der an der Unterlassung der Löschung ein berechtigtes Interesse hat. Der Widerspruch ist bei dem Amtsgericht Düsseldorf -Registergericht-, Werdener Straße 1, 40227 Düsseldorf schriftlich in deutscher Sprache oder zur Niederschrift der Geschäftsstelle einzulegen. Der Widerspruch kann auch zur Niederschrift der Geschäftsstelle eines jeden Amtsgerichtes abgegeben werden. Die Einlegung ist auch durch Übertragung eines elektronischen Dokuments an die elektronische Poststelle des Gerichts möglich. Das elektronische Dokument muss für die Bearbeitung durch das Gericht geeignet und mit einer qualifizierten elektronischen Signatur der verantwortenden Person versehen sein oder von der verantwortenden Person signiert und auf einem sicheren Übermittlungsweg gemäß § 130a ZPO nach näherer Maßgabe der Verordnung über die technischen Rahmenbedingungen des elektronischen Rechtsverkehrs und über das besondere elektronische Behördenpostfach (BGBl. I, S.3803) eingereicht werden. Weitere Informationen erhalten Sie auf der Internetseite www.justiz.de.\nDer Widerspruch muss spätestens innerhalb der gesetzten Frist nach dem Datum der Bekanntmachung der Löschungsankündigung bei dem Amtsgericht - Registergericht - Düsseldorf eingegangen sein.  Dies gilt auch dann, wenn der Widerspruch zur Niederschrift der Geschäftsstelle eines anderen Amtsgerichtes abgegeben wurde. Die Frist beginnt mit dem Tage der Bekanntmachung der Löschungsankündigung in dem für die Bekanntmachung der Eintragungen in das Handelsregister bestimmten elektronischen Informations- und Kommunikationssystem nach § 10 des Handelsgesetzbuches. Fällt das Ende der Frist auf einen Sonntag, einen allgemeinen Feiertag oder Sonnabend, so endet die Frist mit Ablauf des nächsten Werktages.\nDer Widerspruch muss die Bezeichnung der angefochtenen Löschungsankündigung sowie die Erklärung enthalten, dass Widerspruch gegen diese Löschungsankündigung eingelegt wird. Er ist zu unterzeichnen und soll begründet werden."
    },
    {
      "date": "2024-12-02",
      "id": "95156",
      "original_text": "Registerbekanntmachung nach dem Umwandlungsgesetz\nNordrhein-Westfalen Amtsgericht Neuss HRB 24283\nTransporter Center NRW GmbH – Meerbusch",
      "type": "Registerbekanntmachung nach dem Umwandlungsgesetz",
      "state": "Nordrhein-Westfalen",
      "amtsgericht": "Amtsgericht Neuss",
      "registernummer": "HRB 24283",
      "registerart": "HRB",
      "company_name": "Transporter Center NRW GmbH",
      "company_seat": "Meerbusch",
      "details": "02.12.2024 (Bekanntmachungsdatum)\n\nNordrhein-Westfalen Amtsgericht Neuss HRB 24283\nRegisterbekanntmachung nach dem Umwandlungsgesetz 02.12.2024 (Eintragungsdatum)\n\nTransporter Center NRW GmbH\nGesellschaft mit beschränkter Haftung\nMeerbusch\n\nDen Gläubigern der an der Ausgliederung beteiligten Rechtsträger ist, wenn sie binnen sechs Monaten nach dem Tag, an dem die Eintragung der Ausgliederung in das Register des Sitzes desjenigen Rechtsträgers, dessen Gläubiger sie sind, nach § 19 Absatz 3 UmwG als bekanntgemacht gilt, ihren Anspruch nach Grund und Höhe schriftlich anmelden, Sicherheit zu leisten, soweit sie nicht Befriedigung verlangen können. Dieses Recht steht den Gläubigern jedoch nur zu, wenn sie glaubhaft machen, dass durch die Ausgliederung die Erfüllung ihrer Forderung gefährdet wird."
    },
    {
      "date": "2024-12-02",
      "id": "95157",
      "original_text": "Sonstige Registerbekanntmachung\nNordrhein-Westfalen Amtsgericht Paderborn HRB 7780\nproactive AG – Lippstadt",
      "type": "Sonstige Registerbekanntmachung",
      "state": "Nordrhein-Westfalen",
      "amtsgericht": "Amtsgericht Paderborn",
      "registernummer": "HRB 7780",
      "registerart": "HRB",
      "company_name": "proactive AG",
      "company_seat": "Lippstadt",
      "details": "02.12.2024 (Bekanntmachungsdatum)\n\nNordrhein-Westfalen Amtsgericht Paderborn HRB 7780\nSonstige Registerbekanntmachung\n\nproactive AG\nAktiengesellschaft\nLippstadt\n\nDem Registergericht ist eine Liste der Mitglieder des Aufsichtsrates eingereicht worden."
    },
    {
      "date": "2024-12-02",
      "id": "95158",
      "original_text": "Löschungsankündigung\nNordrhein-Westfalen Amtsgericht Bochum HRB 18734\nG & M KFZ Technik UG (haftungsbeschränkt) – Bochum",
      "type": "Löschungsankündigung",
      "state": "Nordrhein-Westfalen",
      "amtsgericht": "Amtsgericht Bochum",
      "registernummer": "HRB 18734",
      "registerart": "HRB",
      "company_name": "G & M KFZ Technik UG (haftungsbeschränkt)",
      "company_seat": "Bochum",
      "details": "02.12.2024 (Bekanntmachungsdatum)\n\nNordrhein-Westfalen Amtsgericht Bochum HRB 18734\nLöschungsankündigung 03.12.2024 (Eintragungsdatum)\n\nG & M KFZ Technik UG (haftungsbeschränkt)\nGesellschaft mit beschränkter Haftung\nBochum\n\nDas Registergericht beabsichtigt die Gesellschaft von Amts wegen nach § 394 FamFG zu löschen. Die Frist zur Erhebung eines Widerspruchs ist auf drei Monate festgesetzt."
    },
    {
      "date": "2024-12-02",
      "id": "95159",
      "original_text": "Registerbekanntmachung nach dem Umwandlungsgesetz\nNordrhein-Westfalen Amtsgericht Iserlohn HRB 904\nDGD Kliniken Hemer gGmbH – Hemer",
      "type": "Registerbekanntmachung nach dem Umwandlungsgesetz",
      "state": "Nordrhein-Westfalen",
      "amtsgericht": "Amtsgericht Iserlohn",
      "registernummer": "HRB 904",
      "registerart": "HRB",
      "company_name": "DGD Kliniken Hemer gGmbH",
      "company_seat": "Hemer",
      "details": "02.12.2024 (Bekanntmachungsdatum)\n\nNordrhein-Westfalen Amtsgericht Iserlohn HRB 904\nRegisterbekanntmachung nach dem Umwandlungsgesetz 29.11.2024 (Eintragungsdatum)\n\nDGD Kliniken Hemer gGmbH\nGesellschaft mit beschränkter Haftung\nHemer\n\nDen Gläubigern der an der Ausgliederung beteiligten Rechtsträger ist, wenn sie binnen sechs Monaten nach dem Tag, an dem die Eintragung der Ausgliederung in das Register des Sitzes desjenigen Rechtsträgers, dessen Gläubiger sie sind, nach § 19 Absatz 3 UmwG als bekanntgemacht gilt, ihren Anspruch nach Grund und Höhe schriftlich anmelden, Sicherheit zu leisten, soweit sie nicht Befriedigung verlangen können. Dieses Recht steht den Gläubigern jedoch nur zu, wenn sie glaubhaft machen, dass durch die Ausgliederung die Erfüllung ihrer Forderung gefährdet wird."
    },
    {
      "date": "2024-12-02",
      "id": "95160",
      "original_text": "Registerbekanntmachung nach dem Umwandlungsgesetz\nNordrhein-Westfalen Amtsgericht Gelsenkirchen GnR 206\nBauverein Gelsenkirchen eG. – Gelsenkirchen",
      "type": "Registerbekanntmachung nach dem Umwandlungsgesetz",
      "state": "Nordrhein-Westfalen",
      "amtsgericht": "Amtsgericht Gelsenkirchen",
      "registernummer": "GnR 206",
      "registerart": "GnR",
      "company_name": "Bauverein Gelsenkirchen eG.",
      "company_seat": "Gelsenkirchen",
      "details": "02.12.2024 (Bekanntmachungsdatum)\n\nNordrhein-Westfalen Amtsgericht Gelsenkirchen GnR 206\nRegisterbekanntmachung nach dem Umwandlungsgesetz 02.12.2024 (Eintragungsdatum)\n\nBauverein Gelsenkirchen eG.\neingetragene Genossenschaft\nGelsenkirchen\n\nAls nicht eingetragen wird veröffentlicht: Den Gläubigern der Genossenschaft ist gemäß § 22 GenG, wenn sie sich binnen sechs Monaten nach der Bekanntmachung bei der Genossenschaft  zu diesem Zweck  melden, Sicherheit zu leisten, soweit sie nicht Befriedigung verlangen können."
    },
    {
      "date": "2024-12-02",
      "id": "95161",
      "original_text": "Einreichung neuer Dokumente\nNordrhein-Westfalen Amtsgericht Essen HRB 34423\nthyssenkrupp Decarbon Technologies GmbH – Essen",
      "type": "Einreichung neuer Dokumente",
      "state": "Nordrhein-Westfalen",
      "amtsgericht": "Amtsgericht Essen",
      "registernummer": "HRB 34423",
      "registerart": "HRB",
      "company_name": "thyssenkrupp Decarbon Technologies GmbH",
      "company_seat": "Essen",
      "details": "02.12.2024 (Bekanntmachungsdatum)\n\nNordrhein-Westfalen Amtsgericht Essen HRB 34423\nEinreichung neuer Dokumente\n\nthyssenkrupp Decarbon Technologies GmbH\nGesellschaft mit beschränkter Haftung\nEssen\n\nDem Registergericht ist eine neue Liste der Mitglieder des Aufsichtsrates eingereicht worden."
    },
    {
      "date": "2024-12-02",
      "id": "95162",
      "original_text": "Registerbekanntmachung nach dem Umwandlungsgesetz\nNordrhein-Westfalen Amtsgericht Hagen HRB 5416\nATZ Media Solutions GmbH – Herdecke",
      "type": "Registerbekanntmachung nach dem Umwandlungsgesetz",
      "state": "Nordrhein-Westfalen",
      "amtsgericht": "Amtsgericht Hagen",
      "registernummer": "HRB 5416",
      "registerart": "HRB",
      "company_name": "ATZ Media Solutions GmbH",
      "company_seat": "Herdecke",
      "details": "02.12.2024 (Bekanntmachungsdatum)\n\nNordrhein-Westfalen Amtsgericht Hagen HRB 5416\nRegisterbekanntmachung nach dem Umwandlungsgesetz 02.12.2024 (Eintragungsdatum)\n\nATZ Media Solutions GmbH\nGesellschaft mit beschränkter Haftung\nHerdecke\n\nDen Gläubigern des formwechselnden Rechtsträgers ist, wenn sie binnen sechs Monaten nach dem Tag, an dem die Eintragung des Formwechsels nach § 201 UmwG als bekannt gemacht gilt, ihren Anspruch nach Grund und Höhe schriftlich anmelden, Sicherheit zu leisten, soweit sie nicht Befriedigung verlangen können. Dieses Recht steht ihnen jedoch nur zu, wenn sie glaubhaft machen, dass durch den Formwechsel  die Erfüllung ihrer Forderung gefährdet wird."
    },
    {
      "date": "2024-12-02",
      "id": "95163",
      "original_text": "Löschungsankündigung\nNordrhein-Westfalen Amtsgericht Gelsenkirchen HRA 5177\nFork Innovationsbäckerei Bochum GmbH & Co. KG – Gelsenkirchen",
      "type": "Löschungsankündigung",
      "state": "Nordrhein-Westfalen",
      "amtsgericht": "Amtsgericht Gelsenkirchen",
      "registernummer": "HRA 5177",
      "registerart": "HRA",
      "company_name": "Fork Innovationsbäckerei Bochum GmbH & Co. KG",
      "company_seat": "Gelsenkirchen",
      "details": "02.12.2024 (Bekanntmachungsdatum)\n\nNordrhein-Westfalen Amtsgericht Gelsenkirchen HRA 5177\nLöschungsankündigung\n\nFork Innovationsbäckerei Bochum GmbH & Co. KG\nKommanditgesellschaft\nGelsenkirchen\n\nDas Registergericht beabsichtigt die Firma von Amts wegen nach § 394 FamFG zu löschen. Die Frist zur Erhebung eines Widerspruchs ist auf einen Monat festgesetzt."
    },
    {
      "date": "2024-12-02",
      "id": "95164",
      "original_text": "Löschungsankündigung\nNordrhein-Westfalen Amtsgericht Bochum HRB 18816\nND PaoPao UG (haftungsbeschränkt) – Bochum",
      "type": "Löschungsankündigung",
      "state": "Nordrhein-Westfalen",
      "amtsgericht": "Amtsgericht Bochum",
      "registernummer": "HRB 18816",
      "registerart": "HRB",
      "company_name": "ND PaoPao UG (haftungsbeschränkt)",
      "company_seat": "Bochum",
      "details": "02.12.2024 (Bekanntmachungsdatum)\n\nNordrhein-Westfalen Amtsgericht Bochum HRB 18816\nLöschungsankündigung 03.12.2024 (Eintragungsdatum)\n\nND PaoPao UG (haftungsbeschränkt)\nGesellschaft mit beschränkter Haftung\nBochum\n\nDas Registergericht beabsichtigt die Gesellschaft von Amts wegen nach § 394 FamFG zu löschen. Die Frist zur Erhebung eines Widerspruchs ist auf drei Monate festgesetzt."
    },
    {
      "date": "2024-12-02",
      "id": "95165",
      "original_text": "Registerbekanntmachung nach dem Umwandlungsgesetz\nNordrhein-Westfalen Amtsgericht Aachen HRA 10267\nMCS-Florian Kleb e.K. – Aachen",
      "type": "Registerbekanntmachung nach dem Umwandlungsgesetz",
      "state": "Nordrhein-Westfalen",
      "amtsgericht": "Amtsgericht Aachen",
      "registernummer": "HRA 10267",
      "registerart": "HRA",
      "company_name": "MCS-Florian Kleb e.K.",
      "company_seat": "Aachen",
      "details": "02.12.2024 (Bekanntmachungsdatum)\n\nNordrhein-Westfalen Amtsgericht Aachen HRA 10267\nRegisterbekanntmachung nach dem Umwandlungsgesetz 02.12.2024 (Eintragungsdatum)\n\nMCS-Florian Kleb e.K.\nEinzelkaufmann / Einzelkauffrau\nAachen\n\nDen Gläubigern der an der Ausgliederung beteiligten Rechtsträger ist, wenn sie binnen sechs Monaten nach dem Tag, an dem die Eintragung der Ausgliederung in das Register des Sitzes desjenigen Rechtsträgers, dessen Gläubiger sie sind, nach § 19 Absatz 3 UmwG als bekanntgemacht gilt, ihren Anspruch nach Grund und Höhe schriftlich anmelden, Sicherheit zu leisten, soweit sie nicht Befriedigung verlangen können. Dieses Recht steht den Gläubigern jedoch nur zu, wenn sie glaubhaft machen, dass durch die Ausgliederung die Erfüllung ihrer Forderung gefährdet wird."
    },
    {
      "date": "2024-12-02",
      "id": "95166",
      "original_text": "Sonstige Registerbekanntmachung\nNordrhein-Westfalen Amtsgericht Düsseldorf HRB 82306\nLucas International GmbH – Düsseldorf",
      "type": "Sonstige Registerbekanntmachung",
      "state": "Nordrhein-Westfalen",
      "amtsgericht": "Amtsgericht Düsseldorf",
      "registernummer": "HRB 82306",
      "registerart": "HRB",
      "company_name": "Lucas International GmbH",
      "company_seat": "Düsseldorf",
      "details": "02.12.2024 (Bekanntmachungsdatum)\n\nNordrhein-Westfalen Amtsgericht Düsseldorf HRB 82306\nSonstige Registerbekanntmachung 02.12.2024 (Eintragungsdatum)\n\nLucas International GmbH\nGesellschaft mit beschränkter Haftung\nDüsseldorf\n\nDie Gesellschaft ist aufgelöst. Von Amts wegen eingetragen."
    },
    {
      "date": "2024-12-02",
      "id": "95167",
      "original_text": "Einreichung neuer Dokumente\nNordrhein-Westfalen Amtsgericht Mönchengladbach HRB 22550\nSMS group GmbH – Mönchengladbach",
      "type": "Einreichung neuer Dokumente",
      "state": "Nordrhein-Westfalen",
      "amtsgericht": "Amtsgericht Mönchengladbach",
      "registernummer": "HRB 22550",
      "registerart": "HRB",
      "company_name": "SMS group GmbH",
      "company_seat": "Mönchengladbach",
      "details": "02.12.2024 (Bekanntmachungsdatum)\n\nNordrhein-Westfalen Amtsgericht Mönchengladbach HRB 22550\nEinreichung neuer Dokumente\n\nSMS group GmbH\nGesellschaft mit beschränkter Haftung\nMönchengladbach\n\nDem Registergericht ist eine neue Liste der Mitglieder des Aufsichtsrates eingereicht worden."
    },
    {
      "date": "2024-12-02",
      "id": "95168",
      "original_text": "Löschungsankündigung\nNordrhein-Westfalen Amtsgericht Köln HRB 90732\nGlas- und Gebäudereinigung Baudrie UG (haftungsbeschränkt) – Bergisch Gladbach",
      "type": "Löschungsankündigung",
      "state": "Nordrhein-Westfalen",
      "amtsgericht": "Amtsgericht Köln",
      "registernummer": "HRB 90732",
      "registerart": "HRB",
      "company_name": "Glas- und Gebäudereinigung Baudrie UG (haftungsbeschränkt)",
      "company_seat": "Bergisch Gladbach",
      "details": "02.12.2024 (Bekanntmachungsdatum)\n\nNordrhein-Westfalen Amtsgericht Köln HRB 90732\nLöschungsankündigung\n\nGlas- und Gebäudereinigung Baudrie UG (haftungsbeschränkt)\nGesellschaft mit beschränkter Haftung\nBergisch Gladbach\n\nDas Registergericht beabsichtigt die Gesellschaft von Amts wegen nach § 394 FamFG zu löschen. Die Frist zur Erhebung eines Widerspruchs ist auf einen Monat festgesetzt."
    },
    {
      "date": "2024-12-02",
      "id": "95169",
      "original_text": "Registerbekanntmachung nach dem Umwandlungsgesetz\nNordrhein-Westfalen Amtsgericht Köln HRB 119782\nSchlegel Immobilien GmbH – Leverkusen",
      "type": "Registerbekanntmachung nach dem Umwandlungsgesetz",
      "state": "Nordrhein-Westfalen",
      "amtsgericht": "Amtsgericht Köln",
      "registernummer": "HRB 119782",
      "registerart": "HRB",
      "company_name": "Schlegel Immobilien GmbH",
      "company_seat": "Leverkusen",
      "details": "02.12.2024 (Bekanntmachungsdatum)\n\nNordrhein-Westfalen Amtsgericht Köln HRB 119782\nRegisterbekanntmachung nach dem Umwandlungsgesetz 02.12.2024 (Eintragungsdatum)\n\nSchlegel Immobilien GmbH\nGesellschaft mit beschränkter Haftung\nLeverkusen\n\nDen Gläubigern der an der Ausgliederung beteiligten Rechtsträger ist, wenn sie binnen sechs Monaten nach dem Tag, an dem die Eintragung der Ausgliederung in das Register des Sitzes desjenigen Rechtsträgers, dessen Gläubiger sie sind, nach § 19 Absatz 3 UmwG als bekanntgemacht gilt, ihren Anspruch nach Grund und Höhe schriftlich anmelden, Sicherheit zu leisten, soweit sie nicht Befriedigung verlangen können. Dieses Recht steht den Gläubigern jedoch nur zu, wenn sie glaubhaft machen, dass durch die Ausgliederung die Erfüllung ihrer Forderung gefährdet wird."
    },
    {
      "date": "2024-12-02",
      "id": "95170",
      "original_text": "Löschungsankündigung\nNordrhein-Westfalen Amtsgericht Hamm HRB 8926\nPUBLICOM Gesellschaft für Öffentlichkeitsarbeit mbH – Hamm",
      "type": "Löschungsankündigung",
      "state": "Nordrhein-Westfalen",
      "amtsgericht": "Amtsgericht Hamm",
      "registernummer": "HRB 8926",
      "registerart": "HRB",
      "company_name": "PUBLICOM Gesellschaft für Öffentlichkeitsarbeit mbH",
      "company_seat": "Hamm",
      "details": "02.12.2024 (Bekanntmachungsdatum)\n\nNordrhein-Westfalen Amtsgericht Hamm HRB 8926\nLöschungsankündigung\n\nPUBLICOM Gesellschaft für Öffentlichkeitsarbeit mbH\nGesellschaft mit beschränkter Haftung\nHamm\n\nDas Registergericht beabsichtigt die Gesellschaft von Amts wegen nach § 394 FamFG zu löschen. Die Frist zur Erhebung eines Widerspruchs ist auf drei Monate festgesetzt."
    },
    {
      "date": "2024-12-02",
      "id": "95171",
      "original_text": "Sonstige Registerbekanntmachung\nNordrhein-Westfalen Amtsgericht Aachen HRB 9424\nEGG Entwicklungsgesellschaft Gangelt GmbH – Gangelt",
      "type": "Sonstige Registerbekanntmachung",
      "state": "Nordrhein-Westfalen",
      "amtsgericht": "Amtsgericht Aachen",
      "registernummer": "HRB 9424",
      "registerart": "HRB",
      "company_name": "EGG Entwicklungsgesellschaft Gangelt GmbH",
      "company_seat": "Gangelt",
      "details": "02.12.2024 (Bekanntmachungsdatum)\n\nNordrhein-Westfalen Amtsgericht Aachen HRB 9424\nSonstige Registerbekanntmachung\n\nEGG Entwicklungsgesellschaft Gangelt GmbH\nGesellschaft mit beschränkter Haftung\nGangelt\n\nDem Registergericht ist eine neue Liste der Mitglieder des Aufsichtsrates eingereicht worden."
    },
    {
      "date": "2024-12-02",
      "id": "95172",
      "original_text": "Registerbekanntmachung nach dem Umwandlungsgesetz\nNordrhein-Westfalen Amtsgericht Köln HRB 119782\nSchlegel Immobilien GmbH – Leverkusen",
      "type": "Registerbekanntmachung nach dem Umwandlungsgesetz",
      "state": "Nordrhein-Westfalen",
      "amtsgericht": "Amtsgericht Köln",
      "registernummer": "HRB 119782",
      "registerart": "HRB",
      "company_name": "Schlegel Immobilien GmbH",
      "company_seat": "Leverkusen",
      "details": "02.12.2024 (Bekanntmachungsdatum)\n\nNordrhein-Westfalen Amtsgericht Köln HRB 119782\nRegisterbekanntmachung nach dem Umwandlungsgesetz 02.12.2024 (Eintragungsdatum)\n\nSchlegel Immobilien GmbH\nGesellschaft mit beschränkter Haftung\nLeverkusen\n\nDen Gläubigern der an der Ausgliederung beteiligten Rechtsträger ist, wenn sie binnen sechs Monaten nach dem Tag, an dem die Eintragung der Ausgliederung in das Register des Sitzes desjenigen Rechtsträgers, dessen Gläubiger sie sind, nach § 19 Absatz 3 UmwG als bekanntgemacht gilt, ihren Anspruch nach Grund und Höhe schriftlich anmelden, Sicherheit zu leisten, soweit sie nicht Befriedigung verlangen können. Dieses Recht steht den Gläubigern jedoch nur zu, wenn sie glaubhaft machen, dass durch die Ausgliederung die Erfüllung ihrer Forderung gefährdet wird."
    },
    {
      "date": "2024-12-02",
      "id": "95173",
      "original_text": "Registerbekanntmachung nach dem Umwandlungsgesetz\nNordrhein-Westfalen Amtsgericht Neuss HRB 4845\nNISSIN TRANSPORT GmbH – Neuss",
      "type": "Registerbekanntmachung nach dem Umwandlungsgesetz",
      "state": "Nordrhein-Westfalen",
      "amtsgericht": "Amtsgericht Neuss",
      "registernummer": "HRB 4845",
      "registerart": "HRB",
      "company_name": "NISSIN TRANSPORT GmbH",
      "company_seat": "Neuss",
      "details": "02.12.2024 (Bekanntmachungsdatum)\n\nNordrhein-Westfalen Amtsgericht Neuss HRB 4845\nRegisterbekanntmachung nach dem Umwandlungsgesetz 02.12.2024 (Eintragungsdatum)\n\nNISSIN TRANSPORT GmbH\nGesellschaft mit beschränkter Haftung\nNeuss\n\nDem Registergericht ist nach § 308 Abs. 1 S. 1 UmwG der Entwurf des Verschmelzungsplans über die grenzüberschreitende Verschmelzung der NISSIN BELGIUM NV, einer nach dem Recht von Belgien gegründeten Aktiengesellschaft (naamloze vennootschap) mit Sitz in Bedrijvenzone Machelen, Cargo 738 PO Box 2, 1830 Machelen, Belgien, eingetragen in der Zentralen Datenbank der Unternehmen unter der Nummer 0460.457.713, als übertragendem Rechtsträger und der NISSIN\nTRANSPORT GmbH, einer nach deutschem Recht gegründeten Gesellschaft\nmit beschränkter Haftung mit Sitz in Neuss, Deutschland, eingetragen im Handelsregister des Amtsgerichts Neuss unter HRB 4845, als übernehmendem\nRechtsträger eingereicht worden.\n\nDie Anteilsinhaber und Gläubiger der an der grenzüberschreitenden Verschmelzung beteiligten Gesellschaften und der Betriebsrat und die Arbeitnehmer der übernehmenden Gesellschaft sowie die Arbeitnehmer der übertragenden Gesellschaft  werden darauf hingewiesen, dass sie der jeweiligen Gesellschaft\nspätestens fünf Arbeitstage vor dem Tag der Beurkundung der Zustimmung der Anteilsinhaber der Gesellschaft zum Verschmelzungsplan (§ 308 Abs. 1 S. 4 UmwG) Bemerkungen zum Verschmelzungsplan übermitteln können. Der Termin für die Beurkundung der Zustimmung der Anteilsinhaber steht gegenwärtig noch nicht fest, wird aber nicht vor dem 13. Februar 2025 stattfinden."
    },
    {
      "date": "2024-12-02",
      "id": "95174",
      "original_text": "Sonstige Registerbekanntmachung\nNordrhein-Westfalen Amtsgericht Düsseldorf HRB 94966\nM.E Sicherheitsdienst UG (haftungsbeschränkt) – Monheim am Rhein",
      "type": "Sonstige Registerbekanntmachung",
      "state": "Nordrhein-Westfalen",
      "amtsgericht": "Amtsgericht Düsseldorf",
      "registernummer": "HRB 94966",
      "registerart": "HRB",
      "company_name": "M.E Sicherheitsdienst UG (haftungsbeschränkt)",
      "company_seat": "Monheim am Rhein",
      "details": "02.12.2024 (Bekanntmachungsdatum)\n\nNordrhein-Westfalen Amtsgericht Düsseldorf HRB 94966\nSonstige Registerbekanntmachung 02.12.2024 (Eintragungsdatum)\n\nM.E Sicherheitsdienst UG (haftungsbeschränkt)\nGesellschaft mit beschränkter Haftung\nMonheim am Rhein\n\nDie Gesellschaft ist aufgelöst. Von Amts wegen eingetragen."
    },
    {
      "date": "2024-12-02",
      "id": "95175",
      "original_text": "Löschungsankündigung\nHessen Amtsgericht Wiesbaden HRB 26539\nHaustechnik-Werner GmbH – Hochheim am Main",
      "type": "Löschungsankündigung",
      "state": "Hessen",
      "amtsgericht": "Amtsgericht Wiesbaden",
      "registernummer": "HRB 26539",
      "registerart": "HRB",
      "company_name": "Haustechnik-Werner GmbH",
      "company_seat": "Hochheim am Main",
      "details": "02.12.2024 (Bekanntmachungsdatum)\n\nHessen Amtsgericht Wiesbaden HRB 26539\nLöschungsankündigung\n\nHaustechnik-Werner GmbH\nGesellschaft mit beschränkter Haftung\nHochheim am Main\n\nDas Registergericht beabsichtigt die im Handelsregister eingetragene Gesellschaft von Amts wegen nach § 394 FamFG zu löschen. Die Frist zur Erhebung eines Widerspruchs gegen die beabsichtigte Löschung wird auf 3 Monate festgesetzt."
    },
    {
      "date": "2024-12-02",
      "id": "95176",
      "original_text": "Registerbekanntmachung nach dem Umwandlungsgesetz\nHessen Amtsgericht Wetzlar HRB 4344\nRittal Beteiligungs GmbH – Herborn",
      "type": "Registerbekanntmachung nach dem Umwandlungsgesetz",
      "state": "Hessen",
      "amtsgericht": "Amtsgericht Wetzlar",
      "registernummer": "HRB 4344",
      "registerart": "HRB",
      "company_name": "Rittal Beteiligungs GmbH",
      "company_seat": "Herborn",
      "details": "02.12.2024 (Bekanntmachungsdatum)\n\nHessen Amtsgericht Wetzlar HRB 4344\nRegisterbekanntmachung nach dem Umwandlungsgesetz 02.12.2024 (Eintragungsdatum)\n\nRittal Beteiligungs GmbH\nGesellschaft mit beschränkter Haftung\nHerborn\n\nDen Gläubigern der an der grenzüberschreitenden Verschmelzung beteiligten übernehmenden Rechtsträger ist, wenn sie binnen sechs Monaten nach dem Tag, an dem die Eintragung der Verschmelzung in das Register des Sitzes desjenigen Rechtsträgers, dessen Gläubiger sie sind, nach § 19 Absatz 3 UmwG als bekanntgemacht gilt, ihren Anspruch nach Grund und Höhe schriftlich anmelden, Sicherheit zu leisten, soweit sie nicht Befriedigung verlangen können.\n\nDieses Recht steht den Gläubigern jedoch nur zu, wenn sie glaubhaft machen, dass durch die Verschmelzung die Erfüllung ihrer Forderung gefährdet wird."
    },
    {
      "date": "2024-12-02",
      "id": "95177",
      "original_text": "Registerbekanntmachung nach dem Umwandlungsgesetz\nHessen Amtsgericht Marburg HRB 3861\nViessmann Holding International GmbH – Allendorf (Eder)",
      "type": "Registerbekanntmachung nach dem Umwandlungsgesetz",
      "state": "Hessen",
      "amtsgericht": "Amtsgericht Marburg",
      "registernummer": "HRB 3861",
      "registerart": "HRB",
      "company_name": "Viessmann Holding International GmbH",
      "company_seat": "Allendorf (Eder)",
      "details": "02.12.2024 (Bekanntmachungsdatum)\n\nHessen Amtsgericht Marburg HRB 3861\nRegisterbekanntmachung nach dem Umwandlungsgesetz 02.12.2024 (Eintragungsdatum)\n\nViessmann Holding International GmbH\nGesellschaft mit beschränkter Haftung\nAllendorf (Eder)\n\nDen Gläubigern der an der Ausgliederung beteiligten Rechtsträger ist, wenn sie binnen sechs Monaten nach dem Tag, an dem die Eintragung der Ausgliederung in das Register des Sitzes desjenigen Rechtsträgers, dessen Gläubiger sie sind, nach §§ 125, 19 Absatz 3 UmwG bekannt gemacht worden ist, ihren Anspruch nach Grund und Höhe schriftlich anmelden, Sicherheit zu leisten, soweit sie nicht Befriedigung verlangen können. Dieses Recht steht den Gläubigern jedoch nur zu, wenn sie glaubhaft machen, dass durch die Ausgliederung die Erfüllung ihrer Forderung gefährdet wird."
    },
    {
      "date": "2024-12-02",
      "id": "95178",
      "original_text": "Einreichung neuer Dokumente\nHessen Amtsgericht Darmstadt HRB 93089\nb.lution AG – Reinheim",
      "type": "Einreichung neuer Dokumente",
      "state": "Hessen",
      "amtsgericht": "Amtsgericht Darmstadt",
      "registernummer": "HRB 93089",
      "registerart": "HRB",
      "company_name": "b.lution AG",
      "company_seat": "Reinheim",
      "details": "02.12.2024 (Bekanntmachungsdatum)\n\nHessen Amtsgericht Darmstadt HRB 93089\nEinreichung neuer Dokumente\n\nb.lution AG\nAktiengesellschaft\nReinheim\n\nDurch eine Änderung in den Personen der Aufsichtsratsmitglieder ist eine Liste der Mitglieder des Aufsichtsrates zum Handelsregister eingereicht worden."
    },
    {
      "date": "2024-12-02",
      "id": "95179",
      "original_text": "Sonstige Registerbekanntmachung\nHessen Amtsgericht Frankfurt am Main HRB 86734\nNTG Air & Ocean GmbH – Frankfurt am Main",
      "type": "Sonstige Registerbekanntmachung",
      "state": "Hessen",
      "amtsgericht": "Amtsgericht Frankfurt am Main",
      "registernummer": "HRB 86734",
      "registerart": "HRB",
      "company_name": "NTG Air & Ocean GmbH",
      "company_seat": "Frankfurt am Main",
      "details": "02.12.2024 (Bekanntmachungsdatum)\n\nHessen Amtsgericht Frankfurt am Main HRB 86734\nSonstige Registerbekanntmachung\n\nNTG Air & Ocean GmbH\nGesellschaft mit beschränkter Haftung\nFrankfurt am Main\n\nDurch eine Änderung in den Personen der Aufsichtsratsmitglieder ist eine Liste der Mitglieder des Aufsichtsrates zum Handelsregister eingereicht worden."
    },
    {
      "date": "2024-12-02",
      "id": "95180",
      "original_text": "Registerbekanntmachung nach dem Umwandlungsgesetz\nHessen Amtsgericht Korbach HRB 2598\nBolzcourt GmbH – Korbach",
      "type": "Registerbekanntmachung nach dem Umwandlungsgesetz",
      "state": "Hessen",
      "amtsgericht": "Amtsgericht Korbach",
      "registernummer": "HRB 2598",
      "registerart": "HRB",
      "company_name": "Bolzcourt GmbH",
      "company_seat": "Korbach",
      "details": "02.12.2024 (Bekanntmachungsdatum)\n\nHessen Amtsgericht Korbach HRB 2598\nRegisterbekanntmachung nach dem Umwandlungsgesetz 02.12.2024 (Eintragungsdatum)\n\nBolzcourt GmbH\nGesellschaft mit beschränkter Haftung\nKorbach\n\nDen Gläubigern der an der Ausgliederung beteiligten Rechtsträger ist, wenn sie binnen sechs Monaten nach dem Tag, an dem die Eintragung der Ausgliederung in das Register des Sitzes derjenigen Rechtsträger deren Gläubiger sie sind, nach §§ 125, 19 Absatz 3 UmwG bekannt gemacht worden ist, ihren Anspruch nach Grund und Höhe schriftlich anmelden, Sicherheit zu leisten, soweit sie nicht Befriedigung verlangen können. Dieses Recht steht den Gläubigern jedoch nur zu, wenn sie glaubhaft machen, dass durch die Ausgliederung die Erfüllung ihrer Forderung gefährdet wird."
    },
    {
      "date": "2024-12-02",
      "id": "95181",
      "original_text": "Registerbekanntmachung nach dem Umwandlungsgesetz\nHessen Amtsgericht Frankfurt am Main HRB 74146\nDeufol Frankfurt GmbH – Frankfurt am Main (Flughafen)",
      "type": "Registerbekanntmachung nach dem Umwandlungsgesetz",
      "state": "Hessen",
      "amtsgericht": "Amtsgericht Frankfurt am Main",
      "registernummer": "HRB 74146",
      "registerart": "HRB",
      "company_name": "Deufol Frankfurt GmbH",
      "company_seat": "Frankfurt am Main (Flughafen)",
      "details": "02.12.2024 (Bekanntmachungsdatum)\n\nHessen Amtsgericht Frankfurt am Main HRB 74146\nRegisterbekanntmachung nach dem Umwandlungsgesetz 02.12.2024 (Eintragungsdatum)\n\nDeufol Frankfurt GmbH\nGesellschaft mit beschränkter Haftung\nFrankfurt am Main (Flughafen)\n\nDen Gläubigern der an der Verschmelzung beteiligten Rechtsträger ist, wenn sie binnen sechs Monaten nach dem Tag, an dem die Eintragung der Verschmelzung in das Register des Sitzes derjenigen Rechtsträger deren Gläubiger sie sind, nach § 19 Absatz 3 UmwG bekannt gemacht worden ist, ihren Anspruch nach Grund und Höhe schriftlich anmelden, Sicherheit zu leisten, soweit sie nicht Befriedigung verlangen können. Dieses Recht steht den Gläubigern jedoch nur zu, wenn sie glaubhaft machen, dass durch die Verschmelzung die Erfüllung ihrer Forderung gefährdet wird."
    },
    {
      "date": "2024-12-02",
      "id": "95182",
      "original_text": "Registerbekanntmachung nach dem Umwandlungsgesetz\nHessen Amtsgericht Hanau HRA 92846\nBVV-GmbH & Co. KG – Hanau",
      "type": "Registerbekanntmachung nach dem Umwandlungsgesetz",
      "state": "Hessen",
      "amtsgericht": "Amtsgericht Hanau",
      "registernummer": "HRA 92846",
      "registerart": "HRA",
      "company_name": "BVV-GmbH & Co. KG",
      "company_seat": "Hanau",
      "details": "02.12.2024 (Bekanntmachungsdatum)\n\nHessen Amtsgericht Hanau HRA 92846\nRegisterbekanntmachung nach dem Umwandlungsgesetz 02.12.2024 (Eintragungsdatum)\n\nBVV-GmbH & Co. KG\nKommanditgesellschaft\nHanau\n\nDen Gläubigern der an der formwechselnden Umwandlung beteiligten Rechtsträger ist, wenn sie binnen sechs Monaten nach dem Tag, an dem die Eintragung der formwechselnden Umwandlung in das Register des Sitzes desjenigen Rechtsträgers, dessen Gläubiger sie sind, nach § 201 UmwG bekannt gemacht worden ist, ihren Anspruch nach Grund und Höhe schriftlich anmelden, Sicherheit zu leisten, soweit sie nicht Befriedigung verlangen können. Dieses Recht steht den Gläubigern jedoch nur zu, wenn sie glaubhaft machen, dass durch die formwechselnden Umwandlung die Erfüllung ihrer Forderung gefährdet wird."
    },
    {
      "date": "2024-12-02",
      "id": "95183",
      "original_text": "Registerbekanntmachung nach dem Umwandlungsgesetz\nHessen Amtsgericht Fritzlar HRA 16599\nJung Besitz- und Verwaltungs GmbH & Co. KG – Melsungen",
      "type": "Registerbekanntmachung nach dem Umwandlungsgesetz",
      "state": "Hessen",
      "amtsgericht": "Amtsgericht Fritzlar",
      "registernummer": "HRA 16599",
      "registerart": "HRA",
      "company_name": "Jung Besitz- und Verwaltungs GmbH & Co. KG",
      "company_seat": "Melsungen",
      "details": "02.12.2024 (Bekanntmachungsdatum)\n\nHessen Amtsgericht Fritzlar HRA 16599\nRegisterbekanntmachung nach dem Umwandlungsgesetz 02.12.2024 (Eintragungsdatum)\n\nJung Besitz- und Verwaltungs GmbH & Co. KG\nKommanditgesellschaft\nMelsungen\n\nDen Gläubigern der an der Ausgliederung beteiligten Rechtsträger ist, wenn sie binnen sechs Monaten nach dem Tag, an dem die Eintragung der Ausgliederung in das Register des Sitzes desjenigen Rechtsträgers, dessen Gläubiger sie sind, nach § 19 Absatz 3 UmwG bekannt gemacht worden ist, ihren Anspruch nach Grund und Höhe schriftlich anmelden, Sicherheit zu leisten, soweit sie nicht Befriedigung verlangen können. Dieses Recht steht den Gläubigern jedoch nur zu, wenn sie glaubhaft machen, dass durch die Ausgliederung die Erfüllung ihrer Forderung gefährdet wird."
    },
    {
      "date": "2024-12-02",
      "id": "95184",
      "original_text": "Löschungsankündigung\nHessen Amtsgericht Frankfurt am Main HRB 120719\nSCUDERIA SAFETY GmbH – Eschborn",
      "type": "Löschungsankündigung",
      "state": "Hessen",
      "amtsgericht": "Amtsgericht Frankfurt am Main",
      "registernummer": "HRB 120719",
      "registerart": "HRB",
      "company_name": "SCUDERIA SAFETY GmbH",
      "company_seat": "Eschborn",
      "details": "02.12.2024 (Bekanntmachungsdatum)\n\nHessen Amtsgericht Frankfurt am Main HRB 120719\nLöschungsankündigung\n\nSCUDERIA SAFETY GmbH\nGesellschaft mit beschränkter Haftung\nEschborn\n\nDas Registergericht beabsichtigt die im Handelsregister eingetragene Gesellschaft von Amts wegen nach § 394 FamFG zu löschen. Die Frist zur Erhebung eines Widerspruchs gegen die beabsichtigte Löschung wird auf 1 Monat festgesetzt."
    },
    {
      "date": "2024-12-02",
      "id": "95185",
      "original_text": "Registerbekanntmachung nach dem Umwandlungsgesetz\nHessen Amtsgericht Gießen HRB 8332\nELSTA-Mosdorfer Deutschland GmbH – Lich",
      "type": "Registerbekanntmachung nach dem Umwandlungsgesetz",
      "state": "Hessen",
      "amtsgericht": "Amtsgericht Gießen",
      "registernummer": "HRB 8332",
      "registerart": "HRB",
      "company_name": "ELSTA-Mosdorfer Deutschland GmbH",
      "company_seat": "Lich",
      "details": "02.12.2024 (Bekanntmachungsdatum)\n\nHessen Amtsgericht Gießen HRB 8332\nRegisterbekanntmachung nach dem Umwandlungsgesetz 02.12.2024 (Eintragungsdatum)\n\nELSTA-Mosdorfer Deutschland GmbH\nGesellschaft mit beschränkter Haftung\nLich\n\nDen Gläubigern der an der Verschmelzung beteiligten Rechtsträger ist, wenn sie binnen sechs Monaten nach dem Tag, an dem die Eintragung der Verschmelzung in das Register des Sitzes desjenigen Rechtsträgers, dessen Gläubiger sie sind, nach § 19 Absatz 3 UmwG bekannt gemacht worden ist, ihren Anspruch nach Grund und Höhe schriftlich anmelden, Sicherheit zu leisten, soweit sie nicht Befriedigung verlangen können. Dieses Recht steht den Gläubigern jedoch nur zu, wenn sie glaubhaft machen, dass durch die Verschmelzung die Erfüllung ihrer Forderung gefährdet wird."
    },
    {
      "date": "2024-12-02",
      "id": "95186",
      "original_text": "Löschungsankündigung\nHessen Amtsgericht Frankfurt am Main HRB 112173\nEspe GmbH – Eschborn",
      "type": "Löschungsankündigung",
      "state": "Hessen",
      "amtsgericht": "Amtsgericht Frankfurt am Main",
      "registernummer": "HRB 112173",
      "registerart": "HRB",
      "company_name": "Espe GmbH",
      "company_seat": "Eschborn",
      "details": "02.12.2024 (Bekanntmachungsdatum)\n\nHessen Amtsgericht Frankfurt am Main HRB 112173\nLöschungsankündigung\n\nEspe GmbH\nGesellschaft mit beschränkter Haftung\nEschborn\n\nDas Registergericht hat das am 06.09.2024 eingeleitete Amtslöschungsverfahren nach § 394 FamFG aufgehoben, da der Antrag am 26.09.2024 zurück genommen wurde."
    },
    {
      "date": "2024-12-02",
      "id": "95187",
      "original_text": "Registerbekanntmachung nach dem Umwandlungsgesetz\nHessen Amtsgericht Korbach HRA 1890\nBolzcourt Korbach e.K Inh. Christian Metz-Pieper – Korbach",
      "type": "Registerbekanntmachung nach dem Umwandlungsgesetz",
      "state": "Hessen",
      "amtsgericht": "Amtsgericht Korbach",
      "registernummer": "HRA 1890",
      "registerart": "HRA",
      "company_name": "Bolzcourt Korbach e.K Inh. Christian Metz-Pieper",
      "company_seat": "Korbach",
      "details": "02.12.2024 (Bekanntmachungsdatum)\n\nHessen Amtsgericht Korbach HRA 1890\nRegisterbekanntmachung nach dem Umwandlungsgesetz 02.12.2024 (Eintragungsdatum)\n\nBolzcourt Korbach e.K Inh. Christian Metz-Pieper\nEinzelkaufmann / Einzelkauffrau\nKorbach\n\nDen Gläubigern der an der Ausgliederung beteiligten Rechtsträger ist, wenn sie binnen sechs Monaten nach dem Tag, an dem die Eintragung der Ausgliederung in das Register des Sitzes derjenigen Rechtsträger deren Gläubiger sie sind, nach §§ 125, 19 Absatz 3 UmwG bekannt gemacht worden ist, ihren Anspruch nach Grund und Höhe schriftlich anmelden, Sicherheit zu leisten, soweit sie nicht Befriedigung verlangen können. Dieses Recht steht den Gläubigern jedoch nur zu, wenn sie glaubhaft machen, dass durch die Ausgliederung die Erfüllung ihrer Forderung gefährdet wird."
    },
    {
      "date": "2024-12-02",
      "id": "95188",
      "original_text": "Einreichung neuer Dokumente\nHessen Amtsgericht Frankfurt am Main HRB 71427\nContiTech Techno-Chemie GmbH – Karben",
      "type": "Einreichung neuer Dokumente",
      "state": "Hessen",
      "amtsgericht": "Amtsgericht Frankfurt am Main",
      "registernummer": "HRB 71427",
      "registerart": "HRB",
      "company_name": "ContiTech Techno-Chemie GmbH",
      "company_seat": "Karben",
      "details": "02.12.2024 (Bekanntmachungsdatum)\n\nHessen Amtsgericht Frankfurt am Main HRB 71427\nEinreichung neuer Dokumente\n\nContiTech Techno-Chemie GmbH\nGesellschaft mit beschränkter Haftung\nKarben\n\nDurch eine Änderung in den Personen der Aufsichtsratsmitglieder ist eine Liste der Mitglieder des Aufsichtsrates zum Handelsregister eingereicht worden."
    },
    {
      "date": "2024-12-02",
      "id": "95189",
      "original_text": "Einreichung neuer Dokumente\nHessen Amtsgericht Frankfurt am Main HRB 103658\nCONREN Land Immobilien Kapitalverwaltungsgesellschaft mbH – Frankfurt am Main",
      "type": "Einreichung neuer Dokumente",
      "state": "Hessen",
      "amtsgericht": "Amtsgericht Frankfurt am Main",
      "registernummer": "HRB 103658",
      "registerart": "HRB",
      "company_name": "CONREN Land Immobilien Kapitalverwaltungsgesellschaft mbH",
      "company_seat": "Frankfurt am Main",
      "details": "02.12.2024 (Bekanntmachungsdatum)\n\nHessen Amtsgericht Frankfurt am Main HRB 103658\nEinreichung neuer Dokumente\n\nCONREN Land Immobilien Kapitalverwaltungsgesellschaft mbH\nGesellschaft mit beschränkter Haftung\nFrankfurt am Main\n\nDurch eine Änderung in den Personen der Aufsichtsratsmitglieder ist eine Liste der Mitglieder des Aufsichtsrates zum Handelsregister eingereicht worden."
    },
    {
      "date": "2024-12-02",
      "id": "95190",
      "original_text": "Registerbekanntmachung nach dem Umwandlungsgesetz\nHessen Amtsgericht Marburg HRB 7562\nViessmann Climate Solutions SE – Allendorf (Eder)",
      "type": "Registerbekanntmachung nach dem Umwandlungsgesetz",
      "state": "Hessen",
      "amtsgericht": "Amtsgericht Marburg",
      "registernummer": "HRB 7562",
      "registerart": "HRB",
      "company_name": "Viessmann Climate Solutions SE",
      "company_seat": "Allendorf (Eder)",
      "details": "02.12.2024 (Bekanntmachungsdatum)\n\nHessen Amtsgericht Marburg HRB 7562\nRegisterbekanntmachung nach dem Umwandlungsgesetz 02.12.2024 (Eintragungsdatum)\n\nViessmann Climate Solutions SE\nEuropäische Aktiengesellschaft (SE)\nAllendorf (Eder)\n\nDen Gläubigern der an der Ausgliederung beteiligten Rechtsträger ist, wenn sie binnen sechs Monaten nach dem Tag, an dem die Eintragung der Ausgliederung in das Register des Sitzes desjenigen Rechtsträgers, dessen Gläubiger sie sind, nach §§ 125, 19 Absatz 3 UmwG bekannt gemacht worden ist, ihren Anspruch nach Grund und Höhe schriftlich anmelden, Sicherheit zu leisten, soweit sie nicht Befriedigung verlangen können. Dieses Recht steht den Gläubigern jedoch nur zu, wenn sie glaubhaft machen, dass durch die Ausgliederung die Erfüllung ihrer Forderung gefährdet wird."
    },
    {
      "date": "2024-12-02",
      "id": "95191",
      "original_text": "Registerbekanntmachung nach dem Umwandlungsgesetz\nHessen Amtsgericht Hanau HRB 100222\nBVV GmbH – Hanau",
      "type": "Registerbekanntmachung nach dem Umwandlungsgesetz",
      "state": "Hessen",
      "amtsgericht": "Amtsgericht Hanau",
      "registernummer": "HRB 100222",
      "registerart": "HRB",
      "company_name": "BVV GmbH",
      "company_seat": "Hanau",
      "details": "02.12.2024 (Bekanntmachungsdatum)\n\nHessen Amtsgericht Hanau HRB 100222\nRegisterbekanntmachung nach dem Umwandlungsgesetz 02.12.2024 (Eintragungsdatum)\n\nBVV GmbH\nGesellschaft mit beschränkter Haftung\nHanau\n\nDen Gläubigern der an der formwechselnden Umwandlung beteiligten Rechtsträger ist, wenn sie binnen sechs Monaten nach dem Tag, an dem die Eintragung der formwechselnden Umwandlung in das Register des Sitzes desjenigen Rechtsträgers, dessen Gläubiger sie sind, nach § 201 UmwG bekannt gemacht worden ist, ihren Anspruch nach Grund und Höhe schriftlich anmelden, Sicherheit zu leisten, soweit sie nicht Befriedigung verlangen können. Dieses Recht steht den Gläubigern jedoch nur zu, wenn sie glaubhaft machen, dass durch die formwechselnden Umwandlung die Erfüllung ihrer Forderung gefährdet wird."
    },
    {
      "date": "2024-12-02",
      "id": "95192",
      "original_text": "Sonstige Registerbekanntmachung\nHessen Amtsgericht Wiesbaden VR 7484\nInitiative Mentale Gesundheit Geflüchteter e. V. – Wiesbaden",
      "type": "Sonstige Registerbekanntmachung",
      "state": "Hessen",
      "amtsgericht": "Amtsgericht Wiesbaden",
      "registernummer": "VR 7484",
      "registerart": "VR",
      "company_name": "Initiative Mentale Gesundheit Geflüchteter e. V.",
      "company_seat": "Wiesbaden",
      "details": "02.12.2024 (Bekanntmachungsdatum)\n\nHessen Amtsgericht Wiesbaden VR 7484\nSonstige Registerbekanntmachung 02.12.2024 (Eintragungsdatum)\n\nInitiative Mentale Gesundheit Geflüchteter e. V.\neingetragener Verein\nWiesbaden\n\nDer Verein ist aufgelöst."
    },
    {
      "date": "2024-12-02",
      "id": "95193",
      "original_text": "Löschungsankündigung\nHessen Amtsgericht Frankfurt am Main HRB 108794\nWolke Transport GmbH – Frankfurt am Main",
      "type": "Löschungsankündigung",
      "state": "Hessen",
      "amtsgericht": "Amtsgericht Frankfurt am Main",
      "registernummer": "HRB 108794",
      "registerart": "HRB",
      "company_name": "Wolke Transport GmbH",
      "company_seat": "Frankfurt am Main",
      "details": "02.12.2024 (Bekanntmachungsdatum)\n\nHessen Amtsgericht Frankfurt am Main HRB 108794\nLöschungsankündigung\n\nWolke Transport GmbH\nGesellschaft mit beschränkter Haftung\nFrankfurt am Main\n\nDas Registergericht beabsichtigt die im Handelsregister eingetragene Gesellschaft von Amts wegen nach § 394 FamFG zu löschen. Die Frist zur Erhebung eines Widerspruchs gegen die beabsichtigte Löschung wird auf 1 Monat festgesetzt."
    }
  ]
}