{
  "date": "2024-12-14",
  "date_of_scrape": "2024-12-15T04:02:47.301Z",
  "tool_version": "0.2.0",
  "number_of_announcements": 17,
  "announcements": [
    {
      "date": "2024-12-14",
      "id": "96457",
      "original_text": "Registerbekanntmachung nach dem Umwandlungsgesetz\nBayern Amtsgericht Ansbach HRB 8588\nPhysio-Point Pachl GmbH – Schillingsfürst",
      "type": "Registerbekanntmachung nach dem Umwandlungsgesetz",
      "state": "Bayern",
      "amtsgericht": "Amtsgericht Ansbach",
      "registernummer": "HRB 8588",
      "registerart": "HRB",
      "company_name": "Physio-Point Pachl GmbH",
      "company_seat": "Schillingsfürst",
      "details": "14.12.2024 (Bekanntmachungsdatum)\n\nBayern Amtsgericht Ansbach HRB 8588\nRegisterbekanntmachung nach dem Umwandlungsgesetz 13.12.2024 (Eintragungsdatum)\n\nPhysio-Point Pachl GmbH\nGesellschaft mit beschränkter Haftung\nSchillingsfürst\n\nDen Gläubigern der an der Ausgliederung beteiligten Rechtsträger ist, wenn sie binnen sechs Monaten nach dem Tag, an dem die Eintragung der Ausgliederung in das Register des Sitzes desjenigen Rechtsträgers, dessen Gläubiger sie sind, nach §§ 125, 19 Abs. 3 UmwG als bekannt gemacht gilt, ihren Anspruch nach Grund und Höhe schriftlich anmelden, Sicherheit zu leisten, soweit sie nicht Befriedigung verlangen können. Dieses Recht steht den Gläubigern jedoch nur zu, wenn sie glaubhaft machen, dass durch die Ausgliederung die Erfüllung ihrer Forderung gefährdet wird."
    },
    {
      "date": "2024-12-14",
      "id": "96458",
      "original_text": "Registerbekanntmachung nach dem Umwandlungsgesetz\nBayern Amtsgericht Ansbach HRA 4835\nElektronikbob Robin Friedrich e. K. – Wassertrüdingen",
      "type": "Registerbekanntmachung nach dem Umwandlungsgesetz",
      "state": "Bayern",
      "amtsgericht": "Amtsgericht Ansbach",
      "registernummer": "HRA 4835",
      "registerart": "HRA",
      "company_name": "Elektronikbob Robin Friedrich e. K.",
      "company_seat": "Wassertrüdingen",
      "details": "14.12.2024 (Bekanntmachungsdatum)\n\nBayern Amtsgericht Ansbach HRA 4835\nRegisterbekanntmachung nach dem Umwandlungsgesetz 13.12.2024 (Eintragungsdatum)\n\nElektronikbob Robin Friedrich e. K.\nEinzelkaufmann / Einzelkauffrau\nWassertrüdingen\n\nDen Gläubigern der an der Ausgliederung beteiligten Rechtsträger ist, wenn sie binnen sechs Monaten nach dem Tag, an dem die Eintragung der Ausgliederung in das Register des Sitzes desjenigen Rechtsträgers, dessen Gläubiger sie sind, nach §§ 125, 19 Abs. 3 UmwG als bekannt gemacht gilt, ihren Anspruch nach Grund und Höhe schriftlich anmelden, Sicherheit zu leisten, soweit sie nicht Befriedigung verlangen können. Dieses Recht steht den Gläubigern jedoch nur zu, wenn sie glaubhaft machen, dass durch die Ausgliederung die Erfüllung ihrer Forderung gefährdet wird."
    },
    {
      "date": "2024-12-14",
      "id": "96459",
      "original_text": "Registerbekanntmachung nach dem Umwandlungsgesetz\nBayern Amtsgericht Ansbach HRB 8480\nElektronikbob GmbH – Wassertrüdingen",
      "type": "Registerbekanntmachung nach dem Umwandlungsgesetz",
      "state": "Bayern",
      "amtsgericht": "Amtsgericht Ansbach",
      "registernummer": "HRB 8480",
      "registerart": "HRB",
      "company_name": "Elektronikbob GmbH",
      "company_seat": "Wassertrüdingen",
      "details": "14.12.2024 (Bekanntmachungsdatum)\n\nBayern Amtsgericht Ansbach HRB 8480\nRegisterbekanntmachung nach dem Umwandlungsgesetz 13.12.2024 (Eintragungsdatum)\n\nElektronikbob GmbH\nGesellschaft mit beschränkter Haftung\nWassertrüdingen\n\nDen Gläubigern der an der Ausgliederung beteiligten Rechtsträger ist, wenn sie binnen sechs Monaten nach dem Tag, an dem die Eintragung der Ausgliederung in das Register des Sitzes desjenigen Rechtsträgers, dessen Gläubiger sie sind, nach §§ 125, 19 Abs. 3 UmwG als bekannt gemacht gilt, ihren Anspruch nach Grund und Höhe schriftlich anmelden, Sicherheit zu leisten, soweit sie nicht Befriedigung verlangen können. Dieses Recht steht den Gläubigern jedoch nur zu, wenn sie glaubhaft machen, dass durch die Ausgliederung die Erfüllung ihrer Forderung gefährdet wird."
    },
    {
      "date": "2024-12-14",
      "id": "96460",
      "original_text": "Löschungsankündigung\nBayern Amtsgericht Traunstein HRA 11265\nad-onlineS e.K. – Oberaudorf",
      "type": "Löschungsankündigung",
      "state": "Bayern",
      "amtsgericht": "Amtsgericht Traunstein",
      "registernummer": "HRA 11265",
      "registerart": "HRA",
      "company_name": "ad-onlineS e.K.",
      "company_seat": "Oberaudorf",
      "details": "14.12.2024 (Bekanntmachungsdatum)\n\nBayern Amtsgericht Traunstein HRA 11265\nLöschungsankündigung\n\nad-onlineS e.K.\nEinzelkaufmann / Einzelkauffrau\nOberaudorf\n\nDas Registergericht beabsichtigt, die im Handelsregister eingetragene Firma von Amts wegen nach § 31 Abs. 2 HGB zu löschen. Die Frist zur Erhebung eines Widerspruchs ist auf drei Monate festgesetzt."
    },
    {
      "date": "2024-12-14",
      "id": "96461",
      "original_text": "Registerbekanntmachung nach dem Umwandlungsgesetz\nBayern Amtsgericht Ansbach HRA 4852\nPhysio-Point Alfred Pachl e.K. – Schillingsfürst",
      "type": "Registerbekanntmachung nach dem Umwandlungsgesetz",
      "state": "Bayern",
      "amtsgericht": "Amtsgericht Ansbach",
      "registernummer": "HRA 4852",
      "registerart": "HRA",
      "company_name": "Physio-Point Alfred Pachl e.K.",
      "company_seat": "Schillingsfürst",
      "details": "14.12.2024 (Bekanntmachungsdatum)\n\nBayern Amtsgericht Ansbach HRA 4852\nRegisterbekanntmachung nach dem Umwandlungsgesetz 13.12.2024 (Eintragungsdatum)\n\nPhysio-Point Alfred Pachl e.K.\nEinzelkaufmann / Einzelkauffrau\nSchillingsfürst\n\nDen Gläubigern der an der Ausgliederung beteiligten Rechtsträger ist, wenn sie binnen sechs Monaten nach dem Tag, an dem die Eintragung der Ausgliederung in das Register des Sitzes desjenigen Rechtsträgers, dessen Gläubiger sie sind, nach §§ 125, 19 Abs. 3 UmwG als bekannt gemacht gilt, ihren Anspruch nach Grund und Höhe schriftlich anmelden, Sicherheit zu leisten, soweit sie nicht Befriedigung verlangen können. Dieses Recht steht den Gläubigern jedoch nur zu, wenn sie glaubhaft machen, dass durch die Ausgliederung die Erfüllung ihrer Forderung gefährdet wird."
    },
    {
      "date": "2024-12-14",
      "id": "96462",
      "original_text": "Löschungsankündigung\nBayern Amtsgericht München HRB 189804\nQuantum Technologie (Deutschland) GmbH – Puchheim",
      "type": "Löschungsankündigung",
      "state": "Bayern",
      "amtsgericht": "Amtsgericht München",
      "registernummer": "HRB 189804",
      "registerart": "HRB",
      "company_name": "Quantum Technologie (Deutschland) GmbH",
      "company_seat": "Puchheim",
      "details": "14.12.2024 (Bekanntmachungsdatum)\n\nBayern Amtsgericht München HRB 189804\nLöschungsankündigung 13.12.2024 (Eintragungsdatum)\n\nQuantum Technologie (Deutschland) GmbH\nGesellschaft mit beschränkter Haftung\nPuchheim\n\nDas Registergericht beabsichtigt, die im Handelsregister eingetragene Gesellschaft wegen Vermögenslosigkeit von Amts wegen nach § 394 FamFG zu löschen. Die Frist zur Erhebung eines Widerspruchs ist auf drei Monate festgesetzt."
    },
    {
      "date": "2024-12-14",
      "id": "96463",
      "original_text": "Registerbekanntmachung nach dem Umwandlungsgesetz\nBayern Amtsgericht Nürnberg HRB 25122\nERGE Holding GmbH – Schnaittach",
      "type": "Registerbekanntmachung nach dem Umwandlungsgesetz",
      "state": "Bayern",
      "amtsgericht": "Amtsgericht Nürnberg",
      "registernummer": "HRB 25122",
      "registerart": "HRB",
      "company_name": "ERGE Holding GmbH",
      "company_seat": "Schnaittach",
      "details": "14.12.2024 (Bekanntmachungsdatum)\n\nBayern Amtsgericht Nürnberg HRB 25122\nRegisterbekanntmachung nach dem Umwandlungsgesetz 13.12.2024 (Eintragungsdatum)\n\nERGE Holding GmbH\nGesellschaft mit beschränkter Haftung\nSchnaittach\n\nDen Gläubigern der an der Verschmelzung beteiligten Rechtsträger ist, wenn sie binnen sechs Monaten nach dem Tag, an dem die Eintragung der Verschmelzung in das Register des Sitzes desjenigen Rechtsträgers, dessen Gläubiger sie sind, nach § 19 Abs. 3 UmwG als bekannt gemacht gilt, ihren Anspruch nach Grund und Höhe schriftlich anmelden, Sicherheit zu leisten, soweit sie nicht Befriedigung verlangen können. Dieses Recht steht den Gläubigern jedoch nur zu, wenn sie glaubhaft machen, dass durch die Verschmelzung die Erfüllung ihrer Forderung gefährdet wird."
    },
    {
      "date": "2024-12-14",
      "id": "96464",
      "original_text": "Registerbekanntmachung nach dem Umwandlungsgesetz\nBayern Amtsgericht München HRB 297879\nSoenke Capital Holding GmbH – München",
      "type": "Registerbekanntmachung nach dem Umwandlungsgesetz",
      "state": "Bayern",
      "amtsgericht": "Amtsgericht München",
      "registernummer": "HRB 297879",
      "registerart": "HRB",
      "company_name": "Soenke Capital Holding GmbH",
      "company_seat": "München",
      "details": "14.12.2024 (Bekanntmachungsdatum)\n\nBayern Amtsgericht München HRB 297879\nRegisterbekanntmachung nach dem Umwandlungsgesetz 13.12.2024 (Eintragungsdatum)\n\nSoenke Capital Holding GmbH\nGesellschaft mit beschränkter Haftung\nMünchen\n\nDen Gläubigern der an der Verschmelzung beteiligten Rechtsträger ist, wenn sie binnen sechs Monaten nach dem Tag, an dem die Eintragung der Verschmelzung in das Register des Sitzes desjenigen Rechtsträgers, dessen Gläubiger sie sind, nach § 19 Abs. 3 UmwG als bekannt gemacht gilt, ihren Anspruch nach Grund und Höhe schriftlich anmelden, Sicherheit zu leisten, soweit sie nicht Befriedigung verlangen können. Dieses Recht steht den Gläubigern jedoch nur zu, wenn sie glaubhaft machen, dass durch die Verschmelzung die Erfüllung ihrer Forderung gefährdet wird."
    },
    {
      "date": "2024-12-14",
      "id": "96465",
      "original_text": "Löschungsankündigung\nBayern Amtsgericht München HRB 266417\nB & B Veles GmbH – Gräfelfing",
      "type": "Löschungsankündigung",
      "state": "Bayern",
      "amtsgericht": "Amtsgericht München",
      "registernummer": "HRB 266417",
      "registerart": "HRB",
      "company_name": "B & B Veles GmbH",
      "company_seat": "Gräfelfing",
      "details": "14.12.2024 (Bekanntmachungsdatum)\n\nBayern Amtsgericht München HRB 266417\nLöschungsankündigung 13.12.2024 (Eintragungsdatum)\n\nB & B Veles GmbH\nGesellschaft mit beschränkter Haftung\nGräfelfing\n\nDas Registergericht beabsichtigt, die im Handelsregister eingetragene Gesellschaft wegen Vermögenslosigkeit von Amts wegen nach § 394 FamFG zu löschen. Die Frist zur Erhebung eines Widerspruchs ist auf drei Monate festgesetzt."
    },
    {
      "date": "2024-12-14",
      "id": "96466",
      "original_text": "Einreichung neuer Dokumente\nBayern Amtsgericht München HRB 199543\nApollo 5 GmbH – Starnberg",
      "type": "Einreichung neuer Dokumente",
      "state": "Bayern",
      "amtsgericht": "Amtsgericht München",
      "registernummer": "HRB 199543",
      "registerart": "HRB",
      "company_name": "Apollo 5 GmbH",
      "company_seat": "Starnberg",
      "details": "14.12.2024 (Bekanntmachungsdatum)\n\nBayern Amtsgericht München HRB 199543\nEinreichung neuer Dokumente\n\nApollo 5 GmbH\nGesellschaft mit beschränkter Haftung\nStarnberg\n\nDem #Re.Name ist eine Liste der Mitglieder des Aufsichtsrats eingereicht worden, § 52 Abs. 3 S. 2 GmbHG."
    },
    {
      "date": "2024-12-14",
      "id": "96467",
      "original_text": "Löschungsankündigung\nBayern Amtsgericht München HRB 218508\nPolo Projekt AG – Grünwald",
      "type": "Löschungsankündigung",
      "state": "Bayern",
      "amtsgericht": "Amtsgericht München",
      "registernummer": "HRB 218508",
      "registerart": "HRB",
      "company_name": "Polo Projekt AG",
      "company_seat": "Grünwald",
      "details": "14.12.2024 (Bekanntmachungsdatum)\n\nBayern Amtsgericht München HRB 218508\nLöschungsankündigung 13.12.2024 (Eintragungsdatum)\n\nPolo Projekt AG\nAktiengesellschaft\nGrünwald\n\nDas Registergericht beabsichtigt, den im Handelsregister eingetragenen Abwickler Hans Jürgen Götzfried, geboren am 18.05.1943,  wegen fehlender Eignung nach § 395 FamFG zu löschen. Die Frist zur Erhebung eines Widerspruchs ist auf drei Monate festgesetzt."
    },
    {
      "date": "2024-12-14",
      "id": "96468",
      "original_text": "Einreichung neuer Dokumente\nBayern Amtsgericht München HRB 188307\nleon-nanodrugs GmbH – München",
      "type": "Einreichung neuer Dokumente",
      "state": "Bayern",
      "amtsgericht": "Amtsgericht München",
      "registernummer": "HRB 188307",
      "registerart": "HRB",
      "company_name": "leon-nanodrugs GmbH",
      "company_seat": "München",
      "details": "14.12.2024 (Bekanntmachungsdatum)\n\nBayern Amtsgericht München HRB 188307\nEinreichung neuer Dokumente\n\nleon-nanodrugs GmbH\nGesellschaft mit beschränkter Haftung\nMünchen\n\nDem Amtsgericht München -Registergericht- ist eine Liste der Mitglieder des Aufsichtsrats eingereicht worden, § 52 Abs. 3 S. 2 GmbHG."
    },
    {
      "date": "2024-12-14",
      "id": "96469",
      "original_text": "Einreichung neuer Dokumente\nBayern Amtsgericht Augsburg HRB 24494\ncapital art ag – Augsburg",
      "type": "Einreichung neuer Dokumente",
      "state": "Bayern",
      "amtsgericht": "Amtsgericht Augsburg",
      "registernummer": "HRB 24494",
      "registerart": "HRB",
      "company_name": "capital art ag",
      "company_seat": "Augsburg",
      "details": "14.12.2024 (Bekanntmachungsdatum)\n\nBayern Amtsgericht Augsburg HRB 24494\nEinreichung neuer Dokumente\n\ncapital art ag\nAktiengesellschaft\nAugsburg\n\nDem Amtsgericht Augsburg -Registergericht- sind zwei Listen der Mitglieder des Aufsichtsrats eingereicht worden, § 106 AktG."
    },
    {
      "date": "2024-12-14",
      "id": "96470",
      "original_text": "Registerbekanntmachung nach dem Umwandlungsgesetz\nBayern Amtsgericht Nürnberg HRB 42684\nFranz Messer GmbH – Schnaittach",
      "type": "Registerbekanntmachung nach dem Umwandlungsgesetz",
      "state": "Bayern",
      "amtsgericht": "Amtsgericht Nürnberg",
      "registernummer": "HRB 42684",
      "registerart": "HRB",
      "company_name": "Franz Messer GmbH",
      "company_seat": "Schnaittach",
      "details": "14.12.2024 (Bekanntmachungsdatum)\n\nBayern Amtsgericht Nürnberg HRB 42684\nRegisterbekanntmachung nach dem Umwandlungsgesetz 13.12.2024 (Eintragungsdatum)\n\nFranz Messer GmbH\nGesellschaft mit beschränkter Haftung\nSchnaittach\n\nDen Gläubigern der an der Verschmelzung beteiligten Rechtsträger ist, wenn sie binnen sechs Monaten nach dem Tag, an dem die Eintragung der Verschmelzung in das Register des Sitzes desjenigen Rechtsträgers, dessen Gläubiger sie sind, nach § 19 Abs. 3 UmwG als bekannt gemacht gilt, ihren Anspruch nach Grund und Höhe schriftlich anmelden, Sicherheit zu leisten, soweit sie nicht Befriedigung verlangen können. Dieses Recht steht den Gläubigern jedoch nur zu, wenn sie glaubhaft machen, dass durch die Verschmelzung die Erfüllung ihrer Forderung gefährdet wird."
    },
    {
      "date": "2024-12-14",
      "id": "96471",
      "original_text": "Registerbekanntmachung nach dem Umwandlungsgesetz\nBayern Amtsgericht München HRB 276982\nSoenke Capital Management UG (haftungsbeschränkt) – München",
      "type": "Registerbekanntmachung nach dem Umwandlungsgesetz",
      "state": "Bayern",
      "amtsgericht": "Amtsgericht München",
      "registernummer": "HRB 276982",
      "registerart": "HRB",
      "company_name": "Soenke Capital Management UG (haftungsbeschränkt)",
      "company_seat": "München",
      "details": "14.12.2024 (Bekanntmachungsdatum)\n\nBayern Amtsgericht München HRB 276982\nRegisterbekanntmachung nach dem Umwandlungsgesetz 13.12.2024 (Eintragungsdatum)\n\nSoenke Capital Management UG (haftungsbeschränkt)\nGesellschaft mit beschränkter Haftung\nMünchen\n\nDen Gläubigern der an der Verschmelzung beteiligten Rechtsträger ist, wenn sie binnen sechs Monaten nach dem Tag, an dem die Eintragung der Verschmelzung in das Register des Sitzes desjenigen Rechtsträgers, dessen Gläubiger sie sind, nach § 19 Abs. 3 UmwG als bekannt gemacht gilt, ihren Anspruch nach Grund und Höhe schriftlich anmelden, Sicherheit zu leisten, soweit sie nicht Befriedigung verlangen können. Dieses Recht steht den Gläubigern jedoch nur zu, wenn sie glaubhaft machen, dass durch die Verschmelzung die Erfüllung ihrer Forderung gefährdet wird."
    },
    {
      "date": "2024-12-14",
      "id": "96472",
      "original_text": "Löschungsankündigung\nBayern Amtsgericht München HRB 208670\nSt. Ars Holding GmbH – München",
      "type": "Löschungsankündigung",
      "state": "Bayern",
      "amtsgericht": "Amtsgericht München",
      "registernummer": "HRB 208670",
      "registerart": "HRB",
      "company_name": "St. Ars Holding GmbH",
      "company_seat": "München",
      "details": "14.12.2024 (Bekanntmachungsdatum)\n\nBayern Amtsgericht München HRB 208670\nLöschungsankündigung\n\nSt. Ars Holding GmbH\nGesellschaft mit beschränkter Haftung\nMünchen\n\nDas Registergericht beabsichtigt, die im Handelsregister eingetragene Gesellschaft wegen Vermögenslosigkeit von Amts wegen nach § 394 FamFG zu löschen. Die Frist zur Erhebung eines Widerspruchs ist auf drei Monate festgesetzt."
    },
    {
      "date": "2024-12-14",
      "id": "96473",
      "original_text": "Löschungsankündigung\nBayern Amtsgericht München HRB 191986\nDr. Schmidt Wohnbau GmbH – München",
      "type": "Löschungsankündigung",
      "state": "Bayern",
      "amtsgericht": "Amtsgericht München",
      "registernummer": "HRB 191986",
      "registerart": "HRB",
      "company_name": "Dr. Schmidt Wohnbau GmbH",
      "company_seat": "München",
      "details": "14.12.2024 (Bekanntmachungsdatum)\n\nBayern Amtsgericht München HRB 191986\nLöschungsankündigung\n\nDr. Schmidt Wohnbau GmbH\nGesellschaft mit beschränkter Haftung\nMünchen\n\nDas Registergericht beabsichtigt, die im Handelsregister eingetragene Gesellschaft wegen Vermögenslosigkeit von Amts wegen nach § 394 FamFG zu löschen. Die Frist zur Erhebung eines Widerspruchs ist auf drei Monate festgesetzt."
    }
  ]
}