{
  "date": "2024-12-10",
  "date_of_scrape": "2024-12-11T04:09:04.152Z",
  "tool_version": "0.2.0",
  "number_of_announcements": 170,
  "announcements": [
    {
      "date": "2024-12-10",
      "id": "95853",
      "original_text": "Löschungsankündigung\nBayern Amtsgericht Coburg HRB 6284\nAVINOOR GmbH – Meeder",
      "type": "Löschungsankündigung",
      "state": "Bayern",
      "amtsgericht": "Amtsgericht Coburg",
      "registernummer": "HRB 6284",
      "registerart": "HRB",
      "company_name": "AVINOOR GmbH",
      "company_seat": "Meeder",
      "details": "10.12.2024 (Bekanntmachungsdatum)\n\nBayern Amtsgericht Coburg HRB 6284\nLöschungsankündigung\n\nAVINOOR GmbH\nGesellschaft mit beschränkter Haftung\nMeeder\n\nDas Registergericht beabsichtigt, die im Handelsregister eingetragene Gesellschaft wegen Vermögenslosigkeit von Amts wegen nach § 394 FamFG zu löschen. Die Frist zur Erhebung eines Widerspruchs ist auf sechs Wochen festgesetzt."
    },
    {
      "date": "2024-12-10",
      "id": "95854",
      "original_text": "Registerbekanntmachung nach dem Umwandlungsgesetz\nBayern Amtsgericht München HRB 239037\nEIB Group GmbH – Pullach i.Isartal",
      "type": "Registerbekanntmachung nach dem Umwandlungsgesetz",
      "state": "Bayern",
      "amtsgericht": "Amtsgericht München",
      "registernummer": "HRB 239037",
      "registerart": "HRB",
      "company_name": "EIB Group GmbH",
      "company_seat": "Pullach i.Isartal",
      "details": "10.12.2024 (Bekanntmachungsdatum)\n\nBayern Amtsgericht München HRB 239037\nRegisterbekanntmachung nach dem Umwandlungsgesetz 09.12.2024 (Eintragungsdatum)\n\nEIB Group GmbH\nGesellschaft mit beschränkter Haftung\nPullach i.Isartal\n\nDen Gläubigern der an der Verschmelzung beteiligten Rechtsträger ist, wenn sie binnen sechs Monaten nach dem Tag, an dem die Eintragung der Verschmelzung in das Register des Sitzes desjenigen Rechtsträgers, dessen Gläubiger sie sind, nach § 19 Abs. 3 UmwG als bekannt gemacht gilt, ihren Anspruch nach Grund und Höhe schriftlich anmelden, Sicherheit zu leisten, soweit sie nicht Befriedigung verlangen können. Dieses Recht steht den Gläubigern jedoch nur zu, wenn sie glaubhaft machen, dass durch die Verschmelzung die Erfüllung ihrer Forderung gefährdet wird."
    },
    {
      "date": "2024-12-10",
      "id": "95855",
      "original_text": "Löschungsankündigung\nBayern Amtsgericht Traunstein HRA 2465\nHans Huber eingetragener Kaufmann – Wasserburg am Inn",
      "type": "Löschungsankündigung",
      "state": "Bayern",
      "amtsgericht": "Amtsgericht Traunstein",
      "registernummer": "HRA 2465",
      "registerart": "HRA",
      "company_name": "Hans Huber eingetragener Kaufmann",
      "company_seat": "Wasserburg am Inn",
      "details": "10.12.2024 (Bekanntmachungsdatum)\n\nBayern Amtsgericht Traunstein HRA 2465\nLöschungsankündigung\n\nHans Huber eingetragener Kaufmann\nEinzelkaufmann / Einzelkauffrau\nWasserburg am Inn\n\nDas Registergericht beabsichtigt, die im Handelsregister eingetragene Firma von Amts wegen nach § 31 Abs. 2 HGB zu löschen. Die Frist zur Erhebung eines Widerspruchs ist auf drei Monate festgesetzt."
    },
    {
      "date": "2024-12-10",
      "id": "95856",
      "original_text": "Einreichung neuer Dokumente\nBayern Amtsgericht München HRB 115316\nBavaria Revisions- und Treuhand Aktiengesellschaft Wirtschaftsprüfungsgesellschaft Steuerberatungsgesellschaft – München",
      "type": "Einreichung neuer Dokumente",
      "state": "Bayern",
      "amtsgericht": "Amtsgericht München",
      "registernummer": "HRB 115316",
      "registerart": "HRB",
      "company_name": "Bavaria Revisions- und Treuhand Aktiengesellschaft Wirtschaftsprüfungsgesellschaft Steuerberatungsgesellschaft",
      "company_seat": "München",
      "details": "10.12.2024 (Bekanntmachungsdatum)\n\nBayern Amtsgericht München HRB 115316\nEinreichung neuer Dokumente 09.12.2024 (Eintragungsdatum)\n\nBavaria Revisions- und Treuhand Aktiengesellschaft Wirtschaftsprüfungsgesellschaft Steuerberatungsgesellschaft\nAktiengesellschaft\nMünchen\n\nDem Amtsgericht München -Registergericht- ist eine Liste der Mitglieder des Aufsichtsrats eingereicht worden, § 106 AktG."
    },
    {
      "date": "2024-12-10",
      "id": "95857",
      "original_text": "Registerbekanntmachung nach dem Umwandlungsgesetz\nBayern Amtsgericht Nürnberg HRB 20381\nLorenz Technik Verwaltungs GmbH – Nürnberg",
      "type": "Registerbekanntmachung nach dem Umwandlungsgesetz",
      "state": "Bayern",
      "amtsgericht": "Amtsgericht Nürnberg",
      "registernummer": "HRB 20381",
      "registerart": "HRB",
      "company_name": "Lorenz Technik Verwaltungs GmbH",
      "company_seat": "Nürnberg",
      "details": "10.12.2024 (Bekanntmachungsdatum)\n\nBayern Amtsgericht Nürnberg HRB 20381\nRegisterbekanntmachung nach dem Umwandlungsgesetz 09.12.2024 (Eintragungsdatum)\n\nLorenz Technik Verwaltungs GmbH\nGesellschaft mit beschränkter Haftung\nNürnberg\n\nDen Gläubigern der an der Verschmelzung beteiligten Rechtsträger ist, wenn sie binnen sechs Monaten nach dem Tag, an dem die Eintragung der Verschmelzung in das Register des Sitzes desjenigen Rechtsträgers, dessen Gläubiger sie sind, nach § 19 Abs. 3 UmwG als bekannt gemacht gilt, ihren Anspruch nach Grund und Höhe schriftlich anmelden, Sicherheit zu leisten, soweit sie nicht Befriedigung verlangen können. Dieses Recht steht den Gläubigern jedoch nur zu, wenn sie glaubhaft machen, dass durch die Verschmelzung die Erfüllung ihrer Forderung gefährdet wird."
    },
    {
      "date": "2024-12-10",
      "id": "95858",
      "original_text": "Registerbekanntmachung nach dem Umwandlungsgesetz\nBayern Amtsgericht Nürnberg HRB 42846\nDGbAV - Deutsche Gesellschaft für betriebliche Altersversorgung AG – Nürnberg",
      "type": "Registerbekanntmachung nach dem Umwandlungsgesetz",
      "state": "Bayern",
      "amtsgericht": "Amtsgericht Nürnberg",
      "registernummer": "HRB 42846",
      "registerart": "HRB",
      "company_name": "DGbAV - Deutsche Gesellschaft für betriebliche Altersversorgung AG",
      "company_seat": "Nürnberg",
      "details": "10.12.2024 (Bekanntmachungsdatum)\n\nBayern Amtsgericht Nürnberg HRB 42846\nRegisterbekanntmachung nach dem Umwandlungsgesetz 09.12.2024 (Eintragungsdatum)\n\nDGbAV - Deutsche Gesellschaft für betriebliche Altersversorgung AG\nAktiengesellschaft\nNürnberg\n\nDen Gläubigern der an der Verschmelzung beteiligten Rechtsträger ist, wenn sie binnen sechs Monaten nach dem Tag, an dem die Eintragung der Verschmelzung in das Register des Sitzes desjenigen Rechtsträgers, dessen Gläubiger sie sind, nach § 19 Abs. 3 UmwG als bekannt gemacht gilt, ihren Anspruch nach Grund und Höhe schriftlich anmelden, Sicherheit zu leisten, soweit sie nicht Befriedigung verlangen können. Dieses Recht steht den Gläubigern jedoch nur zu, wenn sie glaubhaft machen, dass durch die Verschmelzung die Erfüllung ihrer Forderung gefährdet wird."
    },
    {
      "date": "2024-12-10",
      "id": "95859",
      "original_text": "Löschungsankündigung\nBayern Amtsgericht Nürnberg HRB 22856\nPSM Komplettlösungen GmbH – Nürnberg",
      "type": "Löschungsankündigung",
      "state": "Bayern",
      "amtsgericht": "Amtsgericht Nürnberg",
      "registernummer": "HRB 22856",
      "registerart": "HRB",
      "company_name": "PSM Komplettlösungen GmbH",
      "company_seat": "Nürnberg",
      "details": "10.12.2024 (Bekanntmachungsdatum)\n\nBayern Amtsgericht Nürnberg HRB 22856\nLöschungsankündigung\n\nPSM Komplettlösungen GmbH\nGesellschaft mit beschränkter Haftung\nNürnberg\n\nDas Registergericht beabsichtigt, die im Handelsregister eingetragene Gesellschaft wegen Vermögenslosigkeit von Amts wegen nach § 394 FamFG zu löschen. Die Frist zur Erhebung eines Widerspruchs ist auf einen Monat festgesetzt."
    },
    {
      "date": "2024-12-10",
      "id": "95860",
      "original_text": "Registerbekanntmachung nach dem Umwandlungsgesetz\nBayern Amtsgericht München HRB 189166\nmorphicon media AG – München",
      "type": "Registerbekanntmachung nach dem Umwandlungsgesetz",
      "state": "Bayern",
      "amtsgericht": "Amtsgericht München",
      "registernummer": "HRB 189166",
      "registerart": "HRB",
      "company_name": "morphicon media AG",
      "company_seat": "München",
      "details": "10.12.2024 (Bekanntmachungsdatum)\n\nBayern Amtsgericht München HRB 189166\nRegisterbekanntmachung nach dem Umwandlungsgesetz 09.12.2024 (Eintragungsdatum)\n\nmorphicon media AG\nAktiengesellschaft\nMünchen\n\nDen Gläubigern des formwechselnden Rechtsträgers ist, wenn sie binnen sechs Monaten nach dem Tag, an dem die Eintragung des Formwechsels nach § 201 UmwG als bekannt gemacht gilt, ihren Anspruch nach Grund und Höhe schriftlich anmelden, Sicherheit zu leisten, soweit sie nicht Befriedigung verlangen können. Dieses Recht steht den Gläubigern jedoch nur zu, wenn sie glaubhaft machen, dass durch den Formwechsel die Erfüllung ihrer Forderung gefährdet wird."
    },
    {
      "date": "2024-12-10",
      "id": "95861",
      "original_text": "Einreichung neuer Dokumente\nBayern Amtsgericht Nürnberg HRB 32123\nGRR AG – Nürnberg",
      "type": "Einreichung neuer Dokumente",
      "state": "Bayern",
      "amtsgericht": "Amtsgericht Nürnberg",
      "registernummer": "HRB 32123",
      "registerart": "HRB",
      "company_name": "GRR AG",
      "company_seat": "Nürnberg",
      "details": "10.12.2024 (Bekanntmachungsdatum)\n\nBayern Amtsgericht Nürnberg HRB 32123\nEinreichung neuer Dokumente 09.12.2024 (Eintragungsdatum)\n\nGRR AG\nAktiengesellschaft\nNürnberg\n\nDem Amtsgericht Nürnberg -Registergericht- ist eine Liste der Mitglieder des Aufsichtsrats eingereicht worden, § 106 AktG."
    },
    {
      "date": "2024-12-10",
      "id": "95862",
      "original_text": "Registerbekanntmachung nach dem Umwandlungsgesetz\nBayern Amtsgericht München HRA 100316\nHolzland Kern GmbH & Co. KG – Kirchseeon",
      "type": "Registerbekanntmachung nach dem Umwandlungsgesetz",
      "state": "Bayern",
      "amtsgericht": "Amtsgericht München",
      "registernummer": "HRA 100316",
      "registerart": "HRA",
      "company_name": "Holzland Kern GmbH & Co. KG",
      "company_seat": "Kirchseeon",
      "details": "10.12.2024 (Bekanntmachungsdatum)\n\nBayern Amtsgericht München HRA 100316\nRegisterbekanntmachung nach dem Umwandlungsgesetz 09.12.2024 (Eintragungsdatum)\n\nHolzland Kern GmbH & Co. KG\nKommanditgesellschaft\nKirchseeon\n\nDen Gläubigern der an der Verschmelzung beteiligten Rechtsträger ist, wenn sie binnen sechs Monaten nach dem Tag, an dem die Eintragung der Verschmelzung in das Register des Sitzes desjenigen Rechtsträgers, dessen Gläubiger sie sind, nach § 19 Abs. 3 UmwG als bekannt gemacht gilt, ihren Anspruch nach Grund und Höhe schriftlich anmelden, Sicherheit zu leisten, soweit sie nicht Befriedigung verlangen können. Dieses Recht steht den Gläubigern jedoch nur zu, wenn sie glaubhaft machen, dass durch die Verschmelzung die Erfüllung ihrer Forderung gefährdet wird."
    },
    {
      "date": "2024-12-10",
      "id": "95863",
      "original_text": "Registerbekanntmachung nach dem Umwandlungsgesetz\nBayern Amtsgericht Traunstein HRB 98\nOtto Dunkel GmbH – Mühldorf a. Inn",
      "type": "Registerbekanntmachung nach dem Umwandlungsgesetz",
      "state": "Bayern",
      "amtsgericht": "Amtsgericht Traunstein",
      "registernummer": "HRB 98",
      "registerart": "HRB",
      "company_name": "Otto Dunkel GmbH",
      "company_seat": "Mühldorf a. Inn",
      "details": "10.12.2024 (Bekanntmachungsdatum)\n\nBayern Amtsgericht Traunstein HRB 98\nRegisterbekanntmachung nach dem Umwandlungsgesetz 08.12.2024 (Eintragungsdatum)\n\nOtto Dunkel GmbH\nGesellschaft mit beschränkter Haftung\nMühldorf a. Inn\n\nDen Gläubigern der an der Verschmelzung beteiligten Rechtsträger ist, wenn sie binnen sechs Monaten nach dem Tag, an dem die Eintragung der Verschmelzung in das Register des Sitzes desjenigen Rechtsträgers, dessen Gläubiger sie sind, nach § 19 Abs. 3 UmwG als bekannt gemacht gilt, ihren Anspruch nach Grund und Höhe schriftlich anmelden, Sicherheit zu leisten, soweit sie nicht Befriedigung verlangen können. Dieses Recht steht den Gläubigern jedoch nur zu, wenn sie glaubhaft machen, dass durch die Verschmelzung die Erfüllung ihrer Forderung gefährdet wird."
    },
    {
      "date": "2024-12-10",
      "id": "95864",
      "original_text": "Löschungsankündigung\nBayern Amtsgericht Augsburg HRA 18323\nMM - Interior GmbH & Co. KG – Landsberg am Lech",
      "type": "Löschungsankündigung",
      "state": "Bayern",
      "amtsgericht": "Amtsgericht Augsburg",
      "registernummer": "HRA 18323",
      "registerart": "HRA",
      "company_name": "MM - Interior GmbH & Co. KG",
      "company_seat": "Landsberg am Lech",
      "details": "10.12.2024 (Bekanntmachungsdatum)\n\nBayern Amtsgericht Augsburg HRA 18323\nLöschungsankündigung\n\nMM - Interior GmbH & Co. KG\nKommanditgesellschaft\nLandsberg am Lech\n\nDas Registergericht beabsichtigt, die im Handelsregister eingetragene Firma wegen Vermögenslosigkeit von Amts wegen nach § 394 FamFG zu löschen. Die Frist zur Erhebung eines Widerspruchs ist auf einen Monat festgesetzt."
    },
    {
      "date": "2024-12-10",
      "id": "95865",
      "original_text": "Löschungsankündigung\nBayern Amtsgericht Nürnberg HRB 37662\nMGMM Verwaltungsgesellschaft UG (haftungsbeschränkt) – Nürnberg",
      "type": "Löschungsankündigung",
      "state": "Bayern",
      "amtsgericht": "Amtsgericht Nürnberg",
      "registernummer": "HRB 37662",
      "registerart": "HRB",
      "company_name": "MGMM Verwaltungsgesellschaft UG (haftungsbeschränkt)",
      "company_seat": "Nürnberg",
      "details": "10.12.2024 (Bekanntmachungsdatum)\n\nBayern Amtsgericht Nürnberg HRB 37662\nLöschungsankündigung\n\nMGMM Verwaltungsgesellschaft UG (haftungsbeschränkt)\nGesellschaft mit beschränkter Haftung\nNürnberg\n\nDas Registergericht beabsichtigt, die im Handelsregister eingetragene Gesellschaft wegen Vermögenslosigkeit von Amts wegen nach § 394 FamFG zu löschen. Die Frist zur Erhebung eines Widerspruchs ist auf einen Monat festgesetzt."
    },
    {
      "date": "2024-12-10",
      "id": "95866",
      "original_text": "Registerbekanntmachung nach dem Umwandlungsgesetz\nBayern Amtsgericht Nürnberg HRB 20344\ncargo support GmbH – Nürnberg",
      "type": "Registerbekanntmachung nach dem Umwandlungsgesetz",
      "state": "Bayern",
      "amtsgericht": "Amtsgericht Nürnberg",
      "registernummer": "HRB 20344",
      "registerart": "HRB",
      "company_name": "cargo support GmbH",
      "company_seat": "Nürnberg",
      "details": "10.12.2024 (Bekanntmachungsdatum)\n\nBayern Amtsgericht Nürnberg HRB 20344\nRegisterbekanntmachung nach dem Umwandlungsgesetz 09.12.2024 (Eintragungsdatum)\n\ncargo support GmbH\nGesellschaft mit beschränkter Haftung\nNürnberg\n\nDen Gläubigern der an der Verschmelzung beteiligten Rechtsträger ist, wenn sie binnen sechs Monaten nach dem Tag, an dem die Eintragung der Verschmelzung in das Register des Sitzes desjenigen Rechtsträgers, dessen Gläubiger sie sind, nach § 19 Abs. 3 UmwG als bekannt gemacht gilt, ihren Anspruch nach Grund und Höhe schriftlich anmelden, Sicherheit zu leisten, soweit sie nicht Befriedigung verlangen können. Dieses Recht steht den Gläubigern jedoch nur zu, wenn sie glaubhaft machen, dass durch die Verschmelzung die Erfüllung ihrer Forderung gefährdet wird."
    },
    {
      "date": "2024-12-10",
      "id": "95867",
      "original_text": "Löschungsankündigung\nBayern Amtsgericht Kempten (Allgäu) HRB 13181\nAlpack UG (haftungsbeschränkt) – Kaufbeuren",
      "type": "Löschungsankündigung",
      "state": "Bayern",
      "amtsgericht": "Amtsgericht Kempten (Allgäu)",
      "registernummer": "HRB 13181",
      "registerart": "HRB",
      "company_name": "Alpack UG (haftungsbeschränkt)",
      "company_seat": "Kaufbeuren",
      "details": "10.12.2024 (Bekanntmachungsdatum)\n\nBayern Amtsgericht Kempten (Allgäu) HRB 13181\nLöschungsankündigung\n\nAlpack UG (haftungsbeschränkt)\nGesellschaft mit beschränkter Haftung\nKaufbeuren\n\nDas Registergericht beabsichtigt, die im Handelsregister eingetragene Gesellschaft von Amts wegen nach § 395 FamFG zu löschen. Die Frist zur Erhebung eines Widerspruchs ist auf einen Monat festgesetzt."
    },
    {
      "date": "2024-12-10",
      "id": "95868",
      "original_text": "Registerbekanntmachung nach dem Umwandlungsgesetz\nBayern Amtsgericht Kempten (Allgäu) HRB 15744\nStraßer Verwaltungs GmbH – Buchloe",
      "type": "Registerbekanntmachung nach dem Umwandlungsgesetz",
      "state": "Bayern",
      "amtsgericht": "Amtsgericht Kempten (Allgäu)",
      "registernummer": "HRB 15744",
      "registerart": "HRB",
      "company_name": "Straßer Verwaltungs GmbH",
      "company_seat": "Buchloe",
      "details": "10.12.2024 (Bekanntmachungsdatum)\n\nBayern Amtsgericht Kempten (Allgäu) HRB 15744\nRegisterbekanntmachung nach dem Umwandlungsgesetz 07.12.2024 (Eintragungsdatum)\n\nStraßer Verwaltungs GmbH\nGesellschaft mit beschränkter Haftung\nBuchloe\n\nDen Gläubigern der an der Verschmelzung beteiligten Rechtsträger ist, wenn sie binnen sechs Monaten nach dem Tag, an dem die Eintragung der Verschmelzung in das Register des Sitzes desjenigen Rechtsträgers, dessen Gläubiger sie sind, nach § 19 Abs. 3 UmwG als bekannt gemacht gilt, ihren Anspruch nach Grund und Höhe schriftlich anmelden, Sicherheit zu leisten, soweit sie nicht Befriedigung verlangen können. Dieses Recht steht den Gläubigern jedoch nur zu, wenn sie glaubhaft machen, dass durch die Verschmelzung die Erfüllung ihrer Forderung gefährdet wird."
    },
    {
      "date": "2024-12-10",
      "id": "95869",
      "original_text": "Einreichung neuer Dokumente\nBayern Amtsgericht Passau HRB 6035\naucuron AG Wirtschaftsprüfungsgesellschaft Steuerberatungsgesellschaft – Passau",
      "type": "Einreichung neuer Dokumente",
      "state": "Bayern",
      "amtsgericht": "Amtsgericht Passau",
      "registernummer": "HRB 6035",
      "registerart": "HRB",
      "company_name": "aucuron AG Wirtschaftsprüfungsgesellschaft Steuerberatungsgesellschaft",
      "company_seat": "Passau",
      "details": "10.12.2024 (Bekanntmachungsdatum)\n\nBayern Amtsgericht Passau HRB 6035\nEinreichung neuer Dokumente 09.12.2024 (Eintragungsdatum)\n\naucuron AG Wirtschaftsprüfungsgesellschaft Steuerberatungsgesellschaft\nAktiengesellschaft\nPassau\n\nDem #Re.Name ist eine Liste der Mitglieder des Aufsichtsrats eingereicht worden, § 106 AktG."
    },
    {
      "date": "2024-12-10",
      "id": "95870",
      "original_text": "Registerbekanntmachung nach dem Umwandlungsgesetz\nBayern Amtsgericht München HRB 240013\nResidia Projekt Am Loferfeld GmbH – Oberhaching",
      "type": "Registerbekanntmachung nach dem Umwandlungsgesetz",
      "state": "Bayern",
      "amtsgericht": "Amtsgericht München",
      "registernummer": "HRB 240013",
      "registerart": "HRB",
      "company_name": "Residia Projekt Am Loferfeld GmbH",
      "company_seat": "Oberhaching",
      "details": "10.12.2024 (Bekanntmachungsdatum)\n\nBayern Amtsgericht München HRB 240013\nRegisterbekanntmachung nach dem Umwandlungsgesetz 09.12.2024 (Eintragungsdatum)\n\nResidia Projekt Am Loferfeld GmbH\nGesellschaft mit beschränkter Haftung\nOberhaching\n\nDen Gläubigern des formwechselnden Rechtsträgers ist, wenn sie binnen sechs Monaten nach dem Tag, an dem die Eintragung des Formwechsels nach § 201 UmwG als bekannt gemacht gilt, ihren Anspruch nach Grund und Höhe schriftlich anmelden, Sicherheit zu leisten, soweit sie nicht Befriedigung verlangen können. Dieses Recht steht den Gläubigern jedoch nur zu, wenn sie glaubhaft machen, dass durch den Formwechsel die Erfüllung ihrer Forderung gefährdet wird."
    },
    {
      "date": "2024-12-10",
      "id": "95871",
      "original_text": "Registerbekanntmachung nach dem Umwandlungsgesetz\nBayern Amtsgericht Nürnberg HRB 20383\nLorenz Personal Verwaltungs GmbH – Nürnberg",
      "type": "Registerbekanntmachung nach dem Umwandlungsgesetz",
      "state": "Bayern",
      "amtsgericht": "Amtsgericht Nürnberg",
      "registernummer": "HRB 20383",
      "registerart": "HRB",
      "company_name": "Lorenz Personal Verwaltungs GmbH",
      "company_seat": "Nürnberg",
      "details": "10.12.2024 (Bekanntmachungsdatum)\n\nBayern Amtsgericht Nürnberg HRB 20383\nRegisterbekanntmachung nach dem Umwandlungsgesetz 09.12.2024 (Eintragungsdatum)\n\nLorenz Personal Verwaltungs GmbH\nGesellschaft mit beschränkter Haftung\nNürnberg\n\nDen Gläubigern der an der Verschmelzung beteiligten Rechtsträger ist, wenn sie binnen sechs Monaten nach dem Tag, an dem die Eintragung der Verschmelzung in das Register des Sitzes desjenigen Rechtsträgers, dessen Gläubiger sie sind, nach § 19 Abs. 3 UmwG als bekannt gemacht gilt, ihren Anspruch nach Grund und Höhe schriftlich anmelden, Sicherheit zu leisten, soweit sie nicht Befriedigung verlangen können. Dieses Recht steht den Gläubigern jedoch nur zu, wenn sie glaubhaft machen, dass durch die Verschmelzung die Erfüllung ihrer Forderung gefährdet wird."
    },
    {
      "date": "2024-12-10",
      "id": "95872",
      "original_text": "Registerbekanntmachung nach dem Umwandlungsgesetz\nBayern Amtsgericht München HRB 91467\nERGO Zwölfte Beteiligungsgesellschaft mbH – München",
      "type": "Registerbekanntmachung nach dem Umwandlungsgesetz",
      "state": "Bayern",
      "amtsgericht": "Amtsgericht München",
      "registernummer": "HRB 91467",
      "registerart": "HRB",
      "company_name": "ERGO Zwölfte Beteiligungsgesellschaft mbH",
      "company_seat": "München",
      "details": "10.12.2024 (Bekanntmachungsdatum)\n\nBayern Amtsgericht München HRB 91467\nRegisterbekanntmachung nach dem Umwandlungsgesetz 09.12.2024 (Eintragungsdatum)\n\nERGO Zwölfte Beteiligungsgesellschaft mbH\nGesellschaft mit beschränkter Haftung\nMünchen\n\nDen Gläubigern der an der Verschmelzung beteiligten Rechtsträger ist, wenn sie binnen sechs Monaten nach dem Tag, an dem die Eintragung der Verschmelzung in das Register des Sitzes desjenigen Rechtsträgers, dessen Gläubiger sie sind, nach § 19 Abs. 3 UmwG als bekannt gemacht gilt, ihren Anspruch nach Grund und Höhe schriftlich anmelden, Sicherheit zu leisten, soweit sie nicht Befriedigung verlangen können. Dieses Recht steht den Gläubigern jedoch nur zu, wenn sie glaubhaft machen, dass durch die Verschmelzung die Erfüllung ihrer Forderung gefährdet wird."
    },
    {
      "date": "2024-12-10",
      "id": "95873",
      "original_text": "Löschungsankündigung\nBayern Amtsgericht Regensburg HRB 16829\nWoidlust UG (haftungsbeschränkt) – Regensburg",
      "type": "Löschungsankündigung",
      "state": "Bayern",
      "amtsgericht": "Amtsgericht Regensburg",
      "registernummer": "HRB 16829",
      "registerart": "HRB",
      "company_name": "Woidlust UG (haftungsbeschränkt)",
      "company_seat": "Regensburg",
      "details": "10.12.2024 (Bekanntmachungsdatum)\n\nBayern Amtsgericht Regensburg HRB 16829\nLöschungsankündigung\n\nWoidlust UG (haftungsbeschränkt)\nGesellschaft mit beschränkter Haftung\nRegensburg\n\nDas Registergericht beabsichtigt, die im Handelsregister eingetragene Gesellschaft wegen Vermögenslosigkeit von Amts wegen nach § 394 FamFG zu löschen. Die Frist zur Erhebung eines Widerspruchs ist auf einen Monat festgesetzt."
    },
    {
      "date": "2024-12-10",
      "id": "95874",
      "original_text": "Registerbekanntmachung nach dem Umwandlungsgesetz\nBayern Amtsgericht Traunstein HRB 29422\nConnect Energie GmbH – Ampfing",
      "type": "Registerbekanntmachung nach dem Umwandlungsgesetz",
      "state": "Bayern",
      "amtsgericht": "Amtsgericht Traunstein",
      "registernummer": "HRB 29422",
      "registerart": "HRB",
      "company_name": "Connect Energie GmbH",
      "company_seat": "Ampfing",
      "details": "10.12.2024 (Bekanntmachungsdatum)\n\nBayern Amtsgericht Traunstein HRB 29422\nRegisterbekanntmachung nach dem Umwandlungsgesetz 08.12.2024 (Eintragungsdatum)\n\nConnect Energie GmbH\nGesellschaft mit beschränkter Haftung\nAmpfing\n\nDen Gläubigern der an der Verschmelzung beteiligten Rechtsträger ist, wenn sie binnen sechs Monaten nach dem Tag, an dem die Eintragung der Verschmelzung in das Register des Sitzes desjenigen Rechtsträgers, dessen Gläubiger sie sind, nach § 19 Abs. 3 UmwG als bekannt gemacht gilt, ihren Anspruch nach Grund und Höhe schriftlich anmelden, Sicherheit zu leisten, soweit sie nicht Befriedigung verlangen können. Dieses Recht steht den Gläubigern jedoch nur zu, wenn sie glaubhaft machen, dass durch die Verschmelzung die Erfüllung ihrer Forderung gefährdet wird."
    },
    {
      "date": "2024-12-10",
      "id": "95875",
      "original_text": "Löschungsankündigung\nBayern Amtsgericht Augsburg HRA 11454\nAPS Gewerbepark GmbH & Co. KG – Augsburg",
      "type": "Löschungsankündigung",
      "state": "Bayern",
      "amtsgericht": "Amtsgericht Augsburg",
      "registernummer": "HRA 11454",
      "registerart": "HRA",
      "company_name": "APS Gewerbepark GmbH & Co. KG",
      "company_seat": "Augsburg",
      "details": "10.12.2024 (Bekanntmachungsdatum)\n\nBayern Amtsgericht Augsburg HRA 11454\nLöschungsankündigung\n\nAPS Gewerbepark GmbH & Co. KG\nKommanditgesellschaft\nAugsburg\n\nDas Registergericht beabsichtigt, die im Handelsregister eingetragene Firma wegen Vermögenslosigkeit von Amts wegen nach § 394 FamFG zu löschen. Die Frist zur Erhebung eines Widerspruchs ist auf einen Monat festgesetzt."
    },
    {
      "date": "2024-12-10",
      "id": "95876",
      "original_text": "Registerbekanntmachung nach dem Umwandlungsgesetz\nBayern Amtsgericht Nürnberg HRB 43437\nIGbAV - Internationale Gesellschaft für betriebliche Altersversorgung mbH – Nürnberg",
      "type": "Registerbekanntmachung nach dem Umwandlungsgesetz",
      "state": "Bayern",
      "amtsgericht": "Amtsgericht Nürnberg",
      "registernummer": "HRB 43437",
      "registerart": "HRB",
      "company_name": "IGbAV - Internationale Gesellschaft für betriebliche Altersversorgung mbH",
      "company_seat": "Nürnberg",
      "details": "10.12.2024 (Bekanntmachungsdatum)\n\nBayern Amtsgericht Nürnberg HRB 43437\nRegisterbekanntmachung nach dem Umwandlungsgesetz 09.12.2024 (Eintragungsdatum)\n\nIGbAV - Internationale Gesellschaft für betriebliche Altersversorgung mbH\nGesellschaft mit beschränkter Haftung\nNürnberg\n\nDen Gläubigern der an der Verschmelzung beteiligten Rechtsträger ist, wenn sie binnen sechs Monaten nach dem Tag, an dem die Eintragung der Verschmelzung in das Register des Sitzes desjenigen Rechtsträgers, dessen Gläubiger sie sind, nach § 19 Abs. 3 UmwG als bekannt gemacht gilt, ihren Anspruch nach Grund und Höhe schriftlich anmelden, Sicherheit zu leisten, soweit sie nicht Befriedigung verlangen können. Dieses Recht steht den Gläubigern jedoch nur zu, wenn sie glaubhaft machen, dass durch die Verschmelzung die Erfüllung ihrer Forderung gefährdet wird."
    },
    {
      "date": "2024-12-10",
      "id": "95877",
      "original_text": "Einreichung neuer Dokumente\nBrandenburg Amtsgericht Neuruppin HRB 1519\nStadtwerke Rheinsberg GmbH – Rheinsberg",
      "type": "Einreichung neuer Dokumente",
      "state": "Brandenburg",
      "amtsgericht": "Amtsgericht Neuruppin",
      "registernummer": "HRB 1519",
      "registerart": "HRB",
      "company_name": "Stadtwerke Rheinsberg GmbH",
      "company_seat": "Rheinsberg",
      "details": "10.12.2024 (Bekanntmachungsdatum)\n\nBrandenburg Amtsgericht Neuruppin HRB 1519\nEinreichung neuer Dokumente\n\nStadtwerke Rheinsberg GmbH\nGesellschaft mit beschränkter Haftung\nRheinsberg\n\nAls nicht eingetragen wird veröffentlicht: Eine Liste der Mitglieder des Aufsichtsrates wurde zum Handelsregister eingereicht."
    },
    {
      "date": "2024-12-10",
      "id": "95878",
      "original_text": "Löschungsankündigung\nSachsen-Anhalt Amtsgericht Stendal HRA 22360\nWMS Flocktechnik GmbH & Co. KG – Wolmirstedt",
      "type": "Löschungsankündigung",
      "state": "Sachsen-Anhalt",
      "amtsgericht": "Amtsgericht Stendal",
      "registernummer": "HRA 22360",
      "registerart": "HRA",
      "company_name": "WMS Flocktechnik GmbH & Co. KG",
      "company_seat": "Wolmirstedt",
      "details": "10.12.2024 (Bekanntmachungsdatum)\n\nSachsen-Anhalt Amtsgericht Stendal HRA 22360\nLöschungsankündigung 23.02.2024 (Eintragungsdatum)\n\nWMS Flocktechnik GmbH & Co. KG\nKommanditgesellschaft\nWolmirstedt\n\nDas Registergericht beabsichtigt, nachfolgende im Handelregister eingetragenen Firmen von Amts wegen nach § 394 FamFG zu löschen. Die Frist zu Erhebung eines Widerspruchs wird auf drei Monate festgesetzt."
    },
    {
      "date": "2024-12-10",
      "id": "95879",
      "original_text": "Registerbekanntmachung nach dem Umwandlungsgesetz\nBrandenburg Amtsgericht Potsdam HRB 24449\nBrenntag Vermögensmanagement GmbH – Zossen",
      "type": "Registerbekanntmachung nach dem Umwandlungsgesetz",
      "state": "Brandenburg",
      "amtsgericht": "Amtsgericht Potsdam",
      "registernummer": "HRB 24449",
      "registerart": "HRB",
      "company_name": "Brenntag Vermögensmanagement GmbH",
      "company_seat": "Zossen",
      "details": "10.12.2024 (Bekanntmachungsdatum)\n\nBrandenburg Amtsgericht Potsdam HRB 24449\nRegisterbekanntmachung nach dem Umwandlungsgesetz 07.12.2024 (Eintragungsdatum)\n\nBrenntag Vermögensmanagement GmbH\nGesellschaft mit beschränkter Haftung\nZossen\n\nZu Eintragungsnummer 13 vom 07.12.2024 wird als nicht eingetragen veröffentlicht:\nDen Gläubigern der an der Verschmelzung beteiligten Rechtsträger ist, wenn sie binnen sechs Monaten nach dem Tag, an dem die Eintragung der Verschmelzung in das Register des Sitzes desjenigen Rechtsträgers, dessen Gläubiger sie sind, als bekannt gemacht gilt, ihren Anspruch nach Grund und Höhe schriftlich anmelden, Sicherheit zu leisten, soweit sie nicht Befriedigung verlangen können. Dieses Recht steht den Gläubigern jedoch nur zu, wenn sie glaubhaft machen, dass durch die Verschmelzung die Erfüllung ihrer Forderung gefährdet wird"
    },
    {
      "date": "2024-12-10",
      "id": "95880",
      "original_text": "Registerbekanntmachung nach dem Umwandlungsgesetz\nBerlin Amtsgericht Berlin (Charlottenburg) HRB 63549\nSCHOLZ & FRIENDS Realisation Hub GmbH – Berlin",
      "type": "Registerbekanntmachung nach dem Umwandlungsgesetz",
      "state": "Berlin",
      "amtsgericht": "Amtsgericht Berlin (Charlottenburg)",
      "registernummer": "HRB 63549",
      "registerart": "HRB",
      "company_name": "SCHOLZ & FRIENDS Realisation Hub GmbH",
      "company_seat": "Berlin",
      "details": "10.12.2024 (Bekanntmachungsdatum)\n\nBerlin Amtsgericht Berlin (Charlottenburg) HRB 63549\nRegisterbekanntmachung nach dem Umwandlungsgesetz 09.12.2024 (Eintragungsdatum)\n\nSCHOLZ & FRIENDS Realisation Hub GmbH\nGesellschaft mit beschränkter Haftung\nBerlin\n\nZu Eintragungsnummer 21 vom 09.12.2024 wird als nicht eingetragen veröffentlicht: Den Gläubigern der an der Verschmelzung beteiligten Rechtsträger ist, wenn sie binnen sechs Monaten nach dem Tag, an dem die Eintragung der Verschmelzung in das Register des Sitzes desjenigen Rechtsträgers, dessen Gläubiger sie sind, als bekannt gemacht gilt, ihren Anspruch nach Grund und Höhe schriftlich anmelden, Sicherheit zu leisten, soweit sie nicht Befriedigung verlangen können. Dieses Recht steht den Gläubigern jedoch nur zu, wenn sie glaubhaft machen, dass durch die Verschmelzung die Erfüllung ihrer Forderung gefährdet wird. Das Recht, Sicherheitsleistung zu verlangen, steht Gläubigern nicht zu, die im Falle der Insolvenz ein Recht auf vorzugsweise Befriedigung aus einer Deckungsmasse haben, die nach gesetzlicher Vorschrift zu ihrem Schutz errichtet und staatlich überwacht ist."
    },
    {
      "date": "2024-12-10",
      "id": "95881",
      "original_text": "Registerbekanntmachung nach dem Umwandlungsgesetz\nBrandenburg Amtsgericht Cottbus HRB 12082\nKunz Holding GmbH – Schönefeld",
      "type": "Registerbekanntmachung nach dem Umwandlungsgesetz",
      "state": "Brandenburg",
      "amtsgericht": "Amtsgericht Cottbus",
      "registernummer": "HRB 12082",
      "registerart": "HRB",
      "company_name": "Kunz Holding GmbH",
      "company_seat": "Schönefeld",
      "details": "10.12.2024 (Bekanntmachungsdatum)\n\nBrandenburg Amtsgericht Cottbus HRB 12082\nRegisterbekanntmachung nach dem Umwandlungsgesetz 09.12.2024 (Eintragungsdatum)\n\nKunz Holding GmbH\nGesellschaft mit beschränkter Haftung\nSchönefeld\n\nZu Eintragungsnummer 7 vom 09.12.2024 wird als nicht eingetragen veröffentlicht:\nAls nicht eingetragen wird veröffentlicht:\nDen Gläubigern der an der Verschmelzung beteiligten Rechtsträger ist, wenn sie binnen sechs Monaten nach dem Tag, an dem die Eintragung der Verschmelzung in das Register des Sitzes desjenigen Rechtsträgers, dessen Gläubiger sie sind, als bekannt gemacht gilt, ihren Anspruch nach Grund und Höhe schriftlich anmelden, Sicherheit zu leisten, soweit sie nicht Befriedigung verlangen können. Dieses Recht steht den Gläubigern jedoch nur zu, wenn sie glaubhaft machen, dass durch die Verschmelzung die Erfüllung ihrer Forderung gefährdet wird"
    },
    {
      "date": "2024-12-10",
      "id": "95882",
      "original_text": "Einreichung neuer Dokumente\nSaarland Amtsgericht Saarbrücken HRB 108805\nMVZ Knappschaft Kliniken Süd GmbH – Püttlingen",
      "type": "Einreichung neuer Dokumente",
      "state": "Saarland",
      "amtsgericht": "Amtsgericht Saarbrücken",
      "registernummer": "HRB 108805",
      "registerart": "HRB",
      "company_name": "MVZ Knappschaft Kliniken Süd GmbH",
      "company_seat": "Püttlingen",
      "details": "10.12.2024 (Bekanntmachungsdatum)\n\nSaarland Amtsgericht Saarbrücken HRB 108805\nEinreichung neuer Dokumente\n\nMVZ Knappschaft Kliniken Süd GmbH\nGesellschaft mit beschränkter Haftung\nPüttlingen\n\nDie Geschäftsführung der Gesellschaft hat eine Liste der Mitglieder des Aufsichtsrats zum Handelsregister eingereicht (§ 52 Abs. 3 Satz 2 GmbHG)."
    },
    {
      "date": "2024-12-10",
      "id": "95883",
      "original_text": "Registerbekanntmachung nach dem Umwandlungsgesetz\nBaden-Württemberg Amtsgericht Ulm HRB 732466\nImle Sanierungen Aalen GmbH – Aalen",
      "type": "Registerbekanntmachung nach dem Umwandlungsgesetz",
      "state": "Baden-Württemberg",
      "amtsgericht": "Amtsgericht Ulm",
      "registernummer": "HRB 732466",
      "registerart": "HRB",
      "company_name": "Imle Sanierungen Aalen GmbH",
      "company_seat": "Aalen",
      "details": "10.12.2024 (Bekanntmachungsdatum)\n\nBaden-Württemberg Amtsgericht Ulm HRB 732466\nRegisterbekanntmachung nach dem Umwandlungsgesetz 10.12.2024 (Eintragungsdatum)\n\nImle Sanierungen Aalen GmbH\nGesellschaft mit beschränkter Haftung\nAalen\n\nAls nicht eingetragen wird bekanntgemacht:\nDen Gläubigern der an der Verschmelzung beteiligten Rechtsträger ist, wenn sie binnen sechs Monaten nach dem Tag, an dem die Eintragung der Verschmelzung in das Register des Sitzes desjenigen Rechtsträgers, dessen Gläubiger sie sind, nach § 19 Abs. 3 UmwG als bekanntgemacht gilt, ihren Anspruch nach Grund und Höhe schriftlich anmelden, Sicherheit zu leisten, soweit sie nicht Befriedigung verlangen können. Dieses Recht steht den Gläubigern jedoch nur zu, wenn sie glaubhaft machen, dass durch die Verschmelzung die Erfüllung ihrer Forderung gefährdet wird."
    },
    {
      "date": "2024-12-10",
      "id": "95884",
      "original_text": "Registerbekanntmachung nach dem Umwandlungsgesetz\nBaden-Württemberg Amtsgericht Ulm HRB 730584\nImle Sanierungen Ostalb GmbH – Heubach",
      "type": "Registerbekanntmachung nach dem Umwandlungsgesetz",
      "state": "Baden-Württemberg",
      "amtsgericht": "Amtsgericht Ulm",
      "registernummer": "HRB 730584",
      "registerart": "HRB",
      "company_name": "Imle Sanierungen Ostalb GmbH",
      "company_seat": "Heubach",
      "details": "10.12.2024 (Bekanntmachungsdatum)\n\nBaden-Württemberg Amtsgericht Ulm HRB 730584\nRegisterbekanntmachung nach dem Umwandlungsgesetz 10.12.2024 (Eintragungsdatum)\n\nImle Sanierungen Ostalb GmbH\nGesellschaft mit beschränkter Haftung\nHeubach\n\nAls nicht eingetragen wird bekanntgemacht:\nDen Gläubigern der an der Verschmelzung beteiligten Rechtsträger ist, wenn sie binnen sechs Monaten nach dem Tag, an dem die Eintragung der Verschmelzung in das Register des Sitzes desjenigen Rechtsträgers, dessen Gläubiger sie sind, nach § 19 Abs. 3 UmwG als bekanntgemacht gilt, ihren Anspruch nach Grund und Höhe schriftlich anmelden, Sicherheit zu leisten, soweit sie nicht Befriedigung verlangen können. Dieses Recht steht den Gläubigern jedoch nur zu, wenn sie glaubhaft machen, dass durch die Verschmelzung die Erfüllung ihrer Forderung gefährdet wird."
    },
    {
      "date": "2024-12-10",
      "id": "95885",
      "original_text": "Einreichung neuer Dokumente\nBerlin Amtsgericht Berlin (Charlottenburg) HRB 266369\nBerlin RE Assekuradeur AG – Berlin",
      "type": "Einreichung neuer Dokumente",
      "state": "Berlin",
      "amtsgericht": "Amtsgericht Berlin (Charlottenburg)",
      "registernummer": "HRB 266369",
      "registerart": "HRB",
      "company_name": "Berlin RE Assekuradeur AG",
      "company_seat": "Berlin",
      "details": "10.12.2024 (Bekanntmachungsdatum)\n\nBerlin Amtsgericht Berlin (Charlottenburg) HRB 266369\nEinreichung neuer Dokumente\n\nBerlin RE Assekuradeur AG\nAktiengesellschaft\nBerlin\n\nAls nicht eingetragen wird veröffentlicht:Es wurde eine neue Liste der Aufsichtsratsmitglieder eingereicht (§ 106 AktG)."
    },
    {
      "date": "2024-12-10",
      "id": "95886",
      "original_text": "Einreichung neuer Dokumente\nBrandenburg Amtsgericht Potsdam HRB 16858\ne.dialog Netz GmbH – Potsdam",
      "type": "Einreichung neuer Dokumente",
      "state": "Brandenburg",
      "amtsgericht": "Amtsgericht Potsdam",
      "registernummer": "HRB 16858",
      "registerart": "HRB",
      "company_name": "e.dialog Netz GmbH",
      "company_seat": "Potsdam",
      "details": "10.12.2024 (Bekanntmachungsdatum)\n\nBrandenburg Amtsgericht Potsdam HRB 16858\nEinreichung neuer Dokumente\n\ne.dialog Netz GmbH\nGesellschaft mit beschränkter Haftung\nPotsdam\n\nAls nicht eingetragen wird veröffentlicht: Eine Liste der Mitglieder des Aufsichtsrates wurde zum Handelsregister eingereicht."
    },
    {
      "date": "2024-12-10",
      "id": "95887",
      "original_text": "Löschungsankündigung\nBrandenburg Amtsgericht Potsdam HRB 11680\nT + R. W. Tief- + Rohrleitungsbau Wasser-Abwasser-GmbH – Stahnsdorf",
      "type": "Löschungsankündigung",
      "state": "Brandenburg",
      "amtsgericht": "Amtsgericht Potsdam",
      "registernummer": "HRB 11680",
      "registerart": "HRB",
      "company_name": "T + R. W. Tief- + Rohrleitungsbau Wasser-Abwasser-GmbH",
      "company_seat": "Stahnsdorf",
      "details": "10.12.2024 (Bekanntmachungsdatum)\n\nBrandenburg Amtsgericht Potsdam HRB 11680\nLöschungsankündigung\n\nT + R. W. Tief- + Rohrleitungsbau Wasser-Abwasser-GmbH\nGesellschaft mit beschränkter Haftung\nStahnsdorf\n\nBei der nachstehenden Gesellschaft wird das Amtslöschungsverfahren gemäß § 394 FamFG eingeleitet. Widerspruchsfrist: 8 Wochen."
    },
    {
      "date": "2024-12-10",
      "id": "95888",
      "original_text": "Löschungsankündigung\nHamburg Amtsgericht Hamburg HRB 101541\nATI Real Estate GmbH – Hamburg",
      "type": "Löschungsankündigung",
      "state": "Hamburg",
      "amtsgericht": "Amtsgericht Hamburg",
      "registernummer": "HRB 101541",
      "registerart": "HRB",
      "company_name": "ATI Real Estate GmbH",
      "company_seat": "Hamburg",
      "details": "10.12.2024 (Bekanntmachungsdatum)\n\nHamburg Amtsgericht Hamburg HRB 101541\nLöschungsankündigung\n\nATI Real Estate GmbH\nGesellschaft mit beschränkter Haftung\nHamburg\n\nDas Registergericht beabsichtigt, die im Handelsregister eingetragene Gesellschaft von Amts wegen nach § 394 FamFG zu löschen. Die Frist zur Erhebung eines Widerspruchs gegen die beabsichtigte Löschung wird auf 3 Monate festgesetzt."
    },
    {
      "date": "2024-12-10",
      "id": "95889",
      "original_text": "Löschungsankündigung\nHamburg Amtsgericht Hamburg HRB 118608\nAdversitement Deutschland GmbH – Hamburg",
      "type": "Löschungsankündigung",
      "state": "Hamburg",
      "amtsgericht": "Amtsgericht Hamburg",
      "registernummer": "HRB 118608",
      "registerart": "HRB",
      "company_name": "Adversitement Deutschland GmbH",
      "company_seat": "Hamburg",
      "details": "10.12.2024 (Bekanntmachungsdatum)\n\nHamburg Amtsgericht Hamburg HRB 118608\nLöschungsankündigung\n\nAdversitement Deutschland GmbH\nGesellschaft mit beschränkter Haftung\nHamburg\n\nDas Registergericht beabsichtigt, die im Handelsregister eingetragene Gesellschaft von Amts wegen nach § 394 FamFG zu löschen. Die Frist zur Erhebung eines Widerspruchs gegen die beabsichtigte Löschung wird auf 3 Monate festgesetzt."
    },
    {
      "date": "2024-12-10",
      "id": "95890",
      "original_text": "Löschungsankündigung\nHamburg Amtsgericht Hamburg HRB 138244\nAnti-Aging Gesundheits GmbH – Hamburg",
      "type": "Löschungsankündigung",
      "state": "Hamburg",
      "amtsgericht": "Amtsgericht Hamburg",
      "registernummer": "HRB 138244",
      "registerart": "HRB",
      "company_name": "Anti-Aging Gesundheits GmbH",
      "company_seat": "Hamburg",
      "details": "10.12.2024 (Bekanntmachungsdatum)\n\nHamburg Amtsgericht Hamburg HRB 138244\nLöschungsankündigung\n\nAnti-Aging Gesundheits GmbH\nGesellschaft mit beschränkter Haftung\nHamburg\n\nDas Registergericht beabsichtigt, die im Handelsregister eingetragene Gesellschaft von Amts wegen nach § 394 FamFG zu löschen. Die Frist zur Erhebung eines Widerspruchs gegen die beabsichtigte Löschung wird auf 3 Monate festgesetzt."
    },
    {
      "date": "2024-12-10",
      "id": "95891",
      "original_text": "Löschungsankündigung\nHamburg Amtsgericht Hamburg HRB 43589\nTD Texte & Daten Beratungsgesellschaft für Media-Marketing und elektronische Datenverarbeitung mbH – Hamburg",
      "type": "Löschungsankündigung",
      "state": "Hamburg",
      "amtsgericht": "Amtsgericht Hamburg",
      "registernummer": "HRB 43589",
      "registerart": "HRB",
      "company_name": "TD Texte & Daten Beratungsgesellschaft für Media-Marketing und elektronische Datenverarbeitung mbH",
      "company_seat": "Hamburg",
      "details": "10.12.2024 (Bekanntmachungsdatum)\n\nHamburg Amtsgericht Hamburg HRB 43589\nLöschungsankündigung\n\nTD Texte & Daten Beratungsgesellschaft für Media-Marketing und elektronische Datenverarbeitung mbH\nGesellschaft mit beschränkter Haftung\nHamburg\n\nDas Registergericht beabsichtigt, die im Handelsregister eingetragene Gesellschaft von Amts wegen nach § 394 FamFG zu löschen. Die Frist zur Erhebung eines Widerspruchs gegen die beabsichtigte Löschung wird auf 3 Monate festgesetzt."
    },
    {
      "date": "2024-12-10",
      "id": "95892",
      "original_text": "Löschungsankündigung\nHamburg Amtsgericht Hamburg HRB 112305\nBölter Hauswerkstatt RöWa UG (haftungsbeschränkt) – Hamburg",
      "type": "Löschungsankündigung",
      "state": "Hamburg",
      "amtsgericht": "Amtsgericht Hamburg",
      "registernummer": "HRB 112305",
      "registerart": "HRB",
      "company_name": "Bölter Hauswerkstatt RöWa UG (haftungsbeschränkt)",
      "company_seat": "Hamburg",
      "details": "10.12.2024 (Bekanntmachungsdatum)\n\nHamburg Amtsgericht Hamburg HRB 112305\nLöschungsankündigung\n\nBölter Hauswerkstatt RöWa UG (haftungsbeschränkt)\nGesellschaft mit beschränkter Haftung\nHamburg\n\nDas Registergericht beabsichtigt, die im Handelsregister eingetragene Gesellschaft von Amts wegen nach § 394 FamFG zu löschen. Die Frist zur Erhebung eines Widerspruchs gegen die beabsichtigte Löschung wird auf 3 Monate festgesetzt."
    },
    {
      "date": "2024-12-10",
      "id": "95893",
      "original_text": "Löschungsankündigung\nHamburg Amtsgericht Hamburg HRB 130353\nTELEZOO Media GmbH – Hamburg",
      "type": "Löschungsankündigung",
      "state": "Hamburg",
      "amtsgericht": "Amtsgericht Hamburg",
      "registernummer": "HRB 130353",
      "registerart": "HRB",
      "company_name": "TELEZOO Media GmbH",
      "company_seat": "Hamburg",
      "details": "10.12.2024 (Bekanntmachungsdatum)\n\nHamburg Amtsgericht Hamburg HRB 130353\nLöschungsankündigung\n\nTELEZOO Media GmbH\nGesellschaft mit beschränkter Haftung\nHamburg\n\nDas Registergericht beabsichtigt, die im Handelsregister eingetragene Gesellschaft von Amts wegen nach § 394 FamFG zu löschen. Die Frist zur Erhebung eines Widerspruchs gegen die beabsichtigte Löschung wird auf 3 Monate festgesetzt."
    },
    {
      "date": "2024-12-10",
      "id": "95894",
      "original_text": "Löschungsankündigung\nHamburg Amtsgericht Hamburg HRB 141908\nSofia Tang GmbH – Hamburg",
      "type": "Löschungsankündigung",
      "state": "Hamburg",
      "amtsgericht": "Amtsgericht Hamburg",
      "registernummer": "HRB 141908",
      "registerart": "HRB",
      "company_name": "Sofia Tang GmbH",
      "company_seat": "Hamburg",
      "details": "10.12.2024 (Bekanntmachungsdatum)\n\nHamburg Amtsgericht Hamburg HRB 141908\nLöschungsankündigung\n\nSofia Tang GmbH\nGesellschaft mit beschränkter Haftung\nHamburg\n\nDas Registergericht beabsichtigt, die im Handelsregister eingetragene Gesellschaft von Amts wegen nach § 394 FamFG zu löschen. Die Frist zur Erhebung eines Widerspruchs gegen die beabsichtigte Löschung wird auf 3 Monate festgesetzt."
    },
    {
      "date": "2024-12-10",
      "id": "95895",
      "original_text": "Löschungsankündigung\nMecklenburg-Vorpommern Amtsgericht Stralsund HRB 22038\nAutohaus Hermann UG (haftungsbeschränkt) – Greifswald",
      "type": "Löschungsankündigung",
      "state": "Mecklenburg-Vorpommern",
      "amtsgericht": "Amtsgericht Stralsund",
      "registernummer": "HRB 22038",
      "registerart": "HRB",
      "company_name": "Autohaus Hermann UG (haftungsbeschränkt)",
      "company_seat": "Greifswald",
      "details": "10.12.2024 (Bekanntmachungsdatum)\n\nMecklenburg-Vorpommern Amtsgericht Stralsund HRB 22038\nLöschungsankündigung\n\nAutohaus Hermann UG (haftungsbeschränkt)\nGesellschaft mit beschränkter Haftung\nGreifswald\n\nDas Registergericht beabsichtigt, die im Handelsregister eingetragene Gesellschaft von Amts wegen nach § 394 FamFG zu löschen. Die Frist zur Erhebung eines Widerspruchs gegen die beabsichtigte Löschung wird auf 1 Monat festgesetzt."
    },
    {
      "date": "2024-12-10",
      "id": "95896",
      "original_text": "Löschungsankündigung\nSchleswig-Holstein Amtsgericht Kiel HRA 1997\nSchöttke & Siebecke GmbH & Co. KG – Kiel",
      "type": "Löschungsankündigung",
      "state": "Schleswig-Holstein",
      "amtsgericht": "Amtsgericht Kiel",
      "registernummer": "HRA 1997",
      "registerart": "HRA",
      "company_name": "Schöttke & Siebecke GmbH & Co. KG",
      "company_seat": "Kiel",
      "details": "10.12.2024 (Bekanntmachungsdatum)\n\nSchleswig-Holstein Amtsgericht Kiel HRA 1997\nLöschungsankündigung\n\nSchöttke & Siebecke GmbH & Co. KG\nKommanditgesellschaft\nKiel\n\nBei der nachstehenden Firma wird das Amtslöschungsverfahren gemäß § 31 Abs. 2 HGB eingeleitet. Widerspruchsfrist: 2 Monate."
    },
    {
      "date": "2024-12-10",
      "id": "95897",
      "original_text": "Löschungsankündigung\nHamburg Amtsgericht Hamburg HRB 143040\nRestaurant Safran Hamburg UG (haftungsbeschränkt) – Hamburg",
      "type": "Löschungsankündigung",
      "state": "Hamburg",
      "amtsgericht": "Amtsgericht Hamburg",
      "registernummer": "HRB 143040",
      "registerart": "HRB",
      "company_name": "Restaurant Safran Hamburg UG (haftungsbeschränkt)",
      "company_seat": "Hamburg",
      "details": "10.12.2024 (Bekanntmachungsdatum)\n\nHamburg Amtsgericht Hamburg HRB 143040\nLöschungsankündigung\n\nRestaurant Safran Hamburg UG (haftungsbeschränkt)\nGesellschaft mit beschränkter Haftung\nHamburg\n\nDas Registergericht beabsichtigt, die im Handelsregister eingetragene Gesellschaft von Amts wegen nach § 394 FamFG zu löschen. Die Frist zur Erhebung eines Widerspruchs gegen die beabsichtigte Löschung wird auf 3 Monate festgesetzt."
    },
    {
      "date": "2024-12-10",
      "id": "95898",
      "original_text": "Löschungsankündigung\nHamburg Amtsgericht Hamburg HRB 151592\nHaKuDi Hanseatische Kundendienste GmbH – Hamburg",
      "type": "Löschungsankündigung",
      "state": "Hamburg",
      "amtsgericht": "Amtsgericht Hamburg",
      "registernummer": "HRB 151592",
      "registerart": "HRB",
      "company_name": "HaKuDi Hanseatische Kundendienste GmbH",
      "company_seat": "Hamburg",
      "details": "10.12.2024 (Bekanntmachungsdatum)\n\nHamburg Amtsgericht Hamburg HRB 151592\nLöschungsankündigung\n\nHaKuDi Hanseatische Kundendienste GmbH\nGesellschaft mit beschränkter Haftung\nHamburg\n\nDas Registergericht beabsichtigt, die im Handelsregister eingetragene Gesellschaft von Amts wegen nach § 394 FamFG zu löschen. Die Frist zur Erhebung eines Widerspruchs gegen die beabsichtigte Löschung wird auf 3 Monate festgesetzt."
    },
    {
      "date": "2024-12-10",
      "id": "95899",
      "original_text": "Löschungsankündigung\nHamburg Amtsgericht Hamburg HRB 162567\nAdAstra Uno UG (haftungsbeschränkt) – Hamburg",
      "type": "Löschungsankündigung",
      "state": "Hamburg",
      "amtsgericht": "Amtsgericht Hamburg",
      "registernummer": "HRB 162567",
      "registerart": "HRB",
      "company_name": "AdAstra Uno UG (haftungsbeschränkt)",
      "company_seat": "Hamburg",
      "details": "10.12.2024 (Bekanntmachungsdatum)\n\nHamburg Amtsgericht Hamburg HRB 162567\nLöschungsankündigung\n\nAdAstra Uno UG (haftungsbeschränkt)\nGesellschaft mit beschränkter Haftung\nHamburg\n\nDas Registergericht beabsichtigt, die im Handelsregister eingetragene Gesellschaft von Amts wegen nach § 394 FamFG zu löschen. Die Frist zur Erhebung eines Widerspruchs gegen die beabsichtigte Löschung wird auf 3 Monate festgesetzt."
    },
    {
      "date": "2024-12-10",
      "id": "95900",
      "original_text": "Löschungsankündigung\nHamburg Amtsgericht Hamburg HRB 175277\nStefanov Unternehmer UG (haftungsbeschränkt) – Hamburg",
      "type": "Löschungsankündigung",
      "state": "Hamburg",
      "amtsgericht": "Amtsgericht Hamburg",
      "registernummer": "HRB 175277",
      "registerart": "HRB",
      "company_name": "Stefanov Unternehmer UG (haftungsbeschränkt)",
      "company_seat": "Hamburg",
      "details": "10.12.2024 (Bekanntmachungsdatum)\n\nHamburg Amtsgericht Hamburg HRB 175277\nLöschungsankündigung\n\nStefanov Unternehmer UG (haftungsbeschränkt)\nGesellschaft mit beschränkter Haftung\nHamburg\n\nDas Registergericht beabsichtigt, die im Handelsregister eingetragene Gesellschaft von Amts wegen nach § 394 FamFG zu löschen. Die Frist zur Erhebung eines Widerspruchs gegen die beabsichtigte Löschung wird auf 3 Monate festgesetzt."
    },
    {
      "date": "2024-12-10",
      "id": "95901",
      "original_text": "Löschungsankündigung\nHamburg Amtsgericht Hamburg HRB 178055\nAEM Neumann UG (haftungsbeschränkt) – Hamburg",
      "type": "Löschungsankündigung",
      "state": "Hamburg",
      "amtsgericht": "Amtsgericht Hamburg",
      "registernummer": "HRB 178055",
      "registerart": "HRB",
      "company_name": "AEM Neumann UG (haftungsbeschränkt)",
      "company_seat": "Hamburg",
      "details": "10.12.2024 (Bekanntmachungsdatum)\n\nHamburg Amtsgericht Hamburg HRB 178055\nLöschungsankündigung\n\nAEM Neumann UG (haftungsbeschränkt)\nGesellschaft mit beschränkter Haftung\nHamburg\n\nDas Registergericht beabsichtigt, die im Handelsregister eingetragene Gesellschaft von Amts wegen nach § 394 FamFG zu löschen. Die Frist zur Erhebung eines Widerspruchs gegen die beabsichtigte Löschung wird auf 3 Monate festgesetzt."
    },
    {
      "date": "2024-12-10",
      "id": "95902",
      "original_text": "Löschungsankündigung\nHamburg Amtsgericht Hamburg HRB 184336\nHambergh GmbH – Hamburg",
      "type": "Löschungsankündigung",
      "state": "Hamburg",
      "amtsgericht": "Amtsgericht Hamburg",
      "registernummer": "HRB 184336",
      "registerart": "HRB",
      "company_name": "Hambergh GmbH",
      "company_seat": "Hamburg",
      "details": "10.12.2024 (Bekanntmachungsdatum)\n\nHamburg Amtsgericht Hamburg HRB 184336\nLöschungsankündigung\n\nHambergh GmbH\nGesellschaft mit beschränkter Haftung\nHamburg\n\nDas Registergericht beabsichtigt, die im Handelsregister eingetragene Gesellschaft von Amts wegen nach § 394 FamFG zu löschen. Die Frist zur Erhebung eines Widerspruchs gegen die beabsichtigte Löschung wird auf 3 Monate festgesetzt."
    },
    {
      "date": "2024-12-10",
      "id": "95903",
      "original_text": "Löschungsankündigung\nHamburg Amtsgericht Hamburg HRB 170770\nAcar Bau GmbH – Hamburg",
      "type": "Löschungsankündigung",
      "state": "Hamburg",
      "amtsgericht": "Amtsgericht Hamburg",
      "registernummer": "HRB 170770",
      "registerart": "HRB",
      "company_name": "Acar Bau GmbH",
      "company_seat": "Hamburg",
      "details": "10.12.2024 (Bekanntmachungsdatum)\n\nHamburg Amtsgericht Hamburg HRB 170770\nLöschungsankündigung\n\nAcar Bau GmbH\nGesellschaft mit beschränkter Haftung\nHamburg\n\nDas Registergericht beabsichtigt, die im Handelsregister eingetragene Gesellschaft von Amts wegen nach § 394 FamFG zu löschen. Die Frist zur Erhebung eines Widerspruchs gegen die beabsichtigte Löschung wird auf 3 Monate festgesetzt."
    },
    {
      "date": "2024-12-10",
      "id": "95904",
      "original_text": "Löschungsankündigung\nHamburg Amtsgericht Hamburg HRB 175986\nABOARD Dienstleistungen GmbH – Hamburg",
      "type": "Löschungsankündigung",
      "state": "Hamburg",
      "amtsgericht": "Amtsgericht Hamburg",
      "registernummer": "HRB 175986",
      "registerart": "HRB",
      "company_name": "ABOARD Dienstleistungen GmbH",
      "company_seat": "Hamburg",
      "details": "10.12.2024 (Bekanntmachungsdatum)\n\nHamburg Amtsgericht Hamburg HRB 175986\nLöschungsankündigung\n\nABOARD Dienstleistungen GmbH\nGesellschaft mit beschränkter Haftung\nHamburg\n\nDas Registergericht beabsichtigt, die im Handelsregister eingetragene Gesellschaft von Amts wegen nach § 394 FamFG zu löschen. Die Frist zur Erhebung eines Widerspruchs gegen die beabsichtigte Löschung wird auf 3 Monate festgesetzt."
    },
    {
      "date": "2024-12-10",
      "id": "95905",
      "original_text": "Löschungsankündigung\nHamburg Amtsgericht Hamburg HRB 183875\nTESSI GmbH – Hamburg",
      "type": "Löschungsankündigung",
      "state": "Hamburg",
      "amtsgericht": "Amtsgericht Hamburg",
      "registernummer": "HRB 183875",
      "registerart": "HRB",
      "company_name": "TESSI GmbH",
      "company_seat": "Hamburg",
      "details": "10.12.2024 (Bekanntmachungsdatum)\n\nHamburg Amtsgericht Hamburg HRB 183875\nLöschungsankündigung\n\nTESSI GmbH\nGesellschaft mit beschränkter Haftung\nHamburg\n\nDas Registergericht beabsichtigt, die im Handelsregister eingetragene Gesellschaft von Amts wegen nach § 394 FamFG zu löschen. Die Frist zur Erhebung eines Widerspruchs gegen die beabsichtigte Löschung wird auf 3 Monate festgesetzt."
    },
    {
      "date": "2024-12-10",
      "id": "95906",
      "original_text": "Löschungsankündigung\nHamburg Amtsgericht Hamburg HRB 142896\nDie Futuristen GmbH – Hamburg",
      "type": "Löschungsankündigung",
      "state": "Hamburg",
      "amtsgericht": "Amtsgericht Hamburg",
      "registernummer": "HRB 142896",
      "registerart": "HRB",
      "company_name": "Die Futuristen GmbH",
      "company_seat": "Hamburg",
      "details": "10.12.2024 (Bekanntmachungsdatum)\n\nHamburg Amtsgericht Hamburg HRB 142896\nLöschungsankündigung\n\nDie Futuristen GmbH\nGesellschaft mit beschränkter Haftung\nHamburg\n\nDas Registergericht beabsichtigt, die im Handelsregister eingetragene Gesellschaft von Amts wegen nach § 394 FamFG zu löschen. Die Frist zur Erhebung eines Widerspruchs gegen die beabsichtigte Löschung wird auf 3 Monate festgesetzt."
    },
    {
      "date": "2024-12-10",
      "id": "95907",
      "original_text": "Löschungsankündigung\nHamburg Amtsgericht Hamburg HRA 96092\nSchiffahrts-Gesellschaft \"HS Livingstone\" mbH & Co. KG – Hamburg",
      "type": "Löschungsankündigung",
      "state": "Hamburg",
      "amtsgericht": "Amtsgericht Hamburg",
      "registernummer": "HRA 96092",
      "registerart": "HRA",
      "company_name": "Schiffahrts-Gesellschaft \"HS Livingstone\" mbH & Co. KG",
      "company_seat": "Hamburg",
      "details": "10.12.2024 (Bekanntmachungsdatum)\n\nHamburg Amtsgericht Hamburg HRA 96092\nLöschungsankündigung\n\nSchiffahrts-Gesellschaft \"HS Livingstone\" mbH & Co. KG\nKommanditgesellschaft\nHamburg\n\nDas Registergericht beabsichtigt, die im Handelsregister eingetragene Firma von Amts wegen nach § 31 Abs. 2 HGB zu löschen. Die Frist zur Erhebung eines Widerspruchs gegen die beabsichtigte Löschung wird auf 3 Monate festgesetzt."
    },
    {
      "date": "2024-12-10",
      "id": "95908",
      "original_text": "Löschungsankündigung\nHamburg Amtsgericht Hamburg HRB 162489\nAmc Alster GmbH – Hamburg",
      "type": "Löschungsankündigung",
      "state": "Hamburg",
      "amtsgericht": "Amtsgericht Hamburg",
      "registernummer": "HRB 162489",
      "registerart": "HRB",
      "company_name": "Amc Alster GmbH",
      "company_seat": "Hamburg",
      "details": "10.12.2024 (Bekanntmachungsdatum)\n\nHamburg Amtsgericht Hamburg HRB 162489\nLöschungsankündigung\n\nAmc Alster GmbH\nGesellschaft mit beschränkter Haftung\nHamburg\n\nDas Registergericht beabsichtigt, die im Handelsregister eingetragene Gesellschaft von Amts wegen nach § 394 FamFG zu löschen. Die Frist zur Erhebung eines Widerspruchs gegen die beabsichtigte Löschung wird auf 3 Monate festgesetzt."
    },
    {
      "date": "2024-12-10",
      "id": "95909",
      "original_text": "Einreichung neuer Dokumente\nSaarland Amtsgericht Saarbrücken HRB 81107\nKDT Kommunale Dienste Tholey GmbH – Tholey",
      "type": "Einreichung neuer Dokumente",
      "state": "Saarland",
      "amtsgericht": "Amtsgericht Saarbrücken",
      "registernummer": "HRB 81107",
      "registerart": "HRB",
      "company_name": "KDT Kommunale Dienste Tholey GmbH",
      "company_seat": "Tholey",
      "details": "10.12.2024 (Bekanntmachungsdatum)\n\nSaarland Amtsgericht Saarbrücken HRB 81107\nEinreichung neuer Dokumente\n\nKDT Kommunale Dienste Tholey GmbH\nGesellschaft mit beschränkter Haftung\nTholey\n\nDie Geschäftsführung der Gesellschaft hat eine Liste der Mitglieder des Aufsichtsrats zum Handelsregister eingereicht (§ 52 Abs. 3 Satz 2 GmbHG)."
    },
    {
      "date": "2024-12-10",
      "id": "95910",
      "original_text": "Einreichung neuer Dokumente\nBaden-Württemberg Amtsgericht Mannheim HRB 718120\nCamelot Management Consultants AG – Mannheim",
      "type": "Einreichung neuer Dokumente",
      "state": "Baden-Württemberg",
      "amtsgericht": "Amtsgericht Mannheim",
      "registernummer": "HRB 718120",
      "registerart": "HRB",
      "company_name": "Camelot Management Consultants AG",
      "company_seat": "Mannheim",
      "details": "10.12.2024 (Bekanntmachungsdatum)\n\nBaden-Württemberg Amtsgericht Mannheim HRB 718120\nEinreichung neuer Dokumente 10.12.2024 (Eintragungsdatum)\n\nCamelot Management Consultants AG\nAktiengesellschaft\nMannheim\n\nDie Gesellschaft hat am 20.11.2024 die Liste über die Zusammensetzung des Aufsichtsrats zum Handelsregister eingereicht."
    },
    {
      "date": "2024-12-10",
      "id": "95911",
      "original_text": "Einreichung neuer Dokumente\nBerlin Amtsgericht Berlin (Charlottenburg) HRB 236454\nQ Energy Solutions SE – Berlin",
      "type": "Einreichung neuer Dokumente",
      "state": "Berlin",
      "amtsgericht": "Amtsgericht Berlin (Charlottenburg)",
      "registernummer": "HRB 236454",
      "registerart": "HRB",
      "company_name": "Q Energy Solutions SE",
      "company_seat": "Berlin",
      "details": "10.12.2024 (Bekanntmachungsdatum)\n\nBerlin Amtsgericht Berlin (Charlottenburg) HRB 236454\nEinreichung neuer Dokumente\n\nQ Energy Solutions SE\nEuropäische Aktiengesellschaft (SE)\nBerlin\n\nAls nicht eingetragen wird veröffentlicht: Es wurde eine neue Liste der Aufsichtsratsmitglieder eingereicht (§ 106 AktG)."
    },
    {
      "date": "2024-12-10",
      "id": "95912",
      "original_text": "Löschungsankündigung\nHamburg Amtsgericht Hamburg HRB 100320\nVerwaltung MS Courier GmbH – Hamburg",
      "type": "Löschungsankündigung",
      "state": "Hamburg",
      "amtsgericht": "Amtsgericht Hamburg",
      "registernummer": "HRB 100320",
      "registerart": "HRB",
      "company_name": "Verwaltung MS Courier GmbH",
      "company_seat": "Hamburg",
      "details": "10.12.2024 (Bekanntmachungsdatum)\n\nHamburg Amtsgericht Hamburg HRB 100320\nLöschungsankündigung\n\nVerwaltung MS Courier GmbH\nGesellschaft mit beschränkter Haftung\nHamburg\n\nDas Registergericht beabsichtigt, die im Handelsregister eingetragene Gesellschaft von Amts wegen nach § 394 FamFG zu löschen. Die Frist zur Erhebung eines Widerspruchs gegen die beabsichtigte Löschung wird auf 3 Monate festgesetzt."
    },
    {
      "date": "2024-12-10",
      "id": "95913",
      "original_text": "Löschungsankündigung\nHamburg Amtsgericht Hamburg HRA 115014\nLuxini Hamburg e.K. – Hamburg",
      "type": "Löschungsankündigung",
      "state": "Hamburg",
      "amtsgericht": "Amtsgericht Hamburg",
      "registernummer": "HRA 115014",
      "registerart": "HRA",
      "company_name": "Luxini Hamburg e.K.",
      "company_seat": "Hamburg",
      "details": "10.12.2024 (Bekanntmachungsdatum)\n\nHamburg Amtsgericht Hamburg HRA 115014\nLöschungsankündigung\n\nLuxini Hamburg e.K.\nEinzelkaufmann\nHamburg\n\nDas Registergericht beabsichtigt, die im Handelsregister eingetragene Firma von Amts wegen nach § 31 Abs. 2 HGB zu löschen. Die Frist zur Erhebung eines Widerspruchs gegen die beabsichtigte Löschung wird auf 3 Monate festgesetzt."
    },
    {
      "date": "2024-12-10",
      "id": "95914",
      "original_text": "Löschungsankündigung\nHamburg Amtsgericht Hamburg HRA 112711\nSchifffahrtsgesellschaft MS \"Egernsund\" mbH & Co. KG i.L. – Hamburg",
      "type": "Löschungsankündigung",
      "state": "Hamburg",
      "amtsgericht": "Amtsgericht Hamburg",
      "registernummer": "HRA 112711",
      "registerart": "HRA",
      "company_name": "Schifffahrtsgesellschaft MS \"Egernsund\" mbH & Co. KG i.L.",
      "company_seat": "Hamburg",
      "details": "10.12.2024 (Bekanntmachungsdatum)\n\nHamburg Amtsgericht Hamburg HRA 112711\nLöschungsankündigung\n\nSchifffahrtsgesellschaft MS \"Egernsund\" mbH & Co. KG i.L.\nKommanditgesellschaft\nHamburg\n\nDas Registergericht beabsichtigt, die im Handelsregister eingetragene Firma von Amts wegen nach § 31 Abs. 2 HGB zu löschen. Die Frist zur Erhebung eines Widerspruchs gegen die beabsichtigte Löschung wird auf 3 Monate festgesetzt."
    },
    {
      "date": "2024-12-10",
      "id": "95915",
      "original_text": "Löschungsankündigung\nHamburg Amtsgericht Hamburg VR 22552\nGenau e.V. – Hamburg",
      "type": "Löschungsankündigung",
      "state": "Hamburg",
      "amtsgericht": "Amtsgericht Hamburg",
      "registernummer": "VR 22552",
      "registerart": "VR",
      "company_name": "Genau e.V.",
      "company_seat": "Hamburg",
      "details": "10.12.2024 (Bekanntmachungsdatum)\n\nHamburg Amtsgericht Hamburg VR 22552\nLöschungsankündigung\n\nGenau e.V.\neingetragener Verein\nHamburg\n\nDas Registergericht beabsichtigt, den im Vereinsregister eingetragenen Verein von Amts wegen nach § 395 FamFG zu löschen, da nach den angestellten Ermittlungen dieser Verein offenbar nicht mehr besteht. Die Frist zur Erhebung eines Widerspruchs gegen die beabsichtigte Löschung wird auf 3 Monate festgesetzt."
    },
    {
      "date": "2024-12-10",
      "id": "95916",
      "original_text": "Registerbekanntmachung nach dem Umwandlungsgesetz\nBerlin Amtsgericht Berlin (Charlottenburg) HRB 162900\nGerman Investment Management Holding GmbH – Berlin",
      "type": "Registerbekanntmachung nach dem Umwandlungsgesetz",
      "state": "Berlin",
      "amtsgericht": "Amtsgericht Berlin (Charlottenburg)",
      "registernummer": "HRB 162900",
      "registerart": "HRB",
      "company_name": "German Investment Management Holding GmbH",
      "company_seat": "Berlin",
      "details": "10.12.2024 (Bekanntmachungsdatum)\n\nBerlin Amtsgericht Berlin (Charlottenburg) HRB 162900\nRegisterbekanntmachung nach dem Umwandlungsgesetz 09.12.2024 (Eintragungsdatum)\n\nGerman Investment Management Holding GmbH\nGesellschaft mit beschränkter Haftung\nBerlin\n\nZu Eintragungsnummer 16 vom 09.12.2024 wird als nicht eingetragen veröffentlicht:\n\nDen Gläubigern ist, wenn sie binnen sechs Monaten nach dem Tag, an dem die Eintragung der Umwandlung als bekannt gemacht gilt, ihren Anspruch nach Grund und Höhe schriftlich anmelden, Sicherheit zu leisten, soweit sie nicht Befriedigung verlangen können. Dieses Recht steht den Gläubigern jedoch nur zu, wenn sie glaubhaft machen, dass durch die Umwandlung die Erfüllung ihrer Forderung gefährdet wird. Das Recht, Sicherheitsleistung zu verlangen, steht Gläubigern nicht zu, die im Falle der Insolvenz ein Recht auf vorzugsweise Befriedigung aus einer Deckungsmasse haben, die nach gesetzlicher Vorschrift zu ihrem Schutz errichtet und staatlich überwacht ist."
    },
    {
      "date": "2024-12-10",
      "id": "95917",
      "original_text": "Einreichung neuer Dokumente\nBerlin Amtsgericht Berlin (Charlottenburg) HRB 81404\nDB Zeitarbeit GmbH – Berlin",
      "type": "Einreichung neuer Dokumente",
      "state": "Berlin",
      "amtsgericht": "Amtsgericht Berlin (Charlottenburg)",
      "registernummer": "HRB 81404",
      "registerart": "HRB",
      "company_name": "DB Zeitarbeit GmbH",
      "company_seat": "Berlin",
      "details": "10.12.2024 (Bekanntmachungsdatum)\n\nBerlin Amtsgericht Berlin (Charlottenburg) HRB 81404\nEinreichung neuer Dokumente\n\nDB Zeitarbeit GmbH\nGesellschaft mit beschränkter Haftung\nBerlin\n\nAls nicht eingetragen wird veröffentlicht: Es wurde eine neue Liste der Aufsichtsratsmitglieder eingereicht (§52 GmbHG)."
    },
    {
      "date": "2024-12-10",
      "id": "95918",
      "original_text": "Einreichung neuer Dokumente\nSaarland Amtsgericht Saarbrücken HRB 10508\nEVS Gesellschaft für Abfallverwertungsanlagen mbH (EVS GAV mbH) – Saarbrücken",
      "type": "Einreichung neuer Dokumente",
      "state": "Saarland",
      "amtsgericht": "Amtsgericht Saarbrücken",
      "registernummer": "HRB 10508",
      "registerart": "HRB",
      "company_name": "EVS Gesellschaft für Abfallverwertungsanlagen mbH (EVS GAV mbH)",
      "company_seat": "Saarbrücken",
      "details": "10.12.2024 (Bekanntmachungsdatum)\n\nSaarland Amtsgericht Saarbrücken HRB 10508\nEinreichung neuer Dokumente\n\nEVS Gesellschaft für Abfallverwertungsanlagen mbH (EVS GAV mbH)\nGesellschaft mit beschränkter Haftung\nSaarbrücken\n\nDie Geschäftsführung der Gesellschaft hat eine Liste der Mitglieder des Aufsichtsrats zum Handelsregister eingereicht (§ 52 Abs. 3 Satz 2 GmbHG)."
    },
    {
      "date": "2024-12-10",
      "id": "95919",
      "original_text": "Registerbekanntmachung nach dem Umwandlungsgesetz\nSchleswig-Holstein Amtsgericht Pinneberg HRB 15629\nThe Quality Group GmbH – Elmshorn",
      "type": "Registerbekanntmachung nach dem Umwandlungsgesetz",
      "state": "Schleswig-Holstein",
      "amtsgericht": "Amtsgericht Pinneberg",
      "registernummer": "HRB 15629",
      "registerart": "HRB",
      "company_name": "The Quality Group GmbH",
      "company_seat": "Elmshorn",
      "details": "10.12.2024 (Bekanntmachungsdatum)\n\nSchleswig-Holstein Amtsgericht Pinneberg HRB 15629\nRegisterbekanntmachung nach dem Umwandlungsgesetz 09.12.2024 (Eintragungsdatum)\n\nThe Quality Group GmbH\nGesellschaft mit beschränkter Haftung\nElmshorn\n\nZu Eintragungsnummer 16 vom 09.12.2024 wird als nicht eingetragen veröffentlicht: Den Gläubigern der an der Verschmelzung beteiligten Rechtsträger ist, wenn sie binnen sechs Monaten nach dem Tag, an dem die Eintragung der Verschmelzung in das Register des Sitzes desjenigen Rechtsträgers, dessen Gläubiger sie sind, als bekannt gemacht gilt, ihren Anspruch nach Grund und Höhe schriftlich anmelden, Sicherheit zu leisten, soweit sie nicht Befriedigung verlangen können. Dieses Recht steht den Gläubigern jedoch nur zu, wenn sie glaubhaft machen, dass durch die Verschmelzung die Erfüllung ihrer Forderung gefährdet wird. Das Recht, Sicherheitsleistung zu verlangen, steht Gläubigern nicht zu, die im Falle der Insolvenz ein Recht auf vorzugsweise Befriedigung aus einer Deckungsmasse haben, die nach gesetzlicher Vorschrift zu ihrem Schutz errichtet und staatlich überwacht ist."
    },
    {
      "date": "2024-12-10",
      "id": "95920",
      "original_text": "Registerbekanntmachung nach dem Umwandlungsgesetz\nHamburg Amtsgericht Hamburg HRB 57624\n\"Blane\" Industriebeteiligung GmbH – Hamburg",
      "type": "Registerbekanntmachung nach dem Umwandlungsgesetz",
      "state": "Hamburg",
      "amtsgericht": "Amtsgericht Hamburg",
      "registernummer": "HRB 57624",
      "registerart": "HRB",
      "company_name": "\"Blane\" Industriebeteiligung GmbH",
      "company_seat": "Hamburg",
      "details": "10.12.2024 (Bekanntmachungsdatum)\n\nHamburg Amtsgericht Hamburg HRB 57624\nRegisterbekanntmachung nach dem Umwandlungsgesetz 10.12.2024 (Eintragungsdatum)\n\n\"Blane\" Industriebeteiligung GmbH\nGesellschaft mit beschränkter Haftung\nHamburg\n\nAls nicht eingetragen wird bekannt gemacht:\nDen Gläubigern der an der Verschmelzung beteiligten Gesellschaften ist, wenn sie binnen sechs Monaten nach dem Tag, an dem die Eintragung der Verschmelzung in das Register des Sitzes derjenigen Rechtsträger deren Gläubiger sie sind, nach § 19 Absatz 3 UmwG als bekannt gemacht gilt, ihren Anspruch nach Grund und Höhe schriftlich anmelden, Sicherheit zu leisten, soweit sie nicht Befriedigung verlangen können. Dieses Recht steht den Gläubigern jedoch nur zu, wenn sie glaubhaft machen, dass durch die Verschmelzung die Erfüllung ihrer Forderung gefährdet wird."
    },
    {
      "date": "2024-12-10",
      "id": "95921",
      "original_text": "Einreichung neuer Dokumente\nSaarland Amtsgericht Saarbrücken HRB 347\nHydac Technology GmbH – Sulzbach",
      "type": "Einreichung neuer Dokumente",
      "state": "Saarland",
      "amtsgericht": "Amtsgericht Saarbrücken",
      "registernummer": "HRB 347",
      "registerart": "HRB",
      "company_name": "Hydac Technology GmbH",
      "company_seat": "Sulzbach",
      "details": "10.12.2024 (Bekanntmachungsdatum)\n\nSaarland Amtsgericht Saarbrücken HRB 347\nEinreichung neuer Dokumente\n\nHydac Technology GmbH\nGesellschaft mit beschränkter Haftung\nSulzbach\n\nDie Geschäftsführung der Gesellschaft hat eine Liste der Mitglieder des Beirats zum Handelsregister eingereicht (§ 52 Abs. 3 Satz 2 GmbHG)."
    },
    {
      "date": "2024-12-10",
      "id": "95922",
      "original_text": "Einreichung neuer Dokumente\nSaarland Amtsgericht Saarbrücken HRB 948\nHYDAC International GmbH – Sulzbach/Saar",
      "type": "Einreichung neuer Dokumente",
      "state": "Saarland",
      "amtsgericht": "Amtsgericht Saarbrücken",
      "registernummer": "HRB 948",
      "registerart": "HRB",
      "company_name": "HYDAC International GmbH",
      "company_seat": "Sulzbach/Saar",
      "details": "10.12.2024 (Bekanntmachungsdatum)\n\nSaarland Amtsgericht Saarbrücken HRB 948\nEinreichung neuer Dokumente\n\nHYDAC International GmbH\nGesellschaft mit beschränkter Haftung\nSulzbach/Saar\n\nDie Geschäftsführung der Gesellschaft hat eine Liste der Mitglieder des Beirats zum Handelsregister eingereicht (§ 52 Abs. 3 Satz 2 GmbHG)."
    },
    {
      "date": "2024-12-10",
      "id": "95923",
      "original_text": "Einreichung neuer Dokumente\nSaarland Amtsgericht Saarbrücken HRB 349\nHydac Filtertechnik GmbH – Sulzbach/Saar",
      "type": "Einreichung neuer Dokumente",
      "state": "Saarland",
      "amtsgericht": "Amtsgericht Saarbrücken",
      "registernummer": "HRB 349",
      "registerart": "HRB",
      "company_name": "Hydac Filtertechnik GmbH",
      "company_seat": "Sulzbach/Saar",
      "details": "10.12.2024 (Bekanntmachungsdatum)\n\nSaarland Amtsgericht Saarbrücken HRB 349\nEinreichung neuer Dokumente\n\nHydac Filtertechnik GmbH\nGesellschaft mit beschränkter Haftung\nSulzbach/Saar\n\nDie Geschäftsführung der Gesellschaft hat eine Liste der Mitglieder des Beirats zum Handelsregister eingereicht (§ 52 Abs. 3 Satz 2 GmbHG)."
    },
    {
      "date": "2024-12-10",
      "id": "95924",
      "original_text": "Registerbekanntmachung nach dem Umwandlungsgesetz\nBrandenburg Amtsgericht Potsdam HRA 8346\nDer Lampe e.K. Inh. Oliver Lampe – Zossen",
      "type": "Registerbekanntmachung nach dem Umwandlungsgesetz",
      "state": "Brandenburg",
      "amtsgericht": "Amtsgericht Potsdam",
      "registernummer": "HRA 8346",
      "registerart": "HRA",
      "company_name": "Der Lampe e.K. Inh. Oliver Lampe",
      "company_seat": "Zossen",
      "details": "10.12.2024 (Bekanntmachungsdatum)\n\nBrandenburg Amtsgericht Potsdam HRA 8346\nRegisterbekanntmachung nach dem Umwandlungsgesetz 06.12.2024 (Eintragungsdatum)\n\nDer Lampe e.K. Inh. Oliver Lampe\nEinzelkaufmann / Einzelkauffrau\nZossen\n\nBekanntmachungstext zur 2. Eintragung:\n\nAls nicht eingetragen wird veröffentlicht:\n\nDen Gläubigern der an der Ausgliederung beteiligten Rechtsträger ist, wenn sie binnen sechs Monaten nach dem Tag, an dem die Eintragung der Ausgliederung in das Register des Sitzes desjenigen Rechtsträgers, dessen Gläubiger sie sind, nach den §§ 125, 19 Abs. 3 UmwG als bekannt gemacht gilt, ihren Anspruch nach Grund und Höhe schriftlich anmelden, Sicherheit zu leisten, soweit sie nicht Befriedigung verlangen können. Dieses Recht steht den Gläubigern jedoch nur zu, wenn sie glaubhaft machen, dass durch die Ausgliederung die Erfüllung ihrer Forderung gefährdet wird."
    },
    {
      "date": "2024-12-10",
      "id": "95925",
      "original_text": "Löschungsankündigung\nBerlin Amtsgericht Berlin (Charlottenburg) HRB 102247\nVedranel neunte Immobilienbesitz Verwaltungs GmbH – Berlin",
      "type": "Löschungsankündigung",
      "state": "Berlin",
      "amtsgericht": "Amtsgericht Berlin (Charlottenburg)",
      "registernummer": "HRB 102247",
      "registerart": "HRB",
      "company_name": "Vedranel neunte Immobilienbesitz Verwaltungs GmbH",
      "company_seat": "Berlin",
      "details": "10.12.2024 (Bekanntmachungsdatum)\n\nBerlin Amtsgericht Berlin (Charlottenburg) HRB 102247\nLöschungsankündigung\n\nVedranel neunte Immobilienbesitz Verwaltungs GmbH\nGesellschaft mit beschränkter Haftung\nBerlin\n\nBei der nachstehenden Gesellschaft wird das Amtslöschungsverfahren gemäß § 394 FamFG eingeleitet. Widerspruchsfrist 6 Wochen"
    },
    {
      "date": "2024-12-10",
      "id": "95926",
      "original_text": "Löschungsankündigung\nBerlin Amtsgericht Berlin (Charlottenburg) HRB 208769\nDNet Technologies UG (haftungsbeschränkt) – Berlin",
      "type": "Löschungsankündigung",
      "state": "Berlin",
      "amtsgericht": "Amtsgericht Berlin (Charlottenburg)",
      "registernummer": "HRB 208769",
      "registerart": "HRB",
      "company_name": "DNet Technologies UG (haftungsbeschränkt)",
      "company_seat": "Berlin",
      "details": "10.12.2024 (Bekanntmachungsdatum)\n\nBerlin Amtsgericht Berlin (Charlottenburg) HRB 208769\nLöschungsankündigung\n\nDNet Technologies UG (haftungsbeschränkt)\nGesellschaft mit beschränkter Haftung\nBerlin\n\nBei der nachstehenden Gesellschaft wird das Amtslöschungsverfahren gemäß § 394 FamFG eingeleitet. Widerspruchsfrist 6 Wochen"
    },
    {
      "date": "2024-12-10",
      "id": "95927",
      "original_text": "Einreichung neuer Dokumente\nSaarland Amtsgericht Saarbrücken HRB 10757\nEVS Gesellschaft für Abfallwirtschaft mbH (EVS ABW GmbH) – Saarbrücken",
      "type": "Einreichung neuer Dokumente",
      "state": "Saarland",
      "amtsgericht": "Amtsgericht Saarbrücken",
      "registernummer": "HRB 10757",
      "registerart": "HRB",
      "company_name": "EVS Gesellschaft für Abfallwirtschaft mbH (EVS ABW GmbH)",
      "company_seat": "Saarbrücken",
      "details": "10.12.2024 (Bekanntmachungsdatum)\n\nSaarland Amtsgericht Saarbrücken HRB 10757\nEinreichung neuer Dokumente 10.12.2024 (Eintragungsdatum)\n\nEVS Gesellschaft für Abfallwirtschaft mbH (EVS ABW GmbH)\nGesellschaft mit beschränkter Haftung\nSaarbrücken\n\nDie Geschäftsführung der Gesellschaft hat eine Liste der Mitglieder des Aufsichtsrats zum Handelsregister eingereicht (§ 52 Abs. 3 Satz 2 GmbHG)."
    },
    {
      "date": "2024-12-10",
      "id": "95928",
      "original_text": "Registerbekanntmachung nach dem Umwandlungsgesetz\nHamburg Amtsgericht Hamburg HRB 136044\nNASCO Germany GmbH – Hamburg",
      "type": "Registerbekanntmachung nach dem Umwandlungsgesetz",
      "state": "Hamburg",
      "amtsgericht": "Amtsgericht Hamburg",
      "registernummer": "HRB 136044",
      "registerart": "HRB",
      "company_name": "NASCO Germany GmbH",
      "company_seat": "Hamburg",
      "details": "10.12.2024 (Bekanntmachungsdatum)\n\nHamburg Amtsgericht Hamburg HRB 136044\nRegisterbekanntmachung nach dem Umwandlungsgesetz 10.12.2024 (Eintragungsdatum)\n\nNASCO Germany GmbH\nGesellschaft mit beschränkter Haftung\nHamburg\n\nAls nicht eingetragen wird bekannt gemacht:\nDen Gläubigern der an der Verschmelzung beteiligten Gesellschaften ist, wenn sie binnen sechs Monaten nach dem Tag, an dem die Eintragung der Verschmelzung in das Register des Sitzes desjenigen Rechtsträgers, dessen Gläubiger sie sind, nach § 19 Absatz 3 UmwG als bekannt gemacht gilt, ihren Anspruch nach Grund und Höhe schriftlich anmelden, Sicherheit zu leisten, soweit sie nicht Befriedigung verlangen können. Dieses Recht steht den Gläubigern jedoch nur zu, wenn sie glaubhaft machen, dass durch die Verschmelzung die Erfüllung ihrer Forderung gefährdet wird."
    },
    {
      "date": "2024-12-10",
      "id": "95929",
      "original_text": "Registerbekanntmachung nach dem Umwandlungsgesetz\nHamburg Amtsgericht Hamburg HRB 134509\nNASCO Energie & Rohstoff AG – Hamburg",
      "type": "Registerbekanntmachung nach dem Umwandlungsgesetz",
      "state": "Hamburg",
      "amtsgericht": "Amtsgericht Hamburg",
      "registernummer": "HRB 134509",
      "registerart": "HRB",
      "company_name": "NASCO Energie & Rohstoff AG",
      "company_seat": "Hamburg",
      "details": "10.12.2024 (Bekanntmachungsdatum)\n\nHamburg Amtsgericht Hamburg HRB 134509\nRegisterbekanntmachung nach dem Umwandlungsgesetz 10.12.2024 (Eintragungsdatum)\n\nNASCO Energie & Rohstoff AG\nAktiengesellschaft\nHamburg\n\nAls nicht eingetragen wird bekannt gemacht:\nDen Gläubigern der an der Verschmelzung beteiligten Gesellschaften ist, wenn sie binnen sechs Monaten nach dem Tag, an dem die Eintragung der Verschmelzung in das Register des Sitzes desjenigen Rechtsträgers, dessen Gläubiger sie sind, nach § 19 Absatz 3 UmwG als bekannt gemacht gilt, ihren Anspruch nach Grund und Höhe schriftlich anmelden, Sicherheit zu leisten, soweit sie nicht Befriedigung verlangen können. Dieses Recht steht den Gläubigern jedoch nur zu, wenn sie glaubhaft machen, dass durch die Verschmelzung die Erfüllung ihrer Forderung gefährdet wird."
    },
    {
      "date": "2024-12-10",
      "id": "95930",
      "original_text": "Löschungsankündigung\nBerlin Amtsgericht Berlin (Charlottenburg) HRB 138160\nStoppel & Barros Fahrtreppenservice GmbH – Berlin",
      "type": "Löschungsankündigung",
      "state": "Berlin",
      "amtsgericht": "Amtsgericht Berlin (Charlottenburg)",
      "registernummer": "HRB 138160",
      "registerart": "HRB",
      "company_name": "Stoppel & Barros Fahrtreppenservice GmbH",
      "company_seat": "Berlin",
      "details": "10.12.2024 (Bekanntmachungsdatum)\n\nBerlin Amtsgericht Berlin (Charlottenburg) HRB 138160\nLöschungsankündigung\n\nStoppel & Barros Fahrtreppenservice GmbH\nGesellschaft mit beschränkter Haftung\nBerlin\n\nBei der nachstehenden Gesellschaft wird das Amtslöschungsverfahren gemäß § 394 FamFG eingeleitet. Widerspruchsfrist 6 Wochen"
    },
    {
      "date": "2024-12-10",
      "id": "95931",
      "original_text": "Registerbekanntmachung nach dem Umwandlungsgesetz\nHamburg Amtsgericht Hamburg HRB 121387\nQuartier etc. GmbH – Hamburg",
      "type": "Registerbekanntmachung nach dem Umwandlungsgesetz",
      "state": "Hamburg",
      "amtsgericht": "Amtsgericht Hamburg",
      "registernummer": "HRB 121387",
      "registerart": "HRB",
      "company_name": "Quartier etc. GmbH",
      "company_seat": "Hamburg",
      "details": "10.12.2024 (Bekanntmachungsdatum)\n\nHamburg Amtsgericht Hamburg HRB 121387\nRegisterbekanntmachung nach dem Umwandlungsgesetz 10.12.2024 (Eintragungsdatum)\n\nQuartier etc. GmbH\nGesellschaft mit beschränkter Haftung\nHamburg\n\nAls nicht eingetragen wird bekannt gemacht:\nDen Gläubigern der an der grenzüberschreitenden Verschmelzung beteiligten übernehmenden Rechtsträger ist, wenn sie binnen sechs Monaten nach dem Tag, an dem die Eintragung der Verschmelzung in das Register des Sitzes desjenigen Rechtsträgers, dessen Gläubiger sie sind, nach § 19 Absatz 3 UmwG als bekanntgemacht gilt, ihren Anspruch nach Grund und Höhe schriftlich anmelden, Sicherheit zu leisten, soweit sie nicht Befriedigung verlangen können.\nDieses Recht steht den Gläubigern jedoch nur zu, wenn sie glaubhaft machen, dass durch die Verschmelzung die Erfüllung ihrer Forderung gefährdet wird."
    },
    {
      "date": "2024-12-10",
      "id": "95932",
      "original_text": "Löschungsankündigung\nBerlin Amtsgericht Berlin (Charlottenburg) HRB 129242\nEXAKT ELEKTRONIK GmbH – Berlin",
      "type": "Löschungsankündigung",
      "state": "Berlin",
      "amtsgericht": "Amtsgericht Berlin (Charlottenburg)",
      "registernummer": "HRB 129242",
      "registerart": "HRB",
      "company_name": "EXAKT ELEKTRONIK GmbH",
      "company_seat": "Berlin",
      "details": "10.12.2024 (Bekanntmachungsdatum)\n\nBerlin Amtsgericht Berlin (Charlottenburg) HRB 129242\nLöschungsankündigung\n\nEXAKT ELEKTRONIK GmbH\nGesellschaft mit beschränkter Haftung\nBerlin\n\nBei der nachstehenden Gesellschaft wird das Amtslöschungsverfahren gemäß § 394 FamFG eingeleitet. Widerspruchsfrist 6 Wochen"
    },
    {
      "date": "2024-12-10",
      "id": "95933",
      "original_text": "Registerbekanntmachung nach dem Umwandlungsgesetz\nBaden-Württemberg Amtsgericht Stuttgart HRB 770029\nKessler Immobilien- und Vertriebsgesellschaft Objekt Tübingen GmbH – Tübingen",
      "type": "Registerbekanntmachung nach dem Umwandlungsgesetz",
      "state": "Baden-Württemberg",
      "amtsgericht": "Amtsgericht Stuttgart",
      "registernummer": "HRB 770029",
      "registerart": "HRB",
      "company_name": "Kessler Immobilien- und Vertriebsgesellschaft Objekt Tübingen GmbH",
      "company_seat": "Tübingen",
      "details": "10.12.2024 (Bekanntmachungsdatum)\n\nBaden-Württemberg Amtsgericht Stuttgart HRB 770029\nRegisterbekanntmachung nach dem Umwandlungsgesetz 10.12.2024 (Eintragungsdatum)\n\nKessler Immobilien- und Vertriebsgesellschaft Objekt Tübingen GmbH\nGesellschaft mit beschränkter Haftung\nTübingen\n\nDen Gläubigern dern an der grenzüberschreitenden Verschmelzung beteiligten übernehmenden Rechtsträger ist, wenn sie binnen sechs Monaten nach dem Tag, an dem die Eintragung der Verschmelzung in das Register des Sitzes desjenigen Rechtsträgers, dessen Gläubiger sie sind, nach § 19 Absatz 3 UmwG als bekanntgemacht gilt, ihren Anspruch nach Grund und Höhe schriftlich anmelden, Sicherheit zu leisten, soweit sie nicht Befriedigung verlangen können. Dieses Recht steht den Gläubigern jedoch nur zu, wenn sie glaubhaft machen, dass durch die Verschmelzung die Erfüllung ihrer Forderung gefährdet wird."
    },
    {
      "date": "2024-12-10",
      "id": "95934",
      "original_text": "Einreichung neuer Dokumente\nBerlin Amtsgericht Berlin (Charlottenburg) HRB 121596\nCA Customer Alliance GmbH – Berlin",
      "type": "Einreichung neuer Dokumente",
      "state": "Berlin",
      "amtsgericht": "Amtsgericht Berlin (Charlottenburg)",
      "registernummer": "HRB 121596",
      "registerart": "HRB",
      "company_name": "CA Customer Alliance GmbH",
      "company_seat": "Berlin",
      "details": "10.12.2024 (Bekanntmachungsdatum)\n\nBerlin Amtsgericht Berlin (Charlottenburg) HRB 121596\nEinreichung neuer Dokumente\n\nCA Customer Alliance GmbH\nGesellschaft mit beschränkter Haftung\nBerlin\n\nAls nicht eingetragen wird veröffentlicht: Es wurde eine neue Liste der Beiratsratsmitglieder eingereicht (§52 GmbHG)."
    },
    {
      "date": "2024-12-10",
      "id": "95935",
      "original_text": "Löschungsankündigung\nBerlin Amtsgericht Berlin (Charlottenburg) HRB 204207\nHerekol Consulting & Construction GmbH – Berlin",
      "type": "Löschungsankündigung",
      "state": "Berlin",
      "amtsgericht": "Amtsgericht Berlin (Charlottenburg)",
      "registernummer": "HRB 204207",
      "registerart": "HRB",
      "company_name": "Herekol Consulting & Construction GmbH",
      "company_seat": "Berlin",
      "details": "10.12.2024 (Bekanntmachungsdatum)\n\nBerlin Amtsgericht Berlin (Charlottenburg) HRB 204207\nLöschungsankündigung\n\nHerekol Consulting & Construction GmbH\nGesellschaft mit beschränkter Haftung\nBerlin\n\nBei der nachstehenden Gesellschaft wird das Amtslöschungsverfahren gemäß § 394 FamFG eingeleitet. Widerspruchsfrist 6 Wochen."
    },
    {
      "date": "2024-12-10",
      "id": "95936",
      "original_text": "Registerbekanntmachung nach dem Umwandlungsgesetz\nBerlin Amtsgericht Berlin (Charlottenburg) HRB 218743\nVery Good Looking GmbH – Berlin",
      "type": "Registerbekanntmachung nach dem Umwandlungsgesetz",
      "state": "Berlin",
      "amtsgericht": "Amtsgericht Berlin (Charlottenburg)",
      "registernummer": "HRB 218743",
      "registerart": "HRB",
      "company_name": "Very Good Looking GmbH",
      "company_seat": "Berlin",
      "details": "10.12.2024 (Bekanntmachungsdatum)\n\nBerlin Amtsgericht Berlin (Charlottenburg) HRB 218743\nRegisterbekanntmachung nach dem Umwandlungsgesetz 09.12.2024 (Eintragungsdatum)\n\nVery Good Looking GmbH\nGesellschaft mit beschränkter Haftung\nBerlin\n\nZu Eintragungsnummer 4 vom 09.12.2024 wird als nicht eingetragen veröffentlicht:  Den Gläubigern der an der Verschmelzung beteiligten Rechtsträger ist, wenn sie binnen sechs Monaten nach dem Tag, an dem die Eintragung der Verschmelzung in das Register des Sitzes desjenigen Rechtsträgers, dessen Gläubiger sie sind, als bekannt gemacht gilt, ihren Anspruch nach Grund und Höhe schriftlich anmelden, Sicherheit zu leisten, soweit sie nicht Befriedigung verlangen können. Dieses Recht steht den Gläubigern jedoch nur zu, wenn sie glaubhaft machen, dass durch die Verschmelzung die Erfüllung ihrer Forderung gefährdet wird. Das Recht, Sicherheitsleistung zu verlangen, steht Gläubigern nicht zu, die im Falle der Insolvenz ein Recht auf vorzugsweise Befriedigung aus einer Deckungsmasse haben, die nach gesetzlicher Vorschrift zu ihrem Schutz errichtet und staatlich überwacht ist."
    },
    {
      "date": "2024-12-10",
      "id": "95937",
      "original_text": "Einreichung neuer Dokumente\nBrandenburg Amtsgericht Cottbus HRB 1471\nStadtwerke Finsterwalde GmbH – Finsterwalde",
      "type": "Einreichung neuer Dokumente",
      "state": "Brandenburg",
      "amtsgericht": "Amtsgericht Cottbus",
      "registernummer": "HRB 1471",
      "registerart": "HRB",
      "company_name": "Stadtwerke Finsterwalde GmbH",
      "company_seat": "Finsterwalde",
      "details": "10.12.2024 (Bekanntmachungsdatum)\n\nBrandenburg Amtsgericht Cottbus HRB 1471\nEinreichung neuer Dokumente\n\nStadtwerke Finsterwalde GmbH\nGesellschaft mit beschränkter Haftung\nFinsterwalde\n\nAls nicht eingetragen wird veröffentlicht:\nDie aktuelle Liste der Aufsichtsratsmitglieder wurde zum Handelsregister gem. § 52 Abs. 3 GmbHG eingereicht."
    },
    {
      "date": "2024-12-10",
      "id": "95938",
      "original_text": "Registerbekanntmachung nach dem Umwandlungsgesetz\nBerlin Amtsgericht Berlin (Charlottenburg) HRB 231105\nRadical Kindness UG (haftungsbeschränkt) – Berlin",
      "type": "Registerbekanntmachung nach dem Umwandlungsgesetz",
      "state": "Berlin",
      "amtsgericht": "Amtsgericht Berlin (Charlottenburg)",
      "registernummer": "HRB 231105",
      "registerart": "HRB",
      "company_name": "Radical Kindness UG (haftungsbeschränkt)",
      "company_seat": "Berlin",
      "details": "10.12.2024 (Bekanntmachungsdatum)\n\nBerlin Amtsgericht Berlin (Charlottenburg) HRB 231105\nRegisterbekanntmachung nach dem Umwandlungsgesetz 09.12.2024 (Eintragungsdatum)\n\nRadical Kindness UG (haftungsbeschränkt)\nGesellschaft mit beschränkter Haftung\nBerlin\n\nZu Eintragungsnummer 3 vom 09.12.2024 wird als nicht eingetragen veröffentlicht:  Den Gläubigern der an der Verschmelzung beteiligten Rechtsträger ist, wenn sie binnen sechs Monaten nach dem Tag, an dem die Eintragung der Verschmelzung in das Register des Sitzes desjenigen Rechtsträgers, dessen Gläubiger sie sind, als bekannt gemacht gilt, ihren Anspruch nach Grund und Höhe schriftlich anmelden, Sicherheit zu leisten, soweit sie nicht Befriedigung verlangen können. Dieses Recht steht den Gläubigern jedoch nur zu, wenn sie glaubhaft machen, dass durch die Verschmelzung die Erfüllung ihrer Forderung gefährdet wird. Das Recht, Sicherheitsleistung zu verlangen, steht Gläubigern nicht zu, die im Falle der Insolvenz ein Recht auf vorzugsweise Befriedigung aus einer Deckungsmasse haben, die nach gesetzlicher Vorschrift zu ihrem Schutz errichtet und staatlich überwacht ist."
    },
    {
      "date": "2024-12-10",
      "id": "95939",
      "original_text": "Einreichung neuer Dokumente\nBaden-Württemberg Amtsgericht Mannheim HRB 709193\nAX Business Solutions AG – Karlsbad",
      "type": "Einreichung neuer Dokumente",
      "state": "Baden-Württemberg",
      "amtsgericht": "Amtsgericht Mannheim",
      "registernummer": "HRB 709193",
      "registerart": "HRB",
      "company_name": "AX Business Solutions AG",
      "company_seat": "Karlsbad",
      "details": "10.12.2024 (Bekanntmachungsdatum)\n\nBaden-Württemberg Amtsgericht Mannheim HRB 709193\nEinreichung neuer Dokumente 10.12.2024 (Eintragungsdatum)\n\nAX Business Solutions AG\nAktiengesellschaft\nKarlsbad\n\nDie Gesellschaft hat am 05.12.2024 die Liste über die Zusammensetzung des Aufsichtsrats zum Handelsregister eingereicht."
    },
    {
      "date": "2024-12-10",
      "id": "95940",
      "original_text": "Registerbekanntmachung nach dem Umwandlungsgesetz\nHamburg Amtsgericht Hamburg HRB 120807\nJIL SANDER GmbH – Hamburg",
      "type": "Registerbekanntmachung nach dem Umwandlungsgesetz",
      "state": "Hamburg",
      "amtsgericht": "Amtsgericht Hamburg",
      "registernummer": "HRB 120807",
      "registerart": "HRB",
      "company_name": "JIL SANDER GmbH",
      "company_seat": "Hamburg",
      "details": "10.12.2024 (Bekanntmachungsdatum)\n\nHamburg Amtsgericht Hamburg HRB 120807\nRegisterbekanntmachung nach dem Umwandlungsgesetz 10.12.2024 (Eintragungsdatum)\n\nJIL SANDER GmbH\nGesellschaft mit beschränkter Haftung\nHamburg\n\nAls nicht eingetragen wird bekannt gemacht:\nDen Gläubigern der an dem Formwechsel beteiligten Gesellschaft ist, wenn sie binnen sechs Monaten nach dem Tag, an dem die Eintragung des Formwechsels in das Register des Sitzes desjenigen Rechtsträgers, dessen Gläubiger sie sind, nach § 201 UmwG als bekannt gemacht gilt, ihren Anspruch nach Grund und Höhe schriftlich anmelden, Sicherheit zu leisten, soweit sie nicht Befriedigung verlangen können. Dieses Recht steht den Gläubigern jedoch nur zu, wenn sie glaubhaft machen, dass durch den Formwechsel die Erfüllung ihrer Forderung gefährdet wird."
    },
    {
      "date": "2024-12-10",
      "id": "95941",
      "original_text": "Registerbekanntmachung nach dem Umwandlungsgesetz\nBaden-Württemberg Amtsgericht Mannheim HRB 333880\nGELITA Health GmbH – Eberbach",
      "type": "Registerbekanntmachung nach dem Umwandlungsgesetz",
      "state": "Baden-Württemberg",
      "amtsgericht": "Amtsgericht Mannheim",
      "registernummer": "HRB 333880",
      "registerart": "HRB",
      "company_name": "GELITA Health GmbH",
      "company_seat": "Eberbach",
      "details": "10.12.2024 (Bekanntmachungsdatum)\n\nBaden-Württemberg Amtsgericht Mannheim HRB 333880\nRegisterbekanntmachung nach dem Umwandlungsgesetz 10.12.2024 (Eintragungsdatum)\n\nGELITA Health GmbH\nGesellschaft mit beschränkter Haftung\nEberbach\n\nDen Gläubigern der an der Verschmelzung beteiligten Rechtsträger ist, wenn sie binnen sechs Monaten nach dem Tag, an dem die Eintragung der Verschmelzung in das Register des Sitzes desjenigen Rechtsträgers, dessen Gläubiger sie sind, nach § 19 Abs. 3 UmwG als bekanntgemacht gilt, ihren Anspruch nach Grund und Höhe schriftlich anmelden, Sicherheit zu leisten, soweit sie nicht Befriedigung verlangen können. Dieses Recht steht den Gläubigern jedoch nur zu, wenn sie glaubhaft machen, dass durch die Verschmelzung die Erfüllung ihrer Forderung gefährdet wird."
    },
    {
      "date": "2024-12-10",
      "id": "95942",
      "original_text": "Registerbekanntmachung nach dem Umwandlungsgesetz\nBaden-Württemberg Amtsgericht Mannheim HRB 337572\nATRO ProVita GmbH – Eberbach",
      "type": "Registerbekanntmachung nach dem Umwandlungsgesetz",
      "state": "Baden-Württemberg",
      "amtsgericht": "Amtsgericht Mannheim",
      "registernummer": "HRB 337572",
      "registerart": "HRB",
      "company_name": "ATRO ProVita GmbH",
      "company_seat": "Eberbach",
      "details": "10.12.2024 (Bekanntmachungsdatum)\n\nBaden-Württemberg Amtsgericht Mannheim HRB 337572\nRegisterbekanntmachung nach dem Umwandlungsgesetz 10.12.2024 (Eintragungsdatum)\n\nATRO ProVita GmbH\nGesellschaft mit beschränkter Haftung\nEberbach\n\nDen Gläubigern der an der Verschmelzung beteiligten Rechtsträger ist, wenn sie binnen sechs Monaten nach dem Tag, an dem die Eintragung der Verschmelzung in das Register des Sitzes desjenigen Rechtsträgers, dessen Gläubiger sie sind, nach § 19 Abs. 3 UmwG als bekanntgemacht gilt, ihren Anspruch nach Grund und Höhe schriftlich anmelden, Sicherheit zu leisten, soweit sie nicht Befriedigung verlangen können. Dieses Recht steht den Gläubigern jedoch nur zu, wenn sie glaubhaft machen, dass durch die Verschmelzung die Erfüllung ihrer Forderung gefährdet wird."
    },
    {
      "date": "2024-12-10",
      "id": "95943",
      "original_text": "Registerbekanntmachung nach dem Umwandlungsgesetz\nBaden-Württemberg Amtsgericht Mannheim HRB 746627\nFreudenberg Performance Materials Holding GmbH – Weinheim",
      "type": "Registerbekanntmachung nach dem Umwandlungsgesetz",
      "state": "Baden-Württemberg",
      "amtsgericht": "Amtsgericht Mannheim",
      "registernummer": "HRB 746627",
      "registerart": "HRB",
      "company_name": "Freudenberg Performance Materials Holding GmbH",
      "company_seat": "Weinheim",
      "details": "10.12.2024 (Bekanntmachungsdatum)\n\nBaden-Württemberg Amtsgericht Mannheim HRB 746627\nRegisterbekanntmachung nach dem Umwandlungsgesetz 10.12.2024 (Eintragungsdatum)\n\nFreudenberg Performance Materials Holding GmbH\nGesellschaft mit beschränkter Haftung\nWeinheim\n\nDen Gläubigern der an der Verschmelzung beteiligten Rechtsträger ist, wenn sie binnen sechs Monaten nach dem Tag, an dem die Eintragung der Verschmelzung in das Register des Sitzes desjenigen Rechtsträgers, dessen Gläubiger sie sind, nach § 19 Abs. 3 UmwG als bekanntgemacht gilt, ihren Anspruch nach Grund und Höhe schriftlich anmelden, Sicherheit zu leisten, soweit sie nicht Befriedigung verlangen können. Dieses Recht steht den Gläubigern jedoch nur zu, wenn sie glaubhaft machen, dass durch die Verschmelzung die Erfüllung ihrer Forderung gefährdet wird."
    },
    {
      "date": "2024-12-10",
      "id": "95944",
      "original_text": "Registerbekanntmachung nach dem Umwandlungsgesetz\nBerlin Amtsgericht Berlin (Charlottenburg) HRB 220314\nPayreto GmbH – Berlin",
      "type": "Registerbekanntmachung nach dem Umwandlungsgesetz",
      "state": "Berlin",
      "amtsgericht": "Amtsgericht Berlin (Charlottenburg)",
      "registernummer": "HRB 220314",
      "registerart": "HRB",
      "company_name": "Payreto GmbH",
      "company_seat": "Berlin",
      "details": "10.12.2024 (Bekanntmachungsdatum)\n\nBerlin Amtsgericht Berlin (Charlottenburg) HRB 220314\nRegisterbekanntmachung nach dem Umwandlungsgesetz 09.12.2024 (Eintragungsdatum)\n\nPayreto GmbH\nGesellschaft mit beschränkter Haftung\nBerlin\n\nZu Eintragungsnummer 6 vom 09.12.2024 wird als nicht eingetragen veröffentlicht: Den Gläubigern der an der Verschmelzung beteiligten Rechtsträger ist, wenn sie binnen sechs Monaten nach dem Tag, an dem die Eintragung der Verschmelzung in das Register des Sitzes desjenigen Rechtsträgers, dessen Gläubiger sie sind, als bekannt gemacht gilt, ihren Anspruch nach Grund und Höhe schriftlich anmelden, Sicherheit zu leisten, soweit sie nicht Befriedigung verlangen können. Dieses Recht steht den Gläubigern jedoch nur zu, wenn sie glaubhaft machen, dass durch die Verschmelzung die Erfüllung ihrer Forderung gefährdet wird. Das Recht, Sicherheitsleistung zu verlangen, steht Gläubigern nicht zu, die im Falle der Insolvenz ein Recht auf vorzugsweise Befriedigung aus einer Deckungsmasse haben, die nach gesetzlicher Vorschrift zu ihrem Schutz errichtet und staatlich überwacht ist."
    },
    {
      "date": "2024-12-10",
      "id": "95945",
      "original_text": "Löschungsankündigung\nBerlin Amtsgericht Berlin (Charlottenburg) HRB 140845\nVilla Michaelis 42 GmbH – Berlin",
      "type": "Löschungsankündigung",
      "state": "Berlin",
      "amtsgericht": "Amtsgericht Berlin (Charlottenburg)",
      "registernummer": "HRB 140845",
      "registerart": "HRB",
      "company_name": "Villa Michaelis 42 GmbH",
      "company_seat": "Berlin",
      "details": "10.12.2024 (Bekanntmachungsdatum)\n\nBerlin Amtsgericht Berlin (Charlottenburg) HRB 140845\nLöschungsankündigung\n\nVilla Michaelis 42 GmbH\nGesellschaft mit beschränkter Haftung\nBerlin\n\nBei der nachstehenden Gesellschaft wird das Amtslöschungsverfahren gemäß § 394 FamFG eingeleitet. Widerspruchsfrist 6 Wochen"
    },
    {
      "date": "2024-12-10",
      "id": "95946",
      "original_text": "Einreichung neuer Dokumente\nSchleswig-Holstein Amtsgericht Pinneberg HRB 14216\nSeehundstation Friedrichskoog gGmbH – Friedrichskoog",
      "type": "Einreichung neuer Dokumente",
      "state": "Schleswig-Holstein",
      "amtsgericht": "Amtsgericht Pinneberg",
      "registernummer": "HRB 14216",
      "registerart": "HRB",
      "company_name": "Seehundstation Friedrichskoog gGmbH",
      "company_seat": "Friedrichskoog",
      "details": "10.12.2024 (Bekanntmachungsdatum)\n\nSchleswig-Holstein Amtsgericht Pinneberg HRB 14216\nEinreichung neuer Dokumente\n\nSeehundstation Friedrichskoog gGmbH\nGesellschaft mit beschränkter Haftung\nFriedrichskoog\n\nAls nicht eingetragen wird veröffentlicht: Als nicht eingetragen wird veröffentlicht: Es ist eine neue Liste der Aufsichtsratsmitglieder gemäß § 52 Abs. 3 2 Hs. GmbHG i.V.m. § 10 HGB zum Handelsregister eingereicht worden."
    },
    {
      "date": "2024-12-10",
      "id": "95947",
      "original_text": "Löschungsankündigung\nBrandenburg Amtsgericht Potsdam HRB 35611\nFemonti GmbH – Zossen",
      "type": "Löschungsankündigung",
      "state": "Brandenburg",
      "amtsgericht": "Amtsgericht Potsdam",
      "registernummer": "HRB 35611",
      "registerart": "HRB",
      "company_name": "Femonti GmbH",
      "company_seat": "Zossen",
      "details": "10.12.2024 (Bekanntmachungsdatum)\n\nBrandenburg Amtsgericht Potsdam HRB 35611\nLöschungsankündigung\n\nFemonti GmbH\nGesellschaft mit beschränkter Haftung\nZossen\n\nBei der nachstehenden Gesellschaft wird das Amtslöschungsverfahren gemäß § 394 FamFG eingeleitet. Widerspruchsfrist: 8 Wochen"
    },
    {
      "date": "2024-12-10",
      "id": "95948",
      "original_text": "Einreichung neuer Dokumente\nBerlin Amtsgericht Berlin (Charlottenburg) HRB 100157\nVivantes - Forum für Senioren GmbH – Berlin",
      "type": "Einreichung neuer Dokumente",
      "state": "Berlin",
      "amtsgericht": "Amtsgericht Berlin (Charlottenburg)",
      "registernummer": "HRB 100157",
      "registerart": "HRB",
      "company_name": "Vivantes - Forum für Senioren GmbH",
      "company_seat": "Berlin",
      "details": "10.12.2024 (Bekanntmachungsdatum)\n\nBerlin Amtsgericht Berlin (Charlottenburg) HRB 100157\nEinreichung neuer Dokumente\n\nVivantes - Forum für Senioren GmbH\nGesellschaft mit beschränkter Haftung\nBerlin\n\nAls nicht eingetragen wird veröffentlicht:Es wurde eine neue Liste der Aufsichtsratsmitglieder eingereicht (§52 GmbHG)."
    },
    {
      "date": "2024-12-10",
      "id": "95949",
      "original_text": "Registerbekanntmachung nach dem Umwandlungsgesetz\nBaden-Württemberg Amtsgericht Mannheim HRB 351965\nAutohaus Lehr GmbH – Wiesloch",
      "type": "Registerbekanntmachung nach dem Umwandlungsgesetz",
      "state": "Baden-Württemberg",
      "amtsgericht": "Amtsgericht Mannheim",
      "registernummer": "HRB 351965",
      "registerart": "HRB",
      "company_name": "Autohaus Lehr GmbH",
      "company_seat": "Wiesloch",
      "details": "10.12.2024 (Bekanntmachungsdatum)\n\nBaden-Württemberg Amtsgericht Mannheim HRB 351965\nRegisterbekanntmachung nach dem Umwandlungsgesetz 10.12.2024 (Eintragungsdatum)\n\nAutohaus Lehr GmbH\nGesellschaft mit beschränkter Haftung\nWiesloch\n\nDen Gläubigern der an der Verschmelzung beteiligten Rechtsträger ist, wenn sie binnen sechs Monaten nach dem Tag, an dem die Eintragung der Verschmelzung in das Register des Sitzes desjenigen Rechtsträgers, dessen Gläubiger sie sind, nach § 19 Abs. 3 UmwG als bekanntgemacht gilt, ihren Anspruch nach Grund und Höhe schriftlich anmelden, Sicherheit zu leisten, soweit sie nicht Befriedigung verlangen können. Dieses Recht steht den Gläubigern jedoch nur zu, wenn sie glaubhaft machen, dass durch die Verschmelzung die Erfüllung ihrer Forderung gefährdet wird."
    },
    {
      "date": "2024-12-10",
      "id": "95950",
      "original_text": "Sonstige Registerbekanntmachung\nMecklenburg-Vorpommern Amtsgericht Rostock HRB 5672\nStadtwerke Teterow GmbH – Teterow",
      "type": "Sonstige Registerbekanntmachung",
      "state": "Mecklenburg-Vorpommern",
      "amtsgericht": "Amtsgericht Rostock",
      "registernummer": "HRB 5672",
      "registerart": "HRB",
      "company_name": "Stadtwerke Teterow GmbH",
      "company_seat": "Teterow",
      "details": "10.12.2024 (Bekanntmachungsdatum)\n\nMecklenburg-Vorpommern Amtsgericht Rostock HRB 5672\nSonstige Registerbekanntmachung 10.12.2024 (Eintragungsdatum)\n\nStadtwerke Teterow GmbH\nGesellschaft mit beschränkter Haftung\nTeterow\n\nEine Liste der Mitglieder des Aufsichtsrats ist zum Handelsregister eingereicht worden."
    },
    {
      "date": "2024-12-10",
      "id": "95951",
      "original_text": "Löschungsankündigung\nSchleswig-Holstein Amtsgericht Pinneberg HRB 16333\nFUBATEC GmbH – Marne",
      "type": "Löschungsankündigung",
      "state": "Schleswig-Holstein",
      "amtsgericht": "Amtsgericht Pinneberg",
      "registernummer": "HRB 16333",
      "registerart": "HRB",
      "company_name": "FUBATEC GmbH",
      "company_seat": "Marne",
      "details": "10.12.2024 (Bekanntmachungsdatum)\n\nSchleswig-Holstein Amtsgericht Pinneberg HRB 16333\nLöschungsankündigung\n\nFUBATEC GmbH\nGesellschaft mit beschränkter Haftung\nMarne\n\nEs ist die Löschung der nachstehenden Gesellschaft wegen Vermögenslosigkeit gemäß § 394 FamFG beabsichtigt. Widerspruchsfrist: 2 Monate."
    },
    {
      "date": "2024-12-10",
      "id": "95952",
      "original_text": "Löschungsankündigung\nBaden-Württemberg Amtsgericht Stuttgart HRB 778473\nWandweiss GmbH – Kornwestheim",
      "type": "Löschungsankündigung",
      "state": "Baden-Württemberg",
      "amtsgericht": "Amtsgericht Stuttgart",
      "registernummer": "HRB 778473",
      "registerart": "HRB",
      "company_name": "Wandweiss GmbH",
      "company_seat": "Kornwestheim",
      "details": "10.12.2024 (Bekanntmachungsdatum)\n\nBaden-Württemberg Amtsgericht Stuttgart HRB 778473\nLöschungsankündigung 16.09.2024 (Eintragungsdatum)\n\nWandweiss GmbH\nGesellschaft mit beschränkter Haftung\nKornwestheim\n\nDas Gericht beabsichtigt, die Gesellschaft wegen Vermögenslosigkeit im Handelsregister von Amts wegen nach § 394 FamFG zu löschen. Die Frist zur Geltendmachung eines Widerspruchs gegen die beabsichtigte Löschung ist auf zwei Monate ab Veröffentlichung bestimmt."
    },
    {
      "date": "2024-12-10",
      "id": "95953",
      "original_text": "Löschungsankündigung\nSchleswig-Holstein Amtsgericht Lübeck HRB 14905\nHome Spirit GmbH – Hammor",
      "type": "Löschungsankündigung",
      "state": "Schleswig-Holstein",
      "amtsgericht": "Amtsgericht Lübeck",
      "registernummer": "HRB 14905",
      "registerart": "HRB",
      "company_name": "Home Spirit GmbH",
      "company_seat": "Hammor",
      "details": "10.12.2024 (Bekanntmachungsdatum)\n\nSchleswig-Holstein Amtsgericht Lübeck HRB 14905\nLöschungsankündigung\n\nHome Spirit GmbH\nGesellschaft mit beschränkter Haftung\nHammor\n\nEs ist die Löschung der nachstehenden Gesellschaft wegen Vermögenslosigkeit gemäß § 394 FamFG beabsichtigt.\nWiderspruchsfrist: 1 Monat."
    },
    {
      "date": "2024-12-10",
      "id": "95954",
      "original_text": "Sonstige Registerbekanntmachung\nSchleswig-Holstein Amtsgericht Kiel HRB 215 EC\nVAMED Rehaklinik Damp GmbH – Damp",
      "type": "Sonstige Registerbekanntmachung",
      "state": "Schleswig-Holstein",
      "amtsgericht": "Amtsgericht Kiel",
      "registernummer": "HRB 215 EC",
      "registerart": "HRB",
      "company_name": "VAMED Rehaklinik Damp GmbH",
      "company_seat": "Damp",
      "details": "10.12.2024 (Bekanntmachungsdatum)\n\nSchleswig-Holstein Amtsgericht Kiel HRB 215 EC\nSonstige Registerbekanntmachung\n\nVAMED Rehaklinik Damp GmbH\nGesellschaft mit beschränkter Haftung\nDamp\n\nAls nicht eingetragen wird veröffentlicht: Den Gläubigern der Gesellschaft, deren Forderungen begründet worden sind, bevor die Eintragung der Beendigung des Vertrages in das Handelsregister nach § 10 HGB bekannt gemacht worden ist, ist vom anderen Vertragspartner Sicherheit zu leisten, wenn sie sich binnen sechs Monaten nach Bekanntmachung der Eintragung zu diesem Zweck bei ihm melden."
    },
    {
      "date": "2024-12-10",
      "id": "95955",
      "original_text": "Einreichung neuer Dokumente\nSachsen Amtsgericht Leipzig HRB 2721\nTorgauer Wohnstätten GmbH – Torgau",
      "type": "Einreichung neuer Dokumente",
      "state": "Sachsen",
      "amtsgericht": "Amtsgericht Leipzig",
      "registernummer": "HRB 2721",
      "registerart": "HRB",
      "company_name": "Torgauer Wohnstätten GmbH",
      "company_seat": "Torgau",
      "details": "10.12.2024 (Bekanntmachungsdatum)\n\nSachsen Amtsgericht Leipzig HRB 2721\nEinreichung neuer Dokumente\n\nTorgauer Wohnstätten GmbH\nGesellschaft mit beschränkter Haftung\nTorgau\n\nAm 04.11.2024 wurde beim Handelsregister des Amtsgerichts Leipzig die Liste der Mitglieder des Aufsichtsrats gemäß § 52 GmbHG eingereicht."
    },
    {
      "date": "2024-12-10",
      "id": "95956",
      "original_text": "Einreichung neuer Dokumente\nSachsen Amtsgericht Chemnitz HRB 24295\nVereinigte Gesundheitseinrichtungen Mittelsachsen GmbH – Freiberg",
      "type": "Einreichung neuer Dokumente",
      "state": "Sachsen",
      "amtsgericht": "Amtsgericht Chemnitz",
      "registernummer": "HRB 24295",
      "registerart": "HRB",
      "company_name": "Vereinigte Gesundheitseinrichtungen Mittelsachsen GmbH",
      "company_seat": "Freiberg",
      "details": "10.12.2024 (Bekanntmachungsdatum)\n\nSachsen Amtsgericht Chemnitz HRB 24295\nEinreichung neuer Dokumente\n\nVereinigte Gesundheitseinrichtungen Mittelsachsen GmbH\nGesellschaft mit beschränkter Haftung\nFreiberg\n\nAm 06.12.2024 wurde beim Handelsregister des Amtsgerichts Chemnitz die Liste der Mitglieder des Aufsichtsrats gemäß § 52 GmbHG eingereicht."
    },
    {
      "date": "2024-12-10",
      "id": "95957",
      "original_text": "Einreichung neuer Dokumente\nSachsen Amtsgericht Chemnitz HRB 12409\nKreiskrankenhaus Freiberg gemeinnützige GmbH – Freiberg",
      "type": "Einreichung neuer Dokumente",
      "state": "Sachsen",
      "amtsgericht": "Amtsgericht Chemnitz",
      "registernummer": "HRB 12409",
      "registerart": "HRB",
      "company_name": "Kreiskrankenhaus Freiberg gemeinnützige GmbH",
      "company_seat": "Freiberg",
      "details": "10.12.2024 (Bekanntmachungsdatum)\n\nSachsen Amtsgericht Chemnitz HRB 12409\nEinreichung neuer Dokumente 06.12.2024 (Eintragungsdatum)\n\nKreiskrankenhaus Freiberg gemeinnützige GmbH\nGesellschaft mit beschränkter Haftung\nFreiberg\n\nAm 06.12.2024 wurde beim Handelsregister des Amtsgerichts Chemnitz die Liste der Mitglieder des Aufsichtsrats gemäß § 52 GmbHG eingereicht."
    },
    {
      "date": "2024-12-10",
      "id": "95958",
      "original_text": "Einreichung neuer Dokumente\nSachsen Amtsgericht Chemnitz HRB 31176\nS.L.P. Vertriebsservice AG Gesellschaft für Versicherungsvermittlung, Marketing und Vertriebslogistik – Chemnitz",
      "type": "Einreichung neuer Dokumente",
      "state": "Sachsen",
      "amtsgericht": "Amtsgericht Chemnitz",
      "registernummer": "HRB 31176",
      "registerart": "HRB",
      "company_name": "S.L.P. Vertriebsservice AG Gesellschaft für Versicherungsvermittlung, Marketing und Vertriebslogistik",
      "company_seat": "Chemnitz",
      "details": "10.12.2024 (Bekanntmachungsdatum)\n\nSachsen Amtsgericht Chemnitz HRB 31176\nEinreichung neuer Dokumente\n\nS.L.P. Vertriebsservice AG Gesellschaft für Versicherungsvermittlung, Marketing und Vertriebslogistik\nAktiengesellschaft\nChemnitz\n\nAm 09.12.2024 wurde beim Handelsregister des Amtsgerichts Chemnitz die Liste der Mitglieder des Aufsichtsrats gemäß § 106 AktG eingereicht."
    },
    {
      "date": "2024-12-10",
      "id": "95959",
      "original_text": "Einreichung neuer Dokumente\nSachsen Amtsgericht Leipzig HRB 21820\nSchaubühne Lindenfels Aktiengesellschaft – Leipzig",
      "type": "Einreichung neuer Dokumente",
      "state": "Sachsen",
      "amtsgericht": "Amtsgericht Leipzig",
      "registernummer": "HRB 21820",
      "registerart": "HRB",
      "company_name": "Schaubühne Lindenfels Aktiengesellschaft",
      "company_seat": "Leipzig",
      "details": "10.12.2024 (Bekanntmachungsdatum)\n\nSachsen Amtsgericht Leipzig HRB 21820\nEinreichung neuer Dokumente\n\nSchaubühne Lindenfels Aktiengesellschaft\nAktiengesellschaft\nLeipzig\n\nAm 22.11.2024 wurde beim Handelsregister des Amtsgerichts Leipzig die Liste der Mitglieder des Aufsichtsrats gemäß § 106 AktG eingereicht."
    },
    {
      "date": "2024-12-10",
      "id": "95960",
      "original_text": "Löschungsankündigung\nSachsen Amtsgericht Dresden HRA 8154\nStargas Alternative Kraftstoffe KG – Dresden",
      "type": "Löschungsankündigung",
      "state": "Sachsen",
      "amtsgericht": "Amtsgericht Dresden",
      "registernummer": "HRA 8154",
      "registerart": "HRA",
      "company_name": "Stargas Alternative Kraftstoffe KG",
      "company_seat": "Dresden",
      "details": "10.12.2024 (Bekanntmachungsdatum)\n\nSachsen Amtsgericht Dresden HRA 8154\nLöschungsankündigung\n\nStargas Alternative Kraftstoffe KG\nKommanditgesellschaft\nDresden\n\nDas Registergericht beabsichtigt, die im Handelsregister eingetragene Firma von Amts wegen nach § 31 Abs. 2 HGB, 393 FamFG zu löschen. Die Frist zur Erhebung eines Widerspruchs gegen die beabsichtigte Löschung wird auf einen Monat festgesetzt."
    },
    {
      "date": "2024-12-10",
      "id": "95961",
      "original_text": "Löschungsankündigung\nSachsen Amtsgericht Chemnitz HRB 28589\nKGH Immobilien GmbH – Reinsdorf",
      "type": "Löschungsankündigung",
      "state": "Sachsen",
      "amtsgericht": "Amtsgericht Chemnitz",
      "registernummer": "HRB 28589",
      "registerart": "HRB",
      "company_name": "KGH Immobilien GmbH",
      "company_seat": "Reinsdorf",
      "details": "10.12.2024 (Bekanntmachungsdatum)\n\nSachsen Amtsgericht Chemnitz HRB 28589\nLöschungsankündigung\n\nKGH Immobilien GmbH\nGesellschaft mit beschränkter Haftung\nReinsdorf\n\nDas Registergericht beabsichtigt, die im Handelsregister eingetragene Gesellschaft von Amts wegen nach § 394 FamFG zu löschen. Die Frist zu Erhebung eines Widerspruchs gegen die beabsichtigte Löschung wird auf einen Monat festgesetzt."
    },
    {
      "date": "2024-12-10",
      "id": "95962",
      "original_text": "Registerbekanntmachung nach dem Umwandlungsgesetz\nNiedersachsen Amtsgericht Oldenburg (Oldenburg) HRB 130751 früher Amtsgericht Wilhelmshaven\nvan der Kamp Beteiligungsgesellschaft mit beschränkter Haftung – Varel",
      "type": "Registerbekanntmachung nach dem Umwandlungsgesetz",
      "state": "Niedersachsen",
      "amtsgericht": "Amtsgericht Oldenburg (Oldenburg)",
      "registernummer": "HRB 130751",
      "registerart": "HRB",
      "company_name": "van der Kamp Beteiligungsgesellschaft mit beschränkter Haftung",
      "company_seat": "Varel",
      "former_amtsgericht": "Wilhelmshaven",
      "details": "10.12.2024 (Bekanntmachungsdatum)\n\nNiedersachsen Amtsgericht Oldenburg (Oldenburg) HRB 130751 früher Amtsgericht Wilhelmshaven\nRegisterbekanntmachung nach dem Umwandlungsgesetz 10.12.2024 (Eintragungsdatum)\n\nvan der Kamp Beteiligungsgesellschaft mit beschränkter Haftung\nGesellschaft mit beschränkter Haftung\nVarel\n\nDen Gläubigern der an der Verschmelzung beteiligten Rechtsträger ist, wenn sie binnen sechs Monaten nach dem Tag, an dem die Eintragung der Verschmelzung in das Register des Sitzes desjenigen Rechtsträgers, dessen Gläubiger sie sind, nach § 19  Abs.  3 UmwG als bekannt gemacht gilt, ihren Anspruch nach Grund und Höhe schriftlich anmelden, Sicherheit zu leisten, soweit sie nicht Befriedigung verlangen können. Dieses Recht steht den Gläubigern jedoch nur zu, wenn sie glaubhaft machen, dass durch die Verschmelzung die Erfüllung der Forderung gefährdet wird."
    },
    {
      "date": "2024-12-10",
      "id": "95963",
      "original_text": "Registerbekanntmachung nach dem Umwandlungsgesetz\nNiedersachsen Amtsgericht Lüneburg HRA 200963\nElfte DGI GmbH & Co. KG – Egestorf",
      "type": "Registerbekanntmachung nach dem Umwandlungsgesetz",
      "state": "Niedersachsen",
      "amtsgericht": "Amtsgericht Lüneburg",
      "registernummer": "HRA 200963",
      "registerart": "HRA",
      "company_name": "Elfte DGI GmbH & Co. KG",
      "company_seat": "Egestorf",
      "details": "10.12.2024 (Bekanntmachungsdatum)\n\nNiedersachsen Amtsgericht Lüneburg HRA 200963\nRegisterbekanntmachung nach dem Umwandlungsgesetz 10.12.2024 (Eintragungsdatum)\n\nElfte DGI GmbH & Co. KG\nKommanditgesellschaft\nEgestorf\n\nDen Gläubigern der an der Verschmelzung beteiligten Rechtsträger ist, wenn sie binnen sechs Monaten nach dem Tag, an dem die Eintragung der Verschmelzung in das Register des Sitzes desjenigen Rechtsträgers, dessen Gläubiger sie sind, nach § 19  Abs.  3 UmwG als bekannt gemacht gilt, ihren Anspruch nach Grund und Höhe schriftlich anmelden, Sicherheit zu leisten, soweit sie nicht Befriedigung verlangen können. Dieses Recht steht den Gläubigern jedoch nur zu, wenn sie glaubhaft machen, dass durch die Verschmelzung die Erfüllung der Forderung gefährdet wird."
    },
    {
      "date": "2024-12-10",
      "id": "95964",
      "original_text": "Löschungsankündigung\nNiedersachsen Amtsgericht Oldenburg (Oldenburg) HRB 215861\nWeserbau GmbH – Nordenham",
      "type": "Löschungsankündigung",
      "state": "Niedersachsen",
      "amtsgericht": "Amtsgericht Oldenburg (Oldenburg)",
      "registernummer": "HRB 215861",
      "registerart": "HRB",
      "company_name": "Weserbau GmbH",
      "company_seat": "Nordenham",
      "details": "10.12.2024 (Bekanntmachungsdatum)\n\nNiedersachsen Amtsgericht Oldenburg (Oldenburg) HRB 215861\nLöschungsankündigung\n\nWeserbau GmbH\nGesellschaft mit beschränkter Haftung\nNordenham\n\nDas Registergericht beabsichtigt, die Gesellschaft von Amts wegen nach § 394 FamFG zu löschen. Die Frist zur Erhebung eines Widerspruchs ist auf 1 Monat ab dieser Registerbekanntmachung festgesetzt."
    },
    {
      "date": "2024-12-10",
      "id": "95965",
      "original_text": "Registerbekanntmachung nach dem Umwandlungsgesetz\nNiedersachsen Amtsgericht Tostedt HRB 206711\nSUNRISE X GmbH – Geestland",
      "type": "Registerbekanntmachung nach dem Umwandlungsgesetz",
      "state": "Niedersachsen",
      "amtsgericht": "Amtsgericht Tostedt",
      "registernummer": "HRB 206711",
      "registerart": "HRB",
      "company_name": "SUNRISE X GmbH",
      "company_seat": "Geestland",
      "details": "10.12.2024 (Bekanntmachungsdatum)\n\nNiedersachsen Amtsgericht Tostedt HRB 206711\nRegisterbekanntmachung nach dem Umwandlungsgesetz 10.12.2024 (Eintragungsdatum)\n\nSUNRISE X GmbH\nGesellschaft mit beschränkter Haftung\nGeestland\n\nDen Gläubigern der an der Verschmelzung beteiligten Rechtsträger ist, wenn sie binnen sechs Monaten nach dem Tag, an dem die Eintragung der Verschmelzung in das Register des Sitzes desjenigen Rechtsträgers, dessen Gläubiger sie sind, nach § 19  Abs.  3 UmwG als bekannt gemacht gilt, ihren Anspruch nach Grund und Höhe schriftlich anmelden, Sicherheit zu leisten, soweit sie nicht Befriedigung verlangen können. Dieses Recht steht den Gläubigern jedoch nur zu, wenn sie glaubhaft machen, dass durch die Verschmelzung die Erfüllung der Forderung gefährdet wird."
    },
    {
      "date": "2024-12-10",
      "id": "95966",
      "original_text": "Registerbekanntmachung nach dem Umwandlungsgesetz\nNiedersachsen Amtsgericht Oldenburg (Oldenburg) HRB 130749 früher Amtsgericht Wilhelmshaven\nMeyer & van der Kamp Gesellschaft mit beschränkter Haftung – Varel",
      "type": "Registerbekanntmachung nach dem Umwandlungsgesetz",
      "state": "Niedersachsen",
      "amtsgericht": "Amtsgericht Oldenburg (Oldenburg)",
      "registernummer": "HRB 130749",
      "registerart": "HRB",
      "company_name": "Meyer & van der Kamp Gesellschaft mit beschränkter Haftung",
      "company_seat": "Varel",
      "former_amtsgericht": "Wilhelmshaven",
      "details": "10.12.2024 (Bekanntmachungsdatum)\n\nNiedersachsen Amtsgericht Oldenburg (Oldenburg) HRB 130749 früher Amtsgericht Wilhelmshaven\nRegisterbekanntmachung nach dem Umwandlungsgesetz 10.12.2024 (Eintragungsdatum)\n\nMeyer & van der Kamp Gesellschaft mit beschränkter Haftung\nGesellschaft mit beschränkter Haftung\nVarel\n\nDen Gläubigern der an der Verschmelzung beteiligten Rechtsträger ist, wenn sie binnen sechs Monaten nach dem Tag, an dem die Eintragung der Verschmelzung in das Register des Sitzes desjenigen Rechtsträgers, dessen Gläubiger sie sind, nach § 19  Abs.  3 UmwG als bekannt gemacht gilt, ihren Anspruch nach Grund und Höhe schriftlich anmelden, Sicherheit zu leisten, soweit sie nicht Befriedigung verlangen können. Dieses Recht steht den Gläubigern jedoch nur zu, wenn sie glaubhaft machen, dass durch die Verschmelzung die Erfüllung der Forderung gefährdet wird."
    },
    {
      "date": "2024-12-10",
      "id": "95967",
      "original_text": "Löschungsankündigung\nNiedersachsen Amtsgericht Braunschweig HRB 211093\nMT AUTO GmbH – Braunschweig",
      "type": "Löschungsankündigung",
      "state": "Niedersachsen",
      "amtsgericht": "Amtsgericht Braunschweig",
      "registernummer": "HRB 211093",
      "registerart": "HRB",
      "company_name": "MT AUTO GmbH",
      "company_seat": "Braunschweig",
      "details": "10.12.2024 (Bekanntmachungsdatum)\n\nNiedersachsen Amtsgericht Braunschweig HRB 211093\nLöschungsankündigung\n\nMT AUTO GmbH\nGesellschaft mit beschränkter Haftung\nBraunschweig\n\nDas Registergericht beabsichtigt, die Gesellschaft von Amts wegen nach § 394 FamFG zu löschen. Die Frist zur Erhebung eines Widerspruchs ist auf 1 Monat ab dieser Registerbekanntmachung festgesetzt."
    },
    {
      "date": "2024-12-10",
      "id": "95968",
      "original_text": "Registerbekanntmachung nach dem Umwandlungsgesetz\nNiedersachsen Amtsgericht Lüneburg HRA 200962\nZehnte DGI GmbH & Co. KG – Egestorf",
      "type": "Registerbekanntmachung nach dem Umwandlungsgesetz",
      "state": "Niedersachsen",
      "amtsgericht": "Amtsgericht Lüneburg",
      "registernummer": "HRA 200962",
      "registerart": "HRA",
      "company_name": "Zehnte DGI GmbH & Co. KG",
      "company_seat": "Egestorf",
      "details": "10.12.2024 (Bekanntmachungsdatum)\n\nNiedersachsen Amtsgericht Lüneburg HRA 200962\nRegisterbekanntmachung nach dem Umwandlungsgesetz 10.12.2024 (Eintragungsdatum)\n\nZehnte DGI GmbH & Co. KG\nKommanditgesellschaft\nEgestorf\n\nDen Gläubigern der an der Verschmelzung beteiligten Rechtsträger ist, wenn sie binnen sechs Monaten nach dem Tag, an dem die Eintragung der Verschmelzung in das Register des Sitzes desjenigen Rechtsträgers, dessen Gläubiger sie sind, nach § 19  Abs.  3 UmwG als bekannt gemacht gilt, ihren Anspruch nach Grund und Höhe schriftlich anmelden, Sicherheit zu leisten, soweit sie nicht Befriedigung verlangen können. Dieses Recht steht den Gläubigern jedoch nur zu, wenn sie glaubhaft machen, dass durch die Verschmelzung die Erfüllung der Forderung gefährdet wird."
    },
    {
      "date": "2024-12-10",
      "id": "95969",
      "original_text": "Registerbekanntmachung nach dem Umwandlungsgesetz\nNiedersachsen Amtsgericht Lüneburg HRA 110754 früher Amtsgericht Winsen\nGraubner Projektentwicklung GmbH & Co. KG – Egestorf",
      "type": "Registerbekanntmachung nach dem Umwandlungsgesetz",
      "state": "Niedersachsen",
      "amtsgericht": "Amtsgericht Lüneburg",
      "registernummer": "HRA 110754",
      "registerart": "HRA",
      "company_name": "Graubner Projektentwicklung GmbH & Co. KG",
      "company_seat": "Egestorf",
      "former_amtsgericht": "Winsen",
      "details": "10.12.2024 (Bekanntmachungsdatum)\n\nNiedersachsen Amtsgericht Lüneburg HRA 110754 früher Amtsgericht Winsen\nRegisterbekanntmachung nach dem Umwandlungsgesetz 10.12.2024 (Eintragungsdatum)\n\nGraubner Projektentwicklung GmbH & Co. KG\nKommanditgesellschaft\nEgestorf\n\nDen Gläubigern der an der Verschmelzung beteiligten Rechtsträger ist, wenn sie binnen sechs Monaten nach dem Tag, an dem die Eintragung der Verschmelzung in das Register des Sitzes desjenigen Rechtsträgers, dessen Gläubiger sie sind, nach § 19  Abs.  3 UmwG als bekannt gemacht gilt, ihren Anspruch nach Grund und Höhe schriftlich anmelden, Sicherheit zu leisten, soweit sie nicht Befriedigung verlangen können. Dieses Recht steht den Gläubigern jedoch nur zu, wenn sie glaubhaft machen, dass durch die Verschmelzung die Erfüllung der Forderung gefährdet wird."
    },
    {
      "date": "2024-12-10",
      "id": "95970",
      "original_text": "Registerbekanntmachung nach dem Umwandlungsgesetz\nNiedersachsen Amtsgericht Osnabrück HRB 220785\nT&T Bautenschutz GmbH – Twist",
      "type": "Registerbekanntmachung nach dem Umwandlungsgesetz",
      "state": "Niedersachsen",
      "amtsgericht": "Amtsgericht Osnabrück",
      "registernummer": "HRB 220785",
      "registerart": "HRB",
      "company_name": "T&T Bautenschutz GmbH",
      "company_seat": "Twist",
      "details": "10.12.2024 (Bekanntmachungsdatum)\n\nNiedersachsen Amtsgericht Osnabrück HRB 220785\nRegisterbekanntmachung nach dem Umwandlungsgesetz 10.12.2024 (Eintragungsdatum)\n\nT&T Bautenschutz GmbH\nGesellschaft mit beschränkter Haftung\nTwist\n\nDen Gläubigern der an der Ausgliederung beteiligten Rechtsträger ist, wenn sie binnen sechs Monaten nach dem Tag, an dem die Eintragung der Ausgliederung in das Register des Sitzes desjenigen Rechtsträgers, dessen Gläubiger sie sind, nach § 19 Abs. 3 UmwG als bekannt gemacht gilt, ihren Anspruch nach Grund und Höhe schriftlich anmelden, Sicherheit zu leisten, soweit sie nicht Befriedigung verlangen können. Dieses Recht steht den Gläubigern jedoch nur zu, wenn sie glaubhaft machen, dass durch die Ausgliederung die Erfüllung der Forderung gefährdet wird."
    },
    {
      "date": "2024-12-10",
      "id": "95971",
      "original_text": "Einreichung neuer Dokumente\nNiedersachsen Amtsgericht Braunschweig HRB 100516 früher Amtsgericht Wolfsburg\nVolkswagen Group Services GmbH – Wolfsburg",
      "type": "Einreichung neuer Dokumente",
      "state": "Niedersachsen",
      "amtsgericht": "Amtsgericht Braunschweig",
      "registernummer": "HRB 100516",
      "registerart": "HRB",
      "company_name": "Volkswagen Group Services GmbH",
      "company_seat": "Wolfsburg",
      "former_amtsgericht": "Wolfsburg",
      "details": "10.12.2024 (Bekanntmachungsdatum)\n\nNiedersachsen Amtsgericht Braunschweig HRB 100516 früher Amtsgericht Wolfsburg\nEinreichung neuer Dokumente 10.12.2024 (Eintragungsdatum)\n\nVolkswagen Group Services GmbH\nGesellschaft mit beschränkter Haftung\nWolfsburg\n\nDie Liste der Mitglieder des Aufsichtsrats wurde beim Registergericht eingereicht."
    },
    {
      "date": "2024-12-10",
      "id": "95972",
      "original_text": "Registerbekanntmachung nach dem Umwandlungsgesetz\nNiedersachsen Amtsgericht Lüneburg HRA 110754 früher Amtsgericht Winsen\nGraubner Projektentwicklung GmbH & Co. KG – Egestorf",
      "type": "Registerbekanntmachung nach dem Umwandlungsgesetz",
      "state": "Niedersachsen",
      "amtsgericht": "Amtsgericht Lüneburg",
      "registernummer": "HRA 110754",
      "registerart": "HRA",
      "company_name": "Graubner Projektentwicklung GmbH & Co. KG",
      "company_seat": "Egestorf",
      "former_amtsgericht": "Winsen",
      "details": "10.12.2024 (Bekanntmachungsdatum)\n\nNiedersachsen Amtsgericht Lüneburg HRA 110754 früher Amtsgericht Winsen\nRegisterbekanntmachung nach dem Umwandlungsgesetz 10.12.2024 (Eintragungsdatum)\n\nGraubner Projektentwicklung GmbH & Co. KG\nKommanditgesellschaft\nEgestorf\n\nDen Gläubigern der an der Verschmelzung beteiligten Rechtsträger ist, wenn sie binnen sechs Monaten nach dem Tag, an dem die Eintragung der Verschmelzung in das Register des Sitzes desjenigen Rechtsträgers, dessen Gläubiger sie sind, nach § 19  Abs.  3 UmwG als bekannt gemacht gilt, ihren Anspruch nach Grund und Höhe schriftlich anmelden, Sicherheit zu leisten, soweit sie nicht Befriedigung verlangen können. Dieses Recht steht den Gläubigern jedoch nur zu, wenn sie glaubhaft machen, dass durch die Verschmelzung die Erfüllung der Forderung gefährdet wird."
    },
    {
      "date": "2024-12-10",
      "id": "95973",
      "original_text": "Registerbekanntmachung nach dem Umwandlungsgesetz\nNiedersachsen Amtsgericht Tostedt HRB 206242\nSUNWAY X GmbH – Geestland",
      "type": "Registerbekanntmachung nach dem Umwandlungsgesetz",
      "state": "Niedersachsen",
      "amtsgericht": "Amtsgericht Tostedt",
      "registernummer": "HRB 206242",
      "registerart": "HRB",
      "company_name": "SUNWAY X GmbH",
      "company_seat": "Geestland",
      "details": "10.12.2024 (Bekanntmachungsdatum)\n\nNiedersachsen Amtsgericht Tostedt HRB 206242\nRegisterbekanntmachung nach dem Umwandlungsgesetz 10.12.2024 (Eintragungsdatum)\n\nSUNWAY X GmbH\nGesellschaft mit beschränkter Haftung\nGeestland\n\nDen Gläubigern der an der Verschmelzung beteiligten Rechtsträger ist, wenn sie binnen sechs Monaten nach dem Tag, an dem die Eintragung der Verschmelzung in das Register des Sitzes desjenigen Rechtsträgers, dessen Gläubiger sie sind, nach § 19  Abs.  3 UmwG als bekannt gemacht gilt, ihren Anspruch nach Grund und Höhe schriftlich anmelden, Sicherheit zu leisten, soweit sie nicht Befriedigung verlangen können. Dieses Recht steht den Gläubigern jedoch nur zu, wenn sie glaubhaft machen, dass durch die Verschmelzung die Erfüllung der Forderung gefährdet wird."
    },
    {
      "date": "2024-12-10",
      "id": "95974",
      "original_text": "Sonstige Registerbekanntmachung\nNiedersachsen Amtsgericht Hannover HRB 110532 früher Amtsgericht Neustadt a. Rbge. (Neustadt)\nStadtwerke Garbsen GmbH – Garbsen",
      "type": "Sonstige Registerbekanntmachung",
      "state": "Niedersachsen",
      "amtsgericht": "Amtsgericht Hannover",
      "registernummer": "HRB 110532",
      "registerart": "HRB",
      "company_name": "Stadtwerke Garbsen GmbH",
      "company_seat": "Garbsen",
      "former_amtsgericht": "Neustadt a. Rbge. (Neustadt)",
      "details": "10.12.2024 (Bekanntmachungsdatum)\n\nNiedersachsen Amtsgericht Hannover HRB 110532 früher Amtsgericht Neustadt a. Rbge. (Neustadt)\nSonstige Registerbekanntmachung 10.12.2024 (Eintragungsdatum)\n\nStadtwerke Garbsen GmbH\nGesellschaft mit beschränkter Haftung\nGarbsen\n\nDie Liste der Mitglieder des Aufsichtsrats wurde beim Registergericht eingereicht."
    },
    {
      "date": "2024-12-10",
      "id": "95975",
      "original_text": "Löschungsankündigung\nNiedersachsen Amtsgericht Oldenburg (Oldenburg) HRB 150395 früher Amtsgericht Cloppenburg\nREKA Bau GmbH – Barßel",
      "type": "Löschungsankündigung",
      "state": "Niedersachsen",
      "amtsgericht": "Amtsgericht Oldenburg (Oldenburg)",
      "registernummer": "HRB 150395",
      "registerart": "HRB",
      "company_name": "REKA Bau GmbH",
      "company_seat": "Barßel",
      "former_amtsgericht": "Cloppenburg",
      "details": "10.12.2024 (Bekanntmachungsdatum)\n\nNiedersachsen Amtsgericht Oldenburg (Oldenburg) HRB 150395 früher Amtsgericht Cloppenburg\nLöschungsankündigung\n\nREKA Bau GmbH\nGesellschaft mit beschränkter Haftung\nBarßel\n\nDas Registergericht beabsichtigt, die Gesellschaft von Amts wegen nach § 394 FamFG zu löschen. Die Frist zur Erhebung eines Widerspruchs ist auf 1 Monat ab dieser Registerbekanntmachung festgesetzt."
    },
    {
      "date": "2024-12-10",
      "id": "95976",
      "original_text": "Löschungsankündigung\nNiedersachsen Amtsgericht Lüneburg HRB 210121\nKaiser Bau GmbH – Undeloh",
      "type": "Löschungsankündigung",
      "state": "Niedersachsen",
      "amtsgericht": "Amtsgericht Lüneburg",
      "registernummer": "HRB 210121",
      "registerart": "HRB",
      "company_name": "Kaiser Bau GmbH",
      "company_seat": "Undeloh",
      "details": "10.12.2024 (Bekanntmachungsdatum)\n\nNiedersachsen Amtsgericht Lüneburg HRB 210121\nLöschungsankündigung\n\nKaiser Bau GmbH\nGesellschaft mit beschränkter Haftung\nUndeloh\n\nDas Registergericht beabsichtigt, die Gesellschaft von Amts wegen nach § 394 FamFG zu löschen. Die Frist zur Erhebung eines Widerspruchs ist auf 1 Monat ab dieser Registerbekanntmachung festgesetzt."
    },
    {
      "date": "2024-12-10",
      "id": "95977",
      "original_text": "Löschungsankündigung\nNiedersachsen Amtsgericht Tostedt HRB 204770\nRH Maschinenbau und Automation Beteiligungs-GmbH – Cadenberge",
      "type": "Löschungsankündigung",
      "state": "Niedersachsen",
      "amtsgericht": "Amtsgericht Tostedt",
      "registernummer": "HRB 204770",
      "registerart": "HRB",
      "company_name": "RH Maschinenbau und Automation Beteiligungs-GmbH",
      "company_seat": "Cadenberge",
      "details": "10.12.2024 (Bekanntmachungsdatum)\n\nNiedersachsen Amtsgericht Tostedt HRB 204770\nLöschungsankündigung\n\nRH Maschinenbau und Automation Beteiligungs-GmbH\nGesellschaft mit beschränkter Haftung\nCadenberge\n\nDas Registergericht beabsichtigt, die Gesellschaft von Amts wegen nach § 394 FamFG zu löschen. Die Frist zur Erhebung eines Widerspruchs ist auf 1 Monat ab dieser Registerbekanntmachung festgesetzt."
    },
    {
      "date": "2024-12-10",
      "id": "95978",
      "original_text": "Einreichung neuer Dokumente\nNiedersachsen Amtsgericht Lüneburg HRB 204039\nSpinnhütte Aktiengesellschaft – Celle",
      "type": "Einreichung neuer Dokumente",
      "state": "Niedersachsen",
      "amtsgericht": "Amtsgericht Lüneburg",
      "registernummer": "HRB 204039",
      "registerart": "HRB",
      "company_name": "Spinnhütte Aktiengesellschaft",
      "company_seat": "Celle",
      "details": "10.12.2024 (Bekanntmachungsdatum)\n\nNiedersachsen Amtsgericht Lüneburg HRB 204039\nEinreichung neuer Dokumente\n\nSpinnhütte Aktiengesellschaft\nAktiengesellschaft\nCelle\n\nDie Liste der Mitglieder des Aufsichtsrats wurde beim Registergericht eingereicht."
    },
    {
      "date": "2024-12-10",
      "id": "95979",
      "original_text": "Einreichung neuer Dokumente\nBremen Amtsgericht Bremen HRB 22233\nHKW Blumenthal GmbH – Bremen",
      "type": "Einreichung neuer Dokumente",
      "state": "Bremen",
      "amtsgericht": "Amtsgericht Bremen",
      "registernummer": "HRB 22233",
      "registerart": "HRB",
      "company_name": "HKW Blumenthal GmbH",
      "company_seat": "Bremen",
      "details": "10.12.2024 (Bekanntmachungsdatum)\n\nBremen Amtsgericht Bremen HRB 22233\nEinreichung neuer Dokumente\n\nHKW Blumenthal GmbH\nGesellschaft mit beschränkter Haftung\nBremen\n\nAls nicht eingetragen wird bekannt gemacht: Liste des Aufsichtsrats wurde eingereicht."
    },
    {
      "date": "2024-12-10",
      "id": "95980",
      "original_text": "Registerbekanntmachung nach dem Umwandlungsgesetz\nRheinland-Pfalz Amtsgericht Zweibrücken HRB 32638\nAlexander Kedzierski Holding GmbH – Rodalben",
      "type": "Registerbekanntmachung nach dem Umwandlungsgesetz",
      "state": "Rheinland-Pfalz",
      "amtsgericht": "Amtsgericht Zweibrücken",
      "registernummer": "HRB 32638",
      "registerart": "HRB",
      "company_name": "Alexander Kedzierski Holding GmbH",
      "company_seat": "Rodalben",
      "details": "10.12.2024 (Bekanntmachungsdatum)\n\nRheinland-Pfalz Amtsgericht Zweibrücken HRB 32638\nRegisterbekanntmachung nach dem Umwandlungsgesetz 09.12.2024 (Eintragungsdatum)\n\nAlexander Kedzierski Holding GmbH\nGesellschaft mit beschränkter Haftung\nRodalben\n\nAls nicht eingetragen wird veröffentlicht: Den Gläubigern der an der Verschmelzung beteiligten Rechtsträger ist, wenn sie binnen sechs Monaten nach dem Tag, an dem die Eintragung der Verschmelzung in das Register des Sitzes desjenigen Rechtsträgers,dessen Gläubiger sie sind, nach § 19 Abs. 3 UmwG als bekannt gemacht gilt, ihren Anspruch nach Grund und Höhe schriftlich anmelden, Sicherheit zu leisten, soweit sie nicht Befriedigung verlangen können. Dieses Recht steht den Gläubigern jedoch nur zu, wenn sie glaubhaft machen, dass durch die Verschmelzung die Erfüllungd er Forderung gefährdet wird."
    },
    {
      "date": "2024-12-10",
      "id": "95981",
      "original_text": "Löschungsankündigung\nRheinland-Pfalz Amtsgericht Montabaur HRB 29247\nDanque Reifen GmbH – Altenkirchen",
      "type": "Löschungsankündigung",
      "state": "Rheinland-Pfalz",
      "amtsgericht": "Amtsgericht Montabaur",
      "registernummer": "HRB 29247",
      "registerart": "HRB",
      "company_name": "Danque Reifen GmbH",
      "company_seat": "Altenkirchen",
      "details": "10.12.2024 (Bekanntmachungsdatum)\n\nRheinland-Pfalz Amtsgericht Montabaur HRB 29247\nLöschungsankündigung 10.12.2024 (Eintragungsdatum)\n\nDanque Reifen GmbH\nGesellschaft mit beschränkter Haftung\nAltenkirchen\n\nDas Registergericht beabsichtigt die Gesellschaft von Amts wegen nach § 394 FamFG zu löschen. Die Frist zur Erhebung eines Widerspruchs ist auf einen Monat festgesetzt."
    },
    {
      "date": "2024-12-10",
      "id": "95982",
      "original_text": "Registerbekanntmachung nach dem Umwandlungsgesetz\nRheinland-Pfalz Amtsgericht Kaiserslautern HRB 34069\nElektrotechnik Terner GmbH – Otterberg",
      "type": "Registerbekanntmachung nach dem Umwandlungsgesetz",
      "state": "Rheinland-Pfalz",
      "amtsgericht": "Amtsgericht Kaiserslautern",
      "registernummer": "HRB 34069",
      "registerart": "HRB",
      "company_name": "Elektrotechnik Terner GmbH",
      "company_seat": "Otterberg",
      "details": "10.12.2024 (Bekanntmachungsdatum)\n\nRheinland-Pfalz Amtsgericht Kaiserslautern HRB 34069\nRegisterbekanntmachung nach dem Umwandlungsgesetz 10.12.2024 (Eintragungsdatum)\n\nElektrotechnik Terner GmbH\nGesellschaft mit beschränkter Haftung\nOtterberg\n\nAls nicht eingetragen wird veröffentlicht: Den Gläubigern der an der Ausgliederung beteiligten Rechtsträger ist, wenn sie binnen sechs Monaten nac hdem Tag, an dem die Eintragung der Ausgliederung in das Register des Sitzes desjenigen Rechtsträgers,dessen Gläubiger sie sind, nach § 19 Abs. 3 UmwG als bekannt gemacht gilt, ihren Anspruch nach Grund und Höhe schriftlich anmelden, Sicherheit zu leisten, soweit sie nicht Befriedigung verlangen können. Dieses Recht steht den Gläubigern jedoch nur zu, wenn sie glaubhaft machen, dass durch die Ausgliederung die Erfüllung der Forderung gefährdet wird."
    },
    {
      "date": "2024-12-10",
      "id": "95983",
      "original_text": "Löschungsankündigung\nNordrhein-Westfalen Amtsgericht Dortmund HRB 30553\nBesser Leben Media Produktions und Vertriebs UG (haftungsbeschränkt) – Dortmund",
      "type": "Löschungsankündigung",
      "state": "Nordrhein-Westfalen",
      "amtsgericht": "Amtsgericht Dortmund",
      "registernummer": "HRB 30553",
      "registerart": "HRB",
      "company_name": "Besser Leben Media Produktions und Vertriebs UG (haftungsbeschränkt)",
      "company_seat": "Dortmund",
      "details": "10.12.2024 (Bekanntmachungsdatum)\n\nNordrhein-Westfalen Amtsgericht Dortmund HRB 30553\nLöschungsankündigung\n\nBesser Leben Media Produktions und Vertriebs UG (haftungsbeschränkt)\nGesellschaft mit beschränkter Haftung\nDortmund\n\nDas Registergericht beabsichtigt die Gesellschaft von Amts wegen nach § 394 FamFG zu löschen. Die Frist zur Erhebung eines Widerspruchs ist auf #DV.Fr(Text=\"Bitte wählen Sie die Widerspruchsfrist aus!\",Eingabe=\"einen Monat\",\"zwei Monate\",\"drei Monate\",\"#insert(Text=\"Freitext\")\"|\"freier Text\") festgesetzt."
    },
    {
      "date": "2024-12-10",
      "id": "95984",
      "original_text": "Löschungsankündigung\nNordrhein-Westfalen Amtsgericht Dortmund HRB 30553\nBesser Leben Media Produktions und Vertriebs UG (haftungsbeschränkt) – Dortmund",
      "type": "Löschungsankündigung",
      "state": "Nordrhein-Westfalen",
      "amtsgericht": "Amtsgericht Dortmund",
      "registernummer": "HRB 30553",
      "registerart": "HRB",
      "company_name": "Besser Leben Media Produktions und Vertriebs UG (haftungsbeschränkt)",
      "company_seat": "Dortmund",
      "details": "10.12.2024 (Bekanntmachungsdatum)\n\nNordrhein-Westfalen Amtsgericht Dortmund HRB 30553\nLöschungsankündigung\n\nBesser Leben Media Produktions und Vertriebs UG (haftungsbeschränkt)\nGesellschaft mit beschränkter Haftung\nDortmund\n\nDas Registergericht beabsichtigt die Gesellschaft von Amts wegen nach § 394 FamFG zu löschen. Die Frist zur Erhebung eines Widerspruchs ist auf zwei Monate festgesetzt."
    },
    {
      "date": "2024-12-10",
      "id": "95985",
      "original_text": "Löschungsankündigung\nNordrhein-Westfalen Amtsgericht Gütersloh HRB 1293\nEggelbusch-Beteiligungsgesellschaft mbH – Harsewinkel-Greffen",
      "type": "Löschungsankündigung",
      "state": "Nordrhein-Westfalen",
      "amtsgericht": "Amtsgericht Gütersloh",
      "registernummer": "HRB 1293",
      "registerart": "HRB",
      "company_name": "Eggelbusch-Beteiligungsgesellschaft mbH",
      "company_seat": "Harsewinkel-Greffen",
      "details": "10.12.2024 (Bekanntmachungsdatum)\n\nNordrhein-Westfalen Amtsgericht Gütersloh HRB 1293\nLöschungsankündigung 10.12.2024 (Eintragungsdatum)\n\nEggelbusch-Beteiligungsgesellschaft mbH\nGesellschaft mit beschränkter Haftung\nHarsewinkel-Greffen\n\nDas Registergericht beabsichtigt die Gesellschaft von Amts wegen nach § 394 FamFG zu löschen. Die Frist zur Erhebung eines Widerspruchs ist auf einen Monat festgesetzt."
    },
    {
      "date": "2024-12-10",
      "id": "95986",
      "original_text": "Registerbekanntmachung nach dem Umwandlungsgesetz\nNordrhein-Westfalen Amtsgericht Münster HRA 11882\nPapke Credit GmbH & Co. KG – Münster",
      "type": "Registerbekanntmachung nach dem Umwandlungsgesetz",
      "state": "Nordrhein-Westfalen",
      "amtsgericht": "Amtsgericht Münster",
      "registernummer": "HRA 11882",
      "registerart": "HRA",
      "company_name": "Papke Credit GmbH & Co. KG",
      "company_seat": "Münster",
      "details": "10.12.2024 (Bekanntmachungsdatum)\n\nNordrhein-Westfalen Amtsgericht Münster HRA 11882\nRegisterbekanntmachung nach dem Umwandlungsgesetz 10.12.2024 (Eintragungsdatum)\n\nPapke Credit GmbH & Co. KG\nKommanditgesellschaft\nMünster\n\nDen Gläubigern der an der Ausgliederung beteiligten Rechtsträger ist, wenn sie binnen sechs Monaten nach dem Tag, an dem die Eintragung der Ausgliederung in das Register des Sitzes desjenigen Rechtsträgers, dessen Gläubiger sie sind, nach § 19 Absatz 3 UmwG als bekanntgemacht gilt, ihren Anspruch nach Grund und Höhe schriftlich anmelden, Sicherheit zu leisten, soweit sie nicht Befriedigung verlangen können. Dieses Recht steht den Gläubigern jedoch nur zu, wenn sie glaubhaft machen, dass durch die Ausgliederung die Erfüllung ihrer Forderung gefährdet wird."
    },
    {
      "date": "2024-12-10",
      "id": "95987",
      "original_text": "Registerbekanntmachung nach dem Umwandlungsgesetz\nNordrhein-Westfalen Amtsgericht Düsseldorf HRB 53655\nVorsorge Service GmbH – Düsseldorf",
      "type": "Registerbekanntmachung nach dem Umwandlungsgesetz",
      "state": "Nordrhein-Westfalen",
      "amtsgericht": "Amtsgericht Düsseldorf",
      "registernummer": "HRB 53655",
      "registerart": "HRB",
      "company_name": "Vorsorge Service GmbH",
      "company_seat": "Düsseldorf",
      "details": "10.12.2024 (Bekanntmachungsdatum)\n\nNordrhein-Westfalen Amtsgericht Düsseldorf HRB 53655\nRegisterbekanntmachung nach dem Umwandlungsgesetz 10.12.2024 (Eintragungsdatum)\n\nVorsorge Service GmbH\nGesellschaft mit beschränkter Haftung\nDüsseldorf\n\nDen Gläubigern der an der Verschmelzung beteiligten Rechtsträger ist, wenn sie binnen sechs Monaten nach dem Tag, an dem die Eintragung der Verschmelzung in das Register des Sitzes desjenigen Rechtsträgers, dessen Gläubiger sie sind, nach § 19 Absatz 3 UmwG als bekanntgemacht gilt, ihren Anspruch nach Grund und Höhe schriftlich anmelden, Sicherheit zu leisten, soweit sie nicht Befriedigung verlangen können. Dieses Recht steht den Gläubigern jedoch nur zu, wenn sie glaubhaft machen, dass durch die Verschmelzung die Erfüllung ihrer Forderung gefährdet wird."
    },
    {
      "date": "2024-12-10",
      "id": "95988",
      "original_text": "Löschungsankündigung\nNordrhein-Westfalen Amtsgericht Wuppertal HRB 30792\nDVA I GmbH – Erkrath",
      "type": "Löschungsankündigung",
      "state": "Nordrhein-Westfalen",
      "amtsgericht": "Amtsgericht Wuppertal",
      "registernummer": "HRB 30792",
      "registerart": "HRB",
      "company_name": "DVA I GmbH",
      "company_seat": "Erkrath",
      "details": "10.12.2024 (Bekanntmachungsdatum)\n\nNordrhein-Westfalen Amtsgericht Wuppertal HRB 30792\nLöschungsankündigung\n\nDVA I GmbH\nGesellschaft mit beschränkter Haftung\nErkrath\n\nDas Registergericht beabsichtigt die Gesellschaft von Amts wegen nach § 394 FamFG zu löschen. Die Frist zur Erhebung eines Widerspruchs ist auf einen Monat festgesetzt."
    },
    {
      "date": "2024-12-10",
      "id": "95989",
      "original_text": "Einreichung neuer Dokumente\nNordrhein-Westfalen Amtsgericht Düsseldorf HRB 38062\nVodafone GmbH – Düsseldorf",
      "type": "Einreichung neuer Dokumente",
      "state": "Nordrhein-Westfalen",
      "amtsgericht": "Amtsgericht Düsseldorf",
      "registernummer": "HRB 38062",
      "registerart": "HRB",
      "company_name": "Vodafone GmbH",
      "company_seat": "Düsseldorf",
      "details": "10.12.2024 (Bekanntmachungsdatum)\n\nNordrhein-Westfalen Amtsgericht Düsseldorf HRB 38062\nEinreichung neuer Dokumente\n\nVodafone GmbH\nGesellschaft mit beschränkter Haftung\nDüsseldorf\n\nDem Registergericht ist eine Liste der Mitglieder des Aufsichtsrates eingereicht worden."
    },
    {
      "date": "2024-12-10",
      "id": "95990",
      "original_text": "Löschungsankündigung\nNordrhein-Westfalen Amtsgericht Aachen HRB 9414\nMASITA GmbH Sportartikel – Geilenkirchen",
      "type": "Löschungsankündigung",
      "state": "Nordrhein-Westfalen",
      "amtsgericht": "Amtsgericht Aachen",
      "registernummer": "HRB 9414",
      "registerart": "HRB",
      "company_name": "MASITA GmbH Sportartikel",
      "company_seat": "Geilenkirchen",
      "details": "10.12.2024 (Bekanntmachungsdatum)\n\nNordrhein-Westfalen Amtsgericht Aachen HRB 9414\nLöschungsankündigung\n\nMASITA GmbH Sportartikel\nGesellschaft mit beschränkter Haftung\nGeilenkirchen\n\nDas Registergericht beabsichtigt, von Amts wegen die Gesellschaft wegen Vermögenslosigkeit nach § 394 FamFG zu löschen.\n\nZur Geltendmachung des Widerspruchs gegen die beabsichtigte Löschung wird hiermit eine Frist von einem Monat ab Veröffentlichung dieser Ankündigung bestimmt.\nRechtsbehelfsbelehrung:\n\nGegen diese Verfügung kann Widerspruch eingelegt werden. Zum Widerspruch ist jeder berechtigt, der an der Unterlassung der Löschung ein berechtigtes Interesse hat.\n\nDer Widerspruch ist bei dem Amtsgericht Aachen, Adalbertsteinweg 92, 52070 Aachen schriftlich in deutscher Sprache oder zur Niederschrift der Geschäftsstelle einzulegen. Der Widerspruch kann auch zur Niederschrift der Geschäftsstelle eines jeden Amtsgerichtes abgegeben werden.\n\nDer Widerspruch muss spätestens innerhalb der gesetzten Frist nach der Bekanntgabe der Verfügung bei dem Amtsgericht Aachen eingegangen sein. Dies gilt auch dann, wenn der Widerspruch zur Niederschrift der Geschäftsstelle eines anderen Amtsgerichtes abgegeben wurde. Die Frist beginnt mit der Bekanntgabe der Verfügung durch Veröffentlichung. Fällt das Ende der Frist auf einen Sonntag, einen allgemeinen Feiertag oder Sonnabend, so endet die Frist mit Ablauf des nächsten Werktages.\n\nDer Widerspruch muss die Bezeichnung der angefochtenen Verfügung sowie die Erklärung enthalten, dass Widerspruch gegen diese Verfügung eingelegt wird. Er ist zu unterzeichnen und soll begründet werden.\n\nDie Einlegung ist auch durch Übertragung eines elektronischen Dokuments an die elektronische Poststelle des Gerichts möglich. Das elektronische Dokument muss für die Bearbeitung durch das Gericht geeignet und mit einer qualifizierten elektronischen Signatur der verantwortenden Person versehen sein oder von der verantwortenden Person signiert und auf einem sicheren Übermittlungsweg gemäß § 130 a ZPO nach näherer Maßgabe der Verordnung über die technischen Rahmenbedingungen des elektronischen Rechtsverkehrs und über das besondere elektronische Behördenpostfach (BGBl. I, S. 3803) eingereicht werden. Weitere Informationen erhalten Sie auf der Internetseite www.justiz.de."
    },
    {
      "date": "2024-12-10",
      "id": "95991",
      "original_text": "Registerbekanntmachung nach dem Umwandlungsgesetz\nNordrhein-Westfalen Amtsgericht Köln HRA 13601\nSDK Systemdruck Köln GmbH & Co. KG – Köln",
      "type": "Registerbekanntmachung nach dem Umwandlungsgesetz",
      "state": "Nordrhein-Westfalen",
      "amtsgericht": "Amtsgericht Köln",
      "registernummer": "HRA 13601",
      "registerart": "HRA",
      "company_name": "SDK Systemdruck Köln GmbH & Co. KG",
      "company_seat": "Köln",
      "details": "10.12.2024 (Bekanntmachungsdatum)\n\nNordrhein-Westfalen Amtsgericht Köln HRA 13601\nRegisterbekanntmachung nach dem Umwandlungsgesetz 10.12.2024 (Eintragungsdatum)\n\nSDK Systemdruck Köln GmbH & Co. KG\nKommanditgesellschaft\nKöln\n\nDen Gläubigern der an der Verschmelzung beteiligten Rechtsträger ist, wenn sie binnen sechs Monaten nach dem Tag, an dem die Eintragung der Verschmelzung in das Register des Sitzes derjenigen Rechtsträger deren Gläubiger sie sind, nach § 19 Absatz 3 UmwG als bekanntgemacht gilt, ihren Anspruch nach Grund und Höhe schriftlich anmelden, Sicherheit zu leisten, soweit sie nicht Befriedigung verlangen können. Dieses Recht steht den Gläubigern jedoch nur zu, wenn sie glaubhaft machen, dass durch die Verschmelzung die Erfüllung ihrer Forderung gefährdet wird."
    },
    {
      "date": "2024-12-10",
      "id": "95992",
      "original_text": "Löschungsankündigung\nNordrhein-Westfalen Amtsgericht Kleve HRB 18230\nSAM Bau GmbH – Neukirchen-Vluyn",
      "type": "Löschungsankündigung",
      "state": "Nordrhein-Westfalen",
      "amtsgericht": "Amtsgericht Kleve",
      "registernummer": "HRB 18230",
      "registerart": "HRB",
      "company_name": "SAM Bau GmbH",
      "company_seat": "Neukirchen-Vluyn",
      "details": "10.12.2024 (Bekanntmachungsdatum)\n\nNordrhein-Westfalen Amtsgericht Kleve HRB 18230\nLöschungsankündigung\n\nSAM Bau GmbH\nGesellschaft mit beschränkter Haftung\nNeukirchen-Vluyn\n\nDas Registergericht beabsichtigt die Gesellschaft von Amts wegen nach § 394 FamFG zu löschen. Die Frist zur Erhebung eines Widerspruchs ist auf einen Monat festgesetzt."
    },
    {
      "date": "2024-12-10",
      "id": "95993",
      "original_text": "Sonstige Registerbekanntmachung\nNordrhein-Westfalen Amtsgericht Köln HRB 49226\nBayer Vital GmbH – Leverkusen",
      "type": "Sonstige Registerbekanntmachung",
      "state": "Nordrhein-Westfalen",
      "amtsgericht": "Amtsgericht Köln",
      "registernummer": "HRB 49226",
      "registerart": "HRB",
      "company_name": "Bayer Vital GmbH",
      "company_seat": "Leverkusen",
      "details": "10.12.2024 (Bekanntmachungsdatum)\n\nNordrhein-Westfalen Amtsgericht Köln HRB 49226\nSonstige Registerbekanntmachung 10.12.2024 (Eintragungsdatum)\n\nBayer Vital GmbH\nGesellschaft mit beschränkter Haftung\nLeverkusen\n\nAls nicht eingetragen wird veröffentlicht: Den Gläubigern der Gesellschaft, deren Forderungen begründet worden sind bevor die Eintragung der Beendigung des Beherrschungsvertrages  in das Handelsregister nach § 10 des Handelsgesetzbuches als bekanntgemacht gilt, hat der andere Vertragsteil Sicherheit zu leisten, wenn sie sich binnen sechs Monaten nach der Bekanntmachung der Eintragung zu diesem Zweck bei ihm melden."
    },
    {
      "date": "2024-12-10",
      "id": "95994",
      "original_text": "Löschungsankündigung\nNordrhein-Westfalen Amtsgericht Gütersloh HRB 6992\nGesundheitszentrum Werther GmbH – Werther",
      "type": "Löschungsankündigung",
      "state": "Nordrhein-Westfalen",
      "amtsgericht": "Amtsgericht Gütersloh",
      "registernummer": "HRB 6992",
      "registerart": "HRB",
      "company_name": "Gesundheitszentrum Werther GmbH",
      "company_seat": "Werther",
      "details": "10.12.2024 (Bekanntmachungsdatum)\n\nNordrhein-Westfalen Amtsgericht Gütersloh HRB 6992\nLöschungsankündigung 10.12.2024 (Eintragungsdatum)\n\nGesundheitszentrum Werther GmbH\nGesellschaft mit beschränkter Haftung\nWerther\n\nDas Registergericht beabsichtigt die Gesellschaft von Amts wegen nach § 394 FamFG zu löschen. Die Frist zur Erhebung eines Widerspruchs ist auf einen Monat festgesetzt."
    },
    {
      "date": "2024-12-10",
      "id": "95995",
      "original_text": "Löschungsankündigung\nNordrhein-Westfalen Amtsgericht Paderborn HRB 13631\nSälzer Fitness Beteiligungs UG (haftungsbeschränkt) – Büren",
      "type": "Löschungsankündigung",
      "state": "Nordrhein-Westfalen",
      "amtsgericht": "Amtsgericht Paderborn",
      "registernummer": "HRB 13631",
      "registerart": "HRB",
      "company_name": "Sälzer Fitness Beteiligungs UG (haftungsbeschränkt)",
      "company_seat": "Büren",
      "details": "10.12.2024 (Bekanntmachungsdatum)\n\nNordrhein-Westfalen Amtsgericht Paderborn HRB 13631\nLöschungsankündigung 10.12.2024 (Eintragungsdatum)\n\nSälzer Fitness Beteiligungs UG (haftungsbeschränkt)\nGesellschaft mit beschränkter Haftung\nBüren\n\nDas Registergericht beabsichtigt die Gesellschaft von Amts wegen nach § 394 FamFG zu löschen. Die Frist zur Erhebung eines Widerspruchs ist auf einen Monat festgesetzt."
    },
    {
      "date": "2024-12-10",
      "id": "95996",
      "original_text": "Löschungsankündigung\nNordrhein-Westfalen Amtsgericht Wuppertal HRB 29307\nFims GmbH – Erkrath",
      "type": "Löschungsankündigung",
      "state": "Nordrhein-Westfalen",
      "amtsgericht": "Amtsgericht Wuppertal",
      "registernummer": "HRB 29307",
      "registerart": "HRB",
      "company_name": "Fims GmbH",
      "company_seat": "Erkrath",
      "details": "10.12.2024 (Bekanntmachungsdatum)\n\nNordrhein-Westfalen Amtsgericht Wuppertal HRB 29307\nLöschungsankündigung\n\nFims GmbH\nGesellschaft mit beschränkter Haftung\nErkrath\n\nDas Registergericht beabsichtigt die Gesellschaft von Amts wegen nach § 394 FamFG zu löschen. Die Frist zur Erhebung eines Widerspruchs ist auf einen Monat festgesetzt."
    },
    {
      "date": "2024-12-10",
      "id": "95997",
      "original_text": "Registerbekanntmachung nach dem Umwandlungsgesetz\nNordrhein-Westfalen Amtsgericht Hagen HRB 3023\nJosef Klein GmbH Verwaltung – Hagen",
      "type": "Registerbekanntmachung nach dem Umwandlungsgesetz",
      "state": "Nordrhein-Westfalen",
      "amtsgericht": "Amtsgericht Hagen",
      "registernummer": "HRB 3023",
      "registerart": "HRB",
      "company_name": "Josef Klein GmbH Verwaltung",
      "company_seat": "Hagen",
      "details": "10.12.2024 (Bekanntmachungsdatum)\n\nNordrhein-Westfalen Amtsgericht Hagen HRB 3023\nRegisterbekanntmachung nach dem Umwandlungsgesetz 10.12.2024 (Eintragungsdatum)\n\nJosef Klein GmbH Verwaltung\nGesellschaft mit beschränkter Haftung\nHagen\n\nDen Gläubigern der an der Verschmelzung beteiligten Rechtsträger ist, wenn sie binnen sechs Monaten nach dem Tag, an dem die Eintragung der Verschmelzung in das Register des Sitzes derjenigen Rechtsträger deren Gläubiger sie sind, nach § 19 Absatz 3 UmwG als bekanntgemacht gilt, ihren Anspruch nach Grund und Höhe schriftlich anmelden, Sicherheit zu leisten, soweit sie nicht Befriedigung verlangen können. Dieses Recht steht den Gläubigern jedoch nur zu, wenn sie glaubhaft machen, dass durch die Verschmelzung die Erfüllung ihrer Forderung gefährdet wird."
    },
    {
      "date": "2024-12-10",
      "id": "95998",
      "original_text": "Einreichung neuer Dokumente\nNordrhein-Westfalen Amtsgericht Münster HRB 17592\nandsafe Aktiengesellschaft – Münster",
      "type": "Einreichung neuer Dokumente",
      "state": "Nordrhein-Westfalen",
      "amtsgericht": "Amtsgericht Münster",
      "registernummer": "HRB 17592",
      "registerart": "HRB",
      "company_name": "andsafe Aktiengesellschaft",
      "company_seat": "Münster",
      "details": "10.12.2024 (Bekanntmachungsdatum)\n\nNordrhein-Westfalen Amtsgericht Münster HRB 17592\nEinreichung neuer Dokumente\n\nandsafe Aktiengesellschaft\nAktiengesellschaft\nMünster\n\nDem Registergericht ist eine neue Liste der Mitglieder des Aufsichtsrates eingereicht worden."
    },
    {
      "date": "2024-12-10",
      "id": "95999",
      "original_text": "Registerbekanntmachung nach dem Umwandlungsgesetz\nNordrhein-Westfalen Amtsgericht Kleve HRB 19660\n7YRDS Saugbagger GmbH – Goch",
      "type": "Registerbekanntmachung nach dem Umwandlungsgesetz",
      "state": "Nordrhein-Westfalen",
      "amtsgericht": "Amtsgericht Kleve",
      "registernummer": "HRB 19660",
      "registerart": "HRB",
      "company_name": "7YRDS Saugbagger GmbH",
      "company_seat": "Goch",
      "details": "10.12.2024 (Bekanntmachungsdatum)\n\nNordrhein-Westfalen Amtsgericht Kleve HRB 19660\nRegisterbekanntmachung nach dem Umwandlungsgesetz 10.12.2024 (Eintragungsdatum)\n\n7YRDS Saugbagger GmbH\nGesellschaft mit beschränkter Haftung\nGoch\n\nDen Gläubigern der an der Verschmelzung beteiligten Rechtsträger ist, wenn sie binnen sechs Monaten nach dem Tag, an dem die Eintragung der Verschmelzung in das Register des Sitzes desjenigen Rechtsträgers, dessen Gläubiger sie sind, nach § 19 Absatz 3 UmwG als bekanntgemacht gilt, ihren Anspruch nach Grund und Höhe schriftlich anmelden, Sicherheit zu leisten, soweit sie nicht Befriedigung verlangen können. Dieses Recht steht den Gläubigern jedoch nur zu, wenn sie glaubhaft machen, dass durch die Verschmelzung die Erfüllung ihrer Forderung gefährdet wird."
    },
    {
      "date": "2024-12-10",
      "id": "96000",
      "original_text": "Registerbekanntmachung nach dem Umwandlungsgesetz\nNordrhein-Westfalen Amtsgericht Bochum HRB 13341\nRPH Industrie-Partner GmbH – Bochum",
      "type": "Registerbekanntmachung nach dem Umwandlungsgesetz",
      "state": "Nordrhein-Westfalen",
      "amtsgericht": "Amtsgericht Bochum",
      "registernummer": "HRB 13341",
      "registerart": "HRB",
      "company_name": "RPH Industrie-Partner GmbH",
      "company_seat": "Bochum",
      "details": "10.12.2024 (Bekanntmachungsdatum)\n\nNordrhein-Westfalen Amtsgericht Bochum HRB 13341\nRegisterbekanntmachung nach dem Umwandlungsgesetz 06.12.2024 (Eintragungsdatum)\n\nRPH Industrie-Partner GmbH\nGesellschaft mit beschränkter Haftung\nBochum\n\nDen Gläubigern der an der Verschmelzung beteiligten Rechtsträger ist, wenn sie binnen sechs Monaten nach dem Tag, an dem die Eintragung der Verschmelzung in das Register des Sitzes desjenigen Rechtsträgers, dessen Gläubiger sie sind, nach § 19 Absatz 3 UmwG als bekanntgemacht gilt, ihren Anspruch nach Grund und Höhe schriftlich anmelden, Sicherheit zu leisten, soweit sie nicht Befriedigung verlangen können. Dieses Recht steht den Gläubigern jedoch nur zu, wenn sie glaubhaft machen, dass durch die Verschmelzung die Erfüllung ihrer Forderung gefährdet wird."
    },
    {
      "date": "2024-12-10",
      "id": "96001",
      "original_text": "Löschungsankündigung\nNordrhein-Westfalen Amtsgericht Wuppertal HRA 13251\nSpedition Ewald Höhlschen GmbH & Co. KG – Wuppertal",
      "type": "Löschungsankündigung",
      "state": "Nordrhein-Westfalen",
      "amtsgericht": "Amtsgericht Wuppertal",
      "registernummer": "HRA 13251",
      "registerart": "HRA",
      "company_name": "Spedition Ewald Höhlschen GmbH & Co. KG",
      "company_seat": "Wuppertal",
      "details": "10.12.2024 (Bekanntmachungsdatum)\n\nNordrhein-Westfalen Amtsgericht Wuppertal HRA 13251\nLöschungsankündigung 10.12.2024 (Eintragungsdatum)\n\nSpedition Ewald Höhlschen GmbH & Co. KG\nKommanditgesellschaft\nWuppertal\n\nDas Registergericht beabsichtigt die Firma von Amts wegen nach § 394 FamFG zu löschen. Die Frist zur Erhebung eines Widerspruchs ist auf drei Monate festgesetzt."
    },
    {
      "date": "2024-12-10",
      "id": "96002",
      "original_text": "Registerbekanntmachung nach dem Umwandlungsgesetz\nNordrhein-Westfalen Amtsgericht Düsseldorf HRB 107332\nSchneider Electric Investment GmbH – Düsseldorf",
      "type": "Registerbekanntmachung nach dem Umwandlungsgesetz",
      "state": "Nordrhein-Westfalen",
      "amtsgericht": "Amtsgericht Düsseldorf",
      "registernummer": "HRB 107332",
      "registerart": "HRB",
      "company_name": "Schneider Electric Investment GmbH",
      "company_seat": "Düsseldorf",
      "details": "10.12.2024 (Bekanntmachungsdatum)\n\nNordrhein-Westfalen Amtsgericht Düsseldorf HRB 107332\nRegisterbekanntmachung nach dem Umwandlungsgesetz 10.12.2024 (Eintragungsdatum)\n\nSchneider Electric Investment GmbH\nGesellschaft mit beschränkter Haftung\nDüsseldorf\n\nDen Gläubigern der an der formwechselnden Umwandlung beteiligten Rechtsträger ist, wenn sie binnen sechs Monaten nach dem Tag, an dem die Eintragung der formwechselnden Umwandlung in das Register des Sitzes desjenigen Rechtsträgers, dessen Gläubiger sie sind, nach § 19 Absatz 3 UmwG als bekanntgemacht gilt, ihren Anspruch nach Grund und Höhe schriftlich anmelden, Sicherheit zu leisten, soweit sie nicht Befriedigung verlangen können. Dieses Recht steht den Gläubigern jedoch nur zu, wenn sie glaubhaft machen, dass durch die formwechselnden Umwandlung die Erfüllung ihrer Forderung gefährdet wird."
    },
    {
      "date": "2024-12-10",
      "id": "96003",
      "original_text": "Registerbekanntmachung nach dem Umwandlungsgesetz\nNordrhein-Westfalen Amtsgericht Düsseldorf HRB 85184\nSchneider Electric Investment AG – Düsseldorf",
      "type": "Registerbekanntmachung nach dem Umwandlungsgesetz",
      "state": "Nordrhein-Westfalen",
      "amtsgericht": "Amtsgericht Düsseldorf",
      "registernummer": "HRB 85184",
      "registerart": "HRB",
      "company_name": "Schneider Electric Investment AG",
      "company_seat": "Düsseldorf",
      "details": "10.12.2024 (Bekanntmachungsdatum)\n\nNordrhein-Westfalen Amtsgericht Düsseldorf HRB 85184\nRegisterbekanntmachung nach dem Umwandlungsgesetz 10.12.2024 (Eintragungsdatum)\n\nSchneider Electric Investment AG\nAktiengesellschaft\nDüsseldorf\n\nDen Gläubigern der an der formwechselnden Umwandlung beteiligten Rechtsträger ist, wenn sie binnen sechs Monaten nach dem Tag, an dem die Eintragung der formwechselnden Umwandlung in das Register des Sitzes desjenigen Rechtsträgers, dessen Gläubiger sie sind, nach § 19 Absatz 3 UmwG als bekanntgemacht gilt, ihren Anspruch nach Grund und Höhe schriftlich anmelden, Sicherheit zu leisten, soweit sie nicht Befriedigung verlangen können. Dieses Recht steht den Gläubigern jedoch nur zu, wenn sie glaubhaft machen, dass durch die formwechselnden Umwandlung die Erfüllung ihrer Forderung gefährdet wird."
    },
    {
      "date": "2024-12-10",
      "id": "96004",
      "original_text": "Sonstige Registerbekanntmachung\nNordrhein-Westfalen Amtsgericht Düsseldorf HRB 52666\nCentrum Objektmanagementgesellschaft mbH – Düsseldorf",
      "type": "Sonstige Registerbekanntmachung",
      "state": "Nordrhein-Westfalen",
      "amtsgericht": "Amtsgericht Düsseldorf",
      "registernummer": "HRB 52666",
      "registerart": "HRB",
      "company_name": "Centrum Objektmanagementgesellschaft mbH",
      "company_seat": "Düsseldorf",
      "details": "10.12.2024 (Bekanntmachungsdatum)\n\nNordrhein-Westfalen Amtsgericht Düsseldorf HRB 52666\nSonstige Registerbekanntmachung 10.12.2024 (Eintragungsdatum)\n\nCentrum Objektmanagementgesellschaft mbH\nGesellschaft mit beschränkter Haftung\nDüsseldorf\n\nDie Gesellschaft ist aufgelöst. Von Amts wegen eingetragen."
    },
    {
      "date": "2024-12-10",
      "id": "96005",
      "original_text": "Einreichung neuer Dokumente\nNordrhein-Westfalen Amtsgericht Köln HRB 81974\nAWB Abfallwirtschaftsbetriebe Köln GmbH – Köln",
      "type": "Einreichung neuer Dokumente",
      "state": "Nordrhein-Westfalen",
      "amtsgericht": "Amtsgericht Köln",
      "registernummer": "HRB 81974",
      "registerart": "HRB",
      "company_name": "AWB Abfallwirtschaftsbetriebe Köln GmbH",
      "company_seat": "Köln",
      "details": "10.12.2024 (Bekanntmachungsdatum)\n\nNordrhein-Westfalen Amtsgericht Köln HRB 81974\nEinreichung neuer Dokumente\n\nAWB Abfallwirtschaftsbetriebe Köln GmbH\nGesellschaft mit beschränkter Haftung\nKöln\n\nDem Registergericht ist eine neue Liste der Mitglieder des Aufsichtsrates eingereicht worden."
    },
    {
      "date": "2024-12-10",
      "id": "96006",
      "original_text": "Löschungsankündigung\nNordrhein-Westfalen Amtsgericht Kleve HRB 15815\nVIP Bauprojekte Unternehmergesellschaft (haftungsbeschränkt) – Moers",
      "type": "Löschungsankündigung",
      "state": "Nordrhein-Westfalen",
      "amtsgericht": "Amtsgericht Kleve",
      "registernummer": "HRB 15815",
      "registerart": "HRB",
      "company_name": "VIP Bauprojekte Unternehmergesellschaft (haftungsbeschränkt)",
      "company_seat": "Moers",
      "details": "10.12.2024 (Bekanntmachungsdatum)\n\nNordrhein-Westfalen Amtsgericht Kleve HRB 15815\nLöschungsankündigung\n\nVIP Bauprojekte Unternehmergesellschaft (haftungsbeschränkt)\nGesellschaft mit beschränkter Haftung\nMoers\n\nDas Registergericht beabsichtigt die Gesellschaft von Amts wegen nach § 394 FamFG zu löschen. Die Frist zur Erhebung eines Widerspruchs ist auf einen Monat festgesetzt."
    },
    {
      "date": "2024-12-10",
      "id": "96007",
      "original_text": "Löschungsankündigung\nNordrhein-Westfalen Amtsgericht Duisburg HRB 35203\nS.A.V. UG (haftungsbeschränkt) – Oberhausen",
      "type": "Löschungsankündigung",
      "state": "Nordrhein-Westfalen",
      "amtsgericht": "Amtsgericht Duisburg",
      "registernummer": "HRB 35203",
      "registerart": "HRB",
      "company_name": "S.A.V. UG (haftungsbeschränkt)",
      "company_seat": "Oberhausen",
      "details": "10.12.2024 (Bekanntmachungsdatum)\n\nNordrhein-Westfalen Amtsgericht Duisburg HRB 35203\nLöschungsankündigung 10.12.2024 (Eintragungsdatum)\n\nS.A.V. UG (haftungsbeschränkt)\nGesellschaft mit beschränkter Haftung\nOberhausen\n\nHRB 35203:\nS.A.V. UG (haftungsbeschränkt), Oberhausen\nUhlandstraße 31, 46047 Oberhausen.\nDas Registergericht beabsichtigt, die im Handelsregister eingetragene Gesellschaft gemäß § 394 FamFG wegen Vermögenslosigkeit von Amts wegen zu löschen. Gegen diese Verfügung kann Widerspruch eingelegt werden. Die Frist zur Erhebung eines Widerspruchs gegen die beabsichtigte Löschung von Amts wegen ist auf drei Monate festgesetzt. Rechtsbehelfsbelehrung Der Widerspruch ist bei dem Amtsgericht Duisburg, Kardinal-Galen-Str. 124-132, 47058 Duisburg schriftlich in deutscher Sprache oder zur Niederschrift der Geschäftsstelle einzulegen. Der Widerspruch kann auch zur Niederschrift der Geschäftsstelle eines jeden Amtsgerichtes abgegeben werden. Die Einlegung ist auch durch Übertragung eines elektronischen Dokuments an die elektronische Poststelle des Gerichts möglich. Das elektronische Dokument muss für die Bearbeitung durch das Gericht geeignet und mit einer qualifizierten elektronischen Signatur der verantwortenden Person versehen sein oder von der verantwortenden Person signiert und auf einem sicheren Übermittlungsweg gemäß § 130 a ZPO nach näherer Maßgabe der Verordnung über die technischen Rahmenbedingungen des elektronischen Rechtsverkehrs und über das besondere elektronische Behördenpostfach (BGBl. I, S. 3803) eingereicht werden. Weitere Informationen erhalten Sie auf der Internetseite www.justiz.de <http://www.justiz.de>. Der Widerspruch muss spätestens innerhalb der gesetzten Frist bei dem Amtsgericht Duisburg eingegangen sein. Dies gilt auch dann, wenn der Widerspruch zur Niederschrift der Geschäftsstelle eines anderen Amtsgerichtes abgegeben wurde. Die Frist beginnt mit der Veröffentlichung. Fällt das Ende der Frist auf einen Sonntag, einen allgemeinen Feiertag oder Sonnabend, so endet die Frist mit Ablauf des nächsten Werktages. Der Widerspruch muss die Bezeichnung der angefochtenen Verfügung sowie die Erklärung enthalten, dass Widerspruch gegen diese Verfügung eingelegt wird. Er ist zu unterzeichnen und soll begründet werden."
    },
    {
      "date": "2024-12-10",
      "id": "96008",
      "original_text": "Einreichung neuer Dokumente\nNordrhein-Westfalen Amtsgericht Dortmund HRB 14217\nBorussia Dortmund GmbH & Co. Kommanditgesellschaft auf Aktien – Dortmund",
      "type": "Einreichung neuer Dokumente",
      "state": "Nordrhein-Westfalen",
      "amtsgericht": "Amtsgericht Dortmund",
      "registernummer": "HRB 14217",
      "registerart": "HRB",
      "company_name": "Borussia Dortmund GmbH & Co. Kommanditgesellschaft auf Aktien",
      "company_seat": "Dortmund",
      "details": "10.12.2024 (Bekanntmachungsdatum)\n\nNordrhein-Westfalen Amtsgericht Dortmund HRB 14217\nEinreichung neuer Dokumente 10.12.2024 (Eintragungsdatum)\n\nBorussia Dortmund GmbH & Co. Kommanditgesellschaft auf Aktien\nKommanditgesellschaft auf Aktien\nDortmund\n\nDem Registergericht ist eine neue Liste der Mitglieder des Aufsichtsrates eingereicht worden."
    },
    {
      "date": "2024-12-10",
      "id": "96009",
      "original_text": "Löschungsankündigung\nNordrhein-Westfalen Amtsgericht Siegen HRB 10638\nGarten - Wohnwelt UG (haftungsbeschränkt) – Siegen",
      "type": "Löschungsankündigung",
      "state": "Nordrhein-Westfalen",
      "amtsgericht": "Amtsgericht Siegen",
      "registernummer": "HRB 10638",
      "registerart": "HRB",
      "company_name": "Garten - Wohnwelt UG (haftungsbeschränkt)",
      "company_seat": "Siegen",
      "details": "10.12.2024 (Bekanntmachungsdatum)\n\nNordrhein-Westfalen Amtsgericht Siegen HRB 10638\nLöschungsankündigung\n\nGarten - Wohnwelt UG (haftungsbeschränkt)\nGesellschaft mit beschränkter Haftung\nSiegen\n\nDas Registergericht beabsichtigt die Gesellschaft von Amts wegen nach § 394 FamFG zu löschen. Die Frist zur Erhebung eines Widerspruchs ist auf drei Monate festgesetzt."
    },
    {
      "date": "2024-12-10",
      "id": "96010",
      "original_text": "Einreichung neuer Dokumente\nHessen Amtsgericht Frankfurt am Main HRB 106465\nNorthern Data AG – Frankfurt am Main",
      "type": "Einreichung neuer Dokumente",
      "state": "Hessen",
      "amtsgericht": "Amtsgericht Frankfurt am Main",
      "registernummer": "HRB 106465",
      "registerart": "HRB",
      "company_name": "Northern Data AG",
      "company_seat": "Frankfurt am Main",
      "details": "10.12.2024 (Bekanntmachungsdatum)\n\nHessen Amtsgericht Frankfurt am Main HRB 106465\nEinreichung neuer Dokumente 10.12.2024 (Eintragungsdatum)\n\nNorthern Data AG\nAktiengesellschaft\nFrankfurt am Main\n\nDurch eine Änderung in den Personen der Aufsichtsratsmitglieder ist eine Liste der Mitglieder des Aufsichtsrates zum Handelsregister eingereicht worden."
    },
    {
      "date": "2024-12-10",
      "id": "96011",
      "original_text": "Registerbekanntmachung nach dem Umwandlungsgesetz\nHessen Amtsgericht Wetzlar HRB 9276\nHealy International GmbH – Wetzlar",
      "type": "Registerbekanntmachung nach dem Umwandlungsgesetz",
      "state": "Hessen",
      "amtsgericht": "Amtsgericht Wetzlar",
      "registernummer": "HRB 9276",
      "registerart": "HRB",
      "company_name": "Healy International GmbH",
      "company_seat": "Wetzlar",
      "details": "10.12.2024 (Bekanntmachungsdatum)\n\nHessen Amtsgericht Wetzlar HRB 9276\nRegisterbekanntmachung nach dem Umwandlungsgesetz 10.12.2024 (Eintragungsdatum)\n\nHealy International GmbH\nGesellschaft mit beschränkter Haftung\nWetzlar\n\nDen Gläubigern der an der formwechselnden Umwandlung beteiligten Rechtsträger ist, wenn sie binnen sechs Monaten nach dem Tag, an dem die Eintragung der formwechselnden Umwandlung in das Register des Sitzes desjenigen Rechtsträgers, dessen Gläubiger sie sind, nach § 201 UmwG bekannt gemacht worden ist, ihren Anspruch nach Grund und Höhe schriftlich anmelden, Sicherheit zu leisten, soweit sie nicht Befriedigung verlangen können. Dieses Recht steht den Gläubigern jedoch nur zu, wenn sie glaubhaft machen, dass durch die formwechselnden Umwandlung die Erfüllung ihrer Forderung gefährdet wird."
    },
    {
      "date": "2024-12-10",
      "id": "96012",
      "original_text": "Löschungsankündigung\nHessen Amtsgericht Friedberg HRB 9699\nValley Automatenaufstellung GmbH – Butzbach",
      "type": "Löschungsankündigung",
      "state": "Hessen",
      "amtsgericht": "Amtsgericht Friedberg",
      "registernummer": "HRB 9699",
      "registerart": "HRB",
      "company_name": "Valley Automatenaufstellung GmbH",
      "company_seat": "Butzbach",
      "details": "10.12.2024 (Bekanntmachungsdatum)\n\nHessen Amtsgericht Friedberg HRB 9699\nLöschungsankündigung\n\nValley Automatenaufstellung GmbH\nGesellschaft mit beschränkter Haftung\nButzbach\n\nDas Registergericht beabsichtigt die im Handelsregister eingetragene Gesellschaft von Amts wegen nach § 394 FamFG zu löschen. Die Frist zur Erhebung eines Widerspruchs gegen die beabsichtigte Löschung wird auf 3 Monate festgesetzt."
    },
    {
      "date": "2024-12-10",
      "id": "96013",
      "original_text": "Einreichung neuer Dokumente\nHessen Amtsgericht Kassel HRB 15684\nNEL Gastransport GmbH – Kassel",
      "type": "Einreichung neuer Dokumente",
      "state": "Hessen",
      "amtsgericht": "Amtsgericht Kassel",
      "registernummer": "HRB 15684",
      "registerart": "HRB",
      "company_name": "NEL Gastransport GmbH",
      "company_seat": "Kassel",
      "details": "10.12.2024 (Bekanntmachungsdatum)\n\nHessen Amtsgericht Kassel HRB 15684\nEinreichung neuer Dokumente\n\nNEL Gastransport GmbH\nGesellschaft mit beschränkter Haftung\nKassel\n\nDurch eine Änderung in den Personen der Aufsichtsratsmitglieder ist eine Liste der Mitglieder des Aufsichtsrates zum Handelsregister eingereicht worden."
    },
    {
      "date": "2024-12-10",
      "id": "96014",
      "original_text": "Registerbekanntmachung nach dem Umwandlungsgesetz\nHessen Amtsgericht Wetzlar HRB 7146\nHealy International AG – Wetzlar",
      "type": "Registerbekanntmachung nach dem Umwandlungsgesetz",
      "state": "Hessen",
      "amtsgericht": "Amtsgericht Wetzlar",
      "registernummer": "HRB 7146",
      "registerart": "HRB",
      "company_name": "Healy International AG",
      "company_seat": "Wetzlar",
      "details": "10.12.2024 (Bekanntmachungsdatum)\n\nHessen Amtsgericht Wetzlar HRB 7146\nRegisterbekanntmachung nach dem Umwandlungsgesetz 10.12.2024 (Eintragungsdatum)\n\nHealy International AG\nAktiengesellschaft\nWetzlar\n\nDen Gläubigern der an der formwechselnden Umwandlung beteiligten Rechtsträger ist, wenn sie binnen sechs Monaten nach dem Tag, an dem die Eintragung der formwechselnden Umwandlung in das Register des Sitzes desjenigen Rechtsträgers, dessen Gläubiger sie sind, nach § 201 UmwG bekannt gemacht worden ist, ihren Anspruch nach Grund und Höhe schriftlich anmelden, Sicherheit zu leisten, soweit sie nicht Befriedigung verlangen können. Dieses Recht steht den Gläubigern jedoch nur zu, wenn sie glaubhaft machen, dass durch die formwechselnden Umwandlung die Erfüllung ihrer Forderung gefährdet wird."
    },
    {
      "date": "2024-12-10",
      "id": "96015",
      "original_text": "Löschungsankündigung\nHessen Amtsgericht Frankfurt am Main HRB 90682\nNURKO Fussbodensysteme GmbH – Eschborn",
      "type": "Löschungsankündigung",
      "state": "Hessen",
      "amtsgericht": "Amtsgericht Frankfurt am Main",
      "registernummer": "HRB 90682",
      "registerart": "HRB",
      "company_name": "NURKO Fussbodensysteme GmbH",
      "company_seat": "Eschborn",
      "details": "10.12.2024 (Bekanntmachungsdatum)\n\nHessen Amtsgericht Frankfurt am Main HRB 90682\nLöschungsankündigung 10.12.2024 (Eintragungsdatum)\n\nNURKO Fussbodensysteme GmbH\nGesellschaft mit beschränkter Haftung\nEschborn\n\nEs ist beabsichtigt die Gesellschaft wegen Vermögenslosigkeit gemäß § 394 FamFG von Amts wegen zu löschen. Hiergegen kann innerhalb eines Monats nach dieser Veröffentlichung Widerspruch bei dem Amtsgericht Frankfurt am Main eingelegt werden."
    },
    {
      "date": "2024-12-10",
      "id": "96016",
      "original_text": "Einreichung neuer Dokumente\nHessen Amtsgericht Frankfurt am Main HRB 108645\nNoratis AG – Eschborn",
      "type": "Einreichung neuer Dokumente",
      "state": "Hessen",
      "amtsgericht": "Amtsgericht Frankfurt am Main",
      "registernummer": "HRB 108645",
      "registerart": "HRB",
      "company_name": "Noratis AG",
      "company_seat": "Eschborn",
      "details": "10.12.2024 (Bekanntmachungsdatum)\n\nHessen Amtsgericht Frankfurt am Main HRB 108645\nEinreichung neuer Dokumente 10.12.2024 (Eintragungsdatum)\n\nNoratis AG\nAktiengesellschaft\nEschborn\n\nDurch eine Änderung in den Personen der Aufsichtsratsmitglieder ist eine Liste der Mitglieder des Aufsichtsrates zum Handelsregister eingereicht worden."
    },
    {
      "date": "2024-12-10",
      "id": "96017",
      "original_text": "Löschungsankündigung\nHessen Amtsgericht Wiesbaden HRB 28981\nB & K Baupartner GmbH – Wiesbaden",
      "type": "Löschungsankündigung",
      "state": "Hessen",
      "amtsgericht": "Amtsgericht Wiesbaden",
      "registernummer": "HRB 28981",
      "registerart": "HRB",
      "company_name": "B & K Baupartner GmbH",
      "company_seat": "Wiesbaden",
      "details": "10.12.2024 (Bekanntmachungsdatum)\n\nHessen Amtsgericht Wiesbaden HRB 28981\nLöschungsankündigung\n\nB & K Baupartner GmbH\nGesellschaft mit beschränkter Haftung\nWiesbaden\n\nDas Registergericht beabsichtigt die im Handelsregister eingetragene Gesellschaft von Amts wegen nach § 394 FamFG zu löschen. Die Frist zur Erhebung eines Widerspruchs gegen die beabsichtigte Löschung wird auf 3 Monate festgesetzt."
    },
    {
      "date": "2024-12-10",
      "id": "96018",
      "original_text": "Löschungsankündigung\nHessen Amtsgericht Friedberg HRB 7870\nFACO Baudekoration GmbH – Friedberg (Hessen)",
      "type": "Löschungsankündigung",
      "state": "Hessen",
      "amtsgericht": "Amtsgericht Friedberg",
      "registernummer": "HRB 7870",
      "registerart": "HRB",
      "company_name": "FACO Baudekoration GmbH",
      "company_seat": "Friedberg (Hessen)",
      "details": "10.12.2024 (Bekanntmachungsdatum)\n\nHessen Amtsgericht Friedberg HRB 7870\nLöschungsankündigung\n\nFACO Baudekoration GmbH\nGesellschaft mit beschränkter Haftung\nFriedberg (Hessen)\n\nDas Registergericht beabsichtigt die im Handelsregister eingetragene Gesellschaft von Amts wegen nach § 394 FamFG zu löschen. Die Frist zur Erhebung eines Widerspruchs gegen die beabsichtigte Löschung wird auf 3 Monate festgesetzt."
    },
    {
      "date": "2024-12-10",
      "id": "96019",
      "original_text": "Löschungsankündigung\nHessen Amtsgericht Wiesbaden HRB 32471\nLabocell GmbH – Wiesbaden",
      "type": "Löschungsankündigung",
      "state": "Hessen",
      "amtsgericht": "Amtsgericht Wiesbaden",
      "registernummer": "HRB 32471",
      "registerart": "HRB",
      "company_name": "Labocell GmbH",
      "company_seat": "Wiesbaden",
      "details": "10.12.2024 (Bekanntmachungsdatum)\n\nHessen Amtsgericht Wiesbaden HRB 32471\nLöschungsankündigung\n\nLabocell GmbH\nGesellschaft mit beschränkter Haftung\nWiesbaden\n\nDas Registergericht beabsichtigt die im Handelsregister eingetragene Gesellschaft von Amts wegen nach § 394 FamFG zu löschen. Die Frist zur Erhebung eines Widerspruchs gegen die beabsichtigte Löschung wird auf 3 Monate festgesetzt."
    },
    {
      "date": "2024-12-10",
      "id": "96020",
      "original_text": "Löschungsankündigung\nHessen Amtsgericht Bad Homburg v.d.H. HRB 13881\nSchmidt Baumanagement GmbH – Bad Homburg v. d. Höhe",
      "type": "Löschungsankündigung",
      "state": "Hessen",
      "amtsgericht": "Amtsgericht Bad Homburg v.d.H.",
      "registernummer": "HRB 13881",
      "registerart": "HRB",
      "company_name": "Schmidt Baumanagement GmbH",
      "company_seat": "Bad Homburg v. d. Höhe",
      "details": "10.12.2024 (Bekanntmachungsdatum)\n\nHessen Amtsgericht Bad Homburg v.d.H. HRB 13881\nLöschungsankündigung 28.11.2024 (Eintragungsdatum)\n\nSchmidt Baumanagement GmbH\nGesellschaft mit beschränkter Haftung\nBad Homburg v. d. Höhe\n\nDas Registergericht beabsichtigt die im Handelsregister eingetragene Gesellschaft von Amts wegen nach § 394 FamFG zu löschen. Die Frist zur Erhebung eines Widerspruchs gegen die beabsichtigte Löschung wird auf 3 Monate festgesetzt."
    },
    {
      "date": "2024-12-10",
      "id": "96021",
      "original_text": "Löschungsankündigung\nHessen Amtsgericht Frankfurt am Main HRB 89676\nLMD Reisecenter GmbH – Eschborn",
      "type": "Löschungsankündigung",
      "state": "Hessen",
      "amtsgericht": "Amtsgericht Frankfurt am Main",
      "registernummer": "HRB 89676",
      "registerart": "HRB",
      "company_name": "LMD Reisecenter GmbH",
      "company_seat": "Eschborn",
      "details": "10.12.2024 (Bekanntmachungsdatum)\n\nHessen Amtsgericht Frankfurt am Main HRB 89676\nLöschungsankündigung 10.12.2024 (Eintragungsdatum)\n\nLMD Reisecenter GmbH\nGesellschaft mit beschränkter Haftung\nEschborn\n\nEs ist beabsichtigt die Gesellschaft wegen Vermögenslosigkeit gemäß § 394 FamFG von Amts wegen zu löschen. Hiergegen kann innerhalb eines Monats nach dieser Veröffentlichung Widerspruch bei dem Amtsgericht Frankfurt am Main eingelegt werden."
    },
    {
      "date": "2024-12-10",
      "id": "96022",
      "original_text": "Löschungsankündigung\nHessen Amtsgericht Wiesbaden HRB 27996\nGesellschaft für Vitalgesundheit mbH – Wiesbaden",
      "type": "Löschungsankündigung",
      "state": "Hessen",
      "amtsgericht": "Amtsgericht Wiesbaden",
      "registernummer": "HRB 27996",
      "registerart": "HRB",
      "company_name": "Gesellschaft für Vitalgesundheit mbH",
      "company_seat": "Wiesbaden",
      "details": "10.12.2024 (Bekanntmachungsdatum)\n\nHessen Amtsgericht Wiesbaden HRB 27996\nLöschungsankündigung\n\nGesellschaft für Vitalgesundheit mbH\nGesellschaft mit beschränkter Haftung\nWiesbaden\n\nDas Registergericht beabsichtigt die im Handelsregister eingetragene Gesellschaft von Amts wegen nach § 394 FamFG zu löschen. Die Frist zur Erhebung eines Widerspruchs gegen die beabsichtigte Löschung wird auf 3 Monate festgesetzt."
    }
  ]
}