{
  "date": "2024-12-23",
  "date_of_scrape": "2024-12-24T04:06:04.125Z",
  "tool_version": "0.2.0",
  "number_of_announcements": 85,
  "announcements": [
    {
      "date": "2024-12-23",
      "id": "97240",
      "original_text": "Registerbekanntmachung nach dem Umwandlungsgesetz\nBaden-Württemberg Amtsgericht Stuttgart HRB 747290\nJetter Holding GmbH – Rosenfeld",
      "type": "Registerbekanntmachung nach dem Umwandlungsgesetz",
      "state": "Baden-Württemberg",
      "amtsgericht": "Amtsgericht Stuttgart",
      "registernummer": "HRB 747290",
      "registerart": "HRB",
      "company_name": "Jetter Holding GmbH",
      "company_seat": "Rosenfeld",
      "details": "23.12.2024 (Bekanntmachungsdatum)\n\nBaden-Württemberg Amtsgericht Stuttgart HRB 747290\nRegisterbekanntmachung nach dem Umwandlungsgesetz 19.12.2024 (Eintragungsdatum)\n\nJetter Holding GmbH\nGesellschaft mit beschränkter Haftung\nRosenfeld\n\nAls nicht eingetragen wird bekanntgemacht:\nDen Gläubigern der an der Verschmelzung beteiligten Rechtsträger ist, wenn sie binnen sechs Monaten nach dem Tag, an dem die Eintragung der Verschmelzung in das Register des Sitzes desjenigen Rechtsträgers, dessen Gläubiger sie sind, nach § 19 Abs. 3 UmwG als bekanntgemacht gilt, ihren Anspruch nach Grund und Höhe schriftlich anmelden, Sicherheit zu leisten, soweit sie nicht Befriedigung verlangen können. Dieses Recht steht den Gläubigern jedoch nur zu, wenn sie glaubhaft machen, dass durch die Verschmelzung die Erfüllung ihrer Forderung gefährdet wird."
    },
    {
      "date": "2024-12-23",
      "id": "97241",
      "original_text": "Löschungsankündigung\nSaarland Amtsgericht Saarbrücken HRB 105232\nImmobilien Saar Lor Lux UG (haftungsbeschränkt) – Saarlouis",
      "type": "Löschungsankündigung",
      "state": "Saarland",
      "amtsgericht": "Amtsgericht Saarbrücken",
      "registernummer": "HRB 105232",
      "registerart": "HRB",
      "company_name": "Immobilien Saar Lor Lux UG (haftungsbeschränkt)",
      "company_seat": "Saarlouis",
      "details": "23.12.2024 (Bekanntmachungsdatum)\n\nSaarland Amtsgericht Saarbrücken HRB 105232\nLöschungsankündigung\n\nImmobilien Saar Lor Lux UG (haftungsbeschränkt)\nGesellschaft mit beschränkter Haftung\nSaarlouis\n\nEs ist beabsichtigt, die Gesellschaft von Amts wegen gemäß § 394 FamFG wegen Vermögenslosigkeit zu löschen.\nGegen die Löschung von Amts wegen ist das Rechtsmittel des Widerspruchs statthaft. Der Widerspruch ist binnen einer Frist zwei Monaten beginnend mit dem Tag dieser Veröffentlichung durch Einreichen eines Widerspruchsschreibens -schriftlich oder zur Niederschrift der Geschäftsstelle beim Amtsgericht Saarbrücken, -zentrales Handelsregister-, Mainzerstr.178, 66121 Saarbrücken einzulegen.\nDer Widerspruch muss die Bezeichnung der angefochtenen Löschungsankündigung enthalten sowie die Erklärung, dass Widerspruch eingelegt wird. Er ist vom Widerspruchsführer oder seinem Bevollmächtigten zu unterzeichnen.\nDas Widerspruchsschreiben kann auch in der Form eines elektronischen Dokumentes eingereicht werden, das mit einer qualifizierten elektronischen Signatur nach dem Signaturgesetz versehen sein muss (§§ 14 Abs. 2 FamFG, 130a, 298 ZPO)."
    },
    {
      "date": "2024-12-23",
      "id": "97242",
      "original_text": "Einreichung neuer Dokumente\nBrandenburg Amtsgericht Frankfurt/Oder HRB 6393\nGLG Gesellschaft für Leben und Gesundheit mbH – Eberswalde",
      "type": "Einreichung neuer Dokumente",
      "state": "Brandenburg",
      "amtsgericht": "Amtsgericht Frankfurt/Oder",
      "registernummer": "HRB 6393",
      "registerart": "HRB",
      "company_name": "GLG Gesellschaft für Leben und Gesundheit mbH",
      "company_seat": "Eberswalde",
      "details": "23.12.2024 (Bekanntmachungsdatum)\n\nBrandenburg Amtsgericht Frankfurt/Oder HRB 6393\nEinreichung neuer Dokumente\n\nGLG Gesellschaft für Leben und Gesundheit mbH\nGesellschaft mit beschränkter Haftung\nEberswalde\n\nAls nicht eingetragen wird veröffentlicht:  Die Gesellschaft hat Änderungen im Aufsichtsrat angezeigt."
    },
    {
      "date": "2024-12-23",
      "id": "97243",
      "original_text": "Einreichung neuer Dokumente\nBrandenburg Amtsgericht Potsdam HRB 4729\nWOBRA Wohnungsbaugesellschaft der Stadt Brandenburg an der Havel mit beschränkter Haftung – Brandenburg an der Havel",
      "type": "Einreichung neuer Dokumente",
      "state": "Brandenburg",
      "amtsgericht": "Amtsgericht Potsdam",
      "registernummer": "HRB 4729",
      "registerart": "HRB",
      "company_name": "WOBRA Wohnungsbaugesellschaft der Stadt Brandenburg an der Havel mit beschränkter Haftung",
      "company_seat": "Brandenburg an der Havel",
      "details": "23.12.2024 (Bekanntmachungsdatum)\n\nBrandenburg Amtsgericht Potsdam HRB 4729\nEinreichung neuer Dokumente\n\nWOBRA Wohnungsbaugesellschaft der Stadt Brandenburg an der Havel mit beschränkter Haftung\nGesellschaft mit beschränkter Haftung\nBrandenburg an der Havel\n\nAls nicht eingetragen wird veröffentlicht: Eine Liste der Mitglieder des Aufsichtsrates wurde zum Handelsregister eingereicht."
    },
    {
      "date": "2024-12-23",
      "id": "97244",
      "original_text": "Löschungsankündigung\nBerlin Amtsgericht Berlin (Charlottenburg) HRB 188351\nHORECA Services Berlin UG (haftungsbeschränkt) – Berlin",
      "type": "Löschungsankündigung",
      "state": "Berlin",
      "amtsgericht": "Amtsgericht Berlin (Charlottenburg)",
      "registernummer": "HRB 188351",
      "registerart": "HRB",
      "company_name": "HORECA Services Berlin UG (haftungsbeschränkt)",
      "company_seat": "Berlin",
      "details": "23.12.2024 (Bekanntmachungsdatum)\n\nBerlin Amtsgericht Berlin (Charlottenburg) HRB 188351\nLöschungsankündigung\n\nHORECA Services Berlin UG (haftungsbeschränkt)\nGesellschaft mit beschränkter Haftung\nBerlin\n\nBei der nachstehenden Gesellschaft wird das Amtslöschungsverfahren gemäß § 394 FamFG eingeleitet. Widerspruchsfrist 6 Wochen"
    },
    {
      "date": "2024-12-23",
      "id": "97245",
      "original_text": "Löschungsankündigung\nBrandenburg Amtsgericht Potsdam HRB 414\nTBS Tankstellen-Betriebs- und Service GmbH – Stahnsdorf",
      "type": "Löschungsankündigung",
      "state": "Brandenburg",
      "amtsgericht": "Amtsgericht Potsdam",
      "registernummer": "HRB 414",
      "registerart": "HRB",
      "company_name": "TBS Tankstellen-Betriebs- und Service GmbH",
      "company_seat": "Stahnsdorf",
      "details": "23.12.2024 (Bekanntmachungsdatum)\n\nBrandenburg Amtsgericht Potsdam HRB 414\nLöschungsankündigung\n\nTBS Tankstellen-Betriebs- und Service GmbH\nGesellschaft mit beschränkter Haftung\nStahnsdorf\n\nBei der nachstehenden Gesellschaft wird das Amtslöschungsverfahren gemäß § 394 FamFG eingeleitet. Widerspruchsfrist: 8 Wochen"
    },
    {
      "date": "2024-12-23",
      "id": "97246",
      "original_text": "Registerbekanntmachung nach dem Umwandlungsgesetz\nBaden-Württemberg Amtsgericht Stuttgart HRB 787394\ncurrily AG – Stuttgart",
      "type": "Registerbekanntmachung nach dem Umwandlungsgesetz",
      "state": "Baden-Württemberg",
      "amtsgericht": "Amtsgericht Stuttgart",
      "registernummer": "HRB 787394",
      "registerart": "HRB",
      "company_name": "currily AG",
      "company_seat": "Stuttgart",
      "details": "23.12.2024 (Bekanntmachungsdatum)\n\nBaden-Württemberg Amtsgericht Stuttgart HRB 787394\nRegisterbekanntmachung nach dem Umwandlungsgesetz 23.12.2024 (Eintragungsdatum)\n\ncurrily AG\nAktiengesellschaft\nStuttgart\n\nAls nicht eingetragen wird bekanntgemacht:\nDen Gläubigern der an der Verschmelzung beteiligten Rechtsträger ist, wenn sie binnen sechs Monaten nach dem Tag, an dem die Eintragung der Verschmelzung in das Register des Sitzes desjenigen Rechtsträgers, dessen Gläubiger sie sind, nach § 19 Abs. 3 UmwG als bekanntgemacht gilt, ihren Anspruch nach Grund und Höhe schriftlich anmelden, Sicherheit zu leisten, soweit sie nicht Befriedigung verlangen können. Dieses Recht steht den Gläubigern jedoch nur zu, wenn sie glaubhaft machen, dass durch die Verschmelzung die Erfüllung ihrer Forderung gefährdet wird."
    },
    {
      "date": "2024-12-23",
      "id": "97247",
      "original_text": "Registerbekanntmachung nach dem Umwandlungsgesetz\nBaden-Württemberg Amtsgericht Stuttgart HRB 754597\nSecond GmbH – Sindelfingen",
      "type": "Registerbekanntmachung nach dem Umwandlungsgesetz",
      "state": "Baden-Württemberg",
      "amtsgericht": "Amtsgericht Stuttgart",
      "registernummer": "HRB 754597",
      "registerart": "HRB",
      "company_name": "Second GmbH",
      "company_seat": "Sindelfingen",
      "details": "23.12.2024 (Bekanntmachungsdatum)\n\nBaden-Württemberg Amtsgericht Stuttgart HRB 754597\nRegisterbekanntmachung nach dem Umwandlungsgesetz 23.12.2024 (Eintragungsdatum)\n\nSecond GmbH\nGesellschaft mit beschränkter Haftung\nSindelfingen\n\nAls nicht eingetragen wird bekanntgemacht:\nDen Gläubigern der an der Verschmelzung beteiligten Rechtsträger ist, wenn sie binnen sechs Monaten nach dem Tag, an dem die Eintragung der Verschmelzung in das Register des Sitzes desjenigen Rechtsträgers, dessen Gläubiger sie sind, nach § 19 Abs. 3 UmwG als bekanntgemacht gilt, ihren Anspruch nach Grund und Höhe schriftlich anmelden, Sicherheit zu leisten, soweit sie nicht Befriedigung verlangen können. Dieses Recht steht den Gläubigern jedoch nur zu, wenn sie glaubhaft machen, dass durch die Verschmelzung die Erfüllung ihrer Forderung gefährdet wird."
    },
    {
      "date": "2024-12-23",
      "id": "97248",
      "original_text": "Registerbekanntmachung nach dem Umwandlungsgesetz\nHamburg Amtsgericht Hamburg HRA 131918\nVALUES AkquiCo 1 GmbH & Co. KG – Hamburg",
      "type": "Registerbekanntmachung nach dem Umwandlungsgesetz",
      "state": "Hamburg",
      "amtsgericht": "Amtsgericht Hamburg",
      "registernummer": "HRA 131918",
      "registerart": "HRA",
      "company_name": "VALUES AkquiCo 1 GmbH & Co. KG",
      "company_seat": "Hamburg",
      "details": "23.12.2024 (Bekanntmachungsdatum)\n\nHamburg Amtsgericht Hamburg HRA 131918\nRegisterbekanntmachung nach dem Umwandlungsgesetz 23.12.2024 (Eintragungsdatum)\n\nVALUES AkquiCo 1 GmbH & Co. KG\nKommanditgesellschaft\nHamburg\n\nAls nicht eingetragen wird bekannt gemacht:\nDen Gläubigern der an der formwechselnden Umwandlung beteiligten Gesellschaften ist, wenn sie binnen sechs Monaten nach dem Tag, an dem die Eintragung der formwechselnden Umwandlung in das Register des Sitzes desjenigen Rechtsträgers, dessen Gläubiger sie sind, nach § 19 Absatz 3 UmwG als bekannt gemacht gilt, ihren Anspruch nach Grund und Höhe schriftlich anmelden, Sicherheit zu leisten, soweit sie nicht Befriedigung verlangen können. Dieses Recht steht den Gläubigern jedoch nur zu, wenn sie glaubhaft machen, dass durch die formwechselnde Umwandlung die Erfüllung ihrer Forderung gefährdet wird."
    },
    {
      "date": "2024-12-23",
      "id": "97249",
      "original_text": "Registerbekanntmachung nach dem Umwandlungsgesetz\nHamburg Amtsgericht Hamburg HRB 165697\nVALUES AkquiCo 1 GmbH – Hamburg",
      "type": "Registerbekanntmachung nach dem Umwandlungsgesetz",
      "state": "Hamburg",
      "amtsgericht": "Amtsgericht Hamburg",
      "registernummer": "HRB 165697",
      "registerart": "HRB",
      "company_name": "VALUES AkquiCo 1 GmbH",
      "company_seat": "Hamburg",
      "details": "23.12.2024 (Bekanntmachungsdatum)\n\nHamburg Amtsgericht Hamburg HRB 165697\nRegisterbekanntmachung nach dem Umwandlungsgesetz 23.12.2024 (Eintragungsdatum)\n\nVALUES AkquiCo 1 GmbH\nGesellschaft mit beschränkter Haftung\nHamburg\n\nAls nicht eingetragen wird bekannt gemacht:\nDen Gläubigern der an der formwechselnden Umwandlung beteiligten Gesellschaften ist, wenn sie binnen sechs Monaten nach dem Tag, an dem die Eintragung der formwechselnden Umwandlung in das Register des Sitzes desjenigen Rechtsträgers, dessen Gläubiger sie sind, nach § 19 Absatz 3 UmwG als bekannt gemacht gilt, ihren Anspruch nach Grund und Höhe schriftlich anmelden, Sicherheit zu leisten, soweit sie nicht Befriedigung verlangen können. Dieses Recht steht den Gläubigern jedoch nur zu, wenn sie glaubhaft machen, dass durch die formwechselnde Umwandlung die Erfüllung ihrer Forderung gefährdet wird."
    },
    {
      "date": "2024-12-23",
      "id": "97250",
      "original_text": "Löschungsankündigung\nBerlin Amtsgericht Berlin (Charlottenburg) HRB 189003\nTAKE-AWAY Transportgesellschaft mbH – Berlin",
      "type": "Löschungsankündigung",
      "state": "Berlin",
      "amtsgericht": "Amtsgericht Berlin (Charlottenburg)",
      "registernummer": "HRB 189003",
      "registerart": "HRB",
      "company_name": "TAKE-AWAY Transportgesellschaft mbH",
      "company_seat": "Berlin",
      "details": "23.12.2024 (Bekanntmachungsdatum)\n\nBerlin Amtsgericht Berlin (Charlottenburg) HRB 189003\nLöschungsankündigung\n\nTAKE-AWAY Transportgesellschaft mbH\nGesellschaft mit beschränkter Haftung\nBerlin\n\nBei der nachstehenden Gesellschaft wird das Amtslöschungsverfahren gemäß § 394 FamFG eingeleitet. Widerspruchsfrist 6 Wochen"
    },
    {
      "date": "2024-12-23",
      "id": "97251",
      "original_text": "Einreichung neuer Dokumente\nSachsen-Anhalt Amtsgericht Stendal HRB 5956\nWITRA Service GmbH – Lutherstadt Wittenberg",
      "type": "Einreichung neuer Dokumente",
      "state": "Sachsen-Anhalt",
      "amtsgericht": "Amtsgericht Stendal",
      "registernummer": "HRB 5956",
      "registerart": "HRB",
      "company_name": "WITRA Service GmbH",
      "company_seat": "Lutherstadt Wittenberg",
      "details": "23.12.2024 (Bekanntmachungsdatum)\n\nSachsen-Anhalt Amtsgericht Stendal HRB 5956\nEinreichung neuer Dokumente\n\nWITRA Service GmbH\nGesellschaft mit beschränkter Haftung\nLutherstadt Wittenberg\n\nEine Liste der Mitglieder des Aufsichtsrates wurde zum Handelsregister eingereicht."
    },
    {
      "date": "2024-12-23",
      "id": "97252",
      "original_text": "Einreichung neuer Dokumente\nBaden-Württemberg Amtsgericht Stuttgart HRB 773598\nMARKT-PILOT GmbH – Beilstein",
      "type": "Einreichung neuer Dokumente",
      "state": "Baden-Württemberg",
      "amtsgericht": "Amtsgericht Stuttgart",
      "registernummer": "HRB 773598",
      "registerart": "HRB",
      "company_name": "MARKT-PILOT GmbH",
      "company_seat": "Beilstein",
      "details": "23.12.2024 (Bekanntmachungsdatum)\n\nBaden-Württemberg Amtsgericht Stuttgart HRB 773598\nEinreichung neuer Dokumente\n\nMARKT-PILOT GmbH\nGesellschaft mit beschränkter Haftung\nBeilstein\n\nDie Gesellschaft hat am 20.12.2024 die Liste über die Zusammensetzung des Aufsichtsrats zum Handelsregister eingereicht."
    },
    {
      "date": "2024-12-23",
      "id": "97253",
      "original_text": "Registerbekanntmachung nach dem Umwandlungsgesetz\nHamburg Amtsgericht Hamburg HRB 165698\nVALUES AkquiCo 2 GmbH – Hamburg",
      "type": "Registerbekanntmachung nach dem Umwandlungsgesetz",
      "state": "Hamburg",
      "amtsgericht": "Amtsgericht Hamburg",
      "registernummer": "HRB 165698",
      "registerart": "HRB",
      "company_name": "VALUES AkquiCo 2 GmbH",
      "company_seat": "Hamburg",
      "details": "23.12.2024 (Bekanntmachungsdatum)\n\nHamburg Amtsgericht Hamburg HRB 165698\nRegisterbekanntmachung nach dem Umwandlungsgesetz 23.12.2024 (Eintragungsdatum)\n\nVALUES AkquiCo 2 GmbH\nGesellschaft mit beschränkter Haftung\nHamburg\n\nAls nicht eingetragen wird bekannt gemacht:\nDen Gläubigern der an der formwechselnden Umwandlung beteiligten Gesellschaften ist, wenn sie binnen sechs Monaten nach dem Tag, an dem die Eintragung der formwechselnden Umwandlung in das Register des Sitzes desjenigen Rechtsträgers, dessen Gläubiger sie sind, nach § 19 Absatz 3 UmwG als bekannt gemacht gilt, ihren Anspruch nach Grund und Höhe schriftlich anmelden, Sicherheit zu leisten, soweit sie nicht Befriedigung verlangen können. Dieses Recht steht den Gläubigern jedoch nur zu, wenn sie glaubhaft machen, dass durch die formwechselnde Umwandlung die Erfüllung ihrer Forderung gefährdet wird."
    },
    {
      "date": "2024-12-23",
      "id": "97254",
      "original_text": "Registerbekanntmachung nach dem Umwandlungsgesetz\nHamburg Amtsgericht Hamburg HRA 131919\nVALUES AkquiCo 2 GmbH & Co. KG – Hamburg",
      "type": "Registerbekanntmachung nach dem Umwandlungsgesetz",
      "state": "Hamburg",
      "amtsgericht": "Amtsgericht Hamburg",
      "registernummer": "HRA 131919",
      "registerart": "HRA",
      "company_name": "VALUES AkquiCo 2 GmbH & Co. KG",
      "company_seat": "Hamburg",
      "details": "23.12.2024 (Bekanntmachungsdatum)\n\nHamburg Amtsgericht Hamburg HRA 131919\nRegisterbekanntmachung nach dem Umwandlungsgesetz 23.12.2024 (Eintragungsdatum)\n\nVALUES AkquiCo 2 GmbH & Co. KG\nKommanditgesellschaft\nHamburg\n\nAls nicht eingetragen wird bekannt gemacht:\nDen Gläubigern der an der formwechselnden Umwandlung beteiligten Gesellschaften ist, wenn sie binnen sechs Monaten nach dem Tag, an dem die Eintragung der formwechselnden Umwandlung in das Register des Sitzes desjenigen Rechtsträgers, dessen Gläubiger sie sind, nach § 19 Absatz 3 UmwG als bekannt gemacht gilt, ihren Anspruch nach Grund und Höhe schriftlich anmelden, Sicherheit zu leisten, soweit sie nicht Befriedigung verlangen können. Dieses Recht steht den Gläubigern jedoch nur zu, wenn sie glaubhaft machen, dass durch die formwechselnde Umwandlung die Erfüllung ihrer Forderung gefährdet wird."
    },
    {
      "date": "2024-12-23",
      "id": "97255",
      "original_text": "Registerbekanntmachung nach dem Umwandlungsgesetz\nHamburg Amtsgericht Hamburg HRB 179453\nHamburg Producers Media GmbH – Hamburg",
      "type": "Registerbekanntmachung nach dem Umwandlungsgesetz",
      "state": "Hamburg",
      "amtsgericht": "Amtsgericht Hamburg",
      "registernummer": "HRB 179453",
      "registerart": "HRB",
      "company_name": "Hamburg Producers Media GmbH",
      "company_seat": "Hamburg",
      "details": "23.12.2024 (Bekanntmachungsdatum)\n\nHamburg Amtsgericht Hamburg HRB 179453\nRegisterbekanntmachung nach dem Umwandlungsgesetz 23.12.2024 (Eintragungsdatum)\n\nHamburg Producers Media GmbH\nGesellschaft mit beschränkter Haftung\nHamburg\n\nAls nicht eingetragen wird bekannt gemacht:\nDen Gläubigern der an der Verschmelzung beteiligten Gesellschaften ist, wenn sie binnen sechs Monaten nach dem Tag, an dem die Eintragung der Verschmelzung in das Register des Sitzes desjenigen Rechtsträgers, dessen Gläubiger sie sind, nach § 19 Absatz 3 UmwG als bekannt gemacht gilt, ihren Anspruch nach Grund und Höhe schriftlich anmelden, Sicherheit zu leisten, soweit sie nicht Befriedigung verlangen können. Dieses Recht steht den Gläubigern jedoch nur zu, wenn sie glaubhaft machen, dass durch die Verschmelzung die Erfüllung ihrer Forderung gefährdet wird."
    },
    {
      "date": "2024-12-23",
      "id": "97256",
      "original_text": "Registerbekanntmachung nach dem Umwandlungsgesetz\nHamburg Amtsgericht Hamburg HRB 99731\nTimer Leipzig GmbH – Hamburg",
      "type": "Registerbekanntmachung nach dem Umwandlungsgesetz",
      "state": "Hamburg",
      "amtsgericht": "Amtsgericht Hamburg",
      "registernummer": "HRB 99731",
      "registerart": "HRB",
      "company_name": "Timer Leipzig GmbH",
      "company_seat": "Hamburg",
      "details": "23.12.2024 (Bekanntmachungsdatum)\n\nHamburg Amtsgericht Hamburg HRB 99731\nRegisterbekanntmachung nach dem Umwandlungsgesetz\n\nTimer Leipzig GmbH\nGesellschaft mit beschränkter Haftung\nHamburg\n\nAls nicht eingetragen wird bekannt gemacht:\nEs wird darauf hingewiesen, dass ein Formwechselplan oder sein Entwurf über einen grenzüberschreitenden Formwechsel in die Timer Leipzig S.à r.l. mit Sitz in Luxemburg/Luxemburg  (société à responsabilité limitée - Gesellschaft mit beschränkter Haftung  nach luxemburgischem Recht) beim Handelsregister eingereicht worden ist.\nDie Anteilsinhaber, die Gläubiger sowie die zuständigen Betriebsräte der an dem grenzüberschreitenden Formwechsel beteiligten Gesellschaft oder, soweit es keinen Betriebsrat gibt, die Arbeitnehmer der an dem grenzüberschreitenden Formwechsel beteiligten Gesellschaft, können der Gesellschaft spätestens fünf Arbeitstage vor dem Tag der Gesellschafterversammlung Bemerkungen zum Formwechselplan übermitteln."
    },
    {
      "date": "2024-12-23",
      "id": "97257",
      "original_text": "Registerbekanntmachung nach dem Umwandlungsgesetz\nBerlin Amtsgericht Berlin (Charlottenburg) HRB 224005\nGansel Rechtsanwälte Rechtsanwalts-Aktiengesellschaft – Berlin",
      "type": "Registerbekanntmachung nach dem Umwandlungsgesetz",
      "state": "Berlin",
      "amtsgericht": "Amtsgericht Berlin (Charlottenburg)",
      "registernummer": "HRB 224005",
      "registerart": "HRB",
      "company_name": "Gansel Rechtsanwälte Rechtsanwalts-Aktiengesellschaft",
      "company_seat": "Berlin",
      "details": "23.12.2024 (Bekanntmachungsdatum)\n\nBerlin Amtsgericht Berlin (Charlottenburg) HRB 224005\nRegisterbekanntmachung nach dem Umwandlungsgesetz 20.12.2024 (Eintragungsdatum)\n\nGansel Rechtsanwälte Rechtsanwalts-Aktiengesellschaft\nAktiengesellschaft\nBerlin\n\nZu Eintragungsnummer 4 vom 20.12.2024 wird als nicht eingetragen veröffentlicht: Den Gläubigern ist, wenn sie binnen sechs Monaten nach dem Tag, an dem die Eintragung der Umwandlung als bekannt gemacht gilt, ihren Anspruch nach Grund und Höhe schriftlich anmelden, Sicherheit zu leisten, soweit sie nicht Befriedigung verlangen können. Dieses Recht steht den Gläubigern jedoch nur zu, wenn sie glaubhaft machen, dass durch die Umwandlung die Erfüllung ihrer Forderung gefährdet wird. Das Recht, Sicherheitsleistung zu verlangen, steht Gläubigern nicht zu, die im Falle der Insolvenz ein Recht auf vorzugsweise Befriedigung aus einer Deckungsmasse haben, die nach gesetzlicher Vorschrift zu ihrem Schutz errichtet und staatlich überwacht ist."
    },
    {
      "date": "2024-12-23",
      "id": "97258",
      "original_text": "Registerbekanntmachung nach dem Umwandlungsgesetz\nHamburg Amtsgericht Hamburg HRB 126701\nAußenalster TS2 GmbH – Hamburg",
      "type": "Registerbekanntmachung nach dem Umwandlungsgesetz",
      "state": "Hamburg",
      "amtsgericht": "Amtsgericht Hamburg",
      "registernummer": "HRB 126701",
      "registerart": "HRB",
      "company_name": "Außenalster TS2 GmbH",
      "company_seat": "Hamburg",
      "details": "23.12.2024 (Bekanntmachungsdatum)\n\nHamburg Amtsgericht Hamburg HRB 126701\nRegisterbekanntmachung nach dem Umwandlungsgesetz 23.12.2024 (Eintragungsdatum)\n\nAußenalster TS2 GmbH\nGesellschaft mit beschränkter Haftung\nHamburg\n\nAls nicht eingetragen wird bekannt gemacht:\nDen Gläubigern der an der Verschmelzung beteiligten Gesellschaften ist, wenn sie binnen sechs Monaten nach dem Tag, an dem die Eintragung der Verschmelzung in das Register des Sitzes desjenigen Rechtsträgers, dessen Gläubiger sie sind, nach § 19 Absatz 3 UmwG als bekannt gemacht gilt, ihren Anspruch nach Grund und Höhe schriftlich anmelden, Sicherheit zu leisten, soweit sie nicht Befriedigung verlangen können. Dieses Recht steht den Gläubigern jedoch nur zu, wenn sie glaubhaft machen, dass durch die Verschmelzung die Erfüllung ihrer Forderung gefährdet wird."
    },
    {
      "date": "2024-12-23",
      "id": "97259",
      "original_text": "Registerbekanntmachung nach dem Umwandlungsgesetz\nBerlin Amtsgericht Berlin (Charlottenburg) HRB 248528\nRupicapra GmbH – Berlin",
      "type": "Registerbekanntmachung nach dem Umwandlungsgesetz",
      "state": "Berlin",
      "amtsgericht": "Amtsgericht Berlin (Charlottenburg)",
      "registernummer": "HRB 248528",
      "registerart": "HRB",
      "company_name": "Rupicapra GmbH",
      "company_seat": "Berlin",
      "details": "23.12.2024 (Bekanntmachungsdatum)\n\nBerlin Amtsgericht Berlin (Charlottenburg) HRB 248528\nRegisterbekanntmachung nach dem Umwandlungsgesetz 19.12.2024 (Eintragungsdatum)\n\nRupicapra GmbH\nGesellschaft mit beschränkter Haftung\nBerlin\n\nZu Eintragungsnummer 4 vom 19.12.2024 wird als nicht eingetragen veröffentlicht: Den Gläubigern der an der Verschmelzung beteiligten Rechtsträger ist, wenn sie binnen sechs Monaten nach dem Tag, an dem die Eintragung der Verschmelzung in das Register des Sitzes desjenigen Rechtsträgers, dessen Gläubiger sie sind, als bekannt gemacht gilt, ihren Anspruch nach Grund und Höhe schriftlich anmelden, Sicherheit zu leisten, soweit sie nicht Befriedigung verlangen können. Dieses Recht steht den Gläubigern jedoch nur zu, wenn sie glaubhaft machen, dass durch die Verschmelzung die Erfüllung ihrer Forderung gefährdet wird. Das Recht, Sicherheitsleistung zu verlangen, steht Gläubigern nicht zu, die im Falle der Insolvenz ein Recht auf vorzugsweise Befriedigung aus einer Deckungsmasse haben, die nach gesetzlicher Vorschrift zu ihrem Schutz errichtet und staatlich überwacht ist."
    },
    {
      "date": "2024-12-23",
      "id": "97260",
      "original_text": "Löschungsankündigung\nBerlin Amtsgericht Berlin (Charlottenburg) HRB 140380\nZack-Zack GmbH – Berlin",
      "type": "Löschungsankündigung",
      "state": "Berlin",
      "amtsgericht": "Amtsgericht Berlin (Charlottenburg)",
      "registernummer": "HRB 140380",
      "registerart": "HRB",
      "company_name": "Zack-Zack GmbH",
      "company_seat": "Berlin",
      "details": "23.12.2024 (Bekanntmachungsdatum)\n\nBerlin Amtsgericht Berlin (Charlottenburg) HRB 140380\nLöschungsankündigung\n\nZack-Zack GmbH\nGesellschaft mit beschränkter Haftung\nBerlin\n\nBei der nachstehenden Gesellschaft wird das Amtslöschungsverfahren gemäß § 394 FamFG eingeleitet. Widerspruchsfrist 6 Wochen"
    },
    {
      "date": "2024-12-23",
      "id": "97261",
      "original_text": "Einreichung neuer Dokumente\nBerlin Amtsgericht Berlin (Charlottenburg) HRB 44343\nGASAG AG – Berlin",
      "type": "Einreichung neuer Dokumente",
      "state": "Berlin",
      "amtsgericht": "Amtsgericht Berlin (Charlottenburg)",
      "registernummer": "HRB 44343",
      "registerart": "HRB",
      "company_name": "GASAG AG",
      "company_seat": "Berlin",
      "details": "23.12.2024 (Bekanntmachungsdatum)\n\nBerlin Amtsgericht Berlin (Charlottenburg) HRB 44343\nEinreichung neuer Dokumente\n\nGASAG AG\nAktiengesellschaft\nBerlin\n\nAls nicht eingetragen wird veröffentlicht:Es wurde eine neue Liste der Aufsichtsratsmitglieder eingereicht (§ 106 AktG)."
    },
    {
      "date": "2024-12-23",
      "id": "97262",
      "original_text": "Registerbekanntmachung nach dem Umwandlungsgesetz\nSachsen-Anhalt Amtsgericht Stendal HRB 26590\nPB Verwaltungs GmbH – Ilsenburg",
      "type": "Registerbekanntmachung nach dem Umwandlungsgesetz",
      "state": "Sachsen-Anhalt",
      "amtsgericht": "Amtsgericht Stendal",
      "registernummer": "HRB 26590",
      "registerart": "HRB",
      "company_name": "PB Verwaltungs GmbH",
      "company_seat": "Ilsenburg",
      "details": "23.12.2024 (Bekanntmachungsdatum)\n\nSachsen-Anhalt Amtsgericht Stendal HRB 26590\nRegisterbekanntmachung nach dem Umwandlungsgesetz 23.12.2024 (Eintragungsdatum)\n\nPB Verwaltungs GmbH\nGesellschaft mit beschränkter Haftung\nIlsenburg\n\nNicht eingetragen:\nDen Gläubigern der an der Verschmelzung beteiligten Rechtsträger ist, wenn sie binnen sechs Monaten nach dem Tag, an dem die Eintragung der Verschmelzung nach § 19 Abs. 3 UmwG als bekanntgemacht gilt, ihren Anspruch nach Grund und Höhe schriftlich anmelden, Sicherheit zu leisten, soweit sie nicht Befriedigung verlangen können. Dieses Recht steht ihnen jedoch nur zu, wenn sie glaubhaft machen, dass durch die Verschmelzung die Erfüllung ihrer Forderung gefährdet wird."
    },
    {
      "date": "2024-12-23",
      "id": "97263",
      "original_text": "Registerbekanntmachung nach dem Umwandlungsgesetz\nSachsen-Anhalt Amtsgericht Stendal HRB 35004\nLYOCONTRACT Property GmbH – Ilsenburg (Harz)",
      "type": "Registerbekanntmachung nach dem Umwandlungsgesetz",
      "state": "Sachsen-Anhalt",
      "amtsgericht": "Amtsgericht Stendal",
      "registernummer": "HRB 35004",
      "registerart": "HRB",
      "company_name": "LYOCONTRACT Property GmbH",
      "company_seat": "Ilsenburg (Harz)",
      "details": "23.12.2024 (Bekanntmachungsdatum)\n\nSachsen-Anhalt Amtsgericht Stendal HRB 35004\nRegisterbekanntmachung nach dem Umwandlungsgesetz 23.12.2024 (Eintragungsdatum)\n\nLYOCONTRACT Property GmbH\nGesellschaft mit beschränkter Haftung\nIlsenburg (Harz)\n\nNicht eingetragen:\nDen Gläubigern der an der Verschmelzung beteiligten Rechtsträger ist, wenn sie binnen sechs Monaten nach dem Tag, an dem die Eintragung der Verschmelzung nach § 19 Abs. 3 UmwG als bekanntgemacht gilt, ihren Anspruch nach Grund und Höhe schriftlich anmelden, Sicherheit zu leisten, soweit sie nicht Befriedigung verlangen können. Dieses Recht steht ihnen jedoch nur zu, wenn sie glaubhaft machen, dass durch die Verschmelzung die Erfüllung ihrer Forderung gefährdet wird."
    },
    {
      "date": "2024-12-23",
      "id": "97264",
      "original_text": "Sonstige Registerbekanntmachung\nBerlin Amtsgericht Berlin (Charlottenburg) HRB 168869\nPark-Klinik Weißensee GmbH – Berlin",
      "type": "Sonstige Registerbekanntmachung",
      "state": "Berlin",
      "amtsgericht": "Amtsgericht Berlin (Charlottenburg)",
      "registernummer": "HRB 168869",
      "registerart": "HRB",
      "company_name": "Park-Klinik Weißensee GmbH",
      "company_seat": "Berlin",
      "details": "23.12.2024 (Bekanntmachungsdatum)\n\nBerlin Amtsgericht Berlin (Charlottenburg) HRB 168869\nSonstige Registerbekanntmachung\n\nPark-Klinik Weißensee GmbH\nGesellschaft mit beschränkter Haftung\nBerlin\n\nAls nicht eingetragen wird veröffentlicht:\nEs wurde eine neue Liste der Aufsichtsratsmitglieder eingereicht (§52 GmbHG)."
    },
    {
      "date": "2024-12-23",
      "id": "97265",
      "original_text": "Registerbekanntmachung nach dem Umwandlungsgesetz\nNordrhein-Westfalen Amtsgericht Coesfeld HRB 1451\nEF GF-D GmbH – Coesfeld",
      "type": "Registerbekanntmachung nach dem Umwandlungsgesetz",
      "state": "Nordrhein-Westfalen",
      "amtsgericht": "Amtsgericht Coesfeld",
      "registernummer": "HRB 1451",
      "registerart": "HRB",
      "company_name": "EF GF-D GmbH",
      "company_seat": "Coesfeld",
      "details": "23.12.2024 (Bekanntmachungsdatum)\n\nNordrhein-Westfalen Amtsgericht Coesfeld HRB 1451\nRegisterbekanntmachung nach dem Umwandlungsgesetz 23.12.2024 (Eintragungsdatum)\n\nEF GF-D GmbH\nGesellschaft mit beschränkter Haftung\nCoesfeld\n\nDen Gläubigern der an der Verschmelzung beteiligten Rechtsträger ist, wenn sie binnen sechs Monaten nach dem Tag, an dem die Eintragung der Verschmelzung in das Register des Sitzes derjenigen Rechtsträger deren Gläubiger sie sind, nach § 19 Absatz 3 UmwG als bekanntgemacht gilt, ihren Anspruch nach Grund und Höhe schriftlich anmelden, Sicherheit zu leisten, soweit sie nicht Befriedigung verlangen können. Dieses Recht steht den Gläubigern jedoch nur zu, wenn sie glaubhaft machen, dass durch die Verschmelzung die Erfüllung ihrer Forderung gefährdet wird."
    },
    {
      "date": "2024-12-23",
      "id": "97266",
      "original_text": "Löschungsankündigung\nBerlin Amtsgericht Berlin (Charlottenburg) HRB 205385\nWealth Pharma GmbH – Berlin",
      "type": "Löschungsankündigung",
      "state": "Berlin",
      "amtsgericht": "Amtsgericht Berlin (Charlottenburg)",
      "registernummer": "HRB 205385",
      "registerart": "HRB",
      "company_name": "Wealth Pharma GmbH",
      "company_seat": "Berlin",
      "details": "23.12.2024 (Bekanntmachungsdatum)\n\nBerlin Amtsgericht Berlin (Charlottenburg) HRB 205385\nLöschungsankündigung\n\nWealth Pharma GmbH\nGesellschaft mit beschränkter Haftung\nBerlin\n\nBei der nachstehenden Gesellschaft wird das Amtslöschungsverfahren gemäß § 394 FamFG eingeleitet. Widerspruchsfrist 6 Wochen"
    },
    {
      "date": "2024-12-23",
      "id": "97267",
      "original_text": "Registerbekanntmachung nach dem Umwandlungsgesetz\nHamburg Amtsgericht Hamburg HRB 58997\nVerwaltung MS \"ANNA RICKMERS\" Schiffsbeteiligungsgesellschaft mbH – Hamburg",
      "type": "Registerbekanntmachung nach dem Umwandlungsgesetz",
      "state": "Hamburg",
      "amtsgericht": "Amtsgericht Hamburg",
      "registernummer": "HRB 58997",
      "registerart": "HRB",
      "company_name": "Verwaltung MS \"ANNA RICKMERS\" Schiffsbeteiligungsgesellschaft mbH",
      "company_seat": "Hamburg",
      "details": "23.12.2024 (Bekanntmachungsdatum)\n\nHamburg Amtsgericht Hamburg HRB 58997\nRegisterbekanntmachung nach dem Umwandlungsgesetz 23.12.2024 (Eintragungsdatum)\n\nVerwaltung MS \"ANNA RICKMERS\" Schiffsbeteiligungsgesellschaft mbH\nGesellschaft mit beschränkter Haftung\nHamburg\n\nAls nicht eingetragen wird bekannt gemacht:\nDen Gläubigern der an der Verschmelzung beteiligten Gesellschaften ist, wenn sie binnen sechs Monaten nach dem Tag, an dem die Eintragung der Verschmelzung in das Register des Sitzes desjenigen Rechtsträgers, dessen Gläubiger sie sind, nach § 19 Absatz 3 UmwG als bekannt gemacht gilt, ihren Anspruch nach Grund und Höhe schriftlich anmelden, Sicherheit zu leisten, soweit sie nicht Befriedigung verlangen können. Dieses Recht steht den Gläubigern jedoch nur zu, wenn sie glaubhaft machen, dass durch die Verschmelzung die Erfüllung ihrer Forderung gefährdet wird."
    },
    {
      "date": "2024-12-23",
      "id": "97268",
      "original_text": "Registerbekanntmachung nach dem Umwandlungsgesetz\nHamburg Amtsgericht Hamburg HRB 58923\nVerwaltung MS \"LARA RICKMERS\" Schiffsbeteiligungsgesellschaft mbH – Hamburg",
      "type": "Registerbekanntmachung nach dem Umwandlungsgesetz",
      "state": "Hamburg",
      "amtsgericht": "Amtsgericht Hamburg",
      "registernummer": "HRB 58923",
      "registerart": "HRB",
      "company_name": "Verwaltung MS \"LARA RICKMERS\" Schiffsbeteiligungsgesellschaft mbH",
      "company_seat": "Hamburg",
      "details": "23.12.2024 (Bekanntmachungsdatum)\n\nHamburg Amtsgericht Hamburg HRB 58923\nRegisterbekanntmachung nach dem Umwandlungsgesetz 23.12.2024 (Eintragungsdatum)\n\nVerwaltung MS \"LARA RICKMERS\" Schiffsbeteiligungsgesellschaft mbH\nGesellschaft mit beschränkter Haftung\nHamburg\n\nAls nicht eingetragen wird bekannt gemacht:\nDen Gläubigern der an der Verschmelzung beteiligten Gesellschaften ist, wenn sie binnen sechs Monaten nach dem Tag, an dem die Eintragung der Verschmelzung in das Register des Sitzes desjenigen Rechtsträgers, dessen Gläubiger sie sind, nach § 19 Absatz 3 UmwG als bekannt gemacht gilt, ihren Anspruch nach Grund und Höhe schriftlich anmelden, Sicherheit zu leisten, soweit sie nicht Befriedigung verlangen können. Dieses Recht steht den Gläubigern jedoch nur zu, wenn sie glaubhaft machen, dass durch die Verschmelzung die Erfüllung ihrer Forderung gefährdet wird."
    },
    {
      "date": "2024-12-23",
      "id": "97269",
      "original_text": "Registerbekanntmachung nach dem Umwandlungsgesetz\nHamburg Amtsgericht Hamburg HRB 58707\nVerwaltung MS \"CHRISTA RICKMERS\" Schiffsbeteiligungsgesellschaft mbH – Hamburg",
      "type": "Registerbekanntmachung nach dem Umwandlungsgesetz",
      "state": "Hamburg",
      "amtsgericht": "Amtsgericht Hamburg",
      "registernummer": "HRB 58707",
      "registerart": "HRB",
      "company_name": "Verwaltung MS \"CHRISTA RICKMERS\" Schiffsbeteiligungsgesellschaft mbH",
      "company_seat": "Hamburg",
      "details": "23.12.2024 (Bekanntmachungsdatum)\n\nHamburg Amtsgericht Hamburg HRB 58707\nRegisterbekanntmachung nach dem Umwandlungsgesetz 23.12.2024 (Eintragungsdatum)\n\nVerwaltung MS \"CHRISTA RICKMERS\" Schiffsbeteiligungsgesellschaft mbH\nGesellschaft mit beschränkter Haftung\nHamburg\n\nAls nicht eingetragen wird bekannt gemacht:\nDen Gläubigern der an der Verschmelzung beteiligten Gesellschaften ist, wenn sie binnen sechs Monaten nach dem Tag, an dem die Eintragung der Verschmelzung in das Register des Sitzes desjenigen Rechtsträgers, dessen Gläubiger sie sind, nach § 19 Absatz 3 UmwG als bekannt gemacht gilt, ihren Anspruch nach Grund und Höhe schriftlich anmelden, Sicherheit zu leisten, soweit sie nicht Befriedigung verlangen können. Dieses Recht steht den Gläubigern jedoch nur zu, wenn sie glaubhaft machen, dass durch die Verschmelzung die Erfüllung ihrer Forderung gefährdet wird."
    },
    {
      "date": "2024-12-23",
      "id": "97270",
      "original_text": "Sonstige Registerbekanntmachung\nBerlin Amtsgericht Berlin (Charlottenburg) HRB 77192\nMLK Mitteldeutsche Licht- und Kraftwerke AG – Berlin",
      "type": "Sonstige Registerbekanntmachung",
      "state": "Berlin",
      "amtsgericht": "Amtsgericht Berlin (Charlottenburg)",
      "registernummer": "HRB 77192",
      "registerart": "HRB",
      "company_name": "MLK Mitteldeutsche Licht- und Kraftwerke AG",
      "company_seat": "Berlin",
      "details": "23.12.2024 (Bekanntmachungsdatum)\n\nBerlin Amtsgericht Berlin (Charlottenburg) HRB 77192\nSonstige Registerbekanntmachung\n\nMLK Mitteldeutsche Licht- und Kraftwerke AG\nAktiengesellschaft\nBerlin\n\nAls nicht eingetragen wird veröffentlicht: Es wurde eine neue Liste der Aufsichtsratsmitglieder eingereicht (§ 106 AktG)."
    },
    {
      "date": "2024-12-23",
      "id": "97271",
      "original_text": "Registerbekanntmachung nach dem Umwandlungsgesetz\nHamburg Amtsgericht Hamburg HRB 57417\nVerwaltung MS \"CAMILLA RICKMERS\" Schiffsbeteiligungsgesellschaft mbH – Hamburg",
      "type": "Registerbekanntmachung nach dem Umwandlungsgesetz",
      "state": "Hamburg",
      "amtsgericht": "Amtsgericht Hamburg",
      "registernummer": "HRB 57417",
      "registerart": "HRB",
      "company_name": "Verwaltung MS \"CAMILLA RICKMERS\" Schiffsbeteiligungsgesellschaft mbH",
      "company_seat": "Hamburg",
      "details": "23.12.2024 (Bekanntmachungsdatum)\n\nHamburg Amtsgericht Hamburg HRB 57417\nRegisterbekanntmachung nach dem Umwandlungsgesetz 23.12.2024 (Eintragungsdatum)\n\nVerwaltung MS \"CAMILLA RICKMERS\" Schiffsbeteiligungsgesellschaft mbH\nGesellschaft mit beschränkter Haftung\nHamburg\n\nAls nicht eingetragen wird bekannt gemacht:\nDen Gläubigern der an der Verschmelzung beteiligten Gesellschaften ist, wenn sie binnen sechs Monaten nach dem Tag, an dem die Eintragung der Verschmelzung in das Register des Sitzes desjenigen Rechtsträgers, dessen Gläubiger sie sind, nach § 19 Absatz 3 UmwG als bekannt gemacht gilt, ihren Anspruch nach Grund und Höhe schriftlich anmelden, Sicherheit zu leisten, soweit sie nicht Befriedigung verlangen können. Dieses Recht steht den Gläubigern jedoch nur zu, wenn sie glaubhaft machen, dass durch die Verschmelzung die Erfüllung ihrer Forderung gefährdet wird."
    },
    {
      "date": "2024-12-23",
      "id": "97272",
      "original_text": "Löschungsankündigung\nBerlin Amtsgericht Berlin (Charlottenburg) HRB 103143\nWVM Medien GmbH Verlag und Vertrieb – Berlin",
      "type": "Löschungsankündigung",
      "state": "Berlin",
      "amtsgericht": "Amtsgericht Berlin (Charlottenburg)",
      "registernummer": "HRB 103143",
      "registerart": "HRB",
      "company_name": "WVM Medien GmbH Verlag und Vertrieb",
      "company_seat": "Berlin",
      "details": "23.12.2024 (Bekanntmachungsdatum)\n\nBerlin Amtsgericht Berlin (Charlottenburg) HRB 103143\nLöschungsankündigung\n\nWVM Medien GmbH Verlag und Vertrieb\nGesellschaft mit beschränkter Haftung\nBerlin\n\nBei der nachstehenden Gesellschaft wird das Amtslöschungsverfahren gemäß § 394 FamFG eingeleitet. Widerspruchsfrist 6 Wochen"
    },
    {
      "date": "2024-12-23",
      "id": "97273",
      "original_text": "Registerbekanntmachung nach dem Umwandlungsgesetz\nBerlin Amtsgericht Berlin (Charlottenburg) HRA 61642\naliacare - ambulanter Pflegedienst Selviye Spriewald e. Kfr. – Berlin",
      "type": "Registerbekanntmachung nach dem Umwandlungsgesetz",
      "state": "Berlin",
      "amtsgericht": "Amtsgericht Berlin (Charlottenburg)",
      "registernummer": "HRA 61642",
      "registerart": "HRA",
      "company_name": "aliacare - ambulanter Pflegedienst Selviye Spriewald e. Kfr.",
      "company_seat": "Berlin",
      "details": "23.12.2024 (Bekanntmachungsdatum)\n\nBerlin Amtsgericht Berlin (Charlottenburg) HRA 61642\nRegisterbekanntmachung nach dem Umwandlungsgesetz 23.12.2024 (Eintragungsdatum)\n\naliacare - ambulanter Pflegedienst Selviye Spriewald e. Kfr.\nEinzelkaufmann / Einzelkauffrau\nBerlin\n\nZu Eintragungsnummer 2 vom 23.12.2024 wird als nicht eingetragen veröffentlicht: Den Gläubigern der an der Ausgliederung beteiligten Rechtsträger ist, wenn sie binnen sechs Monaten nach dem Tag, an dem die Eintragung der Ausgliederung in das Register des Sitzes desjenigen Rechtsträgers, dessen Gläubiger sie sind, als bekannt gemacht gilt, ihren Anspruch nach Grund und Höhe schriftlich anmelden, Sicherheit zu leisten, soweit sie nicht Befriedigung verlangen können. Dieses Recht steht den Gläubigern jedoch nur zu, wenn sie glaubhaft machen, dass durch die Ausgliederung die Erfüllung ihrer Forderung gefährdet wird. Das Recht, Sicherheitsleistung zu verlangen, steht Gläubigern nicht zu, die im Falle der Insolvenz ein Recht auf vorzugsweise Befriedigung aus einer Deckungsmasse haben, die nach gesetzlicher Vorschrift zu ihrem Schutz errichtet und staatlich überwacht ist."
    },
    {
      "date": "2024-12-23",
      "id": "97274",
      "original_text": "Einreichung neuer Dokumente\nThüringen Amtsgericht Jena HRB 401918\nStadtwerke Mühlhausen GmbH – Mühlhausen",
      "type": "Einreichung neuer Dokumente",
      "state": "Thüringen",
      "amtsgericht": "Amtsgericht Jena",
      "registernummer": "HRB 401918",
      "registerart": "HRB",
      "company_name": "Stadtwerke Mühlhausen GmbH",
      "company_seat": "Mühlhausen",
      "details": "23.12.2024 (Bekanntmachungsdatum)\n\nThüringen Amtsgericht Jena HRB 401918\nEinreichung neuer Dokumente\n\nStadtwerke Mühlhausen GmbH\nGesellschaft mit beschränkter Haftung\nMühlhausen\n\nBekanntmachung gem. § 52 Abs. 3 Satz 2 GmbHG: Aufgrund einer Veränderung in den Personen der Aufsichtsratsmitglieder ist durch die Geschäftsführer eine neue Liste zum Handelsregister eingereicht worden."
    },
    {
      "date": "2024-12-23",
      "id": "97275",
      "original_text": "Einreichung neuer Dokumente\nThüringen Amtsgericht Jena HRB 401137\nEW Eichsfeldgas GmbH – Leinefelde-Worbis",
      "type": "Einreichung neuer Dokumente",
      "state": "Thüringen",
      "amtsgericht": "Amtsgericht Jena",
      "registernummer": "HRB 401137",
      "registerart": "HRB",
      "company_name": "EW Eichsfeldgas GmbH",
      "company_seat": "Leinefelde-Worbis",
      "details": "23.12.2024 (Bekanntmachungsdatum)\n\nThüringen Amtsgericht Jena HRB 401137\nEinreichung neuer Dokumente\n\nEW Eichsfeldgas GmbH\nGesellschaft mit beschränkter Haftung\nLeinefelde-Worbis\n\nBekanntmachung gem. § 52 Abs. 3 Satz 2 GmbHG: Aufgrund einer Veränderung in den Personen der Aufsichtsratsmitglieder ist durch die Geschäftsführer eine neue Liste zum Handelsregister eingereicht worden."
    },
    {
      "date": "2024-12-23",
      "id": "97276",
      "original_text": "Registerbekanntmachung nach dem Umwandlungsgesetz\nBerlin Amtsgericht Berlin (Charlottenburg) HRB 4870\naliacare ambulanter pflegedienst GmbH – Berlin",
      "type": "Registerbekanntmachung nach dem Umwandlungsgesetz",
      "state": "Berlin",
      "amtsgericht": "Amtsgericht Berlin (Charlottenburg)",
      "registernummer": "HRB 4870",
      "registerart": "HRB",
      "company_name": "aliacare ambulanter pflegedienst GmbH",
      "company_seat": "Berlin",
      "details": "23.12.2024 (Bekanntmachungsdatum)\n\nBerlin Amtsgericht Berlin (Charlottenburg) HRB 4870\nRegisterbekanntmachung nach dem Umwandlungsgesetz 23.12.2024 (Eintragungsdatum)\n\naliacare ambulanter pflegedienst GmbH\nGesellschaft mit beschränkter Haftung\nBerlin\n\nZu Eintragungsnummer 6 vom 23.12.2024 wird als nicht eingetragen veröffentlicht: Den Gläubigern der an der Ausgliederung beteiligten Rechtsträger ist, wenn sie binnen sechs Monaten nach dem Tag, an dem die Eintragung der Ausgliederung in das Register des Sitzes desjenigen Rechtsträgers, dessen Gläubiger sie sind, als bekannt gemacht gilt, ihren Anspruch nach Grund und Höhe schriftlich anmelden, Sicherheit zu leisten, soweit sie nicht Befriedigung verlangen können. Dieses Recht steht den Gläubigern jedoch nur zu, wenn sie glaubhaft machen, dass durch die Ausgliederung die Erfüllung ihrer Forderung gefährdet wird. Das Recht, Sicherheitsleistung zu verlangen, steht Gläubigern nicht zu, die im Falle der Insolvenz ein Recht auf vorzugsweise Befriedigung aus einer Deckungsmasse haben, die nach gesetzlicher Vorschrift zu ihrem Schutz errichtet und staatlich überwacht ist."
    },
    {
      "date": "2024-12-23",
      "id": "97277",
      "original_text": "Registerbekanntmachung nach dem Umwandlungsgesetz\nNordrhein-Westfalen Amtsgericht Coesfeld HRB 2124\nErnsting's media GmbH – Coesfeld",
      "type": "Registerbekanntmachung nach dem Umwandlungsgesetz",
      "state": "Nordrhein-Westfalen",
      "amtsgericht": "Amtsgericht Coesfeld",
      "registernummer": "HRB 2124",
      "registerart": "HRB",
      "company_name": "Ernsting's media GmbH",
      "company_seat": "Coesfeld",
      "details": "23.12.2024 (Bekanntmachungsdatum)\n\nNordrhein-Westfalen Amtsgericht Coesfeld HRB 2124\nRegisterbekanntmachung nach dem Umwandlungsgesetz 23.12.2024 (Eintragungsdatum)\n\nErnsting's media GmbH\nGesellschaft mit beschränkter Haftung\nCoesfeld\n\nDen Gläubigern der an der Verschmelzung beteiligten Rechtsträger ist, wenn sie binnen sechs Monaten nach dem Tag, an dem die Eintragung der Verschmelzung in das Register des Sitzes derjenigen Rechtsträger deren Gläubiger sie sind, nach § 19 Absatz 3 UmwG als bekanntgemacht gilt, ihren Anspruch nach Grund und Höhe schriftlich anmelden, Sicherheit zu leisten, soweit sie nicht Befriedigung verlangen können. Dieses Recht steht den Gläubigern jedoch nur zu, wenn sie glaubhaft machen, dass durch die Verschmelzung die Erfüllung ihrer Forderung gefährdet wird."
    },
    {
      "date": "2024-12-23",
      "id": "97278",
      "original_text": "Sonstige Registerbekanntmachung\nBerlin Amtsgericht Berlin (Charlottenburg) HRB 109105\nTibado Care Berlin GmbH – Berlin",
      "type": "Sonstige Registerbekanntmachung",
      "state": "Berlin",
      "amtsgericht": "Amtsgericht Berlin (Charlottenburg)",
      "registernummer": "HRB 109105",
      "registerart": "HRB",
      "company_name": "Tibado Care Berlin GmbH",
      "company_seat": "Berlin",
      "details": "23.12.2024 (Bekanntmachungsdatum)\n\nBerlin Amtsgericht Berlin (Charlottenburg) HRB 109105\nSonstige Registerbekanntmachung\n\nTibado Care Berlin GmbH\nGesellschaft mit beschränkter Haftung\nBerlin\n\nAls nicht eingetragen wird veröffentlicht: Der andere Vertragsteil hat den Gläubigern dieses Rechtsträgers, deren Forderungen begründet worden sind, bevor die Eintragung der Beendigung dieses Vertrages in das Handelsregister nach § 10 des Handelsgesetzbuches als bekannt gemacht gilt, Sicherheit zu leisten, wenn sie sich binnen sechs Monaten nach der Bekanntmachung der Eintragung zu diesem Zweck bei ihm melden. Dieses Recht steht den Gläubigern nicht zu, die im Fall des Insolvenzverfahrens ein Recht auf vorzugsweise Befriedigung aus der Deckungsmasse haben, die nach gesetzlicher Vorschrift zu ihrem Schutz errichtet und staatlich überwacht ist."
    },
    {
      "date": "2024-12-23",
      "id": "97279",
      "original_text": "Einreichung neuer Dokumente\nBerlin Amtsgericht Berlin (Charlottenburg) HRB 248174\nmomox Holding SE – Berlin",
      "type": "Einreichung neuer Dokumente",
      "state": "Berlin",
      "amtsgericht": "Amtsgericht Berlin (Charlottenburg)",
      "registernummer": "HRB 248174",
      "registerart": "HRB",
      "company_name": "momox Holding SE",
      "company_seat": "Berlin",
      "details": "23.12.2024 (Bekanntmachungsdatum)\n\nBerlin Amtsgericht Berlin (Charlottenburg) HRB 248174\nEinreichung neuer Dokumente\n\nmomox Holding SE\nEuropäische Aktiengesellschaft (SE)\nBerlin\n\nAls nicht eingetragen wird veröffentlicht: Es wurde eine neue Liste der Aufsichtsratsmitglieder eingereicht (§ 106 AktG)."
    },
    {
      "date": "2024-12-23",
      "id": "97280",
      "original_text": "Löschungsankündigung\nBrandenburg Amtsgericht Potsdam HRB 38184\nHörstern Hörgeräte UG (haftungsbeschränkt) – Brandenburg an der Havel",
      "type": "Löschungsankündigung",
      "state": "Brandenburg",
      "amtsgericht": "Amtsgericht Potsdam",
      "registernummer": "HRB 38184",
      "registerart": "HRB",
      "company_name": "Hörstern Hörgeräte UG (haftungsbeschränkt)",
      "company_seat": "Brandenburg an der Havel",
      "details": "23.12.2024 (Bekanntmachungsdatum)\n\nBrandenburg Amtsgericht Potsdam HRB 38184\nLöschungsankündigung\n\nHörstern Hörgeräte UG (haftungsbeschränkt)\nGesellschaft mit beschränkter Haftung\nBrandenburg an der Havel\n\nBei der nachstehenden Gesellschaft wird das Amtslöschungsverfahren gemäß § 394 FamFG eingeleitet. Widerspruchsfrist: 8 Wochen."
    },
    {
      "date": "2024-12-23",
      "id": "97281",
      "original_text": "Sonstige Registerbekanntmachung\nBerlin Amtsgericht Berlin (Charlottenburg) HRB 35454\nFor Life Produktions- und Vertriebsgesellschaft für Heil- und Hilfsmittel mbH – Berlin",
      "type": "Sonstige Registerbekanntmachung",
      "state": "Berlin",
      "amtsgericht": "Amtsgericht Berlin (Charlottenburg)",
      "registernummer": "HRB 35454",
      "registerart": "HRB",
      "company_name": "For Life Produktions- und Vertriebsgesellschaft für Heil- und Hilfsmittel mbH",
      "company_seat": "Berlin",
      "details": "23.12.2024 (Bekanntmachungsdatum)\n\nBerlin Amtsgericht Berlin (Charlottenburg) HRB 35454\nSonstige Registerbekanntmachung\n\nFor Life Produktions- und Vertriebsgesellschaft für Heil- und Hilfsmittel mbH\nGesellschaft mit beschränkter Haftung\nBerlin\n\nAls nicht eingetragen wird veröffentlicht: Der andere Vertragsteil hat den Gläubigern dieses Rechtsträgers, deren Forderungen begründet worden sind, bevor die Eintragung der Beendigung dieses Vertrages in das Handelsregister nach § 10 des Handelsgesetzbuches als bekannt gemacht gilt, Sicherheit zu leisten, wenn sie sich binnen sechs Monaten nach der Bekanntmachung der Eintragung zu diesem Zweck bei ihm melden. Dieses Recht steht den Gläubigern nicht zu, die im Fall des Insolvenzverfahrens ein Recht auf vorzugsweise Befriedigung aus der Deckungsmasse haben, die nach gesetzlicher Vorschrift zu ihrem Schutz errichtet und staatlich überwacht ist."
    },
    {
      "date": "2024-12-23",
      "id": "97282",
      "original_text": "Sonstige Registerbekanntmachung\nMecklenburg-Vorpommern Amtsgericht Rostock HRB 4760\nGüstrower Werkstätten GmbH – Güstrow",
      "type": "Sonstige Registerbekanntmachung",
      "state": "Mecklenburg-Vorpommern",
      "amtsgericht": "Amtsgericht Rostock",
      "registernummer": "HRB 4760",
      "registerart": "HRB",
      "company_name": "Güstrower Werkstätten GmbH",
      "company_seat": "Güstrow",
      "details": "23.12.2024 (Bekanntmachungsdatum)\n\nMecklenburg-Vorpommern Amtsgericht Rostock HRB 4760\nSonstige Registerbekanntmachung 23.12.2024 (Eintragungsdatum)\n\nGüstrower Werkstätten GmbH\nGesellschaft mit beschränkter Haftung\nGüstrow\n\nEine Liste der Mitglieder des Aufsichtsrats ist zum Handelsregister eingereicht worden."
    },
    {
      "date": "2024-12-23",
      "id": "97283",
      "original_text": "Löschungsankündigung\nBrandenburg Amtsgericht Potsdam HRB 21638\nEpionics Medical GmbH – Potsdam",
      "type": "Löschungsankündigung",
      "state": "Brandenburg",
      "amtsgericht": "Amtsgericht Potsdam",
      "registernummer": "HRB 21638",
      "registerart": "HRB",
      "company_name": "Epionics Medical GmbH",
      "company_seat": "Potsdam",
      "details": "23.12.2024 (Bekanntmachungsdatum)\n\nBrandenburg Amtsgericht Potsdam HRB 21638\nLöschungsankündigung\n\nEpionics Medical GmbH\nGesellschaft mit beschränkter Haftung\nPotsdam\n\nBei der nachstehenden Gesellschaft wird das Amtslöschungsverfahren gemäß § 394 FamFG eingeleitet. Widerspruchsfrist: 8 Wochen"
    },
    {
      "date": "2024-12-23",
      "id": "97284",
      "original_text": "Registerbekanntmachung nach dem Umwandlungsgesetz\nHamburg Amtsgericht Hamburg HRB 125740\nBauer Media Audio Holding GmbH – Hamburg",
      "type": "Registerbekanntmachung nach dem Umwandlungsgesetz",
      "state": "Hamburg",
      "amtsgericht": "Amtsgericht Hamburg",
      "registernummer": "HRB 125740",
      "registerart": "HRB",
      "company_name": "Bauer Media Audio Holding GmbH",
      "company_seat": "Hamburg",
      "details": "23.12.2024 (Bekanntmachungsdatum)\n\nHamburg Amtsgericht Hamburg HRB 125740\nRegisterbekanntmachung nach dem Umwandlungsgesetz 23.12.2024 (Eintragungsdatum)\n\nBauer Media Audio Holding GmbH\nGesellschaft mit beschränkter Haftung\nHamburg\n\nAls nicht eingetragen wird bekannt gemacht:\nDen Gläubigern der an der grenzüberschreitenden Verschmelzung beteiligten übernehmenden Rechtsträger ist, wenn sie binnen sechs Monaten nach dem Tag, an dem die Eintragung der Verschmelzung in das Register des Sitzes desjenigen Rechtsträgers, dessen Gläubiger sie sind, nach § 19 Absatz 3 UmwG als bekanntgemacht gilt, ihren Anspruch nach Grund und Höhe schriftlich anmelden, Sicherheit zu leisten, soweit sie nicht Befriedigung verlangen können.\nDieses Recht steht den Gläubigern jedoch nur zu, wenn sie glaubhaft machen, dass durch die Verschmelzung die Erfüllung ihrer Forderung gefährdet wird.Als nicht eingetragen wird bekannt gemacht:\nDen Gläubigern der an der Verschmelzung beteiligten Gesellschaften ist, wenn sie binnen zwei Monaten nach dem Tag, an dem der gemeinsame Verschmelzungsplan bekannt gemacht worden ist, ihren Anspruch nach Grund und Höhe schriftlich anmelden, Sicherheit zu leisten, soweit sie nicht Befriedigung verlangen können. Dieses Recht steht den Gläubigern jedoch nur zu, wenn sie glaubhaft machen, dass durch die Verschmelzung die Erfüllung ihrer Forderung gefährdet wird, und nur in Hinblick auf solche Forderungen, die vor oder bis zu 15 Tagen nach Bekanntmachung des Verschmelzungsplans entstanden sind."
    },
    {
      "date": "2024-12-23",
      "id": "97285",
      "original_text": "Registerbekanntmachung nach dem Umwandlungsgesetz\nSchleswig-Holstein Amtsgericht Kiel HRB 15729\nKröger Kranbau und Industrieservice GmbH – Neumünster",
      "type": "Registerbekanntmachung nach dem Umwandlungsgesetz",
      "state": "Schleswig-Holstein",
      "amtsgericht": "Amtsgericht Kiel",
      "registernummer": "HRB 15729",
      "registerart": "HRB",
      "company_name": "Kröger Kranbau und Industrieservice GmbH",
      "company_seat": "Neumünster",
      "details": "23.12.2024 (Bekanntmachungsdatum)\n\nSchleswig-Holstein Amtsgericht Kiel HRB 15729\nRegisterbekanntmachung nach dem Umwandlungsgesetz 23.12.2024 (Eintragungsdatum)\n\nKröger Kranbau und Industrieservice GmbH\nGesellschaft mit beschränkter Haftung\nNeumünster\n\nZu Eintragungsnummer 3 vom 23.12.2024 wird als nicht eingetragen veröffentlicht: Den Gläubigern der an der Verschmelzung beteiligten Rechtsträger ist, wenn sie binnen sechs Monaten nach dem Tag, an dem die Eintragung der Verschmelzung in das Register des Sitzes desjenigen Rechtsträgers, dessen Gläubiger sie sind, nach § 19 Abs. 3 UmwG bekannt gemacht worden ist, ihren Anspruch nach Grund und Höhe schriftlich anmelden, Sicherheit zu leisten, soweit sie nicht Befriedigung verlangen können. Dieses Recht steht den Gläubigern jedoch nur zu, wenn sie glaubhaft machen, dass durch die Verschmelzung die Erfüllung ihrer Forderung gefährdet wird."
    },
    {
      "date": "2024-12-23",
      "id": "97286",
      "original_text": "Sonstige Registerbekanntmachung\nSchleswig-Holstein Amtsgericht Flensburg HRB 5581\nDiakonisches Werk Südtondern gGmbH – Niebüll",
      "type": "Sonstige Registerbekanntmachung",
      "state": "Schleswig-Holstein",
      "amtsgericht": "Amtsgericht Flensburg",
      "registernummer": "HRB 5581",
      "registerart": "HRB",
      "company_name": "Diakonisches Werk Südtondern gGmbH",
      "company_seat": "Niebüll",
      "details": "23.12.2024 (Bekanntmachungsdatum)\n\nSchleswig-Holstein Amtsgericht Flensburg HRB 5581\nSonstige Registerbekanntmachung\n\nDiakonisches Werk Südtondern gGmbH\nGesellschaft mit beschränkter Haftung\nNiebüll\n\nNeue Aufsichtsratsliste nach Änderung eingereicht am 23.12.2024"
    },
    {
      "date": "2024-12-23",
      "id": "97287",
      "original_text": "Einreichung neuer Dokumente\nSachsen Amtsgericht Chemnitz HRB 9509\nWohnungsbaugesellschaft Reinsdorf mbH – Reinsdorf",
      "type": "Einreichung neuer Dokumente",
      "state": "Sachsen",
      "amtsgericht": "Amtsgericht Chemnitz",
      "registernummer": "HRB 9509",
      "registerart": "HRB",
      "company_name": "Wohnungsbaugesellschaft Reinsdorf mbH",
      "company_seat": "Reinsdorf",
      "details": "23.12.2024 (Bekanntmachungsdatum)\n\nSachsen Amtsgericht Chemnitz HRB 9509\nEinreichung neuer Dokumente 20.12.2024 (Eintragungsdatum)\n\nWohnungsbaugesellschaft Reinsdorf mbH\nGesellschaft mit beschränkter Haftung\nReinsdorf\n\nAm 20.12.2024 wurde beim Handelsregister des Amtsgerichts Chemnitz die Liste der Mitglieder des Aufsichtsrats gemäß § 52 GmbHG eingereicht."
    },
    {
      "date": "2024-12-23",
      "id": "97288",
      "original_text": "Löschungsankündigung\nSachsen Amtsgericht Dresden HRB 40481\nViva La Shisha GmbH – Dresden",
      "type": "Löschungsankündigung",
      "state": "Sachsen",
      "amtsgericht": "Amtsgericht Dresden",
      "registernummer": "HRB 40481",
      "registerart": "HRB",
      "company_name": "Viva La Shisha GmbH",
      "company_seat": "Dresden",
      "details": "23.12.2024 (Bekanntmachungsdatum)\n\nSachsen Amtsgericht Dresden HRB 40481\nLöschungsankündigung\n\nViva La Shisha GmbH\nGesellschaft mit beschränkter Haftung\nDresden\n\nDas Registergericht beabsichtigt, die im Handelsregister eingetragene Gesellschaft von Amts wegen nach § 394 FamFG zu löschen. Die Frist zu Erhebung eines Widerspruchs gegen die beabsichtigte Löschung wird auf einen Monat festgesetzt."
    },
    {
      "date": "2024-12-23",
      "id": "97289",
      "original_text": "Sonstige Registerbekanntmachung\nNiedersachsen Amtsgericht Hannover HRB 216579\nEnergie-Admin AG – Hannover",
      "type": "Sonstige Registerbekanntmachung",
      "state": "Niedersachsen",
      "amtsgericht": "Amtsgericht Hannover",
      "registernummer": "HRB 216579",
      "registerart": "HRB",
      "company_name": "Energie-Admin AG",
      "company_seat": "Hannover",
      "details": "23.12.2024 (Bekanntmachungsdatum)\n\nNiedersachsen Amtsgericht Hannover HRB 216579\nSonstige Registerbekanntmachung 23.12.2024 (Eintragungsdatum)\n\nEnergie-Admin AG\nAktiengesellschaft\nHannover\n\nDie Liste der Mitglieder des Aufsichtsrats wurde beim Registergericht eingereicht."
    },
    {
      "date": "2024-12-23",
      "id": "97290",
      "original_text": "Einreichung neuer Dokumente\nNiedersachsen Amtsgericht Braunschweig HRB 200053\nPerschmann Calibration GmbH – Braunschweig",
      "type": "Einreichung neuer Dokumente",
      "state": "Niedersachsen",
      "amtsgericht": "Amtsgericht Braunschweig",
      "registernummer": "HRB 200053",
      "registerart": "HRB",
      "company_name": "Perschmann Calibration GmbH",
      "company_seat": "Braunschweig",
      "details": "23.12.2024 (Bekanntmachungsdatum)\n\nNiedersachsen Amtsgericht Braunschweig HRB 200053\nEinreichung neuer Dokumente\n\nPerschmann Calibration GmbH\nGesellschaft mit beschränkter Haftung\nBraunschweig\n\nEine aktuelle Liste der Mitglieder des Beirats (= des Aufsichtsrats) wurde beim Registergericht eingereicht."
    },
    {
      "date": "2024-12-23",
      "id": "97291",
      "original_text": "Löschungsankündigung\nNiedersachsen Amtsgericht Braunschweig HRB 208399\nVest Estate UG (haftungsbeschränkt) – Braunschweig",
      "type": "Löschungsankündigung",
      "state": "Niedersachsen",
      "amtsgericht": "Amtsgericht Braunschweig",
      "registernummer": "HRB 208399",
      "registerart": "HRB",
      "company_name": "Vest Estate UG (haftungsbeschränkt)",
      "company_seat": "Braunschweig",
      "details": "23.12.2024 (Bekanntmachungsdatum)\n\nNiedersachsen Amtsgericht Braunschweig HRB 208399\nLöschungsankündigung 23.12.2024 (Eintragungsdatum)\n\nVest Estate UG (haftungsbeschränkt)\nGesellschaft mit beschränkter Haftung\nBraunschweig\n\nDas Registergericht beabsichtigt, die Gesellschaft von Amts wegen nach § 394 FamFG zu löschen. Die Frist zur Erhebung eines Widerspruchs ist auf 1 Monat ab dieser Registerbekanntmachung festgesetzt."
    },
    {
      "date": "2024-12-23",
      "id": "97292",
      "original_text": "Einreichung neuer Dokumente\nNiedersachsen Amtsgericht Osnabrück HRB 211583\nATTENTIUM AG – Osnabrück",
      "type": "Einreichung neuer Dokumente",
      "state": "Niedersachsen",
      "amtsgericht": "Amtsgericht Osnabrück",
      "registernummer": "HRB 211583",
      "registerart": "HRB",
      "company_name": "ATTENTIUM AG",
      "company_seat": "Osnabrück",
      "details": "23.12.2024 (Bekanntmachungsdatum)\n\nNiedersachsen Amtsgericht Osnabrück HRB 211583\nEinreichung neuer Dokumente\n\nATTENTIUM AG\nAktiengesellschaft\nOsnabrück\n\nDie Liste der Mitglieder des Aufsichtsrats wurde beim Registergericht eingereicht."
    },
    {
      "date": "2024-12-23",
      "id": "97293",
      "original_text": "Registerbekanntmachung nach dem Umwandlungsgesetz\nNiedersachsen Amtsgericht Tostedt HRB 110807 früher Amtsgericht Langen\nfresh haven gmbh – Cuxhaven",
      "type": "Registerbekanntmachung nach dem Umwandlungsgesetz",
      "state": "Niedersachsen",
      "amtsgericht": "Amtsgericht Tostedt",
      "registernummer": "HRB 110807",
      "registerart": "HRB",
      "company_name": "fresh haven gmbh",
      "company_seat": "Cuxhaven",
      "former_amtsgericht": "Langen",
      "details": "23.12.2024 (Bekanntmachungsdatum)\n\nNiedersachsen Amtsgericht Tostedt HRB 110807 früher Amtsgericht Langen\nRegisterbekanntmachung nach dem Umwandlungsgesetz 23.12.2024 (Eintragungsdatum)\n\nfresh haven gmbh\nGesellschaft mit beschränkter Haftung\nCuxhaven\n\nDen Gläubigern der an der Verschmelzung beteiligten Rechtsträger ist, wenn sie binnen sechs Monaten nach dem Tag, an dem die Eintragung der Verschmelzung in das Register des Sitzes desjenigen Rechtsträgers, dessen Gläubiger sie sind, nach § 19  Abs.  3 UmwG als bekannt gemacht gilt, ihren Anspruch nach Grund und Höhe schriftlich anmelden, Sicherheit zu leisten, soweit sie nicht Befriedigung verlangen können. Dieses Recht steht den Gläubigern jedoch nur zu, wenn sie glaubhaft machen, dass durch die Verschmelzung die Erfüllung der Forderung gefährdet wird."
    },
    {
      "date": "2024-12-23",
      "id": "97294",
      "original_text": "Löschungsankündigung\nRheinland-Pfalz Amtsgericht Mainz HRB 22494\nElektro-Diel GmbH – Bingen-Büdesheim",
      "type": "Löschungsankündigung",
      "state": "Rheinland-Pfalz",
      "amtsgericht": "Amtsgericht Mainz",
      "registernummer": "HRB 22494",
      "registerart": "HRB",
      "company_name": "Elektro-Diel GmbH",
      "company_seat": "Bingen-Büdesheim",
      "details": "23.12.2024 (Bekanntmachungsdatum)\n\nRheinland-Pfalz Amtsgericht Mainz HRB 22494\nLöschungsankündigung\n\nElektro-Diel GmbH\nGesellschaft mit beschränkter Haftung\nBingen-Büdesheim\n\nDas Registergericht beabsichtigt die Gesellschaft von Amts wegen nach § 394 FamFG zu löschen. Die Frist zur Erhebung eines Widerspruchs ist auf einen Monat festgesetzt."
    },
    {
      "date": "2024-12-23",
      "id": "97295",
      "original_text": "Einreichung neuer Dokumente\nRheinland-Pfalz Amtsgericht Landau HRB 34004\nGemeindewerke Südpfalz GmbH – Rülzheim",
      "type": "Einreichung neuer Dokumente",
      "state": "Rheinland-Pfalz",
      "amtsgericht": "Amtsgericht Landau",
      "registernummer": "HRB 34004",
      "registerart": "HRB",
      "company_name": "Gemeindewerke Südpfalz GmbH",
      "company_seat": "Rülzheim",
      "details": "23.12.2024 (Bekanntmachungsdatum)\n\nRheinland-Pfalz Amtsgericht Landau HRB 34004\nEinreichung neuer Dokumente\n\nGemeindewerke Südpfalz GmbH\nGesellschaft mit beschränkter Haftung\nRülzheim\n\nDem Registergericht ist eine neue Liste der Mitglieder des Aufsichtsrates eingereicht worden."
    },
    {
      "date": "2024-12-23",
      "id": "97296",
      "original_text": "Registerbekanntmachung nach dem Umwandlungsgesetz\nNordrhein-Westfalen Amtsgericht Bochum HRB 21261\nTiemeyer Holding AG – Bochum",
      "type": "Registerbekanntmachung nach dem Umwandlungsgesetz",
      "state": "Nordrhein-Westfalen",
      "amtsgericht": "Amtsgericht Bochum",
      "registernummer": "HRB 21261",
      "registerart": "HRB",
      "company_name": "Tiemeyer Holding AG",
      "company_seat": "Bochum",
      "details": "23.12.2024 (Bekanntmachungsdatum)\n\nNordrhein-Westfalen Amtsgericht Bochum HRB 21261\nRegisterbekanntmachung nach dem Umwandlungsgesetz 20.12.2024 (Eintragungsdatum)\n\nTiemeyer Holding AG\nAktiengesellschaft\nBochum\n\nDen Gläubigern der an der grenzüberschreitenden Verschmelzung beteiligten übernehmenden Rechtsträger ist, wenn sie binnen sechs Monaten nach dem Tag, an dem die Eintragung der Spaltung in das Register des Sitzes desjenigen Rechtsträgers, dessen Gläubiger sie sind, nach § 19 Absatz 3 UmwG als bekanntgemacht gilt, ihren Anspruch nach Grund und Höhe in Textform anmelden, Sicherheit zu leisten, soweit sie nicht Befriedigung verlangen können.\n\nDieses Recht steht den Gläubigern jedoch nur zu, wenn sie glaubhaft machen, dass durch die Spaltung die Erfüllung ihrer Forderung gefährdet wird."
    },
    {
      "date": "2024-12-23",
      "id": "97297",
      "original_text": "Löschungsankündigung\nNordrhein-Westfalen Amtsgericht Gelsenkirchen HRB 14293\nInca Technologie GmbH – Gladbeck",
      "type": "Löschungsankündigung",
      "state": "Nordrhein-Westfalen",
      "amtsgericht": "Amtsgericht Gelsenkirchen",
      "registernummer": "HRB 14293",
      "registerart": "HRB",
      "company_name": "Inca Technologie GmbH",
      "company_seat": "Gladbeck",
      "details": "23.12.2024 (Bekanntmachungsdatum)\n\nNordrhein-Westfalen Amtsgericht Gelsenkirchen HRB 14293\nLöschungsankündigung\n\nInca Technologie GmbH\nGesellschaft mit beschränkter Haftung\nGladbeck\n\nDas Gericht beabsichtigt, die Gesellschaft Inca Technologie GmbH i. L. mit Sitz in Gladbeck, HRB 14293 Amtsgericht Gelsenkirchen, wegen Vermögenslosigkeit zu löschen.\nHiermit wird denjenigen, die an der Unterlassung der Löschung ein berechtigtes Interesse haben, gem. § 394 Abs. 2 FamFG Gelegenheit gegeben, gegen dieses Vorhaben binnen eines Monats nach dieser Bekanntmachung Widerspruch einzulegen. Der Widerspruch kann schriftlich oder zu Protokoll der Geschäftsstelle erhoben werden."
    },
    {
      "date": "2024-12-23",
      "id": "97298",
      "original_text": "Registerbekanntmachung nach dem Umwandlungsgesetz\nNordrhein-Westfalen Amtsgericht Bochum HRB 22058\nTiemeyer Holding SE – Bochum",
      "type": "Registerbekanntmachung nach dem Umwandlungsgesetz",
      "state": "Nordrhein-Westfalen",
      "amtsgericht": "Amtsgericht Bochum",
      "registernummer": "HRB 22058",
      "registerart": "HRB",
      "company_name": "Tiemeyer Holding SE",
      "company_seat": "Bochum",
      "details": "23.12.2024 (Bekanntmachungsdatum)\n\nNordrhein-Westfalen Amtsgericht Bochum HRB 22058\nRegisterbekanntmachung nach dem Umwandlungsgesetz 20.12.2024 (Eintragungsdatum)\n\nTiemeyer Holding SE\nEuropäische Aktiengesellschaft (SE)\nBochum\n\nDen Gläubigern der an der Verschmelzung beteiligten Rechtsträger ist, wenn sie binnen sechs Monaten nach dem Tag, an dem die Eintragung der Verschmelzung in das Register des Sitzes derjenigen Rechtsträger deren Gläubiger sie sind, nach § 19 Absatz 3 UmwG als bekanntgemacht gilt, ihren Anspruch nach Grund und Höhe schriftlich anmelden, Sicherheit zu leisten, soweit sie nicht Befriedigung verlangen können. Dieses Recht steht den Gläubigern jedoch nur zu, wenn sie glaubhaft machen, dass durch die Verschmelzung die Erfüllung ihrer Forderung gefährdet wird."
    },
    {
      "date": "2024-12-23",
      "id": "97299",
      "original_text": "Registerbekanntmachung nach dem Umwandlungsgesetz\nNordrhein-Westfalen Amtsgericht Bochum HRB 14814\nTiemeyer AG – Bochum",
      "type": "Registerbekanntmachung nach dem Umwandlungsgesetz",
      "state": "Nordrhein-Westfalen",
      "amtsgericht": "Amtsgericht Bochum",
      "registernummer": "HRB 14814",
      "registerart": "HRB",
      "company_name": "Tiemeyer AG",
      "company_seat": "Bochum",
      "details": "23.12.2024 (Bekanntmachungsdatum)\n\nNordrhein-Westfalen Amtsgericht Bochum HRB 14814\nRegisterbekanntmachung nach dem Umwandlungsgesetz 20.12.2024 (Eintragungsdatum)\n\nTiemeyer AG\nAktiengesellschaft\nBochum\n\nDen Gläubigern der an der grenzüberschreitenden Verschmelzung beteiligten übernehmenden Rechtsträger ist, wenn sie binnen sechs Monaten nach dem Tag, an dem die Eintragung der Spaltung in das Register des Sitzes desjenigen Rechtsträgers, dessen Gläubiger sie sind, nach § 19 Absatz 3 UmwG als bekanntgemacht gilt, ihren Anspruch nach Grund und Höhe in Textform anmelden, Sicherheit zu leisten, soweit sie nicht Befriedigung verlangen können.\n\nDieses Recht steht den Gläubigern jedoch nur zu, wenn sie glaubhaft machen, dass durch die Spaltung die Erfüllung ihrer Forderung gefährdet wird."
    },
    {
      "date": "2024-12-23",
      "id": "97300",
      "original_text": "Registerbekanntmachung nach dem Umwandlungsgesetz\nNordrhein-Westfalen Amtsgericht Bochum HRB 22059\nTiemeyer SE – Bochum",
      "type": "Registerbekanntmachung nach dem Umwandlungsgesetz",
      "state": "Nordrhein-Westfalen",
      "amtsgericht": "Amtsgericht Bochum",
      "registernummer": "HRB 22059",
      "registerart": "HRB",
      "company_name": "Tiemeyer SE",
      "company_seat": "Bochum",
      "details": "23.12.2024 (Bekanntmachungsdatum)\n\nNordrhein-Westfalen Amtsgericht Bochum HRB 22059\nRegisterbekanntmachung nach dem Umwandlungsgesetz 20.12.2024 (Eintragungsdatum)\n\nTiemeyer SE\nEuropäische Aktiengesellschaft (SE)\nBochum\n\nDen Gläubigern der an der formwechselnden Umwandlung beteiligten Rechtsträger ist, wenn sie binnen sechs Monaten nach dem Tag, an dem die Eintragung der formwechselnden Umwandlung in das Register des Sitzes derjenigen Rechtsträger deren Gläubiger sie sind, nach § 19 Absatz 3 UmwG als bekanntgemacht gilt, ihren Anspruch nach Grund und Höhe schriftlich anmelden, Sicherheit zu leisten, soweit sie nicht Befriedigung verlangen können. Dieses Recht steht den Gläubigern jedoch nur zu, wenn sie glaubhaft machen, dass durch die formwechselnden Umwandlung die Erfüllung ihrer Forderung gefährdet wird."
    },
    {
      "date": "2024-12-23",
      "id": "97301",
      "original_text": "Löschungsankündigung\nNordrhein-Westfalen Amtsgericht Hamm HRA 3947\nImmobilienkontor Wuppertal \"Schöner Wohnen\" UG (haftungsbeschränkt) & Co. KG – Kamen",
      "type": "Löschungsankündigung",
      "state": "Nordrhein-Westfalen",
      "amtsgericht": "Amtsgericht Hamm",
      "registernummer": "HRA 3947",
      "registerart": "HRA",
      "company_name": "Immobilienkontor Wuppertal \"Schöner Wohnen\" UG (haftungsbeschränkt) & Co. KG",
      "company_seat": "Kamen",
      "details": "23.12.2024 (Bekanntmachungsdatum)\n\nNordrhein-Westfalen Amtsgericht Hamm HRA 3947\nLöschungsankündigung\n\nImmobilienkontor Wuppertal \"Schöner Wohnen\" UG (haftungsbeschränkt) & Co. KG\nKommanditgesellschaft\nKamen\n\nDas Registergericht beabsichtigt die Firma von Amts wegen nach § 394 FamFG zu löschen. Die Frist zur Erhebung eines Widerspruchs ist auf einen Monat festgesetzt."
    },
    {
      "date": "2024-12-23",
      "id": "97302",
      "original_text": "Registerbekanntmachung nach dem Umwandlungsgesetz\nNordrhein-Westfalen Amtsgericht Köln HRB 21783\nAstenJohnson (Deutschland) GmbH – Köln",
      "type": "Registerbekanntmachung nach dem Umwandlungsgesetz",
      "state": "Nordrhein-Westfalen",
      "amtsgericht": "Amtsgericht Köln",
      "registernummer": "HRB 21783",
      "registerart": "HRB",
      "company_name": "AstenJohnson (Deutschland) GmbH",
      "company_seat": "Köln",
      "details": "23.12.2024 (Bekanntmachungsdatum)\n\nNordrhein-Westfalen Amtsgericht Köln HRB 21783\nRegisterbekanntmachung nach dem Umwandlungsgesetz\n\nAstenJohnson (Deutschland) GmbH\nGesellschaft mit beschränkter Haftung\nKöln\n\nDem Registergericht ist der Entwurf eines Verschmelzungsplanes über die nachfolgende geplante Verschmelzung eingereicht worden.\nHRB 21783\nASTENJOHNSON (DEUTSCHLAND) GMBH I. L.\n(Gesellschaft)\n\nI.\tAnlagen\nMit Blick auf die grenzüberschreitende Verschmelzung der Gesellschaft wird als Anlage überreicht:\nDer Entwurf des gemeinsamen Verschmelzungsplans betreffend die grenzüberschreitende Verschmelzung der Gesellschaft als übertragenden Rechtsträger auf die AstenJohnson (Luxembourg) LLC, S.à.r.l. mit Sitz in Luxemburg, Großherzogtum Luxemburg, als übernehmenden Rechtsträger. Die Verschmelzung erfolgt unter Anwendung der §§ 305 ff. UmwG sowie der anwendbaren luxemburgischen Rechtsvorschriften.\n\nII.\tBekanntmachungen\nEs wird um Bekanntmachung der in § 308 Abs. 1 Satz 2 UmwG vorgesehenen Angaben gebeten und hierzu gemäß § 308 Abs. 1 Satz 3 UmwG mitgeteilt:\n\n1.\t§ 308 Abs. 1 Satz 2 Nr. 1 UmwG\nDie Gesellschaft hat den Entwurf des gemeinsamen Verschmelzungsplans beim Handelsregister des Amtsgerichts Köln eingereicht.\n\n2.\t§ 308 Abs. 1 Satz 2 Nr. 2 und Nr. 3 UmwG\nAn der grenzüberschreitenden Verschmelzung sind folgende Gesellschaften beteiligt, die in den unten genannten Registern eingetragen sind:\na.\tÜbertragende Gesellschaft ist die AstenJohnson (Deutschland) GmbH i. L., eine nach deutschem Recht gegründete Gesellschaft mit beschränkter Haftung mit Sitz in Köln, Deutschland, und Geschäftsanschrift c/o Price Waterhouse Coopers AG Wirtschaftsprüfungsgesellschaft, Konrad-Adenauer-Ufer 11, 50668 Köln, Deutschland, eingetragen im Handelsregister des Amtsgerichts Köln unter HRB 21783.\na.\tÜbernehmende Gesellschaft ist die AstenJohnson (Luxembourg) LLC, S.à.r.l., eine nach luxemburgischem Recht gegründete Gesellschaft mit beschränkter Haftung (société à responsabilité limitée) mit Sitz in 29, Avenue de la Porte-Neuve, L-2227 Luxemburg, Großherzogtum Luxemburg, eingetragen im Handels- und Gesellschaftsregister von Luxemburg (Registre de Commerce et des Sociétés, Luxembourg) unter der Nummer B150163.\n3.\t§ 308 Abs. 1 Satz 2 Nr. 4 UmwG\nDie Verschmelzung bedarf nach § 312 Abs. 2 i.V.m. § 307 Abs. 3 Nr. 1 UmwG nicht der Zustimmung der Gesellschafterversammlung der Gesellschaft. Stattdessen trifft die alleinige Anteilsinhaberin der Gesellschaft grundsätzlich die Entscheidung über den Abschluss des Verschmelzungsplans mit der Beurkundung des Verschmelzungsplans, die aktuell für den Tag geplant ist, der auf den Ablauf von einem Monat nach dem Tag der Registerbekanntmachung des Entwurfs des Verschmelzungsplans folgt, oder ggfs. den nächsten Arbeitstag (wobei Samstage, Sonntage und bundesweite Feiertage nicht als Arbeitstage zählen). Zusätzlich beabsichtigt die alleinige Anteilsinhaberin der Gesellschaft höchstvorsorglich, am Tag der Beurkundung des Verschmelzungsplans über die Zustimmung zu dem Verschmelzungsplan zu beschließen. Auch die alleinige Anteilsinhaberin der AstenJohnson (Luxembourg) LLC, S.à.r.l. beabsichtigt  höchstvorsorglich, an dem Tag der Beurkundung des Verschmelzungsplans einen zustimmenden Beschluss zu fassen.\nDementsprechend können die folgenden Personen der jeweiligen Gesellschaft spätestens fünf Arbeitstage vor dem Tag der Beurkundung des Verschmelzungsplans und der zustimmenden Beschlüsse Bemerkungen zum Verschmelzungsplan übermitteln:\na.\tdie Anteilsinhaber und die Gläubiger der an der grenzüberschreitenden Verschmelzung beteiligten Gesellschaften.\n\nb.\tDie an der grenzüberschreitenden Verschmelzung beteiligten Gesellschaften verfügen beide weder über Arbeitnehmer noch über einen Betriebsrat. Der guten Ordnung halber erfolgt gleichwohl der Hinweis, dass auch die zuständigen Betriebsräte der Gesellschaften oder, soweit es keinen Betriebsrat gibt, die Arbeitnehmer der Gesellschaften, Bemerkungen zum Verschmelzungsplan übermitteln können.\nEntsprechende Bemerkungen können an die eingetragene Geschäftsanschrift der Gesellschaft gerichtet werden. Sämtliche eingehenden Bemerkungen werden der alleinigen Anteilsinhaberin der Gesellschaft zur Kenntnis gebracht. Sollte der geplante Termin der Beurkundung des Verschmelzungsplans und der zustimmenden Beschlüsse aufgrund von Verzögerungen nicht möglich sein, wird der Termin so bald wie praktisch möglich danach, jedenfalls aber unter Einhaltung der Monatsfrist gemäß § 308 Abs. 2 UmwG seit der Einreichung des Entwurfs des Verschmelzungsplans beim Registergericht stattfinden."
    },
    {
      "date": "2024-12-23",
      "id": "97303",
      "original_text": "Registerbekanntmachung nach dem Umwandlungsgesetz\nNordrhein-Westfalen Amtsgericht Köln HRB 26728\nSDK Systemdruck GmbH – Köln",
      "type": "Registerbekanntmachung nach dem Umwandlungsgesetz",
      "state": "Nordrhein-Westfalen",
      "amtsgericht": "Amtsgericht Köln",
      "registernummer": "HRB 26728",
      "registerart": "HRB",
      "company_name": "SDK Systemdruck GmbH",
      "company_seat": "Köln",
      "details": "23.12.2024 (Bekanntmachungsdatum)\n\nNordrhein-Westfalen Amtsgericht Köln HRB 26728\nRegisterbekanntmachung nach dem Umwandlungsgesetz 23.12.2024 (Eintragungsdatum)\n\nSDK Systemdruck GmbH\nGesellschaft mit beschränkter Haftung\nKöln\n\nDen Gläubigern der an der Verschmelzung beteiligten Rechtsträger ist, wenn sie binnen sechs Monaten nach dem Tag, an dem die Eintragung der Verschmelzung in das Register des Sitzes desjenigen Rechtsträgers, dessen Gläubiger sie sind, nach § 19 Absatz 3 UmwG als bekanntgemacht gilt, ihren Anspruch nach Grund und Höhe schriftlich anmelden, Sicherheit zu leisten, soweit sie nicht Befriedigung verlangen können. Dieses Recht steht den Gläubigern jedoch nur zu, wenn sie glaubhaft machen, dass durch die Verschmelzung die Erfüllung ihrer Forderung gefährdet wird."
    },
    {
      "date": "2024-12-23",
      "id": "97304",
      "original_text": "Einreichung neuer Dokumente\nNordrhein-Westfalen Amtsgericht Düren HRB 7208\nSIG Euro Holding GmbH – Linnich",
      "type": "Einreichung neuer Dokumente",
      "state": "Nordrhein-Westfalen",
      "amtsgericht": "Amtsgericht Düren",
      "registernummer": "HRB 7208",
      "registerart": "HRB",
      "company_name": "SIG Euro Holding GmbH",
      "company_seat": "Linnich",
      "details": "23.12.2024 (Bekanntmachungsdatum)\n\nNordrhein-Westfalen Amtsgericht Düren HRB 7208\nEinreichung neuer Dokumente 23.12.2024 (Eintragungsdatum)\n\nSIG Euro Holding GmbH\nGesellschaft mit beschränkter Haftung\nLinnich"
    },
    {
      "date": "2024-12-23",
      "id": "97305",
      "original_text": "Löschungsankündigung\nNordrhein-Westfalen Amtsgericht Dortmund HRB 30939\nBoss Kranservice GmbH – Dortmund",
      "type": "Löschungsankündigung",
      "state": "Nordrhein-Westfalen",
      "amtsgericht": "Amtsgericht Dortmund",
      "registernummer": "HRB 30939",
      "registerart": "HRB",
      "company_name": "Boss Kranservice GmbH",
      "company_seat": "Dortmund",
      "details": "23.12.2024 (Bekanntmachungsdatum)\n\nNordrhein-Westfalen Amtsgericht Dortmund HRB 30939\nLöschungsankündigung\n\nBoss Kranservice GmbH\nGesellschaft mit beschränkter Haftung\nDortmund\n\nDas Registergericht beabsichtigt die Gesellschaft von Amts wegen nach § 394 FamFG zu löschen. Die Frist zur Erhebung eines Widerspruchs ist auf #DV.Fr(Text=\"Bitte wählen Sie die Widerspruchsfrist aus!\",Eingabe=\"einen Monat\",\"zwei Monate\",\"drei Monate\",\"#insert(Text=\"Freitext\")\"|\"freier Text\") festgesetzt."
    },
    {
      "date": "2024-12-23",
      "id": "97306",
      "original_text": "Registerbekanntmachung nach dem Umwandlungsgesetz\nNordrhein-Westfalen Amtsgericht Köln HRA 37355\nVanessa Reinhard - Ästhetik & Kosmetik e.K. – Hürth",
      "type": "Registerbekanntmachung nach dem Umwandlungsgesetz",
      "state": "Nordrhein-Westfalen",
      "amtsgericht": "Amtsgericht Köln",
      "registernummer": "HRA 37355",
      "registerart": "HRA",
      "company_name": "Vanessa Reinhard - Ästhetik & Kosmetik e.K.",
      "company_seat": "Hürth",
      "details": "23.12.2024 (Bekanntmachungsdatum)\n\nNordrhein-Westfalen Amtsgericht Köln HRA 37355\nRegisterbekanntmachung nach dem Umwandlungsgesetz 23.12.2024 (Eintragungsdatum)\n\nVanessa Reinhard - Ästhetik & Kosmetik e.K.\nEinzelkaufmann / Einzelkauffrau\nHürth\n\nDen Gläubigern der an der Ausgliederung beteiligten Rechtsträger ist, wenn sie binnen sechs Monaten nach dem Tag, an dem die Eintragung der Ausgliederung in das Register des Sitzes derjenigen Rechtsträger deren Gläubiger sie sind, nach § 19 Absatz 3 UmwG als bekanntgemacht gilt, ihren Anspruch nach Grund und Höhe schriftlich anmelden, Sicherheit zu leisten, soweit sie nicht Befriedigung verlangen können. Dieses Recht steht den Gläubigern jedoch nur zu, wenn sie glaubhaft machen, dass durch die Ausgliederung die Erfüllung ihrer Forderung gefährdet wird."
    },
    {
      "date": "2024-12-23",
      "id": "97307",
      "original_text": "Löschungsankündigung\nNordrhein-Westfalen Amtsgericht Düsseldorf HRA 14516\nKaufring Werbeagentur GmbH & Co. Kommanditgesellschaft – Düsseldorf",
      "type": "Löschungsankündigung",
      "state": "Nordrhein-Westfalen",
      "amtsgericht": "Amtsgericht Düsseldorf",
      "registernummer": "HRA 14516",
      "registerart": "HRA",
      "company_name": "Kaufring Werbeagentur GmbH & Co. Kommanditgesellschaft",
      "company_seat": "Düsseldorf",
      "details": "23.12.2024 (Bekanntmachungsdatum)\n\nNordrhein-Westfalen Amtsgericht Düsseldorf HRA 14516\nLöschungsankündigung\n\nKaufring Werbeagentur GmbH & Co. Kommanditgesellschaft\nKommanditgesellschaft\nDüsseldorf\n\nDas Registergericht beabsichtigt die Firma von Amts wegen nach § 394 FamFG zu löschen, da das Insolvenzverfahren durchgeführt wurde, offenbar keine Vermögenswerte mehr vorhanden sind und auch die persönlich haftende Gesellschafterin bereits wegen Vermögenlosigkeit gelöscht worden ist. Die Frist zur Erhebung eines Widerspruchs ist auf einen Monat festgesetzt.\n\nRechtsbehelfsbelehrung:\nDas Widerspruchsrecht steht jedem zu, der an der Unterlassung der Löschung ein berechtigtes Interesse hat. Der Widerspruch ist bei dem Amtsgericht Düsseldorf -Registergericht-, Werdener Straße 1, 40227 Düsseldorf schriftlich in deutscher Sprache oder zur Niederschrift der Geschäftsstelle einzulegen. Der Widerspruch kann auch zur Niederschrift der Geschäftsstelle eines jeden Amtsgerichtes abgegeben werden. Die Einlegung ist auch durch Übertragung eines elektronischen Dokuments an die elektronische Poststelle des Gerichts möglich. Das elektronische Dokument muss für die Bearbeitung durch das Gericht geeignet und mit einer qualifizierten elektronischen Signatur der verantwortenden Person versehen sein oder von der verantwortenden Person signiert und auf einem sicheren Übermittlungsweg gemäß § 130a ZPO nach näherer Maßgabe der Verordnung über die technischen Rahmenbedingungen des elektronischen Rechtsverkehrs und über das besondere elektronische Behördenpostfach (BGBl. I, S.3803) eingereicht werden. Weitere Informationen erhalten Sie auf der Internetseite www.justiz.de.\nDer Widerspruch muss spätestens innerhalb der gesetzten Frist nach dem Datum der Bekanntmachung der Löschungsankündigung bei dem Amtsgericht - Registergericht - Düsseldorf eingegangen sein.  Dies gilt auch dann, wenn der Widerspruch zur Niederschrift der Geschäftsstelle eines anderen Amtsgerichtes abgegeben wurde. Die Frist beginnt mit dem Tage der Bekanntmachung der Löschungsankündigung in dem für die Bekanntmachung der Eintragungen in das Handelsregister bestimmten elektronischen Informations- und Kommunikationssystem nach § 10 des Handelsgesetzbuches. Fällt das Ende der Frist auf einen Sonntag, einen allgemeinen Feiertag oder Sonnabend, so endet die Frist mit Ablauf des nächsten Werktages.\nDer Widerspruch muss die Bezeichnung der angefochtenen Löschungsankündigung sowie die Erklärung enthalten, dass Widerspruch gegen diese Löschungsankündigung eingelegt wird. Er ist zu unterzeichnen und soll begründet werden."
    },
    {
      "date": "2024-12-23",
      "id": "97308",
      "original_text": "Registerbekanntmachung nach dem Umwandlungsgesetz\nHessen Amtsgericht Offenbach am Main HRA 43274\nScheibner Baudienstleistungen GmbH & Co. KG – Dietzenbach",
      "type": "Registerbekanntmachung nach dem Umwandlungsgesetz",
      "state": "Hessen",
      "amtsgericht": "Amtsgericht Offenbach am Main",
      "registernummer": "HRA 43274",
      "registerart": "HRA",
      "company_name": "Scheibner Baudienstleistungen GmbH & Co. KG",
      "company_seat": "Dietzenbach",
      "details": "23.12.2024 (Bekanntmachungsdatum)\n\nHessen Amtsgericht Offenbach am Main HRA 43274\nRegisterbekanntmachung nach dem Umwandlungsgesetz 23.12.2024 (Eintragungsdatum)\n\nScheibner Baudienstleistungen GmbH & Co. KG\nKommanditgesellschaft\nDietzenbach\n\nDen Gläubigern der an der Ausgliederung beteiligten Rechtsträger ist, wenn sie binnen sechs Monaten nach dem Tag, an dem die Eintragung der Ausgliederung in das Register des Sitzes desjenigen Rechtsträgers, dessen Gläubiger sie sind, nach §§ 125, 19 Absatz 3 UmwG bekannt gemacht worden ist, ihren Anspruch nach Grund und Höhe schriftlich anmelden, Sicherheit zu leisten, soweit sie nicht Befriedigung verlangen können. Dieses Recht steht den Gläubigern jedoch nur zu, wenn sie glaubhaft machen, dass durch die Ausgliederung die Erfüllung ihrer Forderung gefährdet wird."
    },
    {
      "date": "2024-12-23",
      "id": "97309",
      "original_text": "Einreichung neuer Dokumente\nHessen Amtsgericht Kassel HRB 16253\nEAM Verwaltungs-GmbH – Kassel",
      "type": "Einreichung neuer Dokumente",
      "state": "Hessen",
      "amtsgericht": "Amtsgericht Kassel",
      "registernummer": "HRB 16253",
      "registerart": "HRB",
      "company_name": "EAM Verwaltungs-GmbH",
      "company_seat": "Kassel",
      "details": "23.12.2024 (Bekanntmachungsdatum)\n\nHessen Amtsgericht Kassel HRB 16253\nEinreichung neuer Dokumente\n\nEAM Verwaltungs-GmbH\nGesellschaft mit beschränkter Haftung\nKassel\n\nDurch eine Änderung in den Personen der Aufsichtsratsmitglieder ist eine Liste der Mitglieder des Aufsichtsrates zum Handelsregister eingereicht worden."
    },
    {
      "date": "2024-12-23",
      "id": "97310",
      "original_text": "Registerbekanntmachung nach dem Umwandlungsgesetz\nHessen Amtsgericht Darmstadt HRB 85403\nDietz Holding GmbH – Bensheim",
      "type": "Registerbekanntmachung nach dem Umwandlungsgesetz",
      "state": "Hessen",
      "amtsgericht": "Amtsgericht Darmstadt",
      "registernummer": "HRB 85403",
      "registerart": "HRB",
      "company_name": "Dietz Holding GmbH",
      "company_seat": "Bensheim",
      "details": "23.12.2024 (Bekanntmachungsdatum)\n\nHessen Amtsgericht Darmstadt HRB 85403\nRegisterbekanntmachung nach dem Umwandlungsgesetz 23.12.2024 (Eintragungsdatum)\n\nDietz Holding GmbH\nGesellschaft mit beschränkter Haftung\nBensheim\n\nDen Gläubigern der an der Verschmelzung beteiligten Rechtsträger ist, wenn sie binnen sechs Monaten nach dem Tag, an dem die Eintragung der Verschmelzung in das Register des Sitzes derjenigen Rechtsträger deren Gläubiger sie sind, nach § 19 Absatz 3 UmwG bekannt gemacht worden ist, ihren Anspruch nach Grund und Höhe schriftlich anmelden, Sicherheit zu leisten, soweit sie nicht Befriedigung verlangen können. Dieses Recht steht den Gläubigern jedoch nur zu, wenn sie glaubhaft machen, dass durch die Verschmelzung die Erfüllung ihrer Forderung gefährdet wird."
    },
    {
      "date": "2024-12-23",
      "id": "97311",
      "original_text": "Registerbekanntmachung nach dem Umwandlungsgesetz\nHessen Amtsgericht Offenbach am Main HRA 43455\nScheibner Baudienstleistungen e.K., Inh. Peer Scheibner – Dietzenbach",
      "type": "Registerbekanntmachung nach dem Umwandlungsgesetz",
      "state": "Hessen",
      "amtsgericht": "Amtsgericht Offenbach am Main",
      "registernummer": "HRA 43455",
      "registerart": "HRA",
      "company_name": "Scheibner Baudienstleistungen e.K., Inh. Peer Scheibner",
      "company_seat": "Dietzenbach",
      "details": "23.12.2024 (Bekanntmachungsdatum)\n\nHessen Amtsgericht Offenbach am Main HRA 43455\nRegisterbekanntmachung nach dem Umwandlungsgesetz 23.12.2024 (Eintragungsdatum)\n\nScheibner Baudienstleistungen e.K., Inh. Peer Scheibner\nEinzelkaufmann / Einzelkauffrau\nDietzenbach\n\nDas Registergericht beabsichtigt die im Handelsregister eingetragene Firma von Amts wegen nach § 31 Abs. 2 HGB zu löschen. Die Frist zur Erhebung eines Widerspruchs gegen die beabsichtigte Löschung wird auf 3 Monate festgesetzt.\nDen Gläubigern der an der Ausgliederung beteiligten Rechtsträger ist, wenn sie binnen sechs Monaten nach dem Tag, an dem die Eintragung der Ausgliederung in das Register des Sitzes desjenigen Rechtsträgers, dessen Gläubiger sie sind, nach §§ 125, 19 Absatz 3 UmwG bekannt gemacht worden ist, ihren Anspruch nach Grund und Höhe schriftlich anmelden, Sicherheit zu leisten, soweit sie nicht Befriedigung verlangen können. Dieses Recht steht den Gläubigern jedoch nur zu, wenn sie glaubhaft machen, dass durch die Ausgliederung die Erfüllung ihrer Forderung gefährdet wird."
    },
    {
      "date": "2024-12-23",
      "id": "97312",
      "original_text": "Registerbekanntmachung nach dem Umwandlungsgesetz\nHessen Amtsgericht Hanau HRB 99816\nROTTLER Hanau GmbH – Hanau",
      "type": "Registerbekanntmachung nach dem Umwandlungsgesetz",
      "state": "Hessen",
      "amtsgericht": "Amtsgericht Hanau",
      "registernummer": "HRB 99816",
      "registerart": "HRB",
      "company_name": "ROTTLER Hanau GmbH",
      "company_seat": "Hanau",
      "details": "23.12.2024 (Bekanntmachungsdatum)\n\nHessen Amtsgericht Hanau HRB 99816\nRegisterbekanntmachung nach dem Umwandlungsgesetz 23.12.2024 (Eintragungsdatum)\n\nROTTLER Hanau GmbH\nGesellschaft mit beschränkter Haftung\nHanau\n\nDen Gläubigern der an der Verschmelzung beteiligten Rechtsträger ist, wenn sie binnen sechs Monaten nach dem Tag, an dem die Eintragung der Verschmelzung in das Register des Sitzes desjenigen Rechtsträgers, dessen Gläubiger sie sind, nach § 19 Absatz 3 UmwG bekannt gemacht worden ist, ihren Anspruch nach Grund und Höhe schriftlich anmelden, Sicherheit zu leisten, soweit sie nicht Befriedigung verlangen können. Dieses Recht steht den Gläubigern jedoch nur zu, wenn sie glaubhaft machen, dass durch die Verschmelzung die Erfüllung ihrer Forderung gefährdet wird."
    },
    {
      "date": "2024-12-23",
      "id": "97313",
      "original_text": "Löschungsankündigung\nHessen Amtsgericht Wiesbaden HRB 25397\nbodycur gmbh – Wiesbaden",
      "type": "Löschungsankündigung",
      "state": "Hessen",
      "amtsgericht": "Amtsgericht Wiesbaden",
      "registernummer": "HRB 25397",
      "registerart": "HRB",
      "company_name": "bodycur gmbh",
      "company_seat": "Wiesbaden",
      "details": "23.12.2024 (Bekanntmachungsdatum)\n\nHessen Amtsgericht Wiesbaden HRB 25397\nLöschungsankündigung\n\nbodycur gmbh\nGesellschaft mit beschränkter Haftung\nWiesbaden\n\nDas Registergericht beabsichtigt die im Handelsregister eingetragene Gesellschaft von Amts wegen nach § 394 FamFG zu löschen. Die Frist zur Erhebung eines Widerspruchs gegen die beabsichtigte Löschung wird auf 3 Monate festgesetzt."
    },
    {
      "date": "2024-12-23",
      "id": "97314",
      "original_text": "Registerbekanntmachung nach dem Umwandlungsgesetz\nHessen Amtsgericht Darmstadt VR 853\nDeutsches Rotes Kreuz Kreisverband Darmstadt-Land e.V. – Seeheim-Jugenheim",
      "type": "Registerbekanntmachung nach dem Umwandlungsgesetz",
      "state": "Hessen",
      "amtsgericht": "Amtsgericht Darmstadt",
      "registernummer": "VR 853",
      "registerart": "VR",
      "company_name": "Deutsches Rotes Kreuz Kreisverband Darmstadt-Land e.V.",
      "company_seat": "Seeheim-Jugenheim",
      "details": "23.12.2024 (Bekanntmachungsdatum)\n\nHessen Amtsgericht Darmstadt VR 853\nRegisterbekanntmachung nach dem Umwandlungsgesetz 23.12.2024 (Eintragungsdatum)\n\nDeutsches Rotes Kreuz Kreisverband Darmstadt-Land e.V.\neingetragener Verein\nSeeheim-Jugenheim\n\nDen Gläubigern der an der Ausgliederung beteiligten Rechtsträger ist, wenn sie binnen sechs Monaten nach dem Tag, an dem die Eintragung der Ausgliederung in das Register des Sitzes derjenigen Rechtsträger deren Gläubiger sie sind, nach §§ 125, 19 Absatz 3 UmwG bekannt gemacht worden ist, ihren Anspruch nach Grund und Höhe schriftlich anmelden, Sicherheit zu leisten, soweit sie nicht Befriedigung verlangen können. Dieses Recht steht den Gläubigern jedoch nur zu, wenn sie glaubhaft machen, dass durch die Ausgliederung die Erfüllung ihrer Forderung gefährdet wird."
    },
    {
      "date": "2024-12-23",
      "id": "97315",
      "original_text": "Löschungsankündigung\nHessen Amtsgericht Wiesbaden HRB 30356\nSevenwins GmbH – Wiesbaden",
      "type": "Löschungsankündigung",
      "state": "Hessen",
      "amtsgericht": "Amtsgericht Wiesbaden",
      "registernummer": "HRB 30356",
      "registerart": "HRB",
      "company_name": "Sevenwins GmbH",
      "company_seat": "Wiesbaden",
      "details": "23.12.2024 (Bekanntmachungsdatum)\n\nHessen Amtsgericht Wiesbaden HRB 30356\nLöschungsankündigung\n\nSevenwins GmbH\nGesellschaft mit beschränkter Haftung\nWiesbaden\n\nDas Registergericht beabsichtigt die im Handelsregister eingetragene Gesellschaft von Amts wegen nach § 394 FamFG zu löschen. Die Frist zur Erhebung eines Widerspruchs gegen die beabsichtigte Löschung wird auf 3 Monate festgesetzt."
    },
    {
      "date": "2024-12-23",
      "id": "97316",
      "original_text": "Einreichung neuer Dokumente\nHessen Amtsgericht Kassel HRB 14608\nEAM Netz GmbH – Kassel",
      "type": "Einreichung neuer Dokumente",
      "state": "Hessen",
      "amtsgericht": "Amtsgericht Kassel",
      "registernummer": "HRB 14608",
      "registerart": "HRB",
      "company_name": "EAM Netz GmbH",
      "company_seat": "Kassel",
      "details": "23.12.2024 (Bekanntmachungsdatum)\n\nHessen Amtsgericht Kassel HRB 14608\nEinreichung neuer Dokumente 23.12.2024 (Eintragungsdatum)\n\nEAM Netz GmbH\nGesellschaft mit beschränkter Haftung\nKassel\n\nDurch eine Änderung in den Personen der Aufsichtsratsmitglieder ist eine Liste der Mitglieder des Aufsichtsrates zum Handelsregister eingereicht worden."
    },
    {
      "date": "2024-12-23",
      "id": "97317",
      "original_text": "Sonstige Registerbekanntmachung\nHessen Amtsgericht Eschwege VR 1309\nSportverein (SV) Hörne 01 – Bad Sooden-Allendorf",
      "type": "Sonstige Registerbekanntmachung",
      "state": "Hessen",
      "amtsgericht": "Amtsgericht Eschwege",
      "registernummer": "VR 1309",
      "registerart": "VR",
      "company_name": "Sportverein (SV) Hörne 01",
      "company_seat": "Bad Sooden-Allendorf",
      "details": "23.12.2024 (Bekanntmachungsdatum)\n\nHessen Amtsgericht Eschwege VR 1309\nSonstige Registerbekanntmachung 23.12.2024 (Eintragungsdatum)\n\nSportverein (SV) Hörne 01\neingetragener Verein\nBad Sooden-Allendorf\n\nDer Verein ist aufgelöst."
    },
    {
      "date": "2024-12-23",
      "id": "97318",
      "original_text": "Einreichung neuer Dokumente\nHessen Amtsgericht Wiesbaden HRB 28636\nAthora Deutschland GmbH – Wiesbaden",
      "type": "Einreichung neuer Dokumente",
      "state": "Hessen",
      "amtsgericht": "Amtsgericht Wiesbaden",
      "registernummer": "HRB 28636",
      "registerart": "HRB",
      "company_name": "Athora Deutschland GmbH",
      "company_seat": "Wiesbaden",
      "details": "23.12.2024 (Bekanntmachungsdatum)\n\nHessen Amtsgericht Wiesbaden HRB 28636\nEinreichung neuer Dokumente 23.12.2024 (Eintragungsdatum)\n\nAthora Deutschland GmbH\nGesellschaft mit beschränkter Haftung\nWiesbaden\n\nDurch eine Änderung in den Personen der Aufsichtsratsmitglieder ist eine Liste der Mitglieder des Aufsichtsrates zum Handelsregister eingereicht worden."
    },
    {
      "date": "2024-12-23",
      "id": "97319",
      "original_text": "Löschungsankündigung\nHessen Amtsgericht Frankfurt am Main HRB 99072\nPST PROZESSSTEUERUNG TECHNOLOGIE GMBH – Frankfurt am Main",
      "type": "Löschungsankündigung",
      "state": "Hessen",
      "amtsgericht": "Amtsgericht Frankfurt am Main",
      "registernummer": "HRB 99072",
      "registerart": "HRB",
      "company_name": "PST PROZESSSTEUERUNG TECHNOLOGIE GMBH",
      "company_seat": "Frankfurt am Main",
      "details": "23.12.2024 (Bekanntmachungsdatum)\n\nHessen Amtsgericht Frankfurt am Main HRB 99072\nLöschungsankündigung 22.12.2024 (Eintragungsdatum)\n\nPST PROZESSSTEUERUNG TECHNOLOGIE GMBH\nGesellschaft mit beschränkter Haftung\nFrankfurt am Main\n\nEs ist beabsichtigt, die Gesellschaft wegen Vermögenslosigkeit gemäß § 394 FamFG von Amts wegen im Handelsregister zu löschen.\n\nHiergegen kann innerhalb eines Monats nach Veröffentlichung Widerspruch bei dem Amtsgericht Frankfurt am Main eingelegt werden."
    },
    {
      "date": "2024-12-23",
      "id": "97320",
      "original_text": "Registerbekanntmachung nach dem Umwandlungsgesetz\nHessen Amtsgericht Darmstadt HRB 101537\nDeutsches Rotes Kreuz Soziale Dienste Darmstadt-Dieburg gGmbH – Seeheim-Jugenheim",
      "type": "Registerbekanntmachung nach dem Umwandlungsgesetz",
      "state": "Hessen",
      "amtsgericht": "Amtsgericht Darmstadt",
      "registernummer": "HRB 101537",
      "registerart": "HRB",
      "company_name": "Deutsches Rotes Kreuz Soziale Dienste Darmstadt-Dieburg gGmbH",
      "company_seat": "Seeheim-Jugenheim",
      "details": "23.12.2024 (Bekanntmachungsdatum)\n\nHessen Amtsgericht Darmstadt HRB 101537\nRegisterbekanntmachung nach dem Umwandlungsgesetz 23.12.2024 (Eintragungsdatum)\n\nDeutsches Rotes Kreuz Soziale Dienste Darmstadt-Dieburg gGmbH\nGesellschaft mit beschränkter Haftung\nSeeheim-Jugenheim\n\nDen Gläubigern der an der Ausgliederung beteiligten Rechtsträger ist, wenn sie binnen sechs Monaten nach dem Tag, an dem die Eintragung der Ausgliederung in das Register des Sitzes derjenigen Rechtsträger deren Gläubiger sie sind, nach §§ 125, 19 Absatz 3 UmwG bekannt gemacht worden ist, ihren Anspruch nach Grund und Höhe schriftlich anmelden, Sicherheit zu leisten, soweit sie nicht Befriedigung verlangen können. Dieses Recht steht den Gläubigern jedoch nur zu, wenn sie glaubhaft machen, dass durch die Ausgliederung die Erfüllung ihrer Forderung gefährdet wird."
    },
    {
      "date": "2024-12-23",
      "id": "97321",
      "original_text": "Einreichung neuer Dokumente\nHessen Amtsgericht Kassel HRB 2154\ndocumenta und Museum Fridericianum gemeinnützige Gesellschaft mit beschränkter Haftung – Kassel",
      "type": "Einreichung neuer Dokumente",
      "state": "Hessen",
      "amtsgericht": "Amtsgericht Kassel",
      "registernummer": "HRB 2154",
      "registerart": "HRB",
      "company_name": "documenta und Museum Fridericianum gemeinnützige Gesellschaft mit beschränkter Haftung",
      "company_seat": "Kassel",
      "details": "23.12.2024 (Bekanntmachungsdatum)\n\nHessen Amtsgericht Kassel HRB 2154\nEinreichung neuer Dokumente\n\ndocumenta und Museum Fridericianum gemeinnützige Gesellschaft mit beschränkter Haftung\nGesellschaft mit beschränkter Haftung\nKassel\n\nDurch eine Änderung in den Personen der Aufsichtsratsmitglieder ist eine Liste der Mitglieder des Aufsichtsrates zum Handelsregister eingereicht worden."
    },
    {
      "date": "2024-12-23",
      "id": "97322",
      "original_text": "Sonstige Registerbekanntmachung\nHessen Amtsgericht Wiesbaden VR 5437\nAktionsgruppe Eine Welt – Geisenheim",
      "type": "Sonstige Registerbekanntmachung",
      "state": "Hessen",
      "amtsgericht": "Amtsgericht Wiesbaden",
      "registernummer": "VR 5437",
      "registerart": "VR",
      "company_name": "Aktionsgruppe Eine Welt",
      "company_seat": "Geisenheim",
      "details": "23.12.2024 (Bekanntmachungsdatum)\n\nHessen Amtsgericht Wiesbaden VR 5437\nSonstige Registerbekanntmachung 23.12.2024 (Eintragungsdatum)\n\nAktionsgruppe Eine Welt\neingetragener Verein\nGeisenheim\n\nDer Verein ist aufgelöst."
    },
    {
      "date": "2024-12-23",
      "id": "97323",
      "original_text": "Registerbekanntmachung nach dem Umwandlungsgesetz\nHessen Amtsgericht Darmstadt HRB 94675\nDInvest GmbH – Bensheim",
      "type": "Registerbekanntmachung nach dem Umwandlungsgesetz",
      "state": "Hessen",
      "amtsgericht": "Amtsgericht Darmstadt",
      "registernummer": "HRB 94675",
      "registerart": "HRB",
      "company_name": "DInvest GmbH",
      "company_seat": "Bensheim",
      "details": "23.12.2024 (Bekanntmachungsdatum)\n\nHessen Amtsgericht Darmstadt HRB 94675\nRegisterbekanntmachung nach dem Umwandlungsgesetz 23.12.2024 (Eintragungsdatum)\n\nDInvest GmbH\nGesellschaft mit beschränkter Haftung\nBensheim\n\nDen Gläubigern der an der Verschmelzung beteiligten Rechtsträger ist, wenn sie binnen sechs Monaten nach dem Tag, an dem die Eintragung der Verschmelzung in das Register des Sitzes desjenigen Rechtsträgers, dessen Gläubiger sie sind, nach § 19 Absatz 3 UmwG bekannt gemacht worden ist, ihren Anspruch nach Grund und Höhe schriftlich anmelden, Sicherheit zu leisten, soweit sie nicht Befriedigung verlangen können. Dieses Recht steht den Gläubigern jedoch nur zu, wenn sie glaubhaft machen, dass durch die Verschmelzung die Erfüllung ihrer Forderung gefährdet wird."
    },
    {
      "date": "2024-12-23",
      "id": "97324",
      "original_text": "Einreichung neuer Dokumente\nBaden-Württemberg Amtsgericht Stuttgart HRB 440006\nBaugesellschaft Horb Gesellschaft mit beschränkter Haftung – Horb am Neckar",
      "type": "Einreichung neuer Dokumente",
      "state": "Baden-Württemberg",
      "amtsgericht": "Amtsgericht Stuttgart",
      "registernummer": "HRB 440006",
      "registerart": "HRB",
      "company_name": "Baugesellschaft Horb Gesellschaft mit beschränkter Haftung",
      "company_seat": "Horb am Neckar",
      "details": "23.12.2024 (Bekanntmachungsdatum)\n\nBaden-Württemberg Amtsgericht Stuttgart HRB 440006\nEinreichung neuer Dokumente\n\nBaugesellschaft Horb Gesellschaft mit beschränkter Haftung\nGesellschaft mit beschränkter Haftung\nHorb am Neckar\n\nDie Gesellschaft hat am 17.12.2024 die Liste über die Zusammensetzung des Aufsichtsrats zum Handelsregister eingereicht."
    }
  ]
}