{
  "date": "2024-12-04",
  "date_of_scrape": "2024-12-05T04:08:08.132Z",
  "tool_version": "0.2.0",
  "number_of_announcements": 126,
  "announcements": [
    {
      "date": "2024-12-04",
      "id": "95318",
      "original_text": "Registerbekanntmachung nach dem Umwandlungsgesetz\nBayern Amtsgericht Nürnberg HRB 12941\nCircana Group GmbH – Nürnberg",
      "type": "Registerbekanntmachung nach dem Umwandlungsgesetz",
      "state": "Bayern",
      "amtsgericht": "Amtsgericht Nürnberg",
      "registernummer": "HRB 12941",
      "registerart": "HRB",
      "company_name": "Circana Group GmbH",
      "company_seat": "Nürnberg",
      "details": "04.12.2024 (Bekanntmachungsdatum)\n\nBayern Amtsgericht Nürnberg HRB 12941\nRegisterbekanntmachung nach dem Umwandlungsgesetz 03.12.2024 (Eintragungsdatum)\n\nCircana Group GmbH\nGesellschaft mit beschränkter Haftung\nNürnberg\n\nDen Gläubigern der an der Verschmelzung beteiligten Rechtsträger ist, wenn sie binnen sechs Monaten nach dem Tag, an dem die Eintragung der Verschmelzung in das Register des Sitzes desjenigen Rechtsträgers, dessen Gläubiger sie sind, nach § 19 Abs. 3 UmwG als bekannt gemacht gilt, ihren Anspruch nach Grund und Höhe schriftlich anmelden, Sicherheit zu leisten, soweit sie nicht Befriedigung verlangen können. Dieses Recht steht den Gläubigern jedoch nur zu, wenn sie glaubhaft machen, dass durch die Verschmelzung die Erfüllung ihrer Forderung gefährdet wird."
    },
    {
      "date": "2024-12-04",
      "id": "95319",
      "original_text": "Einreichung neuer Dokumente\nBayern Amtsgericht München HRB 162346\nDEMA Electronic AG – München",
      "type": "Einreichung neuer Dokumente",
      "state": "Bayern",
      "amtsgericht": "Amtsgericht München",
      "registernummer": "HRB 162346",
      "registerart": "HRB",
      "company_name": "DEMA Electronic AG",
      "company_seat": "München",
      "details": "04.12.2024 (Bekanntmachungsdatum)\n\nBayern Amtsgericht München HRB 162346\nEinreichung neuer Dokumente\n\nDEMA Electronic AG\nAktiengesellschaft\nMünchen\n\nDem Amtsgericht München -Registergericht- ist eine Liste der Mitglieder des Aufsichtsrats eingereicht worden, § 106 AktG."
    },
    {
      "date": "2024-12-04",
      "id": "95320",
      "original_text": "Registerbekanntmachung nach dem Umwandlungsgesetz\nBayern Amtsgericht Nürnberg HRB 36595\nalpha Lignum GmbH – Nürnberg",
      "type": "Registerbekanntmachung nach dem Umwandlungsgesetz",
      "state": "Bayern",
      "amtsgericht": "Amtsgericht Nürnberg",
      "registernummer": "HRB 36595",
      "registerart": "HRB",
      "company_name": "alpha Lignum GmbH",
      "company_seat": "Nürnberg",
      "details": "04.12.2024 (Bekanntmachungsdatum)\n\nBayern Amtsgericht Nürnberg HRB 36595\nRegisterbekanntmachung nach dem Umwandlungsgesetz 03.12.2024 (Eintragungsdatum)\n\nalpha Lignum GmbH\nGesellschaft mit beschränkter Haftung\nNürnberg\n\nDen Gläubigern der an der Verschmelzung beteiligten Rechtsträger ist, wenn sie binnen sechs Monaten nach dem Tag, an dem die Eintragung der Verschmelzung in das Register des Sitzes desjenigen Rechtsträgers, dessen Gläubiger sie sind, nach § 19 Abs. 3 UmwG als bekannt gemacht gilt, ihren Anspruch nach Grund und Höhe schriftlich anmelden, Sicherheit zu leisten, soweit sie nicht Befriedigung verlangen können. Dieses Recht steht den Gläubigern jedoch nur zu, wenn sie glaubhaft machen, dass durch die Verschmelzung die Erfüllung ihrer Forderung gefährdet wird."
    },
    {
      "date": "2024-12-04",
      "id": "95321",
      "original_text": "Löschungsankündigung\nBayern Amtsgericht München HRB 249352\nHelske Essen AG – München",
      "type": "Löschungsankündigung",
      "state": "Bayern",
      "amtsgericht": "Amtsgericht München",
      "registernummer": "HRB 249352",
      "registerart": "HRB",
      "company_name": "Helske Essen AG",
      "company_seat": "München",
      "details": "04.12.2024 (Bekanntmachungsdatum)\n\nBayern Amtsgericht München HRB 249352\nLöschungsankündigung 03.12.2024 (Eintragungsdatum)\n\nHelske Essen AG\nAktiengesellschaft\nMünchen\n\nDas Registergericht beabsichtigt, die im Handelsregister eingetragene Gesellschaft wegen Vermögenslosigkeit von Amts wegen nach § 394 FamFG zu löschen. Die Frist zur Erhebung eines Widerspruchs ist auf drei Monate festgesetzt."
    },
    {
      "date": "2024-12-04",
      "id": "95322",
      "original_text": "Einreichung neuer Dokumente\nBayern Amtsgericht Bayreuth HRB 2452\nPASS Stanztechnik AG – Creußen",
      "type": "Einreichung neuer Dokumente",
      "state": "Bayern",
      "amtsgericht": "Amtsgericht Bayreuth",
      "registernummer": "HRB 2452",
      "registerart": "HRB",
      "company_name": "PASS Stanztechnik AG",
      "company_seat": "Creußen",
      "details": "04.12.2024 (Bekanntmachungsdatum)\n\nBayern Amtsgericht Bayreuth HRB 2452\nEinreichung neuer Dokumente\n\nPASS Stanztechnik AG\nAktiengesellschaft\nCreußen\n\nDem Amtsgericht Bayreuth -Registergericht- ist eine Liste der Mitglieder des Aufsichtsrats eingereicht worden, § 106 AktG."
    },
    {
      "date": "2024-12-04",
      "id": "95323",
      "original_text": "Löschungsankündigung\nBayern Amtsgericht München HRB 254104\nEasy Shipping GmbH – Egenhofen",
      "type": "Löschungsankündigung",
      "state": "Bayern",
      "amtsgericht": "Amtsgericht München",
      "registernummer": "HRB 254104",
      "registerart": "HRB",
      "company_name": "Easy Shipping GmbH",
      "company_seat": "Egenhofen",
      "details": "04.12.2024 (Bekanntmachungsdatum)\n\nBayern Amtsgericht München HRB 254104\nLöschungsankündigung 03.12.2024 (Eintragungsdatum)\n\nEasy Shipping GmbH\nGesellschaft mit beschränkter Haftung\nEgenhofen\n\nDas Registergericht beabsichtigt, die im Handelsregister eingetragene Gesellschaft wegen Vermögenslosigkeit von Amts wegen nach § 394 FamFG zu löschen. Die Frist zur Erhebung eines Widerspruchs ist auf drei Monate festgesetzt."
    },
    {
      "date": "2024-12-04",
      "id": "95324",
      "original_text": "Registerbekanntmachung nach dem Umwandlungsgesetz\nBayern Amtsgericht München HRB 222329\nDigitronics Holding GmbH – München",
      "type": "Registerbekanntmachung nach dem Umwandlungsgesetz",
      "state": "Bayern",
      "amtsgericht": "Amtsgericht München",
      "registernummer": "HRB 222329",
      "registerart": "HRB",
      "company_name": "Digitronics Holding GmbH",
      "company_seat": "München",
      "details": "04.12.2024 (Bekanntmachungsdatum)\n\nBayern Amtsgericht München HRB 222329\nRegisterbekanntmachung nach dem Umwandlungsgesetz 03.12.2024 (Eintragungsdatum)\n\nDigitronics Holding GmbH\nGesellschaft mit beschränkter Haftung\nMünchen\n\nDen Gläubigern der an der Verschmelzung beteiligten Rechtsträger ist, wenn sie binnen sechs Monaten nach dem Tag, an dem die Eintragung der Verschmelzung in das Register des Sitzes desjenigen Rechtsträgers, dessen Gläubiger sie sind, nach § 19 Abs. 3 UmwG als bekannt gemacht gilt, ihren Anspruch nach Grund und Höhe schriftlich anmelden, Sicherheit zu leisten, soweit sie nicht Befriedigung verlangen können. Dieses Recht steht den Gläubigern jedoch nur zu, wenn sie glaubhaft machen, dass durch die Verschmelzung die Erfüllung ihrer Forderung gefährdet wird."
    },
    {
      "date": "2024-12-04",
      "id": "95325",
      "original_text": "Registerbekanntmachung nach dem Umwandlungsgesetz\nBayern Amtsgericht Ansbach HRB 4112\nMayer GmbH Verwaltung – Ansbach",
      "type": "Registerbekanntmachung nach dem Umwandlungsgesetz",
      "state": "Bayern",
      "amtsgericht": "Amtsgericht Ansbach",
      "registernummer": "HRB 4112",
      "registerart": "HRB",
      "company_name": "Mayer GmbH Verwaltung",
      "company_seat": "Ansbach",
      "details": "04.12.2024 (Bekanntmachungsdatum)\n\nBayern Amtsgericht Ansbach HRB 4112\nRegisterbekanntmachung nach dem Umwandlungsgesetz 03.12.2024 (Eintragungsdatum)\n\nMayer GmbH Verwaltung\nGesellschaft mit beschränkter Haftung\nAnsbach\n\nDen Gläubigern der an der Verschmelzung beteiligten Rechtsträger ist, wenn sie binnen sechs Monaten nach dem Tag, an dem die Eintragung der Verschmelzung in das Register des Sitzes desjenigen Rechtsträgers, dessen Gläubiger sie sind, nach § 19 Abs. 3 UmwG als bekannt gemacht gilt, ihren Anspruch nach Grund und Höhe schriftlich anmelden, Sicherheit zu leisten, soweit sie nicht Befriedigung verlangen können. Dieses Recht steht den Gläubigern jedoch nur zu, wenn sie glaubhaft machen, dass durch die Verschmelzung die Erfüllung ihrer Forderung gefährdet wird."
    },
    {
      "date": "2024-12-04",
      "id": "95326",
      "original_text": "Registerbekanntmachung nach dem Umwandlungsgesetz\nBayern Amtsgericht München HRB 196172\nVermietung PRIME GmbH – Gräfelfing",
      "type": "Registerbekanntmachung nach dem Umwandlungsgesetz",
      "state": "Bayern",
      "amtsgericht": "Amtsgericht München",
      "registernummer": "HRB 196172",
      "registerart": "HRB",
      "company_name": "Vermietung PRIME GmbH",
      "company_seat": "Gräfelfing",
      "details": "04.12.2024 (Bekanntmachungsdatum)\n\nBayern Amtsgericht München HRB 196172\nRegisterbekanntmachung nach dem Umwandlungsgesetz 03.12.2024 (Eintragungsdatum)\n\nVermietung PRIME GmbH\nGesellschaft mit beschränkter Haftung\nGräfelfing\n\nDen Gläubigern der an der Verschmelzung beteiligten Rechtsträger ist, wenn sie binnen sechs Monaten nach dem Tag, an dem die Eintragung der Verschmelzung in das Register des Sitzes desjenigen Rechtsträgers, dessen Gläubiger sie sind, nach § 19 Abs. 3 UmwG als bekannt gemacht gilt, ihren Anspruch nach Grund und Höhe schriftlich anmelden, Sicherheit zu leisten, soweit sie nicht Befriedigung verlangen können. Dieses Recht steht den Gläubigern jedoch nur zu, wenn sie glaubhaft machen, dass durch die Verschmelzung die Erfüllung ihrer Forderung gefährdet wird."
    },
    {
      "date": "2024-12-04",
      "id": "95327",
      "original_text": "Löschungsankündigung\nBayern Amtsgericht Nürnberg HRB 28352\nLirdy UG (haftungsbeschränkt) – Nürnberg",
      "type": "Löschungsankündigung",
      "state": "Bayern",
      "amtsgericht": "Amtsgericht Nürnberg",
      "registernummer": "HRB 28352",
      "registerart": "HRB",
      "company_name": "Lirdy UG (haftungsbeschränkt)",
      "company_seat": "Nürnberg",
      "details": "04.12.2024 (Bekanntmachungsdatum)\n\nBayern Amtsgericht Nürnberg HRB 28352\nLöschungsankündigung\n\nLirdy UG (haftungsbeschränkt)\nGesellschaft mit beschränkter Haftung\nNürnberg\n\nDas Registergericht beabsichtigt, die im Handelsregister eingetragene Gesellschaft wegen Vermögenslosigkeit von Amts wegen nach § 394 FamFG zu löschen. Die Frist zur Erhebung eines Widerspruchs ist auf einen Monat festgesetzt."
    },
    {
      "date": "2024-12-04",
      "id": "95328",
      "original_text": "Registerbekanntmachung nach dem Umwandlungsgesetz\nBayern Amtsgericht Augsburg HRB 22803\nPATRIZIA Projekt 440 GmbH – Augsburg",
      "type": "Registerbekanntmachung nach dem Umwandlungsgesetz",
      "state": "Bayern",
      "amtsgericht": "Amtsgericht Augsburg",
      "registernummer": "HRB 22803",
      "registerart": "HRB",
      "company_name": "PATRIZIA Projekt 440 GmbH",
      "company_seat": "Augsburg",
      "details": "04.12.2024 (Bekanntmachungsdatum)\n\nBayern Amtsgericht Augsburg HRB 22803\nRegisterbekanntmachung nach dem Umwandlungsgesetz\n\nPATRIZIA Projekt 440 GmbH\nGesellschaft mit beschränkter Haftung\nAugsburg\n\nAls nicht eingetragen gemäß §§ 336, 308 Abs. 1 UmwG bekannt gemacht: Die Gesellschaft hat am 28.11.2024 den Entwurf eines Formwechselplans betreffend den Formwechsel der PATRIZIA Projekt 440 GmbH mit Sitz in Augsburg, Deutschland, in die neu einzutragende PATRIZIA Projekt 440 S.à r.l., Société á responsabilité limitée mit Sitz in Luxemburg, Großherzogtum Luxemburg, beim Amtsgericht Augsburg (Registergericht) zur Einsichtnahme eingereicht. Bekanntmachung gemäß §§ 336, 308 Abs. 1 Umwandlungsgesetz: 1. Rechtsform, Firma und Sitz der beteiligten Gesellschaften: Am grenzüberschreitenden Formwechsel sind beteiligt: die PATRIZIA Projekt 440 GmbH mit Sitz in Augsburg, Geschäftsanschrift: Fuggerstraße 26, 86150 Augsburg, und als Zielrechtsträger die PATRIZIA Projekt 440 S.à r.l. mit Sitz in Luxemburg, eine Société á responsabilité limitée nach dem Recht des Großherzogtums Luxemburg, als welche die formwechselnde Gesellschaft nach dem Formwechsel fortgesetzt werden soll. 2. Register, bei denen die am grenzüberschreitenden Formwechsel beteiligten Gesellschaften eingetragen sind, sowie die Nummer der Eintragung:  Die PATRIZIA Projekt 440 GmbH mit Sitz in Augsburg, Deutschland,  ist eingetragen im Handelsregister des Amtsgerichts Augsburg unter HRB 22803.  3. Neue Rechtsform, neue Firma und neuer Sitz der Gesellschaft:  Die PATRIZIA Projekt 440 GmbH wird formgewechselt in eine Société à responsabilité limitée nach dem Recht des Großherzogtums Luxemburg. Die PATRIZIA Projekt 440 GmbH  wird künftig unter der Firma PATRIZIA Projekt 440 S.à r.l. ihren Satzungs- und Verwaltungssitz in 41, Avenue de la Liberté, 1931 Luxemburg, Großherzogtum Luxemburg, haben und eingetragen werden im Handels- und Gesellschaftsregister von Luxemburg (registre de commerce et des sociétés de Luxembourg).  4. Hinweis an Anteilsinhaber und Gläubiger: Die Anteilsinhaber und Gläubiger der PATRIZIA Projekt 440 GmbH können der PATRIZIA Projekt 440 GmbH spätestens fünf Arbeitstage vor der Gesellschafterversammlung der PATRIZIA Projekt 440 GmbH,  die über die Zustimmung zu dem Formwechselplan beschließen wird, d.h. bis spätestens 06.01.2025, Bemerkungen zum Formwechselplan übermitteln."
    },
    {
      "date": "2024-12-04",
      "id": "95329",
      "original_text": "Einreichung neuer Dokumente\nBayern Amtsgericht München HRB 139673\nARRI AG – München",
      "type": "Einreichung neuer Dokumente",
      "state": "Bayern",
      "amtsgericht": "Amtsgericht München",
      "registernummer": "HRB 139673",
      "registerart": "HRB",
      "company_name": "ARRI AG",
      "company_seat": "München",
      "details": "04.12.2024 (Bekanntmachungsdatum)\n\nBayern Amtsgericht München HRB 139673\nEinreichung neuer Dokumente\n\nARRI AG\nAktiengesellschaft\nMünchen\n\nDem Amtsgericht München -Registergericht- ist eine Liste der Mitglieder des Aufsichtsrats eingereicht worden, § 106 AktG."
    },
    {
      "date": "2024-12-04",
      "id": "95330",
      "original_text": "Registerbekanntmachung nach dem Umwandlungsgesetz\nBayern Amtsgericht Nürnberg HRB 36113\nAlpha Torin GmbH – Nürnberg",
      "type": "Registerbekanntmachung nach dem Umwandlungsgesetz",
      "state": "Bayern",
      "amtsgericht": "Amtsgericht Nürnberg",
      "registernummer": "HRB 36113",
      "registerart": "HRB",
      "company_name": "Alpha Torin GmbH",
      "company_seat": "Nürnberg",
      "details": "04.12.2024 (Bekanntmachungsdatum)\n\nBayern Amtsgericht Nürnberg HRB 36113\nRegisterbekanntmachung nach dem Umwandlungsgesetz 03.12.2024 (Eintragungsdatum)\n\nAlpha Torin GmbH\nGesellschaft mit beschränkter Haftung\nNürnberg\n\nDen Gläubigern der an der Verschmelzung beteiligten Rechtsträger ist, wenn sie binnen sechs Monaten nach dem Tag, an dem die Eintragung der Verschmelzung in das Register des Sitzes desjenigen Rechtsträgers, dessen Gläubiger sie sind, nach § 19 Abs. 3 UmwG als bekannt gemacht gilt, ihren Anspruch nach Grund und Höhe schriftlich anmelden, Sicherheit zu leisten, soweit sie nicht Befriedigung verlangen können. Dieses Recht steht den Gläubigern jedoch nur zu, wenn sie glaubhaft machen, dass durch die Verschmelzung die Erfüllung ihrer Forderung gefährdet wird."
    },
    {
      "date": "2024-12-04",
      "id": "95331",
      "original_text": "Löschungsankündigung\nBayern Amtsgericht München HRB 211182\nAFH Abschlepp- & Pannendienst UG (haftungsbeschränkt) – München",
      "type": "Löschungsankündigung",
      "state": "Bayern",
      "amtsgericht": "Amtsgericht München",
      "registernummer": "HRB 211182",
      "registerart": "HRB",
      "company_name": "AFH Abschlepp- & Pannendienst UG (haftungsbeschränkt)",
      "company_seat": "München",
      "details": "04.12.2024 (Bekanntmachungsdatum)\n\nBayern Amtsgericht München HRB 211182\nLöschungsankündigung\n\nAFH Abschlepp- & Pannendienst UG (haftungsbeschränkt)\nGesellschaft mit beschränkter Haftung\nMünchen\n\nDas Registergericht beabsichtigt, die im Handelsregister eingetragene Gesellschaft wegen Vermögenslosigkeit von Amts wegen nach § 394 FamFG zu löschen. Die Frist zur Erhebung eines Widerspruchs ist auf drei Monate festgesetzt."
    },
    {
      "date": "2024-12-04",
      "id": "95332",
      "original_text": "Sonstige Registerbekanntmachung\nBayern Amtsgericht Würzburg HRB 575\nGerresheimer Lohr GmbH – Lohr",
      "type": "Sonstige Registerbekanntmachung",
      "state": "Bayern",
      "amtsgericht": "Amtsgericht Würzburg",
      "registernummer": "HRB 575",
      "registerart": "HRB",
      "company_name": "Gerresheimer Lohr GmbH",
      "company_seat": "Lohr",
      "details": "04.12.2024 (Bekanntmachungsdatum)\n\nBayern Amtsgericht Würzburg HRB 575\nSonstige Registerbekanntmachung 03.12.2024 (Eintragungsdatum)\n\nGerresheimer Lohr GmbH\nGesellschaft mit beschränkter Haftung\nLohr\n\nDen Gläubigern der Gesellschaft, deren Forderungen begründet worden sind, bevor die Eintragung der Beendigung des Beherrschungs- und Gewinnabführungsvertrages in das Handelsregister nach § 10 des Handelsgesetzbuches als bekanntgemacht gilt, hat der andere Vertragsteil Sicherheit zu leisten, wenn sie sich binnen sechs Monaten nach der Bekanntmachung der Eintragung zu diesem Zweck bei ihm melden."
    },
    {
      "date": "2024-12-04",
      "id": "95333",
      "original_text": "Löschungsankündigung\nBayern Amtsgericht Coburg HRB 6284\nAVINOOR GmbH – Meeder",
      "type": "Löschungsankündigung",
      "state": "Bayern",
      "amtsgericht": "Amtsgericht Coburg",
      "registernummer": "HRB 6284",
      "registerart": "HRB",
      "company_name": "AVINOOR GmbH",
      "company_seat": "Meeder",
      "details": "04.12.2024 (Bekanntmachungsdatum)\n\nBayern Amtsgericht Coburg HRB 6284\nLöschungsankündigung\n\nAVINOOR GmbH\nGesellschaft mit beschränkter Haftung\nMeeder\n\nDas Registergericht beabsichtigt, die im Handelsregister eingetragene Gesellschaft wegen Vermögenslosigkeit von Amts wegen nach § 394 FamFG zu löschen. #insert(Text=\"zztb_V_Widerspruchsfrist\")"
    },
    {
      "date": "2024-12-04",
      "id": "95334",
      "original_text": "Einreichung neuer Dokumente\nBayern Amtsgericht Bamberg HRB 10107\nNaturEnergy GmbH & Co. KGaA – Bamberg",
      "type": "Einreichung neuer Dokumente",
      "state": "Bayern",
      "amtsgericht": "Amtsgericht Bamberg",
      "registernummer": "HRB 10107",
      "registerart": "HRB",
      "company_name": "NaturEnergy GmbH & Co. KGaA",
      "company_seat": "Bamberg",
      "details": "04.12.2024 (Bekanntmachungsdatum)\n\nBayern Amtsgericht Bamberg HRB 10107\nEinreichung neuer Dokumente\n\nNaturEnergy GmbH & Co. KGaA\nKommanditgesellschaft auf Aktien\nBamberg\n\nDem Amtsgericht Bamberg -Registergericht- isteine Liste der Mitglieder des Aufsichtsrats eingereicht worden, §§ 278 Abs. 3, 106 AktG."
    },
    {
      "date": "2024-12-04",
      "id": "95335",
      "original_text": "Löschungsankündigung\nBayern Amtsgericht Ingolstadt HRB 9196\n\"SUN\" Klebstoff- und Werkzeug Handels-GmbH – Ingolstadt",
      "type": "Löschungsankündigung",
      "state": "Bayern",
      "amtsgericht": "Amtsgericht Ingolstadt",
      "registernummer": "HRB 9196",
      "registerart": "HRB",
      "company_name": "\"SUN\" Klebstoff- und Werkzeug Handels-GmbH",
      "company_seat": "Ingolstadt",
      "details": "04.12.2024 (Bekanntmachungsdatum)\n\nBayern Amtsgericht Ingolstadt HRB 9196\nLöschungsankündigung\n\n\"SUN\" Klebstoff- und Werkzeug Handels-GmbH\nGesellschaft mit beschränkter Haftung\nIngolstadt\n\nDas Registergericht beabsichtigt, die im Handelsregister eingetragene Gesellschaft wegen Vermögenslosigkeit von Amts wegen nach § 394 FamFG zu löschen. Die Frist zur Erhebung eines Widerspruchs ist auf einen Monat festgesetzt."
    },
    {
      "date": "2024-12-04",
      "id": "95336",
      "original_text": "Löschungsankündigung\nBayern Amtsgericht München HRB 247795\nDalmika UG (haftungsbeschränkt) – Gräfelfing",
      "type": "Löschungsankündigung",
      "state": "Bayern",
      "amtsgericht": "Amtsgericht München",
      "registernummer": "HRB 247795",
      "registerart": "HRB",
      "company_name": "Dalmika UG (haftungsbeschränkt)",
      "company_seat": "Gräfelfing",
      "details": "04.12.2024 (Bekanntmachungsdatum)\n\nBayern Amtsgericht München HRB 247795\nLöschungsankündigung\n\nDalmika UG (haftungsbeschränkt)\nGesellschaft mit beschränkter Haftung\nGräfelfing\n\nDas Registergericht beabsichtigt, die im Handelsregister eingetragene Gesellschaft wegen Vermögenslosigkeit von Amts wegen nach § 394 FamFG zu löschen. Die Frist zur Erhebung eines Widerspruchs ist auf drei Monate festgesetzt."
    },
    {
      "date": "2024-12-04",
      "id": "95337",
      "original_text": "Registerbekanntmachung nach dem Umwandlungsgesetz\nBayern Amtsgericht München HRB 209510\nSiemens Advanta Solutions GmbH – München",
      "type": "Registerbekanntmachung nach dem Umwandlungsgesetz",
      "state": "Bayern",
      "amtsgericht": "Amtsgericht München",
      "registernummer": "HRB 209510",
      "registerart": "HRB",
      "company_name": "Siemens Advanta Solutions GmbH",
      "company_seat": "München",
      "details": "04.12.2024 (Bekanntmachungsdatum)\n\nBayern Amtsgericht München HRB 209510\nRegisterbekanntmachung nach dem Umwandlungsgesetz 03.12.2024 (Eintragungsdatum)\n\nSiemens Advanta Solutions GmbH\nGesellschaft mit beschränkter Haftung\nMünchen\n\nDen Gläubigern der an der Verschmelzung beteiligten Rechtsträger ist, wenn sie binnen sechs Monaten nach dem Tag, an dem die Eintragung der Verschmelzung in das Register des Sitzes desjenigen Rechtsträgers, dessen Gläubiger sie sind, nach § 19 Abs. 3 UmwG als bekannt gemacht gilt, ihren Anspruch nach Grund und Höhe schriftlich anmelden, Sicherheit zu leisten, soweit sie nicht Befriedigung verlangen können. Dieses Recht steht den Gläubigern jedoch nur zu, wenn sie glaubhaft machen, dass durch die Verschmelzung die Erfüllung ihrer Forderung gefährdet wird."
    },
    {
      "date": "2024-12-04",
      "id": "95338",
      "original_text": "Registerbekanntmachung nach dem Umwandlungsgesetz\nBayern Amtsgericht Ansbach HRB 5326\nMayer GmbH Holding – Ansbach",
      "type": "Registerbekanntmachung nach dem Umwandlungsgesetz",
      "state": "Bayern",
      "amtsgericht": "Amtsgericht Ansbach",
      "registernummer": "HRB 5326",
      "registerart": "HRB",
      "company_name": "Mayer GmbH Holding",
      "company_seat": "Ansbach",
      "details": "04.12.2024 (Bekanntmachungsdatum)\n\nBayern Amtsgericht Ansbach HRB 5326\nRegisterbekanntmachung nach dem Umwandlungsgesetz 03.12.2024 (Eintragungsdatum)\n\nMayer GmbH Holding\nGesellschaft mit beschränkter Haftung\nAnsbach\n\nDen Gläubigern der an der Verschmelzung beteiligten Rechtsträger ist, wenn sie binnen sechs Monaten nach dem Tag, an dem die Eintragung der Verschmelzung in das Register des Sitzes desjenigen Rechtsträgers, dessen Gläubiger sie sind, nach § 19 Abs. 3 UmwG als bekannt gemacht gilt, ihren Anspruch nach Grund und Höhe schriftlich anmelden, Sicherheit zu leisten, soweit sie nicht Befriedigung verlangen können. Dieses Recht steht den Gläubigern jedoch nur zu, wenn sie glaubhaft machen, dass durch die Verschmelzung die Erfüllung ihrer Forderung gefährdet wird."
    },
    {
      "date": "2024-12-04",
      "id": "95339",
      "original_text": "Sonstige Registerbekanntmachung\nSchleswig-Holstein Amtsgericht Lübeck HRB 23652\nHamburg auto GmbH – Geesthacht",
      "type": "Sonstige Registerbekanntmachung",
      "state": "Schleswig-Holstein",
      "amtsgericht": "Amtsgericht Lübeck",
      "registernummer": "HRB 23652",
      "registerart": "HRB",
      "company_name": "Hamburg auto GmbH",
      "company_seat": "Geesthacht",
      "details": "04.12.2024 (Bekanntmachungsdatum)\n\nSchleswig-Holstein Amtsgericht Lübeck HRB 23652\nSonstige Registerbekanntmachung\n\nHamburg auto GmbH\nGesellschaft mit beschränkter Haftung\nGeesthacht\n\nAls nicht eingetragen wird veröffentlicht:\nAmtsgericht Lübeck, Am Burgfeld 7, 23568 Lübeck\n\nHamburg auto GmbH\nz. H. Herrn Geschäftsführer\nAndrejs Nesteruks\nBorgfelder Stieg 20\n21502 Geesthacht\n\nUnser Zeichen: HRB 23652 HL\n\nDatum: 02.12.2024\n\nSehr geehrter Herr Nesteruks,\n\nin der Handelsregistersache der\n\nHamburg auto GmbH\n\nergeben sich aus den mir vorliegenden Unterlagen Anhaltspunkte dafür, dass die Gesellschaft, als deren Geschäftsführer Sie noch eingetragen sind, vermögenslos ist:\n\nSchreiben des Finanzamtes Lübeck vom 22.11.2024.\n\nIch beabsichtige daher, die Gesellschaft wegen Vermögenslosigkeit gemäß § 394 FamFG zu löschen.\n\nIch bestimme eine Frist von einem Monat zur Geltendmachung eines Widerspruchs gegen die Löschung, § 394 Abs. 2 S. 1 FamFG.\n\nWeiter bitte ich Sie, mir binnen derselben Frist mitzuteilen, ob die genannte Gesellschaft noch Vermögen hat, ggf. welche Vermögensgegenstände sie besitzt, ob die Gesellschaft noch Partei eines noch nicht rechtskräftig abgeschlossenen Rechtsstreits ist oder ob sonst noch eine Abwicklung stattfindet.\n\nNach Fristablauf ohne Widerspruch von Ihnen oder anderer Seite wird die Gesellschaft gelöscht.\n\nMit freundlichen Grüßen\nWolski,\nDipl.-Rechtspflegerin (FH)"
    },
    {
      "date": "2024-12-04",
      "id": "95340",
      "original_text": "Löschungsankündigung\nSchleswig-Holstein Amtsgericht Lübeck HRB 23652\nHamburg auto GmbH – Geesthacht",
      "type": "Löschungsankündigung",
      "state": "Schleswig-Holstein",
      "amtsgericht": "Amtsgericht Lübeck",
      "registernummer": "HRB 23652",
      "registerart": "HRB",
      "company_name": "Hamburg auto GmbH",
      "company_seat": "Geesthacht",
      "details": "04.12.2024 (Bekanntmachungsdatum)\n\nSchleswig-Holstein Amtsgericht Lübeck HRB 23652\nLöschungsankündigung\n\nHamburg auto GmbH\nGesellschaft mit beschränkter Haftung\nGeesthacht\n\nEs ist die Löschung der nachstehenden Gesellschaft wegen Vermögenslosigkeit gemäß § 394 FamFG beabsichtigt. Widespruchsfrist: 1 Monat."
    },
    {
      "date": "2024-12-04",
      "id": "95341",
      "original_text": "Einreichung neuer Dokumente\nSachsen-Anhalt Amtsgericht Stendal HRB 12193\nStadtentwicklungsgesellschaft Bitterfeld-Wolfen mbH (STEG Bitterfeld-Wolfen) – Bitterfeld-Wolfen",
      "type": "Einreichung neuer Dokumente",
      "state": "Sachsen-Anhalt",
      "amtsgericht": "Amtsgericht Stendal",
      "registernummer": "HRB 12193",
      "registerart": "HRB",
      "company_name": "Stadtentwicklungsgesellschaft Bitterfeld-Wolfen mbH (STEG Bitterfeld-Wolfen)",
      "company_seat": "Bitterfeld-Wolfen",
      "details": "04.12.2024 (Bekanntmachungsdatum)\n\nSachsen-Anhalt Amtsgericht Stendal HRB 12193\nEinreichung neuer Dokumente\n\nStadtentwicklungsgesellschaft Bitterfeld-Wolfen mbH (STEG Bitterfeld-Wolfen)\nGesellschaft mit beschränkter Haftung\nBitterfeld-Wolfen\n\nEine Liste der Mitglieder des Aufsichtsrates wurde zum Handelsregister eingereicht."
    },
    {
      "date": "2024-12-04",
      "id": "95342",
      "original_text": "Einreichung neuer Dokumente\nSachsen-Anhalt Amtsgericht Stendal HRB 5202\nLutherstadt Wittenberg Marketing GmbH – Lutherstadt Wittenberg",
      "type": "Einreichung neuer Dokumente",
      "state": "Sachsen-Anhalt",
      "amtsgericht": "Amtsgericht Stendal",
      "registernummer": "HRB 5202",
      "registerart": "HRB",
      "company_name": "Lutherstadt Wittenberg Marketing GmbH",
      "company_seat": "Lutherstadt Wittenberg",
      "details": "04.12.2024 (Bekanntmachungsdatum)\n\nSachsen-Anhalt Amtsgericht Stendal HRB 5202\nEinreichung neuer Dokumente\n\nLutherstadt Wittenberg Marketing GmbH\nGesellschaft mit beschränkter Haftung\nLutherstadt Wittenberg\n\nEine Liste der Mitglieder des Aufsichtsrates wurde zum Handelsregister eingereicht."
    },
    {
      "date": "2024-12-04",
      "id": "95343",
      "original_text": "Einreichung neuer Dokumente\nBerlin Amtsgericht Berlin (Charlottenburg) HRB 256810\nLINDENMAGNAT AG – Berlin",
      "type": "Einreichung neuer Dokumente",
      "state": "Berlin",
      "amtsgericht": "Amtsgericht Berlin (Charlottenburg)",
      "registernummer": "HRB 256810",
      "registerart": "HRB",
      "company_name": "LINDENMAGNAT AG",
      "company_seat": "Berlin",
      "details": "04.12.2024 (Bekanntmachungsdatum)\n\nBerlin Amtsgericht Berlin (Charlottenburg) HRB 256810\nEinreichung neuer Dokumente\n\nLINDENMAGNAT AG\nAktiengesellschaft\nBerlin\n\nAls nicht eingetragen wird veröffentlicht: Es wurde eine neue Liste der Aufsichtsratsmitglieder eingereicht (§ 106 AktG)."
    },
    {
      "date": "2024-12-04",
      "id": "95344",
      "original_text": "Löschungsankündigung\nSchleswig-Holstein Amtsgericht Kiel HRB 21353\nVIKING Stahlmanufaktur UG (haftungsbeschränkt) – Kiel",
      "type": "Löschungsankündigung",
      "state": "Schleswig-Holstein",
      "amtsgericht": "Amtsgericht Kiel",
      "registernummer": "HRB 21353",
      "registerart": "HRB",
      "company_name": "VIKING Stahlmanufaktur UG (haftungsbeschränkt)",
      "company_seat": "Kiel",
      "details": "04.12.2024 (Bekanntmachungsdatum)\n\nSchleswig-Holstein Amtsgericht Kiel HRB 21353\nLöschungsankündigung\n\nVIKING Stahlmanufaktur UG (haftungsbeschränkt)\nGesellschaft mit beschränkter Haftung\nKiel\n\nEs ist die Löschung der nachstehenden Gesellschaft wegen Vermögenslosigkeit gemäß § 394 FamFG beabsichtigt. Widerspruchsfrist: 2 Monate."
    },
    {
      "date": "2024-12-04",
      "id": "95345",
      "original_text": "Löschungsankündigung\nBerlin Amtsgericht Berlin (Charlottenburg) HRB 124499\ndozentenkontor UG (haftungsbeschränkt) – Berlin",
      "type": "Löschungsankündigung",
      "state": "Berlin",
      "amtsgericht": "Amtsgericht Berlin (Charlottenburg)",
      "registernummer": "HRB 124499",
      "registerart": "HRB",
      "company_name": "dozentenkontor UG (haftungsbeschränkt)",
      "company_seat": "Berlin",
      "details": "04.12.2024 (Bekanntmachungsdatum)\n\nBerlin Amtsgericht Berlin (Charlottenburg) HRB 124499\nLöschungsankündigung\n\ndozentenkontor UG (haftungsbeschränkt)\nGesellschaft mit beschränkter Haftung\nBerlin\n\nBei der nachstehenden Gesellschaft wird das Amtslöschungsverfahren gemäß § 394 FamFG eingeleitet. Widerspruchsfrist 6 Wochen"
    },
    {
      "date": "2024-12-04",
      "id": "95346",
      "original_text": "Löschungsankündigung\nBrandenburg Amtsgericht Potsdam HRB 39479\nHomeOp GmbH – Potsdam",
      "type": "Löschungsankündigung",
      "state": "Brandenburg",
      "amtsgericht": "Amtsgericht Potsdam",
      "registernummer": "HRB 39479",
      "registerart": "HRB",
      "company_name": "HomeOp GmbH",
      "company_seat": "Potsdam",
      "details": "04.12.2024 (Bekanntmachungsdatum)\n\nBrandenburg Amtsgericht Potsdam HRB 39479\nLöschungsankündigung\n\nHomeOp GmbH\nGesellschaft mit beschränkter Haftung\nPotsdam\n\nBei der nachstehenden Gesellschaft wird das Amtslöschungsverfahren gemäß § 394 FamFG eingeleitet. Widerspruchsfrist 8 Wochen."
    },
    {
      "date": "2024-12-04",
      "id": "95347",
      "original_text": "Löschungsankündigung\nBerlin Amtsgericht Berlin (Charlottenburg) HRB 182508\nRadialimpuls GmbH – Berlin",
      "type": "Löschungsankündigung",
      "state": "Berlin",
      "amtsgericht": "Amtsgericht Berlin (Charlottenburg)",
      "registernummer": "HRB 182508",
      "registerart": "HRB",
      "company_name": "Radialimpuls GmbH",
      "company_seat": "Berlin",
      "details": "04.12.2024 (Bekanntmachungsdatum)\n\nBerlin Amtsgericht Berlin (Charlottenburg) HRB 182508\nLöschungsankündigung\n\nRadialimpuls GmbH\nGesellschaft mit beschränkter Haftung\nBerlin\n\nBei der nachstehenden Gesellschaft wird das Amtslöschungsverfahren gemäß § 394 FamFG eingeleitet. Widerspruchsfrist 6 Wochen"
    },
    {
      "date": "2024-12-04",
      "id": "95348",
      "original_text": "Registerbekanntmachung nach dem Umwandlungsgesetz\nBerlin Amtsgericht Berlin (Charlottenburg) HRA 63660\nUIW Lux West 2 GmbH & Co. KG – Berlin",
      "type": "Registerbekanntmachung nach dem Umwandlungsgesetz",
      "state": "Berlin",
      "amtsgericht": "Amtsgericht Berlin (Charlottenburg)",
      "registernummer": "HRA 63660",
      "registerart": "HRA",
      "company_name": "UIW Lux West 2 GmbH & Co. KG",
      "company_seat": "Berlin",
      "details": "04.12.2024 (Bekanntmachungsdatum)\n\nBerlin Amtsgericht Berlin (Charlottenburg) HRA 63660\nRegisterbekanntmachung nach dem Umwandlungsgesetz 03.12.2024 (Eintragungsdatum)\n\nUIW Lux West 2 GmbH & Co. KG\nKommanditgesellschaft\nBerlin\n\nZu Eintragungsnummer 1 vom 03.12.2024 wird als nicht eingetragen veröffentlicht: Den Gläubigern ist, wenn sie binnen sechs Monaten nach dem Tag, an dem die Eintragung der Umwandlung als bekannt gemacht gilt, ihren Anspruch nach Grund und Höhe schriftlich anmelden, Sicherheit zu leisten, soweit sie nicht Befriedigung verlangen können. Dieses Recht steht den Gläubigern jedoch nur zu, wenn sie glaubhaft machen, dass durch die Umwandlung die Erfüllung ihrer Forderung gefährdet wird. Das Recht, Sicherheitsleistung zu verlangen, steht Gläubigern nicht zu, die im Falle der Insolvenz ein Recht auf vorzugsweise Befriedigung aus einer Deckungsmasse haben, die nach gesetzlicher Vorschrift zu ihrem Schutz errichtet und staatlich überwacht ist."
    },
    {
      "date": "2024-12-04",
      "id": "95349",
      "original_text": "Registerbekanntmachung nach dem Umwandlungsgesetz\nBerlin Amtsgericht Berlin (Charlottenburg) HRA 63661\nUIW Lux Nord 3 GmbH & Co. KG – Berlin",
      "type": "Registerbekanntmachung nach dem Umwandlungsgesetz",
      "state": "Berlin",
      "amtsgericht": "Amtsgericht Berlin (Charlottenburg)",
      "registernummer": "HRA 63661",
      "registerart": "HRA",
      "company_name": "UIW Lux Nord 3 GmbH & Co. KG",
      "company_seat": "Berlin",
      "details": "04.12.2024 (Bekanntmachungsdatum)\n\nBerlin Amtsgericht Berlin (Charlottenburg) HRA 63661\nRegisterbekanntmachung nach dem Umwandlungsgesetz 03.12.2024 (Eintragungsdatum)\n\nUIW Lux Nord 3 GmbH & Co. KG\nKommanditgesellschaft\nBerlin\n\nZu Eintragungsnummer 1 vom 03.12.2024 wird als nicht eingetragen veröffentlicht: Den Gläubigern ist, wenn sie binnen sechs Monaten nach dem Tag, an dem die Eintragung der Umwandlung als bekannt gemacht gilt, ihren Anspruch nach Grund und Höhe schriftlich anmelden, Sicherheit zu leisten, soweit sie nicht Befriedigung verlangen können. Dieses Recht steht den Gläubigern jedoch nur zu, wenn sie glaubhaft machen, dass durch die Umwandlung die Erfüllung ihrer Forderung gefährdet wird. Das Recht, Sicherheitsleistung zu verlangen, steht Gläubigern nicht zu, die im Falle der Insolvenz ein Recht auf vorzugsweise Befriedigung aus einer Deckungsmasse haben, die nach gesetzlicher Vorschrift zu ihrem Schutz errichtet und staatlich überwacht ist."
    },
    {
      "date": "2024-12-04",
      "id": "95350",
      "original_text": "Registerbekanntmachung nach dem Umwandlungsgesetz\nBerlin Amtsgericht Berlin (Charlottenburg) HRA 63645\nUIW Lux Nordwest 1 GmbH & Co. KG – Berlin",
      "type": "Registerbekanntmachung nach dem Umwandlungsgesetz",
      "state": "Berlin",
      "amtsgericht": "Amtsgericht Berlin (Charlottenburg)",
      "registernummer": "HRA 63645",
      "registerart": "HRA",
      "company_name": "UIW Lux Nordwest 1 GmbH & Co. KG",
      "company_seat": "Berlin",
      "details": "04.12.2024 (Bekanntmachungsdatum)\n\nBerlin Amtsgericht Berlin (Charlottenburg) HRA 63645\nRegisterbekanntmachung nach dem Umwandlungsgesetz 02.12.2024 (Eintragungsdatum)\n\nUIW Lux Nordwest 1 GmbH & Co. KG\nKommanditgesellschaft\nBerlin\n\nZu Eintragungsnummer 1 vom 02.12.2024 wird als nicht eingetragen veröffentlicht: Den Gläubigern ist, wenn sie binnen sechs Monaten nach dem Tag, an dem die Eintragung der formwechselnden Umwandlung als bekannt gemacht gilt, ihren Anspruch nach Grund und Höhe schriftlich anmelden, Sicherheit zu leisten, soweit sie nicht Befriedigung verlangen können. Dieses Recht steht den Gläubigern jedoch nur zu, wenn sie glaubhaft machen, dass durch die formwechselnde Umwandlung die Erfüllung ihrer Forderung gefährdet wird. Das Recht, Sicherheitsleistung zu verlangen, steht Gläubigern nicht zu, die im Falle der Insolvenz ein Recht auf vorzugsweise Befriedigung aus einer Deckungsmasse haben, die nach gesetzlicher Vorschrift zu ihrem Schutz errichtet und staatlich überwacht ist."
    },
    {
      "date": "2024-12-04",
      "id": "95351",
      "original_text": "Registerbekanntmachung nach dem Umwandlungsgesetz\nBerlin Amtsgericht Berlin (Charlottenburg) HRA 63658\nUIW Lux Berlin 7 GmbH & Co. KG – Berlin",
      "type": "Registerbekanntmachung nach dem Umwandlungsgesetz",
      "state": "Berlin",
      "amtsgericht": "Amtsgericht Berlin (Charlottenburg)",
      "registernummer": "HRA 63658",
      "registerart": "HRA",
      "company_name": "UIW Lux Berlin 7 GmbH & Co. KG",
      "company_seat": "Berlin",
      "details": "04.12.2024 (Bekanntmachungsdatum)\n\nBerlin Amtsgericht Berlin (Charlottenburg) HRA 63658\nRegisterbekanntmachung nach dem Umwandlungsgesetz 03.12.2024 (Eintragungsdatum)\n\nUIW Lux Berlin 7 GmbH & Co. KG\nKommanditgesellschaft\nBerlin\n\nZu Eintragungsnummer 1 vom 03.12.2024 wird als nicht eingetragen veröffentlicht: Den Gläubigern ist, wenn sie binnen sechs Monaten nach dem Tag, an dem die Eintragung der Umwandlung als bekannt gemacht gilt, ihren Anspruch nach Grund und Höhe schriftlich anmelden, Sicherheit zu leisten, soweit sie nicht Befriedigung verlangen können. Dieses Recht steht den Gläubigern jedoch nur zu, wenn sie glaubhaft machen, dass durch die Umwandlung die Erfüllung ihrer Forderung gefährdet wird. Das Recht, Sicherheitsleistung zu verlangen, steht Gläubigern nicht zu, die im Falle der Insolvenz ein Recht auf vorzugsweise Befriedigung aus einer Deckungsmasse haben, die nach gesetzlicher Vorschrift zu ihrem Schutz errichtet und staatlich überwacht ist."
    },
    {
      "date": "2024-12-04",
      "id": "95352",
      "original_text": "Registerbekanntmachung nach dem Umwandlungsgesetz\nBerlin Amtsgericht Berlin (Charlottenburg) HRA 63644\nUIW Lux West 3 GmbH & Co. KG – Berlin",
      "type": "Registerbekanntmachung nach dem Umwandlungsgesetz",
      "state": "Berlin",
      "amtsgericht": "Amtsgericht Berlin (Charlottenburg)",
      "registernummer": "HRA 63644",
      "registerart": "HRA",
      "company_name": "UIW Lux West 3 GmbH & Co. KG",
      "company_seat": "Berlin",
      "details": "04.12.2024 (Bekanntmachungsdatum)\n\nBerlin Amtsgericht Berlin (Charlottenburg) HRA 63644\nRegisterbekanntmachung nach dem Umwandlungsgesetz 02.12.2024 (Eintragungsdatum)\n\nUIW Lux West 3 GmbH & Co. KG\nKommanditgesellschaft\nBerlin\n\nZu Eintragungsnummer 1 vom 02.12.2024 wird als nicht eingetragen veröffentlicht: Den Gläubigern ist, wenn sie binnen sechs Monaten nach dem Tag, an dem die Eintragung der formwechselnden Umwandlung als bekannt gemacht gilt, ihren Anspruch nach Grund und Höhe schriftlich anmelden, Sicherheit zu leisten, soweit sie nicht Befriedigung verlangen können. Dieses Recht steht den Gläubigern jedoch nur zu, wenn sie glaubhaft machen, dass durch die formwechselnde Umwandlung die Erfüllung ihrer Forderung gefährdet wird. Das Recht, Sicherheitsleistung zu verlangen, steht Gläubigern nicht zu, die im Falle der Insolvenz ein Recht auf vorzugsweise Befriedigung aus einer Deckungsmasse haben, die nach gesetzlicher Vorschrift zu ihrem Schutz errichtet und staatlich überwacht ist."
    },
    {
      "date": "2024-12-04",
      "id": "95353",
      "original_text": "Registerbekanntmachung nach dem Umwandlungsgesetz\nBerlin Amtsgericht Berlin (Charlottenburg) HRA 63657\nUIW Lux Mitte GmbH & Co. KG – Berlin",
      "type": "Registerbekanntmachung nach dem Umwandlungsgesetz",
      "state": "Berlin",
      "amtsgericht": "Amtsgericht Berlin (Charlottenburg)",
      "registernummer": "HRA 63657",
      "registerart": "HRA",
      "company_name": "UIW Lux Mitte GmbH & Co. KG",
      "company_seat": "Berlin",
      "details": "04.12.2024 (Bekanntmachungsdatum)\n\nBerlin Amtsgericht Berlin (Charlottenburg) HRA 63657\nRegisterbekanntmachung nach dem Umwandlungsgesetz 03.12.2024 (Eintragungsdatum)\n\nUIW Lux Mitte GmbH & Co. KG\nKommanditgesellschaft\nBerlin\n\nZu Eintragungsnummer 1 vom 03.12.2024 wird als nicht eingetragen veröffentlicht:Den Gläubigern ist, wenn sie binnen sechs Monaten nach dem Tag, an dem die Eintragung der Umwandlung als bekannt gemacht gilt, ihren Anspruch nach Grund und Höhe schriftlich anmelden, Sicherheit zu leisten, soweit sie nicht Befriedigung verlangen können. Dieses Recht steht den Gläubigern jedoch nur zu, wenn sie glaubhaft machen, dass durch die Umwandlung die Erfüllung ihrer Forderung gefährdet wird. Das Recht, Sicherheitsleistung zu verlangen, steht Gläubigern nicht zu, die im Falle der Insolvenz ein Recht auf vorzugsweise Befriedigung aus einer Deckungsmasse haben, die nach gesetzlicher Vorschrift zu ihrem Schutz errichtet und staatlich überwacht ist."
    },
    {
      "date": "2024-12-04",
      "id": "95354",
      "original_text": "Löschungsankündigung\nBaden-Württemberg Amtsgericht Mannheim HRA 707629\nHotel Nachtigall Baden-Baden UG (haftungsbeschränkt) & Co. KG – Baden-Baden",
      "type": "Löschungsankündigung",
      "state": "Baden-Württemberg",
      "amtsgericht": "Amtsgericht Mannheim",
      "registernummer": "HRA 707629",
      "registerart": "HRA",
      "company_name": "Hotel Nachtigall Baden-Baden UG (haftungsbeschränkt) & Co. KG",
      "company_seat": "Baden-Baden",
      "details": "04.12.2024 (Bekanntmachungsdatum)\n\nBaden-Württemberg Amtsgericht Mannheim HRA 707629\nLöschungsankündigung\n\nHotel Nachtigall Baden-Baden UG (haftungsbeschränkt) & Co. KG\nKommanditgesellschaft\nBaden-Baden\n\nAls nicht eingetragen wird bekanntgemacht:\nDas Gericht beabsichtigt, die Gesellschaft wegen Vermögenslosigkeit im Handelsregister von Amts wegen nach § 394 FamFG zu löschen. Die Frist zur Geltendmachung eines Widerspruchs gegen die beabsichtigte Löschung ist auf einen Monat ab Veröffentlichung bestimmt."
    },
    {
      "date": "2024-12-04",
      "id": "95355",
      "original_text": "Registerbekanntmachung nach dem Umwandlungsgesetz\nBerlin Amtsgericht Berlin (Charlottenburg) HRA 63655\nUIW Lux Süd 2 GmbH & Co. KG – Berlin",
      "type": "Registerbekanntmachung nach dem Umwandlungsgesetz",
      "state": "Berlin",
      "amtsgericht": "Amtsgericht Berlin (Charlottenburg)",
      "registernummer": "HRA 63655",
      "registerart": "HRA",
      "company_name": "UIW Lux Süd 2 GmbH & Co. KG",
      "company_seat": "Berlin",
      "details": "04.12.2024 (Bekanntmachungsdatum)\n\nBerlin Amtsgericht Berlin (Charlottenburg) HRA 63655\nRegisterbekanntmachung nach dem Umwandlungsgesetz 03.12.2024 (Eintragungsdatum)\n\nUIW Lux Süd 2 GmbH & Co. KG\nKommanditgesellschaft\nBerlin\n\nZu Eintragungsnummer 1 vom 03.12.2024 wird als nicht eingetragen veröffentlicht: Den Gläubigern ist, wenn sie binnen sechs Monaten nach dem Tag, an dem die Eintragung der Umwandlung als bekannt gemacht gilt, ihren Anspruch nach Grund und Höhe schriftlich anmelden, Sicherheit zu leisten, soweit sie nicht Befriedigung verlangen können. Dieses Recht steht den Gläubigern jedoch nur zu, wenn sie glaubhaft machen, dass durch die Umwandlung die Erfüllung ihrer Forderung gefährdet wird. Das Recht, Sicherheitsleistung zu verlangen, steht Gläubigern nicht zu, die im Falle der Insolvenz ein Recht auf vorzugsweise Befriedigung aus einer Deckungsmasse haben, die nach gesetzlicher Vorschrift zu ihrem Schutz errichtet und staatlich überwacht ist."
    },
    {
      "date": "2024-12-04",
      "id": "95356",
      "original_text": "Registerbekanntmachung nach dem Umwandlungsgesetz\nBerlin Amtsgericht Berlin (Charlottenburg) HRA 63654\nUIW Lux Berlin 2 GmbH & Co. KG – Berlin",
      "type": "Registerbekanntmachung nach dem Umwandlungsgesetz",
      "state": "Berlin",
      "amtsgericht": "Amtsgericht Berlin (Charlottenburg)",
      "registernummer": "HRA 63654",
      "registerart": "HRA",
      "company_name": "UIW Lux Berlin 2 GmbH & Co. KG",
      "company_seat": "Berlin",
      "details": "04.12.2024 (Bekanntmachungsdatum)\n\nBerlin Amtsgericht Berlin (Charlottenburg) HRA 63654\nRegisterbekanntmachung nach dem Umwandlungsgesetz 03.12.2024 (Eintragungsdatum)\n\nUIW Lux Berlin 2 GmbH & Co. KG\nKommanditgesellschaft\nBerlin\n\nZu Eintragungsnummer 1 vom 03.12.2024 wird als nicht eingetragen veröffentlicht: Den Gläubigern ist, wenn sie binnen sechs Monaten nach dem Tag, an dem die Eintragung der Umwandlung als bekannt gemacht gilt, ihren Anspruch nach Grund und Höhe schriftlich anmelden, Sicherheit zu leisten, soweit sie nicht Befriedigung verlangen können. Dieses Recht steht den Gläubigern jedoch nur zu, wenn sie glaubhaft machen, dass durch die Umwandlung die Erfüllung ihrer Forderung gefährdet wird. Das Recht, Sicherheitsleistung zu verlangen, steht Gläubigern nicht zu, die im Falle der Insolvenz ein Recht auf vorzugsweise Befriedigung aus einer Deckungsmasse haben, die nach gesetzlicher Vorschrift zu ihrem Schutz errichtet und staatlich überwacht ist."
    },
    {
      "date": "2024-12-04",
      "id": "95357",
      "original_text": "Löschungsankündigung\nBerlin Amtsgericht Berlin (Charlottenburg) HRB 183285\nMM Metal-Trade GmbH – Berlin",
      "type": "Löschungsankündigung",
      "state": "Berlin",
      "amtsgericht": "Amtsgericht Berlin (Charlottenburg)",
      "registernummer": "HRB 183285",
      "registerart": "HRB",
      "company_name": "MM Metal-Trade GmbH",
      "company_seat": "Berlin",
      "details": "04.12.2024 (Bekanntmachungsdatum)\n\nBerlin Amtsgericht Berlin (Charlottenburg) HRB 183285\nLöschungsankündigung\n\nMM Metal-Trade GmbH\nGesellschaft mit beschränkter Haftung\nBerlin\n\nBei der nachstehenden Gesellschaft wird das Amtslöschungsverfahren gemäß § 394 FamFG eingeleitet. Widerspruchsfrist\n6 Wochen"
    },
    {
      "date": "2024-12-04",
      "id": "95358",
      "original_text": "Registerbekanntmachung nach dem Umwandlungsgesetz\nBaden-Württemberg Amtsgericht Stuttgart HRB 797379\nDie Zahnärzte im Odenheimer Hof MVZ GmbH – Leingarten",
      "type": "Registerbekanntmachung nach dem Umwandlungsgesetz",
      "state": "Baden-Württemberg",
      "amtsgericht": "Amtsgericht Stuttgart",
      "registernummer": "HRB 797379",
      "registerart": "HRB",
      "company_name": "Die Zahnärzte im Odenheimer Hof MVZ GmbH",
      "company_seat": "Leingarten",
      "details": "04.12.2024 (Bekanntmachungsdatum)\n\nBaden-Württemberg Amtsgericht Stuttgart HRB 797379\nRegisterbekanntmachung nach dem Umwandlungsgesetz 04.12.2024 (Eintragungsdatum)\n\nDie Zahnärzte im Odenheimer Hof MVZ GmbH\nGesellschaft mit beschränkter Haftung\nLeingarten\n\nAls nicht eingetragen wird bekanntgemacht:\nDen Gläubigern des an dem Formwechsel beteiligten Rechtsträgers ist, wenn sie binnen sechs Monaten nach dem Tag, an dem die Eintragung des Formwechsels in das Register des Sitzes desjenigen Rechtsträgers, dessen Gläubiger sie sind, nach § 19 Abs. 3 UmwG als bekanntgemacht gilt, ihren Anspruch nach Grund und Höhe schriftlich anmelden, Sicherheit zu leisten, soweit sie nicht Befriedigung verlangen können. Dieses Recht steht den Gläubigern jedoch nur zu, wenn sie glaubhaft machen, dass durch den Formwechsel die Erfüllung ihrer Forderung gefährdet wird."
    },
    {
      "date": "2024-12-04",
      "id": "95359",
      "original_text": "Registerbekanntmachung nach dem Umwandlungsgesetz\nBaden-Württemberg Amtsgericht Stuttgart GsR 1391\nBAG Die Zahnärzte im Odenheimer Hof eGbR – Leingarten",
      "type": "Registerbekanntmachung nach dem Umwandlungsgesetz",
      "state": "Baden-Württemberg",
      "amtsgericht": "Amtsgericht Stuttgart",
      "registernummer": "GsR 1391",
      "registerart": "GsR",
      "company_name": "BAG Die Zahnärzte im Odenheimer Hof eGbR",
      "company_seat": "Leingarten",
      "details": "04.12.2024 (Bekanntmachungsdatum)\n\nBaden-Württemberg Amtsgericht Stuttgart GsR 1391\nRegisterbekanntmachung nach dem Umwandlungsgesetz 04.12.2024 (Eintragungsdatum)\n\nBAG Die Zahnärzte im Odenheimer Hof eGbR\nGesellschaft bürgerlichen Rechts\nLeingarten\n\nAls nicht eingetragen wird bekanntgemacht:\nDen Gläubigern des an dem Formwechsel beteiligten Rechtsträgers ist, wenn sie binnen sechs Monaten nach dem Tag, an dem die Eintragung des Formwechsels in das Register des Sitzes desjenigen Rechtsträgers, dessen Gläubiger sie sind, nach § 19 Abs. 3 UmwG als bekanntgemacht gilt, ihren Anspruch nach Grund und Höhe schriftlich anmelden, Sicherheit zu leisten, soweit sie nicht Befriedigung verlangen können. Dieses Recht steht den Gläubigern jedoch nur zu, wenn sie glaubhaft machen, dass durch den Formwechsel die Erfüllung ihrer Forderung gefährdet wird."
    },
    {
      "date": "2024-12-04",
      "id": "95360",
      "original_text": "Registerbekanntmachung nach dem Umwandlungsgesetz\nBerlin Amtsgericht Berlin (Charlottenburg) HRB 210250\nPBI GmbH – Berlin",
      "type": "Registerbekanntmachung nach dem Umwandlungsgesetz",
      "state": "Berlin",
      "amtsgericht": "Amtsgericht Berlin (Charlottenburg)",
      "registernummer": "HRB 210250",
      "registerart": "HRB",
      "company_name": "PBI GmbH",
      "company_seat": "Berlin",
      "details": "04.12.2024 (Bekanntmachungsdatum)\n\nBerlin Amtsgericht Berlin (Charlottenburg) HRB 210250\nRegisterbekanntmachung nach dem Umwandlungsgesetz 02.12.2024 (Eintragungsdatum)\n\nPBI GmbH\nGesellschaft mit beschränkter Haftung\nBerlin\n\nZu Eintragungsnummer 6 vom 02.12.2024 wird als nicht eingetragen veröffentlicht: Den Gläubigern der an der Spaltung beteiligten Rechtsträger ist, wenn sie binnen sechs Monaten nach dem Tag, an dem die Eintragung der Spaltung in das Register des Sitzes desjenigen Rechtsträgers, dessen Gläubiger sie sind, als bekannt gemacht gilt, ihren Anspruch nach Grund und Höhe schriftlich anmelden, Sicherheit zu leisten, soweit sie nicht Befriedigung verlangen können. Dieses Recht steht den Gläubigern jedoch nur zu, wenn sie glaubhaft machen, dass durch die Spaltung die Erfüllung ihrer Forderung gefährdet wird. Das Recht, Sicherheitsleistung zu verlangen, steht Gläubigern nicht zu, die im Falle der Insolvenz ein Recht auf vorzugsweise Befriedigung aus einer Deckungsmasse haben, die nach gesetzlicher Vorschrift zu ihrem Schutz errichtet und staatlich überwacht ist."
    },
    {
      "date": "2024-12-04",
      "id": "95361",
      "original_text": "Registerbekanntmachung nach dem Umwandlungsgesetz\nBerlin Amtsgericht Berlin (Charlottenburg) HRB 268647\nYummy GmbH – Berlin",
      "type": "Registerbekanntmachung nach dem Umwandlungsgesetz",
      "state": "Berlin",
      "amtsgericht": "Amtsgericht Berlin (Charlottenburg)",
      "registernummer": "HRB 268647",
      "registerart": "HRB",
      "company_name": "Yummy GmbH",
      "company_seat": "Berlin",
      "details": "04.12.2024 (Bekanntmachungsdatum)\n\nBerlin Amtsgericht Berlin (Charlottenburg) HRB 268647\nRegisterbekanntmachung nach dem Umwandlungsgesetz 21.10.2024 (Eintragungsdatum)\n\nYummy GmbH\nGesellschaft mit beschränkter Haftung\nBerlin\n\nZu Eintragungsnummer 2 vom 21.10.2024 wird als nicht eingetragen veröffentlicht: Den Gläubigern ist, wenn sie binnen sechs Monaten nach dem Tag, an dem die Eintragung der Umwandlung als bekannt gemacht gilt, ihren Anspruch nach Grund und Höhe schriftlich anmelden, Sicherheit zu leisten, soweit sie nicht Befriedigung verlangen können. Dieses Recht steht den Gläubigern jedoch nur zu, wenn sie glaubhaft machen, dass durch die Umwandlung die Erfüllung ihrer Forderung gefährdet wird. Das Recht, Sicherheitsleistung zu verlangen, steht Gläubigern nicht zu, die im Falle der Insolvenz ein Recht auf vorzugsweise Befriedigung aus einer Deckungsmasse haben, die nach gesetzlicher Vorschrift zu ihrem Schutz errichtet und staatlich überwacht ist."
    },
    {
      "date": "2024-12-04",
      "id": "95362",
      "original_text": "Löschungsankündigung\nMecklenburg-Vorpommern Amtsgericht Stralsund HRB 2695 früher Amtsgericht Rostock\nBESTWOOD E.F. Kynder GmbH – Ribnitz-Damgarten",
      "type": "Löschungsankündigung",
      "state": "Mecklenburg-Vorpommern",
      "amtsgericht": "Amtsgericht Stralsund",
      "registernummer": "HRB 2695",
      "registerart": "HRB",
      "company_name": "BESTWOOD E.F. Kynder GmbH",
      "company_seat": "Ribnitz-Damgarten",
      "former_amtsgericht": "Rostock",
      "details": "04.12.2024 (Bekanntmachungsdatum)\n\nMecklenburg-Vorpommern Amtsgericht Stralsund HRB 2695 früher Amtsgericht Rostock\nLöschungsankündigung 04.12.2024 (Eintragungsdatum)\n\nBESTWOOD E.F. Kynder GmbH\nGesellschaft mit beschränkter Haftung\nRibnitz-Damgarten\n\nDas Registergericht beabsichtigt, die im Handelsregister eingetragene Gesellschaft von Amts wegen nach § 394 FamFG zu löschen. Die Frist zur Erhebung eines Widerspruchs gegen die beabsichtigte Löschung wird auf 1 Monat festgesetzt."
    },
    {
      "date": "2024-12-04",
      "id": "95363",
      "original_text": "Einreichung neuer Dokumente\nBerlin Amtsgericht Berlin (Charlottenburg) HRB 87492\nVivantes Rehabilitation GmbH – Berlin",
      "type": "Einreichung neuer Dokumente",
      "state": "Berlin",
      "amtsgericht": "Amtsgericht Berlin (Charlottenburg)",
      "registernummer": "HRB 87492",
      "registerart": "HRB",
      "company_name": "Vivantes Rehabilitation GmbH",
      "company_seat": "Berlin",
      "details": "04.12.2024 (Bekanntmachungsdatum)\n\nBerlin Amtsgericht Berlin (Charlottenburg) HRB 87492\nEinreichung neuer Dokumente\n\nVivantes Rehabilitation GmbH\nGesellschaft mit beschränkter Haftung\nBerlin\n\nAls nicht eingetragen wird veröffentlicht:Es wurde eine neue Liste der Aufsichtsratsmitglieder eingereicht (§52 GmbHG)."
    },
    {
      "date": "2024-12-04",
      "id": "95364",
      "original_text": "Einreichung neuer Dokumente\nBaden-Württemberg Amtsgericht Mannheim HRB 337365\nStadtwerke Neckargemünd GmbH – Neckargemünd",
      "type": "Einreichung neuer Dokumente",
      "state": "Baden-Württemberg",
      "amtsgericht": "Amtsgericht Mannheim",
      "registernummer": "HRB 337365",
      "registerart": "HRB",
      "company_name": "Stadtwerke Neckargemünd GmbH",
      "company_seat": "Neckargemünd",
      "details": "04.12.2024 (Bekanntmachungsdatum)\n\nBaden-Württemberg Amtsgericht Mannheim HRB 337365\nEinreichung neuer Dokumente\n\nStadtwerke Neckargemünd GmbH\nGesellschaft mit beschränkter Haftung\nNeckargemünd\n\nDie Gesellschaft hat am 29.11.2024 die Liste über die Zusammensetzung des Aufsichtsrats zum Handelsregister eingereicht."
    },
    {
      "date": "2024-12-04",
      "id": "95365",
      "original_text": "Einreichung neuer Dokumente\nBaden-Württemberg Amtsgericht Stuttgart HRB 740510\nTransnetBW GmbH – Stuttgart",
      "type": "Einreichung neuer Dokumente",
      "state": "Baden-Württemberg",
      "amtsgericht": "Amtsgericht Stuttgart",
      "registernummer": "HRB 740510",
      "registerart": "HRB",
      "company_name": "TransnetBW GmbH",
      "company_seat": "Stuttgart",
      "details": "04.12.2024 (Bekanntmachungsdatum)\n\nBaden-Württemberg Amtsgericht Stuttgart HRB 740510\nEinreichung neuer Dokumente\n\nTransnetBW GmbH\nGesellschaft mit beschränkter Haftung\nStuttgart\n\nDie Gesellschaft hat am 03.12.2024 die Liste über die Zusammensetzung des Aufsichtsrats zum Handelsregister eingereicht."
    },
    {
      "date": "2024-12-04",
      "id": "95366",
      "original_text": "Löschungsankündigung\nBrandenburg Amtsgericht Frankfurt/Oder HRB 12356\nZKV Kunststoffverwertungs-GmbH – Eisenhüttenstadt",
      "type": "Löschungsankündigung",
      "state": "Brandenburg",
      "amtsgericht": "Amtsgericht Frankfurt/Oder",
      "registernummer": "HRB 12356",
      "registerart": "HRB",
      "company_name": "ZKV Kunststoffverwertungs-GmbH",
      "company_seat": "Eisenhüttenstadt",
      "details": "04.12.2024 (Bekanntmachungsdatum)\n\nBrandenburg Amtsgericht Frankfurt/Oder HRB 12356\nLöschungsankündigung\n\nZKV Kunststoffverwertungs-GmbH\nGesellschaft mit beschränkter Haftung\nEisenhüttenstadt\n\nBei der nachstehenden Gesellschaft wird das Amtslöschungsverfahren gemäß § 394 Abs. 1 FamFG eingeleitet."
    },
    {
      "date": "2024-12-04",
      "id": "95367",
      "original_text": "Sonstige Registerbekanntmachung\nBerlin Amtsgericht Berlin (Charlottenburg) HRB 15220\nHawitas Berlin GmbH – Berlin",
      "type": "Sonstige Registerbekanntmachung",
      "state": "Berlin",
      "amtsgericht": "Amtsgericht Berlin (Charlottenburg)",
      "registernummer": "HRB 15220",
      "registerart": "HRB",
      "company_name": "Hawitas Berlin GmbH",
      "company_seat": "Berlin",
      "details": "04.12.2024 (Bekanntmachungsdatum)\n\nBerlin Amtsgericht Berlin (Charlottenburg) HRB 15220\nSonstige Registerbekanntmachung\n\nHawitas Berlin GmbH\nGesellschaft mit beschränkter Haftung\nBerlin\n\nAls nicht eingetragen wird veröffentlicht: Der andere Vertragsteil hat den Gläubigern dieses Rechtsträgers, deren Forderungen begründet worden sind, bevor die Eintragung der Beendigung dieses Vertrages in das Handelsregister nach § 10 des Handelsgesetzbuches als bekannt gemacht gilt, Sicherheit zu leisten, wenn sie sich binnen sechs Monaten nach der Bekanntmachung der Eintragung zu diesem Zweck bei ihm melden. Dieses Recht steht den Gläubigern nicht zu, die im Fall des Insolvenzverfahrens ein Recht auf vorzugsweise Befriedigung aus der Deckungsmasse haben, die nach gesetzlicher Vorschrift zu ihrem Schutz errichtet und staatlich überwacht ist."
    },
    {
      "date": "2024-12-04",
      "id": "95368",
      "original_text": "Registerbekanntmachung nach dem Umwandlungsgesetz\nSachsen-Anhalt Amtsgericht Stendal HRB 23611\nSILUX 2. (zweite) Wind Beteiligungs GmbH – Osterburg (Altmark)",
      "type": "Registerbekanntmachung nach dem Umwandlungsgesetz",
      "state": "Sachsen-Anhalt",
      "amtsgericht": "Amtsgericht Stendal",
      "registernummer": "HRB 23611",
      "registerart": "HRB",
      "company_name": "SILUX 2. (zweite) Wind Beteiligungs GmbH",
      "company_seat": "Osterburg (Altmark)",
      "details": "04.12.2024 (Bekanntmachungsdatum)\n\nSachsen-Anhalt Amtsgericht Stendal HRB 23611\nRegisterbekanntmachung nach dem Umwandlungsgesetz 04.12.2024 (Eintragungsdatum)\n\nSILUX 2. (zweite) Wind Beteiligungs GmbH\nGesellschaft mit beschränkter Haftung\nOsterburg (Altmark)\n\nNicht eingetragen:\nDen Gläubigern des formwechselnden  Rechtsträgers, ist wenn sie binnen sechs Monaten nach dem Tag, an dem die Eintragung des Formwechsels nach § 201 UmwG als bekanntgemacht gilt, ihren Anspruch nach Grund und Höhe schriftlich anmelden, Sicherheit zu leisten, soweit sie nicht Befriedigung verlangen können. Dieses Recht steht ihnen jedoch nur zu, wenn sie glaubhaft machen, dass durch den Formwechsel die Erfüllung ihrer Forderung gefährdet wird."
    },
    {
      "date": "2024-12-04",
      "id": "95369",
      "original_text": "Registerbekanntmachung nach dem Umwandlungsgesetz\nSachsen-Anhalt Amtsgericht Stendal HRB 21602\nSILUX 1. Wind Beteiligungs GmbH – Osterburg (Altmark)",
      "type": "Registerbekanntmachung nach dem Umwandlungsgesetz",
      "state": "Sachsen-Anhalt",
      "amtsgericht": "Amtsgericht Stendal",
      "registernummer": "HRB 21602",
      "registerart": "HRB",
      "company_name": "SILUX 1. Wind Beteiligungs GmbH",
      "company_seat": "Osterburg (Altmark)",
      "details": "04.12.2024 (Bekanntmachungsdatum)\n\nSachsen-Anhalt Amtsgericht Stendal HRB 21602\nRegisterbekanntmachung nach dem Umwandlungsgesetz 04.12.2024 (Eintragungsdatum)\n\nSILUX 1. Wind Beteiligungs GmbH\nGesellschaft mit beschränkter Haftung\nOsterburg (Altmark)\n\nNicht eingetragen:\nDen Gläubigern des formwechselnden  Rechtsträgers, ist wenn sie binnen sechs Monaten nach dem Tag, an dem die Eintragung des Formwechsels nach § 201 UmwG als bekanntgemacht gilt, ihren Anspruch nach Grund und Höhe schriftlich anmelden, Sicherheit zu leisten, soweit sie nicht Befriedigung verlangen können. Dieses Recht steht ihnen jedoch nur zu, wenn sie glaubhaft machen, dass durch den Formwechsel die Erfüllung ihrer Forderung gefährdet wird."
    },
    {
      "date": "2024-12-04",
      "id": "95370",
      "original_text": "Registerbekanntmachung nach dem Umwandlungsgesetz\nBaden-Württemberg Amtsgericht Stuttgart HRB 737561\nBühler Abbruch GmbH – Plüderhausen",
      "type": "Registerbekanntmachung nach dem Umwandlungsgesetz",
      "state": "Baden-Württemberg",
      "amtsgericht": "Amtsgericht Stuttgart",
      "registernummer": "HRB 737561",
      "registerart": "HRB",
      "company_name": "Bühler Abbruch GmbH",
      "company_seat": "Plüderhausen",
      "details": "04.12.2024 (Bekanntmachungsdatum)\n\nBaden-Württemberg Amtsgericht Stuttgart HRB 737561\nRegisterbekanntmachung nach dem Umwandlungsgesetz 04.12.2024 (Eintragungsdatum)\n\nBühler Abbruch GmbH\nGesellschaft mit beschränkter Haftung\nPlüderhausen\n\nAls nicht eingetragen wird bekanntgemacht:\nDen Gläubigern der an der Verschmelzung beteiligten Rechtsträger ist, wenn sie binnen sechs Monaten nach dem Tag, an dem die Eintragung der Verschmelzung in das Register des Sitzes desjenigen Rechtsträgers, dessen Gläubiger sie sind, nach § 19 Abs. 3 UmwG als bekanntgemacht gilt, ihren Anspruch nach Grund und Höhe schriftlich anmelden, Sicherheit zu leisten, soweit sie nicht Befriedigung verlangen können. Dieses Recht steht den Gläubigern jedoch nur zu, wenn sie glaubhaft machen, dass durch die Verschmelzung die Erfüllung ihrer Forderung gefährdet wird."
    },
    {
      "date": "2024-12-04",
      "id": "95371",
      "original_text": "Löschungsankündigung\nBrandenburg Amtsgericht Frankfurt/Oder VR 5916\nFreundeskreis der Stadt- und Regionalbibliothek Frankfurt (Oder) e. V. – Frankfurt (Oder)",
      "type": "Löschungsankündigung",
      "state": "Brandenburg",
      "amtsgericht": "Amtsgericht Frankfurt/Oder",
      "registernummer": "VR 5916",
      "registerart": "VR",
      "company_name": "Freundeskreis der Stadt- und Regionalbibliothek Frankfurt (Oder) e. V.",
      "company_seat": "Frankfurt (Oder)",
      "details": "04.12.2024 (Bekanntmachungsdatum)\n\nBrandenburg Amtsgericht Frankfurt/Oder VR 5916\nLöschungsankündigung\n\nFreundeskreis der Stadt- und Regionalbibliothek Frankfurt (Oder) e. V.\neingetragener Verein\nFrankfurt (Oder)\n\nBei der nachstehenden Gesellschaft/dem nachstehenden Verein wird das Amtslöschungsverfahren gemäß § 395 FamFG eingeleitet."
    },
    {
      "date": "2024-12-04",
      "id": "95372",
      "original_text": "Sonstige Registerbekanntmachung\nHamburg Amtsgericht Hamburg HRB 144405\nBÖAG Projekt Aktiengesellschaft – Hamburg",
      "type": "Sonstige Registerbekanntmachung",
      "state": "Hamburg",
      "amtsgericht": "Amtsgericht Hamburg",
      "registernummer": "HRB 144405",
      "registerart": "HRB",
      "company_name": "BÖAG Projekt Aktiengesellschaft",
      "company_seat": "Hamburg",
      "details": "04.12.2024 (Bekanntmachungsdatum)\n\nHamburg Amtsgericht Hamburg HRB 144405\nSonstige Registerbekanntmachung\n\nBÖAG Projekt Aktiengesellschaft\nAktiengesellschaft\nHamburg\n\nAls nicht eingetragen wird bekannt gemacht: Liste des Aufsichtsrats wurde eingereicht."
    },
    {
      "date": "2024-12-04",
      "id": "95373",
      "original_text": "Registerbekanntmachung nach dem Umwandlungsgesetz\nSchleswig-Holstein Amtsgericht Kiel HRB 20752\nVAMED Real Estate Deutschland GmbH – Damp",
      "type": "Registerbekanntmachung nach dem Umwandlungsgesetz",
      "state": "Schleswig-Holstein",
      "amtsgericht": "Amtsgericht Kiel",
      "registernummer": "HRB 20752",
      "registerart": "HRB",
      "company_name": "VAMED Real Estate Deutschland GmbH",
      "company_seat": "Damp",
      "details": "04.12.2024 (Bekanntmachungsdatum)\n\nSchleswig-Holstein Amtsgericht Kiel HRB 20752\nRegisterbekanntmachung nach dem Umwandlungsgesetz 03.12.2024 (Eintragungsdatum)\n\nVAMED Real Estate Deutschland GmbH\nGesellschaft mit beschränkter Haftung\nDamp\n\nZu Eintragungsnummer 4 vom 03.12.2024 wird als nicht eingetragen veröffentlicht: Den Gläubigern der Gesellschaft, deren Forderungen begründet worden sind, bevor die Eintragung der Beendigung des Vertrages in das Handelsregister nach § 10 HGB bekannt gemacht worden ist, ist vom anderen Vertragspartner Sicherheit zu leisten, wenn sie sich binnen sechs Monaten nach Bekanntmachung der Eintragung zu diesem Zweck bei ihm melden."
    },
    {
      "date": "2024-12-04",
      "id": "95374",
      "original_text": "Einreichung neuer Dokumente\nBaden-Württemberg Amtsgericht Ulm HRB 632124\nKlinikum Friedrichshafen GmbH – Friedrichshafen",
      "type": "Einreichung neuer Dokumente",
      "state": "Baden-Württemberg",
      "amtsgericht": "Amtsgericht Ulm",
      "registernummer": "HRB 632124",
      "registerart": "HRB",
      "company_name": "Klinikum Friedrichshafen GmbH",
      "company_seat": "Friedrichshafen",
      "details": "04.12.2024 (Bekanntmachungsdatum)\n\nBaden-Württemberg Amtsgericht Ulm HRB 632124\nEinreichung neuer Dokumente\n\nKlinikum Friedrichshafen GmbH\nGesellschaft mit beschränkter Haftung\nFriedrichshafen\n\nDie Gesellschaft hat am 04.12.2024 die Liste über die Zusammensetzung des Aufsichtsrats zum Handelsregister eingereicht."
    },
    {
      "date": "2024-12-04",
      "id": "95375",
      "original_text": "Löschungsankündigung\nSaarland Amtsgericht Saarbrücken HRB 16994\nFiedler GmbH – Wadern",
      "type": "Löschungsankündigung",
      "state": "Saarland",
      "amtsgericht": "Amtsgericht Saarbrücken",
      "registernummer": "HRB 16994",
      "registerart": "HRB",
      "company_name": "Fiedler GmbH",
      "company_seat": "Wadern",
      "details": "04.12.2024 (Bekanntmachungsdatum)\n\nSaarland Amtsgericht Saarbrücken HRB 16994\nLöschungsankündigung\n\nFiedler GmbH\nGesellschaft mit beschränkter Haftung\nWadern\n\n.Es ist beabsichtigt, die Gesellschaft von Amts wegen gemäß § 394 FamFG wegen Vermögenslosigkeit zu löschen. Gegen die Löschung von Amts wegen ist das Rechtsmittel des Widerspruchs statthaft. Der Widerspruch ist binnen einer Frist von 3 Monaten beginnend mit dem Tag dieser Veröffentlichung durch Einreichen eines Widerspruchsschreibens -schriftlich oder zur Niederschrift der Geschäftsstelle- beim Amtsgericht Saarbrücken, -zentrales Handelsregister-, Mainzerstr.178, 66121 Saarbrücken einzulegen. Der Widerspruch muss die Bezeichnung der angefochtenen Löschungsankündigung enthalten sowie die Erklärung, dass Widerspruch eingelegt wird. Er ist vom Widerspruchsführer oder seinem Bevollmächtigten zu unterzeichnen.\nDas Widerspruchsschreiben kann auch in der Form eines elektronischen Dokumentes eingereicht werden, das mit einer qualifizierten elektronischen Signatur nach dem Signaturgesetz versehen sein muss (§§ 14 Abs. 2 FamFG, 130a, 298 ZPO)"
    },
    {
      "date": "2024-12-04",
      "id": "95376",
      "original_text": "Einreichung neuer Dokumente\nBerlin Amtsgericht Berlin (Charlottenburg) HRB 105569\nGrow In AG – Berlin",
      "type": "Einreichung neuer Dokumente",
      "state": "Berlin",
      "amtsgericht": "Amtsgericht Berlin (Charlottenburg)",
      "registernummer": "HRB 105569",
      "registerart": "HRB",
      "company_name": "Grow In AG",
      "company_seat": "Berlin",
      "details": "04.12.2024 (Bekanntmachungsdatum)\n\nBerlin Amtsgericht Berlin (Charlottenburg) HRB 105569\nEinreichung neuer Dokumente\n\nGrow In AG\nAktiengesellschaft\nBerlin\n\nAls nicht eingetragen wird veröffentlicht: Es wurde eine neue Liste der Aufsichtsratsmitglieder eingereicht (§ 106 AktG)."
    },
    {
      "date": "2024-12-04",
      "id": "95377",
      "original_text": "Registerbekanntmachung nach dem Umwandlungsgesetz\nBrandenburg Amtsgericht Potsdam GsR 80\nSWS Grundbesitz und Service eGbR – Brück",
      "type": "Registerbekanntmachung nach dem Umwandlungsgesetz",
      "state": "Brandenburg",
      "amtsgericht": "Amtsgericht Potsdam",
      "registernummer": "GsR 80",
      "registerart": "GsR",
      "company_name": "SWS Grundbesitz und Service eGbR",
      "company_seat": "Brück",
      "details": "04.12.2024 (Bekanntmachungsdatum)\n\nBrandenburg Amtsgericht Potsdam GsR 80\nRegisterbekanntmachung nach dem Umwandlungsgesetz 29.11.2024 (Eintragungsdatum)\n\nSWS Grundbesitz und Service eGbR\nGesellschaft bürgerlichen Rechts\nBrück\n\nZu Eintragungsnummer 2 vom 29.11.2024 wird als nicht eingetragen veröffentlicht: Den Gläubigern des formwechselnden Rechtsträgers  ist, wenn sie binnen sechs Monaten nach dem Tag, an dem die Eintragung des Formwechsels nach § 201 UmwG als bekannt gemacht gilt, ihren Anspruch nach Grund und Höhe schriftlich anmelden, Sicherheit zu leisten, soweit sie nicht Befriedigung verlangen können. Dieses Recht steht den Gläubigern jedoch nur zu, wenn sie glaubhaft machen, dass durch den Formwechsel die Erfüllung ihrer Forderung gefährdet wird."
    },
    {
      "date": "2024-12-04",
      "id": "95378",
      "original_text": "Registerbekanntmachung nach dem Umwandlungsgesetz\nHamburg Amtsgericht Hamburg HRB 154588\nZytoPlus Verwaltungs GmbH – Hamburg",
      "type": "Registerbekanntmachung nach dem Umwandlungsgesetz",
      "state": "Hamburg",
      "amtsgericht": "Amtsgericht Hamburg",
      "registernummer": "HRB 154588",
      "registerart": "HRB",
      "company_name": "ZytoPlus Verwaltungs GmbH",
      "company_seat": "Hamburg",
      "details": "04.12.2024 (Bekanntmachungsdatum)\n\nHamburg Amtsgericht Hamburg HRB 154588\nRegisterbekanntmachung nach dem Umwandlungsgesetz 04.12.2024 (Eintragungsdatum)\n\nZytoPlus Verwaltungs GmbH\nGesellschaft mit beschränkter Haftung\nHamburg\n\nAls nicht eingetragen wird bekannt gemacht:\nDen Gläubigern der an der Verschmelzung beteiligten Gesellschaften ist, wenn sie binnen sechs Monaten nach dem Tag, an dem die Eintragung der Verschmelzung in das Register des Sitzes desjenigen Rechtsträgers, dessen Gläubiger sie sind, nach § 19 Absatz 3 UmwG als bekannt gemacht gilt, ihren Anspruch nach Grund und Höhe schriftlich anmelden, Sicherheit zu leisten, soweit sie nicht Befriedigung verlangen können. Dieses Recht steht den Gläubigern jedoch nur zu, wenn sie glaubhaft machen, dass durch die Verschmelzung die Erfüllung ihrer Forderung gefährdet wird."
    },
    {
      "date": "2024-12-04",
      "id": "95379",
      "original_text": "Registerbekanntmachung nach dem Umwandlungsgesetz\nHamburg Amtsgericht Hamburg HRB 102568\nZytoService Deutschland GmbH – Hamburg",
      "type": "Registerbekanntmachung nach dem Umwandlungsgesetz",
      "state": "Hamburg",
      "amtsgericht": "Amtsgericht Hamburg",
      "registernummer": "HRB 102568",
      "registerart": "HRB",
      "company_name": "ZytoService Deutschland GmbH",
      "company_seat": "Hamburg",
      "details": "04.12.2024 (Bekanntmachungsdatum)\n\nHamburg Amtsgericht Hamburg HRB 102568\nRegisterbekanntmachung nach dem Umwandlungsgesetz 04.12.2024 (Eintragungsdatum)\n\nZytoService Deutschland GmbH\nGesellschaft mit beschränkter Haftung\nHamburg\n\nAls nicht eingetragen wird bekannt gemacht:\nDen Gläubigern der an der Verschmelzung beteiligten Gesellschaften ist, wenn sie binnen sechs Monaten nach dem Tag, an dem die Eintragung der Verschmelzung in das Register des Sitzes desjenigen Rechtsträgers, dessen Gläubiger sie sind, nach § 19 Absatz 3 UmwG als bekannt gemacht gilt, ihren Anspruch nach Grund und Höhe schriftlich anmelden, Sicherheit zu leisten, soweit sie nicht Befriedigung verlangen können. Dieses Recht steht den Gläubigern jedoch nur zu, wenn sie glaubhaft machen, dass durch die Verschmelzung die Erfüllung ihrer Forderung gefährdet wird."
    },
    {
      "date": "2024-12-04",
      "id": "95380",
      "original_text": "Registerbekanntmachung nach dem Umwandlungsgesetz\nBerlin Amtsgericht Berlin (Charlottenburg) HRB 157759\nTele Columbus Sachsen-Anhalt GmbH – Berlin",
      "type": "Registerbekanntmachung nach dem Umwandlungsgesetz",
      "state": "Berlin",
      "amtsgericht": "Amtsgericht Berlin (Charlottenburg)",
      "registernummer": "HRB 157759",
      "registerart": "HRB",
      "company_name": "Tele Columbus Sachsen-Anhalt GmbH",
      "company_seat": "Berlin",
      "details": "04.12.2024 (Bekanntmachungsdatum)\n\nBerlin Amtsgericht Berlin (Charlottenburg) HRB 157759\nRegisterbekanntmachung nach dem Umwandlungsgesetz 03.12.2024 (Eintragungsdatum)\n\nTele Columbus Sachsen-Anhalt GmbH\nGesellschaft mit beschränkter Haftung\nBerlin\n\nZu Eintragungsnummer 24 vom 03.12.2024 wird als nicht eingetragen veröffentlicht:  Den Gläubigern der an der Verschmelzung beteiligten Rechtsträger ist, wenn sie binnen sechs Monaten nach dem Tag, an dem die Eintragung der Verschmelzung in das Register des Sitzes desjenigen Rechtsträgers, dessen Gläubiger sie sind, als bekannt gemacht gilt, ihren Anspruch nach Grund und Höhe schriftlich anmelden, Sicherheit zu leisten, soweit sie nicht Befriedigung verlangen können. Dieses Recht steht den Gläubigern jedoch nur zu, wenn sie glaubhaft machen, dass durch die Verschmelzung die Erfüllung ihrer Forderung gefährdet wird. Das Recht, Sicherheitsleistung zu verlangen, steht Gläubigern nicht zu, die im Falle der Insolvenz ein Recht auf vorzugsweise Befriedigung aus einer Deckungsmasse haben, die nach gesetzlicher Vorschrift zu ihrem Schutz errichtet und staatlich überwacht ist."
    },
    {
      "date": "2024-12-04",
      "id": "95381",
      "original_text": "Löschungsankündigung\nBerlin Amtsgericht Berlin (Charlottenburg) HRB 172315\nSRC KRAFT GmbH – Berlin",
      "type": "Löschungsankündigung",
      "state": "Berlin",
      "amtsgericht": "Amtsgericht Berlin (Charlottenburg)",
      "registernummer": "HRB 172315",
      "registerart": "HRB",
      "company_name": "SRC KRAFT GmbH",
      "company_seat": "Berlin",
      "details": "04.12.2024 (Bekanntmachungsdatum)\n\nBerlin Amtsgericht Berlin (Charlottenburg) HRB 172315\nLöschungsankündigung\n\nSRC KRAFT GmbH\nGesellschaft mit beschränkter Haftung\nBerlin\n\nBei der nachstehenden Gesellschaft wird das Amtslöschungsverfahren gemäß § 394 FamFG eingeleitet. Widerspruchsfrist\n6 Wochen"
    },
    {
      "date": "2024-12-04",
      "id": "95382",
      "original_text": "Löschungsankündigung\nBrandenburg Amtsgericht Potsdam HRB 32803\nPuhui Import und Export GmbH – Brandenburg an der Havel",
      "type": "Löschungsankündigung",
      "state": "Brandenburg",
      "amtsgericht": "Amtsgericht Potsdam",
      "registernummer": "HRB 32803",
      "registerart": "HRB",
      "company_name": "Puhui Import und Export GmbH",
      "company_seat": "Brandenburg an der Havel",
      "details": "04.12.2024 (Bekanntmachungsdatum)\n\nBrandenburg Amtsgericht Potsdam HRB 32803\nLöschungsankündigung\n\nPuhui Import und Export GmbH\nGesellschaft mit beschränkter Haftung\nBrandenburg an der Havel\n\nBei der nachstehenden Gesellschaft wird das Amtslöschungsverfahren gemäß § 394 FamFG eingeleitet. Widerspruchsfrist: 8 Wochen"
    },
    {
      "date": "2024-12-04",
      "id": "95383",
      "original_text": "Löschungsankündigung\nBaden-Württemberg Amtsgericht Mannheim HRB 712501\nRND Rhein Neckar Dach GmbH – Weinheim",
      "type": "Löschungsankündigung",
      "state": "Baden-Württemberg",
      "amtsgericht": "Amtsgericht Mannheim",
      "registernummer": "HRB 712501",
      "registerart": "HRB",
      "company_name": "RND Rhein Neckar Dach GmbH",
      "company_seat": "Weinheim",
      "details": "04.12.2024 (Bekanntmachungsdatum)\n\nBaden-Württemberg Amtsgericht Mannheim HRB 712501\nLöschungsankündigung\n\nRND Rhein Neckar Dach GmbH\nGesellschaft mit beschränkter Haftung\nWeinheim\n\nDas Gericht beabsichtigt, die Gesellschaft wegen Vermögenslosigkeit im Handelsregister von Amts wegen nach § 394 FamFG zu löschen. Die Frist zur Geltendmachung eines Widerspruchs gegen die beabsichtigte Löschung ist auf einen Monat ab Veröffentlichung bestimmt."
    },
    {
      "date": "2024-12-04",
      "id": "95384",
      "original_text": "Einreichung neuer Dokumente\nSachsen-Anhalt Amtsgericht Stendal HRB 11008\nStadtwerke Bernburg GmbH – Bernburg (Saale)",
      "type": "Einreichung neuer Dokumente",
      "state": "Sachsen-Anhalt",
      "amtsgericht": "Amtsgericht Stendal",
      "registernummer": "HRB 11008",
      "registerart": "HRB",
      "company_name": "Stadtwerke Bernburg GmbH",
      "company_seat": "Bernburg (Saale)",
      "details": "04.12.2024 (Bekanntmachungsdatum)\n\nSachsen-Anhalt Amtsgericht Stendal HRB 11008\nEinreichung neuer Dokumente\n\nStadtwerke Bernburg GmbH\nGesellschaft mit beschränkter Haftung\nBernburg (Saale)\n\nEine Liste der Mitglieder des Aufsichtsrates wurde zum Handelsregister eingereicht."
    },
    {
      "date": "2024-12-04",
      "id": "95385",
      "original_text": "Löschungsankündigung\nBaden-Württemberg Amtsgericht Mannheim HRB 735412\nMoh Transport & Baggerarbeiten GmbH – Lobbach",
      "type": "Löschungsankündigung",
      "state": "Baden-Württemberg",
      "amtsgericht": "Amtsgericht Mannheim",
      "registernummer": "HRB 735412",
      "registerart": "HRB",
      "company_name": "Moh Transport & Baggerarbeiten GmbH",
      "company_seat": "Lobbach",
      "details": "04.12.2024 (Bekanntmachungsdatum)\n\nBaden-Württemberg Amtsgericht Mannheim HRB 735412\nLöschungsankündigung\n\nMoh Transport & Baggerarbeiten GmbH\nGesellschaft mit beschränkter Haftung\nLobbach\n\nDas Gericht beabsichtigt, die Gesellschaft wegen Vermögenslosigkeit im Handelsregister von Amts wegen nach § 394 FamFG zu löschen. Die Frist zur Geltendmachung eines Widerspruchs gegen die beabsichtigte Löschung ist auf einen Monat ab Veröffentlichung bestimmt."
    },
    {
      "date": "2024-12-04",
      "id": "95386",
      "original_text": "Löschungsankündigung\nBaden-Württemberg Amtsgericht Mannheim HRB 714030\nPMS Solartechnik Verwaltungs GmbH – Eberbach",
      "type": "Löschungsankündigung",
      "state": "Baden-Württemberg",
      "amtsgericht": "Amtsgericht Mannheim",
      "registernummer": "HRB 714030",
      "registerart": "HRB",
      "company_name": "PMS Solartechnik Verwaltungs GmbH",
      "company_seat": "Eberbach",
      "details": "04.12.2024 (Bekanntmachungsdatum)\n\nBaden-Württemberg Amtsgericht Mannheim HRB 714030\nLöschungsankündigung\n\nPMS Solartechnik Verwaltungs GmbH\nGesellschaft mit beschränkter Haftung\nEberbach\n\nDas Gericht beabsichtigt, die Gesellschaft wegen Vermögenslosigkeit im Handelsregister von Amts wegen nach § 394 FamFG zu löschen. Die Frist zur Geltendmachung eines Widerspruchs gegen die beabsichtigte Löschung ist auf einen Monat ab Veröffentlichung bestimmt."
    },
    {
      "date": "2024-12-04",
      "id": "95387",
      "original_text": "Sonstige Registerbekanntmachung\nSchleswig-Holstein Amtsgericht Kiel HRB 20745\nVAMED Care Deutschland GmbH – Damp",
      "type": "Sonstige Registerbekanntmachung",
      "state": "Schleswig-Holstein",
      "amtsgericht": "Amtsgericht Kiel",
      "registernummer": "HRB 20745",
      "registerart": "HRB",
      "company_name": "VAMED Care Deutschland GmbH",
      "company_seat": "Damp",
      "details": "04.12.2024 (Bekanntmachungsdatum)\n\nSchleswig-Holstein Amtsgericht Kiel HRB 20745\nSonstige Registerbekanntmachung\n\nVAMED Care Deutschland GmbH\nGesellschaft mit beschränkter Haftung\nDamp\n\nAls nicht eingetragen wird veröffentlicht: Den Gläubigern der Gesellschaft, deren Forderungen begründet worden sind, bevor die Eintragung der Beendigung des Vertrages in das Handelsregister nach § 10 HGB bekannt gemacht worden ist, ist vom anderen Vertragspartner Sicherheit zu leisten, wenn sie sich binnen sechs Monaten nach Bekanntmachung der Eintragung zu diesem Zweck bei ihm melden."
    },
    {
      "date": "2024-12-04",
      "id": "95388",
      "original_text": "Löschungsankündigung\nBerlin Amtsgericht Berlin (Charlottenburg) HRB 220505\nStarpost 030 GmbH – Berlin",
      "type": "Löschungsankündigung",
      "state": "Berlin",
      "amtsgericht": "Amtsgericht Berlin (Charlottenburg)",
      "registernummer": "HRB 220505",
      "registerart": "HRB",
      "company_name": "Starpost 030 GmbH",
      "company_seat": "Berlin",
      "details": "04.12.2024 (Bekanntmachungsdatum)\n\nBerlin Amtsgericht Berlin (Charlottenburg) HRB 220505\nLöschungsankündigung\n\nStarpost 030 GmbH\nGesellschaft mit beschränkter Haftung\nBerlin\n\nBei der nachstehenden Gesellschaft wird das Amtslöschungsverfahren gemäß § 394 FamFG eingeleitet. Widerspruchsfrist 6 Wochen"
    },
    {
      "date": "2024-12-04",
      "id": "95389",
      "original_text": "Registerbekanntmachung nach dem Umwandlungsgesetz\nBerlin Amtsgericht Berlin (Charlottenburg) HRA 62632\nSKP Verbundgesellschaft mbH & Co. KG – Berlin",
      "type": "Registerbekanntmachung nach dem Umwandlungsgesetz",
      "state": "Berlin",
      "amtsgericht": "Amtsgericht Berlin (Charlottenburg)",
      "registernummer": "HRA 62632",
      "registerart": "HRA",
      "company_name": "SKP Verbundgesellschaft mbH & Co. KG",
      "company_seat": "Berlin",
      "details": "04.12.2024 (Bekanntmachungsdatum)\n\nBerlin Amtsgericht Berlin (Charlottenburg) HRA 62632\nRegisterbekanntmachung nach dem Umwandlungsgesetz 02.12.2024 (Eintragungsdatum)\n\nSKP Verbundgesellschaft mbH & Co. KG\nKommanditgesellschaft\nBerlin\n\nZu Eintragungsnummer 3 vom 02.12.2024 wird als nicht eingetragen veröffentlicht: Den Gläubigern der an der Spaltung beteiligten Rechtsträger ist, wenn sie binnen sechs Monaten nach dem Tag, an dem die Eintragung der Spaltung in das Register des Sitzes desjenigen Rechtsträgers, dessen Gläubiger sie sind, als bekannt gemacht gilt, ihren Anspruch nach Grund und Höhe schriftlich anmelden, Sicherheit zu leisten, soweit sie nicht Befriedigung verlangen können. Dieses Recht steht den Gläubigern jedoch nur zu, wenn sie glaubhaft machen, dass durch die Spaltung die Erfüllung ihrer Forderung gefährdet wird. Das Recht, Sicherheitsleistung zu verlangen, steht Gläubigern nicht zu, die im Falle der Insolvenz ein Recht auf vorzugsweise Befriedigung aus einer Deckungsmasse haben, die nach gesetzlicher Vorschrift zu ihrem Schutz errichtet und staatlich überwacht ist."
    },
    {
      "date": "2024-12-04",
      "id": "95390",
      "original_text": "Registerbekanntmachung nach dem Umwandlungsgesetz\nBerlin Amtsgericht Berlin (Charlottenburg) HRA 62632\nSKP Verbundgesellschaft mbH & Co. KG – Berlin",
      "type": "Registerbekanntmachung nach dem Umwandlungsgesetz",
      "state": "Berlin",
      "amtsgericht": "Amtsgericht Berlin (Charlottenburg)",
      "registernummer": "HRA 62632",
      "registerart": "HRA",
      "company_name": "SKP Verbundgesellschaft mbH & Co. KG",
      "company_seat": "Berlin",
      "details": "04.12.2024 (Bekanntmachungsdatum)\n\nBerlin Amtsgericht Berlin (Charlottenburg) HRA 62632\nRegisterbekanntmachung nach dem Umwandlungsgesetz 02.12.2024 (Eintragungsdatum)\n\nSKP Verbundgesellschaft mbH & Co. KG\nKommanditgesellschaft\nBerlin\n\nZu Eintragungsnummer 3 vom 02.12.2024 wird als nicht eingetragen veröffentlicht: Den Gläubigern der an der Spaltung beteiligten Rechtsträger ist, wenn sie binnen sechs Monaten nach dem Tag, an dem die Eintragung der Spaltung in das Register des Sitzes desjenigen Rechtsträgers, dessen Gläubiger sie sind, als bekannt gemacht gilt, ihren Anspruch nach Grund und Höhe schriftlich anmelden, Sicherheit zu leisten, soweit sie nicht Befriedigung verlangen können. Dieses Recht steht den Gläubigern jedoch nur zu, wenn sie glaubhaft machen, dass durch die Spaltung die Erfüllung ihrer Forderung gefährdet wird. Das Recht, Sicherheitsleistung zu verlangen, steht Gläubigern nicht zu, die im Falle der Insolvenz ein Recht auf vorzugsweise Befriedigung aus einer Deckungsmasse haben, die nach gesetzlicher Vorschrift zu ihrem Schutz errichtet und staatlich überwacht ist."
    },
    {
      "date": "2024-12-04",
      "id": "95391",
      "original_text": "Registerbekanntmachung nach dem Umwandlungsgesetz\nBerlin Amtsgericht Berlin (Charlottenburg) HRB 99726\nLandesbank Berlin AG – Berlin",
      "type": "Registerbekanntmachung nach dem Umwandlungsgesetz",
      "state": "Berlin",
      "amtsgericht": "Amtsgericht Berlin (Charlottenburg)",
      "registernummer": "HRB 99726",
      "registerart": "HRB",
      "company_name": "Landesbank Berlin AG",
      "company_seat": "Berlin",
      "details": "04.12.2024 (Bekanntmachungsdatum)\n\nBerlin Amtsgericht Berlin (Charlottenburg) HRB 99726\nRegisterbekanntmachung nach dem Umwandlungsgesetz 02.12.2024 (Eintragungsdatum)\n\nLandesbank Berlin AG\nAktiengesellschaft\nBerlin\n\nZu Eintragungsnummer 75 vom 02.12.2024 wird als nicht eingetragen veröffentlicht: Den Gläubigern der an der Spaltung beteiligten Rechtsträger ist, wenn sie binnen sechs Monaten nach dem Tag, an dem die Eintragung der Spaltung in das Register des Sitzes desjenigen Rechtsträgers, dessen Gläubiger sie sind, als bekannt gemacht gilt, ihren Anspruch nach Grund und Höhe schriftlich anmelden, Sicherheit zu leisten, soweit sie nicht Befriedigung verlangen können. Dieses Recht steht den Gläubigern jedoch nur zu, wenn sie glaubhaft machen, dass durch die Spaltung die Erfüllung ihrer Forderung gefährdet wird. Das Recht, Sicherheitsleistung zu verlangen, steht Gläubigern nicht zu, die im Falle der Insolvenz ein Recht auf vorzugsweise Befriedigung aus einer Deckungsmasse haben, die nach gesetzlicher Vorschrift zu ihrem Schutz errichtet und staatlich überwacht ist."
    },
    {
      "date": "2024-12-04",
      "id": "95392",
      "original_text": "Löschungsankündigung\nBerlin Amtsgericht Berlin (Charlottenburg) HRB 66445\nprintzip X GmbH – Berlin",
      "type": "Löschungsankündigung",
      "state": "Berlin",
      "amtsgericht": "Amtsgericht Berlin (Charlottenburg)",
      "registernummer": "HRB 66445",
      "registerart": "HRB",
      "company_name": "printzip X GmbH",
      "company_seat": "Berlin",
      "details": "04.12.2024 (Bekanntmachungsdatum)\n\nBerlin Amtsgericht Berlin (Charlottenburg) HRB 66445\nLöschungsankündigung\n\nprintzip X GmbH\nGesellschaft mit beschränkter Haftung\nBerlin\n\nBei der nachstehenden Gesellschaft wird das Amtslöschungsverfahren gemäß § 394 FamFG eingeleitet. Widerspruchsfrist 6 Wochen"
    },
    {
      "date": "2024-12-04",
      "id": "95393",
      "original_text": "Einreichung neuer Dokumente\nBaden-Württemberg Amtsgericht Stuttgart HRB 354465\nRieber Management GmbH – Reutlingen",
      "type": "Einreichung neuer Dokumente",
      "state": "Baden-Württemberg",
      "amtsgericht": "Amtsgericht Stuttgart",
      "registernummer": "HRB 354465",
      "registerart": "HRB",
      "company_name": "Rieber Management GmbH",
      "company_seat": "Reutlingen",
      "details": "04.12.2024 (Bekanntmachungsdatum)\n\nBaden-Württemberg Amtsgericht Stuttgart HRB 354465\nEinreichung neuer Dokumente\n\nRieber Management GmbH\nGesellschaft mit beschränkter Haftung\nReutlingen\n\nDie Gesellschaft hat am 04.12.2024 die Liste über die Zusammensetzung des Aufsichtsrats zum Handelsregister eingereicht."
    },
    {
      "date": "2024-12-04",
      "id": "95394",
      "original_text": "Einreichung neuer Dokumente\nBaden-Württemberg Amtsgericht Stuttgart HRB 733560\nmax maier kitchen group verwaltungs gmbh – Ludwigsburg",
      "type": "Einreichung neuer Dokumente",
      "state": "Baden-Württemberg",
      "amtsgericht": "Amtsgericht Stuttgart",
      "registernummer": "HRB 733560",
      "registerart": "HRB",
      "company_name": "max maier kitchen group verwaltungs gmbh",
      "company_seat": "Ludwigsburg",
      "details": "04.12.2024 (Bekanntmachungsdatum)\n\nBaden-Württemberg Amtsgericht Stuttgart HRB 733560\nEinreichung neuer Dokumente\n\nmax maier kitchen group verwaltungs gmbh\nGesellschaft mit beschränkter Haftung\nLudwigsburg\n\nDie Gesellschaft hat am 04.12.2024 die Liste über die Zusammensetzung des Aufsichtsrats zum Handelsregister eingereicht."
    },
    {
      "date": "2024-12-04",
      "id": "95395",
      "original_text": "Löschungsankündigung\nSachsen Amtsgericht Dresden HRB 36096\nUnicorn UG (haftungsbeschränkt) – Dresden",
      "type": "Löschungsankündigung",
      "state": "Sachsen",
      "amtsgericht": "Amtsgericht Dresden",
      "registernummer": "HRB 36096",
      "registerart": "HRB",
      "company_name": "Unicorn UG (haftungsbeschränkt)",
      "company_seat": "Dresden",
      "details": "04.12.2024 (Bekanntmachungsdatum)\n\nSachsen Amtsgericht Dresden HRB 36096\nLöschungsankündigung\n\nUnicorn UG (haftungsbeschränkt)\nGesellschaft mit beschränkter Haftung\nDresden\n\nDas Registergericht beabsichtigt, die im Handelsregister eingetragene Gesellschaft von Amts wegen nach § 394 FamFG zu löschen. Die Frist zu Erhebung eines Widerspruchs gegen die beabsichtigte Löschung wird auf einen Monat festgesetzt."
    },
    {
      "date": "2024-12-04",
      "id": "95396",
      "original_text": "Registerbekanntmachung nach dem Umwandlungsgesetz\nSachsen Amtsgericht Chemnitz HRB 1315\nGeologische Landesuntersuchung GmbH Freiberg – Freiberg",
      "type": "Registerbekanntmachung nach dem Umwandlungsgesetz",
      "state": "Sachsen",
      "amtsgericht": "Amtsgericht Chemnitz",
      "registernummer": "HRB 1315",
      "registerart": "HRB",
      "company_name": "Geologische Landesuntersuchung GmbH Freiberg",
      "company_seat": "Freiberg",
      "details": "04.12.2024 (Bekanntmachungsdatum)\n\nSachsen Amtsgericht Chemnitz HRB 1315\nRegisterbekanntmachung nach dem Umwandlungsgesetz 04.12.2024 (Eintragungsdatum)\n\nGeologische Landesuntersuchung GmbH Freiberg\nGesellschaft mit beschränkter Haftung\nFreiberg\n\nDen Gläubigern der an der Verschmelzung beteiligten Rechtsträger ist, wenn sie binnen sechs Monaten nach dem Tag, an dem die Eintragung der Verschmelzung in das Register des Sitzes desjenigen Rechtsträgers, dessen Gläubiger sie sind, nach § 19 Abs. 3 UmwG als bekannt gemacht gilt, ihren Anspruch nach Grund und Höhe schriftlich anmelden, Sicherheit zu leisten, soweit sie nicht Befriedigung verlangen können. Dieses Recht steht den Gläubigern jedoch nur zu, wenn sie glaubhaft machen, dass durch die Verschmelzung die Erfüllung der Forderung gefährdet wird."
    },
    {
      "date": "2024-12-04",
      "id": "95397",
      "original_text": "Registerbekanntmachung nach dem Umwandlungsgesetz\nSachsen Amtsgericht Leipzig HRB 35494\nGeiger Edelmetalle AG – Rötha",
      "type": "Registerbekanntmachung nach dem Umwandlungsgesetz",
      "state": "Sachsen",
      "amtsgericht": "Amtsgericht Leipzig",
      "registernummer": "HRB 35494",
      "registerart": "HRB",
      "company_name": "Geiger Edelmetalle AG",
      "company_seat": "Rötha",
      "details": "04.12.2024 (Bekanntmachungsdatum)\n\nSachsen Amtsgericht Leipzig HRB 35494\nRegisterbekanntmachung nach dem Umwandlungsgesetz 04.12.2024 (Eintragungsdatum)\n\nGeiger Edelmetalle AG\nAktiengesellschaft\nRötha\n\nDen Gläubigern der an der Verschmelzung beteiligten Rechtsträger ist, wenn sie binnen sechs Monaten nach dem Tag, an dem die Eintragung der Verschmelzung in das Register des Sitzes desjenigen Rechtsträgers, dessen Gläubiger sie sind, nach § 19 Abs. 3 UmwG als bekannt gemacht gilt, ihren Anspruch nach Grund und Höhe schriftlich anmelden, Sicherheit zu leisten, soweit sie nicht Befriedigung verlangen können. Dieses Recht steht den Gläubigern jedoch nur zu, wenn sie glaubhaft machen, dass durch die Verschmelzung die Erfüllung der Forderung gefährdet wird."
    },
    {
      "date": "2024-12-04",
      "id": "95398",
      "original_text": "Registerbekanntmachung nach dem Umwandlungsgesetz\nSachsen Amtsgericht Dresden HRA 6313\nHW Vermietungs und Verwaltungs GmbH & Co. KG – Dresden",
      "type": "Registerbekanntmachung nach dem Umwandlungsgesetz",
      "state": "Sachsen",
      "amtsgericht": "Amtsgericht Dresden",
      "registernummer": "HRA 6313",
      "registerart": "HRA",
      "company_name": "HW Vermietungs und Verwaltungs GmbH & Co. KG",
      "company_seat": "Dresden",
      "details": "04.12.2024 (Bekanntmachungsdatum)\n\nSachsen Amtsgericht Dresden HRA 6313\nRegisterbekanntmachung nach dem Umwandlungsgesetz 04.12.2024 (Eintragungsdatum)\n\nHW Vermietungs und Verwaltungs GmbH & Co. KG\nKommanditgesellschaft\nDresden\n\nDen Gläubigern der an der Verschmelzung beteiligten Rechtsträger ist, wenn sie binnen sechs Monaten nach dem Tag, an dem die Eintragung der Verschmelzung in das Register des Sitzes desjenigen Rechtsträgers, dessen Gläubiger sie sind, nach § 19 Abs. 3 UmwG als bekannt gemacht gilt, ihren Anspruch nach Grund und Höhe schriftlich anmelden, Sicherheit zu leisten, soweit sie nicht Befriedigung verlangen können. Dieses Recht steht den Gläubigern jedoch nur zu, wenn sie glaubhaft machen, dass durch die Verschmelzung die Erfüllung der Forderung gefährdet wird."
    },
    {
      "date": "2024-12-04",
      "id": "95399",
      "original_text": "Registerbekanntmachung nach dem Umwandlungsgesetz\nSachsen Amtsgericht Leipzig HRB 24798\nLeipziger Edelmetallverarbeitung GmbH – Espenhain",
      "type": "Registerbekanntmachung nach dem Umwandlungsgesetz",
      "state": "Sachsen",
      "amtsgericht": "Amtsgericht Leipzig",
      "registernummer": "HRB 24798",
      "registerart": "HRB",
      "company_name": "Leipziger Edelmetallverarbeitung GmbH",
      "company_seat": "Espenhain",
      "details": "04.12.2024 (Bekanntmachungsdatum)\n\nSachsen Amtsgericht Leipzig HRB 24798\nRegisterbekanntmachung nach dem Umwandlungsgesetz 04.12.2024 (Eintragungsdatum)\n\nLeipziger Edelmetallverarbeitung GmbH\nGesellschaft mit beschränkter Haftung\nEspenhain\n\nDen Gläubigern der an der Verschmelzung beteiligten Rechtsträger ist, wenn sie binnen sechs Monaten nach dem Tag, an dem die Eintragung der Verschmelzung in das Register des Sitzes desjenigen Rechtsträgers, dessen Gläubiger sie sind, nach § 19 Abs. 3 UmwG als bekannt gemacht gilt, ihren Anspruch nach Grund und Höhe schriftlich anmelden, Sicherheit zu leisten, soweit sie nicht Befriedigung verlangen können. Dieses Recht steht den Gläubigern jedoch nur zu, wenn sie glaubhaft machen, dass durch die Verschmelzung die Erfüllung der Forderung gefährdet wird."
    },
    {
      "date": "2024-12-04",
      "id": "95400",
      "original_text": "Registerbekanntmachung nach dem Umwandlungsgesetz\nSachsen Amtsgericht Dresden HRA 935\nHW Vermietungs und Verwaltungs GmbH & Co. KG – Dresden",
      "type": "Registerbekanntmachung nach dem Umwandlungsgesetz",
      "state": "Sachsen",
      "amtsgericht": "Amtsgericht Dresden",
      "registernummer": "HRA 935",
      "registerart": "HRA",
      "company_name": "HW Vermietungs und Verwaltungs GmbH & Co. KG",
      "company_seat": "Dresden",
      "details": "04.12.2024 (Bekanntmachungsdatum)\n\nSachsen Amtsgericht Dresden HRA 935\nRegisterbekanntmachung nach dem Umwandlungsgesetz 04.12.2024 (Eintragungsdatum)\n\nHW Vermietungs und Verwaltungs GmbH & Co. KG\nKommanditgesellschaft\nDresden\n\nDen Gläubigern der an der Verschmelzung beteiligten Rechtsträger ist, wenn sie binnen sechs Monaten nach dem Tag, an dem die Eintragung der Verschmelzung in das Register des Sitzes desjenigen Rechtsträgers, dessen Gläubiger sie sind, nach § 19 Abs. 3 UmwG als bekannt gemacht gilt, ihren Anspruch nach Grund und Höhe schriftlich anmelden, Sicherheit zu leisten, soweit sie nicht Befriedigung verlangen können. Dieses Recht steht den Gläubigern jedoch nur zu, wenn sie glaubhaft machen, dass durch die Verschmelzung die Erfüllung der Forderung gefährdet wird."
    },
    {
      "date": "2024-12-04",
      "id": "95401",
      "original_text": "Einreichung neuer Dokumente\nSachsen Amtsgericht Chemnitz HRB 26253\nHBK-Service gemeinnützige GmbH – Zwickau",
      "type": "Einreichung neuer Dokumente",
      "state": "Sachsen",
      "amtsgericht": "Amtsgericht Chemnitz",
      "registernummer": "HRB 26253",
      "registerart": "HRB",
      "company_name": "HBK-Service gemeinnützige GmbH",
      "company_seat": "Zwickau",
      "details": "04.12.2024 (Bekanntmachungsdatum)\n\nSachsen Amtsgericht Chemnitz HRB 26253\nEinreichung neuer Dokumente 04.12.2024 (Eintragungsdatum)\n\nHBK-Service gemeinnützige GmbH\nGesellschaft mit beschränkter Haftung\nZwickau\n\nAm 03.12.2024 wurde beim Handelsregister des Amtsgerichts Chemnitz die Liste der Mitglieder des Aufsichtsrats gemäß § 52 GmbHG eingereicht."
    },
    {
      "date": "2024-12-04",
      "id": "95402",
      "original_text": "Löschungsankündigung\nSachsen Amtsgericht Dresden HRB 34705\nWIRE-TRADE UG (haftungsbeschränkt) – Markersdorf",
      "type": "Löschungsankündigung",
      "state": "Sachsen",
      "amtsgericht": "Amtsgericht Dresden",
      "registernummer": "HRB 34705",
      "registerart": "HRB",
      "company_name": "WIRE-TRADE UG (haftungsbeschränkt)",
      "company_seat": "Markersdorf",
      "details": "04.12.2024 (Bekanntmachungsdatum)\n\nSachsen Amtsgericht Dresden HRB 34705\nLöschungsankündigung\n\nWIRE-TRADE UG (haftungsbeschränkt)\nGesellschaft mit beschränkter Haftung\nMarkersdorf\n\nDas Registergericht beabsichtigt, die im Handelsregister eingetragene Gesellschaft von Amts wegen nach § 394 FamFG zu löschen. Die Frist zu Erhebung eines Widerspruchs gegen die beabsichtigte Löschung wird auf einen Monat festgesetzt."
    },
    {
      "date": "2024-12-04",
      "id": "95403",
      "original_text": "Registerbekanntmachung nach dem Umwandlungsgesetz\nNiedersachsen Amtsgericht Osnabrück HRA 208702\nHeitker Besitz UG (haftungsbeschränkt) & Co. KG – Lingen (Ems)",
      "type": "Registerbekanntmachung nach dem Umwandlungsgesetz",
      "state": "Niedersachsen",
      "amtsgericht": "Amtsgericht Osnabrück",
      "registernummer": "HRA 208702",
      "registerart": "HRA",
      "company_name": "Heitker Besitz UG (haftungsbeschränkt) & Co. KG",
      "company_seat": "Lingen (Ems)",
      "details": "04.12.2024 (Bekanntmachungsdatum)\n\nNiedersachsen Amtsgericht Osnabrück HRA 208702\nRegisterbekanntmachung nach dem Umwandlungsgesetz 04.12.2024 (Eintragungsdatum)\n\nHeitker Besitz UG (haftungsbeschränkt) & Co. KG\nKommanditgesellschaft\nLingen (Ems)\n\nDen Gläubigern der an der Ausgliederung beteiligten Rechtsträger ist, wenn sie binnen sechs Monaten nach dem Tag, an dem die Eintragung der Ausgliederung in das Register des Sitzes desjenigen Rechtsträgers, dessen Gläubiger sie sind, nach § 19 Abs. 3 UmwG als bekannt gemacht gilt, ihren Anspruch nach Grund und Höhe schriftlich anmelden, Sicherheit zu leisten, soweit sie nicht Befriedigung verlangen können. Dieses Recht steht den Gläubigern jedoch nur zu, wenn sie glaubhaft machen, dass durch die Ausgliederung die Erfüllung der Forderung gefährdet wird."
    },
    {
      "date": "2024-12-04",
      "id": "95404",
      "original_text": "Löschungsankündigung\nNiedersachsen Amtsgericht Hannover HRB 216363\nITALY FLAIR GmbH – Hannover",
      "type": "Löschungsankündigung",
      "state": "Niedersachsen",
      "amtsgericht": "Amtsgericht Hannover",
      "registernummer": "HRB 216363",
      "registerart": "HRB",
      "company_name": "ITALY FLAIR GmbH",
      "company_seat": "Hannover",
      "details": "04.12.2024 (Bekanntmachungsdatum)\n\nNiedersachsen Amtsgericht Hannover HRB 216363\nLöschungsankündigung\n\nITALY FLAIR GmbH\nGesellschaft mit beschränkter Haftung\nHannover\n\nDas Registergericht beabsichtigt, die Gesellschaft von Amts wegen nach § 394 FamFG zu löschen. Die Frist zur Erhebung eines Widerspruchs ist auf 1 Monat ab dieser Registerbekanntmachung festgesetzt."
    },
    {
      "date": "2024-12-04",
      "id": "95405",
      "original_text": "Sonstige Registerbekanntmachung\nNiedersachsen Amtsgericht Walsrode HRB 208176\nbboo solutions UG (haftungsbeschränkt) – Achim",
      "type": "Sonstige Registerbekanntmachung",
      "state": "Niedersachsen",
      "amtsgericht": "Amtsgericht Walsrode",
      "registernummer": "HRB 208176",
      "registerart": "HRB",
      "company_name": "bboo solutions UG (haftungsbeschränkt)",
      "company_seat": "Achim",
      "details": "04.12.2024 (Bekanntmachungsdatum)\n\nNiedersachsen Amtsgericht Walsrode HRB 208176\nSonstige Registerbekanntmachung\n\nbboo solutions UG (haftungsbeschränkt)\nGesellschaft mit beschränkter Haftung\nAchim\n\nEs ist beabsichtigt, die Gesellschaft wegen Vermögenslosigkeit von Amts wegen im Handelsregister zu löschen (§ 394 FamFG).\nBis zum 01.03.2025 können Sie beim Amtsgericht Walsrode gegen die angekündigte Löschung schriftlich oder zu Protokoll der Geschäftsstelle Widerspruch unter Angabe von Gründen erheben."
    },
    {
      "date": "2024-12-04",
      "id": "95406",
      "original_text": "Registerbekanntmachung nach dem Umwandlungsgesetz\nNiedersachsen Amtsgericht Hannover HRB 228111\nRegenesa gGmbH – Hannover",
      "type": "Registerbekanntmachung nach dem Umwandlungsgesetz",
      "state": "Niedersachsen",
      "amtsgericht": "Amtsgericht Hannover",
      "registernummer": "HRB 228111",
      "registerart": "HRB",
      "company_name": "Regenesa gGmbH",
      "company_seat": "Hannover",
      "details": "04.12.2024 (Bekanntmachungsdatum)\n\nNiedersachsen Amtsgericht Hannover HRB 228111\nRegisterbekanntmachung nach dem Umwandlungsgesetz 04.12.2024 (Eintragungsdatum)\n\nRegenesa gGmbH\nGesellschaft mit beschränkter Haftung\nHannover\n\nDen Gläubigern des formwechselnden Rechtsträgers ist, wenn sie binnen sechs Monaten nach dem Tag, an dem die Eintragung des Formwechsels nach § 201 UmwG als bekannt gemacht gilt, ihren Anspruch nach Grund und Höhe schriftlich anmelden, Sicherheit zu leisten. Dieses Recht steht ihnen jedoch nur zu, wenn sie glaubhaft machen, dass durch den Formwechsel die Erfüllung ihrer Forderungen gefährdet wird."
    },
    {
      "date": "2024-12-04",
      "id": "95407",
      "original_text": "Löschungsankündigung\nNiedersachsen Amtsgericht Stadthagen HRB 202131\nHORANI ACCOUNT CONSULT GmbH – Obernkirchen",
      "type": "Löschungsankündigung",
      "state": "Niedersachsen",
      "amtsgericht": "Amtsgericht Stadthagen",
      "registernummer": "HRB 202131",
      "registerart": "HRB",
      "company_name": "HORANI ACCOUNT CONSULT GmbH",
      "company_seat": "Obernkirchen",
      "details": "04.12.2024 (Bekanntmachungsdatum)\n\nNiedersachsen Amtsgericht Stadthagen HRB 202131\nLöschungsankündigung\n\nHORANI ACCOUNT CONSULT GmbH\nGesellschaft mit beschränkter Haftung\nObernkirchen\n\nDas Registergericht beabsichtigt, die Gesellschaft von Amts wegen nach § 394 FamFG zu löschen. Die Frist zur Erhebung eines Widerspruchs ist auf 1 Monat ab dieser Registerbekanntmachung festgesetzt."
    },
    {
      "date": "2024-12-04",
      "id": "95408",
      "original_text": "Registerbekanntmachung nach dem Umwandlungsgesetz\nNiedersachsen Amtsgericht Hannover VR 2746\nReGenesa - Vorsorgekliniken für Frauen, Mütter und Kinder sowie Familienerholung in der Ev.-luth. Landeskirche Hannovers e.V. – Hannover",
      "type": "Registerbekanntmachung nach dem Umwandlungsgesetz",
      "state": "Niedersachsen",
      "amtsgericht": "Amtsgericht Hannover",
      "registernummer": "VR 2746",
      "registerart": "VR",
      "company_name": "ReGenesa - Vorsorgekliniken für Frauen, Mütter und Kinder sowie Familienerholung in der Ev.-luth. Landeskirche Hannovers e.V.",
      "company_seat": "Hannover",
      "details": "04.12.2024 (Bekanntmachungsdatum)\n\nNiedersachsen Amtsgericht Hannover VR 2746\nRegisterbekanntmachung nach dem Umwandlungsgesetz 04.12.2024 (Eintragungsdatum)\n\nReGenesa - Vorsorgekliniken für Frauen, Mütter und Kinder sowie Familienerholung in der Ev.-luth. Landeskirche Hannovers e.V.\neingetragener Verein\nHannover\n\nDen Gläubigern des formwechselnden Rechtsträgers ist, wenn sie binnen sechs Monaten nach dem Tag, an dem die Eintragung des Formwechsels nach § 201 UmwG als bekannt gemacht gilt, ihren Anspruch nach Grund und Höhe schriftlich anmelden, Sicherheit zu leisten. Dieses Recht steht ihnen jedoch nur zu, wenn sie glaubhaft machen, dass durch den Formwechsel die Erfüllung ihrer Forderungen gefährdet wird."
    },
    {
      "date": "2024-12-04",
      "id": "95409",
      "original_text": "Löschungsankündigung\nRheinland-Pfalz Amtsgericht Montabaur HRB 14105\nCurtis 1000 Europe AktiengeselIschaft – Neuwied",
      "type": "Löschungsankündigung",
      "state": "Rheinland-Pfalz",
      "amtsgericht": "Amtsgericht Montabaur",
      "registernummer": "HRB 14105",
      "registerart": "HRB",
      "company_name": "Curtis 1000 Europe AktiengeselIschaft",
      "company_seat": "Neuwied",
      "details": "04.12.2024 (Bekanntmachungsdatum)\n\nRheinland-Pfalz Amtsgericht Montabaur HRB 14105\nLöschungsankündigung 04.12.2024 (Eintragungsdatum)\n\nCurtis 1000 Europe AktiengeselIschaft\nAktiengesellschaft\nNeuwied\n\nDas Registergericht beabsichtigt die Gesellschaft von Amts wegen nach § 394 FamFG zu löschen. Die Frist zur Erhebung eines Widerspruchs ist auf einen Monat festgesetzt."
    },
    {
      "date": "2024-12-04",
      "id": "95410",
      "original_text": "Löschungsankündigung\nRheinland-Pfalz Amtsgericht Kaiserslautern HRB 32158\nPalm und Mazur GmbH – Kaiserslautern",
      "type": "Löschungsankündigung",
      "state": "Rheinland-Pfalz",
      "amtsgericht": "Amtsgericht Kaiserslautern",
      "registernummer": "HRB 32158",
      "registerart": "HRB",
      "company_name": "Palm und Mazur GmbH",
      "company_seat": "Kaiserslautern",
      "details": "04.12.2024 (Bekanntmachungsdatum)\n\nRheinland-Pfalz Amtsgericht Kaiserslautern HRB 32158\nLöschungsankündigung 04.12.2024 (Eintragungsdatum)\n\nPalm und Mazur GmbH\nGesellschaft mit beschränkter Haftung\nKaiserslautern\n\nDas Registergericht beabsichtigt die vorgenannte Firma gemäß § 394 FamFG wegen Vermögenslosigkeit zu löschen. Widerspruch gegen die Löschung kann nur binnen 2 Monaten ab Veröffentlichung dieser Verfügung eingelegt werden."
    },
    {
      "date": "2024-12-04",
      "id": "95411",
      "original_text": "Löschungsankündigung\nRheinland-Pfalz Amtsgericht Kaiserslautern HRB 31802\nUnlock Japan UG (haftungsbeschränkt) – Kaiserslautern",
      "type": "Löschungsankündigung",
      "state": "Rheinland-Pfalz",
      "amtsgericht": "Amtsgericht Kaiserslautern",
      "registernummer": "HRB 31802",
      "registerart": "HRB",
      "company_name": "Unlock Japan UG (haftungsbeschränkt)",
      "company_seat": "Kaiserslautern",
      "details": "04.12.2024 (Bekanntmachungsdatum)\n\nRheinland-Pfalz Amtsgericht Kaiserslautern HRB 31802\nLöschungsankündigung 02.12.2024 (Eintragungsdatum)\n\nUnlock Japan UG (haftungsbeschränkt)\nGesellschaft mit beschränkter Haftung\nKaiserslautern\n\nDas Registergericht beabsichtigt die vorgenannte Firma gemäß § 394 FamFG wegen Vermögenslosigkeit zu löschen. Widerspruch gegen die Löschung kann nur binnen 3 Monaten ab Veröffentlichung dieser Verfügung eingelegt werden."
    },
    {
      "date": "2024-12-04",
      "id": "95412",
      "original_text": "Registerbekanntmachung nach dem Umwandlungsgesetz\nNordrhein-Westfalen Amtsgericht Köln HRA 37840\nBuzz Bauservice Bestvater e. K. – Frechen",
      "type": "Registerbekanntmachung nach dem Umwandlungsgesetz",
      "state": "Nordrhein-Westfalen",
      "amtsgericht": "Amtsgericht Köln",
      "registernummer": "HRA 37840",
      "registerart": "HRA",
      "company_name": "Buzz Bauservice Bestvater e. K.",
      "company_seat": "Frechen",
      "details": "04.12.2024 (Bekanntmachungsdatum)\n\nNordrhein-Westfalen Amtsgericht Köln HRA 37840\nRegisterbekanntmachung nach dem Umwandlungsgesetz 04.12.2024 (Eintragungsdatum)\n\nBuzz Bauservice Bestvater e. K.\nEinzelkaufmann / Einzelkauffrau\nFrechen\n\nDen Gläubigern der an der Ausgliederung beteiligten Rechtsträger ist, wenn sie binnen sechs Monaten nach dem Tag, an dem die Eintragung der Ausgliederung in das Register des Sitzes desjenigen Rechtsträgers, dessen Gläubiger sie sind, nach § 19 Absatz 3 UmwG als bekanntgemacht gilt, ihren Anspruch nach Grund und Höhe schriftlich anmelden, Sicherheit zu leisten, soweit sie nicht Befriedigung verlangen können. Dieses Recht steht den Gläubigern jedoch nur zu, wenn sie glaubhaft machen, dass durch die Ausgliederung die Erfüllung ihrer Forderung gefährdet wird."
    },
    {
      "date": "2024-12-04",
      "id": "95413",
      "original_text": "Registerbekanntmachung nach dem Umwandlungsgesetz\nNordrhein-Westfalen Amtsgericht Siegen HRB 9512\nTuS Ferndorf Handball GmbH – Kreuztal",
      "type": "Registerbekanntmachung nach dem Umwandlungsgesetz",
      "state": "Nordrhein-Westfalen",
      "amtsgericht": "Amtsgericht Siegen",
      "registernummer": "HRB 9512",
      "registerart": "HRB",
      "company_name": "TuS Ferndorf Handball GmbH",
      "company_seat": "Kreuztal",
      "details": "04.12.2024 (Bekanntmachungsdatum)\n\nNordrhein-Westfalen Amtsgericht Siegen HRB 9512\nRegisterbekanntmachung nach dem Umwandlungsgesetz 04.12.2024 (Eintragungsdatum)\n\nTuS Ferndorf Handball GmbH\nGesellschaft mit beschränkter Haftung\nKreuztal\n\nDen Gläubigern der an der formwechselnden Umwandlung beteiligten Rechtsträger ist, wenn sie binnen sechs Monaten nach dem Tag, an dem die Eintragung der formwechselnden Umwandlung in das Register des Sitzes desjenigen Rechtsträgers, dessen Gläubiger sie sind, nach § 19 Absatz 3 UmwG als bekanntgemacht gilt, ihren Anspruch nach Grund und Höhe schriftlich anmelden, Sicherheit zu leisten, soweit sie nicht Befriedigung verlangen können. Dieses Recht steht den Gläubigern jedoch nur zu, wenn sie glaubhaft machen, dass durch die formwechselnden Umwandlung die Erfüllung ihrer Forderung gefährdet wird."
    },
    {
      "date": "2024-12-04",
      "id": "95414",
      "original_text": "Löschungsankündigung\nNordrhein-Westfalen Amtsgericht Düsseldorf HRB 99059\nLa Zona GmbH – Düsseldorf",
      "type": "Löschungsankündigung",
      "state": "Nordrhein-Westfalen",
      "amtsgericht": "Amtsgericht Düsseldorf",
      "registernummer": "HRB 99059",
      "registerart": "HRB",
      "company_name": "La Zona GmbH",
      "company_seat": "Düsseldorf",
      "details": "04.12.2024 (Bekanntmachungsdatum)\n\nNordrhein-Westfalen Amtsgericht Düsseldorf HRB 99059\nLöschungsankündigung\n\nLa Zona GmbH\nGesellschaft mit beschränkter Haftung\nDüsseldorf\n\nDas Registergericht beabsichtigt die Gesellschaft von Amts wegen nach § 394 FamFG zu löschen. Die Frist zur Erhebung eines Widerspruchs ist auf 3 Wochen festgesetzt.\n\nRechtsbehelfsbelehrung:\nDas Widerspruchsrecht steht jedem zu, der an der Unterlassung der Löschung ein berechtigtes Interesse hat. Der Widerspruch ist bei dem Amtsgericht Düsseldorf -Registergericht-, Werdener Straße 1, 40227 Düsseldorf schriftlich in deutscher Sprache oder zur Niederschrift der Geschäftsstelle einzulegen. Der Widerspruch kann auch zur Niederschrift der Geschäftsstelle eines jeden Amtsgerichtes abgegeben werden. Die Einlegung ist auch durch Übertragung eines elektronischen Dokuments an die elektronische Poststelle des Gerichts möglich. Das elektronische Dokument muss für die Bearbeitung durch das Gericht geeignet und mit einer qualifizierten elektronischen Signatur der verantwortenden Person versehen sein oder von der verantwortenden Person signiert und auf einem sicheren Übermittlungsweg gemäß § 130a ZPO nach näherer Maßgabe der Verordnung über die technischen Rahmenbedingungen des elektronischen Rechtsverkehrs und über das besondere elektronische Behördenpostfach (BGBl. I, S.3803) eingereicht werden. Weitere Informationen erhalten Sie auf der Internetseite www.justiz.de.\nDer Widerspruch muss spätestens innerhalb der gesetzten Frist nach dem Datum der Bekanntmachung der Löschungsankündigung bei dem Amtsgericht - Registergericht - Düsseldorf eingegangen sein.  Dies gilt auch dann, wenn der Widerspruch zur Niederschrift der Geschäftsstelle eines anderen Amtsgerichtes abgegeben wurde. Die Frist beginnt mit dem Tage der Bekanntmachung der Löschungsankündigung in dem für die Bekanntmachung der Eintragungen in das Handelsregister bestimmten elektronischen Informations- und Kommunikationssystem nach § 10 des Handelsgesetzbuches. Fällt das Ende der Frist auf einen Sonntag, einen allgemeinen Feiertag oder Sonnabend, so endet die Frist mit Ablauf des nächsten Werktages.\nDer Widerspruch muss die Bezeichnung der angefochtenen Löschungsankündigung sowie die Erklärung enthalten, dass Widerspruch gegen diese Löschungsankündigung eingelegt wird. Er ist zu unterzeichnen und soll begründet werden."
    },
    {
      "date": "2024-12-04",
      "id": "95415",
      "original_text": "Registerbekanntmachung nach dem Umwandlungsgesetz\nNordrhein-Westfalen Amtsgericht Köln HRB 121335\nBuzz Bauservice GmbH – Frechen",
      "type": "Registerbekanntmachung nach dem Umwandlungsgesetz",
      "state": "Nordrhein-Westfalen",
      "amtsgericht": "Amtsgericht Köln",
      "registernummer": "HRB 121335",
      "registerart": "HRB",
      "company_name": "Buzz Bauservice GmbH",
      "company_seat": "Frechen",
      "details": "04.12.2024 (Bekanntmachungsdatum)\n\nNordrhein-Westfalen Amtsgericht Köln HRB 121335\nRegisterbekanntmachung nach dem Umwandlungsgesetz 04.12.2024 (Eintragungsdatum)\n\nBuzz Bauservice GmbH\nGesellschaft mit beschränkter Haftung\nFrechen\n\nDen Gläubigern der an der Ausgliederung beteiligten Rechtsträger ist, wenn sie binnen sechs Monaten nach dem Tag, an dem die Eintragung der Ausgliederung in das Register des Sitzes desjenigen Rechtsträgers, dessen Gläubiger sie sind, nach § 19 Absatz 3 UmwG als bekanntgemacht gilt, ihren Anspruch nach Grund und Höhe schriftlich anmelden, Sicherheit zu leisten, soweit sie nicht Befriedigung verlangen können. Dieses Recht steht den Gläubigern jedoch nur zu, wenn sie glaubhaft machen, dass durch die Ausgliederung die Erfüllung ihrer Forderung gefährdet wird."
    },
    {
      "date": "2024-12-04",
      "id": "95416",
      "original_text": "Löschungsankündigung\nNordrhein-Westfalen Amtsgericht Dortmund HRB 21429\nDatenservice Käfer Gesellschaft mit beschränkter Haftung – Dortmund",
      "type": "Löschungsankündigung",
      "state": "Nordrhein-Westfalen",
      "amtsgericht": "Amtsgericht Dortmund",
      "registernummer": "HRB 21429",
      "registerart": "HRB",
      "company_name": "Datenservice Käfer Gesellschaft mit beschränkter Haftung",
      "company_seat": "Dortmund",
      "details": "04.12.2024 (Bekanntmachungsdatum)\n\nNordrhein-Westfalen Amtsgericht Dortmund HRB 21429\nLöschungsankündigung\n\nDatenservice Käfer Gesellschaft mit beschränkter Haftung\nGesellschaft mit beschränkter Haftung\nDortmund\n\nDas Registergericht beabsichtigt die Gesellschaft von Amts wegen nach § 394 FamFG zu löschen. Die Frist zur Erhebung eines Widerspruchs ist auf zwei Monate festgesetzt."
    },
    {
      "date": "2024-12-04",
      "id": "95417",
      "original_text": "Löschungsankündigung\nNordrhein-Westfalen Amtsgericht Düsseldorf HRB 83710\nIAC Partners GmbH – Düsseldorf",
      "type": "Löschungsankündigung",
      "state": "Nordrhein-Westfalen",
      "amtsgericht": "Amtsgericht Düsseldorf",
      "registernummer": "HRB 83710",
      "registerart": "HRB",
      "company_name": "IAC Partners GmbH",
      "company_seat": "Düsseldorf",
      "details": "04.12.2024 (Bekanntmachungsdatum)\n\nNordrhein-Westfalen Amtsgericht Düsseldorf HRB 83710\nLöschungsankündigung\n\nIAC Partners GmbH\nGesellschaft mit beschränkter Haftung\nDüsseldorf\n\nDas Registergericht beabsichtigt die Gesellschaft von Amts wegen nach § 394 Abs. 1 FamFG zu löschen. Die Frist zur Erhebung eines Widerspruchs ist auf 3 Wochen festgesetzt.\n\nRechtsbehelfsbelehrung:\nDas Widerspruchsrecht steht jedem zu, der an der Unterlassung der Löschung ein berechtigtes Interesse hat. Der Widerspruch ist bei dem Amtsgericht Düsseldorf -Registergericht-, Werdener Straße 1, 40227 Düsseldorf schriftlich in deutscher Sprache oder zur Niederschrift der Geschäftsstelle einzulegen. Der Widerspruch kann auch zur Niederschrift der Geschäftsstelle eines jeden Amtsgerichtes abgegeben werden. Die Einlegung ist auch durch Übertragung eines elektronischen Dokuments an die elektronische Poststelle des Gerichts möglich. Das elektronische Dokument muss für die Bearbeitung durch das Gericht geeignet und mit einer qualifizierten elektronischen Signatur der verantwortenden Person versehen sein oder von der verantwortenden Person signiert und auf einem sicheren Übermittlungsweg gemäß § 130a ZPO nach näherer Maßgabe der Verordnung über die technischen Rahmenbedingungen des elektronischen Rechtsverkehrs und über das besondere elektronische Behördenpostfach (BGBl. I, S.3803) eingereicht werden. Weitere Informationen erhalten Sie auf der Internetseite www.justiz.de.\nDer Widerspruch muss spätestens innerhalb der gesetzten Frist nach dem Datum der Bekanntmachung der Löschungsankündigung bei dem Amtsgericht - Registergericht - Düsseldorf eingegangen sein.  Dies gilt auch dann, wenn der Widerspruch zur Niederschrift der Geschäftsstelle eines anderen Amtsgerichtes abgegeben wurde. Die Frist beginnt mit dem Tage der Bekanntmachung der Löschungsankündigung in dem für die Bekanntmachung der Eintragungen in das Handelsregister bestimmten elektronischen Informations- und Kommunikationssystem nach § 10 des Handelsgesetzbuches. Fällt das Ende der Frist auf einen Sonntag, einen allgemeinen Feiertag oder Sonnabend, so endet die Frist mit Ablauf des nächsten Werktages.\nDer Widerspruch muss die Bezeichnung der angefochtenen Löschungsankündigung sowie die Erklärung enthalten, dass Widerspruch gegen diese Löschungsankündigung eingelegt wird. Er ist zu unterzeichnen und soll begründet werden."
    },
    {
      "date": "2024-12-04",
      "id": "95418",
      "original_text": "Registerbekanntmachung nach dem Umwandlungsgesetz\nBremen Amtsgericht Bremen HRB 38317\nChanghua North East Holding GmbH – Bremen",
      "type": "Registerbekanntmachung nach dem Umwandlungsgesetz",
      "state": "Bremen",
      "amtsgericht": "Amtsgericht Bremen",
      "registernummer": "HRB 38317",
      "registerart": "HRB",
      "company_name": "Changhua North East Holding GmbH",
      "company_seat": "Bremen",
      "details": "04.12.2024 (Bekanntmachungsdatum)\n\nBremen Amtsgericht Bremen HRB 38317\nRegisterbekanntmachung nach dem Umwandlungsgesetz 03.12.2024 (Eintragungsdatum)\n\nChanghua North East Holding GmbH\nGesellschaft mit beschränkter Haftung\nBremen\n\nZu Eintragungsnummer 4 vom 03.12.2024 wird als nicht eingetragen veröffentlicht: Den Gläubigern der an der Verschmelzung beteiligten Rechtsträger ist, wenn sie binnen sechs Monaten nach dem Tag, an dem die Eintragung der Verschmelzung in das Register des Sitzes desjenigen Rechtsträgers, dessen Gläubiger sie sind, als bekannt gemacht gilt, ihren Anspruch nach Grund und Höhe schriftlich anmelden, Sicherheit zu leisten, soweit sie nicht Befriedigung verlangen können. Dieses Recht steht den Gläubigern jedoch nur zu, wenn sie glaubhaft machen, dass durch die Verschmelzung die Erfüllung ihrer Forderung gefährdet wird. Das Recht, Sicherheitsleistung zu verlangen, steht Gläubigern nicht zu, die im Falle der Insolvenz ein Recht auf vorzugsweise Befriedigung aus einer Deckungsmasse haben, die nach gesetzlicher Vorschrift zu ihrem Schutz errichtet und staatlich überwacht ist."
    },
    {
      "date": "2024-12-04",
      "id": "95419",
      "original_text": "Registerbekanntmachung nach dem Umwandlungsgesetz\nBremen Amtsgericht Bremen HRB 31556\nTaiwan offshore Holding GmbH – Bremen",
      "type": "Registerbekanntmachung nach dem Umwandlungsgesetz",
      "state": "Bremen",
      "amtsgericht": "Amtsgericht Bremen",
      "registernummer": "HRB 31556",
      "registerart": "HRB",
      "company_name": "Taiwan offshore Holding GmbH",
      "company_seat": "Bremen",
      "details": "04.12.2024 (Bekanntmachungsdatum)\n\nBremen Amtsgericht Bremen HRB 31556\nRegisterbekanntmachung nach dem Umwandlungsgesetz 03.12.2024 (Eintragungsdatum)\n\nTaiwan offshore Holding GmbH\nGesellschaft mit beschränkter Haftung\nBremen\n\nZu Eintragungsnummer 8 vom 03.12.2024 wird als nicht eingetragen veröffentlicht:  Den Gläubigern der an der Verschmelzung beteiligten Rechtsträger ist, wenn sie binnen sechs Monaten nach dem Tag, an dem die Eintragung der Verschmelzung in das Register des Sitzes desjenigen Rechtsträgers, dessen Gläubiger sie sind, als bekannt gemacht gilt, ihren Anspruch nach Grund und Höhe schriftlich anmelden, Sicherheit zu leisten, soweit sie nicht Befriedigung verlangen können. Dieses Recht steht den Gläubigern jedoch nur zu, wenn sie glaubhaft machen, dass durch die Verschmelzung die Erfüllung ihrer Forderung gefährdet wird. Das Recht, Sicherheitsleistung zu verlangen, steht Gläubigern nicht zu, die im Falle der Insolvenz ein Recht auf vorzugsweise Befriedigung aus einer Deckungsmasse haben, die nach gesetzlicher Vorschrift zu ihrem Schutz errichtet und staatlich überwacht ist."
    },
    {
      "date": "2024-12-04",
      "id": "95420",
      "original_text": "Registerbekanntmachung nach dem Umwandlungsgesetz\nBremen Amtsgericht Bremen HRB 31556\nTaiwan offshore Holding GmbH – Bremen",
      "type": "Registerbekanntmachung nach dem Umwandlungsgesetz",
      "state": "Bremen",
      "amtsgericht": "Amtsgericht Bremen",
      "registernummer": "HRB 31556",
      "registerart": "HRB",
      "company_name": "Taiwan offshore Holding GmbH",
      "company_seat": "Bremen",
      "details": "04.12.2024 (Bekanntmachungsdatum)\n\nBremen Amtsgericht Bremen HRB 31556\nRegisterbekanntmachung nach dem Umwandlungsgesetz 03.12.2024 (Eintragungsdatum)\n\nTaiwan offshore Holding GmbH\nGesellschaft mit beschränkter Haftung\nBremen\n\nZu Eintragungsnummer 9 vom 03.12.2024 wird als nicht eingetragen veröffentlicht: Den Gläubigern der an der Verschmelzung beteiligten Rechtsträger ist, wenn sie binnen sechs Monaten nach dem Tag, an dem die Eintragung der Verschmelzung in das Register des Sitzes desjenigen Rechtsträgers, dessen Gläubiger sie sind, als bekannt gemacht gilt, ihren Anspruch nach Grund und Höhe schriftlich anmelden, Sicherheit zu leisten, soweit sie nicht Befriedigung verlangen können. Dieses Recht steht den Gläubigern jedoch nur zu, wenn sie glaubhaft machen, dass durch die Verschmelzung die Erfüllung ihrer Forderung gefährdet wird. Das Recht, Sicherheitsleistung zu verlangen, steht Gläubigern nicht zu, die im Falle der Insolvenz ein Recht auf vorzugsweise Befriedigung aus einer Deckungsmasse haben, die nach gesetzlicher Vorschrift zu ihrem Schutz errichtet und staatlich überwacht ist."
    },
    {
      "date": "2024-12-04",
      "id": "95421",
      "original_text": "Registerbekanntmachung nach dem Umwandlungsgesetz\nBremen Amtsgericht Bremen HRB 37154\nChanghua South East Holding GmbH – Bremen",
      "type": "Registerbekanntmachung nach dem Umwandlungsgesetz",
      "state": "Bremen",
      "amtsgericht": "Amtsgericht Bremen",
      "registernummer": "HRB 37154",
      "registerart": "HRB",
      "company_name": "Changhua South East Holding GmbH",
      "company_seat": "Bremen",
      "details": "04.12.2024 (Bekanntmachungsdatum)\n\nBremen Amtsgericht Bremen HRB 37154\nRegisterbekanntmachung nach dem Umwandlungsgesetz 03.12.2024 (Eintragungsdatum)\n\nChanghua South East Holding GmbH\nGesellschaft mit beschränkter Haftung\nBremen\n\nZu Eintragungsnummer 6 vom 03.12.2024 wird als nicht eingetragen veröffentlicht: Den Gläubigern der an der Verschmelzung beteiligten Rechtsträger ist, wenn sie binnen sechs Monaten nach dem Tag, an dem die Eintragung der Verschmelzung in das Register des Sitzes desjenigen Rechtsträgers, dessen Gläubiger sie sind, als bekannt gemacht gilt, ihren Anspruch nach Grund und Höhe schriftlich anmelden, Sicherheit zu leisten, soweit sie nicht Befriedigung verlangen können. Dieses Recht steht den Gläubigern jedoch nur zu, wenn sie glaubhaft machen, dass durch die Verschmelzung die Erfüllung ihrer Forderung gefährdet wird. Das Recht, Sicherheitsleistung zu verlangen, steht Gläubigern nicht zu, die im Falle der Insolvenz ein Recht auf vorzugsweise Befriedigung aus einer Deckungsmasse haben, die nach gesetzlicher Vorschrift zu ihrem Schutz errichtet und staatlich überwacht ist."
    },
    {
      "date": "2024-12-04",
      "id": "95422",
      "original_text": "Löschungsankündigung\nBremen Amtsgericht Bremen HRB 31506\ni3 - Projektierungsgesellschaft UG (haftungsbeschränkt) – Bremen",
      "type": "Löschungsankündigung",
      "state": "Bremen",
      "amtsgericht": "Amtsgericht Bremen",
      "registernummer": "HRB 31506",
      "registerart": "HRB",
      "company_name": "i3 - Projektierungsgesellschaft UG (haftungsbeschränkt)",
      "company_seat": "Bremen",
      "details": "04.12.2024 (Bekanntmachungsdatum)\n\nBremen Amtsgericht Bremen HRB 31506\nLöschungsankündigung\n\ni3 - Projektierungsgesellschaft UG (haftungsbeschränkt)\nGesellschaft mit beschränkter Haftung\nBremen\n\nEs ist beabsichtigt die im Handelsregister eingetragene Gesellschaft von Amts wegen gemäß § 394 FamFG zu löschen. Gegen die Löschung kann beim AG Bremen schriftlich oder zu Protokoll der Geschäftsstelle Widerspruch eingelegt werden. Widerspruchsfrist 4 Wochen."
    },
    {
      "date": "2024-12-04",
      "id": "95423",
      "original_text": "Einreichung neuer Dokumente\nNordrhein-Westfalen Amtsgericht Düsseldorf HRB 34345\nDIS AG – Düsseldorf",
      "type": "Einreichung neuer Dokumente",
      "state": "Nordrhein-Westfalen",
      "amtsgericht": "Amtsgericht Düsseldorf",
      "registernummer": "HRB 34345",
      "registerart": "HRB",
      "company_name": "DIS AG",
      "company_seat": "Düsseldorf",
      "details": "04.12.2024 (Bekanntmachungsdatum)\n\nNordrhein-Westfalen Amtsgericht Düsseldorf HRB 34345\nEinreichung neuer Dokumente\n\nDIS AG\nAktiengesellschaft\nDüsseldorf\n\nDem Registergericht ist eine Liste der Mitglieder des Aufsichtsrates eingereicht worden."
    },
    {
      "date": "2024-12-04",
      "id": "95424",
      "original_text": "Registerbekanntmachung nach dem Umwandlungsgesetz\nNordrhein-Westfalen Amtsgericht Hamm HRB 2798\nDSI Micro Matic GmbH – Hamm",
      "type": "Registerbekanntmachung nach dem Umwandlungsgesetz",
      "state": "Nordrhein-Westfalen",
      "amtsgericht": "Amtsgericht Hamm",
      "registernummer": "HRB 2798",
      "registerart": "HRB",
      "company_name": "DSI Micro Matic GmbH",
      "company_seat": "Hamm",
      "details": "04.12.2024 (Bekanntmachungsdatum)\n\nNordrhein-Westfalen Amtsgericht Hamm HRB 2798\nRegisterbekanntmachung nach dem Umwandlungsgesetz 04.12.2024 (Eintragungsdatum)\n\nDSI Micro Matic GmbH\nGesellschaft mit beschränkter Haftung\nHamm\n\nDen Gläubigern der an der Verschmelzung beteiligten Rechtsträger ist, wenn sie binnen sechs Monaten nach dem Tag, an dem die Eintragung der Verschmelzung in das Register des Sitzes derjenigen Rechtsträger deren Gläubiger sie sind, nach § 19 Absatz 3 UmwG als bekanntgemacht gilt, ihren Anspruch nach Grund und Höhe schriftlich anmelden, Sicherheit zu leisten, soweit sie nicht Befriedigung verlangen können. Dieses Recht steht den Gläubigern jedoch nur zu, wenn sie glaubhaft machen, dass durch die Verschmelzung die Erfüllung ihrer Forderung gefährdet wird."
    },
    {
      "date": "2024-12-04",
      "id": "95425",
      "original_text": "Löschungsankündigung\nNordrhein-Westfalen Amtsgericht Dortmund HRB 9884\nVoigt GmbH – Dortmund",
      "type": "Löschungsankündigung",
      "state": "Nordrhein-Westfalen",
      "amtsgericht": "Amtsgericht Dortmund",
      "registernummer": "HRB 9884",
      "registerart": "HRB",
      "company_name": "Voigt GmbH",
      "company_seat": "Dortmund",
      "details": "04.12.2024 (Bekanntmachungsdatum)\n\nNordrhein-Westfalen Amtsgericht Dortmund HRB 9884\nLöschungsankündigung\n\nVoigt GmbH\nGesellschaft mit beschränkter Haftung\nDortmund\n\nDas Registergericht beabsichtigt die Gesellschaft von Amts wegen nach § 394 FamFG zu löschen. Die Frist zur Erhebung eines Widerspruchs ist auf zwei Monate festgesetzt."
    },
    {
      "date": "2024-12-04",
      "id": "95426",
      "original_text": "Registerbekanntmachung nach dem Umwandlungsgesetz\nNordrhein-Westfalen Amtsgericht Paderborn HRB 17450\nMRH Trowe & Lurse GmbH – Salzkotten",
      "type": "Registerbekanntmachung nach dem Umwandlungsgesetz",
      "state": "Nordrhein-Westfalen",
      "amtsgericht": "Amtsgericht Paderborn",
      "registernummer": "HRB 17450",
      "registerart": "HRB",
      "company_name": "MRH Trowe & Lurse GmbH",
      "company_seat": "Salzkotten",
      "details": "04.12.2024 (Bekanntmachungsdatum)\n\nNordrhein-Westfalen Amtsgericht Paderborn HRB 17450\nRegisterbekanntmachung nach dem Umwandlungsgesetz 04.12.2024 (Eintragungsdatum)\n\nMRH Trowe & Lurse GmbH\nGesellschaft mit beschränkter Haftung\nSalzkotten\n\nDen Gläubigern der an der formwechselnden Umwandlung beteiligten Rechtsträger ist, wenn sie binnen sechs Monaten nach dem Tag, an dem die Eintragung der formwechselnden Umwandlung in das Register des Sitzes desjenigen Rechtsträgers, dessen Gläubiger sie sind, nach § 19 Absatz 3 UmwG als bekanntgemacht gilt, ihren Anspruch nach Grund und Höhe schriftlich anmelden, Sicherheit zu leisten, soweit sie nicht Befriedigung verlangen können. Dieses Recht steht den Gläubigern jedoch nur zu, wenn sie glaubhaft machen, dass durch die formwechselnden Umwandlung die Erfüllung ihrer Forderung gefährdet wird."
    },
    {
      "date": "2024-12-04",
      "id": "95427",
      "original_text": "Löschungsankündigung\nNordrhein-Westfalen Amtsgericht Dortmund HRB 34279\nIlio GmbH – Lünen",
      "type": "Löschungsankündigung",
      "state": "Nordrhein-Westfalen",
      "amtsgericht": "Amtsgericht Dortmund",
      "registernummer": "HRB 34279",
      "registerart": "HRB",
      "company_name": "Ilio GmbH",
      "company_seat": "Lünen",
      "details": "04.12.2024 (Bekanntmachungsdatum)\n\nNordrhein-Westfalen Amtsgericht Dortmund HRB 34279\nLöschungsankündigung\n\nIlio GmbH\nGesellschaft mit beschränkter Haftung\nLünen\n\nDas Registergericht beabsichtigt die Gesellschaft von Amts wegen nach § 394 FamFG zu löschen. Die Frist zur Erhebung eines Widerspruchs ist auf zwei Monate festgesetzt."
    },
    {
      "date": "2024-12-04",
      "id": "95428",
      "original_text": "Löschungsankündigung\nNordrhein-Westfalen Amtsgericht Duisburg HRB 25382\nSumo GmbH – Duisburg",
      "type": "Löschungsankündigung",
      "state": "Nordrhein-Westfalen",
      "amtsgericht": "Amtsgericht Duisburg",
      "registernummer": "HRB 25382",
      "registerart": "HRB",
      "company_name": "Sumo GmbH",
      "company_seat": "Duisburg",
      "details": "04.12.2024 (Bekanntmachungsdatum)\n\nNordrhein-Westfalen Amtsgericht Duisburg HRB 25382\nLöschungsankündigung\n\nSumo GmbH\nGesellschaft mit beschränkter Haftung\nDuisburg\n\nDas Registergericht beabsichtigt, die im Handelsregister unter HRB 25382  eingetragene Gesellschaft  Sumo GmbH gemäß § 394 FamFG wegen Vermögenslosigkeit von Amts wegen zu löschen. Gegen diese Verfügung kann Widerspruch eingelegt werden. Die Frist zur Erhebung eines Widerspruchs gegen die beabsichtigte Löschung von Amts wegen ist auf drei Monate festgesetzt. Rechtsbehelfsbelehrung Der Widerspruch ist bei dem Amtsgericht Duisburg, Kardinal-Galen-Str. 124-132, 47058 Duisburg schriftlich in deutscher Sprache oder zur Niederschrift der Geschäftsstelle einzulegen. Der Widerspruch kann auch zur Niederschrift der Geschäftsstelle eines jeden Amtsgerichtes abgegeben werden. Die Einlegung ist auch durch Übertragung eines elektronischen Dokuments an die elektronische Poststelle des Gerichts möglich. Das elektronische Dokument muss für die Bearbeitung durch das Gericht geeignet und mit einer qualifizierten elektronischen Signatur der verantwortenden Person versehen sein oder von der verantwortenden Person signiert und auf einem sicheren Übermittlungsweg gemäß § 130 a ZPO nach näherer Maßgabe der Verordnung über die technischen Rahmenbedingungen des elektronischen Rechtsverkehrs und über das besondere elektronische Behördenpostfach (BGBl. I, S. 3803) eingereicht werden. Weitere Informationen erhalten Sie auf der Internetseite www.justiz.de <http://www.justiz.de>. Der Widerspruch muss spätestens innerhalb der gesetzten Frist bei dem Amtsgericht Duisburg eingegangen sein. Dies gilt auch dann, wenn der Widerspruch zur Niederschrift der Geschäftsstelle eines anderen Amtsgerichtes abgegeben wurde. Die Frist beginnt mit der Veröffentlichung. Fällt das Ende der Frist auf einen Sonntag, einen allgemeinen Feiertag oder Sonnabend, so endet die Frist mit Ablauf des nächsten Werktages. Der Widerspruch muss die Bezeichnung der angefochtenen Verfügung sowie die Erklärung enthalten, dass Widerspruch gegen diese Verfügung eingelegt wird. Er ist zu unterzeichnen und soll begründet werden."
    },
    {
      "date": "2024-12-04",
      "id": "95429",
      "original_text": "Registerbekanntmachung nach dem Umwandlungsgesetz\nNordrhein-Westfalen Amtsgericht Siegen HRA 10013\nTuS Ferndorf Handball GmbH & Co. KG – Kreuztal",
      "type": "Registerbekanntmachung nach dem Umwandlungsgesetz",
      "state": "Nordrhein-Westfalen",
      "amtsgericht": "Amtsgericht Siegen",
      "registernummer": "HRA 10013",
      "registerart": "HRA",
      "company_name": "TuS Ferndorf Handball GmbH & Co. KG",
      "company_seat": "Kreuztal",
      "details": "04.12.2024 (Bekanntmachungsdatum)\n\nNordrhein-Westfalen Amtsgericht Siegen HRA 10013\nRegisterbekanntmachung nach dem Umwandlungsgesetz 04.12.2024 (Eintragungsdatum)\n\nTuS Ferndorf Handball GmbH & Co. KG\nKommanditgesellschaft\nKreuztal\n\nDen Gläubigern der an der formwechselnden Umwandlung beteiligten Rechtsträger ist, wenn sie binnen sechs Monaten nach dem Tag, an dem die Eintragung der formwechselnden Umwandlung in das Register des Sitzes desjenigen Rechtsträgers, dessen Gläubiger sie sind, nach § 19 Absatz 3 UmwG als bekanntgemacht gilt, ihren Anspruch nach Grund und Höhe schriftlich anmelden, Sicherheit zu leisten, soweit sie nicht Befriedigung verlangen können. Dieses Recht steht den Gläubigern jedoch nur zu, wenn sie glaubhaft machen, dass durch die formwechselnden Umwandlung die Erfüllung ihrer Forderung gefährdet wird."
    },
    {
      "date": "2024-12-04",
      "id": "95430",
      "original_text": "Einreichung neuer Dokumente\nNordrhein-Westfalen Amtsgericht Dortmund HRB 19417\nEDG Entsorgung Dortmund GmbH – Dortmund",
      "type": "Einreichung neuer Dokumente",
      "state": "Nordrhein-Westfalen",
      "amtsgericht": "Amtsgericht Dortmund",
      "registernummer": "HRB 19417",
      "registerart": "HRB",
      "company_name": "EDG Entsorgung Dortmund GmbH",
      "company_seat": "Dortmund",
      "details": "04.12.2024 (Bekanntmachungsdatum)\n\nNordrhein-Westfalen Amtsgericht Dortmund HRB 19417\nEinreichung neuer Dokumente\n\nEDG Entsorgung Dortmund GmbH\nGesellschaft mit beschränkter Haftung\nDortmund\n\nDem Registergericht ist eine neue Liste der Mitglieder des Aufsichtsrates eingereicht worden."
    },
    {
      "date": "2024-12-04",
      "id": "95431",
      "original_text": "Einreichung neuer Dokumente\nNordrhein-Westfalen Amtsgericht Dortmund HRB 9696\nEDG Holding GmbH – Dortmund",
      "type": "Einreichung neuer Dokumente",
      "state": "Nordrhein-Westfalen",
      "amtsgericht": "Amtsgericht Dortmund",
      "registernummer": "HRB 9696",
      "registerart": "HRB",
      "company_name": "EDG Holding GmbH",
      "company_seat": "Dortmund",
      "details": "04.12.2024 (Bekanntmachungsdatum)\n\nNordrhein-Westfalen Amtsgericht Dortmund HRB 9696\nEinreichung neuer Dokumente\n\nEDG Holding GmbH\nGesellschaft mit beschränkter Haftung\nDortmund\n\nDem Registergericht ist eine neue Liste der Mitglieder des Aufsichtsrates eingereicht worden."
    },
    {
      "date": "2024-12-04",
      "id": "95432",
      "original_text": "Einreichung neuer Dokumente\nNordrhein-Westfalen Amtsgericht Duisburg HRB 1171\nDuisburger Versorgungs- und Verkehrsgesellschaft mit beschränkter Haftung – Duisburg",
      "type": "Einreichung neuer Dokumente",
      "state": "Nordrhein-Westfalen",
      "amtsgericht": "Amtsgericht Duisburg",
      "registernummer": "HRB 1171",
      "registerart": "HRB",
      "company_name": "Duisburger Versorgungs- und Verkehrsgesellschaft mit beschränkter Haftung",
      "company_seat": "Duisburg",
      "details": "04.12.2024 (Bekanntmachungsdatum)\n\nNordrhein-Westfalen Amtsgericht Duisburg HRB 1171\nEinreichung neuer Dokumente\n\nDuisburger Versorgungs- und Verkehrsgesellschaft mit beschränkter Haftung\nGesellschaft mit beschränkter Haftung\nDuisburg\n\nDem Registergericht ist eine neue Liste der Mitglieder des Aufsichtsrates eingereicht worden."
    },
    {
      "date": "2024-12-04",
      "id": "95433",
      "original_text": "Registerbekanntmachung nach dem Umwandlungsgesetz\nNordrhein-Westfalen Amtsgericht Paderborn HRB 3758\nLurse AG – Salzkotten",
      "type": "Registerbekanntmachung nach dem Umwandlungsgesetz",
      "state": "Nordrhein-Westfalen",
      "amtsgericht": "Amtsgericht Paderborn",
      "registernummer": "HRB 3758",
      "registerart": "HRB",
      "company_name": "Lurse AG",
      "company_seat": "Salzkotten",
      "details": "04.12.2024 (Bekanntmachungsdatum)\n\nNordrhein-Westfalen Amtsgericht Paderborn HRB 3758\nRegisterbekanntmachung nach dem Umwandlungsgesetz 04.12.2024 (Eintragungsdatum)\n\nLurse AG\nAktiengesellschaft\nSalzkotten\n\nDen Gläubigern der an der formwechselnden Umwandlung beteiligten Rechtsträger ist, wenn sie binnen sechs Monaten nach dem Tag, an dem die Eintragung der formwechselnden Umwandlung in das Register des Sitzes desjenigen Rechtsträgers, dessen Gläubiger sie sind, nach § 19 Absatz 3 UmwG als bekanntgemacht gilt, ihren Anspruch nach Grund und Höhe schriftlich anmelden, Sicherheit zu leisten, soweit sie nicht Befriedigung verlangen können. Dieses Recht steht den Gläubigern jedoch nur zu, wenn sie glaubhaft machen, dass durch die formwechselnden Umwandlung die Erfüllung ihrer Forderung gefährdet wird."
    },
    {
      "date": "2024-12-04",
      "id": "95434",
      "original_text": "Sonstige Registerbekanntmachung\nNordrhein-Westfalen Amtsgericht Köln HRB 63665\nSchumacher Bergische Werke GmbH – Wermelskirchen",
      "type": "Sonstige Registerbekanntmachung",
      "state": "Nordrhein-Westfalen",
      "amtsgericht": "Amtsgericht Köln",
      "registernummer": "HRB 63665",
      "registerart": "HRB",
      "company_name": "Schumacher Bergische Werke GmbH",
      "company_seat": "Wermelskirchen",
      "details": "04.12.2024 (Bekanntmachungsdatum)\n\nNordrhein-Westfalen Amtsgericht Köln HRB 63665\nSonstige Registerbekanntmachung 04.12.2024 (Eintragungsdatum)\n\nSchumacher Bergische Werke GmbH\nGesellschaft mit beschränkter Haftung\nWermelskirchen\n\nAls nicht eingetragen wird veröffentlicht: Den Gläubigern der Gesellschaft, deren Forderungen begründet worden sind bevor die Eintragung der Beendigung des Beherrschungs- und Gewinnabführungsvertrages  in das Handelsregister nach § 10 des Handelsgesetzbuches als bekanntgemacht gilt, hat der andere Vertragsteil Sicherheit zu leisten, wenn sie sich binnen sechs Monaten nach der Bekanntmachung der Eintragung zu diesem Zweck bei ihm melden."
    },
    {
      "date": "2024-12-04",
      "id": "95435",
      "original_text": "Löschungsankündigung\nNordrhein-Westfalen Amtsgericht Dortmund HRB 19749\nBRIMAG Broer Immobilien und Anlagen GmbH – Lünen",
      "type": "Löschungsankündigung",
      "state": "Nordrhein-Westfalen",
      "amtsgericht": "Amtsgericht Dortmund",
      "registernummer": "HRB 19749",
      "registerart": "HRB",
      "company_name": "BRIMAG Broer Immobilien und Anlagen GmbH",
      "company_seat": "Lünen",
      "details": "04.12.2024 (Bekanntmachungsdatum)\n\nNordrhein-Westfalen Amtsgericht Dortmund HRB 19749\nLöschungsankündigung\n\nBRIMAG Broer Immobilien und Anlagen GmbH\nGesellschaft mit beschränkter Haftung\nLünen\n\nDas Registergericht beabsichtigt die Gesellschaft von Amts wegen nach § 394 FamFG zu löschen. Die Frist zur Erhebung eines Widerspruchs ist auf zwei Monate festgesetzt."
    },
    {
      "date": "2024-12-04",
      "id": "95436",
      "original_text": "Löschungsankündigung\nNordrhein-Westfalen Amtsgericht Dortmund HRB 36469\nSchwanitz GmbH – Dortmund",
      "type": "Löschungsankündigung",
      "state": "Nordrhein-Westfalen",
      "amtsgericht": "Amtsgericht Dortmund",
      "registernummer": "HRB 36469",
      "registerart": "HRB",
      "company_name": "Schwanitz GmbH",
      "company_seat": "Dortmund",
      "details": "04.12.2024 (Bekanntmachungsdatum)\n\nNordrhein-Westfalen Amtsgericht Dortmund HRB 36469\nLöschungsankündigung\n\nSchwanitz GmbH\nGesellschaft mit beschränkter Haftung\nDortmund\n\nDas Registergericht beabsichtigt die Gesellschaft von Amts wegen nach § 394 FamFG zu löschen. Die Frist zur Erhebung eines Widerspruchs ist auf zwei Monate festgesetzt."
    },
    {
      "date": "2024-12-04",
      "id": "95437",
      "original_text": "Registerbekanntmachung nach dem Umwandlungsgesetz\nNordrhein-Westfalen Amtsgericht Dortmund HRB 12820\nNill Beteiligungen GmbH – Dortmund",
      "type": "Registerbekanntmachung nach dem Umwandlungsgesetz",
      "state": "Nordrhein-Westfalen",
      "amtsgericht": "Amtsgericht Dortmund",
      "registernummer": "HRB 12820",
      "registerart": "HRB",
      "company_name": "Nill Beteiligungen GmbH",
      "company_seat": "Dortmund",
      "details": "04.12.2024 (Bekanntmachungsdatum)\n\nNordrhein-Westfalen Amtsgericht Dortmund HRB 12820\nRegisterbekanntmachung nach dem Umwandlungsgesetz 04.12.2024 (Eintragungsdatum)\n\nNill Beteiligungen GmbH\nGesellschaft mit beschränkter Haftung\nDortmund\n\nDen Gläubigern der an der Verschmelzung beteiligten Rechtsträger ist, wenn sie binnen sechs Monaten nach dem Tag, an dem die Eintragung der Verschmelzung in das Register des Sitzes desjenigen Rechtsträgers, dessen Gläubiger sie sind, nach § 19 Absatz 3 UmwG als bekanntgemacht gilt, ihren Anspruch nach Grund und Höhe schriftlich anmelden, Sicherheit zu leisten, soweit sie nicht Befriedigung verlangen können. Dieses Recht steht den Gläubigern jedoch nur zu, wenn sie glaubhaft machen, dass durch die Verschmelzung die Erfüllung ihrer Forderung gefährdet wird."
    },
    {
      "date": "2024-12-04",
      "id": "95438",
      "original_text": "Löschungsankündigung\nNordrhein-Westfalen Amtsgericht Köln HRB 117637\nJet Logistik GmbH – Brühl",
      "type": "Löschungsankündigung",
      "state": "Nordrhein-Westfalen",
      "amtsgericht": "Amtsgericht Köln",
      "registernummer": "HRB 117637",
      "registerart": "HRB",
      "company_name": "Jet Logistik GmbH",
      "company_seat": "Brühl",
      "details": "04.12.2024 (Bekanntmachungsdatum)\n\nNordrhein-Westfalen Amtsgericht Köln HRB 117637\nLöschungsankündigung\n\nJet Logistik GmbH\nGesellschaft mit beschränkter Haftung\nBrühl\n\nDas Registergericht beabsichtigt, die im Handelsregister eingetragene Gesellschaft gemäß § 394 Absatz 1 FamFG wegen Vermögenslosigkeit von Amts wegen zu löschen. Gegen diese Verfügung kann Widerspruch eingelegt werden. Die Frist zur Erhebung eines Widerspruchs gegen die beabsichtigte Löschung von Amts wegen ist auf einen Monat festgesetzt. Rechtsbehelfsbelehrung: Gegen diese Verfügung können Sie Widerspruch einlegen. Der Widerspruch ist bei dem Amtsgericht Köln, Reichenspergerplatz 1, 50670 Köln schriftlich in deutscher Sprache oder zur Niederschrift der Geschäftsstelle einzulegen. Der Widerspruch kann auch zur Niederschrift der Geschäftsstelle eines jeden Amtsgerichtes abgegeben werden. Die Einlegung ist auch durch Übertragung eines elektronischen Dokuments an die elektronische Poststelle des Gerichts möglich. Das elektronische Dokument muss für die Bearbeitung durch das Gericht geeignet und mit einer qualifizierten elektronischen Signatur der verantwortenden Person versehen sein oder von der verantwortenden Person signiert und auf einem sicheren Übermittlungsweg gemäß § 130a ZPO nach näherer Maßgabe der Verordnung über die technischen Rahmenbedingungen des elektronischen Rechtsverkehrs und über das besondere elektronische Behördenpostfach (BGBl. I, S.3803) eingereicht werden. Weitere Informationen erhalten Sie auf der Internetseite www.justiz.de.Der Widerspruch muss spätestens innerhalb der gesetzten Frist bei dem Amtsgericht Köln eingegangen sein. Dies gilt auch dann, wenn der Widerspruch zur Niederschrift der Geschäftsstelle eines anderen Amtsgerichtes abgegeben wurde. Die Frist beginnt mit der Veröffentlichung. Fällt das Ende der Frist auf einen Sonntag, einen allgemeinen Feiertag oder Sonnabend, so endet die Frist mit Ablauf des nächsten Werktages.\n\nDer Widerspruch muss die Bezeichnung der angefochtenen Verfügung sowie die Erklärung enthalten, dass Widerspruch gegen diese Verfügung eingelegt wird. Er ist zu unterzeichnen und soll begründet werden."
    },
    {
      "date": "2024-12-04",
      "id": "95439",
      "original_text": "Löschungsankündigung\nHessen Amtsgericht Frankfurt am Main HRB 106620\nIBP Corp Deutschland GmbH – Liederbach",
      "type": "Löschungsankündigung",
      "state": "Hessen",
      "amtsgericht": "Amtsgericht Frankfurt am Main",
      "registernummer": "HRB 106620",
      "registerart": "HRB",
      "company_name": "IBP Corp Deutschland GmbH",
      "company_seat": "Liederbach",
      "details": "04.12.2024 (Bekanntmachungsdatum)\n\nHessen Amtsgericht Frankfurt am Main HRB 106620\nLöschungsankündigung\n\nIBP Corp Deutschland GmbH\nGesellschaft mit beschränkter Haftung\nLiederbach\n\nDas Registergericht beabsichtigt die im Handelsregister eingetragene Gesellschaft von Amts wegen nach § 394 FamFG zu löschen. Die Frist zur Erhebung eines Widerspruchs gegen die beabsichtigte Löschung wird auf 1 Monat festgesetzt."
    },
    {
      "date": "2024-12-04",
      "id": "95440",
      "original_text": "Registerbekanntmachung nach dem Umwandlungsgesetz\nHessen Amtsgericht Frankfurt am Main HRB 91841\nainovi GmbH – Eschborn",
      "type": "Registerbekanntmachung nach dem Umwandlungsgesetz",
      "state": "Hessen",
      "amtsgericht": "Amtsgericht Frankfurt am Main",
      "registernummer": "HRB 91841",
      "registerart": "HRB",
      "company_name": "ainovi GmbH",
      "company_seat": "Eschborn",
      "details": "04.12.2024 (Bekanntmachungsdatum)\n\nHessen Amtsgericht Frankfurt am Main HRB 91841\nRegisterbekanntmachung nach dem Umwandlungsgesetz 04.12.2024 (Eintragungsdatum)\n\nainovi GmbH\nGesellschaft mit beschränkter Haftung\nEschborn\n\nDen Gläubigern der an der Verschmelzung beteiligten Rechtsträger ist, wenn sie binnen sechs Monaten nach dem Tag, an dem die Eintragung der Verschmelzung in das Register des Sitzes derjenigen Rechtsträger deren Gläubiger sie sind, nach § 19 Absatz 3 UmwG bekannt gemacht worden ist, ihren Anspruch nach Grund und Höhe schriftlich anmelden, Sicherheit zu leisten, soweit sie nicht Befriedigung verlangen können. Dieses Recht steht den Gläubigern jedoch nur zu, wenn sie glaubhaft machen, dass durch die Verschmelzung die Erfüllung ihrer Forderung gefährdet wird."
    },
    {
      "date": "2024-12-04",
      "id": "95441",
      "original_text": "Registerbekanntmachung nach dem Umwandlungsgesetz\nHessen Amtsgericht Frankfurt am Main HRB 126303\nainovi Products UG (haftungsbeschränkt) – Eschborn",
      "type": "Registerbekanntmachung nach dem Umwandlungsgesetz",
      "state": "Hessen",
      "amtsgericht": "Amtsgericht Frankfurt am Main",
      "registernummer": "HRB 126303",
      "registerart": "HRB",
      "company_name": "ainovi Products UG (haftungsbeschränkt)",
      "company_seat": "Eschborn",
      "details": "04.12.2024 (Bekanntmachungsdatum)\n\nHessen Amtsgericht Frankfurt am Main HRB 126303\nRegisterbekanntmachung nach dem Umwandlungsgesetz 04.12.2024 (Eintragungsdatum)\n\nainovi Products UG (haftungsbeschränkt)\nGesellschaft mit beschränkter Haftung\nEschborn\n\nDen Gläubigern der an der Verschmelzung beteiligten Rechtsträger ist, wenn sie binnen sechs Monaten nach dem Tag, an dem die Eintragung der Verschmelzung in das Register des Sitzes derjenigen Rechtsträger deren Gläubiger sie sind, nach § 19 Absatz 3 UmwG bekannt gemacht worden ist, ihren Anspruch nach Grund und Höhe schriftlich anmelden, Sicherheit zu leisten, soweit sie nicht Befriedigung verlangen können. Dieses Recht steht den Gläubigern jedoch nur zu, wenn sie glaubhaft machen, dass durch die Verschmelzung die Erfüllung ihrer Forderung gefährdet wird."
    },
    {
      "date": "2024-12-04",
      "id": "95442",
      "original_text": "Löschungsankündigung\nHessen Amtsgericht Bad Hersfeld HRA 1489\nZühlke GmbH & Co. Fotohandel KG – Haunetal",
      "type": "Löschungsankündigung",
      "state": "Hessen",
      "amtsgericht": "Amtsgericht Bad Hersfeld",
      "registernummer": "HRA 1489",
      "registerart": "HRA",
      "company_name": "Zühlke GmbH & Co. Fotohandel KG",
      "company_seat": "Haunetal",
      "details": "04.12.2024 (Bekanntmachungsdatum)\n\nHessen Amtsgericht Bad Hersfeld HRA 1489\nLöschungsankündigung\n\nZühlke GmbH & Co. Fotohandel KG\nKommanditgesellschaft\nHaunetal\n\nDas Registergericht beabsichtigt die im Handelsregister eingetragene Firma von Amts wegen nach § 394 FamFG zu löschen. Die Frist zur Erhebung eines Widerspruchs gegen die beabsichtigte Löschung wird auf 6 Wochen festgesetzt."
    },
    {
      "date": "2024-12-04",
      "id": "95443",
      "original_text": "Löschungsankündigung\nHessen Amtsgericht Wiesbaden VR 1162\nInstitut für Erziehungshilfe e. V. – Wiesbaden",
      "type": "Löschungsankündigung",
      "state": "Hessen",
      "amtsgericht": "Amtsgericht Wiesbaden",
      "registernummer": "VR 1162",
      "registerart": "VR",
      "company_name": "Institut für Erziehungshilfe e. V.",
      "company_seat": "Wiesbaden",
      "details": "04.12.2024 (Bekanntmachungsdatum)\n\nHessen Amtsgericht Wiesbaden VR 1162\nLöschungsankündigung 04.12.2024 (Eintragungsdatum)\n\nInstitut für Erziehungshilfe e. V.\neingetragener Verein\nWiesbaden\n\nDer Verein ist aufgelöst."
    }
  ]
}