{
  "date": "2024-12-13",
  "date_of_scrape": "2024-12-14T04:07:56.808Z",
  "tool_version": "0.2.0",
  "number_of_announcements": 132,
  "announcements": [
    {
      "date": "2024-12-13",
      "id": "96325",
      "original_text": "Registerbekanntmachung nach dem Umwandlungsgesetz\nBayern Amtsgericht München HRB 166188\nGesellschaft für kommunale Verkehrs- und Versorgungsanlagen mit beschränkter Haftung – Pullach i. Isartal",
      "type": "Registerbekanntmachung nach dem Umwandlungsgesetz",
      "state": "Bayern",
      "amtsgericht": "Amtsgericht München",
      "registernummer": "HRB 166188",
      "registerart": "HRB",
      "company_name": "Gesellschaft für kommunale Verkehrs- und Versorgungsanlagen mit beschränkter Haftung",
      "company_seat": "Pullach i. Isartal",
      "details": "13.12.2024 (Bekanntmachungsdatum)\n\nBayern Amtsgericht München HRB 166188\nRegisterbekanntmachung nach dem Umwandlungsgesetz 12.12.2024 (Eintragungsdatum)\n\nGesellschaft für kommunale Verkehrs- und Versorgungsanlagen mit beschränkter Haftung\nGesellschaft mit beschränkter Haftung\nPullach i. Isartal\n\nDen Gläubigern der an der Verschmelzung beteiligten Rechtsträger ist, wenn sie binnen sechs Monaten nach dem Tag, an dem die Eintragung der Verschmelzung in das Register des Sitzes desjenigen Rechtsträgers, dessen Gläubiger sie sind, nach § 19 Abs. 3 UmwG als bekannt gemacht gilt, ihren Anspruch nach Grund und Höhe schriftlich anmelden, Sicherheit zu leisten, soweit sie nicht Befriedigung verlangen können. Dieses Recht steht den Gläubigern jedoch nur zu, wenn sie glaubhaft machen, dass durch die Verschmelzung die Erfüllung ihrer Forderung gefährdet wird."
    },
    {
      "date": "2024-12-13",
      "id": "96326",
      "original_text": "Löschungsankündigung\nBayern Amtsgericht München HRB 232420\nMezaBites GmbH – Starnberg",
      "type": "Löschungsankündigung",
      "state": "Bayern",
      "amtsgericht": "Amtsgericht München",
      "registernummer": "HRB 232420",
      "registerart": "HRB",
      "company_name": "MezaBites GmbH",
      "company_seat": "Starnberg",
      "details": "13.12.2024 (Bekanntmachungsdatum)\n\nBayern Amtsgericht München HRB 232420\nLöschungsankündigung 12.12.2024 (Eintragungsdatum)\n\nMezaBites GmbH\nGesellschaft mit beschränkter Haftung\nStarnberg\n\nDas Registergericht beabsichtigt, die im Handelsregister eingetragene Firma von Amts wegen nach § 31 Abs. 2 HGB, § 393 FamFG zu löschen. Die Frist zur Erhebung eines Widerspruchs ist auf drei Monate festgesetzt."
    },
    {
      "date": "2024-12-13",
      "id": "96327",
      "original_text": "Löschungsankündigung\nBayern Amtsgericht Kempten (Allgäu) HRB 11007\nReifenservice Dorn GmbH – Altusried",
      "type": "Löschungsankündigung",
      "state": "Bayern",
      "amtsgericht": "Amtsgericht Kempten (Allgäu)",
      "registernummer": "HRB 11007",
      "registerart": "HRB",
      "company_name": "Reifenservice Dorn GmbH",
      "company_seat": "Altusried",
      "details": "13.12.2024 (Bekanntmachungsdatum)\n\nBayern Amtsgericht Kempten (Allgäu) HRB 11007\nLöschungsankündigung\n\nReifenservice Dorn GmbH\nGesellschaft mit beschränkter Haftung\nAltusried\n\nDas Registergericht beabsichtigt, die im Handelsregister eingetragene Gesellschaft wegen Vermögenslosigkeit von Amts wegen nach § 394 FamFG zu löschen. Die Frist zur Erhebung eines Widerspruchs ist auf einen Monat festgesetzt."
    },
    {
      "date": "2024-12-13",
      "id": "96328",
      "original_text": "Löschungsankündigung\nBayern Amtsgericht Bayreuth HRA 3863\nQuantor International Vertriebsgesellschaft mbH & Co. KG – Bayreuth",
      "type": "Löschungsankündigung",
      "state": "Bayern",
      "amtsgericht": "Amtsgericht Bayreuth",
      "registernummer": "HRA 3863",
      "registerart": "HRA",
      "company_name": "Quantor International Vertriebsgesellschaft mbH & Co. KG",
      "company_seat": "Bayreuth",
      "details": "13.12.2024 (Bekanntmachungsdatum)\n\nBayern Amtsgericht Bayreuth HRA 3863\nLöschungsankündigung\n\nQuantor International Vertriebsgesellschaft mbH & Co. KG\nKommanditgesellschaft\nBayreuth\n\nDas Registergericht beabsichtigt, die im Handelsregister eingetragene Gesellschaft wegen Vermögenslosigkeit von Amts wegen nach § 394 FamFG zu löschen. Die Frist zur Erhebung eines Widerspruchs ist auf einen Monat festgesetzt."
    },
    {
      "date": "2024-12-13",
      "id": "96329",
      "original_text": "Registerbekanntmachung nach dem Umwandlungsgesetz\nBayern Amtsgericht München HRB 137300\nCLEVIS GmbH – München",
      "type": "Registerbekanntmachung nach dem Umwandlungsgesetz",
      "state": "Bayern",
      "amtsgericht": "Amtsgericht München",
      "registernummer": "HRB 137300",
      "registerart": "HRB",
      "company_name": "CLEVIS GmbH",
      "company_seat": "München",
      "details": "13.12.2024 (Bekanntmachungsdatum)\n\nBayern Amtsgericht München HRB 137300\nRegisterbekanntmachung nach dem Umwandlungsgesetz 12.12.2024 (Eintragungsdatum)\n\nCLEVIS GmbH\nGesellschaft mit beschränkter Haftung\nMünchen\n\nDen Gläubigern der an der Spaltung beteiligten Rechtsträger ist, wenn sie binnen sechs Monaten nach dem Tag, an dem die Eintragung der Spaltung in das Register des Sitzes desjenigen Rechtsträgers, dessen Gläubiger sie sind, nach §§ 125, 19 Abs. 3 UmwG als bekannt gemacht gilt, ihren Anspruch nach Grund und Höhe schriftlich anmelden, Sicherheit zu leisten, soweit sie nicht Befriedigung verlangen können. Dieses Recht steht den Gläubigern jedoch nur zu, wenn sie glaubhaft machen, dass durch die Spaltung die Erfüllung ihrer Forderung gefährdet wird."
    },
    {
      "date": "2024-12-13",
      "id": "96330",
      "original_text": "Registerbekanntmachung nach dem Umwandlungsgesetz\nBayern Amtsgericht Memmingen HRB 10826\nACC AICHAM CONCEPT CONSULTING AG – Neu-Ulm",
      "type": "Registerbekanntmachung nach dem Umwandlungsgesetz",
      "state": "Bayern",
      "amtsgericht": "Amtsgericht Memmingen",
      "registernummer": "HRB 10826",
      "registerart": "HRB",
      "company_name": "ACC AICHAM CONCEPT CONSULTING AG",
      "company_seat": "Neu-Ulm",
      "details": "13.12.2024 (Bekanntmachungsdatum)\n\nBayern Amtsgericht Memmingen HRB 10826\nRegisterbekanntmachung nach dem Umwandlungsgesetz 12.12.2024 (Eintragungsdatum)\n\nACC AICHAM CONCEPT CONSULTING AG\nAktiengesellschaft\nNeu-Ulm\n\nDen Gläubigern des formwechselnden Rechtsträgers ist, wenn sie binnen sechs Monaten nach dem Tag, an dem die Eintragung des Formwechsels nach § 201 UmwG als bekannt gemacht gilt, ihren Anspruch nach Grund und Höhe schriftlich anmelden, Sicherheit zu leisten, soweit sie nicht Befriedigung verlangen können. Dieses Recht steht den Gläubigern jedoch nur zu, wenn sie glaubhaft machen, dass durch den Formwechsel die Erfüllung ihrer Forderung gefährdet wird."
    },
    {
      "date": "2024-12-13",
      "id": "96331",
      "original_text": "Registerbekanntmachung nach dem Umwandlungsgesetz\nBayern Amtsgericht Nürnberg HRB 31186\nKIB Wohnungsbau GmbH – Nürnberg",
      "type": "Registerbekanntmachung nach dem Umwandlungsgesetz",
      "state": "Bayern",
      "amtsgericht": "Amtsgericht Nürnberg",
      "registernummer": "HRB 31186",
      "registerart": "HRB",
      "company_name": "KIB Wohnungsbau GmbH",
      "company_seat": "Nürnberg",
      "details": "13.12.2024 (Bekanntmachungsdatum)\n\nBayern Amtsgericht Nürnberg HRB 31186\nRegisterbekanntmachung nach dem Umwandlungsgesetz 12.12.2024 (Eintragungsdatum)\n\nKIB Wohnungsbau GmbH\nGesellschaft mit beschränkter Haftung\nNürnberg\n\nDen Gläubigern der an der Verschmelzung beteiligten Rechtsträger ist, wenn sie binnen sechs Monaten nach dem Tag, an dem die Eintragung der Verschmelzung in das Register des Sitzes desjenigen Rechtsträgers, dessen Gläubiger sie sind, nach § 19 Abs. 3 UmwG als bekannt gemacht gilt, ihren Anspruch nach Grund und Höhe schriftlich anmelden, Sicherheit zu leisten, soweit sie nicht Befriedigung verlangen können. Dieses Recht steht den Gläubigern jedoch nur zu, wenn sie glaubhaft machen, dass durch die Verschmelzung die Erfüllung ihrer Forderung gefährdet wird."
    },
    {
      "date": "2024-12-13",
      "id": "96332",
      "original_text": "Registerbekanntmachung nach dem Umwandlungsgesetz\nBayern Amtsgericht München HRB 139644\nSiemens Beteiligungen Inland GmbH – München",
      "type": "Registerbekanntmachung nach dem Umwandlungsgesetz",
      "state": "Bayern",
      "amtsgericht": "Amtsgericht München",
      "registernummer": "HRB 139644",
      "registerart": "HRB",
      "company_name": "Siemens Beteiligungen Inland GmbH",
      "company_seat": "München",
      "details": "13.12.2024 (Bekanntmachungsdatum)\n\nBayern Amtsgericht München HRB 139644\nRegisterbekanntmachung nach dem Umwandlungsgesetz 12.12.2024 (Eintragungsdatum)\n\nSiemens Beteiligungen Inland GmbH\nGesellschaft mit beschränkter Haftung\nMünchen\n\nDen Gläubigern der an der Ausgliederung beteiligten Rechtsträger ist, wenn sie binnen sechs Monaten nach dem Tag, an dem die Eintragung der Ausgliederung in das Register des Sitzes desjenigen Rechtsträgers, dessen Gläubiger sie sind, nach §§ 125, 19 Abs. 3 UmwG als bekannt gemacht gilt, ihren Anspruch nach Grund und Höhe schriftlich anmelden, Sicherheit zu leisten, soweit sie nicht Befriedigung verlangen können. Dieses Recht steht den Gläubigern jedoch nur zu, wenn sie glaubhaft machen, dass durch die Ausgliederung die Erfüllung ihrer Forderung gefährdet wird."
    },
    {
      "date": "2024-12-13",
      "id": "96333",
      "original_text": "Löschungsankündigung\nBayern Amtsgericht München HRB 239519\nGMB Int. Transporte GmbH – Kranzberg",
      "type": "Löschungsankündigung",
      "state": "Bayern",
      "amtsgericht": "Amtsgericht München",
      "registernummer": "HRB 239519",
      "registerart": "HRB",
      "company_name": "GMB Int. Transporte GmbH",
      "company_seat": "Kranzberg",
      "details": "13.12.2024 (Bekanntmachungsdatum)\n\nBayern Amtsgericht München HRB 239519\nLöschungsankündigung 12.12.2024 (Eintragungsdatum)\n\nGMB Int. Transporte GmbH\nGesellschaft mit beschränkter Haftung\nKranzberg\n\nDas Registergericht beabsichtigt, den im Handelsregister eingetragenen  Vertretungsberechtigten Görtler, Ingeborg * 03.11.1966 als Geschäftsführer wegen fehlender Eignung nach § 395 FamFG zu löschen. Die Frist zur Erhebung eines Widerspruchs ist auf drei Monate festgesetzt."
    },
    {
      "date": "2024-12-13",
      "id": "96334",
      "original_text": "Registerbekanntmachung nach dem Umwandlungsgesetz\nBayern Amtsgericht Nürnberg HRB 31725\n21st Century Gartenstadt GmbH – Nürnberg",
      "type": "Registerbekanntmachung nach dem Umwandlungsgesetz",
      "state": "Bayern",
      "amtsgericht": "Amtsgericht Nürnberg",
      "registernummer": "HRB 31725",
      "registerart": "HRB",
      "company_name": "21st Century Gartenstadt GmbH",
      "company_seat": "Nürnberg",
      "details": "13.12.2024 (Bekanntmachungsdatum)\n\nBayern Amtsgericht Nürnberg HRB 31725\nRegisterbekanntmachung nach dem Umwandlungsgesetz 12.12.2024 (Eintragungsdatum)\n\n21st Century Gartenstadt GmbH\nGesellschaft mit beschränkter Haftung\nNürnberg\n\nDen Gläubigern der an der Verschmelzung beteiligten Rechtsträger ist, wenn sie binnen sechs Monaten nach dem Tag, an dem die Eintragung der Verschmelzung in das Register des Sitzes desjenigen Rechtsträgers, dessen Gläubiger sie sind, nach § 19 Abs. 3 UmwG als bekannt gemacht gilt, ihren Anspruch nach Grund und Höhe schriftlich anmelden, Sicherheit zu leisten, soweit sie nicht Befriedigung verlangen können. Dieses Recht steht den Gläubigern jedoch nur zu, wenn sie glaubhaft machen, dass durch die Verschmelzung die Erfüllung ihrer Forderung gefährdet wird."
    },
    {
      "date": "2024-12-13",
      "id": "96335",
      "original_text": "Registerbekanntmachung nach dem Umwandlungsgesetz\nBayern Amtsgericht Nürnberg HRB 31861\nMAXFLEX Software GmbH – Nürnberg",
      "type": "Registerbekanntmachung nach dem Umwandlungsgesetz",
      "state": "Bayern",
      "amtsgericht": "Amtsgericht Nürnberg",
      "registernummer": "HRB 31861",
      "registerart": "HRB",
      "company_name": "MAXFLEX Software GmbH",
      "company_seat": "Nürnberg",
      "details": "13.12.2024 (Bekanntmachungsdatum)\n\nBayern Amtsgericht Nürnberg HRB 31861\nRegisterbekanntmachung nach dem Umwandlungsgesetz 12.12.2024 (Eintragungsdatum)\n\nMAXFLEX Software GmbH\nGesellschaft mit beschränkter Haftung\nNürnberg\n\nDen Gläubigern der an der Verschmelzung beteiligten Rechtsträger ist, wenn sie binnen sechs Monaten nach dem Tag, an dem die Eintragung der Verschmelzung in das Register des Sitzes desjenigen Rechtsträgers, dessen Gläubiger sie sind, nach § 19 Abs. 3 UmwG als bekannt gemacht gilt, ihren Anspruch nach Grund und Höhe schriftlich anmelden, Sicherheit zu leisten, soweit sie nicht Befriedigung verlangen können. Dieses Recht steht den Gläubigern jedoch nur zu, wenn sie glaubhaft machen, dass durch die Verschmelzung die Erfüllung ihrer Forderung gefährdet wird."
    },
    {
      "date": "2024-12-13",
      "id": "96336",
      "original_text": "Registerbekanntmachung nach dem Umwandlungsgesetz\nBayern Amtsgericht München HRB 298327\nLombardiello AG – München",
      "type": "Registerbekanntmachung nach dem Umwandlungsgesetz",
      "state": "Bayern",
      "amtsgericht": "Amtsgericht München",
      "registernummer": "HRB 298327",
      "registerart": "HRB",
      "company_name": "Lombardiello AG",
      "company_seat": "München",
      "details": "13.12.2024 (Bekanntmachungsdatum)\n\nBayern Amtsgericht München HRB 298327\nRegisterbekanntmachung nach dem Umwandlungsgesetz 12.12.2024 (Eintragungsdatum)\n\nLombardiello AG\nAktiengesellschaft\nMünchen\n\nDen Gläubigern des formwechselnden Rechtsträgers ist, wenn sie binnen sechs Monaten nach dem Tag, an dem die Eintragung des Formwechsels nach § 201 UmwG als bekannt gemacht gilt, ihren Anspruch nach Grund und Höhe schriftlich anmelden, Sicherheit zu leisten, soweit sie nicht Befriedigung verlangen können. Dieses Recht steht den Gläubigern jedoch nur zu, wenn sie glaubhaft machen, dass durch den Formwechsel die Erfüllung ihrer Forderung gefährdet wird."
    },
    {
      "date": "2024-12-13",
      "id": "96337",
      "original_text": "Löschungsankündigung\nBayern Amtsgericht Landshut HRB 11779\nImmoServOpt Unternehmergesellschaft (haftungsbeschränkt) – Landshut",
      "type": "Löschungsankündigung",
      "state": "Bayern",
      "amtsgericht": "Amtsgericht Landshut",
      "registernummer": "HRB 11779",
      "registerart": "HRB",
      "company_name": "ImmoServOpt Unternehmergesellschaft (haftungsbeschränkt)",
      "company_seat": "Landshut",
      "details": "13.12.2024 (Bekanntmachungsdatum)\n\nBayern Amtsgericht Landshut HRB 11779\nLöschungsankündigung\n\nImmoServOpt Unternehmergesellschaft (haftungsbeschränkt)\nGesellschaft mit beschränkter Haftung\nLandshut\n\nDas Registergericht beabsichtigt, die im Handelsregister eingetragene Gesellschaft wegen Vermögenslosigkeit von Amts wegen nach § 394 FamFG zu löschen. Die Frist zur Erhebung eines Widerspruchs ist auf einen Monat festgesetzt."
    },
    {
      "date": "2024-12-13",
      "id": "96338",
      "original_text": "Löschungsankündigung\nBayern Amtsgericht Augsburg HRB 32021\nfutureglance GmbH – Merching",
      "type": "Löschungsankündigung",
      "state": "Bayern",
      "amtsgericht": "Amtsgericht Augsburg",
      "registernummer": "HRB 32021",
      "registerart": "HRB",
      "company_name": "futureglance GmbH",
      "company_seat": "Merching",
      "details": "13.12.2024 (Bekanntmachungsdatum)\n\nBayern Amtsgericht Augsburg HRB 32021\nLöschungsankündigung\n\nfutureglance GmbH\nGesellschaft mit beschränkter Haftung\nMerching\n\nDas Registergericht beabsichtigt, die im Handelsregister eingetragene Gesellschaft wegen Vermögenslosigkeit von Amts wegen nach § 394 FamFG zu löschen. Die Frist zur Erhebung eines Widerspruchs ist auf einen Monat festgesetzt."
    },
    {
      "date": "2024-12-13",
      "id": "96339",
      "original_text": "Registerbekanntmachung nach dem Umwandlungsgesetz\nBayern Amtsgericht München HRB 247879\nAmRest Pizza GmbH – München",
      "type": "Registerbekanntmachung nach dem Umwandlungsgesetz",
      "state": "Bayern",
      "amtsgericht": "Amtsgericht München",
      "registernummer": "HRB 247879",
      "registerart": "HRB",
      "company_name": "AmRest Pizza GmbH",
      "company_seat": "München",
      "details": "13.12.2024 (Bekanntmachungsdatum)\n\nBayern Amtsgericht München HRB 247879\nRegisterbekanntmachung nach dem Umwandlungsgesetz 12.12.2024 (Eintragungsdatum)\n\nAmRest Pizza GmbH\nGesellschaft mit beschränkter Haftung\nMünchen\n\nDen Gläubigern der an der Verschmelzung beteiligten Rechtsträger ist, wenn sie binnen sechs Monaten nach dem Tag, an dem die Eintragung der Verschmelzung in das Register des Sitzes desjenigen Rechtsträgers, dessen Gläubiger sie sind, nach § 19 Abs. 3 UmwG als bekannt gemacht gilt, ihren Anspruch nach Grund und Höhe schriftlich anmelden, Sicherheit zu leisten, soweit sie nicht Befriedigung verlangen können. Dieses Recht steht den Gläubigern jedoch nur zu, wenn sie glaubhaft machen, dass durch die Verschmelzung die Erfüllung ihrer Forderung gefährdet wird."
    },
    {
      "date": "2024-12-13",
      "id": "96340",
      "original_text": "Löschungsankündigung\nBayern Amtsgericht München HRB 152673\n7b DIREKT Apothekenservice und Großhandel Aktiengesellschaft – Fürstenfeldbruck",
      "type": "Löschungsankündigung",
      "state": "Bayern",
      "amtsgericht": "Amtsgericht München",
      "registernummer": "HRB 152673",
      "registerart": "HRB",
      "company_name": "7b DIREKT Apothekenservice und Großhandel Aktiengesellschaft",
      "company_seat": "Fürstenfeldbruck",
      "details": "13.12.2024 (Bekanntmachungsdatum)\n\nBayern Amtsgericht München HRB 152673\nLöschungsankündigung\n\n7b DIREKT Apothekenservice und Großhandel Aktiengesellschaft\nAktiengesellschaft\nFürstenfeldbruck\n\nDas Registergericht beabsichtigt, die im Handelsregister eingetragene Gesellschaft wegen Vermögenslosigkeit von Amts wegen nach § 394 FamFG zu löschen. Die Frist zur Erhebung eines Widerspruchs ist auf drei Monate festgesetzt."
    },
    {
      "date": "2024-12-13",
      "id": "96341",
      "original_text": "Registerbekanntmachung nach dem Umwandlungsgesetz\nBayern Amtsgericht Augsburg HRB 38914\nV4Drive Battery GmbH – Nördlingen",
      "type": "Registerbekanntmachung nach dem Umwandlungsgesetz",
      "state": "Bayern",
      "amtsgericht": "Amtsgericht Augsburg",
      "registernummer": "HRB 38914",
      "registerart": "HRB",
      "company_name": "V4Drive Battery GmbH",
      "company_seat": "Nördlingen",
      "details": "13.12.2024 (Bekanntmachungsdatum)\n\nBayern Amtsgericht Augsburg HRB 38914\nRegisterbekanntmachung nach dem Umwandlungsgesetz 12.12.2024 (Eintragungsdatum)\n\nV4Drive Battery GmbH\nGesellschaft mit beschränkter Haftung\nNördlingen\n\nDen Gläubigern des formwechselnden Rechtsträgers ist, wenn sie binnen sechs Monaten nach dem Tag, an dem die Eintragung des Formwechsels nach § 201 UmwG als bekannt gemacht gilt, ihren Anspruch nach Grund und Höhe schriftlich anmelden, Sicherheit zu leisten, soweit sie nicht Befriedigung verlangen können. Dieses Recht steht den Gläubigern jedoch nur zu, wenn sie glaubhaft machen, dass durch den Formwechsel die Erfüllung ihrer Forderung gefährdet wird."
    },
    {
      "date": "2024-12-13",
      "id": "96342",
      "original_text": "Registerbekanntmachung nach dem Umwandlungsgesetz\nBayern Amtsgericht München HRB 298326\nLOWI Grundstücksverwaltungs GmbH – Vaterstetten",
      "type": "Registerbekanntmachung nach dem Umwandlungsgesetz",
      "state": "Bayern",
      "amtsgericht": "Amtsgericht München",
      "registernummer": "HRB 298326",
      "registerart": "HRB",
      "company_name": "LOWI Grundstücksverwaltungs GmbH",
      "company_seat": "Vaterstetten",
      "details": "13.12.2024 (Bekanntmachungsdatum)\n\nBayern Amtsgericht München HRB 298326\nRegisterbekanntmachung nach dem Umwandlungsgesetz 12.12.2024 (Eintragungsdatum)\n\nLOWI Grundstücksverwaltungs GmbH\nGesellschaft mit beschränkter Haftung\nVaterstetten\n\nDen Gläubigern des formwechselnden Rechtsträgers ist, wenn sie binnen sechs Monaten nach dem Tag, an dem die Eintragung des Formwechsels nach § 201 UmwG als bekannt gemacht gilt, ihren Anspruch nach Grund und Höhe schriftlich anmelden, Sicherheit zu leisten, soweit sie nicht Befriedigung verlangen können. Dieses Recht steht den Gläubigern jedoch nur zu, wenn sie glaubhaft machen, dass durch den Formwechsel die Erfüllung ihrer Forderung gefährdet wird."
    },
    {
      "date": "2024-12-13",
      "id": "96343",
      "original_text": "Löschungsankündigung\nBayern Amtsgericht München HRB 52628\nDeutsch Radio- und Fernsehtechnik GmbH – München",
      "type": "Löschungsankündigung",
      "state": "Bayern",
      "amtsgericht": "Amtsgericht München",
      "registernummer": "HRB 52628",
      "registerart": "HRB",
      "company_name": "Deutsch Radio- und Fernsehtechnik GmbH",
      "company_seat": "München",
      "details": "13.12.2024 (Bekanntmachungsdatum)\n\nBayern Amtsgericht München HRB 52628\nLöschungsankündigung 12.12.2024 (Eintragungsdatum)\n\nDeutsch Radio- und Fernsehtechnik GmbH\nGesellschaft mit beschränkter Haftung\nMünchen\n\nDas Registergericht beabsichtigt, die im Handelsregister eingetragene Gesellschaft wegen Vermögenslosigkeit von Amts wegen nach § 394 FamFG zu löschen. Die Frist zur Erhebung eines Widerspruchs ist auf drei Monate festgesetzt."
    },
    {
      "date": "2024-12-13",
      "id": "96344",
      "original_text": "Registerbekanntmachung nach dem Umwandlungsgesetz\nBayern Amtsgericht Nürnberg HRB 12941\nCircana Group GmbH – Nürnberg",
      "type": "Registerbekanntmachung nach dem Umwandlungsgesetz",
      "state": "Bayern",
      "amtsgericht": "Amtsgericht Nürnberg",
      "registernummer": "HRB 12941",
      "registerart": "HRB",
      "company_name": "Circana Group GmbH",
      "company_seat": "Nürnberg",
      "details": "13.12.2024 (Bekanntmachungsdatum)\n\nBayern Amtsgericht Nürnberg HRB 12941\nRegisterbekanntmachung nach dem Umwandlungsgesetz 12.12.2024 (Eintragungsdatum)\n\nCircana Group GmbH\nGesellschaft mit beschränkter Haftung\nNürnberg\n\nDen Gläubigern der an der Verschmelzung beteiligten Rechtsträger ist, wenn sie binnen sechs Monaten nach dem Tag, an dem die Eintragung der Verschmelzung in das Register des Sitzes desjenigen Rechtsträgers, dessen Gläubiger sie sind, nach § 19 Abs. 3 UmwG als bekannt gemacht gilt, ihren Anspruch nach Grund und Höhe schriftlich anmelden, Sicherheit zu leisten, soweit sie nicht Befriedigung verlangen können. Dieses Recht steht den Gläubigern jedoch nur zu, wenn sie glaubhaft machen, dass durch die Verschmelzung die Erfüllung ihrer Forderung gefährdet wird."
    },
    {
      "date": "2024-12-13",
      "id": "96345",
      "original_text": "Registerbekanntmachung nach dem Umwandlungsgesetz\nBayern Amtsgericht Nürnberg HRB 29971\nTRA Verwaltungsgesellschaft UG (haftungsbeschränkt) – Wendelstein",
      "type": "Registerbekanntmachung nach dem Umwandlungsgesetz",
      "state": "Bayern",
      "amtsgericht": "Amtsgericht Nürnberg",
      "registernummer": "HRB 29971",
      "registerart": "HRB",
      "company_name": "TRA Verwaltungsgesellschaft UG (haftungsbeschränkt)",
      "company_seat": "Wendelstein",
      "details": "13.12.2024 (Bekanntmachungsdatum)\n\nBayern Amtsgericht Nürnberg HRB 29971\nRegisterbekanntmachung nach dem Umwandlungsgesetz 12.12.2024 (Eintragungsdatum)\n\nTRA Verwaltungsgesellschaft UG (haftungsbeschränkt)\nGesellschaft mit beschränkter Haftung\nWendelstein\n\nDen Gläubigern der an der Verschmelzung beteiligten Rechtsträger ist, wenn sie binnen sechs Monaten nach dem Tag, an dem die Eintragung der Verschmelzung in das Register des Sitzes desjenigen Rechtsträgers, dessen Gläubiger sie sind, nach § 19 Abs. 3 UmwG als bekannt gemacht gilt, ihren Anspruch nach Grund und Höhe schriftlich anmelden, Sicherheit zu leisten, soweit sie nicht Befriedigung verlangen können. Dieses Recht steht den Gläubigern jedoch nur zu, wenn sie glaubhaft machen, dass durch die Verschmelzung die Erfüllung ihrer Forderung gefährdet wird."
    },
    {
      "date": "2024-12-13",
      "id": "96346",
      "original_text": "Registerbekanntmachung nach dem Umwandlungsgesetz\nBayern Amtsgericht München HRB 170808\nOXITGEN AG – Pullach",
      "type": "Registerbekanntmachung nach dem Umwandlungsgesetz",
      "state": "Bayern",
      "amtsgericht": "Amtsgericht München",
      "registernummer": "HRB 170808",
      "registerart": "HRB",
      "company_name": "OXITGEN AG",
      "company_seat": "Pullach",
      "details": "13.12.2024 (Bekanntmachungsdatum)\n\nBayern Amtsgericht München HRB 170808\nRegisterbekanntmachung nach dem Umwandlungsgesetz 12.12.2024 (Eintragungsdatum)\n\nOXITGEN AG\nAktiengesellschaft\nPullach\n\nDen Gläubigern der an der Verschmelzung beteiligten Rechtsträger ist, wenn sie binnen sechs Monaten nach dem Tag, an dem die Eintragung der Verschmelzung in das Register des Sitzes desjenigen Rechtsträgers, dessen Gläubiger sie sind, nach § 19 Abs. 3 UmwG als bekannt gemacht gilt, ihren Anspruch nach Grund und Höhe schriftlich anmelden, Sicherheit zu leisten, soweit sie nicht Befriedigung verlangen können. Dieses Recht steht den Gläubigern jedoch nur zu, wenn sie glaubhaft machen, dass durch die Verschmelzung die Erfüllung ihrer Forderung gefährdet wird."
    },
    {
      "date": "2024-12-13",
      "id": "96347",
      "original_text": "Einreichung neuer Dokumente\nBayern Amtsgericht Würzburg HRB 12609\nOMB AG Online.Marketing.Berater. – Würzburg",
      "type": "Einreichung neuer Dokumente",
      "state": "Bayern",
      "amtsgericht": "Amtsgericht Würzburg",
      "registernummer": "HRB 12609",
      "registerart": "HRB",
      "company_name": "OMB AG Online.Marketing.Berater.",
      "company_seat": "Würzburg",
      "details": "13.12.2024 (Bekanntmachungsdatum)\n\nBayern Amtsgericht Würzburg HRB 12609\nEinreichung neuer Dokumente 12.12.2024 (Eintragungsdatum)\n\nOMB AG Online.Marketing.Berater.\nAktiengesellschaft\nWürzburg\n\nDem Amtsgericht Würzburg -Registergericht- ist eine Liste der Mitglieder des Aufsichtsrats eingereicht worden, § 106 AktG."
    },
    {
      "date": "2024-12-13",
      "id": "96348",
      "original_text": "Registerbekanntmachung nach dem Umwandlungsgesetz\nBayern Amtsgericht München HRB 139969\nLombardiello GmbH – München",
      "type": "Registerbekanntmachung nach dem Umwandlungsgesetz",
      "state": "Bayern",
      "amtsgericht": "Amtsgericht München",
      "registernummer": "HRB 139969",
      "registerart": "HRB",
      "company_name": "Lombardiello GmbH",
      "company_seat": "München",
      "details": "13.12.2024 (Bekanntmachungsdatum)\n\nBayern Amtsgericht München HRB 139969\nRegisterbekanntmachung nach dem Umwandlungsgesetz 12.12.2024 (Eintragungsdatum)\n\nLombardiello GmbH\nGesellschaft mit beschränkter Haftung\nMünchen\n\nDen Gläubigern des formwechselnden Rechtsträgers ist, wenn sie binnen sechs Monaten nach dem Tag, an dem die Eintragung des Formwechsels nach § 201 UmwG als bekannt gemacht gilt, ihren Anspruch nach Grund und Höhe schriftlich anmelden, Sicherheit zu leisten, soweit sie nicht Befriedigung verlangen können. Dieses Recht steht den Gläubigern jedoch nur zu, wenn sie glaubhaft machen, dass durch den Formwechsel die Erfüllung ihrer Forderung gefährdet wird."
    },
    {
      "date": "2024-12-13",
      "id": "96349",
      "original_text": "Registerbekanntmachung nach dem Umwandlungsgesetz\nBayern Amtsgericht Nürnberg HRB 29473\nWein-Plus Solutions GmbH – Nürnberg",
      "type": "Registerbekanntmachung nach dem Umwandlungsgesetz",
      "state": "Bayern",
      "amtsgericht": "Amtsgericht Nürnberg",
      "registernummer": "HRB 29473",
      "registerart": "HRB",
      "company_name": "Wein-Plus Solutions GmbH",
      "company_seat": "Nürnberg",
      "details": "13.12.2024 (Bekanntmachungsdatum)\n\nBayern Amtsgericht Nürnberg HRB 29473\nRegisterbekanntmachung nach dem Umwandlungsgesetz 12.12.2024 (Eintragungsdatum)\n\nWein-Plus Solutions GmbH\nGesellschaft mit beschränkter Haftung\nNürnberg\n\nDen Gläubigern des formwechselnden Rechtsträgers ist, wenn sie binnen sechs Monaten nach dem Tag, an dem die Eintragung des Formwechsels nach § 201 UmwG als bekannt gemacht gilt, ihren Anspruch nach Grund und Höhe schriftlich anmelden, Sicherheit zu leisten, soweit sie nicht Befriedigung verlangen können. Dieses Recht steht den Gläubigern jedoch nur zu, wenn sie glaubhaft machen, dass durch den Formwechsel die Erfüllung ihrer Forderung gefährdet wird."
    },
    {
      "date": "2024-12-13",
      "id": "96350",
      "original_text": "Sonstige Registerbekanntmachung\nBayern Amtsgericht München HRB 219719\nTriStyle Mode GmbH – München",
      "type": "Sonstige Registerbekanntmachung",
      "state": "Bayern",
      "amtsgericht": "Amtsgericht München",
      "registernummer": "HRB 219719",
      "registerart": "HRB",
      "company_name": "TriStyle Mode GmbH",
      "company_seat": "München",
      "details": "13.12.2024 (Bekanntmachungsdatum)\n\nBayern Amtsgericht München HRB 219719\nSonstige Registerbekanntmachung 12.12.2024 (Eintragungsdatum)\n\nTriStyle Mode GmbH\nGesellschaft mit beschränkter Haftung\nMünchen\n\nDen Gläubigern der Gesellschaft, deren Forderungen begründet worden sind, bevor die Eintragung der Beendigung des Gewinnabführungsvertrages in das Handelsregister nach § 10 des Handelsgesetzbuches als bekanntgemacht gilt, hat der andere Vertragsteil Sicherheit zu leisten, wenn sie sich binnen sechs Monaten nach der Bekanntmachung der Eintragung zu diesem Zweck bei ihm melden."
    },
    {
      "date": "2024-12-13",
      "id": "96351",
      "original_text": "Registerbekanntmachung nach dem Umwandlungsgesetz\nBayern Amtsgericht Nürnberg HRB 35893\nHubert Schwarz Professional GmbH – Büchenbach",
      "type": "Registerbekanntmachung nach dem Umwandlungsgesetz",
      "state": "Bayern",
      "amtsgericht": "Amtsgericht Nürnberg",
      "registernummer": "HRB 35893",
      "registerart": "HRB",
      "company_name": "Hubert Schwarz Professional GmbH",
      "company_seat": "Büchenbach",
      "details": "13.12.2024 (Bekanntmachungsdatum)\n\nBayern Amtsgericht Nürnberg HRB 35893\nRegisterbekanntmachung nach dem Umwandlungsgesetz 12.12.2024 (Eintragungsdatum)\n\nHubert Schwarz Professional GmbH\nGesellschaft mit beschränkter Haftung\nBüchenbach\n\nDen Gläubigern der an der Verschmelzung beteiligten Rechtsträger ist, wenn sie binnen sechs Monaten nach dem Tag, an dem die Eintragung der Verschmelzung in das Register des Sitzes desjenigen Rechtsträgers, dessen Gläubiger sie sind, nach § 19 Abs. 3 UmwG als bekannt gemacht gilt, ihren Anspruch nach Grund und Höhe schriftlich anmelden, Sicherheit zu leisten, soweit sie nicht Befriedigung verlangen können. Dieses Recht steht den Gläubigern jedoch nur zu, wenn sie glaubhaft machen, dass durch die Verschmelzung die Erfüllung ihrer Forderung gefährdet wird."
    },
    {
      "date": "2024-12-13",
      "id": "96352",
      "original_text": "Einreichung neuer Dokumente\nBaden-Württemberg Amtsgericht Stuttgart HRB 203626\nStädtische Wohnbau Kornwestheim Gesellschaft mit beschränkter Haftung – Kornwestheim",
      "type": "Einreichung neuer Dokumente",
      "state": "Baden-Württemberg",
      "amtsgericht": "Amtsgericht Stuttgart",
      "registernummer": "HRB 203626",
      "registerart": "HRB",
      "company_name": "Städtische Wohnbau Kornwestheim Gesellschaft mit beschränkter Haftung",
      "company_seat": "Kornwestheim",
      "details": "13.12.2024 (Bekanntmachungsdatum)\n\nBaden-Württemberg Amtsgericht Stuttgart HRB 203626\nEinreichung neuer Dokumente 13.12.2024 (Eintragungsdatum)\n\nStädtische Wohnbau Kornwestheim Gesellschaft mit beschränkter Haftung\nGesellschaft mit beschränkter Haftung\nKornwestheim\n\nDie Gesellschaft hat am 12.12.2024 die Liste über die Zusammensetzung des Aufsichtsrats zum Handelsregister eingereicht."
    },
    {
      "date": "2024-12-13",
      "id": "96353",
      "original_text": "Einreichung neuer Dokumente\nBerlin Amtsgericht Berlin (Charlottenburg) HRB 236454\nQ Energy Solutions SE – Berlin",
      "type": "Einreichung neuer Dokumente",
      "state": "Berlin",
      "amtsgericht": "Amtsgericht Berlin (Charlottenburg)",
      "registernummer": "HRB 236454",
      "registerart": "HRB",
      "company_name": "Q Energy Solutions SE",
      "company_seat": "Berlin",
      "details": "13.12.2024 (Bekanntmachungsdatum)\n\nBerlin Amtsgericht Berlin (Charlottenburg) HRB 236454\nEinreichung neuer Dokumente\n\nQ Energy Solutions SE\nEuropäische Aktiengesellschaft (SE)\nBerlin\n\nAls nicht eingetragen wird veröffentlicht: Es wurde eine neue Liste der Aufsichtsratsmitglieder eingereicht (§ 106 AktG)."
    },
    {
      "date": "2024-12-13",
      "id": "96354",
      "original_text": "Löschungsankündigung\nBerlin Amtsgericht Berlin (Charlottenburg) HRB 132386\nM.A.M. Bau GmbH – Berlin",
      "type": "Löschungsankündigung",
      "state": "Berlin",
      "amtsgericht": "Amtsgericht Berlin (Charlottenburg)",
      "registernummer": "HRB 132386",
      "registerart": "HRB",
      "company_name": "M.A.M. Bau GmbH",
      "company_seat": "Berlin",
      "details": "13.12.2024 (Bekanntmachungsdatum)\n\nBerlin Amtsgericht Berlin (Charlottenburg) HRB 132386\nLöschungsankündigung\n\nM.A.M. Bau GmbH\nGesellschaft mit beschränkter Haftung\nBerlin\n\nBei der nachstehenden Gesellschaft wird das Amtslöschungsverfahren gemäß § 394 FamFG eingeleitet. Widerspruchsfrist 6 Wochen"
    },
    {
      "date": "2024-12-13",
      "id": "96355",
      "original_text": "Einreichung neuer Dokumente\nSaarland Amtsgericht Saarbrücken HRB 8707\nHYDAC Electronic GmbH – Saarbrücken",
      "type": "Einreichung neuer Dokumente",
      "state": "Saarland",
      "amtsgericht": "Amtsgericht Saarbrücken",
      "registernummer": "HRB 8707",
      "registerart": "HRB",
      "company_name": "HYDAC Electronic GmbH",
      "company_seat": "Saarbrücken",
      "details": "13.12.2024 (Bekanntmachungsdatum)\n\nSaarland Amtsgericht Saarbrücken HRB 8707\nEinreichung neuer Dokumente\n\nHYDAC Electronic GmbH\nGesellschaft mit beschränkter Haftung\nSaarbrücken\n\nDie Geschäftsführung der Gesellschaft hat eine Liste der Mitglieder des Beirats zum Handelsregister eingereicht (§ 52 Abs. 3 Satz 2 GmbHG)."
    },
    {
      "date": "2024-12-13",
      "id": "96356",
      "original_text": "Registerbekanntmachung nach dem Umwandlungsgesetz\nBerlin Amtsgericht Berlin (Charlottenburg) HRB 195566\nTitan Parkplatz UG (haftungsbeschränkt) – Berlin",
      "type": "Registerbekanntmachung nach dem Umwandlungsgesetz",
      "state": "Berlin",
      "amtsgericht": "Amtsgericht Berlin (Charlottenburg)",
      "registernummer": "HRB 195566",
      "registerart": "HRB",
      "company_name": "Titan Parkplatz UG (haftungsbeschränkt)",
      "company_seat": "Berlin",
      "details": "13.12.2024 (Bekanntmachungsdatum)\n\nBerlin Amtsgericht Berlin (Charlottenburg) HRB 195566\nRegisterbekanntmachung nach dem Umwandlungsgesetz 12.12.2024 (Eintragungsdatum)\n\nTitan Parkplatz UG (haftungsbeschränkt)\nGesellschaft mit beschränkter Haftung\nBerlin\n\nZu Eintragungsnummer 4 vom 12.12.2024 wird als nicht eingetragen veröffentlicht:\n\nDen Gläubigern der an der Verschmelzung beteiligten Rechtsträger ist, wenn sie binnen sechs Monaten nach dem Tag, an dem die Eintragung der Verschmelzung in das Register des Sitzes desjenigen Rechtsträgers, dessen Gläubiger sie sind, als bekannt gemacht gilt, ihren Anspruch nach Grund und Höhe schriftlich anmelden, Sicherheit zu leisten, soweit sie nicht Befriedigung verlangen können. Dieses Recht steht den Gläubigern jedoch nur zu, wenn sie glaubhaft machen, dass durch die Verschmelzung die Erfüllung ihrer Forderung gefährdet wird. Das Recht, Sicherheitsleistung zu verlangen, steht Gläubigern nicht zu, die im Falle der Insolvenz ein Recht auf vorzugsweise Befriedigung aus einer Deckungsmasse haben, die nach gesetzlicher Vorschrift zu ihrem Schutz errichtet und staatlich überwacht ist."
    },
    {
      "date": "2024-12-13",
      "id": "96357",
      "original_text": "Registerbekanntmachung nach dem Umwandlungsgesetz\nBerlin Amtsgericht Berlin (Charlottenburg) HRB 175968\naptus 1073. GmbH – Berlin",
      "type": "Registerbekanntmachung nach dem Umwandlungsgesetz",
      "state": "Berlin",
      "amtsgericht": "Amtsgericht Berlin (Charlottenburg)",
      "registernummer": "HRB 175968",
      "registerart": "HRB",
      "company_name": "aptus 1073. GmbH",
      "company_seat": "Berlin",
      "details": "13.12.2024 (Bekanntmachungsdatum)\n\nBerlin Amtsgericht Berlin (Charlottenburg) HRB 175968\nRegisterbekanntmachung nach dem Umwandlungsgesetz 12.12.2024 (Eintragungsdatum)\n\naptus 1073. GmbH\nGesellschaft mit beschränkter Haftung\nBerlin\n\nZu Eintragungsnummer 6 vom 12.12.2024 wird als nicht eingetragen veröffentlicht:\n\nDen Gläubigern der an der Verschmelzung beteiligten Rechtsträger ist, wenn sie binnen sechs Monaten nach dem Tag, an dem die Eintragung der Verschmelzung in das Register des Sitzes desjenigen Rechtsträgers, dessen Gläubiger sie sind, als bekannt gemacht gilt, ihren Anspruch nach Grund und Höhe schriftlich anmelden, Sicherheit zu leisten, soweit sie nicht Befriedigung verlangen können. Dieses Recht steht den Gläubigern jedoch nur zu, wenn sie glaubhaft machen, dass durch die Verschmelzung die Erfüllung ihrer Forderung gefährdet wird. Das Recht, Sicherheitsleistung zu verlangen, steht Gläubigern nicht zu, die im Falle der Insolvenz ein Recht auf vorzugsweise Befriedigung aus einer Deckungsmasse haben, die nach gesetzlicher Vorschrift zu ihrem Schutz errichtet und staatlich überwacht ist."
    },
    {
      "date": "2024-12-13",
      "id": "96358",
      "original_text": "Einreichung neuer Dokumente\nBerlin Amtsgericht Berlin (Charlottenburg) HRB 1431\nB Plus Planungs-Aktiengesellschaft – Berlin",
      "type": "Einreichung neuer Dokumente",
      "state": "Berlin",
      "amtsgericht": "Amtsgericht Berlin (Charlottenburg)",
      "registernummer": "HRB 1431",
      "registerart": "HRB",
      "company_name": "B Plus Planungs-Aktiengesellschaft",
      "company_seat": "Berlin",
      "details": "13.12.2024 (Bekanntmachungsdatum)\n\nBerlin Amtsgericht Berlin (Charlottenburg) HRB 1431\nEinreichung neuer Dokumente\n\nB Plus Planungs-Aktiengesellschaft\nAktiengesellschaft\nBerlin\n\nAls nicht eingetragen wird veröffentlicht: Es wurde eine neue Liste der Aufsichtsratsmitglieder eingereicht (§ 106 AktG)."
    },
    {
      "date": "2024-12-13",
      "id": "96359",
      "original_text": "Löschungsankündigung\nBerlin Amtsgericht Berlin (Charlottenburg) HRB 140738\nFiBa Hoch + Tief Bau GmbH – Berlin",
      "type": "Löschungsankündigung",
      "state": "Berlin",
      "amtsgericht": "Amtsgericht Berlin (Charlottenburg)",
      "registernummer": "HRB 140738",
      "registerart": "HRB",
      "company_name": "FiBa Hoch + Tief Bau GmbH",
      "company_seat": "Berlin",
      "details": "13.12.2024 (Bekanntmachungsdatum)\n\nBerlin Amtsgericht Berlin (Charlottenburg) HRB 140738\nLöschungsankündigung\n\nFiBa Hoch + Tief Bau GmbH\nGesellschaft mit beschränkter Haftung\nBerlin\n\nBei der nachstehenden Gesellschaft wird das Amtslöschungsverfahren gemäß § 394 FamFG eingeleitet. Widerspruchsfrist 6 Wochen"
    },
    {
      "date": "2024-12-13",
      "id": "96360",
      "original_text": "Einreichung neuer Dokumente\nBaden-Württemberg Amtsgericht Mannheim HRB 460634\nManagement Stadtwerke Buchen GmbH – Buchen Odenwald",
      "type": "Einreichung neuer Dokumente",
      "state": "Baden-Württemberg",
      "amtsgericht": "Amtsgericht Mannheim",
      "registernummer": "HRB 460634",
      "registerart": "HRB",
      "company_name": "Management Stadtwerke Buchen GmbH",
      "company_seat": "Buchen Odenwald",
      "details": "13.12.2024 (Bekanntmachungsdatum)\n\nBaden-Württemberg Amtsgericht Mannheim HRB 460634\nEinreichung neuer Dokumente\n\nManagement Stadtwerke Buchen GmbH\nGesellschaft mit beschränkter Haftung\nBuchen Odenwald\n\nDie Gesellschaft hat am 11.12.2024 die Liste über die Zusammensetzung des Aufsichtsrats zum Handelsregister eingereicht."
    },
    {
      "date": "2024-12-13",
      "id": "96361",
      "original_text": "Löschungsankündigung\nSchleswig-Holstein Amtsgericht Lübeck HRB 7834\nAS Absolut-it-Service GmbH – Ahrensburg",
      "type": "Löschungsankündigung",
      "state": "Schleswig-Holstein",
      "amtsgericht": "Amtsgericht Lübeck",
      "registernummer": "HRB 7834",
      "registerart": "HRB",
      "company_name": "AS Absolut-it-Service GmbH",
      "company_seat": "Ahrensburg",
      "details": "13.12.2024 (Bekanntmachungsdatum)\n\nSchleswig-Holstein Amtsgericht Lübeck HRB 7834\nLöschungsankündigung\n\nAS Absolut-it-Service GmbH\nGesellschaft mit beschränkter Haftung\nAhrensburg\n\nEs ist die Löschung der nachstehenden Gesellschaft wegen Vermögenslosigkeit gemäß § 394 FamFG beabsichtigt."
    },
    {
      "date": "2024-12-13",
      "id": "96362",
      "original_text": "Einreichung neuer Dokumente\nSaarland Amtsgericht Saarbrücken HRB 25415\nFernwärme Saarlouis-Steinrausch Geschäftsführungsgesellschaft mbH – Saarlouis",
      "type": "Einreichung neuer Dokumente",
      "state": "Saarland",
      "amtsgericht": "Amtsgericht Saarbrücken",
      "registernummer": "HRB 25415",
      "registerart": "HRB",
      "company_name": "Fernwärme Saarlouis-Steinrausch Geschäftsführungsgesellschaft mbH",
      "company_seat": "Saarlouis",
      "details": "13.12.2024 (Bekanntmachungsdatum)\n\nSaarland Amtsgericht Saarbrücken HRB 25415\nEinreichung neuer Dokumente\n\nFernwärme Saarlouis-Steinrausch Geschäftsführungsgesellschaft mbH\nGesellschaft mit beschränkter Haftung\nSaarlouis\n\nDie Geschäftsführung der Gesellschaft hat eine Liste der Mitglieder des Aufsichtsrats zum Handelsregister eingereicht (§ 52 Abs. 3 Satz 2 GmbHG)."
    },
    {
      "date": "2024-12-13",
      "id": "96363",
      "original_text": "Löschungsankündigung\nBrandenburg Amtsgericht Potsdam HRB 26549\nXema UG (haftungsbeschränkt) – Kloster Lehnin",
      "type": "Löschungsankündigung",
      "state": "Brandenburg",
      "amtsgericht": "Amtsgericht Potsdam",
      "registernummer": "HRB 26549",
      "registerart": "HRB",
      "company_name": "Xema UG (haftungsbeschränkt)",
      "company_seat": "Kloster Lehnin",
      "details": "13.12.2024 (Bekanntmachungsdatum)\n\nBrandenburg Amtsgericht Potsdam HRB 26549\nLöschungsankündigung\n\nXema UG (haftungsbeschränkt)\nGesellschaft mit beschränkter Haftung\nKloster Lehnin\n\nBei der nachstehenden Gesellschaft wird das Amtslöschungsverfahren gemäß § 394 FamFG eingeleitet.\nWiderspruchsfrist: 8 Wochen."
    },
    {
      "date": "2024-12-13",
      "id": "96364",
      "original_text": "Sonstige Registerbekanntmachung\nBerlin Amtsgericht Berlin (Charlottenburg) HRB 184391\nCURATA Seniorenresidenzen für Pflege und Betreuung GmbH – Berlin",
      "type": "Sonstige Registerbekanntmachung",
      "state": "Berlin",
      "amtsgericht": "Amtsgericht Berlin (Charlottenburg)",
      "registernummer": "HRB 184391",
      "registerart": "HRB",
      "company_name": "CURATA Seniorenresidenzen für Pflege und Betreuung GmbH",
      "company_seat": "Berlin",
      "details": "13.12.2024 (Bekanntmachungsdatum)\n\nBerlin Amtsgericht Berlin (Charlottenburg) HRB 184391\nSonstige Registerbekanntmachung\n\nCURATA Seniorenresidenzen für Pflege und Betreuung GmbH\nGesellschaft mit beschränkter Haftung\nBerlin\n\nAls nicht eingetragen wird veröffentlicht: Der andere Vertragsteil hat den Gläubigern dieses Rechtsträgers, deren Forderungen begründet worden sind, bevor die Eintragung der Beendigung dieses Vertrages in das Handelsregister nach § 10 des Handelsgesetzbuches als bekannt gemacht gilt, Sicherheit zu leisten, wenn sie sich binnen sechs Monaten nach der Bekanntmachung der Eintragung zu diesem Zweck bei ihm melden. Dieses Recht steht den Gläubigern nicht zu, die im Fall des Insolvenzverfahrens ein Recht auf vorzugsweise Befriedigung aus der Deckungsmasse haben, die nach gesetzlicher Vorschrift zu ihrem Schutz errichtet und staatlich überwacht ist."
    },
    {
      "date": "2024-12-13",
      "id": "96365",
      "original_text": "Registerbekanntmachung nach dem Umwandlungsgesetz\nSchleswig-Holstein Amtsgericht Pinneberg HRA 5458\nBoyens Medien GmbH & Co. KG – Heide",
      "type": "Registerbekanntmachung nach dem Umwandlungsgesetz",
      "state": "Schleswig-Holstein",
      "amtsgericht": "Amtsgericht Pinneberg",
      "registernummer": "HRA 5458",
      "registerart": "HRA",
      "company_name": "Boyens Medien GmbH & Co. KG",
      "company_seat": "Heide",
      "details": "13.12.2024 (Bekanntmachungsdatum)\n\nSchleswig-Holstein Amtsgericht Pinneberg HRA 5458\nRegisterbekanntmachung nach dem Umwandlungsgesetz 12.12.2024 (Eintragungsdatum)\n\nBoyens Medien GmbH & Co. KG\nKommanditgesellschaft\nHeide\n\nZu Eintragungsnummer 9 vom 12.12.2024 wird als nicht eingetragen veröffentlicht: Als nicht eingetragen wird veröffentlicht: Den Gläubigern der an der Verschmelzung beteiligten Rechtsträger ist, wenn sie binnen sechs Monaten nach dem Tag, an dem die Eintragung der Verschmelzung in das Register des Sitzes desjenigen Rechtsträgers, dessen Gläubiger sie sind, als bekannt gemacht gilt, ihren Anspruch nach Grund und Höhe schriftlich anmelden, Sicherheit zu leisten, soweit sie nicht Befriedigung verlangen können. Dieses Recht steht den Gläubigern jedoch nur zu, wenn sie glaubhaft machen, dass durch die Verschmelzung die Erfüllung ihrer Forderung gefährdet wird. Das Recht, Sicherheitsleistung zu verlangen, steht Gläubigern nicht zu, die im Falle der Insolvenz ein Recht auf vorzugsweise Befriedigung aus einer Deckungsmasse haben, die nach gesetzlicher Vorschrift zu ihrem Schutz errichtet und staatlich überwacht ist."
    },
    {
      "date": "2024-12-13",
      "id": "96366",
      "original_text": "Registerbekanntmachung nach dem Umwandlungsgesetz\nHamburg Amtsgericht Hamburg HRB 53548\nWick Hill Kommunikationstechnik GmbH – Hamburg",
      "type": "Registerbekanntmachung nach dem Umwandlungsgesetz",
      "state": "Hamburg",
      "amtsgericht": "Amtsgericht Hamburg",
      "registernummer": "HRB 53548",
      "registerart": "HRB",
      "company_name": "Wick Hill Kommunikationstechnik GmbH",
      "company_seat": "Hamburg",
      "details": "13.12.2024 (Bekanntmachungsdatum)\n\nHamburg Amtsgericht Hamburg HRB 53548\nRegisterbekanntmachung nach dem Umwandlungsgesetz 12.12.2024 (Eintragungsdatum)\n\nWick Hill Kommunikationstechnik GmbH\nGesellschaft mit beschränkter Haftung\nHamburg\n\nAls nicht eingetragen wird bekannt gemacht:\nDen Gläubigern der an der Verschmelzung beteiligten Gesellschaften ist, wenn sie binnen sechs Monaten nach dem Tag, an dem die Eintragung der Verschmelzung in das Register des Sitzes desjenigen Rechtsträgers, dessen Gläubiger sie sind, nach § 19 Absatz 3 UmwG als bekannt gemacht gilt, ihren Anspruch nach Grund und Höhe schriftlich anmelden, Sicherheit zu leisten, soweit sie nicht Befriedigung verlangen können. Dieses Recht steht den Gläubigern jedoch nur zu, wenn sie glaubhaft machen, dass durch die Verschmelzung die Erfüllung ihrer Forderung gefährdet wird."
    },
    {
      "date": "2024-12-13",
      "id": "96367",
      "original_text": "Registerbekanntmachung nach dem Umwandlungsgesetz\nBaden-Württemberg Amtsgericht Stuttgart HRB 264569\nSCHMALZ+SCHÖN Logistics GmbH Region Stuttgart – Fellbach",
      "type": "Registerbekanntmachung nach dem Umwandlungsgesetz",
      "state": "Baden-Württemberg",
      "amtsgericht": "Amtsgericht Stuttgart",
      "registernummer": "HRB 264569",
      "registerart": "HRB",
      "company_name": "SCHMALZ+SCHÖN Logistics GmbH Region Stuttgart",
      "company_seat": "Fellbach",
      "details": "13.12.2024 (Bekanntmachungsdatum)\n\nBaden-Württemberg Amtsgericht Stuttgart HRB 264569\nRegisterbekanntmachung nach dem Umwandlungsgesetz 13.12.2024 (Eintragungsdatum)\n\nSCHMALZ+SCHÖN Logistics GmbH Region Stuttgart\nGesellschaft mit beschränkter Haftung\nFellbach\n\nDen Gläubigern der an der Verschmelzung beteiligten Rechtsträger ist, wenn sie binnen sechs Monaten nach dem Tag, an dem die Eintragung der Verschmelzung in das Register des Sitzes desjenigen Rechtsträgers, dessen Gläubiger sie sind, nach § 19 Abs. 3 UmwG als bekanntgemacht gilt, ihren Anspruch nach Grund und Höhe schriftlich anmelden, Sicherheit zu leisten, soweit sie nicht Befriedigung verlangen können. Dieses Recht steht den Gläubigern jedoch nur zu, wenn sie glaubhaft machen, dass durch die Verschmelzung die Erfüllung ihrer Forderung gefährdet wird."
    },
    {
      "date": "2024-12-13",
      "id": "96368",
      "original_text": "Registerbekanntmachung nach dem Umwandlungsgesetz\nBaden-Württemberg Amtsgericht Stuttgart HRB 262102\nSCHMALZ+SCHÖN Logistics GmbH Region Stuttgart – Fellbach",
      "type": "Registerbekanntmachung nach dem Umwandlungsgesetz",
      "state": "Baden-Württemberg",
      "amtsgericht": "Amtsgericht Stuttgart",
      "registernummer": "HRB 262102",
      "registerart": "HRB",
      "company_name": "SCHMALZ+SCHÖN Logistics GmbH Region Stuttgart",
      "company_seat": "Fellbach",
      "details": "13.12.2024 (Bekanntmachungsdatum)\n\nBaden-Württemberg Amtsgericht Stuttgart HRB 262102\nRegisterbekanntmachung nach dem Umwandlungsgesetz 13.12.2024 (Eintragungsdatum)\n\nSCHMALZ+SCHÖN Logistics GmbH Region Stuttgart\nGesellschaft mit beschränkter Haftung\nFellbach\n\nDen Gläubigern dern an der grenzüberschreitenden Verschmelzung beteiligten übernehmenden Rechtsträger ist, wenn sie binnen sechs Monaten nach dem Tag, an dem die Eintragung der Verschmelzung in das Register des Sitzes desjenigen Rechtsträgers, dessen Gläubiger sie sind, nach § 19 Absatz 3 UmwG als bekanntgemacht gilt, ihren Anspruch nach Grund und Höhe schriftlich anmelden, Sicherheit zu leisten, soweit sie nicht Befriedigung verlangen können. Dieses Recht steht den Gläubigern jedoch nur zu, wenn sie glaubhaft machen, dass durch die Verschmelzung die Erfüllung ihrer Forderung gefährdet wird.  Den Gläubigern der an der Verschmelzung beteiligten Rechtsträger ist, wenn sie binnen sechs Monaten nach dem Tag, an dem die Eintragung der Verschmelzung in das Register des Sitzes desjenigen Rechtsträgers, dessen Gläubiger sie sind, nach § 19 Abs. 3 UmwG als bekanntgemacht gilt, ihren Anspruch nach Grund und Höhe schriftlich anmelden, Sicherheit zu leisten, soweit sie nicht Befriedigung verlangen können. Dieses Recht steht den Gläubigern jedoch nur zu, wenn sie glaubhaft machen, dass durch die Verschmelzung die Erfüllung ihrer Forderung gefährdet wird."
    },
    {
      "date": "2024-12-13",
      "id": "96369",
      "original_text": "Löschungsankündigung\nBerlin Amtsgericht Berlin (Charlottenburg) HRB 209196\nEuro Technik Bau & Services GmbH – Berlin",
      "type": "Löschungsankündigung",
      "state": "Berlin",
      "amtsgericht": "Amtsgericht Berlin (Charlottenburg)",
      "registernummer": "HRB 209196",
      "registerart": "HRB",
      "company_name": "Euro Technik Bau & Services GmbH",
      "company_seat": "Berlin",
      "details": "13.12.2024 (Bekanntmachungsdatum)\n\nBerlin Amtsgericht Berlin (Charlottenburg) HRB 209196\nLöschungsankündigung\n\nEuro Technik Bau & Services GmbH\nGesellschaft mit beschränkter Haftung\nBerlin\n\nBei der nachstehenden Gesellschaft wird das Amtslöschungsverfahren gemäß § 394 FamFG eingeleitet. Widerspruchsfrist 6 Wochen"
    },
    {
      "date": "2024-12-13",
      "id": "96370",
      "original_text": "Löschungsankündigung\nBerlin Amtsgericht Berlin (Charlottenburg) HRB 222944\nMDGO Germany GmbH – Berlin",
      "type": "Löschungsankündigung",
      "state": "Berlin",
      "amtsgericht": "Amtsgericht Berlin (Charlottenburg)",
      "registernummer": "HRB 222944",
      "registerart": "HRB",
      "company_name": "MDGO Germany GmbH",
      "company_seat": "Berlin",
      "details": "13.12.2024 (Bekanntmachungsdatum)\n\nBerlin Amtsgericht Berlin (Charlottenburg) HRB 222944\nLöschungsankündigung\n\nMDGO Germany GmbH\nGesellschaft mit beschränkter Haftung\nBerlin\n\nBei der nachstehenden Gesellschaft wird das Amtslöschungsverfahren gemäß § 394 FamFG eingeleitet. Widerspruchsfrist 6 Wochen"
    },
    {
      "date": "2024-12-13",
      "id": "96371",
      "original_text": "Registerbekanntmachung nach dem Umwandlungsgesetz\nBaden-Württemberg Amtsgericht Ulm HRB 747815\nMüller Borago Grundstücksverwaltungsgesellschaft mbH – Ulm",
      "type": "Registerbekanntmachung nach dem Umwandlungsgesetz",
      "state": "Baden-Württemberg",
      "amtsgericht": "Amtsgericht Ulm",
      "registernummer": "HRB 747815",
      "registerart": "HRB",
      "company_name": "Müller Borago Grundstücksverwaltungsgesellschaft mbH",
      "company_seat": "Ulm",
      "details": "13.12.2024 (Bekanntmachungsdatum)\n\nBaden-Württemberg Amtsgericht Ulm HRB 747815\nRegisterbekanntmachung nach dem Umwandlungsgesetz 13.12.2024 (Eintragungsdatum)\n\nMüller Borago Grundstücksverwaltungsgesellschaft mbH\nGesellschaft mit beschränkter Haftung\nUlm\n\nAls nicht eingetragen wird bekanntgemacht:\nDen Gläubigern der an der Verschmelzung beteiligten Rechtsträger ist, wenn sie binnen sechs Monaten nach dem Tag, an dem die Eintragung der Verschmelzung in das Register des Sitzes desjenigen Rechtsträgers, dessen Gläubiger sie sind, nach § 19 Abs. 3 UmwG als bekanntgemacht gilt, ihren Anspruch nach Grund und Höhe schriftlich anmelden, Sicherheit zu leisten, soweit sie nicht Befriedigung verlangen können. Dieses Recht steht den Gläubigern jedoch nur zu, wenn sie glaubhaft machen, dass durch die Verschmelzung die Erfüllung ihrer Forderung gefährdet wird."
    },
    {
      "date": "2024-12-13",
      "id": "96372",
      "original_text": "Registerbekanntmachung nach dem Umwandlungsgesetz\nBaden-Württemberg Amtsgericht Ulm HRB 5219\nDL Beimerstetten GmbH – Beimerstetten",
      "type": "Registerbekanntmachung nach dem Umwandlungsgesetz",
      "state": "Baden-Württemberg",
      "amtsgericht": "Amtsgericht Ulm",
      "registernummer": "HRB 5219",
      "registerart": "HRB",
      "company_name": "DL Beimerstetten GmbH",
      "company_seat": "Beimerstetten",
      "details": "13.12.2024 (Bekanntmachungsdatum)\n\nBaden-Württemberg Amtsgericht Ulm HRB 5219\nRegisterbekanntmachung nach dem Umwandlungsgesetz 13.12.2024 (Eintragungsdatum)\n\nDL Beimerstetten GmbH\nGesellschaft mit beschränkter Haftung\nBeimerstetten\n\nAls nicht eingetragen wird bekanntgemacht:\nDen Gläubigern der an der Verschmelzung beteiligten Rechtsträger ist, wenn sie binnen sechs Monaten nach dem Tag, an dem die Eintragung der Verschmelzung in das Register des Sitzes desjenigen Rechtsträgers, dessen Gläubiger sie sind, nach § 19 Abs. 3 UmwG als bekanntgemacht gilt, ihren Anspruch nach Grund und Höhe schriftlich anmelden, Sicherheit zu leisten, soweit sie nicht Befriedigung verlangen können. Dieses Recht steht den Gläubigern jedoch nur zu, wenn sie glaubhaft machen, dass durch die Verschmelzung die Erfüllung ihrer Forderung gefährdet wird."
    },
    {
      "date": "2024-12-13",
      "id": "96373",
      "original_text": "Registerbekanntmachung nach dem Umwandlungsgesetz\nSachsen-Anhalt Amtsgericht Stendal HRA 8000\nSmain Service Solutions e.Kfr. – Luth. Wittenberg",
      "type": "Registerbekanntmachung nach dem Umwandlungsgesetz",
      "state": "Sachsen-Anhalt",
      "amtsgericht": "Amtsgericht Stendal",
      "registernummer": "HRA 8000",
      "registerart": "HRA",
      "company_name": "Smain Service Solutions e.Kfr.",
      "company_seat": "Luth. Wittenberg",
      "details": "13.12.2024 (Bekanntmachungsdatum)\n\nSachsen-Anhalt Amtsgericht Stendal HRA 8000\nRegisterbekanntmachung nach dem Umwandlungsgesetz 13.12.2024 (Eintragungsdatum)\n\nSmain Service Solutions e.Kfr.\nEinzelkaufmann / Einzelkauffrau\nLuth. Wittenberg\n\nNicht eingetragen:\nDen Gläubigern der an der Ausgliederung beteiligten Rechtsträger, ist wenn sie binnen sechs Monaten nach dem Tag, an dem die Eintragung der Ausgliederung nach §§125, 19 Abs. 3 UmwG als bekanntgemacht gilt, ihren Anspruch nach Grund und Höhe schriftlich anmelden, Sicherheit zu leisten, soweit sie nicht Befriedigung verlangen können. Diese Recht steht ihnen jedoch nur zu, wenn sie glaubhaft machen, dass durch die Ausgliederung die Erfüllung ihrer Forderung gefährdet wird."
    },
    {
      "date": "2024-12-13",
      "id": "96374",
      "original_text": "Löschungsankündigung\nMecklenburg-Vorpommern Amtsgericht Schwerin HRA 1282\nAutohaus Kärst e. K., Inhaber Dirk Radtke – Schwerin",
      "type": "Löschungsankündigung",
      "state": "Mecklenburg-Vorpommern",
      "amtsgericht": "Amtsgericht Schwerin",
      "registernummer": "HRA 1282",
      "registerart": "HRA",
      "company_name": "Autohaus Kärst e. K., Inhaber Dirk Radtke",
      "company_seat": "Schwerin",
      "details": "13.12.2024 (Bekanntmachungsdatum)\n\nMecklenburg-Vorpommern Amtsgericht Schwerin HRA 1282\nLöschungsankündigung\n\nAutohaus Kärst e. K., Inhaber Dirk Radtke\nEinzelkaufmann / Einzelkauffrau\nSchwerin\n\nDas Amtsgericht Schwerin, Handelsregisterabteilung, beabsichtigt den o.g. Kaufmann gemäß § 31 Abs. 2, § 393 FamFG von Amts wegen zu löschen, wenn nicht binnen eines Monats nach dieser Bekanntmachung hiergegen Widerspruch erhoben wird."
    },
    {
      "date": "2024-12-13",
      "id": "96375",
      "original_text": "Registerbekanntmachung nach dem Umwandlungsgesetz\nSachsen-Anhalt Amtsgericht Stendal HRB 215491\nEuropean Energy Deutschland GmbH – Teuchern",
      "type": "Registerbekanntmachung nach dem Umwandlungsgesetz",
      "state": "Sachsen-Anhalt",
      "amtsgericht": "Amtsgericht Stendal",
      "registernummer": "HRB 215491",
      "registerart": "HRB",
      "company_name": "European Energy Deutschland GmbH",
      "company_seat": "Teuchern",
      "details": "13.12.2024 (Bekanntmachungsdatum)\n\nSachsen-Anhalt Amtsgericht Stendal HRB 215491\nRegisterbekanntmachung nach dem Umwandlungsgesetz 13.12.2024 (Eintragungsdatum)\n\nEuropean Energy Deutschland GmbH\nGesellschaft mit beschränkter Haftung\nTeuchern\n\nNicht eingetragen:\nDen Gläubigern der an der Verschmelzung beteiligten Rechtsträger ist, wenn sie binnen sechs Monaten nach dem Tag, an dem die Eintragung der Verschmelzung nach § 19 Abs. 3 UmwG als bekanntgemacht gilt, ihren Anspruch nach Grund und Höhe schriftlich anmelden, Sicherheit zu leisten, soweit sie nicht Befriedigung verlangen können. Dieses Recht steht ihnen jedoch nur zu, wenn sie glaubhaft machen, dass durch die Verschmelzung die Erfüllung ihrer Forderung gefährdet wird."
    },
    {
      "date": "2024-12-13",
      "id": "96376",
      "original_text": "Löschungsankündigung\nBerlin Amtsgericht Berlin (Charlottenburg) HRB 240300\nZeitDrive GmbH – Berlin",
      "type": "Löschungsankündigung",
      "state": "Berlin",
      "amtsgericht": "Amtsgericht Berlin (Charlottenburg)",
      "registernummer": "HRB 240300",
      "registerart": "HRB",
      "company_name": "ZeitDrive GmbH",
      "company_seat": "Berlin",
      "details": "13.12.2024 (Bekanntmachungsdatum)\n\nBerlin Amtsgericht Berlin (Charlottenburg) HRB 240300\nLöschungsankündigung\n\nZeitDrive GmbH\nGesellschaft mit beschränkter Haftung\nBerlin\n\nBei der nachstehenden Gesellschaft wird das Amtslöschungsverfahren gemäß § 394 FamFG eingeleitet. Widerspruchsfrist 6 Wochen"
    },
    {
      "date": "2024-12-13",
      "id": "96377",
      "original_text": "Einreichung neuer Dokumente\nBaden-Württemberg Amtsgericht Mannheim HRB 9135\nStadtmarketing Mannheim GmbH – Mannheim",
      "type": "Einreichung neuer Dokumente",
      "state": "Baden-Württemberg",
      "amtsgericht": "Amtsgericht Mannheim",
      "registernummer": "HRB 9135",
      "registerart": "HRB",
      "company_name": "Stadtmarketing Mannheim GmbH",
      "company_seat": "Mannheim",
      "details": "13.12.2024 (Bekanntmachungsdatum)\n\nBaden-Württemberg Amtsgericht Mannheim HRB 9135\nEinreichung neuer Dokumente 13.12.2024 (Eintragungsdatum)\n\nStadtmarketing Mannheim GmbH\nGesellschaft mit beschränkter Haftung\nMannheim\n\nDie Gesellschaft hat am 09.12.2024 die Listen über die Zusammensetzung des Aufsichtsrats zum Handelsregister eingereicht."
    },
    {
      "date": "2024-12-13",
      "id": "96378",
      "original_text": "Registerbekanntmachung nach dem Umwandlungsgesetz\nHamburg Amtsgericht Hamburg HRB 142504\nGünther Holding SE – Hamburg",
      "type": "Registerbekanntmachung nach dem Umwandlungsgesetz",
      "state": "Hamburg",
      "amtsgericht": "Amtsgericht Hamburg",
      "registernummer": "HRB 142504",
      "registerart": "HRB",
      "company_name": "Günther Holding SE",
      "company_seat": "Hamburg",
      "details": "13.12.2024 (Bekanntmachungsdatum)\n\nHamburg Amtsgericht Hamburg HRB 142504\nRegisterbekanntmachung nach dem Umwandlungsgesetz 13.12.2024 (Eintragungsdatum)\n\nGünther Holding SE\nEuropäische Aktiengesellschaft (SE)\nHamburg\n\nAls nicht eingetragen wird bekannt gemacht:\nDen Gläubigern der an der Verschmelzung beteiligten Gesellschaften ist, wenn sie binnen sechs Monaten nach dem Tag, an dem die Eintragung der Verschmelzung in das Register des Sitzes desjenigen Rechtsträgers, dessen Gläubiger sie sind, nach § 19 Absatz 3 UmwG als bekannt gemacht gilt, ihren Anspruch nach Grund und Höhe schriftlich anmelden, Sicherheit zu leisten, soweit sie nicht Befriedigung verlangen können. Dieses Recht steht den Gläubigern jedoch nur zu, wenn sie glaubhaft machen, dass durch die Verschmelzung die Erfüllung ihrer Forderung gefährdet wird."
    },
    {
      "date": "2024-12-13",
      "id": "96379",
      "original_text": "Registerbekanntmachung nach dem Umwandlungsgesetz\nHamburg Amtsgericht Hamburg HRB 97851\nGünther Services GmbH – Hamburg",
      "type": "Registerbekanntmachung nach dem Umwandlungsgesetz",
      "state": "Hamburg",
      "amtsgericht": "Amtsgericht Hamburg",
      "registernummer": "HRB 97851",
      "registerart": "HRB",
      "company_name": "Günther Services GmbH",
      "company_seat": "Hamburg",
      "details": "13.12.2024 (Bekanntmachungsdatum)\n\nHamburg Amtsgericht Hamburg HRB 97851\nRegisterbekanntmachung nach dem Umwandlungsgesetz 13.12.2024 (Eintragungsdatum)\n\nGünther Services GmbH\nGesellschaft mit beschränkter Haftung\nHamburg\n\nAls nicht eingetragen wird bekannt gemacht:\nDen Gläubigern der an der Verschmelzung beteiligten Gesellschaften ist, wenn sie binnen sechs Monaten nach dem Tag, an dem die Eintragung der Verschmelzung in das Register des Sitzes desjenigen Rechtsträgers, dessen Gläubiger sie sind, nach § 19 Absatz 3 UmwG als bekannt gemacht gilt, ihren Anspruch nach Grund und Höhe schriftlich anmelden, Sicherheit zu leisten, soweit sie nicht Befriedigung verlangen können. Dieses Recht steht den Gläubigern jedoch nur zu, wenn sie glaubhaft machen, dass durch die Verschmelzung die Erfüllung ihrer Forderung gefährdet wird."
    },
    {
      "date": "2024-12-13",
      "id": "96380",
      "original_text": "Sonstige Registerbekanntmachung\nHamburg Amtsgericht Hamburg HRB 64570\nHUNTSMAN Verwaltungs GmbH – Hamburg",
      "type": "Sonstige Registerbekanntmachung",
      "state": "Hamburg",
      "amtsgericht": "Amtsgericht Hamburg",
      "registernummer": "HRB 64570",
      "registerart": "HRB",
      "company_name": "HUNTSMAN Verwaltungs GmbH",
      "company_seat": "Hamburg",
      "details": "13.12.2024 (Bekanntmachungsdatum)\n\nHamburg Amtsgericht Hamburg HRB 64570\nSonstige Registerbekanntmachung 13.12.2024 (Eintragungsdatum)\n\nHUNTSMAN Verwaltungs GmbH\nGesellschaft mit beschränkter Haftung\nHamburg\n\nAls nicht eingetragen wird bekannt gemacht:  Den Gläubigern der Gesellschaft, deren Forderungen begründet worden sind, bevor die Eintragung der Vertragsbeendigung in das Handelsregister nach § 10 HGB als bekannt gemacht gilt, ist vom anderen Vertragsteil Sicherheit zu leisten, wenn sie sich binnen 6 Monaten nach Bekanntmachung der Eintragung zu diesem Zweck bei ihm melden."
    },
    {
      "date": "2024-12-13",
      "id": "96381",
      "original_text": "Registerbekanntmachung nach dem Umwandlungsgesetz\nHamburg Amtsgericht Hamburg HRB 134393\nExporo AG – Hamburg",
      "type": "Registerbekanntmachung nach dem Umwandlungsgesetz",
      "state": "Hamburg",
      "amtsgericht": "Amtsgericht Hamburg",
      "registernummer": "HRB 134393",
      "registerart": "HRB",
      "company_name": "Exporo AG",
      "company_seat": "Hamburg",
      "details": "13.12.2024 (Bekanntmachungsdatum)\n\nHamburg Amtsgericht Hamburg HRB 134393\nRegisterbekanntmachung nach dem Umwandlungsgesetz 13.12.2024 (Eintragungsdatum)\n\nExporo AG\nAktiengesellschaft\nHamburg\n\nAls nicht eingetragen wird bekannt gemacht:\nDen Gläubigern der an der Verschmelzung beteiligten Gesellschaften ist, wenn sie binnen sechs Monaten nach dem Tag, an dem die Eintragung der Verschmelzung in das Register des Sitzes desjenigen Rechtsträgers, dessen Gläubiger sie sind, nach § 19 Absatz 3 UmwG als bekannt gemacht gilt, ihren Anspruch nach Grund und Höhe schriftlich anmelden, Sicherheit zu leisten, soweit sie nicht Befriedigung verlangen können. Dieses Recht steht den Gläubigern jedoch nur zu, wenn sie glaubhaft machen, dass durch die Verschmelzung die Erfüllung ihrer Forderung gefährdet wird."
    },
    {
      "date": "2024-12-13",
      "id": "96382",
      "original_text": "Sonstige Registerbekanntmachung\nHamburg Amtsgericht Hamburg HRB 134393\nExporo AG – Hamburg",
      "type": "Sonstige Registerbekanntmachung",
      "state": "Hamburg",
      "amtsgericht": "Amtsgericht Hamburg",
      "registernummer": "HRB 134393",
      "registerart": "HRB",
      "company_name": "Exporo AG",
      "company_seat": "Hamburg",
      "details": "13.12.2024 (Bekanntmachungsdatum)\n\nHamburg Amtsgericht Hamburg HRB 134393\nSonstige Registerbekanntmachung 13.12.2024 (Eintragungsdatum)\n\nExporo AG\nAktiengesellschaft\nHamburg\n\nAls nicht eingetragen wird bekannt gemacht: Liste des Aufsichtsrats wurde eingereicht."
    },
    {
      "date": "2024-12-13",
      "id": "96383",
      "original_text": "Einreichung neuer Dokumente\nSachsen-Anhalt Amtsgericht Stendal HRB 207945\nWohnungsbaugesellschaft Zeitz mbH – Zeitz",
      "type": "Einreichung neuer Dokumente",
      "state": "Sachsen-Anhalt",
      "amtsgericht": "Amtsgericht Stendal",
      "registernummer": "HRB 207945",
      "registerart": "HRB",
      "company_name": "Wohnungsbaugesellschaft Zeitz mbH",
      "company_seat": "Zeitz",
      "details": "13.12.2024 (Bekanntmachungsdatum)\n\nSachsen-Anhalt Amtsgericht Stendal HRB 207945\nEinreichung neuer Dokumente\n\nWohnungsbaugesellschaft Zeitz mbH\nGesellschaft mit beschränkter Haftung\nZeitz\n\nEine Liste der Mitglieder des Aufsichtsrates wurde zum Handelsregister eingereicht."
    },
    {
      "date": "2024-12-13",
      "id": "96384",
      "original_text": "Registerbekanntmachung nach dem Umwandlungsgesetz\nThüringen Amtsgericht Jena HRA 506830\nVB Elektrotechnik Apolda, Inh. Rene Radtke e.K. – Apolda",
      "type": "Registerbekanntmachung nach dem Umwandlungsgesetz",
      "state": "Thüringen",
      "amtsgericht": "Amtsgericht Jena",
      "registernummer": "HRA 506830",
      "registerart": "HRA",
      "company_name": "VB Elektrotechnik Apolda, Inh. Rene Radtke e.K.",
      "company_seat": "Apolda",
      "details": "13.12.2024 (Bekanntmachungsdatum)\n\nThüringen Amtsgericht Jena HRA 506830\nRegisterbekanntmachung nach dem Umwandlungsgesetz 13.12.2024 (Eintragungsdatum)\n\nVB Elektrotechnik Apolda, Inh. Rene Radtke e.K.\nEinzelkaufmann / Einzelkauffrau\nApolda\n\nNicht eingetragen: Den Gläubigern der an der Ausgliederung beteiligten Rechtsträger, ist wenn sie binnen sechs Monaten nach dem Tag, an dem die Eintragung der Ausgliederung in das Register des Sitzes desjenigen Rechtsträgers, dessen Gläubiger sie sind, nach §§125, 19 Abs. 3 UmwG als bekanntgemacht gilt, ihren Anspruch nach Grund und Höhe schriftlich anmelden, Sicherheit zu leisten, soweit sie nicht Befriedigung verlangen können. Dieses Recht steht ihnen jedoch nur zu, wenn sie glaubhaft machen, daß durch die Ausgliederung die Erfüllung ihrer Forderung gefährdet wird."
    },
    {
      "date": "2024-12-13",
      "id": "96385",
      "original_text": "Einreichung neuer Dokumente\nThüringen Amtsgericht Jena HRB 304426\nHenneberg-Kliniken-Besitzgesellschaft mit beschränkter Haftung – Hildburghausen",
      "type": "Einreichung neuer Dokumente",
      "state": "Thüringen",
      "amtsgericht": "Amtsgericht Jena",
      "registernummer": "HRB 304426",
      "registerart": "HRB",
      "company_name": "Henneberg-Kliniken-Besitzgesellschaft mit beschränkter Haftung",
      "company_seat": "Hildburghausen",
      "details": "13.12.2024 (Bekanntmachungsdatum)\n\nThüringen Amtsgericht Jena HRB 304426\nEinreichung neuer Dokumente\n\nHenneberg-Kliniken-Besitzgesellschaft mit beschränkter Haftung\nGesellschaft mit beschränkter Haftung\nHildburghausen\n\nBekanntmachung gem. § 52 Abs. 3 Satz 2 GmbHG: Aufgrund einer Veränderung in den Personen der Aufsichtsratsmitglieder sind durch die Geschäftsführer fünf neue Listen zum Handelsregister eingereicht worden."
    },
    {
      "date": "2024-12-13",
      "id": "96386",
      "original_text": "Registerbekanntmachung nach dem Umwandlungsgesetz\nSchleswig-Holstein Amtsgericht Lübeck HRA 8286\nOrient Vision e.K. – Oststeinbek",
      "type": "Registerbekanntmachung nach dem Umwandlungsgesetz",
      "state": "Schleswig-Holstein",
      "amtsgericht": "Amtsgericht Lübeck",
      "registernummer": "HRA 8286",
      "registerart": "HRA",
      "company_name": "Orient Vision e.K.",
      "company_seat": "Oststeinbek",
      "details": "13.12.2024 (Bekanntmachungsdatum)\n\nSchleswig-Holstein Amtsgericht Lübeck HRA 8286\nRegisterbekanntmachung nach dem Umwandlungsgesetz 12.12.2024 (Eintragungsdatum)\n\nOrient Vision e.K.\nEinzelkaufmann / Einzelkauffrau\nOststeinbek\n\nZu Eintragungsnummer 2 vom 12.12.2024 wird als nicht eingetragen veröffentlicht: Den Gläubigern der an der Ausgliederung beteiligten Rechtsträger ist, wenn sie binnen sechs Monaten nach dem Tag, an dem die Eintragung der Ausgliederung in das Register des Sitzes desjenigen Rechtsträgers, dessen Gläubiger sie sind, als bekannt gemacht gilt, ihren Anspruch nach Grund und Höhe schriftlich anmelden, Sicherheit zu leisten, soweit sie nicht Befriedigung verlangen können. Dieses Recht steht den Gläubigern jedoch nur zu, wenn sie glaubhaft machen, dass durch die Ausgliederung die Erfüllung ihrer Forderung gefährdet wird."
    },
    {
      "date": "2024-12-13",
      "id": "96387",
      "original_text": "Registerbekanntmachung nach dem Umwandlungsgesetz\nHamburg Amtsgericht Hamburg HRB 133804\nCivum GmbH – Hamburg",
      "type": "Registerbekanntmachung nach dem Umwandlungsgesetz",
      "state": "Hamburg",
      "amtsgericht": "Amtsgericht Hamburg",
      "registernummer": "HRB 133804",
      "registerart": "HRB",
      "company_name": "Civum GmbH",
      "company_seat": "Hamburg",
      "details": "13.12.2024 (Bekanntmachungsdatum)\n\nHamburg Amtsgericht Hamburg HRB 133804\nRegisterbekanntmachung nach dem Umwandlungsgesetz 13.12.2024 (Eintragungsdatum)\n\nCivum GmbH\nGesellschaft mit beschränkter Haftung\nHamburg\n\nAls nicht eingetragen wird bekannt gemacht:\nDen Gläubigern der an der Verschmelzung beteiligten Gesellschaften ist, wenn sie binnen sechs Monaten nach dem Tag, an dem die Eintragung der Verschmelzung in das Register des Sitzes desjenigen Rechtsträgers, dessen Gläubiger sie sind, nach § 19 Absatz 3 UmwG als bekannt gemacht gilt, ihren Anspruch nach Grund und Höhe schriftlich anmelden, Sicherheit zu leisten, soweit sie nicht Befriedigung verlangen können. Dieses Recht steht den Gläubigern jedoch nur zu, wenn sie glaubhaft machen, dass durch die Verschmelzung die Erfüllung ihrer Forderung gefährdet wird."
    },
    {
      "date": "2024-12-13",
      "id": "96388",
      "original_text": "Löschungsankündigung\nBerlin Amtsgericht Berlin (Charlottenburg) HRA 52097\nShahnameh - The House of Hospitality GmbH & Co. KG – Berlin",
      "type": "Löschungsankündigung",
      "state": "Berlin",
      "amtsgericht": "Amtsgericht Berlin (Charlottenburg)",
      "registernummer": "HRA 52097",
      "registerart": "HRA",
      "company_name": "Shahnameh - The House of Hospitality GmbH & Co. KG",
      "company_seat": "Berlin",
      "details": "13.12.2024 (Bekanntmachungsdatum)\n\nBerlin Amtsgericht Berlin (Charlottenburg) HRA 52097\nLöschungsankündigung\n\nShahnameh - The House of Hospitality GmbH & Co. KG\nKommanditgesellschaft\nBerlin\n\nBei dem nachstehenden Unternehmen / der nachstehenden Gesellschaft wird das Amtslöschungsverfahren gemäß § 31 Abs. 2 HGB eingeleitet. Widerspruchsfrist 1 Monat."
    },
    {
      "date": "2024-12-13",
      "id": "96389",
      "original_text": "Registerbekanntmachung nach dem Umwandlungsgesetz\nSchleswig-Holstein Amtsgericht Lübeck HRB 25627\nOrient Vision GmbH – Oststeinbek",
      "type": "Registerbekanntmachung nach dem Umwandlungsgesetz",
      "state": "Schleswig-Holstein",
      "amtsgericht": "Amtsgericht Lübeck",
      "registernummer": "HRB 25627",
      "registerart": "HRB",
      "company_name": "Orient Vision GmbH",
      "company_seat": "Oststeinbek",
      "details": "13.12.2024 (Bekanntmachungsdatum)\n\nSchleswig-Holstein Amtsgericht Lübeck HRB 25627\nRegisterbekanntmachung nach dem Umwandlungsgesetz 12.12.2024 (Eintragungsdatum)\n\nOrient Vision GmbH\nGesellschaft mit beschränkter Haftung\nOststeinbek\n\nZu Eintragungsnummer 1 vom 12.12.2024 wird als nicht eingetragen veröffentlicht: Den Gläubigern der an der Spaltung beteiligten Rechtsträger ist, wenn sie binnen sechs Monaten nach dem Tag, an dem die Eintragung der Spaltung in das Register des Sitzes desjenigen Rechtsträgers, dessen Gläubiger sie sind, als bekannt gemacht gilt, ihren Anspruch nach Grund und Höhe schriftlich anmelden, Sicherheit zu leisten, soweit sie nicht Befriedigung verlangen können. Dieses Recht steht den Gläubigern jedoch nur zu, wenn sie glaubhaft machen, dass durch die Spaltung die Erfüllung ihrer Forderung gefährdet wird."
    },
    {
      "date": "2024-12-13",
      "id": "96390",
      "original_text": "Einreichung neuer Dokumente\nSchleswig-Holstein Amtsgericht Pinneberg HRB 7739\nBiotic Science Holding AG – Pinneberg",
      "type": "Einreichung neuer Dokumente",
      "state": "Schleswig-Holstein",
      "amtsgericht": "Amtsgericht Pinneberg",
      "registernummer": "HRB 7739",
      "registerart": "HRB",
      "company_name": "Biotic Science Holding AG",
      "company_seat": "Pinneberg",
      "details": "13.12.2024 (Bekanntmachungsdatum)\n\nSchleswig-Holstein Amtsgericht Pinneberg HRB 7739\nEinreichung neuer Dokumente\n\nBiotic Science Holding AG\nAktiengesellschaft\nPinneberg\n\nAls nicht eingetragen wird veröffentlicht: Es wurde gem. § 106 AktG eine neue Liste der Aufsichtsratsmitglieder zum Handelsregister eingereicht."
    },
    {
      "date": "2024-12-13",
      "id": "96391",
      "original_text": "Löschungsankündigung\nBrandenburg Amtsgericht Potsdam HRB 29212\nSchaffrathnumis GmbH – Kleinmachnow",
      "type": "Löschungsankündigung",
      "state": "Brandenburg",
      "amtsgericht": "Amtsgericht Potsdam",
      "registernummer": "HRB 29212",
      "registerart": "HRB",
      "company_name": "Schaffrathnumis GmbH",
      "company_seat": "Kleinmachnow",
      "details": "13.12.2024 (Bekanntmachungsdatum)\n\nBrandenburg Amtsgericht Potsdam HRB 29212\nLöschungsankündigung\n\nSchaffrathnumis GmbH\nGesellschaft mit beschränkter Haftung\nKleinmachnow\n\nBei der nachstehenden Gesellschaft wird das Amtslöschungsverfahren gemäß § 394 FamFG eingeleitet. Widerspruchsfrist: 8 Wochen."
    },
    {
      "date": "2024-12-13",
      "id": "96392",
      "original_text": "Einreichung neuer Dokumente\nBaden-Württemberg Amtsgericht Stuttgart HRB 480006\nSchramberger Wohnungsbau, Gesellschaft mit beschränkter Haftung – Schramberg",
      "type": "Einreichung neuer Dokumente",
      "state": "Baden-Württemberg",
      "amtsgericht": "Amtsgericht Stuttgart",
      "registernummer": "HRB 480006",
      "registerart": "HRB",
      "company_name": "Schramberger Wohnungsbau, Gesellschaft mit beschränkter Haftung",
      "company_seat": "Schramberg",
      "details": "13.12.2024 (Bekanntmachungsdatum)\n\nBaden-Württemberg Amtsgericht Stuttgart HRB 480006\nEinreichung neuer Dokumente\n\nSchramberger Wohnungsbau, Gesellschaft mit beschränkter Haftung\nGesellschaft mit beschränkter Haftung\nSchramberg\n\nDie Gesellschaft hat am 12.12.2024 die Liste über die Zusammensetzung des Aufsichtsrats zum Handelsregister eingereicht."
    },
    {
      "date": "2024-12-13",
      "id": "96393",
      "original_text": "Löschungsankündigung\nSchleswig-Holstein Amtsgericht Kiel HRB 23947\nInter-Concordia GmbH – Wasbek",
      "type": "Löschungsankündigung",
      "state": "Schleswig-Holstein",
      "amtsgericht": "Amtsgericht Kiel",
      "registernummer": "HRB 23947",
      "registerart": "HRB",
      "company_name": "Inter-Concordia GmbH",
      "company_seat": "Wasbek",
      "details": "13.12.2024 (Bekanntmachungsdatum)\n\nSchleswig-Holstein Amtsgericht Kiel HRB 23947\nLöschungsankündigung\n\nInter-Concordia GmbH\nGesellschaft mit beschränkter Haftung\nWasbek\n\nEs ist die Löschung der nachstehenden Gesellschaft wegen Vermögenslosigkeit gemäß § 394 FamFG beabsichtigt. Widerspruchsfrist: 2 Monate."
    },
    {
      "date": "2024-12-13",
      "id": "96394",
      "original_text": "Registerbekanntmachung nach dem Umwandlungsgesetz\nHamburg Amtsgericht Hamburg HRB 128189\nConceptIF Group AG – Hamburg",
      "type": "Registerbekanntmachung nach dem Umwandlungsgesetz",
      "state": "Hamburg",
      "amtsgericht": "Amtsgericht Hamburg",
      "registernummer": "HRB 128189",
      "registerart": "HRB",
      "company_name": "ConceptIF Group AG",
      "company_seat": "Hamburg",
      "details": "13.12.2024 (Bekanntmachungsdatum)\n\nHamburg Amtsgericht Hamburg HRB 128189\nRegisterbekanntmachung nach dem Umwandlungsgesetz 13.12.2024 (Eintragungsdatum)\n\nConceptIF Group AG\nAktiengesellschaft\nHamburg\n\nAls nicht eingetragen wird bekannt gemacht:\nDen Gläubigern der an der formwechselnden Umwandlung beteiligten Gesellschaften ist, wenn sie binnen sechs Monaten nach dem Tag, an dem die Eintragung der formwechselnden Umwandlung in das Register des Sitzes desjenigen Rechtsträgers, dessen Gläubiger sie sind, nach § 19 Absatz 3 UmwG als bekannt gemacht gilt, ihren Anspruch nach Grund und Höhe schriftlich anmelden, Sicherheit zu leisten, soweit sie nicht Befriedigung verlangen können. Dieses Recht steht den Gläubigern jedoch nur zu, wenn sie glaubhaft machen, dass durch die formwechselnde Umwandlung die Erfüllung ihrer Forderung gefährdet wird."
    },
    {
      "date": "2024-12-13",
      "id": "96395",
      "original_text": "Löschungsankündigung\nSchleswig-Holstein Amtsgericht Kiel HRA 6456\nN D Dienstleistungen e. K. – Mönkeberg",
      "type": "Löschungsankündigung",
      "state": "Schleswig-Holstein",
      "amtsgericht": "Amtsgericht Kiel",
      "registernummer": "HRA 6456",
      "registerart": "HRA",
      "company_name": "N D Dienstleistungen e. K.",
      "company_seat": "Mönkeberg",
      "details": "13.12.2024 (Bekanntmachungsdatum)\n\nSchleswig-Holstein Amtsgericht Kiel HRA 6456\nLöschungsankündigung\n\nN D Dienstleistungen e. K.\nEinzelkaufmann / Einzelkauffrau\nMönkeberg\n\nBei der nachstehenden Firma wird das Amtslöschungsverfahren gemäß § 31 Abs. 2 HGB eingeleitet. Widerspruchsfrist: 3 Monate."
    },
    {
      "date": "2024-12-13",
      "id": "96396",
      "original_text": "Löschungsankündigung\nSchleswig-Holstein Amtsgericht Flensburg HRB 9181\nKleine Kneipe UG (haftungsbeschränkt) – Flensburg",
      "type": "Löschungsankündigung",
      "state": "Schleswig-Holstein",
      "amtsgericht": "Amtsgericht Flensburg",
      "registernummer": "HRB 9181",
      "registerart": "HRB",
      "company_name": "Kleine Kneipe UG (haftungsbeschränkt)",
      "company_seat": "Flensburg",
      "details": "13.12.2024 (Bekanntmachungsdatum)\n\nSchleswig-Holstein Amtsgericht Flensburg HRB 9181\nLöschungsankündigung\n\nKleine Kneipe UG (haftungsbeschränkt)\nGesellschaft mit beschränkter Haftung\nFlensburg\n\nEs ist die Löschung der nachstehenden Gesellschaft wegen Vermögenslosigkeit gemäß § 394 FamFG beabsichtigt.\nWiderspruchsfrist: 2 Monate."
    },
    {
      "date": "2024-12-13",
      "id": "96397",
      "original_text": "Registerbekanntmachung nach dem Umwandlungsgesetz\nHamburg Amtsgericht Hamburg HRB 138926\nAMERIGI Beteiligungsgesellschaft mbH – Hamburg",
      "type": "Registerbekanntmachung nach dem Umwandlungsgesetz",
      "state": "Hamburg",
      "amtsgericht": "Amtsgericht Hamburg",
      "registernummer": "HRB 138926",
      "registerart": "HRB",
      "company_name": "AMERIGI Beteiligungsgesellschaft mbH",
      "company_seat": "Hamburg",
      "details": "13.12.2024 (Bekanntmachungsdatum)\n\nHamburg Amtsgericht Hamburg HRB 138926\nRegisterbekanntmachung nach dem Umwandlungsgesetz 13.12.2024 (Eintragungsdatum)\n\nAMERIGI Beteiligungsgesellschaft mbH\nGesellschaft mit beschränkter Haftung\nHamburg\n\nAls nicht eingetragen wird bekannt gemacht:\nDen Gläubigern der an der Verschmelzung beteiligten Gesellschaften ist, wenn sie binnen sechs Monaten nach dem Tag, an dem die Eintragung der Verschmelzung in das Register des Sitzes desjenigen Rechtsträgers, dessen Gläubiger sie sind, nach § 19 Absatz 3 UmwG als bekannt gemacht gilt, ihren Anspruch nach Grund und Höhe schriftlich anmelden, Sicherheit zu leisten, soweit sie nicht Befriedigung verlangen können. Dieses Recht steht den Gläubigern jedoch nur zu, wenn sie glaubhaft machen, dass durch die Verschmelzung die Erfüllung ihrer Forderung gefährdet wird."
    },
    {
      "date": "2024-12-13",
      "id": "96398",
      "original_text": "Sonstige Registerbekanntmachung\nHamburg Amtsgericht Hamburg HRB 153992\nSunnic Lighthouse Solar Invest 19 GmbH – Hamburg",
      "type": "Sonstige Registerbekanntmachung",
      "state": "Hamburg",
      "amtsgericht": "Amtsgericht Hamburg",
      "registernummer": "HRB 153992",
      "registerart": "HRB",
      "company_name": "Sunnic Lighthouse Solar Invest 19 GmbH",
      "company_seat": "Hamburg",
      "details": "13.12.2024 (Bekanntmachungsdatum)\n\nHamburg Amtsgericht Hamburg HRB 153992\nSonstige Registerbekanntmachung 13.12.2024 (Eintragungsdatum)\n\nSunnic Lighthouse Solar Invest 19 GmbH\nGesellschaft mit beschränkter Haftung\nHamburg\n\nAls nicht eingetragen wird bekannt gemacht:  Den Gläubigern der Gesellschaft, deren Forderungen begründet worden sind, bevor die Eintragung der Vertragsbeendigung in das Handelsregister nach § 10 HGB als bekannt gemacht gilt, ist vom anderen Vertragsteil Sicherheit zu leisten, wenn sie sich binnen 6 Monaten nach Bekanntmachung der Eintragung zu diesem Zweck bei ihm melden."
    },
    {
      "date": "2024-12-13",
      "id": "96399",
      "original_text": "Registerbekanntmachung nach dem Umwandlungsgesetz\nHamburg Amtsgericht Hamburg HRB 163457\nSPIEGEL TV Infotainment & Fiction GmbH – Hamburg",
      "type": "Registerbekanntmachung nach dem Umwandlungsgesetz",
      "state": "Hamburg",
      "amtsgericht": "Amtsgericht Hamburg",
      "registernummer": "HRB 163457",
      "registerart": "HRB",
      "company_name": "SPIEGEL TV Infotainment & Fiction GmbH",
      "company_seat": "Hamburg",
      "details": "13.12.2024 (Bekanntmachungsdatum)\n\nHamburg Amtsgericht Hamburg HRB 163457\nRegisterbekanntmachung nach dem Umwandlungsgesetz 13.12.2024 (Eintragungsdatum)\n\nSPIEGEL TV Infotainment & Fiction GmbH\nGesellschaft mit beschränkter Haftung\nHamburg\n\nAls nicht eingetragen wird bekannt gemacht:\nDen Gläubigern der an der Verschmelzung beteiligten Gesellschaften ist, wenn sie binnen sechs Monaten nach dem Tag, an dem die Eintragung der Verschmelzung in das Register des Sitzes desjenigen Rechtsträgers, dessen Gläubiger sie sind, nach § 19 Absatz 3 UmwG als bekannt gemacht gilt, ihren Anspruch nach Grund und Höhe schriftlich anmelden, Sicherheit zu leisten, soweit sie nicht Befriedigung verlangen können. Dieses Recht steht den Gläubigern jedoch nur zu, wenn sie glaubhaft machen, dass durch die Verschmelzung die Erfüllung ihrer Forderung gefährdet wird."
    },
    {
      "date": "2024-12-13",
      "id": "96400",
      "original_text": "Registerbekanntmachung nach dem Umwandlungsgesetz\nHamburg Amtsgericht Hamburg HRB 172355\nAll About Fiction GmbH – Hamburg",
      "type": "Registerbekanntmachung nach dem Umwandlungsgesetz",
      "state": "Hamburg",
      "amtsgericht": "Amtsgericht Hamburg",
      "registernummer": "HRB 172355",
      "registerart": "HRB",
      "company_name": "All About Fiction GmbH",
      "company_seat": "Hamburg",
      "details": "13.12.2024 (Bekanntmachungsdatum)\n\nHamburg Amtsgericht Hamburg HRB 172355\nRegisterbekanntmachung nach dem Umwandlungsgesetz 13.12.2024 (Eintragungsdatum)\n\nAll About Fiction GmbH\nGesellschaft mit beschränkter Haftung\nHamburg\n\nAls nicht eingetragen wird bekannt gemacht:\nDen Gläubigern der an der Verschmelzung beteiligten Gesellschaften ist, wenn sie binnen sechs Monaten nach dem Tag, an dem die Eintragung der Verschmelzung in das Register des Sitzes desjenigen Rechtsträgers, dessen Gläubiger sie sind, nach § 19 Absatz 3 UmwG als bekannt gemacht gilt, ihren Anspruch nach Grund und Höhe schriftlich anmelden, Sicherheit zu leisten, soweit sie nicht Befriedigung verlangen können. Dieses Recht steht den Gläubigern jedoch nur zu, wenn sie glaubhaft machen, dass durch die Verschmelzung die Erfüllung ihrer Forderung gefährdet wird."
    },
    {
      "date": "2024-12-13",
      "id": "96401",
      "original_text": "Registerbekanntmachung nach dem Umwandlungsgesetz\nSachsen Amtsgericht Dresden HRA 12123\nMATEtronix GmbH & Co. KG – Dippoldiswalde",
      "type": "Registerbekanntmachung nach dem Umwandlungsgesetz",
      "state": "Sachsen",
      "amtsgericht": "Amtsgericht Dresden",
      "registernummer": "HRA 12123",
      "registerart": "HRA",
      "company_name": "MATEtronix GmbH & Co. KG",
      "company_seat": "Dippoldiswalde",
      "details": "13.12.2024 (Bekanntmachungsdatum)\n\nSachsen Amtsgericht Dresden HRA 12123\nRegisterbekanntmachung nach dem Umwandlungsgesetz 13.12.2024 (Eintragungsdatum)\n\nMATEtronix GmbH & Co. KG\nKommanditgesellschaft\nDippoldiswalde\n\nDen Gläubigern der an der Ausgliederung beteiligten Rechtsträger ist, wenn sie binnen sechs Monaten nach dem Tag, an dem die Eintragung der Ausgliederung in das Register des Sitzes desjenigen Rechtsträgers, dessen Gläubiger sie sind, nach § 19 Abs. 3 UmwG als bekannt gemacht gilt, ihren Anspruch nach Grund und Höhe schriftlich anmelden, Sicherheit zu leisten, soweit sie nicht Befriedigung verlangen können. Dieses Recht steht den Gläubigern jedoch nur zu, wenn sie glaubhaft machen, dass durch die Ausgliederung die Erfüllung der Forderung gefährdet wird."
    },
    {
      "date": "2024-12-13",
      "id": "96402",
      "original_text": "Löschungsankündigung\nSachsen Amtsgericht Dresden HRB 33157\nWirtshaus Altkö 26 GmbH – Radebeul",
      "type": "Löschungsankündigung",
      "state": "Sachsen",
      "amtsgericht": "Amtsgericht Dresden",
      "registernummer": "HRB 33157",
      "registerart": "HRB",
      "company_name": "Wirtshaus Altkö 26 GmbH",
      "company_seat": "Radebeul",
      "details": "13.12.2024 (Bekanntmachungsdatum)\n\nSachsen Amtsgericht Dresden HRB 33157\nLöschungsankündigung\n\nWirtshaus Altkö 26 GmbH\nGesellschaft mit beschränkter Haftung\nRadebeul\n\nDas Registergericht beabsichtigt, die im Handelsregister eingetragene Gesellschaft von Amts wegen nach § 394 FamFG zu löschen. Die Frist zu Erhebung eines Widerspruchs gegen die beabsichtigte Löschung wird auf einen Monat festgesetzt."
    },
    {
      "date": "2024-12-13",
      "id": "96403",
      "original_text": "Registerbekanntmachung nach dem Umwandlungsgesetz\nSachsen Amtsgericht Dresden HRB 6208\nSelectrona GmbH – Dippoldiswalde",
      "type": "Registerbekanntmachung nach dem Umwandlungsgesetz",
      "state": "Sachsen",
      "amtsgericht": "Amtsgericht Dresden",
      "registernummer": "HRB 6208",
      "registerart": "HRB",
      "company_name": "Selectrona GmbH",
      "company_seat": "Dippoldiswalde",
      "details": "13.12.2024 (Bekanntmachungsdatum)\n\nSachsen Amtsgericht Dresden HRB 6208\nRegisterbekanntmachung nach dem Umwandlungsgesetz 13.12.2024 (Eintragungsdatum)\n\nSelectrona GmbH\nGesellschaft mit beschränkter Haftung\nDippoldiswalde\n\nDen Gläubigern der an der Ausgliederung beteiligten Rechtsträger ist, wenn sie binnen sechs Monaten nach dem Tag, an dem die Eintragung der Ausgliederung in das Register des Sitzes desjenigen Rechtsträgers, dessen Gläubiger sie sind, nach § 19 Abs. 3 UmwG als bekannt gemacht gilt, ihren Anspruch nach Grund und Höhe schriftlich anmelden, Sicherheit zu leisten, soweit sie nicht Befriedigung verlangen können. Dieses Recht steht den Gläubigern jedoch nur zu, wenn sie glaubhaft machen, dass durch die Ausgliederung die Erfüllung der Forderung gefährdet wird."
    },
    {
      "date": "2024-12-13",
      "id": "96404",
      "original_text": "Einreichung neuer Dokumente\nSachsen Amtsgericht Chemnitz HRB 10607\nChemnitzer Wohn- und Heimstätten-Gesellschaft mit beschränkter Haftung – Chemnitz",
      "type": "Einreichung neuer Dokumente",
      "state": "Sachsen",
      "amtsgericht": "Amtsgericht Chemnitz",
      "registernummer": "HRB 10607",
      "registerart": "HRB",
      "company_name": "Chemnitzer Wohn- und Heimstätten-Gesellschaft mit beschränkter Haftung",
      "company_seat": "Chemnitz",
      "details": "13.12.2024 (Bekanntmachungsdatum)\n\nSachsen Amtsgericht Chemnitz HRB 10607\nEinreichung neuer Dokumente 12.12.2024 (Eintragungsdatum)\n\nChemnitzer Wohn- und Heimstätten-Gesellschaft mit beschränkter Haftung\nGesellschaft mit beschränkter Haftung\nChemnitz\n\nAm 12.12.2024 wurde beim Handelsregister des Amtsgerichts Chemnitz die Liste der Mitglieder des Aufsichtsrats gemäß § 52 GmbHG eingereicht."
    },
    {
      "date": "2024-12-13",
      "id": "96405",
      "original_text": "Einreichung neuer Dokumente\nSachsen Amtsgericht Leipzig HRB 7735\nHHL gemeinnützige GmbH – Leipzig",
      "type": "Einreichung neuer Dokumente",
      "state": "Sachsen",
      "amtsgericht": "Amtsgericht Leipzig",
      "registernummer": "HRB 7735",
      "registerart": "HRB",
      "company_name": "HHL gemeinnützige GmbH",
      "company_seat": "Leipzig",
      "details": "13.12.2024 (Bekanntmachungsdatum)\n\nSachsen Amtsgericht Leipzig HRB 7735\nEinreichung neuer Dokumente 13.12.2024 (Eintragungsdatum)\n\nHHL gemeinnützige GmbH\nGesellschaft mit beschränkter Haftung\nLeipzig\n\nAm 11.12.2024 wurde beim Handelsregister des Amtsgerichts Leipzig die Liste der Mitglieder des Aufsichtsrats gemäß § 52 GmbHG eingereicht."
    },
    {
      "date": "2024-12-13",
      "id": "96406",
      "original_text": "Einreichung neuer Dokumente\nSachsen Amtsgericht Leipzig HRB 41108\nARI Motors Industries SE – Borna",
      "type": "Einreichung neuer Dokumente",
      "state": "Sachsen",
      "amtsgericht": "Amtsgericht Leipzig",
      "registernummer": "HRB 41108",
      "registerart": "HRB",
      "company_name": "ARI Motors Industries SE",
      "company_seat": "Borna",
      "details": "13.12.2024 (Bekanntmachungsdatum)\n\nSachsen Amtsgericht Leipzig HRB 41108\nEinreichung neuer Dokumente 13.12.2024 (Eintragungsdatum)\n\nARI Motors Industries SE\nEuropäische Aktiengesellschaft (SE)\nBorna\n\nAm 06.12.2024 wurde beim Handelsregister des Amtsgerichts Leipzig die Liste der Mitglieder des Verwaltungsrats gemäß § 106 AktG eingereicht."
    },
    {
      "date": "2024-12-13",
      "id": "96407",
      "original_text": "Registerbekanntmachung nach dem Umwandlungsgesetz\nNiedersachsen Amtsgericht Hannover HRB 223619\nMalandus GmbH – Burgwedel",
      "type": "Registerbekanntmachung nach dem Umwandlungsgesetz",
      "state": "Niedersachsen",
      "amtsgericht": "Amtsgericht Hannover",
      "registernummer": "HRB 223619",
      "registerart": "HRB",
      "company_name": "Malandus GmbH",
      "company_seat": "Burgwedel",
      "details": "13.12.2024 (Bekanntmachungsdatum)\n\nNiedersachsen Amtsgericht Hannover HRB 223619\nRegisterbekanntmachung nach dem Umwandlungsgesetz 13.12.2024 (Eintragungsdatum)\n\nMalandus GmbH\nGesellschaft mit beschränkter Haftung\nBurgwedel\n\nDen Gläubigern der an der formwechselnden Umwandlung beteiligten Rechtsträger ist, wenn sie binnen sechs Monaten nach dem Tag, an dem die Eintragung der Umwandlung in das Register des Sitzes desjenigen Rechtsträgers, dessen Gläubiger sie sind, nach § 19 Abs. 3 UmwG als bekannt gemacht gilt, ihren Anspruch nach Grund und Höhe schriftlich anmelden, Sicherheit zu leisten, soweit sie nicht Befriedigung verlangen können. Dieses Recht steht den Gläubigern jedoch nur zu, wenn sie glaubhaft machen, dass durch die formwechselnde Umwandlung die Erfüllung der Forderung gefährdet wird."
    },
    {
      "date": "2024-12-13",
      "id": "96408",
      "original_text": "Löschungsankündigung\nNiedersachsen Amtsgericht Lüneburg HRB 120014 früher Amtsgericht Dannenberg (Elbe)\nHerz System- und Anlagentechnik GmbH – Zernien",
      "type": "Löschungsankündigung",
      "state": "Niedersachsen",
      "amtsgericht": "Amtsgericht Lüneburg",
      "registernummer": "HRB 120014",
      "registerart": "HRB",
      "company_name": "Herz System- und Anlagentechnik GmbH",
      "company_seat": "Zernien",
      "former_amtsgericht": "Dannenberg (Elbe)",
      "details": "13.12.2024 (Bekanntmachungsdatum)\n\nNiedersachsen Amtsgericht Lüneburg HRB 120014 früher Amtsgericht Dannenberg (Elbe)\nLöschungsankündigung\n\nHerz System- und Anlagentechnik GmbH\nGesellschaft mit beschränkter Haftung\nZernien\n\nDas Registergericht beabsichtigt, die Gesellschaft von Amts wegen nach § 394 FamFG zu löschen. Die Frist zur Erhebung eines Widerspruchs ist auf 1 Monat ab dieser Registerbekanntmachung festgesetzt."
    },
    {
      "date": "2024-12-13",
      "id": "96409",
      "original_text": "Registerbekanntmachung nach dem Umwandlungsgesetz\nNiedersachsen Amtsgericht Braunschweig HRB 211939\nAurato Holding GmbH – Hornburg",
      "type": "Registerbekanntmachung nach dem Umwandlungsgesetz",
      "state": "Niedersachsen",
      "amtsgericht": "Amtsgericht Braunschweig",
      "registernummer": "HRB 211939",
      "registerart": "HRB",
      "company_name": "Aurato Holding GmbH",
      "company_seat": "Hornburg",
      "details": "13.12.2024 (Bekanntmachungsdatum)\n\nNiedersachsen Amtsgericht Braunschweig HRB 211939\nRegisterbekanntmachung nach dem Umwandlungsgesetz 13.12.2024 (Eintragungsdatum)\n\nAurato Holding GmbH\nGesellschaft mit beschränkter Haftung\nHornburg\n\nDen Gläubigern der an der formwechselnden Umwandlung beteiligten Rechtsträger ist, wenn sie binnen sechs Monaten nach dem Tag, an dem die Eintragung der Umwandlung in das Register des Sitzes desjenigen Rechtsträgers, dessen Gläubiger sie sind, nach § 19 Abs. 3 UmwG als bekannt gemacht gilt, ihren Anspruch nach Grund und Höhe schriftlich anmelden, Sicherheit zu leisten, soweit sie nicht Befriedigung verlangen können. Dieses Recht steht den Gläubigern jedoch nur zu, wenn sie glaubhaft machen, dass durch die formwechselnde Umwandlung die Erfüllung der Forderung gefährdet wird."
    },
    {
      "date": "2024-12-13",
      "id": "96410",
      "original_text": "Registerbekanntmachung nach dem Umwandlungsgesetz\nNiedersachsen Amtsgericht Hannover HRA 206580\nMalva Verwaltung & Co. KG – Burgwedel",
      "type": "Registerbekanntmachung nach dem Umwandlungsgesetz",
      "state": "Niedersachsen",
      "amtsgericht": "Amtsgericht Hannover",
      "registernummer": "HRA 206580",
      "registerart": "HRA",
      "company_name": "Malva Verwaltung & Co. KG",
      "company_seat": "Burgwedel",
      "details": "13.12.2024 (Bekanntmachungsdatum)\n\nNiedersachsen Amtsgericht Hannover HRA 206580\nRegisterbekanntmachung nach dem Umwandlungsgesetz 13.12.2024 (Eintragungsdatum)\n\nMalva Verwaltung & Co. KG\nKommanditgesellschaft\nBurgwedel\n\nDen Gläubigern der an der formwechselnden Umwandlung beteiligten Rechtsträger ist, wenn sie binnen sechs Monaten nach dem Tag, an dem die Eintragung der Umwandlung in das Register des Sitzes desjenigen Rechtsträgers, dessen Gläubiger sie sind, nach § 19 Abs. 3 UmwG als bekannt gemacht gilt, ihren Anspruch nach Grund und Höhe schriftlich anmelden, Sicherheit zu leisten, soweit sie nicht Befriedigung verlangen können. Dieses Recht steht den Gläubigern jedoch nur zu, wenn sie glaubhaft machen, dass durch die formwechselnde Umwandlung die Erfüllung der Forderung gefährdet wird."
    },
    {
      "date": "2024-12-13",
      "id": "96411",
      "original_text": "Registerbekanntmachung nach dem Umwandlungsgesetz\nNiedersachsen Amtsgericht Osnabrück HRA 209252\nHysen Tishukaj e.K. – Twist",
      "type": "Registerbekanntmachung nach dem Umwandlungsgesetz",
      "state": "Niedersachsen",
      "amtsgericht": "Amtsgericht Osnabrück",
      "registernummer": "HRA 209252",
      "registerart": "HRA",
      "company_name": "Hysen Tishukaj e.K.",
      "company_seat": "Twist",
      "details": "13.12.2024 (Bekanntmachungsdatum)\n\nNiedersachsen Amtsgericht Osnabrück HRA 209252\nRegisterbekanntmachung nach dem Umwandlungsgesetz 13.12.2024 (Eintragungsdatum)\n\nHysen Tishukaj e.K.\nEinzelkaufmann / Einzelkauffrau\nTwist\n\nDen Gläubigern der an der Ausgliederung beteiligten Rechtsträger ist, wenn sie binnen sechs Monaten nach dem Tag, an dem die Eintragung der Ausgliederung in das Register des Sitzes desjenigen Rechtsträgers, dessen Gläubiger sie sind, nach § 19 Abs. 3 UmwG als bekannt gemacht gilt, ihren Anspruch nach Grund und Höhe schriftlich anmelden, Sicherheit zu leisten, soweit sie nicht Befriedigung verlangen können. Dieses Recht steht den Gläubigern jedoch nur zu, wenn sie glaubhaft machen, dass durch die Ausgliederung die Erfüllung der Forderung gefährdet wird."
    },
    {
      "date": "2024-12-13",
      "id": "96412",
      "original_text": "Einreichung neuer Dokumente\nNiedersachsen Amtsgericht Braunschweig HRB 207166\nIntelligence Unit Service AG – Braunschweig",
      "type": "Einreichung neuer Dokumente",
      "state": "Niedersachsen",
      "amtsgericht": "Amtsgericht Braunschweig",
      "registernummer": "HRB 207166",
      "registerart": "HRB",
      "company_name": "Intelligence Unit Service AG",
      "company_seat": "Braunschweig",
      "details": "13.12.2024 (Bekanntmachungsdatum)\n\nNiedersachsen Amtsgericht Braunschweig HRB 207166\nEinreichung neuer Dokumente 13.12.2024 (Eintragungsdatum)\n\nIntelligence Unit Service AG\nAktiengesellschaft\nBraunschweig\n\nDie Liste der Mitglieder des Aufsichtsrats wurde beim Registergericht eingereicht."
    },
    {
      "date": "2024-12-13",
      "id": "96413",
      "original_text": "Registerbekanntmachung nach dem Umwandlungsgesetz\nNiedersachsen Amtsgericht Braunschweig HRB 205775\nHBSN Health business services network - AG – Hornburg",
      "type": "Registerbekanntmachung nach dem Umwandlungsgesetz",
      "state": "Niedersachsen",
      "amtsgericht": "Amtsgericht Braunschweig",
      "registernummer": "HRB 205775",
      "registerart": "HRB",
      "company_name": "HBSN Health business services network - AG",
      "company_seat": "Hornburg",
      "details": "13.12.2024 (Bekanntmachungsdatum)\n\nNiedersachsen Amtsgericht Braunschweig HRB 205775\nRegisterbekanntmachung nach dem Umwandlungsgesetz 13.12.2024 (Eintragungsdatum)\n\nHBSN Health business services network - AG\nAktiengesellschaft\nHornburg\n\nDen Gläubigern der an der formwechselnden Umwandlung beteiligten Rechtsträger ist, wenn sie binnen sechs Monaten nach dem Tag, an dem die Eintragung der Umwandlung in das Register des Sitzes desjenigen Rechtsträgers, dessen Gläubiger sie sind, nach § 19 Abs. 3 UmwG als bekannt gemacht gilt, ihren Anspruch nach Grund und Höhe schriftlich anmelden, Sicherheit zu leisten, soweit sie nicht Befriedigung verlangen können. Dieses Recht steht den Gläubigern jedoch nur zu, wenn sie glaubhaft machen, dass durch die formwechselnde Umwandlung die Erfüllung der Forderung gefährdet wird."
    },
    {
      "date": "2024-12-13",
      "id": "96414",
      "original_text": "Löschungsankündigung\nNiedersachsen Amtsgericht Aurich HRB 205470\nMMXX NEY GmbH – Nordeney",
      "type": "Löschungsankündigung",
      "state": "Niedersachsen",
      "amtsgericht": "Amtsgericht Aurich",
      "registernummer": "HRB 205470",
      "registerart": "HRB",
      "company_name": "MMXX NEY GmbH",
      "company_seat": "Nordeney",
      "details": "13.12.2024 (Bekanntmachungsdatum)\n\nNiedersachsen Amtsgericht Aurich HRB 205470\nLöschungsankündigung 13.12.2024 (Eintragungsdatum)\n\nMMXX NEY GmbH\nGesellschaft mit beschränkter Haftung\nNordeney\n\nDas Registergericht beabsichtigt, die Gesellschaft von Amts wegen nach § 394 FamFG zu löschen. Die Frist zur Erhebung eines Widerspruchs ist auf 3 Monate ab dieser Registerbekanntmachung festgesetzt."
    },
    {
      "date": "2024-12-13",
      "id": "96415",
      "original_text": "Registerbekanntmachung nach dem Umwandlungsgesetz\nNiedersachsen Amtsgericht Osnabrück HRA 205874\nGROW Digital Group GmbH & Co. KG – Osnabrück",
      "type": "Registerbekanntmachung nach dem Umwandlungsgesetz",
      "state": "Niedersachsen",
      "amtsgericht": "Amtsgericht Osnabrück",
      "registernummer": "HRA 205874",
      "registerart": "HRA",
      "company_name": "GROW Digital Group GmbH & Co. KG",
      "company_seat": "Osnabrück",
      "details": "13.12.2024 (Bekanntmachungsdatum)\n\nNiedersachsen Amtsgericht Osnabrück HRA 205874\nRegisterbekanntmachung nach dem Umwandlungsgesetz 13.12.2024 (Eintragungsdatum)\n\nGROW Digital Group GmbH & Co. KG\nKommanditgesellschaft\nOsnabrück\n\nDen Gläubigern der an der Verschmelzung beteiligten Rechtsträger ist, wenn sie binnen sechs Monaten nach dem Tag, an dem die Eintragung der Verschmelzung in das Register des Sitzes desjenigen Rechtsträgers, dessen Gläubiger sie sind, nach § 19  Abs.  3 UmwG als bekannt gemacht gilt, ihren Anspruch nach Grund und Höhe schriftlich anmelden, Sicherheit zu leisten, soweit sie nicht Befriedigung verlangen können. Dieses Recht steht den Gläubigern jedoch nur zu, wenn sie glaubhaft machen, dass durch die Verschmelzung die Erfüllung der Forderung gefährdet wird."
    },
    {
      "date": "2024-12-13",
      "id": "96416",
      "original_text": "Löschungsankündigung\nBremen Amtsgericht Bremen HRB 36773\nRoja International UG (haftungsbeschränkt) – Bremen",
      "type": "Löschungsankündigung",
      "state": "Bremen",
      "amtsgericht": "Amtsgericht Bremen",
      "registernummer": "HRB 36773",
      "registerart": "HRB",
      "company_name": "Roja International UG (haftungsbeschränkt)",
      "company_seat": "Bremen",
      "details": "13.12.2024 (Bekanntmachungsdatum)\n\nBremen Amtsgericht Bremen HRB 36773\nLöschungsankündigung\n\nRoja International UG (haftungsbeschränkt)\nGesellschaft mit beschränkter Haftung\nBremen\n\nEs ist beabsichtigt die im Handelsregister eingetragene Gesellschaft von Amts wegen gemäß § 394 FamFG zu löschen. Gegen die Löschung kann beim AG Bremen schriftlich oder zu Protokoll der Geschäftsstelle Widerspruch eingelegt werden. Widerspruchsfrist 4 Wochen."
    },
    {
      "date": "2024-12-13",
      "id": "96417",
      "original_text": "Löschungsankündigung\nBremen Amtsgericht Bremen HRB 3228 BHV\nMöhring GmbH – Bremerhaven",
      "type": "Löschungsankündigung",
      "state": "Bremen",
      "amtsgericht": "Amtsgericht Bremen",
      "registernummer": "HRB 3228 BHV",
      "registerart": "HRB",
      "company_name": "Möhring GmbH",
      "company_seat": "Bremerhaven",
      "details": "13.12.2024 (Bekanntmachungsdatum)\n\nBremen Amtsgericht Bremen HRB 3228 BHV\nLöschungsankündigung\n\nMöhring GmbH\nGesellschaft mit beschränkter Haftung\nBremerhaven\n\nEs ist beabsichtigt die im Handelsregister eingetragene Gesellschaft von Amts wegen gemäß § 394 FamFG zu löschen. Gegen die Löschung kann beim AG Bremen schriftlich oder zu Protokoll der Geschäftsstelle Widerspruch eingelegt werden. Widerspruchsfrist 4 Wochen."
    },
    {
      "date": "2024-12-13",
      "id": "96418",
      "original_text": "Registerbekanntmachung nach dem Umwandlungsgesetz\nRheinland-Pfalz Amtsgericht Ludwigshafen a.Rhein (Ludwigshafen) HRB 69464\nWilli Walcher GmbH – Neustadt an der Weinstraße",
      "type": "Registerbekanntmachung nach dem Umwandlungsgesetz",
      "state": "Rheinland-Pfalz",
      "amtsgericht": "Amtsgericht Ludwigshafen a.Rhein (Ludwigshafen)",
      "registernummer": "HRB 69464",
      "registerart": "HRB",
      "company_name": "Willi Walcher GmbH",
      "company_seat": "Neustadt an der Weinstraße",
      "details": "13.12.2024 (Bekanntmachungsdatum)\n\nRheinland-Pfalz Amtsgericht Ludwigshafen a.Rhein (Ludwigshafen) HRB 69464\nRegisterbekanntmachung nach dem Umwandlungsgesetz 13.12.2024 (Eintragungsdatum)\n\nWilli Walcher GmbH\nGesellschaft mit beschränkter Haftung\nNeustadt an der Weinstraße\n\nAls nicht eingetragen wird veröffentlicht: Den Gläubigern der an der Ausgliederung beteiligten Rechtsträger ist, wenn sie binnen sechs Monaten nach dem Tag, an dem die Eintragung der Ausgliederung in das Register des Sitzes desjenigen Rechtsträgers, dessen Gläubiger sie sind, nach § 19 Abs. 3 UmwG als bekannt gemacht gilt, ihren Anspruch nach Grund und Höhe schriftlich anmelden, Sicherheit zu leisten, soweit sie nicht Befriedigung verlangen können. Dieses Recht steht den Gläubigern jedoch nur zu, wenn sie glaubhaft machen, dass durch die Ausgliederung die Erfüllung der Forderung gefährdet wird."
    },
    {
      "date": "2024-12-13",
      "id": "96419",
      "original_text": "Registerbekanntmachung nach dem Umwandlungsgesetz\nRheinland-Pfalz Amtsgericht Ludwigshafen a.Rhein (Ludwigshafen) HRA 61856\nWilli Walcher Erd- und Abbrucharbeiten, Agrartechnisches Lohnunternehmen e.K. – Neustadt an der Weinstraße",
      "type": "Registerbekanntmachung nach dem Umwandlungsgesetz",
      "state": "Rheinland-Pfalz",
      "amtsgericht": "Amtsgericht Ludwigshafen a.Rhein (Ludwigshafen)",
      "registernummer": "HRA 61856",
      "registerart": "HRA",
      "company_name": "Willi Walcher Erd- und Abbrucharbeiten, Agrartechnisches Lohnunternehmen e.K.",
      "company_seat": "Neustadt an der Weinstraße",
      "details": "13.12.2024 (Bekanntmachungsdatum)\n\nRheinland-Pfalz Amtsgericht Ludwigshafen a.Rhein (Ludwigshafen) HRA 61856\nRegisterbekanntmachung nach dem Umwandlungsgesetz 13.12.2024 (Eintragungsdatum)\n\nWilli Walcher Erd- und Abbrucharbeiten, Agrartechnisches Lohnunternehmen e.K.\nEinzelkaufmann / Einzelkauffrau\nNeustadt an der Weinstraße\n\nAls nicht eingetragen wird veröffentlicht: Den Gläubigern der an der Ausgliederung beteiligten Rechtsträger ist, wenn sie binnen sechs Monaten nach dem Tag, an dem die Eintragung der Ausgliederung in das Register des Sitzes desjenigen Rechtsträgers, dessen Gläubiger sie sind, nach § 19 Abs. 3 UmwG als bekannt gemacht gilt, ihren Anspruch nach Grund und Höhe schriftlich anmelden, Sicherheit zu leisten, soweit sie nicht Befriedigung verlangen können. Dieses Recht steht den Gläubigern jedoch nur zu, wenn sie glaubhaft machen, dass durch die Ausgliederung die Erfüllung der Forderung gefährdet wird."
    },
    {
      "date": "2024-12-13",
      "id": "96420",
      "original_text": "Löschungsankündigung\nRheinland-Pfalz Amtsgericht Mainz HRB 52255\nNT Dienstleistungen UG (haftungsbeschränkt) – Worms",
      "type": "Löschungsankündigung",
      "state": "Rheinland-Pfalz",
      "amtsgericht": "Amtsgericht Mainz",
      "registernummer": "HRB 52255",
      "registerart": "HRB",
      "company_name": "NT Dienstleistungen UG (haftungsbeschränkt)",
      "company_seat": "Worms",
      "details": "13.12.2024 (Bekanntmachungsdatum)\n\nRheinland-Pfalz Amtsgericht Mainz HRB 52255\nLöschungsankündigung\n\nNT Dienstleistungen UG (haftungsbeschränkt)\nGesellschaft mit beschränkter Haftung\nWorms\n\nDas Registergericht beabsichtigt die Gesellschaft von Amts wegen nach § 394 FamFG zu löschen. Die Frist zur Erhebung eines Widerspruchs ist auf einen Monat festgesetzt."
    },
    {
      "date": "2024-12-13",
      "id": "96421",
      "original_text": "Registerbekanntmachung nach dem Umwandlungsgesetz\nRheinland-Pfalz Amtsgericht Bad Kreuznach HRA 11401\nHartsteinwerk Gerach Bernhard GmbH & Co. KG – Gerach",
      "type": "Registerbekanntmachung nach dem Umwandlungsgesetz",
      "state": "Rheinland-Pfalz",
      "amtsgericht": "Amtsgericht Bad Kreuznach",
      "registernummer": "HRA 11401",
      "registerart": "HRA",
      "company_name": "Hartsteinwerk Gerach Bernhard GmbH & Co. KG",
      "company_seat": "Gerach",
      "details": "13.12.2024 (Bekanntmachungsdatum)\n\nRheinland-Pfalz Amtsgericht Bad Kreuznach HRA 11401\nRegisterbekanntmachung nach dem Umwandlungsgesetz 13.12.2024 (Eintragungsdatum)\n\nHartsteinwerk Gerach Bernhard GmbH & Co. KG\nKommanditgesellschaft\nGerach\n\nAls nicht eingetragen wird veröffentlicht: Den Gläubigern der an der Verschmelzung beteiligten Rechtsträger ist, wenn sie binnen sechs Monaten nach dem Tag, an dem die Eintragung der Verschmelzung in das Register des Sitzes desjenigen Rechtsträgers, dessen Gläubiger sie sind, nach § 19 Abs. 3 UmwG als bekannt gemacht gilt, ihren Anspruch nach Grund und Höhe schriftlich anmelden, Sicherheit zu leisten, soweit sie nicht Befriedigung verlangen können. Dieses Recht steht den Gläubigern jedoch nur zu, wenn sie glaubhaft machen, dass durch die Verschmelzung die Erfüllung der Forderung gefährdet wird."
    },
    {
      "date": "2024-12-13",
      "id": "96422",
      "original_text": "Registerbekanntmachung nach dem Umwandlungsgesetz\nNordrhein-Westfalen Amtsgericht Siegen HRB 5277\nETANCO GmbH – Wilnsdorf",
      "type": "Registerbekanntmachung nach dem Umwandlungsgesetz",
      "state": "Nordrhein-Westfalen",
      "amtsgericht": "Amtsgericht Siegen",
      "registernummer": "HRB 5277",
      "registerart": "HRB",
      "company_name": "ETANCO GmbH",
      "company_seat": "Wilnsdorf",
      "details": "13.12.2024 (Bekanntmachungsdatum)\n\nNordrhein-Westfalen Amtsgericht Siegen HRB 5277\nRegisterbekanntmachung nach dem Umwandlungsgesetz 13.12.2024 (Eintragungsdatum)\n\nETANCO GmbH\nGesellschaft mit beschränkter Haftung\nWilnsdorf\n\nDen Gläubigern der an der Verschmelzung beteiligten Rechtsträger ist, wenn sie binnen sechs Monaten nach dem Tag, an dem die Eintragung der Verschmelzung in das Register des Sitzes desjenigen Rechtsträgers, dessen Gläubiger sie sind, nach § 19 Absatz 3 UmwG als bekanntgemacht gilt, ihren Anspruch nach Grund und Höhe schriftlich anmelden, Sicherheit zu leisten, soweit sie nicht Befriedigung verlangen können. Dieses Recht steht den Gläubigern jedoch nur zu, wenn sie glaubhaft machen, dass durch die Verschmelzung die Erfüllung ihrer Forderung gefährdet wird."
    },
    {
      "date": "2024-12-13",
      "id": "96423",
      "original_text": "Sonstige Registerbekanntmachung\nNordrhein-Westfalen Amtsgericht Düsseldorf HRB 81666\nCENTRUM Berlin, Büro-Beteiligungs GmbH – Düsseldorf",
      "type": "Sonstige Registerbekanntmachung",
      "state": "Nordrhein-Westfalen",
      "amtsgericht": "Amtsgericht Düsseldorf",
      "registernummer": "HRB 81666",
      "registerart": "HRB",
      "company_name": "CENTRUM Berlin, Büro-Beteiligungs GmbH",
      "company_seat": "Düsseldorf",
      "details": "13.12.2024 (Bekanntmachungsdatum)\n\nNordrhein-Westfalen Amtsgericht Düsseldorf HRB 81666\nSonstige Registerbekanntmachung 13.12.2024 (Eintragungsdatum)\n\nCENTRUM Berlin, Büro-Beteiligungs GmbH\nGesellschaft mit beschränkter Haftung\nDüsseldorf\n\nDie Gesellschaft ist aufgelöst. Von Amts wegen eingetragen."
    },
    {
      "date": "2024-12-13",
      "id": "96424",
      "original_text": "Einreichung neuer Dokumente\nNordrhein-Westfalen Amtsgericht Düsseldorf HRB 63453\nAdecco Personaldienstleistungen GmbH – Düsseldorf",
      "type": "Einreichung neuer Dokumente",
      "state": "Nordrhein-Westfalen",
      "amtsgericht": "Amtsgericht Düsseldorf",
      "registernummer": "HRB 63453",
      "registerart": "HRB",
      "company_name": "Adecco Personaldienstleistungen GmbH",
      "company_seat": "Düsseldorf",
      "details": "13.12.2024 (Bekanntmachungsdatum)\n\nNordrhein-Westfalen Amtsgericht Düsseldorf HRB 63453\nEinreichung neuer Dokumente\n\nAdecco Personaldienstleistungen GmbH\nGesellschaft mit beschränkter Haftung\nDüsseldorf\n\nDem Registergericht ist eine Liste der Mitglieder des Aufsichtsrates eingereicht worden."
    },
    {
      "date": "2024-12-13",
      "id": "96425",
      "original_text": "Einreichung neuer Dokumente\nNordrhein-Westfalen Amtsgericht Iserlohn HRB 5014\nKunststoff-Institut für die mittelständische Wirtschaft NRW GmbH (KIMW NRW GmbH) – Lüdenscheid",
      "type": "Einreichung neuer Dokumente",
      "state": "Nordrhein-Westfalen",
      "amtsgericht": "Amtsgericht Iserlohn",
      "registernummer": "HRB 5014",
      "registerart": "HRB",
      "company_name": "Kunststoff-Institut für die mittelständische Wirtschaft NRW GmbH (KIMW NRW GmbH)",
      "company_seat": "Lüdenscheid",
      "details": "13.12.2024 (Bekanntmachungsdatum)\n\nNordrhein-Westfalen Amtsgericht Iserlohn HRB 5014\nEinreichung neuer Dokumente\n\nKunststoff-Institut für die mittelständische Wirtschaft NRW GmbH (KIMW NRW GmbH)\nGesellschaft mit beschränkter Haftung\nLüdenscheid\n\nDem Registergericht ist eine Liste der Mitglieder des Aufsichtsrates eingereicht worden."
    },
    {
      "date": "2024-12-13",
      "id": "96426",
      "original_text": "Registerbekanntmachung nach dem Umwandlungsgesetz\nNordrhein-Westfalen Amtsgericht Düsseldorf HRB 69780\nRefondo Holding GmbH – Düsseldorf",
      "type": "Registerbekanntmachung nach dem Umwandlungsgesetz",
      "state": "Nordrhein-Westfalen",
      "amtsgericht": "Amtsgericht Düsseldorf",
      "registernummer": "HRB 69780",
      "registerart": "HRB",
      "company_name": "Refondo Holding GmbH",
      "company_seat": "Düsseldorf",
      "details": "13.12.2024 (Bekanntmachungsdatum)\n\nNordrhein-Westfalen Amtsgericht Düsseldorf HRB 69780\nRegisterbekanntmachung nach dem Umwandlungsgesetz 13.12.2024 (Eintragungsdatum)\n\nRefondo Holding GmbH\nGesellschaft mit beschränkter Haftung\nDüsseldorf\n\nDen Gläubigern der an der Verschmelzung beteiligten Rechtsträger ist, wenn sie binnen sechs Monaten nach dem Tag, an dem die Eintragung der Verschmelzung in das Register des Sitzes desjenigen Rechtsträgers, dessen Gläubiger sie sind, nach § 19 Absatz 3 UmwG als bekanntgemacht gilt, ihren Anspruch nach Grund und Höhe schriftlich anmelden, Sicherheit zu leisten, soweit sie nicht Befriedigung verlangen können. Dieses Recht steht den Gläubigern jedoch nur zu, wenn sie glaubhaft machen, dass durch die Verschmelzung die Erfüllung ihrer Forderung gefährdet wird."
    },
    {
      "date": "2024-12-13",
      "id": "96427",
      "original_text": "Löschungsankündigung\nNordrhein-Westfalen Amtsgericht Iserlohn HRB 9810\nTBS - Technischer Bauservice UG (haftungsbeschränkt) – Lüdenscheid",
      "type": "Löschungsankündigung",
      "state": "Nordrhein-Westfalen",
      "amtsgericht": "Amtsgericht Iserlohn",
      "registernummer": "HRB 9810",
      "registerart": "HRB",
      "company_name": "TBS - Technischer Bauservice UG (haftungsbeschränkt)",
      "company_seat": "Lüdenscheid",
      "details": "13.12.2024 (Bekanntmachungsdatum)\n\nNordrhein-Westfalen Amtsgericht Iserlohn HRB 9810\nLöschungsankündigung 02.12.2024 (Eintragungsdatum)\n\nTBS - Technischer Bauservice UG (haftungsbeschränkt)\nGesellschaft mit beschränkter Haftung\nLüdenscheid\n\nHRB 9810:\nTBS - Technischer Bauservice UG (haftungsbeschränkt), Lüdenscheid\n\nDas Registergericht beabsichtigt die im Handelsregister eingetragene Gesellschaft gemäß § 394 Absatz 1 FamFG wegen Vermögenslosigkeit von Amts wegen zu löschen. Gegen diese Verfügung kann Widerspruch eingelegt werden. Die Frist zur Erhebung eines Widerspruchs gegen die beabsichtigte Löschung von Amts wegen ist auf zwei Monate festgesetzt.\n\nRechtsbehelfsbelehrung:\n\nGegen diese Verfügung können Sie Widerspruch einlegen.\nDer Widerspruch ist bei dem Amtsgericht Iserlohn, Friedrichstraße 108-110, 58636 Iserlohn schriftlich in deutscher Sprache oder zur Niederschrift der Geschäftsstelle einzulegen. Der Widerspruch kann auch zur Niederschrift der Geschäftsstelle eines jeden Amtsgerichtes abgegeben werden.\nDer Widerspruch muss spätestens innerhalb der gesetzten Frist bei dem Amtsgericht Iserlohn eingegangen sein. Dies gilt auch dann, wenn der Widerspruch zur Niederschrift der Geschäftsstelle eines anderen Amtsgerichtes abgegeben wurde. Die Frist beginnt mit der Veröffentlichung. Fällt das Ende der Frist auf einen Sonntag, einen allgemeinen Feiertag oder Sonnabend, so endet die Frist mit Ablauf des nächsten Werktages.\nDer Widerspruch muss die Bezeichnung der angefochtenen Verfügung sowie die Erklärung enthalten, dass Widerspruch gegen diese Verfügung eingelegt wird. Er ist zu unterzeichnen und soll begründet werden."
    },
    {
      "date": "2024-12-13",
      "id": "96428",
      "original_text": "Registerbekanntmachung nach dem Umwandlungsgesetz\nNordrhein-Westfalen Amtsgericht Düsseldorf HRB 75970\nmfi Immobilien Marketing GmbH – Düsseldorf",
      "type": "Registerbekanntmachung nach dem Umwandlungsgesetz",
      "state": "Nordrhein-Westfalen",
      "amtsgericht": "Amtsgericht Düsseldorf",
      "registernummer": "HRB 75970",
      "registerart": "HRB",
      "company_name": "mfi Immobilien Marketing GmbH",
      "company_seat": "Düsseldorf",
      "details": "13.12.2024 (Bekanntmachungsdatum)\n\nNordrhein-Westfalen Amtsgericht Düsseldorf HRB 75970\nRegisterbekanntmachung nach dem Umwandlungsgesetz 13.12.2024 (Eintragungsdatum)\n\nmfi Immobilien Marketing GmbH\nGesellschaft mit beschränkter Haftung\nDüsseldorf\n\nDen Gläubigern der an der Abspaltung beteiligten Rechtsträger ist, wenn sie binnen sechs Monaten nach dem Tag, an dem die Eintragung der Abspaltung in das Register des Sitzes desjenigen Rechtsträgers, dessen Gläubiger sie sind, nach § 19 Absatz 3 UmwG als bekanntgemacht gilt, ihren Anspruch nach Grund und Höhe schriftlich anmelden, Sicherheit zu leisten, soweit sie nicht Befriedigung verlangen können. Dieses Recht steht den Gläubigern jedoch nur zu, wenn sie glaubhaft machen, dass durch die Abspaltung die Erfüllung ihrer Forderung gefährdet wird."
    },
    {
      "date": "2024-12-13",
      "id": "96429",
      "original_text": "Registerbekanntmachung nach dem Umwandlungsgesetz\nNordrhein-Westfalen Amtsgericht Düsseldorf HRB 26838\nECOVIS KSO Treuhandgesellschaft mbH Steuerberatungsgesellschaft – Düsseldorf",
      "type": "Registerbekanntmachung nach dem Umwandlungsgesetz",
      "state": "Nordrhein-Westfalen",
      "amtsgericht": "Amtsgericht Düsseldorf",
      "registernummer": "HRB 26838",
      "registerart": "HRB",
      "company_name": "ECOVIS KSO Treuhandgesellschaft mbH Steuerberatungsgesellschaft",
      "company_seat": "Düsseldorf",
      "details": "13.12.2024 (Bekanntmachungsdatum)\n\nNordrhein-Westfalen Amtsgericht Düsseldorf HRB 26838\nRegisterbekanntmachung nach dem Umwandlungsgesetz 13.12.2024 (Eintragungsdatum)\n\nECOVIS KSO Treuhandgesellschaft mbH Steuerberatungsgesellschaft\nGesellschaft mit beschränkter Haftung\nDüsseldorf\n\nDen Gläubigern der an der Verschmelzung beteiligten Rechtsträger ist, wenn sie binnen sechs Monaten nach dem Tag, an dem die Eintragung der Verschmelzung in das Register des Sitzes desjenigen Rechtsträgers, dessen Gläubiger sie sind, nach § 19 Absatz 3 UmwG als bekanntgemacht gilt, ihren Anspruch nach Grund und Höhe schriftlich anmelden, Sicherheit zu leisten, soweit sie nicht Befriedigung verlangen können. Dieses Recht steht den Gläubigern jedoch nur zu, wenn sie glaubhaft machen, dass durch die Verschmelzung die Erfüllung ihrer Forderung gefährdet wird."
    },
    {
      "date": "2024-12-13",
      "id": "96430",
      "original_text": "Löschungsankündigung\nNordrhein-Westfalen Amtsgericht Düsseldorf HRB 71748\nNUSS GmbH – Düsseldorf",
      "type": "Löschungsankündigung",
      "state": "Nordrhein-Westfalen",
      "amtsgericht": "Amtsgericht Düsseldorf",
      "registernummer": "HRB 71748",
      "registerart": "HRB",
      "company_name": "NUSS GmbH",
      "company_seat": "Düsseldorf",
      "details": "13.12.2024 (Bekanntmachungsdatum)\n\nNordrhein-Westfalen Amtsgericht Düsseldorf HRB 71748\nLöschungsankündigung\n\nNUSS GmbH\nGesellschaft mit beschränkter Haftung\nDüsseldorf\n\nDas Registergericht beabsichtigt die Gesellschaft von Amts wegen nach § 394 FamFG zu löschen. Die Frist zur Erhebung eines Widerspruchs ist auf 3 Wochen festgesetzt.\n\nRechtsbehelfsbelehrung:\nDas Widerspruchsrecht steht jedem zu, der an der Unterlassung der Löschung ein berechtigtes Interesse hat. Der Widerspruch ist bei dem Amtsgericht Düsseldorf -Registergericht-, Werdener Straße 1, 40227 Düsseldorf schriftlich in deutscher Sprache oder zur Niederschrift der Geschäftsstelle einzulegen. Der Widerspruch kann auch zur Niederschrift der Geschäftsstelle eines jeden Amtsgerichtes abgegeben werden. Die Einlegung ist auch durch Übertragung eines elektronischen Dokuments an die elektronische Poststelle des Gerichts möglich. Das elektronische Dokument muss für die Bearbeitung durch das Gericht geeignet und mit einer qualifizierten elektronischen Signatur der verantwortenden Person versehen sein oder von der verantwortenden Person signiert und auf einem sicheren Übermittlungsweg gemäß § 130a ZPO nach näherer Maßgabe der Verordnung über die technischen Rahmenbedingungen des elektronischen Rechtsverkehrs und über das besondere elektronische Behördenpostfach (BGBl. I, S.3803) eingereicht werden. Weitere Informationen erhalten Sie auf der Internetseite www.justiz.de.\nDer Widerspruch muss spätestens innerhalb der gesetzten Frist nach dem Datum der Bekanntmachung der Löschungsankündigung bei dem Amtsgericht - Registergericht - Düsseldorf eingegangen sein.  Dies gilt auch dann, wenn der Widerspruch zur Niederschrift der Geschäftsstelle eines anderen Amtsgerichtes abgegeben wurde. Die Frist beginnt mit dem Tage der Bekanntmachung der Löschungsankündigung in dem für die Bekanntmachung der Eintragungen in das Handelsregister bestimmten elektronischen Informations- und Kommunikationssystem nach § 10 des Handelsgesetzbuches. Fällt das Ende der Frist auf einen Sonntag, einen allgemeinen Feiertag oder Sonnabend, so endet die Frist mit Ablauf des nächsten Werktages.\nDer Widerspruch muss die Bezeichnung der angefochtenen Löschungsankündigung sowie die Erklärung enthalten, dass Widerspruch gegen diese Löschungsankündigung eingelegt wird. Er ist zu unterzeichnen und soll begründet werden."
    },
    {
      "date": "2024-12-13",
      "id": "96431",
      "original_text": "Einreichung neuer Dokumente\nNordrhein-Westfalen Amtsgericht Duisburg HRB 1531\nDuisburger Werkstatt für Menschen mit Behinderung gemeinnnützige GmbH – Duisburg",
      "type": "Einreichung neuer Dokumente",
      "state": "Nordrhein-Westfalen",
      "amtsgericht": "Amtsgericht Duisburg",
      "registernummer": "HRB 1531",
      "registerart": "HRB",
      "company_name": "Duisburger Werkstatt für Menschen mit Behinderung gemeinnnützige GmbH",
      "company_seat": "Duisburg",
      "details": "13.12.2024 (Bekanntmachungsdatum)\n\nNordrhein-Westfalen Amtsgericht Duisburg HRB 1531\nEinreichung neuer Dokumente\n\nDuisburger Werkstatt für Menschen mit Behinderung gemeinnnützige GmbH\nGesellschaft mit beschränkter Haftung\nDuisburg\n\nDem Registergericht ist eine Liste der Mitglieder des Aufsichtsrates eingereicht worden."
    },
    {
      "date": "2024-12-13",
      "id": "96432",
      "original_text": "Registerbekanntmachung nach dem Umwandlungsgesetz\nNordrhein-Westfalen Amtsgericht Bad Oeynhausen HRB 8460\nWittemöller Energieservice GmbH – Lübbecke",
      "type": "Registerbekanntmachung nach dem Umwandlungsgesetz",
      "state": "Nordrhein-Westfalen",
      "amtsgericht": "Amtsgericht Bad Oeynhausen",
      "registernummer": "HRB 8460",
      "registerart": "HRB",
      "company_name": "Wittemöller Energieservice GmbH",
      "company_seat": "Lübbecke",
      "details": "13.12.2024 (Bekanntmachungsdatum)\n\nNordrhein-Westfalen Amtsgericht Bad Oeynhausen HRB 8460\nRegisterbekanntmachung nach dem Umwandlungsgesetz 13.12.2024 (Eintragungsdatum)\n\nWittemöller Energieservice GmbH\nGesellschaft mit beschränkter Haftung\nLübbecke\n\nDen Gläubigern der an der Verschmelzung beteiligten Rechtsträger ist, wenn sie binnen sechs Monaten nach dem Tag, an dem die Eintragung der Verschmelzung in das Register des Sitzes desjenigen Rechtsträgers, dessen Gläubiger sie sind, nach § 19 Absatz 3 UmwG als bekanntgemacht gilt, ihren Anspruch nach Grund und Höhe schriftlich anmelden, Sicherheit zu leisten, soweit sie nicht Befriedigung verlangen können. Dieses Recht steht den Gläubigern jedoch nur zu, wenn sie glaubhaft machen, dass durch die Verschmelzung die Erfüllung ihrer Forderung gefährdet wird."
    },
    {
      "date": "2024-12-13",
      "id": "96433",
      "original_text": "Registerbekanntmachung nach dem Umwandlungsgesetz\nNordrhein-Westfalen Amtsgericht Paderborn HRA 8763\nBrand Holding GmbH & Co. KG – Paderborn",
      "type": "Registerbekanntmachung nach dem Umwandlungsgesetz",
      "state": "Nordrhein-Westfalen",
      "amtsgericht": "Amtsgericht Paderborn",
      "registernummer": "HRA 8763",
      "registerart": "HRA",
      "company_name": "Brand Holding GmbH & Co. KG",
      "company_seat": "Paderborn",
      "details": "13.12.2024 (Bekanntmachungsdatum)\n\nNordrhein-Westfalen Amtsgericht Paderborn HRA 8763\nRegisterbekanntmachung nach dem Umwandlungsgesetz 13.12.2024 (Eintragungsdatum)\n\nBrand Holding GmbH & Co. KG\nKommanditgesellschaft\nPaderborn\n\nDen Gläubigern der an der Ausgliederung beteiligten Rechtsträger ist, wenn sie binnen sechs Monaten nach dem Tag, an dem die Eintragung der Ausgliederung in das Register des Sitzes desjenigen Rechtsträgers, dessen Gläubiger sie sind, nach § 19 Absatz 3 UmwG als bekanntgemacht gilt, ihren Anspruch nach Grund und Höhe schriftlich anmelden, Sicherheit zu leisten, soweit sie nicht Befriedigung verlangen können. Dieses Recht steht den Gläubigern jedoch nur zu, wenn sie glaubhaft machen, dass durch die Ausgliederung die Erfüllung ihrer Forderung gefährdet wird."
    },
    {
      "date": "2024-12-13",
      "id": "96434",
      "original_text": "Registerbekanntmachung nach dem Umwandlungsgesetz\nNordrhein-Westfalen Amtsgericht Bad Oeynhausen HRB 5691\nHempelmann Wittemöller GmbH – Hiddenhausen",
      "type": "Registerbekanntmachung nach dem Umwandlungsgesetz",
      "state": "Nordrhein-Westfalen",
      "amtsgericht": "Amtsgericht Bad Oeynhausen",
      "registernummer": "HRB 5691",
      "registerart": "HRB",
      "company_name": "Hempelmann Wittemöller GmbH",
      "company_seat": "Hiddenhausen",
      "details": "13.12.2024 (Bekanntmachungsdatum)\n\nNordrhein-Westfalen Amtsgericht Bad Oeynhausen HRB 5691\nRegisterbekanntmachung nach dem Umwandlungsgesetz 13.12.2024 (Eintragungsdatum)\n\nHempelmann Wittemöller GmbH\nGesellschaft mit beschränkter Haftung\nHiddenhausen\n\nDen Gläubigern der an der Verschmelzung beteiligten Rechtsträger ist, wenn sie binnen sechs Monaten nach dem Tag, an dem die Eintragung der Verschmelzung in das Register des Sitzes desjenigen Rechtsträgers, dessen Gläubiger sie sind, nach § 19 Absatz 3 UmwG als bekanntgemacht gilt, ihren Anspruch nach Grund und Höhe schriftlich anmelden, Sicherheit zu leisten, soweit sie nicht Befriedigung verlangen können. Dieses Recht steht den Gläubigern jedoch nur zu, wenn sie glaubhaft machen, dass durch die Verschmelzung die Erfüllung ihrer Forderung gefährdet wird."
    },
    {
      "date": "2024-12-13",
      "id": "96435",
      "original_text": "Einreichung neuer Dokumente\nNordrhein-Westfalen Amtsgericht Essen HRB 36278\nifm group se – Essen",
      "type": "Einreichung neuer Dokumente",
      "state": "Nordrhein-Westfalen",
      "amtsgericht": "Amtsgericht Essen",
      "registernummer": "HRB 36278",
      "registerart": "HRB",
      "company_name": "ifm group se",
      "company_seat": "Essen",
      "details": "13.12.2024 (Bekanntmachungsdatum)\n\nNordrhein-Westfalen Amtsgericht Essen HRB 36278\nEinreichung neuer Dokumente 13.12.2024 (Eintragungsdatum)\n\nifm group se\nEuropäische Aktiengesellschaft (SE)\nEssen\n\nDem Registergericht ist eine neue Liste der Mitglieder des Aufsichtsrates eingereicht worden."
    },
    {
      "date": "2024-12-13",
      "id": "96436",
      "original_text": "Registerbekanntmachung nach dem Umwandlungsgesetz\nNordrhein-Westfalen Amtsgericht Bad Oeynhausen HRB 13486\nJAKA-BKL GmbH – Stemwede",
      "type": "Registerbekanntmachung nach dem Umwandlungsgesetz",
      "state": "Nordrhein-Westfalen",
      "amtsgericht": "Amtsgericht Bad Oeynhausen",
      "registernummer": "HRB 13486",
      "registerart": "HRB",
      "company_name": "JAKA-BKL GmbH",
      "company_seat": "Stemwede",
      "details": "13.12.2024 (Bekanntmachungsdatum)\n\nNordrhein-Westfalen Amtsgericht Bad Oeynhausen HRB 13486\nRegisterbekanntmachung nach dem Umwandlungsgesetz 13.12.2024 (Eintragungsdatum)\n\nJAKA-BKL GmbH\nGesellschaft mit beschränkter Haftung\nStemwede\n\nDen Gläubigern der an der Verschmelzung beteiligten Rechtsträger ist, wenn sie binnen sechs Monaten nach dem Tag, an dem die Eintragung der Verschmelzung in das Register des Sitzes desjenigen Rechtsträgers, dessen Gläubiger sie sind, nach § 19 Absatz 3 UmwG als bekanntgemacht gilt, ihren Anspruch nach Grund und Höhe schriftlich anmelden, Sicherheit zu leisten, soweit sie nicht Befriedigung verlangen können. Dieses Recht steht den Gläubigern jedoch nur zu, wenn sie glaubhaft machen, dass durch die Verschmelzung die Erfüllung ihrer Forderung gefährdet wird."
    },
    {
      "date": "2024-12-13",
      "id": "96437",
      "original_text": "Registerbekanntmachung nach dem Umwandlungsgesetz\nNordrhein-Westfalen Amtsgericht Köln HRB 119057\nZOLL Ventilation Deutschland GmbH – Köln",
      "type": "Registerbekanntmachung nach dem Umwandlungsgesetz",
      "state": "Nordrhein-Westfalen",
      "amtsgericht": "Amtsgericht Köln",
      "registernummer": "HRB 119057",
      "registerart": "HRB",
      "company_name": "ZOLL Ventilation Deutschland GmbH",
      "company_seat": "Köln",
      "details": "13.12.2024 (Bekanntmachungsdatum)\n\nNordrhein-Westfalen Amtsgericht Köln HRB 119057\nRegisterbekanntmachung nach dem Umwandlungsgesetz 13.12.2024 (Eintragungsdatum)\n\nZOLL Ventilation Deutschland GmbH\nGesellschaft mit beschränkter Haftung\nKöln\n\nDen Gläubigern der an der Verschmelzung beteiligten Rechtsträger ist, wenn sie binnen sechs Monaten nach dem Tag, an dem die Eintragung der Verschmelzung in das Register des Sitzes desjenigen Rechtsträgers, dessen Gläubiger sie sind, nach § 19 Absatz 3 UmwG als bekanntgemacht gilt, ihren Anspruch nach Grund und Höhe schriftlich anmelden, Sicherheit zu leisten, soweit sie nicht Befriedigung verlangen können. Dieses Recht steht den Gläubigern jedoch nur zu, wenn sie glaubhaft machen, dass durch die Verschmelzung die Erfüllung ihrer Forderung gefährdet wird."
    },
    {
      "date": "2024-12-13",
      "id": "96438",
      "original_text": "Löschungsankündigung\nNordrhein-Westfalen Amtsgericht Aachen HRB 9847\nPerpetuum Energie GmbH – Selfkant",
      "type": "Löschungsankündigung",
      "state": "Nordrhein-Westfalen",
      "amtsgericht": "Amtsgericht Aachen",
      "registernummer": "HRB 9847",
      "registerart": "HRB",
      "company_name": "Perpetuum Energie GmbH",
      "company_seat": "Selfkant",
      "details": "13.12.2024 (Bekanntmachungsdatum)\n\nNordrhein-Westfalen Amtsgericht Aachen HRB 9847\nLöschungsankündigung\n\nPerpetuum Energie GmbH\nGesellschaft mit beschränkter Haftung\nSelfkant\n\nDas Registergericht beabsichtigt, von Amts wegen die Gesellschaft wegen Vermögenslosigkeit nach § 394 FamFG zu löschen, weil das Insolvenzverfahren Amtsgericht Aachen (93 IN 120/24) beendet und Vermögen der Gesellschaft nicht mehr erkennbar ist.\nZur Geltendmachung des Widerspruchs gegen die beabsichtigte Löschung wird hiermit eine Frist von einem Monat ab Veröffentlichung dieser Ankündigung bestimmt.Rechtsbehelfsbelehrung: Gegen diese Verfügung kann Widerspruch eingelegt werden. Zum Widerspruch ist jeder berechtigt, der an der Unterlassung der Löschung ein berechtigtes Interesse hat.Der Widerspruch ist bei dem Amtsgericht Aachen, Adalbertsteinweg 92, 52070 Aachen schriftlich in deutscher Sprache oder zur Niederschrift der Geschäftsstelle einzulegen. Der Widerspruch kann auch zur Niederschrift der Geschäftsstelle eines jeden Amtsgerichtes abgegeben werden. Der Widerspruch muss spätestens innerhalb der gesetzten Frist nach der Bekanntgabe der Verfügung bei dem Amtsgericht Aachen eingegangen sein. Dies gilt auch dann, wenn der Widerspruch zur Niederschrift der Geschäftsstelle eines anderen Amtsgerichtes abgegeben wurde. Die Frist beginnt mit der Bekanntgabe der Verfügung durch Veröffentlichung. Fällt das Ende der Frist auf einen Sonntag, einen allgemeinen Feiertag oder Sonnabend, so endet die Frist mit Ablauf des nächsten Werktages. Der Widerspruch muss die Bezeichnung der angefochtenen Verfügung sowie die Erklärung enthalten, dass Widerspruch gegen diese Verfügung eingelegt wird. Er ist zu unterzeichnen und soll begründet werden.Die Einlegung ist auch durch Übertragung eines elektronischen Dokuments an die elektronische Poststelle des Gerichts möglich. Das elektronische Dokument muss für die Bearbeitung durch das Gericht geeignet und mit einer qualifizierten elektronischen Signatur der verantwortenden Person versehen sein oder von der verantwortenden Person signiert und auf einem sicheren Übermittlungsweg gemäß § 130 a ZPO nach näherer Maßgabe der Verordnung über die technischen Rahmenbedingungen des elektronischen Rechtsverkehrs und über das besondere elektronische Behördenpostfach (BGBl. I, S. 3803) eingereicht werden. Weitere Informationen erhalten Sie auf der Internetseite www.justiz.de."
    },
    {
      "date": "2024-12-13",
      "id": "96439",
      "original_text": "Registerbekanntmachung nach dem Umwandlungsgesetz\nNordrhein-Westfalen Amtsgericht Gütersloh HRB 13599\nMChef Hospitality Trailer GmbH – Gütersloh",
      "type": "Registerbekanntmachung nach dem Umwandlungsgesetz",
      "state": "Nordrhein-Westfalen",
      "amtsgericht": "Amtsgericht Gütersloh",
      "registernummer": "HRB 13599",
      "registerart": "HRB",
      "company_name": "MChef Hospitality Trailer GmbH",
      "company_seat": "Gütersloh",
      "details": "13.12.2024 (Bekanntmachungsdatum)\n\nNordrhein-Westfalen Amtsgericht Gütersloh HRB 13599\nRegisterbekanntmachung nach dem Umwandlungsgesetz 13.12.2024 (Eintragungsdatum)\n\nMChef Hospitality Trailer GmbH\nGesellschaft mit beschränkter Haftung\nGütersloh\n\nDen Gläubigern der an der Verschmelzung beteiligten Rechtsträger ist, wenn sie binnen sechs Monaten nach dem Tag, an dem die Eintragung der Verschmelzung in das Register des Sitzes desjenigen Rechtsträgers, dessen Gläubiger sie sind, nach § 19 Absatz 3 UmwG als bekanntgemacht gilt, ihren Anspruch nach Grund und Höhe schriftlich anmelden, Sicherheit zu leisten, soweit sie nicht Befriedigung verlangen können. Dieses Recht steht den Gläubigern jedoch nur zu, wenn sie glaubhaft machen, dass durch die Verschmelzung die Erfüllung ihrer Forderung gefährdet wird."
    },
    {
      "date": "2024-12-13",
      "id": "96440",
      "original_text": "Registerbekanntmachung nach dem Umwandlungsgesetz\nNordrhein-Westfalen Amtsgericht Düsseldorf HRB 75817\nUnibail-Rodamco Beteiligungs GmbH – Düsseldorf",
      "type": "Registerbekanntmachung nach dem Umwandlungsgesetz",
      "state": "Nordrhein-Westfalen",
      "amtsgericht": "Amtsgericht Düsseldorf",
      "registernummer": "HRB 75817",
      "registerart": "HRB",
      "company_name": "Unibail-Rodamco Beteiligungs GmbH",
      "company_seat": "Düsseldorf",
      "details": "13.12.2024 (Bekanntmachungsdatum)\n\nNordrhein-Westfalen Amtsgericht Düsseldorf HRB 75817\nRegisterbekanntmachung nach dem Umwandlungsgesetz 13.12.2024 (Eintragungsdatum)\n\nUnibail-Rodamco Beteiligungs GmbH\nGesellschaft mit beschränkter Haftung\nDüsseldorf\n\nDen Gläubigern der an der Verschmelzung beteiligten Rechtsträger ist, wenn sie binnen sechs Monaten nach dem Tag, an dem die Eintragung der Verschmelzung in das Register des Sitzes desjenigen Rechtsträgers, dessen Gläubiger sie sind, nach § 19 Absatz 3 UmwG als bekanntgemacht gilt, ihren Anspruch nach Grund und Höhe schriftlich anmelden, Sicherheit zu leisten, soweit sie nicht Befriedigung verlangen können. Dieses Recht steht den Gläubigern jedoch nur zu, wenn sie glaubhaft machen, dass durch die Verschmelzung die Erfüllung ihrer Forderung gefährdet wird."
    },
    {
      "date": "2024-12-13",
      "id": "96441",
      "original_text": "Löschungsankündigung\nNordrhein-Westfalen Amtsgericht Iserlohn HRB 7873\nHaCo-Handy & Co. GmbH – Iserlohn",
      "type": "Löschungsankündigung",
      "state": "Nordrhein-Westfalen",
      "amtsgericht": "Amtsgericht Iserlohn",
      "registernummer": "HRB 7873",
      "registerart": "HRB",
      "company_name": "HaCo-Handy & Co. GmbH",
      "company_seat": "Iserlohn",
      "details": "13.12.2024 (Bekanntmachungsdatum)\n\nNordrhein-Westfalen Amtsgericht Iserlohn HRB 7873\nLöschungsankündigung 06.12.2024 (Eintragungsdatum)\n\nHaCo-Handy & Co. GmbH\nGesellschaft mit beschränkter Haftung\nIserlohn\n\nHRB 7873:\nHaCo-Handy & Co. GmbH\nWermingser Straße 42\n58636 Iserlohn\n\nDas Registergericht beabsichtigt die im Handelsregister eingetragene Gesellschaft gemäß § 394 Absatz 1 FamFG wegen Vermögenslosigkeit von Amts wegen zu löschen. Gegen diese Verfügung kann Widerspruch eingelegt werden. Die Frist zur Erhebung eines Widerspruchs gegen die beabsichtigte Löschung von Amts wegen ist auf zwei Monate festgesetzt.\n\nRechtsbehelfsbelehrung:\n\nGegen diese Verfügung können Sie Widerspruch einlegen.\n\nDer Widerspruch ist bei dem Amtsgericht Iserlohn, Friedrichstraße 108-110, 58636 Iserlohn schriftlich in deutscher Sprache oder zur Niederschrift der Geschäftsstelle einzulegen. Der Widerspruch kann auch zur Niederschrift der Geschäftsstelle eines jeden Amtsgerichtes abgegeben werden.\n\nDer Widerspruch muss spätestens innerhalb der gesetzten Frist bei dem Amtsgericht Iserlohn eingegangen sein. Dies gilt auch dann, wenn der Widerspruch zur Niederschrift der Geschäftsstelle eines anderen Amtsgerichtes abgegeben wurde. Die Frist beginnt mit der Veröffentlichung. Fällt das Ende der Frist auf einen Sonntag, einen allgemeinen Feiertag oder Sonnabend, so endet die Frist mit Ablauf des nächsten Werktages.\n\nDer Widerspruch muss die Bezeichnung der angefochtenen Verfügung sowie die Erklärung enthalten, dass Widerspruch gegen diese Verfügung eingelegt wird. Er ist zu unterzeichnen und soll begründet werden."
    },
    {
      "date": "2024-12-13",
      "id": "96442",
      "original_text": "Registerbekanntmachung nach dem Umwandlungsgesetz\nNordrhein-Westfalen Amtsgericht Bad Oeynhausen HRB 19127\nMarlin Bad Verwaltungsgesellschaft mbH – Stemwede",
      "type": "Registerbekanntmachung nach dem Umwandlungsgesetz",
      "state": "Nordrhein-Westfalen",
      "amtsgericht": "Amtsgericht Bad Oeynhausen",
      "registernummer": "HRB 19127",
      "registerart": "HRB",
      "company_name": "Marlin Bad Verwaltungsgesellschaft mbH",
      "company_seat": "Stemwede",
      "details": "13.12.2024 (Bekanntmachungsdatum)\n\nNordrhein-Westfalen Amtsgericht Bad Oeynhausen HRB 19127\nRegisterbekanntmachung nach dem Umwandlungsgesetz 13.12.2024 (Eintragungsdatum)\n\nMarlin Bad Verwaltungsgesellschaft mbH\nGesellschaft mit beschränkter Haftung\nStemwede\n\nDen Gläubigern der an der Verschmelzung beteiligten Rechtsträger ist, wenn sie binnen sechs Monaten nach dem Tag, an dem die Eintragung der Verschmelzung in das Register des Sitzes desjenigen Rechtsträgers, dessen Gläubiger sie sind, nach § 19 Absatz 3 UmwG als bekanntgemacht gilt, ihren Anspruch nach Grund und Höhe schriftlich anmelden, Sicherheit zu leisten, soweit sie nicht Befriedigung verlangen können. Dieses Recht steht den Gläubigern jedoch nur zu, wenn sie glaubhaft machen, dass durch die Verschmelzung die Erfüllung ihrer Forderung gefährdet wird."
    },
    {
      "date": "2024-12-13",
      "id": "96443",
      "original_text": "Löschungsankündigung\nNordrhein-Westfalen Amtsgericht Gelsenkirchen HRB 17629\nKonzept Security GmbH – Gladbeck",
      "type": "Löschungsankündigung",
      "state": "Nordrhein-Westfalen",
      "amtsgericht": "Amtsgericht Gelsenkirchen",
      "registernummer": "HRB 17629",
      "registerart": "HRB",
      "company_name": "Konzept Security GmbH",
      "company_seat": "Gladbeck",
      "details": "13.12.2024 (Bekanntmachungsdatum)\n\nNordrhein-Westfalen Amtsgericht Gelsenkirchen HRB 17629\nLöschungsankündigung\n\nKonzept Security GmbH\nGesellschaft mit beschränkter Haftung\nGladbeck\n\nDas Gericht beabsichtigt, die Gesellschaft Konzept Security GmbH mit Sitz in Gladbeck, HRB 17629 Amtsgericht Gelsenkirchen, wegen Vermögenslosigkeit zu löschen.\n\nHiermit wird denjenigen, die an der Unterlassung der Löschung ein berechtigtes Interesse haben, gem. § 394 Abs. 2 FamFG Gelegenheit gegeben, gegen dieses Vorhaben binnen eines Monats nach dieser Bekanntmachung Widerspruch einzulegen. Der Widerspruch kann schriftlich oder zu Protokoll der Geschäftsstelle erhoben werden."
    },
    {
      "date": "2024-12-13",
      "id": "96444",
      "original_text": "Registerbekanntmachung nach dem Umwandlungsgesetz\nNordrhein-Westfalen Amtsgericht Düsseldorf HRB 100751\nVERITAS Steuerberatungsgesellschaft mbH – Langenfeld",
      "type": "Registerbekanntmachung nach dem Umwandlungsgesetz",
      "state": "Nordrhein-Westfalen",
      "amtsgericht": "Amtsgericht Düsseldorf",
      "registernummer": "HRB 100751",
      "registerart": "HRB",
      "company_name": "VERITAS Steuerberatungsgesellschaft mbH",
      "company_seat": "Langenfeld",
      "details": "13.12.2024 (Bekanntmachungsdatum)\n\nNordrhein-Westfalen Amtsgericht Düsseldorf HRB 100751\nRegisterbekanntmachung nach dem Umwandlungsgesetz 13.12.2024 (Eintragungsdatum)\n\nVERITAS Steuerberatungsgesellschaft mbH\nGesellschaft mit beschränkter Haftung\nLangenfeld\n\nDen Gläubigern der an der Verschmelzung beteiligten Rechtsträger ist, wenn sie binnen sechs Monaten nach dem Tag, an dem die Eintragung der Verschmelzung in das Register des Sitzes desjenigen Rechtsträgers, dessen Gläubiger sie sind, nach § 19 Absatz 3 UmwG als bekanntgemacht gilt, ihren Anspruch nach Grund und Höhe schriftlich anmelden, Sicherheit zu leisten, soweit sie nicht Befriedigung verlangen können. Dieses Recht steht den Gläubigern jedoch nur zu, wenn sie glaubhaft machen, dass durch die Verschmelzung die Erfüllung ihrer Forderung gefährdet wird."
    },
    {
      "date": "2024-12-13",
      "id": "96445",
      "original_text": "Einreichung neuer Dokumente\nThüringen Amtsgericht Jena HRB 503633\nSüdharzwerke Nordhausen - Entsorgungsgesellschaft mbH – Nordhausen",
      "type": "Einreichung neuer Dokumente",
      "state": "Thüringen",
      "amtsgericht": "Amtsgericht Jena",
      "registernummer": "HRB 503633",
      "registerart": "HRB",
      "company_name": "Südharzwerke Nordhausen - Entsorgungsgesellschaft mbH",
      "company_seat": "Nordhausen",
      "details": "13.12.2024 (Bekanntmachungsdatum)\n\nThüringen Amtsgericht Jena HRB 503633\nEinreichung neuer Dokumente 13.12.2024 (Eintragungsdatum)\n\nSüdharzwerke Nordhausen - Entsorgungsgesellschaft mbH\nGesellschaft mit beschränkter Haftung\nNordhausen\n\nBekanntmachung gem. § 52 Abs. 3 Satz 2 GmbHG: Aufgrund einer Veränderung in den Personen der Aufsichtsratsmitglieder ist durch die Geschäftsführer eine neue Liste zum Handelsregister eingereicht worden."
    },
    {
      "date": "2024-12-13",
      "id": "96446",
      "original_text": "Einreichung neuer Dokumente\nThüringen Amtsgericht Jena HRB 517688\nTreuenburg Real Estate AG – Erfurt",
      "type": "Einreichung neuer Dokumente",
      "state": "Thüringen",
      "amtsgericht": "Amtsgericht Jena",
      "registernummer": "HRB 517688",
      "registerart": "HRB",
      "company_name": "Treuenburg Real Estate AG",
      "company_seat": "Erfurt",
      "details": "13.12.2024 (Bekanntmachungsdatum)\n\nThüringen Amtsgericht Jena HRB 517688\nEinreichung neuer Dokumente\n\nTreuenburg Real Estate AG\nAktiengesellschaft\nErfurt\n\nBekanntmachung gem. § 106 AktG: Aufgrund einer Veränderung in den Personen der Aufsichtsratsmitglieder ist durch den Vorstand eine neue Liste zum Handelsregister eingereicht worden."
    },
    {
      "date": "2024-12-13",
      "id": "96447",
      "original_text": "Sonstige Registerbekanntmachung\nThüringen Amtsgericht Jena HRB 203261\nStädtische Wohnungsgesellschaft Altenburg mbH – Altenburg",
      "type": "Sonstige Registerbekanntmachung",
      "state": "Thüringen",
      "amtsgericht": "Amtsgericht Jena",
      "registernummer": "HRB 203261",
      "registerart": "HRB",
      "company_name": "Städtische Wohnungsgesellschaft Altenburg mbH",
      "company_seat": "Altenburg",
      "details": "13.12.2024 (Bekanntmachungsdatum)\n\nThüringen Amtsgericht Jena HRB 203261\nSonstige Registerbekanntmachung\n\nStädtische Wohnungsgesellschaft Altenburg mbH\nGesellschaft mit beschränkter Haftung\nAltenburg\n\nBekanntmachung gem. § 52 Abs. 3 Satz 2 GmbHG: Aufgrund einer Veränderung in den Personen der Aufsichtsratsmitglieder ist durch die Geschäftsführer eine neue Liste zum Handelsregister eingereicht worden."
    },
    {
      "date": "2024-12-13",
      "id": "96448",
      "original_text": "Einreichung neuer Dokumente\nHessen Amtsgericht Kassel HRB 13752\nGASCADE Gastransport GmbH – Kassel",
      "type": "Einreichung neuer Dokumente",
      "state": "Hessen",
      "amtsgericht": "Amtsgericht Kassel",
      "registernummer": "HRB 13752",
      "registerart": "HRB",
      "company_name": "GASCADE Gastransport GmbH",
      "company_seat": "Kassel",
      "details": "13.12.2024 (Bekanntmachungsdatum)\n\nHessen Amtsgericht Kassel HRB 13752\nEinreichung neuer Dokumente\n\nGASCADE Gastransport GmbH\nGesellschaft mit beschränkter Haftung\nKassel\n\nDurch eine Änderung in den Personen der Aufsichtsratsmitglieder ist eine Liste der Mitglieder des Aufsichtsrates zum Handelsregister eingereicht worden."
    },
    {
      "date": "2024-12-13",
      "id": "96449",
      "original_text": "Registerbekanntmachung nach dem Umwandlungsgesetz\nHessen Amtsgericht Bad Homburg v.d.H. HRB 11601\nJefferson Wells GmbH – Bad Homburg v. d Höhe",
      "type": "Registerbekanntmachung nach dem Umwandlungsgesetz",
      "state": "Hessen",
      "amtsgericht": "Amtsgericht Bad Homburg v.d.H.",
      "registernummer": "HRB 11601",
      "registerart": "HRB",
      "company_name": "Jefferson Wells GmbH",
      "company_seat": "Bad Homburg v. d Höhe",
      "details": "13.12.2024 (Bekanntmachungsdatum)\n\nHessen Amtsgericht Bad Homburg v.d.H. HRB 11601\nRegisterbekanntmachung nach dem Umwandlungsgesetz 13.12.2024 (Eintragungsdatum)\n\nJefferson Wells GmbH\nGesellschaft mit beschränkter Haftung\nBad Homburg v. d Höhe\n\nDen Gläubigern der an der Verschmelzung beteiligten Rechtsträger ist, wenn sie binnen sechs Monaten nach dem Tag, an dem die Eintragung der Verschmelzung in das Register des Sitzes desjenigen Rechtsträgers, dessen Gläubiger sie sind, nach § 19 Absatz 3 UmwG bekannt gemacht worden ist, ihren Anspruch nach Grund und Höhe schriftlich anmelden, Sicherheit zu leisten, soweit sie nicht Befriedigung verlangen können. Dieses Recht steht den Gläubigern jedoch nur zu, wenn sie glaubhaft machen, dass durch die Verschmelzung die Erfüllung ihrer Forderung gefährdet wird."
    },
    {
      "date": "2024-12-13",
      "id": "96450",
      "original_text": "Sonstige Registerbekanntmachung\nHessen Amtsgericht Bad Hersfeld HRB 2208\nGUT Gleisunterhaltungstechnik GmbH – Bebra",
      "type": "Sonstige Registerbekanntmachung",
      "state": "Hessen",
      "amtsgericht": "Amtsgericht Bad Hersfeld",
      "registernummer": "HRB 2208",
      "registerart": "HRB",
      "company_name": "GUT Gleisunterhaltungstechnik GmbH",
      "company_seat": "Bebra",
      "details": "13.12.2024 (Bekanntmachungsdatum)\n\nHessen Amtsgericht Bad Hersfeld HRB 2208\nSonstige Registerbekanntmachung 13.12.2024 (Eintragungsdatum)\n\nGUT Gleisunterhaltungstechnik GmbH\nGesellschaft mit beschränkter Haftung\nBebra\n\nDen Gläubigern der Gesellschaft, deren Forderungen begründet worden sind, bevor die Eintragung der Beendigung des Vertrags in das Handelsregister nach § 10 HGB bekannt gemacht worden ist, ist vom anderen Vertragsteil Sicherheit zu leisten, wenn sie sich binnen sechs Monaten nach dieser Bekanntmachung zu diesem Zweck bei ihm melden."
    },
    {
      "date": "2024-12-13",
      "id": "96451",
      "original_text": "Registerbekanntmachung nach dem Umwandlungsgesetz\nHessen Amtsgericht Bad Homburg v.d.H. HRB 15957\nKeller Consulting GmbH – Oberursel (Taunus)",
      "type": "Registerbekanntmachung nach dem Umwandlungsgesetz",
      "state": "Hessen",
      "amtsgericht": "Amtsgericht Bad Homburg v.d.H.",
      "registernummer": "HRB 15957",
      "registerart": "HRB",
      "company_name": "Keller Consulting GmbH",
      "company_seat": "Oberursel (Taunus)",
      "details": "13.12.2024 (Bekanntmachungsdatum)\n\nHessen Amtsgericht Bad Homburg v.d.H. HRB 15957\nRegisterbekanntmachung nach dem Umwandlungsgesetz 13.12.2024 (Eintragungsdatum)\n\nKeller Consulting GmbH\nGesellschaft mit beschränkter Haftung\nOberursel (Taunus)\n\nDen Gläubigern der an der Verschmelzung beteiligten Rechtsträger ist, wenn sie binnen sechs Monaten nach dem Tag, an dem die Eintragung der Verschmelzung in das Register des Sitzes desjenigen Rechtsträgers, dessen Gläubiger sie sind, nach § 19 Absatz 3 UmwG bekannt gemacht worden ist, ihren Anspruch nach Grund und Höhe schriftlich anmelden, Sicherheit zu leisten, soweit sie nicht Befriedigung verlangen können. Dieses Recht steht den Gläubigern jedoch nur zu, wenn sie glaubhaft machen, dass durch die Verschmelzung die Erfüllung ihrer Forderung gefährdet wird."
    },
    {
      "date": "2024-12-13",
      "id": "96452",
      "original_text": "Löschungsankündigung\nHessen Amtsgericht Frankfurt am Main HRB 116828\nXD Projekt Invest Verwaltungs GmbH – Frankfurt am Main",
      "type": "Löschungsankündigung",
      "state": "Hessen",
      "amtsgericht": "Amtsgericht Frankfurt am Main",
      "registernummer": "HRB 116828",
      "registerart": "HRB",
      "company_name": "XD Projekt Invest Verwaltungs GmbH",
      "company_seat": "Frankfurt am Main",
      "details": "13.12.2024 (Bekanntmachungsdatum)\n\nHessen Amtsgericht Frankfurt am Main HRB 116828\nLöschungsankündigung 13.12.2024 (Eintragungsdatum)\n\nXD Projekt Invest Verwaltungs GmbH\nGesellschaft mit beschränkter Haftung\nFrankfurt am Main\n\nEs ist beabsichtigt die Gesellschaft wegen Vermögenslosigkeit gemäß § 394 FamFG von Amts wegen zu löschen.\n\nHiergegen kann innerhalb eines Monats nach dieser Veröffentlichung Widerspruch bei dem Amtsgericht Frankfurt am Main eingelegt werden."
    },
    {
      "date": "2024-12-13",
      "id": "96453",
      "original_text": "Einreichung neuer Dokumente\nHessen Amtsgericht Frankfurt am Main HRB 74133\nClariant Verwaltungsgesellschaft mbH – Frankfurt am Main",
      "type": "Einreichung neuer Dokumente",
      "state": "Hessen",
      "amtsgericht": "Amtsgericht Frankfurt am Main",
      "registernummer": "HRB 74133",
      "registerart": "HRB",
      "company_name": "Clariant Verwaltungsgesellschaft mbH",
      "company_seat": "Frankfurt am Main",
      "details": "13.12.2024 (Bekanntmachungsdatum)\n\nHessen Amtsgericht Frankfurt am Main HRB 74133\nEinreichung neuer Dokumente\n\nClariant Verwaltungsgesellschaft mbH\nGesellschaft mit beschränkter Haftung\nFrankfurt am Main\n\nDurch eine Änderung in den Personen der Aufsichtsratsmitglieder ist eine Liste der Mitglieder des Aufsichtsrates zum Handelsregister eingereicht worden."
    },
    {
      "date": "2024-12-13",
      "id": "96454",
      "original_text": "Löschungsankündigung\nHessen Amtsgericht Frankfurt am Main HRB 113327\nBG Personaldienstleistungen GmbH – Frankfurt am Main",
      "type": "Löschungsankündigung",
      "state": "Hessen",
      "amtsgericht": "Amtsgericht Frankfurt am Main",
      "registernummer": "HRB 113327",
      "registerart": "HRB",
      "company_name": "BG Personaldienstleistungen GmbH",
      "company_seat": "Frankfurt am Main",
      "details": "13.12.2024 (Bekanntmachungsdatum)\n\nHessen Amtsgericht Frankfurt am Main HRB 113327\nLöschungsankündigung 13.12.2024 (Eintragungsdatum)\n\nBG Personaldienstleistungen GmbH\nGesellschaft mit beschränkter Haftung\nFrankfurt am Main\n\nEs ist beabsichtigt, die Gesellschaft wegen Vermögenslosigkeit gemäß § 394 FamFG von Amts wegen im Handelsregister zu löschen.\n\nHiergegen kann innerhalb eines Zeitraums von 1 Monat nach Zustellung dieser Veröffentlichung Widerspruch bei dem Amtsgericht Frankfurt am Main eingelegt werden."
    },
    {
      "date": "2024-12-13",
      "id": "96455",
      "original_text": "Sonstige Registerbekanntmachung\nHessen Amtsgericht Darmstadt VR 83016\nFörderverein der Jugendverkehrsschule Darmstadt e.V. – Darmstadt",
      "type": "Sonstige Registerbekanntmachung",
      "state": "Hessen",
      "amtsgericht": "Amtsgericht Darmstadt",
      "registernummer": "VR 83016",
      "registerart": "VR",
      "company_name": "Förderverein der Jugendverkehrsschule Darmstadt e.V.",
      "company_seat": "Darmstadt",
      "details": "13.12.2024 (Bekanntmachungsdatum)\n\nHessen Amtsgericht Darmstadt VR 83016\nSonstige Registerbekanntmachung 13.12.2024 (Eintragungsdatum)\n\nFörderverein der Jugendverkehrsschule Darmstadt e.V.\neingetragener Verein\nDarmstadt\n\nDer Verein ist aufgelöst."
    },
    {
      "date": "2024-12-13",
      "id": "96456",
      "original_text": "Löschungsankündigung\nHessen Amtsgericht Frankfurt am Main HRB 53097\nEIF Europäische Immobilienfonds Aktiengesellschaft – Frankfurt am Main",
      "type": "Löschungsankündigung",
      "state": "Hessen",
      "amtsgericht": "Amtsgericht Frankfurt am Main",
      "registernummer": "HRB 53097",
      "registerart": "HRB",
      "company_name": "EIF Europäische Immobilienfonds Aktiengesellschaft",
      "company_seat": "Frankfurt am Main",
      "details": "13.12.2024 (Bekanntmachungsdatum)\n\nHessen Amtsgericht Frankfurt am Main HRB 53097\nLöschungsankündigung\n\nEIF Europäische Immobilienfonds Aktiengesellschaft\nAktiengesellschaft\nFrankfurt am Main\n\nDas Registergericht beabsichtigt die im Handelsregister eingetragene Gesellschaft von Amts wegen nach § 394 FamFG zu löschen. Die Frist zur Erhebung eines Widerspruchs gegen die beabsichtigte Löschung wird auf 1 Monat festgesetzt."
    }
  ]
}