{
  "date": "2024-12-18",
  "date_of_scrape": "2024-12-19T04:09:56.040Z",
  "tool_version": "0.2.0",
  "number_of_announcements": 159,
  "announcements": [
    {
      "date": "2024-12-18",
      "id": "96753",
      "original_text": "Sonstige Registerbekanntmachung\nBayern Amtsgericht Bayreuth HRB 5264\nBellandTechnology AG – Pottenstein",
      "type": "Sonstige Registerbekanntmachung",
      "state": "Bayern",
      "amtsgericht": "Amtsgericht Bayreuth",
      "registernummer": "HRB 5264",
      "registerart": "HRB",
      "company_name": "BellandTechnology AG",
      "company_seat": "Pottenstein",
      "details": "18.12.2024 (Bekanntmachungsdatum)\n\nBayern Amtsgericht Bayreuth HRB 5264\nSonstige Registerbekanntmachung 17.12.2024 (Eintragungsdatum)\n\nBellandTechnology AG\nAktiengesellschaft\nPottenstein\n\nDen Gläubigern der Gesellschaft, deren Forderungen begründet worden sind, bevor die Eintragung des Beschlusses bekanntgemacht worden ist, ist, wenn sie sich binnen sechs Monaten nach der Bekanntmachung zu diesem Zweck melden, Sicherheit zu leisten, soweit sie nicht Befriedigung verlangen können. Das Recht, Sicherheitsleistung zu verlangen, steht Gläubigern nicht zu, die im Fall des Insolvenzverfahrens ein Recht auf vorzugsweise Befriedigung aus einer Deckungsmasse haben, die nach gesetzlicher Vorschrift zu ihrem Schutz errichtet und staatlich überwacht ist."
    },
    {
      "date": "2024-12-18",
      "id": "96754",
      "original_text": "Registerbekanntmachung nach dem Umwandlungsgesetz\nBayern Amtsgericht Regensburg HRB 2669\nEbner GmbH – Regensburg",
      "type": "Registerbekanntmachung nach dem Umwandlungsgesetz",
      "state": "Bayern",
      "amtsgericht": "Amtsgericht Regensburg",
      "registernummer": "HRB 2669",
      "registerart": "HRB",
      "company_name": "Ebner GmbH",
      "company_seat": "Regensburg",
      "details": "18.12.2024 (Bekanntmachungsdatum)\n\nBayern Amtsgericht Regensburg HRB 2669\nRegisterbekanntmachung nach dem Umwandlungsgesetz 17.12.2024 (Eintragungsdatum)\n\nEbner GmbH\nGesellschaft mit beschränkter Haftung\nRegensburg\n\nDen Gläubigern der an der Verschmelzung beteiligten Rechtsträger ist, wenn sie binnen sechs Monaten nach dem Tag, an dem die Eintragung der Verschmelzung in das Register des Sitzes desjenigen Rechtsträgers, dessen Gläubiger sie sind, nach § 19 Abs. 3 UmwG als bekannt gemacht gilt, ihren Anspruch nach Grund und Höhe schriftlich anmelden, Sicherheit zu leisten, soweit sie nicht Befriedigung verlangen können. Dieses Recht steht den Gläubigern jedoch nur zu, wenn sie glaubhaft machen, dass durch die Verschmelzung die Erfüllung ihrer Forderung gefährdet wird."
    },
    {
      "date": "2024-12-18",
      "id": "96755",
      "original_text": "Registerbekanntmachung nach dem Umwandlungsgesetz\nBayern Amtsgericht München HRB 298401\nIngentis TopCo GmbH – München",
      "type": "Registerbekanntmachung nach dem Umwandlungsgesetz",
      "state": "Bayern",
      "amtsgericht": "Amtsgericht München",
      "registernummer": "HRB 298401",
      "registerart": "HRB",
      "company_name": "Ingentis TopCo GmbH",
      "company_seat": "München",
      "details": "18.12.2024 (Bekanntmachungsdatum)\n\nBayern Amtsgericht München HRB 298401\nRegisterbekanntmachung nach dem Umwandlungsgesetz 17.12.2024 (Eintragungsdatum)\n\nIngentis TopCo GmbH\nGesellschaft mit beschränkter Haftung\nMünchen\n\nDen Gläubigern des formwechselnden Rechtsträgers ist, wenn sie binnen sechs Monaten nach dem Tag, an dem die Eintragung des Formwechsels nach § 201 UmwG als bekannt gemacht gilt, ihren Anspruch nach Grund und Höhe schriftlich anmelden, Sicherheit zu leisten, soweit sie nicht Befriedigung verlangen können. Dieses Recht steht den Gläubigern jedoch nur zu, wenn sie glaubhaft machen, dass durch den Formwechsel die Erfüllung ihrer Forderung gefährdet wird."
    },
    {
      "date": "2024-12-18",
      "id": "96756",
      "original_text": "Registerbekanntmachung nach dem Umwandlungsgesetz\nBayern Amtsgericht Augsburg HRA 21637\nKX Restaurant GmbH & Co. KG – Augsburg",
      "type": "Registerbekanntmachung nach dem Umwandlungsgesetz",
      "state": "Bayern",
      "amtsgericht": "Amtsgericht Augsburg",
      "registernummer": "HRA 21637",
      "registerart": "HRA",
      "company_name": "KX Restaurant GmbH & Co. KG",
      "company_seat": "Augsburg",
      "details": "18.12.2024 (Bekanntmachungsdatum)\n\nBayern Amtsgericht Augsburg HRA 21637\nRegisterbekanntmachung nach dem Umwandlungsgesetz 17.12.2024 (Eintragungsdatum)\n\nKX Restaurant GmbH & Co. KG\nKommanditgesellschaft\nAugsburg\n\nDen Gläubigern der an der Spaltung beteiligten Rechtsträger ist, wenn sie binnen sechs Monaten nach dem Tag, an dem die Eintragung der Spaltung in das Register des Sitzes desjenigen Rechtsträgers, dessen Gläubiger sie sind, nach §§ 125, 19 Abs. 3 UmwG als bekannt gemacht gilt, ihren Anspruch nach Grund und Höhe schriftlich anmelden, Sicherheit zu leisten, soweit sie nicht Befriedigung verlangen können. Dieses Recht steht den Gläubigern jedoch nur zu, wenn sie glaubhaft machen, dass durch die Spaltung die Erfüllung ihrer Forderung gefährdet wird."
    },
    {
      "date": "2024-12-18",
      "id": "96757",
      "original_text": "Löschungsankündigung\nBayern Amtsgericht München HRA 108871\nzugspitzt GmbH & Co. KG – Murnau a.Staffelsee",
      "type": "Löschungsankündigung",
      "state": "Bayern",
      "amtsgericht": "Amtsgericht München",
      "registernummer": "HRA 108871",
      "registerart": "HRA",
      "company_name": "zugspitzt GmbH & Co. KG",
      "company_seat": "Murnau a.Staffelsee",
      "details": "18.12.2024 (Bekanntmachungsdatum)\n\nBayern Amtsgericht München HRA 108871\nLöschungsankündigung\n\nzugspitzt GmbH & Co. KG\nKommanditgesellschaft\nMurnau a.Staffelsee\n\nDas Registergericht beabsichtigt, die im Handelsregister eingetragene Firma von Amts wegen nach § 31 Abs. 2 HGB zu löschen. Die Frist zur Erhebung eines Widerspruchs ist auf drei Monate festgesetzt."
    },
    {
      "date": "2024-12-18",
      "id": "96758",
      "original_text": "Einreichung neuer Dokumente\nBayern Amtsgericht München HRB 132279\npmOne AG – München",
      "type": "Einreichung neuer Dokumente",
      "state": "Bayern",
      "amtsgericht": "Amtsgericht München",
      "registernummer": "HRB 132279",
      "registerart": "HRB",
      "company_name": "pmOne AG",
      "company_seat": "München",
      "details": "18.12.2024 (Bekanntmachungsdatum)\n\nBayern Amtsgericht München HRB 132279\nEinreichung neuer Dokumente 17.12.2024 (Eintragungsdatum)\n\npmOne AG\nAktiengesellschaft\nMünchen\n\nDem Amtsgericht München -Registergericht- ist eine Liste der Mitglieder des Aufsichtsrats eingereicht worden, § 106 AktG."
    },
    {
      "date": "2024-12-18",
      "id": "96759",
      "original_text": "Einreichung neuer Dokumente\nBayern Amtsgericht München HRB 109326\nTÜV SÜD Aktiengesellschaft – München",
      "type": "Einreichung neuer Dokumente",
      "state": "Bayern",
      "amtsgericht": "Amtsgericht München",
      "registernummer": "HRB 109326",
      "registerart": "HRB",
      "company_name": "TÜV SÜD Aktiengesellschaft",
      "company_seat": "München",
      "details": "18.12.2024 (Bekanntmachungsdatum)\n\nBayern Amtsgericht München HRB 109326\nEinreichung neuer Dokumente 17.12.2024 (Eintragungsdatum)\n\nTÜV SÜD Aktiengesellschaft\nAktiengesellschaft\nMünchen\n\nDem Amtsgericht München -Registergericht- ist eine Liste der Mitglieder des Aufsichtsrats eingereicht worden, § 106 AktG."
    },
    {
      "date": "2024-12-18",
      "id": "96760",
      "original_text": "Einreichung neuer Dokumente\nBayern Amtsgericht München HRB 127137\nIngenieurbüro Linsmeier AG – München",
      "type": "Einreichung neuer Dokumente",
      "state": "Bayern",
      "amtsgericht": "Amtsgericht München",
      "registernummer": "HRB 127137",
      "registerart": "HRB",
      "company_name": "Ingenieurbüro Linsmeier AG",
      "company_seat": "München",
      "details": "18.12.2024 (Bekanntmachungsdatum)\n\nBayern Amtsgericht München HRB 127137\nEinreichung neuer Dokumente 17.12.2024 (Eintragungsdatum)\n\nIngenieurbüro Linsmeier AG\nAktiengesellschaft\nMünchen\n\nDem Amtsgericht München -Registergericht- ist eine Liste der Mitglieder des Aufsichtsrats eingereicht worden, § 106 AktG."
    },
    {
      "date": "2024-12-18",
      "id": "96761",
      "original_text": "Löschungsankündigung\nBayern Amtsgericht Fürth HRB 15580\nTRAUTS WEST Bauservice UG (haftungsbeschränkt) – Trautskirchen",
      "type": "Löschungsankündigung",
      "state": "Bayern",
      "amtsgericht": "Amtsgericht Fürth",
      "registernummer": "HRB 15580",
      "registerart": "HRB",
      "company_name": "TRAUTS WEST Bauservice UG (haftungsbeschränkt)",
      "company_seat": "Trautskirchen",
      "details": "18.12.2024 (Bekanntmachungsdatum)\n\nBayern Amtsgericht Fürth HRB 15580\nLöschungsankündigung\n\nTRAUTS WEST Bauservice UG (haftungsbeschränkt)\nGesellschaft mit beschränkter Haftung\nTrautskirchen\n\nDas Registergericht beabsichtigt, die im Handelsregister eingetragene Gesellschaft wegen Vermögenslosigkeit von Amts wegen nach § 394 FamFG zu löschen. Die Frist zur Erhebung eines Widerspruchs ist auf drei Monate festgesetzt."
    },
    {
      "date": "2024-12-18",
      "id": "96762",
      "original_text": "Löschungsankündigung\nBayern Amtsgericht Würzburg HRA 6028\nLACOS Know-How, Andreas König e. K. – Würzburg",
      "type": "Löschungsankündigung",
      "state": "Bayern",
      "amtsgericht": "Amtsgericht Würzburg",
      "registernummer": "HRA 6028",
      "registerart": "HRA",
      "company_name": "LACOS Know-How, Andreas König e. K.",
      "company_seat": "Würzburg",
      "details": "18.12.2024 (Bekanntmachungsdatum)\n\nBayern Amtsgericht Würzburg HRA 6028\nLöschungsankündigung\n\nLACOS Know-How, Andreas König e. K.\nEinzelkaufmann / Einzelkauffrau\nWürzburg\n\nDas Registergericht beabsichtigt, die im Handelsregister eingetragene Firma von Amts wegen nach § 31 Abs. 2 HGB zu löschen. Die Frist zur Erhebung eines Widerspruchs ist auf einen Monat festgesetzt."
    },
    {
      "date": "2024-12-18",
      "id": "96763",
      "original_text": "Einreichung neuer Dokumente\nBayern Amtsgericht München HRB 220771\nGenerali Deutschland AG – München",
      "type": "Einreichung neuer Dokumente",
      "state": "Bayern",
      "amtsgericht": "Amtsgericht München",
      "registernummer": "HRB 220771",
      "registerart": "HRB",
      "company_name": "Generali Deutschland AG",
      "company_seat": "München",
      "details": "18.12.2024 (Bekanntmachungsdatum)\n\nBayern Amtsgericht München HRB 220771\nEinreichung neuer Dokumente\n\nGenerali Deutschland AG\nAktiengesellschaft\nMünchen\n\nDem Amtsgericht München -Registergericht- ist eine Liste der Mitglieder des Aufsichtsrats eingereicht worden, § 106 AktG."
    },
    {
      "date": "2024-12-18",
      "id": "96764",
      "original_text": "Registerbekanntmachung nach dem Umwandlungsgesetz\nBayern Amtsgericht Augsburg HRA 20065\nTH Systemgastronomie GmbH & Co. KG – Augsburg",
      "type": "Registerbekanntmachung nach dem Umwandlungsgesetz",
      "state": "Bayern",
      "amtsgericht": "Amtsgericht Augsburg",
      "registernummer": "HRA 20065",
      "registerart": "HRA",
      "company_name": "TH Systemgastronomie GmbH & Co. KG",
      "company_seat": "Augsburg",
      "details": "18.12.2024 (Bekanntmachungsdatum)\n\nBayern Amtsgericht Augsburg HRA 20065\nRegisterbekanntmachung nach dem Umwandlungsgesetz 17.12.2024 (Eintragungsdatum)\n\nTH Systemgastronomie GmbH & Co. KG\nKommanditgesellschaft\nAugsburg\n\nDen Gläubigern der an der Spaltung beteiligten Rechtsträger ist, wenn sie binnen sechs Monaten nach dem Tag, an dem die Eintragung der Spaltung in das Register des Sitzes desjenigen Rechtsträgers, dessen Gläubiger sie sind, nach §§ 125, 19 Abs. 3 UmwG als bekannt gemacht gilt, ihren Anspruch nach Grund und Höhe schriftlich anmelden, Sicherheit zu leisten, soweit sie nicht Befriedigung verlangen können. Dieses Recht steht den Gläubigern jedoch nur zu, wenn sie glaubhaft machen, dass durch die Spaltung die Erfüllung ihrer Forderung gefährdet wird."
    },
    {
      "date": "2024-12-18",
      "id": "96765",
      "original_text": "Registerbekanntmachung nach dem Umwandlungsgesetz\nBayern Amtsgericht München HRB 232247\nmoebel.net AG – München",
      "type": "Registerbekanntmachung nach dem Umwandlungsgesetz",
      "state": "Bayern",
      "amtsgericht": "Amtsgericht München",
      "registernummer": "HRB 232247",
      "registerart": "HRB",
      "company_name": "moebel.net AG",
      "company_seat": "München",
      "details": "18.12.2024 (Bekanntmachungsdatum)\n\nBayern Amtsgericht München HRB 232247\nRegisterbekanntmachung nach dem Umwandlungsgesetz 17.12.2024 (Eintragungsdatum)\n\nmoebel.net AG\nAktiengesellschaft\nMünchen\n\nDen Gläubigern des formwechselnden Rechtsträgers ist, wenn sie binnen sechs Monaten nach dem Tag, an dem die Eintragung des Formwechsels nach § 201 UmwG als bekannt gemacht gilt, ihren Anspruch nach Grund und Höhe schriftlich anmelden, Sicherheit zu leisten, soweit sie nicht Befriedigung verlangen können. Dieses Recht steht den Gläubigern jedoch nur zu, wenn sie glaubhaft machen, dass durch den Formwechsel die Erfüllung ihrer Forderung gefährdet wird."
    },
    {
      "date": "2024-12-18",
      "id": "96766",
      "original_text": "Registerbekanntmachung nach dem Umwandlungsgesetz\nBayern Amtsgericht München HRB 167698\nGesellschaft für Kraftwerke und öffentliche Bauten mbH – Pullach i. Isartal",
      "type": "Registerbekanntmachung nach dem Umwandlungsgesetz",
      "state": "Bayern",
      "amtsgericht": "Amtsgericht München",
      "registernummer": "HRB 167698",
      "registerart": "HRB",
      "company_name": "Gesellschaft für Kraftwerke und öffentliche Bauten mbH",
      "company_seat": "Pullach i. Isartal",
      "details": "18.12.2024 (Bekanntmachungsdatum)\n\nBayern Amtsgericht München HRB 167698\nRegisterbekanntmachung nach dem Umwandlungsgesetz 17.12.2024 (Eintragungsdatum)\n\nGesellschaft für Kraftwerke und öffentliche Bauten mbH\nGesellschaft mit beschränkter Haftung\nPullach i. Isartal\n\nDen Gläubigern der an der Verschmelzung beteiligten Rechtsträger ist, wenn sie binnen sechs Monaten nach dem Tag, an dem die Eintragung der Verschmelzung in das Register des Sitzes desjenigen Rechtsträgers, dessen Gläubiger sie sind, nach § 19 Abs. 3 UmwG als bekannt gemacht gilt, ihren Anspruch nach Grund und Höhe schriftlich anmelden, Sicherheit zu leisten, soweit sie nicht Befriedigung verlangen können. Dieses Recht steht den Gläubigern jedoch nur zu, wenn sie glaubhaft machen, dass durch die Verschmelzung die Erfüllung ihrer Forderung gefährdet wird."
    },
    {
      "date": "2024-12-18",
      "id": "96767",
      "original_text": "Registerbekanntmachung nach dem Umwandlungsgesetz\nBayern Amtsgericht Fürth HRB 20091\nSchultheiß Software AG – Erlangen",
      "type": "Registerbekanntmachung nach dem Umwandlungsgesetz",
      "state": "Bayern",
      "amtsgericht": "Amtsgericht Fürth",
      "registernummer": "HRB 20091",
      "registerart": "HRB",
      "company_name": "Schultheiß Software AG",
      "company_seat": "Erlangen",
      "details": "18.12.2024 (Bekanntmachungsdatum)\n\nBayern Amtsgericht Fürth HRB 20091\nRegisterbekanntmachung nach dem Umwandlungsgesetz 17.12.2024 (Eintragungsdatum)\n\nSchultheiß Software AG\nAktiengesellschaft\nErlangen\n\nDen Gläubigern des formwechselnden Rechtsträgers ist, wenn sie binnen sechs Monaten nach dem Tag, an dem die Eintragung des Formwechsels nach § 201 UmwG als bekannt gemacht gilt, ihren Anspruch nach Grund und Höhe schriftlich anmelden, Sicherheit zu leisten, soweit sie nicht Befriedigung verlangen können. Dieses Recht steht den Gläubigern jedoch nur zu, wenn sie glaubhaft machen, dass durch den Formwechsel die Erfüllung ihrer Forderung gefährdet wird."
    },
    {
      "date": "2024-12-18",
      "id": "96768",
      "original_text": "Registerbekanntmachung nach dem Umwandlungsgesetz\nBayern Amtsgericht München HRB 266482\nGreenTech Living Spaces GmbH – München",
      "type": "Registerbekanntmachung nach dem Umwandlungsgesetz",
      "state": "Bayern",
      "amtsgericht": "Amtsgericht München",
      "registernummer": "HRB 266482",
      "registerart": "HRB",
      "company_name": "GreenTech Living Spaces GmbH",
      "company_seat": "München",
      "details": "18.12.2024 (Bekanntmachungsdatum)\n\nBayern Amtsgericht München HRB 266482\nRegisterbekanntmachung nach dem Umwandlungsgesetz 17.12.2024 (Eintragungsdatum)\n\nGreenTech Living Spaces GmbH\nGesellschaft mit beschränkter Haftung\nMünchen\n\nDen Gläubigern der an der Verschmelzung beteiligten Rechtsträger ist, wenn sie binnen sechs Monaten nach dem Tag, an dem die Eintragung der Verschmelzung in das Register des Sitzes desjenigen Rechtsträgers, dessen Gläubiger sie sind, nach § 19 Abs. 3 UmwG als bekannt gemacht gilt, ihren Anspruch nach Grund und Höhe schriftlich anmelden, Sicherheit zu leisten, soweit sie nicht Befriedigung verlangen können. Dieses Recht steht den Gläubigern jedoch nur zu, wenn sie glaubhaft machen, dass durch die Verschmelzung die Erfüllung ihrer Forderung gefährdet wird."
    },
    {
      "date": "2024-12-18",
      "id": "96769",
      "original_text": "Registerbekanntmachung nach dem Umwandlungsgesetz\nBayern Amtsgericht München HRB 104206\nHelmut Berger Immobilien u. Hausverwaltungen GmbH – Fürstenfeldbruck",
      "type": "Registerbekanntmachung nach dem Umwandlungsgesetz",
      "state": "Bayern",
      "amtsgericht": "Amtsgericht München",
      "registernummer": "HRB 104206",
      "registerart": "HRB",
      "company_name": "Helmut Berger Immobilien u. Hausverwaltungen GmbH",
      "company_seat": "Fürstenfeldbruck",
      "details": "18.12.2024 (Bekanntmachungsdatum)\n\nBayern Amtsgericht München HRB 104206\nRegisterbekanntmachung nach dem Umwandlungsgesetz\n\nHelmut Berger Immobilien u. Hausverwaltungen GmbH\nGesellschaft mit beschränkter Haftung\nFürstenfeldbruck\n\nEs wird darauf hingewiesen, dass ein Formwechselplan oder sein Entwurf über einen grenzüberschreitenden Formwechsel in die Helmut Berger Immobilien u. Hausverwaltungen GmbH mit Sitz in Krimml, Österreich beim Handelsregister eingereicht worden ist.\nDie Anteilsinhaber, die Gläubiger sowie die zuständigen Betriebsräte der an dem grenzüberschreitenden Formwechsel beteiligten Gesellschaft oder, soweit es keinen Betriebsrat gibt, die Arbeitnehmer der an dem grenzüberschreitenden Formwechsel beteiligten Gesellschaft, können der Gesellschaft spätestens fünf Arbeitstage vor dem Tag der Gesellschafterversammlung Bemerkungen zum Formwechselplan übermitteln."
    },
    {
      "date": "2024-12-18",
      "id": "96770",
      "original_text": "Registerbekanntmachung nach dem Umwandlungsgesetz\nBayern Amtsgericht Fürth HRB 21495\nSchultheiß Software GmbH – Erlangen",
      "type": "Registerbekanntmachung nach dem Umwandlungsgesetz",
      "state": "Bayern",
      "amtsgericht": "Amtsgericht Fürth",
      "registernummer": "HRB 21495",
      "registerart": "HRB",
      "company_name": "Schultheiß Software GmbH",
      "company_seat": "Erlangen",
      "details": "18.12.2024 (Bekanntmachungsdatum)\n\nBayern Amtsgericht Fürth HRB 21495\nRegisterbekanntmachung nach dem Umwandlungsgesetz 17.12.2024 (Eintragungsdatum)\n\nSchultheiß Software GmbH\nGesellschaft mit beschränkter Haftung\nErlangen\n\nDen Gläubigern des formwechselnden Rechtsträgers ist, wenn sie binnen sechs Monaten nach dem Tag, an dem die Eintragung des Formwechsels nach § 201 UmwG als bekannt gemacht gilt, ihren Anspruch nach Grund und Höhe schriftlich anmelden, Sicherheit zu leisten, soweit sie nicht Befriedigung verlangen können. Dieses Recht steht den Gläubigern jedoch nur zu, wenn sie glaubhaft machen, dass durch den Formwechsel die Erfüllung ihrer Forderung gefährdet wird."
    },
    {
      "date": "2024-12-18",
      "id": "96771",
      "original_text": "Registerbekanntmachung nach dem Umwandlungsgesetz\nBayern Amtsgericht München HRB 242065\nmantro education Software GmbH – München",
      "type": "Registerbekanntmachung nach dem Umwandlungsgesetz",
      "state": "Bayern",
      "amtsgericht": "Amtsgericht München",
      "registernummer": "HRB 242065",
      "registerart": "HRB",
      "company_name": "mantro education Software GmbH",
      "company_seat": "München",
      "details": "18.12.2024 (Bekanntmachungsdatum)\n\nBayern Amtsgericht München HRB 242065\nRegisterbekanntmachung nach dem Umwandlungsgesetz 17.12.2024 (Eintragungsdatum)\n\nmantro education Software GmbH\nGesellschaft mit beschränkter Haftung\nMünchen\n\nDen Gläubigern der an der Verschmelzung beteiligten Rechtsträger ist, wenn sie binnen sechs Monaten nach dem Tag, an dem die Eintragung der Verschmelzung in das Register des Sitzes desjenigen Rechtsträgers, dessen Gläubiger sie sind, nach § 19 Abs. 3 UmwG als bekannt gemacht gilt, ihren Anspruch nach Grund und Höhe schriftlich anmelden, Sicherheit zu leisten, soweit sie nicht Befriedigung verlangen können. Dieses Recht steht den Gläubigern jedoch nur zu, wenn sie glaubhaft machen, dass durch die Verschmelzung die Erfüllung ihrer Forderung gefährdet wird."
    },
    {
      "date": "2024-12-18",
      "id": "96772",
      "original_text": "Registerbekanntmachung nach dem Umwandlungsgesetz\nBayern Amtsgericht Ingolstadt HRA 4142\nLorenz Liepold Omnibusservice e.K. – Ingolstadt",
      "type": "Registerbekanntmachung nach dem Umwandlungsgesetz",
      "state": "Bayern",
      "amtsgericht": "Amtsgericht Ingolstadt",
      "registernummer": "HRA 4142",
      "registerart": "HRA",
      "company_name": "Lorenz Liepold Omnibusservice e.K.",
      "company_seat": "Ingolstadt",
      "details": "18.12.2024 (Bekanntmachungsdatum)\n\nBayern Amtsgericht Ingolstadt HRA 4142\nRegisterbekanntmachung nach dem Umwandlungsgesetz 17.12.2024 (Eintragungsdatum)\n\nLorenz Liepold Omnibusservice e.K.\nEinzelkaufmann / Einzelkauffrau\nIngolstadt\n\nDen Gläubigern der an der Ausgliederung beteiligten Rechtsträger ist, wenn sie binnen sechs Monaten nach dem Tag, an dem die Eintragung der Ausgliederung in das Register des Sitzes desjenigen Rechtsträgers, dessen Gläubiger sie sind, nach §§ 125, 19 Abs. 3 UmwG als bekannt gemacht gilt, ihren Anspruch nach Grund und Höhe schriftlich anmelden, Sicherheit zu leisten, soweit sie nicht Befriedigung verlangen können. Dieses Recht steht den Gläubigern jedoch nur zu, wenn sie glaubhaft machen, dass durch die Ausgliederung die Erfüllung ihrer Forderung gefährdet wird."
    },
    {
      "date": "2024-12-18",
      "id": "96773",
      "original_text": "Einreichung neuer Dokumente\nBayern Amtsgericht München HRB 167849\nShirtinator AG – München",
      "type": "Einreichung neuer Dokumente",
      "state": "Bayern",
      "amtsgericht": "Amtsgericht München",
      "registernummer": "HRB 167849",
      "registerart": "HRB",
      "company_name": "Shirtinator AG",
      "company_seat": "München",
      "details": "18.12.2024 (Bekanntmachungsdatum)\n\nBayern Amtsgericht München HRB 167849\nEinreichung neuer Dokumente\n\nShirtinator AG\nAktiengesellschaft\nMünchen\n\nDem Amtsgericht München -Registergericht- ist eine Liste der Mitglieder des Aufsichtsrats eingereicht worden, § 106 AktG."
    },
    {
      "date": "2024-12-18",
      "id": "96774",
      "original_text": "Registerbekanntmachung nach dem Umwandlungsgesetz\nBayern Amtsgericht München HRB 233194\nInfinigate Group GmbH – Haar",
      "type": "Registerbekanntmachung nach dem Umwandlungsgesetz",
      "state": "Bayern",
      "amtsgericht": "Amtsgericht München",
      "registernummer": "HRB 233194",
      "registerart": "HRB",
      "company_name": "Infinigate Group GmbH",
      "company_seat": "Haar",
      "details": "18.12.2024 (Bekanntmachungsdatum)\n\nBayern Amtsgericht München HRB 233194\nRegisterbekanntmachung nach dem Umwandlungsgesetz 17.12.2024 (Eintragungsdatum)\n\nInfinigate Group GmbH\nGesellschaft mit beschränkter Haftung\nHaar\n\nDen Gläubigern der an der Verschmelzung beteiligten Rechtsträger ist, wenn sie binnen sechs Monaten nach dem Tag, an dem die Eintragung der Verschmelzung in das Register des Sitzes desjenigen Rechtsträgers, dessen Gläubiger sie sind, nach § 19 Abs. 3 UmwG als bekannt gemacht gilt, ihren Anspruch nach Grund und Höhe schriftlich anmelden, Sicherheit zu leisten, soweit sie nicht Befriedigung verlangen können. Dieses Recht steht den Gläubigern jedoch nur zu, wenn sie glaubhaft machen, dass durch die Verschmelzung die Erfüllung ihrer Forderung gefährdet wird."
    },
    {
      "date": "2024-12-18",
      "id": "96775",
      "original_text": "Löschungsankündigung\nBayern Amtsgericht Augsburg HRB 34161\nAthemco UG (haftungsbeschränkt) – Zusamaltheim",
      "type": "Löschungsankündigung",
      "state": "Bayern",
      "amtsgericht": "Amtsgericht Augsburg",
      "registernummer": "HRB 34161",
      "registerart": "HRB",
      "company_name": "Athemco UG (haftungsbeschränkt)",
      "company_seat": "Zusamaltheim",
      "details": "18.12.2024 (Bekanntmachungsdatum)\n\nBayern Amtsgericht Augsburg HRB 34161\nLöschungsankündigung\n\nAthemco UG (haftungsbeschränkt)\nGesellschaft mit beschränkter Haftung\nZusamaltheim\n\nDas Registergericht beabsichtigt, die im Handelsregister eingetragene Gesellschaft wegen Vermögenslosigkeit von Amts wegen nach § 394 FamFG zu löschen. Die Frist zur Erhebung eines Widerspruchs ist auf einen Monat festgesetzt."
    },
    {
      "date": "2024-12-18",
      "id": "96776",
      "original_text": "Registerbekanntmachung nach dem Umwandlungsgesetz\nBayern Amtsgericht Ingolstadt HRB 12084\nIFS-Omnibusservice GmbH – Ingolstadt",
      "type": "Registerbekanntmachung nach dem Umwandlungsgesetz",
      "state": "Bayern",
      "amtsgericht": "Amtsgericht Ingolstadt",
      "registernummer": "HRB 12084",
      "registerart": "HRB",
      "company_name": "IFS-Omnibusservice GmbH",
      "company_seat": "Ingolstadt",
      "details": "18.12.2024 (Bekanntmachungsdatum)\n\nBayern Amtsgericht Ingolstadt HRB 12084\nRegisterbekanntmachung nach dem Umwandlungsgesetz 17.12.2024 (Eintragungsdatum)\n\nIFS-Omnibusservice GmbH\nGesellschaft mit beschränkter Haftung\nIngolstadt\n\nDen Gläubigern der an der Ausgliederung beteiligten Rechtsträger ist, wenn sie binnen sechs Monaten nach dem Tag, an dem die Eintragung der Ausgliederung in das Register des Sitzes desjenigen Rechtsträgers, dessen Gläubiger sie sind, nach §§ 125, 19 Abs. 3 UmwG als bekannt gemacht gilt, ihren Anspruch nach Grund und Höhe schriftlich anmelden, Sicherheit zu leisten, soweit sie nicht Befriedigung verlangen können. Dieses Recht steht den Gläubigern jedoch nur zu, wenn sie glaubhaft machen, dass durch die Ausgliederung die Erfüllung ihrer Forderung gefährdet wird."
    },
    {
      "date": "2024-12-18",
      "id": "96777",
      "original_text": "Einreichung neuer Dokumente\nBayern Amtsgericht München HRB 118952\nKNDS Deutschland Verwaltungs GmbH – München",
      "type": "Einreichung neuer Dokumente",
      "state": "Bayern",
      "amtsgericht": "Amtsgericht München",
      "registernummer": "HRB 118952",
      "registerart": "HRB",
      "company_name": "KNDS Deutschland Verwaltungs GmbH",
      "company_seat": "München",
      "details": "18.12.2024 (Bekanntmachungsdatum)\n\nBayern Amtsgericht München HRB 118952\nEinreichung neuer Dokumente 17.12.2024 (Eintragungsdatum)\n\nKNDS Deutschland Verwaltungs GmbH\nGesellschaft mit beschränkter Haftung\nMünchen\n\nDem Amtsgericht München -Registergericht- ist eine Liste der Mitglieder des Aufsichtsrats eingereicht worden, § 52 Abs. 3 S. 2 GmbHG."
    },
    {
      "date": "2024-12-18",
      "id": "96778",
      "original_text": "Registerbekanntmachung nach dem Umwandlungsgesetz\nBayern Amtsgericht Nürnberg HRB 35297\nMahlknecht & Mäusl GmbH – Nürnberg",
      "type": "Registerbekanntmachung nach dem Umwandlungsgesetz",
      "state": "Bayern",
      "amtsgericht": "Amtsgericht Nürnberg",
      "registernummer": "HRB 35297",
      "registerart": "HRB",
      "company_name": "Mahlknecht & Mäusl GmbH",
      "company_seat": "Nürnberg",
      "details": "18.12.2024 (Bekanntmachungsdatum)\n\nBayern Amtsgericht Nürnberg HRB 35297\nRegisterbekanntmachung nach dem Umwandlungsgesetz 17.12.2024 (Eintragungsdatum)\n\nMahlknecht & Mäusl GmbH\nGesellschaft mit beschränkter Haftung\nNürnberg\n\nDen Gläubigern der an der Spaltung beteiligten Rechtsträger ist, wenn sie binnen sechs Monaten nach dem Tag, an dem die Eintragung der Spaltung in das Register des Sitzes desjenigen Rechtsträgers, dessen Gläubiger sie sind, nach §§ 125, 19 Abs. 3 UmwG als bekannt gemacht gilt, ihren Anspruch nach Grund und Höhe schriftlich anmelden, Sicherheit zu leisten, soweit sie nicht Befriedigung verlangen können. Dieses Recht steht den Gläubigern jedoch nur zu, wenn sie glaubhaft machen, dass durch die Spaltung die Erfüllung ihrer Forderung gefährdet wird."
    },
    {
      "date": "2024-12-18",
      "id": "96779",
      "original_text": "Registerbekanntmachung nach dem Umwandlungsgesetz\nBaden-Württemberg Amtsgericht Freiburg HRB 732237\nMaier Catering GmbH – Stockach",
      "type": "Registerbekanntmachung nach dem Umwandlungsgesetz",
      "state": "Baden-Württemberg",
      "amtsgericht": "Amtsgericht Freiburg",
      "registernummer": "HRB 732237",
      "registerart": "HRB",
      "company_name": "Maier Catering GmbH",
      "company_seat": "Stockach",
      "details": "18.12.2024 (Bekanntmachungsdatum)\n\nBaden-Württemberg Amtsgericht Freiburg HRB 732237\nRegisterbekanntmachung nach dem Umwandlungsgesetz 18.12.2024 (Eintragungsdatum)\n\nMaier Catering GmbH\nGesellschaft mit beschränkter Haftung\nStockach\n\nDen Gläubigern der an der Ausgliederung beteiligten Rechtsträger ist, wenn sie binnen sechs Monaten nach dem Tag, an dem die Eintragung der Ausgliederung in das Register des Sitzes desjenigen Rechtsträgers, dessen Gläubiger sie sind, nach § 19 Abs. 3 UmwG als bekanntgemacht gilt, ihren Anspruch nach Grund und Höhe schriftlich anmelden, Sicherheit zu leisten, soweit sie nicht Befriedigung verlangen können. Dieses Recht steht den Gläubigern jedoch nur zu, wenn sie glaubhaft machen, dass durch die Ausgliederung die Erfüllung ihrer Forderung gefährdet wird."
    },
    {
      "date": "2024-12-18",
      "id": "96780",
      "original_text": "Registerbekanntmachung nach dem Umwandlungsgesetz\nBaden-Württemberg Amtsgericht Freiburg HRA 706602\nMaier Partyservice & Catering Bastian Maier e.K. – Stockach",
      "type": "Registerbekanntmachung nach dem Umwandlungsgesetz",
      "state": "Baden-Württemberg",
      "amtsgericht": "Amtsgericht Freiburg",
      "registernummer": "HRA 706602",
      "registerart": "HRA",
      "company_name": "Maier Partyservice & Catering Bastian Maier e.K.",
      "company_seat": "Stockach",
      "details": "18.12.2024 (Bekanntmachungsdatum)\n\nBaden-Württemberg Amtsgericht Freiburg HRA 706602\nRegisterbekanntmachung nach dem Umwandlungsgesetz 18.12.2024 (Eintragungsdatum)\n\nMaier Partyservice & Catering Bastian Maier e.K.\nEinzelkaufmann / Einzelkauffrau\nStockach\n\nDen Gläubigern der an der Ausgliederung beteiligten Rechtsträger ist, wenn sie binnen sechs Monaten nach dem Tag, an dem die Eintragung der Ausgliederung in das Register des Sitzes desjenigen Rechtsträgers, dessen Gläubiger sie sind, nach § 19 Abs. 3 UmwG als bekanntgemacht gilt, ihren Anspruch nach Grund und Höhe schriftlich anmelden, Sicherheit zu leisten, soweit sie nicht Befriedigung verlangen können. Dieses Recht steht den Gläubigern jedoch nur zu, wenn sie glaubhaft machen, dass durch die Ausgliederung die Erfüllung ihrer Forderung gefährdet wird."
    },
    {
      "date": "2024-12-18",
      "id": "96781",
      "original_text": "Einreichung neuer Dokumente\nBaden-Württemberg Amtsgericht Mannheim HRB 740361\nAgosi AG – Pforzheim",
      "type": "Einreichung neuer Dokumente",
      "state": "Baden-Württemberg",
      "amtsgericht": "Amtsgericht Mannheim",
      "registernummer": "HRB 740361",
      "registerart": "HRB",
      "company_name": "Agosi AG",
      "company_seat": "Pforzheim",
      "details": "18.12.2024 (Bekanntmachungsdatum)\n\nBaden-Württemberg Amtsgericht Mannheim HRB 740361\nEinreichung neuer Dokumente\n\nAgosi AG\nAktiengesellschaft\nPforzheim\n\nDie Gesellschaft hat am 17.12.2024 die Liste über die Zusammensetzung des Aufsichtsrats zum Handelsregister eingereicht."
    },
    {
      "date": "2024-12-18",
      "id": "96782",
      "original_text": "Registerbekanntmachung nach dem Umwandlungsgesetz\nBaden-Württemberg Amtsgericht Mannheim HRB 752994\nMain Projektbau GmbH – Grünsfeld",
      "type": "Registerbekanntmachung nach dem Umwandlungsgesetz",
      "state": "Baden-Württemberg",
      "amtsgericht": "Amtsgericht Mannheim",
      "registernummer": "HRB 752994",
      "registerart": "HRB",
      "company_name": "Main Projektbau GmbH",
      "company_seat": "Grünsfeld",
      "details": "18.12.2024 (Bekanntmachungsdatum)\n\nBaden-Württemberg Amtsgericht Mannheim HRB 752994\nRegisterbekanntmachung nach dem Umwandlungsgesetz 17.12.2024 (Eintragungsdatum)\n\nMain Projektbau GmbH\nGesellschaft mit beschränkter Haftung\nGrünsfeld\n\nDen Gläubigern der an der Ausgliederung beteiligten Rechtsträger ist, wenn sie binnen sechs Monaten nach dem Tag, an dem die Eintragung der Ausgliederung in das Register des Sitzes desjenigen Rechtsträgers, dessen Gläubiger sie sind, nach § 19 Abs. 3 UmwG als bekanntgemacht gilt, ihren Anspruch nach Grund und Höhe schriftlich anmelden, Sicherheit zu leisten, soweit sie nicht Befriedigung verlangen können. Dieses Recht steht den Gläubigern jedoch nur zu, wenn sie glaubhaft machen, dass durch die Ausgliederung die Erfüllung ihrer Forderung gefährdet wird."
    },
    {
      "date": "2024-12-18",
      "id": "96783",
      "original_text": "Registerbekanntmachung nach dem Umwandlungsgesetz\nSchleswig-Holstein Amtsgericht Kiel HRB 991 NM\nGPE- Plast Engineering GmbH – Neumünster",
      "type": "Registerbekanntmachung nach dem Umwandlungsgesetz",
      "state": "Schleswig-Holstein",
      "amtsgericht": "Amtsgericht Kiel",
      "registernummer": "HRB 991 NM",
      "registerart": "HRB",
      "company_name": "GPE- Plast Engineering GmbH",
      "company_seat": "Neumünster",
      "details": "18.12.2024 (Bekanntmachungsdatum)\n\nSchleswig-Holstein Amtsgericht Kiel HRB 991 NM\nRegisterbekanntmachung nach dem Umwandlungsgesetz 17.12.2024 (Eintragungsdatum)\n\nGPE- Plast Engineering GmbH\nGesellschaft mit beschränkter Haftung\nNeumünster\n\nAls nicht eingetragen wird veröffentlicht: Den Gläubigern der an der Verschmelzung beteiligten Rechtsträger ist, wenn sie binnen sechs Monaten nach dem Tag, an dem die Eintragung der Verschmelzung in das Register des Sitzes desjenigen Rechtsträgers, dessen Gläubiger sie sind, nach § 19 Abs. 3 UmwG bekannt gemacht worden ist, ihren Anspruch nach Grund und Höhe schriftlich anmelden, Sicherheit zu leisten, soweit sie nicht Befriedigung verlangen können. Dieses Recht steht den Gläubigern jedoch nur zu, wenn sie glaubhaft machen, dass durch die Verschmelzung die Erfüllung ihrer Forderung gefährdet wird."
    },
    {
      "date": "2024-12-18",
      "id": "96784",
      "original_text": "Registerbekanntmachung nach dem Umwandlungsgesetz\nBerlin Amtsgericht Berlin (Charlottenburg) HRB 202040\nParadyse Berlin Publishing GmbH – Berlin",
      "type": "Registerbekanntmachung nach dem Umwandlungsgesetz",
      "state": "Berlin",
      "amtsgericht": "Amtsgericht Berlin (Charlottenburg)",
      "registernummer": "HRB 202040",
      "registerart": "HRB",
      "company_name": "Paradyse Berlin Publishing GmbH",
      "company_seat": "Berlin",
      "details": "18.12.2024 (Bekanntmachungsdatum)\n\nBerlin Amtsgericht Berlin (Charlottenburg) HRB 202040\nRegisterbekanntmachung nach dem Umwandlungsgesetz 17.12.2024 (Eintragungsdatum)\n\nParadyse Berlin Publishing GmbH\nGesellschaft mit beschränkter Haftung\nBerlin\n\nZu Eintragungsnummer 9 vom 17.12.2024 wird als nicht eingetragen veröffentlicht:\n\nDen Gläubigern der an der Spaltung beteiligten Rechtsträger ist, wenn sie binnen sechs Monaten nach dem Tag, an dem die Eintragung der Spaltung in das Register des Sitzes desjenigen Rechtsträgers, dessen Gläubiger sie sind, als bekannt gemacht gilt, ihren Anspruch nach Grund und Höhe schriftlich anmelden, Sicherheit zu leisten, soweit sie nicht Befriedigung verlangen können. Dieses Recht steht den Gläubigern jedoch nur zu, wenn sie glaubhaft machen, dass durch die Spaltung die Erfüllung ihrer Forderung gefährdet wird. Das Recht, Sicherheitsleistung zu verlangen, steht Gläubigern nicht zu, die im Falle der Insolvenz ein Recht auf vorzugsweise Befriedigung aus einer Deckungsmasse haben, die nach gesetzlicher Vorschrift zu ihrem Schutz errichtet und staatlich überwacht ist."
    },
    {
      "date": "2024-12-18",
      "id": "96785",
      "original_text": "Registerbekanntmachung nach dem Umwandlungsgesetz\nBaden-Württemberg Amtsgericht Stuttgart HRB 753413\nAUTOflex GmbH – Gundelsheim",
      "type": "Registerbekanntmachung nach dem Umwandlungsgesetz",
      "state": "Baden-Württemberg",
      "amtsgericht": "Amtsgericht Stuttgart",
      "registernummer": "HRB 753413",
      "registerart": "HRB",
      "company_name": "AUTOflex GmbH",
      "company_seat": "Gundelsheim",
      "details": "18.12.2024 (Bekanntmachungsdatum)\n\nBaden-Württemberg Amtsgericht Stuttgart HRB 753413\nRegisterbekanntmachung nach dem Umwandlungsgesetz 18.12.2024 (Eintragungsdatum)\n\nAUTOflex GmbH\nGesellschaft mit beschränkter Haftung\nGundelsheim\n\nAls nicht eingetragen wird bekanntgemacht:\nDen Gläubigern der an der Verschmelzung beteiligten Rechtsträger ist, wenn sie binnen sechs Monaten nach dem Tag, an dem die Eintragung der Verschmelzung in das Register des Sitzes desjenigen Rechtsträgers, dessen Gläubiger sie sind, nach § 19 Abs. 3 UmwG als bekanntgemacht gilt, ihren Anspruch nach Grund und Höhe schriftlich anmelden, Sicherheit zu leisten, soweit sie nicht Befriedigung verlangen können. Dieses Recht steht den Gläubigern jedoch nur zu, wenn sie glaubhaft machen, dass durch die Verschmelzung die Erfüllung ihrer Forderung gefährdet wird."
    },
    {
      "date": "2024-12-18",
      "id": "96786",
      "original_text": "Registerbekanntmachung nach dem Umwandlungsgesetz\nSchleswig-Holstein Amtsgericht Kiel HRB 25451\nMulticon Beteiligungs GmbH – Neumünster",
      "type": "Registerbekanntmachung nach dem Umwandlungsgesetz",
      "state": "Schleswig-Holstein",
      "amtsgericht": "Amtsgericht Kiel",
      "registernummer": "HRB 25451",
      "registerart": "HRB",
      "company_name": "Multicon Beteiligungs GmbH",
      "company_seat": "Neumünster",
      "details": "18.12.2024 (Bekanntmachungsdatum)\n\nSchleswig-Holstein Amtsgericht Kiel HRB 25451\nRegisterbekanntmachung nach dem Umwandlungsgesetz 17.12.2024 (Eintragungsdatum)\n\nMulticon Beteiligungs GmbH\nGesellschaft mit beschränkter Haftung\nNeumünster\n\nAls nicht eingetragen wird veröffentlicht: Den Gläubigern der an der Verschmelzung beteiligten Rechtsträger ist, wenn sie binnen sechs Monaten nach dem Tag, an dem die Eintragung der Verschmelzung in das Register des Sitzes desjenigen Rechtsträgers, dessen Gläubiger sie sind, nach § 19 Abs. 3 UmwG bekannt gemacht worden ist, ihren Anspruch nach Grund und Höhe schriftlich anmelden, Sicherheit zu leisten, soweit sie nicht Befriedigung verlangen können. Dieses Recht steht den Gläubigern jedoch nur zu, wenn sie glaubhaft machen, dass durch die Verschmelzung die Erfüllung ihrer Forderung gefährdet wird."
    },
    {
      "date": "2024-12-18",
      "id": "96787",
      "original_text": "Einreichung neuer Dokumente\nBaden-Württemberg Amtsgericht Freiburg HRB 930\nStadtwerke Freiburg GmbH – Freiburg im Breisgau",
      "type": "Einreichung neuer Dokumente",
      "state": "Baden-Württemberg",
      "amtsgericht": "Amtsgericht Freiburg",
      "registernummer": "HRB 930",
      "registerart": "HRB",
      "company_name": "Stadtwerke Freiburg GmbH",
      "company_seat": "Freiburg im Breisgau",
      "details": "18.12.2024 (Bekanntmachungsdatum)\n\nBaden-Württemberg Amtsgericht Freiburg HRB 930\nEinreichung neuer Dokumente\n\nStadtwerke Freiburg GmbH\nGesellschaft mit beschränkter Haftung\nFreiburg im Breisgau\n\nDie Gesellschaft hat am 17.12.2024 die Liste über die Zusammensetzung des Aufsichtsrats zum Handelsregister eingereicht."
    },
    {
      "date": "2024-12-18",
      "id": "96788",
      "original_text": "Registerbekanntmachung nach dem Umwandlungsgesetz\nHamburg Amtsgericht Hamburg HRB 69538\nNWL Germany Production GmbH – Hamburg",
      "type": "Registerbekanntmachung nach dem Umwandlungsgesetz",
      "state": "Hamburg",
      "amtsgericht": "Amtsgericht Hamburg",
      "registernummer": "HRB 69538",
      "registerart": "HRB",
      "company_name": "NWL Germany Production GmbH",
      "company_seat": "Hamburg",
      "details": "18.12.2024 (Bekanntmachungsdatum)\n\nHamburg Amtsgericht Hamburg HRB 69538\nRegisterbekanntmachung nach dem Umwandlungsgesetz 18.12.2024 (Eintragungsdatum)\n\nNWL Germany Production GmbH\nGesellschaft mit beschränkter Haftung\nHamburg\n\nAls nicht eingetragen wird bekannt gemacht:\nDen Gläubigern der an der Verschmelzung beteiligten Gesellschaften ist, wenn sie binnen sechs Monaten nach dem Tag, an dem die Eintragung der Verschmelzung in das Register des Sitzes desjenigen Rechtsträgers, dessen Gläubiger sie sind, nach § 19 Absatz 3 UmwG als bekannt gemacht gilt, ihren Anspruch nach Grund und Höhe schriftlich anmelden, Sicherheit zu leisten, soweit sie nicht Befriedigung verlangen können. Dieses Recht steht den Gläubigern jedoch nur zu, wenn sie glaubhaft machen, dass durch die Verschmelzung die Erfüllung ihrer Forderung gefährdet wird."
    },
    {
      "date": "2024-12-18",
      "id": "96789",
      "original_text": "Registerbekanntmachung nach dem Umwandlungsgesetz\nHamburg Amtsgericht Hamburg HRB 69538\nNWL Germany Production GmbH – Hamburg",
      "type": "Registerbekanntmachung nach dem Umwandlungsgesetz",
      "state": "Hamburg",
      "amtsgericht": "Amtsgericht Hamburg",
      "registernummer": "HRB 69538",
      "registerart": "HRB",
      "company_name": "NWL Germany Production GmbH",
      "company_seat": "Hamburg",
      "details": "18.12.2024 (Bekanntmachungsdatum)\n\nHamburg Amtsgericht Hamburg HRB 69538\nRegisterbekanntmachung nach dem Umwandlungsgesetz 18.12.2024 (Eintragungsdatum)\n\nNWL Germany Production GmbH\nGesellschaft mit beschränkter Haftung\nHamburg\n\nAls nicht eingetragen wird bekannt gemacht:\nDen Gläubigern der an der Verschmelzung beteiligten Gesellschaften ist, wenn sie binnen sechs Monaten nach dem Tag, an dem die Eintragung der Verschmelzung in das Register des Sitzes desjenigen Rechtsträgers, dessen Gläubiger sie sind, nach § 19 Absatz 3 UmwG als bekannt gemacht gilt, ihren Anspruch nach Grund und Höhe schriftlich anmelden, Sicherheit zu leisten, soweit sie nicht Befriedigung verlangen können. Dieses Recht steht den Gläubigern jedoch nur zu, wenn sie glaubhaft machen, dass durch die Verschmelzung die Erfüllung ihrer Forderung gefährdet wird."
    },
    {
      "date": "2024-12-18",
      "id": "96790",
      "original_text": "Registerbekanntmachung nach dem Umwandlungsgesetz\nHamburg Amtsgericht Hamburg HRB 133037\nNewell Brands Germany GmbH – Hamburg",
      "type": "Registerbekanntmachung nach dem Umwandlungsgesetz",
      "state": "Hamburg",
      "amtsgericht": "Amtsgericht Hamburg",
      "registernummer": "HRB 133037",
      "registerart": "HRB",
      "company_name": "Newell Brands Germany GmbH",
      "company_seat": "Hamburg",
      "details": "18.12.2024 (Bekanntmachungsdatum)\n\nHamburg Amtsgericht Hamburg HRB 133037\nRegisterbekanntmachung nach dem Umwandlungsgesetz 18.12.2024 (Eintragungsdatum)\n\nNewell Brands Germany GmbH\nGesellschaft mit beschränkter Haftung\nHamburg\n\nAls nicht eingetragen wird bekannt gemacht:\nDen Gläubigern der an der Verschmelzung beteiligten Gesellschaften ist, wenn sie binnen sechs Monaten nach dem Tag, an dem die Eintragung der Verschmelzung in das Register des Sitzes desjenigen Rechtsträgers, dessen Gläubiger sie sind, nach § 19 Absatz 3 UmwG als bekannt gemacht gilt, ihren Anspruch nach Grund und Höhe schriftlich anmelden, Sicherheit zu leisten, soweit sie nicht Befriedigung verlangen können. Dieses Recht steht den Gläubigern jedoch nur zu, wenn sie glaubhaft machen, dass durch die Verschmelzung die Erfüllung ihrer Forderung gefährdet wird."
    },
    {
      "date": "2024-12-18",
      "id": "96791",
      "original_text": "Registerbekanntmachung nach dem Umwandlungsgesetz\nHamburg Amtsgericht Hamburg HRB 189210\nSummit Holding GmbH – Hamburg",
      "type": "Registerbekanntmachung nach dem Umwandlungsgesetz",
      "state": "Hamburg",
      "amtsgericht": "Amtsgericht Hamburg",
      "registernummer": "HRB 189210",
      "registerart": "HRB",
      "company_name": "Summit Holding GmbH",
      "company_seat": "Hamburg",
      "details": "18.12.2024 (Bekanntmachungsdatum)\n\nHamburg Amtsgericht Hamburg HRB 189210\nRegisterbekanntmachung nach dem Umwandlungsgesetz 18.12.2024 (Eintragungsdatum)\n\nSummit Holding GmbH\nGesellschaft mit beschränkter Haftung\nHamburg\n\nAls nicht eingetragen wird bekannt gemacht:\nDen Gläubigern der an der Verschmelzung beteiligten Gesellschaften ist, wenn sie binnen sechs Monaten nach dem Tag, an dem die Eintragung der Verschmelzung in das Register des Sitzes desjenigen Rechtsträgers, dessen Gläubiger sie sind, nach § 19 Absatz 3 UmwG als bekannt gemacht gilt, ihren Anspruch nach Grund und Höhe schriftlich anmelden, Sicherheit zu leisten, soweit sie nicht Befriedigung verlangen können. Dieses Recht steht den Gläubigern jedoch nur zu, wenn sie glaubhaft machen, dass durch die Verschmelzung die Erfüllung ihrer Forderung gefährdet wird."
    },
    {
      "date": "2024-12-18",
      "id": "96792",
      "original_text": "Sonstige Registerbekanntmachung\nHamburg Amtsgericht Hamburg HRB 189210\nSummit Holding GmbH – Hamburg",
      "type": "Sonstige Registerbekanntmachung",
      "state": "Hamburg",
      "amtsgericht": "Amtsgericht Hamburg",
      "registernummer": "HRB 189210",
      "registerart": "HRB",
      "company_name": "Summit Holding GmbH",
      "company_seat": "Hamburg",
      "details": "18.12.2024 (Bekanntmachungsdatum)\n\nHamburg Amtsgericht Hamburg HRB 189210\nSonstige Registerbekanntmachung 18.12.2024 (Eintragungsdatum)\n\nSummit Holding GmbH\nGesellschaft mit beschränkter Haftung\nHamburg\n\nAls nicht eingetragen wird bekannt gemacht:  Den Gläubigern der Gesellschaft, deren Forderungen begründet worden sind, bevor die Eintragung der Vertragsbeendigung in das Handelsregister nach § 10 HGB als bekannt gemacht gilt, ist vom anderen Vertragsteil Sicherheit zu leisten, wenn sie sich binnen 6 Monaten nach Bekanntmachung der Eintragung zu diesem Zweck bei ihm melden."
    },
    {
      "date": "2024-12-18",
      "id": "96793",
      "original_text": "Registerbekanntmachung nach dem Umwandlungsgesetz\nHamburg Amtsgericht Hamburg HRB 114854\nNewell Rubbermaid German Holding GmbH – Hamburg",
      "type": "Registerbekanntmachung nach dem Umwandlungsgesetz",
      "state": "Hamburg",
      "amtsgericht": "Amtsgericht Hamburg",
      "registernummer": "HRB 114854",
      "registerart": "HRB",
      "company_name": "Newell Rubbermaid German Holding GmbH",
      "company_seat": "Hamburg",
      "details": "18.12.2024 (Bekanntmachungsdatum)\n\nHamburg Amtsgericht Hamburg HRB 114854\nRegisterbekanntmachung nach dem Umwandlungsgesetz 18.12.2024 (Eintragungsdatum)\n\nNewell Rubbermaid German Holding GmbH\nGesellschaft mit beschränkter Haftung\nHamburg\n\nAls nicht eingetragen wird bekannt gemacht:\nDen Gläubigern der an der Verschmelzung beteiligten Gesellschaften ist, wenn sie binnen sechs Monaten nach dem Tag, an dem die Eintragung der Verschmelzung in das Register des Sitzes desjenigen Rechtsträgers, dessen Gläubiger sie sind, nach § 19 Absatz 3 UmwG als bekannt gemacht gilt, ihren Anspruch nach Grund und Höhe schriftlich anmelden, Sicherheit zu leisten, soweit sie nicht Befriedigung verlangen können. Dieses Recht steht den Gläubigern jedoch nur zu, wenn sie glaubhaft machen, dass durch die Verschmelzung die Erfüllung ihrer Forderung gefährdet wird."
    },
    {
      "date": "2024-12-18",
      "id": "96794",
      "original_text": "Registerbekanntmachung nach dem Umwandlungsgesetz\nHamburg Amtsgericht Hamburg HRB 143985\nNWL Germany Services GmbH – Hamburg",
      "type": "Registerbekanntmachung nach dem Umwandlungsgesetz",
      "state": "Hamburg",
      "amtsgericht": "Amtsgericht Hamburg",
      "registernummer": "HRB 143985",
      "registerart": "HRB",
      "company_name": "NWL Germany Services GmbH",
      "company_seat": "Hamburg",
      "details": "18.12.2024 (Bekanntmachungsdatum)\n\nHamburg Amtsgericht Hamburg HRB 143985\nRegisterbekanntmachung nach dem Umwandlungsgesetz 18.12.2024 (Eintragungsdatum)\n\nNWL Germany Services GmbH\nGesellschaft mit beschränkter Haftung\nHamburg\n\nAls nicht eingetragen wird bekannt gemacht:\nDen Gläubigern der an der Verschmelzung beteiligten Gesellschaften ist, wenn sie binnen sechs Monaten nach dem Tag, an dem die Eintragung der Verschmelzung in das Register des Sitzes desjenigen Rechtsträgers, dessen Gläubiger sie sind, nach § 19 Absatz 3 UmwG als bekannt gemacht gilt, ihren Anspruch nach Grund und Höhe schriftlich anmelden, Sicherheit zu leisten, soweit sie nicht Befriedigung verlangen können. Dieses Recht steht den Gläubigern jedoch nur zu, wenn sie glaubhaft machen, dass durch die Verschmelzung die Erfüllung ihrer Forderung gefährdet wird."
    },
    {
      "date": "2024-12-18",
      "id": "96795",
      "original_text": "Sonstige Registerbekanntmachung\nHamburg Amtsgericht Hamburg HRB 143985\nNWL Germany Services GmbH – Hamburg",
      "type": "Sonstige Registerbekanntmachung",
      "state": "Hamburg",
      "amtsgericht": "Amtsgericht Hamburg",
      "registernummer": "HRB 143985",
      "registerart": "HRB",
      "company_name": "NWL Germany Services GmbH",
      "company_seat": "Hamburg",
      "details": "18.12.2024 (Bekanntmachungsdatum)\n\nHamburg Amtsgericht Hamburg HRB 143985\nSonstige Registerbekanntmachung 18.12.2024 (Eintragungsdatum)\n\nNWL Germany Services GmbH\nGesellschaft mit beschränkter Haftung\nHamburg\n\nAls nicht eingetragen wird bekannt gemacht:  Den Gläubigern der Gesellschaft, deren Forderungen begründet worden sind, bevor die Eintragung der Vertragsbeendigung in das Handelsregister nach § 10 HGB als bekannt gemacht gilt, ist vom anderen Vertragsteil Sicherheit zu leisten, wenn sie sich binnen 6 Monaten nach Bekanntmachung der Eintragung zu diesem Zweck bei ihm melden."
    },
    {
      "date": "2024-12-18",
      "id": "96796",
      "original_text": "Einreichung neuer Dokumente\nSachsen-Anhalt Amtsgericht Stendal HRB 209455\nGWG Wohnungsgesellschaft Naumburg mbH – Naumburg",
      "type": "Einreichung neuer Dokumente",
      "state": "Sachsen-Anhalt",
      "amtsgericht": "Amtsgericht Stendal",
      "registernummer": "HRB 209455",
      "registerart": "HRB",
      "company_name": "GWG Wohnungsgesellschaft Naumburg mbH",
      "company_seat": "Naumburg",
      "details": "18.12.2024 (Bekanntmachungsdatum)\n\nSachsen-Anhalt Amtsgericht Stendal HRB 209455\nEinreichung neuer Dokumente\n\nGWG Wohnungsgesellschaft Naumburg mbH\nGesellschaft mit beschränkter Haftung\nNaumburg\n\nEine Liste der Mitglieder des Aufsichtsrates wurde zum Handelsregister eingereicht."
    },
    {
      "date": "2024-12-18",
      "id": "96797",
      "original_text": "Sonstige Registerbekanntmachung\nHamburg Amtsgericht Hamburg HRB 62827\nAhlrep Elektrogroßhandel Aktiengesellschaft – Hamburg",
      "type": "Sonstige Registerbekanntmachung",
      "state": "Hamburg",
      "amtsgericht": "Amtsgericht Hamburg",
      "registernummer": "HRB 62827",
      "registerart": "HRB",
      "company_name": "Ahlrep Elektrogroßhandel Aktiengesellschaft",
      "company_seat": "Hamburg",
      "details": "18.12.2024 (Bekanntmachungsdatum)\n\nHamburg Amtsgericht Hamburg HRB 62827\nSonstige Registerbekanntmachung 18.12.2024 (Eintragungsdatum)\n\nAhlrep Elektrogroßhandel Aktiengesellschaft\nAktiengesellschaft\nHamburg\n\nDie Gesellschaft hat Gläubigern, deren Forderungen vor dieser Bekanntmachung begründet worden sind, Sicherheit zu leisten, soweit sie nicht Befriedigung verlangen können, wenn sie sich binnen sechs Monaten zu diesem Zweck melden."
    },
    {
      "date": "2024-12-18",
      "id": "96798",
      "original_text": "Einreichung neuer Dokumente\nSchleswig-Holstein Amtsgericht Pinneberg HRB 8648\nEnbycon Holding AG – Pinneberg",
      "type": "Einreichung neuer Dokumente",
      "state": "Schleswig-Holstein",
      "amtsgericht": "Amtsgericht Pinneberg",
      "registernummer": "HRB 8648",
      "registerart": "HRB",
      "company_name": "Enbycon Holding AG",
      "company_seat": "Pinneberg",
      "details": "18.12.2024 (Bekanntmachungsdatum)\n\nSchleswig-Holstein Amtsgericht Pinneberg HRB 8648\nEinreichung neuer Dokumente\n\nEnbycon Holding AG\nAktiengesellschaft\nPinneberg\n\nAls nicht eingetragen wird veröffentlicht: gem. §106 AktG ist die Liste der Aufsichtsratsmitglieder beim Handelsregister eingereicht worden."
    },
    {
      "date": "2024-12-18",
      "id": "96799",
      "original_text": "Einreichung neuer Dokumente\nBaden-Württemberg Amtsgericht Stuttgart HRB 411302\nZollernalb Klinikum gGmbH – Balingen",
      "type": "Einreichung neuer Dokumente",
      "state": "Baden-Württemberg",
      "amtsgericht": "Amtsgericht Stuttgart",
      "registernummer": "HRB 411302",
      "registerart": "HRB",
      "company_name": "Zollernalb Klinikum gGmbH",
      "company_seat": "Balingen",
      "details": "18.12.2024 (Bekanntmachungsdatum)\n\nBaden-Württemberg Amtsgericht Stuttgart HRB 411302\nEinreichung neuer Dokumente\n\nZollernalb Klinikum gGmbH\nGesellschaft mit beschränkter Haftung\nBalingen\n\nDie Gesellschaft hat am 18.12.2024 die Liste über die Zusammensetzung des Aufsichtsrats zum Handelsregister eingereicht."
    },
    {
      "date": "2024-12-18",
      "id": "96800",
      "original_text": "Einreichung neuer Dokumente\nBaden-Württemberg Amtsgericht Mannheim HRB 714673\nEXA AG – Heidelberg",
      "type": "Einreichung neuer Dokumente",
      "state": "Baden-Württemberg",
      "amtsgericht": "Amtsgericht Mannheim",
      "registernummer": "HRB 714673",
      "registerart": "HRB",
      "company_name": "EXA AG",
      "company_seat": "Heidelberg",
      "details": "18.12.2024 (Bekanntmachungsdatum)\n\nBaden-Württemberg Amtsgericht Mannheim HRB 714673\nEinreichung neuer Dokumente\n\nEXA AG\nAktiengesellschaft\nHeidelberg\n\nDie Gesellschaft hat am 03.12.2024 die Liste über die Zusammensetzung des Aufsichtsrats zum Handelsregister eingereicht."
    },
    {
      "date": "2024-12-18",
      "id": "96801",
      "original_text": "Löschungsankündigung\nBerlin Amtsgericht Berlin (Charlottenburg) HRB 172455\nBPG Unternehmergesellschaft (haftungsbeschränkt) – Berlin",
      "type": "Löschungsankündigung",
      "state": "Berlin",
      "amtsgericht": "Amtsgericht Berlin (Charlottenburg)",
      "registernummer": "HRB 172455",
      "registerart": "HRB",
      "company_name": "BPG Unternehmergesellschaft (haftungsbeschränkt)",
      "company_seat": "Berlin",
      "details": "18.12.2024 (Bekanntmachungsdatum)\n\nBerlin Amtsgericht Berlin (Charlottenburg) HRB 172455\nLöschungsankündigung\n\nBPG Unternehmergesellschaft (haftungsbeschränkt)\nGesellschaft mit beschränkter Haftung\nBerlin\n\nBei der nachstehenden Gesellschaft wird das Amtslöschungsverfahren gemäß § 394 FamFG eingeleitet. Widerspruchsfrist 6 Wochen"
    },
    {
      "date": "2024-12-18",
      "id": "96802",
      "original_text": "Löschungsankündigung\nSchleswig-Holstein Amtsgericht Pinneberg HRB 15842\nSWEDSUB GmbH – Elmshorn",
      "type": "Löschungsankündigung",
      "state": "Schleswig-Holstein",
      "amtsgericht": "Amtsgericht Pinneberg",
      "registernummer": "HRB 15842",
      "registerart": "HRB",
      "company_name": "SWEDSUB GmbH",
      "company_seat": "Elmshorn",
      "details": "18.12.2024 (Bekanntmachungsdatum)\n\nSchleswig-Holstein Amtsgericht Pinneberg HRB 15842\nLöschungsankündigung\n\nSWEDSUB GmbH\nGesellschaft mit beschränkter Haftung\nElmshorn\n\nEs ist die Löschung der nachstehenden Gesellschaft wegen Vermögenslosigkeit gemäß § 394 FamFG beabsichtigt. Widerspruchsfrist: 2 Monate."
    },
    {
      "date": "2024-12-18",
      "id": "96803",
      "original_text": "Sonstige Registerbekanntmachung\nBaden-Württemberg Amtsgericht Ulm HRB 721859\nDIVACO AG – Langenburg",
      "type": "Sonstige Registerbekanntmachung",
      "state": "Baden-Württemberg",
      "amtsgericht": "Amtsgericht Ulm",
      "registernummer": "HRB 721859",
      "registerart": "HRB",
      "company_name": "DIVACO AG",
      "company_seat": "Langenburg",
      "details": "18.12.2024 (Bekanntmachungsdatum)\n\nBaden-Württemberg Amtsgericht Ulm HRB 721859\nSonstige Registerbekanntmachung 18.12.2024 (Eintragungsdatum)\n\nDIVACO AG\nAktiengesellschaft\nLangenburg\n\nDie Gesellschaft hat am 17.12.2024 die Liste über die Zusammensetzung des Aufsichtsrats zum Handelsregister eingereicht."
    },
    {
      "date": "2024-12-18",
      "id": "96804",
      "original_text": "Einreichung neuer Dokumente\nBerlin Amtsgericht Berlin (Charlottenburg) HRB 162198\nDAM Professional School SE – Berlin",
      "type": "Einreichung neuer Dokumente",
      "state": "Berlin",
      "amtsgericht": "Amtsgericht Berlin (Charlottenburg)",
      "registernummer": "HRB 162198",
      "registerart": "HRB",
      "company_name": "DAM Professional School SE",
      "company_seat": "Berlin",
      "details": "18.12.2024 (Bekanntmachungsdatum)\n\nBerlin Amtsgericht Berlin (Charlottenburg) HRB 162198\nEinreichung neuer Dokumente\n\nDAM Professional School SE\nEuropäische Aktiengesellschaft (SE)\nBerlin\n\nAls nicht eingetragen wird veröffentlicht:Es wurde eine neue Liste der Aufsichtsratsmitglieder eingereicht (§ 106 AktG)."
    },
    {
      "date": "2024-12-18",
      "id": "96805",
      "original_text": "Löschungsankündigung\nBaden-Württemberg Amtsgericht Mannheim HRA 704738\nAFRIKA! Zirkus- & Veranstaltungs GmbH & Co. KG – Mannheim",
      "type": "Löschungsankündigung",
      "state": "Baden-Württemberg",
      "amtsgericht": "Amtsgericht Mannheim",
      "registernummer": "HRA 704738",
      "registerart": "HRA",
      "company_name": "AFRIKA! Zirkus- & Veranstaltungs GmbH & Co. KG",
      "company_seat": "Mannheim",
      "details": "18.12.2024 (Bekanntmachungsdatum)\n\nBaden-Württemberg Amtsgericht Mannheim HRA 704738\nLöschungsankündigung\n\nAFRIKA! Zirkus- & Veranstaltungs GmbH & Co. KG\nKommanditgesellschaft\nMannheim\n\nAls nicht eingetragen wird bekanntgemacht: Das Gericht beabsichtigt, die Gesellschaft wegen Vermögenslosigkeit im Handelsregister von Amts wegen nach § 394 FamFG zu löschen. Die Frist zur Geltendmachung eines Widerspruchs gegen die beabsichtigte Löschung ist auf einen Monat ab Veröffentlichung bestimmt."
    },
    {
      "date": "2024-12-18",
      "id": "96806",
      "original_text": "Sonstige Registerbekanntmachung\nBaden-Württemberg Amtsgericht Stuttgart HRB 581037\nW E - Beteiligungs-GmbH – Neckarsulm",
      "type": "Sonstige Registerbekanntmachung",
      "state": "Baden-Württemberg",
      "amtsgericht": "Amtsgericht Stuttgart",
      "registernummer": "HRB 581037",
      "registerart": "HRB",
      "company_name": "W E - Beteiligungs-GmbH",
      "company_seat": "Neckarsulm",
      "details": "18.12.2024 (Bekanntmachungsdatum)\n\nBaden-Württemberg Amtsgericht Stuttgart HRB 581037\nSonstige Registerbekanntmachung 17.12.2024 (Eintragungsdatum)\n\nW E - Beteiligungs-GmbH\nGesellschaft mit beschränkter Haftung\nNeckarsulm\n\nDen Gläubigern der Gesellschaft, deren Forderungen begründet worden sind, bevor die Eintragung der Beendigung des Vertrages in das Handelsregister nach § 10 HGB als bekanntgemacht gilt, ist vom anderen Vertragsteil Sicherheit zu leisten, wenn sie sich binnen sechs Monaten nach der Bekanntmachung zu diesem Zweck bei ihm melden."
    },
    {
      "date": "2024-12-18",
      "id": "96807",
      "original_text": "Einreichung neuer Dokumente\nBerlin Amtsgericht Berlin (Charlottenburg) HRB 97815\nGVA Grund- und Vermögensanlagen Aktiengesellschaft – Berlin",
      "type": "Einreichung neuer Dokumente",
      "state": "Berlin",
      "amtsgericht": "Amtsgericht Berlin (Charlottenburg)",
      "registernummer": "HRB 97815",
      "registerart": "HRB",
      "company_name": "GVA Grund- und Vermögensanlagen Aktiengesellschaft",
      "company_seat": "Berlin",
      "details": "18.12.2024 (Bekanntmachungsdatum)\n\nBerlin Amtsgericht Berlin (Charlottenburg) HRB 97815\nEinreichung neuer Dokumente\n\nGVA Grund- und Vermögensanlagen Aktiengesellschaft\nAktiengesellschaft\nBerlin\n\nAls nicht eingetragen wird veröffentlicht:\n\nEs wurde eine neue Liste der Aufsichtsratsmitglieder eingereicht (§ 106 AktG)."
    },
    {
      "date": "2024-12-18",
      "id": "96808",
      "original_text": "Registerbekanntmachung nach dem Umwandlungsgesetz\nNordrhein-Westfalen Amtsgericht Coesfeld HRA 5750\nHerbert Frede e.K. – Havixbeck",
      "type": "Registerbekanntmachung nach dem Umwandlungsgesetz",
      "state": "Nordrhein-Westfalen",
      "amtsgericht": "Amtsgericht Coesfeld",
      "registernummer": "HRA 5750",
      "registerart": "HRA",
      "company_name": "Herbert Frede e.K.",
      "company_seat": "Havixbeck",
      "details": "18.12.2024 (Bekanntmachungsdatum)\n\nNordrhein-Westfalen Amtsgericht Coesfeld HRA 5750\nRegisterbekanntmachung nach dem Umwandlungsgesetz 13.12.2024 (Eintragungsdatum)\n\nHerbert Frede e.K.\nEinzelkaufmann\nHavixbeck\n\nDen Gläubigern der an der Ausgliederung beteiligten Rechtsträger ist, wenn sie binnen sechs Monaten nach dem Tag, an dem die Eintragung der Ausgliederung in das Register des Sitzes desjenigen Rechtsträgers, dessen Gläubiger sie sind, nach § 19 Absatz 3 UmwG als bekanntgemacht gilt, ihren Anspruch nach Grund und Höhe schriftlich anmelden, Sicherheit zu leisten, soweit sie nicht Befriedigung verlangen können. Dieses Recht steht den Gläubigern jedoch nur zu, wenn sie glaubhaft machen, dass durch die Erfüllung ihrer Forderung gefährdet wird."
    },
    {
      "date": "2024-12-18",
      "id": "96809",
      "original_text": "Löschungsankündigung\nBrandenburg Amtsgericht Potsdam HRB 39743\nTask Rise GmbH – Nuthe-Urstromtal",
      "type": "Löschungsankündigung",
      "state": "Brandenburg",
      "amtsgericht": "Amtsgericht Potsdam",
      "registernummer": "HRB 39743",
      "registerart": "HRB",
      "company_name": "Task Rise GmbH",
      "company_seat": "Nuthe-Urstromtal",
      "details": "18.12.2024 (Bekanntmachungsdatum)\n\nBrandenburg Amtsgericht Potsdam HRB 39743\nLöschungsankündigung\n\nTask Rise GmbH\nGesellschaft mit beschränkter Haftung\nNuthe-Urstromtal\n\nBei der nachstehenden Gesellschaft wird das Amtslöschungsverfahren gemäß § 394 FamFG eingeleitet. Widerspruchsfrist: 8 Wochen."
    },
    {
      "date": "2024-12-18",
      "id": "96810",
      "original_text": "Registerbekanntmachung nach dem Umwandlungsgesetz\nSaarland Amtsgericht Saarbrücken HRB 14942\nBlue Tank Beteiligungs GmbH – Völklingen",
      "type": "Registerbekanntmachung nach dem Umwandlungsgesetz",
      "state": "Saarland",
      "amtsgericht": "Amtsgericht Saarbrücken",
      "registernummer": "HRB 14942",
      "registerart": "HRB",
      "company_name": "Blue Tank Beteiligungs GmbH",
      "company_seat": "Völklingen",
      "details": "18.12.2024 (Bekanntmachungsdatum)\n\nSaarland Amtsgericht Saarbrücken HRB 14942\nRegisterbekanntmachung nach dem Umwandlungsgesetz 18.12.2024 (Eintragungsdatum)\n\nBlue Tank Beteiligungs GmbH\nGesellschaft mit beschränkter Haftung\nVölklingen\n\nAls nicht eingetragen wird bekannt gemacht: Den Gläubigern der an der Ausgliederung beteiligten Gesellschaften ist, wenn sie binnen sechs Monaten nach dem Tag, an dem die Eintragung der Ausgliederung in das Register des Sitzes desjenigen Rechtsträgers, dessen Gläubiger sie sind, nach § 19 Absatz 3 UmwG bekannt gemacht worden ist, ihren Anspruch nach Grund und Höhe schriftlich anmelden, Sicherheit zu leisten, soweit sie nicht Befriedigung verlangen können. Dieses Recht steht den Gläubigern jedoch nur zu, wenn sie glaubhaft machen, dass durch die Ausgliederung die Erfüllung ihrer Forderung gefährdet wird."
    },
    {
      "date": "2024-12-18",
      "id": "96811",
      "original_text": "Registerbekanntmachung nach dem Umwandlungsgesetz\nSaarland Amtsgericht Saarbrücken HRB 110780\nASAP Projekt GmbH – Überherrn",
      "type": "Registerbekanntmachung nach dem Umwandlungsgesetz",
      "state": "Saarland",
      "amtsgericht": "Amtsgericht Saarbrücken",
      "registernummer": "HRB 110780",
      "registerart": "HRB",
      "company_name": "ASAP Projekt GmbH",
      "company_seat": "Überherrn",
      "details": "18.12.2024 (Bekanntmachungsdatum)\n\nSaarland Amtsgericht Saarbrücken HRB 110780\nRegisterbekanntmachung nach dem Umwandlungsgesetz 18.12.2024 (Eintragungsdatum)\n\nASAP Projekt GmbH\nGesellschaft mit beschränkter Haftung\nÜberherrn\n\nAls nicht eingetragen wird bekannt gemacht: Den Gläubigern der an der Ausgliederung beteiligten Gesellschaften ist, wenn sie binnen sechs Monaten nach dem Tag, an dem die Eintragung der Ausgliederung in das Register des Sitzes desjenigen Rechtsträgers, dessen Gläubiger sie sind, nach § 19 Absatz 3 UmwG bekannt gemacht worden ist, ihren Anspruch nach Grund und Höhe schriftlich anmelden, Sicherheit zu leisten, soweit sie nicht Befriedigung verlangen können. Dieses Recht steht den Gläubigern jedoch nur zu, wenn sie glaubhaft machen, dass durch die Ausgliederung die Erfüllung ihrer Forderung gefährdet wird."
    },
    {
      "date": "2024-12-18",
      "id": "96812",
      "original_text": "Registerbekanntmachung nach dem Umwandlungsgesetz\nBerlin Amtsgericht Berlin (Charlottenburg) HRB 195001\ncorporate benefits holding GmbH – Berlin",
      "type": "Registerbekanntmachung nach dem Umwandlungsgesetz",
      "state": "Berlin",
      "amtsgericht": "Amtsgericht Berlin (Charlottenburg)",
      "registernummer": "HRB 195001",
      "registerart": "HRB",
      "company_name": "corporate benefits holding GmbH",
      "company_seat": "Berlin",
      "details": "18.12.2024 (Bekanntmachungsdatum)\n\nBerlin Amtsgericht Berlin (Charlottenburg) HRB 195001\nRegisterbekanntmachung nach dem Umwandlungsgesetz 17.12.2024 (Eintragungsdatum)\n\ncorporate benefits holding GmbH\nGesellschaft mit beschränkter Haftung\nBerlin\n\nZu Eintragungsnummer 2 vom 17.12.2024 wird als nicht eingetragen veröffentlicht: Den Gläubigern der an der Verschmelzung beteiligten Rechtsträger ist, wenn sie binnen sechs Monaten nach dem Tag, an dem die Eintragung der Verschmelzung in das Register des Sitzes desjenigen Rechtsträgers, dessen Gläubiger sie sind, als bekannt gemacht gilt, ihren Anspruch nach Grund und Höhe schriftlich anmelden, Sicherheit zu leisten, soweit sie nicht Befriedigung verlangen können. Dieses Recht steht den Gläubigern jedoch nur zu, wenn sie glaubhaft machen, dass durch die Verschmelzung die Erfüllung ihrer Forderung gefährdet wird. Das Recht, Sicherheitsleistung zu verlangen, steht Gläubigern nicht zu, die im Falle der Insolvenz ein Recht auf vorzugsweise Befriedigung aus einer Deckungsmasse haben, die nach gesetzlicher Vorschrift zu ihrem Schutz errichtet und staatlich überwacht ist."
    },
    {
      "date": "2024-12-18",
      "id": "96813",
      "original_text": "Löschungsankündigung\nSchleswig-Holstein Amtsgericht Kiel HRB 23680\nVTM Baudienstleistungen GmbH – Neumünster",
      "type": "Löschungsankündigung",
      "state": "Schleswig-Holstein",
      "amtsgericht": "Amtsgericht Kiel",
      "registernummer": "HRB 23680",
      "registerart": "HRB",
      "company_name": "VTM Baudienstleistungen GmbH",
      "company_seat": "Neumünster",
      "details": "18.12.2024 (Bekanntmachungsdatum)\n\nSchleswig-Holstein Amtsgericht Kiel HRB 23680\nLöschungsankündigung\n\nVTM Baudienstleistungen GmbH\nGesellschaft mit beschränkter Haftung\nNeumünster\n\nEs ist die Löschung der nachstehenden Gesellschaft wegen Vermögenslosigkeit gemäß § 394 FamFG beabsichtigt. Widerspruchsfrist: 2 Monate."
    },
    {
      "date": "2024-12-18",
      "id": "96814",
      "original_text": "Löschungsankündigung\nBerlin Amtsgericht Berlin (Charlottenburg) HRB 215067\nKML Verwaltungs GmbH – Berlin",
      "type": "Löschungsankündigung",
      "state": "Berlin",
      "amtsgericht": "Amtsgericht Berlin (Charlottenburg)",
      "registernummer": "HRB 215067",
      "registerart": "HRB",
      "company_name": "KML Verwaltungs GmbH",
      "company_seat": "Berlin",
      "details": "18.12.2024 (Bekanntmachungsdatum)\n\nBerlin Amtsgericht Berlin (Charlottenburg) HRB 215067\nLöschungsankündigung\n\nKML Verwaltungs GmbH\nGesellschaft mit beschränkter Haftung\nBerlin\n\nBei der nachstehenden Gesellschaft wird das Amtslöschungsverfahren gemäß § 394 FamFG eingeleitet. Widerspruchsfrist 6 Wochen"
    },
    {
      "date": "2024-12-18",
      "id": "96815",
      "original_text": "Löschungsankündigung\nBerlin Amtsgericht Berlin (Charlottenburg) HRB 246709\nGM Gebäudemanagement GmbH – Berlin",
      "type": "Löschungsankündigung",
      "state": "Berlin",
      "amtsgericht": "Amtsgericht Berlin (Charlottenburg)",
      "registernummer": "HRB 246709",
      "registerart": "HRB",
      "company_name": "GM Gebäudemanagement GmbH",
      "company_seat": "Berlin",
      "details": "18.12.2024 (Bekanntmachungsdatum)\n\nBerlin Amtsgericht Berlin (Charlottenburg) HRB 246709\nLöschungsankündigung\n\nGM Gebäudemanagement GmbH\nGesellschaft mit beschränkter Haftung\nBerlin\n\nBei der nachstehenden Gesellschaft wird das Amtslöschungsverfahren gemäß § 394 FamFG eingeleitet. Widerspruchsfrist 6 Wochen"
    },
    {
      "date": "2024-12-18",
      "id": "96816",
      "original_text": "Löschungsankündigung\nBerlin Amtsgericht Berlin (Charlottenburg) HRB 190732\nIP Bausysteme GmbH – Berlin",
      "type": "Löschungsankündigung",
      "state": "Berlin",
      "amtsgericht": "Amtsgericht Berlin (Charlottenburg)",
      "registernummer": "HRB 190732",
      "registerart": "HRB",
      "company_name": "IP Bausysteme GmbH",
      "company_seat": "Berlin",
      "details": "18.12.2024 (Bekanntmachungsdatum)\n\nBerlin Amtsgericht Berlin (Charlottenburg) HRB 190732\nLöschungsankündigung\n\nIP Bausysteme GmbH\nGesellschaft mit beschränkter Haftung\nBerlin\n\nBei der nachstehenden Gesellschaft wird das Amtslöschungsverfahren gemäß § 394 FamFG eingeleitet. Widerspruchsfrist 6 Wochen"
    },
    {
      "date": "2024-12-18",
      "id": "96817",
      "original_text": "Registerbekanntmachung nach dem Umwandlungsgesetz\nBerlin Amtsgericht Berlin (Charlottenburg) HRB 91240\ncorporate benefits International GmbH – Berlin",
      "type": "Registerbekanntmachung nach dem Umwandlungsgesetz",
      "state": "Berlin",
      "amtsgericht": "Amtsgericht Berlin (Charlottenburg)",
      "registernummer": "HRB 91240",
      "registerart": "HRB",
      "company_name": "corporate benefits International GmbH",
      "company_seat": "Berlin",
      "details": "18.12.2024 (Bekanntmachungsdatum)\n\nBerlin Amtsgericht Berlin (Charlottenburg) HRB 91240\nRegisterbekanntmachung nach dem Umwandlungsgesetz 17.12.2024 (Eintragungsdatum)\n\ncorporate benefits International GmbH\nGesellschaft mit beschränkter Haftung\nBerlin\n\nZu Eintragungsnummer 6 vom 17.12.2024 wird als nicht eingetragen veröffentlicht: Den Gläubigern der an der Verschmelzung beteiligten Rechtsträger ist, wenn sie binnen sechs Monaten nach dem Tag, an dem die Eintragung der Verschmelzung in das Register des Sitzes desjenigen Rechtsträgers, dessen Gläubiger sie sind, als bekannt gemacht gilt, ihren Anspruch nach Grund und Höhe schriftlich anmelden, Sicherheit zu leisten, soweit sie nicht Befriedigung verlangen können. Dieses Recht steht den Gläubigern jedoch nur zu, wenn sie glaubhaft machen, dass durch die Verschmelzung die Erfüllung ihrer Forderung gefährdet wird. Das Recht, Sicherheitsleistung zu verlangen, steht Gläubigern nicht zu, die im Falle der Insolvenz ein Recht auf vorzugsweise Befriedigung aus einer Deckungsmasse haben, die nach gesetzlicher Vorschrift zu ihrem Schutz errichtet und staatlich überwacht ist."
    },
    {
      "date": "2024-12-18",
      "id": "96818",
      "original_text": "Sonstige Registerbekanntmachung\nBrandenburg Amtsgericht Neuruppin HRB 10464\nFortuna Kyritz Automaten GmbH – Kyritz",
      "type": "Sonstige Registerbekanntmachung",
      "state": "Brandenburg",
      "amtsgericht": "Amtsgericht Neuruppin",
      "registernummer": "HRB 10464",
      "registerart": "HRB",
      "company_name": "Fortuna Kyritz Automaten GmbH",
      "company_seat": "Kyritz",
      "details": "18.12.2024 (Bekanntmachungsdatum)\n\nBrandenburg Amtsgericht Neuruppin HRB 10464\nSonstige Registerbekanntmachung\n\nFortuna Kyritz Automaten GmbH\nGesellschaft mit beschränkter Haftung\nKyritz\n\nDie vermögenslose Gesellschaft ist auf Grund des § 394 FamFG von Amts wegen gelöscht."
    },
    {
      "date": "2024-12-18",
      "id": "96819",
      "original_text": "Löschungsankündigung\nBrandenburg Amtsgericht Potsdam HRB 35941\nT. Braasch Projektentwicklung - Grünlandprojekte UG (haftungsbeschränkt) – Kloster Lehnin",
      "type": "Löschungsankündigung",
      "state": "Brandenburg",
      "amtsgericht": "Amtsgericht Potsdam",
      "registernummer": "HRB 35941",
      "registerart": "HRB",
      "company_name": "T. Braasch Projektentwicklung - Grünlandprojekte UG (haftungsbeschränkt)",
      "company_seat": "Kloster Lehnin",
      "details": "18.12.2024 (Bekanntmachungsdatum)\n\nBrandenburg Amtsgericht Potsdam HRB 35941\nLöschungsankündigung\n\nT. Braasch Projektentwicklung - Grünlandprojekte UG (haftungsbeschränkt)\nGesellschaft mit beschränkter Haftung\nKloster Lehnin\n\nBei der nachstehenden Gesellschaft wird das Amtslöschungsverfahren gemäß § 394 FamFG eingeleitet. Widerspruchsfrist: 8 Wochen"
    },
    {
      "date": "2024-12-18",
      "id": "96820",
      "original_text": "Registerbekanntmachung nach dem Umwandlungsgesetz\nBaden-Württemberg Amtsgericht Stuttgart HRB 301693\nClaus & Werner Steuerberatungsgesellschaft mbH – Bietigheim-Bissingen",
      "type": "Registerbekanntmachung nach dem Umwandlungsgesetz",
      "state": "Baden-Württemberg",
      "amtsgericht": "Amtsgericht Stuttgart",
      "registernummer": "HRB 301693",
      "registerart": "HRB",
      "company_name": "Claus & Werner Steuerberatungsgesellschaft mbH",
      "company_seat": "Bietigheim-Bissingen",
      "details": "18.12.2024 (Bekanntmachungsdatum)\n\nBaden-Württemberg Amtsgericht Stuttgart HRB 301693\nRegisterbekanntmachung nach dem Umwandlungsgesetz 18.12.2024 (Eintragungsdatum)\n\nClaus & Werner Steuerberatungsgesellschaft mbH\nGesellschaft mit beschränkter Haftung\nBietigheim-Bissingen\n\nAls nicht eingetragen wird bekanntgemacht:\nDen Gläubigern der an der Abspaltung beteiligten Rechtsträger ist, wenn sie binnen sechs Monaten nach dem Tag, an dem die Eintragung der Abspaltung in das Register des Sitzes desjenigen Rechtsträgers, dessen Gläubiger sie sind, nach § 19 Abs. 3 UmwG als bekanntgemacht gilt, ihren Anspruch nach Grund und Höhe schriftlich anmelden, Sicherheit zu leisten, soweit sie nicht Befriedigung verlangen können. Dieses Recht steht den Gläubigern jedoch nur zu, wenn sie glaubhaft machen, dass durch die Abspaltung die Erfüllung ihrer Forderung gefährdet wird."
    },
    {
      "date": "2024-12-18",
      "id": "96821",
      "original_text": "Registerbekanntmachung nach dem Umwandlungsgesetz\nBaden-Württemberg Amtsgericht Freiburg HRB 724878\nVicos UG (haftungsbeschränkt) – Schluchsee",
      "type": "Registerbekanntmachung nach dem Umwandlungsgesetz",
      "state": "Baden-Württemberg",
      "amtsgericht": "Amtsgericht Freiburg",
      "registernummer": "HRB 724878",
      "registerart": "HRB",
      "company_name": "Vicos UG (haftungsbeschränkt)",
      "company_seat": "Schluchsee",
      "details": "18.12.2024 (Bekanntmachungsdatum)\n\nBaden-Württemberg Amtsgericht Freiburg HRB 724878\nRegisterbekanntmachung nach dem Umwandlungsgesetz 18.12.2024 (Eintragungsdatum)\n\nVicos UG (haftungsbeschränkt)\nGesellschaft mit beschränkter Haftung\nSchluchsee\n\nAls nicht eingetragen wird bekanntgemacht:\nDen Gläubigern der an der Verschmelzung beteiligten Rechtsträger ist, wenn sie binnen sechs Monaten nach dem Tag, an dem die Eintragung der Verschmelzung in das Register des Sitzes desjenigen Rechtsträgers, dessen Gläubiger sie sind, nach § 19 Abs. 3 UmwG als bekanntgemacht gilt, ihren Anspruch nach Grund und Höhe schriftlich anmelden, Sicherheit zu leisten, soweit sie nicht Befriedigung verlangen können. Dieses Recht steht den Gläubigern jedoch nur zu, wenn sie glaubhaft machen, dass durch die Verschmelzung die Erfüllung ihrer Forderung gefährdet wird."
    },
    {
      "date": "2024-12-18",
      "id": "96822",
      "original_text": "Registerbekanntmachung nach dem Umwandlungsgesetz\nBaden-Württemberg Amtsgericht Freiburg HRB 720234\nartax International Consulting GmbH – Schluchsee",
      "type": "Registerbekanntmachung nach dem Umwandlungsgesetz",
      "state": "Baden-Württemberg",
      "amtsgericht": "Amtsgericht Freiburg",
      "registernummer": "HRB 720234",
      "registerart": "HRB",
      "company_name": "artax International Consulting GmbH",
      "company_seat": "Schluchsee",
      "details": "18.12.2024 (Bekanntmachungsdatum)\n\nBaden-Württemberg Amtsgericht Freiburg HRB 720234\nRegisterbekanntmachung nach dem Umwandlungsgesetz 18.12.2024 (Eintragungsdatum)\n\nartax International Consulting GmbH\nGesellschaft mit beschränkter Haftung\nSchluchsee\n\nAls nicht eingetragen wird bekanntgemacht:\nDen Gläubigern der an der Verschmelzung beteiligten Rechtsträger ist, wenn sie binnen sechs Monaten nach dem Tag, an dem die Eintragung der Verschmelzung in das Register des Sitzes desjenigen Rechtsträgers, dessen Gläubiger sie sind, nach § 19 Abs. 3 UmwG als bekanntgemacht gilt, ihren Anspruch nach Grund und Höhe schriftlich anmelden, Sicherheit zu leisten, soweit sie nicht Befriedigung verlangen können. Dieses Recht steht den Gläubigern jedoch nur zu, wenn sie glaubhaft machen, dass durch die Verschmelzung die Erfüllung ihrer Forderung gefährdet wird."
    },
    {
      "date": "2024-12-18",
      "id": "96823",
      "original_text": "Einreichung neuer Dokumente\nBrandenburg Amtsgericht Potsdam HRB 12844\nUP Transfer GmbH an der Universität Potsdam – Potsdam",
      "type": "Einreichung neuer Dokumente",
      "state": "Brandenburg",
      "amtsgericht": "Amtsgericht Potsdam",
      "registernummer": "HRB 12844",
      "registerart": "HRB",
      "company_name": "UP Transfer GmbH an der Universität Potsdam",
      "company_seat": "Potsdam",
      "details": "18.12.2024 (Bekanntmachungsdatum)\n\nBrandenburg Amtsgericht Potsdam HRB 12844\nEinreichung neuer Dokumente\n\nUP Transfer GmbH an der Universität Potsdam\nGesellschaft mit beschränkter Haftung\nPotsdam\n\nAls nicht eingetragen wird veröffentlicht: Eine Liste der Mitglieder des Aufsichtsrates wurde zum Handelsregister eingereicht."
    },
    {
      "date": "2024-12-18",
      "id": "96824",
      "original_text": "Registerbekanntmachung nach dem Umwandlungsgesetz\nBrandenburg Amtsgericht Cottbus HRB 10034\nMSK Wintergärten GmbH – Bestensee",
      "type": "Registerbekanntmachung nach dem Umwandlungsgesetz",
      "state": "Brandenburg",
      "amtsgericht": "Amtsgericht Cottbus",
      "registernummer": "HRB 10034",
      "registerart": "HRB",
      "company_name": "MSK Wintergärten GmbH",
      "company_seat": "Bestensee",
      "details": "18.12.2024 (Bekanntmachungsdatum)\n\nBrandenburg Amtsgericht Cottbus HRB 10034\nRegisterbekanntmachung nach dem Umwandlungsgesetz 18.12.2024 (Eintragungsdatum)\n\nMSK Wintergärten GmbH\nGesellschaft mit beschränkter Haftung\nBestensee\n\nAls nicht eingetragen wird veröffentlicht:\nDen Gläubigern der an der Verschmelzung beteiligten Rechtsträger ist, wenn sie binnen sechs Monaten nach dem Tag, an dem die Eintragung der Verschmelzung in das Register des Sitzes desjenigen Rechtsträgers, dessen Gläubiger sie sind, als bekannt gemacht gilt, ihren Anspruch nach Grund und Höhe schriftlich anmelden, Sicherheit zu leisten, soweit sie nicht Befriedigung verlangen können. Dieses Recht steht den Gläubigern jedoch nur zu, wenn sie glaubhaft machen, dass durch die Verschmelzung die Erfüllung ihrer Forderung gefährdet wird"
    },
    {
      "date": "2024-12-18",
      "id": "96825",
      "original_text": "Löschungsankündigung\nBerlin Amtsgericht Berlin (Charlottenburg) HRB 206299\nAS Taxi GmbH – Berlin",
      "type": "Löschungsankündigung",
      "state": "Berlin",
      "amtsgericht": "Amtsgericht Berlin (Charlottenburg)",
      "registernummer": "HRB 206299",
      "registerart": "HRB",
      "company_name": "AS Taxi GmbH",
      "company_seat": "Berlin",
      "details": "18.12.2024 (Bekanntmachungsdatum)\n\nBerlin Amtsgericht Berlin (Charlottenburg) HRB 206299\nLöschungsankündigung\n\nAS Taxi GmbH\nGesellschaft mit beschränkter Haftung\nBerlin\n\nBei der nachstehenden Gesellschaft wird das Amtslöschungsverfahren gemäß § 394 FamFG eingeleitet. Widerspruchsfrist 6 Wochen"
    },
    {
      "date": "2024-12-18",
      "id": "96826",
      "original_text": "Löschungsankündigung\nBaden-Württemberg Amtsgericht Stuttgart HRB 751562\nthe rooms gastromanagement GmbH – Heilbronn",
      "type": "Löschungsankündigung",
      "state": "Baden-Württemberg",
      "amtsgericht": "Amtsgericht Stuttgart",
      "registernummer": "HRB 751562",
      "registerart": "HRB",
      "company_name": "the rooms gastromanagement GmbH",
      "company_seat": "Heilbronn",
      "details": "18.12.2024 (Bekanntmachungsdatum)\n\nBaden-Württemberg Amtsgericht Stuttgart HRB 751562\nLöschungsankündigung\n\nthe rooms gastromanagement GmbH\nGesellschaft mit beschränkter Haftung\nHeilbronn\n\nAls nicht eingetragen wird bekanntgemacht:\nDas Gericht beabsichtigt, die Gesellschaft wegen Vermögenslosigkeit im Handelsregister von Amts wegen nach § 394 FamFG zu löschen. Die Frist zur Geltendmachung eines Widerspruchs gegen die beabsichtigte Löschung ist auf zwei Monate ab Veröffentlichung bestimmt."
    },
    {
      "date": "2024-12-18",
      "id": "96827",
      "original_text": "Registerbekanntmachung nach dem Umwandlungsgesetz\nBaden-Württemberg Amtsgericht Stuttgart HRA 729885\nBlickle Leitstellen- und Kommunikationstechnik GmbH & Co. KG – Ludwigsburg",
      "type": "Registerbekanntmachung nach dem Umwandlungsgesetz",
      "state": "Baden-Württemberg",
      "amtsgericht": "Amtsgericht Stuttgart",
      "registernummer": "HRA 729885",
      "registerart": "HRA",
      "company_name": "Blickle Leitstellen- und Kommunikationstechnik GmbH & Co. KG",
      "company_seat": "Ludwigsburg",
      "details": "18.12.2024 (Bekanntmachungsdatum)\n\nBaden-Württemberg Amtsgericht Stuttgart HRA 729885\nRegisterbekanntmachung nach dem Umwandlungsgesetz 18.12.2024 (Eintragungsdatum)\n\nBlickle Leitstellen- und Kommunikationstechnik GmbH & Co. KG\nKommanditgesellschaft\nLudwigsburg\n\nAls nicht eingetragen wird bekanntgemacht:\nDen Gläubigern der an der Verschmelzung beteiligten Rechtsträger ist, wenn sie binnen sechs Monaten nach dem Tag, an dem die Eintragung der Verschmelzung in das Register des Sitzes desjenigen Rechtsträgers, dessen Gläubiger sie sind, nach § 19 Abs. 3 UmwG als bekanntgemacht gilt, ihren Anspruch nach Grund und Höhe schriftlich anmelden, Sicherheit zu leisten, soweit sie nicht Befriedigung verlangen können. Dieses Recht steht den Gläubigern jedoch nur zu, wenn sie glaubhaft machen, dass durch die Verschmelzung die Erfüllung ihrer Forderung gefährdet wird."
    },
    {
      "date": "2024-12-18",
      "id": "96828",
      "original_text": "Einreichung neuer Dokumente\nBaden-Württemberg Amtsgericht Mannheim HRB 709176\nMV Mannheimer Verkehr GmbH – Mannheim",
      "type": "Einreichung neuer Dokumente",
      "state": "Baden-Württemberg",
      "amtsgericht": "Amtsgericht Mannheim",
      "registernummer": "HRB 709176",
      "registerart": "HRB",
      "company_name": "MV Mannheimer Verkehr GmbH",
      "company_seat": "Mannheim",
      "details": "18.12.2024 (Bekanntmachungsdatum)\n\nBaden-Württemberg Amtsgericht Mannheim HRB 709176\nEinreichung neuer Dokumente\n\nMV Mannheimer Verkehr GmbH\nGesellschaft mit beschränkter Haftung\nMannheim\n\nDie Gesellschaft hat am 18.12.2024 die Liste über die Zusammensetzung des Aufsichtsrats zum Handelsregister eingereicht."
    },
    {
      "date": "2024-12-18",
      "id": "96829",
      "original_text": "Registerbekanntmachung nach dem Umwandlungsgesetz\nSchleswig-Holstein Amtsgericht Kiel HRB 27609\nDiamant- und Rückbautechnik Ulzburg GmbH – Henstedt-Ulzburg",
      "type": "Registerbekanntmachung nach dem Umwandlungsgesetz",
      "state": "Schleswig-Holstein",
      "amtsgericht": "Amtsgericht Kiel",
      "registernummer": "HRB 27609",
      "registerart": "HRB",
      "company_name": "Diamant- und Rückbautechnik Ulzburg GmbH",
      "company_seat": "Henstedt-Ulzburg",
      "details": "18.12.2024 (Bekanntmachungsdatum)\n\nSchleswig-Holstein Amtsgericht Kiel HRB 27609\nRegisterbekanntmachung nach dem Umwandlungsgesetz 18.12.2024 (Eintragungsdatum)\n\nDiamant- und Rückbautechnik Ulzburg GmbH\nGesellschaft mit beschränkter Haftung\nHenstedt-Ulzburg\n\nAls nicht eingetragen wird veröffentlicht: Den Gläubigern ist, wenn sie binnen sechs Monaten nach dem Tag, an dem die Eintragung der Umwandlung bekannt gemacht worden ist, ihren Anspruch nach Grund und Höhe schriftlich anmelden, Sicherheit zu leisten, soweit sie nicht Befriedigung verlangen können. Dieses Recht steht den Gläubigern jedoch nur zu, wenn sie glaubhaft machen, dass durch die Umwandlung die Erfüllung ihrer Forderung gefährdet wird."
    },
    {
      "date": "2024-12-18",
      "id": "96830",
      "original_text": "Registerbekanntmachung nach dem Umwandlungsgesetz\nBerlin Amtsgericht Berlin (Charlottenburg) HRB 239980\nGLB Rappenweg München GmbH – Berlin",
      "type": "Registerbekanntmachung nach dem Umwandlungsgesetz",
      "state": "Berlin",
      "amtsgericht": "Amtsgericht Berlin (Charlottenburg)",
      "registernummer": "HRB 239980",
      "registerart": "HRB",
      "company_name": "GLB Rappenweg München GmbH",
      "company_seat": "Berlin",
      "details": "18.12.2024 (Bekanntmachungsdatum)\n\nBerlin Amtsgericht Berlin (Charlottenburg) HRB 239980\nRegisterbekanntmachung nach dem Umwandlungsgesetz 17.12.2024 (Eintragungsdatum)\n\nGLB Rappenweg München GmbH\nGesellschaft mit beschränkter Haftung\nBerlin\n\nZu Eintragungsnummer 6 vom 17.12.2024 wird als nicht eingetragen veröffentlicht: Den Gläubigern ist, wenn sie binnen sechs Monaten nach dem Tag, an dem die Eintragung der Umwandlung als bekannt gemacht gilt, ihren Anspruch nach Grund und Höhe schriftlich anmelden, Sicherheit zu leisten, soweit sie nicht Befriedigung verlangen können. Dieses Recht steht den Gläubigern jedoch nur zu, wenn sie glaubhaft machen, dass durch die Umwandlung die Erfüllung ihrer Forderung gefährdet wird. Das Recht, Sicherheitsleistung zu verlangen, steht Gläubigern nicht zu, die im Falle der Insolvenz ein Recht auf vorzugsweise Befriedigung aus einer Deckungsmasse haben, die nach gesetzlicher Vorschrift zu ihrem Schutz errichtet und staatlich überwacht ist."
    },
    {
      "date": "2024-12-18",
      "id": "96831",
      "original_text": "Registerbekanntmachung nach dem Umwandlungsgesetz\nBaden-Württemberg Amtsgericht Stuttgart HRA 741428\nHans Sachs Sanitär und Heizung e.K. – Bietigheim-Bissingen",
      "type": "Registerbekanntmachung nach dem Umwandlungsgesetz",
      "state": "Baden-Württemberg",
      "amtsgericht": "Amtsgericht Stuttgart",
      "registernummer": "HRA 741428",
      "registerart": "HRA",
      "company_name": "Hans Sachs Sanitär und Heizung e.K.",
      "company_seat": "Bietigheim-Bissingen",
      "details": "18.12.2024 (Bekanntmachungsdatum)\n\nBaden-Württemberg Amtsgericht Stuttgart HRA 741428\nRegisterbekanntmachung nach dem Umwandlungsgesetz 18.12.2024 (Eintragungsdatum)\n\nHans Sachs Sanitär und Heizung e.K.\nEinzelkaufmann / Einzelkauffrau\nBietigheim-Bissingen\n\nDen Gläubigern der an der Ausgliederung beteiligten Rechtsträger ist, wenn sie binnen sechs Monaten nach dem Tag, an dem die Eintragung der Ausgliederung in das Register des Sitzes desjenigen Rechtsträgers, dessen Gläubiger sie sind, nach § 19 Abs. 3 UmwG als bekanntgemacht gilt, ihren Anspruch nach Grund und Höhe schriftlich anmelden, Sicherheit zu leisten, soweit sie nicht Befriedigung verlangen können. Dieses Recht steht den Gläubigern jedoch nur zu, wenn sie glaubhaft machen, dass durch die Ausgliederung die Erfüllung ihrer Forderung gefährdet wird."
    },
    {
      "date": "2024-12-18",
      "id": "96832",
      "original_text": "Sonstige Registerbekanntmachung\nBaden-Württemberg Amtsgericht Stuttgart HRB 779858\nWürth Elektronik CBT International GmbH – Niedernhall",
      "type": "Sonstige Registerbekanntmachung",
      "state": "Baden-Württemberg",
      "amtsgericht": "Amtsgericht Stuttgart",
      "registernummer": "HRB 779858",
      "registerart": "HRB",
      "company_name": "Würth Elektronik CBT International GmbH",
      "company_seat": "Niedernhall",
      "details": "18.12.2024 (Bekanntmachungsdatum)\n\nBaden-Württemberg Amtsgericht Stuttgart HRB 779858\nSonstige Registerbekanntmachung 18.12.2024 (Eintragungsdatum)\n\nWürth Elektronik CBT International GmbH\nGesellschaft mit beschränkter Haftung\nNiedernhall\n\nAls nicht eingetragen wird bekanntgemacht:\nDen Gläubigern der Gesellschaft, deren Forderungen begründet worden sind, bevor die Eintragung der Beendigung des Vertrages in das Handelsregister nach § 10 HGB als bekanntgemacht gilt, ist vom anderen Vertragsteil Sicherheit zu leisten, wenn sie sich binnen sechs Monaten nach der Bekanntmachung zu diesem Zweck bei ihm melden."
    },
    {
      "date": "2024-12-18",
      "id": "96833",
      "original_text": "Sonstige Registerbekanntmachung\nBaden-Württemberg Amtsgericht Stuttgart HRB 20215\nTourismus Marketing GmbH Baden-Württemberg – Stuttgart",
      "type": "Sonstige Registerbekanntmachung",
      "state": "Baden-Württemberg",
      "amtsgericht": "Amtsgericht Stuttgart",
      "registernummer": "HRB 20215",
      "registerart": "HRB",
      "company_name": "Tourismus Marketing GmbH Baden-Württemberg",
      "company_seat": "Stuttgart",
      "details": "18.12.2024 (Bekanntmachungsdatum)\n\nBaden-Württemberg Amtsgericht Stuttgart HRB 20215\nSonstige Registerbekanntmachung 18.12.2024 (Eintragungsdatum)\n\nTourismus Marketing GmbH Baden-Württemberg\nGesellschaft mit beschränkter Haftung\nStuttgart\n\nDie Gesellschaft hat am 21.11.2024 die Liste über die Zusammensetzung des Aufsichtsrats zum Handelsregister eingereicht."
    },
    {
      "date": "2024-12-18",
      "id": "96834",
      "original_text": "Sonstige Registerbekanntmachung\nBaden-Württemberg Amtsgericht Freiburg HRB 952\nFreiburger Verkehrs Aktiengesellschaft – Freiburg im Breisgau",
      "type": "Sonstige Registerbekanntmachung",
      "state": "Baden-Württemberg",
      "amtsgericht": "Amtsgericht Freiburg",
      "registernummer": "HRB 952",
      "registerart": "HRB",
      "company_name": "Freiburger Verkehrs Aktiengesellschaft",
      "company_seat": "Freiburg im Breisgau",
      "details": "18.12.2024 (Bekanntmachungsdatum)\n\nBaden-Württemberg Amtsgericht Freiburg HRB 952\nSonstige Registerbekanntmachung\n\nFreiburger Verkehrs Aktiengesellschaft\nAktiengesellschaft\nFreiburg im Breisgau\n\nDie Gesellschaft hat am 17.12.2024 die Liste über die Zusammensetzung des Aufsichtsrats zum Handelsregister eingereicht."
    },
    {
      "date": "2024-12-18",
      "id": "96835",
      "original_text": "Einreichung neuer Dokumente\nBaden-Württemberg Amtsgericht Mannheim HRB 730644\nAliaxis Deutschland GmbH – Mannheim",
      "type": "Einreichung neuer Dokumente",
      "state": "Baden-Württemberg",
      "amtsgericht": "Amtsgericht Mannheim",
      "registernummer": "HRB 730644",
      "registerart": "HRB",
      "company_name": "Aliaxis Deutschland GmbH",
      "company_seat": "Mannheim",
      "details": "18.12.2024 (Bekanntmachungsdatum)\n\nBaden-Württemberg Amtsgericht Mannheim HRB 730644\nEinreichung neuer Dokumente\n\nAliaxis Deutschland GmbH\nGesellschaft mit beschränkter Haftung\nMannheim\n\nDie Gesellschaft hat am 17.12.2024 die Liste über die Zusammensetzung des Aufsichtsrats zum Handelsregister eingereicht."
    },
    {
      "date": "2024-12-18",
      "id": "96836",
      "original_text": "Einreichung neuer Dokumente\nBaden-Württemberg Amtsgericht Freiburg HRB 715372\nFernwärme SBH AG – Grafenhausen",
      "type": "Einreichung neuer Dokumente",
      "state": "Baden-Württemberg",
      "amtsgericht": "Amtsgericht Freiburg",
      "registernummer": "HRB 715372",
      "registerart": "HRB",
      "company_name": "Fernwärme SBH AG",
      "company_seat": "Grafenhausen",
      "details": "18.12.2024 (Bekanntmachungsdatum)\n\nBaden-Württemberg Amtsgericht Freiburg HRB 715372\nEinreichung neuer Dokumente\n\nFernwärme SBH AG\nAktiengesellschaft\nGrafenhausen\n\nDie Gesellschaft hat am 18.12.2024 die Liste über die Zusammensetzung des Aufsichtsrats zum Handelsregister eingereicht."
    },
    {
      "date": "2024-12-18",
      "id": "96837",
      "original_text": "Registerbekanntmachung nach dem Umwandlungsgesetz\nHamburg Amtsgericht Hamburg HRA 93345\nNorddeutsche Reederei Holding GmbH & Co. KG – Hamburg",
      "type": "Registerbekanntmachung nach dem Umwandlungsgesetz",
      "state": "Hamburg",
      "amtsgericht": "Amtsgericht Hamburg",
      "registernummer": "HRA 93345",
      "registerart": "HRA",
      "company_name": "Norddeutsche Reederei Holding GmbH & Co. KG",
      "company_seat": "Hamburg",
      "details": "18.12.2024 (Bekanntmachungsdatum)\n\nHamburg Amtsgericht Hamburg HRA 93345\nRegisterbekanntmachung nach dem Umwandlungsgesetz 18.12.2024 (Eintragungsdatum)\n\nNorddeutsche Reederei Holding GmbH & Co. KG\nKommanditgesellschaft\nHamburg\n\nAls nicht eingetragen wird bekannt gemacht:\nDen Gläubigern der an der Verschmelzung beteiligten Gesellschaften ist, wenn sie binnen sechs Monaten nach dem Tag, an dem die Eintragung der Verschmelzung in das Register des Sitzes desjenigen Rechtsträgers, dessen Gläubiger sie sind, nach § 19 Absatz 3 UmwG als bekannt gemacht gilt, ihren Anspruch nach Grund und Höhe schriftlich anmelden, Sicherheit zu leisten, soweit sie nicht Befriedigung verlangen können. Dieses Recht steht den Gläubigern jedoch nur zu, wenn sie glaubhaft machen, dass durch die Verschmelzung die Erfüllung ihrer Forderung gefährdet wird."
    },
    {
      "date": "2024-12-18",
      "id": "96838",
      "original_text": "Löschungsankündigung\nBerlin Amtsgericht Berlin (Charlottenburg) HRB 88511\nOptimahl Gastronomie Bewirtschaftungs GmbH – Berlin",
      "type": "Löschungsankündigung",
      "state": "Berlin",
      "amtsgericht": "Amtsgericht Berlin (Charlottenburg)",
      "registernummer": "HRB 88511",
      "registerart": "HRB",
      "company_name": "Optimahl Gastronomie Bewirtschaftungs GmbH",
      "company_seat": "Berlin",
      "details": "18.12.2024 (Bekanntmachungsdatum)\n\nBerlin Amtsgericht Berlin (Charlottenburg) HRB 88511\nLöschungsankündigung\n\nOptimahl Gastronomie Bewirtschaftungs GmbH\nGesellschaft mit beschränkter Haftung\nBerlin\n\nBei der nachstehenden Gesellschaft wird das Amtslöschungsverfahren gemäß § 394 FamFG eingeleitet. Widerspruchsfrist: 6 Wochen."
    },
    {
      "date": "2024-12-18",
      "id": "96839",
      "original_text": "Löschungsankündigung\nBaden-Württemberg Amtsgericht Mannheim HRB 7122\nT.S. Injektor Engineering International GmbH – Mannheim",
      "type": "Löschungsankündigung",
      "state": "Baden-Württemberg",
      "amtsgericht": "Amtsgericht Mannheim",
      "registernummer": "HRB 7122",
      "registerart": "HRB",
      "company_name": "T.S. Injektor Engineering International GmbH",
      "company_seat": "Mannheim",
      "details": "18.12.2024 (Bekanntmachungsdatum)\n\nBaden-Württemberg Amtsgericht Mannheim HRB 7122\nLöschungsankündigung\n\nT.S. Injektor Engineering International GmbH\nGesellschaft mit beschränkter Haftung\nMannheim\n\nDas Gericht beabsichtigt, die Gesellschaft wegen Vermögenslosigkeit im Handelsregister von Amts wegen nach § 394 FamFG zu löschen. Die Frist zur Geltendmachung eines Widerspruchs gegen die beabsichtigte Löschung ist auf einen Monat ab Veröffentlichung bestimmt."
    },
    {
      "date": "2024-12-18",
      "id": "96840",
      "original_text": "Registerbekanntmachung nach dem Umwandlungsgesetz\nHamburg Amtsgericht Hamburg HRB 142341\nCompanyCheck Deutschland GmbH – Hamburg",
      "type": "Registerbekanntmachung nach dem Umwandlungsgesetz",
      "state": "Hamburg",
      "amtsgericht": "Amtsgericht Hamburg",
      "registernummer": "HRB 142341",
      "registerart": "HRB",
      "company_name": "CompanyCheck Deutschland GmbH",
      "company_seat": "Hamburg",
      "details": "18.12.2024 (Bekanntmachungsdatum)\n\nHamburg Amtsgericht Hamburg HRB 142341\nRegisterbekanntmachung nach dem Umwandlungsgesetz 18.12.2024 (Eintragungsdatum)\n\nCompanyCheck Deutschland GmbH\nGesellschaft mit beschränkter Haftung\nHamburg\n\nAls nicht eingetragen wird bekannt gemacht:\nDen Gläubigern der an der Verschmelzung beteiligten Gesellschaften ist, wenn sie binnen sechs Monaten nach dem Tag, an dem die Eintragung der Verschmelzung in das Register des Sitzes desjenigen Rechtsträgers, dessen Gläubiger sie sind, nach § 19 Absatz 3 UmwG als bekannt gemacht gilt, ihren Anspruch nach Grund und Höhe schriftlich anmelden, Sicherheit zu leisten, soweit sie nicht Befriedigung verlangen können. Dieses Recht steht den Gläubigern jedoch nur zu, wenn sie glaubhaft machen, dass durch die Verschmelzung die Erfüllung ihrer Forderung gefährdet wird."
    },
    {
      "date": "2024-12-18",
      "id": "96841",
      "original_text": "Registerbekanntmachung nach dem Umwandlungsgesetz\nSchleswig-Holstein Amtsgericht Kiel HRB 27144\nAbuGoku GmbH – Kiel",
      "type": "Registerbekanntmachung nach dem Umwandlungsgesetz",
      "state": "Schleswig-Holstein",
      "amtsgericht": "Amtsgericht Kiel",
      "registernummer": "HRB 27144",
      "registerart": "HRB",
      "company_name": "AbuGoku GmbH",
      "company_seat": "Kiel",
      "details": "18.12.2024 (Bekanntmachungsdatum)\n\nSchleswig-Holstein Amtsgericht Kiel HRB 27144\nRegisterbekanntmachung nach dem Umwandlungsgesetz 17.12.2024 (Eintragungsdatum)\n\nAbuGoku GmbH\nGesellschaft mit beschränkter Haftung\nKiel\n\nZu Eintragungsnummer 2 vom 17.12.2024 wird als nicht eingetragen veröffentlicht: Als nicht eingetragen wird veröffentlicht: Den Gläubigern der an der Spaltung beteiligten Rechtsträger ist, wenn sie binnen sechs Monaten nach dem Tag, an dem die Eintragung der Spaltung in das Register des Sitzes desjenigen Rechtsträgers, dessen Gläubiger sie sind,  bekannt gemacht worden ist, ihren Anspruch nach Grund und Höhe schriftlich anmelden, Sicherheit zu leisten, soweit sie nicht Befriedigung verlangen können. Dieses Recht steht den Gläubigern jedoch nur zu, wenn sie glaubhaft machen, dass durch die Spaltung die Erfüllung ihrer Forderung gefährdet wird."
    },
    {
      "date": "2024-12-18",
      "id": "96842",
      "original_text": "Einreichung neuer Dokumente\nBaden-Württemberg Amtsgericht Stuttgart HRB 15139\nHerzzentrum Klinikum Stuttgart GmbH – Stuttgart",
      "type": "Einreichung neuer Dokumente",
      "state": "Baden-Württemberg",
      "amtsgericht": "Amtsgericht Stuttgart",
      "registernummer": "HRB 15139",
      "registerart": "HRB",
      "company_name": "Herzzentrum Klinikum Stuttgart GmbH",
      "company_seat": "Stuttgart",
      "details": "18.12.2024 (Bekanntmachungsdatum)\n\nBaden-Württemberg Amtsgericht Stuttgart HRB 15139\nEinreichung neuer Dokumente 18.12.2024 (Eintragungsdatum)\n\nHerzzentrum Klinikum Stuttgart GmbH\nGesellschaft mit beschränkter Haftung\nStuttgart\n\nDie Gesellschaft hat am 16.12.2024 die Liste über die Zusammensetzung des Aufsichtsrats zum Handelsregister eingereicht."
    },
    {
      "date": "2024-12-18",
      "id": "96843",
      "original_text": "Registerbekanntmachung nach dem Umwandlungsgesetz\nSachsen Amtsgericht Chemnitz HRB 31408\nVSTR AG Rodewisch – Rodewisch",
      "type": "Registerbekanntmachung nach dem Umwandlungsgesetz",
      "state": "Sachsen",
      "amtsgericht": "Amtsgericht Chemnitz",
      "registernummer": "HRB 31408",
      "registerart": "HRB",
      "company_name": "VSTR AG Rodewisch",
      "company_seat": "Rodewisch",
      "details": "18.12.2024 (Bekanntmachungsdatum)\n\nSachsen Amtsgericht Chemnitz HRB 31408\nRegisterbekanntmachung nach dem Umwandlungsgesetz\n\nVSTR AG Rodewisch\nAktiengesellschaft\nRodewisch\n\nGemäß § 61 UmwG wird bekanntgemacht, dass die Gesellschaft den Entwurf des Verschmelzungsvertrages zwischen der Gesellschaft und der VSTR Bauservice GmbH mit Sitz in Rodewisch (Amtsgericht Chemnitz HRB 12692) übersandt hat."
    },
    {
      "date": "2024-12-18",
      "id": "96844",
      "original_text": "Einreichung neuer Dokumente\nSachsen Amtsgericht Leipzig HRB 622\nLeipziger Messe Gesellschaft mbH – Leipzig",
      "type": "Einreichung neuer Dokumente",
      "state": "Sachsen",
      "amtsgericht": "Amtsgericht Leipzig",
      "registernummer": "HRB 622",
      "registerart": "HRB",
      "company_name": "Leipziger Messe Gesellschaft mbH",
      "company_seat": "Leipzig",
      "details": "18.12.2024 (Bekanntmachungsdatum)\n\nSachsen Amtsgericht Leipzig HRB 622\nEinreichung neuer Dokumente\n\nLeipziger Messe Gesellschaft mbH\nGesellschaft mit beschränkter Haftung\nLeipzig\n\nAm 16.12.2024 wurde beim Handelsregister des Amtsgerichts Leipzig die Liste der Mitglieder des Aufsichtsrats gemäß § 52 GmbHG eingereicht."
    },
    {
      "date": "2024-12-18",
      "id": "96845",
      "original_text": "Einreichung neuer Dokumente\nSachsen Amtsgericht Leipzig HRB 13860\nLVV Leipziger Versorgungs- und Verkehrsgesellschaft mbH – Leipzig",
      "type": "Einreichung neuer Dokumente",
      "state": "Sachsen",
      "amtsgericht": "Amtsgericht Leipzig",
      "registernummer": "HRB 13860",
      "registerart": "HRB",
      "company_name": "LVV Leipziger Versorgungs- und Verkehrsgesellschaft mbH",
      "company_seat": "Leipzig",
      "details": "18.12.2024 (Bekanntmachungsdatum)\n\nSachsen Amtsgericht Leipzig HRB 13860\nEinreichung neuer Dokumente\n\nLVV Leipziger Versorgungs- und Verkehrsgesellschaft mbH\nGesellschaft mit beschränkter Haftung\nLeipzig\n\nAm 17.12.2024 wurde beim Handelsregister des Amtsgerichts Leipzig die Liste der Mitglieder des Aufsichtsrats gemäß § 52 GmbHG eingereicht."
    },
    {
      "date": "2024-12-18",
      "id": "96846",
      "original_text": "Einreichung neuer Dokumente\nNiedersachsen Amtsgericht Osnabrück HRB 111027 früher Amtsgericht Bad Iburg\nCaritas Südkreis Pflege GmbH – Georgsmarienhütte",
      "type": "Einreichung neuer Dokumente",
      "state": "Niedersachsen",
      "amtsgericht": "Amtsgericht Osnabrück",
      "registernummer": "HRB 111027",
      "registerart": "HRB",
      "company_name": "Caritas Südkreis Pflege GmbH",
      "company_seat": "Georgsmarienhütte",
      "former_amtsgericht": "Bad Iburg",
      "details": "18.12.2024 (Bekanntmachungsdatum)\n\nNiedersachsen Amtsgericht Osnabrück HRB 111027 früher Amtsgericht Bad Iburg\nEinreichung neuer Dokumente 18.12.2024 (Eintragungsdatum)\n\nCaritas Südkreis Pflege GmbH\nGesellschaft mit beschränkter Haftung\nGeorgsmarienhütte\n\nDie Liste der Mitglieder des Aufsichtsrats wurde beim Registergericht eingereicht."
    },
    {
      "date": "2024-12-18",
      "id": "96847",
      "original_text": "Löschungsankündigung\nNiedersachsen Amtsgericht Osnabrück HRA 100379 früher Amtsgericht Lingen (Ems)\nBerends Farm GmbH & Co. KG – Gersten",
      "type": "Löschungsankündigung",
      "state": "Niedersachsen",
      "amtsgericht": "Amtsgericht Osnabrück",
      "registernummer": "HRA 100379",
      "registerart": "HRA",
      "company_name": "Berends Farm GmbH & Co. KG",
      "company_seat": "Gersten",
      "former_amtsgericht": "Lingen (Ems)",
      "details": "18.12.2024 (Bekanntmachungsdatum)\n\nNiedersachsen Amtsgericht Osnabrück HRA 100379 früher Amtsgericht Lingen (Ems)\nLöschungsankündigung\n\nBerends Farm GmbH & Co. KG\nKommanditgesellschaft\nGersten\n\nDas Registergericht beabsichtigt, die Firma von Amts wegen nach § 394 FamFG wegen Vermögenslosigkeit zu löschen. Die Frist zur Erhebung eines Widerspruchs ist auf 1 Monat ab dieser Registerbekanntmachung festgesetzt."
    },
    {
      "date": "2024-12-18",
      "id": "96848",
      "original_text": "Registerbekanntmachung nach dem Umwandlungsgesetz\nNiedersachsen Amtsgericht Hannover HRB 201500\nDMA Antriebs- und Systemkomponenten GmbH – Isernhagen",
      "type": "Registerbekanntmachung nach dem Umwandlungsgesetz",
      "state": "Niedersachsen",
      "amtsgericht": "Amtsgericht Hannover",
      "registernummer": "HRB 201500",
      "registerart": "HRB",
      "company_name": "DMA Antriebs- und Systemkomponenten GmbH",
      "company_seat": "Isernhagen",
      "details": "18.12.2024 (Bekanntmachungsdatum)\n\nNiedersachsen Amtsgericht Hannover HRB 201500\nRegisterbekanntmachung nach dem Umwandlungsgesetz 18.12.2024 (Eintragungsdatum)\n\nDMA Antriebs- und Systemkomponenten GmbH\nGesellschaft mit beschränkter Haftung\nIsernhagen\n\nDen Gläubigern der an der Verschmelzung beteiligten Rechtsträger ist, wenn sie binnen sechs Monaten nach dem Tag, an dem die Eintragung der Verschmelzung in das Register des Sitzes desjenigen Rechtsträgers, dessen Gläubiger sie sind, nach § 19  Abs.  3 UmwG als bekannt gemacht gilt, ihren Anspruch nach Grund und Höhe schriftlich anmelden, Sicherheit zu leisten, soweit sie nicht Befriedigung verlangen können. Dieses Recht steht den Gläubigern jedoch nur zu, wenn sie glaubhaft machen, dass durch die Verschmelzung die Erfüllung der Forderung gefährdet wird."
    },
    {
      "date": "2024-12-18",
      "id": "96849",
      "original_text": "Registerbekanntmachung nach dem Umwandlungsgesetz\nNiedersachsen Amtsgericht Hannover HRB 228207\nHölling DMA Antriebs- und Systemkomponenten GmbH – Isernhagen",
      "type": "Registerbekanntmachung nach dem Umwandlungsgesetz",
      "state": "Niedersachsen",
      "amtsgericht": "Amtsgericht Hannover",
      "registernummer": "HRB 228207",
      "registerart": "HRB",
      "company_name": "Hölling DMA Antriebs- und Systemkomponenten GmbH",
      "company_seat": "Isernhagen",
      "details": "18.12.2024 (Bekanntmachungsdatum)\n\nNiedersachsen Amtsgericht Hannover HRB 228207\nRegisterbekanntmachung nach dem Umwandlungsgesetz 18.12.2024 (Eintragungsdatum)\n\nHölling DMA Antriebs- und Systemkomponenten GmbH\nGesellschaft mit beschränkter Haftung\nIsernhagen\n\nDen Gläubigern der an der Verschmelzung beteiligten Rechtsträger ist, wenn sie binnen sechs Monaten nach dem Tag, an dem die Eintragung der Verschmelzung in das Register des Sitzes desjenigen Rechtsträgers, dessen Gläubiger sie sind, nach § 19  Abs.  3 UmwG als bekannt gemacht gilt, ihren Anspruch nach Grund und Höhe schriftlich anmelden, Sicherheit zu leisten, soweit sie nicht Befriedigung verlangen können. Dieses Recht steht den Gläubigern jedoch nur zu, wenn sie glaubhaft machen, dass durch die Verschmelzung die Erfüllung der Forderung gefährdet wird."
    },
    {
      "date": "2024-12-18",
      "id": "96850",
      "original_text": "Registerbekanntmachung nach dem Umwandlungsgesetz\nNiedersachsen Amtsgericht Osnabrück HRA 209195\nGartenbau Müller e. K. – Bohmte",
      "type": "Registerbekanntmachung nach dem Umwandlungsgesetz",
      "state": "Niedersachsen",
      "amtsgericht": "Amtsgericht Osnabrück",
      "registernummer": "HRA 209195",
      "registerart": "HRA",
      "company_name": "Gartenbau Müller e. K.",
      "company_seat": "Bohmte",
      "details": "18.12.2024 (Bekanntmachungsdatum)\n\nNiedersachsen Amtsgericht Osnabrück HRA 209195\nRegisterbekanntmachung nach dem Umwandlungsgesetz 18.12.2024 (Eintragungsdatum)\n\nGartenbau Müller e. K.\nEinzelkaufmann / Einzelkauffrau\nBohmte\n\nDen Gläubigern der an der Ausgliederung beteiligten Rechtsträger ist, wenn sie binnen sechs Monaten nach dem Tag, an dem die Eintragung der Ausgliederung in das Register des Sitzes desjenigen Rechtsträgers, dessen Gläubiger sie sind, nach § 19 Abs. 3 UmwG als bekannt gemacht gilt, ihren Anspruch nach Grund und Höhe schriftlich anmelden, Sicherheit zu leisten, soweit sie nicht Befriedigung verlangen können. Dieses Recht steht den Gläubigern jedoch nur zu, wenn sie glaubhaft machen, dass durch die Ausgliederung die Erfüllung der Forderung gefährdet wird."
    },
    {
      "date": "2024-12-18",
      "id": "96851",
      "original_text": "Registerbekanntmachung nach dem Umwandlungsgesetz\nNiedersachsen Amtsgericht Hannover HRA 200537\nHölling DMA Antriebs- und Systemkomponenten GmbH & Co. KG – Isernhagen",
      "type": "Registerbekanntmachung nach dem Umwandlungsgesetz",
      "state": "Niedersachsen",
      "amtsgericht": "Amtsgericht Hannover",
      "registernummer": "HRA 200537",
      "registerart": "HRA",
      "company_name": "Hölling DMA Antriebs- und Systemkomponenten GmbH & Co. KG",
      "company_seat": "Isernhagen",
      "details": "18.12.2024 (Bekanntmachungsdatum)\n\nNiedersachsen Amtsgericht Hannover HRA 200537\nRegisterbekanntmachung nach dem Umwandlungsgesetz 18.12.2024 (Eintragungsdatum)\n\nHölling DMA Antriebs- und Systemkomponenten GmbH & Co. KG\nKommanditgesellschaft\nIsernhagen\n\nDen Gläubigern der an der Ausgliederung beteiligten Rechtsträger ist, wenn sie binnen sechs Monaten nach dem Tag, an dem die Eintragung der Ausgliederung in das Register des Sitzes desjenigen Rechtsträgers, dessen Gläubiger sie sind, nach § 19 Abs. 3 UmwG als bekannt gemacht gilt, ihren Anspruch nach Grund und Höhe schriftlich anmelden, Sicherheit zu leisten, soweit sie nicht Befriedigung verlangen können. Dieses Recht steht den Gläubigern jedoch nur zu, wenn sie glaubhaft machen, dass durch die Ausgliederung die Erfüllung der Forderung gefährdet wird."
    },
    {
      "date": "2024-12-18",
      "id": "96852",
      "original_text": "Registerbekanntmachung nach dem Umwandlungsgesetz\nNiedersachsen Amtsgericht Oldenburg (Oldenburg) HRA 208406\nObjekt und Raum GmbH & Co. KG – Friesoythe",
      "type": "Registerbekanntmachung nach dem Umwandlungsgesetz",
      "state": "Niedersachsen",
      "amtsgericht": "Amtsgericht Oldenburg (Oldenburg)",
      "registernummer": "HRA 208406",
      "registerart": "HRA",
      "company_name": "Objekt und Raum GmbH & Co. KG",
      "company_seat": "Friesoythe",
      "details": "18.12.2024 (Bekanntmachungsdatum)\n\nNiedersachsen Amtsgericht Oldenburg (Oldenburg) HRA 208406\nRegisterbekanntmachung nach dem Umwandlungsgesetz 18.12.2024 (Eintragungsdatum)\n\nObjekt und Raum GmbH & Co. KG\nKommanditgesellschaft\nFriesoythe\n\nDen Gläubigern der an der Ausgliederung beteiligten Rechtsträger ist, wenn sie binnen sechs Monaten nach dem Tag, an dem die Eintragung der Ausgliederung in das Register des Sitzes desjenigen Rechtsträgers, dessen Gläubiger sie sind, nach § 19 Abs. 3 UmwG als bekannt gemacht gilt, ihren Anspruch nach Grund und Höhe schriftlich anmelden, Sicherheit zu leisten, soweit sie nicht Befriedigung verlangen können. Dieses Recht steht den Gläubigern jedoch nur zu, wenn sie glaubhaft machen, dass durch die Ausgliederung die Erfüllung der Forderung gefährdet wird."
    },
    {
      "date": "2024-12-18",
      "id": "96853",
      "original_text": "Einreichung neuer Dokumente\nNiedersachsen Amtsgericht Lüneburg HRB 201403\nRheinmetall Waffe Munition GmbH – Südheide",
      "type": "Einreichung neuer Dokumente",
      "state": "Niedersachsen",
      "amtsgericht": "Amtsgericht Lüneburg",
      "registernummer": "HRB 201403",
      "registerart": "HRB",
      "company_name": "Rheinmetall Waffe Munition GmbH",
      "company_seat": "Südheide",
      "details": "18.12.2024 (Bekanntmachungsdatum)\n\nNiedersachsen Amtsgericht Lüneburg HRB 201403\nEinreichung neuer Dokumente\n\nRheinmetall Waffe Munition GmbH\nGesellschaft mit beschränkter Haftung\nSüdheide\n\nDie Liste der Mitglieder des Aufsichtsrats wurde beim Registergericht eingereicht."
    },
    {
      "date": "2024-12-18",
      "id": "96854",
      "original_text": "Löschungsankündigung\nNiedersachsen Amtsgericht Aurich HRB 100018 früher Amtsgericht Emden\nOMAG Ostfriesische Maschinenbau Aktiengesellschaft – Emden",
      "type": "Löschungsankündigung",
      "state": "Niedersachsen",
      "amtsgericht": "Amtsgericht Aurich",
      "registernummer": "HRB 100018",
      "registerart": "HRB",
      "company_name": "OMAG Ostfriesische Maschinenbau Aktiengesellschaft",
      "company_seat": "Emden",
      "former_amtsgericht": "Emden",
      "details": "18.12.2024 (Bekanntmachungsdatum)\n\nNiedersachsen Amtsgericht Aurich HRB 100018 früher Amtsgericht Emden\nLöschungsankündigung\n\nOMAG Ostfriesische Maschinenbau Aktiengesellschaft\nAktiengesellschaft\nEmden\n\nDas Registergericht beabsichtigt, die Gesellschaft von Amts wegen nach § 394 FamFG zu löschen. Die Frist zur Erhebung eines Widerspruchs ist auf 1 Monat ab dieser Registerbekanntmachung festgesetzt."
    },
    {
      "date": "2024-12-18",
      "id": "96855",
      "original_text": "Registerbekanntmachung nach dem Umwandlungsgesetz\nNiedersachsen Amtsgericht Hannover HRA 200537\nHölling DMA Antriebs- und Systemkomponenten GmbH & Co. KG – Isernhagen",
      "type": "Registerbekanntmachung nach dem Umwandlungsgesetz",
      "state": "Niedersachsen",
      "amtsgericht": "Amtsgericht Hannover",
      "registernummer": "HRA 200537",
      "registerart": "HRA",
      "company_name": "Hölling DMA Antriebs- und Systemkomponenten GmbH & Co. KG",
      "company_seat": "Isernhagen",
      "details": "18.12.2024 (Bekanntmachungsdatum)\n\nNiedersachsen Amtsgericht Hannover HRA 200537\nRegisterbekanntmachung nach dem Umwandlungsgesetz 18.12.2024 (Eintragungsdatum)\n\nHölling DMA Antriebs- und Systemkomponenten GmbH & Co. KG\nKommanditgesellschaft\nIsernhagen\n\nDen Gläubigern der an der formwechselnden Umwandlung beteiligten Rechtsträger ist, wenn sie binnen sechs Monaten nach dem Tag, an dem die Eintragung der Umwandlung in das Register des Sitzes desjenigen Rechtsträgers, dessen Gläubiger sie sind, nach § 19 Abs. 3 UmwG als bekannt gemacht gilt, ihren Anspruch nach Grund und Höhe schriftlich anmelden, Sicherheit zu leisten, soweit sie nicht Befriedigung verlangen können. Dieses Recht steht den Gläubigern jedoch nur zu, wenn sie glaubhaft machen, dass durch die formwechselnde Umwandlung die Erfüllung der Forderung gefährdet wird."
    },
    {
      "date": "2024-12-18",
      "id": "96856",
      "original_text": "Löschungsankündigung\nNiedersachsen Amtsgericht Lüneburg HRB 208088\nSteinhof Uelzen Verwaltungs UG (haftungsbeschränkt) – Uelzen",
      "type": "Löschungsankündigung",
      "state": "Niedersachsen",
      "amtsgericht": "Amtsgericht Lüneburg",
      "registernummer": "HRB 208088",
      "registerart": "HRB",
      "company_name": "Steinhof Uelzen Verwaltungs UG (haftungsbeschränkt)",
      "company_seat": "Uelzen",
      "details": "18.12.2024 (Bekanntmachungsdatum)\n\nNiedersachsen Amtsgericht Lüneburg HRB 208088\nLöschungsankündigung\n\nSteinhof Uelzen Verwaltungs UG (haftungsbeschränkt)\nGesellschaft mit beschränkter Haftung\nUelzen\n\nDas Registergericht beabsichtigt, die Gesellschaft von Amts wegen nach § 394 FamFG zu löschen. Die Frist zur Erhebung eines Widerspruchs ist auf 1 Monat ab dieser Registerbekanntmachung festgesetzt."
    },
    {
      "date": "2024-12-18",
      "id": "96857",
      "original_text": "Registerbekanntmachung nach dem Umwandlungsgesetz\nNiedersachsen Amtsgericht Walsrode HRB 202637\nBuss Fertiggerichte GmbH – Ottersberg",
      "type": "Registerbekanntmachung nach dem Umwandlungsgesetz",
      "state": "Niedersachsen",
      "amtsgericht": "Amtsgericht Walsrode",
      "registernummer": "HRB 202637",
      "registerart": "HRB",
      "company_name": "Buss Fertiggerichte GmbH",
      "company_seat": "Ottersberg",
      "details": "18.12.2024 (Bekanntmachungsdatum)\n\nNiedersachsen Amtsgericht Walsrode HRB 202637\nRegisterbekanntmachung nach dem Umwandlungsgesetz 18.12.2024 (Eintragungsdatum)\n\nBuss Fertiggerichte GmbH\nGesellschaft mit beschränkter Haftung\nOttersberg\n\nDen Gläubigern der an der Verschmelzung beteiligten Rechtsträger ist, wenn sie binnen sechs Monaten nach dem Tag, an dem die Eintragung der Verschmelzung in das Register des Sitzes desjenigen Rechtsträgers, dessen Gläubiger sie sind, nach § 19  Abs.  3 UmwG als bekannt gemacht gilt, ihren Anspruch nach Grund und Höhe schriftlich anmelden, Sicherheit zu leisten, soweit sie nicht Befriedigung verlangen können. Dieses Recht steht den Gläubigern jedoch nur zu, wenn sie glaubhaft machen, dass durch die Verschmelzung die Erfüllung der Forderung gefährdet wird."
    },
    {
      "date": "2024-12-18",
      "id": "96858",
      "original_text": "Registerbekanntmachung nach dem Umwandlungsgesetz\nNiedersachsen Amtsgericht Hannover HRA 200521\nHölling DMA Industrial First Provision e. K. – Isernhagen",
      "type": "Registerbekanntmachung nach dem Umwandlungsgesetz",
      "state": "Niedersachsen",
      "amtsgericht": "Amtsgericht Hannover",
      "registernummer": "HRA 200521",
      "registerart": "HRA",
      "company_name": "Hölling DMA Industrial First Provision e. K.",
      "company_seat": "Isernhagen",
      "details": "18.12.2024 (Bekanntmachungsdatum)\n\nNiedersachsen Amtsgericht Hannover HRA 200521\nRegisterbekanntmachung nach dem Umwandlungsgesetz 18.12.2024 (Eintragungsdatum)\n\nHölling DMA Industrial First Provision e. K.\nEinzelkaufmann / Einzelkauffrau\nIsernhagen\n\nDen Gläubigern der an der Ausgliederung beteiligten Rechtsträger ist, wenn sie binnen sechs Monaten nach dem Tag, an dem die Eintragung der Ausgliederung in das Register des Sitzes desjenigen Rechtsträgers, dessen Gläubiger sie sind, nach § 19 Abs. 3 UmwG als bekannt gemacht gilt, ihren Anspruch nach Grund und Höhe schriftlich anmelden, Sicherheit zu leisten, soweit sie nicht Befriedigung verlangen können. Dieses Recht steht den Gläubigern jedoch nur zu, wenn sie glaubhaft machen, dass durch die Ausgliederung die Erfüllung der Forderung gefährdet wird."
    },
    {
      "date": "2024-12-18",
      "id": "96859",
      "original_text": "Einreichung neuer Dokumente\nNiedersachsen Amtsgericht Osnabrück HRB 214967\nWiO - Wohnen in Osnabrück GmbH – Osnabrück",
      "type": "Einreichung neuer Dokumente",
      "state": "Niedersachsen",
      "amtsgericht": "Amtsgericht Osnabrück",
      "registernummer": "HRB 214967",
      "registerart": "HRB",
      "company_name": "WiO - Wohnen in Osnabrück GmbH",
      "company_seat": "Osnabrück",
      "details": "18.12.2024 (Bekanntmachungsdatum)\n\nNiedersachsen Amtsgericht Osnabrück HRB 214967\nEinreichung neuer Dokumente\n\nWiO - Wohnen in Osnabrück GmbH\nGesellschaft mit beschränkter Haftung\nOsnabrück\n\nDie Liste der Mitglieder des Aufsichtsrats wurde beim Registergericht eingereicht."
    },
    {
      "date": "2024-12-18",
      "id": "96860",
      "original_text": "Registerbekanntmachung nach dem Umwandlungsgesetz\nNiedersachsen Amtsgericht Oldenburg (Oldenburg) HRA 208330\nMalerbetrieb Objekt und Raum Ralf Müller e.K. – Friesoythe",
      "type": "Registerbekanntmachung nach dem Umwandlungsgesetz",
      "state": "Niedersachsen",
      "amtsgericht": "Amtsgericht Oldenburg (Oldenburg)",
      "registernummer": "HRA 208330",
      "registerart": "HRA",
      "company_name": "Malerbetrieb Objekt und Raum Ralf Müller e.K.",
      "company_seat": "Friesoythe",
      "details": "18.12.2024 (Bekanntmachungsdatum)\n\nNiedersachsen Amtsgericht Oldenburg (Oldenburg) HRA 208330\nRegisterbekanntmachung nach dem Umwandlungsgesetz 18.12.2024 (Eintragungsdatum)\n\nMalerbetrieb Objekt und Raum Ralf Müller e.K.\nEinzelkaufmann / Einzelkauffrau\nFriesoythe\n\nDen Gläubigern der an der Ausgliederung beteiligten Rechtsträger ist, wenn sie binnen sechs Monaten nach dem Tag, an dem die Eintragung der Ausgliederung in das Register des Sitzes desjenigen Rechtsträgers, dessen Gläubiger sie sind, nach § 19 Abs. 3 UmwG als bekannt gemacht gilt, ihren Anspruch nach Grund und Höhe schriftlich anmelden, Sicherheit zu leisten, soweit sie nicht Befriedigung verlangen können. Dieses Recht steht den Gläubigern jedoch nur zu, wenn sie glaubhaft machen, dass durch die Ausgliederung die Erfüllung der Forderung gefährdet wird."
    },
    {
      "date": "2024-12-18",
      "id": "96861",
      "original_text": "Einreichung neuer Dokumente\nRheinland-Pfalz Amtsgericht Landau HRB 2066\nAPL Automobil-Prüftechnik Landau GmbH – Landau in der Pfalz",
      "type": "Einreichung neuer Dokumente",
      "state": "Rheinland-Pfalz",
      "amtsgericht": "Amtsgericht Landau",
      "registernummer": "HRB 2066",
      "registerart": "HRB",
      "company_name": "APL Automobil-Prüftechnik Landau GmbH",
      "company_seat": "Landau in der Pfalz",
      "details": "18.12.2024 (Bekanntmachungsdatum)\n\nRheinland-Pfalz Amtsgericht Landau HRB 2066\nEinreichung neuer Dokumente 18.12.2024 (Eintragungsdatum)\n\nAPL Automobil-Prüftechnik Landau GmbH\nGesellschaft mit beschränkter Haftung\nLandau in der Pfalz\n\nDem Registergericht ist eine neue Liste der Mitglieder des Aufsichtsrates eingereicht worden."
    },
    {
      "date": "2024-12-18",
      "id": "96862",
      "original_text": "Registerbekanntmachung nach dem Umwandlungsgesetz\nRheinland-Pfalz Amtsgericht Mainz HRB 49967\nDr Hochberg Consulting UG (haftungsbeschränkt) – Bodenheim",
      "type": "Registerbekanntmachung nach dem Umwandlungsgesetz",
      "state": "Rheinland-Pfalz",
      "amtsgericht": "Amtsgericht Mainz",
      "registernummer": "HRB 49967",
      "registerart": "HRB",
      "company_name": "Dr Hochberg Consulting UG (haftungsbeschränkt)",
      "company_seat": "Bodenheim",
      "details": "18.12.2024 (Bekanntmachungsdatum)\n\nRheinland-Pfalz Amtsgericht Mainz HRB 49967\nRegisterbekanntmachung nach dem Umwandlungsgesetz 18.12.2024 (Eintragungsdatum)\n\nDr Hochberg Consulting UG (haftungsbeschränkt)\nGesellschaft mit beschränkter Haftung\nBodenheim\n\nAls nicht eingetragen wird veröffentlicht: Den Gläubigern der an der Verschmelzung beteiligten Gesellschaft ist, wenn sie binnen sechs Monaten nach dem Tag, an dem die Eintragung der Verschmelzung in das Register des Sitzes desjenigen Rechtsträgers,dessen Gläubiger sie sind, nach § 19 Abs. 3 UmwG als bekannt gemacht gilt, ihren Anspruch nach Grund und Höhe schriftlich anmelden, Sicherheit zu leisten, soweit sie nicht Befriedigung verlangen können. Dieses Recht steht den Gläubigern jedoch nur zu, wenn sie glaubhaft machen, dass durch die Verschmelzung die Erfüllung der Forderung gefährdet wird."
    },
    {
      "date": "2024-12-18",
      "id": "96863",
      "original_text": "Einreichung neuer Dokumente\nRheinland-Pfalz Amtsgericht Koblenz HRB 14289\nFWM, Fernwärmeversorgung Mayen GmbH – Mayen",
      "type": "Einreichung neuer Dokumente",
      "state": "Rheinland-Pfalz",
      "amtsgericht": "Amtsgericht Koblenz",
      "registernummer": "HRB 14289",
      "registerart": "HRB",
      "company_name": "FWM, Fernwärmeversorgung Mayen GmbH",
      "company_seat": "Mayen",
      "details": "18.12.2024 (Bekanntmachungsdatum)\n\nRheinland-Pfalz Amtsgericht Koblenz HRB 14289\nEinreichung neuer Dokumente\n\nFWM, Fernwärmeversorgung Mayen GmbH\nGesellschaft mit beschränkter Haftung\nMayen\n\nDem Registergericht ist eine neue Liste der Mitglieder des Aufsichtsrates eingereicht worden."
    },
    {
      "date": "2024-12-18",
      "id": "96864",
      "original_text": "Löschungsankündigung\nRheinland-Pfalz Amtsgericht Montabaur HRB 22409\nLawn & Green Culture International GmbH – Katzenelnbogen",
      "type": "Löschungsankündigung",
      "state": "Rheinland-Pfalz",
      "amtsgericht": "Amtsgericht Montabaur",
      "registernummer": "HRB 22409",
      "registerart": "HRB",
      "company_name": "Lawn & Green Culture International GmbH",
      "company_seat": "Katzenelnbogen",
      "details": "18.12.2024 (Bekanntmachungsdatum)\n\nRheinland-Pfalz Amtsgericht Montabaur HRB 22409\nLöschungsankündigung\n\nLawn & Green Culture International GmbH\nGesellschaft mit beschränkter Haftung\nKatzenelnbogen\n\nDas Registergericht beabsichtigt die Gesellschaft von Amts wegen nach § 394 FamFG zu löschen. Die Frist zur Erhebung eines Widerspruchs ist auf einen Monat festgesetzt."
    },
    {
      "date": "2024-12-18",
      "id": "96865",
      "original_text": "Registerbekanntmachung nach dem Umwandlungsgesetz\nRheinland-Pfalz Amtsgericht Bad Kreuznach HRA 10088\nKlein & Becker GmbH u. Co. KG – Idar-Oberstein",
      "type": "Registerbekanntmachung nach dem Umwandlungsgesetz",
      "state": "Rheinland-Pfalz",
      "amtsgericht": "Amtsgericht Bad Kreuznach",
      "registernummer": "HRA 10088",
      "registerart": "HRA",
      "company_name": "Klein & Becker GmbH u. Co. KG",
      "company_seat": "Idar-Oberstein",
      "details": "18.12.2024 (Bekanntmachungsdatum)\n\nRheinland-Pfalz Amtsgericht Bad Kreuznach HRA 10088\nRegisterbekanntmachung nach dem Umwandlungsgesetz 18.12.2024 (Eintragungsdatum)\n\nKlein & Becker GmbH u. Co. KG\nKommanditgesellschaft\nIdar-Oberstein\n\nAls nicht eingetragen wird veröffentlicht: Den Gläubigern der an der Verschmelzung beteiligten Rechtsträger ist, wenn sie binnen sechs Monaten nach dem Tag, an dem die Eintragung der Verschmelzung in das Register des Sitzes desjenigen Rechtsträgers, dessen Gläubiger sie sind, nach § 19 Abs. 3 UmwG als bekannt gemacht gilt, ihren Anspruch nach Grund und Höhe schriftlich anmelden, Sicherheit zu leisten, soweit sie nicht Befriedigung verlangen können. Dieses Recht steht den Gläubigern jedoch nur zu, wenn sie glaubhaft machen, dass durch die Verschmelzung die Erfüllung der Forderung gefährdet wird."
    },
    {
      "date": "2024-12-18",
      "id": "96866",
      "original_text": "Registerbekanntmachung nach dem Umwandlungsgesetz\nRheinland-Pfalz Amtsgericht Bad Kreuznach HRB 10467\nKlein & Becker GmbH – Idar-Oberstein",
      "type": "Registerbekanntmachung nach dem Umwandlungsgesetz",
      "state": "Rheinland-Pfalz",
      "amtsgericht": "Amtsgericht Bad Kreuznach",
      "registernummer": "HRB 10467",
      "registerart": "HRB",
      "company_name": "Klein & Becker GmbH",
      "company_seat": "Idar-Oberstein",
      "details": "18.12.2024 (Bekanntmachungsdatum)\n\nRheinland-Pfalz Amtsgericht Bad Kreuznach HRB 10467\nRegisterbekanntmachung nach dem Umwandlungsgesetz 18.12.2024 (Eintragungsdatum)\n\nKlein & Becker GmbH\nGesellschaft mit beschränkter Haftung\nIdar-Oberstein\n\nAls nicht eingetragen wird veröffentlicht: Den Gläubigern der an der Verschmelzung beteiligten Rechtsträger ist, wenn sie binnen sechs Monaten nach dem Tag, an dem die Eintragung der Verschmelzung in das Register des Sitzes desjenigen Rechtsträgers, dessen Gläubiger sie sind, nach § 19 Abs. 3 UmwG als bekannt gemacht gilt, ihren Anspruch nach Grund und Höhe schriftlich anmelden, Sicherheit zu leisten, soweit sie nicht Befriedigung verlangen können. Dieses Recht steht den Gläubigern jedoch nur zu, wenn sie glaubhaft machen, dass durch die Verschmelzung die Erfüllung der Forderung gefährdet wird."
    },
    {
      "date": "2024-12-18",
      "id": "96867",
      "original_text": "Einreichung neuer Dokumente\nRheinland-Pfalz Amtsgericht Mainz HRB 23461\nPaX Aktiengesellschaft – Ingelheim am Rhein",
      "type": "Einreichung neuer Dokumente",
      "state": "Rheinland-Pfalz",
      "amtsgericht": "Amtsgericht Mainz",
      "registernummer": "HRB 23461",
      "registerart": "HRB",
      "company_name": "PaX Aktiengesellschaft",
      "company_seat": "Ingelheim am Rhein",
      "details": "18.12.2024 (Bekanntmachungsdatum)\n\nRheinland-Pfalz Amtsgericht Mainz HRB 23461\nEinreichung neuer Dokumente\n\nPaX Aktiengesellschaft\nAktiengesellschaft\nIngelheim am Rhein\n\nDem Registergericht ist eine neue Liste der Mitglieder des Aufsichtsrates eingereicht worden."
    },
    {
      "date": "2024-12-18",
      "id": "96868",
      "original_text": "Löschungsankündigung\nRheinland-Pfalz Amtsgericht Bad Kreuznach VR 20820\nMSV Gerach (Motorsportverein Gerach) e.V. – Gerach",
      "type": "Löschungsankündigung",
      "state": "Rheinland-Pfalz",
      "amtsgericht": "Amtsgericht Bad Kreuznach",
      "registernummer": "VR 20820",
      "registerart": "VR",
      "company_name": "MSV Gerach (Motorsportverein Gerach) e.V.",
      "company_seat": "Gerach",
      "details": "18.12.2024 (Bekanntmachungsdatum)\n\nRheinland-Pfalz Amtsgericht Bad Kreuznach VR 20820\nLöschungsankündigung\n\nMSV Gerach (Motorsportverein Gerach) e.V.\neingetragener Verein\nGerach\n\nDas Gericht beabsichtigt, die Eintragung des Vereins im Vereinsregister wegen des Mangels einer wesentlichen Voraussetzung von Amts wegen nach § 395 FamFG als unzulässig zu löschen. Die Frist zur Geltendmachung eines Widerspruchs gegen die beabsichtigte Löschung ist auf einen Monat ab Veröffentlichung bestimmt."
    },
    {
      "date": "2024-12-18",
      "id": "96869",
      "original_text": "Löschungsankündigung\nRheinland-Pfalz Amtsgericht Landau HRB 33381\nPhilipp Hoffmann Holding UG (haftungsbeschränkt) – Neupotz",
      "type": "Löschungsankündigung",
      "state": "Rheinland-Pfalz",
      "amtsgericht": "Amtsgericht Landau",
      "registernummer": "HRB 33381",
      "registerart": "HRB",
      "company_name": "Philipp Hoffmann Holding UG (haftungsbeschränkt)",
      "company_seat": "Neupotz",
      "details": "18.12.2024 (Bekanntmachungsdatum)\n\nRheinland-Pfalz Amtsgericht Landau HRB 33381\nLöschungsankündigung\n\nPhilipp Hoffmann Holding UG (haftungsbeschränkt)\nGesellschaft mit beschränkter Haftung\nNeupotz\n\nDas Registergericht beabsichtigt die Gesellschaft von Amts wegen nach § 394 FamFG zu löschen. Die Frist zur Erhebung eines Widerspruchs ist auf einen Monat festgesetzt."
    },
    {
      "date": "2024-12-18",
      "id": "96870",
      "original_text": "Löschungsankündigung\nNordrhein-Westfalen Amtsgericht Dortmund HRB 29775\nORGAPART U.G. (haftungsbeschränkt) – Dortmund",
      "type": "Löschungsankündigung",
      "state": "Nordrhein-Westfalen",
      "amtsgericht": "Amtsgericht Dortmund",
      "registernummer": "HRB 29775",
      "registerart": "HRB",
      "company_name": "ORGAPART U.G. (haftungsbeschränkt)",
      "company_seat": "Dortmund",
      "details": "18.12.2024 (Bekanntmachungsdatum)\n\nNordrhein-Westfalen Amtsgericht Dortmund HRB 29775\nLöschungsankündigung\n\nORGAPART U.G. (haftungsbeschränkt)\nGesellschaft mit beschränkter Haftung\nDortmund\n\nDas Registergericht beabsichtigt die Gesellschaft von Amts wegen nach § 394 FamFG zu löschen. Die Frist zur Erhebung eines Widerspruchs ist auf zwei Monate festgesetzt."
    },
    {
      "date": "2024-12-18",
      "id": "96871",
      "original_text": "Registerbekanntmachung nach dem Umwandlungsgesetz\nNordrhein-Westfalen Amtsgericht Duisburg HRA 13486\nRudari - Haus und Garten e. K. – Duisburg",
      "type": "Registerbekanntmachung nach dem Umwandlungsgesetz",
      "state": "Nordrhein-Westfalen",
      "amtsgericht": "Amtsgericht Duisburg",
      "registernummer": "HRA 13486",
      "registerart": "HRA",
      "company_name": "Rudari - Haus und Garten e. K.",
      "company_seat": "Duisburg",
      "details": "18.12.2024 (Bekanntmachungsdatum)\n\nNordrhein-Westfalen Amtsgericht Duisburg HRA 13486\nRegisterbekanntmachung nach dem Umwandlungsgesetz 18.12.2024 (Eintragungsdatum)\n\nRudari - Haus und Garten e. K.\nEinzelkaufmann / Einzelkauffrau\nDuisburg\n\n.Den Gläubigern der an der Ausgliederung beteiligten Rechtsträger ist, wenn sie binnen sechs Monaten nach dem Tag, an dem die Eintragung der Ausgliederung in das Register des Sitzes desjenigen Rechtsträgers, dessen Gläubiger sie sind, nach § 19 Absatz 3 UmwG als bekanntgemacht gilt, ihren Anspruch nach Grund und Höhe schriftlich anmelden, Sicherheit zu leisten, soweit sie nicht Befriedigung verlangen können. Dieses Recht steht den Gläubigern jedoch nur zu, wenn sie glaubhaft machen, dass durch die Ausgliederung die Erfüllung ihrer Forderung gefährdet wird."
    },
    {
      "date": "2024-12-18",
      "id": "96872",
      "original_text": "Registerbekanntmachung nach dem Umwandlungsgesetz\nNordrhein-Westfalen Amtsgericht Steinfurt HRB 11151\nWolff Vermögensverwaltungsgesellschaft mbH – Lotte",
      "type": "Registerbekanntmachung nach dem Umwandlungsgesetz",
      "state": "Nordrhein-Westfalen",
      "amtsgericht": "Amtsgericht Steinfurt",
      "registernummer": "HRB 11151",
      "registerart": "HRB",
      "company_name": "Wolff Vermögensverwaltungsgesellschaft mbH",
      "company_seat": "Lotte",
      "details": "18.12.2024 (Bekanntmachungsdatum)\n\nNordrhein-Westfalen Amtsgericht Steinfurt HRB 11151\nRegisterbekanntmachung nach dem Umwandlungsgesetz 18.12.2024 (Eintragungsdatum)\n\nWolff Vermögensverwaltungsgesellschaft mbH\nGesellschaft mit beschränkter Haftung\nLotte\n\nDen Gläubigern der an der Verschmelzung beteiligten Rechtsträger ist, wenn sie binnen sechs Monaten nach dem Tag, an dem die Eintragung der Verschmelzung in das Register des Sitzes desjenigen Rechtsträgers, dessen Gläubiger sie sind, nach § 19 Absatz 3 UmwG als bekanntgemacht gilt, ihren Anspruch nach Grund und Höhe schriftlich anmelden, Sicherheit zu leisten, soweit sie nicht Befriedigung verlangen können. Dieses Recht steht den Gläubigern jedoch nur zu, wenn sie glaubhaft machen, dass durch die Verschmelzung die Erfüllung ihrer Forderung gefährdet wird."
    },
    {
      "date": "2024-12-18",
      "id": "96873",
      "original_text": "Registerbekanntmachung nach dem Umwandlungsgesetz\nNordrhein-Westfalen Amtsgericht Duisburg HRA 13459\nHephaistos Holding GmbH & Co. KG – Duisburg",
      "type": "Registerbekanntmachung nach dem Umwandlungsgesetz",
      "state": "Nordrhein-Westfalen",
      "amtsgericht": "Amtsgericht Duisburg",
      "registernummer": "HRA 13459",
      "registerart": "HRA",
      "company_name": "Hephaistos Holding GmbH & Co. KG",
      "company_seat": "Duisburg",
      "details": "18.12.2024 (Bekanntmachungsdatum)\n\nNordrhein-Westfalen Amtsgericht Duisburg HRA 13459\nRegisterbekanntmachung nach dem Umwandlungsgesetz 18.12.2024 (Eintragungsdatum)\n\nHephaistos Holding GmbH & Co. KG\nKommanditgesellschaft\nDuisburg\n\nBerichtigung:\nDen Gläubigern der an der teilweisen Abspaltung beteiligten Rechtsträger ist, wenn sie binnen sechs Monaten nach dem Tag, an dem die Eintragung der teilweisen Abspaltung in das Register des Sitzes desjenigen Rechtsträgers, dessen Gläubiger sie sind, nach § 19 Absatz 3 UmwG als bekanntgemacht gilt, ihren Anspruch nach Grund und Höhe schriftlich anmelden, Sicherheit zu leisten, soweit sie nicht Befriedigung verlangen können. Dieses Recht steht den Gläubigern jedoch nur zu, wenn sie glaubhaft machen, dass durch die teilweise Abspaltung die Erfüllung ihrer Forderung gefährdet wird."
    },
    {
      "date": "2024-12-18",
      "id": "96874",
      "original_text": "Löschungsankündigung\nBremen Amtsgericht Bremen HRB 39677\nZainspective Construction GmbH – Bremen",
      "type": "Löschungsankündigung",
      "state": "Bremen",
      "amtsgericht": "Amtsgericht Bremen",
      "registernummer": "HRB 39677",
      "registerart": "HRB",
      "company_name": "Zainspective Construction GmbH",
      "company_seat": "Bremen",
      "details": "18.12.2024 (Bekanntmachungsdatum)\n\nBremen Amtsgericht Bremen HRB 39677\nLöschungsankündigung\n\nZainspective Construction GmbH\nGesellschaft mit beschränkter Haftung\nBremen\n\nEs ist beabsichtigt die im Handelsregister eingetragene Gesellschaft von Amts wegen gemäß § 394 FamFG zu löschen. Gegen die Löschung kann beim AG Bremen schriftlich oder zu Protokoll der Geschäftsstelle Widerspruch eingelegt werden. Widerspruchsfrist 4 Wochen."
    },
    {
      "date": "2024-12-18",
      "id": "96875",
      "original_text": "Registerbekanntmachung nach dem Umwandlungsgesetz\nNordrhein-Westfalen Amtsgericht Duisburg HRB 19088\nPCC SE – Duisburg",
      "type": "Registerbekanntmachung nach dem Umwandlungsgesetz",
      "state": "Nordrhein-Westfalen",
      "amtsgericht": "Amtsgericht Duisburg",
      "registernummer": "HRB 19088",
      "registerart": "HRB",
      "company_name": "PCC SE",
      "company_seat": "Duisburg",
      "details": "18.12.2024 (Bekanntmachungsdatum)\n\nNordrhein-Westfalen Amtsgericht Duisburg HRB 19088\nRegisterbekanntmachung nach dem Umwandlungsgesetz 18.12.2024 (Eintragungsdatum)\n\nPCC SE\nEuropäische Aktiengesellschaft (SE)\nDuisburg\n\nDie Gesellschaft hat Gläubigern, deren Forderungen vor dieser Bekanntmachung begründet worden sind, Sicherheit zu leisten, soweit sie nicht Befriedigung verlangen können, wenn sie sich binnen sechs Monaten zu diesem Zweck melden."
    },
    {
      "date": "2024-12-18",
      "id": "96876",
      "original_text": "Löschungsankündigung\nNordrhein-Westfalen Amtsgericht Köln HRB 105820\nsimplay UG (haftungebeschränkt) – Köln",
      "type": "Löschungsankündigung",
      "state": "Nordrhein-Westfalen",
      "amtsgericht": "Amtsgericht Köln",
      "registernummer": "HRB 105820",
      "registerart": "HRB",
      "company_name": "simplay UG (haftungebeschränkt)",
      "company_seat": "Köln",
      "details": "18.12.2024 (Bekanntmachungsdatum)\n\nNordrhein-Westfalen Amtsgericht Köln HRB 105820\nLöschungsankündigung\n\nsimplay UG (haftungebeschränkt)\nGesellschaft mit beschränkter Haftung\nKöln\n\nDas Registergericht beabsichtigt die Gesellschaft von Amts wegen nach § 394 FamFG zu löschen. Die Frist zur Erhebung eines Widerspruchs ist auf einen Monat festgesetzt."
    },
    {
      "date": "2024-12-18",
      "id": "96877",
      "original_text": "Registerbekanntmachung nach dem Umwandlungsgesetz\nNordrhein-Westfalen Amtsgericht Duisburg HRB 19088\nPCC SE – Duisburg",
      "type": "Registerbekanntmachung nach dem Umwandlungsgesetz",
      "state": "Nordrhein-Westfalen",
      "amtsgericht": "Amtsgericht Duisburg",
      "registernummer": "HRB 19088",
      "registerart": "HRB",
      "company_name": "PCC SE",
      "company_seat": "Duisburg",
      "details": "18.12.2024 (Bekanntmachungsdatum)\n\nNordrhein-Westfalen Amtsgericht Duisburg HRB 19088\nRegisterbekanntmachung nach dem Umwandlungsgesetz 18.12.2024 (Eintragungsdatum)\n\nPCC SE\nEuropäische Aktiengesellschaft (SE)\nDuisburg\n\nDie Gesellschaft hat Gläubigern, deren Forderungen vor dieser Bekanntmachung begründet worden sind, Sicherheit zu leisten, soweit sie nicht Befriedigung verlangen können, wenn sie sich binnen sechs Monaten zu diesem Zweck melden."
    },
    {
      "date": "2024-12-18",
      "id": "96878",
      "original_text": "Einreichung neuer Dokumente\nNordrhein-Westfalen Amtsgericht Düsseldorf HRB 92244\nVantage Towers AG – Düsseldorf",
      "type": "Einreichung neuer Dokumente",
      "state": "Nordrhein-Westfalen",
      "amtsgericht": "Amtsgericht Düsseldorf",
      "registernummer": "HRB 92244",
      "registerart": "HRB",
      "company_name": "Vantage Towers AG",
      "company_seat": "Düsseldorf",
      "details": "18.12.2024 (Bekanntmachungsdatum)\n\nNordrhein-Westfalen Amtsgericht Düsseldorf HRB 92244\nEinreichung neuer Dokumente 18.12.2024 (Eintragungsdatum)\n\nVantage Towers AG\nAktiengesellschaft\nDüsseldorf\n\nDem Registergericht ist eine neue Liste der Mitglieder des Aufsichtsrates eingereicht worden."
    },
    {
      "date": "2024-12-18",
      "id": "96879",
      "original_text": "Registerbekanntmachung nach dem Umwandlungsgesetz\nNordrhein-Westfalen Amtsgericht Duisburg HRA 6824\nJaegers Holding GmbH & Co. KG – Duisburg",
      "type": "Registerbekanntmachung nach dem Umwandlungsgesetz",
      "state": "Nordrhein-Westfalen",
      "amtsgericht": "Amtsgericht Duisburg",
      "registernummer": "HRA 6824",
      "registerart": "HRA",
      "company_name": "Jaegers Holding GmbH & Co. KG",
      "company_seat": "Duisburg",
      "details": "18.12.2024 (Bekanntmachungsdatum)\n\nNordrhein-Westfalen Amtsgericht Duisburg HRA 6824\nRegisterbekanntmachung nach dem Umwandlungsgesetz 18.12.2024 (Eintragungsdatum)\n\nJaegers Holding GmbH & Co. KG\nKommanditgesellschaft\nDuisburg\n\nBerichtigung:\nDen Gläubigern der an der teilweisen Abspaltung beteiligten Rechtsträger ist, wenn sie binnen sechs Monaten nach dem Tag, an dem die Eintragung der teilweisen Abspaltung in das Register des Sitzes desjenigen Rechtsträgers, dessen Gläubiger sie sind, nach § 19 Absatz 3 UmwG als bekanntgemacht gilt, ihren Anspruch nach Grund und Höhe schriftlich anmelden, Sicherheit zu leisten, soweit sie nicht Befriedigung verlangen können. Dieses Recht steht den Gläubigern jedoch nur zu, wenn sie glaubhaft machen, dass durch die teilweise Abspaltung die Erfüllung ihrer Forderung gefährdet wird."
    },
    {
      "date": "2024-12-18",
      "id": "96880",
      "original_text": "Sonstige Registerbekanntmachung\nNordrhein-Westfalen Amtsgericht Aachen HRB 560\nSTAWAG - Stadt- und Städteregionswerke Aachen AG – Aachen",
      "type": "Sonstige Registerbekanntmachung",
      "state": "Nordrhein-Westfalen",
      "amtsgericht": "Amtsgericht Aachen",
      "registernummer": "HRB 560",
      "registerart": "HRB",
      "company_name": "STAWAG - Stadt- und Städteregionswerke Aachen AG",
      "company_seat": "Aachen",
      "details": "18.12.2024 (Bekanntmachungsdatum)\n\nNordrhein-Westfalen Amtsgericht Aachen HRB 560\nSonstige Registerbekanntmachung 18.12.2024 (Eintragungsdatum)\n\nSTAWAG - Stadt- und Städteregionswerke Aachen AG\nAktiengesellschaft\nAachen\n\nAls nicht eingetragen wird veröffentlicht: Den Gläubigern der Gesellschaft, deren Forderungen begründet worden sind bevor die Eintragung der Beendigung des Beherrschungsvertrages  in das Handelsregister nach § 10 des Handelsgesetzbuches als bekanntgemacht gilt, hat der andere Vertragsteil Sicherheit zu leisten, wenn sie sich binnen sechs Monaten nach der Bekanntmachung der Eintragung zu diesem Zweck bei ihm melden."
    },
    {
      "date": "2024-12-18",
      "id": "96881",
      "original_text": "Registerbekanntmachung nach dem Umwandlungsgesetz\nNordrhein-Westfalen Amtsgericht Duisburg HRB 32003\nPCC Integrated Chemistries GmbH – Duisburg",
      "type": "Registerbekanntmachung nach dem Umwandlungsgesetz",
      "state": "Nordrhein-Westfalen",
      "amtsgericht": "Amtsgericht Duisburg",
      "registernummer": "HRB 32003",
      "registerart": "HRB",
      "company_name": "PCC Integrated Chemistries GmbH",
      "company_seat": "Duisburg",
      "details": "18.12.2024 (Bekanntmachungsdatum)\n\nNordrhein-Westfalen Amtsgericht Duisburg HRB 32003\nRegisterbekanntmachung nach dem Umwandlungsgesetz 18.12.2024 (Eintragungsdatum)\n\nPCC Integrated Chemistries GmbH\nGesellschaft mit beschränkter Haftung\nDuisburg\n\nDie Gesellschaft hat Gläubigern, deren Forderungen vor dieser Bekanntmachung begründet worden sind, Sicherheit zu leisten, soweit sie nicht Befriedigung verlangen können, wenn sie sich binnen sechs Monaten zu diesem Zweck melden."
    },
    {
      "date": "2024-12-18",
      "id": "96882",
      "original_text": "Löschungsankündigung\nNordrhein-Westfalen Amtsgericht Essen HRB 31675\nK.A.R UG (haftungsbeschränkt) – Essen",
      "type": "Löschungsankündigung",
      "state": "Nordrhein-Westfalen",
      "amtsgericht": "Amtsgericht Essen",
      "registernummer": "HRB 31675",
      "registerart": "HRB",
      "company_name": "K.A.R UG (haftungsbeschränkt)",
      "company_seat": "Essen",
      "details": "18.12.2024 (Bekanntmachungsdatum)\n\nNordrhein-Westfalen Amtsgericht Essen HRB 31675\nLöschungsankündigung\n\nK.A.R UG (haftungsbeschränkt)\nGesellschaft mit beschränkter Haftung\nEssen\n\nDas Registergericht beabsichtigt die Gesellschaft von Amts wegen nach § 394 FamFG zu löschen. Die Frist zur Erhebung eines Widerspruchs ist auf einen Monat festgesetzt."
    },
    {
      "date": "2024-12-18",
      "id": "96883",
      "original_text": "Registerbekanntmachung nach dem Umwandlungsgesetz\nNordrhein-Westfalen Amtsgericht Duisburg HRB 33576\nPCC Chemicals GmbH – Duisburg",
      "type": "Registerbekanntmachung nach dem Umwandlungsgesetz",
      "state": "Nordrhein-Westfalen",
      "amtsgericht": "Amtsgericht Duisburg",
      "registernummer": "HRB 33576",
      "registerart": "HRB",
      "company_name": "PCC Chemicals GmbH",
      "company_seat": "Duisburg",
      "details": "18.12.2024 (Bekanntmachungsdatum)\n\nNordrhein-Westfalen Amtsgericht Duisburg HRB 33576\nRegisterbekanntmachung nach dem Umwandlungsgesetz 18.12.2024 (Eintragungsdatum)\n\nPCC Chemicals GmbH\nGesellschaft mit beschränkter Haftung\nDuisburg\n\nDie Gesellschaft hat Gläubigern, deren Forderungen vor dieser Bekanntmachung begründet worden sind, Sicherheit zu leisten, soweit sie nicht Befriedigung verlangen können, wenn sie sich binnen sechs Monaten zu diesem Zweck melden."
    },
    {
      "date": "2024-12-18",
      "id": "96884",
      "original_text": "Registerbekanntmachung nach dem Umwandlungsgesetz\nNordrhein-Westfalen Amtsgericht Bad Oeynhausen HRB 13486\nJAKA-BKL GmbH – Stemwede",
      "type": "Registerbekanntmachung nach dem Umwandlungsgesetz",
      "state": "Nordrhein-Westfalen",
      "amtsgericht": "Amtsgericht Bad Oeynhausen",
      "registernummer": "HRB 13486",
      "registerart": "HRB",
      "company_name": "JAKA-BKL GmbH",
      "company_seat": "Stemwede",
      "details": "18.12.2024 (Bekanntmachungsdatum)\n\nNordrhein-Westfalen Amtsgericht Bad Oeynhausen HRB 13486\nRegisterbekanntmachung nach dem Umwandlungsgesetz 18.12.2024 (Eintragungsdatum)\n\nJAKA-BKL GmbH\nGesellschaft mit beschränkter Haftung\nStemwede\n\nDen Gläubigern der an der Verschmelzung beteiligten Rechtsträger ist, wenn sie binnen sechs Monaten nach dem Tag, an dem die Eintragung der Verschmelzung in das Register des Sitzes desjenigen Rechtsträgers, dessen Gläubiger sie sind, nach § 19 Absatz 3 UmwG als bekanntgemacht gilt, ihren Anspruch nach Grund und Höhe schriftlich anmelden, Sicherheit zu leisten, soweit sie nicht Befriedigung verlangen können. Dieses Recht steht den Gläubigern jedoch nur zu, wenn sie glaubhaft machen, dass durch die Verschmelzung die Erfüllung ihrer Forderung gefährdet wird."
    },
    {
      "date": "2024-12-18",
      "id": "96885",
      "original_text": "Löschungsankündigung\nNordrhein-Westfalen Amtsgericht Siegen HRB 10677\nHillebrand Management GmbH – Attendorn",
      "type": "Löschungsankündigung",
      "state": "Nordrhein-Westfalen",
      "amtsgericht": "Amtsgericht Siegen",
      "registernummer": "HRB 10677",
      "registerart": "HRB",
      "company_name": "Hillebrand Management GmbH",
      "company_seat": "Attendorn",
      "details": "18.12.2024 (Bekanntmachungsdatum)\n\nNordrhein-Westfalen Amtsgericht Siegen HRB 10677\nLöschungsankündigung\n\nHillebrand Management GmbH\nGesellschaft mit beschränkter Haftung\nAttendorn\n\nDas Registergericht beabsichtigt die Gesellschaft von Amts wegen nach § 394 FamFG zu löschen. Die Frist zur Erhebung eines Widerspruchs ist auf drei Monate festgesetzt."
    },
    {
      "date": "2024-12-18",
      "id": "96886",
      "original_text": "Registerbekanntmachung nach dem Umwandlungsgesetz\nNordrhein-Westfalen Amtsgericht Düsseldorf HRB 69604\nERGO Zehnte Beteiligungsgesellschaft mbH – Düsseldorf",
      "type": "Registerbekanntmachung nach dem Umwandlungsgesetz",
      "state": "Nordrhein-Westfalen",
      "amtsgericht": "Amtsgericht Düsseldorf",
      "registernummer": "HRB 69604",
      "registerart": "HRB",
      "company_name": "ERGO Zehnte Beteiligungsgesellschaft mbH",
      "company_seat": "Düsseldorf",
      "details": "18.12.2024 (Bekanntmachungsdatum)\n\nNordrhein-Westfalen Amtsgericht Düsseldorf HRB 69604\nRegisterbekanntmachung nach dem Umwandlungsgesetz 18.12.2024 (Eintragungsdatum)\n\nERGO Zehnte Beteiligungsgesellschaft mbH\nGesellschaft mit beschränkter Haftung\nDüsseldorf\n\nDen Gläubigern der an der Verschmelzung beteiligten Rechtsträger ist, wenn sie binnen sechs Monaten nach dem Tag, an dem die Eintragung der Verschmelzung in das Register des Sitzes desjenigen Rechtsträgers, dessen Gläubiger sie sind, nach § 19 Absatz 3 UmwG als bekanntgemacht gilt, ihren Anspruch nach Grund und Höhe schriftlich anmelden, Sicherheit zu leisten, soweit sie nicht Befriedigung verlangen können. Dieses Recht steht den Gläubigern jedoch nur zu, wenn sie glaubhaft machen, dass durch die Verschmelzung die Erfüllung ihrer Forderung gefährdet wird."
    },
    {
      "date": "2024-12-18",
      "id": "96887",
      "original_text": "Registerbekanntmachung nach dem Umwandlungsgesetz\nNordrhein-Westfalen Amtsgericht Siegburg HRA 7166\nWolf Elektrotechnik GmbH & Co. KG – Bad Honnef",
      "type": "Registerbekanntmachung nach dem Umwandlungsgesetz",
      "state": "Nordrhein-Westfalen",
      "amtsgericht": "Amtsgericht Siegburg",
      "registernummer": "HRA 7166",
      "registerart": "HRA",
      "company_name": "Wolf Elektrotechnik GmbH & Co. KG",
      "company_seat": "Bad Honnef",
      "details": "18.12.2024 (Bekanntmachungsdatum)\n\nNordrhein-Westfalen Amtsgericht Siegburg HRA 7166\nRegisterbekanntmachung nach dem Umwandlungsgesetz 18.12.2024 (Eintragungsdatum)\n\nWolf Elektrotechnik GmbH & Co. KG\nKommanditgesellschaft\nBad Honnef\n\nDen Gläubigern der an der #DV.UmF(Text=\"Bitte wählen Sie die zutreffende Art nach UmwG aus!\",Eingabe=\"Verschmelzung\",\"Aufspaltung\",\"Abspaltung\",\"Ausgliederung\",\"Vermögensübertragung\",\"formwechselnden Umwandlung\") beteiligten Rechtsträger ist, wenn sie binnen sechs Monaten nach dem Tag, an dem die Eintragung der #DV.UmF in das Register des Sitzes #DV.RTr(Text=\"Bitte wählen Sie aus, ob ein oder mehrere andere Rechtsträger betroffen sind!\",Eingabe=\"desjenigen Rechtsträgers, dessen Gläubiger\",\"derjenigen Rechtsträger deren Gläubiger\") sie sind, nach § 19 Absatz 3 UmwG als bekanntgemacht gilt, ihren Anspruch nach Grund und Höhe schriftlich anmelden, Sicherheit zu leisten, soweit sie nicht Befriedigung verlangen können. Dieses Recht steht den Gläubigern jedoch nur zu, wenn sie glaubhaft machen, dass durch die #DV.UmF die Erfüllung ihrer Forderung gefährdet wird."
    },
    {
      "date": "2024-12-18",
      "id": "96888",
      "original_text": "Löschungsankündigung\nNordrhein-Westfalen Amtsgericht Essen HRB 33269\nCP Sicherheit & Service Dienstleistung GmbH – Essen",
      "type": "Löschungsankündigung",
      "state": "Nordrhein-Westfalen",
      "amtsgericht": "Amtsgericht Essen",
      "registernummer": "HRB 33269",
      "registerart": "HRB",
      "company_name": "CP Sicherheit & Service Dienstleistung GmbH",
      "company_seat": "Essen",
      "details": "18.12.2024 (Bekanntmachungsdatum)\n\nNordrhein-Westfalen Amtsgericht Essen HRB 33269\nLöschungsankündigung\n\nCP Sicherheit & Service Dienstleistung GmbH\nGesellschaft mit beschränkter Haftung\nEssen\n\nDas Registergericht beabsichtigt die Gesellschaft von Amts wegen nach § 394 FamFG zu löschen. Die Frist zur Erhebung eines Widerspruchs ist auf einen Monat festgesetzt."
    },
    {
      "date": "2024-12-18",
      "id": "96889",
      "original_text": "Löschungsankündigung\nNordrhein-Westfalen Amtsgericht Hamm HRB 8108\nInventus BioTec Geschäftsführungsgesellschaft für innovative Bioanalytik, Biosensoren und Diagnostika mbH – Hamm",
      "type": "Löschungsankündigung",
      "state": "Nordrhein-Westfalen",
      "amtsgericht": "Amtsgericht Hamm",
      "registernummer": "HRB 8108",
      "registerart": "HRB",
      "company_name": "Inventus BioTec Geschäftsführungsgesellschaft für innovative Bioanalytik, Biosensoren und Diagnostika mbH",
      "company_seat": "Hamm",
      "details": "18.12.2024 (Bekanntmachungsdatum)\n\nNordrhein-Westfalen Amtsgericht Hamm HRB 8108\nLöschungsankündigung\n\nInventus BioTec Geschäftsführungsgesellschaft für innovative Bioanalytik, Biosensoren und Diagnostika mbH\nGesellschaft mit beschränkter Haftung\nHamm\n\nDas Registergericht beabsichtigt die Gesellschaft von Amts wegen nach § 394 FamFG zu löschen. Die Frist zur Erhebung eines Widerspruchs ist auf drei Monate festgesetzt."
    },
    {
      "date": "2024-12-18",
      "id": "96890",
      "original_text": "Einreichung neuer Dokumente\nNordrhein-Westfalen Amtsgericht Düren HRB 328\nMetsä Tissue GmbH – Kreuzau",
      "type": "Einreichung neuer Dokumente",
      "state": "Nordrhein-Westfalen",
      "amtsgericht": "Amtsgericht Düren",
      "registernummer": "HRB 328",
      "registerart": "HRB",
      "company_name": "Metsä Tissue GmbH",
      "company_seat": "Kreuzau",
      "details": "18.12.2024 (Bekanntmachungsdatum)\n\nNordrhein-Westfalen Amtsgericht Düren HRB 328\nEinreichung neuer Dokumente 18.12.2024 (Eintragungsdatum)\n\nMetsä Tissue GmbH\nGesellschaft mit beschränkter Haftung\nKreuzau\n\nDem Registergericht ist eine neue Liste der Mitglieder des Aufsichtsrates eingereicht worden."
    },
    {
      "date": "2024-12-18",
      "id": "96891",
      "original_text": "Löschungsankündigung\nNordrhein-Westfalen Amtsgericht Bochum HRB 19279\nMcKinley Objektgesellschaft IV mbH – Witten",
      "type": "Löschungsankündigung",
      "state": "Nordrhein-Westfalen",
      "amtsgericht": "Amtsgericht Bochum",
      "registernummer": "HRB 19279",
      "registerart": "HRB",
      "company_name": "McKinley Objektgesellschaft IV mbH",
      "company_seat": "Witten",
      "details": "18.12.2024 (Bekanntmachungsdatum)\n\nNordrhein-Westfalen Amtsgericht Bochum HRB 19279\nLöschungsankündigung\n\nMcKinley Objektgesellschaft IV mbH\nGesellschaft mit beschränkter Haftung\nWitten\n\nDas Registergericht beabsichtigt die Gesellschaft von Amts wegen nach § 394 FamFG zu löschen. Die Frist zur Erhebung eines Widerspruchs ist auf drei Monate festgesetzt."
    },
    {
      "date": "2024-12-18",
      "id": "96892",
      "original_text": "Löschungsankündigung\nNordrhein-Westfalen Amtsgericht Essen HRB 25375\nUnity Prestige GmbH – Essen",
      "type": "Löschungsankündigung",
      "state": "Nordrhein-Westfalen",
      "amtsgericht": "Amtsgericht Essen",
      "registernummer": "HRB 25375",
      "registerart": "HRB",
      "company_name": "Unity Prestige GmbH",
      "company_seat": "Essen",
      "details": "18.12.2024 (Bekanntmachungsdatum)\n\nNordrhein-Westfalen Amtsgericht Essen HRB 25375\nLöschungsankündigung\n\nUnity Prestige GmbH\nGesellschaft mit beschränkter Haftung\nEssen\n\nDas Registergericht beabsichtigt die Gesellschaft von Amts wegen nach § 394 FamFG zu löschen. Die Frist zur Erhebung eines Widerspruchs ist auf einen Monat festgesetzt."
    },
    {
      "date": "2024-12-18",
      "id": "96893",
      "original_text": "Registerbekanntmachung nach dem Umwandlungsgesetz\nNordrhein-Westfalen Amtsgericht Iserlohn HRB 11080\nKOSTAL Industriegrundbesitz Zwei GmbH – Lüdenscheid",
      "type": "Registerbekanntmachung nach dem Umwandlungsgesetz",
      "state": "Nordrhein-Westfalen",
      "amtsgericht": "Amtsgericht Iserlohn",
      "registernummer": "HRB 11080",
      "registerart": "HRB",
      "company_name": "KOSTAL Industriegrundbesitz Zwei GmbH",
      "company_seat": "Lüdenscheid",
      "details": "18.12.2024 (Bekanntmachungsdatum)\n\nNordrhein-Westfalen Amtsgericht Iserlohn HRB 11080\nRegisterbekanntmachung nach dem Umwandlungsgesetz 07.11.2024 (Eintragungsdatum)\n\nKOSTAL Industriegrundbesitz Zwei GmbH\nGesellschaft mit beschränkter Haftung\nLüdenscheid\n\nDen Gläubigern der an der Ausgliederung beteiligten Rechtsträger ist, wenn sie binnen sechs Monaten nach dem Tag, an dem die Eintragung der Ausgliederung in das Register des Sitzes desjenigen Rechtsträgers, dessen Gläubiger sie sind, nach § 19 Absatz 3 UmwG als bekanntgemacht gilt, ihren Anspruch nach Grund und Höhe schriftlich anmelden, Sicherheit zu leisten, soweit sie nicht Befriedigung verlangen können. Dieses Recht steht den Gläubigern jedoch nur zu, wenn sie glaubhaft machen, dass durch die Ausgliederung die Erfüllung ihrer Forderung gefährdet wird."
    },
    {
      "date": "2024-12-18",
      "id": "96894",
      "original_text": "Registerbekanntmachung nach dem Umwandlungsgesetz\nThüringen Amtsgericht Jena HRB 510838\nDivine Svetlina GmbH Veranstaltungsmanagement und Organisation – Bad Tabarz",
      "type": "Registerbekanntmachung nach dem Umwandlungsgesetz",
      "state": "Thüringen",
      "amtsgericht": "Amtsgericht Jena",
      "registernummer": "HRB 510838",
      "registerart": "HRB",
      "company_name": "Divine Svetlina GmbH Veranstaltungsmanagement und Organisation",
      "company_seat": "Bad Tabarz",
      "details": "18.12.2024 (Bekanntmachungsdatum)\n\nThüringen Amtsgericht Jena HRB 510838\nRegisterbekanntmachung nach dem Umwandlungsgesetz 18.12.2024 (Eintragungsdatum)\n\nDivine Svetlina GmbH Veranstaltungsmanagement und Organisation\nGesellschaft mit beschränkter Haftung\nBad Tabarz\n\nNicht eingetragen: Den Gläubigern der an der Verschmelzung beteiligten Rechtsträger, ist wenn sie binnen sechs Monaten nach dem Tag, an dem die Eintragung der Verschmelzung in das Register des Sitzes desjenigen Rechtsträgers, dessen Gläubiger sie sind,  nach § 19 Abs. 3 UmwG als bekanntgemacht gilt, ihren Anspruch nach Grund und Höhe schriftlich anmelden, Sicherheit zu leisten, soweit sie nicht Befriedigung verlangen können. Dieses Recht steht ihnen jedoch nur zu, wenn sie glaubhaft machen, daß durch die Verschmelzung die Erfüllung ihrer Forderung gefährdet wird."
    },
    {
      "date": "2024-12-18",
      "id": "96895",
      "original_text": "Registerbekanntmachung nach dem Umwandlungsgesetz\nThüringen Amtsgericht Jena HRA 506809\nZanko Zanev e.K. Inhaber: Zanko Zanev – Bad Tabarz",
      "type": "Registerbekanntmachung nach dem Umwandlungsgesetz",
      "state": "Thüringen",
      "amtsgericht": "Amtsgericht Jena",
      "registernummer": "HRA 506809",
      "registerart": "HRA",
      "company_name": "Zanko Zanev e.K. Inhaber: Zanko Zanev",
      "company_seat": "Bad Tabarz",
      "details": "18.12.2024 (Bekanntmachungsdatum)\n\nThüringen Amtsgericht Jena HRA 506809\nRegisterbekanntmachung nach dem Umwandlungsgesetz 18.12.2024 (Eintragungsdatum)\n\nZanko Zanev e.K. Inhaber: Zanko Zanev\nEinzelkaufmann / Einzelkauffrau\nBad Tabarz\n\nNicht eingetragen: Den Gläubigern der an der Verschmelzung beteiligten Rechtsträger, ist wenn sie binnen sechs Monaten nach dem Tag, an dem die Eintragung der Verschmelzung in das Register des Sitzes desjenigen Rechtsträgers, dessen Gläubiger sie sind,  nach § 19 Abs. 3 UmwG als bekanntgemacht gilt, ihren Anspruch nach Grund und Höhe schriftlich anmelden, Sicherheit zu leisten, soweit sie nicht Befriedigung verlangen können. Dieses Recht steht ihnen jedoch nur zu, wenn sie glaubhaft machen, daß durch die Verschmelzung die Erfüllung ihrer Forderung gefährdet wird."
    },
    {
      "date": "2024-12-18",
      "id": "96896",
      "original_text": "Einreichung neuer Dokumente\nThüringen Amtsgericht Jena HRB 512700\nNahverkehrsgesellschaft des Landkreises Gotha mbH (NVG) – Gotha",
      "type": "Einreichung neuer Dokumente",
      "state": "Thüringen",
      "amtsgericht": "Amtsgericht Jena",
      "registernummer": "HRB 512700",
      "registerart": "HRB",
      "company_name": "Nahverkehrsgesellschaft des Landkreises Gotha mbH (NVG)",
      "company_seat": "Gotha",
      "details": "18.12.2024 (Bekanntmachungsdatum)\n\nThüringen Amtsgericht Jena HRB 512700\nEinreichung neuer Dokumente\n\nNahverkehrsgesellschaft des Landkreises Gotha mbH (NVG)\nGesellschaft mit beschränkter Haftung\nGotha\n\nBekanntmachung gem. § 52 Abs. 3 Satz 2 GmbHG: Aufgrund einer Veränderung in den Personen der Aufsichtsratsmitglieder (Berichtigung) ist durch die Geschäftsführer eine neue Liste zum Handelsregister eingereicht worden."
    },
    {
      "date": "2024-12-18",
      "id": "96897",
      "original_text": "Registerbekanntmachung nach dem Umwandlungsgesetz\nThüringen Amtsgericht Jena HRB 208358\nArbeiterwohlfahrt Saalfeld Dienstleistungs- und Service GmbH – Saalfeld/Saale",
      "type": "Registerbekanntmachung nach dem Umwandlungsgesetz",
      "state": "Thüringen",
      "amtsgericht": "Amtsgericht Jena",
      "registernummer": "HRB 208358",
      "registerart": "HRB",
      "company_name": "Arbeiterwohlfahrt Saalfeld Dienstleistungs- und Service GmbH",
      "company_seat": "Saalfeld/Saale",
      "details": "18.12.2024 (Bekanntmachungsdatum)\n\nThüringen Amtsgericht Jena HRB 208358\nRegisterbekanntmachung nach dem Umwandlungsgesetz 18.12.2024 (Eintragungsdatum)\n\nArbeiterwohlfahrt Saalfeld Dienstleistungs- und Service GmbH\nGesellschaft mit beschränkter Haftung\nSaalfeld/Saale\n\nNicht eingetragen: Den Gläubigern der an der Ausgliederung beteiligten Rechtsträger, ist wenn sie binnen sechs Monaten nach dem Tag, an dem die Eintragung der Ausgliederung in das Register des Sitzes desjenigen Rechtsträgers, dessen Gläubiger sie sind, nach §§125, 19 Abs. 3 UmwG als bekanntgemacht gilt, ihren Anspruch nach Grund und Höhe schriftlich anmelden, Sicherheit zu leisten, soweit sie nicht Befriedigung verlangen können. Dieses Recht steht ihnen jedoch nur zu, wenn sie glaubhaft machen, daß durch die Ausgliederung die Erfüllung ihrer Forderung gefährdet wird."
    },
    {
      "date": "2024-12-18",
      "id": "96898",
      "original_text": "Löschungsankündigung\nThüringen Amtsgericht Jena HRB 514328\nREM - Real Event Music UG (haftungsbeschränkt) – Artern",
      "type": "Löschungsankündigung",
      "state": "Thüringen",
      "amtsgericht": "Amtsgericht Jena",
      "registernummer": "HRB 514328",
      "registerart": "HRB",
      "company_name": "REM - Real Event Music UG (haftungsbeschränkt)",
      "company_seat": "Artern",
      "details": "18.12.2024 (Bekanntmachungsdatum)\n\nThüringen Amtsgericht Jena HRB 514328\nLöschungsankündigung\n\nREM - Real Event Music UG (haftungsbeschränkt)\nGesellschaft mit beschränkter Haftung\nArtern\n\nDas Registergericht beabsichtigt, den im Handelsregister eingetragenen Geschäftsführer Christian Lustig wegen unzulässiger Eintragung nach § 395 FamFG von Amts wegen zu löschen. Die Frist zur Erhebung eines Widerspruchs gegen die beabsichtigte Löschung wird auf einen Monat festgesetzt."
    },
    {
      "date": "2024-12-18",
      "id": "96899",
      "original_text": "Löschungsankündigung\nHessen Amtsgericht Frankfurt am Main HRB 97988\nBETAM Holding GmbH – Frankfurt am Main",
      "type": "Löschungsankündigung",
      "state": "Hessen",
      "amtsgericht": "Amtsgericht Frankfurt am Main",
      "registernummer": "HRB 97988",
      "registerart": "HRB",
      "company_name": "BETAM Holding GmbH",
      "company_seat": "Frankfurt am Main",
      "details": "18.12.2024 (Bekanntmachungsdatum)\n\nHessen Amtsgericht Frankfurt am Main HRB 97988\nLöschungsankündigung\n\nBETAM Holding GmbH\nGesellschaft mit beschränkter Haftung\nFrankfurt am Main\n\nEs ist beabsichtigt, die Gesellschaft wegen Vermögenslosigkeit gemäß § 394 FamFG von Amts wegen im Handelsregister zu löschen. Hiergegen kann innerhalb eines Monats nach dieser Veröffentlichung Widerspruch bei dem Amtsgericht Frankfurt am Main eingelegt werden."
    },
    {
      "date": "2024-12-18",
      "id": "96900",
      "original_text": "Löschungsankündigung\nHessen Amtsgericht Friedberg HRB 9614\nTLA-Recruitment UG (haftungsbeschränkt) – Bad Nauheim",
      "type": "Löschungsankündigung",
      "state": "Hessen",
      "amtsgericht": "Amtsgericht Friedberg",
      "registernummer": "HRB 9614",
      "registerart": "HRB",
      "company_name": "TLA-Recruitment UG (haftungsbeschränkt)",
      "company_seat": "Bad Nauheim",
      "details": "18.12.2024 (Bekanntmachungsdatum)\n\nHessen Amtsgericht Friedberg HRB 9614\nLöschungsankündigung\n\nTLA-Recruitment UG (haftungsbeschränkt)\nGesellschaft mit beschränkter Haftung\nBad Nauheim\n\nDas Registergericht beabsichtigt die im Handelsregister eingetragene Gesellschaft von Amts wegen nach § 394 FamFG zu löschen. Die Frist zur Erhebung eines Widerspruchs gegen die beabsichtigte Löschung wird auf 3 Monate festgesetzt."
    },
    {
      "date": "2024-12-18",
      "id": "96901",
      "original_text": "Sonstige Registerbekanntmachung\nHessen Amtsgericht Darmstadt VR 83026\nClub Latinoamericano Darmstadt – Darmstadt",
      "type": "Sonstige Registerbekanntmachung",
      "state": "Hessen",
      "amtsgericht": "Amtsgericht Darmstadt",
      "registernummer": "VR 83026",
      "registerart": "VR",
      "company_name": "Club Latinoamericano Darmstadt",
      "company_seat": "Darmstadt",
      "details": "18.12.2024 (Bekanntmachungsdatum)\n\nHessen Amtsgericht Darmstadt VR 83026\nSonstige Registerbekanntmachung 18.12.2024 (Eintragungsdatum)\n\nClub Latinoamericano Darmstadt\neingetragener Verein\nDarmstadt\n\nDer Verein ist aufgelöst."
    },
    {
      "date": "2024-12-18",
      "id": "96902",
      "original_text": "Einreichung neuer Dokumente\nHessen Amtsgericht Offenbach am Main HRB 56382\nKARL MAYER Verwaltungsgesellschaft AG – Obertshausen",
      "type": "Einreichung neuer Dokumente",
      "state": "Hessen",
      "amtsgericht": "Amtsgericht Offenbach am Main",
      "registernummer": "HRB 56382",
      "registerart": "HRB",
      "company_name": "KARL MAYER Verwaltungsgesellschaft AG",
      "company_seat": "Obertshausen",
      "details": "18.12.2024 (Bekanntmachungsdatum)\n\nHessen Amtsgericht Offenbach am Main HRB 56382\nEinreichung neuer Dokumente 18.12.2024 (Eintragungsdatum)\n\nKARL MAYER Verwaltungsgesellschaft AG\nAktiengesellschaft\nObertshausen\n\nDurch eine Änderung in den Personen der Aufsichtsratsmitglieder ist eine Liste der Mitglieder des Aufsichtsrates zum Handelsregister eingereicht worden."
    },
    {
      "date": "2024-12-18",
      "id": "96903",
      "original_text": "Registerbekanntmachung nach dem Umwandlungsgesetz\nHessen Amtsgericht Kassel HRB 7161\nMOORE Ludewig AG Wirtschaftsprüfungsgesellschaft – Kassel",
      "type": "Registerbekanntmachung nach dem Umwandlungsgesetz",
      "state": "Hessen",
      "amtsgericht": "Amtsgericht Kassel",
      "registernummer": "HRB 7161",
      "registerart": "HRB",
      "company_name": "MOORE Ludewig AG Wirtschaftsprüfungsgesellschaft",
      "company_seat": "Kassel",
      "details": "18.12.2024 (Bekanntmachungsdatum)\n\nHessen Amtsgericht Kassel HRB 7161\nRegisterbekanntmachung nach dem Umwandlungsgesetz 18.12.2024 (Eintragungsdatum)\n\nMOORE Ludewig AG Wirtschaftsprüfungsgesellschaft\nAktiengesellschaft\nKassel\n\nDen Gläubigern der an der formwechselnden Umwandlung beteiligten Rechtsträger ist, wenn sie binnen sechs Monaten nach dem Tag, an dem die Eintragung der formwechselnden Umwandlung in das Register des Sitzes desjenigen Rechtsträgers, dessen Gläubiger sie sind, nach § 201 UmwG bekannt gemacht worden ist, ihren Anspruch nach Grund und Höhe schriftlich anmelden, Sicherheit zu leisten, soweit sie nicht Befriedigung verlangen können. Dieses Recht steht den Gläubigern jedoch nur zu, wenn sie glaubhaft machen, dass durch die formwechselnden Umwandlung die Erfüllung ihrer Forderung gefährdet wird."
    },
    {
      "date": "2024-12-18",
      "id": "96904",
      "original_text": "Löschungsankündigung\nHessen Amtsgericht Frankfurt am Main HRA 45489\nGrundstücksgesellschaft Dahlmannstraße mbH & Co. Verwaltungs II - KG – Frankfurt am Main",
      "type": "Löschungsankündigung",
      "state": "Hessen",
      "amtsgericht": "Amtsgericht Frankfurt am Main",
      "registernummer": "HRA 45489",
      "registerart": "HRA",
      "company_name": "Grundstücksgesellschaft Dahlmannstraße mbH & Co. Verwaltungs II - KG",
      "company_seat": "Frankfurt am Main",
      "details": "18.12.2024 (Bekanntmachungsdatum)\n\nHessen Amtsgericht Frankfurt am Main HRA 45489\nLöschungsankündigung\n\nGrundstücksgesellschaft Dahlmannstraße mbH & Co. Verwaltungs II - KG\nKommanditgesellschaft\nFrankfurt am Main\n\nEs ist beabsichtigt, die Gesellschaft wegen Vermögenslosigkeit gemäß § 394 FamFG von Amts wegen im Handelsregister zu löschen. Hiergegen kann innerhalb eines Monats nach dieser Veröffentlichung Widerspruch bei dem Amtsgericht Frankfurt am Main eingelegt werden."
    },
    {
      "date": "2024-12-18",
      "id": "96905",
      "original_text": "Registerbekanntmachung nach dem Umwandlungsgesetz\nHessen Amtsgericht Offenbach am Main HRB 56643\nTMS Brand Management GmbH – Offenbach am Main",
      "type": "Registerbekanntmachung nach dem Umwandlungsgesetz",
      "state": "Hessen",
      "amtsgericht": "Amtsgericht Offenbach am Main",
      "registernummer": "HRB 56643",
      "registerart": "HRB",
      "company_name": "TMS Brand Management GmbH",
      "company_seat": "Offenbach am Main",
      "details": "18.12.2024 (Bekanntmachungsdatum)\n\nHessen Amtsgericht Offenbach am Main HRB 56643\nRegisterbekanntmachung nach dem Umwandlungsgesetz 18.12.2024 (Eintragungsdatum)\n\nTMS Brand Management GmbH\nGesellschaft mit beschränkter Haftung\nOffenbach am Main\n\nDen Gläubigern der an der Verschmelzung beteiligten Rechtsträger ist, wenn sie binnen sechs Monaten nach dem Tag, an dem die Eintragung der Verschmelzung in das Register des Sitzes desjenigen Rechtsträgers, dessen Gläubiger sie sind, nach § 19 Absatz 3 UmwG bekannt gemacht worden ist, ihren Anspruch nach Grund und Höhe schriftlich anmelden, Sicherheit zu leisten, soweit sie nicht Befriedigung verlangen können. Dieses Recht steht den Gläubigern jedoch nur zu, wenn sie glaubhaft machen, dass durch die Verschmelzung die Erfüllung ihrer Forderung gefährdet wird."
    },
    {
      "date": "2024-12-18",
      "id": "96906",
      "original_text": "Registerbekanntmachung nach dem Umwandlungsgesetz\nHessen Amtsgericht Eschwege HRB 3557\nHolzbau Rüffer GmbH – Sontra",
      "type": "Registerbekanntmachung nach dem Umwandlungsgesetz",
      "state": "Hessen",
      "amtsgericht": "Amtsgericht Eschwege",
      "registernummer": "HRB 3557",
      "registerart": "HRB",
      "company_name": "Holzbau Rüffer GmbH",
      "company_seat": "Sontra",
      "details": "18.12.2024 (Bekanntmachungsdatum)\n\nHessen Amtsgericht Eschwege HRB 3557\nRegisterbekanntmachung nach dem Umwandlungsgesetz 18.12.2024 (Eintragungsdatum)\n\nHolzbau Rüffer GmbH\nGesellschaft mit beschränkter Haftung\nSontra\n\nDen Gläubigern der an der Verschmelzung beteiligten Rechtsträger ist, wenn sie binnen sechs Monaten nach dem Tag, an dem die Eintragung der Verschmelzung in das Register des Sitzes desjenigen Rechtsträgers, dessen Gläubiger sie sind, nach § 19 Absatz 3 UmwG bekannt gemacht worden ist, ihren Anspruch nach Grund und Höhe schriftlich anmelden, Sicherheit zu leisten, soweit sie nicht Befriedigung verlangen können. Dieses Recht steht den Gläubigern jedoch nur zu, wenn sie glaubhaft machen, dass durch die Verschmelzung die Erfüllung ihrer Forderung gefährdet wird."
    },
    {
      "date": "2024-12-18",
      "id": "96907",
      "original_text": "Sonstige Registerbekanntmachung\nHessen Amtsgericht Frankfurt am Main HRB 75345\nSavills Fund Management Holding AG – Frankfurt am Main",
      "type": "Sonstige Registerbekanntmachung",
      "state": "Hessen",
      "amtsgericht": "Amtsgericht Frankfurt am Main",
      "registernummer": "HRB 75345",
      "registerart": "HRB",
      "company_name": "Savills Fund Management Holding AG",
      "company_seat": "Frankfurt am Main",
      "details": "18.12.2024 (Bekanntmachungsdatum)\n\nHessen Amtsgericht Frankfurt am Main HRB 75345\nSonstige Registerbekanntmachung 18.12.2024 (Eintragungsdatum)\n\nSavills Fund Management Holding AG\nAktiengesellschaft\nFrankfurt am Main\n\nDie Gesellschaft hat Gläubigern, deren Forderungen vor dieser Bekanntmachung begründet worden sind, Sicherheit zu leisten, soweit sie nicht Befriedigung verlangen können, wenn sie sich binnen sechs Monaten nach dieser Bekanntmachung zu diesem Zweck melden."
    },
    {
      "date": "2024-12-18",
      "id": "96908",
      "original_text": "Registerbekanntmachung nach dem Umwandlungsgesetz\nHessen Amtsgericht Offenbach am Main HRB 56575\nTMS TRADEMARKETING SERVICE GmbH – Offenbach am Main",
      "type": "Registerbekanntmachung nach dem Umwandlungsgesetz",
      "state": "Hessen",
      "amtsgericht": "Amtsgericht Offenbach am Main",
      "registernummer": "HRB 56575",
      "registerart": "HRB",
      "company_name": "TMS TRADEMARKETING SERVICE GmbH",
      "company_seat": "Offenbach am Main",
      "details": "18.12.2024 (Bekanntmachungsdatum)\n\nHessen Amtsgericht Offenbach am Main HRB 56575\nRegisterbekanntmachung nach dem Umwandlungsgesetz 18.12.2024 (Eintragungsdatum)\n\nTMS TRADEMARKETING SERVICE GmbH\nGesellschaft mit beschränkter Haftung\nOffenbach am Main\n\nDen Gläubigern der an der Verschmelzung beteiligten Rechtsträger ist, wenn sie binnen sechs Monaten nach dem Tag, an dem die Eintragung der Verschmelzung in das Register des Sitzes desjenigen Rechtsträgers, dessen Gläubiger sie sind, nach § 19 Absatz 3 UmwG bekannt gemacht worden ist, ihren Anspruch nach Grund und Höhe schriftlich anmelden, Sicherheit zu leisten, soweit sie nicht Befriedigung verlangen können. Dieses Recht steht den Gläubigern jedoch nur zu, wenn sie glaubhaft machen, dass durch die Verschmelzung die Erfüllung ihrer Forderung gefährdet wird."
    },
    {
      "date": "2024-12-18",
      "id": "96909",
      "original_text": "Registerbekanntmachung nach dem Umwandlungsgesetz\nHessen Amtsgericht Frankfurt am Main HRB 48809\nLucht Probst Associates GmbH – Frankfurt am Main",
      "type": "Registerbekanntmachung nach dem Umwandlungsgesetz",
      "state": "Hessen",
      "amtsgericht": "Amtsgericht Frankfurt am Main",
      "registernummer": "HRB 48809",
      "registerart": "HRB",
      "company_name": "Lucht Probst Associates GmbH",
      "company_seat": "Frankfurt am Main",
      "details": "18.12.2024 (Bekanntmachungsdatum)\n\nHessen Amtsgericht Frankfurt am Main HRB 48809\nRegisterbekanntmachung nach dem Umwandlungsgesetz 18.12.2024 (Eintragungsdatum)\n\nLucht Probst Associates GmbH\nGesellschaft mit beschränkter Haftung\nFrankfurt am Main\n\nDem Registergericht ist ein Verschmelzungsplan über die geplante grenzüberschreitende Verschmelzung der Lucht Probst Associates GmbH mit Sitz in Frankfurt am Main (Gesellschaft mit beschränkter Haftung, eingetragen beim Amtsgericht Frankfurt am Main unter der HRB  48809) als übernehmender Rechtsträger mit der Acarda Services S.à  r.l. mit Sitz in Luxemburg / Luxemburg (S.à r.l., eingetragen beim Registre de commerce et des sociétés B 221516) als übertragender Rechtsträger eingereicht worden.\nDen Gläubigern der übertragenden Gesellschaft ist Sicherheit zu leisten, wenn sie innerhalb einer Frist von zwei Monaten nach Bekanntmachung des Verschmelzungsplans glaubhaft machen, dass durch die Verschmelzung die Erfüllung ihrer Forderung gefährdet wird. Die Anteilseigner der übertragenden Gesellschaft haben bei grenzüberschreitenden Verschmelzungen einen Anspruch auf angemessene Abfindung, sofern sie der Verschmelzung widersprochen haben; gegebenenfalls steht ihnen auch ein Anspruch auf bare Zuzahlung zu."
    },
    {
      "date": "2024-12-18",
      "id": "96910",
      "original_text": "Löschungsankündigung\nHessen Amtsgericht Frankfurt am Main HRB 115723\nBesente GmbH – Sulzbach (Taunus)",
      "type": "Löschungsankündigung",
      "state": "Hessen",
      "amtsgericht": "Amtsgericht Frankfurt am Main",
      "registernummer": "HRB 115723",
      "registerart": "HRB",
      "company_name": "Besente GmbH",
      "company_seat": "Sulzbach (Taunus)",
      "details": "18.12.2024 (Bekanntmachungsdatum)\n\nHessen Amtsgericht Frankfurt am Main HRB 115723\nLöschungsankündigung\n\nBesente GmbH\nGesellschaft mit beschränkter Haftung\nSulzbach (Taunus)\n\nDas Registergericht beabsichtigt die im Handelsregister eingetragene Gesellschaft von Amts wegen nach § 394 FamFG zu löschen. Die Frist zur Erhebung eines Widerspruchs gegen die beabsichtigte Löschung wird auf 1 Monat festgesetzt."
    },
    {
      "date": "2024-12-18",
      "id": "96911",
      "original_text": "Registerbekanntmachung nach dem Umwandlungsgesetz\nHessen Amtsgericht Kassel HRB 20038\nMOORE Ludewig GmbH Wirtschaftsprüfungsgesellschaft – Kassel",
      "type": "Registerbekanntmachung nach dem Umwandlungsgesetz",
      "state": "Hessen",
      "amtsgericht": "Amtsgericht Kassel",
      "registernummer": "HRB 20038",
      "registerart": "HRB",
      "company_name": "MOORE Ludewig GmbH Wirtschaftsprüfungsgesellschaft",
      "company_seat": "Kassel",
      "details": "18.12.2024 (Bekanntmachungsdatum)\n\nHessen Amtsgericht Kassel HRB 20038\nRegisterbekanntmachung nach dem Umwandlungsgesetz 18.12.2024 (Eintragungsdatum)\n\nMOORE Ludewig GmbH Wirtschaftsprüfungsgesellschaft\nGesellschaft mit beschränkter Haftung\nKassel\n\nDen Gläubigern der an der formwechselnden Umwandlung beteiligten Rechtsträger ist, wenn sie binnen sechs Monaten nach dem Tag, an dem die Eintragung der formwechselnden Umwandlung in das Register des Sitzes desjenigen Rechtsträgers, dessen Gläubiger sie sind, nach § 201 UmwG bekannt gemacht worden ist, ihren Anspruch nach Grund und Höhe schriftlich anmelden, Sicherheit zu leisten, soweit sie nicht Befriedigung verlangen können. Dieses Recht steht den Gläubigern jedoch nur zu, wenn sie glaubhaft machen, dass durch die formwechselnden Umwandlung die Erfüllung ihrer Forderung gefährdet wird."
    }
  ]
}