{
  "date": "2024-12-17",
  "date_of_scrape": "2024-12-18T04:10:05.410Z",
  "tool_version": "0.2.0",
  "number_of_announcements": 150,
  "announcements": [
    {
      "date": "2024-12-17",
      "id": "96603",
      "original_text": "Registerbekanntmachung nach dem Umwandlungsgesetz\nBayern Amtsgericht Traunstein HRB 27836\nNAFTA Germany GmbH – Schechen",
      "type": "Registerbekanntmachung nach dem Umwandlungsgesetz",
      "state": "Bayern",
      "amtsgericht": "Amtsgericht Traunstein",
      "registernummer": "HRB 27836",
      "registerart": "HRB",
      "company_name": "NAFTA Germany GmbH",
      "company_seat": "Schechen",
      "details": "17.12.2024 (Bekanntmachungsdatum)\n\nBayern Amtsgericht Traunstein HRB 27836\nRegisterbekanntmachung nach dem Umwandlungsgesetz 16.12.2024 (Eintragungsdatum)\n\nNAFTA Germany GmbH\nGesellschaft mit beschränkter Haftung\nSchechen\n\nDen Gläubigern der an der Verschmelzung beteiligten Rechtsträger ist, wenn sie binnen sechs Monaten nach dem Tag, an dem die Eintragung der Verschmelzung in das Register des Sitzes desjenigen Rechtsträgers, dessen Gläubiger sie sind, nach § 19 Abs. 3 UmwG als bekannt gemacht gilt, ihren Anspruch nach Grund und Höhe schriftlich anmelden, Sicherheit zu leisten, soweit sie nicht Befriedigung verlangen können. Dieses Recht steht den Gläubigern jedoch nur zu, wenn sie glaubhaft machen, dass durch die Verschmelzung die Erfüllung ihrer Forderung gefährdet wird."
    },
    {
      "date": "2024-12-17",
      "id": "96604",
      "original_text": "Sonstige Registerbekanntmachung\nBayern Amtsgericht Aschaffenburg HRB 12677\nNUKEM Technologies Engineering Services GmbH – Karlstein am Main",
      "type": "Sonstige Registerbekanntmachung",
      "state": "Bayern",
      "amtsgericht": "Amtsgericht Aschaffenburg",
      "registernummer": "HRB 12677",
      "registerart": "HRB",
      "company_name": "NUKEM Technologies Engineering Services GmbH",
      "company_seat": "Karlstein am Main",
      "details": "17.12.2024 (Bekanntmachungsdatum)\n\nBayern Amtsgericht Aschaffenburg HRB 12677\nSonstige Registerbekanntmachung 16.12.2024 (Eintragungsdatum)\n\nNUKEM Technologies Engineering Services GmbH\nGesellschaft mit beschränkter Haftung\nKarlstein am Main\n\nDen Gläubigern der Gesellschaft, deren Forderungen begründet worden sind, bevor die Eintragung der Beendigung des Beherrschungs- und Gewinnabführungsvertrages in das Handelsregister nach § 10 des Handelsgesetzbuches als bekanntgemacht gilt, hat der andere Vertragsteil Sicherheit zu leisten, wenn sie sich binnen sechs Monaten nach der Bekanntmachung der Eintragung zu diesem Zweck bei ihm melden."
    },
    {
      "date": "2024-12-17",
      "id": "96605",
      "original_text": "Registerbekanntmachung nach dem Umwandlungsgesetz\nBayern Amtsgericht Traunstein HRB 27829\nNAFTA Bavaria GmbH – Schechen",
      "type": "Registerbekanntmachung nach dem Umwandlungsgesetz",
      "state": "Bayern",
      "amtsgericht": "Amtsgericht Traunstein",
      "registernummer": "HRB 27829",
      "registerart": "HRB",
      "company_name": "NAFTA Bavaria GmbH",
      "company_seat": "Schechen",
      "details": "17.12.2024 (Bekanntmachungsdatum)\n\nBayern Amtsgericht Traunstein HRB 27829\nRegisterbekanntmachung nach dem Umwandlungsgesetz 16.12.2024 (Eintragungsdatum)\n\nNAFTA Bavaria GmbH\nGesellschaft mit beschränkter Haftung\nSchechen\n\nDen Gläubigern der an der Verschmelzung beteiligten Rechtsträger ist, wenn sie binnen sechs Monaten nach dem Tag, an dem die Eintragung der Verschmelzung in das Register des Sitzes desjenigen Rechtsträgers, dessen Gläubiger sie sind, nach § 19 Abs. 3 UmwG als bekannt gemacht gilt, ihren Anspruch nach Grund und Höhe schriftlich anmelden, Sicherheit zu leisten, soweit sie nicht Befriedigung verlangen können. Dieses Recht steht den Gläubigern jedoch nur zu, wenn sie glaubhaft machen, dass durch die Verschmelzung die Erfüllung ihrer Forderung gefährdet wird."
    },
    {
      "date": "2024-12-17",
      "id": "96606",
      "original_text": "Registerbekanntmachung nach dem Umwandlungsgesetz\nBayern Amtsgericht München HRB 294376\nmutares Holding-88 GmbH – Bad Wiessee",
      "type": "Registerbekanntmachung nach dem Umwandlungsgesetz",
      "state": "Bayern",
      "amtsgericht": "Amtsgericht München",
      "registernummer": "HRB 294376",
      "registerart": "HRB",
      "company_name": "mutares Holding-88 GmbH",
      "company_seat": "Bad Wiessee",
      "details": "17.12.2024 (Bekanntmachungsdatum)\n\nBayern Amtsgericht München HRB 294376\nRegisterbekanntmachung nach dem Umwandlungsgesetz 16.12.2024 (Eintragungsdatum)\n\nmutares Holding-88 GmbH\nGesellschaft mit beschränkter Haftung\nBad Wiessee\n\nDen Gläubigern der an der Verschmelzung beteiligten Rechtsträger ist, wenn sie binnen sechs Monaten nach dem Tag, an dem die Eintragung der Verschmelzung in das Register des Sitzes desjenigen Rechtsträgers, dessen Gläubiger sie sind, nach § 19 Abs. 3 UmwG als bekannt gemacht gilt, ihren Anspruch nach Grund und Höhe schriftlich anmelden, Sicherheit zu leisten, soweit sie nicht Befriedigung verlangen können. Dieses Recht steht den Gläubigern jedoch nur zu, wenn sie glaubhaft machen, dass durch die Verschmelzung die Erfüllung ihrer Forderung gefährdet wird."
    },
    {
      "date": "2024-12-17",
      "id": "96607",
      "original_text": "Registerbekanntmachung nach dem Umwandlungsgesetz\nBayern Amtsgericht Fürth HRB 20092\nSellerRocket UG (haftungsbeschränkt) – Markt Bibart",
      "type": "Registerbekanntmachung nach dem Umwandlungsgesetz",
      "state": "Bayern",
      "amtsgericht": "Amtsgericht Fürth",
      "registernummer": "HRB 20092",
      "registerart": "HRB",
      "company_name": "SellerRocket UG (haftungsbeschränkt)",
      "company_seat": "Markt Bibart",
      "details": "17.12.2024 (Bekanntmachungsdatum)\n\nBayern Amtsgericht Fürth HRB 20092\nRegisterbekanntmachung nach dem Umwandlungsgesetz 16.12.2024 (Eintragungsdatum)\n\nSellerRocket UG (haftungsbeschränkt)\nGesellschaft mit beschränkter Haftung\nMarkt Bibart\n\nDen Gläubigern der an der Verschmelzung beteiligten Rechtsträger ist, wenn sie binnen sechs Monaten nach dem Tag, an dem die Eintragung der Verschmelzung in das Register des Sitzes desjenigen Rechtsträgers, dessen Gläubiger sie sind, nach § 19 Abs. 3 UmwG als bekannt gemacht gilt, ihren Anspruch nach Grund und Höhe schriftlich anmelden, Sicherheit zu leisten, soweit sie nicht Befriedigung verlangen können. Dieses Recht steht den Gläubigern jedoch nur zu, wenn sie glaubhaft machen, dass durch die Verschmelzung die Erfüllung ihrer Forderung gefährdet wird."
    },
    {
      "date": "2024-12-17",
      "id": "96608",
      "original_text": "Löschungsankündigung\nBayern Amtsgericht München HRB 185849\nAdauctus GmbH – München",
      "type": "Löschungsankündigung",
      "state": "Bayern",
      "amtsgericht": "Amtsgericht München",
      "registernummer": "HRB 185849",
      "registerart": "HRB",
      "company_name": "Adauctus GmbH",
      "company_seat": "München",
      "details": "17.12.2024 (Bekanntmachungsdatum)\n\nBayern Amtsgericht München HRB 185849\nLöschungsankündigung 16.12.2024 (Eintragungsdatum)\n\nAdauctus GmbH\nGesellschaft mit beschränkter Haftung\nMünchen\n\nDas Registergericht beabsichtigt, die im Handelsregister eingetragene Gesellschaft wegen Vermögenslosigkeit von Amts wegen nach § 394 FamFG zu löschen. Die Frist zur Erhebung eines Widerspruchs ist auf drei Monate festgesetzt."
    },
    {
      "date": "2024-12-17",
      "id": "96609",
      "original_text": "Registerbekanntmachung nach dem Umwandlungsgesetz\nBayern Amtsgericht Fürth HRB 20087\nLuckylama GmbH – Markt Bibart",
      "type": "Registerbekanntmachung nach dem Umwandlungsgesetz",
      "state": "Bayern",
      "amtsgericht": "Amtsgericht Fürth",
      "registernummer": "HRB 20087",
      "registerart": "HRB",
      "company_name": "Luckylama GmbH",
      "company_seat": "Markt Bibart",
      "details": "17.12.2024 (Bekanntmachungsdatum)\n\nBayern Amtsgericht Fürth HRB 20087\nRegisterbekanntmachung nach dem Umwandlungsgesetz 16.12.2024 (Eintragungsdatum)\n\nLuckylama GmbH\nGesellschaft mit beschränkter Haftung\nMarkt Bibart\n\nDen Gläubigern der an der Verschmelzung beteiligten Rechtsträger ist, wenn sie binnen sechs Monaten nach dem Tag, an dem die Eintragung der Verschmelzung in das Register des Sitzes desjenigen Rechtsträgers, dessen Gläubiger sie sind, nach § 19 Abs. 3 UmwG als bekannt gemacht gilt, ihren Anspruch nach Grund und Höhe schriftlich anmelden, Sicherheit zu leisten, soweit sie nicht Befriedigung verlangen können. Dieses Recht steht den Gläubigern jedoch nur zu, wenn sie glaubhaft machen, dass durch die Verschmelzung die Erfüllung ihrer Forderung gefährdet wird."
    },
    {
      "date": "2024-12-17",
      "id": "96610",
      "original_text": "Einreichung neuer Dokumente\nBayern Amtsgericht München HRB 251564\nSyneos Health Germany GmbH – München",
      "type": "Einreichung neuer Dokumente",
      "state": "Bayern",
      "amtsgericht": "Amtsgericht München",
      "registernummer": "HRB 251564",
      "registerart": "HRB",
      "company_name": "Syneos Health Germany GmbH",
      "company_seat": "München",
      "details": "17.12.2024 (Bekanntmachungsdatum)\n\nBayern Amtsgericht München HRB 251564\nEinreichung neuer Dokumente 16.12.2024 (Eintragungsdatum)\n\nSyneos Health Germany GmbH\nGesellschaft mit beschränkter Haftung\nMünchen\n\nDem Amtsgericht München -Registergericht- ist eine Liste der Mitglieder des Aufsichtsrats eingereicht worden, § 52 Abs. 3 S. 2 GmbHG."
    },
    {
      "date": "2024-12-17",
      "id": "96611",
      "original_text": "Registerbekanntmachung nach dem Umwandlungsgesetz\nBayern Amtsgericht Deggendorf HRA 2510\nBVS-Finanz KG – Bodenmais",
      "type": "Registerbekanntmachung nach dem Umwandlungsgesetz",
      "state": "Bayern",
      "amtsgericht": "Amtsgericht Deggendorf",
      "registernummer": "HRA 2510",
      "registerart": "HRA",
      "company_name": "BVS-Finanz KG",
      "company_seat": "Bodenmais",
      "details": "17.12.2024 (Bekanntmachungsdatum)\n\nBayern Amtsgericht Deggendorf HRA 2510\nRegisterbekanntmachung nach dem Umwandlungsgesetz 10.10.2024 (Eintragungsdatum)\n\nBVS-Finanz KG\nKommanditgesellschaft\nBodenmais\n\nDen Gläubigern des formwechselnden Rechtsträgers ist, wenn sie binnen sechs Monaten nach dem Tag, an dem die Eintragung des Formwechsels nach § 201 UmwG als bekannt gemacht gilt, ihren Anspruch nach Grund und Höhe schriftlich anmelden, Sicherheit zu leisten, soweit sie nicht Befriedigung verlangen können. Dieses Recht steht den Gläubigern jedoch nur zu, wenn sie glaubhaft machen, dass durch den Formwechsel die Erfüllung ihrer Forderung gefährdet wird."
    },
    {
      "date": "2024-12-17",
      "id": "96612",
      "original_text": "Registerbekanntmachung nach dem Umwandlungsgesetz\nBayern Amtsgericht München HRB 238151\nBallon-Team-Ammersee GmbH – Huglfing",
      "type": "Registerbekanntmachung nach dem Umwandlungsgesetz",
      "state": "Bayern",
      "amtsgericht": "Amtsgericht München",
      "registernummer": "HRB 238151",
      "registerart": "HRB",
      "company_name": "Ballon-Team-Ammersee GmbH",
      "company_seat": "Huglfing",
      "details": "17.12.2024 (Bekanntmachungsdatum)\n\nBayern Amtsgericht München HRB 238151\nRegisterbekanntmachung nach dem Umwandlungsgesetz 16.12.2024 (Eintragungsdatum)\n\nBallon-Team-Ammersee GmbH\nGesellschaft mit beschränkter Haftung\nHuglfing\n\nDen Gläubigern der an der Verschmelzung beteiligten Rechtsträger ist, wenn sie binnen sechs Monaten nach dem Tag, an dem die Eintragung der Verschmelzung in das Register des Sitzes desjenigen Rechtsträgers, dessen Gläubiger sie sind, nach § 19 Abs. 3 UmwG als bekannt gemacht gilt, ihren Anspruch nach Grund und Höhe schriftlich anmelden, Sicherheit zu leisten, soweit sie nicht Befriedigung verlangen können. Dieses Recht steht den Gläubigern jedoch nur zu, wenn sie glaubhaft machen, dass durch die Verschmelzung die Erfüllung ihrer Forderung gefährdet wird."
    },
    {
      "date": "2024-12-17",
      "id": "96613",
      "original_text": "Registerbekanntmachung nach dem Umwandlungsgesetz\nBayern Amtsgericht Fürth HRA 12397\nSES Special Event Service Stefan Krautz e.K. – Fürth",
      "type": "Registerbekanntmachung nach dem Umwandlungsgesetz",
      "state": "Bayern",
      "amtsgericht": "Amtsgericht Fürth",
      "registernummer": "HRA 12397",
      "registerart": "HRA",
      "company_name": "SES Special Event Service Stefan Krautz e.K.",
      "company_seat": "Fürth",
      "details": "17.12.2024 (Bekanntmachungsdatum)\n\nBayern Amtsgericht Fürth HRA 12397\nRegisterbekanntmachung nach dem Umwandlungsgesetz 16.12.2024 (Eintragungsdatum)\n\nSES Special Event Service Stefan Krautz e.K.\nEinzelkaufmann / Einzelkauffrau\nFürth\n\nDen Gläubigern der an der Ausgliederung beteiligten Rechtsträger ist, wenn sie binnen sechs Monaten nach dem Tag, an dem die Eintragung der Ausgliederung in das Register des Sitzes desjenigen Rechtsträgers, dessen Gläubiger sie sind, nach §§ 125, 19 Abs. 3 UmwG als bekannt gemacht gilt, ihren Anspruch nach Grund und Höhe schriftlich anmelden, Sicherheit zu leisten, soweit sie nicht Befriedigung verlangen können. Dieses Recht steht den Gläubigern jedoch nur zu, wenn sie glaubhaft machen, dass durch die Ausgliederung die Erfüllung ihrer Forderung gefährdet wird."
    },
    {
      "date": "2024-12-17",
      "id": "96614",
      "original_text": "Sonstige Registerbekanntmachung\nBayern Amtsgericht München HRB 63790\nAktiv Assekuranz Makler Gesellschaft mit beschränkter Haftung – München",
      "type": "Sonstige Registerbekanntmachung",
      "state": "Bayern",
      "amtsgericht": "Amtsgericht München",
      "registernummer": "HRB 63790",
      "registerart": "HRB",
      "company_name": "Aktiv Assekuranz Makler Gesellschaft mit beschränkter Haftung",
      "company_seat": "München",
      "details": "17.12.2024 (Bekanntmachungsdatum)\n\nBayern Amtsgericht München HRB 63790\nSonstige Registerbekanntmachung 16.12.2024 (Eintragungsdatum)\n\nAktiv Assekuranz Makler Gesellschaft mit beschränkter Haftung\nGesellschaft mit beschränkter Haftung\nMünchen\n\nDen Gläubigern der Gesellschaft, deren Forderungen begründet worden sind, bevor die Eintragung der Beendigung des Beherrschungs- und Gewinnabführungsvertrages in das Handelsregister nach § 10 des Handelsgesetzbuches als bekanntgemacht gilt, hat der andere Vertragsteil Sicherheit zu leisten, wenn sie sich binnen sechs Monaten nach der Bekanntmachung der Eintragung zu diesem Zweck bei ihm melden."
    },
    {
      "date": "2024-12-17",
      "id": "96615",
      "original_text": "Registerbekanntmachung nach dem Umwandlungsgesetz\nBayern Amtsgericht Würzburg HRB 11684\nanevis solutions GmbH – Würzburg",
      "type": "Registerbekanntmachung nach dem Umwandlungsgesetz",
      "state": "Bayern",
      "amtsgericht": "Amtsgericht Würzburg",
      "registernummer": "HRB 11684",
      "registerart": "HRB",
      "company_name": "anevis solutions GmbH",
      "company_seat": "Würzburg",
      "details": "17.12.2024 (Bekanntmachungsdatum)\n\nBayern Amtsgericht Würzburg HRB 11684\nRegisterbekanntmachung nach dem Umwandlungsgesetz 14.12.2024 (Eintragungsdatum)\n\nanevis solutions GmbH\nGesellschaft mit beschränkter Haftung\nWürzburg\n\nDen Gläubigern der an der Verschmelzung beteiligten Rechtsträger ist, wenn sie binnen sechs Monaten nach dem Tag, an dem die Eintragung der Verschmelzung in das Register des Sitzes desjenigen Rechtsträgers, dessen Gläubiger sie sind, nach § 19 Abs. 3 UmwG als bekannt gemacht gilt, ihren Anspruch nach Grund und Höhe schriftlich anmelden, Sicherheit zu leisten, soweit sie nicht Befriedigung verlangen können. Dieses Recht steht den Gläubigern jedoch nur zu, wenn sie glaubhaft machen, dass durch die Verschmelzung die Erfüllung ihrer Forderung gefährdet wird."
    },
    {
      "date": "2024-12-17",
      "id": "96616",
      "original_text": "Einreichung neuer Dokumente\nBayern Amtsgericht München HRB 125040\nC4B Com For Business Aktiengesellschaft Gesellschaft für Informations- und Kommunikationstechnik – Germering",
      "type": "Einreichung neuer Dokumente",
      "state": "Bayern",
      "amtsgericht": "Amtsgericht München",
      "registernummer": "HRB 125040",
      "registerart": "HRB",
      "company_name": "C4B Com For Business Aktiengesellschaft Gesellschaft für Informations- und Kommunikationstechnik",
      "company_seat": "Germering",
      "details": "17.12.2024 (Bekanntmachungsdatum)\n\nBayern Amtsgericht München HRB 125040\nEinreichung neuer Dokumente 16.12.2024 (Eintragungsdatum)\n\nC4B Com For Business Aktiengesellschaft Gesellschaft für Informations- und Kommunikationstechnik\nAktiengesellschaft\nGermering\n\nDem Amtsgericht München -Registergericht- ist eine Liste der Mitglieder des Aufsichtsrats eingereicht worden, § 106 AktG."
    },
    {
      "date": "2024-12-17",
      "id": "96617",
      "original_text": "Registerbekanntmachung nach dem Umwandlungsgesetz\nBayern Amtsgericht München HRB 264968\nmutares Holding-51 GmbH – Bad Wiessee",
      "type": "Registerbekanntmachung nach dem Umwandlungsgesetz",
      "state": "Bayern",
      "amtsgericht": "Amtsgericht München",
      "registernummer": "HRB 264968",
      "registerart": "HRB",
      "company_name": "mutares Holding-51 GmbH",
      "company_seat": "Bad Wiessee",
      "details": "17.12.2024 (Bekanntmachungsdatum)\n\nBayern Amtsgericht München HRB 264968\nRegisterbekanntmachung nach dem Umwandlungsgesetz 16.12.2024 (Eintragungsdatum)\n\nmutares Holding-51 GmbH\nGesellschaft mit beschränkter Haftung\nBad Wiessee\n\nDen Gläubigern der an der Verschmelzung beteiligten Rechtsträger ist, wenn sie binnen sechs Monaten nach dem Tag, an dem die Eintragung der Verschmelzung in das Register des Sitzes desjenigen Rechtsträgers, dessen Gläubiger sie sind, nach § 19 Abs. 3 UmwG als bekannt gemacht gilt, ihren Anspruch nach Grund und Höhe schriftlich anmelden, Sicherheit zu leisten, soweit sie nicht Befriedigung verlangen können. Dieses Recht steht den Gläubigern jedoch nur zu, wenn sie glaubhaft machen, dass durch die Verschmelzung die Erfüllung ihrer Forderung gefährdet wird."
    },
    {
      "date": "2024-12-17",
      "id": "96618",
      "original_text": "Löschungsankündigung\nBayern Amtsgericht Regensburg HRB 14403\nwo²-Service UG (haftungsbeschränkt) – Regensburg",
      "type": "Löschungsankündigung",
      "state": "Bayern",
      "amtsgericht": "Amtsgericht Regensburg",
      "registernummer": "HRB 14403",
      "registerart": "HRB",
      "company_name": "wo²-Service UG (haftungsbeschränkt)",
      "company_seat": "Regensburg",
      "details": "17.12.2024 (Bekanntmachungsdatum)\n\nBayern Amtsgericht Regensburg HRB 14403\nLöschungsankündigung\n\nwo²-Service UG (haftungsbeschränkt)\nGesellschaft mit beschränkter Haftung\nRegensburg\n\nDas Registergericht beabsichtigt, die im Handelsregister eingetragene Gesellschaft wegen Vermögenslosigkeit von Amts wegen nach § 394 FamFG zu löschen. Die Frist zur Erhebung eines Widerspruchs ist auf einen Monat festgesetzt."
    },
    {
      "date": "2024-12-17",
      "id": "96619",
      "original_text": "Registerbekanntmachung nach dem Umwandlungsgesetz\nBayern Amtsgericht München HRB 201846\nWealthCap Entity Service GmbH – München",
      "type": "Registerbekanntmachung nach dem Umwandlungsgesetz",
      "state": "Bayern",
      "amtsgericht": "Amtsgericht München",
      "registernummer": "HRB 201846",
      "registerart": "HRB",
      "company_name": "WealthCap Entity Service GmbH",
      "company_seat": "München",
      "details": "17.12.2024 (Bekanntmachungsdatum)\n\nBayern Amtsgericht München HRB 201846\nRegisterbekanntmachung nach dem Umwandlungsgesetz 16.12.2024 (Eintragungsdatum)\n\nWealthCap Entity Service GmbH\nGesellschaft mit beschränkter Haftung\nMünchen\n\nDen Gläubigern der an der Verschmelzung beteiligten Rechtsträger ist, wenn sie binnen sechs Monaten nach dem Tag, an dem die Eintragung der Verschmelzung in das Register des Sitzes desjenigen Rechtsträgers, dessen Gläubiger sie sind, nach § 19 Abs. 3 UmwG als bekannt gemacht gilt, ihren Anspruch nach Grund und Höhe schriftlich anmelden, Sicherheit zu leisten, soweit sie nicht Befriedigung verlangen können. Dieses Recht steht den Gläubigern jedoch nur zu, wenn sie glaubhaft machen, dass durch die Verschmelzung die Erfüllung ihrer Forderung gefährdet wird."
    },
    {
      "date": "2024-12-17",
      "id": "96620",
      "original_text": "Registerbekanntmachung nach dem Umwandlungsgesetz\nBayern Amtsgericht Kempten (Allgäu) HRB 17964\nInning Bau GmbH – Stöttwang",
      "type": "Registerbekanntmachung nach dem Umwandlungsgesetz",
      "state": "Bayern",
      "amtsgericht": "Amtsgericht Kempten (Allgäu)",
      "registernummer": "HRB 17964",
      "registerart": "HRB",
      "company_name": "Inning Bau GmbH",
      "company_seat": "Stöttwang",
      "details": "17.12.2024 (Bekanntmachungsdatum)\n\nBayern Amtsgericht Kempten (Allgäu) HRB 17964\nRegisterbekanntmachung nach dem Umwandlungsgesetz 16.12.2024 (Eintragungsdatum)\n\nInning Bau GmbH\nGesellschaft mit beschränkter Haftung\nStöttwang\n\nDen Gläubigern der an der Ausgliederung beteiligten Rechtsträger ist, wenn sie binnen sechs Monaten nach dem Tag, an dem die Eintragung der Ausgliederung in das Register des Sitzes desjenigen Rechtsträgers, dessen Gläubiger sie sind, nach §§ 125, 19 Abs. 3 UmwG als bekannt gemacht gilt, ihren Anspruch nach Grund und Höhe schriftlich anmelden, Sicherheit zu leisten, soweit sie nicht Befriedigung verlangen können. Dieses Recht steht den Gläubigern jedoch nur zu, wenn sie glaubhaft machen, dass durch die Ausgliederung die Erfüllung ihrer Forderung gefährdet wird.Den Gläubigern der an der Ausgliederung beteiligten Rechtsträger ist, wenn sie binnen sechs Monaten nach dem Tag, an dem die Eintragung der Ausgliederung in das Register des Sitzes desjenigen Rechtsträgers, dessen Gläubiger sie sind, nach §§ 125, 19 Abs. 3 UmwG als bekannt gemacht gilt, ihren Anspruch nach Grund und Höhe schriftlich anmelden, Sicherheit zu leisten, soweit sie nicht Befriedigung verlangen können. Dieses Recht steht den Gläubigern jedoch nur zu, wenn sie glaubhaft machen, dass durch die Ausgliederung die Erfüllung ihrer Forderung gefährdet wird."
    },
    {
      "date": "2024-12-17",
      "id": "96621",
      "original_text": "Registerbekanntmachung nach dem Umwandlungsgesetz\nBayern Amtsgericht Augsburg HRA 15806\nKunzmann Weinkellerei - Mineralbrunnen - Fruchtsaft GmbH & Co. KG – Dasing",
      "type": "Registerbekanntmachung nach dem Umwandlungsgesetz",
      "state": "Bayern",
      "amtsgericht": "Amtsgericht Augsburg",
      "registernummer": "HRA 15806",
      "registerart": "HRA",
      "company_name": "Kunzmann Weinkellerei - Mineralbrunnen - Fruchtsaft GmbH & Co. KG",
      "company_seat": "Dasing",
      "details": "17.12.2024 (Bekanntmachungsdatum)\n\nBayern Amtsgericht Augsburg HRA 15806\nRegisterbekanntmachung nach dem Umwandlungsgesetz 16.12.2024 (Eintragungsdatum)\n\nKunzmann Weinkellerei - Mineralbrunnen - Fruchtsaft GmbH & Co. KG\nKommanditgesellschaft\nDasing\n\nDen Gläubigern der an der Verschmelzung beteiligten Rechtsträger ist, wenn sie binnen sechs Monaten nach dem Tag, an dem die Eintragung der Verschmelzung in das Register des Sitzes desjenigen Rechtsträgers, dessen Gläubiger sie sind, nach § 19 Abs. 3 UmwG als bekannt gemacht gilt, ihren Anspruch nach Grund und Höhe schriftlich anmelden, Sicherheit zu leisten, soweit sie nicht Befriedigung verlangen können. Dieses Recht steht den Gläubigern jedoch nur zu, wenn sie glaubhaft machen, dass durch die Verschmelzung die Erfüllung ihrer Forderung gefährdet wird."
    },
    {
      "date": "2024-12-17",
      "id": "96622",
      "original_text": "Registerbekanntmachung nach dem Umwandlungsgesetz\nBayern Amtsgericht München HRB 116551\nServiceplan Campaign 3 GmbH – München",
      "type": "Registerbekanntmachung nach dem Umwandlungsgesetz",
      "state": "Bayern",
      "amtsgericht": "Amtsgericht München",
      "registernummer": "HRB 116551",
      "registerart": "HRB",
      "company_name": "Serviceplan Campaign 3 GmbH",
      "company_seat": "München",
      "details": "17.12.2024 (Bekanntmachungsdatum)\n\nBayern Amtsgericht München HRB 116551\nRegisterbekanntmachung nach dem Umwandlungsgesetz 16.12.2024 (Eintragungsdatum)\n\nServiceplan Campaign 3 GmbH\nGesellschaft mit beschränkter Haftung\nMünchen\n\nDen Gläubigern der an der Verschmelzung beteiligten Rechtsträger ist, wenn sie binnen sechs Monaten nach dem Tag, an dem die Eintragung der Verschmelzung in das Register des Sitzes desjenigen Rechtsträgers, dessen Gläubiger sie sind, nach § 19 Abs. 3 UmwG als bekannt gemacht gilt, ihren Anspruch nach Grund und Höhe schriftlich anmelden, Sicherheit zu leisten, soweit sie nicht Befriedigung verlangen können. Dieses Recht steht den Gläubigern jedoch nur zu, wenn sie glaubhaft machen, dass durch die Verschmelzung die Erfüllung ihrer Forderung gefährdet wird."
    },
    {
      "date": "2024-12-17",
      "id": "96623",
      "original_text": "Einreichung neuer Dokumente\nBayern Amtsgericht Memmingen HRB 14773\nBerufsfachschule für Musik Krumbach gemeinnützige Schulträger GmbH – Krumbach",
      "type": "Einreichung neuer Dokumente",
      "state": "Bayern",
      "amtsgericht": "Amtsgericht Memmingen",
      "registernummer": "HRB 14773",
      "registerart": "HRB",
      "company_name": "Berufsfachschule für Musik Krumbach gemeinnützige Schulträger GmbH",
      "company_seat": "Krumbach",
      "details": "17.12.2024 (Bekanntmachungsdatum)\n\nBayern Amtsgericht Memmingen HRB 14773\nEinreichung neuer Dokumente\n\nBerufsfachschule für Musik Krumbach gemeinnützige Schulträger GmbH\nGesellschaft mit beschränkter Haftung\nKrumbach\n\nDem Amtsgericht Memmingen -Registergericht- ist eine Liste der Mitglieder des Aufsichtsrats eingereicht worden, § 52 Abs. 3 S. 2 GmbHG."
    },
    {
      "date": "2024-12-17",
      "id": "96624",
      "original_text": "Registerbekanntmachung nach dem Umwandlungsgesetz\nBayern Amtsgericht Traunstein HRB 14816\nObermaier GmbH – Winhöring",
      "type": "Registerbekanntmachung nach dem Umwandlungsgesetz",
      "state": "Bayern",
      "amtsgericht": "Amtsgericht Traunstein",
      "registernummer": "HRB 14816",
      "registerart": "HRB",
      "company_name": "Obermaier GmbH",
      "company_seat": "Winhöring",
      "details": "17.12.2024 (Bekanntmachungsdatum)\n\nBayern Amtsgericht Traunstein HRB 14816\nRegisterbekanntmachung nach dem Umwandlungsgesetz 16.12.2024 (Eintragungsdatum)\n\nObermaier GmbH\nGesellschaft mit beschränkter Haftung\nWinhöring\n\nDen Gläubigern der an der Verschmelzung beteiligten Rechtsträger ist, wenn sie binnen sechs Monaten nach dem Tag, an dem die Eintragung der Verschmelzung in das Register des Sitzes desjenigen Rechtsträgers, dessen Gläubiger sie sind, nach § 19 Abs. 3 UmwG als bekannt gemacht gilt, ihren Anspruch nach Grund und Höhe schriftlich anmelden, Sicherheit zu leisten, soweit sie nicht Befriedigung verlangen können. Dieses Recht steht den Gläubigern jedoch nur zu, wenn sie glaubhaft machen, dass durch die Verschmelzung die Erfüllung ihrer Forderung gefährdet wird."
    },
    {
      "date": "2024-12-17",
      "id": "96625",
      "original_text": "Registerbekanntmachung nach dem Umwandlungsgesetz\nBayern Amtsgericht Kempten (Allgäu) HRA 11284\nInning Bau e. K. – Stöttwang",
      "type": "Registerbekanntmachung nach dem Umwandlungsgesetz",
      "state": "Bayern",
      "amtsgericht": "Amtsgericht Kempten (Allgäu)",
      "registernummer": "HRA 11284",
      "registerart": "HRA",
      "company_name": "Inning Bau e. K.",
      "company_seat": "Stöttwang",
      "details": "17.12.2024 (Bekanntmachungsdatum)\n\nBayern Amtsgericht Kempten (Allgäu) HRA 11284\nRegisterbekanntmachung nach dem Umwandlungsgesetz 16.12.2024 (Eintragungsdatum)\n\nInning Bau e. K.\nEinzelkaufmann / Einzelkauffrau\nStöttwang\n\nDen Gläubigern der an der Ausgliederung beteiligten Rechtsträger ist, wenn sie binnen sechs Monaten nach dem Tag, an dem die Eintragung der Ausgliederung in das Register des Sitzes desjenigen Rechtsträgers, dessen Gläubiger sie sind, nach §§ 125, 19 Abs. 3 UmwG als bekannt gemacht gilt, ihren Anspruch nach Grund und Höhe schriftlich anmelden, Sicherheit zu leisten, soweit sie nicht Befriedigung verlangen können. Dieses Recht steht den Gläubigern jedoch nur zu, wenn sie glaubhaft machen, dass durch die Ausgliederung die Erfüllung ihrer Forderung gefährdet wird."
    },
    {
      "date": "2024-12-17",
      "id": "96626",
      "original_text": "Registerbekanntmachung nach dem Umwandlungsgesetz\nBayern Amtsgericht München HRB 285653\n222 Ventures UG (haftungsbeschränkt) – München",
      "type": "Registerbekanntmachung nach dem Umwandlungsgesetz",
      "state": "Bayern",
      "amtsgericht": "Amtsgericht München",
      "registernummer": "HRB 285653",
      "registerart": "HRB",
      "company_name": "222 Ventures UG (haftungsbeschränkt)",
      "company_seat": "München",
      "details": "17.12.2024 (Bekanntmachungsdatum)\n\nBayern Amtsgericht München HRB 285653\nRegisterbekanntmachung nach dem Umwandlungsgesetz 16.12.2024 (Eintragungsdatum)\n\n222 Ventures UG (haftungsbeschränkt)\nGesellschaft mit beschränkter Haftung\nMünchen\n\nDen Gläubigern der an der Verschmelzung beteiligten Rechtsträger ist, wenn sie binnen sechs Monaten nach dem Tag, an dem die Eintragung der Verschmelzung in das Register des Sitzes desjenigen Rechtsträgers, dessen Gläubiger sie sind, nach § 19 Abs. 3 UmwG als bekannt gemacht gilt, ihren Anspruch nach Grund und Höhe schriftlich anmelden, Sicherheit zu leisten, soweit sie nicht Befriedigung verlangen können. Dieses Recht steht den Gläubigern jedoch nur zu, wenn sie glaubhaft machen, dass durch die Verschmelzung die Erfüllung ihrer Forderung gefährdet wird."
    },
    {
      "date": "2024-12-17",
      "id": "96627",
      "original_text": "Registerbekanntmachung nach dem Umwandlungsgesetz\nBayern Amtsgericht Traunstein HRB 18491\nKölbl & Vogl GmbH – Rohrdorf",
      "type": "Registerbekanntmachung nach dem Umwandlungsgesetz",
      "state": "Bayern",
      "amtsgericht": "Amtsgericht Traunstein",
      "registernummer": "HRB 18491",
      "registerart": "HRB",
      "company_name": "Kölbl & Vogl GmbH",
      "company_seat": "Rohrdorf",
      "details": "17.12.2024 (Bekanntmachungsdatum)\n\nBayern Amtsgericht Traunstein HRB 18491\nRegisterbekanntmachung nach dem Umwandlungsgesetz 16.12.2024 (Eintragungsdatum)\n\nKölbl & Vogl GmbH\nGesellschaft mit beschränkter Haftung\nRohrdorf\n\nDen Gläubigern der an der Verschmelzung beteiligten Rechtsträger ist, wenn sie binnen sechs Monaten nach dem Tag, an dem die Eintragung der Verschmelzung in das Register des Sitzes desjenigen Rechtsträgers, dessen Gläubiger sie sind, nach § 19 Abs. 3 UmwG als bekannt gemacht gilt, ihren Anspruch nach Grund und Höhe schriftlich anmelden, Sicherheit zu leisten, soweit sie nicht Befriedigung verlangen können. Dieses Recht steht den Gläubigern jedoch nur zu, wenn sie glaubhaft machen, dass durch die Verschmelzung die Erfüllung ihrer Forderung gefährdet wird."
    },
    {
      "date": "2024-12-17",
      "id": "96628",
      "original_text": "Registerbekanntmachung nach dem Umwandlungsgesetz\nBayern Amtsgericht Traunstein HRB 14707\nObermaier Beteiligungs GmbH – Winhöring",
      "type": "Registerbekanntmachung nach dem Umwandlungsgesetz",
      "state": "Bayern",
      "amtsgericht": "Amtsgericht Traunstein",
      "registernummer": "HRB 14707",
      "registerart": "HRB",
      "company_name": "Obermaier Beteiligungs GmbH",
      "company_seat": "Winhöring",
      "details": "17.12.2024 (Bekanntmachungsdatum)\n\nBayern Amtsgericht Traunstein HRB 14707\nRegisterbekanntmachung nach dem Umwandlungsgesetz 16.12.2024 (Eintragungsdatum)\n\nObermaier Beteiligungs GmbH\nGesellschaft mit beschränkter Haftung\nWinhöring\n\nDen Gläubigern der an der Verschmelzung beteiligten Rechtsträger ist, wenn sie binnen sechs Monaten nach dem Tag, an dem die Eintragung der Verschmelzung in das Register des Sitzes desjenigen Rechtsträgers, dessen Gläubiger sie sind, nach § 19 Abs. 3 UmwG als bekannt gemacht gilt, ihren Anspruch nach Grund und Höhe schriftlich anmelden, Sicherheit zu leisten, soweit sie nicht Befriedigung verlangen können. Dieses Recht steht den Gläubigern jedoch nur zu, wenn sie glaubhaft machen, dass durch die Verschmelzung die Erfüllung ihrer Forderung gefährdet wird."
    },
    {
      "date": "2024-12-17",
      "id": "96629",
      "original_text": "Registerbekanntmachung nach dem Umwandlungsgesetz\nBayern Amtsgericht Augsburg HRB 18201\nKunzmann Logistik GmbH – Dasing",
      "type": "Registerbekanntmachung nach dem Umwandlungsgesetz",
      "state": "Bayern",
      "amtsgericht": "Amtsgericht Augsburg",
      "registernummer": "HRB 18201",
      "registerart": "HRB",
      "company_name": "Kunzmann Logistik GmbH",
      "company_seat": "Dasing",
      "details": "17.12.2024 (Bekanntmachungsdatum)\n\nBayern Amtsgericht Augsburg HRB 18201\nRegisterbekanntmachung nach dem Umwandlungsgesetz 16.12.2024 (Eintragungsdatum)\n\nKunzmann Logistik GmbH\nGesellschaft mit beschränkter Haftung\nDasing\n\nDen Gläubigern der an der Verschmelzung beteiligten Rechtsträger ist, wenn sie binnen sechs Monaten nach dem Tag, an dem die Eintragung der Verschmelzung in das Register des Sitzes desjenigen Rechtsträgers, dessen Gläubiger sie sind, nach § 19 Abs. 3 UmwG als bekannt gemacht gilt, ihren Anspruch nach Grund und Höhe schriftlich anmelden, Sicherheit zu leisten, soweit sie nicht Befriedigung verlangen können. Dieses Recht steht den Gläubigern jedoch nur zu, wenn sie glaubhaft machen, dass durch die Verschmelzung die Erfüllung ihrer Forderung gefährdet wird."
    },
    {
      "date": "2024-12-17",
      "id": "96630",
      "original_text": "Registerbekanntmachung nach dem Umwandlungsgesetz\nBayern Amtsgericht München HRB 255705\nAMBIA Grundstücks-Verwaltungsgesellschaft Projekt 1 mbH – Grünwald",
      "type": "Registerbekanntmachung nach dem Umwandlungsgesetz",
      "state": "Bayern",
      "amtsgericht": "Amtsgericht München",
      "registernummer": "HRB 255705",
      "registerart": "HRB",
      "company_name": "AMBIA Grundstücks-Verwaltungsgesellschaft Projekt 1 mbH",
      "company_seat": "Grünwald",
      "details": "17.12.2024 (Bekanntmachungsdatum)\n\nBayern Amtsgericht München HRB 255705\nRegisterbekanntmachung nach dem Umwandlungsgesetz 16.12.2024 (Eintragungsdatum)\n\nAMBIA Grundstücks-Verwaltungsgesellschaft Projekt 1 mbH\nGesellschaft mit beschränkter Haftung\nGrünwald\n\nDen Gläubigern der an der Ausgliederung beteiligten Rechtsträger ist, wenn sie binnen sechs Monaten nach dem Tag, an dem die Eintragung der Ausgliederung in das Register des Sitzes desjenigen Rechtsträgers, dessen Gläubiger sie sind, nach §§ 125, 19 Abs. 3 UmwG als bekannt gemacht gilt, ihren Anspruch nach Grund und Höhe schriftlich anmelden, Sicherheit zu leisten, soweit sie nicht Befriedigung verlangen können. Dieses Recht steht den Gläubigern jedoch nur zu, wenn sie glaubhaft machen, dass durch die Ausgliederung die Erfüllung ihrer Forderung gefährdet wird."
    },
    {
      "date": "2024-12-17",
      "id": "96631",
      "original_text": "Löschungsankündigung\nBayern Amtsgericht München HRB 190623\nMeran & Beacock GmbH – München",
      "type": "Löschungsankündigung",
      "state": "Bayern",
      "amtsgericht": "Amtsgericht München",
      "registernummer": "HRB 190623",
      "registerart": "HRB",
      "company_name": "Meran & Beacock GmbH",
      "company_seat": "München",
      "details": "17.12.2024 (Bekanntmachungsdatum)\n\nBayern Amtsgericht München HRB 190623\nLöschungsankündigung 16.12.2024 (Eintragungsdatum)\n\nMeran & Beacock GmbH\nGesellschaft mit beschränkter Haftung\nMünchen\n\nDas Registergericht beabsichtigt, die im Handelsregister eingetragene Gesellschaft wegen Vermögenslosigkeit von Amts wegen nach § 394 FamFG zu löschen. Die Frist zur Erhebung eines Widerspruchs ist auf drei Monate festgesetzt."
    },
    {
      "date": "2024-12-17",
      "id": "96632",
      "original_text": "Registerbekanntmachung nach dem Umwandlungsgesetz\nBayern Amtsgericht München HRB 255706\nAMBIA Grundstücks-Verwaltungsgesellschaft Projekt 2 mbH – Grünwald",
      "type": "Registerbekanntmachung nach dem Umwandlungsgesetz",
      "state": "Bayern",
      "amtsgericht": "Amtsgericht München",
      "registernummer": "HRB 255706",
      "registerart": "HRB",
      "company_name": "AMBIA Grundstücks-Verwaltungsgesellschaft Projekt 2 mbH",
      "company_seat": "Grünwald",
      "details": "17.12.2024 (Bekanntmachungsdatum)\n\nBayern Amtsgericht München HRB 255706\nRegisterbekanntmachung nach dem Umwandlungsgesetz 16.12.2024 (Eintragungsdatum)\n\nAMBIA Grundstücks-Verwaltungsgesellschaft Projekt 2 mbH\nGesellschaft mit beschränkter Haftung\nGrünwald\n\nDen Gläubigern der an der Ausgliederung beteiligten Rechtsträger ist, wenn sie binnen sechs Monaten nach dem Tag, an dem die Eintragung der Ausgliederung in das Register des Sitzes desjenigen Rechtsträgers, dessen Gläubiger sie sind, nach §§ 125, 19 Abs. 3 UmwG als bekannt gemacht gilt, ihren Anspruch nach Grund und Höhe schriftlich anmelden, Sicherheit zu leisten, soweit sie nicht Befriedigung verlangen können. Dieses Recht steht den Gläubigern jedoch nur zu, wenn sie glaubhaft machen, dass durch die Ausgliederung die Erfüllung ihrer Forderung gefährdet wird."
    },
    {
      "date": "2024-12-17",
      "id": "96633",
      "original_text": "Registerbekanntmachung nach dem Umwandlungsgesetz\nBayern Amtsgericht Fürth HRB 21492\nSES Special Event Service GmbH – Fürth",
      "type": "Registerbekanntmachung nach dem Umwandlungsgesetz",
      "state": "Bayern",
      "amtsgericht": "Amtsgericht Fürth",
      "registernummer": "HRB 21492",
      "registerart": "HRB",
      "company_name": "SES Special Event Service GmbH",
      "company_seat": "Fürth",
      "details": "17.12.2024 (Bekanntmachungsdatum)\n\nBayern Amtsgericht Fürth HRB 21492\nRegisterbekanntmachung nach dem Umwandlungsgesetz 16.12.2024 (Eintragungsdatum)\n\nSES Special Event Service GmbH\nGesellschaft mit beschränkter Haftung\nFürth\n\nDen Gläubigern der an der Ausgliederung beteiligten Rechtsträger ist, wenn sie binnen sechs Monaten nach dem Tag, an dem die Eintragung der Ausgliederung in das Register des Sitzes desjenigen Rechtsträgers, dessen Gläubiger sie sind, nach §§ 125, 19 Abs. 3 UmwG als bekannt gemacht gilt, ihren Anspruch nach Grund und Höhe schriftlich anmelden, Sicherheit zu leisten, soweit sie nicht Befriedigung verlangen können. Dieses Recht steht den Gläubigern jedoch nur zu, wenn sie glaubhaft machen, dass durch die Ausgliederung die Erfüllung ihrer Forderung gefährdet wird."
    },
    {
      "date": "2024-12-17",
      "id": "96634",
      "original_text": "Löschungsankündigung\nBayern Amtsgericht München HRB 167976\nRIMTECH d.o.o. Zweigniederlassung Ismaning – Ismaning",
      "type": "Löschungsankündigung",
      "state": "Bayern",
      "amtsgericht": "Amtsgericht München",
      "registernummer": "HRB 167976",
      "registerart": "HRB",
      "company_name": "RIMTECH d.o.o. Zweigniederlassung Ismaning",
      "company_seat": "Ismaning",
      "details": "17.12.2024 (Bekanntmachungsdatum)\n\nBayern Amtsgericht München HRB 167976\nLöschungsankündigung\n\nRIMTECH d.o.o. Zweigniederlassung Ismaning\nRechtsform ausländischen Rechts HRB\nIsmaning\n\nDas Registergericht beabsichtigt, die im Handelsregister B eingetragene Zweigniederlassung von Amts wegen nach § 395 FamFG zu löschen. Die Frist zur Erhebung eines Widerspruchs ist auf drei Monate festgesetzt."
    },
    {
      "date": "2024-12-17",
      "id": "96635",
      "original_text": "Sonstige Registerbekanntmachung\nBayern Amtsgericht München HRB 182883\nFinanzierungspool GmbH – Haimhausen",
      "type": "Sonstige Registerbekanntmachung",
      "state": "Bayern",
      "amtsgericht": "Amtsgericht München",
      "registernummer": "HRB 182883",
      "registerart": "HRB",
      "company_name": "Finanzierungspool GmbH",
      "company_seat": "Haimhausen",
      "details": "17.12.2024 (Bekanntmachungsdatum)\n\nBayern Amtsgericht München HRB 182883\nSonstige Registerbekanntmachung 16.12.2024 (Eintragungsdatum)\n\nFinanzierungspool GmbH\nGesellschaft mit beschränkter Haftung\nHaimhausen\n\nDen Gläubigern der Gesellschaft, deren Forderungen begründet worden sind, bevor die Eintragung der Beendigung des Beherrschungs- und Gewinnabführungsvertrages in das Handelsregister nach § 10 des Handelsgesetzbuches als bekanntgemacht gilt, hat der andere Vertragsteil Sicherheit zu leisten, wenn sie sich binnen sechs Monaten nach der Bekanntmachung der Eintragung zu diesem Zweck bei ihm melden."
    },
    {
      "date": "2024-12-17",
      "id": "96636",
      "original_text": "Registerbekanntmachung nach dem Umwandlungsgesetz\nBayern Amtsgericht München HRB 292551\nGER Linde GmbH – Pullach i.Isartal",
      "type": "Registerbekanntmachung nach dem Umwandlungsgesetz",
      "state": "Bayern",
      "amtsgericht": "Amtsgericht München",
      "registernummer": "HRB 292551",
      "registerart": "HRB",
      "company_name": "GER Linde GmbH",
      "company_seat": "Pullach i.Isartal",
      "details": "17.12.2024 (Bekanntmachungsdatum)\n\nBayern Amtsgericht München HRB 292551\nRegisterbekanntmachung nach dem Umwandlungsgesetz 16.12.2024 (Eintragungsdatum)\n\nGER Linde GmbH\nGesellschaft mit beschränkter Haftung\nPullach i.Isartal\n\nDen Gläubigern der an der Verschmelzung beteiligten Rechtsträger ist, wenn sie binnen sechs Monaten nach dem Tag, an dem die Eintragung der Verschmelzung in das Register des Sitzes desjenigen Rechtsträgers, dessen Gläubiger sie sind, nach § 19 Abs. 3 UmwG als bekannt gemacht gilt, ihren Anspruch nach Grund und Höhe schriftlich anmelden, Sicherheit zu leisten, soweit sie nicht Befriedigung verlangen können. Dieses Recht steht den Gläubigern jedoch nur zu, wenn sie glaubhaft machen, dass durch die Verschmelzung die Erfüllung ihrer Forderung gefährdet wird."
    },
    {
      "date": "2024-12-17",
      "id": "96637",
      "original_text": "Löschungsankündigung\nBerlin Amtsgericht Berlin (Charlottenburg) HRB 220765\nInteger Asset Management GmbH – Berlin",
      "type": "Löschungsankündigung",
      "state": "Berlin",
      "amtsgericht": "Amtsgericht Berlin (Charlottenburg)",
      "registernummer": "HRB 220765",
      "registerart": "HRB",
      "company_name": "Integer Asset Management GmbH",
      "company_seat": "Berlin",
      "details": "17.12.2024 (Bekanntmachungsdatum)\n\nBerlin Amtsgericht Berlin (Charlottenburg) HRB 220765\nLöschungsankündigung\n\nInteger Asset Management GmbH\nGesellschaft mit beschränkter Haftung\nBerlin\n\nBei der nachstehenden Gesellschaft wird das Amtslöschungsverfahren gemäß § 394 FamFG eingeleitet. Widerspruchsfrist 6 Wochen"
    },
    {
      "date": "2024-12-17",
      "id": "96638",
      "original_text": "Löschungsankündigung\nBrandenburg Amtsgericht Potsdam HRB 25405\nDatenschutz & IT-Projekte Zeidler UG (haftungsbeschränkt) – Teltow",
      "type": "Löschungsankündigung",
      "state": "Brandenburg",
      "amtsgericht": "Amtsgericht Potsdam",
      "registernummer": "HRB 25405",
      "registerart": "HRB",
      "company_name": "Datenschutz & IT-Projekte Zeidler UG (haftungsbeschränkt)",
      "company_seat": "Teltow",
      "details": "17.12.2024 (Bekanntmachungsdatum)\n\nBrandenburg Amtsgericht Potsdam HRB 25405\nLöschungsankündigung\n\nDatenschutz & IT-Projekte Zeidler UG (haftungsbeschränkt)\nGesellschaft mit beschränkter Haftung\nTeltow\n\nBei der nachstehenden Gesellschaft wird das Amtslöschungsverfahren gemäß § 394 FamFG eingeleitet. Widerspruchsfrist beträgt 8 Wochen."
    },
    {
      "date": "2024-12-17",
      "id": "96639",
      "original_text": "Registerbekanntmachung nach dem Umwandlungsgesetz\nBaden-Württemberg Amtsgericht Stuttgart HRA 740859\nAndreas Stiefele e.K. – Leutenbach",
      "type": "Registerbekanntmachung nach dem Umwandlungsgesetz",
      "state": "Baden-Württemberg",
      "amtsgericht": "Amtsgericht Stuttgart",
      "registernummer": "HRA 740859",
      "registerart": "HRA",
      "company_name": "Andreas Stiefele e.K.",
      "company_seat": "Leutenbach",
      "details": "17.12.2024 (Bekanntmachungsdatum)\n\nBaden-Württemberg Amtsgericht Stuttgart HRA 740859\nRegisterbekanntmachung nach dem Umwandlungsgesetz 17.12.2024 (Eintragungsdatum)\n\nAndreas Stiefele e.K.\nEinzelkaufmann / Einzelkauffrau\nLeutenbach\n\nAls nicht eingetragen wird bekanntgemacht:\nDen Gläubigern der an der Ausgliederung beteiligten Rechtsträger ist, wenn sie binnen sechs Monaten nach dem Tag, an dem die Eintragung der Ausgliederung in das Register des Sitzes desjenigen Rechtsträgers, dessen Gläubiger sie sind, nach § 19 Abs. 3 UmwG als bekanntgemacht gilt, ihren Anspruch nach Grund und Höhe schriftlich anmelden, Sicherheit zu leisten, soweit sie nicht Befriedigung verlangen können. Dieses Recht steht den Gläubigern jedoch nur zu, wenn sie glaubhaft machen, dass durch die Ausgliederung die Erfüllung ihrer Forderung gefährdet wird."
    },
    {
      "date": "2024-12-17",
      "id": "96640",
      "original_text": "Löschungsankündigung\nSaarland Amtsgericht Saarbrücken HRB 63777\nzb - dh Heizung, Sanitär und Elektro GmbH – Beckingen",
      "type": "Löschungsankündigung",
      "state": "Saarland",
      "amtsgericht": "Amtsgericht Saarbrücken",
      "registernummer": "HRB 63777",
      "registerart": "HRB",
      "company_name": "zb - dh Heizung, Sanitär und Elektro GmbH",
      "company_seat": "Beckingen",
      "details": "17.12.2024 (Bekanntmachungsdatum)\n\nSaarland Amtsgericht Saarbrücken HRB 63777\nLöschungsankündigung\n\nzb - dh Heizung, Sanitär und Elektro GmbH\nGesellschaft mit beschränkter Haftung\nBeckingen\n\nEs ist beabsichtigt, die Gesellschaft von Amts wegen gemäß § 394 FamFG wegen Vermögenslosigkeit zu löschen.\nGegen die Löschung von Amts wegen ist das Rechtsmittel des Widerspruchs statthaft. Der Widerspruch ist binnen einer Frist zwei Monaten beginnend mit dem Tag dieser Veröffentlichung durch Einreichen eines Widerspruchsschreibens -schriftlich oder zur Niederschrift der Geschäftsstelle beim Amtsgericht Saarbrücken, -zentrales Handelsregister-, Mainzerstr.178, 66121 Saarbrücken einzulegen.\nDer Widerspruch muss die Bezeichnung der angefochtenen Löschungsankündigung enthalten sowie die Erklärung, dass Widerspruch eingelegt wird. Er ist vom Widerspruchsführer oder seinem Bevollmächtigten zu unterzeichnen.\nDas Widerspruchsschreiben kann auch in der Form eines elektronischen Dokumentes eingereicht werden, das mit einer qualifizierten elektronischen Signatur nach dem Signaturgesetz versehen sein muss (§§ 14 Abs. 2 FamFG, 130a, 298 ZPO)."
    },
    {
      "date": "2024-12-17",
      "id": "96641",
      "original_text": "Einreichung neuer Dokumente\nBaden-Württemberg Amtsgericht Stuttgart HRB 214034\nBioTask AG – Esslingen am Neckar",
      "type": "Einreichung neuer Dokumente",
      "state": "Baden-Württemberg",
      "amtsgericht": "Amtsgericht Stuttgart",
      "registernummer": "HRB 214034",
      "registerart": "HRB",
      "company_name": "BioTask AG",
      "company_seat": "Esslingen am Neckar",
      "details": "17.12.2024 (Bekanntmachungsdatum)\n\nBaden-Württemberg Amtsgericht Stuttgart HRB 214034\nEinreichung neuer Dokumente 17.12.2024 (Eintragungsdatum)\n\nBioTask AG\nAktiengesellschaft\nEsslingen am Neckar\n\nDie Gesellschaft hat am 16.12.2024 die Liste über die Zusammensetzung des Aufsichtsrats zum Handelsregister eingereicht."
    },
    {
      "date": "2024-12-17",
      "id": "96642",
      "original_text": "Registerbekanntmachung nach dem Umwandlungsgesetz\nBerlin Amtsgericht Berlin (Charlottenburg) HRB 270031\nAMBOSS AG – Berlin",
      "type": "Registerbekanntmachung nach dem Umwandlungsgesetz",
      "state": "Berlin",
      "amtsgericht": "Amtsgericht Berlin (Charlottenburg)",
      "registernummer": "HRB 270031",
      "registerart": "HRB",
      "company_name": "AMBOSS AG",
      "company_seat": "Berlin",
      "details": "17.12.2024 (Bekanntmachungsdatum)\n\nBerlin Amtsgericht Berlin (Charlottenburg) HRB 270031\nRegisterbekanntmachung nach dem Umwandlungsgesetz 12.12.2024 (Eintragungsdatum)\n\nAMBOSS AG\nAktiengesellschaft\nBerlin\n\nZu Eintragungsnummer 2 vom 12.12.2024 wird als nicht eingetragen vDen Gläubigern ist, wenn sie binnen sechs Monaten nach dem Tag, an dem die Eintragung der Umwandlung als bekannt gemacht gilt, ihren Anspruch nach Grund und Höhe schriftlich anmelden, Sicherheit zu leisten, soweit sie nicht Befriedigung verlangen können. Dieses Recht steht den Gläubigern jedoch nur zu, wenn sie glaubhaft machen, dass durch die Umwandlung die Erfüllung ihrer Forderung gefährdet wird. Das Recht, Sicherheitsleistung zu verlangen, steht Gläubigern nicht zu, die im Falle der Insolvenz ein Recht auf vorzugsweise Befriedigung aus einer Deckungsmasse haben, die nach gesetzlicher Vorschrift zu ihrem Schutz errichtet und staatlich überwacht ist.eröffentlicht:"
    },
    {
      "date": "2024-12-17",
      "id": "96643",
      "original_text": "Löschungsankündigung\nBerlin Amtsgericht Berlin (Charlottenburg) HRB 124161\nHealth4You GmbH – Berlin",
      "type": "Löschungsankündigung",
      "state": "Berlin",
      "amtsgericht": "Amtsgericht Berlin (Charlottenburg)",
      "registernummer": "HRB 124161",
      "registerart": "HRB",
      "company_name": "Health4You GmbH",
      "company_seat": "Berlin",
      "details": "17.12.2024 (Bekanntmachungsdatum)\n\nBerlin Amtsgericht Berlin (Charlottenburg) HRB 124161\nLöschungsankündigung\n\nHealth4You GmbH\nGesellschaft mit beschränkter Haftung\nBerlin\n\nBei der nachstehenden Gesellschaft wird das Amtslöschungsverfahren gemäß § 394 FamFG eingeleitet. Widerspruchsfrist 6 Wochen"
    },
    {
      "date": "2024-12-17",
      "id": "96644",
      "original_text": "Löschungsankündigung\nBerlin Amtsgericht Berlin (Charlottenburg) HRB 208158\nNew Croxteth Group GmbH – Berlin",
      "type": "Löschungsankündigung",
      "state": "Berlin",
      "amtsgericht": "Amtsgericht Berlin (Charlottenburg)",
      "registernummer": "HRB 208158",
      "registerart": "HRB",
      "company_name": "New Croxteth Group GmbH",
      "company_seat": "Berlin",
      "details": "17.12.2024 (Bekanntmachungsdatum)\n\nBerlin Amtsgericht Berlin (Charlottenburg) HRB 208158\nLöschungsankündigung\n\nNew Croxteth Group GmbH\nGesellschaft mit beschränkter Haftung\nBerlin\n\nBei der nachstehenden Gesellschaft wird das Amtslöschungsverfahren gemäß § 394 FamFG eingeleitet. Widerspruchsfrist 6 Wochen"
    },
    {
      "date": "2024-12-17",
      "id": "96645",
      "original_text": "Löschungsankündigung\nBerlin Amtsgericht Berlin (Charlottenburg) HRB 179138\nSchokoladenwald UG (haftungsbeschränkt) – Berlin",
      "type": "Löschungsankündigung",
      "state": "Berlin",
      "amtsgericht": "Amtsgericht Berlin (Charlottenburg)",
      "registernummer": "HRB 179138",
      "registerart": "HRB",
      "company_name": "Schokoladenwald UG (haftungsbeschränkt)",
      "company_seat": "Berlin",
      "details": "17.12.2024 (Bekanntmachungsdatum)\n\nBerlin Amtsgericht Berlin (Charlottenburg) HRB 179138\nLöschungsankündigung\n\nSchokoladenwald UG (haftungsbeschränkt)\nGesellschaft mit beschränkter Haftung\nBerlin\n\nBei der nachstehenden Gesellschaft wird das Amtslöschungsverfahren gemäß § 394 FamFG eingeleitet. Widerspruchsfrist 6 Wochen"
    },
    {
      "date": "2024-12-17",
      "id": "96646",
      "original_text": "Löschungsankündigung\nBerlin Amtsgericht Berlin (Charlottenburg) HRB 244136\nSIF UG (haftungsbeschränkt) – Berlin",
      "type": "Löschungsankündigung",
      "state": "Berlin",
      "amtsgericht": "Amtsgericht Berlin (Charlottenburg)",
      "registernummer": "HRB 244136",
      "registerart": "HRB",
      "company_name": "SIF UG (haftungsbeschränkt)",
      "company_seat": "Berlin",
      "details": "17.12.2024 (Bekanntmachungsdatum)\n\nBerlin Amtsgericht Berlin (Charlottenburg) HRB 244136\nLöschungsankündigung\n\nSIF UG (haftungsbeschränkt)\nGesellschaft mit beschränkter Haftung\nBerlin\n\nBei der nachstehenden Gesellschaft wird das Amtslöschungsverfahren gemäß § 394 FamFG eingeleitet. Widerspruchsfrist 6 Wochen"
    },
    {
      "date": "2024-12-17",
      "id": "96647",
      "original_text": "Einreichung neuer Dokumente\nBerlin Amtsgericht Berlin (Charlottenburg) HRB 200131\nDie Autobahn GmbH des Bundes – Berlin",
      "type": "Einreichung neuer Dokumente",
      "state": "Berlin",
      "amtsgericht": "Amtsgericht Berlin (Charlottenburg)",
      "registernummer": "HRB 200131",
      "registerart": "HRB",
      "company_name": "Die Autobahn GmbH des Bundes",
      "company_seat": "Berlin",
      "details": "17.12.2024 (Bekanntmachungsdatum)\n\nBerlin Amtsgericht Berlin (Charlottenburg) HRB 200131\nEinreichung neuer Dokumente\n\nDie Autobahn GmbH des Bundes\nGesellschaft mit beschränkter Haftung\nBerlin\n\nAls nicht eingetragen wird veröffentlicht:Es wurde eine neue Liste der Aufsichtsratsmitglieder eingereicht (§52 GmbHG)."
    },
    {
      "date": "2024-12-17",
      "id": "96648",
      "original_text": "Registerbekanntmachung nach dem Umwandlungsgesetz\nHamburg Amtsgericht Hamburg HRB 189911\nAquila Digital Infrastructure Holding GmbH – Hamburg",
      "type": "Registerbekanntmachung nach dem Umwandlungsgesetz",
      "state": "Hamburg",
      "amtsgericht": "Amtsgericht Hamburg",
      "registernummer": "HRB 189911",
      "registerart": "HRB",
      "company_name": "Aquila Digital Infrastructure Holding GmbH",
      "company_seat": "Hamburg",
      "details": "17.12.2024 (Bekanntmachungsdatum)\n\nHamburg Amtsgericht Hamburg HRB 189911\nRegisterbekanntmachung nach dem Umwandlungsgesetz 13.12.2024 (Eintragungsdatum)\n\nAquila Digital Infrastructure Holding GmbH\nGesellschaft mit beschränkter Haftung\nHamburg\n\nAls nicht eingetragen wird bekannt gemacht:\nDen Gläubigern der an der Ausgliederung beteiligten Gesellschaften ist, wenn sie binnen sechs Monaten nach dem Tag, an dem die Eintragung der Ausgliederung in das Register des Sitzes desjenigen Rechtsträgers, dessen Gläubiger sie sind, nach § 19 Absatz 3 UmwG als bekannt gemacht gilt, ihren Anspruch nach Grund und Höhe schriftlich anmelden, Sicherheit zu leisten, soweit sie nicht Befriedigung verlangen können. Dieses Recht steht den Gläubigern jedoch nur zu, wenn sie glaubhaft machen, dass durch die Ausgliederung die Erfüllung ihrer Forderung gefährdet wird."
    },
    {
      "date": "2024-12-17",
      "id": "96649",
      "original_text": "Registerbekanntmachung nach dem Umwandlungsgesetz\nHamburg Amtsgericht Hamburg HRB 177977\nAquila Digital Infrastructure GmbH – Hamburg",
      "type": "Registerbekanntmachung nach dem Umwandlungsgesetz",
      "state": "Hamburg",
      "amtsgericht": "Amtsgericht Hamburg",
      "registernummer": "HRB 177977",
      "registerart": "HRB",
      "company_name": "Aquila Digital Infrastructure GmbH",
      "company_seat": "Hamburg",
      "details": "17.12.2024 (Bekanntmachungsdatum)\n\nHamburg Amtsgericht Hamburg HRB 177977\nRegisterbekanntmachung nach dem Umwandlungsgesetz 13.12.2024 (Eintragungsdatum)\n\nAquila Digital Infrastructure GmbH\nGesellschaft mit beschränkter Haftung\nHamburg\n\nAls nicht eingetragen wird bekannt gemacht:\nDen Gläubigern der an der Ausgliederung beteiligten Gesellschaften ist, wenn sie binnen sechs Monaten nach dem Tag, an dem die Eintragung der Ausgliederung in das Register des Sitzes desjenigen Rechtsträgers, dessen Gläubiger sie sind, nach § 19 Absatz 3 UmwG als bekannt gemacht gilt, ihren Anspruch nach Grund und Höhe schriftlich anmelden, Sicherheit zu leisten, soweit sie nicht Befriedigung verlangen können. Dieses Recht steht den Gläubigern jedoch nur zu, wenn sie glaubhaft machen, dass durch die Ausgliederung die Erfüllung ihrer Forderung gefährdet wird."
    },
    {
      "date": "2024-12-17",
      "id": "96650",
      "original_text": "Einreichung neuer Dokumente\nBaden-Württemberg Amtsgericht Mannheim HRB 737454\nVIVAVIS AG – Ettlingen",
      "type": "Einreichung neuer Dokumente",
      "state": "Baden-Württemberg",
      "amtsgericht": "Amtsgericht Mannheim",
      "registernummer": "HRB 737454",
      "registerart": "HRB",
      "company_name": "VIVAVIS AG",
      "company_seat": "Ettlingen",
      "details": "17.12.2024 (Bekanntmachungsdatum)\n\nBaden-Württemberg Amtsgericht Mannheim HRB 737454\nEinreichung neuer Dokumente 05.12.2024 (Eintragungsdatum)\n\nVIVAVIS AG\nAktiengesellschaft\nEttlingen\n\nDie Gesellschaft hat am 25.11.2024 die Liste über die Zusammensetzung des Aufsichtsrats zum Handelsregister eingereicht."
    },
    {
      "date": "2024-12-17",
      "id": "96651",
      "original_text": "Registerbekanntmachung nach dem Umwandlungsgesetz\nBerlin Amtsgericht Berlin (Charlottenburg) HRB 202040\nParadyse Berlin Publishing GmbH – Berlin",
      "type": "Registerbekanntmachung nach dem Umwandlungsgesetz",
      "state": "Berlin",
      "amtsgericht": "Amtsgericht Berlin (Charlottenburg)",
      "registernummer": "HRB 202040",
      "registerart": "HRB",
      "company_name": "Paradyse Berlin Publishing GmbH",
      "company_seat": "Berlin",
      "details": "17.12.2024 (Bekanntmachungsdatum)\n\nBerlin Amtsgericht Berlin (Charlottenburg) HRB 202040\nRegisterbekanntmachung nach dem Umwandlungsgesetz 16.12.2024 (Eintragungsdatum)\n\nParadyse Berlin Publishing GmbH\nGesellschaft mit beschränkter Haftung\nBerlin\n\nZu Eintragungsnummer 8 vom 16.12.2024 wird als nicht eingetragen veröffentlicht:\n\nDen Gläubigern der an der Spaltung beteiligten Rechtsträger ist, wenn sie binnen sechs Monaten nach dem Tag, an dem die Eintragung der Spaltung in das Register des Sitzes desjenigen Rechtsträgers, dessen Gläubiger sie sind, als bekannt gemacht gilt, ihren Anspruch nach Grund und Höhe schriftlich anmelden, Sicherheit zu leisten, soweit sie nicht Befriedigung verlangen können. Dieses Recht steht den Gläubigern jedoch nur zu, wenn sie glaubhaft machen, dass durch die Spaltung die Erfüllung ihrer Forderung gefährdet wird. Das Recht, Sicherheitsleistung zu verlangen, steht Gläubigern nicht zu, die im Falle der Insolvenz ein Recht auf vorzugsweise Befriedigung aus einer Deckungsmasse haben, die nach gesetzlicher Vorschrift zu ihrem Schutz errichtet und staatlich überwacht ist."
    },
    {
      "date": "2024-12-17",
      "id": "96652",
      "original_text": "Registerbekanntmachung nach dem Umwandlungsgesetz\nBaden-Württemberg Amtsgericht Stuttgart HRB 725252\nInnovation Group AG – Stuttgart",
      "type": "Registerbekanntmachung nach dem Umwandlungsgesetz",
      "state": "Baden-Württemberg",
      "amtsgericht": "Amtsgericht Stuttgart",
      "registernummer": "HRB 725252",
      "registerart": "HRB",
      "company_name": "Innovation Group AG",
      "company_seat": "Stuttgart",
      "details": "17.12.2024 (Bekanntmachungsdatum)\n\nBaden-Württemberg Amtsgericht Stuttgart HRB 725252\nRegisterbekanntmachung nach dem Umwandlungsgesetz 17.12.2024 (Eintragungsdatum)\n\nInnovation Group AG\nAktiengesellschaft\nStuttgart\n\nAls nicht eingetragen wird bekanntgemacht:\nDen Gläubigern des an dem Formwechsel beteiligten Rechtsträgers ist, wenn sie binnen sechs Monaten nach dem Tag, an dem die Eintragung des Formwechsels in das Register des Sitzes desjenigen Rechtsträgers, dessen Gläubiger sie sind, nach § 19 Abs. 3 UmwG als bekanntgemacht gilt, ihren Anspruch nach Grund und Höhe schriftlich anmelden, Sicherheit zu leisten, soweit sie nicht Befriedigung verlangen können. Dieses Recht steht den Gläubigern jedoch nur zu, wenn sie glaubhaft machen, dass durch den Formwechsel die Erfüllung ihrer Forderung gefährdet wird."
    },
    {
      "date": "2024-12-17",
      "id": "96653",
      "original_text": "Registerbekanntmachung nach dem Umwandlungsgesetz\nBerlin Amtsgericht Berlin (Charlottenburg) HRB 224778\nParadyse Berlin GmbH – Berlin",
      "type": "Registerbekanntmachung nach dem Umwandlungsgesetz",
      "state": "Berlin",
      "amtsgericht": "Amtsgericht Berlin (Charlottenburg)",
      "registernummer": "HRB 224778",
      "registerart": "HRB",
      "company_name": "Paradyse Berlin GmbH",
      "company_seat": "Berlin",
      "details": "17.12.2024 (Bekanntmachungsdatum)\n\nBerlin Amtsgericht Berlin (Charlottenburg) HRB 224778\nRegisterbekanntmachung nach dem Umwandlungsgesetz 16.12.2024 (Eintragungsdatum)\n\nParadyse Berlin GmbH\nGesellschaft mit beschränkter Haftung\nBerlin\n\nZu Eintragungsnummer 7 vom 16.12.2024 wird als nicht eingetragen veröffentlicht:\n\nDen Gläubigern der an der Spaltung beteiligten Rechtsträger ist, wenn sie binnen sechs Monaten nach dem Tag, an dem die Eintragung der Spaltung in das Register des Sitzes desjenigen Rechtsträgers, dessen Gläubiger sie sind, als bekannt gemacht gilt, ihren Anspruch nach Grund und Höhe schriftlich anmelden, Sicherheit zu leisten, soweit sie nicht Befriedigung verlangen können. Dieses Recht steht den Gläubigern jedoch nur zu, wenn sie glaubhaft machen, dass durch die Spaltung die Erfüllung ihrer Forderung gefährdet wird. Das Recht, Sicherheitsleistung zu verlangen, steht Gläubigern nicht zu, die im Falle der Insolvenz ein Recht auf vorzugsweise Befriedigung aus einer Deckungsmasse haben, die nach gesetzlicher Vorschrift zu ihrem Schutz errichtet und staatlich überwacht ist."
    },
    {
      "date": "2024-12-17",
      "id": "96654",
      "original_text": "Löschungsankündigung\nBerlin Amtsgericht Berlin (Charlottenburg) HRB 195575\nMex Service GmbH – Berlin",
      "type": "Löschungsankündigung",
      "state": "Berlin",
      "amtsgericht": "Amtsgericht Berlin (Charlottenburg)",
      "registernummer": "HRB 195575",
      "registerart": "HRB",
      "company_name": "Mex Service GmbH",
      "company_seat": "Berlin",
      "details": "17.12.2024 (Bekanntmachungsdatum)\n\nBerlin Amtsgericht Berlin (Charlottenburg) HRB 195575\nLöschungsankündigung\n\nMex Service GmbH\nGesellschaft mit beschränkter Haftung\nBerlin\n\nBei der nachstehenden Gesellschaft wird das Amtslöschungsverfahren gemäß § 394 FamFG eingeleitet. Widerspruchsfrist 6 Wochen"
    },
    {
      "date": "2024-12-17",
      "id": "96655",
      "original_text": "Sonstige Registerbekanntmachung\nBerlin Amtsgericht Berlin (Charlottenburg) HRB 173862\nKRIS - LÜFT GmbH – Berlin",
      "type": "Sonstige Registerbekanntmachung",
      "state": "Berlin",
      "amtsgericht": "Amtsgericht Berlin (Charlottenburg)",
      "registernummer": "HRB 173862",
      "registerart": "HRB",
      "company_name": "KRIS - LÜFT GmbH",
      "company_seat": "Berlin",
      "details": "17.12.2024 (Bekanntmachungsdatum)\n\nBerlin Amtsgericht Berlin (Charlottenburg) HRB 173862\nSonstige Registerbekanntmachung\n\nKRIS - LÜFT GmbH\nGesellschaft mit beschränkter Haftung\nBerlin\n\nAls nicht eingetragen wird veröffentlicht:  Es ist beabsichtigt die Eintragung des Herrn Krzysztof Zielinski als Geschäftsführer/Liquidator im Handelsregister gemäß § 395 FamFG zu löschen. Widerspruchsfrist: 2 Wochen"
    },
    {
      "date": "2024-12-17",
      "id": "96656",
      "original_text": "Löschungsankündigung\nBaden-Württemberg Amtsgericht Mannheim HRB 719528\nSchreinerei Erny GmbH – Heddesheim",
      "type": "Löschungsankündigung",
      "state": "Baden-Württemberg",
      "amtsgericht": "Amtsgericht Mannheim",
      "registernummer": "HRB 719528",
      "registerart": "HRB",
      "company_name": "Schreinerei Erny GmbH",
      "company_seat": "Heddesheim",
      "details": "17.12.2024 (Bekanntmachungsdatum)\n\nBaden-Württemberg Amtsgericht Mannheim HRB 719528\nLöschungsankündigung\n\nSchreinerei Erny GmbH\nGesellschaft mit beschränkter Haftung\nHeddesheim\n\nDas Gericht beabsichtigt, die Gesellschaft wegen Vermögenslosigkeit im Handelsregister von Amts wegen nach § 394 FamFG zu löschen. Die Frist zur Geltendmachung eines Widerspruchs gegen die beabsichtigte Löschung ist auf einen Monat ab Veröffentlichung bestimmt."
    },
    {
      "date": "2024-12-17",
      "id": "96657",
      "original_text": "Registerbekanntmachung nach dem Umwandlungsgesetz\nBerlin Amtsgericht Berlin (Charlottenburg) HRB 200620\nREALPORT AG – Berlin",
      "type": "Registerbekanntmachung nach dem Umwandlungsgesetz",
      "state": "Berlin",
      "amtsgericht": "Amtsgericht Berlin (Charlottenburg)",
      "registernummer": "HRB 200620",
      "registerart": "HRB",
      "company_name": "REALPORT AG",
      "company_seat": "Berlin",
      "details": "17.12.2024 (Bekanntmachungsdatum)\n\nBerlin Amtsgericht Berlin (Charlottenburg) HRB 200620\nRegisterbekanntmachung nach dem Umwandlungsgesetz 16.12.2024 (Eintragungsdatum)\n\nREALPORT AG\nAktiengesellschaft\nBerlin\n\nZu Eintragungsnummer 20 vom 16.12.2024 wird als nicht eingetragen veröffentlicht: Den Gläubigern der an der Verschmelzung beteiligten Rechtsträger ist, wenn sie binnen sechs Monaten nach dem Tag, an dem die Eintragung der Verschmelzung in das Register des Sitzes desjenigen Rechtsträgers, dessen Gläubiger sie sind, als bekannt gemacht gilt, ihren Anspruch nach Grund und Höhe schriftlich anmelden, Sicherheit zu leisten, soweit sie nicht Befriedigung verlangen können. Dieses Recht steht den Gläubigern jedoch nur zu, wenn sie glaubhaft machen, dass durch die Verschmelzung die Erfüllung ihrer Forderung gefährdet wird. Das Recht, Sicherheitsleistung zu verlangen, steht Gläubigern nicht zu, die im Falle der Insolvenz ein Recht auf vorzugsweise Befriedigung aus einer Deckungsmasse haben, die nach gesetzlicher Vorschrift zu ihrem Schutz errichtet und staatlich überwacht ist."
    },
    {
      "date": "2024-12-17",
      "id": "96658",
      "original_text": "Registerbekanntmachung nach dem Umwandlungsgesetz\nBerlin Amtsgericht Berlin (Charlottenburg) HRB 200620\nREALPORT AG – Berlin",
      "type": "Registerbekanntmachung nach dem Umwandlungsgesetz",
      "state": "Berlin",
      "amtsgericht": "Amtsgericht Berlin (Charlottenburg)",
      "registernummer": "HRB 200620",
      "registerart": "HRB",
      "company_name": "REALPORT AG",
      "company_seat": "Berlin",
      "details": "17.12.2024 (Bekanntmachungsdatum)\n\nBerlin Amtsgericht Berlin (Charlottenburg) HRB 200620\nRegisterbekanntmachung nach dem Umwandlungsgesetz 16.12.2024 (Eintragungsdatum)\n\nREALPORT AG\nAktiengesellschaft\nBerlin\n\nZu Eintragungsnummer 19 vom 16.12.2024 wird als nicht eingetragen veröffentlicht: Den Gläubigern der an der Verschmelzung beteiligten Rechtsträger ist, wenn sie binnen sechs Monaten nach dem Tag, an dem die Eintragung der Verschmelzung in das Register des Sitzes desjenigen Rechtsträgers, dessen Gläubiger sie sind, als bekannt gemacht gilt, ihren Anspruch nach Grund und Höhe schriftlich anmelden, Sicherheit zu leisten, soweit sie nicht Befriedigung verlangen können. Dieses Recht steht den Gläubigern jedoch nur zu, wenn sie glaubhaft machen, dass durch die Verschmelzung die Erfüllung ihrer Forderung gefährdet wird. Das Recht, Sicherheitsleistung zu verlangen, steht Gläubigern nicht zu, die im Falle der Insolvenz ein Recht auf vorzugsweise Befriedigung aus einer Deckungsmasse haben, die nach gesetzlicher Vorschrift zu ihrem Schutz errichtet und staatlich überwacht ist."
    },
    {
      "date": "2024-12-17",
      "id": "96659",
      "original_text": "Registerbekanntmachung nach dem Umwandlungsgesetz\nBerlin Amtsgericht Berlin (Charlottenburg) HRB 205891\nRealport Services GmbH – Berlin",
      "type": "Registerbekanntmachung nach dem Umwandlungsgesetz",
      "state": "Berlin",
      "amtsgericht": "Amtsgericht Berlin (Charlottenburg)",
      "registernummer": "HRB 205891",
      "registerart": "HRB",
      "company_name": "Realport Services GmbH",
      "company_seat": "Berlin",
      "details": "17.12.2024 (Bekanntmachungsdatum)\n\nBerlin Amtsgericht Berlin (Charlottenburg) HRB 205891\nRegisterbekanntmachung nach dem Umwandlungsgesetz 16.12.2024 (Eintragungsdatum)\n\nRealport Services GmbH\nGesellschaft mit beschränkter Haftung\nBerlin\n\nZu Eintragungsnummer 4 vom 16.12.2024 wird als nicht eingetragen veröffentlicht: Den Gläubigern der an der Verschmelzung beteiligten Rechtsträger ist, wenn sie binnen sechs Monaten nach dem Tag, an dem die Eintragung der Verschmelzung in das Register des Sitzes desjenigen Rechtsträgers, dessen Gläubiger sie sind, als bekannt gemacht gilt, ihren Anspruch nach Grund und Höhe schriftlich anmelden, Sicherheit zu leisten, soweit sie nicht Befriedigung verlangen können. Dieses Recht steht den Gläubigern jedoch nur zu, wenn sie glaubhaft machen, dass durch die Verschmelzung die Erfüllung ihrer Forderung gefährdet wird. Das Recht, Sicherheitsleistung zu verlangen, steht Gläubigern nicht zu, die im Falle der Insolvenz ein Recht auf vorzugsweise Befriedigung aus einer Deckungsmasse haben, die nach gesetzlicher Vorschrift zu ihrem Schutz errichtet und staatlich überwacht ist."
    },
    {
      "date": "2024-12-17",
      "id": "96660",
      "original_text": "Registerbekanntmachung nach dem Umwandlungsgesetz\nBerlin Amtsgericht Berlin (Charlottenburg) HRB 205891\nRealport Services GmbH – Berlin",
      "type": "Registerbekanntmachung nach dem Umwandlungsgesetz",
      "state": "Berlin",
      "amtsgericht": "Amtsgericht Berlin (Charlottenburg)",
      "registernummer": "HRB 205891",
      "registerart": "HRB",
      "company_name": "Realport Services GmbH",
      "company_seat": "Berlin",
      "details": "17.12.2024 (Bekanntmachungsdatum)\n\nBerlin Amtsgericht Berlin (Charlottenburg) HRB 205891\nRegisterbekanntmachung nach dem Umwandlungsgesetz 16.12.2024 (Eintragungsdatum)\n\nRealport Services GmbH\nGesellschaft mit beschränkter Haftung\nBerlin\n\nZu Eintragungsnummer 4 vom 16.12.2024 wird veröffentlicht: Der andere Vertragsteil hat den Gläubigern dieses Rechtsträgers, deren Forderungen begründet worden sind, bevor die Eintragung der Beendigung dieses Vertrages in das Handelsregister nach § 10 des Handelsgesetzbuches als bekannt gemacht gilt, Sicherheit zu leisten, wenn sie sich binnen sechs Monaten nach der Bekanntmachung der Eintragung zu diesem Zweck bei ihm melden. Dieses Recht steht den Gläubigern nicht zu, die im Fall des Insolvenzverfahrens ein Recht auf vorzugsweise Befriedigung aus der Deckungsmasse haben, die nach gesetzlicher Vorschrift zu ihrem Schutz errichtet und staatlich überwacht ist."
    },
    {
      "date": "2024-12-17",
      "id": "96661",
      "original_text": "Registerbekanntmachung nach dem Umwandlungsgesetz\nBerlin Amtsgericht Berlin (Charlottenburg) HRB 204285\nRealport Broker GmbH – Berlin",
      "type": "Registerbekanntmachung nach dem Umwandlungsgesetz",
      "state": "Berlin",
      "amtsgericht": "Amtsgericht Berlin (Charlottenburg)",
      "registernummer": "HRB 204285",
      "registerart": "HRB",
      "company_name": "Realport Broker GmbH",
      "company_seat": "Berlin",
      "details": "17.12.2024 (Bekanntmachungsdatum)\n\nBerlin Amtsgericht Berlin (Charlottenburg) HRB 204285\nRegisterbekanntmachung nach dem Umwandlungsgesetz 16.12.2024 (Eintragungsdatum)\n\nRealport Broker GmbH\nGesellschaft mit beschränkter Haftung\nBerlin\n\nZu Eintragungsnummer 7 vom 16.12.2024 wird als nicht eingetragen veröffentlicht: Den Gläubigern der an der Verschmelzung beteiligten Rechtsträger ist, wenn sie binnen sechs Monaten nach dem Tag, an dem die Eintragung der Verschmelzung in das Register des Sitzes desjenigen Rechtsträgers, dessen Gläubiger sie sind, als bekannt gemacht gilt, ihren Anspruch nach Grund und Höhe schriftlich anmelden, Sicherheit zu leisten, soweit sie nicht Befriedigung verlangen können. Dieses Recht steht den Gläubigern jedoch nur zu, wenn sie glaubhaft machen, dass durch die Verschmelzung die Erfüllung ihrer Forderung gefährdet wird. Das Recht, Sicherheitsleistung zu verlangen, steht Gläubigern nicht zu, die im Falle der Insolvenz ein Recht auf vorzugsweise Befriedigung aus einer Deckungsmasse haben, die nach gesetzlicher Vorschrift zu ihrem Schutz errichtet und staatlich überwacht ist.\n\nDer andere Vertragsteil hat den Gläubigern dieses Rechtsträgers, deren Forderungen begründet worden sind, bevor die Eintragung der Beendigung dieses Vertrages in das Handelsregister nach § 10 des Handelsgesetzbuches als bekannt gemacht gilt, Sicherheit zu leisten, wenn sie sich binnen sechs Monaten nach der Bekanntmachung der Eintragung zu diesem Zweck bei ihm melden. Dieses Recht steht den Gläubigern nicht zu, die im Fall des Insolvenzverfahrens ein Recht auf vorzugsweise Befriedigung aus der Deckungsmasse haben, die nach gesetzlicher Vorschrift zu ihrem Schutz errichtet und staatlich überwacht ist."
    },
    {
      "date": "2024-12-17",
      "id": "96662",
      "original_text": "Registerbekanntmachung nach dem Umwandlungsgesetz\nMecklenburg-Vorpommern Amtsgericht Schwerin HRA 4721\nLandwirtschaftsunternehmen Gut Grambow Hans Martin Lösch e. K. – Grambow",
      "type": "Registerbekanntmachung nach dem Umwandlungsgesetz",
      "state": "Mecklenburg-Vorpommern",
      "amtsgericht": "Amtsgericht Schwerin",
      "registernummer": "HRA 4721",
      "registerart": "HRA",
      "company_name": "Landwirtschaftsunternehmen Gut Grambow Hans Martin Lösch e. K.",
      "company_seat": "Grambow",
      "details": "17.12.2024 (Bekanntmachungsdatum)\n\nMecklenburg-Vorpommern Amtsgericht Schwerin HRA 4721\nRegisterbekanntmachung nach dem Umwandlungsgesetz 17.12.2024 (Eintragungsdatum)\n\nLandwirtschaftsunternehmen Gut Grambow Hans Martin Lösch e. K.\nEinzelkaufmann / Einzelkauffrau\nGrambow\n\nAls nicht eingetragen wird veröffentlicht: Den Gläubigern der an der Ausgliederung beteiligten Rechtsträger ist, wenn sie binnen sechs Monaten nach dem Tag, an dem die Eintragung der Ausgliederung in das Register des Sitzes desjenigen Rechtsträgers, dessen Gläubiger sie sind, nach § 19 Abs. 3 UmwG als bekannt gemacht gilt, ihren Anspruch nach Grund und Höhe schriftlich anmelden,\nSicherheit zu leisten, soweit sie nicht Befriedigung verlangen können. Dieses Recht steht den Gläubigern jedoch nur zu, wenn sie glaubhaft machen, dass durch die Ausgliederung die Erfüllung der Forderung gefährdet wird."
    },
    {
      "date": "2024-12-17",
      "id": "96663",
      "original_text": "Registerbekanntmachung nach dem Umwandlungsgesetz\nMecklenburg-Vorpommern Amtsgericht Schwerin HRA 4682\nHML Grambow Holding GmbH & Co. KG – Grambow",
      "type": "Registerbekanntmachung nach dem Umwandlungsgesetz",
      "state": "Mecklenburg-Vorpommern",
      "amtsgericht": "Amtsgericht Schwerin",
      "registernummer": "HRA 4682",
      "registerart": "HRA",
      "company_name": "HML Grambow Holding GmbH & Co. KG",
      "company_seat": "Grambow",
      "details": "17.12.2024 (Bekanntmachungsdatum)\n\nMecklenburg-Vorpommern Amtsgericht Schwerin HRA 4682\nRegisterbekanntmachung nach dem Umwandlungsgesetz 17.12.2024 (Eintragungsdatum)\n\nHML Grambow Holding GmbH & Co. KG\nKommanditgesellschaft\nGrambow\n\nAls nicht eingetragen wird veröffentlicht: Den Gläubigern der an der Ausgliederung beteiligten Rechtsträger ist, wenn sie binnen sechs Monaten nach dem Tag, an dem die Eintragung der Ausgliederung in das Register des Sitzes desjenigen Rechtsträgers, dessen Gläubiger sie sind, nach § 19 Abs. 3 UmwG als bekannt gemacht gilt, ihren Anspruch nach Grund und Höhe schriftlich anmelden,\nSicherheit zu leisten, soweit sie nicht Befriedigung verlangen können. Dieses Recht steht den Gläubigern jedoch nur zu, wenn sie glaubhaft machen, dass durch die Ausgliederung die Erfüllung der Forderung gefährdet wird."
    },
    {
      "date": "2024-12-17",
      "id": "96664",
      "original_text": "Einreichung neuer Dokumente\nBaden-Württemberg Amtsgericht Mannheim HRB 703173\nStadtwerke Heidelberg Netze GmbH – Heidelberg",
      "type": "Einreichung neuer Dokumente",
      "state": "Baden-Württemberg",
      "amtsgericht": "Amtsgericht Mannheim",
      "registernummer": "HRB 703173",
      "registerart": "HRB",
      "company_name": "Stadtwerke Heidelberg Netze GmbH",
      "company_seat": "Heidelberg",
      "details": "17.12.2024 (Bekanntmachungsdatum)\n\nBaden-Württemberg Amtsgericht Mannheim HRB 703173\nEinreichung neuer Dokumente\n\nStadtwerke Heidelberg Netze GmbH\nGesellschaft mit beschränkter Haftung\nHeidelberg\n\nDie Gesellschaft hat am 09.12.2024 die Liste über die Zusammensetzung des Aufsichtsrats zum Handelsregister eingereicht."
    },
    {
      "date": "2024-12-17",
      "id": "96665",
      "original_text": "Löschungsankündigung\nBaden-Württemberg Amtsgericht Stuttgart HRB 214560\nArtur Hohenberger Fliesenarbeiten, Natursteine GmbH – Aichwald",
      "type": "Löschungsankündigung",
      "state": "Baden-Württemberg",
      "amtsgericht": "Amtsgericht Stuttgart",
      "registernummer": "HRB 214560",
      "registerart": "HRB",
      "company_name": "Artur Hohenberger Fliesenarbeiten, Natursteine GmbH",
      "company_seat": "Aichwald",
      "details": "17.12.2024 (Bekanntmachungsdatum)\n\nBaden-Württemberg Amtsgericht Stuttgart HRB 214560\nLöschungsankündigung\n\nArtur Hohenberger Fliesenarbeiten, Natursteine GmbH\nGesellschaft mit beschränkter Haftung\nAichwald\n\nAls nicht eingetragen wird bekanntgemacht:\nDas Gericht beabsichtigt, die Gesellschaft wegen Vermögenslosigkeit im Handelsregister von Amts wegen nach § 394 FamFG zu löschen. Die Frist zur Geltendmachung eines Widerspruchs gegen die beabsichtigte Löschung ist auf zwei Monate ab Veröffentlichung bestimmt."
    },
    {
      "date": "2024-12-17",
      "id": "96666",
      "original_text": "Löschungsankündigung\nBrandenburg Amtsgericht Potsdam HRB 31890\nJänicke Spedition und Transport GmbH – Großbeeren",
      "type": "Löschungsankündigung",
      "state": "Brandenburg",
      "amtsgericht": "Amtsgericht Potsdam",
      "registernummer": "HRB 31890",
      "registerart": "HRB",
      "company_name": "Jänicke Spedition und Transport GmbH",
      "company_seat": "Großbeeren",
      "details": "17.12.2024 (Bekanntmachungsdatum)\n\nBrandenburg Amtsgericht Potsdam HRB 31890\nLöschungsankündigung\n\nJänicke Spedition und Transport GmbH\nGesellschaft mit beschränkter Haftung\nGroßbeeren\n\nBei der nachstehenden Gesellschaft wird das Amtslöschungsverfahren gemäß § 394 FamFG eingeleitet. Widerspruchsfrist: 8 Wochen."
    },
    {
      "date": "2024-12-17",
      "id": "96667",
      "original_text": "Registerbekanntmachung nach dem Umwandlungsgesetz\nBaden-Württemberg Amtsgericht Stuttgart HRB 739753\nSchildDirect GmbH – Balingen",
      "type": "Registerbekanntmachung nach dem Umwandlungsgesetz",
      "state": "Baden-Württemberg",
      "amtsgericht": "Amtsgericht Stuttgart",
      "registernummer": "HRB 739753",
      "registerart": "HRB",
      "company_name": "SchildDirect GmbH",
      "company_seat": "Balingen",
      "details": "17.12.2024 (Bekanntmachungsdatum)\n\nBaden-Württemberg Amtsgericht Stuttgart HRB 739753\nRegisterbekanntmachung nach dem Umwandlungsgesetz\n\nSchildDirect GmbH\nGesellschaft mit beschränkter Haftung\nBalingen\n\nDie Gesellschaft hat am 10.12.2024 den Entwurf des Spaltungsvertrages zwischen \"SkyTech AB\", Norrtälje (Amtsgericht Bolagsverket 5565588653)\nund der hiesigen Gesellschaft (übertragender Rechtsträger) zum Handelsregister eingereicht.\nAn der grenzüberschreitenden Abspaltung sind beteiligt die SchildDirect GmbH ,Sitz Balingen, eine GmbH nach deutschem Recht (eingetragen beim AG Stuttgart HRB 739753) als übertragende Gesellschaft und die SkyTech AB, Sitz Norrtälje, eine AB nach schwedischem Recht (eingetragen im Handelsregister des schwedischen Bolagverket unter 556558-8653) als übernehmende Gesellschaft (Abspaltung zur Aufnahme).\nEin Hinweis an folgende Personen, dass sie der Gesellschaft spätestens fünf Arbeitstagevor dem 13. 01 .2025 Bemerkungen zum Spaltungsplan übermitteln können: an die Gläubiger der SchildDirect GmbH und der SkyTech AB sowie an die Arbeitnehmer der SchildDirect GmbH und der SkyTech AB sowie an die Anteilsinhaber der SkyTech AB.\n\nBei beiden Gesellschaften besteht kein Betriebsrat."
    },
    {
      "date": "2024-12-17",
      "id": "96668",
      "original_text": "Einreichung neuer Dokumente\nBaden-Württemberg Amtsgericht Mannheim HRB 714293\nLONG-TERM INVESTING Research AG - Institut für die langfristige Kapitalanlage – Karlsruhe",
      "type": "Einreichung neuer Dokumente",
      "state": "Baden-Württemberg",
      "amtsgericht": "Amtsgericht Mannheim",
      "registernummer": "HRB 714293",
      "registerart": "HRB",
      "company_name": "LONG-TERM INVESTING Research AG - Institut für die langfristige Kapitalanlage",
      "company_seat": "Karlsruhe",
      "details": "17.12.2024 (Bekanntmachungsdatum)\n\nBaden-Württemberg Amtsgericht Mannheim HRB 714293\nEinreichung neuer Dokumente 17.12.2024 (Eintragungsdatum)\n\nLONG-TERM INVESTING Research AG - Institut für die langfristige Kapitalanlage\nAktiengesellschaft\nKarlsruhe\n\nDie Gesellschaft hat am 16.12.2024 die Liste über die Zusammensetzung des Aufsichtsrats zum Handelsregister eingereicht."
    },
    {
      "date": "2024-12-17",
      "id": "96669",
      "original_text": "Einreichung neuer Dokumente\nHamburg Amtsgericht Hamburg HRB 188910\nAlsterhöhe 17. V V AG – Hamburg",
      "type": "Einreichung neuer Dokumente",
      "state": "Hamburg",
      "amtsgericht": "Amtsgericht Hamburg",
      "registernummer": "HRB 188910",
      "registerart": "HRB",
      "company_name": "Alsterhöhe 17. V V AG",
      "company_seat": "Hamburg",
      "details": "17.12.2024 (Bekanntmachungsdatum)\n\nHamburg Amtsgericht Hamburg HRB 188910\nEinreichung neuer Dokumente 17.12.2024 (Eintragungsdatum)\n\nAlsterhöhe 17. V V AG\nAktiengesellschaft\nHamburg\n\nAls nicht eingetragen wird bekannt gemacht: Liste des Aufsichtsrats wurde eingereicht."
    },
    {
      "date": "2024-12-17",
      "id": "96670",
      "original_text": "Löschungsankündigung\nNordrhein-Westfalen Amtsgericht Coesfeld HRB 15264\nGMMR Verwaltung UG (haftungsbeschränkt) – Gronau",
      "type": "Löschungsankündigung",
      "state": "Nordrhein-Westfalen",
      "amtsgericht": "Amtsgericht Coesfeld",
      "registernummer": "HRB 15264",
      "registerart": "HRB",
      "company_name": "GMMR Verwaltung UG (haftungsbeschränkt)",
      "company_seat": "Gronau",
      "details": "17.12.2024 (Bekanntmachungsdatum)\n\nNordrhein-Westfalen Amtsgericht Coesfeld HRB 15264\nLöschungsankündigung\n\nGMMR Verwaltung UG (haftungsbeschränkt)\nGesellschaft mit beschränkter Haftung\nGronau\n\nDas Registergericht beabsichtigt, den Rechtsträger wegen Vermögenslosigkeit gemäß § 394 FamFG von Amts wegen zu löschen.\n\nGegen diese Verfügung kann Widerspruch eingelegt werden. Die Frist zur Erhebung eines Widerspruchs gegen die beabsichtigte Löschung ist auf zwei Monate ab Veröffentlichung festgesetzt."
    },
    {
      "date": "2024-12-17",
      "id": "96671",
      "original_text": "Registerbekanntmachung nach dem Umwandlungsgesetz\nBaden-Württemberg Amtsgericht Freiburg HRB 717036\nZahnmedizinisches Versorgungszentrum am Heilsberg GmbH – Gottmadingen",
      "type": "Registerbekanntmachung nach dem Umwandlungsgesetz",
      "state": "Baden-Württemberg",
      "amtsgericht": "Amtsgericht Freiburg",
      "registernummer": "HRB 717036",
      "registerart": "HRB",
      "company_name": "Zahnmedizinisches Versorgungszentrum am Heilsberg GmbH",
      "company_seat": "Gottmadingen",
      "details": "17.12.2024 (Bekanntmachungsdatum)\n\nBaden-Württemberg Amtsgericht Freiburg HRB 717036\nRegisterbekanntmachung nach dem Umwandlungsgesetz 17.12.2024 (Eintragungsdatum)\n\nZahnmedizinisches Versorgungszentrum am Heilsberg GmbH\nGesellschaft mit beschränkter Haftung\nGottmadingen\n\nAls nicht eingetragen wird bekanntgemacht:\nDen Gläubigern der an der Verschmelzung beteiligten Rechtsträger (Zahnmedizinisches Versorgungszentrum am Heilsberg GmbH mit Sitz in Gottmadingen und Zahnmedizinisches Versorgungszentrum am Heilsberg Verwaltungsgesellschaft mbH mit Sitz in Gottmadingen), ist, wenn sie binnen sechs Monaten nach dem Tag, an dem die Eintragung der Verschmelzung in das Register des Sitzes desjenigen Rechtsträgers, dessen Gläubiger sie sind, nach § 19 Abs. 3 UmwG als bekanntgemacht gilt, ihren Anspruch nach Grund und Höhe schriftlich anmelden, Sicherheit zu leisten, soweit sie nicht Befriedigung verlangen können. Dieses Recht steht den Gläubigern jedoch nur zu, wenn sie glaubhaft machen, dass durch die Verschmelzung die Erfüllung ihrer Forderung gefährdet wird."
    },
    {
      "date": "2024-12-17",
      "id": "96672",
      "original_text": "Registerbekanntmachung nach dem Umwandlungsgesetz\nSchleswig-Holstein Amtsgericht Kiel HRB 21402\nHÖHRMANN Akademie GmbH – Schacht-Audorf",
      "type": "Registerbekanntmachung nach dem Umwandlungsgesetz",
      "state": "Schleswig-Holstein",
      "amtsgericht": "Amtsgericht Kiel",
      "registernummer": "HRB 21402",
      "registerart": "HRB",
      "company_name": "HÖHRMANN Akademie GmbH",
      "company_seat": "Schacht-Audorf",
      "details": "17.12.2024 (Bekanntmachungsdatum)\n\nSchleswig-Holstein Amtsgericht Kiel HRB 21402\nRegisterbekanntmachung nach dem Umwandlungsgesetz 13.12.2024 (Eintragungsdatum)\n\nHÖHRMANN Akademie GmbH\nGesellschaft mit beschränkter Haftung\nSchacht-Audorf\n\nZu Eintragungsnummer 3 vom 13.12.2024 wird als nicht eingetragen veröffentlicht: Als nicht eingetragen wird veröffentlicht: Den Gläubigern der an der Verschmelzung beteiligten Rechtsträger ist, wenn sie binnen sechs Monaten nach dem Tag, an dem die Eintragung der Verschmelzung in das Register des Sitzes desjenigen Rechtsträgers, dessen Gläubiger sie sind, nach § 19 Abs. 3 UmwG bekannt gemacht worden ist, ihren Anspruch nach Grund und Höhe schriftlich anmelden, Sicherheit zu leisten, soweit sie nicht Befriedigung verlangen können. Dieses Recht steht den Gläubigern jedoch nur zu, wenn sie glaubhaft machen, dass durch die Verschmelzung die Erfüllung ihrer Forderung gefährdet wird."
    },
    {
      "date": "2024-12-17",
      "id": "96673",
      "original_text": "Löschungsankündigung\nBrandenburg Amtsgericht Potsdam HRB 16098\nP & B GmbH Projektplanung und Baumanagement – Teltow",
      "type": "Löschungsankündigung",
      "state": "Brandenburg",
      "amtsgericht": "Amtsgericht Potsdam",
      "registernummer": "HRB 16098",
      "registerart": "HRB",
      "company_name": "P & B GmbH Projektplanung und Baumanagement",
      "company_seat": "Teltow",
      "details": "17.12.2024 (Bekanntmachungsdatum)\n\nBrandenburg Amtsgericht Potsdam HRB 16098\nLöschungsankündigung\n\nP & B GmbH Projektplanung und Baumanagement\nGesellschaft mit beschränkter Haftung\nTeltow\n\nBei der nachstehenden Gesellschaft wird das Amtslöschungsverfahren gemäß § 394 FamFG eingeleitet. Widerspruchsfrist: 8 Wochen"
    },
    {
      "date": "2024-12-17",
      "id": "96674",
      "original_text": "Registerbekanntmachung nach dem Umwandlungsgesetz\nSchleswig-Holstein Amtsgericht Kiel HRB 1701 RD\nMS \"NORTHERN VIRTUE\" Schiffahrtsgesellschaft mbH – Rendsburg",
      "type": "Registerbekanntmachung nach dem Umwandlungsgesetz",
      "state": "Schleswig-Holstein",
      "amtsgericht": "Amtsgericht Kiel",
      "registernummer": "HRB 1701 RD",
      "registerart": "HRB",
      "company_name": "MS \"NORTHERN VIRTUE\" Schiffahrtsgesellschaft mbH",
      "company_seat": "Rendsburg",
      "details": "17.12.2024 (Bekanntmachungsdatum)\n\nSchleswig-Holstein Amtsgericht Kiel HRB 1701 RD\nRegisterbekanntmachung nach dem Umwandlungsgesetz 13.12.2024 (Eintragungsdatum)\n\nMS \"NORTHERN VIRTUE\" Schiffahrtsgesellschaft mbH\nGesellschaft mit beschränkter Haftung\nRendsburg\n\nZu Eintragungsnummer 13 vom 13.12.2024 wird als nicht eingetragen veröffentlicht: Den Gläubigern der an der Verschmelzung beteiligten Rechtsträger ist, wenn sie binnen sechs Monaten nach dem Tag, an dem die Eintragung der Verschmelzung in das Register des Sitzes desjenigen Rechtsträgers, dessen Gläubiger sie sind, nach § 19 Abs. 3 UmwG bekannt gemacht worden ist, ihren Anspruch nach Grund und Höhe schriftlich anmelden, Sicherheit zu leisten, soweit sie nicht Befriedigung verlangen können. Dieses Recht steht den Gläubigern jedoch nur zu, wenn sie glaubhaft machen, dass durch die Verschmelzung die Erfüllung ihrer Forderung gefährdet wird."
    },
    {
      "date": "2024-12-17",
      "id": "96675",
      "original_text": "Registerbekanntmachung nach dem Umwandlungsgesetz\nSchleswig-Holstein Amtsgericht Kiel HRB 1721 RD\nMS \"NORTHERN VALOUR\" Schiffahrtsgesellschaft mbH – Rendsburg",
      "type": "Registerbekanntmachung nach dem Umwandlungsgesetz",
      "state": "Schleswig-Holstein",
      "amtsgericht": "Amtsgericht Kiel",
      "registernummer": "HRB 1721 RD",
      "registerart": "HRB",
      "company_name": "MS \"NORTHERN VALOUR\" Schiffahrtsgesellschaft mbH",
      "company_seat": "Rendsburg",
      "details": "17.12.2024 (Bekanntmachungsdatum)\n\nSchleswig-Holstein Amtsgericht Kiel HRB 1721 RD\nRegisterbekanntmachung nach dem Umwandlungsgesetz 13.12.2024 (Eintragungsdatum)\n\nMS \"NORTHERN VALOUR\" Schiffahrtsgesellschaft mbH\nGesellschaft mit beschränkter Haftung\nRendsburg\n\nZu Eintragungsnummer 13 vom 13.12.2024 wird als nicht eingetragen veröffentlicht: Den Gläubigern der an der Verschmelzung beteiligten Rechtsträger ist, wenn sie binnen sechs Monaten nach dem Tag, an dem die Eintragung der Verschmelzung in das Register des Sitzes desjenigen Rechtsträgers, dessen Gläubiger sie sind, nach § 19 Abs. 3 UmwG bekannt gemacht worden ist, ihren Anspruch nach Grund und Höhe schriftlich anmelden, Sicherheit zu leisten, soweit sie nicht Befriedigung verlangen können. Dieses Recht steht den Gläubigern jedoch nur zu, wenn sie glaubhaft machen, dass durch die Verschmelzung die Erfüllung ihrer Forderung gefährdet wird."
    },
    {
      "date": "2024-12-17",
      "id": "96676",
      "original_text": "Sonstige Registerbekanntmachung\nSchleswig-Holstein Amtsgericht Kiel VR 806 RD\nFörderverein zur Integration Benachteiligter in die berufliche Bildung e.V. – Rendsburg",
      "type": "Sonstige Registerbekanntmachung",
      "state": "Schleswig-Holstein",
      "amtsgericht": "Amtsgericht Kiel",
      "registernummer": "VR 806 RD",
      "registerart": "VR",
      "company_name": "Förderverein zur Integration Benachteiligter in die berufliche Bildung e.V.",
      "company_seat": "Rendsburg",
      "details": "17.12.2024 (Bekanntmachungsdatum)\n\nSchleswig-Holstein Amtsgericht Kiel VR 806 RD\nSonstige Registerbekanntmachung\n\nFörderverein zur Integration Benachteiligter in die berufliche Bildung e.V.\neingetragener Verein\nRendsburg\n\nAls nicht eingetragen wird veröffentlicht:\n\nBeschluss\nIn der Registersache\nFörderverein zur Integration Benachteiligter in die berufliche Bildung e.V. mit Sitz in Rendsburg\n\nwird dem Verein die Rechtsfähigkeit gem. § 73 BGB entzogen.\n\nDas Gericht hat Anhaltspunkte, dass zumindest 2 von 3 eingetragenen Vorstandsmitglieder (Herr Tönsfeldt und Herr Manzke) verstorben sind, ein Vereinsgeschehen nicht mehr stattfindet und der Verein keine aktiven Mitglieder mehr hat. Es wird insofern auch auf die Ausführungen der Verwaltungsleitung BBZ am Nord-Ostsee-Kanal vom 04.12.2024 verwiesen werden. Nach alledem kann dem Verein auf Antrag des Vorstands und sollte ein entsprechender Antrag nicht gestellt werden, von Amts wegen die Rechtsfähigkeit entzogen werden, wenn die Mitgliederzahl unter drei herabsinkt.\n\nGegen diesen Beschluss kann binnen eines Monats die Beschwerde durch Einreichung einer\nBeschwerdeschrift oder zur Niederschrift der Geschäftsstelle bei dem Gericht, dessen Beschluss\nangefochten wird, eingelegt werden (§§ 58, 63, 64 FamFG).\n\nKiel, 13.12.2024\nAmtsgericht Kiel"
    },
    {
      "date": "2024-12-17",
      "id": "96677",
      "original_text": "Registerbekanntmachung nach dem Umwandlungsgesetz\nBaden-Württemberg Amtsgericht Stuttgart HRB 581030\nSiQS GmbH – Bretzfeld",
      "type": "Registerbekanntmachung nach dem Umwandlungsgesetz",
      "state": "Baden-Württemberg",
      "amtsgericht": "Amtsgericht Stuttgart",
      "registernummer": "HRB 581030",
      "registerart": "HRB",
      "company_name": "SiQS GmbH",
      "company_seat": "Bretzfeld",
      "details": "17.12.2024 (Bekanntmachungsdatum)\n\nBaden-Württemberg Amtsgericht Stuttgart HRB 581030\nRegisterbekanntmachung nach dem Umwandlungsgesetz 17.12.2024 (Eintragungsdatum)\n\nSiQS GmbH\nGesellschaft mit beschränkter Haftung\nBretzfeld\n\nDen Gläubigern der an der Ausgliederung beteiligten Rechtsträger ist, wenn sie binnen sechs Monaten nach dem Tag, an dem die Eintragung der Ausgliederung in das Register des Sitzes desjenigen Rechtsträgers, dessen Gläubiger sie sind, nach § 19 Abs. 3 UmwG als bekanntgemacht gilt, ihren Anspruch nach Grund und Höhe schriftlich anmelden, Sicherheit zu leisten, soweit sie nicht Befriedigung verlangen können. Dieses Recht steht den Gläubigern jedoch nur zu, wenn sie glaubhaft machen, dass durch die Ausgliederung die Erfüllung ihrer Forderung gefährdet wird."
    },
    {
      "date": "2024-12-17",
      "id": "96678",
      "original_text": "Registerbekanntmachung nach dem Umwandlungsgesetz\nBaden-Württemberg Amtsgericht Stuttgart HRA 741168\nHandelsvertretung Joachim Bäuerle e. K. – Bretzfeld",
      "type": "Registerbekanntmachung nach dem Umwandlungsgesetz",
      "state": "Baden-Württemberg",
      "amtsgericht": "Amtsgericht Stuttgart",
      "registernummer": "HRA 741168",
      "registerart": "HRA",
      "company_name": "Handelsvertretung Joachim Bäuerle e. K.",
      "company_seat": "Bretzfeld",
      "details": "17.12.2024 (Bekanntmachungsdatum)\n\nBaden-Württemberg Amtsgericht Stuttgart HRA 741168\nRegisterbekanntmachung nach dem Umwandlungsgesetz 17.12.2024 (Eintragungsdatum)\n\nHandelsvertretung Joachim Bäuerle e. K.\nEinzelkaufmann / Einzelkauffrau\nBretzfeld\n\nDen Gläubigern der an der Ausgliederung beteiligten Rechtsträger ist, wenn sie binnen sechs Monaten nach dem Tag, an dem die Eintragung der Ausgliederung in das Register des Sitzes desjenigen Rechtsträgers, dessen Gläubiger sie sind, nach § 19 Abs. 3 UmwG als bekanntgemacht gilt, ihren Anspruch nach Grund und Höhe schriftlich anmelden, Sicherheit zu leisten, soweit sie nicht Befriedigung verlangen können. Dieses Recht steht den Gläubigern jedoch nur zu, wenn sie glaubhaft machen, dass durch die Ausgliederung die Erfüllung ihrer Forderung gefährdet wird."
    },
    {
      "date": "2024-12-17",
      "id": "96679",
      "original_text": "Einreichung neuer Dokumente\nBaden-Württemberg Amtsgericht Stuttgart HRB 204401\nDetzer Verwaltungs-Gesellschaft mit beschränkter Haftung – Ludwigsburg",
      "type": "Einreichung neuer Dokumente",
      "state": "Baden-Württemberg",
      "amtsgericht": "Amtsgericht Stuttgart",
      "registernummer": "HRB 204401",
      "registerart": "HRB",
      "company_name": "Detzer Verwaltungs-Gesellschaft mit beschränkter Haftung",
      "company_seat": "Ludwigsburg",
      "details": "17.12.2024 (Bekanntmachungsdatum)\n\nBaden-Württemberg Amtsgericht Stuttgart HRB 204401\nEinreichung neuer Dokumente 04.12.2024 (Eintragungsdatum)\n\nDetzer Verwaltungs-Gesellschaft mit beschränkter Haftung\nGesellschaft mit beschränkter Haftung\nLudwigsburg\n\nDie Gesellschaft hat am 04.12.2024 die Liste über die Zusammensetzung des Aufsichtsrats zum Handelsregister eingereicht."
    },
    {
      "date": "2024-12-17",
      "id": "96680",
      "original_text": "Registerbekanntmachung nach dem Umwandlungsgesetz\nSchleswig-Holstein Amtsgericht Kiel HRB 25392\nevidia MVZ Förde-Radiologicum GmbH – Kiel",
      "type": "Registerbekanntmachung nach dem Umwandlungsgesetz",
      "state": "Schleswig-Holstein",
      "amtsgericht": "Amtsgericht Kiel",
      "registernummer": "HRB 25392",
      "registerart": "HRB",
      "company_name": "evidia MVZ Förde-Radiologicum GmbH",
      "company_seat": "Kiel",
      "details": "17.12.2024 (Bekanntmachungsdatum)\n\nSchleswig-Holstein Amtsgericht Kiel HRB 25392\nRegisterbekanntmachung nach dem Umwandlungsgesetz 10.12.2024 (Eintragungsdatum)\n\nevidia MVZ Förde-Radiologicum GmbH\nGesellschaft mit beschränkter Haftung\nKiel\n\nZu Eintragungsnummer 5 vom 10.12.2024 wird als nicht eingetragen veröffentlicht: Den Gläubigern der Gesellschaft, deren Forderungen begründet worden sind, bevor die Eintragung der Beendigung des Vertrages in das Handelsregister nach § 10 HGB bekannt gemacht worden ist, ist vom anderen Vertragspartner Sicherheit zu leisten, wenn sie sich binnen sechs Monaten nach Bekanntmachung der Eintragung zu diesem Zweck bei ihm melden."
    },
    {
      "date": "2024-12-17",
      "id": "96681",
      "original_text": "Registerbekanntmachung nach dem Umwandlungsgesetz\nSchleswig-Holstein Amtsgericht Kiel HRB 2092 RD\nRGR-Reedereigesellschaft Rendsburg mbH – Rendsburg",
      "type": "Registerbekanntmachung nach dem Umwandlungsgesetz",
      "state": "Schleswig-Holstein",
      "amtsgericht": "Amtsgericht Kiel",
      "registernummer": "HRB 2092 RD",
      "registerart": "HRB",
      "company_name": "RGR-Reedereigesellschaft Rendsburg mbH",
      "company_seat": "Rendsburg",
      "details": "17.12.2024 (Bekanntmachungsdatum)\n\nSchleswig-Holstein Amtsgericht Kiel HRB 2092 RD\nRegisterbekanntmachung nach dem Umwandlungsgesetz 10.12.2024 (Eintragungsdatum)\n\nRGR-Reedereigesellschaft Rendsburg mbH\nGesellschaft mit beschränkter Haftung\nRendsburg\n\nZu Eintragungsnummer 13 vom 10.12.2024 wird als nicht eingetragen veröffentlicht: Als nicht eingetragen wird veröffentlicht: Den Gläubigern der an der Verschmelzung beteiligten Rechtsträger ist, wenn sie binnen sechs Monaten nach dem Tag, an dem die Eintragung der Verschmelzung in das Register des Sitzes desjenigen Rechtsträgers, dessen Gläubiger sie sind, nach § 19 Abs. 3 UmwG bekannt gemacht worden ist, ihren Anspruch nach Grund und Höhe schriftlich anmelden, Sicherheit zu leisten, soweit sie nicht Befriedigung verlangen können. Dieses Recht steht den Gläubigern jedoch nur zu, wenn sie glaubhaft machen, dass durch die Verschmelzung die Erfüllung ihrer Forderung gefährdet wird."
    },
    {
      "date": "2024-12-17",
      "id": "96682",
      "original_text": "Einreichung neuer Dokumente\nBaden-Württemberg Amtsgericht Stuttgart HRB 726116\nPNZ GmbH – Stuttgart",
      "type": "Einreichung neuer Dokumente",
      "state": "Baden-Württemberg",
      "amtsgericht": "Amtsgericht Stuttgart",
      "registernummer": "HRB 726116",
      "registerart": "HRB",
      "company_name": "PNZ GmbH",
      "company_seat": "Stuttgart",
      "details": "17.12.2024 (Bekanntmachungsdatum)\n\nBaden-Württemberg Amtsgericht Stuttgart HRB 726116\nEinreichung neuer Dokumente\n\nPNZ GmbH\nGesellschaft mit beschränkter Haftung\nStuttgart\n\nDie Gesellschaft hat am 16.12.2024 die Liste über die Zusammensetzung des Aufsichtsrats zum Handelsregister eingereicht."
    },
    {
      "date": "2024-12-17",
      "id": "96683",
      "original_text": "Registerbekanntmachung nach dem Umwandlungsgesetz\nBerlin Amtsgericht Berlin (Charlottenburg) HRB 177922\nGEBBAU GmbH – Berlin",
      "type": "Registerbekanntmachung nach dem Umwandlungsgesetz",
      "state": "Berlin",
      "amtsgericht": "Amtsgericht Berlin (Charlottenburg)",
      "registernummer": "HRB 177922",
      "registerart": "HRB",
      "company_name": "GEBBAU GmbH",
      "company_seat": "Berlin",
      "details": "17.12.2024 (Bekanntmachungsdatum)\n\nBerlin Amtsgericht Berlin (Charlottenburg) HRB 177922\nRegisterbekanntmachung nach dem Umwandlungsgesetz 16.12.2024 (Eintragungsdatum)\n\nGEBBAU GmbH\nGesellschaft mit beschränkter Haftung\nBerlin\n\nZu Eintragungsnummer 5 vom 16.12.2024 wird als nicht eingetragen veröffentlicht: Den Gläubigern der an der Verschmelzung beteiligten Rechtsträger ist, wenn sie binnen sechs Monaten nach dem Tag, an dem die Eintragung der Verschmelzung in das Register des Sitzes desjenigen Rechtsträgers, dessen Gläubiger sie sind, als bekannt gemacht gilt, ihren Anspruch nach Grund und Höhe schriftlich anmelden, Sicherheit zu leisten, soweit sie nicht Befriedigung verlangen können. Dieses Recht steht den Gläubigern jedoch nur zu, wenn sie glaubhaft machen, dass durch die Verschmelzung die Erfüllung ihrer Forderung gefährdet wird. Das Recht, Sicherheitsleistung zu verlangen, steht Gläubigern nicht zu, die im Falle der Insolvenz ein Recht auf vorzugsweise Befriedigung aus einer Deckungsmasse haben, die nach gesetzlicher Vorschrift zu ihrem Schutz errichtet und staatlich überwacht ist."
    },
    {
      "date": "2024-12-17",
      "id": "96684",
      "original_text": "Registerbekanntmachung nach dem Umwandlungsgesetz\nHamburg Amtsgericht Hamburg HRB 171534\nAdaptavist GmbH – Hamburg",
      "type": "Registerbekanntmachung nach dem Umwandlungsgesetz",
      "state": "Hamburg",
      "amtsgericht": "Amtsgericht Hamburg",
      "registernummer": "HRB 171534",
      "registerart": "HRB",
      "company_name": "Adaptavist GmbH",
      "company_seat": "Hamburg",
      "details": "17.12.2024 (Bekanntmachungsdatum)\n\nHamburg Amtsgericht Hamburg HRB 171534\nRegisterbekanntmachung nach dem Umwandlungsgesetz 17.12.2024 (Eintragungsdatum)\n\nAdaptavist GmbH\nGesellschaft mit beschränkter Haftung\nHamburg\n\nAls nicht eingetragen wird bekannt gemacht:\nDen Gläubigern der an der Verschmelzung beteiligten Gesellschaften ist, wenn sie binnen sechs Monaten nach dem Tag, an dem die Eintragung der Verschmelzung in das Register des Sitzes desjenigen Rechtsträgers, dessen Gläubiger sie sind, nach § 19 Absatz 3 UmwG als bekannt gemacht gilt, ihren Anspruch nach Grund und Höhe schriftlich anmelden, Sicherheit zu leisten, soweit sie nicht Befriedigung verlangen können. Dieses Recht steht den Gläubigern jedoch nur zu, wenn sie glaubhaft machen, dass durch die Verschmelzung die Erfüllung ihrer Forderung gefährdet wird."
    },
    {
      "date": "2024-12-17",
      "id": "96685",
      "original_text": "Registerbekanntmachung nach dem Umwandlungsgesetz\nBerlin Amtsgericht Berlin (Charlottenburg) HRA 63275\nGebbau Lööd Ltd. & Co.KG – Berlin",
      "type": "Registerbekanntmachung nach dem Umwandlungsgesetz",
      "state": "Berlin",
      "amtsgericht": "Amtsgericht Berlin (Charlottenburg)",
      "registernummer": "HRA 63275",
      "registerart": "HRA",
      "company_name": "Gebbau Lööd Ltd. & Co.KG",
      "company_seat": "Berlin",
      "details": "17.12.2024 (Bekanntmachungsdatum)\n\nBerlin Amtsgericht Berlin (Charlottenburg) HRA 63275\nRegisterbekanntmachung nach dem Umwandlungsgesetz 16.12.2024 (Eintragungsdatum)\n\nGebbau Lööd Ltd. & Co.KG\nKommanditgesellschaft\nBerlin\n\nZu Eintragungsnummer 2 vom 16.12.2024 wird als nicht eingetragen veröffentlicht: Den Gläubigern der an der Verschmelzung beteiligten Rechtsträger ist, wenn sie binnen sechs Monaten nach dem Tag, an dem die Eintragung der Verschmelzung in das Register des Sitzes desjenigen Rechtsträgers, dessen Gläubiger sie sind, als bekannt gemacht gilt, ihren Anspruch nach Grund und Höhe schriftlich anmelden, Sicherheit zu leisten, soweit sie nicht Befriedigung verlangen können. Dieses Recht steht den Gläubigern jedoch nur zu, wenn sie glaubhaft machen, dass durch die Verschmelzung die Erfüllung ihrer Forderung gefährdet wird. Das Recht, Sicherheitsleistung zu verlangen, steht Gläubigern nicht zu, die im Falle der Insolvenz ein Recht auf vorzugsweise Befriedigung aus einer Deckungsmasse haben, die nach gesetzlicher Vorschrift zu ihrem Schutz errichtet und staatlich überwacht ist."
    },
    {
      "date": "2024-12-17",
      "id": "96686",
      "original_text": "Registerbekanntmachung nach dem Umwandlungsgesetz\nSchleswig-Holstein Amtsgericht Pinneberg HRA 5457\nBoyens Concept GmbH & Co. KG – Heide",
      "type": "Registerbekanntmachung nach dem Umwandlungsgesetz",
      "state": "Schleswig-Holstein",
      "amtsgericht": "Amtsgericht Pinneberg",
      "registernummer": "HRA 5457",
      "registerart": "HRA",
      "company_name": "Boyens Concept GmbH & Co. KG",
      "company_seat": "Heide",
      "details": "17.12.2024 (Bekanntmachungsdatum)\n\nSchleswig-Holstein Amtsgericht Pinneberg HRA 5457\nRegisterbekanntmachung nach dem Umwandlungsgesetz 12.12.2024 (Eintragungsdatum)\n\nBoyens Concept GmbH & Co. KG\nKommanditgesellschaft\nHeide\n\nAls nicht eingetragen wird veröffentlicht: Den Gläubigern der an der Verschmelzung beteiligten Rechtsträger ist, wenn sie binnen sechs Monaten nach dem Tag, an dem die Eintragung der Verschmelzung in das Register des Sitzes desjenigen Rechtsträgers, dessen Gläubiger sie sind, als bekannt gemacht gilt, ihren Anspruch nach Grund und Höhe schriftlich anmelden, Sicherheit zu leisten, soweit sie nicht Befriedigung verlangen können. Dieses Recht steht den Gläubigern jedoch nur zu, wenn sie glaubhaft machen, dass durch die Verschmelzung die Erfüllung ihrer Forderung gefährdet wird. Das Recht, Sicherheitsleistung zu verlangen, steht Gläubigern nicht zu, die im Falle der Insolvenz ein Recht auf vorzugsweise Befriedigung aus einer Deckungsmasse haben, die nach gesetzlicher Vorschrift zu ihrem Schutz errichtet und staatlich überwacht ist."
    },
    {
      "date": "2024-12-17",
      "id": "96687",
      "original_text": "Registerbekanntmachung nach dem Umwandlungsgesetz\nSchleswig-Holstein Amtsgericht Kiel HRB 21402\nHÖHRMANN Akademie GmbH – Schacht-Audorf",
      "type": "Registerbekanntmachung nach dem Umwandlungsgesetz",
      "state": "Schleswig-Holstein",
      "amtsgericht": "Amtsgericht Kiel",
      "registernummer": "HRB 21402",
      "registerart": "HRB",
      "company_name": "HÖHRMANN Akademie GmbH",
      "company_seat": "Schacht-Audorf",
      "details": "17.12.2024 (Bekanntmachungsdatum)\n\nSchleswig-Holstein Amtsgericht Kiel HRB 21402\nRegisterbekanntmachung nach dem Umwandlungsgesetz 08.01.2024 (Eintragungsdatum)\n\nHÖHRMANN Akademie GmbH\nGesellschaft mit beschränkter Haftung\nSchacht-Audorf\n\nZu Eintragungsnummer 2 vom 08.01.2024 wird als nicht eingetragen veröffentlicht: Als nicht eingetragen wird veröffentlicht: Den Gläubigern der an der Verschmelzung beteiligten Rechtsträger ist, wenn sie binnen sechs Monaten nach dem Tag, an dem die Eintragung der Verschmelzung in das Register des Sitzes desjenigen Rechtsträgers, dessen Gläubiger sie sind, nach § 19 Abs. 3 UmwG bekannt gemacht worden ist, ihren Anspruch nach Grund und Höhe schriftlich anmelden, Sicherheit zu leisten, soweit sie nicht Befriedigung verlangen können. Dieses Recht steht den Gläubigern jedoch nur zu, wenn sie glaubhaft machen, dass durch die Verschmelzung die Erfüllung ihrer Forderung gefährdet wird."
    },
    {
      "date": "2024-12-17",
      "id": "96688",
      "original_text": "Löschungsankündigung\nSachsen Amtsgericht Leipzig HRB 41374\nVoltaik GmbH – Leipzig",
      "type": "Löschungsankündigung",
      "state": "Sachsen",
      "amtsgericht": "Amtsgericht Leipzig",
      "registernummer": "HRB 41374",
      "registerart": "HRB",
      "company_name": "Voltaik GmbH",
      "company_seat": "Leipzig",
      "details": "17.12.2024 (Bekanntmachungsdatum)\n\nSachsen Amtsgericht Leipzig HRB 41374\nLöschungsankündigung\n\nVoltaik GmbH\nGesellschaft mit beschränkter Haftung\nLeipzig\n\nDas Registergericht beabsichtigt, die im Handelsregister eingetragene Gesellschaft von Amts wegen nach § 394 FamFG zu löschen. Die Frist zu Erhebung eines Widerspruchs gegen die beabsichtigte Löschung wird auf einen Monat festgesetzt."
    },
    {
      "date": "2024-12-17",
      "id": "96689",
      "original_text": "Registerbekanntmachung nach dem Umwandlungsgesetz\nSachsen Amtsgericht Chemnitz HRA 10030\nThilo Utz Besitzunternehmen e.K. – Limbach-Oberfrohna",
      "type": "Registerbekanntmachung nach dem Umwandlungsgesetz",
      "state": "Sachsen",
      "amtsgericht": "Amtsgericht Chemnitz",
      "registernummer": "HRA 10030",
      "registerart": "HRA",
      "company_name": "Thilo Utz Besitzunternehmen e.K.",
      "company_seat": "Limbach-Oberfrohna",
      "details": "17.12.2024 (Bekanntmachungsdatum)\n\nSachsen Amtsgericht Chemnitz HRA 10030\nRegisterbekanntmachung nach dem Umwandlungsgesetz 17.12.2024 (Eintragungsdatum)\n\nThilo Utz Besitzunternehmen e.K.\nEinzelkaufmann / Einzelkauffrau\nLimbach-Oberfrohna\n\nDen Gläubigern der an der Ausgliederung beteiligten Rechtsträger ist, wenn sie binnen sechs Monaten nach dem Tag, an dem die Eintragung der Ausgliederung in das Register des Sitzes desjenigen Rechtsträgers, dessen Gläubiger sie sind, nach § 19 Abs. 3 UmwG als bekannt gemacht gilt, ihren Anspruch nach Grund und Höhe schriftlich anmelden, Sicherheit zu leisten, soweit sie nicht Befriedigung verlangen können. Dieses Recht steht den Gläubigern jedoch nur zu, wenn sie glaubhaft machen, dass durch die Ausgliederung die Erfüllung der Forderung gefährdet wird."
    },
    {
      "date": "2024-12-17",
      "id": "96690",
      "original_text": "Registerbekanntmachung nach dem Umwandlungsgesetz\nSachsen Amtsgericht Chemnitz HRA 10032\nUtz Immobilien GmbH & Co. KG – Limbach-Oberfrohna",
      "type": "Registerbekanntmachung nach dem Umwandlungsgesetz",
      "state": "Sachsen",
      "amtsgericht": "Amtsgericht Chemnitz",
      "registernummer": "HRA 10032",
      "registerart": "HRA",
      "company_name": "Utz Immobilien GmbH & Co. KG",
      "company_seat": "Limbach-Oberfrohna",
      "details": "17.12.2024 (Bekanntmachungsdatum)\n\nSachsen Amtsgericht Chemnitz HRA 10032\nRegisterbekanntmachung nach dem Umwandlungsgesetz 17.12.2024 (Eintragungsdatum)\n\nUtz Immobilien GmbH & Co. KG\nKommanditgesellschaft\nLimbach-Oberfrohna\n\nDen Gläubigern der an der Ausgliederung beteiligten Rechtsträger ist, wenn sie binnen sechs Monaten nach dem Tag, an dem die Eintragung der Ausgliederung in das Register des Sitzes desjenigen Rechtsträgers, dessen Gläubiger sie sind, nach § 19 Abs. 3 UmwG als bekannt gemacht gilt, ihren Anspruch nach Grund und Höhe schriftlich anmelden, Sicherheit zu leisten, soweit sie nicht Befriedigung verlangen können. Dieses Recht steht den Gläubigern jedoch nur zu, wenn sie glaubhaft machen, dass durch die Ausgliederung die Erfüllung der Forderung gefährdet wird."
    },
    {
      "date": "2024-12-17",
      "id": "96691",
      "original_text": "Registerbekanntmachung nach dem Umwandlungsgesetz\nSachsen Amtsgericht Dresden HRA 12156\nDr. Caroline Hollenders e. K. – Dresden",
      "type": "Registerbekanntmachung nach dem Umwandlungsgesetz",
      "state": "Sachsen",
      "amtsgericht": "Amtsgericht Dresden",
      "registernummer": "HRA 12156",
      "registerart": "HRA",
      "company_name": "Dr. Caroline Hollenders e. K.",
      "company_seat": "Dresden",
      "details": "17.12.2024 (Bekanntmachungsdatum)\n\nSachsen Amtsgericht Dresden HRA 12156\nRegisterbekanntmachung nach dem Umwandlungsgesetz 17.12.2024 (Eintragungsdatum)\n\nDr. Caroline Hollenders e. K.\nEinzelkaufmann / Einzelkauffrau\nDresden\n\nDen Gläubigern der an der Ausgliederung beteiligten Rechtsträger ist, wenn sie binnen sechs Monaten nach dem Tag, an dem die Eintragung der Ausgliederung in das Register des Sitzes desjenigen Rechtsträgers, dessen Gläubiger sie sind, nach § 19 Abs. 3 UmwG als bekannt gemacht gilt, ihren Anspruch nach Grund und Höhe schriftlich anmelden, Sicherheit zu leisten, soweit sie nicht Befriedigung verlangen können. Dieses Recht steht den Gläubigern jedoch nur zu, wenn sie glaubhaft machen, dass durch die Ausgliederung die Erfüllung der Forderung gefährdet wird."
    },
    {
      "date": "2024-12-17",
      "id": "96692",
      "original_text": "Registerbekanntmachung nach dem Umwandlungsgesetz\nSachsen Amtsgericht Dresden HRB 25482\nAgrarprodukte Höckendorf GmbH – Klingenberg",
      "type": "Registerbekanntmachung nach dem Umwandlungsgesetz",
      "state": "Sachsen",
      "amtsgericht": "Amtsgericht Dresden",
      "registernummer": "HRB 25482",
      "registerart": "HRB",
      "company_name": "Agrarprodukte Höckendorf GmbH",
      "company_seat": "Klingenberg",
      "details": "17.12.2024 (Bekanntmachungsdatum)\n\nSachsen Amtsgericht Dresden HRB 25482\nRegisterbekanntmachung nach dem Umwandlungsgesetz 17.12.2024 (Eintragungsdatum)\n\nAgrarprodukte Höckendorf GmbH\nGesellschaft mit beschränkter Haftung\nKlingenberg\n\nDen Gläubigern der an der Verschmelzung beteiligten Rechtsträger ist, wenn sie binnen sechs Monaten nach dem Tag, an dem die Eintragung der Verschmelzung in das Register des Sitzes desjenigen Rechtsträgers, dessen Gläubiger sie sind, nach § 19 Abs. 3 UmwG als bekannt gemacht gilt, ihren Anspruch nach Grund und Höhe schriftlich anmelden, Sicherheit zu leisten, soweit sie nicht Befriedigung verlangen können. Dieses Recht steht den Gläubigern jedoch nur zu, wenn sie glaubhaft machen, dass durch die Verschmelzung die Erfüllung der Forderung gefährdet wird."
    },
    {
      "date": "2024-12-17",
      "id": "96693",
      "original_text": "Registerbekanntmachung nach dem Umwandlungsgesetz\nSachsen Amtsgericht Dresden HRB 22959\nAgrargesellschaft Ruppendorf AG – Klingenberg",
      "type": "Registerbekanntmachung nach dem Umwandlungsgesetz",
      "state": "Sachsen",
      "amtsgericht": "Amtsgericht Dresden",
      "registernummer": "HRB 22959",
      "registerart": "HRB",
      "company_name": "Agrargesellschaft Ruppendorf AG",
      "company_seat": "Klingenberg",
      "details": "17.12.2024 (Bekanntmachungsdatum)\n\nSachsen Amtsgericht Dresden HRB 22959\nRegisterbekanntmachung nach dem Umwandlungsgesetz 17.12.2024 (Eintragungsdatum)\n\nAgrargesellschaft Ruppendorf AG\nAktiengesellschaft\nKlingenberg\n\nDen Gläubigern der an der Verschmelzung beteiligten Rechtsträger ist, wenn sie binnen sechs Monaten nach dem Tag, an dem die Eintragung der Verschmelzung in das Register des Sitzes desjenigen Rechtsträgers, dessen Gläubiger sie sind, nach § 19 Abs. 3 UmwG als bekannt gemacht gilt, ihren Anspruch nach Grund und Höhe schriftlich anmelden, Sicherheit zu leisten, soweit sie nicht Befriedigung verlangen können. Dieses Recht steht den Gläubigern jedoch nur zu, wenn sie glaubhaft machen, dass durch die Verschmelzung die Erfüllung der Forderung gefährdet wird."
    },
    {
      "date": "2024-12-17",
      "id": "96694",
      "original_text": "Einreichung neuer Dokumente\nSachsen Amtsgericht Dresden HRB 17118\nWohnungsbau GmbH Bad Muskau – Bad Muskau",
      "type": "Einreichung neuer Dokumente",
      "state": "Sachsen",
      "amtsgericht": "Amtsgericht Dresden",
      "registernummer": "HRB 17118",
      "registerart": "HRB",
      "company_name": "Wohnungsbau GmbH Bad Muskau",
      "company_seat": "Bad Muskau",
      "details": "17.12.2024 (Bekanntmachungsdatum)\n\nSachsen Amtsgericht Dresden HRB 17118\nEinreichung neuer Dokumente\n\nWohnungsbau GmbH Bad Muskau\nGesellschaft mit beschränkter Haftung\nBad Muskau\n\nAm 13.12.2024 wurde beim Handelsregister des Amtsgerichts Dresden die Liste der Mitglieder des Aufsichtsrats gemäß § 52 GmbHG eingereicht."
    },
    {
      "date": "2024-12-17",
      "id": "96695",
      "original_text": "Löschungsankündigung\nSachsen Amtsgericht Dresden HRB 29369\nFärber-GmbH – Bautzen",
      "type": "Löschungsankündigung",
      "state": "Sachsen",
      "amtsgericht": "Amtsgericht Dresden",
      "registernummer": "HRB 29369",
      "registerart": "HRB",
      "company_name": "Färber-GmbH",
      "company_seat": "Bautzen",
      "details": "17.12.2024 (Bekanntmachungsdatum)\n\nSachsen Amtsgericht Dresden HRB 29369\nLöschungsankündigung\n\nFärber-GmbH\nGesellschaft mit beschränkter Haftung\nBautzen\n\nDas Registergericht beabsichtigt, die im Handelsregister eingetragene Gesellschaft von Amts wegen nach § 394 FamFG zu löschen. Die Frist zu Erhebung eines Widerspruchs gegen die beabsichtigte Löschung wird auf einen Monat festgesetzt."
    },
    {
      "date": "2024-12-17",
      "id": "96696",
      "original_text": "Löschungsankündigung\nSachsen Amtsgericht Chemnitz HRB 34437\nATiD UG (haftungsbeschränkt) – Chemnitz",
      "type": "Löschungsankündigung",
      "state": "Sachsen",
      "amtsgericht": "Amtsgericht Chemnitz",
      "registernummer": "HRB 34437",
      "registerart": "HRB",
      "company_name": "ATiD UG (haftungsbeschränkt)",
      "company_seat": "Chemnitz",
      "details": "17.12.2024 (Bekanntmachungsdatum)\n\nSachsen Amtsgericht Chemnitz HRB 34437\nLöschungsankündigung\n\nATiD UG (haftungsbeschränkt)\nGesellschaft mit beschränkter Haftung\nChemnitz\n\nDas Registergericht beabsichtigt, die im Handelsregister eingetragene Gesellschaft von Amts wegen nach § 394 FamFG zu löschen. Die Frist zu Erhebung eines Widerspruchs gegen die beabsichtigte Löschung wird auf einen Monat festgesetzt."
    },
    {
      "date": "2024-12-17",
      "id": "96697",
      "original_text": "Registerbekanntmachung nach dem Umwandlungsgesetz\nSachsen Amtsgericht Dresden HRB 46067\ncaro GmbH – Dresden",
      "type": "Registerbekanntmachung nach dem Umwandlungsgesetz",
      "state": "Sachsen",
      "amtsgericht": "Amtsgericht Dresden",
      "registernummer": "HRB 46067",
      "registerart": "HRB",
      "company_name": "caro GmbH",
      "company_seat": "Dresden",
      "details": "17.12.2024 (Bekanntmachungsdatum)\n\nSachsen Amtsgericht Dresden HRB 46067\nRegisterbekanntmachung nach dem Umwandlungsgesetz 17.12.2024 (Eintragungsdatum)\n\ncaro GmbH\nGesellschaft mit beschränkter Haftung\nDresden\n\nDen Gläubigern der an der Ausgliederung beteiligten Rechtsträger ist, wenn sie binnen sechs Monaten nach dem Tag, an dem die Eintragung der Ausgliederung in das Register des Sitzes desjenigen Rechtsträgers, dessen Gläubiger sie sind, nach § 19 Abs. 3 UmwG als bekannt gemacht gilt, ihren Anspruch nach Grund und Höhe schriftlich anmelden, Sicherheit zu leisten, soweit sie nicht Befriedigung verlangen können. Dieses Recht steht den Gläubigern jedoch nur zu, wenn sie glaubhaft machen, dass durch die Ausgliederung die Erfüllung der Forderung gefährdet wird."
    },
    {
      "date": "2024-12-17",
      "id": "96698",
      "original_text": "Registerbekanntmachung nach dem Umwandlungsgesetz\nSachsen Amtsgericht Dresden HRB 11995\nSZA Agrarprodukte GmbH Ebersbach – Klingenberg",
      "type": "Registerbekanntmachung nach dem Umwandlungsgesetz",
      "state": "Sachsen",
      "amtsgericht": "Amtsgericht Dresden",
      "registernummer": "HRB 11995",
      "registerart": "HRB",
      "company_name": "SZA Agrarprodukte GmbH Ebersbach",
      "company_seat": "Klingenberg",
      "details": "17.12.2024 (Bekanntmachungsdatum)\n\nSachsen Amtsgericht Dresden HRB 11995\nRegisterbekanntmachung nach dem Umwandlungsgesetz 17.12.2024 (Eintragungsdatum)\n\nSZA Agrarprodukte GmbH Ebersbach\nGesellschaft mit beschränkter Haftung\nKlingenberg\n\nDen Gläubigern der an der Verschmelzung beteiligten Rechtsträger ist, wenn sie binnen sechs Monaten nach dem Tag, an dem die Eintragung der Verschmelzung in das Register des Sitzes desjenigen Rechtsträgers, dessen Gläubiger sie sind, nach § 19 Abs. 3 UmwG als bekannt gemacht gilt, ihren Anspruch nach Grund und Höhe schriftlich anmelden, Sicherheit zu leisten, soweit sie nicht Befriedigung verlangen können. Dieses Recht steht den Gläubigern jedoch nur zu, wenn sie glaubhaft machen, dass durch die Verschmelzung die Erfüllung der Forderung gefährdet wird."
    },
    {
      "date": "2024-12-17",
      "id": "96699",
      "original_text": "Löschungsankündigung\nNiedersachsen Amtsgericht Braunschweig HRB 207056\nAD-Automobile UG (haftungsbeschränkt) – Braunschweig",
      "type": "Löschungsankündigung",
      "state": "Niedersachsen",
      "amtsgericht": "Amtsgericht Braunschweig",
      "registernummer": "HRB 207056",
      "registerart": "HRB",
      "company_name": "AD-Automobile UG (haftungsbeschränkt)",
      "company_seat": "Braunschweig",
      "details": "17.12.2024 (Bekanntmachungsdatum)\n\nNiedersachsen Amtsgericht Braunschweig HRB 207056\nLöschungsankündigung 17.12.2024 (Eintragungsdatum)\n\nAD-Automobile UG (haftungsbeschränkt)\nGesellschaft mit beschränkter Haftung\nBraunschweig\n\nDas Registergericht beabsichtigt, die Gesellschaft von Amts wegen nach § 394 FamFG zu löschen. Die Frist zur Erhebung eines Widerspruchs ist auf 1 Monat ab dieser Registerbekanntmachung festgesetzt."
    },
    {
      "date": "2024-12-17",
      "id": "96700",
      "original_text": "Einreichung neuer Dokumente\nNiedersachsen Amtsgericht Hildesheim HRB 110488 früher Amtsgericht Alfeld\nStiebel Verwaltungs-GmbH – Holzminden",
      "type": "Einreichung neuer Dokumente",
      "state": "Niedersachsen",
      "amtsgericht": "Amtsgericht Hildesheim",
      "registernummer": "HRB 110488",
      "registerart": "HRB",
      "company_name": "Stiebel Verwaltungs-GmbH",
      "company_seat": "Holzminden",
      "former_amtsgericht": "Alfeld",
      "details": "17.12.2024 (Bekanntmachungsdatum)\n\nNiedersachsen Amtsgericht Hildesheim HRB 110488 früher Amtsgericht Alfeld\nEinreichung neuer Dokumente\n\nStiebel Verwaltungs-GmbH\nGesellschaft mit beschränkter Haftung\nHolzminden\n\nDie Liste der Mitglieder des Aufsichtsrats wurde beim Registergericht eingereicht."
    },
    {
      "date": "2024-12-17",
      "id": "96701",
      "original_text": "Löschungsankündigung\nNiedersachsen Amtsgericht Aurich HRB 202138\nproturbine Beteiligungs GmbH – Wittmund",
      "type": "Löschungsankündigung",
      "state": "Niedersachsen",
      "amtsgericht": "Amtsgericht Aurich",
      "registernummer": "HRB 202138",
      "registerart": "HRB",
      "company_name": "proturbine Beteiligungs GmbH",
      "company_seat": "Wittmund",
      "details": "17.12.2024 (Bekanntmachungsdatum)\n\nNiedersachsen Amtsgericht Aurich HRB 202138\nLöschungsankündigung 17.12.2024 (Eintragungsdatum)\n\nproturbine Beteiligungs GmbH\nGesellschaft mit beschränkter Haftung\nWittmund\n\nDas Registergericht beabsichtigt, die Gesellschaft von Amts wegen nach § 394 FamFG zu löschen. Die Frist zur Erhebung eines Widerspruchs ist auf 1 Monat ab dieser Registerbekanntmachung festgesetzt."
    },
    {
      "date": "2024-12-17",
      "id": "96702",
      "original_text": "Registerbekanntmachung nach dem Umwandlungsgesetz\nNiedersachsen Amtsgericht Oldenburg (Oldenburg) HRB 205306\nKEHAG Holding AG – Oldenburg",
      "type": "Registerbekanntmachung nach dem Umwandlungsgesetz",
      "state": "Niedersachsen",
      "amtsgericht": "Amtsgericht Oldenburg (Oldenburg)",
      "registernummer": "HRB 205306",
      "registerart": "HRB",
      "company_name": "KEHAG Holding AG",
      "company_seat": "Oldenburg",
      "details": "17.12.2024 (Bekanntmachungsdatum)\n\nNiedersachsen Amtsgericht Oldenburg (Oldenburg) HRB 205306\nRegisterbekanntmachung nach dem Umwandlungsgesetz 17.12.2024 (Eintragungsdatum)\n\nKEHAG Holding AG\nAktiengesellschaft\nOldenburg\n\nDen Gläubigern der an der formwechselnden Umwandlung beteiligten Rechtsträger ist, wenn sie binnen sechs Monaten nach dem Tag, an dem die Eintragung der Umwandlung in das Register des Sitzes desjenigen Rechtsträgers, dessen Gläubiger sie sind, nach § 19 Abs. 3 UmwG als bekannt gemacht gilt, ihren Anspruch nach Grund und Höhe schriftlich anmelden, Sicherheit zu leisten, soweit sie nicht Befriedigung verlangen können. Dieses Recht steht den Gläubigern jedoch nur zu, wenn sie glaubhaft machen, dass durch die formwechselnde Umwandlung die Erfüllung der Forderung gefährdet wird."
    },
    {
      "date": "2024-12-17",
      "id": "96703",
      "original_text": "Sonstige Registerbekanntmachung\nNiedersachsen Amtsgericht Hannover HRB 217567\nWH Care Rethem GmbH – Garbsen",
      "type": "Sonstige Registerbekanntmachung",
      "state": "Niedersachsen",
      "amtsgericht": "Amtsgericht Hannover",
      "registernummer": "HRB 217567",
      "registerart": "HRB",
      "company_name": "WH Care Rethem GmbH",
      "company_seat": "Garbsen",
      "details": "17.12.2024 (Bekanntmachungsdatum)\n\nNiedersachsen Amtsgericht Hannover HRB 217567\nSonstige Registerbekanntmachung 17.12.2024 (Eintragungsdatum)\n\nWH Care Rethem GmbH\nGesellschaft mit beschränkter Haftung\nGarbsen\n\nDen Gläubigern der Gesellschaft, deren Forderungen begründet worden sind, bevor die Eintragung der Beendigung des Vertrages in das Handelsregister nach § 10 HGB als bekanntgemacht gilt, ist vom anderen Vertragsteil Sicherheit zu leisten, wenn sie sich binnen sechs Monaten nach der Bekanntmachung zu diesem Zweck bei ihm melden."
    },
    {
      "date": "2024-12-17",
      "id": "96704",
      "original_text": "Registerbekanntmachung nach dem Umwandlungsgesetz\nNiedersachsen Amtsgericht Oldenburg (Oldenburg) HRB 220876\nBUOYANCY Holding GmbH – Lohne",
      "type": "Registerbekanntmachung nach dem Umwandlungsgesetz",
      "state": "Niedersachsen",
      "amtsgericht": "Amtsgericht Oldenburg (Oldenburg)",
      "registernummer": "HRB 220876",
      "registerart": "HRB",
      "company_name": "BUOYANCY Holding GmbH",
      "company_seat": "Lohne",
      "details": "17.12.2024 (Bekanntmachungsdatum)\n\nNiedersachsen Amtsgericht Oldenburg (Oldenburg) HRB 220876\nRegisterbekanntmachung nach dem Umwandlungsgesetz 17.12.2024 (Eintragungsdatum)\n\nBUOYANCY Holding GmbH\nGesellschaft mit beschränkter Haftung\nLohne\n\nDen Gläubigern der an der Verschmelzung beteiligten Rechtsträger ist, wenn sie binnen sechs Monaten nach dem Tag, an dem die Eintragung der Verschmelzung in das Register des Sitzes desjenigen Rechtsträgers, dessen Gläubiger sie sind, nach § 19  Abs.  3 UmwG als bekannt gemacht gilt, ihren Anspruch nach Grund und Höhe schriftlich anmelden, Sicherheit zu leisten, soweit sie nicht Befriedigung verlangen können. Dieses Recht steht den Gläubigern jedoch nur zu, wenn sie glaubhaft machen, dass durch die Verschmelzung die Erfüllung der Forderung gefährdet wird."
    },
    {
      "date": "2024-12-17",
      "id": "96705",
      "original_text": "Löschungsankündigung\nNiedersachsen Amtsgericht Osnabrück HRB 219119\nKF Nature Plast GmbH – Nordhorn",
      "type": "Löschungsankündigung",
      "state": "Niedersachsen",
      "amtsgericht": "Amtsgericht Osnabrück",
      "registernummer": "HRB 219119",
      "registerart": "HRB",
      "company_name": "KF Nature Plast GmbH",
      "company_seat": "Nordhorn",
      "details": "17.12.2024 (Bekanntmachungsdatum)\n\nNiedersachsen Amtsgericht Osnabrück HRB 219119\nLöschungsankündigung 17.12.2024 (Eintragungsdatum)\n\nKF Nature Plast GmbH\nGesellschaft mit beschränkter Haftung\nNordhorn\n\nDas Registergericht beabsichtigt, die Gesellschaft von Amts wegen nach § 394 FamFG wegen Vermögenslosigkeit zu löschen. Die Frist zur Erhebung eines Widerspruchs ist auf 1 Monat ab dieser Registerbekanntmachung festgesetzt."
    },
    {
      "date": "2024-12-17",
      "id": "96706",
      "original_text": "Einreichung neuer Dokumente\nNiedersachsen Amtsgericht Osnabrück HRB 217852\nRiverside Capital AG – Bad Rothenfelde",
      "type": "Einreichung neuer Dokumente",
      "state": "Niedersachsen",
      "amtsgericht": "Amtsgericht Osnabrück",
      "registernummer": "HRB 217852",
      "registerart": "HRB",
      "company_name": "Riverside Capital AG",
      "company_seat": "Bad Rothenfelde",
      "details": "17.12.2024 (Bekanntmachungsdatum)\n\nNiedersachsen Amtsgericht Osnabrück HRB 217852\nEinreichung neuer Dokumente 21.03.2024 (Eintragungsdatum)\n\nRiverside Capital AG\nAktiengesellschaft\nBad Rothenfelde\n\nDie Liste der Mitglieder des Aufsichtsrats wurde beim Registergericht eingereicht."
    },
    {
      "date": "2024-12-17",
      "id": "96707",
      "original_text": "Registerbekanntmachung nach dem Umwandlungsgesetz\nNiedersachsen Amtsgericht Walsrode HRB 204284\nBens d'Avall Verwaltungs-GmbH – Ottersberg",
      "type": "Registerbekanntmachung nach dem Umwandlungsgesetz",
      "state": "Niedersachsen",
      "amtsgericht": "Amtsgericht Walsrode",
      "registernummer": "HRB 204284",
      "registerart": "HRB",
      "company_name": "Bens d'Avall Verwaltungs-GmbH",
      "company_seat": "Ottersberg",
      "details": "17.12.2024 (Bekanntmachungsdatum)\n\nNiedersachsen Amtsgericht Walsrode HRB 204284\nRegisterbekanntmachung nach dem Umwandlungsgesetz 17.12.2024 (Eintragungsdatum)\n\nBens d'Avall Verwaltungs-GmbH\nGesellschaft mit beschränkter Haftung\nOttersberg\n\nDen Gläubigern der an der Verschmelzung beteiligten Rechtsträger ist, wenn sie binnen sechs Monaten nach dem Tag, an dem die Eintragung der Verschmelzung in das Register des Sitzes desjenigen Rechtsträgers, dessen Gläubiger sie sind, nach § 19  Abs.  3 UmwG als bekannt gemacht gilt, ihren Anspruch nach Grund und Höhe schriftlich anmelden, Sicherheit zu leisten, soweit sie nicht Befriedigung verlangen können. Dieses Recht steht den Gläubigern jedoch nur zu, wenn sie glaubhaft machen, dass durch die Verschmelzung die Erfüllung der Forderung gefährdet wird."
    },
    {
      "date": "2024-12-17",
      "id": "96708",
      "original_text": "Registerbekanntmachung nach dem Umwandlungsgesetz\nNiedersachsen Amtsgericht Osnabrück HRB 214072\nAvermann Auslandsbeteiligungs GmbH – Osnabrück",
      "type": "Registerbekanntmachung nach dem Umwandlungsgesetz",
      "state": "Niedersachsen",
      "amtsgericht": "Amtsgericht Osnabrück",
      "registernummer": "HRB 214072",
      "registerart": "HRB",
      "company_name": "Avermann Auslandsbeteiligungs GmbH",
      "company_seat": "Osnabrück",
      "details": "17.12.2024 (Bekanntmachungsdatum)\n\nNiedersachsen Amtsgericht Osnabrück HRB 214072\nRegisterbekanntmachung nach dem Umwandlungsgesetz 17.12.2024 (Eintragungsdatum)\n\nAvermann Auslandsbeteiligungs GmbH\nGesellschaft mit beschränkter Haftung\nOsnabrück\n\nDen Gläubigern der an der Verschmelzung beteiligten Rechtsträger ist, wenn sie binnen sechs Monaten nach dem Tag, an dem die Eintragung der Verschmelzung in das Register des Sitzes desjenigen Rechtsträgers, dessen Gläubiger sie sind, nach § 19  Abs.  3 UmwG als bekannt gemacht gilt, ihren Anspruch nach Grund und Höhe schriftlich anmelden, Sicherheit zu leisten, soweit sie nicht Befriedigung verlangen können. Dieses Recht steht den Gläubigern jedoch nur zu, wenn sie glaubhaft machen, dass durch die Verschmelzung die Erfüllung der Forderung gefährdet wird."
    },
    {
      "date": "2024-12-17",
      "id": "96709",
      "original_text": "Registerbekanntmachung nach dem Umwandlungsgesetz\nSachsen Amtsgericht Dresden HRB 3584\nBudissa - Agrar - GmbH Kubschütz – Kubschütz",
      "type": "Registerbekanntmachung nach dem Umwandlungsgesetz",
      "state": "Sachsen",
      "amtsgericht": "Amtsgericht Dresden",
      "registernummer": "HRB 3584",
      "registerart": "HRB",
      "company_name": "Budissa - Agrar - GmbH Kubschütz",
      "company_seat": "Kubschütz",
      "details": "17.12.2024 (Bekanntmachungsdatum)\n\nSachsen Amtsgericht Dresden HRB 3584\nRegisterbekanntmachung nach dem Umwandlungsgesetz 17.12.2024 (Eintragungsdatum)\n\nBudissa - Agrar - GmbH Kubschütz\nGesellschaft mit beschränkter Haftung\nKubschütz\n\nDen Gläubigern der an der Verschmelzung beteiligten Rechtsträger ist, wenn sie binnen sechs Monaten nach dem Tag, an dem die Eintragung der Verschmelzung in das Register des Sitzes desjenigen Rechtsträgers, dessen Gläubiger sie sind, nach § 19 Abs. 3 UmwG als bekannt gemacht gilt, ihren Anspruch nach Grund und Höhe schriftlich anmelden, Sicherheit zu leisten, soweit sie nicht Befriedigung verlangen können. Dieses Recht steht den Gläubigern jedoch nur zu, wenn sie glaubhaft machen, dass durch die Verschmelzung die Erfüllung der Forderung gefährdet wird."
    },
    {
      "date": "2024-12-17",
      "id": "96710",
      "original_text": "Registerbekanntmachung nach dem Umwandlungsgesetz\nSachsen Amtsgericht Dresden HRB 26904\nBUDISSA Agrar GmbH Kubschütz – Kubschütz",
      "type": "Registerbekanntmachung nach dem Umwandlungsgesetz",
      "state": "Sachsen",
      "amtsgericht": "Amtsgericht Dresden",
      "registernummer": "HRB 26904",
      "registerart": "HRB",
      "company_name": "BUDISSA Agrar GmbH Kubschütz",
      "company_seat": "Kubschütz",
      "details": "17.12.2024 (Bekanntmachungsdatum)\n\nSachsen Amtsgericht Dresden HRB 26904\nRegisterbekanntmachung nach dem Umwandlungsgesetz 17.12.2024 (Eintragungsdatum)\n\nBUDISSA Agrar GmbH Kubschütz\nGesellschaft mit beschränkter Haftung\nKubschütz\n\nDen Gläubigern der an der Verschmelzung beteiligten Rechtsträger ist, wenn sie binnen sechs Monaten nach dem Tag, an dem die Eintragung der Verschmelzung in das Register des Sitzes desjenigen Rechtsträgers, dessen Gläubiger sie sind, nach § 19 Abs. 3 UmwG als bekannt gemacht gilt, ihren Anspruch nach Grund und Höhe schriftlich anmelden, Sicherheit zu leisten, soweit sie nicht Befriedigung verlangen können. Dieses Recht steht den Gläubigern jedoch nur zu, wenn sie glaubhaft machen, dass durch die Verschmelzung die Erfüllung der Forderung gefährdet wird."
    },
    {
      "date": "2024-12-17",
      "id": "96711",
      "original_text": "Löschungsankündigung\nBremen Amtsgericht Bremen HRB 39490\nDada Bau Service GmbH – Bremen",
      "type": "Löschungsankündigung",
      "state": "Bremen",
      "amtsgericht": "Amtsgericht Bremen",
      "registernummer": "HRB 39490",
      "registerart": "HRB",
      "company_name": "Dada Bau Service GmbH",
      "company_seat": "Bremen",
      "details": "17.12.2024 (Bekanntmachungsdatum)\n\nBremen Amtsgericht Bremen HRB 39490\nLöschungsankündigung\n\nDada Bau Service GmbH\nGesellschaft mit beschränkter Haftung\nBremen\n\nEs ist beabsichtigt die im Handelsregister eingetragene Gesellschaft von Amts wegen gemäß § 394 FamFG zu löschen. Gegen die Löschung kann beim AG Bremen schriftlich oder zu Protokoll der Geschäftsstelle Widerspruch eingelegt werden. Widerspruchsfrist 4 Wochen."
    },
    {
      "date": "2024-12-17",
      "id": "96712",
      "original_text": "Löschungsankündigung\nBremen Amtsgericht Bremen HRB 36391\nP.A.S. UG (haftungsbeschränkt) – Bremen",
      "type": "Löschungsankündigung",
      "state": "Bremen",
      "amtsgericht": "Amtsgericht Bremen",
      "registernummer": "HRB 36391",
      "registerart": "HRB",
      "company_name": "P.A.S. UG (haftungsbeschränkt)",
      "company_seat": "Bremen",
      "details": "17.12.2024 (Bekanntmachungsdatum)\n\nBremen Amtsgericht Bremen HRB 36391\nLöschungsankündigung\n\nP.A.S. UG (haftungsbeschränkt)\nGesellschaft mit beschränkter Haftung\nBremen\n\nEs ist beabsichtigt die im Handelsregister eingetragene Gesellschaft von Amts wegen gemäß § 394 FamFG zu löschen. Gegen die Löschung kann beim AG Bremen schriftlich oder zu Protokoll der Geschäftsstelle Widerspruch eingelegt werden. Widerspruchsfrist 4 Wochen."
    },
    {
      "date": "2024-12-17",
      "id": "96713",
      "original_text": "Löschungsankündigung\nBremen Amtsgericht Bremen HRB 35356\nGODEXCO Logistics GmbH – Bremen",
      "type": "Löschungsankündigung",
      "state": "Bremen",
      "amtsgericht": "Amtsgericht Bremen",
      "registernummer": "HRB 35356",
      "registerart": "HRB",
      "company_name": "GODEXCO Logistics GmbH",
      "company_seat": "Bremen",
      "details": "17.12.2024 (Bekanntmachungsdatum)\n\nBremen Amtsgericht Bremen HRB 35356\nLöschungsankündigung\n\nGODEXCO Logistics GmbH\nGesellschaft mit beschränkter Haftung\nBremen\n\nEs ist beabsichtigt die im Handelsregister eingetragene Gesellschaft von Amts wegen gemäß § 394 FamFG zu löschen. Gegen die Löschung kann beim AG Bremen schriftlich oder zu Protokoll der Geschäftsstelle Widerspruch eingelegt werden. Widerspruchsfrist 4 Wochen."
    },
    {
      "date": "2024-12-17",
      "id": "96714",
      "original_text": "Löschungsankündigung\nRheinland-Pfalz Amtsgericht Zweibrücken HRB 30578\nSam-Publishing GmbH – Ramstein-Miesenbach",
      "type": "Löschungsankündigung",
      "state": "Rheinland-Pfalz",
      "amtsgericht": "Amtsgericht Zweibrücken",
      "registernummer": "HRB 30578",
      "registerart": "HRB",
      "company_name": "Sam-Publishing GmbH",
      "company_seat": "Ramstein-Miesenbach",
      "details": "17.12.2024 (Bekanntmachungsdatum)\n\nRheinland-Pfalz Amtsgericht Zweibrücken HRB 30578\nLöschungsankündigung\n\nSam-Publishing GmbH\nGesellschaft mit beschränkter Haftung\nRamstein-Miesenbach\n\nDas Registergericht beabsichtigt die Gesellschaft von Amts wegen nach § 394 FamFG zu löschen. Die Frist zur Erhebung eines Widerspruchs ist auf einen Monat festgesetzt."
    },
    {
      "date": "2024-12-17",
      "id": "96715",
      "original_text": "Registerbekanntmachung nach dem Umwandlungsgesetz\nRheinland-Pfalz Amtsgericht Mainz HRB 53355\nBL Biopark GmbH – Mainz",
      "type": "Registerbekanntmachung nach dem Umwandlungsgesetz",
      "state": "Rheinland-Pfalz",
      "amtsgericht": "Amtsgericht Mainz",
      "registernummer": "HRB 53355",
      "registerart": "HRB",
      "company_name": "BL Biopark GmbH",
      "company_seat": "Mainz",
      "details": "17.12.2024 (Bekanntmachungsdatum)\n\nRheinland-Pfalz Amtsgericht Mainz HRB 53355\nRegisterbekanntmachung nach dem Umwandlungsgesetz 17.12.2024 (Eintragungsdatum)\n\nBL Biopark GmbH\nGesellschaft mit beschränkter Haftung\nMainz\n\nAls nicht eingetragen wird veröffentlicht:\nDen Gläubigern des formwechselnden Rechtsträgers ist, wenn sie binnen sechs Monaten nach dem Tag, an dem die Eintragung des Formwechsels nach § 201 UmwG als bekanntgemacht gilt, ihren Anspruch nach Grund und Höhe schriftlich anmelden, Sicherheit zu leisten, soweit sie nicht Befriedigung verlangen können. Dieses Recht steht den Gläubigern jedoch nur zu, wenn sie glaubhaft machen, dass durch den Formwechsel die Erfüllung ihrer Forderung gefährdet wird."
    },
    {
      "date": "2024-12-17",
      "id": "96716",
      "original_text": "Registerbekanntmachung nach dem Umwandlungsgesetz\nRheinland-Pfalz Amtsgericht Mainz HRA 43017\nBL Biopark GmbH & Co. KG – Mainz",
      "type": "Registerbekanntmachung nach dem Umwandlungsgesetz",
      "state": "Rheinland-Pfalz",
      "amtsgericht": "Amtsgericht Mainz",
      "registernummer": "HRA 43017",
      "registerart": "HRA",
      "company_name": "BL Biopark GmbH & Co. KG",
      "company_seat": "Mainz",
      "details": "17.12.2024 (Bekanntmachungsdatum)\n\nRheinland-Pfalz Amtsgericht Mainz HRA 43017\nRegisterbekanntmachung nach dem Umwandlungsgesetz 17.12.2024 (Eintragungsdatum)\n\nBL Biopark GmbH & Co. KG\nKommanditgesellschaft\nMainz\n\nAls nicht eingetragen wird veröffentlicht:\nDen Gläubigern des formwechselnden Rechtsträgers ist, wenn sie binnen sechs Monaten nach dem Tag, an dem die Eintragung des Formwechsels nach § 201 UmwG als bekanntgemacht gilt, ihren Anspruch nach Grund und Höhe schriftlich anmelden, Sicherheit zu leisten, soweit sie nicht Befriedigung verlangen können. Dieses Recht steht den Gläubigern jedoch nur zu, wenn sie glaubhaft machen, dass durch den Formwechsel die Erfüllung ihrer Forderung gefährdet wird."
    },
    {
      "date": "2024-12-17",
      "id": "96717",
      "original_text": "Löschungsankündigung\nRheinland-Pfalz Amtsgericht Mainz HRB 49921\nDeutsche Biofonds Financial Services GmbH – Mainz",
      "type": "Löschungsankündigung",
      "state": "Rheinland-Pfalz",
      "amtsgericht": "Amtsgericht Mainz",
      "registernummer": "HRB 49921",
      "registerart": "HRB",
      "company_name": "Deutsche Biofonds Financial Services GmbH",
      "company_seat": "Mainz",
      "details": "17.12.2024 (Bekanntmachungsdatum)\n\nRheinland-Pfalz Amtsgericht Mainz HRB 49921\nLöschungsankündigung\n\nDeutsche Biofonds Financial Services GmbH\nGesellschaft mit beschränkter Haftung\nMainz\n\nDas Registergericht beabsichtigt die Gesellschaft von Amts wegen nach § 394 FamFG zu löschen. Die Frist zur Erhebung eines Widerspruchs ist auf einen Monat festgesetzt."
    },
    {
      "date": "2024-12-17",
      "id": "96718",
      "original_text": "Löschungsankündigung\nRheinland-Pfalz Amtsgericht Ludwigshafen a.Rhein (Ludwigshafen) HRB 63469\nH.A.C.H. Holz Montage Service GmbH – Ludwigshafen",
      "type": "Löschungsankündigung",
      "state": "Rheinland-Pfalz",
      "amtsgericht": "Amtsgericht Ludwigshafen a.Rhein (Ludwigshafen)",
      "registernummer": "HRB 63469",
      "registerart": "HRB",
      "company_name": "H.A.C.H. Holz Montage Service GmbH",
      "company_seat": "Ludwigshafen",
      "details": "17.12.2024 (Bekanntmachungsdatum)\n\nRheinland-Pfalz Amtsgericht Ludwigshafen a.Rhein (Ludwigshafen) HRB 63469\nLöschungsankündigung\n\nH.A.C.H. Holz Montage Service GmbH\nGesellschaft mit beschränkter Haftung\nLudwigshafen\n\nDas Registergericht beabsichtigt die Gesellschaft von Amts wegen nach § 394 FamFG zu löschen. Die Frist zur Erhebung eines Widerspruchs ist auf einen Monat festgesetzt."
    },
    {
      "date": "2024-12-17",
      "id": "96719",
      "original_text": "Registerbekanntmachung nach dem Umwandlungsgesetz\nNordrhein-Westfalen Amtsgericht Köln HRB 76187\nfitogram GmbH – Köln",
      "type": "Registerbekanntmachung nach dem Umwandlungsgesetz",
      "state": "Nordrhein-Westfalen",
      "amtsgericht": "Amtsgericht Köln",
      "registernummer": "HRB 76187",
      "registerart": "HRB",
      "company_name": "fitogram GmbH",
      "company_seat": "Köln",
      "details": "17.12.2024 (Bekanntmachungsdatum)\n\nNordrhein-Westfalen Amtsgericht Köln HRB 76187\nRegisterbekanntmachung nach dem Umwandlungsgesetz 17.12.2024 (Eintragungsdatum)\n\nfitogram GmbH\nGesellschaft mit beschränkter Haftung\nKöln\n\nDen Gläubigern der an der Verschmelzung beteiligten Rechtsträger ist, wenn sie binnen sechs Monaten nach dem Tag, an dem die Eintragung der Verschmelzung in das Register des Sitzes desjenigen Rechtsträgers, dessen Gläubiger sie sind, nach § 19 Absatz 3 UmwG als bekanntgemacht gilt, ihren Anspruch nach Grund und Höhe schriftlich anmelden, Sicherheit zu leisten, soweit sie nicht Befriedigung verlangen können. Dieses Recht steht den Gläubigern jedoch nur zu, wenn sie glaubhaft machen, dass durch die Verschmelzung die Erfüllung ihrer Forderung gefährdet wird."
    },
    {
      "date": "2024-12-17",
      "id": "96720",
      "original_text": "Einreichung neuer Dokumente\nNordrhein-Westfalen Amtsgericht Neuss HRB 18496\nYareto GmbH – Neuss",
      "type": "Einreichung neuer Dokumente",
      "state": "Nordrhein-Westfalen",
      "amtsgericht": "Amtsgericht Neuss",
      "registernummer": "HRB 18496",
      "registerart": "HRB",
      "company_name": "Yareto GmbH",
      "company_seat": "Neuss",
      "details": "17.12.2024 (Bekanntmachungsdatum)\n\nNordrhein-Westfalen Amtsgericht Neuss HRB 18496\nEinreichung neuer Dokumente 13.12.2024 (Eintragungsdatum)\n\nYareto GmbH\nGesellschaft mit beschränkter Haftung\nNeuss\n\nDem Registergericht ist eine Liste der Mitglieder des Aufsichtsrates eingereicht worden."
    },
    {
      "date": "2024-12-17",
      "id": "96721",
      "original_text": "Löschungsankündigung\nNordrhein-Westfalen Amtsgericht Mönchengladbach HRB 19648\nALIEV Transport GmbH – Mönchengladbach",
      "type": "Löschungsankündigung",
      "state": "Nordrhein-Westfalen",
      "amtsgericht": "Amtsgericht Mönchengladbach",
      "registernummer": "HRB 19648",
      "registerart": "HRB",
      "company_name": "ALIEV Transport GmbH",
      "company_seat": "Mönchengladbach",
      "details": "17.12.2024 (Bekanntmachungsdatum)\n\nNordrhein-Westfalen Amtsgericht Mönchengladbach HRB 19648\nLöschungsankündigung\n\nALIEV Transport GmbH\nGesellschaft mit beschränkter Haftung\nMönchengladbach\n\nALIEV Transport GmbH, Mönchengladbach (Amtsgericht Mönchengladbach, HRB 19648)\nDas Registergericht beabsichtigt, die im Handelsregister eingetragene Gesellschaft gemäß § 394 Absatz 1 FamFG wegen Vermögenslosigkeit von Amts wegen zu löschen. Gegen diese Verfügung kann Widerspruch eingelegt werden. Die Frist zur Erhebung eines Widerspruchs gegen die beabsichtigte Löschung von Amts wegen ist auf drei Monate festgesetzt."
    },
    {
      "date": "2024-12-17",
      "id": "96722",
      "original_text": "Registerbekanntmachung nach dem Umwandlungsgesetz\nNordrhein-Westfalen Amtsgericht Bonn HRB 8058\nGDE Werbeagentur GmbH – Bonn",
      "type": "Registerbekanntmachung nach dem Umwandlungsgesetz",
      "state": "Nordrhein-Westfalen",
      "amtsgericht": "Amtsgericht Bonn",
      "registernummer": "HRB 8058",
      "registerart": "HRB",
      "company_name": "GDE Werbeagentur GmbH",
      "company_seat": "Bonn",
      "details": "17.12.2024 (Bekanntmachungsdatum)\n\nNordrhein-Westfalen Amtsgericht Bonn HRB 8058\nRegisterbekanntmachung nach dem Umwandlungsgesetz 17.12.2024 (Eintragungsdatum)\n\nGDE Werbeagentur GmbH\nGesellschaft mit beschränkter Haftung\nBonn\n\nDen Gläubigern der an der Verschmelzung beteiligten Rechtsträger ist, wenn sie binnen sechs Monaten nach dem Tag, an dem die Eintragung der Verschmelzung in das Register des Sitzes desjenigen Rechtsträgers, dessen Gläubiger sie sind, nach § 19 Absatz 3 UmwG als bekanntgemacht gilt, ihren Anspruch nach Grund und Höhe schriftlich anmelden, Sicherheit zu leisten, soweit sie nicht Befriedigung verlangen können. Dieses Recht steht den Gläubigern jedoch nur zu, wenn sie glaubhaft machen, dass durch die Verschmelzung die Erfüllung ihrer Forderung gefährdet wird."
    },
    {
      "date": "2024-12-17",
      "id": "96723",
      "original_text": "Löschungsankündigung\nNordrhein-Westfalen Amtsgericht Dortmund HRB 33661\nCuric Bau. UG (haftungsbeschränkt) – Dortmund",
      "type": "Löschungsankündigung",
      "state": "Nordrhein-Westfalen",
      "amtsgericht": "Amtsgericht Dortmund",
      "registernummer": "HRB 33661",
      "registerart": "HRB",
      "company_name": "Curic Bau. UG (haftungsbeschränkt)",
      "company_seat": "Dortmund",
      "details": "17.12.2024 (Bekanntmachungsdatum)\n\nNordrhein-Westfalen Amtsgericht Dortmund HRB 33661\nLöschungsankündigung\n\nCuric Bau. UG (haftungsbeschränkt)\nGesellschaft mit beschränkter Haftung\nDortmund\n\nDas Registergericht beabsichtigt die Gesellschaft von Amts wegen nach § 394 FamFG zu löschen. Die Frist zur Erhebung eines Widerspruchs ist auf zwei Monate festgesetzt."
    },
    {
      "date": "2024-12-17",
      "id": "96724",
      "original_text": "Registerbekanntmachung nach dem Umwandlungsgesetz\nNordrhein-Westfalen Amtsgericht Paderborn HRA 8752\nEsslust Speisen und Service e. K. – Paderborn",
      "type": "Registerbekanntmachung nach dem Umwandlungsgesetz",
      "state": "Nordrhein-Westfalen",
      "amtsgericht": "Amtsgericht Paderborn",
      "registernummer": "HRA 8752",
      "registerart": "HRA",
      "company_name": "Esslust Speisen und Service e. K.",
      "company_seat": "Paderborn",
      "details": "17.12.2024 (Bekanntmachungsdatum)\n\nNordrhein-Westfalen Amtsgericht Paderborn HRA 8752\nRegisterbekanntmachung nach dem Umwandlungsgesetz 17.12.2024 (Eintragungsdatum)\n\nEsslust Speisen und Service e. K.\nEinzelkaufmann / Einzelkauffrau\nPaderborn\n\nDen Gläubigern der an der Ausgliederung beteiligten Rechtsträger ist, wenn sie binnen sechs Monaten nach dem Tag, an dem die Eintragung der Ausgliederung in das Register des Sitzes desjenigen Rechtsträgers, dessen Gläubiger sie sind, nach § 19 Absatz 3 UmwG als bekanntgemacht gilt, ihren Anspruch nach Grund und Höhe schriftlich anmelden, Sicherheit zu leisten, soweit sie nicht Befriedigung verlangen können. Dieses Recht steht den Gläubigern jedoch nur zu, wenn sie glaubhaft machen, dass durch die Ausgliederung die Erfüllung ihrer Forderung gefährdet wird."
    },
    {
      "date": "2024-12-17",
      "id": "96725",
      "original_text": "Einreichung neuer Dokumente\nNordrhein-Westfalen Amtsgericht Essen HRB 22146\nMCE CONSULT AG – Essen",
      "type": "Einreichung neuer Dokumente",
      "state": "Nordrhein-Westfalen",
      "amtsgericht": "Amtsgericht Essen",
      "registernummer": "HRB 22146",
      "registerart": "HRB",
      "company_name": "MCE CONSULT AG",
      "company_seat": "Essen",
      "details": "17.12.2024 (Bekanntmachungsdatum)\n\nNordrhein-Westfalen Amtsgericht Essen HRB 22146\nEinreichung neuer Dokumente\n\nMCE CONSULT AG\nAktiengesellschaft\nEssen\n\nAls nicht eingetragen wird bekannt gegeben:\nDem Registergericht ist eine neue Liste der Mitglieder des Aufsichtsrates eingereicht worden."
    },
    {
      "date": "2024-12-17",
      "id": "96726",
      "original_text": "Einreichung neuer Dokumente\nNordrhein-Westfalen Amtsgericht Iserlohn HRB 3839\nLüdenscheider Wohnstätten-Aktiengesellschaft – Lüdenscheid",
      "type": "Einreichung neuer Dokumente",
      "state": "Nordrhein-Westfalen",
      "amtsgericht": "Amtsgericht Iserlohn",
      "registernummer": "HRB 3839",
      "registerart": "HRB",
      "company_name": "Lüdenscheider Wohnstätten-Aktiengesellschaft",
      "company_seat": "Lüdenscheid",
      "details": "17.12.2024 (Bekanntmachungsdatum)\n\nNordrhein-Westfalen Amtsgericht Iserlohn HRB 3839\nEinreichung neuer Dokumente\n\nLüdenscheider Wohnstätten-Aktiengesellschaft\nAktiengesellschaft\nLüdenscheid\n\nDem Registergericht ist eine neue Liste der Mitglieder des Aufsichtsrates eingereicht worden."
    },
    {
      "date": "2024-12-17",
      "id": "96727",
      "original_text": "Einreichung neuer Dokumente\nNordrhein-Westfalen Amtsgericht Iserlohn HRB 3839\nLüdenscheider Wohnstätten-Aktiengesellschaft – Lüdenscheid",
      "type": "Einreichung neuer Dokumente",
      "state": "Nordrhein-Westfalen",
      "amtsgericht": "Amtsgericht Iserlohn",
      "registernummer": "HRB 3839",
      "registerart": "HRB",
      "company_name": "Lüdenscheider Wohnstätten-Aktiengesellschaft",
      "company_seat": "Lüdenscheid",
      "details": "17.12.2024 (Bekanntmachungsdatum)\n\nNordrhein-Westfalen Amtsgericht Iserlohn HRB 3839\nEinreichung neuer Dokumente\n\nLüdenscheider Wohnstätten-Aktiengesellschaft\nAktiengesellschaft\nLüdenscheid\n\nDem Registergericht ist eine neue Liste der Mitglieder des Aufsichtsrates eingereicht worden."
    },
    {
      "date": "2024-12-17",
      "id": "96728",
      "original_text": "Löschungsankündigung\nNordrhein-Westfalen Amtsgericht Mönchengladbach HRB 21454\nRetaj Immobilien Investment GmbH – Mönchengladbach",
      "type": "Löschungsankündigung",
      "state": "Nordrhein-Westfalen",
      "amtsgericht": "Amtsgericht Mönchengladbach",
      "registernummer": "HRB 21454",
      "registerart": "HRB",
      "company_name": "Retaj Immobilien Investment GmbH",
      "company_seat": "Mönchengladbach",
      "details": "17.12.2024 (Bekanntmachungsdatum)\n\nNordrhein-Westfalen Amtsgericht Mönchengladbach HRB 21454\nLöschungsankündigung\n\nRetaj Immobilien Investment GmbH\nGesellschaft mit beschränkter Haftung\nMönchengladbach\n\nDas Registergericht beabsichtigt die Gesellschaft von Amts wegen nach § 394 FamFG zu löschen. Die Frist zur Erhebung eines Widerspruchs ist auf drei Monate festgesetzt."
    },
    {
      "date": "2024-12-17",
      "id": "96729",
      "original_text": "Löschungsankündigung\nNordrhein-Westfalen Amtsgericht Neuss HRA 4329\nLudwig Sarlette jun., Spezialveranstalter für politische, wirtschaftliche und kulturelle Informations- und Studienreisen – Neuss",
      "type": "Löschungsankündigung",
      "state": "Nordrhein-Westfalen",
      "amtsgericht": "Amtsgericht Neuss",
      "registernummer": "HRA 4329",
      "registerart": "HRA",
      "company_name": "Ludwig Sarlette jun., Spezialveranstalter für politische, wirtschaftliche und kulturelle Informations- und Studienreisen",
      "company_seat": "Neuss",
      "details": "17.12.2024 (Bekanntmachungsdatum)\n\nNordrhein-Westfalen Amtsgericht Neuss HRA 4329\nLöschungsankündigung 11.12.2024 (Eintragungsdatum)\n\nLudwig Sarlette jun., Spezialveranstalter für politische, wirtschaftliche und kulturelle Informations- und Studienreisen\nEinzelkaufmann / Einzelkauffrau\nNeuss\n\nDas Registergericht beabsichtigt die Firma von Amts wegen nach § 31 Abs. 2 HGB, § 393 FamFG zu löschen. Die Frist zur Erhebung eines Widerspruchs ist auf einen Monat festgesetzt."
    },
    {
      "date": "2024-12-17",
      "id": "96730",
      "original_text": "Löschungsankündigung\nNordrhein-Westfalen Amtsgericht Bochum HRB 20592\nKmT Industrie Service IDS GmbH – Bochum",
      "type": "Löschungsankündigung",
      "state": "Nordrhein-Westfalen",
      "amtsgericht": "Amtsgericht Bochum",
      "registernummer": "HRB 20592",
      "registerart": "HRB",
      "company_name": "KmT Industrie Service IDS GmbH",
      "company_seat": "Bochum",
      "details": "17.12.2024 (Bekanntmachungsdatum)\n\nNordrhein-Westfalen Amtsgericht Bochum HRB 20592\nLöschungsankündigung\n\nKmT Industrie Service IDS GmbH\nGesellschaft mit beschränkter Haftung\nBochum\n\nDas Registergericht beabsichtigt die Gesellschaft von Amts wegen nach § 394 FamFG zu löschen. Die Frist zur Erhebung eines Widerspruchs ist auf drei Monate festgesetzt."
    },
    {
      "date": "2024-12-17",
      "id": "96731",
      "original_text": "Registerbekanntmachung nach dem Umwandlungsgesetz\nNordrhein-Westfalen Amtsgericht Düsseldorf HRB 56019\nSILAG Handel AG – Langenfeld",
      "type": "Registerbekanntmachung nach dem Umwandlungsgesetz",
      "state": "Nordrhein-Westfalen",
      "amtsgericht": "Amtsgericht Düsseldorf",
      "registernummer": "HRB 56019",
      "registerart": "HRB",
      "company_name": "SILAG Handel AG",
      "company_seat": "Langenfeld",
      "details": "17.12.2024 (Bekanntmachungsdatum)\n\nNordrhein-Westfalen Amtsgericht Düsseldorf HRB 56019\nRegisterbekanntmachung nach dem Umwandlungsgesetz 17.12.2024 (Eintragungsdatum)\n\nSILAG Handel AG\nAktiengesellschaft\nLangenfeld\n\nDen Gläubigern der an der formwechselnden Umwandlung beteiligten Rechtsträger ist, wenn sie binnen sechs Monaten nach dem Tag, an dem die Eintragung der formwechselnden Umwandlung in das Register des Sitzes desjenigen Rechtsträgers, dessen Gläubiger sie sind, nach § 19 Absatz 3 UmwG als bekanntgemacht gilt, ihren Anspruch nach Grund und Höhe schriftlich anmelden, Sicherheit zu leisten, soweit sie nicht Befriedigung verlangen können. Dieses Recht steht den Gläubigern jedoch nur zu, wenn sie glaubhaft machen, dass durch die formwechselnden Umwandlung die Erfüllung ihrer Forderung gefährdet wird."
    },
    {
      "date": "2024-12-17",
      "id": "96732",
      "original_text": "Registerbekanntmachung nach dem Umwandlungsgesetz\nNordrhein-Westfalen Amtsgericht Köln HRA 37650\nEdelstein Immobilien - Sebastian Sekulla e.K. – Pulheim",
      "type": "Registerbekanntmachung nach dem Umwandlungsgesetz",
      "state": "Nordrhein-Westfalen",
      "amtsgericht": "Amtsgericht Köln",
      "registernummer": "HRA 37650",
      "registerart": "HRA",
      "company_name": "Edelstein Immobilien - Sebastian Sekulla e.K.",
      "company_seat": "Pulheim",
      "details": "17.12.2024 (Bekanntmachungsdatum)\n\nNordrhein-Westfalen Amtsgericht Köln HRA 37650\nRegisterbekanntmachung nach dem Umwandlungsgesetz 17.12.2024 (Eintragungsdatum)\n\nEdelstein Immobilien - Sebastian Sekulla e.K.\nEinzelkaufmann / Einzelkauffrau\nPulheim\n\nDen Gläubigern der an der Ausgliederung beteiligten Rechtsträger ist, wenn sie binnen sechs Monaten nach dem Tag, an dem die Eintragung der Ausgliederung in das Register des Sitzes desjenigen Rechtsträgers, dessen Gläubiger sie sind, nach § 19 Absatz 3 UmwG als bekanntgemacht gilt, ihren Anspruch nach Grund und Höhe schriftlich anmelden, Sicherheit zu leisten, soweit sie nicht Befriedigung verlangen können. Dieses Recht steht den Gläubigern jedoch nur zu, wenn sie glaubhaft machen, dass durch die Ausgliederung die Erfüllung ihrer Forderung gefährdet wird."
    },
    {
      "date": "2024-12-17",
      "id": "96733",
      "original_text": "Löschungsankündigung\nNordrhein-Westfalen Amtsgericht Düsseldorf HRB 45390\nCONTURA Laserschneiden GmbH – Hilden",
      "type": "Löschungsankündigung",
      "state": "Nordrhein-Westfalen",
      "amtsgericht": "Amtsgericht Düsseldorf",
      "registernummer": "HRB 45390",
      "registerart": "HRB",
      "company_name": "CONTURA Laserschneiden GmbH",
      "company_seat": "Hilden",
      "details": "17.12.2024 (Bekanntmachungsdatum)\n\nNordrhein-Westfalen Amtsgericht Düsseldorf HRB 45390\nLöschungsankündigung\n\nCONTURA Laserschneiden GmbH\nGesellschaft mit beschränkter Haftung\nHilden\n\nDas Registergericht beabsichtigt die Gesellschaft von Amts wegen nach § 394 FamFG zu löschen. Die Frist zur Erhebung eines Widerspruchs ist auf 3 Wochen festgesetzt.\n\nRechtsbehelfsbelehrung:\nDas Widerspruchsrecht steht jedem zu, der an der Unterlassung der Löschung ein berechtigtes Interesse hat. Der Widerspruch ist bei dem Amtsgericht Düsseldorf -Registergericht-, Werdener Straße 1, 40227 Düsseldorf schriftlich in deutscher Sprache oder zur Niederschrift der Geschäftsstelle einzulegen. Der Widerspruch kann auch zur Niederschrift der Geschäftsstelle eines jeden Amtsgerichtes abgegeben werden. Die Einlegung ist auch durch Übertragung eines elektronischen Dokuments an die elektronische Poststelle des Gerichts möglich. Das elektronische Dokument muss für die Bearbeitung durch das Gericht geeignet und mit einer qualifizierten elektronischen Signatur der verantwortenden Person versehen sein oder von der verantwortenden Person signiert und auf einem sicheren Übermittlungsweg gemäß § 130a ZPO nach näherer Maßgabe der Verordnung über die technischen Rahmenbedingungen des elektronischen Rechtsverkehrs und über das besondere elektronische Behördenpostfach (BGBl. I, S.3803) eingereicht werden. Weitere Informationen erhalten Sie auf der Internetseite www.justiz.de.\nDer Widerspruch muss spätestens innerhalb der gesetzten Frist nach dem Datum der Bekanntmachung der Löschungsankündigung bei dem Amtsgericht - Registergericht - Düsseldorf eingegangen sein.  Dies gilt auch dann, wenn der Widerspruch zur Niederschrift der Geschäftsstelle eines anderen Amtsgerichtes abgegeben wurde. Die Frist beginnt mit dem Tage der Bekanntmachung der Löschungsankündigung in dem für die Bekanntmachung der Eintragungen in das Handelsregister bestimmten elektronischen Informations- und Kommunikationssystem nach § 10 des Handelsgesetzbuches. Fällt das Ende der Frist auf einen Sonntag, einen allgemeinen Feiertag oder Sonnabend, so endet die Frist mit Ablauf des nächsten Werktages.\nDer Widerspruch muss die Bezeichnung der angefochtenen Löschungsankündigung sowie die Erklärung enthalten, dass Widerspruch gegen diese Löschungsankündigung eingelegt wird. Er ist zu unterzeichnen und soll begründet werden."
    },
    {
      "date": "2024-12-17",
      "id": "96734",
      "original_text": "Löschungsankündigung\nNordrhein-Westfalen Amtsgericht Kleve HRB 16051\nIORE GmbH – Emmerich am Rhein",
      "type": "Löschungsankündigung",
      "state": "Nordrhein-Westfalen",
      "amtsgericht": "Amtsgericht Kleve",
      "registernummer": "HRB 16051",
      "registerart": "HRB",
      "company_name": "IORE GmbH",
      "company_seat": "Emmerich am Rhein",
      "details": "17.12.2024 (Bekanntmachungsdatum)\n\nNordrhein-Westfalen Amtsgericht Kleve HRB 16051\nLöschungsankündigung\n\nIORE GmbH\nGesellschaft mit beschränkter Haftung\nEmmerich am Rhein\n\nDas Registergericht beabsichtigt die Gesellschaft von Amts wegen nach § 394 FamFG zu löschen. Die Frist zur Erhebung eines Widerspruchs ist auf einen Monat festgesetzt."
    },
    {
      "date": "2024-12-17",
      "id": "96735",
      "original_text": "Löschungsankündigung\nNordrhein-Westfalen Amtsgericht Düsseldorf HRB 95055\nHarake GmbH – Ratingen",
      "type": "Löschungsankündigung",
      "state": "Nordrhein-Westfalen",
      "amtsgericht": "Amtsgericht Düsseldorf",
      "registernummer": "HRB 95055",
      "registerart": "HRB",
      "company_name": "Harake GmbH",
      "company_seat": "Ratingen",
      "details": "17.12.2024 (Bekanntmachungsdatum)\n\nNordrhein-Westfalen Amtsgericht Düsseldorf HRB 95055\nLöschungsankündigung\n\nHarake GmbH\nGesellschaft mit beschränkter Haftung\nRatingen\n\nBetr.: Harake GmbH, Boschstr. 3, 40882 Ratingen\n\nDas Registergericht beabsichtigt die Gesellschaft von Amts wegen nach § 394 FamFG zu löschen. Die Frist zur Erhebung eines Widerspruchs ist auf 3 Wochen festgesetzt.\n\nRechtsbehelfsbelehrung:\n\nDas Widerspruchsrecht steht jedem zu, der an der Unterlassung der Löschung ein berechtigtes Interesse hat. Der Widerspruch ist bei dem Amtsgericht Düsseldorf -Registergericht-, Werdener Straße 1, 40227 Düsseldorf schriftlich in deutscher Sprache oder zur Niederschrift der Geschäftsstelle einzulegen. Der Widerspruch kann auch zur Niederschrift der Geschäftsstelle eines jeden Amtsgerichtes abgegeben werden. Die Einlegung ist auch durch Übertragung eines elektronischen Dokuments an die elektronische Poststelle des Gerichts möglich. Das elektronische Dokument muss für die Bearbeitung durch das Gericht geeignet und mit einer qualifizierten elektronischen Signatur der verantwortenden Person versehen sein oder von der verantwortenden Person signiert und auf einem sicheren Übermittlungsweg gemäß § 130a ZPO nach näherer Maßgabe der Verordnung über die technischen Rahmenbedingungen des elektronischen Rechtsverkehrs und über das besondere elektronische Behördenpostfach (BGBl. I, S.3803) eingereicht werden. Weitere Informationen erhalten Sie auf der Internetseite www.justiz.de.\nDer Widerspruch muss spätestens innerhalb der gesetzten Frist nach dem Datum der Bekanntmachung der Löschungsankündigung bei dem Amtsgericht - Registergericht - Düsseldorf eingegangen sein.  Dies gilt auch dann, wenn der Widerspruch zur Niederschrift der Geschäftsstelle eines anderen Amtsgerichtes abgegeben wurde. Die Frist beginnt mit dem Tage der Bekanntmachung der Löschungsankündigung in dem für die Bekanntmachung der Eintragungen in das Handelsregister bestimmten elektronischen Informations- und Kommunikationssystem nach § 10 des Handelsgesetzbuches. Fällt das Ende der Frist auf einen Sonntag, einen allgemeinen Feiertag oder Sonnabend, so endet die Frist mit Ablauf des nächsten Werktages.\nDer Widerspruch muss die Bezeichnung der angefochtenen Löschungsankündigung sowie die Erklärung enthalten, dass Widerspruch gegen diese Löschungsankündigung eingelegt wird. Er ist zu unterzeichnen und soll begründet werden."
    },
    {
      "date": "2024-12-17",
      "id": "96736",
      "original_text": "Löschungsankündigung\nNordrhein-Westfalen Amtsgericht Gütersloh HRB 11176\nBrinktriene Consult UG (haftungsbeschränkt) – Gütersloh",
      "type": "Löschungsankündigung",
      "state": "Nordrhein-Westfalen",
      "amtsgericht": "Amtsgericht Gütersloh",
      "registernummer": "HRB 11176",
      "registerart": "HRB",
      "company_name": "Brinktriene Consult UG (haftungsbeschränkt)",
      "company_seat": "Gütersloh",
      "details": "17.12.2024 (Bekanntmachungsdatum)\n\nNordrhein-Westfalen Amtsgericht Gütersloh HRB 11176\nLöschungsankündigung\n\nBrinktriene Consult UG (haftungsbeschränkt)\nGesellschaft mit beschränkter Haftung\nGütersloh\n\nDas Registergericht beabsichtigt die Gesellschaft von Amts wegen nach § 394 FamFG zu löschen. Die Frist zur Erhebung eines Widerspruchs ist auf einen Monat festgesetzt."
    },
    {
      "date": "2024-12-17",
      "id": "96737",
      "original_text": "Einreichung neuer Dokumente\nNordrhein-Westfalen Amtsgericht Essen HRB 25360\nthyssenkrupp Services GmbH – Essen",
      "type": "Einreichung neuer Dokumente",
      "state": "Nordrhein-Westfalen",
      "amtsgericht": "Amtsgericht Essen",
      "registernummer": "HRB 25360",
      "registerart": "HRB",
      "company_name": "thyssenkrupp Services GmbH",
      "company_seat": "Essen",
      "details": "17.12.2024 (Bekanntmachungsdatum)\n\nNordrhein-Westfalen Amtsgericht Essen HRB 25360\nEinreichung neuer Dokumente\n\nthyssenkrupp Services GmbH\nGesellschaft mit beschränkter Haftung\nEssen\n\nDem Registergericht ist eine neue Liste der Mitglieder des Aufsichtsrates eingereicht worden."
    },
    {
      "date": "2024-12-17",
      "id": "96738",
      "original_text": "Löschungsankündigung\nNordrhein-Westfalen Amtsgericht Neuss HRB 19974\nJevtic Bauunternehmen UG (haftungsbeschränkt) – Neuss",
      "type": "Löschungsankündigung",
      "state": "Nordrhein-Westfalen",
      "amtsgericht": "Amtsgericht Neuss",
      "registernummer": "HRB 19974",
      "registerart": "HRB",
      "company_name": "Jevtic Bauunternehmen UG (haftungsbeschränkt)",
      "company_seat": "Neuss",
      "details": "17.12.2024 (Bekanntmachungsdatum)\n\nNordrhein-Westfalen Amtsgericht Neuss HRB 19974\nLöschungsankündigung 27.11.2024 (Eintragungsdatum)\n\nJevtic Bauunternehmen UG (haftungsbeschränkt)\nGesellschaft mit beschränkter Haftung\nNeuss\n\nDas Registergericht beabsichtigt die Gesellschaft von Amts wegen nach § 394 FamFG zu löschen. Die Frist zur Erhebung eines Widerspruchs ist auf einen Monat festgesetzt. Rechtsbehelfsbelehrung: Gegen diese Verfügung können Sie Widerspruch einlegen. Der Widerspruch ist bei dem Amtsgericht Neuss - Registergericht -, Breite Str. 48, 41460 Neuss schriftlich in deutscher Sprache oder zur Niederschrift der Geschäftsstelle einzulegen. Der Widerspruch kann auch zur Niederschrift der Geschäftsstelle eines jeden Amtsgerichtes abgegeben werden. Die Einlegung ist auch durch Übertragung eines elektronischen Dokuments an die elektronische Poststelle des Gerichts möglich. Das elektronische Dokument muss für die Bearbeitung durch das Gericht geeignet und mit einer qualifizierten elektronischen Signatur der verantwortenden Person versehen sein oder von der verantwortenden Person signiert und auf einem sicheren Übermittlungsweg gemäß § 130a ZPO nach näherer Maßgabe der Verordnung über die technischen Rahmenbedingungen des elektronischen Rechtsverkehrs und über das besondere elektronische Behördenpostfach (BGBl. I, S.3803) eingereicht werden. Weitere Informationen erhalten Sie auf der Internetseite www.justiz.de. Der Widerspruch muss spätestens innerhalb der gesetzten Frist nach der schriftlichen Bekanntgabe der Verfügung bei dem Amtsgericht - Registergericht - Neuss eingegangen sein. Dies gilt auch dann, wenn der Widerspruch zur Niederschrift der Geschäftsstelle eines anderen Amtsgerichtes abgegeben wurde. Die Frist beginnt mit der schriftlichen Bekanntgabe der Verfügung. Die Bekanntgabe ist entweder durch Zustellung oder am dritten Tage nach Aufgabe zur Post bewirkt. Fällt das Ende der Frist auf einen Sonntag, einen allgemeinen Feiertag oder Sonnabend, so endet die Frist mit Ablauf des nächsten Werktages. Der Widerspruch muss die Bezeichnung der angefochtenen Verfügung sowie die Erklärung enthalten, dass Widerspruch gegen diese Verfügung eingelegt wird. Er ist zu unterzeichnen und soll begründet werden."
    },
    {
      "date": "2024-12-17",
      "id": "96739",
      "original_text": "Registerbekanntmachung nach dem Umwandlungsgesetz\nHessen Amtsgericht Frankfurt am Main HRB 17592\nWallenborn Germany GmbH – Frankfurt am Main",
      "type": "Registerbekanntmachung nach dem Umwandlungsgesetz",
      "state": "Hessen",
      "amtsgericht": "Amtsgericht Frankfurt am Main",
      "registernummer": "HRB 17592",
      "registerart": "HRB",
      "company_name": "Wallenborn Germany GmbH",
      "company_seat": "Frankfurt am Main",
      "details": "17.12.2024 (Bekanntmachungsdatum)\n\nHessen Amtsgericht Frankfurt am Main HRB 17592\nRegisterbekanntmachung nach dem Umwandlungsgesetz 17.12.2024 (Eintragungsdatum)\n\nWallenborn Germany GmbH\nGesellschaft mit beschränkter Haftung\nFrankfurt am Main\n\nDen Gläubigern der an der Verschmelzung beteiligten Rechtsträger ist, wenn sie binnen sechs Monaten nach dem Tag, an dem die Eintragung der Verschmelzung in das Register des Sitzes desjenigen Rechtsträgers, dessen Gläubiger sie sind, nach § 19 Absatz 3 UmwG bekannt gemacht worden ist, ihren Anspruch nach Grund und Höhe schriftlich anmelden, Sicherheit zu leisten, soweit sie nicht Befriedigung verlangen können. Dieses Recht steht den Gläubigern jedoch nur zu, wenn sie glaubhaft machen, dass durch die Verschmelzung die Erfüllung ihrer Forderung gefährdet wird."
    },
    {
      "date": "2024-12-17",
      "id": "96740",
      "original_text": "Registerbekanntmachung nach dem Umwandlungsgesetz\nHessen Amtsgericht Fulda HRB 3522\nHeribert Giebel AG – Eiterfeld",
      "type": "Registerbekanntmachung nach dem Umwandlungsgesetz",
      "state": "Hessen",
      "amtsgericht": "Amtsgericht Fulda",
      "registernummer": "HRB 3522",
      "registerart": "HRB",
      "company_name": "Heribert Giebel AG",
      "company_seat": "Eiterfeld",
      "details": "17.12.2024 (Bekanntmachungsdatum)\n\nHessen Amtsgericht Fulda HRB 3522\nRegisterbekanntmachung nach dem Umwandlungsgesetz 17.12.2024 (Eintragungsdatum)\n\nHeribert Giebel AG\nAktiengesellschaft\nEiterfeld\n\nDen Gläubigern der an der Abspaltung beteiligten Rechtsträger ist, wenn sie binnen sechs Monaten nach dem Tag, an dem die Eintragung der Abspaltung in das Register des Sitzes desjenigen Rechtsträgers, dessen Gläubiger sie sind, nach §§ 125, 19 Absatz 3 UmwG bekannt gemacht worden ist, ihren Anspruch nach Grund und Höhe schriftlich anmelden, Sicherheit zu leisten, soweit sie nicht Befriedigung verlangen können. Dieses Recht steht den Gläubigern jedoch nur zu, wenn sie glaubhaft machen, dass durch die Abspaltung die Erfüllung ihrer Forderung gefährdet wird."
    },
    {
      "date": "2024-12-17",
      "id": "96741",
      "original_text": "Registerbekanntmachung nach dem Umwandlungsgesetz\nHessen Amtsgericht Darmstadt HRB 105043\nIBM Super iPaaS Integration Deutschland GmbH – Darmstadt",
      "type": "Registerbekanntmachung nach dem Umwandlungsgesetz",
      "state": "Hessen",
      "amtsgericht": "Amtsgericht Darmstadt",
      "registernummer": "HRB 105043",
      "registerart": "HRB",
      "company_name": "IBM Super iPaaS Integration Deutschland GmbH",
      "company_seat": "Darmstadt",
      "details": "17.12.2024 (Bekanntmachungsdatum)\n\nHessen Amtsgericht Darmstadt HRB 105043\nRegisterbekanntmachung nach dem Umwandlungsgesetz 17.12.2024 (Eintragungsdatum)\n\nIBM Super iPaaS Integration Deutschland GmbH\nGesellschaft mit beschränkter Haftung\nDarmstadt\n\nDen Gläubigern der an der Verschmelzung beteiligten Rechtsträger ist, wenn sie binnen sechs Monaten nach dem Tag, an dem die Eintragung der Verschmelzung in das Register des Sitzes derjenigen Rechtsträger deren Gläubiger sie sind, nach § 19 Absatz 3 UmwG bekannt gemacht worden ist, ihren Anspruch nach Grund und Höhe schriftlich anmelden, Sicherheit zu leisten, soweit sie nicht Befriedigung verlangen können. Dieses Recht steht den Gläubigern jedoch nur zu, wenn sie glaubhaft machen, dass durch die Verschmelzung die Erfüllung ihrer Forderung gefährdet wird."
    },
    {
      "date": "2024-12-17",
      "id": "96742",
      "original_text": "Sonstige Registerbekanntmachung\nHessen Amtsgericht Bad Hersfeld VR 1943\nFörderverein Haus der kleinen Freunde e. V. – Niederaula-Niederjossa",
      "type": "Sonstige Registerbekanntmachung",
      "state": "Hessen",
      "amtsgericht": "Amtsgericht Bad Hersfeld",
      "registernummer": "VR 1943",
      "registerart": "VR",
      "company_name": "Förderverein Haus der kleinen Freunde e. V.",
      "company_seat": "Niederaula-Niederjossa",
      "details": "17.12.2024 (Bekanntmachungsdatum)\n\nHessen Amtsgericht Bad Hersfeld VR 1943\nSonstige Registerbekanntmachung 17.12.2024 (Eintragungsdatum)\n\nFörderverein Haus der kleinen Freunde e. V.\neingetragener Verein\nNiederaula-Niederjossa\n\nDer Verein ist aufgelöst."
    },
    {
      "date": "2024-12-17",
      "id": "96743",
      "original_text": "Registerbekanntmachung nach dem Umwandlungsgesetz\nHessen Amtsgericht Darmstadt HRB 5152\nValmet GmbH – Darmstadt",
      "type": "Registerbekanntmachung nach dem Umwandlungsgesetz",
      "state": "Hessen",
      "amtsgericht": "Amtsgericht Darmstadt",
      "registernummer": "HRB 5152",
      "registerart": "HRB",
      "company_name": "Valmet GmbH",
      "company_seat": "Darmstadt",
      "details": "17.12.2024 (Bekanntmachungsdatum)\n\nHessen Amtsgericht Darmstadt HRB 5152\nRegisterbekanntmachung nach dem Umwandlungsgesetz 17.12.2024 (Eintragungsdatum)\n\nValmet GmbH\nGesellschaft mit beschränkter Haftung\nDarmstadt\n\nDen Gläubigern der an der Verschmelzung beteiligten Rechtsträger ist, wenn sie binnen sechs Monaten nach dem Tag, an dem die Eintragung der Verschmelzung in das Register des Sitzes derjenigen Rechtsträger deren Gläubiger sie sind, nach § 19 Absatz 3 UmwG bekannt gemacht worden ist, ihren Anspruch nach Grund und Höhe schriftlich anmelden, Sicherheit zu leisten, soweit sie nicht Befriedigung verlangen können. Dieses Recht steht den Gläubigern jedoch nur zu, wenn sie glaubhaft machen, dass durch die Verschmelzung die Erfüllung ihrer Forderung gefährdet wird."
    },
    {
      "date": "2024-12-17",
      "id": "96744",
      "original_text": "Registerbekanntmachung nach dem Umwandlungsgesetz\nHessen Amtsgericht Offenbach am Main HRB 47947\nKIV Immobilien- und Vermögensverwaltung GmbH – Langen (Hessen)",
      "type": "Registerbekanntmachung nach dem Umwandlungsgesetz",
      "state": "Hessen",
      "amtsgericht": "Amtsgericht Offenbach am Main",
      "registernummer": "HRB 47947",
      "registerart": "HRB",
      "company_name": "KIV Immobilien- und Vermögensverwaltung GmbH",
      "company_seat": "Langen (Hessen)",
      "details": "17.12.2024 (Bekanntmachungsdatum)\n\nHessen Amtsgericht Offenbach am Main HRB 47947\nRegisterbekanntmachung nach dem Umwandlungsgesetz 17.12.2024 (Eintragungsdatum)\n\nKIV Immobilien- und Vermögensverwaltung GmbH\nGesellschaft mit beschränkter Haftung\nLangen (Hessen)\n\nDen Gläubigern der an der Verschmelzung beteiligten Rechtsträger ist, wenn sie binnen sechs Monaten nach dem Tag, an dem die Eintragung der Verschmelzung in das Register des Sitzes desjenigen Rechtsträgers, dessen Gläubiger sie sind, nach § 19 Absatz 3 UmwG bekannt gemacht worden ist, ihren Anspruch nach Grund und Höhe schriftlich anmelden, Sicherheit zu leisten, soweit sie nicht Befriedigung verlangen können. Dieses Recht steht den Gläubigern jedoch nur zu, wenn sie glaubhaft machen, dass durch die Verschmelzung die Erfüllung ihrer Forderung gefährdet wird."
    },
    {
      "date": "2024-12-17",
      "id": "96745",
      "original_text": "Registerbekanntmachung nach dem Umwandlungsgesetz\nHessen Amtsgericht Wiesbaden GsR 244\nTRANS-CAR SRL & Co eGbR – Wiesbaden",
      "type": "Registerbekanntmachung nach dem Umwandlungsgesetz",
      "state": "Hessen",
      "amtsgericht": "Amtsgericht Wiesbaden",
      "registernummer": "GsR 244",
      "registerart": "GsR",
      "company_name": "TRANS-CAR SRL & Co eGbR",
      "company_seat": "Wiesbaden",
      "details": "17.12.2024 (Bekanntmachungsdatum)\n\nHessen Amtsgericht Wiesbaden GsR 244\nRegisterbekanntmachung nach dem Umwandlungsgesetz 17.12.2024 (Eintragungsdatum)\n\nTRANS-CAR SRL & Co eGbR\nGesellschaft bürgerlichen Rechts\nWiesbaden\n\nDen Gläubigern der an der formwechselnden Umwandlung beteiligten Rechtsträger ist, wenn sie binnen sechs Monaten nach dem Tag, an dem die Eintragung der formwechselnden Umwandlung in das Register des Sitzes derjenigen Rechtsträger deren Gläubiger sie sind, nach § 201 UmwG bekannt gemacht worden ist, ihren Anspruch nach Grund und Höhe schriftlich anmelden, Sicherheit zu leisten, soweit sie nicht Befriedigung verlangen können. Dieses Recht steht den Gläubigern jedoch nur zu, wenn sie glaubhaft machen, dass durch die formwechselnden Umwandlung die Erfüllung ihrer Forderung gefährdet wird."
    },
    {
      "date": "2024-12-17",
      "id": "96746",
      "original_text": "Registerbekanntmachung nach dem Umwandlungsgesetz\nHessen Amtsgericht Wiesbaden HRB 29880\nHCW Exhibitions GmbH – Wiesbaden",
      "type": "Registerbekanntmachung nach dem Umwandlungsgesetz",
      "state": "Hessen",
      "amtsgericht": "Amtsgericht Wiesbaden",
      "registernummer": "HRB 29880",
      "registerart": "HRB",
      "company_name": "HCW Exhibitions GmbH",
      "company_seat": "Wiesbaden",
      "details": "17.12.2024 (Bekanntmachungsdatum)\n\nHessen Amtsgericht Wiesbaden HRB 29880\nRegisterbekanntmachung nach dem Umwandlungsgesetz 17.12.2024 (Eintragungsdatum)\n\nHCW Exhibitions GmbH\nGesellschaft mit beschränkter Haftung\nWiesbaden\n\nDen Gläubigern der an der formwechselnden Umwandlung beteiligten Rechtsträger ist, wenn sie binnen sechs Monaten nach dem Tag, an dem die Eintragung der formwechselnden Umwandlung in das Register des Sitzes derjenigen Rechtsträger deren Gläubiger sie sind, nach § 201 UmwG bekannt gemacht worden ist, ihren Anspruch nach Grund und Höhe schriftlich anmelden, Sicherheit zu leisten, soweit sie nicht Befriedigung verlangen können. Dieses Recht steht den Gläubigern jedoch nur zu, wenn sie glaubhaft machen, dass durch die formwechselnden Umwandlung die Erfüllung ihrer Forderung gefährdet wird."
    },
    {
      "date": "2024-12-17",
      "id": "96747",
      "original_text": "Einreichung neuer Dokumente\nHessen Amtsgericht Wiesbaden HRB 31741\nNEWVISIONVEST AG – Wiesbaden",
      "type": "Einreichung neuer Dokumente",
      "state": "Hessen",
      "amtsgericht": "Amtsgericht Wiesbaden",
      "registernummer": "HRB 31741",
      "registerart": "HRB",
      "company_name": "NEWVISIONVEST AG",
      "company_seat": "Wiesbaden",
      "details": "17.12.2024 (Bekanntmachungsdatum)\n\nHessen Amtsgericht Wiesbaden HRB 31741\nEinreichung neuer Dokumente 17.12.2024 (Eintragungsdatum)\n\nNEWVISIONVEST AG\nAktiengesellschaft\nWiesbaden\n\nDurch eine Änderung in den Personen der Aufsichtsratsmitglieder ist eine Liste der Mitglieder des Aufsichtsrates zum Handelsregister eingereicht worden."
    },
    {
      "date": "2024-12-17",
      "id": "96748",
      "original_text": "Registerbekanntmachung nach dem Umwandlungsgesetz\nHessen Amtsgericht Frankfurt am Main HRB 86719\nWallenborn Deutschland GmbH – Frankfurt am Main",
      "type": "Registerbekanntmachung nach dem Umwandlungsgesetz",
      "state": "Hessen",
      "amtsgericht": "Amtsgericht Frankfurt am Main",
      "registernummer": "HRB 86719",
      "registerart": "HRB",
      "company_name": "Wallenborn Deutschland GmbH",
      "company_seat": "Frankfurt am Main",
      "details": "17.12.2024 (Bekanntmachungsdatum)\n\nHessen Amtsgericht Frankfurt am Main HRB 86719\nRegisterbekanntmachung nach dem Umwandlungsgesetz 17.12.2024 (Eintragungsdatum)\n\nWallenborn Deutschland GmbH\nGesellschaft mit beschränkter Haftung\nFrankfurt am Main\n\nDen Gläubigern der an der Verschmelzung beteiligten Rechtsträger ist, wenn sie binnen sechs Monaten nach dem Tag, an dem die Eintragung der Verschmelzung in das Register des Sitzes desjenigen Rechtsträgers, dessen Gläubiger sie sind, nach § 19 Absatz 3 UmwG bekannt gemacht worden ist, ihren Anspruch nach Grund und Höhe schriftlich anmelden, Sicherheit zu leisten, soweit sie nicht Befriedigung verlangen können. Dieses Recht steht den Gläubigern jedoch nur zu, wenn sie glaubhaft machen, dass durch die Verschmelzung die Erfüllung ihrer Forderung gefährdet wird."
    },
    {
      "date": "2024-12-17",
      "id": "96749",
      "original_text": "Registerbekanntmachung nach dem Umwandlungsgesetz\nHessen Amtsgericht Fulda HRB 6982\nGiebel Hoch- und Tiefbau AG – Eiterfeld",
      "type": "Registerbekanntmachung nach dem Umwandlungsgesetz",
      "state": "Hessen",
      "amtsgericht": "Amtsgericht Fulda",
      "registernummer": "HRB 6982",
      "registerart": "HRB",
      "company_name": "Giebel Hoch- und Tiefbau AG",
      "company_seat": "Eiterfeld",
      "details": "17.12.2024 (Bekanntmachungsdatum)\n\nHessen Amtsgericht Fulda HRB 6982\nRegisterbekanntmachung nach dem Umwandlungsgesetz 17.12.2024 (Eintragungsdatum)\n\nGiebel Hoch- und Tiefbau AG\nAktiengesellschaft\nEiterfeld\n\nDen Gläubigern der an der Abspaltung beteiligten Rechtsträger ist, wenn sie binnen sechs Monaten nach dem Tag, an dem die Eintragung der Abspaltung in das Register des Sitzes desjenigen Rechtsträgers, dessen Gläubiger sie sind, nach §§ 125, 19 Absatz 3 UmwG bekannt gemacht worden ist, ihren Anspruch nach Grund und Höhe schriftlich anmelden, Sicherheit zu leisten, soweit sie nicht Befriedigung verlangen können. Dieses Recht steht den Gläubigern jedoch nur zu, wenn sie glaubhaft machen, dass durch die Abspaltung die Erfüllung ihrer Forderung gefährdet wird."
    },
    {
      "date": "2024-12-17",
      "id": "96750",
      "original_text": "Einreichung neuer Dokumente\nHessen Amtsgericht Offenbach am Main HRB 43873\nSport und Freizeit GmbH Offenbach – Offenbach am Main",
      "type": "Einreichung neuer Dokumente",
      "state": "Hessen",
      "amtsgericht": "Amtsgericht Offenbach am Main",
      "registernummer": "HRB 43873",
      "registerart": "HRB",
      "company_name": "Sport und Freizeit GmbH Offenbach",
      "company_seat": "Offenbach am Main",
      "details": "17.12.2024 (Bekanntmachungsdatum)\n\nHessen Amtsgericht Offenbach am Main HRB 43873\nEinreichung neuer Dokumente\n\nSport und Freizeit GmbH Offenbach\nGesellschaft mit beschränkter Haftung\nOffenbach am Main\n\nDurch eine Änderung in den Personen der Aufsichtsratsmitglieder ist eine Liste der Mitglieder des Aufsichtsrates zum Handelsregister eingereicht worden."
    },
    {
      "date": "2024-12-17",
      "id": "96751",
      "original_text": "Löschungsankündigung\nHessen Amtsgericht Offenbach am Main HRB 50249\nDelta Gebäudedienste GmbH – Offenbach am Main",
      "type": "Löschungsankündigung",
      "state": "Hessen",
      "amtsgericht": "Amtsgericht Offenbach am Main",
      "registernummer": "HRB 50249",
      "registerart": "HRB",
      "company_name": "Delta Gebäudedienste GmbH",
      "company_seat": "Offenbach am Main",
      "details": "17.12.2024 (Bekanntmachungsdatum)\n\nHessen Amtsgericht Offenbach am Main HRB 50249\nLöschungsankündigung\n\nDelta Gebäudedienste GmbH\nGesellschaft mit beschränkter Haftung\nOffenbach am Main\n\nDas Registergericht beabsichtigt die im Handelsregister eingetragene Gesellschaft von Amts wegen nach § 394 FamFG zu löschen. Die Frist zur Erhebung eines Widerspruchs gegen die beabsichtigte Löschung wird auf 3 Monate festgesetzt."
    },
    {
      "date": "2024-12-17",
      "id": "96752",
      "original_text": "Registerbekanntmachung nach dem Umwandlungsgesetz\nHessen Amtsgericht Darmstadt HRB 85800\nValmet Plattling GmbH – Darmstadt",
      "type": "Registerbekanntmachung nach dem Umwandlungsgesetz",
      "state": "Hessen",
      "amtsgericht": "Amtsgericht Darmstadt",
      "registernummer": "HRB 85800",
      "registerart": "HRB",
      "company_name": "Valmet Plattling GmbH",
      "company_seat": "Darmstadt",
      "details": "17.12.2024 (Bekanntmachungsdatum)\n\nHessen Amtsgericht Darmstadt HRB 85800\nRegisterbekanntmachung nach dem Umwandlungsgesetz 17.12.2024 (Eintragungsdatum)\n\nValmet Plattling GmbH\nGesellschaft mit beschränkter Haftung\nDarmstadt\n\nDen Gläubigern der an der Verschmelzung beteiligten Rechtsträger ist, wenn sie binnen sechs Monaten nach dem Tag, an dem die Eintragung der Verschmelzung in das Register des Sitzes derjenigen Rechtsträger deren Gläubiger sie sind, nach § 19 Absatz 3 UmwG bekannt gemacht worden ist, ihren Anspruch nach Grund und Höhe schriftlich anmelden, Sicherheit zu leisten, soweit sie nicht Befriedigung verlangen können. Dieses Recht steht den Gläubigern jedoch nur zu, wenn sie glaubhaft machen, dass durch die Verschmelzung die Erfüllung ihrer Forderung gefährdet wird."
    }
  ]
}