{
  "date": "2024-12-05",
  "date_of_scrape": "2024-12-06T04:08:52.640Z",
  "tool_version": "0.2.0",
  "number_of_announcements": 155,
  "announcements": [
    {
      "date": "2024-12-05",
      "id": "95444",
      "original_text": "Registerbekanntmachung nach dem Umwandlungsgesetz\nBayern Amtsgericht Regensburg HRB 19433\nFuBa Assekuranz GmbH – Wenzenbach, Landkreis Regensburg",
      "type": "Registerbekanntmachung nach dem Umwandlungsgesetz",
      "state": "Bayern",
      "amtsgericht": "Amtsgericht Regensburg",
      "registernummer": "HRB 19433",
      "registerart": "HRB",
      "company_name": "FuBa Assekuranz GmbH",
      "company_seat": "Wenzenbach, Landkreis Regensburg",
      "details": "05.12.2024 (Bekanntmachungsdatum)\n\nBayern Amtsgericht Regensburg HRB 19433\nRegisterbekanntmachung nach dem Umwandlungsgesetz 04.12.2024 (Eintragungsdatum)\n\nFuBa Assekuranz GmbH\nGesellschaft mit beschränkter Haftung\nWenzenbach, Landkreis Regensburg\n\nDen Gläubigern der an der Verschmelzung beteiligten Rechtsträger ist, wenn sie binnen sechs Monaten nach dem Tag, an dem die Eintragung der Verschmelzung in das Register des Sitzes desjenigen Rechtsträgers, dessen Gläubiger sie sind, nach § 19 Abs. 3 UmwG als bekannt gemacht gilt, ihren Anspruch nach Grund und Höhe schriftlich anmelden, Sicherheit zu leisten, soweit sie nicht Befriedigung verlangen können. Dieses Recht steht den Gläubigern jedoch nur zu, wenn sie glaubhaft machen, dass durch die Verschmelzung die Erfüllung ihrer Forderung gefährdet wird."
    },
    {
      "date": "2024-12-05",
      "id": "95445",
      "original_text": "Löschungsankündigung\nBayern Amtsgericht Aschaffenburg HRB 14836\n2014 Stockholm UG (haftungsbeschränkt) – Alzenau",
      "type": "Löschungsankündigung",
      "state": "Bayern",
      "amtsgericht": "Amtsgericht Aschaffenburg",
      "registernummer": "HRB 14836",
      "registerart": "HRB",
      "company_name": "2014 Stockholm UG (haftungsbeschränkt)",
      "company_seat": "Alzenau",
      "details": "05.12.2024 (Bekanntmachungsdatum)\n\nBayern Amtsgericht Aschaffenburg HRB 14836\nLöschungsankündigung\n\n2014 Stockholm UG (haftungsbeschränkt)\nGesellschaft mit beschränkter Haftung\nAlzenau\n\nDas Registergericht beabsichtigt, die im Handelsregister eingetragene Gesellschaft wegen Vermögenslosigkeit von Amts wegen nach § 394 FamFG zu löschen. Die Frist zur Erhebung eines Widerspruchs ist auf drei Monate festgesetzt."
    },
    {
      "date": "2024-12-05",
      "id": "95446",
      "original_text": "Löschungsankündigung\nBayern Amtsgericht München HRB 265000\nBa Ne UG (haftungsbeschränkt) – München",
      "type": "Löschungsankündigung",
      "state": "Bayern",
      "amtsgericht": "Amtsgericht München",
      "registernummer": "HRB 265000",
      "registerart": "HRB",
      "company_name": "Ba Ne UG (haftungsbeschränkt)",
      "company_seat": "München",
      "details": "05.12.2024 (Bekanntmachungsdatum)\n\nBayern Amtsgericht München HRB 265000\nLöschungsankündigung 04.12.2024 (Eintragungsdatum)\n\nBa Ne UG (haftungsbeschränkt)\nGesellschaft mit beschränkter Haftung\nMünchen\n\nDas Registergericht beabsichtigt, die im Handelsregister eingetragene Gesellschaft wegen Vermögenslosigkeit von Amts wegen nach § 394 FamFG zu löschen. Die Frist zur Erhebung eines Widerspruchs ist auf drei Monate festgesetzt."
    },
    {
      "date": "2024-12-05",
      "id": "95447",
      "original_text": "Einreichung neuer Dokumente\nBayern Amtsgericht München HRB 176566\niShares (DE) I Investmentaktiengesellschaft mit Teilgesellschaftsvermögen – München",
      "type": "Einreichung neuer Dokumente",
      "state": "Bayern",
      "amtsgericht": "Amtsgericht München",
      "registernummer": "HRB 176566",
      "registerart": "HRB",
      "company_name": "iShares (DE) I Investmentaktiengesellschaft mit Teilgesellschaftsvermögen",
      "company_seat": "München",
      "details": "05.12.2024 (Bekanntmachungsdatum)\n\nBayern Amtsgericht München HRB 176566\nEinreichung neuer Dokumente\n\niShares (DE) I Investmentaktiengesellschaft mit Teilgesellschaftsvermögen\nAktiengesellschaft\nMünchen\n\nDem Amtsgericht München -Registergericht- ist eine Liste der Mitglieder des Aufsichtsrats eingereicht worden, § 106 AktG."
    },
    {
      "date": "2024-12-05",
      "id": "95448",
      "original_text": "Löschungsankündigung\nBayern Amtsgericht München HRB 272762\nRaj Bau Service GmbH – München",
      "type": "Löschungsankündigung",
      "state": "Bayern",
      "amtsgericht": "Amtsgericht München",
      "registernummer": "HRB 272762",
      "registerart": "HRB",
      "company_name": "Raj Bau Service GmbH",
      "company_seat": "München",
      "details": "05.12.2024 (Bekanntmachungsdatum)\n\nBayern Amtsgericht München HRB 272762\nLöschungsankündigung 04.12.2024 (Eintragungsdatum)\n\nRaj Bau Service GmbH\nGesellschaft mit beschränkter Haftung\nMünchen\n\nDas Registergericht beabsichtigt, die im Handelsregister eingetragene Gesellschaft wegen Vermögenslosigkeit von Amts wegen nach § 394 FamFG zu löschen. Die Frist zur Erhebung eines Widerspruchs ist auf drei Monate festgesetzt."
    },
    {
      "date": "2024-12-05",
      "id": "95449",
      "original_text": "Registerbekanntmachung nach dem Umwandlungsgesetz\nBayern Amtsgericht München HRB 289271\nFNZ Bank SE – Aschheim",
      "type": "Registerbekanntmachung nach dem Umwandlungsgesetz",
      "state": "Bayern",
      "amtsgericht": "Amtsgericht München",
      "registernummer": "HRB 289271",
      "registerart": "HRB",
      "company_name": "FNZ Bank SE",
      "company_seat": "Aschheim",
      "details": "05.12.2024 (Bekanntmachungsdatum)\n\nBayern Amtsgericht München HRB 289271\nRegisterbekanntmachung nach dem Umwandlungsgesetz 04.12.2024 (Eintragungsdatum)\n\nFNZ Bank SE\nEuropäische Aktiengesellschaft (SE)\nAschheim\n\nDen Gläubigern der an der Spaltung beteiligten Rechtsträger ist, wenn sie binnen sechs Monaten nach dem Tag, an dem die Eintragung der Spaltung in das Register des Sitzes desjenigen Rechtsträgers, dessen Gläubiger sie sind, nach §§ 125, 19 Abs. 3 UmwG als bekannt gemacht gilt, ihren Anspruch nach Grund und Höhe schriftlich anmelden, Sicherheit zu leisten, soweit sie nicht Befriedigung verlangen können. Dieses Recht steht den Gläubigern jedoch nur zu, wenn sie glaubhaft machen, dass durch die Spaltung die Erfüllung ihrer Forderung gefährdet wird."
    },
    {
      "date": "2024-12-05",
      "id": "95450",
      "original_text": "Löschungsankündigung\nBayern Amtsgericht München HRB 156025\nEUROLAND GmbH – München",
      "type": "Löschungsankündigung",
      "state": "Bayern",
      "amtsgericht": "Amtsgericht München",
      "registernummer": "HRB 156025",
      "registerart": "HRB",
      "company_name": "EUROLAND GmbH",
      "company_seat": "München",
      "details": "05.12.2024 (Bekanntmachungsdatum)\n\nBayern Amtsgericht München HRB 156025\nLöschungsankündigung 04.12.2024 (Eintragungsdatum)\n\nEUROLAND GmbH\nGesellschaft mit beschränkter Haftung\nMünchen\n\nDas Registergericht beabsichtigt, die im Handelsregister eingetragene Gesellschaft wegen Vermögenslosigkeit von Amts wegen nach § 394 FamFG zu löschen. Die Frist zur Erhebung eines Widerspruchs ist auf drei Monate festgesetzt."
    },
    {
      "date": "2024-12-05",
      "id": "95451",
      "original_text": "Einreichung neuer Dokumente\nBayern Amtsgericht München HRB 157279\nAmper Kliniken Aktiengesellschaft – Dachau",
      "type": "Einreichung neuer Dokumente",
      "state": "Bayern",
      "amtsgericht": "Amtsgericht München",
      "registernummer": "HRB 157279",
      "registerart": "HRB",
      "company_name": "Amper Kliniken Aktiengesellschaft",
      "company_seat": "Dachau",
      "details": "05.12.2024 (Bekanntmachungsdatum)\n\nBayern Amtsgericht München HRB 157279\nEinreichung neuer Dokumente\n\nAmper Kliniken Aktiengesellschaft\nAktiengesellschaft\nDachau\n\nDem Amtsgericht München -Registergericht- ist eine Liste der Mitglieder des Aufsichtsrats eingereicht worden, § 106 AktG."
    },
    {
      "date": "2024-12-05",
      "id": "95452",
      "original_text": "Löschungsankündigung\nBayern Amtsgericht München HRB 117274\nAWS Kurierservice GmbH – Karlsfeld",
      "type": "Löschungsankündigung",
      "state": "Bayern",
      "amtsgericht": "Amtsgericht München",
      "registernummer": "HRB 117274",
      "registerart": "HRB",
      "company_name": "AWS Kurierservice GmbH",
      "company_seat": "Karlsfeld",
      "details": "05.12.2024 (Bekanntmachungsdatum)\n\nBayern Amtsgericht München HRB 117274\nLöschungsankündigung\n\nAWS Kurierservice GmbH\nGesellschaft mit beschränkter Haftung\nKarlsfeld\n\nDas Registergericht beabsichtigt, die im Handelsregister eingetragene Gesellschaft wegen Vermögenslosigkeit von Amts wegen nach § 394 FamFG zu löschen. Die Frist zur Erhebung eines Widerspruchs ist auf drei Monate festgesetzt."
    },
    {
      "date": "2024-12-05",
      "id": "95453",
      "original_text": "Registerbekanntmachung nach dem Umwandlungsgesetz\nBayern Amtsgericht Bamberg GsR 148\nHirschmann Mohnkorn eGbR – Eggolsheim",
      "type": "Registerbekanntmachung nach dem Umwandlungsgesetz",
      "state": "Bayern",
      "amtsgericht": "Amtsgericht Bamberg",
      "registernummer": "GsR 148",
      "registerart": "GsR",
      "company_name": "Hirschmann Mohnkorn eGbR",
      "company_seat": "Eggolsheim",
      "details": "05.12.2024 (Bekanntmachungsdatum)\n\nBayern Amtsgericht Bamberg GsR 148\nRegisterbekanntmachung nach dem Umwandlungsgesetz 04.12.2024 (Eintragungsdatum)\n\nHirschmann Mohnkorn eGbR\nGesellschaft bürgerlichen Rechts\nEggolsheim\n\nDen Gläubigern der an der Verschmelzung beteiligten Rechtsträger ist, wenn sie binnen sechs Monaten nach dem Tag, an dem die Eintragung der Verschmelzung in das Register des Sitzes desjenigen Rechtsträgers, dessen Gläubiger sie sind, nach § 19 Abs. 3 UmwG als bekannt gemacht gilt, ihren Anspruch nach Grund und Höhe schriftlich anmelden, Sicherheit zu leisten, soweit sie nicht Befriedigung verlangen können. Dieses Recht steht den Gläubigern jedoch nur zu, wenn sie glaubhaft machen, dass durch die Verschmelzung die Erfüllung ihrer Forderung gefährdet wird."
    },
    {
      "date": "2024-12-05",
      "id": "95454",
      "original_text": "Löschungsankündigung\nBayern Amtsgericht München HRB 163160\nGecko Services GmbH – München",
      "type": "Löschungsankündigung",
      "state": "Bayern",
      "amtsgericht": "Amtsgericht München",
      "registernummer": "HRB 163160",
      "registerart": "HRB",
      "company_name": "Gecko Services GmbH",
      "company_seat": "München",
      "details": "05.12.2024 (Bekanntmachungsdatum)\n\nBayern Amtsgericht München HRB 163160\nLöschungsankündigung 04.12.2024 (Eintragungsdatum)\n\nGecko Services GmbH\nGesellschaft mit beschränkter Haftung\nMünchen\n\nDas Registergericht beabsichtigt, die im Handelsregister eingetragene Gesellschaft wegen Vermögenslosigkeit von Amts wegen nach § 394 FamFG zu löschen. Die Frist zur Erhebung eines Widerspruchs ist auf drei Monate festgesetzt."
    },
    {
      "date": "2024-12-05",
      "id": "95455",
      "original_text": "Löschungsankündigung\nBayern Amtsgericht Kempten (Allgäu) HRB 14711\nSvL Media UG (haftungsbeschränkt) – Kaufbeuren",
      "type": "Löschungsankündigung",
      "state": "Bayern",
      "amtsgericht": "Amtsgericht Kempten (Allgäu)",
      "registernummer": "HRB 14711",
      "registerart": "HRB",
      "company_name": "SvL Media UG (haftungsbeschränkt)",
      "company_seat": "Kaufbeuren",
      "details": "05.12.2024 (Bekanntmachungsdatum)\n\nBayern Amtsgericht Kempten (Allgäu) HRB 14711\nLöschungsankündigung\n\nSvL Media UG (haftungsbeschränkt)\nGesellschaft mit beschränkter Haftung\nKaufbeuren\n\nDas Registergericht beabsichtigt, die im Handelsregister eingetragene Gesellschaft wegen Vermögenslosigkeit von Amts wegen nach § 394 FamFG zu löschen. Die Frist zur Erhebung eines Widerspruchs ist auf einen Monat festgesetzt."
    },
    {
      "date": "2024-12-05",
      "id": "95456",
      "original_text": "Registerbekanntmachung nach dem Umwandlungsgesetz\nBayern Amtsgericht München HRB 222347\nDigitronics GmbH – München",
      "type": "Registerbekanntmachung nach dem Umwandlungsgesetz",
      "state": "Bayern",
      "amtsgericht": "Amtsgericht München",
      "registernummer": "HRB 222347",
      "registerart": "HRB",
      "company_name": "Digitronics GmbH",
      "company_seat": "München",
      "details": "05.12.2024 (Bekanntmachungsdatum)\n\nBayern Amtsgericht München HRB 222347\nRegisterbekanntmachung nach dem Umwandlungsgesetz 04.12.2024 (Eintragungsdatum)\n\nDigitronics GmbH\nGesellschaft mit beschränkter Haftung\nMünchen\n\nDen Gläubigern der an der Verschmelzung beteiligten Rechtsträger ist, wenn sie binnen sechs Monaten nach dem Tag, an dem die Eintragung der Verschmelzung in das Register des Sitzes desjenigen Rechtsträgers, dessen Gläubiger sie sind, nach § 19 Abs. 3 UmwG als bekannt gemacht gilt, ihren Anspruch nach Grund und Höhe schriftlich anmelden, Sicherheit zu leisten, soweit sie nicht Befriedigung verlangen können. Dieses Recht steht den Gläubigern jedoch nur zu, wenn sie glaubhaft machen, dass durch die Verschmelzung die Erfüllung ihrer Forderung gefährdet wird."
    },
    {
      "date": "2024-12-05",
      "id": "95457",
      "original_text": "Einreichung neuer Dokumente\nBayern Amtsgericht München HRB 298093\nTradevest Markets AG – München",
      "type": "Einreichung neuer Dokumente",
      "state": "Bayern",
      "amtsgericht": "Amtsgericht München",
      "registernummer": "HRB 298093",
      "registerart": "HRB",
      "company_name": "Tradevest Markets AG",
      "company_seat": "München",
      "details": "05.12.2024 (Bekanntmachungsdatum)\n\nBayern Amtsgericht München HRB 298093\nEinreichung neuer Dokumente 04.12.2024 (Eintragungsdatum)\n\nTradevest Markets AG\nAktiengesellschaft\nMünchen\n\nDem Amtsgericht München -Registergericht- ist eine Liste der Mitglieder des Aufsichtsrats eingereicht worden, § 106 AktG."
    },
    {
      "date": "2024-12-05",
      "id": "95458",
      "original_text": "Sonstige Registerbekanntmachung\nBayern Amtsgericht München HRB 206240\nGLL Real Estate Partners Kapitalverwaltungsgesellschaft mbH – München",
      "type": "Sonstige Registerbekanntmachung",
      "state": "Bayern",
      "amtsgericht": "Amtsgericht München",
      "registernummer": "HRB 206240",
      "registerart": "HRB",
      "company_name": "GLL Real Estate Partners Kapitalverwaltungsgesellschaft mbH",
      "company_seat": "München",
      "details": "05.12.2024 (Bekanntmachungsdatum)\n\nBayern Amtsgericht München HRB 206240\nSonstige Registerbekanntmachung 03.12.2024 (Eintragungsdatum)\n\nGLL Real Estate Partners Kapitalverwaltungsgesellschaft mbH\nGesellschaft mit beschränkter Haftung\nMünchen\n\nDem Amtsgericht München -Registergericht- ist eine Liste der Mitglieder des Aufsichtsrats eingereicht worden, § 52 Abs. 3 S. 2 GmbHG."
    },
    {
      "date": "2024-12-05",
      "id": "95459",
      "original_text": "Löschungsankündigung\nBayern Amtsgericht München HRB 211781\nSchuhbeck's Wein-Depot AG – München",
      "type": "Löschungsankündigung",
      "state": "Bayern",
      "amtsgericht": "Amtsgericht München",
      "registernummer": "HRB 211781",
      "registerart": "HRB",
      "company_name": "Schuhbeck's Wein-Depot AG",
      "company_seat": "München",
      "details": "05.12.2024 (Bekanntmachungsdatum)\n\nBayern Amtsgericht München HRB 211781\nLöschungsankündigung\n\nSchuhbeck's Wein-Depot AG\nAktiengesellschaft\nMünchen\n\nDas Registergericht beabsichtigt, die im Handelsregister eingetragene Gesellschaft wegen Vermögenslosigkeit von Amts wegen nach § 394 FamFG zu löschen. Die Frist zur Erhebung eines Widerspruchs ist auf drei Monate festgesetzt."
    },
    {
      "date": "2024-12-05",
      "id": "95460",
      "original_text": "Registerbekanntmachung nach dem Umwandlungsgesetz\nBayern Amtsgericht Traunstein HRB 28819\nJM Naturholzböden GmbH – Kiefersfelden",
      "type": "Registerbekanntmachung nach dem Umwandlungsgesetz",
      "state": "Bayern",
      "amtsgericht": "Amtsgericht Traunstein",
      "registernummer": "HRB 28819",
      "registerart": "HRB",
      "company_name": "JM Naturholzböden GmbH",
      "company_seat": "Kiefersfelden",
      "details": "05.12.2024 (Bekanntmachungsdatum)\n\nBayern Amtsgericht Traunstein HRB 28819\nRegisterbekanntmachung nach dem Umwandlungsgesetz 04.12.2024 (Eintragungsdatum)\n\nJM Naturholzböden GmbH\nGesellschaft mit beschränkter Haftung\nKiefersfelden\n\nDen Gläubigern der an der Verschmelzung beteiligten Rechtsträger ist, wenn sie binnen sechs Monaten nach dem Tag, an dem die Eintragung der Verschmelzung in das Register des Sitzes desjenigen Rechtsträgers, dessen Gläubiger sie sind, nach § 19 Abs. 3 UmwG als bekannt gemacht gilt, ihren Anspruch nach Grund und Höhe schriftlich anmelden, Sicherheit zu leisten, soweit sie nicht Befriedigung verlangen können. Dieses Recht steht den Gläubigern jedoch nur zu, wenn sie glaubhaft machen, dass durch die Verschmelzung die Erfüllung ihrer Forderung gefährdet wird."
    },
    {
      "date": "2024-12-05",
      "id": "95461",
      "original_text": "Registerbekanntmachung nach dem Umwandlungsgesetz\nBayern Amtsgericht Nürnberg HRB 29473\nWein-Plus Solutions GmbH – Nürnberg",
      "type": "Registerbekanntmachung nach dem Umwandlungsgesetz",
      "state": "Bayern",
      "amtsgericht": "Amtsgericht Nürnberg",
      "registernummer": "HRB 29473",
      "registerart": "HRB",
      "company_name": "Wein-Plus Solutions GmbH",
      "company_seat": "Nürnberg",
      "details": "05.12.2024 (Bekanntmachungsdatum)\n\nBayern Amtsgericht Nürnberg HRB 29473\nRegisterbekanntmachung nach dem Umwandlungsgesetz 04.12.2024 (Eintragungsdatum)\n\nWein-Plus Solutions GmbH\nGesellschaft mit beschränkter Haftung\nNürnberg\n\nDen Gläubigern des formwechselnden Rechtsträgers ist, wenn sie binnen sechs Monaten nach dem Tag, an dem die Eintragung des Formwechsels nach § 201 UmwG als bekannt gemacht gilt, ihren Anspruch nach Grund und Höhe schriftlich anmelden, Sicherheit zu leisten, soweit sie nicht Befriedigung verlangen können. Dieses Recht steht den Gläubigern jedoch nur zu, wenn sie glaubhaft machen, dass durch den Formwechsel die Erfüllung ihrer Forderung gefährdet wird."
    },
    {
      "date": "2024-12-05",
      "id": "95462",
      "original_text": "Registerbekanntmachung nach dem Umwandlungsgesetz\nBayern Amtsgericht Fürth HRA 12398\nKertesz Plakatmedien GmbH & Co. KG – Oberasbach",
      "type": "Registerbekanntmachung nach dem Umwandlungsgesetz",
      "state": "Bayern",
      "amtsgericht": "Amtsgericht Fürth",
      "registernummer": "HRA 12398",
      "registerart": "HRA",
      "company_name": "Kertesz Plakatmedien GmbH & Co. KG",
      "company_seat": "Oberasbach",
      "details": "05.12.2024 (Bekanntmachungsdatum)\n\nBayern Amtsgericht Fürth HRA 12398\nRegisterbekanntmachung nach dem Umwandlungsgesetz 04.12.2024 (Eintragungsdatum)\n\nKertesz Plakatmedien GmbH & Co. KG\nKommanditgesellschaft\nOberasbach\n\nDen Gläubigern der an der Ausgliederung beteiligten Rechtsträger ist, wenn sie binnen sechs Monaten nach dem Tag, an dem die Eintragung der Ausgliederung in das Register des Sitzes desjenigen Rechtsträgers, dessen Gläubiger sie sind, nach §§ 125, 19 Abs. 3 UmwG als bekannt gemacht gilt, ihren Anspruch nach Grund und Höhe schriftlich anmelden, Sicherheit zu leisten, soweit sie nicht Befriedigung verlangen können. Dieses Recht steht den Gläubigern jedoch nur zu, wenn sie glaubhaft machen, dass durch die Ausgliederung die Erfüllung ihrer Forderung gefährdet wird."
    },
    {
      "date": "2024-12-05",
      "id": "95463",
      "original_text": "Löschungsankündigung\nBayern Amtsgericht Kempten (Allgäu) HRB 14273\nPfronten Solar Vertriebs UG (haftungsbeschränkt) – Pfronten",
      "type": "Löschungsankündigung",
      "state": "Bayern",
      "amtsgericht": "Amtsgericht Kempten (Allgäu)",
      "registernummer": "HRB 14273",
      "registerart": "HRB",
      "company_name": "Pfronten Solar Vertriebs UG (haftungsbeschränkt)",
      "company_seat": "Pfronten",
      "details": "05.12.2024 (Bekanntmachungsdatum)\n\nBayern Amtsgericht Kempten (Allgäu) HRB 14273\nLöschungsankündigung\n\nPfronten Solar Vertriebs UG (haftungsbeschränkt)\nGesellschaft mit beschränkter Haftung\nPfronten\n\nDas Registergericht beabsichtigt, die im Handelsregister eingetragene Gesellschaft wegen Vermögenslosigkeit von Amts wegen nach § 394 FamFG zu löschen. Die Frist zur Erhebung eines Widerspruchs ist auf einen Monat festgesetzt."
    },
    {
      "date": "2024-12-05",
      "id": "95464",
      "original_text": "Registerbekanntmachung nach dem Umwandlungsgesetz\nBayern Amtsgericht München HRB 222347\nDigitronics GmbH – München",
      "type": "Registerbekanntmachung nach dem Umwandlungsgesetz",
      "state": "Bayern",
      "amtsgericht": "Amtsgericht München",
      "registernummer": "HRB 222347",
      "registerart": "HRB",
      "company_name": "Digitronics GmbH",
      "company_seat": "München",
      "details": "05.12.2024 (Bekanntmachungsdatum)\n\nBayern Amtsgericht München HRB 222347\nRegisterbekanntmachung nach dem Umwandlungsgesetz 04.12.2024 (Eintragungsdatum)\n\nDigitronics GmbH\nGesellschaft mit beschränkter Haftung\nMünchen\n\nDen Gläubigern der an der Verschmelzung beteiligten Rechtsträger ist, wenn sie binnen sechs Monaten nach dem Tag, an dem die Eintragung der Verschmelzung in das Register des Sitzes desjenigen Rechtsträgers, dessen Gläubiger sie sind, nach § 19 Abs. 3 UmwG als bekannt gemacht gilt, ihren Anspruch nach Grund und Höhe schriftlich anmelden, Sicherheit zu leisten, soweit sie nicht Befriedigung verlangen können. Dieses Recht steht den Gläubigern jedoch nur zu, wenn sie glaubhaft machen, dass durch die Verschmelzung die Erfüllung ihrer Forderung gefährdet wird."
    },
    {
      "date": "2024-12-05",
      "id": "95465",
      "original_text": "Registerbekanntmachung nach dem Umwandlungsgesetz\nBayern Amtsgericht Bamberg HRB 1702\nhimocon GmbH – Eggolsheim",
      "type": "Registerbekanntmachung nach dem Umwandlungsgesetz",
      "state": "Bayern",
      "amtsgericht": "Amtsgericht Bamberg",
      "registernummer": "HRB 1702",
      "registerart": "HRB",
      "company_name": "himocon GmbH",
      "company_seat": "Eggolsheim",
      "details": "05.12.2024 (Bekanntmachungsdatum)\n\nBayern Amtsgericht Bamberg HRB 1702\nRegisterbekanntmachung nach dem Umwandlungsgesetz 04.12.2024 (Eintragungsdatum)\n\nhimocon GmbH\nGesellschaft mit beschränkter Haftung\nEggolsheim\n\nDen Gläubigern der an der Verschmelzung beteiligten Rechtsträger ist, wenn sie binnen sechs Monaten nach dem Tag, an dem die Eintragung der Verschmelzung in das Register des Sitzes desjenigen Rechtsträgers, dessen Gläubiger sie sind, nach § 19 Abs. 3 UmwG als bekannt gemacht gilt, ihren Anspruch nach Grund und Höhe schriftlich anmelden, Sicherheit zu leisten, soweit sie nicht Befriedigung verlangen können. Dieses Recht steht den Gläubigern jedoch nur zu, wenn sie glaubhaft machen, dass durch die Verschmelzung die Erfüllung ihrer Forderung gefährdet wird."
    },
    {
      "date": "2024-12-05",
      "id": "95466",
      "original_text": "Löschungsankündigung\nBayern Amtsgericht Coburg HRB 4868\nSachwert Service GmbH – Coburg",
      "type": "Löschungsankündigung",
      "state": "Bayern",
      "amtsgericht": "Amtsgericht Coburg",
      "registernummer": "HRB 4868",
      "registerart": "HRB",
      "company_name": "Sachwert Service GmbH",
      "company_seat": "Coburg",
      "details": "05.12.2024 (Bekanntmachungsdatum)\n\nBayern Amtsgericht Coburg HRB 4868\nLöschungsankündigung\n\nSachwert Service GmbH\nGesellschaft mit beschränkter Haftung\nCoburg\n\nDas Registergericht beabsichtigt, die im Handelsregister eingetragene Gesellschaft wegen Vermögenslosigkeit von Amts wegen nach § 394 FamFG zu löschen. Die Frist zur Erhebung eines Widerspruchs ist auf sechs Wochen festgesetzt."
    },
    {
      "date": "2024-12-05",
      "id": "95467",
      "original_text": "Registerbekanntmachung nach dem Umwandlungsgesetz\nBayern Amtsgericht Fürth HRB 19588\nSHIFTSCHOOL GmbH – Fürth",
      "type": "Registerbekanntmachung nach dem Umwandlungsgesetz",
      "state": "Bayern",
      "amtsgericht": "Amtsgericht Fürth",
      "registernummer": "HRB 19588",
      "registerart": "HRB",
      "company_name": "SHIFTSCHOOL GmbH",
      "company_seat": "Fürth",
      "details": "05.12.2024 (Bekanntmachungsdatum)\n\nBayern Amtsgericht Fürth HRB 19588\nRegisterbekanntmachung nach dem Umwandlungsgesetz 04.12.2024 (Eintragungsdatum)\n\nSHIFTSCHOOL GmbH\nGesellschaft mit beschränkter Haftung\nFürth\n\nDen Gläubigern der an der Verschmelzung beteiligten Rechtsträger ist, wenn sie binnen sechs Monaten nach dem Tag, an dem die Eintragung der Verschmelzung in das Register des Sitzes desjenigen Rechtsträgers, dessen Gläubiger sie sind, nach § 19 Abs. 3 UmwG als bekannt gemacht gilt, ihren Anspruch nach Grund und Höhe schriftlich anmelden, Sicherheit zu leisten, soweit sie nicht Befriedigung verlangen können. Dieses Recht steht den Gläubigern jedoch nur zu, wenn sie glaubhaft machen, dass durch die Verschmelzung die Erfüllung ihrer Forderung gefährdet wird."
    },
    {
      "date": "2024-12-05",
      "id": "95468",
      "original_text": "Registerbekanntmachung nach dem Umwandlungsgesetz\nBayern Amtsgericht München HRB 96370\nModehaus Schreiner GmbH – München",
      "type": "Registerbekanntmachung nach dem Umwandlungsgesetz",
      "state": "Bayern",
      "amtsgericht": "Amtsgericht München",
      "registernummer": "HRB 96370",
      "registerart": "HRB",
      "company_name": "Modehaus Schreiner GmbH",
      "company_seat": "München",
      "details": "05.12.2024 (Bekanntmachungsdatum)\n\nBayern Amtsgericht München HRB 96370\nRegisterbekanntmachung nach dem Umwandlungsgesetz 04.12.2024 (Eintragungsdatum)\n\nModehaus Schreiner GmbH\nGesellschaft mit beschränkter Haftung\nMünchen\n\nDen Gläubigern der an der Verschmelzung beteiligten Rechtsträger ist, wenn sie binnen sechs Monaten nach dem Tag, an dem die Eintragung der Verschmelzung in das Register des Sitzes desjenigen Rechtsträgers, dessen Gläubiger sie sind, nach § 19 Abs. 3 UmwG als bekannt gemacht gilt, ihren Anspruch nach Grund und Höhe schriftlich anmelden, Sicherheit zu leisten, soweit sie nicht Befriedigung verlangen können. Dieses Recht steht den Gläubigern jedoch nur zu, wenn sie glaubhaft machen, dass durch die Verschmelzung die Erfüllung ihrer Forderung gefährdet wird."
    },
    {
      "date": "2024-12-05",
      "id": "95469",
      "original_text": "Löschungsankündigung\nBayern Amtsgericht München HRB 250040\nCRAFTWORK Bau GmbH – München",
      "type": "Löschungsankündigung",
      "state": "Bayern",
      "amtsgericht": "Amtsgericht München",
      "registernummer": "HRB 250040",
      "registerart": "HRB",
      "company_name": "CRAFTWORK Bau GmbH",
      "company_seat": "München",
      "details": "05.12.2024 (Bekanntmachungsdatum)\n\nBayern Amtsgericht München HRB 250040\nLöschungsankündigung 28.11.2024 (Eintragungsdatum)\n\nCRAFTWORK Bau GmbH\nGesellschaft mit beschränkter Haftung\nMünchen\n\nDas Registergericht beabsichtigt, die im Handelsregister eingetragene Gesellschaft wegen Vermögenslosigkeit von Amts wegen nach § 394 FamFG zu löschen. Die Frist zur Erhebung eines Widerspruchs ist auf drei Monate festgesetzt."
    },
    {
      "date": "2024-12-05",
      "id": "95470",
      "original_text": "Löschungsankündigung\nBayern Amtsgericht Hof HRB 1988\nSharon Vertriebs GmbH – Hof",
      "type": "Löschungsankündigung",
      "state": "Bayern",
      "amtsgericht": "Amtsgericht Hof",
      "registernummer": "HRB 1988",
      "registerart": "HRB",
      "company_name": "Sharon Vertriebs GmbH",
      "company_seat": "Hof",
      "details": "05.12.2024 (Bekanntmachungsdatum)\n\nBayern Amtsgericht Hof HRB 1988\nLöschungsankündigung\n\nSharon Vertriebs GmbH\nGesellschaft mit beschränkter Haftung\nHof\n\nDas Registergericht beabsichtigt, die im Handelsregister eingetragene Gesellschaft wegen Vermögenslosigkeit von Amts wegen nach § 394 FamFG zu löschen. Die Frist zur Erhebung eines Widerspruchs ist auf einen Monat festgesetzt."
    },
    {
      "date": "2024-12-05",
      "id": "95471",
      "original_text": "Einreichung neuer Dokumente\nBayern Amtsgericht München HRB 291526\nAlpina Parking Holding AG – München",
      "type": "Einreichung neuer Dokumente",
      "state": "Bayern",
      "amtsgericht": "Amtsgericht München",
      "registernummer": "HRB 291526",
      "registerart": "HRB",
      "company_name": "Alpina Parking Holding AG",
      "company_seat": "München",
      "details": "05.12.2024 (Bekanntmachungsdatum)\n\nBayern Amtsgericht München HRB 291526\nEinreichung neuer Dokumente 04.12.2024 (Eintragungsdatum)\n\nAlpina Parking Holding AG\nAktiengesellschaft\nMünchen\n\nDem Amtsgericht München -Registergericht- ist eine Liste der Mitglieder des Aufsichtsrats eingereicht worden, § 106 AktG."
    },
    {
      "date": "2024-12-05",
      "id": "95472",
      "original_text": "Registerbekanntmachung nach dem Umwandlungsgesetz\nBayern Amtsgericht Fürth HRB 13135\nLilly Banilly Ventures UG (haftungsbeschränkt) – Fürth",
      "type": "Registerbekanntmachung nach dem Umwandlungsgesetz",
      "state": "Bayern",
      "amtsgericht": "Amtsgericht Fürth",
      "registernummer": "HRB 13135",
      "registerart": "HRB",
      "company_name": "Lilly Banilly Ventures UG (haftungsbeschränkt)",
      "company_seat": "Fürth",
      "details": "05.12.2024 (Bekanntmachungsdatum)\n\nBayern Amtsgericht Fürth HRB 13135\nRegisterbekanntmachung nach dem Umwandlungsgesetz 04.12.2024 (Eintragungsdatum)\n\nLilly Banilly Ventures UG (haftungsbeschränkt)\nGesellschaft mit beschränkter Haftung\nFürth\n\nDen Gläubigern der an der Verschmelzung beteiligten Rechtsträger ist, wenn sie binnen sechs Monaten nach dem Tag, an dem die Eintragung der Verschmelzung in das Register des Sitzes desjenigen Rechtsträgers, dessen Gläubiger sie sind, nach § 19 Abs. 3 UmwG als bekannt gemacht gilt, ihren Anspruch nach Grund und Höhe schriftlich anmelden, Sicherheit zu leisten, soweit sie nicht Befriedigung verlangen können. Dieses Recht steht den Gläubigern jedoch nur zu, wenn sie glaubhaft machen, dass durch die Verschmelzung die Erfüllung ihrer Forderung gefährdet wird."
    },
    {
      "date": "2024-12-05",
      "id": "95473",
      "original_text": "Registerbekanntmachung nach dem Umwandlungsgesetz\nBayern Amtsgericht Fürth HRB 17261\nGGS Grundbesitz Burgbernheim GmbH – Burgbernheim",
      "type": "Registerbekanntmachung nach dem Umwandlungsgesetz",
      "state": "Bayern",
      "amtsgericht": "Amtsgericht Fürth",
      "registernummer": "HRB 17261",
      "registerart": "HRB",
      "company_name": "GGS Grundbesitz Burgbernheim GmbH",
      "company_seat": "Burgbernheim",
      "details": "05.12.2024 (Bekanntmachungsdatum)\n\nBayern Amtsgericht Fürth HRB 17261\nRegisterbekanntmachung nach dem Umwandlungsgesetz\n\nGGS Grundbesitz Burgbernheim GmbH\nGesellschaft mit beschränkter Haftung\nBurgbernheim\n\nDem Amtsgericht Fürth -Registergericht- ist am 21.11.2024 der Entwurf eines Formwechselplans eingereicht worden.\n1. Der Entwurf des Formwechselplans ist beim Handelsregister eingereicht.\n2. Die formwechselnde Gesellschaft firmiert unter GGS Grundbesitz Burgbernheim GmbH und hat die Rechtsform einer Gesellschaft mit beschränkter Haftung (GmbH). Ihr Sitz ist in Burgbernheim; die Gesellschaft ist eingetragen im Handelsregister des Amtsgerichts Fürth unter HRB 17261.\n3. Die Gesellschaft wird durch den Formwechsel die Rechtsform einer société à responsabilité limitée (S.à.r.l.) nach dem Recht des Großherzogtums Luxemburg erlangen. Sie wird ihren Sitz in der Stadt Luxemburg haben und unter der Firma \"GGS Grundbesitz Burgbernheim S.à.r.l.\" firmieren. Eingetragen wird die formgewechselte Gesellschaft im Handels- und Gesellschaftsregister (Registre de Commerce et des Sociétés; RCS) Luxemburg.\n4. Die Gesellschaft erteilt ihren Gläubigern nach Maßgabe der §§ 336, 308 Abs. 1 S. 2 Nr. 4a) UmwG den Hinweis, dass sie der Gesellschaft bis spätestens fünf Tage vor dem Tag der Gesellschafterversammlung, die am 16. Januar 2025 stattfinden wird, Bemerkungen zum Formwechselplan übermitteln können. Solche Bemerkungen sind zu richten an die GGS Grundbesitz Burgbernheim GmbH zu Händen von Herrn Karol Maziukiewic, c/o AS-Administrative Services GmbH, Platz der Einheit 2, 60327 Frankfurt am Main."
    },
    {
      "date": "2024-12-05",
      "id": "95474",
      "original_text": "Löschungsankündigung\nBayern Amtsgericht München HRB 231907\nELETI LIGHTING Germany GmbH – München",
      "type": "Löschungsankündigung",
      "state": "Bayern",
      "amtsgericht": "Amtsgericht München",
      "registernummer": "HRB 231907",
      "registerart": "HRB",
      "company_name": "ELETI LIGHTING Germany GmbH",
      "company_seat": "München",
      "details": "05.12.2024 (Bekanntmachungsdatum)\n\nBayern Amtsgericht München HRB 231907\nLöschungsankündigung 04.12.2024 (Eintragungsdatum)\n\nELETI LIGHTING Germany GmbH\nGesellschaft mit beschränkter Haftung\nMünchen\n\nDas Registergericht beabsichtigt, die im Handelsregister eingetragene Gesellschaft wegen Vermögenslosigkeit von Amts wegen nach § 394 FamFG zu löschen. Die Frist zur Erhebung eines Widerspruchs ist auf drei Monate festgesetzt."
    },
    {
      "date": "2024-12-05",
      "id": "95475",
      "original_text": "Einreichung neuer Dokumente\nBayern Amtsgericht München HRB 251577\nL´Osteria Restaurant SE – München",
      "type": "Einreichung neuer Dokumente",
      "state": "Bayern",
      "amtsgericht": "Amtsgericht München",
      "registernummer": "HRB 251577",
      "registerart": "HRB",
      "company_name": "L´Osteria Restaurant SE",
      "company_seat": "München",
      "details": "05.12.2024 (Bekanntmachungsdatum)\n\nBayern Amtsgericht München HRB 251577\nEinreichung neuer Dokumente\n\nL´Osteria Restaurant SE\nEuropäische Aktiengesellschaft (SE)\nMünchen\n\nDem Amtsgericht München -Registergericht- ist eine Liste der Mitglieder des Aufsichtsrats eingereicht worden, Art. 9 Abs. 1 Buchst. c (ii) SE-VO i.V.m. § 106 AktG."
    },
    {
      "date": "2024-12-05",
      "id": "95476",
      "original_text": "Löschungsankündigung\nBerlin Amtsgericht Berlin (Charlottenburg) HRB 78471\nAndreas Butze * Dienstleistungsgesellschaft mbH * – Berlin",
      "type": "Löschungsankündigung",
      "state": "Berlin",
      "amtsgericht": "Amtsgericht Berlin (Charlottenburg)",
      "registernummer": "HRB 78471",
      "registerart": "HRB",
      "company_name": "Andreas Butze * Dienstleistungsgesellschaft mbH *",
      "company_seat": "Berlin",
      "details": "05.12.2024 (Bekanntmachungsdatum)\n\nBerlin Amtsgericht Berlin (Charlottenburg) HRB 78471\nLöschungsankündigung\n\nAndreas Butze * Dienstleistungsgesellschaft mbH *\nGesellschaft mit beschränkter Haftung\nBerlin\n\nBei der nachstehenden Gesellschaft wird das Amtslöschungsverfahren gemäß § 394 FamFG eingeleitet. Widerspruchsfrist 6 Wochen"
    },
    {
      "date": "2024-12-05",
      "id": "95477",
      "original_text": "Löschungsankündigung\nSchleswig-Holstein Amtsgericht Lübeck HRB 15805\nFehmarn Concepts GmbH – Fehmarn",
      "type": "Löschungsankündigung",
      "state": "Schleswig-Holstein",
      "amtsgericht": "Amtsgericht Lübeck",
      "registernummer": "HRB 15805",
      "registerart": "HRB",
      "company_name": "Fehmarn Concepts GmbH",
      "company_seat": "Fehmarn",
      "details": "05.12.2024 (Bekanntmachungsdatum)\n\nSchleswig-Holstein Amtsgericht Lübeck HRB 15805\nLöschungsankündigung\n\nFehmarn Concepts GmbH\nGesellschaft mit beschränkter Haftung\nFehmarn\n\nEs ist die Löschung der nachstehenden Gesellschaft wegen Vermögenslosigkeit gemäß § 394 FamFG beabsichtigt."
    },
    {
      "date": "2024-12-05",
      "id": "95478",
      "original_text": "Löschungsankündigung\nBaden-Württemberg Amtsgericht Stuttgart HRB 749383\nFelix Finger GmbH – Freudenstadt",
      "type": "Löschungsankündigung",
      "state": "Baden-Württemberg",
      "amtsgericht": "Amtsgericht Stuttgart",
      "registernummer": "HRB 749383",
      "registerart": "HRB",
      "company_name": "Felix Finger GmbH",
      "company_seat": "Freudenstadt",
      "details": "05.12.2024 (Bekanntmachungsdatum)\n\nBaden-Württemberg Amtsgericht Stuttgart HRB 749383\nLöschungsankündigung\n\nFelix Finger GmbH\nGesellschaft mit beschränkter Haftung\nFreudenstadt\n\nAls nicht eingetragen wird bekanntgemacht:\nDas Gericht beabsichtigt, die Gesellschaft wegen Vermögenslosigkeit im Handelsregister von Amts wegen nach § 394 FamFG zu löschen. Die Frist zur Geltendmachung eines Widerspruchs gegen die beabsichtigte Löschung ist auf zwei Monate ab Veröffentlichung bestimmt."
    },
    {
      "date": "2024-12-05",
      "id": "95479",
      "original_text": "Löschungsankündigung\nBerlin Amtsgericht Berlin (Charlottenburg) HRB 185288\nAlphaProject Hoch- und Tiefbau GmbH – Berlin",
      "type": "Löschungsankündigung",
      "state": "Berlin",
      "amtsgericht": "Amtsgericht Berlin (Charlottenburg)",
      "registernummer": "HRB 185288",
      "registerart": "HRB",
      "company_name": "AlphaProject Hoch- und Tiefbau GmbH",
      "company_seat": "Berlin",
      "details": "05.12.2024 (Bekanntmachungsdatum)\n\nBerlin Amtsgericht Berlin (Charlottenburg) HRB 185288\nLöschungsankündigung\n\nAlphaProject Hoch- und Tiefbau GmbH\nGesellschaft mit beschränkter Haftung\nBerlin\n\nBei der nachstehenden Gesellschaft wird das Amtslöschungsverfahren gemäß § 394 FamFG eingeleitet. Widerspruchsfrist\n6 Wochen"
    },
    {
      "date": "2024-12-05",
      "id": "95480",
      "original_text": "Registerbekanntmachung nach dem Umwandlungsgesetz\nBaden-Württemberg Amtsgericht Stuttgart HRB 281211\nBühler GmbH – Plüderhausen",
      "type": "Registerbekanntmachung nach dem Umwandlungsgesetz",
      "state": "Baden-Württemberg",
      "amtsgericht": "Amtsgericht Stuttgart",
      "registernummer": "HRB 281211",
      "registerart": "HRB",
      "company_name": "Bühler GmbH",
      "company_seat": "Plüderhausen",
      "details": "05.12.2024 (Bekanntmachungsdatum)\n\nBaden-Württemberg Amtsgericht Stuttgart HRB 281211\nRegisterbekanntmachung nach dem Umwandlungsgesetz 05.12.2024 (Eintragungsdatum)\n\nBühler GmbH\nGesellschaft mit beschränkter Haftung\nPlüderhausen\n\nAls nicht eingetragen wird bekanntgemacht:\nDen Gläubigern der an der Verschmelzung beteiligten Rechtsträger ist, wenn sie binnen sechs Monaten nach dem Tag, an dem die Eintragung der Verschmelzung in das Register des Sitzes desjenigen Rechtsträgers, dessen Gläubiger sie sind, nach § 19 Abs. 3 UmwG als bekanntgemacht gilt, ihren Anspruch nach Grund und Höhe schriftlich anmelden, Sicherheit zu leisten, soweit sie nicht Befriedigung verlangen können. Dieses Recht steht den Gläubigern jedoch nur zu, wenn sie glaubhaft machen, dass durch die Verschmelzung die Erfüllung ihrer Forderung gefährdet wird."
    },
    {
      "date": "2024-12-05",
      "id": "95481",
      "original_text": "Einreichung neuer Dokumente\nBerlin Amtsgericht Berlin (Charlottenburg) HRB 65553\nTME Pharma Aktiengesellschaft – Berlin",
      "type": "Einreichung neuer Dokumente",
      "state": "Berlin",
      "amtsgericht": "Amtsgericht Berlin (Charlottenburg)",
      "registernummer": "HRB 65553",
      "registerart": "HRB",
      "company_name": "TME Pharma Aktiengesellschaft",
      "company_seat": "Berlin",
      "details": "05.12.2024 (Bekanntmachungsdatum)\n\nBerlin Amtsgericht Berlin (Charlottenburg) HRB 65553\nEinreichung neuer Dokumente\n\nTME Pharma Aktiengesellschaft\nAktiengesellschaft\nBerlin\n\nAls nicht eingetragen wird veröffentlicht:Es wurde eine neue Liste der Aufsichtsratsmitglieder eingereicht (§ 106 AktG)."
    },
    {
      "date": "2024-12-05",
      "id": "95482",
      "original_text": "Einreichung neuer Dokumente\nBerlin Amtsgericht Berlin (Charlottenburg) HRB 103691\nAccentro Real Estate AG – Berlin",
      "type": "Einreichung neuer Dokumente",
      "state": "Berlin",
      "amtsgericht": "Amtsgericht Berlin (Charlottenburg)",
      "registernummer": "HRB 103691",
      "registerart": "HRB",
      "company_name": "Accentro Real Estate AG",
      "company_seat": "Berlin",
      "details": "05.12.2024 (Bekanntmachungsdatum)\n\nBerlin Amtsgericht Berlin (Charlottenburg) HRB 103691\nEinreichung neuer Dokumente\n\nAccentro Real Estate AG\nAktiengesellschaft\nBerlin\n\nAls nicht eingetragen wird veröffentlicht: Es wurde eine neue Liste der Aufsichtsratsmitglieder eingereicht (§ 106 AktG)."
    },
    {
      "date": "2024-12-05",
      "id": "95483",
      "original_text": "Einreichung neuer Dokumente\nBaden-Württemberg Amtsgericht Stuttgart HRB 200388\nStadtwerke Ludwigsburg - Kornwestheim GmbH – Ludwigsburg",
      "type": "Einreichung neuer Dokumente",
      "state": "Baden-Württemberg",
      "amtsgericht": "Amtsgericht Stuttgart",
      "registernummer": "HRB 200388",
      "registerart": "HRB",
      "company_name": "Stadtwerke Ludwigsburg - Kornwestheim GmbH",
      "company_seat": "Ludwigsburg",
      "details": "05.12.2024 (Bekanntmachungsdatum)\n\nBaden-Württemberg Amtsgericht Stuttgart HRB 200388\nEinreichung neuer Dokumente\n\nStadtwerke Ludwigsburg - Kornwestheim GmbH\nGesellschaft mit beschränkter Haftung\nLudwigsburg\n\nDie Gesellschaft hat am 03.12.2024 die Liste über die Zusammensetzung des Aufsichtsrats zum Handelsregister eingereicht."
    },
    {
      "date": "2024-12-05",
      "id": "95484",
      "original_text": "Registerbekanntmachung nach dem Umwandlungsgesetz\nBaden-Württemberg Amtsgericht Stuttgart HRB 781985\nALUCA GmbH – Rosengarten",
      "type": "Registerbekanntmachung nach dem Umwandlungsgesetz",
      "state": "Baden-Württemberg",
      "amtsgericht": "Amtsgericht Stuttgart",
      "registernummer": "HRB 781985",
      "registerart": "HRB",
      "company_name": "ALUCA GmbH",
      "company_seat": "Rosengarten",
      "details": "05.12.2024 (Bekanntmachungsdatum)\n\nBaden-Württemberg Amtsgericht Stuttgart HRB 781985\nRegisterbekanntmachung nach dem Umwandlungsgesetz\n\nALUCA GmbH\nGesellschaft mit beschränkter Haftung\nRosengarten\n\nAls nicht eingetragen wird bekanntgemacht:\nEs wird darauf hingewiesen, dass ein ein Entwurf des Verschmelzungsplans über eine grenzüberschreitende Verschmelzung zur Aufnahme mit folgenden Rechtsträgern beim Handelsregister eingereicht worden:\na) als übertragende Gesellschaft die Aluca Austria GmbH, eine Gesellschaft mit beschränkter Haftung nach österreichischem Recht mit dem Sitz in Wien, Österreich und mit Geschäftsanschrift: Gauermanngasse 2, 1010 Wien, Österreich.\nb) als übernehmende Gesellschaft die ALUCA GmbH, eine nach deutschem Recht gegründete Gesellschaft mit beschränkter Haftung mit dem Sitz in Rosengarten, Deutschland und mit der Geschäftsanschrift : Westring 1 74538 Rosengarten, Deutschland.\nDie Gesellschaften sind in folgenden Registern eingetragen:\na) die Aluca Austria GmbH ist im Firmenbuch des Handelsregisters Wien unter FN 528893 i eingetragen.\nb) die ALUCA GmbH ist im Handelsregister des Amtsgerichts Stuttgart unter HRB 781985 eingetragen.\nDie Anteilsinhaber, die Gläubiger sowie die zuständigen Betriebsräte der an der grenzüberschreitenden Verschmelzung beteiligten Gesellschaften oder, soweit es keinen Betriebsrat gibt, die Arbeitnehmer der an der grenzüberschreitenden Verschmelzung beteiligten Gesellschaften, können der jeweiligen Gesellschaft spätestens fünf Arbeitstage vor dem Tag der Gesellschafterversammlung Bemerkungen zum Verschmelzungsplan übermitteln. Diese Gesellschafterversammlung der ALUCA GmbH, in der die Gesellschafter dem Verschmelzungsplan zustimmen, wird voraussichtlich am 13.02.2025 stattfinden."
    },
    {
      "date": "2024-12-05",
      "id": "95485",
      "original_text": "Einreichung neuer Dokumente\nSachsen-Anhalt Amtsgericht Stendal HRB 34830\nZukunftszentrum für Deutsche Einheit und Europäische Transformation gGmbH – Halle (Saale)",
      "type": "Einreichung neuer Dokumente",
      "state": "Sachsen-Anhalt",
      "amtsgericht": "Amtsgericht Stendal",
      "registernummer": "HRB 34830",
      "registerart": "HRB",
      "company_name": "Zukunftszentrum für Deutsche Einheit und Europäische Transformation gGmbH",
      "company_seat": "Halle (Saale)",
      "details": "05.12.2024 (Bekanntmachungsdatum)\n\nSachsen-Anhalt Amtsgericht Stendal HRB 34830\nEinreichung neuer Dokumente\n\nZukunftszentrum für Deutsche Einheit und Europäische Transformation gGmbH\nGesellschaft mit beschränkter Haftung\nHalle (Saale)\n\nEine Liste der Mitglieder des Aufsichtsrates wurde zum Handelsregister eingereicht."
    },
    {
      "date": "2024-12-05",
      "id": "95486",
      "original_text": "Löschungsankündigung\nSchleswig-Holstein Amtsgericht Kiel HRB 16759\nKAIFU Enterprises GmbH – Eckernförde",
      "type": "Löschungsankündigung",
      "state": "Schleswig-Holstein",
      "amtsgericht": "Amtsgericht Kiel",
      "registernummer": "HRB 16759",
      "registerart": "HRB",
      "company_name": "KAIFU Enterprises GmbH",
      "company_seat": "Eckernförde",
      "details": "05.12.2024 (Bekanntmachungsdatum)\n\nSchleswig-Holstein Amtsgericht Kiel HRB 16759\nLöschungsankündigung\n\nKAIFU Enterprises GmbH\nGesellschaft mit beschränkter Haftung\nEckernförde\n\nEs ist die Löschung der nachstehenden Gesellschaft wegen Vermögenslosigkeit gemäß § 394 FamFG beabsichtigt. Widerspruchsfrist: 1 Monat."
    },
    {
      "date": "2024-12-05",
      "id": "95487",
      "original_text": "Registerbekanntmachung nach dem Umwandlungsgesetz\nBaden-Württemberg Amtsgericht Stuttgart HRB 749665\nMeyer Menü HN Verwaltungs GmbH – Neuenstadt am Kocher",
      "type": "Registerbekanntmachung nach dem Umwandlungsgesetz",
      "state": "Baden-Württemberg",
      "amtsgericht": "Amtsgericht Stuttgart",
      "registernummer": "HRB 749665",
      "registerart": "HRB",
      "company_name": "Meyer Menü HN Verwaltungs GmbH",
      "company_seat": "Neuenstadt am Kocher",
      "details": "05.12.2024 (Bekanntmachungsdatum)\n\nBaden-Württemberg Amtsgericht Stuttgart HRB 749665\nRegisterbekanntmachung nach dem Umwandlungsgesetz 05.12.2024 (Eintragungsdatum)\n\nMeyer Menü HN Verwaltungs GmbH\nGesellschaft mit beschränkter Haftung\nNeuenstadt am Kocher\n\nDen Gläubigern der an der Verschmelzung beteiligten Rechtsträger ist, wenn sie binnen sechs Monaten nach dem Tag, an dem die Eintragung der Verschmelzung in das Register des Sitzes desjenigen Rechtsträgers, dessen Gläubiger sie sind, nach § 19 Abs. 3 UmwG als bekanntgemacht gilt, ihren Anspruch nach Grund und Höhe schriftlich anmelden, Sicherheit zu leisten, soweit sie nicht Befriedigung verlangen können. Dieses Recht steht den Gläubigern jedoch nur zu, wenn sie glaubhaft machen, dass durch die Verschmelzung die Erfüllung ihrer Forderung gefährdet wird."
    },
    {
      "date": "2024-12-05",
      "id": "95488",
      "original_text": "Löschungsankündigung\nMecklenburg-Vorpommern Amtsgericht Rostock HRB 13156\nSC - Service Company GmbH – Rostock",
      "type": "Löschungsankündigung",
      "state": "Mecklenburg-Vorpommern",
      "amtsgericht": "Amtsgericht Rostock",
      "registernummer": "HRB 13156",
      "registerart": "HRB",
      "company_name": "SC - Service Company GmbH",
      "company_seat": "Rostock",
      "details": "05.12.2024 (Bekanntmachungsdatum)\n\nMecklenburg-Vorpommern Amtsgericht Rostock HRB 13156\nLöschungsankündigung\n\nSC - Service Company GmbH\nGesellschaft mit beschränkter Haftung\nRostock\n\nDas Registergericht beabsichtigt, die im Handelsregister eingetragene Gesellschaft von Amts wegen nach § 394 FamFG zu löschen. Die Frist zur Erhebung eines Widerspruchs gegen die beabsichtigte Löschung wird auf einen Monat festgesetzt."
    },
    {
      "date": "2024-12-05",
      "id": "95489",
      "original_text": "Sonstige Registerbekanntmachung\nHamburg Amtsgericht Hamburg HRB 161722\nWintershall Dea Deutschland GmbH – Hamburg",
      "type": "Sonstige Registerbekanntmachung",
      "state": "Hamburg",
      "amtsgericht": "Amtsgericht Hamburg",
      "registernummer": "HRB 161722",
      "registerart": "HRB",
      "company_name": "Wintershall Dea Deutschland GmbH",
      "company_seat": "Hamburg",
      "details": "05.12.2024 (Bekanntmachungsdatum)\n\nHamburg Amtsgericht Hamburg HRB 161722\nSonstige Registerbekanntmachung 05.12.2024 (Eintragungsdatum)\n\nWintershall Dea Deutschland GmbH\nGesellschaft mit beschränkter Haftung\nHamburg\n\nAls nicht eingetragen wird bekannt gemacht: Liste des Aufsichtsrats wurde eingereicht."
    },
    {
      "date": "2024-12-05",
      "id": "95490",
      "original_text": "Löschungsankündigung\nSachsen-Anhalt Amtsgericht Stendal HRB 205977\nEppe Handelskontor GmbH – Eisleben",
      "type": "Löschungsankündigung",
      "state": "Sachsen-Anhalt",
      "amtsgericht": "Amtsgericht Stendal",
      "registernummer": "HRB 205977",
      "registerart": "HRB",
      "company_name": "Eppe Handelskontor GmbH",
      "company_seat": "Eisleben",
      "details": "05.12.2024 (Bekanntmachungsdatum)\n\nSachsen-Anhalt Amtsgericht Stendal HRB 205977\nLöschungsankündigung\n\nEppe Handelskontor GmbH\nGesellschaft mit beschränkter Haftung\nEisleben\n\nDas Registergericht beabsichtigt, nachfolgende im Handelregister eingetragenen Firmen von Amts wegen nach § 394 FamFG zu löschen. Die Frist zu Erhebung eines Widerspruchs wird auf drei Monate festgesetzt."
    },
    {
      "date": "2024-12-05",
      "id": "95491",
      "original_text": "Registerbekanntmachung nach dem Umwandlungsgesetz\nBerlin Amtsgericht Berlin (Charlottenburg) HRA 63656\nUIW Lux Süd 1 GmbH & Co. KG – Berlin",
      "type": "Registerbekanntmachung nach dem Umwandlungsgesetz",
      "state": "Berlin",
      "amtsgericht": "Amtsgericht Berlin (Charlottenburg)",
      "registernummer": "HRA 63656",
      "registerart": "HRA",
      "company_name": "UIW Lux Süd 1 GmbH & Co. KG",
      "company_seat": "Berlin",
      "details": "05.12.2024 (Bekanntmachungsdatum)\n\nBerlin Amtsgericht Berlin (Charlottenburg) HRA 63656\nRegisterbekanntmachung nach dem Umwandlungsgesetz 04.12.2024 (Eintragungsdatum)\n\nUIW Lux Süd 1 GmbH & Co. KG\nKommanditgesellschaft\nBerlin\n\nZu Eintragungsnummer 1 vom 04.12.2024 wird als nicht eingetragen veröffentlicht: Den Gläubigern ist, wenn sie binnen sechs Monaten nach dem Tag, an dem die Eintragung der Umwandlung als bekannt gemacht gilt, ihren Anspruch nach Grund und Höhe schriftlich anmelden, Sicherheit zu leisten, soweit sie nicht Befriedigung verlangen können. Dieses Recht steht den Gläubigern jedoch nur zu, wenn sie glaubhaft machen, dass durch die Umwandlung die Erfüllung ihrer Forderung gefährdet wird. Das Recht, Sicherheitsleistung zu verlangen, steht Gläubigern nicht zu, die im Falle der Insolvenz ein Recht auf vorzugsweise Befriedigung aus einer Deckungsmasse haben, die nach gesetzlicher Vorschrift zu ihrem Schutz errichtet und staatlich überwacht ist."
    },
    {
      "date": "2024-12-05",
      "id": "95492",
      "original_text": "Einreichung neuer Dokumente\nBaden-Württemberg Amtsgericht Mannheim HRB 179\nNeue Rechtsschutz- Versicherungsgesellschaft Aktiengesellschaft – Mannheim",
      "type": "Einreichung neuer Dokumente",
      "state": "Baden-Württemberg",
      "amtsgericht": "Amtsgericht Mannheim",
      "registernummer": "HRB 179",
      "registerart": "HRB",
      "company_name": "Neue Rechtsschutz- Versicherungsgesellschaft Aktiengesellschaft",
      "company_seat": "Mannheim",
      "details": "05.12.2024 (Bekanntmachungsdatum)\n\nBaden-Württemberg Amtsgericht Mannheim HRB 179\nEinreichung neuer Dokumente\n\nNeue Rechtsschutz- Versicherungsgesellschaft Aktiengesellschaft\nAktiengesellschaft\nMannheim\n\nDie Gesellschaft hat am 04.12.2024 die Liste über die Zusammensetzung des Aufsichtsrats zum Handelsregister eingereicht."
    },
    {
      "date": "2024-12-05",
      "id": "95493",
      "original_text": "Einreichung neuer Dokumente\nBaden-Württemberg Amtsgericht Freiburg HRB 7436\nSMP Deutschland GmbH – Bötzingen",
      "type": "Einreichung neuer Dokumente",
      "state": "Baden-Württemberg",
      "amtsgericht": "Amtsgericht Freiburg",
      "registernummer": "HRB 7436",
      "registerart": "HRB",
      "company_name": "SMP Deutschland GmbH",
      "company_seat": "Bötzingen",
      "details": "05.12.2024 (Bekanntmachungsdatum)\n\nBaden-Württemberg Amtsgericht Freiburg HRB 7436\nEinreichung neuer Dokumente\n\nSMP Deutschland GmbH\nGesellschaft mit beschränkter Haftung\nBötzingen\n\nDie Gesellschaft hat am 04.12.2024 die Liste über die Zusammensetzung des Aufsichtsrats zum Handelsregister eingereicht."
    },
    {
      "date": "2024-12-05",
      "id": "95494",
      "original_text": "Einreichung neuer Dokumente\nHamburg Amtsgericht Hamburg HRB 56747\nDonner & Reuschel Aktiengesellschaft – Hamburg",
      "type": "Einreichung neuer Dokumente",
      "state": "Hamburg",
      "amtsgericht": "Amtsgericht Hamburg",
      "registernummer": "HRB 56747",
      "registerart": "HRB",
      "company_name": "Donner & Reuschel Aktiengesellschaft",
      "company_seat": "Hamburg",
      "details": "05.12.2024 (Bekanntmachungsdatum)\n\nHamburg Amtsgericht Hamburg HRB 56747\nEinreichung neuer Dokumente 05.12.2024 (Eintragungsdatum)\n\nDonner & Reuschel Aktiengesellschaft\nAktiengesellschaft\nHamburg\n\nAls nicht eingetragen wird bekannt gemacht: Liste des Aufsichtsrats wurde eingereicht."
    },
    {
      "date": "2024-12-05",
      "id": "95495",
      "original_text": "Einreichung neuer Dokumente\nSachsen-Anhalt Amtsgericht Stendal HRB 207208\nKME Mansfeld GmbH – Hettstedt",
      "type": "Einreichung neuer Dokumente",
      "state": "Sachsen-Anhalt",
      "amtsgericht": "Amtsgericht Stendal",
      "registernummer": "HRB 207208",
      "registerart": "HRB",
      "company_name": "KME Mansfeld GmbH",
      "company_seat": "Hettstedt",
      "details": "05.12.2024 (Bekanntmachungsdatum)\n\nSachsen-Anhalt Amtsgericht Stendal HRB 207208\nEinreichung neuer Dokumente\n\nKME Mansfeld GmbH\nGesellschaft mit beschränkter Haftung\nHettstedt\n\nEine Liste der Mitglieder des Aufsichtsrates wurde zum Handelsregister eingereicht."
    },
    {
      "date": "2024-12-05",
      "id": "95496",
      "original_text": "Löschungsankündigung\nSchleswig-Holstein Amtsgericht Flensburg HRA 6922\nDANTYS Energy GmbH & Co. KG – Norderfriedrichskoog",
      "type": "Löschungsankündigung",
      "state": "Schleswig-Holstein",
      "amtsgericht": "Amtsgericht Flensburg",
      "registernummer": "HRA 6922",
      "registerart": "HRA",
      "company_name": "DANTYS Energy GmbH & Co. KG",
      "company_seat": "Norderfriedrichskoog",
      "details": "05.12.2024 (Bekanntmachungsdatum)\n\nSchleswig-Holstein Amtsgericht Flensburg HRA 6922\nLöschungsankündigung\n\nDANTYS Energy GmbH & Co. KG\nKommanditgesellschaft\nNorderfriedrichskoog\n\nEs ist die Löschung der nachstehenden Gesellschaft wegen Vermögenslosigkeit gemäß § 394 FamFG beabsichtigt.\nWiderspruchsfrist: 2 Monate"
    },
    {
      "date": "2024-12-05",
      "id": "95497",
      "original_text": "Registerbekanntmachung nach dem Umwandlungsgesetz\nBerlin Amtsgericht Berlin (Charlottenburg) HRB 209607\nAMBOSS GmbH – Berlin",
      "type": "Registerbekanntmachung nach dem Umwandlungsgesetz",
      "state": "Berlin",
      "amtsgericht": "Amtsgericht Berlin (Charlottenburg)",
      "registernummer": "HRB 209607",
      "registerart": "HRB",
      "company_name": "AMBOSS GmbH",
      "company_seat": "Berlin",
      "details": "05.12.2024 (Bekanntmachungsdatum)\n\nBerlin Amtsgericht Berlin (Charlottenburg) HRB 209607\nRegisterbekanntmachung nach dem Umwandlungsgesetz 04.12.2024 (Eintragungsdatum)\n\nAMBOSS GmbH\nGesellschaft mit beschränkter Haftung\nBerlin\n\nZu Eintragungsnummer 5 vom 04.12.2024 wird als nicht eingetragen veröffentlicht: Den Gläubigern ist, wenn sie binnen sechs Monaten nach dem Tag, an dem die Eintragung der Umwandlung als bekannt gemacht gilt, ihren Anspruch nach Grund und Höhe schriftlich anmelden, Sicherheit zu leisten, soweit sie nicht Befriedigung verlangen können. Dieses Recht steht den Gläubigern jedoch nur zu, wenn sie glaubhaft machen, dass durch die Umwandlung die Erfüllung ihrer Forderung gefährdet wird. Das Recht, Sicherheitsleistung zu verlangen, steht Gläubigern nicht zu, die im Falle der Insolvenz ein Recht auf vorzugsweise Befriedigung aus einer Deckungsmasse haben, die nach gesetzlicher Vorschrift zu ihrem Schutz errichtet und staatlich überwacht ist."
    },
    {
      "date": "2024-12-05",
      "id": "95498",
      "original_text": "Registerbekanntmachung nach dem Umwandlungsgesetz\nBerlin Amtsgericht Berlin (Charlottenburg) HRA 63669\nUIW Lux Berlin 4 GmbH & Co. KG – Berlin",
      "type": "Registerbekanntmachung nach dem Umwandlungsgesetz",
      "state": "Berlin",
      "amtsgericht": "Amtsgericht Berlin (Charlottenburg)",
      "registernummer": "HRA 63669",
      "registerart": "HRA",
      "company_name": "UIW Lux Berlin 4 GmbH & Co. KG",
      "company_seat": "Berlin",
      "details": "05.12.2024 (Bekanntmachungsdatum)\n\nBerlin Amtsgericht Berlin (Charlottenburg) HRA 63669\nRegisterbekanntmachung nach dem Umwandlungsgesetz 04.12.2024 (Eintragungsdatum)\n\nUIW Lux Berlin 4 GmbH & Co. KG\nKommanditgesellschaft\nBerlin\n\nZu Eintragungsnummer 2 vom 04.12.2024 wird als nicht eingetragen veröffentlicht:\nDen Gläubigern ist, wenn sie binnen sechs Monaten nach dem Tag, an dem die Eintragung der Umwandlung als bekannt gemacht gilt, ihren Anspruch nach Grund und Höhe schriftlich anmelden, Sicherheit zu leisten, soweit sie nicht Befriedigung verlangen können. Dieses Recht steht den Gläubigern jedoch nur zu, wenn sie glaubhaft machen, dass durch die Umwandlung die Erfüllung ihrer Forderung gefährdet wird. Das Recht, Sicherheitsleistung zu verlangen, steht Gläubigern nicht zu, die im Falle der Insolvenz ein Recht auf vorzugsweise Befriedigung aus einer Deckungsmasse haben, die nach gesetzlicher Vorschrift zu ihrem Schutz errichtet und staatlich überwacht ist."
    },
    {
      "date": "2024-12-05",
      "id": "95499",
      "original_text": "Registerbekanntmachung nach dem Umwandlungsgesetz\nBerlin Amtsgericht Berlin (Charlottenburg) HRA 63668\nUIW Lux Berlin 5 GmbH & Co. KG – Berlin",
      "type": "Registerbekanntmachung nach dem Umwandlungsgesetz",
      "state": "Berlin",
      "amtsgericht": "Amtsgericht Berlin (Charlottenburg)",
      "registernummer": "HRA 63668",
      "registerart": "HRA",
      "company_name": "UIW Lux Berlin 5 GmbH & Co. KG",
      "company_seat": "Berlin",
      "details": "05.12.2024 (Bekanntmachungsdatum)\n\nBerlin Amtsgericht Berlin (Charlottenburg) HRA 63668\nRegisterbekanntmachung nach dem Umwandlungsgesetz 04.12.2024 (Eintragungsdatum)\n\nUIW Lux Berlin 5 GmbH & Co. KG\nKommanditgesellschaft\nBerlin\n\nZu Eintragungsnummer 1 vom 04.12.2024 wird als nicht eingetragen veröffentlicht: Den Gläubigern ist, wenn sie binnen sechs Monaten nach dem Tag, an dem die Eintragung der Umwandlung als bekannt gemacht gilt, ihren Anspruch nach Grund und Höhe schriftlich anmelden, Sicherheit zu leisten, soweit sie nicht Befriedigung verlangen können. Dieses Recht steht den Gläubigern jedoch nur zu, wenn sie glaubhaft machen, dass durch die Umwandlung die Erfüllung ihrer Forderung gefährdet wird. Das Recht, Sicherheitsleistung zu verlangen, steht Gläubigern nicht zu, die im Falle der Insolvenz ein Recht auf vorzugsweise Befriedigung aus einer Deckungsmasse haben, die nach gesetzlicher Vorschrift zu ihrem Schutz errichtet und staatlich überwacht ist."
    },
    {
      "date": "2024-12-05",
      "id": "95500",
      "original_text": "Löschungsankündigung\nBrandenburg Amtsgericht Potsdam HRB 29252\nFirst HD Distribution GmbH – Schwielowsee",
      "type": "Löschungsankündigung",
      "state": "Brandenburg",
      "amtsgericht": "Amtsgericht Potsdam",
      "registernummer": "HRB 29252",
      "registerart": "HRB",
      "company_name": "First HD Distribution GmbH",
      "company_seat": "Schwielowsee",
      "details": "05.12.2024 (Bekanntmachungsdatum)\n\nBrandenburg Amtsgericht Potsdam HRB 29252\nLöschungsankündigung\n\nFirst HD Distribution GmbH\nGesellschaft mit beschränkter Haftung\nSchwielowsee\n\nBei der nachstehenden Gesellschaft wird das Amtslöschungsverfahren gemäß § 394 FamFG eingeleitet. Widerspruchsfrist: 8 Wochen"
    },
    {
      "date": "2024-12-05",
      "id": "95501",
      "original_text": "Sonstige Registerbekanntmachung\nThüringen Amtsgericht Jena HRB 105668\nArchitekten- und Ingenieurgruppe Erfurt und Partner GmbH – Erfurt",
      "type": "Sonstige Registerbekanntmachung",
      "state": "Thüringen",
      "amtsgericht": "Amtsgericht Jena",
      "registernummer": "HRB 105668",
      "registerart": "HRB",
      "company_name": "Architekten- und Ingenieurgruppe Erfurt und Partner GmbH",
      "company_seat": "Erfurt",
      "details": "05.12.2024 (Bekanntmachungsdatum)\n\nThüringen Amtsgericht Jena HRB 105668\nSonstige Registerbekanntmachung 05.12.2024 (Eintragungsdatum)\n\nArchitekten- und Ingenieurgruppe Erfurt und Partner GmbH\nGesellschaft mit beschränkter Haftung\nErfurt\n\nNicht eingetragen: Den Gläubigern der Gesellschaft ist, wenn sie binnen sechs Monaten nach dieser Bekanntmachung ihren Anspruch nach Grund und Höhe schriftlich anmelden, Sicherheit zu leisten, soweit sie nicht Befriedigung verlangen können. Dieses Recht steht ihnen jedoch nicht zu, wenn sie im Falle des Insolvenzverfahrens ein Recht auf vorzugsweise Befriedigung aus einer Deckungsmasse haben, die nach gesetzlicher Vorschrift zu ihrem Schutz errichtet und staatlich überwacht ist."
    },
    {
      "date": "2024-12-05",
      "id": "95502",
      "original_text": "Löschungsankündigung\nBaden-Württemberg Amtsgericht Mannheim HRB 721089\nDFS Dach Fassaden Systeme GmbH – Karlsruhe",
      "type": "Löschungsankündigung",
      "state": "Baden-Württemberg",
      "amtsgericht": "Amtsgericht Mannheim",
      "registernummer": "HRB 721089",
      "registerart": "HRB",
      "company_name": "DFS Dach Fassaden Systeme GmbH",
      "company_seat": "Karlsruhe",
      "details": "05.12.2024 (Bekanntmachungsdatum)\n\nBaden-Württemberg Amtsgericht Mannheim HRB 721089\nLöschungsankündigung\n\nDFS Dach Fassaden Systeme GmbH\nGesellschaft mit beschränkter Haftung\nKarlsruhe\n\nAls nicht eingetragen wird bekanntgemacht:\nDas Gericht beabsichtigt, die Gesellschaft wegen Vermögenslosigkeit im Handelsregister von Amts wegen nach § 394 FamFG zu löschen. Die Frist zur Geltendmachung eines Widerspruchs gegen die beabsichtigte Löschung ist auf einen Monat ab Veröffentlichung bestimmt."
    },
    {
      "date": "2024-12-05",
      "id": "95503",
      "original_text": "Registerbekanntmachung nach dem Umwandlungsgesetz\nBerlin Amtsgericht Berlin (Charlottenburg) HRB 145521\nLosemann Legal Tax GmbH Rechtsanwaltsgesellschaft – Berlin",
      "type": "Registerbekanntmachung nach dem Umwandlungsgesetz",
      "state": "Berlin",
      "amtsgericht": "Amtsgericht Berlin (Charlottenburg)",
      "registernummer": "HRB 145521",
      "registerart": "HRB",
      "company_name": "Losemann Legal Tax GmbH Rechtsanwaltsgesellschaft",
      "company_seat": "Berlin",
      "details": "05.12.2024 (Bekanntmachungsdatum)\n\nBerlin Amtsgericht Berlin (Charlottenburg) HRB 145521\nRegisterbekanntmachung nach dem Umwandlungsgesetz 04.12.2024 (Eintragungsdatum)\n\nLosemann Legal Tax GmbH Rechtsanwaltsgesellschaft\nGesellschaft mit beschränkter Haftung\nBerlin\n\nZu Eintragungsnummer 4 vom 04.12.2024 wird als nicht eingetragen veröffentlicht: Den Gläubigern der an der Verschmelzung beteiligten Rechtsträger ist, wenn sie binnen sechs Monaten nach dem Tag, an dem die Eintragung der Verschmelzung in das Register des Sitzes desjenigen Rechtsträgers, dessen Gläubiger sie sind, als bekannt gemacht gilt, ihren Anspruch nach Grund und Höhe schriftlich anmelden, Sicherheit zu leisten, soweit sie nicht Befriedigung verlangen können. Dieses Recht steht den Gläubigern jedoch nur zu, wenn sie glaubhaft machen, dass durch die Verschmelzung die Erfüllung ihrer Forderung gefährdet wird. Das Recht, Sicherheitsleistung zu verlangen, steht Gläubigern nicht zu, die im Falle der Insolvenz ein Recht auf vorzugsweise Befriedigung aus einer Deckungsmasse haben, die nach gesetzlicher Vorschrift zu ihrem Schutz errichtet und staatlich überwacht ist."
    },
    {
      "date": "2024-12-05",
      "id": "95504",
      "original_text": "Registerbekanntmachung nach dem Umwandlungsgesetz\nBerlin Amtsgericht Berlin (Charlottenburg) HRB 141827\nLosemann Tax GmbH Steuerberatung – Berlin",
      "type": "Registerbekanntmachung nach dem Umwandlungsgesetz",
      "state": "Berlin",
      "amtsgericht": "Amtsgericht Berlin (Charlottenburg)",
      "registernummer": "HRB 141827",
      "registerart": "HRB",
      "company_name": "Losemann Tax GmbH Steuerberatung",
      "company_seat": "Berlin",
      "details": "05.12.2024 (Bekanntmachungsdatum)\n\nBerlin Amtsgericht Berlin (Charlottenburg) HRB 141827\nRegisterbekanntmachung nach dem Umwandlungsgesetz 04.12.2024 (Eintragungsdatum)\n\nLosemann Tax GmbH Steuerberatung\nGesellschaft mit beschränkter Haftung\nBerlin\n\nZu Eintragungsnummer 6 vom 04.12.2024 wird als nicht eingetragen veröffentlicht: Den Gläubigern der an der Verschmelzung beteiligten Rechtsträger ist, wenn sie binnen sechs Monaten nach dem Tag, an dem die Eintragung der Verschmelzung in das Register des Sitzes desjenigen Rechtsträgers, dessen Gläubiger sie sind, als bekannt gemacht gilt, ihren Anspruch nach Grund und Höhe schriftlich anmelden, Sicherheit zu leisten, soweit sie nicht Befriedigung verlangen können. Dieses Recht steht den Gläubigern jedoch nur zu, wenn sie glaubhaft machen, dass durch die Verschmelzung die Erfüllung ihrer Forderung gefährdet wird. Das Recht, Sicherheitsleistung zu verlangen, steht Gläubigern nicht zu, die im Falle der Insolvenz ein Recht auf vorzugsweise Befriedigung aus einer Deckungsmasse haben, die nach gesetzlicher Vorschrift zu ihrem Schutz errichtet und staatlich überwacht ist."
    },
    {
      "date": "2024-12-05",
      "id": "95505",
      "original_text": "Registerbekanntmachung nach dem Umwandlungsgesetz\nBerlin Amtsgericht Berlin (Charlottenburg) HRB 191754\nSunshine Smile GmbH – Berlin",
      "type": "Registerbekanntmachung nach dem Umwandlungsgesetz",
      "state": "Berlin",
      "amtsgericht": "Amtsgericht Berlin (Charlottenburg)",
      "registernummer": "HRB 191754",
      "registerart": "HRB",
      "company_name": "Sunshine Smile GmbH",
      "company_seat": "Berlin",
      "details": "05.12.2024 (Bekanntmachungsdatum)\n\nBerlin Amtsgericht Berlin (Charlottenburg) HRB 191754\nRegisterbekanntmachung nach dem Umwandlungsgesetz 04.12.2024 (Eintragungsdatum)\n\nSunshine Smile GmbH\nGesellschaft mit beschränkter Haftung\nBerlin\n\nZu Eintragungsnummer 24 vom 04.12.2024 wird als nicht eingetragen veröffentlicht:  Den Gläubigern der an der Verschmelzung beteiligten Rechtsträger ist, wenn sie binnen sechs Monaten nach dem Tag, an dem die Eintragung der Verschmelzung in das Register des Sitzes desjenigen Rechtsträgers, dessen Gläubiger sie sind, als bekannt gemacht gilt, ihren Anspruch nach Grund und Höhe schriftlich anmelden, Sicherheit zu leisten, soweit sie nicht Befriedigung verlangen können. Dieses Recht steht den Gläubigern jedoch nur zu, wenn sie glaubhaft machen, dass durch die Verschmelzung die Erfüllung ihrer Forderung gefährdet wird. Das Recht, Sicherheitsleistung zu verlangen, steht Gläubigern nicht zu, die im Falle der Insolvenz ein Recht auf vorzugsweise Befriedigung aus einer Deckungsmasse haben, die nach gesetzlicher Vorschrift zu ihrem Schutz errichtet und staatlich überwacht ist."
    },
    {
      "date": "2024-12-05",
      "id": "95506",
      "original_text": "Registerbekanntmachung nach dem Umwandlungsgesetz\nBerlin Amtsgericht Berlin (Charlottenburg) PR 1622\nbfp Beckmann Fehrenbach Rechtsanwälte Steuerberater PartG mbB – Berlin",
      "type": "Registerbekanntmachung nach dem Umwandlungsgesetz",
      "state": "Berlin",
      "amtsgericht": "Amtsgericht Berlin (Charlottenburg)",
      "registernummer": "PR 1622",
      "registerart": "PR",
      "company_name": "bfp Beckmann Fehrenbach Rechtsanwälte Steuerberater PartG mbB",
      "company_seat": "Berlin",
      "details": "05.12.2024 (Bekanntmachungsdatum)\n\nBerlin Amtsgericht Berlin (Charlottenburg) PR 1622\nRegisterbekanntmachung nach dem Umwandlungsgesetz 04.12.2024 (Eintragungsdatum)\n\nbfp Beckmann Fehrenbach Rechtsanwälte Steuerberater PartG mbB\nPartnerschaftsgesellschaft\nBerlin\n\nZu Eintragungsnummer 2 vom 04.12.2024 wird als nicht eingetragen veröffentlicht: Den Gläubigern der an der Verschmelzung beteiligten Rechtsträger ist, wenn sie binnen sechs Monaten nach dem Tag, an dem die Eintragung der Verschmelzung in das Register des Sitzes desjenigen Rechtsträgers, dessen Gläubiger sie sind, als bekannt gemacht gilt, ihren Anspruch nach Grund und Höhe schriftlich anmelden, Sicherheit zu leisten, soweit sie nicht Befriedigung verlangen können. Dieses Recht steht den Gläubigern jedoch nur zu, wenn sie glaubhaft machen, dass durch die Verschmelzung die Erfüllung ihrer Forderung gefährdet wird. Das Recht, Sicherheitsleistung zu verlangen, steht Gläubigern nicht zu, die im Falle der Insolvenz ein Recht auf vorzugsweise Befriedigung aus einer Deckungsmasse haben, die nach gesetzlicher Vorschrift zu ihrem Schutz errichtet und staatlich überwacht ist."
    },
    {
      "date": "2024-12-05",
      "id": "95507",
      "original_text": "Registerbekanntmachung nach dem Umwandlungsgesetz\nBerlin Amtsgericht Berlin (Charlottenburg) HRB 230081\nSunshine Smile Dental Technologies GmbH – Berlin",
      "type": "Registerbekanntmachung nach dem Umwandlungsgesetz",
      "state": "Berlin",
      "amtsgericht": "Amtsgericht Berlin (Charlottenburg)",
      "registernummer": "HRB 230081",
      "registerart": "HRB",
      "company_name": "Sunshine Smile Dental Technologies GmbH",
      "company_seat": "Berlin",
      "details": "05.12.2024 (Bekanntmachungsdatum)\n\nBerlin Amtsgericht Berlin (Charlottenburg) HRB 230081\nRegisterbekanntmachung nach dem Umwandlungsgesetz 04.12.2024 (Eintragungsdatum)\n\nSunshine Smile Dental Technologies GmbH\nGesellschaft mit beschränkter Haftung\nBerlin\n\nZu Eintragungsnummer 5 vom 04.12.2024 wird als nicht eingetragen veröffentlicht:  Den Gläubigern der an der Verschmelzung beteiligten Rechtsträger ist, wenn sie binnen sechs Monaten nach dem Tag, an dem die Eintragung der Verschmelzung in das Register des Sitzes desjenigen Rechtsträgers, dessen Gläubiger sie sind, als bekannt gemacht gilt, ihren Anspruch nach Grund und Höhe schriftlich anmelden, Sicherheit zu leisten, soweit sie nicht Befriedigung verlangen können. Dieses Recht steht den Gläubigern jedoch nur zu, wenn sie glaubhaft machen, dass durch die Verschmelzung die Erfüllung ihrer Forderung gefährdet wird. Das Recht, Sicherheitsleistung zu verlangen, steht Gläubigern nicht zu, die im Falle der Insolvenz ein Recht auf vorzugsweise Befriedigung aus einer Deckungsmasse haben, die nach gesetzlicher Vorschrift zu ihrem Schutz errichtet und staatlich überwacht ist."
    },
    {
      "date": "2024-12-05",
      "id": "95508",
      "original_text": "Sonstige Registerbekanntmachung\nBerlin Amtsgericht Berlin (Charlottenburg) HRB 156620\nMKSK Investment GmbH – Berlin",
      "type": "Sonstige Registerbekanntmachung",
      "state": "Berlin",
      "amtsgericht": "Amtsgericht Berlin (Charlottenburg)",
      "registernummer": "HRB 156620",
      "registerart": "HRB",
      "company_name": "MKSK Investment GmbH",
      "company_seat": "Berlin",
      "details": "05.12.2024 (Bekanntmachungsdatum)\n\nBerlin Amtsgericht Berlin (Charlottenburg) HRB 156620\nSonstige Registerbekanntmachung 04.12.2024 (Eintragungsdatum)\n\nMKSK Investment GmbH\nGesellschaft mit beschränkter Haftung\nBerlin\n\nAls nicht eingetragen wird veröffentlicht: Den Gläubigern der an der Verschmelzung beteiligten Rechtsträger ist, wenn sie binnen sechs Monaten nach dem Tag, an dem die Eintragung der Verschmelzung in das Register des Sitzes desjenigen Rechtsträgers, dessen Gläubiger sie sind, als bekannt gemacht gilt, ihren Anspruch nach Grund und Höhe schriftlich anmelden, Sicherheit zu leisten, soweit sie nicht Befriedigung verlangen können. Dieses Recht steht den Gläubigern jedoch nur zu, wenn sie glaubhaft machen, dass durch die Verschmelzung die Erfüllung ihrer Forderung gefährdet wird. Das Recht, Sicherheitsleistung zu verlangen, steht Gläubigern nicht zu, die im Falle der Insolvenz ein Recht auf vorzugsweise Befriedigung aus einer Deckungsmasse haben, die nach gesetzlicher Vorschrift zu ihrem Schutz errichtet und staatlich überwacht ist."
    },
    {
      "date": "2024-12-05",
      "id": "95509",
      "original_text": "Sonstige Registerbekanntmachung\nHamburg Amtsgericht Hamburg HRB 149665\nsh+ GmbH – Hamburg",
      "type": "Sonstige Registerbekanntmachung",
      "state": "Hamburg",
      "amtsgericht": "Amtsgericht Hamburg",
      "registernummer": "HRB 149665",
      "registerart": "HRB",
      "company_name": "sh+ GmbH",
      "company_seat": "Hamburg",
      "details": "05.12.2024 (Bekanntmachungsdatum)\n\nHamburg Amtsgericht Hamburg HRB 149665\nSonstige Registerbekanntmachung 05.12.2024 (Eintragungsdatum)\n\nsh+ GmbH\nGesellschaft mit beschränkter Haftung\nHamburg\n\nAls nicht eingetragen wird bekannt gemacht:  Den Gläubigern der Gesellschaft, deren Forderungen begründet worden sind, bevor die Eintragung der Vertragsbeendigung in das Handelsregister nach § 10 HGB als bekannt gemacht gilt, ist vom anderen Vertragsteil Sicherheit zu leisten, wenn sie sich binnen 6 Monaten nach Bekanntmachung der Eintragung zu diesem Zweck bei ihm melden."
    },
    {
      "date": "2024-12-05",
      "id": "95510",
      "original_text": "Registerbekanntmachung nach dem Umwandlungsgesetz\nSchleswig-Holstein Amtsgericht Pinneberg HRB 7076\nFeldstraße die Zweite Verwaltungsgesellschaft mbH – Heist",
      "type": "Registerbekanntmachung nach dem Umwandlungsgesetz",
      "state": "Schleswig-Holstein",
      "amtsgericht": "Amtsgericht Pinneberg",
      "registernummer": "HRB 7076",
      "registerart": "HRB",
      "company_name": "Feldstraße die Zweite Verwaltungsgesellschaft mbH",
      "company_seat": "Heist",
      "details": "05.12.2024 (Bekanntmachungsdatum)\n\nSchleswig-Holstein Amtsgericht Pinneberg HRB 7076\nRegisterbekanntmachung nach dem Umwandlungsgesetz 05.12.2024 (Eintragungsdatum)\n\nFeldstraße die Zweite Verwaltungsgesellschaft mbH\nGesellschaft mit beschränkter Haftung\nHeist\n\nZu Eintragungsnummer 5 vom 05.12.2024 wird als nicht eingetragen veröffentlicht: Als nicht eingetragen wird veröffentlicht: Den Gläubigern der an der Spaltung beteiligten Rechtsträger ist, wenn sie binnen sechs Monaten nach dem Tag, an dem die Eintragung der Spaltung in das Register des Sitzes desjenigen Rechtsträgers, dessen Gläubiger sie sind, als bekannt gemacht gilt, ihren Anspruch nach Grund und Höhe schriftlich anmelden, Sicherheit zu leisten, soweit sie nicht Befriedigung verlangen können. Dieses Recht steht den Gläubigern jedoch nur zu, wenn sie glaubhaft machen, dass durch die Spaltung die Erfüllung ihrer Forderung gefährdet wird. Das Recht, Sicherheitsleistung zu verlangen, steht Gläubigern nicht zu, die im Falle der Insolvenz ein Recht auf vorzugsweise Befriedigung aus einer Deckungsmasse haben, die nach gesetzlicher Vorschrift zu ihrem Schutz errichtet und staatlich überwacht ist."
    },
    {
      "date": "2024-12-05",
      "id": "95511",
      "original_text": "Registerbekanntmachung nach dem Umwandlungsgesetz\nBerlin Amtsgericht Berlin (Charlottenburg) HRA 54500\nThe Grounds App 2 GmbH & Co. KG – Berlin",
      "type": "Registerbekanntmachung nach dem Umwandlungsgesetz",
      "state": "Berlin",
      "amtsgericht": "Amtsgericht Berlin (Charlottenburg)",
      "registernummer": "HRA 54500",
      "registerart": "HRA",
      "company_name": "The Grounds App 2 GmbH & Co. KG",
      "company_seat": "Berlin",
      "details": "05.12.2024 (Bekanntmachungsdatum)\n\nBerlin Amtsgericht Berlin (Charlottenburg) HRA 54500\nRegisterbekanntmachung nach dem Umwandlungsgesetz 05.12.2024 (Eintragungsdatum)\n\nThe Grounds App 2 GmbH & Co. KG\nKommanditgesellschaft\nBerlin\n\nZu Eintragungsnummer 7 vom 05.12.2024 wird als nicht eingetragen veröffentlicht:\nDen Gläubigern ist, wenn sie binnen sechs Monaten nach dem Tag, an dem die Eintragung der Umwandlung als bekannt gemacht gilt, ihren Anspruch nach Grund und Höhe schriftlich anmelden, Sicherheit zu leisten, soweit sie nicht Befriedigung verlangen können. Dieses Recht steht den Gläubigern jedoch nur zu, wenn sie glaubhaft machen, dass durch die Umwandlung die Erfüllung ihrer Forderung gefährdet wird. Das Recht, Sicherheitsleistung zu verlangen, steht Gläubigern nicht zu, die im Falle der Insolvenz ein Recht auf vorzugsweise Befriedigung aus einer Deckungsmasse haben, die nach gesetzlicher Vorschrift zu ihrem Schutz errichtet und staatlich überwacht ist."
    },
    {
      "date": "2024-12-05",
      "id": "95512",
      "original_text": "Registerbekanntmachung nach dem Umwandlungsgesetz\nBerlin Amtsgericht Berlin (Charlottenburg) HRB 270082\nThe Grounds App 2 GmbH – Berlin",
      "type": "Registerbekanntmachung nach dem Umwandlungsgesetz",
      "state": "Berlin",
      "amtsgericht": "Amtsgericht Berlin (Charlottenburg)",
      "registernummer": "HRB 270082",
      "registerart": "HRB",
      "company_name": "The Grounds App 2 GmbH",
      "company_seat": "Berlin",
      "details": "05.12.2024 (Bekanntmachungsdatum)\n\nBerlin Amtsgericht Berlin (Charlottenburg) HRB 270082\nRegisterbekanntmachung nach dem Umwandlungsgesetz 05.12.2024 (Eintragungsdatum)\n\nThe Grounds App 2 GmbH\nGesellschaft mit beschränkter Haftung\nBerlin\n\nZu Eintragungsnummer 1 vom 05.12.2024 wird als nicht eingetragen veröffentlicht:\nDen Gläubigern ist, wenn sie binnen sechs Monaten nach dem Tag, an dem die Eintragung der Umwandlung als bekannt gemacht gilt, ihren Anspruch nach Grund und Höhe schriftlich anmelden, Sicherheit zu leisten, soweit sie nicht Befriedigung verlangen können. Dieses Recht steht den Gläubigern jedoch nur zu, wenn sie glaubhaft machen, dass durch die Umwandlung die Erfüllung ihrer Forderung gefährdet wird. Das Recht, Sicherheitsleistung zu verlangen, steht Gläubigern nicht zu, die im Falle der Insolvenz ein Recht auf vorzugsweise Befriedigung aus einer Deckungsmasse haben, die nach gesetzlicher Vorschrift zu ihrem Schutz errichtet und staatlich überwacht ist."
    },
    {
      "date": "2024-12-05",
      "id": "95513",
      "original_text": "Einreichung neuer Dokumente\nBrandenburg Amtsgericht Neuruppin HRB 8226\nKreiskrankenhaus Prignitz Schule für Gesundheitsberufe Perleberg GmbH – Perleberg",
      "type": "Einreichung neuer Dokumente",
      "state": "Brandenburg",
      "amtsgericht": "Amtsgericht Neuruppin",
      "registernummer": "HRB 8226",
      "registerart": "HRB",
      "company_name": "Kreiskrankenhaus Prignitz Schule für Gesundheitsberufe Perleberg GmbH",
      "company_seat": "Perleberg",
      "details": "05.12.2024 (Bekanntmachungsdatum)\n\nBrandenburg Amtsgericht Neuruppin HRB 8226\nEinreichung neuer Dokumente\n\nKreiskrankenhaus Prignitz Schule für Gesundheitsberufe Perleberg GmbH\nGesellschaft mit beschränkter Haftung\nPerleberg\n\nAls nicht eingetragen wird veröffentlicht: Eine Liste der Mitglieder des Aufsichtsrates wurde zum Handelsregister eingereicht."
    },
    {
      "date": "2024-12-05",
      "id": "95514",
      "original_text": "Einreichung neuer Dokumente\nBaden-Württemberg Amtsgericht Freiburg HRB 380008\nFlughafen-Gesellschaft Konstanz GmbH – Konstanz",
      "type": "Einreichung neuer Dokumente",
      "state": "Baden-Württemberg",
      "amtsgericht": "Amtsgericht Freiburg",
      "registernummer": "HRB 380008",
      "registerart": "HRB",
      "company_name": "Flughafen-Gesellschaft Konstanz GmbH",
      "company_seat": "Konstanz",
      "details": "05.12.2024 (Bekanntmachungsdatum)\n\nBaden-Württemberg Amtsgericht Freiburg HRB 380008\nEinreichung neuer Dokumente 05.12.2024 (Eintragungsdatum)\n\nFlughafen-Gesellschaft Konstanz GmbH\nGesellschaft mit beschränkter Haftung\nKonstanz\n\nDie Gesellschaft hat am 03.12.2024 die Liste über die Zusammensetzung des Aufsichtsrats zum Handelsregister eingereicht."
    },
    {
      "date": "2024-12-05",
      "id": "95515",
      "original_text": "Registerbekanntmachung nach dem Umwandlungsgesetz\nBaden-Württemberg Amtsgericht Stuttgart HRB 735674\nINCOVIS Projekt- und Prozessberatung GmbH – Filderstadt",
      "type": "Registerbekanntmachung nach dem Umwandlungsgesetz",
      "state": "Baden-Württemberg",
      "amtsgericht": "Amtsgericht Stuttgart",
      "registernummer": "HRB 735674",
      "registerart": "HRB",
      "company_name": "INCOVIS Projekt- und Prozessberatung GmbH",
      "company_seat": "Filderstadt",
      "details": "05.12.2024 (Bekanntmachungsdatum)\n\nBaden-Württemberg Amtsgericht Stuttgart HRB 735674\nRegisterbekanntmachung nach dem Umwandlungsgesetz 05.12.2024 (Eintragungsdatum)\n\nINCOVIS Projekt- und Prozessberatung GmbH\nGesellschaft mit beschränkter Haftung\nFilderstadt\n\nDen Gläubigern der an der Verschmelzung beteiligten Rechtsträger ist, wenn sie binnen sechs Monaten nach dem Tag, an dem die Eintragung der Verschmelzung in das Register des Sitzes desjenigen Rechtsträgers, dessen Gläubiger sie sind, nach § 19 Abs. 3 UmwG als bekanntgemacht gilt, ihren Anspruch nach Grund und Höhe schriftlich anmelden, Sicherheit zu leisten, soweit sie nicht Befriedigung verlangen können. Dieses Recht steht den Gläubigern jedoch nur zu, wenn sie glaubhaft machen, dass durch die Verschmelzung die Erfüllung ihrer Forderung gefährdet wird."
    },
    {
      "date": "2024-12-05",
      "id": "95516",
      "original_text": "Registerbekanntmachung nach dem Umwandlungsgesetz\nSchleswig-Holstein Amtsgericht Lübeck HRB 25608\nKurt Junge Klempnerei GmbH – Oststeinbek",
      "type": "Registerbekanntmachung nach dem Umwandlungsgesetz",
      "state": "Schleswig-Holstein",
      "amtsgericht": "Amtsgericht Lübeck",
      "registernummer": "HRB 25608",
      "registerart": "HRB",
      "company_name": "Kurt Junge Klempnerei GmbH",
      "company_seat": "Oststeinbek",
      "details": "05.12.2024 (Bekanntmachungsdatum)\n\nSchleswig-Holstein Amtsgericht Lübeck HRB 25608\nRegisterbekanntmachung nach dem Umwandlungsgesetz 04.12.2024 (Eintragungsdatum)\n\nKurt Junge Klempnerei GmbH\nGesellschaft mit beschränkter Haftung\nOststeinbek\n\nZu Eintragungsnummer 1 vom 04.12.2024 wird als nicht eingetragen veröffentlicht:\nDen Gläubigern der an der Ausgliederung beteiligten Rechtsträger ist, wenn sie binnen sechs Monaten nach dem Tag, an dem die Eintragung der Ausgliederung in das Register des Sitzes desjenigen Rechtsträgers, dessen Gläubiger sie sind, als bekannt gemacht gilt, ihren Anspruch nach Grund und Höhe schriftlich anmelden, Sicherheit zu leisten, soweit sie nicht Befriedigung verlangen können. Dieses Recht steht den Gläubigern jedoch nur zu, wenn sie glaubhaft machen, dass durch die Ausgliederung die Erfüllung ihrer Forderung gefährdet wird."
    },
    {
      "date": "2024-12-05",
      "id": "95517",
      "original_text": "Löschungsankündigung\nBaden-Württemberg Amtsgericht Ulm HRB 744519\nDado Group GmbH – Göppingen",
      "type": "Löschungsankündigung",
      "state": "Baden-Württemberg",
      "amtsgericht": "Amtsgericht Ulm",
      "registernummer": "HRB 744519",
      "registerart": "HRB",
      "company_name": "Dado Group GmbH",
      "company_seat": "Göppingen",
      "details": "05.12.2024 (Bekanntmachungsdatum)\n\nBaden-Württemberg Amtsgericht Ulm HRB 744519\nLöschungsankündigung\n\nDado Group GmbH\nGesellschaft mit beschränkter Haftung\nGöppingen\n\nDas Gericht beabsichtigt, die Gesellschaft wegen Vermögenslosigkeit im Handelsregister von Amts wegen nach § 394 FamFG zu löschen. Die Frist zur Geltendmachung eines Widerspruchs gegen die beabsichtigte Löschung ist auf  einen Monat ab Veröffentlichung bestimmt."
    },
    {
      "date": "2024-12-05",
      "id": "95518",
      "original_text": "Löschungsankündigung\nSchleswig-Holstein Amtsgericht Kiel HRA 4925\nREMONDIS GmbH & Co. KG – Melsdorf",
      "type": "Löschungsankündigung",
      "state": "Schleswig-Holstein",
      "amtsgericht": "Amtsgericht Kiel",
      "registernummer": "HRA 4925",
      "registerart": "HRA",
      "company_name": "REMONDIS GmbH & Co. KG",
      "company_seat": "Melsdorf",
      "details": "05.12.2024 (Bekanntmachungsdatum)\n\nSchleswig-Holstein Amtsgericht Kiel HRA 4925\nLöschungsankündigung\n\nREMONDIS GmbH & Co. KG\nKommanditgesellschaft\nMelsdorf\n\nBei der nachstehenden Firma wird das Amtslöschungsverfahren gemäß § 31 Abs. 2 HGB eingeleitet. Widerspruchsfrist: 2 Monate."
    },
    {
      "date": "2024-12-05",
      "id": "95519",
      "original_text": "Einreichung neuer Dokumente\nSachsen Amtsgericht Leipzig HRB 5947\nStadtwerke Delitzsch GmbH – Delitzsch",
      "type": "Einreichung neuer Dokumente",
      "state": "Sachsen",
      "amtsgericht": "Amtsgericht Leipzig",
      "registernummer": "HRB 5947",
      "registerart": "HRB",
      "company_name": "Stadtwerke Delitzsch GmbH",
      "company_seat": "Delitzsch",
      "details": "05.12.2024 (Bekanntmachungsdatum)\n\nSachsen Amtsgericht Leipzig HRB 5947\nEinreichung neuer Dokumente\n\nStadtwerke Delitzsch GmbH\nGesellschaft mit beschränkter Haftung\nDelitzsch\n\nAm 03.12.2024 wurde beim Handelsregister des Amtsgerichts Leipzig die Liste der Mitglieder des Aufsichtsrats gemäß § 52 GmbHG eingereicht."
    },
    {
      "date": "2024-12-05",
      "id": "95520",
      "original_text": "Registerbekanntmachung nach dem Umwandlungsgesetz\nSachsen Amtsgericht Leipzig HRB 25051\nQUANTIC Digital GmbH – Leipzig",
      "type": "Registerbekanntmachung nach dem Umwandlungsgesetz",
      "state": "Sachsen",
      "amtsgericht": "Amtsgericht Leipzig",
      "registernummer": "HRB 25051",
      "registerart": "HRB",
      "company_name": "QUANTIC Digital GmbH",
      "company_seat": "Leipzig",
      "details": "05.12.2024 (Bekanntmachungsdatum)\n\nSachsen Amtsgericht Leipzig HRB 25051\nRegisterbekanntmachung nach dem Umwandlungsgesetz 05.12.2024 (Eintragungsdatum)\n\nQUANTIC Digital GmbH\nGesellschaft mit beschränkter Haftung\nLeipzig\n\nDen Gläubigern der an der Verschmelzung beteiligten Rechtsträger ist, wenn sie binnen sechs Monaten nach dem Tag, an dem die Eintragung der Verschmelzung in das Register des Sitzes desjenigen Rechtsträgers, dessen Gläubiger sie sind, nach § 19 Abs. 3 UmwG als bekannt gemacht gilt, ihren Anspruch nach Grund und Höhe schriftlich anmelden, Sicherheit zu leisten, soweit sie nicht Befriedigung verlangen können. Dieses Recht steht den Gläubigern jedoch nur zu, wenn sie glaubhaft machen, dass durch die Verschmelzung die Erfüllung der Forderung gefährdet wird."
    },
    {
      "date": "2024-12-05",
      "id": "95521",
      "original_text": "Einreichung neuer Dokumente\nSachsen Amtsgericht Dresden HRB 14061\nWohnungs- und Verwaltungsgesellschaft Nossen mbH – Nossen",
      "type": "Einreichung neuer Dokumente",
      "state": "Sachsen",
      "amtsgericht": "Amtsgericht Dresden",
      "registernummer": "HRB 14061",
      "registerart": "HRB",
      "company_name": "Wohnungs- und Verwaltungsgesellschaft Nossen mbH",
      "company_seat": "Nossen",
      "details": "05.12.2024 (Bekanntmachungsdatum)\n\nSachsen Amtsgericht Dresden HRB 14061\nEinreichung neuer Dokumente 05.12.2024 (Eintragungsdatum)\n\nWohnungs- und Verwaltungsgesellschaft Nossen mbH\nGesellschaft mit beschränkter Haftung\nNossen\n\nAm 03.12.2024 wurde beim Handelsregister des Amtsgerichts Dresden die Liste der Mitglieder des Aufsichtsrats gemäß § 52 GmbHG eingereicht."
    },
    {
      "date": "2024-12-05",
      "id": "95522",
      "original_text": "Löschungsankündigung\nSachsen Amtsgericht Dresden HRB 26986\nPhönix-Hotelbetriebsgesellschaft mbH – Dresden",
      "type": "Löschungsankündigung",
      "state": "Sachsen",
      "amtsgericht": "Amtsgericht Dresden",
      "registernummer": "HRB 26986",
      "registerart": "HRB",
      "company_name": "Phönix-Hotelbetriebsgesellschaft mbH",
      "company_seat": "Dresden",
      "details": "05.12.2024 (Bekanntmachungsdatum)\n\nSachsen Amtsgericht Dresden HRB 26986\nLöschungsankündigung\n\nPhönix-Hotelbetriebsgesellschaft mbH\nGesellschaft mit beschränkter Haftung\nDresden\n\nDas Registergericht beabsichtigt, die im Handelsregister eingetragene Gesellschaft von Amts wegen nach § 394 FamFG zu löschen. Die Frist zu Erhebung eines Widerspruchs gegen die beabsichtigte Löschung wird auf einen Monat festgesetzt."
    },
    {
      "date": "2024-12-05",
      "id": "95523",
      "original_text": "Registerbekanntmachung nach dem Umwandlungsgesetz\nSachsen Amtsgericht Leipzig HRB 30590\nAGAPLESION MITTELDEUTSCHLAND gemeinnützige GmbH – Leipzig",
      "type": "Registerbekanntmachung nach dem Umwandlungsgesetz",
      "state": "Sachsen",
      "amtsgericht": "Amtsgericht Leipzig",
      "registernummer": "HRB 30590",
      "registerart": "HRB",
      "company_name": "AGAPLESION MITTELDEUTSCHLAND gemeinnützige GmbH",
      "company_seat": "Leipzig",
      "details": "05.12.2024 (Bekanntmachungsdatum)\n\nSachsen Amtsgericht Leipzig HRB 30590\nRegisterbekanntmachung nach dem Umwandlungsgesetz 05.12.2024 (Eintragungsdatum)\n\nAGAPLESION MITTELDEUTSCHLAND gemeinnützige GmbH\nGesellschaft mit beschränkter Haftung\nLeipzig\n\nDen Gläubigern der an der Verschmelzung beteiligten Rechtsträger ist, wenn sie binnen sechs Monaten nach dem Tag, an dem die Eintragung der Verschmelzung in das Register des Sitzes desjenigen Rechtsträgers, dessen Gläubiger sie sind, nach § 19 Abs. 3 UmwG als bekannt gemacht gilt, ihren Anspruch nach Grund und Höhe schriftlich anmelden, Sicherheit zu leisten, soweit sie nicht Befriedigung verlangen können. Dieses Recht steht den Gläubigern jedoch nur zu, wenn sie glaubhaft machen, dass durch die Verschmelzung die Erfüllung der Forderung gefährdet wird."
    },
    {
      "date": "2024-12-05",
      "id": "95524",
      "original_text": "Einreichung neuer Dokumente\nSachsen Amtsgericht Dresden HRB 4115\nStädtisches Klinikum Görlitz gGmbH – Görlitz",
      "type": "Einreichung neuer Dokumente",
      "state": "Sachsen",
      "amtsgericht": "Amtsgericht Dresden",
      "registernummer": "HRB 4115",
      "registerart": "HRB",
      "company_name": "Städtisches Klinikum Görlitz gGmbH",
      "company_seat": "Görlitz",
      "details": "05.12.2024 (Bekanntmachungsdatum)\n\nSachsen Amtsgericht Dresden HRB 4115\nEinreichung neuer Dokumente\n\nStädtisches Klinikum Görlitz gGmbH\nGesellschaft mit beschränkter Haftung\nGörlitz\n\nAm 04.12.2024 wurde beim Handelsregister des Amtsgerichts Dresden die Liste der Mitglieder des Aufsichtsrats gemäß § 52 GmbHG eingereicht."
    },
    {
      "date": "2024-12-05",
      "id": "95525",
      "original_text": "Registerbekanntmachung nach dem Umwandlungsgesetz\nSachsen Amtsgericht Leipzig HRB 41885\nPolyxo Studios GmbH – Leipzig",
      "type": "Registerbekanntmachung nach dem Umwandlungsgesetz",
      "state": "Sachsen",
      "amtsgericht": "Amtsgericht Leipzig",
      "registernummer": "HRB 41885",
      "registerart": "HRB",
      "company_name": "Polyxo Studios GmbH",
      "company_seat": "Leipzig",
      "details": "05.12.2024 (Bekanntmachungsdatum)\n\nSachsen Amtsgericht Leipzig HRB 41885\nRegisterbekanntmachung nach dem Umwandlungsgesetz 05.12.2024 (Eintragungsdatum)\n\nPolyxo Studios GmbH\nGesellschaft mit beschränkter Haftung\nLeipzig\n\nDen Gläubigern der an der Verschmelzung beteiligten Rechtsträger ist, wenn sie binnen sechs Monaten nach dem Tag, an dem die Eintragung der Verschmelzung in das Register des Sitzes desjenigen Rechtsträgers, dessen Gläubiger sie sind, nach § 19 Abs. 3 UmwG als bekannt gemacht gilt, ihren Anspruch nach Grund und Höhe schriftlich anmelden, Sicherheit zu leisten, soweit sie nicht Befriedigung verlangen können. Dieses Recht steht den Gläubigern jedoch nur zu, wenn sie glaubhaft machen, dass durch die Verschmelzung die Erfüllung der Forderung gefährdet wird."
    },
    {
      "date": "2024-12-05",
      "id": "95526",
      "original_text": "Einreichung neuer Dokumente\nSachsen Amtsgericht Chemnitz HRB 9026\nSeniorenheime Freiberg gemeinnützige Gesellschaft mit beschränkter Haftung – Freiberg",
      "type": "Einreichung neuer Dokumente",
      "state": "Sachsen",
      "amtsgericht": "Amtsgericht Chemnitz",
      "registernummer": "HRB 9026",
      "registerart": "HRB",
      "company_name": "Seniorenheime Freiberg gemeinnützige Gesellschaft mit beschränkter Haftung",
      "company_seat": "Freiberg",
      "details": "05.12.2024 (Bekanntmachungsdatum)\n\nSachsen Amtsgericht Chemnitz HRB 9026\nEinreichung neuer Dokumente\n\nSeniorenheime Freiberg gemeinnützige Gesellschaft mit beschränkter Haftung\nGesellschaft mit beschränkter Haftung\nFreiberg\n\nAm 04.12.2024 wurde beim Handelsregister des Amtsgerichts Chemnitz die Liste der Mitglieder des Aufsichtsrats gemäß § 52 GmbHG eingereicht."
    },
    {
      "date": "2024-12-05",
      "id": "95527",
      "original_text": "Registerbekanntmachung nach dem Umwandlungsgesetz\nSachsen Amtsgericht Leipzig HRB 43278\nBBG - Bethanien Beteiligungsgesellschaft GmbH – Leipzig",
      "type": "Registerbekanntmachung nach dem Umwandlungsgesetz",
      "state": "Sachsen",
      "amtsgericht": "Amtsgericht Leipzig",
      "registernummer": "HRB 43278",
      "registerart": "HRB",
      "company_name": "BBG - Bethanien Beteiligungsgesellschaft GmbH",
      "company_seat": "Leipzig",
      "details": "05.12.2024 (Bekanntmachungsdatum)\n\nSachsen Amtsgericht Leipzig HRB 43278\nRegisterbekanntmachung nach dem Umwandlungsgesetz 05.12.2024 (Eintragungsdatum)\n\nBBG - Bethanien Beteiligungsgesellschaft GmbH\nGesellschaft mit beschränkter Haftung\nLeipzig\n\nDen Gläubigern der an der Verschmelzung beteiligten Rechtsträger ist, wenn sie binnen sechs Monaten nach dem Tag, an dem die Eintragung der Verschmelzung in das Register des Sitzes desjenigen Rechtsträgers, dessen Gläubiger sie sind, nach § 19 Abs. 3 UmwG als bekannt gemacht gilt, ihren Anspruch nach Grund und Höhe schriftlich anmelden, Sicherheit zu leisten, soweit sie nicht Befriedigung verlangen können. Dieses Recht steht den Gläubigern jedoch nur zu, wenn sie glaubhaft machen, dass durch die Verschmelzung die Erfüllung der Forderung gefährdet wird."
    },
    {
      "date": "2024-12-05",
      "id": "95528",
      "original_text": "Einreichung neuer Dokumente\nSachsen Amtsgericht Dresden HRB 40037\nConnCons GmbH – Dresden",
      "type": "Einreichung neuer Dokumente",
      "state": "Sachsen",
      "amtsgericht": "Amtsgericht Dresden",
      "registernummer": "HRB 40037",
      "registerart": "HRB",
      "company_name": "ConnCons GmbH",
      "company_seat": "Dresden",
      "details": "05.12.2024 (Bekanntmachungsdatum)\n\nSachsen Amtsgericht Dresden HRB 40037\nEinreichung neuer Dokumente\n\nConnCons GmbH\nGesellschaft mit beschränkter Haftung\nDresden\n\nAm 03.12.2024 wurde beim Handelsregister des Amtsgerichts Dresden die Liste der Mitglieder des Aufsichtsrats gemäß § 52 GmbHG eingereicht."
    },
    {
      "date": "2024-12-05",
      "id": "95529",
      "original_text": "Einreichung neuer Dokumente\nSachsen Amtsgericht Leipzig HRB 17227\nDr. Födisch Umweltmesstechnik AG – Markranstädt",
      "type": "Einreichung neuer Dokumente",
      "state": "Sachsen",
      "amtsgericht": "Amtsgericht Leipzig",
      "registernummer": "HRB 17227",
      "registerart": "HRB",
      "company_name": "Dr. Födisch Umweltmesstechnik AG",
      "company_seat": "Markranstädt",
      "details": "05.12.2024 (Bekanntmachungsdatum)\n\nSachsen Amtsgericht Leipzig HRB 17227\nEinreichung neuer Dokumente 05.12.2024 (Eintragungsdatum)\n\nDr. Födisch Umweltmesstechnik AG\nAktiengesellschaft\nMarkranstädt\n\nAm 29.11.2024 wurde beim Handelsregister des Amtsgerichts Leipzig die Liste der Mitglieder des Aufsichtsrats gemäß § 106 AktG eingereicht."
    },
    {
      "date": "2024-12-05",
      "id": "95530",
      "original_text": "Einreichung neuer Dokumente\nNiedersachsen Amtsgericht Oldenburg (Oldenburg) GnR 150021 früher Amtsgericht Cloppenburg\nVolksbank eG – Friesoythe",
      "type": "Einreichung neuer Dokumente",
      "state": "Niedersachsen",
      "amtsgericht": "Amtsgericht Oldenburg (Oldenburg)",
      "registernummer": "GnR 150021",
      "registerart": "GnR",
      "company_name": "Volksbank eG",
      "company_seat": "Friesoythe",
      "former_amtsgericht": "Cloppenburg",
      "details": "05.12.2024 (Bekanntmachungsdatum)\n\nNiedersachsen Amtsgericht Oldenburg (Oldenburg) GnR 150021 früher Amtsgericht Cloppenburg\nEinreichung neuer Dokumente\n\nVolksbank eG\neingetragene Genossenschaft\nFriesoythe\n\nDie Liste der Mitglieder des Aufsichtsrats wurde beim Registergericht eingereicht."
    },
    {
      "date": "2024-12-05",
      "id": "95531",
      "original_text": "Registerbekanntmachung nach dem Umwandlungsgesetz\nNiedersachsen Amtsgericht Osnabrück HRA 208967\nUlrich Borkowski Bau- und Möbeltischlerei e. K. – Hilter a.T.W.",
      "type": "Registerbekanntmachung nach dem Umwandlungsgesetz",
      "state": "Niedersachsen",
      "amtsgericht": "Amtsgericht Osnabrück",
      "registernummer": "HRA 208967",
      "registerart": "HRA",
      "company_name": "Ulrich Borkowski Bau- und Möbeltischlerei e. K.",
      "company_seat": "Hilter a.T.W.",
      "details": "05.12.2024 (Bekanntmachungsdatum)\n\nNiedersachsen Amtsgericht Osnabrück HRA 208967\nRegisterbekanntmachung nach dem Umwandlungsgesetz 05.12.2024 (Eintragungsdatum)\n\nUlrich Borkowski Bau- und Möbeltischlerei e. K.\nEinzelkaufmann / Einzelkauffrau\nHilter a.T.W.\n\nDen Gläubigern der an der Ausgliederung beteiligten Rechtsträger ist, wenn sie binnen sechs Monaten nach dem Tag, an dem die Eintragung der Ausgliederung in das Register des Sitzes desjenigen Rechtsträgers, dessen Gläubiger sie sind, nach § 19 Abs. 3 UmwG als bekannt gemacht gilt, ihren Anspruch nach Grund und Höhe schriftlich anmelden, Sicherheit zu leisten, soweit sie nicht Befriedigung verlangen können. Dieses Recht steht den Gläubigern jedoch nur zu, wenn sie glaubhaft machen, dass durch die Ausgliederung die Erfüllung der Forderung gefährdet wird."
    },
    {
      "date": "2024-12-05",
      "id": "95532",
      "original_text": "Löschungsankündigung\nNiedersachsen Amtsgericht Osnabrück HRB 212943\nMailo Holding GmbH – Emsbüren",
      "type": "Löschungsankündigung",
      "state": "Niedersachsen",
      "amtsgericht": "Amtsgericht Osnabrück",
      "registernummer": "HRB 212943",
      "registerart": "HRB",
      "company_name": "Mailo Holding GmbH",
      "company_seat": "Emsbüren",
      "details": "05.12.2024 (Bekanntmachungsdatum)\n\nNiedersachsen Amtsgericht Osnabrück HRB 212943\nLöschungsankündigung\n\nMailo Holding GmbH\nGesellschaft mit beschränkter Haftung\nEmsbüren\n\nDas Registergericht beabsichtigt, die Gesellschaft von Amts wegen nach § 394 FamFG wegen Vermögenslosigkeit zu löschen. Die Frist zur Erhebung eines Widerspruchs ist auf 1 Monat ab dieser Registerbekanntmachung festgesetzt."
    },
    {
      "date": "2024-12-05",
      "id": "95533",
      "original_text": "Einreichung neuer Dokumente\nNiedersachsen Amtsgericht Hannover HRB 226688\nSennheiser Verwaltungs SE – Wedemark",
      "type": "Einreichung neuer Dokumente",
      "state": "Niedersachsen",
      "amtsgericht": "Amtsgericht Hannover",
      "registernummer": "HRB 226688",
      "registerart": "HRB",
      "company_name": "Sennheiser Verwaltungs SE",
      "company_seat": "Wedemark",
      "details": "05.12.2024 (Bekanntmachungsdatum)\n\nNiedersachsen Amtsgericht Hannover HRB 226688\nEinreichung neuer Dokumente\n\nSennheiser Verwaltungs SE\nEuropäische Aktiengesellschaft (SE)\nWedemark\n\nDie Liste der Mitglieder des Verwaltungsrats wurde beim Registergericht eingereicht."
    },
    {
      "date": "2024-12-05",
      "id": "95534",
      "original_text": "Registerbekanntmachung nach dem Umwandlungsgesetz\nNiedersachsen Amtsgericht Walsrode HRB 211514\ncertavo GmbH – Weyhe",
      "type": "Registerbekanntmachung nach dem Umwandlungsgesetz",
      "state": "Niedersachsen",
      "amtsgericht": "Amtsgericht Walsrode",
      "registernummer": "HRB 211514",
      "registerart": "HRB",
      "company_name": "certavo GmbH",
      "company_seat": "Weyhe",
      "details": "05.12.2024 (Bekanntmachungsdatum)\n\nNiedersachsen Amtsgericht Walsrode HRB 211514\nRegisterbekanntmachung nach dem Umwandlungsgesetz 05.12.2024 (Eintragungsdatum)\n\ncertavo GmbH\nGesellschaft mit beschränkter Haftung\nWeyhe\n\nDen Gläubigern der an der formwechselnden Umwandlung beteiligten Rechtsträger ist, wenn sie binnen sechs Monaten nach dem Tag, an dem die Eintragung der Umwandlung in das Register des Sitzes desjenigen Rechtsträgers, dessen Gläubiger sie sind, nach § 19 Abs. 3 UmwG als bekannt gemacht gilt, ihren Anspruch nach Grund und Höhe schriftlich anmelden, Sicherheit zu leisten, soweit sie nicht Befriedigung verlangen können. Dieses Recht steht den Gläubigern jedoch nur zu, wenn sie glaubhaft machen, dass durch die formwechselnde Umwandlung die Erfüllung der Forderung gefährdet wird."
    },
    {
      "date": "2024-12-05",
      "id": "95535",
      "original_text": "Einreichung neuer Dokumente\nNiedersachsen Amtsgericht Oldenburg (Oldenburg) HRB 151594 früher Amtsgericht Cloppenburg\nLandvolk Betriebsmittel GmbH – Cloppenburg",
      "type": "Einreichung neuer Dokumente",
      "state": "Niedersachsen",
      "amtsgericht": "Amtsgericht Oldenburg (Oldenburg)",
      "registernummer": "HRB 151594",
      "registerart": "HRB",
      "company_name": "Landvolk Betriebsmittel GmbH",
      "company_seat": "Cloppenburg",
      "former_amtsgericht": "Cloppenburg",
      "details": "05.12.2024 (Bekanntmachungsdatum)\n\nNiedersachsen Amtsgericht Oldenburg (Oldenburg) HRB 151594 früher Amtsgericht Cloppenburg\nEinreichung neuer Dokumente\n\nLandvolk Betriebsmittel GmbH\nGesellschaft mit beschränkter Haftung\nCloppenburg\n\nDie Liste der Mitglieder des Aufsichtsrats wurde beim Registergericht eingereicht."
    },
    {
      "date": "2024-12-05",
      "id": "95536",
      "original_text": "Löschungsankündigung\nNiedersachsen Amtsgericht Hildesheim HRB 203477\nPV Montagebau GmbH – Algermissen",
      "type": "Löschungsankündigung",
      "state": "Niedersachsen",
      "amtsgericht": "Amtsgericht Hildesheim",
      "registernummer": "HRB 203477",
      "registerart": "HRB",
      "company_name": "PV Montagebau GmbH",
      "company_seat": "Algermissen",
      "details": "05.12.2024 (Bekanntmachungsdatum)\n\nNiedersachsen Amtsgericht Hildesheim HRB 203477\nLöschungsankündigung 05.12.2024 (Eintragungsdatum)\n\nPV Montagebau GmbH\nGesellschaft mit beschränkter Haftung\nAlgermissen\n\nDas Registergericht beabsichtigt, die Gesellschaft von Amts wegen nach § 394 FamFG zu löschen. Die Frist zur Erhebung eines Widerspruchs ist auf 1 Monat ab dieser Registerbekanntmachung festgesetzt."
    },
    {
      "date": "2024-12-05",
      "id": "95537",
      "original_text": "Einreichung neuer Dokumente\nNiedersachsen Amtsgericht Hannover HRB 226687\nSennheiser Management SE – Wedemark",
      "type": "Einreichung neuer Dokumente",
      "state": "Niedersachsen",
      "amtsgericht": "Amtsgericht Hannover",
      "registernummer": "HRB 226687",
      "registerart": "HRB",
      "company_name": "Sennheiser Management SE",
      "company_seat": "Wedemark",
      "details": "05.12.2024 (Bekanntmachungsdatum)\n\nNiedersachsen Amtsgericht Hannover HRB 226687\nEinreichung neuer Dokumente\n\nSennheiser Management SE\nEuropäische Aktiengesellschaft (SE)\nWedemark\n\nDie Liste der Mitglieder des Verwaltungsrats wurde beim Registergericht eingereicht."
    },
    {
      "date": "2024-12-05",
      "id": "95538",
      "original_text": "Registerbekanntmachung nach dem Umwandlungsgesetz\nNiedersachsen Amtsgericht Walsrode HRB 212373\nCERTAVO AG – Weyhe",
      "type": "Registerbekanntmachung nach dem Umwandlungsgesetz",
      "state": "Niedersachsen",
      "amtsgericht": "Amtsgericht Walsrode",
      "registernummer": "HRB 212373",
      "registerart": "HRB",
      "company_name": "CERTAVO AG",
      "company_seat": "Weyhe",
      "details": "05.12.2024 (Bekanntmachungsdatum)\n\nNiedersachsen Amtsgericht Walsrode HRB 212373\nRegisterbekanntmachung nach dem Umwandlungsgesetz 05.12.2024 (Eintragungsdatum)\n\nCERTAVO AG\nAktiengesellschaft\nWeyhe\n\nDen Gläubigern der an der formwechselnden Umwandlung beteiligten Rechtsträger ist, wenn sie binnen sechs Monaten nach dem Tag, an dem die Eintragung der Umwandlung in das Register des Sitzes desjenigen Rechtsträgers, dessen Gläubiger sie sind, nach § 19 Abs. 3 UmwG als bekannt gemacht gilt, ihren Anspruch nach Grund und Höhe schriftlich anmelden, Sicherheit zu leisten, soweit sie nicht Befriedigung verlangen können. Dieses Recht steht den Gläubigern jedoch nur zu, wenn sie glaubhaft machen, dass durch die formwechselnde Umwandlung die Erfüllung der Forderung gefährdet wird."
    },
    {
      "date": "2024-12-05",
      "id": "95539",
      "original_text": "Löschungsankündigung\nNiedersachsen Amtsgericht Osnabrück HRB 214400\nE. J. B-Bau GmbH – Lähden/OT Holte-Lastrup",
      "type": "Löschungsankündigung",
      "state": "Niedersachsen",
      "amtsgericht": "Amtsgericht Osnabrück",
      "registernummer": "HRB 214400",
      "registerart": "HRB",
      "company_name": "E. J. B-Bau GmbH",
      "company_seat": "Lähden/OT Holte-Lastrup",
      "details": "05.12.2024 (Bekanntmachungsdatum)\n\nNiedersachsen Amtsgericht Osnabrück HRB 214400\nLöschungsankündigung\n\nE. J. B-Bau GmbH\nGesellschaft mit beschränkter Haftung\nLähden/OT Holte-Lastrup\n\nDas Registergericht beabsichtigt, die Gesellschaft von Amts wegen nach § 394 FamFG wegen Vermögenslosigkeit zu löschen. Die Frist zur Erhebung eines Widerspruchs ist auf 1 Monat ab dieser Registerbekanntmachung festgesetzt."
    },
    {
      "date": "2024-12-05",
      "id": "95540",
      "original_text": "Einreichung neuer Dokumente\nNiedersachsen Amtsgericht Osnabrück HRB 214664\nKME Germany GmbH – Osnabrück",
      "type": "Einreichung neuer Dokumente",
      "state": "Niedersachsen",
      "amtsgericht": "Amtsgericht Osnabrück",
      "registernummer": "HRB 214664",
      "registerart": "HRB",
      "company_name": "KME Germany GmbH",
      "company_seat": "Osnabrück",
      "details": "05.12.2024 (Bekanntmachungsdatum)\n\nNiedersachsen Amtsgericht Osnabrück HRB 214664\nEinreichung neuer Dokumente 05.12.2024 (Eintragungsdatum)\n\nKME Germany GmbH\nGesellschaft mit beschränkter Haftung\nOsnabrück\n\nDie Liste der Mitglieder des Aufsichtsrats wurde beim Registergericht eingereicht."
    },
    {
      "date": "2024-12-05",
      "id": "95541",
      "original_text": "Löschungsankündigung\nNiedersachsen Amtsgericht Osnabrück HRB 212100\nMDS Servicedienstleistung UG (haftungsbeschränkt) – Meppen",
      "type": "Löschungsankündigung",
      "state": "Niedersachsen",
      "amtsgericht": "Amtsgericht Osnabrück",
      "registernummer": "HRB 212100",
      "registerart": "HRB",
      "company_name": "MDS Servicedienstleistung UG (haftungsbeschränkt)",
      "company_seat": "Meppen",
      "details": "05.12.2024 (Bekanntmachungsdatum)\n\nNiedersachsen Amtsgericht Osnabrück HRB 212100\nLöschungsankündigung\n\nMDS Servicedienstleistung UG (haftungsbeschränkt)\nGesellschaft mit beschränkter Haftung\nMeppen\n\nDas Registergericht beabsichtigt, die Gesellschaft von Amts wegen nach § 394 FamFG wegen Vermögenslosigkeit zu löschen. Die Frist zur Erhebung eines Widerspruchs ist auf 1 Monat ab dieser Registerbekanntmachung festgesetzt."
    },
    {
      "date": "2024-12-05",
      "id": "95542",
      "original_text": "Löschungsankündigung\nBremen Amtsgericht Bremen HRB 29183\nArctica Sport UG (haftungsbeschränkt) – Bremen",
      "type": "Löschungsankündigung",
      "state": "Bremen",
      "amtsgericht": "Amtsgericht Bremen",
      "registernummer": "HRB 29183",
      "registerart": "HRB",
      "company_name": "Arctica Sport UG (haftungsbeschränkt)",
      "company_seat": "Bremen",
      "details": "05.12.2024 (Bekanntmachungsdatum)\n\nBremen Amtsgericht Bremen HRB 29183\nLöschungsankündigung\n\nArctica Sport UG (haftungsbeschränkt)\nGesellschaft mit beschränkter Haftung\nBremen\n\nEs ist beabsichtigt die im Handelsregister eingetragene Gesellschaft von Amts wegen gemäß § 394 FamFG zu löschen. Gegen die Löschung kann beim AG Bremen schriftlich oder zu Protokoll der Geschäftsstelle Widerspruch eingelegt werden. Widerspruchsfrist 4 Wochen."
    },
    {
      "date": "2024-12-05",
      "id": "95543",
      "original_text": "Löschungsankündigung\nBremen Amtsgericht Bremen HRA 29130\nCP Neu Wulmstorf GmbH & Co. KG – Bremen",
      "type": "Löschungsankündigung",
      "state": "Bremen",
      "amtsgericht": "Amtsgericht Bremen",
      "registernummer": "HRA 29130",
      "registerart": "HRA",
      "company_name": "CP Neu Wulmstorf GmbH & Co. KG",
      "company_seat": "Bremen",
      "details": "05.12.2024 (Bekanntmachungsdatum)\n\nBremen Amtsgericht Bremen HRA 29130\nLöschungsankündigung\n\nCP Neu Wulmstorf GmbH & Co. KG\nKommanditgesellschaft\nBremen\n\nEs ist beabsichtigt die im Handelsregister eingetragene Firma von Amts wegen gemäß § 31 Abs.2 HGB zu löschen. Gegen die Löschung kann beim AG Bremen schriftlich oder zu Protokoll der Geschäftsstelle Widerspruch eingelegt werden. Widerspruchsfrist 4 Wochen."
    },
    {
      "date": "2024-12-05",
      "id": "95544",
      "original_text": "Löschungsankündigung\nBremen Amtsgericht Bremen HRB 32907\nReparatur Experten GmbH – Bremen",
      "type": "Löschungsankündigung",
      "state": "Bremen",
      "amtsgericht": "Amtsgericht Bremen",
      "registernummer": "HRB 32907",
      "registerart": "HRB",
      "company_name": "Reparatur Experten GmbH",
      "company_seat": "Bremen",
      "details": "05.12.2024 (Bekanntmachungsdatum)\n\nBremen Amtsgericht Bremen HRB 32907\nLöschungsankündigung\n\nReparatur Experten GmbH\nGesellschaft mit beschränkter Haftung\nBremen\n\nEs ist beabsichtigt die im Handelsregister eingetragene Gesellschaft von Amts wegen gemäß § 394 FamFG zu löschen. Gegen die Löschung kann beim AG Bremen schriftlich oder zu Protokoll der Geschäftsstelle Widerspruch eingelegt werden. Widerspruchsfrist 4 Wochen."
    },
    {
      "date": "2024-12-05",
      "id": "95545",
      "original_text": "Löschungsankündigung\nBremen Amtsgericht Bremen HRB 32139\nKlein Michel Verwaltungs GmbH – Bremen",
      "type": "Löschungsankündigung",
      "state": "Bremen",
      "amtsgericht": "Amtsgericht Bremen",
      "registernummer": "HRB 32139",
      "registerart": "HRB",
      "company_name": "Klein Michel Verwaltungs GmbH",
      "company_seat": "Bremen",
      "details": "05.12.2024 (Bekanntmachungsdatum)\n\nBremen Amtsgericht Bremen HRB 32139\nLöschungsankündigung\n\nKlein Michel Verwaltungs GmbH\nGesellschaft mit beschränkter Haftung\nBremen\n\nEs ist beabsichtigt die im Handelsregister eingetragene Gesellschaft von Amts wegen gemäß § 394 FamFG zu löschen. Gegen die Löschung kann beim AG Bremen schriftlich oder zu Protokoll der Geschäftsstelle Widerspruch eingelegt werden. Widerspruchsfrist 4 Wochen."
    },
    {
      "date": "2024-12-05",
      "id": "95546",
      "original_text": "Einreichung neuer Dokumente\nRheinland-Pfalz Amtsgericht Mainz HRB 50334\nIMDIRA AG – Mainz",
      "type": "Einreichung neuer Dokumente",
      "state": "Rheinland-Pfalz",
      "amtsgericht": "Amtsgericht Mainz",
      "registernummer": "HRB 50334",
      "registerart": "HRB",
      "company_name": "IMDIRA AG",
      "company_seat": "Mainz",
      "details": "05.12.2024 (Bekanntmachungsdatum)\n\nRheinland-Pfalz Amtsgericht Mainz HRB 50334\nEinreichung neuer Dokumente\n\nIMDIRA AG\nAktiengesellschaft\nMainz\n\nDem Registergericht ist eine neue Liste der Mitglieder des Aufsichtsrates eingereicht worden."
    },
    {
      "date": "2024-12-05",
      "id": "95547",
      "original_text": "Registerbekanntmachung nach dem Umwandlungsgesetz\nRheinland-Pfalz Amtsgericht Kaiserslautern HRA 30954\nMemory Kaiserslautern OHG – Kaiserslautern",
      "type": "Registerbekanntmachung nach dem Umwandlungsgesetz",
      "state": "Rheinland-Pfalz",
      "amtsgericht": "Amtsgericht Kaiserslautern",
      "registernummer": "HRA 30954",
      "registerart": "HRA",
      "company_name": "Memory Kaiserslautern OHG",
      "company_seat": "Kaiserslautern",
      "details": "05.12.2024 (Bekanntmachungsdatum)\n\nRheinland-Pfalz Amtsgericht Kaiserslautern HRA 30954\nRegisterbekanntmachung nach dem Umwandlungsgesetz 05.12.2024 (Eintragungsdatum)\n\nMemory Kaiserslautern OHG\nOffene Handelsgesellschaft\nKaiserslautern\n\nAls nicht eingetragen wird veröffentlicht:\nDen Gläubigern des formwechselnden Rechtsträgers ist, wenn sie binnen sechs Monaten nach dem Tag, an dem die Eintragung des Formwechsels nach § 201 UmwG als bekannt gemacht gilt, ihren Anspruch nach Grund und Höhe schriftlich anmelden, Sicherheit zu leisten, soweit sie nicht Befriedigung verlangen können. Dieses Recht steht den Gläubigern jedoch nur zu, wenn sie glaubhaft machen, dass durch den Formwechsel die Erfüllung der Forderung gefährdet wird.\nGläubigern des bisherigen Rechtsträgers ist unter den Voraussetzungen der §§ 204, 22 UmwG Sicherheit zu leisten."
    },
    {
      "date": "2024-12-05",
      "id": "95548",
      "original_text": "Registerbekanntmachung nach dem Umwandlungsgesetz\nRheinland-Pfalz Amtsgericht Kaiserslautern HRB 33857\nMemory Kaiserslautern GmbH – Kaiserslauren",
      "type": "Registerbekanntmachung nach dem Umwandlungsgesetz",
      "state": "Rheinland-Pfalz",
      "amtsgericht": "Amtsgericht Kaiserslautern",
      "registernummer": "HRB 33857",
      "registerart": "HRB",
      "company_name": "Memory Kaiserslautern GmbH",
      "company_seat": "Kaiserslauren",
      "details": "05.12.2024 (Bekanntmachungsdatum)\n\nRheinland-Pfalz Amtsgericht Kaiserslautern HRB 33857\nRegisterbekanntmachung nach dem Umwandlungsgesetz 05.12.2024 (Eintragungsdatum)\n\nMemory Kaiserslautern GmbH\nGesellschaft mit beschränkter Haftung\nKaiserslauren\n\nAls nicht eingetragen wird veröffentlicht:\nDen Gläubigern des formwechselnden Rechtsträgers ist, wenn sie binnen sechs Monaten nach dem Tag, an dem die Eintragung des Formwechsels nach § 201 UmwG als bekannt gemacht gilt, ihren Anspruch nach Grund und Höhe schriftlich anmelden, Sicherheit zu leisten, soweit sie nicht Befriedigung verlangen können. Dieses Recht steht den Gläubigern jedoch nur zu, wenn sie glaubhaft machen, dass durch den Formwechsel die Erfüllung der Forderung gefährdet wird. Gläubigern des bisherigen Rechtsträgers ist unter den Voraussetzungen der §§ 204, 22 UmwG Sicherheit zu leisten."
    },
    {
      "date": "2024-12-05",
      "id": "95549",
      "original_text": "Löschungsankündigung\nRheinland-Pfalz Amtsgericht Mainz VR 10814\nAllgemeiner Hundesportverein Worms-Rheindürkheim – Worms-Rheindürkheim",
      "type": "Löschungsankündigung",
      "state": "Rheinland-Pfalz",
      "amtsgericht": "Amtsgericht Mainz",
      "registernummer": "VR 10814",
      "registerart": "VR",
      "company_name": "Allgemeiner Hundesportverein Worms-Rheindürkheim",
      "company_seat": "Worms-Rheindürkheim",
      "details": "05.12.2024 (Bekanntmachungsdatum)\n\nRheinland-Pfalz Amtsgericht Mainz VR 10814\nLöschungsankündigung\n\nAllgemeiner Hundesportverein Worms-Rheindürkheim\neingetragener Verein\nWorms-Rheindürkheim\n\nDas Registergericht beabsichtigt den Verein von Amts wegen nach § 395 FamFG zu löschen. Die Frist zur Erhebung eines Widerspruchs ist auf einen Monat festgesetzt."
    },
    {
      "date": "2024-12-05",
      "id": "95550",
      "original_text": "Löschungsankündigung\nRheinland-Pfalz Amtsgericht Mainz HRB 51472\nBone Ma Facility Management GmbH – Mainz",
      "type": "Löschungsankündigung",
      "state": "Rheinland-Pfalz",
      "amtsgericht": "Amtsgericht Mainz",
      "registernummer": "HRB 51472",
      "registerart": "HRB",
      "company_name": "Bone Ma Facility Management GmbH",
      "company_seat": "Mainz",
      "details": "05.12.2024 (Bekanntmachungsdatum)\n\nRheinland-Pfalz Amtsgericht Mainz HRB 51472\nLöschungsankündigung\n\nBone Ma Facility Management GmbH\nGesellschaft mit beschränkter Haftung\nMainz\n\nDas Registergericht beabsichtigt die Gesellschaft von Amts wegen nach § 394 FamFG zu löschen. Die Frist zur Erhebung eines Widerspruchs ist auf einen Monat festgesetzt."
    },
    {
      "date": "2024-12-05",
      "id": "95551",
      "original_text": "Löschungsankündigung\nNordrhein-Westfalen Amtsgericht Duisburg HRB 33089\nReklamsa GmbH – Dinslaken",
      "type": "Löschungsankündigung",
      "state": "Nordrhein-Westfalen",
      "amtsgericht": "Amtsgericht Duisburg",
      "registernummer": "HRB 33089",
      "registerart": "HRB",
      "company_name": "Reklamsa GmbH",
      "company_seat": "Dinslaken",
      "details": "05.12.2024 (Bekanntmachungsdatum)\n\nNordrhein-Westfalen Amtsgericht Duisburg HRB 33089\nLöschungsankündigung\n\nReklamsa GmbH\nGesellschaft mit beschränkter Haftung\nDinslaken\n\nHRB 33089;\nReklamsa GmbH,\nDinslaken, Thyssenstr. 179, 46535 Dinslaken. Das Registergericht beabsichtigt, die im Handelsregister eingetragene Gesellschaft gemäß § 394 Absatz 1 FamFG wegen Vermögenslosigkeit von Amts wegen zu löschen. Gegen diese Verfügung kann Widerspruch eingelegt werden. Die Frist zur Erhebung eines Widerspruchs gegen die beabsichtigte Löschung von Amts wegen ist auf drei Monate festgesetzt. Rechtsbehelfsbelehrung Der Widerspruch ist bei dem Amtsgericht Duisburg, Kardinal-Galen-Str. 124-132, 47058 Duisburg schriftlich in deutscher Sprache oder zur Niederschrift der Geschäftsstelle einzulegen. Der Widerspruch kann auch zur Niederschrift der Geschäftsstelle eines jeden Amtsgerichtes abgegeben werden. Die Einlegung ist auch durch Übertragung eines elektronischen Dokuments an die elektronische Poststelle des Gerichts möglich. Das elektronische Dokument muss für die Bearbeitung durch das Gericht geeignet und mit einer qualifizierten elektronischen Signatur der verantwortenden Person versehen sein oder von der verantwortenden Person signiert und auf einem sicheren Übermittlungsweg gemäß § 130 a ZPO nach näherer Maßgabe der Verordnung über die technischen Rahmenbedingungen des elektronischen Rechtsverkehrs und über das besondere elektronische Behördenpostfach (BGBl. I, S. 3803) eingereicht werden. Weitere Informationen erhalten Sie auf der Internetseite www.justiz.de <http://www.justiz.de>. Der Widerspruch muss spätestens innerhalb der gesetzten Frist bei dem Amtsgericht Duisburg eingegangen sein. Dies gilt auch dann, wenn der Widerspruch zur Niederschrift der Geschäftsstelle eines anderen Amtsgerichtes abgegeben wurde. Die Frist beginnt mit der Veröffentlichung. Fällt das Ende der Frist auf einen Sonntag, einen allgemeinen Feiertag oder Sonnabend, so endet die Frist mit Ablauf des nächsten Werktages. Der Widerspruch muss die Bezeichnung der angefochtenen Verfügung sowie die Erklärung enthalten, dass Widerspruch gegen diese Verfügung eingelegt wird. Er ist zu unterzeichnen und soll begründet werden."
    },
    {
      "date": "2024-12-05",
      "id": "95552",
      "original_text": "Einreichung neuer Dokumente\nNordrhein-Westfalen Amtsgericht Münster HRB 91\nErdgas Münster GmbH – Münster",
      "type": "Einreichung neuer Dokumente",
      "state": "Nordrhein-Westfalen",
      "amtsgericht": "Amtsgericht Münster",
      "registernummer": "HRB 91",
      "registerart": "HRB",
      "company_name": "Erdgas Münster GmbH",
      "company_seat": "Münster",
      "details": "05.12.2024 (Bekanntmachungsdatum)\n\nNordrhein-Westfalen Amtsgericht Münster HRB 91\nEinreichung neuer Dokumente\n\nErdgas Münster GmbH\nGesellschaft mit beschränkter Haftung\nMünster\n\nDem Registergericht ist eine neue Liste der Mitglieder des Aufsichtsrates eingereicht worden."
    },
    {
      "date": "2024-12-05",
      "id": "95553",
      "original_text": "Registerbekanntmachung nach dem Umwandlungsgesetz\nNordrhein-Westfalen Amtsgericht Düsseldorf HRB 38062\nVodafone GmbH – Düsseldorf",
      "type": "Registerbekanntmachung nach dem Umwandlungsgesetz",
      "state": "Nordrhein-Westfalen",
      "amtsgericht": "Amtsgericht Düsseldorf",
      "registernummer": "HRB 38062",
      "registerart": "HRB",
      "company_name": "Vodafone GmbH",
      "company_seat": "Düsseldorf",
      "details": "05.12.2024 (Bekanntmachungsdatum)\n\nNordrhein-Westfalen Amtsgericht Düsseldorf HRB 38062\nRegisterbekanntmachung nach dem Umwandlungsgesetz 05.12.2024 (Eintragungsdatum)\n\nVodafone GmbH\nGesellschaft mit beschränkter Haftung\nDüsseldorf\n\nDen Gläubigern der an der Verschmelzung beteiligten Rechtsträger ist, wenn sie binnen sechs Monaten nach dem Tag, an dem die Eintragung der Verschmelzung in das Register des Sitzes desjenigen Rechtsträgers, dessen Gläubiger sie sind, nach § 19 Absatz 3 UmwG als bekanntgemacht gilt, ihren Anspruch nach Grund und Höhe schriftlich anmelden, Sicherheit zu leisten, soweit sie nicht Befriedigung verlangen können. Dieses Recht steht den Gläubigern jedoch nur zu, wenn sie glaubhaft machen, dass durch die Verschmelzung die Erfüllung ihrer Forderung gefährdet wird."
    },
    {
      "date": "2024-12-05",
      "id": "95554",
      "original_text": "Löschungsankündigung\nNordrhein-Westfalen Amtsgericht Duisburg HRB 34886\nStoyanova GmbH – Duisburg",
      "type": "Löschungsankündigung",
      "state": "Nordrhein-Westfalen",
      "amtsgericht": "Amtsgericht Duisburg",
      "registernummer": "HRB 34886",
      "registerart": "HRB",
      "company_name": "Stoyanova GmbH",
      "company_seat": "Duisburg",
      "details": "05.12.2024 (Bekanntmachungsdatum)\n\nNordrhein-Westfalen Amtsgericht Duisburg HRB 34886\nLöschungsankündigung\n\nStoyanova GmbH\nGesellschaft mit beschränkter Haftung\nDuisburg\n\nDas Registergericht beabsichtigt, die im Handelsregister Duisburg unter HRB 34886 eingetragene Gesellschaft Stoyanova GmbH mit Sitz in Duisburg gemäß § 394 Absatz 1 FamFG wegen Vermögenslosigkeit von Amts wegen zu löschen. Gegen diese Verfügung kann Widerspruch eingelegt werden. Die Frist zur Erhebung eines Widerspruchs gegen die beabsichtigte Löschung von Amts wegen ist auf drei Monate festgesetzt. Rechtsbehelfsbelehrung Der Widerspruch ist bei dem Amtsgericht Duisburg, Kardinal-Galen-Str. 124-132, 47058 Duisburg schriftlich in deutscher Sprache oder zur Niederschrift der Geschäftsstelle einzulegen. Der Widerspruch kann auch zur Niederschrift der Geschäftsstelle eines jeden Amtsgerichtes abgegeben werden. Die Einlegung ist auch durch Übertragung eines elektronischen Dokuments an die elektronische Poststelle des Gerichts möglich. Das elektronische Dokument muss für die Bearbeitung durch das Gericht geeignet und mit einer qualifizierten elektronischen Signatur der verantwortenden Person versehen sein oder von der verantwortenden Person signiert und auf einem sicheren Übermittlungsweg gemäß § 130 a ZPO nach näherer Maßgabe der Verordnung über die technischen Rahmenbedingungen des elektronischen Rechtsverkehrs und über das besondere elektronische Behördenpostfach (BGBl. I, S. 3803) eingereicht werden. Weitere Informationen erhalten Sie auf der Internetseite www.justiz.de <http://www.justiz.de>. Der Widerspruch muss spätestens innerhalb der gesetzten Frist bei dem Amtsgericht Duisburg eingegangen sein. Dies gilt auch dann, wenn der Widerspruch zur Niederschrift der Geschäftsstelle eines anderen Amtsgerichtes abgegeben wurde. Die Frist beginnt mit der Veröffentlichung. Fällt das Ende der Frist auf einen Sonntag, einen allgemeinen Feiertag oder Sonnabend, so endet die Frist mit Ablauf des nächsten Werktages. Der Widerspruch muss die Bezeichnung der angefochtenen Verfügung sowie die Erklärung enthalten, dass Widerspruch gegen diese Verfügung eingelegt wird. Er ist zu unterzeichnen und soll begründet werden."
    },
    {
      "date": "2024-12-05",
      "id": "95555",
      "original_text": "Sonstige Registerbekanntmachung\nNordrhein-Westfalen Amtsgericht Düsseldorf HRB 97001\nSIERA SE – Düsseldorf",
      "type": "Sonstige Registerbekanntmachung",
      "state": "Nordrhein-Westfalen",
      "amtsgericht": "Amtsgericht Düsseldorf",
      "registernummer": "HRB 97001",
      "registerart": "HRB",
      "company_name": "SIERA SE",
      "company_seat": "Düsseldorf",
      "details": "05.12.2024 (Bekanntmachungsdatum)\n\nNordrhein-Westfalen Amtsgericht Düsseldorf HRB 97001\nSonstige Registerbekanntmachung\n\nSIERA SE\nEuropäische Aktiengesellschaft (SE)\nDüsseldorf\n\nDem Registergericht ist ein Verlegungsplan über die Verlegung des Satzungssitzes nach Luxemburg, Großherzogtum Luxemburg, eingereicht worden, Offenlegung gemäß Art. 8 Abs. 2 i.V.m. Art. 13 EG-Verordnung Nr. 2157/2001."
    },
    {
      "date": "2024-12-05",
      "id": "95556",
      "original_text": "Einreichung neuer Dokumente\nNordrhein-Westfalen Amtsgericht Gütersloh HRB 7850\nDeutsches Rotes Kreuz Soziale Dienste und Einrichtungen Gütersloh gGmbH – Gütersloh",
      "type": "Einreichung neuer Dokumente",
      "state": "Nordrhein-Westfalen",
      "amtsgericht": "Amtsgericht Gütersloh",
      "registernummer": "HRB 7850",
      "registerart": "HRB",
      "company_name": "Deutsches Rotes Kreuz Soziale Dienste und Einrichtungen Gütersloh gGmbH",
      "company_seat": "Gütersloh",
      "details": "05.12.2024 (Bekanntmachungsdatum)\n\nNordrhein-Westfalen Amtsgericht Gütersloh HRB 7850\nEinreichung neuer Dokumente\n\nDeutsches Rotes Kreuz Soziale Dienste und Einrichtungen Gütersloh gGmbH\nGesellschaft mit beschränkter Haftung\nGütersloh\n\nDem Registergericht ist eine neue Liste der Mitglieder des Aufsichtsrates eingereicht worden."
    },
    {
      "date": "2024-12-05",
      "id": "95557",
      "original_text": "Löschungsankündigung\nNordrhein-Westfalen Amtsgericht Paderborn HRB 12873\nSchenghuader GmbH – Bad Driburg",
      "type": "Löschungsankündigung",
      "state": "Nordrhein-Westfalen",
      "amtsgericht": "Amtsgericht Paderborn",
      "registernummer": "HRB 12873",
      "registerart": "HRB",
      "company_name": "Schenghuader GmbH",
      "company_seat": "Bad Driburg",
      "details": "05.12.2024 (Bekanntmachungsdatum)\n\nNordrhein-Westfalen Amtsgericht Paderborn HRB 12873\nLöschungsankündigung\n\nSchenghuader GmbH\nGesellschaft mit beschränkter Haftung\nBad Driburg\n\nNach den dem Registergericht vorliegenden Erkenntnissen ist die Firma vermögenslos. Das ergibt sich aus der Tatsache, dass die Gesellschaft nach Auskunft des zuständigen Finanzamtes über kein Vermögen mehr verfügt und den Geschäftsbetrieb eingestellt hat.\nDas Registergericht beabsichtigt die Gesellschaft von Amts wegen nach § 394 FamFG zu löschen. Die Frist zur Erhebung eines Widerspruchs ist auf 4 Wochen festgesetzt."
    },
    {
      "date": "2024-12-05",
      "id": "95558",
      "original_text": "Registerbekanntmachung nach dem Umwandlungsgesetz\nNordrhein-Westfalen Amtsgericht Paderborn HRA 8622\nFunke Metallbau GmbH & Co. KG – Delbrück",
      "type": "Registerbekanntmachung nach dem Umwandlungsgesetz",
      "state": "Nordrhein-Westfalen",
      "amtsgericht": "Amtsgericht Paderborn",
      "registernummer": "HRA 8622",
      "registerart": "HRA",
      "company_name": "Funke Metallbau GmbH & Co. KG",
      "company_seat": "Delbrück",
      "details": "05.12.2024 (Bekanntmachungsdatum)\n\nNordrhein-Westfalen Amtsgericht Paderborn HRA 8622\nRegisterbekanntmachung nach dem Umwandlungsgesetz 05.12.2024 (Eintragungsdatum)\n\nFunke Metallbau GmbH & Co. KG\nKommanditgesellschaft\nDelbrück\n\nDen Gläubigern der an der Ausgliederung beteiligten Rechtsträger ist, wenn sie binnen sechs Monaten nach dem Tag, an dem die Eintragung der Ausgliederung in das Register des Sitzes desjenigen Rechtsträgers, dessen Gläubiger sie sind, nach § 19 Absatz 3 UmwG als bekanntgemacht gilt, ihren Anspruch nach Grund und Höhe schriftlich anmelden, Sicherheit zu leisten, soweit sie nicht Befriedigung verlangen können. Dieses Recht steht den Gläubigern jedoch nur zu, wenn sie glaubhaft machen, dass durch die Ausgliederung die Erfüllung ihrer Forderung gefährdet wird."
    },
    {
      "date": "2024-12-05",
      "id": "95559",
      "original_text": "Sonstige Registerbekanntmachung\nNordrhein-Westfalen Amtsgericht Paderborn HRB 12895\nVoltabox AG – Paderborn",
      "type": "Sonstige Registerbekanntmachung",
      "state": "Nordrhein-Westfalen",
      "amtsgericht": "Amtsgericht Paderborn",
      "registernummer": "HRB 12895",
      "registerart": "HRB",
      "company_name": "Voltabox AG",
      "company_seat": "Paderborn",
      "details": "05.12.2024 (Bekanntmachungsdatum)\n\nNordrhein-Westfalen Amtsgericht Paderborn HRB 12895\nSonstige Registerbekanntmachung 05.12.2024 (Eintragungsdatum)\n\nVoltabox AG\nAktiengesellschaft\nPaderborn\n\nDas Registergericht beabsichtigt auf Antrag des Vorstandes den Aufsichtsrat der Aktiengesellschaft gerichtlich gemäß § 104 AktG zu ergänzen. Die Frist zur Erhebung eines Widerspruchs ist auf drei Wochen festgesetzt."
    },
    {
      "date": "2024-12-05",
      "id": "95560",
      "original_text": "Registerbekanntmachung nach dem Umwandlungsgesetz\nNordrhein-Westfalen Amtsgericht Köln HRA 32568\nPfleiderer Home GmbH & Co. KG – Köln",
      "type": "Registerbekanntmachung nach dem Umwandlungsgesetz",
      "state": "Nordrhein-Westfalen",
      "amtsgericht": "Amtsgericht Köln",
      "registernummer": "HRA 32568",
      "registerart": "HRA",
      "company_name": "Pfleiderer Home GmbH & Co. KG",
      "company_seat": "Köln",
      "details": "05.12.2024 (Bekanntmachungsdatum)\n\nNordrhein-Westfalen Amtsgericht Köln HRA 32568\nRegisterbekanntmachung nach dem Umwandlungsgesetz 05.12.2024 (Eintragungsdatum)\n\nPfleiderer Home GmbH & Co. KG\nKommanditgesellschaft\nKöln\n\nDen Gläubigern der an der formwechselnden Umwandlung beteiligten Rechtsträger ist, wenn sie binnen sechs Monaten nach dem Tag, an dem die Eintragung der formwechselnden Umwandlung in das Register des Sitzes desjenigen Rechtsträgers, dessen Gläubiger sie sind, nach § 19 Absatz 3 UmwG als bekanntgemacht gilt, ihren Anspruch nach Grund und Höhe schriftlich anmelden, Sicherheit zu leisten, soweit sie nicht Befriedigung verlangen können. Dieses Recht steht den Gläubigern jedoch nur zu, wenn sie glaubhaft machen, dass durch die formwechselnden Umwandlung die Erfüllung ihrer Forderung gefährdet wird."
    },
    {
      "date": "2024-12-05",
      "id": "95561",
      "original_text": "Einreichung neuer Dokumente\nNordrhein-Westfalen Amtsgericht Mönchengladbach HRB 22512\nSMS GmbH – Mönchengladbach",
      "type": "Einreichung neuer Dokumente",
      "state": "Nordrhein-Westfalen",
      "amtsgericht": "Amtsgericht Mönchengladbach",
      "registernummer": "HRB 22512",
      "registerart": "HRB",
      "company_name": "SMS GmbH",
      "company_seat": "Mönchengladbach",
      "details": "05.12.2024 (Bekanntmachungsdatum)\n\nNordrhein-Westfalen Amtsgericht Mönchengladbach HRB 22512\nEinreichung neuer Dokumente 05.12.2024 (Eintragungsdatum)\n\nSMS GmbH\nGesellschaft mit beschränkter Haftung\nMönchengladbach\n\nDem Registergericht ist eine neue Liste der Mitglieder des Aufsichtsrates eingereicht worden."
    },
    {
      "date": "2024-12-05",
      "id": "95562",
      "original_text": "Registerbekanntmachung nach dem Umwandlungsgesetz\nNordrhein-Westfalen Amtsgericht Köln HRB 121349\nPfleiderer Home GmbH – Köln",
      "type": "Registerbekanntmachung nach dem Umwandlungsgesetz",
      "state": "Nordrhein-Westfalen",
      "amtsgericht": "Amtsgericht Köln",
      "registernummer": "HRB 121349",
      "registerart": "HRB",
      "company_name": "Pfleiderer Home GmbH",
      "company_seat": "Köln",
      "details": "05.12.2024 (Bekanntmachungsdatum)\n\nNordrhein-Westfalen Amtsgericht Köln HRB 121349\nRegisterbekanntmachung nach dem Umwandlungsgesetz 05.12.2024 (Eintragungsdatum)\n\nPfleiderer Home GmbH\nGesellschaft mit beschränkter Haftung\nKöln\n\nDen Gläubigern der an der formwechselnden Umwandlung beteiligten Rechtsträger ist, wenn sie binnen sechs Monaten nach dem Tag, an dem die Eintragung der formwechselnden Umwandlung in das Register des Sitzes desjenigen Rechtsträgers, dessen Gläubiger sie sind, nach § 19 Absatz 3 UmwG als bekanntgemacht gilt, ihren Anspruch nach Grund und Höhe schriftlich anmelden, Sicherheit zu leisten, soweit sie nicht Befriedigung verlangen können. Dieses Recht steht den Gläubigern jedoch nur zu, wenn sie glaubhaft machen, dass durch die formwechselnden Umwandlung die Erfüllung ihrer Forderung gefährdet wird."
    },
    {
      "date": "2024-12-05",
      "id": "95563",
      "original_text": "Registerbekanntmachung nach dem Umwandlungsgesetz\nNordrhein-Westfalen Amtsgericht Köln HRB 121354\nJalousiendoc GmbH – Köln",
      "type": "Registerbekanntmachung nach dem Umwandlungsgesetz",
      "state": "Nordrhein-Westfalen",
      "amtsgericht": "Amtsgericht Köln",
      "registernummer": "HRB 121354",
      "registerart": "HRB",
      "company_name": "Jalousiendoc GmbH",
      "company_seat": "Köln",
      "details": "05.12.2024 (Bekanntmachungsdatum)\n\nNordrhein-Westfalen Amtsgericht Köln HRB 121354\nRegisterbekanntmachung nach dem Umwandlungsgesetz 05.12.2024 (Eintragungsdatum)\n\nJalousiendoc GmbH\nGesellschaft mit beschränkter Haftung\nKöln\n\nDen Gläubigern der an der Ausgliederung beteiligten Rechtsträger ist, wenn sie binnen sechs Monaten nach dem Tag, an dem die Eintragung der Ausgliederung in das Register des Sitzes desjenigen Rechtsträgers, dessen Gläubiger sie sind, nach § 19 Absatz 3 UmwG als bekanntgemacht gilt, ihren Anspruch nach Grund und Höhe schriftlich anmelden, Sicherheit zu leisten, soweit sie nicht Befriedigung verlangen können. Dieses Recht steht den Gläubigern jedoch nur zu, wenn sie glaubhaft machen, dass durch die Ausgliederung die Erfüllung ihrer Forderung gefährdet wird."
    },
    {
      "date": "2024-12-05",
      "id": "95564",
      "original_text": "Löschungsankündigung\nNordrhein-Westfalen Amtsgericht Duisburg HRB 28798\nSaad Projekt Drei UG (haftungsbeschränkt) – Mülheim an der Ruhr",
      "type": "Löschungsankündigung",
      "state": "Nordrhein-Westfalen",
      "amtsgericht": "Amtsgericht Duisburg",
      "registernummer": "HRB 28798",
      "registerart": "HRB",
      "company_name": "Saad Projekt Drei UG (haftungsbeschränkt)",
      "company_seat": "Mülheim an der Ruhr",
      "details": "05.12.2024 (Bekanntmachungsdatum)\n\nNordrhein-Westfalen Amtsgericht Duisburg HRB 28798\nLöschungsankündigung\n\nSaad Projekt Drei UG (haftungsbeschränkt)\nGesellschaft mit beschränkter Haftung\nMülheim an der Ruhr\n\nHRB 28798:\nSaad Projekt Drei UG (haftungsbeschränkt),\nMülheim an der Ruhr, Bergische Straße 50, 51766 Engelskirchen Das Registergericht beabsichtigt, die im Handelsregister eingetragene Gesellschaft gemäß § 394 Absatz 1 FamFG wegen Vermögenslosigkeit von Amts wegen zu löschen. Gegen diese Verfügung kann Widerspruch eingelegt werden. Die Frist zur Erhebung eines Widerspruchs gegen die beabsichtigte Löschung von Amts wegen ist auf drei Monate festgesetzt. Rechtsbehelfsbelehrung Der Widerspruch ist bei dem Amtsgericht Duisburg, Kardinal-Galen-Str. 124-132, 47058 Duisburg schriftlich in deutscher Sprache oder zur Niederschrift der Geschäftsstelle einzulegen. Der Widerspruch kann auch zur Niederschrift der Geschäftsstelle eines jeden Amtsgerichtes abgegeben werden. Die Einlegung ist auch durch Übertragung eines elektronischen Dokuments an die elektronische Poststelle des Gerichts möglich. Das elektronische Dokument muss für die Bearbeitung durch das Gericht geeignet und mit einer qualifizierten elektronischen Signatur der verantwortenden Person versehen sein oder von der verantwortenden Person signiert und auf einem sicheren Übermittlungsweg gemäß § 130 a ZPO nach näherer Maßgabe der Verordnung über die technischen Rahmenbedingungen des elektronischen Rechtsverkehrs und über das besondere elektronische Behördenpostfach (BGBl. I, S. 3803) eingereicht werden. Weitere Informationen erhalten Sie auf der Internetseite www.justiz.de <http://www.justiz.de>. Der Widerspruch muss spätestens innerhalb der gesetzten Frist bei dem Amtsgericht Duisburg eingegangen sein. Dies gilt auch dann, wenn der Widerspruch zur Niederschrift der Geschäftsstelle eines anderen Amtsgerichtes abgegeben wurde. Die Frist beginnt mit der Veröffentlichung. Fällt das Ende der Frist auf einen Sonntag, einen allgemeinen Feiertag oder Sonnabend, so endet die Frist mit Ablauf des nächsten Werktages. Der Widerspruch muss die Bezeichnung der angefochtenen Verfügung sowie die Erklärung enthalten, dass Widerspruch gegen diese Verfügung eingelegt wird. Er ist zu unterzeichnen und soll begründet werden."
    },
    {
      "date": "2024-12-05",
      "id": "95565",
      "original_text": "Löschungsankündigung\nNordrhein-Westfalen Amtsgericht Dortmund HRA 18393\nRUPKO ARMS LTD. & Co. KG – Castrop-Rauxel",
      "type": "Löschungsankündigung",
      "state": "Nordrhein-Westfalen",
      "amtsgericht": "Amtsgericht Dortmund",
      "registernummer": "HRA 18393",
      "registerart": "HRA",
      "company_name": "RUPKO ARMS LTD. & Co. KG",
      "company_seat": "Castrop-Rauxel",
      "details": "05.12.2024 (Bekanntmachungsdatum)\n\nNordrhein-Westfalen Amtsgericht Dortmund HRA 18393\nLöschungsankündigung\n\nRUPKO ARMS LTD. & Co. KG\nKommanditgesellschaft\nCastrop-Rauxel\n\nDas Registergericht beabsichtigt die Firma von Amts wegen nach § 394 FamFG zu löschen. Die Frist zur Erhebung eines Widerspruchs ist auf drei Monate festgesetzt."
    },
    {
      "date": "2024-12-05",
      "id": "95566",
      "original_text": "Einreichung neuer Dokumente\nNordrhein-Westfalen Amtsgericht Duisburg HRB 19088\nPCC SE – Duisburg",
      "type": "Einreichung neuer Dokumente",
      "state": "Nordrhein-Westfalen",
      "amtsgericht": "Amtsgericht Duisburg",
      "registernummer": "HRB 19088",
      "registerart": "HRB",
      "company_name": "PCC SE",
      "company_seat": "Duisburg",
      "details": "05.12.2024 (Bekanntmachungsdatum)\n\nNordrhein-Westfalen Amtsgericht Duisburg HRB 19088\nEinreichung neuer Dokumente\n\nPCC SE\nEuropäische Aktiengesellschaft (SE)\nDuisburg\n\nDem Registergericht ist eine Liste der Mitglieder des Aufsichtsrates eingereicht worden."
    },
    {
      "date": "2024-12-05",
      "id": "95567",
      "original_text": "Einreichung neuer Dokumente\nNordrhein-Westfalen Amtsgericht Paderborn HRB 14179\nHYPERTEGRITY AG – Büren",
      "type": "Einreichung neuer Dokumente",
      "state": "Nordrhein-Westfalen",
      "amtsgericht": "Amtsgericht Paderborn",
      "registernummer": "HRB 14179",
      "registerart": "HRB",
      "company_name": "HYPERTEGRITY AG",
      "company_seat": "Büren",
      "details": "05.12.2024 (Bekanntmachungsdatum)\n\nNordrhein-Westfalen Amtsgericht Paderborn HRB 14179\nEinreichung neuer Dokumente\n\nHYPERTEGRITY AG\nAktiengesellschaft\nBüren\n\nDem Registergericht ist eine neue Liste der Mitglieder des Aufsichtsrates eingereicht worden."
    },
    {
      "date": "2024-12-05",
      "id": "95568",
      "original_text": "Einreichung neuer Dokumente\nNordrhein-Westfalen Amtsgericht Duisburg HRB 6666\nSTART NRW GmbH – Duisburg",
      "type": "Einreichung neuer Dokumente",
      "state": "Nordrhein-Westfalen",
      "amtsgericht": "Amtsgericht Duisburg",
      "registernummer": "HRB 6666",
      "registerart": "HRB",
      "company_name": "START NRW GmbH",
      "company_seat": "Duisburg",
      "details": "05.12.2024 (Bekanntmachungsdatum)\n\nNordrhein-Westfalen Amtsgericht Duisburg HRB 6666\nEinreichung neuer Dokumente\n\nSTART NRW GmbH\nGesellschaft mit beschränkter Haftung\nDuisburg\n\nDem Registergericht ist eine neue Liste der Mitglieder des Aufsichtsrates eingereicht worden."
    },
    {
      "date": "2024-12-05",
      "id": "95569",
      "original_text": "Registerbekanntmachung nach dem Umwandlungsgesetz\nNordrhein-Westfalen Amtsgericht Hagen GnR 253\nAMAKURA IT eG – Gevelsberg",
      "type": "Registerbekanntmachung nach dem Umwandlungsgesetz",
      "state": "Nordrhein-Westfalen",
      "amtsgericht": "Amtsgericht Hagen",
      "registernummer": "GnR 253",
      "registerart": "GnR",
      "company_name": "AMAKURA IT eG",
      "company_seat": "Gevelsberg",
      "details": "05.12.2024 (Bekanntmachungsdatum)\n\nNordrhein-Westfalen Amtsgericht Hagen GnR 253\nRegisterbekanntmachung nach dem Umwandlungsgesetz 05.12.2024 (Eintragungsdatum)\n\nAMAKURA IT eG\neingetragene Genossenschaft\nGevelsberg\n\nDen Gläubigern der an der formwechselnden Umwandlung beteiligten Rechtsträger ist, wenn sie binnen sechs Monaten nach dem Tag, an dem die Eintragung der formwechselnden Umwandlung in das Register des Sitzes desjenigen Rechtsträgers, dessen Gläubiger sie sind, nach § 19 Absatz 3 UmwG als bekanntgemacht gilt, ihren Anspruch nach Grund und Höhe schriftlich anmelden, Sicherheit zu leisten, soweit sie nicht Befriedigung verlangen können. Dieses Recht steht den Gläubigern jedoch nur zu, wenn sie glaubhaft machen, dass durch die formwechselnden Umwandlung die Erfüllung ihrer Forderung gefährdet wird."
    },
    {
      "date": "2024-12-05",
      "id": "95570",
      "original_text": "Löschungsankündigung\nNordrhein-Westfalen Amtsgericht Mönchengladbach HRA 2405\nDeko Christ GmbH & Co. KG – Mönchengladbach",
      "type": "Löschungsankündigung",
      "state": "Nordrhein-Westfalen",
      "amtsgericht": "Amtsgericht Mönchengladbach",
      "registernummer": "HRA 2405",
      "registerart": "HRA",
      "company_name": "Deko Christ GmbH & Co. KG",
      "company_seat": "Mönchengladbach",
      "details": "05.12.2024 (Bekanntmachungsdatum)\n\nNordrhein-Westfalen Amtsgericht Mönchengladbach HRA 2405\nLöschungsankündigung\n\nDeko Christ GmbH & Co. KG\nKommanditgesellschaft\nMönchengladbach\n\nDas Registergericht beabsichtigt, die im Handelsregister eingetragene Gesellschaft gemäß § 394 Absatz 1 FamFG wegen Vermögenslosigkeit von Amts wegen zu löschen. Gegen diese Verfügung kann Widerspruch eingelegt werden. Die Frist zur Erhebung eines Widerspruchs gegen die beabsichtigte Löschung von Amts wegen ist auf drei Monate festgesetzt."
    },
    {
      "date": "2024-12-05",
      "id": "95571",
      "original_text": "Registerbekanntmachung nach dem Umwandlungsgesetz\nNordrhein-Westfalen Amtsgericht Köln HRA 37539\nJalousiendoc e.K. – Köln",
      "type": "Registerbekanntmachung nach dem Umwandlungsgesetz",
      "state": "Nordrhein-Westfalen",
      "amtsgericht": "Amtsgericht Köln",
      "registernummer": "HRA 37539",
      "registerart": "HRA",
      "company_name": "Jalousiendoc e.K.",
      "company_seat": "Köln",
      "details": "05.12.2024 (Bekanntmachungsdatum)\n\nNordrhein-Westfalen Amtsgericht Köln HRA 37539\nRegisterbekanntmachung nach dem Umwandlungsgesetz 05.12.2024 (Eintragungsdatum)\n\nJalousiendoc e.K.\nEinzelkaufmann / Einzelkauffrau\nKöln\n\nDen Gläubigern der an der Ausgliederung beteiligten Rechtsträger ist, wenn sie binnen sechs Monaten nach dem Tag, an dem die Eintragung der Ausgliederung in das Register des Sitzes desjenigen Rechtsträgers, dessen Gläubiger sie sind, nach § 19 Absatz 3 UmwG als bekanntgemacht gilt, ihren Anspruch nach Grund und Höhe schriftlich anmelden, Sicherheit zu leisten, soweit sie nicht Befriedigung verlangen können. Dieses Recht steht den Gläubigern jedoch nur zu, wenn sie glaubhaft machen, dass durch die Ausgliederung die Erfüllung ihrer Forderung gefährdet wird."
    },
    {
      "date": "2024-12-05",
      "id": "95572",
      "original_text": "Einreichung neuer Dokumente\nNordrhein-Westfalen Amtsgericht Düren HRB 2635\nAndritz Fabrics and Rolls AG – Düren",
      "type": "Einreichung neuer Dokumente",
      "state": "Nordrhein-Westfalen",
      "amtsgericht": "Amtsgericht Düren",
      "registernummer": "HRB 2635",
      "registerart": "HRB",
      "company_name": "Andritz Fabrics and Rolls AG",
      "company_seat": "Düren",
      "details": "05.12.2024 (Bekanntmachungsdatum)\n\nNordrhein-Westfalen Amtsgericht Düren HRB 2635\nEinreichung neuer Dokumente 05.12.2024 (Eintragungsdatum)\n\nAndritz Fabrics and Rolls AG\nAktiengesellschaft\nDüren\n\nDem Registergericht ist eine neue Liste der Mitglieder des Aufsichtsrates eingereicht worden."
    },
    {
      "date": "2024-12-05",
      "id": "95573",
      "original_text": "Registerbekanntmachung nach dem Umwandlungsgesetz\nNordrhein-Westfalen Amtsgericht Düsseldorf HRB 56465\nRUDU Verwaltungsgesellschaft mbH – Düsseldorf",
      "type": "Registerbekanntmachung nach dem Umwandlungsgesetz",
      "state": "Nordrhein-Westfalen",
      "amtsgericht": "Amtsgericht Düsseldorf",
      "registernummer": "HRB 56465",
      "registerart": "HRB",
      "company_name": "RUDU Verwaltungsgesellschaft mbH",
      "company_seat": "Düsseldorf",
      "details": "05.12.2024 (Bekanntmachungsdatum)\n\nNordrhein-Westfalen Amtsgericht Düsseldorf HRB 56465\nRegisterbekanntmachung nach dem Umwandlungsgesetz 05.12.2024 (Eintragungsdatum)\n\nRUDU Verwaltungsgesellschaft mbH\nGesellschaft mit beschränkter Haftung\nDüsseldorf\n\nDen Gläubigern der an der Verschmelzung beteiligten Rechtsträger ist, wenn sie binnen sechs Monaten nach dem Tag, an dem die Eintragung der Verschmelzung in das Register des Sitzes desjenigen Rechtsträgers, dessen Gläubiger sie sind, nach § 19 Absatz 3 UmwG als bekanntgemacht gilt, ihren Anspruch nach Grund und Höhe schriftlich anmelden, Sicherheit zu leisten, soweit sie nicht Befriedigung verlangen können. Dieses Recht steht den Gläubigern jedoch nur zu, wenn sie glaubhaft machen, dass durch die Verschmelzung die Erfüllung ihrer Forderung gefährdet wird."
    },
    {
      "date": "2024-12-05",
      "id": "95574",
      "original_text": "Registerbekanntmachung nach dem Umwandlungsgesetz\nNordrhein-Westfalen Amtsgericht Düsseldorf HRA 27897\nErgotherapie Beyer e. K. – Düsseldorf",
      "type": "Registerbekanntmachung nach dem Umwandlungsgesetz",
      "state": "Nordrhein-Westfalen",
      "amtsgericht": "Amtsgericht Düsseldorf",
      "registernummer": "HRA 27897",
      "registerart": "HRA",
      "company_name": "Ergotherapie Beyer e. K.",
      "company_seat": "Düsseldorf",
      "details": "05.12.2024 (Bekanntmachungsdatum)\n\nNordrhein-Westfalen Amtsgericht Düsseldorf HRA 27897\nRegisterbekanntmachung nach dem Umwandlungsgesetz 05.12.2024 (Eintragungsdatum)\n\nErgotherapie Beyer e. K.\nEinzelkaufmann / Einzelkauffrau\nDüsseldorf\n\nDen Gläubigern der an der Ausgliederung beteiligten Rechtsträger ist, wenn sie binnen sechs Monaten nach dem Tag, an dem die Eintragung der Ausgliederung in das Register des Sitzes desjenigen Rechtsträgers, dessen Gläubiger sie sind, nach § 19 Absatz 3 UmwG als bekanntgemacht gilt, ihren Anspruch nach Grund und Höhe schriftlich anmelden, Sicherheit zu leisten, soweit sie nicht Befriedigung verlangen können. Dieses Recht steht den Gläubigern jedoch nur zu, wenn sie glaubhaft machen, dass durch die Ausgliederung die Erfüllung ihrer Forderung gefährdet wird."
    },
    {
      "date": "2024-12-05",
      "id": "95575",
      "original_text": "Registerbekanntmachung nach dem Umwandlungsgesetz\nNordrhein-Westfalen Amtsgericht Düsseldorf HRB 70295\nGBS Gesellschaft für Unternehmensbeteiligungen mbH – Düsseldorf",
      "type": "Registerbekanntmachung nach dem Umwandlungsgesetz",
      "state": "Nordrhein-Westfalen",
      "amtsgericht": "Amtsgericht Düsseldorf",
      "registernummer": "HRB 70295",
      "registerart": "HRB",
      "company_name": "GBS Gesellschaft für Unternehmensbeteiligungen mbH",
      "company_seat": "Düsseldorf",
      "details": "05.12.2024 (Bekanntmachungsdatum)\n\nNordrhein-Westfalen Amtsgericht Düsseldorf HRB 70295\nRegisterbekanntmachung nach dem Umwandlungsgesetz 05.12.2024 (Eintragungsdatum)\n\nGBS Gesellschaft für Unternehmensbeteiligungen mbH\nGesellschaft mit beschränkter Haftung\nDüsseldorf\n\nDen Gläubigern der an der Verschmelzung beteiligten Rechtsträger ist, wenn sie binnen sechs Monaten nach dem Tag, an dem die Eintragung der Verschmelzung in das Register des Sitzes desjenigen Rechtsträgers, dessen Gläubiger sie sind, nach § 19 Absatz 3 UmwG als bekanntgemacht gilt, ihren Anspruch nach Grund und Höhe schriftlich anmelden, Sicherheit zu leisten, soweit sie nicht Befriedigung verlangen können. Dieses Recht steht den Gläubigern jedoch nur zu, wenn sie glaubhaft machen, dass durch die Verschmelzung die Erfüllung ihrer Forderung gefährdet wird."
    },
    {
      "date": "2024-12-05",
      "id": "95576",
      "original_text": "Löschungsankündigung\nNordrhein-Westfalen Amtsgericht Bielefeld HRB 43243\n4mee Products GmbH – Bielefeld",
      "type": "Löschungsankündigung",
      "state": "Nordrhein-Westfalen",
      "amtsgericht": "Amtsgericht Bielefeld",
      "registernummer": "HRB 43243",
      "registerart": "HRB",
      "company_name": "4mee Products GmbH",
      "company_seat": "Bielefeld",
      "details": "05.12.2024 (Bekanntmachungsdatum)\n\nNordrhein-Westfalen Amtsgericht Bielefeld HRB 43243\nLöschungsankündigung\n\n4mee Products GmbH\nGesellschaft mit beschränkter Haftung\nBielefeld\n\nDas Registergericht beabsichtigt, die im Handelsregister eingetragene Gesellschaft gem.  § 394 Abs .1 FamFG wegen Vermögenslosigkeit von Amts wegen zu löschen. Gegen diese Verfügung kann Widerspruch eingelegt werden. Die Frist zur Erhebung eines Widerspruchs gegen die beabsichtigte Löschung von Amts wegen ist auf 6 Wochen festgesetzt."
    },
    {
      "date": "2024-12-05",
      "id": "95577",
      "original_text": "Löschungsankündigung\nNordrhein-Westfalen Amtsgericht Neuss HRB 19533\nLuvata Sales Oy Zweigniederlassung Deutschland – Kaarst",
      "type": "Löschungsankündigung",
      "state": "Nordrhein-Westfalen",
      "amtsgericht": "Amtsgericht Neuss",
      "registernummer": "HRB 19533",
      "registerart": "HRB",
      "company_name": "Luvata Sales Oy Zweigniederlassung Deutschland",
      "company_seat": "Kaarst",
      "details": "05.12.2024 (Bekanntmachungsdatum)\n\nNordrhein-Westfalen Amtsgericht Neuss HRB 19533\nLöschungsankündigung 05.12.2024 (Eintragungsdatum)\n\nLuvata Sales Oy Zweigniederlassung Deutschland\nRechtsform ausländischen Rechts HRB\nKaarst\n\nDas Registergericht beabsichtigt die Gesellschaft nach § 395 FamFG zu löschen, da die Hauptniederlassung ebenfalls gelöscht wurde. Frist zur Geltendmachung eines Widerspruchs: 1 Monat.\nRechtsbehelfsbelehrung:\nGegen diese Verfügung können Sie Widerspruch einlegen.\nDer Widerspruch ist bei dem Amtsgericht Neuss - Registergericht -, Breite Str. 48, 41460 Neuss schriftlich in deutscher Sprache oder zur Niederschrift der Geschäftsstelle einzulegen.\nDer Widerspruch kann auch zur Niederschrift der Geschäftsstelle eines jeden Amtsgerichtes abgegeben werden.\nDie Einlegung ist auch durch Übertragung eines elektronischen Dokuments an die elektronische Poststelle des Gerichts möglich. Das elektronische Dokument muss für die Bearbeitung durch das Gericht geeignet und mit einer qualifizierten elektronischen Signatur der verantwortenden Person versehen sein oder von der verantwortenden Person signiert und auf einem sicheren Übermittlungsweg gemäß § 130a ZPO nach näherer Maßgabe der Verordnung über die technischen Rahmenbedingungen des elektronischen Rechtsverkehrs und über das besondere elektronische Behördenpostfach (BGBl. I, S.3803) eingereicht werden. Weitere Informationen erhalten Sie auf der Internetseite www.justiz.de.\nDer Widerspruch muss spätestens innerhalb der gesetzten Frist nach der schriftlichen Bekanntgabe der Verfügung bei dem Amtsgericht - Registergericht - Neuss eingegangen sein. Dies gilt auch dann, wenn der Widerspruch zur Niederschrift der Geschäftsstelle eines anderen Amtsgerichtes abgegeben wurde. Die Frist beginnt mit der schriftlichen Bekanntgabe der Verfügung. Die Bekanntgabe ist entweder durch Zustellung oder am dritten Tage nach Aufgabe zur Post bewirkt. Fällt das Ende der Frist auf einen Sonntag, einen allgemeinen Feiertag oder Sonnabend, so endet die Frist mit Ablauf des nächsten Werktages.\nDer Widerspruch muss die Bezeichnung der angefochtenen Verfügung sowie die Erklärung enthalten, dass Widerspruch gegen diese Verfügung eingelegt wird. Er ist zu unterzeichnen und soll begründet werden."
    },
    {
      "date": "2024-12-05",
      "id": "95578",
      "original_text": "Löschungsankündigung\nNordrhein-Westfalen Amtsgericht Wuppertal HRB 4633\nFlüshöh Beteiligungsgesellschaft mbH – Wuppertal",
      "type": "Löschungsankündigung",
      "state": "Nordrhein-Westfalen",
      "amtsgericht": "Amtsgericht Wuppertal",
      "registernummer": "HRB 4633",
      "registerart": "HRB",
      "company_name": "Flüshöh Beteiligungsgesellschaft mbH",
      "company_seat": "Wuppertal",
      "details": "05.12.2024 (Bekanntmachungsdatum)\n\nNordrhein-Westfalen Amtsgericht Wuppertal HRB 4633\nLöschungsankündigung\n\nFlüshöh Beteiligungsgesellschaft mbH\nGesellschaft mit beschränkter Haftung\nWuppertal\n\nDas Registergericht beabsichtigt die Gesellschaft von Amts wegen nach § 394 FamFG zu löschen. Die Frist zur Erhebung eines Widerspruchs ist auf einen Monat festgesetzt."
    },
    {
      "date": "2024-12-05",
      "id": "95579",
      "original_text": "Löschungsankündigung\nNordrhein-Westfalen Amtsgericht Duisburg HRB 35827\nEuromarket GmbH – Mülheim an der Ruhr",
      "type": "Löschungsankündigung",
      "state": "Nordrhein-Westfalen",
      "amtsgericht": "Amtsgericht Duisburg",
      "registernummer": "HRB 35827",
      "registerart": "HRB",
      "company_name": "Euromarket GmbH",
      "company_seat": "Mülheim an der Ruhr",
      "details": "05.12.2024 (Bekanntmachungsdatum)\n\nNordrhein-Westfalen Amtsgericht Duisburg HRB 35827\nLöschungsankündigung\n\nEuromarket GmbH\nGesellschaft mit beschränkter Haftung\nMülheim an der Ruhr\n\nHRB 35827\nEuromarket GmbH,\nMülheim an der Ruhr, Saarner Straße 241-243, 45478 Mülheim an der Ruhr.\n\nDas Registergericht beabsichtigt, die im Handelsregister eingetragene Gesellschaft gemäß § 394 Absatz 1 FamFG wegen Vermögenslosigkeit von Amts wegen zu löschen. Gegen diese Verfügung kann Widerspruch eingelegt werden. Die Frist zur Erhebung eines Widerspruchs gegen die beabsichtigte Löschung von Amts wegen ist auf drei Monate festgesetzt. Rechtsbehelfsbelehrung Der Widerspruch ist bei dem Amtsgericht Duisburg, Kardinal-Galen-Str. 124-132, 47058 Duisburg schriftlich in deutscher Sprache oder zur Niederschrift der Geschäftsstelle einzulegen. Der Widerspruch kann auch zur Niederschrift der Geschäftsstelle eines jeden Amtsgerichtes abgegeben werden. Die Einlegung ist auch durch Übertragung eines elektronischen Dokuments an die elektronische Poststelle des Gerichts möglich. Das elektronische Dokument muss für die Bearbeitung durch das Gericht geeignet und mit einer qualifizierten elektronischen Signatur der verantwortenden Person versehen sein oder von der verantwortenden Person signiert und auf einem sicheren Übermittlungsweg gemäß § 130 a ZPO nach näherer Maßgabe der Verordnung über die technischen Rahmenbedingungen des elektronischen Rechtsverkehrs und über das besondere elektronische Behördenpostfach (BGBl. I, S. 3803) eingereicht werden. Weitere Informationen erhalten Sie auf der Internetseite www.justiz.de <http://www.justiz.de>. Der Widerspruch muss spätestens innerhalb der gesetzten Frist bei dem Amtsgericht Duisburg eingegangen sein. Dies gilt auch dann, wenn der Widerspruch zur Niederschrift der Geschäftsstelle eines anderen Amtsgerichtes abgegeben wurde. Die Frist beginnt mit der Veröffentlichung. Fällt das Ende der Frist auf einen Sonntag, einen allgemeinen Feiertag oder Sonnabend, so endet die Frist mit Ablauf des nächsten Werktages. Der Widerspruch muss die Bezeichnung der angefochtenen Verfügung sowie die Erklärung enthalten, dass Widerspruch gegen diese Verfügung eingelegt wird. Er ist zu unterzeichnen und soll begründet werden."
    },
    {
      "date": "2024-12-05",
      "id": "95580",
      "original_text": "Löschungsankündigung\nHessen Amtsgericht Frankfurt am Main HRB 130634\nNM Unlimited GmbH – Frankfurt am Main",
      "type": "Löschungsankündigung",
      "state": "Hessen",
      "amtsgericht": "Amtsgericht Frankfurt am Main",
      "registernummer": "HRB 130634",
      "registerart": "HRB",
      "company_name": "NM Unlimited GmbH",
      "company_seat": "Frankfurt am Main",
      "details": "05.12.2024 (Bekanntmachungsdatum)\n\nHessen Amtsgericht Frankfurt am Main HRB 130634\nLöschungsankündigung 05.12.2024 (Eintragungsdatum)\n\nNM Unlimited GmbH\nGesellschaft mit beschränkter Haftung\nFrankfurt am Main\n\nDas Registergericht beabsichtigt die im Handelsregister eingetragene Gesellschaft von Amts wegen nach § 394 FamFG zu löschen. Die Frist zur Erhebung eines Widerspruchs gegen die beabsichtigte Löschung wird auf 1 Monat festgesetzt."
    },
    {
      "date": "2024-12-05",
      "id": "95581",
      "original_text": "Registerbekanntmachung nach dem Umwandlungsgesetz\nHessen Amtsgericht Fulda HRA 1573\nWende Transport GmbH & Co. KG – Fulda",
      "type": "Registerbekanntmachung nach dem Umwandlungsgesetz",
      "state": "Hessen",
      "amtsgericht": "Amtsgericht Fulda",
      "registernummer": "HRA 1573",
      "registerart": "HRA",
      "company_name": "Wende Transport GmbH & Co. KG",
      "company_seat": "Fulda",
      "details": "05.12.2024 (Bekanntmachungsdatum)\n\nHessen Amtsgericht Fulda HRA 1573\nRegisterbekanntmachung nach dem Umwandlungsgesetz 05.12.2024 (Eintragungsdatum)\n\nWende Transport GmbH & Co. KG\nKommanditgesellschaft\nFulda\n\nDen Gläubigern der an der formwechselnden Umwandlung beteiligten Rechtsträger ist, wenn sie binnen sechs Monaten nach dem Tag, an dem die Eintragung der formwechselnden Umwandlung in das Register des Sitzes desjenigen Rechtsträgers, dessen Gläubiger sie sind, nach § 201 UmwG bekannt gemacht worden ist, ihren Anspruch nach Grund und Höhe schriftlich anmelden, Sicherheit zu leisten, soweit sie nicht Befriedigung verlangen können. Dieses Recht steht den Gläubigern jedoch nur zu, wenn sie glaubhaft machen, dass durch die formwechselnden Umwandlung die Erfüllung ihrer Forderung gefährdet wird."
    },
    {
      "date": "2024-12-05",
      "id": "95582",
      "original_text": "Löschungsankündigung\nHessen Amtsgericht Bad Hersfeld HRA 1600\nDM-LOG Baulogistik GmbH & Co. KG – Bad Hersfeld",
      "type": "Löschungsankündigung",
      "state": "Hessen",
      "amtsgericht": "Amtsgericht Bad Hersfeld",
      "registernummer": "HRA 1600",
      "registerart": "HRA",
      "company_name": "DM-LOG Baulogistik GmbH & Co. KG",
      "company_seat": "Bad Hersfeld",
      "details": "05.12.2024 (Bekanntmachungsdatum)\n\nHessen Amtsgericht Bad Hersfeld HRA 1600\nLöschungsankündigung\n\nDM-LOG Baulogistik GmbH & Co. KG\nKommanditgesellschaft\nBad Hersfeld\n\nDas Registergericht beabsichtigt die im Handelsregister eingetragene Firma von Amts wegen nach § 394 FamFG zu löschen. Die Frist zur Erhebung eines Widerspruchs gegen die beabsichtigte Löschung wird auf 3 Monate festgesetzt."
    },
    {
      "date": "2024-12-05",
      "id": "95583",
      "original_text": "Registerbekanntmachung nach dem Umwandlungsgesetz\nHessen Amtsgericht Frankfurt am Main HRB 135808\nLitura GmbH – Frankfurt am Main",
      "type": "Registerbekanntmachung nach dem Umwandlungsgesetz",
      "state": "Hessen",
      "amtsgericht": "Amtsgericht Frankfurt am Main",
      "registernummer": "HRB 135808",
      "registerart": "HRB",
      "company_name": "Litura GmbH",
      "company_seat": "Frankfurt am Main",
      "details": "05.12.2024 (Bekanntmachungsdatum)\n\nHessen Amtsgericht Frankfurt am Main HRB 135808\nRegisterbekanntmachung nach dem Umwandlungsgesetz 05.12.2024 (Eintragungsdatum)\n\nLitura GmbH\nGesellschaft mit beschränkter Haftung\nFrankfurt am Main\n\nDen Gläubigern der an der Ausgliederung beteiligten Rechtsträger ist, wenn sie binnen sechs Monaten nach dem Tag, an dem die Eintragung der Ausgliederung in das Register des Sitzes desjenigen Rechtsträgers, dessen Gläubiger sie sind, nach §§ 125, 19 Absatz 3 UmwG bekannt gemacht worden ist, ihren Anspruch nach Grund und Höhe schriftlich anmelden, Sicherheit zu leisten, soweit sie nicht Befriedigung verlangen können. Dieses Recht steht den Gläubigern jedoch nur zu, wenn sie glaubhaft machen, dass durch die Ausgliederung die Erfüllung ihrer Forderung gefährdet wird."
    },
    {
      "date": "2024-12-05",
      "id": "95584",
      "original_text": "Registerbekanntmachung nach dem Umwandlungsgesetz\nHessen Amtsgericht Frankfurt am Main HRA 53970\nN-Scion SPV GmbH & Co. KG – Frankfurt am Main",
      "type": "Registerbekanntmachung nach dem Umwandlungsgesetz",
      "state": "Hessen",
      "amtsgericht": "Amtsgericht Frankfurt am Main",
      "registernummer": "HRA 53970",
      "registerart": "HRA",
      "company_name": "N-Scion SPV GmbH & Co. KG",
      "company_seat": "Frankfurt am Main",
      "details": "05.12.2024 (Bekanntmachungsdatum)\n\nHessen Amtsgericht Frankfurt am Main HRA 53970\nRegisterbekanntmachung nach dem Umwandlungsgesetz 05.12.2024 (Eintragungsdatum)\n\nN-Scion SPV GmbH & Co. KG\nKommanditgesellschaft\nFrankfurt am Main\n\nDen Gläubigern der an der Ausgliederung beteiligten Rechtsträger ist, wenn sie binnen sechs Monaten nach dem Tag, an dem die Eintragung der Ausgliederung in das Register des Sitzes desjenigen Rechtsträgers, dessen Gläubiger sie sind, nach §§ 125, 19 Absatz 3 UmwG bekannt gemacht worden ist, ihren Anspruch nach Grund und Höhe schriftlich anmelden, Sicherheit zu leisten, soweit sie nicht Befriedigung verlangen können. Dieses Recht steht den Gläubigern jedoch nur zu, wenn sie glaubhaft machen, dass durch die Ausgliederung die Erfüllung ihrer Forderung gefährdet wird."
    },
    {
      "date": "2024-12-05",
      "id": "95585",
      "original_text": "Registerbekanntmachung nach dem Umwandlungsgesetz\nHessen Amtsgericht Offenbach am Main HRB 48478\nViridium Service Management GmbH – Neu-Isenburg",
      "type": "Registerbekanntmachung nach dem Umwandlungsgesetz",
      "state": "Hessen",
      "amtsgericht": "Amtsgericht Offenbach am Main",
      "registernummer": "HRB 48478",
      "registerart": "HRB",
      "company_name": "Viridium Service Management GmbH",
      "company_seat": "Neu-Isenburg",
      "details": "05.12.2024 (Bekanntmachungsdatum)\n\nHessen Amtsgericht Offenbach am Main HRB 48478\nRegisterbekanntmachung nach dem Umwandlungsgesetz 05.12.2024 (Eintragungsdatum)\n\nViridium Service Management GmbH\nGesellschaft mit beschränkter Haftung\nNeu-Isenburg\n\nDen Gläubigern der an der Verschmelzung beteiligten Rechtsträger ist, wenn sie binnen sechs Monaten nach dem Tag, an dem die Eintragung der Verschmelzung in das Register des Sitzes desjenigen Rechtsträgers, dessen Gläubiger sie sind, nach § 19 Absatz 3 UmwG bekannt gemacht worden ist, ihren Anspruch nach Grund und Höhe schriftlich anmelden, Sicherheit zu leisten, soweit sie nicht Befriedigung verlangen können. Dieses Recht steht den Gläubigern jedoch nur zu, wenn sie glaubhaft machen, dass durch die Verschmelzung die Erfüllung ihrer Forderung gefährdet wird."
    },
    {
      "date": "2024-12-05",
      "id": "95586",
      "original_text": "Löschungsankündigung\nHessen Amtsgericht Frankfurt am Main HRB 128676\nBlumenauer Real Estate GmbH – Frankfurt am Main",
      "type": "Löschungsankündigung",
      "state": "Hessen",
      "amtsgericht": "Amtsgericht Frankfurt am Main",
      "registernummer": "HRB 128676",
      "registerart": "HRB",
      "company_name": "Blumenauer Real Estate GmbH",
      "company_seat": "Frankfurt am Main",
      "details": "05.12.2024 (Bekanntmachungsdatum)\n\nHessen Amtsgericht Frankfurt am Main HRB 128676\nLöschungsankündigung\n\nBlumenauer Real Estate GmbH\nGesellschaft mit beschränkter Haftung\nFrankfurt am Main\n\nDas Registergericht beabsichtigt die im Handelsregister eingetragene Gesellschaft von Amts wegen nach § 394 FamFG zu löschen. Die Frist zur Erhebung eines Widerspruchs gegen die beabsichtigte Löschung wird auf 1 Monat festgesetzt."
    },
    {
      "date": "2024-12-05",
      "id": "95587",
      "original_text": "Registerbekanntmachung nach dem Umwandlungsgesetz\nHessen Amtsgericht Darmstadt HRB 102965\nStylefile GmbH – Ober-Ramstadt",
      "type": "Registerbekanntmachung nach dem Umwandlungsgesetz",
      "state": "Hessen",
      "amtsgericht": "Amtsgericht Darmstadt",
      "registernummer": "HRB 102965",
      "registerart": "HRB",
      "company_name": "Stylefile GmbH",
      "company_seat": "Ober-Ramstadt",
      "details": "05.12.2024 (Bekanntmachungsdatum)\n\nHessen Amtsgericht Darmstadt HRB 102965\nRegisterbekanntmachung nach dem Umwandlungsgesetz 05.12.2024 (Eintragungsdatum)\n\nStylefile GmbH\nGesellschaft mit beschränkter Haftung\nOber-Ramstadt\n\nDen Gläubigern der an der Verschmelzung beteiligten Rechtsträger ist, wenn sie binnen sechs Monaten nach dem Tag, an dem die Eintragung der Verschmelzung in das Register des Sitzes derjenigen Rechtsträger deren Gläubiger sie sind, nach § 19 Absatz 3 UmwG bekannt gemacht worden ist, ihren Anspruch nach Grund und Höhe schriftlich anmelden, Sicherheit zu leisten, soweit sie nicht Befriedigung verlangen können. Dieses Recht steht den Gläubigern jedoch nur zu, wenn sie glaubhaft machen, dass durch die Verschmelzung die Erfüllung ihrer Forderung gefährdet wird."
    },
    {
      "date": "2024-12-05",
      "id": "95588",
      "original_text": "Sonstige Registerbekanntmachung\nHessen Amtsgericht Wiesbaden VR 5427\nSchützenverein Presberg 1969 – Rüdesheim am Rhein-Presberg",
      "type": "Sonstige Registerbekanntmachung",
      "state": "Hessen",
      "amtsgericht": "Amtsgericht Wiesbaden",
      "registernummer": "VR 5427",
      "registerart": "VR",
      "company_name": "Schützenverein Presberg 1969",
      "company_seat": "Rüdesheim am Rhein-Presberg",
      "details": "05.12.2024 (Bekanntmachungsdatum)\n\nHessen Amtsgericht Wiesbaden VR 5427\nSonstige Registerbekanntmachung 05.12.2024 (Eintragungsdatum)\n\nSchützenverein Presberg 1969\neingetragener Verein\nRüdesheim am Rhein-Presberg\n\nDer Verein ist aufgelöst."
    },
    {
      "date": "2024-12-05",
      "id": "95589",
      "original_text": "Einreichung neuer Dokumente\nHessen Amtsgericht Darmstadt HRB 9661\nSEG Stadtentwicklungsgesellschaft Ober-Ramstadt mbH – Ober-Ramstadt",
      "type": "Einreichung neuer Dokumente",
      "state": "Hessen",
      "amtsgericht": "Amtsgericht Darmstadt",
      "registernummer": "HRB 9661",
      "registerart": "HRB",
      "company_name": "SEG Stadtentwicklungsgesellschaft Ober-Ramstadt mbH",
      "company_seat": "Ober-Ramstadt",
      "details": "05.12.2024 (Bekanntmachungsdatum)\n\nHessen Amtsgericht Darmstadt HRB 9661\nEinreichung neuer Dokumente 05.12.2024 (Eintragungsdatum)\n\nSEG Stadtentwicklungsgesellschaft Ober-Ramstadt mbH\nGesellschaft mit beschränkter Haftung\nOber-Ramstadt\n\nWegen Änderungen in den Personen der Aufsichtsratsmitglieder ist eine Liste der Mitglieder des Aufsichtsrates zum Handelsregister eingereicht worden."
    },
    {
      "date": "2024-12-05",
      "id": "95590",
      "original_text": "Einreichung neuer Dokumente\nHessen Amtsgericht Kassel HRB 16239\nAIS Automations- und Informationssysteme AG – Kassel",
      "type": "Einreichung neuer Dokumente",
      "state": "Hessen",
      "amtsgericht": "Amtsgericht Kassel",
      "registernummer": "HRB 16239",
      "registerart": "HRB",
      "company_name": "AIS Automations- und Informationssysteme AG",
      "company_seat": "Kassel",
      "details": "05.12.2024 (Bekanntmachungsdatum)\n\nHessen Amtsgericht Kassel HRB 16239\nEinreichung neuer Dokumente 05.12.2024 (Eintragungsdatum)\n\nAIS Automations- und Informationssysteme AG\nAktiengesellschaft\nKassel\n\nDurch eine Änderung in den Personen der Aufsichtsratsmitglieder ist eine Liste der Mitglieder des Aufsichtsrates zum Handelsregister eingereicht worden."
    },
    {
      "date": "2024-12-05",
      "id": "95591",
      "original_text": "Löschungsankündigung\nHessen Amtsgericht Frankfurt am Main HRB 129913\nAGM International GmbH – Frankfurt am Main",
      "type": "Löschungsankündigung",
      "state": "Hessen",
      "amtsgericht": "Amtsgericht Frankfurt am Main",
      "registernummer": "HRB 129913",
      "registerart": "HRB",
      "company_name": "AGM International GmbH",
      "company_seat": "Frankfurt am Main",
      "details": "05.12.2024 (Bekanntmachungsdatum)\n\nHessen Amtsgericht Frankfurt am Main HRB 129913\nLöschungsankündigung\n\nAGM International GmbH\nGesellschaft mit beschränkter Haftung\nFrankfurt am Main\n\nDas Registergericht beabsichtigt die im Handelsregister eingetragene Gesellschaft von Amts wegen nach § 394 FamFG zu löschen. Die Frist zur Erhebung eines Widerspruchs gegen die beabsichtigte Löschung wird auf 1 Monat festgesetzt."
    },
    {
      "date": "2024-12-05",
      "id": "95592",
      "original_text": "Einreichung neuer Dokumente\nHessen Amtsgericht Frankfurt am Main HRB 45804\nAMADEUS FIRE AG – Frankfurt am Main",
      "type": "Einreichung neuer Dokumente",
      "state": "Hessen",
      "amtsgericht": "Amtsgericht Frankfurt am Main",
      "registernummer": "HRB 45804",
      "registerart": "HRB",
      "company_name": "AMADEUS FIRE AG",
      "company_seat": "Frankfurt am Main",
      "details": "05.12.2024 (Bekanntmachungsdatum)\n\nHessen Amtsgericht Frankfurt am Main HRB 45804\nEinreichung neuer Dokumente 03.12.2024 (Eintragungsdatum)\n\nAMADEUS FIRE AG\nAktiengesellschaft\nFrankfurt am Main\n\nDurch eine Änderung in den Personen der Aufsichtsratsmitglieder ist eine Liste der Mitglieder des Aufsichtsrates zum Handelsregister eingereicht worden."
    },
    {
      "date": "2024-12-05",
      "id": "95593",
      "original_text": "Löschungsankündigung\nHessen Amtsgericht Frankfurt am Main HRB 98926\nUNIMOD Europe GmbH – Frankfurt am Main",
      "type": "Löschungsankündigung",
      "state": "Hessen",
      "amtsgericht": "Amtsgericht Frankfurt am Main",
      "registernummer": "HRB 98926",
      "registerart": "HRB",
      "company_name": "UNIMOD Europe GmbH",
      "company_seat": "Frankfurt am Main",
      "details": "05.12.2024 (Bekanntmachungsdatum)\n\nHessen Amtsgericht Frankfurt am Main HRB 98926\nLöschungsankündigung\n\nUNIMOD Europe GmbH\nGesellschaft mit beschränkter Haftung\nFrankfurt am Main\n\nDas Registergericht beabsichtigt die im Handelsregister eingetragene Gesellschaft von Amts wegen nach § 394 FamFG zu löschen. Die Frist zur Erhebung eines Widerspruchs gegen die beabsichtigte Löschung wird auf 1 Monat festgesetzt."
    },
    {
      "date": "2024-12-05",
      "id": "95594",
      "original_text": "Löschungsankündigung\nHessen Amtsgericht Bad Hersfeld HRB 2320\nDM-Beteiligungs GmbH – Bad Hersfeld",
      "type": "Löschungsankündigung",
      "state": "Hessen",
      "amtsgericht": "Amtsgericht Bad Hersfeld",
      "registernummer": "HRB 2320",
      "registerart": "HRB",
      "company_name": "DM-Beteiligungs GmbH",
      "company_seat": "Bad Hersfeld",
      "details": "05.12.2024 (Bekanntmachungsdatum)\n\nHessen Amtsgericht Bad Hersfeld HRB 2320\nLöschungsankündigung\n\nDM-Beteiligungs GmbH\nGesellschaft mit beschränkter Haftung\nBad Hersfeld\n\nDas Registergericht beabsichtigt die im Handelsregister eingetragene Gesellschaft von Amts wegen nach § 394 FamFG zu löschen. Die Frist zur Erhebung eines Widerspruchs gegen die beabsichtigte Löschung wird auf 3 Monate festgesetzt."
    },
    {
      "date": "2024-12-05",
      "id": "95595",
      "original_text": "Löschungsankündigung\nHessen Amtsgericht Darmstadt HRB 103192\nTransGoFast GmbH – Rüsselsheim",
      "type": "Löschungsankündigung",
      "state": "Hessen",
      "amtsgericht": "Amtsgericht Darmstadt",
      "registernummer": "HRB 103192",
      "registerart": "HRB",
      "company_name": "TransGoFast GmbH",
      "company_seat": "Rüsselsheim",
      "details": "05.12.2024 (Bekanntmachungsdatum)\n\nHessen Amtsgericht Darmstadt HRB 103192\nLöschungsankündigung 05.12.2024 (Eintragungsdatum)\n\nTransGoFast GmbH\nGesellschaft mit beschränkter Haftung\nRüsselsheim\n\nDas Registergericht beabsichtigt die im Handelsregister eingetragene Gesellschaft von Amts wegen nach § 394 FamFG zu löschen. Die Frist zur Erhebung eines Widerspruchs gegen die beabsichtigte Löschung wird auf 3 Monate festgesetzt."
    },
    {
      "date": "2024-12-05",
      "id": "95596",
      "original_text": "Registerbekanntmachung nach dem Umwandlungsgesetz\nHessen Amtsgericht Offenbach am Main HRB 42398\nHeli Transair European Air Services GmbH – Egelsbach",
      "type": "Registerbekanntmachung nach dem Umwandlungsgesetz",
      "state": "Hessen",
      "amtsgericht": "Amtsgericht Offenbach am Main",
      "registernummer": "HRB 42398",
      "registerart": "HRB",
      "company_name": "Heli Transair European Air Services GmbH",
      "company_seat": "Egelsbach",
      "details": "05.12.2024 (Bekanntmachungsdatum)\n\nHessen Amtsgericht Offenbach am Main HRB 42398\nRegisterbekanntmachung nach dem Umwandlungsgesetz 05.12.2024 (Eintragungsdatum)\n\nHeli Transair European Air Services GmbH\nGesellschaft mit beschränkter Haftung\nEgelsbach\n\nDen Gläubigern der an der Verschmelzung beteiligten Rechtsträger ist, wenn sie binnen sechs Monaten nach dem Tag, an dem die Eintragung der Verschmelzung in das Register des Sitzes desjenigen Rechtsträgers, dessen Gläubiger sie sind, nach § 19 Absatz 3 UmwG bekannt gemacht worden ist, ihren Anspruch nach Grund und Höhe schriftlich anmelden, Sicherheit zu leisten, soweit sie nicht Befriedigung verlangen können. Dieses Recht steht den Gläubigern jedoch nur zu, wenn sie glaubhaft machen, dass durch die Verschmelzung die Erfüllung ihrer Forderung gefährdet wird."
    },
    {
      "date": "2024-12-05",
      "id": "95597",
      "original_text": "Löschungsankündigung\nHessen Amtsgericht Frankfurt am Main HRB 95680\nMonterra Group AG – Frankfurt am Main",
      "type": "Löschungsankündigung",
      "state": "Hessen",
      "amtsgericht": "Amtsgericht Frankfurt am Main",
      "registernummer": "HRB 95680",
      "registerart": "HRB",
      "company_name": "Monterra Group AG",
      "company_seat": "Frankfurt am Main",
      "details": "05.12.2024 (Bekanntmachungsdatum)\n\nHessen Amtsgericht Frankfurt am Main HRB 95680\nLöschungsankündigung\n\nMonterra Group AG\nAktiengesellschaft\nFrankfurt am Main\n\nDas Registergericht beabsichtigt die im Handelsregister eingetragene Gesellschaft von Amts wegen nach § 394 FamFG zu löschen. Die Frist zur Erhebung eines Widerspruchs gegen die beabsichtigte Löschung wird auf 1 Monat festgesetzt."
    },
    {
      "date": "2024-12-05",
      "id": "95598",
      "original_text": "Löschungsankündigung\nHessen Amtsgericht Frankfurt am Main HRB 102525\nASV Service GmbH – Frankfurt am Main",
      "type": "Löschungsankündigung",
      "state": "Hessen",
      "amtsgericht": "Amtsgericht Frankfurt am Main",
      "registernummer": "HRB 102525",
      "registerart": "HRB",
      "company_name": "ASV Service GmbH",
      "company_seat": "Frankfurt am Main",
      "details": "05.12.2024 (Bekanntmachungsdatum)\n\nHessen Amtsgericht Frankfurt am Main HRB 102525\nLöschungsankündigung\n\nASV Service GmbH\nGesellschaft mit beschränkter Haftung\nFrankfurt am Main\n\nDas Registergericht beabsichtigt die im Handelsregister eingetragene Gesellschaft von Amts wegen nach § 394 FamFG zu löschen. Die Frist zur Erhebung eines Widerspruchs gegen die beabsichtigte Löschung wird auf 1 Monat festgesetzt."
    }
  ]
}