{
  "date": "2024-12-28",
  "date_of_scrape": "2024-12-29T04:03:37.752Z",
  "tool_version": "0.2.0",
  "number_of_announcements": 25,
  "announcements": [
    {
      "date": "2024-12-28",
      "id": "97426",
      "original_text": "Registerbekanntmachung nach dem Umwandlungsgesetz\nBayern Amtsgericht Traunstein HRB 29868\nBiogena Premium & Franchise GmbH – Freilassing",
      "type": "Registerbekanntmachung nach dem Umwandlungsgesetz",
      "state": "Bayern",
      "amtsgericht": "Amtsgericht Traunstein",
      "registernummer": "HRB 29868",
      "registerart": "HRB",
      "company_name": "Biogena Premium & Franchise GmbH",
      "company_seat": "Freilassing",
      "details": "28.12.2024 (Bekanntmachungsdatum)\n\nBayern Amtsgericht Traunstein HRB 29868\nRegisterbekanntmachung nach dem Umwandlungsgesetz 27.12.2024 (Eintragungsdatum)\n\nBiogena Premium & Franchise GmbH\nGesellschaft mit beschränkter Haftung\nFreilassing\n\nDen Gläubigern der an der Verschmelzung beteiligten Rechtsträger ist, wenn sie binnen sechs Monaten nach dem Tag, an dem die Eintragung der Verschmelzung in das Register des Sitzes desjenigen Rechtsträgers, dessen Gläubiger sie sind, nach § 19 Abs. 3 UmwG als bekannt gemacht gilt, ihren Anspruch nach Grund und Höhe schriftlich anmelden, Sicherheit zu leisten, soweit sie nicht Befriedigung verlangen können. Dieses Recht steht den Gläubigern jedoch nur zu, wenn sie glaubhaft machen, dass durch die Verschmelzung die Erfüllung ihrer Forderung gefährdet wird."
    },
    {
      "date": "2024-12-28",
      "id": "97427",
      "original_text": "Registerbekanntmachung nach dem Umwandlungsgesetz\nBayern Amtsgericht Traunstein HRB 26611\nBiogena Diagnostics Deutschland GmbH – Freilassing",
      "type": "Registerbekanntmachung nach dem Umwandlungsgesetz",
      "state": "Bayern",
      "amtsgericht": "Amtsgericht Traunstein",
      "registernummer": "HRB 26611",
      "registerart": "HRB",
      "company_name": "Biogena Diagnostics Deutschland GmbH",
      "company_seat": "Freilassing",
      "details": "28.12.2024 (Bekanntmachungsdatum)\n\nBayern Amtsgericht Traunstein HRB 26611\nRegisterbekanntmachung nach dem Umwandlungsgesetz 27.12.2024 (Eintragungsdatum)\n\nBiogena Diagnostics Deutschland GmbH\nGesellschaft mit beschränkter Haftung\nFreilassing\n\nDen Gläubigern der an der Verschmelzung beteiligten Rechtsträger ist, wenn sie binnen sechs Monaten nach dem Tag, an dem die Eintragung der Verschmelzung in das Register des Sitzes desjenigen Rechtsträgers, dessen Gläubiger sie sind, nach § 19 Abs. 3 UmwG als bekannt gemacht gilt, ihren Anspruch nach Grund und Höhe schriftlich anmelden, Sicherheit zu leisten, soweit sie nicht Befriedigung verlangen können. Dieses Recht steht den Gläubigern jedoch nur zu, wenn sie glaubhaft machen, dass durch die Verschmelzung die Erfüllung ihrer Forderung gefährdet wird."
    },
    {
      "date": "2024-12-28",
      "id": "97428",
      "original_text": "Registerbekanntmachung nach dem Umwandlungsgesetz\nBayern Amtsgericht Nürnberg HRB 43364\nTCH Therapie Company Holding GmbH – Nürnberg",
      "type": "Registerbekanntmachung nach dem Umwandlungsgesetz",
      "state": "Bayern",
      "amtsgericht": "Amtsgericht Nürnberg",
      "registernummer": "HRB 43364",
      "registerart": "HRB",
      "company_name": "TCH Therapie Company Holding GmbH",
      "company_seat": "Nürnberg",
      "details": "28.12.2024 (Bekanntmachungsdatum)\n\nBayern Amtsgericht Nürnberg HRB 43364\nRegisterbekanntmachung nach dem Umwandlungsgesetz 27.12.2024 (Eintragungsdatum)\n\nTCH Therapie Company Holding GmbH\nGesellschaft mit beschränkter Haftung\nNürnberg\n\nDen Gläubigern der an der Ausgliederung beteiligten Rechtsträger ist, wenn sie binnen sechs Monaten nach dem Tag, an dem die Eintragung der Ausgliederung in das Register des Sitzes desjenigen Rechtsträgers, dessen Gläubiger sie sind, nach §§ 125, 19 Abs. 3 UmwG als bekannt gemacht gilt, ihren Anspruch nach Grund und Höhe schriftlich anmelden, Sicherheit zu leisten, soweit sie nicht Befriedigung verlangen können. Dieses Recht steht den Gläubigern jedoch nur zu, wenn sie glaubhaft machen, dass durch die Ausgliederung die Erfüllung ihrer Forderung gefährdet wird."
    },
    {
      "date": "2024-12-28",
      "id": "97429",
      "original_text": "Registerbekanntmachung nach dem Umwandlungsgesetz\nBayern Amtsgericht München HRB 113576\nCitrix Systems GmbH – München",
      "type": "Registerbekanntmachung nach dem Umwandlungsgesetz",
      "state": "Bayern",
      "amtsgericht": "Amtsgericht München",
      "registernummer": "HRB 113576",
      "registerart": "HRB",
      "company_name": "Citrix Systems GmbH",
      "company_seat": "München",
      "details": "28.12.2024 (Bekanntmachungsdatum)\n\nBayern Amtsgericht München HRB 113576\nRegisterbekanntmachung nach dem Umwandlungsgesetz 27.12.2024 (Eintragungsdatum)\n\nCitrix Systems GmbH\nGesellschaft mit beschränkter Haftung\nMünchen\n\nDen Gläubigern der an der Verschmelzung beteiligten Rechtsträger ist, wenn sie binnen sechs Monaten nach dem Tag, an dem die Eintragung der Verschmelzung in das Register des Sitzes desjenigen Rechtsträgers, dessen Gläubiger sie sind, nach § 19 Abs. 3 UmwG als bekannt gemacht gilt, ihren Anspruch nach Grund und Höhe schriftlich anmelden, Sicherheit zu leisten, soweit sie nicht Befriedigung verlangen können. Dieses Recht steht den Gläubigern jedoch nur zu, wenn sie glaubhaft machen, dass durch die Verschmelzung die Erfüllung ihrer Forderung gefährdet wird."
    },
    {
      "date": "2024-12-28",
      "id": "97430",
      "original_text": "Registerbekanntmachung nach dem Umwandlungsgesetz\nBayern Amtsgericht München HRB 295421\nENTRO Beteiligungen GmbH – München",
      "type": "Registerbekanntmachung nach dem Umwandlungsgesetz",
      "state": "Bayern",
      "amtsgericht": "Amtsgericht München",
      "registernummer": "HRB 295421",
      "registerart": "HRB",
      "company_name": "ENTRO Beteiligungen GmbH",
      "company_seat": "München",
      "details": "28.12.2024 (Bekanntmachungsdatum)\n\nBayern Amtsgericht München HRB 295421\nRegisterbekanntmachung nach dem Umwandlungsgesetz 27.12.2024 (Eintragungsdatum)\n\nENTRO Beteiligungen GmbH\nGesellschaft mit beschränkter Haftung\nMünchen\n\nDen Gläubigern der an der Verschmelzung beteiligten Rechtsträger ist, wenn sie binnen sechs Monaten nach dem Tag, an dem die Eintragung der Verschmelzung in das Register des Sitzes desjenigen Rechtsträgers, dessen Gläubiger sie sind, nach § 19 Abs. 3 UmwG als bekannt gemacht gilt, ihren Anspruch nach Grund und Höhe schriftlich anmelden, Sicherheit zu leisten, soweit sie nicht Befriedigung verlangen können. Dieses Recht steht den Gläubigern jedoch nur zu, wenn sie glaubhaft machen, dass durch die Verschmelzung die Erfüllung ihrer Forderung gefährdet wird."
    },
    {
      "date": "2024-12-28",
      "id": "97431",
      "original_text": "Registerbekanntmachung nach dem Umwandlungsgesetz\nBayern Amtsgericht Ansbach HRA 3668\nKontraktlogistik Wüst GmbH & Co. KG – Weißenburg i. Bay.",
      "type": "Registerbekanntmachung nach dem Umwandlungsgesetz",
      "state": "Bayern",
      "amtsgericht": "Amtsgericht Ansbach",
      "registernummer": "HRA 3668",
      "registerart": "HRA",
      "company_name": "Kontraktlogistik Wüst GmbH & Co. KG",
      "company_seat": "Weißenburg i. Bay.",
      "details": "28.12.2024 (Bekanntmachungsdatum)\n\nBayern Amtsgericht Ansbach HRA 3668\nRegisterbekanntmachung nach dem Umwandlungsgesetz 27.12.2024 (Eintragungsdatum)\n\nKontraktlogistik Wüst GmbH & Co. KG\nKommanditgesellschaft\nWeißenburg i. Bay.\n\nDen Gläubigern des formwechselnden Rechtsträgers ist, wenn sie binnen sechs Monaten nach dem Tag, an dem die Eintragung des Formwechsels nach § 201 UmwG als bekannt gemacht gilt, ihren Anspruch nach Grund und Höhe schriftlich anmelden, Sicherheit zu leisten, soweit sie nicht Befriedigung verlangen können. Dieses Recht steht den Gläubigern jedoch nur zu, wenn sie glaubhaft machen, dass durch den Formwechsel die Erfüllung ihrer Forderung gefährdet wird."
    },
    {
      "date": "2024-12-28",
      "id": "97432",
      "original_text": "Registerbekanntmachung nach dem Umwandlungsgesetz\nBayern Amtsgericht Nürnberg HRB 23652\nNet1 GmbH – Nürnberg",
      "type": "Registerbekanntmachung nach dem Umwandlungsgesetz",
      "state": "Bayern",
      "amtsgericht": "Amtsgericht Nürnberg",
      "registernummer": "HRB 23652",
      "registerart": "HRB",
      "company_name": "Net1 GmbH",
      "company_seat": "Nürnberg",
      "details": "28.12.2024 (Bekanntmachungsdatum)\n\nBayern Amtsgericht Nürnberg HRB 23652\nRegisterbekanntmachung nach dem Umwandlungsgesetz 27.12.2024 (Eintragungsdatum)\n\nNet1 GmbH\nGesellschaft mit beschränkter Haftung\nNürnberg\n\nDen Gläubigern der an der Verschmelzung beteiligten Rechtsträger ist, wenn sie binnen sechs Monaten nach dem Tag, an dem die Eintragung der Verschmelzung in das Register des Sitzes desjenigen Rechtsträgers, dessen Gläubiger sie sind, nach § 19 Abs. 3 UmwG als bekannt gemacht gilt, ihren Anspruch nach Grund und Höhe schriftlich anmelden, Sicherheit zu leisten, soweit sie nicht Befriedigung verlangen können. Dieses Recht steht den Gläubigern jedoch nur zu, wenn sie glaubhaft machen, dass durch die Verschmelzung die Erfüllung ihrer Forderung gefährdet wird."
    },
    {
      "date": "2024-12-28",
      "id": "97433",
      "original_text": "Registerbekanntmachung nach dem Umwandlungsgesetz\nBayern Amtsgericht Nürnberg HRB 23652\nNet1 GmbH – Nürnberg",
      "type": "Registerbekanntmachung nach dem Umwandlungsgesetz",
      "state": "Bayern",
      "amtsgericht": "Amtsgericht Nürnberg",
      "registernummer": "HRB 23652",
      "registerart": "HRB",
      "company_name": "Net1 GmbH",
      "company_seat": "Nürnberg",
      "details": "28.12.2024 (Bekanntmachungsdatum)\n\nBayern Amtsgericht Nürnberg HRB 23652\nRegisterbekanntmachung nach dem Umwandlungsgesetz 27.12.2024 (Eintragungsdatum)\n\nNet1 GmbH\nGesellschaft mit beschränkter Haftung\nNürnberg\n\nDen Gläubigern der an der Verschmelzung beteiligten Rechtsträger ist, wenn sie binnen sechs Monaten nach dem Tag, an dem die Eintragung der Verschmelzung in das Register des Sitzes desjenigen Rechtsträgers, dessen Gläubiger sie sind, nach § 19 Abs. 3 UmwG als bekannt gemacht gilt, ihren Anspruch nach Grund und Höhe schriftlich anmelden, Sicherheit zu leisten, soweit sie nicht Befriedigung verlangen können. Dieses Recht steht den Gläubigern jedoch nur zu, wenn sie glaubhaft machen, dass durch die Verschmelzung die Erfüllung ihrer Forderung gefährdet wird."
    },
    {
      "date": "2024-12-28",
      "id": "97434",
      "original_text": "Löschungsankündigung\nBayern Amtsgericht Kempten (Allgäu) HRB 1251\nKinold-Ausstellungsgesellschaft mit beschränkter Haftung – Bodolz",
      "type": "Löschungsankündigung",
      "state": "Bayern",
      "amtsgericht": "Amtsgericht Kempten (Allgäu)",
      "registernummer": "HRB 1251",
      "registerart": "HRB",
      "company_name": "Kinold-Ausstellungsgesellschaft mit beschränkter Haftung",
      "company_seat": "Bodolz",
      "details": "28.12.2024 (Bekanntmachungsdatum)\n\nBayern Amtsgericht Kempten (Allgäu) HRB 1251\nLöschungsankündigung\n\nKinold-Ausstellungsgesellschaft mit beschränkter Haftung\nGesellschaft mit beschränkter Haftung\nBodolz\n\nDas Registergericht beabsichtigt, die im Handelsregister eingetragene Gesellschaft wegen Vermögenslosigkeit von Amts wegen nach § 394 FamFG zu löschen. Die Frist zur Erhebung eines Widerspruchs ist auf einen Monat festgesetzt."
    },
    {
      "date": "2024-12-28",
      "id": "97435",
      "original_text": "Registerbekanntmachung nach dem Umwandlungsgesetz\nBayern Amtsgericht München HRB 211627\nLOUISA VICTORIA GmbH – München",
      "type": "Registerbekanntmachung nach dem Umwandlungsgesetz",
      "state": "Bayern",
      "amtsgericht": "Amtsgericht München",
      "registernummer": "HRB 211627",
      "registerart": "HRB",
      "company_name": "LOUISA VICTORIA GmbH",
      "company_seat": "München",
      "details": "28.12.2024 (Bekanntmachungsdatum)\n\nBayern Amtsgericht München HRB 211627\nRegisterbekanntmachung nach dem Umwandlungsgesetz 27.12.2024 (Eintragungsdatum)\n\nLOUISA VICTORIA GmbH\nGesellschaft mit beschränkter Haftung\nMünchen\n\nDen Gläubigern der an der Verschmelzung beteiligten Rechtsträger ist, wenn sie binnen sechs Monaten nach dem Tag, an dem die Eintragung der Verschmelzung in das Register des Sitzes desjenigen Rechtsträgers, dessen Gläubiger sie sind, nach § 19 Abs. 3 UmwG als bekannt gemacht gilt, ihren Anspruch nach Grund und Höhe schriftlich anmelden, Sicherheit zu leisten, soweit sie nicht Befriedigung verlangen können. Dieses Recht steht den Gläubigern jedoch nur zu, wenn sie glaubhaft machen, dass durch die Verschmelzung die Erfüllung ihrer Forderung gefährdet wird."
    },
    {
      "date": "2024-12-28",
      "id": "97436",
      "original_text": "Registerbekanntmachung nach dem Umwandlungsgesetz\nBayern Amtsgericht Nürnberg HRB 23652\nNet1 GmbH – Nürnberg",
      "type": "Registerbekanntmachung nach dem Umwandlungsgesetz",
      "state": "Bayern",
      "amtsgericht": "Amtsgericht Nürnberg",
      "registernummer": "HRB 23652",
      "registerart": "HRB",
      "company_name": "Net1 GmbH",
      "company_seat": "Nürnberg",
      "details": "28.12.2024 (Bekanntmachungsdatum)\n\nBayern Amtsgericht Nürnberg HRB 23652\nRegisterbekanntmachung nach dem Umwandlungsgesetz 27.12.2024 (Eintragungsdatum)\n\nNet1 GmbH\nGesellschaft mit beschränkter Haftung\nNürnberg\n\nDen Gläubigern der an der Verschmelzung beteiligten Rechtsträger ist, wenn sie binnen sechs Monaten nach dem Tag, an dem die Eintragung der Verschmelzung in das Register des Sitzes desjenigen Rechtsträgers, dessen Gläubiger sie sind, nach § 19 Abs. 3 UmwG als bekannt gemacht gilt, ihren Anspruch nach Grund und Höhe schriftlich anmelden, Sicherheit zu leisten, soweit sie nicht Befriedigung verlangen können. Dieses Recht steht den Gläubigern jedoch nur zu, wenn sie glaubhaft machen, dass durch die Verschmelzung die Erfüllung ihrer Forderung gefährdet wird."
    },
    {
      "date": "2024-12-28",
      "id": "97437",
      "original_text": "Löschungsankündigung\nBayern Amtsgericht Nürnberg HRA 11108\ni-center Elektrogroßhandel GmbH & Co. – Nürnberg",
      "type": "Löschungsankündigung",
      "state": "Bayern",
      "amtsgericht": "Amtsgericht Nürnberg",
      "registernummer": "HRA 11108",
      "registerart": "HRA",
      "company_name": "i-center Elektrogroßhandel GmbH & Co.",
      "company_seat": "Nürnberg",
      "details": "28.12.2024 (Bekanntmachungsdatum)\n\nBayern Amtsgericht Nürnberg HRA 11108\nLöschungsankündigung\n\ni-center Elektrogroßhandel GmbH & Co.\nKommanditgesellschaft\nNürnberg\n\nDas Registergericht beabsichtigt, die im Handelsregister eingetragene Firma wegen Vermögenslosigkeit von Amts wegen nach § 394 FamFG zu löschen. Die Frist zur Erhebung eines Widerspruchs ist auf einen Monat festgesetzt."
    },
    {
      "date": "2024-12-28",
      "id": "97438",
      "original_text": "Einreichung neuer Dokumente\nBayern Amtsgericht München HRB 219608\nOrcan Energy AG – München",
      "type": "Einreichung neuer Dokumente",
      "state": "Bayern",
      "amtsgericht": "Amtsgericht München",
      "registernummer": "HRB 219608",
      "registerart": "HRB",
      "company_name": "Orcan Energy AG",
      "company_seat": "München",
      "details": "28.12.2024 (Bekanntmachungsdatum)\n\nBayern Amtsgericht München HRB 219608\nEinreichung neuer Dokumente\n\nOrcan Energy AG\nAktiengesellschaft\nMünchen\n\nDem Amtsgericht München -Registergericht- ist eine Liste der Mitglieder des Aufsichtsrats eingereicht worden, § 106 AktG."
    },
    {
      "date": "2024-12-28",
      "id": "97439",
      "original_text": "Einreichung neuer Dokumente\nBayern Amtsgericht München HRB 182068\nPGIM Real Estate Germany AG – München",
      "type": "Einreichung neuer Dokumente",
      "state": "Bayern",
      "amtsgericht": "Amtsgericht München",
      "registernummer": "HRB 182068",
      "registerart": "HRB",
      "company_name": "PGIM Real Estate Germany AG",
      "company_seat": "München",
      "details": "28.12.2024 (Bekanntmachungsdatum)\n\nBayern Amtsgericht München HRB 182068\nEinreichung neuer Dokumente\n\nPGIM Real Estate Germany AG\nAktiengesellschaft\nMünchen\n\nDem Amtsgericht München -Registergericht- ist eine Liste der Mitglieder des Aufsichtsrats eingereicht worden, § 106 AktG."
    },
    {
      "date": "2024-12-28",
      "id": "97440",
      "original_text": "Registerbekanntmachung nach dem Umwandlungsgesetz\nBayern Amtsgericht Nürnberg HRB 34698\nStumpner Netservice UG (haftungsbeschränkt) – Nürnberg",
      "type": "Registerbekanntmachung nach dem Umwandlungsgesetz",
      "state": "Bayern",
      "amtsgericht": "Amtsgericht Nürnberg",
      "registernummer": "HRB 34698",
      "registerart": "HRB",
      "company_name": "Stumpner Netservice UG (haftungsbeschränkt)",
      "company_seat": "Nürnberg",
      "details": "28.12.2024 (Bekanntmachungsdatum)\n\nBayern Amtsgericht Nürnberg HRB 34698\nRegisterbekanntmachung nach dem Umwandlungsgesetz 27.12.2024 (Eintragungsdatum)\n\nStumpner Netservice UG (haftungsbeschränkt)\nGesellschaft mit beschränkter Haftung\nNürnberg\n\nDen Gläubigern der an der Verschmelzung beteiligten Rechtsträger ist, wenn sie binnen sechs Monaten nach dem Tag, an dem die Eintragung der Verschmelzung in das Register des Sitzes desjenigen Rechtsträgers, dessen Gläubiger sie sind, nach § 19 Abs. 3 UmwG als bekannt gemacht gilt, ihren Anspruch nach Grund und Höhe schriftlich anmelden, Sicherheit zu leisten, soweit sie nicht Befriedigung verlangen können. Dieses Recht steht den Gläubigern jedoch nur zu, wenn sie glaubhaft machen, dass durch die Verschmelzung die Erfüllung ihrer Forderung gefährdet wird."
    },
    {
      "date": "2024-12-28",
      "id": "97441",
      "original_text": "Registerbekanntmachung nach dem Umwandlungsgesetz\nBayern Amtsgericht Memmingen HRA 14204\nKlaus Wörz eK – Lautrach",
      "type": "Registerbekanntmachung nach dem Umwandlungsgesetz",
      "state": "Bayern",
      "amtsgericht": "Amtsgericht Memmingen",
      "registernummer": "HRA 14204",
      "registerart": "HRA",
      "company_name": "Klaus Wörz eK",
      "company_seat": "Lautrach",
      "details": "28.12.2024 (Bekanntmachungsdatum)\n\nBayern Amtsgericht Memmingen HRA 14204\nRegisterbekanntmachung nach dem Umwandlungsgesetz 27.12.2024 (Eintragungsdatum)\n\nKlaus Wörz eK\nEinzelkaufmann / Einzelkauffrau\nLautrach\n\nDen Gläubigern der an der Ausgliederung beteiligten Rechtsträger ist, wenn sie binnen sechs Monaten nach dem Tag, an dem die Eintragung der Ausgliederung in das Register des Sitzes desjenigen Rechtsträgers, dessen Gläubiger sie sind, nach §§ 125, 19 Abs. 3 UmwG als bekannt gemacht gilt, ihren Anspruch nach Grund und Höhe schriftlich anmelden, Sicherheit zu leisten, soweit sie nicht Befriedigung verlangen können. Dieses Recht steht den Gläubigern jedoch nur zu, wenn sie glaubhaft machen, dass durch die Ausgliederung die Erfüllung ihrer Forderung gefährdet wird."
    },
    {
      "date": "2024-12-28",
      "id": "97442",
      "original_text": "Registerbekanntmachung nach dem Umwandlungsgesetz\nBayern Amtsgericht Nürnberg HRB 22313\nTherapie Company TCB Beteiligungs GmbH – Nürnberg",
      "type": "Registerbekanntmachung nach dem Umwandlungsgesetz",
      "state": "Bayern",
      "amtsgericht": "Amtsgericht Nürnberg",
      "registernummer": "HRB 22313",
      "registerart": "HRB",
      "company_name": "Therapie Company TCB Beteiligungs GmbH",
      "company_seat": "Nürnberg",
      "details": "28.12.2024 (Bekanntmachungsdatum)\n\nBayern Amtsgericht Nürnberg HRB 22313\nRegisterbekanntmachung nach dem Umwandlungsgesetz 27.12.2024 (Eintragungsdatum)\n\nTherapie Company TCB Beteiligungs GmbH\nGesellschaft mit beschränkter Haftung\nNürnberg\n\nDen Gläubigern der an der Ausgliederung beteiligten Rechtsträger ist, wenn sie binnen sechs Monaten nach dem Tag, an dem die Eintragung der Ausgliederung in das Register des Sitzes desjenigen Rechtsträgers, dessen Gläubiger sie sind, nach §§ 125, 19 Abs. 3 UmwG als bekannt gemacht gilt, ihren Anspruch nach Grund und Höhe schriftlich anmelden, Sicherheit zu leisten, soweit sie nicht Befriedigung verlangen können. Dieses Recht steht den Gläubigern jedoch nur zu, wenn sie glaubhaft machen, dass durch die Ausgliederung die Erfüllung ihrer Forderung gefährdet wird."
    },
    {
      "date": "2024-12-28",
      "id": "97443",
      "original_text": "Registerbekanntmachung nach dem Umwandlungsgesetz\nBayern Amtsgericht Traunstein HRB 17029\nBiogena Deutschland GmbH – Freilassing",
      "type": "Registerbekanntmachung nach dem Umwandlungsgesetz",
      "state": "Bayern",
      "amtsgericht": "Amtsgericht Traunstein",
      "registernummer": "HRB 17029",
      "registerart": "HRB",
      "company_name": "Biogena Deutschland GmbH",
      "company_seat": "Freilassing",
      "details": "28.12.2024 (Bekanntmachungsdatum)\n\nBayern Amtsgericht Traunstein HRB 17029\nRegisterbekanntmachung nach dem Umwandlungsgesetz 27.12.2024 (Eintragungsdatum)\n\nBiogena Deutschland GmbH\nGesellschaft mit beschränkter Haftung\nFreilassing\n\nDen Gläubigern der an der Verschmelzung beteiligten Rechtsträger ist, wenn sie binnen sechs Monaten nach dem Tag, an dem die Eintragung der Verschmelzung in das Register des Sitzes desjenigen Rechtsträgers, dessen Gläubiger sie sind, nach § 19 Abs. 3 UmwG als bekannt gemacht gilt, ihren Anspruch nach Grund und Höhe schriftlich anmelden, Sicherheit zu leisten, soweit sie nicht Befriedigung verlangen können. Dieses Recht steht den Gläubigern jedoch nur zu, wenn sie glaubhaft machen, dass durch die Verschmelzung die Erfüllung ihrer Forderung gefährdet wird."
    },
    {
      "date": "2024-12-28",
      "id": "97444",
      "original_text": "Löschungsankündigung\nBayern Amtsgericht München HRB 248841\nKruzr GmbH – München",
      "type": "Löschungsankündigung",
      "state": "Bayern",
      "amtsgericht": "Amtsgericht München",
      "registernummer": "HRB 248841",
      "registerart": "HRB",
      "company_name": "Kruzr GmbH",
      "company_seat": "München",
      "details": "28.12.2024 (Bekanntmachungsdatum)\n\nBayern Amtsgericht München HRB 248841\nLöschungsankündigung 27.12.2024 (Eintragungsdatum)\n\nKruzr GmbH\nGesellschaft mit beschränkter Haftung\nMünchen\n\nDas Registergericht beabsichtigt, die im Handelsregister eingetragene Gesellschaft wegen Vermögenslosigkeit von Amts wegen nach § 394 FamFG zu löschen. Die Frist zur Erhebung eines Widerspruchs ist auf drei Monate festgesetzt."
    },
    {
      "date": "2024-12-28",
      "id": "97445",
      "original_text": "Registerbekanntmachung nach dem Umwandlungsgesetz\nBayern Amtsgericht Nürnberg HRB 36716\nWeinandNet UG (haftungsbeschränkt) – Schwabach",
      "type": "Registerbekanntmachung nach dem Umwandlungsgesetz",
      "state": "Bayern",
      "amtsgericht": "Amtsgericht Nürnberg",
      "registernummer": "HRB 36716",
      "registerart": "HRB",
      "company_name": "WeinandNet UG (haftungsbeschränkt)",
      "company_seat": "Schwabach",
      "details": "28.12.2024 (Bekanntmachungsdatum)\n\nBayern Amtsgericht Nürnberg HRB 36716\nRegisterbekanntmachung nach dem Umwandlungsgesetz 27.12.2024 (Eintragungsdatum)\n\nWeinandNet UG (haftungsbeschränkt)\nGesellschaft mit beschränkter Haftung\nSchwabach\n\nDen Gläubigern der an der Verschmelzung beteiligten Rechtsträger ist, wenn sie binnen sechs Monaten nach dem Tag, an dem die Eintragung der Verschmelzung in das Register des Sitzes desjenigen Rechtsträgers, dessen Gläubiger sie sind, nach § 19 Abs. 3 UmwG als bekannt gemacht gilt, ihren Anspruch nach Grund und Höhe schriftlich anmelden, Sicherheit zu leisten, soweit sie nicht Befriedigung verlangen können. Dieses Recht steht den Gläubigern jedoch nur zu, wenn sie glaubhaft machen, dass durch die Verschmelzung die Erfüllung ihrer Forderung gefährdet wird."
    },
    {
      "date": "2024-12-28",
      "id": "97446",
      "original_text": "Registerbekanntmachung nach dem Umwandlungsgesetz\nBayern Amtsgericht München HRB 297743\nPL Becker Capital Holding GmbH – München",
      "type": "Registerbekanntmachung nach dem Umwandlungsgesetz",
      "state": "Bayern",
      "amtsgericht": "Amtsgericht München",
      "registernummer": "HRB 297743",
      "registerart": "HRB",
      "company_name": "PL Becker Capital Holding GmbH",
      "company_seat": "München",
      "details": "28.12.2024 (Bekanntmachungsdatum)\n\nBayern Amtsgericht München HRB 297743\nRegisterbekanntmachung nach dem Umwandlungsgesetz 27.12.2024 (Eintragungsdatum)\n\nPL Becker Capital Holding GmbH\nGesellschaft mit beschränkter Haftung\nMünchen\n\nDen Gläubigern der an der Verschmelzung beteiligten Rechtsträger ist, wenn sie binnen sechs Monaten nach dem Tag, an dem die Eintragung der Verschmelzung in das Register des Sitzes desjenigen Rechtsträgers, dessen Gläubiger sie sind, nach § 19 Abs. 3 UmwG als bekannt gemacht gilt, ihren Anspruch nach Grund und Höhe schriftlich anmelden, Sicherheit zu leisten, soweit sie nicht Befriedigung verlangen können. Dieses Recht steht den Gläubigern jedoch nur zu, wenn sie glaubhaft machen, dass durch die Verschmelzung die Erfüllung ihrer Forderung gefährdet wird."
    },
    {
      "date": "2024-12-28",
      "id": "97447",
      "original_text": "Registerbekanntmachung nach dem Umwandlungsgesetz\nBayern Amtsgericht Traunstein HRB 23609\nBiogena Stores Deutschland GmbH – Freilassing",
      "type": "Registerbekanntmachung nach dem Umwandlungsgesetz",
      "state": "Bayern",
      "amtsgericht": "Amtsgericht Traunstein",
      "registernummer": "HRB 23609",
      "registerart": "HRB",
      "company_name": "Biogena Stores Deutschland GmbH",
      "company_seat": "Freilassing",
      "details": "28.12.2024 (Bekanntmachungsdatum)\n\nBayern Amtsgericht Traunstein HRB 23609\nRegisterbekanntmachung nach dem Umwandlungsgesetz 27.12.2024 (Eintragungsdatum)\n\nBiogena Stores Deutschland GmbH\nGesellschaft mit beschränkter Haftung\nFreilassing\n\nDen Gläubigern der an der Verschmelzung beteiligten Rechtsträger ist, wenn sie binnen sechs Monaten nach dem Tag, an dem die Eintragung der Verschmelzung in das Register des Sitzes desjenigen Rechtsträgers, dessen Gläubiger sie sind, nach § 19 Abs. 3 UmwG als bekannt gemacht gilt, ihren Anspruch nach Grund und Höhe schriftlich anmelden, Sicherheit zu leisten, soweit sie nicht Befriedigung verlangen können. Dieses Recht steht den Gläubigern jedoch nur zu, wenn sie glaubhaft machen, dass durch die Verschmelzung die Erfüllung ihrer Forderung gefährdet wird."
    },
    {
      "date": "2024-12-28",
      "id": "97448",
      "original_text": "Registerbekanntmachung nach dem Umwandlungsgesetz\nBayern Amtsgericht Ansbach HRB 8602\nLZWUG Immobilien GmbH – Weißenburg i. Bay.",
      "type": "Registerbekanntmachung nach dem Umwandlungsgesetz",
      "state": "Bayern",
      "amtsgericht": "Amtsgericht Ansbach",
      "registernummer": "HRB 8602",
      "registerart": "HRB",
      "company_name": "LZWUG Immobilien GmbH",
      "company_seat": "Weißenburg i. Bay.",
      "details": "28.12.2024 (Bekanntmachungsdatum)\n\nBayern Amtsgericht Ansbach HRB 8602\nRegisterbekanntmachung nach dem Umwandlungsgesetz 27.12.2024 (Eintragungsdatum)\n\nLZWUG Immobilien GmbH\nGesellschaft mit beschränkter Haftung\nWeißenburg i. Bay.\n\nDen Gläubigern des formwechselnden Rechtsträgers ist, wenn sie binnen sechs Monaten nach dem Tag, an dem die Eintragung des Formwechsels nach § 201 UmwG als bekannt gemacht gilt, ihren Anspruch nach Grund und Höhe schriftlich anmelden, Sicherheit zu leisten, soweit sie nicht Befriedigung verlangen können. Dieses Recht steht den Gläubigern jedoch nur zu, wenn sie glaubhaft machen, dass durch den Formwechsel die Erfüllung ihrer Forderung gefährdet wird."
    },
    {
      "date": "2024-12-28",
      "id": "97449",
      "original_text": "Registerbekanntmachung nach dem Umwandlungsgesetz\nBayern Amtsgericht Nürnberg HRB 33461\nTT1 Datacenter UG (haftungsbeschränkt) – Nürnberg",
      "type": "Registerbekanntmachung nach dem Umwandlungsgesetz",
      "state": "Bayern",
      "amtsgericht": "Amtsgericht Nürnberg",
      "registernummer": "HRB 33461",
      "registerart": "HRB",
      "company_name": "TT1 Datacenter UG (haftungsbeschränkt)",
      "company_seat": "Nürnberg",
      "details": "28.12.2024 (Bekanntmachungsdatum)\n\nBayern Amtsgericht Nürnberg HRB 33461\nRegisterbekanntmachung nach dem Umwandlungsgesetz 27.12.2024 (Eintragungsdatum)\n\nTT1 Datacenter UG (haftungsbeschränkt)\nGesellschaft mit beschränkter Haftung\nNürnberg\n\nDen Gläubigern der an der Verschmelzung beteiligten Rechtsträger ist, wenn sie binnen sechs Monaten nach dem Tag, an dem die Eintragung der Verschmelzung in das Register des Sitzes desjenigen Rechtsträgers, dessen Gläubiger sie sind, nach § 19 Abs. 3 UmwG als bekannt gemacht gilt, ihren Anspruch nach Grund und Höhe schriftlich anmelden, Sicherheit zu leisten, soweit sie nicht Befriedigung verlangen können. Dieses Recht steht den Gläubigern jedoch nur zu, wenn sie glaubhaft machen, dass durch die Verschmelzung die Erfüllung ihrer Forderung gefährdet wird."
    },
    {
      "date": "2024-12-28",
      "id": "97450",
      "original_text": "Einreichung neuer Dokumente\nBayern Amtsgericht München HRB 217778\nScalable Capital GmbH – München",
      "type": "Einreichung neuer Dokumente",
      "state": "Bayern",
      "amtsgericht": "Amtsgericht München",
      "registernummer": "HRB 217778",
      "registerart": "HRB",
      "company_name": "Scalable Capital GmbH",
      "company_seat": "München",
      "details": "28.12.2024 (Bekanntmachungsdatum)\n\nBayern Amtsgericht München HRB 217778\nEinreichung neuer Dokumente\n\nScalable Capital GmbH\nGesellschaft mit beschränkter Haftung\nMünchen\n\nDem Amtsgericht München -Registergericht- ist eine Liste der Mitglieder des Aufsichtsrats eingereicht worden, § 52 Abs. 3 S. 2 GmbHG."
    }
  ]
}