{
  "date": "2024-12-16",
  "date_of_scrape": "2024-12-17T04:07:47.269Z",
  "tool_version": "0.2.0",
  "number_of_announcements": 127,
  "announcements": [
    {
      "date": "2024-12-16",
      "id": "96476",
      "original_text": "Registerbekanntmachung nach dem Umwandlungsgesetz\nBaden-Württemberg Amtsgericht Stuttgart HRB 796591\nBerger Group GmbH – Korntal-Münchingen",
      "type": "Registerbekanntmachung nach dem Umwandlungsgesetz",
      "state": "Baden-Württemberg",
      "amtsgericht": "Amtsgericht Stuttgart",
      "registernummer": "HRB 796591",
      "registerart": "HRB",
      "company_name": "Berger Group GmbH",
      "company_seat": "Korntal-Münchingen",
      "details": "16.12.2024 (Bekanntmachungsdatum)\n\nBaden-Württemberg Amtsgericht Stuttgart HRB 796591\nRegisterbekanntmachung nach dem Umwandlungsgesetz 16.12.2024 (Eintragungsdatum)\n\nBerger Group GmbH\nGesellschaft mit beschränkter Haftung\nKorntal-Münchingen\n\nAls nicht eingetragen wird bekanntgemacht:\nDen Gläubigern der an der Ausgliederung beteiligten Rechtsträger ist, wenn sie binnen sechs Monaten nach dem Tag, an dem die Eintragung der Ausgliederung in das Register des Sitzes desjenigen Rechtsträgers, dessen Gläubiger sie sind, nach § 19 Abs. 3 UmwG als bekanntgemacht gilt, ihren Anspruch nach Grund und Höhe schriftlich anmelden, Sicherheit zu leisten, soweit sie nicht Befriedigung verlangen können. Dieses Recht steht den Gläubigern jedoch nur zu, wenn sie glaubhaft machen, dass durch die Ausgliederung die Erfüllung ihrer Forderung gefährdet wird."
    },
    {
      "date": "2024-12-16",
      "id": "96477",
      "original_text": "Löschungsankündigung\nBerlin Amtsgericht Berlin (Charlottenburg) HRB 157540\nI.M.A. 53 Dienstleistungen UG (haftungsbeschränkt) – Berlin",
      "type": "Löschungsankündigung",
      "state": "Berlin",
      "amtsgericht": "Amtsgericht Berlin (Charlottenburg)",
      "registernummer": "HRB 157540",
      "registerart": "HRB",
      "company_name": "I.M.A. 53 Dienstleistungen UG (haftungsbeschränkt)",
      "company_seat": "Berlin",
      "details": "16.12.2024 (Bekanntmachungsdatum)\n\nBerlin Amtsgericht Berlin (Charlottenburg) HRB 157540\nLöschungsankündigung\n\nI.M.A. 53 Dienstleistungen UG (haftungsbeschränkt)\nGesellschaft mit beschränkter Haftung\nBerlin\n\nBei der nachstehenden Gesellschaft wird das Amtslöschungsverfahren gemäß § 394 FamFG eingeleitet. Widerspruchsfrist 6 Wochen"
    },
    {
      "date": "2024-12-16",
      "id": "96478",
      "original_text": "Einreichung neuer Dokumente\nBaden-Württemberg Amtsgericht Freiburg HRB 728625\nJobRad Holding SE – Freiburg im Breisgau",
      "type": "Einreichung neuer Dokumente",
      "state": "Baden-Württemberg",
      "amtsgericht": "Amtsgericht Freiburg",
      "registernummer": "HRB 728625",
      "registerart": "HRB",
      "company_name": "JobRad Holding SE",
      "company_seat": "Freiburg im Breisgau",
      "details": "16.12.2024 (Bekanntmachungsdatum)\n\nBaden-Württemberg Amtsgericht Freiburg HRB 728625\nEinreichung neuer Dokumente\n\nJobRad Holding SE\nEuropäische Aktiengesellschaft (SE)\nFreiburg im Breisgau\n\nDie Gesellschaft hat am 12.12.2024 die Liste über die Zusammensetzung des Aufsichtsrats zum Handelsregister eingereicht."
    },
    {
      "date": "2024-12-16",
      "id": "96479",
      "original_text": "Registerbekanntmachung nach dem Umwandlungsgesetz\nBerlin Amtsgericht Berlin (Charlottenburg) HRB 96876\nIcon Impact GmbH – Berlin",
      "type": "Registerbekanntmachung nach dem Umwandlungsgesetz",
      "state": "Berlin",
      "amtsgericht": "Amtsgericht Berlin (Charlottenburg)",
      "registernummer": "HRB 96876",
      "registerart": "HRB",
      "company_name": "Icon Impact GmbH",
      "company_seat": "Berlin",
      "details": "16.12.2024 (Bekanntmachungsdatum)\n\nBerlin Amtsgericht Berlin (Charlottenburg) HRB 96876\nRegisterbekanntmachung nach dem Umwandlungsgesetz 13.12.2024 (Eintragungsdatum)\n\nIcon Impact GmbH\nGesellschaft mit beschränkter Haftung\nBerlin\n\nZu Eintragungsnummer 9 vom 13.12.2024 wird als nicht eingetragen veröffentlicht:\n\nDen Gläubigern der an der Verschmelzung beteiligten Rechtsträger ist, wenn sie binnen sechs Monaten nach dem Tag, an dem die Eintragung der Verschmelzung in das Register des Sitzes desjenigen Rechtsträgers, dessen Gläubiger sie sind, als bekannt gemacht gilt, ihren Anspruch nach Grund und Höhe schriftlich anmelden, Sicherheit zu leisten, soweit sie nicht Befriedigung verlangen können. Dieses Recht steht den Gläubigern jedoch nur zu, wenn sie glaubhaft machen, dass durch die Verschmelzung die Erfüllung ihrer Forderung gefährdet wird. Das Recht, Sicherheitsleistung zu verlangen, steht Gläubigern nicht zu, die im Falle der Insolvenz ein Recht auf vorzugsweise Befriedigung aus einer Deckungsmasse haben, die nach gesetzlicher Vorschrift zu ihrem Schutz errichtet und staatlich überwacht ist."
    },
    {
      "date": "2024-12-16",
      "id": "96480",
      "original_text": "Registerbekanntmachung nach dem Umwandlungsgesetz\nBerlin Amtsgericht Berlin (Charlottenburg) HRB 110836\nicon incar GmbH – Berlin",
      "type": "Registerbekanntmachung nach dem Umwandlungsgesetz",
      "state": "Berlin",
      "amtsgericht": "Amtsgericht Berlin (Charlottenburg)",
      "registernummer": "HRB 110836",
      "registerart": "HRB",
      "company_name": "icon incar GmbH",
      "company_seat": "Berlin",
      "details": "16.12.2024 (Bekanntmachungsdatum)\n\nBerlin Amtsgericht Berlin (Charlottenburg) HRB 110836\nRegisterbekanntmachung nach dem Umwandlungsgesetz 13.12.2024 (Eintragungsdatum)\n\nicon incar GmbH\nGesellschaft mit beschränkter Haftung\nBerlin\n\nZu Eintragungsnummer 10 vom 13.12.2024 wird als nicht eingetragen veröffentlicht:\n\nDen Gläubigern der an der Verschmelzung beteiligten Rechtsträger ist, wenn sie binnen sechs Monaten nach dem Tag, an dem die Eintragung der Verschmelzung in das Register des Sitzes desjenigen Rechtsträgers, dessen Gläubiger sie sind, als bekannt gemacht gilt, ihren Anspruch nach Grund und Höhe schriftlich anmelden, Sicherheit zu leisten, soweit sie nicht Befriedigung verlangen können. Dieses Recht steht den Gläubigern jedoch nur zu, wenn sie glaubhaft machen, dass durch die Verschmelzung die Erfüllung ihrer Forderung gefährdet wird. Das Recht, Sicherheitsleistung zu verlangen, steht Gläubigern nicht zu, die im Falle der Insolvenz ein Recht auf vorzugsweise Befriedigung aus einer Deckungsmasse haben, die nach gesetzlicher Vorschrift zu ihrem Schutz errichtet und staatlich überwacht ist."
    },
    {
      "date": "2024-12-16",
      "id": "96481",
      "original_text": "Registerbekanntmachung nach dem Umwandlungsgesetz\nBrandenburg Amtsgericht Cottbus HRB 16798\nPROPELL GmbH – Cottbus",
      "type": "Registerbekanntmachung nach dem Umwandlungsgesetz",
      "state": "Brandenburg",
      "amtsgericht": "Amtsgericht Cottbus",
      "registernummer": "HRB 16798",
      "registerart": "HRB",
      "company_name": "PROPELL GmbH",
      "company_seat": "Cottbus",
      "details": "16.12.2024 (Bekanntmachungsdatum)\n\nBrandenburg Amtsgericht Cottbus HRB 16798\nRegisterbekanntmachung nach dem Umwandlungsgesetz 13.12.2024 (Eintragungsdatum)\n\nPROPELL GmbH\nGesellschaft mit beschränkter Haftung\nCottbus\n\nDen Gläubigern der an der Verschmelzung beteiligten Rechtsträger ist, wenn sie binnen sechs Monaten nach dem Tag, an dem die Eintragung der Verschmelzung in das Register des Sitzes desjenigen Rechtsträgers, dessen Gläubiger sie sind, als bekannt gemacht gilt, ihren Anspruch nach Grund und Höhe schriftlich anmelden, Sicherheit zu leisten, soweit sie nicht Befriedigung verlangen können. Dieses Recht steht den Gläubigern jedoch nur zu, wenn sie glaubhaft machen, dass durch die Verschmelzung die Erfüllung ihrer Forderung gefährdet wird."
    },
    {
      "date": "2024-12-16",
      "id": "96482",
      "original_text": "Sonstige Registerbekanntmachung\nMecklenburg-Vorpommern Amtsgericht Rostock HRB 6384\nNOREX NORIKA Exportgesellschaft mbH – Groß Lüsewitz",
      "type": "Sonstige Registerbekanntmachung",
      "state": "Mecklenburg-Vorpommern",
      "amtsgericht": "Amtsgericht Rostock",
      "registernummer": "HRB 6384",
      "registerart": "HRB",
      "company_name": "NOREX NORIKA Exportgesellschaft mbH",
      "company_seat": "Groß Lüsewitz",
      "details": "16.12.2024 (Bekanntmachungsdatum)\n\nMecklenburg-Vorpommern Amtsgericht Rostock HRB 6384\nSonstige Registerbekanntmachung\n\nNOREX  NORIKA Exportgesellschaft mbH\nGesellschaft mit beschränkter Haftung\nGroß Lüsewitz\n\nEine Liste der Mitglieder des Aufsichtsrats ist zum Handelsregister eingereicht worden."
    },
    {
      "date": "2024-12-16",
      "id": "96483",
      "original_text": "Registerbekanntmachung nach dem Umwandlungsgesetz\nBerlin Amtsgericht Berlin (Charlottenburg) HRB 245468\nFT Beteiligung GmbH – Berlin",
      "type": "Registerbekanntmachung nach dem Umwandlungsgesetz",
      "state": "Berlin",
      "amtsgericht": "Amtsgericht Berlin (Charlottenburg)",
      "registernummer": "HRB 245468",
      "registerart": "HRB",
      "company_name": "FT Beteiligung GmbH",
      "company_seat": "Berlin",
      "details": "16.12.2024 (Bekanntmachungsdatum)\n\nBerlin Amtsgericht Berlin (Charlottenburg) HRB 245468\nRegisterbekanntmachung nach dem Umwandlungsgesetz 13.12.2024 (Eintragungsdatum)\n\nFT Beteiligung GmbH\nGesellschaft mit beschränkter Haftung\nBerlin\n\nZu Eintragungsnummer 4 vom 13.12.2024 wird als nicht eingetragen veröffentlicht: Den Gläubigern der an der Verschmelzung beteiligten Rechtsträger ist, wenn sie binnen sechs Monaten nach dem Tag, an dem die Eintragung der Verschmelzung in das Register des Sitzes desjenigen Rechtsträgers, dessen Gläubiger sie sind, als bekannt gemacht gilt, ihren Anspruch nach Grund und Höhe schriftlich anmelden, Sicherheit zu leisten, soweit sie nicht Befriedigung verlangen können. Dieses Recht steht den Gläubigern jedoch nur zu, wenn sie glaubhaft machen, dass durch die Verschmelzung die Erfüllung ihrer Forderung gefährdet wird. Das Recht, Sicherheitsleistung zu verlangen, steht Gläubigern nicht zu, die im Falle der Insolvenz ein Recht auf vorzugsweise Befriedigung aus einer Deckungsmasse haben, die nach gesetzlicher Vorschrift zu ihrem Schutz errichtet und staatlich überwacht ist."
    },
    {
      "date": "2024-12-16",
      "id": "96484",
      "original_text": "Registerbekanntmachung nach dem Umwandlungsgesetz\nBerlin Amtsgericht Berlin (Charlottenburg) HRB 165177\nELEXXUS Beratung und Beteiligung UG (haftungsbeschränkt) – Berlin",
      "type": "Registerbekanntmachung nach dem Umwandlungsgesetz",
      "state": "Berlin",
      "amtsgericht": "Amtsgericht Berlin (Charlottenburg)",
      "registernummer": "HRB 165177",
      "registerart": "HRB",
      "company_name": "ELEXXUS Beratung und Beteiligung UG (haftungsbeschränkt)",
      "company_seat": "Berlin",
      "details": "16.12.2024 (Bekanntmachungsdatum)\n\nBerlin Amtsgericht Berlin (Charlottenburg) HRB 165177\nRegisterbekanntmachung nach dem Umwandlungsgesetz 13.12.2024 (Eintragungsdatum)\n\nELEXXUS Beratung und Beteiligung UG (haftungsbeschränkt)\nGesellschaft mit beschränkter Haftung\nBerlin\n\nZu Eintragungsnummer 2 vom 13.12.2024 wird als nicht eingetragen veröffentlicht: Den Gläubigern der an der Verschmelzung beteiligten Rechtsträger ist, wenn sie binnen sechs Monaten nach dem Tag, an dem die Eintragung der Verschmelzung in das Register des Sitzes desjenigen Rechtsträgers, dessen Gläubiger sie sind, als bekannt gemacht gilt, ihren Anspruch nach Grund und Höhe schriftlich anmelden, Sicherheit zu leisten, soweit sie nicht Befriedigung verlangen können. Dieses Recht steht den Gläubigern jedoch nur zu, wenn sie glaubhaft machen, dass durch die Verschmelzung die Erfüllung ihrer Forderung gefährdet wird. Das Recht, Sicherheitsleistung zu verlangen, steht Gläubigern nicht zu, die im Falle der Insolvenz ein Recht auf vorzugsweise Befriedigung aus einer Deckungsmasse haben, die nach gesetzlicher Vorschrift zu ihrem Schutz errichtet und staatlich überwacht ist."
    },
    {
      "date": "2024-12-16",
      "id": "96485",
      "original_text": "Einreichung neuer Dokumente\nSachsen-Anhalt Amtsgericht Stendal HRB 35225\nSLE - Tourismus und Freizeit GmbH – Lutherstadt Eisleben",
      "type": "Einreichung neuer Dokumente",
      "state": "Sachsen-Anhalt",
      "amtsgericht": "Amtsgericht Stendal",
      "registernummer": "HRB 35225",
      "registerart": "HRB",
      "company_name": "SLE - Tourismus und Freizeit GmbH",
      "company_seat": "Lutherstadt Eisleben",
      "details": "16.12.2024 (Bekanntmachungsdatum)\n\nSachsen-Anhalt Amtsgericht Stendal HRB 35225\nEinreichung neuer Dokumente 16.12.2024 (Eintragungsdatum)\n\nSLE - Tourismus und Freizeit GmbH\nGesellschaft mit beschränkter Haftung\nLutherstadt Eisleben\n\nEine Liste der Mitglieder des Aufsichtsrates wurde zum Handelsregister eingereicht."
    },
    {
      "date": "2024-12-16",
      "id": "96486",
      "original_text": "Registerbekanntmachung nach dem Umwandlungsgesetz\nBaden-Württemberg Amtsgericht Stuttgart HRB 733231\nTectum-X GmbH – Filderstadt",
      "type": "Registerbekanntmachung nach dem Umwandlungsgesetz",
      "state": "Baden-Württemberg",
      "amtsgericht": "Amtsgericht Stuttgart",
      "registernummer": "HRB 733231",
      "registerart": "HRB",
      "company_name": "Tectum-X GmbH",
      "company_seat": "Filderstadt",
      "details": "16.12.2024 (Bekanntmachungsdatum)\n\nBaden-Württemberg Amtsgericht Stuttgart HRB 733231\nRegisterbekanntmachung nach dem Umwandlungsgesetz 16.12.2024 (Eintragungsdatum)\n\nTectum-X GmbH\nGesellschaft mit beschränkter Haftung\nFilderstadt\n\nDen Gläubigern des an dem Formwechsel beteiligten Rechtsträgers ist, wenn sie binnen sechs Monaten nach dem Tag, an dem die Eintragung des Formwechsels in das Register des Sitzes desjenigen Rechtsträgers, dessen Gläubiger sie sind, nach § 19 Abs. 3 UmwG als bekanntgemacht gilt, ihren Anspruch nach Grund und Höhe schriftlich anmelden, Sicherheit zu leisten, soweit sie nicht Befriedigung verlangen können. Dieses Recht steht den Gläubigern jedoch nur zu, wenn sie glaubhaft machen, dass durch den Formwechsel die Erfüllung ihrer Forderung gefährdet wird."
    },
    {
      "date": "2024-12-16",
      "id": "96487",
      "original_text": "Sonstige Registerbekanntmachung\nSachsen-Anhalt Amtsgericht Stendal HRB 5045\nBäder und Freizeit GmbH – Lutherstadt Wittenberg",
      "type": "Sonstige Registerbekanntmachung",
      "state": "Sachsen-Anhalt",
      "amtsgericht": "Amtsgericht Stendal",
      "registernummer": "HRB 5045",
      "registerart": "HRB",
      "company_name": "Bäder und Freizeit GmbH",
      "company_seat": "Lutherstadt Wittenberg",
      "details": "16.12.2024 (Bekanntmachungsdatum)\n\nSachsen-Anhalt Amtsgericht Stendal HRB 5045\nSonstige Registerbekanntmachung\n\nBäder und Freizeit GmbH\nGesellschaft mit beschränkter Haftung\nLutherstadt Wittenberg\n\nEine Liste der Mitglieder des Aufsichtsrates wurde zum Handelsregister eingereicht."
    },
    {
      "date": "2024-12-16",
      "id": "96488",
      "original_text": "Registerbekanntmachung nach dem Umwandlungsgesetz\nSchleswig-Holstein Amtsgericht Kiel HRB 1739 RD\nMS \"NORTHERN VITALITY\" Schiffahrtsgesellschaft mbH – Rendsburg",
      "type": "Registerbekanntmachung nach dem Umwandlungsgesetz",
      "state": "Schleswig-Holstein",
      "amtsgericht": "Amtsgericht Kiel",
      "registernummer": "HRB 1739 RD",
      "registerart": "HRB",
      "company_name": "MS \"NORTHERN VITALITY\" Schiffahrtsgesellschaft mbH",
      "company_seat": "Rendsburg",
      "details": "16.12.2024 (Bekanntmachungsdatum)\n\nSchleswig-Holstein Amtsgericht Kiel HRB 1739 RD\nRegisterbekanntmachung nach dem Umwandlungsgesetz 13.12.2024 (Eintragungsdatum)\n\nMS \"NORTHERN VITALITY\" Schiffahrtsgesellschaft mbH\nGesellschaft mit beschränkter Haftung\nRendsburg\n\nZu Eintragungsnummer 13 vom 13.12.2024 wird als nicht eingetragen veröffentlicht: Den Gläubigern der an der Verschmelzung beteiligten Rechtsträger ist, wenn sie binnen sechs Monaten nach dem Tag, an dem die Eintragung der Verschmelzung in das Register des Sitzes desjenigen Rechtsträgers, dessen Gläubiger sie sind, nach § 19 Abs. 3 UmwG bekannt gemacht worden ist, ihren Anspruch nach Grund und Höhe schriftlich anmelden, Sicherheit zu leisten, soweit sie nicht Befriedigung verlangen können. Dieses Recht steht den Gläubigern jedoch nur zu, wenn sie glaubhaft machen, dass durch die Verschmelzung die Erfüllung ihrer Forderung gefährdet wird."
    },
    {
      "date": "2024-12-16",
      "id": "96489",
      "original_text": "Einreichung neuer Dokumente\nSachsen-Anhalt Amtsgericht Stendal HRB 202315\nKurbetriebsgesellschaft Naumburg/Bad Kösen mit beschränkter Haftung – Naumburg (Saale)",
      "type": "Einreichung neuer Dokumente",
      "state": "Sachsen-Anhalt",
      "amtsgericht": "Amtsgericht Stendal",
      "registernummer": "HRB 202315",
      "registerart": "HRB",
      "company_name": "Kurbetriebsgesellschaft Naumburg/Bad Kösen mit beschränkter Haftung",
      "company_seat": "Naumburg (Saale)",
      "details": "16.12.2024 (Bekanntmachungsdatum)\n\nSachsen-Anhalt Amtsgericht Stendal HRB 202315\nEinreichung neuer Dokumente\n\nKurbetriebsgesellschaft Naumburg/Bad Kösen mit beschränkter Haftung\nGesellschaft mit beschränkter Haftung\nNaumburg (Saale)\n\nEine Liste der Mitglieder des Aufsichtsrates wurde zum Handelsregister eingereicht."
    },
    {
      "date": "2024-12-16",
      "id": "96490",
      "original_text": "Einreichung neuer Dokumente\nBerlin Amtsgericht Berlin (Charlottenburg) HRB 33600\nDB Services GmbH – Berlin",
      "type": "Einreichung neuer Dokumente",
      "state": "Berlin",
      "amtsgericht": "Amtsgericht Berlin (Charlottenburg)",
      "registernummer": "HRB 33600",
      "registerart": "HRB",
      "company_name": "DB Services GmbH",
      "company_seat": "Berlin",
      "details": "16.12.2024 (Bekanntmachungsdatum)\n\nBerlin Amtsgericht Berlin (Charlottenburg) HRB 33600\nEinreichung neuer Dokumente\n\nDB Services GmbH\nGesellschaft mit beschränkter Haftung\nBerlin\n\nAls nicht eingetragen wird veröffentlicht: Es wurde eine neue Liste der Aufsichtsratsmitglieder eingereicht (§52 GmbHG)."
    },
    {
      "date": "2024-12-16",
      "id": "96491",
      "original_text": "Sonstige Registerbekanntmachung\nHamburg Amtsgericht Hamburg HRB 127106\nENERPARC Solar Invest 255 TU 3 GmbH – Hamburg",
      "type": "Sonstige Registerbekanntmachung",
      "state": "Hamburg",
      "amtsgericht": "Amtsgericht Hamburg",
      "registernummer": "HRB 127106",
      "registerart": "HRB",
      "company_name": "ENERPARC Solar Invest 255 TU 3 GmbH",
      "company_seat": "Hamburg",
      "details": "16.12.2024 (Bekanntmachungsdatum)\n\nHamburg Amtsgericht Hamburg HRB 127106\nSonstige Registerbekanntmachung 16.12.2024 (Eintragungsdatum)\n\nENERPARC Solar Invest 255 TU 3 GmbH\nGesellschaft mit beschränkter Haftung\nHamburg\n\nAls nicht eingetragen wird bekannt gemacht:  Den Gläubigern der Gesellschaft, deren Forderungen begründet worden sind, bevor die Eintragung der Vertragsbeendigung in das Handelsregister nach § 10 HGB als bekannt gemacht gilt, ist vom anderen Vertragsteil Sicherheit zu leisten, wenn sie sich binnen 6 Monaten nach Bekanntmachung der Eintragung zu diesem Zweck bei ihm melden."
    },
    {
      "date": "2024-12-16",
      "id": "96492",
      "original_text": "Registerbekanntmachung nach dem Umwandlungsgesetz\nHamburg Amtsgericht Hamburg HRB 90396\nBiesterfeld AG – Hamburg",
      "type": "Registerbekanntmachung nach dem Umwandlungsgesetz",
      "state": "Hamburg",
      "amtsgericht": "Amtsgericht Hamburg",
      "registernummer": "HRB 90396",
      "registerart": "HRB",
      "company_name": "Biesterfeld AG",
      "company_seat": "Hamburg",
      "details": "16.12.2024 (Bekanntmachungsdatum)\n\nHamburg Amtsgericht Hamburg HRB 90396\nRegisterbekanntmachung nach dem Umwandlungsgesetz 16.12.2024 (Eintragungsdatum)\n\nBiesterfeld AG\nAktiengesellschaft\nHamburg\n\nAls nicht eingetragen wird bekannt gemacht:\nDen Gläubigern der an dem Formwechsel beteiligten Gesellschaft ist, wenn sie binnen sechs Monaten nach dem Tag, an dem die Eintragung des Formwechsels in das Register des Sitzes desjenigen Rechtsträgers, dessen Gläubiger sie sind, nach § 201 UmwG als bekannt gemacht gilt, ihren Anspruch nach Grund und Höhe schriftlich anmelden, Sicherheit zu leisten, soweit sie nicht Befriedigung verlangen können. Dieses Recht steht den Gläubigern jedoch nur zu, wenn sie glaubhaft machen, dass durch den Formwechsel die Erfüllung ihrer Forderung gefährdet wird."
    },
    {
      "date": "2024-12-16",
      "id": "96493",
      "original_text": "Sonstige Registerbekanntmachung\nBerlin Amtsgericht Berlin (Charlottenburg) HRB 81544\nBPG Berliner Personaldienstleistungsgesellschaft mbH – Berlin",
      "type": "Sonstige Registerbekanntmachung",
      "state": "Berlin",
      "amtsgericht": "Amtsgericht Berlin (Charlottenburg)",
      "registernummer": "HRB 81544",
      "registerart": "HRB",
      "company_name": "BPG Berliner Personaldienstleistungsgesellschaft mbH",
      "company_seat": "Berlin",
      "details": "16.12.2024 (Bekanntmachungsdatum)\n\nBerlin Amtsgericht Berlin (Charlottenburg) HRB 81544\nSonstige Registerbekanntmachung\n\nBPG Berliner Personaldienstleistungsgesellschaft mbH\nGesellschaft mit beschränkter Haftung\nBerlin\n\nAls nicht eingetragen wird veröffentlicht: Der andere Vertragsteil hat den Gläubigern dieses Rechtsträgers, deren Forderungen begründet worden sind, bevor die Eintragung der Beendigung dieses Vertrages in das Handelsregister nach § 10 des Handelsgesetzbuches als bekannt gemacht gilt, Sicherheit zu leisten, wenn sie sich binnen sechs Monaten nach der Bekanntmachung der Eintragung zu diesem Zweck bei ihm melden. Dieses Recht steht den Gläubigern nicht zu, die im Fall des Insolvenzverfahrens ein Recht auf vorzugsweise Befriedigung aus der Deckungsmasse haben, die nach gesetzlicher Vorschrift zu ihrem Schutz errichtet und staatlich überwacht ist."
    },
    {
      "date": "2024-12-16",
      "id": "96494",
      "original_text": "Löschungsankündigung\nBrandenburg Amtsgericht Potsdam HRB 38740\nAkilio SC UG (haftungsbeschränkt) – Werder (Havel)",
      "type": "Löschungsankündigung",
      "state": "Brandenburg",
      "amtsgericht": "Amtsgericht Potsdam",
      "registernummer": "HRB 38740",
      "registerart": "HRB",
      "company_name": "Akilio SC UG (haftungsbeschränkt)",
      "company_seat": "Werder (Havel)",
      "details": "16.12.2024 (Bekanntmachungsdatum)\n\nBrandenburg Amtsgericht Potsdam HRB 38740\nLöschungsankündigung\n\nAkilio SC UG (haftungsbeschränkt)\nGesellschaft mit beschränkter Haftung\nWerder (Havel)\n\nBei der nachstehenden Gesellschaft wird das Amtslöschungsverfahren gemäß § 394 FamFG eingeleitet. Widerspruchsfrist: 8 Wochen."
    },
    {
      "date": "2024-12-16",
      "id": "96495",
      "original_text": "Sonstige Registerbekanntmachung\nHamburg Amtsgericht Hamburg HRB 128310\nENERPARC Solar Invest 255 TU 4 GmbH – Hamburg",
      "type": "Sonstige Registerbekanntmachung",
      "state": "Hamburg",
      "amtsgericht": "Amtsgericht Hamburg",
      "registernummer": "HRB 128310",
      "registerart": "HRB",
      "company_name": "ENERPARC Solar Invest 255 TU 4 GmbH",
      "company_seat": "Hamburg",
      "details": "16.12.2024 (Bekanntmachungsdatum)\n\nHamburg Amtsgericht Hamburg HRB 128310\nSonstige Registerbekanntmachung 16.12.2024 (Eintragungsdatum)\n\nENERPARC Solar Invest 255 TU 4 GmbH\nGesellschaft mit beschränkter Haftung\nHamburg\n\nAls nicht eingetragen wird bekannt gemacht:  Den Gläubigern der Gesellschaft, deren Forderungen begründet worden sind, bevor die Eintragung der Vertragsbeendigung in das Handelsregister nach § 10 HGB als bekannt gemacht gilt, ist vom anderen Vertragsteil Sicherheit zu leisten, wenn sie sich binnen 6 Monaten nach Bekanntmachung der Eintragung zu diesem Zweck bei ihm melden."
    },
    {
      "date": "2024-12-16",
      "id": "96496",
      "original_text": "Registerbekanntmachung nach dem Umwandlungsgesetz\nSachsen-Anhalt Amtsgericht Stendal HRB 115243\nEuropäisches Bildungswerk für Beruf und Gesellschaft gemeinnützige GmbH – Magdeburg",
      "type": "Registerbekanntmachung nach dem Umwandlungsgesetz",
      "state": "Sachsen-Anhalt",
      "amtsgericht": "Amtsgericht Stendal",
      "registernummer": "HRB 115243",
      "registerart": "HRB",
      "company_name": "Europäisches Bildungswerk für Beruf und Gesellschaft gemeinnützige GmbH",
      "company_seat": "Magdeburg",
      "details": "16.12.2024 (Bekanntmachungsdatum)\n\nSachsen-Anhalt Amtsgericht Stendal HRB 115243\nRegisterbekanntmachung nach dem Umwandlungsgesetz 16.12.2024 (Eintragungsdatum)\n\nEuropäisches Bildungswerk für Beruf und Gesellschaft gemeinnützige GmbH\nGesellschaft mit beschränkter Haftung\nMagdeburg\n\nDer Europäisches Bildungswerk für Beruf und Gesellschaft e.V. mit dem Sitz in Leipzig (Amtsgericht Leipzig VR 2622) ist auf Grund des Verschmelzungsvertrages vom 26.07.2024 und der Beschlüsse der Gesellschafter-  und  der Mitgliederversammlung vom selben Tag mit der Gesellschaft verschmolzen.Nicht eingetragen: Den Gläubigern der an der Verschmelzung beteiligten Rechtsträger ist, wenn sie binnen sechs Monaten nach dem Tag, an dem die Eintragung der Verschmelzung nach § 19 Abs. 3 UmwG als bekanntgemacht gilt, ihren Anspruch nach Grund und Höhe schriftlich anmelden, Sicherheit zu leisten, soweit sie nicht Befriedigung verlangen können. Dieses Recht steht ihnen jedoch nur zu, wenn sie glaubhaft machen, dass durch die Verschmelzung die Erfüllung ihrer Forderung gefährdet wird."
    },
    {
      "date": "2024-12-16",
      "id": "96497",
      "original_text": "Registerbekanntmachung nach dem Umwandlungsgesetz\nBaden-Württemberg Amtsgericht Stuttgart HRB 351776\nAtoria - the people software GmbH – Reutlingen",
      "type": "Registerbekanntmachung nach dem Umwandlungsgesetz",
      "state": "Baden-Württemberg",
      "amtsgericht": "Amtsgericht Stuttgart",
      "registernummer": "HRB 351776",
      "registerart": "HRB",
      "company_name": "Atoria - the people software GmbH",
      "company_seat": "Reutlingen",
      "details": "16.12.2024 (Bekanntmachungsdatum)\n\nBaden-Württemberg Amtsgericht Stuttgart HRB 351776\nRegisterbekanntmachung nach dem Umwandlungsgesetz 16.12.2024 (Eintragungsdatum)\n\nAtoria - the people software GmbH\nGesellschaft mit beschränkter Haftung\nReutlingen\n\nAls nicht eingetragen wird bekanntgemacht:\nDen Gläubigern der an der Verschmelzung beteiligten Rechtsträger ist, wenn sie binnen sechs Monaten nach dem Tag, an dem die Eintragung der Verschmelzung in das Register des Sitzes desjenigen Rechtsträgers, dessen Gläubiger sie sind, nach § 19 Abs. 3 UmwG als bekanntgemacht gilt, ihren Anspruch nach Grund und Höhe schriftlich anmelden, Sicherheit zu leisten, soweit sie nicht Befriedigung verlangen können. Dieses Recht steht den Gläubigern jedoch nur zu, wenn sie glaubhaft machen, dass durch die Verschmelzung die Erfüllung ihrer Forderung gefährdet wird."
    },
    {
      "date": "2024-12-16",
      "id": "96498",
      "original_text": "Registerbekanntmachung nach dem Umwandlungsgesetz\nHamburg Amtsgericht Hamburg HRB 65501\nColoplast GmbH – Hamburg",
      "type": "Registerbekanntmachung nach dem Umwandlungsgesetz",
      "state": "Hamburg",
      "amtsgericht": "Amtsgericht Hamburg",
      "registernummer": "HRB 65501",
      "registerart": "HRB",
      "company_name": "Coloplast GmbH",
      "company_seat": "Hamburg",
      "details": "16.12.2024 (Bekanntmachungsdatum)\n\nHamburg Amtsgericht Hamburg HRB 65501\nRegisterbekanntmachung nach dem Umwandlungsgesetz 16.12.2024 (Eintragungsdatum)\n\nColoplast GmbH\nGesellschaft mit beschränkter Haftung\nHamburg\n\nAls nicht eingetragen wird bekannt gemacht:\nDen Gläubigern der an der Verschmelzung beteiligten Gesellschaften ist, wenn sie binnen sechs Monaten nach dem Tag, an dem die Eintragung der Verschmelzung in das Register des Sitzes desjenigen Rechtsträgers, dessen Gläubiger sie sind, nach § 19 Absatz 3 UmwG als bekannt gemacht gilt, ihren Anspruch nach Grund und Höhe schriftlich anmelden, Sicherheit zu leisten, soweit sie nicht Befriedigung verlangen können. Dieses Recht steht den Gläubigern jedoch nur zu, wenn sie glaubhaft machen, dass durch die Verschmelzung die Erfüllung ihrer Forderung gefährdet wird."
    },
    {
      "date": "2024-12-16",
      "id": "96499",
      "original_text": "Sonstige Registerbekanntmachung\nHamburg Amtsgericht Hamburg HRB 130469\nENERPARC Solar Invest 255 TU 5 GmbH – Hamburg",
      "type": "Sonstige Registerbekanntmachung",
      "state": "Hamburg",
      "amtsgericht": "Amtsgericht Hamburg",
      "registernummer": "HRB 130469",
      "registerart": "HRB",
      "company_name": "ENERPARC Solar Invest 255 TU 5 GmbH",
      "company_seat": "Hamburg",
      "details": "16.12.2024 (Bekanntmachungsdatum)\n\nHamburg Amtsgericht Hamburg HRB 130469\nSonstige Registerbekanntmachung 16.12.2024 (Eintragungsdatum)\n\nENERPARC Solar Invest 255 TU 5 GmbH\nGesellschaft mit beschränkter Haftung\nHamburg\n\nAls nicht eingetragen wird bekannt gemacht:  Den Gläubigern der Gesellschaft, deren Forderungen begründet worden sind, bevor die Eintragung der Vertragsbeendigung in das Handelsregister nach § 10 HGB als bekannt gemacht gilt, ist vom anderen Vertragsteil Sicherheit zu leisten, wenn sie sich binnen 6 Monaten nach Bekanntmachung der Eintragung zu diesem Zweck bei ihm melden."
    },
    {
      "date": "2024-12-16",
      "id": "96500",
      "original_text": "Registerbekanntmachung nach dem Umwandlungsgesetz\nBerlin Amtsgericht Berlin (Charlottenburg) HRB 230254\nSunshine Smile Patient Care & Services GmbH – Berlin",
      "type": "Registerbekanntmachung nach dem Umwandlungsgesetz",
      "state": "Berlin",
      "amtsgericht": "Amtsgericht Berlin (Charlottenburg)",
      "registernummer": "HRB 230254",
      "registerart": "HRB",
      "company_name": "Sunshine Smile Patient Care & Services GmbH",
      "company_seat": "Berlin",
      "details": "16.12.2024 (Bekanntmachungsdatum)\n\nBerlin Amtsgericht Berlin (Charlottenburg) HRB 230254\nRegisterbekanntmachung nach dem Umwandlungsgesetz 09.12.2024 (Eintragungsdatum)\n\nSunshine Smile Patient Care & Services GmbH\nGesellschaft mit beschränkter Haftung\nBerlin\n\nZu Eintragungsnummer 6 vom 09.12.2024 wird als nicht eingetragen veröffentlicht: Den Gläubigern der an der Verschmelzung beteiligten Rechtsträger ist, wenn sie binnen sechs Monaten nach dem Tag, an dem die Eintragung der Verschmelzung in das Register des Sitzes desjenigen Rechtsträgers, dessen Gläubiger sie sind, als bekannt gemacht gilt, ihren Anspruch nach Grund und Höhe schriftlich anmelden, Sicherheit zu leisten, soweit sie nicht Befriedigung verlangen können. Dieses Recht steht den Gläubigern jedoch nur zu, wenn sie glaubhaft machen, dass durch die Verschmelzung die Erfüllung ihrer Forderung gefährdet wird. Das Recht, Sicherheitsleistung zu verlangen, steht Gläubigern nicht zu, die im Falle der Insolvenz ein Recht auf vorzugsweise Befriedigung aus einer Deckungsmasse haben, die nach gesetzlicher Vorschrift zu ihrem Schutz errichtet und staatlich überwacht ist."
    },
    {
      "date": "2024-12-16",
      "id": "96501",
      "original_text": "Registerbekanntmachung nach dem Umwandlungsgesetz\nBerlin Amtsgericht Berlin (Charlottenburg) HRB 191754\nSunshine Smile GmbH – Berlin",
      "type": "Registerbekanntmachung nach dem Umwandlungsgesetz",
      "state": "Berlin",
      "amtsgericht": "Amtsgericht Berlin (Charlottenburg)",
      "registernummer": "HRB 191754",
      "registerart": "HRB",
      "company_name": "Sunshine Smile GmbH",
      "company_seat": "Berlin",
      "details": "16.12.2024 (Bekanntmachungsdatum)\n\nBerlin Amtsgericht Berlin (Charlottenburg) HRB 191754\nRegisterbekanntmachung nach dem Umwandlungsgesetz 09.12.2024 (Eintragungsdatum)\n\nSunshine Smile GmbH\nGesellschaft mit beschränkter Haftung\nBerlin\n\nZu Eintragungsnummer 25 vom 09.12.2024 wird als nicht eingetragen veröffentlicht: Den Gläubigern der an der Verschmelzung beteiligten Rechtsträger ist, wenn sie binnen sechs Monaten nach dem Tag, an dem die Eintragung der Verschmelzung in das Register des Sitzes desjenigen Rechtsträgers, dessen Gläubiger sie sind, als bekannt gemacht gilt, ihren Anspruch nach Grund und Höhe schriftlich anmelden, Sicherheit zu leisten, soweit sie nicht Befriedigung verlangen können. Dieses Recht steht den Gläubigern jedoch nur zu, wenn sie glaubhaft machen, dass durch die Verschmelzung die Erfüllung ihrer Forderung gefährdet wird. Das Recht, Sicherheitsleistung zu verlangen, steht Gläubigern nicht zu, die im Falle der Insolvenz ein Recht auf vorzugsweise Befriedigung aus einer Deckungsmasse haben, die nach gesetzlicher Vorschrift zu ihrem Schutz errichtet und staatlich überwacht ist."
    },
    {
      "date": "2024-12-16",
      "id": "96502",
      "original_text": "Sonstige Registerbekanntmachung\nHamburg Amtsgericht Hamburg HRB 130473\nENERPARC Solar Invest 255 TU 6 GmbH – Hamburg",
      "type": "Sonstige Registerbekanntmachung",
      "state": "Hamburg",
      "amtsgericht": "Amtsgericht Hamburg",
      "registernummer": "HRB 130473",
      "registerart": "HRB",
      "company_name": "ENERPARC Solar Invest 255 TU 6 GmbH",
      "company_seat": "Hamburg",
      "details": "16.12.2024 (Bekanntmachungsdatum)\n\nHamburg Amtsgericht Hamburg HRB 130473\nSonstige Registerbekanntmachung 16.12.2024 (Eintragungsdatum)\n\nENERPARC Solar Invest 255 TU 6 GmbH\nGesellschaft mit beschränkter Haftung\nHamburg\n\nAls nicht eingetragen wird bekannt gemacht:  Den Gläubigern der Gesellschaft, deren Forderungen begründet worden sind, bevor die Eintragung der Vertragsbeendigung in das Handelsregister nach § 10 HGB als bekannt gemacht gilt, ist vom anderen Vertragsteil Sicherheit zu leisten, wenn sie sich binnen 6 Monaten nach Bekanntmachung der Eintragung zu diesem Zweck bei ihm melden."
    },
    {
      "date": "2024-12-16",
      "id": "96503",
      "original_text": "Sonstige Registerbekanntmachung\nHamburg Amtsgericht Hamburg HRB 130474\nENERPARC Solar Invest 255 TU 7 GmbH – Hamburg",
      "type": "Sonstige Registerbekanntmachung",
      "state": "Hamburg",
      "amtsgericht": "Amtsgericht Hamburg",
      "registernummer": "HRB 130474",
      "registerart": "HRB",
      "company_name": "ENERPARC Solar Invest 255 TU 7 GmbH",
      "company_seat": "Hamburg",
      "details": "16.12.2024 (Bekanntmachungsdatum)\n\nHamburg Amtsgericht Hamburg HRB 130474\nSonstige Registerbekanntmachung 16.12.2024 (Eintragungsdatum)\n\nENERPARC Solar Invest 255 TU 7 GmbH\nGesellschaft mit beschränkter Haftung\nHamburg\n\nAls nicht eingetragen wird bekannt gemacht:  Den Gläubigern der Gesellschaft, deren Forderungen begründet worden sind, bevor die Eintragung der Vertragsbeendigung in das Handelsregister nach § 10 HGB als bekannt gemacht gilt, ist vom anderen Vertragsteil Sicherheit zu leisten, wenn sie sich binnen 6 Monaten nach Bekanntmachung der Eintragung zu diesem Zweck bei ihm melden."
    },
    {
      "date": "2024-12-16",
      "id": "96504",
      "original_text": "Registerbekanntmachung nach dem Umwandlungsgesetz\nSchleswig-Holstein Amtsgericht Kiel HRB 21312\nHÖHRMANN Enterprises GmbH – Schacht-Audorf",
      "type": "Registerbekanntmachung nach dem Umwandlungsgesetz",
      "state": "Schleswig-Holstein",
      "amtsgericht": "Amtsgericht Kiel",
      "registernummer": "HRB 21312",
      "registerart": "HRB",
      "company_name": "HÖHRMANN Enterprises GmbH",
      "company_seat": "Schacht-Audorf",
      "details": "16.12.2024 (Bekanntmachungsdatum)\n\nSchleswig-Holstein Amtsgericht Kiel HRB 21312\nRegisterbekanntmachung nach dem Umwandlungsgesetz 13.12.2024 (Eintragungsdatum)\n\nHÖHRMANN Enterprises GmbH\nGesellschaft mit beschränkter Haftung\nSchacht-Audorf\n\nZu Eintragungsnummer 3 vom 13.12.2024 wird als nicht eingetragen veröffentlicht: Den Gläubigern der an der Verschmelzung beteiligten Rechtsträger ist, wenn sie binnen sechs Monaten nach dem Tag, an dem die Eintragung der Verschmelzung in das Register des Sitzes desjenigen Rechtsträgers, dessen Gläubiger sie sind, nach § 19 Abs. 3 UmwG bekannt gemacht worden ist, ihren Anspruch nach Grund und Höhe schriftlich anmelden, Sicherheit zu leisten, soweit sie nicht Befriedigung verlangen können. Dieses Recht steht den Gläubigern jedoch nur zu, wenn sie glaubhaft machen, dass durch die Verschmelzung die Erfüllung ihrer Forderung gefährdet wird."
    },
    {
      "date": "2024-12-16",
      "id": "96505",
      "original_text": "Registerbekanntmachung nach dem Umwandlungsgesetz\nBaden-Württemberg Amtsgericht Freiburg HRA 708897\nSven Behrend e.K. – Allensbach",
      "type": "Registerbekanntmachung nach dem Umwandlungsgesetz",
      "state": "Baden-Württemberg",
      "amtsgericht": "Amtsgericht Freiburg",
      "registernummer": "HRA 708897",
      "registerart": "HRA",
      "company_name": "Sven Behrend e.K.",
      "company_seat": "Allensbach",
      "details": "16.12.2024 (Bekanntmachungsdatum)\n\nBaden-Württemberg Amtsgericht Freiburg HRA 708897\nRegisterbekanntmachung nach dem Umwandlungsgesetz 16.12.2024 (Eintragungsdatum)\n\nSven Behrend e.K.\nEinzelkaufmann / Einzelkauffrau\nAllensbach\n\nDen Gläubigern der an der Verschmelzung beteiligten Rechtsträger ist, wenn sie binnen sechs Monaten nach dem Tag, an dem die Eintragung der Verschmelzung in das Register des Sitzes desjenigen Rechtsträgers, dessen Gläubiger sie sind, nach § 19 Abs. 3 UmwG als bekanntgemacht gilt, ihren Anspruch nach Grund und Höhe schriftlich anmelden, Sicherheit zu leisten, soweit sie nicht Befriedigung verlangen können. Dieses Recht steht den Gläubigern jedoch nur zu, wenn sie glaubhaft machen, dass durch die Verschmelzung die Erfüllung ihrer Forderung gefährdet wird."
    },
    {
      "date": "2024-12-16",
      "id": "96506",
      "original_text": "Registerbekanntmachung nach dem Umwandlungsgesetz\nBaden-Württemberg Amtsgericht Freiburg HRB 707304\nBFB Verwaltung und Beratung GmbH – Allensbach",
      "type": "Registerbekanntmachung nach dem Umwandlungsgesetz",
      "state": "Baden-Württemberg",
      "amtsgericht": "Amtsgericht Freiburg",
      "registernummer": "HRB 707304",
      "registerart": "HRB",
      "company_name": "BFB Verwaltung und Beratung GmbH",
      "company_seat": "Allensbach",
      "details": "16.12.2024 (Bekanntmachungsdatum)\n\nBaden-Württemberg Amtsgericht Freiburg HRB 707304\nRegisterbekanntmachung nach dem Umwandlungsgesetz 16.12.2024 (Eintragungsdatum)\n\nBFB Verwaltung und Beratung GmbH\nGesellschaft mit beschränkter Haftung\nAllensbach\n\nDen Gläubigern der an der Verschmelzung beteiligten Rechtsträger ist, wenn sie binnen sechs Monaten nach dem Tag, an dem die Eintragung der Verschmelzung in das Register des Sitzes desjenigen Rechtsträgers, dessen Gläubiger sie sind, nach § 19 Abs. 3 UmwG als bekanntgemacht gilt, ihren Anspruch nach Grund und Höhe schriftlich anmelden, Sicherheit zu leisten, soweit sie nicht Befriedigung verlangen können. Dieses Recht steht den Gläubigern jedoch nur zu, wenn sie glaubhaft machen, dass durch die Verschmelzung die Erfüllung ihrer Forderung gefährdet wird."
    },
    {
      "date": "2024-12-16",
      "id": "96507",
      "original_text": "Registerbekanntmachung nach dem Umwandlungsgesetz\nThüringen Amtsgericht Jena HRB 522562\nAndrzejak Holding GmbH – Erfurt",
      "type": "Registerbekanntmachung nach dem Umwandlungsgesetz",
      "state": "Thüringen",
      "amtsgericht": "Amtsgericht Jena",
      "registernummer": "HRB 522562",
      "registerart": "HRB",
      "company_name": "Andrzejak Holding GmbH",
      "company_seat": "Erfurt",
      "details": "16.12.2024 (Bekanntmachungsdatum)\n\nThüringen Amtsgericht Jena HRB 522562\nRegisterbekanntmachung nach dem Umwandlungsgesetz 16.12.2024 (Eintragungsdatum)\n\nAndrzejak Holding GmbH\nGesellschaft mit beschränkter Haftung\nErfurt\n\nNicht eingetragen: Den Gläubigern der an der Verschmelzung beteiligten Rechtsträger, ist wenn sie binnen sechs Monaten nach dem Tag, an dem die Eintragung der Verschmelzung in das Register des Sitzes desjenigen Rechtsträgers, dessen Gläubiger sie sind,  nach § 19 Abs. 3 UmwG als bekanntgemacht gilt, ihren Anspruch nach Grund und Höhe schriftlich anmelden, Sicherheit zu leisten, soweit sie nicht Befriedigung verlangen können. Dieses Recht steht ihnen jedoch nur zu, wenn sie glaubhaft machen, daß durch die Verschmelzung die Erfüllung ihrer Forderung gefährdet wird."
    },
    {
      "date": "2024-12-16",
      "id": "96508",
      "original_text": "Registerbekanntmachung nach dem Umwandlungsgesetz\nThüringen Amtsgericht Jena HRB 113649\nSP Veranstaltungs- und Handels GmbH – Erfurt",
      "type": "Registerbekanntmachung nach dem Umwandlungsgesetz",
      "state": "Thüringen",
      "amtsgericht": "Amtsgericht Jena",
      "registernummer": "HRB 113649",
      "registerart": "HRB",
      "company_name": "SP Veranstaltungs- und Handels GmbH",
      "company_seat": "Erfurt",
      "details": "16.12.2024 (Bekanntmachungsdatum)\n\nThüringen Amtsgericht Jena HRB 113649\nRegisterbekanntmachung nach dem Umwandlungsgesetz 16.12.2024 (Eintragungsdatum)\n\nSP Veranstaltungs- und Handels GmbH\nGesellschaft mit beschränkter Haftung\nErfurt\n\nNicht eingetragen: Den Gläubigern der an der Verschmelzung beteiligten Rechtsträger, ist wenn sie binnen sechs Monaten nach dem Tag, an dem die Eintragung der Verschmelzung in das Register des Sitzes desjenigen Rechtsträgers, dessen Gläubiger sie sind,  nach § 19 Abs. 3 UmwG als bekanntgemacht gilt, ihren Anspruch nach Grund und Höhe schriftlich anmelden, Sicherheit zu leisten, soweit sie nicht Befriedigung verlangen können. Dieses Recht steht ihnen jedoch nur zu, wenn sie glaubhaft machen, daß durch die Verschmelzung die Erfüllung ihrer Forderung gefährdet wird."
    },
    {
      "date": "2024-12-16",
      "id": "96509",
      "original_text": "Registerbekanntmachung nach dem Umwandlungsgesetz\nThüringen Amtsgericht Jena HRB 522562\nAndrzejak Holding GmbH – Erfurt",
      "type": "Registerbekanntmachung nach dem Umwandlungsgesetz",
      "state": "Thüringen",
      "amtsgericht": "Amtsgericht Jena",
      "registernummer": "HRB 522562",
      "registerart": "HRB",
      "company_name": "Andrzejak Holding GmbH",
      "company_seat": "Erfurt",
      "details": "16.12.2024 (Bekanntmachungsdatum)\n\nThüringen Amtsgericht Jena HRB 522562\nRegisterbekanntmachung nach dem Umwandlungsgesetz 16.12.2024 (Eintragungsdatum)\n\nAndrzejak Holding GmbH\nGesellschaft mit beschränkter Haftung\nErfurt\n\nNicht eingetragen: Den Gläubigern der an der Verschmelzung beteiligten Rechtsträger, ist wenn sie binnen sechs Monaten nach dem Tag, an dem die Eintragung der Verschmelzung in das Register des Sitzes desjenigen Rechtsträgers, dessen Gläubiger sie sind,  nach § 19 Abs. 3 UmwG als bekanntgemacht gilt, ihren Anspruch nach Grund und Höhe schriftlich anmelden, Sicherheit zu leisten, soweit sie nicht Befriedigung verlangen können. Dieses Recht steht ihnen jedoch nur zu, wenn sie glaubhaft machen, daß durch die Verschmelzung die Erfüllung ihrer Forderung gefährdet wird."
    },
    {
      "date": "2024-12-16",
      "id": "96510",
      "original_text": "Sonstige Registerbekanntmachung\nHamburg Amtsgericht Hamburg HRB 130491\nENERPARC Solar Invest 255 TU 8 GmbH – Hamburg",
      "type": "Sonstige Registerbekanntmachung",
      "state": "Hamburg",
      "amtsgericht": "Amtsgericht Hamburg",
      "registernummer": "HRB 130491",
      "registerart": "HRB",
      "company_name": "ENERPARC Solar Invest 255 TU 8 GmbH",
      "company_seat": "Hamburg",
      "details": "16.12.2024 (Bekanntmachungsdatum)\n\nHamburg Amtsgericht Hamburg HRB 130491\nSonstige Registerbekanntmachung 16.12.2024 (Eintragungsdatum)\n\nENERPARC Solar Invest 255 TU 8 GmbH\nGesellschaft mit beschränkter Haftung\nHamburg\n\nAls nicht eingetragen wird bekannt gemacht:  Den Gläubigern der Gesellschaft, deren Forderungen begründet worden sind, bevor die Eintragung der Vertragsbeendigung in das Handelsregister nach § 10 HGB als bekannt gemacht gilt, ist vom anderen Vertragsteil Sicherheit zu leisten, wenn sie sich binnen 6 Monaten nach Bekanntmachung der Eintragung zu diesem Zweck bei ihm melden."
    },
    {
      "date": "2024-12-16",
      "id": "96511",
      "original_text": "Sonstige Registerbekanntmachung\nHamburg Amtsgericht Hamburg HRB 130493\nENERPARC Solar Invest 255 TU 9 GmbH – Hamburg",
      "type": "Sonstige Registerbekanntmachung",
      "state": "Hamburg",
      "amtsgericht": "Amtsgericht Hamburg",
      "registernummer": "HRB 130493",
      "registerart": "HRB",
      "company_name": "ENERPARC Solar Invest 255 TU 9 GmbH",
      "company_seat": "Hamburg",
      "details": "16.12.2024 (Bekanntmachungsdatum)\n\nHamburg Amtsgericht Hamburg HRB 130493\nSonstige Registerbekanntmachung 16.12.2024 (Eintragungsdatum)\n\nENERPARC Solar Invest 255 TU 9 GmbH\nGesellschaft mit beschränkter Haftung\nHamburg\n\nAls nicht eingetragen wird bekannt gemacht:  Den Gläubigern der Gesellschaft, deren Forderungen begründet worden sind, bevor die Eintragung der Vertragsbeendigung in das Handelsregister nach § 10 HGB als bekannt gemacht gilt, ist vom anderen Vertragsteil Sicherheit zu leisten, wenn sie sich binnen 6 Monaten nach Bekanntmachung der Eintragung zu diesem Zweck bei ihm melden."
    },
    {
      "date": "2024-12-16",
      "id": "96512",
      "original_text": "Registerbekanntmachung nach dem Umwandlungsgesetz\nSachsen-Anhalt Amtsgericht Stendal HRA 8033\nalles gut - Cleaning & Service Dirk Novotny e. K. – Lutherstadt Wittenberg",
      "type": "Registerbekanntmachung nach dem Umwandlungsgesetz",
      "state": "Sachsen-Anhalt",
      "amtsgericht": "Amtsgericht Stendal",
      "registernummer": "HRA 8033",
      "registerart": "HRA",
      "company_name": "alles gut - Cleaning & Service Dirk Novotny e. K.",
      "company_seat": "Lutherstadt Wittenberg",
      "details": "16.12.2024 (Bekanntmachungsdatum)\n\nSachsen-Anhalt Amtsgericht Stendal HRA 8033\nRegisterbekanntmachung nach dem Umwandlungsgesetz 16.12.2024 (Eintragungsdatum)\n\nalles gut - Cleaning & Service Dirk Novotny e. K.\nEinzelkaufmann / Einzelkauffrau\nLutherstadt Wittenberg\n\nNicht eingetragen:\nDen Gläubigern der an der Ausgliederung beteiligten Rechtsträger, ist wenn sie binnen sechs Monaten nach dem Tag, an dem die Eintragung der Ausgliederung nach §§125, 19 Abs. 3 UmwG als bekanntgemacht gilt, ihren Anspruch nach Grund und Höhe schriftlich anmelden, Sicherheit zu leisten, soweit sie nicht Befriedigung verlangen können. Diese Recht steht ihnen jedoch nur zu, wenn sie glaubhaft machen, dass durch die Ausgliederung die Erfüllung ihrer Forderung gefährdet wird."
    },
    {
      "date": "2024-12-16",
      "id": "96513",
      "original_text": "Registerbekanntmachung nach dem Umwandlungsgesetz\nHamburg Amtsgericht Hamburg HRB 154482\nZytoPlus GmbH – Hamburg",
      "type": "Registerbekanntmachung nach dem Umwandlungsgesetz",
      "state": "Hamburg",
      "amtsgericht": "Amtsgericht Hamburg",
      "registernummer": "HRB 154482",
      "registerart": "HRB",
      "company_name": "ZytoPlus GmbH",
      "company_seat": "Hamburg",
      "details": "16.12.2024 (Bekanntmachungsdatum)\n\nHamburg Amtsgericht Hamburg HRB 154482\nRegisterbekanntmachung nach dem Umwandlungsgesetz 16.12.2024 (Eintragungsdatum)\n\nZytoPlus GmbH\nGesellschaft mit beschränkter Haftung\nHamburg\n\nAls nicht eingetragen wird bekannt gemacht:\nDen Gläubigern der an der Verschmelzung beteiligten Gesellschaften ist, wenn sie binnen sechs Monaten nach dem Tag, an dem die Eintragung der Verschmelzung in das Register des Sitzes desjenigen Rechtsträgers, dessen Gläubiger sie sind, nach § 19 Absatz 3 UmwG als bekannt gemacht gilt, ihren Anspruch nach Grund und Höhe schriftlich anmelden, Sicherheit zu leisten, soweit sie nicht Befriedigung verlangen können. Dieses Recht steht den Gläubigern jedoch nur zu, wenn sie glaubhaft machen, dass durch die Verschmelzung die Erfüllung ihrer Forderung gefährdet wird."
    },
    {
      "date": "2024-12-16",
      "id": "96514",
      "original_text": "Sonstige Registerbekanntmachung\nHamburg Amtsgericht Hamburg HRB 130494\nENERPARC Solar Invest 255 TU 10 GmbH – Hamburg",
      "type": "Sonstige Registerbekanntmachung",
      "state": "Hamburg",
      "amtsgericht": "Amtsgericht Hamburg",
      "registernummer": "HRB 130494",
      "registerart": "HRB",
      "company_name": "ENERPARC Solar Invest 255 TU 10 GmbH",
      "company_seat": "Hamburg",
      "details": "16.12.2024 (Bekanntmachungsdatum)\n\nHamburg Amtsgericht Hamburg HRB 130494\nSonstige Registerbekanntmachung 16.12.2024 (Eintragungsdatum)\n\nENERPARC Solar Invest 255 TU 10 GmbH\nGesellschaft mit beschränkter Haftung\nHamburg\n\nAls nicht eingetragen wird bekannt gemacht:  Den Gläubigern der Gesellschaft, deren Forderungen begründet worden sind, bevor die Eintragung der Vertragsbeendigung in das Handelsregister nach § 10 HGB als bekannt gemacht gilt, ist vom anderen Vertragsteil Sicherheit zu leisten, wenn sie sich binnen 6 Monaten nach Bekanntmachung der Eintragung zu diesem Zweck bei ihm melden."
    },
    {
      "date": "2024-12-16",
      "id": "96515",
      "original_text": "Registerbekanntmachung nach dem Umwandlungsgesetz\nHamburg Amtsgericht Hamburg HRB 102568\nZytoService Deutschland GmbH – Hamburg",
      "type": "Registerbekanntmachung nach dem Umwandlungsgesetz",
      "state": "Hamburg",
      "amtsgericht": "Amtsgericht Hamburg",
      "registernummer": "HRB 102568",
      "registerart": "HRB",
      "company_name": "ZytoService Deutschland GmbH",
      "company_seat": "Hamburg",
      "details": "16.12.2024 (Bekanntmachungsdatum)\n\nHamburg Amtsgericht Hamburg HRB 102568\nRegisterbekanntmachung nach dem Umwandlungsgesetz 16.12.2024 (Eintragungsdatum)\n\nZytoService Deutschland GmbH\nGesellschaft mit beschränkter Haftung\nHamburg\n\nAls nicht eingetragen wird bekannt gemacht:\nDen Gläubigern der an der Verschmelzung beteiligten Gesellschaften ist, wenn sie binnen sechs Monaten nach dem Tag, an dem die Eintragung der Verschmelzung in das Register des Sitzes desjenigen Rechtsträgers, dessen Gläubiger sie sind, nach § 19 Absatz 3 UmwG als bekannt gemacht gilt, ihren Anspruch nach Grund und Höhe schriftlich anmelden, Sicherheit zu leisten, soweit sie nicht Befriedigung verlangen können. Dieses Recht steht den Gläubigern jedoch nur zu, wenn sie glaubhaft machen, dass durch die Verschmelzung die Erfüllung ihrer Forderung gefährdet wird."
    },
    {
      "date": "2024-12-16",
      "id": "96516",
      "original_text": "Registerbekanntmachung nach dem Umwandlungsgesetz\nBaden-Württemberg Amtsgericht Mannheim VR 520314\nTennis-Club Fohlenweide Rastatt e.V. – Rastatt",
      "type": "Registerbekanntmachung nach dem Umwandlungsgesetz",
      "state": "Baden-Württemberg",
      "amtsgericht": "Amtsgericht Mannheim",
      "registernummer": "VR 520314",
      "registerart": "VR",
      "company_name": "Tennis-Club Fohlenweide Rastatt e.V.",
      "company_seat": "Rastatt",
      "details": "16.12.2024 (Bekanntmachungsdatum)\n\nBaden-Württemberg Amtsgericht Mannheim VR 520314\nRegisterbekanntmachung nach dem Umwandlungsgesetz 16.12.2024 (Eintragungsdatum)\n\nTennis-Club Fohlenweide Rastatt e.V.\neingetragener Verein\nRastatt\n\nAls nicht eingetragen wird bekanntgemacht:\nDen Gläubigern der an der Verschmelzung beteiligten Rechtsträger ist, wenn sie binnen sechs Monaten nach dem Tag, an dem die Eintragung der Verschmelzung in das Register des Sitzes desjenigen Rechtsträgers, dessen Gläubiger sie sind, nach § 19 Abs. 3 UmwG als bekanntgemacht gilt, ihren Anspruch nach Grund und Höhe schriftlich anmelden, Sicherheit zu leisten, soweit sie nicht Befriedigung verlangen können. Dieses Recht steht den Gläubigern jedoch nur zu, wenn sie glaubhaft machen, dass durch die Verschmelzung die Erfüllung ihrer Forderung gefährdet wird."
    },
    {
      "date": "2024-12-16",
      "id": "96517",
      "original_text": "Registerbekanntmachung nach dem Umwandlungsgesetz\nBaden-Württemberg Amtsgericht Mannheim VR 520054\nTennisclub Rastatt Blau - Gold e.V. – Rastatt",
      "type": "Registerbekanntmachung nach dem Umwandlungsgesetz",
      "state": "Baden-Württemberg",
      "amtsgericht": "Amtsgericht Mannheim",
      "registernummer": "VR 520054",
      "registerart": "VR",
      "company_name": "Tennisclub Rastatt Blau - Gold e.V.",
      "company_seat": "Rastatt",
      "details": "16.12.2024 (Bekanntmachungsdatum)\n\nBaden-Württemberg Amtsgericht Mannheim VR 520054\nRegisterbekanntmachung nach dem Umwandlungsgesetz 16.12.2024 (Eintragungsdatum)\n\nTennisclub Rastatt Blau - Gold e.V.\neingetragener Verein\nRastatt\n\nAls nicht eingetragen wird bekanntgemacht:\nDen Gläubigern der an der Verschmelzung beteiligten Rechtsträger ist, wenn sie binnen sechs Monaten nach dem Tag, an dem die Eintragung der Verschmelzung in das Register des Sitzes desjenigen Rechtsträgers, dessen Gläubiger sie sind, nach § 19 Abs. 3 UmwG als bekanntgemacht gilt, ihren Anspruch nach Grund und Höhe schriftlich anmelden, Sicherheit zu leisten, soweit sie nicht Befriedigung verlangen können. Dieses Recht steht den Gläubigern jedoch nur zu, wenn sie glaubhaft machen, dass durch die Verschmelzung die Erfüllung ihrer Forderung gefährdet wird."
    },
    {
      "date": "2024-12-16",
      "id": "96518",
      "original_text": "Löschungsankündigung\nBerlin Amtsgericht Berlin (Charlottenburg) HRB 163738\nFlex48 GmbH – Berlin",
      "type": "Löschungsankündigung",
      "state": "Berlin",
      "amtsgericht": "Amtsgericht Berlin (Charlottenburg)",
      "registernummer": "HRB 163738",
      "registerart": "HRB",
      "company_name": "Flex48 GmbH",
      "company_seat": "Berlin",
      "details": "16.12.2024 (Bekanntmachungsdatum)\n\nBerlin Amtsgericht Berlin (Charlottenburg) HRB 163738\nLöschungsankündigung\n\nFlex48 GmbH\nGesellschaft mit beschränkter Haftung\nBerlin\n\nBei der nachstehenden Gesellschaft wird das Amtslöschungsverfahren gemäß § 394 FamFG eingeleitet. Widerspruchsfrist 6 Wochen"
    },
    {
      "date": "2024-12-16",
      "id": "96519",
      "original_text": "Sonstige Registerbekanntmachung\nHamburg Amtsgericht Hamburg HRB 135158\nENERPARC Solar Invest 255 TU 11 GmbH – Hamburg",
      "type": "Sonstige Registerbekanntmachung",
      "state": "Hamburg",
      "amtsgericht": "Amtsgericht Hamburg",
      "registernummer": "HRB 135158",
      "registerart": "HRB",
      "company_name": "ENERPARC Solar Invest 255 TU 11 GmbH",
      "company_seat": "Hamburg",
      "details": "16.12.2024 (Bekanntmachungsdatum)\n\nHamburg Amtsgericht Hamburg HRB 135158\nSonstige Registerbekanntmachung 16.12.2024 (Eintragungsdatum)\n\nENERPARC Solar Invest 255 TU 11 GmbH\nGesellschaft mit beschränkter Haftung\nHamburg\n\nAls nicht eingetragen wird bekannt gemacht:  Den Gläubigern der Gesellschaft, deren Forderungen begründet worden sind, bevor die Eintragung der Vertragsbeendigung in das Handelsregister nach § 10 HGB als bekannt gemacht gilt, ist vom anderen Vertragsteil Sicherheit zu leisten, wenn sie sich binnen 6 Monaten nach Bekanntmachung der Eintragung zu diesem Zweck bei ihm melden."
    },
    {
      "date": "2024-12-16",
      "id": "96520",
      "original_text": "Löschungsankündigung\nBerlin Amtsgericht Berlin (Charlottenburg) HRB 23559\nDie Eintragung betreffend die Firma HD Reality Gastronomie- und Unterhaltungsbetriebs GmbH ist als nichtig gelöscht. – Berlin",
      "type": "Löschungsankündigung",
      "state": "Berlin",
      "amtsgericht": "Amtsgericht Berlin (Charlottenburg)",
      "registernummer": "HRB 23559",
      "registerart": "HRB",
      "company_name": "Die Eintragung betreffend die Firma HD Reality Gastronomie- und Unterhaltungsbetriebs GmbH ist als nichtig gelöscht.",
      "company_seat": "Berlin",
      "details": "16.12.2024 (Bekanntmachungsdatum)\n\nBerlin Amtsgericht Berlin (Charlottenburg) HRB 23559\nLöschungsankündigung\n\nDie Eintragung betreffend die Firma HD Reality Gastronomie- und Unterhaltungsbetriebs GmbH ist als nichtig gelöscht.\nGesellschaft mit beschränkter Haftung\nBerlin\n\nBei der nachstehenden Gesellschaft wird das Amtslöschungsverfahren gemäß § 394 FamFG eingeleitet. Widerspruchsfrist 6 Wochen"
    },
    {
      "date": "2024-12-16",
      "id": "96521",
      "original_text": "Löschungsankündigung\nBerlin Amtsgericht Berlin (Charlottenburg) HRB 140572\nS.H. Solution-Berlin UG (haftungsbeschränkt) – Berlin",
      "type": "Löschungsankündigung",
      "state": "Berlin",
      "amtsgericht": "Amtsgericht Berlin (Charlottenburg)",
      "registernummer": "HRB 140572",
      "registerart": "HRB",
      "company_name": "S.H. Solution-Berlin UG (haftungsbeschränkt)",
      "company_seat": "Berlin",
      "details": "16.12.2024 (Bekanntmachungsdatum)\n\nBerlin Amtsgericht Berlin (Charlottenburg) HRB 140572\nLöschungsankündigung\n\nS.H. Solution-Berlin UG (haftungsbeschränkt)\nGesellschaft mit beschränkter Haftung\nBerlin\n\nBei der nachstehenden Gesellschaft wird das Amtslöschungsverfahren gemäß § 394 FamFG eingeleitet. Widerspruchsfrist 6 Wochen"
    },
    {
      "date": "2024-12-16",
      "id": "96522",
      "original_text": "Löschungsankündigung\nBerlin Amtsgericht Berlin (Charlottenburg) HRB 169581\nGerman Collection Service Financial Pro GmbH – Berlin",
      "type": "Löschungsankündigung",
      "state": "Berlin",
      "amtsgericht": "Amtsgericht Berlin (Charlottenburg)",
      "registernummer": "HRB 169581",
      "registerart": "HRB",
      "company_name": "German Collection Service Financial Pro GmbH",
      "company_seat": "Berlin",
      "details": "16.12.2024 (Bekanntmachungsdatum)\n\nBerlin Amtsgericht Berlin (Charlottenburg) HRB 169581\nLöschungsankündigung\n\nGerman Collection Service Financial Pro GmbH\nGesellschaft mit beschränkter Haftung\nBerlin\n\nBei der nachstehenden Gesellschaft wird das Amtslöschungsverfahren gemäß § 394 FamFG eingeleitet. Widerspruchsfrist 6 Wochen"
    },
    {
      "date": "2024-12-16",
      "id": "96523",
      "original_text": "Löschungsankündigung\nBerlin Amtsgericht Berlin (Charlottenburg) HRB 195588\nKonti Construction GmbH – Berlin",
      "type": "Löschungsankündigung",
      "state": "Berlin",
      "amtsgericht": "Amtsgericht Berlin (Charlottenburg)",
      "registernummer": "HRB 195588",
      "registerart": "HRB",
      "company_name": "Konti Construction GmbH",
      "company_seat": "Berlin",
      "details": "16.12.2024 (Bekanntmachungsdatum)\n\nBerlin Amtsgericht Berlin (Charlottenburg) HRB 195588\nLöschungsankündigung\n\nKonti Construction GmbH\nGesellschaft mit beschränkter Haftung\nBerlin\n\nBei der nachstehenden Gesellschaft wird das Amtslöschungsverfahren gemäß § 394 FamFG eingeleitet. Widerspruchsfrist 6 Wochen"
    },
    {
      "date": "2024-12-16",
      "id": "96524",
      "original_text": "Einreichung neuer Dokumente\nBerlin Amtsgericht Berlin (Charlottenburg) HRB 140624\nENGIE Deutschland AG – Berlin",
      "type": "Einreichung neuer Dokumente",
      "state": "Berlin",
      "amtsgericht": "Amtsgericht Berlin (Charlottenburg)",
      "registernummer": "HRB 140624",
      "registerart": "HRB",
      "company_name": "ENGIE Deutschland AG",
      "company_seat": "Berlin",
      "details": "16.12.2024 (Bekanntmachungsdatum)\n\nBerlin Amtsgericht Berlin (Charlottenburg) HRB 140624\nEinreichung neuer Dokumente\n\nENGIE Deutschland AG\nAktiengesellschaft\nBerlin\n\nAls nicht eingetragen wird veröffentlicht:Es wurde eine neue Liste der Aufsichtsratsmitglieder eingereicht (§ 106 AktG)."
    },
    {
      "date": "2024-12-16",
      "id": "96525",
      "original_text": "Einreichung neuer Dokumente\nBaden-Württemberg Amtsgericht Freiburg HRB 472277\nMesse Offenburg - Ortenau GmbH – Offenburg",
      "type": "Einreichung neuer Dokumente",
      "state": "Baden-Württemberg",
      "amtsgericht": "Amtsgericht Freiburg",
      "registernummer": "HRB 472277",
      "registerart": "HRB",
      "company_name": "Messe Offenburg - Ortenau GmbH",
      "company_seat": "Offenburg",
      "details": "16.12.2024 (Bekanntmachungsdatum)\n\nBaden-Württemberg Amtsgericht Freiburg HRB 472277\nEinreichung neuer Dokumente\n\nMesse Offenburg - Ortenau GmbH\nGesellschaft mit beschränkter Haftung\nOffenburg\n\nDie Gesellschaft hat am 13.12.2024 die Liste über die Zusammensetzung des Aufsichtsrats zum Handelsregister eingereicht."
    },
    {
      "date": "2024-12-16",
      "id": "96526",
      "original_text": "Löschungsankündigung\nBrandenburg Amtsgericht Frankfurt/Oder HRB 10931\nArtwork Werbe GmbH – Frankfurt (Oder)",
      "type": "Löschungsankündigung",
      "state": "Brandenburg",
      "amtsgericht": "Amtsgericht Frankfurt/Oder",
      "registernummer": "HRB 10931",
      "registerart": "HRB",
      "company_name": "Artwork Werbe GmbH",
      "company_seat": "Frankfurt (Oder)",
      "details": "16.12.2024 (Bekanntmachungsdatum)\n\nBrandenburg Amtsgericht Frankfurt/Oder HRB 10931\nLöschungsankündigung\n\nArtwork Werbe GmbH\nGesellschaft mit beschränkter Haftung\nFrankfurt (Oder)\n\nBei der nachstehenden Gesellschaft wird das Amtslöschungsverfahren gemäß § 394 FamFG eingeleitet."
    },
    {
      "date": "2024-12-16",
      "id": "96527",
      "original_text": "Einreichung neuer Dokumente\nSachsen-Anhalt Amtsgericht Stendal HRB 15008\nKommunalservice GmbH Lutherstadt Wittenberg – Lutherstadt Wittenberg",
      "type": "Einreichung neuer Dokumente",
      "state": "Sachsen-Anhalt",
      "amtsgericht": "Amtsgericht Stendal",
      "registernummer": "HRB 15008",
      "registerart": "HRB",
      "company_name": "Kommunalservice GmbH Lutherstadt Wittenberg",
      "company_seat": "Lutherstadt Wittenberg",
      "details": "16.12.2024 (Bekanntmachungsdatum)\n\nSachsen-Anhalt Amtsgericht Stendal HRB 15008\nEinreichung neuer Dokumente\n\nKommunalservice GmbH Lutherstadt Wittenberg\nGesellschaft mit beschränkter Haftung\nLutherstadt Wittenberg\n\nEine Liste der Mitglieder des Aufsichtsrates wurde zum Handelsregister eingereicht."
    },
    {
      "date": "2024-12-16",
      "id": "96528",
      "original_text": "Sonstige Registerbekanntmachung\nBerlin Amtsgericht Berlin (Charlottenburg) HRB 106059\nMailingmanufaktur GmbH – Berlin",
      "type": "Sonstige Registerbekanntmachung",
      "state": "Berlin",
      "amtsgericht": "Amtsgericht Berlin (Charlottenburg)",
      "registernummer": "HRB 106059",
      "registerart": "HRB",
      "company_name": "Mailingmanufaktur GmbH",
      "company_seat": "Berlin",
      "details": "16.12.2024 (Bekanntmachungsdatum)\n\nBerlin Amtsgericht Berlin (Charlottenburg) HRB 106059\nSonstige Registerbekanntmachung\n\nMailingmanufaktur GmbH\nGesellschaft mit beschränkter Haftung\nBerlin\n\nAls nicht eingetragen wird veröffentlicht: Den Gläubigern der an der Verschmelzung beteiligten Rechtsträger ist, wenn sie binnen sechs Monaten nach dem Tag, an dem die Eintragung der Verschmelzung in das Register des Sitzes desjenigen Rechtsträgers, dessen Gläubiger sie sind, als bekannt gemacht gilt, ihren Anspruch nach Grund und Höhe schriftlich anmelden, Sicherheit zu leisten, soweit sie nicht Befriedigung verlangen können. Dieses Recht steht den Gläubigern jedoch nur zu, wenn sie glaubhaft machen, dass durch die Verschmelzung die Erfüllung ihrer Forderung gefährdet wird. Das Recht, Sicherheitsleistung zu verlangen, steht Gläubigern nicht zu, die im Falle der Insolvenz ein Recht auf vorzugsweise Befriedigung aus einer Deckungsmasse haben, die nach gesetzlicher Vorschrift zu ihrem Schutz errichtet und staatlich überwacht ist."
    },
    {
      "date": "2024-12-16",
      "id": "96529",
      "original_text": "Registerbekanntmachung nach dem Umwandlungsgesetz\nMecklenburg-Vorpommern Amtsgericht Schwerin HRB 905\nKrankenhaus Service LUP-Kliniken gGmbH – Ludwigslust",
      "type": "Registerbekanntmachung nach dem Umwandlungsgesetz",
      "state": "Mecklenburg-Vorpommern",
      "amtsgericht": "Amtsgericht Schwerin",
      "registernummer": "HRB 905",
      "registerart": "HRB",
      "company_name": "Krankenhaus Service LUP-Kliniken gGmbH",
      "company_seat": "Ludwigslust",
      "details": "16.12.2024 (Bekanntmachungsdatum)\n\nMecklenburg-Vorpommern Amtsgericht Schwerin HRB 905\nRegisterbekanntmachung nach dem Umwandlungsgesetz 16.12.2024 (Eintragungsdatum)\n\nKrankenhaus Service LUP-Kliniken gGmbH\nGesellschaft mit beschränkter Haftung\nLudwigslust\n\nDie Gesellschaft hat Gläubigern, deren Forderungen vor dieser Bekanntmachung begründet worden sind, Sicherheit zu leisten, soweit sie nicht Befriedigung verlangen können, wenn sie sich binnen sechs Monaten zu diesem Zweck melden."
    },
    {
      "date": "2024-12-16",
      "id": "96530",
      "original_text": "Einreichung neuer Dokumente\nSaarland Amtsgericht Saarbrücken HRB 11874\nEVS Gesellschaft für Service im Abwasserbereich mbH (EVS SAB GmbH) – Saarbrücken",
      "type": "Einreichung neuer Dokumente",
      "state": "Saarland",
      "amtsgericht": "Amtsgericht Saarbrücken",
      "registernummer": "HRB 11874",
      "registerart": "HRB",
      "company_name": "EVS Gesellschaft für Service im Abwasserbereich mbH (EVS SAB GmbH)",
      "company_seat": "Saarbrücken",
      "details": "16.12.2024 (Bekanntmachungsdatum)\n\nSaarland Amtsgericht Saarbrücken HRB 11874\nEinreichung neuer Dokumente\n\nEVS Gesellschaft für Service im Abwasserbereich mbH (EVS SAB GmbH)\nGesellschaft mit beschränkter Haftung\nSaarbrücken\n\nDie Geschäftsführung der Gesellschaft hat eine Liste der Mitglieder des Aufsichtsrats zum Handelsregister eingereicht (§ 52 Abs. 3 Satz 2 GmbHG)."
    },
    {
      "date": "2024-12-16",
      "id": "96531",
      "original_text": "Sonstige Registerbekanntmachung\nBerlin Amtsgericht Berlin (Charlottenburg) HRB 191887\nConsus Real Estate AG – Berlin",
      "type": "Sonstige Registerbekanntmachung",
      "state": "Berlin",
      "amtsgericht": "Amtsgericht Berlin (Charlottenburg)",
      "registernummer": "HRB 191887",
      "registerart": "HRB",
      "company_name": "Consus Real Estate AG",
      "company_seat": "Berlin",
      "details": "16.12.2024 (Bekanntmachungsdatum)\n\nBerlin Amtsgericht Berlin (Charlottenburg) HRB 191887\nSonstige Registerbekanntmachung\n\nConsus Real Estate AG\nAktiengesellschaft\nBerlin\n\nAls nicht eingetragen wird veröffentlicht:\nEs wurde eine neue Liste der Aufsichtsratsmitglieder eingereicht (§ 106 AktG)."
    },
    {
      "date": "2024-12-16",
      "id": "96532",
      "original_text": "Registerbekanntmachung nach dem Umwandlungsgesetz\nBaden-Württemberg Amtsgericht Ulm HRB 610192\nVerallia Deutschland AG – Bad Wurzach",
      "type": "Registerbekanntmachung nach dem Umwandlungsgesetz",
      "state": "Baden-Württemberg",
      "amtsgericht": "Amtsgericht Ulm",
      "registernummer": "HRB 610192",
      "registerart": "HRB",
      "company_name": "Verallia Deutschland AG",
      "company_seat": "Bad Wurzach",
      "details": "16.12.2024 (Bekanntmachungsdatum)\n\nBaden-Württemberg Amtsgericht Ulm HRB 610192\nRegisterbekanntmachung nach dem Umwandlungsgesetz\n\nVerallia Deutschland AG\nAktiengesellschaft\nBad Wurzach\n\nDie Gesellschaft hat am 16.12.2024 den Verschmelzungsvertrag vom 11.12.2024 zwischen \"Verallia Mehrweg GmbH\", Bad Wurzach (Amtsgericht Amtsgericht Ulm HRB 746751) und der hiesigen Gesellschaft (übernehmender Rechtsträger) zum Handelsregister eingereicht."
    },
    {
      "date": "2024-12-16",
      "id": "96533",
      "original_text": "Löschungsankündigung\nBaden-Württemberg Amtsgericht Stuttgart HRB 14400\nFING'RS (Deutschland) GmbH – Sindelfingen",
      "type": "Löschungsankündigung",
      "state": "Baden-Württemberg",
      "amtsgericht": "Amtsgericht Stuttgart",
      "registernummer": "HRB 14400",
      "registerart": "HRB",
      "company_name": "FING'RS (Deutschland) GmbH",
      "company_seat": "Sindelfingen",
      "details": "16.12.2024 (Bekanntmachungsdatum)\n\nBaden-Württemberg Amtsgericht Stuttgart HRB 14400\nLöschungsankündigung\n\nFING'RS (Deutschland) GmbH\nGesellschaft mit beschränkter Haftung\nSindelfingen\n\nDas Gericht beabsichtigt, die Gesellschaft wegen Vermögenslosigkeit im Handelsregister von Amts wegen nach § 394 FamFG zu löschen. Die Frist zur Geltendmachung eines Widerspruchs gegen die beabsichtigte Löschung ist auf zwei Monate ab Veröffentlichung bestimmt."
    },
    {
      "date": "2024-12-16",
      "id": "96534",
      "original_text": "Sonstige Registerbekanntmachung\nHamburg Amtsgericht Hamburg HRB 135160\nENERPARC Solar Invest 255 TU 12 GmbH – Hamburg",
      "type": "Sonstige Registerbekanntmachung",
      "state": "Hamburg",
      "amtsgericht": "Amtsgericht Hamburg",
      "registernummer": "HRB 135160",
      "registerart": "HRB",
      "company_name": "ENERPARC Solar Invest 255 TU 12 GmbH",
      "company_seat": "Hamburg",
      "details": "16.12.2024 (Bekanntmachungsdatum)\n\nHamburg Amtsgericht Hamburg HRB 135160\nSonstige Registerbekanntmachung 16.12.2024 (Eintragungsdatum)\n\nENERPARC Solar Invest 255 TU 12 GmbH\nGesellschaft mit beschränkter Haftung\nHamburg\n\nAls nicht eingetragen wird bekannt gemacht:  Den Gläubigern der Gesellschaft, deren Forderungen begründet worden sind, bevor die Eintragung der Vertragsbeendigung in das Handelsregister nach § 10 HGB als bekannt gemacht gilt, ist vom anderen Vertragsteil Sicherheit zu leisten, wenn sie sich binnen 6 Monaten nach Bekanntmachung der Eintragung zu diesem Zweck bei ihm melden."
    },
    {
      "date": "2024-12-16",
      "id": "96535",
      "original_text": "Registerbekanntmachung nach dem Umwandlungsgesetz\nBaden-Württemberg Amtsgericht Stuttgart HRA 741798\nHartmut Lamminger Hotel Arkade e.K. – Heilbronn",
      "type": "Registerbekanntmachung nach dem Umwandlungsgesetz",
      "state": "Baden-Württemberg",
      "amtsgericht": "Amtsgericht Stuttgart",
      "registernummer": "HRA 741798",
      "registerart": "HRA",
      "company_name": "Hartmut Lamminger Hotel Arkade e.K.",
      "company_seat": "Heilbronn",
      "details": "16.12.2024 (Bekanntmachungsdatum)\n\nBaden-Württemberg Amtsgericht Stuttgart HRA 741798\nRegisterbekanntmachung nach dem Umwandlungsgesetz 16.12.2024 (Eintragungsdatum)\n\nHartmut Lamminger Hotel Arkade e.K.\nEinzelkaufmann / Einzelkauffrau\nHeilbronn\n\nAls nicht eingetragen wird bekanntgemacht:\nDen Gläubigern der an der Ausgliederung beteiligten Rechtsträger ist, wenn sie binnen sechs Monaten nach dem Tag, an dem die Eintragung der Ausgliederung in das Register des Sitzes desjenigen Rechtsträgers, dessen Gläubiger sie sind, nach § 19 Abs. 3 UmwG als bekanntgemacht gilt, ihren Anspruch nach Grund und Höhe schriftlich anmelden, Sicherheit zu leisten, soweit sie nicht Befriedigung verlangen können. Dieses Recht steht den Gläubigern jedoch nur zu, wenn sie glaubhaft machen, dass durch die Ausgliederung die Erfüllung ihrer Forderung gefährdet wird."
    },
    {
      "date": "2024-12-16",
      "id": "96536",
      "original_text": "Registerbekanntmachung nach dem Umwandlungsgesetz\nBaden-Württemberg Amtsgericht Stuttgart HRA 104897\nHartmut Lamminger GmbH & Co. KG – Heilbronn",
      "type": "Registerbekanntmachung nach dem Umwandlungsgesetz",
      "state": "Baden-Württemberg",
      "amtsgericht": "Amtsgericht Stuttgart",
      "registernummer": "HRA 104897",
      "registerart": "HRA",
      "company_name": "Hartmut Lamminger GmbH & Co. KG",
      "company_seat": "Heilbronn",
      "details": "16.12.2024 (Bekanntmachungsdatum)\n\nBaden-Württemberg Amtsgericht Stuttgart HRA 104897\nRegisterbekanntmachung nach dem Umwandlungsgesetz 16.12.2024 (Eintragungsdatum)\n\nHartmut Lamminger GmbH & Co. KG\nKommanditgesellschaft\nHeilbronn\n\nAls nicht eingetragen wird bekanntgemacht:\nDen Gläubigern der an der Ausgliederung beteiligten Rechtsträger ist, wenn sie binnen sechs Monaten nach dem Tag, an dem die Eintragung der Ausgliederung in das Register des Sitzes desjenigen Rechtsträgers, dessen Gläubiger sie sind, nach § 19 Abs. 3 UmwG als bekanntgemacht gilt, ihren Anspruch nach Grund und Höhe schriftlich anmelden, Sicherheit zu leisten, soweit sie nicht Befriedigung verlangen können. Dieses Recht steht den Gläubigern jedoch nur zu, wenn sie glaubhaft machen, dass durch die Ausgliederung die Erfüllung ihrer Forderung gefährdet wird."
    },
    {
      "date": "2024-12-16",
      "id": "96537",
      "original_text": "Registerbekanntmachung nach dem Umwandlungsgesetz\nBaden-Württemberg Amtsgericht Ulm HRB 749069\nFinkonzept AG – Dietenheim",
      "type": "Registerbekanntmachung nach dem Umwandlungsgesetz",
      "state": "Baden-Württemberg",
      "amtsgericht": "Amtsgericht Ulm",
      "registernummer": "HRB 749069",
      "registerart": "HRB",
      "company_name": "Finkonzept AG",
      "company_seat": "Dietenheim",
      "details": "16.12.2024 (Bekanntmachungsdatum)\n\nBaden-Württemberg Amtsgericht Ulm HRB 749069\nRegisterbekanntmachung nach dem Umwandlungsgesetz 16.12.2024 (Eintragungsdatum)\n\nFinkonzept AG\nAktiengesellschaft\nDietenheim\n\nAls nicht eingetragen wird bekanntgemacht:\nDen Gläubigern des an dem Formwechsel beteiligten Rechtsträgers ist, wenn sie binnen sechs Monaten nach dem Tag, an dem die Eintragung des Formwechsels in das Register des Sitzes desjenigen Rechtsträgers, dessen Gläubiger sie sind, nach § 19 Abs. 3 UmwG als bekanntgemacht gilt, ihren Anspruch nach Grund und Höhe schriftlich anmelden, Sicherheit zu leisten, soweit sie nicht Befriedigung verlangen können. Dieses Recht steht den Gläubigern jedoch nur zu, wenn sie glaubhaft machen, dass durch den Formwechsel die Erfüllung ihrer Forderung gefährdet wird."
    },
    {
      "date": "2024-12-16",
      "id": "96538",
      "original_text": "Registerbekanntmachung nach dem Umwandlungsgesetz\nBaden-Württemberg Amtsgericht Ulm HRB 747316\nFinkonzept GmbH – Dietenheim",
      "type": "Registerbekanntmachung nach dem Umwandlungsgesetz",
      "state": "Baden-Württemberg",
      "amtsgericht": "Amtsgericht Ulm",
      "registernummer": "HRB 747316",
      "registerart": "HRB",
      "company_name": "Finkonzept GmbH",
      "company_seat": "Dietenheim",
      "details": "16.12.2024 (Bekanntmachungsdatum)\n\nBaden-Württemberg Amtsgericht Ulm HRB 747316\nRegisterbekanntmachung nach dem Umwandlungsgesetz 16.12.2024 (Eintragungsdatum)\n\nFinkonzept GmbH\nGesellschaft mit beschränkter Haftung\nDietenheim\n\nAls nicht eingetragen wird bekanntgemacht:\nDen Gläubigern des an dem Formwechsel beteiligten Rechtsträgers ist, wenn sie binnen sechs Monaten nach dem Tag, an dem die Eintragung des Formwechsels in das Register des Sitzes desjenigen Rechtsträgers, dessen Gläubiger sie sind, nach § 19 Abs. 3 UmwG als bekanntgemacht gilt, ihren Anspruch nach Grund und Höhe schriftlich anmelden, Sicherheit zu leisten, soweit sie nicht Befriedigung verlangen können. Dieses Recht steht den Gläubigern jedoch nur zu, wenn sie glaubhaft machen, dass durch den Formwechsel die Erfüllung ihrer Forderung gefährdet wird."
    },
    {
      "date": "2024-12-16",
      "id": "96539",
      "original_text": "Löschungsankündigung\nBaden-Württemberg Amtsgericht Stuttgart HRB 765142\nIDS - Elektro plus GmbH - Industrielle Dienstleistungen – Reutlingen",
      "type": "Löschungsankündigung",
      "state": "Baden-Württemberg",
      "amtsgericht": "Amtsgericht Stuttgart",
      "registernummer": "HRB 765142",
      "registerart": "HRB",
      "company_name": "IDS - Elektro plus GmbH - Industrielle Dienstleistungen",
      "company_seat": "Reutlingen",
      "details": "16.12.2024 (Bekanntmachungsdatum)\n\nBaden-Württemberg Amtsgericht Stuttgart HRB 765142\nLöschungsankündigung\n\nIDS - Elektro plus GmbH - Industrielle Dienstleistungen\nGesellschaft mit beschränkter Haftung\nReutlingen\n\nDas Gericht beabsichtigt, die Gesellschaft wegen Vermögenslosigkeit im Handelsregister von Amts wegen nach § 394 FamFG zu löschen. Die Frist zur Geltendmachung eines Widerspruchs gegen die beabsichtigte Löschung ist auf zwei Monate ab Veröffentlichung bestimmt."
    },
    {
      "date": "2024-12-16",
      "id": "96540",
      "original_text": "Löschungsankündigung\nSachsen Amtsgericht Dresden HRB 36739\ninova ConceptBau GmbH – Sebnitz",
      "type": "Löschungsankündigung",
      "state": "Sachsen",
      "amtsgericht": "Amtsgericht Dresden",
      "registernummer": "HRB 36739",
      "registerart": "HRB",
      "company_name": "inova ConceptBau GmbH",
      "company_seat": "Sebnitz",
      "details": "16.12.2024 (Bekanntmachungsdatum)\n\nSachsen Amtsgericht Dresden HRB 36739\nLöschungsankündigung\n\ninova ConceptBau GmbH\nGesellschaft mit beschränkter Haftung\nSebnitz\n\nDas Registergericht beabsichtigt, die im Handelsregister eingetragene Gesellschaft von Amts wegen nach § 394 FamFG zu löschen. Die Frist zu Erhebung eines Widerspruchs gegen die beabsichtigte Löschung wird auf einen Monat festgesetzt."
    },
    {
      "date": "2024-12-16",
      "id": "96541",
      "original_text": "Löschungsankündigung\nSachsen Amtsgericht Dresden HRB 32612\nASN Transport GmbH – Dresden",
      "type": "Löschungsankündigung",
      "state": "Sachsen",
      "amtsgericht": "Amtsgericht Dresden",
      "registernummer": "HRB 32612",
      "registerart": "HRB",
      "company_name": "ASN Transport GmbH",
      "company_seat": "Dresden",
      "details": "16.12.2024 (Bekanntmachungsdatum)\n\nSachsen Amtsgericht Dresden HRB 32612\nLöschungsankündigung\n\nASN Transport GmbH\nGesellschaft mit beschränkter Haftung\nDresden\n\nDas Registergericht beabsichtigt, die im Handelsregister eingetragene Gesellschaft von Amts wegen nach § 394 FamFG zu löschen. Die Frist zu Erhebung eines Widerspruchs gegen die beabsichtigte Löschung wird auf einen Monat festgesetzt."
    },
    {
      "date": "2024-12-16",
      "id": "96542",
      "original_text": "Einreichung neuer Dokumente\nSachsen Amtsgericht Chemnitz HRB 5735\nStadtwerke Meerane GmbH – Meerane",
      "type": "Einreichung neuer Dokumente",
      "state": "Sachsen",
      "amtsgericht": "Amtsgericht Chemnitz",
      "registernummer": "HRB 5735",
      "registerart": "HRB",
      "company_name": "Stadtwerke Meerane GmbH",
      "company_seat": "Meerane",
      "details": "16.12.2024 (Bekanntmachungsdatum)\n\nSachsen Amtsgericht Chemnitz HRB 5735\nEinreichung neuer Dokumente\n\nStadtwerke Meerane GmbH\nGesellschaft mit beschränkter Haftung\nMeerane\n\nAm 11.12.2024 wurde beim Handelsregister des Amtsgerichts Chemnitz die Liste der Mitglieder des Aufsichtsrats gemäß § 52 GmbHG eingereicht."
    },
    {
      "date": "2024-12-16",
      "id": "96543",
      "original_text": "Löschungsankündigung\nSachsen Amtsgericht Chemnitz HRB 34329\nSKIZ GmbH – Plauen",
      "type": "Löschungsankündigung",
      "state": "Sachsen",
      "amtsgericht": "Amtsgericht Chemnitz",
      "registernummer": "HRB 34329",
      "registerart": "HRB",
      "company_name": "SKIZ GmbH",
      "company_seat": "Plauen",
      "details": "16.12.2024 (Bekanntmachungsdatum)\n\nSachsen Amtsgericht Chemnitz HRB 34329\nLöschungsankündigung\n\nSKIZ GmbH\nGesellschaft mit beschränkter Haftung\nPlauen\n\nDas Registergericht beabsichtigt, die im Handelsregister eingetragene Gesellschaft von Amts wegen nach § 394 FamFG zu löschen. Die Frist zu Erhebung eines Widerspruchs gegen die beabsichtigte Löschung wird auf einen Monat festgesetzt."
    },
    {
      "date": "2024-12-16",
      "id": "96544",
      "original_text": "Einreichung neuer Dokumente\nSachsen Amtsgericht Chemnitz HRB 13139\nNaturschutzzentrum Erzgebirge gemeinnützige GmbH – Schlettau",
      "type": "Einreichung neuer Dokumente",
      "state": "Sachsen",
      "amtsgericht": "Amtsgericht Chemnitz",
      "registernummer": "HRB 13139",
      "registerart": "HRB",
      "company_name": "Naturschutzzentrum Erzgebirge gemeinnützige GmbH",
      "company_seat": "Schlettau",
      "details": "16.12.2024 (Bekanntmachungsdatum)\n\nSachsen Amtsgericht Chemnitz HRB 13139\nEinreichung neuer Dokumente\n\nNaturschutzzentrum Erzgebirge gemeinnützige GmbH\nGesellschaft mit beschränkter Haftung\nSchlettau\n\nAm 12.12.2024 wurde beim Handelsregister des Amtsgerichts Chemnitz die Liste der Mitglieder des Aufsichtsrats gemäß § 52 GmbHG eingereicht."
    },
    {
      "date": "2024-12-16",
      "id": "96545",
      "original_text": "Registerbekanntmachung nach dem Umwandlungsgesetz\nBaden-Württemberg Amtsgericht Freiburg HRB 717027\nZahnmedizinisches Versorgungszentrum am Heilsberg Verwaltungsgesellschaft mbH – Gottmadingen",
      "type": "Registerbekanntmachung nach dem Umwandlungsgesetz",
      "state": "Baden-Württemberg",
      "amtsgericht": "Amtsgericht Freiburg",
      "registernummer": "HRB 717027",
      "registerart": "HRB",
      "company_name": "Zahnmedizinisches Versorgungszentrum am Heilsberg Verwaltungsgesellschaft mbH",
      "company_seat": "Gottmadingen",
      "details": "16.12.2024 (Bekanntmachungsdatum)\n\nBaden-Württemberg Amtsgericht Freiburg HRB 717027\nRegisterbekanntmachung nach dem Umwandlungsgesetz 16.12.2024 (Eintragungsdatum)\n\nZahnmedizinisches Versorgungszentrum am Heilsberg Verwaltungsgesellschaft mbH\nGesellschaft mit beschränkter Haftung\nGottmadingen\n\nAls nicht eingetragen wird bekanntgemacht:\nDen Gläubigern der an der Verschmelzung beteiligten Rechtsträger ist, wenn sie binnen sechs Monaten nach dem Tag, an dem die Eintragung der Verschmelzung in das Register des Sitzes desjenigen Rechtsträgers, dessen Gläubiger sie sind, nach § 19 Abs. 3 UmwG als bekanntgemacht gilt, ihren Anspruch nach Grund und Höhe schriftlich anmelden, Sicherheit zu leisten, soweit sie nicht Befriedigung verlangen können. Dieses Recht steht den Gläubigern jedoch nur zu, wenn sie glaubhaft machen, dass durch die Verschmelzung die Erfüllung ihrer Forderung gefährdet wird."
    },
    {
      "date": "2024-12-16",
      "id": "96546",
      "original_text": "Löschungsankündigung\nNiedersachsen Amtsgericht Osnabrück HRA 120454 früher Amtsgericht Meppen\nTESCH Bereederungsgesellschaft mbH & Co. KG MS \"Margareta B.\" – Haren (Ems)",
      "type": "Löschungsankündigung",
      "state": "Niedersachsen",
      "amtsgericht": "Amtsgericht Osnabrück",
      "registernummer": "HRA 120454",
      "registerart": "HRA",
      "company_name": "TESCH Bereederungsgesellschaft mbH & Co. KG MS \"Margareta B.\"",
      "company_seat": "Haren (Ems)",
      "former_amtsgericht": "Meppen",
      "details": "16.12.2024 (Bekanntmachungsdatum)\n\nNiedersachsen Amtsgericht Osnabrück HRA 120454 früher Amtsgericht Meppen\nLöschungsankündigung 16.12.2024 (Eintragungsdatum)\n\nTESCH Bereederungsgesellschaft mbH & Co. KG MS \"Margareta B.\"\nKommanditgesellschaft\nHaren (Ems)\n\nDas Registergericht beabsichtigt, die Firma von Amts wegen nach § 394 FamFG wegen Vermögenslosigkeit zu löschen. Die Frist zur Erhebung eines Widerspruchs ist auf 1 Monat ab dieser Registerbekanntmachung festgesetzt."
    },
    {
      "date": "2024-12-16",
      "id": "96547",
      "original_text": "Sonstige Registerbekanntmachung\nNiedersachsen Amtsgericht Hildesheim HRB 110814 früher Amtsgericht Alfeld\nTecalor GmbH – Holzminden",
      "type": "Sonstige Registerbekanntmachung",
      "state": "Niedersachsen",
      "amtsgericht": "Amtsgericht Hildesheim",
      "registernummer": "HRB 110814",
      "registerart": "HRB",
      "company_name": "Tecalor GmbH",
      "company_seat": "Holzminden",
      "former_amtsgericht": "Alfeld",
      "details": "16.12.2024 (Bekanntmachungsdatum)\n\nNiedersachsen Amtsgericht Hildesheim HRB 110814 früher Amtsgericht Alfeld\nSonstige Registerbekanntmachung 16.12.2024 (Eintragungsdatum)\n\nTecalor GmbH\nGesellschaft mit beschränkter Haftung\nHolzminden\n\nDen Gläubigern der Gesellschaft, deren Forderungen begründet worden sind, bevor die Eintragung der Beendigung des Vertrages in das Handelsregister nach § 10 HGB als bekanntgemacht gilt, ist vom anderen Vertragsteil Sicherheit zu leisten, wenn sie sich binnen sechs Monaten nach der Bekanntmachung zu diesem Zweck bei ihm melden."
    },
    {
      "date": "2024-12-16",
      "id": "96548",
      "original_text": "Registerbekanntmachung nach dem Umwandlungsgesetz\nNiedersachsen Amtsgericht Tostedt HRB 120592 früher Amtsgericht Buxtehude\nUnterelbe Beteiligungsgesellschaft mbH – Buxtehude",
      "type": "Registerbekanntmachung nach dem Umwandlungsgesetz",
      "state": "Niedersachsen",
      "amtsgericht": "Amtsgericht Tostedt",
      "registernummer": "HRB 120592",
      "registerart": "HRB",
      "company_name": "Unterelbe Beteiligungsgesellschaft mbH",
      "company_seat": "Buxtehude",
      "former_amtsgericht": "Buxtehude",
      "details": "16.12.2024 (Bekanntmachungsdatum)\n\nNiedersachsen Amtsgericht Tostedt HRB 120592 früher Amtsgericht Buxtehude\nRegisterbekanntmachung nach dem Umwandlungsgesetz 16.12.2024 (Eintragungsdatum)\n\nUnterelbe Beteiligungsgesellschaft mbH\nGesellschaft mit beschränkter Haftung\nBuxtehude\n\nDen Gläubigern der an der Verschmelzung beteiligten Rechtsträger ist, wenn sie binnen sechs Monaten nach dem Tag, an dem die Eintragung der Verschmelzung in das Register des Sitzes desjenigen Rechtsträgers, dessen Gläubiger sie sind, nach § 19  Abs.  3 UmwG als bekannt gemacht gilt, ihren Anspruch nach Grund und Höhe schriftlich anmelden, Sicherheit zu leisten, soweit sie nicht Befriedigung verlangen können. Dieses Recht steht den Gläubigern jedoch nur zu, wenn sie glaubhaft machen, dass durch die Verschmelzung die Erfüllung der Forderung gefährdet wird."
    },
    {
      "date": "2024-12-16",
      "id": "96549",
      "original_text": "Registerbekanntmachung nach dem Umwandlungsgesetz\nNiedersachsen Amtsgericht Hannover HRB 53869\nTPG Baustoff- und Beteiligungsgesellschaft mbH – Hannover",
      "type": "Registerbekanntmachung nach dem Umwandlungsgesetz",
      "state": "Niedersachsen",
      "amtsgericht": "Amtsgericht Hannover",
      "registernummer": "HRB 53869",
      "registerart": "HRB",
      "company_name": "TPG Baustoff- und Beteiligungsgesellschaft mbH",
      "company_seat": "Hannover",
      "details": "16.12.2024 (Bekanntmachungsdatum)\n\nNiedersachsen Amtsgericht Hannover HRB 53869\nRegisterbekanntmachung nach dem Umwandlungsgesetz 16.12.2024 (Eintragungsdatum)\n\nTPG Baustoff- und Beteiligungsgesellschaft mbH\nGesellschaft mit beschränkter Haftung\nHannover\n\nDen Gläubigern der an der Verschmelzung beteiligten Rechtsträger ist, wenn sie binnen sechs Monaten nach dem Tag, an dem die Eintragung der Verschmelzung in das Register des Sitzes desjenigen Rechtsträgers, dessen Gläubiger sie sind, nach § 19  Abs.  3 UmwG als bekannt gemacht gilt, ihren Anspruch nach Grund und Höhe schriftlich anmelden, Sicherheit zu leisten, soweit sie nicht Befriedigung verlangen können. Dieses Recht steht den Gläubigern jedoch nur zu, wenn sie glaubhaft machen, dass durch die Verschmelzung die Erfüllung der Forderung gefährdet wird."
    },
    {
      "date": "2024-12-16",
      "id": "96550",
      "original_text": "Einreichung neuer Dokumente\nNiedersachsen Amtsgericht Hildesheim HRB 110401 früher Amtsgericht Alfeld\nStiebel Eltron Geschäftsführungsgesellschaft mit beschränkter Haftung – Holzminden",
      "type": "Einreichung neuer Dokumente",
      "state": "Niedersachsen",
      "amtsgericht": "Amtsgericht Hildesheim",
      "registernummer": "HRB 110401",
      "registerart": "HRB",
      "company_name": "Stiebel Eltron Geschäftsführungsgesellschaft mit beschränkter Haftung",
      "company_seat": "Holzminden",
      "former_amtsgericht": "Alfeld",
      "details": "16.12.2024 (Bekanntmachungsdatum)\n\nNiedersachsen Amtsgericht Hildesheim HRB 110401 früher Amtsgericht Alfeld\nEinreichung neuer Dokumente 16.12.2024 (Eintragungsdatum)\n\nStiebel Eltron Geschäftsführungsgesellschaft mit beschränkter Haftung\nGesellschaft mit beschränkter Haftung\nHolzminden\n\nDie Liste der Mitglieder des Aufsichtsrats wurde beim Registergericht eingereicht."
    },
    {
      "date": "2024-12-16",
      "id": "96551",
      "original_text": "Registerbekanntmachung nach dem Umwandlungsgesetz\nNiedersachsen Amtsgericht Hannover HRB 225818\nYOFC International (Germany) GmbH – Hannover",
      "type": "Registerbekanntmachung nach dem Umwandlungsgesetz",
      "state": "Niedersachsen",
      "amtsgericht": "Amtsgericht Hannover",
      "registernummer": "HRB 225818",
      "registerart": "HRB",
      "company_name": "YOFC International (Germany) GmbH",
      "company_seat": "Hannover",
      "details": "16.12.2024 (Bekanntmachungsdatum)\n\nNiedersachsen Amtsgericht Hannover HRB 225818\nRegisterbekanntmachung nach dem Umwandlungsgesetz 16.12.2024 (Eintragungsdatum)\n\nYOFC International (Germany) GmbH\nGesellschaft mit beschränkter Haftung\nHannover\n\nDen Gläubigern der an der Verschmelzung beteiligten Rechtsträger ist, wenn sie binnen sechs Monaten nach dem Tag, an dem die Eintragung der Verschmelzung in das Register des Sitzes desjenigen Rechtsträgers, dessen Gläubiger sie sind, nach § 19  Abs.  3 UmwG als bekannt gemacht gilt, ihren Anspruch nach Grund und Höhe schriftlich anmelden, Sicherheit zu leisten, soweit sie nicht Befriedigung verlangen können. Dieses Recht steht den Gläubigern jedoch nur zu, wenn sie glaubhaft machen, dass durch die Verschmelzung die Erfüllung der Forderung gefährdet wird."
    },
    {
      "date": "2024-12-16",
      "id": "96552",
      "original_text": "Löschungsankündigung\nNiedersachsen Amtsgericht Osnabrück HRB 217032\nBusiness Investment Support GmbH – Bad Bentheim",
      "type": "Löschungsankündigung",
      "state": "Niedersachsen",
      "amtsgericht": "Amtsgericht Osnabrück",
      "registernummer": "HRB 217032",
      "registerart": "HRB",
      "company_name": "Business Investment Support GmbH",
      "company_seat": "Bad Bentheim",
      "details": "16.12.2024 (Bekanntmachungsdatum)\n\nNiedersachsen Amtsgericht Osnabrück HRB 217032\nLöschungsankündigung\n\nBusiness Investment Support GmbH\nGesellschaft mit beschränkter Haftung\nBad Bentheim\n\nDas Registergericht beabsichtigt, die Gesellschaft von Amts wegen nach § 394 FamFG wegen Vermögenslosigkeit zu löschen. Die Frist zur Erhebung eines Widerspruchs ist auf 1 Monat ab dieser Registerbekanntmachung festgesetzt."
    },
    {
      "date": "2024-12-16",
      "id": "96553",
      "original_text": "Löschungsankündigung\nNiedersachsen Amtsgericht Stadthagen HRB 2711\nLamitec GmbH – Rinteln",
      "type": "Löschungsankündigung",
      "state": "Niedersachsen",
      "amtsgericht": "Amtsgericht Stadthagen",
      "registernummer": "HRB 2711",
      "registerart": "HRB",
      "company_name": "Lamitec GmbH",
      "company_seat": "Rinteln",
      "details": "16.12.2024 (Bekanntmachungsdatum)\n\nNiedersachsen Amtsgericht Stadthagen HRB 2711\nLöschungsankündigung\n\nLamitec GmbH\nGesellschaft mit beschränkter Haftung\nRinteln\n\nDas Registergericht beabsichtigt, die Gesellschaft von Amts wegen nach § 394 FamFG zu löschen. Die Frist zur Erhebung eines Widerspruchs ist auf 1 Monat ab dieser Registerbekanntmachung festgesetzt."
    },
    {
      "date": "2024-12-16",
      "id": "96554",
      "original_text": "Registerbekanntmachung nach dem Umwandlungsgesetz\nNiedersachsen Amtsgericht Hannover HRB 52392\nRadio Frequency Systems Gesellschaft mit beschränkter Haftung – Hannover",
      "type": "Registerbekanntmachung nach dem Umwandlungsgesetz",
      "state": "Niedersachsen",
      "amtsgericht": "Amtsgericht Hannover",
      "registernummer": "HRB 52392",
      "registerart": "HRB",
      "company_name": "Radio Frequency Systems Gesellschaft mit beschränkter Haftung",
      "company_seat": "Hannover",
      "details": "16.12.2024 (Bekanntmachungsdatum)\n\nNiedersachsen Amtsgericht Hannover HRB 52392\nRegisterbekanntmachung nach dem Umwandlungsgesetz\n\nRadio Frequency Systems Gesellschaft mit beschränkter Haftung\nGesellschaft mit beschränkter Haftung\nHannover\n\nDen Gläubigern der an der Verschmelzung beteiligten Rechtsträger ist, wenn sie binnen sechs Monaten nach dem Tag, an dem die Eintragung der Verschmelzung in das Register des Sitzes desjenigen Rechtsträgers, dessen Gläubiger sie sind, nach § 19  Abs.  3 UmwG als bekannt gemacht gilt, ihren Anspruch nach Grund und Höhe schriftlich anmelden, Sicherheit zu leisten, soweit sie nicht Befriedigung verlangen können. Dieses Recht steht den Gläubigern jedoch nur zu, wenn sie glaubhaft machen, dass durch die Verschmelzung die Erfüllung der Forderung gefährdet wird."
    },
    {
      "date": "2024-12-16",
      "id": "96555",
      "original_text": "Registerbekanntmachung nach dem Umwandlungsgesetz\nNiedersachsen Amtsgericht Hannover HRB 59068\nGP Günter Papenburg Aktiengesellschaft – Hannover",
      "type": "Registerbekanntmachung nach dem Umwandlungsgesetz",
      "state": "Niedersachsen",
      "amtsgericht": "Amtsgericht Hannover",
      "registernummer": "HRB 59068",
      "registerart": "HRB",
      "company_name": "GP Günter Papenburg Aktiengesellschaft",
      "company_seat": "Hannover",
      "details": "16.12.2024 (Bekanntmachungsdatum)\n\nNiedersachsen Amtsgericht Hannover HRB 59068\nRegisterbekanntmachung nach dem Umwandlungsgesetz 16.12.2024 (Eintragungsdatum)\n\nGP Günter Papenburg Aktiengesellschaft\nAktiengesellschaft\nHannover\n\nDen Gläubigern der an der Verschmelzung beteiligten Rechtsträger ist, wenn sie binnen sechs Monaten nach dem Tag, an dem die Eintragung der Verschmelzung in das Register des Sitzes desjenigen Rechtsträgers, dessen Gläubiger sie sind, nach § 19  Abs.  3 UmwG als bekannt gemacht gilt, ihren Anspruch nach Grund und Höhe schriftlich anmelden, Sicherheit zu leisten, soweit sie nicht Befriedigung verlangen können. Dieses Recht steht den Gläubigern jedoch nur zu, wenn sie glaubhaft machen, dass durch die Verschmelzung die Erfüllung der Forderung gefährdet wird."
    },
    {
      "date": "2024-12-16",
      "id": "96556",
      "original_text": "Registerbekanntmachung nach dem Umwandlungsgesetz\nNiedersachsen Amtsgericht Osnabrück HRB 209955\nAvermann Finanzierungs GmbH – Osnabrück",
      "type": "Registerbekanntmachung nach dem Umwandlungsgesetz",
      "state": "Niedersachsen",
      "amtsgericht": "Amtsgericht Osnabrück",
      "registernummer": "HRB 209955",
      "registerart": "HRB",
      "company_name": "Avermann Finanzierungs GmbH",
      "company_seat": "Osnabrück",
      "details": "16.12.2024 (Bekanntmachungsdatum)\n\nNiedersachsen Amtsgericht Osnabrück HRB 209955\nRegisterbekanntmachung nach dem Umwandlungsgesetz 16.12.2024 (Eintragungsdatum)\n\nAvermann Finanzierungs GmbH\nGesellschaft mit beschränkter Haftung\nOsnabrück\n\nDen Gläubigern der an der Verschmelzung beteiligten Rechtsträger ist, wenn sie binnen sechs Monaten nach dem Tag, an dem die Eintragung der Verschmelzung in das Register des Sitzes desjenigen Rechtsträgers, dessen Gläubiger sie sind, nach § 19  Abs.  3 UmwG als bekannt gemacht gilt, ihren Anspruch nach Grund und Höhe schriftlich anmelden, Sicherheit zu leisten, soweit sie nicht Befriedigung verlangen können. Dieses Recht steht den Gläubigern jedoch nur zu, wenn sie glaubhaft machen, dass durch die Verschmelzung die Erfüllung der Forderung gefährdet wird."
    },
    {
      "date": "2024-12-16",
      "id": "96557",
      "original_text": "Registerbekanntmachung nach dem Umwandlungsgesetz\nNiedersachsen Amtsgericht Oldenburg (Oldenburg) HRB 220302\nFunke Klimatechnik GmbH – Dötlingen",
      "type": "Registerbekanntmachung nach dem Umwandlungsgesetz",
      "state": "Niedersachsen",
      "amtsgericht": "Amtsgericht Oldenburg (Oldenburg)",
      "registernummer": "HRB 220302",
      "registerart": "HRB",
      "company_name": "Funke Klimatechnik GmbH",
      "company_seat": "Dötlingen",
      "details": "16.12.2024 (Bekanntmachungsdatum)\n\nNiedersachsen Amtsgericht Oldenburg (Oldenburg) HRB 220302\nRegisterbekanntmachung nach dem Umwandlungsgesetz 16.12.2024 (Eintragungsdatum)\n\nFunke Klimatechnik GmbH\nGesellschaft mit beschränkter Haftung\nDötlingen\n\nDen Gläubigern der an der Ausgliederung beteiligten Rechtsträger ist, wenn sie binnen sechs Monaten nach dem Tag, an dem die Eintragung der Ausgliederung in das Register des Sitzes desjenigen Rechtsträgers, dessen Gläubiger sie sind, nach § 19 Abs. 3 UmwG als bekannt gemacht gilt, ihren Anspruch nach Grund und Höhe schriftlich anmelden, Sicherheit zu leisten, soweit sie nicht Befriedigung verlangen können. Dieses Recht steht den Gläubigern jedoch nur zu, wenn sie glaubhaft machen, dass durch die Ausgliederung die Erfüllung der Forderung gefährdet wird."
    },
    {
      "date": "2024-12-16",
      "id": "96558",
      "original_text": "Registerbekanntmachung nach dem Umwandlungsgesetz\nNiedersachsen Amtsgericht Osnabrück HRB 218611\nheristo VG 9 GmbH – Bad Rothenfelde",
      "type": "Registerbekanntmachung nach dem Umwandlungsgesetz",
      "state": "Niedersachsen",
      "amtsgericht": "Amtsgericht Osnabrück",
      "registernummer": "HRB 218611",
      "registerart": "HRB",
      "company_name": "heristo VG 9 GmbH",
      "company_seat": "Bad Rothenfelde",
      "details": "16.12.2024 (Bekanntmachungsdatum)\n\nNiedersachsen Amtsgericht Osnabrück HRB 218611\nRegisterbekanntmachung nach dem Umwandlungsgesetz 16.12.2024 (Eintragungsdatum)\n\nheristo VG 9 GmbH\nGesellschaft mit beschränkter Haftung\nBad Rothenfelde\n\nDen Gläubigern der an der Verschmelzung beteiligten Rechtsträger ist, wenn sie binnen sechs Monaten nach dem Tag, an dem die Eintragung der Verschmelzung in das Register des Sitzes desjenigen Rechtsträgers, dessen Gläubiger sie sind, nach § 19  Abs.  3 UmwG als bekannt gemacht gilt, ihren Anspruch nach Grund und Höhe schriftlich anmelden, Sicherheit zu leisten, soweit sie nicht Befriedigung verlangen können. Dieses Recht steht den Gläubigern jedoch nur zu, wenn sie glaubhaft machen, dass durch die Verschmelzung die Erfüllung der Forderung gefährdet wird."
    },
    {
      "date": "2024-12-16",
      "id": "96559",
      "original_text": "Registerbekanntmachung nach dem Umwandlungsgesetz\nNiedersachsen Amtsgericht Tostedt HRB 110807 früher Amtsgericht Langen\nfresh haven gmbh – Cuxhaven",
      "type": "Registerbekanntmachung nach dem Umwandlungsgesetz",
      "state": "Niedersachsen",
      "amtsgericht": "Amtsgericht Tostedt",
      "registernummer": "HRB 110807",
      "registerart": "HRB",
      "company_name": "fresh haven gmbh",
      "company_seat": "Cuxhaven",
      "former_amtsgericht": "Langen",
      "details": "16.12.2024 (Bekanntmachungsdatum)\n\nNiedersachsen Amtsgericht Tostedt HRB 110807 früher Amtsgericht Langen\nRegisterbekanntmachung nach dem Umwandlungsgesetz 16.12.2024 (Eintragungsdatum)\n\nfresh haven gmbh\nGesellschaft mit beschränkter Haftung\nCuxhaven\n\nDen Gläubigern der an der Verschmelzung beteiligten Rechtsträger ist, wenn sie binnen sechs Monaten nach dem Tag, an dem die Eintragung der Verschmelzung in das Register des Sitzes desjenigen Rechtsträgers, dessen Gläubiger sie sind, nach § 19  Abs.  3 UmwG als bekannt gemacht gilt, ihren Anspruch nach Grund und Höhe schriftlich anmelden, Sicherheit zu leisten, soweit sie nicht Befriedigung verlangen können. Dieses Recht steht den Gläubigern jedoch nur zu, wenn sie glaubhaft machen, dass durch die Verschmelzung die Erfüllung der Forderung gefährdet wird."
    },
    {
      "date": "2024-12-16",
      "id": "96560",
      "original_text": "Registerbekanntmachung nach dem Umwandlungsgesetz\nRheinland-Pfalz Amtsgericht Mainz HRB 51855\nANTHROPOS GmbH – Ingelheim am Rhein",
      "type": "Registerbekanntmachung nach dem Umwandlungsgesetz",
      "state": "Rheinland-Pfalz",
      "amtsgericht": "Amtsgericht Mainz",
      "registernummer": "HRB 51855",
      "registerart": "HRB",
      "company_name": "ANTHROPOS GmbH",
      "company_seat": "Ingelheim am Rhein",
      "details": "16.12.2024 (Bekanntmachungsdatum)\n\nRheinland-Pfalz Amtsgericht Mainz HRB 51855\nRegisterbekanntmachung nach dem Umwandlungsgesetz 16.12.2024 (Eintragungsdatum)\n\nANTHROPOS GmbH\nGesellschaft mit beschränkter Haftung\nIngelheim am Rhein\n\nAls nicht eingetragen wird veröffentlicht:\nDen Gläubigern der an der Verschmelzung beteiligten Rechtsträger ist, wenn sie binnen sechs Monaten nach dem Tag, an dem die Eintragung der Verschmelzung in das Register des Sitzes desjenigen Rechtsträgers,dessen Gläubiger sie sind, nach § 19 Abs. 3 UmwG als bekannt gemacht gilt, ihren Anspruch nach Grund und Höhe schriftlich anmelden, Sicherheit zu leisten, soweit sie nicht Befriedigung verlangen können. Dieses Recht steht den Gläubigern jedoch nur zu, wenn sie glaubhaft machen, dass durch die Verschmelzung die Erfüllungd er Forderung gefährdet wird."
    },
    {
      "date": "2024-12-16",
      "id": "96561",
      "original_text": "Einreichung neuer Dokumente\nRheinland-Pfalz Amtsgericht Mainz HRB 12473\nStadt Worms Beteiligungs-GmbH – Worms",
      "type": "Einreichung neuer Dokumente",
      "state": "Rheinland-Pfalz",
      "amtsgericht": "Amtsgericht Mainz",
      "registernummer": "HRB 12473",
      "registerart": "HRB",
      "company_name": "Stadt Worms Beteiligungs-GmbH",
      "company_seat": "Worms",
      "details": "16.12.2024 (Bekanntmachungsdatum)\n\nRheinland-Pfalz Amtsgericht Mainz HRB 12473\nEinreichung neuer Dokumente\n\nStadt Worms Beteiligungs-GmbH\nGesellschaft mit beschränkter Haftung\nWorms\n\nDem Registergericht ist eine Liste der Mitglieder des Aufsichtsrates eingereicht worden."
    },
    {
      "date": "2024-12-16",
      "id": "96562",
      "original_text": "Registerbekanntmachung nach dem Umwandlungsgesetz\nRheinland-Pfalz Amtsgericht Mainz HRB 51913\nmetropolheads GmbH – Ingelheim am Rhein",
      "type": "Registerbekanntmachung nach dem Umwandlungsgesetz",
      "state": "Rheinland-Pfalz",
      "amtsgericht": "Amtsgericht Mainz",
      "registernummer": "HRB 51913",
      "registerart": "HRB",
      "company_name": "metropolheads GmbH",
      "company_seat": "Ingelheim am Rhein",
      "details": "16.12.2024 (Bekanntmachungsdatum)\n\nRheinland-Pfalz Amtsgericht Mainz HRB 51913\nRegisterbekanntmachung nach dem Umwandlungsgesetz 16.12.2024 (Eintragungsdatum)\n\nmetropolheads GmbH\nGesellschaft mit beschränkter Haftung\nIngelheim am Rhein\n\nAls nicht eingetragen wird veröffentlicht:\nDen Gläubigern der an der Verschmelzung beteiligten Rechtsträger ist, wenn sie binnen sechs Monaten nach dem Tag, an dem die Eintragung der Verschmelzung in das Register des Sitzes desjenigen Rechtsträgers,\ndessen Gläubiger sie sind, nach § 19 Abs. 3 UmwG als bekannt gemacht gilt, ihren Anspruch nach Grund und Höhe schriftlich anmelden, Sicherheit zu leisten, soweit sie nicht Befriedigung verlangen können. Dieses Recht steht den Gläubigern jedoch nur zu, wenn sie glaubhaft machen, dass durch die Verschmelzung die Erfüllung der Forderung gefährdet wird."
    },
    {
      "date": "2024-12-16",
      "id": "96563",
      "original_text": "Registerbekanntmachung nach dem Umwandlungsgesetz\nRheinland-Pfalz Amtsgericht Koblenz HRB 25039\nSchäfer Versicherungsmakler Verwaltungs GmbH – Koblenz",
      "type": "Registerbekanntmachung nach dem Umwandlungsgesetz",
      "state": "Rheinland-Pfalz",
      "amtsgericht": "Amtsgericht Koblenz",
      "registernummer": "HRB 25039",
      "registerart": "HRB",
      "company_name": "Schäfer Versicherungsmakler Verwaltungs GmbH",
      "company_seat": "Koblenz",
      "details": "16.12.2024 (Bekanntmachungsdatum)\n\nRheinland-Pfalz Amtsgericht Koblenz HRB 25039\nRegisterbekanntmachung nach dem Umwandlungsgesetz 16.12.2024 (Eintragungsdatum)\n\nSchäfer Versicherungsmakler Verwaltungs GmbH\nGesellschaft mit beschränkter Haftung\nKoblenz\n\nAls nicht eingetragen wird veröffentlicht: Den Gläubigern der an der Verschmelzung beteiligten Rechtsträger ist, wenn sie binnen sechs Monaten nach dem Tag, an dem die Eintragung der Verschmelzung in das Register des Sitzes desjenigen Rechtsträgers,dessen Gläubiger sie sind, nach § 19 Abs. 3 UmwG als bekannt gemacht gilt, ihren Anspruch nach Grund und Höhe schriftlich anmelden, Sicherheit zu leisten, soweit sie nicht Befriedigung verlangen können. Dieses Recht steht den Gläubigern jedoch nur zu, wenn sie glaubhaft machen, dass durch die Verschmelzung die Erfüllungd er Forderung gefährdet wird."
    },
    {
      "date": "2024-12-16",
      "id": "96564",
      "original_text": "Einreichung neuer Dokumente\nNordrhein-Westfalen Amtsgericht Köln HRB 22957\nHäfen und Güterverkehr Köln Aktiengesellschaft – Köln",
      "type": "Einreichung neuer Dokumente",
      "state": "Nordrhein-Westfalen",
      "amtsgericht": "Amtsgericht Köln",
      "registernummer": "HRB 22957",
      "registerart": "HRB",
      "company_name": "Häfen und Güterverkehr Köln Aktiengesellschaft",
      "company_seat": "Köln",
      "details": "16.12.2024 (Bekanntmachungsdatum)\n\nNordrhein-Westfalen Amtsgericht Köln HRB 22957\nEinreichung neuer Dokumente\n\nHäfen und Güterverkehr Köln Aktiengesellschaft\nAktiengesellschaft\nKöln\n\nDem Registergericht ist eine Liste der Mitglieder des Aufsichtsrates eingereicht worden."
    },
    {
      "date": "2024-12-16",
      "id": "96565",
      "original_text": "Registerbekanntmachung nach dem Umwandlungsgesetz\nNordrhein-Westfalen Amtsgericht Iserlohn HRB 2802\nradprax Krankenhaus Plettenberg GmbH – Plettenberg",
      "type": "Registerbekanntmachung nach dem Umwandlungsgesetz",
      "state": "Nordrhein-Westfalen",
      "amtsgericht": "Amtsgericht Iserlohn",
      "registernummer": "HRB 2802",
      "registerart": "HRB",
      "company_name": "radprax Krankenhaus Plettenberg GmbH",
      "company_seat": "Plettenberg",
      "details": "16.12.2024 (Bekanntmachungsdatum)\n\nNordrhein-Westfalen Amtsgericht Iserlohn HRB 2802\nRegisterbekanntmachung nach dem Umwandlungsgesetz 13.12.2024 (Eintragungsdatum)\n\nradprax Krankenhaus Plettenberg GmbH\nGesellschaft mit beschränkter Haftung\nPlettenberg\n\nDen Gläubigern der an der Verschmelzung beteiligten Rechtsträger ist, wenn sie binnen sechs Monaten nach dem Tag, an dem die Eintragung der Verschmelzung in das Register des Sitzes derjenigen Rechtsträger deren Gläubiger sie sind, nach § 19 Absatz 3 UmwG als bekanntgemacht gilt, ihren Anspruch nach Grund und Höhe schriftlich anmelden, Sicherheit zu leisten, soweit sie nicht Befriedigung verlangen können. Dieses Recht steht den Gläubigern jedoch nur zu, wenn sie glaubhaft machen, dass durch die Verschmelzung die Erfüllung ihrer Forderung gefährdet wird."
    },
    {
      "date": "2024-12-16",
      "id": "96566",
      "original_text": "Löschungsankündigung\nNordrhein-Westfalen Amtsgericht Recklinghausen HRB 7998\nRuhrpottential UG (haftungsbeschränkt) – Herten",
      "type": "Löschungsankündigung",
      "state": "Nordrhein-Westfalen",
      "amtsgericht": "Amtsgericht Recklinghausen",
      "registernummer": "HRB 7998",
      "registerart": "HRB",
      "company_name": "Ruhrpottential UG (haftungsbeschränkt)",
      "company_seat": "Herten",
      "details": "16.12.2024 (Bekanntmachungsdatum)\n\nNordrhein-Westfalen Amtsgericht Recklinghausen HRB 7998\nLöschungsankündigung\n\nRuhrpottential UG (haftungsbeschränkt)\nGesellschaft mit beschränkter Haftung\nHerten\n\nDas Registergericht beabsichtigt die Gesellschaft von Amts wegen nach § 394 FamFG zu löschen. Die Frist zur Erhebung eines Widerspruchs ist auf zwei Monate festgesetzt."
    },
    {
      "date": "2024-12-16",
      "id": "96567",
      "original_text": "Registerbekanntmachung nach dem Umwandlungsgesetz\nNordrhein-Westfalen Amtsgericht Essen HRA 11864\nBlitz 24-785 S.à.r.l. & Co. KG – Essen",
      "type": "Registerbekanntmachung nach dem Umwandlungsgesetz",
      "state": "Nordrhein-Westfalen",
      "amtsgericht": "Amtsgericht Essen",
      "registernummer": "HRA 11864",
      "registerart": "HRA",
      "company_name": "Blitz 24-785 S.à.r.l. & Co. KG",
      "company_seat": "Essen",
      "details": "16.12.2024 (Bekanntmachungsdatum)\n\nNordrhein-Westfalen Amtsgericht Essen HRA 11864\nRegisterbekanntmachung nach dem Umwandlungsgesetz 16.12.2024 (Eintragungsdatum)\n\nBlitz 24-785 S.à.r.l. & Co. KG\nKommanditgesellschaft\nEssen\n\nDen Gläubigern der an der Ausgliederung beteiligten Rechtsträger ist, wenn sie binnen sechs Monaten nach dem Tag, an dem die Eintragung der Ausgliederung in das Register des Sitzes desjenigen Rechtsträgers, dessen Gläubiger sie sind, nach § 19 Absatz 3 UmwG als bekanntgemacht gilt, ihren Anspruch nach Grund und Höhe schriftlich anmelden, Sicherheit zu leisten, soweit sie nicht Befriedigung verlangen können. Dieses Recht steht den Gläubigern jedoch nur zu, wenn sie glaubhaft machen, dass durch die Ausgliederung die Erfüllung ihrer Forderung gefährdet wird."
    },
    {
      "date": "2024-12-16",
      "id": "96568",
      "original_text": "Löschungsankündigung\nNordrhein-Westfalen Amtsgericht Dortmund HRB 33096\nEG Solid Bau GmbH – Castrop-Rauxel",
      "type": "Löschungsankündigung",
      "state": "Nordrhein-Westfalen",
      "amtsgericht": "Amtsgericht Dortmund",
      "registernummer": "HRB 33096",
      "registerart": "HRB",
      "company_name": "EG Solid Bau GmbH",
      "company_seat": "Castrop-Rauxel",
      "details": "16.12.2024 (Bekanntmachungsdatum)\n\nNordrhein-Westfalen Amtsgericht Dortmund HRB 33096\nLöschungsankündigung\n\nEG Solid Bau GmbH\nGesellschaft mit beschränkter Haftung\nCastrop-Rauxel\n\nDas Registergericht beabsichtigt die Gesellschaft von Amts wegen nach § 394 FamFG zu löschen. Die Frist zur Erhebung eines Widerspruchs ist auf zwei Monate festgesetzt."
    },
    {
      "date": "2024-12-16",
      "id": "96569",
      "original_text": "Einreichung neuer Dokumente\nNordrhein-Westfalen Amtsgericht Duisburg HRB 20299\nThyssenKrupp MillServices & Systems GmbH – Duisburg",
      "type": "Einreichung neuer Dokumente",
      "state": "Nordrhein-Westfalen",
      "amtsgericht": "Amtsgericht Duisburg",
      "registernummer": "HRB 20299",
      "registerart": "HRB",
      "company_name": "ThyssenKrupp MillServices & Systems GmbH",
      "company_seat": "Duisburg",
      "details": "16.12.2024 (Bekanntmachungsdatum)\n\nNordrhein-Westfalen Amtsgericht Duisburg HRB 20299\nEinreichung neuer Dokumente\n\nThyssenKrupp MillServices & Systems GmbH\nGesellschaft mit beschränkter Haftung\nDuisburg\n\nDem Registergericht ist eine neue Liste der Mitglieder des Aufsichtsrates eingereicht worden."
    },
    {
      "date": "2024-12-16",
      "id": "96570",
      "original_text": "Registerbekanntmachung nach dem Umwandlungsgesetz\nNordrhein-Westfalen Amtsgericht Düsseldorf HRB 101486\nRialto Capital GmbH – Düsseldorf",
      "type": "Registerbekanntmachung nach dem Umwandlungsgesetz",
      "state": "Nordrhein-Westfalen",
      "amtsgericht": "Amtsgericht Düsseldorf",
      "registernummer": "HRB 101486",
      "registerart": "HRB",
      "company_name": "Rialto Capital GmbH",
      "company_seat": "Düsseldorf",
      "details": "16.12.2024 (Bekanntmachungsdatum)\n\nNordrhein-Westfalen Amtsgericht Düsseldorf HRB 101486\nRegisterbekanntmachung nach dem Umwandlungsgesetz 16.12.2024 (Eintragungsdatum)\n\nRialto Capital GmbH\nGesellschaft mit beschränkter Haftung\nDüsseldorf\n\nDen Gläubigern der an der Verschmelzung beteiligten Rechtsträger ist, wenn sie binnen sechs Monaten nach dem Tag, an dem die Eintragung der Verschmelzung in das Register des Sitzes desjenigen Rechtsträgers, dessen Gläubiger sie sind, nach § 19 Absatz 3 UmwG als bekanntgemacht gilt, ihren Anspruch nach Grund und Höhe schriftlich anmelden, Sicherheit zu leisten, soweit sie nicht Befriedigung verlangen können. Dieses Recht steht den Gläubigern jedoch nur zu, wenn sie glaubhaft machen, dass durch die Verschmelzung die Erfüllung ihrer Forderung gefährdet wird."
    },
    {
      "date": "2024-12-16",
      "id": "96571",
      "original_text": "Sonstige Registerbekanntmachung\nNordrhein-Westfalen Amtsgericht Aachen HRB 560\nSTAWAG - Stadt- und Städteregionswerke Aachen AG – Aachen",
      "type": "Sonstige Registerbekanntmachung",
      "state": "Nordrhein-Westfalen",
      "amtsgericht": "Amtsgericht Aachen",
      "registernummer": "HRB 560",
      "registerart": "HRB",
      "company_name": "STAWAG - Stadt- und Städteregionswerke Aachen AG",
      "company_seat": "Aachen",
      "details": "16.12.2024 (Bekanntmachungsdatum)\n\nNordrhein-Westfalen Amtsgericht Aachen HRB 560\nSonstige Registerbekanntmachung\n\nSTAWAG - Stadt- und Städteregionswerke Aachen AG\nAktiengesellschaft\nAachen\n\nDem Registergericht ist eine neue Liste der Mitglieder des Aufsichtsrates eingereicht worden."
    },
    {
      "date": "2024-12-16",
      "id": "96572",
      "original_text": "Registerbekanntmachung nach dem Umwandlungsgesetz\nNordrhein-Westfalen Amtsgericht Düsseldorf HRB 75869\nRhein Arcaden GmbH – Düsseldorf",
      "type": "Registerbekanntmachung nach dem Umwandlungsgesetz",
      "state": "Nordrhein-Westfalen",
      "amtsgericht": "Amtsgericht Düsseldorf",
      "registernummer": "HRB 75869",
      "registerart": "HRB",
      "company_name": "Rhein Arcaden GmbH",
      "company_seat": "Düsseldorf",
      "details": "16.12.2024 (Bekanntmachungsdatum)\n\nNordrhein-Westfalen Amtsgericht Düsseldorf HRB 75869\nRegisterbekanntmachung nach dem Umwandlungsgesetz 16.12.2024 (Eintragungsdatum)\n\nRhein Arcaden GmbH\nGesellschaft mit beschränkter Haftung\nDüsseldorf\n\nDen Gläubigern der an der Verschmelzung beteiligten Rechtsträger ist, wenn sie binnen sechs Monaten nach dem Tag, an dem die Eintragung der Verschmelzung in das Register des Sitzes desjenigen Rechtsträgers, dessen Gläubiger sie sind, nach § 19 Absatz 3 UmwG als bekanntgemacht gilt, ihren Anspruch nach Grund und Höhe schriftlich anmelden, Sicherheit zu leisten, soweit sie nicht Befriedigung verlangen können. Dieses Recht steht den Gläubigern jedoch nur zu, wenn sie glaubhaft machen, dass durch die Verschmelzung die Erfüllung ihrer Forderung gefährdet wird."
    },
    {
      "date": "2024-12-16",
      "id": "96573",
      "original_text": "Registerbekanntmachung nach dem Umwandlungsgesetz\nNordrhein-Westfalen Amtsgericht Essen HRA 11818\nGALERIA S.à r.l. & Co. KG – Essen",
      "type": "Registerbekanntmachung nach dem Umwandlungsgesetz",
      "state": "Nordrhein-Westfalen",
      "amtsgericht": "Amtsgericht Essen",
      "registernummer": "HRA 11818",
      "registerart": "HRA",
      "company_name": "GALERIA S.à r.l. & Co. KG",
      "company_seat": "Essen",
      "details": "16.12.2024 (Bekanntmachungsdatum)\n\nNordrhein-Westfalen Amtsgericht Essen HRA 11818\nRegisterbekanntmachung nach dem Umwandlungsgesetz 16.12.2024 (Eintragungsdatum)\n\nGALERIA S.à r.l. & Co. KG\nKommanditgesellschaft\nEssen\n\nDen Gläubigern der an der Ausgliederung beteiligten Rechtsträger ist, wenn sie binnen sechs Monaten nach dem Tag, an dem die Eintragung der Ausgliederung in das Register des Sitzes desjenigen Rechtsträgers, dessen Gläubiger sie sind, nach § 19 Absatz 3 UmwG als bekanntgemacht gilt, ihren Anspruch nach Grund und Höhe schriftlich anmelden, Sicherheit zu leisten, soweit sie nicht Befriedigung verlangen können. Dieses Recht steht den Gläubigern jedoch nur zu, wenn sie glaubhaft machen, dass durch die Ausgliederung die Erfüllung ihrer Forderung gefährdet wird."
    },
    {
      "date": "2024-12-16",
      "id": "96574",
      "original_text": "Löschungsankündigung\nNordrhein-Westfalen Amtsgericht Hamm HRB 11392\nTransporte CA GmbH – Unna",
      "type": "Löschungsankündigung",
      "state": "Nordrhein-Westfalen",
      "amtsgericht": "Amtsgericht Hamm",
      "registernummer": "HRB 11392",
      "registerart": "HRB",
      "company_name": "Transporte CA GmbH",
      "company_seat": "Unna",
      "details": "16.12.2024 (Bekanntmachungsdatum)\n\nNordrhein-Westfalen Amtsgericht Hamm HRB 11392\nLöschungsankündigung\n\nTransporte CA GmbH\nGesellschaft mit beschränkter Haftung\nUnna\n\nDas Registergericht beabsichtigt die Gesellschaft von Amts wegen nach § 394 FamFG zu löschen. Die Frist zur Erhebung eines Widerspruchs ist auf drei Monate festgesetzt."
    },
    {
      "date": "2024-12-16",
      "id": "96575",
      "original_text": "Registerbekanntmachung nach dem Umwandlungsgesetz\nNordrhein-Westfalen Amtsgericht Paderborn GsR 45\nRichter & Sperling eGbR – Willebadessen",
      "type": "Registerbekanntmachung nach dem Umwandlungsgesetz",
      "state": "Nordrhein-Westfalen",
      "amtsgericht": "Amtsgericht Paderborn",
      "registernummer": "GsR 45",
      "registerart": "GsR",
      "company_name": "Richter & Sperling eGbR",
      "company_seat": "Willebadessen",
      "details": "16.12.2024 (Bekanntmachungsdatum)\n\nNordrhein-Westfalen Amtsgericht Paderborn GsR 45\nRegisterbekanntmachung nach dem Umwandlungsgesetz 16.12.2024 (Eintragungsdatum)\n\nRichter & Sperling eGbR\nGesellschaft bürgerlichen Rechts\nWillebadessen\n\nDen Gläubigern der an der formwechselnden Umwandlung beteiligten Rechtsträger ist, wenn sie binnen sechs Monaten nach dem Tag, an dem die Eintragung der formwechselnden Umwandlung in das Register des Sitzes desjenigen Rechtsträgers, dessen Gläubiger sie sind, nach § 19 Absatz 3 UmwG als bekanntgemacht gilt, ihren Anspruch nach Grund und Höhe schriftlich anmelden, Sicherheit zu leisten, soweit sie nicht Befriedigung verlangen können. Dieses Recht steht den Gläubigern jedoch nur zu, wenn sie glaubhaft machen, dass durch die formwechselnden Umwandlung die Erfüllung ihrer Forderung gefährdet wird."
    },
    {
      "date": "2024-12-16",
      "id": "96576",
      "original_text": "Sonstige Registerbekanntmachung\nNordrhein-Westfalen Amtsgericht Siegen HRB 13619\nBreitband Kreuztal GmbH – Kreuztal",
      "type": "Sonstige Registerbekanntmachung",
      "state": "Nordrhein-Westfalen",
      "amtsgericht": "Amtsgericht Siegen",
      "registernummer": "HRB 13619",
      "registerart": "HRB",
      "company_name": "Breitband Kreuztal GmbH",
      "company_seat": "Kreuztal",
      "details": "16.12.2024 (Bekanntmachungsdatum)\n\nNordrhein-Westfalen Amtsgericht Siegen HRB 13619\nSonstige Registerbekanntmachung\n\nBreitband Kreuztal GmbH\nGesellschaft mit beschränkter Haftung\nKreuztal\n\nDem Registergericht wurde eine geänderte Liste des Aufsichtsrates vom 10.12.2024 eingereicht."
    },
    {
      "date": "2024-12-16",
      "id": "96577",
      "original_text": "Löschungsankündigung\nNordrhein-Westfalen Amtsgericht Düsseldorf HRB 89650\nCELEST GmbH – Düsseldorf",
      "type": "Löschungsankündigung",
      "state": "Nordrhein-Westfalen",
      "amtsgericht": "Amtsgericht Düsseldorf",
      "registernummer": "HRB 89650",
      "registerart": "HRB",
      "company_name": "CELEST GmbH",
      "company_seat": "Düsseldorf",
      "details": "16.12.2024 (Bekanntmachungsdatum)\n\nNordrhein-Westfalen Amtsgericht Düsseldorf HRB 89650\nLöschungsankündigung\n\nCELEST GmbH\nGesellschaft mit beschränkter Haftung\nDüsseldorf\n\nDas Registergericht beabsichtigt die Gesellschaft von Amts wegen nach § 394 Abs. 1 FamFG zu löschen. Die Frist zur Erhebung eines Widerspruchs ist auf 3 Wochen festgesetzt.\n\nRechtsbehelfsbelehrung:\nDas Widerspruchsrecht steht jedem zu, der an der Unterlassung der Löschung ein berechtigtes Interesse hat. Der Widerspruch ist bei dem Amtsgericht Düsseldorf -Registergericht-, Werdener Straße 1, 40227 Düsseldorf schriftlich in deutscher Sprache oder zur Niederschrift der Geschäftsstelle einzulegen. Der Widerspruch kann auch zur Niederschrift der Geschäftsstelle eines jeden Amtsgerichtes abgegeben werden. Die Einlegung ist auch durch Übertragung eines elektronischen Dokuments an die elektronische Poststelle des Gerichts möglich. Das elektronische Dokument muss für die Bearbeitung durch das Gericht geeignet und mit einer qualifizierten elektronischen Signatur der verantwortenden Person versehen sein oder von der verantwortenden Person signiert und auf einem sicheren Übermittlungsweg gemäß § 130a ZPO nach näherer Maßgabe der Verordnung über die technischen Rahmenbedingungen des elektronischen Rechtsverkehrs und über das besondere elektronische Behördenpostfach (BGBl. I, S.3803) eingereicht werden. Weitere Informationen erhalten Sie auf der Internetseite www.justiz.de.\nDer Widerspruch muss spätestens innerhalb der gesetzten Frist nach dem Datum der Bekanntmachung der Löschungsankündigung bei dem Amtsgericht - Registergericht - Düsseldorf eingegangen sein.  Dies gilt auch dann, wenn der Widerspruch zur Niederschrift der Geschäftsstelle eines anderen Amtsgerichtes abgegeben wurde. Die Frist beginnt mit dem Tage der Bekanntmachung der Löschungsankündigung in dem für die Bekanntmachung der Eintragungen in das Handelsregister bestimmten elektronischen Informations- und Kommunikationssystem nach § 10 des Handelsgesetzbuches. Fällt das Ende der Frist auf einen Sonntag, einen allgemeinen Feiertag oder Sonnabend, so endet die Frist mit Ablauf des nächsten Werktages.\nDer Widerspruch muss die Bezeichnung der angefochtenen Löschungsankündigung sowie die Erklärung enthalten, dass Widerspruch gegen diese Löschungsankündigung eingelegt wird. Er ist zu unterzeichnen und soll begründet werden."
    },
    {
      "date": "2024-12-16",
      "id": "96578",
      "original_text": "Löschungsankündigung\nNordrhein-Westfalen Amtsgericht Düsseldorf HRB 81940\nDESEN LifeTech GmbH – Düsseldorf",
      "type": "Löschungsankündigung",
      "state": "Nordrhein-Westfalen",
      "amtsgericht": "Amtsgericht Düsseldorf",
      "registernummer": "HRB 81940",
      "registerart": "HRB",
      "company_name": "DESEN LifeTech GmbH",
      "company_seat": "Düsseldorf",
      "details": "16.12.2024 (Bekanntmachungsdatum)\n\nNordrhein-Westfalen Amtsgericht Düsseldorf HRB 81940\nLöschungsankündigung\n\nDESEN LifeTech GmbH\nGesellschaft mit beschränkter Haftung\nDüsseldorf\n\nDas Registergericht beabsichtigt die Gesellschaft von Amts wegen nach § 394 Abs. 1 FamFG zu löschen. Die Frist zur Erhebung eines Widerspruchs ist auf 3 Wochen festgesetzt.\n\nRechtsbehelfsbelehrung:\nDas Widerspruchsrecht steht jedem zu, der an der Unterlassung der Löschung ein berechtigtes Interesse hat. Der Widerspruch ist bei dem Amtsgericht Düsseldorf -Registergericht-, Werdener Straße 1, 40227 Düsseldorf schriftlich in deutscher Sprache oder zur Niederschrift der Geschäftsstelle einzulegen. Der Widerspruch kann auch zur Niederschrift der Geschäftsstelle eines jeden Amtsgerichtes abgegeben werden. Die Einlegung ist auch durch Übertragung eines elektronischen Dokuments an die elektronische Poststelle des Gerichts möglich. Das elektronische Dokument muss für die Bearbeitung durch das Gericht geeignet und mit einer qualifizierten elektronischen Signatur der verantwortenden Person versehen sein oder von der verantwortenden Person signiert und auf einem sicheren Übermittlungsweg gemäß § 130a ZPO nach näherer Maßgabe der Verordnung über die technischen Rahmenbedingungen des elektronischen Rechtsverkehrs und über das besondere elektronische Behördenpostfach (BGBl. I, S.3803) eingereicht werden. Weitere Informationen erhalten Sie auf der Internetseite www.justiz.de.\nDer Widerspruch muss spätestens innerhalb der gesetzten Frist nach dem Datum der Bekanntmachung der Löschungsankündigung bei dem Amtsgericht - Registergericht - Düsseldorf eingegangen sein.  Dies gilt auch dann, wenn der Widerspruch zur Niederschrift der Geschäftsstelle eines anderen Amtsgerichtes abgegeben wurde. Die Frist beginnt mit dem Tage der Bekanntmachung der Löschungsankündigung in dem für die Bekanntmachung der Eintragungen in das Handelsregister bestimmten elektronischen Informations- und Kommunikationssystem nach § 10 des Handelsgesetzbuches. Fällt das Ende der Frist auf einen Sonntag, einen allgemeinen Feiertag oder Sonnabend, so endet die Frist mit Ablauf des nächsten Werktages.\nDer Widerspruch muss die Bezeichnung der angefochtenen Löschungsankündigung sowie die Erklärung enthalten, dass Widerspruch gegen diese Löschungsankündigung eingelegt wird. Er ist zu unterzeichnen und soll begründet werden."
    },
    {
      "date": "2024-12-16",
      "id": "96579",
      "original_text": "Einreichung neuer Dokumente\nNordrhein-Westfalen Amtsgericht Münster HRB 6194\nDFMG Deutsche Funkturm GmbH – Münster",
      "type": "Einreichung neuer Dokumente",
      "state": "Nordrhein-Westfalen",
      "amtsgericht": "Amtsgericht Münster",
      "registernummer": "HRB 6194",
      "registerart": "HRB",
      "company_name": "DFMG Deutsche Funkturm GmbH",
      "company_seat": "Münster",
      "details": "16.12.2024 (Bekanntmachungsdatum)\n\nNordrhein-Westfalen Amtsgericht Münster HRB 6194\nEinreichung neuer Dokumente\n\nDFMG Deutsche Funkturm GmbH\nGesellschaft mit beschränkter Haftung\nMünster\n\nDem Registergericht ist eine Liste der Mitglieder des Aufsichtsrates eingereicht worden."
    },
    {
      "date": "2024-12-16",
      "id": "96580",
      "original_text": "Löschungsankündigung\nNordrhein-Westfalen Amtsgericht Düsseldorf HRB 25354\nEdgar Hülsmeyer Maschinenbau GmbH – Düsseldorf",
      "type": "Löschungsankündigung",
      "state": "Nordrhein-Westfalen",
      "amtsgericht": "Amtsgericht Düsseldorf",
      "registernummer": "HRB 25354",
      "registerart": "HRB",
      "company_name": "Edgar Hülsmeyer Maschinenbau GmbH",
      "company_seat": "Düsseldorf",
      "details": "16.12.2024 (Bekanntmachungsdatum)\n\nNordrhein-Westfalen Amtsgericht Düsseldorf HRB 25354\nLöschungsankündigung\n\nEdgar Hülsmeyer Maschinenbau GmbH\nGesellschaft mit beschränkter Haftung\nDüsseldorf\n\nDas Registergericht beabsichtigt die Gesellschaft von Amts wegen nach § 394 FamFG zu löschen. Die Frist zur Erhebung eines Widerspruchs ist auf einen Monat festgesetzt.\n\nRechtsbehelfsbelehrung:\nDas Widerspruchsrecht steht jedem zu, der an der Unterlassung der Löschung ein berechtigtes Interesse hat. Der Widerspruch ist bei dem Amtsgericht Düsseldorf -Registergericht-, Werdener Straße 1, 40227 Düsseldorf schriftlich in deutscher Sprache oder zur Niederschrift der Geschäftsstelle einzulegen. Der Widerspruch kann auch zur Niederschrift der Geschäftsstelle eines jeden Amtsgerichtes abgegeben werden. Die Einlegung ist auch durch Übertragung eines elektronischen Dokuments an die elektronische Poststelle des Gerichts möglich. Das elektronische Dokument muss für die Bearbeitung durch das Gericht geeignet und mit einer qualifizierten elektronischen Signatur der verantwortenden Person versehen sein oder von der verantwortenden Person signiert und auf einem sicheren Übermittlungsweg gemäß § 130a ZPO nach näherer Maßgabe der Verordnung über die technischen Rahmenbedingungen des elektronischen Rechtsverkehrs und über das besondere elektronische Behördenpostfach (BGBl. I, S.3803) eingereicht werden. Weitere Informationen erhalten Sie auf der Internetseite www.justiz.de.\nDer Widerspruch muss spätestens innerhalb der gesetzten Frist nach dem Datum der Bekanntmachung der Löschungsankündigung bei dem Amtsgericht - Registergericht - Düsseldorf eingegangen sein.  Dies gilt auch dann, wenn der Widerspruch zur Niederschrift der Geschäftsstelle eines anderen Amtsgerichtes abgegeben wurde. Die Frist beginnt mit dem Tage der Bekanntmachung der Löschungsankündigung in dem für die Bekanntmachung der Eintragungen in das Handelsregister bestimmten elektronischen Informations- und Kommunikationssystem nach § 10 des Handelsgesetzbuches. Fällt das Ende der Frist auf einen Sonntag, einen allgemeinen Feiertag oder Sonnabend, so endet die Frist mit Ablauf des nächsten Werktages.\nDer Widerspruch muss die Bezeichnung der angefochtenen Löschungsankündigung sowie die Erklärung enthalten, dass Widerspruch gegen diese Löschungsankündigung eingelegt wird. Er ist zu unterzeichnen und soll begründet werden."
    },
    {
      "date": "2024-12-16",
      "id": "96581",
      "original_text": "Sonstige Registerbekanntmachung\nThüringen Amtsgericht Jena HRB 201015\nWohnbaugesellschaft Kahla Kommunales Wohnungsunternehmen mit beschränkter Haftung – Kahla",
      "type": "Sonstige Registerbekanntmachung",
      "state": "Thüringen",
      "amtsgericht": "Amtsgericht Jena",
      "registernummer": "HRB 201015",
      "registerart": "HRB",
      "company_name": "Wohnbaugesellschaft Kahla Kommunales Wohnungsunternehmen mit beschränkter Haftung",
      "company_seat": "Kahla",
      "details": "16.12.2024 (Bekanntmachungsdatum)\n\nThüringen Amtsgericht Jena HRB 201015\nSonstige Registerbekanntmachung\n\nWohnbaugesellschaft Kahla Kommunales Wohnungsunternehmen mit beschränkter Haftung\nGesellschaft mit beschränkter Haftung\nKahla\n\nBekanntmachung gem. § 52 Abs. 3 Satz 2 GmbHG: Aufgrund einer Veränderung in den Personen der Aufsichtsratsmitglieder ist durch die Geschäftsführer eine neue Liste zum Handelsregister eingereicht worden."
    },
    {
      "date": "2024-12-16",
      "id": "96582",
      "original_text": "Einreichung neuer Dokumente\nThüringen Amtsgericht Jena HRB 510133\nSCARABAEUS AG – Apolda",
      "type": "Einreichung neuer Dokumente",
      "state": "Thüringen",
      "amtsgericht": "Amtsgericht Jena",
      "registernummer": "HRB 510133",
      "registerart": "HRB",
      "company_name": "SCARABAEUS AG",
      "company_seat": "Apolda",
      "details": "16.12.2024 (Bekanntmachungsdatum)\n\nThüringen Amtsgericht Jena HRB 510133\nEinreichung neuer Dokumente 16.12.2024 (Eintragungsdatum)\n\nSCARABAEUS AG\nAktiengesellschaft\nApolda\n\nBekanntmachung gem. § 106 AktG: Aufgrund einer Veränderung in den Personen der Aufsichtsratsmitglieder ist durch den Vorstand eine neue Liste zum Handelsregister eingereicht worden."
    },
    {
      "date": "2024-12-16",
      "id": "96583",
      "original_text": "Registerbekanntmachung nach dem Umwandlungsgesetz\nHessen Amtsgericht Frankfurt am Main HRB 84097\nAmbrosia Naturkost AG – Frankfurt am Main",
      "type": "Registerbekanntmachung nach dem Umwandlungsgesetz",
      "state": "Hessen",
      "amtsgericht": "Amtsgericht Frankfurt am Main",
      "registernummer": "HRB 84097",
      "registerart": "HRB",
      "company_name": "Ambrosia Naturkost AG",
      "company_seat": "Frankfurt am Main",
      "details": "16.12.2024 (Bekanntmachungsdatum)\n\nHessen Amtsgericht Frankfurt am Main HRB 84097\nRegisterbekanntmachung nach dem Umwandlungsgesetz 16.12.2024 (Eintragungsdatum)\n\nAmbrosia Naturkost AG\nAktiengesellschaft\nFrankfurt am Main\n\nDen Gläubigern der an der Verschmelzung beteiligten Rechtsträger ist, wenn sie binnen sechs Monaten nach dem Tag, an dem die Eintragung der Verschmelzung in das Register des Sitzes desjenigen Rechtsträgers, dessen Gläubiger sie sind, nach § 19 Absatz 3 UmwG bekannt gemacht worden ist, ihren Anspruch nach Grund und Höhe schriftlich anmelden, Sicherheit zu leisten, soweit sie nicht Befriedigung verlangen können. Dieses Recht steht den Gläubigern jedoch nur zu, wenn sie glaubhaft machen, dass durch die Verschmelzung die Erfüllung ihrer Forderung gefährdet wird."
    },
    {
      "date": "2024-12-16",
      "id": "96584",
      "original_text": "Registerbekanntmachung nach dem Umwandlungsgesetz\nHessen Amtsgericht Frankfurt am Main HRB 136921\nAmbrosia Invest AG – Frankfurt am Main",
      "type": "Registerbekanntmachung nach dem Umwandlungsgesetz",
      "state": "Hessen",
      "amtsgericht": "Amtsgericht Frankfurt am Main",
      "registernummer": "HRB 136921",
      "registerart": "HRB",
      "company_name": "Ambrosia Invest AG",
      "company_seat": "Frankfurt am Main",
      "details": "16.12.2024 (Bekanntmachungsdatum)\n\nHessen Amtsgericht Frankfurt am Main HRB 136921\nRegisterbekanntmachung nach dem Umwandlungsgesetz 16.12.2024 (Eintragungsdatum)\n\nAmbrosia Invest AG\nAktiengesellschaft\nFrankfurt am Main\n\nDen Gläubigern der an der Verschmelzung beteiligten Rechtsträger ist, wenn sie binnen sechs Monaten nach dem Tag, an dem die Eintragung der Verschmelzung in das Register des Sitzes desjenigen Rechtsträgers, dessen Gläubiger sie sind, nach § 19 Absatz 3 UmwG bekannt gemacht worden ist, ihren Anspruch nach Grund und Höhe schriftlich anmelden, Sicherheit zu leisten, soweit sie nicht Befriedigung verlangen können. Dieses Recht steht den Gläubigern jedoch nur zu, wenn sie glaubhaft machen, dass durch die Verschmelzung die Erfüllung ihrer Forderung gefährdet wird."
    },
    {
      "date": "2024-12-16",
      "id": "96585",
      "original_text": "Registerbekanntmachung nach dem Umwandlungsgesetz\nHessen Amtsgericht Offenbach am Main HRA 42990\nHEWAKS Meisterbetrieb e. K. – Rödermark",
      "type": "Registerbekanntmachung nach dem Umwandlungsgesetz",
      "state": "Hessen",
      "amtsgericht": "Amtsgericht Offenbach am Main",
      "registernummer": "HRA 42990",
      "registerart": "HRA",
      "company_name": "HEWAKS Meisterbetrieb e. K.",
      "company_seat": "Rödermark",
      "details": "16.12.2024 (Bekanntmachungsdatum)\n\nHessen Amtsgericht Offenbach am Main HRA 42990\nRegisterbekanntmachung nach dem Umwandlungsgesetz 15.12.2024 (Eintragungsdatum)\n\nHEWAKS Meisterbetrieb e. K.\nEinzelkaufmann / Einzelkauffrau\nRödermark\n\nDen Gläubigern der an der Ausgliederung beteiligten Rechtsträger ist, wenn sie binnen sechs Monaten nach dem Tag, an dem die Eintragung der Ausgliederung in das Register des Sitzes desjenigen Rechtsträgers, dessen Gläubiger sie sind, nach §§ 125, 19 Absatz 3 UmwG bekannt gemacht worden ist, ihren Anspruch nach Grund und Höhe schriftlich anmelden, Sicherheit zu leisten, soweit sie nicht Befriedigung verlangen können. Dieses Recht steht den Gläubigern jedoch nur zu, wenn sie glaubhaft machen, dass durch die Ausgliederung die Erfüllung ihrer Forderung gefährdet wird."
    },
    {
      "date": "2024-12-16",
      "id": "96586",
      "original_text": "Löschungsankündigung\nHessen Amtsgericht Frankfurt am Main HRB 118061\nWegner Holding Ventures UG (haftungsbeschränkt) – Frankfurt am Main",
      "type": "Löschungsankündigung",
      "state": "Hessen",
      "amtsgericht": "Amtsgericht Frankfurt am Main",
      "registernummer": "HRB 118061",
      "registerart": "HRB",
      "company_name": "Wegner Holding Ventures UG (haftungsbeschränkt)",
      "company_seat": "Frankfurt am Main",
      "details": "16.12.2024 (Bekanntmachungsdatum)\n\nHessen Amtsgericht Frankfurt am Main HRB 118061\nLöschungsankündigung\n\nWegner Holding Ventures UG (haftungsbeschränkt)\nGesellschaft mit beschränkter Haftung\nFrankfurt am Main\n\nEs ist beabsichtigt, die Gesellschaft wegen Vermögenslosigkeit gemäß § 394 FamFG von Amts wegen im Handelsregister zu löschen. Hiergegen kann innerhalb eines Monats nach dieser Veröffentlichung Widerspruch bei dem Amtsgericht Frankfurt am Main eingelegt werden."
    },
    {
      "date": "2024-12-16",
      "id": "96587",
      "original_text": "Einreichung neuer Dokumente\nHessen Amtsgericht Frankfurt am Main HRB 49421\nEintracht Frankfurt Fußball Aktiengesellschaft – Frankfurt am Main",
      "type": "Einreichung neuer Dokumente",
      "state": "Hessen",
      "amtsgericht": "Amtsgericht Frankfurt am Main",
      "registernummer": "HRB 49421",
      "registerart": "HRB",
      "company_name": "Eintracht Frankfurt Fußball Aktiengesellschaft",
      "company_seat": "Frankfurt am Main",
      "details": "16.12.2024 (Bekanntmachungsdatum)\n\nHessen Amtsgericht Frankfurt am Main HRB 49421\nEinreichung neuer Dokumente\n\nEintracht Frankfurt Fußball Aktiengesellschaft\nAktiengesellschaft\nFrankfurt am Main\n\nDurch eine Änderung in den Personen der Aufsichtsratsmitglieder ist eine Liste der Mitglieder des Aufsichtsrates zum Handelsregister eingereicht worden."
    },
    {
      "date": "2024-12-16",
      "id": "96588",
      "original_text": "Sonstige Registerbekanntmachung\nHessen Amtsgericht Frankfurt am Main VR 8246\nTennisclub Rot Weiß Eckenheim – Frankfurt am Main",
      "type": "Sonstige Registerbekanntmachung",
      "state": "Hessen",
      "amtsgericht": "Amtsgericht Frankfurt am Main",
      "registernummer": "VR 8246",
      "registerart": "VR",
      "company_name": "Tennisclub Rot Weiß Eckenheim",
      "company_seat": "Frankfurt am Main",
      "details": "16.12.2024 (Bekanntmachungsdatum)\n\nHessen Amtsgericht Frankfurt am Main VR 8246\nSonstige Registerbekanntmachung 16.12.2024 (Eintragungsdatum)\n\nTennisclub Rot Weiß Eckenheim\neingetragener Verein\nFrankfurt am Main\n\nDer Verein ist aufgelöst."
    },
    {
      "date": "2024-12-16",
      "id": "96589",
      "original_text": "Löschungsankündigung\nHessen Amtsgericht Friedberg HRB 8089\nMedizinZentrum Bad Salzhausen GmbH – Nidda",
      "type": "Löschungsankündigung",
      "state": "Hessen",
      "amtsgericht": "Amtsgericht Friedberg",
      "registernummer": "HRB 8089",
      "registerart": "HRB",
      "company_name": "MedizinZentrum Bad Salzhausen GmbH",
      "company_seat": "Nidda",
      "details": "16.12.2024 (Bekanntmachungsdatum)\n\nHessen Amtsgericht Friedberg HRB 8089\nLöschungsankündigung\n\nMedizinZentrum Bad Salzhausen GmbH\nGesellschaft mit beschränkter Haftung\nNidda\n\nDas Registergericht beabsichtigt die im Handelsregister eingetragene Gesellschaft von Amts wegen nach § 394 FamFG zu löschen. Die Frist zur Erhebung eines Widerspruchs gegen die beabsichtigte Löschung wird auf 3 Monate festgesetzt."
    },
    {
      "date": "2024-12-16",
      "id": "96590",
      "original_text": "Registerbekanntmachung nach dem Umwandlungsgesetz\nHessen Amtsgericht Hanau HRB 12922\nBan Consult & Asset Management GmbH – Freigericht",
      "type": "Registerbekanntmachung nach dem Umwandlungsgesetz",
      "state": "Hessen",
      "amtsgericht": "Amtsgericht Hanau",
      "registernummer": "HRB 12922",
      "registerart": "HRB",
      "company_name": "Ban Consult & Asset Management GmbH",
      "company_seat": "Freigericht",
      "details": "16.12.2024 (Bekanntmachungsdatum)\n\nHessen Amtsgericht Hanau HRB 12922\nRegisterbekanntmachung nach dem Umwandlungsgesetz 16.12.2024 (Eintragungsdatum)\n\nBan Consult & Asset Management GmbH\nGesellschaft mit beschränkter Haftung\nFreigericht\n\nDen Gläubigern der an der Verschmelzung beteiligten Rechtsträger ist, wenn sie binnen sechs Monaten nach dem Tag, an dem die Eintragung der Verschmelzung in das Register des Sitzes desjenigen Rechtsträgers, dessen Gläubiger sie sind, nach § 19 Absatz 3 UmwG bekannt gemacht worden ist, ihren Anspruch nach Grund und Höhe schriftlich anmelden, Sicherheit zu leisten, soweit sie nicht Befriedigung verlangen können. Dieses Recht steht den Gläubigern jedoch nur zu, wenn sie glaubhaft machen, dass durch die Verschmelzung die Erfüllung ihrer Forderung gefährdet wird."
    },
    {
      "date": "2024-12-16",
      "id": "96591",
      "original_text": "Einreichung neuer Dokumente\nHessen Amtsgericht Frankfurt am Main HRB 7688\n\"Treuhandgesellschaft für die Südwestdeutsche Wohnungswirtschaft mbH\" – Frankfurt am Main",
      "type": "Einreichung neuer Dokumente",
      "state": "Hessen",
      "amtsgericht": "Amtsgericht Frankfurt am Main",
      "registernummer": "HRB 7688",
      "registerart": "HRB",
      "company_name": "\"Treuhandgesellschaft für die Südwestdeutsche Wohnungswirtschaft mbH\"",
      "company_seat": "Frankfurt am Main",
      "details": "16.12.2024 (Bekanntmachungsdatum)\n\nHessen Amtsgericht Frankfurt am Main HRB 7688\nEinreichung neuer Dokumente\n\n\"Treuhandgesellschaft für die Südwestdeutsche Wohnungswirtschaft mbH\"\nGesellschaft mit beschränkter Haftung\nFrankfurt am Main\n\nDurch eine Änderung in den Personen der Aufsichtsratsmitglieder ist eine Liste der Mitglieder des Aufsichtsrates zum Handelsregister eingereicht worden."
    },
    {
      "date": "2024-12-16",
      "id": "96592",
      "original_text": "Einreichung neuer Dokumente\nHessen Amtsgericht Offenbach am Main HRB 44750\nStadiongesellschaft Bieberer Berg mbH Offenbach – Offenbach am Main",
      "type": "Einreichung neuer Dokumente",
      "state": "Hessen",
      "amtsgericht": "Amtsgericht Offenbach am Main",
      "registernummer": "HRB 44750",
      "registerart": "HRB",
      "company_name": "Stadiongesellschaft Bieberer Berg mbH Offenbach",
      "company_seat": "Offenbach am Main",
      "details": "16.12.2024 (Bekanntmachungsdatum)\n\nHessen Amtsgericht Offenbach am Main HRB 44750\nEinreichung neuer Dokumente 16.12.2024 (Eintragungsdatum)\n\nStadiongesellschaft Bieberer Berg mbH Offenbach\nGesellschaft mit beschränkter Haftung\nOffenbach am Main\n\nDurch eine Änderung in den Personen der Aufsichtsratsmitglieder ist eine Liste der Mitglieder des Aufsichtsrates zum Handelsregister eingereicht worden."
    },
    {
      "date": "2024-12-16",
      "id": "96593",
      "original_text": "Registerbekanntmachung nach dem Umwandlungsgesetz\nHessen Amtsgericht Hanau HRB 13052\nOPM Autovermietung GmbH – Freigericht",
      "type": "Registerbekanntmachung nach dem Umwandlungsgesetz",
      "state": "Hessen",
      "amtsgericht": "Amtsgericht Hanau",
      "registernummer": "HRB 13052",
      "registerart": "HRB",
      "company_name": "OPM Autovermietung GmbH",
      "company_seat": "Freigericht",
      "details": "16.12.2024 (Bekanntmachungsdatum)\n\nHessen Amtsgericht Hanau HRB 13052\nRegisterbekanntmachung nach dem Umwandlungsgesetz 16.12.2024 (Eintragungsdatum)\n\nOPM Autovermietung GmbH\nGesellschaft mit beschränkter Haftung\nFreigericht\n\nDen Gläubigern der an der Verschmelzung beteiligten Rechtsträger ist, wenn sie binnen sechs Monaten nach dem Tag, an dem die Eintragung der Verschmelzung in das Register des Sitzes desjenigen Rechtsträgers, dessen Gläubiger sie sind, nach § 19 Absatz 3 UmwG bekannt gemacht worden ist, ihren Anspruch nach Grund und Höhe schriftlich anmelden, Sicherheit zu leisten, soweit sie nicht Befriedigung verlangen können. Dieses Recht steht den Gläubigern jedoch nur zu, wenn sie glaubhaft machen, dass durch die Verschmelzung die Erfüllung ihrer Forderung gefährdet wird."
    },
    {
      "date": "2024-12-16",
      "id": "96594",
      "original_text": "Einreichung neuer Dokumente\nHessen Amtsgericht Frankfurt am Main HRB 103782\nClariant Plastics & Coatings (Deutschland) GmbH – Frankfurt am Main",
      "type": "Einreichung neuer Dokumente",
      "state": "Hessen",
      "amtsgericht": "Amtsgericht Frankfurt am Main",
      "registernummer": "HRB 103782",
      "registerart": "HRB",
      "company_name": "Clariant Plastics & Coatings (Deutschland) GmbH",
      "company_seat": "Frankfurt am Main",
      "details": "16.12.2024 (Bekanntmachungsdatum)\n\nHessen Amtsgericht Frankfurt am Main HRB 103782\nEinreichung neuer Dokumente\n\nClariant Plastics & Coatings (Deutschland) GmbH\nGesellschaft mit beschränkter Haftung\nFrankfurt am Main\n\nDurch eine Änderung in den Personen der Aufsichtsratsmitglieder ist eine Liste der Mitglieder des Aufsichtsrates zum Handelsregister eingereicht worden."
    },
    {
      "date": "2024-12-16",
      "id": "96595",
      "original_text": "Registerbekanntmachung nach dem Umwandlungsgesetz\nHessen Amtsgericht Frankfurt am Main HRB 112837\nLuneta Fixtures Immobilien GmbH – Frankfurt am Main",
      "type": "Registerbekanntmachung nach dem Umwandlungsgesetz",
      "state": "Hessen",
      "amtsgericht": "Amtsgericht Frankfurt am Main",
      "registernummer": "HRB 112837",
      "registerart": "HRB",
      "company_name": "Luneta Fixtures Immobilien GmbH",
      "company_seat": "Frankfurt am Main",
      "details": "16.12.2024 (Bekanntmachungsdatum)\n\nHessen Amtsgericht Frankfurt am Main HRB 112837\nRegisterbekanntmachung nach dem Umwandlungsgesetz\n\nLuneta Fixtures Immobilien GmbH\nGesellschaft mit beschränkter Haftung\nFrankfurt am Main\n\nEs wird darauf hingewiesen, dass ein Verschmelzungsplan oder sein Entwurf über eine grenzüberschreitende Verschmelzung zur Aufnahme mit der CCP 5 Matrix Holding S.à.r.l mit Sitz in Luxemburg/Luxemburg (Registre de Commerce et des Sociétés B 238972) (société à responsabilité limitée) beim Handelsregister eingereicht worden ist.\nDie Anteilsinhaber, die Gläubiger sowie die zuständigen Betriebsräte der an der grenzüberschreitenden Verschmelzung beteiligten Gesellschaften oder, soweit es keinen Betriebsrat gibt, die Arbeitnehmer der an der grenzüberschreitenden Verschmelzung beteiligten Gesellschaften, können der jeweiligen Gesellschaft spätestens fünf Arbeitstage vor dem Tag der Gesellschafterversammlung Bemerkungen zum Verschmelzungsplan übermitteln.\n\n1.\tAn der Verschmelzung sind\na)\tals übertragende Gesellschaft die Luneta Fixtures Immobilien GmbH, eine Gesellschaft mit beschränkter Haftung deutschen Rechts mit dem Sitz in Frankfurt am Main, Bundesrepublik Deutschland, und\nb)\tals aufnehmende Gesellschaft die CCP 5 Matrix Holding S.à.r.l., eine Gesellschaft mit beschränkter Haftung (société à responsabilité limitée) nach dem Recht von Luxemburg mit Sitz in 1 , Allée Scheffer, L-\n2520 Luxemburg,, Großherzogtum Luxemburg,\n\nbeteiligt.\n2.\tDie Registerdaten der an der Verschmelzung beteiligten Gesellschaften lauten wie folgt:\na)\tDie übertragende Gesellschaft ist eingetragen im Handelsregister des Amtsgerichts Frankfurt am Main unter HRB 112837.\nb)\tDie aufnehmende Gesellschaft ist eingetragen im Handels- und Gesellschaftsregister von Luxemburg (Registre de Commerce et des Sociétés) unter B 238972.\n3.\tDie Anteilsinhaber und Gläubiger der an der grenzüberschreitenden Verschmelzung beteiligten Gesellschaften werden darauf hingewiesen, dass sie der übertragenden Gesellschaft (an c/o btu beraterpartner GmbH Steuerberatergesellschaft, Feldbergstraße 27-29, 61440 Oberursel, Bundesrepublik Deutschland) spätestens fünf Arbeitstage vor der für den 22.01.2025 vorgesehenen Gesellschafterversammlung Bemerkungen zum Verschmelzungsplan übermitteln können."
    },
    {
      "date": "2024-12-16",
      "id": "96596",
      "original_text": "Registerbekanntmachung nach dem Umwandlungsgesetz\nHessen Amtsgericht Frankfurt am Main HRB 76931\nLuneta Köln Immobilien GmbH – Frankfurt am Main",
      "type": "Registerbekanntmachung nach dem Umwandlungsgesetz",
      "state": "Hessen",
      "amtsgericht": "Amtsgericht Frankfurt am Main",
      "registernummer": "HRB 76931",
      "registerart": "HRB",
      "company_name": "Luneta Köln Immobilien GmbH",
      "company_seat": "Frankfurt am Main",
      "details": "16.12.2024 (Bekanntmachungsdatum)\n\nHessen Amtsgericht Frankfurt am Main HRB 76931\nRegisterbekanntmachung nach dem Umwandlungsgesetz\n\nLuneta Köln Immobilien GmbH\nGesellschaft mit beschränkter Haftung\nFrankfurt am Main\n\nDem Registergericht ist der Entwurf eines Verschmelzungsplans über die geplante grenzüberschreitende Verschmelzung der Luneta Köln Immobilien GmbH mit Sitz in Frankfurt am Main (Gesellschaft mit beschränkter Haftung, eingetragen beim Amtsgericht Frankfurt am Main unter der HRB  76931) als übertragender Rechtsträger mit der CCP 5 Matrix Holding S.ä r. l., mit Sitz in Luxemburg, Luxemburg (Societe a responsabilite limitee, eingetragen beim Registre de Commerce et des Societes unter der Registernummer\nB 238972) als übernehmender Rechtsträger eingereicht worden.\nDen Gläubigern der übertragenden Gesellschaft ist Sicherheit zu leisten, wenn sie innerhalb einer Frist von zwei Monaten nach Bekanntmachung des Verschmelzungsplans glaubhaft machen, dass durch die Verschmelzung die Erfüllung ihrer Forderung gefährdet wird. Die Anteilseigner der übertragenden Gesellschaft haben bei grenzüberschreitenden Verschmelzungen einen Anspruch auf angemessene Abfindung, sofern sie der Verschmelzung widersprochen haben; gegebenenfalls steht ihnen auch ein Anspruch auf bare Zuzahlung zu.\nGemäß § 308 UmwG wird bekannt gemacht:\n\n1. Es wird darauf hingewiesen, dass der Entwurf des Verschmelzungsplans beim Handelsregister eingereicht wurde.\n\n2. Die an der grenzüberschreitenden Verschmelzung beteiligten Gesellschaften sind:\na. als übertragende Rechtsträger:\nLuneta Köln Immobilien GmbH, eine Gesellschaft mit beschränkter Haftung nach dem Recht der Bundesrepublik Deutschland (GmbH) mit Sitz in Frankfurt am Main, Deutschland; und\nb. als übernehmender Rechtsträger:\nCCP 5 Matrix Holding S.a r. l., eine Gesellschaft mit beschränkter Haftung (Societe a responsabilite limitee) nach dem Recht des Großherzogtums Luxemburg mit Sitz in 1, Allée Scheffer, L- 2520 Luxemburg, Großherzogtum Luxemburg (\"Übernehmender Rechtsträger\").\nDie Gesellschaften sollen unter Auflösung ohne Abwicklung auf den Übernehmenden Rechtsträger im Wege einer Verschmelzung durch Aufnahme verschmolzen werden.\n3. Die übertragende Gesellschaft ist eingetragen im Handelsregister des Amtsgerichts Frankfurt am Main unter der folgenden Registernummer:\nLuneta Köln Immobilien GmbH: HRB 76931\nDer Übernehmende Rechtsträger ist eingetragen im luxemburgische Handels- und Firmenregister (Registre de Commerce et des Societes) unter der Registernummer B 238972.\n\n4. Der Gesellschafter und die Gläubiger der Gesellschaft (Betriebsräte und Arbeitnehmer gibt es nicht) werden darauf hingewiesen, dass sie der Gesellschaft spätestens fünf Arbeitstage vor dem Tag der Gesellschafterversammlung, die über die Zustimmung zu dem Verschmelzungsplan beschließen soll, Bemerkungen zu dem Verschmelzungsplan(an c/o btu beraterpartner GmbH Steuerberatungsgesellschaft, Feldbergstraße 27-29, 61440 Oberursel (Taunus), Bundesrepublik Deutschland) übermitteln können. Die Gesellschafterversammlung findet am 22. Januar 2025 statt."
    },
    {
      "date": "2024-12-16",
      "id": "96597",
      "original_text": "Registerbekanntmachung nach dem Umwandlungsgesetz\nHessen Amtsgericht Frankfurt am Main HRB 125365\nG63 Beteiligungs GmbH – Frankfurt am Main",
      "type": "Registerbekanntmachung nach dem Umwandlungsgesetz",
      "state": "Hessen",
      "amtsgericht": "Amtsgericht Frankfurt am Main",
      "registernummer": "HRB 125365",
      "registerart": "HRB",
      "company_name": "G63 Beteiligungs GmbH",
      "company_seat": "Frankfurt am Main",
      "details": "16.12.2024 (Bekanntmachungsdatum)\n\nHessen Amtsgericht Frankfurt am Main HRB 125365\nRegisterbekanntmachung nach dem Umwandlungsgesetz 16.12.2024 (Eintragungsdatum)\n\nG63 Beteiligungs GmbH\nGesellschaft mit beschränkter Haftung\nFrankfurt am Main\n\nDen Gläubigern der an der Verschmelzung beteiligten Rechtsträger ist, wenn sie binnen sechs Monaten nach dem Tag, an dem die Eintragung der Verschmelzung in das Register des Sitzes desjenigen Rechtsträgers, dessen Gläubiger sie sind, nach § 19 Absatz 3 UmwG bekannt gemacht worden ist, ihren Anspruch nach Grund und Höhe schriftlich anmelden, Sicherheit zu leisten, soweit sie nicht Befriedigung verlangen können. Dieses Recht steht den Gläubigern jedoch nur zu, wenn sie glaubhaft machen, dass durch die Verschmelzung die Erfüllung ihrer Forderung gefährdet wird."
    },
    {
      "date": "2024-12-16",
      "id": "96598",
      "original_text": "Löschungsankündigung\nHessen Amtsgericht Frankfurt am Main HRA 43868\nViewPoint Growth II Advisory GmbH & Co. KG – Frankfurt am Main",
      "type": "Löschungsankündigung",
      "state": "Hessen",
      "amtsgericht": "Amtsgericht Frankfurt am Main",
      "registernummer": "HRA 43868",
      "registerart": "HRA",
      "company_name": "ViewPoint Growth II Advisory GmbH & Co. KG",
      "company_seat": "Frankfurt am Main",
      "details": "16.12.2024 (Bekanntmachungsdatum)\n\nHessen Amtsgericht Frankfurt am Main HRA 43868\nLöschungsankündigung\n\nViewPoint Growth II Advisory GmbH & Co. KG\nKommanditgesellschaft\nFrankfurt am Main\n\nEs ist beabsichtigt, die Gesellschaft wegen Vermögenslosigkeit gemäß § 394 FamFG von Amts wegen im Handelsregister zu löschen. Hiergegen kann innerhalb eines Monats nach dieser Veröffentlichung Widerspruch bei dem Amtsgericht Frankfurt am Main eingelegt werden."
    },
    {
      "date": "2024-12-16",
      "id": "96599",
      "original_text": "Einreichung neuer Dokumente\nHessen Amtsgericht Frankfurt am Main HRB 91898\nMusashi Europe GmbH – Frankfurt am Main",
      "type": "Einreichung neuer Dokumente",
      "state": "Hessen",
      "amtsgericht": "Amtsgericht Frankfurt am Main",
      "registernummer": "HRB 91898",
      "registerart": "HRB",
      "company_name": "Musashi Europe GmbH",
      "company_seat": "Frankfurt am Main",
      "details": "16.12.2024 (Bekanntmachungsdatum)\n\nHessen Amtsgericht Frankfurt am Main HRB 91898\nEinreichung neuer Dokumente\n\nMusashi Europe GmbH\nGesellschaft mit beschränkter Haftung\nFrankfurt am Main\n\nDurch eine Änderung in den Personen der Aufsichtsratsmitglieder ist eine Liste der Mitglieder des Aufsichtsrates zum Handelsregister eingereicht worden."
    },
    {
      "date": "2024-12-16",
      "id": "96600",
      "original_text": "Löschungsankündigung\nHessen Amtsgericht Frankfurt am Main HRB 104984\nSancare GmbH – Frankfurt am Main",
      "type": "Löschungsankündigung",
      "state": "Hessen",
      "amtsgericht": "Amtsgericht Frankfurt am Main",
      "registernummer": "HRB 104984",
      "registerart": "HRB",
      "company_name": "Sancare GmbH",
      "company_seat": "Frankfurt am Main",
      "details": "16.12.2024 (Bekanntmachungsdatum)\n\nHessen Amtsgericht Frankfurt am Main HRB 104984\nLöschungsankündigung\n\nSancare GmbH\nGesellschaft mit beschränkter Haftung\nFrankfurt am Main\n\nEs ist beabsichtigt, die Gesellschaft wegen Vermögenslosigkeit gemäß § 394 FamFG von Amts wegen im Handelsregister zu löschen. Hiergegen kann innerhalb eines Monats nach dieser Veröffentlichung Widerspruch bei dem Amtsgericht Frankfurt am Main eingelegt werden."
    },
    {
      "date": "2024-12-16",
      "id": "96601",
      "original_text": "Registerbekanntmachung nach dem Umwandlungsgesetz\nHessen Amtsgericht Offenbach am Main HRB 57419\nHEWAKS Meisterbetrieb GmbH – Rödermark",
      "type": "Registerbekanntmachung nach dem Umwandlungsgesetz",
      "state": "Hessen",
      "amtsgericht": "Amtsgericht Offenbach am Main",
      "registernummer": "HRB 57419",
      "registerart": "HRB",
      "company_name": "HEWAKS Meisterbetrieb GmbH",
      "company_seat": "Rödermark",
      "details": "16.12.2024 (Bekanntmachungsdatum)\n\nHessen Amtsgericht Offenbach am Main HRB 57419\nRegisterbekanntmachung nach dem Umwandlungsgesetz 15.12.2024 (Eintragungsdatum)\n\nHEWAKS Meisterbetrieb GmbH\nGesellschaft mit beschränkter Haftung\nRödermark\n\nDen Gläubigern der an der Ausgliederung beteiligten Rechtsträger ist, wenn sie binnen sechs Monaten nach dem Tag, an dem die Eintragung der Ausgliederung in das Register des Sitzes desjenigen Rechtsträgers, dessen Gläubiger sie sind, nach §§ 125, 19 Absatz 3 UmwG bekannt gemacht worden ist, ihren Anspruch nach Grund und Höhe schriftlich anmelden, Sicherheit zu leisten, soweit sie nicht Befriedigung verlangen können. Dieses Recht steht den Gläubigern jedoch nur zu, wenn sie glaubhaft machen, dass durch die Ausgliederung die Erfüllung ihrer Forderung gefährdet wird."
    },
    {
      "date": "2024-12-16",
      "id": "96602",
      "original_text": "Sonstige Registerbekanntmachung\nHessen Amtsgericht Kassel VR 5337\nSeekers e.V. – Kassel",
      "type": "Sonstige Registerbekanntmachung",
      "state": "Hessen",
      "amtsgericht": "Amtsgericht Kassel",
      "registernummer": "VR 5337",
      "registerart": "VR",
      "company_name": "Seekers e.V.",
      "company_seat": "Kassel",
      "details": "16.12.2024 (Bekanntmachungsdatum)\n\nHessen Amtsgericht Kassel VR 5337\nSonstige Registerbekanntmachung 16.12.2024 (Eintragungsdatum)\n\nSeekers e.V.\neingetragener Verein\nKassel\n\nDer Verein ist aufgelöst."
    }
  ]
}