{
  "date": "2024-12-07",
  "date_of_scrape": "2024-12-08T04:02:34.982Z",
  "tool_version": "0.2.0",
  "number_of_announcements": 13,
  "announcements": [
    {
      "date": "2024-12-07",
      "id": "95702",
      "original_text": "Sonstige Registerbekanntmachung\nBayern Amtsgericht Bayreuth HRB 7350\nHECO TEXTILVERLAG GmbH – Kulmbach",
      "type": "Sonstige Registerbekanntmachung",
      "state": "Bayern",
      "amtsgericht": "Amtsgericht Bayreuth",
      "registernummer": "HRB 7350",
      "registerart": "HRB",
      "company_name": "HECO TEXTILVERLAG GmbH",
      "company_seat": "Kulmbach",
      "details": "07.12.2024 (Bekanntmachungsdatum)\n\nBayern Amtsgericht Bayreuth HRB 7350\nSonstige Registerbekanntmachung 06.12.2024 (Eintragungsdatum)\n\nHECO TEXTILVERLAG GmbH\nGesellschaft mit beschränkter Haftung\nKulmbach\n\nDen Gläubigern der an der Verschmelzung beteiligten Rechtsträger ist, wenn sie binnen sechs Monaten nach dem Tag, an dem die Eintragung der Verschmelzung in das Register des Sitzes desjenigen Rechtsträgers, dessen Gläubiger sie sind, nach § 19 Abs. 3 UmwG als bekannt gemacht gilt, ihren Anspruch nach Grund und Höhe schriftlich anmelden, Sicherheit zu leisten, soweit sie nicht Befriedigung verlangen können. Dieses Recht steht den Gläubigern jedoch nur zu, wenn sie glaubhaft machen, dass durch die Verschmelzung die Erfüllung ihrer Forderung gefährdet wird."
    },
    {
      "date": "2024-12-07",
      "id": "95703",
      "original_text": "Registerbekanntmachung nach dem Umwandlungsgesetz\nBayern Amtsgericht München HRB 192312\nPRIME Selfstorage GmbH – Gräfelfing",
      "type": "Registerbekanntmachung nach dem Umwandlungsgesetz",
      "state": "Bayern",
      "amtsgericht": "Amtsgericht München",
      "registernummer": "HRB 192312",
      "registerart": "HRB",
      "company_name": "PRIME Selfstorage GmbH",
      "company_seat": "Gräfelfing",
      "details": "07.12.2024 (Bekanntmachungsdatum)\n\nBayern Amtsgericht München HRB 192312\nRegisterbekanntmachung nach dem Umwandlungsgesetz 06.12.2024 (Eintragungsdatum)\n\nPRIME Selfstorage GmbH\nGesellschaft mit beschränkter Haftung\nGräfelfing\n\nDen Gläubigern der an der Verschmelzung beteiligten Rechtsträger ist, wenn sie binnen sechs Monaten nach dem Tag, an dem die Eintragung der Verschmelzung in das Register des Sitzes desjenigen Rechtsträgers, dessen Gläubiger sie sind, nach § 19 Abs. 3 UmwG als bekannt gemacht gilt, ihren Anspruch nach Grund und Höhe schriftlich anmelden, Sicherheit zu leisten, soweit sie nicht Befriedigung verlangen können. Dieses Recht steht den Gläubigern jedoch nur zu, wenn sie glaubhaft machen, dass durch die Verschmelzung die Erfüllung ihrer Forderung gefährdet wird."
    },
    {
      "date": "2024-12-07",
      "id": "95704",
      "original_text": "Registerbekanntmachung nach dem Umwandlungsgesetz\nBayern Amtsgericht München HRB 222480\ndiva-e Digital Value Excellence GmbH – München",
      "type": "Registerbekanntmachung nach dem Umwandlungsgesetz",
      "state": "Bayern",
      "amtsgericht": "Amtsgericht München",
      "registernummer": "HRB 222480",
      "registerart": "HRB",
      "company_name": "diva-e Digital Value Excellence GmbH",
      "company_seat": "München",
      "details": "07.12.2024 (Bekanntmachungsdatum)\n\nBayern Amtsgericht München HRB 222480\nRegisterbekanntmachung nach dem Umwandlungsgesetz 06.12.2024 (Eintragungsdatum)\n\ndiva-e Digital Value Excellence GmbH\nGesellschaft mit beschränkter Haftung\nMünchen\n\nDen Gläubigern der an der Verschmelzung beteiligten Rechtsträger ist, wenn sie binnen sechs Monaten nach dem Tag, an dem die Eintragung der Verschmelzung in das Register des Sitzes desjenigen Rechtsträgers, dessen Gläubiger sie sind, nach § 19 Abs. 3 UmwG als bekannt gemacht gilt, ihren Anspruch nach Grund und Höhe schriftlich anmelden, Sicherheit zu leisten, soweit sie nicht Befriedigung verlangen können. Dieses Recht steht den Gläubigern jedoch nur zu, wenn sie glaubhaft machen, dass durch die Verschmelzung die Erfüllung ihrer Forderung gefährdet wird."
    },
    {
      "date": "2024-12-07",
      "id": "95705",
      "original_text": "Löschungsankündigung\nBayern Amtsgericht München HRB 280618\nMisiura Beteiligungs-GmbH – Buch a.Buchrain",
      "type": "Löschungsankündigung",
      "state": "Bayern",
      "amtsgericht": "Amtsgericht München",
      "registernummer": "HRB 280618",
      "registerart": "HRB",
      "company_name": "Misiura Beteiligungs-GmbH",
      "company_seat": "Buch a.Buchrain",
      "details": "07.12.2024 (Bekanntmachungsdatum)\n\nBayern Amtsgericht München HRB 280618\nLöschungsankündigung 05.12.2024 (Eintragungsdatum)\n\nMisiura Beteiligungs-GmbH\nGesellschaft mit beschränkter Haftung\nBuch a.Buchrain\n\nDas Registergericht beabsichtigt, die im Handelsregister eingetragene Gesellschaft wegen Vermögenslosigkeit von Amts wegen nach § 394 FamFG zu löschen. Die Frist zur Erhebung eines Widerspruchs ist auf drei Monate festgesetzt."
    },
    {
      "date": "2024-12-07",
      "id": "95706",
      "original_text": "Registerbekanntmachung nach dem Umwandlungsgesetz\nBayern Amtsgericht Regensburg HRB 12587\nPHYSIO GmbH – Regensburg",
      "type": "Registerbekanntmachung nach dem Umwandlungsgesetz",
      "state": "Bayern",
      "amtsgericht": "Amtsgericht Regensburg",
      "registernummer": "HRB 12587",
      "registerart": "HRB",
      "company_name": "PHYSIO GmbH",
      "company_seat": "Regensburg",
      "details": "07.12.2024 (Bekanntmachungsdatum)\n\nBayern Amtsgericht Regensburg HRB 12587\nRegisterbekanntmachung nach dem Umwandlungsgesetz 06.12.2024 (Eintragungsdatum)\n\nPHYSIO GmbH\nGesellschaft mit beschränkter Haftung\nRegensburg\n\nDen Gläubigern der an der Verschmelzung beteiligten Rechtsträger ist, wenn sie binnen sechs Monaten nach dem Tag, an dem die Eintragung der Verschmelzung in das Register des Sitzes desjenigen Rechtsträgers, dessen Gläubiger sie sind, nach § 19 Abs. 3 UmwG als bekannt gemacht gilt, ihren Anspruch nach Grund und Höhe schriftlich anmelden, Sicherheit zu leisten, soweit sie nicht Befriedigung verlangen können. Dieses Recht steht den Gläubigern jedoch nur zu, wenn sie glaubhaft machen, dass durch die Verschmelzung die Erfüllung ihrer Forderung gefährdet wird."
    },
    {
      "date": "2024-12-07",
      "id": "95707",
      "original_text": "Registerbekanntmachung nach dem Umwandlungsgesetz\nBayern Amtsgericht München HRB 4834\nBavaria Film GmbH – München",
      "type": "Registerbekanntmachung nach dem Umwandlungsgesetz",
      "state": "Bayern",
      "amtsgericht": "Amtsgericht München",
      "registernummer": "HRB 4834",
      "registerart": "HRB",
      "company_name": "Bavaria Film GmbH",
      "company_seat": "München",
      "details": "07.12.2024 (Bekanntmachungsdatum)\n\nBayern Amtsgericht München HRB 4834\nRegisterbekanntmachung nach dem Umwandlungsgesetz 06.12.2024 (Eintragungsdatum)\n\nBavaria Film GmbH\nGesellschaft mit beschränkter Haftung\nMünchen\n\nDen Gläubigern der an der Verschmelzung beteiligten Rechtsträger ist, wenn sie binnen sechs Monaten nach dem Tag, an dem die Eintragung der Verschmelzung in das Register des Sitzes desjenigen Rechtsträgers, dessen Gläubiger sie sind, nach § 19 Abs. 3 UmwG als bekannt gemacht gilt, ihren Anspruch nach Grund und Höhe schriftlich anmelden, Sicherheit zu leisten, soweit sie nicht Befriedigung verlangen können. Dieses Recht steht den Gläubigern jedoch nur zu, wenn sie glaubhaft machen, dass durch die Verschmelzung die Erfüllung ihrer Forderung gefährdet wird."
    },
    {
      "date": "2024-12-07",
      "id": "95708",
      "original_text": "Registerbekanntmachung nach dem Umwandlungsgesetz\nBayern Amtsgericht München HRB 272431\nloahoku GmbH – Ismaning",
      "type": "Registerbekanntmachung nach dem Umwandlungsgesetz",
      "state": "Bayern",
      "amtsgericht": "Amtsgericht München",
      "registernummer": "HRB 272431",
      "registerart": "HRB",
      "company_name": "loahoku GmbH",
      "company_seat": "Ismaning",
      "details": "07.12.2024 (Bekanntmachungsdatum)\n\nBayern Amtsgericht München HRB 272431\nRegisterbekanntmachung nach dem Umwandlungsgesetz 06.12.2024 (Eintragungsdatum)\n\nloahoku GmbH\nGesellschaft mit beschränkter Haftung\nIsmaning\n\nDen Gläubigern des formwechselnden Rechtsträgers ist, wenn sie binnen sechs Monaten nach dem Tag, an dem die Eintragung des Formwechsels nach § 201 UmwG als bekannt gemacht gilt, ihren Anspruch nach Grund und Höhe schriftlich anmelden, Sicherheit zu leisten, soweit sie nicht Befriedigung verlangen können. Dieses Recht steht den Gläubigern jedoch nur zu, wenn sie glaubhaft machen, dass durch den Formwechsel die Erfüllung ihrer Forderung gefährdet wird."
    },
    {
      "date": "2024-12-07",
      "id": "95709",
      "original_text": "Einreichung neuer Dokumente\nBayern Amtsgericht Hof HRB 1895\nVishay Electronic GmbH – Selb",
      "type": "Einreichung neuer Dokumente",
      "state": "Bayern",
      "amtsgericht": "Amtsgericht Hof",
      "registernummer": "HRB 1895",
      "registerart": "HRB",
      "company_name": "Vishay Electronic GmbH",
      "company_seat": "Selb",
      "details": "07.12.2024 (Bekanntmachungsdatum)\n\nBayern Amtsgericht Hof HRB 1895\nEinreichung neuer Dokumente\n\nVishay Electronic GmbH\nGesellschaft mit beschränkter Haftung\nSelb\n\nDem Amtsgericht Hof -Registergericht- ist eine Liste der Mitglieder des Aufsichtsrats eingereicht worden, § 52 Abs. 3 S. 2 GmbHG."
    },
    {
      "date": "2024-12-07",
      "id": "95710",
      "original_text": "Sonstige Registerbekanntmachung\nBayern Amtsgericht Würzburg HRB 7446\nBVUK. GmbH – Würzburg",
      "type": "Sonstige Registerbekanntmachung",
      "state": "Bayern",
      "amtsgericht": "Amtsgericht Würzburg",
      "registernummer": "HRB 7446",
      "registerart": "HRB",
      "company_name": "BVUK. GmbH",
      "company_seat": "Würzburg",
      "details": "07.12.2024 (Bekanntmachungsdatum)\n\nBayern Amtsgericht Würzburg HRB 7446\nSonstige Registerbekanntmachung 06.12.2024 (Eintragungsdatum)\n\nBVUK. GmbH\nGesellschaft mit beschränkter Haftung\nWürzburg\n\nDen Gläubigern der Gesellschaft, deren Forderungen begründet worden sind, bevor die Eintragung der Beendigung des Beherrschungs- und Gewinnabführungsvertrages in das Handelsregister nach § 10 des Handelsgesetzbuches als bekanntgemacht gilt, hat der andere Vertragsteil Sicherheit zu leisten, wenn sie sich binnen sechs Monaten nach der Bekanntmachung der Eintragung zu diesem Zweck bei ihm melden."
    },
    {
      "date": "2024-12-07",
      "id": "95711",
      "original_text": "Einreichung neuer Dokumente\nBayern Amtsgericht Hof HRB 1480\nVishay Europe GmbH – Selb",
      "type": "Einreichung neuer Dokumente",
      "state": "Bayern",
      "amtsgericht": "Amtsgericht Hof",
      "registernummer": "HRB 1480",
      "registerart": "HRB",
      "company_name": "Vishay Europe GmbH",
      "company_seat": "Selb",
      "details": "07.12.2024 (Bekanntmachungsdatum)\n\nBayern Amtsgericht Hof HRB 1480\nEinreichung neuer Dokumente\n\nVishay Europe GmbH\nGesellschaft mit beschränkter Haftung\nSelb\n\nDem Amtsgericht Hof -Registergericht- ist eine Liste der Mitglieder des Aufsichtsrats eingereicht worden, § 52 Abs. 3 S. 2 GmbHG."
    },
    {
      "date": "2024-12-07",
      "id": "95712",
      "original_text": "Registerbekanntmachung nach dem Umwandlungsgesetz\nBayern Amtsgericht München HRB 280713\ndiva-e NEXT GmbH – München",
      "type": "Registerbekanntmachung nach dem Umwandlungsgesetz",
      "state": "Bayern",
      "amtsgericht": "Amtsgericht München",
      "registernummer": "HRB 280713",
      "registerart": "HRB",
      "company_name": "diva-e NEXT GmbH",
      "company_seat": "München",
      "details": "07.12.2024 (Bekanntmachungsdatum)\n\nBayern Amtsgericht München HRB 280713\nRegisterbekanntmachung nach dem Umwandlungsgesetz 06.12.2024 (Eintragungsdatum)\n\ndiva-e NEXT GmbH\nGesellschaft mit beschränkter Haftung\nMünchen\n\nDen Gläubigern der an der Verschmelzung beteiligten Rechtsträger ist, wenn sie binnen sechs Monaten nach dem Tag, an dem die Eintragung der Verschmelzung in das Register des Sitzes desjenigen Rechtsträgers, dessen Gläubiger sie sind, nach § 19 Abs. 3 UmwG als bekannt gemacht gilt, ihren Anspruch nach Grund und Höhe schriftlich anmelden, Sicherheit zu leisten, soweit sie nicht Befriedigung verlangen können. Dieses Recht steht den Gläubigern jedoch nur zu, wenn sie glaubhaft machen, dass durch die Verschmelzung die Erfüllung ihrer Forderung gefährdet wird."
    },
    {
      "date": "2024-12-07",
      "id": "95713",
      "original_text": "Löschungsankündigung\nBayern Amtsgericht München HRB 249350\nHelske Resort Wuppertal AG – München",
      "type": "Löschungsankündigung",
      "state": "Bayern",
      "amtsgericht": "Amtsgericht München",
      "registernummer": "HRB 249350",
      "registerart": "HRB",
      "company_name": "Helske Resort Wuppertal AG",
      "company_seat": "München",
      "details": "07.12.2024 (Bekanntmachungsdatum)\n\nBayern Amtsgericht München HRB 249350\nLöschungsankündigung 06.12.2024 (Eintragungsdatum)\n\nHelske Resort Wuppertal AG\nAktiengesellschaft\nMünchen\n\nDas Registergericht beabsichtigt, die im Handelsregister eingetragene Gesellschaft wegen Vermögenslosigkeit von Amts wegen nach § 394 FamFG zu löschen. Die Frist zur Erhebung eines Widerspruchs ist auf drei Monate festgesetzt."
    },
    {
      "date": "2024-12-07",
      "id": "95714",
      "original_text": "Registerbekanntmachung nach dem Umwandlungsgesetz\nBayern Amtsgericht München HRB 140425\nO&R Oppenhoff & Rädler AG Wirtschaftsprüfungsgesellschaft Steuerberatungsgesellschaft – München",
      "type": "Registerbekanntmachung nach dem Umwandlungsgesetz",
      "state": "Bayern",
      "amtsgericht": "Amtsgericht München",
      "registernummer": "HRB 140425",
      "registerart": "HRB",
      "company_name": "O&R Oppenhoff & Rädler AG Wirtschaftsprüfungsgesellschaft Steuerberatungsgesellschaft",
      "company_seat": "München",
      "details": "07.12.2024 (Bekanntmachungsdatum)\n\nBayern Amtsgericht München HRB 140425\nRegisterbekanntmachung nach dem Umwandlungsgesetz 06.12.2024 (Eintragungsdatum)\n\nO&R Oppenhoff & Rädler AG Wirtschaftsprüfungsgesellschaft Steuerberatungsgesellschaft\nAktiengesellschaft\nMünchen\n\nDen Gläubigern des formwechselnden Rechtsträgers ist, wenn sie binnen sechs Monaten nach dem Tag, an dem die Eintragung des Formwechsels nach § 201 UmwG als bekannt gemacht gilt, ihren Anspruch nach Grund und Höhe schriftlich anmelden, Sicherheit zu leisten, soweit sie nicht Befriedigung verlangen können. Dieses Recht steht den Gläubigern jedoch nur zu, wenn sie glaubhaft machen, dass durch den Formwechsel die Erfüllung ihrer Forderung gefährdet wird."
    }
  ]
}