{
  "date": "2024-12-06",
  "date_of_scrape": "2024-12-07T04:06:46.659Z",
  "tool_version": "0.2.0",
  "number_of_announcements": 103,
  "announcements": [
    {
      "date": "2024-12-06",
      "id": "95599",
      "original_text": "Registerbekanntmachung nach dem Umwandlungsgesetz\nBayern Amtsgericht München HRB 126082\nBayerische Filmhallen GmbH – Grünwald",
      "type": "Registerbekanntmachung nach dem Umwandlungsgesetz",
      "state": "Bayern",
      "amtsgericht": "Amtsgericht München",
      "registernummer": "HRB 126082",
      "registerart": "HRB",
      "company_name": "Bayerische Filmhallen GmbH",
      "company_seat": "Grünwald",
      "details": "06.12.2024 (Bekanntmachungsdatum)\n\nBayern Amtsgericht München HRB 126082\nRegisterbekanntmachung nach dem Umwandlungsgesetz 05.12.2024 (Eintragungsdatum)\n\nBayerische Filmhallen GmbH\nGesellschaft mit beschränkter Haftung\nGrünwald\n\nDen Gläubigern der an der Verschmelzung beteiligten Rechtsträger ist, wenn sie binnen sechs Monaten nach dem Tag, an dem die Eintragung der Verschmelzung in das Register des Sitzes desjenigen Rechtsträgers, dessen Gläubiger sie sind, nach § 19 Abs. 3 UmwG als bekannt gemacht gilt, ihren Anspruch nach Grund und Höhe schriftlich anmelden, Sicherheit zu leisten, soweit sie nicht Befriedigung verlangen können. Dieses Recht steht den Gläubigern jedoch nur zu, wenn sie glaubhaft machen, dass durch die Verschmelzung die Erfüllung ihrer Forderung gefährdet wird."
    },
    {
      "date": "2024-12-06",
      "id": "95600",
      "original_text": "Sonstige Registerbekanntmachung\nBayern Amtsgericht München HRB 134934\nManova Partners GmbH – München",
      "type": "Sonstige Registerbekanntmachung",
      "state": "Bayern",
      "amtsgericht": "Amtsgericht München",
      "registernummer": "HRB 134934",
      "registerart": "HRB",
      "company_name": "Manova Partners GmbH",
      "company_seat": "München",
      "details": "06.12.2024 (Bekanntmachungsdatum)\n\nBayern Amtsgericht München HRB 134934\nSonstige Registerbekanntmachung 05.12.2024 (Eintragungsdatum)\n\nManova Partners GmbH\nGesellschaft mit beschränkter Haftung\nMünchen\n\nDen Gläubigern der Gesellschaft, deren Forderungen begründet worden sind, bevor die Eintragung der Beendigung des Gewinnabführungsvertrages in das Handelsregister nach § 10 des Handelsgesetzbuches als bekanntgemacht gilt, hat der andere Vertragsteil Sicherheit zu leisten, wenn sie sich binnen sechs Monaten nach der Bekanntmachung der Eintragung zu diesem Zweck bei ihm melden."
    },
    {
      "date": "2024-12-06",
      "id": "95601",
      "original_text": "Registerbekanntmachung nach dem Umwandlungsgesetz\nBayern Amtsgericht Nürnberg HRB 43832\nAta Solutions GmbH – Nürnberg",
      "type": "Registerbekanntmachung nach dem Umwandlungsgesetz",
      "state": "Bayern",
      "amtsgericht": "Amtsgericht Nürnberg",
      "registernummer": "HRB 43832",
      "registerart": "HRB",
      "company_name": "Ata Solutions GmbH",
      "company_seat": "Nürnberg",
      "details": "06.12.2024 (Bekanntmachungsdatum)\n\nBayern Amtsgericht Nürnberg HRB 43832\nRegisterbekanntmachung nach dem Umwandlungsgesetz 05.12.2024 (Eintragungsdatum)\n\nAta Solutions GmbH\nGesellschaft mit beschränkter Haftung\nNürnberg\n\nDen Gläubigern der an der Ausgliederung beteiligten Rechtsträger ist, wenn sie binnen sechs Monaten nach dem Tag, an dem die Eintragung der Ausgliederung in das Register des Sitzes desjenigen Rechtsträgers, dessen Gläubiger sie sind, nach §§ 125, 19 Abs. 3 UmwG als bekannt gemacht gilt, ihren Anspruch nach Grund und Höhe schriftlich anmelden, Sicherheit zu leisten, soweit sie nicht Befriedigung verlangen können. Dieses Recht steht den Gläubigern jedoch nur zu, wenn sie glaubhaft machen, dass durch die Ausgliederung die Erfüllung ihrer Forderung gefährdet wird."
    },
    {
      "date": "2024-12-06",
      "id": "95602",
      "original_text": "Registerbekanntmachung nach dem Umwandlungsgesetz\nBayern Amtsgericht München HRB 213246\nHWN GmbH XIV – Grünwald",
      "type": "Registerbekanntmachung nach dem Umwandlungsgesetz",
      "state": "Bayern",
      "amtsgericht": "Amtsgericht München",
      "registernummer": "HRB 213246",
      "registerart": "HRB",
      "company_name": "HWN GmbH XIV",
      "company_seat": "Grünwald",
      "details": "06.12.2024 (Bekanntmachungsdatum)\n\nBayern Amtsgericht München HRB 213246\nRegisterbekanntmachung nach dem Umwandlungsgesetz 05.12.2024 (Eintragungsdatum)\n\nHWN GmbH XIV\nGesellschaft mit beschränkter Haftung\nGrünwald\n\nDen Gläubigern der an der Verschmelzung beteiligten Rechtsträger ist, wenn sie binnen sechs Monaten nach dem Tag, an dem die Eintragung der Verschmelzung in das Register des Sitzes desjenigen Rechtsträgers, dessen Gläubiger sie sind, nach § 19 Abs. 3 UmwG als bekannt gemacht gilt, ihren Anspruch nach Grund und Höhe schriftlich anmelden, Sicherheit zu leisten, soweit sie nicht Befriedigung verlangen können. Dieses Recht steht den Gläubigern jedoch nur zu, wenn sie glaubhaft machen, dass durch die Verschmelzung die Erfüllung ihrer Forderung gefährdet wird."
    },
    {
      "date": "2024-12-06",
      "id": "95603",
      "original_text": "Löschungsankündigung\nBayern Amtsgericht Augsburg HRB 26144\nWohnen am Schäfflerbach GmbH – Aichach",
      "type": "Löschungsankündigung",
      "state": "Bayern",
      "amtsgericht": "Amtsgericht Augsburg",
      "registernummer": "HRB 26144",
      "registerart": "HRB",
      "company_name": "Wohnen am Schäfflerbach GmbH",
      "company_seat": "Aichach",
      "details": "06.12.2024 (Bekanntmachungsdatum)\n\nBayern Amtsgericht Augsburg HRB 26144\nLöschungsankündigung\n\nWohnen am Schäfflerbach GmbH\nGesellschaft mit beschränkter Haftung\nAichach\n\nDas Registergericht beabsichtigt, die im Handelsregister eingetragene Gesellschaft wegen Vermögenslosigkeit von Amts wegen nach § 394 FamFG zu löschen. Die Frist zur Erhebung eines Widerspruchs ist auf einen Monat festgesetzt."
    },
    {
      "date": "2024-12-06",
      "id": "95604",
      "original_text": "Registerbekanntmachung nach dem Umwandlungsgesetz\nBayern Amtsgericht Nürnberg VR 1226\nKEB - Katholische Erwachsenenbildung Stadtbildungswerk Nürnberg e. V. – Nürnberg",
      "type": "Registerbekanntmachung nach dem Umwandlungsgesetz",
      "state": "Bayern",
      "amtsgericht": "Amtsgericht Nürnberg",
      "registernummer": "VR 1226",
      "registerart": "VR",
      "company_name": "KEB - Katholische Erwachsenenbildung Stadtbildungswerk Nürnberg e. V.",
      "company_seat": "Nürnberg",
      "details": "06.12.2024 (Bekanntmachungsdatum)\n\nBayern Amtsgericht Nürnberg VR 1226\nRegisterbekanntmachung nach dem Umwandlungsgesetz 05.12.2024 (Eintragungsdatum)\n\nKEB - Katholische Erwachsenenbildung Stadtbildungswerk Nürnberg e. V.\neingetragener Verein\nNürnberg\n\nDen Gläubigern der an der Verschmelzung beteiligten Rechtsträger ist, wenn sie binnen sechs Monaten nach dem Tag, an dem die Eintragung der Verschmelzung in das Register des Sitzes desjenigen Rechtsträgers, dessen Gläubiger sie sind, nach § 19 Abs. 3 UmwG als bekannt gemacht gilt, ihren Anspruch nach Grund und Höhe schriftlich anmelden, Sicherheit zu leisten, soweit sie nicht Befriedigung verlangen können. Dieses Recht steht den Gläubigern jedoch nur zu, wenn sie glaubhaft machen, dass durch die Verschmelzung die Erfüllung ihrer Forderung gefährdet wird."
    },
    {
      "date": "2024-12-06",
      "id": "95605",
      "original_text": "Registerbekanntmachung nach dem Umwandlungsgesetz\nBayern Amtsgericht Nürnberg HRB 43098\nTimelabs UG (haftungsbeschränkt) – Nürnberg",
      "type": "Registerbekanntmachung nach dem Umwandlungsgesetz",
      "state": "Bayern",
      "amtsgericht": "Amtsgericht Nürnberg",
      "registernummer": "HRB 43098",
      "registerart": "HRB",
      "company_name": "Timelabs UG (haftungsbeschränkt)",
      "company_seat": "Nürnberg",
      "details": "06.12.2024 (Bekanntmachungsdatum)\n\nBayern Amtsgericht Nürnberg HRB 43098\nRegisterbekanntmachung nach dem Umwandlungsgesetz 05.12.2024 (Eintragungsdatum)\n\nTimelabs UG (haftungsbeschränkt)\nGesellschaft mit beschränkter Haftung\nNürnberg\n\nDen Gläubigern der an der Verschmelzung beteiligten Rechtsträger ist, wenn sie binnen sechs Monaten nach dem Tag, an dem die Eintragung der Verschmelzung in das Register des Sitzes desjenigen Rechtsträgers, dessen Gläubiger sie sind, nach § 19 Abs. 3 UmwG als bekannt gemacht gilt, ihren Anspruch nach Grund und Höhe schriftlich anmelden, Sicherheit zu leisten, soweit sie nicht Befriedigung verlangen können. Dieses Recht steht den Gläubigern jedoch nur zu, wenn sie glaubhaft machen, dass durch die Verschmelzung die Erfüllung ihrer Forderung gefährdet wird."
    },
    {
      "date": "2024-12-06",
      "id": "95606",
      "original_text": "Registerbekanntmachung nach dem Umwandlungsgesetz\nBayern Amtsgericht Fürth VR 20327\nKatholische Erwachsenenbildung in der Stadt Erlangen e.V. – Erlangen",
      "type": "Registerbekanntmachung nach dem Umwandlungsgesetz",
      "state": "Bayern",
      "amtsgericht": "Amtsgericht Fürth",
      "registernummer": "VR 20327",
      "registerart": "VR",
      "company_name": "Katholische Erwachsenenbildung in der Stadt Erlangen e.V.",
      "company_seat": "Erlangen",
      "details": "06.12.2024 (Bekanntmachungsdatum)\n\nBayern Amtsgericht Fürth VR 20327\nRegisterbekanntmachung nach dem Umwandlungsgesetz 05.12.2024 (Eintragungsdatum)\n\nKatholische Erwachsenenbildung in der Stadt Erlangen e.V.\neingetragener Verein\nErlangen\n\nDen Gläubigern der an der Verschmelzung beteiligten Rechtsträger ist, wenn sie binnen sechs Monaten nach dem Tag, an dem die Eintragung der Verschmelzung in das Register des Sitzes desjenigen Rechtsträgers, dessen Gläubiger sie sind, nach § 19 Abs. 3 UmwG als bekannt gemacht gilt, ihren Anspruch nach Grund und Höhe schriftlich anmelden, Sicherheit zu leisten, soweit sie nicht Befriedigung verlangen können. Dieses Recht steht den Gläubigern jedoch nur zu, wenn sie glaubhaft machen, dass durch die Verschmelzung die Erfüllung ihrer Forderung gefährdet wird."
    },
    {
      "date": "2024-12-06",
      "id": "95607",
      "original_text": "Registerbekanntmachung nach dem Umwandlungsgesetz\nBayern Amtsgericht Nürnberg VR 30479\nKEB - Katholische Erwachsenenbildung Nürnberger Land e.V. – Lauf a.d. Pegnitz",
      "type": "Registerbekanntmachung nach dem Umwandlungsgesetz",
      "state": "Bayern",
      "amtsgericht": "Amtsgericht Nürnberg",
      "registernummer": "VR 30479",
      "registerart": "VR",
      "company_name": "KEB - Katholische Erwachsenenbildung Nürnberger Land e.V.",
      "company_seat": "Lauf a.d. Pegnitz",
      "details": "06.12.2024 (Bekanntmachungsdatum)\n\nBayern Amtsgericht Nürnberg VR 30479\nRegisterbekanntmachung nach dem Umwandlungsgesetz 05.12.2024 (Eintragungsdatum)\n\nKEB - Katholische Erwachsenenbildung Nürnberger Land e.V.\neingetragener Verein\nLauf a.d. Pegnitz\n\nDen Gläubigern der an der Verschmelzung beteiligten Rechtsträger ist, wenn sie binnen sechs Monaten nach dem Tag, an dem die Eintragung der Verschmelzung in das Register des Sitzes desjenigen Rechtsträgers, dessen Gläubiger sie sind, nach § 19 Abs. 3 UmwG als bekannt gemacht gilt, ihren Anspruch nach Grund und Höhe schriftlich anmelden, Sicherheit zu leisten, soweit sie nicht Befriedigung verlangen können. Dieses Recht steht den Gläubigern jedoch nur zu, wenn sie glaubhaft machen, dass durch die Verschmelzung die Erfüllung ihrer Forderung gefährdet wird."
    },
    {
      "date": "2024-12-06",
      "id": "95608",
      "original_text": "Registerbekanntmachung nach dem Umwandlungsgesetz\nBayern Amtsgericht Nürnberg HRA 20118\nAta Repair e.K. – Nürnberg",
      "type": "Registerbekanntmachung nach dem Umwandlungsgesetz",
      "state": "Bayern",
      "amtsgericht": "Amtsgericht Nürnberg",
      "registernummer": "HRA 20118",
      "registerart": "HRA",
      "company_name": "Ata Repair e.K.",
      "company_seat": "Nürnberg",
      "details": "06.12.2024 (Bekanntmachungsdatum)\n\nBayern Amtsgericht Nürnberg HRA 20118\nRegisterbekanntmachung nach dem Umwandlungsgesetz 05.12.2024 (Eintragungsdatum)\n\nAta Repair e.K.\nEinzelkaufmann / Einzelkauffrau\nNürnberg\n\nDen Gläubigern der an der Ausgliederung beteiligten Rechtsträger ist, wenn sie binnen sechs Monaten nach dem Tag, an dem die Eintragung der Ausgliederung in das Register des Sitzes desjenigen Rechtsträgers, dessen Gläubiger sie sind, nach §§ 125, 19 Abs. 3 UmwG als bekannt gemacht gilt, ihren Anspruch nach Grund und Höhe schriftlich anmelden, Sicherheit zu leisten, soweit sie nicht Befriedigung verlangen können. Dieses Recht steht den Gläubigern jedoch nur zu, wenn sie glaubhaft machen, dass durch die Ausgliederung die Erfüllung ihrer Forderung gefährdet wird."
    },
    {
      "date": "2024-12-06",
      "id": "95609",
      "original_text": "Registerbekanntmachung nach dem Umwandlungsgesetz\nBayern Amtsgericht Traunstein HRB 10620\nUnterstaller GmbH – Tüßling",
      "type": "Registerbekanntmachung nach dem Umwandlungsgesetz",
      "state": "Bayern",
      "amtsgericht": "Amtsgericht Traunstein",
      "registernummer": "HRB 10620",
      "registerart": "HRB",
      "company_name": "Unterstaller GmbH",
      "company_seat": "Tüßling",
      "details": "06.12.2024 (Bekanntmachungsdatum)\n\nBayern Amtsgericht Traunstein HRB 10620\nRegisterbekanntmachung nach dem Umwandlungsgesetz 05.12.2024 (Eintragungsdatum)\n\nUnterstaller GmbH\nGesellschaft mit beschränkter Haftung\nTüßling\n\nDen Gläubigern der an der Verschmelzung beteiligten Rechtsträger ist, wenn sie binnen sechs Monaten nach dem Tag, an dem die Eintragung der Verschmelzung in das Register des Sitzes desjenigen Rechtsträgers, dessen Gläubiger sie sind, nach § 19 Abs. 3 UmwG als bekannt gemacht gilt, ihren Anspruch nach Grund und Höhe schriftlich anmelden, Sicherheit zu leisten, soweit sie nicht Befriedigung verlangen können. Dieses Recht steht den Gläubigern jedoch nur zu, wenn sie glaubhaft machen, dass durch die Verschmelzung die Erfüllung ihrer Forderung gefährdet wird."
    },
    {
      "date": "2024-12-06",
      "id": "95610",
      "original_text": "Einreichung neuer Dokumente\nBayern Amtsgericht München HRB 172019\nMünchner Wohnen Immobilien 2 GmbH – München",
      "type": "Einreichung neuer Dokumente",
      "state": "Bayern",
      "amtsgericht": "Amtsgericht München",
      "registernummer": "HRB 172019",
      "registerart": "HRB",
      "company_name": "Münchner Wohnen Immobilien 2 GmbH",
      "company_seat": "München",
      "details": "06.12.2024 (Bekanntmachungsdatum)\n\nBayern Amtsgericht München HRB 172019\nEinreichung neuer Dokumente 05.12.2024 (Eintragungsdatum)\n\nMünchner Wohnen Immobilien 2 GmbH\nGesellschaft mit beschränkter Haftung\nMünchen\n\nDem Amtsgericht München -Registergericht- ist eine Liste der Mitglieder des Aufsichtsrats eingereicht worden, § 52 Abs. 3 S. 2 GmbHG."
    },
    {
      "date": "2024-12-06",
      "id": "95611",
      "original_text": "Einreichung neuer Dokumente\nBayern Amtsgericht München HRB 5520\nWohnungsbaugesellschaft Pullach i. Isartal mit beschränkter Haftung – Pullach i. Isartal",
      "type": "Einreichung neuer Dokumente",
      "state": "Bayern",
      "amtsgericht": "Amtsgericht München",
      "registernummer": "HRB 5520",
      "registerart": "HRB",
      "company_name": "Wohnungsbaugesellschaft Pullach i. Isartal mit beschränkter Haftung",
      "company_seat": "Pullach i. Isartal",
      "details": "06.12.2024 (Bekanntmachungsdatum)\n\nBayern Amtsgericht München HRB 5520\nEinreichung neuer Dokumente\n\nWohnungsbaugesellschaft Pullach i. Isartal mit beschränkter Haftung\nGesellschaft mit beschränkter Haftung\nPullach i. Isartal\n\nDem Amtsgericht München -Registergericht- ist eine Liste der Mitglieder des Aufsichtsrats eingereicht worden, § 52 Abs. 3 S. 2 GmbHG."
    },
    {
      "date": "2024-12-06",
      "id": "95612",
      "original_text": "Registerbekanntmachung nach dem Umwandlungsgesetz\nBayern Amtsgericht Augsburg HRA 21686\nWeis Logistik e.K. – Augsburg",
      "type": "Registerbekanntmachung nach dem Umwandlungsgesetz",
      "state": "Bayern",
      "amtsgericht": "Amtsgericht Augsburg",
      "registernummer": "HRA 21686",
      "registerart": "HRA",
      "company_name": "Weis Logistik e.K.",
      "company_seat": "Augsburg",
      "details": "06.12.2024 (Bekanntmachungsdatum)\n\nBayern Amtsgericht Augsburg HRA 21686\nRegisterbekanntmachung nach dem Umwandlungsgesetz 05.12.2024 (Eintragungsdatum)\n\nWeis Logistik e.K.\nEinzelkaufmann / Einzelkauffrau\nAugsburg\n\nDen Gläubigern der an der Ausgliederung beteiligten Rechtsträger ist, wenn sie binnen sechs Monaten nach dem Tag, an dem die Eintragung der Ausgliederung in das Register des Sitzes desjenigen Rechtsträgers, dessen Gläubiger sie sind, nach §§ 125, 19 Abs. 3 UmwG als bekannt gemacht gilt, ihren Anspruch nach Grund und Höhe schriftlich anmelden, Sicherheit zu leisten, soweit sie nicht Befriedigung verlangen können. Dieses Recht steht den Gläubigern jedoch nur zu, wenn sie glaubhaft machen, dass durch die Ausgliederung die Erfüllung ihrer Forderung gefährdet wird."
    },
    {
      "date": "2024-12-06",
      "id": "95613",
      "original_text": "Registerbekanntmachung nach dem Umwandlungsgesetz\nBayern Amtsgericht München HRB 246833\nEncavis Asset Management AG – Neubiberg",
      "type": "Registerbekanntmachung nach dem Umwandlungsgesetz",
      "state": "Bayern",
      "amtsgericht": "Amtsgericht München",
      "registernummer": "HRB 246833",
      "registerart": "HRB",
      "company_name": "Encavis Asset Management AG",
      "company_seat": "Neubiberg",
      "details": "06.12.2024 (Bekanntmachungsdatum)\n\nBayern Amtsgericht München HRB 246833\nRegisterbekanntmachung nach dem Umwandlungsgesetz\n\nEncavis Asset Management AG\nAktiengesellschaft\nNeubiberg\n\nDem Amtsgericht München -Registergericht- ist der Entwurf eines Verschmelzungsvertrages zwischen der Gesellschaft als übernehmendem Rechtsträger und der ENCAVIS AM Capital GmbH, Neubiberg (Amtsgericht München HRB 140713), CHORUS CleanTech Management GmbH, Neubiberg (Amtsgericht München HRB 160204) und Encavis AM Komplementär GmbH, Neubiberg (Amtsgericht München HRB 246132) als übertragende Rechtsträger zur Einsichtnahme eingereicht worden."
    },
    {
      "date": "2024-12-06",
      "id": "95614",
      "original_text": "Einreichung neuer Dokumente\nBayern Amtsgericht München HRB 278515\nFriz Biochem Holding AG – Neuried",
      "type": "Einreichung neuer Dokumente",
      "state": "Bayern",
      "amtsgericht": "Amtsgericht München",
      "registernummer": "HRB 278515",
      "registerart": "HRB",
      "company_name": "Friz Biochem Holding AG",
      "company_seat": "Neuried",
      "details": "06.12.2024 (Bekanntmachungsdatum)\n\nBayern Amtsgericht München HRB 278515\nEinreichung neuer Dokumente\n\nFriz Biochem Holding AG\nAktiengesellschaft\nNeuried\n\nDem Amtsgericht München -Registergericht- ist eine Liste der Mitglieder des Aufsichtsrats eingereicht worden, § 106 AktG."
    },
    {
      "date": "2024-12-06",
      "id": "95615",
      "original_text": "Registerbekanntmachung nach dem Umwandlungsgesetz\nBayern Amtsgericht Fürth VR 550\nKatholische Erwachsenenbildung Fürth e. V. – Fürth",
      "type": "Registerbekanntmachung nach dem Umwandlungsgesetz",
      "state": "Bayern",
      "amtsgericht": "Amtsgericht Fürth",
      "registernummer": "VR 550",
      "registerart": "VR",
      "company_name": "Katholische Erwachsenenbildung Fürth e. V.",
      "company_seat": "Fürth",
      "details": "06.12.2024 (Bekanntmachungsdatum)\n\nBayern Amtsgericht Fürth VR 550\nRegisterbekanntmachung nach dem Umwandlungsgesetz 05.12.2024 (Eintragungsdatum)\n\nKatholische Erwachsenenbildung Fürth e. V.\neingetragener Verein\nFürth\n\nDen Gläubigern der an der Verschmelzung beteiligten Rechtsträger ist, wenn sie binnen sechs Monaten nach dem Tag, an dem die Eintragung der Verschmelzung in das Register des Sitzes desjenigen Rechtsträgers, dessen Gläubiger sie sind, nach § 19 Abs. 3 UmwG als bekannt gemacht gilt, ihren Anspruch nach Grund und Höhe schriftlich anmelden, Sicherheit zu leisten, soweit sie nicht Befriedigung verlangen können. Dieses Recht steht den Gläubigern jedoch nur zu, wenn sie glaubhaft machen, dass durch die Verschmelzung die Erfüllung ihrer Forderung gefährdet wird."
    },
    {
      "date": "2024-12-06",
      "id": "95616",
      "original_text": "Löschungsankündigung\nBayern Amtsgericht München HRB 249351\nHelske Resort Nürnberg AG – München",
      "type": "Löschungsankündigung",
      "state": "Bayern",
      "amtsgericht": "Amtsgericht München",
      "registernummer": "HRB 249351",
      "registerart": "HRB",
      "company_name": "Helske Resort Nürnberg AG",
      "company_seat": "München",
      "details": "06.12.2024 (Bekanntmachungsdatum)\n\nBayern Amtsgericht München HRB 249351\nLöschungsankündigung 05.12.2024 (Eintragungsdatum)\n\nHelske Resort Nürnberg AG\nAktiengesellschaft\nMünchen\n\nDas Registergericht beabsichtigt, die im Handelsregister eingetragene Gesellschaft wegen Vermögenslosigkeit von Amts wegen nach § 394 FamFG zu löschen. Die Frist zur Erhebung eines Widerspruchs ist auf drei Monate festgesetzt."
    },
    {
      "date": "2024-12-06",
      "id": "95617",
      "original_text": "Löschungsankündigung\nBayern Amtsgericht München HRB 167216\nTelecenter24 GmbH – Gilching",
      "type": "Löschungsankündigung",
      "state": "Bayern",
      "amtsgericht": "Amtsgericht München",
      "registernummer": "HRB 167216",
      "registerart": "HRB",
      "company_name": "Telecenter24 GmbH",
      "company_seat": "Gilching",
      "details": "06.12.2024 (Bekanntmachungsdatum)\n\nBayern Amtsgericht München HRB 167216\nLöschungsankündigung 05.12.2024 (Eintragungsdatum)\n\nTelecenter24 GmbH\nGesellschaft mit beschränkter Haftung\nGilching\n\nDas Registergericht beabsichtigt, die im Handelsregister eingetragene Gesellschaft wegen Vermögenslosigkeit von Amts wegen nach § 394 FamFG zu löschen. Die Frist zur Erhebung eines Widerspruchs ist auf drei Monate festgesetzt."
    },
    {
      "date": "2024-12-06",
      "id": "95618",
      "original_text": "Registerbekanntmachung nach dem Umwandlungsgesetz\nBayern Amtsgericht München HRB 236242\ndiva-e Advertising GmbH – München",
      "type": "Registerbekanntmachung nach dem Umwandlungsgesetz",
      "state": "Bayern",
      "amtsgericht": "Amtsgericht München",
      "registernummer": "HRB 236242",
      "registerart": "HRB",
      "company_name": "diva-e Advertising GmbH",
      "company_seat": "München",
      "details": "06.12.2024 (Bekanntmachungsdatum)\n\nBayern Amtsgericht München HRB 236242\nRegisterbekanntmachung nach dem Umwandlungsgesetz 05.12.2024 (Eintragungsdatum)\n\ndiva-e Advertising GmbH\nGesellschaft mit beschränkter Haftung\nMünchen\n\nDen Gläubigern der an der Verschmelzung beteiligten Rechtsträger ist, wenn sie binnen sechs Monaten nach dem Tag, an dem die Eintragung der Verschmelzung in das Register des Sitzes desjenigen Rechtsträgers, dessen Gläubiger sie sind, nach § 19 Abs. 3 UmwG als bekannt gemacht gilt, ihren Anspruch nach Grund und Höhe schriftlich anmelden, Sicherheit zu leisten, soweit sie nicht Befriedigung verlangen können. Dieses Recht steht den Gläubigern jedoch nur zu, wenn sie glaubhaft machen, dass durch die Verschmelzung die Erfüllung ihrer Forderung gefährdet wird."
    },
    {
      "date": "2024-12-06",
      "id": "95619",
      "original_text": "Löschungsankündigung\nBayern Amtsgericht München HRB 206249\nsonoVTS GmbH – Feldkirchen",
      "type": "Löschungsankündigung",
      "state": "Bayern",
      "amtsgericht": "Amtsgericht München",
      "registernummer": "HRB 206249",
      "registerart": "HRB",
      "company_name": "sonoVTS GmbH",
      "company_seat": "Feldkirchen",
      "details": "06.12.2024 (Bekanntmachungsdatum)\n\nBayern Amtsgericht München HRB 206249\nLöschungsankündigung 05.12.2024 (Eintragungsdatum)\n\nsonoVTS GmbH\nGesellschaft mit beschränkter Haftung\nFeldkirchen\n\nDas Registergericht beabsichtigt, die im Handelsregister eingetragene Gesellschaft wegen Vermögenslosigkeit von Amts wegen nach § 394 FamFG zu löschen. Die Frist zur Erhebung eines Widerspruchs ist auf drei Monate festgesetzt."
    },
    {
      "date": "2024-12-06",
      "id": "95620",
      "original_text": "Löschungsankündigung\nBayern Amtsgericht München HRB 170464\nPacific Storm FX Film Productions GmbH – München",
      "type": "Löschungsankündigung",
      "state": "Bayern",
      "amtsgericht": "Amtsgericht München",
      "registernummer": "HRB 170464",
      "registerart": "HRB",
      "company_name": "Pacific Storm FX Film Productions GmbH",
      "company_seat": "München",
      "details": "06.12.2024 (Bekanntmachungsdatum)\n\nBayern Amtsgericht München HRB 170464\nLöschungsankündigung 05.12.2024 (Eintragungsdatum)\n\nPacific Storm FX Film Productions GmbH\nGesellschaft mit beschränkter Haftung\nMünchen\n\nDas Registergericht beabsichtigt, die im Handelsregister eingetragene Gesellschaft wegen Vermögenslosigkeit von Amts wegen nach § 394 FamFG zu löschen. Die Frist zur Erhebung eines Widerspruchs ist auf drei Monate festgesetzt."
    },
    {
      "date": "2024-12-06",
      "id": "95621",
      "original_text": "Einreichung neuer Dokumente\nBaden-Württemberg Amtsgericht Stuttgart HRB 735844\nPflegeverbund Strohgäu-Glems gemeinnützige GmbH – Leonberg",
      "type": "Einreichung neuer Dokumente",
      "state": "Baden-Württemberg",
      "amtsgericht": "Amtsgericht Stuttgart",
      "registernummer": "HRB 735844",
      "registerart": "HRB",
      "company_name": "Pflegeverbund Strohgäu-Glems gemeinnützige GmbH",
      "company_seat": "Leonberg",
      "details": "06.12.2024 (Bekanntmachungsdatum)\n\nBaden-Württemberg Amtsgericht Stuttgart HRB 735844\nEinreichung neuer Dokumente\n\nPflegeverbund Strohgäu-Glems gemeinnützige GmbH\nGesellschaft mit beschränkter Haftung\nLeonberg\n\nDie Gesellschaft hat am 05.12.2024 die Liste über die Zusammensetzung des Aufsichtsrats zum Handelsregister eingereicht."
    },
    {
      "date": "2024-12-06",
      "id": "95622",
      "original_text": "Registerbekanntmachung nach dem Umwandlungsgesetz\nBaden-Württemberg Amtsgericht Stuttgart HRB 786122\nMagie Studios UG (haftungsbeschränkt) – Möckmühl",
      "type": "Registerbekanntmachung nach dem Umwandlungsgesetz",
      "state": "Baden-Württemberg",
      "amtsgericht": "Amtsgericht Stuttgart",
      "registernummer": "HRB 786122",
      "registerart": "HRB",
      "company_name": "Magie Studios UG (haftungsbeschränkt)",
      "company_seat": "Möckmühl",
      "details": "06.12.2024 (Bekanntmachungsdatum)\n\nBaden-Württemberg Amtsgericht Stuttgart HRB 786122\nRegisterbekanntmachung nach dem Umwandlungsgesetz 06.12.2024 (Eintragungsdatum)\n\nMagie Studios UG (haftungsbeschränkt)\nGesellschaft mit beschränkter Haftung\nMöckmühl\n\nDen Gläubigern der an der Verschmelzung beteiligten Rechtsträger ist, wenn sie binnen sechs Monaten nach dem Tag, an dem die Eintragung der Verschmelzung in das Register des Sitzes desjenigen Rechtsträgers, dessen Gläubiger sie sind, nach § 19 Abs. 3 UmwG als bekanntgemacht gilt, ihren Anspruch nach Grund und Höhe schriftlich anmelden, Sicherheit zu leisten, soweit sie nicht Befriedigung verlangen können. Dieses Recht steht den Gläubigern jedoch nur zu, wenn sie glaubhaft machen, dass durch die Verschmelzung die Erfüllung ihrer Forderung gefährdet wird."
    },
    {
      "date": "2024-12-06",
      "id": "95623",
      "original_text": "Registerbekanntmachung nach dem Umwandlungsgesetz\nBaden-Württemberg Amtsgericht Stuttgart HRA 741672\nFeeluxa e.K. – Möckmühl",
      "type": "Registerbekanntmachung nach dem Umwandlungsgesetz",
      "state": "Baden-Württemberg",
      "amtsgericht": "Amtsgericht Stuttgart",
      "registernummer": "HRA 741672",
      "registerart": "HRA",
      "company_name": "Feeluxa e.K.",
      "company_seat": "Möckmühl",
      "details": "06.12.2024 (Bekanntmachungsdatum)\n\nBaden-Württemberg Amtsgericht Stuttgart HRA 741672\nRegisterbekanntmachung nach dem Umwandlungsgesetz 06.12.2024 (Eintragungsdatum)\n\nFeeluxa e.K.\nEinzelkaufmann / Einzelkauffrau\nMöckmühl\n\nDen Gläubigern der an der Verschmelzung beteiligten Rechtsträger ist, wenn sie binnen sechs Monaten nach dem Tag, an dem die Eintragung der Verschmelzung in das Register des Sitzes desjenigen Rechtsträgers, dessen Gläubiger sie sind, nach § 19 Abs. 3 UmwG als bekanntgemacht gilt, ihren Anspruch nach Grund und Höhe schriftlich anmelden, Sicherheit zu leisten, soweit sie nicht Befriedigung verlangen können. Dieses Recht steht den Gläubigern jedoch nur zu, wenn sie glaubhaft machen, dass durch die Verschmelzung die Erfüllung ihrer Forderung gefährdet wird."
    },
    {
      "date": "2024-12-06",
      "id": "95624",
      "original_text": "Löschungsankündigung\nBaden-Württemberg Amtsgericht Stuttgart HRB 750427\nFERRANTE GmbH – Esslingen am Neckar",
      "type": "Löschungsankündigung",
      "state": "Baden-Württemberg",
      "amtsgericht": "Amtsgericht Stuttgart",
      "registernummer": "HRB 750427",
      "registerart": "HRB",
      "company_name": "FERRANTE GmbH",
      "company_seat": "Esslingen am Neckar",
      "details": "06.12.2024 (Bekanntmachungsdatum)\n\nBaden-Württemberg Amtsgericht Stuttgart HRB 750427\nLöschungsankündigung\n\nFERRANTE GmbH\nGesellschaft mit beschränkter Haftung\nEsslingen am Neckar\n\nDas Gericht beabsichtigt, die Gesellschaft wegen Vermögenslosigkeit im Handelsregister von Amts wegen nach § 394 FamFG zu löschen. Die Frist zur Geltendmachung eines Widerspruchs gegen die beabsichtigte Löschung ist auf zwei Monate ab Veröffentlichung bestimmt."
    },
    {
      "date": "2024-12-06",
      "id": "95625",
      "original_text": "Registerbekanntmachung nach dem Umwandlungsgesetz\nBaden-Württemberg Amtsgericht Ulm HRA 729268\nKlamer, ab-art-ig e.K. – Wolfegg",
      "type": "Registerbekanntmachung nach dem Umwandlungsgesetz",
      "state": "Baden-Württemberg",
      "amtsgericht": "Amtsgericht Ulm",
      "registernummer": "HRA 729268",
      "registerart": "HRA",
      "company_name": "Klamer, ab-art-ig e.K.",
      "company_seat": "Wolfegg",
      "details": "06.12.2024 (Bekanntmachungsdatum)\n\nBaden-Württemberg Amtsgericht Ulm HRA 729268\nRegisterbekanntmachung nach dem Umwandlungsgesetz 06.12.2024 (Eintragungsdatum)\n\nKlamer, ab-art-ig e.K.\nEinzelkaufmann / Einzelkauffrau\nWolfegg\n\nAls nicht eingetragen wird bekanntgemacht:\nDen Gläubigern der an der Ausgliederung beteiligten Rechtsträger ist, wenn sie binnen sechs Monaten nach dem Tag, an dem die Eintragung der Ausgliederung in das Register des Sitzes desjenigen Rechtsträgers, dessen Gläubiger sie sind, nach § 19 Abs. 3 UmwG als bekanntgemacht gilt, ihren Anspruch nach Grund und Höhe schriftlich anmelden, Sicherheit zu leisten, soweit sie nicht Befriedigung verlangen können. Dieses Recht steht den Gläubigern jedoch nur zu, wenn sie glaubhaft machen, dass durch die Ausgliederung die Erfüllung ihrer Forderung gefährdet wird."
    },
    {
      "date": "2024-12-06",
      "id": "95626",
      "original_text": "Registerbekanntmachung nach dem Umwandlungsgesetz\nBaden-Württemberg Amtsgericht Ulm HRB 748431\nZimmerei abartig GmbH – Wolfegg",
      "type": "Registerbekanntmachung nach dem Umwandlungsgesetz",
      "state": "Baden-Württemberg",
      "amtsgericht": "Amtsgericht Ulm",
      "registernummer": "HRB 748431",
      "registerart": "HRB",
      "company_name": "Zimmerei abartig GmbH",
      "company_seat": "Wolfegg",
      "details": "06.12.2024 (Bekanntmachungsdatum)\n\nBaden-Württemberg Amtsgericht Ulm HRB 748431\nRegisterbekanntmachung nach dem Umwandlungsgesetz 06.12.2024 (Eintragungsdatum)\n\nZimmerei abartig GmbH\nGesellschaft mit beschränkter Haftung\nWolfegg\n\nAls nicht eingetragen wird bekanntgemacht:\nDen Gläubigern der an der Ausgliederung beteiligten Rechtsträger ist, wenn sie binnen sechs Monaten nach dem Tag, an dem die Eintragung der Ausgliederung in das Register des Sitzes desjenigen Rechtsträgers, dessen Gläubiger sie sind, nach § 19 Abs. 3 UmwG als bekanntgemacht gilt, ihren Anspruch nach Grund und Höhe schriftlich anmelden, Sicherheit zu leisten, soweit sie nicht Befriedigung verlangen können. Dieses Recht steht den Gläubigern jedoch nur zu, wenn sie glaubhaft machen, dass durch die Ausgliederung die Erfüllung ihrer Forderung gefährdet wird."
    },
    {
      "date": "2024-12-06",
      "id": "95627",
      "original_text": "Registerbekanntmachung nach dem Umwandlungsgesetz\nBaden-Württemberg Amtsgericht Stuttgart HRB 731163\nNAT AG Steuerberatungsgesellschaft – Reutlingen",
      "type": "Registerbekanntmachung nach dem Umwandlungsgesetz",
      "state": "Baden-Württemberg",
      "amtsgericht": "Amtsgericht Stuttgart",
      "registernummer": "HRB 731163",
      "registerart": "HRB",
      "company_name": "NAT AG Steuerberatungsgesellschaft",
      "company_seat": "Reutlingen",
      "details": "06.12.2024 (Bekanntmachungsdatum)\n\nBaden-Württemberg Amtsgericht Stuttgart HRB 731163\nRegisterbekanntmachung nach dem Umwandlungsgesetz 06.12.2024 (Eintragungsdatum)\n\nNAT AG Steuerberatungsgesellschaft\nAktiengesellschaft\nReutlingen\n\nDen Gläubigern des an dem Formwechsel beteiligten Rechtsträgers ist, wenn sie binnen sechs Monaten nach dem Tag, an dem die Eintragung des Formwechsels in das Register des Sitzes desjenigen Rechtsträgers, dessen Gläubiger sie sind, nach § 19 Abs. 3 UmwG als bekanntgemacht gilt, ihren Anspruch nach Grund und Höhe schriftlich anmelden, Sicherheit zu leisten, soweit sie nicht Befriedigung verlangen können. Dieses Recht steht den Gläubigern jedoch nur zu, wenn sie glaubhaft machen, dass durch den Formwechsel die Erfüllung ihrer Forderung gefährdet wird."
    },
    {
      "date": "2024-12-06",
      "id": "95628",
      "original_text": "Registerbekanntmachung nach dem Umwandlungsgesetz\nBaden-Württemberg Amtsgericht Stuttgart HRB 797436\nTechnivation GmbH – Waldachtal",
      "type": "Registerbekanntmachung nach dem Umwandlungsgesetz",
      "state": "Baden-Württemberg",
      "amtsgericht": "Amtsgericht Stuttgart",
      "registernummer": "HRB 797436",
      "registerart": "HRB",
      "company_name": "Technivation GmbH",
      "company_seat": "Waldachtal",
      "details": "06.12.2024 (Bekanntmachungsdatum)\n\nBaden-Württemberg Amtsgericht Stuttgart HRB 797436\nRegisterbekanntmachung nach dem Umwandlungsgesetz 06.12.2024 (Eintragungsdatum)\n\nTechnivation GmbH\nGesellschaft mit beschränkter Haftung\nWaldachtal\n\nDen Gläubigern des an dem Formwechsel beteiligten Rechtsträgers ist, wenn sie binnen sechs Monaten nach dem Tag, an dem die Eintragung des Formwechsels in das Register des Sitzes desjenigen Rechtsträgers, dessen Gläubiger sie sind, nach § 19 Abs. 3 UmwG als bekanntgemacht gilt, ihren Anspruch nach Grund und Höhe schriftlich anmelden, Sicherheit zu leisten, soweit sie nicht Befriedigung verlangen können. Dieses Recht steht den Gläubigern jedoch nur zu, wenn sie glaubhaft machen, dass durch den Formwechsel die Erfüllung ihrer Forderung gefährdet wird."
    },
    {
      "date": "2024-12-06",
      "id": "95629",
      "original_text": "Registerbekanntmachung nach dem Umwandlungsgesetz\nBaden-Württemberg Amtsgericht Stuttgart HRB 791873\nTechnivation AG – Waldachtal",
      "type": "Registerbekanntmachung nach dem Umwandlungsgesetz",
      "state": "Baden-Württemberg",
      "amtsgericht": "Amtsgericht Stuttgart",
      "registernummer": "HRB 791873",
      "registerart": "HRB",
      "company_name": "Technivation AG",
      "company_seat": "Waldachtal",
      "details": "06.12.2024 (Bekanntmachungsdatum)\n\nBaden-Württemberg Amtsgericht Stuttgart HRB 791873\nRegisterbekanntmachung nach dem Umwandlungsgesetz 06.12.2024 (Eintragungsdatum)\n\nTechnivation AG\nAktiengesellschaft\nWaldachtal\n\nDen Gläubigern des an dem Formwechsel beteiligten Rechtsträgers ist, wenn sie binnen sechs Monaten nach dem Tag, an dem die Eintragung des Formwechsels in das Register des Sitzes desjenigen Rechtsträgers, dessen Gläubiger sie sind, nach § 19 Abs. 3 UmwG als bekanntgemacht gilt, ihren Anspruch nach Grund und Höhe schriftlich anmelden, Sicherheit zu leisten, soweit sie nicht Befriedigung verlangen können. Dieses Recht steht den Gläubigern jedoch nur zu, wenn sie glaubhaft machen, dass durch den Formwechsel die Erfüllung ihrer Forderung gefährdet wird."
    },
    {
      "date": "2024-12-06",
      "id": "95630",
      "original_text": "Registerbekanntmachung nach dem Umwandlungsgesetz\nSchleswig-Holstein Amtsgericht Kiel HRB 9652\nBERNADES GRAGE SOCIETA´ GmbH – Molfsee",
      "type": "Registerbekanntmachung nach dem Umwandlungsgesetz",
      "state": "Schleswig-Holstein",
      "amtsgericht": "Amtsgericht Kiel",
      "registernummer": "HRB 9652",
      "registerart": "HRB",
      "company_name": "BERNADES GRAGE SOCIETA´ GmbH",
      "company_seat": "Molfsee",
      "details": "06.12.2024 (Bekanntmachungsdatum)\n\nSchleswig-Holstein Amtsgericht Kiel HRB 9652\nRegisterbekanntmachung nach dem Umwandlungsgesetz 06.12.2024 (Eintragungsdatum)\n\nBERNADES GRAGE SOCIETA´ GmbH\nGesellschaft mit beschränkter Haftung\nMolfsee\n\nZu Eintragungsnummer 3 vom 06.12.2024 wird als nicht eingetragen veröffentlicht: Als nicht eingetragen wird veröffentlicht: Den Gläubigern der an der Verschmelzung beteiligten Rechtsträger ist, wenn sie binnen sechs Monaten nach dem Tag, an dem die Eintragung der Verschmelzung in das Register des Sitzes desjenigen Rechtsträgers, dessen Gläubiger sie sind, nach § 19 Abs. 3 UmwG bekannt gemacht worden ist, ihren Anspruch nach Grund und Höhe schriftlich anmelden, Sicherheit zu leisten, soweit sie nicht Befriedigung verlangen können. Dieses Recht steht den Gläubigern jedoch nur zu, wenn sie glaubhaft machen, dass durch die Verschmelzung die Erfüllung ihrer Forderung gefährdet wird."
    },
    {
      "date": "2024-12-06",
      "id": "95631",
      "original_text": "Löschungsankündigung\nBerlin Amtsgericht Berlin (Charlottenburg) HRB 182300\nWannsee - Stern GmbH – Berlin",
      "type": "Löschungsankündigung",
      "state": "Berlin",
      "amtsgericht": "Amtsgericht Berlin (Charlottenburg)",
      "registernummer": "HRB 182300",
      "registerart": "HRB",
      "company_name": "Wannsee - Stern GmbH",
      "company_seat": "Berlin",
      "details": "06.12.2024 (Bekanntmachungsdatum)\n\nBerlin Amtsgericht Berlin (Charlottenburg) HRB 182300\nLöschungsankündigung\n\nWannsee - Stern GmbH\nGesellschaft mit beschränkter Haftung\nBerlin\n\nBei der nachstehenden Gesellschaft wird das Amtslöschungsverfahren gemäß § 394 FamFG eingeleitet. Widerspruchsfrist 6 Wochen"
    },
    {
      "date": "2024-12-06",
      "id": "95632",
      "original_text": "Löschungsankündigung\nThüringen Amtsgericht Jena HRB 513951\nRuch Verwaltungs UG (haftungsbeschränkt) – Jena",
      "type": "Löschungsankündigung",
      "state": "Thüringen",
      "amtsgericht": "Amtsgericht Jena",
      "registernummer": "HRB 513951",
      "registerart": "HRB",
      "company_name": "Ruch Verwaltungs UG (haftungsbeschränkt)",
      "company_seat": "Jena",
      "details": "06.12.2024 (Bekanntmachungsdatum)\n\nThüringen Amtsgericht Jena HRB 513951\nLöschungsankündigung\n\nRuch Verwaltungs UG (haftungsbeschränkt)\nGesellschaft mit beschränkter Haftung\nJena\n\nDas Registergericht beabsichtigt, die im Handelsregister eingetragene Gesellschaft wegen Vermögenslosigkeit nach § 394 FamFG von Amts wegen zu löschen. Die Frist zur Erhebung eines Widerspruchs gegen die beabsichtigte Löschung wird auf 6 Wochen festgesetzt."
    },
    {
      "date": "2024-12-06",
      "id": "95633",
      "original_text": "Löschungsankündigung\nBerlin Amtsgericht Berlin (Charlottenburg) HRB 174710\nhisNET GmbH – Berlin",
      "type": "Löschungsankündigung",
      "state": "Berlin",
      "amtsgericht": "Amtsgericht Berlin (Charlottenburg)",
      "registernummer": "HRB 174710",
      "registerart": "HRB",
      "company_name": "hisNET GmbH",
      "company_seat": "Berlin",
      "details": "06.12.2024 (Bekanntmachungsdatum)\n\nBerlin Amtsgericht Berlin (Charlottenburg) HRB 174710\nLöschungsankündigung\n\nhisNET GmbH\nGesellschaft mit beschränkter Haftung\nBerlin\n\nBei der nachstehenden Gesellschaft wird das Amtslöschungsverfahren gemäß § 394 FamFG eingeleitet. Widerspruchsfrist 6 Wochen"
    },
    {
      "date": "2024-12-06",
      "id": "95634",
      "original_text": "Löschungsankündigung\nBerlin Amtsgericht Berlin (Charlottenburg) HRB 174281\nParas Constantin UG (haftungsbeschränkt) – Berlin",
      "type": "Löschungsankündigung",
      "state": "Berlin",
      "amtsgericht": "Amtsgericht Berlin (Charlottenburg)",
      "registernummer": "HRB 174281",
      "registerart": "HRB",
      "company_name": "Paras Constantin UG (haftungsbeschränkt)",
      "company_seat": "Berlin",
      "details": "06.12.2024 (Bekanntmachungsdatum)\n\nBerlin Amtsgericht Berlin (Charlottenburg) HRB 174281\nLöschungsankündigung\n\nParas Constantin UG (haftungsbeschränkt)\nGesellschaft mit beschränkter Haftung\nBerlin\n\nBei der nachstehenden Gesellschaft wird das Amtslöschungsverfahren gemäß § 394 FamFG eingeleitet. Widerspruchsfrist\n6 Wochen"
    },
    {
      "date": "2024-12-06",
      "id": "95635",
      "original_text": "Registerbekanntmachung nach dem Umwandlungsgesetz\nBrandenburg Amtsgericht Neuruppin HRB 1564\nWolfshagener Rinder GmbH – Wolfshagen",
      "type": "Registerbekanntmachung nach dem Umwandlungsgesetz",
      "state": "Brandenburg",
      "amtsgericht": "Amtsgericht Neuruppin",
      "registernummer": "HRB 1564",
      "registerart": "HRB",
      "company_name": "Wolfshagener Rinder GmbH",
      "company_seat": "Wolfshagen",
      "details": "06.12.2024 (Bekanntmachungsdatum)\n\nBrandenburg Amtsgericht Neuruppin HRB 1564\nRegisterbekanntmachung nach dem Umwandlungsgesetz 06.12.2024 (Eintragungsdatum)\n\nWolfshagener Rinder GmbH\nGesellschaft mit beschränkter Haftung\nWolfshagen\n\nZu Eintragungsnummer 6 vom 06.12.2024 wird als nicht eingetragen veröffentlicht:\n\nDen Gläubigern der an der Umwandlung beteiligten Rechtsträger ist, wenn sie binnen sechs Monaten nach dem Tag, an dem die Eintragung der Umwandlung in das Register des Sitzes desjenigen Rechtsträgers, dessen Gläubiger sie sind, als bekannt gemacht gilt, ihren Anspruch nach Grund und Höhe schriftlich anmelden, Sicherheit zu leisten, soweit sie nicht Befriedigung verlangen können. Dieses Recht steht den Gläubigern jedoch nur zu, wenn sie glaubhaft machen, dass durch die Umwandlung die Erfüllung ihrer Forderung gefährdet wird"
    },
    {
      "date": "2024-12-06",
      "id": "95636",
      "original_text": "Registerbekanntmachung nach dem Umwandlungsgesetz\nBaden-Württemberg Amtsgericht Stuttgart HRB 790336\nBlässinger Vertriebs GmbH – Stuttgart",
      "type": "Registerbekanntmachung nach dem Umwandlungsgesetz",
      "state": "Baden-Württemberg",
      "amtsgericht": "Amtsgericht Stuttgart",
      "registernummer": "HRB 790336",
      "registerart": "HRB",
      "company_name": "Blässinger Vertriebs GmbH",
      "company_seat": "Stuttgart",
      "details": "06.12.2024 (Bekanntmachungsdatum)\n\nBaden-Württemberg Amtsgericht Stuttgart HRB 790336\nRegisterbekanntmachung nach dem Umwandlungsgesetz 06.12.2024 (Eintragungsdatum)\n\nBlässinger Vertriebs GmbH\nGesellschaft mit beschränkter Haftung\nStuttgart\n\nAls nicht eingetragen wird bekanntgemacht:\nDen Gläubigern der an der Verschmelzung beteiligten Rechtsträger ist, wenn sie binnen sechs Monaten nach dem Tag, an dem die Eintragung der Verschmelzung in das Register des Sitzes desjenigen Rechtsträgers, dessen Gläubiger sie sind, nach § 19 Abs. 3 UmwG als bekanntgemacht gilt, ihren Anspruch nach Grund und Höhe schriftlich anmelden, Sicherheit zu leisten, soweit sie nicht Befriedigung verlangen können. Dieses Recht steht den Gläubigern jedoch nur zu, wenn sie glaubhaft machen, dass durch die Verschmelzung die Erfüllung ihrer Forderung gefährdet wird."
    },
    {
      "date": "2024-12-06",
      "id": "95637",
      "original_text": "Registerbekanntmachung nach dem Umwandlungsgesetz\nBerlin Amtsgericht Berlin (Charlottenburg) HRA 63670\nUIW Lux West 1 GmbH & Co. KG – Berlin",
      "type": "Registerbekanntmachung nach dem Umwandlungsgesetz",
      "state": "Berlin",
      "amtsgericht": "Amtsgericht Berlin (Charlottenburg)",
      "registernummer": "HRA 63670",
      "registerart": "HRA",
      "company_name": "UIW Lux West 1 GmbH & Co. KG",
      "company_seat": "Berlin",
      "details": "06.12.2024 (Bekanntmachungsdatum)\n\nBerlin Amtsgericht Berlin (Charlottenburg) HRA 63670\nRegisterbekanntmachung nach dem Umwandlungsgesetz 05.12.2024 (Eintragungsdatum)\n\nUIW Lux West 1 GmbH & Co. KG\nKommanditgesellschaft\nBerlin\n\nZu Eintragungsnummer 1 vom 05.12.2024 wird als nicht eingetragen veröffentlicht: Den Gläubigern ist, wenn sie binnen sechs Monaten nach dem Tag, an dem die Eintragung der Umwandlung als bekannt gemacht gilt, ihren Anspruch nach Grund und Höhe schriftlich anmelden, Sicherheit zu leisten, soweit sie nicht Befriedigung verlangen können. Dieses Recht steht den Gläubigern jedoch nur zu, wenn sie glaubhaft machen, dass durch die Umwandlung die Erfüllung ihrer Forderung gefährdet wird. Das Recht, Sicherheitsleistung zu verlangen, steht Gläubigern nicht zu, die im Falle der Insolvenz ein Recht auf vorzugsweise Befriedigung aus einer Deckungsmasse haben, die nach gesetzlicher Vorschrift zu ihrem Schutz errichtet und staatlich überwacht ist."
    },
    {
      "date": "2024-12-06",
      "id": "95638",
      "original_text": "Sonstige Registerbekanntmachung\nSachsen-Anhalt Amtsgericht Stendal GnR 115\nAgrarwirtschaftliche Genossenschaft Badingen eG – Bismark (Altmark) OT Badingen",
      "type": "Sonstige Registerbekanntmachung",
      "state": "Sachsen-Anhalt",
      "amtsgericht": "Amtsgericht Stendal",
      "registernummer": "GnR 115",
      "registerart": "GnR",
      "company_name": "Agrarwirtschaftliche Genossenschaft Badingen eG",
      "company_seat": "Bismark (Altmark) OT Badingen",
      "details": "06.12.2024 (Bekanntmachungsdatum)\n\nSachsen-Anhalt Amtsgericht Stendal GnR 115\nSonstige Registerbekanntmachung 06.12.2024 (Eintragungsdatum)\n\nAgrarwirtschaftliche Genossenschaft Badingen eG\neingetragene Genossenschaft\nBismark (Altmark) OT Badingen\n\nIm Zuge der am  06.12.2024  eingetragenen Satzungsneufassung erfolgte folgende Änderung des bisherigen § 37 Abs. 1 und 2 nun neu §  10 Abs 1 und 2:\n(1) Ein Geschäftsanteil beträgt 50,00 EUR. Es müssen mindestens 50 Geschäftsanteile als Pflichtbeteiligung gezeichnet werden.\n(2) Zwei Geschäftsanteile sind durch die Mitglieder bei Eintritt sofort einzuzahlen. Der\nVorstand kann die Einzahlung in Raten zulassen. In diesem Fall sind die weiteren\nGeschäftsanteile innerhalb von 12 Monaten voll einzuzahlen. Die vorzeitige Volleinzahlung\nder Geschäftsanteile ist zugelassen.\n\nAls nicht eingetragen wird veröffentlicht und bekanntgegeben:\n\nDen Gläubigern der Genossenschaft ist, wenn sie sich binnen 6 Monaten nach der Bekanntmachung bei der Genossenschaft zu diesem Zweck melden, Sicherheit zu leisten, soweit sie nicht Befriedigung verlangen können (§ 22 Abs. 1 bis 3 GenG)."
    },
    {
      "date": "2024-12-06",
      "id": "95639",
      "original_text": "Einreichung neuer Dokumente\nBerlin Amtsgericht Berlin (Charlottenburg) HRB 83923\nToll Collect GmbH – Berlin",
      "type": "Einreichung neuer Dokumente",
      "state": "Berlin",
      "amtsgericht": "Amtsgericht Berlin (Charlottenburg)",
      "registernummer": "HRB 83923",
      "registerart": "HRB",
      "company_name": "Toll Collect GmbH",
      "company_seat": "Berlin",
      "details": "06.12.2024 (Bekanntmachungsdatum)\n\nBerlin Amtsgericht Berlin (Charlottenburg) HRB 83923\nEinreichung neuer Dokumente\n\nToll Collect GmbH\nGesellschaft mit beschränkter Haftung\nBerlin\n\nAls nicht eingetragen wird veröffentlicht:\n\nEs wurde eine neue Liste der Aufsichtsratsmitglieder eingereicht (§52 GmbHG)."
    },
    {
      "date": "2024-12-06",
      "id": "95640",
      "original_text": "Registerbekanntmachung nach dem Umwandlungsgesetz\nBerlin Amtsgericht Berlin (Charlottenburg) HRA 63674\nUIW Lux Nord 2 GmbH & Co. KG – Berlin",
      "type": "Registerbekanntmachung nach dem Umwandlungsgesetz",
      "state": "Berlin",
      "amtsgericht": "Amtsgericht Berlin (Charlottenburg)",
      "registernummer": "HRA 63674",
      "registerart": "HRA",
      "company_name": "UIW Lux Nord 2 GmbH & Co. KG",
      "company_seat": "Berlin",
      "details": "06.12.2024 (Bekanntmachungsdatum)\n\nBerlin Amtsgericht Berlin (Charlottenburg) HRA 63674\nRegisterbekanntmachung nach dem Umwandlungsgesetz 05.12.2024 (Eintragungsdatum)\n\nUIW Lux Nord 2 GmbH & Co. KG\nKommanditgesellschaft\nBerlin\n\nZu Eintragungsnummer 1 vom 05.12.2024 wird als nicht eingetragen veröffentlicht: Den Gläubigern ist, wenn sie binnen sechs Monaten nach dem Tag, an dem die Eintragung der Umwandlung als bekannt gemacht gilt, ihren Anspruch nach Grund und Höhe schriftlich anmelden, Sicherheit zu leisten, soweit sie nicht Befriedigung verlangen können. Dieses Recht steht den Gläubigern jedoch nur zu, wenn sie glaubhaft machen, dass durch die Umwandlung die Erfüllung ihrer Forderung gefährdet wird. Das Recht, Sicherheitsleistung zu verlangen, steht Gläubigern nicht zu, die im Falle der Insolvenz ein Recht auf vorzugsweise Befriedigung aus einer Deckungsmasse haben, die nach gesetzlicher Vorschrift zu ihrem Schutz errichtet und staatlich überwacht ist."
    },
    {
      "date": "2024-12-06",
      "id": "95641",
      "original_text": "Löschungsankündigung\nSaarland Amtsgericht Saarbrücken HRB 104265\nBrauhof Saar GmbH – Saarbrücken",
      "type": "Löschungsankündigung",
      "state": "Saarland",
      "amtsgericht": "Amtsgericht Saarbrücken",
      "registernummer": "HRB 104265",
      "registerart": "HRB",
      "company_name": "Brauhof Saar GmbH",
      "company_seat": "Saarbrücken",
      "details": "06.12.2024 (Bekanntmachungsdatum)\n\nSaarland Amtsgericht Saarbrücken HRB 104265\nLöschungsankündigung\n\nBrauhof Saar GmbH\nGesellschaft mit beschränkter Haftung\nSaarbrücken\n\nEs ist beabsichtigt, die Gesellschaft von Amts wegen gemäß § 394 FamFG wegen Vermögenslosigkeit zu löschen.\nGegen die Löschung von Amts wegen ist das Rechtsmittel des Widerspruchs statthaft. Der Widerspruch ist binnen einer Frist drei Monaten beginnend mit dem Tag dieser Veröffentlichung durch Einreichen eines Widerspruchsschreibens -schriftlich oder zur Niederschrift der Geschäftsstelle beim Amtsgericht Saarbrücken, -zentrales Handelsregister-, Mainzerstr.178, 66121 Saarbrücken einzulegen.\nDer Widerspruch muss die Bezeichnung der angefochtenen Löschungsankündigung enthalten sowie die Erklärung, dass Widerspruch eingelegt wird. Er ist vom Widerspruchsführer oder seinem Bevollmächtigten zu unterzeichnen.\nDas Widerspruchsschreiben kann auch in der Form eines elektronischen Dokumentes eingereicht werden, das mit einer qualifizierten elektronischen Signatur nach dem Signaturgesetz versehen sein muss (§§ 14 Abs. 2 FamFG, 130a, 298 ZPO)."
    },
    {
      "date": "2024-12-06",
      "id": "95642",
      "original_text": "Registerbekanntmachung nach dem Umwandlungsgesetz\nSchleswig-Holstein Amtsgericht Lübeck HRB 20445\nMACH Holding GmbH – Lübeck",
      "type": "Registerbekanntmachung nach dem Umwandlungsgesetz",
      "state": "Schleswig-Holstein",
      "amtsgericht": "Amtsgericht Lübeck",
      "registernummer": "HRB 20445",
      "registerart": "HRB",
      "company_name": "MACH Holding GmbH",
      "company_seat": "Lübeck",
      "details": "06.12.2024 (Bekanntmachungsdatum)\n\nSchleswig-Holstein Amtsgericht Lübeck HRB 20445\nRegisterbekanntmachung nach dem Umwandlungsgesetz 05.12.2024 (Eintragungsdatum)\n\nMACH Holding GmbH\nGesellschaft mit beschränkter Haftung\nLübeck\n\nZu Eintragungsnummer 13 vom 05.12.2024 wird als nicht eingetragen veröffentlicht:  Als nicht eingetragen wird veröffentlicht: Den Gläubigern der an der Verschmelzung beteiligten Rechtsträger ist, wenn sie binnen sechs Monaten nach dem Tag, an dem die Eintragung der Verschmelzung in das Register des Sitzes desjenigen Rechtsträgers, dessen Gläubiger sie sind, als bekannt gemacht gilt, ihren Anspruch nach Grund und Höhe schriftlich anmelden, Sicherheit zu leisten, soweit sie nicht Befriedigung verlangen können. Dieses Recht steht den Gläubigern jedoch nur zu, wenn sie glaubhaft machen, dass durch die Verschmelzung die Erfüllung ihrer Forderung gefährdet wird."
    },
    {
      "date": "2024-12-06",
      "id": "95643",
      "original_text": "Registerbekanntmachung nach dem Umwandlungsgesetz\nHamburg Amtsgericht Hamburg HRB 146159\nAengenesch Beteiligungen UG (haftungsbeschränkt) – Hamburg",
      "type": "Registerbekanntmachung nach dem Umwandlungsgesetz",
      "state": "Hamburg",
      "amtsgericht": "Amtsgericht Hamburg",
      "registernummer": "HRB 146159",
      "registerart": "HRB",
      "company_name": "Aengenesch Beteiligungen UG (haftungsbeschränkt)",
      "company_seat": "Hamburg",
      "details": "06.12.2024 (Bekanntmachungsdatum)\n\nHamburg Amtsgericht Hamburg HRB 146159\nRegisterbekanntmachung nach dem Umwandlungsgesetz 06.12.2024 (Eintragungsdatum)\n\nAengenesch Beteiligungen UG (haftungsbeschränkt)\nGesellschaft mit beschränkter Haftung\nHamburg\n\nAls nicht eingetragen wird bekannt gemacht:\nDen Gläubigern der an der Verschmelzung beteiligten Gesellschaften ist, wenn sie binnen sechs Monaten nach dem Tag, an dem die Eintragung der Verschmelzung in das Register des Sitzes desjenigen Rechtsträgers, dessen Gläubiger sie sind, nach § 19 Absatz 3 UmwG als bekannt gemacht gilt, ihren Anspruch nach Grund und Höhe schriftlich anmelden, Sicherheit zu leisten, soweit sie nicht Befriedigung verlangen können. Dieses Recht steht den Gläubigern jedoch nur zu, wenn sie glaubhaft machen, dass durch die Verschmelzung die Erfüllung ihrer Forderung gefährdet wird."
    },
    {
      "date": "2024-12-06",
      "id": "95644",
      "original_text": "Registerbekanntmachung nach dem Umwandlungsgesetz\nHamburg Amtsgericht Hamburg HRB 146092\nForecash Solutions UG (haftungsbeschränkt) – Hamburg",
      "type": "Registerbekanntmachung nach dem Umwandlungsgesetz",
      "state": "Hamburg",
      "amtsgericht": "Amtsgericht Hamburg",
      "registernummer": "HRB 146092",
      "registerart": "HRB",
      "company_name": "Forecash Solutions UG (haftungsbeschränkt)",
      "company_seat": "Hamburg",
      "details": "06.12.2024 (Bekanntmachungsdatum)\n\nHamburg Amtsgericht Hamburg HRB 146092\nRegisterbekanntmachung nach dem Umwandlungsgesetz 06.12.2024 (Eintragungsdatum)\n\nForecash Solutions UG (haftungsbeschränkt)\nGesellschaft mit beschränkter Haftung\nHamburg\n\nAls nicht eingetragen wird bekannt gemacht:\nDen Gläubigern der an der Verschmelzung beteiligten Gesellschaften ist, wenn sie binnen sechs Monaten nach dem Tag, an dem die Eintragung der Verschmelzung in das Register des Sitzes desjenigen Rechtsträgers, dessen Gläubiger sie sind, nach § 19 Absatz 3 UmwG als bekannt gemacht gilt, ihren Anspruch nach Grund und Höhe schriftlich anmelden, Sicherheit zu leisten, soweit sie nicht Befriedigung verlangen können. Dieses Recht steht den Gläubigern jedoch nur zu, wenn sie glaubhaft machen, dass durch die Verschmelzung die Erfüllung ihrer Forderung gefährdet wird."
    },
    {
      "date": "2024-12-06",
      "id": "95645",
      "original_text": "Löschungsankündigung\nBerlin Amtsgericht Berlin (Charlottenburg) HRA 48117\nWENKON GmbH & Co. KG – Berlin",
      "type": "Löschungsankündigung",
      "state": "Berlin",
      "amtsgericht": "Amtsgericht Berlin (Charlottenburg)",
      "registernummer": "HRA 48117",
      "registerart": "HRA",
      "company_name": "WENKON GmbH & Co. KG",
      "company_seat": "Berlin",
      "details": "06.12.2024 (Bekanntmachungsdatum)\n\nBerlin Amtsgericht Berlin (Charlottenburg) HRA 48117\nLöschungsankündigung\n\nWENKON GmbH & Co. KG\nKommanditgesellschaft\nBerlin\n\nBei dem nachstehenden Unternehmen / der nachstehenden Gesellschaft wird das Amtslöschungsverfahren gemäß § 31 Abs. 2 HGB eingeleitet. Widerspruchsfrist 1 Monat"
    },
    {
      "date": "2024-12-06",
      "id": "95646",
      "original_text": "Registerbekanntmachung nach dem Umwandlungsgesetz\nBerlin Amtsgericht Berlin (Charlottenburg) HRB 174704\nTHOR-Portfolio Beteiligungs GmbH – Berlin",
      "type": "Registerbekanntmachung nach dem Umwandlungsgesetz",
      "state": "Berlin",
      "amtsgericht": "Amtsgericht Berlin (Charlottenburg)",
      "registernummer": "HRB 174704",
      "registerart": "HRB",
      "company_name": "THOR-Portfolio Beteiligungs GmbH",
      "company_seat": "Berlin",
      "details": "06.12.2024 (Bekanntmachungsdatum)\n\nBerlin Amtsgericht Berlin (Charlottenburg) HRB 174704\nRegisterbekanntmachung nach dem Umwandlungsgesetz 04.12.2024 (Eintragungsdatum)\n\nTHOR-Portfolio Beteiligungs GmbH\nGesellschaft mit beschränkter Haftung\nBerlin\n\nZu Eintragungsnummer 14 vom 04.12.2024 wird als nicht eingetragen veröffentlicht:  Den Gläubigern ist, wenn sie binnen sechs Monaten nach dem Tag, an dem die Eintragung der Umwandlung als bekannt gemacht gilt, ihren Anspruch nach Grund und Höhe schriftlich anmelden, Sicherheit zu leisten, soweit sie nicht Befriedigung verlangen können. Dieses Recht steht den Gläubigern jedoch nur zu, wenn sie glaubhaft machen, dass durch die Umwandlung die Erfüllung ihrer Forderung gefährdet wird. Das Recht, Sicherheitsleistung zu verlangen, steht Gläubigern nicht zu, die im Falle der Insolvenz ein Recht auf vorzugsweise Befriedigung aus einer Deckungsmasse haben, die nach gesetzlicher Vorschrift zu ihrem Schutz errichtet und staatlich überwacht ist."
    },
    {
      "date": "2024-12-06",
      "id": "95647",
      "original_text": "Löschungsankündigung\nMecklenburg-Vorpommern Amtsgericht Schwerin HRB 12713\nMagniflySolutions GmbH – Schwerin",
      "type": "Löschungsankündigung",
      "state": "Mecklenburg-Vorpommern",
      "amtsgericht": "Amtsgericht Schwerin",
      "registernummer": "HRB 12713",
      "registerart": "HRB",
      "company_name": "MagniflySolutions GmbH",
      "company_seat": "Schwerin",
      "details": "06.12.2024 (Bekanntmachungsdatum)\n\nMecklenburg-Vorpommern Amtsgericht Schwerin HRB 12713\nLöschungsankündigung\n\nMagniflySolutions GmbH\nGesellschaft mit beschränkter Haftung\nSchwerin\n\nDas Registergericht beabsichtigt, die im Handelsregister eingetragene Gesellschaft von Amts wegen nach § 394 FamFG zu löschen. Die Frist zur Erhebung eines Widerspruchs gegen die beabsichtigte Löschung wird auf 1 Monat festgesetzt."
    },
    {
      "date": "2024-12-06",
      "id": "95648",
      "original_text": "Löschungsankündigung\nBerlin Amtsgericht Berlin (Charlottenburg) HRB 228491\nIAMIAM UG (haftungsbeschränkt) – Berlin",
      "type": "Löschungsankündigung",
      "state": "Berlin",
      "amtsgericht": "Amtsgericht Berlin (Charlottenburg)",
      "registernummer": "HRB 228491",
      "registerart": "HRB",
      "company_name": "IAMIAM UG (haftungsbeschränkt)",
      "company_seat": "Berlin",
      "details": "06.12.2024 (Bekanntmachungsdatum)\n\nBerlin Amtsgericht Berlin (Charlottenburg) HRB 228491\nLöschungsankündigung\n\nIAMIAM UG (haftungsbeschränkt)\nGesellschaft mit beschränkter Haftung\nBerlin\n\nBei der nachstehenden Gesellschaft wird das Amtslöschungsverfahren gemäß § 394 FamFG eingeleitet. Widerspruchsfrist 6 Wochen"
    },
    {
      "date": "2024-12-06",
      "id": "95649",
      "original_text": "Registerbekanntmachung nach dem Umwandlungsgesetz\nHamburg Amtsgericht Hamburg HRB 134393\nExporo AG – Hamburg",
      "type": "Registerbekanntmachung nach dem Umwandlungsgesetz",
      "state": "Hamburg",
      "amtsgericht": "Amtsgericht Hamburg",
      "registernummer": "HRB 134393",
      "registerart": "HRB",
      "company_name": "Exporo AG",
      "company_seat": "Hamburg",
      "details": "06.12.2024 (Bekanntmachungsdatum)\n\nHamburg Amtsgericht Hamburg HRB 134393\nRegisterbekanntmachung nach dem Umwandlungsgesetz\n\nExporo AG\nAktiengesellschaft\nHamburg\n\nDie Gesellschaft hat gemäß § 61 UmwG den Verschmelzungsvertrag vom 04.12.2024 bei dem Handelsregister eingereicht, mit dem die Civum GmbH mit Sitz in Hamburg (AG Hamburg, HRB 133804) als übertragende Gesellschaft auf die Exporo AG mit Sitz in Hamburg (AG Hamburg, HRB 134393) als übernehmende Gesellschaft verschmolzen wird."
    },
    {
      "date": "2024-12-06",
      "id": "95650",
      "original_text": "Löschungsankündigung\nSachsen Amtsgericht Chemnitz HRB 9683\nECONCEPT Projektmanagement GmbH – Zwickau",
      "type": "Löschungsankündigung",
      "state": "Sachsen",
      "amtsgericht": "Amtsgericht Chemnitz",
      "registernummer": "HRB 9683",
      "registerart": "HRB",
      "company_name": "ECONCEPT Projektmanagement GmbH",
      "company_seat": "Zwickau",
      "details": "06.12.2024 (Bekanntmachungsdatum)\n\nSachsen Amtsgericht Chemnitz HRB 9683\nLöschungsankündigung\n\nECONCEPT Projektmanagement GmbH\nGesellschaft mit beschränkter Haftung\nZwickau\n\nDas Registergericht beabsichtigt, die im Handelsregister eingetragene Gesellschaft von Amts wegen nach § 394 FamFG zu löschen. Die Frist zu Erhebung eines Widerspruchs gegen die beabsichtigte Löschung wird auf einen Monat festgesetzt."
    },
    {
      "date": "2024-12-06",
      "id": "95651",
      "original_text": "Löschungsankündigung\nSachsen Amtsgericht Dresden HRB 12454\nKnöll Wohnungsverwaltungsgesellschaft mbH – Pirna",
      "type": "Löschungsankündigung",
      "state": "Sachsen",
      "amtsgericht": "Amtsgericht Dresden",
      "registernummer": "HRB 12454",
      "registerart": "HRB",
      "company_name": "Knöll Wohnungsverwaltungsgesellschaft mbH",
      "company_seat": "Pirna",
      "details": "06.12.2024 (Bekanntmachungsdatum)\n\nSachsen Amtsgericht Dresden HRB 12454\nLöschungsankündigung\n\nKnöll Wohnungsverwaltungsgesellschaft mbH\nGesellschaft mit beschränkter Haftung\nPirna\n\nDas Registergericht beabsichtigt, die im Handelsregister eingetragene Gesellschaft von Amts wegen nach § 394 FamFG zu löschen. Die Frist zu Erhebung eines Widerspruchs gegen die beabsichtigte Löschung wird auf einen Monat festgesetzt."
    },
    {
      "date": "2024-12-06",
      "id": "95652",
      "original_text": "Löschungsankündigung\nSachsen Amtsgericht Leipzig HRB 2703\nWindolph Bauunternehmung GmbH – Leipzig",
      "type": "Löschungsankündigung",
      "state": "Sachsen",
      "amtsgericht": "Amtsgericht Leipzig",
      "registernummer": "HRB 2703",
      "registerart": "HRB",
      "company_name": "Windolph Bauunternehmung GmbH",
      "company_seat": "Leipzig",
      "details": "06.12.2024 (Bekanntmachungsdatum)\n\nSachsen Amtsgericht Leipzig HRB 2703\nLöschungsankündigung\n\nWindolph Bauunternehmung GmbH\nGesellschaft mit beschränkter Haftung\nLeipzig\n\nDas Registergericht beabsichtigt, den im Handelsregister eingetragenen Geschäftsführer Bartczak, Roman von Amts wegen nach § 395 Absatz 1 FamFG zu löschen. Die Frist zu Erhebung eines Widerspruchs gegen die beabsichtigte Löschung wird auf einen Monat festgesetzt."
    },
    {
      "date": "2024-12-06",
      "id": "95653",
      "original_text": "Registerbekanntmachung nach dem Umwandlungsgesetz\nNiedersachsen Amtsgericht Osnabrück HRB 220671\nDS Beteiligung GmbH – Bissendorf",
      "type": "Registerbekanntmachung nach dem Umwandlungsgesetz",
      "state": "Niedersachsen",
      "amtsgericht": "Amtsgericht Osnabrück",
      "registernummer": "HRB 220671",
      "registerart": "HRB",
      "company_name": "DS Beteiligung GmbH",
      "company_seat": "Bissendorf",
      "details": "06.12.2024 (Bekanntmachungsdatum)\n\nNiedersachsen Amtsgericht Osnabrück HRB 220671\nRegisterbekanntmachung nach dem Umwandlungsgesetz 06.12.2024 (Eintragungsdatum)\n\nDS Beteiligung GmbH\nGesellschaft mit beschränkter Haftung\nBissendorf\n\nDen Gläubigern der an der Verschmelzung beteiligten Rechtsträger ist, wenn sie binnen sechs Monaten nach dem Tag, an dem die Eintragung der Verschmelzung in das Register des Sitzes desjenigen Rechtsträgers, dessen Gläubiger sie sind, nach § 19  Abs.  3 UmwG als bekannt gemacht gilt, ihren Anspruch nach Grund und Höhe schriftlich anmelden, Sicherheit zu leisten, soweit sie nicht Befriedigung verlangen können. Dieses Recht steht den Gläubigern jedoch nur zu, wenn sie glaubhaft machen, dass durch die Verschmelzung die Erfüllung der Forderung gefährdet wird."
    },
    {
      "date": "2024-12-06",
      "id": "95654",
      "original_text": "Registerbekanntmachung nach dem Umwandlungsgesetz\nNiedersachsen Amtsgericht Lüneburg HRA 110687 früher Amtsgericht Winsen\nSechste DGI GmbH & Co. KG – Egestorf",
      "type": "Registerbekanntmachung nach dem Umwandlungsgesetz",
      "state": "Niedersachsen",
      "amtsgericht": "Amtsgericht Lüneburg",
      "registernummer": "HRA 110687",
      "registerart": "HRA",
      "company_name": "Sechste DGI GmbH & Co. KG",
      "company_seat": "Egestorf",
      "former_amtsgericht": "Winsen",
      "details": "06.12.2024 (Bekanntmachungsdatum)\n\nNiedersachsen Amtsgericht Lüneburg HRA 110687 früher Amtsgericht Winsen\nRegisterbekanntmachung nach dem Umwandlungsgesetz 06.12.2024 (Eintragungsdatum)\n\nSechste DGI GmbH & Co. KG\nKommanditgesellschaft\nEgestorf\n\nDen Gläubigern der an der Verschmelzung beteiligten Rechtsträger ist, wenn sie binnen sechs Monaten nach dem Tag, an dem die Eintragung der Verschmelzung in das Register des Sitzes desjenigen Rechtsträgers, dessen Gläubiger sie sind, nach § 19  Abs.  3 UmwG als bekannt gemacht gilt, ihren Anspruch nach Grund und Höhe schriftlich anmelden, Sicherheit zu leisten, soweit sie nicht Befriedigung verlangen können. Dieses Recht steht den Gläubigern jedoch nur zu, wenn sie glaubhaft machen, dass durch die Verschmelzung die Erfüllung der Forderung gefährdet wird."
    },
    {
      "date": "2024-12-06",
      "id": "95655",
      "original_text": "Löschungsankündigung\nNiedersachsen Amtsgericht Lüneburg HRB 203544\nGLOBAL SERVICE & SOLUTIONS UG (haftungsbeschränkt) – Seevetal",
      "type": "Löschungsankündigung",
      "state": "Niedersachsen",
      "amtsgericht": "Amtsgericht Lüneburg",
      "registernummer": "HRB 203544",
      "registerart": "HRB",
      "company_name": "GLOBAL SERVICE & SOLUTIONS UG (haftungsbeschränkt)",
      "company_seat": "Seevetal",
      "details": "06.12.2024 (Bekanntmachungsdatum)\n\nNiedersachsen Amtsgericht Lüneburg HRB 203544\nLöschungsankündigung\n\nGLOBAL SERVICE & SOLUTIONS UG (haftungsbeschränkt)\nGesellschaft mit beschränkter Haftung\nSeevetal\n\nDas Registergericht beabsichtigt, die Gesellschaft von Amts wegen nach § 394 FamFG zu löschen. Die Frist zur Erhebung eines Widerspruchs ist auf 1 Monat ab dieser Registerbekanntmachung festgesetzt."
    },
    {
      "date": "2024-12-06",
      "id": "95656",
      "original_text": "Einreichung neuer Dokumente\nNiedersachsen Amtsgericht Oldenburg (Oldenburg) HRB 218117\nRegionalwert AG Bremen & Weser-Ems – Oldenburg",
      "type": "Einreichung neuer Dokumente",
      "state": "Niedersachsen",
      "amtsgericht": "Amtsgericht Oldenburg (Oldenburg)",
      "registernummer": "HRB 218117",
      "registerart": "HRB",
      "company_name": "Regionalwert AG Bremen & Weser-Ems",
      "company_seat": "Oldenburg",
      "details": "06.12.2024 (Bekanntmachungsdatum)\n\nNiedersachsen Amtsgericht Oldenburg (Oldenburg) HRB 218117\nEinreichung neuer Dokumente\n\nRegionalwert AG Bremen & Weser-Ems\nAktiengesellschaft\nOldenburg\n\nDie Liste der Mitglieder des Aufsichtsrats wurde beim Registergericht eingereicht."
    },
    {
      "date": "2024-12-06",
      "id": "95657",
      "original_text": "Einreichung neuer Dokumente\nNiedersachsen Amtsgericht Göttingen HRB 3415\nRohde AG – Göttingen",
      "type": "Einreichung neuer Dokumente",
      "state": "Niedersachsen",
      "amtsgericht": "Amtsgericht Göttingen",
      "registernummer": "HRB 3415",
      "registerart": "HRB",
      "company_name": "Rohde AG",
      "company_seat": "Göttingen",
      "details": "06.12.2024 (Bekanntmachungsdatum)\n\nNiedersachsen Amtsgericht Göttingen HRB 3415\nEinreichung neuer Dokumente\n\nRohde AG\nAktiengesellschaft\nGöttingen\n\nDie Liste der Mitglieder des Aufsichtsrats wurde beim Registergericht eingereicht."
    },
    {
      "date": "2024-12-06",
      "id": "95658",
      "original_text": "Registerbekanntmachung nach dem Umwandlungsgesetz\nNiedersachsen Amtsgericht Lüneburg HRA 110754 früher Amtsgericht Winsen\nGraubner Projektentwicklung GmbH & Co. KG – Egestorf",
      "type": "Registerbekanntmachung nach dem Umwandlungsgesetz",
      "state": "Niedersachsen",
      "amtsgericht": "Amtsgericht Lüneburg",
      "registernummer": "HRA 110754",
      "registerart": "HRA",
      "company_name": "Graubner Projektentwicklung GmbH & Co. KG",
      "company_seat": "Egestorf",
      "former_amtsgericht": "Winsen",
      "details": "06.12.2024 (Bekanntmachungsdatum)\n\nNiedersachsen Amtsgericht Lüneburg HRA 110754 früher Amtsgericht Winsen\nRegisterbekanntmachung nach dem Umwandlungsgesetz 06.12.2024 (Eintragungsdatum)\n\nGraubner Projektentwicklung GmbH & Co. KG\nKommanditgesellschaft\nEgestorf\n\nDen Gläubigern der an der Verschmelzung beteiligten Rechtsträger ist, wenn sie binnen sechs Monaten nach dem Tag, an dem die Eintragung der Verschmelzung in das Register des Sitzes desjenigen Rechtsträgers, dessen Gläubiger sie sind, nach § 19  Abs.  3 UmwG als bekannt gemacht gilt, ihren Anspruch nach Grund und Höhe schriftlich anmelden, Sicherheit zu leisten, soweit sie nicht Befriedigung verlangen können. Dieses Recht steht den Gläubigern jedoch nur zu, wenn sie glaubhaft machen, dass durch die Verschmelzung die Erfüllung der Forderung gefährdet wird."
    },
    {
      "date": "2024-12-06",
      "id": "95659",
      "original_text": "Einreichung neuer Dokumente\nNiedersachsen Amtsgericht Braunschweig HRB 100988 früher Amtsgericht Wolfsburg\nBrose Sitech GmbH – Wolfsburg",
      "type": "Einreichung neuer Dokumente",
      "state": "Niedersachsen",
      "amtsgericht": "Amtsgericht Braunschweig",
      "registernummer": "HRB 100988",
      "registerart": "HRB",
      "company_name": "Brose Sitech GmbH",
      "company_seat": "Wolfsburg",
      "former_amtsgericht": "Wolfsburg",
      "details": "06.12.2024 (Bekanntmachungsdatum)\n\nNiedersachsen Amtsgericht Braunschweig HRB 100988 früher Amtsgericht Wolfsburg\nEinreichung neuer Dokumente\n\nBrose Sitech GmbH\nGesellschaft mit beschränkter Haftung\nWolfsburg\n\nDie Liste der Mitglieder des Aufsichtsrats wurde beim Registergericht eingereicht."
    },
    {
      "date": "2024-12-06",
      "id": "95660",
      "original_text": "Registerbekanntmachung nach dem Umwandlungsgesetz\nNiedersachsen Amtsgericht Braunschweig HRB 211909\nBÖRKER Vermögensverwaltung GmbH – Langelsheim",
      "type": "Registerbekanntmachung nach dem Umwandlungsgesetz",
      "state": "Niedersachsen",
      "amtsgericht": "Amtsgericht Braunschweig",
      "registernummer": "HRB 211909",
      "registerart": "HRB",
      "company_name": "BÖRKER Vermögensverwaltung GmbH",
      "company_seat": "Langelsheim",
      "details": "06.12.2024 (Bekanntmachungsdatum)\n\nNiedersachsen Amtsgericht Braunschweig HRB 211909\nRegisterbekanntmachung nach dem Umwandlungsgesetz 06.12.2024 (Eintragungsdatum)\n\nBÖRKER Vermögensverwaltung GmbH\nGesellschaft mit beschränkter Haftung\nLangelsheim\n\nDen Gläubigern der an der formwechselnden Umwandlung beteiligten Rechtsträger ist, wenn sie binnen sechs Monaten nach dem Tag, an dem die Eintragung der Umwandlung in das Register des Sitzes desjenigen Rechtsträgers, dessen Gläubiger sie sind, nach § 19 Abs. 3 UmwG als bekannt gemacht gilt, ihren Anspruch nach Grund und Höhe schriftlich anmelden, Sicherheit zu leisten, soweit sie nicht Befriedigung verlangen können. Dieses Recht steht den Gläubigern jedoch nur zu, wenn sie glaubhaft machen, dass durch die formwechselnde Umwandlung die Erfüllung der Forderung gefährdet wird."
    },
    {
      "date": "2024-12-06",
      "id": "95661",
      "original_text": "Registerbekanntmachung nach dem Umwandlungsgesetz\nNiedersachsen Amtsgericht Braunschweig HRA 200757\nBÖRKER Touristik KG – Langelsheim",
      "type": "Registerbekanntmachung nach dem Umwandlungsgesetz",
      "state": "Niedersachsen",
      "amtsgericht": "Amtsgericht Braunschweig",
      "registernummer": "HRA 200757",
      "registerart": "HRA",
      "company_name": "BÖRKER Touristik KG",
      "company_seat": "Langelsheim",
      "details": "06.12.2024 (Bekanntmachungsdatum)\n\nNiedersachsen Amtsgericht Braunschweig HRA 200757\nRegisterbekanntmachung nach dem Umwandlungsgesetz 06.12.2024 (Eintragungsdatum)\n\nBÖRKER Touristik KG\nKommanditgesellschaft\nLangelsheim\n\nDen Gläubigern der an der formwechselnden Umwandlung beteiligten Rechtsträger ist, wenn sie binnen sechs Monaten nach dem Tag, an dem die Eintragung der Umwandlung in das Register des Sitzes desjenigen Rechtsträgers, dessen Gläubiger sie sind, nach § 19 Abs. 3 UmwG als bekannt gemacht gilt, ihren Anspruch nach Grund und Höhe schriftlich anmelden, Sicherheit zu leisten, soweit sie nicht Befriedigung verlangen können. Dieses Recht steht den Gläubigern jedoch nur zu, wenn sie glaubhaft machen, dass durch die formwechselnde Umwandlung die Erfüllung der Forderung gefährdet wird."
    },
    {
      "date": "2024-12-06",
      "id": "95662",
      "original_text": "Löschungsankündigung\nNiedersachsen Amtsgericht Hannover HRB 216681\nPALA Bau & Industrie GmbH – Hannover",
      "type": "Löschungsankündigung",
      "state": "Niedersachsen",
      "amtsgericht": "Amtsgericht Hannover",
      "registernummer": "HRB 216681",
      "registerart": "HRB",
      "company_name": "PALA Bau & Industrie GmbH",
      "company_seat": "Hannover",
      "details": "06.12.2024 (Bekanntmachungsdatum)\n\nNiedersachsen Amtsgericht Hannover HRB 216681\nLöschungsankündigung\n\nPALA Bau & Industrie GmbH\nGesellschaft mit beschränkter Haftung\nHannover\n\nDas Registergericht beabsichtigt, die Gesellschaft von Amts wegen nach § 394 FamFG zu löschen. Die Frist zur Erhebung eines Widerspruchs ist auf 1 Monat ab dieser Registerbekanntmachung festgesetzt."
    },
    {
      "date": "2024-12-06",
      "id": "95663",
      "original_text": "Registerbekanntmachung nach dem Umwandlungsgesetz\nRheinland-Pfalz Amtsgericht Montabaur HRA 21309\nUwe Bischoff e.K. – Fiersbach",
      "type": "Registerbekanntmachung nach dem Umwandlungsgesetz",
      "state": "Rheinland-Pfalz",
      "amtsgericht": "Amtsgericht Montabaur",
      "registernummer": "HRA 21309",
      "registerart": "HRA",
      "company_name": "Uwe Bischoff e.K.",
      "company_seat": "Fiersbach",
      "details": "06.12.2024 (Bekanntmachungsdatum)\n\nRheinland-Pfalz Amtsgericht Montabaur HRA 21309\nRegisterbekanntmachung nach dem Umwandlungsgesetz 06.12.2024 (Eintragungsdatum)\n\nUwe Bischoff e.K.\nEinzelkaufmann / Einzelkauffrau\nFiersbach\n\nAls nicht eingetragen wird veröffentlicht: Den Gläubigern der an der Ausgliederung beteiligten Rechtsträger ist, wenn sie binnen sechs Monaten nach dem Tag, an dem die Eintragung der Ausgliederung in das Register des Sitzes desjenigen Rechtsträgers, dessen Gläubiger sie sind, nach § 19 Abs. 3 UmwG als bekannt gemacht gilt, ihren Anspruch nach Grund und Höhe schriftlich anmelden, Sicherheit zu leisten, soweit sie nicht Befriedigung verlangen können. Dieses Recht steht den Gläubigern jedoch nur zu, wenn sie glaubhaft machen, dass durch die Ausgliederung die Erfüllung der Forderung gefährdet wird."
    },
    {
      "date": "2024-12-06",
      "id": "95664",
      "original_text": "Löschungsankündigung\nRheinland-Pfalz Amtsgericht Ludwigshafen a.Rhein (Ludwigshafen) HRA 61605\nIT Handels GmbH & Co. KG – Laumersheim",
      "type": "Löschungsankündigung",
      "state": "Rheinland-Pfalz",
      "amtsgericht": "Amtsgericht Ludwigshafen a.Rhein (Ludwigshafen)",
      "registernummer": "HRA 61605",
      "registerart": "HRA",
      "company_name": "IT Handels GmbH & Co. KG",
      "company_seat": "Laumersheim",
      "details": "06.12.2024 (Bekanntmachungsdatum)\n\nRheinland-Pfalz Amtsgericht Ludwigshafen a.Rhein (Ludwigshafen) HRA 61605\nLöschungsankündigung\n\nIT Handels GmbH & Co. KG\nKommanditgesellschaft\nLaumersheim\n\nDas Registergericht beabsichtigt die Firma von Amts wegen nach § 31 Abs. 2 HGB, § 393 FamFG zu löschen. Die Frist zur Erhebung eines Widerspruchs ist auf  einen Monat festgesetzt."
    },
    {
      "date": "2024-12-06",
      "id": "95665",
      "original_text": "Löschungsankündigung\nRheinland-Pfalz Amtsgericht Ludwigshafen a.Rhein (Ludwigshafen) HRA 61275\nDanitech OHG – Ludwigshafen/Rhein",
      "type": "Löschungsankündigung",
      "state": "Rheinland-Pfalz",
      "amtsgericht": "Amtsgericht Ludwigshafen a.Rhein (Ludwigshafen)",
      "registernummer": "HRA 61275",
      "registerart": "HRA",
      "company_name": "Danitech OHG",
      "company_seat": "Ludwigshafen/Rhein",
      "details": "06.12.2024 (Bekanntmachungsdatum)\n\nRheinland-Pfalz Amtsgericht Ludwigshafen a.Rhein (Ludwigshafen) HRA 61275\nLöschungsankündigung\n\nDanitech OHG\nOffene Handelsgesellschaft\nLudwigshafen/Rhein\n\nDas Registergericht beabsichtigt die Firma von Amts wegen nach § 31 Abs. 2 HGB, § 393 FamFG zu löschen. Die Frist zur Erhebung eines Widerspruchs ist auf  einen Monat festgesetzt."
    },
    {
      "date": "2024-12-06",
      "id": "95666",
      "original_text": "Löschungsankündigung\nRheinland-Pfalz Amtsgericht Mainz HRB 6359\nSCS GmbH Systeme Consulting Service – Mainz",
      "type": "Löschungsankündigung",
      "state": "Rheinland-Pfalz",
      "amtsgericht": "Amtsgericht Mainz",
      "registernummer": "HRB 6359",
      "registerart": "HRB",
      "company_name": "SCS GmbH Systeme Consulting Service",
      "company_seat": "Mainz",
      "details": "06.12.2024 (Bekanntmachungsdatum)\n\nRheinland-Pfalz Amtsgericht Mainz HRB 6359\nLöschungsankündigung 03.12.2024 (Eintragungsdatum)\n\nSCS GmbH Systeme Consulting Service\nGesellschaft mit beschränkter Haftung\nMainz\n\nDas Registergericht beabsichtigt die Gesellschaft von Amts wegen nach § 394 FamFG zu löschen. Die Frist zur Erhebung eines Widerspruchs ist auf einen Monat festgesetzt."
    },
    {
      "date": "2024-12-06",
      "id": "95667",
      "original_text": "Löschungsankündigung\nRheinland-Pfalz Amtsgericht Zweibrücken HRB 23629\nPKM Baustahlarmierung GmbH – Vinningen",
      "type": "Löschungsankündigung",
      "state": "Rheinland-Pfalz",
      "amtsgericht": "Amtsgericht Zweibrücken",
      "registernummer": "HRB 23629",
      "registerart": "HRB",
      "company_name": "PKM Baustahlarmierung GmbH",
      "company_seat": "Vinningen",
      "details": "06.12.2024 (Bekanntmachungsdatum)\n\nRheinland-Pfalz Amtsgericht Zweibrücken HRB 23629\nLöschungsankündigung\n\nPKM Baustahlarmierung GmbH\nGesellschaft mit beschränkter Haftung\nVinningen\n\nDas Registergericht beabsichtigt die Gesellschaft von Amts wegen nach § 394 FamFG zu löschen. Die Frist zur Erhebung eines Widerspruchs ist auf einen Monat festgesetzt."
    },
    {
      "date": "2024-12-06",
      "id": "95668",
      "original_text": "Registerbekanntmachung nach dem Umwandlungsgesetz\nNordrhein-Westfalen Amtsgericht Siegen HRB 13957\nForneberg 1919 GmbH – Freudenberg",
      "type": "Registerbekanntmachung nach dem Umwandlungsgesetz",
      "state": "Nordrhein-Westfalen",
      "amtsgericht": "Amtsgericht Siegen",
      "registernummer": "HRB 13957",
      "registerart": "HRB",
      "company_name": "Forneberg 1919 GmbH",
      "company_seat": "Freudenberg",
      "details": "06.12.2024 (Bekanntmachungsdatum)\n\nNordrhein-Westfalen Amtsgericht Siegen HRB 13957\nRegisterbekanntmachung nach dem Umwandlungsgesetz 06.12.2024 (Eintragungsdatum)\n\nForneberg 1919 GmbH\nGesellschaft mit beschränkter Haftung\nFreudenberg\n\nDen Gläubigern der an der Ausgliederung beteiligten Rechtsträger ist, wenn sie binnen sechs Monaten nach dem Tag, an dem die Eintragung der Ausgliederung in das Register des Sitzes desjenigen Rechtsträgers, dessen Gläubiger sie sind, nach § 19 Absatz 3 UmwG als bekanntgemacht gilt, ihren Anspruch nach Grund und Höhe schriftlich anmelden, Sicherheit zu leisten, soweit sie nicht Befriedigung verlangen können. Dieses Recht steht den Gläubigern jedoch nur zu, wenn sie glaubhaft machen, dass durch die Ausgliederung die Erfüllung ihrer Forderung gefährdet wird."
    },
    {
      "date": "2024-12-06",
      "id": "95669",
      "original_text": "Registerbekanntmachung nach dem Umwandlungsgesetz\nNordrhein-Westfalen Amtsgericht Köln VR 7221\nBildungswerk der Erzdiözese Köln e.V. – Köln",
      "type": "Registerbekanntmachung nach dem Umwandlungsgesetz",
      "state": "Nordrhein-Westfalen",
      "amtsgericht": "Amtsgericht Köln",
      "registernummer": "VR 7221",
      "registerart": "VR",
      "company_name": "Bildungswerk der Erzdiözese Köln e.V.",
      "company_seat": "Köln",
      "details": "06.12.2024 (Bekanntmachungsdatum)\n\nNordrhein-Westfalen Amtsgericht Köln VR 7221\nRegisterbekanntmachung nach dem Umwandlungsgesetz 06.12.2024 (Eintragungsdatum)\n\nBildungswerk der Erzdiözese Köln e.V.\neingetragener Verein\nKöln\n\nDen Gläubigern der an der Ausgliederung beteiligten Rechtsträger ist, wenn sie binnen sechs Monaten nach dem Tag, an dem die Eintragung der Ausgliederung in das Register des Sitzes desjenigen Rechtsträgers, dessen Gläubiger sie sind, nach § 19 Absatz 3 UmwG als bekanntgemacht gilt, ihren Anspruch nach Grund und Höhe schriftlich anmelden, Sicherheit zu leisten, soweit sie nicht Befriedigung verlangen können. Dieses Recht steht den Gläubigern jedoch nur zu, wenn sie glaubhaft machen, dass durch die Ausgliederung die Erfüllung ihrer Forderung gefährdet wird."
    },
    {
      "date": "2024-12-06",
      "id": "95670",
      "original_text": "Löschungsankündigung\nNordrhein-Westfalen Amtsgericht Düsseldorf HRB 21986\nFinest Guards Security & Services GmbH – Düsseldorf",
      "type": "Löschungsankündigung",
      "state": "Nordrhein-Westfalen",
      "amtsgericht": "Amtsgericht Düsseldorf",
      "registernummer": "HRB 21986",
      "registerart": "HRB",
      "company_name": "Finest Guards Security & Services GmbH",
      "company_seat": "Düsseldorf",
      "details": "06.12.2024 (Bekanntmachungsdatum)\n\nNordrhein-Westfalen Amtsgericht Düsseldorf HRB 21986\nLöschungsankündigung\n\nFinest Guards Security & Services GmbH\nGesellschaft mit beschränkter Haftung\nDüsseldorf\n\nDas Registergericht beabsichtigt die Gesellschaft von Amts wegen nach § 394 Abs. 1 FamFG zu löschen. Die Frist zur Erhebung eines Widerspruchs ist auf einen Monat festgesetzt.\n\nRechtsbehelfsbelehrung:\nDas Widerspruchsrecht steht jedem zu, der an der Unterlassung der Löschung ein berechtigtes Interesse hat. Der Widerspruch ist bei dem Amtsgericht Düsseldorf -Registergericht-, Werdener Straße 1, 40227 Düsseldorf schriftlich in deutscher Sprache oder zur Niederschrift der Geschäftsstelle einzulegen. Der Widerspruch kann auch zur Niederschrift der Geschäftsstelle eines jeden Amtsgerichtes abgegeben werden. Die Einlegung ist auch durch Übertragung eines elektronischen Dokuments an die elektronische Poststelle des Gerichts möglich. Das elektronische Dokument muss für die Bearbeitung durch das Gericht geeignet und mit einer qualifizierten elektronischen Signatur der verantwortenden Person versehen sein oder von der verantwortenden Person signiert und auf einem sicheren Übermittlungsweg gemäß § 130a ZPO nach näherer Maßgabe der Verordnung über die technischen Rahmenbedingungen des elektronischen Rechtsverkehrs und über das besondere elektronische Behördenpostfach (BGBl. I, S.3803) eingereicht werden. Weitere Informationen erhalten Sie auf der Internetseite www.justiz.de.\nDer Widerspruch muss spätestens innerhalb der gesetzten Frist nach dem Datum der Bekanntmachung der Löschungsankündigung bei dem Amtsgericht - Registergericht - Düsseldorf eingegangen sein.  Dies gilt auch dann, wenn der Widerspruch zur Niederschrift der Geschäftsstelle eines anderen Amtsgerichtes abgegeben wurde. Die Frist beginnt mit dem Tage der Bekanntmachung der Löschungsankündigung in dem für die Bekanntmachung der Eintragungen in das Handelsregister bestimmten elektronischen Informations- und Kommunikationssystem nach § 10 des Handelsgesetzbuches. Fällt das Ende der Frist auf einen Sonntag, einen allgemeinen Feiertag oder Sonnabend, so endet die Frist mit Ablauf des nächsten Werktages.\nDer Widerspruch muss die Bezeichnung der angefochtenen Löschungsankündigung sowie die Erklärung enthalten, dass Widerspruch gegen diese Löschungsankündigung eingelegt wird. Er ist zu unterzeichnen und soll begründet werden."
    },
    {
      "date": "2024-12-06",
      "id": "95671",
      "original_text": "Registerbekanntmachung nach dem Umwandlungsgesetz\nNordrhein-Westfalen Amtsgericht Köln HRB 121377\nDOMRADIO.DE gGmbH – Köln",
      "type": "Registerbekanntmachung nach dem Umwandlungsgesetz",
      "state": "Nordrhein-Westfalen",
      "amtsgericht": "Amtsgericht Köln",
      "registernummer": "HRB 121377",
      "registerart": "HRB",
      "company_name": "DOMRADIO.DE gGmbH",
      "company_seat": "Köln",
      "details": "06.12.2024 (Bekanntmachungsdatum)\n\nNordrhein-Westfalen Amtsgericht Köln HRB 121377\nRegisterbekanntmachung nach dem Umwandlungsgesetz 06.12.2024 (Eintragungsdatum)\n\nDOMRADIO.DE gGmbH\nGesellschaft mit beschränkter Haftung\nKöln\n\nDen Gläubigern der an der Ausgliederung beteiligten Rechtsträger ist, wenn sie binnen sechs Monaten nach dem Tag, an dem die Eintragung der Ausgliederung in das Register des Sitzes derjenigen Rechtsträger deren Gläubiger sie sind, nach § 19 Absatz 3 UmwG als bekanntgemacht gilt, ihren Anspruch nach Grund und Höhe schriftlich anmelden, Sicherheit zu leisten, soweit sie nicht Befriedigung verlangen können. Dieses Recht steht den Gläubigern jedoch nur zu, wenn sie glaubhaft machen, dass durch die Ausgliederung die Erfüllung ihrer Forderung gefährdet wird."
    },
    {
      "date": "2024-12-06",
      "id": "95672",
      "original_text": "Löschungsankündigung\nNordrhein-Westfalen Amtsgericht Köln HRB 115439\nImmovest Concept GmbH – Gummersbach",
      "type": "Löschungsankündigung",
      "state": "Nordrhein-Westfalen",
      "amtsgericht": "Amtsgericht Köln",
      "registernummer": "HRB 115439",
      "registerart": "HRB",
      "company_name": "Immovest Concept GmbH",
      "company_seat": "Gummersbach",
      "details": "06.12.2024 (Bekanntmachungsdatum)\n\nNordrhein-Westfalen Amtsgericht Köln HRB 115439\nLöschungsankündigung\n\nImmovest Concept GmbH\nGesellschaft mit beschränkter Haftung\nGummersbach\n\nDas Registergericht beabsichtigt die Gesellschaft von Amts wegen nach § 394 FamFG zu löschen. Die Frist zur Erhebung eines Widerspruchs ist auf einen Monat festgesetzt."
    },
    {
      "date": "2024-12-06",
      "id": "95673",
      "original_text": "Löschungsankündigung\nNordrhein-Westfalen Amtsgericht Kleve HRB 12907\nNTI Installationstechnik GmbH – Kleve",
      "type": "Löschungsankündigung",
      "state": "Nordrhein-Westfalen",
      "amtsgericht": "Amtsgericht Kleve",
      "registernummer": "HRB 12907",
      "registerart": "HRB",
      "company_name": "NTI Installationstechnik GmbH",
      "company_seat": "Kleve",
      "details": "06.12.2024 (Bekanntmachungsdatum)\n\nNordrhein-Westfalen Amtsgericht Kleve HRB 12907\nLöschungsankündigung\n\nNTI Installationstechnik GmbH\nGesellschaft mit beschränkter Haftung\nKleve\n\nDas Registergericht beabsichtigt die Gesellschaft von Amts wegen nach § 394 FamFG zu löschen. Die Frist zur Erhebung eines Widerspruchs ist auf einen Monat festgesetzt."
    },
    {
      "date": "2024-12-06",
      "id": "95674",
      "original_text": "Löschungsankündigung\nNordrhein-Westfalen Amtsgericht Köln HRB 86678\nETK Projektmanagement UG (haftungsbeschränkt) – Köln",
      "type": "Löschungsankündigung",
      "state": "Nordrhein-Westfalen",
      "amtsgericht": "Amtsgericht Köln",
      "registernummer": "HRB 86678",
      "registerart": "HRB",
      "company_name": "ETK Projektmanagement UG (haftungsbeschränkt)",
      "company_seat": "Köln",
      "details": "06.12.2024 (Bekanntmachungsdatum)\n\nNordrhein-Westfalen Amtsgericht Köln HRB 86678\nLöschungsankündigung\n\nETK Projektmanagement UG (haftungsbeschränkt)\nGesellschaft mit beschränkter Haftung\nKöln\n\nDas Registergericht beabsichtigt, die im Handelsregister eingetragene Gesellschaft gemäß § 394 Absatz 1 FamFG wegen Vermögenslosigkeit von Amts wegen zu löschen. Gegen diese Verfügung kann Widerspruch eingelegt werden. Die Frist zur Erhebung eines Widerspruchs gegen die beabsichtigte Löschung von Amts wegen ist auf einen Monat festgesetzt. Rechtsbehelfsbelehrung: Gegen diese Verfügung können Sie Widerspruch einlegen. Der Widerspruch ist bei dem Amtsgericht Köln, Reichenspergerplatz 1, 50670 Köln schriftlich in deutscher Sprache oder zur Niederschrift der Geschäftsstelle einzulegen. Der Widerspruch kann auch zur Niederschrift der Geschäftsstelle eines jeden Amtsgerichtes abgegeben werden. Die Einlegung ist auch durch Übertragung eines elektronischen Dokuments an die elektronische Poststelle des Gerichts möglich. Das elektronische Dokument muss für die Bearbeitung durch das Gericht geeignet und mit einer qualifizierten elektronischen Signatur der verantwortenden Person versehen sein oder von der verantwortenden Person signiert und auf einem sicheren Übermittlungsweg gemäß § 130a ZPO nach näherer Maßgabe der Verordnung über die technischen Rahmenbedingungen des elektronischen Rechtsverkehrs und über das besondere elektronische Behördenpostfach (BGBl. I, S.3803) eingereicht werden. Weitere Informationen erhalten Sie auf der Internetseite www.justiz.de.Der Widerspruch muss spätestens innerhalb der gesetzten Frist bei dem Amtsgericht Köln eingegangen sein. Dies gilt auch dann, wenn der Widerspruch zur Niederschrift der Geschäftsstelle eines anderen Amtsgerichtes abgegeben wurde. Die Frist beginnt mit der Veröffentlichung. Fällt das Ende der Frist auf einen Sonntag, einen allgemeinen Feiertag oder Sonnabend, so endet die Frist mit Ablauf des nächsten Werktages.\n\nDer Widerspruch muss die Bezeichnung der angefochtenen Verfügung sowie die Erklärung enthalten, dass Widerspruch gegen diese Verfügung eingelegt wird. Er ist zu unterzeichnen und soll begründet werden."
    },
    {
      "date": "2024-12-06",
      "id": "95675",
      "original_text": "Registerbekanntmachung nach dem Umwandlungsgesetz\nNordrhein-Westfalen Amtsgericht Bielefeld HRB 38170\nDralle Aufzüge Verwaltungs GmbH – Bielefeld",
      "type": "Registerbekanntmachung nach dem Umwandlungsgesetz",
      "state": "Nordrhein-Westfalen",
      "amtsgericht": "Amtsgericht Bielefeld",
      "registernummer": "HRB 38170",
      "registerart": "HRB",
      "company_name": "Dralle Aufzüge Verwaltungs GmbH",
      "company_seat": "Bielefeld",
      "details": "06.12.2024 (Bekanntmachungsdatum)\n\nNordrhein-Westfalen Amtsgericht Bielefeld HRB 38170\nRegisterbekanntmachung nach dem Umwandlungsgesetz 06.12.2024 (Eintragungsdatum)\n\nDralle Aufzüge Verwaltungs GmbH\nGesellschaft mit beschränkter Haftung\nBielefeld\n\nDen Gläubigern der an der Verschmelzung beteiligten Rechtsträger ist, wenn sie binnen sechs Monaten nach dem Tag, an dem die Eintragung der Verschmelzung in das Register des Sitzes desjenigen Rechtsträgers, dessen Gläubiger sie sind, nach § 19 Absatz 3 UmwG als bekanntgemacht gilt, ihren Anspruch nach Grund und Höhe schriftlich anmelden, Sicherheit zu leisten, soweit sie nicht Befriedigung verlangen können. Dieses Recht steht den Gläubigern jedoch nur zu, wenn sie glaubhaft machen, dass durch die Verschmelzung die Erfüllung ihrer Forderung gefährdet wird."
    },
    {
      "date": "2024-12-06",
      "id": "95676",
      "original_text": "Registerbekanntmachung nach dem Umwandlungsgesetz\nNordrhein-Westfalen Amtsgericht Düsseldorf HRB 66514\nR.I.P. GmbH – Düsseldorf",
      "type": "Registerbekanntmachung nach dem Umwandlungsgesetz",
      "state": "Nordrhein-Westfalen",
      "amtsgericht": "Amtsgericht Düsseldorf",
      "registernummer": "HRB 66514",
      "registerart": "HRB",
      "company_name": "R.I.P. GmbH",
      "company_seat": "Düsseldorf",
      "details": "06.12.2024 (Bekanntmachungsdatum)\n\nNordrhein-Westfalen Amtsgericht Düsseldorf HRB 66514\nRegisterbekanntmachung nach dem Umwandlungsgesetz 06.12.2024 (Eintragungsdatum)\n\nR.I.P. GmbH\nGesellschaft mit beschränkter Haftung\nDüsseldorf\n\nDen Gläubigern der an der Verschmelzung beteiligten Rechtsträger ist, wenn sie binnen sechs Monaten nach dem Tag, an dem die Eintragung der Verschmelzung in das Register des Sitzes desjenigen Rechtsträgers, dessen Gläubiger sie sind, nach § 19 Absatz 3 UmwG als bekanntgemacht gilt, ihren Anspruch nach Grund und Höhe schriftlich anmelden, Sicherheit zu leisten, soweit sie nicht Befriedigung verlangen können. Dieses Recht steht den Gläubigern jedoch nur zu, wenn sie glaubhaft machen, dass durch die Verschmelzung die Erfüllung ihrer Forderung gefährdet wird."
    },
    {
      "date": "2024-12-06",
      "id": "95677",
      "original_text": "Löschungsankündigung\nNordrhein-Westfalen Amtsgericht Siegen HRB 12570\nVelocity Siegerland GmbH – Siegen",
      "type": "Löschungsankündigung",
      "state": "Nordrhein-Westfalen",
      "amtsgericht": "Amtsgericht Siegen",
      "registernummer": "HRB 12570",
      "registerart": "HRB",
      "company_name": "Velocity Siegerland GmbH",
      "company_seat": "Siegen",
      "details": "06.12.2024 (Bekanntmachungsdatum)\n\nNordrhein-Westfalen Amtsgericht Siegen HRB 12570\nLöschungsankündigung\n\nVelocity Siegerland GmbH\nGesellschaft mit beschränkter Haftung\nSiegen\n\nDas Registergericht beabsichtigt die Gesellschaft von Amts wegen nach § 394 FamFG zu löschen. Die Frist zur Erhebung eines Widerspruchs ist auf drei Monate festgesetzt."
    },
    {
      "date": "2024-12-06",
      "id": "95678",
      "original_text": "Sonstige Registerbekanntmachung\nNordrhein-Westfalen Amtsgericht Paderborn HRB 2723\nUNITY Aktiengesellschaft für Unternehmensführung und Informationstechnologie – Büren",
      "type": "Sonstige Registerbekanntmachung",
      "state": "Nordrhein-Westfalen",
      "amtsgericht": "Amtsgericht Paderborn",
      "registernummer": "HRB 2723",
      "registerart": "HRB",
      "company_name": "UNITY Aktiengesellschaft für Unternehmensführung und Informationstechnologie",
      "company_seat": "Büren",
      "details": "06.12.2024 (Bekanntmachungsdatum)\n\nNordrhein-Westfalen Amtsgericht Paderborn HRB 2723\nSonstige Registerbekanntmachung 06.12.2024 (Eintragungsdatum)\n\nUNITY Aktiengesellschaft für Unternehmensführung und Informationstechnologie\nAktiengesellschaft\nBüren\n\nDem Registergericht ist eine Liste der Mitglieder des Aufsichtsrates eingereicht worden."
    },
    {
      "date": "2024-12-06",
      "id": "95679",
      "original_text": "Löschungsankündigung\nNordrhein-Westfalen Amtsgericht Düsseldorf HRB 54672\nSARAR EUROPE GmbH – Düsseldorf",
      "type": "Löschungsankündigung",
      "state": "Nordrhein-Westfalen",
      "amtsgericht": "Amtsgericht Düsseldorf",
      "registernummer": "HRB 54672",
      "registerart": "HRB",
      "company_name": "SARAR EUROPE GmbH",
      "company_seat": "Düsseldorf",
      "details": "06.12.2024 (Bekanntmachungsdatum)\n\nNordrhein-Westfalen Amtsgericht Düsseldorf HRB 54672\nLöschungsankündigung\n\nSARAR EUROPE GmbH\nGesellschaft mit beschränkter Haftung\nDüsseldorf\n\nDas Registergericht beabsichtigt die Gesellschaft von Amts wegen nach § 394 FamFG zu löschen. Die Frist zur Erhebung eines Widerspruchs ist auf 3 Wochen festgesetzt.\n\nRechtsbehelfsbelehrung:\nDas Widerspruchsrecht steht jedem zu, der an der Unterlassung der Löschung ein berechtigtes Interesse hat. Der Widerspruch ist bei dem Amtsgericht Düsseldorf -Registergericht-, Werdener Straße 1, 40227 Düsseldorf schriftlich in deutscher Sprache oder zur Niederschrift der Geschäftsstelle einzulegen. Der Widerspruch kann auch zur Niederschrift der Geschäftsstelle eines jeden Amtsgerichtes abgegeben werden. Die Einlegung ist auch durch Übertragung eines elektronischen Dokuments an die elektronische Poststelle des Gerichts möglich. Das elektronische Dokument muss für die Bearbeitung durch das Gericht geeignet und mit einer qualifizierten elektronischen Signatur der verantwortenden Person versehen sein oder von der verantwortenden Person signiert und auf einem sicheren Übermittlungsweg gemäß § 130a ZPO nach näherer Maßgabe der Verordnung über die technischen Rahmenbedingungen des elektronischen Rechtsverkehrs und über das besondere elektronische Behördenpostfach (BGBl. I, S.3803) eingereicht werden. Weitere Informationen erhalten Sie auf der Internetseite www.justiz.de.\nDer Widerspruch muss spätestens innerhalb der gesetzten Frist nach dem Datum der Bekanntmachung der Löschungsankündigung bei dem Amtsgericht - Registergericht - Düsseldorf eingegangen sein.  Dies gilt auch dann, wenn der Widerspruch zur Niederschrift der Geschäftsstelle eines anderen Amtsgerichtes abgegeben wurde. Die Frist beginnt mit dem Tage der Bekanntmachung der Löschungsankündigung in dem für die Bekanntmachung der Eintragungen in das Handelsregister bestimmten elektronischen Informations- und Kommunikationssystem nach § 10 des Handelsgesetzbuches. Fällt das Ende der Frist auf einen Sonntag, einen allgemeinen Feiertag oder Sonnabend, so endet die Frist mit Ablauf des nächsten Werktages.\nDer Widerspruch muss die Bezeichnung der angefochtenen Löschungsankündigung sowie die Erklärung enthalten, dass Widerspruch gegen diese Löschungsankündigung eingelegt wird. Er ist zu unterzeichnen und soll begründet werden."
    },
    {
      "date": "2024-12-06",
      "id": "95680",
      "original_text": "Registerbekanntmachung nach dem Umwandlungsgesetz\nNordrhein-Westfalen Amtsgericht Siegen HRA 9978\nMalerbetrieb Forneberg 1919 e.K. – Freudenberg",
      "type": "Registerbekanntmachung nach dem Umwandlungsgesetz",
      "state": "Nordrhein-Westfalen",
      "amtsgericht": "Amtsgericht Siegen",
      "registernummer": "HRA 9978",
      "registerart": "HRA",
      "company_name": "Malerbetrieb Forneberg 1919 e.K.",
      "company_seat": "Freudenberg",
      "details": "06.12.2024 (Bekanntmachungsdatum)\n\nNordrhein-Westfalen Amtsgericht Siegen HRA 9978\nRegisterbekanntmachung nach dem Umwandlungsgesetz 06.12.2024 (Eintragungsdatum)\n\nMalerbetrieb Forneberg 1919 e.K.\nEinzelkaufmann / Einzelkauffrau\nFreudenberg\n\nDen Gläubigern der an der Ausgliederung beteiligten Rechtsträger ist, wenn sie binnen sechs Monaten nach dem Tag, an dem die Eintragung der Ausgliederung in das Register des Sitzes desjenigen Rechtsträgers, dessen Gläubiger sie sind, nach § 19 Absatz 3 UmwG als bekanntgemacht gilt, ihren Anspruch nach Grund und Höhe schriftlich anmelden, Sicherheit zu leisten, soweit sie nicht Befriedigung verlangen können. Dieses Recht steht den Gläubigern jedoch nur zu, wenn sie glaubhaft machen, dass durch die Ausgliederung die Erfüllung ihrer Forderung gefährdet wird."
    },
    {
      "date": "2024-12-06",
      "id": "95681",
      "original_text": "Registerbekanntmachung nach dem Umwandlungsgesetz\nNordrhein-Westfalen Amtsgericht Düsseldorf HRB 76028\nmfi Shopping Center Management GmbH – Düsseldorf",
      "type": "Registerbekanntmachung nach dem Umwandlungsgesetz",
      "state": "Nordrhein-Westfalen",
      "amtsgericht": "Amtsgericht Düsseldorf",
      "registernummer": "HRB 76028",
      "registerart": "HRB",
      "company_name": "mfi Shopping Center Management GmbH",
      "company_seat": "Düsseldorf",
      "details": "06.12.2024 (Bekanntmachungsdatum)\n\nNordrhein-Westfalen Amtsgericht Düsseldorf HRB 76028\nRegisterbekanntmachung nach dem Umwandlungsgesetz 06.12.2024 (Eintragungsdatum)\n\nmfi Shopping Center Management GmbH\nGesellschaft mit beschränkter Haftung\nDüsseldorf\n\nDen Gläubigern der an der Abspaltung beteiligten Rechtsträger ist, wenn sie binnen sechs Monaten nach dem Tag, an dem die Eintragung der Abspaltung in das Register des Sitzes desjenigen Rechtsträgers, dessen Gläubiger sie sind, nach § 19 Absatz 3 UmwG als bekanntgemacht gilt, ihren Anspruch nach Grund und Höhe schriftlich anmelden, Sicherheit zu leisten, soweit sie nicht Befriedigung verlangen können. Dieses Recht steht den Gläubigern jedoch nur zu, wenn sie glaubhaft machen, dass durch die Abspaltung die Erfüllung ihrer Forderung gefährdet wird."
    },
    {
      "date": "2024-12-06",
      "id": "95682",
      "original_text": "Löschungsankündigung\nNordrhein-Westfalen Amtsgericht Gelsenkirchen HRB 12330\nKURTT Gerüstbau GmbH – Gladbeck",
      "type": "Löschungsankündigung",
      "state": "Nordrhein-Westfalen",
      "amtsgericht": "Amtsgericht Gelsenkirchen",
      "registernummer": "HRB 12330",
      "registerart": "HRB",
      "company_name": "KURTT Gerüstbau GmbH",
      "company_seat": "Gladbeck",
      "details": "06.12.2024 (Bekanntmachungsdatum)\n\nNordrhein-Westfalen Amtsgericht Gelsenkirchen HRB 12330\nLöschungsankündigung\n\nKURTT Gerüstbau GmbH\nGesellschaft mit beschränkter Haftung\nGladbeck\n\nDas Gericht beabsichtigt, die Eintragung des Herrn Ibrahim Kurt als alleiniger Geschäftsführer der in seinem Handelsregister unter HRB 12330 eingetragenen Gesellschaft KURTT Gerüstbau GmbH mit Sitz in Gladbeck gemäß § 395 Abs. 1 FamFG wegen Unrichtigkeit von Amts wegen zu löschen.\n\nHiermit wird denjenigen, die an der Unterlassung der Löschung ein berechtigtes Interesse haben, gem. §§ 395 Abs. 2 Satz 2, 394 Abs. 2 FamFG Gelegenheit gegeben, gegen dieses Vorhaben binnen eines Monats nach dieser Bekanntmachung Widerspruch einzulegen. Der Widerspruch kann schriftlich oder zu Protokoll der Geschäftsstelle erhoben werden."
    },
    {
      "date": "2024-12-06",
      "id": "95683",
      "original_text": "Registerbekanntmachung nach dem Umwandlungsgesetz\nBremen Amtsgericht Bremen HRB 29325\nJustus Grosse Beteiligungs GmbH – Bremen",
      "type": "Registerbekanntmachung nach dem Umwandlungsgesetz",
      "state": "Bremen",
      "amtsgericht": "Amtsgericht Bremen",
      "registernummer": "HRB 29325",
      "registerart": "HRB",
      "company_name": "Justus Grosse Beteiligungs GmbH",
      "company_seat": "Bremen",
      "details": "06.12.2024 (Bekanntmachungsdatum)\n\nBremen Amtsgericht Bremen HRB 29325\nRegisterbekanntmachung nach dem Umwandlungsgesetz 05.12.2024 (Eintragungsdatum)\n\nJustus Grosse Beteiligungs GmbH\nGesellschaft mit beschränkter Haftung\nBremen\n\nAls nicht eingetragen wird veröffentlicht: Den Gläubigern der an der Verschmelzung beteiligten Rechtsträger ist, wenn sie binnen sechs Monaten nach dem Tag, an dem die Eintragung der Verschmelzung in das Register des Sitzes desjenigen Rechtsträgers, dessen Gläubiger sie sind, als bekannt gemacht gilt, ihren Anspruch nach Grund und Höhe schriftlich anmelden, Sicherheit zu leisten, soweit sie nicht Befriedigung verlangen können. Dieses Recht steht den Gläubigern jedoch nur zu, wenn sie glaubhaft machen, dass durch die Verschmelzung die Erfüllung ihrer Forderung gefährdet wird. Das Recht, Sicherheitsleistung zu verlangen, steht Gläubigern nicht zu, die im Falle der Insolvenz ein Recht auf vorzugsweise Befriedigung aus einer Deckungsmasse haben, die nach gesetzlicher Vorschrift zu ihrem Schutz errichtet und staatlich überwacht ist."
    },
    {
      "date": "2024-12-06",
      "id": "95684",
      "original_text": "Registerbekanntmachung nach dem Umwandlungsgesetz\nBremen Amtsgericht Bremen HRB 25044\nLinnemann/Paul Verwaltungs GmbH – Bremen",
      "type": "Registerbekanntmachung nach dem Umwandlungsgesetz",
      "state": "Bremen",
      "amtsgericht": "Amtsgericht Bremen",
      "registernummer": "HRB 25044",
      "registerart": "HRB",
      "company_name": "Linnemann/Paul Verwaltungs GmbH",
      "company_seat": "Bremen",
      "details": "06.12.2024 (Bekanntmachungsdatum)\n\nBremen Amtsgericht Bremen HRB 25044\nRegisterbekanntmachung nach dem Umwandlungsgesetz 05.12.2024 (Eintragungsdatum)\n\nLinnemann/Paul Verwaltungs GmbH\nGesellschaft mit beschränkter Haftung\nBremen\n\nZu Eintragungsnummer 9 vom 05.12.2024 wird als nicht eingetragen veröffentlicht: Den Gläubigern der an der Verschmelzung beteiligten Rechtsträger ist, wenn sie binnen sechs Monaten nach dem Tag, an dem die Eintragung der Verschmelzung in das Register des Sitzes desjenigen Rechtsträgers, dessen Gläubiger sie sind, als bekannt gemacht gilt, ihren Anspruch nach Grund und Höhe schriftlich anmelden, Sicherheit zu leisten, soweit sie nicht Befriedigung verlangen können. Dieses Recht steht den Gläubigern jedoch nur zu, wenn sie glaubhaft machen, dass durch die Verschmelzung die Erfüllung ihrer Forderung gefährdet wird. Das Recht, Sicherheitsleistung zu verlangen, steht Gläubigern nicht zu, die im Falle der Insolvenz ein Recht auf vorzugsweise Befriedigung aus einer Deckungsmasse haben, die nach gesetzlicher Vorschrift zu ihrem Schutz errichtet und staatlich überwacht ist."
    },
    {
      "date": "2024-12-06",
      "id": "95685",
      "original_text": "Registerbekanntmachung nach dem Umwandlungsgesetz\nBremen Amtsgericht Bremen HRA 30570\nnextpractice consulting GmbH & Co. KG – Bremen",
      "type": "Registerbekanntmachung nach dem Umwandlungsgesetz",
      "state": "Bremen",
      "amtsgericht": "Amtsgericht Bremen",
      "registernummer": "HRA 30570",
      "registerart": "HRA",
      "company_name": "nextpractice consulting GmbH & Co. KG",
      "company_seat": "Bremen",
      "details": "06.12.2024 (Bekanntmachungsdatum)\n\nBremen Amtsgericht Bremen HRA 30570\nRegisterbekanntmachung nach dem Umwandlungsgesetz 05.12.2024 (Eintragungsdatum)\n\nnextpractice consulting GmbH & Co. KG\nKommanditgesellschaft\nBremen\n\nZu Eintragungsnummer 1 vom 05.12.2024 wird als nicht eingetragen veröffentlicht: Den Gläubigern ist, wenn sie binnen sechs Monaten nach dem Tag, an dem die Eintragung der Umwandlung als bekannt gemacht gilt, ihren Anspruch nach Grund und Höhe schriftlich anmelden, Sicherheit zu leisten, soweit sie nicht Befriedigung verlangen können. Dieses Recht steht den Gläubigern jedoch nur zu, wenn sie glaubhaft machen, dass durch die Umwandlung die Erfüllung ihrer Forderung gefährdet wird. Das Recht, Sicherheitsleistung zu verlangen, steht Gläubigern nicht zu, die im Falle der Insolvenz ein Recht auf vorzugsweise Befriedigung aus einer Deckungsmasse haben, die nach gesetzlicher Vorschrift zu ihrem Schutz errichtet und staatlich überwacht ist."
    },
    {
      "date": "2024-12-06",
      "id": "95686",
      "original_text": "Registerbekanntmachung nach dem Umwandlungsgesetz\nBremen Amtsgericht Bremen HRB 40510\nnextpractice consulting GmbH – Bremen",
      "type": "Registerbekanntmachung nach dem Umwandlungsgesetz",
      "state": "Bremen",
      "amtsgericht": "Amtsgericht Bremen",
      "registernummer": "HRB 40510",
      "registerart": "HRB",
      "company_name": "nextpractice consulting GmbH",
      "company_seat": "Bremen",
      "details": "06.12.2024 (Bekanntmachungsdatum)\n\nBremen Amtsgericht Bremen HRB 40510\nRegisterbekanntmachung nach dem Umwandlungsgesetz 05.12.2024 (Eintragungsdatum)\n\nnextpractice consulting GmbH\nGesellschaft mit beschränkter Haftung\nBremen\n\nZu Eintragungsnummer 3 vom 05.12.2024 wird als nicht eingetragen veröffentlicht: Den Gläubigern ist, wenn sie binnen sechs Monaten nach dem Tag, an dem die Eintragung der Umwandlung als bekannt gemacht gilt, ihren Anspruch nach Grund und Höhe schriftlich anmelden, Sicherheit zu leisten, soweit sie nicht Befriedigung verlangen können. Dieses Recht steht den Gläubigern jedoch nur zu, wenn sie glaubhaft machen, dass durch die Umwandlung die Erfüllung ihrer Forderung gefährdet wird. Das Recht, Sicherheitsleistung zu verlangen, steht Gläubigern nicht zu, die im Falle der Insolvenz ein Recht auf vorzugsweise Befriedigung aus einer Deckungsmasse haben, die nach gesetzlicher Vorschrift zu ihrem Schutz errichtet und staatlich überwacht ist."
    },
    {
      "date": "2024-12-06",
      "id": "95687",
      "original_text": "Registerbekanntmachung nach dem Umwandlungsgesetz\nBremen Amtsgericht Bremen HRB 31556\nTaiwan offshore Holding GmbH – Bremen",
      "type": "Registerbekanntmachung nach dem Umwandlungsgesetz",
      "state": "Bremen",
      "amtsgericht": "Amtsgericht Bremen",
      "registernummer": "HRB 31556",
      "registerart": "HRB",
      "company_name": "Taiwan offshore Holding GmbH",
      "company_seat": "Bremen",
      "details": "06.12.2024 (Bekanntmachungsdatum)\n\nBremen Amtsgericht Bremen HRB 31556\nRegisterbekanntmachung nach dem Umwandlungsgesetz 05.12.2024 (Eintragungsdatum)\n\nTaiwan offshore Holding GmbH\nGesellschaft mit beschränkter Haftung\nBremen\n\nZu Eintragungsnummer 10 vom 05.12.2024 wird als nicht eingetragen veröffentlicht: Den Gläubigern der an der Verschmelzung beteiligten Rechtsträger ist, wenn sie binnen sechs Monaten nach dem Tag, an dem die Eintragung der Verschmelzung in das Register des Sitzes desjenigen Rechtsträgers, dessen Gläubiger sie sind, als bekannt gemacht gilt, ihren Anspruch nach Grund und Höhe schriftlich anmelden, Sicherheit zu leisten, soweit sie nicht Befriedigung verlangen können. Dieses Recht steht den Gläubigern jedoch nur zu, wenn sie glaubhaft machen, dass durch die Verschmelzung die Erfüllung ihrer Forderung gefährdet wird. Das Recht, Sicherheitsleistung zu verlangen, steht Gläubigern nicht zu, die im Falle der Insolvenz ein Recht auf vorzugsweise Befriedigung aus einer Deckungsmasse haben, die nach gesetzlicher Vorschrift zu ihrem Schutz errichtet und staatlich überwacht ist."
    },
    {
      "date": "2024-12-06",
      "id": "95688",
      "original_text": "Löschungsankündigung\nThüringen Amtsgericht Jena HRA 504572\nElektro Ruch Innungsfachbetrieb UG (haftungsbeschränkt) & Co. KG – Jena",
      "type": "Löschungsankündigung",
      "state": "Thüringen",
      "amtsgericht": "Amtsgericht Jena",
      "registernummer": "HRA 504572",
      "registerart": "HRA",
      "company_name": "Elektro Ruch Innungsfachbetrieb UG (haftungsbeschränkt) & Co. KG",
      "company_seat": "Jena",
      "details": "06.12.2024 (Bekanntmachungsdatum)\n\nThüringen Amtsgericht Jena HRA 504572\nLöschungsankündigung\n\nElektro Ruch Innungsfachbetrieb UG (haftungsbeschränkt) & Co. KG\nKommanditgesellschaft\nJena\n\nDas Registergericht beabsichtigt, die im Handelsregister eingetragene Gesellschaft wegen unzulässiger Eintragung nach § 395 FamFG von Amts wegen zu löschen. Die Frist zur Erhebung eines Widerspruchs gegen die beabsichtigte Löschung wird auf einen Monat festgesetzt."
    },
    {
      "date": "2024-12-06",
      "id": "95689",
      "original_text": "Sonstige Registerbekanntmachung\nHessen Amtsgericht Frankfurt am Main HRB 28138\nHELVETIA schweizerische Lebensversicherungs- Aktiengesellschaft – Frankfurt am Main",
      "type": "Sonstige Registerbekanntmachung",
      "state": "Hessen",
      "amtsgericht": "Amtsgericht Frankfurt am Main",
      "registernummer": "HRB 28138",
      "registerart": "HRB",
      "company_name": "HELVETIA schweizerische Lebensversicherungs- Aktiengesellschaft",
      "company_seat": "Frankfurt am Main",
      "details": "06.12.2024 (Bekanntmachungsdatum)\n\nHessen Amtsgericht Frankfurt am Main HRB 28138\nSonstige Registerbekanntmachung\n\nHELVETIA schweizerische Lebensversicherungs- Aktiengesellschaft\nAktiengesellschaft\nFrankfurt am Main\n\nDurch eine Änderung in den Personen der Aufsichtsratsmitglieder ist eine Liste der Mitglieder des Aufsichtsrates zum Handelsregister eingereicht worden."
    },
    {
      "date": "2024-12-06",
      "id": "95690",
      "original_text": "Löschungsankündigung\nHessen Amtsgericht Wiesbaden HRB 28550\nWiesBURG GmbH (Internationale Handelsagentur) – Wiesbaden",
      "type": "Löschungsankündigung",
      "state": "Hessen",
      "amtsgericht": "Amtsgericht Wiesbaden",
      "registernummer": "HRB 28550",
      "registerart": "HRB",
      "company_name": "WiesBURG GmbH (Internationale Handelsagentur)",
      "company_seat": "Wiesbaden",
      "details": "06.12.2024 (Bekanntmachungsdatum)\n\nHessen Amtsgericht Wiesbaden HRB 28550\nLöschungsankündigung\n\nWiesBURG GmbH (Internationale Handelsagentur)\nGesellschaft mit beschränkter Haftung\nWiesbaden\n\nDas Registergericht beabsichtigt die im Handelsregister eingetragene Gesellschaft von Amts wegen nach § 394 FamFG zu löschen. Die Frist zur Erhebung eines Widerspruchs gegen die beabsichtigte Löschung wird auf 3 Monate festgesetzt."
    },
    {
      "date": "2024-12-06",
      "id": "95691",
      "original_text": "Sonstige Registerbekanntmachung\nHessen Amtsgericht Frankfurt am Main HRB 42397\nABG FRANKFURT HOLDING Wohnungsbau- und Beteiligungsgesellschaft mit beschränkter Haftung – Frankfurt am Main",
      "type": "Sonstige Registerbekanntmachung",
      "state": "Hessen",
      "amtsgericht": "Amtsgericht Frankfurt am Main",
      "registernummer": "HRB 42397",
      "registerart": "HRB",
      "company_name": "ABG FRANKFURT HOLDING Wohnungsbau- und Beteiligungsgesellschaft mit beschränkter Haftung",
      "company_seat": "Frankfurt am Main",
      "details": "06.12.2024 (Bekanntmachungsdatum)\n\nHessen Amtsgericht Frankfurt am Main HRB 42397\nSonstige Registerbekanntmachung\n\nABG FRANKFURT HOLDING Wohnungsbau- und Beteiligungsgesellschaft mit beschränkter Haftung\nGesellschaft mit beschränkter Haftung\nFrankfurt am Main\n\nDurch eine Änderung in den Personen der Aufsichtsratsmitglieder ist eine Liste der Mitglieder des Aufsichtsrates zum Handelsregister eingereicht worden."
    },
    {
      "date": "2024-12-06",
      "id": "95692",
      "original_text": "Sonstige Registerbekanntmachung\nHessen Amtsgericht Wiesbaden HRB 2145\nAthora Lebensversicherung Aktiengesellschaft – Wiesbaden",
      "type": "Sonstige Registerbekanntmachung",
      "state": "Hessen",
      "amtsgericht": "Amtsgericht Wiesbaden",
      "registernummer": "HRB 2145",
      "registerart": "HRB",
      "company_name": "Athora Lebensversicherung Aktiengesellschaft",
      "company_seat": "Wiesbaden",
      "details": "06.12.2024 (Bekanntmachungsdatum)\n\nHessen Amtsgericht Wiesbaden HRB 2145\nSonstige Registerbekanntmachung 06.12.2024 (Eintragungsdatum)\n\nAthora Lebensversicherung Aktiengesellschaft\nAktiengesellschaft\nWiesbaden\n\nDurch eine Änderung in den Personen der Aufsichtsratsmitglieder ist eine Liste der Mitglieder des Aufsichtsrates zum Handelsregister eingereicht worden."
    },
    {
      "date": "2024-12-06",
      "id": "95693",
      "original_text": "Löschungsankündigung\nHessen Amtsgericht Frankfurt am Main HRB 109253\nGL Trading and Marketing UG (haftungsbeschränkt) – Frankfurt am Main",
      "type": "Löschungsankündigung",
      "state": "Hessen",
      "amtsgericht": "Amtsgericht Frankfurt am Main",
      "registernummer": "HRB 109253",
      "registerart": "HRB",
      "company_name": "GL Trading and Marketing UG (haftungsbeschränkt)",
      "company_seat": "Frankfurt am Main",
      "details": "06.12.2024 (Bekanntmachungsdatum)\n\nHessen Amtsgericht Frankfurt am Main HRB 109253\nLöschungsankündigung\n\nGL Trading and Marketing UG (haftungsbeschränkt)\nGesellschaft mit beschränkter Haftung\nFrankfurt am Main\n\nEs ist beabsichtigt, die Gesellschaft wegen Vermögenslosigkeit gemäß § 394 FamFG von Amts wegen im Handelsregister zu löschen. Hiergegen kann innerhalb eines Monats nach dieser Veröffentlichung Widerspruch bei dem Amtsgericht Frankfurt am Main eingelegt werden."
    },
    {
      "date": "2024-12-06",
      "id": "95694",
      "original_text": "Löschungsankündigung\nHessen Amtsgericht Frankfurt am Main HRB 102175\nMADEX GmbH – Frankfurt am Main",
      "type": "Löschungsankündigung",
      "state": "Hessen",
      "amtsgericht": "Amtsgericht Frankfurt am Main",
      "registernummer": "HRB 102175",
      "registerart": "HRB",
      "company_name": "MADEX GmbH",
      "company_seat": "Frankfurt am Main",
      "details": "06.12.2024 (Bekanntmachungsdatum)\n\nHessen Amtsgericht Frankfurt am Main HRB 102175\nLöschungsankündigung\n\nMADEX GmbH\nGesellschaft mit beschränkter Haftung\nFrankfurt am Main\n\nDas Registergericht beabsichtigt die im Handelsregister eingetragene Gesellschaft von Amts wegen nach § 394 FamFG zu löschen. Die Frist zur Erhebung eines Widerspruchs gegen die beabsichtigte Löschung wird auf 1 Monate festgesetzt."
    },
    {
      "date": "2024-12-06",
      "id": "95695",
      "original_text": "Löschungsankündigung\nHessen Amtsgericht Offenbach am Main HRB 45547\nNobel Business GmbH – Dreieich",
      "type": "Löschungsankündigung",
      "state": "Hessen",
      "amtsgericht": "Amtsgericht Offenbach am Main",
      "registernummer": "HRB 45547",
      "registerart": "HRB",
      "company_name": "Nobel Business GmbH",
      "company_seat": "Dreieich",
      "details": "06.12.2024 (Bekanntmachungsdatum)\n\nHessen Amtsgericht Offenbach am Main HRB 45547\nLöschungsankündigung\n\nNobel Business GmbH\nGesellschaft mit beschränkter Haftung\nDreieich\n\nDas Registergericht beabsichtigt die im Handelsregister eingetragene Gesellschaft von Amts wegen nach § 394 FamFG zu löschen. Die Frist zur Erhebung eines Widerspruchs gegen die beabsichtigte Löschung wird auf 3 Monate festgesetzt"
    },
    {
      "date": "2024-12-06",
      "id": "95696",
      "original_text": "Löschungsankündigung\nHessen Amtsgericht Wiesbaden HRB 29550\nULTRA P&M GmbH – Wiesbaden",
      "type": "Löschungsankündigung",
      "state": "Hessen",
      "amtsgericht": "Amtsgericht Wiesbaden",
      "registernummer": "HRB 29550",
      "registerart": "HRB",
      "company_name": "ULTRA P&M GmbH",
      "company_seat": "Wiesbaden",
      "details": "06.12.2024 (Bekanntmachungsdatum)\n\nHessen Amtsgericht Wiesbaden HRB 29550\nLöschungsankündigung\n\nULTRA P&M GmbH\nGesellschaft mit beschränkter Haftung\nWiesbaden\n\nDas Registergericht beabsichtigt die im Handelsregister eingetragene Gesellschaft von Amts wegen nach § 394 FamFG zu löschen. Die Frist zur Erhebung eines Widerspruchs gegen die beabsichtigte Löschung wird auf 3 Monate festgesetzt."
    },
    {
      "date": "2024-12-06",
      "id": "95697",
      "original_text": "Registerbekanntmachung nach dem Umwandlungsgesetz\nHessen Amtsgericht Friedberg HRB 7632\nSIMPSON STRONG-TIE GmbH – Bad Nauheim",
      "type": "Registerbekanntmachung nach dem Umwandlungsgesetz",
      "state": "Hessen",
      "amtsgericht": "Amtsgericht Friedberg",
      "registernummer": "HRB 7632",
      "registerart": "HRB",
      "company_name": "SIMPSON STRONG-TIE GmbH",
      "company_seat": "Bad Nauheim",
      "details": "06.12.2024 (Bekanntmachungsdatum)\n\nHessen Amtsgericht Friedberg HRB 7632\nRegisterbekanntmachung nach dem Umwandlungsgesetz 06.12.2024 (Eintragungsdatum)\n\nSIMPSON STRONG-TIE GmbH\nGesellschaft mit beschränkter Haftung\nBad Nauheim\n\nDen Gläubigern der an der Verschmelzung beteiligten Rechtsträger ist, wenn sie binnen sechs Monaten nach dem Tag, an dem die Eintragung der Verschmelzung in das Register des Sitzes desjenigen Rechtsträgers, dessen Gläubiger sie sind, nach § 19 Absatz 3 UmwG bekannt gemacht worden ist, ihren Anspruch nach Grund und Höhe schriftlich anmelden, Sicherheit zu leisten, soweit sie nicht Befriedigung verlangen können. Dieses Recht steht den Gläubigern jedoch nur zu, wenn sie glaubhaft machen, dass durch die Verschmelzung die Erfüllung ihrer Forderung gefährdet wird."
    },
    {
      "date": "2024-12-06",
      "id": "95698",
      "original_text": "Registerbekanntmachung nach dem Umwandlungsgesetz\nHessen Amtsgericht Wiesbaden HRB 23456\nEurowind Aktiengesellschaft – Wiesbaden",
      "type": "Registerbekanntmachung nach dem Umwandlungsgesetz",
      "state": "Hessen",
      "amtsgericht": "Amtsgericht Wiesbaden",
      "registernummer": "HRB 23456",
      "registerart": "HRB",
      "company_name": "Eurowind Aktiengesellschaft",
      "company_seat": "Wiesbaden",
      "details": "06.12.2024 (Bekanntmachungsdatum)\n\nHessen Amtsgericht Wiesbaden HRB 23456\nRegisterbekanntmachung nach dem Umwandlungsgesetz 06.12.2024 (Eintragungsdatum)\n\nEurowind Aktiengesellschaft\nAktiengesellschaft\nWiesbaden\n\nDen Gläubigern der an der formwechselnden Umwandlung beteiligten Rechtsträger ist, wenn sie binnen sechs Monaten nach dem Tag, an dem die Eintragung der formwechselnden Umwandlung in das Register des Sitzes derjenigen Rechtsträger deren Gläubiger sie sind, nach § 201 UmwG bekannt gemacht worden ist, ihren Anspruch nach Grund und Höhe schriftlich anmelden, Sicherheit zu leisten, soweit sie nicht Befriedigung verlangen können. Dieses Recht steht den Gläubigern jedoch nur zu, wenn sie glaubhaft machen, dass durch die formwechselnden Umwandlung die Erfüllung ihrer Forderung gefährdet wird."
    },
    {
      "date": "2024-12-06",
      "id": "95699",
      "original_text": "Einreichung neuer Dokumente\nHessen Amtsgericht Wiesbaden HRB 11962\nESWE Verkehrsgesellschaft mbH – Wiesbaden",
      "type": "Einreichung neuer Dokumente",
      "state": "Hessen",
      "amtsgericht": "Amtsgericht Wiesbaden",
      "registernummer": "HRB 11962",
      "registerart": "HRB",
      "company_name": "ESWE Verkehrsgesellschaft mbH",
      "company_seat": "Wiesbaden",
      "details": "06.12.2024 (Bekanntmachungsdatum)\n\nHessen Amtsgericht Wiesbaden HRB 11962\nEinreichung neuer Dokumente 06.12.2024 (Eintragungsdatum)\n\nESWE Verkehrsgesellschaft mbH\nGesellschaft mit beschränkter Haftung\nWiesbaden\n\nDurch eine Änderung in den Personen der Aufsichtsratsmitglieder ist eine Liste der Mitglieder des Aufsichtsrates zum Handelsregister eingereicht worden."
    },
    {
      "date": "2024-12-06",
      "id": "95700",
      "original_text": "Löschungsankündigung\nHessen Amtsgericht Frankfurt am Main HRB 105554\nDream Doctors UG (haftungsbeschränkt) – Frankfurt am Main",
      "type": "Löschungsankündigung",
      "state": "Hessen",
      "amtsgericht": "Amtsgericht Frankfurt am Main",
      "registernummer": "HRB 105554",
      "registerart": "HRB",
      "company_name": "Dream Doctors UG (haftungsbeschränkt)",
      "company_seat": "Frankfurt am Main",
      "details": "06.12.2024 (Bekanntmachungsdatum)\n\nHessen Amtsgericht Frankfurt am Main HRB 105554\nLöschungsankündigung\n\nDream Doctors UG (haftungsbeschränkt)\nGesellschaft mit beschränkter Haftung\nFrankfurt am Main\n\nEs ist beabsichtigt, die Gesellschaft wegen Vermögenslosigkeit gemäß § 394 FamFG von Amts wegen im Handelsregister zu löschen. Hiergegen kann innerhalb eines Monats nach dieser Veröffentlichung Widerspruch bei dem Amtsgericht Frankfurt am Main eingelegt werden."
    },
    {
      "date": "2024-12-06",
      "id": "95701",
      "original_text": "Sonstige Registerbekanntmachung\nHessen Amtsgericht Wiesbaden VR 6143\nBleidenstadter Heimat- und Verschönerungsverein – Taunusstein",
      "type": "Sonstige Registerbekanntmachung",
      "state": "Hessen",
      "amtsgericht": "Amtsgericht Wiesbaden",
      "registernummer": "VR 6143",
      "registerart": "VR",
      "company_name": "Bleidenstadter Heimat- und Verschönerungsverein",
      "company_seat": "Taunusstein",
      "details": "06.12.2024 (Bekanntmachungsdatum)\n\nHessen Amtsgericht Wiesbaden VR 6143\nSonstige Registerbekanntmachung 06.12.2024 (Eintragungsdatum)\n\nBleidenstadter Heimat- und Verschönerungsverein\neingetragener Verein\nTaunusstein\n\nDer Verein ist aufgelöst."
    }
  ]
}