{
  "date": "2025-05-15",
  "date_of_scrape": "2025-05-31T10:41:29.727Z",
  "tool_version": "0.2.0",
  "number_of_announcements": 166,
  "announcements": [
    {
      "date": "2025-05-15",
      "id": "109103",
      "original_text": "Registerbekanntmachung nach dem Umwandlungsgesetz\nBayern Amtsgericht Traunstein GsR 439\nObermeier Energie eGbR – Pleiskirchen",
      "type": "Registerbekanntmachung nach dem Umwandlungsgesetz",
      "state": "Bayern",
      "amtsgericht": "Amtsgericht Traunstein",
      "registernummer": "GsR 439",
      "registerart": "GsR",
      "company_name": "Obermeier Energie eGbR",
      "company_seat": "Pleiskirchen",
      "details": "15.05.2025 (Bekanntmachungsdatum)\n\nBayern Amtsgericht Traunstein GsR 439\nRegisterbekanntmachung nach dem Umwandlungsgesetz 14.05.2025 (Eintragungsdatum)\n\nObermeier Energie eGbR\nGesellschaft bürgerlichen Rechts\nPleiskirchen\n\nDen Gläubigern des formwechselnden Rechtsträgers ist, wenn sie binnen sechs Monaten nach dem Tag, an dem die Eintragung des Formwechsels nach § 201 UmwG als bekannt gemacht gilt, ihren Anspruch nach Grund und Höhe in Textform anmelden, Sicherheit zu leisten, soweit sie nicht Befriedigung verlangen können. Dieses Recht steht den Gläubigern jedoch nur zu, wenn sie glaubhaft machen, dass durch den Formwechsel die Erfüllung ihrer Forderung gefährdet wird."
    },
    {
      "date": "2025-05-15",
      "id": "109104",
      "original_text": "Registerbekanntmachung nach dem Umwandlungsgesetz\nBayern Amtsgericht Traunstein HRB 15022\nG & P Gesellschaft für die Vermittlung von Finanzdienstleistungen mbH – Rattenkirchen",
      "type": "Registerbekanntmachung nach dem Umwandlungsgesetz",
      "state": "Bayern",
      "amtsgericht": "Amtsgericht Traunstein",
      "registernummer": "HRB 15022",
      "registerart": "HRB",
      "company_name": "G & P Gesellschaft für die Vermittlung von Finanzdienstleistungen mbH",
      "company_seat": "Rattenkirchen",
      "details": "15.05.2025 (Bekanntmachungsdatum)\n\nBayern Amtsgericht Traunstein HRB 15022\nRegisterbekanntmachung nach dem Umwandlungsgesetz 14.05.2025 (Eintragungsdatum)\n\nG & P Gesellschaft für die Vermittlung von Finanzdienstleistungen mbH\nGesellschaft mit beschränkter Haftung\nRattenkirchen\n\nDen Gläubigern der an der Verschmelzung beteiligten Rechtsträger ist, wenn sie binnen sechs Monaten nach dem Tag, an dem die Eintragung der Verschmelzung in das Register des Sitzes desjenigen Rechtsträgers, dessen Gläubiger sie sind, nach § 19 Abs. 3 UmwG als bekannt gemacht gilt, ihren Anspruch nach Grund und Höhe in Textform anmelden, Sicherheit zu leisten, soweit sie nicht Befriedigung verlangen können. Dieses Recht steht den Gläubigern jedoch nur zu, wenn sie glaubhaft machen, dass durch die Verschmelzung die Erfüllung ihrer Forderung gefährdet wird."
    },
    {
      "date": "2025-05-15",
      "id": "109105",
      "original_text": "Registerbekanntmachung nach dem Umwandlungsgesetz\nBayern Amtsgericht München HRB 56369\n\"Feldmeier GmbH\" – München",
      "type": "Registerbekanntmachung nach dem Umwandlungsgesetz",
      "state": "Bayern",
      "amtsgericht": "Amtsgericht München",
      "registernummer": "HRB 56369",
      "registerart": "HRB",
      "company_name": "\"Feldmeier GmbH\"",
      "company_seat": "München",
      "details": "15.05.2025 (Bekanntmachungsdatum)\n\nBayern Amtsgericht München HRB 56369\nRegisterbekanntmachung nach dem Umwandlungsgesetz 14.05.2025 (Eintragungsdatum)\n\n\"Feldmeier GmbH\"\nGesellschaft mit beschränkter Haftung\nMünchen\n\nDen Gläubigern der an der Verschmelzung beteiligten Rechtsträger ist, wenn sie binnen sechs Monaten nach dem Tag, an dem die Eintragung der Verschmelzung in das Register des Sitzes desjenigen Rechtsträgers, dessen Gläubiger sie sind, nach § 19 Abs. 3 UmwG als bekannt gemacht gilt, ihren Anspruch nach Grund und Höhe in Textform anmelden, Sicherheit zu leisten, soweit sie nicht Befriedigung verlangen können. Dieses Recht steht den Gläubigern jedoch nur zu, wenn sie glaubhaft machen, dass durch die Verschmelzung die Erfüllung ihrer Forderung gefährdet wird."
    },
    {
      "date": "2025-05-15",
      "id": "109106",
      "original_text": "Löschungsankündigung\nBayern Amtsgericht Passau HRB 8753\nTutte Druckerei & Verlagsservice GmbH – Salzweg",
      "type": "Löschungsankündigung",
      "state": "Bayern",
      "amtsgericht": "Amtsgericht Passau",
      "registernummer": "HRB 8753",
      "registerart": "HRB",
      "company_name": "Tutte Druckerei & Verlagsservice GmbH",
      "company_seat": "Salzweg",
      "details": "15.05.2025 (Bekanntmachungsdatum)\n\nBayern Amtsgericht Passau HRB 8753\nLöschungsankündigung\n\nTutte Druckerei & Verlagsservice GmbH\nGesellschaft mit beschränkter Haftung\nSalzweg\n\nDas Registergericht beabsichtigt, die im Handelsregister eingetragene Gesellschaft wegen Vermögenslosigkeit von Amts wegen nach § 394 FamFG zu löschen. Die Frist zur Erhebung eines Widerspruchs ist auf einen Monat festgesetzt."
    },
    {
      "date": "2025-05-15",
      "id": "109107",
      "original_text": "Registerbekanntmachung nach dem Umwandlungsgesetz\nBayern Amtsgericht München HRB 246637\nRoomgrid GmbH – Krailling",
      "type": "Registerbekanntmachung nach dem Umwandlungsgesetz",
      "state": "Bayern",
      "amtsgericht": "Amtsgericht München",
      "registernummer": "HRB 246637",
      "registerart": "HRB",
      "company_name": "Roomgrid GmbH",
      "company_seat": "Krailling",
      "details": "15.05.2025 (Bekanntmachungsdatum)\n\nBayern Amtsgericht München HRB 246637\nRegisterbekanntmachung nach dem Umwandlungsgesetz 14.05.2025 (Eintragungsdatum)\n\nRoomgrid GmbH\nGesellschaft mit beschränkter Haftung\nKrailling\n\nDen Gläubigern der an der Verschmelzung beteiligten Rechtsträger ist, wenn sie binnen sechs Monaten nach dem Tag, an dem die Eintragung der Verschmelzung in das Register des Sitzes desjenigen Rechtsträgers, dessen Gläubiger sie sind, nach § 19 Abs. 3 UmwG als bekannt gemacht gilt, ihren Anspruch nach Grund und Höhe in Textform anmelden, Sicherheit zu leisten, soweit sie nicht Befriedigung verlangen können. Dieses Recht steht den Gläubigern jedoch nur zu, wenn sie glaubhaft machen, dass durch die Verschmelzung die Erfüllung ihrer Forderung gefährdet wird."
    },
    {
      "date": "2025-05-15",
      "id": "109108",
      "original_text": "Löschungsankündigung\nBayern Amtsgericht Kempten (Allgäu) HRB 1881\nOtto Feix Schmuckwaren GmbH – Mauerstetten-Steinholz",
      "type": "Löschungsankündigung",
      "state": "Bayern",
      "amtsgericht": "Amtsgericht Kempten (Allgäu)",
      "registernummer": "HRB 1881",
      "registerart": "HRB",
      "company_name": "Otto Feix Schmuckwaren GmbH",
      "company_seat": "Mauerstetten-Steinholz",
      "details": "15.05.2025 (Bekanntmachungsdatum)\n\nBayern Amtsgericht Kempten (Allgäu) HRB 1881\nLöschungsankündigung\n\nOtto Feix Schmuckwaren GmbH\nGesellschaft mit beschränkter Haftung\nMauerstetten-Steinholz\n\nDas Registergericht beabsichtigt, die im Handelsregister eingetragene Gesellschaft wegen Vermögenslosigkeit von Amts wegen nach § 394 FamFG zu löschen. Die Frist zur Erhebung eines Widerspruchs ist auf einen Monat festgesetzt."
    },
    {
      "date": "2025-05-15",
      "id": "109109",
      "original_text": "Registerbekanntmachung nach dem Umwandlungsgesetz\nBayern Amtsgericht Coburg VR 246\nKEB - Katholische Erwachsenenbildung in Stadt und Landkreis Coburg e.V. – Coburg",
      "type": "Registerbekanntmachung nach dem Umwandlungsgesetz",
      "state": "Bayern",
      "amtsgericht": "Amtsgericht Coburg",
      "registernummer": "VR 246",
      "registerart": "VR",
      "company_name": "KEB - Katholische Erwachsenenbildung in Stadt und Landkreis Coburg e.V.",
      "company_seat": "Coburg",
      "details": "15.05.2025 (Bekanntmachungsdatum)\n\nBayern Amtsgericht Coburg VR 246\nRegisterbekanntmachung nach dem Umwandlungsgesetz 14.05.2025 (Eintragungsdatum)\n\nKEB - Katholische Erwachsenenbildung in Stadt und Landkreis Coburg e.V.\neingetragener Verein\nCoburg\n\nDen Gläubigern der an der Verschmelzung beteiligten Rechtsträger ist, wenn sie binnen sechs Monaten nach dem Tag, an dem die Eintragung der Verschmelzung in das Register des Sitzes desjenigen Rechtsträgers, dessen Gläubiger sie sind, nach § 19 Abs. 3 UmwG als bekannt gemacht gilt, ihren Anspruch nach Grund und Höhe in Textform anmelden, Sicherheit zu leisten, soweit sie nicht Befriedigung verlangen können. Dieses Recht steht den Gläubigern jedoch nur zu, wenn sie glaubhaft machen, dass durch die Verschmelzung die Erfüllung ihrer Forderung gefährdet wird."
    },
    {
      "date": "2025-05-15",
      "id": "109110",
      "original_text": "Löschungsankündigung\nBayern Amtsgericht Coburg HRB 52\nGittel Triagwerke GmbH – Lichtenfels, Stadtteil Schney",
      "type": "Löschungsankündigung",
      "state": "Bayern",
      "amtsgericht": "Amtsgericht Coburg",
      "registernummer": "HRB 52",
      "registerart": "HRB",
      "company_name": "Gittel Triagwerke GmbH",
      "company_seat": "Lichtenfels, Stadtteil Schney",
      "details": "15.05.2025 (Bekanntmachungsdatum)\n\nBayern Amtsgericht Coburg HRB 52\nLöschungsankündigung\n\nGittel Triagwerke GmbH\nGesellschaft mit beschränkter Haftung\nLichtenfels, Stadtteil Schney\n\nDas Registergericht beabsichtigt, die im Handelsregister eingetragene Gesellschaft wegen Vermögenslosigkeit von Amts wegen nach § 394 FamFG zu löschen. Die Frist zur Erhebung eines Widerspruchs ist auf sechs Wochen festgesetzt."
    },
    {
      "date": "2025-05-15",
      "id": "109111",
      "original_text": "Sonstige Registerbekanntmachung\nBayern Amtsgericht Nürnberg HRB 35594\nOAC Analytics AG – Roth",
      "type": "Sonstige Registerbekanntmachung",
      "state": "Bayern",
      "amtsgericht": "Amtsgericht Nürnberg",
      "registernummer": "HRB 35594",
      "registerart": "HRB",
      "company_name": "OAC Analytics AG",
      "company_seat": "Roth",
      "details": "15.05.2025 (Bekanntmachungsdatum)\n\nBayern Amtsgericht Nürnberg HRB 35594\nSonstige Registerbekanntmachung 14.05.2025 (Eintragungsdatum)\n\nOAC Analytics AG\nAktiengesellschaft\nRoth\n\nDem Amtsgericht Nürnberg -Registergericht- ist eine Liste der Mitglieder des Aufsichtsrats eingereicht worden, § 106 AktG."
    },
    {
      "date": "2025-05-15",
      "id": "109112",
      "original_text": "Einreichung neuer Dokumente\nBayern Amtsgericht München HRB 144217\nHVB Immobilien AG – München",
      "type": "Einreichung neuer Dokumente",
      "state": "Bayern",
      "amtsgericht": "Amtsgericht München",
      "registernummer": "HRB 144217",
      "registerart": "HRB",
      "company_name": "HVB Immobilien AG",
      "company_seat": "München",
      "details": "15.05.2025 (Bekanntmachungsdatum)\n\nBayern Amtsgericht München HRB 144217\nEinreichung neuer Dokumente 05.05.2025 (Eintragungsdatum)\n\nHVB Immobilien AG\nAktiengesellschaft\nMünchen\n\nDem Amtsgericht München -Registergericht- ist eine Liste der Mitglieder des Aufsichtsrats eingereicht worden, § 106 AktG."
    },
    {
      "date": "2025-05-15",
      "id": "109113",
      "original_text": "Löschungsankündigung\nBayern Amtsgericht Nürnberg HRB 37097\nTPZ Verwaltungs GmbH – Neuhaus",
      "type": "Löschungsankündigung",
      "state": "Bayern",
      "amtsgericht": "Amtsgericht Nürnberg",
      "registernummer": "HRB 37097",
      "registerart": "HRB",
      "company_name": "TPZ Verwaltungs GmbH",
      "company_seat": "Neuhaus",
      "details": "15.05.2025 (Bekanntmachungsdatum)\n\nBayern Amtsgericht Nürnberg HRB 37097\nLöschungsankündigung\n\nTPZ Verwaltungs GmbH\nGesellschaft mit beschränkter Haftung\nNeuhaus\n\nDas Registergericht beabsichtigt, die im Handelsregister eingetragene Gesellschaft wegen Vermögenslosigkeit von Amts wegen nach § 394 FamFG zu löschen. Die Frist zur Erhebung eines Widerspruchs ist auf einen Monat festgesetzt. Das Registergericht beabsichtigt, die im Handelsregister eingetragene Firma von Amts wegen nach § 31 Abs. 2 HGB, § 393 FamFG zu löschen. #insert(Text=\"zztb_V_Widerspruchsfrist\")"
    },
    {
      "date": "2025-05-15",
      "id": "109114",
      "original_text": "Löschungsankündigung\nBayern Amtsgericht München HRB 151583\n2nextStep Technology AG – München",
      "type": "Löschungsankündigung",
      "state": "Bayern",
      "amtsgericht": "Amtsgericht München",
      "registernummer": "HRB 151583",
      "registerart": "HRB",
      "company_name": "2nextStep Technology AG",
      "company_seat": "München",
      "details": "15.05.2025 (Bekanntmachungsdatum)\n\nBayern Amtsgericht München HRB 151583\nLöschungsankündigung 14.05.2025 (Eintragungsdatum)\n\n2nextStep Technology AG\nAktiengesellschaft\nMünchen\n\nDas Registergericht beabsichtigt, die im Handelsregister eingetragene Gesellschaft wegen Vermögenslosigkeit von Amts wegen nach § 394 FamFG zu löschen. Die Frist zur Erhebung eines Widerspruchs ist auf drei Monate festgesetzt."
    },
    {
      "date": "2025-05-15",
      "id": "109115",
      "original_text": "Registerbekanntmachung nach dem Umwandlungsgesetz\nBayern Amtsgericht München HRB 82726\nWWD Dienstleistung GmbH – München",
      "type": "Registerbekanntmachung nach dem Umwandlungsgesetz",
      "state": "Bayern",
      "amtsgericht": "Amtsgericht München",
      "registernummer": "HRB 82726",
      "registerart": "HRB",
      "company_name": "WWD Dienstleistung GmbH",
      "company_seat": "München",
      "details": "15.05.2025 (Bekanntmachungsdatum)\n\nBayern Amtsgericht München HRB 82726\nRegisterbekanntmachung nach dem Umwandlungsgesetz 14.05.2025 (Eintragungsdatum)\n\nWWD Dienstleistung GmbH\nGesellschaft mit beschränkter Haftung\nMünchen\n\nDen Gläubigern der an der Verschmelzung beteiligten Rechtsträger ist, wenn sie binnen sechs Monaten nach dem Tag, an dem die Eintragung der Verschmelzung in das Register des Sitzes desjenigen Rechtsträgers, dessen Gläubiger sie sind, nach § 19 Abs. 3 UmwG als bekannt gemacht gilt, ihren Anspruch nach Grund und Höhe in Textform anmelden, Sicherheit zu leisten, soweit sie nicht Befriedigung verlangen können. Dieses Recht steht den Gläubigern jedoch nur zu, wenn sie glaubhaft machen, dass durch die Verschmelzung die Erfüllung ihrer Forderung gefährdet wird."
    },
    {
      "date": "2025-05-15",
      "id": "109116",
      "original_text": "Registerbekanntmachung nach dem Umwandlungsgesetz\nBayern Amtsgericht München HRB 254179\nSPT Beteiligungsmanagement GmbH – Grünwald",
      "type": "Registerbekanntmachung nach dem Umwandlungsgesetz",
      "state": "Bayern",
      "amtsgericht": "Amtsgericht München",
      "registernummer": "HRB 254179",
      "registerart": "HRB",
      "company_name": "SPT Beteiligungsmanagement GmbH",
      "company_seat": "Grünwald",
      "details": "15.05.2025 (Bekanntmachungsdatum)\n\nBayern Amtsgericht München HRB 254179\nRegisterbekanntmachung nach dem Umwandlungsgesetz 14.05.2025 (Eintragungsdatum)\n\nSPT Beteiligungsmanagement GmbH\nGesellschaft mit beschränkter Haftung\nGrünwald\n\nDen Gläubigern der an der Verschmelzung beteiligten Rechtsträger ist, wenn sie binnen sechs Monaten nach dem Tag, an dem die Eintragung der Verschmelzung in das Register des Sitzes desjenigen Rechtsträgers, dessen Gläubiger sie sind, nach § 19 Abs. 3 UmwG als bekannt gemacht gilt, ihren Anspruch nach Grund und Höhe in Textform anmelden, Sicherheit zu leisten, soweit sie nicht Befriedigung verlangen können. Dieses Recht steht den Gläubigern jedoch nur zu, wenn sie glaubhaft machen, dass durch die Verschmelzung die Erfüllung ihrer Forderung gefährdet wird."
    },
    {
      "date": "2025-05-15",
      "id": "109117",
      "original_text": "Registerbekanntmachung nach dem Umwandlungsgesetz\nBayern Amtsgericht München HRB 188126\nThoesch GmbH – Berg",
      "type": "Registerbekanntmachung nach dem Umwandlungsgesetz",
      "state": "Bayern",
      "amtsgericht": "Amtsgericht München",
      "registernummer": "HRB 188126",
      "registerart": "HRB",
      "company_name": "Thoesch GmbH",
      "company_seat": "Berg",
      "details": "15.05.2025 (Bekanntmachungsdatum)\n\nBayern Amtsgericht München HRB 188126\nRegisterbekanntmachung nach dem Umwandlungsgesetz 14.05.2025 (Eintragungsdatum)\n\nThoesch GmbH\nGesellschaft mit beschränkter Haftung\nBerg\n\nDen Gläubigern der an der Verschmelzung beteiligten Rechtsträger ist, wenn sie binnen sechs Monaten nach dem Tag, an dem die Eintragung der Verschmelzung in das Register des Sitzes desjenigen Rechtsträgers, dessen Gläubiger sie sind, nach § 19 Abs. 3 UmwG als bekannt gemacht gilt, ihren Anspruch nach Grund und Höhe in Textform anmelden, Sicherheit zu leisten, soweit sie nicht Befriedigung verlangen können. Dieses Recht steht den Gläubigern jedoch nur zu, wenn sie glaubhaft machen, dass durch die Verschmelzung die Erfüllung ihrer Forderung gefährdet wird."
    },
    {
      "date": "2025-05-15",
      "id": "109118",
      "original_text": "Löschungsankündigung\nBayern Amtsgericht Deggendorf HRB 3637\nAtelier Marcus Wallner GmbH – Deggendorf",
      "type": "Löschungsankündigung",
      "state": "Bayern",
      "amtsgericht": "Amtsgericht Deggendorf",
      "registernummer": "HRB 3637",
      "registerart": "HRB",
      "company_name": "Atelier Marcus Wallner GmbH",
      "company_seat": "Deggendorf",
      "details": "15.05.2025 (Bekanntmachungsdatum)\n\nBayern Amtsgericht Deggendorf HRB 3637\nLöschungsankündigung\n\nAtelier Marcus Wallner GmbH\nGesellschaft mit beschränkter Haftung\nDeggendorf\n\nDas Registergericht beabsichtigt, die im Handelsregister eingetragene Gesellschaft wegen Vermögenslosigkeit von Amts wegen nach § 394 FamFG zu löschen. Die Frist zur Erhebung eines Widerspruchs ist auf einen Monat festgesetzt."
    },
    {
      "date": "2025-05-15",
      "id": "109119",
      "original_text": "Einreichung neuer Dokumente\nBayern Amtsgericht Nürnberg HRB 461\nEisenbahn-Wohnungsbaugesellschaft Nürnberg GmbH – Nürnberg",
      "type": "Einreichung neuer Dokumente",
      "state": "Bayern",
      "amtsgericht": "Amtsgericht Nürnberg",
      "registernummer": "HRB 461",
      "registerart": "HRB",
      "company_name": "Eisenbahn-Wohnungsbaugesellschaft Nürnberg GmbH",
      "company_seat": "Nürnberg",
      "details": "15.05.2025 (Bekanntmachungsdatum)\n\nBayern Amtsgericht Nürnberg HRB 461\nEinreichung neuer Dokumente\n\nEisenbahn-Wohnungsbaugesellschaft Nürnberg GmbH\nGesellschaft mit beschränkter Haftung\nNürnberg\n\nDem Amtsgericht Nürnberg -Registergericht- ist eine Liste der Mitglieder des Aufsichtsrats eingereicht worden, § 52 Abs. 3 S. 2 GmbHG."
    },
    {
      "date": "2025-05-15",
      "id": "109120",
      "original_text": "Registerbekanntmachung nach dem Umwandlungsgesetz\nBayern Amtsgericht Kempten (Allgäu) HRB 18203\nLipp Company GmbH – Roßhaupten",
      "type": "Registerbekanntmachung nach dem Umwandlungsgesetz",
      "state": "Bayern",
      "amtsgericht": "Amtsgericht Kempten (Allgäu)",
      "registernummer": "HRB 18203",
      "registerart": "HRB",
      "company_name": "Lipp Company GmbH",
      "company_seat": "Roßhaupten",
      "details": "15.05.2025 (Bekanntmachungsdatum)\n\nBayern Amtsgericht Kempten (Allgäu) HRB 18203\nRegisterbekanntmachung nach dem Umwandlungsgesetz 14.05.2025 (Eintragungsdatum)\n\nLipp Company GmbH\nGesellschaft mit beschränkter Haftung\nRoßhaupten\n\nDen Gläubigern der an der Ausgliederung beteiligten Rechtsträger ist, wenn sie binnen sechs Monaten nach dem Tag, an dem die Eintragung der Ausgliederung in das Register des Sitzes desjenigen Rechtsträgers, dessen Gläubiger sie sind, nach §§ 125, 19 Abs. 3 UmwG als bekannt gemacht gilt, ihren Anspruch nach Grund und Höhe in Textform anmelden, Sicherheit zu leisten, soweit sie nicht Befriedigung verlangen können. Dieses Recht steht den Gläubigern jedoch nur zu, wenn sie glaubhaft machen, dass durch die Ausgliederung die Erfüllung ihrer Forderung gefährdet wird."
    },
    {
      "date": "2025-05-15",
      "id": "109121",
      "original_text": "Einreichung neuer Dokumente\nBayern Amtsgericht München HRB 240852\nSmart Mobile Labs AG – München",
      "type": "Einreichung neuer Dokumente",
      "state": "Bayern",
      "amtsgericht": "Amtsgericht München",
      "registernummer": "HRB 240852",
      "registerart": "HRB",
      "company_name": "Smart Mobile Labs AG",
      "company_seat": "München",
      "details": "15.05.2025 (Bekanntmachungsdatum)\n\nBayern Amtsgericht München HRB 240852\nEinreichung neuer Dokumente 14.05.2025 (Eintragungsdatum)\n\nSmart Mobile Labs AG\nAktiengesellschaft\nMünchen\n\nDem Amtsgericht München -Registergericht- ist eine Liste der Mitglieder des Aufsichtsrats eingereicht worden, § 106 AktG."
    },
    {
      "date": "2025-05-15",
      "id": "109122",
      "original_text": "Registerbekanntmachung nach dem Umwandlungsgesetz\nBayern Amtsgericht Fürth HRB 20227\nGBI Holding GmbH – Erlangen",
      "type": "Registerbekanntmachung nach dem Umwandlungsgesetz",
      "state": "Bayern",
      "amtsgericht": "Amtsgericht Fürth",
      "registernummer": "HRB 20227",
      "registerart": "HRB",
      "company_name": "GBI Holding GmbH",
      "company_seat": "Erlangen",
      "details": "15.05.2025 (Bekanntmachungsdatum)\n\nBayern Amtsgericht Fürth HRB 20227\nRegisterbekanntmachung nach dem Umwandlungsgesetz 14.05.2025 (Eintragungsdatum)\n\nGBI Holding GmbH\nGesellschaft mit beschränkter Haftung\nErlangen\n\nDen Gläubigern der an der Verschmelzung beteiligten Rechtsträger ist, wenn sie binnen sechs Monaten nach dem Tag, an dem die Eintragung der Verschmelzung in das Register des Sitzes desjenigen Rechtsträgers, dessen Gläubiger sie sind, nach § 19 Abs. 3 UmwG als bekannt gemacht gilt, ihren Anspruch nach Grund und Höhe in Textform anmelden, Sicherheit zu leisten, soweit sie nicht Befriedigung verlangen können. Dieses Recht steht den Gläubigern jedoch nur zu, wenn sie glaubhaft machen, dass durch die Verschmelzung die Erfüllung ihrer Forderung gefährdet wird."
    },
    {
      "date": "2025-05-15",
      "id": "109123",
      "original_text": "Registerbekanntmachung nach dem Umwandlungsgesetz\nBayern Amtsgericht Passau HRB 12899\nSokoli GmbH – Pocking",
      "type": "Registerbekanntmachung nach dem Umwandlungsgesetz",
      "state": "Bayern",
      "amtsgericht": "Amtsgericht Passau",
      "registernummer": "HRB 12899",
      "registerart": "HRB",
      "company_name": "Sokoli GmbH",
      "company_seat": "Pocking",
      "details": "15.05.2025 (Bekanntmachungsdatum)\n\nBayern Amtsgericht Passau HRB 12899\nRegisterbekanntmachung nach dem Umwandlungsgesetz 14.05.2025 (Eintragungsdatum)\n\nSokoli GmbH\nGesellschaft mit beschränkter Haftung\nPocking\n\nDen Gläubigern der an der Ausgliederung beteiligten Rechtsträger ist, wenn sie binnen sechs Monaten nach dem Tag, an dem die Eintragung der Ausgliederung in das Register des Sitzes desjenigen Rechtsträgers, dessen Gläubiger sie sind, nach §§ 125, 19 Abs. 3 UmwG als bekannt gemacht gilt, ihren Anspruch nach Grund und Höhe in Textform anmelden, Sicherheit zu leisten, soweit sie nicht Befriedigung verlangen können. Dieses Recht steht den Gläubigern jedoch nur zu, wenn sie glaubhaft machen, dass durch die Ausgliederung die Erfüllung ihrer Forderung gefährdet wird."
    },
    {
      "date": "2025-05-15",
      "id": "109124",
      "original_text": "Registerbekanntmachung nach dem Umwandlungsgesetz\nBayern Amtsgericht München HRB 301896\nLindab GmbH – Feldkirchen",
      "type": "Registerbekanntmachung nach dem Umwandlungsgesetz",
      "state": "Bayern",
      "amtsgericht": "Amtsgericht München",
      "registernummer": "HRB 301896",
      "registerart": "HRB",
      "company_name": "Lindab GmbH",
      "company_seat": "Feldkirchen",
      "details": "15.05.2025 (Bekanntmachungsdatum)\n\nBayern Amtsgericht München HRB 301896\nRegisterbekanntmachung nach dem Umwandlungsgesetz 14.05.2025 (Eintragungsdatum)\n\nLindab GmbH\nGesellschaft mit beschränkter Haftung\nFeldkirchen\n\nDen Gläubigern der an der Verschmelzung beteiligten Rechtsträger ist, wenn sie binnen sechs Monaten nach dem Tag, an dem die Eintragung der Verschmelzung in das Register des Sitzes desjenigen Rechtsträgers, dessen Gläubiger sie sind, nach § 19 Abs. 3 UmwG als bekannt gemacht gilt, ihren Anspruch nach Grund und Höhe in Textform anmelden, Sicherheit zu leisten, soweit sie nicht Befriedigung verlangen können. Dieses Recht steht den Gläubigern jedoch nur zu, wenn sie glaubhaft machen, dass durch die Verschmelzung die Erfüllung ihrer Forderung gefährdet wird."
    },
    {
      "date": "2025-05-15",
      "id": "109125",
      "original_text": "Registerbekanntmachung nach dem Umwandlungsgesetz\nBayern Amtsgericht Memmingen HRA 14277\nSina Kunz e.K. – Bibertal",
      "type": "Registerbekanntmachung nach dem Umwandlungsgesetz",
      "state": "Bayern",
      "amtsgericht": "Amtsgericht Memmingen",
      "registernummer": "HRA 14277",
      "registerart": "HRA",
      "company_name": "Sina Kunz e.K.",
      "company_seat": "Bibertal",
      "details": "15.05.2025 (Bekanntmachungsdatum)\n\nBayern Amtsgericht Memmingen HRA 14277\nRegisterbekanntmachung nach dem Umwandlungsgesetz 14.05.2025 (Eintragungsdatum)\n\nSina Kunz e.K.\nEinzelkaufmann / Einzelkauffrau\nBibertal\n\nDen Gläubigern der an der Verschmelzung beteiligten Rechtsträger ist, wenn sie binnen sechs Monaten nach dem Tag, an dem die Eintragung der Verschmelzung in das Register des Sitzes desjenigen Rechtsträgers, dessen Gläubiger sie sind, nach § 19 Abs. 3 UmwG als bekannt gemacht gilt, ihren Anspruch nach Grund und Höhe in Textform anmelden, Sicherheit zu leisten, soweit sie nicht Befriedigung verlangen können. Dieses Recht steht den Gläubigern jedoch nur zu, wenn sie glaubhaft machen, dass durch die Verschmelzung die Erfüllung ihrer Forderung gefährdet wird."
    },
    {
      "date": "2025-05-15",
      "id": "109126",
      "original_text": "Registerbekanntmachung nach dem Umwandlungsgesetz\nBayern Amtsgericht Kempten (Allgäu) HRA 11640\nBeim Lipp - Landgasthof & Hotel eK – Roßhaupten",
      "type": "Registerbekanntmachung nach dem Umwandlungsgesetz",
      "state": "Bayern",
      "amtsgericht": "Amtsgericht Kempten (Allgäu)",
      "registernummer": "HRA 11640",
      "registerart": "HRA",
      "company_name": "Beim Lipp - Landgasthof & Hotel eK",
      "company_seat": "Roßhaupten",
      "details": "15.05.2025 (Bekanntmachungsdatum)\n\nBayern Amtsgericht Kempten (Allgäu) HRA 11640\nRegisterbekanntmachung nach dem Umwandlungsgesetz 14.05.2025 (Eintragungsdatum)\n\nBeim Lipp - Landgasthof & Hotel eK\nEinzelkaufmann / Einzelkauffrau\nRoßhaupten\n\nDen Gläubigern der an der Ausgliederung beteiligten Rechtsträger ist, wenn sie binnen sechs Monaten nach dem Tag, an dem die Eintragung der Ausgliederung in das Register des Sitzes desjenigen Rechtsträgers, dessen Gläubiger sie sind, nach §§ 125, 19 Abs. 3 UmwG als bekannt gemacht gilt, ihren Anspruch nach Grund und Höhe in Textform anmelden, Sicherheit zu leisten, soweit sie nicht Befriedigung verlangen können. Dieses Recht steht den Gläubigern jedoch nur zu, wenn sie glaubhaft machen, dass durch die Ausgliederung die Erfüllung ihrer Forderung gefährdet wird."
    },
    {
      "date": "2025-05-15",
      "id": "109127",
      "original_text": "Registerbekanntmachung nach dem Umwandlungsgesetz\nBayern Amtsgericht Coburg VR 10209\nKEB - Katholische Erwachsenenbildung im Landkreis Kronach e.V. – Kronach",
      "type": "Registerbekanntmachung nach dem Umwandlungsgesetz",
      "state": "Bayern",
      "amtsgericht": "Amtsgericht Coburg",
      "registernummer": "VR 10209",
      "registerart": "VR",
      "company_name": "KEB - Katholische Erwachsenenbildung im Landkreis Kronach e.V.",
      "company_seat": "Kronach",
      "details": "15.05.2025 (Bekanntmachungsdatum)\n\nBayern Amtsgericht Coburg VR 10209\nRegisterbekanntmachung nach dem Umwandlungsgesetz 14.05.2025 (Eintragungsdatum)\n\nKEB - Katholische Erwachsenenbildung im Landkreis Kronach e.V.\neingetragener Verein\nKronach\n\nDen Gläubigern der an der Verschmelzung beteiligten Rechtsträger ist, wenn sie binnen sechs Monaten nach dem Tag, an dem die Eintragung der Verschmelzung in das Register des Sitzes desjenigen Rechtsträgers, dessen Gläubiger sie sind, nach § 19 Abs. 3 UmwG als bekannt gemacht gilt, ihren Anspruch nach Grund und Höhe in Textform anmelden, Sicherheit zu leisten, soweit sie nicht Befriedigung verlangen können. Dieses Recht steht den Gläubigern jedoch nur zu, wenn sie glaubhaft machen, dass durch die Verschmelzung die Erfüllung ihrer Forderung gefährdet wird."
    },
    {
      "date": "2025-05-15",
      "id": "109128",
      "original_text": "Registerbekanntmachung nach dem Umwandlungsgesetz\nBayern Amtsgericht München HRB 230271\nsalesfive GmbH – München",
      "type": "Registerbekanntmachung nach dem Umwandlungsgesetz",
      "state": "Bayern",
      "amtsgericht": "Amtsgericht München",
      "registernummer": "HRB 230271",
      "registerart": "HRB",
      "company_name": "salesfive GmbH",
      "company_seat": "München",
      "details": "15.05.2025 (Bekanntmachungsdatum)\n\nBayern Amtsgericht München HRB 230271\nRegisterbekanntmachung nach dem Umwandlungsgesetz 14.05.2025 (Eintragungsdatum)\n\nsalesfive GmbH\nGesellschaft mit beschränkter Haftung\nMünchen\n\nDen Gläubigern der an der Verschmelzung beteiligten Rechtsträger ist, wenn sie binnen sechs Monaten nach dem Tag, an dem die Eintragung der Verschmelzung in das Register des Sitzes desjenigen Rechtsträgers, dessen Gläubiger sie sind, nach § 19 Abs. 3 UmwG als bekannt gemacht gilt, ihren Anspruch nach Grund und Höhe in Textform anmelden, Sicherheit zu leisten, soweit sie nicht Befriedigung verlangen können. Dieses Recht steht den Gläubigern jedoch nur zu, wenn sie glaubhaft machen, dass durch die Verschmelzung die Erfüllung ihrer Forderung gefährdet wird."
    },
    {
      "date": "2025-05-15",
      "id": "109129",
      "original_text": "Einreichung neuer Dokumente\nBayern Amtsgericht Fürth HRB 14738\nSchaeffler AG – Herzogenaurach",
      "type": "Einreichung neuer Dokumente",
      "state": "Bayern",
      "amtsgericht": "Amtsgericht Fürth",
      "registernummer": "HRB 14738",
      "registerart": "HRB",
      "company_name": "Schaeffler AG",
      "company_seat": "Herzogenaurach",
      "details": "15.05.2025 (Bekanntmachungsdatum)\n\nBayern Amtsgericht Fürth HRB 14738\nEinreichung neuer Dokumente\n\nSchaeffler AG\nAktiengesellschaft\nHerzogenaurach\n\nDem Amtsgericht Fürth -Registergericht- ist eine Liste der Mitglieder des Aufsichtsrats eingereicht worden, § 106 AktG."
    },
    {
      "date": "2025-05-15",
      "id": "109130",
      "original_text": "Einreichung neuer Dokumente\nBayern Amtsgericht Regensburg HRB 5171\nGOLDSTEIG Käsereien Bayerwald GmbH – Cham",
      "type": "Einreichung neuer Dokumente",
      "state": "Bayern",
      "amtsgericht": "Amtsgericht Regensburg",
      "registernummer": "HRB 5171",
      "registerart": "HRB",
      "company_name": "GOLDSTEIG Käsereien Bayerwald GmbH",
      "company_seat": "Cham",
      "details": "15.05.2025 (Bekanntmachungsdatum)\n\nBayern Amtsgericht Regensburg HRB 5171\nEinreichung neuer Dokumente\n\nGOLDSTEIG Käsereien Bayerwald GmbH\nGesellschaft mit beschränkter Haftung\nCham\n\nDem Amtsgericht Regensburg -Registergericht- ist eine Liste der Mitglieder des Aufsichtsrats eingereicht worden, § 52 Abs. 3 S. 2 GmbHG."
    },
    {
      "date": "2025-05-15",
      "id": "109131",
      "original_text": "Einreichung neuer Dokumente\nBayern Amtsgericht Würzburg HRB 4528\nWAREMA Renkhoff SE – Marktheidenfeld",
      "type": "Einreichung neuer Dokumente",
      "state": "Bayern",
      "amtsgericht": "Amtsgericht Würzburg",
      "registernummer": "HRB 4528",
      "registerart": "HRB",
      "company_name": "WAREMA Renkhoff SE",
      "company_seat": "Marktheidenfeld",
      "details": "15.05.2025 (Bekanntmachungsdatum)\n\nBayern Amtsgericht Würzburg HRB 4528\nEinreichung neuer Dokumente\n\nWAREMA Renkhoff SE\nEuropäische Aktiengesellschaft (SE)\nMarktheidenfeld\n\nDem Amtsgericht Würzburg -Registergericht- ist eine Liste der Mitglieder des Aufsichtsrats eingereicht worden, Art. 9 Abs. 1 Buchst. c (ii) SE-VO i.V.m. § 106 AktG."
    },
    {
      "date": "2025-05-15",
      "id": "109132",
      "original_text": "Registerbekanntmachung nach dem Umwandlungsgesetz\nBayern Amtsgericht München HRB 258577\nSchumacher medTech group GmbH – Gräfelfing",
      "type": "Registerbekanntmachung nach dem Umwandlungsgesetz",
      "state": "Bayern",
      "amtsgericht": "Amtsgericht München",
      "registernummer": "HRB 258577",
      "registerart": "HRB",
      "company_name": "Schumacher medTech group GmbH",
      "company_seat": "Gräfelfing",
      "details": "15.05.2025 (Bekanntmachungsdatum)\n\nBayern Amtsgericht München HRB 258577\nRegisterbekanntmachung nach dem Umwandlungsgesetz 14.05.2025 (Eintragungsdatum)\n\nSchumacher medTech group GmbH\nGesellschaft mit beschränkter Haftung\nGräfelfing\n\nDen Gläubigern der an der Verschmelzung beteiligten Rechtsträger ist, wenn sie binnen sechs Monaten nach dem Tag, an dem die Eintragung der Verschmelzung in das Register des Sitzes desjenigen Rechtsträgers, dessen Gläubiger sie sind, nach § 19 Abs. 3 UmwG als bekannt gemacht gilt, ihren Anspruch nach Grund und Höhe in Textform anmelden, Sicherheit zu leisten, soweit sie nicht Befriedigung verlangen können. Dieses Recht steht den Gläubigern jedoch nur zu, wenn sie glaubhaft machen, dass durch die Verschmelzung die Erfüllung ihrer Forderung gefährdet wird."
    },
    {
      "date": "2025-05-15",
      "id": "109133",
      "original_text": "Registerbekanntmachung nach dem Umwandlungsgesetz\nBayern Amtsgericht München HRB 201237\nRobert Decker Immobilien GmbH – Dorfen",
      "type": "Registerbekanntmachung nach dem Umwandlungsgesetz",
      "state": "Bayern",
      "amtsgericht": "Amtsgericht München",
      "registernummer": "HRB 201237",
      "registerart": "HRB",
      "company_name": "Robert Decker Immobilien GmbH",
      "company_seat": "Dorfen",
      "details": "15.05.2025 (Bekanntmachungsdatum)\n\nBayern Amtsgericht München HRB 201237\nRegisterbekanntmachung nach dem Umwandlungsgesetz 14.05.2025 (Eintragungsdatum)\n\nRobert Decker Immobilien GmbH\nGesellschaft mit beschränkter Haftung\nDorfen\n\nDen Gläubigern der an der Verschmelzung beteiligten Rechtsträger ist, wenn sie binnen sechs Monaten nach dem Tag, an dem die Eintragung der Verschmelzung in das Register des Sitzes desjenigen Rechtsträgers, dessen Gläubiger sie sind, nach § 19 Abs. 3 UmwG als bekannt gemacht gilt, ihren Anspruch nach Grund und Höhe in Textform anmelden, Sicherheit zu leisten, soweit sie nicht Befriedigung verlangen können. Dieses Recht steht den Gläubigern jedoch nur zu, wenn sie glaubhaft machen, dass durch die Verschmelzung die Erfüllung ihrer Forderung gefährdet wird."
    },
    {
      "date": "2025-05-15",
      "id": "109134",
      "original_text": "Registerbekanntmachung nach dem Umwandlungsgesetz\nBayern Amtsgericht Traunstein GnR 333\nObermeier Energie eG – Pleiskirchen",
      "type": "Registerbekanntmachung nach dem Umwandlungsgesetz",
      "state": "Bayern",
      "amtsgericht": "Amtsgericht Traunstein",
      "registernummer": "GnR 333",
      "registerart": "GnR",
      "company_name": "Obermeier Energie eG",
      "company_seat": "Pleiskirchen",
      "details": "15.05.2025 (Bekanntmachungsdatum)\n\nBayern Amtsgericht Traunstein GnR 333\nRegisterbekanntmachung nach dem Umwandlungsgesetz 14.05.2025 (Eintragungsdatum)\n\nObermeier Energie eG\neingetragene Genossenschaft\nPleiskirchen\n\nDen Gläubigern des formwechselnden Rechtsträgers ist, wenn sie binnen sechs Monaten nach dem Tag, an dem die Eintragung des Formwechsels nach § 201 UmwG als bekannt gemacht gilt, ihren Anspruch nach Grund und Höhe in Textform anmelden, Sicherheit zu leisten, soweit sie nicht Befriedigung verlangen können. Dieses Recht steht den Gläubigern jedoch nur zu, wenn sie glaubhaft machen, dass durch den Formwechsel die Erfüllung ihrer Forderung gefährdet wird."
    },
    {
      "date": "2025-05-15",
      "id": "109135",
      "original_text": "Löschungsankündigung\nBayern Amtsgericht München HRB 110378\nAdria-Bau-GmbH – München",
      "type": "Löschungsankündigung",
      "state": "Bayern",
      "amtsgericht": "Amtsgericht München",
      "registernummer": "HRB 110378",
      "registerart": "HRB",
      "company_name": "Adria-Bau-GmbH",
      "company_seat": "München",
      "details": "15.05.2025 (Bekanntmachungsdatum)\n\nBayern Amtsgericht München HRB 110378\nLöschungsankündigung\n\nAdria-Bau-GmbH\nGesellschaft mit beschränkter Haftung\nMünchen\n\nDas Registergericht beabsichtigt, die im Handelsregister eingetragene Gesellschaft wegen Vermögenslosigkeit von Amts wegen nach § 394 FamFG zu löschen. Die Frist zur Erhebung eines Widerspruchs ist auf drei Monate festgesetzt."
    },
    {
      "date": "2025-05-15",
      "id": "109136",
      "original_text": "Registerbekanntmachung nach dem Umwandlungsgesetz\nBayern Amtsgericht Memmingen HRB 21362\nFräulein Heimelig UG (haftungsbeschränkt) – Bibertal",
      "type": "Registerbekanntmachung nach dem Umwandlungsgesetz",
      "state": "Bayern",
      "amtsgericht": "Amtsgericht Memmingen",
      "registernummer": "HRB 21362",
      "registerart": "HRB",
      "company_name": "Fräulein Heimelig UG (haftungsbeschränkt)",
      "company_seat": "Bibertal",
      "details": "15.05.2025 (Bekanntmachungsdatum)\n\nBayern Amtsgericht Memmingen HRB 21362\nRegisterbekanntmachung nach dem Umwandlungsgesetz 14.05.2025 (Eintragungsdatum)\n\nFräulein Heimelig UG (haftungsbeschränkt)\nGesellschaft mit beschränkter Haftung\nBibertal\n\nDen Gläubigern der an der Verschmelzung beteiligten Rechtsträger ist, wenn sie binnen sechs Monaten nach dem Tag, an dem die Eintragung der Verschmelzung in das Register des Sitzes desjenigen Rechtsträgers, dessen Gläubiger sie sind, nach § 19 Abs. 3 UmwG als bekannt gemacht gilt, ihren Anspruch nach Grund und Höhe in Textform anmelden, Sicherheit zu leisten, soweit sie nicht Befriedigung verlangen können. Dieses Recht steht den Gläubigern jedoch nur zu, wenn sie glaubhaft machen, dass durch die Verschmelzung die Erfüllung ihrer Forderung gefährdet wird."
    },
    {
      "date": "2025-05-15",
      "id": "109137",
      "original_text": "Registerbekanntmachung nach dem Umwandlungsgesetz\nBayern Amtsgericht Coburg VR 20188\nKEB - Katholische Erwachsenenbildung im Landkreis Lichtenfels e.V. – Lichtenfels",
      "type": "Registerbekanntmachung nach dem Umwandlungsgesetz",
      "state": "Bayern",
      "amtsgericht": "Amtsgericht Coburg",
      "registernummer": "VR 20188",
      "registerart": "VR",
      "company_name": "KEB - Katholische Erwachsenenbildung im Landkreis Lichtenfels e.V.",
      "company_seat": "Lichtenfels",
      "details": "15.05.2025 (Bekanntmachungsdatum)\n\nBayern Amtsgericht Coburg VR 20188\nRegisterbekanntmachung nach dem Umwandlungsgesetz 14.05.2025 (Eintragungsdatum)\n\nKEB - Katholische Erwachsenenbildung im Landkreis Lichtenfels e.V.\neingetragener Verein\nLichtenfels\n\nDen Gläubigern der an der Verschmelzung beteiligten Rechtsträger ist, wenn sie binnen sechs Monaten nach dem Tag, an dem die Eintragung der Verschmelzung in das Register des Sitzes desjenigen Rechtsträgers, dessen Gläubiger sie sind, nach § 19 Abs. 3 UmwG als bekannt gemacht gilt, ihren Anspruch nach Grund und Höhe in Textform anmelden, Sicherheit zu leisten, soweit sie nicht Befriedigung verlangen können. Dieses Recht steht den Gläubigern jedoch nur zu, wenn sie glaubhaft machen, dass durch die Verschmelzung die Erfüllung ihrer Forderung gefährdet wird."
    },
    {
      "date": "2025-05-15",
      "id": "109138",
      "original_text": "Registerbekanntmachung nach dem Umwandlungsgesetz\nBayern Amtsgericht München HRB 302326\nMSW Gebäudereinigung GmbH – Unterhaching",
      "type": "Registerbekanntmachung nach dem Umwandlungsgesetz",
      "state": "Bayern",
      "amtsgericht": "Amtsgericht München",
      "registernummer": "HRB 302326",
      "registerart": "HRB",
      "company_name": "MSW Gebäudereinigung GmbH",
      "company_seat": "Unterhaching",
      "details": "15.05.2025 (Bekanntmachungsdatum)\n\nBayern Amtsgericht München HRB 302326\nRegisterbekanntmachung nach dem Umwandlungsgesetz 14.05.2025 (Eintragungsdatum)\n\nMSW Gebäudereinigung GmbH\nGesellschaft mit beschränkter Haftung\nUnterhaching\n\nDen Gläubigern der an der Ausgliederung beteiligten Rechtsträger ist, wenn sie binnen sechs Monaten nach dem Tag, an dem die Eintragung der Ausgliederung in das Register des Sitzes desjenigen Rechtsträgers, dessen Gläubiger sie sind, nach §§ 125, 19 Abs. 3 UmwG als bekannt gemacht gilt, ihren Anspruch nach Grund und Höhe in Textform anmelden, Sicherheit zu leisten, soweit sie nicht Befriedigung verlangen können. Dieses Recht steht den Gläubigern jedoch nur zu, wenn sie glaubhaft machen, dass durch die Ausgliederung die Erfüllung ihrer Forderung gefährdet wird."
    },
    {
      "date": "2025-05-15",
      "id": "109139",
      "original_text": "Einreichung neuer Dokumente\nBayern Amtsgericht München HRB 119307\nMHM Holding Gesellschaft mit beschränkter Haftung – Kirchheim",
      "type": "Einreichung neuer Dokumente",
      "state": "Bayern",
      "amtsgericht": "Amtsgericht München",
      "registernummer": "HRB 119307",
      "registerart": "HRB",
      "company_name": "MHM Holding Gesellschaft mit beschränkter Haftung",
      "company_seat": "Kirchheim",
      "details": "15.05.2025 (Bekanntmachungsdatum)\n\nBayern Amtsgericht München HRB 119307\nEinreichung neuer Dokumente\n\nMHM Holding Gesellschaft mit beschränkter Haftung\nGesellschaft mit beschränkter Haftung\nKirchheim\n\nDem Amtsgericht München -Registergericht- ist eine Liste der Mitglieder des Aufsichtsrats eingereicht worden, § 52 Abs. 3 S. 2 GmbHG."
    },
    {
      "date": "2025-05-15",
      "id": "109140",
      "original_text": "Registerbekanntmachung nach dem Umwandlungsgesetz\nBayern Amtsgericht München HRB 285967\nIMAGIRO Projektentwicklung GmbH – München",
      "type": "Registerbekanntmachung nach dem Umwandlungsgesetz",
      "state": "Bayern",
      "amtsgericht": "Amtsgericht München",
      "registernummer": "HRB 285967",
      "registerart": "HRB",
      "company_name": "IMAGIRO Projektentwicklung GmbH",
      "company_seat": "München",
      "details": "15.05.2025 (Bekanntmachungsdatum)\n\nBayern Amtsgericht München HRB 285967\nRegisterbekanntmachung nach dem Umwandlungsgesetz 14.05.2025 (Eintragungsdatum)\n\nIMAGIRO Projektentwicklung GmbH\nGesellschaft mit beschränkter Haftung\nMünchen\n\nDen Gläubigern der an der Verschmelzung beteiligten Rechtsträger ist, wenn sie binnen sechs Monaten nach dem Tag, an dem die Eintragung der Verschmelzung in das Register des Sitzes desjenigen Rechtsträgers, dessen Gläubiger sie sind, nach § 19 Abs. 3 UmwG als bekannt gemacht gilt, ihren Anspruch nach Grund und Höhe in Textform anmelden, Sicherheit zu leisten, soweit sie nicht Befriedigung verlangen können. Dieses Recht steht den Gläubigern jedoch nur zu, wenn sie glaubhaft machen, dass durch die Verschmelzung die Erfüllung ihrer Forderung gefährdet wird."
    },
    {
      "date": "2025-05-15",
      "id": "109141",
      "original_text": "Registerbekanntmachung nach dem Umwandlungsgesetz\nBayern Amtsgericht München HRB 289886\ne+k commercial portfolio GmbH – Starnberg",
      "type": "Registerbekanntmachung nach dem Umwandlungsgesetz",
      "state": "Bayern",
      "amtsgericht": "Amtsgericht München",
      "registernummer": "HRB 289886",
      "registerart": "HRB",
      "company_name": "e+k commercial portfolio GmbH",
      "company_seat": "Starnberg",
      "details": "15.05.2025 (Bekanntmachungsdatum)\n\nBayern Amtsgericht München HRB 289886\nRegisterbekanntmachung nach dem Umwandlungsgesetz 14.05.2025 (Eintragungsdatum)\n\ne+k commercial portfolio GmbH\nGesellschaft mit beschränkter Haftung\nStarnberg\n\nDen Gläubigern der an der Verschmelzung beteiligten Rechtsträger ist, wenn sie binnen sechs Monaten nach dem Tag, an dem die Eintragung der Verschmelzung in das Register des Sitzes desjenigen Rechtsträgers, dessen Gläubiger sie sind, nach § 19 Abs. 3 UmwG als bekannt gemacht gilt, ihren Anspruch nach Grund und Höhe in Textform anmelden, Sicherheit zu leisten, soweit sie nicht Befriedigung verlangen können. Dieses Recht steht den Gläubigern jedoch nur zu, wenn sie glaubhaft machen, dass durch die Verschmelzung die Erfüllung ihrer Forderung gefährdet wird."
    },
    {
      "date": "2025-05-15",
      "id": "109142",
      "original_text": "Registerbekanntmachung nach dem Umwandlungsgesetz\nBayern Amtsgericht München HRB 221033\nBirkenstock digital GmbH – München",
      "type": "Registerbekanntmachung nach dem Umwandlungsgesetz",
      "state": "Bayern",
      "amtsgericht": "Amtsgericht München",
      "registernummer": "HRB 221033",
      "registerart": "HRB",
      "company_name": "Birkenstock digital GmbH",
      "company_seat": "München",
      "details": "15.05.2025 (Bekanntmachungsdatum)\n\nBayern Amtsgericht München HRB 221033\nRegisterbekanntmachung nach dem Umwandlungsgesetz 14.05.2025 (Eintragungsdatum)\n\nBirkenstock digital GmbH\nGesellschaft mit beschränkter Haftung\nMünchen\n\nDen Gläubigern der an der Spaltung beteiligten Rechtsträger ist, wenn sie binnen sechs Monaten nach dem Tag, an dem die Eintragung der Spaltung in das Register des Sitzes desjenigen Rechtsträgers, dessen Gläubiger sie sind, nach §§ 125, 19 Abs. 3 UmwG als bekannt gemacht gilt, ihren Anspruch nach Grund und Höhe in Textform anmelden, Sicherheit zu leisten, soweit sie nicht Befriedigung verlangen können. Dieses Recht steht den Gläubigern jedoch nur zu, wenn sie glaubhaft machen, dass durch die Spaltung die Erfüllung ihrer Forderung gefährdet wird."
    },
    {
      "date": "2025-05-15",
      "id": "109143",
      "original_text": "Löschungsankündigung\nBrandenburg Amtsgericht Potsdam HRB 38729\nMed-Triage UG (haftungsbeschränkt) – Potsdam",
      "type": "Löschungsankündigung",
      "state": "Brandenburg",
      "amtsgericht": "Amtsgericht Potsdam",
      "registernummer": "HRB 38729",
      "registerart": "HRB",
      "company_name": "Med-Triage UG (haftungsbeschränkt)",
      "company_seat": "Potsdam",
      "details": "15.05.2025 (Bekanntmachungsdatum)\n\nBrandenburg Amtsgericht Potsdam HRB 38729\nLöschungsankündigung\n\nMed-Triage UG (haftungsbeschränkt)\nGesellschaft mit beschränkter Haftung\nPotsdam\n\nBei der nachstehenden Gesellschaft wird das Amtslöschungsverfahren gemäß § 394 FamFG eingeleitet. Widerspruchsfrist 8 Wochen."
    },
    {
      "date": "2025-05-15",
      "id": "109144",
      "original_text": "Registerbekanntmachung nach dem Umwandlungsgesetz\nBaden-Württemberg Amtsgericht Mannheim HRB 722921\nMektec Europe Sales GmbH – Weinheim",
      "type": "Registerbekanntmachung nach dem Umwandlungsgesetz",
      "state": "Baden-Württemberg",
      "amtsgericht": "Amtsgericht Mannheim",
      "registernummer": "HRB 722921",
      "registerart": "HRB",
      "company_name": "Mektec Europe Sales GmbH",
      "company_seat": "Weinheim",
      "details": "15.05.2025 (Bekanntmachungsdatum)\n\nBaden-Württemberg Amtsgericht Mannheim HRB 722921\nRegisterbekanntmachung nach dem Umwandlungsgesetz 15.05.2025 (Eintragungsdatum)\n\nMektec Europe Sales GmbH\nGesellschaft mit beschränkter Haftung\nWeinheim\n\nAls nicht eingetragen wird bekanntgemacht:\nDen Gläubigern der an der Verschmelzung beteiligten Rechtsträger ist, wenn sie binnen sechs Monaten nach dem Tag, an dem die Eintragung der Verschmelzung in das Register des Sitzes desjenigen Rechtsträgers, dessen Gläubiger sie sind, nach § 19 Abs. 3 UmwG als bekanntgemacht gilt, ihren Anspruch nach Grund und Höhe schriftlich anmelden, Sicherheit zu leisten, soweit sie nicht Befriedigung verlangen können. Dieses Recht steht den Gläubigern jedoch nur zu, wenn sie glaubhaft machen, dass durch die Verschmelzung die Erfüllung ihrer Forderung gefährdet wird."
    },
    {
      "date": "2025-05-15",
      "id": "109145",
      "original_text": "Löschungsankündigung\nBerlin Amtsgericht Berlin (Charlottenburg) HRB 158845\nFeraru Schrottverwertungs GmbH – Berlin",
      "type": "Löschungsankündigung",
      "state": "Berlin",
      "amtsgericht": "Amtsgericht Berlin (Charlottenburg)",
      "registernummer": "HRB 158845",
      "registerart": "HRB",
      "company_name": "Feraru Schrottverwertungs GmbH",
      "company_seat": "Berlin",
      "details": "15.05.2025 (Bekanntmachungsdatum)\n\nBerlin Amtsgericht Berlin (Charlottenburg) HRB 158845\nLöschungsankündigung\n\nFeraru Schrottverwertungs GmbH\nGesellschaft mit beschränkter Haftung\nBerlin\n\nBei der nachstehenden Gesellschaft wird das Amtslöschungsverfahren gemäß § 394 FamFG eingeleitet. Widerspruchsfrist 6 Wochen"
    },
    {
      "date": "2025-05-15",
      "id": "109146",
      "original_text": "Registerbekanntmachung nach dem Umwandlungsgesetz\nBerlin Amtsgericht Berlin (Charlottenburg) HRB 133839\nIngenieurgruppe Dr. Struck Ingenieurgesellschaft mbH – Berlin",
      "type": "Registerbekanntmachung nach dem Umwandlungsgesetz",
      "state": "Berlin",
      "amtsgericht": "Amtsgericht Berlin (Charlottenburg)",
      "registernummer": "HRB 133839",
      "registerart": "HRB",
      "company_name": "Ingenieurgruppe Dr. Struck Ingenieurgesellschaft mbH",
      "company_seat": "Berlin",
      "details": "15.05.2025 (Bekanntmachungsdatum)\n\nBerlin Amtsgericht Berlin (Charlottenburg) HRB 133839\nRegisterbekanntmachung nach dem Umwandlungsgesetz 14.05.2025 (Eintragungsdatum)\n\nIngenieurgruppe Dr. Struck Ingenieurgesellschaft mbH\nGesellschaft mit beschränkter Haftung\nBerlin\n\nDen Gläubigern der an der Verschmelzung beteiligten Rechtsträger ist, wenn sie binnen sechs Monaten nach dem Tag, an dem die Eintragung der Verschmelzung in das Register des Sitzes desjenigen Rechtsträgers, dessen Gläubiger sie sind, als bekannt gemacht gilt, ihren Anspruch nach Grund und Höhe schriftlich anmelden, Sicherheit zu leisten, soweit sie nicht Befriedigung verlangen können. Dieses Recht steht den Gläubigern jedoch nur zu, wenn sie glaubhaft machen, dass durch die Verschmelzung die Erfüllung ihrer Forderung gefährdet wird. Das Recht, Sicherheitsleistung zu verlangen, steht Gläubigern nicht zu, die im Falle der Insolvenz ein Recht auf vorzugsweise Befriedigung aus einer Deckungsmasse haben, die nach gesetzlicher Vorschrift zu ihrem Schutz errichtet und staatlich überwacht ist.Zu Eintragungsnummer 4 vom 14.05.2025 wird als nicht eingetragen veröffentlicht:"
    },
    {
      "date": "2025-05-15",
      "id": "109147",
      "original_text": "Registerbekanntmachung nach dem Umwandlungsgesetz\nHamburg Amtsgericht Hamburg HRB 139861\nUNITED WIND Logistics GmbH – Hamburg",
      "type": "Registerbekanntmachung nach dem Umwandlungsgesetz",
      "state": "Hamburg",
      "amtsgericht": "Amtsgericht Hamburg",
      "registernummer": "HRB 139861",
      "registerart": "HRB",
      "company_name": "UNITED WIND Logistics GmbH",
      "company_seat": "Hamburg",
      "details": "15.05.2025 (Bekanntmachungsdatum)\n\nHamburg Amtsgericht Hamburg HRB 139861\nRegisterbekanntmachung nach dem Umwandlungsgesetz 15.05.2025 (Eintragungsdatum)\n\nUNITED WIND Logistics GmbH\nGesellschaft mit beschränkter Haftung\nHamburg\n\nAls nicht eingetragen wird bekannt gemacht:\nDen Gläubigern der an der formwechselnden Umwandlung beteiligten Gesellschaften ist, wenn sie binnen sechs Monaten nach dem Tag, an dem die Eintragung der formwechselnden Umwandlung in das Register des Sitzes desjenigen Rechtsträgers, dessen Gläubiger sie sind, nach § 19 Absatz 3 UmwG als bekannt gemacht gilt, ihren Anspruch nach Grund und Höhe schriftlich anmelden, Sicherheit zu leisten, soweit sie nicht Befriedigung verlangen können. Dieses Recht steht den Gläubigern jedoch nur zu, wenn sie glaubhaft machen, dass durch die formwechselnde Umwandlung die Erfüllung ihrer Forderung gefährdet wird."
    },
    {
      "date": "2025-05-15",
      "id": "109148",
      "original_text": "Registerbekanntmachung nach dem Umwandlungsgesetz\nBerlin Amtsgericht Berlin (Charlottenburg) HRB 162855\nDILAX Management Investment Verwaltungsgesellschaft mbH – Berlin",
      "type": "Registerbekanntmachung nach dem Umwandlungsgesetz",
      "state": "Berlin",
      "amtsgericht": "Amtsgericht Berlin (Charlottenburg)",
      "registernummer": "HRB 162855",
      "registerart": "HRB",
      "company_name": "DILAX Management Investment Verwaltungsgesellschaft mbH",
      "company_seat": "Berlin",
      "details": "15.05.2025 (Bekanntmachungsdatum)\n\nBerlin Amtsgericht Berlin (Charlottenburg) HRB 162855\nRegisterbekanntmachung nach dem Umwandlungsgesetz 14.05.2025 (Eintragungsdatum)\n\nDILAX Management Investment Verwaltungsgesellschaft mbH\nGesellschaft mit beschränkter Haftung\nBerlin\n\nDen Gläubigern der an der Verschmelzung beteiligten Rechtsträger ist, wenn sie binnen sechs Monaten nach dem Tag, an dem die Eintragung der Verschmelzung in das Register des Sitzes desjenigen Rechtsträgers, dessen Gläubiger sie sind, als bekannt gemacht gilt, ihren Anspruch nach Grund und Höhe schriftlich anmelden, Sicherheit zu leisten, soweit sie nicht Befriedigung verlangen können. Dieses Recht steht den Gläubigern jedoch nur zu, wenn sie glaubhaft machen, dass durch die Verschmelzung die Erfüllung ihrer Forderung gefährdet wird. Das Recht, Sicherheitsleistung zu verlangen, steht Gläubigern nicht zu, die im Falle der Insolvenz ein Recht auf vorzugsweise Befriedigung aus einer Deckungsmasse haben, die nach gesetzlicher Vorschrift zu ihrem Schutz errichtet und staatlich überwacht ist.Zu Eintragungsnummer 5 vom 14.05.2025 wird als nicht eingetragen veröffentlicht:"
    },
    {
      "date": "2025-05-15",
      "id": "109149",
      "original_text": "Löschungsankündigung\nBaden-Württemberg Amtsgericht Freiburg VR 370151\nSpanischer Kulturverein Kehl e.V. - ACEK – Kehl",
      "type": "Löschungsankündigung",
      "state": "Baden-Württemberg",
      "amtsgericht": "Amtsgericht Freiburg",
      "registernummer": "VR 370151",
      "registerart": "VR",
      "company_name": "Spanischer Kulturverein Kehl e.V. - ACEK",
      "company_seat": "Kehl",
      "details": "15.05.2025 (Bekanntmachungsdatum)\n\nBaden-Württemberg Amtsgericht Freiburg VR 370151\nLöschungsankündigung\n\nSpanischer Kulturverein Kehl e.V. - ACEK\neingetragener Verein\nKehl\n\nDas Gericht beabsichtigt, die Eintragung des Vereins im Vereinsregister wegen des Mangels einer wesentlichen Voraussetzung von Amts wegen als unzulässig zu löschen. Die Frist zur Geltendmachung eines Widerspruchs gegen die beabsichtigte Löschung ist auf einen Monat ab Veröffentlichung bestimmt."
    },
    {
      "date": "2025-05-15",
      "id": "109150",
      "original_text": "Sonstige Registerbekanntmachung\nSachsen-Anhalt Amtsgericht Stendal HRB 11056\nStratherm Glas-Vertriebs-GmbH – Straach",
      "type": "Sonstige Registerbekanntmachung",
      "state": "Sachsen-Anhalt",
      "amtsgericht": "Amtsgericht Stendal",
      "registernummer": "HRB 11056",
      "registerart": "HRB",
      "company_name": "Stratherm Glas-Vertriebs-GmbH",
      "company_seat": "Straach",
      "details": "15.05.2025 (Bekanntmachungsdatum)\n\nSachsen-Anhalt Amtsgericht Stendal HRB 11056\nSonstige Registerbekanntmachung\n\nStratherm Glas-Vertriebs-GmbH\nGesellschaft mit beschränkter Haftung\nStraach\n\nHinsichtlich o.g. Gesellschaft ist beabsichtigt, Klaus Dieter Eckert, Lutherstadt Wittenberg OT Straach, zum Nachtragsliquidator zu bestellen. Die Frist zu Einreichung etwaiger Stellungnahmen bzw. Erhebung eines Widerspruchs beim Amtsgericht Stendal wird auf 1 Monat festgesetzt."
    },
    {
      "date": "2025-05-15",
      "id": "109151",
      "original_text": "Registerbekanntmachung nach dem Umwandlungsgesetz\nBaden-Württemberg Amtsgericht Mannheim HRB 335406\nB.A.G. Bernhardt Automobilhandels GmbH – Heidelberg",
      "type": "Registerbekanntmachung nach dem Umwandlungsgesetz",
      "state": "Baden-Württemberg",
      "amtsgericht": "Amtsgericht Mannheim",
      "registernummer": "HRB 335406",
      "registerart": "HRB",
      "company_name": "B.A.G. Bernhardt Automobilhandels GmbH",
      "company_seat": "Heidelberg",
      "details": "15.05.2025 (Bekanntmachungsdatum)\n\nBaden-Württemberg Amtsgericht Mannheim HRB 335406\nRegisterbekanntmachung nach dem Umwandlungsgesetz 15.05.2025 (Eintragungsdatum)\n\nB.A.G. Bernhardt Automobilhandels GmbH\nGesellschaft mit beschränkter Haftung\nHeidelberg\n\nAls nicht eingetragen wird bekanntgemacht:\nDen Gläubigern der an der Verschmelzung beteiligten Rechtsträger ist, wenn sie binnen sechs Monaten nach dem Tag, an dem die Eintragung der Verschmelzung in das Register des Sitzes desjenigen Rechtsträgers, dessen Gläubiger sie sind, nach § 19 Abs. 3 UmwG als bekanntgemacht gilt, ihren Anspruch nach Grund und Höhe schriftlich anmelden, Sicherheit zu leisten, soweit sie nicht Befriedigung verlangen können. Dieses Recht steht den Gläubigern jedoch nur zu, wenn sie glaubhaft machen, dass durch die Verschmelzung die Erfüllung ihrer Forderung gefährdet wird."
    },
    {
      "date": "2025-05-15",
      "id": "109152",
      "original_text": "Löschungsankündigung\nBerlin Amtsgericht Berlin (Charlottenburg) HRB 106593\nPOLMIL GmbH – Berlin",
      "type": "Löschungsankündigung",
      "state": "Berlin",
      "amtsgericht": "Amtsgericht Berlin (Charlottenburg)",
      "registernummer": "HRB 106593",
      "registerart": "HRB",
      "company_name": "POLMIL GmbH",
      "company_seat": "Berlin",
      "details": "15.05.2025 (Bekanntmachungsdatum)\n\nBerlin Amtsgericht Berlin (Charlottenburg) HRB 106593\nLöschungsankündigung\n\nPOLMIL GmbH\nGesellschaft mit beschränkter Haftung\nBerlin\n\nBei der nachstehenden Gesellschaft wird das Amtslöschungsverfahren gemäß § 394 FamFG eingeleitet. Widerspruchsfrist 6 Wochen"
    },
    {
      "date": "2025-05-15",
      "id": "109153",
      "original_text": "Löschungsankündigung\nBaden-Württemberg Amtsgericht Ulm HRB 738455\nDMB Projektmanagement GmbH – Königsbronn",
      "type": "Löschungsankündigung",
      "state": "Baden-Württemberg",
      "amtsgericht": "Amtsgericht Ulm",
      "registernummer": "HRB 738455",
      "registerart": "HRB",
      "company_name": "DMB Projektmanagement GmbH",
      "company_seat": "Königsbronn",
      "details": "15.05.2025 (Bekanntmachungsdatum)\n\nBaden-Württemberg Amtsgericht Ulm HRB 738455\nLöschungsankündigung\n\nDMB Projektmanagement GmbH\nGesellschaft mit beschränkter Haftung\nKönigsbronn\n\nDas Gericht beabsichtigt, die Gesellschaft wegen Vermögenslosigkeit im Handelsregister von Amts wegen nach § 394 FamFG zu löschen. Die Frist zur Geltendmachung eines Widerspruchs gegen die beabsichtigte Löschung ist auf  einen Monat ab Veröffentlichung bestimmt."
    },
    {
      "date": "2025-05-15",
      "id": "109154",
      "original_text": "Einreichung neuer Dokumente\nBaden-Württemberg Amtsgericht Mannheim HRB 717394\nFUCHS SE – Mannheim",
      "type": "Einreichung neuer Dokumente",
      "state": "Baden-Württemberg",
      "amtsgericht": "Amtsgericht Mannheim",
      "registernummer": "HRB 717394",
      "registerart": "HRB",
      "company_name": "FUCHS SE",
      "company_seat": "Mannheim",
      "details": "15.05.2025 (Bekanntmachungsdatum)\n\nBaden-Württemberg Amtsgericht Mannheim HRB 717394\nEinreichung neuer Dokumente 15.05.2025 (Eintragungsdatum)\n\nFUCHS SE\nEuropäische Aktiengesellschaft (SE)\nMannheim\n\nDie Gesellschaft hat am 13.05.2025 die Liste über die Zusammensetzung des Aufsichtsrats zum Handelsregister eingereicht."
    },
    {
      "date": "2025-05-15",
      "id": "109155",
      "original_text": "Einreichung neuer Dokumente\nBaden-Württemberg Amtsgericht Stuttgart HRB 16873\nRegio Stuttgart Marketing- und Tourismus GmbH – Stuttgart",
      "type": "Einreichung neuer Dokumente",
      "state": "Baden-Württemberg",
      "amtsgericht": "Amtsgericht Stuttgart",
      "registernummer": "HRB 16873",
      "registerart": "HRB",
      "company_name": "Regio Stuttgart Marketing- und Tourismus GmbH",
      "company_seat": "Stuttgart",
      "details": "15.05.2025 (Bekanntmachungsdatum)\n\nBaden-Württemberg Amtsgericht Stuttgart HRB 16873\nEinreichung neuer Dokumente\n\nRegio Stuttgart Marketing- und Tourismus GmbH\nGesellschaft mit beschränkter Haftung\nStuttgart\n\nDie Gesellschaft hat am 14.05.2025 die Liste über die Zusammensetzung des Aufsichtsrats zum Handelsregister zum 19.03.2024 nachgereicht."
    },
    {
      "date": "2025-05-15",
      "id": "109156",
      "original_text": "Löschungsankündigung\nMecklenburg-Vorpommern Amtsgericht Neubrandenburg HRB 6350\nMüritz Event GmbH – Malchow",
      "type": "Löschungsankündigung",
      "state": "Mecklenburg-Vorpommern",
      "amtsgericht": "Amtsgericht Neubrandenburg",
      "registernummer": "HRB 6350",
      "registerart": "HRB",
      "company_name": "Müritz Event GmbH",
      "company_seat": "Malchow",
      "details": "15.05.2025 (Bekanntmachungsdatum)\n\nMecklenburg-Vorpommern Amtsgericht Neubrandenburg HRB 6350\nLöschungsankündigung 15.05.2025 (Eintragungsdatum)\n\nMüritz Event GmbH\nGesellschaft mit beschränkter Haftung\nMalchow\n\nDas Registergericht beabsichtigt, die im Handelsregister eingetragene Gesellschaft von Amts wegen nach § 394 FamFG zu löschen. Die Frist zur Erhebung eines Widerspruchs gegen die beabsichtigte Löschung wird auf drei Monate festgesetzt."
    },
    {
      "date": "2025-05-15",
      "id": "109157",
      "original_text": "Registerbekanntmachung nach dem Umwandlungsgesetz\nHamburg Amtsgericht Hamburg HRB 92089\nPRINOVIS Service GmbH – Hamburg",
      "type": "Registerbekanntmachung nach dem Umwandlungsgesetz",
      "state": "Hamburg",
      "amtsgericht": "Amtsgericht Hamburg",
      "registernummer": "HRB 92089",
      "registerart": "HRB",
      "company_name": "PRINOVIS Service GmbH",
      "company_seat": "Hamburg",
      "details": "15.05.2025 (Bekanntmachungsdatum)\n\nHamburg Amtsgericht Hamburg HRB 92089\nRegisterbekanntmachung nach dem Umwandlungsgesetz 15.05.2025 (Eintragungsdatum)\n\nPRINOVIS Service GmbH\nGesellschaft mit beschränkter Haftung\nHamburg\n\nAls nicht eingetragen wird bekannt gemacht:\nDen Gläubigern der an der Verschmelzung beteiligten Gesellschaften ist, wenn sie binnen sechs Monaten nach dem Tag, an dem die Eintragung der Verschmelzung in das Register des Sitzes desjenigen Rechtsträgers, dessen Gläubiger sie sind, nach § 19 Absatz 3 UmwG als bekannt gemacht gilt, ihren Anspruch nach Grund und Höhe schriftlich anmelden, Sicherheit zu leisten, soweit sie nicht Befriedigung verlangen können. Dieses Recht steht den Gläubigern jedoch nur zu, wenn sie glaubhaft machen, dass durch die Verschmelzung die Erfüllung ihrer Forderung gefährdet wird."
    },
    {
      "date": "2025-05-15",
      "id": "109158",
      "original_text": "Einreichung neuer Dokumente\nSaarland Amtsgericht Saarbrücken HRB 4322\nWOGE Saar, Wohnungsgesellschaft Saarland mbH – Saarbrücken",
      "type": "Einreichung neuer Dokumente",
      "state": "Saarland",
      "amtsgericht": "Amtsgericht Saarbrücken",
      "registernummer": "HRB 4322",
      "registerart": "HRB",
      "company_name": "WOGE Saar, Wohnungsgesellschaft Saarland mbH",
      "company_seat": "Saarbrücken",
      "details": "15.05.2025 (Bekanntmachungsdatum)\n\nSaarland Amtsgericht Saarbrücken HRB 4322\nEinreichung neuer Dokumente\n\nWOGE Saar, Wohnungsgesellschaft Saarland mbH\nGesellschaft mit beschränkter Haftung\nSaarbrücken\n\nDie Geschäftsführung der Gesellschaft hat eine Liste der Mitglieder des Aufsichtsrats zum Handelsregister eingereicht (§ 52 Abs. 3 Satz 2 GmbHG)."
    },
    {
      "date": "2025-05-15",
      "id": "109159",
      "original_text": "Löschungsankündigung\nBerlin Amtsgericht Berlin (Charlottenburg) HRB 211131\nWestost Haustechnik GmbH – Berlin",
      "type": "Löschungsankündigung",
      "state": "Berlin",
      "amtsgericht": "Amtsgericht Berlin (Charlottenburg)",
      "registernummer": "HRB 211131",
      "registerart": "HRB",
      "company_name": "Westost Haustechnik GmbH",
      "company_seat": "Berlin",
      "details": "15.05.2025 (Bekanntmachungsdatum)\n\nBerlin Amtsgericht Berlin (Charlottenburg) HRB 211131\nLöschungsankündigung\n\nWestost Haustechnik GmbH\nGesellschaft mit beschränkter Haftung\nBerlin\n\nBei der nachstehenden Gesellschaft wird das Amtslöschungsverfahren gemäß § 394 FamFG eingeleitet. Widerspruchsfrist 6 Wochen"
    },
    {
      "date": "2025-05-15",
      "id": "109160",
      "original_text": "Registerbekanntmachung nach dem Umwandlungsgesetz\nHamburg Amtsgericht Hamburg HRB 105328\nPRINOVIS Ahrensburg Weiterverarbeitung und Logistik GmbH – Hamburg",
      "type": "Registerbekanntmachung nach dem Umwandlungsgesetz",
      "state": "Hamburg",
      "amtsgericht": "Amtsgericht Hamburg",
      "registernummer": "HRB 105328",
      "registerart": "HRB",
      "company_name": "PRINOVIS Ahrensburg Weiterverarbeitung und Logistik GmbH",
      "company_seat": "Hamburg",
      "details": "15.05.2025 (Bekanntmachungsdatum)\n\nHamburg Amtsgericht Hamburg HRB 105328\nRegisterbekanntmachung nach dem Umwandlungsgesetz 15.05.2025 (Eintragungsdatum)\n\nPRINOVIS Ahrensburg Weiterverarbeitung und Logistik GmbH\nGesellschaft mit beschränkter Haftung\nHamburg\n\nAls nicht eingetragen wird bekannt gemacht:\nDen Gläubigern der an der Verschmelzung beteiligten Gesellschaften ist, wenn sie binnen sechs Monaten nach dem Tag, an dem die Eintragung der Verschmelzung in das Register des Sitzes desjenigen Rechtsträgers, dessen Gläubiger sie sind, nach § 19 Absatz 3 UmwG als bekannt gemacht gilt, ihren Anspruch nach Grund und Höhe schriftlich anmelden, Sicherheit zu leisten, soweit sie nicht Befriedigung verlangen können. Dieses Recht steht den Gläubigern jedoch nur zu, wenn sie glaubhaft machen, dass durch die Verschmelzung die Erfüllung ihrer Forderung gefährdet wird."
    },
    {
      "date": "2025-05-15",
      "id": "109161",
      "original_text": "Einreichung neuer Dokumente\nBaden-Württemberg Amtsgericht Mannheim HRB 749822\nBlanc & Fischer Familienholding SE & Co. KGaA – Oberderdingen",
      "type": "Einreichung neuer Dokumente",
      "state": "Baden-Württemberg",
      "amtsgericht": "Amtsgericht Mannheim",
      "registernummer": "HRB 749822",
      "registerart": "HRB",
      "company_name": "Blanc & Fischer Familienholding SE & Co. KGaA",
      "company_seat": "Oberderdingen",
      "details": "15.05.2025 (Bekanntmachungsdatum)\n\nBaden-Württemberg Amtsgericht Mannheim HRB 749822\nEinreichung neuer Dokumente 15.05.2025 (Eintragungsdatum)\n\nBlanc & Fischer Familienholding SE & Co. KGaA\nKommanditgesellschaft auf Aktien\nOberderdingen\n\nDie Gesellschaft hat am 14.05.2025 die Liste über die Zusammensetzung des Aufsichtsrats zum Handelsregister eingereicht."
    },
    {
      "date": "2025-05-15",
      "id": "109162",
      "original_text": "Registerbekanntmachung nach dem Umwandlungsgesetz\nBerlin Amtsgericht Berlin (Charlottenburg) HRA 64257\nHuirong Ni BEST Recruiting e. K. – Berlin",
      "type": "Registerbekanntmachung nach dem Umwandlungsgesetz",
      "state": "Berlin",
      "amtsgericht": "Amtsgericht Berlin (Charlottenburg)",
      "registernummer": "HRA 64257",
      "registerart": "HRA",
      "company_name": "Huirong Ni BEST Recruiting e. K.",
      "company_seat": "Berlin",
      "details": "15.05.2025 (Bekanntmachungsdatum)\n\nBerlin Amtsgericht Berlin (Charlottenburg) HRA 64257\nRegisterbekanntmachung nach dem Umwandlungsgesetz 14.05.2025 (Eintragungsdatum)\n\nHuirong Ni BEST Recruiting e. K.\nEinzelkaufmann / Einzelkauffrau\nBerlin\n\nZu Eintragungsnummer 3 vom 14.05.2025 wird als nicht eingetragen veröffentlicht: Den Gläubigern der an der Spaltung beteiligten Rechtsträger ist, wenn sie binnen sechs Monaten nach dem Tag, an dem die Eintragung der Spaltung in das Register des Sitzes desjenigen Rechtsträgers, dessen Gläubiger sie sind, als bekannt gemacht gilt, ihren Anspruch nach Grund und Höhe schriftlich anmelden, Sicherheit zu leisten, soweit sie nicht Befriedigung verlangen können. Dieses Recht steht den Gläubigern jedoch nur zu, wenn sie glaubhaft machen, dass durch die Spaltung die Erfüllung ihrer Forderung gefährdet wird. Das Recht, Sicherheitsleistung zu verlangen, steht Gläubigern nicht zu, die im Falle der Insolvenz ein Recht auf vorzugsweise Befriedigung aus einer Deckungsmasse haben, die nach gesetzlicher Vorschrift zu ihrem Schutz errichtet und staatlich überwacht ist."
    },
    {
      "date": "2025-05-15",
      "id": "109163",
      "original_text": "Löschungsankündigung\nBerlin Amtsgericht Berlin (Charlottenburg) HRB 254437\nCarpe Diem Agere UG (haftungsbeschränkt) – Berlin",
      "type": "Löschungsankündigung",
      "state": "Berlin",
      "amtsgericht": "Amtsgericht Berlin (Charlottenburg)",
      "registernummer": "HRB 254437",
      "registerart": "HRB",
      "company_name": "Carpe Diem Agere UG (haftungsbeschränkt)",
      "company_seat": "Berlin",
      "details": "15.05.2025 (Bekanntmachungsdatum)\n\nBerlin Amtsgericht Berlin (Charlottenburg) HRB 254437\nLöschungsankündigung\n\nCarpe Diem Agere UG (haftungsbeschränkt)\nGesellschaft mit beschränkter Haftung\nBerlin\n\nBei der nachstehenden Gesellschaft wird das Amtslöschungsverfahren gemäß § 394 FamFG eingeleitet. Widerspruchsfrist 6 Wochen"
    },
    {
      "date": "2025-05-15",
      "id": "109164",
      "original_text": "Registerbekanntmachung nach dem Umwandlungsgesetz\nBaden-Württemberg Amtsgericht Mannheim HRB 732063\nDetect Value AG – Walldorf",
      "type": "Registerbekanntmachung nach dem Umwandlungsgesetz",
      "state": "Baden-Württemberg",
      "amtsgericht": "Amtsgericht Mannheim",
      "registernummer": "HRB 732063",
      "registerart": "HRB",
      "company_name": "Detect Value AG",
      "company_seat": "Walldorf",
      "details": "15.05.2025 (Bekanntmachungsdatum)\n\nBaden-Württemberg Amtsgericht Mannheim HRB 732063\nRegisterbekanntmachung nach dem Umwandlungsgesetz 15.05.2025 (Eintragungsdatum)\n\nDetect Value AG\nAktiengesellschaft\nWalldorf\n\nAls nicht eingetragen wird bekanntgemacht:\nDen Gläubigern der an der Verschmelzung beteiligten Rechtsträger ist, wenn sie binnen sechs Monaten nach dem Tag, an dem die Eintragung der Verschmelzung in das Register des Sitzes desjenigen Rechtsträgers, dessen Gläubiger sie sind, nach § 19 Abs. 3 UmwG als bekanntgemacht gilt, ihren Anspruch nach Grund und Höhe schriftlich anmelden, Sicherheit zu leisten, soweit sie nicht Befriedigung verlangen können. Dieses Recht steht den Gläubigern jedoch nur zu, wenn sie glaubhaft machen, dass durch die Verschmelzung die Erfüllung ihrer Forderung gefährdet wird."
    },
    {
      "date": "2025-05-15",
      "id": "109165",
      "original_text": "Registerbekanntmachung nach dem Umwandlungsgesetz\nHamburg Amtsgericht Hamburg HRB 104241\nPFLEGEN & WOHNEN HAMBURG GmbH – Hamburg",
      "type": "Registerbekanntmachung nach dem Umwandlungsgesetz",
      "state": "Hamburg",
      "amtsgericht": "Amtsgericht Hamburg",
      "registernummer": "HRB 104241",
      "registerart": "HRB",
      "company_name": "PFLEGEN & WOHNEN HAMBURG GmbH",
      "company_seat": "Hamburg",
      "details": "15.05.2025 (Bekanntmachungsdatum)\n\nHamburg Amtsgericht Hamburg HRB 104241\nRegisterbekanntmachung nach dem Umwandlungsgesetz 15.05.2025 (Eintragungsdatum)\n\nPFLEGEN & WOHNEN HAMBURG GmbH\nGesellschaft mit beschränkter Haftung\nHamburg\n\nAls nicht eingetragen wird bekannt gemacht:\nDen Gläubigern der an der Verschmelzung beteiligten Gesellschaften ist, wenn sie binnen sechs Monaten nach dem Tag, an dem die Eintragung der Verschmelzung in das Register des Sitzes desjenigen Rechtsträgers, dessen Gläubiger sie sind, nach § 19 Absatz 3 UmwG als bekannt gemacht gilt, ihren Anspruch nach Grund und Höhe schriftlich anmelden, Sicherheit zu leisten, soweit sie nicht Befriedigung verlangen können. Dieses Recht steht den Gläubigern jedoch nur zu, wenn sie glaubhaft machen, dass durch die Verschmelzung die Erfüllung ihrer Forderung gefährdet wird."
    },
    {
      "date": "2025-05-15",
      "id": "109166",
      "original_text": "Registerbekanntmachung nach dem Umwandlungsgesetz\nHamburg Amtsgericht Hamburg HRB 110613\nPFLEGEN & WOHNEN Service GmbH – Hamburg",
      "type": "Registerbekanntmachung nach dem Umwandlungsgesetz",
      "state": "Hamburg",
      "amtsgericht": "Amtsgericht Hamburg",
      "registernummer": "HRB 110613",
      "registerart": "HRB",
      "company_name": "PFLEGEN & WOHNEN Service GmbH",
      "company_seat": "Hamburg",
      "details": "15.05.2025 (Bekanntmachungsdatum)\n\nHamburg Amtsgericht Hamburg HRB 110613\nRegisterbekanntmachung nach dem Umwandlungsgesetz 15.05.2025 (Eintragungsdatum)\n\nPFLEGEN & WOHNEN Service GmbH\nGesellschaft mit beschränkter Haftung\nHamburg\n\nAls nicht eingetragen wird bekannt gemacht:\nDen Gläubigern der an der Verschmelzung beteiligten Gesellschaften ist, wenn sie binnen sechs Monaten nach dem Tag, an dem die Eintragung der Verschmelzung in das Register des Sitzes desjenigen Rechtsträgers, dessen Gläubiger sie sind, nach § 19 Absatz 3 UmwG als bekannt gemacht gilt, ihren Anspruch nach Grund und Höhe schriftlich anmelden, Sicherheit zu leisten, soweit sie nicht Befriedigung verlangen können. Dieses Recht steht den Gläubigern jedoch nur zu, wenn sie glaubhaft machen, dass durch die Verschmelzung die Erfüllung ihrer Forderung gefährdet wird."
    },
    {
      "date": "2025-05-15",
      "id": "109167",
      "original_text": "Löschungsankündigung\nSaarland Amtsgericht Saarbrücken HRB 18323\nWassergärtner Krämer GmbH – Kleinblittersdorf",
      "type": "Löschungsankündigung",
      "state": "Saarland",
      "amtsgericht": "Amtsgericht Saarbrücken",
      "registernummer": "HRB 18323",
      "registerart": "HRB",
      "company_name": "Wassergärtner Krämer GmbH",
      "company_seat": "Kleinblittersdorf",
      "details": "15.05.2025 (Bekanntmachungsdatum)\n\nSaarland Amtsgericht Saarbrücken HRB 18323\nLöschungsankündigung\n\nWassergärtner Krämer GmbH\nGesellschaft mit beschränkter Haftung\nKleinblittersdorf\n\nEs ist beabsichtigt, die Gesellschaft von Amts wegen gemäß § 394 FamFG wegen Vermögenslosigkeit zu löschen.\nGegen die Löschung von Amts wegen ist das Rechtsmittel des Widerspruchs statthaft. Der Widerspruch ist binnen einer Frist von einem Monat beginnend mit dem Tag dieser Veröffentlichung durch Einreichen eines Widerspruchsschreibens -schriftlich oder zur Niederschrift der Geschäftsstelle beim Amtsgericht Saarbrücken, -zentrales Handelsregister-, Mainzerstr.178, 66121 Saarbrücken einzulegen.\nDer Widerspruch muss die Bezeichnung der angefochtenen Löschungsankündigung enthalten sowie die Erklärung, dass Widerspruch eingelegt wird. Er ist vom Widerspruchsführer oder seinem Bevollmächtigten zu unterzeichnen.\nDas Widerspruchsschreiben kann auch in der Form eines elektronischen Dokumentes eingereicht werden, das mit einer qualifizierten elektronischen Signatur nach dem Signaturgesetz versehen sein muss (§§ 14 Abs. 2 FamFG, 130a, 298 ZPO)."
    },
    {
      "date": "2025-05-15",
      "id": "109168",
      "original_text": "Löschungsankündigung\nBerlin Amtsgericht Berlin (Charlottenburg) HRB 194126\nEJ NAP UG (haftungsbeschränkt) – Berlin",
      "type": "Löschungsankündigung",
      "state": "Berlin",
      "amtsgericht": "Amtsgericht Berlin (Charlottenburg)",
      "registernummer": "HRB 194126",
      "registerart": "HRB",
      "company_name": "EJ NAP UG (haftungsbeschränkt)",
      "company_seat": "Berlin",
      "details": "15.05.2025 (Bekanntmachungsdatum)\n\nBerlin Amtsgericht Berlin (Charlottenburg) HRB 194126\nLöschungsankündigung\n\nEJ NAP UG (haftungsbeschränkt)\nGesellschaft mit beschränkter Haftung\nBerlin\n\nBei der nachstehenden Gesellschaft wird das Amtslöschungsverfahren gemäß § 394 FamFG eingeleitet. Widerspruchsfrist 6 Wochen"
    },
    {
      "date": "2025-05-15",
      "id": "109169",
      "original_text": "Löschungsankündigung\nSaarland Amtsgericht Saarbrücken HRB 105025\nDas Restaurant - Riegelsberghalle - UG (haftungsbeschränkt) – Riegelsberg",
      "type": "Löschungsankündigung",
      "state": "Saarland",
      "amtsgericht": "Amtsgericht Saarbrücken",
      "registernummer": "HRB 105025",
      "registerart": "HRB",
      "company_name": "Das Restaurant - Riegelsberghalle - UG (haftungsbeschränkt)",
      "company_seat": "Riegelsberg",
      "details": "15.05.2025 (Bekanntmachungsdatum)\n\nSaarland Amtsgericht Saarbrücken HRB 105025\nLöschungsankündigung\n\nDas Restaurant - Riegelsberghalle - UG (haftungsbeschränkt)\nGesellschaft mit beschränkter Haftung\nRiegelsberg\n\nEs ist beabsichtigt, die Gesellschaft von Amts wegen gemäß § 394 FamFG wegen Vermögenslosigkeit zu löschen. Gegen die Löschung von Amts wegen ist das Rechtsmittel des Widerspruchs statthaft. Der Widerspruch ist binnen einer Frist von 3 Monaten beginnend mit dem Tag dieser Veröffentlichung durch Einreichen eines Widerspruchsschreibens -schriftlich oder zur Niederschrift der Geschäftsstelle- beim Amtsgericht Saarbrücken, -zentrales Handelsregister-, Mainzerstr.178, 66121 Saarbrücken einzulegen. Der Widerspruch muss die Bezeichnung der angefochtenen Löschungsankündigung enthalten sowie die Erklärung, dass Widerspruch eingelegt wird. Er ist vom Widerspruchsführer oder seinem Bevollmächtigten zu unterzeichnen.\nDas Widerspruchsschreiben kann auch in der Form eines elektronischen Dokumentes eingereicht werden, das mit einer qualifizierten elektronischen Signatur nach dem Signaturgesetz versehen sein muss (§§ 14 Abs. 2 FamFG, 130a, 298 ZPO)."
    },
    {
      "date": "2025-05-15",
      "id": "109170",
      "original_text": "Einreichung neuer Dokumente\nBaden-Württemberg Amtsgericht Stuttgart HRB 17521\nErnst Klett Aktiengesellschaft – Stuttgart",
      "type": "Einreichung neuer Dokumente",
      "state": "Baden-Württemberg",
      "amtsgericht": "Amtsgericht Stuttgart",
      "registernummer": "HRB 17521",
      "registerart": "HRB",
      "company_name": "Ernst Klett Aktiengesellschaft",
      "company_seat": "Stuttgart",
      "details": "15.05.2025 (Bekanntmachungsdatum)\n\nBaden-Württemberg Amtsgericht Stuttgart HRB 17521\nEinreichung neuer Dokumente\n\nErnst Klett Aktiengesellschaft\nAktiengesellschaft\nStuttgart\n\nDie Gesellschaft hat am 14.05.2025 die Liste über die Zusammensetzung des Aufsichtsrats zum Handelsregister eingereicht."
    },
    {
      "date": "2025-05-15",
      "id": "109171",
      "original_text": "Löschungsankündigung\nBerlin Amtsgericht Berlin (Charlottenburg) HRB 194200\nBeefwork GmbH – Berlin",
      "type": "Löschungsankündigung",
      "state": "Berlin",
      "amtsgericht": "Amtsgericht Berlin (Charlottenburg)",
      "registernummer": "HRB 194200",
      "registerart": "HRB",
      "company_name": "Beefwork GmbH",
      "company_seat": "Berlin",
      "details": "15.05.2025 (Bekanntmachungsdatum)\n\nBerlin Amtsgericht Berlin (Charlottenburg) HRB 194200\nLöschungsankündigung\n\nBeefwork GmbH\nGesellschaft mit beschränkter Haftung\nBerlin\n\nBei der nachstehenden Gesellschaft wird das Amtslöschungsverfahren gemäß § 394 FamFG eingeleitet. Widerspruchsfrist 6 Wochen"
    },
    {
      "date": "2025-05-15",
      "id": "109172",
      "original_text": "Löschungsankündigung\nBaden-Württemberg Amtsgericht Ulm HRA 720726\nSSU Solarstrom Ulm GmbH & Co. KG – Ulm",
      "type": "Löschungsankündigung",
      "state": "Baden-Württemberg",
      "amtsgericht": "Amtsgericht Ulm",
      "registernummer": "HRA 720726",
      "registerart": "HRA",
      "company_name": "SSU Solarstrom Ulm GmbH & Co. KG",
      "company_seat": "Ulm",
      "details": "15.05.2025 (Bekanntmachungsdatum)\n\nBaden-Württemberg Amtsgericht Ulm HRA 720726\nLöschungsankündigung\n\nSSU Solarstrom Ulm GmbH & Co. KG\nKommanditgesellschaft\nUlm\n\nAls nicht eingetragen wird bekanntgemacht:\nDas Gericht beabsichtigt, die Gesellschaft wegen Vermögenslosigkeit im Handelsregister von Amts wegen nach § 394 FamFG zu löschen. Die Frist zur Geltendmachung eines Widerspruchs gegen die beabsichtigte Löschung ist auf  einen Monat ab Veröffentlichung bestimmt."
    },
    {
      "date": "2025-05-15",
      "id": "109173",
      "original_text": "Löschungsankündigung\nSchleswig-Holstein Amtsgericht Kiel HRB 19585\nSKS Immobiliengruppe GmbH – Neumünster",
      "type": "Löschungsankündigung",
      "state": "Schleswig-Holstein",
      "amtsgericht": "Amtsgericht Kiel",
      "registernummer": "HRB 19585",
      "registerart": "HRB",
      "company_name": "SKS Immobiliengruppe GmbH",
      "company_seat": "Neumünster",
      "details": "15.05.2025 (Bekanntmachungsdatum)\n\nSchleswig-Holstein Amtsgericht Kiel HRB 19585\nLöschungsankündigung\n\nSKS Immobiliengruppe GmbH\nGesellschaft mit beschränkter Haftung\nNeumünster\n\nEs ist die Löschung der nachstehenden Gesellschaft wegen Vermögenslosigkeit gemäß § 394 FamFG beabsichtigt. Widerspruchsfrist: 2 Monate."
    },
    {
      "date": "2025-05-15",
      "id": "109174",
      "original_text": "Löschungsankündigung\nBerlin Amtsgericht Berlin (Charlottenburg) HRB 137086\nComfort Café GmbH – Berlin",
      "type": "Löschungsankündigung",
      "state": "Berlin",
      "amtsgericht": "Amtsgericht Berlin (Charlottenburg)",
      "registernummer": "HRB 137086",
      "registerart": "HRB",
      "company_name": "Comfort Café GmbH",
      "company_seat": "Berlin",
      "details": "15.05.2025 (Bekanntmachungsdatum)\n\nBerlin Amtsgericht Berlin (Charlottenburg) HRB 137086\nLöschungsankündigung\n\nComfort Café GmbH\nGesellschaft mit beschränkter Haftung\nBerlin\n\nBei der nachstehenden Gesellschaft wird das Amtslöschungsverfahren gemäß § 394 FamFG eingeleitet. Widerspruchsfrist 6 Wochen"
    },
    {
      "date": "2025-05-15",
      "id": "109175",
      "original_text": "Löschungsankündigung\nBaden-Württemberg Amtsgericht Mannheim HRB 732018\nAI Logistik GmbH – Mannheim",
      "type": "Löschungsankündigung",
      "state": "Baden-Württemberg",
      "amtsgericht": "Amtsgericht Mannheim",
      "registernummer": "HRB 732018",
      "registerart": "HRB",
      "company_name": "AI Logistik GmbH",
      "company_seat": "Mannheim",
      "details": "15.05.2025 (Bekanntmachungsdatum)\n\nBaden-Württemberg Amtsgericht Mannheim HRB 732018\nLöschungsankündigung\n\nAI Logistik GmbH\nGesellschaft mit beschränkter Haftung\nMannheim\n\nDas Gericht beabsichtigt, die Gesellschaft wegen Vermögenslosigkeit im Handelsregister von Amts wegen nach § 394 FamFG zu löschen. Die Frist zur Geltendmachung eines Widerspruchs gegen die beabsichtigte Löschung ist auf einen Monat ab Veröffentlichung bestimmt."
    },
    {
      "date": "2025-05-15",
      "id": "109176",
      "original_text": "Registerbekanntmachung nach dem Umwandlungsgesetz\nThüringen Amtsgericht Jena HRB 401090\nFloracent - Gartenbau - GmbH Sondershausen – Sondershausen",
      "type": "Registerbekanntmachung nach dem Umwandlungsgesetz",
      "state": "Thüringen",
      "amtsgericht": "Amtsgericht Jena",
      "registernummer": "HRB 401090",
      "registerart": "HRB",
      "company_name": "Floracent - Gartenbau - GmbH Sondershausen",
      "company_seat": "Sondershausen",
      "details": "15.05.2025 (Bekanntmachungsdatum)\n\nThüringen Amtsgericht Jena HRB 401090\nRegisterbekanntmachung nach dem Umwandlungsgesetz 15.05.2025 (Eintragungsdatum)\n\nFloracent - Gartenbau - GmbH Sondershausen\nGesellschaft mit beschränkter Haftung\nSondershausen\n\nNicht eingetragen: Den Gläubigern der an der Verschmelzung beteiligten Rechtsträger, ist wenn sie binnen sechs Monaten nach dem Tag, an dem die Eintragung der Verschmelzung in das Register des Sitzes desjenigen Rechtsträgers, dessen Gläubiger sie sind,  nach § 19 Abs. 3 UmwG als bekanntgemacht gilt, ihren Anspruch nach Grund und Höhe schriftlich anmelden, Sicherheit zu leisten, soweit sie nicht Befriedigung verlangen können. Dieses Recht steht ihnen jedoch nur zu, wenn sie glaubhaft machen, daß durch die Verschmelzung die Erfüllung ihrer Forderung gefährdet wird."
    },
    {
      "date": "2025-05-15",
      "id": "109177",
      "original_text": "Löschungsankündigung\nThüringen Amtsgericht Jena HRB 506438\nDesign House Lichte GmbH – Neuhaus am Rennweg",
      "type": "Löschungsankündigung",
      "state": "Thüringen",
      "amtsgericht": "Amtsgericht Jena",
      "registernummer": "HRB 506438",
      "registerart": "HRB",
      "company_name": "Design House Lichte GmbH",
      "company_seat": "Neuhaus am Rennweg",
      "details": "15.05.2025 (Bekanntmachungsdatum)\n\nThüringen Amtsgericht Jena HRB 506438\nLöschungsankündigung\n\nDesign House Lichte GmbH\nGesellschaft mit beschränkter Haftung\nNeuhaus am Rennweg\n\nDas Registergericht beabsichtigt, die im Handelsregister eingetragene Gesellschaft wegen Vermögenslosigkeit nach § 394 FamFG von Amts wegen zu löschen. Die Frist zur Erhebung eines Widerspruchs gegen die beabsichtigte Löschung wird auf 6 Wochen festgesetzt."
    },
    {
      "date": "2025-05-15",
      "id": "109178",
      "original_text": "Registerbekanntmachung nach dem Umwandlungsgesetz\nBrandenburg Amtsgericht Cottbus HRB 10912\nN-com GmbH – Lauchhammer",
      "type": "Registerbekanntmachung nach dem Umwandlungsgesetz",
      "state": "Brandenburg",
      "amtsgericht": "Amtsgericht Cottbus",
      "registernummer": "HRB 10912",
      "registerart": "HRB",
      "company_name": "N-com GmbH",
      "company_seat": "Lauchhammer",
      "details": "15.05.2025 (Bekanntmachungsdatum)\n\nBrandenburg Amtsgericht Cottbus HRB 10912\nRegisterbekanntmachung nach dem Umwandlungsgesetz 15.05.2025 (Eintragungsdatum)\n\nN-com GmbH\nGesellschaft mit beschränkter Haftung\nLauchhammer\n\nZu Eintragungsnummer 2 vom 15.05.2025 wird als nicht eingetragen veröffentlicht:\nAls nicht eingetragen wird veröffentlicht:\nDen Gläubigern der an der Verschmelzung beteiligten Rechtsträger ist, wenn sie binnen sechs Monaten nach dem Tag, an dem die Eintragung der Verschmelzung in das Register des Sitzes desjenigen Rechtsträgers, dessen Gläubiger sie sind, als bekannt gemacht gilt, ihren Anspruch nach Grund und Höhe schriftlich anmelden, Sicherheit zu leisten, soweit sie nicht Befriedigung verlangen können. Dieses Recht steht den Gläubigern jedoch nur zu, wenn sie glaubhaft machen, dass durch die Verschmelzung die Erfüllung ihrer Forderung gefährdet wird"
    },
    {
      "date": "2025-05-15",
      "id": "109179",
      "original_text": "Registerbekanntmachung nach dem Umwandlungsgesetz\nBrandenburg Amtsgericht Cottbus HRB 1892\nWMZ Werbe-und Medienzentrum GmbH – Lauchhammer",
      "type": "Registerbekanntmachung nach dem Umwandlungsgesetz",
      "state": "Brandenburg",
      "amtsgericht": "Amtsgericht Cottbus",
      "registernummer": "HRB 1892",
      "registerart": "HRB",
      "company_name": "WMZ Werbe-und Medienzentrum GmbH",
      "company_seat": "Lauchhammer",
      "details": "15.05.2025 (Bekanntmachungsdatum)\n\nBrandenburg Amtsgericht Cottbus HRB 1892\nRegisterbekanntmachung nach dem Umwandlungsgesetz 15.05.2025 (Eintragungsdatum)\n\nWMZ Werbe-und Medienzentrum GmbH\nGesellschaft mit beschränkter Haftung\nLauchhammer\n\nZu Eintragungsnummer 8 vom 15.05.2025 wird als nicht eingetragen veröffentlicht:\nAls nicht eingetragen wird veröffentlicht:\nDen Gläubigern der an der Verschmelzung beteiligten Rechtsträger ist, wenn sie binnen sechs Monaten nach dem Tag, an dem die Eintragung der Verschmelzung in das Register des Sitzes desjenigen Rechtsträgers, dessen Gläubiger sie sind, als bekannt gemacht gilt, ihren Anspruch nach Grund und Höhe schriftlich anmelden, Sicherheit zu leisten, soweit sie nicht Befriedigung verlangen können. Dieses Recht steht den Gläubigern jedoch nur zu, wenn sie glaubhaft machen, dass durch die Verschmelzung die Erfüllung ihrer Forderung gefährdet wird."
    },
    {
      "date": "2025-05-15",
      "id": "109180",
      "original_text": "Registerbekanntmachung nach dem Umwandlungsgesetz\nBaden-Württemberg Amtsgericht Stuttgart HRB 799536\nInfoniqa Group Holding GmbH – Böblingen",
      "type": "Registerbekanntmachung nach dem Umwandlungsgesetz",
      "state": "Baden-Württemberg",
      "amtsgericht": "Amtsgericht Stuttgart",
      "registernummer": "HRB 799536",
      "registerart": "HRB",
      "company_name": "Infoniqa Group Holding GmbH",
      "company_seat": "Böblingen",
      "details": "15.05.2025 (Bekanntmachungsdatum)\n\nBaden-Württemberg Amtsgericht Stuttgart HRB 799536\nRegisterbekanntmachung nach dem Umwandlungsgesetz 15.05.2025 (Eintragungsdatum)\n\nInfoniqa Group Holding GmbH\nGesellschaft mit beschränkter Haftung\nBöblingen\n\nAls nicht eingetragen wird bekanntgemacht:\nDen Gläubigern der an der Verschmelzung beteiligten Rechtsträger ist, wenn sie binnen sechs Monaten nach dem Tag, an dem die Eintragung der Verschmelzung in das Register des Sitzes desjenigen Rechtsträgers, dessen Gläubiger sie sind, nach § 19 Abs. 3 UmwG als bekanntgemacht gilt, ihren Anspruch nach Grund und Höhe schriftlich anmelden, Sicherheit zu leisten, soweit sie nicht Befriedigung verlangen können. Dieses Recht steht den Gläubigern jedoch nur zu, wenn sie glaubhaft machen, dass durch die Verschmelzung die Erfüllung ihrer Forderung gefährdet wird."
    },
    {
      "date": "2025-05-15",
      "id": "109181",
      "original_text": "Sonstige Registerbekanntmachung\nSachsen-Anhalt Amtsgericht Stendal GnR 3140\nVolksbank eG – Sangerhausen",
      "type": "Sonstige Registerbekanntmachung",
      "state": "Sachsen-Anhalt",
      "amtsgericht": "Amtsgericht Stendal",
      "registernummer": "GnR 3140",
      "registerart": "GnR",
      "company_name": "Volksbank eG",
      "company_seat": "Sangerhausen",
      "details": "15.05.2025 (Bekanntmachungsdatum)\n\nSachsen-Anhalt Amtsgericht Stendal GnR 3140\nSonstige Registerbekanntmachung 15.05.2025 (Eintragungsdatum)\n\nVolksbank eG\neingetragene Genossenschaft\nSangerhausen\n\nDie Generalversammlung vom 08.04.2025 hat die Änderung der Satzung beschlossen. Geändert wurden: §§ 2 (Zweck und Gegenstand), 16 ( Aufgaben und Pflichten des Vorstands), 19 (Willensbildung), 23 (Gemeinsame Sitzungen von Vorstand und Aufsichtsrat), 24 (Zusammensetzung und Wahl des Aufsichtsrats), 25 (Konstituierung, Beschlussfassung), 27 (Frist und Tagungsort), § 28 (Einberufung und Tagesordnung), 33 (Abstimmungen und Wahlen), 35 ( Versammlungsniederschrift),36 a (Virtuelle Versammlung, hybride Versammlung und Versammlung im gestreckten Verfahren), 36c ( Teilnahme von Aufsichtsratsmitgliedern an einer Präsenzversammlung in Bild und Ton und Übertragung der Generalversammlung in Bild und Ton),  40 (Nachschusspflicht) und 46 (Bekanntmachungen) nach näherer Maßgabe des eingereichten Protokolls.\nDen Gläubigern der Genossenschaft ist, wenn sie sich binnen 6 Monaten nach der Bekanntmachung bei der Genossenschaft zu diesem Zweck melden, Sicherheit zu leisten, soweit sie nicht Befriedigung verlangen können (§ 22 Abs. 1 bis 3 GenG)."
    },
    {
      "date": "2025-05-15",
      "id": "109182",
      "original_text": "Registerbekanntmachung nach dem Umwandlungsgesetz\nSchleswig-Holstein Amtsgericht Kiel HRB 26365\nContinuo Holding GmbH – Damp",
      "type": "Registerbekanntmachung nach dem Umwandlungsgesetz",
      "state": "Schleswig-Holstein",
      "amtsgericht": "Amtsgericht Kiel",
      "registernummer": "HRB 26365",
      "registerart": "HRB",
      "company_name": "Continuo Holding GmbH",
      "company_seat": "Damp",
      "details": "15.05.2025 (Bekanntmachungsdatum)\n\nSchleswig-Holstein Amtsgericht Kiel HRB 26365\nRegisterbekanntmachung nach dem Umwandlungsgesetz 12.05.2025 (Eintragungsdatum)\n\nContinuo Holding GmbH\nGesellschaft mit beschränkter Haftung\nDamp\n\nZu Eintragungsnummer 4 vom 12.05.2025 wird als nicht eingetragen veröffentlicht:  Als nicht eingetragen wird veröffentlicht: Den Gläubigern der an der Spaltung beteiligten Rechtsträger ist, wenn sie binnen sechs Monaten nach dem Tag, an dem die Eintragung der Spaltung in das Register des Sitzes desjenigen Rechtsträgers, dessen Gläubiger sie sind,  bekannt gemacht worden ist, ihren Anspruch nach Grund und Höhe schriftlich anmelden, Sicherheit zu leisten, soweit sie nicht Befriedigung verlangen können. Dieses Recht steht den Gläubigern jedoch nur zu, wenn sie glaubhaft machen, dass durch die Spaltung die Erfüllung ihrer Forderung gefährdet wird."
    },
    {
      "date": "2025-05-15",
      "id": "109183",
      "original_text": "Registerbekanntmachung nach dem Umwandlungsgesetz\nBerlin Amtsgericht Berlin (Charlottenburg) HRB 176302\nPYUR Vertrieb & Service GmbH – Berlin",
      "type": "Registerbekanntmachung nach dem Umwandlungsgesetz",
      "state": "Berlin",
      "amtsgericht": "Amtsgericht Berlin (Charlottenburg)",
      "registernummer": "HRB 176302",
      "registerart": "HRB",
      "company_name": "PYUR Vertrieb & Service GmbH",
      "company_seat": "Berlin",
      "details": "15.05.2025 (Bekanntmachungsdatum)\n\nBerlin Amtsgericht Berlin (Charlottenburg) HRB 176302\nRegisterbekanntmachung nach dem Umwandlungsgesetz 30.04.2025 (Eintragungsdatum)\n\nPYUR Vertrieb & Service GmbH\nGesellschaft mit beschränkter Haftung\nBerlin\n\nZu Eintragungsnummer 29 vom 30.04.2025 wird als nicht eingetragen veröffentlicht: Den Gläubigern der an der Spaltung beteiligten Rechtsträger ist, wenn sie binnen sechs Monaten nach dem Tag, an dem die Eintragung der Spaltung in das Register des Sitzes desjenigen Rechtsträgers, dessen Gläubiger sie sind, als bekannt gemacht gilt, ihren Anspruch nach Grund und Höhe schriftlich anmelden, Sicherheit zu leisten, soweit sie nicht Befriedigung verlangen können. Dieses Recht steht den Gläubigern jedoch nur zu, wenn sie glaubhaft machen, dass durch die Spaltung die Erfüllung ihrer Forderung gefährdet wird. Das Recht, Sicherheitsleistung zu verlangen, steht Gläubigern nicht zu, die im Falle der Insolvenz ein Recht auf vorzugsweise Befriedigung aus einer Deckungsmasse haben, die nach gesetzlicher Vorschrift zu ihrem Schutz errichtet und staatlich überwacht ist."
    },
    {
      "date": "2025-05-15",
      "id": "109184",
      "original_text": "Registerbekanntmachung nach dem Umwandlungsgesetz\nBaden-Württemberg Amtsgericht Freiburg HRB 713354\nELIQUO KGSTULZ GmbH – Grafenhausen",
      "type": "Registerbekanntmachung nach dem Umwandlungsgesetz",
      "state": "Baden-Württemberg",
      "amtsgericht": "Amtsgericht Freiburg",
      "registernummer": "HRB 713354",
      "registerart": "HRB",
      "company_name": "ELIQUO KGSTULZ GmbH",
      "company_seat": "Grafenhausen",
      "details": "15.05.2025 (Bekanntmachungsdatum)\n\nBaden-Württemberg Amtsgericht Freiburg HRB 713354\nRegisterbekanntmachung nach dem Umwandlungsgesetz 15.05.2025 (Eintragungsdatum)\n\nELIQUO KGSTULZ GmbH\nGesellschaft mit beschränkter Haftung\nGrafenhausen\n\nDen Gläubigern der an der Verschmelzung beteiligten Rechtsträger ist, wenn sie binnen sechs Monaten nach dem Tag, an dem die Eintragung der Verschmelzung in das Register des Sitzes desjenigen Rechtsträgers, dessen Gläubiger sie sind, nach § 19 Abs. 3 UmwG als bekanntgemacht gilt, ihren Anspruch nach Grund und Höhe schriftlich anmelden, Sicherheit zu leisten, soweit sie nicht Befriedigung verlangen können. Dieses Recht steht den Gläubigern jedoch nur zu, wenn sie glaubhaft machen, dass durch die Verschmelzung die Erfüllung ihrer Forderung gefährdet wird."
    },
    {
      "date": "2025-05-15",
      "id": "109185",
      "original_text": "Registerbekanntmachung nach dem Umwandlungsgesetz\nBaden-Württemberg Amtsgericht Stuttgart HRA 740949\nSascha Trunte e.K. – Haiterbach",
      "type": "Registerbekanntmachung nach dem Umwandlungsgesetz",
      "state": "Baden-Württemberg",
      "amtsgericht": "Amtsgericht Stuttgart",
      "registernummer": "HRA 740949",
      "registerart": "HRA",
      "company_name": "Sascha Trunte e.K.",
      "company_seat": "Haiterbach",
      "details": "15.05.2025 (Bekanntmachungsdatum)\n\nBaden-Württemberg Amtsgericht Stuttgart HRA 740949\nRegisterbekanntmachung nach dem Umwandlungsgesetz 15.05.2025 (Eintragungsdatum)\n\nSascha Trunte e.K.\nEinzelkaufmann / Einzelkauffrau\nHaiterbach\n\nDen Gläubigern der an der Ausgliederung beteiligten Rechtsträger ist, wenn sie binnen sechs Monaten nach dem Tag, an dem die Eintragung der Ausgliederung in das Register des Sitzes desjenigen Rechtsträgers, dessen Gläubiger sie sind, nach § 19 Abs. 3 UmwG als bekanntgemacht gilt, ihren Anspruch nach Grund und Höhe schriftlich anmelden, Sicherheit zu leisten, soweit sie nicht Befriedigung verlangen können. Dieses Recht steht den Gläubigern jedoch nur zu, wenn sie glaubhaft machen, dass durch die Ausgliederung die Erfüllung ihrer Forderung gefährdet wird."
    },
    {
      "date": "2025-05-15",
      "id": "109186",
      "original_text": "Registerbekanntmachung nach dem Umwandlungsgesetz\nBaden-Württemberg Amtsgericht Stuttgart HRB 786521\nAUDERE Development GmbH – Fellbach",
      "type": "Registerbekanntmachung nach dem Umwandlungsgesetz",
      "state": "Baden-Württemberg",
      "amtsgericht": "Amtsgericht Stuttgart",
      "registernummer": "HRB 786521",
      "registerart": "HRB",
      "company_name": "AUDERE Development GmbH",
      "company_seat": "Fellbach",
      "details": "15.05.2025 (Bekanntmachungsdatum)\n\nBaden-Württemberg Amtsgericht Stuttgart HRB 786521\nRegisterbekanntmachung nach dem Umwandlungsgesetz 15.05.2025 (Eintragungsdatum)\n\nAUDERE Development GmbH\nGesellschaft mit beschränkter Haftung\nFellbach\n\nDen Gläubigern der an der Verschmelzung beteiligten Rechtsträger ist, wenn sie binnen sechs Monaten nach dem Tag, an dem die Eintragung der Verschmelzung in das Register des Sitzes desjenigen Rechtsträgers, dessen Gläubiger sie sind, nach § 19 Abs. 3 UmwG als bekanntgemacht gilt, ihren Anspruch nach Grund und Höhe schriftlich anmelden, Sicherheit zu leisten, soweit sie nicht Befriedigung verlangen können. Dieses Recht steht den Gläubigern jedoch nur zu, wenn sie glaubhaft machen, dass durch die Verschmelzung die Erfüllung ihrer Forderung gefährdet wird."
    },
    {
      "date": "2025-05-15",
      "id": "109187",
      "original_text": "Registerbekanntmachung nach dem Umwandlungsgesetz\nBaden-Württemberg Amtsgericht Stuttgart HRA 742060\nRalf Grömminger Fotografie + Film e.K. – Kornwestheim",
      "type": "Registerbekanntmachung nach dem Umwandlungsgesetz",
      "state": "Baden-Württemberg",
      "amtsgericht": "Amtsgericht Stuttgart",
      "registernummer": "HRA 742060",
      "registerart": "HRA",
      "company_name": "Ralf Grömminger Fotografie + Film e.K.",
      "company_seat": "Kornwestheim",
      "details": "15.05.2025 (Bekanntmachungsdatum)\n\nBaden-Württemberg Amtsgericht Stuttgart HRA 742060\nRegisterbekanntmachung nach dem Umwandlungsgesetz 15.05.2025 (Eintragungsdatum)\n\nRalf Grömminger Fotografie + Film e.K.\nEinzelkaufmann / Einzelkauffrau\nKornwestheim\n\nAls nicht eingetragen wird bekanntgemacht:\nDen Gläubigern der an der Verschmelzung beteiligten Rechtsträger ist, wenn sie binnen sechs Monaten nach dem Tag, an dem die Eintragung der Verschmelzung in das Register des Sitzes desjenigen Rechtsträgers, dessen Gläubiger sie sind, nach § 19 Abs. 3 UmwG als bekanntgemacht gilt, ihren Anspruch nach Grund und Höhe schriftlich anmelden, Sicherheit zu leisten, soweit sie nicht Befriedigung verlangen können. Dieses Recht steht den Gläubigern jedoch nur zu, wenn sie glaubhaft machen, dass durch die Verschmelzung die Erfüllung ihrer Forderung gefährdet wird."
    },
    {
      "date": "2025-05-15",
      "id": "109188",
      "original_text": "Registerbekanntmachung nach dem Umwandlungsgesetz\nSchleswig-Holstein Amtsgericht Flensburg HRB 12073\nNeubukow Pork GmbH – Harrislee",
      "type": "Registerbekanntmachung nach dem Umwandlungsgesetz",
      "state": "Schleswig-Holstein",
      "amtsgericht": "Amtsgericht Flensburg",
      "registernummer": "HRB 12073",
      "registerart": "HRB",
      "company_name": "Neubukow Pork GmbH",
      "company_seat": "Harrislee",
      "details": "15.05.2025 (Bekanntmachungsdatum)\n\nSchleswig-Holstein Amtsgericht Flensburg HRB 12073\nRegisterbekanntmachung nach dem Umwandlungsgesetz\n\nNeubukow Pork GmbH\nGesellschaft mit beschränkter Haftung\nHarrislee\n\nRegisterbekanntmachung nach dem Umwandlungsgesetz (Bekanntmachung nach § 308 UmwG):\n\nAls nicht eingetragen wird veröffentlicht:\n\n1. Es wird darauf hingewiesen, dass der Entwurf des Verschmelzungsplans hiermit beim Handelsregister eingereicht worden ist.\n\n2. An der Verschmelzung sind die Neubukow Pork GmbH, eine Gesellschaft mit beschränkter Haftung nach deutschem Recht mit Sitz in Harrislee, als übertragende Gesellschaft und die Amstrup DPL ApS, eine GmbH (Anpartsselskab) nach dänischem Recht mit Sitz in Vrå (Dänemark), als übernehmende Gesellschaft beteiligt.\n\n3. Die übertragende Gesellschaft ist eingetragen im Handelsregister des Amtsgerichts Flensburg unter HRB 12073 FL. Die übernehmende Gesellschaft ist eingetragen im dänischen zentralen Unternehmensregister (CVR - Det Centrale Virksomhedsregister) unter CVR-Nr. 28321562.\n\n4. Die Anteilsinhaber und die Gläubiger der an der grenzüberschreitenden Verschmelzung beteiligten Gesellschaften - bei den beteiligten Gesellschaften gibt es keine Arbeitnehmer und keine Betriebsräte - werden nach Maßgabe des § 308 Absatz 1 Satz 2 Nr. 4 a) und b) UmwG darauf hingewiesen, dass sie der jeweiligen Gesellschaft spätestens fünf Arbeitstage vor dem Tag der Beurkundung des Verschmelzungsplanes (§ 308 Absatz 2 UmwG; Tag der Beurkundung: 19.06.2025) bei der Neubukow Pork GmbH bzw. fünf Arbeitstage vor dem Tag der Sitzung der Geschäftsführung der Amstrup DPL Aps (Tag der Sitzung der Geschäftsführung der Amstrup DPL ApS: 19.06.2025) Bemerkungen zum Verschmelzungsplan übermitteln können. Der Verschmelzungsplan soll am 19.06.2025 beurkundet werden. Die Sitzung der Geschäftsführung der Amstrup DPL ApS soll am 19.06.2025 stattfinden. Anmerkungen können postalisch an die Geschäftsanschrift der jeweiligen beteiligten Gesellschaft oder per E-Mail an danhatch@danhatch.dk gesendet werden."
    },
    {
      "date": "2025-05-15",
      "id": "109189",
      "original_text": "Einreichung neuer Dokumente\nBaden-Württemberg Amtsgericht Stuttgart HRB 737788\nMercedes-Benz Mobility AG – Stuttgart",
      "type": "Einreichung neuer Dokumente",
      "state": "Baden-Württemberg",
      "amtsgericht": "Amtsgericht Stuttgart",
      "registernummer": "HRB 737788",
      "registerart": "HRB",
      "company_name": "Mercedes-Benz Mobility AG",
      "company_seat": "Stuttgart",
      "details": "15.05.2025 (Bekanntmachungsdatum)\n\nBaden-Württemberg Amtsgericht Stuttgart HRB 737788\nEinreichung neuer Dokumente\n\nMercedes-Benz Mobility AG\nAktiengesellschaft\nStuttgart\n\nDie Gesellschaft hat am 15.05.2025 die Liste über die Zusammensetzung des Aufsichtsrats zum Handelsregister eingereicht."
    },
    {
      "date": "2025-05-15",
      "id": "109190",
      "original_text": "Löschungsankündigung\nBaden-Württemberg Amtsgericht Freiburg HRB 714009\nHottenlocher Verwaltungs- und Beteiligungsgesellschaft m.b.h. – Mühlingen",
      "type": "Löschungsankündigung",
      "state": "Baden-Württemberg",
      "amtsgericht": "Amtsgericht Freiburg",
      "registernummer": "HRB 714009",
      "registerart": "HRB",
      "company_name": "Hottenlocher Verwaltungs- und Beteiligungsgesellschaft m.b.h.",
      "company_seat": "Mühlingen",
      "details": "15.05.2025 (Bekanntmachungsdatum)\n\nBaden-Württemberg Amtsgericht Freiburg HRB 714009\nLöschungsankündigung 15.05.2025 (Eintragungsdatum)\n\nHottenlocher Verwaltungs- und Beteiligungsgesellschaft m.b.h.\nGesellschaft mit beschränkter Haftung\nMühlingen\n\nAls nicht eingetragen wird bekanntgemacht:\nDas Gericht beabsichtigt, die Gesellschaft wegen Vermögenslosigkeit im Handelsregister von Amts wegen nach § 394 FamFG zu löschen. Die Frist zur Geltendmachung eines Widerspruchs gegen die beabsichtigte Löschung ist auf einen Monat ab Veröffentlichung bestimmt."
    },
    {
      "date": "2025-05-15",
      "id": "109191",
      "original_text": "Einreichung neuer Dokumente\nBerlin Amtsgericht Berlin (Charlottenburg) HRB 50000\nDeutsche Bahn Aktiengesellschaft – Berlin",
      "type": "Einreichung neuer Dokumente",
      "state": "Berlin",
      "amtsgericht": "Amtsgericht Berlin (Charlottenburg)",
      "registernummer": "HRB 50000",
      "registerart": "HRB",
      "company_name": "Deutsche Bahn Aktiengesellschaft",
      "company_seat": "Berlin",
      "details": "15.05.2025 (Bekanntmachungsdatum)\n\nBerlin Amtsgericht Berlin (Charlottenburg) HRB 50000\nEinreichung neuer Dokumente\n\nDeutsche Bahn Aktiengesellschaft\nAktiengesellschaft\nBerlin\n\nAls nicht eingetragen wird veröffentlicht: ein Verschmelzungsvertrag vom 13. Mai 2025 mit der DB Barnsdale AG, Berlin (Amtsgericht Charlottenburg HRB 149322 B) wurde eingereicht."
    },
    {
      "date": "2025-05-15",
      "id": "109192",
      "original_text": "Registerbekanntmachung nach dem Umwandlungsgesetz\nBaden-Württemberg Amtsgericht Freiburg HRB 732411\nHappy Personalservice GmbH – Appenweier",
      "type": "Registerbekanntmachung nach dem Umwandlungsgesetz",
      "state": "Baden-Württemberg",
      "amtsgericht": "Amtsgericht Freiburg",
      "registernummer": "HRB 732411",
      "registerart": "HRB",
      "company_name": "Happy Personalservice GmbH",
      "company_seat": "Appenweier",
      "details": "15.05.2025 (Bekanntmachungsdatum)\n\nBaden-Württemberg Amtsgericht Freiburg HRB 732411\nRegisterbekanntmachung nach dem Umwandlungsgesetz 15.05.2025 (Eintragungsdatum)\n\nHappy Personalservice GmbH\nGesellschaft mit beschränkter Haftung\nAppenweier\n\nAls nicht eingetragen wird bekanntgemacht:\nDen Gläubigern der an der Ausgliederung beteiligten Rechtsträger ist, wenn sie binnen sechs Monaten nach dem Tag, an dem die Eintragung der Ausgliederung in das Register des Sitzes desjenigen Rechtsträgers, dessen Gläubiger sie sind, nach § 19 Abs. 3 UmwG als bekanntgemacht gilt, ihren Anspruch nach Grund und Höhe schriftlich anmelden, Sicherheit zu leisten, soweit sie nicht Befriedigung verlangen können. Dieses Recht steht den Gläubigern jedoch nur zu, wenn sie glaubhaft machen, dass durch die Ausgliederung die Erfüllung ihrer Forderung gefährdet wird."
    },
    {
      "date": "2025-05-15",
      "id": "109193",
      "original_text": "Registerbekanntmachung nach dem Umwandlungsgesetz\nBaden-Württemberg Amtsgericht Freiburg HRA 709078\nHappy Medical Personalservice Fabian Luther e. K. – Oberkirch",
      "type": "Registerbekanntmachung nach dem Umwandlungsgesetz",
      "state": "Baden-Württemberg",
      "amtsgericht": "Amtsgericht Freiburg",
      "registernummer": "HRA 709078",
      "registerart": "HRA",
      "company_name": "Happy Medical Personalservice Fabian Luther e. K.",
      "company_seat": "Oberkirch",
      "details": "15.05.2025 (Bekanntmachungsdatum)\n\nBaden-Württemberg Amtsgericht Freiburg HRA 709078\nRegisterbekanntmachung nach dem Umwandlungsgesetz 15.05.2025 (Eintragungsdatum)\n\nHappy Medical Personalservice Fabian Luther e. K.\nEinzelkaufmann / Einzelkauffrau\nOberkirch\n\nDen Gläubigern der an der Ausgliederung beteiligten Rechtsträger ist, wenn sie binnen sechs Monaten nach dem Tag, an dem die Eintragung der Ausgliederung in das Register des Sitzes desjenigen Rechtsträgers, dessen Gläubiger sie sind, nach §§ 125, 19 Abs. 3 UmwG als bekanntgemacht gilt, ihren Anspruch nach Grund und Höhe schriftlich anmelden, Sicherheit zu leisten, soweit sie nicht Befriedigung verlangen können. Dieses Recht steht den Gläubigern jedoch nur zu, wenn sie glaubhaft machen, dass durch die Ausgliederung die Erfüllung ihrer Forderung gefährdet wird."
    },
    {
      "date": "2025-05-15",
      "id": "109194",
      "original_text": "Registerbekanntmachung nach dem Umwandlungsgesetz\nBerlin Amtsgericht Berlin (Charlottenburg) HRB 153498\njf unikat einrichtungen gmbh – Berlin",
      "type": "Registerbekanntmachung nach dem Umwandlungsgesetz",
      "state": "Berlin",
      "amtsgericht": "Amtsgericht Berlin (Charlottenburg)",
      "registernummer": "HRB 153498",
      "registerart": "HRB",
      "company_name": "jf unikat einrichtungen gmbh",
      "company_seat": "Berlin",
      "details": "15.05.2025 (Bekanntmachungsdatum)\n\nBerlin Amtsgericht Berlin (Charlottenburg) HRB 153498\nRegisterbekanntmachung nach dem Umwandlungsgesetz 14.05.2025 (Eintragungsdatum)\n\njf unikat einrichtungen gmbh\nGesellschaft mit beschränkter Haftung\nBerlin\n\nZu Eintragungsnummer 5 vom 14.05.2025 wird als nicht eingetragen veröffentlicht: Den Gläubigern der an der Verschmelzung beteiligten Rechtsträger ist, wenn sie binnen sechs Monaten nach dem Tag, an dem die Eintragung der Verschmelzung in das Register des Sitzes desjenigen Rechtsträgers, dessen Gläubiger sie sind, als bekannt gemacht gilt, ihren Anspruch nach Grund und Höhe schriftlich anmelden, Sicherheit zu leisten, soweit sie nicht Befriedigung verlangen können. Dieses Recht steht den Gläubigern jedoch nur zu, wenn sie glaubhaft machen, dass durch die Verschmelzung die Erfüllung ihrer Forderung gefährdet wird. Das Recht, Sicherheitsleistung zu verlangen, steht Gläubigern nicht zu, die im Falle der Insolvenz ein Recht auf vorzugsweise Befriedigung aus einer Deckungsmasse haben, die nach gesetzlicher Vorschrift zu ihrem Schutz errichtet und staatlich überwacht ist."
    },
    {
      "date": "2025-05-15",
      "id": "109195",
      "original_text": "Registerbekanntmachung nach dem Umwandlungsgesetz\nBerlin Amtsgericht Berlin (Charlottenburg) HRB 214226\njf unikat einrichtungen gmbh – Berlin",
      "type": "Registerbekanntmachung nach dem Umwandlungsgesetz",
      "state": "Berlin",
      "amtsgericht": "Amtsgericht Berlin (Charlottenburg)",
      "registernummer": "HRB 214226",
      "registerart": "HRB",
      "company_name": "jf unikat einrichtungen gmbh",
      "company_seat": "Berlin",
      "details": "15.05.2025 (Bekanntmachungsdatum)\n\nBerlin Amtsgericht Berlin (Charlottenburg) HRB 214226\nRegisterbekanntmachung nach dem Umwandlungsgesetz 14.05.2025 (Eintragungsdatum)\n\njf unikat einrichtungen gmbh\nGesellschaft mit beschränkter Haftung\nBerlin\n\nZu Eintragungsnummer 4 vom 14.05.2025 wird als nicht eingetragen veröffentlicht: Den Gläubigern der an der Verschmelzung beteiligten Rechtsträger ist, wenn sie binnen sechs Monaten nach dem Tag, an dem die Eintragung der Verschmelzung in das Register des Sitzes desjenigen Rechtsträgers, dessen Gläubiger sie sind, als bekannt gemacht gilt, ihren Anspruch nach Grund und Höhe schriftlich anmelden, Sicherheit zu leisten, soweit sie nicht Befriedigung verlangen können. Dieses Recht steht den Gläubigern jedoch nur zu, wenn sie glaubhaft machen, dass durch die Verschmelzung die Erfüllung ihrer Forderung gefährdet wird. Das Recht, Sicherheitsleistung zu verlangen, steht Gläubigern nicht zu, die im Falle der Insolvenz ein Recht auf vorzugsweise Befriedigung aus einer Deckungsmasse haben, die nach gesetzlicher Vorschrift zu ihrem Schutz errichtet und staatlich überwacht ist."
    },
    {
      "date": "2025-05-15",
      "id": "109196",
      "original_text": "Registerbekanntmachung nach dem Umwandlungsgesetz\nBerlin Amtsgericht Berlin (Charlottenburg) HRB 267613\nBCM RealEstate GmbH – Berlin",
      "type": "Registerbekanntmachung nach dem Umwandlungsgesetz",
      "state": "Berlin",
      "amtsgericht": "Amtsgericht Berlin (Charlottenburg)",
      "registernummer": "HRB 267613",
      "registerart": "HRB",
      "company_name": "BCM RealEstate GmbH",
      "company_seat": "Berlin",
      "details": "15.05.2025 (Bekanntmachungsdatum)\n\nBerlin Amtsgericht Berlin (Charlottenburg) HRB 267613\nRegisterbekanntmachung nach dem Umwandlungsgesetz 14.05.2025 (Eintragungsdatum)\n\nBCM RealEstate GmbH\nGesellschaft mit beschränkter Haftung\nBerlin\n\nZu Eintragungsnummer 2 vom 14.05.2025 wird als nicht eingetragen veröffentlicht:\nDen Gläubigern der an der Verschmelzung beteiligten Rechtsträger ist, wenn sie binnen sechs Monaten nach dem Tag, an dem die Eintragung der Verschmelzung in das Register des Sitzes desjenigen Rechtsträgers, dessen Gläubiger sie sind, als bekannt gemacht gilt, ihren Anspruch nach Grund und Höhe schriftlich anmelden, Sicherheit zu leisten, soweit sie nicht Befriedigung verlangen können. Dieses Recht steht den Gläubigern jedoch nur zu, wenn sie glaubhaft machen, dass durch die Verschmelzung die Erfüllung ihrer Forderung gefährdet wird. Das Recht, Sicherheitsleistung zu verlangen, steht Gläubigern nicht zu, die im Falle der Insolvenz ein Recht auf vorzugsweise Befriedigung aus einer Deckungsmasse haben, die nach gesetzlicher Vorschrift zu ihrem Schutz errichtet und staatlich überwacht ist."
    },
    {
      "date": "2025-05-15",
      "id": "109197",
      "original_text": "Registerbekanntmachung nach dem Umwandlungsgesetz\nBerlin Amtsgericht Berlin (Charlottenburg) HRB 266901\nBCM Holding GmbH – Berlin",
      "type": "Registerbekanntmachung nach dem Umwandlungsgesetz",
      "state": "Berlin",
      "amtsgericht": "Amtsgericht Berlin (Charlottenburg)",
      "registernummer": "HRB 266901",
      "registerart": "HRB",
      "company_name": "BCM Holding GmbH",
      "company_seat": "Berlin",
      "details": "15.05.2025 (Bekanntmachungsdatum)\n\nBerlin Amtsgericht Berlin (Charlottenburg) HRB 266901\nRegisterbekanntmachung nach dem Umwandlungsgesetz 14.05.2025 (Eintragungsdatum)\n\nBCM Holding GmbH\nGesellschaft mit beschränkter Haftung\nBerlin\n\nZu Eintragungsnummer 2 vom 14.05.2025 wird als nicht eingetragen veröffentlicht:\nDen Gläubigern der an der Verschmelzung beteiligten Rechtsträger ist, wenn sie binnen sechs Monaten nach dem Tag, an dem die Eintragung der Verschmelzung in das Register des Sitzes desjenigen Rechtsträgers, dessen Gläubiger sie sind, als bekannt gemacht gilt, ihren Anspruch nach Grund und Höhe schriftlich anmelden, Sicherheit zu leisten, soweit sie nicht Befriedigung verlangen können. Dieses Recht steht den Gläubigern jedoch nur zu, wenn sie glaubhaft machen, dass durch die Verschmelzung die Erfüllung ihrer Forderung gefährdet wird. Das Recht, Sicherheitsleistung zu verlangen, steht Gläubigern nicht zu, die im Falle der Insolvenz ein Recht auf vorzugsweise Befriedigung aus einer Deckungsmasse haben, die nach gesetzlicher Vorschrift zu ihrem Schutz errichtet und staatlich überwacht ist."
    },
    {
      "date": "2025-05-15",
      "id": "109198",
      "original_text": "Löschungsankündigung\nBaden-Württemberg Amtsgericht Ulm HRB 746026\nMerkle investment company GmbH – Ulm",
      "type": "Löschungsankündigung",
      "state": "Baden-Württemberg",
      "amtsgericht": "Amtsgericht Ulm",
      "registernummer": "HRB 746026",
      "registerart": "HRB",
      "company_name": "Merkle investment company GmbH",
      "company_seat": "Ulm",
      "details": "15.05.2025 (Bekanntmachungsdatum)\n\nBaden-Württemberg Amtsgericht Ulm HRB 746026\nLöschungsankündigung\n\nMerkle investment company GmbH\nGesellschaft mit beschränkter Haftung\nUlm\n\nAls nicht eingetragen wird bekanntgemacht:\nDas Gericht beabsichtigt, die am 06.04.2023 vorgenommene Eintragung, die  Bestellung von Herrn Zlatan Milanovic als Geschäftsführer der Merkle investment company GmbH, wegen des Mangels einer wesentlichen Voraussetzung gemäß § 395 FamFG von Amts wegen im Handelsregister als unzulässig zu löschen.\nDie Frist zur Geltendmachung eines Widerspruchs gegen die beabsichtigte Löschung ist auf einen Monat ab Veröffentlichung bestimmt."
    },
    {
      "date": "2025-05-15",
      "id": "109199",
      "original_text": "Registerbekanntmachung nach dem Umwandlungsgesetz\nBaden-Württemberg Amtsgericht Stuttgart HRA 742155\nHeuser Verwaltungs GmbH & Co. KG – Heilbronn",
      "type": "Registerbekanntmachung nach dem Umwandlungsgesetz",
      "state": "Baden-Württemberg",
      "amtsgericht": "Amtsgericht Stuttgart",
      "registernummer": "HRA 742155",
      "registerart": "HRA",
      "company_name": "Heuser Verwaltungs GmbH & Co. KG",
      "company_seat": "Heilbronn",
      "details": "15.05.2025 (Bekanntmachungsdatum)\n\nBaden-Württemberg Amtsgericht Stuttgart HRA 742155\nRegisterbekanntmachung nach dem Umwandlungsgesetz 15.05.2025 (Eintragungsdatum)\n\nHeuser Verwaltungs GmbH & Co. KG\nKommanditgesellschaft\nHeilbronn\n\nAls nicht eingetragen wird bekanntgemacht:\nDen Gläubigern der an der Ausgliederung beteiligten Rechtsträger ist, wenn sie binnen sechs Monaten nach dem Tag, an dem die Eintragung der Ausgliederung in das Register des Sitzes desjenigen Rechtsträgers, dessen Gläubiger sie sind, nach § 19 Abs. 3 UmwG als bekanntgemacht gilt, ihren Anspruch nach Grund und Höhe schriftlich anmelden, Sicherheit zu leisten, soweit sie nicht Befriedigung verlangen können. Dieses Recht steht den Gläubigern jedoch nur zu, wenn sie glaubhaft machen, dass durch die Ausgliederung die Erfüllung ihrer Forderung gefährdet wird."
    },
    {
      "date": "2025-05-15",
      "id": "109200",
      "original_text": "Registerbekanntmachung nach dem Umwandlungsgesetz\nBerlin Amtsgericht Berlin (Charlottenburg) HRB 164793\nDILAX Management Investment Reserve GmbH – Berlin",
      "type": "Registerbekanntmachung nach dem Umwandlungsgesetz",
      "state": "Berlin",
      "amtsgericht": "Amtsgericht Berlin (Charlottenburg)",
      "registernummer": "HRB 164793",
      "registerart": "HRB",
      "company_name": "DILAX Management Investment Reserve GmbH",
      "company_seat": "Berlin",
      "details": "15.05.2025 (Bekanntmachungsdatum)\n\nBerlin Amtsgericht Berlin (Charlottenburg) HRB 164793\nRegisterbekanntmachung nach dem Umwandlungsgesetz 14.05.2025 (Eintragungsdatum)\n\nDILAX Management Investment Reserve GmbH\nGesellschaft mit beschränkter Haftung\nBerlin\n\nZu Eintragungsnummer 5 vom 14.05.2025 wird als nicht eingetragen veröffentlicht:\nDen Gläubigern der an der Verschmelzung beteiligten Rechtsträger ist, wenn sie binnen sechs Monaten nach dem Tag, an dem die Eintragung der Verschmelzung in das Register des Sitzes desjenigen Rechtsträgers, dessen Gläubiger sie sind, als bekannt gemacht gilt, ihren Anspruch nach Grund und Höhe schriftlich anmelden, Sicherheit zu leisten, soweit sie nicht Befriedigung verlangen können. Dieses Recht steht den Gläubigern jedoch nur zu, wenn sie glaubhaft machen, dass durch die Verschmelzung die Erfüllung ihrer Forderung gefährdet wird. Das Recht, Sicherheitsleistung zu verlangen, steht Gläubigern nicht zu, die im Falle der Insolvenz ein Recht auf vorzugsweise Befriedigung aus einer Deckungsmasse haben, die nach gesetzlicher Vorschrift zu ihrem Schutz errichtet und staatlich überwacht ist."
    },
    {
      "date": "2025-05-15",
      "id": "109201",
      "original_text": "Registerbekanntmachung nach dem Umwandlungsgesetz\nBerlin Amtsgericht Berlin (Charlottenburg) HRB 162883\nDILAX Beteiligungs Verwaltungsgesellschaft mbH – Berlin",
      "type": "Registerbekanntmachung nach dem Umwandlungsgesetz",
      "state": "Berlin",
      "amtsgericht": "Amtsgericht Berlin (Charlottenburg)",
      "registernummer": "HRB 162883",
      "registerart": "HRB",
      "company_name": "DILAX Beteiligungs Verwaltungsgesellschaft mbH",
      "company_seat": "Berlin",
      "details": "15.05.2025 (Bekanntmachungsdatum)\n\nBerlin Amtsgericht Berlin (Charlottenburg) HRB 162883\nRegisterbekanntmachung nach dem Umwandlungsgesetz 14.05.2025 (Eintragungsdatum)\n\nDILAX Beteiligungs Verwaltungsgesellschaft mbH\nGesellschaft mit beschränkter Haftung\nBerlin\n\nZu Eintragungsnummer 5 vom 14.05.2025 wird jeweils als nicht eingetragen veröffentlicht:\nDen Gläubigern der an der Verschmelzung beteiligten Rechtsträger ist, wenn sie binnen sechs Monaten nach dem Tag, an dem die Eintragung der Verschmelzung in das Register des Sitzes desjenigen Rechtsträgers, dessen Gläubiger sie sind, als bekannt gemacht gilt, ihren Anspruch nach Grund und Höhe schriftlich anmelden, Sicherheit zu leisten, soweit sie nicht Befriedigung verlangen können. Dieses Recht steht den Gläubigern jedoch nur zu, wenn sie glaubhaft machen, dass durch die Verschmelzung die Erfüllung ihrer Forderung gefährdet wird. Das Recht, Sicherheitsleistung zu verlangen, steht Gläubigern nicht zu, die im Falle der Insolvenz ein Recht auf vorzugsweise Befriedigung aus einer Deckungsmasse haben, die nach gesetzlicher Vorschrift zu ihrem Schutz errichtet und staatlich überwacht ist."
    },
    {
      "date": "2025-05-15",
      "id": "109202",
      "original_text": "Löschungsankündigung\nMecklenburg-Vorpommern Amtsgericht Rostock HRA 2286\nLoddenkemper Immobilien GmbH & Co. Kommanditgesellschaft – Güstrow",
      "type": "Löschungsankündigung",
      "state": "Mecklenburg-Vorpommern",
      "amtsgericht": "Amtsgericht Rostock",
      "registernummer": "HRA 2286",
      "registerart": "HRA",
      "company_name": "Loddenkemper Immobilien GmbH & Co. Kommanditgesellschaft",
      "company_seat": "Güstrow",
      "details": "15.05.2025 (Bekanntmachungsdatum)\n\nMecklenburg-Vorpommern Amtsgericht Rostock HRA 2286\nLöschungsankündigung\n\nLoddenkemper Immobilien GmbH & Co. Kommanditgesellschaft\nKommanditgesellschaft\nGüstrow\n\nDas Registergericht beabsichtigt, die im Handelsregister eingetragene Gesellschaft von Amts wegen nach § 394 FamFG zu löschen. Die Frist zur Erhebung eines Widerspruchs gegen die beabsichtigte Löschung wird auf einen Monat festgesetzt."
    },
    {
      "date": "2025-05-15",
      "id": "109203",
      "original_text": "Registerbekanntmachung nach dem Umwandlungsgesetz\nSchleswig-Holstein Amtsgericht Flensburg HRB 13402\nBreitschuh & Kock GmbH – Schleswig",
      "type": "Registerbekanntmachung nach dem Umwandlungsgesetz",
      "state": "Schleswig-Holstein",
      "amtsgericht": "Amtsgericht Flensburg",
      "registernummer": "HRB 13402",
      "registerart": "HRB",
      "company_name": "Breitschuh & Kock GmbH",
      "company_seat": "Schleswig",
      "details": "15.05.2025 (Bekanntmachungsdatum)\n\nSchleswig-Holstein Amtsgericht Flensburg HRB 13402\nRegisterbekanntmachung nach dem Umwandlungsgesetz 14.05.2025 (Eintragungsdatum)\n\nBreitschuh & Kock GmbH\nGesellschaft mit beschränkter Haftung\nSchleswig\n\nZu Eintragungsnummer 4 vom 14.05.2025 wird als nicht eingetragen veröffentlicht:\nDen Gläubigern der an der Verschmelzung beteiligten Rechtsträger ist, wenn sie binnen sechs Monaten nach dem Tag, an dem die Eintragung der Verschmelzung in das Register des Sitzes desjenigen Rechtsträgers, dessen Gläubiger sie sind, als bekannt gemacht gilt, ihren Anspruch nach Grund und Höhe in Textform anmelden, Sicherheit zu leisten, soweit sie nicht Befriedigung verlangen können. Dieses Recht steht den Gläubigern jedoch nur zu, wenn sie glaubhaft machen, dass durch die Verschmelzung die Erfüllung ihrer Forderung gefährdet wird."
    },
    {
      "date": "2025-05-15",
      "id": "109204",
      "original_text": "Löschungsankündigung\nBerlin Amtsgericht Berlin (Charlottenburg) HRB 200393\nWEGA Plan + Baukonzept GmbH – Berlin",
      "type": "Löschungsankündigung",
      "state": "Berlin",
      "amtsgericht": "Amtsgericht Berlin (Charlottenburg)",
      "registernummer": "HRB 200393",
      "registerart": "HRB",
      "company_name": "WEGA Plan + Baukonzept GmbH",
      "company_seat": "Berlin",
      "details": "15.05.2025 (Bekanntmachungsdatum)\n\nBerlin Amtsgericht Berlin (Charlottenburg) HRB 200393\nLöschungsankündigung\n\nWEGA Plan + Baukonzept GmbH\nGesellschaft mit beschränkter Haftung\nBerlin\n\nBei der nachstehenden Gesellschaft wird das Amtslöschungsverfahren gemäß § 394 FamFG eingeleitet. Widerspruchsfrist: 6 Wochen."
    },
    {
      "date": "2025-05-15",
      "id": "109205",
      "original_text": "Löschungsankündigung\nNiedersachsen Amtsgericht Lüneburg HRB 201373\nBrentear Teegesellschaft mbH – Winsen (Luhe)",
      "type": "Löschungsankündigung",
      "state": "Niedersachsen",
      "amtsgericht": "Amtsgericht Lüneburg",
      "registernummer": "HRB 201373",
      "registerart": "HRB",
      "company_name": "Brentear Teegesellschaft mbH",
      "company_seat": "Winsen (Luhe)",
      "details": "15.05.2025 (Bekanntmachungsdatum)\n\nNiedersachsen Amtsgericht Lüneburg HRB 201373\nLöschungsankündigung\n\nBrentear Teegesellschaft mbH\nGesellschaft mit beschränkter Haftung\nWinsen (Luhe)\n\nDas Registergericht beabsichtigt, vorstehende Gesellschaft von Amts wegen nach § 394 FamFG zu löschen. Die Frist zur Erhebung eines Widerspruchs ist auf 1 Monat ab Veröffentlichung festgesetzt."
    },
    {
      "date": "2025-05-15",
      "id": "109206",
      "original_text": "Einreichung neuer Dokumente\nNiedersachsen Amtsgericht Walsrode HRB 204374\nBorn-Ermel Ingenieure AG – Achim",
      "type": "Einreichung neuer Dokumente",
      "state": "Niedersachsen",
      "amtsgericht": "Amtsgericht Walsrode",
      "registernummer": "HRB 204374",
      "registerart": "HRB",
      "company_name": "Born-Ermel Ingenieure AG",
      "company_seat": "Achim",
      "details": "15.05.2025 (Bekanntmachungsdatum)\n\nNiedersachsen Amtsgericht Walsrode HRB 204374\nEinreichung neuer Dokumente\n\nBorn-Ermel Ingenieure AG\nAktiengesellschaft\nAchim\n\nDie Liste der Mitglieder des Aufsichtsrats wurde beim Registergericht eingereicht."
    },
    {
      "date": "2025-05-15",
      "id": "109207",
      "original_text": "Löschungsankündigung\nNiedersachsen Amtsgericht Hannover HRB 211027\nMotorbootschule Kölling UG (haftungsbeschränkt) – Hannover",
      "type": "Löschungsankündigung",
      "state": "Niedersachsen",
      "amtsgericht": "Amtsgericht Hannover",
      "registernummer": "HRB 211027",
      "registerart": "HRB",
      "company_name": "Motorbootschule Kölling UG (haftungsbeschränkt)",
      "company_seat": "Hannover",
      "details": "15.05.2025 (Bekanntmachungsdatum)\n\nNiedersachsen Amtsgericht Hannover HRB 211027\nLöschungsankündigung\n\nMotorbootschule Kölling UG (haftungsbeschränkt)\nGesellschaft mit beschränkter Haftung\nHannover\n\nDas Registergericht beabsichtigt, die Gesellschaft von Amts wegen nach § 394 FamFG zu löschen. Die Frist zur Erhebung eines Widerspruchs ist auf 1 Monat ab dieser Registerbekanntmachung festgesetzt."
    },
    {
      "date": "2025-05-15",
      "id": "109208",
      "original_text": "Einreichung neuer Dokumente\nNiedersachsen Amtsgericht Hannover HRB 3535\nNT NORDWESTDEUTSCHE TREUHAND Gesellschaft zur Betreuung von Wohnungsunternehmen mit beschränkter Haftung – Hannover",
      "type": "Einreichung neuer Dokumente",
      "state": "Niedersachsen",
      "amtsgericht": "Amtsgericht Hannover",
      "registernummer": "HRB 3535",
      "registerart": "HRB",
      "company_name": "NT NORDWESTDEUTSCHE TREUHAND Gesellschaft zur Betreuung von Wohnungsunternehmen mit beschränkter Haftung",
      "company_seat": "Hannover",
      "details": "15.05.2025 (Bekanntmachungsdatum)\n\nNiedersachsen Amtsgericht Hannover HRB 3535\nEinreichung neuer Dokumente\n\nNT NORDWESTDEUTSCHE TREUHAND Gesellschaft zur Betreuung von Wohnungsunternehmen mit beschränkter Haftung\nGesellschaft mit beschränkter Haftung\nHannover\n\nDie Liste der Mitglieder des Aufsichtsrats wurde beim Registergericht eingereicht."
    },
    {
      "date": "2025-05-15",
      "id": "109209",
      "original_text": "Löschungsankündigung\nNiedersachsen Amtsgericht Lüneburg HRA 203086\nSchlemminger UG (haftungsbeschränkt) & Co. KG – Winsen (Luhe)",
      "type": "Löschungsankündigung",
      "state": "Niedersachsen",
      "amtsgericht": "Amtsgericht Lüneburg",
      "registernummer": "HRA 203086",
      "registerart": "HRA",
      "company_name": "Schlemminger UG (haftungsbeschränkt) & Co. KG",
      "company_seat": "Winsen (Luhe)",
      "details": "15.05.2025 (Bekanntmachungsdatum)\n\nNiedersachsen Amtsgericht Lüneburg HRA 203086\nLöschungsankündigung\n\nSchlemminger UG (haftungsbeschränkt) & Co. KG\nKommanditgesellschaft\nWinsen (Luhe)\n\nDas Registergericht beabsichtigt, die Firma von Amts wegen nach § 394 FamFG zu löschen. Die Frist zur Erhebung eines Widerspruchs ist auf 1 Monat ab dieser Registerbekanntmachung festgesetzt."
    },
    {
      "date": "2025-05-15",
      "id": "109210",
      "original_text": "Registerbekanntmachung nach dem Umwandlungsgesetz\nNiedersachsen Amtsgericht Walsrode VR 140039\nDeutsches Rotes Kreuz Ortsverein Loccum – Loccum",
      "type": "Registerbekanntmachung nach dem Umwandlungsgesetz",
      "state": "Niedersachsen",
      "amtsgericht": "Amtsgericht Walsrode",
      "registernummer": "VR 140039",
      "registerart": "VR",
      "company_name": "Deutsches Rotes Kreuz Ortsverein Loccum",
      "company_seat": "Loccum",
      "details": "15.05.2025 (Bekanntmachungsdatum)\n\nNiedersachsen Amtsgericht Walsrode VR 140039\nRegisterbekanntmachung nach dem Umwandlungsgesetz 15.05.2025 (Eintragungsdatum)\n\nDeutsches Rotes Kreuz Ortsverein Loccum\neingetragener Verein\nLoccum\n\nDen Gläubigern der an der Verschmelzung beteiligten Rechtsträger ist, wenn sie binnen sechs Monaten nach dem Tag, an dem die Eintragung der Verschmelzung in das Register des Sitzes desjenigen Rechtsträgers, dessen Gläubiger sie sind, nach § 19  Abs.  3 UmwG als bekannt gemacht gilt, ihren Anspruch nach Grund und Höhe schriftlich anmelden, Sicherheit zu leisten, soweit sie nicht Befriedigung verlangen können. Dieses Recht steht den Gläubigern jedoch nur zu, wenn sie glaubhaft machen, dass durch die Verschmelzung die Erfüllung der Forderung gefährdet wird."
    },
    {
      "date": "2025-05-15",
      "id": "109211",
      "original_text": "Einreichung neuer Dokumente\nNiedersachsen Amtsgericht Hannover HRB 61743\nNT ImmoConsult Gesellschaft zur Beratung von Immobilienunternehmen mbH – Hannover",
      "type": "Einreichung neuer Dokumente",
      "state": "Niedersachsen",
      "amtsgericht": "Amtsgericht Hannover",
      "registernummer": "HRB 61743",
      "registerart": "HRB",
      "company_name": "NT ImmoConsult Gesellschaft zur Beratung von Immobilienunternehmen mbH",
      "company_seat": "Hannover",
      "details": "15.05.2025 (Bekanntmachungsdatum)\n\nNiedersachsen Amtsgericht Hannover HRB 61743\nEinreichung neuer Dokumente\n\nNT ImmoConsult Gesellschaft zur Beratung von Immobilienunternehmen mbH\nGesellschaft mit beschränkter Haftung\nHannover\n\nDie Liste der Mitglieder des Aufsichtsrats wurde beim Registergericht eingereicht."
    },
    {
      "date": "2025-05-15",
      "id": "109212",
      "original_text": "Sonstige Registerbekanntmachung\nNiedersachsen Amtsgericht Osnabrück HRB 203904\nVolkswagen Osnabrück GmbH – Osnabrück",
      "type": "Sonstige Registerbekanntmachung",
      "state": "Niedersachsen",
      "amtsgericht": "Amtsgericht Osnabrück",
      "registernummer": "HRB 203904",
      "registerart": "HRB",
      "company_name": "Volkswagen Osnabrück GmbH",
      "company_seat": "Osnabrück",
      "details": "15.05.2025 (Bekanntmachungsdatum)\n\nNiedersachsen Amtsgericht Osnabrück HRB 203904\nSonstige Registerbekanntmachung\n\nVolkswagen Osnabrück GmbH\nGesellschaft mit beschränkter Haftung\nOsnabrück\n\nDie Liste der Mitglieder des Aufsichtsrats wurde beim Registergericht eingereicht."
    },
    {
      "date": "2025-05-15",
      "id": "109213",
      "original_text": "Einreichung neuer Dokumente\nNiedersachsen Amtsgericht Osnabrück HRB 18988\nPublic Entertainment AG – Osnabrück",
      "type": "Einreichung neuer Dokumente",
      "state": "Niedersachsen",
      "amtsgericht": "Amtsgericht Osnabrück",
      "registernummer": "HRB 18988",
      "registerart": "HRB",
      "company_name": "Public Entertainment AG",
      "company_seat": "Osnabrück",
      "details": "15.05.2025 (Bekanntmachungsdatum)\n\nNiedersachsen Amtsgericht Osnabrück HRB 18988\nEinreichung neuer Dokumente\n\nPublic Entertainment AG\nAktiengesellschaft\nOsnabrück\n\nDie Liste der Mitglieder des Aufsichtsrats wurde beim Registergericht eingereicht."
    },
    {
      "date": "2025-05-15",
      "id": "109214",
      "original_text": "Löschungsankündigung\nNiedersachsen Amtsgericht Göttingen HRA 201977\nMBV Marketing GmbH & Co. KG – Rosdorf",
      "type": "Löschungsankündigung",
      "state": "Niedersachsen",
      "amtsgericht": "Amtsgericht Göttingen",
      "registernummer": "HRA 201977",
      "registerart": "HRA",
      "company_name": "MBV Marketing GmbH & Co. KG",
      "company_seat": "Rosdorf",
      "details": "15.05.2025 (Bekanntmachungsdatum)\n\nNiedersachsen Amtsgericht Göttingen HRA 201977\nLöschungsankündigung\n\nMBV Marketing GmbH & Co. KG\nKommanditgesellschaft\nRosdorf\n\nDas Registergericht beabsichtigt, die Firma von Amts wegen nach § 394 IV FamFG zu löschen. Die Frist zur Erhebung eines Widerspruchs ist auf 1 Monat ab dieser Registerbekanntmachung festgesetzt."
    },
    {
      "date": "2025-05-15",
      "id": "109215",
      "original_text": "Einreichung neuer Dokumente\nRheinland-Pfalz Amtsgericht Montabaur HRB 21435\nV8 Deutschland AG – Mogendorf",
      "type": "Einreichung neuer Dokumente",
      "state": "Rheinland-Pfalz",
      "amtsgericht": "Amtsgericht Montabaur",
      "registernummer": "HRB 21435",
      "registerart": "HRB",
      "company_name": "V8 Deutschland AG",
      "company_seat": "Mogendorf",
      "details": "15.05.2025 (Bekanntmachungsdatum)\n\nRheinland-Pfalz Amtsgericht Montabaur HRB 21435\nEinreichung neuer Dokumente 15.05.2025 (Eintragungsdatum)\n\nV8 Deutschland AG\nAktiengesellschaft\nMogendorf\n\nDem Registergericht ist eine neue Liste der Mitglieder des Aufsichtsrates eingereicht worden."
    },
    {
      "date": "2025-05-15",
      "id": "109216",
      "original_text": "Löschungsankündigung\nRheinland-Pfalz Amtsgericht Montabaur HRB 27966\nTalent Sale UG (haftungsbeschränkt) – Dierdorf",
      "type": "Löschungsankündigung",
      "state": "Rheinland-Pfalz",
      "amtsgericht": "Amtsgericht Montabaur",
      "registernummer": "HRB 27966",
      "registerart": "HRB",
      "company_name": "Talent Sale UG (haftungsbeschränkt)",
      "company_seat": "Dierdorf",
      "details": "15.05.2025 (Bekanntmachungsdatum)\n\nRheinland-Pfalz Amtsgericht Montabaur HRB 27966\nLöschungsankündigung\n\nTalent Sale UG (haftungsbeschränkt)\nGesellschaft mit beschränkter Haftung\nDierdorf\n\nDas Registergericht beabsichtigt die Gesellschaft von Amts wegen nach § 394 FamFG zu löschen. Die Frist zur Erhebung eines Widerspruchs ist auf 1 Monat festgesetzt."
    },
    {
      "date": "2025-05-15",
      "id": "109217",
      "original_text": "Löschungsankündigung\nRheinland-Pfalz Amtsgericht Zweibrücken HRB 31533\nGames plus in Zweibrücken GmbH – Zweibrücken",
      "type": "Löschungsankündigung",
      "state": "Rheinland-Pfalz",
      "amtsgericht": "Amtsgericht Zweibrücken",
      "registernummer": "HRB 31533",
      "registerart": "HRB",
      "company_name": "Games plus in Zweibrücken GmbH",
      "company_seat": "Zweibrücken",
      "details": "15.05.2025 (Bekanntmachungsdatum)\n\nRheinland-Pfalz Amtsgericht Zweibrücken HRB 31533\nLöschungsankündigung\n\nGames plus in Zweibrücken GmbH\nGesellschaft mit beschränkter Haftung\nZweibrücken\n\nDas Registergericht beabsichtigt die Gesellschaft von Amts wegen nach § 394 FamFG zu löschen. Die Frist zur Erhebung eines Widerspruchs ist auf einen Monat festgesetzt."
    },
    {
      "date": "2025-05-15",
      "id": "109218",
      "original_text": "Registerbekanntmachung nach dem Umwandlungsgesetz\nBremen Amtsgericht Bremen HRA 21913\nswb Erzeugung AG & Co. KG – Bremen",
      "type": "Registerbekanntmachung nach dem Umwandlungsgesetz",
      "state": "Bremen",
      "amtsgericht": "Amtsgericht Bremen",
      "registernummer": "HRA 21913",
      "registerart": "HRA",
      "company_name": "swb Erzeugung AG & Co. KG",
      "company_seat": "Bremen",
      "details": "15.05.2025 (Bekanntmachungsdatum)\n\nBremen Amtsgericht Bremen HRA 21913\nRegisterbekanntmachung nach dem Umwandlungsgesetz 13.05.2025 (Eintragungsdatum)\n\nswb Erzeugung AG & Co. KG\nKommanditgesellschaft\nBremen\n\nZu Eintragungsnummer 19 vom 13.05.2025 wird als nicht eingetragen veröffentlicht: Den Gläubigern der an der Verschmelzung beteiligten Rechtsträger ist, wenn sie binnen sechs Monaten nach dem Tag, an dem die Eintragung der Verschmelzung in das Register des Sitzes desjenigen Rechtsträgers, dessen Gläubiger sie sind, als bekannt gemacht gilt, ihren Anspruch nach Grund und Höhe schriftlich anmelden, Sicherheit zu leisten, soweit sie nicht Befriedigung verlangen können. Dieses Recht steht den Gläubigern jedoch nur zu, wenn sie glaubhaft machen, dass durch die Verschmelzung die Erfüllung ihrer Forderung gefährdet wird. Das Recht, Sicherheitsleistung zu verlangen, steht Gläubigern nicht zu, die im Falle der Insolvenz ein Recht auf vorzugsweise Befriedigung aus einer Deckungsmasse haben, die nach gesetzlicher Vorschrift zu ihrem Schutz errichtet und staatlich überwacht ist."
    },
    {
      "date": "2025-05-15",
      "id": "109219",
      "original_text": "Registerbekanntmachung nach dem Umwandlungsgesetz\nBremen Amtsgericht Bremen HRA 23294\nswb Services AG & Co. KG – Bremen",
      "type": "Registerbekanntmachung nach dem Umwandlungsgesetz",
      "state": "Bremen",
      "amtsgericht": "Amtsgericht Bremen",
      "registernummer": "HRA 23294",
      "registerart": "HRA",
      "company_name": "swb Services AG & Co. KG",
      "company_seat": "Bremen",
      "details": "15.05.2025 (Bekanntmachungsdatum)\n\nBremen Amtsgericht Bremen HRA 23294\nRegisterbekanntmachung nach dem Umwandlungsgesetz 13.05.2025 (Eintragungsdatum)\n\nswb Services AG & Co. KG\nKommanditgesellschaft\nBremen\n\nZu Eintragungsnummer 21 vom 13.05.2025 wird als nicht eingetragen veröffentlicht: Den Gläubigern der an der Verschmelzung beteiligten Rechtsträger ist, wenn sie binnen sechs Monaten nach dem Tag, an dem die Eintragung der Verschmelzung in das Register des Sitzes desjenigen Rechtsträgers, dessen Gläubiger sie sind, als bekannt gemacht gilt, ihren Anspruch nach Grund und Höhe schriftlich anmelden, Sicherheit zu leisten, soweit sie nicht Befriedigung verlangen können. Dieses Recht steht den Gläubigern jedoch nur zu, wenn sie glaubhaft machen, dass durch die Verschmelzung die Erfüllung ihrer Forderung gefährdet wird. Das Recht, Sicherheitsleistung zu verlangen, steht Gläubigern nicht zu, die im Falle der Insolvenz ein Recht auf vorzugsweise Befriedigung aus einer Deckungsmasse haben, die nach gesetzlicher Vorschrift zu ihrem Schutz errichtet und staatlich überwacht ist."
    },
    {
      "date": "2025-05-15",
      "id": "109220",
      "original_text": "Registerbekanntmachung nach dem Umwandlungsgesetz\nBremen Amtsgericht Bremen HRB 31687\nswb Erzeugung GmbH – Bremen",
      "type": "Registerbekanntmachung nach dem Umwandlungsgesetz",
      "state": "Bremen",
      "amtsgericht": "Amtsgericht Bremen",
      "registernummer": "HRB 31687",
      "registerart": "HRB",
      "company_name": "swb Erzeugung GmbH",
      "company_seat": "Bremen",
      "details": "15.05.2025 (Bekanntmachungsdatum)\n\nBremen Amtsgericht Bremen HRB 31687\nRegisterbekanntmachung nach dem Umwandlungsgesetz 13.05.2025 (Eintragungsdatum)\n\nswb Erzeugung GmbH\nGesellschaft mit beschränkter Haftung\nBremen\n\nZu Eintragungsnummer 9 vom 13.05.2025 wird als nicht eingetragen veröffentlicht: Den Gläubigern der an der Verschmelzung beteiligten Rechtsträger ist, wenn sie binnen sechs Monaten nach dem Tag, an dem die Eintragung der Verschmelzung in das Register des Sitzes desjenigen Rechtsträgers, dessen Gläubiger sie sind, als bekannt gemacht gilt, ihren Anspruch nach Grund und Höhe schriftlich anmelden, Sicherheit zu leisten, soweit sie nicht Befriedigung verlangen können. Dieses Recht steht den Gläubigern jedoch nur zu, wenn sie glaubhaft machen, dass durch die Verschmelzung die Erfüllung ihrer Forderung gefährdet wird. Das Recht, Sicherheitsleistung zu verlangen, steht Gläubigern nicht zu, die im Falle der Insolvenz ein Recht auf vorzugsweise Befriedigung aus einer Deckungsmasse haben, die nach gesetzlicher Vorschrift zu ihrem Schutz errichtet und staatlich überwacht ist."
    },
    {
      "date": "2025-05-15",
      "id": "109221",
      "original_text": "Registerbekanntmachung nach dem Umwandlungsgesetz\nBremen Amtsgericht Bremen HRB 40125\nteam neusta Aktiengesellschaft – Bremen",
      "type": "Registerbekanntmachung nach dem Umwandlungsgesetz",
      "state": "Bremen",
      "amtsgericht": "Amtsgericht Bremen",
      "registernummer": "HRB 40125",
      "registerart": "HRB",
      "company_name": "team neusta Aktiengesellschaft",
      "company_seat": "Bremen",
      "details": "15.05.2025 (Bekanntmachungsdatum)\n\nBremen Amtsgericht Bremen HRB 40125\nRegisterbekanntmachung nach dem Umwandlungsgesetz 15.05.2025 (Eintragungsdatum)\n\nteam neusta Aktiengesellschaft\nAktiengesellschaft\nBremen\n\nZu Eintragungsnummer 4 vom 15.05.2025 wird als nicht eingetragen veröffentlicht: Den Gläubigern der an der Verschmelzung beteiligten Rechtsträger ist, wenn sie binnen sechs Monaten nach dem Tag, an dem die Eintragung der Verschmelzung in das Register des Sitzes desjenigen Rechtsträgers, dessen Gläubiger sie sind, als bekannt gemacht gilt, ihren Anspruch nach Grund und Höhe schriftlich anmelden, Sicherheit zu leisten, soweit sie nicht Befriedigung verlangen können. Dieses Recht steht den Gläubigern jedoch nur zu, wenn sie glaubhaft machen, dass durch die Verschmelzung die Erfüllung ihrer Forderung gefährdet wird. Das Recht, Sicherheitsleistung zu verlangen, steht Gläubigern nicht zu, die im Falle der Insolvenz ein Recht auf vorzugsweise Befriedigung aus einer Deckungsmasse haben, die nach gesetzlicher Vorschrift zu ihrem Schutz errichtet und staatlich überwacht ist."
    },
    {
      "date": "2025-05-15",
      "id": "109222",
      "original_text": "Registerbekanntmachung nach dem Umwandlungsgesetz\nBremen Amtsgericht Bremen HRB 41480\nteam neusta SE – Bremen",
      "type": "Registerbekanntmachung nach dem Umwandlungsgesetz",
      "state": "Bremen",
      "amtsgericht": "Amtsgericht Bremen",
      "registernummer": "HRB 41480",
      "registerart": "HRB",
      "company_name": "team neusta SE",
      "company_seat": "Bremen",
      "details": "15.05.2025 (Bekanntmachungsdatum)\n\nBremen Amtsgericht Bremen HRB 41480\nRegisterbekanntmachung nach dem Umwandlungsgesetz 15.05.2025 (Eintragungsdatum)\n\nteam neusta SE\nEuropäische Aktiengesellschaft (SE)\nBremen\n\nZu Eintragungsnummer 1 vom 15.05.2025 wird als nicht eingetragen veröffentlicht: Den Gläubigern der an der Verschmelzung beteiligten Rechtsträger ist, wenn sie binnen sechs Monaten nach dem Tag, an dem die Eintragung der Verschmelzung in das Register des Sitzes desjenigen Rechtsträgers, dessen Gläubiger sie sind, als bekannt gemacht gilt, ihren Anspruch nach Grund und Höhe schriftlich anmelden, Sicherheit zu leisten, soweit sie nicht Befriedigung verlangen können. Dieses Recht steht den Gläubigern jedoch nur zu, wenn sie glaubhaft machen, dass durch die Verschmelzung die Erfüllung ihrer Forderung gefährdet wird. Das Recht, Sicherheitsleistung zu verlangen, steht Gläubigern nicht zu, die im Falle der Insolvenz ein Recht auf vorzugsweise Befriedigung aus einer Deckungsmasse haben, die nach gesetzlicher Vorschrift zu ihrem Schutz errichtet und staatlich überwacht ist."
    },
    {
      "date": "2025-05-15",
      "id": "109223",
      "original_text": "Löschungsankündigung\nNordrhein-Westfalen Amtsgericht Köln HRB 84819\nR & D Logistik GmbH – Köln",
      "type": "Löschungsankündigung",
      "state": "Nordrhein-Westfalen",
      "amtsgericht": "Amtsgericht Köln",
      "registernummer": "HRB 84819",
      "registerart": "HRB",
      "company_name": "R & D Logistik GmbH",
      "company_seat": "Köln",
      "details": "15.05.2025 (Bekanntmachungsdatum)\n\nNordrhein-Westfalen Amtsgericht Köln HRB 84819\nLöschungsankündigung\n\nR & D Logistik GmbH\nGesellschaft mit beschränkter Haftung\nKöln\n\nDas Registergericht beabsichtigt die Gesellschaft von Amts wegen nach § 394 FamFG zu löschen. Die Frist zur Erhebung eines Widerspruchs ist auf einen Monat festgesetzt."
    },
    {
      "date": "2025-05-15",
      "id": "109224",
      "original_text": "Einreichung neuer Dokumente\nNordrhein-Westfalen Amtsgericht Bonn HRB 12232\nPrinz von Preußen Grundbesitz AG – Bonn",
      "type": "Einreichung neuer Dokumente",
      "state": "Nordrhein-Westfalen",
      "amtsgericht": "Amtsgericht Bonn",
      "registernummer": "HRB 12232",
      "registerart": "HRB",
      "company_name": "Prinz von Preußen Grundbesitz AG",
      "company_seat": "Bonn",
      "details": "15.05.2025 (Bekanntmachungsdatum)\n\nNordrhein-Westfalen Amtsgericht Bonn HRB 12232\nEinreichung neuer Dokumente\n\nPrinz von Preußen Grundbesitz AG\nAktiengesellschaft\nBonn\n\nDem Registergericht ist eine neue Liste der Mitglieder des Aufsichtsrates eingereicht worden."
    },
    {
      "date": "2025-05-15",
      "id": "109225",
      "original_text": "Registerbekanntmachung nach dem Umwandlungsgesetz\nNordrhein-Westfalen Amtsgericht Bonn HRB 25667\nKopfKörperSchule GmbH – Bonn",
      "type": "Registerbekanntmachung nach dem Umwandlungsgesetz",
      "state": "Nordrhein-Westfalen",
      "amtsgericht": "Amtsgericht Bonn",
      "registernummer": "HRB 25667",
      "registerart": "HRB",
      "company_name": "KopfKörperSchule GmbH",
      "company_seat": "Bonn",
      "details": "15.05.2025 (Bekanntmachungsdatum)\n\nNordrhein-Westfalen Amtsgericht Bonn HRB 25667\nRegisterbekanntmachung nach dem Umwandlungsgesetz 15.05.2025 (Eintragungsdatum)\n\nKopfKörperSchule GmbH\nGesellschaft mit beschränkter Haftung\nBonn\n\nDen Gläubigern der an der Verschmelzung beteiligten Rechtsträger ist, wenn sie binnen sechs Monaten nach dem Tag, an dem die Eintragung der Verschmelzung in das Register des Sitzes derjenigen Rechtsträger deren Gläubiger sie sind, nach § 19 Absatz 3 UmwG als bekanntgemacht gilt, ihren Anspruch nach Grund und Höhe schriftlich anmelden, Sicherheit zu leisten, soweit sie nicht Befriedigung verlangen können. Dieses Recht steht den Gläubigern jedoch nur zu, wenn sie glaubhaft machen, dass durch die Verschmelzung die Erfüllung ihrer Forderung gefährdet wird."
    },
    {
      "date": "2025-05-15",
      "id": "109226",
      "original_text": "Löschungsankündigung\nNordrhein-Westfalen Amtsgericht Köln HRB 99426\nconcept plus GmbH – Köln",
      "type": "Löschungsankündigung",
      "state": "Nordrhein-Westfalen",
      "amtsgericht": "Amtsgericht Köln",
      "registernummer": "HRB 99426",
      "registerart": "HRB",
      "company_name": "concept plus GmbH",
      "company_seat": "Köln",
      "details": "15.05.2025 (Bekanntmachungsdatum)\n\nNordrhein-Westfalen Amtsgericht Köln HRB 99426\nLöschungsankündigung\n\nconcept plus GmbH\nGesellschaft mit beschränkter Haftung\nKöln\n\nDas Registergericht beabsichtigt die Gesellschaft von Amts wegen nach § 394 FamFG zu löschen. Die Frist zur Erhebung eines Widerspruchs ist auf einen Monat festgesetzt."
    },
    {
      "date": "2025-05-15",
      "id": "109227",
      "original_text": "Sonstige Registerbekanntmachung\nNordrhein-Westfalen Amtsgericht Steinfurt GnR 210\nSAMA SCE mit beschränkter Haftung – Greven",
      "type": "Sonstige Registerbekanntmachung",
      "state": "Nordrhein-Westfalen",
      "amtsgericht": "Amtsgericht Steinfurt",
      "registernummer": "GnR 210",
      "registerart": "GnR",
      "company_name": "SAMA SCE mit beschränkter Haftung",
      "company_seat": "Greven",
      "details": "15.05.2025 (Bekanntmachungsdatum)\n\nNordrhein-Westfalen Amtsgericht Steinfurt GnR 210\nSonstige Registerbekanntmachung 15.05.2025 (Eintragungsdatum)\n\nSAMA SCE mit beschränkter Haftung\nEuropäische Genossenschaft (SCE)\nGreven\n\nGnR  210\n\nEUROPÄISCHE UNION\nVeröffentlichung des Supplements zum Amtsblatt der Europäischen Union\n2, rue Mercier, 2985 Luxembourg, Luxemburg - E-Mail: ojs-coord@publications.europa.eu\nInfos und Online-Formulare: http://simap.ted.europa.eu - Fax: +352 29 29 42 670\n\nDiese Bekanntmachung betrifft\nEUROPÄISCHE GESELLSCHAFT\nVerordnung (EG) Nr. 2157/2001 des Rates vom 8. Oktober 2001 über das Statut der Europäischen Gesellschaft (SE) (ABl. L 294, 10.11.2001, S. 1)\n\nX\tEUROPÄISCHE GENOSSENSCHAFT\nVerordnung (EG) Nr. 1435/2003 des Rates vom 22. Juli 2003 über das Statut der Europäischen\nGenossenschaft (SCE) (ABl. L 207, 18.8.2003, S. 1\n\nDiese Bekanntmachung enthält Informationen betreffend\nX\tEintragung\nLöschen\nEintragung der Verlegung\nLöschung der Verlegung\n\n(Bitte machen Sie die nötigen Angaben gemäß Artikel 14 der Verordnung ((EG) Nr. 2157/2001 oder Artikel 13 Verordnung (EG) Nr. 1435/2003.)\n\nName, Adressen und Kontaktstelle(n)\nEingetragener Name:\nSAMA SCE mit beschränkter Haftung\nEingetragene Geschäftsstelle\nPostanschrift:\nMarktstraße 45\nOrt:\nGreven\nPostleitzahl:\n48268\nLand:\nDeutschland (DE)\n\nKontaktstelle(n)\nZu Händen von:\n\nTelefon:\n\nFax:\n\nE-Mail:\n\nInternet-Adresse(n)\nHauptadresse der Gesellschaft (URL):\n\nEintragung\nDatum der Eintragung:\n15.05.2025\nEintragungsnummer:\nGnR  210\n\nOrt der Eintragung\nOrt:\nSteinfurt\nPostleitzahl:\n48565\nLand:\nDeutschland (DE)\n\nName und Adresse der eintragenden Behörde\nOffizielle Bezeichnung:\nAmtsgericht Steinfurt - Registergericht -\nPostanschrift:\nGerichtstraße 2\nOrt:\nSteinfurt\nPostleitzahl:\n48565\nLand:\nDeutschland (DE)\n\nVeröffentlichung in dem Mitgliedsstaat, in dem die Gesellschaft eingetragen ist\nTag:\n15.05.2025\nVollständiger Titel der Veröffentlichung:\nJustizportal des Bundes und der Länder\nInternet-Adresse(n):\nwww.handelsregisterbekanntmachungen.de\nName und Adresse des Herausgebers\nOffizielle Bezeichnung:\nLand Nordrhein-Westfalen vertreten durch das Ministerium der Justiz\nPostanschrift:\nMartin-Luther-Platz 40\nOrt:\nDüsseldorf\nPostleitzahl:\n40212\nLand:\nDeutschland (DE)\n\nHaupttätigkeit(en)\n\nAllgemeine öffentliche Verwaltung\t \tStrom\n\nVerteidigung\t \tAufsuchung und Gewinnung von Gas und Erdöl\n\nÖffentliche Sicherheit und Ordnung\t \tAufsuchung und Gewinnung von Kohle und\nanderen festen Brennstoffen\n\nUmwelt\t \tWasser\n\nWirtschaft und Finanzen\t \tPostdienste\n\nGesundheit\t \tEisenbahndienste\n\nWohnungswesen und kommunale Einrichtungen\t \tStädtische Eisenbahn-, Straßenbahn-, Oberleitungsbus- oder Busdienste\n\nSozialwesen\t \tHafeneinrichtungen\n\nFreizeit, Kultur und Religion\t \tFlughafenanlagen\n\nBildung\tX\tSonstiges (bitte angeben)\n\nErzeugung, Fortleitung und Abgabe von Gas und Wärme\t\tenergetische und informelle Potentialaufwertung, Dienstleistungen zur Epistemologie\n\nZusätzliche Angabe(n)\n\nTag der Absendung dieser Bekanntmachung:\n15.05.2025"
    },
    {
      "date": "2025-05-15",
      "id": "109228",
      "original_text": "Registerbekanntmachung nach dem Umwandlungsgesetz\nNordrhein-Westfalen Amtsgericht Düsseldorf HRA 24851\nAIRE Akazie Berlin Beteiligungs GmbH & Co. KG – Monheim am Rhein",
      "type": "Registerbekanntmachung nach dem Umwandlungsgesetz",
      "state": "Nordrhein-Westfalen",
      "amtsgericht": "Amtsgericht Düsseldorf",
      "registernummer": "HRA 24851",
      "registerart": "HRA",
      "company_name": "AIRE Akazie Berlin Beteiligungs GmbH & Co. KG",
      "company_seat": "Monheim am Rhein",
      "details": "15.05.2025 (Bekanntmachungsdatum)\n\nNordrhein-Westfalen Amtsgericht Düsseldorf HRA 24851\nRegisterbekanntmachung nach dem Umwandlungsgesetz 15.05.2025 (Eintragungsdatum)\n\nAIRE Akazie Berlin Beteiligungs GmbH & Co. KG\nKommanditgesellschaft\nMonheim am Rhein\n\nDen Gläubigern der an der Verschmelzung beteiligten Rechtsträger ist, wenn sie binnen sechs Monaten nach dem Tag, an dem die Eintragung der Verschmelzung in das Register des Sitzes derjenigen Rechtsträger deren Gläubiger sie sind, nach § 19 Absatz 3 UmwG als bekanntgemacht gilt, ihren Anspruch nach Grund und Höhe schriftlich anmelden, Sicherheit zu leisten, soweit sie nicht Befriedigung verlangen können. Dieses Recht steht den Gläubigern jedoch nur zu, wenn sie glaubhaft machen, dass durch die Verschmelzung die Erfüllung ihrer Forderung gefährdet wird."
    },
    {
      "date": "2025-05-15",
      "id": "109229",
      "original_text": "Löschungsankündigung\nNordrhein-Westfalen Amtsgericht Recklinghausen HRB 8286\nSanierungsteam Sawosz UG (haftungsbeschränkt) – Recklinghausen",
      "type": "Löschungsankündigung",
      "state": "Nordrhein-Westfalen",
      "amtsgericht": "Amtsgericht Recklinghausen",
      "registernummer": "HRB 8286",
      "registerart": "HRB",
      "company_name": "Sanierungsteam Sawosz UG (haftungsbeschränkt)",
      "company_seat": "Recklinghausen",
      "details": "15.05.2025 (Bekanntmachungsdatum)\n\nNordrhein-Westfalen Amtsgericht Recklinghausen HRB 8286\nLöschungsankündigung\n\nSanierungsteam Sawosz UG (haftungsbeschränkt)\nGesellschaft mit beschränkter Haftung\nRecklinghausen\n\nDas Registergericht beabsichtigt die Gesellschaft von Amts wegen nach § 394 FamFG zu löschen. Die Frist zur Erhebung eines Widerspruchs ist auf zwei Monate festgesetzt."
    },
    {
      "date": "2025-05-15",
      "id": "109230",
      "original_text": "Registerbekanntmachung nach dem Umwandlungsgesetz\nNordrhein-Westfalen Amtsgericht Bonn HRB 26806\nKopfKörperSchule Bonn GmbH – Bonn",
      "type": "Registerbekanntmachung nach dem Umwandlungsgesetz",
      "state": "Nordrhein-Westfalen",
      "amtsgericht": "Amtsgericht Bonn",
      "registernummer": "HRB 26806",
      "registerart": "HRB",
      "company_name": "KopfKörperSchule Bonn GmbH",
      "company_seat": "Bonn",
      "details": "15.05.2025 (Bekanntmachungsdatum)\n\nNordrhein-Westfalen Amtsgericht Bonn HRB 26806\nRegisterbekanntmachung nach dem Umwandlungsgesetz 15.05.2025 (Eintragungsdatum)\n\nKopfKörperSchule Bonn GmbH\nGesellschaft mit beschränkter Haftung\nBonn\n\nDen Gläubigern der an der Verschmelzung beteiligten Rechtsträger ist, wenn sie binnen sechs Monaten nach dem Tag, an dem die Eintragung der Verschmelzung in das Register des Sitzes desjenigen Rechtsträgers, dessen Gläubiger sie sind, nach § 19 Absatz 3 UmwG als bekanntgemacht gilt, ihren Anspruch nach Grund und Höhe schriftlich anmelden, Sicherheit zu leisten, soweit sie nicht Befriedigung verlangen können. Dieses Recht steht den Gläubigern jedoch nur zu, wenn sie glaubhaft machen, dass durch die Verschmelzung die Erfüllung ihrer Forderung gefährdet wird."
    },
    {
      "date": "2025-05-15",
      "id": "109231",
      "original_text": "Löschungsankündigung\nNordrhein-Westfalen Amtsgericht Krefeld HRB 14663\nDesk Trade UG (haftungsbeschränkt) – Krefeld",
      "type": "Löschungsankündigung",
      "state": "Nordrhein-Westfalen",
      "amtsgericht": "Amtsgericht Krefeld",
      "registernummer": "HRB 14663",
      "registerart": "HRB",
      "company_name": "Desk Trade UG (haftungsbeschränkt)",
      "company_seat": "Krefeld",
      "details": "15.05.2025 (Bekanntmachungsdatum)\n\nNordrhein-Westfalen Amtsgericht Krefeld HRB 14663\nLöschungsankündigung\n\nDesk Trade UG (haftungsbeschränkt)\nGesellschaft mit beschränkter Haftung\nKrefeld\n\nDas Registergericht beabsichtigt die Gesellschaft von Amts wegen nach § 394 FamFG zu löschen. Die Frist zur Erhebung eines Widerspruchs ist auf einen Monat festgesetzt."
    },
    {
      "date": "2025-05-15",
      "id": "109232",
      "original_text": "Registerbekanntmachung nach dem Umwandlungsgesetz\nNordrhein-Westfalen Amtsgericht Bonn HRB 25667\nKopfKörperSchule GmbH – Bonn",
      "type": "Registerbekanntmachung nach dem Umwandlungsgesetz",
      "state": "Nordrhein-Westfalen",
      "amtsgericht": "Amtsgericht Bonn",
      "registernummer": "HRB 25667",
      "registerart": "HRB",
      "company_name": "KopfKörperSchule GmbH",
      "company_seat": "Bonn",
      "details": "15.05.2025 (Bekanntmachungsdatum)\n\nNordrhein-Westfalen Amtsgericht Bonn HRB 25667\nRegisterbekanntmachung nach dem Umwandlungsgesetz 15.05.2025 (Eintragungsdatum)\n\nKopfKörperSchule GmbH\nGesellschaft mit beschränkter Haftung\nBonn\n\nDen Gläubigern der an der Verschmelzung beteiligten Rechtsträger ist, wenn sie binnen sechs Monaten nach dem Tag, an dem die Eintragung der Verschmelzung in das Register des Sitzes derjenigen Rechtsträger deren Gläubiger sie sind, nach § 19 Absatz 3 UmwG als bekanntgemacht gilt, ihren Anspruch nach Grund und Höhe schriftlich anmelden, Sicherheit zu leisten, soweit sie nicht Befriedigung verlangen können. Dieses Recht steht den Gläubigern jedoch nur zu, wenn sie glaubhaft machen, dass durch die Verschmelzung die Erfüllung ihrer Forderung gefährdet wird."
    },
    {
      "date": "2025-05-15",
      "id": "109233",
      "original_text": "Sonstige Registerbekanntmachung\nNordrhein-Westfalen Amtsgericht Bonn HRB 29764\ndai data analytics institute AG – Bonn",
      "type": "Sonstige Registerbekanntmachung",
      "state": "Nordrhein-Westfalen",
      "amtsgericht": "Amtsgericht Bonn",
      "registernummer": "HRB 29764",
      "registerart": "HRB",
      "company_name": "dai data analytics institute AG",
      "company_seat": "Bonn",
      "details": "15.05.2025 (Bekanntmachungsdatum)\n\nNordrhein-Westfalen Amtsgericht Bonn HRB 29764\nSonstige Registerbekanntmachung 15.05.2025 (Eintragungsdatum)\n\ndai data analytics institute AG\nAktiengesellschaft\nBonn\n\nDem Registergericht ist eine Liste der Mitglieder des Aufsichtsrates eingereicht worden."
    },
    {
      "date": "2025-05-15",
      "id": "109234",
      "original_text": "Löschungsankündigung\nNordrhein-Westfalen Amtsgericht Düsseldorf HRB 95194\nAUTOLAIS UG (haftungsbeschränkt) – Düsseldorf",
      "type": "Löschungsankündigung",
      "state": "Nordrhein-Westfalen",
      "amtsgericht": "Amtsgericht Düsseldorf",
      "registernummer": "HRB 95194",
      "registerart": "HRB",
      "company_name": "AUTOLAIS UG (haftungsbeschränkt)",
      "company_seat": "Düsseldorf",
      "details": "15.05.2025 (Bekanntmachungsdatum)\n\nNordrhein-Westfalen Amtsgericht Düsseldorf HRB 95194\nLöschungsankündigung\n\nAUTOLAIS UG (haftungsbeschränkt)\nGesellschaft mit beschränkter Haftung\nDüsseldorf\n\nDas Registergericht beabsichtigt die Gesellschaft von Amts wegen nach § 394 FamFG zu löschen. Die Frist zur Erhebung eines Widerspruchs ist auf 3 Wochen festgesetzt.\n\nRechtsbehelfsbelehrung:\nDas Widerspruchsrecht steht jedem zu, der an der Unterlassung der Löschung ein berechtigtes Interesse hat. Der Widerspruch ist bei dem Amtsgericht Düsseldorf -Registergericht-, Werdener Straße 1, 40227 Düsseldorf schriftlich in deutscher Sprache oder zur Niederschrift der Geschäftsstelle einzulegen. Der Widerspruch kann auch zur Niederschrift der Geschäftsstelle eines jeden Amtsgerichtes abgegeben werden. Die Einlegung ist auch durch Übertragung eines elektronischen Dokuments an die elektronische Poststelle des Gerichts möglich. Das elektronische Dokument muss für die Bearbeitung durch das Gericht geeignet und mit einer qualifizierten elektronischen Signatur der verantwortenden Person versehen sein oder von der verantwortenden Person signiert und auf einem sicheren Übermittlungsweg gemäß § 130a ZPO nach näherer Maßgabe der Verordnung über die technischen Rahmenbedingungen des elektronischen Rechtsverkehrs und über das besondere elektronische Behördenpostfach (BGBl. I, S.3803) eingereicht werden. Weitere Informationen erhalten Sie auf der Internetseite www.justiz.de.\nDer Widerspruch muss spätestens innerhalb der gesetzten Frist nach dem Datum der Bekanntmachung der Löschungsankündigung bei dem Amtsgericht - Registergericht - Düsseldorf eingegangen sein.  Dies gilt auch dann, wenn der Widerspruch zur Niederschrift der Geschäftsstelle eines anderen Amtsgerichtes abgegeben wurde. Die Frist beginnt mit dem Tage der Bekanntmachung der Löschungsankündigung in dem für die Bekanntmachung der Eintragungen in das Handelsregister bestimmten elektronischen Informations- und Kommunikationssystem nach § 10 des Handelsgesetzbuches. Fällt das Ende der Frist auf einen Sonntag, einen allgemeinen Feiertag oder Sonnabend, so endet die Frist mit Ablauf des nächsten Werktages.\nDer Widerspruch muss die Bezeichnung der angefochtenen Löschungsankündigung sowie die Erklärung enthalten, dass Widerspruch gegen diese Löschungsankündigung eingelegt wird. Er ist zu unterzeichnen und soll begründet werden."
    },
    {
      "date": "2025-05-15",
      "id": "109235",
      "original_text": "Einreichung neuer Dokumente\nNordrhein-Westfalen Amtsgericht Köln HRB 226\nFlughafen Köln/Bonn Gesellschaft mit beschränkter Haftung – Köln",
      "type": "Einreichung neuer Dokumente",
      "state": "Nordrhein-Westfalen",
      "amtsgericht": "Amtsgericht Köln",
      "registernummer": "HRB 226",
      "registerart": "HRB",
      "company_name": "Flughafen Köln/Bonn Gesellschaft mit beschränkter Haftung",
      "company_seat": "Köln",
      "details": "15.05.2025 (Bekanntmachungsdatum)\n\nNordrhein-Westfalen Amtsgericht Köln HRB 226\nEinreichung neuer Dokumente\n\nFlughafen Köln/Bonn Gesellschaft mit beschränkter Haftung\nGesellschaft mit beschränkter Haftung\nKöln\n\nDem Registergericht ist eine Liste der Mitglieder des Aufsichtsrates eingereicht worden."
    },
    {
      "date": "2025-05-15",
      "id": "109236",
      "original_text": "Löschungsankündigung\nNordrhein-Westfalen Amtsgericht Dortmund HRB 26813\nKayser Haushaltsgeräte GmbH – Dortmund",
      "type": "Löschungsankündigung",
      "state": "Nordrhein-Westfalen",
      "amtsgericht": "Amtsgericht Dortmund",
      "registernummer": "HRB 26813",
      "registerart": "HRB",
      "company_name": "Kayser Haushaltsgeräte GmbH",
      "company_seat": "Dortmund",
      "details": "15.05.2025 (Bekanntmachungsdatum)\n\nNordrhein-Westfalen Amtsgericht Dortmund HRB 26813\nLöschungsankündigung\n\nKayser Haushaltsgeräte GmbH\nGesellschaft mit beschränkter Haftung\nDortmund\n\nDas Registergericht beabsichtigt die Gesellschaft von Amts wegen nach § 394 FamFG zu löschen. Die Frist zur Erhebung eines Widerspruchs ist auf zwei Monate festgesetzt."
    },
    {
      "date": "2025-05-15",
      "id": "109237",
      "original_text": "Registerbekanntmachung nach dem Umwandlungsgesetz\nNordrhein-Westfalen Amtsgericht Mönchengladbach HRB 20169\nSoul Handels UG (haftungsbeschränkt) – Mönchengladbach",
      "type": "Registerbekanntmachung nach dem Umwandlungsgesetz",
      "state": "Nordrhein-Westfalen",
      "amtsgericht": "Amtsgericht Mönchengladbach",
      "registernummer": "HRB 20169",
      "registerart": "HRB",
      "company_name": "Soul Handels UG (haftungsbeschränkt)",
      "company_seat": "Mönchengladbach",
      "details": "15.05.2025 (Bekanntmachungsdatum)\n\nNordrhein-Westfalen Amtsgericht Mönchengladbach HRB 20169\nRegisterbekanntmachung nach dem Umwandlungsgesetz 15.05.2025 (Eintragungsdatum)\n\nSoul Handels UG (haftungsbeschränkt)\nGesellschaft mit beschränkter Haftung\nMönchengladbach\n\nDen Gläubigern der an der Verschmelzung beteiligten Rechtsträger ist, wenn sie binnen sechs Monaten nach dem Tag, an dem die Eintragung der Verschmelzung in das Register des Sitzes desjenigen Rechtsträgers, dessen Gläubiger sie sind, nach § 19 Absatz 3 UmwG als bekanntgemacht gilt, ihren Anspruch nach Grund und Höhe schriftlich anmelden, Sicherheit zu leisten, soweit sie nicht Befriedigung verlangen können. Dieses Recht steht den Gläubigern jedoch nur zu, wenn sie glaubhaft machen, dass durch die Verschmelzung die Erfüllung ihrer Forderung gefährdet wird."
    },
    {
      "date": "2025-05-15",
      "id": "109238",
      "original_text": "Registerbekanntmachung nach dem Umwandlungsgesetz\nNordrhein-Westfalen Amtsgericht Dortmund HRB 2391\nDortmunder Stadtwerke Aktiengesellschaft – Dortmund",
      "type": "Registerbekanntmachung nach dem Umwandlungsgesetz",
      "state": "Nordrhein-Westfalen",
      "amtsgericht": "Amtsgericht Dortmund",
      "registernummer": "HRB 2391",
      "registerart": "HRB",
      "company_name": "Dortmunder Stadtwerke Aktiengesellschaft",
      "company_seat": "Dortmund",
      "details": "15.05.2025 (Bekanntmachungsdatum)\n\nNordrhein-Westfalen Amtsgericht Dortmund HRB 2391\nRegisterbekanntmachung nach dem Umwandlungsgesetz\n\nDortmunder Stadtwerke Aktiengesellschaft\nAktiengesellschaft\nDortmund\n\nDem Registergericht ist der Entwurf eines Vertrages über die geplante Verschmelzung der H-Bahn-Gesellschaft Dortmund mit beschränkter Haftung (Amtsgericht Dortmund HRB 5604) mit der Dortmunder Stadtwerke Aktiengesellschaft (Amtsgericht Dortmund HRB 2391) eingereicht worden."
    },
    {
      "date": "2025-05-15",
      "id": "109239",
      "original_text": "Löschungsankündigung\nNordrhein-Westfalen Amtsgericht Bochum HRB 21494\nLehmann Sauna, Pool, Freizeit GmbH – Bochum",
      "type": "Löschungsankündigung",
      "state": "Nordrhein-Westfalen",
      "amtsgericht": "Amtsgericht Bochum",
      "registernummer": "HRB 21494",
      "registerart": "HRB",
      "company_name": "Lehmann Sauna, Pool, Freizeit GmbH",
      "company_seat": "Bochum",
      "details": "15.05.2025 (Bekanntmachungsdatum)\n\nNordrhein-Westfalen Amtsgericht Bochum HRB 21494\nLöschungsankündigung 16.05.2025 (Eintragungsdatum)\n\nLehmann Sauna, Pool, Freizeit GmbH\nGesellschaft mit beschränkter Haftung\nBochum\n\nDas Registergericht erwägt, die Gesellschaft von Amts wegen nach § 394 FamFG zu löschen. Die Frist zur Erhebung eines Widerspruchs ist auf drei Monate festgesetzt."
    },
    {
      "date": "2025-05-15",
      "id": "109240",
      "original_text": "Löschungsankündigung\nNordrhein-Westfalen Amtsgericht Duisburg HRB 35528\nEM-Dienstleistungs UG (haftungsbeschränkt) – Duisburg",
      "type": "Löschungsankündigung",
      "state": "Nordrhein-Westfalen",
      "amtsgericht": "Amtsgericht Duisburg",
      "registernummer": "HRB 35528",
      "registerart": "HRB",
      "company_name": "EM-Dienstleistungs UG (haftungsbeschränkt)",
      "company_seat": "Duisburg",
      "details": "15.05.2025 (Bekanntmachungsdatum)\n\nNordrhein-Westfalen Amtsgericht Duisburg HRB 35528\nLöschungsankündigung\n\nEM-Dienstleistungs UG (haftungsbeschränkt)\nGesellschaft mit beschränkter Haftung\nDuisburg\n\nHRB 35528:\nEM-Dienstleistungs UG (haftungsbeschränkt),\nDuisburg,\nFabrikstraße 38, 47119 Duisburg Das Registergericht beabsichtigt, die im Handelsregister eingetragene Gesellschaft gemäß § 394 Absatz 1 FamFG wegen Vermögenslosigkeit von Amts wegen zu löschen. Gegen diese Verfügung kann Widerspruch eingelegt werden. Die Frist zur Erhebung eines Widerspruchs gegen die beabsichtigte Löschung von Amts wegen ist auf drei Monate festgesetzt. Rechtsbehelfsbelehrung Der Widerspruch ist bei dem Amtsgericht Duisburg, Kardinal-Galen-Str. 124-132, 47058 Duisburg schriftlich in deutscher Sprache oder zur Niederschrift der Geschäftsstelle einzulegen. Der Widerspruch kann auch zur Niederschrift der Geschäftsstelle eines jeden Amtsgerichtes abgegeben werden. Die Einlegung ist auch durch Übertragung eines elektronischen Dokuments an die elektronische Poststelle des Gerichts möglich. Das elektronische Dokument muss für die Bearbeitung durch das Gericht geeignet und mit einer qualifizierten elektronischen Signatur der verantwortenden Person versehen sein oder von der verantwortenden Person signiert und auf einem sicheren Übermittlungsweg gemäß § 130 a ZPO nach näherer Maßgabe der Verordnung über die technischen Rahmenbedingungen des elektronischen Rechtsverkehrs und über das besondere elektronische Behördenpostfach (BGBl. I, S. 3803) eingereicht werden. Weitere Informationen erhalten Sie auf der Internetseite www.justiz.de <http://www.justiz.de>. Der Widerspruch muss spätestens innerhalb der gesetzten Frist bei dem Amtsgericht Duisburg eingegangen sein. Dies gilt auch dann, wenn der Widerspruch zur Niederschrift der Geschäftsstelle eines anderen Amtsgerichtes abgegeben wurde. Die Frist beginnt mit der Veröffentlichung. Fällt das Ende der Frist auf einen Sonntag, einen allgemeinen Feiertag oder Sonnabend, so endet die Frist mit Ablauf des nächsten Werktages. Der Widerspruch muss die Bezeichnung der angefochtenen Verfügung sowie die Erklärung enthalten, dass Widerspruch gegen diese Verfügung eingelegt wird. Er ist zu unterzeichnen und soll begründet werden."
    },
    {
      "date": "2025-05-15",
      "id": "109241",
      "original_text": "Sonstige Registerbekanntmachung\nNordrhein-Westfalen Amtsgericht Dortmund HRB 30763\nVerbraucherportal Deutschland GmbH – Dortmund",
      "type": "Sonstige Registerbekanntmachung",
      "state": "Nordrhein-Westfalen",
      "amtsgericht": "Amtsgericht Dortmund",
      "registernummer": "HRB 30763",
      "registerart": "HRB",
      "company_name": "Verbraucherportal Deutschland GmbH",
      "company_seat": "Dortmund",
      "details": "15.05.2025 (Bekanntmachungsdatum)\n\nNordrhein-Westfalen Amtsgericht Dortmund HRB 30763\nSonstige Registerbekanntmachung 15.05.2025 (Eintragungsdatum)\n\nVerbraucherportal Deutschland GmbH\nGesellschaft mit beschränkter Haftung\nDortmund\n\nAls nicht eingetragen wird veröffentlicht: Den Gläubigern der Gesellschaft, deren Forderungen begründet worden sind bevor die Eintragung der Beendigung des Beherrschungsvertrages und der Beendigung des Gewinnabführungsvertrages  in das Handelsregister nach § 10 des Handelsgesetzbuches als bekanntgemacht gilt, hat der andere Vertragsteil Sicherheit zu leisten, wenn sie sich binnen sechs Monaten nach der Bekanntmachung der Eintragung zu diesem Zweck bei ihm melden."
    },
    {
      "date": "2025-05-15",
      "id": "109242",
      "original_text": "Löschungsankündigung\nThüringen Amtsgericht Jena HRB 111479\nBachmann Gartenbau GmbH – Erfurt",
      "type": "Löschungsankündigung",
      "state": "Thüringen",
      "amtsgericht": "Amtsgericht Jena",
      "registernummer": "HRB 111479",
      "registerart": "HRB",
      "company_name": "Bachmann Gartenbau GmbH",
      "company_seat": "Erfurt",
      "details": "15.05.2025 (Bekanntmachungsdatum)\n\nThüringen Amtsgericht Jena HRB 111479\nLöschungsankündigung\n\nBachmann Gartenbau GmbH\nGesellschaft mit beschränkter Haftung\nErfurt\n\nDas Registergericht beabsichtigt, die im Handelsregister eingetragene Gesellschaft wegen Vermögenslosigkeit nach § 394 FamFG von Amts wegen zu löschen. Die Frist zur Erhebung eines Widerspruchs gegen die beabsichtigte Löschung wird auf 6 Wochen festgesetzt."
    },
    {
      "date": "2025-05-15",
      "id": "109243",
      "original_text": "Einreichung neuer Dokumente\nThüringen Amtsgericht Jena HRB 113448\nBetreibergesellschaft für Applikations- und Technologiezentren Thüringen mbH (BATT) – Erfurt",
      "type": "Einreichung neuer Dokumente",
      "state": "Thüringen",
      "amtsgericht": "Amtsgericht Jena",
      "registernummer": "HRB 113448",
      "registerart": "HRB",
      "company_name": "Betreibergesellschaft für Applikations- und Technologiezentren Thüringen mbH (BATT)",
      "company_seat": "Erfurt",
      "details": "15.05.2025 (Bekanntmachungsdatum)\n\nThüringen Amtsgericht Jena HRB 113448\nEinreichung neuer Dokumente\n\nBetreibergesellschaft für Applikations- und Technologiezentren Thüringen mbH (BATT)\nGesellschaft mit beschränkter Haftung\nErfurt\n\nBekanntmachung gem. § 52 Abs. 3 Satz 2 GmbHG: Aufgrund einer Veränderung in den Personen der Aufsichtsratsmitglieder ist durch die Geschäftsführer eine neue Liste zum Handelsregister eingereicht worden."
    },
    {
      "date": "2025-05-15",
      "id": "109244",
      "original_text": "Registerbekanntmachung nach dem Umwandlungsgesetz\nThüringen Amtsgericht Jena HRA 201935\nCzerwenka - Finanz Michael Czerwenka e.K. – Greiz",
      "type": "Registerbekanntmachung nach dem Umwandlungsgesetz",
      "state": "Thüringen",
      "amtsgericht": "Amtsgericht Jena",
      "registernummer": "HRA 201935",
      "registerart": "HRA",
      "company_name": "Czerwenka - Finanz Michael Czerwenka e.K.",
      "company_seat": "Greiz",
      "details": "15.05.2025 (Bekanntmachungsdatum)\n\nThüringen Amtsgericht Jena HRA 201935\nRegisterbekanntmachung nach dem Umwandlungsgesetz 15.05.2025 (Eintragungsdatum)\n\nCzerwenka - Finanz Michael Czerwenka e.K.\nEinzelkaufmann / Einzelkauffrau\nGreiz\n\nDie Czerwenka-Finanz GmbH mit dem Sitz in Greiz (Amtsgericht Jena HRB 503456) ist auf Grund des Verschmelzungsvertrages vom 25.03.2025 und des Beschlusses der Gesellschafterversammlung vom selben Tag auf das Vermögen des Alleingesellschafters Czerwenka, Michael, Elsterberg, *25.09.1957 verschmolzen. Das Unternehmen des übertragenen Rechtsträgers wird unter dem Einzelunternehmen fortgeführt.\nNicht eingetragen: Den Gläubigern der an der Verschmelzung beteiligten Rechtsträger, ist wenn sie binnen sechs Monaten nach dem Tag, an dem die Eintragung der Verschmelzung in das Register des Sitzes desjenigen Rechtsträgers, dessen Gläubiger sie sind,  nach § 19 Abs. 3 UmwG als bekanntgemacht gilt, ihren Anspruch nach Grund und Höhe schriftlich anmelden, Sicherheit zu leisten, soweit sie nicht Befriedigung verlangen können. Dieses Recht steht ihnen jedoch nur zu, wenn sie glaubhaft machen, daß durch die Verschmelzung die Erfüllung ihrer Forderung gefährdet wird."
    },
    {
      "date": "2025-05-15",
      "id": "109245",
      "original_text": "Registerbekanntmachung nach dem Umwandlungsgesetz\nThüringen Amtsgericht Jena HRB 503456\nCzerwenka-Finanz GmbH – Greiz",
      "type": "Registerbekanntmachung nach dem Umwandlungsgesetz",
      "state": "Thüringen",
      "amtsgericht": "Amtsgericht Jena",
      "registernummer": "HRB 503456",
      "registerart": "HRB",
      "company_name": "Czerwenka-Finanz GmbH",
      "company_seat": "Greiz",
      "details": "15.05.2025 (Bekanntmachungsdatum)\n\nThüringen Amtsgericht Jena HRB 503456\nRegisterbekanntmachung nach dem Umwandlungsgesetz 15.05.2025 (Eintragungsdatum)\n\nCzerwenka-Finanz GmbH\nGesellschaft mit beschränkter Haftung\nGreiz\n\nDie Gesellschaft ist aufgrund des Verschmelzungsvertrages vom 25.03.2025 sowie des Beschlusses der Gesellschafterversammlung vom selben Tag mit dem Vermögen des Alleingesellschafters Czerwenka, Michael, Elsterberg, *25.09.1957 verschmolzen. Das Unternehmen wird als Einzelfirma unter der Firma Czerwenka - Finanz Michael Czerwenka e.K.  mit dem Sitz in Greiz (Amtsgericht Jena HRA 201935) geführt. Die Eintragung ist mit zeitgleicher Eintragung in das Register des übernehmenden Rechtsträgers wirksam geworden.\nNicht eingetragen: Den Gläubigern der an der Verschmelzung beteiligten Rechtsträger, ist wenn sie binnen sechs Monaten nach dem Tag, an dem die Eintragung der Verschmelzung in das Register des Sitzes desjenigen Rechtsträgers, dessen Gläubiger sie sind,  nach § 19 Abs. 3 UmwG als bekanntgemacht gilt, ihren Anspruch nach Grund und Höhe schriftlich anmelden, Sicherheit zu leisten, soweit sie nicht Befriedigung verlangen können. Dieses Recht steht ihnen jedoch nur zu, wenn sie glaubhaft machen, daß durch die Verschmelzung die Erfüllung ihrer Forderung gefährdet wird."
    },
    {
      "date": "2025-05-15",
      "id": "109246",
      "original_text": "Registerbekanntmachung nach dem Umwandlungsgesetz\nThüringen Amtsgericht Jena HRB 505995\nIBV Immobilien Bau- und Verwaltungsgesellschaft mbH – Jena",
      "type": "Registerbekanntmachung nach dem Umwandlungsgesetz",
      "state": "Thüringen",
      "amtsgericht": "Amtsgericht Jena",
      "registernummer": "HRB 505995",
      "registerart": "HRB",
      "company_name": "IBV Immobilien Bau- und Verwaltungsgesellschaft mbH",
      "company_seat": "Jena",
      "details": "15.05.2025 (Bekanntmachungsdatum)\n\nThüringen Amtsgericht Jena HRB 505995\nRegisterbekanntmachung nach dem Umwandlungsgesetz 15.05.2025 (Eintragungsdatum)\n\nIBV Immobilien Bau- und Verwaltungsgesellschaft mbH\nGesellschaft mit beschränkter Haftung\nJena\n\nNicht eingetragen: Den Gläubigern der an der Ausgliederung beteiligten Rechtsträger, ist wenn sie binnen sechs Monaten nach dem Tag, an dem die Eintragung der Ausgliederung in das Register des Sitzes desjenigen Rechtsträgers, dessen Gläubiger sie sind, nach §§125, 19 Abs. 3 UmwG als bekanntgemacht gilt, ihren Anspruch nach Grund und Höhe schriftlich anmelden, Sicherheit zu leisten, soweit sie nicht Befriedigung verlangen können. Dieses Recht steht ihnen jedoch nur zu, wenn sie glaubhaft machen, daß durch die Ausgliederung die Erfüllung ihrer Forderung gefährdet wird."
    },
    {
      "date": "2025-05-15",
      "id": "109247",
      "original_text": "Registerbekanntmachung nach dem Umwandlungsgesetz\nThüringen Amtsgericht Jena HRA 506771\nHausverwaltung Iris Bach e.K. – Jena",
      "type": "Registerbekanntmachung nach dem Umwandlungsgesetz",
      "state": "Thüringen",
      "amtsgericht": "Amtsgericht Jena",
      "registernummer": "HRA 506771",
      "registerart": "HRA",
      "company_name": "Hausverwaltung Iris Bach e.K.",
      "company_seat": "Jena",
      "details": "15.05.2025 (Bekanntmachungsdatum)\n\nThüringen Amtsgericht Jena HRA 506771\nRegisterbekanntmachung nach dem Umwandlungsgesetz 15.05.2025 (Eintragungsdatum)\n\nHausverwaltung Iris Bach e.K.\nEinzelkaufmann / Einzelkauffrau\nJena\n\nNicht eingetragen: Den Gläubigern der an der Verschmelzung beteiligten Rechtsträger, ist wenn sie binnen sechs Monaten nach dem Tag, an dem die Eintragung der Verschmelzung in das Register des Sitzes desjenigen Rechtsträgers, dessen Gläubiger sie sind,  nach § 19 Abs. 3 UmwG als bekanntgemacht gilt, ihren Anspruch nach Grund und Höhe schriftlich anmelden, Sicherheit zu leisten, soweit sie nicht Befriedigung verlangen können. Dieses Recht steht ihnen jedoch nur zu, wenn sie glaubhaft machen, daß durch die Verschmelzung die Erfüllung ihrer Forderung gefährdet wird. Nicht eingetragen: Den Gläubigern der an der Ausgliederung beteiligten Rechtsträger, ist wenn sie binnen sechs Monaten nach dem Tag, an dem die Eintragung der Ausgliederung in das Register des Sitzes desjenigen Rechtsträgers, dessen Gläubiger sie sind, nach §§125, 19 Abs. 3 UmwG als bekanntgemacht gilt, ihren Anspruch nach Grund und Höhe schriftlich anmelden, Sicherheit zu leisten, soweit sie nicht Befriedigung verlangen können. Dieses Recht steht ihnen jedoch nur zu, wenn sie glaubhaft machen, daß durch die Ausgliederung die Erfüllung ihrer Forderung gefährdet wird."
    },
    {
      "date": "2025-05-15",
      "id": "109248",
      "original_text": "Registerbekanntmachung nach dem Umwandlungsgesetz\nThüringen Amtsgericht Jena HRB 404956\nPollmeier Finanz GmbH – Amt Creuzburg",
      "type": "Registerbekanntmachung nach dem Umwandlungsgesetz",
      "state": "Thüringen",
      "amtsgericht": "Amtsgericht Jena",
      "registernummer": "HRB 404956",
      "registerart": "HRB",
      "company_name": "Pollmeier Finanz GmbH",
      "company_seat": "Amt Creuzburg",
      "details": "15.05.2025 (Bekanntmachungsdatum)\n\nThüringen Amtsgericht Jena HRB 404956\nRegisterbekanntmachung nach dem Umwandlungsgesetz 15.05.2025 (Eintragungsdatum)\n\nPollmeier Finanz GmbH\nGesellschaft mit beschränkter Haftung\nAmt Creuzburg\n\nNicht eingetragen: Den Gläubigern der an der Verschmelzung beteiligten Rechtsträger, ist wenn sie binnen sechs Monaten nach dem Tag, an dem die Eintragung der Verschmelzung in das Register des Sitzes desjenigen Rechtsträgers, dessen Gläubiger sie sind,  nach § 19 Abs. 3 UmwG als bekanntgemacht gilt, ihren Anspruch nach Grund und Höhe schriftlich anmelden, Sicherheit zu leisten, soweit sie nicht Befriedigung verlangen können. Dieses Recht steht ihnen jedoch nur zu, wenn sie glaubhaft machen, daß durch die Verschmelzung die Erfüllung ihrer Forderung gefährdet wird."
    },
    {
      "date": "2025-05-15",
      "id": "109249",
      "original_text": "Registerbekanntmachung nach dem Umwandlungsgesetz\nThüringen Amtsgericht Jena HRB 506389\nPollmeier Furnierwerkstoffe Verwaltungs GmbH – Amt Creuzburg",
      "type": "Registerbekanntmachung nach dem Umwandlungsgesetz",
      "state": "Thüringen",
      "amtsgericht": "Amtsgericht Jena",
      "registernummer": "HRB 506389",
      "registerart": "HRB",
      "company_name": "Pollmeier Furnierwerkstoffe Verwaltungs GmbH",
      "company_seat": "Amt Creuzburg",
      "details": "15.05.2025 (Bekanntmachungsdatum)\n\nThüringen Amtsgericht Jena HRB 506389\nRegisterbekanntmachung nach dem Umwandlungsgesetz 15.05.2025 (Eintragungsdatum)\n\nPollmeier Furnierwerkstoffe Verwaltungs GmbH\nGesellschaft mit beschränkter Haftung\nAmt Creuzburg\n\nNicht eingetragen: Den Gläubigern der an der Verschmelzung beteiligten Rechtsträger, ist wenn sie binnen sechs Monaten nach dem Tag, an dem die Eintragung der Verschmelzung in das Register des Sitzes desjenigen Rechtsträgers, dessen Gläubiger sie sind,  nach § 19 Abs. 3 UmwG als bekanntgemacht gilt, ihren Anspruch nach Grund und Höhe schriftlich anmelden, Sicherheit zu leisten, soweit sie nicht Befriedigung verlangen können. Dieses Recht steht ihnen jedoch nur zu, wenn sie glaubhaft machen, daß durch die Verschmelzung die Erfüllung ihrer Forderung gefährdet wird."
    },
    {
      "date": "2025-05-15",
      "id": "109250",
      "original_text": "Registerbekanntmachung nach dem Umwandlungsgesetz\nThüringen Amtsgericht Jena HRB 209218\nDie hilfreichen Schwestern DHS Hauskrankenpflege GmbH – Gera",
      "type": "Registerbekanntmachung nach dem Umwandlungsgesetz",
      "state": "Thüringen",
      "amtsgericht": "Amtsgericht Jena",
      "registernummer": "HRB 209218",
      "registerart": "HRB",
      "company_name": "Die hilfreichen Schwestern DHS Hauskrankenpflege GmbH",
      "company_seat": "Gera",
      "details": "15.05.2025 (Bekanntmachungsdatum)\n\nThüringen Amtsgericht Jena HRB 209218\nRegisterbekanntmachung nach dem Umwandlungsgesetz 15.05.2025 (Eintragungsdatum)\n\nDie hilfreichen Schwestern DHS Hauskrankenpflege GmbH\nGesellschaft mit beschränkter Haftung\nGera\n\nNicht eingetragen: Den Gläubigern der an der Verschmelzung beteiligten Rechtsträger, ist wenn sie binnen sechs Monaten nach dem Tag, an dem die Eintragung der Verschmelzung in das Register des Sitzes desjenigen Rechtsträgers, dessen Gläubiger sie sind,  nach § 19 Abs. 3 UmwG als bekanntgemacht gilt, ihren Anspruch nach Grund und Höhe schriftlich anmelden, Sicherheit zu leisten, soweit sie nicht Befriedigung verlangen können. Dieses Recht steht ihnen jedoch nur zu, wenn sie glaubhaft machen, daß durch die Verschmelzung die Erfüllung ihrer Forderung gefährdet wird."
    },
    {
      "date": "2025-05-15",
      "id": "109251",
      "original_text": "Löschungsankündigung\nHessen Amtsgericht Offenbach am Main HRB 51735\nSeki Bau GmbH – Dreieich",
      "type": "Löschungsankündigung",
      "state": "Hessen",
      "amtsgericht": "Amtsgericht Offenbach am Main",
      "registernummer": "HRB 51735",
      "registerart": "HRB",
      "company_name": "Seki Bau GmbH",
      "company_seat": "Dreieich",
      "details": "15.05.2025 (Bekanntmachungsdatum)\n\nHessen Amtsgericht Offenbach am Main HRB 51735\nLöschungsankündigung\n\nSeki Bau GmbH\nGesellschaft mit beschränkter Haftung\nDreieich\n\nDas Registergericht beabsichtigt die im Handelsregister eingetragene Gesellschaft von Amts wegen nach § 394 FamFG zu löschen. Die Frist zur Erhebung eines Widerspruchs gegen die beabsichtigte Löschung wird auf 3 Monate festgesetzt."
    },
    {
      "date": "2025-05-15",
      "id": "109252",
      "original_text": "Registerbekanntmachung nach dem Umwandlungsgesetz\nHessen Amtsgericht Fulda HRB 6952\nGHS Immobilien Holding GmbH – Fulda",
      "type": "Registerbekanntmachung nach dem Umwandlungsgesetz",
      "state": "Hessen",
      "amtsgericht": "Amtsgericht Fulda",
      "registernummer": "HRB 6952",
      "registerart": "HRB",
      "company_name": "GHS Immobilien Holding GmbH",
      "company_seat": "Fulda",
      "details": "15.05.2025 (Bekanntmachungsdatum)\n\nHessen Amtsgericht Fulda HRB 6952\nRegisterbekanntmachung nach dem Umwandlungsgesetz 15.05.2025 (Eintragungsdatum)\n\nGHS Immobilien Holding GmbH\nGesellschaft mit beschränkter Haftung\nFulda\n\nDen Gläubigern der an der Verschmelzung beteiligten Rechtsträger ist, wenn sie binnen sechs Monaten nach dem Tag, an dem die Eintragung der Verschmelzung in das Register des Sitzes desjenigen Rechtsträgers, dessen Gläubiger sie sind, nach § 19 Absatz 3 UmwG bekannt gemacht worden ist, ihren Anspruch nach Grund und Höhe schriftlich anmelden, Sicherheit zu leisten, soweit sie nicht Befriedigung verlangen können. Dieses Recht steht den Gläubigern jedoch nur zu, wenn sie glaubhaft machen, dass durch die Verschmelzung die Erfüllung ihrer Forderung gefährdet wird."
    },
    {
      "date": "2025-05-15",
      "id": "109253",
      "original_text": "Löschungsankündigung\nHessen Amtsgericht Frankfurt am Main HRB 113886\nTOKATA Medizinische Systeme GmbH – Frankfurt am Main",
      "type": "Löschungsankündigung",
      "state": "Hessen",
      "amtsgericht": "Amtsgericht Frankfurt am Main",
      "registernummer": "HRB 113886",
      "registerart": "HRB",
      "company_name": "TOKATA Medizinische Systeme GmbH",
      "company_seat": "Frankfurt am Main",
      "details": "15.05.2025 (Bekanntmachungsdatum)\n\nHessen Amtsgericht Frankfurt am Main HRB 113886\nLöschungsankündigung\n\nTOKATA Medizinische Systeme GmbH\nGesellschaft mit beschränkter Haftung\nFrankfurt am Main\n\nEs ist beabsichtigt, die Gesellschaft wegen Vermögenslosigkeit gemäß § 394 FamFG von Amts wegen im Handelsregister zu löschen. Hiergegen kann innerhalb eines Monats nach dieser Veröffentlichung Widerspruch bei dem Amtsgericht Frankfurt am Main eingelegt werden."
    },
    {
      "date": "2025-05-15",
      "id": "109254",
      "original_text": "Registerbekanntmachung nach dem Umwandlungsgesetz\nHessen Amtsgericht Frankfurt am Main HRB 136272\nAudika GmbH – Frankfurt am Main",
      "type": "Registerbekanntmachung nach dem Umwandlungsgesetz",
      "state": "Hessen",
      "amtsgericht": "Amtsgericht Frankfurt am Main",
      "registernummer": "HRB 136272",
      "registerart": "HRB",
      "company_name": "Audika GmbH",
      "company_seat": "Frankfurt am Main",
      "details": "15.05.2025 (Bekanntmachungsdatum)\n\nHessen Amtsgericht Frankfurt am Main HRB 136272\nRegisterbekanntmachung nach dem Umwandlungsgesetz 15.05.2025 (Eintragungsdatum)\n\nAudika GmbH\nGesellschaft mit beschränkter Haftung\nFrankfurt am Main\n\nDen Gläubigern der an der Verschmelzung beteiligten Rechtsträger ist, wenn sie binnen sechs Monaten nach dem Tag, an dem die Eintragung der Verschmelzung in das Register des Sitzes desjenigen Rechtsträgers, dessen Gläubiger sie sind, nach § 19 Absatz 3 UmwG bekannt gemacht worden ist, ihren Anspruch nach Grund und Höhe schriftlich anmelden, Sicherheit zu leisten, soweit sie nicht Befriedigung verlangen können. Dieses Recht steht den Gläubigern jedoch nur zu, wenn sie glaubhaft machen, dass durch die Verschmelzung die Erfüllung ihrer Forderung gefährdet wird."
    },
    {
      "date": "2025-05-15",
      "id": "109255",
      "original_text": "Einreichung neuer Dokumente\nHessen Amtsgericht Frankfurt am Main HRB 91699\nArbeiter-Samariter-Bund Lehrerkooperative Bildung und Kommunikation gemeinnützige Gesellschaft mbH – Frankfurt am Main",
      "type": "Einreichung neuer Dokumente",
      "state": "Hessen",
      "amtsgericht": "Amtsgericht Frankfurt am Main",
      "registernummer": "HRB 91699",
      "registerart": "HRB",
      "company_name": "Arbeiter-Samariter-Bund Lehrerkooperative Bildung und Kommunikation gemeinnützige Gesellschaft mbH",
      "company_seat": "Frankfurt am Main",
      "details": "15.05.2025 (Bekanntmachungsdatum)\n\nHessen Amtsgericht Frankfurt am Main HRB 91699\nEinreichung neuer Dokumente\n\nArbeiter-Samariter-Bund Lehrerkooperative Bildung und Kommunikation gemeinnützige Gesellschaft mbH\nGesellschaft mit beschränkter Haftung\nFrankfurt am Main\n\nDurch eine Änderung in den Personen der Aufsichtsratsmitglieder ist eine Liste der Mitglieder des Aufsichtsrates zum Handelsregister eingereicht worden."
    },
    {
      "date": "2025-05-15",
      "id": "109256",
      "original_text": "Löschungsankündigung\nHessen Amtsgericht Frankfurt am Main HRB 104165\nFahrschule PS Drive GmbH – Frankfurt am Main",
      "type": "Löschungsankündigung",
      "state": "Hessen",
      "amtsgericht": "Amtsgericht Frankfurt am Main",
      "registernummer": "HRB 104165",
      "registerart": "HRB",
      "company_name": "Fahrschule PS Drive GmbH",
      "company_seat": "Frankfurt am Main",
      "details": "15.05.2025 (Bekanntmachungsdatum)\n\nHessen Amtsgericht Frankfurt am Main HRB 104165\nLöschungsankündigung 15.05.2025 (Eintragungsdatum)\n\nFahrschule PS Drive GmbH\nGesellschaft mit beschränkter Haftung\nFrankfurt am Main\n\nDas Registergericht beabsichtigt die im Handelsregister eingetragene Gesellschaft von Amts wegen nach § 394 FamFG zu löschen. Die Frist zur Erhebung eines Widerspruchs gegen die beabsichtigte Löschung wird auf 1 Monat festgesetzt."
    },
    {
      "date": "2025-05-15",
      "id": "109257",
      "original_text": "Registerbekanntmachung nach dem Umwandlungsgesetz\nHessen Amtsgericht Frankfurt am Main HRB 138445\nSPIE Data Center GmbH – Frankfurt am Main",
      "type": "Registerbekanntmachung nach dem Umwandlungsgesetz",
      "state": "Hessen",
      "amtsgericht": "Amtsgericht Frankfurt am Main",
      "registernummer": "HRB 138445",
      "registerart": "HRB",
      "company_name": "SPIE Data Center GmbH",
      "company_seat": "Frankfurt am Main",
      "details": "15.05.2025 (Bekanntmachungsdatum)\n\nHessen Amtsgericht Frankfurt am Main HRB 138445\nRegisterbekanntmachung nach dem Umwandlungsgesetz 15.05.2025 (Eintragungsdatum)\n\nSPIE Data Center GmbH\nGesellschaft mit beschränkter Haftung\nFrankfurt am Main\n\nDen Gläubigern der an der Abspaltung beteiligten Rechtsträger ist, wenn sie binnen sechs Monaten nach dem Tag, an dem die Eintragung der Abspaltung in das Register des Sitzes derjenigen Rechtsträger deren Gläubiger sie sind, nach §§ 125, 19 Absatz 3 UmwG bekannt gemacht worden ist, ihren Anspruch nach Grund und Höhe schriftlich anmelden, Sicherheit zu leisten, soweit sie nicht Befriedigung verlangen können. Dieses Recht steht den Gläubigern jedoch nur zu, wenn sie glaubhaft machen, dass durch die Abspaltung die Erfüllung ihrer Forderung gefährdet wird."
    },
    {
      "date": "2025-05-15",
      "id": "109258",
      "original_text": "Sonstige Registerbekanntmachung\nHessen Amtsgericht Wiesbaden HRB 32195\nHy2gen AG – Wiesbaden",
      "type": "Sonstige Registerbekanntmachung",
      "state": "Hessen",
      "amtsgericht": "Amtsgericht Wiesbaden",
      "registernummer": "HRB 32195",
      "registerart": "HRB",
      "company_name": "Hy2gen AG",
      "company_seat": "Wiesbaden",
      "details": "15.05.2025 (Bekanntmachungsdatum)\n\nHessen Amtsgericht Wiesbaden HRB 32195\nSonstige Registerbekanntmachung 15.05.2025 (Eintragungsdatum)\n\nHy2gen AG\nAktiengesellschaft\nWiesbaden\n\nDurch eine Änderung in den Personen der Aufsichtsratsmitglieder ist eine Liste der Mitglieder des Aufsichtsrates zum Handelsregister eingereicht worden."
    },
    {
      "date": "2025-05-15",
      "id": "109259",
      "original_text": "Löschungsankündigung\nHessen Amtsgericht Frankfurt am Main HRB 104339\nBCLH Beteiligungen GmbH – Frankfurt am Main",
      "type": "Löschungsankündigung",
      "state": "Hessen",
      "amtsgericht": "Amtsgericht Frankfurt am Main",
      "registernummer": "HRB 104339",
      "registerart": "HRB",
      "company_name": "BCLH Beteiligungen GmbH",
      "company_seat": "Frankfurt am Main",
      "details": "15.05.2025 (Bekanntmachungsdatum)\n\nHessen Amtsgericht Frankfurt am Main HRB 104339\nLöschungsankündigung\n\nBCLH Beteiligungen GmbH\nGesellschaft mit beschränkter Haftung\nFrankfurt am Main\n\nDas Registergericht beabsichtigt die im Handelsregister eingetragene Gesellschaft von Amts wegen nach § 394 FamFG zu löschen. Die Frist zur Erhebung eines Widerspruchs gegen die beabsichtigte Löschung wird auf 1 Monat festgesetzt."
    },
    {
      "date": "2025-05-15",
      "id": "109260",
      "original_text": "Löschungsankündigung\nHessen Amtsgericht Frankfurt am Main HRB 94516\nROYU-GmbH – Frankfurt am Main",
      "type": "Löschungsankündigung",
      "state": "Hessen",
      "amtsgericht": "Amtsgericht Frankfurt am Main",
      "registernummer": "HRB 94516",
      "registerart": "HRB",
      "company_name": "ROYU-GmbH",
      "company_seat": "Frankfurt am Main",
      "details": "15.05.2025 (Bekanntmachungsdatum)\n\nHessen Amtsgericht Frankfurt am Main HRB 94516\nLöschungsankündigung 15.05.2025 (Eintragungsdatum)\n\nROYU-GmbH\nGesellschaft mit beschränkter Haftung\nFrankfurt am Main\n\nDas Registergericht beabsichtigt die im Handelsregister eingetragene Gesellschaft von Amts wegen nach § 394 FamFG zu löschen. Die Frist zur Erhebung eines Widerspruchs gegen die beabsichtigte Löschung wird auf 3 Monate festgesetzt."
    },
    {
      "date": "2025-05-15",
      "id": "109261",
      "original_text": "Einreichung neuer Dokumente\nHessen Amtsgericht Hanau HRB 13236\nKreisverkehrsgesellschaft Main-Kinzig mbH – Gelnhausen",
      "type": "Einreichung neuer Dokumente",
      "state": "Hessen",
      "amtsgericht": "Amtsgericht Hanau",
      "registernummer": "HRB 13236",
      "registerart": "HRB",
      "company_name": "Kreisverkehrsgesellschaft Main-Kinzig mbH",
      "company_seat": "Gelnhausen",
      "details": "15.05.2025 (Bekanntmachungsdatum)\n\nHessen Amtsgericht Hanau HRB 13236\nEinreichung neuer Dokumente\n\nKreisverkehrsgesellschaft Main-Kinzig mbH\nGesellschaft mit beschränkter Haftung\nGelnhausen\n\nDurch eine Änderung in den Personen der Aufsichtsratsmitglieder ist eine Liste der Mitglieder des Aufsichtsrates zum Handelsregister eingereicht worden."
    },
    {
      "date": "2025-05-15",
      "id": "109262",
      "original_text": "Registerbekanntmachung nach dem Umwandlungsgesetz\nHessen Amtsgericht Fulda HRB 7195\nGHS Immobilien 3. Grundbesitz GmbH – Fulda",
      "type": "Registerbekanntmachung nach dem Umwandlungsgesetz",
      "state": "Hessen",
      "amtsgericht": "Amtsgericht Fulda",
      "registernummer": "HRB 7195",
      "registerart": "HRB",
      "company_name": "GHS Immobilien 3. Grundbesitz GmbH",
      "company_seat": "Fulda",
      "details": "15.05.2025 (Bekanntmachungsdatum)\n\nHessen Amtsgericht Fulda HRB 7195\nRegisterbekanntmachung nach dem Umwandlungsgesetz 15.05.2025 (Eintragungsdatum)\n\nGHS Immobilien 3. Grundbesitz GmbH\nGesellschaft mit beschränkter Haftung\nFulda\n\nDen Gläubigern der an der Verschmelzung beteiligten Rechtsträger ist, wenn sie binnen sechs Monaten nach dem Tag, an dem die Eintragung der Verschmelzung in das Register des Sitzes desjenigen Rechtsträgers, dessen Gläubiger sie sind, nach § 19 Absatz 3 UmwG bekannt gemacht worden ist, ihren Anspruch nach Grund und Höhe schriftlich anmelden, Sicherheit zu leisten, soweit sie nicht Befriedigung verlangen können. Dieses Recht steht den Gläubigern jedoch nur zu, wenn sie glaubhaft machen, dass durch die Verschmelzung die Erfüllung ihrer Forderung gefährdet wird."
    },
    {
      "date": "2025-05-15",
      "id": "109263",
      "original_text": "Einreichung neuer Dokumente\nHessen Amtsgericht Frankfurt am Main HRB 19229\nDERPART Reisevertrieb GmbH – Frankfurt am Main",
      "type": "Einreichung neuer Dokumente",
      "state": "Hessen",
      "amtsgericht": "Amtsgericht Frankfurt am Main",
      "registernummer": "HRB 19229",
      "registerart": "HRB",
      "company_name": "DERPART Reisevertrieb GmbH",
      "company_seat": "Frankfurt am Main",
      "details": "15.05.2025 (Bekanntmachungsdatum)\n\nHessen Amtsgericht Frankfurt am Main HRB 19229\nEinreichung neuer Dokumente 15.05.2025 (Eintragungsdatum)\n\nDERPART Reisevertrieb GmbH\nGesellschaft mit beschränkter Haftung\nFrankfurt am Main\n\nDurch eine Änderung in den Personen der Aufsichtsratsmitglieder ist eine Liste der Mitglieder des Aufsichtsrates zum Handelsregister eingereicht worden."
    },
    {
      "date": "2025-05-15",
      "id": "109264",
      "original_text": "Registerbekanntmachung nach dem Umwandlungsgesetz\nHessen Amtsgericht Frankfurt am Main HRB 135648\nHS Advisory GmbH – Frankfurt am Main",
      "type": "Registerbekanntmachung nach dem Umwandlungsgesetz",
      "state": "Hessen",
      "amtsgericht": "Amtsgericht Frankfurt am Main",
      "registernummer": "HRB 135648",
      "registerart": "HRB",
      "company_name": "HS Advisory GmbH",
      "company_seat": "Frankfurt am Main",
      "details": "15.05.2025 (Bekanntmachungsdatum)\n\nHessen Amtsgericht Frankfurt am Main HRB 135648\nRegisterbekanntmachung nach dem Umwandlungsgesetz 14.05.2025 (Eintragungsdatum)\n\nHS Advisory GmbH\nGesellschaft mit beschränkter Haftung\nFrankfurt am Main\n\nDen Gläubigern der an der Verschmelzung beteiligten Rechtsträger ist, wenn sie binnen sechs Monaten nach dem Tag, an dem die Eintragung der Verschmelzung in das Register des Sitzes desjenigen Rechtsträgers, dessen Gläubiger sie sind, nach § 19 Absatz 3 UmwG bekannt gemacht worden ist, ihren Anspruch nach Grund und Höhe schriftlich anmelden, Sicherheit zu leisten, soweit sie nicht Befriedigung verlangen können. Dieses Recht steht den Gläubigern jedoch nur zu, wenn sie glaubhaft machen, dass durch die Verschmelzung die Erfüllung ihrer Forderung gefährdet wird."
    },
    {
      "date": "2025-05-15",
      "id": "109265",
      "original_text": "Registerbekanntmachung nach dem Umwandlungsgesetz\nHessen Amtsgericht Frankfurt am Main HRB 75115\nMH Value GmbH – Frankfurt am Main",
      "type": "Registerbekanntmachung nach dem Umwandlungsgesetz",
      "state": "Hessen",
      "amtsgericht": "Amtsgericht Frankfurt am Main",
      "registernummer": "HRB 75115",
      "registerart": "HRB",
      "company_name": "MH Value GmbH",
      "company_seat": "Frankfurt am Main",
      "details": "15.05.2025 (Bekanntmachungsdatum)\n\nHessen Amtsgericht Frankfurt am Main HRB 75115\nRegisterbekanntmachung nach dem Umwandlungsgesetz 14.05.2025 (Eintragungsdatum)\n\nMH Value GmbH\nGesellschaft mit beschränkter Haftung\nFrankfurt am Main\n\nDen Gläubigern der an der Verschmelzung beteiligten Rechtsträger ist, wenn sie binnen sechs Monaten nach dem Tag, an dem die Eintragung der Verschmelzung in das Register des Sitzes desjenigen Rechtsträgers, dessen Gläubiger sie sind, nach § 19 Absatz 3 UmwG bekannt gemacht worden ist, ihren Anspruch nach Grund und Höhe schriftlich anmelden, Sicherheit zu leisten, soweit sie nicht Befriedigung verlangen können. Dieses Recht steht den Gläubigern jedoch nur zu, wenn sie glaubhaft machen, dass durch die Verschmelzung die Erfüllung ihrer Forderung gefährdet wird."
    },
    {
      "date": "2025-05-15",
      "id": "109266",
      "original_text": "Löschungsankündigung\nHessen Amtsgericht Darmstadt HRB 102201\nTP Bau Management GmbH – Rüsselsheim am Main",
      "type": "Löschungsankündigung",
      "state": "Hessen",
      "amtsgericht": "Amtsgericht Darmstadt",
      "registernummer": "HRB 102201",
      "registerart": "HRB",
      "company_name": "TP Bau Management GmbH",
      "company_seat": "Rüsselsheim am Main",
      "details": "15.05.2025 (Bekanntmachungsdatum)\n\nHessen Amtsgericht Darmstadt HRB 102201\nLöschungsankündigung\n\nTP Bau Management GmbH\nGesellschaft mit beschränkter Haftung\nRüsselsheim am Main\n\nDas Registergericht beabsichtigt die im Handelsregister eingetragene Gesellschaft von Amts wegen nach § 394 FamFG zu löschen. Die Frist zur Erhebung eines Widerspruchs gegen die beabsichtigte Löschung wird auf 3 Monate festgesetzt."
    },
    {
      "date": "2025-05-15",
      "id": "109267",
      "original_text": "Löschungsankündigung\nHessen Amtsgericht Offenbach am Main HRB 51765\nNetwork Service Plaza UG (haftungsbeschränkt) – Dreieich",
      "type": "Löschungsankündigung",
      "state": "Hessen",
      "amtsgericht": "Amtsgericht Offenbach am Main",
      "registernummer": "HRB 51765",
      "registerart": "HRB",
      "company_name": "Network Service Plaza UG (haftungsbeschränkt)",
      "company_seat": "Dreieich",
      "details": "15.05.2025 (Bekanntmachungsdatum)\n\nHessen Amtsgericht Offenbach am Main HRB 51765\nLöschungsankündigung\n\nNetwork Service Plaza UG (haftungsbeschränkt)\nGesellschaft mit beschränkter Haftung\nDreieich\n\nDas Registergericht beabsichtigt die im Handelsregister eingetragene Gesellschaft von Amts wegen nach § 394 FamFG zu löschen. Die Frist zur Erhebung eines Widerspruchs gegen die beabsichtigte Löschung wird auf 3 Monate festgesetzt."
    },
    {
      "date": "2025-05-15",
      "id": "109268",
      "original_text": "Löschungsankündigung\nHessen Amtsgericht Frankfurt am Main HRB 111894\nAltus Bau und Logistik GmbH – Frankfurt am Main",
      "type": "Löschungsankündigung",
      "state": "Hessen",
      "amtsgericht": "Amtsgericht Frankfurt am Main",
      "registernummer": "HRB 111894",
      "registerart": "HRB",
      "company_name": "Altus Bau und Logistik GmbH",
      "company_seat": "Frankfurt am Main",
      "details": "15.05.2025 (Bekanntmachungsdatum)\n\nHessen Amtsgericht Frankfurt am Main HRB 111894\nLöschungsankündigung\n\nAltus Bau und Logistik GmbH\nGesellschaft mit beschränkter Haftung\nFrankfurt am Main\n\nDas Registergericht beabsichtigt die im Handelsregister eingetragene Gesellschaft von Amts wegen nach § 394 FamFG zu löschen. Die Frist zur Erhebung eines Widerspruchs gegen die beabsichtigte Löschung wird auf 1 Monat festgesetzt."
    }
  ]
}