{
  "date": "2025-05-24",
  "date_of_scrape": "2025-05-31T12:52:09.475Z",
  "tool_version": "0.2.0",
  "number_of_announcements": 20,
  "announcements": [
    {
      "date": "2025-05-24",
      "id": "110120",
      "original_text": "Registerbekanntmachung nach dem Umwandlungsgesetz\nBayern Amtsgericht Bamberg HRB 5224\nB und T Marketing GmbH – Oberhaid, Ortsteil Unterhaid",
      "type": "Registerbekanntmachung nach dem Umwandlungsgesetz",
      "state": "Bayern",
      "amtsgericht": "Amtsgericht Bamberg",
      "registernummer": "HRB 5224",
      "registerart": "HRB",
      "company_name": "B und T Marketing GmbH",
      "company_seat": "Oberhaid, Ortsteil Unterhaid",
      "details": "24.05.2025 (Bekanntmachungsdatum)\n\nBayern Amtsgericht Bamberg HRB 5224\nRegisterbekanntmachung nach dem Umwandlungsgesetz 23.05.2025 (Eintragungsdatum)\n\nB und T Marketing GmbH\nGesellschaft mit beschränkter Haftung\nOberhaid, Ortsteil Unterhaid\n\nDen Gläubigern des formwechselnden Rechtsträgers ist, wenn sie binnen sechs Monaten nach dem Tag, an dem die Eintragung des Formwechsels nach § 201 UmwG als bekannt gemacht gilt, ihren Anspruch nach Grund und Höhe in Textform anmelden, Sicherheit zu leisten, soweit sie nicht Befriedigung verlangen können. Dieses Recht steht den Gläubigern jedoch nur zu, wenn sie glaubhaft machen, dass durch den Formwechsel die Erfüllung ihrer Forderung gefährdet wird."
    },
    {
      "date": "2025-05-24",
      "id": "110121",
      "original_text": "Einreichung neuer Dokumente\nBayern Amtsgericht München HRB 185340\nArabella Hospitality SE – München",
      "type": "Einreichung neuer Dokumente",
      "state": "Bayern",
      "amtsgericht": "Amtsgericht München",
      "registernummer": "HRB 185340",
      "registerart": "HRB",
      "company_name": "Arabella Hospitality SE",
      "company_seat": "München",
      "details": "24.05.2025 (Bekanntmachungsdatum)\n\nBayern Amtsgericht München HRB 185340\nEinreichung neuer Dokumente\n\nArabella Hospitality SE\nEuropäische Aktiengesellschaft (SE)\nMünchen\n\nDem Amtsgericht München -Registergericht- ist eine Liste der Mitglieder des Aufsichtsrats eingereicht worden, Art. 9 Abs. 1 Buchst. c (ii) SE-VO i.V.m. § 106 AktG."
    },
    {
      "date": "2025-05-24",
      "id": "110122",
      "original_text": "Registerbekanntmachung nach dem Umwandlungsgesetz\nBayern Amtsgericht Regensburg HRB 11073\nGEPARD GmbH – Regensburg",
      "type": "Registerbekanntmachung nach dem Umwandlungsgesetz",
      "state": "Bayern",
      "amtsgericht": "Amtsgericht Regensburg",
      "registernummer": "HRB 11073",
      "registerart": "HRB",
      "company_name": "GEPARD GmbH",
      "company_seat": "Regensburg",
      "details": "24.05.2025 (Bekanntmachungsdatum)\n\nBayern Amtsgericht Regensburg HRB 11073\nRegisterbekanntmachung nach dem Umwandlungsgesetz 23.05.2025 (Eintragungsdatum)\n\nGEPARD GmbH\nGesellschaft mit beschränkter Haftung\nRegensburg\n\nDen Gläubigern der an der Verschmelzung beteiligten Rechtsträger ist, wenn sie binnen sechs Monaten nach dem Tag, an dem die Eintragung der Verschmelzung in das Register des Sitzes desjenigen Rechtsträgers, dessen Gläubiger sie sind, nach § 19 Abs. 3 UmwG als bekannt gemacht gilt, ihren Anspruch nach Grund und Höhe in Textform anmelden, Sicherheit zu leisten, soweit sie nicht Befriedigung verlangen können. Dieses Recht steht den Gläubigern jedoch nur zu, wenn sie glaubhaft machen, dass durch die Verschmelzung die Erfüllung ihrer Forderung gefährdet wird."
    },
    {
      "date": "2025-05-24",
      "id": "110123",
      "original_text": "Einreichung neuer Dokumente\nBayern Amtsgericht München HRB 269868\nHalifax Management Advisory AG – Grünwald",
      "type": "Einreichung neuer Dokumente",
      "state": "Bayern",
      "amtsgericht": "Amtsgericht München",
      "registernummer": "HRB 269868",
      "registerart": "HRB",
      "company_name": "Halifax Management Advisory AG",
      "company_seat": "Grünwald",
      "details": "24.05.2025 (Bekanntmachungsdatum)\n\nBayern Amtsgericht München HRB 269868\nEinreichung neuer Dokumente\n\nHalifax Management Advisory AG\nAktiengesellschaft\nGrünwald\n\nDem Amtsgericht München -Registergericht- ist eine Liste der Mitglieder des Aufsichtsrats eingereicht worden, § 106 AktG."
    },
    {
      "date": "2025-05-24",
      "id": "110124",
      "original_text": "Einreichung neuer Dokumente\nBayern Amtsgericht München HRB 123660\nBayern-Versicherung Lebensversicherung Aktiengesellschaft – München",
      "type": "Einreichung neuer Dokumente",
      "state": "Bayern",
      "amtsgericht": "Amtsgericht München",
      "registernummer": "HRB 123660",
      "registerart": "HRB",
      "company_name": "Bayern-Versicherung Lebensversicherung Aktiengesellschaft",
      "company_seat": "München",
      "details": "24.05.2025 (Bekanntmachungsdatum)\n\nBayern Amtsgericht München HRB 123660\nEinreichung neuer Dokumente\n\nBayern-Versicherung Lebensversicherung Aktiengesellschaft\nAktiengesellschaft\nMünchen\n\nDem Amtsgericht München -Registergericht- ist eine Liste der Mitglieder des Aufsichtsrats eingereicht worden, § 106 AktG."
    },
    {
      "date": "2025-05-24",
      "id": "110125",
      "original_text": "Einreichung neuer Dokumente\nBayern Amtsgericht München HRB 85840\nCONTIGAS Deutsche Energie-Aktiengesellschaft – München",
      "type": "Einreichung neuer Dokumente",
      "state": "Bayern",
      "amtsgericht": "Amtsgericht München",
      "registernummer": "HRB 85840",
      "registerart": "HRB",
      "company_name": "CONTIGAS Deutsche Energie-Aktiengesellschaft",
      "company_seat": "München",
      "details": "24.05.2025 (Bekanntmachungsdatum)\n\nBayern Amtsgericht München HRB 85840\nEinreichung neuer Dokumente\n\nCONTIGAS Deutsche Energie-Aktiengesellschaft\nAktiengesellschaft\nMünchen\n\nDem Amtsgericht München -Registergericht- ist eine Liste der Mitglieder des Aufsichtsrats eingereicht worden, § 106 AktG."
    },
    {
      "date": "2025-05-24",
      "id": "110126",
      "original_text": "Einreichung neuer Dokumente\nBayern Amtsgericht München HRB 109326\nTÜV SÜD Aktiengesellschaft – München",
      "type": "Einreichung neuer Dokumente",
      "state": "Bayern",
      "amtsgericht": "Amtsgericht München",
      "registernummer": "HRB 109326",
      "registerart": "HRB",
      "company_name": "TÜV SÜD Aktiengesellschaft",
      "company_seat": "München",
      "details": "24.05.2025 (Bekanntmachungsdatum)\n\nBayern Amtsgericht München HRB 109326\nEinreichung neuer Dokumente 23.05.2025 (Eintragungsdatum)\n\nTÜV SÜD Aktiengesellschaft\nAktiengesellschaft\nMünchen\n\nDem Amtsgericht München -Registergericht- ist eine Liste der Mitglieder des Aufsichtsrats eingereicht worden, § 106 AktG."
    },
    {
      "date": "2025-05-24",
      "id": "110127",
      "original_text": "Einreichung neuer Dokumente\nBayern Amtsgericht München HRB 176747\nWaterRise AG – München",
      "type": "Einreichung neuer Dokumente",
      "state": "Bayern",
      "amtsgericht": "Amtsgericht München",
      "registernummer": "HRB 176747",
      "registerart": "HRB",
      "company_name": "WaterRise AG",
      "company_seat": "München",
      "details": "24.05.2025 (Bekanntmachungsdatum)\n\nBayern Amtsgericht München HRB 176747\nEinreichung neuer Dokumente 23.05.2025 (Eintragungsdatum)\n\nWaterRise AG\nAktiengesellschaft\nMünchen\n\nDem Amtsgericht München -Registergericht- ist eine Liste der Mitglieder des Aufsichtsrats eingereicht worden, § 106 AktG."
    },
    {
      "date": "2025-05-24",
      "id": "110128",
      "original_text": "Registerbekanntmachung nach dem Umwandlungsgesetz\nBayern Amtsgericht Bamberg HRA 13371\nB & B Marketing GmbH & Co. KG – Oberhaid OT Unterhaid",
      "type": "Registerbekanntmachung nach dem Umwandlungsgesetz",
      "state": "Bayern",
      "amtsgericht": "Amtsgericht Bamberg",
      "registernummer": "HRA 13371",
      "registerart": "HRA",
      "company_name": "B & B Marketing GmbH & Co. KG",
      "company_seat": "Oberhaid OT Unterhaid",
      "details": "24.05.2025 (Bekanntmachungsdatum)\n\nBayern Amtsgericht Bamberg HRA 13371\nRegisterbekanntmachung nach dem Umwandlungsgesetz 23.05.2025 (Eintragungsdatum)\n\nB & B Marketing GmbH & Co. KG\nKommanditgesellschaft\nOberhaid OT Unterhaid\n\nDen Gläubigern des formwechselnden Rechtsträgers ist, wenn sie binnen sechs Monaten nach dem Tag, an dem die Eintragung des Formwechsels nach § 201 UmwG als bekannt gemacht gilt, ihren Anspruch nach Grund und Höhe in Textform anmelden, Sicherheit zu leisten, soweit sie nicht Befriedigung verlangen können. Dieses Recht steht den Gläubigern jedoch nur zu, wenn sie glaubhaft machen, dass durch den Formwechsel die Erfüllung ihrer Forderung gefährdet wird."
    },
    {
      "date": "2025-05-24",
      "id": "110129",
      "original_text": "Registerbekanntmachung nach dem Umwandlungsgesetz\nBayern Amtsgericht Augsburg HRB 34137\nStaber GmbH – Holzheim",
      "type": "Registerbekanntmachung nach dem Umwandlungsgesetz",
      "state": "Bayern",
      "amtsgericht": "Amtsgericht Augsburg",
      "registernummer": "HRB 34137",
      "registerart": "HRB",
      "company_name": "Staber GmbH",
      "company_seat": "Holzheim",
      "details": "24.05.2025 (Bekanntmachungsdatum)\n\nBayern Amtsgericht Augsburg HRB 34137\nRegisterbekanntmachung nach dem Umwandlungsgesetz 23.05.2025 (Eintragungsdatum)\n\nStaber GmbH\nGesellschaft mit beschränkter Haftung\nHolzheim\n\nDen Gläubigern der an der Verschmelzung beteiligten Rechtsträger ist, wenn sie binnen sechs Monaten nach dem Tag, an dem die Eintragung der Verschmelzung in das Register des Sitzes desjenigen Rechtsträgers, dessen Gläubiger sie sind, nach § 19 Abs. 3 UmwG als bekannt gemacht gilt, ihren Anspruch nach Grund und Höhe in Textform anmelden, Sicherheit zu leisten, soweit sie nicht Befriedigung verlangen können. Dieses Recht steht den Gläubigern jedoch nur zu, wenn sie glaubhaft machen, dass durch die Verschmelzung die Erfüllung ihrer Forderung gefährdet wird."
    },
    {
      "date": "2025-05-24",
      "id": "110130",
      "original_text": "Registerbekanntmachung nach dem Umwandlungsgesetz\nBayern Amtsgericht München HRB 156897\nImage Professionals GmbH – München",
      "type": "Registerbekanntmachung nach dem Umwandlungsgesetz",
      "state": "Bayern",
      "amtsgericht": "Amtsgericht München",
      "registernummer": "HRB 156897",
      "registerart": "HRB",
      "company_name": "Image Professionals GmbH",
      "company_seat": "München",
      "details": "24.05.2025 (Bekanntmachungsdatum)\n\nBayern Amtsgericht München HRB 156897\nRegisterbekanntmachung nach dem Umwandlungsgesetz 23.05.2025 (Eintragungsdatum)\n\nImage Professionals GmbH\nGesellschaft mit beschränkter Haftung\nMünchen\n\nDen Gläubigern der an der Verschmelzung beteiligten Rechtsträger ist, wenn sie binnen sechs Monaten nach dem Tag, an dem die Eintragung der Verschmelzung in das Register des Sitzes desjenigen Rechtsträgers, dessen Gläubiger sie sind, nach § 19 Abs. 3 UmwG als bekannt gemacht gilt, ihren Anspruch nach Grund und Höhe in Textform anmelden, Sicherheit zu leisten, soweit sie nicht Befriedigung verlangen können. Dieses Recht steht den Gläubigern jedoch nur zu, wenn sie glaubhaft machen, dass durch die Verschmelzung die Erfüllung ihrer Forderung gefährdet wird."
    },
    {
      "date": "2025-05-24",
      "id": "110131",
      "original_text": "Einreichung neuer Dokumente\nBayern Amtsgericht München HRB 264823\nBayWa r.e. AG – München",
      "type": "Einreichung neuer Dokumente",
      "state": "Bayern",
      "amtsgericht": "Amtsgericht München",
      "registernummer": "HRB 264823",
      "registerart": "HRB",
      "company_name": "BayWa r.e. AG",
      "company_seat": "München",
      "details": "24.05.2025 (Bekanntmachungsdatum)\n\nBayern Amtsgericht München HRB 264823\nEinreichung neuer Dokumente 23.05.2025 (Eintragungsdatum)\n\nBayWa r.e. AG\nAktiengesellschaft\nMünchen\n\nDem Amtsgericht München -Registergericht- ist eine Liste der Mitglieder des Aufsichtsrats eingereicht worden, § 106 AktG."
    },
    {
      "date": "2025-05-24",
      "id": "110132",
      "original_text": "Einreichung neuer Dokumente\nBayern Amtsgericht München HRB 157206\nMTU Aero Engines AG – München",
      "type": "Einreichung neuer Dokumente",
      "state": "Bayern",
      "amtsgericht": "Amtsgericht München",
      "registernummer": "HRB 157206",
      "registerart": "HRB",
      "company_name": "MTU Aero Engines AG",
      "company_seat": "München",
      "details": "24.05.2025 (Bekanntmachungsdatum)\n\nBayern Amtsgericht München HRB 157206\nEinreichung neuer Dokumente 23.05.2025 (Eintragungsdatum)\n\nMTU Aero Engines AG\nAktiengesellschaft\nMünchen\n\nDem Amtsgericht München -Registergericht- ist eine Liste der Mitglieder des Aufsichtsrats eingereicht worden, § 106 AktG."
    },
    {
      "date": "2025-05-24",
      "id": "110133",
      "original_text": "Registerbekanntmachung nach dem Umwandlungsgesetz\nBayern Amtsgericht Schweinfurt HRB 1698\nBöhm GmbH – Schweinfurt",
      "type": "Registerbekanntmachung nach dem Umwandlungsgesetz",
      "state": "Bayern",
      "amtsgericht": "Amtsgericht Schweinfurt",
      "registernummer": "HRB 1698",
      "registerart": "HRB",
      "company_name": "Böhm GmbH",
      "company_seat": "Schweinfurt",
      "details": "24.05.2025 (Bekanntmachungsdatum)\n\nBayern Amtsgericht Schweinfurt HRB 1698\nRegisterbekanntmachung nach dem Umwandlungsgesetz 23.05.2025 (Eintragungsdatum)\n\nBöhm GmbH\nGesellschaft mit beschränkter Haftung\nSchweinfurt\n\nDen Gläubigern der an der Verschmelzung beteiligten Rechtsträger ist, wenn sie binnen sechs Monaten nach dem Tag, an dem die Eintragung der Verschmelzung in das Register des Sitzes desjenigen Rechtsträgers, dessen Gläubiger sie sind, nach § 19 Abs. 3 UmwG als bekannt gemacht gilt, ihren Anspruch nach Grund und Höhe in Textform anmelden, Sicherheit zu leisten, soweit sie nicht Befriedigung verlangen können. Dieses Recht steht den Gläubigern jedoch nur zu, wenn sie glaubhaft machen, dass durch die Verschmelzung die Erfüllung ihrer Forderung gefährdet wird."
    },
    {
      "date": "2025-05-24",
      "id": "110134",
      "original_text": "Registerbekanntmachung nach dem Umwandlungsgesetz\nBayern Amtsgericht München HRA 120690\nGEWO Projekt 1 GmbH & Co. KG – Wörth",
      "type": "Registerbekanntmachung nach dem Umwandlungsgesetz",
      "state": "Bayern",
      "amtsgericht": "Amtsgericht München",
      "registernummer": "HRA 120690",
      "registerart": "HRA",
      "company_name": "GEWO Projekt 1 GmbH & Co. KG",
      "company_seat": "Wörth",
      "details": "24.05.2025 (Bekanntmachungsdatum)\n\nBayern Amtsgericht München HRA 120690\nRegisterbekanntmachung nach dem Umwandlungsgesetz 23.05.2025 (Eintragungsdatum)\n\nGEWO Projekt 1 GmbH & Co. KG\nKommanditgesellschaft\nWörth\n\nDen Gläubigern der an der Ausgliederung beteiligten Rechtsträger ist, wenn sie binnen sechs Monaten nach dem Tag, an dem die Eintragung der Ausgliederung in das Register des Sitzes desjenigen Rechtsträgers, dessen Gläubiger sie sind, nach §§ 125, 19 Abs. 3 UmwG als bekannt gemacht gilt, ihren Anspruch nach Grund und Höhe in Textform anmelden, Sicherheit zu leisten, soweit sie nicht Befriedigung verlangen können. Dieses Recht steht den Gläubigern jedoch nur zu, wenn sie glaubhaft machen, dass durch die Ausgliederung die Erfüllung ihrer Forderung gefährdet wird."
    },
    {
      "date": "2025-05-24",
      "id": "110135",
      "original_text": "Einreichung neuer Dokumente\nBayern Amtsgericht München HRB 173995\nPartnerFonds AG – Planegg",
      "type": "Einreichung neuer Dokumente",
      "state": "Bayern",
      "amtsgericht": "Amtsgericht München",
      "registernummer": "HRB 173995",
      "registerart": "HRB",
      "company_name": "PartnerFonds AG",
      "company_seat": "Planegg",
      "details": "24.05.2025 (Bekanntmachungsdatum)\n\nBayern Amtsgericht München HRB 173995\nEinreichung neuer Dokumente\n\nPartnerFonds AG\nAktiengesellschaft\nPlanegg\n\nDem #Re.Name ist eine Liste der Mitglieder des Aufsichtsrats eingereicht worden, § 106 AktG."
    },
    {
      "date": "2025-05-24",
      "id": "110136",
      "original_text": "Registerbekanntmachung nach dem Umwandlungsgesetz\nBayern Amtsgericht München HRB 132417\nPentos Aktiengesellschaft – München",
      "type": "Registerbekanntmachung nach dem Umwandlungsgesetz",
      "state": "Bayern",
      "amtsgericht": "Amtsgericht München",
      "registernummer": "HRB 132417",
      "registerart": "HRB",
      "company_name": "Pentos Aktiengesellschaft",
      "company_seat": "München",
      "details": "24.05.2025 (Bekanntmachungsdatum)\n\nBayern Amtsgericht München HRB 132417\nRegisterbekanntmachung nach dem Umwandlungsgesetz 23.05.2025 (Eintragungsdatum)\n\nPentos Aktiengesellschaft\nAktiengesellschaft\nMünchen\n\nDen Gläubigern der an der Verschmelzung beteiligten Rechtsträger ist, wenn sie binnen sechs Monaten nach dem Tag, an dem die Eintragung der Verschmelzung in das Register des Sitzes desjenigen Rechtsträgers, dessen Gläubiger sie sind, nach § 19 Abs. 3 UmwG als bekannt gemacht gilt, ihren Anspruch nach Grund und Höhe in Textform anmelden, Sicherheit zu leisten, soweit sie nicht Befriedigung verlangen können. Dieses Recht steht den Gläubigern jedoch nur zu, wenn sie glaubhaft machen, dass durch die Verschmelzung die Erfüllung ihrer Forderung gefährdet wird."
    },
    {
      "date": "2025-05-24",
      "id": "110137",
      "original_text": "Einreichung neuer Dokumente\nBayern Amtsgericht Aschaffenburg HRB 4436\ncurasan AG – Kleinostheim",
      "type": "Einreichung neuer Dokumente",
      "state": "Bayern",
      "amtsgericht": "Amtsgericht Aschaffenburg",
      "registernummer": "HRB 4436",
      "registerart": "HRB",
      "company_name": "curasan AG",
      "company_seat": "Kleinostheim",
      "details": "24.05.2025 (Bekanntmachungsdatum)\n\nBayern Amtsgericht Aschaffenburg HRB 4436\nEinreichung neuer Dokumente 23.05.2025 (Eintragungsdatum)\n\ncurasan AG\nAktiengesellschaft\nKleinostheim\n\nDem Amtsgericht Aschaffenburg -Registergericht- ist eine Liste der Mitglieder des Aufsichtsrats eingereicht worden, § 106 AktG."
    },
    {
      "date": "2025-05-24",
      "id": "110138",
      "original_text": "Registerbekanntmachung nach dem Umwandlungsgesetz\nBayern Amtsgericht München HRB 201846\nWealthCap Entity Service GmbH – München",
      "type": "Registerbekanntmachung nach dem Umwandlungsgesetz",
      "state": "Bayern",
      "amtsgericht": "Amtsgericht München",
      "registernummer": "HRB 201846",
      "registerart": "HRB",
      "company_name": "WealthCap Entity Service GmbH",
      "company_seat": "München",
      "details": "24.05.2025 (Bekanntmachungsdatum)\n\nBayern Amtsgericht München HRB 201846\nRegisterbekanntmachung nach dem Umwandlungsgesetz 23.05.2025 (Eintragungsdatum)\n\nWealthCap Entity Service GmbH\nGesellschaft mit beschränkter Haftung\nMünchen\n\nDen Gläubigern der an der Verschmelzung beteiligten Rechtsträger ist, wenn sie binnen sechs Monaten nach dem Tag, an dem die Eintragung der Verschmelzung in das Register des Sitzes desjenigen Rechtsträgers, dessen Gläubiger sie sind, nach § 19 Abs. 3 UmwG als bekannt gemacht gilt, ihren Anspruch nach Grund und Höhe in Textform anmelden, Sicherheit zu leisten, soweit sie nicht Befriedigung verlangen können. Dieses Recht steht den Gläubigern jedoch nur zu, wenn sie glaubhaft machen, dass durch die Verschmelzung die Erfüllung ihrer Forderung gefährdet wird."
    },
    {
      "date": "2025-05-24",
      "id": "110139",
      "original_text": "Registerbekanntmachung nach dem Umwandlungsgesetz\nNordrhein-Westfalen Amtsgericht Hamm HRB 11868\nGöke GmbH – Hamm",
      "type": "Registerbekanntmachung nach dem Umwandlungsgesetz",
      "state": "Nordrhein-Westfalen",
      "amtsgericht": "Amtsgericht Hamm",
      "registernummer": "HRB 11868",
      "registerart": "HRB",
      "company_name": "Göke GmbH",
      "company_seat": "Hamm",
      "details": "24.05.2025 (Bekanntmachungsdatum)\n\nNordrhein-Westfalen Amtsgericht Hamm HRB 11868\nRegisterbekanntmachung nach dem Umwandlungsgesetz 24.05.2025 (Eintragungsdatum)\n\nGöke GmbH\nGesellschaft mit beschränkter Haftung\nHamm\n\nDen Gläubigern der an der formwechselnden Umwandlung beteiligten Rechtsträger ist, wenn sie binnen sechs Monaten nach dem Tag, an dem die Eintragung der formwechselnden Umwandlung in das Register des Sitzes desjenigen Rechtsträgers, dessen Gläubiger sie sind, nach § 19 Absatz 3 UmwG als bekanntgemacht gilt, ihren Anspruch nach Grund und Höhe schriftlich anmelden, Sicherheit zu leisten, soweit sie nicht Befriedigung verlangen können. Dieses Recht steht den Gläubigern jedoch nur zu, wenn sie glaubhaft machen, dass durch die formwechselnden Umwandlung die Erfüllung ihrer Forderung gefährdet wird."
    }
  ]
}