{
  "date": "2025-05-02",
  "date_of_scrape": "2025-05-31T07:31:59.709Z",
  "tool_version": "0.2.0",
  "number_of_announcements": 94,
  "announcements": [
    {
      "date": "2025-05-02",
      "id": "107886",
      "original_text": "Einreichung neuer Dokumente\nBaden-Württemberg Amtsgericht Mannheim HRB 8006\nIMAP M&A Consultants AG – Mannheim",
      "type": "Einreichung neuer Dokumente",
      "state": "Baden-Württemberg",
      "amtsgericht": "Amtsgericht Mannheim",
      "registernummer": "HRB 8006",
      "registerart": "HRB",
      "company_name": "IMAP M&A Consultants AG",
      "company_seat": "Mannheim",
      "details": "02.05.2025 (Bekanntmachungsdatum)\n\nBaden-Württemberg Amtsgericht Mannheim HRB 8006\nEinreichung neuer Dokumente\n\nIMAP M&A Consultants AG\nAktiengesellschaft\nMannheim\n\nDie Gesellschaft hat am  30.04.2025 die Liste über die Zusammensetzung des Aufsichtsrats zum Handelsregister eingereicht."
    },
    {
      "date": "2025-05-02",
      "id": "107887",
      "original_text": "Registerbekanntmachung nach dem Umwandlungsgesetz\nHamburg Amtsgericht Hamburg HRA 128547\nHeiko Wohlgemuth e.K. – Hamburg",
      "type": "Registerbekanntmachung nach dem Umwandlungsgesetz",
      "state": "Hamburg",
      "amtsgericht": "Amtsgericht Hamburg",
      "registernummer": "HRA 128547",
      "registerart": "HRA",
      "company_name": "Heiko Wohlgemuth e.K.",
      "company_seat": "Hamburg",
      "details": "02.05.2025 (Bekanntmachungsdatum)\n\nHamburg Amtsgericht Hamburg HRA 128547\nRegisterbekanntmachung nach dem Umwandlungsgesetz 02.05.2025 (Eintragungsdatum)\n\nHeiko Wohlgemuth e.K.\nEinzelkaufmann\nHamburg\n\nAls nicht eingetragen wird bekannt gemacht:\nDen Gläubigern der an der Ausgliederung beteiligten Gesellschaften ist, wenn sie binnen sechs Monaten nach dem Tag, an dem die Eintragung der Ausgliederung in das Register des Sitzes desjenigen Rechtsträgers, dessen Gläubiger sie sind, nach § 19 Absatz 3 UmwG als bekannt gemacht gilt, ihren Anspruch nach Grund und Höhe schriftlich anmelden, Sicherheit zu leisten, soweit sie nicht Befriedigung verlangen können. Dieses Recht steht den Gläubigern jedoch nur zu, wenn sie glaubhaft machen, dass durch die Ausgliederung die Erfüllung ihrer Forderung gefährdet wird."
    },
    {
      "date": "2025-05-02",
      "id": "107888",
      "original_text": "Registerbekanntmachung nach dem Umwandlungsgesetz\nHamburg Amtsgericht Hamburg HRB 174977\nDeichcapital GmbH – Hamburg",
      "type": "Registerbekanntmachung nach dem Umwandlungsgesetz",
      "state": "Hamburg",
      "amtsgericht": "Amtsgericht Hamburg",
      "registernummer": "HRB 174977",
      "registerart": "HRB",
      "company_name": "Deichcapital GmbH",
      "company_seat": "Hamburg",
      "details": "02.05.2025 (Bekanntmachungsdatum)\n\nHamburg Amtsgericht Hamburg HRB 174977\nRegisterbekanntmachung nach dem Umwandlungsgesetz 02.05.2025 (Eintragungsdatum)\n\nDeichcapital GmbH\nGesellschaft mit beschränkter Haftung\nHamburg\n\nAls nicht eingetragen wird bekannt gemacht:\nDen Gläubigern der an der Ausgliederung beteiligten Gesellschaften ist, wenn sie binnen sechs Monaten nach dem Tag, an dem die Eintragung der Ausgliederung in das Register des Sitzes desjenigen Rechtsträgers, dessen Gläubiger sie sind, nach § 19 Absatz 3 UmwG als bekannt gemacht gilt, ihren Anspruch nach Grund und Höhe schriftlich anmelden, Sicherheit zu leisten, soweit sie nicht Befriedigung verlangen können. Dieses Recht steht den Gläubigern jedoch nur zu, wenn sie glaubhaft machen, dass durch die Ausgliederung die Erfüllung ihrer Forderung gefährdet wird."
    },
    {
      "date": "2025-05-02",
      "id": "107889",
      "original_text": "Registerbekanntmachung nach dem Umwandlungsgesetz\nHamburg Amtsgericht Hamburg HRB 106017\nTÜV SÜD Auto Partner GmbH – Hamburg",
      "type": "Registerbekanntmachung nach dem Umwandlungsgesetz",
      "state": "Hamburg",
      "amtsgericht": "Amtsgericht Hamburg",
      "registernummer": "HRB 106017",
      "registerart": "HRB",
      "company_name": "TÜV SÜD Auto Partner GmbH",
      "company_seat": "Hamburg",
      "details": "02.05.2025 (Bekanntmachungsdatum)\n\nHamburg Amtsgericht Hamburg HRB 106017\nRegisterbekanntmachung nach dem Umwandlungsgesetz 02.05.2025 (Eintragungsdatum)\n\nTÜV SÜD Auto Partner GmbH\nGesellschaft mit beschränkter Haftung\nHamburg\n\nAls nicht eingetragen wird bekannt gemacht:\nDen Gläubigern der an der Verschmelzung beteiligten Gesellschaften ist, wenn sie binnen sechs Monaten nach dem Tag, an dem die Eintragung der Verschmelzung in das Register des Sitzes desjenigen Rechtsträgers, dessen Gläubiger sie sind, nach § 19 Absatz 3 UmwG als bekannt gemacht gilt, ihren Anspruch nach Grund und Höhe schriftlich anmelden, Sicherheit zu leisten, soweit sie nicht Befriedigung verlangen können. Dieses Recht steht den Gläubigern jedoch nur zu, wenn sie glaubhaft machen, dass durch die Verschmelzung die Erfüllung ihrer Forderung gefährdet wird."
    },
    {
      "date": "2025-05-02",
      "id": "107890",
      "original_text": "Löschungsankündigung\nBerlin Amtsgericht Berlin (Charlottenburg) HRB 175911\nTOGNOS Deep Machine Learning GmbH – Berlin",
      "type": "Löschungsankündigung",
      "state": "Berlin",
      "amtsgericht": "Amtsgericht Berlin (Charlottenburg)",
      "registernummer": "HRB 175911",
      "registerart": "HRB",
      "company_name": "TOGNOS Deep Machine Learning GmbH",
      "company_seat": "Berlin",
      "details": "02.05.2025 (Bekanntmachungsdatum)\n\nBerlin Amtsgericht Berlin (Charlottenburg) HRB 175911\nLöschungsankündigung\n\nTOGNOS Deep Machine Learning GmbH\nGesellschaft mit beschränkter Haftung\nBerlin\n\nBei der nachstehenden Gesellschaft wird das Amtslöschungsverfahren gemäß § 394 FamFG eingeleitet. Widerspruchsfrist 6 Wochen"
    },
    {
      "date": "2025-05-02",
      "id": "107891",
      "original_text": "Registerbekanntmachung nach dem Umwandlungsgesetz\nBaden-Württemberg Amtsgericht Stuttgart HRB 747687\nKeysight Technologies Deutschland GmbH – Böblingen",
      "type": "Registerbekanntmachung nach dem Umwandlungsgesetz",
      "state": "Baden-Württemberg",
      "amtsgericht": "Amtsgericht Stuttgart",
      "registernummer": "HRB 747687",
      "registerart": "HRB",
      "company_name": "Keysight Technologies Deutschland GmbH",
      "company_seat": "Böblingen",
      "details": "02.05.2025 (Bekanntmachungsdatum)\n\nBaden-Württemberg Amtsgericht Stuttgart HRB 747687\nRegisterbekanntmachung nach dem Umwandlungsgesetz 02.05.2025 (Eintragungsdatum)\n\nKeysight Technologies Deutschland GmbH\nGesellschaft mit beschränkter Haftung\nBöblingen\n\nAls nicht eingetragen wird bekanntgemacht:\nDen Gläubigern der an der Verschmelzung beteiligten Rechtsträger ist, wenn sie binnen sechs Monaten nach dem Tag, an dem die Eintragung der Verschmelzung in das Register des Sitzes desjenigen Rechtsträgers, dessen Gläubiger sie sind, nach § 19 Abs. 3 UmwG als bekanntgemacht gilt, ihren Anspruch nach Grund und Höhe schriftlich anmelden, Sicherheit zu leisten, soweit sie nicht Befriedigung verlangen können. Dieses Recht steht den Gläubigern jedoch nur zu, wenn sie glaubhaft machen, dass durch die Verschmelzung die Erfüllung ihrer Forderung gefährdet wird."
    },
    {
      "date": "2025-05-02",
      "id": "107892",
      "original_text": "Registerbekanntmachung nach dem Umwandlungsgesetz\nHamburg Amtsgericht Hamburg HRB 167566\nHausVorteil GmbH – Hamburg",
      "type": "Registerbekanntmachung nach dem Umwandlungsgesetz",
      "state": "Hamburg",
      "amtsgericht": "Amtsgericht Hamburg",
      "registernummer": "HRB 167566",
      "registerart": "HRB",
      "company_name": "HausVorteil GmbH",
      "company_seat": "Hamburg",
      "details": "02.05.2025 (Bekanntmachungsdatum)\n\nHamburg Amtsgericht Hamburg HRB 167566\nRegisterbekanntmachung nach dem Umwandlungsgesetz 02.05.2025 (Eintragungsdatum)\n\nHausVorteil GmbH\nGesellschaft mit beschränkter Haftung\nHamburg\n\nAls nicht eingetragen wird bekannt gemacht:\nDen Gläubigern der an der formwechselnden Umwandlung beteiligten Gesellschaften ist, wenn sie binnen sechs Monaten nach dem Tag, an dem die Eintragung der formwechselnden Umwandlung in das Register des Sitzes desjenigen Rechtsträgers, dessen Gläubiger sie sind, nach § 19 Absatz 3 UmwG als bekannt gemacht gilt, ihren Anspruch nach Grund und Höhe schriftlich anmelden, Sicherheit zu leisten, soweit sie nicht Befriedigung verlangen können. Dieses Recht steht den Gläubigern jedoch nur zu, wenn sie glaubhaft machen, dass durch die formwechselnde Umwandlung die Erfüllung ihrer Forderung gefährdet wird."
    },
    {
      "date": "2025-05-02",
      "id": "107893",
      "original_text": "Registerbekanntmachung nach dem Umwandlungsgesetz\nHamburg Amtsgericht Hamburg HRB 133248\nHypoport Financing GmbH – Hamburg",
      "type": "Registerbekanntmachung nach dem Umwandlungsgesetz",
      "state": "Hamburg",
      "amtsgericht": "Amtsgericht Hamburg",
      "registernummer": "HRB 133248",
      "registerart": "HRB",
      "company_name": "Hypoport Financing GmbH",
      "company_seat": "Hamburg",
      "details": "02.05.2025 (Bekanntmachungsdatum)\n\nHamburg Amtsgericht Hamburg HRB 133248\nRegisterbekanntmachung nach dem Umwandlungsgesetz 02.05.2025 (Eintragungsdatum)\n\nHypoport Financing GmbH\nGesellschaft mit beschränkter Haftung\nHamburg\n\nAls nicht eingetragen wird bekannt gemacht:\nDen Gläubigern der an der Ausgliederung beteiligten Gesellschaften ist, wenn sie binnen sechs Monaten nach dem Tag, an dem die Eintragung der Ausgliederung in das Register des Sitzes desjenigen Rechtsträgers, dessen Gläubiger sie sind, nach § 19 Absatz 3 UmwG als bekannt gemacht gilt, ihren Anspruch nach Grund und Höhe schriftlich anmelden, Sicherheit zu leisten, soweit sie nicht Befriedigung verlangen können. Dieses Recht steht den Gläubigern jedoch nur zu, wenn sie glaubhaft machen, dass durch die Ausgliederung die Erfüllung ihrer Forderung gefährdet wird."
    },
    {
      "date": "2025-05-02",
      "id": "107894",
      "original_text": "Registerbekanntmachung nach dem Umwandlungsgesetz\nHamburg Amtsgericht Hamburg HRB 189965\nMaklaro GmbH – Hamburg",
      "type": "Registerbekanntmachung nach dem Umwandlungsgesetz",
      "state": "Hamburg",
      "amtsgericht": "Amtsgericht Hamburg",
      "registernummer": "HRB 189965",
      "registerart": "HRB",
      "company_name": "Maklaro GmbH",
      "company_seat": "Hamburg",
      "details": "02.05.2025 (Bekanntmachungsdatum)\n\nHamburg Amtsgericht Hamburg HRB 189965\nRegisterbekanntmachung nach dem Umwandlungsgesetz 02.05.2025 (Eintragungsdatum)\n\nMaklaro GmbH\nGesellschaft mit beschränkter Haftung\nHamburg\n\nAls nicht eingetragen wird bekannt gemacht:\nDen Gläubigern der an der Ausgliederung beteiligten Gesellschaften ist, wenn sie binnen sechs Monaten nach dem Tag, an dem die Eintragung der Ausgliederung in das Register des Sitzes desjenigen Rechtsträgers, dessen Gläubiger sie sind, nach § 19 Absatz 3 UmwG als bekannt gemacht gilt, ihren Anspruch nach Grund und Höhe schriftlich anmelden, Sicherheit zu leisten, soweit sie nicht Befriedigung verlangen können. Dieses Recht steht den Gläubigern jedoch nur zu, wenn sie glaubhaft machen, dass durch die Ausgliederung die Erfüllung ihrer Forderung gefährdet wird."
    },
    {
      "date": "2025-05-02",
      "id": "107895",
      "original_text": "Löschungsankündigung\nBaden-Württemberg Amtsgericht Freiburg HRB 714714\n123 TipTop Dienstleistungen GmbH – Freiburg im Breisgau",
      "type": "Löschungsankündigung",
      "state": "Baden-Württemberg",
      "amtsgericht": "Amtsgericht Freiburg",
      "registernummer": "HRB 714714",
      "registerart": "HRB",
      "company_name": "123 TipTop Dienstleistungen GmbH",
      "company_seat": "Freiburg im Breisgau",
      "details": "02.05.2025 (Bekanntmachungsdatum)\n\nBaden-Württemberg Amtsgericht Freiburg HRB 714714\nLöschungsankündigung\n\n123 TipTop Dienstleistungen GmbH\nGesellschaft mit beschränkter Haftung\nFreiburg im Breisgau\n\nAls nicht eingetragen wird bekanntgemacht:\nDas Gericht beabsichtigt, die Gesellschaft wegen Vermögenslosigkeit im Handelsregister von Amts wegen nach § 394 FamFG zu löschen. Die Frist zur Geltendmachung eines Widerspruchs gegen die beabsichtigte Löschung ist auf einen Monat ab Veröffentlichung bestimmt."
    },
    {
      "date": "2025-05-02",
      "id": "107896",
      "original_text": "Registerbekanntmachung nach dem Umwandlungsgesetz\nHamburg Amtsgericht Hamburg HRB 102981\nConduent Germany Holding GmbH – Hamburg",
      "type": "Registerbekanntmachung nach dem Umwandlungsgesetz",
      "state": "Hamburg",
      "amtsgericht": "Amtsgericht Hamburg",
      "registernummer": "HRB 102981",
      "registerart": "HRB",
      "company_name": "Conduent Germany Holding GmbH",
      "company_seat": "Hamburg",
      "details": "02.05.2025 (Bekanntmachungsdatum)\n\nHamburg Amtsgericht Hamburg HRB 102981\nRegisterbekanntmachung nach dem Umwandlungsgesetz 02.05.2025 (Eintragungsdatum)\n\nConduent Germany Holding GmbH\nGesellschaft mit beschränkter Haftung\nHamburg\n\nAls nicht eingetragen wird bekannt gemacht:\nDen Gläubigern der an der Verschmelzung beteiligten Gesellschaften ist, wenn sie binnen sechs Monaten nach dem Tag, an dem die Eintragung der Verschmelzung in das Register des Sitzes desjenigen Rechtsträgers, dessen Gläubiger sie sind, nach § 19 Absatz 3 UmwG als bekannt gemacht gilt, ihren Anspruch nach Grund und Höhe schriftlich anmelden, Sicherheit zu leisten, soweit sie nicht Befriedigung verlangen können. Dieses Recht steht den Gläubigern jedoch nur zu, wenn sie glaubhaft machen, dass durch die Verschmelzung die Erfüllung ihrer Forderung gefährdet wird."
    },
    {
      "date": "2025-05-02",
      "id": "107897",
      "original_text": "Registerbekanntmachung nach dem Umwandlungsgesetz\nHamburg Amtsgericht Hamburg HRB 124827\nConduent Multimedia GmbH – Hamburg",
      "type": "Registerbekanntmachung nach dem Umwandlungsgesetz",
      "state": "Hamburg",
      "amtsgericht": "Amtsgericht Hamburg",
      "registernummer": "HRB 124827",
      "registerart": "HRB",
      "company_name": "Conduent Multimedia GmbH",
      "company_seat": "Hamburg",
      "details": "02.05.2025 (Bekanntmachungsdatum)\n\nHamburg Amtsgericht Hamburg HRB 124827\nRegisterbekanntmachung nach dem Umwandlungsgesetz 02.05.2025 (Eintragungsdatum)\n\nConduent Multimedia GmbH\nGesellschaft mit beschränkter Haftung\nHamburg\n\nAls nicht eingetragen wird bekannt gemacht:\nDen Gläubigern der an der Verschmelzung beteiligten Gesellschaften ist, wenn sie binnen sechs Monaten nach dem Tag, an dem die Eintragung der Verschmelzung in das Register des Sitzes desjenigen Rechtsträgers, dessen Gläubiger sie sind, nach § 19 Absatz 3 UmwG als bekannt gemacht gilt, ihren Anspruch nach Grund und Höhe schriftlich anmelden, Sicherheit zu leisten, soweit sie nicht Befriedigung verlangen können. Dieses Recht steht den Gläubigern jedoch nur zu, wenn sie glaubhaft machen, dass durch die Verschmelzung die Erfüllung ihrer Forderung gefährdet wird."
    },
    {
      "date": "2025-05-02",
      "id": "107898",
      "original_text": "Registerbekanntmachung nach dem Umwandlungsgesetz\nBaden-Württemberg Amtsgericht Freiburg HRB 715681\nHübner Naturarzneimittel GmbH – Ehrenkirchen",
      "type": "Registerbekanntmachung nach dem Umwandlungsgesetz",
      "state": "Baden-Württemberg",
      "amtsgericht": "Amtsgericht Freiburg",
      "registernummer": "HRB 715681",
      "registerart": "HRB",
      "company_name": "Hübner Naturarzneimittel GmbH",
      "company_seat": "Ehrenkirchen",
      "details": "02.05.2025 (Bekanntmachungsdatum)\n\nBaden-Württemberg Amtsgericht Freiburg HRB 715681\nRegisterbekanntmachung nach dem Umwandlungsgesetz 02.05.2025 (Eintragungsdatum)\n\nHübner Naturarzneimittel GmbH\nGesellschaft mit beschränkter Haftung\nEhrenkirchen\n\nAls nicht eingetragen wird bekanntgemacht:\nDen Gläubigern der an der Verschmelzung beteiligten Rechtsträger ist, wenn sie binnen sechs Monaten nach dem Tag, an dem die Eintragung der Verschmelzung in das Register des Sitzes desjenigen Rechtsträgers, dessen Gläubiger sie sind, nach § 19 Abs. 3 UmwG als bekanntgemacht gilt, ihren Anspruch nach Grund und Höhe schriftlich anmelden, Sicherheit zu leisten, soweit sie nicht Befriedigung verlangen können. Dieses Recht steht den Gläubigern jedoch nur zu, wenn sie glaubhaft machen, dass durch die Verschmelzung die Erfüllung ihrer Forderung gefährdet wird."
    },
    {
      "date": "2025-05-02",
      "id": "107899",
      "original_text": "Einreichung neuer Dokumente\nBaden-Württemberg Amtsgericht Stuttgart HRB 733742\nLEDA gemeinnützige GmbH – Leonberg",
      "type": "Einreichung neuer Dokumente",
      "state": "Baden-Württemberg",
      "amtsgericht": "Amtsgericht Stuttgart",
      "registernummer": "HRB 733742",
      "registerart": "HRB",
      "company_name": "LEDA gemeinnützige GmbH",
      "company_seat": "Leonberg",
      "details": "02.05.2025 (Bekanntmachungsdatum)\n\nBaden-Württemberg Amtsgericht Stuttgart HRB 733742\nEinreichung neuer Dokumente 02.05.2025 (Eintragungsdatum)\n\nLEDA gemeinnützige GmbH\nGesellschaft mit beschränkter Haftung\nLeonberg\n\nDie Gesellschaft hat am 30.04.2025 die Liste über die Zusammensetzung des Aufsichtsrats zum Handelsregister eingereicht."
    },
    {
      "date": "2025-05-02",
      "id": "107900",
      "original_text": "Löschungsankündigung\nSchleswig-Holstein Amtsgericht Pinneberg HRB 9258\nThompson Aerospace GmbH – Wedel",
      "type": "Löschungsankündigung",
      "state": "Schleswig-Holstein",
      "amtsgericht": "Amtsgericht Pinneberg",
      "registernummer": "HRB 9258",
      "registerart": "HRB",
      "company_name": "Thompson Aerospace GmbH",
      "company_seat": "Wedel",
      "details": "02.05.2025 (Bekanntmachungsdatum)\n\nSchleswig-Holstein Amtsgericht Pinneberg HRB 9258\nLöschungsankündigung\n\nThompson Aerospace GmbH\nGesellschaft mit beschränkter Haftung\nWedel\n\nEs ist die Löschung der nachstehenden Gesellschaft wegen Vermögenslosigkeit gemäß § 394 FamFG beabsichtigt. Widerspruchsfrist: 2 Monate."
    },
    {
      "date": "2025-05-02",
      "id": "107901",
      "original_text": "Löschungsankündigung\nBerlin Amtsgericht Berlin (Charlottenburg) HRB 166130\nBDS Limousinen GmbH – Berlin",
      "type": "Löschungsankündigung",
      "state": "Berlin",
      "amtsgericht": "Amtsgericht Berlin (Charlottenburg)",
      "registernummer": "HRB 166130",
      "registerart": "HRB",
      "company_name": "BDS Limousinen GmbH",
      "company_seat": "Berlin",
      "details": "02.05.2025 (Bekanntmachungsdatum)\n\nBerlin Amtsgericht Berlin (Charlottenburg) HRB 166130\nLöschungsankündigung\n\nBDS Limousinen GmbH\nGesellschaft mit beschränkter Haftung\nBerlin\n\nBei der nachstehenden Gesellschaft wird das Amtslöschungsverfahren gemäß § 394 FamFG eingeleitet. Widerspruchsfrist 6 Wochen"
    },
    {
      "date": "2025-05-02",
      "id": "107902",
      "original_text": "Löschungsankündigung\nBaden-Württemberg Amtsgericht Mannheim HRB 361215\nUniCar Taxi- und Mietwagen GmbH – Karlsbad",
      "type": "Löschungsankündigung",
      "state": "Baden-Württemberg",
      "amtsgericht": "Amtsgericht Mannheim",
      "registernummer": "HRB 361215",
      "registerart": "HRB",
      "company_name": "UniCar Taxi- und Mietwagen GmbH",
      "company_seat": "Karlsbad",
      "details": "02.05.2025 (Bekanntmachungsdatum)\n\nBaden-Württemberg Amtsgericht Mannheim HRB 361215\nLöschungsankündigung\n\nUniCar Taxi- und Mietwagen GmbH\nGesellschaft mit beschränkter Haftung\nKarlsbad\n\nAls nicht eingetragen wird bekanntgemacht:\nDas Gericht beabsichtigt, die Gesellschaft wegen Vermögenslosigkeit im Handelsregister von Amts wegen nach § 394 FamFG zu löschen. Die Frist zur Geltendmachung eines Widerspruchs gegen die beabsichtigte Löschung ist auf einen Monat ab Veröffentlichung bestimmt."
    },
    {
      "date": "2025-05-02",
      "id": "107903",
      "original_text": "Registerbekanntmachung nach dem Umwandlungsgesetz\nBaden-Württemberg Amtsgericht Mannheim HRB 731157\nMACH ProForms GmbH – Karlsruhe",
      "type": "Registerbekanntmachung nach dem Umwandlungsgesetz",
      "state": "Baden-Württemberg",
      "amtsgericht": "Amtsgericht Mannheim",
      "registernummer": "HRB 731157",
      "registerart": "HRB",
      "company_name": "MACH ProForms GmbH",
      "company_seat": "Karlsruhe",
      "details": "02.05.2025 (Bekanntmachungsdatum)\n\nBaden-Württemberg Amtsgericht Mannheim HRB 731157\nRegisterbekanntmachung nach dem Umwandlungsgesetz 02.05.2025 (Eintragungsdatum)\n\nMACH ProForms GmbH\nGesellschaft mit beschränkter Haftung\nKarlsruhe\n\nAls nicht eingetragen wird bekanntgemacht:\nDen Gläubigern der an der Verschmelzung beteiligten Rechtsträger ist, wenn sie binnen sechs Monaten nach dem Tag, an dem die Eintragung der Verschmelzung in das Register des Sitzes desjenigen Rechtsträgers, dessen Gläubiger sie sind, nach § 19 Abs. 3 UmwG als bekanntgemacht gilt, ihren Anspruch nach Grund und Höhe schriftlich anmelden, Sicherheit zu leisten, soweit sie nicht Befriedigung verlangen können. Dieses Recht steht den Gläubigern jedoch nur zu, wenn sie glaubhaft machen, dass durch die Verschmelzung die Erfüllung ihrer Forderung gefährdet wird."
    },
    {
      "date": "2025-05-02",
      "id": "107904",
      "original_text": "Registerbekanntmachung nach dem Umwandlungsgesetz\nHamburg Amtsgericht Hamburg HRB 154102\nConnected Infrastructure Capital GmbH – Hamburg",
      "type": "Registerbekanntmachung nach dem Umwandlungsgesetz",
      "state": "Hamburg",
      "amtsgericht": "Amtsgericht Hamburg",
      "registernummer": "HRB 154102",
      "registerart": "HRB",
      "company_name": "Connected Infrastructure Capital GmbH",
      "company_seat": "Hamburg",
      "details": "02.05.2025 (Bekanntmachungsdatum)\n\nHamburg Amtsgericht Hamburg HRB 154102\nRegisterbekanntmachung nach dem Umwandlungsgesetz 02.05.2025 (Eintragungsdatum)\n\nConnected Infrastructure Capital GmbH\nGesellschaft mit beschränkter Haftung\nHamburg\n\nAls nicht eingetragen wird bekannt gemacht:\nDen Gläubigern der an der Verschmelzung beteiligten Gesellschaften ist, wenn sie binnen sechs Monaten nach dem Tag, an dem die Eintragung der Verschmelzung in das Register des Sitzes desjenigen Rechtsträgers, dessen Gläubiger sie sind, nach § 19 Absatz 3 UmwG als bekannt gemacht gilt, ihren Anspruch nach Grund und Höhe schriftlich anmelden, Sicherheit zu leisten, soweit sie nicht Befriedigung verlangen können. Dieses Recht steht den Gläubigern jedoch nur zu, wenn sie glaubhaft machen, dass durch die Verschmelzung die Erfüllung ihrer Forderung gefährdet wird."
    },
    {
      "date": "2025-05-02",
      "id": "107905",
      "original_text": "Registerbekanntmachung nach dem Umwandlungsgesetz\nHamburg Amtsgericht Hamburg HRB 154366\nCIC Verwaltungs GmbH – Hamburg",
      "type": "Registerbekanntmachung nach dem Umwandlungsgesetz",
      "state": "Hamburg",
      "amtsgericht": "Amtsgericht Hamburg",
      "registernummer": "HRB 154366",
      "registerart": "HRB",
      "company_name": "CIC Verwaltungs GmbH",
      "company_seat": "Hamburg",
      "details": "02.05.2025 (Bekanntmachungsdatum)\n\nHamburg Amtsgericht Hamburg HRB 154366\nRegisterbekanntmachung nach dem Umwandlungsgesetz 02.05.2025 (Eintragungsdatum)\n\nCIC Verwaltungs GmbH\nGesellschaft mit beschränkter Haftung\nHamburg\n\nAls nicht eingetragen wird bekannt gemacht:\nDen Gläubigern der an der Verschmelzung beteiligten Gesellschaften ist, wenn sie binnen sechs Monaten nach dem Tag, an dem die Eintragung der Verschmelzung in das Register des Sitzes desjenigen Rechtsträgers, dessen Gläubiger sie sind, nach § 19 Absatz 3 UmwG als bekannt gemacht gilt, ihren Anspruch nach Grund und Höhe schriftlich anmelden, Sicherheit zu leisten, soweit sie nicht Befriedigung verlangen können. Dieses Recht steht den Gläubigern jedoch nur zu, wenn sie glaubhaft machen, dass durch die Verschmelzung die Erfüllung ihrer Forderung gefährdet wird."
    },
    {
      "date": "2025-05-02",
      "id": "107906",
      "original_text": "Registerbekanntmachung nach dem Umwandlungsgesetz\nBaden-Württemberg Amtsgericht Stuttgart HRB 770790\ngrooves & dimples gmbH – Weinsberg",
      "type": "Registerbekanntmachung nach dem Umwandlungsgesetz",
      "state": "Baden-Württemberg",
      "amtsgericht": "Amtsgericht Stuttgart",
      "registernummer": "HRB 770790",
      "registerart": "HRB",
      "company_name": "grooves & dimples gmbH",
      "company_seat": "Weinsberg",
      "details": "02.05.2025 (Bekanntmachungsdatum)\n\nBaden-Württemberg Amtsgericht Stuttgart HRB 770790\nRegisterbekanntmachung nach dem Umwandlungsgesetz 02.05.2025 (Eintragungsdatum)\n\ngrooves & dimples gmbH\nGesellschaft mit beschränkter Haftung\nWeinsberg\n\nAls nicht eingetragen wird bekanntgemacht:\nDen Gläubigern dern an der grenzüberschreitenden Verschmelzung beteiligten übernehmenden Rechtsträger ist, wenn sie binnen sechs Monaten nach dem Tag, an dem die Eintragung der Verschmelzung in das Register des Sitzes desjenigen Rechtsträgers, dessen Gläubiger sie sind, nach § 19 Absatz 3 UmwG als bekanntgemacht gilt, ihren Anspruch nach Grund und Höhe schriftlich anmelden, Sicherheit zu leisten, soweit sie nicht Befriedigung verlangen können. Dieses Recht steht den Gläubigern jedoch nur zu, wenn sie glaubhaft machen, dass durch die Verschmelzung die Erfüllung ihrer Forderung gefährdet wird."
    },
    {
      "date": "2025-05-02",
      "id": "107907",
      "original_text": "Sonstige Registerbekanntmachung\nSchleswig-Holstein Amtsgericht Lübeck HRB 24256\nSH Service Hanse GmbH – Glinde",
      "type": "Sonstige Registerbekanntmachung",
      "state": "Schleswig-Holstein",
      "amtsgericht": "Amtsgericht Lübeck",
      "registernummer": "HRB 24256",
      "registerart": "HRB",
      "company_name": "SH Service Hanse GmbH",
      "company_seat": "Glinde",
      "details": "02.05.2025 (Bekanntmachungsdatum)\n\nSchleswig-Holstein Amtsgericht Lübeck HRB 24256\nSonstige Registerbekanntmachung\n\nSH Service Hanse GmbH\nGesellschaft mit beschränkter Haftung\nGlinde\n\nAls nicht eingetragen wird folgendes Schreiben veröffentlicht, da die jetzige Anschrift des GF nicht zu ermitteln ist:\nHerrn\nMichael Dawid Cislak\nfrüher: Schöneberger Straße 5\n40789 Monheim am Rhein\n\nSehr geehrter Herr Cislak,\n\nin der Handelsregistersache der\nSH Service Hanse GmbH\nergeben sich aus den mir vorliegenden Unterlagen, nämlich Schreiben des Finanzamtes\nStormarn vom 12.03.2025\nAnhaltspunkte dafür, dass die Gesellschaft, als deren Geschäftsführer Sie noch eingetragen\nsind, vermögenslos ist.\nIch prüfe daher, ob die Gesellschaft wegen Vermögenslosigkeit gemäß § 394 FamFG zu\nlöschen ist.\nIch gebe Ihnen Gelegenheit, dazu binnen einer Frist von 1 Monat Stellung zu nehmen.\n\nWeiter bitte ich Sie, binnen derselben Frist folgende Auskünfte zu erteilen:\n- Hat die obige Gesellschaft noch Vermögen? Wenn ja, welche\nVermögensgegenstände besitzt sie?\n- Ist die Gesellschaft Partei eines noch nicht rechtskräftig abgeschlossenen\nRechtsstreits?\n- Findet sonst noch eine Abwicklung statt?\n\nWolski, Dipl.-Rechtspflegerin (FH)"
    },
    {
      "date": "2025-05-02",
      "id": "107908",
      "original_text": "Registerbekanntmachung nach dem Umwandlungsgesetz\nBerlin Amtsgericht Berlin (Charlottenburg) HRB 239396\nThrasio Deutschland Services GmbH – Berlin",
      "type": "Registerbekanntmachung nach dem Umwandlungsgesetz",
      "state": "Berlin",
      "amtsgericht": "Amtsgericht Berlin (Charlottenburg)",
      "registernummer": "HRB 239396",
      "registerart": "HRB",
      "company_name": "Thrasio Deutschland Services GmbH",
      "company_seat": "Berlin",
      "details": "02.05.2025 (Bekanntmachungsdatum)\n\nBerlin Amtsgericht Berlin (Charlottenburg) HRB 239396\nRegisterbekanntmachung nach dem Umwandlungsgesetz 29.04.2025 (Eintragungsdatum)\n\nThrasio Deutschland Services GmbH\nGesellschaft mit beschränkter Haftung\nBerlin\n\nZu Eintragungsnummer 6 vom 29.04.2025 wird als nicht eingetragen veröffentlicht: Den Gläubigern der an der Verschmelzung beteiligten Rechtsträger ist, wenn sie binnen sechs Monaten nach dem Tag, an dem die Eintragung der Verschmelzung in das Register des Sitzes desjenigen Rechtsträgers, dessen Gläubiger sie sind, als bekannt gemacht gilt, ihren Anspruch nach Grund und Höhe schriftlich anmelden, Sicherheit zu leisten, soweit sie nicht Befriedigung verlangen können. Dieses Recht steht den Gläubigern jedoch nur zu, wenn sie glaubhaft machen, dass durch die Verschmelzung die Erfüllung ihrer Forderung gefährdet wird. Das Recht, Sicherheitsleistung zu verlangen, steht Gläubigern nicht zu, die im Falle der Insolvenz ein Recht auf vorzugsweise Befriedigung aus einer Deckungsmasse haben, die nach gesetzlicher Vorschrift zu ihrem Schutz errichtet und staatlich überwacht ist."
    },
    {
      "date": "2025-05-02",
      "id": "107909",
      "original_text": "Registerbekanntmachung nach dem Umwandlungsgesetz\nSchleswig-Holstein Amtsgericht Lübeck HRB 4722 AH\nBUSTORFF KONZEPT GmbH – Trittau",
      "type": "Registerbekanntmachung nach dem Umwandlungsgesetz",
      "state": "Schleswig-Holstein",
      "amtsgericht": "Amtsgericht Lübeck",
      "registernummer": "HRB 4722 AH",
      "registerart": "HRB",
      "company_name": "BUSTORFF KONZEPT GmbH",
      "company_seat": "Trittau",
      "details": "02.05.2025 (Bekanntmachungsdatum)\n\nSchleswig-Holstein Amtsgericht Lübeck HRB 4722 AH\nRegisterbekanntmachung nach dem Umwandlungsgesetz 30.04.2025 (Eintragungsdatum)\n\nBUSTORFF KONZEPT GmbH\nGesellschaft mit beschränkter Haftung\nTrittau\n\nZu Eintragungsnummer 3 vom 30.04.2025 wird als nicht eingetragen veröffentlicht: Den Gläubigern der an der Verschmelzung beteiligten Rechtsträger ist, wenn sie binnen sechs Monaten nach dem Tag, an dem die Eintragung der Verschmelzung in das Register des Sitzes desjenigen Rechtsträgers, dessen Gläubiger sie sind, als bekannt gemacht gilt, ihren Anspruch nach Grund und Höhe schriftlich anmelden, Sicherheit zu leisten, soweit sie nicht Befriedigung verlangen können. Dieses Recht steht den Gläubigern jedoch nur zu, wenn sie glaubhaft machen, dass durch die Verschmelzung die Erfüllung ihrer Forderung gefährdet wird."
    },
    {
      "date": "2025-05-02",
      "id": "107910",
      "original_text": "Registerbekanntmachung nach dem Umwandlungsgesetz\nBerlin Amtsgericht Berlin (Charlottenburg) HRB 239355\nThrasio Deutschland Holdings GmbH – Berlin",
      "type": "Registerbekanntmachung nach dem Umwandlungsgesetz",
      "state": "Berlin",
      "amtsgericht": "Amtsgericht Berlin (Charlottenburg)",
      "registernummer": "HRB 239355",
      "registerart": "HRB",
      "company_name": "Thrasio Deutschland Holdings GmbH",
      "company_seat": "Berlin",
      "details": "02.05.2025 (Bekanntmachungsdatum)\n\nBerlin Amtsgericht Berlin (Charlottenburg) HRB 239355\nRegisterbekanntmachung nach dem Umwandlungsgesetz 29.04.2025 (Eintragungsdatum)\n\nThrasio Deutschland Holdings GmbH\nGesellschaft mit beschränkter Haftung\nBerlin\n\nZu Eintragungsnummer 6 vom 29.04.2025 wird als nicht eingetragen veröffentlicht: Den Gläubigern der an der Verschmelzung beteiligten Rechtsträger ist, wenn sie binnen sechs Monaten nach dem Tag, an dem die Eintragung der Verschmelzung in das Register des Sitzes desjenigen Rechtsträgers, dessen Gläubiger sie sind, als bekannt gemacht gilt, ihren Anspruch nach Grund und Höhe schriftlich anmelden, Sicherheit zu leisten, soweit sie nicht Befriedigung verlangen können. Dieses Recht steht den Gläubigern jedoch nur zu, wenn sie glaubhaft machen, dass durch die Verschmelzung die Erfüllung ihrer Forderung gefährdet wird. Das Recht, Sicherheitsleistung zu verlangen, steht Gläubigern nicht zu, die im Falle der Insolvenz ein Recht auf vorzugsweise Befriedigung aus einer Deckungsmasse haben, die nach gesetzlicher Vorschrift zu ihrem Schutz errichtet und staatlich überwacht ist."
    },
    {
      "date": "2025-05-02",
      "id": "107911",
      "original_text": "Registerbekanntmachung nach dem Umwandlungsgesetz\nBaden-Württemberg Amtsgericht Freiburg HRB 724317\nVSI 344 Verwaltung von Schwimmbadimmobilien GmbH – Markdorf",
      "type": "Registerbekanntmachung nach dem Umwandlungsgesetz",
      "state": "Baden-Württemberg",
      "amtsgericht": "Amtsgericht Freiburg",
      "registernummer": "HRB 724317",
      "registerart": "HRB",
      "company_name": "VSI 344 Verwaltung von Schwimmbadimmobilien GmbH",
      "company_seat": "Markdorf",
      "details": "02.05.2025 (Bekanntmachungsdatum)\n\nBaden-Württemberg Amtsgericht Freiburg HRB 724317\nRegisterbekanntmachung nach dem Umwandlungsgesetz 02.05.2025 (Eintragungsdatum)\n\nVSI 344 Verwaltung von Schwimmbadimmobilien GmbH\nGesellschaft mit beschränkter Haftung\nMarkdorf\n\nAls nicht eingetragen wird bekanntgemacht:\nDen Gläubigern der an der Verschmelzung beteiligten Rechtsträger ist, wenn sie binnen sechs Monaten nach dem Tag, an dem die Eintragung der Verschmelzung in das Register des Sitzes desjenigen Rechtsträgers, dessen Gläubiger sie sind, nach § 19 Abs. 3 UmwG als bekanntgemacht gilt, ihren Anspruch nach Grund und Höhe schriftlich anmelden, Sicherheit zu leisten, soweit sie nicht Befriedigung verlangen können. Dieses Recht steht den Gläubigern jedoch nur zu, wenn sie glaubhaft machen, dass durch die Verschmelzung die Erfüllung ihrer Forderung gefährdet wird."
    },
    {
      "date": "2025-05-02",
      "id": "107912",
      "original_text": "Registerbekanntmachung nach dem Umwandlungsgesetz\nBaden-Württemberg Amtsgericht Stuttgart HRB 570105\nBausparkasse Schwäbisch Hall Aktiengesellschaft - Bausparkasse der Volksbanken und Raiffeisenbanken - – Schwäbisch Hall",
      "type": "Registerbekanntmachung nach dem Umwandlungsgesetz",
      "state": "Baden-Württemberg",
      "amtsgericht": "Amtsgericht Stuttgart",
      "registernummer": "HRB 570105",
      "registerart": "HRB",
      "company_name": "Bausparkasse Schwäbisch Hall Aktiengesellschaft - Bausparkasse der Volksbanken und Raiffeisenbanken -",
      "company_seat": "Schwäbisch Hall",
      "details": "02.05.2025 (Bekanntmachungsdatum)\n\nBaden-Württemberg Amtsgericht Stuttgart HRB 570105\nRegisterbekanntmachung nach dem Umwandlungsgesetz 02.05.2025 (Eintragungsdatum)\n\nBausparkasse Schwäbisch Hall Aktiengesellschaft - Bausparkasse der Volksbanken und Raiffeisenbanken -\nAktiengesellschaft\nSchwäbisch Hall\n\nDen Gläubigern der an der Verschmelzung beteiligten Rechtsträger ist, wenn sie binnen sechs Monaten nach dem Tag, an dem die Eintragung der Verschmelzung in das Register des Sitzes desjenigen Rechtsträgers, dessen Gläubiger sie sind, nach § 19 Abs. 3 UmwG als bekanntgemacht gilt, ihren Anspruch nach Grund und Höhe schriftlich anmelden, Sicherheit zu leisten, soweit sie nicht Befriedigung verlangen können. Dieses Recht steht den Gläubigern jedoch nur zu, wenn sie glaubhaft machen, dass durch die Verschmelzung die Erfüllung ihrer Forderung gefährdet wird."
    },
    {
      "date": "2025-05-02",
      "id": "107913",
      "original_text": "Registerbekanntmachung nach dem Umwandlungsgesetz\nSchleswig-Holstein Amtsgericht Lübeck HRB 4733 AH\nKJ Verwaltungsgesellschaft mbH – Trittau",
      "type": "Registerbekanntmachung nach dem Umwandlungsgesetz",
      "state": "Schleswig-Holstein",
      "amtsgericht": "Amtsgericht Lübeck",
      "registernummer": "HRB 4733 AH",
      "registerart": "HRB",
      "company_name": "KJ Verwaltungsgesellschaft mbH",
      "company_seat": "Trittau",
      "details": "02.05.2025 (Bekanntmachungsdatum)\n\nSchleswig-Holstein Amtsgericht Lübeck HRB 4733 AH\nRegisterbekanntmachung nach dem Umwandlungsgesetz 30.04.2025 (Eintragungsdatum)\n\nKJ Verwaltungsgesellschaft mbH\nGesellschaft mit beschränkter Haftung\nTrittau\n\nZu Eintragungsnummer 3 vom 30.04.2025 wird als nicht eingetragen veröffentlicht: Den Gläubigern der an der Verschmelzung beteiligten Rechtsträger ist, wenn sie binnen sechs Monaten nach dem Tag, an dem die Eintragung der Verschmelzung in das Register des Sitzes desjenigen Rechtsträgers, dessen Gläubiger sie sind, als bekannt gemacht gilt, ihren Anspruch nach Grund und Höhe schriftlich anmelden, Sicherheit zu leisten, soweit sie nicht Befriedigung verlangen können. Dieses Recht steht den Gläubigern jedoch nur zu, wenn sie glaubhaft machen, dass durch die Verschmelzung die Erfüllung ihrer Forderung gefährdet wird."
    },
    {
      "date": "2025-05-02",
      "id": "107914",
      "original_text": "Einreichung neuer Dokumente\nHamburg Amtsgericht Hamburg HRB 170569\nEngel & Völkers Venture Management AG – Hamburg",
      "type": "Einreichung neuer Dokumente",
      "state": "Hamburg",
      "amtsgericht": "Amtsgericht Hamburg",
      "registernummer": "HRB 170569",
      "registerart": "HRB",
      "company_name": "Engel & Völkers Venture Management AG",
      "company_seat": "Hamburg",
      "details": "02.05.2025 (Bekanntmachungsdatum)\n\nHamburg Amtsgericht Hamburg HRB 170569\nEinreichung neuer Dokumente\n\nEngel & Völkers Venture Management AG\nAktiengesellschaft\nHamburg\n\nAls nicht eingetragen wird bekannt gemacht: Liste des Aufsichtsrats wurde eingereicht."
    },
    {
      "date": "2025-05-02",
      "id": "107915",
      "original_text": "Löschungsankündigung\nBerlin Amtsgericht Berlin (Charlottenburg) HRB 200471\nHouse of Pareto Marketing UG (haftungsbeschränkt) – Berlin",
      "type": "Löschungsankündigung",
      "state": "Berlin",
      "amtsgericht": "Amtsgericht Berlin (Charlottenburg)",
      "registernummer": "HRB 200471",
      "registerart": "HRB",
      "company_name": "House of Pareto Marketing UG (haftungsbeschränkt)",
      "company_seat": "Berlin",
      "details": "02.05.2025 (Bekanntmachungsdatum)\n\nBerlin Amtsgericht Berlin (Charlottenburg) HRB 200471\nLöschungsankündigung\n\nHouse of Pareto Marketing UG (haftungsbeschränkt)\nGesellschaft mit beschränkter Haftung\nBerlin\n\nBei der nachstehenden Gesellschaft wird das Amtslöschungsverfahren gemäß § 394 FamFG eingeleitet. Widerspruchsfrist 6 Wochen"
    },
    {
      "date": "2025-05-02",
      "id": "107916",
      "original_text": "Löschungsankündigung\nBerlin Amtsgericht Berlin (Charlottenburg) HRB 245383\nD.I.Y. Cannagarsupply UG (haftungsbeschränkt) – Berlin",
      "type": "Löschungsankündigung",
      "state": "Berlin",
      "amtsgericht": "Amtsgericht Berlin (Charlottenburg)",
      "registernummer": "HRB 245383",
      "registerart": "HRB",
      "company_name": "D.I.Y. Cannagarsupply UG (haftungsbeschränkt)",
      "company_seat": "Berlin",
      "details": "02.05.2025 (Bekanntmachungsdatum)\n\nBerlin Amtsgericht Berlin (Charlottenburg) HRB 245383\nLöschungsankündigung\n\nD.I.Y. Cannagarsupply UG (haftungsbeschränkt)\nGesellschaft mit beschränkter Haftung\nBerlin\n\nBei der nachstehenden Gesellschaft wird das Amtslöschungsverfahren gemäß § 394 FamFG eingeleitet. Widerspruchsfrist 6 Wochen"
    },
    {
      "date": "2025-05-02",
      "id": "107917",
      "original_text": "Registerbekanntmachung nach dem Umwandlungsgesetz\nBerlin Amtsgericht Berlin (Charlottenburg) HRA 58459\nTele Columbus Multimedia GmbH & Co. KG – Berlin",
      "type": "Registerbekanntmachung nach dem Umwandlungsgesetz",
      "state": "Berlin",
      "amtsgericht": "Amtsgericht Berlin (Charlottenburg)",
      "registernummer": "HRA 58459",
      "registerart": "HRA",
      "company_name": "Tele Columbus Multimedia GmbH & Co. KG",
      "company_seat": "Berlin",
      "details": "02.05.2025 (Bekanntmachungsdatum)\n\nBerlin Amtsgericht Berlin (Charlottenburg) HRA 58459\nRegisterbekanntmachung nach dem Umwandlungsgesetz 30.04.2025 (Eintragungsdatum)\n\nTele Columbus Multimedia GmbH & Co. KG\nKommanditgesellschaft\nBerlin\n\nZu Eintragungsnummer 18 vom 30.04.2025 wird als nicht eingetragen veröffentlicht: Den Gläubigern der an der Spaltung beteiligten Rechtsträger ist, wenn sie binnen sechs Monaten nach dem Tag, an dem die Eintragung der Spaltung in das Register des Sitzes desjenigen Rechtsträgers, dessen Gläubiger sie sind, als bekannt gemacht gilt, ihren Anspruch nach Grund und Höhe schriftlich anmelden, Sicherheit zu leisten, soweit sie nicht Befriedigung verlangen können. Dieses Recht steht den Gläubigern jedoch nur zu, wenn sie glaubhaft machen, dass durch die Spaltung die Erfüllung ihrer Forderung gefährdet wird. Das Recht, Sicherheitsleistung zu verlangen, steht Gläubigern nicht zu, die im Falle der Insolvenz ein Recht auf vorzugsweise Befriedigung aus einer Deckungsmasse haben, die nach gesetzlicher Vorschrift zu ihrem Schutz errichtet und staatlich überwacht ist."
    },
    {
      "date": "2025-05-02",
      "id": "107918",
      "original_text": "Registerbekanntmachung nach dem Umwandlungsgesetz\nSchleswig-Holstein Amtsgericht Kiel HRB 27294\nMMN-PW Holding GmbH – Kiel",
      "type": "Registerbekanntmachung nach dem Umwandlungsgesetz",
      "state": "Schleswig-Holstein",
      "amtsgericht": "Amtsgericht Kiel",
      "registernummer": "HRB 27294",
      "registerart": "HRB",
      "company_name": "MMN-PW Holding GmbH",
      "company_seat": "Kiel",
      "details": "02.05.2025 (Bekanntmachungsdatum)\n\nSchleswig-Holstein Amtsgericht Kiel HRB 27294\nRegisterbekanntmachung nach dem Umwandlungsgesetz 30.04.2025 (Eintragungsdatum)\n\nMMN-PW Holding GmbH\nGesellschaft mit beschränkter Haftung\nKiel\n\nZu Eintragungsnummer 3 vom 30.04.2025 wird als nicht eingetragen veröffentlicht: Als nicht eingetragen wird veröffentlicht: Den Gläubigern der an der Spaltung beteiligten Rechtsträger ist, wenn sie binnen sechs Monaten nach dem Tag, an dem die Eintragung der Spaltung in das Register des Sitzes desjenigen Rechtsträgers, dessen Gläubiger sie sind,  bekannt gemacht worden ist, ihren Anspruch nach Grund und Höhe schriftlich anmelden, Sicherheit zu leisten, soweit sie nicht Befriedigung verlangen können. Dieses Recht steht den Gläubigern jedoch nur zu, wenn sie glaubhaft machen, dass durch die Spaltung die Erfüllung ihrer Forderung gefährdet wird."
    },
    {
      "date": "2025-05-02",
      "id": "107919",
      "original_text": "Einreichung neuer Dokumente\nThüringen Amtsgericht Jena HRB 502717\nD.A.R. Metall AG – Ebeleben",
      "type": "Einreichung neuer Dokumente",
      "state": "Thüringen",
      "amtsgericht": "Amtsgericht Jena",
      "registernummer": "HRB 502717",
      "registerart": "HRB",
      "company_name": "D.A.R. Metall AG",
      "company_seat": "Ebeleben",
      "details": "02.05.2025 (Bekanntmachungsdatum)\n\nThüringen Amtsgericht Jena HRB 502717\nEinreichung neuer Dokumente 02.05.2025 (Eintragungsdatum)\n\nD.A.R. Metall AG\nAktiengesellschaft\nEbeleben\n\nBekanntmachung gem. § 106 AktG: Aufgrund einer Veränderung in den Personen der Aufsichtsratsmitglieder ist durch den Vorstand eine neue Liste zum Handelsregister eingereicht worden."
    },
    {
      "date": "2025-05-02",
      "id": "107920",
      "original_text": "Löschungsankündigung\nThüringen Amtsgericht Jena HRB 509311\nBöhm Center of Technology GmbH – Zella-Mehlis",
      "type": "Löschungsankündigung",
      "state": "Thüringen",
      "amtsgericht": "Amtsgericht Jena",
      "registernummer": "HRB 509311",
      "registerart": "HRB",
      "company_name": "Böhm Center of Technology GmbH",
      "company_seat": "Zella-Mehlis",
      "details": "02.05.2025 (Bekanntmachungsdatum)\n\nThüringen Amtsgericht Jena HRB 509311\nLöschungsankündigung\n\nBöhm Center of Technology GmbH\nGesellschaft mit beschränkter Haftung\nZella-Mehlis\n\nDas Registergericht beabsichtigt, die im Handelsregister eingetragene Gesellschaft wegen Vermögenslosigkeit nach § 394 FamFG von Amts wegen zu löschen. Die Frist zur Erhebung eines Widerspruchs gegen die beabsichtigte Löschung wird auf 6 Wochen festgesetzt."
    },
    {
      "date": "2025-05-02",
      "id": "107921",
      "original_text": "Registerbekanntmachung nach dem Umwandlungsgesetz\nBerlin Amtsgericht Berlin (Charlottenburg) HRA 41605\nGBI Wohnungsbau GmbH & Co. KG – Berlin",
      "type": "Registerbekanntmachung nach dem Umwandlungsgesetz",
      "state": "Berlin",
      "amtsgericht": "Amtsgericht Berlin (Charlottenburg)",
      "registernummer": "HRA 41605",
      "registerart": "HRA",
      "company_name": "GBI Wohnungsbau GmbH & Co. KG",
      "company_seat": "Berlin",
      "details": "02.05.2025 (Bekanntmachungsdatum)\n\nBerlin Amtsgericht Berlin (Charlottenburg) HRA 41605\nRegisterbekanntmachung nach dem Umwandlungsgesetz 30.04.2025 (Eintragungsdatum)\n\nGBI Wohnungsbau GmbH & Co. KG\nKommanditgesellschaft\nBerlin\n\nZu Eintragungsnummer 15 vom 30.04.2025 wird als nicht eingetragen veröffentlicht:Den Gläubigern der an der Verschmelzung beteiligten Rechtsträger ist, wenn sie binnen sechs Monaten nach dem Tag, an dem die Eintragung der Verschmelzung in das Register des Sitzes desjenigen Rechtsträgers, dessen Gläubiger sie sind, als bekannt gemacht gilt, ihren Anspruch nach Grund und Höhe schriftlich anmelden, Sicherheit zu leisten, soweit sie nicht Befriedigung verlangen können. Dieses Recht steht den Gläubigern jedoch nur zu, wenn sie glaubhaft machen, dass durch die Verschmelzung die Erfüllung ihrer Forderung gefährdet wird. Das Recht, Sicherheitsleistung zu verlangen, steht Gläubigern nicht zu, die im Falle der Insolvenz ein Recht auf vorzugsweise Befriedigung aus einer Deckungsmasse haben, die nach gesetzlicher Vorschrift zu ihrem Schutz errichtet und staatlich überwacht ist."
    },
    {
      "date": "2025-05-02",
      "id": "107922",
      "original_text": "Registerbekanntmachung nach dem Umwandlungsgesetz\nBrandenburg Amtsgericht Cottbus HRB 18737\nAutohaus Wildau by J.A.H. GmbH – Wildau",
      "type": "Registerbekanntmachung nach dem Umwandlungsgesetz",
      "state": "Brandenburg",
      "amtsgericht": "Amtsgericht Cottbus",
      "registernummer": "HRB 18737",
      "registerart": "HRB",
      "company_name": "Autohaus Wildau by J.A.H. GmbH",
      "company_seat": "Wildau",
      "details": "02.05.2025 (Bekanntmachungsdatum)\n\nBrandenburg Amtsgericht Cottbus HRB 18737\nRegisterbekanntmachung nach dem Umwandlungsgesetz 02.05.2025 (Eintragungsdatum)\n\nAutohaus Wildau by J.A.H. GmbH\nGesellschaft mit beschränkter Haftung\nWildau\n\nZu Eintragungsnummer 1 vom 02.05.2025 wird als nicht eingetragen veröffentlicht: Als nicht eingetragen wird veröffentlicht:\nDen Gläubigern der an der Übertragung von Teilen beteiligten Rechtsträger ist, wenn sie binnen sechs Monaten nach dem Tag, an dem die Eintragung der Übertragung von Teilen in das Register des Sitzes desjenigen Rechtsträgers, dessen Gläubiger sie sind, als bekannt gemacht gilt, ihren Anspruch nach Grund und Höhe schriftlich anmelden, Sicherheit zu leisten, soweit sie nicht Befriedigung verlangen können. Dieses Recht steht den Gläubigern jedoch nur zu, wenn sie glaubhaft machen, dass durch die Übertragung von Teilen die Erfüllung ihrer Forderung gefährdet wird"
    },
    {
      "date": "2025-05-02",
      "id": "107923",
      "original_text": "Löschungsankündigung\nBerlin Amtsgericht Berlin (Charlottenburg) HRA 35086\nPlaisir Selection Feinkosthandel GmbH & Co. KG. – Berlin",
      "type": "Löschungsankündigung",
      "state": "Berlin",
      "amtsgericht": "Amtsgericht Berlin (Charlottenburg)",
      "registernummer": "HRA 35086",
      "registerart": "HRA",
      "company_name": "Plaisir Selection Feinkosthandel GmbH & Co. KG.",
      "company_seat": "Berlin",
      "details": "02.05.2025 (Bekanntmachungsdatum)\n\nBerlin Amtsgericht Berlin (Charlottenburg) HRA 35086\nLöschungsankündigung\n\nPlaisir Selection Feinkosthandel GmbH & Co. KG.\nKommanditgesellschaft\nBerlin\n\nBei dem nachstehenden Unternehmen / der nachstehenden Gesellschaft wird das Amtslöschungsverfahren gemäß § 31 Abs. 2 HGB eingeleitet. Widerspruchsfrist 1 Monat"
    },
    {
      "date": "2025-05-02",
      "id": "107924",
      "original_text": "Löschungsankündigung\nBrandenburg Amtsgericht Frankfurt/Oder HRB 19490\nEggert Dienstleistungen GmbH – Schöneiche bei Berlin",
      "type": "Löschungsankündigung",
      "state": "Brandenburg",
      "amtsgericht": "Amtsgericht Frankfurt/Oder",
      "registernummer": "HRB 19490",
      "registerart": "HRB",
      "company_name": "Eggert Dienstleistungen GmbH",
      "company_seat": "Schöneiche bei Berlin",
      "details": "02.05.2025 (Bekanntmachungsdatum)\n\nBrandenburg Amtsgericht Frankfurt/Oder HRB 19490\nLöschungsankündigung\n\nEggert Dienstleistungen GmbH\nGesellschaft mit beschränkter Haftung\nSchöneiche bei Berlin\n\nBei der nachstehenden Gesellschaft wird das Amtslöschungsverfahren gemäß § 394 FamFG eingeleitet."
    },
    {
      "date": "2025-05-02",
      "id": "107925",
      "original_text": "Löschungsankündigung\nBerlin Amtsgericht Berlin (Charlottenburg) HRB 212440\nearlybean UG (haftungsbeschränkt) – Berlin",
      "type": "Löschungsankündigung",
      "state": "Berlin",
      "amtsgericht": "Amtsgericht Berlin (Charlottenburg)",
      "registernummer": "HRB 212440",
      "registerart": "HRB",
      "company_name": "earlybean UG (haftungsbeschränkt)",
      "company_seat": "Berlin",
      "details": "02.05.2025 (Bekanntmachungsdatum)\n\nBerlin Amtsgericht Berlin (Charlottenburg) HRB 212440\nLöschungsankündigung\n\nearlybean UG (haftungsbeschränkt)\nGesellschaft mit beschränkter Haftung\nBerlin\n\nBei der nachstehenden Gesellschaft wird das Amtslöschungsverfahren gemäß § 394 FamFG eingeleitet. Widerspruchsfrist: 6 Wochen."
    },
    {
      "date": "2025-05-02",
      "id": "107926",
      "original_text": "Löschungsankündigung\nBerlin Amtsgericht Berlin (Charlottenburg) HRA 63152\nTopclean Sheel e.K. – Berlin",
      "type": "Löschungsankündigung",
      "state": "Berlin",
      "amtsgericht": "Amtsgericht Berlin (Charlottenburg)",
      "registernummer": "HRA 63152",
      "registerart": "HRA",
      "company_name": "Topclean Sheel e.K.",
      "company_seat": "Berlin",
      "details": "02.05.2025 (Bekanntmachungsdatum)\n\nBerlin Amtsgericht Berlin (Charlottenburg) HRA 63152\nLöschungsankündigung\n\nTopclean Sheel e.K.\nEinzelkaufmann / Einzelkauffrau\nBerlin\n\nBei dem nachstehenden Unternehmen / der nachstehenden Gesellschaft wird das Amtslöschungsverfahren gemäß § 31 Abs. 2 HGB eingeleitet. Widerspruchsfrist 1 Monat"
    },
    {
      "date": "2025-05-02",
      "id": "107927",
      "original_text": "Einreichung neuer Dokumente\nBerlin Amtsgericht Berlin (Charlottenburg) HRB 185503\nCaya GmbH – Berlin",
      "type": "Einreichung neuer Dokumente",
      "state": "Berlin",
      "amtsgericht": "Amtsgericht Berlin (Charlottenburg)",
      "registernummer": "HRB 185503",
      "registerart": "HRB",
      "company_name": "Caya GmbH",
      "company_seat": "Berlin",
      "details": "02.05.2025 (Bekanntmachungsdatum)\n\nBerlin Amtsgericht Berlin (Charlottenburg) HRB 185503\nEinreichung neuer Dokumente\n\nCaya GmbH\nGesellschaft mit beschränkter Haftung\nBerlin\n\nAls nicht eingetragen wird veröffentlicht: Es wurde eine neue Liste der Beiratsmitglieder eingereicht (§52 GmbHG)."
    },
    {
      "date": "2025-05-02",
      "id": "107928",
      "original_text": "Registerbekanntmachung nach dem Umwandlungsgesetz\nBerlin Amtsgericht Berlin (Charlottenburg) HRB 63500\nBöhm Elektromedizin GmbH – Berlin",
      "type": "Registerbekanntmachung nach dem Umwandlungsgesetz",
      "state": "Berlin",
      "amtsgericht": "Amtsgericht Berlin (Charlottenburg)",
      "registernummer": "HRB 63500",
      "registerart": "HRB",
      "company_name": "Böhm Elektromedizin GmbH",
      "company_seat": "Berlin",
      "details": "02.05.2025 (Bekanntmachungsdatum)\n\nBerlin Amtsgericht Berlin (Charlottenburg) HRB 63500\nRegisterbekanntmachung nach dem Umwandlungsgesetz 29.04.2025 (Eintragungsdatum)\n\nBöhm Elektromedizin GmbH\nGesellschaft mit beschränkter Haftung\nBerlin\n\nZu Eintragungsnummer 11 vom 29.04.2025 wird als nicht eingetragen veröffentlicht: Den Gläubigern der an der Verschmelzung beteiligten Rechtsträger ist, wenn sie binnen sechs Monaten nach dem Tag, an dem die Eintragung der Verschmelzung in das Register des Sitzes desjenigen Rechtsträgers, dessen Gläubiger sie sind, als bekannt gemacht gilt, ihren Anspruch nach Grund und Höhe schriftlich anmelden, Sicherheit zu leisten, soweit sie nicht Befriedigung verlangen können. Dieses Recht steht den Gläubigern jedoch nur zu, wenn sie glaubhaft machen, dass durch die Verschmelzung die Erfüllung ihrer Forderung gefährdet wird. Das Recht, Sicherheitsleistung zu verlangen, steht Gläubigern nicht zu, die im Falle der Insolvenz ein Recht auf vorzugsweise Befriedigung aus einer Deckungsmasse haben, die nach gesetzlicher Vorschrift zu ihrem Schutz errichtet und staatlich überwacht ist."
    },
    {
      "date": "2025-05-02",
      "id": "107929",
      "original_text": "Registerbekanntmachung nach dem Umwandlungsgesetz\nBaden-Württemberg Amtsgericht Freiburg HRB 718272\nEntwicklungsmaßnahme Dietenbach Verwaltungs-GmbH – Freiburg im Breisgau",
      "type": "Registerbekanntmachung nach dem Umwandlungsgesetz",
      "state": "Baden-Württemberg",
      "amtsgericht": "Amtsgericht Freiburg",
      "registernummer": "HRB 718272",
      "registerart": "HRB",
      "company_name": "Entwicklungsmaßnahme Dietenbach Verwaltungs-GmbH",
      "company_seat": "Freiburg im Breisgau",
      "details": "02.05.2025 (Bekanntmachungsdatum)\n\nBaden-Württemberg Amtsgericht Freiburg HRB 718272\nRegisterbekanntmachung nach dem Umwandlungsgesetz 02.05.2025 (Eintragungsdatum)\n\nEntwicklungsmaßnahme Dietenbach Verwaltungs-GmbH\nGesellschaft mit beschränkter Haftung\nFreiburg im Breisgau\n\nAls nicht eingetragen wird bekanntgemacht:\nDen Gläubigern der an der Vermögensübertragung beteiligten Rechtsträger ist, wenn sie binnen sechs Monaten nach dem Tag, an dem die Eintragung der Vermögensübertragung in das Register des Sitzes desjenigen Rechtsträgers, dessen Gläubiger sie sind, nach § 19 Abs. 3 UmwG als bekanntgemacht gilt, ihren Anspruch nach Grund und Höhe schriftlich anmelden, Sicherheit zu leisten, soweit sie nicht Befriedigung verlangen können. Dieses Recht steht den Gläubigern jedoch nur zu, wenn sie glaubhaft machen, dass durch die Vermögensübertragung die Erfüllung ihrer Forderung gefährdet wird."
    },
    {
      "date": "2025-05-02",
      "id": "107930",
      "original_text": "Löschungsankündigung\nBaden-Württemberg Amtsgericht Freiburg HRB 728700\nBW Hygiene Service GmbH – Freiburg im Breisgau",
      "type": "Löschungsankündigung",
      "state": "Baden-Württemberg",
      "amtsgericht": "Amtsgericht Freiburg",
      "registernummer": "HRB 728700",
      "registerart": "HRB",
      "company_name": "BW Hygiene Service GmbH",
      "company_seat": "Freiburg im Breisgau",
      "details": "02.05.2025 (Bekanntmachungsdatum)\n\nBaden-Württemberg Amtsgericht Freiburg HRB 728700\nLöschungsankündigung\n\nBW Hygiene Service GmbH\nGesellschaft mit beschränkter Haftung\nFreiburg im Breisgau\n\nAls nicht eingetragen wird bekanntgemacht:\nDas Gericht beabsichtigt, die Gesellschaft wegen Vermögenslosigkeit im Handelsregister von Amts wegen nach § 394 FamFG zu löschen. Die Frist zur Geltendmachung eines Widerspruchs gegen die beabsichtigte Löschung ist auf einen Monat ab Veröffentlichung bestimmt."
    },
    {
      "date": "2025-05-02",
      "id": "107931",
      "original_text": "Löschungsankündigung\nSachsen Amtsgericht Chemnitz HRB 26890\nWZ Finanzdienstleistungs GmbH – Kirchberg",
      "type": "Löschungsankündigung",
      "state": "Sachsen",
      "amtsgericht": "Amtsgericht Chemnitz",
      "registernummer": "HRB 26890",
      "registerart": "HRB",
      "company_name": "WZ Finanzdienstleistungs GmbH",
      "company_seat": "Kirchberg",
      "details": "02.05.2025 (Bekanntmachungsdatum)\n\nSachsen Amtsgericht Chemnitz HRB 26890\nLöschungsankündigung\n\nWZ Finanzdienstleistungs GmbH\nGesellschaft mit beschränkter Haftung\nKirchberg\n\nDas Registergericht beabsichtigt, die im Handelsregister eingetragene Gesellschaft von Amts wegen nach § 394 FamFG zu löschen. Die Frist zu Erhebung eines Widerspruchs gegen die beabsichtigte Löschung wird auf einen Monat festgesetzt."
    },
    {
      "date": "2025-05-02",
      "id": "107932",
      "original_text": "Löschungsankündigung\nSachsen Amtsgericht Leipzig HRB 6385\nErdbau Leipzig GmbH – Leipzig",
      "type": "Löschungsankündigung",
      "state": "Sachsen",
      "amtsgericht": "Amtsgericht Leipzig",
      "registernummer": "HRB 6385",
      "registerart": "HRB",
      "company_name": "Erdbau Leipzig GmbH",
      "company_seat": "Leipzig",
      "details": "02.05.2025 (Bekanntmachungsdatum)\n\nSachsen Amtsgericht Leipzig HRB 6385\nLöschungsankündigung\n\nErdbau Leipzig GmbH\nGesellschaft mit beschränkter Haftung\nLeipzig\n\nDas Registergericht beabsichtigt, die im Handelsregister eingetragene Gesellschaft von Amts wegen nach § 394 FamFG zu löschen. Die Frist zu Erhebung eines Widerspruchs gegen die beabsichtigte Löschung wird auf einen Monat festgesetzt."
    },
    {
      "date": "2025-05-02",
      "id": "107933",
      "original_text": "Löschungsankündigung\nNiedersachsen Amtsgericht Osnabrück HRB 211830\nRemax Deutschland Bauelemente GmbH – Laar",
      "type": "Löschungsankündigung",
      "state": "Niedersachsen",
      "amtsgericht": "Amtsgericht Osnabrück",
      "registernummer": "HRB 211830",
      "registerart": "HRB",
      "company_name": "Remax Deutschland Bauelemente GmbH",
      "company_seat": "Laar",
      "details": "02.05.2025 (Bekanntmachungsdatum)\n\nNiedersachsen Amtsgericht Osnabrück HRB 211830\nLöschungsankündigung\n\nRemax Deutschland Bauelemente GmbH\nGesellschaft mit beschränkter Haftung\nLaar\n\nDas Registergericht beabsichtigt, die Gesellschaft von Amts wegen nach § 394 FamFG wegen Vermögenslosigkeit zu löschen. Die Frist zur Erhebung eines Widerspruchs ist auf 1 Monat ab dieser Registerbekanntmachung festgesetzt."
    },
    {
      "date": "2025-05-02",
      "id": "107934",
      "original_text": "Sonstige Registerbekanntmachung\nNiedersachsen Amtsgericht Osnabrück HRB 204774\nND Logistics GmbH – Papenburg",
      "type": "Sonstige Registerbekanntmachung",
      "state": "Niedersachsen",
      "amtsgericht": "Amtsgericht Osnabrück",
      "registernummer": "HRB 204774",
      "registerart": "HRB",
      "company_name": "ND Logistics GmbH",
      "company_seat": "Papenburg",
      "details": "02.05.2025 (Bekanntmachungsdatum)\n\nNiedersachsen Amtsgericht Osnabrück HRB 204774\nSonstige Registerbekanntmachung 02.05.2025 (Eintragungsdatum)\n\nND Logistics GmbH\nGesellschaft mit beschränkter Haftung\nPapenburg\n\nDen Gläubigern der Gesellschaft, deren Forderungen begründet worden sind, bevor die Eintragung der Beendigung des Vertrages in das Handelsregister nach § 10 HGB als bekanntgemacht gilt, ist vom anderen Vertragsteil Sicherheit zu leisten, wenn sie sich binnen sechs Monaten nach der Bekanntmachung zu diesem Zweck bei ihm melden."
    },
    {
      "date": "2025-05-02",
      "id": "107935",
      "original_text": "Registerbekanntmachung nach dem Umwandlungsgesetz\nNiedersachsen Amtsgericht Lüneburg HRB 207161\nHeins Hoff Verwaltungsgesellschaft mbH – Vierhöfen",
      "type": "Registerbekanntmachung nach dem Umwandlungsgesetz",
      "state": "Niedersachsen",
      "amtsgericht": "Amtsgericht Lüneburg",
      "registernummer": "HRB 207161",
      "registerart": "HRB",
      "company_name": "Heins Hoff Verwaltungsgesellschaft mbH",
      "company_seat": "Vierhöfen",
      "details": "02.05.2025 (Bekanntmachungsdatum)\n\nNiedersachsen Amtsgericht Lüneburg HRB 207161\nRegisterbekanntmachung nach dem Umwandlungsgesetz 02.05.2025 (Eintragungsdatum)\n\nHeins Hoff Verwaltungsgesellschaft mbH\nGesellschaft mit beschränkter Haftung\nVierhöfen\n\nDen Gläubigern der an der Verschmelzung beteiligten Rechtsträger ist, wenn sie binnen sechs Monaten nach dem Tag, an dem die Eintragung der Verschmelzung in das Register des Sitzes desjenigen Rechtsträgers, dessen Gläubiger sie sind, nach § 19  Abs.  3 UmwG als bekannt gemacht gilt, ihren Anspruch nach Grund und Höhe schriftlich anmelden, Sicherheit zu leisten, soweit sie nicht Befriedigung verlangen können. Dieses Recht steht den Gläubigern jedoch nur zu, wenn sie glaubhaft machen, dass durch die Verschmelzung die Erfüllung der Forderung gefährdet wird."
    },
    {
      "date": "2025-05-02",
      "id": "107936",
      "original_text": "Registerbekanntmachung nach dem Umwandlungsgesetz\nNiedersachsen Amtsgericht Lüneburg HRB 206986\nGrundstücks- und Erschließungsgesellschaft mbH Hamburg Süd – Stelle",
      "type": "Registerbekanntmachung nach dem Umwandlungsgesetz",
      "state": "Niedersachsen",
      "amtsgericht": "Amtsgericht Lüneburg",
      "registernummer": "HRB 206986",
      "registerart": "HRB",
      "company_name": "Grundstücks- und Erschließungsgesellschaft mbH Hamburg Süd",
      "company_seat": "Stelle",
      "details": "02.05.2025 (Bekanntmachungsdatum)\n\nNiedersachsen Amtsgericht Lüneburg HRB 206986\nRegisterbekanntmachung nach dem Umwandlungsgesetz 02.05.2025 (Eintragungsdatum)\n\nGrundstücks- und Erschließungsgesellschaft mbH Hamburg Süd\nGesellschaft mit beschränkter Haftung\nStelle\n\nDen Gläubigern der an der Verschmelzung beteiligten Rechtsträger ist, wenn sie binnen sechs Monaten nach dem Tag, an dem die Eintragung der Verschmelzung in das Register des Sitzes desjenigen Rechtsträgers, dessen Gläubiger sie sind, nach § 19  Abs.  3 UmwG als bekannt gemacht gilt, ihren Anspruch nach Grund und Höhe schriftlich anmelden, Sicherheit zu leisten, soweit sie nicht Befriedigung verlangen können. Dieses Recht steht den Gläubigern jedoch nur zu, wenn sie glaubhaft machen, dass durch die Verschmelzung die Erfüllung der Forderung gefährdet wird."
    },
    {
      "date": "2025-05-02",
      "id": "107937",
      "original_text": "Registerbekanntmachung nach dem Umwandlungsgesetz\nNiedersachsen Amtsgericht Osnabrück HRB 221164\nLMB Green GmbH – Papenburg",
      "type": "Registerbekanntmachung nach dem Umwandlungsgesetz",
      "state": "Niedersachsen",
      "amtsgericht": "Amtsgericht Osnabrück",
      "registernummer": "HRB 221164",
      "registerart": "HRB",
      "company_name": "LMB Green GmbH",
      "company_seat": "Papenburg",
      "details": "02.05.2025 (Bekanntmachungsdatum)\n\nNiedersachsen Amtsgericht Osnabrück HRB 221164\nRegisterbekanntmachung nach dem Umwandlungsgesetz 02.05.2025 (Eintragungsdatum)\n\nLMB Green GmbH\nGesellschaft mit beschränkter Haftung\nPapenburg\n\nDen Gläubigern der an der Verschmelzung beteiligten Rechtsträger ist, wenn sie binnen sechs Monaten nach dem Tag, an dem die Eintragung der Verschmelzung in das Register des Sitzes desjenigen Rechtsträgers, dessen Gläubiger sie sind, nach § 19  Abs.  3 UmwG als bekannt gemacht gilt, ihren Anspruch nach Grund und Höhe schriftlich anmelden, Sicherheit zu leisten, soweit sie nicht Befriedigung verlangen können. Dieses Recht steht den Gläubigern jedoch nur zu, wenn sie glaubhaft machen, dass durch die Verschmelzung die Erfüllung der Forderung gefährdet wird."
    },
    {
      "date": "2025-05-02",
      "id": "107938",
      "original_text": "Registerbekanntmachung nach dem Umwandlungsgesetz\nNiedersachsen Amtsgericht Göttingen HRB 200513\nVitartis Medizin - Service GmbH – Göttingen",
      "type": "Registerbekanntmachung nach dem Umwandlungsgesetz",
      "state": "Niedersachsen",
      "amtsgericht": "Amtsgericht Göttingen",
      "registernummer": "HRB 200513",
      "registerart": "HRB",
      "company_name": "Vitartis Medizin - Service GmbH",
      "company_seat": "Göttingen",
      "details": "02.05.2025 (Bekanntmachungsdatum)\n\nNiedersachsen Amtsgericht Göttingen HRB 200513\nRegisterbekanntmachung nach dem Umwandlungsgesetz 02.05.2025 (Eintragungsdatum)\n\nVitartis Medizin - Service GmbH\nGesellschaft mit beschränkter Haftung\nGöttingen\n\nDen Gläubigern der an der Ausgliederung beteiligten Rechtsträger ist, wenn sie binnen sechs Monaten nach dem Tag, an dem die Eintragung der Ausgliederung in das Register des Sitzes desjenigen Rechtsträgers, dessen Gläubiger sie sind, nach § 19 Abs. 3 UmwG als bekannt gemacht gilt, ihren Anspruch nach Grund und Höhe schriftlich anmelden, Sicherheit zu leisten, soweit sie nicht Befriedigung verlangen können. Dieses Recht steht den Gläubigern jedoch nur zu, wenn sie glaubhaft machen, dass durch die Ausgliederung die Erfüllung der Forderung gefährdet wird."
    },
    {
      "date": "2025-05-02",
      "id": "107939",
      "original_text": "Registerbekanntmachung nach dem Umwandlungsgesetz\nNiedersachsen Amtsgericht Lüneburg GsR 672\nSören Beineke & Tobias Sarkiaho Wolters eGbR – Garlstorf",
      "type": "Registerbekanntmachung nach dem Umwandlungsgesetz",
      "state": "Niedersachsen",
      "amtsgericht": "Amtsgericht Lüneburg",
      "registernummer": "GsR 672",
      "registerart": "GsR",
      "company_name": "Sören Beineke & Tobias Sarkiaho Wolters eGbR",
      "company_seat": "Garlstorf",
      "details": "02.05.2025 (Bekanntmachungsdatum)\n\nNiedersachsen Amtsgericht Lüneburg GsR 672\nRegisterbekanntmachung nach dem Umwandlungsgesetz 02.05.2025 (Eintragungsdatum)\n\nSören Beineke & Tobias Sarkiaho Wolters eGbR\nGesellschaft bürgerlichen Rechts\nGarlstorf\n\nDen Gläubigern der an der formwechselnden Umwandlung beteiligten Rechtsträger ist, wenn sie binnen sechs Monaten nach dem Tag, an dem die Eintragung der Umwandlung in das Register des Sitzes desjenigen Rechtsträgers, dessen Gläubiger sie sind, nach § 19 Abs. 3 UmwG als bekannt gemacht gilt, ihren Anspruch nach Grund und Höhe schriftlich anmelden, Sicherheit zu leisten, soweit sie nicht Befriedigung verlangen können. Dieses Recht steht den Gläubigern jedoch nur zu, wenn sie glaubhaft machen, dass durch die formwechselnde Umwandlung die Erfüllung der Forderung gefährdet wird."
    },
    {
      "date": "2025-05-02",
      "id": "107940",
      "original_text": "Registerbekanntmachung nach dem Umwandlungsgesetz\nNiedersachsen Amtsgericht Braunschweig HRB 100516 früher Amtsgericht Wolfsburg\nVolkswagen Group Services GmbH – Wolfsburg",
      "type": "Registerbekanntmachung nach dem Umwandlungsgesetz",
      "state": "Niedersachsen",
      "amtsgericht": "Amtsgericht Braunschweig",
      "registernummer": "HRB 100516",
      "registerart": "HRB",
      "company_name": "Volkswagen Group Services GmbH",
      "company_seat": "Wolfsburg",
      "former_amtsgericht": "Wolfsburg",
      "details": "02.05.2025 (Bekanntmachungsdatum)\n\nNiedersachsen Amtsgericht Braunschweig HRB 100516 früher Amtsgericht Wolfsburg\nRegisterbekanntmachung nach dem Umwandlungsgesetz 02.05.2025 (Eintragungsdatum)\n\nVolkswagen Group Services GmbH\nGesellschaft mit beschränkter Haftung\nWolfsburg\n\nDen Gläubigern der an der Abspaltung beteiligten Rechtsträger ist, wenn sie binnen sechs Monaten nach dem Tag, an dem die Eintragung der Abspaltung in das Register des Sitzes desjenigen Rechtsträgers, dessen Gläubiger sie sind, nach § 19 Abs. 3 UmwG als bekannt gemacht gilt, ihren Anspruch nach Grund und Höhe schriftlich anmelden, Sicherheit zu leisten, soweit sie nicht Befriedigung verlangen können. Dieses Recht steht den Gläubigern jedoch nur zu, wenn sie glaubhaft machen, dass durch die Abspaltung die Erfüllung der Forderung gefährdet wird."
    },
    {
      "date": "2025-05-02",
      "id": "107941",
      "original_text": "Löschungsankündigung\nNiedersachsen Amtsgericht Braunschweig HRB 202202\nInternational Energy Systems GmbH – Braunschweig",
      "type": "Löschungsankündigung",
      "state": "Niedersachsen",
      "amtsgericht": "Amtsgericht Braunschweig",
      "registernummer": "HRB 202202",
      "registerart": "HRB",
      "company_name": "International Energy Systems GmbH",
      "company_seat": "Braunschweig",
      "details": "02.05.2025 (Bekanntmachungsdatum)\n\nNiedersachsen Amtsgericht Braunschweig HRB 202202\nLöschungsankündigung\n\nInternational Energy Systems GmbH\nGesellschaft mit beschränkter Haftung\nBraunschweig\n\nDas Registergericht beabsichtigt, die Gesellschaft von Amts wegen nach § 394 FamFG zu löschen. Die Frist zur Erhebung eines Widerspruchs ist auf 1 Monat ab dieser Registerbekanntmachung festgesetzt."
    },
    {
      "date": "2025-05-02",
      "id": "107942",
      "original_text": "Registerbekanntmachung nach dem Umwandlungsgesetz\nNiedersachsen Amtsgericht Lüneburg HRB 212856\nLOMA GmbH – Garlstorf",
      "type": "Registerbekanntmachung nach dem Umwandlungsgesetz",
      "state": "Niedersachsen",
      "amtsgericht": "Amtsgericht Lüneburg",
      "registernummer": "HRB 212856",
      "registerart": "HRB",
      "company_name": "LOMA GmbH",
      "company_seat": "Garlstorf",
      "details": "02.05.2025 (Bekanntmachungsdatum)\n\nNiedersachsen Amtsgericht Lüneburg HRB 212856\nRegisterbekanntmachung nach dem Umwandlungsgesetz 02.05.2025 (Eintragungsdatum)\n\nLOMA GmbH\nGesellschaft mit beschränkter Haftung\nGarlstorf\n\nDen Gläubigern der an der formwechselnden Umwandlung beteiligten Rechtsträger ist, wenn sie binnen sechs Monaten nach dem Tag, an dem die Eintragung der Umwandlung in das Register des Sitzes desjenigen Rechtsträgers, dessen Gläubiger sie sind, nach § 19 Abs. 3 UmwG als bekannt gemacht gilt, ihren Anspruch nach Grund und Höhe schriftlich anmelden, Sicherheit zu leisten, soweit sie nicht Befriedigung verlangen können. Dieses Recht steht den Gläubigern jedoch nur zu, wenn sie glaubhaft machen, dass durch die formwechselnde Umwandlung die Erfüllung der Forderung gefährdet wird."
    },
    {
      "date": "2025-05-02",
      "id": "107943",
      "original_text": "Registerbekanntmachung nach dem Umwandlungsgesetz\nNiedersachsen Amtsgericht Braunschweig HRB 205557\nVolkswagen Group Beteiligungen GmbH – Wolfsburg",
      "type": "Registerbekanntmachung nach dem Umwandlungsgesetz",
      "state": "Niedersachsen",
      "amtsgericht": "Amtsgericht Braunschweig",
      "registernummer": "HRB 205557",
      "registerart": "HRB",
      "company_name": "Volkswagen Group Beteiligungen GmbH",
      "company_seat": "Wolfsburg",
      "details": "02.05.2025 (Bekanntmachungsdatum)\n\nNiedersachsen Amtsgericht Braunschweig HRB 205557\nRegisterbekanntmachung nach dem Umwandlungsgesetz 02.05.2025 (Eintragungsdatum)\n\nVolkswagen Group Beteiligungen GmbH\nGesellschaft mit beschränkter Haftung\nWolfsburg\n\nDen Gläubigern der an der Abspaltung beteiligten Rechtsträger ist, wenn sie binnen sechs Monaten nach dem Tag, an dem die Eintragung der Abspaltung in das Register des Sitzes desjenigen Rechtsträgers, dessen Gläubiger sie sind, nach § 19 Abs. 3 UmwG als bekannt gemacht gilt, ihren Anspruch nach Grund und Höhe schriftlich anmelden, Sicherheit zu leisten, soweit sie nicht Befriedigung verlangen können. Dieses Recht steht den Gläubigern jedoch nur zu, wenn sie glaubhaft machen, dass durch die Abspaltung die Erfüllung der Forderung gefährdet wird."
    },
    {
      "date": "2025-05-02",
      "id": "107944",
      "original_text": "Registerbekanntmachung nach dem Umwandlungsgesetz\nRheinland-Pfalz Amtsgericht Ludwigshafen a.Rhein (Ludwigshafen) HRB 51747\nStädtler und Beck GmbH – Speyer",
      "type": "Registerbekanntmachung nach dem Umwandlungsgesetz",
      "state": "Rheinland-Pfalz",
      "amtsgericht": "Amtsgericht Ludwigshafen a.Rhein (Ludwigshafen)",
      "registernummer": "HRB 51747",
      "registerart": "HRB",
      "company_name": "Städtler und Beck GmbH",
      "company_seat": "Speyer",
      "details": "02.05.2025 (Bekanntmachungsdatum)\n\nRheinland-Pfalz Amtsgericht Ludwigshafen a.Rhein (Ludwigshafen) HRB 51747\nRegisterbekanntmachung nach dem Umwandlungsgesetz\n\nStädtler und Beck GmbH\nGesellschaft mit beschränkter Haftung\nSpeyer\n\nAls nicht eingetragen wird veröffentlicht: Den Gläubigern der an der Verschmelzung beteiligten Rechtsträger ist, wenn sie binnen sechs Monaten nach dem Tag, an dem die Eintragung der Verschmelzung in das Register des Sitzes desjenigen Rechtsträgers,dessen Gläubiger sie sind, nach § 19 Abs. 3 UmwG als bekannt gemacht gilt, ihren Anspruch nach Grund und Höhe schriftlich anmelden, Sicherheit zu leisten, soweit sie nicht Befriedigung verlangen können. Dieses Recht steht den Gläubigern jedoch nur zu, wenn sie glaubhaft machen, dass durch die Verschmelzung die Erfüllungd er Forderung gefährdet wird."
    },
    {
      "date": "2025-05-02",
      "id": "107945",
      "original_text": "Registerbekanntmachung nach dem Umwandlungsgesetz\nRheinland-Pfalz Amtsgericht Ludwigshafen a.Rhein (Ludwigshafen) HRB 70099\nINTUB GmbH – Speyer",
      "type": "Registerbekanntmachung nach dem Umwandlungsgesetz",
      "state": "Rheinland-Pfalz",
      "amtsgericht": "Amtsgericht Ludwigshafen a.Rhein (Ludwigshafen)",
      "registernummer": "HRB 70099",
      "registerart": "HRB",
      "company_name": "INTUB GmbH",
      "company_seat": "Speyer",
      "details": "02.05.2025 (Bekanntmachungsdatum)\n\nRheinland-Pfalz Amtsgericht Ludwigshafen a.Rhein (Ludwigshafen) HRB 70099\nRegisterbekanntmachung nach dem Umwandlungsgesetz 02.05.2025 (Eintragungsdatum)\n\nINTUB GmbH\nGesellschaft mit beschränkter Haftung\nSpeyer\n\nAls nicht eingetragen wird veröffentlicht: Den Gläubigern der an der Verschmelzung beteiligten Rechtsträger ist, wenn sie binnen sechs Monaten nach dem Tag, an dem die Eintragung der Verschmelzung in das Register des Sitzes desjenigen Rechtsträgers,dessen Gläubiger sie sind, nach § 19 Abs. 3 UmwG als bekannt gemacht gilt, ihren Anspruch nach Grund und Höhe schriftlich anmelden, Sicherheit zu leisten, soweit sie nicht Befriedigung verlangen können. Dieses Recht steht den Gläubigern jedoch nur zu, wenn sie glaubhaft machen, dass durch die Verschmelzung die Erfüllungd er Forderung gefährdet wird."
    },
    {
      "date": "2025-05-02",
      "id": "107946",
      "original_text": "Registerbekanntmachung nach dem Umwandlungsgesetz\nBremen Amtsgericht Bremen HRA 26399\nBrunel Service GmbH & Co. KG – Bremen",
      "type": "Registerbekanntmachung nach dem Umwandlungsgesetz",
      "state": "Bremen",
      "amtsgericht": "Amtsgericht Bremen",
      "registernummer": "HRA 26399",
      "registerart": "HRA",
      "company_name": "Brunel Service GmbH & Co. KG",
      "company_seat": "Bremen",
      "details": "02.05.2025 (Bekanntmachungsdatum)\n\nBremen Amtsgericht Bremen HRA 26399\nRegisterbekanntmachung nach dem Umwandlungsgesetz 30.04.2025 (Eintragungsdatum)\n\nBrunel Service GmbH & Co. KG\nKommanditgesellschaft\nBremen\n\nZu Eintragungsnummer 9 vom 30.04.2025 wird als nicht eingetragen veröffentlicht: Den Gläubigern der an der Verschmelzung beteiligten Rechtsträger ist, wenn sie binnen sechs Monaten nach dem Tag, an dem die Eintragung der Verschmelzung in das Register des Sitzes desjenigen Rechtsträgers, dessen Gläubiger sie sind, als bekannt gemacht gilt, ihren Anspruch nach Grund und Höhe schriftlich anmelden, Sicherheit zu leisten, soweit sie nicht Befriedigung verlangen können. Dieses Recht steht den Gläubigern jedoch nur zu, wenn sie glaubhaft machen, dass durch die Verschmelzung die Erfüllung ihrer Forderung gefährdet wird. Das Recht, Sicherheitsleistung zu verlangen, steht Gläubigern nicht zu, die im Falle der Insolvenz ein Recht auf vorzugsweise Befriedigung aus einer Deckungsmasse haben, die nach gesetzlicher Vorschrift zu ihrem Schutz errichtet und staatlich überwacht ist."
    },
    {
      "date": "2025-05-02",
      "id": "107947",
      "original_text": "Registerbekanntmachung nach dem Umwandlungsgesetz\nBremen Amtsgericht Bremen HRB 16935\nBrunel GmbH – Bremen",
      "type": "Registerbekanntmachung nach dem Umwandlungsgesetz",
      "state": "Bremen",
      "amtsgericht": "Amtsgericht Bremen",
      "registernummer": "HRB 16935",
      "registerart": "HRB",
      "company_name": "Brunel GmbH",
      "company_seat": "Bremen",
      "details": "02.05.2025 (Bekanntmachungsdatum)\n\nBremen Amtsgericht Bremen HRB 16935\nRegisterbekanntmachung nach dem Umwandlungsgesetz 30.04.2025 (Eintragungsdatum)\n\nBrunel GmbH\nGesellschaft mit beschränkter Haftung\nBremen\n\nZu Eintragungsnummer 25 vom 30.04.2025 wird als nicht eingetragen veröffentlicht: Den Gläubigern der an der Verschmelzung beteiligten Rechtsträger ist, wenn sie binnen sechs Monaten nach dem Tag, an dem die Eintragung der Verschmelzung in das Register des Sitzes desjenigen Rechtsträgers, dessen Gläubiger sie sind, als bekannt gemacht gilt, ihren Anspruch nach Grund und Höhe schriftlich anmelden, Sicherheit zu leisten, soweit sie nicht Befriedigung verlangen können. Dieses Recht steht den Gläubigern jedoch nur zu, wenn sie glaubhaft machen, dass durch die Verschmelzung die Erfüllung ihrer Forderung gefährdet wird. Das Recht, Sicherheitsleistung zu verlangen, steht Gläubigern nicht zu, die im Falle der Insolvenz ein Recht auf vorzugsweise Befriedigung aus einer Deckungsmasse haben, die nach gesetzlicher Vorschrift zu ihrem Schutz errichtet und staatlich überwacht ist."
    },
    {
      "date": "2025-05-02",
      "id": "107948",
      "original_text": "Löschungsankündigung\nBremen Amtsgericht Bremen HRB 17017\nIVB Bau GmbH – Bremen",
      "type": "Löschungsankündigung",
      "state": "Bremen",
      "amtsgericht": "Amtsgericht Bremen",
      "registernummer": "HRB 17017",
      "registerart": "HRB",
      "company_name": "IVB Bau GmbH",
      "company_seat": "Bremen",
      "details": "02.05.2025 (Bekanntmachungsdatum)\n\nBremen Amtsgericht Bremen HRB 17017\nLöschungsankündigung\n\nIVB Bau GmbH\nGesellschaft mit beschränkter Haftung\nBremen\n\nEs ist beabsichtigt die im Handelsregister eingetragene Gesellschaft von Amts wegen gemäß § 394 FamFG zu löschen. Gegen die Löschung kann beim AG Bremen schriftlich oder zu Protokoll der Geschäftsstelle Widerspruch eingelegt werden. Widerspruchsfrist 4 Wochen."
    },
    {
      "date": "2025-05-02",
      "id": "107949",
      "original_text": "Löschungsankündigung\nNordrhein-Westfalen Amtsgericht Köln HRB 94659\nLittle Outlet GmbH – Köln",
      "type": "Löschungsankündigung",
      "state": "Nordrhein-Westfalen",
      "amtsgericht": "Amtsgericht Köln",
      "registernummer": "HRB 94659",
      "registerart": "HRB",
      "company_name": "Little Outlet GmbH",
      "company_seat": "Köln",
      "details": "02.05.2025 (Bekanntmachungsdatum)\n\nNordrhein-Westfalen Amtsgericht Köln HRB 94659\nLöschungsankündigung\n\nLittle Outlet GmbH\nGesellschaft mit beschränkter Haftung\nKöln\n\nDas Registergericht beabsichtigt die Gesellschaft von Amts wegen nach § 394 FamFG zu löschen. Die Frist zur Erhebung eines Widerspruchs ist auf einen Monat festgesetzt."
    },
    {
      "date": "2025-05-02",
      "id": "107950",
      "original_text": "Registerbekanntmachung nach dem Umwandlungsgesetz\nNordrhein-Westfalen Amtsgericht Düsseldorf HRB 75146\nBoston Scientific Medizintechnik GmbH – Ratingen",
      "type": "Registerbekanntmachung nach dem Umwandlungsgesetz",
      "state": "Nordrhein-Westfalen",
      "amtsgericht": "Amtsgericht Düsseldorf",
      "registernummer": "HRB 75146",
      "registerart": "HRB",
      "company_name": "Boston Scientific Medizintechnik GmbH",
      "company_seat": "Ratingen",
      "details": "02.05.2025 (Bekanntmachungsdatum)\n\nNordrhein-Westfalen Amtsgericht Düsseldorf HRB 75146\nRegisterbekanntmachung nach dem Umwandlungsgesetz 02.05.2025 (Eintragungsdatum)\n\nBoston Scientific Medizintechnik GmbH\nGesellschaft mit beschränkter Haftung\nRatingen\n\nDen Gläubigern der an der Verschmelzung beteiligten Rechtsträger ist, wenn sie binnen sechs Monaten nach dem Tag, an dem die Eintragung der Verschmelzung in das Register des Sitzes desjenigen Rechtsträgers, dessen Gläubiger sie sind, nach § 19 Absatz 3 UmwG als bekanntgemacht gilt, ihren Anspruch nach Grund und Höhe schriftlich anmelden, Sicherheit zu leisten, soweit sie nicht Befriedigung verlangen können. Dieses Recht steht den Gläubigern jedoch nur zu, wenn sie glaubhaft machen, dass durch die Verschmelzung die Erfüllung ihrer Forderung gefährdet wird."
    },
    {
      "date": "2025-05-02",
      "id": "107951",
      "original_text": "Registerbekanntmachung nach dem Umwandlungsgesetz\nNordrhein-Westfalen Amtsgericht Düsseldorf HRA 20613\nNaxos Objekt Lüdenscheid SARL & Co. KG – Düsseldorf",
      "type": "Registerbekanntmachung nach dem Umwandlungsgesetz",
      "state": "Nordrhein-Westfalen",
      "amtsgericht": "Amtsgericht Düsseldorf",
      "registernummer": "HRA 20613",
      "registerart": "HRA",
      "company_name": "Naxos Objekt Lüdenscheid SARL & Co. KG",
      "company_seat": "Düsseldorf",
      "details": "02.05.2025 (Bekanntmachungsdatum)\n\nNordrhein-Westfalen Amtsgericht Düsseldorf HRA 20613\nDie Registerbekanntmachung ist nachträglich am 20.05.2025 um 20:01 Uhr gelöscht worden.\nWegen der Einzelheiten und näherer Auskünfte wenden Sie sich bitte an das Amtsgericht Düsseldorf ."
    },
    {
      "date": "2025-05-02",
      "id": "107952",
      "original_text": "Registerbekanntmachung nach dem Umwandlungsgesetz\nNordrhein-Westfalen Amtsgericht Bad Oeynhausen HRB 6838\nAbet GmbH – Herford",
      "type": "Registerbekanntmachung nach dem Umwandlungsgesetz",
      "state": "Nordrhein-Westfalen",
      "amtsgericht": "Amtsgericht Bad Oeynhausen",
      "registernummer": "HRB 6838",
      "registerart": "HRB",
      "company_name": "Abet GmbH",
      "company_seat": "Herford",
      "details": "02.05.2025 (Bekanntmachungsdatum)\n\nNordrhein-Westfalen Amtsgericht Bad Oeynhausen HRB 6838\nRegisterbekanntmachung nach dem Umwandlungsgesetz 02.05.0205 (Eintragungsdatum)\n\nAbet GmbH\nGesellschaft mit beschränkter Haftung\nHerford\n\nEs wird darauf hingewiesen, dass ein Verschmelzungsplan oder sein Entwurf über eine grenzüberschreitende Verschmelzung zur Aufnahme mit folgenden Rechtsträgern beim Handelsregister eingereicht worden ist:  Abet Laminati S.p.A. mit Sitz in Bra (CN)/Italien (Registro delle imprese 00000115819) (Società per azioni - Aktiengesellschaft nach italienischem Recht) als übernehmende Gesellschaft.\nDie Anteilsinhaber, die Gläubiger sowie die zuständigen Betriebsräte der an der grenzüberschreitenden Verschmelzung beteiligten Gesellschaften oder, soweit es keinen Betriebsrat gibt, die Arbeitnehmer der an der grenzüberschreitenden Verschmelzung beteiligten Gesellschaften, können der jeweiligen Gesellschaft spätestens fünf Arbeitstage vor dem Tag der Gesellschafterversammlung Bemerkungen zum Verschmelzungsplan übermitteln."
    },
    {
      "date": "2025-05-02",
      "id": "107953",
      "original_text": "Sonstige Registerbekanntmachung\nNordrhein-Westfalen Amtsgericht Düsseldorf HRA 27730\nLysiros Aachen ME SARL & Co. KG – Düsseldorf",
      "type": "Sonstige Registerbekanntmachung",
      "state": "Nordrhein-Westfalen",
      "amtsgericht": "Amtsgericht Düsseldorf",
      "registernummer": "HRA 27730",
      "registerart": "HRA",
      "company_name": "Lysiros Aachen ME SARL & Co. KG",
      "company_seat": "Düsseldorf",
      "details": "02.05.2025 (Bekanntmachungsdatum)\n\nNordrhein-Westfalen Amtsgericht Düsseldorf HRA 27730\nDie Registerbekanntmachung ist nachträglich am 19.05.2025 um 20:01 Uhr gelöscht worden.\nWegen der Einzelheiten und näherer Auskünfte wenden Sie sich bitte an das Amtsgericht Düsseldorf ."
    },
    {
      "date": "2025-05-02",
      "id": "107954",
      "original_text": "Registerbekanntmachung nach dem Umwandlungsgesetz\nNordrhein-Westfalen Amtsgericht Dortmund HRB 36464\nNerdSense UG (haftungsbeschränkt) – Dortmund",
      "type": "Registerbekanntmachung nach dem Umwandlungsgesetz",
      "state": "Nordrhein-Westfalen",
      "amtsgericht": "Amtsgericht Dortmund",
      "registernummer": "HRB 36464",
      "registerart": "HRB",
      "company_name": "NerdSense UG (haftungsbeschränkt)",
      "company_seat": "Dortmund",
      "details": "02.05.2025 (Bekanntmachungsdatum)\n\nNordrhein-Westfalen Amtsgericht Dortmund HRB 36464\nRegisterbekanntmachung nach dem Umwandlungsgesetz 02.05.2025 (Eintragungsdatum)\n\nNerdSense UG (haftungsbeschränkt)\nGesellschaft mit beschränkter Haftung\nDortmund\n\nDen Gläubigern der an der Verschmelzung beteiligten Rechtsträger ist, wenn sie binnen sechs Monaten nach dem Tag, an dem die Eintragung der Verschmelzung in das Register des Sitzes desjenigen Rechtsträgers, dessen Gläubiger sie sind, nach § 19 Absatz 3 UmwG als bekanntgemacht gilt, ihren Anspruch nach Grund und Höhe schriftlich anmelden, Sicherheit zu leisten, soweit sie nicht Befriedigung verlangen können. Dieses Recht steht den Gläubigern jedoch nur zu, wenn sie glaubhaft machen, dass durch die Verschmelzung die Erfüllung ihrer Forderung gefährdet wird."
    },
    {
      "date": "2025-05-02",
      "id": "107955",
      "original_text": "Registerbekanntmachung nach dem Umwandlungsgesetz\nNordrhein-Westfalen Amtsgericht Köln HRB 84977\nplusserver GmbH – Köln",
      "type": "Registerbekanntmachung nach dem Umwandlungsgesetz",
      "state": "Nordrhein-Westfalen",
      "amtsgericht": "Amtsgericht Köln",
      "registernummer": "HRB 84977",
      "registerart": "HRB",
      "company_name": "plusserver GmbH",
      "company_seat": "Köln",
      "details": "02.05.2025 (Bekanntmachungsdatum)\n\nNordrhein-Westfalen Amtsgericht Köln HRB 84977\nRegisterbekanntmachung nach dem Umwandlungsgesetz 02.05.2025 (Eintragungsdatum)\n\nplusserver GmbH\nGesellschaft mit beschränkter Haftung\nKöln\n\nDen Gläubigern der an der Ausgliederung beteiligten Rechtsträger ist, wenn sie binnen sechs Monaten nach dem Tag, an dem die Eintragung der Ausgliederung in das Register des Sitzes desjenigen Rechtsträgers, dessen Gläubiger sie sind, nach § 19 Absatz 3 UmwG als bekanntgemacht gilt, ihren Anspruch nach Grund und Höhe schriftlich anmelden, Sicherheit zu leisten, soweit sie nicht Befriedigung verlangen können. Dieses Recht steht den Gläubigern jedoch nur zu, wenn sie glaubhaft machen, dass durch die Ausgliederung die Erfüllung ihrer Forderung gefährdet wird."
    },
    {
      "date": "2025-05-02",
      "id": "107956",
      "original_text": "Einreichung neuer Dokumente\nNordrhein-Westfalen Amtsgericht Bonn HRB 355\nVereinigte Bonner Wohnungsbau Aktiengesellschaft – Bonn",
      "type": "Einreichung neuer Dokumente",
      "state": "Nordrhein-Westfalen",
      "amtsgericht": "Amtsgericht Bonn",
      "registernummer": "HRB 355",
      "registerart": "HRB",
      "company_name": "Vereinigte Bonner Wohnungsbau Aktiengesellschaft",
      "company_seat": "Bonn",
      "details": "02.05.2025 (Bekanntmachungsdatum)\n\nNordrhein-Westfalen Amtsgericht Bonn HRB 355\nEinreichung neuer Dokumente\n\nVereinigte Bonner Wohnungsbau Aktiengesellschaft\nAktiengesellschaft\nBonn\n\nDem Registergericht ist eine neue Liste der Mitglieder des Aufsichtsrates eingereicht worden."
    },
    {
      "date": "2025-05-02",
      "id": "107957",
      "original_text": "Sonstige Registerbekanntmachung\nNordrhein-Westfalen Amtsgericht Düsseldorf HRA 21954\nNaxos Erste Objekt SARL & Co. KG – Düsseldorf",
      "type": "Sonstige Registerbekanntmachung",
      "state": "Nordrhein-Westfalen",
      "amtsgericht": "Amtsgericht Düsseldorf",
      "registernummer": "HRA 21954",
      "registerart": "HRA",
      "company_name": "Naxos Erste Objekt SARL & Co. KG",
      "company_seat": "Düsseldorf",
      "details": "02.05.2025 (Bekanntmachungsdatum)\n\nNordrhein-Westfalen Amtsgericht Düsseldorf HRA 21954\nDie Registerbekanntmachung ist nachträglich am 20.05.2025 um 20:01 Uhr gelöscht worden.\nWegen der Einzelheiten und näherer Auskünfte wenden Sie sich bitte an das Amtsgericht Düsseldorf ."
    },
    {
      "date": "2025-05-02",
      "id": "107958",
      "original_text": "Registerbekanntmachung nach dem Umwandlungsgesetz\nNordrhein-Westfalen Amtsgericht Köln VR 600319 früher Amtsgericht Gummersbach\nVerein für Leibesübung von 1861 e.V. – Gummersbach",
      "type": "Registerbekanntmachung nach dem Umwandlungsgesetz",
      "state": "Nordrhein-Westfalen",
      "amtsgericht": "Amtsgericht Köln",
      "registernummer": "VR 600319",
      "registerart": "VR",
      "company_name": "Verein für Leibesübung von 1861 e.V.",
      "company_seat": "Gummersbach",
      "former_amtsgericht": "Gummersbach",
      "details": "02.05.2025 (Bekanntmachungsdatum)\n\nNordrhein-Westfalen Amtsgericht Köln VR 600319 früher Amtsgericht Gummersbach\nRegisterbekanntmachung nach dem Umwandlungsgesetz 02.05.2025 (Eintragungsdatum)\n\nVerein für Leibesübung von 1861 e.V.\neingetragener Verein\nGummersbach\n\nDen Gläubigern der an der Verschmelzung beteiligten Rechtsträger ist, wenn sie binnen sechs Monaten nach dem Tag, an dem die Eintragung der Verschmelzung in das Register des Sitzes desjenigen Rechtsträgers, dessen Gläubiger sie sind, nach § 19 Absatz 3 UmwG als bekanntgemacht gilt, ihren Anspruch nach Grund und Höhe schriftlich anmelden, Sicherheit zu leisten, soweit sie nicht Befriedigung verlangen können. Dieses Recht steht den Gläubigern jedoch nur zu, wenn sie glaubhaft machen, dass durch die Verschmelzung die Erfüllung ihrer Forderung gefährdet wird."
    },
    {
      "date": "2025-05-02",
      "id": "107959",
      "original_text": "Registerbekanntmachung nach dem Umwandlungsgesetz\nNordrhein-Westfalen Amtsgericht Düsseldorf HRB 77705\nSPIE Information & Communication Services GmbH – Düsseldorf",
      "type": "Registerbekanntmachung nach dem Umwandlungsgesetz",
      "state": "Nordrhein-Westfalen",
      "amtsgericht": "Amtsgericht Düsseldorf",
      "registernummer": "HRB 77705",
      "registerart": "HRB",
      "company_name": "SPIE Information & Communication Services GmbH",
      "company_seat": "Düsseldorf",
      "details": "02.05.2025 (Bekanntmachungsdatum)\n\nNordrhein-Westfalen Amtsgericht Düsseldorf HRB 77705\nRegisterbekanntmachung nach dem Umwandlungsgesetz 02.05.2025 (Eintragungsdatum)\n\nSPIE Information & Communication Services GmbH\nGesellschaft mit beschränkter Haftung\nDüsseldorf\n\nDen Gläubigern der an der Verschmelzung beteiligten Rechtsträger ist, wenn sie binnen sechs Monaten nach dem Tag, an dem die Eintragung der Verschmelzung in das Register des Sitzes desjenigen Rechtsträgers, dessen Gläubiger sie sind, nach § 19 Absatz 3 UmwG als bekanntgemacht gilt, ihren Anspruch nach Grund und Höhe schriftlich anmelden, Sicherheit zu leisten, soweit sie nicht Befriedigung verlangen können. Dieses Recht steht den Gläubigern jedoch nur zu, wenn sie glaubhaft machen, dass durch die Verschmelzung die Erfüllung ihrer Forderung gefährdet wird."
    },
    {
      "date": "2025-05-02",
      "id": "107960",
      "original_text": "Registerbekanntmachung nach dem Umwandlungsgesetz\nNordrhein-Westfalen Amtsgericht Düsseldorf HRB 82030\nSPIE SAG GmbH – Düsseldorf",
      "type": "Registerbekanntmachung nach dem Umwandlungsgesetz",
      "state": "Nordrhein-Westfalen",
      "amtsgericht": "Amtsgericht Düsseldorf",
      "registernummer": "HRB 82030",
      "registerart": "HRB",
      "company_name": "SPIE SAG GmbH",
      "company_seat": "Düsseldorf",
      "details": "02.05.2025 (Bekanntmachungsdatum)\n\nNordrhein-Westfalen Amtsgericht Düsseldorf HRB 82030\nRegisterbekanntmachung nach dem Umwandlungsgesetz 02.05.2025 (Eintragungsdatum)\n\nSPIE SAG GmbH\nGesellschaft mit beschränkter Haftung\nDüsseldorf\n\nDen Gläubigern der an der Verschmelzung beteiligten Rechtsträger ist, wenn sie binnen sechs Monaten nach dem Tag, an dem die Eintragung der Verschmelzung in das Register des Sitzes desjenigen Rechtsträgers, dessen Gläubiger sie sind, nach § 19 Absatz 3 UmwG als bekanntgemacht gilt, ihren Anspruch nach Grund und Höhe schriftlich anmelden, Sicherheit zu leisten, soweit sie nicht Befriedigung verlangen können. Dieses Recht steht den Gläubigern jedoch nur zu, wenn sie glaubhaft machen, dass durch die Verschmelzung die Erfüllung ihrer Forderung gefährdet wird."
    },
    {
      "date": "2025-05-02",
      "id": "107961",
      "original_text": "Einreichung neuer Dokumente\nNordrhein-Westfalen Amtsgericht Köln HRB 35505\nGothaer Krankenversicherung Aktiengesellschaft – Köln",
      "type": "Einreichung neuer Dokumente",
      "state": "Nordrhein-Westfalen",
      "amtsgericht": "Amtsgericht Köln",
      "registernummer": "HRB 35505",
      "registerart": "HRB",
      "company_name": "Gothaer Krankenversicherung Aktiengesellschaft",
      "company_seat": "Köln",
      "details": "02.05.2025 (Bekanntmachungsdatum)\n\nNordrhein-Westfalen Amtsgericht Köln HRB 35505\nEinreichung neuer Dokumente 02.05.2025 (Eintragungsdatum)\n\nGothaer Krankenversicherung Aktiengesellschaft\nAktiengesellschaft\nKöln\n\nDem Registergericht ist eine neue Liste der Mitglieder des Aufsichtsrates eingereicht worden."
    },
    {
      "date": "2025-05-02",
      "id": "107962",
      "original_text": "Sonstige Registerbekanntmachung\nNordrhein-Westfalen Amtsgericht Düsseldorf HRB 87608\nCOGNOS International SE – Düsseldorf",
      "type": "Sonstige Registerbekanntmachung",
      "state": "Nordrhein-Westfalen",
      "amtsgericht": "Amtsgericht Düsseldorf",
      "registernummer": "HRB 87608",
      "registerart": "HRB",
      "company_name": "COGNOS International SE",
      "company_seat": "Düsseldorf",
      "details": "02.05.2025 (Bekanntmachungsdatum)\n\nNordrhein-Westfalen Amtsgericht Düsseldorf HRB 87608\nSonstige Registerbekanntmachung\n\nCOGNOS International SE\nEuropäische Aktiengesellschaft (SE)\nDüsseldorf\n\nDem Registergericht ist eine Liste der Mitglieder des Aufsichtsrates eingereicht worden."
    },
    {
      "date": "2025-05-02",
      "id": "107963",
      "original_text": "Registerbekanntmachung nach dem Umwandlungsgesetz\nNordrhein-Westfalen Amtsgericht Köln VR 601139 früher Amtsgericht Gummersbach\n1. FC Gummersbach e. V. – Gummersbach",
      "type": "Registerbekanntmachung nach dem Umwandlungsgesetz",
      "state": "Nordrhein-Westfalen",
      "amtsgericht": "Amtsgericht Köln",
      "registernummer": "VR 601139",
      "registerart": "VR",
      "company_name": "1. FC Gummersbach e. V.",
      "company_seat": "Gummersbach",
      "former_amtsgericht": "Gummersbach",
      "details": "02.05.2025 (Bekanntmachungsdatum)\n\nNordrhein-Westfalen Amtsgericht Köln VR 601139 früher Amtsgericht Gummersbach\nRegisterbekanntmachung nach dem Umwandlungsgesetz 02.05.2025 (Eintragungsdatum)\n\n1.  FC Gummersbach e. V.\neingetragener Verein\nGummersbach\n\nDen Gläubigern der an der Verschmelzung beteiligten Rechtsträger ist, wenn sie binnen sechs Monaten nach dem Tag, an dem die Eintragung der Verschmelzung in das Register des Sitzes desjenigen Rechtsträgers, dessen Gläubiger sie sind, nach § 19 Absatz 3 UmwG als bekanntgemacht gilt, ihren Anspruch nach Grund und Höhe schriftlich anmelden, Sicherheit zu leisten, soweit sie nicht Befriedigung verlangen können. Dieses Recht steht den Gläubigern jedoch nur zu, wenn sie glaubhaft machen, dass durch die Verschmelzung die Erfüllung ihrer Forderung gefährdet wird."
    },
    {
      "date": "2025-05-02",
      "id": "107964",
      "original_text": "Registerbekanntmachung nach dem Umwandlungsgesetz\nNordrhein-Westfalen Amtsgericht Gelsenkirchen HRB 5145\nWilms GmbH – Bottrop",
      "type": "Registerbekanntmachung nach dem Umwandlungsgesetz",
      "state": "Nordrhein-Westfalen",
      "amtsgericht": "Amtsgericht Gelsenkirchen",
      "registernummer": "HRB 5145",
      "registerart": "HRB",
      "company_name": "Wilms GmbH",
      "company_seat": "Bottrop",
      "details": "02.05.2025 (Bekanntmachungsdatum)\n\nNordrhein-Westfalen Amtsgericht Gelsenkirchen HRB 5145\nRegisterbekanntmachung nach dem Umwandlungsgesetz 02.05.2025 (Eintragungsdatum)\n\nWilms GmbH\nGesellschaft mit beschränkter Haftung\nBottrop\n\nDen Gläubigern der an der Verschmelzung beteiligten Rechtsträger ist, wenn sie binnen sechs Monaten nach dem Tag, an dem die Eintragung der Verschmelzung in das Register des Sitzes desjenigen Rechtsträgers, dessen Gläubiger sie sind, nach § 19 Absatz 3 UmwG als bekanntgemacht gilt, ihren Anspruch nach Grund und Höhe schriftlich anmelden, Sicherheit zu leisten, soweit sie nicht Befriedigung verlangen können. Dieses Recht steht den Gläubigern jedoch nur zu, wenn sie glaubhaft machen, dass durch die Verschmelzung die Erfüllung ihrer Forderung gefährdet wird."
    },
    {
      "date": "2025-05-02",
      "id": "107965",
      "original_text": "Registerbekanntmachung nach dem Umwandlungsgesetz\nNordrhein-Westfalen Amtsgericht Münster HRA 12032\nDustin Malankowskie & Arthur Fischer OHG – Münster",
      "type": "Registerbekanntmachung nach dem Umwandlungsgesetz",
      "state": "Nordrhein-Westfalen",
      "amtsgericht": "Amtsgericht Münster",
      "registernummer": "HRA 12032",
      "registerart": "HRA",
      "company_name": "Dustin Malankowskie & Arthur Fischer OHG",
      "company_seat": "Münster",
      "details": "02.05.2025 (Bekanntmachungsdatum)\n\nNordrhein-Westfalen Amtsgericht Münster HRA 12032\nRegisterbekanntmachung nach dem Umwandlungsgesetz 02.05.2025 (Eintragungsdatum)\n\nDustin Malankowskie & Arthur Fischer OHG\nOffene Handelsgesellschaft\nMünster\n\nDen Gläubigern der an der formwechselnden Umwandlung beteiligten Rechtsträger ist, wenn sie binnen sechs Monaten nach dem Tag, an dem die Eintragung der formwechselnden Umwandlung in das Register des Sitzes desjenigen Rechtsträgers, dessen Gläubiger sie sind, nach § 19 Absatz 3 UmwG als bekanntgemacht gilt, ihren Anspruch nach Grund und Höhe schriftlich anmelden, Sicherheit zu leisten, soweit sie nicht Befriedigung verlangen können. Dieses Recht steht den Gläubigern jedoch nur zu, wenn sie glaubhaft machen, dass durch die formwechselnden Umwandlung die Erfüllung ihrer Forderung gefährdet wird."
    },
    {
      "date": "2025-05-02",
      "id": "107966",
      "original_text": "Löschungsankündigung\nNordrhein-Westfalen Amtsgericht Köln HRB 90387\nBreed Capital GmbH – Köln",
      "type": "Löschungsankündigung",
      "state": "Nordrhein-Westfalen",
      "amtsgericht": "Amtsgericht Köln",
      "registernummer": "HRB 90387",
      "registerart": "HRB",
      "company_name": "Breed Capital GmbH",
      "company_seat": "Köln",
      "details": "02.05.2025 (Bekanntmachungsdatum)\n\nNordrhein-Westfalen Amtsgericht Köln HRB 90387\nLöschungsankündigung\n\nBreed Capital GmbH\nGesellschaft mit beschränkter Haftung\nKöln\n\nDas Registergericht beabsichtigt, die im Handelsregister eingetragene Gesellschaft gemäß § 394 Absatz 1 FamFG wegen Vermögenslosigkeit von Amts wegen zu löschen. Gegen diese Verfügung kann Widerspruch eingelegt werden. Die Frist zur Erhebung eines Widerspruchs gegen die beabsichtigte Löschung von Amts wegen ist auf einen Monat festgesetzt. Rechtsbehelfsbelehrung: Gegen diese Verfügung können Sie Widerspruch einlegen. Der Widerspruch ist bei dem Amtsgericht Köln, Reichenspergerplatz 1, 50670 Köln schriftlich in deutscher Sprache oder zur Niederschrift der Geschäftsstelle einzulegen. Der Widerspruch kann auch zur Niederschrift der Geschäftsstelle eines jeden Amtsgerichtes abgegeben werden. Die Einlegung ist auch durch Übertragung eines elektronischen Dokuments an die elektronische Poststelle des Gerichts möglich. Das elektronische Dokument muss für die Bearbeitung durch das Gericht geeignet und mit einer qualifizierten elektronischen Signatur der verantwortenden Person versehen sein oder von der verantwortenden Person signiert und auf einem sicheren Übermittlungsweg gemäß § 130a ZPO nach näherer Maßgabe der Verordnung über die technischen Rahmenbedingungen des elektronischen Rechtsverkehrs und über das besondere elektronische Behördenpostfach (BGBl. I, S.3803) eingereicht werden. Weitere Informationen erhalten Sie auf der Internetseite www.justiz.de.Der Widerspruch muss spätestens innerhalb der gesetzten Frist bei dem Amtsgericht Köln eingegangen sein. Dies gilt auch dann, wenn der Widerspruch zur Niederschrift der Geschäftsstelle eines anderen Amtsgerichtes abgegeben wurde. Die Frist beginnt mit der Veröffentlichung. Fällt das Ende der Frist auf einen Sonntag, einen allgemeinen Feiertag oder Sonnabend, so endet die Frist mit Ablauf des nächsten Werktages.\n\nDer Widerspruch muss die Bezeichnung der angefochtenen Verfügung sowie die Erklärung enthalten, dass Widerspruch gegen diese Verfügung eingelegt wird. Er ist zu unterzeichnen und soll begründet werden."
    },
    {
      "date": "2025-05-02",
      "id": "107967",
      "original_text": "Registerbekanntmachung nach dem Umwandlungsgesetz\nNordrhein-Westfalen Amtsgericht Münster HRB 20888\nBrief und mehr Operations Verwaltungsgesellschaft mbH – Münster",
      "type": "Registerbekanntmachung nach dem Umwandlungsgesetz",
      "state": "Nordrhein-Westfalen",
      "amtsgericht": "Amtsgericht Münster",
      "registernummer": "HRB 20888",
      "registerart": "HRB",
      "company_name": "Brief und mehr Operations Verwaltungsgesellschaft mbH",
      "company_seat": "Münster",
      "details": "02.05.2025 (Bekanntmachungsdatum)\n\nNordrhein-Westfalen Amtsgericht Münster HRB 20888\nRegisterbekanntmachung nach dem Umwandlungsgesetz 02.05.2025 (Eintragungsdatum)\n\nBrief und mehr Operations Verwaltungsgesellschaft mbH\nGesellschaft mit beschränkter Haftung\nMünster\n\nDen Gläubigern der an der Verschmelzung beteiligten Rechtsträger ist, wenn sie binnen sechs Monaten nach dem Tag, an dem die Eintragung der Verschmelzung in das Register des Sitzes derjenigen Rechtsträger deren Gläubiger sie sind, nach § 19 Absatz 3 UmwG als bekanntgemacht gilt, ihren Anspruch nach Grund und Höhe schriftlich anmelden, Sicherheit zu leisten, soweit sie nicht Befriedigung verlangen können. Dieses Recht steht den Gläubigern jedoch nur zu, wenn sie glaubhaft machen, dass durch die Verschmelzung die Erfüllung ihrer Forderung gefährdet wird."
    },
    {
      "date": "2025-05-02",
      "id": "107968",
      "original_text": "Registerbekanntmachung nach dem Umwandlungsgesetz\nNordrhein-Westfalen Amtsgericht Münster HRB 10678\nLogistik und mehr Verwaltungsgesellschaft mbH – Münster",
      "type": "Registerbekanntmachung nach dem Umwandlungsgesetz",
      "state": "Nordrhein-Westfalen",
      "amtsgericht": "Amtsgericht Münster",
      "registernummer": "HRB 10678",
      "registerart": "HRB",
      "company_name": "Logistik und mehr Verwaltungsgesellschaft mbH",
      "company_seat": "Münster",
      "details": "02.05.2025 (Bekanntmachungsdatum)\n\nNordrhein-Westfalen Amtsgericht Münster HRB 10678\nRegisterbekanntmachung nach dem Umwandlungsgesetz 02.05.2025 (Eintragungsdatum)\n\nLogistik und mehr Verwaltungsgesellschaft mbH\nGesellschaft mit beschränkter Haftung\nMünster\n\nDen Gläubigern der an der Verschmelzung beteiligten Rechtsträger ist, wenn sie binnen sechs Monaten nach dem Tag, an dem die Eintragung der Verschmelzung in das Register des Sitzes derjenigen Rechtsträger deren Gläubiger sie sind, nach § 19 Absatz 3 UmwG als bekanntgemacht gilt, ihren Anspruch nach Grund und Höhe schriftlich anmelden, Sicherheit zu leisten, soweit sie nicht Befriedigung verlangen können. Dieses Recht steht den Gläubigern jedoch nur zu, wenn sie glaubhaft machen, dass durch die Verschmelzung die Erfüllung ihrer Forderung gefährdet wird."
    },
    {
      "date": "2025-05-02",
      "id": "107969",
      "original_text": "Löschungsankündigung\nNordrhein-Westfalen Amtsgericht Köln HRB 46856\nOEINCK Industrievertretungen GmbH – Rösrath",
      "type": "Löschungsankündigung",
      "state": "Nordrhein-Westfalen",
      "amtsgericht": "Amtsgericht Köln",
      "registernummer": "HRB 46856",
      "registerart": "HRB",
      "company_name": "OEINCK Industrievertretungen GmbH",
      "company_seat": "Rösrath",
      "details": "02.05.2025 (Bekanntmachungsdatum)\n\nNordrhein-Westfalen Amtsgericht Köln HRB 46856\nLöschungsankündigung\n\nOEINCK Industrievertretungen GmbH\nGesellschaft mit beschränkter Haftung\nRösrath\n\nDas Registergericht beabsichtigt die Gesellschaft von Amts wegen nach § 394 FamFG zu löschen. Die Frist zur Erhebung eines Widerspruchs ist auf einen Monat festgesetzt."
    },
    {
      "date": "2025-05-02",
      "id": "107970",
      "original_text": "Registerbekanntmachung nach dem Umwandlungsgesetz\nNordrhein-Westfalen Amtsgericht Münster HRB 12091\nBriefservice Münster Verwaltungsgesellschaft mbH – Münster",
      "type": "Registerbekanntmachung nach dem Umwandlungsgesetz",
      "state": "Nordrhein-Westfalen",
      "amtsgericht": "Amtsgericht Münster",
      "registernummer": "HRB 12091",
      "registerart": "HRB",
      "company_name": "Briefservice Münster Verwaltungsgesellschaft mbH",
      "company_seat": "Münster",
      "details": "02.05.2025 (Bekanntmachungsdatum)\n\nNordrhein-Westfalen Amtsgericht Münster HRB 12091\nRegisterbekanntmachung nach dem Umwandlungsgesetz 02.05.2025 (Eintragungsdatum)\n\nBriefservice Münster Verwaltungsgesellschaft mbH\nGesellschaft mit beschränkter Haftung\nMünster\n\nDen Gläubigern der an der Verschmelzung beteiligten Rechtsträger ist, wenn sie binnen sechs Monaten nach dem Tag, an dem die Eintragung der Verschmelzung in das Register des Sitzes derjenigen Rechtsträger deren Gläubiger sie sind, nach § 19 Absatz 3 UmwG als bekanntgemacht gilt, ihren Anspruch nach Grund und Höhe schriftlich anmelden, Sicherheit zu leisten, soweit sie nicht Befriedigung verlangen können. Dieses Recht steht den Gläubigern jedoch nur zu, wenn sie glaubhaft machen, dass durch die Verschmelzung die Erfüllung ihrer Forderung gefährdet wird."
    },
    {
      "date": "2025-05-02",
      "id": "107971",
      "original_text": "Einreichung neuer Dokumente\nNordrhein-Westfalen Amtsgericht Düsseldorf HRB 107495\nKloeckner Metals Germany GmbH – Düsseldorf",
      "type": "Einreichung neuer Dokumente",
      "state": "Nordrhein-Westfalen",
      "amtsgericht": "Amtsgericht Düsseldorf",
      "registernummer": "HRB 107495",
      "registerart": "HRB",
      "company_name": "Kloeckner Metals Germany GmbH",
      "company_seat": "Düsseldorf",
      "details": "02.05.2025 (Bekanntmachungsdatum)\n\nNordrhein-Westfalen Amtsgericht Düsseldorf HRB 107495\nEinreichung neuer Dokumente\n\nKloeckner Metals Germany GmbH\nGesellschaft mit beschränkter Haftung\nDüsseldorf\n\nDem Registergericht ist eine Liste der Mitglieder des Aufsichtsrates eingereicht worden."
    },
    {
      "date": "2025-05-02",
      "id": "107972",
      "original_text": "Registerbekanntmachung nach dem Umwandlungsgesetz\nNordrhein-Westfalen Amtsgericht Münster HRB 10678\nLogistik und mehr Verwaltungsgesellschaft mbH – Münster",
      "type": "Registerbekanntmachung nach dem Umwandlungsgesetz",
      "state": "Nordrhein-Westfalen",
      "amtsgericht": "Amtsgericht Münster",
      "registernummer": "HRB 10678",
      "registerart": "HRB",
      "company_name": "Logistik und mehr Verwaltungsgesellschaft mbH",
      "company_seat": "Münster",
      "details": "02.05.2025 (Bekanntmachungsdatum)\n\nNordrhein-Westfalen Amtsgericht Münster HRB 10678\nRegisterbekanntmachung nach dem Umwandlungsgesetz 02.05.2025 (Eintragungsdatum)\n\nLogistik und mehr Verwaltungsgesellschaft mbH\nGesellschaft mit beschränkter Haftung\nMünster\n\nDen Gläubigern der an der Verschmelzung beteiligten Rechtsträger ist, wenn sie binnen sechs Monaten nach dem Tag, an dem die Eintragung der Verschmelzung in das Register des Sitzes derjenigen Rechtsträger deren Gläubiger sie sind, nach § 19 Absatz 3 UmwG als bekanntgemacht gilt, ihren Anspruch nach Grund und Höhe schriftlich anmelden, Sicherheit zu leisten, soweit sie nicht Befriedigung verlangen können. Dieses Recht steht den Gläubigern jedoch nur zu, wenn sie glaubhaft machen, dass durch die Verschmelzung die Erfüllung ihrer Forderung gefährdet wird."
    },
    {
      "date": "2025-05-02",
      "id": "107973",
      "original_text": "Registerbekanntmachung nach dem Umwandlungsgesetz\nNordrhein-Westfalen Amtsgericht Essen HRB 18557\nSPIE Energy Solutions GmbH – Essen",
      "type": "Registerbekanntmachung nach dem Umwandlungsgesetz",
      "state": "Nordrhein-Westfalen",
      "amtsgericht": "Amtsgericht Essen",
      "registernummer": "HRB 18557",
      "registerart": "HRB",
      "company_name": "SPIE Energy Solutions GmbH",
      "company_seat": "Essen",
      "details": "02.05.2025 (Bekanntmachungsdatum)\n\nNordrhein-Westfalen Amtsgericht Essen HRB 18557\nRegisterbekanntmachung nach dem Umwandlungsgesetz 02.05.2025 (Eintragungsdatum)\n\nSPIE Energy Solutions GmbH\nGesellschaft mit beschränkter Haftung\nEssen\n\nDen Gläubigern der an der Verschmelzung beteiligten Rechtsträger ist, wenn sie binnen sechs Monaten nach dem Tag, an dem die Eintragung der Verschmelzung in das Register des Sitzes desjenigen Rechtsträgers, dessen Gläubiger sie sind, nach § 19 Absatz 3 UmwG als bekanntgemacht gilt, ihren Anspruch nach Grund und Höhe schriftlich anmelden, Sicherheit zu leisten, soweit sie nicht Befriedigung verlangen können. Dieses Recht steht den Gläubigern jedoch nur zu, wenn sie glaubhaft machen, dass durch die Verschmelzung die Erfüllung ihrer Forderung gefährdet wird."
    },
    {
      "date": "2025-05-02",
      "id": "107974",
      "original_text": "Löschungsankündigung\nNordrhein-Westfalen Amtsgericht Kleve HRB 15920\nRMM Reitsportmesse Magdeburg UG (haftungsbeschränkt) – Xanten",
      "type": "Löschungsankündigung",
      "state": "Nordrhein-Westfalen",
      "amtsgericht": "Amtsgericht Kleve",
      "registernummer": "HRB 15920",
      "registerart": "HRB",
      "company_name": "RMM Reitsportmesse Magdeburg UG (haftungsbeschränkt)",
      "company_seat": "Xanten",
      "details": "02.05.2025 (Bekanntmachungsdatum)\n\nNordrhein-Westfalen Amtsgericht Kleve HRB 15920\nLöschungsankündigung\n\nRMM Reitsportmesse Magdeburg UG (haftungsbeschränkt)\nGesellschaft mit beschränkter Haftung\nXanten\n\nDas Registergericht beabsichtigt die Gesellschaft von Amts wegen nach § 394 FamFG zu löschen. Die Frist zur Erhebung eines Widerspruchs ist auf #DV.Fr(Text=\"Bitte wählen Sie die Widerspruchsfrist aus!\",Eingabe=\"einen Monat\",\"zwei Monate\",\"drei Monate\",\"#insert(Text=\"Freitext\")\"|\"freier Text\") festgesetzt."
    },
    {
      "date": "2025-05-02",
      "id": "107975",
      "original_text": "Löschungsankündigung\nNordrhein-Westfalen Amtsgericht Dortmund HRB 33705\nSan Marco Betriebs GmbH – Dortmund",
      "type": "Löschungsankündigung",
      "state": "Nordrhein-Westfalen",
      "amtsgericht": "Amtsgericht Dortmund",
      "registernummer": "HRB 33705",
      "registerart": "HRB",
      "company_name": "San Marco Betriebs GmbH",
      "company_seat": "Dortmund",
      "details": "02.05.2025 (Bekanntmachungsdatum)\n\nNordrhein-Westfalen Amtsgericht Dortmund HRB 33705\nLöschungsankündigung\n\nSan Marco Betriebs GmbH\nGesellschaft mit beschränkter Haftung\nDortmund\n\nDas Registergericht beabsichtigt die Gesellschaft von Amts wegen nach § 394 FamFG zu löschen. Die Frist zur Erhebung eines Widerspruchs ist auf zwei Monate festgesetzt."
    },
    {
      "date": "2025-05-02",
      "id": "107976",
      "original_text": "Löschungsankündigung\nHessen Amtsgericht Frankfurt am Main HRB 123812\nDLE Management GmbH – Frankfurt am Main",
      "type": "Löschungsankündigung",
      "state": "Hessen",
      "amtsgericht": "Amtsgericht Frankfurt am Main",
      "registernummer": "HRB 123812",
      "registerart": "HRB",
      "company_name": "DLE Management GmbH",
      "company_seat": "Frankfurt am Main",
      "details": "02.05.2025 (Bekanntmachungsdatum)\n\nHessen Amtsgericht Frankfurt am Main HRB 123812\nLöschungsankündigung 02.05.2025 (Eintragungsdatum)\n\nDLE Management GmbH\nGesellschaft mit beschränkter Haftung\nFrankfurt am Main\n\nEs ist beabsichtigt die Gesellschaft wegen Vermögenslosigkeit gemäß § 394 FamFG von Amts wegen zu löschen. Hiergegen kann innerhalb eines Monats nach dieser Veröffentlichung Widerspruch bei dem Amtsgericht Frankfurt am Main eingelegt werden."
    },
    {
      "date": "2025-05-02",
      "id": "107977",
      "original_text": "Registerbekanntmachung nach dem Umwandlungsgesetz\nHessen Amtsgericht Korbach HRA 1755\nBurg Lichtenfels Meineweh V GmbH & Co. KG – Lichtenfels",
      "type": "Registerbekanntmachung nach dem Umwandlungsgesetz",
      "state": "Hessen",
      "amtsgericht": "Amtsgericht Korbach",
      "registernummer": "HRA 1755",
      "registerart": "HRA",
      "company_name": "Burg Lichtenfels Meineweh V GmbH & Co. KG",
      "company_seat": "Lichtenfels",
      "details": "02.05.2025 (Bekanntmachungsdatum)\n\nHessen Amtsgericht Korbach HRA 1755\nRegisterbekanntmachung nach dem Umwandlungsgesetz 02.05.2025 (Eintragungsdatum)\n\nBurg Lichtenfels Meineweh V GmbH & Co. KG\nKommanditgesellschaft\nLichtenfels\n\nDen Gläubigern der an der Verschmelzung beteiligten Rechtsträger ist, wenn sie binnen sechs Monaten nach dem Tag, an dem die Eintragung der Verschmelzung in das Register des Sitzes derjenigen Rechtsträger deren Gläubiger sie sind, nach § 19 Absatz 3 UmwG bekannt gemacht worden ist, ihren Anspruch nach Grund und Höhe schriftlich anmelden, Sicherheit zu leisten, soweit sie nicht Befriedigung verlangen können. Dieses Recht steht den Gläubigern jedoch nur zu, wenn sie glaubhaft machen, dass durch die Verschmelzung die Erfüllung ihrer Forderung gefährdet wird."
    },
    {
      "date": "2025-05-02",
      "id": "107978",
      "original_text": "Registerbekanntmachung nach dem Umwandlungsgesetz\nHessen Amtsgericht Korbach HRA 1783\nWindkraft Meineweh VII GmbH & Co. KG – Lichtenfels",
      "type": "Registerbekanntmachung nach dem Umwandlungsgesetz",
      "state": "Hessen",
      "amtsgericht": "Amtsgericht Korbach",
      "registernummer": "HRA 1783",
      "registerart": "HRA",
      "company_name": "Windkraft Meineweh VII GmbH & Co. KG",
      "company_seat": "Lichtenfels",
      "details": "02.05.2025 (Bekanntmachungsdatum)\n\nHessen Amtsgericht Korbach HRA 1783\nRegisterbekanntmachung nach dem Umwandlungsgesetz 02.05.2025 (Eintragungsdatum)\n\nWindkraft Meineweh VII GmbH & Co. KG\nKommanditgesellschaft\nLichtenfels\n\nDen Gläubigern der an der Verschmelzung beteiligten Rechtsträger ist, wenn sie binnen sechs Monaten nach dem Tag, an dem die Eintragung der Verschmelzung in das Register des Sitzes derjenigen Rechtsträger deren Gläubiger sie sind, nach § 19 Absatz 3 UmwG bekannt gemacht worden ist, ihren Anspruch nach Grund und Höhe schriftlich anmelden, Sicherheit zu leisten, soweit sie nicht Befriedigung verlangen können. Dieses Recht steht den Gläubigern jedoch nur zu, wenn sie glaubhaft machen, dass durch die Verschmelzung die Erfüllung ihrer Forderung gefährdet wird."
    },
    {
      "date": "2025-05-02",
      "id": "107979",
      "original_text": "Registerbekanntmachung nach dem Umwandlungsgesetz\nHessen Amtsgericht Kassel HRB 16269\nConduent Technical Service GmbH – Kassel",
      "type": "Registerbekanntmachung nach dem Umwandlungsgesetz",
      "state": "Hessen",
      "amtsgericht": "Amtsgericht Kassel",
      "registernummer": "HRB 16269",
      "registerart": "HRB",
      "company_name": "Conduent Technical Service GmbH",
      "company_seat": "Kassel",
      "details": "02.05.2025 (Bekanntmachungsdatum)\n\nHessen Amtsgericht Kassel HRB 16269\nRegisterbekanntmachung nach dem Umwandlungsgesetz 02.05.2025 (Eintragungsdatum)\n\nConduent Technical Service GmbH\nGesellschaft mit beschränkter Haftung\nKassel\n\nDen Gläubigern der an der Verschmelzung beteiligten Rechtsträger ist, wenn sie binnen sechs Monaten nach dem Tag, an dem die Eintragung der Verschmelzung in das Register des Sitzes desjenigen Rechtsträgers, dessen Gläubiger sie sind, nach § 19 Absatz 3 UmwG bekannt gemacht worden ist, ihren Anspruch nach Grund und Höhe schriftlich anmelden, Sicherheit zu leisten, soweit sie nicht Befriedigung verlangen können. Dieses Recht steht den Gläubigern jedoch nur zu, wenn sie glaubhaft machen, dass durch die Verschmelzung die Erfüllung ihrer Forderung gefährdet wird."
    }
  ]
}