{
  "date": "2025-05-27",
  "date_of_scrape": "2025-05-31T13:11:41.416Z",
  "tool_version": "0.2.0",
  "number_of_announcements": 149,
  "announcements": [
    {
      "date": "2025-05-27",
      "id": "110262",
      "original_text": "Registerbekanntmachung nach dem Umwandlungsgesetz\nBayern Amtsgericht Traunstein HRB 9889\nMic Lab GmbH – Neuötting",
      "type": "Registerbekanntmachung nach dem Umwandlungsgesetz",
      "state": "Bayern",
      "amtsgericht": "Amtsgericht Traunstein",
      "registernummer": "HRB 9889",
      "registerart": "HRB",
      "company_name": "Mic Lab GmbH",
      "company_seat": "Neuötting",
      "details": "27.05.2025 (Bekanntmachungsdatum)\n\nBayern Amtsgericht Traunstein HRB 9889\nRegisterbekanntmachung nach dem Umwandlungsgesetz 26.05.2025 (Eintragungsdatum)\n\nMic Lab GmbH\nGesellschaft mit beschränkter Haftung\nNeuötting\n\nDen Gläubigern der an der Verschmelzung beteiligten Rechtsträger ist, wenn sie binnen sechs Monaten nach dem Tag, an dem die Eintragung der Verschmelzung in das Register des Sitzes desjenigen Rechtsträgers, dessen Gläubiger sie sind, nach § 19 Abs. 3 UmwG als bekannt gemacht gilt, ihren Anspruch nach Grund und Höhe in Textform anmelden, Sicherheit zu leisten, soweit sie nicht Befriedigung verlangen können. Dieses Recht steht den Gläubigern jedoch nur zu, wenn sie glaubhaft machen, dass durch die Verschmelzung die Erfüllung ihrer Forderung gefährdet wird."
    },
    {
      "date": "2025-05-27",
      "id": "110263",
      "original_text": "Löschungsankündigung\nBayern Amtsgericht Kempten (Allgäu) HRB 15912\nDONATO'S PIZZA UG (haftungsbeschränkt) – Waltenhofen",
      "type": "Löschungsankündigung",
      "state": "Bayern",
      "amtsgericht": "Amtsgericht Kempten (Allgäu)",
      "registernummer": "HRB 15912",
      "registerart": "HRB",
      "company_name": "DONATO'S PIZZA UG (haftungsbeschränkt)",
      "company_seat": "Waltenhofen",
      "details": "27.05.2025 (Bekanntmachungsdatum)\n\nBayern Amtsgericht Kempten (Allgäu) HRB 15912\nLöschungsankündigung\n\nDONATO'S PIZZA UG (haftungsbeschränkt)\nGesellschaft mit beschränkter Haftung\nWaltenhofen\n\nDas Registergericht beabsichtigt, die im Handelsregister eingetragene Gesellschaft wegen Vermögenslosigkeit von Amts wegen nach § 394 FamFG zu löschen. Die Frist zur Erhebung eines Widerspruchs ist auf einen Monat festgesetzt."
    },
    {
      "date": "2025-05-27",
      "id": "110264",
      "original_text": "Registerbekanntmachung nach dem Umwandlungsgesetz\nBayern Amtsgericht München HRB 159189\nFBI Steuerungstechnik GmbH – Eberfing",
      "type": "Registerbekanntmachung nach dem Umwandlungsgesetz",
      "state": "Bayern",
      "amtsgericht": "Amtsgericht München",
      "registernummer": "HRB 159189",
      "registerart": "HRB",
      "company_name": "FBI Steuerungstechnik GmbH",
      "company_seat": "Eberfing",
      "details": "27.05.2025 (Bekanntmachungsdatum)\n\nBayern Amtsgericht München HRB 159189\nRegisterbekanntmachung nach dem Umwandlungsgesetz 26.05.2025 (Eintragungsdatum)\n\nFBI Steuerungstechnik GmbH\nGesellschaft mit beschränkter Haftung\nEberfing\n\nDen Gläubigern der an der Verschmelzung beteiligten Rechtsträger ist, wenn sie binnen sechs Monaten nach dem Tag, an dem die Eintragung der Verschmelzung in das Register des Sitzes desjenigen Rechtsträgers, dessen Gläubiger sie sind, nach § 19 Abs. 3 UmwG als bekannt gemacht gilt, ihren Anspruch nach Grund und Höhe in Textform anmelden, Sicherheit zu leisten, soweit sie nicht Befriedigung verlangen können. Dieses Recht steht den Gläubigern jedoch nur zu, wenn sie glaubhaft machen, dass durch die Verschmelzung die Erfüllung ihrer Forderung gefährdet wird."
    },
    {
      "date": "2025-05-27",
      "id": "110265",
      "original_text": "Registerbekanntmachung nach dem Umwandlungsgesetz\nBayern Amtsgericht Würzburg HRB 5145\nREMONDIS Mainfranken GmbH – Gemünden",
      "type": "Registerbekanntmachung nach dem Umwandlungsgesetz",
      "state": "Bayern",
      "amtsgericht": "Amtsgericht Würzburg",
      "registernummer": "HRB 5145",
      "registerart": "HRB",
      "company_name": "REMONDIS Mainfranken GmbH",
      "company_seat": "Gemünden",
      "details": "27.05.2025 (Bekanntmachungsdatum)\n\nBayern Amtsgericht Würzburg HRB 5145\nRegisterbekanntmachung nach dem Umwandlungsgesetz 26.05.2025 (Eintragungsdatum)\n\nREMONDIS Mainfranken GmbH\nGesellschaft mit beschränkter Haftung\nGemünden\n\nDen Gläubigern der an der Verschmelzung beteiligten Rechtsträger ist, wenn sie binnen sechs Monaten nach dem Tag, an dem die Eintragung der Verschmelzung in das Register des Sitzes desjenigen Rechtsträgers, dessen Gläubiger sie sind, nach § 19 Abs. 3 UmwG als bekannt gemacht gilt, ihren Anspruch nach Grund und Höhe in Textform anmelden, Sicherheit zu leisten, soweit sie nicht Befriedigung verlangen können. Dieses Recht steht den Gläubigern jedoch nur zu, wenn sie glaubhaft machen, dass durch die Verschmelzung die Erfüllung ihrer Forderung gefährdet wird."
    },
    {
      "date": "2025-05-27",
      "id": "110266",
      "original_text": "Registerbekanntmachung nach dem Umwandlungsgesetz\nBayern Amtsgericht München HRB 225155\nBiluca GmbH – München",
      "type": "Registerbekanntmachung nach dem Umwandlungsgesetz",
      "state": "Bayern",
      "amtsgericht": "Amtsgericht München",
      "registernummer": "HRB 225155",
      "registerart": "HRB",
      "company_name": "Biluca GmbH",
      "company_seat": "München",
      "details": "27.05.2025 (Bekanntmachungsdatum)\n\nBayern Amtsgericht München HRB 225155\nRegisterbekanntmachung nach dem Umwandlungsgesetz 26.05.2025 (Eintragungsdatum)\n\nBiluca GmbH\nGesellschaft mit beschränkter Haftung\nMünchen\n\nDen Gläubigern der an der Verschmelzung beteiligten Rechtsträger ist, wenn sie binnen sechs Monaten nach dem Tag, an dem die Eintragung der Verschmelzung in das Register des Sitzes desjenigen Rechtsträgers, dessen Gläubiger sie sind, nach § 19 Abs. 3 UmwG als bekannt gemacht gilt, ihren Anspruch nach Grund und Höhe in Textform anmelden, Sicherheit zu leisten, soweit sie nicht Befriedigung verlangen können. Dieses Recht steht den Gläubigern jedoch nur zu, wenn sie glaubhaft machen, dass durch die Verschmelzung die Erfüllung ihrer Forderung gefährdet wird."
    },
    {
      "date": "2025-05-27",
      "id": "110267",
      "original_text": "Registerbekanntmachung nach dem Umwandlungsgesetz\nBayern Amtsgericht Hof HRB 7091\nWEMAConnect GmbH – Naila",
      "type": "Registerbekanntmachung nach dem Umwandlungsgesetz",
      "state": "Bayern",
      "amtsgericht": "Amtsgericht Hof",
      "registernummer": "HRB 7091",
      "registerart": "HRB",
      "company_name": "WEMAConnect GmbH",
      "company_seat": "Naila",
      "details": "27.05.2025 (Bekanntmachungsdatum)\n\nBayern Amtsgericht Hof HRB 7091\nRegisterbekanntmachung nach dem Umwandlungsgesetz 26.05.2025 (Eintragungsdatum)\n\nWEMAConnect GmbH\nGesellschaft mit beschränkter Haftung\nNaila\n\nDen Gläubigern der an der Ausgliederung beteiligten Rechtsträger ist, wenn sie binnen sechs Monaten nach dem Tag, an dem die Eintragung der Ausgliederung in das Register des Sitzes desjenigen Rechtsträgers, dessen Gläubiger sie sind, nach §§ 125, 19 Abs. 3 UmwG als bekannt gemacht gilt, ihren Anspruch nach Grund und Höhe in Textform anmelden, Sicherheit zu leisten, soweit sie nicht Befriedigung verlangen können. Dieses Recht steht den Gläubigern jedoch nur zu, wenn sie glaubhaft machen, dass durch die Ausgliederung die Erfüllung ihrer Forderung gefährdet wird."
    },
    {
      "date": "2025-05-27",
      "id": "110268",
      "original_text": "Sonstige Registerbekanntmachung\nBayern Amtsgericht Bayreuth VR 200426\nTierhilfe Streuner in Not e.V. – Bayreuth",
      "type": "Sonstige Registerbekanntmachung",
      "state": "Bayern",
      "amtsgericht": "Amtsgericht Bayreuth",
      "registernummer": "VR 200426",
      "registerart": "VR",
      "company_name": "Tierhilfe Streuner in Not e.V.",
      "company_seat": "Bayreuth",
      "details": "27.05.2025 (Bekanntmachungsdatum)\n\nBayern Amtsgericht Bayreuth VR 200426\nSonstige Registerbekanntmachung\n\nTierhilfe Streuner in Not e.V.\neingetragener Verein\nBayreuth\n\nDas Registergericht beabsichtigt, den im Vereinsregister eingetragenen Verein von Amts wegen nach 395 FamFG wegen Wegfalls aller Mitglieder zu löschen. Die Frist zur Erhebung eines Widerspruchs ist auf sechs Wochen festgesetzt."
    },
    {
      "date": "2025-05-27",
      "id": "110269",
      "original_text": "Löschungsankündigung\nBayern Amtsgericht München HRB 182108\nInsel Mühle GmbH – München",
      "type": "Löschungsankündigung",
      "state": "Bayern",
      "amtsgericht": "Amtsgericht München",
      "registernummer": "HRB 182108",
      "registerart": "HRB",
      "company_name": "Insel Mühle GmbH",
      "company_seat": "München",
      "details": "27.05.2025 (Bekanntmachungsdatum)\n\nBayern Amtsgericht München HRB 182108\nLöschungsankündigung\n\nInsel Mühle GmbH\nGesellschaft mit beschränkter Haftung\nMünchen\n\nDas Registergericht beabsichtigt, die im Handelsregister eingetragene Gesellschaft wegen Vermögenslosigkeit von Amts wegen nach § 394 FamFG zu löschen. Die Frist zur Erhebung eines Widerspruchs ist auf drei Monate festgesetzt."
    },
    {
      "date": "2025-05-27",
      "id": "110270",
      "original_text": "Registerbekanntmachung nach dem Umwandlungsgesetz\nBayern Amtsgericht Traunstein HRB 32448\nsogni d'oro della futura GmbH – Unterneukirchen",
      "type": "Registerbekanntmachung nach dem Umwandlungsgesetz",
      "state": "Bayern",
      "amtsgericht": "Amtsgericht Traunstein",
      "registernummer": "HRB 32448",
      "registerart": "HRB",
      "company_name": "sogni d'oro della futura GmbH",
      "company_seat": "Unterneukirchen",
      "details": "27.05.2025 (Bekanntmachungsdatum)\n\nBayern Amtsgericht Traunstein HRB 32448\nRegisterbekanntmachung nach dem Umwandlungsgesetz 26.05.2025 (Eintragungsdatum)\n\nsogni d'oro della futura GmbH\nGesellschaft mit beschränkter Haftung\nUnterneukirchen\n\nDen Gläubigern des formwechselnden Rechtsträgers ist, wenn sie binnen sechs Monaten nach dem Tag, an dem die Eintragung des Formwechsels nach § 201 UmwG als bekannt gemacht gilt, ihren Anspruch nach Grund und Höhe in Textform anmelden, Sicherheit zu leisten, soweit sie nicht Befriedigung verlangen können. Dieses Recht steht den Gläubigern jedoch nur zu, wenn sie glaubhaft machen, dass durch den Formwechsel die Erfüllung ihrer Forderung gefährdet wird."
    },
    {
      "date": "2025-05-27",
      "id": "110271",
      "original_text": "Löschungsankündigung\nBayern Amtsgericht Traunstein HRB 11108\nMARAN Immobilienverwaltung GmbH – Engelsberg",
      "type": "Löschungsankündigung",
      "state": "Bayern",
      "amtsgericht": "Amtsgericht Traunstein",
      "registernummer": "HRB 11108",
      "registerart": "HRB",
      "company_name": "MARAN Immobilienverwaltung GmbH",
      "company_seat": "Engelsberg",
      "details": "27.05.2025 (Bekanntmachungsdatum)\n\nBayern Amtsgericht Traunstein HRB 11108\nLöschungsankündigung 26.05.2025 (Eintragungsdatum)\n\nMARAN Immobilienverwaltung GmbH\nGesellschaft mit beschränkter Haftung\nEngelsberg\n\nDas Registergericht beabsichtigt, die im Handelsregister eingetragene Gesellschaft wegen Vermögenslosigkeit von Amts wegen nach § 394 FamFG zu löschen. Die Frist zur Erhebung eines Widerspruchs ist auf einen Monat festgesetzt."
    },
    {
      "date": "2025-05-27",
      "id": "110272",
      "original_text": "Löschungsankündigung\nBayern Amtsgericht Nürnberg HRB 38421\nLenilove GmbH – Nürnberg",
      "type": "Löschungsankündigung",
      "state": "Bayern",
      "amtsgericht": "Amtsgericht Nürnberg",
      "registernummer": "HRB 38421",
      "registerart": "HRB",
      "company_name": "Lenilove GmbH",
      "company_seat": "Nürnberg",
      "details": "27.05.2025 (Bekanntmachungsdatum)\n\nBayern Amtsgericht Nürnberg HRB 38421\nLöschungsankündigung\n\nLenilove GmbH\nGesellschaft mit beschränkter Haftung\nNürnberg\n\nDas Registergericht beabsichtigt, die im Handelsregister eingetragene Gesellschaft wegen Vermögenslosigkeit von Amts wegen nach § 394 FamFG zu löschen. Die Frist zur Erhebung eines Widerspruchs ist auf einen Monat festgesetzt."
    },
    {
      "date": "2025-05-27",
      "id": "110273",
      "original_text": "Registerbekanntmachung nach dem Umwandlungsgesetz\nBayern Amtsgericht Memmingen HRA 13960\nIngenieurbüro Fiebig e. K. – Neu-Ulm",
      "type": "Registerbekanntmachung nach dem Umwandlungsgesetz",
      "state": "Bayern",
      "amtsgericht": "Amtsgericht Memmingen",
      "registernummer": "HRA 13960",
      "registerart": "HRA",
      "company_name": "Ingenieurbüro Fiebig e. K.",
      "company_seat": "Neu-Ulm",
      "details": "27.05.2025 (Bekanntmachungsdatum)\n\nBayern Amtsgericht Memmingen HRA 13960\nRegisterbekanntmachung nach dem Umwandlungsgesetz 26.05.2025 (Eintragungsdatum)\n\nIngenieurbüro Fiebig e. K.\nEinzelkaufmann / Einzelkauffrau\nNeu-Ulm\n\nDen Gläubigern der an der Ausgliederung beteiligten Rechtsträger ist, wenn sie binnen sechs Monaten nach dem Tag, an dem die Eintragung der Ausgliederung in das Register des Sitzes desjenigen Rechtsträgers, dessen Gläubiger sie sind, nach §§ 125, 19 Abs. 3 UmwG als bekannt gemacht gilt, ihren Anspruch nach Grund und Höhe in Textform anmelden, Sicherheit zu leisten, soweit sie nicht Befriedigung verlangen können. Dieses Recht steht den Gläubigern jedoch nur zu, wenn sie glaubhaft machen, dass durch die Ausgliederung die Erfüllung ihrer Forderung gefährdet wird."
    },
    {
      "date": "2025-05-27",
      "id": "110274",
      "original_text": "Registerbekanntmachung nach dem Umwandlungsgesetz\nBayern Amtsgericht Traunstein GnR 334\nsogni d oro della futura eG – Unterneukirchen",
      "type": "Registerbekanntmachung nach dem Umwandlungsgesetz",
      "state": "Bayern",
      "amtsgericht": "Amtsgericht Traunstein",
      "registernummer": "GnR 334",
      "registerart": "GnR",
      "company_name": "sogni d oro della futura eG",
      "company_seat": "Unterneukirchen",
      "details": "27.05.2025 (Bekanntmachungsdatum)\n\nBayern Amtsgericht Traunstein GnR 334\nRegisterbekanntmachung nach dem Umwandlungsgesetz 26.05.2025 (Eintragungsdatum)\n\nsogni d oro della futura eG\neingetragene Genossenschaft\nUnterneukirchen\n\nDen Gläubigern des formwechselnden Rechtsträgers ist, wenn sie binnen sechs Monaten nach dem Tag, an dem die Eintragung des Formwechsels nach § 201 UmwG als bekannt gemacht gilt, ihren Anspruch nach Grund und Höhe in Textform anmelden, Sicherheit zu leisten, soweit sie nicht Befriedigung verlangen können. Dieses Recht steht den Gläubigern jedoch nur zu, wenn sie glaubhaft machen, dass durch den Formwechsel die Erfüllung ihrer Forderung gefährdet wird."
    },
    {
      "date": "2025-05-27",
      "id": "110275",
      "original_text": "Löschungsankündigung\nBayern Amtsgericht München HRB 271411\nCanlar Dienstleistungen UG (haftungsbeschränkt) – München",
      "type": "Löschungsankündigung",
      "state": "Bayern",
      "amtsgericht": "Amtsgericht München",
      "registernummer": "HRB 271411",
      "registerart": "HRB",
      "company_name": "Canlar Dienstleistungen UG (haftungsbeschränkt)",
      "company_seat": "München",
      "details": "27.05.2025 (Bekanntmachungsdatum)\n\nBayern Amtsgericht München HRB 271411\nLöschungsankündigung\n\nCanlar Dienstleistungen UG (haftungsbeschränkt)\nGesellschaft mit beschränkter Haftung\nMünchen\n\nDas Registergericht beabsichtigt, die im Handelsregister eingetragene Gesellschaft wegen Vermögenslosigkeit von Amts wegen nach § 394 FamFG zu löschen. Die Frist zur Erhebung eines Widerspruchs ist auf drei Monate festgesetzt."
    },
    {
      "date": "2025-05-27",
      "id": "110276",
      "original_text": "Löschungsankündigung\nBayern Amtsgericht Nürnberg HRB 24116\nLicht Minus Strom GmbH – Nürnberg",
      "type": "Löschungsankündigung",
      "state": "Bayern",
      "amtsgericht": "Amtsgericht Nürnberg",
      "registernummer": "HRB 24116",
      "registerart": "HRB",
      "company_name": "Licht Minus Strom GmbH",
      "company_seat": "Nürnberg",
      "details": "27.05.2025 (Bekanntmachungsdatum)\n\nBayern Amtsgericht Nürnberg HRB 24116\nLöschungsankündigung\n\nLicht Minus Strom GmbH\nGesellschaft mit beschränkter Haftung\nNürnberg\n\nDas Registergericht beabsichtigt, den im Handelsregister eingetragenen Geschäftsführer wegen fehlender Eignung nach § 395 FamFG zu löschen. Die Frist zur Erhebung eines Widerspruchs ist auf sechs Wochen festgesetzt."
    },
    {
      "date": "2025-05-27",
      "id": "110277",
      "original_text": "Registerbekanntmachung nach dem Umwandlungsgesetz\nBayern Amtsgericht München HRB 237858\nGOH Grundstücksverwaltungs GmbH – München",
      "type": "Registerbekanntmachung nach dem Umwandlungsgesetz",
      "state": "Bayern",
      "amtsgericht": "Amtsgericht München",
      "registernummer": "HRB 237858",
      "registerart": "HRB",
      "company_name": "GOH Grundstücksverwaltungs GmbH",
      "company_seat": "München",
      "details": "27.05.2025 (Bekanntmachungsdatum)\n\nBayern Amtsgericht München HRB 237858\nRegisterbekanntmachung nach dem Umwandlungsgesetz\n\nGOH Grundstücksverwaltungs GmbH\nGesellschaft mit beschränkter Haftung\nMünchen\n\nEs wird darauf hingewiesen, dass ein Verschmelzungsplan oder sein Entwurf über eine grenzüberschreitende Verschmelzung zur Aufnahme mit der Domus GOH Holdco S.a.r.l. mit Sitz in Luxemburg/Luxemburg (Registre de commerce et des sociétés B219577) (société à responsabilité limitée - Gesellschaft mit beschränkter Haftung  nach luxemburgischem Recht) beim Handelsregister eingereicht worden ist.\nDie Anteilsinhaber, die Gläubiger sowie die zuständigen Betriebsräte der an der grenzüberschreitenden Verschmelzung beteiligten Gesellschaften oder, soweit es keinen Betriebsrat gibt, die Arbeitnehmer der an der grenzüberschreitenden Verschmelzung beteiligten Gesellschaften, können der jeweiligen Gesellschaft spätestens fünf Arbeitstage vor dem Tag der Gesellschafterversammlung Bemerkungen zum Verschmelzungsplan übermitteln."
    },
    {
      "date": "2025-05-27",
      "id": "110278",
      "original_text": "Registerbekanntmachung nach dem Umwandlungsgesetz\nBayern Amtsgericht Kempten (Allgäu) HRB 3900\nMorgan Thermal Ceramics Porextherm GmbH – Kempten (Allgäu)",
      "type": "Registerbekanntmachung nach dem Umwandlungsgesetz",
      "state": "Bayern",
      "amtsgericht": "Amtsgericht Kempten (Allgäu)",
      "registernummer": "HRB 3900",
      "registerart": "HRB",
      "company_name": "Morgan Thermal Ceramics Porextherm GmbH",
      "company_seat": "Kempten (Allgäu)",
      "details": "27.05.2025 (Bekanntmachungsdatum)\n\nBayern Amtsgericht Kempten (Allgäu) HRB 3900\nRegisterbekanntmachung nach dem Umwandlungsgesetz 26.05.2025 (Eintragungsdatum)\n\nMorgan Thermal Ceramics Porextherm GmbH\nGesellschaft mit beschränkter Haftung\nKempten (Allgäu)\n\nDen Gläubigern der an der Verschmelzung beteiligten Rechtsträger ist, wenn sie binnen sechs Monaten nach dem Tag, an dem die Eintragung der Verschmelzung in das Register des Sitzes desjenigen Rechtsträgers, dessen Gläubiger sie sind, nach § 19 Abs. 3 UmwG als bekannt gemacht gilt, ihren Anspruch nach Grund und Höhe in Textform anmelden, Sicherheit zu leisten, soweit sie nicht Befriedigung verlangen können. Dieses Recht steht den Gläubigern jedoch nur zu, wenn sie glaubhaft machen, dass durch die Verschmelzung die Erfüllung ihrer Forderung gefährdet wird."
    },
    {
      "date": "2025-05-27",
      "id": "110279",
      "original_text": "Registerbekanntmachung nach dem Umwandlungsgesetz\nBayern Amtsgericht Memmingen HRB 21523\nIngenieurbüro und technische Dienstleistungen Fiebig GmbH – Neu-Ulm",
      "type": "Registerbekanntmachung nach dem Umwandlungsgesetz",
      "state": "Bayern",
      "amtsgericht": "Amtsgericht Memmingen",
      "registernummer": "HRB 21523",
      "registerart": "HRB",
      "company_name": "Ingenieurbüro und technische Dienstleistungen Fiebig GmbH",
      "company_seat": "Neu-Ulm",
      "details": "27.05.2025 (Bekanntmachungsdatum)\n\nBayern Amtsgericht Memmingen HRB 21523\nRegisterbekanntmachung nach dem Umwandlungsgesetz 26.05.2025 (Eintragungsdatum)\n\nIngenieurbüro und technische Dienstleistungen Fiebig GmbH\nGesellschaft mit beschränkter Haftung\nNeu-Ulm\n\nDen Gläubiggern der an der Ausgliederung beteiligten Rechtsträger ist, wenn sie binnen sechs Monaten nach dem Tag, an dem die Eintragung der Ausgliederung in das Register des Sitzes desjenigen Rechtsträgers, dessen Gläubiger sie sind, nach §§ 125, 19 Abs. 3 UmwG als bekannt gemacht gilt, ihren Anspruch nach Grund und Höhe in Textform anmelden, Sicherheit zu leisten, soweit sie nicht Befriedigung verlangen können. Dieses Recht steht den Gläubigern jedoch nur zu, wenn sie glaubhaft machen, dass durch die Ausgliederung die Erfüllung ihrer Forderung gefährdet wird."
    },
    {
      "date": "2025-05-27",
      "id": "110280",
      "original_text": "Registerbekanntmachung nach dem Umwandlungsgesetz\nBayern Amtsgericht Hof HRB 4125\nThüga SmartService GmbH – Naila",
      "type": "Registerbekanntmachung nach dem Umwandlungsgesetz",
      "state": "Bayern",
      "amtsgericht": "Amtsgericht Hof",
      "registernummer": "HRB 4125",
      "registerart": "HRB",
      "company_name": "Thüga SmartService GmbH",
      "company_seat": "Naila",
      "details": "27.05.2025 (Bekanntmachungsdatum)\n\nBayern Amtsgericht Hof HRB 4125\nRegisterbekanntmachung nach dem Umwandlungsgesetz 26.05.2025 (Eintragungsdatum)\n\nThüga SmartService GmbH\nGesellschaft mit beschränkter Haftung\nNaila\n\nDen Gläubigern der an der Ausgliederung beteiligten Rechtsträger ist, wenn sie binnen sechs Monaten nach dem Tag, an dem die Eintragung der Ausgliederung in das Register des Sitzes desjenigen Rechtsträgers, dessen Gläubiger sie sind, nach §§ 125, 19 Abs. 3 UmwG als bekannt gemacht gilt, ihren Anspruch nach Grund und Höhe in Textform anmelden, Sicherheit zu leisten, soweit sie nicht Befriedigung verlangen können. Dieses Recht steht den Gläubigern jedoch nur zu, wenn sie glaubhaft machen, dass durch die Ausgliederung die Erfüllung ihrer Forderung gefährdet wird."
    },
    {
      "date": "2025-05-27",
      "id": "110281",
      "original_text": "Löschungsankündigung\nBayern Amtsgericht München HRA 45758\nHofanger-Apotheke e.K. – München",
      "type": "Löschungsankündigung",
      "state": "Bayern",
      "amtsgericht": "Amtsgericht München",
      "registernummer": "HRA 45758",
      "registerart": "HRA",
      "company_name": "Hofanger-Apotheke e.K.",
      "company_seat": "München",
      "details": "27.05.2025 (Bekanntmachungsdatum)\n\nBayern Amtsgericht München HRA 45758\nLöschungsankündigung 21.05.2025 (Eintragungsdatum)\n\nHofanger-Apotheke e.K.\nEinzelkaufmann / Einzelkauffrau\nMünchen\n\nDas Registergericht beabsichtigt, die im Handelsregister eingetragene Firma von Amts wegen nach § 31 Abs. 2 HGB zu löschen. Die Frist zur Erhebung eines Widerspruchs ist auf zwei Monate festgesetzt."
    },
    {
      "date": "2025-05-27",
      "id": "110282",
      "original_text": "Löschungsankündigung\nBayern Amtsgericht München HRB 281466\nGrüne Energie-Kraft Deutschland GmbH – Ismaning",
      "type": "Löschungsankündigung",
      "state": "Bayern",
      "amtsgericht": "Amtsgericht München",
      "registernummer": "HRB 281466",
      "registerart": "HRB",
      "company_name": "Grüne Energie-Kraft Deutschland GmbH",
      "company_seat": "Ismaning",
      "details": "27.05.2025 (Bekanntmachungsdatum)\n\nBayern Amtsgericht München HRB 281466\nLöschungsankündigung\n\nGrüne Energie-Kraft Deutschland GmbH\nGesellschaft mit beschränkter Haftung\nIsmaning\n\nDas Registergericht beabsichtigt, die im Handelsregister eingetragene Gesellschaft wegen Vermögenslosigkeit von Amts wegen nach § 394 FamFG zu löschen. Die Frist zur Erhebung eines Widerspruchs ist auf drei Monate festgesetzt."
    },
    {
      "date": "2025-05-27",
      "id": "110283",
      "original_text": "Registerbekanntmachung nach dem Umwandlungsgesetz\nBayern Amtsgericht München HRB 266278\nGeno-Insure GmbH – München",
      "type": "Registerbekanntmachung nach dem Umwandlungsgesetz",
      "state": "Bayern",
      "amtsgericht": "Amtsgericht München",
      "registernummer": "HRB 266278",
      "registerart": "HRB",
      "company_name": "Geno-Insure GmbH",
      "company_seat": "München",
      "details": "27.05.2025 (Bekanntmachungsdatum)\n\nBayern Amtsgericht München HRB 266278\nRegisterbekanntmachung nach dem Umwandlungsgesetz 26.05.2025 (Eintragungsdatum)\n\nGeno-Insure GmbH\nGesellschaft mit beschränkter Haftung\nMünchen\n\nDen Gläubigern der an der Verschmelzung beteiligten Rechtsträger ist, wenn sie binnen sechs Monaten nach dem Tag, an dem die Eintragung der Verschmelzung in das Register des Sitzes desjenigen Rechtsträgers, dessen Gläubiger sie sind, nach § 19 Abs. 3 UmwG als bekannt gemacht gilt, ihren Anspruch nach Grund und Höhe in Textform anmelden, Sicherheit zu leisten, soweit sie nicht Befriedigung verlangen können. Dieses Recht steht den Gläubigern jedoch nur zu, wenn sie glaubhaft machen, dass durch die Verschmelzung die Erfüllung ihrer Forderung gefährdet wird."
    },
    {
      "date": "2025-05-27",
      "id": "110284",
      "original_text": "Registerbekanntmachung nach dem Umwandlungsgesetz\nBayern Amtsgericht München HRB 293634\nThree-7-Project GmbH – München",
      "type": "Registerbekanntmachung nach dem Umwandlungsgesetz",
      "state": "Bayern",
      "amtsgericht": "Amtsgericht München",
      "registernummer": "HRB 293634",
      "registerart": "HRB",
      "company_name": "Three-7-Project GmbH",
      "company_seat": "München",
      "details": "27.05.2025 (Bekanntmachungsdatum)\n\nBayern Amtsgericht München HRB 293634\nRegisterbekanntmachung nach dem Umwandlungsgesetz 26.05.2025 (Eintragungsdatum)\n\nThree-7-Project GmbH\nGesellschaft mit beschränkter Haftung\nMünchen\n\nDen Gläubigern der an der Ausgliederung beteiligten Rechtsträger ist, wenn sie binnen sechs Monaten nach dem Tag, an dem die Eintragung der Ausgliederung in das Register des Sitzes desjenigen Rechtsträgers, dessen Gläubiger sie sind, nach §§ 125, 19 Abs. 3 UmwG als bekannt gemacht gilt, ihren Anspruch nach Grund und Höhe in Textform anmelden, Sicherheit zu leisten, soweit sie nicht Befriedigung verlangen können. Dieses Recht steht den Gläubigern jedoch nur zu, wenn sie glaubhaft machen, dass durch die Ausgliederung die Erfüllung ihrer Forderung gefährdet wird."
    },
    {
      "date": "2025-05-27",
      "id": "110285",
      "original_text": "Einreichung neuer Dokumente\nBayern Amtsgericht Fürth HRB 14738\nSchaeffler AG – Herzogenaurach",
      "type": "Einreichung neuer Dokumente",
      "state": "Bayern",
      "amtsgericht": "Amtsgericht Fürth",
      "registernummer": "HRB 14738",
      "registerart": "HRB",
      "company_name": "Schaeffler AG",
      "company_seat": "Herzogenaurach",
      "details": "27.05.2025 (Bekanntmachungsdatum)\n\nBayern Amtsgericht Fürth HRB 14738\nEinreichung neuer Dokumente\n\nSchaeffler AG\nAktiengesellschaft\nHerzogenaurach\n\nDem Amtsgericht Fürth -Registergericht- ist eine Liste der Mitglieder des Aufsichtsrats eingereicht worden, § 106 AktG."
    },
    {
      "date": "2025-05-27",
      "id": "110286",
      "original_text": "Registerbekanntmachung nach dem Umwandlungsgesetz\nBayern Amtsgericht Amberg HRB 1490\nBraun GmbH – Schwandorf",
      "type": "Registerbekanntmachung nach dem Umwandlungsgesetz",
      "state": "Bayern",
      "amtsgericht": "Amtsgericht Amberg",
      "registernummer": "HRB 1490",
      "registerart": "HRB",
      "company_name": "Braun GmbH",
      "company_seat": "Schwandorf",
      "details": "27.05.2025 (Bekanntmachungsdatum)\n\nBayern Amtsgericht Amberg HRB 1490\nRegisterbekanntmachung nach dem Umwandlungsgesetz 26.05.2025 (Eintragungsdatum)\n\nBraun GmbH\nGesellschaft mit beschränkter Haftung\nSchwandorf\n\nDen Gläubigern der an der Verschmelzung beteiligten Rechtsträger ist, wenn sie binnen sechs Monaten nach dem Tag, an dem die Eintragung der Verschmelzung in das Register des Sitzes desjenigen Rechtsträgers, dessen Gläubiger sie sind, nach § 19 Abs. 3 UmwG als bekannt gemacht gilt, ihren Anspruch nach Grund und Höhe in Textform anmelden, Sicherheit zu leisten, soweit sie nicht Befriedigung verlangen können. Dieses Recht steht den Gläubigern jedoch nur zu, wenn sie glaubhaft machen, dass durch die Verschmelzung die Erfüllung ihrer Forderung gefährdet wird."
    },
    {
      "date": "2025-05-27",
      "id": "110287",
      "original_text": "Registerbekanntmachung nach dem Umwandlungsgesetz\nBerlin Amtsgericht Berlin (Charlottenburg) HRB 217415\nDelphi HoldCo GmbH – Berlin",
      "type": "Registerbekanntmachung nach dem Umwandlungsgesetz",
      "state": "Berlin",
      "amtsgericht": "Amtsgericht Berlin (Charlottenburg)",
      "registernummer": "HRB 217415",
      "registerart": "HRB",
      "company_name": "Delphi HoldCo GmbH",
      "company_seat": "Berlin",
      "details": "27.05.2025 (Bekanntmachungsdatum)\n\nBerlin Amtsgericht Berlin (Charlottenburg) HRB 217415\nRegisterbekanntmachung nach dem Umwandlungsgesetz 23.05.2025 (Eintragungsdatum)\n\nDelphi HoldCo GmbH\nGesellschaft mit beschränkter Haftung\nBerlin\n\nZu Eintragungsnummer 10 vom 23.05.2025 wird als nicht eingetragen veröffentlicht:Den Gläubigern der an der Verschmelzung beteiligten Rechtsträger ist, wenn sie binnen sechs Monaten nach dem Tag, an dem die Eintragung der Verschmelzung in das Register des Sitzes desjenigen Rechtsträgers, dessen Gläubiger sie sind, als bekannt gemacht gilt, ihren Anspruch nach Grund und Höhe schriftlich anmelden, Sicherheit zu leisten, soweit sie nicht Befriedigung verlangen können. Dieses Recht steht den Gläubigern jedoch nur zu, wenn sie glaubhaft machen, dass durch die Verschmelzung die Erfüllung ihrer Forderung gefährdet wird. Das Recht, Sicherheitsleistung zu verlangen, steht Gläubigern nicht zu, die im Falle der Insolvenz ein Recht auf vorzugsweise Befriedigung aus einer Deckungsmasse haben, die nach gesetzlicher Vorschrift zu ihrem Schutz errichtet und staatlich überwacht ist."
    },
    {
      "date": "2025-05-27",
      "id": "110288",
      "original_text": "Löschungsankündigung\nMecklenburg-Vorpommern Amtsgericht Stralsund HRA 2401\nProra Projektentwicklungs GmbH & Co. Haus Bremen KG – Buschvitz",
      "type": "Löschungsankündigung",
      "state": "Mecklenburg-Vorpommern",
      "amtsgericht": "Amtsgericht Stralsund",
      "registernummer": "HRA 2401",
      "registerart": "HRA",
      "company_name": "Prora Projektentwicklungs GmbH & Co. Haus Bremen KG",
      "company_seat": "Buschvitz",
      "details": "27.05.2025 (Bekanntmachungsdatum)\n\nMecklenburg-Vorpommern Amtsgericht Stralsund HRA 2401\nLöschungsankündigung\n\nProra Projektentwicklungs GmbH & Co. Haus Bremen KG\nKommanditgesellschaft\nBuschvitz\n\nDas Registergericht beabsichtigt nachfolgende Firma von Amts wegen nach § 31 Abs. 2 HGB zu löschen. Die Frist zur Erhebung eines Widerspruchs ist auf 1 Monat festgesetzt."
    },
    {
      "date": "2025-05-27",
      "id": "110289",
      "original_text": "Registerbekanntmachung nach dem Umwandlungsgesetz\nBaden-Württemberg Amtsgericht Mannheim HRB 719915\nSAP SE – Walldorf",
      "type": "Registerbekanntmachung nach dem Umwandlungsgesetz",
      "state": "Baden-Württemberg",
      "amtsgericht": "Amtsgericht Mannheim",
      "registernummer": "HRB 719915",
      "registerart": "HRB",
      "company_name": "SAP SE",
      "company_seat": "Walldorf",
      "details": "27.05.2025 (Bekanntmachungsdatum)\n\nBaden-Württemberg Amtsgericht Mannheim HRB 719915\nRegisterbekanntmachung nach dem Umwandlungsgesetz\n\nSAP SE\nEuropäische Aktiengesellschaft (SE)\nWalldorf\n\nDie Gesellschaft hat am 23.05.2025 den Entwurf des Verschmelzungsvertrages zwischen der \"LeanIX GmbH\", Bonn (Amtsgericht Bonn HRB 19137) und der hiesigen Gesellschaft (übernehmender Rechtsträger) zum Handelsregister eingereicht."
    },
    {
      "date": "2025-05-27",
      "id": "110290",
      "original_text": "Registerbekanntmachung nach dem Umwandlungsgesetz\nBaden-Württemberg Amtsgericht Mannheim HRB 740775\nHEDGEHOG Applications AG – Karlsruhe",
      "type": "Registerbekanntmachung nach dem Umwandlungsgesetz",
      "state": "Baden-Württemberg",
      "amtsgericht": "Amtsgericht Mannheim",
      "registernummer": "HRB 740775",
      "registerart": "HRB",
      "company_name": "HEDGEHOG Applications AG",
      "company_seat": "Karlsruhe",
      "details": "27.05.2025 (Bekanntmachungsdatum)\n\nBaden-Württemberg Amtsgericht Mannheim HRB 740775\nRegisterbekanntmachung nach dem Umwandlungsgesetz 27.05.2025 (Eintragungsdatum)\n\nHEDGEHOG Applications AG\nAktiengesellschaft\nKarlsruhe\n\nAls nicht eingetragen wird bekanntgemacht:\nDen Gläubigern der an der Verschmelzung beteiligten Rechtsträger ist, wenn sie binnen sechs Monaten nach dem Tag, an dem die Eintragung der Verschmelzung in das Register des Sitzes desjenigen Rechtsträgers, dessen Gläubiger sie sind, nach § 19 Abs. 3 UmwG als bekanntgemacht gilt, ihren Anspruch nach Grund und Höhe schriftlich anmelden, Sicherheit zu leisten, soweit sie nicht Befriedigung verlangen können. Dieses Recht steht den Gläubigern jedoch nur zu, wenn sie glaubhaft machen, dass durch die Verschmelzung die Erfüllung ihrer Forderung gefährdet wird."
    },
    {
      "date": "2025-05-27",
      "id": "110291",
      "original_text": "Löschungsankündigung\nMecklenburg-Vorpommern Amtsgericht Stralsund GnR 131\nMaschinen-Geräte-Instandsetzung eG – Kröslin",
      "type": "Löschungsankündigung",
      "state": "Mecklenburg-Vorpommern",
      "amtsgericht": "Amtsgericht Stralsund",
      "registernummer": "GnR 131",
      "registerart": "GnR",
      "company_name": "Maschinen-Geräte-Instandsetzung eG",
      "company_seat": "Kröslin",
      "details": "27.05.2025 (Bekanntmachungsdatum)\n\nMecklenburg-Vorpommern Amtsgericht Stralsund GnR 131\nLöschungsankündigung\n\nMaschinen-Geräte-Instandsetzung eG\neingetragene Genossenschaft\nKröslin\n\nDas Registergericht beabsichtigt, die im Genossenschaftsregister eingetragene Genossenschaft von Amts wegen nach § 394 FamFG zu löschen. Die Frist zur Erhebung eines Widerspruchs ist auf Monat festgesetzt."
    },
    {
      "date": "2025-05-27",
      "id": "110292",
      "original_text": "Registerbekanntmachung nach dem Umwandlungsgesetz\nNordrhein-Westfalen Amtsgericht Coesfeld HRB 13189\nEurodoors Production GmbH – Stadtlohn",
      "type": "Registerbekanntmachung nach dem Umwandlungsgesetz",
      "state": "Nordrhein-Westfalen",
      "amtsgericht": "Amtsgericht Coesfeld",
      "registernummer": "HRB 13189",
      "registerart": "HRB",
      "company_name": "Eurodoors Production GmbH",
      "company_seat": "Stadtlohn",
      "details": "27.05.2025 (Bekanntmachungsdatum)\n\nNordrhein-Westfalen Amtsgericht Coesfeld HRB 13189\nRegisterbekanntmachung nach dem Umwandlungsgesetz 27.05.2025 (Eintragungsdatum)\n\nEurodoors Production GmbH\nGesellschaft mit beschränkter Haftung\nStadtlohn\n\nDen Gläubigern der an der Verschmelzung beteiligten Rechtsträger ist, wenn sie binnen sechs Monaten nach dem Tag, an dem die Eintragung der Verschmelzung in das Register des Sitzes desjenigen Rechtsträgers, dessen Gläubiger sie sind, nach § 19 Absatz 3 UmwG als bekanntgemacht gilt, ihren Anspruch nach Grund und Höhe schriftlich anmelden, Sicherheit zu leisten, soweit sie nicht Befriedigung verlangen können. Dieses Recht steht den Gläubigern jedoch nur zu, wenn sie glaubhaft machen, dass durch die Verschmelzung die Erfüllung ihrer Forderung gefährdet wird."
    },
    {
      "date": "2025-05-27",
      "id": "110293",
      "original_text": "Einreichung neuer Dokumente\nSchleswig-Holstein Amtsgericht Pinneberg HRB 8910\ntel.quick Verwaltungs GmbH – Quickborn/Krs. Pinneberg",
      "type": "Einreichung neuer Dokumente",
      "state": "Schleswig-Holstein",
      "amtsgericht": "Amtsgericht Pinneberg",
      "registernummer": "HRB 8910",
      "registerart": "HRB",
      "company_name": "tel.quick Verwaltungs GmbH",
      "company_seat": "Quickborn/Krs. Pinneberg",
      "details": "27.05.2025 (Bekanntmachungsdatum)\n\nSchleswig-Holstein Amtsgericht Pinneberg HRB 8910\nEinreichung neuer Dokumente\n\ntel.quick Verwaltungs GmbH\nGesellschaft mit beschränkter Haftung\nQuickborn/Krs. Pinneberg\n\nAls nicht eingetragen wird veröffentlicht: Es wurde eine neue Liste der Aufsichtsratsmitglieder zum Handelsregister eingereicht."
    },
    {
      "date": "2025-05-27",
      "id": "110294",
      "original_text": "Sonstige Registerbekanntmachung\nHamburg Amtsgericht Hamburg HRB 1902\nHamburger Hafen und Logistik Aktiengesellschaft – Hamburg",
      "type": "Sonstige Registerbekanntmachung",
      "state": "Hamburg",
      "amtsgericht": "Amtsgericht Hamburg",
      "registernummer": "HRB 1902",
      "registerart": "HRB",
      "company_name": "Hamburger Hafen und Logistik Aktiengesellschaft",
      "company_seat": "Hamburg",
      "details": "27.05.2025 (Bekanntmachungsdatum)\n\nHamburg Amtsgericht Hamburg HRB 1902\nSonstige Registerbekanntmachung\n\nHamburger Hafen und Logistik Aktiengesellschaft\nAktiengesellschaft\nHamburg\n\nAls nicht eingetragen wird bekannt gemacht: Liste des Aufsichtsrats wurde eingereicht."
    },
    {
      "date": "2025-05-27",
      "id": "110295",
      "original_text": "Registerbekanntmachung nach dem Umwandlungsgesetz\nHamburg Amtsgericht Hamburg HRB 169445\nR + B Black Oak UG (haftungsbeschränkt) – Hamburg",
      "type": "Registerbekanntmachung nach dem Umwandlungsgesetz",
      "state": "Hamburg",
      "amtsgericht": "Amtsgericht Hamburg",
      "registernummer": "HRB 169445",
      "registerart": "HRB",
      "company_name": "R + B Black Oak UG (haftungsbeschränkt)",
      "company_seat": "Hamburg",
      "details": "27.05.2025 (Bekanntmachungsdatum)\n\nHamburg Amtsgericht Hamburg HRB 169445\nRegisterbekanntmachung nach dem Umwandlungsgesetz 27.05.2025 (Eintragungsdatum)\n\nR + B Black Oak UG (haftungsbeschränkt)\nGesellschaft mit beschränkter Haftung\nHamburg\n\nAls nicht eingetragen wird bekannt gemacht:\nDen Gläubigern der an der formwechselnden Umwandlung beteiligten Gesellschaften ist, wenn sie binnen sechs Monaten nach dem Tag, an dem die Eintragung der formwechselnden Umwandlung in das Register des Sitzes desjenigen Rechtsträgers, dessen Gläubiger sie sind, nach § 19 Absatz 3 UmwG als bekannt gemacht gilt, ihren Anspruch nach Grund und Höhe schriftlich anmelden, Sicherheit zu leisten, soweit sie nicht Befriedigung verlangen können. Dieses Recht steht den Gläubigern jedoch nur zu, wenn sie glaubhaft machen, dass durch die formwechselnde Umwandlung die Erfüllung ihrer Forderung gefährdet wird."
    },
    {
      "date": "2025-05-27",
      "id": "110296",
      "original_text": "Sonstige Registerbekanntmachung\nBerlin Amtsgericht Berlin (Charlottenburg) HRB 164028\nMcMakler GmbH – Berlin",
      "type": "Sonstige Registerbekanntmachung",
      "state": "Berlin",
      "amtsgericht": "Amtsgericht Berlin (Charlottenburg)",
      "registernummer": "HRB 164028",
      "registerart": "HRB",
      "company_name": "McMakler GmbH",
      "company_seat": "Berlin",
      "details": "27.05.2025 (Bekanntmachungsdatum)\n\nBerlin Amtsgericht Berlin (Charlottenburg) HRB 164028\nSonstige Registerbekanntmachung\n\nMcMakler GmbH\nGesellschaft mit beschränkter Haftung\nBerlin\n\nAls nicht eingetragen wird veröffentlicht:Es wurde eine neue Liste der Beiratsmitglieder eingereicht (§52 GmbHG)."
    },
    {
      "date": "2025-05-27",
      "id": "110297",
      "original_text": "Löschungsankündigung\nBaden-Württemberg Amtsgericht Freiburg HRB 711329\nRegio - Eigenheim GmbH – Denzlingen",
      "type": "Löschungsankündigung",
      "state": "Baden-Württemberg",
      "amtsgericht": "Amtsgericht Freiburg",
      "registernummer": "HRB 711329",
      "registerart": "HRB",
      "company_name": "Regio - Eigenheim GmbH",
      "company_seat": "Denzlingen",
      "details": "27.05.2025 (Bekanntmachungsdatum)\n\nBaden-Württemberg Amtsgericht Freiburg HRB 711329\nLöschungsankündigung\n\nRegio - Eigenheim GmbH\nGesellschaft mit beschränkter Haftung\nDenzlingen\n\nDas Gericht beabsichtigt, die Gesellschaft wegen Vermögenslosigkeit im Handelsregister von Amts wegen nach § 394 FamFG zu löschen. Die Frist zur Geltendmachung eines Widerspruchs gegen die beabsichtigte Löschung ist auf einen Monat ab Veröffentlichung bestimmt."
    },
    {
      "date": "2025-05-27",
      "id": "110298",
      "original_text": "Registerbekanntmachung nach dem Umwandlungsgesetz\nHamburg Amtsgericht Hamburg HRB 159962\nCYCYC sports GmbH – Hamburg",
      "type": "Registerbekanntmachung nach dem Umwandlungsgesetz",
      "state": "Hamburg",
      "amtsgericht": "Amtsgericht Hamburg",
      "registernummer": "HRB 159962",
      "registerart": "HRB",
      "company_name": "CYCYC sports GmbH",
      "company_seat": "Hamburg",
      "details": "27.05.2025 (Bekanntmachungsdatum)\n\nHamburg Amtsgericht Hamburg HRB 159962\nRegisterbekanntmachung nach dem Umwandlungsgesetz 27.05.2025 (Eintragungsdatum)\n\nCYCYC sports GmbH\nGesellschaft mit beschränkter Haftung\nHamburg\n\nAls nicht eingetragen wird bekannt gemacht:\nDen Gläubigern der an der Verschmelzung beteiligten Gesellschaften ist, wenn sie binnen sechs Monaten nach dem Tag, an dem die Eintragung der Verschmelzung in das Register des Sitzes desjenigen Rechtsträgers, dessen Gläubiger sie sind, nach § 19 Absatz 3 UmwG als bekannt gemacht gilt, ihren Anspruch nach Grund und Höhe schriftlich anmelden, Sicherheit zu leisten, soweit sie nicht Befriedigung verlangen können. Dieses Recht steht den Gläubigern jedoch nur zu, wenn sie glaubhaft machen, dass durch die Verschmelzung die Erfüllung ihrer Forderung gefährdet wird."
    },
    {
      "date": "2025-05-27",
      "id": "110299",
      "original_text": "Löschungsankündigung\nBaden-Württemberg Amtsgericht Mannheim HRA 708008\nLEDORA Projekt GmbH & Co. KG – Rastatt",
      "type": "Löschungsankündigung",
      "state": "Baden-Württemberg",
      "amtsgericht": "Amtsgericht Mannheim",
      "registernummer": "HRA 708008",
      "registerart": "HRA",
      "company_name": "LEDORA Projekt GmbH & Co. KG",
      "company_seat": "Rastatt",
      "details": "27.05.2025 (Bekanntmachungsdatum)\n\nBaden-Württemberg Amtsgericht Mannheim HRA 708008\nLöschungsankündigung\n\nLEDORA Projekt GmbH & Co. KG\nKommanditgesellschaft\nRastatt\n\nDas Gericht beabsichtigt, die Gesellschaft wegen Vermögenslosigkeit im Handelsregister von Amts wegen nach § 394 FamFG zu löschen. Die Frist zur Geltendmachung eines Widerspruchs gegen die beabsichtigte Löschung ist auf einen Monat ab Veröffentlichung bestimmt."
    },
    {
      "date": "2025-05-27",
      "id": "110300",
      "original_text": "Einreichung neuer Dokumente\nBaden-Württemberg Amtsgericht Freiburg HRB 2332\nCG Car-Garantie Versicherungs-Aktiengesellschaft – Freiburg im Breisgau",
      "type": "Einreichung neuer Dokumente",
      "state": "Baden-Württemberg",
      "amtsgericht": "Amtsgericht Freiburg",
      "registernummer": "HRB 2332",
      "registerart": "HRB",
      "company_name": "CG Car-Garantie Versicherungs-Aktiengesellschaft",
      "company_seat": "Freiburg im Breisgau",
      "details": "27.05.2025 (Bekanntmachungsdatum)\n\nBaden-Württemberg Amtsgericht Freiburg HRB 2332\nEinreichung neuer Dokumente\n\nCG Car-Garantie Versicherungs-Aktiengesellschaft\nAktiengesellschaft\nFreiburg im Breisgau\n\nDie Gesellschaft hat am 23.05.2025 die Liste über die Zusammensetzung des Aufsichtsrats zum Handelsregister eingereicht."
    },
    {
      "date": "2025-05-27",
      "id": "110301",
      "original_text": "Registerbekanntmachung nach dem Umwandlungsgesetz\nBaden-Württemberg Amtsgericht Mannheim HRB 732063\nDetect Value AG – Walldorf",
      "type": "Registerbekanntmachung nach dem Umwandlungsgesetz",
      "state": "Baden-Württemberg",
      "amtsgericht": "Amtsgericht Mannheim",
      "registernummer": "HRB 732063",
      "registerart": "HRB",
      "company_name": "Detect Value AG",
      "company_seat": "Walldorf",
      "details": "27.05.2025 (Bekanntmachungsdatum)\n\nBaden-Württemberg Amtsgericht Mannheim HRB 732063\nRegisterbekanntmachung nach dem Umwandlungsgesetz 23.05.2025 (Eintragungsdatum)\n\nDetect Value AG\nAktiengesellschaft\nWalldorf\n\nAls nicht eingetragen wird bekanntgemacht:\nDen Gläubigern der an der Verschmelzung beteiligten Rechtsträger ist, wenn sie binnen sechs Monaten nach dem Tag, an dem die Eintragung der Verschmelzung in das Register des Sitzes desjenigen Rechtsträgers, dessen Gläubiger sie sind, nach § 19 Abs. 3 UmwG als bekanntgemacht gilt, ihren Anspruch nach Grund und Höhe schriftlich anmelden, Sicherheit zu leisten, soweit sie nicht Befriedigung verlangen können. Dieses Recht steht den Gläubigern jedoch nur zu, wenn sie glaubhaft machen, dass durch die Verschmelzung die Erfüllung ihrer Forderung gefährdet wird."
    },
    {
      "date": "2025-05-27",
      "id": "110302",
      "original_text": "Registerbekanntmachung nach dem Umwandlungsgesetz\nSaarland Amtsgericht Saarbrücken HRB 103871\nSMS medipool AG – Friedrichsthal",
      "type": "Registerbekanntmachung nach dem Umwandlungsgesetz",
      "state": "Saarland",
      "amtsgericht": "Amtsgericht Saarbrücken",
      "registernummer": "HRB 103871",
      "registerart": "HRB",
      "company_name": "SMS medipool AG",
      "company_seat": "Friedrichsthal",
      "details": "27.05.2025 (Bekanntmachungsdatum)\n\nSaarland Amtsgericht Saarbrücken HRB 103871\nRegisterbekanntmachung nach dem Umwandlungsgesetz 27.05.2025 (Eintragungsdatum)\n\nSMS medipool AG\nAktiengesellschaft\nFriedrichsthal\n\nAls nicht eingetragen wird bekannt gemacht: Den Gläubigern der an der Verschmelzung beteiligten Gesellschaften ist, wenn sie binnen sechs Monaten nach dem Tag, an dem die Eintragung der Verschmelzung in das Register des Sitzes desjenigen Rechtsträgers, dessen Gläubiger sie sind, nach § 19 Absatz 3 UmwG bekannt gemacht worden ist, ihren Anspruch nach Grund und Höhe schriftlich anmelden, Sicherheit zu leisten, soweit sie nicht Befriedigung verlangen können. Dieses Recht steht den Gläubigern jedoch nur zu, wenn sie glaubhaft machen, dass durch die Verschmelzung die Erfüllung ihrer Forderung gefährdet wird."
    },
    {
      "date": "2025-05-27",
      "id": "110303",
      "original_text": "Registerbekanntmachung nach dem Umwandlungsgesetz\nBerlin Amtsgericht Berlin (Charlottenburg) HRB 248190\nKOHLHEPP GmbH Wirtschaftsprüfungsgesellschaft – Berlin",
      "type": "Registerbekanntmachung nach dem Umwandlungsgesetz",
      "state": "Berlin",
      "amtsgericht": "Amtsgericht Berlin (Charlottenburg)",
      "registernummer": "HRB 248190",
      "registerart": "HRB",
      "company_name": "KOHLHEPP GmbH Wirtschaftsprüfungsgesellschaft",
      "company_seat": "Berlin",
      "details": "27.05.2025 (Bekanntmachungsdatum)\n\nBerlin Amtsgericht Berlin (Charlottenburg) HRB 248190\nRegisterbekanntmachung nach dem Umwandlungsgesetz 26.05.2025 (Eintragungsdatum)\n\nKOHLHEPP GmbH Wirtschaftsprüfungsgesellschaft\nGesellschaft mit beschränkter Haftung\nBerlin\n\nZu Eintragungsnummer 3 vom 26.05.2025 wird als nicht eingetragen veröffentlicht: Den Gläubigern der an der Verschmelzung beteiligten Rechtsträger ist, wenn sie binnen sechs Monaten nach dem Tag, an dem die Eintragung der Verschmelzung in das Register des Sitzes desjenigen Rechtsträgers, dessen Gläubiger sie sind, als bekannt gemacht gilt, ihren Anspruch nach Grund und Höhe schriftlich anmelden, Sicherheit zu leisten, soweit sie nicht Befriedigung verlangen können. Dieses Recht steht den Gläubigern jedoch nur zu, wenn sie glaubhaft machen, dass durch die Verschmelzung die Erfüllung ihrer Forderung gefährdet wird. Das Recht, Sicherheitsleistung zu verlangen, steht Gläubigern nicht zu, die im Falle der Insolvenz ein Recht auf vorzugsweise Befriedigung aus einer Deckungsmasse haben, die nach gesetzlicher Vorschrift zu ihrem Schutz errichtet und staatlich überwacht ist."
    },
    {
      "date": "2025-05-27",
      "id": "110304",
      "original_text": "Registerbekanntmachung nach dem Umwandlungsgesetz\nHamburg Amtsgericht Hamburg HRB 174568\nCONTOR Service GmbH – Hamburg",
      "type": "Registerbekanntmachung nach dem Umwandlungsgesetz",
      "state": "Hamburg",
      "amtsgericht": "Amtsgericht Hamburg",
      "registernummer": "HRB 174568",
      "registerart": "HRB",
      "company_name": "CONTOR Service GmbH",
      "company_seat": "Hamburg",
      "details": "27.05.2025 (Bekanntmachungsdatum)\n\nHamburg Amtsgericht Hamburg HRB 174568\nRegisterbekanntmachung nach dem Umwandlungsgesetz 27.05.2025 (Eintragungsdatum)\n\nCONTOR Service GmbH\nGesellschaft mit beschränkter Haftung\nHamburg\n\nAls nicht eingetragen wird bekannt gemacht:\nDen Gläubigern der an der Verschmelzung beteiligten Gesellschaften ist, wenn sie binnen sechs Monaten nach dem Tag, an dem die Eintragung der Verschmelzung in das Register des Sitzes desjenigen Rechtsträgers, dessen Gläubiger sie sind, nach § 19 Absatz 3 UmwG als bekannt gemacht gilt, ihren Anspruch nach Grund und Höhe schriftlich anmelden, Sicherheit zu leisten, soweit sie nicht Befriedigung verlangen können. Dieses Recht steht den Gläubigern jedoch nur zu, wenn sie glaubhaft machen, dass durch die Verschmelzung die Erfüllung ihrer Forderung gefährdet wird."
    },
    {
      "date": "2025-05-27",
      "id": "110305",
      "original_text": "Löschungsankündigung\nHamburg Amtsgericht Hamburg HRB 170471\nCIPLA CAPITAL UG (haftungsbeschränkt) – Hamburg",
      "type": "Löschungsankündigung",
      "state": "Hamburg",
      "amtsgericht": "Amtsgericht Hamburg",
      "registernummer": "HRB 170471",
      "registerart": "HRB",
      "company_name": "CIPLA CAPITAL UG (haftungsbeschränkt)",
      "company_seat": "Hamburg",
      "details": "27.05.2025 (Bekanntmachungsdatum)\n\nHamburg Amtsgericht Hamburg HRB 170471\nLöschungsankündigung\n\nCIPLA CAPITAL UG (haftungsbeschränkt)\nGesellschaft mit beschränkter Haftung\nHamburg\n\nDas Registergericht beabsichtigt, die im Handelsregister eingetragene Gesellschaft von Amts wegen nach § 394 FamFG zu löschen. Die Frist zur Erhebung eines Widerspruchs gegen die beabsichtigte Löschung wird auf 3 Monate festgesetzt."
    },
    {
      "date": "2025-05-27",
      "id": "110306",
      "original_text": "Registerbekanntmachung nach dem Umwandlungsgesetz\nHamburg Amtsgericht Hamburg HRB 143431\nTanktechnik Dringelburg GmbH – Hamburg",
      "type": "Registerbekanntmachung nach dem Umwandlungsgesetz",
      "state": "Hamburg",
      "amtsgericht": "Amtsgericht Hamburg",
      "registernummer": "HRB 143431",
      "registerart": "HRB",
      "company_name": "Tanktechnik Dringelburg GmbH",
      "company_seat": "Hamburg",
      "details": "27.05.2025 (Bekanntmachungsdatum)\n\nHamburg Amtsgericht Hamburg HRB 143431\nRegisterbekanntmachung nach dem Umwandlungsgesetz 23.05.2025 (Eintragungsdatum)\n\nTanktechnik Dringelburg GmbH\nGesellschaft mit beschränkter Haftung\nHamburg\n\nAls nicht eingetragen wird bekannt gemacht:\nDen Gläubigern der an der Verschmelzung beteiligten Gesellschaften ist, wenn sie binnen sechs Monaten nach dem Tag, an dem die Eintragung der Verschmelzung in das Register des Sitzes desjenigen Rechtsträgers, dessen Gläubiger sie sind, nach § 19 Absatz 3 UmwG als bekannt gemacht gilt, ihren Anspruch nach Grund und Höhe schriftlich anmelden, Sicherheit zu leisten, soweit sie nicht Befriedigung verlangen können. Dieses Recht steht den Gläubigern jedoch nur zu, wenn sie glaubhaft machen, dass durch die Verschmelzung die Erfüllung ihrer Forderung gefährdet wird."
    },
    {
      "date": "2025-05-27",
      "id": "110307",
      "original_text": "Registerbekanntmachung nach dem Umwandlungsgesetz\nHamburg Amtsgericht Hamburg HRB 189919\nConceptIF Group GmbH – Hamburg",
      "type": "Registerbekanntmachung nach dem Umwandlungsgesetz",
      "state": "Hamburg",
      "amtsgericht": "Amtsgericht Hamburg",
      "registernummer": "HRB 189919",
      "registerart": "HRB",
      "company_name": "ConceptIF Group GmbH",
      "company_seat": "Hamburg",
      "details": "27.05.2025 (Bekanntmachungsdatum)\n\nHamburg Amtsgericht Hamburg HRB 189919\nRegisterbekanntmachung nach dem Umwandlungsgesetz 27.05.2025 (Eintragungsdatum)\n\nConceptIF Group GmbH\nGesellschaft mit beschränkter Haftung\nHamburg\n\nAls nicht eingetragen wird bekannt gemacht:\nDen Gläubigern der an der Verschmelzung beteiligten Gesellschaften ist, wenn sie binnen sechs Monaten nach dem Tag, an dem die Eintragung der Verschmelzung in das Register des Sitzes desjenigen Rechtsträgers, dessen Gläubiger sie sind, nach § 19 Absatz 3 UmwG als bekannt gemacht gilt, ihren Anspruch nach Grund und Höhe schriftlich anmelden, Sicherheit zu leisten, soweit sie nicht Befriedigung verlangen können. Dieses Recht steht den Gläubigern jedoch nur zu, wenn sie glaubhaft machen, dass durch die Verschmelzung die Erfüllung ihrer Forderung gefährdet wird."
    },
    {
      "date": "2025-05-27",
      "id": "110308",
      "original_text": "Löschungsankündigung\nHamburg Amtsgericht Hamburg HRB 175610\nHPA Service GmbH – Hamburg",
      "type": "Löschungsankündigung",
      "state": "Hamburg",
      "amtsgericht": "Amtsgericht Hamburg",
      "registernummer": "HRB 175610",
      "registerart": "HRB",
      "company_name": "HPA Service GmbH",
      "company_seat": "Hamburg",
      "details": "27.05.2025 (Bekanntmachungsdatum)\n\nHamburg Amtsgericht Hamburg HRB 175610\nLöschungsankündigung\n\nHPA Service GmbH\nGesellschaft mit beschränkter Haftung\nHamburg\n\nDas Registergericht beabsichtigt, die im Handelsregister eingetragene Gesellschaft von Amts wegen nach § 394 FamFG zu löschen. Die Frist zur Erhebung eines Widerspruchs gegen die beabsichtigte Löschung wird auf 3 Monate festgesetzt."
    },
    {
      "date": "2025-05-27",
      "id": "110309",
      "original_text": "Löschungsankündigung\nBrandenburg Amtsgericht Potsdam HRB 37241\nMonolith Copia III GmbH – Zossen",
      "type": "Löschungsankündigung",
      "state": "Brandenburg",
      "amtsgericht": "Amtsgericht Potsdam",
      "registernummer": "HRB 37241",
      "registerart": "HRB",
      "company_name": "Monolith Copia III GmbH",
      "company_seat": "Zossen",
      "details": "27.05.2025 (Bekanntmachungsdatum)\n\nBrandenburg Amtsgericht Potsdam HRB 37241\nLöschungsankündigung\n\nMonolith Copia III GmbH\nGesellschaft mit beschränkter Haftung\nZossen\n\nBei der nachstehenden Gesellschaft wird das Amtslöschungsverfahren gemäß § 394 FamFG eingeleitet."
    },
    {
      "date": "2025-05-27",
      "id": "110310",
      "original_text": "Sonstige Registerbekanntmachung\nHamburg Amtsgericht Hamburg HRB 130095\nConceptIF PRO & BIZ Underwriting GmbH – Hamburg",
      "type": "Sonstige Registerbekanntmachung",
      "state": "Hamburg",
      "amtsgericht": "Amtsgericht Hamburg",
      "registernummer": "HRB 130095",
      "registerart": "HRB",
      "company_name": "ConceptIF PRO & BIZ Underwriting GmbH",
      "company_seat": "Hamburg",
      "details": "27.05.2025 (Bekanntmachungsdatum)\n\nHamburg Amtsgericht Hamburg HRB 130095\nSonstige Registerbekanntmachung 27.05.2025 (Eintragungsdatum)\n\nConceptIF PRO & BIZ Underwriting GmbH\nGesellschaft mit beschränkter Haftung\nHamburg\n\nAls nicht eingetragen wird bekannt gemacht:  Den Gläubigern der Gesellschaft, deren Forderungen begründet worden sind, bevor die Eintragung der Vertragsbeendigung in das Handelsregister nach § 10 HGB als bekannt gemacht gilt, ist vom anderen Vertragsteil Sicherheit zu leisten, wenn sie sich binnen 6 Monaten nach Bekanntmachung der Eintragung zu diesem Zweck bei ihm melden."
    },
    {
      "date": "2025-05-27",
      "id": "110311",
      "original_text": "Löschungsankündigung\nBerlin Amtsgericht Berlin (Charlottenburg) HRA 25014\nTishman Speyer Properties of Berlin, L.P. Zweigniederlassung Berlin – Berlin",
      "type": "Löschungsankündigung",
      "state": "Berlin",
      "amtsgericht": "Amtsgericht Berlin (Charlottenburg)",
      "registernummer": "HRA 25014",
      "registerart": "HRA",
      "company_name": "Tishman Speyer Properties of Berlin, L.P. Zweigniederlassung Berlin",
      "company_seat": "Berlin",
      "details": "27.05.2025 (Bekanntmachungsdatum)\n\nBerlin Amtsgericht Berlin (Charlottenburg) HRA 25014\nLöschungsankündigung\n\nTishman Speyer Properties of Berlin, L.P. Zweigniederlassung Berlin\nRechtsform ausländischen Rechts HRA\nBerlin\n\nBei dem nachstehenden Unternehmen / der nachstehenden Gesellschaft wird das Amtslöschungsverfahren gemäß § 31 Abs. 2 HGB eingeleitet. Widerspruchsfrist 1 Monat"
    },
    {
      "date": "2025-05-27",
      "id": "110312",
      "original_text": "Löschungsankündigung\nBerlin Amtsgericht Berlin (Charlottenburg) HRB 254294\nPerfect-Bau GmbH – Berlin",
      "type": "Löschungsankündigung",
      "state": "Berlin",
      "amtsgericht": "Amtsgericht Berlin (Charlottenburg)",
      "registernummer": "HRB 254294",
      "registerart": "HRB",
      "company_name": "Perfect-Bau GmbH",
      "company_seat": "Berlin",
      "details": "27.05.2025 (Bekanntmachungsdatum)\n\nBerlin Amtsgericht Berlin (Charlottenburg) HRB 254294\nLöschungsankündigung\n\nPerfect-Bau GmbH\nGesellschaft mit beschränkter Haftung\nBerlin\n\nBei der nachstehenden Gesellschaft wird das Amtslöschungsverfahren gemäß § 394 FamFG eingeleitet. Widerspruchsfrist 6 Wochen"
    },
    {
      "date": "2025-05-27",
      "id": "110313",
      "original_text": "Löschungsankündigung\nBerlin Amtsgericht Berlin (Charlottenburg) HRB 196870\nSafetycheck GmbH – Berlin",
      "type": "Löschungsankündigung",
      "state": "Berlin",
      "amtsgericht": "Amtsgericht Berlin (Charlottenburg)",
      "registernummer": "HRB 196870",
      "registerart": "HRB",
      "company_name": "Safetycheck GmbH",
      "company_seat": "Berlin",
      "details": "27.05.2025 (Bekanntmachungsdatum)\n\nBerlin Amtsgericht Berlin (Charlottenburg) HRB 196870\nLöschungsankündigung\n\nSafetycheck GmbH\nGesellschaft mit beschränkter Haftung\nBerlin\n\nBei der nachstehenden Gesellschaft wird das Amtslöschungsverfahren gemäß § 394 FamFG eingeleitet. Widerspruchsfrist 6 Wochen"
    },
    {
      "date": "2025-05-27",
      "id": "110314",
      "original_text": "Löschungsankündigung\nThüringen Amtsgericht Jena HRB 501863\nIhr Autoglaser Altenburg GmbH – Altenburg",
      "type": "Löschungsankündigung",
      "state": "Thüringen",
      "amtsgericht": "Amtsgericht Jena",
      "registernummer": "HRB 501863",
      "registerart": "HRB",
      "company_name": "Ihr Autoglaser Altenburg GmbH",
      "company_seat": "Altenburg",
      "details": "27.05.2025 (Bekanntmachungsdatum)\n\nThüringen Amtsgericht Jena HRB 501863\nLöschungsankündigung\n\nIhr Autoglaser Altenburg GmbH\nGesellschaft mit beschränkter Haftung\nAltenburg\n\nDas Registergericht beabsichtigt, die im Handelsregister eingetragene Gesellschaft wegen Vermögenslosigkeit nach § 394 FamFG von Amts wegen zu löschen. Die Frist zur Erhebung eines Widerspruchs gegen die beabsichtigte Löschung wird auf 6 Wochen festgesetzt."
    },
    {
      "date": "2025-05-27",
      "id": "110315",
      "original_text": "Registerbekanntmachung nach dem Umwandlungsgesetz\nBaden-Württemberg Amtsgericht Mannheim HRB 734984\nPro Concept EKZW GmbH – Mannheim.",
      "type": "Registerbekanntmachung nach dem Umwandlungsgesetz",
      "state": "Baden-Württemberg",
      "amtsgericht": "Amtsgericht Mannheim",
      "registernummer": "HRB 734984",
      "registerart": "HRB",
      "company_name": "Pro Concept EKZW GmbH",
      "company_seat": "Mannheim.",
      "details": "27.05.2025 (Bekanntmachungsdatum)\n\nBaden-Württemberg Amtsgericht Mannheim HRB 734984\nRegisterbekanntmachung nach dem Umwandlungsgesetz 27.05.2025 (Eintragungsdatum)\n\nPro Concept EKZW GmbH\nGesellschaft mit beschränkter Haftung\nMannheim.\n\nDen Gläubigern des an dem Formwechsel beteiligten Rechtsträgers ist, wenn sie binnen sechs Monaten nach dem Tag, an dem die Eintragung des Formwechsels in das Register des Sitzes desjenigen Rechtsträgers, dessen Gläubiger sie sind, nach § 19 Abs. 3 UmwG als bekanntgemacht gilt, ihren Anspruch nach Grund und Höhe schriftlich anmelden, Sicherheit zu leisten, soweit sie nicht Befriedigung verlangen können. Dieses Recht steht den Gläubigern jedoch nur zu, wenn sie glaubhaft machen, dass durch den Formwechsel die Erfüllung ihrer Forderung gefährdet wird."
    },
    {
      "date": "2025-05-27",
      "id": "110316",
      "original_text": "Registerbekanntmachung nach dem Umwandlungsgesetz\nBaden-Württemberg Amtsgericht Mannheim HRA 712611\nPro Concept EKZW GmbH & Co. KG – Mannheim",
      "type": "Registerbekanntmachung nach dem Umwandlungsgesetz",
      "state": "Baden-Württemberg",
      "amtsgericht": "Amtsgericht Mannheim",
      "registernummer": "HRA 712611",
      "registerart": "HRA",
      "company_name": "Pro Concept EKZW GmbH & Co. KG",
      "company_seat": "Mannheim",
      "details": "27.05.2025 (Bekanntmachungsdatum)\n\nBaden-Württemberg Amtsgericht Mannheim HRA 712611\nRegisterbekanntmachung nach dem Umwandlungsgesetz 27.05.2025 (Eintragungsdatum)\n\nPro Concept EKZW GmbH & Co. KG\nKommanditgesellschaft\nMannheim\n\nDen Gläubigern des an dem Formwechsel beteiligten Rechtsträgers ist, wenn sie binnen sechs Monaten nach dem Tag, an dem die Eintragung des Formwechsels in das Register des Sitzes desjenigen Rechtsträgers, dessen Gläubiger sie sind, nach § 19 Abs. 3 UmwG als bekanntgemacht gilt, ihren Anspruch nach Grund und Höhe schriftlich anmelden, Sicherheit zu leisten, soweit sie nicht Befriedigung verlangen können. Dieses Recht steht den Gläubigern jedoch nur zu, wenn sie glaubhaft machen, dass durch den Formwechsel die Erfüllung ihrer Forderung gefährdet wird."
    },
    {
      "date": "2025-05-27",
      "id": "110317",
      "original_text": "Registerbekanntmachung nach dem Umwandlungsgesetz\nHamburg Amtsgericht Hamburg HRA 125476\nHamburg Real Estate Management Ltd. & Co. KG – Hamburg",
      "type": "Registerbekanntmachung nach dem Umwandlungsgesetz",
      "state": "Hamburg",
      "amtsgericht": "Amtsgericht Hamburg",
      "registernummer": "HRA 125476",
      "registerart": "HRA",
      "company_name": "Hamburg Real Estate Management Ltd. & Co. KG",
      "company_seat": "Hamburg",
      "details": "27.05.2025 (Bekanntmachungsdatum)\n\nHamburg Amtsgericht Hamburg HRA 125476\nRegisterbekanntmachung nach dem Umwandlungsgesetz 27.05.2025 (Eintragungsdatum)\n\nHamburg Real Estate Management Ltd. & Co. KG\nKommanditgesellschaft\nHamburg\n\nAls nicht eingetragen wird bekannt gemacht:\nDen Gläubigern der an der formwechselnden Umwandlung beteiligten Gesellschaften ist, wenn sie binnen sechs Monaten nach dem Tag, an dem die Eintragung der formwechselnden Umwandlung in das Register des Sitzes desjenigen Rechtsträgers, dessen Gläubiger sie sind, nach § 19 Absatz 3 UmwG als bekannt gemacht gilt, ihren Anspruch nach Grund und Höhe schriftlich anmelden, Sicherheit zu leisten, soweit sie nicht Befriedigung verlangen können. Dieses Recht steht den Gläubigern jedoch nur zu, wenn sie glaubhaft machen, dass durch die formwechselnde Umwandlung die Erfüllung ihrer Forderung gefährdet wird."
    },
    {
      "date": "2025-05-27",
      "id": "110318",
      "original_text": "Löschungsankündigung\nBerlin Amtsgericht Berlin (Charlottenburg) HRA 52423\n3A-BAD barrierefrei Berlin GmbH & Co. KG – Berlin",
      "type": "Löschungsankündigung",
      "state": "Berlin",
      "amtsgericht": "Amtsgericht Berlin (Charlottenburg)",
      "registernummer": "HRA 52423",
      "registerart": "HRA",
      "company_name": "3A-BAD barrierefrei Berlin GmbH & Co. KG",
      "company_seat": "Berlin",
      "details": "27.05.2025 (Bekanntmachungsdatum)\n\nBerlin Amtsgericht Berlin (Charlottenburg) HRA 52423\nLöschungsankündigung\n\n3A-BAD barrierefrei Berlin GmbH & Co. KG\nKommanditgesellschaft\nBerlin\n\nBei dem nachstehenden Unternehmen / der nachstehenden Gesellschaft wird das Amtslöschungsverfahren gemäß § 31 Abs. 2 HGB eingeleitet. Widerspruchsfrist 1 Monat"
    },
    {
      "date": "2025-05-27",
      "id": "110319",
      "original_text": "Registerbekanntmachung nach dem Umwandlungsgesetz\nBaden-Württemberg Amtsgericht Stuttgart GsR 1562\nGustav Günther Söhne eGbR – Kornwestheim",
      "type": "Registerbekanntmachung nach dem Umwandlungsgesetz",
      "state": "Baden-Württemberg",
      "amtsgericht": "Amtsgericht Stuttgart",
      "registernummer": "GsR 1562",
      "registerart": "GsR",
      "company_name": "Gustav Günther Söhne eGbR",
      "company_seat": "Kornwestheim",
      "details": "27.05.2025 (Bekanntmachungsdatum)\n\nBaden-Württemberg Amtsgericht Stuttgart GsR 1562\nRegisterbekanntmachung nach dem Umwandlungsgesetz 27.05.2025 (Eintragungsdatum)\n\nGustav Günther Söhne eGbR\nGesellschaft bürgerlichen Rechts\nKornwestheim\n\nAls nicht eingetragen wird bekanntgemacht:\nDen Gläubigern des an dem Formwechsel beteiligten Rechtsträgers ist, wenn sie binnen sechs Monaten nach dem Tag, an dem die Eintragung des Formwechsels in das Register des Sitzes desjenigen Rechtsträgers, dessen Gläubiger sie sind, nach § 19 Abs. 3 UmwG als bekanntgemacht gilt, ihren Anspruch nach Grund und Höhe schriftlich anmelden, Sicherheit zu leisten, soweit sie nicht Befriedigung verlangen können. Dieses Recht steht den Gläubigern jedoch nur zu, wenn sie glaubhaft machen, dass durch den Formwechsel die Erfüllung ihrer Forderung gefährdet wird."
    },
    {
      "date": "2025-05-27",
      "id": "110320",
      "original_text": "Registerbekanntmachung nach dem Umwandlungsgesetz\nBaden-Württemberg Amtsgericht Stuttgart HRB 800024\nGustav Günther Söhne GmbH – Kornwestheim",
      "type": "Registerbekanntmachung nach dem Umwandlungsgesetz",
      "state": "Baden-Württemberg",
      "amtsgericht": "Amtsgericht Stuttgart",
      "registernummer": "HRB 800024",
      "registerart": "HRB",
      "company_name": "Gustav Günther Söhne GmbH",
      "company_seat": "Kornwestheim",
      "details": "27.05.2025 (Bekanntmachungsdatum)\n\nBaden-Württemberg Amtsgericht Stuttgart HRB 800024\nRegisterbekanntmachung nach dem Umwandlungsgesetz 27.05.2025 (Eintragungsdatum)\n\nGustav Günther Söhne GmbH\nGesellschaft mit beschränkter Haftung\nKornwestheim\n\nAls nicht eingetragen wird bekanntgemacht:\nDen Gläubigern des an dem Formwechsel beteiligten Rechtsträgers ist, wenn sie binnen sechs Monaten nach dem Tag, an dem die Eintragung des Formwechsels in das Register des Sitzes desjenigen Rechtsträgers, dessen Gläubiger sie sind, nach § 19 Abs. 3 UmwG als bekanntgemacht gilt, ihren Anspruch nach Grund und Höhe schriftlich anmelden, Sicherheit zu leisten, soweit sie nicht Befriedigung verlangen können. Dieses Recht steht den Gläubigern jedoch nur zu, wenn sie glaubhaft machen, dass durch den Formwechsel die Erfüllung ihrer Forderung gefährdet wird."
    },
    {
      "date": "2025-05-27",
      "id": "110321",
      "original_text": "Sonstige Registerbekanntmachung\nSchleswig-Holstein Amtsgericht Kiel GnR 235 NM\nTaxi 44444 Neumünster e. G. – Neumünster",
      "type": "Sonstige Registerbekanntmachung",
      "state": "Schleswig-Holstein",
      "amtsgericht": "Amtsgericht Kiel",
      "registernummer": "GnR 235 NM",
      "registerart": "GnR",
      "company_name": "Taxi 44444 Neumünster e. G.",
      "company_seat": "Neumünster",
      "details": "27.05.2025 (Bekanntmachungsdatum)\n\nSchleswig-Holstein Amtsgericht Kiel GnR 235 NM\nSonstige Registerbekanntmachung 22.05.2025 (Eintragungsdatum)\n\nTaxi 44444 Neumünster e. G.\neingetragene Genossenschaft\nNeumünster\n\nAls nicht eingetragen wird veröffentlicht: Den Gläubigern der Genossenschaft ist, wenn sie binnen sechs Monaten nach dem Tag an dem die Eintragung des Verzichts auf die Nachschusspflicht und die Herabsetzung des Geschäftsanteils in das Register der Genossenschaft, dessen Gläubiger sie sind, nach § 22 und § 22 a GenG bekannt gemacht worden ist, ihren Anspruch nach Grund und Höhe schriftlich anmelden, Sicherheit zu leisten, soweit sie nicht Befriedigung verlangen können."
    },
    {
      "date": "2025-05-27",
      "id": "110322",
      "original_text": "Registerbekanntmachung nach dem Umwandlungsgesetz\nHamburg Amtsgericht Hamburg HRB 192418\nBSS Brand Communication Hamburg GmbH – Hamburg",
      "type": "Registerbekanntmachung nach dem Umwandlungsgesetz",
      "state": "Hamburg",
      "amtsgericht": "Amtsgericht Hamburg",
      "registernummer": "HRB 192418",
      "registerart": "HRB",
      "company_name": "BSS Brand Communication Hamburg GmbH",
      "company_seat": "Hamburg",
      "details": "27.05.2025 (Bekanntmachungsdatum)\n\nHamburg Amtsgericht Hamburg HRB 192418\nRegisterbekanntmachung nach dem Umwandlungsgesetz 27.05.2025 (Eintragungsdatum)\n\nBSS Brand Communication Hamburg GmbH\nGesellschaft mit beschränkter Haftung\nHamburg\n\nAls nicht eingetragen wird bekannt gemacht:\nDen Gläubigern der an der Abspaltung beteiligten Gesellschaften ist, wenn sie binnen sechs Monaten nach dem Tag, an dem die Eintragung der Abspaltung in das Register des Sitzes desjenigen Rechtsträgers, dessen Gläubiger sie sind, nach § 19 Absatz 3 UmwG als bekannt gemacht gilt, ihren Anspruch nach Grund und Höhe schriftlich anmelden, Sicherheit zu leisten, soweit sie nicht Befriedigung verlangen können. Dieses Recht steht den Gläubigern jedoch nur zu, wenn sie glaubhaft machen, dass durch die Abspaltung die Erfüllung ihrer Forderung gefährdet wird."
    },
    {
      "date": "2025-05-27",
      "id": "110323",
      "original_text": "Registerbekanntmachung nach dem Umwandlungsgesetz\nBaden-Württemberg Amtsgericht Mannheim HRA 712612\nPro Concept Projektbau Kurfürstenstraße GmbH & Co. KG – Mannheim",
      "type": "Registerbekanntmachung nach dem Umwandlungsgesetz",
      "state": "Baden-Württemberg",
      "amtsgericht": "Amtsgericht Mannheim",
      "registernummer": "HRA 712612",
      "registerart": "HRA",
      "company_name": "Pro Concept Projektbau Kurfürstenstraße GmbH & Co. KG",
      "company_seat": "Mannheim",
      "details": "27.05.2025 (Bekanntmachungsdatum)\n\nBaden-Württemberg Amtsgericht Mannheim HRA 712612\nRegisterbekanntmachung nach dem Umwandlungsgesetz 27.05.2025 (Eintragungsdatum)\n\nPro Concept Projektbau Kurfürstenstraße GmbH & Co. KG\nKommanditgesellschaft\nMannheim\n\nAls nicht eingetragen wird bekanntgemacht:\nDen Gläubigern des an dem Formwechsel beteiligten Rechtsträgers ist, wenn sie binnen sechs Monaten nach dem Tag, an dem die Eintragung des Formwechsels in das Register des Sitzes desjenigen Rechtsträgers, dessen Gläubiger sie sind, nach § 19 Abs. 3 UmwG als bekanntgemacht gilt, ihren Anspruch nach Grund und Höhe schriftlich anmelden, Sicherheit zu leisten, soweit sie nicht Befriedigung verlangen können. Dieses Recht steht den Gläubigern jedoch nur zu, wenn sie glaubhaft machen, dass durch den Formwechsel die Erfüllung ihrer Forderung gefährdet wird."
    },
    {
      "date": "2025-05-27",
      "id": "110324",
      "original_text": "Registerbekanntmachung nach dem Umwandlungsgesetz\nBaden-Württemberg Amtsgericht Mannheim HRB 730956\nPro Concept Projektbau Kurfürstenstraße GmbH – Mannheim",
      "type": "Registerbekanntmachung nach dem Umwandlungsgesetz",
      "state": "Baden-Württemberg",
      "amtsgericht": "Amtsgericht Mannheim",
      "registernummer": "HRB 730956",
      "registerart": "HRB",
      "company_name": "Pro Concept Projektbau Kurfürstenstraße GmbH",
      "company_seat": "Mannheim",
      "details": "27.05.2025 (Bekanntmachungsdatum)\n\nBaden-Württemberg Amtsgericht Mannheim HRB 730956\nRegisterbekanntmachung nach dem Umwandlungsgesetz 27.05.2025 (Eintragungsdatum)\n\nPro Concept Projektbau Kurfürstenstraße GmbH\nGesellschaft mit beschränkter Haftung\nMannheim\n\nAls nicht eingetragen wird bekanntgemacht:\nDen Gläubigern des an dem Formwechsel beteiligten Rechtsträgers ist, wenn sie binnen sechs Monaten nach dem Tag, an dem die Eintragung des Formwechsels in das Register des Sitzes desjenigen Rechtsträgers, dessen Gläubiger sie sind, nach § 19 Abs. 3 UmwG als bekanntgemacht gilt, ihren Anspruch nach Grund und Höhe schriftlich anmelden, Sicherheit zu leisten, soweit sie nicht Befriedigung verlangen können. Dieses Recht steht den Gläubigern jedoch nur zu, wenn sie glaubhaft machen, dass durch den Formwechsel die Erfüllung ihrer Forderung gefährdet wird."
    },
    {
      "date": "2025-05-27",
      "id": "110325",
      "original_text": "Registerbekanntmachung nach dem Umwandlungsgesetz\nBaden-Württemberg Amtsgericht Mannheim HRB 754627\nMüller-Finanzen GmbH – Walldorf",
      "type": "Registerbekanntmachung nach dem Umwandlungsgesetz",
      "state": "Baden-Württemberg",
      "amtsgericht": "Amtsgericht Mannheim",
      "registernummer": "HRB 754627",
      "registerart": "HRB",
      "company_name": "Müller-Finanzen GmbH",
      "company_seat": "Walldorf",
      "details": "27.05.2025 (Bekanntmachungsdatum)\n\nBaden-Württemberg Amtsgericht Mannheim HRB 754627\nRegisterbekanntmachung nach dem Umwandlungsgesetz 27.05.2025 (Eintragungsdatum)\n\nMüller-Finanzen GmbH\nGesellschaft mit beschränkter Haftung\nWalldorf\n\nDen Gläubigern des an dem Formwechsel beteiligten Rechtsträgers ist, wenn sie binnen sechs Monaten nach dem Tag, an dem die Eintragung des Formwechsels in das Register des Sitzes desjenigen Rechtsträgers, dessen Gläubiger sie sind, nach § 19 Abs. 3 UmwG als bekanntgemacht gilt, ihren Anspruch nach Grund und Höhe schriftlich anmelden, Sicherheit zu leisten, soweit sie nicht Befriedigung verlangen können. Dieses Recht steht den Gläubigern jedoch nur zu, wenn sie glaubhaft machen, dass durch den Formwechsel die Erfüllung ihrer Forderung gefährdet wird."
    },
    {
      "date": "2025-05-27",
      "id": "110326",
      "original_text": "Registerbekanntmachung nach dem Umwandlungsgesetz\nBaden-Württemberg Amtsgericht Mannheim HRA 705399\nMüller - Finanzen GmbH & Co. KG – Walldorf",
      "type": "Registerbekanntmachung nach dem Umwandlungsgesetz",
      "state": "Baden-Württemberg",
      "amtsgericht": "Amtsgericht Mannheim",
      "registernummer": "HRA 705399",
      "registerart": "HRA",
      "company_name": "Müller - Finanzen GmbH & Co. KG",
      "company_seat": "Walldorf",
      "details": "27.05.2025 (Bekanntmachungsdatum)\n\nBaden-Württemberg Amtsgericht Mannheim HRA 705399\nRegisterbekanntmachung nach dem Umwandlungsgesetz 27.05.2025 (Eintragungsdatum)\n\nMüller - Finanzen GmbH & Co. KG\nKommanditgesellschaft\nWalldorf\n\nDen Gläubigern des an dem Formwechsel beteiligten Rechtsträgers ist, wenn sie binnen sechs Monaten nach dem Tag, an dem die Eintragung des Formwechsels in das Register des Sitzes desjenigen Rechtsträgers, dessen Gläubiger sie sind, nach § 19 Abs. 3 UmwG als bekanntgemacht gilt, ihren Anspruch nach Grund und Höhe schriftlich anmelden, Sicherheit zu leisten, soweit sie nicht Befriedigung verlangen können. Dieses Recht steht den Gläubigern jedoch nur zu, wenn sie glaubhaft machen, dass durch den Formwechsel die Erfüllung ihrer Forderung gefährdet wird."
    },
    {
      "date": "2025-05-27",
      "id": "110327",
      "original_text": "Löschungsankündigung\nBerlin Amtsgericht Berlin (Charlottenburg) HRA 63782\nBlackwell Labs GmbH & Co. KG – Berlin",
      "type": "Löschungsankündigung",
      "state": "Berlin",
      "amtsgericht": "Amtsgericht Berlin (Charlottenburg)",
      "registernummer": "HRA 63782",
      "registerart": "HRA",
      "company_name": "Blackwell Labs GmbH & Co. KG",
      "company_seat": "Berlin",
      "details": "27.05.2025 (Bekanntmachungsdatum)\n\nBerlin Amtsgericht Berlin (Charlottenburg) HRA 63782\nLöschungsankündigung\n\nBlackwell Labs GmbH & Co. KG\nKommanditgesellschaft\nBerlin\n\nBei dem nachstehenden Unternehmen / der nachstehenden Gesellschaft wird das Amtslöschungsverfahren gemäß § 31 Abs. 2 HGB eingeleitet. Widerspruchsfrist 1 Monat"
    },
    {
      "date": "2025-05-27",
      "id": "110328",
      "original_text": "Registerbekanntmachung nach dem Umwandlungsgesetz\nBaden-Württemberg Amtsgericht Freiburg HRB 710836\nBarnes Group Acquisition GmbH – Bahlingen am Kaiserstuhl",
      "type": "Registerbekanntmachung nach dem Umwandlungsgesetz",
      "state": "Baden-Württemberg",
      "amtsgericht": "Amtsgericht Freiburg",
      "registernummer": "HRB 710836",
      "registerart": "HRB",
      "company_name": "Barnes Group Acquisition GmbH",
      "company_seat": "Bahlingen am Kaiserstuhl",
      "details": "27.05.2025 (Bekanntmachungsdatum)\n\nBaden-Württemberg Amtsgericht Freiburg HRB 710836\nRegisterbekanntmachung nach dem Umwandlungsgesetz 27.05.2025 (Eintragungsdatum)\n\nBarnes Group Acquisition GmbH\nGesellschaft mit beschränkter Haftung\nBahlingen am Kaiserstuhl\n\nAls nicht eingetragen wird bekanntgemacht:\nDen Gläubigern der an der Verschmelzung beteiligten Rechtsträger (\"THERMOPLAY Deutschland GmbH\", Bahlingen am Kaiserstuhl, Amtsgericht Freiburg i. Br. HRB 724597 und „Barnes Group Acquisition GmbH\", Bahlingen am Kaiserstuhl, Amtsgericht Freiburg i. Br. HRB 710836)  ist, wenn sie binnen sechs Monaten nach dem Tag, an dem die Eintragung der Verschmelzung in das Register des Sitzes desjenigen Rechtsträgers, dessen Gläubiger sie sind, nach § 19 Abs. 3 UmwG als bekanntgemacht gilt, ihren Anspruch nach Grund und Höhe schriftlich anmelden, Sicherheit zu leisten, soweit sie nicht Befriedigung verlangen können. Dieses Recht steht den Gläubigern jedoch nur zu, wenn sie glaubhaft machen, dass durch die Verschmelzung die Erfüllung ihrer Forderung gefährdet wird."
    },
    {
      "date": "2025-05-27",
      "id": "110329",
      "original_text": "Sonstige Registerbekanntmachung\nHamburg Amtsgericht Hamburg HRB 164801\nWeser-Ems Busverkehr GmbH (WEB) – Hamburg",
      "type": "Sonstige Registerbekanntmachung",
      "state": "Hamburg",
      "amtsgericht": "Amtsgericht Hamburg",
      "registernummer": "HRB 164801",
      "registerart": "HRB",
      "company_name": "Weser-Ems Busverkehr GmbH (WEB)",
      "company_seat": "Hamburg",
      "details": "27.05.2025 (Bekanntmachungsdatum)\n\nHamburg Amtsgericht Hamburg HRB 164801\nSonstige Registerbekanntmachung\n\nWeser-Ems Busverkehr GmbH (WEB)\nGesellschaft mit beschränkter Haftung\nHamburg\n\nAls nicht eingetragen wird bekannt gemacht: Liste des Aufsichtsrats wurde eingereicht."
    },
    {
      "date": "2025-05-27",
      "id": "110330",
      "original_text": "Registerbekanntmachung nach dem Umwandlungsgesetz\nBerlin Amtsgericht Berlin (Charlottenburg) HRA 63991\nprofessional technology UG (haftungsbeschränkt) & Co. KG – Berlin",
      "type": "Registerbekanntmachung nach dem Umwandlungsgesetz",
      "state": "Berlin",
      "amtsgericht": "Amtsgericht Berlin (Charlottenburg)",
      "registernummer": "HRA 63991",
      "registerart": "HRA",
      "company_name": "professional technology UG (haftungsbeschränkt) & Co. KG",
      "company_seat": "Berlin",
      "details": "27.05.2025 (Bekanntmachungsdatum)\n\nBerlin Amtsgericht Berlin (Charlottenburg) HRA 63991\nRegisterbekanntmachung nach dem Umwandlungsgesetz 26.05.2025 (Eintragungsdatum)\n\nprofessional technology UG (haftungsbeschränkt) & Co. KG\nKommanditgesellschaft\nBerlin\n\nZu Eintragungsnummer 3 vom 26.05.2025 wird als nicht eingetragen veröffentlicht:\nDen Gläubigern der an der Verschmelzung beteiligten Rechtsträger ist, wenn sie binnen sechs Monaten nach dem Tag, an dem die Eintragung der Verschmelzung in das Register des Sitzes desjenigen Rechtsträgers, dessen Gläubiger sie sind, als bekannt gemacht gilt, ihren Anspruch nach Grund und Höhe schriftlich anmelden, Sicherheit zu leisten, soweit sie nicht Befriedigung verlangen können. Dieses Recht steht den Gläubigern jedoch nur zu, wenn sie glaubhaft machen, dass durch die Verschmelzung die Erfüllung ihrer Forderung gefährdet wird. Das Recht, Sicherheitsleistung zu verlangen, steht Gläubigern nicht zu, die im Falle der Insolvenz ein Recht auf vorzugsweise Befriedigung aus einer Deckungsmasse haben, die nach gesetzlicher Vorschrift zu ihrem Schutz errichtet und staatlich überwacht ist."
    },
    {
      "date": "2025-05-27",
      "id": "110331",
      "original_text": "Registerbekanntmachung nach dem Umwandlungsgesetz\nBerlin Amtsgericht Berlin (Charlottenburg) HRB 206572\nBelle Époque IngBau GmbH – Berlin",
      "type": "Registerbekanntmachung nach dem Umwandlungsgesetz",
      "state": "Berlin",
      "amtsgericht": "Amtsgericht Berlin (Charlottenburg)",
      "registernummer": "HRB 206572",
      "registerart": "HRB",
      "company_name": "Belle Époque IngBau GmbH",
      "company_seat": "Berlin",
      "details": "27.05.2025 (Bekanntmachungsdatum)\n\nBerlin Amtsgericht Berlin (Charlottenburg) HRB 206572\nRegisterbekanntmachung nach dem Umwandlungsgesetz 26.05.2025 (Eintragungsdatum)\n\nBelle Époque IngBau GmbH\nGesellschaft mit beschränkter Haftung\nBerlin\n\nZu Eintragungsnummer 7 vom 26.05.2025 wird als nicht eingetragen veröffentlicht:\nDen Gläubigern der an der Verschmelzung beteiligten Rechtsträger ist, wenn sie binnen sechs Monaten nach dem Tag, an dem die Eintragung der Verschmelzung in das Register des Sitzes desjenigen Rechtsträgers, dessen Gläubiger sie sind, als bekannt gemacht gilt, ihren Anspruch nach Grund und Höhe schriftlich anmelden, Sicherheit zu leisten, soweit sie nicht Befriedigung verlangen können. Dieses Recht steht den Gläubigern jedoch nur zu, wenn sie glaubhaft machen, dass durch die Verschmelzung die Erfüllung ihrer Forderung gefährdet wird. Das Recht, Sicherheitsleistung zu verlangen, steht Gläubigern nicht zu, die im Falle der Insolvenz ein Recht auf vorzugsweise Befriedigung aus einer Deckungsmasse haben, die nach gesetzlicher Vorschrift zu ihrem Schutz errichtet und staatlich überwacht ist."
    },
    {
      "date": "2025-05-27",
      "id": "110332",
      "original_text": "Registerbekanntmachung nach dem Umwandlungsgesetz\nBaden-Württemberg Amtsgericht Freiburg HRB 733141\nSchilling Beteiligungs GmbH – Ühlingen-Birkendorf",
      "type": "Registerbekanntmachung nach dem Umwandlungsgesetz",
      "state": "Baden-Württemberg",
      "amtsgericht": "Amtsgericht Freiburg",
      "registernummer": "HRB 733141",
      "registerart": "HRB",
      "company_name": "Schilling Beteiligungs GmbH",
      "company_seat": "Ühlingen-Birkendorf",
      "details": "27.05.2025 (Bekanntmachungsdatum)\n\nBaden-Württemberg Amtsgericht Freiburg HRB 733141\nRegisterbekanntmachung nach dem Umwandlungsgesetz 27.05.2025 (Eintragungsdatum)\n\nSchilling Beteiligungs GmbH\nGesellschaft mit beschränkter Haftung\nÜhlingen-Birkendorf\n\nAls nicht eingetragen wird bekanntgemacht:\nDen Gläubigern der an der Abspaltung beteiligten Rechtsträger ist, wenn sie binnen sechs Monaten nach dem Tag, an dem die Eintragung der Abspaltung in das Register des Sitzes desjenigen Rechtsträgers, dessen Gläubiger sie sind, nach § 19 Abs. 3 UmwG als bekanntgemacht gilt, ihren Anspruch nach Grund und Höhe schriftlich anmelden, Sicherheit zu leisten, soweit sie nicht Befriedigung verlangen können. Dieses Recht steht den Gläubigern jedoch nur zu, wenn sie glaubhaft machen, dass durch die Abspaltung die Erfüllung ihrer Forderung gefährdet wird."
    },
    {
      "date": "2025-05-27",
      "id": "110333",
      "original_text": "Registerbekanntmachung nach dem Umwandlungsgesetz\nBaden-Württemberg Amtsgericht Stuttgart HRA 740045\nTheodoros Hatzis e.K. – Neckarsulm",
      "type": "Registerbekanntmachung nach dem Umwandlungsgesetz",
      "state": "Baden-Württemberg",
      "amtsgericht": "Amtsgericht Stuttgart",
      "registernummer": "HRA 740045",
      "registerart": "HRA",
      "company_name": "Theodoros Hatzis e.K.",
      "company_seat": "Neckarsulm",
      "details": "27.05.2025 (Bekanntmachungsdatum)\n\nBaden-Württemberg Amtsgericht Stuttgart HRA 740045\nRegisterbekanntmachung nach dem Umwandlungsgesetz 27.05.2025 (Eintragungsdatum)\n\nTheodoros Hatzis e.K.\nEinzelkaufmann / Einzelkauffrau\nNeckarsulm\n\nDen Gläubigern der an der Ausgliederung beteiligten Rechtsträger ist, wenn sie binnen sechs Monaten nach dem Tag, an dem die Eintragung der Ausgliederung in das Register des Sitzes desjenigen Rechtsträgers, dessen Gläubiger sie sind, nach § 19 Abs. 3 UmwG als bekanntgemacht gilt, ihren Anspruch nach Grund und Höhe schriftlich anmelden, Sicherheit zu leisten, soweit sie nicht Befriedigung verlangen können. Dieses Recht steht den Gläubigern jedoch nur zu, wenn sie glaubhaft machen, dass durch die Ausgliederung die Erfüllung ihrer Forderung gefährdet wird."
    },
    {
      "date": "2025-05-27",
      "id": "110334",
      "original_text": "Registerbekanntmachung nach dem Umwandlungsgesetz\nBaden-Württemberg Amtsgericht Freiburg HRB 732939\nSchilling Grundstücks GmbH – Ühlingen-Birkendorf",
      "type": "Registerbekanntmachung nach dem Umwandlungsgesetz",
      "state": "Baden-Württemberg",
      "amtsgericht": "Amtsgericht Freiburg",
      "registernummer": "HRB 732939",
      "registerart": "HRB",
      "company_name": "Schilling Grundstücks GmbH",
      "company_seat": "Ühlingen-Birkendorf",
      "details": "27.05.2025 (Bekanntmachungsdatum)\n\nBaden-Württemberg Amtsgericht Freiburg HRB 732939\nRegisterbekanntmachung nach dem Umwandlungsgesetz 27.05.2025 (Eintragungsdatum)\n\nSchilling Grundstücks GmbH\nGesellschaft mit beschränkter Haftung\nÜhlingen-Birkendorf\n\nAls nicht eingetragen wird bekanntgemacht:\nDen Gläubigern der an der Abspaltung beteiligten Rechtsträger (\"Schilling Grundstücks GmbH\", Ühlingen-Birkendorf, Amtsgericht Freiburg i. Br. HRB 732939 und \"Schilling Beteiligungs GmbH\", Ühlingen-Birkendorf, Amtsgericht Freiburg i. Br. HRB 733141)  ist, wenn sie binnen sechs Monaten nach dem Tag, an dem die Eintragung der Abspaltung in das Register des Sitzes desjenigen Rechtsträgers, dessen Gläubiger sie sind, nach § 19 Abs. 3 UmwG als bekanntgemacht gilt, ihren Anspruch nach Grund und Höhe schriftlich anmelden, Sicherheit zu leisten, soweit sie nicht Befriedigung verlangen können. Dieses Recht steht den Gläubigern jedoch nur zu, wenn sie glaubhaft machen, dass durch die Abspaltung die Erfüllung ihrer Forderung gefährdet wird."
    },
    {
      "date": "2025-05-27",
      "id": "110335",
      "original_text": "Sonstige Registerbekanntmachung\nSchleswig-Holstein Amtsgericht Lübeck HRB 23193\nBau und Gartenbau Schulz UG (haftungsbeschränkt) – Bad Schwartau",
      "type": "Sonstige Registerbekanntmachung",
      "state": "Schleswig-Holstein",
      "amtsgericht": "Amtsgericht Lübeck",
      "registernummer": "HRB 23193",
      "registerart": "HRB",
      "company_name": "Bau und Gartenbau Schulz UG (haftungsbeschränkt)",
      "company_seat": "Bad Schwartau",
      "details": "27.05.2025 (Bekanntmachungsdatum)\n\nSchleswig-Holstein Amtsgericht Lübeck HRB 23193\nSonstige Registerbekanntmachung\n\nBau und Gartenbau Schulz UG (haftungsbeschränkt)\nGesellschaft mit beschränkter Haftung\nBad Schwartau\n\nAls nicht eingetragen wird veröffentlicht: Schreiben an den GF. Stephan Schulz:\nSehr geehrter Herr Schulz,\n\nin der Handelsregistersache der\n\nBau und Gartenbau Schulz UG (haftungsbeschränkt)\n\nergeben sich aus den mir vorliegenden Unterlagen Anhaltspunkte dafür, dass die Gesellschaft, als deren Geschäftsführer Sie noch eingetragen sind, vermögenslos ist.\n\nIch beabsichtige daher, die Gesellschaft wegen Vermögenslosigkeit gemäß § 394 FamFG zu löschen.\n\nIch bestimme eine Frist von einem Monat zur Geltendmachung eines Widerspruchs gegen die Löschung, § 394 Abs. 2 S. 1 FamFG.\n\nWeiter bitte ich Sie, mir binnen derselben Frist mitzuteilen, ob die genannte Gesellschaft noch Vermögen hat, ggf. welche Vermögensgegenstände sie besitzt, ob die Gesellschaft noch Partei eines noch nicht rechtskräftig abgeschlossenen Rechtsstreits ist oder ob sonst noch eine Abwicklung stattfindet.\n\nNach Fristablauf ohne Widerspruch von Ihnen oder anderer Seite wird die Gesellschaft gelöscht.\n\nMit freundlichen Grüßen\n\nKistenmacher,\nDipl. Rechtspflegerin (FH)"
    },
    {
      "date": "2025-05-27",
      "id": "110336",
      "original_text": "Löschungsankündigung\nBrandenburg Amtsgericht Frankfurt/Oder HRB 10634\nTRG Transport-Recycling-Energie GmbH – Fürstenwalde/Spree",
      "type": "Löschungsankündigung",
      "state": "Brandenburg",
      "amtsgericht": "Amtsgericht Frankfurt/Oder",
      "registernummer": "HRB 10634",
      "registerart": "HRB",
      "company_name": "TRG Transport-Recycling-Energie GmbH",
      "company_seat": "Fürstenwalde/Spree",
      "details": "27.05.2025 (Bekanntmachungsdatum)\n\nBrandenburg Amtsgericht Frankfurt/Oder HRB 10634\nLöschungsankündigung\n\nTRG Transport-Recycling-Energie GmbH\nGesellschaft mit beschränkter Haftung\nFürstenwalde/Spree\n\nBei der nachstehenden Gesellschaft wird das Amtslöschungsverfahren gemäß § 394 FamFG eingeleitet."
    },
    {
      "date": "2025-05-27",
      "id": "110337",
      "original_text": "Registerbekanntmachung nach dem Umwandlungsgesetz\nBaden-Württemberg Amtsgericht Stuttgart HRB 764581\nCorvée Verwaltungs GmbH – Stuttgart",
      "type": "Registerbekanntmachung nach dem Umwandlungsgesetz",
      "state": "Baden-Württemberg",
      "amtsgericht": "Amtsgericht Stuttgart",
      "registernummer": "HRB 764581",
      "registerart": "HRB",
      "company_name": "Corvée Verwaltungs GmbH",
      "company_seat": "Stuttgart",
      "details": "27.05.2025 (Bekanntmachungsdatum)\n\nBaden-Württemberg Amtsgericht Stuttgart HRB 764581\nRegisterbekanntmachung nach dem Umwandlungsgesetz 27.05.2025 (Eintragungsdatum)\n\nCorvée Verwaltungs GmbH\nGesellschaft mit beschränkter Haftung\nStuttgart\n\nAls nicht eingetragen wird bekanntgemacht:\nDen Gläubigern der an der Verschmelzung beteiligten Rechtsträger ist, wenn sie binnen sechs Monaten nach dem Tag, an dem die Eintragung der Verschmelzung in das Register des Sitzes desjenigen Rechtsträgers, dessen Gläubiger sie sind, nach § 19 Abs. 3 UmwG als bekanntgemacht gilt, ihren Anspruch nach Grund und Höhe schriftlich anmelden, Sicherheit zu leisten, soweit sie nicht Befriedigung verlangen können. Dieses Recht steht den Gläubigern jedoch nur zu, wenn sie glaubhaft machen, dass durch die Verschmelzung die Erfüllung ihrer Forderung gefährdet wird."
    },
    {
      "date": "2025-05-27",
      "id": "110338",
      "original_text": "Registerbekanntmachung nach dem Umwandlungsgesetz\nBaden-Württemberg Amtsgericht Stuttgart HRB 788598\nsensified Ecosystem GmbH – Pfullingen",
      "type": "Registerbekanntmachung nach dem Umwandlungsgesetz",
      "state": "Baden-Württemberg",
      "amtsgericht": "Amtsgericht Stuttgart",
      "registernummer": "HRB 788598",
      "registerart": "HRB",
      "company_name": "sensified Ecosystem GmbH",
      "company_seat": "Pfullingen",
      "details": "27.05.2025 (Bekanntmachungsdatum)\n\nBaden-Württemberg Amtsgericht Stuttgart HRB 788598\nRegisterbekanntmachung nach dem Umwandlungsgesetz 27.05.2025 (Eintragungsdatum)\n\nsensified Ecosystem GmbH\nGesellschaft mit beschränkter Haftung\nPfullingen\n\nAls nicht eingetragen wird bekanntgemacht:\nDen Gläubigern der an der Verschmelzung beteiligten Rechtsträger ist, wenn sie binnen sechs Monaten nach dem Tag, an dem die Eintragung der Verschmelzung in das Register des Sitzes desjenigen Rechtsträgers, dessen Gläubiger sie sind, nach § 19 Abs. 3 UmwG als bekanntgemacht gilt, ihren Anspruch nach Grund und Höhe schriftlich anmelden, Sicherheit zu leisten, soweit sie nicht Befriedigung verlangen können. Dieses Recht steht den Gläubigern jedoch nur zu, wenn sie glaubhaft machen, dass durch die Verschmelzung die Erfüllung ihrer Forderung gefährdet wird."
    },
    {
      "date": "2025-05-27",
      "id": "110339",
      "original_text": "Sonstige Registerbekanntmachung\nSchleswig-Holstein Amtsgericht Lübeck HRB 7796\nBaltech GmbH – Lübeck",
      "type": "Sonstige Registerbekanntmachung",
      "state": "Schleswig-Holstein",
      "amtsgericht": "Amtsgericht Lübeck",
      "registernummer": "HRB 7796",
      "registerart": "HRB",
      "company_name": "Baltech GmbH",
      "company_seat": "Lübeck",
      "details": "27.05.2025 (Bekanntmachungsdatum)\n\nSchleswig-Holstein Amtsgericht Lübeck HRB 7796\nSonstige Registerbekanntmachung\n\nBaltech GmbH\nGesellschaft mit beschränkter Haftung\nLübeck\n\nAls nicht eingetragen wird veröffentlicht:\nSchreiben an GF. Roman Alexandrovich Romanov, St. Petersburg/Russland\nRussische Föderation\nSehr geehrter Herr Romanov,\n\nin der Handelsregistersache der\n\nBaltech GmbH\n\nergeben sich aus den mir vorliegenden Unterlagen Anhaltspunkte dafür, dass die Gesellschaft vermögenslos ist:\n\nNichterreichbarkeit der Gesellschaft, Geschäftsführer, wohnhaft in Russland, antwortet auf gerichtliche Schreiben nicht, die IHK und Finanzamt befürworten die Löschung.\n\nIch beabsichtige daher, die Gesellschaft wegen Vermögenslosigkeit gemäß § 394 FamFG zu löschen.\n\nIch bestimme eine Frist von einem Monat zur Geltendmachung eines Widerspruchs gegen die Löschung, § 394 Abs. 2 S. 1 FamFG.\n\nWeiter bitte ich Sie, mir binnen derselben Frist mitzuteilen, ob die genannte Gesellschaft noch Vermögen hat, ggf. welche Vermögensgegenstände sie besitzt, ob die Gesellschaft noch Partei eines noch nicht rechtskräftig abgeschlossenen Rechtsstreits ist oder ob sonst noch eine Abwicklung stattfindet.\n\nNach Fristablauf ohne Widerspruch von Ihnen oder anderer Seite wird die Gesellschaft gelöscht.\n\nMit freundlichen Grüßen\nKistenmacher\nDipl.-Rechtspflegerin (FH)"
    },
    {
      "date": "2025-05-27",
      "id": "110340",
      "original_text": "Löschungsankündigung\nBaden-Württemberg Amtsgericht Stuttgart HRB 749501\nSC Projektentwicklung GmbH – Fellbach",
      "type": "Löschungsankündigung",
      "state": "Baden-Württemberg",
      "amtsgericht": "Amtsgericht Stuttgart",
      "registernummer": "HRB 749501",
      "registerart": "HRB",
      "company_name": "SC Projektentwicklung GmbH",
      "company_seat": "Fellbach",
      "details": "27.05.2025 (Bekanntmachungsdatum)\n\nBaden-Württemberg Amtsgericht Stuttgart HRB 749501\nLöschungsankündigung\n\nSC Projektentwicklung GmbH\nGesellschaft mit beschränkter Haftung\nFellbach\n\nDas Gericht beabsichtigt, die Gesellschaft wegen Vermögenslosigkeit im Handelsregister von Amts wegen nach § 394 FamFG zu löschen. Die Frist zur Geltendmachung eines Widerspruchs gegen die beabsichtigte Löschung ist auf zwei Monate ab Veröffentlichung bestimmt."
    },
    {
      "date": "2025-05-27",
      "id": "110341",
      "original_text": "Registerbekanntmachung nach dem Umwandlungsgesetz\nBaden-Württemberg Amtsgericht Freiburg HRB 724597\nTHERMOPLAY Deutschland GmbH – Bahlingen am Kaiserstuhl",
      "type": "Registerbekanntmachung nach dem Umwandlungsgesetz",
      "state": "Baden-Württemberg",
      "amtsgericht": "Amtsgericht Freiburg",
      "registernummer": "HRB 724597",
      "registerart": "HRB",
      "company_name": "THERMOPLAY Deutschland GmbH",
      "company_seat": "Bahlingen am Kaiserstuhl",
      "details": "27.05.2025 (Bekanntmachungsdatum)\n\nBaden-Württemberg Amtsgericht Freiburg HRB 724597\nRegisterbekanntmachung nach dem Umwandlungsgesetz 27.05.2025 (Eintragungsdatum)\n\nTHERMOPLAY Deutschland GmbH\nGesellschaft mit beschränkter Haftung\nBahlingen am Kaiserstuhl\n\nAls nicht eingetragen wird bekanntgemacht:\nDen Gläubigern der an der Verschmelzung beteiligten Rechtsträger (\"THERMOPLAY Deutschland GmbH\", Bahlingen am Kaiserstuhl, Amtsgericht Freiburg i. Br. HRB 724597 und „Barnes Group Acquisition GmbH\", Bahlingen am Kaiserstuhl, Amtsgericht Freiburg i. Br. HRB 710836) ist, wenn sie binnen sechs Monaten nach dem Tag, an dem die Eintragung der Verschmelzung in das Register des Sitzes desjenigen Rechtsträgers, dessen Gläubiger sie sind, nach § 19 Abs. 3 UmwG als bekanntgemacht gilt, ihren Anspruch nach Grund und Höhe schriftlich anmelden, Sicherheit zu leisten, soweit sie nicht Befriedigung verlangen können. Dieses Recht steht den Gläubigern jedoch nur zu, wenn sie glaubhaft machen, dass durch die Verschmelzung die Erfüllung ihrer Forderung gefährdet wird."
    },
    {
      "date": "2025-05-27",
      "id": "110342",
      "original_text": "Sonstige Registerbekanntmachung\nSachsen-Anhalt Amtsgericht Stendal HRB 30944\nETEON Services GmbH – Magdeburg",
      "type": "Sonstige Registerbekanntmachung",
      "state": "Sachsen-Anhalt",
      "amtsgericht": "Amtsgericht Stendal",
      "registernummer": "HRB 30944",
      "registerart": "HRB",
      "company_name": "ETEON Services GmbH",
      "company_seat": "Magdeburg",
      "details": "27.05.2025 (Bekanntmachungsdatum)\n\nSachsen-Anhalt Amtsgericht Stendal HRB 30944\nSonstige Registerbekanntmachung 27.05.2025 (Eintragungsdatum)\n\nETEON Services GmbH\nGesellschaft mit beschränkter Haftung\nMagdeburg\n\nDie Gesellschaft ist durch rechtskräftige Abweisung eines Antrags auf Eröffnung des Insolvenzverfahrens mangels Masse aufgelöst (Az. 340 IN 415/23 (371) Amtsgericht Magdeburg). Von Amts wegen eingetragen."
    },
    {
      "date": "2025-05-27",
      "id": "110343",
      "original_text": "Sonstige Registerbekanntmachung\nBaden-Württemberg Amtsgericht Freiburg HRB 630106\nRheinkraftwerk Säckingen Aktiengesellschaft – Bad Säckingen",
      "type": "Sonstige Registerbekanntmachung",
      "state": "Baden-Württemberg",
      "amtsgericht": "Amtsgericht Freiburg",
      "registernummer": "HRB 630106",
      "registerart": "HRB",
      "company_name": "Rheinkraftwerk Säckingen Aktiengesellschaft",
      "company_seat": "Bad Säckingen",
      "details": "27.05.2025 (Bekanntmachungsdatum)\n\nBaden-Württemberg Amtsgericht Freiburg HRB 630106\nSonstige Registerbekanntmachung 26.05.2025 (Eintragungsdatum)\n\nRheinkraftwerk Säckingen Aktiengesellschaft\nAktiengesellschaft\nBad Säckingen\n\nAls nicht eingetragen wird bekanntgemacht:\nDie Gesellschaft hat am 26.05.2025 die Liste über die Zusammensetzung des Aufsichtsrats zum Handelsregister eingereicht."
    },
    {
      "date": "2025-05-27",
      "id": "110344",
      "original_text": "Registerbekanntmachung nach dem Umwandlungsgesetz\nBaden-Württemberg Amtsgericht Stuttgart HRB 766508\nRTW Logistik & Service Verwaltungs-GmbH – Reutlingen",
      "type": "Registerbekanntmachung nach dem Umwandlungsgesetz",
      "state": "Baden-Württemberg",
      "amtsgericht": "Amtsgericht Stuttgart",
      "registernummer": "HRB 766508",
      "registerart": "HRB",
      "company_name": "RTW Logistik & Service Verwaltungs-GmbH",
      "company_seat": "Reutlingen",
      "details": "27.05.2025 (Bekanntmachungsdatum)\n\nBaden-Württemberg Amtsgericht Stuttgart HRB 766508\nRegisterbekanntmachung nach dem Umwandlungsgesetz 27.05.2025 (Eintragungsdatum)\n\nRTW Logistik & Service Verwaltungs-GmbH\nGesellschaft mit beschränkter Haftung\nReutlingen\n\nAls nicht eingetragen wird bekanntgemacht:\nDen Gläubigern der an der Verschmelzung beteiligten Rechtsträger ist, wenn sie binnen sechs Monaten nach dem Tag, an dem die Eintragung der Verschmelzung in das Register des Sitzes desjenigen Rechtsträgers, dessen Gläubiger sie sind, nach § 19 Abs. 3 UmwG als bekanntgemacht gilt, ihren Anspruch nach Grund und Höhe schriftlich anmelden, Sicherheit zu leisten, soweit sie nicht Befriedigung verlangen können. Dieses Recht steht den Gläubigern jedoch nur zu, wenn sie glaubhaft machen, dass durch die Verschmelzung die Erfüllung ihrer Forderung gefährdet wird."
    },
    {
      "date": "2025-05-27",
      "id": "110345",
      "original_text": "Löschungsankündigung\nBaden-Württemberg Amtsgericht Freiburg HRB 720722\nOptiFin Finanzoptimierungsgesellschaft mbH – Kehl",
      "type": "Löschungsankündigung",
      "state": "Baden-Württemberg",
      "amtsgericht": "Amtsgericht Freiburg",
      "registernummer": "HRB 720722",
      "registerart": "HRB",
      "company_name": "OptiFin Finanzoptimierungsgesellschaft mbH",
      "company_seat": "Kehl",
      "details": "27.05.2025 (Bekanntmachungsdatum)\n\nBaden-Württemberg Amtsgericht Freiburg HRB 720722\nLöschungsankündigung\n\nOptiFin Finanzoptimierungsgesellschaft mbH\nGesellschaft mit beschränkter Haftung\nKehl\n\nAls nicht eingetragen wird bekanntgemacht:\nDas Gericht beabsichtigt, die Gesellschaft wegen Vermögenslosigkeit im Handelsregister von Amts wegen nach § 394 FamFG zu löschen. Die Frist zur Geltendmachung eines Widerspruchs gegen die beabsichtigte Löschung ist auf einen Monat ab Veröffentlichung bestimmt."
    },
    {
      "date": "2025-05-27",
      "id": "110346",
      "original_text": "Registerbekanntmachung nach dem Umwandlungsgesetz\nNordrhein-Westfalen Amtsgericht Coesfeld HRB 19103\nMatthews International GmbH – Vreden",
      "type": "Registerbekanntmachung nach dem Umwandlungsgesetz",
      "state": "Nordrhein-Westfalen",
      "amtsgericht": "Amtsgericht Coesfeld",
      "registernummer": "HRB 19103",
      "registerart": "HRB",
      "company_name": "Matthews International GmbH",
      "company_seat": "Vreden",
      "details": "27.05.2025 (Bekanntmachungsdatum)\n\nNordrhein-Westfalen Amtsgericht Coesfeld HRB 19103\nRegisterbekanntmachung nach dem Umwandlungsgesetz 27.05.2025 (Eintragungsdatum)\n\nMatthews International GmbH\nGesellschaft mit beschränkter Haftung\nVreden\n\nDen Gläubigern der an der Abspaltung beteiligten Rechtsträger ist, wenn sie binnen sechs Monaten nach dem Tag, an dem die Eintragung der Abspaltung in das Register des Sitzes desjenigen Rechtsträgers, dessen Gläubiger sie sind, nach § 19 Absatz 3 UmwG als bekanntgemacht gilt, ihren Anspruch nach Grund und Höhe schriftlich anmelden, Sicherheit zu leisten, soweit sie nicht Befriedigung verlangen können. Dieses Recht steht den Gläubigern jedoch nur zu, wenn sie glaubhaft machen, dass durch die Abspaltung die Erfüllung ihrer Forderung gefährdet wird."
    },
    {
      "date": "2025-05-27",
      "id": "110347",
      "original_text": "Registerbekanntmachung nach dem Umwandlungsgesetz\nBerlin Amtsgericht Berlin (Charlottenburg) HRB 179137\nSpringer Nature Campus GmbH – Berlin",
      "type": "Registerbekanntmachung nach dem Umwandlungsgesetz",
      "state": "Berlin",
      "amtsgericht": "Amtsgericht Berlin (Charlottenburg)",
      "registernummer": "HRB 179137",
      "registerart": "HRB",
      "company_name": "Springer Nature Campus GmbH",
      "company_seat": "Berlin",
      "details": "27.05.2025 (Bekanntmachungsdatum)\n\nBerlin Amtsgericht Berlin (Charlottenburg) HRB 179137\nRegisterbekanntmachung nach dem Umwandlungsgesetz 27.05.2025 (Eintragungsdatum)\n\nSpringer Nature Campus GmbH\nGesellschaft mit beschränkter Haftung\nBerlin\n\nZu Eintragungsnummer 10 vom 27.05.2025 wird als nicht eingetragen veröffentlicht:\nDen Gläubigern der an der Verschmelzung beteiligten Rechtsträger ist, wenn sie binnen sechs Monaten nach dem Tag, an dem die Eintragung der Verschmelzung in das Register des Sitzes desjenigen Rechtsträgers, dessen Gläubiger sie sind, als bekannt gemacht gilt, ihren Anspruch nach Grund und Höhe schriftlich anmelden, Sicherheit zu leisten, soweit sie nicht Befriedigung verlangen können. Dieses Recht steht den Gläubigern jedoch nur zu, wenn sie glaubhaft machen, dass durch die Verschmelzung die Erfüllung ihrer Forderung gefährdet wird. Das Recht, Sicherheitsleistung zu verlangen, steht Gläubigern nicht zu, die im Falle der Insolvenz ein Recht auf vorzugsweise Befriedigung aus einer Deckungsmasse haben, die nach gesetzlicher Vorschrift zu ihrem Schutz errichtet und staatlich überwacht ist."
    },
    {
      "date": "2025-05-27",
      "id": "110348",
      "original_text": "Registerbekanntmachung nach dem Umwandlungsgesetz\nBerlin Amtsgericht Berlin (Charlottenburg) HRB 91881\nSpringer-Verlag GmbH – Berlin",
      "type": "Registerbekanntmachung nach dem Umwandlungsgesetz",
      "state": "Berlin",
      "amtsgericht": "Amtsgericht Berlin (Charlottenburg)",
      "registernummer": "HRB 91881",
      "registerart": "HRB",
      "company_name": "Springer-Verlag GmbH",
      "company_seat": "Berlin",
      "details": "27.05.2025 (Bekanntmachungsdatum)\n\nBerlin Amtsgericht Berlin (Charlottenburg) HRB 91881\nRegisterbekanntmachung nach dem Umwandlungsgesetz 27.05.2025 (Eintragungsdatum)\n\nSpringer-Verlag  GmbH\nGesellschaft mit beschränkter Haftung\nBerlin\n\nZu Eintragungsnummer 63 vom 27.05.2025 wird als nicht eingetragen veröffentlicht:\nDen Gläubigern der an der Verschmelzung beteiligten Rechtsträger ist, wenn sie binnen sechs Monaten nach dem Tag, an dem die Eintragung der Verschmelzung in das Register des Sitzes desjenigen Rechtsträgers, dessen Gläubiger sie sind, als bekannt gemacht gilt, ihren Anspruch nach Grund und Höhe schriftlich anmelden, Sicherheit zu leisten, soweit sie nicht Befriedigung verlangen können. Dieses Recht steht den Gläubigern jedoch nur zu, wenn sie glaubhaft machen, dass durch die Verschmelzung die Erfüllung ihrer Forderung gefährdet wird. Das Recht, Sicherheitsleistung zu verlangen, steht Gläubigern nicht zu, die im Falle der Insolvenz ein Recht auf vorzugsweise Befriedigung aus einer Deckungsmasse haben, die nach gesetzlicher Vorschrift zu ihrem Schutz errichtet und staatlich überwacht ist."
    },
    {
      "date": "2025-05-27",
      "id": "110349",
      "original_text": "Löschungsankündigung\nBaden-Württemberg Amtsgericht Freiburg HRB 722523\nBonaberi Enterprises GmbH – Freiburg im Breisgau",
      "type": "Löschungsankündigung",
      "state": "Baden-Württemberg",
      "amtsgericht": "Amtsgericht Freiburg",
      "registernummer": "HRB 722523",
      "registerart": "HRB",
      "company_name": "Bonaberi Enterprises GmbH",
      "company_seat": "Freiburg im Breisgau",
      "details": "27.05.2025 (Bekanntmachungsdatum)\n\nBaden-Württemberg Amtsgericht Freiburg HRB 722523\nLöschungsankündigung\n\nBonaberi Enterprises GmbH\nGesellschaft mit beschränkter Haftung\nFreiburg im Breisgau\n\nAls nicht eingetragen wird bekanntgemacht:\nDas Gericht beabsichtigt, die Gesellschaft wegen Vermögenslosigkeit im Handelsregister von Amts wegen nach § 394 FamFG zu löschen. Die Frist zur Geltendmachung eines Widerspruchs gegen die beabsichtigte Löschung ist auf einen Monat ab Veröffentlichung bestimmt."
    },
    {
      "date": "2025-05-27",
      "id": "110350",
      "original_text": "Registerbekanntmachung nach dem Umwandlungsgesetz\nBrandenburg Amtsgericht Cottbus HRB 14168\nMarina Plaue Grundstücksgesellschaft mbH – Schönefeld",
      "type": "Registerbekanntmachung nach dem Umwandlungsgesetz",
      "state": "Brandenburg",
      "amtsgericht": "Amtsgericht Cottbus",
      "registernummer": "HRB 14168",
      "registerart": "HRB",
      "company_name": "Marina Plaue Grundstücksgesellschaft mbH",
      "company_seat": "Schönefeld",
      "details": "27.05.2025 (Bekanntmachungsdatum)\n\nBrandenburg Amtsgericht Cottbus HRB 14168\nRegisterbekanntmachung nach dem Umwandlungsgesetz 27.05.2025 (Eintragungsdatum)\n\nMarina Plaue Grundstücksgesellschaft mbH\nGesellschaft mit beschränkter Haftung\nSchönefeld\n\nZu Eintragungsnummer 3 vom 27.05.2025 wird als nicht eingetragen veröffentlicht:\nDen Gläubigern der an der Verschmelzung beteiligten Rechtsträger ist, wenn sie binnen sechs Monaten nach dem Tag, an dem die Eintragung der Verschmelzung in das Register des Sitzes desjenigen Rechtsträgers, dessen Gläubiger sie sind, als bekannt gemacht gilt, ihren Anspruch nach Grund und Höhe schriftlich anmelden, Sicherheit zu leisten, soweit sie nicht Befriedigung verlangen können. Dieses Recht steht den Gläubigern jedoch nur zu, wenn sie glaubhaft machen, dass durch die Verschmelzung die Erfüllung ihrer Forderung gefährdet wird"
    },
    {
      "date": "2025-05-27",
      "id": "110351",
      "original_text": "Registerbekanntmachung nach dem Umwandlungsgesetz\nSachsen Amtsgericht Dresden HRA 3325\nFB- Aufzüge GmbH & Co.KG - Dresden – Dresden",
      "type": "Registerbekanntmachung nach dem Umwandlungsgesetz",
      "state": "Sachsen",
      "amtsgericht": "Amtsgericht Dresden",
      "registernummer": "HRA 3325",
      "registerart": "HRA",
      "company_name": "FB- Aufzüge GmbH & Co.KG - Dresden",
      "company_seat": "Dresden",
      "details": "27.05.2025 (Bekanntmachungsdatum)\n\nSachsen Amtsgericht Dresden HRA 3325\nRegisterbekanntmachung nach dem Umwandlungsgesetz 27.05.2025 (Eintragungsdatum)\n\nFB- Aufzüge GmbH & Co.KG - Dresden\nKommanditgesellschaft\nDresden\n\nDen Gläubigern der an der Verschmelzung beteiligten Rechtsträger ist, wenn sie binnen sechs Monaten nach dem Tag, an dem die Eintragung der Verschmelzung in das Register des Sitzes desjenigen Rechtsträgers, dessen Gläubiger sie sind, nach § 19 Abs. 3 UmwG als bekannt gemacht gilt, ihren Anspruch nach Grund und Höhe in Textform anmelden, Sicherheit zu leisten, soweit sie nicht Befriedigung verlangen können. Dieses Recht steht den Gläubigern jedoch nur zu, wenn sie glaubhaft machen, dass durch die Verschmelzung die Erfüllung der Forderung gefährdet wird."
    },
    {
      "date": "2025-05-27",
      "id": "110352",
      "original_text": "Registerbekanntmachung nach dem Umwandlungsgesetz\nBrandenburg Amtsgericht Cottbus HRB 18791\nAPARTMENTS am Flugplatz Strausberg GmbH – Schönefeld",
      "type": "Registerbekanntmachung nach dem Umwandlungsgesetz",
      "state": "Brandenburg",
      "amtsgericht": "Amtsgericht Cottbus",
      "registernummer": "HRB 18791",
      "registerart": "HRB",
      "company_name": "APARTMENTS am Flugplatz Strausberg GmbH",
      "company_seat": "Schönefeld",
      "details": "27.05.2025 (Bekanntmachungsdatum)\n\nBrandenburg Amtsgericht Cottbus HRB 18791\nRegisterbekanntmachung nach dem Umwandlungsgesetz 27.05.2025 (Eintragungsdatum)\n\nAPARTMENTS am Flugplatz Strausberg GmbH\nGesellschaft mit beschränkter Haftung\nSchönefeld\n\nAls nicht eingetragen wird veröffentlicht:\nDen Gläubigern der an der Spaltung beteiligten Rechtsträger ist, wenn sie binnen sechs Monaten nach dem Tag, an dem die Eintragung der Spaltung in das Register des Sitzes desjenigen Rechtsträgers, dessen Gläubiger sie sind, als bekannt gemacht gilt, ihren Anspruch nach Grund und Höhe schriftlich anmelden, Sicherheit zu leisten, soweit sie nicht Befriedigung verlangen können. Dieses Recht steht den Gläubigern jedoch nur zu, wenn sie glaubhaft machen, dass durch die Spaltung die Erfüllung ihrer Forderung gefährdet wird"
    },
    {
      "date": "2025-05-27",
      "id": "110353",
      "original_text": "Löschungsankündigung\nNiedersachsen Amtsgericht Osnabrück HRB 214726\nKamper Agrartechnik und Dienstleistungen UG (haftungsbeschränkt) – Badbergen",
      "type": "Löschungsankündigung",
      "state": "Niedersachsen",
      "amtsgericht": "Amtsgericht Osnabrück",
      "registernummer": "HRB 214726",
      "registerart": "HRB",
      "company_name": "Kamper Agrartechnik und Dienstleistungen UG (haftungsbeschränkt)",
      "company_seat": "Badbergen",
      "details": "27.05.2025 (Bekanntmachungsdatum)\n\nNiedersachsen Amtsgericht Osnabrück HRB 214726\nLöschungsankündigung\n\nKamper Agrartechnik und Dienstleistungen UG (haftungsbeschränkt)\nGesellschaft mit beschränkter Haftung\nBadbergen\n\nDas Registergericht beabsichtigt, die Gesellschaft von Amts wegen nach § 394 FamFG wegen Vermögenslosigkeit zu löschen. Die Frist zur Erhebung eines Widerspruchs ist auf 1 Monat ab dieser Registerbekanntmachung festgesetzt."
    },
    {
      "date": "2025-05-27",
      "id": "110354",
      "original_text": "Löschungsankündigung\nSchleswig-Holstein Amtsgericht Flensburg HRB 6403\nBünsch Immobilien-Service GmbH – Morsum/Sylt",
      "type": "Löschungsankündigung",
      "state": "Schleswig-Holstein",
      "amtsgericht": "Amtsgericht Flensburg",
      "registernummer": "HRB 6403",
      "registerart": "HRB",
      "company_name": "Bünsch Immobilien-Service GmbH",
      "company_seat": "Morsum/Sylt",
      "details": "27.05.2025 (Bekanntmachungsdatum)\n\nSchleswig-Holstein Amtsgericht Flensburg HRB 6403\nLöschungsankündigung\n\nBünsch Immobilien-Service GmbH\nGesellschaft mit beschränkter Haftung\nMorsum/Sylt\n\nEs ist die Löschung der nachstehenden Gesellschaft wegen Vermögenslosigkeit gemäß § 394 FamFG beabsichtigt.\nWiderspruchsfrist: 2 Monate."
    },
    {
      "date": "2025-05-27",
      "id": "110355",
      "original_text": "Registerbekanntmachung nach dem Umwandlungsgesetz\nNiedersachsen Amtsgericht Hannover HRB 221126\nMagic Circle GmbH – Hameln",
      "type": "Registerbekanntmachung nach dem Umwandlungsgesetz",
      "state": "Niedersachsen",
      "amtsgericht": "Amtsgericht Hannover",
      "registernummer": "HRB 221126",
      "registerart": "HRB",
      "company_name": "Magic Circle GmbH",
      "company_seat": "Hameln",
      "details": "27.05.2025 (Bekanntmachungsdatum)\n\nNiedersachsen Amtsgericht Hannover HRB 221126\nRegisterbekanntmachung nach dem Umwandlungsgesetz 27.05.2025 (Eintragungsdatum)\n\nMagic Circle GmbH\nGesellschaft mit beschränkter Haftung\nHameln\n\nDen Gläubigern der an der Verschmelzung beteiligten Rechtsträger ist, wenn sie binnen sechs Monaten nach dem Tag, an dem die Eintragung der Verschmelzung in das Register des Sitzes desjenigen Rechtsträgers, dessen Gläubiger sie sind, nach § 19  Abs.  3 UmwG als bekannt gemacht gilt, ihren Anspruch nach Grund und Höhe schriftlich anmelden, Sicherheit zu leisten, soweit sie nicht Befriedigung verlangen können. Dieses Recht steht den Gläubigern jedoch nur zu, wenn sie glaubhaft machen, dass durch die Verschmelzung die Erfüllung der Forderung gefährdet wird."
    },
    {
      "date": "2025-05-27",
      "id": "110356",
      "original_text": "Registerbekanntmachung nach dem Umwandlungsgesetz\nNiedersachsen Amtsgericht Hannover HRB 213291\nAM Bauer Verwaltungs GmbH – Hameln",
      "type": "Registerbekanntmachung nach dem Umwandlungsgesetz",
      "state": "Niedersachsen",
      "amtsgericht": "Amtsgericht Hannover",
      "registernummer": "HRB 213291",
      "registerart": "HRB",
      "company_name": "AM Bauer Verwaltungs GmbH",
      "company_seat": "Hameln",
      "details": "27.05.2025 (Bekanntmachungsdatum)\n\nNiedersachsen Amtsgericht Hannover HRB 213291\nRegisterbekanntmachung nach dem Umwandlungsgesetz 27.05.2025 (Eintragungsdatum)\n\nAM Bauer Verwaltungs GmbH\nGesellschaft mit beschränkter Haftung\nHameln\n\nDen Gläubigern der an der Verschmelzung beteiligten Rechtsträger ist, wenn sie binnen sechs Monaten nach dem Tag, an dem die Eintragung der Verschmelzung in das Register des Sitzes desjenigen Rechtsträgers, dessen Gläubiger sie sind, nach § 19  Abs.  3 UmwG als bekannt gemacht gilt, ihren Anspruch nach Grund und Höhe schriftlich anmelden, Sicherheit zu leisten, soweit sie nicht Befriedigung verlangen können. Dieses Recht steht den Gläubigern jedoch nur zu, wenn sie glaubhaft machen, dass durch die Verschmelzung die Erfüllung der Forderung gefährdet wird."
    },
    {
      "date": "2025-05-27",
      "id": "110357",
      "original_text": "Registerbekanntmachung nach dem Umwandlungsgesetz\nNiedersachsen Amtsgericht Aurich HRB 205585\nUP Leuchtfeuer Holding UG (haftungsbeschränkt) – Leer",
      "type": "Registerbekanntmachung nach dem Umwandlungsgesetz",
      "state": "Niedersachsen",
      "amtsgericht": "Amtsgericht Aurich",
      "registernummer": "HRB 205585",
      "registerart": "HRB",
      "company_name": "UP Leuchtfeuer Holding UG (haftungsbeschränkt)",
      "company_seat": "Leer",
      "details": "27.05.2025 (Bekanntmachungsdatum)\n\nNiedersachsen Amtsgericht Aurich HRB 205585\nRegisterbekanntmachung nach dem Umwandlungsgesetz 27.05.2025 (Eintragungsdatum)\n\nUP Leuchtfeuer Holding UG (haftungsbeschränkt)\nGesellschaft mit beschränkter Haftung\nLeer\n\nDen Gläubigern der an der Verschmelzung beteiligten Rechtsträger ist, wenn sie binnen sechs Monaten nach dem Tag, an dem die Eintragung der Verschmelzung in das Register des Sitzes desjenigen Rechtsträgers, dessen Gläubiger sie sind, nach § 19  Abs.  3 UmwG als bekannt gemacht gilt, ihren Anspruch nach Grund und Höhe schriftlich anmelden, Sicherheit zu leisten, soweit sie nicht Befriedigung verlangen können. Dieses Recht steht den Gläubigern jedoch nur zu, wenn sie glaubhaft machen, dass durch die Verschmelzung die Erfüllung der Forderung gefährdet wird."
    },
    {
      "date": "2025-05-27",
      "id": "110358",
      "original_text": "Registerbekanntmachung nach dem Umwandlungsgesetz\nNiedersachsen Amtsgericht Braunschweig HRA 203261\nSchwitalla Elektrotechnik e.K. – Vechelde",
      "type": "Registerbekanntmachung nach dem Umwandlungsgesetz",
      "state": "Niedersachsen",
      "amtsgericht": "Amtsgericht Braunschweig",
      "registernummer": "HRA 203261",
      "registerart": "HRA",
      "company_name": "Schwitalla Elektrotechnik e.K.",
      "company_seat": "Vechelde",
      "details": "27.05.2025 (Bekanntmachungsdatum)\n\nNiedersachsen Amtsgericht Braunschweig HRA 203261\nRegisterbekanntmachung nach dem Umwandlungsgesetz 27.05.2025 (Eintragungsdatum)\n\nSchwitalla Elektrotechnik e.K.\nEinzelkaufmann / Einzelkauffrau\nVechelde\n\nDen Gläubigern der an der Ausgliederung beteiligten Rechtsträger ist, wenn sie binnen sechs Monaten nach dem Tag, an dem die Eintragung der Ausgliederung in das Register des Sitzes desjenigen Rechtsträgers, dessen Gläubiger sie sind, nach § 19 Abs. 3 UmwG als bekannt gemacht gilt, ihren Anspruch nach Grund und Höhe schriftlich anmelden, Sicherheit zu leisten, soweit sie nicht Befriedigung verlangen können. Dieses Recht steht den Gläubigern jedoch nur zu, wenn sie glaubhaft machen, dass durch die Ausgliederung die Erfüllung der Forderung gefährdet wird."
    },
    {
      "date": "2025-05-27",
      "id": "110359",
      "original_text": "Registerbekanntmachung nach dem Umwandlungsgesetz\nNiedersachsen Amtsgericht Braunschweig HRB 212186\nSO Elektrotechnik GmbH – Vechelde",
      "type": "Registerbekanntmachung nach dem Umwandlungsgesetz",
      "state": "Niedersachsen",
      "amtsgericht": "Amtsgericht Braunschweig",
      "registernummer": "HRB 212186",
      "registerart": "HRB",
      "company_name": "SO Elektrotechnik GmbH",
      "company_seat": "Vechelde",
      "details": "27.05.2025 (Bekanntmachungsdatum)\n\nNiedersachsen Amtsgericht Braunschweig HRB 212186\nRegisterbekanntmachung nach dem Umwandlungsgesetz 27.05.2025 (Eintragungsdatum)\n\nSO Elektrotechnik GmbH\nGesellschaft mit beschränkter Haftung\nVechelde\n\nDen Gläubigern der an der Ausgliederung beteiligten Rechtsträger ist, wenn sie binnen sechs Monaten nach dem Tag, an dem die Eintragung der Ausgliederung in das Register des Sitzes desjenigen Rechtsträgers, dessen Gläubiger sie sind, nach § 19 Abs. 3 UmwG als bekannt gemacht gilt, ihren Anspruch nach Grund und Höhe schriftlich anmelden, Sicherheit zu leisten, soweit sie nicht Befriedigung verlangen können. Dieses Recht steht den Gläubigern jedoch nur zu, wenn sie glaubhaft machen, dass durch die Ausgliederung die Erfüllung der Forderung gefährdet wird."
    },
    {
      "date": "2025-05-27",
      "id": "110360",
      "original_text": "Löschungsankündigung\nNiedersachsen Amtsgericht Lüneburg HRB 209475\nCanGanga UG (haftungsbeschränkt) – Winsen (Luhe)",
      "type": "Löschungsankündigung",
      "state": "Niedersachsen",
      "amtsgericht": "Amtsgericht Lüneburg",
      "registernummer": "HRB 209475",
      "registerart": "HRB",
      "company_name": "CanGanga UG (haftungsbeschränkt)",
      "company_seat": "Winsen (Luhe)",
      "details": "27.05.2025 (Bekanntmachungsdatum)\n\nNiedersachsen Amtsgericht Lüneburg HRB 209475\nLöschungsankündigung\n\nCanGanga UG (haftungsbeschränkt)\nGesellschaft mit beschränkter Haftung\nWinsen (Luhe)\n\nDas Registergericht beabsichtigt, die Gesellschaft von Amts wegen nach § 395 FamFG zu löschen. Die Frist zur Erhebung eines Widerspruchs ist auf 1 Monat ab dieser Registerbekanntmachung festgesetzt."
    },
    {
      "date": "2025-05-27",
      "id": "110361",
      "original_text": "Löschungsankündigung\nNiedersachsen Amtsgericht Hildesheim HRB 204525\nKlöpper UG (haftungsbeschränkt) – Bockenem",
      "type": "Löschungsankündigung",
      "state": "Niedersachsen",
      "amtsgericht": "Amtsgericht Hildesheim",
      "registernummer": "HRB 204525",
      "registerart": "HRB",
      "company_name": "Klöpper UG (haftungsbeschränkt)",
      "company_seat": "Bockenem",
      "details": "27.05.2025 (Bekanntmachungsdatum)\n\nNiedersachsen Amtsgericht Hildesheim HRB 204525\nLöschungsankündigung\n\nKlöpper UG (haftungsbeschränkt)\nGesellschaft mit beschränkter Haftung\nBockenem\n\nDas Registergericht beabsichtigt, die Gesellschaft von Amts wegen nach § 394 FamFG zu löschen. Die Frist zur Erhebung eines Widerspruchs ist auf 1 Monat ab dieser Registerbekanntmachung festgesetzt."
    },
    {
      "date": "2025-05-27",
      "id": "110362",
      "original_text": "Löschungsankündigung\nNiedersachsen Amtsgericht Braunschweig HRB 209391\nS.T.G. GmbH – Goslar",
      "type": "Löschungsankündigung",
      "state": "Niedersachsen",
      "amtsgericht": "Amtsgericht Braunschweig",
      "registernummer": "HRB 209391",
      "registerart": "HRB",
      "company_name": "S.T.G. GmbH",
      "company_seat": "Goslar",
      "details": "27.05.2025 (Bekanntmachungsdatum)\n\nNiedersachsen Amtsgericht Braunschweig HRB 209391\nLöschungsankündigung 27.05.2025 (Eintragungsdatum)\n\nS.T.G. GmbH\nGesellschaft mit beschränkter Haftung\nGoslar\n\nDas Registergericht beabsichtigt, die Gesellschaft von Amts wegen nach § 394 FamFG zu löschen. Die Frist zur Erhebung eines Widerspruchs ist auf 1 Monat ab dieser Registerbekanntmachung festgesetzt."
    },
    {
      "date": "2025-05-27",
      "id": "110363",
      "original_text": "Löschungsankündigung\nNiedersachsen Amtsgericht Osnabrück HRB 213410\nER Gastro GmbH – Bad Bentheim",
      "type": "Löschungsankündigung",
      "state": "Niedersachsen",
      "amtsgericht": "Amtsgericht Osnabrück",
      "registernummer": "HRB 213410",
      "registerart": "HRB",
      "company_name": "ER Gastro GmbH",
      "company_seat": "Bad Bentheim",
      "details": "27.05.2025 (Bekanntmachungsdatum)\n\nNiedersachsen Amtsgericht Osnabrück HRB 213410\nLöschungsankündigung\n\nER Gastro GmbH\nGesellschaft mit beschränkter Haftung\nBad Bentheim\n\nDas Registergericht beabsichtigt, die Gesellschaft von Amts wegen nach § 394 FamFG wegen Vermögenslosigkeit zu löschen. Die Frist zur Erhebung eines Widerspruchs ist auf 1 Monat ab dieser Registerbekanntmachung festgesetzt."
    },
    {
      "date": "2025-05-27",
      "id": "110364",
      "original_text": "Registerbekanntmachung nach dem Umwandlungsgesetz\nNiedersachsen Amtsgericht Aurich HRB 205591\nKlarSchiff GmbH – Leer",
      "type": "Registerbekanntmachung nach dem Umwandlungsgesetz",
      "state": "Niedersachsen",
      "amtsgericht": "Amtsgericht Aurich",
      "registernummer": "HRB 205591",
      "registerart": "HRB",
      "company_name": "KlarSchiff GmbH",
      "company_seat": "Leer",
      "details": "27.05.2025 (Bekanntmachungsdatum)\n\nNiedersachsen Amtsgericht Aurich HRB 205591\nRegisterbekanntmachung nach dem Umwandlungsgesetz 27.05.2025 (Eintragungsdatum)\n\nKlarSchiff GmbH\nGesellschaft mit beschränkter Haftung\nLeer\n\nDen Gläubigern der an der Verschmelzung beteiligten Rechtsträger ist, wenn sie binnen sechs Monaten nach dem Tag, an dem die Eintragung der Verschmelzung in das Register des Sitzes desjenigen Rechtsträgers, dessen Gläubiger sie sind, nach § 19  Abs.  3 UmwG als bekannt gemacht gilt, ihren Anspruch nach Grund und Höhe schriftlich anmelden, Sicherheit zu leisten, soweit sie nicht Befriedigung verlangen können. Dieses Recht steht den Gläubigern jedoch nur zu, wenn sie glaubhaft machen, dass durch die Verschmelzung die Erfüllung der Forderung gefährdet wird."
    },
    {
      "date": "2025-05-27",
      "id": "110365",
      "original_text": "Sonstige Registerbekanntmachung\nRheinland-Pfalz Amtsgericht Landau HRB 33670\nLouis Trockenbau UG (haftungsbeschränkt) – Landau in der Pfalz",
      "type": "Sonstige Registerbekanntmachung",
      "state": "Rheinland-Pfalz",
      "amtsgericht": "Amtsgericht Landau",
      "registernummer": "HRB 33670",
      "registerart": "HRB",
      "company_name": "Louis Trockenbau UG (haftungsbeschränkt)",
      "company_seat": "Landau in der Pfalz",
      "details": "27.05.2025 (Bekanntmachungsdatum)\n\nRheinland-Pfalz Amtsgericht Landau HRB 33670\nSonstige Registerbekanntmachung\n\nLouis Trockenbau UG (haftungsbeschränkt)\nGesellschaft mit beschränkter Haftung\nLandau in der Pfalz\n\nDas Registergericht beabsichtigt, die Eintragung des Geschäftsführers Florjan Arkaxhiu von Amts wegen nach § 395 FamFG zu löschen. Die Frist zur Erhebung eines Widerspruchs ist auf drei Wochen festgesetzt."
    },
    {
      "date": "2025-05-27",
      "id": "110366",
      "original_text": "Löschungsankündigung\nRheinland-Pfalz Amtsgericht Ludwigshafen a.Rhein (Ludwigshafen) HRB 4067\nRONI GmbH – Ludwigshafen/Rhein",
      "type": "Löschungsankündigung",
      "state": "Rheinland-Pfalz",
      "amtsgericht": "Amtsgericht Ludwigshafen a.Rhein (Ludwigshafen)",
      "registernummer": "HRB 4067",
      "registerart": "HRB",
      "company_name": "RONI GmbH",
      "company_seat": "Ludwigshafen/Rhein",
      "details": "27.05.2025 (Bekanntmachungsdatum)\n\nRheinland-Pfalz Amtsgericht Ludwigshafen a.Rhein (Ludwigshafen) HRB 4067\nLöschungsankündigung\n\nRONI GmbH\nGesellschaft mit beschränkter Haftung\nLudwigshafen/Rhein\n\nDas Registergericht beabsichtigt die Gesellschaft von Amts wegen nach § 394 FamFG zu löschen. Die Frist zur Erhebung eines Widerspruchs ist auf einen Monat festgesetzt."
    },
    {
      "date": "2025-05-27",
      "id": "110367",
      "original_text": "Registerbekanntmachung nach dem Umwandlungsgesetz\nRheinland-Pfalz Amtsgericht Wittlich HRA 41006\nIT Fabrik Systemhaus GmbH & Co. KG – Bitburg",
      "type": "Registerbekanntmachung nach dem Umwandlungsgesetz",
      "state": "Rheinland-Pfalz",
      "amtsgericht": "Amtsgericht Wittlich",
      "registernummer": "HRA 41006",
      "registerart": "HRA",
      "company_name": "IT Fabrik Systemhaus GmbH & Co. KG",
      "company_seat": "Bitburg",
      "details": "27.05.2025 (Bekanntmachungsdatum)\n\nRheinland-Pfalz Amtsgericht Wittlich HRA 41006\nRegisterbekanntmachung nach dem Umwandlungsgesetz 27.05.2025 (Eintragungsdatum)\n\nIT Fabrik Systemhaus GmbH & Co. KG\nKommanditgesellschaft\nBitburg\n\nAls nicht eingetragen wird veröffentlicht: Den Gläubigern der an der Verschmelzung beteiligten Rechtsträger ist, wenn sie binnen sechs Monaten nach dem Tag, an dem die Eintragung der Verschmelzung in das Register des Sitzes desjenigen Rechtsträgers,dessen Gläubiger sie sind, nach § 19 Abs. 3 UmwG als bekannt gemacht gilt, ihren Anspruch nach Grund und Höhe schriftlich anmelden, Sicherheit zu leisten, soweit sie nicht Befriedigung verlangen können. Dieses Recht steht den Gläubigern jedoch nur zu, wenn sie glaubhaft machen, dass durch die Verschmelzung die Erfüllung der Forderung gefährdet wird."
    },
    {
      "date": "2025-05-27",
      "id": "110368",
      "original_text": "Einreichung neuer Dokumente\nRheinland-Pfalz Amtsgericht Mainz HRB 8041\nArbeit und Leben gemeinnützige Gesellschaft mit beschränkter Haftung – Mainz",
      "type": "Einreichung neuer Dokumente",
      "state": "Rheinland-Pfalz",
      "amtsgericht": "Amtsgericht Mainz",
      "registernummer": "HRB 8041",
      "registerart": "HRB",
      "company_name": "Arbeit und Leben gemeinnützige Gesellschaft mit beschränkter Haftung",
      "company_seat": "Mainz",
      "details": "27.05.2025 (Bekanntmachungsdatum)\n\nRheinland-Pfalz Amtsgericht Mainz HRB 8041\nEinreichung neuer Dokumente 27.05.2025 (Eintragungsdatum)\n\nArbeit und Leben gemeinnützige Gesellschaft mit beschränkter Haftung\nGesellschaft mit beschränkter Haftung\nMainz\n\nDem Registergericht ist eine Liste der Mitglieder des Aufsichtsrates eingereicht worden."
    },
    {
      "date": "2025-05-27",
      "id": "110369",
      "original_text": "Löschungsankündigung\nNordrhein-Westfalen Amtsgericht Köln HRB 50945\nVedere Film- und Theaterausstattungs GmbH – Köln",
      "type": "Löschungsankündigung",
      "state": "Nordrhein-Westfalen",
      "amtsgericht": "Amtsgericht Köln",
      "registernummer": "HRB 50945",
      "registerart": "HRB",
      "company_name": "Vedere Film- und Theaterausstattungs GmbH",
      "company_seat": "Köln",
      "details": "27.05.2025 (Bekanntmachungsdatum)\n\nNordrhein-Westfalen Amtsgericht Köln HRB 50945\nLöschungsankündigung\n\nVedere Film- und Theaterausstattungs GmbH\nGesellschaft mit beschränkter Haftung\nKöln\n\nDas Registergericht beabsichtigt die Gesellschaft von Amts wegen nach § 394 FamFG zu löschen. Die Frist zur Erhebung eines Widerspruchs ist auf einen Monat festgesetzt."
    },
    {
      "date": "2025-05-27",
      "id": "110370",
      "original_text": "Registerbekanntmachung nach dem Umwandlungsgesetz\nNordrhein-Westfalen Amtsgericht Gelsenkirchen HRB 9260\nSchellhorn Public Relations GmbH – Haltern am See",
      "type": "Registerbekanntmachung nach dem Umwandlungsgesetz",
      "state": "Nordrhein-Westfalen",
      "amtsgericht": "Amtsgericht Gelsenkirchen",
      "registernummer": "HRB 9260",
      "registerart": "HRB",
      "company_name": "Schellhorn Public Relations GmbH",
      "company_seat": "Haltern am See",
      "details": "27.05.2025 (Bekanntmachungsdatum)\n\nNordrhein-Westfalen Amtsgericht Gelsenkirchen HRB 9260\nRegisterbekanntmachung nach dem Umwandlungsgesetz 27.05.2025 (Eintragungsdatum)\n\nSchellhorn Public Relations GmbH\nGesellschaft mit beschränkter Haftung\nHaltern am See\n\nDen Gläubigern der an der Verschmelzung beteiligten Rechtsträger ist, wenn sie binnen sechs Monaten nach dem Tag, an dem die Eintragung der Verschmelzung in das Register des Sitzes desjenigen Rechtsträgers, dessen Gläubiger sie sind, nach § 19 Absatz 3 UmwG als bekanntgemacht gilt, ihren Anspruch nach Grund und Höhe schriftlich anmelden, Sicherheit zu leisten, soweit sie nicht Befriedigung verlangen können. Dieses Recht steht den Gläubigern jedoch nur zu, wenn sie glaubhaft machen, dass durch die Verschmelzung die Erfüllung ihrer Forderung gefährdet wird."
    },
    {
      "date": "2025-05-27",
      "id": "110371",
      "original_text": "Registerbekanntmachung nach dem Umwandlungsgesetz\nNordrhein-Westfalen Amtsgericht Gelsenkirchen HRB 10033\nConvincing Systems GmbH – Gelsenkirchen",
      "type": "Registerbekanntmachung nach dem Umwandlungsgesetz",
      "state": "Nordrhein-Westfalen",
      "amtsgericht": "Amtsgericht Gelsenkirchen",
      "registernummer": "HRB 10033",
      "registerart": "HRB",
      "company_name": "Convincing Systems GmbH",
      "company_seat": "Gelsenkirchen",
      "details": "27.05.2025 (Bekanntmachungsdatum)\n\nNordrhein-Westfalen Amtsgericht Gelsenkirchen HRB 10033\nRegisterbekanntmachung nach dem Umwandlungsgesetz 27.05.2025 (Eintragungsdatum)\n\nConvincing Systems GmbH\nGesellschaft mit beschränkter Haftung\nGelsenkirchen\n\nDen Gläubigern der an der Verschmelzung beteiligten Rechtsträger ist, wenn sie binnen sechs Monaten nach dem Tag, an dem die Eintragung der Verschmelzung in das Register des Sitzes desjenigen Rechtsträgers, dessen Gläubiger sie sind, nach § 19 Absatz 3 UmwG als bekanntgemacht gilt, ihren Anspruch nach Grund und Höhe schriftlich anmelden, Sicherheit zu leisten, soweit sie nicht Befriedigung verlangen können. Dieses Recht steht den Gläubigern jedoch nur zu, wenn sie glaubhaft machen, dass durch die Verschmelzung die Erfüllung ihrer Forderung gefährdet wird."
    },
    {
      "date": "2025-05-27",
      "id": "110372",
      "original_text": "Registerbekanntmachung nach dem Umwandlungsgesetz\nNordrhein-Westfalen Amtsgericht Essen HRB 29676\nMindcurv GmbH – Essen",
      "type": "Registerbekanntmachung nach dem Umwandlungsgesetz",
      "state": "Nordrhein-Westfalen",
      "amtsgericht": "Amtsgericht Essen",
      "registernummer": "HRB 29676",
      "registerart": "HRB",
      "company_name": "Mindcurv GmbH",
      "company_seat": "Essen",
      "details": "27.05.2025 (Bekanntmachungsdatum)\n\nNordrhein-Westfalen Amtsgericht Essen HRB 29676\nRegisterbekanntmachung nach dem Umwandlungsgesetz 23.05.2025 (Eintragungsdatum)\n\nMindcurv GmbH\nGesellschaft mit beschränkter Haftung\nEssen\n\nDen Gläubigern der an der Verschmelzung beteiligten Rechtsträger ist, wenn sie binnen sechs Monaten nach dem Tag, an dem die Eintragung der Verschmelzung in das Register des Sitzes desjenigen Rechtsträgers, dessen Gläubiger sie sind, nach § 19 Absatz 3 UmwG als bekanntgemacht gilt, ihren Anspruch nach Grund und Höhe schriftlich anmelden, Sicherheit zu leisten, soweit sie nicht Befriedigung verlangen können. Dieses Recht steht den Gläubigern jedoch nur zu, wenn sie glaubhaft machen, dass durch die Verschmelzung die Erfüllung ihrer Forderung gefährdet wird."
    },
    {
      "date": "2025-05-27",
      "id": "110373",
      "original_text": "Löschungsankündigung\nNordrhein-Westfalen Amtsgericht Wuppertal HRB 23791\nMarrakech Reisen GmbH – Wuppertal",
      "type": "Löschungsankündigung",
      "state": "Nordrhein-Westfalen",
      "amtsgericht": "Amtsgericht Wuppertal",
      "registernummer": "HRB 23791",
      "registerart": "HRB",
      "company_name": "Marrakech Reisen GmbH",
      "company_seat": "Wuppertal",
      "details": "27.05.2025 (Bekanntmachungsdatum)\n\nNordrhein-Westfalen Amtsgericht Wuppertal HRB 23791\nLöschungsankündigung 26.05.2025 (Eintragungsdatum)\n\nMarrakech Reisen GmbH\nGesellschaft mit beschränkter Haftung\nWuppertal\n\nDas Registergericht beabsichtigt die Gesellschaft von Amts wegen nach § 394 FamFG zu löschen. Die Frist zur Erhebung eines Widerspruchs ist auf einen Monat festgesetzt."
    },
    {
      "date": "2025-05-27",
      "id": "110374",
      "original_text": "Registerbekanntmachung nach dem Umwandlungsgesetz\nNordrhein-Westfalen Amtsgericht Düsseldorf HRB 79595\nRaum und Energie Gesellschaft für nachhaltiges Bauen mbH – Hilden",
      "type": "Registerbekanntmachung nach dem Umwandlungsgesetz",
      "state": "Nordrhein-Westfalen",
      "amtsgericht": "Amtsgericht Düsseldorf",
      "registernummer": "HRB 79595",
      "registerart": "HRB",
      "company_name": "Raum und Energie Gesellschaft für nachhaltiges Bauen mbH",
      "company_seat": "Hilden",
      "details": "27.05.2025 (Bekanntmachungsdatum)\n\nNordrhein-Westfalen Amtsgericht Düsseldorf HRB 79595\nRegisterbekanntmachung nach dem Umwandlungsgesetz 27.05.2025 (Eintragungsdatum)\n\nRaum und Energie Gesellschaft für nachhaltiges Bauen mbH\nGesellschaft mit beschränkter Haftung\nHilden\n\nDen Gläubigern der an der Verschmelzung beteiligten Rechtsträger ist, wenn sie binnen sechs Monaten nach dem Tag, an dem die Eintragung der Verschmelzung in das Register des Sitzes desjenigen Rechtsträgers, dessen Gläubiger sie sind, nach § 19 Absatz 3 UmwG als bekanntgemacht gilt, ihren Anspruch nach Grund und Höhe schriftlich anmelden, Sicherheit zu leisten, soweit sie nicht Befriedigung verlangen können. Dieses Recht steht den Gläubigern jedoch nur zu, wenn sie glaubhaft machen, dass durch die Verschmelzung die Erfüllung ihrer Forderung gefährdet wird."
    },
    {
      "date": "2025-05-27",
      "id": "110375",
      "original_text": "Löschungsankündigung\nNordrhein-Westfalen Amtsgericht Düsseldorf HRB 79548\nEco Cab GmbH – Düsseldorf",
      "type": "Löschungsankündigung",
      "state": "Nordrhein-Westfalen",
      "amtsgericht": "Amtsgericht Düsseldorf",
      "registernummer": "HRB 79548",
      "registerart": "HRB",
      "company_name": "Eco Cab GmbH",
      "company_seat": "Düsseldorf",
      "details": "27.05.2025 (Bekanntmachungsdatum)\n\nNordrhein-Westfalen Amtsgericht Düsseldorf HRB 79548\nLöschungsankündigung\n\nEco Cab GmbH\nGesellschaft mit beschränkter Haftung\nDüsseldorf\n\nDas Registergericht beabsichtigt die Gesellschaft von Amts wegen nach § 394 FamFG zu löschen. Die Frist zur Erhebung eines Widerspruchs ist auf 3 Wochen festgesetzt.\n\nRechtsbehelfsbelehrung:\nDas Widerspruchsrecht steht jedem zu, der an der Unterlassung der Löschung ein berechtigtes Interesse hat. Der Widerspruch ist bei dem Amtsgericht Düsseldorf -Registergericht-, Werdener Straße 1, 40227 Düsseldorf schriftlich in deutscher Sprache oder zur Niederschrift der Geschäftsstelle einzulegen. Der Widerspruch kann auch zur Niederschrift der Geschäftsstelle eines jeden Amtsgerichtes abgegeben werden. Die Einlegung ist auch durch Übertragung eines elektronischen Dokuments an die elektronische Poststelle des Gerichts möglich. Das elektronische Dokument muss für die Bearbeitung durch das Gericht geeignet und mit einer qualifizierten elektronischen Signatur der verantwortenden Person versehen sein oder von der verantwortenden Person signiert und auf einem sicheren Übermittlungsweg gemäß § 130a ZPO nach näherer Maßgabe der Verordnung über die technischen Rahmenbedingungen des elektronischen Rechtsverkehrs und über das besondere elektronische Behördenpostfach (BGBl. I, S.3803) eingereicht werden. Weitere Informationen erhalten Sie auf der Internetseite www.justiz.de.\nDer Widerspruch muss spätestens innerhalb der gesetzten Frist nach dem Datum der Bekanntmachung der Löschungsankündigung bei dem Amtsgericht - Registergericht - Düsseldorf eingegangen sein.  Dies gilt auch dann, wenn der Widerspruch zur Niederschrift der Geschäftsstelle eines anderen Amtsgerichtes abgegeben wurde. Die Frist beginnt mit dem Tage der Bekanntmachung der Löschungsankündigung in dem für die Bekanntmachung der Eintragungen in das Handelsregister bestimmten elektronischen Informations- und Kommunikationssystem nach § 10 des Handelsgesetzbuches. Fällt das Ende der Frist auf einen Sonntag, einen allgemeinen Feiertag oder Sonnabend, so endet die Frist mit Ablauf des nächsten Werktages.\nDer Widerspruch muss die Bezeichnung der angefochtenen Löschungsankündigung sowie die Erklärung enthalten, dass Widerspruch gegen diese Löschungsankündigung eingelegt wird. Er ist zu unterzeichnen und soll begründet werden."
    },
    {
      "date": "2025-05-27",
      "id": "110376",
      "original_text": "Löschungsankündigung\nNordrhein-Westfalen Amtsgericht Krefeld HRB 17681\nIT DoKK GmbH – Krefeld",
      "type": "Löschungsankündigung",
      "state": "Nordrhein-Westfalen",
      "amtsgericht": "Amtsgericht Krefeld",
      "registernummer": "HRB 17681",
      "registerart": "HRB",
      "company_name": "IT DoKK GmbH",
      "company_seat": "Krefeld",
      "details": "27.05.2025 (Bekanntmachungsdatum)\n\nNordrhein-Westfalen Amtsgericht Krefeld HRB 17681\nLöschungsankündigung\n\nIT DoKK GmbH\nGesellschaft mit beschränkter Haftung\nKrefeld\n\nDas Registergericht beabsichtigt die Gesellschaft von Amts wegen nach § 394 FamFG zu löschen. Die Frist zur Erhebung eines Widerspruchs ist auf einen Monat festgesetzt."
    },
    {
      "date": "2025-05-27",
      "id": "110377",
      "original_text": "Registerbekanntmachung nach dem Umwandlungsgesetz\nNordrhein-Westfalen Amtsgericht Düsseldorf HRB 30878\nGoldhand Lebensmittel- und Verbrauchsgüter-Vertriebsgesellschaft mit beschränkter Haftung – Düsseldorf",
      "type": "Registerbekanntmachung nach dem Umwandlungsgesetz",
      "state": "Nordrhein-Westfalen",
      "amtsgericht": "Amtsgericht Düsseldorf",
      "registernummer": "HRB 30878",
      "registerart": "HRB",
      "company_name": "Goldhand Lebensmittel- und Verbrauchsgüter-Vertriebsgesellschaft mit beschränkter Haftung",
      "company_seat": "Düsseldorf",
      "details": "27.05.2025 (Bekanntmachungsdatum)\n\nNordrhein-Westfalen Amtsgericht Düsseldorf HRB 30878\nRegisterbekanntmachung nach dem Umwandlungsgesetz 27.05.2025 (Eintragungsdatum)\n\nGoldhand Lebensmittel- und Verbrauchsgüter-Vertriebsgesellschaft mit beschränkter Haftung\nGesellschaft mit beschränkter Haftung\nDüsseldorf\n\nDen Gläubigern der an der Verschmelzung beteiligten Rechtsträger ist, wenn sie binnen sechs Monaten nach dem Tag, an dem die Eintragung der Verschmelzung in das Register des Sitzes desjenigen Rechtsträgers, dessen Gläubiger sie sind, nach § 19 Absatz 3 UmwG als bekanntgemacht gilt, ihren Anspruch nach Grund und Höhe schriftlich anmelden, Sicherheit zu leisten, soweit sie nicht Befriedigung verlangen können. Dieses Recht steht den Gläubigern jedoch nur zu, wenn sie glaubhaft machen, dass durch die Verschmelzung die Erfüllung ihrer Forderung gefährdet wird."
    },
    {
      "date": "2025-05-27",
      "id": "110378",
      "original_text": "Registerbekanntmachung nach dem Umwandlungsgesetz\nNordrhein-Westfalen Amtsgericht Steinfurt HRB 2851\nMichgehl & Partner Gesellschaft für Datenverarbeitung und Dienstleistungen mbH – Nordwalde",
      "type": "Registerbekanntmachung nach dem Umwandlungsgesetz",
      "state": "Nordrhein-Westfalen",
      "amtsgericht": "Amtsgericht Steinfurt",
      "registernummer": "HRB 2851",
      "registerart": "HRB",
      "company_name": "Michgehl & Partner Gesellschaft für Datenverarbeitung und Dienstleistungen mbH",
      "company_seat": "Nordwalde",
      "details": "27.05.2025 (Bekanntmachungsdatum)\n\nNordrhein-Westfalen Amtsgericht Steinfurt HRB 2851\nRegisterbekanntmachung nach dem Umwandlungsgesetz 27.05.2025 (Eintragungsdatum)\n\nMichgehl & Partner Gesellschaft für Datenverarbeitung und Dienstleistungen mbH\nGesellschaft mit beschränkter Haftung\nNordwalde\n\nDen Gläubigern der an der Verschmelzung beteiligten Rechtsträger ist, wenn sie binnen sechs Monaten nach dem Tag, an dem die Eintragung der Verschmelzung in das Register des Sitzes desjenigen Rechtsträgers, dessen Gläubiger sie sind, nach § 19 Absatz 3 UmwG als bekanntgemacht gilt, ihren Anspruch nach Grund und Höhe schriftlich anmelden, Sicherheit zu leisten, soweit sie nicht Befriedigung verlangen können. Dieses Recht steht den Gläubigern jedoch nur zu, wenn sie glaubhaft machen, dass durch die Verschmelzung die Erfüllung ihrer Forderung gefährdet wird."
    },
    {
      "date": "2025-05-27",
      "id": "110379",
      "original_text": "Registerbekanntmachung nach dem Umwandlungsgesetz\nNordrhein-Westfalen Amtsgericht Düsseldorf HRB 106664\nHRConnect GmbH – Monheim am Rhein",
      "type": "Registerbekanntmachung nach dem Umwandlungsgesetz",
      "state": "Nordrhein-Westfalen",
      "amtsgericht": "Amtsgericht Düsseldorf",
      "registernummer": "HRB 106664",
      "registerart": "HRB",
      "company_name": "HRConnect GmbH",
      "company_seat": "Monheim am Rhein",
      "details": "27.05.2025 (Bekanntmachungsdatum)\n\nNordrhein-Westfalen Amtsgericht Düsseldorf HRB 106664\nRegisterbekanntmachung nach dem Umwandlungsgesetz 27.05.2025 (Eintragungsdatum)\n\nHRConnect GmbH\nGesellschaft mit beschränkter Haftung\nMonheim am Rhein\n\nDen Gläubigern der an der Ausgliederung beteiligten Rechtsträger ist, wenn sie binnen sechs Monaten nach dem Tag, an dem die Eintragung der Ausgliederung in das Register des Sitzes desjenigen Rechtsträgers, dessen Gläubiger sie sind, nach § 19 Absatz 3 UmwG als bekanntgemacht gilt, ihren Anspruch nach Grund und Höhe schriftlich anmelden, Sicherheit zu leisten, soweit sie nicht Befriedigung verlangen können. Dieses Recht steht den Gläubigern jedoch nur zu, wenn sie glaubhaft machen, dass durch die Ausgliederung die Erfüllung ihrer Forderung gefährdet wird."
    },
    {
      "date": "2025-05-27",
      "id": "110380",
      "original_text": "Registerbekanntmachung nach dem Umwandlungsgesetz\nNordrhein-Westfalen Amtsgericht Neuss HRB 16637\nGFS Haus und Garten GmbH – Kaarst",
      "type": "Registerbekanntmachung nach dem Umwandlungsgesetz",
      "state": "Nordrhein-Westfalen",
      "amtsgericht": "Amtsgericht Neuss",
      "registernummer": "HRB 16637",
      "registerart": "HRB",
      "company_name": "GFS Haus und Garten GmbH",
      "company_seat": "Kaarst",
      "details": "27.05.2025 (Bekanntmachungsdatum)\n\nNordrhein-Westfalen Amtsgericht Neuss HRB 16637\nRegisterbekanntmachung nach dem Umwandlungsgesetz 27.05.2025 (Eintragungsdatum)\n\nGFS Haus und Garten GmbH\nGesellschaft mit beschränkter Haftung\nKaarst\n\nDen Gläubigern der an der Verschmelzung beteiligten Rechtsträger ist, wenn sie binnen sechs Monaten nach dem Tag, an dem die Eintragung der Verschmelzung in das Register des Sitzes desjenigen Rechtsträgers, dessen Gläubiger sie sind, nach § 19 Absatz 3 UmwG als bekanntgemacht gilt, ihren Anspruch nach Grund und Höhe schriftlich anmelden, Sicherheit zu leisten, soweit sie nicht Befriedigung verlangen können. Dieses Recht steht den Gläubigern jedoch nur zu, wenn sie glaubhaft machen, dass durch die Verschmelzung die Erfüllung ihrer Forderung gefährdet wird."
    },
    {
      "date": "2025-05-27",
      "id": "110381",
      "original_text": "Registerbekanntmachung nach dem Umwandlungsgesetz\nNordrhein-Westfalen Amtsgericht Düsseldorf HRB 87317\nALDI Langenfeld Verwaltungs-SE – Langenfeld",
      "type": "Registerbekanntmachung nach dem Umwandlungsgesetz",
      "state": "Nordrhein-Westfalen",
      "amtsgericht": "Amtsgericht Düsseldorf",
      "registernummer": "HRB 87317",
      "registerart": "HRB",
      "company_name": "ALDI Langenfeld Verwaltungs-SE",
      "company_seat": "Langenfeld",
      "details": "27.05.2025 (Bekanntmachungsdatum)\n\nNordrhein-Westfalen Amtsgericht Düsseldorf HRB 87317\nRegisterbekanntmachung nach dem Umwandlungsgesetz 27.05.2025 (Eintragungsdatum)\n\nALDI Langenfeld Verwaltungs-SE\nEuropäische Aktiengesellschaft (SE)\nLangenfeld\n\nDen Gläubigern der an der Verschmelzung beteiligten Rechtsträger ist, wenn sie binnen sechs Monaten nach dem Tag, an dem die Eintragung der Verschmelzung in das Register des Sitzes desjenigen Rechtsträgers, dessen Gläubiger sie sind, nach § 19 Absatz 3 UmwG als bekanntgemacht gilt, ihren Anspruch nach Grund und Höhe schriftlich anmelden, Sicherheit zu leisten, soweit sie nicht Befriedigung verlangen können. Dieses Recht steht den Gläubigern jedoch nur zu, wenn sie glaubhaft machen, dass durch die Verschmelzung die Erfüllung ihrer Forderung gefährdet wird."
    },
    {
      "date": "2025-05-27",
      "id": "110382",
      "original_text": "Registerbekanntmachung nach dem Umwandlungsgesetz\nNordrhein-Westfalen Amtsgericht Essen HRB 29676\nMindcurv GmbH – Essen",
      "type": "Registerbekanntmachung nach dem Umwandlungsgesetz",
      "state": "Nordrhein-Westfalen",
      "amtsgericht": "Amtsgericht Essen",
      "registernummer": "HRB 29676",
      "registerart": "HRB",
      "company_name": "Mindcurv GmbH",
      "company_seat": "Essen",
      "details": "27.05.2025 (Bekanntmachungsdatum)\n\nNordrhein-Westfalen Amtsgericht Essen HRB 29676\nRegisterbekanntmachung nach dem Umwandlungsgesetz 23.05.2025 (Eintragungsdatum)\n\nMindcurv GmbH\nGesellschaft mit beschränkter Haftung\nEssen\n\nDen Gläubigern der an der Verschmelzung beteiligten Rechtsträger ist, wenn sie binnen sechs Monaten nach dem Tag, an dem die Eintragung der Verschmelzung in das Register des Sitzes desjenigen Rechtsträgers, dessen Gläubiger sie sind, nach § 19 Absatz 3 UmwG als bekanntgemacht gilt, ihren Anspruch nach Grund und Höhe schriftlich anmelden, Sicherheit zu leisten, soweit sie nicht Befriedigung verlangen können. Dieses Recht steht den Gläubigern jedoch nur zu, wenn sie glaubhaft machen, dass durch die Verschmelzung die Erfüllung ihrer Forderung gefährdet wird."
    },
    {
      "date": "2025-05-27",
      "id": "110383",
      "original_text": "Löschungsankündigung\nNordrhein-Westfalen Amtsgericht Essen HRB 34580\nPLAN Construction GmbH – Essen",
      "type": "Löschungsankündigung",
      "state": "Nordrhein-Westfalen",
      "amtsgericht": "Amtsgericht Essen",
      "registernummer": "HRB 34580",
      "registerart": "HRB",
      "company_name": "PLAN Construction GmbH",
      "company_seat": "Essen",
      "details": "27.05.2025 (Bekanntmachungsdatum)\n\nNordrhein-Westfalen Amtsgericht Essen HRB 34580\nLöschungsankündigung\n\nPLAN Construction GmbH\nGesellschaft mit beschränkter Haftung\nEssen\n\nDas Registergericht beabsichtigt die Gesellschaft von Amts wegen nach § 394 FamFG zu löschen. Die Frist zur Erhebung eines Widerspruchs ist auf zwei Monate festgesetzt."
    },
    {
      "date": "2025-05-27",
      "id": "110384",
      "original_text": "Registerbekanntmachung nach dem Umwandlungsgesetz\nNordrhein-Westfalen Amtsgericht Düsseldorf HRB 13665\nMETRO Deutschland GmbH – Düsseldorf",
      "type": "Registerbekanntmachung nach dem Umwandlungsgesetz",
      "state": "Nordrhein-Westfalen",
      "amtsgericht": "Amtsgericht Düsseldorf",
      "registernummer": "HRB 13665",
      "registerart": "HRB",
      "company_name": "METRO Deutschland GmbH",
      "company_seat": "Düsseldorf",
      "details": "27.05.2025 (Bekanntmachungsdatum)\n\nNordrhein-Westfalen Amtsgericht Düsseldorf HRB 13665\nRegisterbekanntmachung nach dem Umwandlungsgesetz 27.05.2025 (Eintragungsdatum)\n\nMETRO Deutschland GmbH\nGesellschaft mit beschränkter Haftung\nDüsseldorf\n\nDen Gläubigern der an der Verschmelzung beteiligten Rechtsträger ist, wenn sie binnen sechs Monaten nach dem Tag, an dem die Eintragung der Verschmelzung in das Register des Sitzes desjenigen Rechtsträgers, dessen Gläubiger sie sind, nach § 19 Absatz 3 UmwG als bekanntgemacht gilt, ihren Anspruch nach Grund und Höhe schriftlich anmelden, Sicherheit zu leisten, soweit sie nicht Befriedigung verlangen können. Dieses Recht steht den Gläubigern jedoch nur zu, wenn sie glaubhaft machen, dass durch die Verschmelzung die Erfüllung ihrer Forderung gefährdet wird."
    },
    {
      "date": "2025-05-27",
      "id": "110385",
      "original_text": "Registerbekanntmachung nach dem Umwandlungsgesetz\nNordrhein-Westfalen Amtsgericht Bielefeld HRA 9539\nBoge & Co. Maschinenhandelsgesellschaft GmbH & Co. KG – Bielefeld",
      "type": "Registerbekanntmachung nach dem Umwandlungsgesetz",
      "state": "Nordrhein-Westfalen",
      "amtsgericht": "Amtsgericht Bielefeld",
      "registernummer": "HRA 9539",
      "registerart": "HRA",
      "company_name": "Boge & Co. Maschinenhandelsgesellschaft GmbH & Co. KG",
      "company_seat": "Bielefeld",
      "details": "27.05.2025 (Bekanntmachungsdatum)\n\nNordrhein-Westfalen Amtsgericht Bielefeld HRA 9539\nRegisterbekanntmachung nach dem Umwandlungsgesetz 27.05.2025 (Eintragungsdatum)\n\nBoge & Co. Maschinenhandelsgesellschaft GmbH & Co. KG\nKommanditgesellschaft\nBielefeld\n\nDen Gläubigern der an der Verschmelzung beteiligten Rechtsträger ist, wenn sie binnen sechs Monaten nach dem Tag, an dem die Eintragung der Verschmelzung in das Register des Sitzes derjenigen Rechtsträger deren Gläubiger sie sind, nach § 19 Absatz 3 UmwG als bekanntgemacht gilt, ihren Anspruch nach Grund und Höhe schriftlich anmelden, Sicherheit zu leisten, soweit sie nicht Befriedigung verlangen können. Dieses Recht steht den Gläubigern jedoch nur zu, wenn sie glaubhaft machen, dass durch die Verschmelzung die Erfüllung ihrer Forderung gefährdet wird."
    },
    {
      "date": "2025-05-27",
      "id": "110386",
      "original_text": "Registerbekanntmachung nach dem Umwandlungsgesetz\nNordrhein-Westfalen Amtsgericht Essen HRB 33179\nKI Invest GmbH – Essen",
      "type": "Registerbekanntmachung nach dem Umwandlungsgesetz",
      "state": "Nordrhein-Westfalen",
      "amtsgericht": "Amtsgericht Essen",
      "registernummer": "HRB 33179",
      "registerart": "HRB",
      "company_name": "KI Invest GmbH",
      "company_seat": "Essen",
      "details": "27.05.2025 (Bekanntmachungsdatum)\n\nNordrhein-Westfalen Amtsgericht Essen HRB 33179\nRegisterbekanntmachung nach dem Umwandlungsgesetz 27.05.2025 (Eintragungsdatum)\n\nKI Invest GmbH\nGesellschaft mit beschränkter Haftung\nEssen\n\nDen Gläubigern der an der Verschmelzung beteiligten Rechtsträger ist, wenn sie binnen sechs Monaten nach dem Tag, an dem die Eintragung der Verschmelzung in das Register des Sitzes desjenigen Rechtsträgers, dessen Gläubiger sie sind, nach § 19 Absatz 3 UmwG als bekanntgemacht gilt, ihren Anspruch nach Grund und Höhe schriftlich anmelden, Sicherheit zu leisten, soweit sie nicht Befriedigung verlangen können. Dieses Recht steht den Gläubigern jedoch nur zu, wenn sie glaubhaft machen, dass durch die Verschmelzung die Erfüllung ihrer Forderung gefährdet wird."
    },
    {
      "date": "2025-05-27",
      "id": "110387",
      "original_text": "Einreichung neuer Dokumente\nNordrhein-Westfalen Amtsgericht Neuss HRB 1878\n3M Deutschland GmbH – Neuss",
      "type": "Einreichung neuer Dokumente",
      "state": "Nordrhein-Westfalen",
      "amtsgericht": "Amtsgericht Neuss",
      "registernummer": "HRB 1878",
      "registerart": "HRB",
      "company_name": "3M Deutschland GmbH",
      "company_seat": "Neuss",
      "details": "27.05.2025 (Bekanntmachungsdatum)\n\nNordrhein-Westfalen Amtsgericht Neuss HRB 1878\nEinreichung neuer Dokumente 27.05.2025 (Eintragungsdatum)\n\n3M Deutschland GmbH\nGesellschaft mit beschränkter Haftung\nNeuss\n\nDem Registergericht ist eine Liste der Mitglieder des Aufsichtsrates eingereicht worden."
    },
    {
      "date": "2025-05-27",
      "id": "110388",
      "original_text": "Löschungsankündigung\nNordrhein-Westfalen Amtsgericht Köln HRB 61845\nHypermetrix GmbH – Köln",
      "type": "Löschungsankündigung",
      "state": "Nordrhein-Westfalen",
      "amtsgericht": "Amtsgericht Köln",
      "registernummer": "HRB 61845",
      "registerart": "HRB",
      "company_name": "Hypermetrix GmbH",
      "company_seat": "Köln",
      "details": "27.05.2025 (Bekanntmachungsdatum)\n\nNordrhein-Westfalen Amtsgericht Köln HRB 61845\nLöschungsankündigung\n\nHypermetrix GmbH\nGesellschaft mit beschränkter Haftung\nKöln\n\nDas Registergericht beabsichtigt die Gesellschaft von Amts wegen nach § 394 FamFG zu löschen. Die Frist zur Erhebung eines Widerspruchs ist auf einen Monat festgesetzt."
    },
    {
      "date": "2025-05-27",
      "id": "110389",
      "original_text": "Löschungsankündigung\nNordrhein-Westfalen Amtsgericht Krefeld HRB 16531\nIM Immobilien - Management UG (haftungsbeschränkt) – Krefeld",
      "type": "Löschungsankündigung",
      "state": "Nordrhein-Westfalen",
      "amtsgericht": "Amtsgericht Krefeld",
      "registernummer": "HRB 16531",
      "registerart": "HRB",
      "company_name": "IM Immobilien - Management UG (haftungsbeschränkt)",
      "company_seat": "Krefeld",
      "details": "27.05.2025 (Bekanntmachungsdatum)\n\nNordrhein-Westfalen Amtsgericht Krefeld HRB 16531\nLöschungsankündigung\n\nIM Immobilien - Management UG (haftungsbeschränkt)\nGesellschaft mit beschränkter Haftung\nKrefeld\n\nDas Registergericht beabsichtigt die Gesellschaft von Amts wegen nach § 394 FamFG zu löschen. Die Frist zur Erhebung eines Widerspruchs ist auf einen Monat festgesetzt."
    },
    {
      "date": "2025-05-27",
      "id": "110390",
      "original_text": "Registerbekanntmachung nach dem Umwandlungsgesetz\nNordrhein-Westfalen Amtsgericht Gelsenkirchen HRA 6297\nCarolin Drießen Immobilien e.Kfr. – Bottrop",
      "type": "Registerbekanntmachung nach dem Umwandlungsgesetz",
      "state": "Nordrhein-Westfalen",
      "amtsgericht": "Amtsgericht Gelsenkirchen",
      "registernummer": "HRA 6297",
      "registerart": "HRA",
      "company_name": "Carolin Drießen Immobilien e.Kfr.",
      "company_seat": "Bottrop",
      "details": "27.05.2025 (Bekanntmachungsdatum)\n\nNordrhein-Westfalen Amtsgericht Gelsenkirchen HRA 6297\nRegisterbekanntmachung nach dem Umwandlungsgesetz 27.05.2025 (Eintragungsdatum)\n\nCarolin Drießen Immobilien e.Kfr.\nEinzelkaufmann / Einzelkauffrau\nBottrop\n\nDen Gläubigern der an der Ausgliederung beteiligten Rechtsträger ist, wenn sie binnen sechs Monaten nach dem Tag, an dem die Eintragung der Ausgliederung in das Register des Sitzes desjenigen Rechtsträgers, dessen Gläubiger sie sind, nach § 19 Absatz 3 UmwG als bekanntgemacht gilt, ihren Anspruch nach Grund und Höhe schriftlich anmelden, Sicherheit zu leisten, soweit sie nicht Befriedigung verlangen können. Dieses Recht steht den Gläubigern jedoch nur zu, wenn sie glaubhaft machen, dass durch die Ausgliederung die Erfüllung ihrer Forderung gefährdet wird."
    },
    {
      "date": "2025-05-27",
      "id": "110391",
      "original_text": "Löschungsankündigung\nNordrhein-Westfalen Amtsgericht Münster HRB 19693\n3L Immobilien Management GmbH – Münster",
      "type": "Löschungsankündigung",
      "state": "Nordrhein-Westfalen",
      "amtsgericht": "Amtsgericht Münster",
      "registernummer": "HRB 19693",
      "registerart": "HRB",
      "company_name": "3L Immobilien Management GmbH",
      "company_seat": "Münster",
      "details": "27.05.2025 (Bekanntmachungsdatum)\n\nNordrhein-Westfalen Amtsgericht Münster HRB 19693\nLöschungsankündigung\n\n3L Immobilien Management GmbH\nGesellschaft mit beschränkter Haftung\nMünster\n\nDas Registergericht beabsichtigt die Gesellschaft von Amts wegen nach § 394 FamFG zu löschen. Die Frist zur Erhebung eines Widerspruchs ist auf einen Monat festgesetzt.\n\nRechtsbehelfsbelehrung:\n\nGegen diese Verfügung können Sie Widerspruch einlegen.\n\nDer Widerspruch ist bei dem Amtsgericht Münster, Gerichtsstraße 2 bis 6, 48149 Münster schriftlich in deutscher Sprache oder zur Niederschrift der Geschäftsstelle eines jeden Amtsgerichtes abgegeben werden.\nDie Einlegung ist auch durch Übertragung eine elektronischen Dokuments an die elektronische Poststelle des Gerichts möglich. Das elektronische Dokument muss für die Bearbeitung durch das Gericht geeignet und mit einer qualifizierten elektronischen Signatur der verantwortenden Person versehen sein oder von der verantwortenden Person signiert und auf einem sicheren Übermittlungsweg gem. §130a ZPO nach nähere Maßgabe der Verordnung über die technischen Rahmenbedingungen des elektronischen Rechtsverkehrs und über das besondere elektronische Behördenpostfach (BGBI. I. S.3808) eingereicht werden. Weitere Informationen erhalten Sie auf der Internetseite www.justiz.de\n\nDer Widerspruch muss spätestens innerhalb der gesetzten Frist nach der schriftlichen Bekanntgabe der Verfügung bei dem Amtsgericht Münster eingegangen sein. Dies gilt auch dann, wenn der Widerspruch zur Niederschrift der Geschäftsstelle eines anderen Amtsgerichtes abgegeben wurde. Die Frist beginnt mit der schriftlichen Bekanntgabe der Verfügung, spätestens mit Ablauf von fünf Monaten nach Erlass der Verfügung. Die Bekanntgabe ist entweder durch Zustellung oder am dritten Tage nach Aufgabe zur Post bewirkt. Fällt das Ende der First auf einen Sonntag, einen allgemeinen Feiertag oder Sonnabend, so endet die Frist mit Ablauf des nächsten Werktages.\n\nDer Widerspruch muss die Bezeichnung der angefochtenen Verfügung sowie die Erklärung enthalten, dass Widerspruch gegen diese Verfügung eingelegt wird. Er ist zu unterzeichnen und soll begründet werden."
    },
    {
      "date": "2025-05-27",
      "id": "110392",
      "original_text": "Registerbekanntmachung nach dem Umwandlungsgesetz\nNordrhein-Westfalen Amtsgericht Gelsenkirchen HRB 18362\nDrießen Immobilien GmbH – Bottrop",
      "type": "Registerbekanntmachung nach dem Umwandlungsgesetz",
      "state": "Nordrhein-Westfalen",
      "amtsgericht": "Amtsgericht Gelsenkirchen",
      "registernummer": "HRB 18362",
      "registerart": "HRB",
      "company_name": "Drießen Immobilien GmbH",
      "company_seat": "Bottrop",
      "details": "27.05.2025 (Bekanntmachungsdatum)\n\nNordrhein-Westfalen Amtsgericht Gelsenkirchen HRB 18362\nRegisterbekanntmachung nach dem Umwandlungsgesetz 27.05.2025 (Eintragungsdatum)\n\nDrießen Immobilien GmbH\nGesellschaft mit beschränkter Haftung\nBottrop\n\nDen Gläubigern der an der Ausgliederung beteiligten Rechtsträger ist, wenn sie binnen sechs Monaten nach dem Tag, an dem die Eintragung der Ausgliederung in das Register des Sitzes desjenigen Rechtsträgers, dessen Gläubiger sie sind, nach § 19 Absatz 3 UmwG als bekanntgemacht gilt, ihren Anspruch nach Grund und Höhe schriftlich anmelden, Sicherheit zu leisten, soweit sie nicht Befriedigung verlangen können. Dieses Recht steht den Gläubigern jedoch nur zu, wenn sie glaubhaft machen, dass durch die Ausgliederung die Erfüllung ihrer Forderung gefährdet wird."
    },
    {
      "date": "2025-05-27",
      "id": "110393",
      "original_text": "Einreichung neuer Dokumente\nNordrhein-Westfalen Amtsgericht Bonn HRB 18384\nDeutsche Gesellschaft für Internationale Zusammenarbeit (GIZ) GmbH – Bonn und Eschborn",
      "type": "Einreichung neuer Dokumente",
      "state": "Nordrhein-Westfalen",
      "amtsgericht": "Amtsgericht Bonn",
      "registernummer": "HRB 18384",
      "registerart": "HRB",
      "company_name": "Deutsche Gesellschaft für Internationale Zusammenarbeit (GIZ) GmbH",
      "company_seat": "Bonn und Eschborn",
      "details": "27.05.2025 (Bekanntmachungsdatum)\n\nNordrhein-Westfalen Amtsgericht Bonn HRB 18384\nEinreichung neuer Dokumente\n\nDeutsche Gesellschaft für Internationale Zusammenarbeit (GIZ) GmbH\nGesellschaft mit beschränkter Haftung\nBonn und Eschborn\n\nDem Registergericht ist eine neue Liste der Mitglieder des Aufsichtsrates eingereicht worden."
    },
    {
      "date": "2025-05-27",
      "id": "110394",
      "original_text": "Löschungsankündigung\nNordrhein-Westfalen Amtsgericht Siegen HRA 9294\nDeeJay's Handelsbistro GmbH & Co.KG – Olpe",
      "type": "Löschungsankündigung",
      "state": "Nordrhein-Westfalen",
      "amtsgericht": "Amtsgericht Siegen",
      "registernummer": "HRA 9294",
      "registerart": "HRA",
      "company_name": "DeeJay's Handelsbistro GmbH & Co.KG",
      "company_seat": "Olpe",
      "details": "27.05.2025 (Bekanntmachungsdatum)\n\nNordrhein-Westfalen Amtsgericht Siegen HRA 9294\nLöschungsankündigung\n\nDeeJay's Handelsbistro GmbH & Co.KG\nKommanditgesellschaft\nOlpe\n\nHRA 9294\nDeeJay's Handelsbistro GmbH & Co. KG - Olpe\n\nDas Registergericht beabsichtigt die Firma von Amts wegen nach § 394 FamFG zu löschen. Gegen diese Verfügung kann Widerspruch eingelegt werden. Die Frist zur Erhebung eines Widerspruchs ist auf einen Monat festgesetzt."
    },
    {
      "date": "2025-05-27",
      "id": "110395",
      "original_text": "Löschungsankündigung\nNordrhein-Westfalen Amtsgericht Köln HRB 106984\nW²K UG (haftungsbeschränkt) – Köln",
      "type": "Löschungsankündigung",
      "state": "Nordrhein-Westfalen",
      "amtsgericht": "Amtsgericht Köln",
      "registernummer": "HRB 106984",
      "registerart": "HRB",
      "company_name": "W²K UG (haftungsbeschränkt)",
      "company_seat": "Köln",
      "details": "27.05.2025 (Bekanntmachungsdatum)\n\nNordrhein-Westfalen Amtsgericht Köln HRB 106984\nLöschungsankündigung\n\nW²K UG (haftungsbeschränkt)\nGesellschaft mit beschränkter Haftung\nKöln\n\nDas Registergericht beabsichtigt die Gesellschaft von Amts wegen nach § 394 FamFG zu löschen. Die Frist zur Erhebung eines Widerspruchs ist auf einen Monat festgesetzt."
    },
    {
      "date": "2025-05-27",
      "id": "110396",
      "original_text": "Löschungsankündigung\nNordrhein-Westfalen Amtsgericht Mönchengladbach HRB 17515\nCanbolat UG (haftungsbeschränkt) – Mönchengladbach",
      "type": "Löschungsankündigung",
      "state": "Nordrhein-Westfalen",
      "amtsgericht": "Amtsgericht Mönchengladbach",
      "registernummer": "HRB 17515",
      "registerart": "HRB",
      "company_name": "Canbolat UG (haftungsbeschränkt)",
      "company_seat": "Mönchengladbach",
      "details": "27.05.2025 (Bekanntmachungsdatum)\n\nNordrhein-Westfalen Amtsgericht Mönchengladbach HRB 17515\nLöschungsankündigung\n\nCanbolat UG (haftungsbeschränkt)\nGesellschaft mit beschränkter Haftung\nMönchengladbach\n\nDas Registergericht beabsichtigt, die im Handelsregister eingetragene Gesellschaft gemäß § 394 Absatz 1 FamFG wegen Vermögenslosigkeit von Amts wegen zu löschen. Gegen diese Verfügung kann Widerspruch eingelegt werden. Die Frist zur Erhebung eines Widerspruchs gegen die beabsichtigte Löschung von Amts wegen ist auf drei Monate festgesetzt."
    },
    {
      "date": "2025-05-27",
      "id": "110397",
      "original_text": "Registerbekanntmachung nach dem Umwandlungsgesetz\nThüringen Amtsgericht Jena HRB 513877\nVBZ Verwaltungs- und Betreuungszentrum Suhl GmbH – Suhl",
      "type": "Registerbekanntmachung nach dem Umwandlungsgesetz",
      "state": "Thüringen",
      "amtsgericht": "Amtsgericht Jena",
      "registernummer": "HRB 513877",
      "registerart": "HRB",
      "company_name": "VBZ Verwaltungs- und Betreuungszentrum Suhl GmbH",
      "company_seat": "Suhl",
      "details": "27.05.2025 (Bekanntmachungsdatum)\n\nThüringen Amtsgericht Jena HRB 513877\nRegisterbekanntmachung nach dem Umwandlungsgesetz 27.05.2025 (Eintragungsdatum)\n\nVBZ Verwaltungs- und Betreuungszentrum Suhl GmbH\nGesellschaft mit beschränkter Haftung\nSuhl\n\nNicht eingetragen: Den Gläubigern der an der Verschmelzung beteiligten Rechtsträger, ist wenn sie binnen sechs Monaten nach dem Tag, an dem die Eintragung der Verschmelzung in das Register des Sitzes desjenigen Rechtsträgers, dessen Gläubiger sie sind,  nach § 19 Abs. 3 UmwG als bekanntgemacht gilt, ihren Anspruch nach Grund und Höhe schriftlich anmelden, Sicherheit zu leisten, soweit sie nicht Befriedigung verlangen können. Dieses Recht steht ihnen jedoch nur zu, wenn sie glaubhaft machen, daß durch die Verschmelzung die Erfüllung ihrer Forderung gefährdet wird."
    },
    {
      "date": "2025-05-27",
      "id": "110398",
      "original_text": "Registerbekanntmachung nach dem Umwandlungsgesetz\nThüringen Amtsgericht Jena HRB 521567\nCE Management-Holding GmbH – Altenburg",
      "type": "Registerbekanntmachung nach dem Umwandlungsgesetz",
      "state": "Thüringen",
      "amtsgericht": "Amtsgericht Jena",
      "registernummer": "HRB 521567",
      "registerart": "HRB",
      "company_name": "CE Management-Holding GmbH",
      "company_seat": "Altenburg",
      "details": "27.05.2025 (Bekanntmachungsdatum)\n\nThüringen Amtsgericht Jena HRB 521567\nRegisterbekanntmachung nach dem Umwandlungsgesetz 27.05.2025 (Eintragungsdatum)\n\nCE Management-Holding GmbH\nGesellschaft mit beschränkter Haftung\nAltenburg\n\nNicht eingetragen: Den Gläubigern der an der Verschmelzung beteiligten Rechtsträger, ist wenn sie binnen sechs Monaten nach dem Tag, an dem die Eintragung der Verschmelzung in das Register des Sitzes desjenigen Rechtsträgers, dessen Gläubiger sie sind,  nach § 19 Abs. 3 UmwG als bekanntgemacht gilt, ihren Anspruch nach Grund und Höhe schriftlich anmelden, Sicherheit zu leisten, soweit sie nicht Befriedigung verlangen können. Dieses Recht steht ihnen jedoch nur zu, wenn sie glaubhaft machen, daß durch die Verschmelzung die Erfüllung ihrer Forderung gefährdet wird."
    },
    {
      "date": "2025-05-27",
      "id": "110399",
      "original_text": "Löschungsankündigung\nThüringen Amtsgericht Jena HRB 508791\nEnergiekontor Stefan Raddatz UG (haftungsbeschränkt) – Weimar",
      "type": "Löschungsankündigung",
      "state": "Thüringen",
      "amtsgericht": "Amtsgericht Jena",
      "registernummer": "HRB 508791",
      "registerart": "HRB",
      "company_name": "Energiekontor Stefan Raddatz UG (haftungsbeschränkt)",
      "company_seat": "Weimar",
      "details": "27.05.2025 (Bekanntmachungsdatum)\n\nThüringen Amtsgericht Jena HRB 508791\nLöschungsankündigung\n\nEnergiekontor Stefan Raddatz UG (haftungsbeschränkt)\nGesellschaft mit beschränkter Haftung\nWeimar\n\nDas Registergericht beabsichtigt, die im Handelsregister eingetragene Gesellschaft wegen Vermögenslosigkeit nach § 394 FamFG von Amts wegen zu löschen. Die Frist zur Erhebung eines Widerspruchs gegen die beabsichtigte Löschung wird auf 6 Wochen festgesetzt."
    },
    {
      "date": "2025-05-27",
      "id": "110400",
      "original_text": "Registerbekanntmachung nach dem Umwandlungsgesetz\nThüringen Amtsgericht Jena HRA 200396\nMWS Mischwerk Saalfeld GmbH + Co. Kommanditgesellschaft – Saalfeld/Saale",
      "type": "Registerbekanntmachung nach dem Umwandlungsgesetz",
      "state": "Thüringen",
      "amtsgericht": "Amtsgericht Jena",
      "registernummer": "HRA 200396",
      "registerart": "HRA",
      "company_name": "MWS Mischwerk Saalfeld GmbH + Co. Kommanditgesellschaft",
      "company_seat": "Saalfeld/Saale",
      "details": "27.05.2025 (Bekanntmachungsdatum)\n\nThüringen Amtsgericht Jena HRA 200396\nRegisterbekanntmachung nach dem Umwandlungsgesetz 27.05.2025 (Eintragungsdatum)\n\nMWS Mischwerk Saalfeld GmbH + Co. Kommanditgesellschaft\nKommanditgesellschaft\nSaalfeld/Saale\n\nNicht eingetragen: Den Gläubigern der an der Verschmelzung beteiligten Rechtsträger, ist wenn sie binnen sechs Monaten nach dem Tag, an dem die Eintragung der Verschmelzung in das Register des Sitzes desjenigen Rechtsträgers, dessen Gläubiger sie sind,  nach § 19 Abs. 3 UmwG als bekanntgemacht gilt, ihren Anspruch nach Grund und Höhe schriftlich anmelden, Sicherheit zu leisten, soweit sie nicht Befriedigung verlangen können. Dieses Recht steht ihnen jedoch nur zu, wenn sie glaubhaft machen, daß durch die Verschmelzung die Erfüllung ihrer Forderung gefährdet wird."
    },
    {
      "date": "2025-05-27",
      "id": "110401",
      "original_text": "Einreichung neuer Dokumente\nThüringen Amtsgericht Jena HRB 403933\nBerghotel Burschenhaus GmbH – Eisenach",
      "type": "Einreichung neuer Dokumente",
      "state": "Thüringen",
      "amtsgericht": "Amtsgericht Jena",
      "registernummer": "HRB 403933",
      "registerart": "HRB",
      "company_name": "Berghotel Burschenhaus GmbH",
      "company_seat": "Eisenach",
      "details": "27.05.2025 (Bekanntmachungsdatum)\n\nThüringen Amtsgericht Jena HRB 403933\nEinreichung neuer Dokumente 27.05.2025 (Eintragungsdatum)\n\nBerghotel Burschenhaus GmbH\nGesellschaft mit beschränkter Haftung\nEisenach\n\nBekanntmachung gem. § 52 Abs. 3 Satz 2 GmbHG: Aufgrund einer Veränderung in den Personen der Aufsichtsratsmitglieder ist durch die Geschäftsführer eine neue Liste zum Handelsregister eingereicht worden."
    },
    {
      "date": "2025-05-27",
      "id": "110402",
      "original_text": "Löschungsankündigung\nHessen Amtsgericht Offenbach am Main HRB 50733\nMIDO Project Development UG (haftungsbeschränkt) – Offenbach am Main",
      "type": "Löschungsankündigung",
      "state": "Hessen",
      "amtsgericht": "Amtsgericht Offenbach am Main",
      "registernummer": "HRB 50733",
      "registerart": "HRB",
      "company_name": "MIDO Project Development UG (haftungsbeschränkt)",
      "company_seat": "Offenbach am Main",
      "details": "27.05.2025 (Bekanntmachungsdatum)\n\nHessen Amtsgericht Offenbach am Main HRB 50733\nLöschungsankündigung\n\nMIDO Project Development UG (haftungsbeschränkt)\nGesellschaft mit beschränkter Haftung\nOffenbach am Main\n\nDas Registergericht beabsichtigt die im Handelsregister eingetragene Gesellschaft von Amts wegen nach § 394 FamFG zu löschen. Die Frist zur Erhebung eines Widerspruchs gegen die beabsichtigte Löschung wird auf 3 Monate festgesetzt."
    },
    {
      "date": "2025-05-27",
      "id": "110403",
      "original_text": "Löschungsankündigung\nHessen Amtsgericht Offenbach am Main HRB 51537\nSabra Bau Projekt UG (haftungsbeschränkt) – Dreieich",
      "type": "Löschungsankündigung",
      "state": "Hessen",
      "amtsgericht": "Amtsgericht Offenbach am Main",
      "registernummer": "HRB 51537",
      "registerart": "HRB",
      "company_name": "Sabra Bau Projekt UG (haftungsbeschränkt)",
      "company_seat": "Dreieich",
      "details": "27.05.2025 (Bekanntmachungsdatum)\n\nHessen Amtsgericht Offenbach am Main HRB 51537\nLöschungsankündigung\n\nSabra Bau Projekt UG (haftungsbeschränkt)\nGesellschaft mit beschränkter Haftung\nDreieich\n\nDas Registergericht beabsichtigt die im Handelsregister eingetragene Gesellschaft von Amts wegen nach § 394 FamFG zu löschen. Die Frist zur Erhebung eines Widerspruchs gegen die beabsichtigte Löschung wird auf 3 Monate festgesetzt."
    },
    {
      "date": "2025-05-27",
      "id": "110404",
      "original_text": "Löschungsankündigung\nHessen Amtsgericht Darmstadt HRB 106364\nDEHA Dienstleistungen GmbH – Mossautal",
      "type": "Löschungsankündigung",
      "state": "Hessen",
      "amtsgericht": "Amtsgericht Darmstadt",
      "registernummer": "HRB 106364",
      "registerart": "HRB",
      "company_name": "DEHA Dienstleistungen GmbH",
      "company_seat": "Mossautal",
      "details": "27.05.2025 (Bekanntmachungsdatum)\n\nHessen Amtsgericht Darmstadt HRB 106364\nLöschungsankündigung 27.05.2025 (Eintragungsdatum)\n\nDEHA Dienstleistungen GmbH\nGesellschaft mit beschränkter Haftung\nMossautal\n\ndas Registergericht beabsichtigt den im Handelsregister eingetragenen Geschäftsführer von Amts wegen als unzulässig nach § 395 FamFG zu löschen. Die Frist zur Erhebung eines Widerspruchs gegen die beabsichtigte Löschung wird auf 3 Wochen festgesetzt."
    },
    {
      "date": "2025-05-27",
      "id": "110405",
      "original_text": "Registerbekanntmachung nach dem Umwandlungsgesetz\nHessen Amtsgericht Kassel HRB 7087\nJO.TR.+A. Jochums, Transporte und Altpapierhandel GmbH – Ahnatal",
      "type": "Registerbekanntmachung nach dem Umwandlungsgesetz",
      "state": "Hessen",
      "amtsgericht": "Amtsgericht Kassel",
      "registernummer": "HRB 7087",
      "registerart": "HRB",
      "company_name": "JO.TR.+A. Jochums, Transporte und Altpapierhandel GmbH",
      "company_seat": "Ahnatal",
      "details": "27.05.2025 (Bekanntmachungsdatum)\n\nHessen Amtsgericht Kassel HRB 7087\nRegisterbekanntmachung nach dem Umwandlungsgesetz 27.05.2025 (Eintragungsdatum)\n\nJO.TR.+A. Jochums, Transporte und Altpapierhandel GmbH\nGesellschaft mit beschränkter Haftung\nAhnatal\n\nDen Gläubigern der an der Verschmelzung beteiligten Rechtsträger ist, wenn sie binnen sechs Monaten nach dem Tag, an dem die Eintragung der Vermögensübertragung in das Register des Sitzes desjenigen Rechtsträgers, dessen Gläubiger sie sind, nach § 19 Absatz 3 UmwG bekannt gemacht worden ist, ihren Anspruch nach Grund und Höhe schriftlich anmelden, Sicherheit zu leisten, soweit sie nicht Befriedigung verlangen können. Dieses Recht steht den Gläubigern jedoch nur zu, wenn sie glaubhaft machen, dass durch die Vermögensübertragung die Erfüllung ihrer Forderung gefährdet wird."
    },
    {
      "date": "2025-05-27",
      "id": "110406",
      "original_text": "Löschungsankündigung\nHessen Amtsgericht Offenbach am Main HRB 6552\nTischer GmbH – Neu-Isenburg",
      "type": "Löschungsankündigung",
      "state": "Hessen",
      "amtsgericht": "Amtsgericht Offenbach am Main",
      "registernummer": "HRB 6552",
      "registerart": "HRB",
      "company_name": "Tischer GmbH",
      "company_seat": "Neu-Isenburg",
      "details": "27.05.2025 (Bekanntmachungsdatum)\n\nHessen Amtsgericht Offenbach am Main HRB 6552\nLöschungsankündigung 27.05.2025 (Eintragungsdatum)\n\nTischer GmbH\nGesellschaft mit beschränkter Haftung\nNeu-Isenburg\n\nDas Registergericht beabsichtigt die im Handelsregister eingetragene Gesellschaft von Amts wegen nach § 394 FamFG zu löschen. Die Frist zur Erhebung eines Widerspruchs gegen die beabsichtigte Löschung wird auf 3 Monate festgesetzt."
    },
    {
      "date": "2025-05-27",
      "id": "110407",
      "original_text": "Löschungsankündigung\nHessen Amtsgericht Bad Homburg v.d.H. HRB 15341\nMax Industrieservice GmbH – Steinbach (Taunus)",
      "type": "Löschungsankündigung",
      "state": "Hessen",
      "amtsgericht": "Amtsgericht Bad Homburg v.d.H.",
      "registernummer": "HRB 15341",
      "registerart": "HRB",
      "company_name": "Max Industrieservice GmbH",
      "company_seat": "Steinbach (Taunus)",
      "details": "27.05.2025 (Bekanntmachungsdatum)\n\nHessen Amtsgericht Bad Homburg v.d.H. HRB 15341\nLöschungsankündigung 27.05.2025 (Eintragungsdatum)\n\nMax Industrieservice GmbH\nGesellschaft mit beschränkter Haftung\nSteinbach (Taunus)\n\nDas Registergericht beabsichtigt die im Handelsregister eingetragene Gesellschaft von Amts wegen nach § 394 FamFG zu löschen. Die Frist zur Erhebung eines Widerspruchs gegen die beabsichtigte Löschung wird auf 3 Monate festgesetzt."
    },
    {
      "date": "2025-05-27",
      "id": "110408",
      "original_text": "Sonstige Registerbekanntmachung\nHessen Amtsgericht Bad Hersfeld VR 1699\nVerein für Rehasport und Funktionstraining Bad Hersfeld e.V. – Bad Hersfeld",
      "type": "Sonstige Registerbekanntmachung",
      "state": "Hessen",
      "amtsgericht": "Amtsgericht Bad Hersfeld",
      "registernummer": "VR 1699",
      "registerart": "VR",
      "company_name": "Verein für Rehasport und Funktionstraining Bad Hersfeld e.V.",
      "company_seat": "Bad Hersfeld",
      "details": "27.05.2025 (Bekanntmachungsdatum)\n\nHessen Amtsgericht Bad Hersfeld VR 1699\nSonstige Registerbekanntmachung 27.05.2025 (Eintragungsdatum)\n\nVerein für Rehasport und Funktionstraining Bad Hersfeld e.V.\neingetragener Verein\nBad Hersfeld\n\nDer Verein ist aufgelöst."
    },
    {
      "date": "2025-05-27",
      "id": "110409",
      "original_text": "Löschungsankündigung\nHessen Amtsgericht Darmstadt HRB 93429\nplusRaumdesign GmbH – Bensheim",
      "type": "Löschungsankündigung",
      "state": "Hessen",
      "amtsgericht": "Amtsgericht Darmstadt",
      "registernummer": "HRB 93429",
      "registerart": "HRB",
      "company_name": "plusRaumdesign GmbH",
      "company_seat": "Bensheim",
      "details": "27.05.2025 (Bekanntmachungsdatum)\n\nHessen Amtsgericht Darmstadt HRB 93429\nLöschungsankündigung\n\nplusRaumdesign GmbH\nGesellschaft mit beschränkter Haftung\nBensheim\n\nDas Registergericht beabsichtigt die im Handelsregister eingetragene Gesellschaft von Amts wegen nach § 394 FamFG zu löschen. Die Frist zur Erhebung eines Widerspruchs gegen die beabsichtigte Löschung wird auf 3 Monate festgesetzt."
    },
    {
      "date": "2025-05-27",
      "id": "110410",
      "original_text": "Sonstige Registerbekanntmachung\nHessen Amtsgericht Darmstadt HRB 86706\ne-netz Südhessen AG – Darmstadt",
      "type": "Sonstige Registerbekanntmachung",
      "state": "Hessen",
      "amtsgericht": "Amtsgericht Darmstadt",
      "registernummer": "HRB 86706",
      "registerart": "HRB",
      "company_name": "e-netz Südhessen AG",
      "company_seat": "Darmstadt",
      "details": "27.05.2025 (Bekanntmachungsdatum)\n\nHessen Amtsgericht Darmstadt HRB 86706\nSonstige Registerbekanntmachung 27.05.2025 (Eintragungsdatum)\n\ne-netz Südhessen AG\nAktiengesellschaft\nDarmstadt\n\nWegen Änderungen in den Personen der Aufsichtsratsmitglieder ist eine Liste der Mitglieder des Aufsichtsrates zum Handelsregister eingereicht worden."
    }
  ]
}