{
  "date": "2025-05-09",
  "date_of_scrape": "2025-05-31T08:42:27.673Z",
  "tool_version": "0.2.0",
  "number_of_announcements": 152,
  "announcements": [
    {
      "date": "2025-05-09",
      "id": "108503",
      "original_text": "Registerbekanntmachung nach dem Umwandlungsgesetz\nBayern Amtsgericht München HRB 187326\nSiemens Treasury GmbH – München",
      "type": "Registerbekanntmachung nach dem Umwandlungsgesetz",
      "state": "Bayern",
      "amtsgericht": "Amtsgericht München",
      "registernummer": "HRB 187326",
      "registerart": "HRB",
      "company_name": "Siemens Treasury GmbH",
      "company_seat": "München",
      "details": "09.05.2025 (Bekanntmachungsdatum)\n\nBayern Amtsgericht München HRB 187326\nRegisterbekanntmachung nach dem Umwandlungsgesetz 08.05.2025 (Eintragungsdatum)\n\nSiemens Treasury GmbH\nGesellschaft mit beschränkter Haftung\nMünchen\n\nDen Gläubigern der an der Verschmelzung beteiligten Rechtsträger ist, wenn sie binnen sechs Monaten nach dem Tag, an dem die Eintragung der Verschmelzung in das Register des Sitzes desjenigen Rechtsträgers, dessen Gläubiger sie sind, nach § 19 Abs. 3 UmwG als bekannt gemacht gilt, ihren Anspruch nach Grund und Höhe in Textform anmelden, Sicherheit zu leisten, soweit sie nicht Befriedigung verlangen können. Dieses Recht steht den Gläubigern jedoch nur zu, wenn sie glaubhaft machen, dass durch die Verschmelzung die Erfüllung ihrer Forderung gefährdet wird."
    },
    {
      "date": "2025-05-09",
      "id": "108504",
      "original_text": "Registerbekanntmachung nach dem Umwandlungsgesetz\nBayern Amtsgericht München HRB 274427\nAmazon Deutschland W41 Transport GmbH – München",
      "type": "Registerbekanntmachung nach dem Umwandlungsgesetz",
      "state": "Bayern",
      "amtsgericht": "Amtsgericht München",
      "registernummer": "HRB 274427",
      "registerart": "HRB",
      "company_name": "Amazon Deutschland W41 Transport GmbH",
      "company_seat": "München",
      "details": "09.05.2025 (Bekanntmachungsdatum)\n\nBayern Amtsgericht München HRB 274427\nRegisterbekanntmachung nach dem Umwandlungsgesetz 08.05.2025 (Eintragungsdatum)\n\nAmazon Deutschland W41 Transport GmbH\nGesellschaft mit beschränkter Haftung\nMünchen\n\nDen Gläubigern der an der Verschmelzung beteiligten Rechtsträger ist, wenn sie binnen sechs Monaten nach dem Tag, an dem die Eintragung der Verschmelzung in das Register des Sitzes desjenigen Rechtsträgers, dessen Gläubiger sie sind, nach § 19 Abs. 3 UmwG als bekannt gemacht gilt, ihren Anspruch nach Grund und Höhe in Textform anmelden, Sicherheit zu leisten, soweit sie nicht Befriedigung verlangen können. Dieses Recht steht den Gläubigern jedoch nur zu, wenn sie glaubhaft machen, dass durch die Verschmelzung die Erfüllung ihrer Forderung gefährdet wird."
    },
    {
      "date": "2025-05-09",
      "id": "108505",
      "original_text": "Registerbekanntmachung nach dem Umwandlungsgesetz\nBayern Amtsgericht München HRB 131127\nThe Walt Disney Company (Germany) GmbH – München",
      "type": "Registerbekanntmachung nach dem Umwandlungsgesetz",
      "state": "Bayern",
      "amtsgericht": "Amtsgericht München",
      "registernummer": "HRB 131127",
      "registerart": "HRB",
      "company_name": "The Walt Disney Company (Germany) GmbH",
      "company_seat": "München",
      "details": "09.05.2025 (Bekanntmachungsdatum)\n\nBayern Amtsgericht München HRB 131127\nRegisterbekanntmachung nach dem Umwandlungsgesetz 08.05.2025 (Eintragungsdatum)\n\nThe Walt Disney Company (Germany) GmbH\nGesellschaft mit beschränkter Haftung\nMünchen\n\nDen Gläubigern der an der Verschmelzung beteiligten Rechtsträger ist, wenn sie binnen sechs Monaten nach dem Tag, an dem die Eintragung der Verschmelzung in das Register des Sitzes desjenigen Rechtsträgers, dessen Gläubiger sie sind, nach § 19 Abs. 3 UmwG als bekannt gemacht gilt, ihren Anspruch nach Grund und Höhe in Textform anmelden, Sicherheit zu leisten, soweit sie nicht Befriedigung verlangen können. Dieses Recht steht den Gläubigern jedoch nur zu, wenn sie glaubhaft machen, dass durch die Verschmelzung die Erfüllung ihrer Forderung gefährdet wird."
    },
    {
      "date": "2025-05-09",
      "id": "108506",
      "original_text": "Löschungsankündigung\nBayern Amtsgericht München HRB 119360\nOFT Options & Futures Trading GmbH – München",
      "type": "Löschungsankündigung",
      "state": "Bayern",
      "amtsgericht": "Amtsgericht München",
      "registernummer": "HRB 119360",
      "registerart": "HRB",
      "company_name": "OFT Options & Futures Trading GmbH",
      "company_seat": "München",
      "details": "09.05.2025 (Bekanntmachungsdatum)\n\nBayern Amtsgericht München HRB 119360\nLöschungsankündigung 08.05.2025 (Eintragungsdatum)\n\nOFT Options & Futures Trading GmbH\nGesellschaft mit beschränkter Haftung\nMünchen\n\nDas Registergericht beabsichtigt, die im Handelsregister eingetragene Gesellschaft wegen Vermögenslosigkeit von Amts wegen nach § 394 FamFG zu löschen. Die Frist zur Erhebung eines Widerspruchs ist auf drei Monate festgesetzt."
    },
    {
      "date": "2025-05-09",
      "id": "108507",
      "original_text": "Registerbekanntmachung nach dem Umwandlungsgesetz\nBayern Amtsgericht Passau HRA 13954\nAMI Bau GmbH & Co. KG – Neuburg am Inn",
      "type": "Registerbekanntmachung nach dem Umwandlungsgesetz",
      "state": "Bayern",
      "amtsgericht": "Amtsgericht Passau",
      "registernummer": "HRA 13954",
      "registerart": "HRA",
      "company_name": "AMI Bau GmbH & Co. KG",
      "company_seat": "Neuburg am Inn",
      "details": "09.05.2025 (Bekanntmachungsdatum)\n\nBayern Amtsgericht Passau HRA 13954\nRegisterbekanntmachung nach dem Umwandlungsgesetz 08.05.2025 (Eintragungsdatum)\n\nAMI Bau GmbH & Co. KG\nKommanditgesellschaft\nNeuburg am Inn\n\nDen Gläubigern der an der Ausgliederung beteiligten Rechtsträger ist, wenn sie binnen sechs Monaten nach dem Tag, an dem die Eintragung der Ausgliederung in das Register des Sitzes desjenigen Rechtsträgers, dessen Gläubiger sie sind, nach §§ 125, 19 Abs. 3 UmwG als bekannt gemacht gilt, ihren Anspruch nach Grund und Höhe in Textform anmelden, Sicherheit zu leisten, soweit sie nicht Befriedigung verlangen können. Dieses Recht steht den Gläubigern jedoch nur zu, wenn sie glaubhaft machen, dass durch die Ausgliederung die Erfüllung ihrer Forderung gefährdet wird."
    },
    {
      "date": "2025-05-09",
      "id": "108508",
      "original_text": "Registerbekanntmachung nach dem Umwandlungsgesetz\nBayern Amtsgericht München HRB 274350\nAmazon Deutschland N19 Transport GmbH – München",
      "type": "Registerbekanntmachung nach dem Umwandlungsgesetz",
      "state": "Bayern",
      "amtsgericht": "Amtsgericht München",
      "registernummer": "HRB 274350",
      "registerart": "HRB",
      "company_name": "Amazon Deutschland N19 Transport GmbH",
      "company_seat": "München",
      "details": "09.05.2025 (Bekanntmachungsdatum)\n\nBayern Amtsgericht München HRB 274350\nRegisterbekanntmachung nach dem Umwandlungsgesetz 08.05.2025 (Eintragungsdatum)\n\nAmazon Deutschland N19 Transport GmbH\nGesellschaft mit beschränkter Haftung\nMünchen\n\nDen Gläubigern der an der Verschmelzung beteiligten Rechtsträger ist, wenn sie binnen sechs Monaten nach dem Tag, an dem die Eintragung der Verschmelzung in das Register des Sitzes desjenigen Rechtsträgers, dessen Gläubiger sie sind, nach § 19 Abs. 3 UmwG als bekannt gemacht gilt, ihren Anspruch nach Grund und Höhe in Textform anmelden, Sicherheit zu leisten, soweit sie nicht Befriedigung verlangen können. Dieses Recht steht den Gläubigern jedoch nur zu, wenn sie glaubhaft machen, dass durch die Verschmelzung die Erfüllung ihrer Forderung gefährdet wird."
    },
    {
      "date": "2025-05-09",
      "id": "108509",
      "original_text": "Löschungsankündigung\nBayern Amtsgericht Hof HRB 5589\nBusiness for Textil GmbH – Selb",
      "type": "Löschungsankündigung",
      "state": "Bayern",
      "amtsgericht": "Amtsgericht Hof",
      "registernummer": "HRB 5589",
      "registerart": "HRB",
      "company_name": "Business for Textil GmbH",
      "company_seat": "Selb",
      "details": "09.05.2025 (Bekanntmachungsdatum)\n\nBayern Amtsgericht Hof HRB 5589\nLöschungsankündigung\n\nBusiness for Textil GmbH\nGesellschaft mit beschränkter Haftung\nSelb\n\nDas Registergericht beabsichtigt, die im Handelsregister eingetragene Gesellschaft wegen Vermögenslosigkeit von Amts wegen nach § 394 FamFG zu löschen. Die Frist zur Erhebung eines Widerspruchs ist auf sechs Wochen festgesetzt."
    },
    {
      "date": "2025-05-09",
      "id": "108510",
      "original_text": "Registerbekanntmachung nach dem Umwandlungsgesetz\nBayern Amtsgericht Würzburg VR 201558\nVerband für landwirtschaftliche Fachbildung Kitzingen-Würzburg e.V. – Kitzingen",
      "type": "Registerbekanntmachung nach dem Umwandlungsgesetz",
      "state": "Bayern",
      "amtsgericht": "Amtsgericht Würzburg",
      "registernummer": "VR 201558",
      "registerart": "VR",
      "company_name": "Verband für landwirtschaftliche Fachbildung Kitzingen-Würzburg e.V.",
      "company_seat": "Kitzingen",
      "details": "09.05.2025 (Bekanntmachungsdatum)\n\nBayern Amtsgericht Würzburg VR 201558\nRegisterbekanntmachung nach dem Umwandlungsgesetz 08.05.2025 (Eintragungsdatum)\n\nVerband für landwirtschaftliche Fachbildung Kitzingen-Würzburg e.V.\neingetragener Verein\nKitzingen\n\nDen Gläubigern der an der Verschmelzung beteiligten Rechtsträger ist, wenn sie binnen sechs Monaten nach dem Tag, an dem die Eintragung der Verschmelzung in das Register des Sitzes desjenigen Rechtsträgers, dessen Gläubiger sie sind, nach § 19 Abs. 3 UmwG als bekannt gemacht gilt, ihren Anspruch nach Grund und Höhe in Textform anmelden, Sicherheit zu leisten, soweit sie nicht Befriedigung verlangen können. Dieses Recht steht den Gläubigern jedoch nur zu, wenn sie glaubhaft machen, dass durch die Verschmelzung die Erfüllung ihrer Forderung gefährdet wird."
    },
    {
      "date": "2025-05-09",
      "id": "108511",
      "original_text": "Sonstige Registerbekanntmachung\nBayern Amtsgericht München HRB 182906\nMünchner Wohnen GmbH – München",
      "type": "Sonstige Registerbekanntmachung",
      "state": "Bayern",
      "amtsgericht": "Amtsgericht München",
      "registernummer": "HRB 182906",
      "registerart": "HRB",
      "company_name": "Münchner Wohnen GmbH",
      "company_seat": "München",
      "details": "09.05.2025 (Bekanntmachungsdatum)\n\nBayern Amtsgericht München HRB 182906\nSonstige Registerbekanntmachung 08.05.2025 (Eintragungsdatum)\n\nMünchner Wohnen GmbH\nGesellschaft mit beschränkter Haftung\nMünchen\n\nDem Amtsgericht München -Registergericht- ist eine Liste der Mitglieder des Aufsichtsrats eingereicht worden, § 52 Abs. 3 S. 2 GmbHG."
    },
    {
      "date": "2025-05-09",
      "id": "108512",
      "original_text": "Registerbekanntmachung nach dem Umwandlungsgesetz\nBayern Amtsgericht München HRB 219073\nVeritas (Deutschland) GmbH – München",
      "type": "Registerbekanntmachung nach dem Umwandlungsgesetz",
      "state": "Bayern",
      "amtsgericht": "Amtsgericht München",
      "registernummer": "HRB 219073",
      "registerart": "HRB",
      "company_name": "Veritas (Deutschland) GmbH",
      "company_seat": "München",
      "details": "09.05.2025 (Bekanntmachungsdatum)\n\nBayern Amtsgericht München HRB 219073\nRegisterbekanntmachung nach dem Umwandlungsgesetz 08.05.2025 (Eintragungsdatum)\n\nVeritas (Deutschland) GmbH\nGesellschaft mit beschränkter Haftung\nMünchen\n\nDen Gläubigern der an der Verschmelzung beteiligten Rechtsträger ist, wenn sie binnen sechs Monaten nach dem Tag, an dem die Eintragung der Verschmelzung in das Register des Sitzes desjenigen Rechtsträgers, dessen Gläubiger sie sind, nach § 19 Abs. 3 UmwG als bekannt gemacht gilt, ihren Anspruch nach Grund und Höhe in Textform anmelden, Sicherheit zu leisten, soweit sie nicht Befriedigung verlangen können. Dieses Recht steht den Gläubigern jedoch nur zu, wenn sie glaubhaft machen, dass durch die Verschmelzung die Erfüllung ihrer Forderung gefährdet wird."
    },
    {
      "date": "2025-05-09",
      "id": "108513",
      "original_text": "Löschungsankündigung\nBayern Amtsgericht München HRB 219891\nMaxum Management UG (haftungsbeschränkt) – München",
      "type": "Löschungsankündigung",
      "state": "Bayern",
      "amtsgericht": "Amtsgericht München",
      "registernummer": "HRB 219891",
      "registerart": "HRB",
      "company_name": "Maxum Management UG (haftungsbeschränkt)",
      "company_seat": "München",
      "details": "09.05.2025 (Bekanntmachungsdatum)\n\nBayern Amtsgericht München HRB 219891\nLöschungsankündigung\n\nMaxum Management UG (haftungsbeschränkt)\nGesellschaft mit beschränkter Haftung\nMünchen\n\nDas Registergericht beabsichtigt, die im Handelsregister eingetragene Gesellschaft wegen Vermögenslosigkeit von Amts wegen nach § 394 FamFG zu löschen. Die Frist zur Erhebung eines Widerspruchs ist auf drei Monate festgesetzt."
    },
    {
      "date": "2025-05-09",
      "id": "108514",
      "original_text": "Sonstige Registerbekanntmachung\nBayern Amtsgericht Bayreuth HRB 5624\nHauck Bauprojekte GmbH – Bayreuth",
      "type": "Sonstige Registerbekanntmachung",
      "state": "Bayern",
      "amtsgericht": "Amtsgericht Bayreuth",
      "registernummer": "HRB 5624",
      "registerart": "HRB",
      "company_name": "Hauck Bauprojekte GmbH",
      "company_seat": "Bayreuth",
      "details": "09.05.2025 (Bekanntmachungsdatum)\n\nBayern Amtsgericht Bayreuth HRB 5624\nSonstige Registerbekanntmachung 08.05.2025 (Eintragungsdatum)\n\nHauck Bauprojekte GmbH\nGesellschaft mit beschränkter Haftung\nBayreuth\n\nDen Gläubigern der an der Verschmelzung beteiligten Rechtsträger ist, wenn sie binnen sechs Monaten nach dem Tag, an dem die Eintragung der Verschmelzung in das Register des Sitzes desjenigen Rechtsträgers, dessen Gläubiger sie sind, nach § 19 Abs. 3 UmwG als bekannt gemacht gilt, ihren Anspruch nach Grund und Höhe in Textform anmelden, Sicherheit zu leisten, soweit sie nicht Befriedigung verlangen können. Dieses Recht steht den Gläubigern jedoch nur zu, wenn sie glaubhaft machen, dass durch die Verschmelzung die Erfüllung ihrer Forderung gefährdet wird."
    },
    {
      "date": "2025-05-09",
      "id": "108515",
      "original_text": "Sonstige Registerbekanntmachung\nBayern Amtsgericht Bayreuth HRB 4528\nHauck + Steger Projekte GmbH – Bayreuth",
      "type": "Sonstige Registerbekanntmachung",
      "state": "Bayern",
      "amtsgericht": "Amtsgericht Bayreuth",
      "registernummer": "HRB 4528",
      "registerart": "HRB",
      "company_name": "Hauck + Steger Projekte GmbH",
      "company_seat": "Bayreuth",
      "details": "09.05.2025 (Bekanntmachungsdatum)\n\nBayern Amtsgericht Bayreuth HRB 4528\nSonstige Registerbekanntmachung 08.05.2025 (Eintragungsdatum)\n\nHauck + Steger Projekte GmbH\nGesellschaft mit beschränkter Haftung\nBayreuth\n\nDen Gläubigern der an der Verschmelzung beteiligten Rechtsträger ist, wenn sie binnen sechs Monaten nach dem Tag, an dem die Eintragung der Verschmelzung in das Register des Sitzes desjenigen Rechtsträgers, dessen Gläubiger sie sind, nach § 19 Abs. 3 UmwG als bekannt gemacht gilt, ihren Anspruch nach Grund und Höhe in Textform anmelden, Sicherheit zu leisten, soweit sie nicht Befriedigung verlangen können. Dieses Recht steht den Gläubigern jedoch nur zu, wenn sie glaubhaft machen, dass durch die Verschmelzung die Erfüllung ihrer Forderung gefährdet wird."
    },
    {
      "date": "2025-05-09",
      "id": "108516",
      "original_text": "Registerbekanntmachung nach dem Umwandlungsgesetz\nBayern Amtsgericht München HRB 274428\nAmazon Deutschland W36 Transport GmbH – München",
      "type": "Registerbekanntmachung nach dem Umwandlungsgesetz",
      "state": "Bayern",
      "amtsgericht": "Amtsgericht München",
      "registernummer": "HRB 274428",
      "registerart": "HRB",
      "company_name": "Amazon Deutschland W36 Transport GmbH",
      "company_seat": "München",
      "details": "09.05.2025 (Bekanntmachungsdatum)\n\nBayern Amtsgericht München HRB 274428\nRegisterbekanntmachung nach dem Umwandlungsgesetz 08.05.2025 (Eintragungsdatum)\n\nAmazon Deutschland W36 Transport GmbH\nGesellschaft mit beschränkter Haftung\nMünchen\n\nDen Gläubigern der an der Verschmelzung beteiligten Rechtsträger ist, wenn sie binnen sechs Monaten nach dem Tag, an dem die Eintragung der Verschmelzung in das Register des Sitzes desjenigen Rechtsträgers, dessen Gläubiger sie sind, nach § 19 Abs. 3 UmwG als bekannt gemacht gilt, ihren Anspruch nach Grund und Höhe in Textform anmelden, Sicherheit zu leisten, soweit sie nicht Befriedigung verlangen können. Dieses Recht steht den Gläubigern jedoch nur zu, wenn sie glaubhaft machen, dass durch die Verschmelzung die Erfüllung ihrer Forderung gefährdet wird."
    },
    {
      "date": "2025-05-09",
      "id": "108517",
      "original_text": "Registerbekanntmachung nach dem Umwandlungsgesetz\nBayern Amtsgericht München HRB 274355\nAmazon Deutschland N20 Transport GmbH – München",
      "type": "Registerbekanntmachung nach dem Umwandlungsgesetz",
      "state": "Bayern",
      "amtsgericht": "Amtsgericht München",
      "registernummer": "HRB 274355",
      "registerart": "HRB",
      "company_name": "Amazon Deutschland N20 Transport GmbH",
      "company_seat": "München",
      "details": "09.05.2025 (Bekanntmachungsdatum)\n\nBayern Amtsgericht München HRB 274355\nRegisterbekanntmachung nach dem Umwandlungsgesetz 08.05.2025 (Eintragungsdatum)\n\nAmazon Deutschland N20 Transport GmbH\nGesellschaft mit beschränkter Haftung\nMünchen\n\nDen Gläubigern der an der Verschmelzung beteiligten Rechtsträger ist, wenn sie binnen sechs Monaten nach dem Tag, an dem die Eintragung der Verschmelzung in das Register des Sitzes desjenigen Rechtsträgers, dessen Gläubiger sie sind, nach § 19 Abs. 3 UmwG als bekannt gemacht gilt, ihren Anspruch nach Grund und Höhe in Textform anmelden, Sicherheit zu leisten, soweit sie nicht Befriedigung verlangen können. Dieses Recht steht den Gläubigern jedoch nur zu, wenn sie glaubhaft machen, dass durch die Verschmelzung die Erfüllung ihrer Forderung gefährdet wird."
    },
    {
      "date": "2025-05-09",
      "id": "108518",
      "original_text": "Löschungsankündigung\nBayern Amtsgericht München HRB 200688\nEXIM Brains GmbH – München",
      "type": "Löschungsankündigung",
      "state": "Bayern",
      "amtsgericht": "Amtsgericht München",
      "registernummer": "HRB 200688",
      "registerart": "HRB",
      "company_name": "EXIM Brains GmbH",
      "company_seat": "München",
      "details": "09.05.2025 (Bekanntmachungsdatum)\n\nBayern Amtsgericht München HRB 200688\nLöschungsankündigung\n\nEXIM Brains GmbH\nGesellschaft mit beschränkter Haftung\nMünchen\n\nDas Registergericht beabsichtigt, die im Handelsregister eingetragene Gesellschaft wegen Vermögenslosigkeit von Amts wegen nach § 394 FamFG zu löschen. Die Frist zur Erhebung eines Widerspruchs ist auf drei Monate festgesetzt."
    },
    {
      "date": "2025-05-09",
      "id": "108519",
      "original_text": "Registerbekanntmachung nach dem Umwandlungsgesetz\nBayern Amtsgericht München HRB 221705\nCACEIS Fonds Service GmbH – München",
      "type": "Registerbekanntmachung nach dem Umwandlungsgesetz",
      "state": "Bayern",
      "amtsgericht": "Amtsgericht München",
      "registernummer": "HRB 221705",
      "registerart": "HRB",
      "company_name": "CACEIS Fonds Service GmbH",
      "company_seat": "München",
      "details": "09.05.2025 (Bekanntmachungsdatum)\n\nBayern Amtsgericht München HRB 221705\nRegisterbekanntmachung nach dem Umwandlungsgesetz\n\nCACEIS Fonds Service GmbH\nGesellschaft mit beschränkter Haftung\nMünchen\n\nGläubigeraufruf vom 24.4.2025 berichtigt:\nEs wird darauf hingewiesen, dass ein Verschmelzungsplan oder sein Entwurf über eine grenzüberschreitende Verschmelzung auf die CACEIS Bank mit Sitz in Montrouge/Frankreich (Registre du Commerce et des Sociétés de Nanterre 692024722) (société anonyme  -Aktiengesellschaft nach französischem Recht) beim Handelsregister eingereicht worden ist.\nDie Anteilsinhaber, die Gläubiger sowie die zuständigen Betriebsräte der an der grenzüberschreitenden Verschmelzung beteiligten Gesellschaften oder, soweit es keinen Betriebsrat gibt, die Arbeitnehmer der an der grenzüberschreitenden Verschmelzung beteiligten Gesellschaften, können der jeweiligen Gesellschaft spätestens fünf Arbeitstage vor Beurkundung des Verschmelzungsplans Bemerkungen zum Verschmelzungsplan übermitteln"
    },
    {
      "date": "2025-05-09",
      "id": "108520",
      "original_text": "Registerbekanntmachung nach dem Umwandlungsgesetz\nBayern Amtsgericht München HRB 274353\nAmazon Deutschland S43 Transport GmbH – München",
      "type": "Registerbekanntmachung nach dem Umwandlungsgesetz",
      "state": "Bayern",
      "amtsgericht": "Amtsgericht München",
      "registernummer": "HRB 274353",
      "registerart": "HRB",
      "company_name": "Amazon Deutschland S43 Transport GmbH",
      "company_seat": "München",
      "details": "09.05.2025 (Bekanntmachungsdatum)\n\nBayern Amtsgericht München HRB 274353\nRegisterbekanntmachung nach dem Umwandlungsgesetz 08.05.2025 (Eintragungsdatum)\n\nAmazon Deutschland S43 Transport GmbH\nGesellschaft mit beschränkter Haftung\nMünchen\n\nDen Gläubigern der an der Verschmelzung beteiligten Rechtsträger ist, wenn sie binnen sechs Monaten nach dem Tag, an dem die Eintragung der Verschmelzung in das Register des Sitzes desjenigen Rechtsträgers, dessen Gläubiger sie sind, nach § 19 Abs. 3 UmwG als bekannt gemacht gilt, ihren Anspruch nach Grund und Höhe in Textform anmelden, Sicherheit zu leisten, soweit sie nicht Befriedigung verlangen können. Dieses Recht steht den Gläubigern jedoch nur zu, wenn sie glaubhaft machen, dass durch die Verschmelzung die Erfüllung ihrer Forderung gefährdet wird."
    },
    {
      "date": "2025-05-09",
      "id": "108521",
      "original_text": "Sonstige Registerbekanntmachung\nBayern Amtsgericht Traunstein HRB 17218\nCOC AG – Burghausen",
      "type": "Sonstige Registerbekanntmachung",
      "state": "Bayern",
      "amtsgericht": "Amtsgericht Traunstein",
      "registernummer": "HRB 17218",
      "registerart": "HRB",
      "company_name": "COC AG",
      "company_seat": "Burghausen",
      "details": "09.05.2025 (Bekanntmachungsdatum)\n\nBayern Amtsgericht Traunstein HRB 17218\nSonstige Registerbekanntmachung\n\nCOC AG\nAktiengesellschaft\nBurghausen\n\nDem Amtsgericht Traunstein -Registergericht- ist der Entwurf eines Ausgliederungsvertrages zwischen der DOCUNIZE GmbH, Altötting (Amtsgericht Traunstein HRB 33670) und der Gesellschaft als übertragendem Rechtsträger zur Einsichtnahme eingereicht worden."
    },
    {
      "date": "2025-05-09",
      "id": "108522",
      "original_text": "Einreichung neuer Dokumente\nBayern Amtsgericht München HRB 62397\nRohde & Schwarz Vertriebs-GmbH – München",
      "type": "Einreichung neuer Dokumente",
      "state": "Bayern",
      "amtsgericht": "Amtsgericht München",
      "registernummer": "HRB 62397",
      "registerart": "HRB",
      "company_name": "Rohde & Schwarz Vertriebs-GmbH",
      "company_seat": "München",
      "details": "09.05.2025 (Bekanntmachungsdatum)\n\nBayern Amtsgericht München HRB 62397\nEinreichung neuer Dokumente\n\nRohde & Schwarz Vertriebs-GmbH\nGesellschaft mit beschränkter Haftung\nMünchen\n\nDem Amtsgericht München -Registergericht- ist eine Liste der Mitglieder des Aufsichtsrats eingereicht worden, § 52 Abs. 3 S. 2 GmbHG."
    },
    {
      "date": "2025-05-09",
      "id": "108523",
      "original_text": "Registerbekanntmachung nach dem Umwandlungsgesetz\nBayern Amtsgericht München HRB 274429\nAmazon Deutschland N22 Transport GmbH – München",
      "type": "Registerbekanntmachung nach dem Umwandlungsgesetz",
      "state": "Bayern",
      "amtsgericht": "Amtsgericht München",
      "registernummer": "HRB 274429",
      "registerart": "HRB",
      "company_name": "Amazon Deutschland N22 Transport GmbH",
      "company_seat": "München",
      "details": "09.05.2025 (Bekanntmachungsdatum)\n\nBayern Amtsgericht München HRB 274429\nRegisterbekanntmachung nach dem Umwandlungsgesetz 08.05.2025 (Eintragungsdatum)\n\nAmazon Deutschland N22 Transport GmbH\nGesellschaft mit beschränkter Haftung\nMünchen\n\nDen Gläubigern der an der Verschmelzung beteiligten Rechtsträger ist, wenn sie binnen sechs Monaten nach dem Tag, an dem die Eintragung der Verschmelzung in das Register des Sitzes desjenigen Rechtsträgers, dessen Gläubiger sie sind, nach § 19 Abs. 3 UmwG als bekannt gemacht gilt, ihren Anspruch nach Grund und Höhe in Textform anmelden, Sicherheit zu leisten, soweit sie nicht Befriedigung verlangen können. Dieses Recht steht den Gläubigern jedoch nur zu, wenn sie glaubhaft machen, dass durch die Verschmelzung die Erfüllung ihrer Forderung gefährdet wird."
    },
    {
      "date": "2025-05-09",
      "id": "108524",
      "original_text": "Registerbekanntmachung nach dem Umwandlungsgesetz\nBayern Amtsgericht München HRB 235825\nOvid Management Reserve GmbH – München",
      "type": "Registerbekanntmachung nach dem Umwandlungsgesetz",
      "state": "Bayern",
      "amtsgericht": "Amtsgericht München",
      "registernummer": "HRB 235825",
      "registerart": "HRB",
      "company_name": "Ovid Management Reserve GmbH",
      "company_seat": "München",
      "details": "09.05.2025 (Bekanntmachungsdatum)\n\nBayern Amtsgericht München HRB 235825\nRegisterbekanntmachung nach dem Umwandlungsgesetz 08.05.2025 (Eintragungsdatum)\n\nOvid Management Reserve GmbH\nGesellschaft mit beschränkter Haftung\nMünchen\n\nDen Gläubigern der an der Verschmelzung beteiligten Rechtsträger ist, wenn sie binnen sechs Monaten nach dem Tag, an dem die Eintragung der Verschmelzung in das Register des Sitzes desjenigen Rechtsträgers, dessen Gläubiger sie sind, nach § 19 Abs. 3 UmwG als bekannt gemacht gilt, ihren Anspruch nach Grund und Höhe in Textform anmelden, Sicherheit zu leisten, soweit sie nicht Befriedigung verlangen können. Dieses Recht steht den Gläubigern jedoch nur zu, wenn sie glaubhaft machen, dass durch die Verschmelzung die Erfüllung ihrer Forderung gefährdet wird."
    },
    {
      "date": "2025-05-09",
      "id": "108525",
      "original_text": "Registerbekanntmachung nach dem Umwandlungsgesetz\nBayern Amtsgericht München HRB 153158\nArkaden Grundstücksverwaltungsgesellschaft mbH – München",
      "type": "Registerbekanntmachung nach dem Umwandlungsgesetz",
      "state": "Bayern",
      "amtsgericht": "Amtsgericht München",
      "registernummer": "HRB 153158",
      "registerart": "HRB",
      "company_name": "Arkaden Grundstücksverwaltungsgesellschaft mbH",
      "company_seat": "München",
      "details": "09.05.2025 (Bekanntmachungsdatum)\n\nBayern Amtsgericht München HRB 153158\nRegisterbekanntmachung nach dem Umwandlungsgesetz 08.05.2025 (Eintragungsdatum)\n\nArkaden Grundstücksverwaltungsgesellschaft mbH\nGesellschaft mit beschränkter Haftung\nMünchen\n\nDen Gläubigern der an der Verschmelzung beteiligten Rechtsträger ist, wenn sie binnen sechs Monaten nach dem Tag, an dem die Eintragung der Verschmelzung in das Register des Sitzes desjenigen Rechtsträgers, dessen Gläubiger sie sind, nach § 19 Abs. 3 UmwG als bekannt gemacht gilt, ihren Anspruch nach Grund und Höhe in Textform anmelden, Sicherheit zu leisten, soweit sie nicht Befriedigung verlangen können. Dieses Recht steht den Gläubigern jedoch nur zu, wenn sie glaubhaft machen, dass durch die Verschmelzung die Erfüllung ihrer Forderung gefährdet wird."
    },
    {
      "date": "2025-05-09",
      "id": "108526",
      "original_text": "Einreichung neuer Dokumente\nBayern Amtsgericht München HRB 301393\nDante Beteiligungen SE – München",
      "type": "Einreichung neuer Dokumente",
      "state": "Bayern",
      "amtsgericht": "Amtsgericht München",
      "registernummer": "HRB 301393",
      "registerart": "HRB",
      "company_name": "Dante Beteiligungen SE",
      "company_seat": "München",
      "details": "09.05.2025 (Bekanntmachungsdatum)\n\nBayern Amtsgericht München HRB 301393\nEinreichung neuer Dokumente 08.05.2025 (Eintragungsdatum)\n\nDante Beteiligungen SE\nEuropäische Aktiengesellschaft (SE)\nMünchen\n\nDem Amtsgericht München -Registergericht- ist eine Liste der Mitglieder des Aufsichtsrats eingereicht worden, Art. 9 Abs. 1 Buchst. c (ii) SE-VO i.V.m. § 106 AktG."
    },
    {
      "date": "2025-05-09",
      "id": "108527",
      "original_text": "Einreichung neuer Dokumente\nBayern Amtsgericht Traunstein HRB 9155\nGabor Shoes Aktiengesellschaft – Rosenheim",
      "type": "Einreichung neuer Dokumente",
      "state": "Bayern",
      "amtsgericht": "Amtsgericht Traunstein",
      "registernummer": "HRB 9155",
      "registerart": "HRB",
      "company_name": "Gabor Shoes Aktiengesellschaft",
      "company_seat": "Rosenheim",
      "details": "09.05.2025 (Bekanntmachungsdatum)\n\nBayern Amtsgericht Traunstein HRB 9155\nEinreichung neuer Dokumente\n\nGabor Shoes Aktiengesellschaft\nAktiengesellschaft\nRosenheim\n\nDem Amtsgericht Traunstein -Registergericht- ist eine Liste der Mitglieder des Aufsichtsrats eingereicht worden, § 106 AktG."
    },
    {
      "date": "2025-05-09",
      "id": "108528",
      "original_text": "Löschungsankündigung\nBayern Amtsgericht Traunstein HRB 27671\nReGo GmbH – Traunstein",
      "type": "Löschungsankündigung",
      "state": "Bayern",
      "amtsgericht": "Amtsgericht Traunstein",
      "registernummer": "HRB 27671",
      "registerart": "HRB",
      "company_name": "ReGo GmbH",
      "company_seat": "Traunstein",
      "details": "09.05.2025 (Bekanntmachungsdatum)\n\nBayern Amtsgericht Traunstein HRB 27671\nLöschungsankündigung 08.05.2025 (Eintragungsdatum)\n\nReGo GmbH\nGesellschaft mit beschränkter Haftung\nTraunstein\n\nDas Registergericht beabsichtigt, die im Handelsregister eingetragene Gesellschaft wegen Vermögenslosigkeit von Amts wegen nach § 394 FamFG zu löschen. Die Frist zur Erhebung eines Widerspruchs ist auf drei Monate festgesetzt."
    },
    {
      "date": "2025-05-09",
      "id": "108529",
      "original_text": "Registerbekanntmachung nach dem Umwandlungsgesetz\nBayern Amtsgericht Passau HRA 13929\nFliesen- und Natursteintechnik-Passau e.K. – Neuburg a. Inn",
      "type": "Registerbekanntmachung nach dem Umwandlungsgesetz",
      "state": "Bayern",
      "amtsgericht": "Amtsgericht Passau",
      "registernummer": "HRA 13929",
      "registerart": "HRA",
      "company_name": "Fliesen- und Natursteintechnik-Passau e.K.",
      "company_seat": "Neuburg a. Inn",
      "details": "09.05.2025 (Bekanntmachungsdatum)\n\nBayern Amtsgericht Passau HRA 13929\nRegisterbekanntmachung nach dem Umwandlungsgesetz 08.05.2025 (Eintragungsdatum)\n\nFliesen- und Natursteintechnik-Passau e.K.\nEinzelkaufmann / Einzelkauffrau\nNeuburg a. Inn\n\nDen Gläubigern der an der Ausgliederung beteiligten Rechtsträger ist, wenn sie binnen sechs Monaten nach dem Tag, an dem die Eintragung der Ausgliederung in das Register des Sitzes desjenigen Rechtsträgers, dessen Gläubiger sie sind, nach §§ 125, 19 Abs. 3 UmwG als bekannt gemacht gilt, ihren Anspruch nach Grund und Höhe in Textform anmelden, Sicherheit zu leisten, soweit sie nicht Befriedigung verlangen können. Dieses Recht steht den Gläubigern jedoch nur zu, wenn sie glaubhaft machen, dass durch die Ausgliederung die Erfüllung ihrer Forderung gefährdet wird."
    },
    {
      "date": "2025-05-09",
      "id": "108530",
      "original_text": "Registerbekanntmachung nach dem Umwandlungsgesetz\nBayern Amtsgericht München HRB 274390\nAmazon Deutschland W38 Transport GmbH – München",
      "type": "Registerbekanntmachung nach dem Umwandlungsgesetz",
      "state": "Bayern",
      "amtsgericht": "Amtsgericht München",
      "registernummer": "HRB 274390",
      "registerart": "HRB",
      "company_name": "Amazon Deutschland W38 Transport GmbH",
      "company_seat": "München",
      "details": "09.05.2025 (Bekanntmachungsdatum)\n\nBayern Amtsgericht München HRB 274390\nRegisterbekanntmachung nach dem Umwandlungsgesetz 08.05.2025 (Eintragungsdatum)\n\nAmazon Deutschland W38 Transport GmbH\nGesellschaft mit beschränkter Haftung\nMünchen\n\nDen Gläubigern der an der Verschmelzung beteiligten Rechtsträger ist, wenn sie binnen sechs Monaten nach dem Tag, an dem die Eintragung der Verschmelzung in das Register des Sitzes desjenigen Rechtsträgers, dessen Gläubiger sie sind, nach § 19 Abs. 3 UmwG als bekannt gemacht gilt, ihren Anspruch nach Grund und Höhe in Textform anmelden, Sicherheit zu leisten, soweit sie nicht Befriedigung verlangen können. Dieses Recht steht den Gläubigern jedoch nur zu, wenn sie glaubhaft machen, dass durch die Verschmelzung die Erfüllung ihrer Forderung gefährdet wird."
    },
    {
      "date": "2025-05-09",
      "id": "108531",
      "original_text": "Registerbekanntmachung nach dem Umwandlungsgesetz\nBayern Amtsgericht München HRB 274430\nAmazon Deutschland S39 Transport GmbH – München",
      "type": "Registerbekanntmachung nach dem Umwandlungsgesetz",
      "state": "Bayern",
      "amtsgericht": "Amtsgericht München",
      "registernummer": "HRB 274430",
      "registerart": "HRB",
      "company_name": "Amazon Deutschland S39 Transport GmbH",
      "company_seat": "München",
      "details": "09.05.2025 (Bekanntmachungsdatum)\n\nBayern Amtsgericht München HRB 274430\nRegisterbekanntmachung nach dem Umwandlungsgesetz 08.05.2025 (Eintragungsdatum)\n\nAmazon Deutschland S39 Transport GmbH\nGesellschaft mit beschränkter Haftung\nMünchen\n\nDen Gläubigern der an der Verschmelzung beteiligten Rechtsträger ist, wenn sie binnen sechs Monaten nach dem Tag, an dem die Eintragung der Verschmelzung in das Register des Sitzes desjenigen Rechtsträgers, dessen Gläubiger sie sind, nach § 19 Abs. 3 UmwG als bekannt gemacht gilt, ihren Anspruch nach Grund und Höhe in Textform anmelden, Sicherheit zu leisten, soweit sie nicht Befriedigung verlangen können. Dieses Recht steht den Gläubigern jedoch nur zu, wenn sie glaubhaft machen, dass durch die Verschmelzung die Erfüllung ihrer Forderung gefährdet wird."
    },
    {
      "date": "2025-05-09",
      "id": "108532",
      "original_text": "Registerbekanntmachung nach dem Umwandlungsgesetz\nBayern Amtsgericht München HRB 274422\nAmazon Deutschland W40 Transport GmbH – München",
      "type": "Registerbekanntmachung nach dem Umwandlungsgesetz",
      "state": "Bayern",
      "amtsgericht": "Amtsgericht München",
      "registernummer": "HRB 274422",
      "registerart": "HRB",
      "company_name": "Amazon Deutschland W40 Transport GmbH",
      "company_seat": "München",
      "details": "09.05.2025 (Bekanntmachungsdatum)\n\nBayern Amtsgericht München HRB 274422\nRegisterbekanntmachung nach dem Umwandlungsgesetz 08.05.2025 (Eintragungsdatum)\n\nAmazon Deutschland W40 Transport GmbH\nGesellschaft mit beschränkter Haftung\nMünchen\n\nDen Gläubigern der an der Verschmelzung beteiligten Rechtsträger ist, wenn sie binnen sechs Monaten nach dem Tag, an dem die Eintragung der Verschmelzung in das Register des Sitzes desjenigen Rechtsträgers, dessen Gläubiger sie sind, nach § 19 Abs. 3 UmwG als bekannt gemacht gilt, ihren Anspruch nach Grund und Höhe in Textform anmelden, Sicherheit zu leisten, soweit sie nicht Befriedigung verlangen können. Dieses Recht steht den Gläubigern jedoch nur zu, wenn sie glaubhaft machen, dass durch die Verschmelzung die Erfüllung ihrer Forderung gefährdet wird."
    },
    {
      "date": "2025-05-09",
      "id": "108533",
      "original_text": "Einreichung neuer Dokumente\nBayern Amtsgericht Ingolstadt HRB 3263\nSTADTWERKE EICHSTÄTT Versorgungs-GmbH – Eichstätt",
      "type": "Einreichung neuer Dokumente",
      "state": "Bayern",
      "amtsgericht": "Amtsgericht Ingolstadt",
      "registernummer": "HRB 3263",
      "registerart": "HRB",
      "company_name": "STADTWERKE EICHSTÄTT Versorgungs-GmbH",
      "company_seat": "Eichstätt",
      "details": "09.05.2025 (Bekanntmachungsdatum)\n\nBayern Amtsgericht Ingolstadt HRB 3263\nEinreichung neuer Dokumente\n\nSTADTWERKE EICHSTÄTT Versorgungs-GmbH\nGesellschaft mit beschränkter Haftung\nEichstätt\n\nDem Amtsgericht Ingolstadt -Registergericht- ist eine Liste der Mitglieder des Aufsichtsrats eingereicht worden, § 52 Abs. 3 S. 2 GmbHG."
    },
    {
      "date": "2025-05-09",
      "id": "108534",
      "original_text": "Registerbekanntmachung nach dem Umwandlungsgesetz\nBayern Amtsgericht München HRB 274328\nAmazon Deutschland E18 Transport GmbH – München",
      "type": "Registerbekanntmachung nach dem Umwandlungsgesetz",
      "state": "Bayern",
      "amtsgericht": "Amtsgericht München",
      "registernummer": "HRB 274328",
      "registerart": "HRB",
      "company_name": "Amazon Deutschland E18 Transport GmbH",
      "company_seat": "München",
      "details": "09.05.2025 (Bekanntmachungsdatum)\n\nBayern Amtsgericht München HRB 274328\nRegisterbekanntmachung nach dem Umwandlungsgesetz 08.05.2025 (Eintragungsdatum)\n\nAmazon Deutschland E18 Transport GmbH\nGesellschaft mit beschränkter Haftung\nMünchen\n\nDen Gläubigern der an der Verschmelzung beteiligten Rechtsträger ist, wenn sie binnen sechs Monaten nach dem Tag, an dem die Eintragung der Verschmelzung in das Register des Sitzes desjenigen Rechtsträgers, dessen Gläubiger sie sind, nach § 19 Abs. 3 UmwG als bekannt gemacht gilt, ihren Anspruch nach Grund und Höhe in Textform anmelden, Sicherheit zu leisten, soweit sie nicht Befriedigung verlangen können. Dieses Recht steht den Gläubigern jedoch nur zu, wenn sie glaubhaft machen, dass durch die Verschmelzung die Erfüllung ihrer Forderung gefährdet wird."
    },
    {
      "date": "2025-05-09",
      "id": "108535",
      "original_text": "Registerbekanntmachung nach dem Umwandlungsgesetz\nBayern Amtsgericht München HRB 7316\nKuznia Gesellschaft mit beschränkter Haftung – Markt Indersdorf",
      "type": "Registerbekanntmachung nach dem Umwandlungsgesetz",
      "state": "Bayern",
      "amtsgericht": "Amtsgericht München",
      "registernummer": "HRB 7316",
      "registerart": "HRB",
      "company_name": "Kuznia Gesellschaft mit beschränkter Haftung",
      "company_seat": "Markt Indersdorf",
      "details": "09.05.2025 (Bekanntmachungsdatum)\n\nBayern Amtsgericht München HRB 7316\nRegisterbekanntmachung nach dem Umwandlungsgesetz 08.05.2025 (Eintragungsdatum)\n\nKuznia Gesellschaft mit beschränkter Haftung\nGesellschaft mit beschränkter Haftung\nMarkt Indersdorf\n\nDen Gläubigern der an der Verschmelzung beteiligten Rechtsträger ist, wenn sie binnen sechs Monaten nach dem Tag, an dem die Eintragung der Verschmelzung in das Register des Sitzes desjenigen Rechtsträgers, dessen Gläubiger sie sind, nach § 19 Abs. 3 UmwG als bekannt gemacht gilt, ihren Anspruch nach Grund und Höhe in Textform anmelden, Sicherheit zu leisten, soweit sie nicht Befriedigung verlangen können. Dieses Recht steht den Gläubigern jedoch nur zu, wenn sie glaubhaft machen, dass durch die Verschmelzung die Erfüllung ihrer Forderung gefährdet wird."
    },
    {
      "date": "2025-05-09",
      "id": "108536",
      "original_text": "Löschungsankündigung\nBayern Amtsgericht Augsburg HRB 17667\nKF Angelika Wiesner Immobilien-GmbH – Augsburg",
      "type": "Löschungsankündigung",
      "state": "Bayern",
      "amtsgericht": "Amtsgericht Augsburg",
      "registernummer": "HRB 17667",
      "registerart": "HRB",
      "company_name": "KF Angelika Wiesner Immobilien-GmbH",
      "company_seat": "Augsburg",
      "details": "09.05.2025 (Bekanntmachungsdatum)\n\nBayern Amtsgericht Augsburg HRB 17667\nLöschungsankündigung\n\nKF Angelika Wiesner Immobilien-GmbH\nGesellschaft mit beschränkter Haftung\nAugsburg\n\nDas Registergericht beabsichtigt, die im Handelsregister eingetragene Gesellschaft wegen Vermögenslosigkeit von Amts wegen nach § 394 FamFG zu löschen. Die Frist zur Erhebung eines Widerspruchs ist auf einen Monat festgesetzt."
    },
    {
      "date": "2025-05-09",
      "id": "108537",
      "original_text": "Registerbekanntmachung nach dem Umwandlungsgesetz\nBayern Amtsgericht München HRB 274356\nAmazon Deutschland W37 Transport GmbH – München",
      "type": "Registerbekanntmachung nach dem Umwandlungsgesetz",
      "state": "Bayern",
      "amtsgericht": "Amtsgericht München",
      "registernummer": "HRB 274356",
      "registerart": "HRB",
      "company_name": "Amazon Deutschland W37 Transport GmbH",
      "company_seat": "München",
      "details": "09.05.2025 (Bekanntmachungsdatum)\n\nBayern Amtsgericht München HRB 274356\nRegisterbekanntmachung nach dem Umwandlungsgesetz 08.05.2025 (Eintragungsdatum)\n\nAmazon Deutschland W37 Transport GmbH\nGesellschaft mit beschränkter Haftung\nMünchen\n\nDen Gläubigern der an der Verschmelzung beteiligten Rechtsträger ist, wenn sie binnen sechs Monaten nach dem Tag, an dem die Eintragung der Verschmelzung in das Register des Sitzes desjenigen Rechtsträgers, dessen Gläubiger sie sind, nach § 19 Abs. 3 UmwG als bekannt gemacht gilt, ihren Anspruch nach Grund und Höhe in Textform anmelden, Sicherheit zu leisten, soweit sie nicht Befriedigung verlangen können. Dieses Recht steht den Gläubigern jedoch nur zu, wenn sie glaubhaft machen, dass durch die Verschmelzung die Erfüllung ihrer Forderung gefährdet wird."
    },
    {
      "date": "2025-05-09",
      "id": "108538",
      "original_text": "Registerbekanntmachung nach dem Umwandlungsgesetz\nBayern Amtsgericht München HRB 274354\nAmazon Deutschland E20 Transport GmbH – München",
      "type": "Registerbekanntmachung nach dem Umwandlungsgesetz",
      "state": "Bayern",
      "amtsgericht": "Amtsgericht München",
      "registernummer": "HRB 274354",
      "registerart": "HRB",
      "company_name": "Amazon Deutschland E20 Transport GmbH",
      "company_seat": "München",
      "details": "09.05.2025 (Bekanntmachungsdatum)\n\nBayern Amtsgericht München HRB 274354\nRegisterbekanntmachung nach dem Umwandlungsgesetz 08.05.2025 (Eintragungsdatum)\n\nAmazon Deutschland E20 Transport GmbH\nGesellschaft mit beschränkter Haftung\nMünchen\n\nDen Gläubigern der an der Verschmelzung beteiligten Rechtsträger ist, wenn sie binnen sechs Monaten nach dem Tag, an dem die Eintragung der Verschmelzung in das Register des Sitzes desjenigen Rechtsträgers, dessen Gläubiger sie sind, nach § 19 Abs. 3 UmwG als bekannt gemacht gilt, ihren Anspruch nach Grund und Höhe in Textform anmelden, Sicherheit zu leisten, soweit sie nicht Befriedigung verlangen können. Dieses Recht steht den Gläubigern jedoch nur zu, wenn sie glaubhaft machen, dass durch die Verschmelzung die Erfüllung ihrer Forderung gefährdet wird."
    },
    {
      "date": "2025-05-09",
      "id": "108539",
      "original_text": "Einreichung neuer Dokumente\nBayern Amtsgericht München HRB 42031\nKnorr-Bremse Aktiengesellschaft – München",
      "type": "Einreichung neuer Dokumente",
      "state": "Bayern",
      "amtsgericht": "Amtsgericht München",
      "registernummer": "HRB 42031",
      "registerart": "HRB",
      "company_name": "Knorr-Bremse Aktiengesellschaft",
      "company_seat": "München",
      "details": "09.05.2025 (Bekanntmachungsdatum)\n\nBayern Amtsgericht München HRB 42031\nEinreichung neuer Dokumente\n\nKnorr-Bremse Aktiengesellschaft\nAktiengesellschaft\nMünchen\n\nDem Amtsgericht München -Registergericht- ist eine Liste der Mitglieder des Aufsichtsrats eingereicht worden, § 106 AktG."
    },
    {
      "date": "2025-05-09",
      "id": "108540",
      "original_text": "Registerbekanntmachung nach dem Umwandlungsgesetz\nBayern Amtsgericht München HRB 245848\nAEQUITA SE & Co. KGaA – München",
      "type": "Registerbekanntmachung nach dem Umwandlungsgesetz",
      "state": "Bayern",
      "amtsgericht": "Amtsgericht München",
      "registernummer": "HRB 245848",
      "registerart": "HRB",
      "company_name": "AEQUITA SE & Co. KGaA",
      "company_seat": "München",
      "details": "09.05.2025 (Bekanntmachungsdatum)\n\nBayern Amtsgericht München HRB 245848\nRegisterbekanntmachung nach dem Umwandlungsgesetz 08.05.2025 (Eintragungsdatum)\n\nAEQUITA SE & Co. KGaA\nKommanditgesellschaft auf Aktien\nMünchen\n\nDem Amtsgericht München -Registergericht- ist der Entwurf eines Verschmelzungsvertrages zwischen der Gesellschaft als übernehmendem Rechtsträger und der AEQH3 GmbH, München (Amtsgericht München HRB 247258) zur Einsichtnahme eingereicht worden."
    },
    {
      "date": "2025-05-09",
      "id": "108541",
      "original_text": "Registerbekanntmachung nach dem Umwandlungsgesetz\nBayern Amtsgericht Würzburg VR 200889\nVerband für haus-, land- und forstwirtschaftliche Fachbildung im Landkreis Kitzingen e.V. – Kitzingen",
      "type": "Registerbekanntmachung nach dem Umwandlungsgesetz",
      "state": "Bayern",
      "amtsgericht": "Amtsgericht Würzburg",
      "registernummer": "VR 200889",
      "registerart": "VR",
      "company_name": "Verband für haus-, land- und forstwirtschaftliche Fachbildung im Landkreis Kitzingen e.V.",
      "company_seat": "Kitzingen",
      "details": "09.05.2025 (Bekanntmachungsdatum)\n\nBayern Amtsgericht Würzburg VR 200889\nRegisterbekanntmachung nach dem Umwandlungsgesetz 08.05.2025 (Eintragungsdatum)\n\nVerband für haus-, land- und forstwirtschaftliche Fachbildung im Landkreis Kitzingen e.V.\neingetragener Verein\nKitzingen\n\nDen Gläubigern der an der Verschmelzung beteiligten Rechtsträger ist, wenn sie binnen sechs Monaten nach dem Tag, an dem die Eintragung der Verschmelzung in das Register des Sitzes desjenigen Rechtsträgers, dessen Gläubiger sie sind, nach § 19 Abs. 3 UmwG als bekannt gemacht gilt, ihren Anspruch nach Grund und Höhe in Textform anmelden, Sicherheit zu leisten, soweit sie nicht Befriedigung verlangen können. Dieses Recht steht den Gläubigern jedoch nur zu, wenn sie glaubhaft machen, dass durch die Verschmelzung die Erfüllung ihrer Forderung gefährdet wird."
    },
    {
      "date": "2025-05-09",
      "id": "108542",
      "original_text": "Registerbekanntmachung nach dem Umwandlungsgesetz\nBaden-Württemberg Amtsgericht Mannheim GnR 700202\nP&L Administration eG – Steinmauern",
      "type": "Registerbekanntmachung nach dem Umwandlungsgesetz",
      "state": "Baden-Württemberg",
      "amtsgericht": "Amtsgericht Mannheim",
      "registernummer": "GnR 700202",
      "registerart": "GnR",
      "company_name": "P&L Administration eG",
      "company_seat": "Steinmauern",
      "details": "09.05.2025 (Bekanntmachungsdatum)\n\nBaden-Württemberg Amtsgericht Mannheim GnR 700202\nRegisterbekanntmachung nach dem Umwandlungsgesetz 09.05.2025 (Eintragungsdatum)\n\nP&L Administration eG\neingetragene Genossenschaft\nSteinmauern\n\nAls nicht eingetragen wird bekanntgemacht:\nDen Gläubigern des an dem Formwechsel beteiligten Rechtsträgers ist, wenn sie binnen sechs Monaten nach dem Tag, an dem die Eintragung des Formwechsels in das Register des Sitzes desjenigen Rechtsträgers, dessen Gläubiger sie sind, nach § 19 Abs. 3 UmwG als bekanntgemacht gilt, ihren Anspruch nach Grund und Höhe schriftlich anmelden, Sicherheit zu leisten, soweit sie nicht Befriedigung verlangen können. Dieses Recht steht den Gläubigern jedoch nur zu, wenn sie glaubhaft machen, dass durch den Formwechsel die Erfüllung ihrer Forderung gefährdet wird."
    },
    {
      "date": "2025-05-09",
      "id": "108543",
      "original_text": "Registerbekanntmachung nach dem Umwandlungsgesetz\nBaden-Württemberg Amtsgericht Mannheim GsR 890\nGrundstücksverwaltungsgesellschaft Philipp Götz und Lukas Götz eingetragene Gesellschaft des bürgerlichen Rechts – Ötigheim",
      "type": "Registerbekanntmachung nach dem Umwandlungsgesetz",
      "state": "Baden-Württemberg",
      "amtsgericht": "Amtsgericht Mannheim",
      "registernummer": "GsR 890",
      "registerart": "GsR",
      "company_name": "Grundstücksverwaltungsgesellschaft Philipp Götz und Lukas Götz eingetragene Gesellschaft des bürgerlichen Rechts",
      "company_seat": "Ötigheim",
      "details": "09.05.2025 (Bekanntmachungsdatum)\n\nBaden-Württemberg Amtsgericht Mannheim GsR 890\nRegisterbekanntmachung nach dem Umwandlungsgesetz 09.05.2025 (Eintragungsdatum)\n\nGrundstücksverwaltungsgesellschaft Philipp Götz und Lukas Götz eingetragene Gesellschaft des bürgerlichen Rechts\nGesellschaft bürgerlichen Rechts\nÖtigheim\n\nAls nicht eingetragen wird bekanntgemacht:\nDen Gläubigern des an dem Formwechsel beteiligten Rechtsträgers ist, wenn sie binnen sechs Monaten nach dem Tag, an dem die Eintragung des Formwechsels in das Register des Sitzes desjenigen Rechtsträgers, dessen Gläubiger sie sind, nach § 19 Abs. 3 UmwG als bekanntgemacht gilt, ihren Anspruch nach Grund und Höhe schriftlich anmelden, Sicherheit zu leisten, soweit sie nicht Befriedigung verlangen können. Dieses Recht steht den Gläubigern jedoch nur zu, wenn sie glaubhaft machen, dass durch den Formwechsel die Erfüllung ihrer Forderung gefährdet wird."
    },
    {
      "date": "2025-05-09",
      "id": "108544",
      "original_text": "Einreichung neuer Dokumente\nSaarland Amtsgericht Saarbrücken HRB 4145\nVSE Aktiengesellschaft – Saarbrücken",
      "type": "Einreichung neuer Dokumente",
      "state": "Saarland",
      "amtsgericht": "Amtsgericht Saarbrücken",
      "registernummer": "HRB 4145",
      "registerart": "HRB",
      "company_name": "VSE Aktiengesellschaft",
      "company_seat": "Saarbrücken",
      "details": "09.05.2025 (Bekanntmachungsdatum)\n\nSaarland Amtsgericht Saarbrücken HRB 4145\nEinreichung neuer Dokumente\n\nVSE Aktiengesellschaft\nAktiengesellschaft\nSaarbrücken\n\nDer Vorstand der Gesellschaft hat eine Liste der Mitglieder des Aufsichtsrats zum Handelsregister eingereicht (§ 106 AktG)."
    },
    {
      "date": "2025-05-09",
      "id": "108545",
      "original_text": "Registerbekanntmachung nach dem Umwandlungsgesetz\nBaden-Württemberg Amtsgericht Mannheim HRB 706662\nService-Direkt Telemarketing Verwaltungsgesellschaft mbH – Mannheim",
      "type": "Registerbekanntmachung nach dem Umwandlungsgesetz",
      "state": "Baden-Württemberg",
      "amtsgericht": "Amtsgericht Mannheim",
      "registernummer": "HRB 706662",
      "registerart": "HRB",
      "company_name": "Service-Direkt Telemarketing Verwaltungsgesellschaft mbH",
      "company_seat": "Mannheim",
      "details": "09.05.2025 (Bekanntmachungsdatum)\n\nBaden-Württemberg Amtsgericht Mannheim HRB 706662\nRegisterbekanntmachung nach dem Umwandlungsgesetz 09.05.2025 (Eintragungsdatum)\n\nService-Direkt Telemarketing Verwaltungsgesellschaft mbH\nGesellschaft mit beschränkter Haftung\nMannheim\n\nDen Gläubigern der an der Verschmelzung beteiligten Rechtsträger ist, wenn sie binnen sechs Monaten nach dem Tag, an dem die Eintragung der Verschmelzung in das Register des Sitzes desjenigen Rechtsträgers, dessen Gläubiger sie sind, nach § 19 Abs. 3 UmwG als bekanntgemacht gilt, ihren Anspruch nach Grund und Höhe schriftlich anmelden, Sicherheit zu leisten, soweit sie nicht Befriedigung verlangen können. Dieses Recht steht den Gläubigern jedoch nur zu, wenn sie glaubhaft machen, dass durch die Verschmelzung die Erfüllung ihrer Forderung gefährdet wird."
    },
    {
      "date": "2025-05-09",
      "id": "108546",
      "original_text": "Registerbekanntmachung nach dem Umwandlungsgesetz\nBaden-Württemberg Amtsgericht Ulm HRB 739964\nBad und Wärme 24.de GmbH – Bad Saulgau",
      "type": "Registerbekanntmachung nach dem Umwandlungsgesetz",
      "state": "Baden-Württemberg",
      "amtsgericht": "Amtsgericht Ulm",
      "registernummer": "HRB 739964",
      "registerart": "HRB",
      "company_name": "Bad und Wärme 24.de GmbH",
      "company_seat": "Bad Saulgau",
      "details": "09.05.2025 (Bekanntmachungsdatum)\n\nBaden-Württemberg Amtsgericht Ulm HRB 739964\nRegisterbekanntmachung nach dem Umwandlungsgesetz 09.05.2025 (Eintragungsdatum)\n\nBad und Wärme 24.de GmbH\nGesellschaft mit beschränkter Haftung\nBad Saulgau\n\nAls nicht eingetragen wird bekanntgemacht:\nDen Gläubigern der an der Verschmelzung beteiligten Rechtsträger ist, wenn sie binnen sechs Monaten nach dem Tag, an dem die Eintragung der Verschmelzung in das Register des Sitzes desjenigen Rechtsträgers, dessen Gläubiger sie sind, nach § 19 Abs. 3 UmwG als bekanntgemacht gilt, ihren Anspruch nach Grund und Höhe schriftlich anmelden, Sicherheit zu leisten, soweit sie nicht Befriedigung verlangen können. Dieses Recht steht den Gläubigern jedoch nur zu, wenn sie glaubhaft machen, dass durch die Verschmelzung die Erfüllung ihrer Forderung gefährdet wird."
    },
    {
      "date": "2025-05-09",
      "id": "108547",
      "original_text": "Registerbekanntmachung nach dem Umwandlungsgesetz\nBaden-Württemberg Amtsgericht Mannheim HRB 110206\nSERVISCOPE AG – Karlsruhe",
      "type": "Registerbekanntmachung nach dem Umwandlungsgesetz",
      "state": "Baden-Württemberg",
      "amtsgericht": "Amtsgericht Mannheim",
      "registernummer": "HRB 110206",
      "registerart": "HRB",
      "company_name": "SERVISCOPE AG",
      "company_seat": "Karlsruhe",
      "details": "09.05.2025 (Bekanntmachungsdatum)\n\nBaden-Württemberg Amtsgericht Mannheim HRB 110206\nRegisterbekanntmachung nach dem Umwandlungsgesetz 09.05.2025 (Eintragungsdatum)\n\nSERVISCOPE AG\nAktiengesellschaft\nKarlsruhe\n\nAls nicht eingetragen wird bekanntgemacht:\nDen Gläubigern der an der Verschmelzung beteiligten Rechtsträger ist, wenn sie binnen sechs Monaten nach dem Tag, an dem die Eintragung der Verschmelzung in das Register des Sitzes desjenigen Rechtsträgers, dessen Gläubiger sie sind, nach § 19 Abs. 3 UmwG als bekanntgemacht gilt, ihren Anspruch nach Grund und Höhe schriftlich anmelden, Sicherheit zu leisten, soweit sie nicht Befriedigung verlangen können. Dieses Recht steht den Gläubigern jedoch nur zu, wenn sie glaubhaft machen, dass durch die Verschmelzung die Erfüllung ihrer Forderung gefährdet wird."
    },
    {
      "date": "2025-05-09",
      "id": "108548",
      "original_text": "Registerbekanntmachung nach dem Umwandlungsgesetz\nBaden-Württemberg Amtsgericht Ulm HRB 560674\nMarkus Tyborski GmbH Sanitäre Anlagen, Heizungsbau, Flaschnerei – Bad Saulgau",
      "type": "Registerbekanntmachung nach dem Umwandlungsgesetz",
      "state": "Baden-Württemberg",
      "amtsgericht": "Amtsgericht Ulm",
      "registernummer": "HRB 560674",
      "registerart": "HRB",
      "company_name": "Markus Tyborski GmbH Sanitäre Anlagen, Heizungsbau, Flaschnerei",
      "company_seat": "Bad Saulgau",
      "details": "09.05.2025 (Bekanntmachungsdatum)\n\nBaden-Württemberg Amtsgericht Ulm HRB 560674\nRegisterbekanntmachung nach dem Umwandlungsgesetz 09.05.2025 (Eintragungsdatum)\n\nMarkus Tyborski GmbH Sanitäre Anlagen, Heizungsbau, Flaschnerei\nGesellschaft mit beschränkter Haftung\nBad Saulgau\n\nAls nicht eingetragen wird bekanntgemacht:\nDen Gläubigern der an der Verschmelzung beteiligten Rechtsträger ist, wenn sie binnen sechs Monaten nach dem Tag, an dem die Eintragung der Verschmelzung in das Register des Sitzes desjenigen Rechtsträgers, dessen Gläubiger sie sind, nach § 19 Abs. 3 UmwG als bekanntgemacht gilt, ihren Anspruch nach Grund und Höhe schriftlich anmelden, Sicherheit zu leisten, soweit sie nicht Befriedigung verlangen können. Dieses Recht steht den Gläubigern jedoch nur zu, wenn sie glaubhaft machen, dass durch die Verschmelzung die Erfüllung ihrer Forderung gefährdet wird."
    },
    {
      "date": "2025-05-09",
      "id": "108549",
      "original_text": "Löschungsankündigung\nBerlin Amtsgericht Berlin (Charlottenburg) HRB 190702\nRecrudo GmbH – Berlin",
      "type": "Löschungsankündigung",
      "state": "Berlin",
      "amtsgericht": "Amtsgericht Berlin (Charlottenburg)",
      "registernummer": "HRB 190702",
      "registerart": "HRB",
      "company_name": "Recrudo GmbH",
      "company_seat": "Berlin",
      "details": "09.05.2025 (Bekanntmachungsdatum)\n\nBerlin Amtsgericht Berlin (Charlottenburg) HRB 190702\nLöschungsankündigung\n\nRecrudo GmbH\nGesellschaft mit beschränkter Haftung\nBerlin\n\nBei der nachstehenden Gesellschaft wird das Amtslöschungsverfahren gemäß § 394 FamFG eingeleitet. Widerspruchsfrist 6 Wochen"
    },
    {
      "date": "2025-05-09",
      "id": "108550",
      "original_text": "Registerbekanntmachung nach dem Umwandlungsgesetz\nMecklenburg-Vorpommern Amtsgericht Rostock HRA 5465\nLA-Immobilien Ihn. Ludwig Alms e.K. – Rostock",
      "type": "Registerbekanntmachung nach dem Umwandlungsgesetz",
      "state": "Mecklenburg-Vorpommern",
      "amtsgericht": "Amtsgericht Rostock",
      "registernummer": "HRA 5465",
      "registerart": "HRA",
      "company_name": "LA-Immobilien Ihn. Ludwig Alms e.K.",
      "company_seat": "Rostock",
      "details": "09.05.2025 (Bekanntmachungsdatum)\n\nMecklenburg-Vorpommern Amtsgericht Rostock HRA 5465\nRegisterbekanntmachung nach dem Umwandlungsgesetz 09.05.2025 (Eintragungsdatum)\n\nLA-Immobilien Ihn. Ludwig Alms e.K.\nEinzelkaufmann / Einzelkauffrau\nRostock\n\nDen Gläubigern der an der Ausgliederung beteiligten Rechtsträger ist, wenn sie binnen sechs Monaten nach dem Tag, an dem die Eintragung der Ausgliederung in das Register des Sitzes desjenigen Rechtsträgers, dessen Gläubiger sie sind, nach § 19 Abs. 3 UmwG als bekannt gemacht gilt, ihren Anspruch nach Grund und Höhe in Textform anmelden, Sicherheit zu leisten, soweit sie nicht Befriedigung verlangen können. Dieses Recht steht den Gläubigern jedoch nur zu, wenn sie glaubhaft machen, dass durch die Ausgliederung die Erfüllung der Forderung gefährdet wird."
    },
    {
      "date": "2025-05-09",
      "id": "108551",
      "original_text": "Löschungsankündigung\nBrandenburg Amtsgericht Potsdam HRB 29430\nSolidtherm UG (haftungsbeschränkt) – Stahnsdorf",
      "type": "Löschungsankündigung",
      "state": "Brandenburg",
      "amtsgericht": "Amtsgericht Potsdam",
      "registernummer": "HRB 29430",
      "registerart": "HRB",
      "company_name": "Solidtherm UG (haftungsbeschränkt)",
      "company_seat": "Stahnsdorf",
      "details": "09.05.2025 (Bekanntmachungsdatum)\n\nBrandenburg Amtsgericht Potsdam HRB 29430\nLöschungsankündigung\n\nSolidtherm UG (haftungsbeschränkt)\nGesellschaft mit beschränkter Haftung\nStahnsdorf\n\nBei der nachstehenden Gesellschaft wird das Amtslöschungsverfahren gemäß § 394 FamFG eingeleitet. Widerspruchsfrist 8 Wochen."
    },
    {
      "date": "2025-05-09",
      "id": "108552",
      "original_text": "Sonstige Registerbekanntmachung\nHamburg Amtsgericht Hamburg HRB 185998\nbp Offshore Wind Deutschland GmbH – Hamburg",
      "type": "Sonstige Registerbekanntmachung",
      "state": "Hamburg",
      "amtsgericht": "Amtsgericht Hamburg",
      "registernummer": "HRB 185998",
      "registerart": "HRB",
      "company_name": "bp Offshore Wind Deutschland GmbH",
      "company_seat": "Hamburg",
      "details": "09.05.2025 (Bekanntmachungsdatum)\n\nHamburg Amtsgericht Hamburg HRB 185998\nSonstige Registerbekanntmachung 09.05.2025 (Eintragungsdatum)\n\nbp Offshore Wind Deutschland GmbH\nGesellschaft mit beschränkter Haftung\nHamburg\n\nAls nicht eingetragen wird bekannt gemacht:  Den Gläubigern der Gesellschaft, deren Forderungen begründet worden sind, bevor die Eintragung der Vertragsbeendigung in das Handelsregister nach § 10 HGB als bekannt gemacht gilt, ist vom anderen Vertragsteil Sicherheit zu leisten, wenn sie sich binnen 6 Monaten nach Bekanntmachung der Eintragung zu diesem Zweck bei ihm melden."
    },
    {
      "date": "2025-05-09",
      "id": "108553",
      "original_text": "Löschungsankündigung\nSachsen-Anhalt Amtsgericht Stendal HRB 6851\nBAUMA IMPEX GmbH – Osterwieck",
      "type": "Löschungsankündigung",
      "state": "Sachsen-Anhalt",
      "amtsgericht": "Amtsgericht Stendal",
      "registernummer": "HRB 6851",
      "registerart": "HRB",
      "company_name": "BAUMA IMPEX GmbH",
      "company_seat": "Osterwieck",
      "details": "09.05.2025 (Bekanntmachungsdatum)\n\nSachsen-Anhalt Amtsgericht Stendal HRB 6851\nLöschungsankündigung\n\nBAUMA IMPEX GmbH\nGesellschaft mit beschränkter Haftung\nOsterwieck\n\nDas Registergericht beabsichtigt, nachfolgende Gesellschaften wegen Vermögenslosigkeit von Amts wegen nach § 394 FamFG zu löschen. Die Frist zur Erhebung eines Widerspruchs gegen die beabsichtigte Löschung wird auf drei Monate festgesetzt."
    },
    {
      "date": "2025-05-09",
      "id": "108554",
      "original_text": "Registerbekanntmachung nach dem Umwandlungsgesetz\nBerlin Amtsgericht Berlin (Charlottenburg) HRB 221358\ntriplecore C2 GmbH – Berlin",
      "type": "Registerbekanntmachung nach dem Umwandlungsgesetz",
      "state": "Berlin",
      "amtsgericht": "Amtsgericht Berlin (Charlottenburg)",
      "registernummer": "HRB 221358",
      "registerart": "HRB",
      "company_name": "triplecore C2 GmbH",
      "company_seat": "Berlin",
      "details": "09.05.2025 (Bekanntmachungsdatum)\n\nBerlin Amtsgericht Berlin (Charlottenburg) HRB 221358\nRegisterbekanntmachung nach dem Umwandlungsgesetz 06.05.2025 (Eintragungsdatum)\n\ntriplecore C2 GmbH\nGesellschaft mit beschränkter Haftung\nBerlin\n\nZu Eintragungsnummer 4 vom 06.05.2025 wird als nicht eingetragen veröffentlicht:Den Gläubigern der an der Verschmelzung beteiligten Rechtsträger ist, wenn sie binnen sechs Monaten nach dem Tag, an dem die Eintragung der Verschmelzung in das Register des Sitzes desjenigen Rechtsträgers, dessen Gläubiger sie sind, als bekannt gemacht gilt, ihren Anspruch nach Grund und Höhe schriftlich anmelden, Sicherheit zu leisten, soweit sie nicht Befriedigung verlangen können. Dieses Recht steht den Gläubigern jedoch nur zu, wenn sie glaubhaft machen, dass durch die Verschmelzung die Erfüllung ihrer Forderung gefährdet wird. Das Recht, Sicherheitsleistung zu verlangen, steht Gläubigern nicht zu, die im Falle der Insolvenz ein Recht auf vorzugsweise Befriedigung aus einer Deckungsmasse haben, die nach gesetzlicher Vorschrift zu ihrem Schutz errichtet und staatlich überwacht ist."
    },
    {
      "date": "2025-05-09",
      "id": "108555",
      "original_text": "Registerbekanntmachung nach dem Umwandlungsgesetz\nSaarland Amtsgericht Saarbrücken HRB 107546\nGC EG 2 Deutschland GmbH – Saarbrücken",
      "type": "Registerbekanntmachung nach dem Umwandlungsgesetz",
      "state": "Saarland",
      "amtsgericht": "Amtsgericht Saarbrücken",
      "registernummer": "HRB 107546",
      "registerart": "HRB",
      "company_name": "GC EG 2 Deutschland GmbH",
      "company_seat": "Saarbrücken",
      "details": "09.05.2025 (Bekanntmachungsdatum)\n\nSaarland Amtsgericht Saarbrücken HRB 107546\nRegisterbekanntmachung nach dem Umwandlungsgesetz 09.05.2025 (Eintragungsdatum)\n\nGC EG 2 Deutschland GmbH\nGesellschaft mit beschränkter Haftung\nSaarbrücken\n\nAls nicht eingetragen wird bekannt gemacht: Den Gläubigern der an der Verschmelzung beteiligten Gesellschaften ist, wenn sie binnen sechs Monaten nach dem Tag, an dem die Eintragung der Verschmelzung in das Register des Sitzes desjenigen Rechtsträgers, dessen Gläubiger sie sind, nach § 19 Absatz 3 UmwG bekannt gemacht worden ist, ihren Anspruch nach Grund und Höhe schriftlich anmelden, Sicherheit zu leisten, soweit sie nicht Befriedigung verlangen können. Dieses Recht steht den Gläubigern jedoch nur zu, wenn sie glaubhaft machen, dass durch die Verschmelzung die Erfüllung ihrer Forderung gefährdet wird."
    },
    {
      "date": "2025-05-09",
      "id": "108556",
      "original_text": "Registerbekanntmachung nach dem Umwandlungsgesetz\nBerlin Amtsgericht Berlin (Charlottenburg) HRB 242839\n8Buddy GmbH – Berlin",
      "type": "Registerbekanntmachung nach dem Umwandlungsgesetz",
      "state": "Berlin",
      "amtsgericht": "Amtsgericht Berlin (Charlottenburg)",
      "registernummer": "HRB 242839",
      "registerart": "HRB",
      "company_name": "8Buddy GmbH",
      "company_seat": "Berlin",
      "details": "09.05.2025 (Bekanntmachungsdatum)\n\nBerlin Amtsgericht Berlin (Charlottenburg) HRB 242839\nRegisterbekanntmachung nach dem Umwandlungsgesetz 06.05.2025 (Eintragungsdatum)\n\n8Buddy GmbH\nGesellschaft mit beschränkter Haftung\nBerlin\n\nZu Eintragungsnummer 3 vom 06.05.2025 wird als nicht eingetragen veröffentlicht:Den Gläubigern der an der Verschmelzung beteiligten Rechtsträger ist, wenn sie binnen sechs Monaten nach dem Tag, an dem die Eintragung der Verschmelzung in das Register des Sitzes desjenigen Rechtsträgers, dessen Gläubiger sie sind, als bekannt gemacht gilt, ihren Anspruch nach Grund und Höhe schriftlich anmelden, Sicherheit zu leisten, soweit sie nicht Befriedigung verlangen können. Dieses Recht steht den Gläubigern jedoch nur zu, wenn sie glaubhaft machen, dass durch die Verschmelzung die Erfüllung ihrer Forderung gefährdet wird. Das Recht, Sicherheitsleistung zu verlangen, steht Gläubigern nicht zu, die im Falle der Insolvenz ein Recht auf vorzugsweise Befriedigung aus einer Deckungsmasse haben, die nach gesetzlicher Vorschrift zu ihrem Schutz errichtet und staatlich überwacht ist."
    },
    {
      "date": "2025-05-09",
      "id": "108557",
      "original_text": "Registerbekanntmachung nach dem Umwandlungsgesetz\nSaarland Amtsgericht Saarbrücken HRB 108838\nGreencells Real Estate GmbH – Saarbrücken",
      "type": "Registerbekanntmachung nach dem Umwandlungsgesetz",
      "state": "Saarland",
      "amtsgericht": "Amtsgericht Saarbrücken",
      "registernummer": "HRB 108838",
      "registerart": "HRB",
      "company_name": "Greencells Real Estate GmbH",
      "company_seat": "Saarbrücken",
      "details": "09.05.2025 (Bekanntmachungsdatum)\n\nSaarland Amtsgericht Saarbrücken HRB 108838\nRegisterbekanntmachung nach dem Umwandlungsgesetz 09.05.2025 (Eintragungsdatum)\n\nGreencells Real Estate GmbH\nGesellschaft mit beschränkter Haftung\nSaarbrücken\n\nAls nicht eingetragen wird bekannt gemacht: Den Gläubigern der an der Verschmelzung beteiligten Gesellschaften ist, wenn sie binnen sechs Monaten nach dem Tag, an dem die Eintragung der Verschmelzung in das Register des Sitzes desjenigen Rechtsträgers, dessen Gläubiger sie sind, nach § 19 Absatz 3 UmwG bekannt gemacht worden ist, ihren Anspruch nach Grund und Höhe schriftlich anmelden, Sicherheit zu leisten, soweit sie nicht Befriedigung verlangen können. Dieses Recht steht den Gläubigern jedoch nur zu, wenn sie glaubhaft machen, dass durch die Verschmelzung die Erfüllung ihrer Forderung gefährdet wird."
    },
    {
      "date": "2025-05-09",
      "id": "108558",
      "original_text": "Registerbekanntmachung nach dem Umwandlungsgesetz\nSchleswig-Holstein Amtsgericht Lübeck HRB 5054\nMACH Aktiengesellschaft – Lübeck",
      "type": "Registerbekanntmachung nach dem Umwandlungsgesetz",
      "state": "Schleswig-Holstein",
      "amtsgericht": "Amtsgericht Lübeck",
      "registernummer": "HRB 5054",
      "registerart": "HRB",
      "company_name": "MACH Aktiengesellschaft",
      "company_seat": "Lübeck",
      "details": "09.05.2025 (Bekanntmachungsdatum)\n\nSchleswig-Holstein Amtsgericht Lübeck HRB 5054\nRegisterbekanntmachung nach dem Umwandlungsgesetz 08.05.2025 (Eintragungsdatum)\n\nMACH Aktiengesellschaft\nAktiengesellschaft\nLübeck\n\nZu Eintragungsnummer 65 vom 08.05.2025 wird als nicht eingetragen veröffentlicht: Den Gläubigern der an der Verschmelzung beteiligten Rechtsträger ist, wenn sie binnen sechs Monaten nach dem Tag, an dem die Eintragung der Verschmelzung in das Register des Sitzes desjenigen Rechtsträgers, dessen Gläubiger sie sind, als bekannt gemacht gilt, ihren Anspruch nach Grund und Höhe schriftlich anmelden, Sicherheit zu leisten, soweit sie nicht Befriedigung verlangen können. Dieses Recht steht den Gläubigern jedoch nur zu, wenn sie glaubhaft machen, dass durch die Verschmelzung die Erfüllung ihrer Forderung gefährdet wird."
    },
    {
      "date": "2025-05-09",
      "id": "108559",
      "original_text": "Registerbekanntmachung nach dem Umwandlungsgesetz\nBerlin Amtsgericht Berlin (Charlottenburg) HRA 64248\nProjekt Lane EOOD & Co. KG – Berlin",
      "type": "Registerbekanntmachung nach dem Umwandlungsgesetz",
      "state": "Berlin",
      "amtsgericht": "Amtsgericht Berlin (Charlottenburg)",
      "registernummer": "HRA 64248",
      "registerart": "HRA",
      "company_name": "Projekt Lane EOOD & Co. KG",
      "company_seat": "Berlin",
      "details": "09.05.2025 (Bekanntmachungsdatum)\n\nBerlin Amtsgericht Berlin (Charlottenburg) HRA 64248\nRegisterbekanntmachung nach dem Umwandlungsgesetz 07.05.2025 (Eintragungsdatum)\n\nProjekt Lane EOOD & Co. KG\nKommanditgesellschaft\nBerlin\n\nZu Eintragungsnummer 1 vom 07.05.2025 wird als nicht eingetragen veröffentlicht: Den Gläubigern ist, wenn sie binnen sechs Monaten nach dem Tag, an dem die Eintragung der Umwandlung als bekannt gemacht gilt, ihren Anspruch nach Grund und Höhe schriftlich anmelden, Sicherheit zu leisten, soweit sie nicht Befriedigung verlangen können. Dieses Recht steht den Gläubigern jedoch nur zu, wenn sie glaubhaft machen, dass durch die Umwandlung die Erfüllung ihrer Forderung gefährdet wird. Das Recht, Sicherheitsleistung zu verlangen, steht Gläubigern nicht zu, die im Falle der Insolvenz ein Recht auf vorzugsweise Befriedigung aus einer Deckungsmasse haben, die nach gesetzlicher Vorschrift zu ihrem Schutz errichtet und staatlich überwacht ist."
    },
    {
      "date": "2025-05-09",
      "id": "108560",
      "original_text": "Registerbekanntmachung nach dem Umwandlungsgesetz\nMecklenburg-Vorpommern Amtsgericht Neubrandenburg HRB 21925\nFischerdienst Deutschland GmbH – Röbel/Müritz",
      "type": "Registerbekanntmachung nach dem Umwandlungsgesetz",
      "state": "Mecklenburg-Vorpommern",
      "amtsgericht": "Amtsgericht Neubrandenburg",
      "registernummer": "HRB 21925",
      "registerart": "HRB",
      "company_name": "Fischerdienst Deutschland GmbH",
      "company_seat": "Röbel/Müritz",
      "details": "09.05.2025 (Bekanntmachungsdatum)\n\nMecklenburg-Vorpommern Amtsgericht Neubrandenburg HRB 21925\nRegisterbekanntmachung nach dem Umwandlungsgesetz 09.05.2025 (Eintragungsdatum)\n\nFischerdienst Deutschland GmbH\nGesellschaft mit beschränkter Haftung\nRöbel/Müritz\n\nDie Gesellschaft hat Gläubigern, deren Forderungen vor dieser Bekanntmachung begründet worden sind, Sicherheit zu leisten, soweit sie nicht Befriedigung verlangen können, wenn sie sich binnen sechs Monaten zu diesem Zweck melden.Als nicht eingetragen wird veröffentlicht: Den Gläubigern der an der Verschmelzung beteiligten Rechtsträger ist, wenn sie binnen sechs Monaten nach dem Tag, an dem die Eintragung der Verschmelzung in das Register des Sitzes desjenigen Rechtsträgers, dessen Gläubiger sie sind, nach § 19 Abs. 3 UmwG als bekannt gemacht gilt,\nihren Anspruch nach Grund und Höhe in Textform anmelden, Sicherheit zu leisten, soweit sie nicht Befriedigung verlangen können. Dieses Recht steht den Gläubigern jedoch nur zu, wenn sie glaubhaft machen, dass durch die Verschmelzung die Erfüllung der Forderung gefährdet wird."
    },
    {
      "date": "2025-05-09",
      "id": "108561",
      "original_text": "Registerbekanntmachung nach dem Umwandlungsgesetz\nSachsen-Anhalt Amtsgericht Stendal HRB 28206\nRotstern Geschäftsführungs-GmbH – Weißenfels",
      "type": "Registerbekanntmachung nach dem Umwandlungsgesetz",
      "state": "Sachsen-Anhalt",
      "amtsgericht": "Amtsgericht Stendal",
      "registernummer": "HRB 28206",
      "registerart": "HRB",
      "company_name": "Rotstern Geschäftsführungs-GmbH",
      "company_seat": "Weißenfels",
      "details": "09.05.2025 (Bekanntmachungsdatum)\n\nSachsen-Anhalt Amtsgericht Stendal HRB 28206\nRegisterbekanntmachung nach dem Umwandlungsgesetz 09.05.2025 (Eintragungsdatum)\n\nRotstern Geschäftsführungs-GmbH\nGesellschaft mit beschränkter Haftung\nWeißenfels\n\nNicht eingetragen:\nDen Gläubigern der an der Verschmelzung beteiligten Rechtsträger ist, wenn sie binnen sechs Monaten nach dem Tag, an dem die Eintragung der Verschmelzung nach § 19 Abs. 3 UmwG als bekanntgemacht gilt, ihren Anspruch nach Grund und Höhe schriftlich anmelden, Sicherheit zu leisten, soweit sie nicht Befriedigung verlangen können. Dieses Recht steht ihnen jedoch nur zu, wenn sie glaubhaft machen, dass durch die Verschmelzung die Erfüllung ihrer Forderung gefährdet wird."
    },
    {
      "date": "2025-05-09",
      "id": "108562",
      "original_text": "Registerbekanntmachung nach dem Umwandlungsgesetz\nSachsen-Anhalt Amtsgericht Stendal HRB 113850\nArgenta Schokoladenmanufaktur GmbH – Weißenfels",
      "type": "Registerbekanntmachung nach dem Umwandlungsgesetz",
      "state": "Sachsen-Anhalt",
      "amtsgericht": "Amtsgericht Stendal",
      "registernummer": "HRB 113850",
      "registerart": "HRB",
      "company_name": "Argenta Schokoladenmanufaktur GmbH",
      "company_seat": "Weißenfels",
      "details": "09.05.2025 (Bekanntmachungsdatum)\n\nSachsen-Anhalt Amtsgericht Stendal HRB 113850\nRegisterbekanntmachung nach dem Umwandlungsgesetz 09.05.2025 (Eintragungsdatum)\n\nArgenta Schokoladenmanufaktur GmbH\nGesellschaft mit beschränkter Haftung\nWeißenfels\n\nNicht eingetragen:\nDen Gläubigern der an der Verschmelzung beteiligten Rechtsträger ist, wenn sie binnen sechs Monaten nach dem Tag, an dem die Eintragung der Verschmelzung nach § 19 Abs. 3 UmwG als bekanntgemacht gilt, ihren Anspruch nach Grund und Höhe schriftlich anmelden, Sicherheit zu leisten, soweit sie nicht Befriedigung verlangen können. Dieses Recht steht ihnen jedoch nur zu, wenn sie glaubhaft machen, dass durch die Verschmelzung die Erfüllung ihrer Forderung gefährdet wird."
    },
    {
      "date": "2025-05-09",
      "id": "108563",
      "original_text": "Registerbekanntmachung nach dem Umwandlungsgesetz\nSachsen-Anhalt Amtsgericht Stendal HRA 6308\nRotstern Schokoladen GmbH & Co. KG – Weißenfels",
      "type": "Registerbekanntmachung nach dem Umwandlungsgesetz",
      "state": "Sachsen-Anhalt",
      "amtsgericht": "Amtsgericht Stendal",
      "registernummer": "HRA 6308",
      "registerart": "HRA",
      "company_name": "Rotstern Schokoladen GmbH & Co. KG",
      "company_seat": "Weißenfels",
      "details": "09.05.2025 (Bekanntmachungsdatum)\n\nSachsen-Anhalt Amtsgericht Stendal HRA 6308\nRegisterbekanntmachung nach dem Umwandlungsgesetz 09.05.2025 (Eintragungsdatum)\n\nRotstern Schokoladen GmbH & Co. KG\nKommanditgesellschaft\nWeißenfels\n\nNicht eingetragen:\nDen Gläubigern der an der Verschmelzung beteiligten Rechtsträger ist, wenn sie binnen sechs Monaten nach dem Tag, an dem die Eintragung der Verschmelzung nach § 19 Abs. 3 UmwG als bekanntgemacht gilt, ihren Anspruch nach Grund und Höhe schriftlich anmelden, Sicherheit zu leisten, soweit sie nicht Befriedigung verlangen können. Dieses Recht steht ihnen jedoch nur zu, wenn sie glaubhaft machen, dass durch die Verschmelzung die Erfüllung ihrer Forderung gefährdet wird."
    },
    {
      "date": "2025-05-09",
      "id": "108564",
      "original_text": "Registerbekanntmachung nach dem Umwandlungsgesetz\nHamburg Amtsgericht Hamburg HRA 121670\nSecura-Personal Dienstleistungs- und Service GmbH & Co. KG – Hamburg",
      "type": "Registerbekanntmachung nach dem Umwandlungsgesetz",
      "state": "Hamburg",
      "amtsgericht": "Amtsgericht Hamburg",
      "registernummer": "HRA 121670",
      "registerart": "HRA",
      "company_name": "Secura-Personal Dienstleistungs- und Service GmbH & Co. KG",
      "company_seat": "Hamburg",
      "details": "09.05.2025 (Bekanntmachungsdatum)\n\nHamburg Amtsgericht Hamburg HRA 121670\nRegisterbekanntmachung nach dem Umwandlungsgesetz 08.05.2025 (Eintragungsdatum)\n\nSecura-Personal Dienstleistungs- und Service GmbH & Co. KG\nKommanditgesellschaft\nHamburg\n\nAls nicht eingetragen wird bekannt gemacht:\nDen Gläubigern der an der formwechselnden Umwandlung beteiligten Gesellschaften ist, wenn sie binnen sechs Monaten nach dem Tag, an dem die Eintragung der formwechselnden Umwandlung in das Register des Sitzes desjenigen Rechtsträgers, dessen Gläubiger sie sind, nach § 19 Absatz 3 UmwG als bekannt gemacht gilt, ihren Anspruch nach Grund und Höhe schriftlich anmelden, Sicherheit zu leisten, soweit sie nicht Befriedigung verlangen können. Dieses Recht steht den Gläubigern jedoch nur zu, wenn sie glaubhaft machen, dass durch die formwechselnde Umwandlung die Erfüllung ihrer Forderung gefährdet wird."
    },
    {
      "date": "2025-05-09",
      "id": "108565",
      "original_text": "Löschungsankündigung\nBaden-Württemberg Amtsgericht Stuttgart HRB 745805\nalsus Verwaltungs GmbH – Öhringen",
      "type": "Löschungsankündigung",
      "state": "Baden-Württemberg",
      "amtsgericht": "Amtsgericht Stuttgart",
      "registernummer": "HRB 745805",
      "registerart": "HRB",
      "company_name": "alsus Verwaltungs GmbH",
      "company_seat": "Öhringen",
      "details": "09.05.2025 (Bekanntmachungsdatum)\n\nBaden-Württemberg Amtsgericht Stuttgart HRB 745805\nLöschungsankündigung\n\nalsus Verwaltungs GmbH\nGesellschaft mit beschränkter Haftung\nÖhringen\n\nAls nicht eingetragen wird bekanntgemacht:\nDas Gericht beabsichtigt, die Gesellschaft wegen Vermögenslosigkeit im Handelsregister von Amts wegen nach § 394 FamFG zu löschen. Die Frist zur Geltendmachung eines Widerspruchs gegen die beabsichtigte Löschung ist auf zwei Monate ab Veröffentlichung bestimmt."
    },
    {
      "date": "2025-05-09",
      "id": "108566",
      "original_text": "Löschungsankündigung\nBaden-Württemberg Amtsgericht Stuttgart HRB 725577\nH-A-N - Haus der angewandten Naturwissenschaften - Gesellschaft mbH – Esslingen am Neckar",
      "type": "Löschungsankündigung",
      "state": "Baden-Württemberg",
      "amtsgericht": "Amtsgericht Stuttgart",
      "registernummer": "HRB 725577",
      "registerart": "HRB",
      "company_name": "H-A-N - Haus der angewandten Naturwissenschaften - Gesellschaft mbH",
      "company_seat": "Esslingen am Neckar",
      "details": "09.05.2025 (Bekanntmachungsdatum)\n\nBaden-Württemberg Amtsgericht Stuttgart HRB 725577\nLöschungsankündigung 22.04.2025 (Eintragungsdatum)\n\nH-A-N - Haus der angewandten Naturwissenschaften - Gesellschaft mbH\nGesellschaft mit beschränkter Haftung\nEsslingen am Neckar\n\nDas Gericht beabsichtigt, die Gesellschaft wegen Vermögenslosigkeit im Handelsregister von Amts wegen nach § 394 FamFG zu löschen. Die Frist zur Geltendmachung eines Widerspruchs gegen die beabsichtigte Löschung ist auf zwei Monate ab Veröffentlichung bestimmt."
    },
    {
      "date": "2025-05-09",
      "id": "108567",
      "original_text": "Registerbekanntmachung nach dem Umwandlungsgesetz\nHamburg Amtsgericht Hamburg HRA 107134\nMabanol GmbH & Co. KG – Hamburg",
      "type": "Registerbekanntmachung nach dem Umwandlungsgesetz",
      "state": "Hamburg",
      "amtsgericht": "Amtsgericht Hamburg",
      "registernummer": "HRA 107134",
      "registerart": "HRA",
      "company_name": "Mabanol GmbH & Co. KG",
      "company_seat": "Hamburg",
      "details": "09.05.2025 (Bekanntmachungsdatum)\n\nHamburg Amtsgericht Hamburg HRA 107134\nRegisterbekanntmachung nach dem Umwandlungsgesetz 09.05.2025 (Eintragungsdatum)\n\nMabanol GmbH & Co. KG\nKommanditgesellschaft\nHamburg\n\nAls nicht eingetragen wird bekannt gemacht:\nDen Gläubigern der an der Verschmelzung beteiligten Gesellschaften ist, wenn sie binnen sechs Monaten nach dem Tag, an dem die Eintragung der Verschmelzung in das Register des Sitzes desjenigen Rechtsträgers, dessen Gläubiger sie sind, nach § 19 Absatz 3 UmwG als bekannt gemacht gilt, ihren Anspruch nach Grund und Höhe schriftlich anmelden, Sicherheit zu leisten, soweit sie nicht Befriedigung verlangen können. Dieses Recht steht den Gläubigern jedoch nur zu, wenn sie glaubhaft machen, dass durch die Verschmelzung die Erfüllung ihrer Forderung gefährdet wird."
    },
    {
      "date": "2025-05-09",
      "id": "108568",
      "original_text": "Registerbekanntmachung nach dem Umwandlungsgesetz\nHamburg Amtsgericht Hamburg HRB 175460\nDuraLubes GmbH – Hamburg",
      "type": "Registerbekanntmachung nach dem Umwandlungsgesetz",
      "state": "Hamburg",
      "amtsgericht": "Amtsgericht Hamburg",
      "registernummer": "HRB 175460",
      "registerart": "HRB",
      "company_name": "DuraLubes GmbH",
      "company_seat": "Hamburg",
      "details": "09.05.2025 (Bekanntmachungsdatum)\n\nHamburg Amtsgericht Hamburg HRB 175460\nRegisterbekanntmachung nach dem Umwandlungsgesetz 09.05.2025 (Eintragungsdatum)\n\nDuraLubes GmbH\nGesellschaft mit beschränkter Haftung\nHamburg\n\nAls nicht eingetragen wird bekannt gemacht:\nDen Gläubigern der an der Verschmelzung beteiligten Gesellschaften ist, wenn sie binnen sechs Monaten nach dem Tag, an dem die Eintragung der Verschmelzung in das Register des Sitzes desjenigen Rechtsträgers, dessen Gläubiger sie sind, nach § 19 Absatz 3 UmwG als bekannt gemacht gilt, ihren Anspruch nach Grund und Höhe schriftlich anmelden, Sicherheit zu leisten, soweit sie nicht Befriedigung verlangen können. Dieses Recht steht den Gläubigern jedoch nur zu, wenn sie glaubhaft machen, dass durch die Verschmelzung die Erfüllung ihrer Forderung gefährdet wird."
    },
    {
      "date": "2025-05-09",
      "id": "108569",
      "original_text": "Löschungsankündigung\nBrandenburg Amtsgericht Frankfurt/Oder HRB 18827\nEDM Portum Personaldienstleistungs GmbH – Hoppegarten",
      "type": "Löschungsankündigung",
      "state": "Brandenburg",
      "amtsgericht": "Amtsgericht Frankfurt/Oder",
      "registernummer": "HRB 18827",
      "registerart": "HRB",
      "company_name": "EDM Portum Personaldienstleistungs GmbH",
      "company_seat": "Hoppegarten",
      "details": "09.05.2025 (Bekanntmachungsdatum)\n\nBrandenburg Amtsgericht Frankfurt/Oder HRB 18827\nLöschungsankündigung\n\nEDM Portum Personaldienstleistungs GmbH\nGesellschaft mit beschränkter Haftung\nHoppegarten\n\nBei der nachstehenden Gesellschaft wird das Amtslöschungsverfahren gemäß § 394 Abs. 1 FamFG eingeleitet."
    },
    {
      "date": "2025-05-09",
      "id": "108570",
      "original_text": "Einreichung neuer Dokumente\nBaden-Württemberg Amtsgericht Mannheim HRB 330004\nHeidelberger Druckmaschinen Aktiengesellschaft – Heidelberg",
      "type": "Einreichung neuer Dokumente",
      "state": "Baden-Württemberg",
      "amtsgericht": "Amtsgericht Mannheim",
      "registernummer": "HRB 330004",
      "registerart": "HRB",
      "company_name": "Heidelberger Druckmaschinen Aktiengesellschaft",
      "company_seat": "Heidelberg",
      "details": "09.05.2025 (Bekanntmachungsdatum)\n\nBaden-Württemberg Amtsgericht Mannheim HRB 330004\nEinreichung neuer Dokumente\n\nHeidelberger Druckmaschinen Aktiengesellschaft\nAktiengesellschaft\nHeidelberg\n\nDie Gesellschaft hat am 09.05.2025 die Liste über die Zusammensetzung des Aufsichtsrats zum Handelsregister eingereicht."
    },
    {
      "date": "2025-05-09",
      "id": "108571",
      "original_text": "Sonstige Registerbekanntmachung\nBaden-Württemberg Amtsgericht Mannheim HRB 731157\nMACH ProForms GmbH – Karlsruhe",
      "type": "Sonstige Registerbekanntmachung",
      "state": "Baden-Württemberg",
      "amtsgericht": "Amtsgericht Mannheim",
      "registernummer": "HRB 731157",
      "registerart": "HRB",
      "company_name": "MACH ProForms GmbH",
      "company_seat": "Karlsruhe",
      "details": "09.05.2025 (Bekanntmachungsdatum)\n\nBaden-Württemberg Amtsgericht Mannheim HRB 731157\nSonstige Registerbekanntmachung 09.05.2025 (Eintragungsdatum)\n\nMACH ProForms GmbH\nGesellschaft mit beschränkter Haftung\nKarlsruhe\n\nAls nicht eingetragen wird bekanntgemacht:\nDen Gläubigern der Gesellschaft, deren Forderungen begründet worden sind, bevor die Eintragung der Beendigung des Vertrages in das Handelsregister nach § 10 HGB als bekanntgemacht gilt, ist vom anderen Vertragsteil Sicherheit zu leisten, wenn sie sich binnen sechs Monaten nach der Bekanntmachung zu diesem Zweck bei ihm melden."
    },
    {
      "date": "2025-05-09",
      "id": "108572",
      "original_text": "Einreichung neuer Dokumente\nBaden-Württemberg Amtsgericht Mannheim HRB 107956\nEnBW Energie Baden-Württemberg AG – Karlsruhe",
      "type": "Einreichung neuer Dokumente",
      "state": "Baden-Württemberg",
      "amtsgericht": "Amtsgericht Mannheim",
      "registernummer": "HRB 107956",
      "registerart": "HRB",
      "company_name": "EnBW Energie Baden-Württemberg AG",
      "company_seat": "Karlsruhe",
      "details": "09.05.2025 (Bekanntmachungsdatum)\n\nBaden-Württemberg Amtsgericht Mannheim HRB 107956\nEinreichung neuer Dokumente\n\nEnBW Energie Baden-Württemberg AG\nAktiengesellschaft\nKarlsruhe\n\nDie Gesellschaft hat am 09.05.2025 die Liste über die Zusammensetzung des Aufsichtsrats zum Handelsregister eingereicht."
    },
    {
      "date": "2025-05-09",
      "id": "108573",
      "original_text": "Einreichung neuer Dokumente\nBaden-Württemberg Amtsgericht Freiburg HRB 705494\nHeli AG – Emmendingen",
      "type": "Einreichung neuer Dokumente",
      "state": "Baden-Württemberg",
      "amtsgericht": "Amtsgericht Freiburg",
      "registernummer": "HRB 705494",
      "registerart": "HRB",
      "company_name": "Heli AG",
      "company_seat": "Emmendingen",
      "details": "09.05.2025 (Bekanntmachungsdatum)\n\nBaden-Württemberg Amtsgericht Freiburg HRB 705494\nEinreichung neuer Dokumente 09.05.2025 (Eintragungsdatum)\n\nHeli AG\nAktiengesellschaft\nEmmendingen\n\nDie Gesellschaft hat am 09.05.2025 die Liste über die Zusammensetzung des Aufsichtsrats zum Handelsregister eingereicht."
    },
    {
      "date": "2025-05-09",
      "id": "108574",
      "original_text": "Registerbekanntmachung nach dem Umwandlungsgesetz\nThüringen Amtsgericht Jena HRB 516336\nPollmeier Heimsheim Verwaltungs GmbH – Amt Creuzburg",
      "type": "Registerbekanntmachung nach dem Umwandlungsgesetz",
      "state": "Thüringen",
      "amtsgericht": "Amtsgericht Jena",
      "registernummer": "HRB 516336",
      "registerart": "HRB",
      "company_name": "Pollmeier Heimsheim Verwaltungs GmbH",
      "company_seat": "Amt Creuzburg",
      "details": "09.05.2025 (Bekanntmachungsdatum)\n\nThüringen Amtsgericht Jena HRB 516336\nRegisterbekanntmachung nach dem Umwandlungsgesetz 09.05.2025 (Eintragungsdatum)\n\nPollmeier Heimsheim Verwaltungs GmbH\nGesellschaft mit beschränkter Haftung\nAmt Creuzburg\n\nNicht eingetragen: Den Gläubigern der an der Verschmelzung beteiligten Rechtsträger, ist wenn sie binnen sechs Monaten nach dem Tag, an dem die Eintragung der Verschmelzung in das Register des Sitzes desjenigen Rechtsträgers, dessen Gläubiger sie sind,  nach § 19 Abs. 3 UmwG als bekanntgemacht gilt, ihren Anspruch nach Grund und Höhe schriftlich anmelden, Sicherheit zu leisten, soweit sie nicht Befriedigung verlangen können. Dieses Recht steht ihnen jedoch nur zu, wenn sie glaubhaft machen, daß durch die Verschmelzung die Erfüllung ihrer Forderung gefährdet wird."
    },
    {
      "date": "2025-05-09",
      "id": "108575",
      "original_text": "Registerbekanntmachung nach dem Umwandlungsgesetz\nThüringen Amtsgericht Jena HRB 501018\nPollmeier Massivholz Verwaltungs GmbH – Amt Creuzburg",
      "type": "Registerbekanntmachung nach dem Umwandlungsgesetz",
      "state": "Thüringen",
      "amtsgericht": "Amtsgericht Jena",
      "registernummer": "HRB 501018",
      "registerart": "HRB",
      "company_name": "Pollmeier Massivholz Verwaltungs GmbH",
      "company_seat": "Amt Creuzburg",
      "details": "09.05.2025 (Bekanntmachungsdatum)\n\nThüringen Amtsgericht Jena HRB 501018\nRegisterbekanntmachung nach dem Umwandlungsgesetz 09.05.2025 (Eintragungsdatum)\n\nPollmeier Massivholz Verwaltungs GmbH\nGesellschaft mit beschränkter Haftung\nAmt Creuzburg\n\nNicht eingetragen: Den Gläubigern der an der Verschmelzung beteiligten Rechtsträger, ist wenn sie binnen sechs Monaten nach dem Tag, an dem die Eintragung der Verschmelzung in das Register des Sitzes desjenigen Rechtsträgers, dessen Gläubiger sie sind,  nach § 19 Abs. 3 UmwG als bekanntgemacht gilt, ihren Anspruch nach Grund und Höhe schriftlich anmelden, Sicherheit zu leisten, soweit sie nicht Befriedigung verlangen können. Dieses Recht steht ihnen jedoch nur zu, wenn sie glaubhaft machen, daß durch die Verschmelzung die Erfüllung ihrer Forderung gefährdet wird."
    },
    {
      "date": "2025-05-09",
      "id": "108576",
      "original_text": "Löschungsankündigung\nThüringen Amtsgericht Jena HRB 508984\nBBS Bad Salzungen UG (haftungsbeschränkt) – Bad Salzungen",
      "type": "Löschungsankündigung",
      "state": "Thüringen",
      "amtsgericht": "Amtsgericht Jena",
      "registernummer": "HRB 508984",
      "registerart": "HRB",
      "company_name": "BBS Bad Salzungen UG (haftungsbeschränkt)",
      "company_seat": "Bad Salzungen",
      "details": "09.05.2025 (Bekanntmachungsdatum)\n\nThüringen Amtsgericht Jena HRB 508984\nLöschungsankündigung\n\nBBS Bad Salzungen UG (haftungsbeschränkt)\nGesellschaft mit beschränkter Haftung\nBad Salzungen\n\nDas Registergericht beabsichtigt, die im Handelsregister eingetragene Gesellschaft wegen Vermögenslosigkeit nach § 394 FamFG von Amts wegen zu löschen. Die Frist zur Erhebung eines Widerspruchs gegen die beabsichtigte Löschung wird auf 6 Wochen festgesetzt."
    },
    {
      "date": "2025-05-09",
      "id": "108577",
      "original_text": "Löschungsankündigung\nThüringen Amtsgericht Jena HRB 506557\nMöve equipment & design GmbH – Mühlhausen",
      "type": "Löschungsankündigung",
      "state": "Thüringen",
      "amtsgericht": "Amtsgericht Jena",
      "registernummer": "HRB 506557",
      "registerart": "HRB",
      "company_name": "Möve equipment & design GmbH",
      "company_seat": "Mühlhausen",
      "details": "09.05.2025 (Bekanntmachungsdatum)\n\nThüringen Amtsgericht Jena HRB 506557\nLöschungsankündigung\n\nMöve equipment & design GmbH\nGesellschaft mit beschränkter Haftung\nMühlhausen\n\nDas Registergericht beabsichtigt, die im Handelsregister eingetragene Gesellschaft wegen Vermögenslosigkeit nach § 394 FamFG von Amts wegen zu löschen. Die Frist zur Erhebung eines Widerspruchs gegen die beabsichtigte Löschung wird auf 6 Wochen festgesetzt."
    },
    {
      "date": "2025-05-09",
      "id": "108578",
      "original_text": "Löschungsankündigung\nBrandenburg Amtsgericht Frankfurt/Oder VR 6829\nVerein der Freunde des Angelhains e.V. – Schorfheide",
      "type": "Löschungsankündigung",
      "state": "Brandenburg",
      "amtsgericht": "Amtsgericht Frankfurt/Oder",
      "registernummer": "VR 6829",
      "registerart": "VR",
      "company_name": "Verein der Freunde des Angelhains e.V.",
      "company_seat": "Schorfheide",
      "details": "09.05.2025 (Bekanntmachungsdatum)\n\nBrandenburg Amtsgericht Frankfurt/Oder VR 6829\nLöschungsankündigung\n\nVerein der Freunde des Angelhains e.V.\neingetragener Verein\nSchorfheide\n\nBei der nachstehenden Gesellschaft/dem nachstehenden Verein wird das Amtslöschungsverfahren gemäß § 395 FamFG eingeleitet."
    },
    {
      "date": "2025-05-09",
      "id": "108579",
      "original_text": "Löschungsankündigung\nBerlin Amtsgericht Berlin (Charlottenburg) HRA 51563\nRWL Rheinisch Westfälische Leasing GmbH & Co. KG – Berlin",
      "type": "Löschungsankündigung",
      "state": "Berlin",
      "amtsgericht": "Amtsgericht Berlin (Charlottenburg)",
      "registernummer": "HRA 51563",
      "registerart": "HRA",
      "company_name": "RWL Rheinisch Westfälische Leasing GmbH & Co. KG",
      "company_seat": "Berlin",
      "details": "09.05.2025 (Bekanntmachungsdatum)\n\nBerlin Amtsgericht Berlin (Charlottenburg) HRA 51563\nLöschungsankündigung\n\nRWL Rheinisch Westfälische Leasing GmbH & Co. KG\nKommanditgesellschaft\nBerlin\n\nBei dem nachstehenden Unternehmen / der nachstehenden Gesellschaft wird das Amtslöschungsverfahren gemäß § 31 Abs. 2 HGB eingeleitet. Widerspruchsfrist 2 Monate"
    },
    {
      "date": "2025-05-09",
      "id": "108580",
      "original_text": "Registerbekanntmachung nach dem Umwandlungsgesetz\nHamburg Amtsgericht Hamburg HRB 139583\nStührk Delikatessen GmbH – Hamburg",
      "type": "Registerbekanntmachung nach dem Umwandlungsgesetz",
      "state": "Hamburg",
      "amtsgericht": "Amtsgericht Hamburg",
      "registernummer": "HRB 139583",
      "registerart": "HRB",
      "company_name": "Stührk Delikatessen GmbH",
      "company_seat": "Hamburg",
      "details": "09.05.2025 (Bekanntmachungsdatum)\n\nHamburg Amtsgericht Hamburg HRB 139583\nRegisterbekanntmachung nach dem Umwandlungsgesetz 09.05.2025 (Eintragungsdatum)\n\nStührk Delikatessen GmbH\nGesellschaft mit beschränkter Haftung\nHamburg\n\nAls nicht eingetragen wird bekannt gemacht:\nDen Gläubigern der an der Verschmelzung beteiligten Gesellschaften ist, wenn sie binnen sechs Monaten nach dem Tag, an dem die Eintragung der Verschmelzung in das Register des Sitzes desjenigen Rechtsträgers, dessen Gläubiger sie sind, nach § 19 Absatz 3 UmwG als bekannt gemacht gilt, ihren Anspruch nach Grund und Höhe schriftlich anmelden, Sicherheit zu leisten, soweit sie nicht Befriedigung verlangen können. Dieses Recht steht den Gläubigern jedoch nur zu, wenn sie glaubhaft machen, dass durch die Verschmelzung die Erfüllung ihrer Forderung gefährdet wird."
    },
    {
      "date": "2025-05-09",
      "id": "108581",
      "original_text": "Registerbekanntmachung nach dem Umwandlungsgesetz\nBerlin Amtsgericht Berlin (Charlottenburg) HRA 63763\nSommerfeldt Versicherungsagentur UG & Co. KG – Berlin",
      "type": "Registerbekanntmachung nach dem Umwandlungsgesetz",
      "state": "Berlin",
      "amtsgericht": "Amtsgericht Berlin (Charlottenburg)",
      "registernummer": "HRA 63763",
      "registerart": "HRA",
      "company_name": "Sommerfeldt Versicherungsagentur UG & Co. KG",
      "company_seat": "Berlin",
      "details": "09.05.2025 (Bekanntmachungsdatum)\n\nBerlin Amtsgericht Berlin (Charlottenburg) HRA 63763\nRegisterbekanntmachung nach dem Umwandlungsgesetz 07.05.2025 (Eintragungsdatum)\n\nSommerfeldt Versicherungsagentur UG & Co. KG\nKommanditgesellschaft\nBerlin\n\nZu Eintragungsnummer 3 vom 07.05.2025 wird als nicht eingetragen veröffentlicht: Den Gläubigern der an der Spaltung beteiligten Rechtsträger ist, wenn sie binnen sechs Monaten nach dem Tag, an dem die Eintragung der Spaltung in das Register des Sitzes desjenigen Rechtsträgers, dessen Gläubiger sie sind, als bekannt gemacht gilt, ihren Anspruch nach Grund und Höhe schriftlich anmelden, Sicherheit zu leisten, soweit sie nicht Befriedigung verlangen können. Dieses Recht steht den Gläubigern jedoch nur zu, wenn sie glaubhaft machen, dass durch die Spaltung die Erfüllung ihrer Forderung gefährdet wird. Das Recht, Sicherheitsleistung zu verlangen, steht Gläubigern nicht zu, die im Falle der Insolvenz ein Recht auf vorzugsweise Befriedigung aus einer Deckungsmasse haben, die nach gesetzlicher Vorschrift zu ihrem Schutz errichtet und staatlich überwacht ist."
    },
    {
      "date": "2025-05-09",
      "id": "108582",
      "original_text": "Registerbekanntmachung nach dem Umwandlungsgesetz\nHamburg Amtsgericht Hamburg HRA 132313\nSFB Sabine Schumann e.K. – Hamburg",
      "type": "Registerbekanntmachung nach dem Umwandlungsgesetz",
      "state": "Hamburg",
      "amtsgericht": "Amtsgericht Hamburg",
      "registernummer": "HRA 132313",
      "registerart": "HRA",
      "company_name": "SFB Sabine Schumann e.K.",
      "company_seat": "Hamburg",
      "details": "09.05.2025 (Bekanntmachungsdatum)\n\nHamburg Amtsgericht Hamburg HRA 132313\nRegisterbekanntmachung nach dem Umwandlungsgesetz 09.05.2025 (Eintragungsdatum)\n\nSFB Sabine Schumann e.K.\nEinzelkaufmann\nHamburg\n\nAls nicht eingetragen wird bekannt gemacht:\nDen Gläubigern der an der Ausgliederung beteiligten Gesellschaften ist, wenn sie binnen sechs Monaten nach dem Tag, an dem die Eintragung der Ausgliederung in das Register des Sitzes desjenigen Rechtsträgers, dessen Gläubiger sie sind, nach § 19 Absatz 3 UmwG als bekannt gemacht gilt, ihren Anspruch nach Grund und Höhe schriftlich anmelden, Sicherheit zu leisten, soweit sie nicht Befriedigung verlangen können. Dieses Recht steht den Gläubigern jedoch nur zu, wenn sie glaubhaft machen, dass durch die Ausgliederung die Erfüllung ihrer Forderung gefährdet wird."
    },
    {
      "date": "2025-05-09",
      "id": "108583",
      "original_text": "Registerbekanntmachung nach dem Umwandlungsgesetz\nHamburg Amtsgericht Hamburg HRB 192408\nSFB GmbH – Hamburg",
      "type": "Registerbekanntmachung nach dem Umwandlungsgesetz",
      "state": "Hamburg",
      "amtsgericht": "Amtsgericht Hamburg",
      "registernummer": "HRB 192408",
      "registerart": "HRB",
      "company_name": "SFB GmbH",
      "company_seat": "Hamburg",
      "details": "09.05.2025 (Bekanntmachungsdatum)\n\nHamburg Amtsgericht Hamburg HRB 192408\nRegisterbekanntmachung nach dem Umwandlungsgesetz 09.05.2025 (Eintragungsdatum)\n\nSFB GmbH\nGesellschaft mit beschränkter Haftung\nHamburg\n\nAls nicht eingetragen wird bekannt gemacht:\nDen Gläubigern der an der Ausgliederung beteiligten Gesellschaften ist, wenn sie binnen sechs Monaten nach dem Tag, an dem die Eintragung der Ausgliederung in das Register des Sitzes desjenigen Rechtsträgers, dessen Gläubiger sie sind, nach § 19 Absatz 3 UmwG als bekannt gemacht gilt, ihren Anspruch nach Grund und Höhe schriftlich anmelden, Sicherheit zu leisten, soweit sie nicht Befriedigung verlangen können. Dieses Recht steht den Gläubigern jedoch nur zu, wenn sie glaubhaft machen, dass durch die Ausgliederung die Erfüllung ihrer Forderung gefährdet wird."
    },
    {
      "date": "2025-05-09",
      "id": "108584",
      "original_text": "Registerbekanntmachung nach dem Umwandlungsgesetz\nHamburg Amtsgericht Hamburg HRB 82484\nSPARK Invest GmbH – Hamburg",
      "type": "Registerbekanntmachung nach dem Umwandlungsgesetz",
      "state": "Hamburg",
      "amtsgericht": "Amtsgericht Hamburg",
      "registernummer": "HRB 82484",
      "registerart": "HRB",
      "company_name": "SPARK Invest GmbH",
      "company_seat": "Hamburg",
      "details": "09.05.2025 (Bekanntmachungsdatum)\n\nHamburg Amtsgericht Hamburg HRB 82484\nRegisterbekanntmachung nach dem Umwandlungsgesetz 09.05.2025 (Eintragungsdatum)\n\nSPARK Invest GmbH\nGesellschaft mit beschränkter Haftung\nHamburg\n\nAls nicht eingetragen wird bekannt gemacht:\nDen Gläubigern der an der Verschmelzung beteiligten Gesellschaften ist, wenn sie binnen sechs Monaten nach dem Tag, an dem die Eintragung der Verschmelzung in das Register des Sitzes desjenigen Rechtsträgers, dessen Gläubiger sie sind, nach § 19 Absatz 3 UmwG als bekannt gemacht gilt, ihren Anspruch nach Grund und Höhe schriftlich anmelden, Sicherheit zu leisten, soweit sie nicht Befriedigung verlangen können. Dieses Recht steht den Gläubigern jedoch nur zu, wenn sie glaubhaft machen, dass durch die Verschmelzung die Erfüllung ihrer Forderung gefährdet wird."
    },
    {
      "date": "2025-05-09",
      "id": "108585",
      "original_text": "Registerbekanntmachung nach dem Umwandlungsgesetz\nHamburg Amtsgericht Hamburg HRB 187466\n3F Services UG (haftungsbeschränkt) – Hamburg",
      "type": "Registerbekanntmachung nach dem Umwandlungsgesetz",
      "state": "Hamburg",
      "amtsgericht": "Amtsgericht Hamburg",
      "registernummer": "HRB 187466",
      "registerart": "HRB",
      "company_name": "3F Services UG (haftungsbeschränkt)",
      "company_seat": "Hamburg",
      "details": "09.05.2025 (Bekanntmachungsdatum)\n\nHamburg Amtsgericht Hamburg HRB 187466\nRegisterbekanntmachung nach dem Umwandlungsgesetz 09.05.2025 (Eintragungsdatum)\n\n3F Services UG (haftungsbeschränkt)\nGesellschaft mit beschränkter Haftung\nHamburg\n\nAls nicht eingetragen wird bekannt gemacht:\nDen Gläubigern der an der Verschmelzung beteiligten Gesellschaften ist, wenn sie binnen sechs Monaten nach dem Tag, an dem die Eintragung der Verschmelzung in das Register des Sitzes desjenigen Rechtsträgers, dessen Gläubiger sie sind, nach § 19 Absatz 3 UmwG als bekannt gemacht gilt, ihren Anspruch nach Grund und Höhe schriftlich anmelden, Sicherheit zu leisten, soweit sie nicht Befriedigung verlangen können. Dieses Recht steht den Gläubigern jedoch nur zu, wenn sie glaubhaft machen, dass durch die Verschmelzung die Erfüllung ihrer Forderung gefährdet wird."
    },
    {
      "date": "2025-05-09",
      "id": "108586",
      "original_text": "Löschungsankündigung\nBrandenburg Amtsgericht Frankfurt/Oder HRB 20180\nTaverna Gastro Berlin GmbH – Eisenhüttenstadt",
      "type": "Löschungsankündigung",
      "state": "Brandenburg",
      "amtsgericht": "Amtsgericht Frankfurt/Oder",
      "registernummer": "HRB 20180",
      "registerart": "HRB",
      "company_name": "Taverna Gastro Berlin GmbH",
      "company_seat": "Eisenhüttenstadt",
      "details": "09.05.2025 (Bekanntmachungsdatum)\n\nBrandenburg Amtsgericht Frankfurt/Oder HRB 20180\nLöschungsankündigung\n\nTaverna Gastro Berlin GmbH\nGesellschaft mit beschränkter Haftung\nEisenhüttenstadt\n\nBei der nachstehenden Gesellschaft wird das Amtslöschungsverfahren gemäß § 394 FamFG eingeleitet."
    },
    {
      "date": "2025-05-09",
      "id": "108587",
      "original_text": "Registerbekanntmachung nach dem Umwandlungsgesetz\nBaden-Württemberg Amtsgericht Stuttgart HRB 780522\nERCHINGER AG – Tuttlingen",
      "type": "Registerbekanntmachung nach dem Umwandlungsgesetz",
      "state": "Baden-Württemberg",
      "amtsgericht": "Amtsgericht Stuttgart",
      "registernummer": "HRB 780522",
      "registerart": "HRB",
      "company_name": "ERCHINGER AG",
      "company_seat": "Tuttlingen",
      "details": "09.05.2025 (Bekanntmachungsdatum)\n\nBaden-Württemberg Amtsgericht Stuttgart HRB 780522\nRegisterbekanntmachung nach dem Umwandlungsgesetz\n\nERCHINGER AG\nAktiengesellschaft\nTuttlingen\n\nDie Gesellschaft hat am 29.04.2025 den Verschmelzungsvertrag vom 29.04.2025 zwischen \"Erchinger Verwaltungs-GmbH\", Tuttlingen (Amtsgericht Amtsgericht Stuttgart HRB 732953)\nund der hiesigen Gesellschaft (übertragender Rechtsträger) zum Handelsregister eingereicht."
    },
    {
      "date": "2025-05-09",
      "id": "108588",
      "original_text": "Einreichung neuer Dokumente\nBaden-Württemberg Amtsgericht Stuttgart HRB 780522\nERCHINGER AG – Tuttlingen",
      "type": "Einreichung neuer Dokumente",
      "state": "Baden-Württemberg",
      "amtsgericht": "Amtsgericht Stuttgart",
      "registernummer": "HRB 780522",
      "registerart": "HRB",
      "company_name": "ERCHINGER AG",
      "company_seat": "Tuttlingen",
      "details": "09.05.2025 (Bekanntmachungsdatum)\n\nBaden-Württemberg Amtsgericht Stuttgart HRB 780522\nEinreichung neuer Dokumente\n\nERCHINGER AG\nAktiengesellschaft\nTuttlingen\n\nDie Gesellschaft hat am 29.04.2025 die Liste über die Zusammensetzung des Aufsichtsrats zum Handelsregister eingereicht."
    },
    {
      "date": "2025-05-09",
      "id": "108589",
      "original_text": "Einreichung neuer Dokumente\nHamburg Amtsgericht Hamburg HRB 168009\nEMobG Services Germany GmbH – Hamburg",
      "type": "Einreichung neuer Dokumente",
      "state": "Hamburg",
      "amtsgericht": "Amtsgericht Hamburg",
      "registernummer": "HRB 168009",
      "registerart": "HRB",
      "company_name": "EMobG Services Germany GmbH",
      "company_seat": "Hamburg",
      "details": "09.05.2025 (Bekanntmachungsdatum)\n\nHamburg Amtsgericht Hamburg HRB 168009\nEinreichung neuer Dokumente\n\nEMobG Services Germany GmbH\nGesellschaft mit beschränkter Haftung\nHamburg\n\nAls nicht eingetragen wird bekannt gemacht: Liste des Aufsichtsrats wurde eingereicht."
    },
    {
      "date": "2025-05-09",
      "id": "108590",
      "original_text": "Registerbekanntmachung nach dem Umwandlungsgesetz\nBaden-Württemberg Amtsgericht Mannheim HRA 712379\nJasmin Pfeifer e.K. – 77833 Ottersweier",
      "type": "Registerbekanntmachung nach dem Umwandlungsgesetz",
      "state": "Baden-Württemberg",
      "amtsgericht": "Amtsgericht Mannheim",
      "registernummer": "HRA 712379",
      "registerart": "HRA",
      "company_name": "Jasmin Pfeifer e.K.",
      "company_seat": "77833 Ottersweier",
      "details": "09.05.2025 (Bekanntmachungsdatum)\n\nBaden-Württemberg Amtsgericht Mannheim HRA 712379\nRegisterbekanntmachung nach dem Umwandlungsgesetz 09.05.2025 (Eintragungsdatum)\n\nJasmin Pfeifer e.K.\nEinzelkaufmann / Einzelkauffrau\n77833 Ottersweier\n\nDen Gläubigern der an der Ausgliederung beteiligten Rechtsträger ist, wenn sie binnen sechs Monaten nach dem Tag, an dem die Eintragung der Ausgliederung in das Register des Sitzes desjenigen Rechtsträgers, dessen Gläubiger sie sind, nach § 19 Abs. 3 UmwG als bekanntgemacht gilt, ihren Anspruch nach Grund und Höhe schriftlich anmelden, Sicherheit zu leisten, soweit sie nicht Befriedigung verlangen können. Dieses Recht steht den Gläubigern jedoch nur zu, wenn sie glaubhaft machen, dass durch die Ausgliederung die Erfüllung ihrer Forderung gefährdet wird."
    },
    {
      "date": "2025-05-09",
      "id": "108591",
      "original_text": "Registerbekanntmachung nach dem Umwandlungsgesetz\nBaden-Württemberg Amtsgericht Stuttgart HRB 794220\ntrunte.it GmbH – Haiterbach",
      "type": "Registerbekanntmachung nach dem Umwandlungsgesetz",
      "state": "Baden-Württemberg",
      "amtsgericht": "Amtsgericht Stuttgart",
      "registernummer": "HRB 794220",
      "registerart": "HRB",
      "company_name": "trunte.it GmbH",
      "company_seat": "Haiterbach",
      "details": "09.05.2025 (Bekanntmachungsdatum)\n\nBaden-Württemberg Amtsgericht Stuttgart HRB 794220\nRegisterbekanntmachung nach dem Umwandlungsgesetz 09.05.2025 (Eintragungsdatum)\n\ntrunte.it GmbH\nGesellschaft mit beschränkter Haftung\nHaiterbach\n\nDen Gläubigern der an der Ausgliederung beteiligten Rechtsträger ist, wenn sie binnen sechs Monaten nach dem Tag, an dem die Eintragung der Ausgliederung in das Register des Sitzes desjenigen Rechtsträgers, dessen Gläubiger sie sind, nach § 19 Abs. 3 UmwG als bekanntgemacht gilt, ihren Anspruch nach Grund und Höhe schriftlich anmelden, Sicherheit zu leisten, soweit sie nicht Befriedigung verlangen können. Dieses Recht steht den Gläubigern jedoch nur zu, wenn sie glaubhaft machen, dass durch die Ausgliederung die Erfüllung ihrer Forderung gefährdet wird."
    },
    {
      "date": "2025-05-09",
      "id": "108592",
      "original_text": "Registerbekanntmachung nach dem Umwandlungsgesetz\nBerlin Amtsgericht Berlin (Charlottenburg) HRB 194012\nAshura 10. Objektverwaltungs GmbH – Berlin",
      "type": "Registerbekanntmachung nach dem Umwandlungsgesetz",
      "state": "Berlin",
      "amtsgericht": "Amtsgericht Berlin (Charlottenburg)",
      "registernummer": "HRB 194012",
      "registerart": "HRB",
      "company_name": "Ashura 10. Objektverwaltungs GmbH",
      "company_seat": "Berlin",
      "details": "09.05.2025 (Bekanntmachungsdatum)\n\nBerlin Amtsgericht Berlin (Charlottenburg) HRB 194012\nRegisterbekanntmachung nach dem Umwandlungsgesetz 07.05.2025 (Eintragungsdatum)\n\nAshura 10. Objektverwaltungs GmbH\nGesellschaft mit beschränkter Haftung\nBerlin\n\nZu Eintragungsnummer 3 vom 07.05.2025 wird als nicht eingetragen veröffentlicht: Den Gläubigern der an der Verschmelzung beteiligten Rechtsträger ist, wenn sie binnen sechs Monaten nach dem Tag, an dem die Eintragung der Verschmelzung in das Register des Sitzes desjenigen Rechtsträgers, dessen Gläubiger sie sind, als bekannt gemacht gilt, ihren Anspruch nach Grund und Höhe schriftlich anmelden, Sicherheit zu leisten, soweit sie nicht Befriedigung verlangen können. Dieses Recht steht den Gläubigern jedoch nur zu, wenn sie glaubhaft machen, dass durch die Verschmelzung die Erfüllung ihrer Forderung gefährdet wird. Das Recht, Sicherheitsleistung zu verlangen, steht Gläubigern nicht zu, die im Falle der Insolvenz ein Recht auf vorzugsweise Befriedigung aus einer Deckungsmasse haben, die nach gesetzlicher Vorschrift zu ihrem Schutz errichtet und staatlich überwacht ist."
    },
    {
      "date": "2025-05-09",
      "id": "108593",
      "original_text": "Registerbekanntmachung nach dem Umwandlungsgesetz\nBerlin Amtsgericht Berlin (Charlottenburg) HRB 193161\nAshura 12. Objektverwaltungs GmbH – Berlin",
      "type": "Registerbekanntmachung nach dem Umwandlungsgesetz",
      "state": "Berlin",
      "amtsgericht": "Amtsgericht Berlin (Charlottenburg)",
      "registernummer": "HRB 193161",
      "registerart": "HRB",
      "company_name": "Ashura 12. Objektverwaltungs GmbH",
      "company_seat": "Berlin",
      "details": "09.05.2025 (Bekanntmachungsdatum)\n\nBerlin Amtsgericht Berlin (Charlottenburg) HRB 193161\nRegisterbekanntmachung nach dem Umwandlungsgesetz 07.05.2025 (Eintragungsdatum)\n\nAshura 12. Objektverwaltungs GmbH\nGesellschaft mit beschränkter Haftung\nBerlin\n\nZu Eintragungsnummer 3 vom 07.05.2025 wird als nicht eingetragen veröffentlicht: Den Gläubigern der an der Verschmelzung beteiligten Rechtsträger ist, wenn sie binnen sechs Monaten nach dem Tag, an dem die Eintragung der Verschmelzung in das Register des Sitzes desjenigen Rechtsträgers, dessen Gläubiger sie sind, als bekannt gemacht gilt, ihren Anspruch nach Grund und Höhe schriftlich anmelden, Sicherheit zu leisten, soweit sie nicht Befriedigung verlangen können. Dieses Recht steht den Gläubigern jedoch nur zu, wenn sie glaubhaft machen, dass durch die Verschmelzung die Erfüllung ihrer Forderung gefährdet wird. Das Recht, Sicherheitsleistung zu verlangen, steht Gläubigern nicht zu, die im Falle der Insolvenz ein Recht auf vorzugsweise Befriedigung aus einer Deckungsmasse haben, die nach gesetzlicher Vorschrift zu ihrem Schutz errichtet und staatlich überwacht ist."
    },
    {
      "date": "2025-05-09",
      "id": "108594",
      "original_text": "Löschungsankündigung\nSaarland Amtsgericht Saarbrücken HRB 17377\nHodel Geschäftsführungs-GmbH – Homburg",
      "type": "Löschungsankündigung",
      "state": "Saarland",
      "amtsgericht": "Amtsgericht Saarbrücken",
      "registernummer": "HRB 17377",
      "registerart": "HRB",
      "company_name": "Hodel Geschäftsführungs-GmbH",
      "company_seat": "Homburg",
      "details": "09.05.2025 (Bekanntmachungsdatum)\n\nSaarland Amtsgericht Saarbrücken HRB 17377\nLöschungsankündigung\n\nHodel Geschäftsführungs-GmbH\nGesellschaft mit beschränkter Haftung\nHomburg\n\nEs ist beabsichtigt, die Gesellschaft von Amts wegen gemäß § 394 FamFG wegen Vermögenslosigkeit zu löschen.\nGegen die Löschung von Amts wegen ist das Rechtsmittel des Widerspruchs statthaft. Der Widerspruch ist binnen einer Frist zwei Monaten beginnend mit dem Tag dieser Veröffentlichung durch Einreichen eines Widerspruchsschreibens -schriftlich oder zur Niederschrift der Geschäftsstelle beim Amtsgericht Saarbrücken, -zentrales Handelsregister-, Mainzerstr.178, 66121 Saarbrücken einzulegen.\nDer Widerspruch muss die Bezeichnung der angefochtenen Löschungsankündigung enthalten sowie die Erklärung, dass Widerspruch eingelegt wird. Er ist vom Widerspruchsführer oder seinem Bevollmächtigten zu unterzeichnen.\nDas Widerspruchsschreiben kann auch in der Form eines elektronischen Dokumentes eingereicht werden, das mit einer qualifizierten elektronischen Signatur nach dem Signaturgesetz versehen sein muss (§§ 14 Abs. 2 FamFG, 130a, 298 ZPO)."
    },
    {
      "date": "2025-05-09",
      "id": "108595",
      "original_text": "Löschungsankündigung\nSachsen Amtsgericht Dresden HRA 6213\nNEY GMBH & CO. KG – Dresden",
      "type": "Löschungsankündigung",
      "state": "Sachsen",
      "amtsgericht": "Amtsgericht Dresden",
      "registernummer": "HRA 6213",
      "registerart": "HRA",
      "company_name": "NEY GMBH & CO. KG",
      "company_seat": "Dresden",
      "details": "09.05.2025 (Bekanntmachungsdatum)\n\nSachsen Amtsgericht Dresden HRA 6213\nLöschungsankündigung\n\nNEY GMBH & CO. KG\nKommanditgesellschaft\nDresden\n\nDas Registergericht beabsichtigt, die im Handelsregister eingetragene Firma von Amts wegen nach § 31 Abs. 2 HGB, 393 FamFG zu löschen. Die Frist zur Erhebung eines Widerspruchs gegen die beabsichtigte Löschung wird auf einen Monat festgesetzt.\n\nDie Löschungsankündigung nach § 394 FamFG vom 25.03.2025 wird aufgehoben."
    },
    {
      "date": "2025-05-09",
      "id": "108596",
      "original_text": "Löschungsankündigung\nSachsen Amtsgericht Leipzig HRB 35080\nRUSIUM-BAU GmbH – Wurzen",
      "type": "Löschungsankündigung",
      "state": "Sachsen",
      "amtsgericht": "Amtsgericht Leipzig",
      "registernummer": "HRB 35080",
      "registerart": "HRB",
      "company_name": "RUSIUM-BAU GmbH",
      "company_seat": "Wurzen",
      "details": "09.05.2025 (Bekanntmachungsdatum)\n\nSachsen Amtsgericht Leipzig HRB 35080\nLöschungsankündigung\n\nRUSIUM-BAU GmbH\nGesellschaft mit beschränkter Haftung\nWurzen\n\nDas Registergericht beabsichtigt, die im Handelsregister eingetragene Gesellschaft von Amts wegen nach § 394 FamFG zu löschen. Die Frist zu Erhebung eines Widerspruchs gegen die beabsichtigte Löschung wird auf einen Monat festgesetzt."
    },
    {
      "date": "2025-05-09",
      "id": "108597",
      "original_text": "Registerbekanntmachung nach dem Umwandlungsgesetz\nSachsen Amtsgericht Leipzig HRB 496\nLeipziger Kraftfuttermittel GmbH (LEIKRA) – Leipzig",
      "type": "Registerbekanntmachung nach dem Umwandlungsgesetz",
      "state": "Sachsen",
      "amtsgericht": "Amtsgericht Leipzig",
      "registernummer": "HRB 496",
      "registerart": "HRB",
      "company_name": "Leipziger Kraftfuttermittel GmbH (LEIKRA)",
      "company_seat": "Leipzig",
      "details": "09.05.2025 (Bekanntmachungsdatum)\n\nSachsen Amtsgericht Leipzig HRB 496\nRegisterbekanntmachung nach dem Umwandlungsgesetz 09.05.2025 (Eintragungsdatum)\n\nLeipziger Kraftfuttermittel GmbH (LEIKRA)\nGesellschaft mit beschränkter Haftung\nLeipzig\n\nDen Gläubigern der an der Verschmelzung beteiligten Rechtsträger ist, wenn sie binnen sechs Monaten nach dem Tag, an dem die Eintragung der Verschmelzung in das Register des Sitzes desjenigen Rechtsträgers, dessen Gläubiger sie sind, nach § 19 Abs. 3 UmwG als bekannt gemacht gilt, ihren Anspruch nach Grund und Höhe in Textform anmelden, Sicherheit zu leisten, soweit sie nicht Befriedigung verlangen können. Dieses Recht steht den Gläubigern jedoch nur zu, wenn sie glaubhaft machen, dass durch die Verschmelzung die Erfüllung der Forderung gefährdet wird."
    },
    {
      "date": "2025-05-09",
      "id": "108598",
      "original_text": "Einreichung neuer Dokumente\nSachsen Amtsgericht Leipzig HRB 13860\nLVV Leipziger Versorgungs- und Verkehrsgesellschaft mbH – Leipzig",
      "type": "Einreichung neuer Dokumente",
      "state": "Sachsen",
      "amtsgericht": "Amtsgericht Leipzig",
      "registernummer": "HRB 13860",
      "registerart": "HRB",
      "company_name": "LVV Leipziger Versorgungs- und Verkehrsgesellschaft mbH",
      "company_seat": "Leipzig",
      "details": "09.05.2025 (Bekanntmachungsdatum)\n\nSachsen Amtsgericht Leipzig HRB 13860\nEinreichung neuer Dokumente\n\nLVV Leipziger Versorgungs- und Verkehrsgesellschaft mbH\nGesellschaft mit beschränkter Haftung\nLeipzig\n\nAm 05.05.2025 wurde beim Handelsregister des Amtsgerichts Leipzig die Liste der Mitglieder des Aufsichtsrats gemäß § 52 GmbHG eingereicht."
    },
    {
      "date": "2025-05-09",
      "id": "108599",
      "original_text": "Sonstige Registerbekanntmachung\nNiedersachsen Amtsgericht Hannover HRB 201186\nenercity Netz GmbH – Hannover",
      "type": "Sonstige Registerbekanntmachung",
      "state": "Niedersachsen",
      "amtsgericht": "Amtsgericht Hannover",
      "registernummer": "HRB 201186",
      "registerart": "HRB",
      "company_name": "enercity Netz GmbH",
      "company_seat": "Hannover",
      "details": "09.05.2025 (Bekanntmachungsdatum)\n\nNiedersachsen Amtsgericht Hannover HRB 201186\nSonstige Registerbekanntmachung\n\nenercity Netz GmbH\nGesellschaft mit beschränkter Haftung\nHannover\n\nDie Liste der Mitglieder des Aufsichtsrats wurde beim Registergericht eingereicht."
    },
    {
      "date": "2025-05-09",
      "id": "108600",
      "original_text": "Löschungsankündigung\nNiedersachsen Amtsgericht Lüneburg HRB 210282\nTSK Nord GmbH – Seevetal",
      "type": "Löschungsankündigung",
      "state": "Niedersachsen",
      "amtsgericht": "Amtsgericht Lüneburg",
      "registernummer": "HRB 210282",
      "registerart": "HRB",
      "company_name": "TSK Nord GmbH",
      "company_seat": "Seevetal",
      "details": "09.05.2025 (Bekanntmachungsdatum)\n\nNiedersachsen Amtsgericht Lüneburg HRB 210282\nLöschungsankündigung\n\nTSK Nord GmbH\nGesellschaft mit beschränkter Haftung\nSeevetal\n\nDas Registergericht beabsichtigt, vorstehende Gesellschaft von Amts wegen nach § 394 FamFG zu löschen. Die Frist zur Erhebung eines Widerspruchs ist auf 1 Monat ab Veröffentlichung festgesetzt."
    },
    {
      "date": "2025-05-09",
      "id": "108601",
      "original_text": "Registerbekanntmachung nach dem Umwandlungsgesetz\nNiedersachsen Amtsgericht Oldenburg (Oldenburg) HRB 217851\nMOIN MONTAGE GmbH – Westerstede",
      "type": "Registerbekanntmachung nach dem Umwandlungsgesetz",
      "state": "Niedersachsen",
      "amtsgericht": "Amtsgericht Oldenburg (Oldenburg)",
      "registernummer": "HRB 217851",
      "registerart": "HRB",
      "company_name": "MOIN MONTAGE GmbH",
      "company_seat": "Westerstede",
      "details": "09.05.2025 (Bekanntmachungsdatum)\n\nNiedersachsen Amtsgericht Oldenburg (Oldenburg) HRB 217851\nRegisterbekanntmachung nach dem Umwandlungsgesetz 09.05.2025 (Eintragungsdatum)\n\nMOIN MONTAGE GmbH\nGesellschaft mit beschränkter Haftung\nWesterstede\n\nDen Gläubigern der an der Verschmelzung beteiligten Rechtsträger ist, wenn sie binnen sechs Monaten nach dem Tag, an dem die Eintragung der Verschmelzung in das Register des Sitzes desjenigen Rechtsträgers, dessen Gläubiger sie sind, nach § 19  Abs.  3 UmwG als bekannt gemacht gilt, ihren Anspruch nach Grund und Höhe schriftlich anmelden, Sicherheit zu leisten, soweit sie nicht Befriedigung verlangen können. Dieses Recht steht den Gläubigern jedoch nur zu, wenn sie glaubhaft machen, dass durch die Verschmelzung die Erfüllung der Forderung gefährdet wird."
    },
    {
      "date": "2025-05-09",
      "id": "108602",
      "original_text": "Registerbekanntmachung nach dem Umwandlungsgesetz\nNiedersachsen Amtsgericht Oldenburg (Oldenburg) HRB 215489\nMOIN SOLAR GmbH – Westerstede",
      "type": "Registerbekanntmachung nach dem Umwandlungsgesetz",
      "state": "Niedersachsen",
      "amtsgericht": "Amtsgericht Oldenburg (Oldenburg)",
      "registernummer": "HRB 215489",
      "registerart": "HRB",
      "company_name": "MOIN SOLAR GmbH",
      "company_seat": "Westerstede",
      "details": "09.05.2025 (Bekanntmachungsdatum)\n\nNiedersachsen Amtsgericht Oldenburg (Oldenburg) HRB 215489\nRegisterbekanntmachung nach dem Umwandlungsgesetz 09.05.2025 (Eintragungsdatum)\n\nMOIN SOLAR GmbH\nGesellschaft mit beschränkter Haftung\nWesterstede\n\nDen Gläubigern der an der Verschmelzung beteiligten Rechtsträger ist, wenn sie binnen sechs Monaten nach dem Tag, an dem die Eintragung der Verschmelzung in das Register des Sitzes desjenigen Rechtsträgers, dessen Gläubiger sie sind, nach § 19  Abs.  3 UmwG als bekannt gemacht gilt, ihren Anspruch nach Grund und Höhe schriftlich anmelden, Sicherheit zu leisten, soweit sie nicht Befriedigung verlangen können. Dieses Recht steht den Gläubigern jedoch nur zu, wenn sie glaubhaft machen, dass durch die Verschmelzung die Erfüllung der Forderung gefährdet wird."
    },
    {
      "date": "2025-05-09",
      "id": "108603",
      "original_text": "Registerbekanntmachung nach dem Umwandlungsgesetz\nNiedersachsen Amtsgericht Oldenburg (Oldenburg) HRB 218306\nMOIN ELEKTRO GmbH – Westerstede",
      "type": "Registerbekanntmachung nach dem Umwandlungsgesetz",
      "state": "Niedersachsen",
      "amtsgericht": "Amtsgericht Oldenburg (Oldenburg)",
      "registernummer": "HRB 218306",
      "registerart": "HRB",
      "company_name": "MOIN ELEKTRO GmbH",
      "company_seat": "Westerstede",
      "details": "09.05.2025 (Bekanntmachungsdatum)\n\nNiedersachsen Amtsgericht Oldenburg (Oldenburg) HRB 218306\nRegisterbekanntmachung nach dem Umwandlungsgesetz 09.05.2025 (Eintragungsdatum)\n\nMOIN ELEKTRO GmbH\nGesellschaft mit beschränkter Haftung\nWesterstede\n\nDen Gläubigern der an der Verschmelzung beteiligten Rechtsträger ist, wenn sie binnen sechs Monaten nach dem Tag, an dem die Eintragung der Verschmelzung in das Register des Sitzes desjenigen Rechtsträgers, dessen Gläubiger sie sind, nach § 19  Abs.  3 UmwG als bekannt gemacht gilt, ihren Anspruch nach Grund und Höhe schriftlich anmelden, Sicherheit zu leisten, soweit sie nicht Befriedigung verlangen können. Dieses Recht steht den Gläubigern jedoch nur zu, wenn sie glaubhaft machen, dass durch die Verschmelzung die Erfüllung der Forderung gefährdet wird."
    },
    {
      "date": "2025-05-09",
      "id": "108604",
      "original_text": "Einreichung neuer Dokumente\nNiedersachsen Amtsgericht Hannover HRB 52029\nContiTech Vibration Control GmbH – Hannover",
      "type": "Einreichung neuer Dokumente",
      "state": "Niedersachsen",
      "amtsgericht": "Amtsgericht Hannover",
      "registernummer": "HRB 52029",
      "registerart": "HRB",
      "company_name": "ContiTech Vibration Control GmbH",
      "company_seat": "Hannover",
      "details": "09.05.2025 (Bekanntmachungsdatum)\n\nNiedersachsen Amtsgericht Hannover HRB 52029\nEinreichung neuer Dokumente\n\nContiTech Vibration Control GmbH\nGesellschaft mit beschränkter Haftung\nHannover\n\nDie Liste der Mitglieder des Aufsichtsrats wurde beim Registergericht eingereicht."
    },
    {
      "date": "2025-05-09",
      "id": "108605",
      "original_text": "Sonstige Registerbekanntmachung\nHamburg Amtsgericht Hamburg HRB 76536\nKRAVAG-LOGISTIC Versicherungs-Aktiengesellschaft – Hamburg",
      "type": "Sonstige Registerbekanntmachung",
      "state": "Hamburg",
      "amtsgericht": "Amtsgericht Hamburg",
      "registernummer": "HRB 76536",
      "registerart": "HRB",
      "company_name": "KRAVAG-LOGISTIC Versicherungs-Aktiengesellschaft",
      "company_seat": "Hamburg",
      "details": "09.05.2025 (Bekanntmachungsdatum)\n\nHamburg Amtsgericht Hamburg HRB 76536\nSonstige Registerbekanntmachung\n\nKRAVAG-LOGISTIC Versicherungs-Aktiengesellschaft\nAktiengesellschaft\nHamburg\n\nAls nicht eingetragen wird bekannt gemacht: Liste des Aufsichtsrats wurde eingereicht."
    },
    {
      "date": "2025-05-09",
      "id": "108606",
      "original_text": "Sonstige Registerbekanntmachung\nHamburg Amtsgericht Hamburg HRB 64830\nKRAVAG-ALLGEMEINE Versicherungs-Aktiengesellschaft – Hamburg",
      "type": "Sonstige Registerbekanntmachung",
      "state": "Hamburg",
      "amtsgericht": "Amtsgericht Hamburg",
      "registernummer": "HRB 64830",
      "registerart": "HRB",
      "company_name": "KRAVAG-ALLGEMEINE Versicherungs-Aktiengesellschaft",
      "company_seat": "Hamburg",
      "details": "09.05.2025 (Bekanntmachungsdatum)\n\nHamburg Amtsgericht Hamburg HRB 64830\nSonstige Registerbekanntmachung\n\nKRAVAG-ALLGEMEINE Versicherungs-Aktiengesellschaft\nAktiengesellschaft\nHamburg\n\nAls nicht eingetragen wird bekannt gemacht: Liste des Aufsichtsrats wurde eingereicht."
    },
    {
      "date": "2025-05-09",
      "id": "108607",
      "original_text": "Löschungsankündigung\nBremen Amtsgericht Bremen HRA 26738\nAbba PV oHG – Bremen",
      "type": "Löschungsankündigung",
      "state": "Bremen",
      "amtsgericht": "Amtsgericht Bremen",
      "registernummer": "HRA 26738",
      "registerart": "HRA",
      "company_name": "Abba PV oHG",
      "company_seat": "Bremen",
      "details": "09.05.2025 (Bekanntmachungsdatum)\n\nBremen Amtsgericht Bremen HRA 26738\nLöschungsankündigung\n\nAbba PV oHG\nOffene Handelsgesellschaft\nBremen\n\nEs ist beabsichtigt die im Handelsregister eingetragene Firma von Amts wegen gemäß § 31 Abs.2 HGB zu löschen. Gegen die Löschung kann beim AG Bremen schriftlich oder zu Protokoll der Geschäftsstelle Widerspruch eingelegt werden. Widerspruchsfrist 4 Wochen."
    },
    {
      "date": "2025-05-09",
      "id": "108608",
      "original_text": "Sonstige Registerbekanntmachung\nRheinland-Pfalz Amtsgericht Ludwigshafen a.Rhein (Ludwigshafen) HRB 60741\nHowden Turbo GmbH – Frankenthal",
      "type": "Sonstige Registerbekanntmachung",
      "state": "Rheinland-Pfalz",
      "amtsgericht": "Amtsgericht Ludwigshafen a.Rhein (Ludwigshafen)",
      "registernummer": "HRB 60741",
      "registerart": "HRB",
      "company_name": "Howden Turbo GmbH",
      "company_seat": "Frankenthal",
      "details": "09.05.2025 (Bekanntmachungsdatum)\n\nRheinland-Pfalz Amtsgericht Ludwigshafen a.Rhein (Ludwigshafen) HRB 60741\nSonstige Registerbekanntmachung\n\nHowden Turbo GmbH\nGesellschaft mit beschränkter Haftung\nFrankenthal\n\nDem Registergericht ist eine neue Liste der Mitglieder des Aufsichtsrates eingereicht worden."
    },
    {
      "date": "2025-05-09",
      "id": "108609",
      "original_text": "Registerbekanntmachung nach dem Umwandlungsgesetz\nRheinland-Pfalz Amtsgericht Landau HRB 32549\nM&A Beteiligungs UG (haftungsbeschränkt) – Bellheim",
      "type": "Registerbekanntmachung nach dem Umwandlungsgesetz",
      "state": "Rheinland-Pfalz",
      "amtsgericht": "Amtsgericht Landau",
      "registernummer": "HRB 32549",
      "registerart": "HRB",
      "company_name": "M&A Beteiligungs UG (haftungsbeschränkt)",
      "company_seat": "Bellheim",
      "details": "09.05.2025 (Bekanntmachungsdatum)\n\nRheinland-Pfalz Amtsgericht Landau HRB 32549\nRegisterbekanntmachung nach dem Umwandlungsgesetz 09.05.2025 (Eintragungsdatum)\n\nM&A Beteiligungs UG (haftungsbeschränkt)\nGesellschaft mit beschränkter Haftung\nBellheim\n\nAls nicht eingetragen wird veröffentlicht: Den Gläubigern der an der Verschmelzung beteiligten Rechtsträger ist, wenn sie binnen sechs Monaten nach dem Tag, an dem die Eintragung der Verschmelzung in das Register des Sitzes desjenigen Rechtsträgers, dessen Gläubiger sie sind, nach § 19 Abs. 3 UmwG als bekannt gemacht gilt, ihren Anspruch nach Grund und Höhe schriftlich anmelden, Sicherheit zu leisten, soweit sie nicht Befriedigung verlangen können. Dieses Recht steht den Gläubigern jedoch nur zu, wenn sie glaubhaft machen, dass durch die Verschmelzung die Erfüllung der Forderung gefährdet wird."
    },
    {
      "date": "2025-05-09",
      "id": "108610",
      "original_text": "Registerbekanntmachung nach dem Umwandlungsgesetz\nNordrhein-Westfalen Amtsgericht Bielefeld HRB 38780\nLaboramus GmbH – Bielefeld",
      "type": "Registerbekanntmachung nach dem Umwandlungsgesetz",
      "state": "Nordrhein-Westfalen",
      "amtsgericht": "Amtsgericht Bielefeld",
      "registernummer": "HRB 38780",
      "registerart": "HRB",
      "company_name": "Laboramus GmbH",
      "company_seat": "Bielefeld",
      "details": "09.05.2025 (Bekanntmachungsdatum)\n\nNordrhein-Westfalen Amtsgericht Bielefeld HRB 38780\nRegisterbekanntmachung nach dem Umwandlungsgesetz 09.05.2025 (Eintragungsdatum)\n\nLaboramus GmbH\nGesellschaft mit beschränkter Haftung\nBielefeld\n\nDen Gläubigern der an der Verschmelzung beteiligten Rechtsträger ist, wenn sie binnen sechs Monaten nach dem Tag, an dem die Eintragung der Verschmelzung in das Register des Sitzes desjenigen Rechtsträgers, dessen Gläubiger sie sind, nach § 19 Absatz 3 UmwG als bekanntgemacht gilt, ihren Anspruch nach Grund und Höhe schriftlich anmelden, Sicherheit zu leisten, soweit sie nicht Befriedigung verlangen können. Dieses Recht steht den Gläubigern jedoch nur zu, wenn sie glaubhaft machen, dass durch die Verschmelzung die Erfüllung ihrer Forderung gefährdet wird."
    },
    {
      "date": "2025-05-09",
      "id": "108611",
      "original_text": "Löschungsankündigung\nNordrhein-Westfalen Amtsgericht Neuss HRB 21811\npira Marketing UG (haftungsbeschränkt) – Neuss",
      "type": "Löschungsankündigung",
      "state": "Nordrhein-Westfalen",
      "amtsgericht": "Amtsgericht Neuss",
      "registernummer": "HRB 21811",
      "registerart": "HRB",
      "company_name": "pira Marketing UG (haftungsbeschränkt)",
      "company_seat": "Neuss",
      "details": "09.05.2025 (Bekanntmachungsdatum)\n\nNordrhein-Westfalen Amtsgericht Neuss HRB 21811\nLöschungsankündigung\n\npira Marketing UG (haftungsbeschränkt)\nGesellschaft mit beschränkter Haftung\nNeuss\n\nEs ist beabsichtigt, die Gesellschaft wegen Vermögenslosigkeit aufgrund des § 394 Abs. 1 FamFG zu löschen. Frist zur Geltendmachung eines Widerspruchs: 1 Monat.\n\nRechtsbehelfsbelehrung:\nGegen diese Verfügung können Sie Widerspruch einlegen.\nDer Widerspruch ist bei dem Amtsgericht Neuss - Registergericht -, Breite Str. 48, 41460 Neuss schriftlich in deutscher Sprache oder zur Niederschrift der Geschäftsstelle einzulegen.\nDer Widerspruch kann auch zur Niederschrift der Geschäftsstelle eines jeden Amtsgerichtes abgegeben werden.\nDie Einlegung ist auch durch Übertragung eines elektronischen Dokuments an die elektronische Poststelle des Gerichts möglich. Das elektronische Dokument muss für die Bearbeitung durch das Gericht geeignet und mit einer qualifizierten elektronischen Signatur der verantwortenden Person versehen sein oder von der verantwortenden Person signiert und auf einem sicheren Übermittlungsweg gemäß § 130a ZPO nach näherer Maßgabe der Verordnung über die technischen Rahmenbedingungen des elektronischen Rechtsverkehrs und über das besondere elektronische Behördenpostfach (BGBl. I, S.3803) eingereicht werden. Weitere Informationen erhalten Sie auf der Internetseite www.justiz.de.\nDer Widerspruch muss spätestens innerhalb der gesetzten Frist nach der schriftlichen Bekanntgabe der Verfügung bei dem Amtsgericht - Registergericht - Neuss eingegangen sein. Dies gilt auch dann, wenn der Widerspruch zur Niederschrift der Geschäftsstelle eines anderen Amtsgerichtes abgegeben wurde. Die Frist beginnt mit der schriftlichen Bekanntgabe der Verfügung. Die Bekanntgabe ist entweder durch Zustellung oder am dritten Tage nach Aufgabe zur Post bewirkt. Fällt das Ende der Frist auf einen Sonntag, einen allgemeinen Feiertag oder Sonnabend, so endet die Frist mit Ablauf des nächsten Werktages.\n\nDer Widerspruch muss die Bezeichnung der angefochtenen Verfügung sowie die Erklärung enthalten, dass Widerspruch gegen diese Verfügung eingelegt wird. Er ist zu unterzeichnen und soll begründet werden."
    },
    {
      "date": "2025-05-09",
      "id": "108612",
      "original_text": "Einreichung neuer Dokumente\nNordrhein-Westfalen Amtsgericht Bonn HRB 18384\nDeutsche Gesellschaft für Internationale Zusammenarbeit (GIZ) GmbH – Bonn und Eschborn",
      "type": "Einreichung neuer Dokumente",
      "state": "Nordrhein-Westfalen",
      "amtsgericht": "Amtsgericht Bonn",
      "registernummer": "HRB 18384",
      "registerart": "HRB",
      "company_name": "Deutsche Gesellschaft für Internationale Zusammenarbeit (GIZ) GmbH",
      "company_seat": "Bonn und Eschborn",
      "details": "09.05.2025 (Bekanntmachungsdatum)\n\nNordrhein-Westfalen Amtsgericht Bonn HRB 18384\nEinreichung neuer Dokumente\n\nDeutsche Gesellschaft für Internationale Zusammenarbeit (GIZ) GmbH\nGesellschaft mit beschränkter Haftung\nBonn und Eschborn\n\nDem Registergericht ist eine neue Liste der Mitglieder des Aufsichtsrates eingereicht worden."
    },
    {
      "date": "2025-05-09",
      "id": "108613",
      "original_text": "Einreichung neuer Dokumente\nNordrhein-Westfalen Amtsgericht Köln HRB 65425\nEnergiewirtschaftliches Institut an der Universität zu Köln gGmbH – Köln",
      "type": "Einreichung neuer Dokumente",
      "state": "Nordrhein-Westfalen",
      "amtsgericht": "Amtsgericht Köln",
      "registernummer": "HRB 65425",
      "registerart": "HRB",
      "company_name": "Energiewirtschaftliches Institut an der Universität zu Köln gGmbH",
      "company_seat": "Köln",
      "details": "09.05.2025 (Bekanntmachungsdatum)\n\nNordrhein-Westfalen Amtsgericht Köln HRB 65425\nEinreichung neuer Dokumente 09.05.2025 (Eintragungsdatum)\n\nEnergiewirtschaftliches Institut an der Universität zu Köln gGmbH\nGesellschaft mit beschränkter Haftung\nKöln\n\nDem Registergericht ist eine neue Liste der Mitglieder des Aufsichtsrates eingereicht worden."
    },
    {
      "date": "2025-05-09",
      "id": "108614",
      "original_text": "Löschungsankündigung\nNordrhein-Westfalen Amtsgericht Duisburg HRA 8899\nDer Nachtkiosk Thomas Kähler e.K. – Mülheim an der Ruhr",
      "type": "Löschungsankündigung",
      "state": "Nordrhein-Westfalen",
      "amtsgericht": "Amtsgericht Duisburg",
      "registernummer": "HRA 8899",
      "registerart": "HRA",
      "company_name": "Der Nachtkiosk Thomas Kähler e.K.",
      "company_seat": "Mülheim an der Ruhr",
      "details": "09.05.2025 (Bekanntmachungsdatum)\n\nNordrhein-Westfalen Amtsgericht Duisburg HRA 8899\nLöschungsankündigung 09.05.2025 (Eintragungsdatum)\n\nDer Nachtkiosk Thomas Kähler e.K.\nEinzelkaufmann / Einzelkauffrau\nMülheim an der Ruhr\n\nHRA 8899:\nDer Nachtkiosk Thomas Kähler e.K.\nDuisburger Straße 67, 45479 Mülheim an der Ruhr.\nDas Registergericht beabsichtigt, die im Handelsregister eingetragene Gesellschaft gemäß §§ 31 Abs. 2, 6 HGB, § 393 FamFG wegen Vermögenslosigkeit von Amts wegen zu löschen.\nGegen diese Verfügung kann Widerspruch eingelegt werden.Die Frist zur Erhebung eines Widerspruchs gegen die beabsichtigte Löschung von Amts wegen ist auf drei Monate festgesetzt.\nDer Widerspruch ist bei dem Amtsgericht - Registergericht - Duisburg, Kardinal-Galen-Straße 124 - 132, 47058 Duisburg, schriftlich in deutscher Sprache oder zur Niederschrift der Geschäftsstelle einzulegen. Der Widerspruch kann auch zur Niederschrift der Geschäftsstelle eines jeden Amtsgerichtes abgegeben werden.\nDer Widerspruch muss spätestens innerhalb der gesetzten Frist nach der schriftlichen Bekanntgabe der Verfügung bei dem Amtsgericht Duisburg eingegangen sein. Dies gilt auch dann, wenn der Widerspruch zur Niederschrift der Geschäftsstelle eines anderen Amtsgerichtes abgegeben wurde. Die Frist beginnt mit der schriftlichen Bekanntgabe der Verfügung.\nDer Widerspruch muss die Bezeichnung der angefochtenen Verfügung sowie die Erklärung enthalten, dass Widerspruch gegen diese Verfügung eingelegt wird. Er ist zu unterzeichnen und soll begründet werden.\nDie Einlegung ist auch durch Übertragung eines elektronischen Dokuments an die elektronische Poststelle des Gerichts möglich. Das elektronische Dokument muss für die Bearbeitung durch das Gericht geeignet und mit einer qualifizierten elektronischen Signatur der verantwortenden Person versehen sein oder von der verantwortenden Person signiert und auf einem sicheren Übermittlungsweg gemäß § 130a ZPO nach näherer Maßgabe der Verordnung über die technischen Rahmenbedingungen des elektronischen Rechtsverkehrs und über das besondere elektronische Behördenpostfach (BGBl. 2017 I, S. 3803) eingereicht werden. Weitere Informationen erhalten Sie auf der Internetseite www.justiz.de."
    },
    {
      "date": "2025-05-09",
      "id": "108615",
      "original_text": "Einreichung neuer Dokumente\nNordrhein-Westfalen Amtsgericht Hagen HRB 9591\ndormakaba Holding GmbH + Co. Kommanditgesellschaft auf Aktien – Ennepetal",
      "type": "Einreichung neuer Dokumente",
      "state": "Nordrhein-Westfalen",
      "amtsgericht": "Amtsgericht Hagen",
      "registernummer": "HRB 9591",
      "registerart": "HRB",
      "company_name": "dormakaba Holding GmbH + Co. Kommanditgesellschaft auf Aktien",
      "company_seat": "Ennepetal",
      "details": "09.05.2025 (Bekanntmachungsdatum)\n\nNordrhein-Westfalen Amtsgericht Hagen HRB 9591\nEinreichung neuer Dokumente\n\ndormakaba Holding GmbH + Co. Kommanditgesellschaft auf Aktien\nKommanditgesellschaft auf Aktien\nEnnepetal\n\nDie gesetzlichen Vertreter der Gesellschaft haben eine aktuelle Liste der Aufsichtsratsmitglieder zum Handelsregister eingereicht."
    },
    {
      "date": "2025-05-09",
      "id": "108616",
      "original_text": "Löschungsankündigung\nNordrhein-Westfalen Amtsgericht Köln HRB 109759\nAtrimmo Vertrieb UG (haftungsbeschränkt) – Leverkusen",
      "type": "Löschungsankündigung",
      "state": "Nordrhein-Westfalen",
      "amtsgericht": "Amtsgericht Köln",
      "registernummer": "HRB 109759",
      "registerart": "HRB",
      "company_name": "Atrimmo Vertrieb UG (haftungsbeschränkt)",
      "company_seat": "Leverkusen",
      "details": "09.05.2025 (Bekanntmachungsdatum)\n\nNordrhein-Westfalen Amtsgericht Köln HRB 109759\nLöschungsankündigung\n\nAtrimmo Vertrieb UG (haftungsbeschränkt)\nGesellschaft mit beschränkter Haftung\nLeverkusen\n\nDas Registergericht beabsichtigt die Gesellschaft von Amts wegen nach § 394 FamFG zu löschen. Die Frist zur Erhebung eines Widerspruchs ist auf einen Monat festgesetzt."
    },
    {
      "date": "2025-05-09",
      "id": "108617",
      "original_text": "Löschungsankündigung\nNordrhein-Westfalen Amtsgericht Düsseldorf HRB 76281\nDUSPRO Management UG (haftungsbeschränkt) – Düsseldorf",
      "type": "Löschungsankündigung",
      "state": "Nordrhein-Westfalen",
      "amtsgericht": "Amtsgericht Düsseldorf",
      "registernummer": "HRB 76281",
      "registerart": "HRB",
      "company_name": "DUSPRO Management UG (haftungsbeschränkt)",
      "company_seat": "Düsseldorf",
      "details": "09.05.2025 (Bekanntmachungsdatum)\n\nNordrhein-Westfalen Amtsgericht Düsseldorf HRB 76281\nLöschungsankündigung\n\nDUSPRO Management UG (haftungsbeschränkt)\nGesellschaft mit beschränkter Haftung\nDüsseldorf\n\nDas Registergericht beabsichtigt die Gesellschaft von Amts wegen nach § 394 FamFG zu löschen. Die Frist zur Erhebung eines Widerspruchs ist auf 3 Wochen festgesetzt.\n\nRechtsbehelfsbelehrung:\nDas Widerspruchsrecht steht jedem zu, der an der Unterlassung der Löschung ein berechtigtes Interesse hat. Der Widerspruch ist bei dem Amtsgericht Düsseldorf -Registergericht-, Werdener Straße 1, 40227 Düsseldorf schriftlich in deutscher Sprache oder zur Niederschrift der Geschäftsstelle einzulegen. Der Widerspruch kann auch zur Niederschrift der Geschäftsstelle eines jeden Amtsgerichtes abgegeben werden. Die Einlegung ist auch durch Übertragung eines elektronischen Dokuments an die elektronische Poststelle des Gerichts möglich. Das elektronische Dokument muss für die Bearbeitung durch das Gericht geeignet und mit einer qualifizierten elektronischen Signatur der verantwortenden Person versehen sein oder von der verantwortenden Person signiert und auf einem sicheren Übermittlungsweg gemäß § 130a ZPO nach näherer Maßgabe der Verordnung über die technischen Rahmenbedingungen des elektronischen Rechtsverkehrs und über das besondere elektronische Behördenpostfach (BGBl. I, S.3803) eingereicht werden. Weitere Informationen erhalten Sie auf der Internetseite www.justiz.de.\nDer Widerspruch muss spätestens innerhalb der gesetzten Frist nach dem Datum der Bekanntmachung der Löschungsankündigung bei dem Amtsgericht - Registergericht - Düsseldorf eingegangen sein.  Dies gilt auch dann, wenn der Widerspruch zur Niederschrift der Geschäftsstelle eines anderen Amtsgerichtes abgegeben wurde. Die Frist beginnt mit dem Tage der Bekanntmachung der Löschungsankündigung in dem für die Bekanntmachung der Eintragungen in das Handelsregister bestimmten elektronischen Informations- und Kommunikationssystem nach § 10 des Handelsgesetzbuches. Fällt das Ende der Frist auf einen Sonntag, einen allgemeinen Feiertag oder Sonnabend, so endet die Frist mit Ablauf des nächsten Werktages.\nDer Widerspruch muss die Bezeichnung der angefochtenen Löschungsankündigung sowie die Erklärung enthalten, dass Widerspruch gegen diese Löschungsankündigung eingelegt wird. Er ist zu unterzeichnen und soll begründet werden."
    },
    {
      "date": "2025-05-09",
      "id": "108618",
      "original_text": "Einreichung neuer Dokumente\nNordrhein-Westfalen Amtsgericht Bonn HRB 6717\nBICC - Bonn International Centre for Conflict Studies gGmbH – Bonn",
      "type": "Einreichung neuer Dokumente",
      "state": "Nordrhein-Westfalen",
      "amtsgericht": "Amtsgericht Bonn",
      "registernummer": "HRB 6717",
      "registerart": "HRB",
      "company_name": "BICC - Bonn International Centre for Conflict Studies gGmbH",
      "company_seat": "Bonn",
      "details": "09.05.2025 (Bekanntmachungsdatum)\n\nNordrhein-Westfalen Amtsgericht Bonn HRB 6717\nEinreichung neuer Dokumente 09.05.2025 (Eintragungsdatum)\n\nBICC - Bonn International Centre for Conflict Studies gGmbH\nGesellschaft mit beschränkter Haftung\nBonn\n\nDem Registergericht ist eine neue Liste der Mitglieder des Aufsichtsrates eingereicht worden."
    },
    {
      "date": "2025-05-09",
      "id": "108619",
      "original_text": "Einreichung neuer Dokumente\nNordrhein-Westfalen Amtsgericht Dortmund HRB 29232\nDortmunder Lebensversicherung AG – Dortmund",
      "type": "Einreichung neuer Dokumente",
      "state": "Nordrhein-Westfalen",
      "amtsgericht": "Amtsgericht Dortmund",
      "registernummer": "HRB 29232",
      "registerart": "HRB",
      "company_name": "Dortmunder Lebensversicherung AG",
      "company_seat": "Dortmund",
      "details": "09.05.2025 (Bekanntmachungsdatum)\n\nNordrhein-Westfalen Amtsgericht Dortmund HRB 29232\nEinreichung neuer Dokumente\n\nDortmunder Lebensversicherung AG\nAktiengesellschaft\nDortmund\n\nDem Registergericht ist eine neue Liste der Mitglieder des Aufsichtsrates eingereicht worden."
    },
    {
      "date": "2025-05-09",
      "id": "108620",
      "original_text": "Registerbekanntmachung nach dem Umwandlungsgesetz\nNordrhein-Westfalen Amtsgericht Köln HRB 112501\nVEBEGO SERVICES GmbH – Köln",
      "type": "Registerbekanntmachung nach dem Umwandlungsgesetz",
      "state": "Nordrhein-Westfalen",
      "amtsgericht": "Amtsgericht Köln",
      "registernummer": "HRB 112501",
      "registerart": "HRB",
      "company_name": "VEBEGO SERVICES GmbH",
      "company_seat": "Köln",
      "details": "09.05.2025 (Bekanntmachungsdatum)\n\nNordrhein-Westfalen Amtsgericht Köln HRB 112501\nRegisterbekanntmachung nach dem Umwandlungsgesetz 09.05.2025 (Eintragungsdatum)\n\nVEBEGO SERVICES GmbH\nGesellschaft mit beschränkter Haftung\nKöln\n\nDen Gläubigern der an der Verschmelzung beteiligten Rechtsträger ist, wenn sie binnen sechs Monaten nach dem Tag, an dem die Eintragung der Verschmelzung in das Register des Sitzes desjenigen Rechtsträgers, dessen Gläubiger sie sind, nach § 19 Absatz 3 UmwG als bekanntgemacht gilt, ihren Anspruch nach Grund und Höhe schriftlich anmelden, Sicherheit zu leisten, soweit sie nicht Befriedigung verlangen können. Dieses Recht steht den Gläubigern jedoch nur zu, wenn sie glaubhaft machen, dass durch die Verschmelzung die Erfüllung ihrer Forderung gefährdet wird."
    },
    {
      "date": "2025-05-09",
      "id": "108621",
      "original_text": "Registerbekanntmachung nach dem Umwandlungsgesetz\nNordrhein-Westfalen Amtsgericht Düren HRA 4156\nEPS Event Protection & Services e.K. – Düren",
      "type": "Registerbekanntmachung nach dem Umwandlungsgesetz",
      "state": "Nordrhein-Westfalen",
      "amtsgericht": "Amtsgericht Düren",
      "registernummer": "HRA 4156",
      "registerart": "HRA",
      "company_name": "EPS Event Protection & Services e.K.",
      "company_seat": "Düren",
      "details": "09.05.2025 (Bekanntmachungsdatum)\n\nNordrhein-Westfalen Amtsgericht Düren HRA 4156\nRegisterbekanntmachung nach dem Umwandlungsgesetz 09.05.2025 (Eintragungsdatum)\n\nEPS Event Protection & Services e.K.\nEinzelkaufmann / Einzelkauffrau\nDüren\n\nDen Gläubigern der an der Ausgliederung beteiligten Rechtsträger ist, wenn sie binnen sechs Monaten nach dem Tag, an dem die Eintragung der Ausgliederung in das Register des Sitzes desjenigen Rechtsträgers, dessen Gläubiger sie sind, nach § 19 Absatz 3 UmwG als bekanntgemacht gilt, ihren Anspruch nach Grund und Höhe schriftlich anmelden, Sicherheit zu leisten, soweit sie nicht Befriedigung verlangen können. Dieses Recht steht den Gläubigern jedoch nur zu, wenn sie glaubhaft machen, dass durch die Ausgliederung die Erfüllung ihrer Forderung gefährdet wird."
    },
    {
      "date": "2025-05-09",
      "id": "108622",
      "original_text": "Registerbekanntmachung nach dem Umwandlungsgesetz\nNordrhein-Westfalen Amtsgericht Bielefeld HRB 7687\nTechnika Beteiligungsgesellschaft mit beschränkter Haftung – Bielefeld",
      "type": "Registerbekanntmachung nach dem Umwandlungsgesetz",
      "state": "Nordrhein-Westfalen",
      "amtsgericht": "Amtsgericht Bielefeld",
      "registernummer": "HRB 7687",
      "registerart": "HRB",
      "company_name": "Technika Beteiligungsgesellschaft mit beschränkter Haftung",
      "company_seat": "Bielefeld",
      "details": "09.05.2025 (Bekanntmachungsdatum)\n\nNordrhein-Westfalen Amtsgericht Bielefeld HRB 7687\nRegisterbekanntmachung nach dem Umwandlungsgesetz 09.05.2025 (Eintragungsdatum)\n\nTechnika Beteiligungsgesellschaft mit beschränkter Haftung\nGesellschaft mit beschränkter Haftung\nBielefeld\n\nDen Gläubigern der an der Verschmelzung beteiligten Rechtsträger ist, wenn sie binnen sechs Monaten nach dem Tag, an dem die Eintragung der Verschmelzung in das Register des Sitzes desjenigen Rechtsträgers, dessen Gläubiger sie sind, nach § 19 Absatz 3 UmwG als bekanntgemacht gilt, ihren Anspruch nach Grund und Höhe schriftlich anmelden, Sicherheit zu leisten, soweit sie nicht Befriedigung verlangen können. Dieses Recht steht den Gläubigern jedoch nur zu, wenn sie glaubhaft machen, dass durch die Verschmelzung die Erfüllung ihrer Forderung gefährdet wird."
    },
    {
      "date": "2025-05-09",
      "id": "108623",
      "original_text": "Einreichung neuer Dokumente\nNordrhein-Westfalen Amtsgericht Köln HRB 100290\nDeutscher Herold Aktiengesellschaft – Köln",
      "type": "Einreichung neuer Dokumente",
      "state": "Nordrhein-Westfalen",
      "amtsgericht": "Amtsgericht Köln",
      "registernummer": "HRB 100290",
      "registerart": "HRB",
      "company_name": "Deutscher Herold Aktiengesellschaft",
      "company_seat": "Köln",
      "details": "09.05.2025 (Bekanntmachungsdatum)\n\nNordrhein-Westfalen Amtsgericht Köln HRB 100290\nEinreichung neuer Dokumente\n\nDeutscher Herold Aktiengesellschaft\nAktiengesellschaft\nKöln\n\nDem Registergericht ist eine Liste der Mitglieder des Aufsichtsrates eingereicht worden."
    },
    {
      "date": "2025-05-09",
      "id": "108624",
      "original_text": "Sonstige Registerbekanntmachung\nNordrhein-Westfalen Amtsgericht Mönchengladbach HRB 16726\nLOGIFLEX Verpackungstechnik GmbH – Mönchengladbach",
      "type": "Sonstige Registerbekanntmachung",
      "state": "Nordrhein-Westfalen",
      "amtsgericht": "Amtsgericht Mönchengladbach",
      "registernummer": "HRB 16726",
      "registerart": "HRB",
      "company_name": "LOGIFLEX Verpackungstechnik GmbH",
      "company_seat": "Mönchengladbach",
      "details": "09.05.2025 (Bekanntmachungsdatum)\n\nNordrhein-Westfalen Amtsgericht Mönchengladbach HRB 16726\nSonstige Registerbekanntmachung 09.05.2025 (Eintragungsdatum)\n\nLOGIFLEX Verpackungstechnik GmbH\nGesellschaft mit beschränkter Haftung\nMönchengladbach\n\nAls nicht eingetragen wird veröffentlicht: Den Gläubigern der Gesellschaft, deren Forderungen begründet worden sind bevor die Eintragung der Beendigung des Beherrschungs- und Gewinnabführungsvertrages  in das Handelsregister nach § 10 des Handelsgesetzbuches als bekanntgemacht gilt, hat der andere Vertragsteil Sicherheit zu leisten, wenn sie sich binnen sechs Monaten nach der Bekanntmachung der Eintragung zu diesem Zweck bei ihm melden."
    },
    {
      "date": "2025-05-09",
      "id": "108625",
      "original_text": "Löschungsankündigung\nNordrhein-Westfalen Amtsgericht Essen HRB 34991\nCro-Bau GmbH – Essen",
      "type": "Löschungsankündigung",
      "state": "Nordrhein-Westfalen",
      "amtsgericht": "Amtsgericht Essen",
      "registernummer": "HRB 34991",
      "registerart": "HRB",
      "company_name": "Cro-Bau GmbH",
      "company_seat": "Essen",
      "details": "09.05.2025 (Bekanntmachungsdatum)\n\nNordrhein-Westfalen Amtsgericht Essen HRB 34991\nLöschungsankündigung\n\nCro-Bau GmbH\nGesellschaft mit beschränkter Haftung\nEssen\n\nDas Registergericht beabsichtigt die Gesellschaft von Amts wegen nach § 394 FamFG zu löschen. Die Frist zur Erhebung eines Widerspruchs ist auf einen Monat festgesetzt."
    },
    {
      "date": "2025-05-09",
      "id": "108626",
      "original_text": "Registerbekanntmachung nach dem Umwandlungsgesetz\nNordrhein-Westfalen Amtsgericht Paderborn HRB 13537\nIMOGENT GmbH – Paderborn",
      "type": "Registerbekanntmachung nach dem Umwandlungsgesetz",
      "state": "Nordrhein-Westfalen",
      "amtsgericht": "Amtsgericht Paderborn",
      "registernummer": "HRB 13537",
      "registerart": "HRB",
      "company_name": "IMOGENT GmbH",
      "company_seat": "Paderborn",
      "details": "09.05.2025 (Bekanntmachungsdatum)\n\nNordrhein-Westfalen Amtsgericht Paderborn HRB 13537\nRegisterbekanntmachung nach dem Umwandlungsgesetz 09.05.2025 (Eintragungsdatum)\n\nIMOGENT GmbH\nGesellschaft mit beschränkter Haftung\nPaderborn\n\nDen Gläubigern der an der Verschmelzung beteiligten Rechtsträger ist, wenn sie binnen sechs Monaten nach dem Tag, an dem die Eintragung der Verschmelzung in das Register des Sitzes desjenigen Rechtsträgers, dessen Gläubiger sie sind, nach § 19 Absatz 3 UmwG als bekanntgemacht gilt, ihren Anspruch nach Grund und Höhe schriftlich anmelden, Sicherheit zu leisten, soweit sie nicht Befriedigung verlangen können. Dieses Recht steht den Gläubigern jedoch nur zu, wenn sie glaubhaft machen, dass durch die Verschmelzung die Erfüllung ihrer Forderung gefährdet wird."
    },
    {
      "date": "2025-05-09",
      "id": "108627",
      "original_text": "Registerbekanntmachung nach dem Umwandlungsgesetz\nNordrhein-Westfalen Amtsgericht Essen HRB 10153\nWTE Wassertechnik GmbH – Essen",
      "type": "Registerbekanntmachung nach dem Umwandlungsgesetz",
      "state": "Nordrhein-Westfalen",
      "amtsgericht": "Amtsgericht Essen",
      "registernummer": "HRB 10153",
      "registerart": "HRB",
      "company_name": "WTE Wassertechnik GmbH",
      "company_seat": "Essen",
      "details": "09.05.2025 (Bekanntmachungsdatum)\n\nNordrhein-Westfalen Amtsgericht Essen HRB 10153\nRegisterbekanntmachung nach dem Umwandlungsgesetz 09.05.2025 (Eintragungsdatum)\n\nWTE Wassertechnik GmbH\nGesellschaft mit beschränkter Haftung\nEssen\n\nDen Gläubigern der an der Abspaltung beteiligten Rechtsträger ist, wenn sie binnen sechs Monaten nach dem Tag, an dem die Eintragung der Abspaltung in das Register des Sitzes desjenigen Rechtsträgers, dessen Gläubiger sie sind, nach § 19 Absatz 3 UmwG als bekanntgemacht gilt, ihren Anspruch nach Grund und Höhe schriftlich anmelden, Sicherheit zu leisten, soweit sie nicht Befriedigung verlangen können. Dieses Recht steht den Gläubigern jedoch nur zu, wenn sie glaubhaft machen, dass durch die Abspaltung die Erfüllung ihrer Forderung gefährdet wird."
    },
    {
      "date": "2025-05-09",
      "id": "108628",
      "original_text": "Löschungsankündigung\nNordrhein-Westfalen Amtsgericht Dortmund HRB 28992\nSABATIN GmbH – Dortmund",
      "type": "Löschungsankündigung",
      "state": "Nordrhein-Westfalen",
      "amtsgericht": "Amtsgericht Dortmund",
      "registernummer": "HRB 28992",
      "registerart": "HRB",
      "company_name": "SABATIN GmbH",
      "company_seat": "Dortmund",
      "details": "09.05.2025 (Bekanntmachungsdatum)\n\nNordrhein-Westfalen Amtsgericht Dortmund HRB 28992\nLöschungsankündigung 09.05.2025 (Eintragungsdatum)\n\nSABATIN GmbH\nGesellschaft mit beschränkter Haftung\nDortmund\n\nDas Registergericht beabsichtigt die Gesellschaft von Amts wegen nach § 394 FamFG zu löschen. Die Frist zur Erhebung eines Widerspruchs ist auf zwei Monate festgesetzt."
    },
    {
      "date": "2025-05-09",
      "id": "108629",
      "original_text": "Registerbekanntmachung nach dem Umwandlungsgesetz\nNordrhein-Westfalen Amtsgericht Paderborn HRB 4931\nFritz Berost Großhandels-GmbH – Warburg",
      "type": "Registerbekanntmachung nach dem Umwandlungsgesetz",
      "state": "Nordrhein-Westfalen",
      "amtsgericht": "Amtsgericht Paderborn",
      "registernummer": "HRB 4931",
      "registerart": "HRB",
      "company_name": "Fritz Berost Großhandels-GmbH",
      "company_seat": "Warburg",
      "details": "09.05.2025 (Bekanntmachungsdatum)\n\nNordrhein-Westfalen Amtsgericht Paderborn HRB 4931\nRegisterbekanntmachung nach dem Umwandlungsgesetz 09.05.2025 (Eintragungsdatum)\n\nFritz Berost Großhandels-GmbH\nGesellschaft mit beschränkter Haftung\nWarburg\n\nDen Gläubigern der an der Verschmelzung beteiligten Rechtsträger ist, wenn sie binnen sechs Monaten nach dem Tag, an dem die Eintragung der Verschmelzung in das Register des Sitzes desjenigen Rechtsträgers, dessen Gläubiger sie sind, nach § 19 Absatz 3 UmwG als bekanntgemacht gilt, ihren Anspruch nach Grund und Höhe schriftlich anmelden, Sicherheit zu leisten, soweit sie nicht Befriedigung verlangen können. Dieses Recht steht den Gläubigern jedoch nur zu, wenn sie glaubhaft machen, dass durch die Verschmelzung die Erfüllung ihrer Forderung gefährdet wird."
    },
    {
      "date": "2025-05-09",
      "id": "108630",
      "original_text": "Löschungsankündigung\nNordrhein-Westfalen Amtsgericht Kleve HRB 16588\nBAUTEC Hochbau UG (haftungsbeschränkt) – Uedem",
      "type": "Löschungsankündigung",
      "state": "Nordrhein-Westfalen",
      "amtsgericht": "Amtsgericht Kleve",
      "registernummer": "HRB 16588",
      "registerart": "HRB",
      "company_name": "BAUTEC Hochbau UG (haftungsbeschränkt)",
      "company_seat": "Uedem",
      "details": "09.05.2025 (Bekanntmachungsdatum)\n\nNordrhein-Westfalen Amtsgericht Kleve HRB 16588\nLöschungsankündigung\n\nBAUTEC Hochbau UG (haftungsbeschränkt)\nGesellschaft mit beschränkter Haftung\nUedem\n\nDas Registergericht beabsichtigt die Gesellschaft von Amts wegen nach § 394 FamFG zu löschen. Die Frist zur Erhebung eines Widerspruchs ist auf einen Monat festgesetzt."
    },
    {
      "date": "2025-05-09",
      "id": "108631",
      "original_text": "Löschungsankündigung\nNordrhein-Westfalen Amtsgericht Hamm HRB 9429\nHand in Hand gGmbH – Hamm",
      "type": "Löschungsankündigung",
      "state": "Nordrhein-Westfalen",
      "amtsgericht": "Amtsgericht Hamm",
      "registernummer": "HRB 9429",
      "registerart": "HRB",
      "company_name": "Hand in Hand gGmbH",
      "company_seat": "Hamm",
      "details": "09.05.2025 (Bekanntmachungsdatum)\n\nNordrhein-Westfalen Amtsgericht Hamm HRB 9429\nLöschungsankündigung\n\nHand in Hand gGmbH\nGesellschaft mit beschränkter Haftung\nHamm\n\nDas Registergericht beabsichtigt die Gesellschaft von Amts wegen nach § 394 FamFG zu löschen. Die Frist zur Erhebung eines Widerspruchs ist auf drei Monate festgesetzt."
    },
    {
      "date": "2025-05-09",
      "id": "108632",
      "original_text": "Einreichung neuer Dokumente\nNordrhein-Westfalen Amtsgericht Düsseldorf HRB 36405\nERGO Vorsorge Lebensversicherung Aktiengesellschaft – Düsseldorf",
      "type": "Einreichung neuer Dokumente",
      "state": "Nordrhein-Westfalen",
      "amtsgericht": "Amtsgericht Düsseldorf",
      "registernummer": "HRB 36405",
      "registerart": "HRB",
      "company_name": "ERGO Vorsorge Lebensversicherung Aktiengesellschaft",
      "company_seat": "Düsseldorf",
      "details": "09.05.2025 (Bekanntmachungsdatum)\n\nNordrhein-Westfalen Amtsgericht Düsseldorf HRB 36405\nEinreichung neuer Dokumente 09.05.2025 (Eintragungsdatum)\n\nERGO Vorsorge Lebensversicherung Aktiengesellschaft\nAktiengesellschaft\nDüsseldorf\n\nDem Registergericht ist eine neue Liste der Mitglieder des Aufsichtsrates eingereicht worden."
    },
    {
      "date": "2025-05-09",
      "id": "108633",
      "original_text": "Einreichung neuer Dokumente\nNordrhein-Westfalen Amtsgericht Bonn HRB 21185\nnorisbank GmbH – Bonn",
      "type": "Einreichung neuer Dokumente",
      "state": "Nordrhein-Westfalen",
      "amtsgericht": "Amtsgericht Bonn",
      "registernummer": "HRB 21185",
      "registerart": "HRB",
      "company_name": "norisbank GmbH",
      "company_seat": "Bonn",
      "details": "09.05.2025 (Bekanntmachungsdatum)\n\nNordrhein-Westfalen Amtsgericht Bonn HRB 21185\nEinreichung neuer Dokumente\n\nnorisbank GmbH\nGesellschaft mit beschränkter Haftung\nBonn\n\nDem Registergericht ist eine neue Liste der Mitglieder des Aufsichtsrates eingereicht worden."
    },
    {
      "date": "2025-05-09",
      "id": "108634",
      "original_text": "Löschungsankündigung\nNordrhein-Westfalen Amtsgericht Krefeld HRB 14109\nDIEP Abwicklungs UG (haftungsbeschränkt) – Krefeld",
      "type": "Löschungsankündigung",
      "state": "Nordrhein-Westfalen",
      "amtsgericht": "Amtsgericht Krefeld",
      "registernummer": "HRB 14109",
      "registerart": "HRB",
      "company_name": "DIEP Abwicklungs UG (haftungsbeschränkt)",
      "company_seat": "Krefeld",
      "details": "09.05.2025 (Bekanntmachungsdatum)\n\nNordrhein-Westfalen Amtsgericht Krefeld HRB 14109\nLöschungsankündigung\n\nDIEP Abwicklungs UG (haftungsbeschränkt)\nGesellschaft mit beschränkter Haftung\nKrefeld\n\nDas Registergericht beabsichtigt die Gesellschaft von Amts wegen nach § 394 FamFG zu löschen. Die Frist zur Erhebung eines Widerspruchs ist auf einen Monat festgesetzt."
    },
    {
      "date": "2025-05-09",
      "id": "108635",
      "original_text": "Registerbekanntmachung nach dem Umwandlungsgesetz\nNordrhein-Westfalen Amtsgericht Düsseldorf HRB 10488\nPark-Hotel GmbH – Düsseldorf",
      "type": "Registerbekanntmachung nach dem Umwandlungsgesetz",
      "state": "Nordrhein-Westfalen",
      "amtsgericht": "Amtsgericht Düsseldorf",
      "registernummer": "HRB 10488",
      "registerart": "HRB",
      "company_name": "Park-Hotel GmbH",
      "company_seat": "Düsseldorf",
      "details": "09.05.2025 (Bekanntmachungsdatum)\n\nNordrhein-Westfalen Amtsgericht Düsseldorf HRB 10488\nRegisterbekanntmachung nach dem Umwandlungsgesetz 09.05.2025 (Eintragungsdatum)\n\nPark-Hotel GmbH\nGesellschaft mit beschränkter Haftung\nDüsseldorf\n\nDen Gläubigern der an der Verschmelzung beteiligten Rechtsträger ist, wenn sie binnen sechs Monaten nach dem Tag, an dem die Eintragung der Verschmelzung in das Register des Sitzes desjenigen Rechtsträgers, dessen Gläubiger sie sind, nach § 19 Absatz 3 UmwG als bekanntgemacht gilt, ihren Anspruch nach Grund und Höhe schriftlich anmelden, Sicherheit zu leisten, soweit sie nicht Befriedigung verlangen können. Dieses Recht steht den Gläubigern jedoch nur zu, wenn sie glaubhaft machen, dass durch die Verschmelzung die Erfüllung ihrer Forderung gefährdet wird."
    },
    {
      "date": "2025-05-09",
      "id": "108636",
      "original_text": "Registerbekanntmachung nach dem Umwandlungsgesetz\nHessen Amtsgericht Frankfurt am Main HRB 94684\nEurocity AG – Frankfurt am Main",
      "type": "Registerbekanntmachung nach dem Umwandlungsgesetz",
      "state": "Hessen",
      "amtsgericht": "Amtsgericht Frankfurt am Main",
      "registernummer": "HRB 94684",
      "registerart": "HRB",
      "company_name": "Eurocity AG",
      "company_seat": "Frankfurt am Main",
      "details": "09.05.2025 (Bekanntmachungsdatum)\n\nHessen Amtsgericht Frankfurt am Main HRB 94684\nRegisterbekanntmachung nach dem Umwandlungsgesetz 05.05.2025 (Eintragungsdatum)\n\nEurocity AG\nAktiengesellschaft\nFrankfurt am Main\n\nDem Registergericht ist ein Ausgliederungs und Übernahmevertrag  über die geplante Umwandlung der Eurocity AG mit Sitz in Frankfurt am Main (Aktiengesellschaft, eingetragen beim Amtsgericht Frankfurt am Main unter der HRB  94684) als übertragender Rechtsträger mit der SCUR-Alpha 272 GmbH mit Sitz in Frankfurt am Main, eingetragen im Handelsregister des Amtsgerichts Frankfurt am Main unter HRB 137638 mit als übernehmender Rechtsträger zur Einsichtnahme eingereicht worden."
    },
    {
      "date": "2025-05-09",
      "id": "108637",
      "original_text": "Einreichung neuer Dokumente\nHessen Amtsgericht Wiesbaden VR 4005\nGesangverein Sängerbund 1847 E.V. Flörsheim am Main – Flörsheim am Main",
      "type": "Einreichung neuer Dokumente",
      "state": "Hessen",
      "amtsgericht": "Amtsgericht Wiesbaden",
      "registernummer": "VR 4005",
      "registerart": "VR",
      "company_name": "Gesangverein Sängerbund 1847 E.V. Flörsheim am Main",
      "company_seat": "Flörsheim am Main",
      "details": "09.05.2025 (Bekanntmachungsdatum)\n\nHessen Amtsgericht Wiesbaden VR 4005\nEinreichung neuer Dokumente 09.05.2025 (Eintragungsdatum)\n\nGesangverein Sängerbund 1847 E.V. Flörsheim am Main\neingetragener Verein\nFlörsheim am Main\n\nDer Verein ist aufgelöst."
    },
    {
      "date": "2025-05-09",
      "id": "108638",
      "original_text": "Registerbekanntmachung nach dem Umwandlungsgesetz\nHessen Amtsgericht Frankfurt am Main HRB 112366\nSpiff Invest GmbH – Frankfurt am Main",
      "type": "Registerbekanntmachung nach dem Umwandlungsgesetz",
      "state": "Hessen",
      "amtsgericht": "Amtsgericht Frankfurt am Main",
      "registernummer": "HRB 112366",
      "registerart": "HRB",
      "company_name": "Spiff Invest GmbH",
      "company_seat": "Frankfurt am Main",
      "details": "09.05.2025 (Bekanntmachungsdatum)\n\nHessen Amtsgericht Frankfurt am Main HRB 112366\nRegisterbekanntmachung nach dem Umwandlungsgesetz 09.05.2025 (Eintragungsdatum)\n\nSpiff Invest GmbH\nGesellschaft mit beschränkter Haftung\nFrankfurt am Main\n\nDen Gläubigern der an der Verschmelzung beteiligten Rechtsträger ist, wenn sie binnen sechs Monaten nach dem Tag, an dem die Eintragung der Verschmelzung in das Register des Sitzes desjenigen Rechtsträgers, dessen Gläubiger sie sind, nach § 19 Absatz 3 UmwG bekannt gemacht worden ist, ihren Anspruch nach Grund und Höhe schriftlich anmelden, Sicherheit zu leisten, soweit sie nicht Befriedigung verlangen können. Dieses Recht steht den Gläubigern jedoch nur zu, wenn sie glaubhaft machen, dass durch die Verschmelzung die Erfüllung ihrer Forderung gefährdet wird."
    },
    {
      "date": "2025-05-09",
      "id": "108639",
      "original_text": "Löschungsankündigung\nHessen Amtsgericht Hanau HRB 93462\nB u B Electronic UG (haftungsbeschränkt) – Birstein",
      "type": "Löschungsankündigung",
      "state": "Hessen",
      "amtsgericht": "Amtsgericht Hanau",
      "registernummer": "HRB 93462",
      "registerart": "HRB",
      "company_name": "B u B Electronic UG (haftungsbeschränkt)",
      "company_seat": "Birstein",
      "details": "09.05.2025 (Bekanntmachungsdatum)\n\nHessen Amtsgericht Hanau HRB 93462\nLöschungsankündigung\n\nB u B Electronic UG (haftungsbeschränkt)\nGesellschaft mit beschränkter Haftung\nBirstein\n\nDas Registergericht beabsichtigt die im Handelsregister eingetragene Gesellschaft von Amts wegen nach § 394 FamFG zu löschen. Die Frist zur Erhebung eines Widerspruchs gegen die beabsichtigte Löschung wird auf 3 Monate festgesetzt."
    },
    {
      "date": "2025-05-09",
      "id": "108640",
      "original_text": "Registerbekanntmachung nach dem Umwandlungsgesetz\nHessen Amtsgericht Darmstadt HRB 92116\nmark17 GmbH – Darmstadt",
      "type": "Registerbekanntmachung nach dem Umwandlungsgesetz",
      "state": "Hessen",
      "amtsgericht": "Amtsgericht Darmstadt",
      "registernummer": "HRB 92116",
      "registerart": "HRB",
      "company_name": "mark17 GmbH",
      "company_seat": "Darmstadt",
      "details": "09.05.2025 (Bekanntmachungsdatum)\n\nHessen Amtsgericht Darmstadt HRB 92116\nRegisterbekanntmachung nach dem Umwandlungsgesetz 09.05.2025 (Eintragungsdatum)\n\nmark17 GmbH\nGesellschaft mit beschränkter Haftung\nDarmstadt\n\nDen Gläubigern der an der Verschmelzung beteiligten Rechtsträger ist, wenn sie binnen sechs Monaten nach dem Tag, an dem die Eintragung der Verschmelzung in das Register des Sitzes derjenigen Rechtsträger deren Gläubiger sie sind, nach § 19 Absatz 3 UmwG bekannt gemacht worden ist, ihren Anspruch nach Grund und Höhe schriftlich anmelden, Sicherheit zu leisten, soweit sie nicht Befriedigung verlangen können. Dieses Recht steht den Gläubigern jedoch nur zu, wenn sie glaubhaft machen, dass durch die Verschmelzung die Erfüllung ihrer Forderung gefährdet wird."
    },
    {
      "date": "2025-05-09",
      "id": "108641",
      "original_text": "Löschungsankündigung\nHessen Amtsgericht Frankfurt am Main HRB 123072\n27 Transporte GmbH – Frankfurt am Main",
      "type": "Löschungsankündigung",
      "state": "Hessen",
      "amtsgericht": "Amtsgericht Frankfurt am Main",
      "registernummer": "HRB 123072",
      "registerart": "HRB",
      "company_name": "27 Transporte GmbH",
      "company_seat": "Frankfurt am Main",
      "details": "09.05.2025 (Bekanntmachungsdatum)\n\nHessen Amtsgericht Frankfurt am Main HRB 123072\nLöschungsankündigung 09.05.2025 (Eintragungsdatum)\n\n27 Transporte GmbH\nGesellschaft mit beschränkter Haftung\nFrankfurt am Main\n\nEs ist beabsichtigt die Gesellschaft wegen Vermögenslosigkeit gemäß § 394 FamFG von Amts wegen zu löschen. Hiergegen kann innerhalb eines Monats nach dieser Veröffentlichung Widerspruch bei dem Amtsgericht Frankfurt am Main eingelegt werden."
    },
    {
      "date": "2025-05-09",
      "id": "108642",
      "original_text": "Registerbekanntmachung nach dem Umwandlungsgesetz\nHessen Amtsgericht Offenbach am Main HRA 42905\nIF Pflegedienst e.K., Inh. Ingrid Fromm – Dietzenbach",
      "type": "Registerbekanntmachung nach dem Umwandlungsgesetz",
      "state": "Hessen",
      "amtsgericht": "Amtsgericht Offenbach am Main",
      "registernummer": "HRA 42905",
      "registerart": "HRA",
      "company_name": "IF Pflegedienst e.K., Inh. Ingrid Fromm",
      "company_seat": "Dietzenbach",
      "details": "09.05.2025 (Bekanntmachungsdatum)\n\nHessen Amtsgericht Offenbach am Main HRA 42905\nRegisterbekanntmachung nach dem Umwandlungsgesetz 09.05.2025 (Eintragungsdatum)\n\nIF Pflegedienst e.K., Inh. Ingrid Fromm\nEinzelkaufmann / Einzelkauffrau\nDietzenbach\n\nDen Gläubigern der an der Ausgliederung beteiligten Rechtsträger ist, wenn sie binnen sechs Monaten nach dem Tag, an dem die Eintragung der Ausgliederung in das Register des Sitzes desjenigen Rechtsträgers, dessen Gläubiger sie sind, nach §§ 125, 19 Absatz 3 UmwG bekannt gemacht worden ist, ihren Anspruch nach Grund und Höhe schriftlich anmelden, Sicherheit zu leisten, soweit sie nicht Befriedigung verlangen können. Dieses Recht steht den Gläubigern jedoch nur zu, wenn sie glaubhaft machen, dass durch die Ausgliederung die Erfüllung ihrer Forderung gefährdet wird."
    },
    {
      "date": "2025-05-09",
      "id": "108643",
      "original_text": "Löschungsankündigung\nHessen Amtsgericht Darmstadt HRB 40129\nC.-Werke GmbH – Wald-Michelbach",
      "type": "Löschungsankündigung",
      "state": "Hessen",
      "amtsgericht": "Amtsgericht Darmstadt",
      "registernummer": "HRB 40129",
      "registerart": "HRB",
      "company_name": "C.-Werke GmbH",
      "company_seat": "Wald-Michelbach",
      "details": "09.05.2025 (Bekanntmachungsdatum)\n\nHessen Amtsgericht Darmstadt HRB 40129\nLöschungsankündigung\n\nC.-Werke GmbH\nGesellschaft mit beschränkter Haftung\nWald-Michelbach\n\nDas Registergericht beabsichtigt die im Handelsregister eingetragene Gesellschaft von Amts wegen nach § 394 FamFG zu löschen. Die Frist zur Erhebung eines Widerspruchs gegen die beabsichtigte Löschung wird auf 3 Monate festgesetzt."
    },
    {
      "date": "2025-05-09",
      "id": "108644",
      "original_text": "Sonstige Registerbekanntmachung\nHessen Amtsgericht Limburg VR 1487\nGem. Chor \"Eintracht\" Langenbach – Weilmünster-Langenbach",
      "type": "Sonstige Registerbekanntmachung",
      "state": "Hessen",
      "amtsgericht": "Amtsgericht Limburg",
      "registernummer": "VR 1487",
      "registerart": "VR",
      "company_name": "Gem. Chor \"Eintracht\" Langenbach",
      "company_seat": "Weilmünster-Langenbach",
      "details": "09.05.2025 (Bekanntmachungsdatum)\n\nHessen Amtsgericht Limburg VR 1487\nSonstige Registerbekanntmachung 09.05.2025 (Eintragungsdatum)\n\nGem. Chor \"Eintracht\" Langenbach\neingetragener Verein\nWeilmünster-Langenbach\n\nDer Verein ist aufgelöst."
    },
    {
      "date": "2025-05-09",
      "id": "108645",
      "original_text": "Sonstige Registerbekanntmachung\nHessen Amtsgericht Frankfurt am Main HRB 108109\nStandard Chartered Bank AG – Frankfurt am Main",
      "type": "Sonstige Registerbekanntmachung",
      "state": "Hessen",
      "amtsgericht": "Amtsgericht Frankfurt am Main",
      "registernummer": "HRB 108109",
      "registerart": "HRB",
      "company_name": "Standard Chartered Bank AG",
      "company_seat": "Frankfurt am Main",
      "details": "09.05.2025 (Bekanntmachungsdatum)\n\nHessen Amtsgericht Frankfurt am Main HRB 108109\nSonstige Registerbekanntmachung\n\nStandard Chartered Bank AG\nAktiengesellschaft\nFrankfurt am Main\n\nDurch eine Änderung in den Personen der Aufsichtsratsmitglieder ist eine Liste der Mitglieder des Aufsichtsrates zum Handelsregister eingereicht worden."
    },
    {
      "date": "2025-05-09",
      "id": "108646",
      "original_text": "Registerbekanntmachung nach dem Umwandlungsgesetz\nHessen Amtsgericht Darmstadt HRB 103977\nLufthansa Group Digital Hangar GmbH – Raunheim",
      "type": "Registerbekanntmachung nach dem Umwandlungsgesetz",
      "state": "Hessen",
      "amtsgericht": "Amtsgericht Darmstadt",
      "registernummer": "HRB 103977",
      "registerart": "HRB",
      "company_name": "Lufthansa Group Digital Hangar GmbH",
      "company_seat": "Raunheim",
      "details": "09.05.2025 (Bekanntmachungsdatum)\n\nHessen Amtsgericht Darmstadt HRB 103977\nRegisterbekanntmachung nach dem Umwandlungsgesetz 09.05.2025 (Eintragungsdatum)\n\nLufthansa Group Digital Hangar GmbH\nGesellschaft mit beschränkter Haftung\nRaunheim\n\nDen Gläubigern der an der Verschmelzung beteiligten Rechtsträger ist, wenn sie binnen sechs Monaten nach dem Tag, an dem die Eintragung der Verschmelzung in das Register des Sitzes derjenigen Rechtsträger deren Gläubiger sie sind, nach § 19 Absatz 3 UmwG bekannt gemacht worden ist, ihren Anspruch nach Grund und Höhe schriftlich anmelden, Sicherheit zu leisten, soweit sie nicht Befriedigung verlangen können. Dieses Recht steht den Gläubigern jedoch nur zu, wenn sie glaubhaft machen, dass durch die Verschmelzung die Erfüllung ihrer Forderung gefährdet wird."
    },
    {
      "date": "2025-05-09",
      "id": "108647",
      "original_text": "Registerbekanntmachung nach dem Umwandlungsgesetz\nHessen Amtsgericht Offenbach am Main HRB 57669\nIngrid Fromm Pflegedienst GmbH – Dietzenbach",
      "type": "Registerbekanntmachung nach dem Umwandlungsgesetz",
      "state": "Hessen",
      "amtsgericht": "Amtsgericht Offenbach am Main",
      "registernummer": "HRB 57669",
      "registerart": "HRB",
      "company_name": "Ingrid Fromm Pflegedienst GmbH",
      "company_seat": "Dietzenbach",
      "details": "09.05.2025 (Bekanntmachungsdatum)\n\nHessen Amtsgericht Offenbach am Main HRB 57669\nRegisterbekanntmachung nach dem Umwandlungsgesetz 09.05.2025 (Eintragungsdatum)\n\nIngrid Fromm Pflegedienst GmbH\nGesellschaft mit beschränkter Haftung\nDietzenbach\n\nDen Gläubigern der an der Ausgliederung beteiligten Rechtsträger ist, wenn sie binnen sechs Monaten nach dem Tag, an dem die Eintragung der Ausgliederung in das Register des Sitzes desjenigen Rechtsträgers, dessen Gläubiger sie sind, nach §§ 125, 19 Absatz 3 UmwG bekannt gemacht worden ist, ihren Anspruch nach Grund und Höhe schriftlich anmelden, Sicherheit zu leisten, soweit sie nicht Befriedigung verlangen können. Dieses Recht steht den Gläubigern jedoch nur zu, wenn sie glaubhaft machen, dass durch die Ausgliederung die Erfüllung ihrer Forderung gefährdet wird."
    },
    {
      "date": "2025-05-09",
      "id": "108648",
      "original_text": "Registerbekanntmachung nach dem Umwandlungsgesetz\nHessen Amtsgericht Bad Homburg v.d.H. HRB 13017\nPharmaLex GmbH – Bad Homburg v. d. Höhe",
      "type": "Registerbekanntmachung nach dem Umwandlungsgesetz",
      "state": "Hessen",
      "amtsgericht": "Amtsgericht Bad Homburg v.d.H.",
      "registernummer": "HRB 13017",
      "registerart": "HRB",
      "company_name": "PharmaLex GmbH",
      "company_seat": "Bad Homburg v. d. Höhe",
      "details": "09.05.2025 (Bekanntmachungsdatum)\n\nHessen Amtsgericht Bad Homburg v.d.H. HRB 13017\nRegisterbekanntmachung nach dem Umwandlungsgesetz 09.05.2025 (Eintragungsdatum)\n\nPharmaLex GmbH\nGesellschaft mit beschränkter Haftung\nBad Homburg v. d. Höhe\n\nDen Gläubigern der an der Verschmelzung beteiligten Rechtsträger ist, wenn sie binnen sechs Monaten nach dem Tag, an dem die Eintragung der Verschmelzung in das Register des Sitzes desjenigen Rechtsträgers, dessen Gläubiger sie sind, nach § 19 Absatz 3 UmwG bekannt gemacht worden ist, ihren Anspruch nach Grund und Höhe schriftlich anmelden, Sicherheit zu leisten, soweit sie nicht Befriedigung verlangen können. Dieses Recht steht den Gläubigern jedoch nur zu, wenn sie glaubhaft machen, dass durch die Verschmelzung die Erfüllung ihrer Forderung gefährdet wird."
    },
    {
      "date": "2025-05-09",
      "id": "108649",
      "original_text": "Registerbekanntmachung nach dem Umwandlungsgesetz\nHessen Amtsgericht Darmstadt HRB 99037\nYANA GmbH – Darmstadt",
      "type": "Registerbekanntmachung nach dem Umwandlungsgesetz",
      "state": "Hessen",
      "amtsgericht": "Amtsgericht Darmstadt",
      "registernummer": "HRB 99037",
      "registerart": "HRB",
      "company_name": "YANA GmbH",
      "company_seat": "Darmstadt",
      "details": "09.05.2025 (Bekanntmachungsdatum)\n\nHessen Amtsgericht Darmstadt HRB 99037\nRegisterbekanntmachung nach dem Umwandlungsgesetz 09.05.2025 (Eintragungsdatum)\n\nYANA GmbH\nGesellschaft mit beschränkter Haftung\nDarmstadt\n\nDen Gläubigern der an der Verschmelzung beteiligten Rechtsträger ist, wenn sie binnen sechs Monaten nach dem Tag, an dem die Eintragung der Verschmelzung in das Register des Sitzes derjenigen Rechtsträger deren Gläubiger sie sind, nach § 19 Absatz 3 UmwG bekannt gemacht worden ist, ihren Anspruch nach Grund und Höhe schriftlich anmelden, Sicherheit zu leisten, soweit sie nicht Befriedigung verlangen können. Dieses Recht steht den Gläubigern jedoch nur zu, wenn sie glaubhaft machen, dass durch die Verschmelzung die Erfüllung ihrer Forderung gefährdet wird."
    },
    {
      "date": "2025-05-09",
      "id": "108650",
      "original_text": "Registerbekanntmachung nach dem Umwandlungsgesetz\nHessen Amtsgericht Darmstadt HRB 107154\nSANI Vermögensverwaltungs GmbH – Groß-Gerau",
      "type": "Registerbekanntmachung nach dem Umwandlungsgesetz",
      "state": "Hessen",
      "amtsgericht": "Amtsgericht Darmstadt",
      "registernummer": "HRB 107154",
      "registerart": "HRB",
      "company_name": "SANI Vermögensverwaltungs GmbH",
      "company_seat": "Groß-Gerau",
      "details": "09.05.2025 (Bekanntmachungsdatum)\n\nHessen Amtsgericht Darmstadt HRB 107154\nRegisterbekanntmachung nach dem Umwandlungsgesetz 09.05.2025 (Eintragungsdatum)\n\nSANI Vermögensverwaltungs GmbH\nGesellschaft mit beschränkter Haftung\nGroß-Gerau\n\nDen Gläubigern der an der Abspaltung beteiligten Rechtsträger ist, wenn sie binnen sechs Monaten nach dem Tag, an dem die Eintragung der Abspaltung in das Register des Sitzes derjenigen Rechtsträger deren Gläubiger sie sind, nach §§ 125, 19 Absatz 3 UmwG bekannt gemacht worden ist, ihren Anspruch nach Grund und Höhe schriftlich anmelden, Sicherheit zu leisten, soweit sie nicht Befriedigung verlangen können. Dieses Recht steht den Gläubigern jedoch nur zu, wenn sie glaubhaft machen, dass durch die Abspaltung die Erfüllung ihrer Forderung gefährdet wird."
    },
    {
      "date": "2025-05-09",
      "id": "108651",
      "original_text": "Registerbekanntmachung nach dem Umwandlungsgesetz\nHessen Amtsgericht Frankfurt am Main HRB 88728\nPanta Rhei Beteiligungs-GmbH – Frankfurt",
      "type": "Registerbekanntmachung nach dem Umwandlungsgesetz",
      "state": "Hessen",
      "amtsgericht": "Amtsgericht Frankfurt am Main",
      "registernummer": "HRB 88728",
      "registerart": "HRB",
      "company_name": "Panta Rhei Beteiligungs-GmbH",
      "company_seat": "Frankfurt",
      "details": "09.05.2025 (Bekanntmachungsdatum)\n\nHessen Amtsgericht Frankfurt am Main HRB 88728\nRegisterbekanntmachung nach dem Umwandlungsgesetz 09.05.2025 (Eintragungsdatum)\n\nPanta Rhei Beteiligungs-GmbH\nGesellschaft mit beschränkter Haftung\nFrankfurt\n\nDen Gläubigern der an der Verschmelzung beteiligten Rechtsträger ist, wenn sie binnen sechs Monaten nach dem Tag, an dem die Eintragung der Verschmelzung in das Register des Sitzes desjenigen Rechtsträgers, dessen Gläubiger sie sind, nach § 19 Absatz 3 UmwG bekannt gemacht worden ist, ihren Anspruch nach Grund und Höhe schriftlich anmelden, Sicherheit zu leisten, soweit sie nicht Befriedigung verlangen können. Dieses Recht steht den Gläubigern jedoch nur zu, wenn sie glaubhaft machen, dass durch die Verschmelzung die Erfüllung ihrer Forderung gefährdet wird."
    },
    {
      "date": "2025-05-09",
      "id": "108652",
      "original_text": "Einreichung neuer Dokumente\nHessen Amtsgericht Frankfurt am Main HRB 31022\nBank Julius Bär Deutschland AG – Frankfurt am Main",
      "type": "Einreichung neuer Dokumente",
      "state": "Hessen",
      "amtsgericht": "Amtsgericht Frankfurt am Main",
      "registernummer": "HRB 31022",
      "registerart": "HRB",
      "company_name": "Bank Julius Bär Deutschland AG",
      "company_seat": "Frankfurt am Main",
      "details": "09.05.2025 (Bekanntmachungsdatum)\n\nHessen Amtsgericht Frankfurt am Main HRB 31022\nEinreichung neuer Dokumente 28.04.2025 (Eintragungsdatum)\n\nBank Julius Bär Deutschland AG\nAktiengesellschaft\nFrankfurt am Main\n\nDurch eine Änderung in den Personen der Aufsichtsratsmitglieder ist eine Liste der Mitglieder des Aufsichtsrates zum Handelsregister eingereicht worden."
    },
    {
      "date": "2025-05-09",
      "id": "108653",
      "original_text": "Sonstige Registerbekanntmachung\nHessen Amtsgericht Limburg VR 1698\nGesangverein \"Liederkranz\" 1863 – Löhnberg-Niedershausen",
      "type": "Sonstige Registerbekanntmachung",
      "state": "Hessen",
      "amtsgericht": "Amtsgericht Limburg",
      "registernummer": "VR 1698",
      "registerart": "VR",
      "company_name": "Gesangverein \"Liederkranz\" 1863",
      "company_seat": "Löhnberg-Niedershausen",
      "details": "09.05.2025 (Bekanntmachungsdatum)\n\nHessen Amtsgericht Limburg VR 1698\nSonstige Registerbekanntmachung 09.05.2025 (Eintragungsdatum)\n\nGesangverein \"Liederkranz\" 1863\neingetragener Verein\nLöhnberg-Niedershausen\n\nDer Verein ist aufgelöst."
    },
    {
      "date": "2025-05-09",
      "id": "108654",
      "original_text": "Registerbekanntmachung nach dem Umwandlungsgesetz\nHessen Amtsgericht Darmstadt HRB 51431\nBBA Bodenbelags- und Ausbau GmbH – Büttelborn",
      "type": "Registerbekanntmachung nach dem Umwandlungsgesetz",
      "state": "Hessen",
      "amtsgericht": "Amtsgericht Darmstadt",
      "registernummer": "HRB 51431",
      "registerart": "HRB",
      "company_name": "BBA Bodenbelags- und Ausbau GmbH",
      "company_seat": "Büttelborn",
      "details": "09.05.2025 (Bekanntmachungsdatum)\n\nHessen Amtsgericht Darmstadt HRB 51431\nRegisterbekanntmachung nach dem Umwandlungsgesetz 09.05.2025 (Eintragungsdatum)\n\nBBA Bodenbelags- und Ausbau GmbH\nGesellschaft mit beschränkter Haftung\nBüttelborn\n\nDen Gläubigern der an der Abspaltung beteiligten Rechtsträger ist, wenn sie binnen sechs Monaten nach dem Tag, an dem die Eintragung der Abspaltung in das Register des Sitzes derjenigen Rechtsträger deren Gläubiger sie sind, nach §§ 125, 19 Absatz 3 UmwG bekannt gemacht worden ist, ihren Anspruch nach Grund und Höhe schriftlich anmelden, Sicherheit zu leisten, soweit sie nicht Befriedigung verlangen können. Dieses Recht steht den Gläubigern jedoch nur zu, wenn sie glaubhaft machen, dass durch die Abspaltung die Erfüllung ihrer Forderung gefährdet wird."
    }
  ]
}