{
  "date": "2025-05-28",
  "date_of_scrape": "2025-05-31T13:25:19.220Z",
  "tool_version": "0.2.0",
  "number_of_announcements": 191,
  "announcements": [
    {
      "date": "2025-05-28",
      "id": "110411",
      "original_text": "Registerbekanntmachung nach dem Umwandlungsgesetz\nBayern Amtsgericht Kempten (Allgäu) HRB 16560\nGeiger FM Grünservice GmbH – Dietmannsried",
      "type": "Registerbekanntmachung nach dem Umwandlungsgesetz",
      "state": "Bayern",
      "amtsgericht": "Amtsgericht Kempten (Allgäu)",
      "registernummer": "HRB 16560",
      "registerart": "HRB",
      "company_name": "Geiger FM Grünservice GmbH",
      "company_seat": "Dietmannsried",
      "details": "28.05.2025 (Bekanntmachungsdatum)\n\nBayern Amtsgericht Kempten (Allgäu) HRB 16560\nRegisterbekanntmachung nach dem Umwandlungsgesetz 27.05.2025 (Eintragungsdatum)\n\nGeiger FM Grünservice GmbH\nGesellschaft mit beschränkter Haftung\nDietmannsried\n\nDen Gläubigern der an der Verschmelzung beteiligten Rechtsträger ist, wenn sie binnen sechs Monaten nach dem Tag, an dem die Eintragung der Verschmelzung in das Register des Sitzes desjenigen Rechtsträgers, dessen Gläubiger sie sind, nach § 19 Abs. 3 UmwG als bekannt gemacht gilt, ihren Anspruch nach Grund und Höhe in Textform anmelden, Sicherheit zu leisten, soweit sie nicht Befriedigung verlangen können. Dieses Recht steht den Gläubigern jedoch nur zu, wenn sie glaubhaft machen, dass durch die Verschmelzung die Erfüllung ihrer Forderung gefährdet wird."
    },
    {
      "date": "2025-05-28",
      "id": "110412",
      "original_text": "Registerbekanntmachung nach dem Umwandlungsgesetz\nBayern Amtsgericht Traunstein HRA 14949\nMarinus Rieder Baugeschäft e.K. – Großkarolinenfeld",
      "type": "Registerbekanntmachung nach dem Umwandlungsgesetz",
      "state": "Bayern",
      "amtsgericht": "Amtsgericht Traunstein",
      "registernummer": "HRA 14949",
      "registerart": "HRA",
      "company_name": "Marinus Rieder Baugeschäft e.K.",
      "company_seat": "Großkarolinenfeld",
      "details": "28.05.2025 (Bekanntmachungsdatum)\n\nBayern Amtsgericht Traunstein HRA 14949\nRegisterbekanntmachung nach dem Umwandlungsgesetz 27.05.2025 (Eintragungsdatum)\n\nMarinus Rieder Baugeschäft e.K.\nEinzelkaufmann / Einzelkauffrau\nGroßkarolinenfeld\n\nDen Gläubigern der an der Ausgliederung beteiligten Rechtsträger ist, wenn sie binnen sechs Monaten nach dem Tag, an dem die Eintragung der Ausgliederung in das Register des Sitzes desjenigen Rechtsträgers, dessen Gläubiger sie sind, nach §§ 125, 19 Abs. 3 UmwG als bekannt gemacht gilt, ihren Anspruch nach Grund und Höhe in Textform anmelden, Sicherheit zu leisten, soweit sie nicht Befriedigung verlangen können. Dieses Recht steht den Gläubigern jedoch nur zu, wenn sie glaubhaft machen, dass durch die Ausgliederung die Erfüllung ihrer Forderung gefährdet wird."
    },
    {
      "date": "2025-05-28",
      "id": "110413",
      "original_text": "Löschungsankündigung\nBayern Amtsgericht Augsburg HRB 29472\nSILA Handels GmbH – Augsburg",
      "type": "Löschungsankündigung",
      "state": "Bayern",
      "amtsgericht": "Amtsgericht Augsburg",
      "registernummer": "HRB 29472",
      "registerart": "HRB",
      "company_name": "SILA Handels GmbH",
      "company_seat": "Augsburg",
      "details": "28.05.2025 (Bekanntmachungsdatum)\n\nBayern Amtsgericht Augsburg HRB 29472\nLöschungsankündigung\n\nSILA Handels GmbH\nGesellschaft mit beschränkter Haftung\nAugsburg\n\nDas Registergericht beabsichtigt, die im Handelsregister eingetragene Gesellschaft wegen Vermögenslosigkeit von Amts wegen nach § 394 FamFG zu löschen. Die Frist zur Erhebung eines Widerspruchs ist auf einen Monat festgesetzt."
    },
    {
      "date": "2025-05-28",
      "id": "110414",
      "original_text": "Registerbekanntmachung nach dem Umwandlungsgesetz\nBayern Amtsgericht Ingolstadt HRB 6069\nTreuburg Verwaltungsgesellschaft mbH – Ingolstadt",
      "type": "Registerbekanntmachung nach dem Umwandlungsgesetz",
      "state": "Bayern",
      "amtsgericht": "Amtsgericht Ingolstadt",
      "registernummer": "HRB 6069",
      "registerart": "HRB",
      "company_name": "Treuburg Verwaltungsgesellschaft mbH",
      "company_seat": "Ingolstadt",
      "details": "28.05.2025 (Bekanntmachungsdatum)\n\nBayern Amtsgericht Ingolstadt HRB 6069\nRegisterbekanntmachung nach dem Umwandlungsgesetz 27.05.2025 (Eintragungsdatum)\n\nTreuburg Verwaltungsgesellschaft mbH\nGesellschaft mit beschränkter Haftung\nIngolstadt\n\nDen Gläubigern #dv.auswahl der an der Verschmelzung beteiligten Rechtsträger ist, wenn sie binnen sechs Monaten nach dem Tag, an dem die Eintragung der Verschmelzung in das Register des Sitzes desjenigen Rechtsträgers, dessen Gläubiger sie sind, nach § 19 Abs. 3 UmwG als bekannt gemacht gilt, ihren Anspruch nach Grund und Höhe in Textform anmelden, Sicherheit zu leisten, soweit sie nicht Befriedigung verlangen können. Dieses Recht steht den Gläubigern jedoch nur zu, wenn sie glaubhaft machen, dass durch die Verschmelzung die Erfüllung ihrer Forderung gefährdet wird."
    },
    {
      "date": "2025-05-28",
      "id": "110415",
      "original_text": "Einreichung neuer Dokumente\nBayern Amtsgericht Nürnberg HRB 66\nNÜRNBERGER Beteiligungs-AG – Nürnberg",
      "type": "Einreichung neuer Dokumente",
      "state": "Bayern",
      "amtsgericht": "Amtsgericht Nürnberg",
      "registernummer": "HRB 66",
      "registerart": "HRB",
      "company_name": "NÜRNBERGER Beteiligungs-AG",
      "company_seat": "Nürnberg",
      "details": "28.05.2025 (Bekanntmachungsdatum)\n\nBayern Amtsgericht Nürnberg HRB 66\nEinreichung neuer Dokumente\n\nNÜRNBERGER Beteiligungs-AG\nAktiengesellschaft\nNürnberg\n\nDem Amtsgericht Nürnberg -Registergericht- ist eine Liste der Mitglieder des Aufsichtsrats eingereicht worden, § 106 AktG."
    },
    {
      "date": "2025-05-28",
      "id": "110416",
      "original_text": "Registerbekanntmachung nach dem Umwandlungsgesetz\nBayern Amtsgericht Kempten (Allgäu) HRB 15405\nLämmle Tuningen GmbH – Oberstdorf",
      "type": "Registerbekanntmachung nach dem Umwandlungsgesetz",
      "state": "Bayern",
      "amtsgericht": "Amtsgericht Kempten (Allgäu)",
      "registernummer": "HRB 15405",
      "registerart": "HRB",
      "company_name": "Lämmle Tuningen GmbH",
      "company_seat": "Oberstdorf",
      "details": "28.05.2025 (Bekanntmachungsdatum)\n\nBayern Amtsgericht Kempten (Allgäu) HRB 15405\nRegisterbekanntmachung nach dem Umwandlungsgesetz 27.05.2025 (Eintragungsdatum)\n\nLämmle Tuningen GmbH\nGesellschaft mit beschränkter Haftung\nOberstdorf\n\nDen Gläubigern des formwechselnden Rechtsträgers ist, wenn sie binnen sechs Monaten nach dem Tag, an dem die Eintragung des Formwechsels nach § 201 UmwG als bekannt gemacht gilt, ihren Anspruch nach Grund und Höhe in Textform anmelden, Sicherheit zu leisten, soweit sie nicht Befriedigung verlangen können. Dieses Recht steht den Gläubigern jedoch nur zu, wenn sie glaubhaft machen, dass durch den Formwechsel die Erfüllung ihrer Forderung gefährdet wird."
    },
    {
      "date": "2025-05-28",
      "id": "110417",
      "original_text": "Einreichung neuer Dokumente\nBayern Amtsgericht Augsburg HRB 18823\nUPM-Kymmene Beteiligungs GmbH – Augsburg",
      "type": "Einreichung neuer Dokumente",
      "state": "Bayern",
      "amtsgericht": "Amtsgericht Augsburg",
      "registernummer": "HRB 18823",
      "registerart": "HRB",
      "company_name": "UPM-Kymmene Beteiligungs GmbH",
      "company_seat": "Augsburg",
      "details": "28.05.2025 (Bekanntmachungsdatum)\n\nBayern Amtsgericht Augsburg HRB 18823\nEinreichung neuer Dokumente 27.05.2025 (Eintragungsdatum)\n\nUPM-Kymmene Beteiligungs GmbH\nGesellschaft mit beschränkter Haftung\nAugsburg\n\nDem Amtsgericht Augsburg -Registergericht- ist eine Liste der Mitglieder des Aufsichtsrats eingereicht worden, § 52 Abs. 3 S. 2 GmbHG."
    },
    {
      "date": "2025-05-28",
      "id": "110418",
      "original_text": "Registerbekanntmachung nach dem Umwandlungsgesetz\nBayern Amtsgericht München HRB 271584\nIFM Vermögensverwaltung GmbH – München",
      "type": "Registerbekanntmachung nach dem Umwandlungsgesetz",
      "state": "Bayern",
      "amtsgericht": "Amtsgericht München",
      "registernummer": "HRB 271584",
      "registerart": "HRB",
      "company_name": "IFM Vermögensverwaltung GmbH",
      "company_seat": "München",
      "details": "28.05.2025 (Bekanntmachungsdatum)\n\nBayern Amtsgericht München HRB 271584\nRegisterbekanntmachung nach dem Umwandlungsgesetz 27.05.2025 (Eintragungsdatum)\n\nIFM Vermögensverwaltung GmbH\nGesellschaft mit beschränkter Haftung\nMünchen\n\nDen Gläubigern der an der Verschmelzung beteiligten Rechtsträger ist, wenn sie binnen sechs Monaten nach dem Tag, an dem die Eintragung der Verschmelzung in das Register des Sitzes desjenigen Rechtsträgers, dessen Gläubiger sie sind, nach § 19 Abs. 3 UmwG als bekannt gemacht gilt, ihren Anspruch nach Grund und Höhe in Textform anmelden, Sicherheit zu leisten, soweit sie nicht Befriedigung verlangen können. Dieses Recht steht den Gläubigern jedoch nur zu, wenn sie glaubhaft machen, dass durch die Verschmelzung die Erfüllung ihrer Forderung gefährdet wird."
    },
    {
      "date": "2025-05-28",
      "id": "110419",
      "original_text": "Registerbekanntmachung nach dem Umwandlungsgesetz\nBayern Amtsgericht Nürnberg HRA 15050\nSDN Sicherheitsdienst Nürnberg e.K. – Nürnberg",
      "type": "Registerbekanntmachung nach dem Umwandlungsgesetz",
      "state": "Bayern",
      "amtsgericht": "Amtsgericht Nürnberg",
      "registernummer": "HRA 15050",
      "registerart": "HRA",
      "company_name": "SDN Sicherheitsdienst Nürnberg e.K.",
      "company_seat": "Nürnberg",
      "details": "28.05.2025 (Bekanntmachungsdatum)\n\nBayern Amtsgericht Nürnberg HRA 15050\nRegisterbekanntmachung nach dem Umwandlungsgesetz 27.05.2025 (Eintragungsdatum)\n\nSDN Sicherheitsdienst Nürnberg e.K.\nEinzelkaufmann / Einzelkauffrau\nNürnberg\n\nDen Gläubigern der an der Ausgliederung beteiligten Rechtsträger ist, wenn sie binnen sechs Monaten nach dem Tag, an dem die Eintragung der Ausgliederung in das Register des Sitzes desjenigen Rechtsträgers, dessen Gläubiger sie sind, nach §§ 125, 19 Abs. 3 UmwG als bekannt gemacht gilt, ihren Anspruch nach Grund und Höhe in Textform anmelden, Sicherheit zu leisten, soweit sie nicht Befriedigung verlangen können. Dieses Recht steht den Gläubigern jedoch nur zu, wenn sie glaubhaft machen, dass durch die Ausgliederung die Erfüllung ihrer Forderung gefährdet wird."
    },
    {
      "date": "2025-05-28",
      "id": "110420",
      "original_text": "Registerbekanntmachung nach dem Umwandlungsgesetz\nBayern Amtsgericht Kempten (Allgäu) HRB 17548\nHGS GmbH – Dietmannsried",
      "type": "Registerbekanntmachung nach dem Umwandlungsgesetz",
      "state": "Bayern",
      "amtsgericht": "Amtsgericht Kempten (Allgäu)",
      "registernummer": "HRB 17548",
      "registerart": "HRB",
      "company_name": "HGS GmbH",
      "company_seat": "Dietmannsried",
      "details": "28.05.2025 (Bekanntmachungsdatum)\n\nBayern Amtsgericht Kempten (Allgäu) HRB 17548\nRegisterbekanntmachung nach dem Umwandlungsgesetz 27.05.2025 (Eintragungsdatum)\n\nHGS GmbH\nGesellschaft mit beschränkter Haftung\nDietmannsried\n\nDen Gläubigern der an der Verschmelzung beteiligten Rechtsträger ist, wenn sie binnen sechs Monaten nach dem Tag, an dem die Eintragung der Verschmelzung in das Register des Sitzes desjenigen Rechtsträgers, dessen Gläubiger sie sind, nach § 19 Abs. 3 UmwG als bekannt gemacht gilt, ihren Anspruch nach Grund und Höhe in Textform anmelden, Sicherheit zu leisten, soweit sie nicht Befriedigung verlangen können. Dieses Recht steht den Gläubigern jedoch nur zu, wenn sie glaubhaft machen, dass durch die Verschmelzung die Erfüllung ihrer Forderung gefährdet wird."
    },
    {
      "date": "2025-05-28",
      "id": "110421",
      "original_text": "Einreichung neuer Dokumente\nBayern Amtsgericht München HRB 42243\nBayerische Motoren Werke Aktiengesellschaft – München",
      "type": "Einreichung neuer Dokumente",
      "state": "Bayern",
      "amtsgericht": "Amtsgericht München",
      "registernummer": "HRB 42243",
      "registerart": "HRB",
      "company_name": "Bayerische Motoren Werke Aktiengesellschaft",
      "company_seat": "München",
      "details": "28.05.2025 (Bekanntmachungsdatum)\n\nBayern Amtsgericht München HRB 42243\nEinreichung neuer Dokumente 27.05.2025 (Eintragungsdatum)\n\nBayerische Motoren Werke Aktiengesellschaft\nAktiengesellschaft\nMünchen\n\nDem Amtsgericht München -Registergericht- ist eine Liste der Mitglieder des Aufsichtsrats eingereicht worden, § 106 AktG."
    },
    {
      "date": "2025-05-28",
      "id": "110422",
      "original_text": "Einreichung neuer Dokumente\nBayern Amtsgericht Memmingen HRB 21194\nQuality Bakers GmbH – Günzburg",
      "type": "Einreichung neuer Dokumente",
      "state": "Bayern",
      "amtsgericht": "Amtsgericht Memmingen",
      "registernummer": "HRB 21194",
      "registerart": "HRB",
      "company_name": "Quality Bakers GmbH",
      "company_seat": "Günzburg",
      "details": "28.05.2025 (Bekanntmachungsdatum)\n\nBayern Amtsgericht Memmingen HRB 21194\nEinreichung neuer Dokumente\n\nQuality Bakers GmbH\nGesellschaft mit beschränkter Haftung\nGünzburg\n\nDem Amtsgericht Memmingen -Registergericht- ist eine Liste der Mitglieder des Aufsichtsrats eingereicht worden, § 52 Abs. 3 S. 2 GmbHG."
    },
    {
      "date": "2025-05-28",
      "id": "110423",
      "original_text": "Einreichung neuer Dokumente\nBayern Amtsgericht München HRB 274912\nFlix SE – München",
      "type": "Einreichung neuer Dokumente",
      "state": "Bayern",
      "amtsgericht": "Amtsgericht München",
      "registernummer": "HRB 274912",
      "registerart": "HRB",
      "company_name": "Flix SE",
      "company_seat": "München",
      "details": "28.05.2025 (Bekanntmachungsdatum)\n\nBayern Amtsgericht München HRB 274912\nEinreichung neuer Dokumente\n\nFlix SE\nEuropäische Aktiengesellschaft (SE)\nMünchen\n\nDem Amtsgericht München -Registergericht- ist eine Liste der Mitglieder des Aufsichtsrats eingereicht worden, Art. 9 Abs. 1 Buchst. c (ii) SE-VO i.V.m. § 106 AktG."
    },
    {
      "date": "2025-05-28",
      "id": "110424",
      "original_text": "Sonstige Registerbekanntmachung\nBayern Amtsgericht Nürnberg HRB 42397\nGfK GmbH – Nürnberg",
      "type": "Sonstige Registerbekanntmachung",
      "state": "Bayern",
      "amtsgericht": "Amtsgericht Nürnberg",
      "registernummer": "HRB 42397",
      "registerart": "HRB",
      "company_name": "GfK GmbH",
      "company_seat": "Nürnberg",
      "details": "28.05.2025 (Bekanntmachungsdatum)\n\nBayern Amtsgericht Nürnberg HRB 42397\nSonstige Registerbekanntmachung\n\nGfK GmbH\nGesellschaft mit beschränkter Haftung\nNürnberg\n\nDem Amtsgericht Nürnberg -Registergericht- ist eine Liste der Mitglieder des Aufsichtsrats eingereicht worden, § 52 Abs. 3 S. 2 GmbHG."
    },
    {
      "date": "2025-05-28",
      "id": "110425",
      "original_text": "Registerbekanntmachung nach dem Umwandlungsgesetz\nBayern Amtsgericht München HRB 177130\nVorFina GmbH – München",
      "type": "Registerbekanntmachung nach dem Umwandlungsgesetz",
      "state": "Bayern",
      "amtsgericht": "Amtsgericht München",
      "registernummer": "HRB 177130",
      "registerart": "HRB",
      "company_name": "VorFina GmbH",
      "company_seat": "München",
      "details": "28.05.2025 (Bekanntmachungsdatum)\n\nBayern Amtsgericht München HRB 177130\nRegisterbekanntmachung nach dem Umwandlungsgesetz 27.05.2025 (Eintragungsdatum)\n\nVorFina GmbH\nGesellschaft mit beschränkter Haftung\nMünchen\n\nDen Gläubigern der an der Verschmelzung beteiligten Rechtsträger ist, wenn sie binnen sechs Monaten nach dem Tag, an dem die Eintragung der Verschmelzung in das Register des Sitzes desjenigen Rechtsträgers, dessen Gläubiger sie sind, nach § 19 Abs. 3 UmwG als bekannt gemacht gilt, ihren Anspruch nach Grund und Höhe in Textform anmelden, Sicherheit zu leisten, soweit sie nicht Befriedigung verlangen können. Dieses Recht steht den Gläubigern jedoch nur zu, wenn sie glaubhaft machen, dass durch die Verschmelzung die Erfüllung ihrer Forderung gefährdet wird."
    },
    {
      "date": "2025-05-28",
      "id": "110426",
      "original_text": "Registerbekanntmachung nach dem Umwandlungsgesetz\nBayern Amtsgericht Kempten (Allgäu) HRA 11688\nRessourcendepot Haldenwald GmbH & Co. KG – Oberstdorf",
      "type": "Registerbekanntmachung nach dem Umwandlungsgesetz",
      "state": "Bayern",
      "amtsgericht": "Amtsgericht Kempten (Allgäu)",
      "registernummer": "HRA 11688",
      "registerart": "HRA",
      "company_name": "Ressourcendepot Haldenwald GmbH & Co. KG",
      "company_seat": "Oberstdorf",
      "details": "28.05.2025 (Bekanntmachungsdatum)\n\nBayern Amtsgericht Kempten (Allgäu) HRA 11688\nRegisterbekanntmachung nach dem Umwandlungsgesetz 27.05.2025 (Eintragungsdatum)\n\nRessourcendepot Haldenwald GmbH & Co. KG\nKommanditgesellschaft\nOberstdorf\n\nDen Gläubigern des formwechselnden Rechtsträgers ist, wenn sie binnen sechs Monaten nach dem Tag, an dem die Eintragung des Formwechsels nach § 201 UmwG als bekannt gemacht gilt, ihren Anspruch nach Grund und Höhe in Textform anmelden, Sicherheit zu leisten, soweit sie nicht Befriedigung verlangen können. Dieses Recht steht den Gläubigern jedoch nur zu, wenn sie glaubhaft machen, dass durch den Formwechsel die Erfüllung ihrer Forderung gefährdet wird."
    },
    {
      "date": "2025-05-28",
      "id": "110427",
      "original_text": "Einreichung neuer Dokumente\nBayern Amtsgericht Augsburg HRB 56\nUPM-Kymmene Administrations GmbH & Co. KGaA – Augsburg",
      "type": "Einreichung neuer Dokumente",
      "state": "Bayern",
      "amtsgericht": "Amtsgericht Augsburg",
      "registernummer": "HRB 56",
      "registerart": "HRB",
      "company_name": "UPM-Kymmene Administrations GmbH & Co. KGaA",
      "company_seat": "Augsburg",
      "details": "28.05.2025 (Bekanntmachungsdatum)\n\nBayern Amtsgericht Augsburg HRB 56\nEinreichung neuer Dokumente\n\nUPM-Kymmene Administrations GmbH & Co. KGaA\nKommanditgesellschaft auf Aktien\nAugsburg\n\nDem Amtsgericht Augsburg -Registergericht- isteine Liste der Mitglieder des Aufsichtsrats eingereicht worden, §§ 278 Abs. 3, 106 AktG."
    },
    {
      "date": "2025-05-28",
      "id": "110428",
      "original_text": "Einreichung neuer Dokumente\nBayern Amtsgericht Bayreuth HRB 5\nBayreuther Bierbrauerei Aktiengesellschaft – Bayreuth",
      "type": "Einreichung neuer Dokumente",
      "state": "Bayern",
      "amtsgericht": "Amtsgericht Bayreuth",
      "registernummer": "HRB 5",
      "registerart": "HRB",
      "company_name": "Bayreuther Bierbrauerei Aktiengesellschaft",
      "company_seat": "Bayreuth",
      "details": "28.05.2025 (Bekanntmachungsdatum)\n\nBayern Amtsgericht Bayreuth HRB 5\nEinreichung neuer Dokumente\n\nBayreuther Bierbrauerei Aktiengesellschaft\nAktiengesellschaft\nBayreuth\n\nDem Amtsgericht Bayreuth -Registergericht- ist eine Liste der Mitglieder des Aufsichtsrats eingereicht worden, § 106 AktG."
    },
    {
      "date": "2025-05-28",
      "id": "110429",
      "original_text": "Registerbekanntmachung nach dem Umwandlungsgesetz\nBayern Amtsgericht Aschaffenburg HRB 13866\nBetreuungsdienste Christ GmbH – Aschaffenburg",
      "type": "Registerbekanntmachung nach dem Umwandlungsgesetz",
      "state": "Bayern",
      "amtsgericht": "Amtsgericht Aschaffenburg",
      "registernummer": "HRB 13866",
      "registerart": "HRB",
      "company_name": "Betreuungsdienste Christ GmbH",
      "company_seat": "Aschaffenburg",
      "details": "28.05.2025 (Bekanntmachungsdatum)\n\nBayern Amtsgericht Aschaffenburg HRB 13866\nRegisterbekanntmachung nach dem Umwandlungsgesetz 27.05.2025 (Eintragungsdatum)\n\nBetreuungsdienste Christ GmbH\nGesellschaft mit beschränkter Haftung\nAschaffenburg\n\nDen Gläubigern der an der Verschmelzung beteiligten Rechtsträger ist, wenn sie binnen sechs Monaten nach dem Tag, an dem die Eintragung der Verschmelzung in das Register des Sitzes desjenigen Rechtsträgers, dessen Gläubiger sie sind, nach § 19 Abs. 3 UmwG als bekannt gemacht gilt, ihren Anspruch nach Grund und Höhe in Textform anmelden, Sicherheit zu leisten, soweit sie nicht Befriedigung verlangen können. Dieses Recht steht den Gläubigern jedoch nur zu, wenn sie glaubhaft machen, dass durch die Verschmelzung die Erfüllung ihrer Forderung gefährdet wird."
    },
    {
      "date": "2025-05-28",
      "id": "110430",
      "original_text": "Einreichung neuer Dokumente\nBayern Amtsgericht München HRB 285797\nenflow energy AG – Gräfelfing",
      "type": "Einreichung neuer Dokumente",
      "state": "Bayern",
      "amtsgericht": "Amtsgericht München",
      "registernummer": "HRB 285797",
      "registerart": "HRB",
      "company_name": "enflow energy AG",
      "company_seat": "Gräfelfing",
      "details": "28.05.2025 (Bekanntmachungsdatum)\n\nBayern Amtsgericht München HRB 285797\nEinreichung neuer Dokumente\n\nenflow energy AG\nAktiengesellschaft\nGräfelfing\n\nDem Amtsgericht München -Registergericht- ist eine Liste der Mitglieder des Aufsichtsrats eingereicht worden, § 106 AktG."
    },
    {
      "date": "2025-05-28",
      "id": "110431",
      "original_text": "Registerbekanntmachung nach dem Umwandlungsgesetz\nBayern Amtsgericht Würzburg HRB 1996\nSteelpaint GmbH Lack- und Farbenproduktion – Kitzingen",
      "type": "Registerbekanntmachung nach dem Umwandlungsgesetz",
      "state": "Bayern",
      "amtsgericht": "Amtsgericht Würzburg",
      "registernummer": "HRB 1996",
      "registerart": "HRB",
      "company_name": "Steelpaint GmbH Lack- und Farbenproduktion",
      "company_seat": "Kitzingen",
      "details": "28.05.2025 (Bekanntmachungsdatum)\n\nBayern Amtsgericht Würzburg HRB 1996\nRegisterbekanntmachung nach dem Umwandlungsgesetz 27.05.2025 (Eintragungsdatum)\n\nSteelpaint GmbH Lack- und Farbenproduktion\nGesellschaft mit beschränkter Haftung\nKitzingen\n\nDen Gläubigern der an der Verschmelzung beteiligten Rechtsträger ist, wenn sie binnen sechs Monaten nach dem Tag, an dem die Eintragung der Verschmelzung in das Register des Sitzes desjenigen Rechtsträgers, dessen Gläubiger sie sind, nach § 19 Abs. 3 UmwG als bekannt gemacht gilt, ihren Anspruch nach Grund und Höhe in Textform anmelden, Sicherheit zu leisten, soweit sie nicht Befriedigung verlangen können. Dieses Recht steht den Gläubigern jedoch nur zu, wenn sie glaubhaft machen, dass durch die Verschmelzung die Erfüllung ihrer Forderung gefährdet wird."
    },
    {
      "date": "2025-05-28",
      "id": "110432",
      "original_text": "Löschungsankündigung\nBayern Amtsgericht München HRB 197834\nPrimus Entertainment GmbH – München",
      "type": "Löschungsankündigung",
      "state": "Bayern",
      "amtsgericht": "Amtsgericht München",
      "registernummer": "HRB 197834",
      "registerart": "HRB",
      "company_name": "Primus Entertainment GmbH",
      "company_seat": "München",
      "details": "28.05.2025 (Bekanntmachungsdatum)\n\nBayern Amtsgericht München HRB 197834\nLöschungsankündigung 26.05.2025 (Eintragungsdatum)\n\nPrimus Entertainment GmbH\nGesellschaft mit beschränkter Haftung\nMünchen\n\nDas Registergericht beabsichtigt, die im Handelsregister eingetragene Gesellschaft wegen Vermögenslosigkeit von Amts wegen nach § 394 FamFG zu löschen. Die Frist zur Erhebung eines Widerspruchs ist auf drei Monate festgesetzt."
    },
    {
      "date": "2025-05-28",
      "id": "110433",
      "original_text": "Einreichung neuer Dokumente\nBayern Amtsgericht Augsburg HRB 24557\nUPM GmbH – Augsburg",
      "type": "Einreichung neuer Dokumente",
      "state": "Bayern",
      "amtsgericht": "Amtsgericht Augsburg",
      "registernummer": "HRB 24557",
      "registerart": "HRB",
      "company_name": "UPM GmbH",
      "company_seat": "Augsburg",
      "details": "28.05.2025 (Bekanntmachungsdatum)\n\nBayern Amtsgericht Augsburg HRB 24557\nEinreichung neuer Dokumente\n\nUPM GmbH\nGesellschaft mit beschränkter Haftung\nAugsburg\n\nDem Amtsgericht Augsburg -Registergericht- ist eine Liste der Mitglieder des Aufsichtsrats eingereicht worden, § 52 Abs. 3 S. 2 GmbHG."
    },
    {
      "date": "2025-05-28",
      "id": "110434",
      "original_text": "Registerbekanntmachung nach dem Umwandlungsgesetz\nBayern Amtsgericht Würzburg HRB 1132\nEmil Harrasser Lack- und Farbenfabrik GmbH – Kitzingen",
      "type": "Registerbekanntmachung nach dem Umwandlungsgesetz",
      "state": "Bayern",
      "amtsgericht": "Amtsgericht Würzburg",
      "registernummer": "HRB 1132",
      "registerart": "HRB",
      "company_name": "Emil Harrasser Lack- und Farbenfabrik GmbH",
      "company_seat": "Kitzingen",
      "details": "28.05.2025 (Bekanntmachungsdatum)\n\nBayern Amtsgericht Würzburg HRB 1132\nRegisterbekanntmachung nach dem Umwandlungsgesetz 27.05.2025 (Eintragungsdatum)\n\nEmil Harrasser Lack- und Farbenfabrik GmbH\nGesellschaft mit beschränkter Haftung\nKitzingen\n\nDen Gläubigern der an der Verschmelzung beteiligten Rechtsträger ist, wenn sie binnen sechs Monaten nach dem Tag, an dem die Eintragung der Verschmelzung in das Register des Sitzes desjenigen Rechtsträgers, dessen Gläubiger sie sind, nach § 19 Abs. 3 UmwG als bekannt gemacht gilt, ihren Anspruch nach Grund und Höhe in Textform anmelden, Sicherheit zu leisten, soweit sie nicht Befriedigung verlangen können. Dieses Recht steht den Gläubigern jedoch nur zu, wenn sie glaubhaft machen, dass durch die Verschmelzung die Erfüllung ihrer Forderung gefährdet wird."
    },
    {
      "date": "2025-05-28",
      "id": "110435",
      "original_text": "Löschungsankündigung\nBayern Amtsgericht München HRB 279139\nY.D. Clean Green GmbH – München",
      "type": "Löschungsankündigung",
      "state": "Bayern",
      "amtsgericht": "Amtsgericht München",
      "registernummer": "HRB 279139",
      "registerart": "HRB",
      "company_name": "Y.D. Clean Green GmbH",
      "company_seat": "München",
      "details": "28.05.2025 (Bekanntmachungsdatum)\n\nBayern Amtsgericht München HRB 279139\nLöschungsankündigung 26.05.2025 (Eintragungsdatum)\n\nY.D. Clean Green GmbH\nGesellschaft mit beschränkter Haftung\nMünchen\n\nDas Registergericht beabsichtigt, die im Handelsregister eingetragene Gesellschaft wegen Vermögenslosigkeit von Amts wegen nach § 394 FamFG zu löschen. #insert(Text=\"zztb_V_Widerspruchsfrist\")"
    },
    {
      "date": "2025-05-28",
      "id": "110436",
      "original_text": "Löschungsankündigung\nBayern Amtsgericht München HRB 279139\nY.D. Clean Green GmbH – München",
      "type": "Löschungsankündigung",
      "state": "Bayern",
      "amtsgericht": "Amtsgericht München",
      "registernummer": "HRB 279139",
      "registerart": "HRB",
      "company_name": "Y.D. Clean Green GmbH",
      "company_seat": "München",
      "details": "28.05.2025 (Bekanntmachungsdatum)\n\nBayern Amtsgericht München HRB 279139\nLöschungsankündigung 26.05.2025 (Eintragungsdatum)\n\nY.D. Clean Green GmbH\nGesellschaft mit beschränkter Haftung\nMünchen\n\nDas Registergericht beabsichtigt, die im Handelsregister eingetragene Gesellschaft wegen Vermögenslosigkeit von Amts wegen nach § 394 FamFG zu löschen. Die Frist zur Erhebung eines Widerspruchs ist auf drei Monate festgesetzt."
    },
    {
      "date": "2025-05-28",
      "id": "110437",
      "original_text": "Löschungsankündigung\nBayern Amtsgericht Augsburg HRB 29828\nFrank Immobilien und Sachwerte GmbH – Meitingen",
      "type": "Löschungsankündigung",
      "state": "Bayern",
      "amtsgericht": "Amtsgericht Augsburg",
      "registernummer": "HRB 29828",
      "registerart": "HRB",
      "company_name": "Frank Immobilien und Sachwerte GmbH",
      "company_seat": "Meitingen",
      "details": "28.05.2025 (Bekanntmachungsdatum)\n\nBayern Amtsgericht Augsburg HRB 29828\nLöschungsankündigung\n\nFrank Immobilien und Sachwerte GmbH\nGesellschaft mit beschränkter Haftung\nMeitingen\n\nDas Registergericht beabsichtigt, die im Handelsregister eingetragene Gesellschaft wegen Vermögenslosigkeit von Amts wegen nach § 394 FamFG zu löschen. Die Frist zur Erhebung eines Widerspruchs ist auf einen Monat festgesetzt."
    },
    {
      "date": "2025-05-28",
      "id": "110438",
      "original_text": "Registerbekanntmachung nach dem Umwandlungsgesetz\nBayern Amtsgericht München HRB 118653\nRefugium Gesellschaft für Wohnungsbau mbH – Gauting",
      "type": "Registerbekanntmachung nach dem Umwandlungsgesetz",
      "state": "Bayern",
      "amtsgericht": "Amtsgericht München",
      "registernummer": "HRB 118653",
      "registerart": "HRB",
      "company_name": "Refugium Gesellschaft für Wohnungsbau mbH",
      "company_seat": "Gauting",
      "details": "28.05.2025 (Bekanntmachungsdatum)\n\nBayern Amtsgericht München HRB 118653\nRegisterbekanntmachung nach dem Umwandlungsgesetz 27.05.2025 (Eintragungsdatum)\n\nRefugium Gesellschaft für Wohnungsbau mbH\nGesellschaft mit beschränkter Haftung\nGauting\n\nDen Gläubigern der an der Verschmelzung beteiligten Rechtsträger ist, wenn sie binnen sechs Monaten nach dem Tag, an dem die Eintragung der Verschmelzung in das Register des Sitzes desjenigen Rechtsträgers, dessen Gläubiger sie sind, nach § 19 Abs. 3 UmwG als bekannt gemacht gilt, ihren Anspruch nach Grund und Höhe in Textform anmelden, Sicherheit zu leisten, soweit sie nicht Befriedigung verlangen können. Dieses Recht steht den Gläubigern jedoch nur zu, wenn sie glaubhaft machen, dass durch die Verschmelzung die Erfüllung ihrer Forderung gefährdet wird."
    },
    {
      "date": "2025-05-28",
      "id": "110439",
      "original_text": "Registerbekanntmachung nach dem Umwandlungsgesetz\nBayern Amtsgericht Memmingen HRA 14280\nE.T. - Ihr Lackprofi e.K. Inhaber Dennis Ittner – Burgau",
      "type": "Registerbekanntmachung nach dem Umwandlungsgesetz",
      "state": "Bayern",
      "amtsgericht": "Amtsgericht Memmingen",
      "registernummer": "HRA 14280",
      "registerart": "HRA",
      "company_name": "E.T. - Ihr Lackprofi e.K. Inhaber Dennis Ittner",
      "company_seat": "Burgau",
      "details": "28.05.2025 (Bekanntmachungsdatum)\n\nBayern Amtsgericht Memmingen HRA 14280\nRegisterbekanntmachung nach dem Umwandlungsgesetz 27.05.2025 (Eintragungsdatum)\n\nE.T. - Ihr Lackprofi e.K. Inhaber Dennis Ittner\nEinzelkaufmann / Einzelkauffrau\nBurgau\n\nDen Gläubigern der an der Ausgliederung beteiligten Rechtsträger ist, wenn sie binnen sechs Monaten nach dem Tag, an dem die Eintragung der Ausgliederung in das Register des Sitzes desjenigen Rechtsträgers, dessen Gläubiger sie sind, nach §§ 125, 19 Abs. 3 UmwG als bekannt gemacht gilt, ihren Anspruch nach Grund und Höhe in Textform anmelden, Sicherheit zu leisten, soweit sie nicht Befriedigung verlangen können. Dieses Recht steht den Gläubigern jedoch nur zu, wenn sie glaubhaft machen, dass durch die Ausgliederung die Erfüllung ihrer Forderung gefährdet wird."
    },
    {
      "date": "2025-05-28",
      "id": "110440",
      "original_text": "Registerbekanntmachung nach dem Umwandlungsgesetz\nBerlin Amtsgericht Berlin (Charlottenburg) HRB 195771\nBrückenköpfe Office GmbH – Berlin",
      "type": "Registerbekanntmachung nach dem Umwandlungsgesetz",
      "state": "Berlin",
      "amtsgericht": "Amtsgericht Berlin (Charlottenburg)",
      "registernummer": "HRB 195771",
      "registerart": "HRB",
      "company_name": "Brückenköpfe Office GmbH",
      "company_seat": "Berlin",
      "details": "28.05.2025 (Bekanntmachungsdatum)\n\nBerlin Amtsgericht Berlin (Charlottenburg) HRB 195771\nRegisterbekanntmachung nach dem Umwandlungsgesetz 27.05.2025 (Eintragungsdatum)\n\nBrückenköpfe Office GmbH\nGesellschaft mit beschränkter Haftung\nBerlin\n\nZu Eintragungsnummer 6 vom 27.05.2025 wird als nicht eingetragen veröffentlicht: Den Gläubigern der an der Spaltung beteiligten Rechtsträger ist, wenn sie binnen sechs Monaten nach dem Tag, an dem die Eintragung der Spaltung in das Register des Sitzes desjenigen Rechtsträgers, dessen Gläubiger sie sind, als bekannt gemacht gilt, ihren Anspruch nach Grund und Höhe schriftlich anmelden, Sicherheit zu leisten, soweit sie nicht Befriedigung verlangen können. Dieses Recht steht den Gläubigern jedoch nur zu, wenn sie glaubhaft machen, dass durch die Spaltung die Erfüllung ihrer Forderung gefährdet wird. Das Recht, Sicherheitsleistung zu verlangen, steht Gläubigern nicht zu, die im Falle der Insolvenz ein Recht auf vorzugsweise Befriedigung aus einer Deckungsmasse haben, die nach gesetzlicher Vorschrift zu ihrem Schutz errichtet und staatlich überwacht ist."
    },
    {
      "date": "2025-05-28",
      "id": "110441",
      "original_text": "Registerbekanntmachung nach dem Umwandlungsgesetz\nBerlin Amtsgericht Berlin (Charlottenburg) HRB 187860\nBrückenköpfe Diamonds GmbH – Berlin",
      "type": "Registerbekanntmachung nach dem Umwandlungsgesetz",
      "state": "Berlin",
      "amtsgericht": "Amtsgericht Berlin (Charlottenburg)",
      "registernummer": "HRB 187860",
      "registerart": "HRB",
      "company_name": "Brückenköpfe Diamonds GmbH",
      "company_seat": "Berlin",
      "details": "28.05.2025 (Bekanntmachungsdatum)\n\nBerlin Amtsgericht Berlin (Charlottenburg) HRB 187860\nRegisterbekanntmachung nach dem Umwandlungsgesetz 27.05.2025 (Eintragungsdatum)\n\nBrückenköpfe Diamonds GmbH\nGesellschaft mit beschränkter Haftung\nBerlin\n\nZu Eintragungsnummer 4 vom 27.05.2025 wird als nicht eingetragen veröffentlicht: Den Gläubigern der an der Spaltung beteiligten Rechtsträger ist, wenn sie binnen sechs Monaten nach dem Tag, an dem die Eintragung der Spaltung in das Register des Sitzes desjenigen Rechtsträgers, dessen Gläubiger sie sind, als bekannt gemacht gilt, ihren Anspruch nach Grund und Höhe schriftlich anmelden, Sicherheit zu leisten, soweit sie nicht Befriedigung verlangen können. Dieses Recht steht den Gläubigern jedoch nur zu, wenn sie glaubhaft machen, dass durch die Spaltung die Erfüllung ihrer Forderung gefährdet wird. Das Recht, Sicherheitsleistung zu verlangen, steht Gläubigern nicht zu, die im Falle der Insolvenz ein Recht auf vorzugsweise Befriedigung aus einer Deckungsmasse haben, die nach gesetzlicher Vorschrift zu ihrem Schutz errichtet und staatlich überwacht ist."
    },
    {
      "date": "2025-05-28",
      "id": "110442",
      "original_text": "Registerbekanntmachung nach dem Umwandlungsgesetz\nBerlin Amtsgericht Berlin (Charlottenburg) HRA 34324\nGutman Holding GmbH & Co. KG – Berlin",
      "type": "Registerbekanntmachung nach dem Umwandlungsgesetz",
      "state": "Berlin",
      "amtsgericht": "Amtsgericht Berlin (Charlottenburg)",
      "registernummer": "HRA 34324",
      "registerart": "HRA",
      "company_name": "Gutman Holding GmbH & Co. KG",
      "company_seat": "Berlin",
      "details": "28.05.2025 (Bekanntmachungsdatum)\n\nBerlin Amtsgericht Berlin (Charlottenburg) HRA 34324\nRegisterbekanntmachung nach dem Umwandlungsgesetz 27.05.2025 (Eintragungsdatum)\n\nGutman Holding GmbH & Co. KG\nKommanditgesellschaft\nBerlin\n\nZu Eintragungsnummer 7 vom 27.05.2025 wird als nicht eingetragen veröffentlicht: Den Gläubigern ist, wenn sie binnen sechs Monaten nach dem Tag, an dem die Eintragung der Umwandlung als bekannt gemacht gilt, ihren Anspruch nach Grund und Höhe schriftlich anmelden, Sicherheit zu leisten, soweit sie nicht Befriedigung verlangen können. Dieses Recht steht den Gläubigern jedoch nur zu, wenn sie glaubhaft machen, dass durch die Umwandlung die Erfüllung ihrer Forderung gefährdet wird. Das Recht, Sicherheitsleistung zu verlangen, steht Gläubigern nicht zu, die im Falle der Insolvenz ein Recht auf vorzugsweise Befriedigung aus einer Deckungsmasse haben, die nach gesetzlicher Vorschrift zu ihrem Schutz errichtet und staatlich überwacht ist."
    },
    {
      "date": "2025-05-28",
      "id": "110443",
      "original_text": "Löschungsankündigung\nBaden-Württemberg Amtsgericht Ulm HRB 743077\nSilent Energy GmbH – Rot an der Rot",
      "type": "Löschungsankündigung",
      "state": "Baden-Württemberg",
      "amtsgericht": "Amtsgericht Ulm",
      "registernummer": "HRB 743077",
      "registerart": "HRB",
      "company_name": "Silent Energy GmbH",
      "company_seat": "Rot an der Rot",
      "details": "28.05.2025 (Bekanntmachungsdatum)\n\nBaden-Württemberg Amtsgericht Ulm HRB 743077\nLöschungsankündigung\n\nSilent Energy GmbH\nGesellschaft mit beschränkter Haftung\nRot an der Rot\n\nAls nicht eingetragen wird bekanntgemacht:\nDas Gericht beabsichtigt, die Gesellschaft wegen Vermögenslosigkeit im Handelsregister von Amts wegen nach § 394 FamFG zu löschen. Die Frist zur Geltendmachung eines Widerspruchs gegen die beabsichtigte Löschung ist auf  einen Monat ab Veröffentlichung bestimmt."
    },
    {
      "date": "2025-05-28",
      "id": "110444",
      "original_text": "Registerbekanntmachung nach dem Umwandlungsgesetz\nBaden-Württemberg Amtsgericht Mannheim HRB 720230\nRoche Diabetes Care Deutschland GmbH – Mannheim",
      "type": "Registerbekanntmachung nach dem Umwandlungsgesetz",
      "state": "Baden-Württemberg",
      "amtsgericht": "Amtsgericht Mannheim",
      "registernummer": "HRB 720230",
      "registerart": "HRB",
      "company_name": "Roche Diabetes Care Deutschland GmbH",
      "company_seat": "Mannheim",
      "details": "28.05.2025 (Bekanntmachungsdatum)\n\nBaden-Württemberg Amtsgericht Mannheim HRB 720230\nRegisterbekanntmachung nach dem Umwandlungsgesetz 28.05.2025 (Eintragungsdatum)\n\nRoche Diabetes Care Deutschland GmbH\nGesellschaft mit beschränkter Haftung\nMannheim\n\nDen Gläubigern der an der Verschmelzung beteiligten Rechtsträger ist, wenn sie binnen sechs Monaten nach dem Tag, an dem die Eintragung der Verschmelzung in das Register des Sitzes desjenigen Rechtsträgers, dessen Gläubiger sie sind, nach § 19 Abs. 3 UmwG als bekanntgemacht gilt, ihren Anspruch nach Grund und Höhe schriftlich anmelden, Sicherheit zu leisten, soweit sie nicht Befriedigung verlangen können. Dieses Recht steht den Gläubigern jedoch nur zu, wenn sie glaubhaft machen, dass durch die Verschmelzung die Erfüllung ihrer Forderung gefährdet wird."
    },
    {
      "date": "2025-05-28",
      "id": "110445",
      "original_text": "Registerbekanntmachung nach dem Umwandlungsgesetz\nBerlin Amtsgericht Berlin (Charlottenburg) HRB 199673\nBSMV Liegenschaften GmbH – Berlin",
      "type": "Registerbekanntmachung nach dem Umwandlungsgesetz",
      "state": "Berlin",
      "amtsgericht": "Amtsgericht Berlin (Charlottenburg)",
      "registernummer": "HRB 199673",
      "registerart": "HRB",
      "company_name": "BSMV Liegenschaften GmbH",
      "company_seat": "Berlin",
      "details": "28.05.2025 (Bekanntmachungsdatum)\n\nBerlin Amtsgericht Berlin (Charlottenburg) HRB 199673\nRegisterbekanntmachung nach dem Umwandlungsgesetz 27.05.2025 (Eintragungsdatum)\n\nBSMV Liegenschaften GmbH\nGesellschaft mit beschränkter Haftung\nBerlin\n\nZu Eintragungsnummer 12 vom 27.05.2025 wird als nicht eingetragen veröffentlicht: Den Gläubigern der an der Verschmelzung beteiligten Rechtsträger ist, wenn sie binnen sechs Monaten nach dem Tag, an dem die Eintragung der Verschmelzung in das Register des Sitzes desjenigen Rechtsträgers, dessen Gläubiger sie sind, als bekannt gemacht gilt, ihren Anspruch nach Grund und Höhe schriftlich anmelden, Sicherheit zu leisten, soweit sie nicht Befriedigung verlangen können. Dieses Recht steht den Gläubigern jedoch nur zu, wenn sie glaubhaft machen, dass durch die Verschmelzung die Erfüllung ihrer Forderung gefährdet wird. Das Recht, Sicherheitsleistung zu verlangen, steht Gläubigern nicht zu, die im Falle der Insolvenz ein Recht auf vorzugsweise Befriedigung aus einer Deckungsmasse haben, die nach gesetzlicher Vorschrift zu ihrem Schutz errichtet und staatlich überwacht ist."
    },
    {
      "date": "2025-05-28",
      "id": "110446",
      "original_text": "Registerbekanntmachung nach dem Umwandlungsgesetz\nBerlin Amtsgericht Berlin (Charlottenburg) HRB 206851\nTS26 Liegenschaften GmbH – Berlin",
      "type": "Registerbekanntmachung nach dem Umwandlungsgesetz",
      "state": "Berlin",
      "amtsgericht": "Amtsgericht Berlin (Charlottenburg)",
      "registernummer": "HRB 206851",
      "registerart": "HRB",
      "company_name": "TS26 Liegenschaften GmbH",
      "company_seat": "Berlin",
      "details": "28.05.2025 (Bekanntmachungsdatum)\n\nBerlin Amtsgericht Berlin (Charlottenburg) HRB 206851\nRegisterbekanntmachung nach dem Umwandlungsgesetz 27.05.2025 (Eintragungsdatum)\n\nTS26 Liegenschaften GmbH\nGesellschaft mit beschränkter Haftung\nBerlin\n\nZu Eintragungsnummer 3 vom 27.05.2025 wird als nicht eingetragen veröffentlicht: Den Gläubigern der an der Verschmelzung beteiligten Rechtsträger ist, wenn sie binnen sechs Monaten nach dem Tag, an dem die Eintragung der Verschmelzung in das Register des Sitzes desjenigen Rechtsträgers, dessen Gläubiger sie sind, als bekannt gemacht gilt, ihren Anspruch nach Grund und Höhe schriftlich anmelden, Sicherheit zu leisten, soweit sie nicht Befriedigung verlangen können. Dieses Recht steht den Gläubigern jedoch nur zu, wenn sie glaubhaft machen, dass durch die Verschmelzung die Erfüllung ihrer Forderung gefährdet wird. Das Recht, Sicherheitsleistung zu verlangen, steht Gläubigern nicht zu, die im Falle der Insolvenz ein Recht auf vorzugsweise Befriedigung aus einer Deckungsmasse haben, die nach gesetzlicher Vorschrift zu ihrem Schutz errichtet und staatlich überwacht ist."
    },
    {
      "date": "2025-05-28",
      "id": "110447",
      "original_text": "Registerbekanntmachung nach dem Umwandlungsgesetz\nBaden-Württemberg Amtsgericht Stuttgart HRA 742132\nHochschule-Dozent e.K. – Stuttgart",
      "type": "Registerbekanntmachung nach dem Umwandlungsgesetz",
      "state": "Baden-Württemberg",
      "amtsgericht": "Amtsgericht Stuttgart",
      "registernummer": "HRA 742132",
      "registerart": "HRA",
      "company_name": "Hochschule-Dozent e.K.",
      "company_seat": "Stuttgart",
      "details": "28.05.2025 (Bekanntmachungsdatum)\n\nBaden-Württemberg Amtsgericht Stuttgart HRA 742132\nRegisterbekanntmachung nach dem Umwandlungsgesetz 26.05.2025 (Eintragungsdatum)\n\nHochschule-Dozent e.K.\nEinzelkaufmann / Einzelkauffrau\nStuttgart\n\nAls nicht eingetragen wird bekanntgemacht:\nDen Gläubigern der an der Ausgliederung beteiligten Rechtsträger ist, wenn sie binnen sechs Monaten nach dem Tag, an dem die Eintragung der Ausgliederung in das Register des Sitzes desjenigen Rechtsträgers, dessen Gläubiger sie sind, nach § 19 Abs. 3 UmwG als bekanntgemacht gilt, ihren Anspruch nach Grund und Höhe schriftlich anmelden, Sicherheit zu leisten, soweit sie nicht Befriedigung verlangen können. Dieses Recht steht den Gläubigern jedoch nur zu, wenn sie glaubhaft machen, dass durch die Ausgliederung die Erfüllung ihrer Forderung gefährdet wird."
    },
    {
      "date": "2025-05-28",
      "id": "110448",
      "original_text": "Registerbekanntmachung nach dem Umwandlungsgesetz\nBaden-Württemberg Amtsgericht Mannheim HRB 570014\nStraub GmbH – Wertheim",
      "type": "Registerbekanntmachung nach dem Umwandlungsgesetz",
      "state": "Baden-Württemberg",
      "amtsgericht": "Amtsgericht Mannheim",
      "registernummer": "HRB 570014",
      "registerart": "HRB",
      "company_name": "Straub GmbH",
      "company_seat": "Wertheim",
      "details": "28.05.2025 (Bekanntmachungsdatum)\n\nBaden-Württemberg Amtsgericht Mannheim HRB 570014\nRegisterbekanntmachung nach dem Umwandlungsgesetz 28.05.2025 (Eintragungsdatum)\n\nStraub GmbH\nGesellschaft mit beschränkter Haftung\nWertheim\n\nDen Gläubigern der an der Verschmelzung beteiligten Rechtsträger ist, wenn sie binnen sechs Monaten nach dem Tag, an dem die Eintragung der Verschmelzung in das Register des Sitzes desjenigen Rechtsträgers, dessen Gläubiger sie sind, nach § 19 Abs. 3 UmwG als bekanntgemacht gilt, ihren Anspruch nach Grund und Höhe schriftlich anmelden, Sicherheit zu leisten, soweit sie nicht Befriedigung verlangen können. Dieses Recht steht den Gläubigern jedoch nur zu, wenn sie glaubhaft machen, dass durch die Verschmelzung die Erfüllung ihrer Forderung gefährdet wird."
    },
    {
      "date": "2025-05-28",
      "id": "110449",
      "original_text": "Registerbekanntmachung nach dem Umwandlungsgesetz\nBerlin Amtsgericht Berlin (Charlottenburg) HRB 268295\nGlobal Sports Versicherungsmakler GmbH – Berlin",
      "type": "Registerbekanntmachung nach dem Umwandlungsgesetz",
      "state": "Berlin",
      "amtsgericht": "Amtsgericht Berlin (Charlottenburg)",
      "registernummer": "HRB 268295",
      "registerart": "HRB",
      "company_name": "Global Sports Versicherungsmakler GmbH",
      "company_seat": "Berlin",
      "details": "28.05.2025 (Bekanntmachungsdatum)\n\nBerlin Amtsgericht Berlin (Charlottenburg) HRB 268295\nRegisterbekanntmachung nach dem Umwandlungsgesetz 27.05.2025 (Eintragungsdatum)\n\nGlobal Sports Versicherungsmakler GmbH\nGesellschaft mit beschränkter Haftung\nBerlin\n\nZu Eintragungsnummer 2 vom 27.05.2025 wird als nicht eingetragen veröffentlicht: Den Gläubigern der an der Verschmelzung beteiligten Rechtsträger ist, wenn sie binnen sechs Monaten nach dem Tag, an dem die Eintragung der Verschmelzung in das Register des Sitzes desjenigen Rechtsträgers, dessen Gläubiger sie sind, als bekannt gemacht gilt, ihren Anspruch nach Grund und Höhe schriftlich anmelden, Sicherheit zu leisten, soweit sie nicht Befriedigung verlangen können. Dieses Recht steht den Gläubigern jedoch nur zu, wenn sie glaubhaft machen, dass durch die Verschmelzung die Erfüllung ihrer Forderung gefährdet wird. Das Recht, Sicherheitsleistung zu verlangen, steht Gläubigern nicht zu, die im Falle der Insolvenz ein Recht auf vorzugsweise Befriedigung aus einer Deckungsmasse haben, die nach gesetzlicher Vorschrift zu ihrem Schutz errichtet und staatlich überwacht ist."
    },
    {
      "date": "2025-05-28",
      "id": "110450",
      "original_text": "Registerbekanntmachung nach dem Umwandlungsgesetz\nBaden-Württemberg Amtsgericht Mannheim HRB 570008\nbellmira Cosmetic Gesellschaft mit beschränkter Haftung – Wertheim",
      "type": "Registerbekanntmachung nach dem Umwandlungsgesetz",
      "state": "Baden-Württemberg",
      "amtsgericht": "Amtsgericht Mannheim",
      "registernummer": "HRB 570008",
      "registerart": "HRB",
      "company_name": "bellmira Cosmetic Gesellschaft mit beschränkter Haftung",
      "company_seat": "Wertheim",
      "details": "28.05.2025 (Bekanntmachungsdatum)\n\nBaden-Württemberg Amtsgericht Mannheim HRB 570008\nRegisterbekanntmachung nach dem Umwandlungsgesetz 28.05.2025 (Eintragungsdatum)\n\nbellmira Cosmetic Gesellschaft mit beschränkter Haftung\nGesellschaft mit beschränkter Haftung\nWertheim\n\nDen Gläubigern der an der Verschmelzung beteiligten Rechtsträger ist, wenn sie binnen sechs Monaten nach dem Tag, an dem die Eintragung der Verschmelzung in das Register des Sitzes desjenigen Rechtsträgers, dessen Gläubiger sie sind, nach § 19 Abs. 3 UmwG als bekanntgemacht gilt, ihren Anspruch nach Grund und Höhe schriftlich anmelden, Sicherheit zu leisten, soweit sie nicht Befriedigung verlangen können. Dieses Recht steht den Gläubigern jedoch nur zu, wenn sie glaubhaft machen, dass durch die Verschmelzung die Erfüllung ihrer Forderung gefährdet wird."
    },
    {
      "date": "2025-05-28",
      "id": "110451",
      "original_text": "Löschungsankündigung\nSchleswig-Holstein Amtsgericht Lübeck HRB 24771\nSR Bau UG (haftungsbeschränkt) – Ammersbek",
      "type": "Löschungsankündigung",
      "state": "Schleswig-Holstein",
      "amtsgericht": "Amtsgericht Lübeck",
      "registernummer": "HRB 24771",
      "registerart": "HRB",
      "company_name": "SR Bau UG (haftungsbeschränkt)",
      "company_seat": "Ammersbek",
      "details": "28.05.2025 (Bekanntmachungsdatum)\n\nSchleswig-Holstein Amtsgericht Lübeck HRB 24771\nLöschungsankündigung\n\nSR Bau UG (haftungsbeschränkt)\nGesellschaft mit beschränkter Haftung\nAmmersbek\n\nEs ist die Löschung der nachstehenden Gesellschaft wegen Vermögenslosigkeit gemäß § 394 FamFG beabsichtigt."
    },
    {
      "date": "2025-05-28",
      "id": "110452",
      "original_text": "Registerbekanntmachung nach dem Umwandlungsgesetz\nSchleswig-Holstein Amtsgericht Pinneberg HRB 18008\nOSKAR Verwaltungs GmbH – Prisdorf",
      "type": "Registerbekanntmachung nach dem Umwandlungsgesetz",
      "state": "Schleswig-Holstein",
      "amtsgericht": "Amtsgericht Pinneberg",
      "registernummer": "HRB 18008",
      "registerart": "HRB",
      "company_name": "OSKAR Verwaltungs GmbH",
      "company_seat": "Prisdorf",
      "details": "28.05.2025 (Bekanntmachungsdatum)\n\nSchleswig-Holstein Amtsgericht Pinneberg HRB 18008\nRegisterbekanntmachung nach dem Umwandlungsgesetz 22.05.2025 (Eintragungsdatum)\n\nOSKAR Verwaltungs GmbH\nGesellschaft mit beschränkter Haftung\nPrisdorf\n\nZu Eintragungsnummer 2 vom 22.05.2025 wird als nicht eingetragen veröffentlicht: Den Gläubigern der an der Verschmelzung beteiligten Rechtsträger ist, wenn sie binnen sechs Monaten nach dem Tag, an dem die Eintragung der Verschmelzung in das Register des Sitzes desjenigen Rechtsträgers, dessen Gläubiger sie sind, als bekannt gemacht gilt, ihren Anspruch nach Grund und Höhe schriftlich anmelden, Sicherheit zu leisten, soweit sie nicht Befriedigung verlangen können. Dieses Recht steht den Gläubigern jedoch nur zu, wenn sie glaubhaft machen, dass durch die Verschmelzung die Erfüllung ihrer Forderung gefährdet wird. Das Recht, Sicherheitsleistung zu verlangen, steht Gläubigern nicht zu, die im Falle der Insolvenz ein Recht auf vorzugsweise Befriedigung aus einer Deckungsmasse haben, die nach gesetzlicher Vorschrift zu ihrem Schutz errichtet und staatlich überwacht ist."
    },
    {
      "date": "2025-05-28",
      "id": "110453",
      "original_text": "Löschungsankündigung\nBerlin Amtsgericht Berlin (Charlottenburg) HRB 178927\nPhilip Gebäudemanagement GmbH – Berlin",
      "type": "Löschungsankündigung",
      "state": "Berlin",
      "amtsgericht": "Amtsgericht Berlin (Charlottenburg)",
      "registernummer": "HRB 178927",
      "registerart": "HRB",
      "company_name": "Philip Gebäudemanagement GmbH",
      "company_seat": "Berlin",
      "details": "28.05.2025 (Bekanntmachungsdatum)\n\nBerlin Amtsgericht Berlin (Charlottenburg) HRB 178927\nLöschungsankündigung\n\nPhilip Gebäudemanagement GmbH\nGesellschaft mit beschränkter Haftung\nBerlin\n\nBei der nachstehenden Gesellschaft wird das Amtslöschungsverfahren gemäß § 394 FamFG eingeleitet. Widerspruchsfrist 6 Wochen"
    },
    {
      "date": "2025-05-28",
      "id": "110454",
      "original_text": "Einreichung neuer Dokumente\nBaden-Württemberg Amtsgericht Mannheim HRB 335755\nMLP Banking AG – Wiesloch",
      "type": "Einreichung neuer Dokumente",
      "state": "Baden-Württemberg",
      "amtsgericht": "Amtsgericht Mannheim",
      "registernummer": "HRB 335755",
      "registerart": "HRB",
      "company_name": "MLP Banking AG",
      "company_seat": "Wiesloch",
      "details": "28.05.2025 (Bekanntmachungsdatum)\n\nBaden-Württemberg Amtsgericht Mannheim HRB 335755\nEinreichung neuer Dokumente 27.05.2025 (Eintragungsdatum)\n\nMLP Banking AG\nAktiengesellschaft\nWiesloch\n\nDie Gesellschaft hat am 27.05.2025 die Liste über die Zusammensetzung des Aufsichtsrats zum Handelsregister eingereicht."
    },
    {
      "date": "2025-05-28",
      "id": "110455",
      "original_text": "Registerbekanntmachung nach dem Umwandlungsgesetz\nBaden-Württemberg Amtsgericht Ulm HRB 540114\nSpindelfabrik Suessen GmbH – Süßen",
      "type": "Registerbekanntmachung nach dem Umwandlungsgesetz",
      "state": "Baden-Württemberg",
      "amtsgericht": "Amtsgericht Ulm",
      "registernummer": "HRB 540114",
      "registerart": "HRB",
      "company_name": "Spindelfabrik Suessen GmbH",
      "company_seat": "Süßen",
      "details": "28.05.2025 (Bekanntmachungsdatum)\n\nBaden-Württemberg Amtsgericht Ulm HRB 540114\nRegisterbekanntmachung nach dem Umwandlungsgesetz 28.05.2025 (Eintragungsdatum)\n\nSpindelfabrik Suessen GmbH\nGesellschaft mit beschränkter Haftung\nSüßen\n\nAls nicht eingetragen wird bekanntgemacht:\nDen Gläubigern der an der Verschmelzung beteiligten Rechtsträger ist, wenn sie binnen sechs Monaten nach dem Tag, an dem die Eintragung der Verschmelzung in das Register des Sitzes desjenigen Rechtsträgers, dessen Gläubiger sie sind, nach § 19 Abs. 3 UmwG als bekanntgemacht gilt, ihren Anspruch nach Grund und Höhe schriftlich anmelden, Sicherheit zu leisten, soweit sie nicht Befriedigung verlangen können. Dieses Recht steht den Gläubigern jedoch nur zu, wenn sie glaubhaft machen, dass durch die Verschmelzung die Erfüllung ihrer Forderung gefährdet wird."
    },
    {
      "date": "2025-05-28",
      "id": "110456",
      "original_text": "Löschungsankündigung\nBaden-Württemberg Amtsgericht Stuttgart HRB 758534\nSottoSopra GmbH – Heilbronn",
      "type": "Löschungsankündigung",
      "state": "Baden-Württemberg",
      "amtsgericht": "Amtsgericht Stuttgart",
      "registernummer": "HRB 758534",
      "registerart": "HRB",
      "company_name": "SottoSopra GmbH",
      "company_seat": "Heilbronn",
      "details": "28.05.2025 (Bekanntmachungsdatum)\n\nBaden-Württemberg Amtsgericht Stuttgart HRB 758534\nLöschungsankündigung\n\nSottoSopra GmbH\nGesellschaft mit beschränkter Haftung\nHeilbronn\n\nAls nicht eingetragen wird bekanntgemacht:\nDas Gericht beabsichtigt, die Gesellschaft wegen Vermögenslosigkeit im Handelsregister von Amts wegen nach § 394 FamFG zu löschen. Die Frist zur Geltendmachung eines Widerspruchs gegen die beabsichtigte Löschung ist auf zwei Monate ab Veröffentlichung bestimmt."
    },
    {
      "date": "2025-05-28",
      "id": "110457",
      "original_text": "Registerbekanntmachung nach dem Umwandlungsgesetz\nBaden-Württemberg Amtsgericht Ulm HRB 540123\nWilhelm Stahlecker GmbH – Süßen",
      "type": "Registerbekanntmachung nach dem Umwandlungsgesetz",
      "state": "Baden-Württemberg",
      "amtsgericht": "Amtsgericht Ulm",
      "registernummer": "HRB 540123",
      "registerart": "HRB",
      "company_name": "Wilhelm Stahlecker GmbH",
      "company_seat": "Süßen",
      "details": "28.05.2025 (Bekanntmachungsdatum)\n\nBaden-Württemberg Amtsgericht Ulm HRB 540123\nRegisterbekanntmachung nach dem Umwandlungsgesetz 28.05.2025 (Eintragungsdatum)\n\nWilhelm Stahlecker GmbH\nGesellschaft mit beschränkter Haftung\nSüßen\n\nAls nicht eingetragen wird bekanntgemacht:\nDen Gläubigern der an der Verschmelzung beteiligten Rechtsträger ist, wenn sie binnen sechs Monaten nach dem Tag, an dem die Eintragung der Verschmelzung in das Register des Sitzes desjenigen Rechtsträgers, dessen Gläubiger sie sind, nach § 19 Abs. 3 UmwG als bekanntgemacht gilt, ihren Anspruch nach Grund und Höhe schriftlich anmelden, Sicherheit zu leisten, soweit sie nicht Befriedigung verlangen können. Dieses Recht steht den Gläubigern jedoch nur zu, wenn sie glaubhaft machen, dass durch die Verschmelzung die Erfüllung ihrer Forderung gefährdet wird."
    },
    {
      "date": "2025-05-28",
      "id": "110458",
      "original_text": "Registerbekanntmachung nach dem Umwandlungsgesetz\nBaden-Württemberg Amtsgericht Ulm HRA 729571\nMartin Kronenberger, Heizungs- und Lüftungsbau e.K. – Waldburg",
      "type": "Registerbekanntmachung nach dem Umwandlungsgesetz",
      "state": "Baden-Württemberg",
      "amtsgericht": "Amtsgericht Ulm",
      "registernummer": "HRA 729571",
      "registerart": "HRA",
      "company_name": "Martin Kronenberger, Heizungs- und Lüftungsbau e.K.",
      "company_seat": "Waldburg",
      "details": "28.05.2025 (Bekanntmachungsdatum)\n\nBaden-Württemberg Amtsgericht Ulm HRA 729571\nRegisterbekanntmachung nach dem Umwandlungsgesetz 28.05.2025 (Eintragungsdatum)\n\nMartin Kronenberger, Heizungs- und Lüftungsbau e.K.\nEinzelkaufmann / Einzelkauffrau\nWaldburg\n\nAls nicht eingetragen wird bekanntgemacht:\nDen Gläubigern der an der Ausgliederung beteiligten Rechtsträger ist, wenn sie binnen sechs Monaten nach dem Tag, an dem die Eintragung der Ausgliederung in das Register des Sitzes desjenigen Rechtsträgers, dessen Gläubiger sie sind, nach § 19 Abs. 3 UmwG als bekanntgemacht gilt, ihren Anspruch nach Grund und Höhe schriftlich anmelden, Sicherheit zu leisten, soweit sie nicht Befriedigung verlangen können. Dieses Recht steht den Gläubigern jedoch nur zu, wenn sie glaubhaft machen, dass durch die Ausgliederung die Erfüllung ihrer Forderung gefährdet wird."
    },
    {
      "date": "2025-05-28",
      "id": "110459",
      "original_text": "Registerbekanntmachung nach dem Umwandlungsgesetz\nBaden-Württemberg Amtsgericht Stuttgart HRB 727284\nMulti Packaging Solutions Leasing GmbH – Obersulm",
      "type": "Registerbekanntmachung nach dem Umwandlungsgesetz",
      "state": "Baden-Württemberg",
      "amtsgericht": "Amtsgericht Stuttgart",
      "registernummer": "HRB 727284",
      "registerart": "HRB",
      "company_name": "Multi Packaging Solutions Leasing GmbH",
      "company_seat": "Obersulm",
      "details": "28.05.2025 (Bekanntmachungsdatum)\n\nBaden-Württemberg Amtsgericht Stuttgart HRB 727284\nRegisterbekanntmachung nach dem Umwandlungsgesetz 28.05.2025 (Eintragungsdatum)\n\nMulti Packaging Solutions Leasing GmbH\nGesellschaft mit beschränkter Haftung\nObersulm\n\nAls nicht eingetragen wird bekanntgemacht:\nDen Gläubigern der an der Verschmelzung beteiligten Rechtsträger ist, wenn sie binnen sechs Monaten nach dem Tag, an dem die Eintragung der Verschmelzung in das Register des Sitzes desjenigen Rechtsträgers, dessen Gläubiger sie sind, nach § 19 Abs. 3 UmwG als bekanntgemacht gilt, ihren Anspruch nach Grund und Höhe schriftlich anmelden, Sicherheit zu leisten, soweit sie nicht Befriedigung verlangen können. Dieses Recht steht den Gläubigern jedoch nur zu, wenn sie glaubhaft machen, dass durch die Verschmelzung die Erfüllung ihrer Forderung gefährdet wird."
    },
    {
      "date": "2025-05-28",
      "id": "110460",
      "original_text": "Registerbekanntmachung nach dem Umwandlungsgesetz\nBerlin Amtsgericht Berlin (Charlottenburg) HRB 124236\nGrand City Property GmbH – Berlin",
      "type": "Registerbekanntmachung nach dem Umwandlungsgesetz",
      "state": "Berlin",
      "amtsgericht": "Amtsgericht Berlin (Charlottenburg)",
      "registernummer": "HRB 124236",
      "registerart": "HRB",
      "company_name": "Grand City Property GmbH",
      "company_seat": "Berlin",
      "details": "28.05.2025 (Bekanntmachungsdatum)\n\nBerlin Amtsgericht Berlin (Charlottenburg) HRB 124236\nRegisterbekanntmachung nach dem Umwandlungsgesetz 27.05.2025 (Eintragungsdatum)\n\nGrand City Property GmbH\nGesellschaft mit beschränkter Haftung\nBerlin\n\nZu Eintragungsnummer 7 vom 27.05.2025 wird als nicht eingetragen veröffentlicht:Den Gläubigern der an der Verschmelzung beteiligten Rechtsträger ist, wenn sie binnen sechs Monaten nach dem Tag, an dem die Eintragung der Verschmelzung in das Register des Sitzes desjenigen Rechtsträgers, dessen Gläubiger sie sind, als bekannt gemacht gilt, ihren Anspruch nach Grund und Höhe schriftlich anmelden, Sicherheit zu leisten, soweit sie nicht Befriedigung verlangen können. Dieses Recht steht den Gläubigern jedoch nur zu, wenn sie glaubhaft machen, dass durch die Verschmelzung die Erfüllung ihrer Forderung gefährdet wird. Das Recht, Sicherheitsleistung zu verlangen, steht Gläubigern nicht zu, die im Falle der Insolvenz ein Recht auf vorzugsweise Befriedigung aus einer Deckungsmasse haben, die nach gesetzlicher Vorschrift zu ihrem Schutz errichtet und staatlich überwacht ist."
    },
    {
      "date": "2025-05-28",
      "id": "110461",
      "original_text": "Registerbekanntmachung nach dem Umwandlungsgesetz\nBerlin Amtsgericht Berlin (Charlottenburg) HRB 124236\nGrand City Property GmbH – Berlin",
      "type": "Registerbekanntmachung nach dem Umwandlungsgesetz",
      "state": "Berlin",
      "amtsgericht": "Amtsgericht Berlin (Charlottenburg)",
      "registernummer": "HRB 124236",
      "registerart": "HRB",
      "company_name": "Grand City Property GmbH",
      "company_seat": "Berlin",
      "details": "28.05.2025 (Bekanntmachungsdatum)\n\nBerlin Amtsgericht Berlin (Charlottenburg) HRB 124236\nRegisterbekanntmachung nach dem Umwandlungsgesetz 27.05.2025 (Eintragungsdatum)\n\nGrand City Property GmbH\nGesellschaft mit beschränkter Haftung\nBerlin\n\nZu Eintragungsnummer 8 vom 27.05.2025 wird als nicht eingetragen veröffentlicht:Den Gläubigern der an der Verschmelzung beteiligten Rechtsträger ist, wenn sie binnen sechs Monaten nach dem Tag, an dem die Eintragung der Verschmelzung in das Register des Sitzes desjenigen Rechtsträgers, dessen Gläubiger sie sind, als bekannt gemacht gilt, ihren Anspruch nach Grund und Höhe schriftlich anmelden, Sicherheit zu leisten, soweit sie nicht Befriedigung verlangen können. Dieses Recht steht den Gläubigern jedoch nur zu, wenn sie glaubhaft machen, dass durch die Verschmelzung die Erfüllung ihrer Forderung gefährdet wird. Das Recht, Sicherheitsleistung zu verlangen, steht Gläubigern nicht zu, die im Falle der Insolvenz ein Recht auf vorzugsweise Befriedigung aus einer Deckungsmasse haben, die nach gesetzlicher Vorschrift zu ihrem Schutz errichtet und staatlich überwacht ist."
    },
    {
      "date": "2025-05-28",
      "id": "110462",
      "original_text": "Registerbekanntmachung nach dem Umwandlungsgesetz\nBerlin Amtsgericht Berlin (Charlottenburg) HRB 124236\nGrand City Property GmbH – Berlin",
      "type": "Registerbekanntmachung nach dem Umwandlungsgesetz",
      "state": "Berlin",
      "amtsgericht": "Amtsgericht Berlin (Charlottenburg)",
      "registernummer": "HRB 124236",
      "registerart": "HRB",
      "company_name": "Grand City Property GmbH",
      "company_seat": "Berlin",
      "details": "28.05.2025 (Bekanntmachungsdatum)\n\nBerlin Amtsgericht Berlin (Charlottenburg) HRB 124236\nRegisterbekanntmachung nach dem Umwandlungsgesetz 27.05.2025 (Eintragungsdatum)\n\nGrand City Property GmbH\nGesellschaft mit beschränkter Haftung\nBerlin\n\nZu Eintragungsnummer 9 vom 27.05.2025 wird als nicht eingetragen veröffentlicht:Den Gläubigern der an der Verschmelzung beteiligten Rechtsträger ist, wenn sie binnen sechs Monaten nach dem Tag, an dem die Eintragung der Verschmelzung in das Register des Sitzes desjenigen Rechtsträgers, dessen Gläubiger sie sind, als bekannt gemacht gilt, ihren Anspruch nach Grund und Höhe schriftlich anmelden, Sicherheit zu leisten, soweit sie nicht Befriedigung verlangen können. Dieses Recht steht den Gläubigern jedoch nur zu, wenn sie glaubhaft machen, dass durch die Verschmelzung die Erfüllung ihrer Forderung gefährdet wird. Das Recht, Sicherheitsleistung zu verlangen, steht Gläubigern nicht zu, die im Falle der Insolvenz ein Recht auf vorzugsweise Befriedigung aus einer Deckungsmasse haben, die nach gesetzlicher Vorschrift zu ihrem Schutz errichtet und staatlich überwacht ist."
    },
    {
      "date": "2025-05-28",
      "id": "110463",
      "original_text": "Registerbekanntmachung nach dem Umwandlungsgesetz\nBaden-Württemberg Amtsgericht Ulm HRA 725610\nHögerle Sanitär - Heizung - Bauflaschnerei e.K., Inhaber: Michael Kronenberger – Ravensburg",
      "type": "Registerbekanntmachung nach dem Umwandlungsgesetz",
      "state": "Baden-Württemberg",
      "amtsgericht": "Amtsgericht Ulm",
      "registernummer": "HRA 725610",
      "registerart": "HRA",
      "company_name": "Högerle Sanitär - Heizung - Bauflaschnerei e.K., Inhaber: Michael Kronenberger",
      "company_seat": "Ravensburg",
      "details": "28.05.2025 (Bekanntmachungsdatum)\n\nBaden-Württemberg Amtsgericht Ulm HRA 725610\nRegisterbekanntmachung nach dem Umwandlungsgesetz 28.05.2025 (Eintragungsdatum)\n\nHögerle Sanitär - Heizung - Bauflaschnerei e.K., Inhaber: Michael Kronenberger\nEinzelkaufmann / Einzelkauffrau\nRavensburg\n\nDen Gläubigern der an der Ausgliederung beteiligten Rechtsträger ist, wenn sie binnen sechs Monaten nach dem Tag, an dem die Eintragung der Ausgliederung in das Register des Sitzes desjenigen Rechtsträgers, dessen Gläubiger sie sind, nach § 19 Abs. 3 UmwG als bekanntgemacht gilt, ihren Anspruch nach Grund und Höhe schriftlich anmelden, Sicherheit zu leisten, soweit sie nicht Befriedigung verlangen können. Dieses Recht steht den Gläubigern jedoch nur zu, wenn sie glaubhaft machen, dass durch die Ausgliederung die Erfüllung ihrer Forderung gefährdet wird."
    },
    {
      "date": "2025-05-28",
      "id": "110464",
      "original_text": "Registerbekanntmachung nach dem Umwandlungsgesetz\nBaden-Württemberg Amtsgericht Ulm HRB 749744\nKronenberger Gebäudetechnik GmbH – Waldburg",
      "type": "Registerbekanntmachung nach dem Umwandlungsgesetz",
      "state": "Baden-Württemberg",
      "amtsgericht": "Amtsgericht Ulm",
      "registernummer": "HRB 749744",
      "registerart": "HRB",
      "company_name": "Kronenberger Gebäudetechnik GmbH",
      "company_seat": "Waldburg",
      "details": "28.05.2025 (Bekanntmachungsdatum)\n\nBaden-Württemberg Amtsgericht Ulm HRB 749744\nRegisterbekanntmachung nach dem Umwandlungsgesetz 28.05.2025 (Eintragungsdatum)\n\nKronenberger Gebäudetechnik GmbH\nGesellschaft mit beschränkter Haftung\nWaldburg\n\nAls nicht eingetragen wird bekanntgemacht:\nDen Gläubigern der an der Ausgliederung beteiligten Rechtsträger ist, wenn sie binnen sechs Monaten nach dem Tag, an dem die Eintragung der Ausgliederung in das Register des Sitzes desjenigen Rechtsträgers, dessen Gläubiger sie sind, nach § 19 Abs. 3 UmwG als bekanntgemacht gilt, ihren Anspruch nach Grund und Höhe schriftlich anmelden, Sicherheit zu leisten, soweit sie nicht Befriedigung verlangen können. Dieses Recht steht den Gläubigern jedoch nur zu, wenn sie glaubhaft machen, dass durch die Ausgliederung die Erfüllung ihrer Forderung gefährdet wird."
    },
    {
      "date": "2025-05-28",
      "id": "110465",
      "original_text": "Registerbekanntmachung nach dem Umwandlungsgesetz\nBaden-Württemberg Amtsgericht Ulm HRB 749744\nKronenberger Gebäudetechnik GmbH – Waldburg",
      "type": "Registerbekanntmachung nach dem Umwandlungsgesetz",
      "state": "Baden-Württemberg",
      "amtsgericht": "Amtsgericht Ulm",
      "registernummer": "HRB 749744",
      "registerart": "HRB",
      "company_name": "Kronenberger Gebäudetechnik GmbH",
      "company_seat": "Waldburg",
      "details": "28.05.2025 (Bekanntmachungsdatum)\n\nBaden-Württemberg Amtsgericht Ulm HRB 749744\nRegisterbekanntmachung nach dem Umwandlungsgesetz 28.05.2025 (Eintragungsdatum)\n\nKronenberger Gebäudetechnik GmbH\nGesellschaft mit beschränkter Haftung\nWaldburg\n\nAls nicht eingetragen wird bekanntgemacht:\nDen Gläubigern der an der Ausgliederung beteiligten Rechtsträger ist, wenn sie binnen sechs Monaten nach dem Tag, an dem die Eintragung der Ausgliederung in das Register des Sitzes desjenigen Rechtsträgers, dessen Gläubiger sie sind, nach § 19 Abs. 3 UmwG als bekanntgemacht gilt, ihren Anspruch nach Grund und Höhe schriftlich anmelden, Sicherheit zu leisten, soweit sie nicht Befriedigung verlangen können. Dieses Recht steht den Gläubigern jedoch nur zu, wenn sie glaubhaft machen, dass durch die Ausgliederung die Erfüllung ihrer Forderung gefährdet wird."
    },
    {
      "date": "2025-05-28",
      "id": "110466",
      "original_text": "Registerbekanntmachung nach dem Umwandlungsgesetz\nBaden-Württemberg Amtsgericht Stuttgart HRA 739831\nKung Fu Academy Jochen Dietter e.K. – Ofterdingen",
      "type": "Registerbekanntmachung nach dem Umwandlungsgesetz",
      "state": "Baden-Württemberg",
      "amtsgericht": "Amtsgericht Stuttgart",
      "registernummer": "HRA 739831",
      "registerart": "HRA",
      "company_name": "Kung Fu Academy Jochen Dietter e.K.",
      "company_seat": "Ofterdingen",
      "details": "28.05.2025 (Bekanntmachungsdatum)\n\nBaden-Württemberg Amtsgericht Stuttgart HRA 739831\nRegisterbekanntmachung nach dem Umwandlungsgesetz 28.05.2025 (Eintragungsdatum)\n\nKung Fu Academy Jochen Dietter e.K.\nEinzelkaufmann / Einzelkauffrau\nOfterdingen\n\nDen Gläubigern der an der Ausgliederung beteiligten Rechtsträger ist, wenn sie binnen sechs Monaten nach dem Tag, an dem die Eintragung der Ausgliederung in das Register des Sitzes desjenigen Rechtsträgers, dessen Gläubiger sie sind, nach § 19 Abs. 3 UmwG als bekanntgemacht gilt, ihren Anspruch nach Grund und Höhe schriftlich anmelden, Sicherheit zu leisten, soweit sie nicht Befriedigung verlangen können. Dieses Recht steht den Gläubigern jedoch nur zu, wenn sie glaubhaft machen, dass durch die Ausgliederung die Erfüllung ihrer Forderung gefährdet wird."
    },
    {
      "date": "2025-05-28",
      "id": "110467",
      "original_text": "Sonstige Registerbekanntmachung\nHamburg Amtsgericht Hamburg HRB 113990\nRitzio Hamburg GmbH – Hamburg",
      "type": "Sonstige Registerbekanntmachung",
      "state": "Hamburg",
      "amtsgericht": "Amtsgericht Hamburg",
      "registernummer": "HRB 113990",
      "registerart": "HRB",
      "company_name": "Ritzio Hamburg GmbH",
      "company_seat": "Hamburg",
      "details": "28.05.2025 (Bekanntmachungsdatum)\n\nHamburg Amtsgericht Hamburg HRB 113990\nSonstige Registerbekanntmachung 28.05.2025 (Eintragungsdatum)\n\nRitzio Hamburg GmbH\nGesellschaft mit beschränkter Haftung\nHamburg\n\nAls nicht eingetragen wird bekannt gemacht:  Den Gläubigern der Gesellschaft, deren Forderungen begründet worden sind, bevor die Eintragung der Vertragsbeendigung in das Handelsregister nach § 10 HGB als bekannt gemacht gilt, ist vom anderen Vertragsteil Sicherheit zu leisten, wenn sie sich binnen 6 Monaten nach Bekanntmachung der Eintragung zu diesem Zweck bei ihm melden."
    },
    {
      "date": "2025-05-28",
      "id": "110468",
      "original_text": "Registerbekanntmachung nach dem Umwandlungsgesetz\nHamburg Amtsgericht Hamburg HRB 164785\nGARBE LogiLux d38-IH GmbH – Hamburg",
      "type": "Registerbekanntmachung nach dem Umwandlungsgesetz",
      "state": "Hamburg",
      "amtsgericht": "Amtsgericht Hamburg",
      "registernummer": "HRB 164785",
      "registerart": "HRB",
      "company_name": "GARBE LogiLux d38-IH GmbH",
      "company_seat": "Hamburg",
      "details": "28.05.2025 (Bekanntmachungsdatum)\n\nHamburg Amtsgericht Hamburg HRB 164785\nRegisterbekanntmachung nach dem Umwandlungsgesetz 28.05.2025 (Eintragungsdatum)\n\nGARBE LogiLux d38-IH GmbH\nGesellschaft mit beschränkter Haftung\nHamburg\n\nAls nicht eingetragen wird bekannt gemacht:\nDen Gläubigern der an der Verschmelzung beteiligten Gesellschaften ist, wenn sie binnen sechs Monaten nach dem Tag, an dem die Eintragung der Verschmelzung in das Register des Sitzes desjenigen Rechtsträgers, dessen Gläubiger sie sind, nach § 19 Absatz 3 UmwG als bekannt gemacht gilt, ihren Anspruch nach Grund und Höhe schriftlich anmelden, Sicherheit zu leisten, soweit sie nicht Befriedigung verlangen können. Dieses Recht steht den Gläubigern jedoch nur zu, wenn sie glaubhaft machen, dass durch die Verschmelzung die Erfüllung ihrer Forderung gefährdet wird."
    },
    {
      "date": "2025-05-28",
      "id": "110469",
      "original_text": "Registerbekanntmachung nach dem Umwandlungsgesetz\nHamburg Amtsgericht Hamburg HRB 96093\nd6 LEIP LogiLux GmbH – Hamburg",
      "type": "Registerbekanntmachung nach dem Umwandlungsgesetz",
      "state": "Hamburg",
      "amtsgericht": "Amtsgericht Hamburg",
      "registernummer": "HRB 96093",
      "registerart": "HRB",
      "company_name": "d6 LEIP LogiLux GmbH",
      "company_seat": "Hamburg",
      "details": "28.05.2025 (Bekanntmachungsdatum)\n\nHamburg Amtsgericht Hamburg HRB 96093\nRegisterbekanntmachung nach dem Umwandlungsgesetz 28.05.2025 (Eintragungsdatum)\n\nd6 LEIP LogiLux GmbH\nGesellschaft mit beschränkter Haftung\nHamburg\n\nAls nicht eingetragen wird bekannt gemacht:\nDen Gläubigern der an der Verschmelzung beteiligten Gesellschaften ist, wenn sie binnen sechs Monaten nach dem Tag, an dem die Eintragung der Verschmelzung in das Register des Sitzes desjenigen Rechtsträgers, dessen Gläubiger sie sind, nach § 19 Absatz 3 UmwG als bekannt gemacht gilt, ihren Anspruch nach Grund und Höhe schriftlich anmelden, Sicherheit zu leisten, soweit sie nicht Befriedigung verlangen können. Dieses Recht steht den Gläubigern jedoch nur zu, wenn sie glaubhaft machen, dass durch die Verschmelzung die Erfüllung ihrer Forderung gefährdet wird."
    },
    {
      "date": "2025-05-28",
      "id": "110470",
      "original_text": "Registerbekanntmachung nach dem Umwandlungsgesetz\nBaden-Württemberg Amtsgericht Stuttgart HRB 798195\nKFA Jochen Dietter GmbH – Ofterdingen",
      "type": "Registerbekanntmachung nach dem Umwandlungsgesetz",
      "state": "Baden-Württemberg",
      "amtsgericht": "Amtsgericht Stuttgart",
      "registernummer": "HRB 798195",
      "registerart": "HRB",
      "company_name": "KFA Jochen Dietter GmbH",
      "company_seat": "Ofterdingen",
      "details": "28.05.2025 (Bekanntmachungsdatum)\n\nBaden-Württemberg Amtsgericht Stuttgart HRB 798195\nRegisterbekanntmachung nach dem Umwandlungsgesetz 28.05.2025 (Eintragungsdatum)\n\nKFA Jochen Dietter GmbH\nGesellschaft mit beschränkter Haftung\nOfterdingen\n\nAls nicht eingetragen wird bekanntgemacht:\nDen Gläubigern der an der Ausgliederung beteiligten Rechtsträger ist, wenn sie binnen sechs Monaten nach dem Tag, an dem die Eintragung der Ausgliederung in das Register des Sitzes desjenigen Rechtsträgers, dessen Gläubiger sie sind, nach § 19 Abs. 3 UmwG als bekanntgemacht gilt, ihren Anspruch nach Grund und Höhe schriftlich anmelden, Sicherheit zu leisten, soweit sie nicht Befriedigung verlangen können. Dieses Recht steht den Gläubigern jedoch nur zu, wenn sie glaubhaft machen, dass durch die Ausgliederung die Erfüllung ihrer Forderung gefährdet wird."
    },
    {
      "date": "2025-05-28",
      "id": "110471",
      "original_text": "Registerbekanntmachung nach dem Umwandlungsgesetz\nBaden-Württemberg Amtsgericht Ulm HRA 640674\nAlbert Handtmann Metallgußwerk GmbH & Co. KG – Biberach an der Riß",
      "type": "Registerbekanntmachung nach dem Umwandlungsgesetz",
      "state": "Baden-Württemberg",
      "amtsgericht": "Amtsgericht Ulm",
      "registernummer": "HRA 640674",
      "registerart": "HRA",
      "company_name": "Albert Handtmann Metallgußwerk GmbH & Co. KG",
      "company_seat": "Biberach an der Riß",
      "details": "28.05.2025 (Bekanntmachungsdatum)\n\nBaden-Württemberg Amtsgericht Ulm HRA 640674\nRegisterbekanntmachung nach dem Umwandlungsgesetz 28.05.2025 (Eintragungsdatum)\n\nAlbert Handtmann Metallgußwerk GmbH & Co. KG\nKommanditgesellschaft\nBiberach an der Riß\n\nAls nicht eingetragen wird bekanntgemacht:\nDen Gläubigern der an der Verschmelzung beteiligten Rechtsträger ist, wenn sie binnen sechs Monaten nach dem Tag, an dem die Eintragung der Verschmelzung in das Register des Sitzes desjenigen Rechtsträgers, dessen Gläubiger sie sind, nach § 19 Abs. 3 UmwG als bekanntgemacht gilt, ihren Anspruch nach Grund und Höhe schriftlich anmelden, Sicherheit zu leisten, soweit sie nicht Befriedigung verlangen können. Dieses Recht steht den Gläubigern jedoch nur zu, wenn sie glaubhaft machen, dass durch die Verschmelzung die Erfüllung ihrer Forderung gefährdet wird."
    },
    {
      "date": "2025-05-28",
      "id": "110472",
      "original_text": "Registerbekanntmachung nach dem Umwandlungsgesetz\nSchleswig-Holstein Amtsgericht Kiel HRB 24481\nSIngredients GmbH – Neumünster",
      "type": "Registerbekanntmachung nach dem Umwandlungsgesetz",
      "state": "Schleswig-Holstein",
      "amtsgericht": "Amtsgericht Kiel",
      "registernummer": "HRB 24481",
      "registerart": "HRB",
      "company_name": "SIngredients GmbH",
      "company_seat": "Neumünster",
      "details": "28.05.2025 (Bekanntmachungsdatum)\n\nSchleswig-Holstein Amtsgericht Kiel HRB 24481\nRegisterbekanntmachung nach dem Umwandlungsgesetz 27.05.2025 (Eintragungsdatum)\n\nSIngredients GmbH\nGesellschaft mit beschränkter Haftung\nNeumünster\n\nZu Eintragungsnummer 2 vom 27.05.2025 wird als nicht eingetragen veröffentlicht:  Den Gläubigern der an der Verschmelzung beteiligten Rechtsträger ist, wenn sie binnen sechs Monaten nach dem Tag, an dem die Eintragung der Verschmelzung in das Register des Sitzes desjenigen Rechtsträgers, dessen Gläubiger sie sind, nach § 19 Abs. 3 UmwG bekannt gemacht worden ist, ihren Anspruch nach Grund und Höhe schriftlich anmelden, Sicherheit zu leisten, soweit sie nicht Befriedigung verlangen können. Dieses Recht steht den Gläubigern jedoch nur zu, wenn sie glaubhaft machen, dass durch die Verschmelzung die Erfüllung ihrer Forderung gefährdet wird."
    },
    {
      "date": "2025-05-28",
      "id": "110473",
      "original_text": "Löschungsankündigung\nSchleswig-Holstein Amtsgericht Lübeck HRB 20610\nFiimm GmbH – Burg a. Fehmarn",
      "type": "Löschungsankündigung",
      "state": "Schleswig-Holstein",
      "amtsgericht": "Amtsgericht Lübeck",
      "registernummer": "HRB 20610",
      "registerart": "HRB",
      "company_name": "Fiimm GmbH",
      "company_seat": "Burg a. Fehmarn",
      "details": "28.05.2025 (Bekanntmachungsdatum)\n\nSchleswig-Holstein Amtsgericht Lübeck HRB 20610\nLöschungsankündigung\n\nFiimm GmbH\nGesellschaft mit beschränkter Haftung\nBurg a. Fehmarn\n\nEs ist die Löschung der nachstehenden Gesellschaft wegen Vermögenslosigkeit gemäß § 394 FamFG beabsichtigt. Widerspruchsfrist: 1 Monat."
    },
    {
      "date": "2025-05-28",
      "id": "110474",
      "original_text": "Registerbekanntmachung nach dem Umwandlungsgesetz\nHamburg Amtsgericht Hamburg HRB 95316\nupgrading GmbH – Hamburg",
      "type": "Registerbekanntmachung nach dem Umwandlungsgesetz",
      "state": "Hamburg",
      "amtsgericht": "Amtsgericht Hamburg",
      "registernummer": "HRB 95316",
      "registerart": "HRB",
      "company_name": "upgrading GmbH",
      "company_seat": "Hamburg",
      "details": "28.05.2025 (Bekanntmachungsdatum)\n\nHamburg Amtsgericht Hamburg HRB 95316\nRegisterbekanntmachung nach dem Umwandlungsgesetz 28.05.2025 (Eintragungsdatum)\n\nupgrading GmbH\nGesellschaft mit beschränkter Haftung\nHamburg\n\nAls nicht eingetragen wird bekannt gemacht:\nDen Gläubigern der an der Verschmelzung beteiligten Gesellschaften ist, wenn sie binnen sechs Monaten nach dem Tag, an dem die Eintragung der Verschmelzung in das Register des Sitzes desjenigen Rechtsträgers, dessen Gläubiger sie sind, nach § 19 Absatz 3 UmwG als bekannt gemacht gilt, ihren Anspruch nach Grund und Höhe schriftlich anmelden, Sicherheit zu leisten, soweit sie nicht Befriedigung verlangen können. Dieses Recht steht den Gläubigern jedoch nur zu, wenn sie glaubhaft machen, dass durch die Verschmelzung die Erfüllung ihrer Forderung gefährdet wird."
    },
    {
      "date": "2025-05-28",
      "id": "110475",
      "original_text": "Registerbekanntmachung nach dem Umwandlungsgesetz\nHamburg Amtsgericht Hamburg HRB 83904\nSMD Beteiligungsgesellschaft mbH – Hamburg",
      "type": "Registerbekanntmachung nach dem Umwandlungsgesetz",
      "state": "Hamburg",
      "amtsgericht": "Amtsgericht Hamburg",
      "registernummer": "HRB 83904",
      "registerart": "HRB",
      "company_name": "SMD Beteiligungsgesellschaft mbH",
      "company_seat": "Hamburg",
      "details": "28.05.2025 (Bekanntmachungsdatum)\n\nHamburg Amtsgericht Hamburg HRB 83904\nRegisterbekanntmachung nach dem Umwandlungsgesetz 28.05.2025 (Eintragungsdatum)\n\nSMD Beteiligungsgesellschaft mbH\nGesellschaft mit beschränkter Haftung\nHamburg\n\nAls nicht eingetragen wird bekannt gemacht:\nDen Gläubigern der an der Verschmelzung beteiligten Gesellschaften ist, wenn sie binnen sechs Monaten nach dem Tag, an dem die Eintragung der Verschmelzung in das Register des Sitzes derjenigen Rechtsträger deren Gläubiger sie sind, nach § 19 Absatz 3 UmwG als bekannt gemacht gilt, ihren Anspruch nach Grund und Höhe schriftlich anmelden, Sicherheit zu leisten, soweit sie nicht Befriedigung verlangen können. Dieses Recht steht den Gläubigern jedoch nur zu, wenn sie glaubhaft machen, dass durch die Verschmelzung die Erfüllung ihrer Forderung gefährdet wird."
    },
    {
      "date": "2025-05-28",
      "id": "110476",
      "original_text": "Sonstige Registerbekanntmachung\nHamburg Amtsgericht Hamburg HRB 102654\nMARCARD, STEIN & CO AG – Hamburg",
      "type": "Sonstige Registerbekanntmachung",
      "state": "Hamburg",
      "amtsgericht": "Amtsgericht Hamburg",
      "registernummer": "HRB 102654",
      "registerart": "HRB",
      "company_name": "MARCARD, STEIN & CO AG",
      "company_seat": "Hamburg",
      "details": "28.05.2025 (Bekanntmachungsdatum)\n\nHamburg Amtsgericht Hamburg HRB 102654\nSonstige Registerbekanntmachung\n\nMARCARD, STEIN & CO AG\nAktiengesellschaft\nHamburg\n\nAls nicht eingetragen wird bekannt gemacht: Liste des Aufsichtsrats wurde eingereicht."
    },
    {
      "date": "2025-05-28",
      "id": "110477",
      "original_text": "Einreichung neuer Dokumente\nSchleswig-Holstein Amtsgericht Flensburg HRB 2981\nttp AG Steuerberatungsgesellschaft – Flensburg",
      "type": "Einreichung neuer Dokumente",
      "state": "Schleswig-Holstein",
      "amtsgericht": "Amtsgericht Flensburg",
      "registernummer": "HRB 2981",
      "registerart": "HRB",
      "company_name": "ttp AG Steuerberatungsgesellschaft",
      "company_seat": "Flensburg",
      "details": "28.05.2025 (Bekanntmachungsdatum)\n\nSchleswig-Holstein Amtsgericht Flensburg HRB 2981\nEinreichung neuer Dokumente\n\nttp AG Steuerberatungsgesellschaft\nAktiengesellschaft\nFlensburg\n\nNeue Aufsichtsratsliste nach Änderung eingereicht am 28.05.2025."
    },
    {
      "date": "2025-05-28",
      "id": "110478",
      "original_text": "Registerbekanntmachung nach dem Umwandlungsgesetz\nBerlin Amtsgericht Berlin (Charlottenburg) HRB 182797\nBPD Business Procurement GmbH – Berlin",
      "type": "Registerbekanntmachung nach dem Umwandlungsgesetz",
      "state": "Berlin",
      "amtsgericht": "Amtsgericht Berlin (Charlottenburg)",
      "registernummer": "HRB 182797",
      "registerart": "HRB",
      "company_name": "BPD Business Procurement GmbH",
      "company_seat": "Berlin",
      "details": "28.05.2025 (Bekanntmachungsdatum)\n\nBerlin Amtsgericht Berlin (Charlottenburg) HRB 182797\nRegisterbekanntmachung nach dem Umwandlungsgesetz 27.05.2025 (Eintragungsdatum)\n\nBPD Business Procurement GmbH\nGesellschaft mit beschränkter Haftung\nBerlin\n\nZu Eintragungsnummer 6 vom 27.05.2025 wird als nicht eingetragen veröffentlicht:Den Gläubigern der an der Verschmelzung beteiligten Rechtsträger ist, wenn sie binnen sechs Monaten nach dem Tag, an dem die Eintragung der Verschmelzung in das Register des Sitzes desjenigen Rechtsträgers, dessen Gläubiger sie sind, als bekannt gemacht gilt, ihren Anspruch nach Grund und Höhe schriftlich anmelden, Sicherheit zu leisten, soweit sie nicht Befriedigung verlangen können. Dieses Recht steht den Gläubigern jedoch nur zu, wenn sie glaubhaft machen, dass durch die Verschmelzung die Erfüllung ihrer Forderung gefährdet wird. Das Recht, Sicherheitsleistung zu verlangen, steht Gläubigern nicht zu, die im Falle der Insolvenz ein Recht auf vorzugsweise Befriedigung aus einer Deckungsmasse haben, die nach gesetzlicher Vorschrift zu ihrem Schutz errichtet und staatlich überwacht ist."
    },
    {
      "date": "2025-05-28",
      "id": "110479",
      "original_text": "Löschungsankündigung\nBerlin Amtsgericht Berlin (Charlottenburg) HRB 191749\nCash2Plus UG (haftungsbeschränkt) – Berlin",
      "type": "Löschungsankündigung",
      "state": "Berlin",
      "amtsgericht": "Amtsgericht Berlin (Charlottenburg)",
      "registernummer": "HRB 191749",
      "registerart": "HRB",
      "company_name": "Cash2Plus UG (haftungsbeschränkt)",
      "company_seat": "Berlin",
      "details": "28.05.2025 (Bekanntmachungsdatum)\n\nBerlin Amtsgericht Berlin (Charlottenburg) HRB 191749\nLöschungsankündigung\n\nCash2Plus UG (haftungsbeschränkt)\nGesellschaft mit beschränkter Haftung\nBerlin\n\nBei der nachstehenden Gesellschaft wird das Amtslöschungsverfahren gemäß § 394 FamFG eingeleitet. Widerspruchsfrist 6 Wochen"
    },
    {
      "date": "2025-05-28",
      "id": "110480",
      "original_text": "Löschungsankündigung\nBaden-Württemberg Amtsgericht Freiburg HRB 490474\nBaustukkateurgeschäft Norbert Männle GmbH – Renchen",
      "type": "Löschungsankündigung",
      "state": "Baden-Württemberg",
      "amtsgericht": "Amtsgericht Freiburg",
      "registernummer": "HRB 490474",
      "registerart": "HRB",
      "company_name": "Baustukkateurgeschäft Norbert Männle GmbH",
      "company_seat": "Renchen",
      "details": "28.05.2025 (Bekanntmachungsdatum)\n\nBaden-Württemberg Amtsgericht Freiburg HRB 490474\nLöschungsankündigung\n\nBaustukkateurgeschäft Norbert Männle GmbH\nGesellschaft mit beschränkter Haftung\nRenchen\n\nAls nicht eingetragen wird bekanntgemacht:\nDas Gericht beabsichtigt, die Gesellschaft wegen Vermögenslosigkeit im Handelsregister von Amts wegen nach § 394 FamFG zu löschen. Die Frist zur Geltendmachung eines Widerspruchs gegen die beabsichtigte Löschung ist auf einen Monat ab Veröffentlichung bestimmt."
    },
    {
      "date": "2025-05-28",
      "id": "110481",
      "original_text": "Sonstige Registerbekanntmachung\nBaden-Württemberg Amtsgericht Ulm HRB 632124\nKlinikum Friedrichshafen GmbH – Friedrichshafen",
      "type": "Sonstige Registerbekanntmachung",
      "state": "Baden-Württemberg",
      "amtsgericht": "Amtsgericht Ulm",
      "registernummer": "HRB 632124",
      "registerart": "HRB",
      "company_name": "Klinikum Friedrichshafen GmbH",
      "company_seat": "Friedrichshafen",
      "details": "28.05.2025 (Bekanntmachungsdatum)\n\nBaden-Württemberg Amtsgericht Ulm HRB 632124\nSonstige Registerbekanntmachung\n\nKlinikum Friedrichshafen GmbH\nGesellschaft mit beschränkter Haftung\nFriedrichshafen\n\nDie Gesellschaft hat am 23.05.2025 die Liste über die Zusammensetzung des Aufsichtsrats zum Handelsregister eingereicht."
    },
    {
      "date": "2025-05-28",
      "id": "110482",
      "original_text": "Registerbekanntmachung nach dem Umwandlungsgesetz\nHamburg Amtsgericht Hamburg HRB 54990\nBIO-LUTIONS GmbH – Hamburg",
      "type": "Registerbekanntmachung nach dem Umwandlungsgesetz",
      "state": "Hamburg",
      "amtsgericht": "Amtsgericht Hamburg",
      "registernummer": "HRB 54990",
      "registerart": "HRB",
      "company_name": "BIO-LUTIONS GmbH",
      "company_seat": "Hamburg",
      "details": "28.05.2025 (Bekanntmachungsdatum)\n\nHamburg Amtsgericht Hamburg HRB 54990\nRegisterbekanntmachung nach dem Umwandlungsgesetz 28.05.2025 (Eintragungsdatum)\n\nBIO-LUTIONS GmbH\nGesellschaft mit beschränkter Haftung\nHamburg\n\nAls nicht eingetragen wird bekannt gemacht:\nDen Gläubigern der an der Verschmelzung beteiligten Gesellschaften ist, wenn sie binnen sechs Monaten nach dem Tag, an dem die Eintragung der Verschmelzung in das Register des Sitzes desjenigen Rechtsträgers, dessen Gläubiger sie sind, nach § 19 Absatz 3 UmwG als bekannt gemacht gilt, ihren Anspruch nach Grund und Höhe schriftlich anmelden, Sicherheit zu leisten, soweit sie nicht Befriedigung verlangen können. Dieses Recht steht den Gläubigern jedoch nur zu, wenn sie glaubhaft machen, dass durch die Verschmelzung die Erfüllung ihrer Forderung gefährdet wird."
    },
    {
      "date": "2025-05-28",
      "id": "110483",
      "original_text": "Registerbekanntmachung nach dem Umwandlungsgesetz\nBerlin Amtsgericht Berlin (Charlottenburg) HRA 38842\nThe G Dritte Immobilien GmbH & Co. KG – Berlin",
      "type": "Registerbekanntmachung nach dem Umwandlungsgesetz",
      "state": "Berlin",
      "amtsgericht": "Amtsgericht Berlin (Charlottenburg)",
      "registernummer": "HRA 38842",
      "registerart": "HRA",
      "company_name": "The G Dritte Immobilien GmbH & Co. KG",
      "company_seat": "Berlin",
      "details": "28.05.2025 (Bekanntmachungsdatum)\n\nBerlin Amtsgericht Berlin (Charlottenburg) HRA 38842\nRegisterbekanntmachung nach dem Umwandlungsgesetz 27.05.2025 (Eintragungsdatum)\n\nThe G Dritte Immobilien GmbH & Co. KG\nKommanditgesellschaft\nBerlin\n\nZu Eintragungsnummer 9 vom 27.05.2025 wird als nicht eingetragen veröffentlicht: Den Gläubigern ist, wenn sie binnen sechs Monaten nach dem Tag, an dem die Eintragung der Umwandlung als bekannt gemacht gilt, ihren Anspruch nach Grund und Höhe schriftlich anmelden, Sicherheit zu leisten, soweit sie nicht Befriedigung verlangen können. Dieses Recht steht den Gläubigern jedoch nur zu, wenn sie glaubhaft machen, dass durch die Umwandlung die Erfüllung ihrer Forderung gefährdet wird. Das Recht, Sicherheitsleistung zu verlangen, steht Gläubigern nicht zu, die im Falle der Insolvenz ein Recht auf vorzugsweise Befriedigung aus einer Deckungsmasse haben, die nach gesetzlicher Vorschrift zu ihrem Schutz errichtet und staatlich überwacht ist."
    },
    {
      "date": "2025-05-28",
      "id": "110484",
      "original_text": "Registerbekanntmachung nach dem Umwandlungsgesetz\nBaden-Württemberg Amtsgericht Ulm HRB 739611\nHandtmann BC Produktions-GmbH – Biberach an der Riß",
      "type": "Registerbekanntmachung nach dem Umwandlungsgesetz",
      "state": "Baden-Württemberg",
      "amtsgericht": "Amtsgericht Ulm",
      "registernummer": "HRB 739611",
      "registerart": "HRB",
      "company_name": "Handtmann BC Produktions-GmbH",
      "company_seat": "Biberach an der Riß",
      "details": "28.05.2025 (Bekanntmachungsdatum)\n\nBaden-Württemberg Amtsgericht Ulm HRB 739611\nRegisterbekanntmachung nach dem Umwandlungsgesetz 28.05.2025 (Eintragungsdatum)\n\nHandtmann BC Produktions-GmbH\nGesellschaft mit beschränkter Haftung\nBiberach an der Riß\n\nAls nicht eingetragen wird bekanntgemacht:\nDen Gläubigern der an der Verschmelzung beteiligten Rechtsträger ist, wenn sie binnen sechs Monaten nach dem Tag, an dem die Eintragung der Verschmelzung in das Register des Sitzes desjenigen Rechtsträgers, dessen Gläubiger sie sind, nach § 19 Abs. 3 UmwG als bekanntgemacht gilt, ihren Anspruch nach Grund und Höhe schriftlich anmelden, Sicherheit zu leisten, soweit sie nicht Befriedigung verlangen können. Dieses Recht steht den Gläubigern jedoch nur zu, wenn sie glaubhaft machen, dass durch die Verschmelzung die Erfüllung ihrer Forderung gefährdet wird."
    },
    {
      "date": "2025-05-28",
      "id": "110485",
      "original_text": "Registerbekanntmachung nach dem Umwandlungsgesetz\nBerlin Amtsgericht Berlin (Charlottenburg) HRB 275499\nThe G Dritte Immobilien GmbH – Berlin",
      "type": "Registerbekanntmachung nach dem Umwandlungsgesetz",
      "state": "Berlin",
      "amtsgericht": "Amtsgericht Berlin (Charlottenburg)",
      "registernummer": "HRB 275499",
      "registerart": "HRB",
      "company_name": "The G Dritte Immobilien GmbH",
      "company_seat": "Berlin",
      "details": "28.05.2025 (Bekanntmachungsdatum)\n\nBerlin Amtsgericht Berlin (Charlottenburg) HRB 275499\nRegisterbekanntmachung nach dem Umwandlungsgesetz 27.05.2025 (Eintragungsdatum)\n\nThe G Dritte Immobilien GmbH\nGesellschaft mit beschränkter Haftung\nBerlin\n\nZu Eintragungsnummer 1 vom 27.05.2025 wird als nicht eingetragen veröffentlicht: Den Gläubigern ist, wenn sie binnen sechs Monaten nach dem Tag, an dem die Eintragung der Umwandlung als bekannt gemacht gilt, ihren Anspruch nach Grund und Höhe schriftlich anmelden, Sicherheit zu leisten, soweit sie nicht Befriedigung verlangen können. Dieses Recht steht den Gläubigern jedoch nur zu, wenn sie glaubhaft machen, dass durch die Umwandlung die Erfüllung ihrer Forderung gefährdet wird. Das Recht, Sicherheitsleistung zu verlangen, steht Gläubigern nicht zu, die im Falle der Insolvenz ein Recht auf vorzugsweise Befriedigung aus einer Deckungsmasse haben, die nach gesetzlicher Vorschrift zu ihrem Schutz errichtet und staatlich überwacht ist."
    },
    {
      "date": "2025-05-28",
      "id": "110486",
      "original_text": "Registerbekanntmachung nach dem Umwandlungsgesetz\nBerlin Amtsgericht Berlin (Charlottenburg) HRB 199997\nPERIUM Bau und Baudienstleistungen GmbH – Berlin",
      "type": "Registerbekanntmachung nach dem Umwandlungsgesetz",
      "state": "Berlin",
      "amtsgericht": "Amtsgericht Berlin (Charlottenburg)",
      "registernummer": "HRB 199997",
      "registerart": "HRB",
      "company_name": "PERIUM Bau und Baudienstleistungen GmbH",
      "company_seat": "Berlin",
      "details": "28.05.2025 (Bekanntmachungsdatum)\n\nBerlin Amtsgericht Berlin (Charlottenburg) HRB 199997\nRegisterbekanntmachung nach dem Umwandlungsgesetz 27.05.2025 (Eintragungsdatum)\n\nPERIUM Bau und Baudienstleistungen GmbH\nGesellschaft mit beschränkter Haftung\nBerlin\n\nZu Eintragungsnummer 6 vom 27.05.2025 wird als nicht eingetragen veröffentlicht:Den Gläubigern der an der Verschmelzung beteiligten Rechtsträger ist, wenn sie binnen sechs Monaten nach dem Tag, an dem die Eintragung der Verschmelzung in das Register des Sitzes desjenigen Rechtsträgers, dessen Gläubiger sie sind, als bekannt gemacht gilt, ihren Anspruch nach Grund und Höhe schriftlich anmelden, Sicherheit zu leisten, soweit sie nicht Befriedigung verlangen können. Dieses Recht steht den Gläubigern jedoch nur zu, wenn sie glaubhaft machen, dass durch die Verschmelzung die Erfüllung ihrer Forderung gefährdet wird. Das Recht, Sicherheitsleistung zu verlangen, steht Gläubigern nicht zu, die im Falle der Insolvenz ein Recht auf vorzugsweise Befriedigung aus einer Deckungsmasse haben, die nach gesetzlicher Vorschrift zu ihrem Schutz errichtet und staatlich überwacht ist."
    },
    {
      "date": "2025-05-28",
      "id": "110487",
      "original_text": "Registerbekanntmachung nach dem Umwandlungsgesetz\nBerlin Amtsgericht Berlin (Charlottenburg) HRB 145174\nBoulevard Facility Services GmbH – Berlin",
      "type": "Registerbekanntmachung nach dem Umwandlungsgesetz",
      "state": "Berlin",
      "amtsgericht": "Amtsgericht Berlin (Charlottenburg)",
      "registernummer": "HRB 145174",
      "registerart": "HRB",
      "company_name": "Boulevard Facility Services GmbH",
      "company_seat": "Berlin",
      "details": "28.05.2025 (Bekanntmachungsdatum)\n\nBerlin Amtsgericht Berlin (Charlottenburg) HRB 145174\nRegisterbekanntmachung nach dem Umwandlungsgesetz 27.05.2025 (Eintragungsdatum)\n\nBoulevard Facility Services GmbH\nGesellschaft mit beschränkter Haftung\nBerlin\n\nZu Eintragungsnummer 8 vom 27.05.2025 wird als nicht eingetragen veröffentlicht:Den Gläubigern der an der Verschmelzung beteiligten Rechtsträger ist, wenn sie binnen sechs Monaten nach dem Tag, an dem die Eintragung der Verschmelzung in das Register des Sitzes desjenigen Rechtsträgers, dessen Gläubiger sie sind, als bekannt gemacht gilt, ihren Anspruch nach Grund und Höhe schriftlich anmelden, Sicherheit zu leisten, soweit sie nicht Befriedigung verlangen können. Dieses Recht steht den Gläubigern jedoch nur zu, wenn sie glaubhaft machen, dass durch die Verschmelzung die Erfüllung ihrer Forderung gefährdet wird. Das Recht, Sicherheitsleistung zu verlangen, steht Gläubigern nicht zu, die im Falle der Insolvenz ein Recht auf vorzugsweise Befriedigung aus einer Deckungsmasse haben, die nach gesetzlicher Vorschrift zu ihrem Schutz errichtet und staatlich überwacht ist."
    },
    {
      "date": "2025-05-28",
      "id": "110488",
      "original_text": "Registerbekanntmachung nach dem Umwandlungsgesetz\nBerlin Amtsgericht Berlin (Charlottenburg) HRA 34324\nGutman Holding GmbH & Co. KG – Berlin",
      "type": "Registerbekanntmachung nach dem Umwandlungsgesetz",
      "state": "Berlin",
      "amtsgericht": "Amtsgericht Berlin (Charlottenburg)",
      "registernummer": "HRA 34324",
      "registerart": "HRA",
      "company_name": "Gutman Holding GmbH & Co. KG",
      "company_seat": "Berlin",
      "details": "28.05.2025 (Bekanntmachungsdatum)\n\nBerlin Amtsgericht Berlin (Charlottenburg) HRA 34324\nRegisterbekanntmachung nach dem Umwandlungsgesetz 27.05.2025 (Eintragungsdatum)\n\nGutman Holding GmbH & Co. KG\nKommanditgesellschaft\nBerlin\n\nZu Eintragungsnummer 7 vom 27.05.2025 wird als nicht eingetragen veröffentlicht: Den Gläubigern ist, wenn sie binnen sechs Monaten nach dem Tag, an dem die Eintragung der Umwandlung als bekannt gemacht gilt, ihren Anspruch nach Grund und Höhe schriftlich anmelden, Sicherheit zu leisten, soweit sie nicht Befriedigung verlangen können. Dieses Recht steht den Gläubigern jedoch nur zu, wenn sie glaubhaft machen, dass durch die Umwandlung die Erfüllung ihrer Forderung gefährdet wird. Das Recht, Sicherheitsleistung zu verlangen, steht Gläubigern nicht zu, die im Falle der Insolvenz ein Recht auf vorzugsweise Befriedigung aus einer Deckungsmasse haben, die nach gesetzlicher Vorschrift zu ihrem Schutz errichtet und staatlich überwacht ist."
    },
    {
      "date": "2025-05-28",
      "id": "110489",
      "original_text": "Registerbekanntmachung nach dem Umwandlungsgesetz\nBerlin Amtsgericht Berlin (Charlottenburg) HRB 275527\nGutman Holding GmbH – Berlin",
      "type": "Registerbekanntmachung nach dem Umwandlungsgesetz",
      "state": "Berlin",
      "amtsgericht": "Amtsgericht Berlin (Charlottenburg)",
      "registernummer": "HRB 275527",
      "registerart": "HRB",
      "company_name": "Gutman Holding GmbH",
      "company_seat": "Berlin",
      "details": "28.05.2025 (Bekanntmachungsdatum)\n\nBerlin Amtsgericht Berlin (Charlottenburg) HRB 275527\nRegisterbekanntmachung nach dem Umwandlungsgesetz 27.05.2025 (Eintragungsdatum)\n\nGutman Holding GmbH\nGesellschaft mit beschränkter Haftung\nBerlin\n\nZu Eintragungsnummer 1 vom 27.05.2025 wird als nicht eingetragen veröffentlicht:Den Gläubigern ist, wenn sie binnen sechs Monaten nach dem Tag, an dem die Eintragung der Umwandlung als bekannt gemacht gilt, ihren Anspruch nach Grund und Höhe schriftlich anmelden, Sicherheit zu leisten, soweit sie nicht Befriedigung verlangen können. Dieses Recht steht den Gläubigern jedoch nur zu, wenn sie glaubhaft machen, dass durch die Umwandlung die Erfüllung ihrer Forderung gefährdet wird. Das Recht, Sicherheitsleistung zu verlangen, steht Gläubigern nicht zu, die im Falle der Insolvenz ein Recht auf vorzugsweise Befriedigung aus einer Deckungsmasse haben, die nach gesetzlicher Vorschrift zu ihrem Schutz errichtet und staatlich überwacht ist."
    },
    {
      "date": "2025-05-28",
      "id": "110490",
      "original_text": "Registerbekanntmachung nach dem Umwandlungsgesetz\nBaden-Württemberg Amtsgericht Freiburg HRB 707978\nFrancis Trading GmbH – Emmendingen",
      "type": "Registerbekanntmachung nach dem Umwandlungsgesetz",
      "state": "Baden-Württemberg",
      "amtsgericht": "Amtsgericht Freiburg",
      "registernummer": "HRB 707978",
      "registerart": "HRB",
      "company_name": "Francis Trading GmbH",
      "company_seat": "Emmendingen",
      "details": "28.05.2025 (Bekanntmachungsdatum)\n\nBaden-Württemberg Amtsgericht Freiburg HRB 707978\nRegisterbekanntmachung nach dem Umwandlungsgesetz 28.05.2025 (Eintragungsdatum)\n\nFrancis Trading GmbH\nGesellschaft mit beschränkter Haftung\nEmmendingen\n\nDen Gläubigern der an der Verschmelzung beteiligten Rechtsträger ist, wenn sie binnen sechs Monaten nach dem Tag, an dem die Eintragung der Verschmelzung in das Register des Sitzes desjenigen Rechtsträgers, dessen Gläubiger sie sind, nach § 19 Absatz 3 UmwG als bekanntgemacht gilt, ihren Anspruch nach Grund und Höhe schriftlich anmelden, Sicherheit zu leisten, soweit sie nicht Befriedigung verlangen können. Dieses Recht steht den Gläubigern jedoch nur zu, wenn sie glaubhaft machen, dass durch die Verschmelzung die Erfüllung ihrer Forderung gefährdet wird."
    },
    {
      "date": "2025-05-28",
      "id": "110491",
      "original_text": "Löschungsankündigung\nMecklenburg-Vorpommern Amtsgericht Rostock HRB 11582\nFastFWD Business Limited – Rostock",
      "type": "Löschungsankündigung",
      "state": "Mecklenburg-Vorpommern",
      "amtsgericht": "Amtsgericht Rostock",
      "registernummer": "HRB 11582",
      "registerart": "HRB",
      "company_name": "FastFWD Business Limited",
      "company_seat": "Rostock",
      "details": "28.05.2025 (Bekanntmachungsdatum)\n\nMecklenburg-Vorpommern Amtsgericht Rostock HRB 11582\nLöschungsankündigung\n\nFastFWD Business Limited\nRechtsform ausländischen Rechts HRB\nRostock\n\nDas Registergericht beabsichtigt, die im Handelsregister eingetragene Gesellschaft von Amts wegen nach § 394 FamFG zu löschen. Die Frist zur Erhebung eines Widerspruchs gegen die beabsichtigte Löschung wird auf 1 Monat festgesetzt."
    },
    {
      "date": "2025-05-28",
      "id": "110492",
      "original_text": "Sonstige Registerbekanntmachung\nSchleswig-Holstein Amtsgericht Kiel HRB 9545\nSCOPE Engineering GmbH – Kiel",
      "type": "Sonstige Registerbekanntmachung",
      "state": "Schleswig-Holstein",
      "amtsgericht": "Amtsgericht Kiel",
      "registernummer": "HRB 9545",
      "registerart": "HRB",
      "company_name": "SCOPE Engineering GmbH",
      "company_seat": "Kiel",
      "details": "28.05.2025 (Bekanntmachungsdatum)\n\nSchleswig-Holstein Amtsgericht Kiel HRB 9545\nSonstige Registerbekanntmachung 27.05.2025 (Eintragungsdatum)\n\nSCOPE Engineering GmbH\nGesellschaft mit beschränkter Haftung\nKiel\n\nAls nicht eingetragen wird veröffentlicht: Den Gläubigern der Gesellschaft, deren Forderungen begründet worden sind, bevor die Eintragung der Beendigung des Vertrages in das Handelsregister nach § 10 HGB bekannt gemacht worden ist, ist vom anderen Vertragspartner Sicherheit zu leisten, wenn sie sich binnen sechs Monaten nach Bekanntmachung der Eintragung zu diesem Zweck bei ihm melden."
    },
    {
      "date": "2025-05-28",
      "id": "110493",
      "original_text": "Registerbekanntmachung nach dem Umwandlungsgesetz\nBaden-Württemberg Amtsgericht Stuttgart HRB 750476\nUntis Baden-Württemberg GmbH – Gerlingen",
      "type": "Registerbekanntmachung nach dem Umwandlungsgesetz",
      "state": "Baden-Württemberg",
      "amtsgericht": "Amtsgericht Stuttgart",
      "registernummer": "HRB 750476",
      "registerart": "HRB",
      "company_name": "Untis Baden-Württemberg GmbH",
      "company_seat": "Gerlingen",
      "details": "28.05.2025 (Bekanntmachungsdatum)\n\nBaden-Württemberg Amtsgericht Stuttgart HRB 750476\nRegisterbekanntmachung nach dem Umwandlungsgesetz 28.05.2025 (Eintragungsdatum)\n\nUntis Baden-Württemberg GmbH\nGesellschaft mit beschränkter Haftung\nGerlingen\n\nDie Gesellschaft hat am 27.05.2025 den Entwurf des Verschmelzungsvertrages zwischen der \"Untis Baden-Württemberg GmbH \", Gerlingen (Amtsgericht Stuttgart, HRB 750476) (übertragender Rechtsträger) und der \"Untis GmbH\", Stockerau, Österreich (Firmenbuch des Landesgerichts Korneuburg, FN 437283 p) (übernehmender Rechtsträger) zum Handelsregister eingereicht. An der grenzüberschreitenden Verschmelzung sind beteiligt: - Untis Baden-Württemberg GmbH, eine Gesellschaft mit beschränkter Haftung deutschen Rechts mit Sitz in Gerlingen (inländische Geschäftsanschrift: Benzstraße 8, 70839 Gerlingen, Deutschland), als übertragende Gesellschaft; - Untis GmbH, eine Gesellschaft mit beschränkter Haftung österreichischen Rechts mit Sitz in Stockerau (inländische Geschäftsanschrift: Belvederegasse 11, 2000 Stockerau, Österreich), als übernehmende Gesellschaft. Die Untis Baden-Württemberg GmbH ist eingetragen im Handelsregister des Amtsgerichts Stuttgart unter HRB 750476. Die Untis GmbH ist eingetragen im Firmenbuch des Landesgerichts Korneuburg unter FN 437283 p. Die Anteilsinhaber und Gläubiger der an der grenzüberschreitenden Verschmelzung beteiligten Gesellschaften sowie die zuständigen Betriebsräte der an der grenzüberschreitenden Verschmelzung beteiligten Gesellschaften oder, soweit es keinen Betriebsrat gibt, die Arbeitnehmer der an der grenzüberschreitenden Verschmelzung beteiligten Gesellschaften werden darauf hingewiesen, dass sie der jeweiligen Gesellschaft spätestens fünf Arbeitstage vor dem Tag, an dem der Verschmelzungsplan beurkundet wird, Bemerkungen zum Verschmelzungsplan übermitteln können. Der Verschmelzungsplan wird am 12. August 2025 beurkundet."
    },
    {
      "date": "2025-05-28",
      "id": "110494",
      "original_text": "Registerbekanntmachung nach dem Umwandlungsgesetz\nBerlin Amtsgericht Berlin (Charlottenburg) HRA 63215\nNeXtWind Windpark Beteiligung 30 GmbH & Co. KG – Berlin",
      "type": "Registerbekanntmachung nach dem Umwandlungsgesetz",
      "state": "Berlin",
      "amtsgericht": "Amtsgericht Berlin (Charlottenburg)",
      "registernummer": "HRA 63215",
      "registerart": "HRA",
      "company_name": "NeXtWind Windpark Beteiligung 30 GmbH & Co. KG",
      "company_seat": "Berlin",
      "details": "28.05.2025 (Bekanntmachungsdatum)\n\nBerlin Amtsgericht Berlin (Charlottenburg) HRA 63215\nRegisterbekanntmachung nach dem Umwandlungsgesetz 27.05.2025 (Eintragungsdatum)\n\nNeXtWind Windpark Beteiligung 30 GmbH & Co. KG\nKommanditgesellschaft\nBerlin\n\nZu Eintragungsnummer 4 vom 27.05.2025 wird als nicht eingetragen veröffentlicht: Den Gläubigern der an der Spaltung beteiligten Rechtsträger ist, wenn sie binnen sechs Monaten nach dem Tag, an dem die Eintragung der Spaltung in das Register des Sitzes desjenigen Rechtsträgers, dessen Gläubiger sie sind, als bekannt gemacht gilt, ihren Anspruch nach Grund und Höhe schriftlich anmelden, Sicherheit zu leisten, soweit sie nicht Befriedigung verlangen können. Dieses Recht steht den Gläubigern jedoch nur zu, wenn sie glaubhaft machen, dass durch die Spaltung die Erfüllung ihrer Forderung gefährdet wird. Das Recht, Sicherheitsleistung zu verlangen, steht Gläubigern nicht zu, die im Falle der Insolvenz ein Recht auf vorzugsweise Befriedigung aus einer Deckungsmasse haben, die nach gesetzlicher Vorschrift zu ihrem Schutz errichtet und staatlich überwacht ist."
    },
    {
      "date": "2025-05-28",
      "id": "110495",
      "original_text": "Einreichung neuer Dokumente\nBerlin Amtsgericht Berlin (Charlottenburg) HRB 39635\nBavariaDirekt Versicherung AG – Berlin",
      "type": "Einreichung neuer Dokumente",
      "state": "Berlin",
      "amtsgericht": "Amtsgericht Berlin (Charlottenburg)",
      "registernummer": "HRB 39635",
      "registerart": "HRB",
      "company_name": "BavariaDirekt Versicherung AG",
      "company_seat": "Berlin",
      "details": "28.05.2025 (Bekanntmachungsdatum)\n\nBerlin Amtsgericht Berlin (Charlottenburg) HRB 39635\nEinreichung neuer Dokumente\n\nBavariaDirekt Versicherung AG\nAktiengesellschaft\nBerlin\n\nAls nicht eingetragen wird veröffentlicht: Es wurde eine neue Liste der Aufsichtsratsmitglieder eingereicht (§ 106 AktG)."
    },
    {
      "date": "2025-05-28",
      "id": "110496",
      "original_text": "Registerbekanntmachung nach dem Umwandlungsgesetz\nBerlin Amtsgericht Berlin (Charlottenburg) HRA 58350\nNeXtWind Windpark Beteiligung IV GmbH & Co. KG – Berlin",
      "type": "Registerbekanntmachung nach dem Umwandlungsgesetz",
      "state": "Berlin",
      "amtsgericht": "Amtsgericht Berlin (Charlottenburg)",
      "registernummer": "HRA 58350",
      "registerart": "HRA",
      "company_name": "NeXtWind Windpark Beteiligung IV GmbH & Co. KG",
      "company_seat": "Berlin",
      "details": "28.05.2025 (Bekanntmachungsdatum)\n\nBerlin Amtsgericht Berlin (Charlottenburg) HRA 58350\nRegisterbekanntmachung nach dem Umwandlungsgesetz 27.05.2025 (Eintragungsdatum)\n\nNeXtWind Windpark Beteiligung IV GmbH & Co. KG\nKommanditgesellschaft\nBerlin\n\nZu Eintragungsnummer 4 vom 27.05.2025 wird als nicht eingetragen veröffentlicht: Den Gläubigern der an der Spaltung beteiligten Rechtsträger ist, wenn sie binnen sechs Monaten nach dem Tag, an dem die Eintragung der Spaltung in das Register des Sitzes desjenigen Rechtsträgers, dessen Gläubiger sie sind, als bekannt gemacht gilt, ihren Anspruch nach Grund und Höhe schriftlich anmelden, Sicherheit zu leisten, soweit sie nicht Befriedigung verlangen können. Dieses Recht steht den Gläubigern jedoch nur zu, wenn sie glaubhaft machen, dass durch die Spaltung die Erfüllung ihrer Forderung gefährdet wird. Das Recht, Sicherheitsleistung zu verlangen, steht Gläubigern nicht zu, die im Falle der Insolvenz ein Recht auf vorzugsweise Befriedigung aus einer Deckungsmasse haben, die nach gesetzlicher Vorschrift zu ihrem Schutz errichtet und staatlich überwacht ist."
    },
    {
      "date": "2025-05-28",
      "id": "110497",
      "original_text": "Löschungsankündigung\nMecklenburg-Vorpommern Amtsgericht Rostock HRB 14888\nGSD Güter-Schnell-Dienst GmbH – Rostock",
      "type": "Löschungsankündigung",
      "state": "Mecklenburg-Vorpommern",
      "amtsgericht": "Amtsgericht Rostock",
      "registernummer": "HRB 14888",
      "registerart": "HRB",
      "company_name": "GSD Güter-Schnell-Dienst GmbH",
      "company_seat": "Rostock",
      "details": "28.05.2025 (Bekanntmachungsdatum)\n\nMecklenburg-Vorpommern Amtsgericht Rostock HRB 14888\nLöschungsankündigung\n\nGSD Güter-Schnell-Dienst GmbH\nGesellschaft mit beschränkter Haftung\nRostock\n\nDas Registergericht beabsichtigt, die im Handelsregister eingetragene Gesellschaft von Amts wegen nach § 394 FamFG zu löschen. Die Frist zur Erhebung eines Widerspruchs gegen die beabsichtigte Löschung wird auf 1 Monat festgesetzt."
    },
    {
      "date": "2025-05-28",
      "id": "110498",
      "original_text": "Sonstige Registerbekanntmachung\nBerlin Amtsgericht Berlin (Charlottenburg) HRB 182766\nR/GA Media Group GmbH – Berlin",
      "type": "Sonstige Registerbekanntmachung",
      "state": "Berlin",
      "amtsgericht": "Amtsgericht Berlin (Charlottenburg)",
      "registernummer": "HRB 182766",
      "registerart": "HRB",
      "company_name": "R/GA Media Group GmbH",
      "company_seat": "Berlin",
      "details": "28.05.2025 (Bekanntmachungsdatum)\n\nBerlin Amtsgericht Berlin (Charlottenburg) HRB 182766\nSonstige Registerbekanntmachung\n\nR/GA Media Group GmbH\nGesellschaft mit beschränkter Haftung\nBerlin\n\nAls nicht eingetragen wird veröffentlicht:Der andere Vertragsteil hat den Gläubigern dieses Rechtsträgers, deren Forderungen begründet worden sind, bevor die Eintragung der Beendigung dieses Vertrages in das Handelsregister nach § 10 des Handelsgesetzbuches als bekannt gemacht gilt, Sicherheit zu leisten, wenn sie sich binnen sechs Monaten nach der Bekanntmachung der Eintragung zu diesem Zweck bei ihm melden. Dieses Recht steht den Gläubigern nicht zu, die im Fall des Insolvenzverfahrens ein Recht auf vorzugsweise Befriedigung aus der Deckungsmasse haben, die nach gesetzlicher Vorschrift zu ihrem Schutz errichtet und staatlich überwacht ist."
    },
    {
      "date": "2025-05-28",
      "id": "110499",
      "original_text": "Löschungsankündigung\nBrandenburg Amtsgericht Potsdam HRB 38316\nEB Wünsdorfer Sicherheitsdienst und Service UG (haftungsbeschränkt) – Zossen",
      "type": "Löschungsankündigung",
      "state": "Brandenburg",
      "amtsgericht": "Amtsgericht Potsdam",
      "registernummer": "HRB 38316",
      "registerart": "HRB",
      "company_name": "EB Wünsdorfer Sicherheitsdienst und Service UG (haftungsbeschränkt)",
      "company_seat": "Zossen",
      "details": "28.05.2025 (Bekanntmachungsdatum)\n\nBrandenburg Amtsgericht Potsdam HRB 38316\nLöschungsankündigung\n\nEB Wünsdorfer Sicherheitsdienst und Service UG (haftungsbeschränkt)\nGesellschaft mit beschränkter Haftung\nZossen\n\nBei der nachstehenden Gesellschaft wird das Amtslöschungsverfahren gemäß § 394 FamFG eingeleitet. Widerspruchsfrist: 8 Wochen."
    },
    {
      "date": "2025-05-28",
      "id": "110500",
      "original_text": "Registerbekanntmachung nach dem Umwandlungsgesetz\nBerlin Amtsgericht Berlin (Charlottenburg) HRB 269246\nMektec Europe GmbH – Berlin",
      "type": "Registerbekanntmachung nach dem Umwandlungsgesetz",
      "state": "Berlin",
      "amtsgericht": "Amtsgericht Berlin (Charlottenburg)",
      "registernummer": "HRB 269246",
      "registerart": "HRB",
      "company_name": "Mektec Europe GmbH",
      "company_seat": "Berlin",
      "details": "28.05.2025 (Bekanntmachungsdatum)\n\nBerlin Amtsgericht Berlin (Charlottenburg) HRB 269246\nRegisterbekanntmachung nach dem Umwandlungsgesetz 28.05.2025 (Eintragungsdatum)\n\nMektec Europe GmbH\nGesellschaft mit beschränkter Haftung\nBerlin\n\nZu Eintragungsnummer 5 vom 28.05.2025 wird als nicht eingetragen veröffentlicht:Den Gläubigern der an der Verschmelzung beteiligten Rechtsträger ist, wenn sie binnen sechs Monaten nach dem Tag, an dem die Eintragung der Verschmelzung in das Register des Sitzes desjenigen Rechtsträgers, dessen Gläubiger sie sind, als bekannt gemacht gilt, ihren Anspruch nach Grund und Höhe schriftlich anmelden, Sicherheit zu leisten, soweit sie nicht Befriedigung verlangen können. Dieses Recht steht den Gläubigern jedoch nur zu, wenn sie glaubhaft machen, dass durch die Verschmelzung die Erfüllung ihrer Forderung gefährdet wird. Das Recht, Sicherheitsleistung zu verlangen, steht Gläubigern nicht zu, die im Falle der Insolvenz ein Recht auf vorzugsweise Befriedigung aus einer Deckungsmasse haben, die nach gesetzlicher Vorschrift zu ihrem Schutz errichtet und staatlich überwacht ist."
    },
    {
      "date": "2025-05-28",
      "id": "110501",
      "original_text": "Registerbekanntmachung nach dem Umwandlungsgesetz\nBerlin Amtsgericht Berlin (Charlottenburg) HRA 58319\nNeXtWind Windpark Beteiligung V GmbH & Co. KG – Berlin",
      "type": "Registerbekanntmachung nach dem Umwandlungsgesetz",
      "state": "Berlin",
      "amtsgericht": "Amtsgericht Berlin (Charlottenburg)",
      "registernummer": "HRA 58319",
      "registerart": "HRA",
      "company_name": "NeXtWind Windpark Beteiligung V GmbH & Co. KG",
      "company_seat": "Berlin",
      "details": "28.05.2025 (Bekanntmachungsdatum)\n\nBerlin Amtsgericht Berlin (Charlottenburg) HRA 58319\nRegisterbekanntmachung nach dem Umwandlungsgesetz 27.05.2025 (Eintragungsdatum)\n\nNeXtWind Windpark Beteiligung V GmbH & Co. KG\nKommanditgesellschaft\nBerlin\n\nZu Eintragungsnummer 3 vom 27.05.2025 wird als nicht eingetragen veröffentlicht: Den Gläubigern der an der Spaltung beteiligten Rechtsträger ist, wenn sie binnen sechs Monaten nach dem Tag, an dem die Eintragung der Spaltung in das Register des Sitzes desjenigen Rechtsträgers, dessen Gläubiger sie sind, als bekannt gemacht gilt, ihren Anspruch nach Grund und Höhe schriftlich anmelden, Sicherheit zu leisten, soweit sie nicht Befriedigung verlangen können. Dieses Recht steht den Gläubigern jedoch nur zu, wenn sie glaubhaft machen, dass durch die Spaltung die Erfüllung ihrer Forderung gefährdet wird. Das Recht, Sicherheitsleistung zu verlangen, steht Gläubigern nicht zu, die im Falle der Insolvenz ein Recht auf vorzugsweise Befriedigung aus einer Deckungsmasse haben, die nach gesetzlicher Vorschrift zu ihrem Schutz errichtet und staatlich überwacht ist."
    },
    {
      "date": "2025-05-28",
      "id": "110502",
      "original_text": "Registerbekanntmachung nach dem Umwandlungsgesetz\nBerlin Amtsgericht Berlin (Charlottenburg) HRA 61767\nNeXtWind Windpark Beteiligung 31 GmbH & Co. KG – Berlin",
      "type": "Registerbekanntmachung nach dem Umwandlungsgesetz",
      "state": "Berlin",
      "amtsgericht": "Amtsgericht Berlin (Charlottenburg)",
      "registernummer": "HRA 61767",
      "registerart": "HRA",
      "company_name": "NeXtWind Windpark Beteiligung 31 GmbH & Co. KG",
      "company_seat": "Berlin",
      "details": "28.05.2025 (Bekanntmachungsdatum)\n\nBerlin Amtsgericht Berlin (Charlottenburg) HRA 61767\nRegisterbekanntmachung nach dem Umwandlungsgesetz 27.05.2025 (Eintragungsdatum)\n\nNeXtWind Windpark Beteiligung 31 GmbH & Co. KG\nKommanditgesellschaft\nBerlin\n\nZu Eintragungsnummer 3 vom 27.05.2025 wird als nicht eingetragen veröffentlicht: Den Gläubigern der an der Spaltung beteiligten Rechtsträger ist, wenn sie binnen sechs Monaten nach dem Tag, an dem die Eintragung der Spaltung in das Register des Sitzes desjenigen Rechtsträgers, dessen Gläubiger sie sind, als bekannt gemacht gilt, ihren Anspruch nach Grund und Höhe schriftlich anmelden, Sicherheit zu leisten, soweit sie nicht Befriedigung verlangen können. Dieses Recht steht den Gläubigern jedoch nur zu, wenn sie glaubhaft machen, dass durch die Spaltung die Erfüllung ihrer Forderung gefährdet wird. Das Recht, Sicherheitsleistung zu verlangen, steht Gläubigern nicht zu, die im Falle der Insolvenz ein Recht auf vorzugsweise Befriedigung aus einer Deckungsmasse haben, die nach gesetzlicher Vorschrift zu ihrem Schutz errichtet und staatlich überwacht ist."
    },
    {
      "date": "2025-05-28",
      "id": "110503",
      "original_text": "Registerbekanntmachung nach dem Umwandlungsgesetz\nBrandenburg Amtsgericht Potsdam HRB 32056\nBMU Betreuungszentrum GmbH – Wiesenburg/Mark",
      "type": "Registerbekanntmachung nach dem Umwandlungsgesetz",
      "state": "Brandenburg",
      "amtsgericht": "Amtsgericht Potsdam",
      "registernummer": "HRB 32056",
      "registerart": "HRB",
      "company_name": "BMU Betreuungszentrum GmbH",
      "company_seat": "Wiesenburg/Mark",
      "details": "28.05.2025 (Bekanntmachungsdatum)\n\nBrandenburg Amtsgericht Potsdam HRB 32056\nRegisterbekanntmachung nach dem Umwandlungsgesetz 26.05.2025 (Eintragungsdatum)\n\nBMU Betreuungszentrum GmbH\nGesellschaft mit beschränkter Haftung\nWiesenburg/Mark\n\nZu Eintragungsnummer 2 vom 26.05.2025 wird als nicht eingetragen veröffentlicht:\nDen Gläubigern der an der Verschmelzung beteiligten Rechtsträger ist, wenn sie binnen sechs Monaten nach dem Tag, an dem die Eintragung der Verschmelzung in das Register des Sitzes desjenigen Rechtsträgers, dessen Gläubiger sie sind, als bekannt gemacht gilt, ihren Anspruch nach Grund und Höhe schriftlich anmelden, Sicherheit zu leisten, soweit sie nicht Befriedigung verlangen können. Dieses Recht steht den Gläubigern jedoch nur zu, wenn sie glaubhaft machen, dass durch die Verschmelzung die Erfüllung ihrer Forderung gefährdet wird."
    },
    {
      "date": "2025-05-28",
      "id": "110504",
      "original_text": "Löschungsankündigung\nBerlin Amtsgericht Berlin (Charlottenburg) HRB 194245\nH.E.Y.U. Holding Berlin GmbH – Berlin",
      "type": "Löschungsankündigung",
      "state": "Berlin",
      "amtsgericht": "Amtsgericht Berlin (Charlottenburg)",
      "registernummer": "HRB 194245",
      "registerart": "HRB",
      "company_name": "H.E.Y.U. Holding Berlin GmbH",
      "company_seat": "Berlin",
      "details": "28.05.2025 (Bekanntmachungsdatum)\n\nBerlin Amtsgericht Berlin (Charlottenburg) HRB 194245\nLöschungsankündigung\n\nH.E.Y.U. Holding Berlin GmbH\nGesellschaft mit beschränkter Haftung\nBerlin\n\nBei der nachstehenden Gesellschaft wird das Amtslöschungsverfahren gemäß § 394 FamFG eingeleitet. Widerspruchsfrist 6 Wochen"
    },
    {
      "date": "2025-05-28",
      "id": "110505",
      "original_text": "Registerbekanntmachung nach dem Umwandlungsgesetz\nHamburg Amtsgericht Hamburg HRB 83082\nSCHOLZ & FRIENDS Trademarks GmbH – Hamburg",
      "type": "Registerbekanntmachung nach dem Umwandlungsgesetz",
      "state": "Hamburg",
      "amtsgericht": "Amtsgericht Hamburg",
      "registernummer": "HRB 83082",
      "registerart": "HRB",
      "company_name": "SCHOLZ & FRIENDS Trademarks GmbH",
      "company_seat": "Hamburg",
      "details": "28.05.2025 (Bekanntmachungsdatum)\n\nHamburg Amtsgericht Hamburg HRB 83082\nRegisterbekanntmachung nach dem Umwandlungsgesetz 28.05.2025 (Eintragungsdatum)\n\nSCHOLZ & FRIENDS Trademarks GmbH\nGesellschaft mit beschränkter Haftung\nHamburg\n\nAls nicht eingetragen wird bekannt gemacht:\nDen Gläubigern der an der Verschmelzung beteiligten Gesellschaften ist, wenn sie binnen sechs Monaten nach dem Tag, an dem die Eintragung der Verschmelzung in das Register des Sitzes desjenigen Rechtsträgers, dessen Gläubiger sie sind, nach § 19 Absatz 3 UmwG als bekannt gemacht gilt, ihren Anspruch nach Grund und Höhe schriftlich anmelden, Sicherheit zu leisten, soweit sie nicht Befriedigung verlangen können. Dieses Recht steht den Gläubigern jedoch nur zu, wenn sie glaubhaft machen, dass durch die Verschmelzung die Erfüllung ihrer Forderung gefährdet wird."
    },
    {
      "date": "2025-05-28",
      "id": "110506",
      "original_text": "Registerbekanntmachung nach dem Umwandlungsgesetz\nBerlin Amtsgericht Berlin (Charlottenburg) HRA 58470\nNeXtWind Windpark Beteiligung VII GmbH & Co. KG – Berlin",
      "type": "Registerbekanntmachung nach dem Umwandlungsgesetz",
      "state": "Berlin",
      "amtsgericht": "Amtsgericht Berlin (Charlottenburg)",
      "registernummer": "HRA 58470",
      "registerart": "HRA",
      "company_name": "NeXtWind Windpark Beteiligung VII GmbH & Co. KG",
      "company_seat": "Berlin",
      "details": "28.05.2025 (Bekanntmachungsdatum)\n\nBerlin Amtsgericht Berlin (Charlottenburg) HRA 58470\nRegisterbekanntmachung nach dem Umwandlungsgesetz 28.05.2025 (Eintragungsdatum)\n\nNeXtWind Windpark Beteiligung VII GmbH & Co. KG\nKommanditgesellschaft\nBerlin\n\nZu Eintragungsnummer 3 vom 28.05.2025 wird als nicht eingetragen veröffentlicht: Den Gläubigern der an der Spaltung beteiligten Rechtsträger ist, wenn sie binnen sechs Monaten nach dem Tag, an dem die Eintragung der Spaltung in das Register des Sitzes desjenigen Rechtsträgers, dessen Gläubiger sie sind, als bekannt gemacht gilt, ihren Anspruch nach Grund und Höhe schriftlich anmelden, Sicherheit zu leisten, soweit sie nicht Befriedigung verlangen können. Dieses Recht steht den Gläubigern jedoch nur zu, wenn sie glaubhaft machen, dass durch die Spaltung die Erfüllung ihrer Forderung gefährdet wird. Das Recht, Sicherheitsleistung zu verlangen, steht Gläubigern nicht zu, die im Falle der Insolvenz ein Recht auf vorzugsweise Befriedigung aus einer Deckungsmasse haben, die nach gesetzlicher Vorschrift zu ihrem Schutz errichtet und staatlich überwacht ist."
    },
    {
      "date": "2025-05-28",
      "id": "110507",
      "original_text": "Registerbekanntmachung nach dem Umwandlungsgesetz\nSchleswig-Holstein Amtsgericht Kiel HRA 12689\nGuido Sandberg Futtermittelrohstoffhandel e.K. – Nützen",
      "type": "Registerbekanntmachung nach dem Umwandlungsgesetz",
      "state": "Schleswig-Holstein",
      "amtsgericht": "Amtsgericht Kiel",
      "registernummer": "HRA 12689",
      "registerart": "HRA",
      "company_name": "Guido Sandberg Futtermittelrohstoffhandel e.K.",
      "company_seat": "Nützen",
      "details": "28.05.2025 (Bekanntmachungsdatum)\n\nSchleswig-Holstein Amtsgericht Kiel HRA 12689\nRegisterbekanntmachung nach dem Umwandlungsgesetz 27.05.2025 (Eintragungsdatum)\n\nGuido Sandberg Futtermittelrohstoffhandel e.K.\nEinzelkaufmann / Einzelkauffrau\nNützen\n\nAls nicht eingetragen wird veröffentlicht: Den Gläubigern der an der Verschmelzung beteiligten Rechtsträger ist, wenn sie binnen sechs Monaten nach dem Tag, an dem die Eintragung der Verschmelzung in das Register des Sitzes desjenigen Rechtsträgers, dessen Gläubiger sie sind, nach § 19 Abs. 3 UmwG bekannt gemacht worden ist, ihren Anspruch nach Grund und Höhe schriftlich anmelden, Sicherheit zu leisten, soweit sie nicht Befriedigung verlangen können. Dieses Recht steht den Gläubigern jedoch nur zu, wenn sie glaubhaft machen, dass durch die Verschmelzung die Erfüllung ihrer Forderung gefährdet wird."
    },
    {
      "date": "2025-05-28",
      "id": "110508",
      "original_text": "Registerbekanntmachung nach dem Umwandlungsgesetz\nBerlin Amtsgericht Berlin (Charlottenburg) HRB 228220\nMondarella GmbH – Berlin",
      "type": "Registerbekanntmachung nach dem Umwandlungsgesetz",
      "state": "Berlin",
      "amtsgericht": "Amtsgericht Berlin (Charlottenburg)",
      "registernummer": "HRB 228220",
      "registerart": "HRB",
      "company_name": "Mondarella GmbH",
      "company_seat": "Berlin",
      "details": "28.05.2025 (Bekanntmachungsdatum)\n\nBerlin Amtsgericht Berlin (Charlottenburg) HRB 228220\nRegisterbekanntmachung nach dem Umwandlungsgesetz 27.05.2025 (Eintragungsdatum)\n\nMondarella GmbH\nGesellschaft mit beschränkter Haftung\nBerlin\n\nZu Eintragungsnummer 8 vom 27.05.2025 wird als nicht eingetragen veröffentlicht: Den Gläubigern der an der Verschmelzung beteiligten Rechtsträger ist, wenn sie binnen sechs Monaten nach dem Tag, an dem die Eintragung der Verschmelzung in das Register des Sitzes desjenigen Rechtsträgers, dessen Gläubiger sie sind, als bekannt gemacht gilt, ihren Anspruch nach Grund und Höhe schriftlich anmelden, Sicherheit zu leisten, soweit sie nicht Befriedigung verlangen können. Dieses Recht steht den Gläubigern jedoch nur zu, wenn sie glaubhaft machen, dass durch die Verschmelzung die Erfüllung ihrer Forderung gefährdet wird. Das Recht, Sicherheitsleistung zu verlangen, steht Gläubigern nicht zu, die im Falle der Insolvenz ein Recht auf vorzugsweise Befriedigung aus einer Deckungsmasse haben, die nach gesetzlicher Vorschrift zu ihrem Schutz errichtet und staatlich überwacht ist."
    },
    {
      "date": "2025-05-28",
      "id": "110509",
      "original_text": "Einreichung neuer Dokumente\nBaden-Württemberg Amtsgericht Stuttgart HRB 723199\nIWV Versicherungsservice AG – Winnenden",
      "type": "Einreichung neuer Dokumente",
      "state": "Baden-Württemberg",
      "amtsgericht": "Amtsgericht Stuttgart",
      "registernummer": "HRB 723199",
      "registerart": "HRB",
      "company_name": "IWV Versicherungsservice AG",
      "company_seat": "Winnenden",
      "details": "28.05.2025 (Bekanntmachungsdatum)\n\nBaden-Württemberg Amtsgericht Stuttgart HRB 723199\nEinreichung neuer Dokumente\n\nIWV Versicherungsservice AG\nAktiengesellschaft\nWinnenden\n\nDie Gesellschaft hat am 22.05.2025 die Liste über die Zusammensetzung des Aufsichtsrats zum Handelsregister eingereicht."
    },
    {
      "date": "2025-05-28",
      "id": "110510",
      "original_text": "Registerbekanntmachung nach dem Umwandlungsgesetz\nBaden-Württemberg Amtsgericht Ulm HRA 729625\nHPM Huzarski PersonalManagement e.K. – Waldstetten",
      "type": "Registerbekanntmachung nach dem Umwandlungsgesetz",
      "state": "Baden-Württemberg",
      "amtsgericht": "Amtsgericht Ulm",
      "registernummer": "HRA 729625",
      "registerart": "HRA",
      "company_name": "HPM Huzarski PersonalManagement e.K.",
      "company_seat": "Waldstetten",
      "details": "28.05.2025 (Bekanntmachungsdatum)\n\nBaden-Württemberg Amtsgericht Ulm HRA 729625\nRegisterbekanntmachung nach dem Umwandlungsgesetz 28.05.2025 (Eintragungsdatum)\n\nHPM Huzarski PersonalManagement e.K.\nEinzelkaufmann / Einzelkauffrau\nWaldstetten\n\nAls nicht eingetragen wird bekanntgemacht:\nDen Gläubigern der an der Verschmelzung beteiligten Rechtsträger ist, wenn sie binnen sechs Monaten nach dem Tag, an dem die Eintragung der Verschmelzung in das Register des Sitzes desjenigen Rechtsträgers, dessen Gläubiger sie sind, nach § 19 Abs. 3 UmwG als bekanntgemacht gilt, ihren Anspruch nach Grund und Höhe schriftlich anmelden, Sicherheit zu leisten, soweit sie nicht Befriedigung verlangen können. Dieses Recht steht den Gläubigern jedoch nur zu, wenn sie glaubhaft machen, dass durch die Verschmelzung die Erfüllung ihrer Forderung gefährdet wird."
    },
    {
      "date": "2025-05-28",
      "id": "110511",
      "original_text": "Registerbekanntmachung nach dem Umwandlungsgesetz\nBaden-Württemberg Amtsgericht Freiburg HRB 721702\nALDI Donaueschingen Verwaltungs-SE – Donaueschingen",
      "type": "Registerbekanntmachung nach dem Umwandlungsgesetz",
      "state": "Baden-Württemberg",
      "amtsgericht": "Amtsgericht Freiburg",
      "registernummer": "HRB 721702",
      "registerart": "HRB",
      "company_name": "ALDI Donaueschingen Verwaltungs-SE",
      "company_seat": "Donaueschingen",
      "details": "28.05.2025 (Bekanntmachungsdatum)\n\nBaden-Württemberg Amtsgericht Freiburg HRB 721702\nRegisterbekanntmachung nach dem Umwandlungsgesetz 28.05.2025 (Eintragungsdatum)\n\nALDI Donaueschingen Verwaltungs-SE\nEuropäische Aktiengesellschaft (SE)\nDonaueschingen\n\nDen Gläubigern der an der Verschmelzung beteiligten Rechtsträger ist, wenn sie binnen sechs Monaten nach dem Tag, an dem die Eintragung der Verschmelzung in das Register des Sitzes desjenigen Rechtsträgers, dessen Gläubiger sie sind, nach § 19 Abs. 3 UmwG als bekanntgemacht gilt, ihren Anspruch nach Grund und Höhe schriftlich anmelden, Sicherheit zu leisten, soweit sie nicht Befriedigung verlangen können. Dieses Recht steht den Gläubigern jedoch nur zu, wenn sie glaubhaft machen, dass durch die Verschmelzung die Erfüllung ihrer Forderung gefährdet wird."
    },
    {
      "date": "2025-05-28",
      "id": "110512",
      "original_text": "Registerbekanntmachung nach dem Umwandlungsgesetz\nBaden-Württemberg Amtsgericht Ulm HRB 701792\nHPW Huzarski Personalberatung GmbH – Waldstetten",
      "type": "Registerbekanntmachung nach dem Umwandlungsgesetz",
      "state": "Baden-Württemberg",
      "amtsgericht": "Amtsgericht Ulm",
      "registernummer": "HRB 701792",
      "registerart": "HRB",
      "company_name": "HPW Huzarski Personalberatung GmbH",
      "company_seat": "Waldstetten",
      "details": "28.05.2025 (Bekanntmachungsdatum)\n\nBaden-Württemberg Amtsgericht Ulm HRB 701792\nRegisterbekanntmachung nach dem Umwandlungsgesetz 28.05.2025 (Eintragungsdatum)\n\nHPW Huzarski Personalberatung GmbH\nGesellschaft mit beschränkter Haftung\nWaldstetten\n\nAls nicht eingetragen wird bekanntgemacht:\nDen Gläubigern der an der Verschmelzung beteiligten Rechtsträger ist, wenn sie binnen sechs Monaten nach dem Tag, an dem die Eintragung der Verschmelzung in das Register des Sitzes desjenigen Rechtsträgers, dessen Gläubiger sie sind, nach § 19 Abs. 3 UmwG als bekanntgemacht gilt, ihren Anspruch nach Grund und Höhe schriftlich anmelden, Sicherheit zu leisten, soweit sie nicht Befriedigung verlangen können. Dieses Recht steht den Gläubigern jedoch nur zu, wenn sie glaubhaft machen, dass durch die Verschmelzung die Erfüllung ihrer Forderung gefährdet wird."
    },
    {
      "date": "2025-05-28",
      "id": "110513",
      "original_text": "Registerbekanntmachung nach dem Umwandlungsgesetz\nSchleswig-Holstein Amtsgericht Kiel HRB 6960\nTKMS GmbH – Kiel",
      "type": "Registerbekanntmachung nach dem Umwandlungsgesetz",
      "state": "Schleswig-Holstein",
      "amtsgericht": "Amtsgericht Kiel",
      "registernummer": "HRB 6960",
      "registerart": "HRB",
      "company_name": "TKMS GmbH",
      "company_seat": "Kiel",
      "details": "28.05.2025 (Bekanntmachungsdatum)\n\nSchleswig-Holstein Amtsgericht Kiel HRB 6960\nRegisterbekanntmachung nach dem Umwandlungsgesetz 27.05.2025 (Eintragungsdatum)\n\nTKMS GmbH\nGesellschaft mit beschränkter Haftung\nKiel\n\nZu Eintragungsnummer 103 vom 27.05.2025 wird als nicht eingetragen veröffentlicht: Den Gläubigern der an der Verschmelzung beteiligten Rechtsträger ist, wenn sie binnen sechs Monaten nach dem Tag, an dem die Eintragung der Verschmelzung in das Register des Sitzes desjenigen Rechtsträgers, dessen Gläubiger sie sind, nach § 19 Abs. 3 UmwG bekannt gemacht worden ist, ihren Anspruch nach Grund und Höhe schriftlich anmelden, Sicherheit zu leisten, soweit sie nicht Befriedigung verlangen können. Dieses Recht steht den Gläubigern jedoch nur zu, wenn sie glaubhaft machen, dass durch die Verschmelzung die Erfüllung ihrer Forderung gefährdet wird."
    },
    {
      "date": "2025-05-28",
      "id": "110514",
      "original_text": "Löschungsankündigung\nBaden-Württemberg Amtsgericht Ulm HRB 510201\nMödinger GmbH – Ellwangen Jagst",
      "type": "Löschungsankündigung",
      "state": "Baden-Württemberg",
      "amtsgericht": "Amtsgericht Ulm",
      "registernummer": "HRB 510201",
      "registerart": "HRB",
      "company_name": "Mödinger GmbH",
      "company_seat": "Ellwangen Jagst",
      "details": "28.05.2025 (Bekanntmachungsdatum)\n\nBaden-Württemberg Amtsgericht Ulm HRB 510201\nLöschungsankündigung\n\nMödinger GmbH\nGesellschaft mit beschränkter Haftung\nEllwangen Jagst\n\nDas Gericht beabsichtigt, die Gesellschaft wegen Vermögenslosigkeit im Handelsregister von Amts wegen nach § 394 FamFG zu löschen. Die Frist zur Geltendmachung eines Widerspruchs gegen die beabsichtigte Löschung ist auf  einen Monat ab Veröffentlichung bestimmt."
    },
    {
      "date": "2025-05-28",
      "id": "110515",
      "original_text": "Einreichung neuer Dokumente\nHamburg Amtsgericht Hamburg HRB 129556\nEVENTIM Management AG – Hamburg",
      "type": "Einreichung neuer Dokumente",
      "state": "Hamburg",
      "amtsgericht": "Amtsgericht Hamburg",
      "registernummer": "HRB 129556",
      "registerart": "HRB",
      "company_name": "EVENTIM Management AG",
      "company_seat": "Hamburg",
      "details": "28.05.2025 (Bekanntmachungsdatum)\n\nHamburg Amtsgericht Hamburg HRB 129556\nEinreichung neuer Dokumente\n\nEVENTIM Management AG\nAktiengesellschaft\nHamburg\n\nAls nicht eingetragen wird bekannt gemacht: Liste des Aufsichtsrats wurde eingereicht."
    },
    {
      "date": "2025-05-28",
      "id": "110516",
      "original_text": "Registerbekanntmachung nach dem Umwandlungsgesetz\nSchleswig-Holstein Amtsgericht Lübeck HRA 6 GE\nLeuchtturm Gruppe GmbH & Co. KG – Geesthacht",
      "type": "Registerbekanntmachung nach dem Umwandlungsgesetz",
      "state": "Schleswig-Holstein",
      "amtsgericht": "Amtsgericht Lübeck",
      "registernummer": "HRA 6 GE",
      "registerart": "HRA",
      "company_name": "Leuchtturm Gruppe GmbH & Co. KG",
      "company_seat": "Geesthacht",
      "details": "28.05.2025 (Bekanntmachungsdatum)\n\nSchleswig-Holstein Amtsgericht Lübeck HRA 6 GE\nRegisterbekanntmachung nach dem Umwandlungsgesetz 28.05.2025 (Eintragungsdatum)\n\nLeuchtturm Gruppe GmbH & Co. KG\nKommanditgesellschaft\nGeesthacht\n\nAls nicht eingetragen wird veröffentlicht: Den Gläubigern der an der Verschmelzung beteiligten Rechtsträger ist, wenn sie binnen sechs Monaten nach dem Tag, an dem die Eintragung der Verschmelzung in das Register des Sitzes desjenigen Rechtsträgers, dessen Gläubiger sie sind, als bekannt gemacht gilt, ihren Anspruch nach Grund und Höhe schriftlich anmelden, Sicherheit zu leisten, soweit sie nicht Befriedigung verlangen können. Dieses Recht steht den Gläubigern jedoch nur zu, wenn sie glaubhaft machen, dass durch die Verschmelzung die Erfüllung ihrer Forderung gefährdet wird."
    },
    {
      "date": "2025-05-28",
      "id": "110517",
      "original_text": "Einreichung neuer Dokumente\nBaden-Württemberg Amtsgericht Stuttgart HRB 15624\nCreditPlus Bank Aktiengesellschaft – Stuttgart",
      "type": "Einreichung neuer Dokumente",
      "state": "Baden-Württemberg",
      "amtsgericht": "Amtsgericht Stuttgart",
      "registernummer": "HRB 15624",
      "registerart": "HRB",
      "company_name": "CreditPlus Bank Aktiengesellschaft",
      "company_seat": "Stuttgart",
      "details": "28.05.2025 (Bekanntmachungsdatum)\n\nBaden-Württemberg Amtsgericht Stuttgart HRB 15624\nEinreichung neuer Dokumente\n\nCreditPlus Bank Aktiengesellschaft\nAktiengesellschaft\nStuttgart\n\nDie Gesellschaft hat am 28.05.2025 die Liste über die Zusammensetzung des Aufsichtsrats zum Handelsregister eingereicht."
    },
    {
      "date": "2025-05-28",
      "id": "110518",
      "original_text": "Löschungsankündigung\nSchleswig-Holstein Amtsgericht Lübeck HRB 23232\nAgadschanjan Holding UG (haftungsbeschränkt) – Lübeck",
      "type": "Löschungsankündigung",
      "state": "Schleswig-Holstein",
      "amtsgericht": "Amtsgericht Lübeck",
      "registernummer": "HRB 23232",
      "registerart": "HRB",
      "company_name": "Agadschanjan Holding UG (haftungsbeschränkt)",
      "company_seat": "Lübeck",
      "details": "28.05.2025 (Bekanntmachungsdatum)\n\nSchleswig-Holstein Amtsgericht Lübeck HRB 23232\nLöschungsankündigung\n\nAgadschanjan Holding UG (haftungsbeschränkt)\nGesellschaft mit beschränkter Haftung\nLübeck\n\nEs ist die Löschung der nachstehenden Gesellschaft wegen Vermögenslosigkeit gemäß § 394 FamFG beabsichtigt."
    },
    {
      "date": "2025-05-28",
      "id": "110519",
      "original_text": "Löschungsankündigung\nBerlin Amtsgericht Berlin (Charlottenburg) HRB 98476\nMinEq GmbH – Berlin",
      "type": "Löschungsankündigung",
      "state": "Berlin",
      "amtsgericht": "Amtsgericht Berlin (Charlottenburg)",
      "registernummer": "HRB 98476",
      "registerart": "HRB",
      "company_name": "MinEq GmbH",
      "company_seat": "Berlin",
      "details": "28.05.2025 (Bekanntmachungsdatum)\n\nBerlin Amtsgericht Berlin (Charlottenburg) HRB 98476\nLöschungsankündigung\n\nMinEq GmbH\nGesellschaft mit beschränkter Haftung\nBerlin\n\nBei der nachstehenden Gesellschaft wird das Amtslöschungsverfahren gemäß § 394 FamFG eingeleitet. Widerspruchsfrist: 6 Wochen."
    },
    {
      "date": "2025-05-28",
      "id": "110520",
      "original_text": "Löschungsankündigung\nBerlin Amtsgericht Berlin (Charlottenburg) HRB 211402\nWeedUp UG (haftungsbeschränkt) – Berlin",
      "type": "Löschungsankündigung",
      "state": "Berlin",
      "amtsgericht": "Amtsgericht Berlin (Charlottenburg)",
      "registernummer": "HRB 211402",
      "registerart": "HRB",
      "company_name": "WeedUp UG (haftungsbeschränkt)",
      "company_seat": "Berlin",
      "details": "28.05.2025 (Bekanntmachungsdatum)\n\nBerlin Amtsgericht Berlin (Charlottenburg) HRB 211402\nLöschungsankündigung\n\nWeedUp UG (haftungsbeschränkt)\nGesellschaft mit beschränkter Haftung\nBerlin\n\nBei der nachstehenden Gesellschaft wird das Amtslöschungsverfahren gemäß § 394 FamFG eingeleitet. Widerspruchsfrist: 6 Wochen."
    },
    {
      "date": "2025-05-28",
      "id": "110521",
      "original_text": "Registerbekanntmachung nach dem Umwandlungsgesetz\nBaden-Württemberg Amtsgericht Mannheim HRA 104646\nBechtle GmbH & Co. KG – Ettlingen",
      "type": "Registerbekanntmachung nach dem Umwandlungsgesetz",
      "state": "Baden-Württemberg",
      "amtsgericht": "Amtsgericht Mannheim",
      "registernummer": "HRA 104646",
      "registerart": "HRA",
      "company_name": "Bechtle GmbH & Co. KG",
      "company_seat": "Ettlingen",
      "details": "28.05.2025 (Bekanntmachungsdatum)\n\nBaden-Württemberg Amtsgericht Mannheim HRA 104646\nRegisterbekanntmachung nach dem Umwandlungsgesetz 28.05.2025 (Eintragungsdatum)\n\nBechtle GmbH & Co. KG\nKommanditgesellschaft\nEttlingen\n\nDen Gläubigern der an der Verschmelzung beteiligten Rechtsträger ist, wenn sie binnen sechs Monaten nach dem Tag, an dem die Eintragung der Verschmelzung in das Register des Sitzes desjenigen Rechtsträgers, dessen Gläubiger sie sind, nach § 19 Abs. 3 UmwG als bekanntgemacht gilt, ihren Anspruch nach Grund und Höhe schriftlich anmelden, Sicherheit zu leisten, soweit sie nicht Befriedigung verlangen können. Dieses Recht steht den Gläubigern jedoch nur zu, wenn sie glaubhaft machen, dass durch die Verschmelzung die Erfüllung ihrer Forderung gefährdet wird."
    },
    {
      "date": "2025-05-28",
      "id": "110522",
      "original_text": "Registerbekanntmachung nach dem Umwandlungsgesetz\nBaden-Württemberg Amtsgericht Freiburg HRB 472243\nPHOENIS Gesellschaft für angewandte Informatik mbH – Appenweier",
      "type": "Registerbekanntmachung nach dem Umwandlungsgesetz",
      "state": "Baden-Württemberg",
      "amtsgericht": "Amtsgericht Freiburg",
      "registernummer": "HRB 472243",
      "registerart": "HRB",
      "company_name": "PHOENIS Gesellschaft für angewandte Informatik mbH",
      "company_seat": "Appenweier",
      "details": "28.05.2025 (Bekanntmachungsdatum)\n\nBaden-Württemberg Amtsgericht Freiburg HRB 472243\nRegisterbekanntmachung nach dem Umwandlungsgesetz 28.05.2025 (Eintragungsdatum)\n\nPHOENIS Gesellschaft für angewandte Informatik mbH\nGesellschaft mit beschränkter Haftung\nAppenweier\n\nAls nicht eingetragen wird bekanntgemacht:\nDen Gläubigern der an der Verschmelzung beteiligten Rechtsträger ist, wenn sie binnen sechs Monaten nach dem Tag, an dem die Eintragung der Verschmelzung in das Register des Sitzes desjenigen Rechtsträgers, dessen Gläubiger sie sind, nach § 19 Abs. 3 UmwG als bekanntgemacht gilt, ihren Anspruch nach Grund und Höhe schriftlich anmelden, Sicherheit zu leisten, soweit sie nicht Befriedigung verlangen können. Dieses Recht steht den Gläubigern jedoch nur zu, wenn sie glaubhaft machen, dass durch die Verschmelzung die Erfüllung ihrer Forderung gefährdet wird."
    },
    {
      "date": "2025-05-28",
      "id": "110523",
      "original_text": "Einreichung neuer Dokumente\nBaden-Württemberg Amtsgericht Stuttgart HRB 732997\ne-mobil BW GmbH – Stuttgart",
      "type": "Einreichung neuer Dokumente",
      "state": "Baden-Württemberg",
      "amtsgericht": "Amtsgericht Stuttgart",
      "registernummer": "HRB 732997",
      "registerart": "HRB",
      "company_name": "e-mobil BW GmbH",
      "company_seat": "Stuttgart",
      "details": "28.05.2025 (Bekanntmachungsdatum)\n\nBaden-Württemberg Amtsgericht Stuttgart HRB 732997\nEinreichung neuer Dokumente\n\ne-mobil BW GmbH\nGesellschaft mit beschränkter Haftung\nStuttgart\n\nDie Gesellschaft hat am 28.05.2025 die Liste über die Zusammensetzung des Aufsichtsrats zum Handelsregister eingereicht."
    },
    {
      "date": "2025-05-28",
      "id": "110524",
      "original_text": "Löschungsankündigung\nSachsen Amtsgericht Dresden HRB 37275\nSaxoniastone Verwaltung UG (haftungsbeschränkt) – Ohorn",
      "type": "Löschungsankündigung",
      "state": "Sachsen",
      "amtsgericht": "Amtsgericht Dresden",
      "registernummer": "HRB 37275",
      "registerart": "HRB",
      "company_name": "Saxoniastone Verwaltung UG (haftungsbeschränkt)",
      "company_seat": "Ohorn",
      "details": "28.05.2025 (Bekanntmachungsdatum)\n\nSachsen Amtsgericht Dresden HRB 37275\nLöschungsankündigung\n\nSaxoniastone Verwaltung UG (haftungsbeschränkt)\nGesellschaft mit beschränkter Haftung\nOhorn\n\nDas Registergericht beabsichtigt, die im Handelsregister eingetragene Gesellschaft von Amts wegen nach § 394 FamFG zu löschen. Die Frist zu Erhebung eines Widerspruchs gegen die beabsichtigte Löschung wird auf einen Monat festgesetzt."
    },
    {
      "date": "2025-05-28",
      "id": "110525",
      "original_text": "Einreichung neuer Dokumente\nSachsen Amtsgericht Dresden HRB 3912\nStadtwerke Oberland GmbH – Ebersbach-Neugersdorf",
      "type": "Einreichung neuer Dokumente",
      "state": "Sachsen",
      "amtsgericht": "Amtsgericht Dresden",
      "registernummer": "HRB 3912",
      "registerart": "HRB",
      "company_name": "Stadtwerke Oberland GmbH",
      "company_seat": "Ebersbach-Neugersdorf",
      "details": "28.05.2025 (Bekanntmachungsdatum)\n\nSachsen Amtsgericht Dresden HRB 3912\nEinreichung neuer Dokumente\n\nStadtwerke Oberland GmbH\nGesellschaft mit beschränkter Haftung\nEbersbach-Neugersdorf\n\nAm 27.05.2025 wurde beim Handelsregister des Amtsgerichts Dresden die Liste der Mitglieder des Aufsichtsrats gemäß § 52 GmbHG eingereicht."
    },
    {
      "date": "2025-05-28",
      "id": "110526",
      "original_text": "Registerbekanntmachung nach dem Umwandlungsgesetz\nSachsen Amtsgericht Leipzig HRB 39443\naricap UG (haftungsbeschränkt) – Leipzig",
      "type": "Registerbekanntmachung nach dem Umwandlungsgesetz",
      "state": "Sachsen",
      "amtsgericht": "Amtsgericht Leipzig",
      "registernummer": "HRB 39443",
      "registerart": "HRB",
      "company_name": "aricap UG (haftungsbeschränkt)",
      "company_seat": "Leipzig",
      "details": "28.05.2025 (Bekanntmachungsdatum)\n\nSachsen Amtsgericht Leipzig HRB 39443\nRegisterbekanntmachung nach dem Umwandlungsgesetz 28.05.2025 (Eintragungsdatum)\n\naricap UG (haftungsbeschränkt)\nGesellschaft mit beschränkter Haftung\nLeipzig\n\nDen Gläubigern der an der Verschmelzung beteiligten Rechtsträger ist, wenn sie binnen sechs Monaten nach dem Tag, an dem die Eintragung der Verschmelzung in das Register des Sitzes desjenigen Rechtsträgers, dessen Gläubiger sie sind, nach § 19 Abs. 3 UmwG als bekannt gemacht gilt, ihren Anspruch nach Grund und Höhe in Textform anmelden, Sicherheit zu leisten, soweit sie nicht Befriedigung verlangen können. Dieses Recht steht den Gläubigern jedoch nur zu, wenn sie glaubhaft machen, dass durch die Verschmelzung die Erfüllung der Forderung gefährdet wird."
    },
    {
      "date": "2025-05-28",
      "id": "110527",
      "original_text": "Registerbekanntmachung nach dem Umwandlungsgesetz\nSachsen Amtsgericht Leipzig HRB 40018\nLiveboxx Media UG (haftungsbeschränkt) – Leipzig",
      "type": "Registerbekanntmachung nach dem Umwandlungsgesetz",
      "state": "Sachsen",
      "amtsgericht": "Amtsgericht Leipzig",
      "registernummer": "HRB 40018",
      "registerart": "HRB",
      "company_name": "Liveboxx Media UG (haftungsbeschränkt)",
      "company_seat": "Leipzig",
      "details": "28.05.2025 (Bekanntmachungsdatum)\n\nSachsen Amtsgericht Leipzig HRB 40018\nRegisterbekanntmachung nach dem Umwandlungsgesetz 28.05.2025 (Eintragungsdatum)\n\nLiveboxx Media UG (haftungsbeschränkt)\nGesellschaft mit beschränkter Haftung\nLeipzig\n\nDen Gläubigern der an der Verschmelzung beteiligten Rechtsträger ist, wenn sie binnen sechs Monaten nach dem Tag, an dem die Eintragung der Verschmelzung in das Register des Sitzes desjenigen Rechtsträgers, dessen Gläubiger sie sind, nach § 19 Abs. 3 UmwG als bekannt gemacht gilt, ihren Anspruch nach Grund und Höhe in Textform anmelden, Sicherheit zu leisten, soweit sie nicht Befriedigung verlangen können. Dieses Recht steht den Gläubigern jedoch nur zu, wenn sie glaubhaft machen, dass durch die Verschmelzung die Erfüllung der Forderung gefährdet wird."
    },
    {
      "date": "2025-05-28",
      "id": "110528",
      "original_text": "Löschungsankündigung\nSachsen Amtsgericht Dresden HRB 39576\nH. Investigativ GmbH – Dresden",
      "type": "Löschungsankündigung",
      "state": "Sachsen",
      "amtsgericht": "Amtsgericht Dresden",
      "registernummer": "HRB 39576",
      "registerart": "HRB",
      "company_name": "H. Investigativ GmbH",
      "company_seat": "Dresden",
      "details": "28.05.2025 (Bekanntmachungsdatum)\n\nSachsen Amtsgericht Dresden HRB 39576\nLöschungsankündigung\n\nH. Investigativ GmbH\nGesellschaft mit beschränkter Haftung\nDresden\n\nDas Registergericht beabsichtigt, die im Handelsregister eingetragene Gesellschaft von Amts wegen nach § 394 FamFG zu löschen. Die Frist zu Erhebung eines Widerspruchs gegen die beabsichtigte Löschung wird auf einen Monat festgesetzt."
    },
    {
      "date": "2025-05-28",
      "id": "110529",
      "original_text": "Löschungsankündigung\nSachsen Amtsgericht Dresden HRB 33406\nWaveguard GmbH – Bautzen",
      "type": "Löschungsankündigung",
      "state": "Sachsen",
      "amtsgericht": "Amtsgericht Dresden",
      "registernummer": "HRB 33406",
      "registerart": "HRB",
      "company_name": "Waveguard GmbH",
      "company_seat": "Bautzen",
      "details": "28.05.2025 (Bekanntmachungsdatum)\n\nSachsen Amtsgericht Dresden HRB 33406\nLöschungsankündigung\n\nWaveguard GmbH\nGesellschaft mit beschränkter Haftung\nBautzen\n\nDas Registergericht beabsichtigt, die im Handelsregister eingetragene Gesellschaft von Amts wegen nach § 394 FamFG zu löschen. Die Frist zu Erhebung eines Widerspruchs gegen die beabsichtigte Löschung wird auf einen Monat festgesetzt."
    },
    {
      "date": "2025-05-28",
      "id": "110530",
      "original_text": "Einreichung neuer Dokumente\nSachsen Amtsgericht Dresden HRB 11170\nEbersbacher Wohnungsunternehmen GmbH – Ebersbach-Neugersdorf",
      "type": "Einreichung neuer Dokumente",
      "state": "Sachsen",
      "amtsgericht": "Amtsgericht Dresden",
      "registernummer": "HRB 11170",
      "registerart": "HRB",
      "company_name": "Ebersbacher Wohnungsunternehmen GmbH",
      "company_seat": "Ebersbach-Neugersdorf",
      "details": "28.05.2025 (Bekanntmachungsdatum)\n\nSachsen Amtsgericht Dresden HRB 11170\nEinreichung neuer Dokumente 28.05.2025 (Eintragungsdatum)\n\nEbersbacher Wohnungsunternehmen GmbH\nGesellschaft mit beschränkter Haftung\nEbersbach-Neugersdorf\n\nAm 27.05.2025 wurde beim Handelsregister des Amtsgerichts Dresden die Liste der Mitglieder des Aufsichtsrats gemäß § 52 GmbHG eingereicht."
    },
    {
      "date": "2025-05-28",
      "id": "110531",
      "original_text": "Registerbekanntmachung nach dem Umwandlungsgesetz\nSachsen Amtsgericht Leipzig HRB 43294\nTyco Service & Montage GmbH – Leipzig",
      "type": "Registerbekanntmachung nach dem Umwandlungsgesetz",
      "state": "Sachsen",
      "amtsgericht": "Amtsgericht Leipzig",
      "registernummer": "HRB 43294",
      "registerart": "HRB",
      "company_name": "Tyco Service & Montage GmbH",
      "company_seat": "Leipzig",
      "details": "28.05.2025 (Bekanntmachungsdatum)\n\nSachsen Amtsgericht Leipzig HRB 43294\nRegisterbekanntmachung nach dem Umwandlungsgesetz 28.05.2025 (Eintragungsdatum)\n\nTyco Service & Montage GmbH\nGesellschaft mit beschränkter Haftung\nLeipzig\n\nDen Gläubigern der an der Verschmelzung beteiligten Rechtsträger ist, wenn sie binnen sechs Monaten nach dem Tag, an dem die Eintragung der Verschmelzung in das Register des Sitzes desjenigen Rechtsträgers, dessen Gläubiger sie sind, nach § 19 Abs. 3 UmwG als bekannt gemacht gilt, ihren Anspruch nach Grund und Höhe in Textform anmelden, Sicherheit zu leisten, soweit sie nicht Befriedigung verlangen können. Dieses Recht steht den Gläubigern jedoch nur zu, wenn sie glaubhaft machen, dass durch die Verschmelzung die Erfüllung der Forderung gefährdet wird."
    },
    {
      "date": "2025-05-28",
      "id": "110532",
      "original_text": "Registerbekanntmachung nach dem Umwandlungsgesetz\nNiedersachsen Amtsgericht Braunschweig HRB 208039\nLöwenstark Consulting GmbH – Braunschweig",
      "type": "Registerbekanntmachung nach dem Umwandlungsgesetz",
      "state": "Niedersachsen",
      "amtsgericht": "Amtsgericht Braunschweig",
      "registernummer": "HRB 208039",
      "registerart": "HRB",
      "company_name": "Löwenstark Consulting GmbH",
      "company_seat": "Braunschweig",
      "details": "28.05.2025 (Bekanntmachungsdatum)\n\nNiedersachsen Amtsgericht Braunschweig HRB 208039\nRegisterbekanntmachung nach dem Umwandlungsgesetz 28.05.2025 (Eintragungsdatum)\n\nLöwenstark Consulting GmbH\nGesellschaft mit beschränkter Haftung\nBraunschweig\n\nDen Gläubigern der an der Verschmelzung beteiligten Rechtsträger ist, wenn sie binnen sechs Monaten nach dem Tag, an dem die Eintragung der Verschmelzung in das Register des Sitzes desjenigen Rechtsträgers, dessen Gläubiger sie sind, nach § 19  Abs.  3 UmwG als bekannt gemacht gilt, ihren Anspruch nach Grund und Höhe schriftlich anmelden, Sicherheit zu leisten, soweit sie nicht Befriedigung verlangen können. Dieses Recht steht den Gläubigern jedoch nur zu, wenn sie glaubhaft machen, dass durch die Verschmelzung die Erfüllung der Forderung gefährdet wird."
    },
    {
      "date": "2025-05-28",
      "id": "110533",
      "original_text": "Einreichung neuer Dokumente\nNiedersachsen Amtsgericht Braunschweig HRB 208338\nAutomobilgruppe Niedersachsen - Mitte AG – Salzgitter",
      "type": "Einreichung neuer Dokumente",
      "state": "Niedersachsen",
      "amtsgericht": "Amtsgericht Braunschweig",
      "registernummer": "HRB 208338",
      "registerart": "HRB",
      "company_name": "Automobilgruppe Niedersachsen - Mitte AG",
      "company_seat": "Salzgitter",
      "details": "28.05.2025 (Bekanntmachungsdatum)\n\nNiedersachsen Amtsgericht Braunschweig HRB 208338\nEinreichung neuer Dokumente 28.05.2025 (Eintragungsdatum)\n\nAutomobilgruppe Niedersachsen - Mitte AG\nAktiengesellschaft\nSalzgitter\n\nDie Liste der Mitglieder des Aufsichtsrats wurde beim Registergericht eingereicht."
    },
    {
      "date": "2025-05-28",
      "id": "110534",
      "original_text": "Löschungsankündigung\nNiedersachsen Amtsgericht Braunschweig HRB 204845\nSpot up Medien Advertising GmbH – Braunschweig",
      "type": "Löschungsankündigung",
      "state": "Niedersachsen",
      "amtsgericht": "Amtsgericht Braunschweig",
      "registernummer": "HRB 204845",
      "registerart": "HRB",
      "company_name": "Spot up Medien Advertising GmbH",
      "company_seat": "Braunschweig",
      "details": "28.05.2025 (Bekanntmachungsdatum)\n\nNiedersachsen Amtsgericht Braunschweig HRB 204845\nLöschungsankündigung 28.05.2025 (Eintragungsdatum)\n\nSpot up Medien Advertising GmbH\nGesellschaft mit beschränkter Haftung\nBraunschweig\n\nDas Registergericht beabsichtigt, die Gesellschaft von Amts wegen nach § 394 FamFG zu löschen. Die Frist zur Erhebung eines Widerspruchs ist auf 1 Monat ab dieser Registerbekanntmachung festgesetzt."
    },
    {
      "date": "2025-05-28",
      "id": "110535",
      "original_text": "Registerbekanntmachung nach dem Umwandlungsgesetz\nNiedersachsen Amtsgericht Lüneburg VR 130059\nDeutsche Verkehrswacht, Verkehrswacht Munster- Bispingen e. V. – Munster",
      "type": "Registerbekanntmachung nach dem Umwandlungsgesetz",
      "state": "Niedersachsen",
      "amtsgericht": "Amtsgericht Lüneburg",
      "registernummer": "VR 130059",
      "registerart": "VR",
      "company_name": "Deutsche Verkehrswacht, Verkehrswacht Munster- Bispingen e. V.",
      "company_seat": "Munster",
      "details": "28.05.2025 (Bekanntmachungsdatum)\n\nNiedersachsen Amtsgericht Lüneburg VR 130059\nRegisterbekanntmachung nach dem Umwandlungsgesetz 28.05.2025 (Eintragungsdatum)\n\nDeutsche Verkehrswacht, Verkehrswacht Munster- Bispingen e. V.\neingetragener Verein\nMunster\n\nDen Gläubigern der an der Verschmelzung beteiligten Rechtsträger ist, wenn sie binnen sechs Monaten nach dem Tag, an dem die Eintragung der Verschmelzung in das Register des Sitzes desjenigen Rechtsträgers, dessen Gläubiger sie sind, nach § 19  Abs.  3 UmwG als bekannt gemacht gilt, ihren Anspruch nach Grund und Höhe schriftlich anmelden, Sicherheit zu leisten, soweit sie nicht Befriedigung verlangen können. Dieses Recht steht den Gläubigern jedoch nur zu, wenn sie glaubhaft machen, dass durch die Verschmelzung die Erfüllung der Forderung gefährdet wird."
    },
    {
      "date": "2025-05-28",
      "id": "110536",
      "original_text": "Löschungsankündigung\nNiedersachsen Amtsgericht Stadthagen HRB 201089\nDLZ Schaumburg GmbH – Stadthagen",
      "type": "Löschungsankündigung",
      "state": "Niedersachsen",
      "amtsgericht": "Amtsgericht Stadthagen",
      "registernummer": "HRB 201089",
      "registerart": "HRB",
      "company_name": "DLZ Schaumburg GmbH",
      "company_seat": "Stadthagen",
      "details": "28.05.2025 (Bekanntmachungsdatum)\n\nNiedersachsen Amtsgericht Stadthagen HRB 201089\nLöschungsankündigung\n\nDLZ Schaumburg GmbH\nGesellschaft mit beschränkter Haftung\nStadthagen\n\nDas Registergericht beabsichtigt, die Gesellschaft von Amts wegen nach § 394 FamFG zu löschen. Die Frist zur Erhebung eines Widerspruchs ist auf 1 Monat ab dieser Registerbekanntmachung festgesetzt."
    },
    {
      "date": "2025-05-28",
      "id": "110537",
      "original_text": "Löschungsankündigung\nNiedersachsen Amtsgericht Stadthagen HRA 1521\nFriedrich Wilharm Garten-und Landschaftsbau GmbH &Co.KG,Tief- und Straßenbau – Niedernwöhren",
      "type": "Löschungsankündigung",
      "state": "Niedersachsen",
      "amtsgericht": "Amtsgericht Stadthagen",
      "registernummer": "HRA 1521",
      "registerart": "HRA",
      "company_name": "Friedrich Wilharm Garten-und Landschaftsbau GmbH &Co.KG,Tief- und Straßenbau",
      "company_seat": "Niedernwöhren",
      "details": "28.05.2025 (Bekanntmachungsdatum)\n\nNiedersachsen Amtsgericht Stadthagen HRA 1521\nLöschungsankündigung\n\nFriedrich Wilharm Garten-und Landschaftsbau GmbH &Co.KG,Tief- und Straßenbau\nKommanditgesellschaft\nNiedernwöhren\n\nDas Registergericht beabsichtigt, die Firma von Amts wegen nach § 394 FamFG zu löschen. Die Frist zur Erhebung eines Widerspruchs ist auf 1 Monat ab dieser Registerbekanntmachung festgesetzt."
    },
    {
      "date": "2025-05-28",
      "id": "110538",
      "original_text": "Löschungsankündigung\nNiedersachsen Amtsgericht Stadthagen HRA 1521\nFriedrich Wilharm Garten-und Landschaftsbau GmbH &Co.KG,Tief- und Straßenbau – Niedernwöhren",
      "type": "Löschungsankündigung",
      "state": "Niedersachsen",
      "amtsgericht": "Amtsgericht Stadthagen",
      "registernummer": "HRA 1521",
      "registerart": "HRA",
      "company_name": "Friedrich Wilharm Garten-und Landschaftsbau GmbH &Co.KG,Tief- und Straßenbau",
      "company_seat": "Niedernwöhren",
      "details": "28.05.2025 (Bekanntmachungsdatum)\n\nNiedersachsen Amtsgericht Stadthagen HRA 1521\nLöschungsankündigung\n\nFriedrich Wilharm Garten-und Landschaftsbau GmbH &Co.KG,Tief- und Straßenbau\nKommanditgesellschaft\nNiedernwöhren\n\nDas Registergericht beabsichtigt, die Firma von Amts wegen nach § 394 FamFG zu löschen. Die Frist zur Erhebung eines Widerspruchs ist auf 1 Monat ab dieser Registerbekanntmachung festgesetzt."
    },
    {
      "date": "2025-05-28",
      "id": "110539",
      "original_text": "Registerbekanntmachung nach dem Umwandlungsgesetz\nNiedersachsen Amtsgericht Braunschweig HRB 200477\nLöwenstark Online-Marketing GmbH – Braunschweig",
      "type": "Registerbekanntmachung nach dem Umwandlungsgesetz",
      "state": "Niedersachsen",
      "amtsgericht": "Amtsgericht Braunschweig",
      "registernummer": "HRB 200477",
      "registerart": "HRB",
      "company_name": "Löwenstark Online-Marketing GmbH",
      "company_seat": "Braunschweig",
      "details": "28.05.2025 (Bekanntmachungsdatum)\n\nNiedersachsen Amtsgericht Braunschweig HRB 200477\nRegisterbekanntmachung nach dem Umwandlungsgesetz 28.05.2025 (Eintragungsdatum)\n\nLöwenstark Online-Marketing GmbH\nGesellschaft mit beschränkter Haftung\nBraunschweig\n\nDen Gläubigern der an der Verschmelzung beteiligten Rechtsträger ist, wenn sie binnen sechs Monaten nach dem Tag, an dem die Eintragung der Verschmelzung in das Register des Sitzes desjenigen Rechtsträgers, dessen Gläubiger sie sind, nach § 19  Abs.  3 UmwG als bekannt gemacht gilt, ihren Anspruch nach Grund und Höhe schriftlich anmelden, Sicherheit zu leisten, soweit sie nicht Befriedigung verlangen können. Dieses Recht steht den Gläubigern jedoch nur zu, wenn sie glaubhaft machen, dass durch die Verschmelzung die Erfüllung der Forderung gefährdet wird."
    },
    {
      "date": "2025-05-28",
      "id": "110540",
      "original_text": "Sonstige Registerbekanntmachung\nNiedersachsen Amtsgericht Osnabrück HRB 200376\nKaffee Partner Holding GmbH – Osnabrück",
      "type": "Sonstige Registerbekanntmachung",
      "state": "Niedersachsen",
      "amtsgericht": "Amtsgericht Osnabrück",
      "registernummer": "HRB 200376",
      "registerart": "HRB",
      "company_name": "Kaffee Partner Holding GmbH",
      "company_seat": "Osnabrück",
      "details": "28.05.2025 (Bekanntmachungsdatum)\n\nNiedersachsen Amtsgericht Osnabrück HRB 200376\nSonstige Registerbekanntmachung 28.05.2025 (Eintragungsdatum)\n\nKaffee Partner Holding GmbH\nGesellschaft mit beschränkter Haftung\nOsnabrück\n\nDen Gläubigern der Gesellschaft, deren Forderungen begründet worden sind, bevor die Eintragung der Beendigung des Vertrages in das Handelsregister nach § 10 HGB als bekanntgemacht gilt, ist vom anderen Vertragsteil Sicherheit zu leisten, wenn sie sich binnen sechs Monaten nach der Bekanntmachung zu diesem Zweck bei ihm melden."
    },
    {
      "date": "2025-05-28",
      "id": "110541",
      "original_text": "Löschungsankündigung\nNiedersachsen Amtsgericht Braunschweig HRB 100999 früher Amtsgericht Wolfsburg\nbrand.elektro gmbh – Wolfsburg",
      "type": "Löschungsankündigung",
      "state": "Niedersachsen",
      "amtsgericht": "Amtsgericht Braunschweig",
      "registernummer": "HRB 100999",
      "registerart": "HRB",
      "company_name": "brand.elektro gmbh",
      "company_seat": "Wolfsburg",
      "former_amtsgericht": "Wolfsburg",
      "details": "28.05.2025 (Bekanntmachungsdatum)\n\nNiedersachsen Amtsgericht Braunschweig HRB 100999 früher Amtsgericht Wolfsburg\nLöschungsankündigung 28.05.2025 (Eintragungsdatum)\n\nbrand.elektro gmbh\nGesellschaft mit beschränkter Haftung\nWolfsburg\n\nDas Registergericht beabsichtigt, die Gesellschaft von Amts wegen nach § 394 FamFG zu löschen. Die Frist zur Erhebung eines Widerspruchs ist auf 1 Monat ab dieser Registerbekanntmachung festgesetzt."
    },
    {
      "date": "2025-05-28",
      "id": "110542",
      "original_text": "Löschungsankündigung\nNiedersachsen Amtsgericht Osnabrück HRB 216047\nD.E.S UG (haftungsbeschränkt) – Osnabrück",
      "type": "Löschungsankündigung",
      "state": "Niedersachsen",
      "amtsgericht": "Amtsgericht Osnabrück",
      "registernummer": "HRB 216047",
      "registerart": "HRB",
      "company_name": "D.E.S UG (haftungsbeschränkt)",
      "company_seat": "Osnabrück",
      "details": "28.05.2025 (Bekanntmachungsdatum)\n\nNiedersachsen Amtsgericht Osnabrück HRB 216047\nLöschungsankündigung\n\nD.E.S UG (haftungsbeschränkt)\nGesellschaft mit beschränkter Haftung\nOsnabrück\n\nDas Registergericht beabsichtigt, die Gesellschaft von Amts wegen nach § 394 FamFG wegen Vermögenslosigkeit zu löschen. Die Frist zur Erhebung eines Widerspruchs ist auf 1 Monat ab dieser Registerbekanntmachung festgesetzt."
    },
    {
      "date": "2025-05-28",
      "id": "110543",
      "original_text": "Löschungsankündigung\nNiedersachsen Amtsgericht Braunschweig HRB 206229\nLOTUS GmbH – Bad Gandersheim",
      "type": "Löschungsankündigung",
      "state": "Niedersachsen",
      "amtsgericht": "Amtsgericht Braunschweig",
      "registernummer": "HRB 206229",
      "registerart": "HRB",
      "company_name": "LOTUS GmbH",
      "company_seat": "Bad Gandersheim",
      "details": "28.05.2025 (Bekanntmachungsdatum)\n\nNiedersachsen Amtsgericht Braunschweig HRB 206229\nLöschungsankündigung 28.05.2025 (Eintragungsdatum)\n\nLOTUS GmbH\nGesellschaft mit beschränkter Haftung\nBad Gandersheim\n\nDas Registergericht beabsichtigt, die Gesellschaft von Amts wegen nach § 394 FamFG zu löschen. Die Frist zur Erhebung eines Widerspruchs ist auf 1 Monat ab dieser Registerbekanntmachung festgesetzt."
    },
    {
      "date": "2025-05-28",
      "id": "110544",
      "original_text": "Löschungsankündigung\nNiedersachsen Amtsgericht Braunschweig HRB 207295\nResidenz Vitalpark UG (haftungsbeschränkt) – Bad Gandersheim",
      "type": "Löschungsankündigung",
      "state": "Niedersachsen",
      "amtsgericht": "Amtsgericht Braunschweig",
      "registernummer": "HRB 207295",
      "registerart": "HRB",
      "company_name": "Residenz Vitalpark UG (haftungsbeschränkt)",
      "company_seat": "Bad Gandersheim",
      "details": "28.05.2025 (Bekanntmachungsdatum)\n\nNiedersachsen Amtsgericht Braunschweig HRB 207295\nLöschungsankündigung 28.05.2025 (Eintragungsdatum)\n\nResidenz Vitalpark UG (haftungsbeschränkt)\nGesellschaft mit beschränkter Haftung\nBad Gandersheim\n\nDas Registergericht beabsichtigt, die Gesellschaft von Amts wegen nach § 394 FamFG zu löschen. Die Frist zur Erhebung eines Widerspruchs ist auf 1 Monat ab dieser Registerbekanntmachung festgesetzt."
    },
    {
      "date": "2025-05-28",
      "id": "110545",
      "original_text": "Einreichung neuer Dokumente\nNiedersachsen Amtsgericht Tostedt HRB 209716\nInnovationsagentur Nordostniedersachsen INNO.NON GmbH – Buchholz in der Nordheide",
      "type": "Einreichung neuer Dokumente",
      "state": "Niedersachsen",
      "amtsgericht": "Amtsgericht Tostedt",
      "registernummer": "HRB 209716",
      "registerart": "HRB",
      "company_name": "Innovationsagentur Nordostniedersachsen INNO.NON GmbH",
      "company_seat": "Buchholz in der Nordheide",
      "details": "28.05.2025 (Bekanntmachungsdatum)\n\nNiedersachsen Amtsgericht Tostedt HRB 209716\nEinreichung neuer Dokumente 28.05.2025 (Eintragungsdatum)\n\nInnovationsagentur Nordostniedersachsen INNO.NON GmbH\nGesellschaft mit beschränkter Haftung\nBuchholz in der Nordheide\n\nDie Liste der Mitglieder des Aufsichtsrats wurde beim Registergericht eingereicht."
    },
    {
      "date": "2025-05-28",
      "id": "110546",
      "original_text": "Löschungsankündigung\nNiedersachsen Amtsgericht Stadthagen HRB 341\nFriedrich Wilharm Garten- und Landschaftsbau GmbH – Niedernwöhren",
      "type": "Löschungsankündigung",
      "state": "Niedersachsen",
      "amtsgericht": "Amtsgericht Stadthagen",
      "registernummer": "HRB 341",
      "registerart": "HRB",
      "company_name": "Friedrich Wilharm Garten- und Landschaftsbau GmbH",
      "company_seat": "Niedernwöhren",
      "details": "28.05.2025 (Bekanntmachungsdatum)\n\nNiedersachsen Amtsgericht Stadthagen HRB 341\nLöschungsankündigung\n\nFriedrich Wilharm Garten- und Landschaftsbau GmbH\nGesellschaft mit beschränkter Haftung\nNiedernwöhren\n\nDas Registergericht beabsichtigt, die Gesellschaft von Amts wegen nach § 394 FamFG zu löschen. Die Frist zur Erhebung eines Widerspruchs ist auf 1 Monat ab dieser Registerbekanntmachung festgesetzt."
    },
    {
      "date": "2025-05-28",
      "id": "110547",
      "original_text": "Löschungsankündigung\nNiedersachsen Amtsgericht Braunschweig HRB 211289\nKelfie E-Trading UG (haftungsbeschränkt) – Braunschweig",
      "type": "Löschungsankündigung",
      "state": "Niedersachsen",
      "amtsgericht": "Amtsgericht Braunschweig",
      "registernummer": "HRB 211289",
      "registerart": "HRB",
      "company_name": "Kelfie E-Trading UG (haftungsbeschränkt)",
      "company_seat": "Braunschweig",
      "details": "28.05.2025 (Bekanntmachungsdatum)\n\nNiedersachsen Amtsgericht Braunschweig HRB 211289\nLöschungsankündigung 28.05.2025 (Eintragungsdatum)\n\nKelfie E-Trading UG (haftungsbeschränkt)\nGesellschaft mit beschränkter Haftung\nBraunschweig\n\nDas Registergericht beabsichtigt, die Gesellschaft von Amts wegen nach § 394 FamFG zu löschen. Die Frist zur Erhebung eines Widerspruchs ist auf 1 Monat ab dieser Registerbekanntmachung festgesetzt."
    },
    {
      "date": "2025-05-28",
      "id": "110548",
      "original_text": "Registerbekanntmachung nach dem Umwandlungsgesetz\nRheinland-Pfalz Amtsgericht Kaiserslautern HRB 34191\nMJP Holding GmbH – Lohnsfeld",
      "type": "Registerbekanntmachung nach dem Umwandlungsgesetz",
      "state": "Rheinland-Pfalz",
      "amtsgericht": "Amtsgericht Kaiserslautern",
      "registernummer": "HRB 34191",
      "registerart": "HRB",
      "company_name": "MJP Holding GmbH",
      "company_seat": "Lohnsfeld",
      "details": "28.05.2025 (Bekanntmachungsdatum)\n\nRheinland-Pfalz Amtsgericht Kaiserslautern HRB 34191\nRegisterbekanntmachung nach dem Umwandlungsgesetz 28.05.2025 (Eintragungsdatum)\n\nMJP Holding GmbH\nGesellschaft mit beschränkter Haftung\nLohnsfeld\n\nAls nicht eingetragen wird veröffentlicht:\nDen Gläubigern des formwechselnden Rechtsträgers ist, wenn sie binnen sechs Monaten nach dem Tag, an dem die Eintragung des Formwechsels nach § 201 UmwG als bekannt gemacht gilt, ihren Anspruch nach Grund und Höhe schriftlich anmelden, Sicherheit zu leisten, soweit sie nicht Befriedigung verlangen können. Dieses Recht steht den Gläubigern jedoch nur zu, wenn sie glaubhaft machen, dass durch den Formwechsel die Erfüllung der Forderung gefährdet wird. Gläubigern des bisherigen Rechtsträgers ist unter den Voraussetzungen der §§ 204, 22 UmwG Sicherheit zu leisten."
    },
    {
      "date": "2025-05-28",
      "id": "110549",
      "original_text": "Löschungsankündigung\nRheinland-Pfalz Amtsgericht Ludwigshafen a.Rhein (Ludwigshafen) HRB 67897\nOgni Abbruch UG (haftungsbeschränkt) – Altrip",
      "type": "Löschungsankündigung",
      "state": "Rheinland-Pfalz",
      "amtsgericht": "Amtsgericht Ludwigshafen a.Rhein (Ludwigshafen)",
      "registernummer": "HRB 67897",
      "registerart": "HRB",
      "company_name": "Ogni Abbruch UG (haftungsbeschränkt)",
      "company_seat": "Altrip",
      "details": "28.05.2025 (Bekanntmachungsdatum)\n\nRheinland-Pfalz Amtsgericht Ludwigshafen a.Rhein (Ludwigshafen) HRB 67897\nLöschungsankündigung\n\nOgni Abbruch UG (haftungsbeschränkt)\nGesellschaft mit beschränkter Haftung\nAltrip\n\nDas Registergericht beabsichtigt die Gesellschaft von Amts wegen nach § 394 FamFG zu löschen. Die Frist zur Erhebung eines Widerspruchs ist auf einen Monat festgesetzt."
    },
    {
      "date": "2025-05-28",
      "id": "110550",
      "original_text": "Registerbekanntmachung nach dem Umwandlungsgesetz\nRheinland-Pfalz Amtsgericht Kaiserslautern HRA 30859\nMT Pfalz-Landhandel GmbH & Co. KG – Enkenbach-Alsenborn",
      "type": "Registerbekanntmachung nach dem Umwandlungsgesetz",
      "state": "Rheinland-Pfalz",
      "amtsgericht": "Amtsgericht Kaiserslautern",
      "registernummer": "HRA 30859",
      "registerart": "HRA",
      "company_name": "MT Pfalz-Landhandel GmbH & Co. KG",
      "company_seat": "Enkenbach-Alsenborn",
      "details": "28.05.2025 (Bekanntmachungsdatum)\n\nRheinland-Pfalz Amtsgericht Kaiserslautern HRA 30859\nRegisterbekanntmachung nach dem Umwandlungsgesetz 28.05.2025 (Eintragungsdatum)\n\nMT Pfalz-Landhandel GmbH & Co. KG\nKommanditgesellschaft\nEnkenbach-Alsenborn\n\nAls nicht eingetragen wird veröffentlicht:\nDen Gläubigern des formwechselnden Rechtsträgers ist, wenn sie binnen sechs Monaten nach dem Tag, an dem die Eintragung des Formwechsels nach § 201 UmwG als bekannt gemacht gilt, ihren Anspruch nach Grund und Höhe schriftlich anmelden, Sicherheit zu leisten, soweit sie nicht Befriedigung verlangen können. Dieses Recht steht den Gläubigern jedoch nur zu, wenn sie glaubhaft machen, dass durch den Formwechsel die Erfüllung der Forderung gefährdet wird. Gläubigern des bisherigen Rechtsträgers ist unter den Voraussetzungen der §§ 204, 22 UmwG Sicherheit zu leisten."
    },
    {
      "date": "2025-05-28",
      "id": "110551",
      "original_text": "Registerbekanntmachung nach dem Umwandlungsgesetz\nBremen Amtsgericht Bremen HRB 41399\nPREIG Development GmbH – Bremerhaven",
      "type": "Registerbekanntmachung nach dem Umwandlungsgesetz",
      "state": "Bremen",
      "amtsgericht": "Amtsgericht Bremen",
      "registernummer": "HRB 41399",
      "registerart": "HRB",
      "company_name": "PREIG Development GmbH",
      "company_seat": "Bremerhaven",
      "details": "28.05.2025 (Bekanntmachungsdatum)\n\nBremen Amtsgericht Bremen HRB 41399\nRegisterbekanntmachung nach dem Umwandlungsgesetz 23.05.2025 (Eintragungsdatum)\n\nPREIG Development GmbH\nGesellschaft mit beschränkter Haftung\nBremerhaven\n\nZu Eintragungsnummer 2 vom 23.05.2025 wird als nicht eingetragen veröffentlicht: Den Gläubigern der an der Verschmelzung beteiligten Rechtsträger ist, wenn sie binnen sechs Monaten nach dem Tag, an dem die Eintragung der Verschmelzung in das Register des Sitzes desjenigen Rechtsträgers, dessen Gläubiger sie sind, als bekannt gemacht gilt, ihren Anspruch nach Grund und Höhe schriftlich anmelden, Sicherheit zu leisten, soweit sie nicht Befriedigung verlangen können. Dieses Recht steht den Gläubigern jedoch nur zu, wenn sie glaubhaft machen, dass durch die Verschmelzung die Erfüllung ihrer Forderung gefährdet wird. Das Recht, Sicherheitsleistung zu verlangen, steht Gläubigern nicht zu, die im Falle der Insolvenz ein Recht auf vorzugsweise Befriedigung aus einer Deckungsmasse haben, die nach gesetzlicher Vorschrift zu ihrem Schutz errichtet und staatlich überwacht ist."
    },
    {
      "date": "2025-05-28",
      "id": "110552",
      "original_text": "Registerbekanntmachung nach dem Umwandlungsgesetz\nBremen Amtsgericht Bremen HRB 41079\nPREIG-R GmbH – Bremerhaven",
      "type": "Registerbekanntmachung nach dem Umwandlungsgesetz",
      "state": "Bremen",
      "amtsgericht": "Amtsgericht Bremen",
      "registernummer": "HRB 41079",
      "registerart": "HRB",
      "company_name": "PREIG-R GmbH",
      "company_seat": "Bremerhaven",
      "details": "28.05.2025 (Bekanntmachungsdatum)\n\nBremen Amtsgericht Bremen HRB 41079\nRegisterbekanntmachung nach dem Umwandlungsgesetz 23.05.2025 (Eintragungsdatum)\n\nPREIG-R GmbH\nGesellschaft mit beschränkter Haftung\nBremerhaven\n\nZu Eintragungsnummer 3 vom 23.05.2025 wird als nicht eingetragen veröffentlicht: Den Gläubigern der an der Verschmelzung beteiligten Rechtsträger ist, wenn sie binnen sechs Monaten nach dem Tag, an dem die Eintragung der Verschmelzung in das Register des Sitzes desjenigen Rechtsträgers, dessen Gläubiger sie sind, als bekannt gemacht gilt, ihren Anspruch nach Grund und Höhe schriftlich anmelden, Sicherheit zu leisten, soweit sie nicht Befriedigung verlangen können. Dieses Recht steht den Gläubigern jedoch nur zu, wenn sie glaubhaft machen, dass durch die Verschmelzung die Erfüllung ihrer Forderung gefährdet wird. Das Recht, Sicherheitsleistung zu verlangen, steht Gläubigern nicht zu, die im Falle der Insolvenz ein Recht auf vorzugsweise Befriedigung aus einer Deckungsmasse haben, die nach gesetzlicher Vorschrift zu ihrem Schutz errichtet und staatlich überwacht ist."
    },
    {
      "date": "2025-05-28",
      "id": "110553",
      "original_text": "Löschungsankündigung\nRheinland-Pfalz Amtsgericht Montabaur HRB 24008\nKDC-Neuwied UG (haftungsbeschränkt) – Neuwied",
      "type": "Löschungsankündigung",
      "state": "Rheinland-Pfalz",
      "amtsgericht": "Amtsgericht Montabaur",
      "registernummer": "HRB 24008",
      "registerart": "HRB",
      "company_name": "KDC-Neuwied UG (haftungsbeschränkt)",
      "company_seat": "Neuwied",
      "details": "28.05.2025 (Bekanntmachungsdatum)\n\nRheinland-Pfalz Amtsgericht Montabaur HRB 24008\nLöschungsankündigung\n\nKDC-Neuwied UG (haftungsbeschränkt)\nGesellschaft mit beschränkter Haftung\nNeuwied\n\nDas Registergericht beabsichtigt die Gesellschaft von Amts wegen nach § 394 FamFG zu löschen. Die Frist zur Erhebung eines Widerspruchs ist auf 1 Monat festgesetzt."
    },
    {
      "date": "2025-05-28",
      "id": "110554",
      "original_text": "Registerbekanntmachung nach dem Umwandlungsgesetz\nNordrhein-Westfalen Amtsgericht Münster HRB 17566\nPawlaczyk Asset GmbH – Münster",
      "type": "Registerbekanntmachung nach dem Umwandlungsgesetz",
      "state": "Nordrhein-Westfalen",
      "amtsgericht": "Amtsgericht Münster",
      "registernummer": "HRB 17566",
      "registerart": "HRB",
      "company_name": "Pawlaczyk Asset GmbH",
      "company_seat": "Münster",
      "details": "28.05.2025 (Bekanntmachungsdatum)\n\nNordrhein-Westfalen Amtsgericht Münster HRB 17566\nRegisterbekanntmachung nach dem Umwandlungsgesetz 28.05.2025 (Eintragungsdatum)\n\nPawlaczyk Asset GmbH\nGesellschaft mit beschränkter Haftung\nMünster\n\nDen Gläubigern der an der Verschmelzung beteiligten Rechtsträger ist, wenn sie binnen sechs Monaten nach dem Tag, an dem die Eintragung der Verschmelzung in das Register des Sitzes desjenigen Rechtsträgers, dessen Gläubiger sie sind, nach § 19 Absatz 3 UmwG als bekanntgemacht gilt, ihren Anspruch nach Grund und Höhe schriftlich anmelden, Sicherheit zu leisten, soweit sie nicht Befriedigung verlangen können. Dieses Recht steht den Gläubigern jedoch nur zu, wenn sie glaubhaft machen, dass durch die Verschmelzung die Erfüllung ihrer Forderung gefährdet wird."
    },
    {
      "date": "2025-05-28",
      "id": "110555",
      "original_text": "Registerbekanntmachung nach dem Umwandlungsgesetz\nNordrhein-Westfalen Amtsgericht Krefeld HRB 14680\nAuto Schelges GmbH – Willich",
      "type": "Registerbekanntmachung nach dem Umwandlungsgesetz",
      "state": "Nordrhein-Westfalen",
      "amtsgericht": "Amtsgericht Krefeld",
      "registernummer": "HRB 14680",
      "registerart": "HRB",
      "company_name": "Auto Schelges GmbH",
      "company_seat": "Willich",
      "details": "28.05.2025 (Bekanntmachungsdatum)\n\nNordrhein-Westfalen Amtsgericht Krefeld HRB 14680\nRegisterbekanntmachung nach dem Umwandlungsgesetz 28.05.2025 (Eintragungsdatum)\n\nAuto Schelges GmbH\nGesellschaft mit beschränkter Haftung\nWillich\n\nDen Gläubigern der an der Verschmelzung beteiligten Rechtsträger ist, wenn sie binnen sechs Monaten nach dem Tag, an dem die Eintragung der Verschmelzung in das Register des Sitzes desjenigen Rechtsträgers, dessen Gläubiger sie sind, nach § 19 Absatz 3 UmwG als bekanntgemacht gilt, ihren Anspruch nach Grund und Höhe schriftlich anmelden, Sicherheit zu leisten, soweit sie nicht Befriedigung verlangen können. Dieses Recht steht den Gläubigern jedoch nur zu, wenn sie glaubhaft machen, dass durch die Verschmelzung die Erfüllung ihrer Forderung gefährdet wird."
    },
    {
      "date": "2025-05-28",
      "id": "110556",
      "original_text": "Löschungsankündigung\nNordrhein-Westfalen Amtsgericht Hamm HRB 9667\nAKD GmbH – Kamen",
      "type": "Löschungsankündigung",
      "state": "Nordrhein-Westfalen",
      "amtsgericht": "Amtsgericht Hamm",
      "registernummer": "HRB 9667",
      "registerart": "HRB",
      "company_name": "AKD GmbH",
      "company_seat": "Kamen",
      "details": "28.05.2025 (Bekanntmachungsdatum)\n\nNordrhein-Westfalen Amtsgericht Hamm HRB 9667\nLöschungsankündigung\n\nAKD GmbH\nGesellschaft mit beschränkter Haftung\nKamen\n\nDas Registergericht beabsichtigt die Gesellschaft von Amts wegen nach § 394 FamFG zu löschen. Die Frist zur Erhebung eines Widerspruchs ist auf drei Monate festgesetzt."
    },
    {
      "date": "2025-05-28",
      "id": "110557",
      "original_text": "Registerbekanntmachung nach dem Umwandlungsgesetz\nNordrhein-Westfalen Amtsgericht Köln HRB 33540\nRocking Share GmbH – Köln",
      "type": "Registerbekanntmachung nach dem Umwandlungsgesetz",
      "state": "Nordrhein-Westfalen",
      "amtsgericht": "Amtsgericht Köln",
      "registernummer": "HRB 33540",
      "registerart": "HRB",
      "company_name": "Rocking Share GmbH",
      "company_seat": "Köln",
      "details": "28.05.2025 (Bekanntmachungsdatum)\n\nNordrhein-Westfalen Amtsgericht Köln HRB 33540\nRegisterbekanntmachung nach dem Umwandlungsgesetz 28.05.2025 (Eintragungsdatum)\n\nRocking Share GmbH\nGesellschaft mit beschränkter Haftung\nKöln\n\nDen Gläubigern der an der Verschmelzung beteiligten Rechtsträger ist, wenn sie binnen sechs Monaten nach dem Tag, an dem die Eintragung der Verschmelzung in das Register des Sitzes desjenigen Rechtsträgers, dessen Gläubiger sie sind, nach § 19 Absatz 3 UmwG als bekanntgemacht gilt, ihren Anspruch nach Grund und Höhe schriftlich anmelden, Sicherheit zu leisten, soweit sie nicht Befriedigung verlangen können. Dieses Recht steht den Gläubigern jedoch nur zu, wenn sie glaubhaft machen, dass durch die Verschmelzung die Erfüllung ihrer Forderung gefährdet wird."
    },
    {
      "date": "2025-05-28",
      "id": "110558",
      "original_text": "Löschungsankündigung\nNordrhein-Westfalen Amtsgericht Siegen HRB 13649\nCOINHELP UG (haftungsbeschränkt) – Attendorn",
      "type": "Löschungsankündigung",
      "state": "Nordrhein-Westfalen",
      "amtsgericht": "Amtsgericht Siegen",
      "registernummer": "HRB 13649",
      "registerart": "HRB",
      "company_name": "COINHELP UG (haftungsbeschränkt)",
      "company_seat": "Attendorn",
      "details": "28.05.2025 (Bekanntmachungsdatum)\n\nNordrhein-Westfalen Amtsgericht Siegen HRB 13649\nLöschungsankündigung\n\nCOINHELP UG (haftungsbeschränkt)\nGesellschaft mit beschränkter Haftung\nAttendorn\n\nDas Registergericht beabsichtigt die Gesellschaft von Amts wegen nach § 394 FamFG zu löschen. Die Frist zur Erhebung eines Widerspruchs ist auf drei Monate festgesetzt."
    },
    {
      "date": "2025-05-28",
      "id": "110559",
      "original_text": "Einreichung neuer Dokumente\nNordrhein-Westfalen Amtsgericht Köln HRB 82367\nNational Express Rail GmbH – Köln",
      "type": "Einreichung neuer Dokumente",
      "state": "Nordrhein-Westfalen",
      "amtsgericht": "Amtsgericht Köln",
      "registernummer": "HRB 82367",
      "registerart": "HRB",
      "company_name": "National Express Rail GmbH",
      "company_seat": "Köln",
      "details": "28.05.2025 (Bekanntmachungsdatum)\n\nNordrhein-Westfalen Amtsgericht Köln HRB 82367\nEinreichung neuer Dokumente\n\nNational Express Rail GmbH\nGesellschaft mit beschränkter Haftung\nKöln\n\nDem Registergericht ist eine Liste der Mitglieder des Aufsichtsrates eingereicht worden."
    },
    {
      "date": "2025-05-28",
      "id": "110560",
      "original_text": "Sonstige Registerbekanntmachung\nNordrhein-Westfalen Amtsgericht Mönchengladbach HRB 17821\nO-G ENERGIE UG (haftungsbeschränkt) – Viersen",
      "type": "Sonstige Registerbekanntmachung",
      "state": "Nordrhein-Westfalen",
      "amtsgericht": "Amtsgericht Mönchengladbach",
      "registernummer": "HRB 17821",
      "registerart": "HRB",
      "company_name": "O-G ENERGIE UG (haftungsbeschränkt)",
      "company_seat": "Viersen",
      "details": "28.05.2025 (Bekanntmachungsdatum)\n\nNordrhein-Westfalen Amtsgericht Mönchengladbach HRB 17821\nSonstige Registerbekanntmachung 28.05.2025 (Eintragungsdatum)\n\nO-G ENERGIE UG (haftungsbeschränkt)\nGesellschaft mit beschränkter Haftung\nViersen\n\nAls nicht eingetragen wird veröffentlicht: Den Gläubigern der Gesellschaft, deren Forderungen begründet worden sind bevor die Eintragung der Beendigung des Beherrschungs- und Gewinnabführungsvertrages  in das Handelsregister nach § 10 des Handelsgesetzbuches als bekanntgemacht gilt, hat der andere Vertragsteil Sicherheit zu leisten, wenn sie sich binnen sechs Monaten nach der Bekanntmachung der Eintragung zu diesem Zweck bei ihm melden."
    },
    {
      "date": "2025-05-28",
      "id": "110561",
      "original_text": "Löschungsankündigung\nNordrhein-Westfalen Amtsgericht Hagen HRB 13277\nMy Cleaning Team GmbH – Hagen",
      "type": "Löschungsankündigung",
      "state": "Nordrhein-Westfalen",
      "amtsgericht": "Amtsgericht Hagen",
      "registernummer": "HRB 13277",
      "registerart": "HRB",
      "company_name": "My Cleaning Team GmbH",
      "company_seat": "Hagen",
      "details": "28.05.2025 (Bekanntmachungsdatum)\n\nNordrhein-Westfalen Amtsgericht Hagen HRB 13277\nLöschungsankündigung\n\nMy Cleaning Team GmbH\nGesellschaft mit beschränkter Haftung\nHagen\n\nDas Registergericht beabsichtigt, die im Handelsregister eingetragene Gesellschaft gemäß § 394 Absatz 1 FamFG wegen Vermögenslosigkeit von Amts wegen zu löschen.  Gegen diese Verfügung kann Widerspruch eingelegt werden. Die Frist zur Erhebung eines Widerspruchs gegen die beabsichtigte Löschung von Amts wegen ist auf drei Monate festgesetzt.\n\nRechtsbehelfsbelehrung:\nGegen diese Verfügung können Sie Widerspruch einlegen.\n\nDer Widerspruch ist bei dem Amtsgericht Hagen, Heinitzstraße 42, 58097 Hagen schriftlich in deutscher Sprache oder zur Niederschrift der Geschäftsstelle einzulegen. Der Widerspruch kann auch zur Niederschrift der Geschäftsstelle eines jeden Amtsgerichtes abgegeben werden.\n\nDer Widerspruch muss spätestens innerhalb der gesetzten Frist bei dem Amtsgericht Hagen eingegangen sein. Dies gilt auch dann, wenn der Widerspruch zur Niederschrift der Geschäftsstelle eines anderen Amtsgerichtes abgegeben wurde. Die Frist beginnt mit der Veröffentlichung. Fällt das Ende der Frist auf einen Sonntag, einen allgemeinen Feiertag oder Sonnabend, so endet die Frist mit Ablauf des nächsten Werktages.\n\nDer Widerspruch muss die Bezeichnung der angefochtenen Verfügung sowie die Erklärung enthalten, dass Widerspruch gegen diese Verfügung eingelegt wird. Er ist zu unterzeichnen und soll begründet werden."
    },
    {
      "date": "2025-05-28",
      "id": "110562",
      "original_text": "Registerbekanntmachung nach dem Umwandlungsgesetz\nNordrhein-Westfalen Amtsgericht Düsseldorf HRB 56501\nPCS Vertriebs- und Service GmbH – Düsseldorf",
      "type": "Registerbekanntmachung nach dem Umwandlungsgesetz",
      "state": "Nordrhein-Westfalen",
      "amtsgericht": "Amtsgericht Düsseldorf",
      "registernummer": "HRB 56501",
      "registerart": "HRB",
      "company_name": "PCS Vertriebs- und Service GmbH",
      "company_seat": "Düsseldorf",
      "details": "28.05.2025 (Bekanntmachungsdatum)\n\nNordrhein-Westfalen Amtsgericht Düsseldorf HRB 56501\nRegisterbekanntmachung nach dem Umwandlungsgesetz 28.05.2025 (Eintragungsdatum)\n\nPCS Vertriebs- und Service GmbH\nGesellschaft mit beschränkter Haftung\nDüsseldorf\n\nDen Gläubigern der an der Verschmelzung beteiligten Rechtsträger ist, wenn sie binnen sechs Monaten nach dem Tag, an dem die Eintragung der Verschmelzung in das Register des Sitzes desjenigen Rechtsträgers, dessen Gläubiger sie sind, nach § 19 Absatz 3 UmwG als bekanntgemacht gilt, ihren Anspruch nach Grund und Höhe schriftlich anmelden, Sicherheit zu leisten, soweit sie nicht Befriedigung verlangen können. Dieses Recht steht den Gläubigern jedoch nur zu, wenn sie glaubhaft machen, dass durch die Verschmelzung die Erfüllung ihrer Forderung gefährdet wird."
    },
    {
      "date": "2025-05-28",
      "id": "110563",
      "original_text": "Einreichung neuer Dokumente\nNordrhein-Westfalen Amtsgericht Köln HRB 43547\nStadtwerke Wesseling GmbH – Wesseling",
      "type": "Einreichung neuer Dokumente",
      "state": "Nordrhein-Westfalen",
      "amtsgericht": "Amtsgericht Köln",
      "registernummer": "HRB 43547",
      "registerart": "HRB",
      "company_name": "Stadtwerke Wesseling GmbH",
      "company_seat": "Wesseling",
      "details": "28.05.2025 (Bekanntmachungsdatum)\n\nNordrhein-Westfalen Amtsgericht Köln HRB 43547\nEinreichung neuer Dokumente 28.05.2025 (Eintragungsdatum)\n\nStadtwerke Wesseling GmbH\nGesellschaft mit beschränkter Haftung\nWesseling\n\nDem Registergericht ist eine Liste der Mitglieder des Aufsichtsrates eingereicht worden."
    },
    {
      "date": "2025-05-28",
      "id": "110564",
      "original_text": "Sonstige Registerbekanntmachung\nNordrhein-Westfalen Amtsgericht Steinfurt HRB 4040\napetito Aktiengesellschaft – Rheine",
      "type": "Sonstige Registerbekanntmachung",
      "state": "Nordrhein-Westfalen",
      "amtsgericht": "Amtsgericht Steinfurt",
      "registernummer": "HRB 4040",
      "registerart": "HRB",
      "company_name": "apetito Aktiengesellschaft",
      "company_seat": "Rheine",
      "details": "28.05.2025 (Bekanntmachungsdatum)\n\nNordrhein-Westfalen Amtsgericht Steinfurt HRB 4040\nSonstige Registerbekanntmachung 28.05.2025 (Eintragungsdatum)\n\napetito Aktiengesellschaft\nAktiengesellschaft\nRheine\n\nDem Registergericht ist eine Liste der Mitglieder des Aufsichtsrates eingereicht worden."
    },
    {
      "date": "2025-05-28",
      "id": "110565",
      "original_text": "Registerbekanntmachung nach dem Umwandlungsgesetz\nNordrhein-Westfalen Amtsgericht Köln HRB 94364\nIXPI GmbH – Köln",
      "type": "Registerbekanntmachung nach dem Umwandlungsgesetz",
      "state": "Nordrhein-Westfalen",
      "amtsgericht": "Amtsgericht Köln",
      "registernummer": "HRB 94364",
      "registerart": "HRB",
      "company_name": "IXPI GmbH",
      "company_seat": "Köln",
      "details": "28.05.2025 (Bekanntmachungsdatum)\n\nNordrhein-Westfalen Amtsgericht Köln HRB 94364\nRegisterbekanntmachung nach dem Umwandlungsgesetz 28.05.2025 (Eintragungsdatum)\n\nIXPI GmbH\nGesellschaft mit beschränkter Haftung\nKöln\n\nDen Gläubigern der an der Verschmelzung beteiligten Rechtsträger ist, wenn sie binnen sechs Monaten nach dem Tag, an dem die Eintragung der Verschmelzung in das Register des Sitzes desjenigen Rechtsträgers, dessen Gläubiger sie sind, nach § 19 Absatz 3 UmwG als bekanntgemacht gilt, ihren Anspruch nach Grund und Höhe schriftlich anmelden, Sicherheit zu leisten, soweit sie nicht Befriedigung verlangen können. Dieses Recht steht den Gläubigern jedoch nur zu, wenn sie glaubhaft machen, dass durch die Verschmelzung die Erfüllung ihrer Forderung gefährdet wird."
    },
    {
      "date": "2025-05-28",
      "id": "110566",
      "original_text": "Registerbekanntmachung nach dem Umwandlungsgesetz\nNordrhein-Westfalen Amtsgericht Hagen HRB 13415\nHADItec GmbH – Gevelsberg",
      "type": "Registerbekanntmachung nach dem Umwandlungsgesetz",
      "state": "Nordrhein-Westfalen",
      "amtsgericht": "Amtsgericht Hagen",
      "registernummer": "HRB 13415",
      "registerart": "HRB",
      "company_name": "HADItec GmbH",
      "company_seat": "Gevelsberg",
      "details": "28.05.2025 (Bekanntmachungsdatum)\n\nNordrhein-Westfalen Amtsgericht Hagen HRB 13415\nRegisterbekanntmachung nach dem Umwandlungsgesetz 27.05.2025 (Eintragungsdatum)\n\nHADItec GmbH\nGesellschaft mit beschränkter Haftung\nGevelsberg\n\nDen Gläubigern der an der Spaltung beteiligten Rechtsträger ist, wenn sie binnen sechs Monaten nach dem Tag, an dem die Eintragung der Spaltung in das Register des Sitzes desjenigen Rechtsträgers, dessen Gläubiger sie sind, nach § 19 Absatz 3 UmwG als bekanntgemacht gilt, ihren Anspruch nach Grund und Höhe schriftlich anmelden, Sicherheit zu leisten, soweit sie nicht Befriedigung verlangen können. Dieses Recht steht den Gläubigern jedoch nur zu, wenn sie glaubhaft machen, dass durch die Abspaltung die Erfüllung ihrer Forderung gefährdet wird."
    },
    {
      "date": "2025-05-28",
      "id": "110567",
      "original_text": "Löschungsankündigung\nNordrhein-Westfalen Amtsgericht Hamm HRB 6160\nStork Bau GmbH – Hamm",
      "type": "Löschungsankündigung",
      "state": "Nordrhein-Westfalen",
      "amtsgericht": "Amtsgericht Hamm",
      "registernummer": "HRB 6160",
      "registerart": "HRB",
      "company_name": "Stork Bau GmbH",
      "company_seat": "Hamm",
      "details": "28.05.2025 (Bekanntmachungsdatum)\n\nNordrhein-Westfalen Amtsgericht Hamm HRB 6160\nLöschungsankündigung\n\nStork Bau GmbH\nGesellschaft mit beschränkter Haftung\nHamm\n\nDas Registergericht beabsichtigt die Gesellschaft von Amts wegen nach § 394 FamFG zu löschen. Die Frist zur Erhebung eines Widerspruchs ist auf drei Monate festgesetzt."
    },
    {
      "date": "2025-05-28",
      "id": "110568",
      "original_text": "Einreichung neuer Dokumente\nNordrhein-Westfalen Amtsgericht Köln HRB 62211\nBarmenia.Gothaer Finanzholding Aktiengesellschaft – Köln",
      "type": "Einreichung neuer Dokumente",
      "state": "Nordrhein-Westfalen",
      "amtsgericht": "Amtsgericht Köln",
      "registernummer": "HRB 62211",
      "registerart": "HRB",
      "company_name": "Barmenia.Gothaer Finanzholding Aktiengesellschaft",
      "company_seat": "Köln",
      "details": "28.05.2025 (Bekanntmachungsdatum)\n\nNordrhein-Westfalen Amtsgericht Köln HRB 62211\nEinreichung neuer Dokumente\n\nBarmenia.Gothaer Finanzholding Aktiengesellschaft\nAktiengesellschaft\nKöln\n\nDem Registergericht ist eine neue Liste der Mitglieder des Aufsichtsrates eingereicht worden."
    },
    {
      "date": "2025-05-28",
      "id": "110569",
      "original_text": "Registerbekanntmachung nach dem Umwandlungsgesetz\nNordrhein-Westfalen Amtsgericht Düsseldorf HRA 24882\nCASSIUS BASTEI Objekt SARL & Co. KG – Düsseldorf",
      "type": "Registerbekanntmachung nach dem Umwandlungsgesetz",
      "state": "Nordrhein-Westfalen",
      "amtsgericht": "Amtsgericht Düsseldorf",
      "registernummer": "HRA 24882",
      "registerart": "HRA",
      "company_name": "CASSIUS BASTEI Objekt SARL & Co. KG",
      "company_seat": "Düsseldorf",
      "details": "28.05.2025 (Bekanntmachungsdatum)\n\nNordrhein-Westfalen Amtsgericht Düsseldorf HRA 24882\nRegisterbekanntmachung nach dem Umwandlungsgesetz\n\nCASSIUS BASTEI Objekt SARL & Co. KG\nKommanditgesellschaft\nDüsseldorf\n\nEs wird darauf hingewiesen, dass ein Entwurf des Formwechselplans vom 16.05.2025 über einen grenzüberschreitenden vollständigen Formwechsel der bisher binationalen Kommanditgesellschaft CASSIUS BASTEI Objekt SARL & Co. KG mit Sitz in Düsseldorf (Amtsgericht Düsseldorf, HRA 24882) in die CASSIUS BASTEI Objekt SCS (société en commandite simple) mit Sitz in Luxemburg, Großherzogtum Luxemburg (Registre de Commerce et des Sociétés de Luxembourg, B290920) beim Handelsregister eingereicht worden ist. Die Anteilsinhaber, die Gläubiger, sowie die zuständigen Betriebsräte der an dem grenzüberschreitenden Formwechsel beteiligten Gesellschaft oder, soweit es keinen Betriebsrat gibt, die Arbeitnehmer der an dem grenzüberschreitenden Formwechsel beteiligten Gesellschaft, können der Gesellschaft spätestens fünf Arbeitstage vor dem Tag der Gesellschafterversammlung Bemerkungen zum Formwechselplan übermitteln."
    },
    {
      "date": "2025-05-28",
      "id": "110570",
      "original_text": "Löschungsankündigung\nNordrhein-Westfalen Amtsgericht Hamm HRB 8979\nFlamingo Grundbesitz GmbH – Hamm",
      "type": "Löschungsankündigung",
      "state": "Nordrhein-Westfalen",
      "amtsgericht": "Amtsgericht Hamm",
      "registernummer": "HRB 8979",
      "registerart": "HRB",
      "company_name": "Flamingo Grundbesitz GmbH",
      "company_seat": "Hamm",
      "details": "28.05.2025 (Bekanntmachungsdatum)\n\nNordrhein-Westfalen Amtsgericht Hamm HRB 8979\nLöschungsankündigung\n\nFlamingo Grundbesitz GmbH\nGesellschaft mit beschränkter Haftung\nHamm\n\nDas Registergericht beabsichtigt die Gesellschaft von Amts wegen nach § 394 FamFG zu löschen. Die Frist zur Erhebung eines Widerspruchs ist auf drei Monate festgesetzt."
    },
    {
      "date": "2025-05-28",
      "id": "110571",
      "original_text": "Registerbekanntmachung nach dem Umwandlungsgesetz\nNordrhein-Westfalen Amtsgericht Düsseldorf HRA 27608\nPaxos Braunschweig SARL & Co. KG – Düsseldorf",
      "type": "Registerbekanntmachung nach dem Umwandlungsgesetz",
      "state": "Nordrhein-Westfalen",
      "amtsgericht": "Amtsgericht Düsseldorf",
      "registernummer": "HRA 27608",
      "registerart": "HRA",
      "company_name": "Paxos Braunschweig SARL & Co. KG",
      "company_seat": "Düsseldorf",
      "details": "28.05.2025 (Bekanntmachungsdatum)\n\nNordrhein-Westfalen Amtsgericht Düsseldorf HRA 27608\nRegisterbekanntmachung nach dem Umwandlungsgesetz\n\nPaxos Braunschweig SARL & Co. KG\nKommanditgesellschaft\nDüsseldorf\n\nEs wird darauf hingewiesen, dass ein Entwurf des Formwechselplans vom 16.05.2025 über einen grenzüberschreitenden vollständigen Formwechsel der bisher binationalen Kommanditgesellschaft Paxos Braunschweig SARL & Co. KG mit Sitz in Düsseldorf (Amtsgericht Düsseldorf, HRA 26808)  in die Firma Paxos Braunschweig SCS (société en commandite simple) mit Sitz in Luxemburg, Großherzogtum Luxemburg, (Registre de Commerce et des Sociétés de Luxembourg, B293845) beim Handelsregister eingereicht worden ist.\nDie Anteilsinhaber, die Gläubiger, sowie die zuständigen Betriebsräte der an dem grenzüberschreitenden Formwechsel beteiligten Gesellschaft oder, soweit es keinen Betriebsrat gibt, die Arbeitnehmer der an dem grenzüberschreitenden Formwechsel beteiligten Gesellschaft, können der Gesellschaft spätestens fünf Arbeitstage vor dem Tag der Gesellschafterversammlung Bemerkungen zum Formwechselplan übermitteln."
    },
    {
      "date": "2025-05-28",
      "id": "110572",
      "original_text": "Löschungsankündigung\nNordrhein-Westfalen Amtsgericht Hamm HRB 9712\nK&H Schaustellerbetrieb UG (haftungsbeschränkt) – Hamm",
      "type": "Löschungsankündigung",
      "state": "Nordrhein-Westfalen",
      "amtsgericht": "Amtsgericht Hamm",
      "registernummer": "HRB 9712",
      "registerart": "HRB",
      "company_name": "K&H Schaustellerbetrieb UG (haftungsbeschränkt)",
      "company_seat": "Hamm",
      "details": "28.05.2025 (Bekanntmachungsdatum)\n\nNordrhein-Westfalen Amtsgericht Hamm HRB 9712\nLöschungsankündigung\n\nK&H Schaustellerbetrieb UG (haftungsbeschränkt)\nGesellschaft mit beschränkter Haftung\nHamm\n\nDas Registergericht beabsichtigt die Gesellschaft von Amts wegen nach § 394 FamFG zu löschen. Die Frist zur Erhebung eines Widerspruchs ist auf drei Monate festgesetzt."
    },
    {
      "date": "2025-05-28",
      "id": "110573",
      "original_text": "Registerbekanntmachung nach dem Umwandlungsgesetz\nNordrhein-Westfalen Amtsgericht Düsseldorf HRB 68506\nPAMAC Vermögensverwaltung GmbH – Düsseldorf",
      "type": "Registerbekanntmachung nach dem Umwandlungsgesetz",
      "state": "Nordrhein-Westfalen",
      "amtsgericht": "Amtsgericht Düsseldorf",
      "registernummer": "HRB 68506",
      "registerart": "HRB",
      "company_name": "PAMAC Vermögensverwaltung GmbH",
      "company_seat": "Düsseldorf",
      "details": "28.05.2025 (Bekanntmachungsdatum)\n\nNordrhein-Westfalen Amtsgericht Düsseldorf HRB 68506\nRegisterbekanntmachung nach dem Umwandlungsgesetz 28.05.2025 (Eintragungsdatum)\n\nPAMAC Vermögensverwaltung GmbH\nGesellschaft mit beschränkter Haftung\nDüsseldorf\n\nDen Gläubigern der an der Verschmelzung beteiligten Rechtsträger ist, wenn sie binnen sechs Monaten nach dem Tag, an dem die Eintragung der Verschmelzung in das Register des Sitzes desjenigen Rechtsträgers, dessen Gläubiger sie sind, nach § 19 Absatz 3 UmwG als bekanntgemacht gilt, ihren Anspruch nach Grund und Höhe schriftlich anmelden, Sicherheit zu leisten, soweit sie nicht Befriedigung verlangen können. Dieses Recht steht den Gläubigern jedoch nur zu, wenn sie glaubhaft machen, dass durch die Verschmelzung die Erfüllung ihrer Forderung gefährdet wird."
    },
    {
      "date": "2025-05-28",
      "id": "110574",
      "original_text": "Registerbekanntmachung nach dem Umwandlungsgesetz\nNordrhein-Westfalen Amtsgericht Düsseldorf HRA 26808\nKELIOS Grundstücks SARL & Co. KG – Düsseldorf",
      "type": "Registerbekanntmachung nach dem Umwandlungsgesetz",
      "state": "Nordrhein-Westfalen",
      "amtsgericht": "Amtsgericht Düsseldorf",
      "registernummer": "HRA 26808",
      "registerart": "HRA",
      "company_name": "KELIOS Grundstücks SARL & Co. KG",
      "company_seat": "Düsseldorf",
      "details": "28.05.2025 (Bekanntmachungsdatum)\n\nNordrhein-Westfalen Amtsgericht Düsseldorf HRA 26808\nRegisterbekanntmachung nach dem Umwandlungsgesetz\n\nKELIOS Grundstücks SARL & Co. KG\nKommanditgesellschaft\nDüsseldorf\n\nEs wird darauf hingewiesen, dass ein Entwurf des Formwechselplans vom 16.05.2025 über einen grenzüberschreitenden vollständigen Formwechsel der bisher binationalen Kommanditgesellschaft KELIOS Grundstücks SARL & Co. KG mit Sitz in Düsseldorf (Amtsgericht Düsseldorf, HRA 26808)  in die Firma KELIOS Grundstücks SCS (société en commandite simple) mit Sitz in Luxemburg, Großherzogtum Luxemburg, (Registre de Commerce et des Sociétés de Luxembourg, B290058) beim Handelsregister eingereicht worden ist.\nDie Anteilsinhaber, die Gläubiger, sowie die zuständigen Betriebsräte der an dem grenzüberschreitenden Formwechsel beteiligten Gesellschaft oder, soweit es keinen Betriebsrat gibt, die Arbeitnehmer der an dem grenzüberschreitenden Formwechsel beteiligten Gesellschaft, können der Gesellschaft spätestens fünf Arbeitstage vor dem Tag der Gesellschafterversammlung Bemerkungen zum Formwechselplan übermitteln."
    },
    {
      "date": "2025-05-28",
      "id": "110575",
      "original_text": "Einreichung neuer Dokumente\nNordrhein-Westfalen Amtsgericht Düsseldorf HRB 41790\nOEV Online Dienste GmbH – Düsseldorf",
      "type": "Einreichung neuer Dokumente",
      "state": "Nordrhein-Westfalen",
      "amtsgericht": "Amtsgericht Düsseldorf",
      "registernummer": "HRB 41790",
      "registerart": "HRB",
      "company_name": "OEV Online Dienste GmbH",
      "company_seat": "Düsseldorf",
      "details": "28.05.2025 (Bekanntmachungsdatum)\n\nNordrhein-Westfalen Amtsgericht Düsseldorf HRB 41790\nEinreichung neuer Dokumente\n\nOEV Online Dienste GmbH\nGesellschaft mit beschränkter Haftung\nDüsseldorf\n\nDem Registergericht ist eine neue Liste der Mitglieder des Aufsichtsrates eingereicht worden."
    },
    {
      "date": "2025-05-28",
      "id": "110576",
      "original_text": "Registerbekanntmachung nach dem Umwandlungsgesetz\nNordrhein-Westfalen Amtsgericht Steinfurt HRB 13881\nSixtus GmbH – Greven",
      "type": "Registerbekanntmachung nach dem Umwandlungsgesetz",
      "state": "Nordrhein-Westfalen",
      "amtsgericht": "Amtsgericht Steinfurt",
      "registernummer": "HRB 13881",
      "registerart": "HRB",
      "company_name": "Sixtus GmbH",
      "company_seat": "Greven",
      "details": "28.05.2025 (Bekanntmachungsdatum)\n\nNordrhein-Westfalen Amtsgericht Steinfurt HRB 13881\nRegisterbekanntmachung nach dem Umwandlungsgesetz 28.05.2025 (Eintragungsdatum)\n\nSixtus GmbH\nGesellschaft mit beschränkter Haftung\nGreven\n\nDen Gläubigern der an der Verschmelzung beteiligten Rechtsträger ist, wenn sie binnen sechs Monaten nach dem Tag, an dem die Eintragung der Verschmelzung in das Register des Sitzes desjenigen Rechtsträgers, dessen Gläubiger sie sind, nach § 19 Absatz 3 UmwG als bekanntgemacht gilt, ihren Anspruch nach Grund und Höhe schriftlich anmelden, Sicherheit zu leisten, soweit sie nicht Befriedigung verlangen können. Dieses Recht steht den Gläubigern jedoch nur zu, wenn sie glaubhaft machen, dass durch die Verschmelzung die Erfüllung ihrer Forderung gefährdet wird."
    },
    {
      "date": "2025-05-28",
      "id": "110577",
      "original_text": "Registerbekanntmachung nach dem Umwandlungsgesetz\nNordrhein-Westfalen Amtsgericht Düsseldorf HRA 25453\nTausendfensterhaus Objekt SARL & Co. KG – Düsseldorf",
      "type": "Registerbekanntmachung nach dem Umwandlungsgesetz",
      "state": "Nordrhein-Westfalen",
      "amtsgericht": "Amtsgericht Düsseldorf",
      "registernummer": "HRA 25453",
      "registerart": "HRA",
      "company_name": "Tausendfensterhaus Objekt SARL & Co. KG",
      "company_seat": "Düsseldorf",
      "details": "28.05.2025 (Bekanntmachungsdatum)\n\nNordrhein-Westfalen Amtsgericht Düsseldorf HRA 25453\nRegisterbekanntmachung nach dem Umwandlungsgesetz\n\nTausendfensterhaus Objekt SARL & Co. KG\nKommanditgesellschaft\nDüsseldorf\n\nEs wird darauf hingewiesen, dass ein Entwurf des Formwechselplans vom 16.05.2025 über einen grenzüberschreitenden vollständigen Formwechsel der bisher binationalen Kommanditgesellschaft Tausendfensterhaus Objekt SARL & Co. KG mit Sitz in Düsseldorf (Amtsgericht Düsseldorf, HRA 25453) in die Tausendfensterhaus Objekt SCS (société en commandite simple) mit Sitz in Luxemburg, Großherzogtum Luxemburg (Registre de Commerce et des Sociétés de Luxembourg, B289940) beim Handelsregister eingereicht worden ist. Die Anteilsinhaber, die Gläubiger, sowie die zuständigen Betriebsräte der an dem grenzüberschreitenden Formwechsel beteiligten Gesellschaft oder, soweit es keinen Betriebsrat gibt, die Arbeitnehmer der an dem grenzüberschreitenden Formwechsel beteiligten Gesellschaft, können der Gesellschaft spätestens fünf Arbeitstage vor dem Tag der Gesellschafterversammlung Bemerkungen zum Formwechselplan übermitteln."
    },
    {
      "date": "2025-05-28",
      "id": "110578",
      "original_text": "Einreichung neuer Dokumente\nNordrhein-Westfalen Amtsgericht Essen HRB 31635\nSTEAG Power GmbH – Essen",
      "type": "Einreichung neuer Dokumente",
      "state": "Nordrhein-Westfalen",
      "amtsgericht": "Amtsgericht Essen",
      "registernummer": "HRB 31635",
      "registerart": "HRB",
      "company_name": "STEAG Power GmbH",
      "company_seat": "Essen",
      "details": "28.05.2025 (Bekanntmachungsdatum)\n\nNordrhein-Westfalen Amtsgericht Essen HRB 31635\nEinreichung neuer Dokumente\n\nSTEAG Power GmbH\nGesellschaft mit beschränkter Haftung\nEssen\n\nDem Registergericht ist eine neue Liste der Mitglieder des Aufsichtsrates eingereicht worden."
    },
    {
      "date": "2025-05-28",
      "id": "110579",
      "original_text": "Registerbekanntmachung nach dem Umwandlungsgesetz\nNordrhein-Westfalen Amtsgericht Steinfurt HRB 6129\nneubourg skin care GmbH – Greven",
      "type": "Registerbekanntmachung nach dem Umwandlungsgesetz",
      "state": "Nordrhein-Westfalen",
      "amtsgericht": "Amtsgericht Steinfurt",
      "registernummer": "HRB 6129",
      "registerart": "HRB",
      "company_name": "neubourg skin care GmbH",
      "company_seat": "Greven",
      "details": "28.05.2025 (Bekanntmachungsdatum)\n\nNordrhein-Westfalen Amtsgericht Steinfurt HRB 6129\nRegisterbekanntmachung nach dem Umwandlungsgesetz 28.05.2025 (Eintragungsdatum)\n\nneubourg skin care GmbH\nGesellschaft mit beschränkter Haftung\nGreven\n\nDen Gläubigern der an der Verschmelzung beteiligten Rechtsträger ist, wenn sie binnen sechs Monaten nach dem Tag, an dem die Eintragung der Verschmelzung in das Register des Sitzes desjenigen Rechtsträgers, dessen Gläubiger sie sind, nach § 19 Absatz 3 UmwG als bekanntgemacht gilt, ihren Anspruch nach Grund und Höhe schriftlich anmelden, Sicherheit zu leisten, soweit sie nicht Befriedigung verlangen können. Dieses Recht steht den Gläubigern jedoch nur zu, wenn sie glaubhaft machen, dass durch die Verschmelzung die Erfüllung ihrer Forderung gefährdet wird."
    },
    {
      "date": "2025-05-28",
      "id": "110580",
      "original_text": "Löschungsankündigung\nNordrhein-Westfalen Amtsgericht Essen HRB 22900\nBasisBuchVerlag UG (haftungsbeschränkt) – Essen",
      "type": "Löschungsankündigung",
      "state": "Nordrhein-Westfalen",
      "amtsgericht": "Amtsgericht Essen",
      "registernummer": "HRB 22900",
      "registerart": "HRB",
      "company_name": "BasisBuchVerlag UG (haftungsbeschränkt)",
      "company_seat": "Essen",
      "details": "28.05.2025 (Bekanntmachungsdatum)\n\nNordrhein-Westfalen Amtsgericht Essen HRB 22900\nLöschungsankündigung\n\nBasisBuchVerlag UG (haftungsbeschränkt)\nGesellschaft mit beschränkter Haftung\nEssen\n\nDas Registergericht beabsichtigt die Gesellschaft von Amts wegen nach § 394 FamFG zu löschen. Die Frist zur Erhebung eines Widerspruchs ist auf einen Monat festgesetzt."
    },
    {
      "date": "2025-05-28",
      "id": "110581",
      "original_text": "Registerbekanntmachung nach dem Umwandlungsgesetz\nNordrhein-Westfalen Amtsgericht Essen HRB 10707\nITZ Informationstechnologie GmbH – Essen",
      "type": "Registerbekanntmachung nach dem Umwandlungsgesetz",
      "state": "Nordrhein-Westfalen",
      "amtsgericht": "Amtsgericht Essen",
      "registernummer": "HRB 10707",
      "registerart": "HRB",
      "company_name": "ITZ Informationstechnologie GmbH",
      "company_seat": "Essen",
      "details": "28.05.2025 (Bekanntmachungsdatum)\n\nNordrhein-Westfalen Amtsgericht Essen HRB 10707\nRegisterbekanntmachung nach dem Umwandlungsgesetz 28.05.2025 (Eintragungsdatum)\n\nITZ Informationstechnologie GmbH\nGesellschaft mit beschränkter Haftung\nEssen\n\nDen Gläubigern der an der Verschmelzung beteiligten Rechtsträger ist, wenn sie binnen sechs Monaten nach dem Tag, an dem die Eintragung der Verschmelzung in das Register des Sitzes desjenigen Rechtsträgers, dessen Gläubiger sie sind, nach § 19 Absatz 3 UmwG als bekanntgemacht gilt, ihren Anspruch nach Grund und Höhe schriftlich anmelden, Sicherheit zu leisten, soweit sie nicht Befriedigung verlangen können. Dieses Recht steht den Gläubigern jedoch nur zu, wenn sie glaubhaft machen, dass durch die Verschmelzung die Erfüllung ihrer Forderung gefährdet wird."
    },
    {
      "date": "2025-05-28",
      "id": "110582",
      "original_text": "Einreichung neuer Dokumente\nThüringen Amtsgericht Jena HRB 202875\nStahlwerk Thüringen GmbH – Unterwellenborn",
      "type": "Einreichung neuer Dokumente",
      "state": "Thüringen",
      "amtsgericht": "Amtsgericht Jena",
      "registernummer": "HRB 202875",
      "registerart": "HRB",
      "company_name": "Stahlwerk Thüringen GmbH",
      "company_seat": "Unterwellenborn",
      "details": "28.05.2025 (Bekanntmachungsdatum)\n\nThüringen Amtsgericht Jena HRB 202875\nEinreichung neuer Dokumente\n\nStahlwerk Thüringen GmbH\nGesellschaft mit beschränkter Haftung\nUnterwellenborn\n\nBekanntmachung gem. § 52 Abs. 3 Satz 2 GmbHG: Aufgrund einer Veränderung in den Personen der Aufsichtsratsmitglieder ist durch die Geschäftsführer eine neue Liste zum Handelsregister eingereicht worden."
    },
    {
      "date": "2025-05-28",
      "id": "110583",
      "original_text": "Sonstige Registerbekanntmachung\nHessen Amtsgericht Darmstadt VR 83366\nStudierendeninitiative für Kinder Ortsgruppe Darmstadt e.V. – Darmstadt",
      "type": "Sonstige Registerbekanntmachung",
      "state": "Hessen",
      "amtsgericht": "Amtsgericht Darmstadt",
      "registernummer": "VR 83366",
      "registerart": "VR",
      "company_name": "Studierendeninitiative für Kinder Ortsgruppe Darmstadt e.V.",
      "company_seat": "Darmstadt",
      "details": "28.05.2025 (Bekanntmachungsdatum)\n\nHessen Amtsgericht Darmstadt VR 83366\nSonstige Registerbekanntmachung 28.05.2025 (Eintragungsdatum)\n\nStudierendeninitiative für Kinder Ortsgruppe Darmstadt e.V.\neingetragener Verein\nDarmstadt\n\nDer Verein ist aufgelöst."
    },
    {
      "date": "2025-05-28",
      "id": "110584",
      "original_text": "Registerbekanntmachung nach dem Umwandlungsgesetz\nHessen Amtsgericht Frankfurt am Main HRA 46862\nOseon GmbH & Co. KG – Frankfurt am Main",
      "type": "Registerbekanntmachung nach dem Umwandlungsgesetz",
      "state": "Hessen",
      "amtsgericht": "Amtsgericht Frankfurt am Main",
      "registernummer": "HRA 46862",
      "registerart": "HRA",
      "company_name": "Oseon GmbH & Co. KG",
      "company_seat": "Frankfurt am Main",
      "details": "28.05.2025 (Bekanntmachungsdatum)\n\nHessen Amtsgericht Frankfurt am Main HRA 46862\nRegisterbekanntmachung nach dem Umwandlungsgesetz 28.05.2025 (Eintragungsdatum)\n\nOseon GmbH & Co. KG\nKommanditgesellschaft\nFrankfurt am Main\n\nDen Gläubigern der an der Verschmelzung beteiligten Rechtsträger ist, wenn sie binnen sechs Monaten nach dem Tag, an dem die Eintragung der Verschmelzung in das Register des Sitzes desjenigen Rechtsträgers, dessen Gläubiger sie sind, nach § 19 Absatz 3 UmwG bekannt gemacht worden ist, ihren Anspruch nach Grund und Höhe schriftlich anmelden, Sicherheit zu leisten, soweit sie nicht Befriedigung verlangen können. Dieses Recht steht den Gläubigern jedoch nur zu, wenn sie glaubhaft machen, dass durch die Verschmelzung die Erfüllung ihrer Forderung gefährdet wird."
    },
    {
      "date": "2025-05-28",
      "id": "110585",
      "original_text": "Registerbekanntmachung nach dem Umwandlungsgesetz\nHessen Amtsgericht Offenbach am Main HRB 45702\nDoric Immobilienmanagement GmbH – Offenbach am Main",
      "type": "Registerbekanntmachung nach dem Umwandlungsgesetz",
      "state": "Hessen",
      "amtsgericht": "Amtsgericht Offenbach am Main",
      "registernummer": "HRB 45702",
      "registerart": "HRB",
      "company_name": "Doric Immobilienmanagement GmbH",
      "company_seat": "Offenbach am Main",
      "details": "28.05.2025 (Bekanntmachungsdatum)\n\nHessen Amtsgericht Offenbach am Main HRB 45702\nRegisterbekanntmachung nach dem Umwandlungsgesetz 28.05.2025 (Eintragungsdatum)\n\nDoric Immobilienmanagement GmbH\nGesellschaft mit beschränkter Haftung\nOffenbach am Main\n\nDen Gläubigern der an der Verschmelzung beteiligten Rechtsträger ist, wenn sie binnen sechs Monaten nach dem Tag, an dem die Eintragung der Verschmelzung in das Register des Sitzes desjenigen Rechtsträgers, dessen Gläubiger sie sind, nach § 19 Absatz 3 UmwG bekannt gemacht worden ist, ihren Anspruch nach Grund und Höhe schriftlich anmelden, Sicherheit zu leisten, soweit sie nicht Befriedigung verlangen können. Dieses Recht steht den Gläubigern jedoch nur zu, wenn sie glaubhaft machen, dass durch die Verschmelzung die Erfüllung ihrer Forderung gefährdet wird."
    },
    {
      "date": "2025-05-28",
      "id": "110586",
      "original_text": "Löschungsankündigung\nHessen Amtsgericht Frankfurt am Main HRB 80486\nDonmor Management GmbH – Frankfurt am Main",
      "type": "Löschungsankündigung",
      "state": "Hessen",
      "amtsgericht": "Amtsgericht Frankfurt am Main",
      "registernummer": "HRB 80486",
      "registerart": "HRB",
      "company_name": "Donmor Management GmbH",
      "company_seat": "Frankfurt am Main",
      "details": "28.05.2025 (Bekanntmachungsdatum)\n\nHessen Amtsgericht Frankfurt am Main HRB 80486\nLöschungsankündigung\n\nDonmor Management GmbH\nGesellschaft mit beschränkter Haftung\nFrankfurt am Main\n\nEs ist beabsichtigt, die Gesellschaft wegen Vermögenslosigkeit gemäß § 394 FamFG von Amts wegen im Handelsregister zu löschen. Hiergegen kann innerhalb 3 Monaten nach dieser Veröffentlichung Widerspruch bei dem Amtsgericht Frankfurt am Main eingelegt werden."
    },
    {
      "date": "2025-05-28",
      "id": "110587",
      "original_text": "Löschungsankündigung\nHessen Amtsgericht Frankfurt am Main HRB 110885\nKUZEY-ET Fleischhandel GmbH – Frankfurt am Main",
      "type": "Löschungsankündigung",
      "state": "Hessen",
      "amtsgericht": "Amtsgericht Frankfurt am Main",
      "registernummer": "HRB 110885",
      "registerart": "HRB",
      "company_name": "KUZEY-ET Fleischhandel GmbH",
      "company_seat": "Frankfurt am Main",
      "details": "28.05.2025 (Bekanntmachungsdatum)\n\nHessen Amtsgericht Frankfurt am Main HRB 110885\nLöschungsankündigung\n\nKUZEY-ET Fleischhandel GmbH\nGesellschaft mit beschränkter Haftung\nFrankfurt am Main\n\nEs ist beabsichtigt, die Gesellschaft wegen Vermögenslosigkeit gemäß § 394 FamFG von Amts wegen im Handelsregister zu löschen. Hiergegen kann innerhalb eines Monats nach dieser Veröffentlichung Widerspruch bei dem Amtsgericht Frankfurt am Main eingelegt werden."
    },
    {
      "date": "2025-05-28",
      "id": "110588",
      "original_text": "Löschungsankündigung\nHessen Amtsgericht Frankfurt am Main HRB 120932\nMonsieur Fresh GmbH – Frankfurt am Main",
      "type": "Löschungsankündigung",
      "state": "Hessen",
      "amtsgericht": "Amtsgericht Frankfurt am Main",
      "registernummer": "HRB 120932",
      "registerart": "HRB",
      "company_name": "Monsieur Fresh GmbH",
      "company_seat": "Frankfurt am Main",
      "details": "28.05.2025 (Bekanntmachungsdatum)\n\nHessen Amtsgericht Frankfurt am Main HRB 120932\nLöschungsankündigung\n\nMonsieur Fresh GmbH\nGesellschaft mit beschränkter Haftung\nFrankfurt am Main\n\nDas Registergericht beabsichtigt die im Handelsregister eingetragene Gesellschaft von Amts wegen nach § 394 FamFG zu löschen. Die Frist zur Erhebung eines Widerspruchs gegen die beabsichtigte Löschung wird auf 3 Monate festgesetzt."
    },
    {
      "date": "2025-05-28",
      "id": "110589",
      "original_text": "Löschungsankündigung\nHessen Amtsgericht Frankfurt am Main HRB 124541\nMECINGER GmbH – Frankfurt am Main",
      "type": "Löschungsankündigung",
      "state": "Hessen",
      "amtsgericht": "Amtsgericht Frankfurt am Main",
      "registernummer": "HRB 124541",
      "registerart": "HRB",
      "company_name": "MECINGER GmbH",
      "company_seat": "Frankfurt am Main",
      "details": "28.05.2025 (Bekanntmachungsdatum)\n\nHessen Amtsgericht Frankfurt am Main HRB 124541\nLöschungsankündigung\n\nMECINGER GmbH\nGesellschaft mit beschränkter Haftung\nFrankfurt am Main\n\nDas Registergericht beabsichtigt die im Handelsregister eingetragene Gesellschaft von Amts wegen nach § 394 FamFG zu löschen. Die Frist zur Erhebung eines Widerspruchs gegen die beabsichtigte Löschung wird auf 1 Monat festgesetzt."
    },
    {
      "date": "2025-05-28",
      "id": "110590",
      "original_text": "Löschungsankündigung\nHessen Amtsgericht Offenbach am Main HRB 48003\nConformityTrust GmbH – Langen (Hessen)",
      "type": "Löschungsankündigung",
      "state": "Hessen",
      "amtsgericht": "Amtsgericht Offenbach am Main",
      "registernummer": "HRB 48003",
      "registerart": "HRB",
      "company_name": "ConformityTrust GmbH",
      "company_seat": "Langen (Hessen)",
      "details": "28.05.2025 (Bekanntmachungsdatum)\n\nHessen Amtsgericht Offenbach am Main HRB 48003\nLöschungsankündigung\n\nConformityTrust GmbH\nGesellschaft mit beschränkter Haftung\nLangen (Hessen)\n\nDas Registergericht beabsichtigt die im Handelsregister eingetragene Gesellschaft von Amts wegen nach § 394 FamFG zu löschen. Die Frist zur Erhebung eines Widerspruchs gegen die beabsichtigte Löschungw ird auf 3 Monate festgesetzt."
    },
    {
      "date": "2025-05-28",
      "id": "110591",
      "original_text": "Löschungsankündigung\nHessen Amtsgericht Frankfurt am Main HRB 75091\nPFI PRO FUTURA INVEST (Deutschland) AG – Frankfurt am Main",
      "type": "Löschungsankündigung",
      "state": "Hessen",
      "amtsgericht": "Amtsgericht Frankfurt am Main",
      "registernummer": "HRB 75091",
      "registerart": "HRB",
      "company_name": "PFI PRO FUTURA INVEST (Deutschland) AG",
      "company_seat": "Frankfurt am Main",
      "details": "28.05.2025 (Bekanntmachungsdatum)\n\nHessen Amtsgericht Frankfurt am Main HRB 75091\nLöschungsankündigung\n\nPFI PRO FUTURA INVEST (Deutschland) AG\nAktiengesellschaft\nFrankfurt am Main\n\nDas Registergericht beabsichtigt die im Handelsregister eingetragene Gesellschaft von Amts wegen nach § 394 FamFG zu löschen. Die Frist zur Erhebung eines Widerspruchs gegen die beabsichtigte Löschung wird auf 1 Monat festgesetzt."
    },
    {
      "date": "2025-05-28",
      "id": "110592",
      "original_text": "Registerbekanntmachung nach dem Umwandlungsgesetz\nHessen Amtsgericht Darmstadt HRB 102406\nDietz FNL 6. Grundbesitz GmbH – Bensheim",
      "type": "Registerbekanntmachung nach dem Umwandlungsgesetz",
      "state": "Hessen",
      "amtsgericht": "Amtsgericht Darmstadt",
      "registernummer": "HRB 102406",
      "registerart": "HRB",
      "company_name": "Dietz FNL 6. Grundbesitz GmbH",
      "company_seat": "Bensheim",
      "details": "28.05.2025 (Bekanntmachungsdatum)\n\nHessen Amtsgericht Darmstadt HRB 102406\nRegisterbekanntmachung nach dem Umwandlungsgesetz 28.05.2025 (Eintragungsdatum)\n\nDietz FNL 6. Grundbesitz GmbH\nGesellschaft mit beschränkter Haftung\nBensheim\n\nDen Gläubigern der an der Verschmelzung beteiligten Rechtsträger ist, wenn sie binnen sechs Monaten nach dem Tag, an dem die Eintragung der Verschmelzung in das Register des Sitzes derjenigen Rechtsträger deren Gläubiger sie sind, nach § 19 Absatz 3 UmwG bekannt gemacht worden ist, ihren Anspruch nach Grund und Höhe schriftlich anmelden, Sicherheit zu leisten, soweit sie nicht Befriedigung verlangen können. Dieses Recht steht den Gläubigern jedoch nur zu, wenn sie glaubhaft machen, dass durch die Verschmelzung die Erfüllung ihrer Forderung gefährdet wird."
    },
    {
      "date": "2025-05-28",
      "id": "110593",
      "original_text": "Registerbekanntmachung nach dem Umwandlungsgesetz\nHessen Amtsgericht Frankfurt am Main HRB 129095\nPaccard eight GmbH – Frankfurt am Main",
      "type": "Registerbekanntmachung nach dem Umwandlungsgesetz",
      "state": "Hessen",
      "amtsgericht": "Amtsgericht Frankfurt am Main",
      "registernummer": "HRB 129095",
      "registerart": "HRB",
      "company_name": "Paccard eight GmbH",
      "company_seat": "Frankfurt am Main",
      "details": "28.05.2025 (Bekanntmachungsdatum)\n\nHessen Amtsgericht Frankfurt am Main HRB 129095\nRegisterbekanntmachung nach dem Umwandlungsgesetz 28.05.2025 (Eintragungsdatum)\n\nPaccard eight GmbH\nGesellschaft mit beschränkter Haftung\nFrankfurt am Main\n\nDen Gläubigern der an der grenzüberschreitenden formwechselnden Umwandlung beteiligten Rechtsträger ist, wenn sie binnen sechs Monaten nach dem Tag, an dem die Eintragung der formwechselnden Umwandlung in das Register des Sitzes derjenigen Rechtsträger deren Gläubiger sie sind, nach §§ 333 Abs. 2 iVm. 201 UmwG bekannt gemacht worden ist, ihren Anspruch nach Grund und Höhe schriftlich anmelden, Sicherheit zu leisten, soweit sie nicht Befriedigung verlangen können. Dieses Recht steht den Gläubigern jedoch nur zu, wenn sie glaubhaft machen, dass durch die formwechselnden Umwandlung die Erfüllung ihrer Forderung gefährdet wird."
    },
    {
      "date": "2025-05-28",
      "id": "110594",
      "original_text": "Einreichung neuer Dokumente\nHessen Amtsgericht Frankfurt am Main HRB 130596\nYouco24 Erste Gründungs SE – Frankfurt am Main",
      "type": "Einreichung neuer Dokumente",
      "state": "Hessen",
      "amtsgericht": "Amtsgericht Frankfurt am Main",
      "registernummer": "HRB 130596",
      "registerart": "HRB",
      "company_name": "Youco24 Erste Gründungs SE",
      "company_seat": "Frankfurt am Main",
      "details": "28.05.2025 (Bekanntmachungsdatum)\n\nHessen Amtsgericht Frankfurt am Main HRB 130596\nEinreichung neuer Dokumente\n\nYouco24 Erste Gründungs SE\nEuropäische Aktiengesellschaft (SE)\nFrankfurt am Main\n\nDurch eine Änderung in den Personen der Verwaltungsrats ist eine Liste der Mitglieder des Verwaltungsrats zum Handelsregister eingereicht worden."
    },
    {
      "date": "2025-05-28",
      "id": "110595",
      "original_text": "Registerbekanntmachung nach dem Umwandlungsgesetz\nHessen Amtsgericht Offenbach am Main HRB 46721\nQuadoro GmbH – Offenbach am Main",
      "type": "Registerbekanntmachung nach dem Umwandlungsgesetz",
      "state": "Hessen",
      "amtsgericht": "Amtsgericht Offenbach am Main",
      "registernummer": "HRB 46721",
      "registerart": "HRB",
      "company_name": "Quadoro GmbH",
      "company_seat": "Offenbach am Main",
      "details": "28.05.2025 (Bekanntmachungsdatum)\n\nHessen Amtsgericht Offenbach am Main HRB 46721\nRegisterbekanntmachung nach dem Umwandlungsgesetz 28.05.2025 (Eintragungsdatum)\n\nQuadoro GmbH\nGesellschaft mit beschränkter Haftung\nOffenbach am Main\n\nDen Gläubigern der an der Verschmelzung beteiligten Rechtsträger ist, wenn sie binnen sechs Monaten nach dem Tag, an dem die Eintragung der Verschmelzung in das Register des Sitzes desjenigen Rechtsträgers, dessen Gläubiger sie sind, nach § 19 Absatz 3 UmwG bekannt gemacht worden ist, ihren Anspruch nach Grund und Höhe schriftlich anmelden, Sicherheit zu leisten, soweit sie nicht Befriedigung verlangen können. Dieses Recht steht den Gläubigern jedoch nur zu, wenn sie glaubhaft machen, dass durch die Verschmelzung die Erfüllung ihrer Forderung gefährdet wird."
    },
    {
      "date": "2025-05-28",
      "id": "110596",
      "original_text": "Löschungsankündigung\nHessen Amtsgericht Frankfurt am Main HRB 127634\nKOR Bau GmbH – Frankfurt am Main",
      "type": "Löschungsankündigung",
      "state": "Hessen",
      "amtsgericht": "Amtsgericht Frankfurt am Main",
      "registernummer": "HRB 127634",
      "registerart": "HRB",
      "company_name": "KOR Bau GmbH",
      "company_seat": "Frankfurt am Main",
      "details": "28.05.2025 (Bekanntmachungsdatum)\n\nHessen Amtsgericht Frankfurt am Main HRB 127634\nLöschungsankündigung\n\nKOR Bau GmbH\nGesellschaft mit beschränkter Haftung\nFrankfurt am Main\n\nEs ist beabsichtig, die Gesellschaft wegen Vermögenslosigkeit gemäß § 394 FamFG von Amts wegen im Handelsregister zu löschen. Hiergegen kann innerhalb eines Zeitraums von 1 Monat nach dieser Veröffentlichung Widerspruch bei dem Amtsgericht Frankfurt am Main eingelegt werden."
    },
    {
      "date": "2025-05-28",
      "id": "110597",
      "original_text": "Sonstige Registerbekanntmachung\nHessen Amtsgericht Frankfurt am Main HRB 120334\nBullfinch Asset Aktiengesellschaft – Frankfurt am Main",
      "type": "Sonstige Registerbekanntmachung",
      "state": "Hessen",
      "amtsgericht": "Amtsgericht Frankfurt am Main",
      "registernummer": "HRB 120334",
      "registerart": "HRB",
      "company_name": "Bullfinch Asset Aktiengesellschaft",
      "company_seat": "Frankfurt am Main",
      "details": "28.05.2025 (Bekanntmachungsdatum)\n\nHessen Amtsgericht Frankfurt am Main HRB 120334\nSonstige Registerbekanntmachung\n\nBullfinch Asset Aktiengesellschaft\nAktiengesellschaft\nFrankfurt am Main\n\nDurch eine Änderung in den Personen der Aufsichtsratsmitglieder ist eine Liste der Mitglieder des Aufsichtsrates zum Handelsregister eingereicht worden."
    },
    {
      "date": "2025-05-28",
      "id": "110598",
      "original_text": "Registerbekanntmachung nach dem Umwandlungsgesetz\nHessen Amtsgericht Frankfurt am Main HRB 91022\nOFFICEFIRST Advisors Germany GmbH – Frankfurt am Main",
      "type": "Registerbekanntmachung nach dem Umwandlungsgesetz",
      "state": "Hessen",
      "amtsgericht": "Amtsgericht Frankfurt am Main",
      "registernummer": "HRB 91022",
      "registerart": "HRB",
      "company_name": "OFFICEFIRST Advisors Germany GmbH",
      "company_seat": "Frankfurt am Main",
      "details": "28.05.2025 (Bekanntmachungsdatum)\n\nHessen Amtsgericht Frankfurt am Main HRB 91022\nRegisterbekanntmachung nach dem Umwandlungsgesetz 08.05.2025 (Eintragungsdatum)\n\nOFFICEFIRST Advisors Germany GmbH\nGesellschaft mit beschränkter Haftung\nFrankfurt am Main\n\nDie Gesellschaft hat den Entwurf des gemeinsamen Verschmelzungsplans beim Handelsregister des Amtsgerichts Frankfurt am Main eingereicht.\n1.Paragraph  308 Abs. 1 Satz 2 Nr. 2 und Nr. 3 UmwG\nAn der grenzueberschreitenden Verschmelzung sind folgende Gesellschaften beteiligt, die in den unten genannten Registern eingetragen sind:\na.Uebertragende Gesellschaft ist die OFFICEFIRST Advisors Germany GmbH, eine Gesellschaft mit beschraenkter Haftung nach deutschem Recht mit ihrem Sitz in Frankfurt am Main, Deutschland, und Geschaeftsanschrift Friedrich Ebert Anlage 49, 60237 Frankfurt am Main, Deutschland, eingetragen im Handelsregister des Amtsgerichts Frankfurt am Main unter HRB 91022.\nb.Uebernehmende Gesellschaft ist die Loonie Advisors Luxembourg S.a r.l., eine Gesellschaft mit beschraenkter Haftung  nach dem Recht des Grossherzogtums Luxemburg mit Geschaeftsanschrift 2 bis 4, rue Eugene Ruppert, 2453 Luxemburg, Grossherzogtum Luxemburg, eingetragen im Handelsregister und Gesellschaftsregister von Luxemburg unter der Registernummer B160395.\n\n2.Paragraph 308 Abs. 1 Satz 2 Nr. 4 UmwG\nDie Verschmelzung bedarf nach Paragraph 312 Abs. 2 i.V.m. Paragraph 307 Abs. 3 Nr. 1 UmwG nicht der Zustimmung der Gesellschafterversammlung der Gesellschaft. Stattdessen trifft die alleinige Anteilsinhaberin der Gesellschaft grundsaetzlich die Entscheidung ueber den Abschluss des Verschmelzungsplans mit der Beurkundung des Verschmelzungsplans, die aktuell fuer den Tag geplant ist, der auf den Ablauf von einem Monat nach dem Tag der Registerbekanntmachung des Entwurfs des Verschmelzungsplans folgt, oder ggfs. den naechsten Arbeitstag, wobei Samstage, Sonntage und bundesweite Feiertage nicht als Arbeitstage zaehlen.\nZusaetzlich beabsichtigen die Gesellschafter der verschmelzenden Gesellschaften hoechst-vorsorglich, am Tag der Beurkundung des Verschmelzungsplans zustimmende Beschluesse zu fassen.\nDementsprechend koennen die folgenden Personen der jeweiligen Gesellschaft spaetestens fuenf Arbeitstage vor dem Tag der Beurkundung des Verschmelzungsplans und der zustimmenden Beschluesse Bemerkungen zum Verschmelzungsplan uebermitteln:\na.die Anteilsinhaber und die Glaeubiger der an der grenzueberschreitenden Verschmelzung beteiligten Gesellschaften.\nb.die zustaendigen Betriebsraete der an der grenzueberschreitenden Verschmelzung beteiligten Gesellschaften oder, soweit es keinen Betriebsrat gibt, die Arbeitnehmer der an der grenzueberschreitenden Verschmelzung beteiligten Gesellschaften.\nEntsprechende Bemerkungen koennen an die eingetragene Geschaeftsanschrift der Gesell¬schaft gerichtet werden. Saemtliche eingehenden Bemerkungen werden der alleinigen Anteilsinhaberin der Gesellschaft zur Kenntnis gebracht. Sollte der geplante Termin der Beurkundung des Verschmelzungsplans und der zustimmenden Beschluesse aufgrund von Verzoegerungen nicht moeglich sein, wird der Termin so bald wie praktisch moeglich danach, jedenfalls aber unter Einhaltung der Monatsfrist gem. Paragraph 308 Abs. 2 UmwG seit der Einreichung des Entwurfs des Verschmelzungsplans beim Registergericht stattfinden."
    },
    {
      "date": "2025-05-28",
      "id": "110599",
      "original_text": "Registerbekanntmachung nach dem Umwandlungsgesetz\nHessen Amtsgericht Darmstadt HRB 102400\nDietz FNL Investment GmbH – Bensheim",
      "type": "Registerbekanntmachung nach dem Umwandlungsgesetz",
      "state": "Hessen",
      "amtsgericht": "Amtsgericht Darmstadt",
      "registernummer": "HRB 102400",
      "registerart": "HRB",
      "company_name": "Dietz FNL Investment GmbH",
      "company_seat": "Bensheim",
      "details": "28.05.2025 (Bekanntmachungsdatum)\n\nHessen Amtsgericht Darmstadt HRB 102400\nRegisterbekanntmachung nach dem Umwandlungsgesetz 28.05.2025 (Eintragungsdatum)\n\nDietz FNL Investment GmbH\nGesellschaft mit beschränkter Haftung\nBensheim\n\nDen Gläubigern der an der Verschmelzung beteiligten Rechtsträger ist, wenn sie binnen sechs Monaten nach dem Tag, an dem die Eintragung der Verschmelzung in das Register des Sitzes derjenigen Rechtsträger deren Gläubiger sie sind, nach § 19 Absatz 3 UmwG bekannt gemacht worden ist, ihren Anspruch nach Grund und Höhe schriftlich anmelden, Sicherheit zu leisten, soweit sie nicht Befriedigung verlangen können. Dieses Recht steht den Gläubigern jedoch nur zu, wenn sie glaubhaft machen, dass durch die Verschmelzung die Erfüllung ihrer Forderung gefährdet wird."
    },
    {
      "date": "2025-05-28",
      "id": "78",
      "original_text": "Sonderregisterbekanntmachung OHNE Bezug zum elektr. Register\nSachsen-Anhalt Amtsgericht Stendal\n65 AR 954/15\nLPG Tierproduktion Einheit Oberröblingen",
      "type": "Sonderregisterbekanntmachung OHNE Bezug zum elektr. Register",
      "state": "Sachsen-Anhalt",
      "amtsgericht": "Amtsgericht Stendal",
      "company_name": "LPG Tierproduktion Einheit Oberröblingen",
      "sonderegister_referenz": "65 AR 954/15",
      "details": "28.05.2025 (Bekanntmachungsdatum)\n\nSachsen-Anhalt Amtsgericht Stendal\n65 AR 954/15\nSonderregisterbekanntmachung OHNE Bezug zum elektr. Register\n\nLPG Tierproduktion Einheit Oberröblingen\n\nDie Genossenschaft ist wegen Vermögenslosigkeit gemäß § 394 FamFG gelöscht. Von Amts wegen eingetragen."
    },
    {
      "date": "2025-05-28",
      "id": "79",
      "original_text": "Sonderregisterbekanntmachung OHNE Bezug zum elektr. Register\nSachsen-Anhalt Amtsgericht Stendal\n65 AR 954/15\nLPG Tierproduktion Einheit Oberröblingen",
      "type": "Sonderregisterbekanntmachung OHNE Bezug zum elektr. Register",
      "state": "Sachsen-Anhalt",
      "amtsgericht": "Amtsgericht Stendal",
      "company_name": "LPG Tierproduktion Einheit Oberröblingen",
      "sonderegister_referenz": "65 AR 954/15",
      "details": "28.05.2025 (Bekanntmachungsdatum)\n\nSachsen-Anhalt Amtsgericht Stendal\n65 AR 954/15\nSonderregisterbekanntmachung OHNE Bezug zum elektr. Register\n\nLPG Tierproduktion Einheit Oberröblingen\n\nDie Genossenschaft ist wegen Vermögenslosigkeit gemäß § 394 FamFG gelöscht. Von Amts wegen eingetragen."
    }
  ]
}