{
  "date": "2025-05-07",
  "date_of_scrape": "2025-05-31T08:28:41.007Z",
  "tool_version": "0.2.0",
  "number_of_announcements": 121,
  "announcements": [
    {
      "date": "2025-05-07",
      "id": "108248",
      "original_text": "Löschungsankündigung\nBayern Amtsgericht Coburg HRB 4572\nManufaktur Rödental GmbH – Rödental",
      "type": "Löschungsankündigung",
      "state": "Bayern",
      "amtsgericht": "Amtsgericht Coburg",
      "registernummer": "HRB 4572",
      "registerart": "HRB",
      "company_name": "Manufaktur Rödental GmbH",
      "company_seat": "Rödental",
      "details": "07.05.2025 (Bekanntmachungsdatum)\n\nBayern Amtsgericht Coburg HRB 4572\nLöschungsankündigung\n\nManufaktur Rödental GmbH\nGesellschaft mit beschränkter Haftung\nRödental\n\nDas Registergericht beabsichtigt, die im Handelsregister eingetragene Gesellschaft wegen Vermögenslosigkeit von Amts wegen nach § 394 FamFG zu löschen. Die Frist zur Erhebung eines Widerspruchs ist auf sechs Wochen festgesetzt."
    },
    {
      "date": "2025-05-07",
      "id": "108249",
      "original_text": "Löschungsankündigung\nBayern Amtsgericht Bayreuth HRB 6694\nKu7 Gastro GmbH – Kulmbach",
      "type": "Löschungsankündigung",
      "state": "Bayern",
      "amtsgericht": "Amtsgericht Bayreuth",
      "registernummer": "HRB 6694",
      "registerart": "HRB",
      "company_name": "Ku7 Gastro GmbH",
      "company_seat": "Kulmbach",
      "details": "07.05.2025 (Bekanntmachungsdatum)\n\nBayern Amtsgericht Bayreuth HRB 6694\nLöschungsankündigung\n\nKu7 Gastro GmbH\nGesellschaft mit beschränkter Haftung\nKulmbach\n\nDas Registergericht beabsichtigt, die im Handelsregister eingetragene Gesellschaft wegen Vermögenslosigkeit von Amts wegen nach § 394 FamFG zu löschen. Die Frist zur Erhebung eines Widerspruchs ist auf einen Monat festgesetzt."
    },
    {
      "date": "2025-05-07",
      "id": "108250",
      "original_text": "Registerbekanntmachung nach dem Umwandlungsgesetz\nBayern Amtsgericht München HRB 189378\nA & B Wohnbau GmbH – Gräfelfing",
      "type": "Registerbekanntmachung nach dem Umwandlungsgesetz",
      "state": "Bayern",
      "amtsgericht": "Amtsgericht München",
      "registernummer": "HRB 189378",
      "registerart": "HRB",
      "company_name": "A & B Wohnbau GmbH",
      "company_seat": "Gräfelfing",
      "details": "07.05.2025 (Bekanntmachungsdatum)\n\nBayern Amtsgericht München HRB 189378\nRegisterbekanntmachung nach dem Umwandlungsgesetz 06.05.2025 (Eintragungsdatum)\n\nA & B Wohnbau GmbH\nGesellschaft mit beschränkter Haftung\nGräfelfing\n\nDen Gläubigern der an der Verschmelzung beteiligten Rechtsträger ist, wenn sie binnen sechs Monaten nach dem Tag, an dem die Eintragung der Verschmelzung in das Register des Sitzes desjenigen Rechtsträgers, dessen Gläubiger sie sind, nach § 19 Abs. 3 UmwG als bekannt gemacht gilt, ihren Anspruch nach Grund und Höhe in Textform anmelden, Sicherheit zu leisten, soweit sie nicht Befriedigung verlangen können. Dieses Recht steht den Gläubigern jedoch nur zu, wenn sie glaubhaft machen, dass durch die Verschmelzung die Erfüllung ihrer Forderung gefährdet wird."
    },
    {
      "date": "2025-05-07",
      "id": "108251",
      "original_text": "Einreichung neuer Dokumente\nBayern Amtsgericht Traunstein HRB 22892\nEdison AG – Traunstein",
      "type": "Einreichung neuer Dokumente",
      "state": "Bayern",
      "amtsgericht": "Amtsgericht Traunstein",
      "registernummer": "HRB 22892",
      "registerart": "HRB",
      "company_name": "Edison AG",
      "company_seat": "Traunstein",
      "details": "07.05.2025 (Bekanntmachungsdatum)\n\nBayern Amtsgericht Traunstein HRB 22892\nEinreichung neuer Dokumente\n\nEdison AG\nAktiengesellschaft\nTraunstein\n\nDem Amtsgericht Traunstein -Registergericht- ist eine Liste der Mitglieder des Aufsichtsrats eingereicht worden, § 106 AktG."
    },
    {
      "date": "2025-05-07",
      "id": "108252",
      "original_text": "Einreichung neuer Dokumente\nBayern Amtsgericht Fürth HRB 16541\nINCHRON AG – Erlangen",
      "type": "Einreichung neuer Dokumente",
      "state": "Bayern",
      "amtsgericht": "Amtsgericht Fürth",
      "registernummer": "HRB 16541",
      "registerart": "HRB",
      "company_name": "INCHRON AG",
      "company_seat": "Erlangen",
      "details": "07.05.2025 (Bekanntmachungsdatum)\n\nBayern Amtsgericht Fürth HRB 16541\nEinreichung neuer Dokumente\n\nINCHRON AG\nAktiengesellschaft\nErlangen\n\nDem Amtsgericht Fürth -Registergericht- ist eine Liste der Mitglieder des Aufsichtsrats eingereicht worden, § 106 AktG."
    },
    {
      "date": "2025-05-07",
      "id": "108253",
      "original_text": "Registerbekanntmachung nach dem Umwandlungsgesetz\nBayern Amtsgericht München HRB 234786\nCondecta Holding GmbH – München",
      "type": "Registerbekanntmachung nach dem Umwandlungsgesetz",
      "state": "Bayern",
      "amtsgericht": "Amtsgericht München",
      "registernummer": "HRB 234786",
      "registerart": "HRB",
      "company_name": "Condecta Holding GmbH",
      "company_seat": "München",
      "details": "07.05.2025 (Bekanntmachungsdatum)\n\nBayern Amtsgericht München HRB 234786\nRegisterbekanntmachung nach dem Umwandlungsgesetz 06.05.2025 (Eintragungsdatum)\n\nCondecta Holding GmbH\nGesellschaft mit beschränkter Haftung\nMünchen\n\nDen Gläubigern der an der Verschmelzung beteiligten Rechtsträger ist, wenn sie binnen sechs Monaten nach dem Tag, an dem die Eintragung der Verschmelzung in das Register des Sitzes desjenigen Rechtsträgers, dessen Gläubiger sie sind, nach § 19 Abs. 3 UmwG als bekannt gemacht gilt, ihren Anspruch nach Grund und Höhe in Textform anmelden, Sicherheit zu leisten, soweit sie nicht Befriedigung verlangen können. Dieses Recht steht den Gläubigern jedoch nur zu, wenn sie glaubhaft machen, dass durch die Verschmelzung die Erfüllung ihrer Forderung gefährdet wird."
    },
    {
      "date": "2025-05-07",
      "id": "108254",
      "original_text": "Löschungsankündigung\nBayern Amtsgericht Memmingen HRB 18515\nBoxenstopp24 GmbH – Erkheim",
      "type": "Löschungsankündigung",
      "state": "Bayern",
      "amtsgericht": "Amtsgericht Memmingen",
      "registernummer": "HRB 18515",
      "registerart": "HRB",
      "company_name": "Boxenstopp24 GmbH",
      "company_seat": "Erkheim",
      "details": "07.05.2025 (Bekanntmachungsdatum)\n\nBayern Amtsgericht Memmingen HRB 18515\nLöschungsankündigung 06.05.2025 (Eintragungsdatum)\n\nBoxenstopp24 GmbH\nGesellschaft mit beschränkter Haftung\nErkheim\n\nDas Registergericht beabsichtigt, die im Handelsregister eingetragene Gesellschaft wegen Vermögenslosigkeit von Amts wegen nach § 394 FamFG zu löschen. Die Frist zur Erhebung eines Widerspruchs ist auf einen Monat festgesetzt."
    },
    {
      "date": "2025-05-07",
      "id": "108255",
      "original_text": "Registerbekanntmachung nach dem Umwandlungsgesetz\nBayern Amtsgericht Augsburg HRB 17087\nTristar Beteiligungsgesellschaft mbH – Augsburg",
      "type": "Registerbekanntmachung nach dem Umwandlungsgesetz",
      "state": "Bayern",
      "amtsgericht": "Amtsgericht Augsburg",
      "registernummer": "HRB 17087",
      "registerart": "HRB",
      "company_name": "Tristar Beteiligungsgesellschaft mbH",
      "company_seat": "Augsburg",
      "details": "07.05.2025 (Bekanntmachungsdatum)\n\nBayern Amtsgericht Augsburg HRB 17087\nRegisterbekanntmachung nach dem Umwandlungsgesetz 06.05.2025 (Eintragungsdatum)\n\nTristar Beteiligungsgesellschaft mbH\nGesellschaft mit beschränkter Haftung\nAugsburg\n\nDen Gläubigern der an der Verschmelzung beteiligten Rechtsträger ist, wenn sie binnen sechs Monaten nach dem Tag, an dem die Eintragung der Verschmelzung in das Register des Sitzes desjenigen Rechtsträgers, dessen Gläubiger sie sind, nach § 19 Abs. 3 UmwG als bekannt gemacht gilt, ihren Anspruch nach Grund und Höhe in Textform anmelden, Sicherheit zu leisten, soweit sie nicht Befriedigung verlangen können. Dieses Recht steht den Gläubigern jedoch nur zu, wenn sie glaubhaft machen, dass durch die Verschmelzung die Erfüllung ihrer Forderung gefährdet wird."
    },
    {
      "date": "2025-05-07",
      "id": "108256",
      "original_text": "Registerbekanntmachung nach dem Umwandlungsgesetz\nBayern Amtsgericht Augsburg HRB 41212\nEquity Advice Unternehmensentwicklungs GmbH – Augsburg",
      "type": "Registerbekanntmachung nach dem Umwandlungsgesetz",
      "state": "Bayern",
      "amtsgericht": "Amtsgericht Augsburg",
      "registernummer": "HRB 41212",
      "registerart": "HRB",
      "company_name": "Equity Advice Unternehmensentwicklungs GmbH",
      "company_seat": "Augsburg",
      "details": "07.05.2025 (Bekanntmachungsdatum)\n\nBayern Amtsgericht Augsburg HRB 41212\nRegisterbekanntmachung nach dem Umwandlungsgesetz 06.05.2025 (Eintragungsdatum)\n\nEquity Advice Unternehmensentwicklungs GmbH\nGesellschaft mit beschränkter Haftung\nAugsburg\n\nDen Gläubigern der an der Verschmelzung beteiligten Rechtsträger ist, wenn sie binnen sechs Monaten nach dem Tag, an dem die Eintragung der Verschmelzung in das Register des Sitzes desjenigen Rechtsträgers, dessen Gläubiger sie sind, nach § 19 Abs. 3 UmwG als bekannt gemacht gilt, ihren Anspruch nach Grund und Höhe in Textform anmelden, Sicherheit zu leisten, soweit sie nicht Befriedigung verlangen können. Dieses Recht steht den Gläubigern jedoch nur zu, wenn sie glaubhaft machen, dass durch die Verschmelzung die Erfüllung ihrer Forderung gefährdet wird."
    },
    {
      "date": "2025-05-07",
      "id": "108257",
      "original_text": "Registerbekanntmachung nach dem Umwandlungsgesetz\nBayern Amtsgericht München HRB 82331\nMESSRING GmbH – Gilching",
      "type": "Registerbekanntmachung nach dem Umwandlungsgesetz",
      "state": "Bayern",
      "amtsgericht": "Amtsgericht München",
      "registernummer": "HRB 82331",
      "registerart": "HRB",
      "company_name": "MESSRING GmbH",
      "company_seat": "Gilching",
      "details": "07.05.2025 (Bekanntmachungsdatum)\n\nBayern Amtsgericht München HRB 82331\nRegisterbekanntmachung nach dem Umwandlungsgesetz 06.05.2025 (Eintragungsdatum)\n\nMESSRING GmbH\nGesellschaft mit beschränkter Haftung\nGilching\n\nDen Gläubigern der an der Verschmelzung beteiligten Rechtsträger ist, wenn sie binnen sechs Monaten nach dem Tag, an dem die Eintragung der Verschmelzung in das Register des Sitzes desjenigen Rechtsträgers, dessen Gläubiger sie sind, nach § 19 Abs. 3 UmwG als bekannt gemacht gilt, ihren Anspruch nach Grund und Höhe in Textform anmelden, Sicherheit zu leisten, soweit sie nicht Befriedigung verlangen können. Dieses Recht steht den Gläubigern jedoch nur zu, wenn sie glaubhaft machen, dass durch die Verschmelzung die Erfüllung ihrer Forderung gefährdet wird."
    },
    {
      "date": "2025-05-07",
      "id": "108258",
      "original_text": "Registerbekanntmachung nach dem Umwandlungsgesetz\nBayern Amtsgericht München HRB 289271\nFNZ Bank SE – Aschheim",
      "type": "Registerbekanntmachung nach dem Umwandlungsgesetz",
      "state": "Bayern",
      "amtsgericht": "Amtsgericht München",
      "registernummer": "HRB 289271",
      "registerart": "HRB",
      "company_name": "FNZ Bank SE",
      "company_seat": "Aschheim",
      "details": "07.05.2025 (Bekanntmachungsdatum)\n\nBayern Amtsgericht München HRB 289271\nRegisterbekanntmachung nach dem Umwandlungsgesetz\n\nFNZ Bank SE\nEuropäische Aktiengesellschaft (SE)\nAschheim\n\nDem Amtsgericht München -Registergericht- ist der Entwurf eines Verschmelzungsvertrages zwischen der Gesellschaft als übernehmendem Rechtsträger und der FNZ Competence Center GmbH, Augsburg (Amtsgericht Augsburg HRB 35065) zur Einsichtnahme eingereicht worden."
    },
    {
      "date": "2025-05-07",
      "id": "108259",
      "original_text": "Registerbekanntmachung nach dem Umwandlungsgesetz\nBayern Amtsgericht München HRB 169422\nm3 Bauprojektmanagement GmbH – München",
      "type": "Registerbekanntmachung nach dem Umwandlungsgesetz",
      "state": "Bayern",
      "amtsgericht": "Amtsgericht München",
      "registernummer": "HRB 169422",
      "registerart": "HRB",
      "company_name": "m3 Bauprojektmanagement GmbH",
      "company_seat": "München",
      "details": "07.05.2025 (Bekanntmachungsdatum)\n\nBayern Amtsgericht München HRB 169422\nRegisterbekanntmachung nach dem Umwandlungsgesetz 06.05.2025 (Eintragungsdatum)\n\nm3 Bauprojektmanagement GmbH\nGesellschaft mit beschränkter Haftung\nMünchen\n\nDen Gläubigern der an der Verschmelzung beteiligten Rechtsträger ist, wenn sie binnen sechs Monaten nach dem Tag, an dem die Eintragung der Verschmelzung in das Register des Sitzes desjenigen Rechtsträgers, dessen Gläubiger sie sind, nach § 19 Abs. 3 UmwG als bekannt gemacht gilt, ihren Anspruch nach Grund und Höhe in Textform anmelden, Sicherheit zu leisten, soweit sie nicht Befriedigung verlangen können. Dieses Recht steht den Gläubigern jedoch nur zu, wenn sie glaubhaft machen, dass durch die Verschmelzung die Erfüllung ihrer Forderung gefährdet wird."
    },
    {
      "date": "2025-05-07",
      "id": "108260",
      "original_text": "Registerbekanntmachung nach dem Umwandlungsgesetz\nBayern Amtsgericht München HRB 114070\nBuena Vista International Film Production (Germany) GmbH – München",
      "type": "Registerbekanntmachung nach dem Umwandlungsgesetz",
      "state": "Bayern",
      "amtsgericht": "Amtsgericht München",
      "registernummer": "HRB 114070",
      "registerart": "HRB",
      "company_name": "Buena Vista International Film Production (Germany) GmbH",
      "company_seat": "München",
      "details": "07.05.2025 (Bekanntmachungsdatum)\n\nBayern Amtsgericht München HRB 114070\nRegisterbekanntmachung nach dem Umwandlungsgesetz 06.05.2025 (Eintragungsdatum)\n\nBuena Vista International Film Production (Germany) GmbH\nGesellschaft mit beschränkter Haftung\nMünchen\n\nDen Gläubigern der an der Verschmelzung beteiligten Rechtsträger ist, wenn sie binnen sechs Monaten nach dem Tag, an dem die Eintragung der Verschmelzung in das Register des Sitzes desjenigen Rechtsträgers, dessen Gläubiger sie sind, nach § 19 Abs. 3 UmwG als bekannt gemacht gilt, ihren Anspruch nach Grund und Höhe in Textform anmelden, Sicherheit zu leisten, soweit sie nicht Befriedigung verlangen können. Dieses Recht steht den Gläubigern jedoch nur zu, wenn sie glaubhaft machen, dass durch die Verschmelzung die Erfüllung ihrer Forderung gefährdet wird."
    },
    {
      "date": "2025-05-07",
      "id": "108261",
      "original_text": "Registerbekanntmachung nach dem Umwandlungsgesetz\nBayern Amtsgericht Ingolstadt HRB 8561\nMESSRING Active Safety GmbH – Ingolstadt",
      "type": "Registerbekanntmachung nach dem Umwandlungsgesetz",
      "state": "Bayern",
      "amtsgericht": "Amtsgericht Ingolstadt",
      "registernummer": "HRB 8561",
      "registerart": "HRB",
      "company_name": "MESSRING Active Safety GmbH",
      "company_seat": "Ingolstadt",
      "details": "07.05.2025 (Bekanntmachungsdatum)\n\nBayern Amtsgericht Ingolstadt HRB 8561\nRegisterbekanntmachung nach dem Umwandlungsgesetz 06.05.2025 (Eintragungsdatum)\n\nMESSRING Active Safety GmbH\nGesellschaft mit beschränkter Haftung\nIngolstadt\n\nDen Gläubigern der an der Verschmelzung beteiligten Rechtsträger ist, wenn sie binnen sechs Monaten nach dem Tag, an dem die Eintragung der Verschmelzung in das Register des Sitzes desjenigen Rechtsträgers, dessen Gläubiger sie sind, nach § 19 Abs. 3 UmwG als bekannt gemacht gilt, ihren Anspruch nach Grund und Höhe in Textform anmelden, Sicherheit zu leisten, soweit sie nicht Befriedigung verlangen können. Dieses Recht steht den Gläubigern jedoch nur zu, wenn sie glaubhaft machen, dass durch die Verschmelzung die Erfüllung ihrer Forderung gefährdet wird."
    },
    {
      "date": "2025-05-07",
      "id": "108262",
      "original_text": "Löschungsankündigung\nBayern Amtsgericht Würzburg HRB 14899\nWioBit Farben und Fenster UG (haftungsbeschränkt) – Aura i.Sinngrund",
      "type": "Löschungsankündigung",
      "state": "Bayern",
      "amtsgericht": "Amtsgericht Würzburg",
      "registernummer": "HRB 14899",
      "registerart": "HRB",
      "company_name": "WioBit Farben und Fenster UG (haftungsbeschränkt)",
      "company_seat": "Aura i.Sinngrund",
      "details": "07.05.2025 (Bekanntmachungsdatum)\n\nBayern Amtsgericht Würzburg HRB 14899\nLöschungsankündigung\n\nWioBit Farben und Fenster UG (haftungsbeschränkt)\nGesellschaft mit beschränkter Haftung\nAura i.Sinngrund\n\nDas Registergericht beabsichtigt, die im Handelsregister eingetragene Gesellschaft wegen Vermögenslosigkeit von Amts wegen nach § 394 FamFG zu löschen. Die Frist zur Erhebung eines Widerspruchs ist auf drei Monate festgesetzt."
    },
    {
      "date": "2025-05-07",
      "id": "108263",
      "original_text": "Registerbekanntmachung nach dem Umwandlungsgesetz\nBayern Amtsgericht Traunstein HRA 8112\nRBW Rohrdorfer Betonwerke GmbH & Co. KG – Rohrdorf",
      "type": "Registerbekanntmachung nach dem Umwandlungsgesetz",
      "state": "Bayern",
      "amtsgericht": "Amtsgericht Traunstein",
      "registernummer": "HRA 8112",
      "registerart": "HRA",
      "company_name": "RBW Rohrdorfer Betonwerke GmbH & Co. KG",
      "company_seat": "Rohrdorf",
      "details": "07.05.2025 (Bekanntmachungsdatum)\n\nBayern Amtsgericht Traunstein HRA 8112\nRegisterbekanntmachung nach dem Umwandlungsgesetz 06.05.2025 (Eintragungsdatum)\n\nRBW Rohrdorfer Betonwerke GmbH & Co. KG\nKommanditgesellschaft\nRohrdorf\n\nDen Gläubigern der an der Verschmelzung beteiligten Rechtsträger ist, wenn sie binnen sechs Monaten nach dem Tag, an dem die Eintragung der Verschmelzung in das Register des Sitzes desjenigen Rechtsträgers, dessen Gläubiger sie sind, nach § 19 Abs. 3 UmwG als bekannt gemacht gilt, ihren Anspruch nach Grund und Höhe in Textform anmelden, Sicherheit zu leisten, soweit sie nicht Befriedigung verlangen können. Dieses Recht steht den Gläubigern jedoch nur zu, wenn sie glaubhaft machen, dass durch die Verschmelzung die Erfüllung ihrer Forderung gefährdet wird."
    },
    {
      "date": "2025-05-07",
      "id": "108264",
      "original_text": "Löschungsankündigung\nBayern Amtsgericht Schweinfurt HRB 1126\nThomas Lehner GmbH – Schwebheim",
      "type": "Löschungsankündigung",
      "state": "Bayern",
      "amtsgericht": "Amtsgericht Schweinfurt",
      "registernummer": "HRB 1126",
      "registerart": "HRB",
      "company_name": "Thomas Lehner GmbH",
      "company_seat": "Schwebheim",
      "details": "07.05.2025 (Bekanntmachungsdatum)\n\nBayern Amtsgericht Schweinfurt HRB 1126\nLöschungsankündigung\n\nThomas Lehner GmbH\nGesellschaft mit beschränkter Haftung\nSchwebheim\n\nDas Registergericht beabsichtigt, die im Handelsregister eingetragene Gesellschaft wegen Vermögenslosigkeit von Amts wegen nach § 394 Abs. 2 S. 3 FamFG zu löschen. Die Frist zur Erhebung eines Widerspruchs ist auf einen Monat festgesetzt."
    },
    {
      "date": "2025-05-07",
      "id": "108265",
      "original_text": "Löschungsankündigung\nBayern Amtsgericht München HRA 95087\nWLT Online UG (haftungsbeschränkt) & Co. KG – München",
      "type": "Löschungsankündigung",
      "state": "Bayern",
      "amtsgericht": "Amtsgericht München",
      "registernummer": "HRA 95087",
      "registerart": "HRA",
      "company_name": "WLT Online UG (haftungsbeschränkt) & Co. KG",
      "company_seat": "München",
      "details": "07.05.2025 (Bekanntmachungsdatum)\n\nBayern Amtsgericht München HRA 95087\nLöschungsankündigung\n\nWLT Online UG (haftungsbeschränkt) & Co. KG\nKommanditgesellschaft\nMünchen\n\nDas Registergericht beabsichtigt, die im Handelsregister eingetragene Gesellschaft wegen Vermögenslosigkeit von Amts wegen nach § 394 FamFG zu löschen. Die Frist zur Erhebung eines Widerspruchs ist auf drei Monate festgesetzt."
    },
    {
      "date": "2025-05-07",
      "id": "108266",
      "original_text": "Registerbekanntmachung nach dem Umwandlungsgesetz\nBaden-Württemberg Amtsgericht Stuttgart HRB 730182\nhugger_gestaltung GmbH – Rottweil",
      "type": "Registerbekanntmachung nach dem Umwandlungsgesetz",
      "state": "Baden-Württemberg",
      "amtsgericht": "Amtsgericht Stuttgart",
      "registernummer": "HRB 730182",
      "registerart": "HRB",
      "company_name": "hugger_gestaltung GmbH",
      "company_seat": "Rottweil",
      "details": "07.05.2025 (Bekanntmachungsdatum)\n\nBaden-Württemberg Amtsgericht Stuttgart HRB 730182\nRegisterbekanntmachung nach dem Umwandlungsgesetz 07.05.2025 (Eintragungsdatum)\n\nhugger_gestaltung GmbH\nGesellschaft mit beschränkter Haftung\nRottweil\n\nAls nicht eingetragen wird bekanntgemacht:\nDen Gläubigern der an der Verschmelzung beteiligten Rechtsträger ist, wenn sie binnen sechs Monaten nach dem Tag, an dem die Eintragung der Verschmelzung in das Register des Sitzes desjenigen Rechtsträgers, dessen Gläubiger sie sind, nach § 19 Abs. 3 UmwG als bekanntgemacht gilt, ihren Anspruch nach Grund und Höhe schriftlich anmelden, Sicherheit zu leisten, soweit sie nicht Befriedigung verlangen können. Dieses Recht steht den Gläubigern jedoch nur zu, wenn sie glaubhaft machen, dass durch die Verschmelzung die Erfüllung ihrer Forderung gefährdet wird."
    },
    {
      "date": "2025-05-07",
      "id": "108267",
      "original_text": "Löschungsankündigung\nSchleswig-Holstein Amtsgericht Flensburg HRB 7464\nabsolutnet. UG (haftungsbeschränkt) – Flensburg",
      "type": "Löschungsankündigung",
      "state": "Schleswig-Holstein",
      "amtsgericht": "Amtsgericht Flensburg",
      "registernummer": "HRB 7464",
      "registerart": "HRB",
      "company_name": "absolutnet. UG (haftungsbeschränkt)",
      "company_seat": "Flensburg",
      "details": "07.05.2025 (Bekanntmachungsdatum)\n\nSchleswig-Holstein Amtsgericht Flensburg HRB 7464\nLöschungsankündigung\n\nabsolutnet. UG (haftungsbeschränkt)\nGesellschaft mit beschränkter Haftung\nFlensburg\n\nEs ist die Löschung der nachstehenden Gesellschaft wegen Vermögenslosigkeit gemäß § 394 FamFG beabsichtigt.\nWiderspruchsfrist: 2 Monate"
    },
    {
      "date": "2025-05-07",
      "id": "108268",
      "original_text": "Löschungsankündigung\nBrandenburg Amtsgericht Neuruppin HRB 14608\nEichenschild Immobilien GmbH – Pinnow",
      "type": "Löschungsankündigung",
      "state": "Brandenburg",
      "amtsgericht": "Amtsgericht Neuruppin",
      "registernummer": "HRB 14608",
      "registerart": "HRB",
      "company_name": "Eichenschild Immobilien GmbH",
      "company_seat": "Pinnow",
      "details": "07.05.2025 (Bekanntmachungsdatum)\n\nBrandenburg Amtsgericht Neuruppin HRB 14608\nLöschungsankündigung\n\nEichenschild Immobilien GmbH\nGesellschaft mit beschränkter Haftung\nPinnow\n\nBei der nachstehenden Gesellschaft wird das Amtslöschungsverfahren gemäß § 394 FamFG eingeleitet.\nWiderspruchsfrist: 1 Monat"
    },
    {
      "date": "2025-05-07",
      "id": "108269",
      "original_text": "Löschungsankündigung\nBerlin Amtsgericht Berlin (Charlottenburg) HRB 137465\nDrome Trading GmbH – Berlin",
      "type": "Löschungsankündigung",
      "state": "Berlin",
      "amtsgericht": "Amtsgericht Berlin (Charlottenburg)",
      "registernummer": "HRB 137465",
      "registerart": "HRB",
      "company_name": "Drome Trading GmbH",
      "company_seat": "Berlin",
      "details": "07.05.2025 (Bekanntmachungsdatum)\n\nBerlin Amtsgericht Berlin (Charlottenburg) HRB 137465\nLöschungsankündigung\n\nDrome Trading GmbH\nGesellschaft mit beschränkter Haftung\nBerlin\n\nBei der nachstehenden Gesellschaft wird das Amtslöschungsverfahren gemäß § 394 FamFG eingeleitet. Widerspruchsfrist 6 Wochen"
    },
    {
      "date": "2025-05-07",
      "id": "108270",
      "original_text": "Löschungsankündigung\nBerlin Amtsgericht Berlin (Charlottenburg) HRB 192445\nAfrodita Gebäudereinigung UG (haftungsbeschränkt) – Berlin",
      "type": "Löschungsankündigung",
      "state": "Berlin",
      "amtsgericht": "Amtsgericht Berlin (Charlottenburg)",
      "registernummer": "HRB 192445",
      "registerart": "HRB",
      "company_name": "Afrodita Gebäudereinigung UG (haftungsbeschränkt)",
      "company_seat": "Berlin",
      "details": "07.05.2025 (Bekanntmachungsdatum)\n\nBerlin Amtsgericht Berlin (Charlottenburg) HRB 192445\nLöschungsankündigung\n\nAfrodita Gebäudereinigung UG (haftungsbeschränkt)\nGesellschaft mit beschränkter Haftung\nBerlin\n\nBei der nachstehenden Gesellschaft wird das Amtslöschungsverfahren gemäß § 394 FamFG eingeleitet. Widerspruchsfrist 6 Wochen"
    },
    {
      "date": "2025-05-07",
      "id": "108271",
      "original_text": "Registerbekanntmachung nach dem Umwandlungsgesetz\nBaden-Württemberg Amtsgericht Stuttgart HRB 731683\nEberle + Jost GmbH – Stuttgart",
      "type": "Registerbekanntmachung nach dem Umwandlungsgesetz",
      "state": "Baden-Württemberg",
      "amtsgericht": "Amtsgericht Stuttgart",
      "registernummer": "HRB 731683",
      "registerart": "HRB",
      "company_name": "Eberle + Jost GmbH",
      "company_seat": "Stuttgart",
      "details": "07.05.2025 (Bekanntmachungsdatum)\n\nBaden-Württemberg Amtsgericht Stuttgart HRB 731683\nRegisterbekanntmachung nach dem Umwandlungsgesetz 07.05.2025 (Eintragungsdatum)\n\nEberle + Jost GmbH\nGesellschaft mit beschränkter Haftung\nStuttgart\n\nAls nicht eingetragen wird bekanntgemacht:\nDen Gläubigern der an der Verschmelzung beteiligten Rechtsträger ist, wenn sie binnen sechs Monaten nach dem Tag, an dem die Eintragung der Verschmelzung in das Register des Sitzes desjenigen Rechtsträgers, dessen Gläubiger sie sind, nach § 19 Abs. 3 UmwG als bekanntgemacht gilt, ihren Anspruch nach Grund und Höhe schriftlich anmelden, Sicherheit zu leisten, soweit sie nicht Befriedigung verlangen können. Dieses Recht steht den Gläubigern jedoch nur zu, wenn sie glaubhaft machen, dass durch die Verschmelzung die Erfüllung ihrer Forderung gefährdet wird."
    },
    {
      "date": "2025-05-07",
      "id": "108272",
      "original_text": "Registerbekanntmachung nach dem Umwandlungsgesetz\nBrandenburg Amtsgericht Frankfurt/Oder HRA 3508\nGrundbesitz Waldsiedlung GmbH & Co. KG – Bernau bei Berlin",
      "type": "Registerbekanntmachung nach dem Umwandlungsgesetz",
      "state": "Brandenburg",
      "amtsgericht": "Amtsgericht Frankfurt/Oder",
      "registernummer": "HRA 3508",
      "registerart": "HRA",
      "company_name": "Grundbesitz Waldsiedlung GmbH & Co. KG",
      "company_seat": "Bernau bei Berlin",
      "details": "07.05.2025 (Bekanntmachungsdatum)\n\nBrandenburg Amtsgericht Frankfurt/Oder HRA 3508\nRegisterbekanntmachung nach dem Umwandlungsgesetz 05.05.2025 (Eintragungsdatum)\n\nGrundbesitz Waldsiedlung GmbH & Co. KG\nKommanditgesellschaft\nBernau bei Berlin\n\nZu Eintragungsnummer 4 vom 05.05.2025 wird als nicht eingetragen veröffentlicht: Als nicht eingetragen wird veröffentlicht:\nDen Gläubigern der an der Verschmelzung beteiligten Rechtsträger ist, wenn sie binnen sechs Monaten nach dem Tag, an dem die Eintragung der Verschmelzung in das Register des Sitzes desjenigen Rechtsträgers, dessen Gläubiger sie sind, als bekannt gemacht gilt, ihren Anspruch nach Grund und Höhe schriftlich anmelden, Sicherheit zu leisten, soweit sie nicht Befriedigung verlangen können. Dieses Recht steht den Gläubigern jedoch nur zu, wenn sie glaubhaft machen, dass durch die Verschmelzung die Erfüllung ihrer Forderung gefährdet wird"
    },
    {
      "date": "2025-05-07",
      "id": "108273",
      "original_text": "Löschungsankündigung\nBerlin Amtsgericht Berlin (Charlottenburg) HRB 205451\nMS Security & Service Solutions GmbH – Berlin",
      "type": "Löschungsankündigung",
      "state": "Berlin",
      "amtsgericht": "Amtsgericht Berlin (Charlottenburg)",
      "registernummer": "HRB 205451",
      "registerart": "HRB",
      "company_name": "MS Security & Service Solutions GmbH",
      "company_seat": "Berlin",
      "details": "07.05.2025 (Bekanntmachungsdatum)\n\nBerlin Amtsgericht Berlin (Charlottenburg) HRB 205451\nLöschungsankündigung\n\nMS Security & Service Solutions GmbH\nGesellschaft mit beschränkter Haftung\nBerlin\n\nBei der nachstehenden Gesellschaft wird das Amtslöschungsverfahren gemäß § 394 FamFG eingeleitet. Widerspruchsfrist 6 Wochen"
    },
    {
      "date": "2025-05-07",
      "id": "108274",
      "original_text": "Sonstige Registerbekanntmachung\nBrandenburg Amtsgericht Potsdam HRB 20207\nSchloss Ribbeck GmbH – Nauen",
      "type": "Sonstige Registerbekanntmachung",
      "state": "Brandenburg",
      "amtsgericht": "Amtsgericht Potsdam",
      "registernummer": "HRB 20207",
      "registerart": "HRB",
      "company_name": "Schloss Ribbeck GmbH",
      "company_seat": "Nauen",
      "details": "07.05.2025 (Bekanntmachungsdatum)\n\nBrandenburg Amtsgericht Potsdam HRB 20207\nSonstige Registerbekanntmachung\n\nSchloss Ribbeck GmbH\nGesellschaft mit beschränkter Haftung\nNauen\n\nAls nicht eingetragen wird veröffentlicht: Eine Liste der Mitglieder des Aufsichtsrates wurde zum Handelsregister eingereicht."
    },
    {
      "date": "2025-05-07",
      "id": "108275",
      "original_text": "Sonstige Registerbekanntmachung\nBrandenburg Amtsgericht Potsdam HRB 36319\nBB Eismanufaktur GmbH – Luckenwalde",
      "type": "Sonstige Registerbekanntmachung",
      "state": "Brandenburg",
      "amtsgericht": "Amtsgericht Potsdam",
      "registernummer": "HRB 36319",
      "registerart": "HRB",
      "company_name": "BB Eismanufaktur GmbH",
      "company_seat": "Luckenwalde",
      "details": "07.05.2025 (Bekanntmachungsdatum)\n\nBrandenburg Amtsgericht Potsdam HRB 36319\nSonstige Registerbekanntmachung\n\nBB Eismanufaktur GmbH\nGesellschaft mit beschränkter Haftung\nLuckenwalde\n\nAls nicht eingetragen wird veröffentlicht: Wird das mit Verfügung vom 25.10.2024 eingeleitete Amtslöschungsverfahren wegen Vermögenslosigkeit aufgehoben."
    },
    {
      "date": "2025-05-07",
      "id": "108276",
      "original_text": "Löschungsankündigung\nBrandenburg Amtsgericht Potsdam HRB 9834\nDie Ossi-Company Anzeigenzeitungen Verwaltungs GmbH – Brandenburg an der Havel",
      "type": "Löschungsankündigung",
      "state": "Brandenburg",
      "amtsgericht": "Amtsgericht Potsdam",
      "registernummer": "HRB 9834",
      "registerart": "HRB",
      "company_name": "Die Ossi-Company Anzeigenzeitungen Verwaltungs GmbH",
      "company_seat": "Brandenburg an der Havel",
      "details": "07.05.2025 (Bekanntmachungsdatum)\n\nBrandenburg Amtsgericht Potsdam HRB 9834\nLöschungsankündigung\n\nDie Ossi-Company Anzeigenzeitungen Verwaltungs GmbH\nGesellschaft mit beschränkter Haftung\nBrandenburg an der Havel\n\nBei der nachstehenden Gesellschaft wird das Amtslöschungsverfahren gemäß § 394 FamFG eingeleitet. Widerspruchsfrist: 8 Wochen"
    },
    {
      "date": "2025-05-07",
      "id": "108277",
      "original_text": "Löschungsankündigung\nBerlin Amtsgericht Berlin (Charlottenburg) HRB 101099\nTIME PRO MED Unternehmensberatungs GmbH – Berlin",
      "type": "Löschungsankündigung",
      "state": "Berlin",
      "amtsgericht": "Amtsgericht Berlin (Charlottenburg)",
      "registernummer": "HRB 101099",
      "registerart": "HRB",
      "company_name": "TIME PRO MED Unternehmensberatungs GmbH",
      "company_seat": "Berlin",
      "details": "07.05.2025 (Bekanntmachungsdatum)\n\nBerlin Amtsgericht Berlin (Charlottenburg) HRB 101099\nLöschungsankündigung\n\nTIME PRO MED Unternehmensberatungs GmbH\nGesellschaft mit beschränkter Haftung\nBerlin\n\nBei der nachstehenden Gesellschaft wird das Amtslöschungsverfahren gemäß § 394 FamFG eingeleitet. Widerspruchsfrist 6 Wochen"
    },
    {
      "date": "2025-05-07",
      "id": "108278",
      "original_text": "Löschungsankündigung\nBrandenburg Amtsgericht Neuruppin HRB 11315\nMeyer-Machowicz Wirtschaftskanzlei GmbH – Mescherin OT Rosow",
      "type": "Löschungsankündigung",
      "state": "Brandenburg",
      "amtsgericht": "Amtsgericht Neuruppin",
      "registernummer": "HRB 11315",
      "registerart": "HRB",
      "company_name": "Meyer-Machowicz Wirtschaftskanzlei GmbH",
      "company_seat": "Mescherin OT Rosow",
      "details": "07.05.2025 (Bekanntmachungsdatum)\n\nBrandenburg Amtsgericht Neuruppin HRB 11315\nLöschungsankündigung\n\nMeyer-Machowicz Wirtschaftskanzlei GmbH\nGesellschaft mit beschränkter Haftung\nMescherin OT Rosow\n\nBei der nachstehenden Gesellschaft wird das Amtslöschungsverfahren gemäß § 394 FamFG eingeleitet.\nWiderspruchsfrist: 1 Monat"
    },
    {
      "date": "2025-05-07",
      "id": "108279",
      "original_text": "Registerbekanntmachung nach dem Umwandlungsgesetz\nBerlin Amtsgericht Berlin (Charlottenburg) HRA 61258\nMichael Schweiger e.K. – Berlin",
      "type": "Registerbekanntmachung nach dem Umwandlungsgesetz",
      "state": "Berlin",
      "amtsgericht": "Amtsgericht Berlin (Charlottenburg)",
      "registernummer": "HRA 61258",
      "registerart": "HRA",
      "company_name": "Michael Schweiger e.K.",
      "company_seat": "Berlin",
      "details": "07.05.2025 (Bekanntmachungsdatum)\n\nBerlin Amtsgericht Berlin (Charlottenburg) HRA 61258\nRegisterbekanntmachung nach dem Umwandlungsgesetz 06.05.2025 (Eintragungsdatum)\n\nMichael Schweiger e.K.\nEinzelkaufmann / Einzelkauffrau\nBerlin\n\nZu Eintragungsnummer 2 vom 06.05.2025 wird als nicht eingetragen veröffentlicht: Den Gläubigern der an der Spaltung beteiligten Rechtsträger ist, wenn sie binnen sechs Monaten nach dem Tag, an dem die Eintragung der Spaltung in das Register des Sitzes desjenigen Rechtsträgers, dessen Gläubiger sie sind, als bekannt gemacht gilt, ihren Anspruch nach Grund und Höhe schriftlich anmelden, Sicherheit zu leisten, soweit sie nicht Befriedigung verlangen können. Dieses Recht steht den Gläubigern jedoch nur zu, wenn sie glaubhaft machen, dass durch die Spaltung die Erfüllung ihrer Forderung gefährdet wird. Das Recht, Sicherheitsleistung zu verlangen, steht Gläubigern nicht zu, die im Falle der Insolvenz ein Recht auf vorzugsweise Befriedigung aus einer Deckungsmasse haben, die nach gesetzlicher Vorschrift zu ihrem Schutz errichtet und staatlich überwacht ist."
    },
    {
      "date": "2025-05-07",
      "id": "108280",
      "original_text": "Registerbekanntmachung nach dem Umwandlungsgesetz\nBaden-Württemberg Amtsgericht Freiburg GsR 1198\nBecker/Ortweiler eGbR – Freiburg im Breisgau",
      "type": "Registerbekanntmachung nach dem Umwandlungsgesetz",
      "state": "Baden-Württemberg",
      "amtsgericht": "Amtsgericht Freiburg",
      "registernummer": "GsR 1198",
      "registerart": "GsR",
      "company_name": "Becker/Ortweiler eGbR",
      "company_seat": "Freiburg im Breisgau",
      "details": "07.05.2025 (Bekanntmachungsdatum)\n\nBaden-Württemberg Amtsgericht Freiburg GsR 1198\nRegisterbekanntmachung nach dem Umwandlungsgesetz 07.05.2025 (Eintragungsdatum)\n\nBecker/Ortweiler eGbR\nGesellschaft bürgerlichen Rechts\nFreiburg im Breisgau\n\nAls nicht eingetragen wird bekanntgemacht:\nDen Gläubigern des an dem Formwechsel beteiligten Rechtsträgers ist, wenn sie binnen sechs Monaten nach dem Tag, an dem die Eintragung des Formwechsels in das Register des Sitzes desjenigen Rechtsträgers, dessen Gläubiger sie sind, nach § 19 Abs. 3 UmwG als bekanntgemacht gilt, ihren Anspruch nach Grund und Höhe schriftlich anmelden, Sicherheit zu leisten, soweit sie nicht Befriedigung verlangen können. Dieses Recht steht den Gläubigern jedoch nur zu, wenn sie glaubhaft machen, dass durch den Formwechsel die Erfüllung ihrer Forderung gefährdet wird."
    },
    {
      "date": "2025-05-07",
      "id": "108281",
      "original_text": "Registerbekanntmachung nach dem Umwandlungsgesetz\nBaden-Württemberg Amtsgericht Freiburg HRB 720817\nChai Seven GmbH – Schluchsee",
      "type": "Registerbekanntmachung nach dem Umwandlungsgesetz",
      "state": "Baden-Württemberg",
      "amtsgericht": "Amtsgericht Freiburg",
      "registernummer": "HRB 720817",
      "registerart": "HRB",
      "company_name": "Chai Seven GmbH",
      "company_seat": "Schluchsee",
      "details": "07.05.2025 (Bekanntmachungsdatum)\n\nBaden-Württemberg Amtsgericht Freiburg HRB 720817\nRegisterbekanntmachung nach dem Umwandlungsgesetz 07.05.2025 (Eintragungsdatum)\n\nChai Seven GmbH\nGesellschaft mit beschränkter Haftung\nSchluchsee\n\nAls nicht eingetragen wird bekanntgemacht:\nDen Gläubigern des an dem Formwechsel beteiligten Rechtsträgers ist, wenn sie binnen sechs Monaten nach dem Tag, an dem die Eintragung des Formwechsels in das Register des Sitzes desjenigen Rechtsträgers, dessen Gläubiger sie sind, nach § 19 Abs. 3 UmwG als bekanntgemacht gilt, ihren Anspruch nach Grund und Höhe schriftlich anmelden, Sicherheit zu leisten, soweit sie nicht Befriedigung verlangen können. Dieses Recht steht den Gläubigern jedoch nur zu, wenn sie glaubhaft machen, dass durch den Formwechsel die Erfüllung ihrer Forderung gefährdet wird."
    },
    {
      "date": "2025-05-07",
      "id": "108282",
      "original_text": "Registerbekanntmachung nach dem Umwandlungsgesetz\nSchleswig-Holstein Amtsgericht Kiel HRB 21942\nFörde Vermögensverwaltungs GmbH – Eckernförde",
      "type": "Registerbekanntmachung nach dem Umwandlungsgesetz",
      "state": "Schleswig-Holstein",
      "amtsgericht": "Amtsgericht Kiel",
      "registernummer": "HRB 21942",
      "registerart": "HRB",
      "company_name": "Förde Vermögensverwaltungs GmbH",
      "company_seat": "Eckernförde",
      "details": "07.05.2025 (Bekanntmachungsdatum)\n\nSchleswig-Holstein Amtsgericht Kiel HRB 21942\nRegisterbekanntmachung nach dem Umwandlungsgesetz 06.05.2025 (Eintragungsdatum)\n\nFörde Vermögensverwaltungs GmbH\nGesellschaft mit beschränkter Haftung\nEckernförde\n\nZu Eintragungsnummer 3 vom 06.05.2025 wird als nicht eingetragen veröffentlicht:\nDen Gläubigern der an der Verschmelzung beteiligten Rechtsträger ist, wenn sie binnen sechs Monaten nach dem Tag, an dem die Eintragung der Verschmelzung in das Register des Sitzes desjenigen Rechtsträgers, dessen Gläubiger sie sind, nach § 19 Abs. 3 UmwG bekannt gemacht worden ist, ihren Anspruch nach Grund und Höhe schriftlich anmelden, Sicherheit zu leisten, soweit sie nicht Befriedigung verlangen können. Dieses Recht steht den Gläubigern jedoch nur zu, wenn sie glaubhaft machen, dass durch die Verschmelzung die Erfüllung ihrer Forderung gefährdet wird."
    },
    {
      "date": "2025-05-07",
      "id": "108283",
      "original_text": "Registerbekanntmachung nach dem Umwandlungsgesetz\nBerlin Amtsgericht Berlin (Charlottenburg) HRB 198186\nYilu Travel Services GmbH – Berlin",
      "type": "Registerbekanntmachung nach dem Umwandlungsgesetz",
      "state": "Berlin",
      "amtsgericht": "Amtsgericht Berlin (Charlottenburg)",
      "registernummer": "HRB 198186",
      "registerart": "HRB",
      "company_name": "Yilu Travel Services GmbH",
      "company_seat": "Berlin",
      "details": "07.05.2025 (Bekanntmachungsdatum)\n\nBerlin Amtsgericht Berlin (Charlottenburg) HRB 198186\nRegisterbekanntmachung nach dem Umwandlungsgesetz 06.05.2025 (Eintragungsdatum)\n\nYilu Travel Services GmbH\nGesellschaft mit beschränkter Haftung\nBerlin\n\nZu Eintragungsnummer 5 vom 06.05.2025 wird als nicht eingetragen veröffentlicht:Den Gläubigern der an der Verschmelzung beteiligten Rechtsträger ist, wenn sie binnen sechs Monaten nach dem Tag, an dem die Eintragung der Verschmelzung in das Register des Sitzes desjenigen Rechtsträgers, dessen Gläubiger sie sind, als bekannt gemacht gilt, ihren Anspruch nach Grund und Höhe schriftlich anmelden, Sicherheit zu leisten, soweit sie nicht Befriedigung verlangen können. Dieses Recht steht den Gläubigern jedoch nur zu, wenn sie glaubhaft machen, dass durch die Verschmelzung die Erfüllung ihrer Forderung gefährdet wird. Das Recht, Sicherheitsleistung zu verlangen, steht Gläubigern nicht zu, die im Falle der Insolvenz ein Recht auf vorzugsweise Befriedigung aus einer Deckungsmasse haben, die nach gesetzlicher Vorschrift zu ihrem Schutz errichtet und staatlich überwacht ist."
    },
    {
      "date": "2025-05-07",
      "id": "108284",
      "original_text": "Registerbekanntmachung nach dem Umwandlungsgesetz\nSchleswig-Holstein Amtsgericht Lübeck HRB 25853\nMV Holding GmbH – Bad Oldesloe",
      "type": "Registerbekanntmachung nach dem Umwandlungsgesetz",
      "state": "Schleswig-Holstein",
      "amtsgericht": "Amtsgericht Lübeck",
      "registernummer": "HRB 25853",
      "registerart": "HRB",
      "company_name": "MV Holding GmbH",
      "company_seat": "Bad Oldesloe",
      "details": "07.05.2025 (Bekanntmachungsdatum)\n\nSchleswig-Holstein Amtsgericht Lübeck HRB 25853\nRegisterbekanntmachung nach dem Umwandlungsgesetz 06.05.2025 (Eintragungsdatum)\n\nMV Holding GmbH\nGesellschaft mit beschränkter Haftung\nBad Oldesloe\n\nZu Eintragungsnummer 6 vom 06.05.2025 wird als nicht eingetragen veröffentlicht:  Den Gläubigern der an der Verschmelzung beteiligten Rechtsträger ist, wenn sie binnen sechs Monaten nach dem Tag, an dem die Eintragung der Verschmelzung in das Register des Sitzes desjenigen Rechtsträgers, dessen Gläubiger sie sind, als bekannt gemacht gilt, ihren Anspruch nach Grund und Höhe schriftlich anmelden, Sicherheit zu leisten, soweit sie nicht Befriedigung verlangen können. Dieses Recht steht den Gläubigern jedoch nur zu, wenn sie glaubhaft machen, dass durch die Verschmelzung die Erfüllung ihrer Forderung gefährdet wird."
    },
    {
      "date": "2025-05-07",
      "id": "108285",
      "original_text": "Löschungsankündigung\nBrandenburg Amtsgericht Potsdam HRB 23494\nPizzeria Casa CaBarNa UG (haftungsbeschränkt) – Rathenow",
      "type": "Löschungsankündigung",
      "state": "Brandenburg",
      "amtsgericht": "Amtsgericht Potsdam",
      "registernummer": "HRB 23494",
      "registerart": "HRB",
      "company_name": "Pizzeria Casa CaBarNa UG (haftungsbeschränkt)",
      "company_seat": "Rathenow",
      "details": "07.05.2025 (Bekanntmachungsdatum)\n\nBrandenburg Amtsgericht Potsdam HRB 23494\nLöschungsankündigung\n\nPizzeria Casa CaBarNa UG (haftungsbeschränkt)\nGesellschaft mit beschränkter Haftung\nRathenow\n\nBei der nachstehenden Gesellschaft wird das Amtslöschungsverfahren gemäß § 394 FamFG eingeleitet. Widerspruchsfrist: 8 Wochen"
    },
    {
      "date": "2025-05-07",
      "id": "108286",
      "original_text": "Einreichung neuer Dokumente\nBaden-Württemberg Amtsgericht Stuttgart HRB 794195\nGlaser AG – Tuttlingen",
      "type": "Einreichung neuer Dokumente",
      "state": "Baden-Württemberg",
      "amtsgericht": "Amtsgericht Stuttgart",
      "registernummer": "HRB 794195",
      "registerart": "HRB",
      "company_name": "Glaser AG",
      "company_seat": "Tuttlingen",
      "details": "07.05.2025 (Bekanntmachungsdatum)\n\nBaden-Württemberg Amtsgericht Stuttgart HRB 794195\nEinreichung neuer Dokumente\n\nGlaser AG\nAktiengesellschaft\nTuttlingen\n\nDie Gesellschaft hat am 29.04.2025 die Liste über die Zusammensetzung des Aufsichtsrats zum Handelsregister eingereicht."
    },
    {
      "date": "2025-05-07",
      "id": "108287",
      "original_text": "Registerbekanntmachung nach dem Umwandlungsgesetz\nNordrhein-Westfalen Amtsgericht Coesfeld HRA 9798\njobtastic - Erol Orahovac e. K. – Coesfeld",
      "type": "Registerbekanntmachung nach dem Umwandlungsgesetz",
      "state": "Nordrhein-Westfalen",
      "amtsgericht": "Amtsgericht Coesfeld",
      "registernummer": "HRA 9798",
      "registerart": "HRA",
      "company_name": "jobtastic - Erol Orahovac e. K.",
      "company_seat": "Coesfeld",
      "details": "07.05.2025 (Bekanntmachungsdatum)\n\nNordrhein-Westfalen Amtsgericht Coesfeld HRA 9798\nRegisterbekanntmachung nach dem Umwandlungsgesetz 07.05.2025 (Eintragungsdatum)\n\njobtastic - Erol Orahovac e. K.\nEinzelkaufmann\nCoesfeld\n\nDen Gläubigern der an der Ausgliederung beteiligten Rechtsträger ist, wenn sie binnen sechs Monaten nach dem Tag, an dem die Eintragung der Ausgliederung in das Register des Sitzes desjenigen Rechtsträgers, dessen Gläubiger sie sind, nach § 19 Absatz 3 UmwG als bekanntgemacht gilt, ihren Anspruch nach Grund und Höhe schriftlich anmelden, Sicherheit zu leisten, soweit sie nicht Befriedigung verlangen können. Dieses Recht steht den Gläubigern jedoch nur zu, wenn sie glaubhaft machen, dass durch die Ausgliederung die Erfüllung ihrer Forderung gefährdet wird."
    },
    {
      "date": "2025-05-07",
      "id": "108288",
      "original_text": "Registerbekanntmachung nach dem Umwandlungsgesetz\nHamburg Amtsgericht Hamburg HRB 177041\nCapital Crafters Finanzstrategen GmbH – Hamburg",
      "type": "Registerbekanntmachung nach dem Umwandlungsgesetz",
      "state": "Hamburg",
      "amtsgericht": "Amtsgericht Hamburg",
      "registernummer": "HRB 177041",
      "registerart": "HRB",
      "company_name": "Capital Crafters Finanzstrategen GmbH",
      "company_seat": "Hamburg",
      "details": "07.05.2025 (Bekanntmachungsdatum)\n\nHamburg Amtsgericht Hamburg HRB 177041\nRegisterbekanntmachung nach dem Umwandlungsgesetz 07.05.2025 (Eintragungsdatum)\n\nCapital Crafters Finanzstrategen GmbH\nGesellschaft mit beschränkter Haftung\nHamburg\n\nAls nicht eingetragen wird bekannt gemacht:\nDen Gläubigern der an der Verschmelzung beteiligten Gesellschaften ist, wenn sie binnen sechs Monaten nach dem Tag, an dem die Eintragung der Verschmelzung in das Register des Sitzes desjenigen Rechtsträgers, dessen Gläubiger sie sind, nach § 19 Absatz 3 UmwG als bekannt gemacht gilt, ihren Anspruch nach Grund und Höhe schriftlich anmelden, Sicherheit zu leisten, soweit sie nicht Befriedigung verlangen können. Dieses Recht steht den Gläubigern jedoch nur zu, wenn sie glaubhaft machen, dass durch die Verschmelzung die Erfüllung ihrer Forderung gefährdet wird."
    },
    {
      "date": "2025-05-07",
      "id": "108289",
      "original_text": "Registerbekanntmachung nach dem Umwandlungsgesetz\nHamburg Amtsgericht Hamburg HRB 137749\nMPV Beteiligungsgesellschaft mbH – Hamburg",
      "type": "Registerbekanntmachung nach dem Umwandlungsgesetz",
      "state": "Hamburg",
      "amtsgericht": "Amtsgericht Hamburg",
      "registernummer": "HRB 137749",
      "registerart": "HRB",
      "company_name": "MPV Beteiligungsgesellschaft mbH",
      "company_seat": "Hamburg",
      "details": "07.05.2025 (Bekanntmachungsdatum)\n\nHamburg Amtsgericht Hamburg HRB 137749\nRegisterbekanntmachung nach dem Umwandlungsgesetz 07.05.2025 (Eintragungsdatum)\n\nMPV Beteiligungsgesellschaft mbH\nGesellschaft mit beschränkter Haftung\nHamburg\n\nAls nicht eingetragen wird bekannt gemacht:\nDen Gläubigern der an der Verschmelzung beteiligten Gesellschaften ist, wenn sie binnen sechs Monaten nach dem Tag, an dem die Eintragung der Verschmelzung in das Register des Sitzes desjenigen Rechtsträgers, dessen Gläubiger sie sind, nach § 19 Absatz 3 UmwG als bekannt gemacht gilt, ihren Anspruch nach Grund und Höhe schriftlich anmelden, Sicherheit zu leisten, soweit sie nicht Befriedigung verlangen können. Dieses Recht steht den Gläubigern jedoch nur zu, wenn sie glaubhaft machen, dass durch die Verschmelzung die Erfüllung ihrer Forderung gefährdet wird."
    },
    {
      "date": "2025-05-07",
      "id": "108290",
      "original_text": "Einreichung neuer Dokumente\nSchleswig-Holstein Amtsgericht Kiel HRB 9 EC\nStadtwerke Eckernförde GmbH – Eckernförde",
      "type": "Einreichung neuer Dokumente",
      "state": "Schleswig-Holstein",
      "amtsgericht": "Amtsgericht Kiel",
      "registernummer": "HRB 9 EC",
      "registerart": "HRB",
      "company_name": "Stadtwerke Eckernförde GmbH",
      "company_seat": "Eckernförde",
      "details": "07.05.2025 (Bekanntmachungsdatum)\n\nSchleswig-Holstein Amtsgericht Kiel HRB 9 EC\nEinreichung neuer Dokumente\n\nStadtwerke Eckernförde GmbH\nGesellschaft mit beschränkter Haftung\nEckernförde\n\nAls nicht eingetragen wird veröffentlicht: Eine neue Liste der Aufsichtsratsmitglieder ist eingereicht worden."
    },
    {
      "date": "2025-05-07",
      "id": "108291",
      "original_text": "Registerbekanntmachung nach dem Umwandlungsgesetz\nSchleswig-Holstein Amtsgericht Flensburg HRB 12632\nFamobra GmbH – Harrislee",
      "type": "Registerbekanntmachung nach dem Umwandlungsgesetz",
      "state": "Schleswig-Holstein",
      "amtsgericht": "Amtsgericht Flensburg",
      "registernummer": "HRB 12632",
      "registerart": "HRB",
      "company_name": "Famobra GmbH",
      "company_seat": "Harrislee",
      "details": "07.05.2025 (Bekanntmachungsdatum)\n\nSchleswig-Holstein Amtsgericht Flensburg HRB 12632\nRegisterbekanntmachung nach dem Umwandlungsgesetz 07.05.2025 (Eintragungsdatum)\n\nFamobra GmbH\nGesellschaft mit beschränkter Haftung\nHarrislee\n\nZu Eintragungsnummer 12 vom 07.05.2025 wird als nicht eingetragen veröffentlicht:\nDen Gläubigern der an der Verschmelzung beteiligten Rechtsträger ist, wenn sie binnen sechs Monaten nach dem Tag, an dem die Eintragung der Verschmelzung in das Register des Sitzes desjenigen Rechtsträgers, dessen Gläubiger sie sind, als bekannt gemacht gilt, ihren Anspruch nach Grund und Höhe in Textform anmelden, Sicherheit zu leisten, soweit sie nicht Befriedigung verlangen können. Dieses Recht steht den Gläubigern jedoch nur zu, wenn sie glaubhaft machen, dass durch die Verschmelzung die Erfüllung ihrer Forderung gefährdet wird."
    },
    {
      "date": "2025-05-07",
      "id": "108292",
      "original_text": "Einreichung neuer Dokumente\nBerlin Amtsgericht Berlin (Charlottenburg) HRB 247600\nFuture Energy Services GmbH – Berlin",
      "type": "Einreichung neuer Dokumente",
      "state": "Berlin",
      "amtsgericht": "Amtsgericht Berlin (Charlottenburg)",
      "registernummer": "HRB 247600",
      "registerart": "HRB",
      "company_name": "Future Energy Services GmbH",
      "company_seat": "Berlin",
      "details": "07.05.2025 (Bekanntmachungsdatum)\n\nBerlin Amtsgericht Berlin (Charlottenburg) HRB 247600\nEinreichung neuer Dokumente\n\nFuture Energy Services GmbH\nGesellschaft mit beschränkter Haftung\nBerlin\n\nAls nicht eingetragen wird veröffentlicht: Es wurde eine neue Liste der Beiratsmitglieder eingereicht (§52 GmbHG)."
    },
    {
      "date": "2025-05-07",
      "id": "108293",
      "original_text": "Löschungsankündigung\nBaden-Württemberg Amtsgericht Mannheim HRA 701510\nKing of Wheels GmbH & Co. KG – Rastatt",
      "type": "Löschungsankündigung",
      "state": "Baden-Württemberg",
      "amtsgericht": "Amtsgericht Mannheim",
      "registernummer": "HRA 701510",
      "registerart": "HRA",
      "company_name": "King of Wheels GmbH & Co. KG",
      "company_seat": "Rastatt",
      "details": "07.05.2025 (Bekanntmachungsdatum)\n\nBaden-Württemberg Amtsgericht Mannheim HRA 701510\nLöschungsankündigung\n\nKing of Wheels GmbH & Co. KG\nKommanditgesellschaft\nRastatt\n\nAls nicht eingetragen wird bekanntgemacht:\nDas Gericht beabsichtigt, die Gesellschaft wegen Vermögenslosigkeit im Handelsregister von Amts wegen nach § 394 FamFG zu löschen. Die Frist zur Geltendmachung eines Widerspruchs gegen die beabsichtigte Löschung ist auf einen Monat ab Veröffentlichung bestimmt."
    },
    {
      "date": "2025-05-07",
      "id": "108294",
      "original_text": "Registerbekanntmachung nach dem Umwandlungsgesetz\nHamburg Amtsgericht Hamburg HRB 152133\nFischmeister Agentur GmbH – Hamburg",
      "type": "Registerbekanntmachung nach dem Umwandlungsgesetz",
      "state": "Hamburg",
      "amtsgericht": "Amtsgericht Hamburg",
      "registernummer": "HRB 152133",
      "registerart": "HRB",
      "company_name": "Fischmeister Agentur GmbH",
      "company_seat": "Hamburg",
      "details": "07.05.2025 (Bekanntmachungsdatum)\n\nHamburg Amtsgericht Hamburg HRB 152133\nRegisterbekanntmachung nach dem Umwandlungsgesetz 07.05.2025 (Eintragungsdatum)\n\nFischmeister Agentur GmbH\nGesellschaft mit beschränkter Haftung\nHamburg\n\nAls nicht eingetragen wird bekannt gemacht:\nDen Gläubigern der an der Verschmelzung beteiligten Gesellschaften ist, wenn sie binnen sechs Monaten nach dem Tag, an dem die Eintragung der Verschmelzung in das Register des Sitzes desjenigen Rechtsträgers, dessen Gläubiger sie sind, nach § 19 Absatz 3 UmwG als bekannt gemacht gilt, ihren Anspruch nach Grund und Höhe schriftlich anmelden, Sicherheit zu leisten, soweit sie nicht Befriedigung verlangen können. Dieses Recht steht den Gläubigern jedoch nur zu, wenn sie glaubhaft machen, dass durch die Verschmelzung die Erfüllung ihrer Forderung gefährdet wird."
    },
    {
      "date": "2025-05-07",
      "id": "108295",
      "original_text": "Registerbekanntmachung nach dem Umwandlungsgesetz\nHamburg Amtsgericht Hamburg HRB 192332\nAkademie für Schulkinder ESW gGmbH – Hamburg",
      "type": "Registerbekanntmachung nach dem Umwandlungsgesetz",
      "state": "Hamburg",
      "amtsgericht": "Amtsgericht Hamburg",
      "registernummer": "HRB 192332",
      "registerart": "HRB",
      "company_name": "Akademie für Schulkinder ESW gGmbH",
      "company_seat": "Hamburg",
      "details": "07.05.2025 (Bekanntmachungsdatum)\n\nHamburg Amtsgericht Hamburg HRB 192332\nRegisterbekanntmachung nach dem Umwandlungsgesetz 07.05.2025 (Eintragungsdatum)\n\nAkademie für Schulkinder ESW gGmbH\nGesellschaft mit beschränkter Haftung\nHamburg\n\nAls nicht eingetragen wird bekannt gemacht:\nDen Gläubigern der an der Abspaltung beteiligten Gesellschaften ist, wenn sie binnen sechs Monaten nach dem Tag, an dem die Eintragung der Abspaltung in das Register des Sitzes desjenigen Rechtsträgers, dessen Gläubiger sie sind, nach § 19 Absatz 3 UmwG als bekannt gemacht gilt, ihren Anspruch nach Grund und Höhe schriftlich anmelden, Sicherheit zu leisten, soweit sie nicht Befriedigung verlangen können. Dieses Recht steht den Gläubigern jedoch nur zu, wenn sie glaubhaft machen, dass durch die Abspaltung die Erfüllung ihrer Forderung gefährdet wird."
    },
    {
      "date": "2025-05-07",
      "id": "108296",
      "original_text": "Registerbekanntmachung nach dem Umwandlungsgesetz\nHamburg Amtsgericht Hamburg HRB 192335\nAkademie für Schulkinder PHOF gGmbH – Hamburg",
      "type": "Registerbekanntmachung nach dem Umwandlungsgesetz",
      "state": "Hamburg",
      "amtsgericht": "Amtsgericht Hamburg",
      "registernummer": "HRB 192335",
      "registerart": "HRB",
      "company_name": "Akademie für Schulkinder PHOF gGmbH",
      "company_seat": "Hamburg",
      "details": "07.05.2025 (Bekanntmachungsdatum)\n\nHamburg Amtsgericht Hamburg HRB 192335\nRegisterbekanntmachung nach dem Umwandlungsgesetz 07.05.2025 (Eintragungsdatum)\n\nAkademie für Schulkinder PHOF gGmbH\nGesellschaft mit beschränkter Haftung\nHamburg\n\nAls nicht eingetragen wird bekannt gemacht:\nDen Gläubigern der an der Abspaltung beteiligten Gesellschaften ist, wenn sie binnen sechs Monaten nach dem Tag, an dem die Eintragung der Abspaltung in das Register des Sitzes desjenigen Rechtsträgers, dessen Gläubiger sie sind, nach § 19 Absatz 3 UmwG als bekannt gemacht gilt, ihren Anspruch nach Grund und Höhe schriftlich anmelden, Sicherheit zu leisten, soweit sie nicht Befriedigung verlangen können. Dieses Recht steht den Gläubigern jedoch nur zu, wenn sie glaubhaft machen, dass durch die Abspaltung die Erfüllung ihrer Forderung gefährdet wird."
    },
    {
      "date": "2025-05-07",
      "id": "108297",
      "original_text": "Registerbekanntmachung nach dem Umwandlungsgesetz\nHamburg Amtsgericht Hamburg HRB 129142\nAkademie für Schulkinder AfSK gemeinnützige GmbH – Hamburg",
      "type": "Registerbekanntmachung nach dem Umwandlungsgesetz",
      "state": "Hamburg",
      "amtsgericht": "Amtsgericht Hamburg",
      "registernummer": "HRB 129142",
      "registerart": "HRB",
      "company_name": "Akademie für Schulkinder AfSK gemeinnützige GmbH",
      "company_seat": "Hamburg",
      "details": "07.05.2025 (Bekanntmachungsdatum)\n\nHamburg Amtsgericht Hamburg HRB 129142\nRegisterbekanntmachung nach dem Umwandlungsgesetz 07.05.2025 (Eintragungsdatum)\n\nAkademie für Schulkinder AfSK gemeinnützige GmbH\nGesellschaft mit beschränkter Haftung\nHamburg\n\nAls nicht eingetragen wird bekannt gemacht:\nDen Gläubigern der an der Abspaltung beteiligten Gesellschaften ist, wenn sie binnen sechs Monaten nach dem Tag, an dem die Eintragung der Abspaltung in das Register des Sitzes derjenigen Rechtsträger deren Gläubiger sie sind, nach § 19 Absatz 3 UmwG als bekannt gemacht gilt, ihren Anspruch nach Grund und Höhe schriftlich anmelden, Sicherheit zu leisten, soweit sie nicht Befriedigung verlangen können. Dieses Recht steht den Gläubigern jedoch nur zu, wenn sie glaubhaft machen, dass durch die Abspaltung die Erfüllung ihrer Forderung gefährdet wird."
    },
    {
      "date": "2025-05-07",
      "id": "108298",
      "original_text": "Registerbekanntmachung nach dem Umwandlungsgesetz\nHamburg Amtsgericht Hamburg HRB 192333\nAkademie für Schulkinder KNIS gGmbH – Hamburg",
      "type": "Registerbekanntmachung nach dem Umwandlungsgesetz",
      "state": "Hamburg",
      "amtsgericht": "Amtsgericht Hamburg",
      "registernummer": "HRB 192333",
      "registerart": "HRB",
      "company_name": "Akademie für Schulkinder KNIS gGmbH",
      "company_seat": "Hamburg",
      "details": "07.05.2025 (Bekanntmachungsdatum)\n\nHamburg Amtsgericht Hamburg HRB 192333\nRegisterbekanntmachung nach dem Umwandlungsgesetz 07.05.2025 (Eintragungsdatum)\n\nAkademie für Schulkinder KNIS gGmbH\nGesellschaft mit beschränkter Haftung\nHamburg\n\nAls nicht eingetragen wird bekannt gemacht:\nDen Gläubigern der an der Abspaltung beteiligten Gesellschaften ist, wenn sie binnen sechs Monaten nach dem Tag, an dem die Eintragung der Abspaltung in das Register des Sitzes desjenigen Rechtsträgers, dessen Gläubiger sie sind, nach § 19 Absatz 3 UmwG als bekannt gemacht gilt, ihren Anspruch nach Grund und Höhe schriftlich anmelden, Sicherheit zu leisten, soweit sie nicht Befriedigung verlangen können. Dieses Recht steht den Gläubigern jedoch nur zu, wenn sie glaubhaft machen, dass durch die Abspaltung die Erfüllung ihrer Forderung gefährdet wird."
    },
    {
      "date": "2025-05-07",
      "id": "108299",
      "original_text": "Löschungsankündigung\nBaden-Württemberg Amtsgericht Stuttgart HRB 763080\nDOM Kunstverlag UG (haftungsbeschränkt) – Böblingen",
      "type": "Löschungsankündigung",
      "state": "Baden-Württemberg",
      "amtsgericht": "Amtsgericht Stuttgart",
      "registernummer": "HRB 763080",
      "registerart": "HRB",
      "company_name": "DOM Kunstverlag UG (haftungsbeschränkt)",
      "company_seat": "Böblingen",
      "details": "07.05.2025 (Bekanntmachungsdatum)\n\nBaden-Württemberg Amtsgericht Stuttgart HRB 763080\nLöschungsankündigung\n\nDOM Kunstverlag UG (haftungsbeschränkt)\nGesellschaft mit beschränkter Haftung\nBöblingen\n\nAls nicht eingetragen wird bekanntgemacht:\nDas Gericht beabsichtigt, die Gesellschaft wegen Vermögenslosigkeit im Handelsregister von Amts wegen nach § 394 FamFG zu löschen. Die Frist zur Geltendmachung eines Widerspruchs gegen die beabsichtigte Löschung ist auf zwei Monate ab Veröffentlichung bestimmt."
    },
    {
      "date": "2025-05-07",
      "id": "108300",
      "original_text": "Registerbekanntmachung nach dem Umwandlungsgesetz\nHamburg Amtsgericht Hamburg HRB 179668\nLion Sirius-Verwaltungs-GmbH – Hamburg",
      "type": "Registerbekanntmachung nach dem Umwandlungsgesetz",
      "state": "Hamburg",
      "amtsgericht": "Amtsgericht Hamburg",
      "registernummer": "HRB 179668",
      "registerart": "HRB",
      "company_name": "Lion Sirius-Verwaltungs-GmbH",
      "company_seat": "Hamburg",
      "details": "07.05.2025 (Bekanntmachungsdatum)\n\nHamburg Amtsgericht Hamburg HRB 179668\nRegisterbekanntmachung nach dem Umwandlungsgesetz 07.05.2025 (Eintragungsdatum)\n\nLion Sirius-Verwaltungs-GmbH\nGesellschaft mit beschränkter Haftung\nHamburg\n\nAls nicht eingetragen wird bekannt gemacht:\nDen Gläubigern der an der Verschmelzung beteiligten Gesellschaften ist, wenn sie binnen sechs Monaten nach dem Tag, an dem die Eintragung der Verschmelzung in das Register des Sitzes desjenigen Rechtsträgers, dessen Gläubiger sie sind, nach § 19 Absatz 3 UmwG als bekannt gemacht gilt, ihren Anspruch nach Grund und Höhe schriftlich anmelden, Sicherheit zu leisten, soweit sie nicht Befriedigung verlangen können. Dieses Recht steht den Gläubigern jedoch nur zu, wenn sie glaubhaft machen, dass durch die Verschmelzung die Erfüllung ihrer Forderung gefährdet wird."
    },
    {
      "date": "2025-05-07",
      "id": "108301",
      "original_text": "Registerbekanntmachung nach dem Umwandlungsgesetz\nHamburg Amtsgericht Hamburg HRB 184136\nLion Sirius Management SE – Hamburg",
      "type": "Registerbekanntmachung nach dem Umwandlungsgesetz",
      "state": "Hamburg",
      "amtsgericht": "Amtsgericht Hamburg",
      "registernummer": "HRB 184136",
      "registerart": "HRB",
      "company_name": "Lion Sirius Management SE",
      "company_seat": "Hamburg",
      "details": "07.05.2025 (Bekanntmachungsdatum)\n\nHamburg Amtsgericht Hamburg HRB 184136\nRegisterbekanntmachung nach dem Umwandlungsgesetz 07.05.2025 (Eintragungsdatum)\n\nLion Sirius Management SE\nEuropäische Aktiengesellschaft (SE)\nHamburg\n\nAls nicht eingetragen wird bekannt gemacht:\nDen Gläubigern der an der Verschmelzung beteiligten Gesellschaften ist, wenn sie binnen sechs Monaten nach dem Tag, an dem die Eintragung der Verschmelzung in das Register des Sitzes desjenigen Rechtsträgers, dessen Gläubiger sie sind, nach § 19 Absatz 3 UmwG als bekannt gemacht gilt, ihren Anspruch nach Grund und Höhe schriftlich anmelden, Sicherheit zu leisten, soweit sie nicht Befriedigung verlangen können. Dieses Recht steht den Gläubigern jedoch nur zu, wenn sie glaubhaft machen, dass durch die Verschmelzung die Erfüllung ihrer Forderung gefährdet wird."
    },
    {
      "date": "2025-05-07",
      "id": "108302",
      "original_text": "Registerbekanntmachung nach dem Umwandlungsgesetz\nSchleswig-Holstein Amtsgericht Flensburg HRB 6398\nFamobra GmbH – Harrislee",
      "type": "Registerbekanntmachung nach dem Umwandlungsgesetz",
      "state": "Schleswig-Holstein",
      "amtsgericht": "Amtsgericht Flensburg",
      "registernummer": "HRB 6398",
      "registerart": "HRB",
      "company_name": "Famobra GmbH",
      "company_seat": "Harrislee",
      "details": "07.05.2025 (Bekanntmachungsdatum)\n\nSchleswig-Holstein Amtsgericht Flensburg HRB 6398\nRegisterbekanntmachung nach dem Umwandlungsgesetz 07.05.2025 (Eintragungsdatum)\n\nFamobra GmbH\nGesellschaft mit beschränkter Haftung\nHarrislee\n\nZu Eintragungsnummer 14 vom 07.05.2025 wird als nicht eingetragen veröffentlicht: Den Gläubigern der an der Verschmelzung beteiligten Rechtsträger ist, wenn sie binnen sechs Monaten nach dem Tag, an dem die Eintragung der Verschmelzung in das Register des Sitzes desjenigen Rechtsträgers, dessen Gläubiger sie sind, als bekannt gemacht gilt, ihren Anspruch nach Grund und Höhe in Textform anmelden, Sicherheit zu leisten, soweit sie nicht Befriedigung verlangen können. Dieses Recht steht den Gläubigern jedoch nur zu, wenn sie glaubhaft machen, dass durch die Verschmelzung die Erfüllung ihrer Forderung gefährdet wird."
    },
    {
      "date": "2025-05-07",
      "id": "108303",
      "original_text": "Registerbekanntmachung nach dem Umwandlungsgesetz\nBerlin Amtsgericht Berlin (Charlottenburg) HRB 12300\nSiemens Aktiengesellschaft – Berlin und München",
      "type": "Registerbekanntmachung nach dem Umwandlungsgesetz",
      "state": "Berlin",
      "amtsgericht": "Amtsgericht Berlin (Charlottenburg)",
      "registernummer": "HRB 12300",
      "registerart": "HRB",
      "company_name": "Siemens Aktiengesellschaft",
      "company_seat": "Berlin und München",
      "details": "07.05.2025 (Bekanntmachungsdatum)\n\nBerlin Amtsgericht Berlin (Charlottenburg) HRB 12300\nRegisterbekanntmachung nach dem Umwandlungsgesetz 06.05.2025 (Eintragungsdatum)\n\nSiemens Aktiengesellschaft\nAktiengesellschaft\nBerlin und München\n\nZu Eintragungsnummer 150 vom 06.05.2025 wird als nicht eingetragen veröffentlicht: Den Gläubigern der an der Verschmelzung beteiligten Rechtsträger ist, wenn sie binnen sechs Monaten nach dem Tag, an dem die Eintragung der Verschmelzung in das Register des Sitzes desjenigen Rechtsträgers, dessen Gläubiger sie sind, als bekannt gemacht gilt, ihren Anspruch nach Grund und Höhe schriftlich anmelden, Sicherheit zu leisten, soweit sie nicht Befriedigung verlangen können. Dieses Recht steht den Gläubigern jedoch nur zu, wenn sie glaubhaft machen, dass durch die Verschmelzung die Erfüllung ihrer Forderung gefährdet wird. Das Recht, Sicherheitsleistung zu verlangen, steht Gläubigern nicht zu, die im Falle der Insolvenz ein Recht auf vorzugsweise Befriedigung aus einer Deckungsmasse haben, die nach gesetzlicher Vorschrift zu ihrem Schutz errichtet und staatlich überwacht ist."
    },
    {
      "date": "2025-05-07",
      "id": "108304",
      "original_text": "Registerbekanntmachung nach dem Umwandlungsgesetz\nBerlin Amtsgericht Berlin (Charlottenburg) HRB 16521\nMTS Mathematisch Technische Software-Entwicklung GmbH. – Berlin",
      "type": "Registerbekanntmachung nach dem Umwandlungsgesetz",
      "state": "Berlin",
      "amtsgericht": "Amtsgericht Berlin (Charlottenburg)",
      "registernummer": "HRB 16521",
      "registerart": "HRB",
      "company_name": "MTS Mathematisch Technische Software-Entwicklung GmbH.",
      "company_seat": "Berlin",
      "details": "07.05.2025 (Bekanntmachungsdatum)\n\nBerlin Amtsgericht Berlin (Charlottenburg) HRB 16521\nRegisterbekanntmachung nach dem Umwandlungsgesetz 06.05.2025 (Eintragungsdatum)\n\nMTS Mathematisch Technische Software-Entwicklung GmbH.\nGesellschaft mit beschränkter Haftung\nBerlin\n\nZu Eintragungsnummer 4 vom 06.05.2025 wird als nicht eingetragen veröffentlicht: Den Gläubigern der an der Verschmelzung beteiligten Rechtsträger ist, wenn sie binnen sechs Monaten nach dem Tag, an dem die Eintragung der Verschmelzung in das Register des Sitzes desjenigen Rechtsträgers, dessen Gläubiger sie sind, als bekannt gemacht gilt, ihren Anspruch nach Grund und Höhe schriftlich anmelden, Sicherheit zu leisten, soweit sie nicht Befriedigung verlangen können. Dieses Recht steht den Gläubigern jedoch nur zu, wenn sie glaubhaft machen, dass durch die Verschmelzung die Erfüllung ihrer Forderung gefährdet wird. Das Recht, Sicherheitsleistung zu verlangen, steht Gläubigern nicht zu, die im Falle der Insolvenz ein Recht auf vorzugsweise Befriedigung aus einer Deckungsmasse haben, die nach gesetzlicher Vorschrift zu ihrem Schutz errichtet und staatlich überwacht ist."
    },
    {
      "date": "2025-05-07",
      "id": "108305",
      "original_text": "Einreichung neuer Dokumente\nBaden-Württemberg Amtsgericht Mannheim HRB 714554\nAmazon Pforzheim GmbH – Pforzheim",
      "type": "Einreichung neuer Dokumente",
      "state": "Baden-Württemberg",
      "amtsgericht": "Amtsgericht Mannheim",
      "registernummer": "HRB 714554",
      "registerart": "HRB",
      "company_name": "Amazon Pforzheim GmbH",
      "company_seat": "Pforzheim",
      "details": "07.05.2025 (Bekanntmachungsdatum)\n\nBaden-Württemberg Amtsgericht Mannheim HRB 714554\nEinreichung neuer Dokumente\n\nAmazon Pforzheim GmbH\nGesellschaft mit beschränkter Haftung\nPforzheim\n\nDie Gesellschaft hat am 06.05.2025 die Liste über die Zusammensetzung des Aufsichtsrats zum Handelsregister eingereicht."
    },
    {
      "date": "2025-05-07",
      "id": "108306",
      "original_text": "Registerbekanntmachung nach dem Umwandlungsgesetz\nBerlin Amtsgericht Berlin (Charlottenburg) HRB 251599\nMPS Buchhaltungs-Management GmbH – Berlin",
      "type": "Registerbekanntmachung nach dem Umwandlungsgesetz",
      "state": "Berlin",
      "amtsgericht": "Amtsgericht Berlin (Charlottenburg)",
      "registernummer": "HRB 251599",
      "registerart": "HRB",
      "company_name": "MPS Buchhaltungs-Management GmbH",
      "company_seat": "Berlin",
      "details": "07.05.2025 (Bekanntmachungsdatum)\n\nBerlin Amtsgericht Berlin (Charlottenburg) HRB 251599\nRegisterbekanntmachung nach dem Umwandlungsgesetz 06.05.2025 (Eintragungsdatum)\n\nMPS Buchhaltungs-Management GmbH\nGesellschaft mit beschränkter Haftung\nBerlin\n\nZu Eintragungsnummer 2 vom 06.05.2025 wird als nicht eingetragen veröffentlicht: Den Gläubigern der an der Spaltung beteiligten Rechtsträger ist, wenn sie binnen sechs Monaten nach dem Tag, an dem die Eintragung der Spaltung in das Register des Sitzes desjenigen Rechtsträgers, dessen Gläubiger sie sind, als bekannt gemacht gilt, ihren Anspruch nach Grund und Höhe schriftlich anmelden, Sicherheit zu leisten, soweit sie nicht Befriedigung verlangen können. Dieses Recht steht den Gläubigern jedoch nur zu, wenn sie glaubhaft machen, dass durch die Spaltung die Erfüllung ihrer Forderung gefährdet wird. Das Recht, Sicherheitsleistung zu verlangen, steht Gläubigern nicht zu, die im Falle der Insolvenz ein Recht auf vorzugsweise Befriedigung aus einer Deckungsmasse haben, die nach gesetzlicher Vorschrift zu ihrem Schutz errichtet und staatlich überwacht ist."
    },
    {
      "date": "2025-05-07",
      "id": "108307",
      "original_text": "Registerbekanntmachung nach dem Umwandlungsgesetz\nSchleswig-Holstein Amtsgericht Flensburg HRB 4548\nCalgros GmbH – Harrislee",
      "type": "Registerbekanntmachung nach dem Umwandlungsgesetz",
      "state": "Schleswig-Holstein",
      "amtsgericht": "Amtsgericht Flensburg",
      "registernummer": "HRB 4548",
      "registerart": "HRB",
      "company_name": "Calgros GmbH",
      "company_seat": "Harrislee",
      "details": "07.05.2025 (Bekanntmachungsdatum)\n\nSchleswig-Holstein Amtsgericht Flensburg HRB 4548\nRegisterbekanntmachung nach dem Umwandlungsgesetz 07.05.2025 (Eintragungsdatum)\n\nCalgros GmbH\nGesellschaft mit beschränkter Haftung\nHarrislee\n\nZu Eintragungsnummer 28 vom 07.05.2025 wird als nicht eingetragen veröffentlicht: Den Gläubigern der an der Verschmelzung beteiligten Rechtsträger ist, wenn sie binnen sechs Monaten nach dem Tag, an dem die Eintragung der Verschmelzung in das Register des Sitzes desjenigen Rechtsträgers, dessen Gläubiger sie sind, als bekannt gemacht gilt, ihren Anspruch nach Grund und Höhe in Textform anmelden, Sicherheit zu leisten, soweit sie nicht Befriedigung verlangen können. Dieses Recht steht den Gläubigern jedoch nur zu, wenn sie glaubhaft machen, dass durch die Verschmelzung die Erfüllung ihrer Forderung gefährdet wird."
    },
    {
      "date": "2025-05-07",
      "id": "108308",
      "original_text": "Registerbekanntmachung nach dem Umwandlungsgesetz\nSchleswig-Holstein Amtsgericht Flensburg GsR 572\nReShop All eGbR – Harrislee",
      "type": "Registerbekanntmachung nach dem Umwandlungsgesetz",
      "state": "Schleswig-Holstein",
      "amtsgericht": "Amtsgericht Flensburg",
      "registernummer": "GsR 572",
      "registerart": "GsR",
      "company_name": "ReShop All eGbR",
      "company_seat": "Harrislee",
      "details": "07.05.2025 (Bekanntmachungsdatum)\n\nSchleswig-Holstein Amtsgericht Flensburg GsR 572\nRegisterbekanntmachung nach dem Umwandlungsgesetz 07.05.2025 (Eintragungsdatum)\n\nReShop All eGbR\nGesellschaft bürgerlichen Rechts\nHarrislee\n\nZu Eintragungsnummer 2 vom 07.05.2025 wird als nicht eingetragen veröffentlicht: Den Gläubigern ist, wenn sie binnen sechs Monaten nach dem Tag, an dem die Eintragung der Umwandlung als bekannt gemacht gilt, ihren Anspruch nach Grund und Höhe in Textform anmelden, Sicherheit zu leisten, soweit sie nicht Befriedigung verlangen können. Dieses Recht steht den Gläubigern jedoch nur zu, wenn sie glaubhaft machen, dass durch die Umwandlung die Erfüllung ihrer Forderung gefährdet wird."
    },
    {
      "date": "2025-05-07",
      "id": "108309",
      "original_text": "Löschungsankündigung\nBerlin Amtsgericht Berlin (Charlottenburg) HRB 28490\nGru Ba Fi Grundstücks- Bauträger- Finanzierungsvermittlungs-GmbH – Berlin",
      "type": "Löschungsankündigung",
      "state": "Berlin",
      "amtsgericht": "Amtsgericht Berlin (Charlottenburg)",
      "registernummer": "HRB 28490",
      "registerart": "HRB",
      "company_name": "Gru Ba Fi Grundstücks- Bauträger- Finanzierungsvermittlungs-GmbH",
      "company_seat": "Berlin",
      "details": "07.05.2025 (Bekanntmachungsdatum)\n\nBerlin Amtsgericht Berlin (Charlottenburg) HRB 28490\nLöschungsankündigung\n\nGru Ba Fi Grundstücks- Bauträger- Finanzierungsvermittlungs-GmbH\nGesellschaft mit beschränkter Haftung\nBerlin\n\nBei der nachstehenden Gesellschaft wird das Amtslöschungsverfahren gemäß § 394 FamFG eingeleitet. Widerspruchsfrist: 6 Wochen."
    },
    {
      "date": "2025-05-07",
      "id": "108310",
      "original_text": "Löschungsankündigung\nBerlin Amtsgericht Berlin (Charlottenburg) HRB 43228\nROKSI Music GmbH – Berlin",
      "type": "Löschungsankündigung",
      "state": "Berlin",
      "amtsgericht": "Amtsgericht Berlin (Charlottenburg)",
      "registernummer": "HRB 43228",
      "registerart": "HRB",
      "company_name": "ROKSI Music GmbH",
      "company_seat": "Berlin",
      "details": "07.05.2025 (Bekanntmachungsdatum)\n\nBerlin Amtsgericht Berlin (Charlottenburg) HRB 43228\nLöschungsankündigung\n\nROKSI Music GmbH\nGesellschaft mit beschränkter Haftung\nBerlin\n\nBei der nachstehenden Gesellschaft wird das Amtslöschungsverfahren gemäß § 394 FamFG eingeleitet. Widerspruchsfrist 6 Wochen"
    },
    {
      "date": "2025-05-07",
      "id": "108311",
      "original_text": "Registerbekanntmachung nach dem Umwandlungsgesetz\nHamburg Amtsgericht Hamburg HRB 172068\nHAM-LOG-GRUPPE Verwaltungs GmbH – Hamburg",
      "type": "Registerbekanntmachung nach dem Umwandlungsgesetz",
      "state": "Hamburg",
      "amtsgericht": "Amtsgericht Hamburg",
      "registernummer": "HRB 172068",
      "registerart": "HRB",
      "company_name": "HAM-LOG-GRUPPE Verwaltungs GmbH",
      "company_seat": "Hamburg",
      "details": "07.05.2025 (Bekanntmachungsdatum)\n\nHamburg Amtsgericht Hamburg HRB 172068\nRegisterbekanntmachung nach dem Umwandlungsgesetz 07.05.2025 (Eintragungsdatum)\n\nHAM-LOG-GRUPPE Verwaltungs GmbH\nGesellschaft mit beschränkter Haftung\nHamburg\n\nAls nicht eingetragen wird bekannt gemacht:\nDen Gläubigern der an der Verschmelzung beteiligten Gesellschaften ist, wenn sie binnen sechs Monaten nach dem Tag, an dem die Eintragung der Verschmelzung in das Register des Sitzes desjenigen Rechtsträgers, dessen Gläubiger sie sind, nach § 19 Absatz 3 UmwG als bekannt gemacht gilt, ihren Anspruch nach Grund und Höhe schriftlich anmelden, Sicherheit zu leisten, soweit sie nicht Befriedigung verlangen können. Dieses Recht steht den Gläubigern jedoch nur zu, wenn sie glaubhaft machen, dass durch die Verschmelzung die Erfüllung ihrer Forderung gefährdet wird."
    },
    {
      "date": "2025-05-07",
      "id": "108312",
      "original_text": "Registerbekanntmachung nach dem Umwandlungsgesetz\nHamburg Amtsgericht Hamburg HRB 125452\nM-K-G Beteiligungs- und Beratungsgesellschaft mbH – Hamburg",
      "type": "Registerbekanntmachung nach dem Umwandlungsgesetz",
      "state": "Hamburg",
      "amtsgericht": "Amtsgericht Hamburg",
      "registernummer": "HRB 125452",
      "registerart": "HRB",
      "company_name": "M-K-G Beteiligungs- und Beratungsgesellschaft mbH",
      "company_seat": "Hamburg",
      "details": "07.05.2025 (Bekanntmachungsdatum)\n\nHamburg Amtsgericht Hamburg HRB 125452\nRegisterbekanntmachung nach dem Umwandlungsgesetz 07.05.2025 (Eintragungsdatum)\n\nM-K-G Beteiligungs- und Beratungsgesellschaft mbH\nGesellschaft mit beschränkter Haftung\nHamburg\n\nAls nicht eingetragen wird bekannt gemacht:\nDen Gläubigern der an der Verschmelzung beteiligten Gesellschaften ist, wenn sie binnen sechs Monaten nach dem Tag, an dem die Eintragung der Verschmelzung in das Register des Sitzes desjenigen Rechtsträgers, dessen Gläubiger sie sind, nach § 19 Absatz 3 UmwG als bekannt gemacht gilt, ihren Anspruch nach Grund und Höhe schriftlich anmelden, Sicherheit zu leisten, soweit sie nicht Befriedigung verlangen können. Dieses Recht steht den Gläubigern jedoch nur zu, wenn sie glaubhaft machen, dass durch die Verschmelzung die Erfüllung ihrer Forderung gefährdet wird."
    },
    {
      "date": "2025-05-07",
      "id": "108313",
      "original_text": "Löschungsankündigung\nBerlin Amtsgericht Berlin (Charlottenburg) HRB 206319\nFSGS Service UG (haftungsbeschränkt) – Berlin",
      "type": "Löschungsankündigung",
      "state": "Berlin",
      "amtsgericht": "Amtsgericht Berlin (Charlottenburg)",
      "registernummer": "HRB 206319",
      "registerart": "HRB",
      "company_name": "FSGS Service UG (haftungsbeschränkt)",
      "company_seat": "Berlin",
      "details": "07.05.2025 (Bekanntmachungsdatum)\n\nBerlin Amtsgericht Berlin (Charlottenburg) HRB 206319\nLöschungsankündigung\n\nFSGS Service UG (haftungsbeschränkt)\nGesellschaft mit beschränkter Haftung\nBerlin\n\nBei der nachstehenden Gesellschaft wird das Amtslöschungsverfahren gemäß § 394 FamFG eingeleitet. Widerspruchsfrist 6 Wochen"
    },
    {
      "date": "2025-05-07",
      "id": "108314",
      "original_text": "Löschungsankündigung\nMecklenburg-Vorpommern Amtsgericht Rostock HRB 13676\nDenecke Gastro & Service GmbH – Kühlungsborn",
      "type": "Löschungsankündigung",
      "state": "Mecklenburg-Vorpommern",
      "amtsgericht": "Amtsgericht Rostock",
      "registernummer": "HRB 13676",
      "registerart": "HRB",
      "company_name": "Denecke Gastro & Service GmbH",
      "company_seat": "Kühlungsborn",
      "details": "07.05.2025 (Bekanntmachungsdatum)\n\nMecklenburg-Vorpommern Amtsgericht Rostock HRB 13676\nLöschungsankündigung\n\nDenecke Gastro & Service GmbH\nGesellschaft mit beschränkter Haftung\nKühlungsborn\n\nDas Registergericht beabsichtigt, die im Handelsregister eingetragene Gesellschaft von Amts wegen nach § 394 FamFG zu löschen. Die Frist zur Erhebung eines Widerspruchs gegen die beabsichtigte Löschung wird auf 1 Monat festgesetzt."
    },
    {
      "date": "2025-05-07",
      "id": "108315",
      "original_text": "Einreichung neuer Dokumente\nBaden-Württemberg Amtsgericht Stuttgart HRB 790497\nPFISTERER Holding SE – Winterbach",
      "type": "Einreichung neuer Dokumente",
      "state": "Baden-Württemberg",
      "amtsgericht": "Amtsgericht Stuttgart",
      "registernummer": "HRB 790497",
      "registerart": "HRB",
      "company_name": "PFISTERER Holding SE",
      "company_seat": "Winterbach",
      "details": "07.05.2025 (Bekanntmachungsdatum)\n\nBaden-Württemberg Amtsgericht Stuttgart HRB 790497\nEinreichung neuer Dokumente\n\nPFISTERER Holding SE\nEuropäische Aktiengesellschaft (SE)\nWinterbach\n\nDie Gesellschaft hat am 06.05.2025 die Liste über die Zusammensetzung des Aufsichtsrats zum Handelsregister eingereicht."
    },
    {
      "date": "2025-05-07",
      "id": "108316",
      "original_text": "Registerbekanntmachung nach dem Umwandlungsgesetz\nBaden-Württemberg Amtsgericht Mannheim HRB 754431\nTierärztliches Zentrum Lautersack GmbH – Ettlingen",
      "type": "Registerbekanntmachung nach dem Umwandlungsgesetz",
      "state": "Baden-Württemberg",
      "amtsgericht": "Amtsgericht Mannheim",
      "registernummer": "HRB 754431",
      "registerart": "HRB",
      "company_name": "Tierärztliches Zentrum Lautersack GmbH",
      "company_seat": "Ettlingen",
      "details": "07.05.2025 (Bekanntmachungsdatum)\n\nBaden-Württemberg Amtsgericht Mannheim HRB 754431\nRegisterbekanntmachung nach dem Umwandlungsgesetz 07.05.2025 (Eintragungsdatum)\n\nTierärztliches Zentrum Lautersack GmbH\nGesellschaft mit beschränkter Haftung\nEttlingen\n\nDen Gläubigern der an der Ausgliederung beteiligten Rechtsträger ist, wenn sie binnen sechs Monaten nach dem Tag, an dem die Eintragung der Ausgliederung in das Register des Sitzes desjenigen Rechtsträgers, dessen Gläubiger sie sind, nach § 19 Abs. 3 UmwG als bekanntgemacht gilt, ihren Anspruch nach Grund und Höhe schriftlich anmelden, Sicherheit zu leisten, soweit sie nicht Befriedigung verlangen können. Dieses Recht steht den Gläubigern jedoch nur zu, wenn sie glaubhaft machen, dass durch die Ausgliederung die Erfüllung ihrer Forderung gefährdet wird."
    },
    {
      "date": "2025-05-07",
      "id": "108317",
      "original_text": "Registerbekanntmachung nach dem Umwandlungsgesetz\nBaden-Württemberg Amtsgericht Mannheim HRB 746867\nLautersack Holding GmbH – Ettlingen",
      "type": "Registerbekanntmachung nach dem Umwandlungsgesetz",
      "state": "Baden-Württemberg",
      "amtsgericht": "Amtsgericht Mannheim",
      "registernummer": "HRB 746867",
      "registerart": "HRB",
      "company_name": "Lautersack Holding GmbH",
      "company_seat": "Ettlingen",
      "details": "07.05.2025 (Bekanntmachungsdatum)\n\nBaden-Württemberg Amtsgericht Mannheim HRB 746867\nRegisterbekanntmachung nach dem Umwandlungsgesetz 07.05.2025 (Eintragungsdatum)\n\nLautersack Holding GmbH\nGesellschaft mit beschränkter Haftung\nEttlingen\n\nDen Gläubigern der an der Ausgliederung beteiligten Rechtsträger ist, wenn sie binnen sechs Monaten nach dem Tag, an dem die Eintragung der Ausgliederung in das Register des Sitzes desjenigen Rechtsträgers, dessen Gläubiger sie sind, nach § 19 Abs. 3 UmwG als bekanntgemacht gilt, ihren Anspruch nach Grund und Höhe schriftlich anmelden, Sicherheit zu leisten, soweit sie nicht Befriedigung verlangen können. Dieses Recht steht den Gläubigern jedoch nur zu, wenn sie glaubhaft machen, dass durch die Ausgliederung die Erfüllung ihrer Forderung gefährdet wird."
    },
    {
      "date": "2025-05-07",
      "id": "108318",
      "original_text": "Löschungsankündigung\nBrandenburg Amtsgericht Potsdam HRB 35500\nPM Beteiligungsgesellschaft mbH – Zossen",
      "type": "Löschungsankündigung",
      "state": "Brandenburg",
      "amtsgericht": "Amtsgericht Potsdam",
      "registernummer": "HRB 35500",
      "registerart": "HRB",
      "company_name": "PM Beteiligungsgesellschaft mbH",
      "company_seat": "Zossen",
      "details": "07.05.2025 (Bekanntmachungsdatum)\n\nBrandenburg Amtsgericht Potsdam HRB 35500\nLöschungsankündigung\n\nPM Beteiligungsgesellschaft mbH\nGesellschaft mit beschränkter Haftung\nZossen\n\nBei der nachstehenden Gesellschaft wird das Amtslöschungsverfahren gemäß § 394 FamFG eingeleitet. Widerspruchsfrist: 8 Wochen."
    },
    {
      "date": "2025-05-07",
      "id": "108319",
      "original_text": "Sonstige Registerbekanntmachung\nSachsen Amtsgericht Leipzig HRB 12567\nSeniorenresidenz \"Am Lunapark\" GmbH – Leipzig-Wahren",
      "type": "Sonstige Registerbekanntmachung",
      "state": "Sachsen",
      "amtsgericht": "Amtsgericht Leipzig",
      "registernummer": "HRB 12567",
      "registerart": "HRB",
      "company_name": "Seniorenresidenz \"Am Lunapark\" GmbH",
      "company_seat": "Leipzig-Wahren",
      "details": "07.05.2025 (Bekanntmachungsdatum)\n\nSachsen Amtsgericht Leipzig HRB 12567\nSonstige Registerbekanntmachung 07.05.2025 (Eintragungsdatum)\n\nSeniorenresidenz \"Am Lunapark\" GmbH\nGesellschaft mit beschränkter Haftung\nLeipzig-Wahren\n\nDen Gläubigern der Gesellschaft, deren Forderungen begründet worden sind bevor die Eintragung der Beendigung des Beherrschungs- und Gewinnabführungsvertrages in das Handelsregister nach § 10 des Handelsgesetzbuches als bekanntgemacht gilt, hat der andere Vertragsteil Sicherheit zu leisten, wenn sie sich binnen sechs Monaten nach der Bekanntmachung der Eintragung zu diesem Zweck bei ihm melden."
    },
    {
      "date": "2025-05-07",
      "id": "108320",
      "original_text": "Registerbekanntmachung nach dem Umwandlungsgesetz\nSachsen Amtsgericht Leipzig HRA 18357\nREGIA Value GmbH & Co. KG – Leipzig",
      "type": "Registerbekanntmachung nach dem Umwandlungsgesetz",
      "state": "Sachsen",
      "amtsgericht": "Amtsgericht Leipzig",
      "registernummer": "HRA 18357",
      "registerart": "HRA",
      "company_name": "REGIA Value GmbH & Co. KG",
      "company_seat": "Leipzig",
      "details": "07.05.2025 (Bekanntmachungsdatum)\n\nSachsen Amtsgericht Leipzig HRA 18357\nRegisterbekanntmachung nach dem Umwandlungsgesetz 07.05.2025 (Eintragungsdatum)\n\nREGIA Value GmbH & Co. KG\nKommanditgesellschaft\nLeipzig\n\nDen Gläubigern der an der Verschmelzung beteiligten Rechtsträger ist, wenn sie binnen sechs Monaten nach dem Tag, an dem die Eintragung der Verschmelzung in das Register des Sitzes desjenigen Rechtsträgers, dessen Gläubiger sie sind, nach § 19 Abs. 3 UmwG als bekannt gemacht gilt, ihren Anspruch nach Grund und Höhe in Textform anmelden, Sicherheit zu leisten, soweit sie nicht Befriedigung verlangen können. Dieses Recht steht den Gläubigern jedoch nur zu, wenn sie glaubhaft machen, dass durch die Verschmelzung die Erfüllung der Forderung gefährdet wird."
    },
    {
      "date": "2025-05-07",
      "id": "108321",
      "original_text": "Löschungsankündigung\nNiedersachsen Amtsgericht Hildesheim HRB 201386\nSeniorenheim Schwälbchen GmbH – Fürstenberg",
      "type": "Löschungsankündigung",
      "state": "Niedersachsen",
      "amtsgericht": "Amtsgericht Hildesheim",
      "registernummer": "HRB 201386",
      "registerart": "HRB",
      "company_name": "Seniorenheim Schwälbchen GmbH",
      "company_seat": "Fürstenberg",
      "details": "07.05.2025 (Bekanntmachungsdatum)\n\nNiedersachsen Amtsgericht Hildesheim HRB 201386\nLöschungsankündigung 07.05.2025 (Eintragungsdatum)\n\nSeniorenheim Schwälbchen GmbH\nGesellschaft mit beschränkter Haftung\nFürstenberg\n\nDas Registergericht beabsichtigt, die Gesellschaft von Amts wegen nach § 394 FamFG zu löschen. Die Frist zur Erhebung eines Widerspruchs ist auf 1 Monat ab dieser Registerbekanntmachung festgesetzt."
    },
    {
      "date": "2025-05-07",
      "id": "108322",
      "original_text": "Registerbekanntmachung nach dem Umwandlungsgesetz\nNiedersachsen Amtsgericht Walsrode HRB 209897\nAJK UG (haftungsbeschränkt) – Hemsbünde",
      "type": "Registerbekanntmachung nach dem Umwandlungsgesetz",
      "state": "Niedersachsen",
      "amtsgericht": "Amtsgericht Walsrode",
      "registernummer": "HRB 209897",
      "registerart": "HRB",
      "company_name": "AJK UG (haftungsbeschränkt)",
      "company_seat": "Hemsbünde",
      "details": "07.05.2025 (Bekanntmachungsdatum)\n\nNiedersachsen Amtsgericht Walsrode HRB 209897\nRegisterbekanntmachung nach dem Umwandlungsgesetz 07.05.2025 (Eintragungsdatum)\n\nAJK UG (haftungsbeschränkt)\nGesellschaft mit beschränkter Haftung\nHemsbünde\n\nDen Gläubigern der an der Verschmelzung beteiligten Rechtsträger ist, wenn sie binnen sechs Monaten nach dem Tag, an dem die Eintragung der Verschmelzung in das Register des Sitzes desjenigen Rechtsträgers, dessen Gläubiger sie sind, nach § 19  Abs.  3 UmwG als bekannt gemacht gilt, ihren Anspruch nach Grund und Höhe schriftlich anmelden, Sicherheit zu leisten, soweit sie nicht Befriedigung verlangen können. Dieses Recht steht den Gläubigern jedoch nur zu, wenn sie glaubhaft machen, dass durch die Verschmelzung die Erfüllung der Forderung gefährdet wird."
    },
    {
      "date": "2025-05-07",
      "id": "108323",
      "original_text": "Löschungsankündigung\nNiedersachsen Amtsgericht Hildesheim HRB 3296\nUL-Flugschule Hildesheim GmbH – Hildesheim",
      "type": "Löschungsankündigung",
      "state": "Niedersachsen",
      "amtsgericht": "Amtsgericht Hildesheim",
      "registernummer": "HRB 3296",
      "registerart": "HRB",
      "company_name": "UL-Flugschule Hildesheim GmbH",
      "company_seat": "Hildesheim",
      "details": "07.05.2025 (Bekanntmachungsdatum)\n\nNiedersachsen Amtsgericht Hildesheim HRB 3296\nLöschungsankündigung 07.05.2025 (Eintragungsdatum)\n\nUL-Flugschule Hildesheim GmbH\nGesellschaft mit beschränkter Haftung\nHildesheim\n\nDas Registergericht beabsichtigt, die Gesellschaft von Amts wegen nach § 394 FamFG zu löschen. Die Frist zur Erhebung eines Widerspruchs ist auf 1 Monat ab dieser Registerbekanntmachung festgesetzt."
    },
    {
      "date": "2025-05-07",
      "id": "108324",
      "original_text": "Löschungsankündigung\nNiedersachsen Amtsgericht Aurich HRB 205049\nWorkMetric UG (haftungsbeschränkt) – Emden",
      "type": "Löschungsankündigung",
      "state": "Niedersachsen",
      "amtsgericht": "Amtsgericht Aurich",
      "registernummer": "HRB 205049",
      "registerart": "HRB",
      "company_name": "WorkMetric UG (haftungsbeschränkt)",
      "company_seat": "Emden",
      "details": "07.05.2025 (Bekanntmachungsdatum)\n\nNiedersachsen Amtsgericht Aurich HRB 205049\nLöschungsankündigung\n\nWorkMetric UG (haftungsbeschränkt)\nGesellschaft mit beschränkter Haftung\nEmden\n\nDas Registergericht beabsichtigt, die Gesellschaft von Amts wegen nach § 394 FamFG zu löschen. Die Frist zur Erhebung eines Widerspruchs ist auf 1 Monat ab dieser Registerbekanntmachung festgesetzt."
    },
    {
      "date": "2025-05-07",
      "id": "108325",
      "original_text": "Registerbekanntmachung nach dem Umwandlungsgesetz\nNiedersachsen Amtsgericht Oldenburg (Oldenburg) HRB 215326\nSchaustellerbetriebe P. Schmidt UG (haftungsbeschränkt) – Hatten",
      "type": "Registerbekanntmachung nach dem Umwandlungsgesetz",
      "state": "Niedersachsen",
      "amtsgericht": "Amtsgericht Oldenburg (Oldenburg)",
      "registernummer": "HRB 215326",
      "registerart": "HRB",
      "company_name": "Schaustellerbetriebe P. Schmidt UG (haftungsbeschränkt)",
      "company_seat": "Hatten",
      "details": "07.05.2025 (Bekanntmachungsdatum)\n\nNiedersachsen Amtsgericht Oldenburg (Oldenburg) HRB 215326\nRegisterbekanntmachung nach dem Umwandlungsgesetz 07.05.2025 (Eintragungsdatum)\n\nSchaustellerbetriebe P. Schmidt UG (haftungsbeschränkt)\nGesellschaft mit beschränkter Haftung\nHatten\n\nDen Gläubigern der an der Verschmelzung beteiligten Rechtsträger ist, wenn sie binnen sechs Monaten nach dem Tag, an dem die Eintragung der Verschmelzung in das Register des Sitzes desjenigen Rechtsträgers, dessen Gläubiger sie sind, nach § 19  Abs.  3 UmwG als bekannt gemacht gilt, ihren Anspruch nach Grund und Höhe schriftlich anmelden, Sicherheit zu leisten, soweit sie nicht Befriedigung verlangen können. Dieses Recht steht den Gläubigern jedoch nur zu, wenn sie glaubhaft machen, dass durch die Verschmelzung die Erfüllung der Forderung gefährdet wird."
    },
    {
      "date": "2025-05-07",
      "id": "108326",
      "original_text": "Löschungsankündigung\nNiedersachsen Amtsgericht Hildesheim HRB 200156\nKaufhold und Pulina CNC-Metallbearbeitung GmbH – Hildesheim",
      "type": "Löschungsankündigung",
      "state": "Niedersachsen",
      "amtsgericht": "Amtsgericht Hildesheim",
      "registernummer": "HRB 200156",
      "registerart": "HRB",
      "company_name": "Kaufhold und Pulina CNC-Metallbearbeitung GmbH",
      "company_seat": "Hildesheim",
      "details": "07.05.2025 (Bekanntmachungsdatum)\n\nNiedersachsen Amtsgericht Hildesheim HRB 200156\nLöschungsankündigung 07.05.2025 (Eintragungsdatum)\n\nKaufhold und Pulina CNC-Metallbearbeitung GmbH\nGesellschaft mit beschränkter Haftung\nHildesheim\n\nDas Registergericht beabsichtigt, die Gesellschaft von Amts wegen nach § 394 FamFG zu löschen. Die Frist zur Erhebung eines Widerspruchs ist auf 1 Monat ab dieser Registerbekanntmachung festgesetzt."
    },
    {
      "date": "2025-05-07",
      "id": "108327",
      "original_text": "Löschungsankündigung\nNiedersachsen Amtsgericht Aurich HRA 111569\nMS \"Michigan Trader\" Schiffahrts UG (haftungsbeschränkt) & Co. KG – Leer",
      "type": "Löschungsankündigung",
      "state": "Niedersachsen",
      "amtsgericht": "Amtsgericht Aurich",
      "registernummer": "HRA 111569",
      "registerart": "HRA",
      "company_name": "MS \"Michigan Trader\" Schiffahrts UG (haftungsbeschränkt) & Co. KG",
      "company_seat": "Leer",
      "details": "07.05.2025 (Bekanntmachungsdatum)\n\nNiedersachsen Amtsgericht Aurich HRA 111569\nLöschungsankündigung\n\nMS \"Michigan Trader\" Schiffahrts UG (haftungsbeschränkt) & Co. KG\nKommanditgesellschaft\nLeer\n\nDas Registergericht beabsichtigt, die Firma von Amts wegen nach § 394 FamFG zu löschen. Die Frist zur Erhebung eines Widerspruchs ist auf 1 Monat ab dieser Registerbekanntmachung festgesetzt."
    },
    {
      "date": "2025-05-07",
      "id": "108328",
      "original_text": "Einreichung neuer Dokumente\nNiedersachsen Amtsgericht Braunschweig HRB 6008\nVerkehrsbetriebe Peine-Salzgitter Gesellschaft mit beschränkter Haftung – Salzgitter",
      "type": "Einreichung neuer Dokumente",
      "state": "Niedersachsen",
      "amtsgericht": "Amtsgericht Braunschweig",
      "registernummer": "HRB 6008",
      "registerart": "HRB",
      "company_name": "Verkehrsbetriebe Peine-Salzgitter Gesellschaft mit beschränkter Haftung",
      "company_seat": "Salzgitter",
      "details": "07.05.2025 (Bekanntmachungsdatum)\n\nNiedersachsen Amtsgericht Braunschweig HRB 6008\nEinreichung neuer Dokumente\n\nVerkehrsbetriebe Peine-Salzgitter Gesellschaft mit beschränkter Haftung\nGesellschaft mit beschränkter Haftung\nSalzgitter\n\nDie Liste der Mitglieder des Aufsichtsrats wurde beim Registergericht eingereicht."
    },
    {
      "date": "2025-05-07",
      "id": "108329",
      "original_text": "Einreichung neuer Dokumente\nNiedersachsen Amtsgericht Osnabrück HRB 17230\nIHH Industrie-+ Handels-Holding Aktiengesellschaft – Osnabrück",
      "type": "Einreichung neuer Dokumente",
      "state": "Niedersachsen",
      "amtsgericht": "Amtsgericht Osnabrück",
      "registernummer": "HRB 17230",
      "registerart": "HRB",
      "company_name": "IHH Industrie-+ Handels-Holding Aktiengesellschaft",
      "company_seat": "Osnabrück",
      "details": "07.05.2025 (Bekanntmachungsdatum)\n\nNiedersachsen Amtsgericht Osnabrück HRB 17230\nEinreichung neuer Dokumente\n\nIHH Industrie-+ Handels-Holding Aktiengesellschaft\nAktiengesellschaft\nOsnabrück\n\nDie Liste der Mitglieder des Aufsichtsrats wurde beim Registergericht eingereicht."
    },
    {
      "date": "2025-05-07",
      "id": "108330",
      "original_text": "Löschungsankündigung\nNiedersachsen Amtsgericht Osnabrück HRB 211556\nKK-Dienstleistungen UG (haftungsbeschränkt) – Osnabrück",
      "type": "Löschungsankündigung",
      "state": "Niedersachsen",
      "amtsgericht": "Amtsgericht Osnabrück",
      "registernummer": "HRB 211556",
      "registerart": "HRB",
      "company_name": "KK-Dienstleistungen UG (haftungsbeschränkt)",
      "company_seat": "Osnabrück",
      "details": "07.05.2025 (Bekanntmachungsdatum)\n\nNiedersachsen Amtsgericht Osnabrück HRB 211556\nLöschungsankündigung 07.05.2025 (Eintragungsdatum)\n\nKK-Dienstleistungen UG (haftungsbeschränkt)\nGesellschaft mit beschränkter Haftung\nOsnabrück\n\nDas Registergericht beabsichtigt, die Gesellschaft von Amts wegen nach § 394 FamFG wegen Vermögenslosigkeit zu löschen. Die Frist zur Erhebung eines Widerspruchs ist auf 1 Monat ab dieser Registerbekanntmachung festgesetzt."
    },
    {
      "date": "2025-05-07",
      "id": "108331",
      "original_text": "Registerbekanntmachung nach dem Umwandlungsgesetz\nRheinland-Pfalz Amtsgericht Zweibrücken HRB 11403\nSPIE InfoGraph GISMobil GmbH – Ramstein-Miesenbach",
      "type": "Registerbekanntmachung nach dem Umwandlungsgesetz",
      "state": "Rheinland-Pfalz",
      "amtsgericht": "Amtsgericht Zweibrücken",
      "registernummer": "HRB 11403",
      "registerart": "HRB",
      "company_name": "SPIE InfoGraph GISMobil GmbH",
      "company_seat": "Ramstein-Miesenbach",
      "details": "07.05.2025 (Bekanntmachungsdatum)\n\nRheinland-Pfalz Amtsgericht Zweibrücken HRB 11403\nRegisterbekanntmachung nach dem Umwandlungsgesetz 07.05.2025 (Eintragungsdatum)\n\nSPIE InfoGraph GISMobil GmbH\nGesellschaft mit beschränkter Haftung\nRamstein-Miesenbach\n\n.Als nicht eingetragen wird veröffentlicht: Den Gläubigern der an der Verschmelzung beteiligten Rechtsträger ist, wenn sie binnen sechs Monaten nach dem Tag, an dem die Eintragung der Verschmelzung in das Register des Sitzes desjenigen Rechtsträgers,dessen Gläubiger sie sind, nach § 19 Abs. 3 UmwG als bekannt gemacht gilt, ihren Anspruch nach Grund und Höhe schriftlich anmelden, Sicherheit zu leisten, soweit sie nicht Befriedigung verlangen können. Dieses Recht steht den Gläubigern jedoch nur zu, wenn sie glaubhaft machen, dass durch die Verschmelzung die Erfüllungd er Forderung gefährdet wird."
    },
    {
      "date": "2025-05-07",
      "id": "108332",
      "original_text": "Einreichung neuer Dokumente\nRheinland-Pfalz Amtsgericht Landau HRB 11293\nRheinspan Geschäftsführungsgesellschaft mbH – Germersheim",
      "type": "Einreichung neuer Dokumente",
      "state": "Rheinland-Pfalz",
      "amtsgericht": "Amtsgericht Landau",
      "registernummer": "HRB 11293",
      "registerart": "HRB",
      "company_name": "Rheinspan Geschäftsführungsgesellschaft mbH",
      "company_seat": "Germersheim",
      "details": "07.05.2025 (Bekanntmachungsdatum)\n\nRheinland-Pfalz Amtsgericht Landau HRB 11293\nEinreichung neuer Dokumente 07.05.2025 (Eintragungsdatum)\n\nRheinspan Geschäftsführungsgesellschaft mbH\nGesellschaft mit beschränkter Haftung\nGermersheim\n\nDem Registergericht ist eine Liste der Mitglieder des Aufsichtsrates eingereicht worden."
    },
    {
      "date": "2025-05-07",
      "id": "108333",
      "original_text": "Registerbekanntmachung nach dem Umwandlungsgesetz\nRheinland-Pfalz Amtsgericht Koblenz HRA 13158\nJ + R Wirths Logistik GmbH & Co. KG – St. Johann",
      "type": "Registerbekanntmachung nach dem Umwandlungsgesetz",
      "state": "Rheinland-Pfalz",
      "amtsgericht": "Amtsgericht Koblenz",
      "registernummer": "HRA 13158",
      "registerart": "HRA",
      "company_name": "J + R Wirths Logistik GmbH & Co. KG",
      "company_seat": "St. Johann",
      "details": "07.05.2025 (Bekanntmachungsdatum)\n\nRheinland-Pfalz Amtsgericht Koblenz HRA 13158\nRegisterbekanntmachung nach dem Umwandlungsgesetz 07.05.2025 (Eintragungsdatum)\n\nJ + R Wirths Logistik GmbH & Co. KG\nKommanditgesellschaft\nSt. Johann\n\nAls nicht eingetragen wird veröffentlicht: Den Gläubigern der an der Verschmelzung beteiligten Rechtsträger ist, wenn sie binnen sechs Monaten nach dem Tag, an dem die Eintragung der Verschmelzung in das Register des Sitzes desjenigen Rechtsträgers,dessen Gläubiger sie sind, nach § 19 Abs. 3 UmwG als bekannt gemacht gilt, ihren Anspruch nach Grund und Höhe schriftlich anmelden, Sicherheit zu leisten, soweit sie nicht Befriedigung verlangen können. Dieses Recht steht den Gläubigern jedoch nur zu, wenn sie glaubhaft machen, dass durch die Verschmelzung die Erfüllung der Forderung gefährdet wird."
    },
    {
      "date": "2025-05-07",
      "id": "108334",
      "original_text": "Löschungsankündigung\nRheinland-Pfalz Amtsgericht Montabaur HRB 21442\nM-Therm Comfort-Heating GmbH – Neuwied",
      "type": "Löschungsankündigung",
      "state": "Rheinland-Pfalz",
      "amtsgericht": "Amtsgericht Montabaur",
      "registernummer": "HRB 21442",
      "registerart": "HRB",
      "company_name": "M-Therm Comfort-Heating GmbH",
      "company_seat": "Neuwied",
      "details": "07.05.2025 (Bekanntmachungsdatum)\n\nRheinland-Pfalz Amtsgericht Montabaur HRB 21442\nLöschungsankündigung\n\nM-Therm Comfort-Heating GmbH\nGesellschaft mit beschränkter Haftung\nNeuwied\n\nDas Registergericht beabsichtigt die Gesellschaft von Amts wegen nach § 394 FamFG zu löschen. Die Frist zur Erhebung eines Widerspruchs ist auf einen Monat festgesetzt."
    },
    {
      "date": "2025-05-07",
      "id": "108335",
      "original_text": "Einreichung neuer Dokumente\nRheinland-Pfalz Amtsgericht Mainz HRB 51356\nJUWI GmbH – Wörrstadt",
      "type": "Einreichung neuer Dokumente",
      "state": "Rheinland-Pfalz",
      "amtsgericht": "Amtsgericht Mainz",
      "registernummer": "HRB 51356",
      "registerart": "HRB",
      "company_name": "JUWI GmbH",
      "company_seat": "Wörrstadt",
      "details": "07.05.2025 (Bekanntmachungsdatum)\n\nRheinland-Pfalz Amtsgericht Mainz HRB 51356\nEinreichung neuer Dokumente\n\nJUWI GmbH\nGesellschaft mit beschränkter Haftung\nWörrstadt\n\nDem Registergericht ist eine neue Liste der Mitglieder des Aufsichtsrates eingereicht worden."
    },
    {
      "date": "2025-05-07",
      "id": "108336",
      "original_text": "Löschungsankündigung\nNordrhein-Westfalen Amtsgericht Neuss HRB 21423\nAbbruch Lores GmbH – Neuss",
      "type": "Löschungsankündigung",
      "state": "Nordrhein-Westfalen",
      "amtsgericht": "Amtsgericht Neuss",
      "registernummer": "HRB 21423",
      "registerart": "HRB",
      "company_name": "Abbruch Lores GmbH",
      "company_seat": "Neuss",
      "details": "07.05.2025 (Bekanntmachungsdatum)\n\nNordrhein-Westfalen Amtsgericht Neuss HRB 21423\nLöschungsankündigung 07.05.2025 (Eintragungsdatum)\n\nAbbruch Lores GmbH\nGesellschaft mit beschränkter Haftung\nNeuss\n\nDas Registergericht beabsichtigt die Gesellschaft wegen Vermögenslosigkeit aufgrund des § 394 Abs. 1 FamFG zu löschen. Frist zur Geltendmachung eines Widerspruchs: 1 Monat.\nRechtsbehelfsbelehrung:\nGegen diese Verfügung können Sie Widerspruch einlegen.\nDer Widerspruch ist bei dem Amtsgericht Neuss - Registergericht -, Breite Str. 48, 41460 Neuss schriftlich in deutscher Sprache oder zur Niederschrift der Geschäftsstelle einzulegen.\nDer Widerspruch kann auch zur Niederschrift der Geschäftsstelle eines jeden Amtsgerichtes abgegeben werden.\nDie Einlegung ist auch durch Übertragung eines elektronischen Dokuments an die elektronische Poststelle des Gerichts möglich. Das elektronische Dokument muss für die Bearbeitung durch das Gericht geeignet und mit einer qualifizierten elektronischen Signatur der verantwortenden Person versehen sein oder von der verantwortenden Person signiert und auf einem sicheren Übermittlungsweg gemäß § 130a ZPO nach näherer Maßgabe der Verordnung über die technischen Rahmenbedingungen des elektronischen Rechtsverkehrs und über das besondere elektronische Behördenpostfach (BGBl. I, S.3803) eingereicht werden. Weitere Informationen erhalten Sie auf der Internetseite www.justiz.de.\nDer Widerspruch muss spätestens innerhalb der gesetzten Frist nach der schriftlichen Bekanntgabe der Verfügung bei dem Amtsgericht - Registergericht - Neuss eingegangen sein. Dies gilt auch dann, wenn der Widerspruch zur Niederschrift der Geschäftsstelle eines anderen Amtsgerichtes abgegeben wurde. Die Frist beginnt mit der schriftlichen Bekanntgabe der Verfügung. Die Bekanntgabe ist entweder durch Zustellung oder am dritten Tage nach Aufgabe zur Post bewirkt. Fällt das Ende der Frist auf einen Sonntag, einen allgemeinen Feiertag oder Sonnabend, so endet die Frist mit Ablauf des nächsten Werktages.\nDer Widerspruch muss die Bezeichnung der angefochtenen Verfügung sowie die Erklärung enthalten, dass Widerspruch gegen diese Verfügung eingelegt wird. Er ist zu unterzeichnen und soll begründet werden."
    },
    {
      "date": "2025-05-07",
      "id": "108337",
      "original_text": "Löschungsankündigung\nNordrhein-Westfalen Amtsgericht Hamm HRB 9731\nWHB Bau GmbH – Kamen",
      "type": "Löschungsankündigung",
      "state": "Nordrhein-Westfalen",
      "amtsgericht": "Amtsgericht Hamm",
      "registernummer": "HRB 9731",
      "registerart": "HRB",
      "company_name": "WHB Bau GmbH",
      "company_seat": "Kamen",
      "details": "07.05.2025 (Bekanntmachungsdatum)\n\nNordrhein-Westfalen Amtsgericht Hamm HRB 9731\nLöschungsankündigung\n\nWHB Bau GmbH\nGesellschaft mit beschränkter Haftung\nKamen\n\nDas Registergericht beabsichtigt die Gesellschaft von Amts wegen nach § 394 FamFG zu löschen. Die Frist zur Erhebung eines Widerspruchs ist auf drei Monate festgesetzt."
    },
    {
      "date": "2025-05-07",
      "id": "108338",
      "original_text": "Löschungsankündigung\nNordrhein-Westfalen Amtsgericht Siegburg HRB 10889\nTW Thermo Warmdach GmbH – Siegburg",
      "type": "Löschungsankündigung",
      "state": "Nordrhein-Westfalen",
      "amtsgericht": "Amtsgericht Siegburg",
      "registernummer": "HRB 10889",
      "registerart": "HRB",
      "company_name": "TW Thermo Warmdach GmbH",
      "company_seat": "Siegburg",
      "details": "07.05.2025 (Bekanntmachungsdatum)\n\nNordrhein-Westfalen Amtsgericht Siegburg HRB 10889\nLöschungsankündigung\n\nTW Thermo Warmdach GmbH\nGesellschaft mit beschränkter Haftung\nSiegburg\n\nDas Registergericht hat glaubhafte Kenntnis erlangt, dass die Gesellschaft vermögenslos geworden ist, da ein Insolvenzverfahren durchgeführt und nach § 200 InsO aufgehoben wurde.\n\nEs ist daher beabsichtigt, die Gesellschaft nach § 394 FamFG im Handelsregister wegen Vermögenslosigkeit zu löschen.\n\nEinwände gegen die Löschung sind durch Widerspruch binnen einer Frist von 3 Monaten geltend zu machen, andernfalls die Löschung erfolgen wird.\n\nEinzulegen ist der Widerspruch bei dem Amtsgericht Siegburg, Neue Poststraße 16, 53721 Siegburg, und zwar entweder schriftlich in deutscher Sprache oder mündlich zur Niederschrift der Geschäftsstelle. Der Widerspruch kann auch zur Niederschrift der Geschäftsstelle eines jeden Amtsgerichts abgegeben werden. Der Widerspruch ist binnen der in der Verfügung bestimmten Frist einzulegen. Die Frist ist nur gewahrt, wenn der Widerspruch rechtzeitig bei dem Amtsgericht Siegburg eingeht, auch wenn der Widerspruch zur Niederschrift der Geschäftsstelle eines anderen Amtsgerichts abgegeben wurde. Die Frist beginnt jeweils mit der schriftlichen Bekanntgabe der Verfügung an die Beteiligten. Kann die schriftliche Bekanntgabe an einen Beteiligten nicht bewirkt werden, beginnt die Frist spätestens mit Ablauf von fünf Monaten nach Erlass der Verfügung. Die Bekanntgabe ist entweder durch Zustellung oder am dritten Tage nach Aufgabe zur Post bewirkt. Sofern die Löschung noch nicht erfolgt ist, kann der Widerspruch auch noch nach Ablauf der Frist eingelegt werden. Fällt das Ende der Frist auf einen Sonnabend, einen Sonntag oder einen allgemeinen Feiertag, endet die Frist mit Ablauf des nächsten Werktages. Der Widerspruch ist zu unterzeichnen. Eine Begründung des Widerspruchs ist nicht vorgeschrieben."
    },
    {
      "date": "2025-05-07",
      "id": "108339",
      "original_text": "Einreichung neuer Dokumente\nNordrhein-Westfalen Amtsgericht Iserlohn HRB 85\nGesellschaft für Wirtschaftsförderung Iserlohn mit beschränkter Haftung – Iserlohn",
      "type": "Einreichung neuer Dokumente",
      "state": "Nordrhein-Westfalen",
      "amtsgericht": "Amtsgericht Iserlohn",
      "registernummer": "HRB 85",
      "registerart": "HRB",
      "company_name": "Gesellschaft für Wirtschaftsförderung Iserlohn mit beschränkter Haftung",
      "company_seat": "Iserlohn",
      "details": "07.05.2025 (Bekanntmachungsdatum)\n\nNordrhein-Westfalen Amtsgericht Iserlohn HRB 85\nEinreichung neuer Dokumente 07.05.2025 (Eintragungsdatum)\n\nGesellschaft für Wirtschaftsförderung Iserlohn mit beschränkter Haftung\nGesellschaft mit beschränkter Haftung\nIserlohn\n\nDem Registergericht ist eine neue Liste der Mitglieder des Aufsichtsrates eingereicht worden."
    },
    {
      "date": "2025-05-07",
      "id": "108340",
      "original_text": "Registerbekanntmachung nach dem Umwandlungsgesetz\nNordrhein-Westfalen Amtsgericht Gütersloh HRB 12843\nAlfred Willich GmbH – Versmold",
      "type": "Registerbekanntmachung nach dem Umwandlungsgesetz",
      "state": "Nordrhein-Westfalen",
      "amtsgericht": "Amtsgericht Gütersloh",
      "registernummer": "HRB 12843",
      "registerart": "HRB",
      "company_name": "Alfred Willich GmbH",
      "company_seat": "Versmold",
      "details": "07.05.2025 (Bekanntmachungsdatum)\n\nNordrhein-Westfalen Amtsgericht Gütersloh HRB 12843\nRegisterbekanntmachung nach dem Umwandlungsgesetz 07.05.2025 (Eintragungsdatum)\n\nAlfred Willich GmbH\nGesellschaft mit beschränkter Haftung\nVersmold\n\nDen Gläubigern der an der Verschmelzung beteiligten Rechtsträger ist, wenn sie binnen sechs Monaten nach dem Tag, an dem die Eintragung der Verschmelzung in das Register des Sitzes desjenigen Rechtsträgers, dessen Gläubiger sie sind, nach § 19 Absatz 3 UmwG als bekanntgemacht gilt, ihren Anspruch nach Grund und Höhe schriftlich anmelden, Sicherheit zu leisten, soweit sie nicht Befriedigung verlangen können. Dieses Recht steht den Gläubigern jedoch nur zu, wenn sie glaubhaft machen, dass durch die Verschmelzung die Erfüllung ihrer Forderung gefährdet wird."
    },
    {
      "date": "2025-05-07",
      "id": "108341",
      "original_text": "Sonstige Registerbekanntmachung\nNordrhein-Westfalen Amtsgericht Mönchengladbach HRB 13109\nLOGIFLEX GmbH – Mönchengladbach",
      "type": "Sonstige Registerbekanntmachung",
      "state": "Nordrhein-Westfalen",
      "amtsgericht": "Amtsgericht Mönchengladbach",
      "registernummer": "HRB 13109",
      "registerart": "HRB",
      "company_name": "LOGIFLEX GmbH",
      "company_seat": "Mönchengladbach",
      "details": "07.05.2025 (Bekanntmachungsdatum)\n\nNordrhein-Westfalen Amtsgericht Mönchengladbach HRB 13109\nSonstige Registerbekanntmachung 07.05.2025 (Eintragungsdatum)\n\nLOGIFLEX GmbH\nGesellschaft mit beschränkter Haftung\nMönchengladbach\n\nAls nicht eingetragen wird veröffentlicht: Den Gläubigern der Gesellschaft, deren Forderungen begründet worden sind bevor die Eintragung der Beendigung des Beherrschungs- und Gewinnabführungsvertrages  in das Handelsregister nach § 10 des Handelsgesetzbuches als bekanntgemacht gilt, hat der andere Vertragsteil Sicherheit zu leisten, wenn sie sich binnen sechs Monaten nach der Bekanntmachung der Eintragung zu diesem Zweck bei ihm melden."
    },
    {
      "date": "2025-05-07",
      "id": "108342",
      "original_text": "Löschungsankündigung\nNordrhein-Westfalen Amtsgericht Bonn HRB 27529\nM.V. Überdachungen UG (haftungsbeschränkt) – Bonn",
      "type": "Löschungsankündigung",
      "state": "Nordrhein-Westfalen",
      "amtsgericht": "Amtsgericht Bonn",
      "registernummer": "HRB 27529",
      "registerart": "HRB",
      "company_name": "M.V. Überdachungen UG (haftungsbeschränkt)",
      "company_seat": "Bonn",
      "details": "07.05.2025 (Bekanntmachungsdatum)\n\nNordrhein-Westfalen Amtsgericht Bonn HRB 27529\nLöschungsankündigung\n\nM.V. Überdachungen UG (haftungsbeschränkt)\nGesellschaft mit beschränkter Haftung\nBonn\n\nDas Registergericht beabsichtigt die Gesellschaft von Amts wegen nach § 394 FamFG zu löschen. Die Frist zur Erhebung eines Widerspruchs ist auf einen Monat festgesetzt."
    },
    {
      "date": "2025-05-07",
      "id": "108343",
      "original_text": "Registerbekanntmachung nach dem Umwandlungsgesetz\nNordrhein-Westfalen Amtsgericht Gütersloh HRB 11476\nWillich Feed Systems GmbH – Versmold",
      "type": "Registerbekanntmachung nach dem Umwandlungsgesetz",
      "state": "Nordrhein-Westfalen",
      "amtsgericht": "Amtsgericht Gütersloh",
      "registernummer": "HRB 11476",
      "registerart": "HRB",
      "company_name": "Willich Feed Systems GmbH",
      "company_seat": "Versmold",
      "details": "07.05.2025 (Bekanntmachungsdatum)\n\nNordrhein-Westfalen Amtsgericht Gütersloh HRB 11476\nRegisterbekanntmachung nach dem Umwandlungsgesetz 07.05.2025 (Eintragungsdatum)\n\nWillich Feed Systems GmbH\nGesellschaft mit beschränkter Haftung\nVersmold\n\nDen Gläubigern der an der Verschmelzung beteiligten Rechtsträger ist, wenn sie binnen sechs Monaten nach dem Tag, an dem die Eintragung der Verschmelzung in das Register des Sitzes desjenigen Rechtsträgers, dessen Gläubiger sie sind, nach § 19 Absatz 3 UmwG als bekanntgemacht gilt, ihren Anspruch nach Grund und Höhe schriftlich anmelden, Sicherheit zu leisten, soweit sie nicht Befriedigung verlangen können. Dieses Recht steht den Gläubigern jedoch nur zu, wenn sie glaubhaft machen, dass durch die Verschmelzung die Erfüllung ihrer Forderung gefährdet wird."
    },
    {
      "date": "2025-05-07",
      "id": "108344",
      "original_text": "Registerbekanntmachung nach dem Umwandlungsgesetz\nNordrhein-Westfalen Amtsgericht Gütersloh HRB 11475\nAlfred Willich Produktions GmbH – Versmold",
      "type": "Registerbekanntmachung nach dem Umwandlungsgesetz",
      "state": "Nordrhein-Westfalen",
      "amtsgericht": "Amtsgericht Gütersloh",
      "registernummer": "HRB 11475",
      "registerart": "HRB",
      "company_name": "Alfred Willich Produktions GmbH",
      "company_seat": "Versmold",
      "details": "07.05.2025 (Bekanntmachungsdatum)\n\nNordrhein-Westfalen Amtsgericht Gütersloh HRB 11475\nRegisterbekanntmachung nach dem Umwandlungsgesetz 07.05.2025 (Eintragungsdatum)\n\nAlfred Willich Produktions GmbH\nGesellschaft mit beschränkter Haftung\nVersmold\n\nDen Gläubigern der an der Verschmelzung beteiligten Rechtsträger ist, wenn sie binnen sechs Monaten nach dem Tag, an dem die Eintragung der Verschmelzung in das Register des Sitzes desjenigen Rechtsträgers, dessen Gläubiger sie sind, nach § 19 Absatz 3 UmwG als bekanntgemacht gilt, ihren Anspruch nach Grund und Höhe schriftlich anmelden, Sicherheit zu leisten, soweit sie nicht Befriedigung verlangen können. Dieses Recht steht den Gläubigern jedoch nur zu, wenn sie glaubhaft machen, dass durch die Verschmelzung die Erfüllung ihrer Forderung gefährdet wird."
    },
    {
      "date": "2025-05-07",
      "id": "108345",
      "original_text": "Löschungsankündigung\nNordrhein-Westfalen Amtsgericht Krefeld HRB 18416\nSchwarz-Handel GmbH – Krefeld",
      "type": "Löschungsankündigung",
      "state": "Nordrhein-Westfalen",
      "amtsgericht": "Amtsgericht Krefeld",
      "registernummer": "HRB 18416",
      "registerart": "HRB",
      "company_name": "Schwarz-Handel GmbH",
      "company_seat": "Krefeld",
      "details": "07.05.2025 (Bekanntmachungsdatum)\n\nNordrhein-Westfalen Amtsgericht Krefeld HRB 18416\nLöschungsankündigung\n\nSchwarz-Handel GmbH\nGesellschaft mit beschränkter Haftung\nKrefeld\n\nDas Registergericht beabsichtigt die Gesellschaft von Amts wegen nach § 394 FamFG zu löschen. Die Frist zur Erhebung eines Widerspruchs ist auf einen Monat festgesetzt."
    },
    {
      "date": "2025-05-07",
      "id": "108346",
      "original_text": "Registerbekanntmachung nach dem Umwandlungsgesetz\nNordrhein-Westfalen Amtsgericht Gütersloh HRB 12843\nAlfred Willich Produktions GmbH – Versmold",
      "type": "Registerbekanntmachung nach dem Umwandlungsgesetz",
      "state": "Nordrhein-Westfalen",
      "amtsgericht": "Amtsgericht Gütersloh",
      "registernummer": "HRB 12843",
      "registerart": "HRB",
      "company_name": "Alfred Willich Produktions GmbH",
      "company_seat": "Versmold",
      "details": "07.05.2025 (Bekanntmachungsdatum)\n\nNordrhein-Westfalen Amtsgericht Gütersloh HRB 12843\nRegisterbekanntmachung nach dem Umwandlungsgesetz 07.05.2025 (Eintragungsdatum)\n\nAlfred Willich Produktions GmbH\nGesellschaft mit beschränkter Haftung\nVersmold\n\nDen Gläubigern der an der Verschmelzung beteiligten Rechtsträger ist, wenn sie binnen sechs Monaten nach dem Tag, an dem die Eintragung der Verschmelzung in das Register des Sitzes desjenigen Rechtsträgers, dessen Gläubiger sie sind, nach § 19 Absatz 3 UmwG als bekanntgemacht gilt, ihren Anspruch nach Grund und Höhe schriftlich anmelden, Sicherheit zu leisten, soweit sie nicht Befriedigung verlangen können. Dieses Recht steht den Gläubigern jedoch nur zu, wenn sie glaubhaft machen, dass durch die Verschmelzung die Erfüllung ihrer Forderung gefährdet wird."
    },
    {
      "date": "2025-05-07",
      "id": "108347",
      "original_text": "Registerbekanntmachung nach dem Umwandlungsgesetz\nNordrhein-Westfalen Amtsgericht Köln GsR 1970\ndigitalshopz-Nachfolge-eGbR – Köln",
      "type": "Registerbekanntmachung nach dem Umwandlungsgesetz",
      "state": "Nordrhein-Westfalen",
      "amtsgericht": "Amtsgericht Köln",
      "registernummer": "GsR 1970",
      "registerart": "GsR",
      "company_name": "digitalshopz-Nachfolge-eGbR",
      "company_seat": "Köln",
      "details": "07.05.2025 (Bekanntmachungsdatum)\n\nNordrhein-Westfalen Amtsgericht Köln GsR 1970\nRegisterbekanntmachung nach dem Umwandlungsgesetz 07.05.2025 (Eintragungsdatum)\n\ndigitalshopz-Nachfolge-eGbR\nGesellschaft bürgerlichen Rechts\nKöln\n\nDen Gläubigern der an der formwechselnden Umwandlung beteiligten Rechtsträger ist, wenn sie binnen sechs Monaten nach dem Tag, an dem die Eintragung der formwechselnden Umwandlung in das Register des Sitzes desjenigen Rechtsträgers, dessen Gläubiger sie sind, nach § 19 Absatz 3 UmwG als bekanntgemacht gilt, ihren Anspruch nach Grund und Höhe schriftlich anmelden, Sicherheit zu leisten, soweit sie nicht Befriedigung verlangen können. Dieses Recht steht den Gläubigern jedoch nur zu, wenn sie glaubhaft machen, dass durch die formwechselnden Umwandlung die Erfüllung ihrer Forderung gefährdet wird."
    },
    {
      "date": "2025-05-07",
      "id": "108348",
      "original_text": "Registerbekanntmachung nach dem Umwandlungsgesetz\nBremen Amtsgericht Bremen HRB 22006\nOAS Aktiengesellschaft – Bremen",
      "type": "Registerbekanntmachung nach dem Umwandlungsgesetz",
      "state": "Bremen",
      "amtsgericht": "Amtsgericht Bremen",
      "registernummer": "HRB 22006",
      "registerart": "HRB",
      "company_name": "OAS Aktiengesellschaft",
      "company_seat": "Bremen",
      "details": "07.05.2025 (Bekanntmachungsdatum)\n\nBremen Amtsgericht Bremen HRB 22006\nRegisterbekanntmachung nach dem Umwandlungsgesetz 30.04.2025 (Eintragungsdatum)\n\nOAS Aktiengesellschaft\nAktiengesellschaft\nBremen\n\nZu Eintragungsnummer 31 vom 30.04.2025 wird als nicht eingetragen veröffentlicht:  Den Gläubigern der an der Verschmelzung beteiligten Rechtsträger ist, wenn sie binnen sechs Monaten nach dem Tag, an dem die Eintragung der Verschmelzung in das Register des Sitzes desjenigen Rechtsträgers, dessen Gläubiger sie sind, als bekannt gemacht gilt, ihren Anspruch nach Grund und Höhe schriftlich anmelden, Sicherheit zu leisten, soweit sie nicht Befriedigung verlangen können. Dieses Recht steht den Gläubigern jedoch nur zu, wenn sie glaubhaft machen, dass durch die Verschmelzung die Erfüllung ihrer Forderung gefährdet wird. Das Recht, Sicherheitsleistung zu verlangen, steht Gläubigern nicht zu, die im Falle der Insolvenz ein Recht auf vorzugsweise Befriedigung aus einer Deckungsmasse haben, die nach gesetzlicher Vorschrift zu ihrem Schutz errichtet und staatlich überwacht ist."
    },
    {
      "date": "2025-05-07",
      "id": "108349",
      "original_text": "Registerbekanntmachung nach dem Umwandlungsgesetz\nBremen Amtsgericht Bremen HRB 26877\nOAS Automation GmbH – Bremen",
      "type": "Registerbekanntmachung nach dem Umwandlungsgesetz",
      "state": "Bremen",
      "amtsgericht": "Amtsgericht Bremen",
      "registernummer": "HRB 26877",
      "registerart": "HRB",
      "company_name": "OAS Automation GmbH",
      "company_seat": "Bremen",
      "details": "07.05.2025 (Bekanntmachungsdatum)\n\nBremen Amtsgericht Bremen HRB 26877\nRegisterbekanntmachung nach dem Umwandlungsgesetz 30.04.2025 (Eintragungsdatum)\n\nOAS Automation GmbH\nGesellschaft mit beschränkter Haftung\nBremen\n\nZu Eintragungsnummer 4 vom 30.04.2025 wird als nicht eingetragen veröffentlicht:  Den Gläubigern der an der Verschmelzung beteiligten Rechtsträger ist, wenn sie binnen sechs Monaten nach dem Tag, an dem die Eintragung der Verschmelzung in das Register des Sitzes desjenigen Rechtsträgers, dessen Gläubiger sie sind, als bekannt gemacht gilt, ihren Anspruch nach Grund und Höhe schriftlich anmelden, Sicherheit zu leisten, soweit sie nicht Befriedigung verlangen können. Dieses Recht steht den Gläubigern jedoch nur zu, wenn sie glaubhaft machen, dass durch die Verschmelzung die Erfüllung ihrer Forderung gefährdet wird. Das Recht, Sicherheitsleistung zu verlangen, steht Gläubigern nicht zu, die im Falle der Insolvenz ein Recht auf vorzugsweise Befriedigung aus einer Deckungsmasse haben, die nach gesetzlicher Vorschrift zu ihrem Schutz errichtet und staatlich überwacht ist."
    },
    {
      "date": "2025-05-07",
      "id": "108350",
      "original_text": "Löschungsankündigung\nBremen Amtsgericht Bremen HRB 31612\nCurafact GmbH – Bremen",
      "type": "Löschungsankündigung",
      "state": "Bremen",
      "amtsgericht": "Amtsgericht Bremen",
      "registernummer": "HRB 31612",
      "registerart": "HRB",
      "company_name": "Curafact GmbH",
      "company_seat": "Bremen",
      "details": "07.05.2025 (Bekanntmachungsdatum)\n\nBremen Amtsgericht Bremen HRB 31612\nLöschungsankündigung\n\nCurafact GmbH\nGesellschaft mit beschränkter Haftung\nBremen\n\nEs ist beabsichtigt die im Handelsregister eingetragene Gesellschaft von Amts wegen gemäß § 394 FamFG zu löschen. Gegen die Löschung kann beim AG Bremen schriftlich oder zu Protokoll der Geschäftsstelle Widerspruch eingelegt werden. Widerspruchsfrist 4 Wochen."
    },
    {
      "date": "2025-05-07",
      "id": "108351",
      "original_text": "Löschungsankündigung\nBremen Amtsgericht Bremen HRA 25088\nAutozentrum Walle KG – Bremen",
      "type": "Löschungsankündigung",
      "state": "Bremen",
      "amtsgericht": "Amtsgericht Bremen",
      "registernummer": "HRA 25088",
      "registerart": "HRA",
      "company_name": "Autozentrum Walle KG",
      "company_seat": "Bremen",
      "details": "07.05.2025 (Bekanntmachungsdatum)\n\nBremen Amtsgericht Bremen HRA 25088\nLöschungsankündigung\n\nAutozentrum Walle KG\nKommanditgesellschaft\nBremen\n\nEs ist beabsichtigt die im Handelsregister eingetragene Firma von Amts wegen gemäß § 31 Abs.2 HGB zu löschen. Gegen die Löschung kann beim AG Bremen schriftlich oder zu Protokoll der Geschäftsstelle Widerspruch eingelegt werden. Widerspruchsfrist 4 Wochen."
    },
    {
      "date": "2025-05-07",
      "id": "108352",
      "original_text": "Registerbekanntmachung nach dem Umwandlungsgesetz\nNordrhein-Westfalen Amtsgericht Dortmund HRB 20663\nadesso SE – Dortmund",
      "type": "Registerbekanntmachung nach dem Umwandlungsgesetz",
      "state": "Nordrhein-Westfalen",
      "amtsgericht": "Amtsgericht Dortmund",
      "registernummer": "HRB 20663",
      "registerart": "HRB",
      "company_name": "adesso SE",
      "company_seat": "Dortmund",
      "details": "07.05.2025 (Bekanntmachungsdatum)\n\nNordrhein-Westfalen Amtsgericht Dortmund HRB 20663\nRegisterbekanntmachung nach dem Umwandlungsgesetz 07.05.2025 (Eintragungsdatum)\n\nadesso SE\nEuropäische Aktiengesellschaft (SE)\nDortmund\n\nDen Gläubigern der an der Verschmelzung beteiligten Rechtsträger ist, wenn sie binnen sechs Monaten nach dem Tag, an dem die Eintragung der Verschmelzung in das Register des Sitzes desjenigen Rechtsträgers, dessen Gläubiger sie sind, nach § 19 Absatz 3 UmwG als bekanntgemacht gilt, ihren Anspruch nach Grund und Höhe schriftlich anmelden, Sicherheit zu leisten, soweit sie nicht Befriedigung verlangen können. Dieses Recht steht den Gläubigern jedoch nur zu, wenn sie glaubhaft machen, dass durch die Verschmelzung die Erfüllung ihrer Forderung gefährdet wird."
    },
    {
      "date": "2025-05-07",
      "id": "108353",
      "original_text": "Registerbekanntmachung nach dem Umwandlungsgesetz\nNordrhein-Westfalen Amtsgericht Bad Oeynhausen HRB 17716\nStallmann Outdoor UG (haftungsbeschränkt) – Löhne",
      "type": "Registerbekanntmachung nach dem Umwandlungsgesetz",
      "state": "Nordrhein-Westfalen",
      "amtsgericht": "Amtsgericht Bad Oeynhausen",
      "registernummer": "HRB 17716",
      "registerart": "HRB",
      "company_name": "Stallmann Outdoor UG (haftungsbeschränkt)",
      "company_seat": "Löhne",
      "details": "07.05.2025 (Bekanntmachungsdatum)\n\nNordrhein-Westfalen Amtsgericht Bad Oeynhausen HRB 17716\nRegisterbekanntmachung nach dem Umwandlungsgesetz 07.05.2025 (Eintragungsdatum)\n\nStallmann Outdoor UG (haftungsbeschränkt)\nGesellschaft mit beschränkter Haftung\nLöhne\n\nDen Gläubigern der an der Verschmelzung beteiligten Rechtsträger ist, wenn sie binnen sechs Monaten nach dem Tag, an dem die Eintragung der Verschmelzung in das Register des Sitzes desjenigen Rechtsträgers, dessen Gläubiger sie sind, nach § 19 Absatz 3 UmwG als bekanntgemacht gilt, ihren Anspruch nach Grund und Höhe schriftlich anmelden, Sicherheit zu leisten, soweit sie nicht Befriedigung verlangen können. Dieses Recht steht den Gläubigern jedoch nur zu, wenn sie glaubhaft machen, dass durch die Verschmelzung die Erfüllung ihrer Forderung gefährdet wird."
    },
    {
      "date": "2025-05-07",
      "id": "108354",
      "original_text": "Löschungsankündigung\nNordrhein-Westfalen Amtsgericht Düsseldorf HRB 72671\nTeamsport Deutschland Sportswear Vertriebs GmbH – Ratingen",
      "type": "Löschungsankündigung",
      "state": "Nordrhein-Westfalen",
      "amtsgericht": "Amtsgericht Düsseldorf",
      "registernummer": "HRB 72671",
      "registerart": "HRB",
      "company_name": "Teamsport Deutschland Sportswear Vertriebs GmbH",
      "company_seat": "Ratingen",
      "details": "07.05.2025 (Bekanntmachungsdatum)\n\nNordrhein-Westfalen Amtsgericht Düsseldorf HRB 72671\nLöschungsankündigung\n\nTeamsport Deutschland Sportswear Vertriebs GmbH\nGesellschaft mit beschränkter Haftung\nRatingen\n\nDas Registergericht beabsichtigt die Gesellschaft von Amts wegen nach § 394 FamFG zu löschen. Die Frist zur Erhebung eines Widerspruchs ist auf 3 Wochen festgesetzt.\n\nRechtsbehelfsbelehrung:\nDas Widerspruchsrecht steht jedem zu, der an der Unterlassung der Löschung ein berechtigtes Interesse hat. Der Widerspruch ist bei dem Amtsgericht Düsseldorf -Registergericht-, Werdener Straße 1, 40227 Düsseldorf schriftlich in deutscher Sprache oder zur Niederschrift der Geschäftsstelle einzulegen. Der Widerspruch kann auch zur Niederschrift der Geschäftsstelle eines jeden Amtsgerichtes abgegeben werden. Die Einlegung ist auch durch Übertragung eines elektronischen Dokuments an die elektronische Poststelle des Gerichts möglich. Das elektronische Dokument muss für die Bearbeitung durch das Gericht geeignet und mit einer qualifizierten elektronischen Signatur der verantwortenden Person versehen sein oder von der verantwortenden Person signiert und auf einem sicheren Übermittlungsweg gemäß § 130a ZPO nach näherer Maßgabe der Verordnung über die technischen Rahmenbedingungen des elektronischen Rechtsverkehrs und über das besondere elektronische Behördenpostfach (BGBl. I, S.3803) eingereicht werden. Weitere Informationen erhalten Sie auf der Internetseite www.justiz.de.\nDer Widerspruch muss spätestens innerhalb der gesetzten Frist nach dem Datum der Bekanntmachung der Löschungsankündigung bei dem Amtsgericht - Registergericht - Düsseldorf eingegangen sein.  Dies gilt auch dann, wenn der Widerspruch zur Niederschrift der Geschäftsstelle eines anderen Amtsgerichtes abgegeben wurde. Die Frist beginnt mit dem Tage der Bekanntmachung der Löschungsankündigung in dem für die Bekanntmachung der Eintragungen in das Handelsregister bestimmten elektronischen Informations- und Kommunikationssystem nach § 10 des Handelsgesetzbuches. Fällt das Ende der Frist auf einen Sonntag, einen allgemeinen Feiertag oder Sonnabend, so endet die Frist mit Ablauf des nächsten Werktages.\nDer Widerspruch muss die Bezeichnung der angefochtenen Löschungsankündigung sowie die Erklärung enthalten, dass Widerspruch gegen diese Löschungsankündigung eingelegt wird. Er ist zu unterzeichnen und soll begründet werden."
    },
    {
      "date": "2025-05-07",
      "id": "108355",
      "original_text": "Registerbekanntmachung nach dem Umwandlungsgesetz\nNordrhein-Westfalen Amtsgericht Düsseldorf HRB 67588\nUnilin Flooring Deutschland GmbH – Düsseldorf",
      "type": "Registerbekanntmachung nach dem Umwandlungsgesetz",
      "state": "Nordrhein-Westfalen",
      "amtsgericht": "Amtsgericht Düsseldorf",
      "registernummer": "HRB 67588",
      "registerart": "HRB",
      "company_name": "Unilin Flooring Deutschland GmbH",
      "company_seat": "Düsseldorf",
      "details": "07.05.2025 (Bekanntmachungsdatum)\n\nNordrhein-Westfalen Amtsgericht Düsseldorf HRB 67588\nRegisterbekanntmachung nach dem Umwandlungsgesetz 07.05.2025 (Eintragungsdatum)\n\nUnilin Flooring Deutschland GmbH\nGesellschaft mit beschränkter Haftung\nDüsseldorf\n\nDen Gläubigern der an der Verschmelzung beteiligten Rechtsträger ist, wenn sie binnen sechs Monaten nach dem Tag, an dem die Eintragung der Verschmelzung in das Register des Sitzes desjenigen Rechtsträgers, dessen Gläubiger sie sind, nach § 19 Absatz 3 UmwG als bekanntgemacht gilt, ihren Anspruch nach Grund und Höhe schriftlich anmelden, Sicherheit zu leisten, soweit sie nicht Befriedigung verlangen können. Dieses Recht steht den Gläubigern jedoch nur zu, wenn sie glaubhaft machen, dass durch die Verschmelzung die Erfüllung ihrer Forderung gefährdet wird."
    },
    {
      "date": "2025-05-07",
      "id": "108356",
      "original_text": "Registerbekanntmachung nach dem Umwandlungsgesetz\nNordrhein-Westfalen Amtsgericht Dortmund HRB 13763\nadesso mobile solutions GmbH – Dortmund",
      "type": "Registerbekanntmachung nach dem Umwandlungsgesetz",
      "state": "Nordrhein-Westfalen",
      "amtsgericht": "Amtsgericht Dortmund",
      "registernummer": "HRB 13763",
      "registerart": "HRB",
      "company_name": "adesso mobile solutions GmbH",
      "company_seat": "Dortmund",
      "details": "07.05.2025 (Bekanntmachungsdatum)\n\nNordrhein-Westfalen Amtsgericht Dortmund HRB 13763\nRegisterbekanntmachung nach dem Umwandlungsgesetz 07.05.2025 (Eintragungsdatum)\n\nadesso mobile solutions GmbH\nGesellschaft mit beschränkter Haftung\nDortmund\n\nDen Gläubigern der an der Verschmelzung beteiligten Rechtsträger ist, wenn sie binnen sechs Monaten nach dem Tag, an dem die Eintragung der Verschmelzung in das Register des Sitzes desjenigen Rechtsträgers, dessen Gläubiger sie sind, nach § 19 Absatz 3 UmwG als bekanntgemacht gilt, ihren Anspruch nach Grund und Höhe schriftlich anmelden, Sicherheit zu leisten, soweit sie nicht Befriedigung verlangen können. Dieses Recht steht den Gläubigern jedoch nur zu, wenn sie glaubhaft machen, dass durch die Verschmelzung die Erfüllung ihrer Forderung gefährdet wird."
    },
    {
      "date": "2025-05-07",
      "id": "108357",
      "original_text": "Einreichung neuer Dokumente\nNordrhein-Westfalen Amtsgericht Dortmund HRB 3134\nVOLKSWOHL-BUND SACHVERSICHERUNG AKTIENGESELLSCHAFT – Dortmund",
      "type": "Einreichung neuer Dokumente",
      "state": "Nordrhein-Westfalen",
      "amtsgericht": "Amtsgericht Dortmund",
      "registernummer": "HRB 3134",
      "registerart": "HRB",
      "company_name": "VOLKSWOHL-BUND SACHVERSICHERUNG AKTIENGESELLSCHAFT",
      "company_seat": "Dortmund",
      "details": "07.05.2025 (Bekanntmachungsdatum)\n\nNordrhein-Westfalen Amtsgericht Dortmund HRB 3134\nEinreichung neuer Dokumente\n\nVOLKSWOHL-BUND SACHVERSICHERUNG AKTIENGESELLSCHAFT\nAktiengesellschaft\nDortmund\n\nDem Registergericht ist eine neue Liste der Mitglieder des Aufsichtsrates eingereicht worden."
    },
    {
      "date": "2025-05-07",
      "id": "108358",
      "original_text": "Registerbekanntmachung nach dem Umwandlungsgesetz\nThüringen Amtsgericht Jena HRB 520167\nKrieg-Estrichbau Erfurt GmbH – Erfurt",
      "type": "Registerbekanntmachung nach dem Umwandlungsgesetz",
      "state": "Thüringen",
      "amtsgericht": "Amtsgericht Jena",
      "registernummer": "HRB 520167",
      "registerart": "HRB",
      "company_name": "Krieg-Estrichbau Erfurt GmbH",
      "company_seat": "Erfurt",
      "details": "07.05.2025 (Bekanntmachungsdatum)\n\nThüringen Amtsgericht Jena HRB 520167\nRegisterbekanntmachung nach dem Umwandlungsgesetz 07.05.2025 (Eintragungsdatum)\n\nKrieg-Estrichbau Erfurt GmbH\nGesellschaft mit beschränkter Haftung\nErfurt\n\nNicht eingetragen: Den Gläubigern der an der Spaltung beteiligten Rechtsträger, ist wenn sie binnen sechs Monaten nach dem Tag, an dem die Eintragung der Spaltung in das Register des Sitzes desjenigen Rechtsträgers, dessen Gläubiger sie sind,  nach §§ 125, 19 Abs. 3 UmwG als bekanntgemacht gilt, ihren Anspruch nach Grund und Höhe schriftlich anmelden, Sicherheit zu leisten, soweit sie nicht Befriedigung verlangen können. Dieses Recht steht ihnen jedoch nur zu, wenn sie glaubhaft machen, daß durch die Spaltung die Erfüllung ihrer Forderung gefährdet wird."
    },
    {
      "date": "2025-05-07",
      "id": "108359",
      "original_text": "Registerbekanntmachung nach dem Umwandlungsgesetz\nHessen Amtsgericht Fritzlar HRA 11242\nThorsten Jakob e.K. Bad & Haus design und technik – Fritzlar",
      "type": "Registerbekanntmachung nach dem Umwandlungsgesetz",
      "state": "Hessen",
      "amtsgericht": "Amtsgericht Fritzlar",
      "registernummer": "HRA 11242",
      "registerart": "HRA",
      "company_name": "Thorsten Jakob e.K. Bad & Haus design und technik",
      "company_seat": "Fritzlar",
      "details": "07.05.2025 (Bekanntmachungsdatum)\n\nHessen Amtsgericht Fritzlar HRA 11242\nRegisterbekanntmachung nach dem Umwandlungsgesetz 07.05.2025 (Eintragungsdatum)\n\nThorsten Jakob e.K. Bad & Haus design und technik\nEinzelkaufmann / Einzelkauffrau\nFritzlar\n\nDen Gläubigern der an der Ausgliederung beteiligten Rechtsträger ist, wenn sie binnen sechs Monaten nach dem Tag, an dem die Eintragung der Ausgliederung in das Register des Sitzes desjenigen Rechtsträgers, deren Gläubiger sie sind, nach §§ 125, 19 Absatz 3 UmwG bekannt gemacht worden ist, ihren Anspruch nach Grund und Höhe schriftlich anmelden, Sicherheit zu leisten, soweit sie nicht Befriedigung verlangen können. Dieses Recht steht den Gläubigern jedoch nur zu, wenn sie glaubhaft machen, dass durch die Ausgliederung die Erfüllung ihrer Forderung gefährdet wird."
    },
    {
      "date": "2025-05-07",
      "id": "108360",
      "original_text": "Registerbekanntmachung nach dem Umwandlungsgesetz\nHessen Amtsgericht Frankfurt am Main HRB 94684\nEurocity AG – Frankfurt am Main",
      "type": "Registerbekanntmachung nach dem Umwandlungsgesetz",
      "state": "Hessen",
      "amtsgericht": "Amtsgericht Frankfurt am Main",
      "registernummer": "HRB 94684",
      "registerart": "HRB",
      "company_name": "Eurocity AG",
      "company_seat": "Frankfurt am Main",
      "details": "07.05.2025 (Bekanntmachungsdatum)\n\nHessen Amtsgericht Frankfurt am Main HRB 94684\nRegisterbekanntmachung nach dem Umwandlungsgesetz 07.05.2025 (Eintragungsdatum)\n\nEurocity AG\nAktiengesellschaft\nFrankfurt am Main\n\nDem Registergericht ist ein Ausgliederungs und Übernahmevertrag  über die geplante Umwandlung der Eurocity AG mit Sitz in Frankfurt am Main (Aktiengesellschaft, eingetragen beim Amtsgericht Frankfurt am Main unter der HRB  94684) als übertragender Rechtsträger mit der SCUR-Alpha 272 GmbH mit Sitz in Frankfurt am Main, eingetragen im Handelsregister des Amtsgerichts Frankfurt am Main unter HRB 137638 mit als übernehmender Rechtsträger eingereicht worden.\nDen Gläubigern der übertragenden Gesellschaft ist Sicherheit zu leisten, wenn sie innerhalb einer Frist von zwei Monaten nach Bekanntmachung des Verschmelzungsplans glaubhaft machen, dass durch die Verschmelzung die Erfüllung ihrer Forderung gefährdet wird. Die Anteilseigner der übertragenden Gesellschaft haben bei grenzüberschreitenden Verschmelzungen einen Anspruch auf angemessene Abfindung, sofern sie der Verschmelzung widersprochen haben; gegebenenfalls steht ihnen auch ein Anspruch auf bare Zuzahlung zu."
    },
    {
      "date": "2025-05-07",
      "id": "108361",
      "original_text": "Löschungsankündigung\nHessen Amtsgericht Hanau HRB 5664\nTKW-Armaturen GmbH – Hanau",
      "type": "Löschungsankündigung",
      "state": "Hessen",
      "amtsgericht": "Amtsgericht Hanau",
      "registernummer": "HRB 5664",
      "registerart": "HRB",
      "company_name": "TKW-Armaturen GmbH",
      "company_seat": "Hanau",
      "details": "07.05.2025 (Bekanntmachungsdatum)\n\nHessen Amtsgericht Hanau HRB 5664\nLöschungsankündigung 07.05.2025 (Eintragungsdatum)\n\nTKW-Armaturen GmbH\nGesellschaft mit beschränkter Haftung\nHanau\n\nDen Gläubigern der Gesellschaft, deren Forderungen begründet worden sind, bevor die Eintragung der Beendigung des Vertrags in das Handelsregister nach § 10 HGB bekannt gemacht worden ist, ist vom anderen Vertragsteil Sicherheit zu leisten, wenn sie sich binnen sechs Monaten nach dieser Bekanntmachung zu diesem Zweck bei ihm melden."
    },
    {
      "date": "2025-05-07",
      "id": "108362",
      "original_text": "Registerbekanntmachung nach dem Umwandlungsgesetz\nHessen Amtsgericht Darmstadt HRB 105304\ntalo Capital GmbH – Bensheim",
      "type": "Registerbekanntmachung nach dem Umwandlungsgesetz",
      "state": "Hessen",
      "amtsgericht": "Amtsgericht Darmstadt",
      "registernummer": "HRB 105304",
      "registerart": "HRB",
      "company_name": "talo Capital GmbH",
      "company_seat": "Bensheim",
      "details": "07.05.2025 (Bekanntmachungsdatum)\n\nHessen Amtsgericht Darmstadt HRB 105304\nRegisterbekanntmachung nach dem Umwandlungsgesetz 07.05.2025 (Eintragungsdatum)\n\ntalo Capital GmbH\nGesellschaft mit beschränkter Haftung\nBensheim\n\nDen Gläubigern der an der Verschmelzung beteiligten Rechtsträger ist, wenn sie binnen sechs Monaten nach dem Tag, an dem die Eintragung der Verschmelzung in das Register des Sitzes derjenigen Rechtsträger deren Gläubiger sie sind, nach § 19 Absatz 3 UmwG bekannt gemacht worden ist, ihren Anspruch nach Grund und Höhe schriftlich anmelden, Sicherheit zu leisten, soweit sie nicht Befriedigung verlangen können. Dieses Recht steht den Gläubigern jedoch nur zu, wenn sie glaubhaft machen, dass durch die Verschmelzung die Erfüllung ihrer Forderung gefährdet wird."
    },
    {
      "date": "2025-05-07",
      "id": "108363",
      "original_text": "Sonstige Registerbekanntmachung\nHessen Amtsgericht Frankfurt am Main HRB 107682\nAGF Videoforschung GmbH – Frankfurt am Main",
      "type": "Sonstige Registerbekanntmachung",
      "state": "Hessen",
      "amtsgericht": "Amtsgericht Frankfurt am Main",
      "registernummer": "HRB 107682",
      "registerart": "HRB",
      "company_name": "AGF Videoforschung GmbH",
      "company_seat": "Frankfurt am Main",
      "details": "07.05.2025 (Bekanntmachungsdatum)\n\nHessen Amtsgericht Frankfurt am Main HRB 107682\nSonstige Registerbekanntmachung 07.05.2025 (Eintragungsdatum)\n\nAGF Videoforschung GmbH\nGesellschaft mit beschränkter Haftung\nFrankfurt am Main\n\nDurch eine Änderung in den Personen der Aufsichtsratsmitglieder ist eine Liste der Mitglieder des Aufsichtsrates zum Handelsregister eingereicht worden."
    },
    {
      "date": "2025-05-07",
      "id": "108364",
      "original_text": "Sonstige Registerbekanntmachung\nHessen Amtsgericht Wetzlar VR 2657\nMännergesangverein \"Frohsinn\" 1878 Wissenbach – Eschenburg-Wissenbach",
      "type": "Sonstige Registerbekanntmachung",
      "state": "Hessen",
      "amtsgericht": "Amtsgericht Wetzlar",
      "registernummer": "VR 2657",
      "registerart": "VR",
      "company_name": "Männergesangverein \"Frohsinn\" 1878 Wissenbach",
      "company_seat": "Eschenburg-Wissenbach",
      "details": "07.05.2025 (Bekanntmachungsdatum)\n\nHessen Amtsgericht Wetzlar VR 2657\nSonstige Registerbekanntmachung 07.05.2025 (Eintragungsdatum)\n\nMännergesangverein \"Frohsinn\" 1878 Wissenbach\neingetragener Verein\nEschenburg-Wissenbach\n\nDer Verein ist aufgelöst."
    },
    {
      "date": "2025-05-07",
      "id": "108365",
      "original_text": "Löschungsankündigung\nHessen Amtsgericht Wiesbaden HRA 11051\nfirewall & IT LR GmbH & Co. KG – Idstein",
      "type": "Löschungsankündigung",
      "state": "Hessen",
      "amtsgericht": "Amtsgericht Wiesbaden",
      "registernummer": "HRA 11051",
      "registerart": "HRA",
      "company_name": "firewall & IT LR GmbH & Co. KG",
      "company_seat": "Idstein",
      "details": "07.05.2025 (Bekanntmachungsdatum)\n\nHessen Amtsgericht Wiesbaden HRA 11051\nLöschungsankündigung\n\nfirewall & IT LR GmbH & Co. KG\nKommanditgesellschaft\nIdstein\n\nDas Registergericht beabsichtigt die im Handelsregister eingetragene Firma von Amts wegen nach § 31 Abs. 2 HGB zu löschen. Die Frist zur Erhebung eines Widerspruchs gegen die beabsichtigte Löschung wird auf 3 Monate festgesetzt."
    },
    {
      "date": "2025-05-07",
      "id": "108366",
      "original_text": "Registerbekanntmachung nach dem Umwandlungsgesetz\nHessen Amtsgericht Gießen HRB 5644\nG + N Gefahrenmelde- und Nachrichtentechnik GmbH – Wartenberg",
      "type": "Registerbekanntmachung nach dem Umwandlungsgesetz",
      "state": "Hessen",
      "amtsgericht": "Amtsgericht Gießen",
      "registernummer": "HRB 5644",
      "registerart": "HRB",
      "company_name": "G + N Gefahrenmelde- und Nachrichtentechnik GmbH",
      "company_seat": "Wartenberg",
      "details": "07.05.2025 (Bekanntmachungsdatum)\n\nHessen Amtsgericht Gießen HRB 5644\nRegisterbekanntmachung nach dem Umwandlungsgesetz 07.05.2025 (Eintragungsdatum)\n\nG + N Gefahrenmelde- und Nachrichtentechnik GmbH\nGesellschaft mit beschränkter Haftung\nWartenberg\n\nDen Gläubigern der an der Abspaltung beteiligten Rechtsträger ist, wenn sie binnen sechs Monaten nach dem Tag, an dem die Eintragung der Abspaltung in das Register des Sitzes desjenigen Rechtsträgers, dessen Gläubiger sie sind, nach §§ 125, 19 Absatz 3 UmwG bekannt gemacht worden ist, ihren Anspruch nach Grund und Höhe schriftlich anmelden, Sicherheit zu leisten, soweit sie nicht Befriedigung verlangen können. Dieses Recht steht den Gläubigern jedoch nur zu, wenn sie glaubhaft machen, dass durch die Abspaltung die Erfüllung ihrer Forderung gefährdet wird."
    },
    {
      "date": "2025-05-07",
      "id": "108367",
      "original_text": "Registerbekanntmachung nach dem Umwandlungsgesetz\nHessen Amtsgericht Darmstadt HRB 53537\nRMIG Automotive GmbH – Stockstadt am Rhein",
      "type": "Registerbekanntmachung nach dem Umwandlungsgesetz",
      "state": "Hessen",
      "amtsgericht": "Amtsgericht Darmstadt",
      "registernummer": "HRB 53537",
      "registerart": "HRB",
      "company_name": "RMIG Automotive GmbH",
      "company_seat": "Stockstadt am Rhein",
      "details": "07.05.2025 (Bekanntmachungsdatum)\n\nHessen Amtsgericht Darmstadt HRB 53537\nRegisterbekanntmachung nach dem Umwandlungsgesetz 07.05.2025 (Eintragungsdatum)\n\nRMIG Automotive GmbH\nGesellschaft mit beschränkter Haftung\nStockstadt am Rhein\n\nDen Gläubigern der an der Verschmelzung beteiligten Rechtsträger ist, wenn sie binnen sechs Monaten nach dem Tag, an dem die Eintragung der Verschmelzung in das Register des Sitzes desjenigen Rechtsträgers, dessen Gläubiger sie sind, nach § 19 Absatz 3 UmwG bekannt gemacht worden ist, ihren Anspruch nach Grund und Höhe schriftlich anmelden, Sicherheit zu leisten, soweit sie nicht Befriedigung verlangen können. Dieses Recht steht den Gläubigern jedoch nur zu, wenn sie glaubhaft machen, dass durch die Verschmelzung die Erfüllung ihrer Forderung gefährdet wird."
    },
    {
      "date": "2025-05-07",
      "id": "108368",
      "original_text": "Einreichung neuer Dokumente\nHessen Amtsgericht Wiesbaden HRB 20108\nRheingau-Taunus Kultur und Tourismus GmbH – Oestrich-Winkel",
      "type": "Einreichung neuer Dokumente",
      "state": "Hessen",
      "amtsgericht": "Amtsgericht Wiesbaden",
      "registernummer": "HRB 20108",
      "registerart": "HRB",
      "company_name": "Rheingau-Taunus Kultur und Tourismus GmbH",
      "company_seat": "Oestrich-Winkel",
      "details": "07.05.2025 (Bekanntmachungsdatum)\n\nHessen Amtsgericht Wiesbaden HRB 20108\nEinreichung neuer Dokumente 07.05.2025 (Eintragungsdatum)\n\nRheingau-Taunus Kultur und Tourismus GmbH\nGesellschaft mit beschränkter Haftung\nOestrich-Winkel\n\nDurch eine Änderung in den Personen der Aufsichtsratsmitglieder ist eine Liste der Mitglieder des Aufsichtsrates zum Handelsregister eingereicht worden."
    }
  ]
}