{
  "date": "2025-05-14",
  "date_of_scrape": "2025-05-31T09:03:48.675Z",
  "tool_version": "0.2.0",
  "number_of_announcements": 156,
  "announcements": [
    {
      "date": "2025-05-14",
      "id": "108947",
      "original_text": "Löschungsankündigung\nBayern Amtsgericht Ingolstadt HRB 9171\nRSD-Transporte UG (haftungsbeschränkt) – Ingolstadt",
      "type": "Löschungsankündigung",
      "state": "Bayern",
      "amtsgericht": "Amtsgericht Ingolstadt",
      "registernummer": "HRB 9171",
      "registerart": "HRB",
      "company_name": "RSD-Transporte UG (haftungsbeschränkt)",
      "company_seat": "Ingolstadt",
      "details": "14.05.2025 (Bekanntmachungsdatum)\n\nBayern Amtsgericht Ingolstadt HRB 9171\nLöschungsankündigung\n\nRSD-Transporte UG (haftungsbeschränkt)\nGesellschaft mit beschränkter Haftung\nIngolstadt\n\nDas Registergericht beabsichtigt, die im Handelsregister eingetragene Gesellschaft wegen Vermögenslosigkeit von Amts wegen nach § 394 FamFG zu löschen. Die Frist zur Erhebung eines Widerspruchs ist auf einen Monat festgesetzt."
    },
    {
      "date": "2025-05-14",
      "id": "108948",
      "original_text": "Registerbekanntmachung nach dem Umwandlungsgesetz\nBayern Amtsgericht München HRB 203004\nIsar Holding GmbH – München",
      "type": "Registerbekanntmachung nach dem Umwandlungsgesetz",
      "state": "Bayern",
      "amtsgericht": "Amtsgericht München",
      "registernummer": "HRB 203004",
      "registerart": "HRB",
      "company_name": "Isar Holding GmbH",
      "company_seat": "München",
      "details": "14.05.2025 (Bekanntmachungsdatum)\n\nBayern Amtsgericht München HRB 203004\nRegisterbekanntmachung nach dem Umwandlungsgesetz 13.05.2025 (Eintragungsdatum)\n\nIsar Holding GmbH\nGesellschaft mit beschränkter Haftung\nMünchen\n\nDen Gläubigern der an der Verschmelzung beteiligten Rechtsträger ist, wenn sie binnen sechs Monaten nach dem Tag, an dem die Eintragung der Verschmelzung in das Register des Sitzes desjenigen Rechtsträgers, dessen Gläubiger sie sind, nach § 19 Abs. 3 UmwG als bekannt gemacht gilt, ihren Anspruch nach Grund und Höhe in Textform anmelden, Sicherheit zu leisten, soweit sie nicht Befriedigung verlangen können. Dieses Recht steht den Gläubigern jedoch nur zu, wenn sie glaubhaft machen, dass durch die Verschmelzung die Erfüllung ihrer Forderung gefährdet wird."
    },
    {
      "date": "2025-05-14",
      "id": "108949",
      "original_text": "Registerbekanntmachung nach dem Umwandlungsgesetz\nBayern Amtsgericht Landshut HRB 4618\nGerl-Schindler Wach- und Sicherheitsdienste Verwaltungs GmbH – Altdorf",
      "type": "Registerbekanntmachung nach dem Umwandlungsgesetz",
      "state": "Bayern",
      "amtsgericht": "Amtsgericht Landshut",
      "registernummer": "HRB 4618",
      "registerart": "HRB",
      "company_name": "Gerl-Schindler Wach- und Sicherheitsdienste Verwaltungs GmbH",
      "company_seat": "Altdorf",
      "details": "14.05.2025 (Bekanntmachungsdatum)\n\nBayern Amtsgericht Landshut HRB 4618\nRegisterbekanntmachung nach dem Umwandlungsgesetz 13.05.2025 (Eintragungsdatum)\n\nGerl-Schindler Wach- und Sicherheitsdienste Verwaltungs GmbH\nGesellschaft mit beschränkter Haftung\nAltdorf\n\nDem #Re.Name ist #DV.auswahl(Text=\"Bitte zutreffendes auswählen:\",Eingabe=\"der Entwurf eines Verschmelzungsvertrages\",\"ein Verschmelzungsvertrag\") zwischen der #DV.fa(Text=\"Bitte Firma/Namen des übernehmenden Rechtsträgers eingeben:\"), #DV.si(Text=\"Bitte Sitz des übernehmenden Rechtsträgers eingeben:\") (Amtsgericht #DV.regg(Text=\"Bitte das zust. Registergericht des übernehmenden Rechtsträgers eingeben:\") #insert(Text=\"RegTyp_Auswahl\") #DV.nr(Text=\"Bitte Registernummer des übernehmenden Rechtsträgers eingeben:\")) und der Gesellschaft als übertragendem Rechtsträger zur Einsichtnahme eingereicht worden."
    },
    {
      "date": "2025-05-14",
      "id": "108950",
      "original_text": "Registerbekanntmachung nach dem Umwandlungsgesetz\nBayern Amtsgericht Landshut HRA 11983\nMarkus Schaumeier e. K. – Velden",
      "type": "Registerbekanntmachung nach dem Umwandlungsgesetz",
      "state": "Bayern",
      "amtsgericht": "Amtsgericht Landshut",
      "registernummer": "HRA 11983",
      "registerart": "HRA",
      "company_name": "Markus Schaumeier e. K.",
      "company_seat": "Velden",
      "details": "14.05.2025 (Bekanntmachungsdatum)\n\nBayern Amtsgericht Landshut HRA 11983\nRegisterbekanntmachung nach dem Umwandlungsgesetz 13.05.2025 (Eintragungsdatum)\n\nMarkus Schaumeier e. K.\nEinzelkaufmann / Einzelkauffrau\nVelden\n\nDen Gläubigern der an der Ausgliederung beteiligten Rechtsträger ist, wenn sie binnen sechs Monaten nach dem Tag, an dem die Eintragung der Ausgliederung in das Register des Sitzes desjenigen Rechtsträgers, dessen Gläubiger sie sind, nach §§ 125, 19 Abs. 3 UmwG als bekannt gemacht gilt, ihren Anspruch nach Grund und Höhe in Textform anmelden, Sicherheit zu leisten, soweit sie nicht Befriedigung verlangen können. Dieses Recht steht den Gläubigern jedoch nur zu, wenn sie glaubhaft machen, dass durch die Ausgliederung die Erfüllung ihrer Forderung gefährdet wird."
    },
    {
      "date": "2025-05-14",
      "id": "108951",
      "original_text": "Registerbekanntmachung nach dem Umwandlungsgesetz\nBayern Amtsgericht Augsburg HRA 21921\nHerbert Chmielorz e.K. – Rain",
      "type": "Registerbekanntmachung nach dem Umwandlungsgesetz",
      "state": "Bayern",
      "amtsgericht": "Amtsgericht Augsburg",
      "registernummer": "HRA 21921",
      "registerart": "HRA",
      "company_name": "Herbert Chmielorz e.K.",
      "company_seat": "Rain",
      "details": "14.05.2025 (Bekanntmachungsdatum)\n\nBayern Amtsgericht Augsburg HRA 21921\nRegisterbekanntmachung nach dem Umwandlungsgesetz 13.05.2025 (Eintragungsdatum)\n\nHerbert Chmielorz e.K.\nEinzelkaufmann / Einzelkauffrau\nRain\n\nDen Gläubigern der an der Ausgliederung beteiligten Rechtsträger ist, wenn sie binnen sechs Monaten nach dem Tag, an dem die Eintragung der Ausgliederung in das Register des Sitzes desjenigen Rechtsträgers, dessen Gläubiger sie sind, nach §§ 125, 19 Abs. 3 UmwG als bekannt gemacht gilt, ihren Anspruch nach Grund und Höhe in Textform anmelden, Sicherheit zu leisten, soweit sie nicht Befriedigung verlangen können. Dieses Recht steht den Gläubigern jedoch nur zu, wenn sie glaubhaft machen, dass durch die Ausgliederung die Erfüllung ihrer Forderung gefährdet wird."
    },
    {
      "date": "2025-05-14",
      "id": "108952",
      "original_text": "Löschungsankündigung\nBayern Amtsgericht München HRB 284235\nMESAY Handels GmbH – München",
      "type": "Löschungsankündigung",
      "state": "Bayern",
      "amtsgericht": "Amtsgericht München",
      "registernummer": "HRB 284235",
      "registerart": "HRB",
      "company_name": "MESAY Handels GmbH",
      "company_seat": "München",
      "details": "14.05.2025 (Bekanntmachungsdatum)\n\nBayern Amtsgericht München HRB 284235\nLöschungsankündigung 08.05.2025 (Eintragungsdatum)\n\nMESAY Handels GmbH\nGesellschaft mit beschränkter Haftung\nMünchen\n\nDas Registergericht beabsichtigt, die im Handelsregister eingetragene Gesellschaft wegen Vermögenslosigkeit von Amts wegen nach § 394 FamFG zu löschen. Die Frist zur Erhebung eines Widerspruchs ist auf drei Monate festgesetzt."
    },
    {
      "date": "2025-05-14",
      "id": "108953",
      "original_text": "Löschungsankündigung\nBayern Amtsgericht Nürnberg HRB 37770\nTruva Foods Vertriebsgesellschaft mbH – Nürnberg",
      "type": "Löschungsankündigung",
      "state": "Bayern",
      "amtsgericht": "Amtsgericht Nürnberg",
      "registernummer": "HRB 37770",
      "registerart": "HRB",
      "company_name": "Truva Foods Vertriebsgesellschaft mbH",
      "company_seat": "Nürnberg",
      "details": "14.05.2025 (Bekanntmachungsdatum)\n\nBayern Amtsgericht Nürnberg HRB 37770\nLöschungsankündigung\n\nTruva Foods Vertriebsgesellschaft mbH\nGesellschaft mit beschränkter Haftung\nNürnberg\n\nDas Registergericht beabsichtigt, die im Handelsregister eingetragene Gesellschaft wegen Vermögenslosigkeit von Amts wegen nach § 394 FamFG zu löschen. Die Frist zur Erhebung eines Widerspruchs ist auf einen Monat festgesetzt."
    },
    {
      "date": "2025-05-14",
      "id": "108954",
      "original_text": "Registerbekanntmachung nach dem Umwandlungsgesetz\nBayern Amtsgericht München HRB 296297\nSoftware GmbH – München",
      "type": "Registerbekanntmachung nach dem Umwandlungsgesetz",
      "state": "Bayern",
      "amtsgericht": "Amtsgericht München",
      "registernummer": "HRB 296297",
      "registerart": "HRB",
      "company_name": "Software GmbH",
      "company_seat": "München",
      "details": "14.05.2025 (Bekanntmachungsdatum)\n\nBayern Amtsgericht München HRB 296297\nRegisterbekanntmachung nach dem Umwandlungsgesetz 13.05.2025 (Eintragungsdatum)\n\nSoftware GmbH\nGesellschaft mit beschränkter Haftung\nMünchen\n\nDen Gläubigern der an der Verschmelzung beteiligten Rechtsträger ist, wenn sie binnen sechs Monaten nach dem Tag, an dem die Eintragung der Verschmelzung in das Register des Sitzes desjenigen Rechtsträgers, dessen Gläubiger sie sind, nach § 19 Abs. 3 UmwG als bekannt gemacht gilt, ihren Anspruch nach Grund und Höhe in Textform anmelden, Sicherheit zu leisten, soweit sie nicht Befriedigung verlangen können. Dieses Recht steht den Gläubigern jedoch nur zu, wenn sie glaubhaft machen, dass durch die Verschmelzung die Erfüllung ihrer Forderung gefährdet wird."
    },
    {
      "date": "2025-05-14",
      "id": "108955",
      "original_text": "Löschungsankündigung\nBayern Amtsgericht Würzburg HRB 13595\nEURFLY Im- und Export GmbH – Würzburg",
      "type": "Löschungsankündigung",
      "state": "Bayern",
      "amtsgericht": "Amtsgericht Würzburg",
      "registernummer": "HRB 13595",
      "registerart": "HRB",
      "company_name": "EURFLY Im- und Export GmbH",
      "company_seat": "Würzburg",
      "details": "14.05.2025 (Bekanntmachungsdatum)\n\nBayern Amtsgericht Würzburg HRB 13595\nLöschungsankündigung\n\nEURFLY Im- und Export GmbH\nGesellschaft mit beschränkter Haftung\nWürzburg\n\nDas Registergericht beabsichtigt, die im Handelsregister eingetragene Gesellschaft wegen Vermögenslosigkeit von Amts wegen nach § 394 FamFG zu löschen. Die Frist zur Erhebung eines Widerspruchs ist auf drei Monate festgesetzt."
    },
    {
      "date": "2025-05-14",
      "id": "108956",
      "original_text": "Registerbekanntmachung nach dem Umwandlungsgesetz\nBayern Amtsgericht München HRB 257605\nBSAV Beteiligungsmanagement GmbH – Grünwald",
      "type": "Registerbekanntmachung nach dem Umwandlungsgesetz",
      "state": "Bayern",
      "amtsgericht": "Amtsgericht München",
      "registernummer": "HRB 257605",
      "registerart": "HRB",
      "company_name": "BSAV Beteiligungsmanagement GmbH",
      "company_seat": "Grünwald",
      "details": "14.05.2025 (Bekanntmachungsdatum)\n\nBayern Amtsgericht München HRB 257605\nRegisterbekanntmachung nach dem Umwandlungsgesetz 13.05.2025 (Eintragungsdatum)\n\nBSAV Beteiligungsmanagement GmbH\nGesellschaft mit beschränkter Haftung\nGrünwald\n\nDen Gläubigern der an der Verschmelzung beteiligten Rechtsträger ist, wenn sie binnen sechs Monaten nach dem Tag, an dem die Eintragung der Verschmelzung in das Register des Sitzes desjenigen Rechtsträgers, dessen Gläubiger sie sind, nach § 19 Abs. 3 UmwG als bekannt gemacht gilt, ihren Anspruch nach Grund und Höhe in Textform anmelden, Sicherheit zu leisten, soweit sie nicht Befriedigung verlangen können. Dieses Recht steht den Gläubigern jedoch nur zu, wenn sie glaubhaft machen, dass durch die Verschmelzung die Erfüllung ihrer Forderung gefährdet wird."
    },
    {
      "date": "2025-05-14",
      "id": "108957",
      "original_text": "Registerbekanntmachung nach dem Umwandlungsgesetz\nBayern Amtsgericht München HRB 207812\nRobert Decker Baumanagement GmbH – Dorfen",
      "type": "Registerbekanntmachung nach dem Umwandlungsgesetz",
      "state": "Bayern",
      "amtsgericht": "Amtsgericht München",
      "registernummer": "HRB 207812",
      "registerart": "HRB",
      "company_name": "Robert Decker Baumanagement GmbH",
      "company_seat": "Dorfen",
      "details": "14.05.2025 (Bekanntmachungsdatum)\n\nBayern Amtsgericht München HRB 207812\nRegisterbekanntmachung nach dem Umwandlungsgesetz 13.05.2025 (Eintragungsdatum)\n\nRobert Decker Baumanagement GmbH\nGesellschaft mit beschränkter Haftung\nDorfen\n\nDen Gläubigern der an der Verschmelzung beteiligten Rechtsträger ist, wenn sie binnen sechs Monaten nach dem Tag, an dem die Eintragung der Verschmelzung in das Register des Sitzes desjenigen Rechtsträgers, dessen Gläubiger sie sind, nach § 19 Abs. 3 UmwG als bekannt gemacht gilt, ihren Anspruch nach Grund und Höhe in Textform anmelden, Sicherheit zu leisten, soweit sie nicht Befriedigung verlangen können. Dieses Recht steht den Gläubigern jedoch nur zu, wenn sie glaubhaft machen, dass durch die Verschmelzung die Erfüllung ihrer Forderung gefährdet wird."
    },
    {
      "date": "2025-05-14",
      "id": "108958",
      "original_text": "Registerbekanntmachung nach dem Umwandlungsgesetz\nBayern Amtsgericht München HRB 287457\nIMAGIRO 1. Objektgesellschaft mbH – Schäftlarn",
      "type": "Registerbekanntmachung nach dem Umwandlungsgesetz",
      "state": "Bayern",
      "amtsgericht": "Amtsgericht München",
      "registernummer": "HRB 287457",
      "registerart": "HRB",
      "company_name": "IMAGIRO 1. Objektgesellschaft mbH",
      "company_seat": "Schäftlarn",
      "details": "14.05.2025 (Bekanntmachungsdatum)\n\nBayern Amtsgericht München HRB 287457\nRegisterbekanntmachung nach dem Umwandlungsgesetz 13.05.2025 (Eintragungsdatum)\n\nIMAGIRO 1. Objektgesellschaft mbH\nGesellschaft mit beschränkter Haftung\nSchäftlarn\n\nDen Gläubigern der an der Verschmelzung beteiligten Rechtsträger ist, wenn sie binnen sechs Monaten nach dem Tag, an dem die Eintragung der Verschmelzung in das Register des Sitzes desjenigen Rechtsträgers, dessen Gläubiger sie sind, nach § 19 Abs. 3 UmwG als bekannt gemacht gilt, ihren Anspruch nach Grund und Höhe in Textform anmelden, Sicherheit zu leisten, soweit sie nicht Befriedigung verlangen können. Dieses Recht steht den Gläubigern jedoch nur zu, wenn sie glaubhaft machen, dass durch die Verschmelzung die Erfüllung ihrer Forderung gefährdet wird."
    },
    {
      "date": "2025-05-14",
      "id": "108959",
      "original_text": "Registerbekanntmachung nach dem Umwandlungsgesetz\nBayern Amtsgericht Fürth HRB 16754\nMMV Wohnungsbau Alpha GmbH – Erlangen",
      "type": "Registerbekanntmachung nach dem Umwandlungsgesetz",
      "state": "Bayern",
      "amtsgericht": "Amtsgericht Fürth",
      "registernummer": "HRB 16754",
      "registerart": "HRB",
      "company_name": "MMV Wohnungsbau Alpha GmbH",
      "company_seat": "Erlangen",
      "details": "14.05.2025 (Bekanntmachungsdatum)\n\nBayern Amtsgericht Fürth HRB 16754\nRegisterbekanntmachung nach dem Umwandlungsgesetz 13.05.2025 (Eintragungsdatum)\n\nMMV Wohnungsbau Alpha GmbH\nGesellschaft mit beschränkter Haftung\nErlangen\n\nDen Gläubigern der an der Verschmelzung beteiligten Rechtsträger ist, wenn sie binnen sechs Monaten nach dem Tag, an dem die Eintragung der Verschmelzung in das Register des Sitzes desjenigen Rechtsträgers, dessen Gläubiger sie sind, nach § 19 Abs. 3 UmwG als bekannt gemacht gilt, ihren Anspruch nach Grund und Höhe in Textform anmelden, Sicherheit zu leisten, soweit sie nicht Befriedigung verlangen können. Dieses Recht steht den Gläubigern jedoch nur zu, wenn sie glaubhaft machen, dass durch die Verschmelzung die Erfüllung ihrer Forderung gefährdet wird."
    },
    {
      "date": "2025-05-14",
      "id": "108960",
      "original_text": "Registerbekanntmachung nach dem Umwandlungsgesetz\nBayern Amtsgericht München HRB 271624\nIQ-5 GmbH – Gräfelfing",
      "type": "Registerbekanntmachung nach dem Umwandlungsgesetz",
      "state": "Bayern",
      "amtsgericht": "Amtsgericht München",
      "registernummer": "HRB 271624",
      "registerart": "HRB",
      "company_name": "IQ-5 GmbH",
      "company_seat": "Gräfelfing",
      "details": "14.05.2025 (Bekanntmachungsdatum)\n\nBayern Amtsgericht München HRB 271624\nRegisterbekanntmachung nach dem Umwandlungsgesetz 13.05.2025 (Eintragungsdatum)\n\nIQ-5 GmbH\nGesellschaft mit beschränkter Haftung\nGräfelfing\n\nDen Gläubigern der an der Verschmelzung beteiligten Rechtsträger ist, wenn sie binnen sechs Monaten nach dem Tag, an dem die Eintragung der Verschmelzung in das Register des Sitzes desjenigen Rechtsträgers, dessen Gläubiger sie sind, nach § 19 Abs. 3 UmwG als bekannt gemacht gilt, ihren Anspruch nach Grund und Höhe in Textform anmelden, Sicherheit zu leisten, soweit sie nicht Befriedigung verlangen können. Dieses Recht steht den Gläubigern jedoch nur zu, wenn sie glaubhaft machen, dass durch die Verschmelzung die Erfüllung ihrer Forderung gefährdet wird."
    },
    {
      "date": "2025-05-14",
      "id": "108961",
      "original_text": "Einreichung neuer Dokumente\nBayern Amtsgericht Nürnberg HRB 9342\nNürnberger Lebensversicherung AG – Nürnberg",
      "type": "Einreichung neuer Dokumente",
      "state": "Bayern",
      "amtsgericht": "Amtsgericht Nürnberg",
      "registernummer": "HRB 9342",
      "registerart": "HRB",
      "company_name": "Nürnberger Lebensversicherung AG",
      "company_seat": "Nürnberg",
      "details": "14.05.2025 (Bekanntmachungsdatum)\n\nBayern Amtsgericht Nürnberg HRB 9342\nEinreichung neuer Dokumente\n\nNürnberger Lebensversicherung AG\nAktiengesellschaft\nNürnberg\n\nDem Amtsgericht Nürnberg -Registergericht- ist eine Liste der Mitglieder des Aufsichtsrats eingereicht worden, § 106 AktG."
    },
    {
      "date": "2025-05-14",
      "id": "108962",
      "original_text": "Einreichung neuer Dokumente\nBayern Amtsgericht Nürnberg HRB 9342\nNürnberger Lebensversicherung AG – Nürnberg",
      "type": "Einreichung neuer Dokumente",
      "state": "Bayern",
      "amtsgericht": "Amtsgericht Nürnberg",
      "registernummer": "HRB 9342",
      "registerart": "HRB",
      "company_name": "Nürnberger Lebensversicherung AG",
      "company_seat": "Nürnberg",
      "details": "14.05.2025 (Bekanntmachungsdatum)\n\nBayern Amtsgericht Nürnberg HRB 9342\nEinreichung neuer Dokumente\n\nNürnberger Lebensversicherung AG\nAktiengesellschaft\nNürnberg\n\nDem Amtsgericht Nürnberg -Registergericht- ist eine Liste der Mitglieder des Aufsichtsrats eingereicht worden, § 106 AktG."
    },
    {
      "date": "2025-05-14",
      "id": "108963",
      "original_text": "Registerbekanntmachung nach dem Umwandlungsgesetz\nBayern Amtsgericht München HRB 187326\nSiemens Treasury GmbH – München",
      "type": "Registerbekanntmachung nach dem Umwandlungsgesetz",
      "state": "Bayern",
      "amtsgericht": "Amtsgericht München",
      "registernummer": "HRB 187326",
      "registerart": "HRB",
      "company_name": "Siemens Treasury GmbH",
      "company_seat": "München",
      "details": "14.05.2025 (Bekanntmachungsdatum)\n\nBayern Amtsgericht München HRB 187326\nRegisterbekanntmachung nach dem Umwandlungsgesetz 13.05.2025 (Eintragungsdatum)\n\nSiemens Treasury GmbH\nGesellschaft mit beschränkter Haftung\nMünchen\n\nDen Gläubigern der an der Verschmelzung beteiligten Rechtsträger ist, wenn sie binnen sechs Monaten nach dem Tag, an dem die Eintragung der Verschmelzung in das Register des Sitzes desjenigen Rechtsträgers, dessen Gläubiger sie sind, nach § 19 Abs. 3 UmwG als bekannt gemacht gilt, ihren Anspruch nach Grund und Höhe in Textform anmelden, Sicherheit zu leisten, soweit sie nicht Befriedigung verlangen können. Dieses Recht steht den Gläubigern jedoch nur zu, wenn sie glaubhaft machen, dass durch die Verschmelzung die Erfüllung ihrer Forderung gefährdet wird."
    },
    {
      "date": "2025-05-14",
      "id": "108964",
      "original_text": "Registerbekanntmachung nach dem Umwandlungsgesetz\nBayern Amtsgericht Fürth HRB 16744\nMMV Wohnungsbau Gamma GmbH – Erlangen",
      "type": "Registerbekanntmachung nach dem Umwandlungsgesetz",
      "state": "Bayern",
      "amtsgericht": "Amtsgericht Fürth",
      "registernummer": "HRB 16744",
      "registerart": "HRB",
      "company_name": "MMV Wohnungsbau Gamma GmbH",
      "company_seat": "Erlangen",
      "details": "14.05.2025 (Bekanntmachungsdatum)\n\nBayern Amtsgericht Fürth HRB 16744\nRegisterbekanntmachung nach dem Umwandlungsgesetz\n\nMMV Wohnungsbau Gamma GmbH\nGesellschaft mit beschränkter Haftung\nErlangen\n\nDen Gläubigern der an der Verschmelzung beteiligten Rechtsträger ist, wenn sie binnen sechs Monaten nach dem Tag, an dem die Eintragung der Verschmelzung in das Register des Sitzes desjenigen Rechtsträgers, dessen Gläubiger sie sind, nach § 19 Abs. 3 UmwG als bekannt gemacht gilt, ihren Anspruch nach Grund und Höhe in Textform anmelden, Sicherheit zu leisten, soweit sie nicht Befriedigung verlangen können. Dieses Recht steht den Gläubigern jedoch nur zu, wenn sie glaubhaft machen, dass durch die Verschmelzung die Erfüllung ihrer Forderung gefährdet wird."
    },
    {
      "date": "2025-05-14",
      "id": "108965",
      "original_text": "Löschungsankündigung\nBayern Amtsgericht Augsburg HRB 23915\nInvictus GmbH – Augsburg",
      "type": "Löschungsankündigung",
      "state": "Bayern",
      "amtsgericht": "Amtsgericht Augsburg",
      "registernummer": "HRB 23915",
      "registerart": "HRB",
      "company_name": "Invictus GmbH",
      "company_seat": "Augsburg",
      "details": "14.05.2025 (Bekanntmachungsdatum)\n\nBayern Amtsgericht Augsburg HRB 23915\nLöschungsankündigung\n\nInvictus GmbH\nGesellschaft mit beschränkter Haftung\nAugsburg\n\nDas Registergericht beabsichtigt, die im Handelsregister eingetragene Gesellschaft wegen Vermögenslosigkeit von Amts wegen nach § 394 FamFG zu löschen. Die Frist zur Erhebung eines Widerspruchs ist auf einen Monat festgesetzt."
    },
    {
      "date": "2025-05-14",
      "id": "108966",
      "original_text": "Registerbekanntmachung nach dem Umwandlungsgesetz\nBayern Amtsgericht Landshut HRB 11117\nVib Immo GmbH – Velden",
      "type": "Registerbekanntmachung nach dem Umwandlungsgesetz",
      "state": "Bayern",
      "amtsgericht": "Amtsgericht Landshut",
      "registernummer": "HRB 11117",
      "registerart": "HRB",
      "company_name": "Vib Immo GmbH",
      "company_seat": "Velden",
      "details": "14.05.2025 (Bekanntmachungsdatum)\n\nBayern Amtsgericht Landshut HRB 11117\nRegisterbekanntmachung nach dem Umwandlungsgesetz 13.05.2025 (Eintragungsdatum)\n\nVib Immo GmbH\nGesellschaft mit beschränkter Haftung\nVelden\n\nDen Gläubigern der an der Ausgliederung beteiligten Rechtsträger ist, wenn sie binnen sechs Monaten nach dem Tag, an dem die Eintragung der Ausgliederung in das Register des Sitzes desjenigen Rechtsträgers, dessen Gläubiger sie sind, nach §§ 125, 19 Abs. 3 UmwG als bekannt gemacht gilt, ihren Anspruch nach Grund und Höhe in Textform anmelden, Sicherheit zu leisten, soweit sie nicht Befriedigung verlangen können. Dieses Recht steht den Gläubigern jedoch nur zu, wenn sie glaubhaft machen, dass durch die Ausgliederung die Erfüllung ihrer Forderung gefährdet wird."
    },
    {
      "date": "2025-05-14",
      "id": "108967",
      "original_text": "Registerbekanntmachung nach dem Umwandlungsgesetz\nBayern Amtsgericht Fürth HRB 18072\nGBI Wohnbau 13 GmbH – Erlangen",
      "type": "Registerbekanntmachung nach dem Umwandlungsgesetz",
      "state": "Bayern",
      "amtsgericht": "Amtsgericht Fürth",
      "registernummer": "HRB 18072",
      "registerart": "HRB",
      "company_name": "GBI Wohnbau 13 GmbH",
      "company_seat": "Erlangen",
      "details": "14.05.2025 (Bekanntmachungsdatum)\n\nBayern Amtsgericht Fürth HRB 18072\nRegisterbekanntmachung nach dem Umwandlungsgesetz 13.05.2025 (Eintragungsdatum)\n\nGBI Wohnbau 13 GmbH\nGesellschaft mit beschränkter Haftung\nErlangen\n\nDen Gläubigern der an der Verschmelzung beteiligten Rechtsträger ist, wenn sie binnen sechs Monaten nach dem Tag, an dem die Eintragung der Verschmelzung in das Register des Sitzes desjenigen Rechtsträgers, dessen Gläubiger sie sind, nach § 19 Abs. 3 UmwG als bekannt gemacht gilt, ihren Anspruch nach Grund und Höhe in Textform anmelden, Sicherheit zu leisten, soweit sie nicht Befriedigung verlangen können. Dieses Recht steht den Gläubigern jedoch nur zu, wenn sie glaubhaft machen, dass durch die Verschmelzung die Erfüllung ihrer Forderung gefährdet wird."
    },
    {
      "date": "2025-05-14",
      "id": "108968",
      "original_text": "Registerbekanntmachung nach dem Umwandlungsgesetz\nBayern Amtsgericht München HRB 215735\nStatica GmbH – München",
      "type": "Registerbekanntmachung nach dem Umwandlungsgesetz",
      "state": "Bayern",
      "amtsgericht": "Amtsgericht München",
      "registernummer": "HRB 215735",
      "registerart": "HRB",
      "company_name": "Statica GmbH",
      "company_seat": "München",
      "details": "14.05.2025 (Bekanntmachungsdatum)\n\nBayern Amtsgericht München HRB 215735\nRegisterbekanntmachung nach dem Umwandlungsgesetz 13.05.2025 (Eintragungsdatum)\n\nStatica GmbH\nGesellschaft mit beschränkter Haftung\nMünchen\n\nDen Gläubigern der an der Verschmelzung beteiligten Rechtsträger ist, wenn sie binnen sechs Monaten nach dem Tag, an dem die Eintragung der Verschmelzung in das Register des Sitzes desjenigen Rechtsträgers, dessen Gläubiger sie sind, nach § 19 Abs. 3 UmwG als bekannt gemacht gilt, ihren Anspruch nach Grund und Höhe in Textform anmelden, Sicherheit zu leisten, soweit sie nicht Befriedigung verlangen können. Dieses Recht steht den Gläubigern jedoch nur zu, wenn sie glaubhaft machen, dass durch die Verschmelzung die Erfüllung ihrer Forderung gefährdet wird."
    },
    {
      "date": "2025-05-14",
      "id": "108969",
      "original_text": "Sonstige Registerbekanntmachung\nBayern Amtsgericht München HRB 122575\nPrüftechnik NDT GmbH – Ismaning",
      "type": "Sonstige Registerbekanntmachung",
      "state": "Bayern",
      "amtsgericht": "Amtsgericht München",
      "registernummer": "HRB 122575",
      "registerart": "HRB",
      "company_name": "Prüftechnik NDT GmbH",
      "company_seat": "Ismaning",
      "details": "14.05.2025 (Bekanntmachungsdatum)\n\nBayern Amtsgericht München HRB 122575\nSonstige Registerbekanntmachung 13.05.2025 (Eintragungsdatum)\n\nPrüftechnik NDT GmbH\nGesellschaft mit beschränkter Haftung\nIsmaning\n\nDen Gläubigern der Gesellschaft, deren Forderungen begründet worden sind, bevor die Eintragung der Beendigung des Gewinnabführungsvertrages in das Handelsregister nach § 10 des Handelsgesetzbuches als bekanntgemacht gilt, hat der andere Vertragsteil Sicherheit zu leisten, wenn sie sich binnen sechs Monaten nach der Bekanntmachung der Eintragung zu diesem Zweck bei ihm melden."
    },
    {
      "date": "2025-05-14",
      "id": "108970",
      "original_text": "Registerbekanntmachung nach dem Umwandlungsgesetz\nBayern Amtsgericht Fürth HRB 14732\nGBI Wohnungsbau Sigma GmbH – Erlangen",
      "type": "Registerbekanntmachung nach dem Umwandlungsgesetz",
      "state": "Bayern",
      "amtsgericht": "Amtsgericht Fürth",
      "registernummer": "HRB 14732",
      "registerart": "HRB",
      "company_name": "GBI Wohnungsbau Sigma GmbH",
      "company_seat": "Erlangen",
      "details": "14.05.2025 (Bekanntmachungsdatum)\n\nBayern Amtsgericht Fürth HRB 14732\nRegisterbekanntmachung nach dem Umwandlungsgesetz 13.05.2025 (Eintragungsdatum)\n\nGBI Wohnungsbau Sigma GmbH\nGesellschaft mit beschränkter Haftung\nErlangen\n\nDen Gläubigern der an der Verschmelzung beteiligten Rechtsträger ist, wenn sie binnen sechs Monaten nach dem Tag, an dem die Eintragung der Verschmelzung in das Register des Sitzes desjenigen Rechtsträgers, dessen Gläubiger sie sind, nach § 19 Abs. 3 UmwG als bekannt gemacht gilt, ihren Anspruch nach Grund und Höhe in Textform anmelden, Sicherheit zu leisten, soweit sie nicht Befriedigung verlangen können. Dieses Recht steht den Gläubigern jedoch nur zu, wenn sie glaubhaft machen, dass durch die Verschmelzung die Erfüllung ihrer Forderung gefährdet wird."
    },
    {
      "date": "2025-05-14",
      "id": "108971",
      "original_text": "Einreichung neuer Dokumente\nBayern Amtsgericht München HRB 59888\nThüga Aktiengesellschaft – München",
      "type": "Einreichung neuer Dokumente",
      "state": "Bayern",
      "amtsgericht": "Amtsgericht München",
      "registernummer": "HRB 59888",
      "registerart": "HRB",
      "company_name": "Thüga Aktiengesellschaft",
      "company_seat": "München",
      "details": "14.05.2025 (Bekanntmachungsdatum)\n\nBayern Amtsgericht München HRB 59888\nEinreichung neuer Dokumente 13.05.2025 (Eintragungsdatum)\n\nThüga Aktiengesellschaft\nAktiengesellschaft\nMünchen\n\nDem Amtsgericht München -Registergericht- ist eine Liste der Mitglieder des Aufsichtsrats eingereicht worden, § 106 AktG."
    },
    {
      "date": "2025-05-14",
      "id": "108972",
      "original_text": "Registerbekanntmachung nach dem Umwandlungsgesetz\nBayern Amtsgericht Fürth HRB 16666\nMMV Objekt Delta GmbH – Erlangen",
      "type": "Registerbekanntmachung nach dem Umwandlungsgesetz",
      "state": "Bayern",
      "amtsgericht": "Amtsgericht Fürth",
      "registernummer": "HRB 16666",
      "registerart": "HRB",
      "company_name": "MMV Objekt Delta GmbH",
      "company_seat": "Erlangen",
      "details": "14.05.2025 (Bekanntmachungsdatum)\n\nBayern Amtsgericht Fürth HRB 16666\nRegisterbekanntmachung nach dem Umwandlungsgesetz 13.05.2025 (Eintragungsdatum)\n\nMMV Objekt Delta GmbH\nGesellschaft mit beschränkter Haftung\nErlangen\n\nDen Gläubigern der an der Verschmelzung beteiligten Rechtsträger ist, wenn sie binnen sechs Monaten nach dem Tag, an dem die Eintragung der Verschmelzung in das Register des Sitzes desjenigen Rechtsträgers, dessen Gläubiger sie sind, nach § 19 Abs. 3 UmwG als bekannt gemacht gilt, ihren Anspruch nach Grund und Höhe in Textform anmelden, Sicherheit zu leisten, soweit sie nicht Befriedigung verlangen können. Dieses Recht steht den Gläubigern jedoch nur zu, wenn sie glaubhaft machen, dass durch die Verschmelzung die Erfüllung ihrer Forderung gefährdet wird."
    },
    {
      "date": "2025-05-14",
      "id": "108973",
      "original_text": "Registerbekanntmachung nach dem Umwandlungsgesetz\nBayern Amtsgericht München HRB 283006\ninnoscripta AG – München",
      "type": "Registerbekanntmachung nach dem Umwandlungsgesetz",
      "state": "Bayern",
      "amtsgericht": "Amtsgericht München",
      "registernummer": "HRB 283006",
      "registerart": "HRB",
      "company_name": "innoscripta AG",
      "company_seat": "München",
      "details": "14.05.2025 (Bekanntmachungsdatum)\n\nBayern Amtsgericht München HRB 283006\nRegisterbekanntmachung nach dem Umwandlungsgesetz 09.05.2025 (Eintragungsdatum)\n\ninnoscripta AG\nAktiengesellschaft\nMünchen\n\nDen Gläubigern des formwechselnden Rechtsträgers ist, wenn sie binnen sechs Monaten nach dem Tag, an dem die Eintragung des Formwechsels nach § 201 UmwG als bekannt gemacht gilt, ihren Anspruch nach Grund und Höhe in Textform anmelden, Sicherheit zu leisten, soweit sie nicht Befriedigung verlangen können. Dieses Recht steht den Gläubigern jedoch nur zu, wenn sie glaubhaft machen, dass durch den Formwechsel die Erfüllung ihrer Forderung gefährdet wird."
    },
    {
      "date": "2025-05-14",
      "id": "108974",
      "original_text": "Einreichung neuer Dokumente\nBayern Amtsgericht München HRB 283006\ninnoscripta AG – München",
      "type": "Einreichung neuer Dokumente",
      "state": "Bayern",
      "amtsgericht": "Amtsgericht München",
      "registernummer": "HRB 283006",
      "registerart": "HRB",
      "company_name": "innoscripta AG",
      "company_seat": "München",
      "details": "14.05.2025 (Bekanntmachungsdatum)\n\nBayern Amtsgericht München HRB 283006\nEinreichung neuer Dokumente 09.05.2025 (Eintragungsdatum)\n\ninnoscripta AG\nAktiengesellschaft\nMünchen\n\nDem Amtsgericht München -Registergericht- ist eine Liste der Mitglieder des Aufsichtsrats eingereicht worden, § 106 AktG."
    },
    {
      "date": "2025-05-14",
      "id": "108975",
      "original_text": "Einreichung neuer Dokumente\nBayern Amtsgericht München HRB 164232\nAllianz SE – München",
      "type": "Einreichung neuer Dokumente",
      "state": "Bayern",
      "amtsgericht": "Amtsgericht München",
      "registernummer": "HRB 164232",
      "registerart": "HRB",
      "company_name": "Allianz SE",
      "company_seat": "München",
      "details": "14.05.2025 (Bekanntmachungsdatum)\n\nBayern Amtsgericht München HRB 164232\nEinreichung neuer Dokumente\n\nAllianz SE\nEuropäische Aktiengesellschaft (SE)\nMünchen\n\nDem Amtsgericht München -Registergericht- ist eine Liste der Mitglieder des Aufsichtsrats eingereicht worden, Art. 9 Abs. 1 Buchst. c (ii) SE-VO i.V.m. § 106 AktG."
    },
    {
      "date": "2025-05-14",
      "id": "108976",
      "original_text": "Registerbekanntmachung nach dem Umwandlungsgesetz\nBayern Amtsgericht München HRB 277502\nValluc Capital GmbH – Starnberg",
      "type": "Registerbekanntmachung nach dem Umwandlungsgesetz",
      "state": "Bayern",
      "amtsgericht": "Amtsgericht München",
      "registernummer": "HRB 277502",
      "registerart": "HRB",
      "company_name": "Valluc Capital GmbH",
      "company_seat": "Starnberg",
      "details": "14.05.2025 (Bekanntmachungsdatum)\n\nBayern Amtsgericht München HRB 277502\nRegisterbekanntmachung nach dem Umwandlungsgesetz 13.05.2025 (Eintragungsdatum)\n\nValluc Capital GmbH\nGesellschaft mit beschränkter Haftung\nStarnberg\n\nDen Gläubigern der an der Verschmelzung beteiligten Rechtsträger ist, wenn sie binnen sechs Monaten nach dem Tag, an dem die Eintragung der Verschmelzung in das Register des Sitzes desjenigen Rechtsträgers, dessen Gläubiger sie sind, nach § 19 Abs. 3 UmwG als bekannt gemacht gilt, ihren Anspruch nach Grund und Höhe in Textform anmelden, Sicherheit zu leisten, soweit sie nicht Befriedigung verlangen können. Dieses Recht steht den Gläubigern jedoch nur zu, wenn sie glaubhaft machen, dass durch die Verschmelzung die Erfüllung ihrer Forderung gefährdet wird."
    },
    {
      "date": "2025-05-14",
      "id": "108977",
      "original_text": "Löschungsankündigung\nBerlin Amtsgericht Berlin (Charlottenburg) HRB 181534\nLucius Annaeus GmbH – Berlin",
      "type": "Löschungsankündigung",
      "state": "Berlin",
      "amtsgericht": "Amtsgericht Berlin (Charlottenburg)",
      "registernummer": "HRB 181534",
      "registerart": "HRB",
      "company_name": "Lucius Annaeus GmbH",
      "company_seat": "Berlin",
      "details": "14.05.2025 (Bekanntmachungsdatum)\n\nBerlin Amtsgericht Berlin (Charlottenburg) HRB 181534\nLöschungsankündigung\n\nLucius Annaeus GmbH\nGesellschaft mit beschränkter Haftung\nBerlin\n\nBei der nachstehenden Gesellschaft wird das Amtslöschungsverfahren gemäß § 394 FamFG eingeleitet. Widerspruchsfrist 6 Wochen"
    },
    {
      "date": "2025-05-14",
      "id": "108978",
      "original_text": "Löschungsankündigung\nBerlin Amtsgericht Berlin (Charlottenburg) HRB 136544\nBERONT GmbH Bauunternehmung – Berlin",
      "type": "Löschungsankündigung",
      "state": "Berlin",
      "amtsgericht": "Amtsgericht Berlin (Charlottenburg)",
      "registernummer": "HRB 136544",
      "registerart": "HRB",
      "company_name": "BERONT GmbH Bauunternehmung",
      "company_seat": "Berlin",
      "details": "14.05.2025 (Bekanntmachungsdatum)\n\nBerlin Amtsgericht Berlin (Charlottenburg) HRB 136544\nLöschungsankündigung\n\nBERONT GmbH Bauunternehmung\nGesellschaft mit beschränkter Haftung\nBerlin\n\nBei der nachstehenden Gesellschaft wird das Amtslöschungsverfahren gemäß § 394 FamFG eingeleitet. Widerspruchsfrist 6 Wochen"
    },
    {
      "date": "2025-05-14",
      "id": "108979",
      "original_text": "Registerbekanntmachung nach dem Umwandlungsgesetz\nSachsen-Anhalt Amtsgericht Stendal HRB 7053\nHessol Lubrication GmbH – Leuna",
      "type": "Registerbekanntmachung nach dem Umwandlungsgesetz",
      "state": "Sachsen-Anhalt",
      "amtsgericht": "Amtsgericht Stendal",
      "registernummer": "HRB 7053",
      "registerart": "HRB",
      "company_name": "Hessol Lubrication GmbH",
      "company_seat": "Leuna",
      "details": "14.05.2025 (Bekanntmachungsdatum)\n\nSachsen-Anhalt Amtsgericht Stendal HRB 7053\nRegisterbekanntmachung nach dem Umwandlungsgesetz 14.05.2025 (Eintragungsdatum)\n\nHessol Lubrication GmbH\nGesellschaft mit beschränkter Haftung\nLeuna\n\nDie Gesellschaft ist auf Grund des Verschmelzungsvertrages vom 24.03.2025 sowie der Beschlüsse der Gesellschafterversammlungen vom selben Tag mit der K & W Mineralölgesellschaft Erfurt mbH mit dem Sitz in Erfurt (Amtsgericht Jena HRB 112081) verschmolzen. Die Verschmelzung wurde am 12.05.2025 in das Register der übernehmenden Gesellschaft eingetragen (siehe Amtsgericht Jena HRB 118081). Nicht eingetragen: Den Gläubigern der an der Verschmelzung beteiligten Rechtsträger ist, wenn sie binnen sechs Monaten nach dem Tag, an dem die Eintragung der Verschmelzung nach § 19 Abs. 3 UmwG als bekanntgemacht gilt, ihren Anspruch nach Grund und Höhe schriftlich anmelden, Sicherheit zu leisten, soweit sie nicht Befriedigung verlangen können. Dieses Recht steht ihnen jedoch nur zu, wenn sie glaubhaft machen, dass durch die Verschmelzung die Erfüllung ihrer Forderung gefährdet wird."
    },
    {
      "date": "2025-05-14",
      "id": "108980",
      "original_text": "Löschungsankündigung\nSaarland Amtsgericht Saarbrücken HRB 17240\nImmoREGS GmbH – Homburg",
      "type": "Löschungsankündigung",
      "state": "Saarland",
      "amtsgericht": "Amtsgericht Saarbrücken",
      "registernummer": "HRB 17240",
      "registerart": "HRB",
      "company_name": "ImmoREGS GmbH",
      "company_seat": "Homburg",
      "details": "14.05.2025 (Bekanntmachungsdatum)\n\nSaarland Amtsgericht Saarbrücken HRB 17240\nLöschungsankündigung\n\nImmoREGS GmbH\nGesellschaft mit beschränkter Haftung\nHomburg\n\nEs ist beabsichtigt, die Gesellschaft von Amts wegen gemäß § 394 FamFG wegen Vermögenslosigkeit zu löschen. Gegen die Löschung von Amts wegen ist das Rechtsmittel des Widerspruchs statthaft. Der Widerspruch ist binnen einer Frist von 3 Monaten beginnend mit dem Tag dieser Veröffentlichung durch Einreichen eines Widerspruchsschreibens -schriftlich oder zur Niederschrift der Geschäftsstelle- beim Amtsgericht Saarbrücken, -zentrales Handelsregister-, Mainzerstr.178, 66121 Saarbrücken einzulegen. Der Widerspruch muss die Bezeichnung der angefochtenen Löschungsankündigung enthalten sowie die Erklärung, dass Widerspruch eingelegt wird. Er ist vom Widerspruchsführer oder seinem Bevollmächtigten zu unterzeichnen."
    },
    {
      "date": "2025-05-14",
      "id": "108981",
      "original_text": "Löschungsankündigung\nBaden-Württemberg Amtsgericht Freiburg HRB 630229\nHochrhein-Eggberg-Klinik GmbH – Bad Säckingen",
      "type": "Löschungsankündigung",
      "state": "Baden-Württemberg",
      "amtsgericht": "Amtsgericht Freiburg",
      "registernummer": "HRB 630229",
      "registerart": "HRB",
      "company_name": "Hochrhein-Eggberg-Klinik GmbH",
      "company_seat": "Bad Säckingen",
      "details": "14.05.2025 (Bekanntmachungsdatum)\n\nBaden-Württemberg Amtsgericht Freiburg HRB 630229\nLöschungsankündigung\n\nHochrhein-Eggberg-Klinik GmbH\nGesellschaft mit beschränkter Haftung\nBad Säckingen\n\nDas Gericht beabsichtigt, die Gesellschaft wegen Vermögenslosigkeit im Handelsregister von Amts wegen nach § 394 FamFG zu löschen. Die Frist zur Geltendmachung eines Widerspruchs gegen die beabsichtigte Löschung ist auf einen Monat ab Veröffentlichung bestimmt."
    },
    {
      "date": "2025-05-14",
      "id": "108982",
      "original_text": "Einreichung neuer Dokumente\nBaden-Württemberg Amtsgericht Stuttgart HRB 728140\nStadtwerke Schorndorf GmbH – Schorndorf",
      "type": "Einreichung neuer Dokumente",
      "state": "Baden-Württemberg",
      "amtsgericht": "Amtsgericht Stuttgart",
      "registernummer": "HRB 728140",
      "registerart": "HRB",
      "company_name": "Stadtwerke Schorndorf GmbH",
      "company_seat": "Schorndorf",
      "details": "14.05.2025 (Bekanntmachungsdatum)\n\nBaden-Württemberg Amtsgericht Stuttgart HRB 728140\nEinreichung neuer Dokumente\n\nStadtwerke Schorndorf GmbH\nGesellschaft mit beschränkter Haftung\nSchorndorf\n\nDie Gesellschaft hat am 09.05.2025 die Liste über die Zusammensetzung des Aufsichtsrats zum Handelsregister eingereicht."
    },
    {
      "date": "2025-05-14",
      "id": "108983",
      "original_text": "Löschungsankündigung\nBerlin Amtsgericht Berlin (Charlottenburg) HRB 178304\nBZB - Bau und Solar GmbH – Berlin",
      "type": "Löschungsankündigung",
      "state": "Berlin",
      "amtsgericht": "Amtsgericht Berlin (Charlottenburg)",
      "registernummer": "HRB 178304",
      "registerart": "HRB",
      "company_name": "BZB - Bau und Solar GmbH",
      "company_seat": "Berlin",
      "details": "14.05.2025 (Bekanntmachungsdatum)\n\nBerlin Amtsgericht Berlin (Charlottenburg) HRB 178304\nLöschungsankündigung\n\nBZB - Bau und Solar GmbH\nGesellschaft mit beschränkter Haftung\nBerlin\n\nBei der nachstehenden Gesellschaft wird das Amtslöschungsverfahren gemäß § 394 FamFG eingeleitet. Widerspruchsfrist 6 Wochen"
    },
    {
      "date": "2025-05-14",
      "id": "108984",
      "original_text": "Registerbekanntmachung nach dem Umwandlungsgesetz\nSchleswig-Holstein Amtsgericht Flensburg HRA 10039\nSterndruck GmbH & Co. KG – Schleswig",
      "type": "Registerbekanntmachung nach dem Umwandlungsgesetz",
      "state": "Schleswig-Holstein",
      "amtsgericht": "Amtsgericht Flensburg",
      "registernummer": "HRA 10039",
      "registerart": "HRA",
      "company_name": "Sterndruck GmbH & Co. KG",
      "company_seat": "Schleswig",
      "details": "14.05.2025 (Bekanntmachungsdatum)\n\nSchleswig-Holstein Amtsgericht Flensburg HRA 10039\nRegisterbekanntmachung nach dem Umwandlungsgesetz 14.05.2025 (Eintragungsdatum)\n\nSterndruck GmbH & Co. KG\nKommanditgesellschaft\nSchleswig\n\nZu Eintragungsnummer 4 vom 14.05.2025 wird als nicht eingetragen veröffentlicht: Den Gläubigern der an der Verschmelzung beteiligten Rechtsträger ist, wenn sie binnen sechs Monaten nach dem Tag, an dem die Eintragung der Verschmelzung in das Register des Sitzes desjenigen Rechtsträgers, dessen Gläubiger sie sind, als bekannt gemacht gilt, ihren Anspruch nach Grund und Höhe in Textform anmelden, Sicherheit zu leisten, soweit sie nicht Befriedigung verlangen können. Dieses Recht steht den Gläubigern jedoch nur zu, wenn sie glaubhaft machen, dass durch die Verschmelzung die Erfüllung ihrer Forderung gefährdet wird."
    },
    {
      "date": "2025-05-14",
      "id": "108985",
      "original_text": "Löschungsankündigung\nBerlin Amtsgericht Berlin (Charlottenburg) HRB 167642\nAyache GmbH – Berlin",
      "type": "Löschungsankündigung",
      "state": "Berlin",
      "amtsgericht": "Amtsgericht Berlin (Charlottenburg)",
      "registernummer": "HRB 167642",
      "registerart": "HRB",
      "company_name": "Ayache GmbH",
      "company_seat": "Berlin",
      "details": "14.05.2025 (Bekanntmachungsdatum)\n\nBerlin Amtsgericht Berlin (Charlottenburg) HRB 167642\nLöschungsankündigung\n\nAyache GmbH\nGesellschaft mit beschränkter Haftung\nBerlin\n\nBei der nachstehenden Gesellschaft wird das Amtslöschungsverfahren gemäß § 394 FamFG eingeleitet. Widerspruchsfrist 6 Wochen"
    },
    {
      "date": "2025-05-14",
      "id": "108986",
      "original_text": "Löschungsankündigung\nBerlin Amtsgericht Berlin (Charlottenburg) HRB 238203\nCablab GmbH – Berlin",
      "type": "Löschungsankündigung",
      "state": "Berlin",
      "amtsgericht": "Amtsgericht Berlin (Charlottenburg)",
      "registernummer": "HRB 238203",
      "registerart": "HRB",
      "company_name": "Cablab GmbH",
      "company_seat": "Berlin",
      "details": "14.05.2025 (Bekanntmachungsdatum)\n\nBerlin Amtsgericht Berlin (Charlottenburg) HRB 238203\nLöschungsankündigung\n\nCablab GmbH\nGesellschaft mit beschränkter Haftung\nBerlin\n\nBei der nachstehenden Gesellschaft wird das Amtslöschungsverfahren gemäß § 394 FamFG eingeleitet. Widerspruchsfrist 6 Wochen"
    },
    {
      "date": "2025-05-14",
      "id": "108987",
      "original_text": "Registerbekanntmachung nach dem Umwandlungsgesetz\nBerlin Amtsgericht Berlin (Charlottenburg) HRA 41605\nGBI Wohnungsbau GmbH & Co. KG – Berlin",
      "type": "Registerbekanntmachung nach dem Umwandlungsgesetz",
      "state": "Berlin",
      "amtsgericht": "Amtsgericht Berlin (Charlottenburg)",
      "registernummer": "HRA 41605",
      "registerart": "HRA",
      "company_name": "GBI Wohnungsbau GmbH & Co. KG",
      "company_seat": "Berlin",
      "details": "14.05.2025 (Bekanntmachungsdatum)\n\nBerlin Amtsgericht Berlin (Charlottenburg) HRA 41605\nRegisterbekanntmachung nach dem Umwandlungsgesetz 13.05.2025 (Eintragungsdatum)\n\nGBI Wohnungsbau GmbH & Co. KG\nKommanditgesellschaft\nBerlin\n\nZu Eintragungsnummer 16 vom 13.05.2025 wird als nicht eingetragen veröffentlicht:Den Gläubigern der an der Verschmelzung beteiligten Rechtsträger ist, wenn sie binnen sechs Monaten nach dem Tag, an dem die Eintragung der Verschmelzung in das Register des Sitzes desjenigen Rechtsträgers, dessen Gläubiger sie sind, als bekannt gemacht gilt, ihren Anspruch nach Grund und Höhe schriftlich anmelden, Sicherheit zu leisten, soweit sie nicht Befriedigung verlangen können. Dieses Recht steht den Gläubigern jedoch nur zu, wenn sie glaubhaft machen, dass durch die Verschmelzung die Erfüllung ihrer Forderung gefährdet wird. Das Recht, Sicherheitsleistung zu verlangen, steht Gläubigern nicht zu, die im Falle der Insolvenz ein Recht auf vorzugsweise Befriedigung aus einer Deckungsmasse haben, die nach gesetzlicher Vorschrift zu ihrem Schutz errichtet und staatlich überwacht ist."
    },
    {
      "date": "2025-05-14",
      "id": "108988",
      "original_text": "Registerbekanntmachung nach dem Umwandlungsgesetz\nBaden-Württemberg Amtsgericht Stuttgart HRB 720778\nRalf Grömminger Fotografie GmbH – Kornwestheim",
      "type": "Registerbekanntmachung nach dem Umwandlungsgesetz",
      "state": "Baden-Württemberg",
      "amtsgericht": "Amtsgericht Stuttgart",
      "registernummer": "HRB 720778",
      "registerart": "HRB",
      "company_name": "Ralf Grömminger Fotografie GmbH",
      "company_seat": "Kornwestheim",
      "details": "14.05.2025 (Bekanntmachungsdatum)\n\nBaden-Württemberg Amtsgericht Stuttgart HRB 720778\nRegisterbekanntmachung nach dem Umwandlungsgesetz 14.05.2025 (Eintragungsdatum)\n\nRalf Grömminger Fotografie GmbH\nGesellschaft mit beschränkter Haftung\nKornwestheim\n\nAls nicht eingetragen wird bekanntgemacht:\nDen Gläubigern der an der Verschmelzung beteiligten Rechtsträger ist, wenn sie binnen sechs Monaten nach dem Tag, an dem die Eintragung der Verschmelzung in das Register des Sitzes desjenigen Rechtsträgers, dessen Gläubiger sie sind, nach § 19 Abs. 3 UmwG als bekanntgemacht gilt, ihren Anspruch nach Grund und Höhe schriftlich anmelden, Sicherheit zu leisten, soweit sie nicht Befriedigung verlangen können. Dieses Recht steht den Gläubigern jedoch nur zu, wenn sie glaubhaft machen, dass durch die Verschmelzung die Erfüllung ihrer Forderung gefährdet wird."
    },
    {
      "date": "2025-05-14",
      "id": "108989",
      "original_text": "Löschungsankündigung\nBaden-Württemberg Amtsgericht Freiburg HRB 707934\nb liquids GmbH – Offenburg",
      "type": "Löschungsankündigung",
      "state": "Baden-Württemberg",
      "amtsgericht": "Amtsgericht Freiburg",
      "registernummer": "HRB 707934",
      "registerart": "HRB",
      "company_name": "b liquids GmbH",
      "company_seat": "Offenburg",
      "details": "14.05.2025 (Bekanntmachungsdatum)\n\nBaden-Württemberg Amtsgericht Freiburg HRB 707934\nLöschungsankündigung\n\nb liquids GmbH\nGesellschaft mit beschränkter Haftung\nOffenburg\n\nAls nicht eingetragen wird bekanntgemacht:\nDas Gericht beabsichtigt, die Gesellschaft wegen Vermögenslosigkeit im Handelsregister von Amts wegen nach § 394 FamFG zu löschen. Die Frist zur Geltendmachung eines Widerspruchs gegen die beabsichtigte Löschung ist auf einen Monat ab Veröffentlichung bestimmt."
    },
    {
      "date": "2025-05-14",
      "id": "108990",
      "original_text": "Einreichung neuer Dokumente\nSchleswig-Holstein Amtsgericht Kiel HRB 6960\nthyssenkrupp Marine Systems GmbH – Kiel",
      "type": "Einreichung neuer Dokumente",
      "state": "Schleswig-Holstein",
      "amtsgericht": "Amtsgericht Kiel",
      "registernummer": "HRB 6960",
      "registerart": "HRB",
      "company_name": "thyssenkrupp Marine Systems GmbH",
      "company_seat": "Kiel",
      "details": "14.05.2025 (Bekanntmachungsdatum)\n\nSchleswig-Holstein Amtsgericht Kiel HRB 6960\nEinreichung neuer Dokumente\n\nthyssenkrupp Marine Systems GmbH\nGesellschaft mit beschränkter Haftung\nKiel\n\nAls nicht eingetragen wird veröffentlicht:\n\nEine neue Liste der Aufsichtsratsmitglieder ist eingereicht worden."
    },
    {
      "date": "2025-05-14",
      "id": "108991",
      "original_text": "Sonstige Registerbekanntmachung\nBerlin Amtsgericht Berlin (Charlottenburg) HRB 192608\nnoga Werbeagentur GmbH – Berlin",
      "type": "Sonstige Registerbekanntmachung",
      "state": "Berlin",
      "amtsgericht": "Amtsgericht Berlin (Charlottenburg)",
      "registernummer": "HRB 192608",
      "registerart": "HRB",
      "company_name": "noga Werbeagentur GmbH",
      "company_seat": "Berlin",
      "details": "14.05.2025 (Bekanntmachungsdatum)\n\nBerlin Amtsgericht Berlin (Charlottenburg) HRB 192608\nSonstige Registerbekanntmachung\n\nnoga Werbeagentur GmbH\nGesellschaft mit beschränkter Haftung\nBerlin\n\nAls nicht eingetragen wird veröffentlicht: Den Gläubigern der an der Verschmelzung beteiligten Rechtsträger ist, wenn sie binnen sechs Monaten nach dem Tag, an dem die Eintragung der Verschmelzung in das Register des Sitzes desjenigen Rechtsträgers, dessen Gläubiger sie sind, als bekannt gemacht gilt, ihren Anspruch nach Grund und Höhe schriftlich anmelden, Sicherheit zu leisten, soweit sie nicht Befriedigung verlangen können. Dieses Recht steht den Gläubigern jedoch nur zu, wenn sie glaubhaft machen, dass durch die Verschmelzung die Erfüllung ihrer Forderung gefährdet wird. Das Recht, Sicherheitsleistung zu verlangen, steht Gläubigern nicht zu, die im Falle der Insolvenz ein Recht auf vorzugsweise Befriedigung aus einer Deckungsmasse haben, die nach gesetzlicher Vorschrift zu ihrem Schutz errichtet und staatlich überwacht ist."
    },
    {
      "date": "2025-05-14",
      "id": "108992",
      "original_text": "Löschungsankündigung\nSaarland Amtsgericht Saarbrücken HRB 104722\nSerLog GmbH – Saarwellingen",
      "type": "Löschungsankündigung",
      "state": "Saarland",
      "amtsgericht": "Amtsgericht Saarbrücken",
      "registernummer": "HRB 104722",
      "registerart": "HRB",
      "company_name": "SerLog GmbH",
      "company_seat": "Saarwellingen",
      "details": "14.05.2025 (Bekanntmachungsdatum)\n\nSaarland Amtsgericht Saarbrücken HRB 104722\nLöschungsankündigung\n\nSerLog GmbH\nGesellschaft mit beschränkter Haftung\nSaarwellingen\n\nEs ist beabsichtigt, die Gesellschaft von Amts wegen gemäß § 394 FamFG wegen Vermögenslosigkeit zu löschen. Gegen die Löschung von Amts wegen ist das Rechtsmittel des Widerspruchs statthaft. Der Widerspruch ist binnen einer Frist von 3 Monaten beginnend mit dem Tag dieser Veröffentlichung durch Einreichen eines Widerspruchsschreibens -schriftlich oder zur Niederschrift der Geschäftsstelle- beim Amtsgericht Saarbrücken, -zentrales Handelsregister-, Mainzerstr.178, 66121 Saarbrücken einzulegen. Der Widerspruch muss die Bezeichnung der angefochtenen Löschungsankündigung enthalten sowie die Erklärung, dass Widerspruch eingelegt wird. Er ist vom Widerspruchsführer oder seinem Bevollmächtigten zu unterzeichnen.\nDas Widerspruchsschreiben kann auch in der Form eines elektronischen Dokumentes eingereicht werden, das mit einer qualifizierten elektronischen Signatur nach dem Signaturgesetz versehen sein muss (§§ 14 Abs. 2 FamFG, 130a, 298 ZPO)"
    },
    {
      "date": "2025-05-14",
      "id": "108993",
      "original_text": "Sonstige Registerbekanntmachung\nBerlin Amtsgericht Berlin (Charlottenburg) HRB 232631\nBrands Live Social Club UG (haftungsbeschränkt) – Berlin",
      "type": "Sonstige Registerbekanntmachung",
      "state": "Berlin",
      "amtsgericht": "Amtsgericht Berlin (Charlottenburg)",
      "registernummer": "HRB 232631",
      "registerart": "HRB",
      "company_name": "Brands Live Social Club UG (haftungsbeschränkt)",
      "company_seat": "Berlin",
      "details": "14.05.2025 (Bekanntmachungsdatum)\n\nBerlin Amtsgericht Berlin (Charlottenburg) HRB 232631\nSonstige Registerbekanntmachung\n\nBrands Live Social Club UG (haftungsbeschränkt)\nGesellschaft mit beschränkter Haftung\nBerlin\n\nAls nicht eingetragen wird veröffentlicht: Den Gläubigern der an der Verschmelzung beteiligten Rechtsträger ist, wenn sie binnen sechs Monaten nach dem Tag, an dem die Eintragung der Verschmelzung in das Register des Sitzes desjenigen Rechtsträgers, dessen Gläubiger sie sind, als bekannt gemacht gilt, ihren Anspruch nach Grund und Höhe schriftlich anmelden, Sicherheit zu leisten, soweit sie nicht Befriedigung verlangen können. Dieses Recht steht den Gläubigern jedoch nur zu, wenn sie glaubhaft machen, dass durch die Verschmelzung die Erfüllung ihrer Forderung gefährdet wird. Das Recht, Sicherheitsleistung zu verlangen, steht Gläubigern nicht zu, die im Falle der Insolvenz ein Recht auf vorzugsweise Befriedigung aus einer Deckungsmasse haben, die nach gesetzlicher Vorschrift zu ihrem Schutz errichtet und staatlich überwacht ist."
    },
    {
      "date": "2025-05-14",
      "id": "108994",
      "original_text": "Registerbekanntmachung nach dem Umwandlungsgesetz\nBerlin Amtsgericht Berlin (Charlottenburg) HRA 64257\nHuirong Ni BEST Recruiting e. K. – Berlin",
      "type": "Registerbekanntmachung nach dem Umwandlungsgesetz",
      "state": "Berlin",
      "amtsgericht": "Amtsgericht Berlin (Charlottenburg)",
      "registernummer": "HRA 64257",
      "registerart": "HRA",
      "company_name": "Huirong Ni BEST Recruiting e. K.",
      "company_seat": "Berlin",
      "details": "14.05.2025 (Bekanntmachungsdatum)\n\nBerlin Amtsgericht Berlin (Charlottenburg) HRA 64257\nRegisterbekanntmachung nach dem Umwandlungsgesetz 13.05.2025 (Eintragungsdatum)\n\nHuirong Ni BEST Recruiting e. K.\nEinzelkaufmann / Einzelkauffrau\nBerlin\n\nZu Eintragungsnummer 2 vom 13.05.2025 wird als nicht eingetragen veröffentlicht:Den Gläubigern der an der Spaltung beteiligten Rechtsträger ist, wenn sie binnen sechs Monaten nach dem Tag, an dem die Eintragung der Spaltung in das Register des Sitzes desjenigen Rechtsträgers, dessen Gläubiger sie sind, als bekannt gemacht gilt, ihren Anspruch nach Grund und Höhe schriftlich anmelden, Sicherheit zu leisten, soweit sie nicht Befriedigung verlangen können. Dieses Recht steht den Gläubigern jedoch nur zu, wenn sie glaubhaft machen, dass durch die Spaltung die Erfüllung ihrer Forderung gefährdet wird. Das Recht, Sicherheitsleistung zu verlangen, steht Gläubigern nicht zu, die im Falle der Insolvenz ein Recht auf vorzugsweise Befriedigung aus einer Deckungsmasse haben, die nach gesetzlicher Vorschrift zu ihrem Schutz errichtet und staatlich überwacht ist."
    },
    {
      "date": "2025-05-14",
      "id": "108995",
      "original_text": "Einreichung neuer Dokumente\nBaden-Württemberg Amtsgericht Freiburg HRB 707215\nResuscitec GmbH – Freiburg im Breisgau",
      "type": "Einreichung neuer Dokumente",
      "state": "Baden-Württemberg",
      "amtsgericht": "Amtsgericht Freiburg",
      "registernummer": "HRB 707215",
      "registerart": "HRB",
      "company_name": "Resuscitec GmbH",
      "company_seat": "Freiburg im Breisgau",
      "details": "14.05.2025 (Bekanntmachungsdatum)\n\nBaden-Württemberg Amtsgericht Freiburg HRB 707215\nEinreichung neuer Dokumente\n\nResuscitec GmbH\nGesellschaft mit beschränkter Haftung\nFreiburg im Breisgau\n\nAls nicht eingetragen wird bekanntgemacht:\nDie Gesellschaft hat am 13.05.2025 die Liste über die Zusammensetzung der Beiratsmitglieder zum Handelsregister eingereicht."
    },
    {
      "date": "2025-05-14",
      "id": "108996",
      "original_text": "Löschungsankündigung\nBerlin Amtsgericht Berlin (Charlottenburg) HRA 50815\nReconsult IV GmbH & Co. KG – Berlin",
      "type": "Löschungsankündigung",
      "state": "Berlin",
      "amtsgericht": "Amtsgericht Berlin (Charlottenburg)",
      "registernummer": "HRA 50815",
      "registerart": "HRA",
      "company_name": "Reconsult IV GmbH & Co. KG",
      "company_seat": "Berlin",
      "details": "14.05.2025 (Bekanntmachungsdatum)\n\nBerlin Amtsgericht Berlin (Charlottenburg) HRA 50815\nLöschungsankündigung\n\nReconsult IV GmbH & Co. KG\nKommanditgesellschaft\nBerlin\n\nBei dem nachstehenden Unternehmen / der nachstehenden Gesellschaft wird das Amtslöschungsverfahren gemäß § 31 Abs. 2 HGB eingeleitet. Widerspruchsfrist 1 Monat"
    },
    {
      "date": "2025-05-14",
      "id": "108997",
      "original_text": "Löschungsankündigung\nSaarland Amtsgericht Saarbrücken HRA 8623\nProton Security Markus Strauß e. K. – Saarbrücken",
      "type": "Löschungsankündigung",
      "state": "Saarland",
      "amtsgericht": "Amtsgericht Saarbrücken",
      "registernummer": "HRA 8623",
      "registerart": "HRA",
      "company_name": "Proton Security Markus Strauß e. K.",
      "company_seat": "Saarbrücken",
      "details": "14.05.2025 (Bekanntmachungsdatum)\n\nSaarland Amtsgericht Saarbrücken HRA 8623\nLöschungsankündigung\n\nProton Security Markus Strauß e. K.\nEinzelkaufmann / Einzelkauffrau\nSaarbrücken\n\nEs ist beabsichtigt, die Firma von Amts wegen gemäß § 31 Abs. 2 HGB zu löschen.\nGegen die Löschung von Amts wegen ist das Rechtsmittel des Widerspruchs statthaft. Der Widerspruch ist binnen einer Frist einem Monat beginnend mit dem Tag dieser Veröffentlichung durch Einreichen eines Widerspruchsschreibens -schriftlich oder zur Niederschrift der Geschäftsstelle beim Amtsgericht Saarbrücken, -zentrales Handelsregister-, Mainzerstr.178, 66121 Saarbrücken einzulegen.\nDer Widerspruch muss die Bezeichnung der angefochtenen Löschungsankündigung enthalten sowie die Erklärung, dass Widerspruch eingelegt wird. Er ist vom Widerspruchsführer oder seinem Bevollmächtigten zu unterzeichnen.\nDas Widerspruchsschreiben kann auch in der Form eines elektronischen Dokumentes eingereicht werden, das mit einer qualifizierten elektronischen Signatur nach dem Signaturgesetz versehen sein muss (§§ 14 Abs. 2 FamFG, 130a, 298 ZPO)."
    },
    {
      "date": "2025-05-14",
      "id": "108998",
      "original_text": "Einreichung neuer Dokumente\nBerlin Amtsgericht Berlin (Charlottenburg) HRB 94436\nmovingimage EVP GmbH – Berlin",
      "type": "Einreichung neuer Dokumente",
      "state": "Berlin",
      "amtsgericht": "Amtsgericht Berlin (Charlottenburg)",
      "registernummer": "HRB 94436",
      "registerart": "HRB",
      "company_name": "movingimage EVP GmbH",
      "company_seat": "Berlin",
      "details": "14.05.2025 (Bekanntmachungsdatum)\n\nBerlin Amtsgericht Berlin (Charlottenburg) HRB 94436\nEinreichung neuer Dokumente\n\nmovingimage EVP GmbH\nGesellschaft mit beschränkter Haftung\nBerlin\n\nAls nicht eingetragen wird veröffentlicht:Es wurde eine neue Liste der Aufsichtsratsmitglieder eingereicht (§52 GmbHG)."
    },
    {
      "date": "2025-05-14",
      "id": "108999",
      "original_text": "Registerbekanntmachung nach dem Umwandlungsgesetz\nSchleswig-Holstein Amtsgericht Kiel HRB 24474\nJASCO Applied Sciences (Deutschland) GmbH – Schwentinental",
      "type": "Registerbekanntmachung nach dem Umwandlungsgesetz",
      "state": "Schleswig-Holstein",
      "amtsgericht": "Amtsgericht Kiel",
      "registernummer": "HRB 24474",
      "registerart": "HRB",
      "company_name": "JASCO Applied Sciences (Deutschland) GmbH",
      "company_seat": "Schwentinental",
      "details": "14.05.2025 (Bekanntmachungsdatum)\n\nSchleswig-Holstein Amtsgericht Kiel HRB 24474\nRegisterbekanntmachung nach dem Umwandlungsgesetz 13.05.2025 (Eintragungsdatum)\n\nJASCO Applied Sciences (Deutschland) GmbH\nGesellschaft mit beschränkter Haftung\nSchwentinental\n\nZu Eintragungsnummer 2 vom 13.05.2025 wird als nicht eingetragen veröffentlicht: Den Gläubigern der an der Verschmelzung beteiligten Rechtsträger ist, wenn sie binnen sechs Monaten nach dem Tag, an dem die Eintragung der Verschmelzung in das Register des Sitzes desjenigen Rechtsträgers, dessen Gläubiger sie sind, nach § 19 Abs. 3 UmwG bekannt gemacht worden ist, ihren Anspruch nach Grund und Höhe schriftlich anmelden, Sicherheit zu leisten, soweit sie nicht Befriedigung verlangen können. Dieses Recht steht den Gläubigern jedoch nur zu, wenn sie glaubhaft machen, dass durch die Verschmelzung die Erfüllung ihrer Forderung gefährdet wird."
    },
    {
      "date": "2025-05-14",
      "id": "109000",
      "original_text": "Löschungsankündigung\nBerlin Amtsgericht Berlin (Charlottenburg) HRB 99279\nINNOVenture Business Consulting GmbH – Berlin",
      "type": "Löschungsankündigung",
      "state": "Berlin",
      "amtsgericht": "Amtsgericht Berlin (Charlottenburg)",
      "registernummer": "HRB 99279",
      "registerart": "HRB",
      "company_name": "INNOVenture Business Consulting GmbH",
      "company_seat": "Berlin",
      "details": "14.05.2025 (Bekanntmachungsdatum)\n\nBerlin Amtsgericht Berlin (Charlottenburg) HRB 99279\nLöschungsankündigung\n\nINNOVenture Business Consulting GmbH\nGesellschaft mit beschränkter Haftung\nBerlin\n\nBei der nachstehenden Gesellschaft wird das Amtslöschungsverfahren gemäß § 394 FamFG eingeleitet. Widerspruchsfrist\n6 Wochen."
    },
    {
      "date": "2025-05-14",
      "id": "109001",
      "original_text": "Löschungsankündigung\nBerlin Amtsgericht Berlin (Charlottenburg) HRB 59497\nMann-o-Meter Veranstaltungs- und Gaststätten Service GmbH – Berlin",
      "type": "Löschungsankündigung",
      "state": "Berlin",
      "amtsgericht": "Amtsgericht Berlin (Charlottenburg)",
      "registernummer": "HRB 59497",
      "registerart": "HRB",
      "company_name": "Mann-o-Meter Veranstaltungs- und Gaststätten Service GmbH",
      "company_seat": "Berlin",
      "details": "14.05.2025 (Bekanntmachungsdatum)\n\nBerlin Amtsgericht Berlin (Charlottenburg) HRB 59497\nLöschungsankündigung\n\nMann-o-Meter Veranstaltungs- und Gaststätten Service GmbH\nGesellschaft mit beschränkter Haftung\nBerlin\n\nBei der nachstehenden Gesellschaft wird das Amtslöschungsverfahren gemäß § 394 FamFG eingeleitet. Widerspruchsfrist: 6 Wochen."
    },
    {
      "date": "2025-05-14",
      "id": "109002",
      "original_text": "Registerbekanntmachung nach dem Umwandlungsgesetz\nSchleswig-Holstein Amtsgericht Kiel HRB 11774\nJASCO Applied Sciences (Europe) GmbH – Schwentinental",
      "type": "Registerbekanntmachung nach dem Umwandlungsgesetz",
      "state": "Schleswig-Holstein",
      "amtsgericht": "Amtsgericht Kiel",
      "registernummer": "HRB 11774",
      "registerart": "HRB",
      "company_name": "JASCO Applied Sciences (Europe) GmbH",
      "company_seat": "Schwentinental",
      "details": "14.05.2025 (Bekanntmachungsdatum)\n\nSchleswig-Holstein Amtsgericht Kiel HRB 11774\nRegisterbekanntmachung nach dem Umwandlungsgesetz 13.05.2025 (Eintragungsdatum)\n\nJASCO Applied Sciences (Europe) GmbH\nGesellschaft mit beschränkter Haftung\nSchwentinental\n\nZu Eintragungsnummer 6 vom 13.05.2025 wird als nicht eingetragen veröffentlicht: Den Gläubigern der an der Verschmelzung beteiligten Rechtsträger ist, wenn sie binnen sechs Monaten nach dem Tag, an dem die Eintragung der Verschmelzung in das Register des Sitzes desjenigen Rechtsträgers, dessen Gläubiger sie sind, nach § 19 Abs. 3 UmwG bekannt gemacht worden ist, ihren Anspruch nach Grund und Höhe schriftlich anmelden, Sicherheit zu leisten, soweit sie nicht Befriedigung verlangen können. Dieses Recht steht den Gläubigern jedoch nur zu, wenn sie glaubhaft machen, dass durch die Verschmelzung die Erfüllung ihrer Forderung gefährdet wird."
    },
    {
      "date": "2025-05-14",
      "id": "109003",
      "original_text": "Löschungsankündigung\nSachsen-Anhalt Amtsgericht Stendal HRA 2960\nAlpha Invest UG (haftungsbeschränkt) Wohnwert & Co.KG – Magdeburg",
      "type": "Löschungsankündigung",
      "state": "Sachsen-Anhalt",
      "amtsgericht": "Amtsgericht Stendal",
      "registernummer": "HRA 2960",
      "registerart": "HRA",
      "company_name": "Alpha Invest UG (haftungsbeschränkt) Wohnwert & Co.KG",
      "company_seat": "Magdeburg",
      "details": "14.05.2025 (Bekanntmachungsdatum)\n\nSachsen-Anhalt Amtsgericht Stendal HRA 2960\nLöschungsankündigung\n\nAlpha Invest UG (haftungsbeschränkt) Wohnwert & Co.KG\nKommanditgesellschaft\nMagdeburg\n\nDas Registergericht beabsichtigt, nachfolgende im Handelregister eingetragenen Firmen von Amts wegen nach § 394 FamFG zu löschen. Die Frist zu Erhebung eines Widerspruchs wird auf drei Monate festgesetzt."
    },
    {
      "date": "2025-05-14",
      "id": "109004",
      "original_text": "Sonstige Registerbekanntmachung\nBerlin Amtsgericht Berlin (Charlottenburg) HRB 94051\nBechtle GmbH – Berlin",
      "type": "Sonstige Registerbekanntmachung",
      "state": "Berlin",
      "amtsgericht": "Amtsgericht Berlin (Charlottenburg)",
      "registernummer": "HRB 94051",
      "registerart": "HRB",
      "company_name": "Bechtle GmbH",
      "company_seat": "Berlin",
      "details": "14.05.2025 (Bekanntmachungsdatum)\n\nBerlin Amtsgericht Berlin (Charlottenburg) HRB 94051\nSonstige Registerbekanntmachung\n\nBechtle GmbH\nGesellschaft mit beschränkter Haftung\nBerlin\n\nAls nicht eingetragen wird veröffentlicht: Den Gläubigern der an der Spaltung beteiligten Rechtsträger ist, wenn sie binnen sechs Monaten nach dem Tag, an dem die Eintragung der Spaltung in das Register des Sitzes desjenigen Rechtsträgers, dessen Gläubiger sie sind, als bekannt gemacht gilt, ihren Anspruch nach Grund und Höhe schriftlich anmelden, Sicherheit zu leisten, soweit sie nicht Befriedigung verlangen können. Dieses Recht steht den Gläubigern jedoch nur zu, wenn sie glaubhaft machen, dass durch die Spaltung die Erfüllung ihrer Forderung gefährdet wird. Das Recht, Sicherheitsleistung zu verlangen, steht Gläubigern nicht zu, die im Falle der Insolvenz ein Recht auf vorzugsweise Befriedigung aus einer Deckungsmasse haben, die nach gesetzlicher Vorschrift zu ihrem Schutz errichtet und staatlich überwacht ist."
    },
    {
      "date": "2025-05-14",
      "id": "109005",
      "original_text": "Löschungsankündigung\nHamburg Amtsgericht Hamburg HRB 120804\nTrapo GmbH – Hamburg",
      "type": "Löschungsankündigung",
      "state": "Hamburg",
      "amtsgericht": "Amtsgericht Hamburg",
      "registernummer": "HRB 120804",
      "registerart": "HRB",
      "company_name": "Trapo GmbH",
      "company_seat": "Hamburg",
      "details": "14.05.2025 (Bekanntmachungsdatum)\n\nHamburg Amtsgericht Hamburg HRB 120804\nLöschungsankündigung\n\nTrapo GmbH\nGesellschaft mit beschränkter Haftung\nHamburg\n\nDas Registergericht beabsichtigt, die im Handelsregister eingetragene Gesellschaft von Amts wegen nach § 394 FamFG zu löschen. Die Frist zur Erhebung eines Widerspruchs gegen die beabsichtigte Löschung wird auf 3 Monate festgesetzt."
    },
    {
      "date": "2025-05-14",
      "id": "109006",
      "original_text": "Registerbekanntmachung nach dem Umwandlungsgesetz\nSchleswig-Holstein Amtsgericht Kiel HRB 28132\nSTAYSTOKED INVEST GmbH – Damp",
      "type": "Registerbekanntmachung nach dem Umwandlungsgesetz",
      "state": "Schleswig-Holstein",
      "amtsgericht": "Amtsgericht Kiel",
      "registernummer": "HRB 28132",
      "registerart": "HRB",
      "company_name": "STAYSTOKED INVEST GmbH",
      "company_seat": "Damp",
      "details": "14.05.2025 (Bekanntmachungsdatum)\n\nSchleswig-Holstein Amtsgericht Kiel HRB 28132\nRegisterbekanntmachung nach dem Umwandlungsgesetz 12.05.2025 (Eintragungsdatum)\n\nSTAYSTOKED INVEST GmbH\nGesellschaft mit beschränkter Haftung\nDamp\n\nZu Eintragungsnummer 1 vom 12.05.2025 wird als nicht eingetragen veröffentlicht:  Den Gläubigern der an der Spaltung beteiligten Rechtsträger ist, wenn sie binnen sechs Monaten nach dem Tag, an dem die Eintragung der Spaltung in das Register des Sitzes desjenigen Rechtsträgers, dessen Gläubiger sie sind,  bekannt gemacht worden ist, ihren Anspruch nach Grund und Höhe schriftlich anmelden, Sicherheit zu leisten, soweit sie nicht Befriedigung verlangen können. Dieses Recht steht den Gläubigern jedoch nur zu, wenn sie glaubhaft machen, dass durch die Spaltung die Erfüllung ihrer Forderung gefährdet wird."
    },
    {
      "date": "2025-05-14",
      "id": "109007",
      "original_text": "Registerbekanntmachung nach dem Umwandlungsgesetz\nBerlin Amtsgericht Berlin (Charlottenburg) HRB 233654\nBEST Recruiting GmbH – Berlin",
      "type": "Registerbekanntmachung nach dem Umwandlungsgesetz",
      "state": "Berlin",
      "amtsgericht": "Amtsgericht Berlin (Charlottenburg)",
      "registernummer": "HRB 233654",
      "registerart": "HRB",
      "company_name": "BEST Recruiting GmbH",
      "company_seat": "Berlin",
      "details": "14.05.2025 (Bekanntmachungsdatum)\n\nBerlin Amtsgericht Berlin (Charlottenburg) HRB 233654\nRegisterbekanntmachung nach dem Umwandlungsgesetz 13.05.2025 (Eintragungsdatum)\n\nBEST Recruiting GmbH\nGesellschaft mit beschränkter Haftung\nBerlin\n\nZu Eintragungsnummer 4 vom 13.05.2025 wird als nicht eingetragen veröffentlicht:Den Gläubigern der an der Spaltung beteiligten Rechtsträger ist, wenn sie binnen sechs Monaten nach dem Tag, an dem die Eintragung der Spaltung in das Register des Sitzes desjenigen Rechtsträgers, dessen Gläubiger sie sind, als bekannt gemacht gilt, ihren Anspruch nach Grund und Höhe schriftlich anmelden, Sicherheit zu leisten, soweit sie nicht Befriedigung verlangen können. Dieses Recht steht den Gläubigern jedoch nur zu, wenn sie glaubhaft machen, dass durch die Spaltung die Erfüllung ihrer Forderung gefährdet wird. Das Recht, Sicherheitsleistung zu verlangen, steht Gläubigern nicht zu, die im Falle der Insolvenz ein Recht auf vorzugsweise Befriedigung aus einer Deckungsmasse haben, die nach gesetzlicher Vorschrift zu ihrem Schutz errichtet und staatlich überwacht ist."
    },
    {
      "date": "2025-05-14",
      "id": "109008",
      "original_text": "Registerbekanntmachung nach dem Umwandlungsgesetz\nBerlin Amtsgericht Berlin (Charlottenburg) HRB 233654\nBEST Recruiting GmbH – Berlin",
      "type": "Registerbekanntmachung nach dem Umwandlungsgesetz",
      "state": "Berlin",
      "amtsgericht": "Amtsgericht Berlin (Charlottenburg)",
      "registernummer": "HRB 233654",
      "registerart": "HRB",
      "company_name": "BEST Recruiting GmbH",
      "company_seat": "Berlin",
      "details": "14.05.2025 (Bekanntmachungsdatum)\n\nBerlin Amtsgericht Berlin (Charlottenburg) HRB 233654\nRegisterbekanntmachung nach dem Umwandlungsgesetz 13.05.2025 (Eintragungsdatum)\n\nBEST Recruiting GmbH\nGesellschaft mit beschränkter Haftung\nBerlin\n\nZu Eintragungsnummer 5 vom 13.05.2025 wird als nicht eingetragen veröffentlicht:Den Gläubigern der an der Spaltung beteiligten Rechtsträger ist, wenn sie binnen sechs Monaten nach dem Tag, an dem die Eintragung der Spaltung in das Register des Sitzes desjenigen Rechtsträgers, dessen Gläubiger sie sind, als bekannt gemacht gilt, ihren Anspruch nach Grund und Höhe schriftlich anmelden, Sicherheit zu leisten, soweit sie nicht Befriedigung verlangen können. Dieses Recht steht den Gläubigern jedoch nur zu, wenn sie glaubhaft machen, dass durch die Spaltung die Erfüllung ihrer Forderung gefährdet wird. Das Recht, Sicherheitsleistung zu verlangen, steht Gläubigern nicht zu, die im Falle der Insolvenz ein Recht auf vorzugsweise Befriedigung aus einer Deckungsmasse haben, die nach gesetzlicher Vorschrift zu ihrem Schutz errichtet und staatlich überwacht ist."
    },
    {
      "date": "2025-05-14",
      "id": "109009",
      "original_text": "Einreichung neuer Dokumente\nSchleswig-Holstein Amtsgericht Pinneberg HRB 6234\nStadtwerke Quickborn GmbH – Quickborn/Krs. Pinneberg",
      "type": "Einreichung neuer Dokumente",
      "state": "Schleswig-Holstein",
      "amtsgericht": "Amtsgericht Pinneberg",
      "registernummer": "HRB 6234",
      "registerart": "HRB",
      "company_name": "Stadtwerke Quickborn GmbH",
      "company_seat": "Quickborn/Krs. Pinneberg",
      "details": "14.05.2025 (Bekanntmachungsdatum)\n\nSchleswig-Holstein Amtsgericht Pinneberg HRB 6234\nEinreichung neuer Dokumente\n\nStadtwerke Quickborn GmbH\nGesellschaft mit beschränkter Haftung\nQuickborn/Krs. Pinneberg\n\nAls nicht eingetragen wird veröffentlicht: Es wurde eine neue Liste der Aufsichtsratsmitglieder gem. § 52 GmbHG zum Handelsregister eingereicht."
    },
    {
      "date": "2025-05-14",
      "id": "109010",
      "original_text": "Löschungsankündigung\nHamburg Amtsgericht Hamburg HRB 133712\nSTASO GmbH – Hamburg",
      "type": "Löschungsankündigung",
      "state": "Hamburg",
      "amtsgericht": "Amtsgericht Hamburg",
      "registernummer": "HRB 133712",
      "registerart": "HRB",
      "company_name": "STASO GmbH",
      "company_seat": "Hamburg",
      "details": "14.05.2025 (Bekanntmachungsdatum)\n\nHamburg Amtsgericht Hamburg HRB 133712\nLöschungsankündigung\n\nSTASO GmbH\nGesellschaft mit beschränkter Haftung\nHamburg\n\nDas Registergericht beabsichtigt, die im Handelsregister eingetragene Gesellschaft von Amts wegen nach § 394 FamFG zu löschen. Die Frist zur Erhebung eines Widerspruchs gegen die beabsichtigte Löschung wird auf 3 Monate festgesetzt."
    },
    {
      "date": "2025-05-14",
      "id": "109011",
      "original_text": "Löschungsankündigung\nHamburg Amtsgericht Hamburg HRB 141976\nErste Solinger Verwaltungs GmbH – Hamburg",
      "type": "Löschungsankündigung",
      "state": "Hamburg",
      "amtsgericht": "Amtsgericht Hamburg",
      "registernummer": "HRB 141976",
      "registerart": "HRB",
      "company_name": "Erste Solinger Verwaltungs GmbH",
      "company_seat": "Hamburg",
      "details": "14.05.2025 (Bekanntmachungsdatum)\n\nHamburg Amtsgericht Hamburg HRB 141976\nLöschungsankündigung\n\nErste Solinger Verwaltungs GmbH\nGesellschaft mit beschränkter Haftung\nHamburg\n\nDas Registergericht beabsichtigt, die im Handelsregister eingetragene Gesellschaft von Amts wegen nach § 394 FamFG zu löschen. Die Frist zur Erhebung eines Widerspruchs gegen die beabsichtigte Löschung wird auf 3 Monate festgesetzt."
    },
    {
      "date": "2025-05-14",
      "id": "109012",
      "original_text": "Registerbekanntmachung nach dem Umwandlungsgesetz\nHamburg Amtsgericht Hamburg HRB 145066\nMMG Invest GmbH – Hamburg",
      "type": "Registerbekanntmachung nach dem Umwandlungsgesetz",
      "state": "Hamburg",
      "amtsgericht": "Amtsgericht Hamburg",
      "registernummer": "HRB 145066",
      "registerart": "HRB",
      "company_name": "MMG Invest GmbH",
      "company_seat": "Hamburg",
      "details": "14.05.2025 (Bekanntmachungsdatum)\n\nHamburg Amtsgericht Hamburg HRB 145066\nRegisterbekanntmachung nach dem Umwandlungsgesetz 14.05.2025 (Eintragungsdatum)\n\nMMG Invest GmbH\nGesellschaft mit beschränkter Haftung\nHamburg\n\nAls nicht eingetragen wird bekannt gemacht:\nDen Gläubigern der an der Verschmelzung beteiligten Gesellschaften ist, wenn sie binnen sechs Monaten nach dem Tag, an dem die Eintragung der Verschmelzung in das Register des Sitzes desjenigen Rechtsträgers, dessen Gläubiger sie sind, nach § 19 Absatz 3 UmwG als bekannt gemacht gilt, ihren Anspruch nach Grund und Höhe schriftlich anmelden, Sicherheit zu leisten, soweit sie nicht Befriedigung verlangen können. Dieses Recht steht den Gläubigern jedoch nur zu, wenn sie glaubhaft machen, dass durch die Verschmelzung die Erfüllung ihrer Forderung gefährdet wird."
    },
    {
      "date": "2025-05-14",
      "id": "109013",
      "original_text": "Registerbekanntmachung nach dem Umwandlungsgesetz\nBaden-Württemberg Amtsgericht Freiburg HRB 722631\nAOX Drive GmbH – Villingen-Schwenningen",
      "type": "Registerbekanntmachung nach dem Umwandlungsgesetz",
      "state": "Baden-Württemberg",
      "amtsgericht": "Amtsgericht Freiburg",
      "registernummer": "HRB 722631",
      "registerart": "HRB",
      "company_name": "AOX Drive GmbH",
      "company_seat": "Villingen-Schwenningen",
      "details": "14.05.2025 (Bekanntmachungsdatum)\n\nBaden-Württemberg Amtsgericht Freiburg HRB 722631\nRegisterbekanntmachung nach dem Umwandlungsgesetz 14.05.2025 (Eintragungsdatum)\n\nAOX Drive GmbH\nGesellschaft mit beschränkter Haftung\nVillingen-Schwenningen\n\nAls nicht eingetragen wird bekanntgemacht:\nDen Gläubigern der an der Verschmelzung beteiligten Rechtsträger ist, wenn sie binnen sechs Monaten nach dem Tag, an dem die Eintragung der Verschmelzung in das Register des Sitzes desjenigen Rechtsträgers, dessen Gläubiger sie sind, nach § 19 Abs. 3 UmwG als bekanntgemacht gilt, ihren Anspruch nach Grund und Höhe schriftlich anmelden, Sicherheit zu leisten, soweit sie nicht Befriedigung verlangen können. Dieses Recht steht den Gläubigern jedoch nur zu, wenn sie glaubhaft machen, dass durch die Verschmelzung die Erfüllung ihrer Forderung gefährdet wird."
    },
    {
      "date": "2025-05-14",
      "id": "109014",
      "original_text": "Einreichung neuer Dokumente\nBerlin Amtsgericht Berlin (Charlottenburg) HRB 39635\nBavariaDirekt Versicherung AG – Berlin",
      "type": "Einreichung neuer Dokumente",
      "state": "Berlin",
      "amtsgericht": "Amtsgericht Berlin (Charlottenburg)",
      "registernummer": "HRB 39635",
      "registerart": "HRB",
      "company_name": "BavariaDirekt Versicherung AG",
      "company_seat": "Berlin",
      "details": "14.05.2025 (Bekanntmachungsdatum)\n\nBerlin Amtsgericht Berlin (Charlottenburg) HRB 39635\nEinreichung neuer Dokumente\n\nBavariaDirekt Versicherung AG\nAktiengesellschaft\nBerlin\n\nAls nicht eingetragen wird veröffentlicht: Es wurde eine neue Liste der Aufsichtsratsmitglieder eingereicht (§ 106 AktG)."
    },
    {
      "date": "2025-05-14",
      "id": "109015",
      "original_text": "Löschungsankündigung\nBrandenburg Amtsgericht Frankfurt/Oder HRB 13691\nG.B. Invest GmbH – Beiersdorf-Freudenberg",
      "type": "Löschungsankündigung",
      "state": "Brandenburg",
      "amtsgericht": "Amtsgericht Frankfurt/Oder",
      "registernummer": "HRB 13691",
      "registerart": "HRB",
      "company_name": "G.B. Invest GmbH",
      "company_seat": "Beiersdorf-Freudenberg",
      "details": "14.05.2025 (Bekanntmachungsdatum)\n\nBrandenburg Amtsgericht Frankfurt/Oder HRB 13691\nLöschungsankündigung\n\nG.B. Invest GmbH\nGesellschaft mit beschränkter Haftung\nBeiersdorf-Freudenberg\n\nBei der nachstehenden Gesellschaft wird das Amtslöschungsverfahren gemäß § 394 FamFG eingeleitet."
    },
    {
      "date": "2025-05-14",
      "id": "109016",
      "original_text": "Löschungsankündigung\nHamburg Amtsgericht Hamburg HRB 147982\nTomzin Allround Service GmbH – Hamburg",
      "type": "Löschungsankündigung",
      "state": "Hamburg",
      "amtsgericht": "Amtsgericht Hamburg",
      "registernummer": "HRB 147982",
      "registerart": "HRB",
      "company_name": "Tomzin Allround Service GmbH",
      "company_seat": "Hamburg",
      "details": "14.05.2025 (Bekanntmachungsdatum)\n\nHamburg Amtsgericht Hamburg HRB 147982\nLöschungsankündigung\n\nTomzin Allround Service GmbH\nGesellschaft mit beschränkter Haftung\nHamburg\n\nDas Registergericht beabsichtigt, die im Handelsregister eingetragene Gesellschaft von Amts wegen nach § 394 FamFG zu löschen. Die Frist zur Erhebung eines Widerspruchs gegen die beabsichtigte Löschung wird auf 3 Monate festgesetzt."
    },
    {
      "date": "2025-05-14",
      "id": "109017",
      "original_text": "Löschungsankündigung\nHamburg Amtsgericht Hamburg HRB 153583\nCMH Dienstleistung GmbH – Hamburg",
      "type": "Löschungsankündigung",
      "state": "Hamburg",
      "amtsgericht": "Amtsgericht Hamburg",
      "registernummer": "HRB 153583",
      "registerart": "HRB",
      "company_name": "CMH Dienstleistung GmbH",
      "company_seat": "Hamburg",
      "details": "14.05.2025 (Bekanntmachungsdatum)\n\nHamburg Amtsgericht Hamburg HRB 153583\nLöschungsankündigung\n\nCMH Dienstleistung GmbH\nGesellschaft mit beschränkter Haftung\nHamburg\n\nDas Registergericht beabsichtigt, die im Handelsregister eingetragene Gesellschaft von Amts wegen nach § 394 FamFG zu löschen. Die Frist zur Erhebung eines Widerspruchs gegen die beabsichtigte Löschung wird auf 3 Monate festgesetzt."
    },
    {
      "date": "2025-05-14",
      "id": "109018",
      "original_text": "Löschungsankündigung\nHamburg Amtsgericht Hamburg HRB 147812\nANYLEI DIAZ Immobilien GmbH – Hamburg",
      "type": "Löschungsankündigung",
      "state": "Hamburg",
      "amtsgericht": "Amtsgericht Hamburg",
      "registernummer": "HRB 147812",
      "registerart": "HRB",
      "company_name": "ANYLEI DIAZ Immobilien GmbH",
      "company_seat": "Hamburg",
      "details": "14.05.2025 (Bekanntmachungsdatum)\n\nHamburg Amtsgericht Hamburg HRB 147812\nLöschungsankündigung\n\nANYLEI DIAZ Immobilien GmbH\nGesellschaft mit beschränkter Haftung\nHamburg\n\nDas Registergericht beabsichtigt, die im Handelsregister eingetragene Gesellschaft von Amts wegen nach § 394 FamFG zu löschen. Die Frist zur Erhebung eines Widerspruchs gegen die beabsichtigte Löschung wird auf 3 Monate festgesetzt."
    },
    {
      "date": "2025-05-14",
      "id": "109019",
      "original_text": "Löschungsankündigung\nHamburg Amtsgericht Hamburg HRB 153011\nSamNet GmbH – Hamburg",
      "type": "Löschungsankündigung",
      "state": "Hamburg",
      "amtsgericht": "Amtsgericht Hamburg",
      "registernummer": "HRB 153011",
      "registerart": "HRB",
      "company_name": "SamNet GmbH",
      "company_seat": "Hamburg",
      "details": "14.05.2025 (Bekanntmachungsdatum)\n\nHamburg Amtsgericht Hamburg HRB 153011\nLöschungsankündigung\n\nSamNet GmbH\nGesellschaft mit beschränkter Haftung\nHamburg\n\nDas Registergericht beabsichtigt, die im Handelsregister eingetragene Gesellschaft von Amts wegen nach § 394 FamFG zu löschen. Die Frist zur Erhebung eines Widerspruchs gegen die beabsichtigte Löschung wird auf 3 Monate festgesetzt."
    },
    {
      "date": "2025-05-14",
      "id": "109020",
      "original_text": "Löschungsankündigung\nHamburg Amtsgericht Hamburg HRB 153938\nELBE TD Personalservice GmbH – Hamburg",
      "type": "Löschungsankündigung",
      "state": "Hamburg",
      "amtsgericht": "Amtsgericht Hamburg",
      "registernummer": "HRB 153938",
      "registerart": "HRB",
      "company_name": "ELBE TD Personalservice GmbH",
      "company_seat": "Hamburg",
      "details": "14.05.2025 (Bekanntmachungsdatum)\n\nHamburg Amtsgericht Hamburg HRB 153938\nLöschungsankündigung\n\nELBE TD Personalservice GmbH\nGesellschaft mit beschränkter Haftung\nHamburg\n\nDas Registergericht beabsichtigt, die im Handelsregister eingetragene Gesellschaft von Amts wegen nach § 394 FamFG zu löschen. Die Frist zur Erhebung eines Widerspruchs gegen die beabsichtigte Löschung wird auf 3 Monate festgesetzt."
    },
    {
      "date": "2025-05-14",
      "id": "109021",
      "original_text": "Registerbekanntmachung nach dem Umwandlungsgesetz\nBaden-Württemberg Amtsgericht Freiburg HRB 718402\nAOX Technologies GmbH – Villingen-Schwenningen",
      "type": "Registerbekanntmachung nach dem Umwandlungsgesetz",
      "state": "Baden-Württemberg",
      "amtsgericht": "Amtsgericht Freiburg",
      "registernummer": "HRB 718402",
      "registerart": "HRB",
      "company_name": "AOX Technologies GmbH",
      "company_seat": "Villingen-Schwenningen",
      "details": "14.05.2025 (Bekanntmachungsdatum)\n\nBaden-Württemberg Amtsgericht Freiburg HRB 718402\nRegisterbekanntmachung nach dem Umwandlungsgesetz 14.05.2025 (Eintragungsdatum)\n\nAOX Technologies GmbH\nGesellschaft mit beschränkter Haftung\nVillingen-Schwenningen\n\nDen Gläubigern der an der Verschmelzung beteiligten Rechtsträger ist, wenn sie binnen sechs Monaten nach dem Tag, an dem die Eintragung der Verschmelzung in das Register des Sitzes desjenigen Rechtsträgers, dessen Gläubiger sie sind, nach § 19 Abs. 3 UmwG als bekanntgemacht gilt, ihren Anspruch nach Grund und Höhe schriftlich anmelden, Sicherheit zu leisten, soweit sie nicht Befriedigung verlangen können. Dieses Recht steht den Gläubigern jedoch nur zu, wenn sie glaubhaft machen, dass durch die Verschmelzung die Erfüllung ihrer Forderung gefährdet wird."
    },
    {
      "date": "2025-05-14",
      "id": "109022",
      "original_text": "Löschungsankündigung\nHamburg Amtsgericht Hamburg HRB 178061\nDIGRO DE GmbH – Hamburg",
      "type": "Löschungsankündigung",
      "state": "Hamburg",
      "amtsgericht": "Amtsgericht Hamburg",
      "registernummer": "HRB 178061",
      "registerart": "HRB",
      "company_name": "DIGRO DE GmbH",
      "company_seat": "Hamburg",
      "details": "14.05.2025 (Bekanntmachungsdatum)\n\nHamburg Amtsgericht Hamburg HRB 178061\nLöschungsankündigung\n\nDIGRO DE GmbH\nGesellschaft mit beschränkter Haftung\nHamburg\n\nDas Registergericht beabsichtigt, die im Handelsregister eingetragene Gesellschaft von Amts wegen nach § 394 FamFG zu löschen. Die Frist zur Erhebung eines Widerspruchs gegen die beabsichtigte Löschung wird auf 3 Monate festgesetzt."
    },
    {
      "date": "2025-05-14",
      "id": "109023",
      "original_text": "Löschungsankündigung\nHamburg Amtsgericht Hamburg HRB 180293\nCLIMAX PRODUCTIONS UG (haftungsbeschränkt) – Hamburg",
      "type": "Löschungsankündigung",
      "state": "Hamburg",
      "amtsgericht": "Amtsgericht Hamburg",
      "registernummer": "HRB 180293",
      "registerart": "HRB",
      "company_name": "CLIMAX PRODUCTIONS UG (haftungsbeschränkt)",
      "company_seat": "Hamburg",
      "details": "14.05.2025 (Bekanntmachungsdatum)\n\nHamburg Amtsgericht Hamburg HRB 180293\nLöschungsankündigung\n\nCLIMAX PRODUCTIONS UG (haftungsbeschränkt)\nGesellschaft mit beschränkter Haftung\nHamburg\n\nDas Registergericht beabsichtigt, die im Handelsregister eingetragene Gesellschaft von Amts wegen nach § 394 FamFG zu löschen. Die Frist zur Erhebung eines Widerspruchs gegen die beabsichtigte Löschung wird auf 3 Monate festgesetzt."
    },
    {
      "date": "2025-05-14",
      "id": "109024",
      "original_text": "Löschungsankündigung\nHamburg Amtsgericht Hamburg HRB 180828\nOimex GmbH – Hamburg",
      "type": "Löschungsankündigung",
      "state": "Hamburg",
      "amtsgericht": "Amtsgericht Hamburg",
      "registernummer": "HRB 180828",
      "registerart": "HRB",
      "company_name": "Oimex GmbH",
      "company_seat": "Hamburg",
      "details": "14.05.2025 (Bekanntmachungsdatum)\n\nHamburg Amtsgericht Hamburg HRB 180828\nLöschungsankündigung\n\nOimex GmbH\nGesellschaft mit beschränkter Haftung\nHamburg\n\nDas Registergericht beabsichtigt, die im Handelsregister eingetragene Gesellschaft von Amts wegen nach § 394 FamFG zu löschen. Die Frist zur Erhebung eines Widerspruchs gegen die beabsichtigte Löschung wird auf 3 Monate festgesetzt."
    },
    {
      "date": "2025-05-14",
      "id": "109025",
      "original_text": "Löschungsankündigung\nHamburg Amtsgericht Hamburg HRB 189627\nC-P Deutschland GmbH – Hamburg",
      "type": "Löschungsankündigung",
      "state": "Hamburg",
      "amtsgericht": "Amtsgericht Hamburg",
      "registernummer": "HRB 189627",
      "registerart": "HRB",
      "company_name": "C-P Deutschland GmbH",
      "company_seat": "Hamburg",
      "details": "14.05.2025 (Bekanntmachungsdatum)\n\nHamburg Amtsgericht Hamburg HRB 189627\nLöschungsankündigung\n\nC-P Deutschland GmbH\nGesellschaft mit beschränkter Haftung\nHamburg\n\nDas Registergericht beabsichtigt, die im Handelsregister eingetragene Gesellschaft von Amts wegen nach § 394 FamFG zu löschen. Die Frist zur Erhebung eines Widerspruchs gegen die beabsichtigte Löschung wird auf 3 Monate festgesetzt."
    },
    {
      "date": "2025-05-14",
      "id": "109026",
      "original_text": "Löschungsankündigung\nHamburg Amtsgericht Hamburg HRB 166593\nSTG - Bau GmbH – Hamburg",
      "type": "Löschungsankündigung",
      "state": "Hamburg",
      "amtsgericht": "Amtsgericht Hamburg",
      "registernummer": "HRB 166593",
      "registerart": "HRB",
      "company_name": "STG - Bau GmbH",
      "company_seat": "Hamburg",
      "details": "14.05.2025 (Bekanntmachungsdatum)\n\nHamburg Amtsgericht Hamburg HRB 166593\nLöschungsankündigung\n\nSTG - Bau GmbH\nGesellschaft mit beschränkter Haftung\nHamburg\n\nDas Registergericht beabsichtigt, die im Handelsregister eingetragene Gesellschaft von Amts wegen nach § 394 FamFG zu löschen. Die Frist zur Erhebung eines Widerspruchs gegen die beabsichtigte Löschung wird auf 3 Monate festgesetzt."
    },
    {
      "date": "2025-05-14",
      "id": "109027",
      "original_text": "Löschungsankündigung\nHamburg Amtsgericht Hamburg HRB 169119\nButera Eats GmbH – Hamburg",
      "type": "Löschungsankündigung",
      "state": "Hamburg",
      "amtsgericht": "Amtsgericht Hamburg",
      "registernummer": "HRB 169119",
      "registerart": "HRB",
      "company_name": "Butera Eats GmbH",
      "company_seat": "Hamburg",
      "details": "14.05.2025 (Bekanntmachungsdatum)\n\nHamburg Amtsgericht Hamburg HRB 169119\nLöschungsankündigung\n\nButera Eats GmbH\nGesellschaft mit beschränkter Haftung\nHamburg\n\nDas Registergericht beabsichtigt, die im Handelsregister eingetragene Gesellschaft von Amts wegen nach § 394 FamFG zu löschen. Die Frist zur Erhebung eines Widerspruchs gegen die beabsichtigte Löschung wird auf 3 Monate festgesetzt."
    },
    {
      "date": "2025-05-14",
      "id": "109028",
      "original_text": "Löschungsankündigung\nHamburg Amtsgericht Hamburg HRB 172103\nMomos Service GmbH – Hamburg",
      "type": "Löschungsankündigung",
      "state": "Hamburg",
      "amtsgericht": "Amtsgericht Hamburg",
      "registernummer": "HRB 172103",
      "registerart": "HRB",
      "company_name": "Momos Service GmbH",
      "company_seat": "Hamburg",
      "details": "14.05.2025 (Bekanntmachungsdatum)\n\nHamburg Amtsgericht Hamburg HRB 172103\nLöschungsankündigung\n\nMomos Service GmbH\nGesellschaft mit beschränkter Haftung\nHamburg\n\nDas Registergericht beabsichtigt, die im Handelsregister eingetragene Gesellschaft von Amts wegen nach § 394 FamFG zu löschen. Die Frist zur Erhebung eines Widerspruchs gegen die beabsichtigte Löschung wird auf 3 Monate festgesetzt."
    },
    {
      "date": "2025-05-14",
      "id": "109029",
      "original_text": "Löschungsankündigung\nHamburg Amtsgericht Hamburg HRB 176870\nB.A.G. Services UG (haftungsbeschränkt) – Hamburg",
      "type": "Löschungsankündigung",
      "state": "Hamburg",
      "amtsgericht": "Amtsgericht Hamburg",
      "registernummer": "HRB 176870",
      "registerart": "HRB",
      "company_name": "B.A.G. Services UG (haftungsbeschränkt)",
      "company_seat": "Hamburg",
      "details": "14.05.2025 (Bekanntmachungsdatum)\n\nHamburg Amtsgericht Hamburg HRB 176870\nLöschungsankündigung\n\nB.A.G. Services UG (haftungsbeschränkt)\nGesellschaft mit beschränkter Haftung\nHamburg\n\nDas Registergericht beabsichtigt, die im Handelsregister eingetragene Gesellschaft von Amts wegen nach § 394 FamFG zu löschen. Die Frist zur Erhebung eines Widerspruchs gegen die beabsichtigte Löschung wird auf 3 Monate festgesetzt."
    },
    {
      "date": "2025-05-14",
      "id": "109030",
      "original_text": "Löschungsankündigung\nHamburg Amtsgericht Hamburg HRB 167402\nASB Abbruch GmbH – Hamburg",
      "type": "Löschungsankündigung",
      "state": "Hamburg",
      "amtsgericht": "Amtsgericht Hamburg",
      "registernummer": "HRB 167402",
      "registerart": "HRB",
      "company_name": "ASB Abbruch GmbH",
      "company_seat": "Hamburg",
      "details": "14.05.2025 (Bekanntmachungsdatum)\n\nHamburg Amtsgericht Hamburg HRB 167402\nLöschungsankündigung\n\nASB Abbruch GmbH\nGesellschaft mit beschränkter Haftung\nHamburg\n\nDas Registergericht beabsichtigt, die im Handelsregister eingetragene Gesellschaft von Amts wegen nach § 394 FamFG zu löschen. Die Frist zur Erhebung eines Widerspruchs gegen die beabsichtigte Löschung wird auf 3 Monate festgesetzt."
    },
    {
      "date": "2025-05-14",
      "id": "109031",
      "original_text": "Löschungsankündigung\nHamburg Amtsgericht Hamburg HRB 170184\nSES Logistics GmbH – Hamburg",
      "type": "Löschungsankündigung",
      "state": "Hamburg",
      "amtsgericht": "Amtsgericht Hamburg",
      "registernummer": "HRB 170184",
      "registerart": "HRB",
      "company_name": "SES Logistics GmbH",
      "company_seat": "Hamburg",
      "details": "14.05.2025 (Bekanntmachungsdatum)\n\nHamburg Amtsgericht Hamburg HRB 170184\nLöschungsankündigung\n\nSES Logistics GmbH\nGesellschaft mit beschränkter Haftung\nHamburg\n\nDas Registergericht beabsichtigt, die im Handelsregister eingetragene Gesellschaft von Amts wegen nach § 394 FamFG zu löschen. Die Frist zur Erhebung eines Widerspruchs gegen die beabsichtigte Löschung wird auf 3 Monate festgesetzt."
    },
    {
      "date": "2025-05-14",
      "id": "109032",
      "original_text": "Löschungsankündigung\nHamburg Amtsgericht Hamburg HRB 180514\nBöger Beteiligungs UG (haftungsbeschränkt) – Hamburg",
      "type": "Löschungsankündigung",
      "state": "Hamburg",
      "amtsgericht": "Amtsgericht Hamburg",
      "registernummer": "HRB 180514",
      "registerart": "HRB",
      "company_name": "Böger Beteiligungs UG (haftungsbeschränkt)",
      "company_seat": "Hamburg",
      "details": "14.05.2025 (Bekanntmachungsdatum)\n\nHamburg Amtsgericht Hamburg HRB 180514\nLöschungsankündigung\n\nBöger Beteiligungs UG (haftungsbeschränkt)\nGesellschaft mit beschränkter Haftung\nHamburg\n\nDas Registergericht beabsichtigt, die im Handelsregister eingetragene Gesellschaft von Amts wegen nach § 394 FamFG zu löschen. Die Frist zur Erhebung eines Widerspruchs gegen die beabsichtigte Löschung wird auf 3 Monate festgesetzt."
    },
    {
      "date": "2025-05-14",
      "id": "109033",
      "original_text": "Löschungsankündigung\nHamburg Amtsgericht Hamburg HRB 185775\nRT Invest 3 GmbH – Hamburg",
      "type": "Löschungsankündigung",
      "state": "Hamburg",
      "amtsgericht": "Amtsgericht Hamburg",
      "registernummer": "HRB 185775",
      "registerart": "HRB",
      "company_name": "RT Invest 3 GmbH",
      "company_seat": "Hamburg",
      "details": "14.05.2025 (Bekanntmachungsdatum)\n\nHamburg Amtsgericht Hamburg HRB 185775\nLöschungsankündigung\n\nRT Invest 3 GmbH\nGesellschaft mit beschränkter Haftung\nHamburg\n\nDas Registergericht beabsichtigt, die im Handelsregister eingetragene Gesellschaft von Amts wegen nach § 394 FamFG zu löschen. Die Frist zur Erhebung eines Widerspruchs gegen die beabsichtigte Löschung wird auf 3 Monate festgesetzt."
    },
    {
      "date": "2025-05-14",
      "id": "109034",
      "original_text": "Löschungsankündigung\nBaden-Württemberg Amtsgericht Ulm HRB 530278\nTepel-Dabberdt Gesellschaft mit beschränkter Haftung – Göppingen",
      "type": "Löschungsankündigung",
      "state": "Baden-Württemberg",
      "amtsgericht": "Amtsgericht Ulm",
      "registernummer": "HRB 530278",
      "registerart": "HRB",
      "company_name": "Tepel-Dabberdt Gesellschaft mit beschränkter Haftung",
      "company_seat": "Göppingen",
      "details": "14.05.2025 (Bekanntmachungsdatum)\n\nBaden-Württemberg Amtsgericht Ulm HRB 530278\nLöschungsankündigung\n\nTepel-Dabberdt Gesellschaft mit beschränkter Haftung\nGesellschaft mit beschränkter Haftung\nGöppingen\n\nAls nicht eingetragen wird bekanntgemacht:\nDas Gericht beabsichtigt, die Gesellschaft wegen Vermögenslosigkeit im Handelsregister von Amts wegen nach § 394 FamFG zu löschen. Die Frist zur Geltendmachung eines Widerspruchs gegen die beabsichtigte Löschung ist auf  einen Monat ab Veröffentlichung bestimmt."
    },
    {
      "date": "2025-05-14",
      "id": "109035",
      "original_text": "Registerbekanntmachung nach dem Umwandlungsgesetz\nHamburg Amtsgericht Hamburg HRB 143325\nBiMa Immobilienverwaltung GmbH – Hamburg",
      "type": "Registerbekanntmachung nach dem Umwandlungsgesetz",
      "state": "Hamburg",
      "amtsgericht": "Amtsgericht Hamburg",
      "registernummer": "HRB 143325",
      "registerart": "HRB",
      "company_name": "BiMa Immobilienverwaltung GmbH",
      "company_seat": "Hamburg",
      "details": "14.05.2025 (Bekanntmachungsdatum)\n\nHamburg Amtsgericht Hamburg HRB 143325\nRegisterbekanntmachung nach dem Umwandlungsgesetz 14.05.2025 (Eintragungsdatum)\n\nBiMa Immobilienverwaltung GmbH\nGesellschaft mit beschränkter Haftung\nHamburg\n\nAls nicht eingetragen wird bekannt gemacht:\nDen Gläubigern der an der Verschmelzung beteiligten Gesellschaften ist, wenn sie binnen sechs Monaten nach dem Tag, an dem die Eintragung der Verschmelzung in das Register des Sitzes desjenigen Rechtsträgers, dessen Gläubiger sie sind, nach § 19 Absatz 3 UmwG als bekannt gemacht gilt, ihren Anspruch nach Grund und Höhe schriftlich anmelden, Sicherheit zu leisten, soweit sie nicht Befriedigung verlangen können. Dieses Recht steht den Gläubigern jedoch nur zu, wenn sie glaubhaft machen, dass durch die Verschmelzung die Erfüllung ihrer Forderung gefährdet wird."
    },
    {
      "date": "2025-05-14",
      "id": "109036",
      "original_text": "Registerbekanntmachung nach dem Umwandlungsgesetz\nHamburg Amtsgericht Hamburg HRB 154926\nRudA Immobilienverwaltung GmbH – Hamburg",
      "type": "Registerbekanntmachung nach dem Umwandlungsgesetz",
      "state": "Hamburg",
      "amtsgericht": "Amtsgericht Hamburg",
      "registernummer": "HRB 154926",
      "registerart": "HRB",
      "company_name": "RudA Immobilienverwaltung GmbH",
      "company_seat": "Hamburg",
      "details": "14.05.2025 (Bekanntmachungsdatum)\n\nHamburg Amtsgericht Hamburg HRB 154926\nRegisterbekanntmachung nach dem Umwandlungsgesetz 14.05.2025 (Eintragungsdatum)\n\nRudA Immobilienverwaltung GmbH\nGesellschaft mit beschränkter Haftung\nHamburg\n\nAls nicht eingetragen wird bekannt gemacht:\nDen Gläubigern der an der Verschmelzung beteiligten Gesellschaften ist, wenn sie binnen sechs Monaten nach dem Tag, an dem die Eintragung der Verschmelzung in das Register des Sitzes desjenigen Rechtsträgers, dessen Gläubiger sie sind, nach § 19 Absatz 3 UmwG als bekannt gemacht gilt, ihren Anspruch nach Grund und Höhe schriftlich anmelden, Sicherheit zu leisten, soweit sie nicht Befriedigung verlangen können. Dieses Recht steht den Gläubigern jedoch nur zu, wenn sie glaubhaft machen, dass durch die Verschmelzung die Erfüllung ihrer Forderung gefährdet wird."
    },
    {
      "date": "2025-05-14",
      "id": "109037",
      "original_text": "Löschungsankündigung\nHamburg Amtsgericht Hamburg HRB 178836\nBuR Construction UG (haftungsbeschränkt) – Hamburg",
      "type": "Löschungsankündigung",
      "state": "Hamburg",
      "amtsgericht": "Amtsgericht Hamburg",
      "registernummer": "HRB 178836",
      "registerart": "HRB",
      "company_name": "BuR Construction UG (haftungsbeschränkt)",
      "company_seat": "Hamburg",
      "details": "14.05.2025 (Bekanntmachungsdatum)\n\nHamburg Amtsgericht Hamburg HRB 178836\nLöschungsankündigung\n\nBuR Construction UG (haftungsbeschränkt)\nGesellschaft mit beschränkter Haftung\nHamburg\n\nDas Registergericht beabsichtigt, die im Handelsregister eingetragene Gesellschaft von Amts wegen nach § 394 FamFG zu löschen. Die Frist zur Erhebung eines Widerspruchs gegen die beabsichtigte Löschung wird auf 3 Monate festgesetzt."
    },
    {
      "date": "2025-05-14",
      "id": "109038",
      "original_text": "Einreichung neuer Dokumente\nBrandenburg Amtsgericht Potsdam HRB 12844\nUP Transfer GmbH an der Universität Potsdam – Potsdam",
      "type": "Einreichung neuer Dokumente",
      "state": "Brandenburg",
      "amtsgericht": "Amtsgericht Potsdam",
      "registernummer": "HRB 12844",
      "registerart": "HRB",
      "company_name": "UP Transfer GmbH an der Universität Potsdam",
      "company_seat": "Potsdam",
      "details": "14.05.2025 (Bekanntmachungsdatum)\n\nBrandenburg Amtsgericht Potsdam HRB 12844\nEinreichung neuer Dokumente\n\nUP Transfer GmbH an der Universität Potsdam\nGesellschaft mit beschränkter Haftung\nPotsdam\n\nAls nicht eingetragen wird veröffentlicht: Eine Liste der Mitglieder des Aufsichtsrates wurde zum Handelsregister eingereicht."
    },
    {
      "date": "2025-05-14",
      "id": "109039",
      "original_text": "Löschungsankündigung\nHamburg Amtsgericht Hamburg HRA 114471\nHansa Heavy Lift UG (haftungsbeschränkt) & Co. KG MS \"HHL Kobe\" – Hamburg",
      "type": "Löschungsankündigung",
      "state": "Hamburg",
      "amtsgericht": "Amtsgericht Hamburg",
      "registernummer": "HRA 114471",
      "registerart": "HRA",
      "company_name": "Hansa Heavy Lift UG (haftungsbeschränkt) & Co. KG MS \"HHL Kobe\"",
      "company_seat": "Hamburg",
      "details": "14.05.2025 (Bekanntmachungsdatum)\n\nHamburg Amtsgericht Hamburg HRA 114471\nLöschungsankündigung\n\nHansa Heavy Lift UG (haftungsbeschränkt) & Co. KG MS \"HHL Kobe\"\nKommanditgesellschaft\nHamburg\n\nDas Registergericht beabsichtigt, die im Handelsregister eingetragene Firma von Amts wegen nach § 31 Abs. 2 HBG zu löschen. Die Frist zur Erhebung eines Widerspruchs gegen die beabsichtigte Löschung wird auf 3 Monate festgesetzt."
    },
    {
      "date": "2025-05-14",
      "id": "109040",
      "original_text": "Löschungsankündigung\nHamburg Amtsgericht Hamburg VR 14639\nSous- Section de RPG (Rassemblement du peuple de Guinée) á Hamburg (serpegham) e.V. – Hamburg",
      "type": "Löschungsankündigung",
      "state": "Hamburg",
      "amtsgericht": "Amtsgericht Hamburg",
      "registernummer": "VR 14639",
      "registerart": "VR",
      "company_name": "Sous- Section de RPG (Rassemblement du peuple de Guinée) á Hamburg (serpegham) e.V.",
      "company_seat": "Hamburg",
      "details": "14.05.2025 (Bekanntmachungsdatum)\n\nHamburg Amtsgericht Hamburg VR 14639\nLöschungsankündigung\n\nSous- Section de RPG (Rassemblement du peuple de Guinée) á Hamburg (serpegham) e.V.\neingetragener Verein\nHamburg\n\nDas Registergericht beabsichtigt, die im Handelsregister eingetragene Firma von Amts wegen nach § 31 Abs. 2 HBG zu löschen. Die Frist zur Erhebung eines Widerspruchs gegen die beabsichtigte Löschung wird auf 3 Monate festgesetzt."
    },
    {
      "date": "2025-05-14",
      "id": "109041",
      "original_text": "Löschungsankündigung\nHamburg Amtsgericht Hamburg HRA 106421\nMS \"United Tambora\" Schifffahrtsgesellschaft mbH & Co. KG – Hamburg",
      "type": "Löschungsankündigung",
      "state": "Hamburg",
      "amtsgericht": "Amtsgericht Hamburg",
      "registernummer": "HRA 106421",
      "registerart": "HRA",
      "company_name": "MS \"United Tambora\" Schifffahrtsgesellschaft mbH & Co. KG",
      "company_seat": "Hamburg",
      "details": "14.05.2025 (Bekanntmachungsdatum)\n\nHamburg Amtsgericht Hamburg HRA 106421\nLöschungsankündigung\n\nMS \"United Tambora\" Schifffahrtsgesellschaft mbH & Co. KG\nKommanditgesellschaft\nHamburg\n\nDas Registergericht beabsichtigt, die im Handelsregister eingetragene Firma von Amts wegen nach § 31 Abs. 2 HBG zu löschen. Die Frist zur Erhebung eines Widerspruchs gegen die beabsichtigte Löschung wird auf 3 Monate festgesetzt."
    },
    {
      "date": "2025-05-14",
      "id": "109042",
      "original_text": "Einreichung neuer Dokumente\nBaden-Württemberg Amtsgericht Stuttgart HRB 724204\nStaufen.AG Beratung Akademie Beteiligung – Köngen",
      "type": "Einreichung neuer Dokumente",
      "state": "Baden-Württemberg",
      "amtsgericht": "Amtsgericht Stuttgart",
      "registernummer": "HRB 724204",
      "registerart": "HRB",
      "company_name": "Staufen.AG Beratung Akademie Beteiligung",
      "company_seat": "Köngen",
      "details": "14.05.2025 (Bekanntmachungsdatum)\n\nBaden-Württemberg Amtsgericht Stuttgart HRB 724204\nEinreichung neuer Dokumente 09.05.2025 (Eintragungsdatum)\n\nStaufen.AG Beratung Akademie Beteiligung\nAktiengesellschaft\nKöngen\n\nDie Gesellschaft hat am 08.04.2025 die Liste über die Zusammensetzung des Aufsichtsrats zum Handelsregister eingereicht."
    },
    {
      "date": "2025-05-14",
      "id": "109043",
      "original_text": "Registerbekanntmachung nach dem Umwandlungsgesetz\nSchleswig-Holstein Amtsgericht Pinneberg HRB 15213\nESHamburg GmbH – Quickborn/Krs. Pinneberg",
      "type": "Registerbekanntmachung nach dem Umwandlungsgesetz",
      "state": "Schleswig-Holstein",
      "amtsgericht": "Amtsgericht Pinneberg",
      "registernummer": "HRB 15213",
      "registerart": "HRB",
      "company_name": "ESHamburg GmbH",
      "company_seat": "Quickborn/Krs. Pinneberg",
      "details": "14.05.2025 (Bekanntmachungsdatum)\n\nSchleswig-Holstein Amtsgericht Pinneberg HRB 15213\nRegisterbekanntmachung nach dem Umwandlungsgesetz 12.05.2025 (Eintragungsdatum)\n\nESHamburg GmbH\nGesellschaft mit beschränkter Haftung\nQuickborn/Krs. Pinneberg\n\nAls nicht eingetragen wird veröffentlicht: Den Gläubigern der an der Verschmelzung beteiligten Rechtsträger ist, wenn sie binnen sechs Monaten nach dem Tag, an dem die Eintragung der Verschmelzung in das Register des Sitzes desjenigen Rechtsträgers, dessen Gläubiger sie sind, als bekannt gemacht gilt, ihren Anspruch nach Grund und Höhe schriftlich anmelden, Sicherheit zu leisten, soweit sie nicht Befriedigung verlangen können. Dieses Recht steht den Gläubigern jedoch nur zu, wenn sie glaubhaft machen, dass durch die Verschmelzung die Erfüllung ihrer Forderung gefährdet wird. Das Recht, Sicherheitsleistung zu verlangen, steht Gläubigern nicht zu, die im Falle der Insolvenz ein Recht auf vorzugsweise Befriedigung aus einer Deckungsmasse haben, die nach gesetzlicher Vorschrift zu ihrem Schutz errichtet und staatlich überwacht ist."
    },
    {
      "date": "2025-05-14",
      "id": "109044",
      "original_text": "Sonstige Registerbekanntmachung\nHamburg Amtsgericht Hamburg HRB 13038\nChemikalien Seetransport G.m.b.H. – Hamburg",
      "type": "Sonstige Registerbekanntmachung",
      "state": "Hamburg",
      "amtsgericht": "Amtsgericht Hamburg",
      "registernummer": "HRB 13038",
      "registerart": "HRB",
      "company_name": "Chemikalien Seetransport G.m.b.H.",
      "company_seat": "Hamburg",
      "details": "14.05.2025 (Bekanntmachungsdatum)\n\nHamburg Amtsgericht Hamburg HRB 13038\nSonstige Registerbekanntmachung 14.05.2025 (Eintragungsdatum)\n\nChemikalien Seetransport G.m.b.H.\nGesellschaft mit beschränkter Haftung\nHamburg\n\nAls nicht eingetragen wird bekannt gemacht:  Den Gläubigern der Gesellschaft, deren Forderungen begründet worden sind, bevor die Eintragung der Vertragsbeendigung in das Handelsregister nach § 10 HGB als bekannt gemacht gilt, ist vom anderen Vertragsteil Sicherheit zu leisten, wenn sie sich binnen 6 Monaten nach Bekanntmachung der Eintragung zu diesem Zweck bei ihm melden."
    },
    {
      "date": "2025-05-14",
      "id": "109045",
      "original_text": "Löschungsankündigung\nSachsen Amtsgericht Dresden HRB 41193\nGan Eden Bestattungsinstitut UG (haftungsbeschränkt) – Dresden",
      "type": "Löschungsankündigung",
      "state": "Sachsen",
      "amtsgericht": "Amtsgericht Dresden",
      "registernummer": "HRB 41193",
      "registerart": "HRB",
      "company_name": "Gan Eden Bestattungsinstitut UG (haftungsbeschränkt)",
      "company_seat": "Dresden",
      "details": "14.05.2025 (Bekanntmachungsdatum)\n\nSachsen Amtsgericht Dresden HRB 41193\nLöschungsankündigung\n\nGan Eden Bestattungsinstitut UG (haftungsbeschränkt)\nGesellschaft mit beschränkter Haftung\nDresden\n\nDas Registergericht beabsichtigt, die im Handelsregister eingetragene Gesellschaft von Amts wegen nach § 394 FamFG zu löschen. Die Frist zu Erhebung eines Widerspruchs gegen die beabsichtigte Löschung wird auf einen Monat festgesetzt."
    },
    {
      "date": "2025-05-14",
      "id": "109046",
      "original_text": "Registerbekanntmachung nach dem Umwandlungsgesetz\nNiedersachsen Amtsgericht Tostedt HRB 211538\nNorbert Riecke GmbH – Tostedt",
      "type": "Registerbekanntmachung nach dem Umwandlungsgesetz",
      "state": "Niedersachsen",
      "amtsgericht": "Amtsgericht Tostedt",
      "registernummer": "HRB 211538",
      "registerart": "HRB",
      "company_name": "Norbert Riecke GmbH",
      "company_seat": "Tostedt",
      "details": "14.05.2025 (Bekanntmachungsdatum)\n\nNiedersachsen Amtsgericht Tostedt HRB 211538\nRegisterbekanntmachung nach dem Umwandlungsgesetz 14.05.2025 (Eintragungsdatum)\n\nNorbert Riecke GmbH\nGesellschaft mit beschränkter Haftung\nTostedt\n\nDen Gläubigern der an der Ausgliederung beteiligten Rechtsträger ist, wenn sie binnen sechs Monaten nach dem Tag, an dem die Eintragung der Ausgliederung in das Register des Sitzes desjenigen Rechtsträgers, dessen Gläubiger sie sind, nach § 19 Abs. 3 UmwG als bekannt gemacht gilt, ihren Anspruch nach Grund und Höhe schriftlich anmelden, Sicherheit zu leisten, soweit sie nicht Befriedigung verlangen können. Dieses Recht steht den Gläubigern jedoch nur zu, wenn sie glaubhaft machen, dass durch die Ausgliederung die Erfüllung der Forderung gefährdet wird."
    },
    {
      "date": "2025-05-14",
      "id": "109047",
      "original_text": "Registerbekanntmachung nach dem Umwandlungsgesetz\nNiedersachsen Amtsgericht Göttingen HRB 207810\nChristiane Hansmann GmbH – Göttingen",
      "type": "Registerbekanntmachung nach dem Umwandlungsgesetz",
      "state": "Niedersachsen",
      "amtsgericht": "Amtsgericht Göttingen",
      "registernummer": "HRB 207810",
      "registerart": "HRB",
      "company_name": "Christiane Hansmann GmbH",
      "company_seat": "Göttingen",
      "details": "14.05.2025 (Bekanntmachungsdatum)\n\nNiedersachsen Amtsgericht Göttingen HRB 207810\nRegisterbekanntmachung nach dem Umwandlungsgesetz 14.05.2025 (Eintragungsdatum)\n\nChristiane Hansmann GmbH\nGesellschaft mit beschränkter Haftung\nGöttingen\n\nDen Gläubigern der an der formwechselnden Umwandlung beteiligten Rechtsträger ist, wenn sie binnen sechs Monaten nach dem Tag, an dem die Eintragung der Umwandlung in das Register des Sitzes desjenigen Rechtsträgers, dessen Gläubiger sie sind, nach § 19 Abs. 3 UmwG als bekannt gemacht gilt, ihren Anspruch nach Grund und Höhe schriftlich anmelden, Sicherheit zu leisten, soweit sie nicht Befriedigung verlangen können. Dieses Recht steht den Gläubigern jedoch nur zu, wenn sie glaubhaft machen, dass durch die formwechselnde Umwandlung die Erfüllung der Forderung gefährdet wird."
    },
    {
      "date": "2025-05-14",
      "id": "109048",
      "original_text": "Registerbekanntmachung nach dem Umwandlungsgesetz\nNiedersachsen Amtsgericht Osnabrück HRB 207960\nMS \"DENEB J\" Verwaltungs UG (haftungsbeschränkt) – Haren",
      "type": "Registerbekanntmachung nach dem Umwandlungsgesetz",
      "state": "Niedersachsen",
      "amtsgericht": "Amtsgericht Osnabrück",
      "registernummer": "HRB 207960",
      "registerart": "HRB",
      "company_name": "MS \"DENEB J\" Verwaltungs UG (haftungsbeschränkt)",
      "company_seat": "Haren",
      "details": "14.05.2025 (Bekanntmachungsdatum)\n\nNiedersachsen Amtsgericht Osnabrück HRB 207960\nRegisterbekanntmachung nach dem Umwandlungsgesetz 14.05.2025 (Eintragungsdatum)\n\nMS \"DENEB J\" Verwaltungs UG (haftungsbeschränkt)\nGesellschaft mit beschränkter Haftung\nHaren\n\nDen Gläubigern der an der Verschmelzung beteiligten Rechtsträger ist, wenn sie binnen sechs Monaten nach dem Tag, an dem die Eintragung der Verschmelzung in das Register des Sitzes desjenigen Rechtsträgers, dessen Gläubiger sie sind, nach § 19  Abs.  3 UmwG als bekannt gemacht gilt, ihren Anspruch nach Grund und Höhe schriftlich anmelden, Sicherheit zu leisten, soweit sie nicht Befriedigung verlangen können. Dieses Recht steht den Gläubigern jedoch nur zu, wenn sie glaubhaft machen, dass durch die Verschmelzung die Erfüllung der Forderung gefährdet wird."
    },
    {
      "date": "2025-05-14",
      "id": "109049",
      "original_text": "Löschungsankündigung\nNiedersachsen Amtsgericht Osnabrück HRB 202062\nALU-Raffinage GmbH – Laar OT Eschebrügge",
      "type": "Löschungsankündigung",
      "state": "Niedersachsen",
      "amtsgericht": "Amtsgericht Osnabrück",
      "registernummer": "HRB 202062",
      "registerart": "HRB",
      "company_name": "ALU-Raffinage GmbH",
      "company_seat": "Laar OT Eschebrügge",
      "details": "14.05.2025 (Bekanntmachungsdatum)\n\nNiedersachsen Amtsgericht Osnabrück HRB 202062\nLöschungsankündigung\n\nALU-Raffinage GmbH\nGesellschaft mit beschränkter Haftung\nLaar OT Eschebrügge\n\nDas Registergericht beabsichtigt, die Gesellschaft von Amts wegen nach § 394 FamFG wegen Vermögenslosigkeit zu löschen. Die Frist zur Erhebung eines Widerspruchs ist auf 1 Monat ab dieser Registerbekanntmachung festgesetzt."
    },
    {
      "date": "2025-05-14",
      "id": "109050",
      "original_text": "Registerbekanntmachung nach dem Umwandlungsgesetz\nNiedersachsen Amtsgericht Tostedt HRA 1684\nNorbert Riecke e.K. – Tostedt",
      "type": "Registerbekanntmachung nach dem Umwandlungsgesetz",
      "state": "Niedersachsen",
      "amtsgericht": "Amtsgericht Tostedt",
      "registernummer": "HRA 1684",
      "registerart": "HRA",
      "company_name": "Norbert Riecke e.K.",
      "company_seat": "Tostedt",
      "details": "14.05.2025 (Bekanntmachungsdatum)\n\nNiedersachsen Amtsgericht Tostedt HRA 1684\nRegisterbekanntmachung nach dem Umwandlungsgesetz 14.05.2025 (Eintragungsdatum)\n\nNorbert Riecke e.K.\nEinzelkaufmann / Einzelkauffrau\nTostedt\n\nDen Gläubigern der an der Ausgliederung beteiligten Rechtsträger ist, wenn sie binnen sechs Monaten nach dem Tag, an dem die Eintragung der Ausgliederung in das Register des Sitzes desjenigen Rechtsträgers, dessen Gläubiger sie sind, nach § 19 Abs. 3 UmwG als bekannt gemacht gilt, ihren Anspruch nach Grund und Höhe schriftlich anmelden, Sicherheit zu leisten, soweit sie nicht Befriedigung verlangen können. Dieses Recht steht den Gläubigern jedoch nur zu, wenn sie glaubhaft machen, dass durch die Ausgliederung die Erfüllung der Forderung gefährdet wird."
    },
    {
      "date": "2025-05-14",
      "id": "109051",
      "original_text": "Löschungsankündigung\nNiedersachsen Amtsgericht Osnabrück HRB 218342\nReCuremed UG (haftungsbeschränkt) – Kettenkamp",
      "type": "Löschungsankündigung",
      "state": "Niedersachsen",
      "amtsgericht": "Amtsgericht Osnabrück",
      "registernummer": "HRB 218342",
      "registerart": "HRB",
      "company_name": "ReCuremed UG (haftungsbeschränkt)",
      "company_seat": "Kettenkamp",
      "details": "14.05.2025 (Bekanntmachungsdatum)\n\nNiedersachsen Amtsgericht Osnabrück HRB 218342\nLöschungsankündigung\n\nReCuremed UG (haftungsbeschränkt)\nGesellschaft mit beschränkter Haftung\nKettenkamp\n\nDas Registergericht beabsichtigt, die Gesellschaft von Amts wegen nach § 394 FamFG wegen Vermögenslosigkeit zu löschen. Die Frist zur Erhebung eines Widerspruchs ist auf 1 Monat ab dieser Registerbekanntmachung festgesetzt."
    },
    {
      "date": "2025-05-14",
      "id": "109052",
      "original_text": "Registerbekanntmachung nach dem Umwandlungsgesetz\nNiedersachsen Amtsgericht Göttingen HRA 202359\nChristiane Hansmann GmbH & Co. OHG – Göttingen",
      "type": "Registerbekanntmachung nach dem Umwandlungsgesetz",
      "state": "Niedersachsen",
      "amtsgericht": "Amtsgericht Göttingen",
      "registernummer": "HRA 202359",
      "registerart": "HRA",
      "company_name": "Christiane Hansmann GmbH & Co. OHG",
      "company_seat": "Göttingen",
      "details": "14.05.2025 (Bekanntmachungsdatum)\n\nNiedersachsen Amtsgericht Göttingen HRA 202359\nRegisterbekanntmachung nach dem Umwandlungsgesetz 14.05.2025 (Eintragungsdatum)\n\nChristiane Hansmann GmbH & Co. OHG\nOffene Handelsgesellschaft\nGöttingen\n\nDen Gläubigern der an der formwechselnden Umwandlung beteiligten Rechtsträger ist, wenn sie binnen sechs Monaten nach dem Tag, an dem die Eintragung der Umwandlung in das Register des Sitzes desjenigen Rechtsträgers, dessen Gläubiger sie sind, nach § 19 Abs. 3 UmwG als bekannt gemacht gilt, ihren Anspruch nach Grund und Höhe schriftlich anmelden, Sicherheit zu leisten, soweit sie nicht Befriedigung verlangen können. Dieses Recht steht den Gläubigern jedoch nur zu, wenn sie glaubhaft machen, dass durch die formwechselnde Umwandlung die Erfüllung der Forderung gefährdet wird."
    },
    {
      "date": "2025-05-14",
      "id": "109053",
      "original_text": "Sonstige Registerbekanntmachung\nNiedersachsen Amtsgericht Hannover HRB 213496\nGemeinde Wedemark Bau- und Entwicklungsgesellschaft mbH – Wedemark",
      "type": "Sonstige Registerbekanntmachung",
      "state": "Niedersachsen",
      "amtsgericht": "Amtsgericht Hannover",
      "registernummer": "HRB 213496",
      "registerart": "HRB",
      "company_name": "Gemeinde Wedemark Bau- und Entwicklungsgesellschaft mbH",
      "company_seat": "Wedemark",
      "details": "14.05.2025 (Bekanntmachungsdatum)\n\nNiedersachsen Amtsgericht Hannover HRB 213496\nSonstige Registerbekanntmachung\n\nGemeinde Wedemark Bau- und Entwicklungsgesellschaft mbH\nGesellschaft mit beschränkter Haftung\nWedemark\n\nDie Liste der Mitglieder des Aufsichtsrats wurde beim Registergericht eingereicht."
    },
    {
      "date": "2025-05-14",
      "id": "109054",
      "original_text": "Registerbekanntmachung nach dem Umwandlungsgesetz\nRheinland-Pfalz Amtsgericht Koblenz HRB 28880\nZW Energie GmbH – Remagen",
      "type": "Registerbekanntmachung nach dem Umwandlungsgesetz",
      "state": "Rheinland-Pfalz",
      "amtsgericht": "Amtsgericht Koblenz",
      "registernummer": "HRB 28880",
      "registerart": "HRB",
      "company_name": "ZW Energie GmbH",
      "company_seat": "Remagen",
      "details": "14.05.2025 (Bekanntmachungsdatum)\n\nRheinland-Pfalz Amtsgericht Koblenz HRB 28880\nRegisterbekanntmachung nach dem Umwandlungsgesetz 14.05.2025 (Eintragungsdatum)\n\nZW Energie GmbH\nGesellschaft mit beschränkter Haftung\nRemagen\n\nAls nicht eingetragen wird veröffentlicht: Den Gläubigern der an der Verschmelzung beteiligten Rechtsträger ist, wenn sie binnen sechs Monaten nach dem Tag, an dem die Eintragung der Verschmelzung in das Register des Sitzes desjenigen Rechtsträgers,dessen Gläubiger sie sind, nach § 19 Abs. 3 UmwG als bekannt gemacht gilt, ihren Anspruch nach Grund und Höhe schriftlich anmelden, Sicherheit zu leisten, soweit sie nicht Befriedigung verlangen können. Dieses Recht steht den Gläubigern jedoch nur zu, wenn sie glaubhaft machen, dass durch die Verschmelzung die Erfüllungd er Forderung gefährdet wird."
    },
    {
      "date": "2025-05-14",
      "id": "109055",
      "original_text": "Registerbekanntmachung nach dem Umwandlungsgesetz\nRheinland-Pfalz Amtsgericht Koblenz HRB 15639\nZewotherm Energie GmbH – Remagen",
      "type": "Registerbekanntmachung nach dem Umwandlungsgesetz",
      "state": "Rheinland-Pfalz",
      "amtsgericht": "Amtsgericht Koblenz",
      "registernummer": "HRB 15639",
      "registerart": "HRB",
      "company_name": "Zewotherm Energie GmbH",
      "company_seat": "Remagen",
      "details": "14.05.2025 (Bekanntmachungsdatum)\n\nRheinland-Pfalz Amtsgericht Koblenz HRB 15639\nRegisterbekanntmachung nach dem Umwandlungsgesetz 14.05.2025 (Eintragungsdatum)\n\nZewotherm Energie GmbH\nGesellschaft mit beschränkter Haftung\nRemagen\n\nAls nicht eingetragen wird veröffentlicht: Den Gläubigern der an der Verschmelzung beteiligten Rechtsträger ist, wenn sie binnen sechs Monaten nach dem Tag, an dem die Eintragung der Verschmelzung in das Register des Sitzes desjenigen Rechtsträgers,dessen Gläubiger sie sind, nach § 19 Abs. 3 UmwG als bekannt gemacht gilt, ihren Anspruch nach Grund und Höhe schriftlich anmelden, Sicherheit zu leisten, soweit sie nicht Befriedigung verlangen können. Dieses Recht steht den Gläubigern jedoch nur zu, wenn sie glaubhaft machen, dass durch die Verschmelzung die Erfüllungd er Forderung gefährdet wird."
    },
    {
      "date": "2025-05-14",
      "id": "109056",
      "original_text": "Einreichung neuer Dokumente\nRheinland-Pfalz Amtsgericht Koblenz HRB 4239\nNovelis Koblenz GmbH – Koblenz",
      "type": "Einreichung neuer Dokumente",
      "state": "Rheinland-Pfalz",
      "amtsgericht": "Amtsgericht Koblenz",
      "registernummer": "HRB 4239",
      "registerart": "HRB",
      "company_name": "Novelis Koblenz GmbH",
      "company_seat": "Koblenz",
      "details": "14.05.2025 (Bekanntmachungsdatum)\n\nRheinland-Pfalz Amtsgericht Koblenz HRB 4239\nEinreichung neuer Dokumente\n\nNovelis Koblenz GmbH\nGesellschaft mit beschränkter Haftung\nKoblenz\n\nDem Registergericht ist eine Liste der Mitglieder des Aufsichtsrates eingereicht worden."
    },
    {
      "date": "2025-05-14",
      "id": "109057",
      "original_text": "Registerbekanntmachung nach dem Umwandlungsgesetz\nNordrhein-Westfalen Amtsgericht Düsseldorf HRB 95257\nRefratechnik Horn Produktions GmbH – Düsseldorf",
      "type": "Registerbekanntmachung nach dem Umwandlungsgesetz",
      "state": "Nordrhein-Westfalen",
      "amtsgericht": "Amtsgericht Düsseldorf",
      "registernummer": "HRB 95257",
      "registerart": "HRB",
      "company_name": "Refratechnik Horn Produktions GmbH",
      "company_seat": "Düsseldorf",
      "details": "14.05.2025 (Bekanntmachungsdatum)\n\nNordrhein-Westfalen Amtsgericht Düsseldorf HRB 95257\nRegisterbekanntmachung nach dem Umwandlungsgesetz 14.05.2025 (Eintragungsdatum)\n\nRefratechnik Horn Produktions GmbH\nGesellschaft mit beschränkter Haftung\nDüsseldorf\n\nDen Gläubigern der an der Verschmelzung beteiligten Rechtsträger ist, wenn sie binnen sechs Monaten nach dem Tag, an dem die Eintragung der Verschmelzung in das Register des Sitzes desjenigen Rechtsträgers, dessen Gläubiger sie sind, nach § 19 Absatz 3 UmwG als bekanntgemacht gilt, ihren Anspruch nach Grund und Höhe schriftlich anmelden, Sicherheit zu leisten, soweit sie nicht Befriedigung verlangen können. Dieses Recht steht den Gläubigern jedoch nur zu, wenn sie glaubhaft machen, dass durch die Verschmelzung die Erfüllung ihrer Forderung gefährdet wird."
    },
    {
      "date": "2025-05-14",
      "id": "109058",
      "original_text": "Löschungsankündigung\nNordrhein-Westfalen Amtsgericht Gelsenkirchen HRB 12330\nKURTT Gerüstbau GmbH – Gladbeck",
      "type": "Löschungsankündigung",
      "state": "Nordrhein-Westfalen",
      "amtsgericht": "Amtsgericht Gelsenkirchen",
      "registernummer": "HRB 12330",
      "registerart": "HRB",
      "company_name": "KURTT Gerüstbau GmbH",
      "company_seat": "Gladbeck",
      "details": "14.05.2025 (Bekanntmachungsdatum)\n\nNordrhein-Westfalen Amtsgericht Gelsenkirchen HRB 12330\nLöschungsankündigung\n\nKURTT Gerüstbau GmbH\nGesellschaft mit beschränkter Haftung\nGladbeck\n\nDas Gericht beabsichtigt, die Gesellschaft KURTT Gerüstbau GmbH mit Sitz in Gladbeck, HRB 12330 Amtsgericht Gelsenkirchen, wegen Vermögenslosigkeit zu löschen.\n\nHiermit wird denjenigen, die an der Unterlassung der Löschung ein berechtigtes Interesse haben, gem. § 394 Abs. 2 FamFG Gelegenheit gegeben, gegen dieses Vorhaben binnen eines Monats nach dieser Bekanntmachung Widerspruch einzulegen. Der Widerspruch kann schriftlich oder zu Protokoll der Geschäftsstelle erhoben werden."
    },
    {
      "date": "2025-05-14",
      "id": "109059",
      "original_text": "Registerbekanntmachung nach dem Umwandlungsgesetz\nNordrhein-Westfalen Amtsgericht Duisburg HRA 8577\nALDI International Services SE & Co. oHG – Mülheim an der Ruhr",
      "type": "Registerbekanntmachung nach dem Umwandlungsgesetz",
      "state": "Nordrhein-Westfalen",
      "amtsgericht": "Amtsgericht Duisburg",
      "registernummer": "HRA 8577",
      "registerart": "HRA",
      "company_name": "ALDI International Services SE & Co. oHG",
      "company_seat": "Mülheim an der Ruhr",
      "details": "14.05.2025 (Bekanntmachungsdatum)\n\nNordrhein-Westfalen Amtsgericht Duisburg HRA 8577\nRegisterbekanntmachung nach dem Umwandlungsgesetz 14.05.2025 (Eintragungsdatum)\n\nALDI International Services SE & Co. oHG\nOffene Handelsgesellschaft\nMülheim an der Ruhr\n\nDie Gesellschaft hat Gläubigern, deren Forderungen vor dieser Bekanntmachung begründet worden sind, Sicherheit zu leisten, soweit sie nicht Befriedigung verlangen können, wenn sie sich binnen sechs Monaten zu diesem Zweck melden."
    },
    {
      "date": "2025-05-14",
      "id": "109060",
      "original_text": "Einreichung neuer Dokumente\nNordrhein-Westfalen Amtsgericht Münster HRB 17424\nDZ HYP AG – Hamburg und Münster",
      "type": "Einreichung neuer Dokumente",
      "state": "Nordrhein-Westfalen",
      "amtsgericht": "Amtsgericht Münster",
      "registernummer": "HRB 17424",
      "registerart": "HRB",
      "company_name": "DZ HYP AG",
      "company_seat": "Hamburg und Münster",
      "details": "14.05.2025 (Bekanntmachungsdatum)\n\nNordrhein-Westfalen Amtsgericht Münster HRB 17424\nEinreichung neuer Dokumente\n\nDZ HYP AG\nAktiengesellschaft\nHamburg und Münster\n\nDem Registergericht ist eine neue Liste der Mitglieder des Aufsichtsrates eingereicht worden."
    },
    {
      "date": "2025-05-14",
      "id": "109061",
      "original_text": "Einreichung neuer Dokumente\nNordrhein-Westfalen Amtsgericht Münster HRB 10502\nVectron Systems AG – Münster",
      "type": "Einreichung neuer Dokumente",
      "state": "Nordrhein-Westfalen",
      "amtsgericht": "Amtsgericht Münster",
      "registernummer": "HRB 10502",
      "registerart": "HRB",
      "company_name": "Vectron Systems AG",
      "company_seat": "Münster",
      "details": "14.05.2025 (Bekanntmachungsdatum)\n\nNordrhein-Westfalen Amtsgericht Münster HRB 10502\nEinreichung neuer Dokumente\n\nVectron Systems AG\nAktiengesellschaft\nMünster\n\nDem Registergericht ist eine neue Liste der Mitglieder des Aufsichtsrates eingereicht worden."
    },
    {
      "date": "2025-05-14",
      "id": "109062",
      "original_text": "Löschungsankündigung\nNordrhein-Westfalen Amtsgericht Gelsenkirchen HRB 12560\nAY Bau GmbH – Gladbeck",
      "type": "Löschungsankündigung",
      "state": "Nordrhein-Westfalen",
      "amtsgericht": "Amtsgericht Gelsenkirchen",
      "registernummer": "HRB 12560",
      "registerart": "HRB",
      "company_name": "AY Bau GmbH",
      "company_seat": "Gladbeck",
      "details": "14.05.2025 (Bekanntmachungsdatum)\n\nNordrhein-Westfalen Amtsgericht Gelsenkirchen HRB 12560\nLöschungsankündigung\n\nAY Bau GmbH\nGesellschaft mit beschränkter Haftung\nGladbeck\n\nDas Gericht beabsichtigt, die Gesellschaft AY Bau GmbH mit Sitz in Gladbeck, HRB 152560 Amtsgericht Gelsenkirchen, wegen Vermögenslosigkeit zu löschen.\n\nHiermit wird denjenigen, die an der Unterlassung der Löschung ein berechtigtes Interesse haben, gem. § 394 Abs. 2 FamFG Gelegenheit gegeben, gegen dieses Vorhaben binnen eines Monats nach dieser Bekanntmachung Widerspruch einzulegen. Der Widerspruch kann schriftlich oder zu Protokoll der Geschäftsstelle erhoben werden."
    },
    {
      "date": "2025-05-14",
      "id": "109063",
      "original_text": "Löschungsankündigung\nNordrhein-Westfalen Amtsgericht Krefeld HRB 18520\nE/S/A Consult GmbH – Krefeld",
      "type": "Löschungsankündigung",
      "state": "Nordrhein-Westfalen",
      "amtsgericht": "Amtsgericht Krefeld",
      "registernummer": "HRB 18520",
      "registerart": "HRB",
      "company_name": "E/S/A Consult GmbH",
      "company_seat": "Krefeld",
      "details": "14.05.2025 (Bekanntmachungsdatum)\n\nNordrhein-Westfalen Amtsgericht Krefeld HRB 18520\nLöschungsankündigung\n\nE/S/A Consult GmbH\nGesellschaft mit beschränkter Haftung\nKrefeld\n\nDas Registergericht beabsichtigt die Gesellschaft von Amts wegen nach § 394 FamFG zu löschen. Die Frist zur Erhebung eines Widerspruchs ist auf einen Monat festgesetzt."
    },
    {
      "date": "2025-05-14",
      "id": "109064",
      "original_text": "Löschungsankündigung\nNordrhein-Westfalen Amtsgericht Essen HRB 13288\nAuth Fugentechnik Verwaltungs-GmbH – Essen",
      "type": "Löschungsankündigung",
      "state": "Nordrhein-Westfalen",
      "amtsgericht": "Amtsgericht Essen",
      "registernummer": "HRB 13288",
      "registerart": "HRB",
      "company_name": "Auth Fugentechnik Verwaltungs-GmbH",
      "company_seat": "Essen",
      "details": "14.05.2025 (Bekanntmachungsdatum)\n\nNordrhein-Westfalen Amtsgericht Essen HRB 13288\nLöschungsankündigung\n\nAuth Fugentechnik Verwaltungs-GmbH\nGesellschaft mit beschränkter Haftung\nEssen\n\nDas Registergericht beabsichtigt die Gesellschaft von Amts wegen nach § 394 FamFG zu löschen. Die Frist zur Erhebung eines Widerspruchs ist auf einen Monat festgesetzt."
    },
    {
      "date": "2025-05-14",
      "id": "109065",
      "original_text": "Einreichung neuer Dokumente\nNordrhein-Westfalen Amtsgericht Neuss HRB 13187\nFinancialbot.com AG – Meerbusch",
      "type": "Einreichung neuer Dokumente",
      "state": "Nordrhein-Westfalen",
      "amtsgericht": "Amtsgericht Neuss",
      "registernummer": "HRB 13187",
      "registerart": "HRB",
      "company_name": "Financialbot.com AG",
      "company_seat": "Meerbusch",
      "details": "14.05.2025 (Bekanntmachungsdatum)\n\nNordrhein-Westfalen Amtsgericht Neuss HRB 13187\nEinreichung neuer Dokumente 14.05.2025 (Eintragungsdatum)\n\nFinancialbot.com AG\nAktiengesellschaft\nMeerbusch\n\nDem Registergericht ist eine Liste der Mitglieder des Aufsichtsrates eingereicht worden."
    },
    {
      "date": "2025-05-14",
      "id": "109066",
      "original_text": "Einreichung neuer Dokumente\nNordrhein-Westfalen Amtsgericht Bonn HRB 12232\nPrinz von Preußen Grundbesitz AG – Bonn",
      "type": "Einreichung neuer Dokumente",
      "state": "Nordrhein-Westfalen",
      "amtsgericht": "Amtsgericht Bonn",
      "registernummer": "HRB 12232",
      "registerart": "HRB",
      "company_name": "Prinz von Preußen Grundbesitz AG",
      "company_seat": "Bonn",
      "details": "14.05.2025 (Bekanntmachungsdatum)\n\nNordrhein-Westfalen Amtsgericht Bonn HRB 12232\nEinreichung neuer Dokumente\n\nPrinz von Preußen Grundbesitz AG\nAktiengesellschaft\nBonn\n\nDem Registergericht ist eine neue Liste der Mitglieder des Aufsichtsrates eingereicht worden."
    },
    {
      "date": "2025-05-14",
      "id": "109067",
      "original_text": "Einreichung neuer Dokumente\nNordrhein-Westfalen Amtsgericht Dortmund HRB 29381\nVOLKSWOHL-BUND LEBENSVERSICHERUNG a.G. – Dortmund",
      "type": "Einreichung neuer Dokumente",
      "state": "Nordrhein-Westfalen",
      "amtsgericht": "Amtsgericht Dortmund",
      "registernummer": "HRB 29381",
      "registerart": "HRB",
      "company_name": "VOLKSWOHL-BUND LEBENSVERSICHERUNG a.G.",
      "company_seat": "Dortmund",
      "details": "14.05.2025 (Bekanntmachungsdatum)\n\nNordrhein-Westfalen Amtsgericht Dortmund HRB 29381\nEinreichung neuer Dokumente\n\nVOLKSWOHL-BUND LEBENSVERSICHERUNG a.G.\nVersicherungsverein auf Gegenseitigkeit\nDortmund\n\nDem Registergericht ist eine Liste der Mitglieder des Aufsichtsrates eingereicht worden."
    },
    {
      "date": "2025-05-14",
      "id": "109068",
      "original_text": "Löschungsankündigung\nNordrhein-Westfalen Amtsgericht Aachen HRA 4405\nVerbraucherorientiertes Versicherungs- & Finanzmaklerbüro Inhaber Manfred Grimmer e.K. – Aachen",
      "type": "Löschungsankündigung",
      "state": "Nordrhein-Westfalen",
      "amtsgericht": "Amtsgericht Aachen",
      "registernummer": "HRA 4405",
      "registerart": "HRA",
      "company_name": "Verbraucherorientiertes Versicherungs- & Finanzmaklerbüro Inhaber Manfred Grimmer e.K.",
      "company_seat": "Aachen",
      "details": "14.05.2025 (Bekanntmachungsdatum)\n\nNordrhein-Westfalen Amtsgericht Aachen HRA 4405\nLöschungsankündigung\n\nVerbraucherorientiertes Versicherungs- & Finanzmaklerbüro Inhaber Manfred Grimmer e.K.\nEinzelkaufmann / Einzelkauffrau\nAachen\n\nDas Registergericht beabsichtigt, die im Handelsregister eingetragene Firma von Amts wegen nach §§ 31 Abs. 2 HGB, 393 FamFG zu löschen.\n\nZur Geltendmachung des Widerspruchs gegen die beabsichtigte Löschung wird hiermit eine Frist von einem Monat ab Veröffentlichung dieser Ankündigung bestimmt.\n\nRechtsbehelfsbelehrung:\n\nGegen diese Verfügung kann Widerspruch eingelegt werden.\n\nDer Widerspruch ist bei dem Amtsgericht Aachen, Adalbertsteinweg 92, 52070 Aachen schriftlich in deutscher Sprache oder zur Niederschrift der Geschäftsstelle einzulegen. Der Widerspruch kann auch zur Niederschrift der Geschäftsstelle eines jeden Amtsgerichtes abgegeben werden.\n\nDer Widerspruch muss spätestens innerhalb der gesetzten Frist nach der Bekanntgabe der Verfügung bei dem Amtsgericht Aachen eingegangen sein. Dies gilt auch dann, wenn der Widerspruch zur Niederschrift der Geschäftsstelle eines anderen Amtsgerichtes abgegeben wurde. Die Frist beginnt mit der Bekanntgabe der Verfügung durch Veröffentlichung. Fällt das Ende der Frist auf einen Sonntag, einen allgemeinen Feiertag oder Sonnabend, so endet die Frist mit Ablauf des nächsten Werktages.\n\nDer Widerspruch muss die Bezeichnung der angefochtenen Verfügung sowie die Erklärung enthalten, dass Widerspruch gegen diese Verfügung eingelegt wird. Er ist zu unterzeichnen und soll begründet werden.\n\nDie Einlegung ist auch durch Übertragung eines elektronischen Dokuments an die elektronische Poststelle des Gerichts möglich. Das elektronische Dokument muss für die Bearbeitung durch das Gericht geeignet und mit einer qualifizierten elektronischen Signatur der verantwortenden Person versehen sein oder von der verantwortenden Person signiert und auf einem sicheren Übermittlungsweg gemäß § 130 a ZPO nach näherer Maßgabe der Verordnung über die technischen Rahmenbedingungen des elektronischen Rechtsverkehrs und über das besondere elektronische Behördenpostfach (BGBl. I, S. 3803) eingereicht werden. Weitere Informationen erhalten Sie auf der Internetseite www.justiz.de."
    },
    {
      "date": "2025-05-14",
      "id": "109069",
      "original_text": "Registerbekanntmachung nach dem Umwandlungsgesetz\nNordrhein-Westfalen Amtsgericht Düsseldorf HRB 68\nRheinische Post Verlagsgesellschaft mbH – Düsseldorf",
      "type": "Registerbekanntmachung nach dem Umwandlungsgesetz",
      "state": "Nordrhein-Westfalen",
      "amtsgericht": "Amtsgericht Düsseldorf",
      "registernummer": "HRB 68",
      "registerart": "HRB",
      "company_name": "Rheinische Post Verlagsgesellschaft mbH",
      "company_seat": "Düsseldorf",
      "details": "14.05.2025 (Bekanntmachungsdatum)\n\nNordrhein-Westfalen Amtsgericht Düsseldorf HRB 68\nRegisterbekanntmachung nach dem Umwandlungsgesetz 14.05.2025 (Eintragungsdatum)\n\nRheinische Post Verlagsgesellschaft mbH\nGesellschaft mit beschränkter Haftung\nDüsseldorf\n\nDen Gläubigern der an der Verschmelzung beteiligten Rechtsträger ist, wenn sie binnen sechs Monaten nach dem Tag, an dem die Eintragung der Verschmelzung in das Register des Sitzes desjenigen Rechtsträgers, dessen Gläubiger sie sind, nach § 19 Absatz 3 UmwG als bekanntgemacht gilt, ihren Anspruch nach Grund und Höhe schriftlich anmelden, Sicherheit zu leisten, soweit sie nicht Befriedigung verlangen können. Dieses Recht steht den Gläubigern jedoch nur zu, wenn sie glaubhaft machen, dass durch die Verschmelzung die Erfüllung ihrer Forderung gefährdet wird."
    },
    {
      "date": "2025-05-14",
      "id": "109070",
      "original_text": "Registerbekanntmachung nach dem Umwandlungsgesetz\nNordrhein-Westfalen Amtsgericht Bad Oeynhausen HRB 1273\nd und d digital data medien GmbH – Bad Oeynhausen",
      "type": "Registerbekanntmachung nach dem Umwandlungsgesetz",
      "state": "Nordrhein-Westfalen",
      "amtsgericht": "Amtsgericht Bad Oeynhausen",
      "registernummer": "HRB 1273",
      "registerart": "HRB",
      "company_name": "d und d digital data medien GmbH",
      "company_seat": "Bad Oeynhausen",
      "details": "14.05.2025 (Bekanntmachungsdatum)\n\nNordrhein-Westfalen Amtsgericht Bad Oeynhausen HRB 1273\nRegisterbekanntmachung nach dem Umwandlungsgesetz 14.05.2025 (Eintragungsdatum)\n\nd und d digital data medien GmbH\nGesellschaft mit beschränkter Haftung\nBad Oeynhausen\n\nDen Gläubigern der an der Verschmelzung beteiligten Rechtsträger ist, wenn sie binnen sechs Monaten nach dem Tag, an dem die Eintragung der Verschmelzung in das Register des Sitzes desjenigen Rechtsträgers, dessen Gläubiger sie sind, nach § 19 Absatz 3 UmwG als bekanntgemacht gilt, ihren Anspruch nach Grund und Höhe schriftlich anmelden, Sicherheit zu leisten, soweit sie nicht Befriedigung verlangen können. Dieses Recht steht den Gläubigern jedoch nur zu, wenn sie glaubhaft machen, dass durch die Verschmelzung die Erfüllung ihrer Forderung gefährdet wird."
    },
    {
      "date": "2025-05-14",
      "id": "109071",
      "original_text": "Registerbekanntmachung nach dem Umwandlungsgesetz\nNordrhein-Westfalen Amtsgericht Hagen HRB 7049\nSchmelzer GmbH Warmpresswerk – Hagen",
      "type": "Registerbekanntmachung nach dem Umwandlungsgesetz",
      "state": "Nordrhein-Westfalen",
      "amtsgericht": "Amtsgericht Hagen",
      "registernummer": "HRB 7049",
      "registerart": "HRB",
      "company_name": "Schmelzer GmbH Warmpresswerk",
      "company_seat": "Hagen",
      "details": "14.05.2025 (Bekanntmachungsdatum)\n\nNordrhein-Westfalen Amtsgericht Hagen HRB 7049\nRegisterbekanntmachung nach dem Umwandlungsgesetz 14.05.2025 (Eintragungsdatum)\n\nSchmelzer GmbH Warmpresswerk\nGesellschaft mit beschränkter Haftung\nHagen\n\nDen Gläubigern der an der Verschmelzung beteiligten Rechtsträger ist, wenn sie binnen sechs Monaten nach dem Tag, an dem die Eintragung der Verschmelzung in das Register des Sitzes desjenigen Rechtsträgers, dessen Gläubiger sie sind, nach § 19 Absatz 3 UmwG als bekanntgemacht gilt, ihren Anspruch nach Grund und Höhe schriftlich anmelden, Sicherheit zu leisten, soweit sie nicht Befriedigung verlangen können. Dieses Recht steht den Gläubigern jedoch nur zu, wenn sie glaubhaft machen, dass durch die Verschmelzung die Erfüllung ihrer Forderung gefährdet wird."
    },
    {
      "date": "2025-05-14",
      "id": "109072",
      "original_text": "Registerbekanntmachung nach dem Umwandlungsgesetz\nNordrhein-Westfalen Amtsgericht Duisburg HRB 15099\nALDI AHEAD GmbH – Mülheim an der Ruhr",
      "type": "Registerbekanntmachung nach dem Umwandlungsgesetz",
      "state": "Nordrhein-Westfalen",
      "amtsgericht": "Amtsgericht Duisburg",
      "registernummer": "HRB 15099",
      "registerart": "HRB",
      "company_name": "ALDI AHEAD GmbH",
      "company_seat": "Mülheim an der Ruhr",
      "details": "14.05.2025 (Bekanntmachungsdatum)\n\nNordrhein-Westfalen Amtsgericht Duisburg HRB 15099\nRegisterbekanntmachung nach dem Umwandlungsgesetz 14.05.2025 (Eintragungsdatum)\n\nALDI AHEAD GmbH\nGesellschaft mit beschränkter Haftung\nMülheim an der Ruhr\n\nDie Gesellschaft hat Gläubigern, deren Forderungen vor dieser Bekanntmachung begründet worden sind, Sicherheit zu leisten, soweit sie nicht Befriedigung verlangen können, wenn sie sich binnen sechs Monaten zu diesem Zweck melden."
    },
    {
      "date": "2025-05-14",
      "id": "109073",
      "original_text": "Löschungsankündigung\nNordrhein-Westfalen Amtsgericht Wuppertal HRA 23350\nKremer GmbH & Co. KG – Wuppertal",
      "type": "Löschungsankündigung",
      "state": "Nordrhein-Westfalen",
      "amtsgericht": "Amtsgericht Wuppertal",
      "registernummer": "HRA 23350",
      "registerart": "HRA",
      "company_name": "Kremer GmbH & Co. KG",
      "company_seat": "Wuppertal",
      "details": "14.05.2025 (Bekanntmachungsdatum)\n\nNordrhein-Westfalen Amtsgericht Wuppertal HRA 23350\nLöschungsankündigung\n\nKremer GmbH & Co. KG\nKommanditgesellschaft\nWuppertal\n\nDas Registergericht beabsichtigt die Firma von Amts wegen nach § 394 FamFG zu löschen. Die Frist zur Erhebung eines Widerspruchs ist auf zwei Monate festgesetzt."
    },
    {
      "date": "2025-05-14",
      "id": "109074",
      "original_text": "Einreichung neuer Dokumente\nNordrhein-Westfalen Amtsgericht Bielefeld HRB 41852\nBiofidus AG – Bielefeld",
      "type": "Einreichung neuer Dokumente",
      "state": "Nordrhein-Westfalen",
      "amtsgericht": "Amtsgericht Bielefeld",
      "registernummer": "HRB 41852",
      "registerart": "HRB",
      "company_name": "Biofidus AG",
      "company_seat": "Bielefeld",
      "details": "14.05.2025 (Bekanntmachungsdatum)\n\nNordrhein-Westfalen Amtsgericht Bielefeld HRB 41852\nEinreichung neuer Dokumente 14.05.2025 (Eintragungsdatum)\n\nBiofidus AG\nAktiengesellschaft\nBielefeld\n\nDem Registergericht ist eine neue Liste der Mitglieder des Aufsichtsrates eingereicht worden."
    },
    {
      "date": "2025-05-14",
      "id": "109075",
      "original_text": "Registerbekanntmachung nach dem Umwandlungsgesetz\nNordrhein-Westfalen Amtsgericht Münster HRB 22031\nGOAS & Söhne GmbH – Münster",
      "type": "Registerbekanntmachung nach dem Umwandlungsgesetz",
      "state": "Nordrhein-Westfalen",
      "amtsgericht": "Amtsgericht Münster",
      "registernummer": "HRB 22031",
      "registerart": "HRB",
      "company_name": "GOAS & Söhne GmbH",
      "company_seat": "Münster",
      "details": "14.05.2025 (Bekanntmachungsdatum)\n\nNordrhein-Westfalen Amtsgericht Münster HRB 22031\nRegisterbekanntmachung nach dem Umwandlungsgesetz 14.05.2025 (Eintragungsdatum)\n\nGOAS & Söhne GmbH\nGesellschaft mit beschränkter Haftung\nMünster\n\nDen Gläubigern der an der Ausgliederung beteiligten Rechtsträger ist, wenn sie binnen sechs Monaten nach dem Tag, an dem die Eintragung der Ausgliederung in das Register des Sitzes desjenigen Rechtsträgers, dessen Gläubiger sie sind, nach § 19 Absatz 3 UmwG als bekanntgemacht gilt, ihren Anspruch nach Grund und Höhe schriftlich anmelden, Sicherheit zu leisten, soweit sie nicht Befriedigung verlangen können. Dieses Recht steht den Gläubigern jedoch nur zu, wenn sie glaubhaft machen, dass durch die Ausgliederung die Erfüllung ihrer Forderung gefährdet wird."
    },
    {
      "date": "2025-05-14",
      "id": "109076",
      "original_text": "Löschungsankündigung\nNordrhein-Westfalen Amtsgericht Recklinghausen HRB 9185\nAlliance for Sustainable Cities and Communities GmbH – Oer-Erkenschwick",
      "type": "Löschungsankündigung",
      "state": "Nordrhein-Westfalen",
      "amtsgericht": "Amtsgericht Recklinghausen",
      "registernummer": "HRB 9185",
      "registerart": "HRB",
      "company_name": "Alliance for Sustainable Cities and Communities GmbH",
      "company_seat": "Oer-Erkenschwick",
      "details": "14.05.2025 (Bekanntmachungsdatum)\n\nNordrhein-Westfalen Amtsgericht Recklinghausen HRB 9185\nLöschungsankündigung\n\nAlliance for Sustainable Cities and Communities GmbH\nGesellschaft mit beschränkter Haftung\nOer-Erkenschwick\n\nDas Registergericht beabsichtigt die Gesellschaft von Amts wegen nach § 394 FamFG zu löschen. Die Frist zur Erhebung eines Widerspruchs ist auf drei Monate festgesetzt."
    },
    {
      "date": "2025-05-14",
      "id": "109077",
      "original_text": "Registerbekanntmachung nach dem Umwandlungsgesetz\nNordrhein-Westfalen Amtsgericht Duisburg HRB 35608\nALDI Data & Analytics Services GmbH – Mülheim an der Ruhr",
      "type": "Registerbekanntmachung nach dem Umwandlungsgesetz",
      "state": "Nordrhein-Westfalen",
      "amtsgericht": "Amtsgericht Duisburg",
      "registernummer": "HRB 35608",
      "registerart": "HRB",
      "company_name": "ALDI Data & Analytics Services GmbH",
      "company_seat": "Mülheim an der Ruhr",
      "details": "14.05.2025 (Bekanntmachungsdatum)\n\nNordrhein-Westfalen Amtsgericht Duisburg HRB 35608\nRegisterbekanntmachung nach dem Umwandlungsgesetz 14.05.2025 (Eintragungsdatum)\n\nALDI Data & Analytics Services GmbH\nGesellschaft mit beschränkter Haftung\nMülheim an der Ruhr\n\nDie Gesellschaft hat Gläubigern, deren Forderungen vor dieser Bekanntmachung begründet worden sind, Sicherheit zu leisten, soweit sie nicht Befriedigung verlangen können, wenn sie sich binnen sechs Monaten zu diesem Zweck melden."
    },
    {
      "date": "2025-05-14",
      "id": "109078",
      "original_text": "Löschungsankündigung\nNordrhein-Westfalen Amtsgericht Bonn HRA 9502\nHBS e.i.n.s. GmbH & Co. KG – Bonn",
      "type": "Löschungsankündigung",
      "state": "Nordrhein-Westfalen",
      "amtsgericht": "Amtsgericht Bonn",
      "registernummer": "HRA 9502",
      "registerart": "HRA",
      "company_name": "HBS e.i.n.s. GmbH & Co. KG",
      "company_seat": "Bonn",
      "details": "14.05.2025 (Bekanntmachungsdatum)\n\nNordrhein-Westfalen Amtsgericht Bonn HRA 9502\nLöschungsankündigung\n\nHBS e.i.n.s. GmbH & Co. KG\nKommanditgesellschaft\nBonn\n\nDas Registergericht beabsichtigt die Firma von Amts wegen nach § 394 FamFG zu löschen. Die Frist zur Erhebung eines Widerspruchs ist auf einen Monat festgesetzt."
    },
    {
      "date": "2025-05-14",
      "id": "109079",
      "original_text": "Registerbekanntmachung nach dem Umwandlungsgesetz\nNordrhein-Westfalen Amtsgericht Köln HRB 123242\nHausmann Elektrotechnik GmbH – Hückeswagen",
      "type": "Registerbekanntmachung nach dem Umwandlungsgesetz",
      "state": "Nordrhein-Westfalen",
      "amtsgericht": "Amtsgericht Köln",
      "registernummer": "HRB 123242",
      "registerart": "HRB",
      "company_name": "Hausmann Elektrotechnik GmbH",
      "company_seat": "Hückeswagen",
      "details": "14.05.2025 (Bekanntmachungsdatum)\n\nNordrhein-Westfalen Amtsgericht Köln HRB 123242\nRegisterbekanntmachung nach dem Umwandlungsgesetz 14.05.2025 (Eintragungsdatum)\n\nHausmann Elektrotechnik GmbH\nGesellschaft mit beschränkter Haftung\nHückeswagen\n\nDen Gläubigern der an der Ausgliederung beteiligten Rechtsträger ist, wenn sie binnen sechs Monaten nach dem Tag, an dem die Eintragung der Ausgliederung in das Register des Sitzes desjenigen Rechtsträgers, dessen Gläubiger sie sind, nach § 19 Absatz 3 UmwG als bekanntgemacht gilt, ihren Anspruch nach Grund und Höhe schriftlich anmelden, Sicherheit zu leisten, soweit sie nicht Befriedigung verlangen können. Dieses Recht steht den Gläubigern jedoch nur zu, wenn sie glaubhaft machen, dass durch die Ausgliederung die Erfüllung ihrer Forderung gefährdet wird."
    },
    {
      "date": "2025-05-14",
      "id": "109080",
      "original_text": "Registerbekanntmachung nach dem Umwandlungsgesetz\nNordrhein-Westfalen Amtsgericht Duisburg HRA 8577\nALDI International Services SE & Co. oHG – Mülheim an der Ruhr",
      "type": "Registerbekanntmachung nach dem Umwandlungsgesetz",
      "state": "Nordrhein-Westfalen",
      "amtsgericht": "Amtsgericht Duisburg",
      "registernummer": "HRA 8577",
      "registerart": "HRA",
      "company_name": "ALDI International Services SE & Co. oHG",
      "company_seat": "Mülheim an der Ruhr",
      "details": "14.05.2025 (Bekanntmachungsdatum)\n\nNordrhein-Westfalen Amtsgericht Duisburg HRA 8577\nRegisterbekanntmachung nach dem Umwandlungsgesetz 14.05.2025 (Eintragungsdatum)\n\nALDI International Services SE & Co. oHG\nOffene Handelsgesellschaft\nMülheim an der Ruhr\n\nDas Registergericht beabsichtigt die Firma von Amts wegen nach § 394 FamFG zu löschen. Die Frist zur Erhebung eines Widerspruchs ist auf #DV.Fr(Text=\"Bitte wählen Sie die Widerspruchsfrist aus!\",Eingabe=\"einen Monat\",\"zwei Monate\",\"drei Monate\",\"#insert(Text=\"Freitext\")\"|\"freier Text\") festgesetzt.Die Gesellschaft hat Gläubigern, deren Forderungen vor dieser Bekanntmachung begründet worden sind, Sicherheit zu leisten, soweit sie nicht Befriedigung verlangen können, wenn sie sich binnen sechs Monaten zu diesem Zweck melden."
    },
    {
      "date": "2025-05-14",
      "id": "109081",
      "original_text": "Registerbekanntmachung nach dem Umwandlungsgesetz\nNordrhein-Westfalen Amtsgericht Düsseldorf HRB 1944\nRB Presse-Data GmbH – Düsseldorf",
      "type": "Registerbekanntmachung nach dem Umwandlungsgesetz",
      "state": "Nordrhein-Westfalen",
      "amtsgericht": "Amtsgericht Düsseldorf",
      "registernummer": "HRB 1944",
      "registerart": "HRB",
      "company_name": "RB Presse-Data GmbH",
      "company_seat": "Düsseldorf",
      "details": "14.05.2025 (Bekanntmachungsdatum)\n\nNordrhein-Westfalen Amtsgericht Düsseldorf HRB 1944\nRegisterbekanntmachung nach dem Umwandlungsgesetz 14.05.2025 (Eintragungsdatum)\n\nRB Presse-Data GmbH\nGesellschaft mit beschränkter Haftung\nDüsseldorf\n\nDen Gläubigern der an der Verschmelzung beteiligten Rechtsträger ist, wenn sie binnen sechs Monaten nach dem Tag, an dem die Eintragung der Verschmelzung in das Register des Sitzes desjenigen Rechtsträgers, dessen Gläubiger sie sind, nach § 19 Absatz 3 UmwG als bekanntgemacht gilt, ihren Anspruch nach Grund und Höhe schriftlich anmelden, Sicherheit zu leisten, soweit sie nicht Befriedigung verlangen können. Dieses Recht steht den Gläubigern jedoch nur zu, wenn sie glaubhaft machen, dass durch die Verschmelzung die Erfüllung ihrer Forderung gefährdet wird."
    },
    {
      "date": "2025-05-14",
      "id": "109082",
      "original_text": "Einreichung neuer Dokumente\nNordrhein-Westfalen Amtsgericht Bochum HRB 127\nVBW Bauen und Wohnen GmbH – Bochum",
      "type": "Einreichung neuer Dokumente",
      "state": "Nordrhein-Westfalen",
      "amtsgericht": "Amtsgericht Bochum",
      "registernummer": "HRB 127",
      "registerart": "HRB",
      "company_name": "VBW Bauen und Wohnen GmbH",
      "company_seat": "Bochum",
      "details": "14.05.2025 (Bekanntmachungsdatum)\n\nNordrhein-Westfalen Amtsgericht Bochum HRB 127\nEinreichung neuer Dokumente 14.05.2025 (Eintragungsdatum)\n\nVBW Bauen und Wohnen GmbH\nGesellschaft mit beschränkter Haftung\nBochum\n\nDem Registergericht ist eine neue Liste der Mitglieder des Aufsichtsrates eingereicht worden."
    },
    {
      "date": "2025-05-14",
      "id": "109083",
      "original_text": "Registerbekanntmachung nach dem Umwandlungsgesetz\nNordrhein-Westfalen Amtsgericht Münster HRA 11940\nEduard Goas e.K. – Münster",
      "type": "Registerbekanntmachung nach dem Umwandlungsgesetz",
      "state": "Nordrhein-Westfalen",
      "amtsgericht": "Amtsgericht Münster",
      "registernummer": "HRA 11940",
      "registerart": "HRA",
      "company_name": "Eduard Goas e.K.",
      "company_seat": "Münster",
      "details": "14.05.2025 (Bekanntmachungsdatum)\n\nNordrhein-Westfalen Amtsgericht Münster HRA 11940\nRegisterbekanntmachung nach dem Umwandlungsgesetz 14.05.2025 (Eintragungsdatum)\n\nEduard Goas e.K.\nEinzelkaufmann / Einzelkauffrau\nMünster\n\nDen Gläubigern der an der Ausgliederung beteiligten Rechtsträger ist, wenn sie binnen sechs Monaten nach dem Tag, an dem die Eintragung der Ausgliederung in das Register des Sitzes desjenigen Rechtsträgers, dessen Gläubiger sie sind, nach § 19 Absatz 3 UmwG als bekanntgemacht gilt, ihren Anspruch nach Grund und Höhe schriftlich anmelden, Sicherheit zu leisten, soweit sie nicht Befriedigung verlangen können. Dieses Recht steht den Gläubigern jedoch nur zu, wenn sie glaubhaft machen, dass durch die Ausgliederung die Erfüllung ihrer Forderung gefährdet wird."
    },
    {
      "date": "2025-05-14",
      "id": "109084",
      "original_text": "Einreichung neuer Dokumente\nHessen Amtsgericht Frankfurt am Main HRB 25668\nDWS Grundbesitz GmbH – Frankfurt am Main",
      "type": "Einreichung neuer Dokumente",
      "state": "Hessen",
      "amtsgericht": "Amtsgericht Frankfurt am Main",
      "registernummer": "HRB 25668",
      "registerart": "HRB",
      "company_name": "DWS Grundbesitz GmbH",
      "company_seat": "Frankfurt am Main",
      "details": "14.05.2025 (Bekanntmachungsdatum)\n\nHessen Amtsgericht Frankfurt am Main HRB 25668\nEinreichung neuer Dokumente\n\nDWS Grundbesitz GmbH\nGesellschaft mit beschränkter Haftung\nFrankfurt am Main\n\nDurch eine Änderung in den Personen der Aufsichtsratsmitglieder ist eine Liste der Mitglieder des Aufsichtsrates zum Handelsregister eingereicht worden."
    },
    {
      "date": "2025-05-14",
      "id": "109085",
      "original_text": "Löschungsankündigung\nHessen Amtsgericht Friedberg HRB 9477\nAdvire UG (haftungsbeschränkt) – Niddatal",
      "type": "Löschungsankündigung",
      "state": "Hessen",
      "amtsgericht": "Amtsgericht Friedberg",
      "registernummer": "HRB 9477",
      "registerart": "HRB",
      "company_name": "Advire UG (haftungsbeschränkt)",
      "company_seat": "Niddatal",
      "details": "14.05.2025 (Bekanntmachungsdatum)\n\nHessen Amtsgericht Friedberg HRB 9477\nLöschungsankündigung\n\nAdvire UG (haftungsbeschränkt)\nGesellschaft mit beschränkter Haftung\nNiddatal\n\nDas Registergericht beabsichtigt die im Handelsregister eingetragene Gesellschaft von Amts wegen nach § 394 FamFG zu löschen. Die Frist zur Erhebung eines Widerspruchs gegen die beabsichtigte Löschung wird auf 3 Monate festgesetzt."
    },
    {
      "date": "2025-05-14",
      "id": "109086",
      "original_text": "Registerbekanntmachung nach dem Umwandlungsgesetz\nHessen Amtsgericht Darmstadt HRB 107842\nAPB Ambulantes Pflegeteam Bensheim GmbH – Bensheim",
      "type": "Registerbekanntmachung nach dem Umwandlungsgesetz",
      "state": "Hessen",
      "amtsgericht": "Amtsgericht Darmstadt",
      "registernummer": "HRB 107842",
      "registerart": "HRB",
      "company_name": "APB Ambulantes Pflegeteam Bensheim GmbH",
      "company_seat": "Bensheim",
      "details": "14.05.2025 (Bekanntmachungsdatum)\n\nHessen Amtsgericht Darmstadt HRB 107842\nRegisterbekanntmachung nach dem Umwandlungsgesetz 14.05.2025 (Eintragungsdatum)\n\nAPB Ambulantes Pflegeteam Bensheim GmbH\nGesellschaft mit beschränkter Haftung\nBensheim\n\nDen Gläubigern der an der Ausgliederung beteiligten Rechtsträger ist, wenn sie binnen sechs Monaten nach dem Tag, an dem die Eintragung der Ausgliederung in das Register des Sitzes desjenigen Rechtsträgers, dessen Gläubiger sie sind, nach §§ 125, 19 Absatz 3 UmwG bekannt gemacht worden ist, ihren Anspruch nach Grund und Höhe schriftlich anmelden, Sicherheit zu leisten, soweit sie nicht Befriedigung verlangen können. Dieses Recht steht den Gläubigern jedoch nur zu, wenn sie glaubhaft machen, dass durch die Ausgliederung die Erfüllung ihrer Forderung gefährdet wird."
    },
    {
      "date": "2025-05-14",
      "id": "109087",
      "original_text": "Löschungsankündigung\nHessen Amtsgericht Wiesbaden HRB 31621\nfirewall & IT LR Beteiligungs GmbH – Idstein",
      "type": "Löschungsankündigung",
      "state": "Hessen",
      "amtsgericht": "Amtsgericht Wiesbaden",
      "registernummer": "HRB 31621",
      "registerart": "HRB",
      "company_name": "firewall & IT LR Beteiligungs GmbH",
      "company_seat": "Idstein",
      "details": "14.05.2025 (Bekanntmachungsdatum)\n\nHessen Amtsgericht Wiesbaden HRB 31621\nLöschungsankündigung\n\nfirewall & IT LR Beteiligungs GmbH\nGesellschaft mit beschränkter Haftung\nIdstein\n\nDas Registergericht beabsichtigt die im Handelsregister eingetragene Gesellschaft von Amts wegen nach § 394 FamFG zu löschen. Die Frist zur Erhebung eines Widerspruchs gegen die beabsichtigte Löschung wird auf 3 Monate festgesetzt."
    },
    {
      "date": "2025-05-14",
      "id": "109088",
      "original_text": "Löschungsankündigung\nHessen Amtsgericht Wiesbaden HRB 35511\nSchwabenbau GmbH – Flörsheim am Main",
      "type": "Löschungsankündigung",
      "state": "Hessen",
      "amtsgericht": "Amtsgericht Wiesbaden",
      "registernummer": "HRB 35511",
      "registerart": "HRB",
      "company_name": "Schwabenbau GmbH",
      "company_seat": "Flörsheim am Main",
      "details": "14.05.2025 (Bekanntmachungsdatum)\n\nHessen Amtsgericht Wiesbaden HRB 35511\nLöschungsankündigung\n\nSchwabenbau GmbH\nGesellschaft mit beschränkter Haftung\nFlörsheim am Main\n\nDas Registergericht beabsichtigt die im Handelsregister eingetragene Gesellschaft von Amts wegen nach § 394 FamFG zu löschen. Die Frist zur Erhebung eines Widerspruchs gegen die beabsichtigte Löschung wird auf 3 Monate festgesetzt."
    },
    {
      "date": "2025-05-14",
      "id": "109089",
      "original_text": "Registerbekanntmachung nach dem Umwandlungsgesetz\nHessen Amtsgericht Darmstadt HRB 102400\nDietz FNL Investment GmbH – Bensheim",
      "type": "Registerbekanntmachung nach dem Umwandlungsgesetz",
      "state": "Hessen",
      "amtsgericht": "Amtsgericht Darmstadt",
      "registernummer": "HRB 102400",
      "registerart": "HRB",
      "company_name": "Dietz FNL Investment GmbH",
      "company_seat": "Bensheim",
      "details": "14.05.2025 (Bekanntmachungsdatum)\n\nHessen Amtsgericht Darmstadt HRB 102400\nRegisterbekanntmachung nach dem Umwandlungsgesetz 14.05.2025 (Eintragungsdatum)\n\nDietz FNL Investment GmbH\nGesellschaft mit beschränkter Haftung\nBensheim\n\nDen Gläubigern der an der Verschmelzung beteiligten Rechtsträger ist, wenn sie binnen sechs Monaten nach dem Tag, an dem die Eintragung der Verschmelzung in das Register des Sitzes derjenigen Rechtsträger deren Gläubiger sie sind, nach § 19 Absatz 3 UmwG bekannt gemacht worden ist, ihren Anspruch nach Grund und Höhe schriftlich anmelden, Sicherheit zu leisten, soweit sie nicht Befriedigung verlangen können. Dieses Recht steht den Gläubigern jedoch nur zu, wenn sie glaubhaft machen, dass durch die Verschmelzung die Erfüllung ihrer Forderung gefährdet wird."
    },
    {
      "date": "2025-05-14",
      "id": "109090",
      "original_text": "Registerbekanntmachung nach dem Umwandlungsgesetz\nHessen Amtsgericht Frankfurt am Main HRB 20424\nUFER Optik + Akustik GmbH – Hofheim am Main",
      "type": "Registerbekanntmachung nach dem Umwandlungsgesetz",
      "state": "Hessen",
      "amtsgericht": "Amtsgericht Frankfurt am Main",
      "registernummer": "HRB 20424",
      "registerart": "HRB",
      "company_name": "UFER Optik + Akustik GmbH",
      "company_seat": "Hofheim am Main",
      "details": "14.05.2025 (Bekanntmachungsdatum)\n\nHessen Amtsgericht Frankfurt am Main HRB 20424\nRegisterbekanntmachung nach dem Umwandlungsgesetz 14.05.2025 (Eintragungsdatum)\n\nUFER Optik + Akustik GmbH\nGesellschaft mit beschränkter Haftung\nHofheim am Main\n\nDen Gläubigern der an der Verschmelzung beteiligten Rechtsträger ist, wenn sie binnen sechs Monaten nach dem Tag, an dem die Eintragung der Verschmelzung in das Register des Sitzes derjenigen Rechtsträger deren Gläubiger sie sind, nach § 19 Absatz 3 UmwG bekannt gemacht worden ist, ihren Anspruch nach Grund und Höhe schriftlich anmelden, Sicherheit zu leisten, soweit sie nicht Befriedigung verlangen können. Dieses Recht steht den Gläubigern jedoch nur zu, wenn sie glaubhaft machen, dass durch die Verschmelzung die Erfüllung ihrer Forderung gefährdet wird."
    },
    {
      "date": "2025-05-14",
      "id": "109091",
      "original_text": "Registerbekanntmachung nach dem Umwandlungsgesetz\nHessen Amtsgericht Darmstadt HRA 87696\nAPB Ambulantes Pflegeteam Bensheim e.K. – Bensheim",
      "type": "Registerbekanntmachung nach dem Umwandlungsgesetz",
      "state": "Hessen",
      "amtsgericht": "Amtsgericht Darmstadt",
      "registernummer": "HRA 87696",
      "registerart": "HRA",
      "company_name": "APB Ambulantes Pflegeteam Bensheim e.K.",
      "company_seat": "Bensheim",
      "details": "14.05.2025 (Bekanntmachungsdatum)\n\nHessen Amtsgericht Darmstadt HRA 87696\nRegisterbekanntmachung nach dem Umwandlungsgesetz 14.05.2025 (Eintragungsdatum)\n\nAPB Ambulantes Pflegeteam Bensheim e.K.\nEinzelkaufmann / Einzelkauffrau\nBensheim\n\nDen Gläubigern der an der Ausgliederung beteiligten Rechtsträger ist, wenn sie binnen sechs Monaten nach dem Tag, an dem die Eintragung der Ausgliederung in das Register des Sitzes desjenigen Rechtsträgers, dessen Gläubiger sie sind, nach §§ 125, 19 Absatz 3 UmwG bekannt gemacht worden ist, ihren Anspruch nach Grund und Höhe schriftlich anmelden, Sicherheit zu leisten, soweit sie nicht Befriedigung verlangen können. Dieses Recht steht den Gläubigern jedoch nur zu, wenn sie glaubhaft machen, dass durch die Ausgliederung die Erfüllung ihrer Forderung gefährdet wird."
    },
    {
      "date": "2025-05-14",
      "id": "109092",
      "original_text": "Sonstige Registerbekanntmachung\nHessen Amtsgericht Frankfurt am Main HRB 81781\nRoadtrack AG Events & Roadshows & LocationCinema – Frankfurt am Main",
      "type": "Sonstige Registerbekanntmachung",
      "state": "Hessen",
      "amtsgericht": "Amtsgericht Frankfurt am Main",
      "registernummer": "HRB 81781",
      "registerart": "HRB",
      "company_name": "Roadtrack AG Events & Roadshows & LocationCinema",
      "company_seat": "Frankfurt am Main",
      "details": "14.05.2025 (Bekanntmachungsdatum)\n\nHessen Amtsgericht Frankfurt am Main HRB 81781\nSonstige Registerbekanntmachung 14.05.2025 (Eintragungsdatum)\n\nRoadtrack AG Events & Roadshows & LocationCinema\nAktiengesellschaft\nFrankfurt am Main\n\nDurch eine Änderung in den Personen der Aufsichtsratsmitglieder ist eine Liste der Mitglieder des Aufsichtsrates zum Handelsregister eingereicht worden."
    },
    {
      "date": "2025-05-14",
      "id": "109093",
      "original_text": "Registerbekanntmachung nach dem Umwandlungsgesetz\nHessen Amtsgericht Darmstadt HRB 100827\nDietz 24. Grundbesitz GmbH – Bensheim",
      "type": "Registerbekanntmachung nach dem Umwandlungsgesetz",
      "state": "Hessen",
      "amtsgericht": "Amtsgericht Darmstadt",
      "registernummer": "HRB 100827",
      "registerart": "HRB",
      "company_name": "Dietz 24. Grundbesitz GmbH",
      "company_seat": "Bensheim",
      "details": "14.05.2025 (Bekanntmachungsdatum)\n\nHessen Amtsgericht Darmstadt HRB 100827\nRegisterbekanntmachung nach dem Umwandlungsgesetz 14.05.2025 (Eintragungsdatum)\n\nDietz 24. Grundbesitz GmbH\nGesellschaft mit beschränkter Haftung\nBensheim\n\nDen Gläubigern der an der Verschmelzung beteiligten Rechtsträger ist, wenn sie binnen sechs Monaten nach dem Tag, an dem die Eintragung der Verschmelzung in das Register des Sitzes derjenigen Rechtsträger deren Gläubiger sie sind, nach § 19 Absatz 3 UmwG bekannt gemacht worden ist, ihren Anspruch nach Grund und Höhe schriftlich anmelden, Sicherheit zu leisten, soweit sie nicht Befriedigung verlangen können. Dieses Recht steht den Gläubigern jedoch nur zu, wenn sie glaubhaft machen, dass durch die Verschmelzung die Erfüllung ihrer Forderung gefährdet wird."
    },
    {
      "date": "2025-05-14",
      "id": "109094",
      "original_text": "Löschungsankündigung\nHessen Amtsgericht Offenbach am Main HRB 52454\nMVK-CLK GmbH – Offenbach am Main",
      "type": "Löschungsankündigung",
      "state": "Hessen",
      "amtsgericht": "Amtsgericht Offenbach am Main",
      "registernummer": "HRB 52454",
      "registerart": "HRB",
      "company_name": "MVK-CLK GmbH",
      "company_seat": "Offenbach am Main",
      "details": "14.05.2025 (Bekanntmachungsdatum)\n\nHessen Amtsgericht Offenbach am Main HRB 52454\nLöschungsankündigung\n\nMVK-CLK GmbH\nGesellschaft mit beschränkter Haftung\nOffenbach am Main\n\nDas Registergericht beabsichtigt, die im Handelsregister eingetragene Gesellschaft von Amts wegen nach § 394 FamFG zu löschen. Die Frist zur Erhebung eines Widerspruchs gegen die beabsichtigte Löschung wird auf 3 Monate festgesetzt."
    },
    {
      "date": "2025-05-14",
      "id": "109095",
      "original_text": "Löschungsankündigung\nHessen Amtsgericht Offenbach am Main HRB 49154\nEltete Deutschland GmbH – Rodgau",
      "type": "Löschungsankündigung",
      "state": "Hessen",
      "amtsgericht": "Amtsgericht Offenbach am Main",
      "registernummer": "HRB 49154",
      "registerart": "HRB",
      "company_name": "Eltete Deutschland GmbH",
      "company_seat": "Rodgau",
      "details": "14.05.2025 (Bekanntmachungsdatum)\n\nHessen Amtsgericht Offenbach am Main HRB 49154\nLöschungsankündigung\n\nEltete Deutschland GmbH\nGesellschaft mit beschränkter Haftung\nRodgau\n\nDas Registergericht beabsichtigt, die im Handelsregister eingetragene Gesellschaft von Amts wegen nach § 394 FamFG zu löschen. Die Frist zur Erhebung eines Widerspruchs gegen die beabsichtigte Löschung wird auf 3 Monate festgesetzt."
    },
    {
      "date": "2025-05-14",
      "id": "109096",
      "original_text": "Registerbekanntmachung nach dem Umwandlungsgesetz\nHessen Amtsgericht Frankfurt am Main HRB 101805\nForsthaus Verwaltungs GmbH – Frankfurt am Main",
      "type": "Registerbekanntmachung nach dem Umwandlungsgesetz",
      "state": "Hessen",
      "amtsgericht": "Amtsgericht Frankfurt am Main",
      "registernummer": "HRB 101805",
      "registerart": "HRB",
      "company_name": "Forsthaus Verwaltungs GmbH",
      "company_seat": "Frankfurt am Main",
      "details": "14.05.2025 (Bekanntmachungsdatum)\n\nHessen Amtsgericht Frankfurt am Main HRB 101805\nRegisterbekanntmachung nach dem Umwandlungsgesetz 14.05.2025 (Eintragungsdatum)\n\nForsthaus Verwaltungs GmbH\nGesellschaft mit beschränkter Haftung\nFrankfurt am Main\n\nDen Gläubigern der an der Verschmelzung beteiligten Rechtsträger ist, wenn sie binnen sechs Monaten nach dem Tag, an dem die Eintragung der Verschmelzung in das Register des Sitzes desjenigen Rechtsträgers, dessen Gläubiger sie sind, nach § 19 Absatz 3 UmwG bekannt gemacht worden ist, ihren Anspruch nach Grund und Höhe schriftlich anmelden, Sicherheit zu leisten, soweit sie nicht Befriedigung verlangen können. Dieses Recht steht den Gläubigern jedoch nur zu, wenn sie glaubhaft machen, dass durch die Verschmelzung die Erfüllung ihrer Forderung gefährdet wird."
    },
    {
      "date": "2025-05-14",
      "id": "109097",
      "original_text": "Registerbekanntmachung nach dem Umwandlungsgesetz\nHessen Amtsgericht Frankfurt am Main HRB 135782\nDussmann Kälte- und Klimatechnik GmbH – Frankfurt am Main",
      "type": "Registerbekanntmachung nach dem Umwandlungsgesetz",
      "state": "Hessen",
      "amtsgericht": "Amtsgericht Frankfurt am Main",
      "registernummer": "HRB 135782",
      "registerart": "HRB",
      "company_name": "Dussmann Kälte- und Klimatechnik GmbH",
      "company_seat": "Frankfurt am Main",
      "details": "14.05.2025 (Bekanntmachungsdatum)\n\nHessen Amtsgericht Frankfurt am Main HRB 135782\nRegisterbekanntmachung nach dem Umwandlungsgesetz 14.05.2025 (Eintragungsdatum)\n\nDussmann Kälte- und Klimatechnik GmbH\nGesellschaft mit beschränkter Haftung\nFrankfurt am Main\n\nDen Gläubigern der an der Verschmelzung beteiligten Rechtsträger ist, wenn sie binnen sechs Monaten nach dem Tag, an dem die Eintragung der Verschmelzung in das Register des Sitzes desjenigen Rechtsträgers, dessen Gläubiger sie sind, nach § 19 Absatz 3 UmwG bekannt gemacht worden ist, ihren Anspruch nach Grund und Höhe schriftlich anmelden, Sicherheit zu leisten, soweit sie nicht Befriedigung verlangen können. Dieses Recht steht den Gläubigern jedoch nur zu, wenn sie glaubhaft machen, dass durch die Verschmelzung die Erfüllung ihrer Forderung gefährdet wird."
    },
    {
      "date": "2025-05-14",
      "id": "109098",
      "original_text": "Einreichung neuer Dokumente\nHessen Amtsgericht Kassel HRB 6694\nPREWE Aktiengesellschaft Steuerberatungsgesellschaft – Kassel",
      "type": "Einreichung neuer Dokumente",
      "state": "Hessen",
      "amtsgericht": "Amtsgericht Kassel",
      "registernummer": "HRB 6694",
      "registerart": "HRB",
      "company_name": "PREWE Aktiengesellschaft Steuerberatungsgesellschaft",
      "company_seat": "Kassel",
      "details": "14.05.2025 (Bekanntmachungsdatum)\n\nHessen Amtsgericht Kassel HRB 6694\nEinreichung neuer Dokumente\n\nPREWE Aktiengesellschaft Steuerberatungsgesellschaft\nAktiengesellschaft\nKassel\n\nDurch eine Änderung in den Personen der Aufsichtsratsmitglieder ist eine Liste der Mitglieder des Aufsichtsrates zum Handelsregister eingereicht worden."
    },
    {
      "date": "2025-05-14",
      "id": "109099",
      "original_text": "Löschungsankündigung\nHessen Amtsgericht Frankfurt am Main HRB 117277\nZias-International GmbH – Frankfurt am Main",
      "type": "Löschungsankündigung",
      "state": "Hessen",
      "amtsgericht": "Amtsgericht Frankfurt am Main",
      "registernummer": "HRB 117277",
      "registerart": "HRB",
      "company_name": "Zias-International GmbH",
      "company_seat": "Frankfurt am Main",
      "details": "14.05.2025 (Bekanntmachungsdatum)\n\nHessen Amtsgericht Frankfurt am Main HRB 117277\nLöschungsankündigung 14.05.2025 (Eintragungsdatum)\n\nZias-International GmbH\nGesellschaft mit beschränkter Haftung\nFrankfurt am Main\n\nDas Registergericht beabsichtigt die im Handelsregister eingetragene Gesellschaft von Amts wegen nach § 394 FamFG zu löschen. Die Frist zur Erhebung eines Widerspruchs gegen die beabsichtigte Löschung wird auf 3 Monate festgesetzt."
    },
    {
      "date": "2025-05-14",
      "id": "109100",
      "original_text": "Sonstige Registerbekanntmachung\nHessen Amtsgericht Königstein VR 640\nFreie Wähler-Gemeinschaft Kelkheim im Taunus e.V. FWG – Kelkheim (Taunus)",
      "type": "Sonstige Registerbekanntmachung",
      "state": "Hessen",
      "amtsgericht": "Amtsgericht Königstein",
      "registernummer": "VR 640",
      "registerart": "VR",
      "company_name": "Freie Wähler-Gemeinschaft Kelkheim im Taunus e.V. FWG",
      "company_seat": "Kelkheim (Taunus)",
      "details": "14.05.2025 (Bekanntmachungsdatum)\n\nHessen Amtsgericht Königstein VR 640\nSonstige Registerbekanntmachung 14.05.2025 (Eintragungsdatum)\n\nFreie Wähler-Gemeinschaft Kelkheim im Taunus e.V. FWG\neingetragener Verein\nKelkheim (Taunus)\n\nDer Verein ist aufgelöst."
    },
    {
      "date": "2025-05-14",
      "id": "109101",
      "original_text": "Löschungsankündigung\nHessen Amtsgericht Wiesbaden HRB 31785\nNordLogistikTeam GmbH – Wiesbaden",
      "type": "Löschungsankündigung",
      "state": "Hessen",
      "amtsgericht": "Amtsgericht Wiesbaden",
      "registernummer": "HRB 31785",
      "registerart": "HRB",
      "company_name": "NordLogistikTeam GmbH",
      "company_seat": "Wiesbaden",
      "details": "14.05.2025 (Bekanntmachungsdatum)\n\nHessen Amtsgericht Wiesbaden HRB 31785\nLöschungsankündigung\n\nNordLogistikTeam GmbH\nGesellschaft mit beschränkter Haftung\nWiesbaden\n\nDas Registergericht beabsichtigt die im Handelsregister eingetragene Gesellschaft von Amts wegen nach § 394 FamFG zu löschen. Die Frist zur Erhebung eines Widerspruchs gegen die beabsichtigte Löschung wird auf 3 Monate festgesetzt."
    },
    {
      "date": "2025-05-14",
      "id": "109102",
      "original_text": "Löschungsankündigung\nHessen Amtsgericht Darmstadt HRB 104783\nSesa Dienstleistung GmbH – Brensbach",
      "type": "Löschungsankündigung",
      "state": "Hessen",
      "amtsgericht": "Amtsgericht Darmstadt",
      "registernummer": "HRB 104783",
      "registerart": "HRB",
      "company_name": "Sesa Dienstleistung GmbH",
      "company_seat": "Brensbach",
      "details": "14.05.2025 (Bekanntmachungsdatum)\n\nHessen Amtsgericht Darmstadt HRB 104783\nLöschungsankündigung\n\nSesa Dienstleistung GmbH\nGesellschaft mit beschränkter Haftung\nBrensbach\n\nDas Registergericht beabsichtigt die im Handelsregister eingetragene Gesellschaft von Amts wegen nach § 394 FamFG zu löschen. Die Frist zur Erhebung eines Widerspruchs gegen die beabsichtigte Löschung wird auf 3 Monate festgesetzt."
    }
  ]
}