{
  "date": "2025-05-01",
  "date_of_scrape": "2025-05-31T07:26:44.386Z",
  "tool_version": "0.2.0",
  "number_of_announcements": 24,
  "announcements": [
    {
      "date": "2025-05-01",
      "id": "107862",
      "original_text": "Löschungsankündigung\nBayern Amtsgericht Fürth HRA 6191\nGlaserei David Inh. Reinhard David – Erlangen",
      "type": "Löschungsankündigung",
      "state": "Bayern",
      "amtsgericht": "Amtsgericht Fürth",
      "registernummer": "HRA 6191",
      "registerart": "HRA",
      "company_name": "Glaserei David Inh. Reinhard David",
      "company_seat": "Erlangen",
      "details": "01.05.2025 (Bekanntmachungsdatum)\n\nBayern Amtsgericht Fürth HRA 6191\nLöschungsankündigung 02.04.2025 (Eintragungsdatum)\n\nGlaserei David Inh. Reinhard David\nEinzelkaufmann / Einzelkauffrau\nErlangen\n\nDas Registergericht beabsichtigt, die im Handelsregister des Amtsgerichts Fürth unter  HRA 6191 eingetragene Firma 'Glaserei David Inh. Reinhard David' mit Niederlassung in Erlangen, von Amts wegen nach § 31 Abs. 2 HGB zu löschen. Die Frist zur Erhebung des Widerspruchs ist auf einen Monat festgesetzt."
    },
    {
      "date": "2025-05-01",
      "id": "107863",
      "original_text": "Registerbekanntmachung nach dem Umwandlungsgesetz\nBayern Amtsgericht Memmingen HRA 12236\nmivita e.K. – Kirchhaslach",
      "type": "Registerbekanntmachung nach dem Umwandlungsgesetz",
      "state": "Bayern",
      "amtsgericht": "Amtsgericht Memmingen",
      "registernummer": "HRA 12236",
      "registerart": "HRA",
      "company_name": "mivita e.K.",
      "company_seat": "Kirchhaslach",
      "details": "01.05.2025 (Bekanntmachungsdatum)\n\nBayern Amtsgericht Memmingen HRA 12236\nRegisterbekanntmachung nach dem Umwandlungsgesetz 29.04.2025 (Eintragungsdatum)\n\nmivita e.K.\nEinzelkaufmann / Einzelkauffrau\nKirchhaslach\n\nDen Gläubigern der an der Ausgliederung beteiligten Rechtsträger ist, wenn sie binnen sechs Monaten nach dem Tag, an dem die Eintragung der Ausgliederung in das Register des Sitzes desjenigen Rechtsträgers, dessen Gläubiger sie sind, nach §§ 125, 19 Abs. 3 UmwG als bekannt gemacht gilt, ihren Anspruch nach Grund und Höhe in Textform anmelden, Sicherheit zu leisten, soweit sie nicht Befriedigung verlangen können. Dieses Recht steht den Gläubigern jedoch nur zu, wenn sie glaubhaft machen, dass durch die Ausgliederung die Erfüllung ihrer Forderung gefährdet wird."
    },
    {
      "date": "2025-05-01",
      "id": "107864",
      "original_text": "Einreichung neuer Dokumente\nBayern Amtsgericht Traunstein HRB 23977\nRibaupierre Aktiengesellschaft – Marquartstein",
      "type": "Einreichung neuer Dokumente",
      "state": "Bayern",
      "amtsgericht": "Amtsgericht Traunstein",
      "registernummer": "HRB 23977",
      "registerart": "HRB",
      "company_name": "Ribaupierre Aktiengesellschaft",
      "company_seat": "Marquartstein",
      "details": "01.05.2025 (Bekanntmachungsdatum)\n\nBayern Amtsgericht Traunstein HRB 23977\nEinreichung neuer Dokumente 30.04.2025 (Eintragungsdatum)\n\nRibaupierre Aktiengesellschaft\nAktiengesellschaft\nMarquartstein\n\nDem Amtsgericht Traunstein -Registergericht- ist eine Liste der Mitglieder des Aufsichtsrats eingereicht worden, § 106 AktG."
    },
    {
      "date": "2025-05-01",
      "id": "107865",
      "original_text": "Registerbekanntmachung nach dem Umwandlungsgesetz\nBayern Amtsgericht Nürnberg HRB 23935\nFlowVision GmbH – Altdorf b. Nbg.",
      "type": "Registerbekanntmachung nach dem Umwandlungsgesetz",
      "state": "Bayern",
      "amtsgericht": "Amtsgericht Nürnberg",
      "registernummer": "HRB 23935",
      "registerart": "HRB",
      "company_name": "FlowVision GmbH",
      "company_seat": "Altdorf b. Nbg.",
      "details": "01.05.2025 (Bekanntmachungsdatum)\n\nBayern Amtsgericht Nürnberg HRB 23935\nRegisterbekanntmachung nach dem Umwandlungsgesetz 30.04.2025 (Eintragungsdatum)\n\nFlowVision GmbH\nGesellschaft mit beschränkter Haftung\nAltdorf b. Nbg.\n\nDen Gläubigern der an der Verschmelzung beteiligten Rechtsträger ist, wenn sie binnen sechs Monaten nach dem Tag, an dem die Eintragung der Verschmelzung in das Register des Sitzes desjenigen Rechtsträgers, dessen Gläubiger sie sind, nach § 19 Abs. 3 UmwG als bekannt gemacht gilt, ihren Anspruch nach Grund und Höhe in Textform anmelden, Sicherheit zu leisten, soweit sie nicht Befriedigung verlangen können. Dieses Recht steht den Gläubigern jedoch nur zu, wenn sie glaubhaft machen, dass durch die Verschmelzung die Erfüllung ihrer Forderung gefährdet wird."
    },
    {
      "date": "2025-05-01",
      "id": "107866",
      "original_text": "Registerbekanntmachung nach dem Umwandlungsgesetz\nBayern Amtsgericht Memmingen HRA 14249\nNR Montage e. K. – Mindelheim",
      "type": "Registerbekanntmachung nach dem Umwandlungsgesetz",
      "state": "Bayern",
      "amtsgericht": "Amtsgericht Memmingen",
      "registernummer": "HRA 14249",
      "registerart": "HRA",
      "company_name": "NR Montage e. K.",
      "company_seat": "Mindelheim",
      "details": "01.05.2025 (Bekanntmachungsdatum)\n\nBayern Amtsgericht Memmingen HRA 14249\nRegisterbekanntmachung nach dem Umwandlungsgesetz 30.04.2025 (Eintragungsdatum)\n\nNR Montage e. K.\nEinzelkaufmann / Einzelkauffrau\nMindelheim\n\nDen Gläubigern der an der Ausgliederung beteiligten Rechtsträger ist, wenn sie binnen sechs Monaten nach dem Tag, an dem die Eintragung der Ausgliederung in das Register des Sitzes desjenigen Rechtsträgers, dessen Gläubiger sie sind, nach §§ 125, 19 Abs. 3 UmwG als bekannt gemacht gilt, ihren Anspruch nach Grund und Höhe in Textform anmelden, Sicherheit zu leisten, soweit sie nicht Befriedigung verlangen können. Dieses Recht steht den Gläubigern jedoch nur zu, wenn sie glaubhaft machen, dass durch die Ausgliederung die Erfüllung ihrer Forderung gefährdet wird."
    },
    {
      "date": "2025-05-01",
      "id": "107867",
      "original_text": "Registerbekanntmachung nach dem Umwandlungsgesetz\nBayern Amtsgericht Aschaffenburg HRA 6700\nM.E. Heizkostenabrechnung e.K. – Kleinwallstadt",
      "type": "Registerbekanntmachung nach dem Umwandlungsgesetz",
      "state": "Bayern",
      "amtsgericht": "Amtsgericht Aschaffenburg",
      "registernummer": "HRA 6700",
      "registerart": "HRA",
      "company_name": "M.E. Heizkostenabrechnung e.K.",
      "company_seat": "Kleinwallstadt",
      "details": "01.05.2025 (Bekanntmachungsdatum)\n\nBayern Amtsgericht Aschaffenburg HRA 6700\nRegisterbekanntmachung nach dem Umwandlungsgesetz 30.04.2025 (Eintragungsdatum)\n\nM.E. Heizkostenabrechnung e.K.\nEinzelkaufmann / Einzelkauffrau\nKleinwallstadt\n\nDen Gläubigern der an der Ausgliederung beteiligten Rechtsträger ist, wenn sie binnen sechs Monaten nach dem Tag, an dem die Eintragung der Ausgliederung in das Register des Sitzes desjenigen Rechtsträgers, dessen Gläubiger sie sind, nach §§ 125, 19 Abs. 3 UmwG als bekannt gemacht gilt, ihren Anspruch nach Grund und Höhe in Textform anmelden, Sicherheit zu leisten, soweit sie nicht Befriedigung verlangen können. Dieses Recht steht den Gläubigern jedoch nur zu, wenn sie glaubhaft machen, dass durch die Ausgliederung die Erfüllung ihrer Forderung gefährdet wird."
    },
    {
      "date": "2025-05-01",
      "id": "107868",
      "original_text": "Registerbekanntmachung nach dem Umwandlungsgesetz\nBayern Amtsgericht Ingolstadt HRB 8187\nImmobilien Gegg GmbH – Eichstätt",
      "type": "Registerbekanntmachung nach dem Umwandlungsgesetz",
      "state": "Bayern",
      "amtsgericht": "Amtsgericht Ingolstadt",
      "registernummer": "HRB 8187",
      "registerart": "HRB",
      "company_name": "Immobilien Gegg GmbH",
      "company_seat": "Eichstätt",
      "details": "01.05.2025 (Bekanntmachungsdatum)\n\nBayern Amtsgericht Ingolstadt HRB 8187\nRegisterbekanntmachung nach dem Umwandlungsgesetz 30.04.2025 (Eintragungsdatum)\n\nImmobilien Gegg GmbH\nGesellschaft mit beschränkter Haftung\nEichstätt\n\nDen Gläubigern des formwechselnden Rechtsträgers ist, wenn sie binnen sechs Monaten nach dem Tag, an dem die Eintragung des Formwechsels nach § 201 UmwG als bekannt gemacht gilt, ihren Anspruch nach Grund und Höhe in Textform anmelden, Sicherheit zu leisten, soweit sie nicht Befriedigung verlangen können. Dieses Recht steht den Gläubigern jedoch nur zu, wenn sie glaubhaft machen, dass durch den Formwechsel die Erfüllung ihrer Forderung gefährdet wird."
    },
    {
      "date": "2025-05-01",
      "id": "107869",
      "original_text": "Registerbekanntmachung nach dem Umwandlungsgesetz\nBayern Amtsgericht Kempten (Allgäu) HRB 16108\nLakeside Brands GmbH – Lindau (Bodensee)",
      "type": "Registerbekanntmachung nach dem Umwandlungsgesetz",
      "state": "Bayern",
      "amtsgericht": "Amtsgericht Kempten (Allgäu)",
      "registernummer": "HRB 16108",
      "registerart": "HRB",
      "company_name": "Lakeside Brands GmbH",
      "company_seat": "Lindau (Bodensee)",
      "details": "01.05.2025 (Bekanntmachungsdatum)\n\nBayern Amtsgericht Kempten (Allgäu) HRB 16108\nRegisterbekanntmachung nach dem Umwandlungsgesetz 30.04.2025 (Eintragungsdatum)\n\nLakeside Brands GmbH\nGesellschaft mit beschränkter Haftung\nLindau (Bodensee)\n\nDen Gläubigern der an der Verschmelzung beteiligten Rechtsträger ist, wenn sie binnen sechs Monaten nach dem Tag, an dem die Eintragung der Verschmelzung in das Register des Sitzes desjenigen Rechtsträgers, dessen Gläubiger sie sind, nach § 19 Abs. 3 UmwG als bekannt gemacht gilt, ihren Anspruch nach Grund und Höhe in Textform anmelden, Sicherheit zu leisten, soweit sie nicht Befriedigung verlangen können. Dieses Recht steht den Gläubigern jedoch nur zu, wenn sie glaubhaft machen, dass durch die Verschmelzung die Erfüllung ihrer Forderung gefährdet wird."
    },
    {
      "date": "2025-05-01",
      "id": "107870",
      "original_text": "Registerbekanntmachung nach dem Umwandlungsgesetz\nBayern Amtsgericht Passau HRA 12104\nHaslinger Hof GmbH & Co. KG – Kirchham",
      "type": "Registerbekanntmachung nach dem Umwandlungsgesetz",
      "state": "Bayern",
      "amtsgericht": "Amtsgericht Passau",
      "registernummer": "HRA 12104",
      "registerart": "HRA",
      "company_name": "Haslinger Hof GmbH & Co. KG",
      "company_seat": "Kirchham",
      "details": "01.05.2025 (Bekanntmachungsdatum)\n\nBayern Amtsgericht Passau HRA 12104\nRegisterbekanntmachung nach dem Umwandlungsgesetz 30.04.2025 (Eintragungsdatum)\n\nHaslinger Hof GmbH & Co. KG\nKommanditgesellschaft\nKirchham\n\nDen Gläubigern der an der Verschmelzung beteiligten Rechtsträger ist, wenn sie binnen sechs Monaten nach dem Tag, an dem die Eintragung der Verschmelzung in das Register des Sitzes desjenigen Rechtsträgers, dessen Gläubiger sie sind, nach § 19 Abs. 3 UmwG als bekannt gemacht gilt, ihren Anspruch nach Grund und Höhe in Textform anmelden, Sicherheit zu leisten, soweit sie nicht Befriedigung verlangen können. Dieses Recht steht den Gläubigern jedoch nur zu, wenn sie glaubhaft machen, dass durch die Verschmelzung die Erfüllung ihrer Forderung gefährdet wird."
    },
    {
      "date": "2025-05-01",
      "id": "107871",
      "original_text": "Löschungsankündigung\nBayern Amtsgericht Kempten (Allgäu) HRB 16696\nAliceitalessen GmbH – Füssen",
      "type": "Löschungsankündigung",
      "state": "Bayern",
      "amtsgericht": "Amtsgericht Kempten (Allgäu)",
      "registernummer": "HRB 16696",
      "registerart": "HRB",
      "company_name": "Aliceitalessen GmbH",
      "company_seat": "Füssen",
      "details": "01.05.2025 (Bekanntmachungsdatum)\n\nBayern Amtsgericht Kempten (Allgäu) HRB 16696\nLöschungsankündigung\n\nAliceitalessen GmbH\nGesellschaft mit beschränkter Haftung\nFüssen\n\nDas Registergericht beabsichtigt, die im Handelsregister eingetragene Gesellschaft wegen Vermögenslosigkeit von Amts wegen nach § 394 FamFG zu löschen. Die Frist zur Erhebung eines Widerspruchs ist auf einen Monat festgesetzt."
    },
    {
      "date": "2025-05-01",
      "id": "107872",
      "original_text": "Registerbekanntmachung nach dem Umwandlungsgesetz\nBayern Amtsgericht Nürnberg HRB 13673\nK & G Industriebeteiligungs- und Verwaltungs-GmbH – Wendelstein",
      "type": "Registerbekanntmachung nach dem Umwandlungsgesetz",
      "state": "Bayern",
      "amtsgericht": "Amtsgericht Nürnberg",
      "registernummer": "HRB 13673",
      "registerart": "HRB",
      "company_name": "K & G Industriebeteiligungs- und Verwaltungs-GmbH",
      "company_seat": "Wendelstein",
      "details": "01.05.2025 (Bekanntmachungsdatum)\n\nBayern Amtsgericht Nürnberg HRB 13673\nRegisterbekanntmachung nach dem Umwandlungsgesetz 30.04.2025 (Eintragungsdatum)\n\nK & G Industriebeteiligungs- und Verwaltungs-GmbH\nGesellschaft mit beschränkter Haftung\nWendelstein\n\nDen Gläubigern der an der Verschmelzung beteiligten Rechtsträger ist, wenn sie binnen sechs Monaten nach dem Tag, an dem die Eintragung der Verschmelzung in das Register des Sitzes desjenigen Rechtsträgers, dessen Gläubiger sie sind, nach § 19 Abs. 3 UmwG als bekannt gemacht gilt, ihren Anspruch nach Grund und Höhe in Textform anmelden, Sicherheit zu leisten, soweit sie nicht Befriedigung verlangen können. Dieses Recht steht den Gläubigern jedoch nur zu, wenn sie glaubhaft machen, dass durch die Verschmelzung die Erfüllung ihrer Forderung gefährdet wird."
    },
    {
      "date": "2025-05-01",
      "id": "107873",
      "original_text": "Registerbekanntmachung nach dem Umwandlungsgesetz\nBayern Amtsgericht Passau HRA 12923\nHaslinger Hofwiesn Hotel GmbH & Co. KG – Kirchham",
      "type": "Registerbekanntmachung nach dem Umwandlungsgesetz",
      "state": "Bayern",
      "amtsgericht": "Amtsgericht Passau",
      "registernummer": "HRA 12923",
      "registerart": "HRA",
      "company_name": "Haslinger Hofwiesn Hotel GmbH & Co. KG",
      "company_seat": "Kirchham",
      "details": "01.05.2025 (Bekanntmachungsdatum)\n\nBayern Amtsgericht Passau HRA 12923\nRegisterbekanntmachung nach dem Umwandlungsgesetz 30.04.2025 (Eintragungsdatum)\n\nHaslinger Hofwiesn Hotel GmbH & Co. KG\nKommanditgesellschaft\nKirchham\n\nDen Gläubigern der an der Verschmelzung beteiligten Rechtsträger ist, wenn sie binnen sechs Monaten nach dem Tag, an dem die Eintragung der Verschmelzung in das Register des Sitzes desjenigen Rechtsträgers, dessen Gläubiger sie sind, nach § 19 Abs. 3 UmwG als bekannt gemacht gilt, ihren Anspruch nach Grund und Höhe in Textform anmelden, Sicherheit zu leisten, soweit sie nicht Befriedigung verlangen können. Dieses Recht steht den Gläubigern jedoch nur zu, wenn sie glaubhaft machen, dass durch die Verschmelzung die Erfüllung ihrer Forderung gefährdet wird."
    },
    {
      "date": "2025-05-01",
      "id": "107874",
      "original_text": "Registerbekanntmachung nach dem Umwandlungsgesetz\nBayern Amtsgericht Kempten (Allgäu) HRB 12785\nMediashop International Group GmbH – Lindau (Bodensee)",
      "type": "Registerbekanntmachung nach dem Umwandlungsgesetz",
      "state": "Bayern",
      "amtsgericht": "Amtsgericht Kempten (Allgäu)",
      "registernummer": "HRB 12785",
      "registerart": "HRB",
      "company_name": "Mediashop International Group GmbH",
      "company_seat": "Lindau (Bodensee)",
      "details": "01.05.2025 (Bekanntmachungsdatum)\n\nBayern Amtsgericht Kempten (Allgäu) HRB 12785\nRegisterbekanntmachung nach dem Umwandlungsgesetz 30.04.2025 (Eintragungsdatum)\n\nMediashop International Group GmbH\nGesellschaft mit beschränkter Haftung\nLindau (Bodensee)\n\nDen Gläubigern der an der Verschmelzung beteiligten Rechtsträger ist, wenn sie binnen sechs Monaten nach dem Tag, an dem die Eintragung der Verschmelzung in das Register des Sitzes desjenigen Rechtsträgers, dessen Gläubiger sie sind, nach § 19 Abs. 3 UmwG als bekannt gemacht gilt, ihren Anspruch nach Grund und Höhe in Textform anmelden, Sicherheit zu leisten, soweit sie nicht Befriedigung verlangen können. Dieses Recht steht den Gläubigern jedoch nur zu, wenn sie glaubhaft machen, dass durch die Verschmelzung die Erfüllung ihrer Forderung gefährdet wird."
    },
    {
      "date": "2025-05-01",
      "id": "107875",
      "original_text": "Registerbekanntmachung nach dem Umwandlungsgesetz\nBayern Amtsgericht München HRB 234802\nPP Silvretta TopCo GmbH – München",
      "type": "Registerbekanntmachung nach dem Umwandlungsgesetz",
      "state": "Bayern",
      "amtsgericht": "Amtsgericht München",
      "registernummer": "HRB 234802",
      "registerart": "HRB",
      "company_name": "PP Silvretta TopCo GmbH",
      "company_seat": "München",
      "details": "01.05.2025 (Bekanntmachungsdatum)\n\nBayern Amtsgericht München HRB 234802\nRegisterbekanntmachung nach dem Umwandlungsgesetz 30.04.2025 (Eintragungsdatum)\n\nPP Silvretta TopCo GmbH\nGesellschaft mit beschränkter Haftung\nMünchen\n\nDen Gläubigern der an der Verschmelzung beteiligten Rechtsträger ist, wenn sie binnen sechs Monaten nach dem Tag, an dem die Eintragung der Verschmelzung in das Register des Sitzes desjenigen Rechtsträgers, dessen Gläubiger sie sind, nach § 19 Abs. 3 UmwG als bekannt gemacht gilt, ihren Anspruch nach Grund und Höhe in Textform anmelden, Sicherheit zu leisten, soweit sie nicht Befriedigung verlangen können. Dieses Recht steht den Gläubigern jedoch nur zu, wenn sie glaubhaft machen, dass durch die Verschmelzung die Erfüllung ihrer Forderung gefährdet wird."
    },
    {
      "date": "2025-05-01",
      "id": "107876",
      "original_text": "Registerbekanntmachung nach dem Umwandlungsgesetz\nBayern Amtsgericht Traunstein HRB 8980\nHubert Haas Malerfachbetrieb GmbH – Bernau a.Chiemsee",
      "type": "Registerbekanntmachung nach dem Umwandlungsgesetz",
      "state": "Bayern",
      "amtsgericht": "Amtsgericht Traunstein",
      "registernummer": "HRB 8980",
      "registerart": "HRB",
      "company_name": "Hubert Haas Malerfachbetrieb GmbH",
      "company_seat": "Bernau a.Chiemsee",
      "details": "01.05.2025 (Bekanntmachungsdatum)\n\nBayern Amtsgericht Traunstein HRB 8980\nRegisterbekanntmachung nach dem Umwandlungsgesetz 30.04.2025 (Eintragungsdatum)\n\nHubert Haas Malerfachbetrieb GmbH\nGesellschaft mit beschränkter Haftung\nBernau a.Chiemsee\n\nDen Gläubigern #dv.auswahl(Text=\"Bitte zutreffendes auswählen:\",Eingabe=\n\n\"der an der Verschmelzung beteiligten Rechtsträger ist, wenn sie binnen sechs Monaten nach dem Tag, an dem die Eintragung der Verschmelzung in das Register des Sitzes desjenigen Rechtsträgers, dessen Gläubiger sie sind, nach § 19 Abs. 3 UmwG als bekannt gemacht gilt, ihren Anspruch nach Grund und Höhe in Textform anmelden, Sicherheit zu leisten, soweit sie nicht Befriedigung verlangen können. Dieses Recht steht den Gläubigern jedoch nur zu, wenn sie glaubhaft machen, dass durch die Verschmelzung die Erfüllung ihrer Forderung gefährdet wird.\"|\"Verschmelzung\",\n\n\"der an der Spaltung beteiligten Rechtsträger ist, wenn sie binnen sechs Monaten nach dem Tag, an dem die Eintragung der Spaltung in das Register des Sitzes desjenigen Rechtsträgers, dessen Gläubiger sie sind, nach §§ 125, 19 Abs. 3 UmwG als bekannt gemacht gilt, ihren Anspruch nach Grund und Höhe in Textform anmelden, Sicherheit zu leisten, soweit sie nicht Befriedigung verlangen können. Dieses Recht steht den Gläubigern jedoch nur zu, wenn sie glaubhaft machen, dass durch die Spaltung die Erfüllung ihrer Forderung gefährdet wird.\"|\"Spaltung\",\n\n\"des formwechselnden Rechtsträgers ist, wenn sie binnen sechs Monaten nach dem Tag, an dem die Eintragung des Formwechsels nach § 201 UmwG als bekannt gemacht gilt, ihren Anspruch nach Grund und Höhe in Textform anmelden, Sicherheit zu leisten, soweit sie nicht Befriedigung verlangen können. Dieses Recht steht den Gläubigern jedoch nur zu, wenn sie glaubhaft machen, dass durch den Formwechsel die Erfüllung ihrer Forderung gefährdet wird.\"|\"formwechselnde Umwandlung\",\n\n\"der an der Ausgliederung beteiligten Rechtsträger ist, wenn sie binnen sechs Monaten nach dem Tag, an dem die Eintragung der Ausgliederung in das Register des Sitzes desjenigen Rechtsträgers, dessen Gläubiger sie sind, nach §§ 125, 19 Abs. 3 UmwG als bekannt gemacht gilt, ihren Anspruch nach Grund und Höhe in Textform anmelden, Sicherheit zu leisten, soweit sie nicht Befriedigung verlangen können. Dieses Recht steht den Gläubigern jedoch nur zu, wenn sie glaubhaft machen, dass durch die Ausgliederung die Erfüllung ihrer Forderung gefährdet wird.\"|\"Ausgliederung\")"
    },
    {
      "date": "2025-05-01",
      "id": "107877",
      "original_text": "Registerbekanntmachung nach dem Umwandlungsgesetz\nBayern Amtsgericht Passau HRB 10054\nWAGoldS UG (haftungsbeschränkt) – Ruhstorf",
      "type": "Registerbekanntmachung nach dem Umwandlungsgesetz",
      "state": "Bayern",
      "amtsgericht": "Amtsgericht Passau",
      "registernummer": "HRB 10054",
      "registerart": "HRB",
      "company_name": "WAGoldS UG (haftungsbeschränkt)",
      "company_seat": "Ruhstorf",
      "details": "01.05.2025 (Bekanntmachungsdatum)\n\nBayern Amtsgericht Passau HRB 10054\nRegisterbekanntmachung nach dem Umwandlungsgesetz 30.04.2025 (Eintragungsdatum)\n\nWAGoldS UG (haftungsbeschränkt)\nGesellschaft mit beschränkter Haftung\nRuhstorf\n\nDen Gläubigern der an der Verschmelzung beteiligten Rechtsträger ist, wenn sie binnen sechs Monaten nach dem Tag, an dem die Eintragung der Verschmelzung in das Register des Sitzes desjenigen Rechtsträgers, dessen Gläubiger sie sind, nach § 19 Abs. 3 UmwG als bekannt gemacht gilt, ihren Anspruch nach Grund und Höhe in Textform anmelden, Sicherheit zu leisten, soweit sie nicht Befriedigung verlangen können. Dieses Recht steht den Gläubigern jedoch nur zu, wenn sie glaubhaft machen, dass durch die Verschmelzung die Erfüllung ihrer Forderung gefährdet wird."
    },
    {
      "date": "2025-05-01",
      "id": "107878",
      "original_text": "Einreichung neuer Dokumente\nBayern Amtsgericht Traunstein HRB 15976\nNeenah Gessner GmbH – Bruckmühl",
      "type": "Einreichung neuer Dokumente",
      "state": "Bayern",
      "amtsgericht": "Amtsgericht Traunstein",
      "registernummer": "HRB 15976",
      "registerart": "HRB",
      "company_name": "Neenah Gessner GmbH",
      "company_seat": "Bruckmühl",
      "details": "01.05.2025 (Bekanntmachungsdatum)\n\nBayern Amtsgericht Traunstein HRB 15976\nEinreichung neuer Dokumente\n\nNeenah Gessner GmbH\nGesellschaft mit beschränkter Haftung\nBruckmühl\n\nDem Amtsgericht Traunstein -Registergericht- ist eine Liste der Mitglieder des Aufsichtsrats eingereicht worden, § 52 Abs. 3 S. 2 GmbHG."
    },
    {
      "date": "2025-05-01",
      "id": "107879",
      "original_text": "Registerbekanntmachung nach dem Umwandlungsgesetz\nBayern Amtsgericht Passau HRA 11995\nHotel am Haslinger Hof GmbH & Co. KG – Kirchham",
      "type": "Registerbekanntmachung nach dem Umwandlungsgesetz",
      "state": "Bayern",
      "amtsgericht": "Amtsgericht Passau",
      "registernummer": "HRA 11995",
      "registerart": "HRA",
      "company_name": "Hotel am Haslinger Hof GmbH & Co. KG",
      "company_seat": "Kirchham",
      "details": "01.05.2025 (Bekanntmachungsdatum)\n\nBayern Amtsgericht Passau HRA 11995\nRegisterbekanntmachung nach dem Umwandlungsgesetz 30.04.2025 (Eintragungsdatum)\n\nHotel am Haslinger Hof GmbH & Co. KG\nKommanditgesellschaft\nKirchham\n\nDen Gläubigern der an der Verschmelzung beteiligten Rechtsträger ist, wenn sie binnen sechs Monaten nach dem Tag, an dem die Eintragung der Verschmelzung in das Register des Sitzes desjenigen Rechtsträgers, dessen Gläubiger sie sind, nach § 19 Abs. 3 UmwG als bekannt gemacht gilt, ihren Anspruch nach Grund und Höhe in Textform anmelden, Sicherheit zu leisten, soweit sie nicht Befriedigung verlangen können. Dieses Recht steht den Gläubigern jedoch nur zu, wenn sie glaubhaft machen, dass durch die Verschmelzung die Erfüllung ihrer Forderung gefährdet wird."
    },
    {
      "date": "2025-05-01",
      "id": "107880",
      "original_text": "Registerbekanntmachung nach dem Umwandlungsgesetz\nBayern Amtsgericht Ingolstadt HRA 4333\nJura Living GmbH & Co. KG – Eichstätt",
      "type": "Registerbekanntmachung nach dem Umwandlungsgesetz",
      "state": "Bayern",
      "amtsgericht": "Amtsgericht Ingolstadt",
      "registernummer": "HRA 4333",
      "registerart": "HRA",
      "company_name": "Jura Living GmbH & Co. KG",
      "company_seat": "Eichstätt",
      "details": "01.05.2025 (Bekanntmachungsdatum)\n\nBayern Amtsgericht Ingolstadt HRA 4333\nRegisterbekanntmachung nach dem Umwandlungsgesetz 30.04.2025 (Eintragungsdatum)\n\nJura Living GmbH & Co. KG\nKommanditgesellschaft\nEichstätt\n\nDen Gläubigern des formwechselnden Rechtsträgers ist, wenn sie binnen sechs Monaten nach dem Tag, an dem die Eintragung des Formwechsels nach § 201 UmwG als bekannt gemacht gilt, ihren Anspruch nach Grund und Höhe in Textform anmelden, Sicherheit zu leisten, soweit sie nicht Befriedigung verlangen können. Dieses Recht steht den Gläubigern jedoch nur zu, wenn sie glaubhaft machen, dass durch den Formwechsel die Erfüllung ihrer Forderung gefährdet wird."
    },
    {
      "date": "2025-05-01",
      "id": "107881",
      "original_text": "Registerbekanntmachung nach dem Umwandlungsgesetz\nBayern Amtsgericht Aschaffenburg HRB 18053\nM.E. Heizkostenabrechnung GmbH – Kleinwallstadt",
      "type": "Registerbekanntmachung nach dem Umwandlungsgesetz",
      "state": "Bayern",
      "amtsgericht": "Amtsgericht Aschaffenburg",
      "registernummer": "HRB 18053",
      "registerart": "HRB",
      "company_name": "M.E. Heizkostenabrechnung GmbH",
      "company_seat": "Kleinwallstadt",
      "details": "01.05.2025 (Bekanntmachungsdatum)\n\nBayern Amtsgericht Aschaffenburg HRB 18053\nRegisterbekanntmachung nach dem Umwandlungsgesetz 30.04.2025 (Eintragungsdatum)\n\nM.E. Heizkostenabrechnung GmbH\nGesellschaft mit beschränkter Haftung\nKleinwallstadt\n\nDen Gläubigern der an der Ausgliederung beteiligten Rechtsträger ist, wenn sie binnen sechs Monaten nach dem Tag, an dem die Eintragung der Ausgliederung in das Register des Sitzes desjenigen Rechtsträgers, dessen Gläubiger sie sind, nach §§ 125, 19 Abs. 3 UmwG als bekannt gemacht gilt, ihren Anspruch nach Grund und Höhe in Textform anmelden, Sicherheit zu leisten, soweit sie nicht Befriedigung verlangen können. Dieses Recht steht den Gläubigern jedoch nur zu, wenn sie glaubhaft machen, dass durch die Ausgliederung die Erfüllung ihrer Forderung gefährdet wird."
    },
    {
      "date": "2025-05-01",
      "id": "107882",
      "original_text": "Löschungsankündigung\nMecklenburg-Vorpommern Amtsgericht Stralsund HRB 8170\nIBK Baumanagement GmbH – Sassnitz",
      "type": "Löschungsankündigung",
      "state": "Mecklenburg-Vorpommern",
      "amtsgericht": "Amtsgericht Stralsund",
      "registernummer": "HRB 8170",
      "registerart": "HRB",
      "company_name": "IBK Baumanagement GmbH",
      "company_seat": "Sassnitz",
      "details": "01.05.2025 (Bekanntmachungsdatum)\n\nMecklenburg-Vorpommern Amtsgericht Stralsund HRB 8170\nLöschungsankündigung\n\nIBK Baumanagement GmbH\nGesellschaft mit beschränkter Haftung\nSassnitz\n\nDas Registergericht beabsichtigt, die im Handelsregister eingetragene Gesellschaft von Amts wegen nach § 394 FamFG zu löschen. Die Frist zur Erhebung eines Widerspruchs gegen die beabsichtigte Löschung wird auf einen Monat festgesetzt."
    },
    {
      "date": "2025-05-01",
      "id": "107883",
      "original_text": "Löschungsankündigung\nBrandenburg Amtsgericht Potsdam HRB 33605\nEurop Best Logistic GmbH – Potsdam",
      "type": "Löschungsankündigung",
      "state": "Brandenburg",
      "amtsgericht": "Amtsgericht Potsdam",
      "registernummer": "HRB 33605",
      "registerart": "HRB",
      "company_name": "Europ Best Logistic GmbH",
      "company_seat": "Potsdam",
      "details": "01.05.2025 (Bekanntmachungsdatum)\n\nBrandenburg Amtsgericht Potsdam HRB 33605\nLöschungsankündigung\n\nEurop Best Logistic GmbH\nGesellschaft mit beschränkter Haftung\nPotsdam\n\nBei der nachstehenden Gesellschaft wird das Amtslöschungsverfahren gemäß § 394 FamFG eingeleitet."
    },
    {
      "date": "2025-05-01",
      "id": "107884",
      "original_text": "Löschungsankündigung\nBerlin Amtsgericht Berlin (Charlottenburg) HRB 251651\nUnique Horse Trading GmbH – Berlin",
      "type": "Löschungsankündigung",
      "state": "Berlin",
      "amtsgericht": "Amtsgericht Berlin (Charlottenburg)",
      "registernummer": "HRB 251651",
      "registerart": "HRB",
      "company_name": "Unique Horse Trading GmbH",
      "company_seat": "Berlin",
      "details": "01.05.2025 (Bekanntmachungsdatum)\n\nBerlin Amtsgericht Berlin (Charlottenburg) HRB 251651\nLöschungsankündigung\n\nUnique Horse Trading GmbH\nGesellschaft mit beschränkter Haftung\nBerlin\n\nBei der nachstehenden Gesellschaft wird das Amtslöschungsverfahren gemäß § 394 FamFG eingeleitet. Widerspruchsfrist 6 Wochen"
    },
    {
      "date": "2025-05-01",
      "id": "107885",
      "original_text": "Sonstige Registerbekanntmachung\nHessen Amtsgericht Bad Hersfeld VR 594\nMännergesangverein 1892 Frielingen e. V. – Kirchheim-Frielingen",
      "type": "Sonstige Registerbekanntmachung",
      "state": "Hessen",
      "amtsgericht": "Amtsgericht Bad Hersfeld",
      "registernummer": "VR 594",
      "registerart": "VR",
      "company_name": "Männergesangverein 1892 Frielingen e. V.",
      "company_seat": "Kirchheim-Frielingen",
      "details": "01.05.2025 (Bekanntmachungsdatum)\n\nHessen Amtsgericht Bad Hersfeld VR 594\nSonstige Registerbekanntmachung 01.05.2025 (Eintragungsdatum)\n\nMännergesangverein 1892 Frielingen e. V.\neingetragener Verein\nKirchheim-Frielingen\n\nDer Verein ist aufgelöst."
    }
  ]
}