{
  "date": "2025-05-23",
  "date_of_scrape": "2025-05-31T12:46:11.340Z",
  "tool_version": "0.2.0",
  "number_of_announcements": 89,
  "announcements": [
    {
      "date": "2025-05-23",
      "id": "110031",
      "original_text": "Einreichung neuer Dokumente\nBayern Amtsgericht München HRB 283942\nRoland Berger Holding GmbH & Co. KGaA – München",
      "type": "Einreichung neuer Dokumente",
      "state": "Bayern",
      "amtsgericht": "Amtsgericht München",
      "registernummer": "HRB 283942",
      "registerart": "HRB",
      "company_name": "Roland Berger Holding GmbH & Co. KGaA",
      "company_seat": "München",
      "details": "23.05.2025 (Bekanntmachungsdatum)\n\nBayern Amtsgericht München HRB 283942\nEinreichung neuer Dokumente 22.05.2025 (Eintragungsdatum)\n\nRoland Berger Holding GmbH & Co. KGaA\nKommanditgesellschaft auf Aktien\nMünchen\n\nDem Amtsgericht München -Registergericht- ist eine Liste der Mitglieder des Aufsichtsrats eingereicht worden, §§ 278 Abs. 3, 106 AktG."
    },
    {
      "date": "2025-05-23",
      "id": "110032",
      "original_text": "Löschungsankündigung\nBayern Amtsgericht München HRB 260780\nKairos Global GmbH – München",
      "type": "Löschungsankündigung",
      "state": "Bayern",
      "amtsgericht": "Amtsgericht München",
      "registernummer": "HRB 260780",
      "registerart": "HRB",
      "company_name": "Kairos Global GmbH",
      "company_seat": "München",
      "details": "23.05.2025 (Bekanntmachungsdatum)\n\nBayern Amtsgericht München HRB 260780\nLöschungsankündigung\n\nKairos Global GmbH\nGesellschaft mit beschränkter Haftung\nMünchen\n\nDas Registergericht beabsichtigt, die im Handelsregister eingetragene Gesellschaft wegen Vermögenslosigkeit von Amts wegen nach § 394 FamFG zu löschen. Die Frist zur Erhebung eines Widerspruchs ist auf drei Monate festgesetzt."
    },
    {
      "date": "2025-05-23",
      "id": "110033",
      "original_text": "Registerbekanntmachung nach dem Umwandlungsgesetz\nBayern Amtsgericht Schweinfurt HRB 8790\nC & O Beteiligungs UG (haftungsbeschränkt) – Schweinfurt",
      "type": "Registerbekanntmachung nach dem Umwandlungsgesetz",
      "state": "Bayern",
      "amtsgericht": "Amtsgericht Schweinfurt",
      "registernummer": "HRB 8790",
      "registerart": "HRB",
      "company_name": "C & O Beteiligungs UG (haftungsbeschränkt)",
      "company_seat": "Schweinfurt",
      "details": "23.05.2025 (Bekanntmachungsdatum)\n\nBayern Amtsgericht Schweinfurt HRB 8790\nRegisterbekanntmachung nach dem Umwandlungsgesetz 22.05.2025 (Eintragungsdatum)\n\nC & O Beteiligungs UG (haftungsbeschränkt)\nGesellschaft mit beschränkter Haftung\nSchweinfurt\n\nDen Gläubigern der an der Verschmelzung beteiligten Rechtsträger ist, wenn sie binnen sechs Monaten nach dem Tag, an dem die Eintragung der Verschmelzung in das Register des Sitzes desjenigen Rechtsträgers, dessen Gläubiger sie sind, nach § 19 Abs. 3 UmwG als bekannt gemacht gilt, ihren Anspruch nach Grund und Höhe in Textform anmelden, Sicherheit zu leisten, soweit sie nicht Befriedigung verlangen können. Dieses Recht steht den Gläubigern jedoch nur zu, wenn sie glaubhaft machen, dass durch die Verschmelzung die Erfüllung ihrer Forderung gefährdet wird."
    },
    {
      "date": "2025-05-23",
      "id": "110034",
      "original_text": "Einreichung neuer Dokumente\nBayern Amtsgericht Nürnberg HRB 26366\nValuniq AG – Hilpoltstein",
      "type": "Einreichung neuer Dokumente",
      "state": "Bayern",
      "amtsgericht": "Amtsgericht Nürnberg",
      "registernummer": "HRB 26366",
      "registerart": "HRB",
      "company_name": "Valuniq AG",
      "company_seat": "Hilpoltstein",
      "details": "23.05.2025 (Bekanntmachungsdatum)\n\nBayern Amtsgericht Nürnberg HRB 26366\nEinreichung neuer Dokumente\n\nValuniq AG\nAktiengesellschaft\nHilpoltstein\n\nDem Amtsgericht Nürnberg -Registergericht- ist eine Liste der Mitglieder des Aufsichtsrats eingereicht worden, § 106 AktG."
    },
    {
      "date": "2025-05-23",
      "id": "110035",
      "original_text": "Löschungsankündigung\nBayern Amtsgericht München HRB 213571\nSVICOMM d.o.o. – München",
      "type": "Löschungsankündigung",
      "state": "Bayern",
      "amtsgericht": "Amtsgericht München",
      "registernummer": "HRB 213571",
      "registerart": "HRB",
      "company_name": "SVICOMM d.o.o.",
      "company_seat": "München",
      "details": "23.05.2025 (Bekanntmachungsdatum)\n\nBayern Amtsgericht München HRB 213571\nLöschungsankündigung\n\nSVICOMM d.o.o.\nRechtsform ausländischen Rechts HRB\nMünchen\n\nDas Registergericht beabsichtigt, die im Handelsregister eingetragene Gesellschaft wegen Vermögenslosigkeit von Amts wegen nach § 394 FamFG zu löschen. Die Frist zur Erhebung eines Widerspruchs ist auf drei Monate festgesetzt."
    },
    {
      "date": "2025-05-23",
      "id": "110036",
      "original_text": "Registerbekanntmachung nach dem Umwandlungsgesetz\nBayern Amtsgericht München HRB 180494\ncabfly GmbH – Olching",
      "type": "Registerbekanntmachung nach dem Umwandlungsgesetz",
      "state": "Bayern",
      "amtsgericht": "Amtsgericht München",
      "registernummer": "HRB 180494",
      "registerart": "HRB",
      "company_name": "cabfly GmbH",
      "company_seat": "Olching",
      "details": "23.05.2025 (Bekanntmachungsdatum)\n\nBayern Amtsgericht München HRB 180494\nRegisterbekanntmachung nach dem Umwandlungsgesetz 22.05.2025 (Eintragungsdatum)\n\ncabfly GmbH\nGesellschaft mit beschränkter Haftung\nOlching\n\nDen Gläubigern der an der Verschmelzung beteiligten Rechtsträger ist, wenn sie binnen sechs Monaten nach dem Tag, an dem die Eintragung der Verschmelzung in das Register des Sitzes desjenigen Rechtsträgers, dessen Gläubiger sie sind, nach § 19 Abs. 3 UmwG als bekannt gemacht gilt, ihren Anspruch nach Grund und Höhe in Textform anmelden, Sicherheit zu leisten, soweit sie nicht Befriedigung verlangen können. Dieses Recht steht den Gläubigern jedoch nur zu, wenn sie glaubhaft machen, dass durch die Verschmelzung die Erfüllung ihrer Forderung gefährdet wird."
    },
    {
      "date": "2025-05-23",
      "id": "110037",
      "original_text": "Löschungsankündigung\nBayern Amtsgericht Coburg HRB 417\nAlgi-Seifenfabrik Verwaltungsgesellschaft mit beschränkter Haftung – Stockheim",
      "type": "Löschungsankündigung",
      "state": "Bayern",
      "amtsgericht": "Amtsgericht Coburg",
      "registernummer": "HRB 417",
      "registerart": "HRB",
      "company_name": "Algi-Seifenfabrik Verwaltungsgesellschaft mit beschränkter Haftung",
      "company_seat": "Stockheim",
      "details": "23.05.2025 (Bekanntmachungsdatum)\n\nBayern Amtsgericht Coburg HRB 417\nLöschungsankündigung 19.05.2025 (Eintragungsdatum)\n\nAlgi-Seifenfabrik Verwaltungsgesellschaft mit beschränkter Haftung\nGesellschaft mit beschränkter Haftung\nStockheim\n\nDas Registergericht beabsichtigt, die im Handelsregister eingetragene Gesellschaft wegen Vermögenslosigkeit von Amts wegen nach § 394 FamFG zu löschen. Die Frist zur Erhebung eines Widerspruchs ist auf sechs Wochen festgesetzt."
    },
    {
      "date": "2025-05-23",
      "id": "110038",
      "original_text": "Löschungsankündigung\nBayern Amtsgericht Aschaffenburg HRB 16388\nOPTIMUM Gesellschaft mit beschränkter Haftung – Haibach",
      "type": "Löschungsankündigung",
      "state": "Bayern",
      "amtsgericht": "Amtsgericht Aschaffenburg",
      "registernummer": "HRB 16388",
      "registerart": "HRB",
      "company_name": "OPTIMUM Gesellschaft mit beschränkter Haftung",
      "company_seat": "Haibach",
      "details": "23.05.2025 (Bekanntmachungsdatum)\n\nBayern Amtsgericht Aschaffenburg HRB 16388\nLöschungsankündigung\n\nOPTIMUM Gesellschaft mit beschränkter Haftung\nGesellschaft mit beschränkter Haftung\nHaibach\n\nDas Registergericht beabsichtigt, die im Handelsregister eingetragene Gesellschaft wegen Vermögenslosigkeit von Amts wegen nach § 394 FamFG zu löschen. Die Frist zur Erhebung eines Widerspruchs ist auf drei Monate festgesetzt."
    },
    {
      "date": "2025-05-23",
      "id": "110039",
      "original_text": "Einreichung neuer Dokumente\nBayern Amtsgericht Weiden i. d. OPf. HRB 5991\nWINKLER Management SE – Parkstein",
      "type": "Einreichung neuer Dokumente",
      "state": "Bayern",
      "amtsgericht": "Amtsgericht Weiden i. d. OPf.",
      "registernummer": "HRB 5991",
      "registerart": "HRB",
      "company_name": "WINKLER Management SE",
      "company_seat": "Parkstein",
      "details": "23.05.2025 (Bekanntmachungsdatum)\n\nBayern Amtsgericht Weiden i. d. OPf. HRB 5991\nEinreichung neuer Dokumente 22.05.2025 (Eintragungsdatum)\n\nWINKLER Management SE\nEuropäische Aktiengesellschaft (SE)\nParkstein\n\nDem Amtsgericht Weiden i.d.OPf. -Registergericht- ist eine Liste der Mitglieder des Aufsichtsrats eingereicht worden, Art. 9 Abs. 1 Buchst. c (ii) SE-VO i.V.m. § 106 AktG."
    },
    {
      "date": "2025-05-23",
      "id": "110040",
      "original_text": "Einreichung neuer Dokumente\nBayern Amtsgericht Kempten (Allgäu) HRB 6408\nADC Automotive Distance Control Systems GmbH – Lindau (B)",
      "type": "Einreichung neuer Dokumente",
      "state": "Bayern",
      "amtsgericht": "Amtsgericht Kempten (Allgäu)",
      "registernummer": "HRB 6408",
      "registerart": "HRB",
      "company_name": "ADC Automotive Distance Control Systems GmbH",
      "company_seat": "Lindau (B)",
      "details": "23.05.2025 (Bekanntmachungsdatum)\n\nBayern Amtsgericht Kempten (Allgäu) HRB 6408\nEinreichung neuer Dokumente 22.05.2025 (Eintragungsdatum)\n\nADC Automotive Distance Control Systems GmbH\nGesellschaft mit beschränkter Haftung\nLindau (B)\n\nDem Amtsgericht Kempten (Allgäu) -Registergericht- ist eine Liste der Mitglieder des Aufsichtsrats eingereicht worden, § 52 Abs. 3 S. 2 GmbHG."
    },
    {
      "date": "2025-05-23",
      "id": "110041",
      "original_text": "Registerbekanntmachung nach dem Umwandlungsgesetz\nBayern Amtsgericht Nürnberg HRB 29872\nNWS Alarmservice GmbH – Nürnberg",
      "type": "Registerbekanntmachung nach dem Umwandlungsgesetz",
      "state": "Bayern",
      "amtsgericht": "Amtsgericht Nürnberg",
      "registernummer": "HRB 29872",
      "registerart": "HRB",
      "company_name": "NWS Alarmservice GmbH",
      "company_seat": "Nürnberg",
      "details": "23.05.2025 (Bekanntmachungsdatum)\n\nBayern Amtsgericht Nürnberg HRB 29872\nRegisterbekanntmachung nach dem Umwandlungsgesetz 22.05.2025 (Eintragungsdatum)\n\nNWS Alarmservice GmbH\nGesellschaft mit beschränkter Haftung\nNürnberg\n\nDen Gläubigern der an der Verschmelzung beteiligten Rechtsträger ist, wenn sie binnen sechs Monaten nach dem Tag, an dem die Eintragung der Verschmelzung in das Register des Sitzes desjenigen Rechtsträgers, dessen Gläubiger sie sind, nach § 19 Abs. 3 UmwG als bekannt gemacht gilt, ihren Anspruch nach Grund und Höhe in Textform anmelden, Sicherheit zu leisten, soweit sie nicht Befriedigung verlangen können. Dieses Recht steht den Gläubigern jedoch nur zu, wenn sie glaubhaft machen, dass durch die Verschmelzung die Erfüllung ihrer Forderung gefährdet wird."
    },
    {
      "date": "2025-05-23",
      "id": "110042",
      "original_text": "Registerbekanntmachung nach dem Umwandlungsgesetz\nBayern Amtsgericht Schweinfurt HRB 8892\nC&O Verwaltungs GmbH – Schweinfurt",
      "type": "Registerbekanntmachung nach dem Umwandlungsgesetz",
      "state": "Bayern",
      "amtsgericht": "Amtsgericht Schweinfurt",
      "registernummer": "HRB 8892",
      "registerart": "HRB",
      "company_name": "C&O Verwaltungs GmbH",
      "company_seat": "Schweinfurt",
      "details": "23.05.2025 (Bekanntmachungsdatum)\n\nBayern Amtsgericht Schweinfurt HRB 8892\nRegisterbekanntmachung nach dem Umwandlungsgesetz 22.05.2025 (Eintragungsdatum)\n\nC&O Verwaltungs GmbH\nGesellschaft mit beschränkter Haftung\nSchweinfurt\n\nDen Gläubigern der an der Verschmelzung beteiligten Rechtsträger ist, wenn sie binnen sechs Monaten nach dem Tag, an dem die Eintragung der Verschmelzung in das Register des Sitzes desjenigen Rechtsträgers, dessen Gläubiger sie sind, nach § 19 Abs. 3 UmwG als bekannt gemacht gilt, ihren Anspruch nach Grund und Höhe in Textform anmelden, Sicherheit zu leisten, soweit sie nicht Befriedigung verlangen können. Dieses Recht steht den Gläubigern jedoch nur zu, wenn sie glaubhaft machen, dass durch die Verschmelzung die Erfüllung ihrer Forderung gefährdet wird."
    },
    {
      "date": "2025-05-23",
      "id": "110043",
      "original_text": "Registerbekanntmachung nach dem Umwandlungsgesetz\nBayern Amtsgericht München HRB 114025\nconduct service GmbH – Grünwald",
      "type": "Registerbekanntmachung nach dem Umwandlungsgesetz",
      "state": "Bayern",
      "amtsgericht": "Amtsgericht München",
      "registernummer": "HRB 114025",
      "registerart": "HRB",
      "company_name": "conduct service GmbH",
      "company_seat": "Grünwald",
      "details": "23.05.2025 (Bekanntmachungsdatum)\n\nBayern Amtsgericht München HRB 114025\nRegisterbekanntmachung nach dem Umwandlungsgesetz 22.05.2025 (Eintragungsdatum)\n\nconduct service GmbH\nGesellschaft mit beschränkter Haftung\nGrünwald\n\nDen Gläubigern der an der Verschmelzung beteiligten Rechtsträger ist, wenn sie binnen sechs Monaten nach dem Tag, an dem die Eintragung der Verschmelzung in das Register des Sitzes desjenigen Rechtsträgers, dessen Gläubiger sie sind, nach § 19 Abs. 3 UmwG als bekannt gemacht gilt, ihren Anspruch nach Grund und Höhe in Textform anmelden, Sicherheit zu leisten, soweit sie nicht Befriedigung verlangen können. Dieses Recht steht den Gläubigern jedoch nur zu, wenn sie glaubhaft machen, dass durch die Verschmelzung die Erfüllung ihrer Forderung gefährdet wird."
    },
    {
      "date": "2025-05-23",
      "id": "110044",
      "original_text": "Löschungsankündigung\nBayern Amtsgericht Würzburg HRB 14180\nJuvgrad GmbH – Rüdenhausen",
      "type": "Löschungsankündigung",
      "state": "Bayern",
      "amtsgericht": "Amtsgericht Würzburg",
      "registernummer": "HRB 14180",
      "registerart": "HRB",
      "company_name": "Juvgrad GmbH",
      "company_seat": "Rüdenhausen",
      "details": "23.05.2025 (Bekanntmachungsdatum)\n\nBayern Amtsgericht Würzburg HRB 14180\nLöschungsankündigung\n\nJuvgrad GmbH\nGesellschaft mit beschränkter Haftung\nRüdenhausen\n\nDas Registergericht beabsichtigt, die im Handelsregister eingetragene Gesellschaft wegen Vermögenslosigkeit von Amts wegen nach § 394 FamFG zu löschen. Die Frist zur Erhebung eines Widerspruchs ist auf drei Monate festgesetzt."
    },
    {
      "date": "2025-05-23",
      "id": "110045",
      "original_text": "Löschungsankündigung\nBerlin Amtsgericht Berlin (Charlottenburg) HRB 145383\nJ & A New Age GmbH – Berlin",
      "type": "Löschungsankündigung",
      "state": "Berlin",
      "amtsgericht": "Amtsgericht Berlin (Charlottenburg)",
      "registernummer": "HRB 145383",
      "registerart": "HRB",
      "company_name": "J & A New Age GmbH",
      "company_seat": "Berlin",
      "details": "23.05.2025 (Bekanntmachungsdatum)\n\nBerlin Amtsgericht Berlin (Charlottenburg) HRB 145383\nLöschungsankündigung\n\nJ & A New Age GmbH\nGesellschaft mit beschränkter Haftung\nBerlin\n\nBei der nachstehenden Gesellschaft wird das Amtslöschungsverfahren gemäß § 394 FamFG eingeleitet. Widerspruchsfrist: 6 Wochen."
    },
    {
      "date": "2025-05-23",
      "id": "110046",
      "original_text": "Registerbekanntmachung nach dem Umwandlungsgesetz\nBerlin Amtsgericht Berlin (Charlottenburg) HRB 191492\nDOREA Beta Beteiligungsgesellschaft mbH – Berlin",
      "type": "Registerbekanntmachung nach dem Umwandlungsgesetz",
      "state": "Berlin",
      "amtsgericht": "Amtsgericht Berlin (Charlottenburg)",
      "registernummer": "HRB 191492",
      "registerart": "HRB",
      "company_name": "DOREA Beta Beteiligungsgesellschaft mbH",
      "company_seat": "Berlin",
      "details": "23.05.2025 (Bekanntmachungsdatum)\n\nBerlin Amtsgericht Berlin (Charlottenburg) HRB 191492\nRegisterbekanntmachung nach dem Umwandlungsgesetz 21.05.2025 (Eintragungsdatum)\n\nDOREA Beta Beteiligungsgesellschaft mbH\nGesellschaft mit beschränkter Haftung\nBerlin\n\nZu Eintragungsnummer 18 vom 21.05.2025 wird als nicht eingetragen veröffentlicht: Den Gläubigern der an den Verschmelzungen beteiligten Rechtsträger ist, wenn sie binnen sechs Monaten nach dem Tag, an dem die Eintragung der jeweiligen Verschmelzung in das Register des Sitzes desjenigen Rechtsträgers, dessen Gläubiger sie sind, als bekannt gemacht gilt, ihren Anspruch nach Grund und Höhe schriftlich anmelden, Sicherheit zu leisten, soweit sie nicht Befriedigung verlangen können. Dieses Recht steht den Gläubigern jedoch nur zu, wenn sie glaubhaft machen, dass durch die jeweilige Verschmelzung die Erfüllung ihrer Forderung gefährdet wird. Das Recht, Sicherheitsleistung zu verlangen, steht Gläubigern nicht zu, die im Falle der Insolvenz ein Recht auf vorzugsweise Befriedigung aus einer Deckungsmasse haben, die nach gesetzlicher Vorschrift zu ihrem Schutz errichtet und staatlich überwacht ist."
    },
    {
      "date": "2025-05-23",
      "id": "110047",
      "original_text": "Registerbekanntmachung nach dem Umwandlungsgesetz\nBerlin Amtsgericht Berlin (Charlottenburg) HRB 191155\nDomicil Seniorenheim GmbH – Berlin",
      "type": "Registerbekanntmachung nach dem Umwandlungsgesetz",
      "state": "Berlin",
      "amtsgericht": "Amtsgericht Berlin (Charlottenburg)",
      "registernummer": "HRB 191155",
      "registerart": "HRB",
      "company_name": "Domicil Seniorenheim GmbH",
      "company_seat": "Berlin",
      "details": "23.05.2025 (Bekanntmachungsdatum)\n\nBerlin Amtsgericht Berlin (Charlottenburg) HRB 191155\nRegisterbekanntmachung nach dem Umwandlungsgesetz 21.05.2025 (Eintragungsdatum)\n\nDomicil Seniorenheim GmbH\nGesellschaft mit beschränkter Haftung\nBerlin\n\nZu Eintragungsnummer 15 vom 21.05.2025 wird als nicht eingetragen veröffentlicht: Den Gläubigern der an der Verschmelzung beteiligten Rechtsträger ist, wenn sie binnen sechs Monaten nach dem Tag, an dem die Eintragung der Verschmelzung in das Register des Sitzes desjenigen Rechtsträgers, dessen Gläubiger sie sind, als bekannt gemacht gilt, ihren Anspruch nach Grund und Höhe schriftlich anmelden, Sicherheit zu leisten, soweit sie nicht Befriedigung verlangen können. Dieses Recht steht den Gläubigern jedoch nur zu, wenn sie glaubhaft machen, dass durch die Verschmelzung die Erfüllung ihrer Forderung gefährdet wird. Das Recht, Sicherheitsleistung zu verlangen, steht Gläubigern nicht zu, die im Falle der Insolvenz ein Recht auf vorzugsweise Befriedigung aus einer Deckungsmasse haben, die nach gesetzlicher Vorschrift zu ihrem Schutz errichtet und staatlich überwacht ist."
    },
    {
      "date": "2025-05-23",
      "id": "110048",
      "original_text": "Registerbekanntmachung nach dem Umwandlungsgesetz\nBerlin Amtsgericht Berlin (Charlottenburg) HRB 191179\nDomicil Am Klostergarten GmbH – Berlin",
      "type": "Registerbekanntmachung nach dem Umwandlungsgesetz",
      "state": "Berlin",
      "amtsgericht": "Amtsgericht Berlin (Charlottenburg)",
      "registernummer": "HRB 191179",
      "registerart": "HRB",
      "company_name": "Domicil Am Klostergarten GmbH",
      "company_seat": "Berlin",
      "details": "23.05.2025 (Bekanntmachungsdatum)\n\nBerlin Amtsgericht Berlin (Charlottenburg) HRB 191179\nRegisterbekanntmachung nach dem Umwandlungsgesetz 21.05.2025 (Eintragungsdatum)\n\nDomicil Am Klostergarten GmbH\nGesellschaft mit beschränkter Haftung\nBerlin\n\nZu Eintragungsnummer 13 vom 21.05.2025 wird als nicht eingetragen veröffentlicht: Den Gläubigern der an der Verschmelzung beteiligten Rechtsträger ist, wenn sie binnen sechs Monaten nach dem Tag, an dem die Eintragung der Verschmelzung in das Register des Sitzes desjenigen Rechtsträgers, dessen Gläubiger sie sind, als bekannt gemacht gilt, ihren Anspruch nach Grund und Höhe schriftlich anmelden, Sicherheit zu leisten, soweit sie nicht Befriedigung verlangen können. Dieses Recht steht den Gläubigern jedoch nur zu, wenn sie glaubhaft machen, dass durch die Verschmelzung die Erfüllung ihrer Forderung gefährdet wird. Das Recht, Sicherheitsleistung zu verlangen, steht Gläubigern nicht zu, die im Falle der Insolvenz ein Recht auf vorzugsweise Befriedigung aus einer Deckungsmasse haben, die nach gesetzlicher Vorschrift zu ihrem Schutz errichtet und staatlich überwacht ist."
    },
    {
      "date": "2025-05-23",
      "id": "110049",
      "original_text": "Registerbekanntmachung nach dem Umwandlungsgesetz\nBaden-Württemberg Amtsgericht Freiburg HRA 708987\nMaxigebäudereinigung e.K. – Weil am Rhein",
      "type": "Registerbekanntmachung nach dem Umwandlungsgesetz",
      "state": "Baden-Württemberg",
      "amtsgericht": "Amtsgericht Freiburg",
      "registernummer": "HRA 708987",
      "registerart": "HRA",
      "company_name": "Maxigebäudereinigung e.K.",
      "company_seat": "Weil am Rhein",
      "details": "23.05.2025 (Bekanntmachungsdatum)\n\nBaden-Württemberg Amtsgericht Freiburg HRA 708987\nRegisterbekanntmachung nach dem Umwandlungsgesetz 23.05.2025 (Eintragungsdatum)\n\nMaxigebäudereinigung e.K.\nEinzelkaufmann / Einzelkauffrau\nWeil am Rhein\n\nDen Gläubigern der an der Ausgliederung beteiligten Rechtsträger ist, wenn sie binnen sechs Monaten nach dem Tag, an dem die Eintragung der Ausgliederung in das Register des Sitzes desjenigen Rechtsträgers, dessen Gläubiger sie sind, nach § 19 Abs. 3 UmwG als bekanntgemacht gilt, ihren Anspruch nach Grund und Höhe schriftlich anmelden, Sicherheit zu leisten, soweit sie nicht Befriedigung verlangen können. Dieses Recht steht den Gläubigern jedoch nur zu, wenn sie glaubhaft machen, dass durch die Ausgliederung die Erfüllung ihrer Forderung gefährdet wird."
    },
    {
      "date": "2025-05-23",
      "id": "110050",
      "original_text": "Löschungsankündigung\nBerlin Amtsgericht Berlin (Charlottenburg) HRB 187292\nMircix Business Service Berlin UG (haftungsbeschränkt) – Berlin",
      "type": "Löschungsankündigung",
      "state": "Berlin",
      "amtsgericht": "Amtsgericht Berlin (Charlottenburg)",
      "registernummer": "HRB 187292",
      "registerart": "HRB",
      "company_name": "Mircix Business Service Berlin UG (haftungsbeschränkt)",
      "company_seat": "Berlin",
      "details": "23.05.2025 (Bekanntmachungsdatum)\n\nBerlin Amtsgericht Berlin (Charlottenburg) HRB 187292\nLöschungsankündigung\n\nMircix Business Service Berlin UG (haftungsbeschränkt)\nGesellschaft mit beschränkter Haftung\nBerlin\n\nBei der nachstehenden Gesellschaft wird das Amtslöschungsverfahren gemäß § 394 FamFG eingeleitet. Widerspruchsfrist 6 Wochen"
    },
    {
      "date": "2025-05-23",
      "id": "110051",
      "original_text": "Registerbekanntmachung nach dem Umwandlungsgesetz\nBaden-Württemberg Amtsgericht Mannheim HRB 335250\nParitätische Sozialdienste gGmbH – Heidelberg",
      "type": "Registerbekanntmachung nach dem Umwandlungsgesetz",
      "state": "Baden-Württemberg",
      "amtsgericht": "Amtsgericht Mannheim",
      "registernummer": "HRB 335250",
      "registerart": "HRB",
      "company_name": "Paritätische Sozialdienste gGmbH",
      "company_seat": "Heidelberg",
      "details": "23.05.2025 (Bekanntmachungsdatum)\n\nBaden-Württemberg Amtsgericht Mannheim HRB 335250\nRegisterbekanntmachung nach dem Umwandlungsgesetz 23.05.2025 (Eintragungsdatum)\n\nParitätische Sozialdienste gGmbH\nGesellschaft mit beschränkter Haftung\nHeidelberg\n\nDen Gläubigern der an der Verschmelzung beteiligten Rechtsträger ist, wenn sie binnen sechs Monaten nach dem Tag, an dem die Eintragung der Verschmelzung in das Register des Sitzes desjenigen Rechtsträgers, dessen Gläubiger sie sind, nach § 19 Abs. 3 UmwG als bekanntgemacht gilt, ihren Anspruch nach Grund und Höhe schriftlich anmelden, Sicherheit zu leisten, soweit sie nicht Befriedigung verlangen können. Dieses Recht steht den Gläubigern jedoch nur zu, wenn sie glaubhaft machen, dass durch die Verschmelzung die Erfüllung ihrer Forderung gefährdet wird."
    },
    {
      "date": "2025-05-23",
      "id": "110052",
      "original_text": "Löschungsankündigung\nSchleswig-Holstein Amtsgericht Flensburg HRB 13278\nwarmgrün GmbH – Schwesing",
      "type": "Löschungsankündigung",
      "state": "Schleswig-Holstein",
      "amtsgericht": "Amtsgericht Flensburg",
      "registernummer": "HRB 13278",
      "registerart": "HRB",
      "company_name": "warmgrün GmbH",
      "company_seat": "Schwesing",
      "details": "23.05.2025 (Bekanntmachungsdatum)\n\nSchleswig-Holstein Amtsgericht Flensburg HRB 13278\nLöschungsankündigung\n\nwarmgrün GmbH\nGesellschaft mit beschränkter Haftung\nSchwesing\n\nEs ist die Löschung der nachstehenden Gesellschaft wegen Vermögenslosigkeit gemäß § 394 FamFG beabsichtigt.\n\nWiderspruchsfrist: 2 Monate."
    },
    {
      "date": "2025-05-23",
      "id": "110053",
      "original_text": "Löschungsankündigung\nSchleswig-Holstein Amtsgericht Flensburg HRA 6315\nAM \"THOR\" Projektgesellschaft mbH & Co. KG – Flensburg",
      "type": "Löschungsankündigung",
      "state": "Schleswig-Holstein",
      "amtsgericht": "Amtsgericht Flensburg",
      "registernummer": "HRA 6315",
      "registerart": "HRA",
      "company_name": "AM \"THOR\" Projektgesellschaft mbH & Co. KG",
      "company_seat": "Flensburg",
      "details": "23.05.2025 (Bekanntmachungsdatum)\n\nSchleswig-Holstein Amtsgericht Flensburg HRA 6315\nLöschungsankündigung\n\nAM \"THOR\" Projektgesellschaft mbH & Co. KG\nKommanditgesellschaft\nFlensburg\n\nEs ist die Löschung der nachstehenden Gesellschaft wegen Vermögenslosigkeit gemäß § 394 FamFG beabsichtigt.\nWiderspruchsfrist: 2 Monate"
    },
    {
      "date": "2025-05-23",
      "id": "110054",
      "original_text": "Einreichung neuer Dokumente\nBaden-Württemberg Amtsgericht Stuttgart HRB 773047\nHeller Holding SE & Co. KGaA – Nürtingen",
      "type": "Einreichung neuer Dokumente",
      "state": "Baden-Württemberg",
      "amtsgericht": "Amtsgericht Stuttgart",
      "registernummer": "HRB 773047",
      "registerart": "HRB",
      "company_name": "Heller Holding SE & Co. KGaA",
      "company_seat": "Nürtingen",
      "details": "23.05.2025 (Bekanntmachungsdatum)\n\nBaden-Württemberg Amtsgericht Stuttgart HRB 773047\nEinreichung neuer Dokumente\n\nHeller Holding SE & Co. KGaA\nKommanditgesellschaft auf Aktien\nNürtingen\n\nDie Gesellschaft hat am 21.05.2025 die Liste über die Zusammensetzung des Aufsichtsrats zum Handelsregister eingereicht."
    },
    {
      "date": "2025-05-23",
      "id": "110055",
      "original_text": "Registerbekanntmachung nach dem Umwandlungsgesetz\nSchleswig-Holstein Amtsgericht Kiel HRB 28166\nRUMPF HOLDING GmbH – Nortorf",
      "type": "Registerbekanntmachung nach dem Umwandlungsgesetz",
      "state": "Schleswig-Holstein",
      "amtsgericht": "Amtsgericht Kiel",
      "registernummer": "HRB 28166",
      "registerart": "HRB",
      "company_name": "RUMPF HOLDING GmbH",
      "company_seat": "Nortorf",
      "details": "23.05.2025 (Bekanntmachungsdatum)\n\nSchleswig-Holstein Amtsgericht Kiel HRB 28166\nRegisterbekanntmachung nach dem Umwandlungsgesetz 22.05.2025 (Eintragungsdatum)\n\nRUMPF HOLDING GmbH\nGesellschaft mit beschränkter Haftung\nNortorf\n\nAls nicht eingetragen wird veröffentlicht: Den Gläubigern ist, wenn sie binnen sechs Monaten nach dem Tag, an dem die Eintragung der Umwandlung bekannt gemacht worden ist, ihren Anspruch nach Grund und Höhe schriftlich anmelden, Sicherheit zu leisten, soweit sie nicht Befriedigung verlangen können. Dieses Recht steht den Gläubigern jedoch nur zu, wenn sie glaubhaft machen, dass durch die Umwandlung die Erfüllung ihrer Forderung gefährdet wird."
    },
    {
      "date": "2025-05-23",
      "id": "110056",
      "original_text": "Registerbekanntmachung nach dem Umwandlungsgesetz\nBaden-Württemberg Amtsgericht Freiburg HRB 722188\nHaufe Group SE – Freiburg im Breisgau",
      "type": "Registerbekanntmachung nach dem Umwandlungsgesetz",
      "state": "Baden-Württemberg",
      "amtsgericht": "Amtsgericht Freiburg",
      "registernummer": "HRB 722188",
      "registerart": "HRB",
      "company_name": "Haufe Group SE",
      "company_seat": "Freiburg im Breisgau",
      "details": "23.05.2025 (Bekanntmachungsdatum)\n\nBaden-Württemberg Amtsgericht Freiburg HRB 722188\nRegisterbekanntmachung nach dem Umwandlungsgesetz 23.05.2025 (Eintragungsdatum)\n\nHaufe Group SE\nEuropäische Aktiengesellschaft (SE)\nFreiburg im Breisgau\n\nAls nicht eingetragen wird bekanntgemacht:\nDen Gläubigern der an der Abspaltung beteiligten Rechtsträger ist, wenn sie binnen sechs Monaten nach dem Tag, an dem die Eintragung der Abspaltung in das Register des Sitzes desjenigen Rechtsträgers, dessen Gläubiger sie sind, nach § 19 Abs. 3 UmwG als bekanntgemacht gilt, ihren Anspruch nach Grund und Höhe schriftlich anmelden, Sicherheit zu leisten, soweit sie nicht Befriedigung verlangen können. Dieses Recht steht den Gläubigern jedoch nur zu, wenn sie glaubhaft machen, dass durch die Abspaltung die Erfüllung ihrer Forderung gefährdet wird."
    },
    {
      "date": "2025-05-23",
      "id": "110057",
      "original_text": "Löschungsankündigung\nBerlin Amtsgericht Berlin (Charlottenburg) HRB 181796\nBaoAh Gastronomiegesellschaft mbH – Berlin",
      "type": "Löschungsankündigung",
      "state": "Berlin",
      "amtsgericht": "Amtsgericht Berlin (Charlottenburg)",
      "registernummer": "HRB 181796",
      "registerart": "HRB",
      "company_name": "BaoAh Gastronomiegesellschaft mbH",
      "company_seat": "Berlin",
      "details": "23.05.2025 (Bekanntmachungsdatum)\n\nBerlin Amtsgericht Berlin (Charlottenburg) HRB 181796\nLöschungsankündigung\n\nBaoAh Gastronomiegesellschaft mbH\nGesellschaft mit beschränkter Haftung\nBerlin\n\nBei der nachstehenden Gesellschaft wird das Amtslöschungsverfahren gemäß § 394 FamFG eingeleitet. Widerspruchsfrist 6 Wochen"
    },
    {
      "date": "2025-05-23",
      "id": "110058",
      "original_text": "Registerbekanntmachung nach dem Umwandlungsgesetz\nBerlin Amtsgericht Berlin (Charlottenburg) HRB 234609\nKungel Invest GmbH – Berlin",
      "type": "Registerbekanntmachung nach dem Umwandlungsgesetz",
      "state": "Berlin",
      "amtsgericht": "Amtsgericht Berlin (Charlottenburg)",
      "registernummer": "HRB 234609",
      "registerart": "HRB",
      "company_name": "Kungel Invest GmbH",
      "company_seat": "Berlin",
      "details": "23.05.2025 (Bekanntmachungsdatum)\n\nBerlin Amtsgericht Berlin (Charlottenburg) HRB 234609\nRegisterbekanntmachung nach dem Umwandlungsgesetz 22.05.2025 (Eintragungsdatum)\n\nKungel Invest GmbH\nGesellschaft mit beschränkter Haftung\nBerlin\n\nZu Eintragungsnummer 3 vom 22.05.2025 wird als nicht eingetragen veröffentlicht: Den Gläubigern der an der Verschmelzung beteiligten Rechtsträger ist, wenn sie binnen sechs Monaten nach dem Tag, an dem die Eintragung der Verschmelzung in das Register des Sitzes desjenigen Rechtsträgers, dessen Gläubiger sie sind, als bekannt gemacht gilt, ihren Anspruch nach Grund und Höhe schriftlich anmelden, Sicherheit zu leisten, soweit sie nicht Befriedigung verlangen können. Dieses Recht steht den Gläubigern jedoch nur zu, wenn sie glaubhaft machen, dass durch die Verschmelzung die Erfüllung ihrer Forderung gefährdet wird. Das Recht, Sicherheitsleistung zu verlangen, steht Gläubigern nicht zu, die im Falle der Insolvenz ein Recht auf vorzugsweise Befriedigung aus einer Deckungsmasse haben, die nach gesetzlicher Vorschrift zu ihrem Schutz errichtet und staatlich überwacht ist."
    },
    {
      "date": "2025-05-23",
      "id": "110059",
      "original_text": "Registerbekanntmachung nach dem Umwandlungsgesetz\nSchleswig-Holstein Amtsgericht Kiel HRA 9556\nKarsten Rumpf Holding GmbH & Co. KG – Nortorf",
      "type": "Registerbekanntmachung nach dem Umwandlungsgesetz",
      "state": "Schleswig-Holstein",
      "amtsgericht": "Amtsgericht Kiel",
      "registernummer": "HRA 9556",
      "registerart": "HRA",
      "company_name": "Karsten Rumpf Holding GmbH & Co. KG",
      "company_seat": "Nortorf",
      "details": "23.05.2025 (Bekanntmachungsdatum)\n\nSchleswig-Holstein Amtsgericht Kiel HRA 9556\nRegisterbekanntmachung nach dem Umwandlungsgesetz 22.05.2025 (Eintragungsdatum)\n\nKarsten Rumpf Holding GmbH & Co. KG\nKommanditgesellschaft\nNortorf\n\nZu Eintragungsnummer 4 vom 22.05.2025 wird als nicht eingetragen veröffentlicht: Den Gläubigern ist, wenn sie binnen sechs Monaten nach dem Tag, an dem die Eintragung der Umwandlung bekannt gemacht worden ist, ihren Anspruch nach Grund und Höhe schriftlich anmelden, Sicherheit zu leisten, soweit sie nicht Befriedigung verlangen können. Dieses Recht steht den Gläubigern jedoch nur zu, wenn sie glaubhaft machen, dass durch die Umwandlung die Erfüllung ihrer Forderung gefährdet wird."
    },
    {
      "date": "2025-05-23",
      "id": "110060",
      "original_text": "Registerbekanntmachung nach dem Umwandlungsgesetz\nBerlin Amtsgericht Berlin (Charlottenburg) HRB 261211\nVKGN Invest GmbH – Berlin",
      "type": "Registerbekanntmachung nach dem Umwandlungsgesetz",
      "state": "Berlin",
      "amtsgericht": "Amtsgericht Berlin (Charlottenburg)",
      "registernummer": "HRB 261211",
      "registerart": "HRB",
      "company_name": "VKGN Invest GmbH",
      "company_seat": "Berlin",
      "details": "23.05.2025 (Bekanntmachungsdatum)\n\nBerlin Amtsgericht Berlin (Charlottenburg) HRB 261211\nRegisterbekanntmachung nach dem Umwandlungsgesetz 22.05.2025 (Eintragungsdatum)\n\nVKGN Invest GmbH\nGesellschaft mit beschränkter Haftung\nBerlin\n\nZu Eintragungsnummer 2 vom 22.05.2025 wird als nicht eingetragen veröffentlicht: Den Gläubigern der an der Verschmelzung beteiligten Rechtsträger ist, wenn sie binnen sechs Monaten nach dem Tag, an dem die Eintragung der Verschmelzung in das Register des Sitzes desjenigen Rechtsträgers, dessen Gläubiger sie sind, als bekannt gemacht gilt, ihren Anspruch nach Grund und Höhe schriftlich anmelden, Sicherheit zu leisten, soweit sie nicht Befriedigung verlangen können. Dieses Recht steht den Gläubigern jedoch nur zu, wenn sie glaubhaft machen, dass durch die Verschmelzung die Erfüllung ihrer Forderung gefährdet wird. Das Recht, Sicherheitsleistung zu verlangen, steht Gläubigern nicht zu, die im Falle der Insolvenz ein Recht auf vorzugsweise Befriedigung aus einer Deckungsmasse haben, die nach gesetzlicher Vorschrift zu ihrem Schutz errichtet und staatlich überwacht ist."
    },
    {
      "date": "2025-05-23",
      "id": "110061",
      "original_text": "Einreichung neuer Dokumente\nSchleswig-Holstein Amtsgericht Kiel HRB 7306\nfreenet AG – Büdelsdorf",
      "type": "Einreichung neuer Dokumente",
      "state": "Schleswig-Holstein",
      "amtsgericht": "Amtsgericht Kiel",
      "registernummer": "HRB 7306",
      "registerart": "HRB",
      "company_name": "freenet AG",
      "company_seat": "Büdelsdorf",
      "details": "23.05.2025 (Bekanntmachungsdatum)\n\nSchleswig-Holstein Amtsgericht Kiel HRB 7306\nEinreichung neuer Dokumente\n\nfreenet AG\nAktiengesellschaft\nBüdelsdorf\n\nAls nicht eingetragen wird veröffentlicht: Eine neue Liste der Aufsichtsratsmitglieder ist eingereicht worden."
    },
    {
      "date": "2025-05-23",
      "id": "110062",
      "original_text": "Sonstige Registerbekanntmachung\nSchleswig-Holstein Amtsgericht Kiel HRB 7306\nfreenet AG – Büdelsdorf",
      "type": "Sonstige Registerbekanntmachung",
      "state": "Schleswig-Holstein",
      "amtsgericht": "Amtsgericht Kiel",
      "registernummer": "HRB 7306",
      "registerart": "HRB",
      "company_name": "freenet AG",
      "company_seat": "Büdelsdorf",
      "details": "23.05.2025 (Bekanntmachungsdatum)\n\nSchleswig-Holstein Amtsgericht Kiel HRB 7306\nSonstige Registerbekanntmachung 22.05.2025 (Eintragungsdatum)\n\nfreenet AG\nAktiengesellschaft\nBüdelsdorf\n\nAls nicht eingetragen wird veröffentlicht: Als nicht eingetragen wird veröffentlicht: Gläubigern, deren Forderungen begründet worden sind, bevor die Eintragung des Beschlusses als nach § 10 des Handelsgesetzbuches bekannt gemacht gilt, ist, wenn sie sich binnen sechs Monaten nach der Bekanntmachung zu diesem Zweck melden, Sicherheit zu leisten, soweit sie nicht Befriedigung verlangen können. Dieses Recht steht den Gläubigern nicht zu, die im Fall des Insolvenzverfahrens ein Recht auf vorzugsweise Befriedigung aus der Deckungsmasse haben, die nach gesetzlicher Vorschrift zu ihrem Schutz errichtet und staatlich überwacht ist."
    },
    {
      "date": "2025-05-23",
      "id": "110063",
      "original_text": "Löschungsankündigung\nBrandenburg Amtsgericht Frankfurt/Oder VR 6147\nNeue Wege - faire Konzepte e.V. – Werneuchen",
      "type": "Löschungsankündigung",
      "state": "Brandenburg",
      "amtsgericht": "Amtsgericht Frankfurt/Oder",
      "registernummer": "VR 6147",
      "registerart": "VR",
      "company_name": "Neue Wege - faire Konzepte e.V.",
      "company_seat": "Werneuchen",
      "details": "23.05.2025 (Bekanntmachungsdatum)\n\nBrandenburg Amtsgericht Frankfurt/Oder VR 6147\nLöschungsankündigung\n\nNeue Wege - faire Konzepte e.V.\neingetragener Verein\nWerneuchen\n\nBei dem nachstehenden Verein wird das Amtslöschungsverfahren gemäß § 395 FamFG eingeleitet."
    },
    {
      "date": "2025-05-23",
      "id": "110064",
      "original_text": "Löschungsankündigung\nBaden-Württemberg Amtsgericht Mannheim HRB 741966\nND 1 GmbH – Karlsruhe",
      "type": "Löschungsankündigung",
      "state": "Baden-Württemberg",
      "amtsgericht": "Amtsgericht Mannheim",
      "registernummer": "HRB 741966",
      "registerart": "HRB",
      "company_name": "ND 1 GmbH",
      "company_seat": "Karlsruhe",
      "details": "23.05.2025 (Bekanntmachungsdatum)\n\nBaden-Württemberg Amtsgericht Mannheim HRB 741966\nLöschungsankündigung\n\nND 1 GmbH\nGesellschaft mit beschränkter Haftung\nKarlsruhe\n\nDas Gericht beabsichtigt, die Gesellschaft wegen Vermögenslosigkeit im Handelsregister von Amts wegen nach § 394 FamFG zu löschen. Die Frist zur Geltendmachung eines Widerspruchs gegen die beabsichtigte Löschung ist auf einen Monat ab Veröffentlichung bestimmt."
    },
    {
      "date": "2025-05-23",
      "id": "110065",
      "original_text": "Registerbekanntmachung nach dem Umwandlungsgesetz\nBaden-Württemberg Amtsgericht Mannheim HRB 721414\nip5 GmbH – Karlsruhe",
      "type": "Registerbekanntmachung nach dem Umwandlungsgesetz",
      "state": "Baden-Württemberg",
      "amtsgericht": "Amtsgericht Mannheim",
      "registernummer": "HRB 721414",
      "registerart": "HRB",
      "company_name": "ip5 GmbH",
      "company_seat": "Karlsruhe",
      "details": "23.05.2025 (Bekanntmachungsdatum)\n\nBaden-Württemberg Amtsgericht Mannheim HRB 721414\nRegisterbekanntmachung nach dem Umwandlungsgesetz 23.05.2025 (Eintragungsdatum)\n\nip5 GmbH\nGesellschaft mit beschränkter Haftung\nKarlsruhe\n\nDen Gläubigern der an der Verschmelzung beteiligten Rechtsträger ist, wenn sie binnen sechs Monaten nach dem Tag, an dem die Eintragung der Verschmelzung in das Register des Sitzes desjenigen Rechtsträgers, dessen Gläubiger sie sind, nach § 19 Abs. 3 UmwG als bekanntgemacht gilt, ihren Anspruch nach Grund und Höhe schriftlich anmelden, Sicherheit zu leisten, soweit sie nicht Befriedigung verlangen können. Dieses Recht steht den Gläubigern jedoch nur zu, wenn sie glaubhaft machen, dass durch die Verschmelzung die Erfüllung ihrer Forderung gefährdet wird."
    },
    {
      "date": "2025-05-23",
      "id": "110066",
      "original_text": "Sonstige Registerbekanntmachung\nSchleswig-Holstein Amtsgericht Pinneberg HRB 13588\nLeo Beteiligungsgesellschaft mbH – Halstenbek",
      "type": "Sonstige Registerbekanntmachung",
      "state": "Schleswig-Holstein",
      "amtsgericht": "Amtsgericht Pinneberg",
      "registernummer": "HRB 13588",
      "registerart": "HRB",
      "company_name": "Leo Beteiligungsgesellschaft mbH",
      "company_seat": "Halstenbek",
      "details": "23.05.2025 (Bekanntmachungsdatum)\n\nSchleswig-Holstein Amtsgericht Pinneberg HRB 13588\nSonstige Registerbekanntmachung\n\nLeo Beteiligungsgesellschaft mbH\nGesellschaft mit beschränkter Haftung\nHalstenbek\n\nAls nicht eingetragen wird veröffentlicht: Gemäß § 308 UmwG § 10 HGB wird bekannt gemacht, dass der Entwurf eines Verschmelzungsplans zwischen der hiesigen Gesellschaft sowie der Affidea B.V., Sitz Den Haag beim Handelsregister eingereicht worden ist.\n1. Der Entwurf des gemeinsamen Verschmelzungsplans mit den Verschmelzungsbedingungen für\neine grenzüberschreitende Verschmelzung zwischen der Leo Beteiligungsgesellschaft mbH (als übertragende Gesellschaft) und der Affidea Diagnostics B.V. (als übernehmende Gesellschaft) ist beim Handelsregister der übertragenden Gesellschaft eingereicht worden. 2. An der grenzüberschreitenden Verschmelzung sind die folgenden Gesellschaften beteiligt:\na) als übertragende Gesellschaft: Die Leo Beteiligungsgesellschaft mbH, eine Gesellschaft mit beschränkter Haftung nach\ndem Recht der Bundesrepublik Deutschland mit Sitz in Halstenbek, Deutschland; b) als übernehmende Gesellschaft:\nAffidea Diagnostics B.V., eine Gesellschaft mit beschränkter Haftung (besloten vennootschap met beperkte aansprakeljkheid) nach dem Recht der Niederlande mit dem Sitz in Den Haag, Niederlande.\n3. Die an der grenzüberschreitenden Verschmelzung beteiligten Gesellschaften sind in den folgenden\nRegistern eingetragen:\na) Die übertragende Gesellschaft Leo Beteiligungsgesellschaft mbH ist eingetragen im Handelsregister\ndes Amtsgerichts Pinneberg unter HRB 13588;\nb) Die übernehmende Gesellschaft Affidea Diagnostics B.V. ist eingetragen im niederländischen Handelsregister unter der Nummer 34119214.\n4. Hinweis zur Möglichkeit der Übermittlung von Bemerkungen zum Verschmelzungsplan Gläubiger und Anteilsinhaber sowie Betriebsräte oder - soweit es keine Betriebsräte gibt - Arbeitnehmer der an der grenzüberschreitenden Verschmelzung beteiligten Gesellschaften haben im Rahmen der grenzüberschreitenden Verschmelzung ein Anhörungsrecht.\nWeder bei der übertragenden noch bei der übernehmenden Gesellschaft sind Arbeitnehmer beschäftigt.\nDemzufolge gibt es weder Arbeitnehmer noch zuständige Arbeitnehmervertretungen (insbesondere Betriebsräte), die im Rahmen der Verschmelzung Rechte geltend machen können, insbesondere Bemerkungen zum Verschmelzungsplan oder dessen Entwurf übermitteln können. Die Gläubiger und Anteilsinhaber der an der Verschmelzung beteiligten Gesellschaften können im Grundsatz bis spätestens fünf Arbeitstage vor dem Tag der Versammlung der Anteilsinhaber, die über die Zustimmung zu dem Verschmelzungsplan beschließen, Bemerkungen zum Verschmelzungsplan bzw. dessen Entwurf übermitteln. Ist eine Versammlung der Anteilsinhaber aufgrund einer Konzernkonstellation nicht erforderlich, können die Bemerkungen von Gläubigern und Anteilsinhabern entsprechend bis spätestens fünf Arbeitstage vor dem Tag, an dem der Verschmelzungsplan beurkundet wird, übermittelt werden (vgl. § 308 Abs. 1S. 1Nr. 4, Abs. 2 UmwG). Da ein Beschluss der Versammlung der Anteilsinhaber der übertragenden Gesellschaft gemäß § 312 Abs. 2 in Verbindung mit§ 307 Abs. 3 Nr. 1 UmwG nicht erforderlich ist, können Gläubiger und Anteilsinhaber der übertragenden Gesellschaft bis spätestens fünf Arbeitstage vor dem Tag, an dem der Verschmelzungsplan beurkundet wird, ihre Bemerkungen zum Verschmelzungsplan\nübermitteln. Die Beurkundung des Verschmelzungsplans in Deutschland wird voraussichtlich am 15. Juli 2025, jedoch in keinem Fall vor diesem Tag erfolgen. Vollständige Auskünfte über die Modalitäten der Ausübung der Rechte der Anteilsinhaber, Gläubiger sowie der Arbeitnehmervertreter und Arbeitnehmer der beteiligten Gesellschaften können unter den folgenden Adressen kostenlos angefordert werden. Dies sind zugleich die Zielanschriften für Bemerkungen zum Verschmelzungsplan:\nAffidea Diagnostics B.V. Zuid-Hollandlaan 7, Spaces Rode Olifant 2595 AL 's-Gravenhage Niederlande"
    },
    {
      "date": "2025-05-23",
      "id": "110067",
      "original_text": "Registerbekanntmachung nach dem Umwandlungsgesetz\nBaden-Württemberg Amtsgericht Stuttgart HRB 763607\nBMB Immobilien Verwaltung GmbH – Stuttgart",
      "type": "Registerbekanntmachung nach dem Umwandlungsgesetz",
      "state": "Baden-Württemberg",
      "amtsgericht": "Amtsgericht Stuttgart",
      "registernummer": "HRB 763607",
      "registerart": "HRB",
      "company_name": "BMB Immobilien Verwaltung GmbH",
      "company_seat": "Stuttgart",
      "details": "23.05.2025 (Bekanntmachungsdatum)\n\nBaden-Württemberg Amtsgericht Stuttgart HRB 763607\nRegisterbekanntmachung nach dem Umwandlungsgesetz 23.05.2025 (Eintragungsdatum)\n\nBMB Immobilien Verwaltung GmbH\nGesellschaft mit beschränkter Haftung\nStuttgart\n\nDen Gläubigern der an der Verschmelzung beteiligten Rechtsträger ist, wenn sie binnen sechs Monaten nach dem Tag, an dem die Eintragung der Verschmelzung in das Register des Sitzes desjenigen Rechtsträgers, dessen Gläubiger sie sind, nach § 19 Abs. 3 UmwG als bekanntgemacht gilt, ihren Anspruch nach Grund und Höhe schriftlich anmelden, Sicherheit zu leisten, soweit sie nicht Befriedigung verlangen können. Dieses Recht steht den Gläubigern jedoch nur zu, wenn sie glaubhaft machen, dass durch die Verschmelzung die Erfüllung ihrer Forderung gefährdet wird."
    },
    {
      "date": "2025-05-23",
      "id": "110068",
      "original_text": "Registerbekanntmachung nach dem Umwandlungsgesetz\nSachsen-Anhalt Amtsgericht Stendal HRB 35659\nARS Betriebsservice GmbH – Merseburg",
      "type": "Registerbekanntmachung nach dem Umwandlungsgesetz",
      "state": "Sachsen-Anhalt",
      "amtsgericht": "Amtsgericht Stendal",
      "registernummer": "HRB 35659",
      "registerart": "HRB",
      "company_name": "ARS Betriebsservice GmbH",
      "company_seat": "Merseburg",
      "details": "23.05.2025 (Bekanntmachungsdatum)\n\nSachsen-Anhalt Amtsgericht Stendal HRB 35659\nRegisterbekanntmachung nach dem Umwandlungsgesetz 23.05.2025 (Eintragungsdatum)\n\nARS Betriebsservice GmbH\nGesellschaft mit beschränkter Haftung\nMerseburg\n\nNicht eingetragen:\nDen Gläubigern der an der Verschmelzung beteiligten Rechtsträger ist, wenn sie binnen sechs Monaten nach dem Tag, an dem die Eintragung der Verschmelzung nach § 19 Abs. 3 UmwG als bekanntgemacht gilt, ihren Anspruch nach Grund und Höhe schriftlich anmelden, Sicherheit zu leisten, soweit sie nicht Befriedigung verlangen können. Dieses Recht steht ihnen jedoch nur zu, wenn sie glaubhaft machen, dass durch die Verschmelzung die Erfüllung ihrer Forderung gefährdet wird."
    },
    {
      "date": "2025-05-23",
      "id": "110069",
      "original_text": "Registerbekanntmachung nach dem Umwandlungsgesetz\nSachsen-Anhalt Amtsgericht Stendal HRB 211086\nARS Betriebsservice GmbH – Merseburg",
      "type": "Registerbekanntmachung nach dem Umwandlungsgesetz",
      "state": "Sachsen-Anhalt",
      "amtsgericht": "Amtsgericht Stendal",
      "registernummer": "HRB 211086",
      "registerart": "HRB",
      "company_name": "ARS Betriebsservice GmbH",
      "company_seat": "Merseburg",
      "details": "23.05.2025 (Bekanntmachungsdatum)\n\nSachsen-Anhalt Amtsgericht Stendal HRB 211086\nRegisterbekanntmachung nach dem Umwandlungsgesetz 23.05.2025 (Eintragungsdatum)\n\nARS Betriebsservice GmbH\nGesellschaft mit beschränkter Haftung\nMerseburg\n\nNicht eingetragen:\nDen Gläubigern der an der Verschmelzung beteiligten Rechtsträger ist, wenn sie binnen sechs Monaten nach dem Tag, an dem die Eintragung der Verschmelzung nach § 19 Abs. 3 UmwG als bekanntgemacht gilt, ihren Anspruch nach Grund und Höhe schriftlich anmelden, Sicherheit zu leisten, soweit sie nicht Befriedigung verlangen können. Dieses Recht steht ihnen jedoch nur zu, wenn sie glaubhaft machen, dass durch die Verschmelzung die Erfüllung ihrer Forderung gefährdet wird."
    },
    {
      "date": "2025-05-23",
      "id": "110070",
      "original_text": "Registerbekanntmachung nach dem Umwandlungsgesetz\nHamburg Amtsgericht Hamburg HRB 112100\nBauer Polen Invest GmbH – Hamburg",
      "type": "Registerbekanntmachung nach dem Umwandlungsgesetz",
      "state": "Hamburg",
      "amtsgericht": "Amtsgericht Hamburg",
      "registernummer": "HRB 112100",
      "registerart": "HRB",
      "company_name": "Bauer Polen Invest GmbH",
      "company_seat": "Hamburg",
      "details": "23.05.2025 (Bekanntmachungsdatum)\n\nHamburg Amtsgericht Hamburg HRB 112100\nRegisterbekanntmachung nach dem Umwandlungsgesetz 23.05.2025 (Eintragungsdatum)\n\nBauer Polen Invest GmbH\nGesellschaft mit beschränkter Haftung\nHamburg\n\nAls nicht eingetragen wird bekannt gemacht:\nDen Gläubigern der an der Verschmelzung beteiligten Gesellschaften ist, wenn sie binnen sechs Monaten nach dem Tag, an dem die Eintragung der Verschmelzung in das Register des Sitzes desjenigen Rechtsträgers, dessen Gläubiger sie sind, nach § 19 Absatz 3 UmwG als bekannt gemacht gilt, ihren Anspruch nach Grund und Höhe schriftlich anmelden, Sicherheit zu leisten, soweit sie nicht Befriedigung verlangen können. Dieses Recht steht den Gläubigern jedoch nur zu, wenn sie glaubhaft machen, dass durch die Verschmelzung die Erfüllung ihrer Forderung gefährdet wird."
    },
    {
      "date": "2025-05-23",
      "id": "110071",
      "original_text": "Registerbekanntmachung nach dem Umwandlungsgesetz\nHamburg Amtsgericht Hamburg HRB 32176\nHeinrich Bauer Verlag Beteiligungs GmbH – Hamburg",
      "type": "Registerbekanntmachung nach dem Umwandlungsgesetz",
      "state": "Hamburg",
      "amtsgericht": "Amtsgericht Hamburg",
      "registernummer": "HRB 32176",
      "registerart": "HRB",
      "company_name": "Heinrich Bauer Verlag Beteiligungs GmbH",
      "company_seat": "Hamburg",
      "details": "23.05.2025 (Bekanntmachungsdatum)\n\nHamburg Amtsgericht Hamburg HRB 32176\nRegisterbekanntmachung nach dem Umwandlungsgesetz 23.05.2025 (Eintragungsdatum)\n\nHeinrich Bauer Verlag Beteiligungs GmbH\nGesellschaft mit beschränkter Haftung\nHamburg\n\nAls nicht eingetragen wird bekannt gemacht:\nDen Gläubigern der an der Verschmelzung beteiligten Gesellschaften ist, wenn sie binnen sechs Monaten nach dem Tag, an dem die Eintragung der Verschmelzung in das Register des Sitzes desjenigen Rechtsträgers, dessen Gläubiger sie sind, nach § 19 Absatz 3 UmwG als bekannt gemacht gilt, ihren Anspruch nach Grund und Höhe schriftlich anmelden, Sicherheit zu leisten, soweit sie nicht Befriedigung verlangen können. Dieses Recht steht den Gläubigern jedoch nur zu, wenn sie glaubhaft machen, dass durch die Verschmelzung die Erfüllung ihrer Forderung gefährdet wird."
    },
    {
      "date": "2025-05-23",
      "id": "110072",
      "original_text": "Registerbekanntmachung nach dem Umwandlungsgesetz\nBaden-Württemberg Amtsgericht Mannheim HRB 740905\nHEDGEHOG Software GmbH – Karlsruhe",
      "type": "Registerbekanntmachung nach dem Umwandlungsgesetz",
      "state": "Baden-Württemberg",
      "amtsgericht": "Amtsgericht Mannheim",
      "registernummer": "HRB 740905",
      "registerart": "HRB",
      "company_name": "HEDGEHOG Software GmbH",
      "company_seat": "Karlsruhe",
      "details": "23.05.2025 (Bekanntmachungsdatum)\n\nBaden-Württemberg Amtsgericht Mannheim HRB 740905\nRegisterbekanntmachung nach dem Umwandlungsgesetz 23.05.2025 (Eintragungsdatum)\n\nHEDGEHOG Software GmbH\nGesellschaft mit beschränkter Haftung\nKarlsruhe\n\nAls nicht eingetragen wird bekanntgemacht:\nDen Gläubigern der an der Verschmelzung beteiligten Rechtsträger ist, wenn sie binnen sechs Monaten nach dem Tag, an dem die Eintragung der Verschmelzung in das Register des Sitzes desjenigen Rechtsträgers, dessen Gläubiger sie sind, nach § 19 Abs. 3 UmwG als bekanntgemacht gilt, ihren Anspruch nach Grund und Höhe schriftlich anmelden, Sicherheit zu leisten, soweit sie nicht Befriedigung verlangen können. Dieses Recht steht den Gläubigern jedoch nur zu, wenn sie glaubhaft machen, dass durch die Verschmelzung die Erfüllung ihrer Forderung gefährdet wird."
    },
    {
      "date": "2025-05-23",
      "id": "110073",
      "original_text": "Registerbekanntmachung nach dem Umwandlungsgesetz\nBaden-Württemberg Amtsgericht Mannheim HRB 722922\nMektec Manufacturing Corporation Europe DE GmbH – Weinheim",
      "type": "Registerbekanntmachung nach dem Umwandlungsgesetz",
      "state": "Baden-Württemberg",
      "amtsgericht": "Amtsgericht Mannheim",
      "registernummer": "HRB 722922",
      "registerart": "HRB",
      "company_name": "Mektec Manufacturing Corporation Europe DE GmbH",
      "company_seat": "Weinheim",
      "details": "23.05.2025 (Bekanntmachungsdatum)\n\nBaden-Württemberg Amtsgericht Mannheim HRB 722922\nRegisterbekanntmachung nach dem Umwandlungsgesetz 23.05.2025 (Eintragungsdatum)\n\nMektec Manufacturing Corporation Europe DE GmbH\nGesellschaft mit beschränkter Haftung\nWeinheim\n\nDen Gläubigern der an der Verschmelzung beteiligten Rechtsträger ist, wenn sie binnen sechs Monaten nach dem Tag, an dem die Eintragung der Verschmelzung in das Register des Sitzes desjenigen Rechtsträgers, dessen Gläubiger sie sind, nach § 19 Abs. 3 UmwG als bekanntgemacht gilt, ihren Anspruch nach Grund und Höhe schriftlich anmelden, Sicherheit zu leisten, soweit sie nicht Befriedigung verlangen können. Dieses Recht steht den Gläubigern jedoch nur zu, wenn sie glaubhaft machen, dass durch die Verschmelzung die Erfüllung ihrer Forderung gefährdet wird."
    },
    {
      "date": "2025-05-23",
      "id": "110074",
      "original_text": "Registerbekanntmachung nach dem Umwandlungsgesetz\nSchleswig-Holstein Amtsgericht Kiel VR 3403\nBerufsbildungswerk der Versicherungswirtschaft (BWV) Schleswig-Holstein/Mecklenburg-Vorpommern e. V. – Kiel",
      "type": "Registerbekanntmachung nach dem Umwandlungsgesetz",
      "state": "Schleswig-Holstein",
      "amtsgericht": "Amtsgericht Kiel",
      "registernummer": "VR 3403",
      "registerart": "VR",
      "company_name": "Berufsbildungswerk der Versicherungswirtschaft (BWV) Schleswig-Holstein/Mecklenburg-Vorpommern e. V.",
      "company_seat": "Kiel",
      "details": "23.05.2025 (Bekanntmachungsdatum)\n\nSchleswig-Holstein Amtsgericht Kiel VR 3403\nRegisterbekanntmachung nach dem Umwandlungsgesetz 22.05.2025 (Eintragungsdatum)\n\nBerufsbildungswerk der Versicherungswirtschaft (BWV) Schleswig-Holstein/Mecklenburg-Vorpommern e. V.\neingetragener Verein\nKiel\n\nZu Eintragungsnummer 9 vom 22.05.2025 wird als nicht eingetragen veröffentlicht: Den Gläubigern der an der Verschmelzung beteiligten Rechtsträger ist, wenn sie binnen sechs Monaten nach dem Tag, an dem die Eintragung der Verschmelzung in das Register des Sitzes desjenigen Rechtsträgers, dessen Gläubiger sie sind, nach § 19 Abs. 3 UmwG bekannt gemacht worden ist, ihren Anspruch nach Grund und Höhe schriftlich anmelden, Sicherheit zu leisten, soweit sie nicht Befriedigung verlangen können. Dieses Recht steht den Gläubigern jedoch nur zu, wenn sie glaubhaft machen, dass durch die Verschmelzung die Erfüllung ihrer Forderung gefährdet wird."
    },
    {
      "date": "2025-05-23",
      "id": "110075",
      "original_text": "Einreichung neuer Dokumente\nBerlin Amtsgericht Berlin (Charlottenburg) HRB 166467\nGrover Group GmbH – Berlin",
      "type": "Einreichung neuer Dokumente",
      "state": "Berlin",
      "amtsgericht": "Amtsgericht Berlin (Charlottenburg)",
      "registernummer": "HRB 166467",
      "registerart": "HRB",
      "company_name": "Grover Group GmbH",
      "company_seat": "Berlin",
      "details": "23.05.2025 (Bekanntmachungsdatum)\n\nBerlin Amtsgericht Berlin (Charlottenburg) HRB 166467\nEinreichung neuer Dokumente\n\nGrover Group GmbH\nGesellschaft mit beschränkter Haftung\nBerlin\n\nAls nicht eingetragen wird veröffentlicht: Es wurde eine neue Liste der Beiratsmitglieder eingereicht (§52 GmbHG)."
    },
    {
      "date": "2025-05-23",
      "id": "110076",
      "original_text": "Einreichung neuer Dokumente\nSchleswig-Holstein Amtsgericht Lübeck HRB 22856\nMondo Gate Aktiengesellschaft – Neustadt in Holstein",
      "type": "Einreichung neuer Dokumente",
      "state": "Schleswig-Holstein",
      "amtsgericht": "Amtsgericht Lübeck",
      "registernummer": "HRB 22856",
      "registerart": "HRB",
      "company_name": "Mondo Gate Aktiengesellschaft",
      "company_seat": "Neustadt in Holstein",
      "details": "23.05.2025 (Bekanntmachungsdatum)\n\nSchleswig-Holstein Amtsgericht Lübeck HRB 22856\nEinreichung neuer Dokumente\n\nMondo Gate Aktiengesellschaft\nAktiengesellschaft\nNeustadt in Holstein\n\nAls nicht eingetragen wird veröffentlicht: Die Gesellschaft hat eine aktuelle Liste der Aufsichtsratsmitglieder zum Handelsregister eingereicht"
    },
    {
      "date": "2025-05-23",
      "id": "110077",
      "original_text": "Sonstige Registerbekanntmachung\nBerlin Amtsgericht Berlin (Charlottenburg) HRB 191155\nDomicil Seniorenheim GmbH – Berlin",
      "type": "Sonstige Registerbekanntmachung",
      "state": "Berlin",
      "amtsgericht": "Amtsgericht Berlin (Charlottenburg)",
      "registernummer": "HRB 191155",
      "registerart": "HRB",
      "company_name": "Domicil Seniorenheim GmbH",
      "company_seat": "Berlin",
      "details": "23.05.2025 (Bekanntmachungsdatum)\n\nBerlin Amtsgericht Berlin (Charlottenburg) HRB 191155\nSonstige Registerbekanntmachung\n\nDomicil Seniorenheim GmbH\nGesellschaft mit beschränkter Haftung\nBerlin\n\nAls nicht eingetragen wird veröffentlicht: Der andere Vertragsteil hat den Gläubigern dieses Rechtsträgers, deren Forderungen begründet worden sind, bevor die Eintragung der Beendigung dieses Vertrages in das Handelsregister nach § 10 des Handelsgesetzbuches als bekannt gemacht gilt, Sicherheit zu leisten, wenn sie sich binnen sechs Monaten nach der Bekanntmachung der Eintragung zu diesem Zweck bei ihm melden. Dieses Recht steht den Gläubigern nicht zu, die im Fall des Insolvenzverfahrens ein Recht auf vorzugsweise Befriedigung aus der Deckungsmasse haben, die nach gesetzlicher Vorschrift zu ihrem Schutz errichtet und staatlich überwacht ist."
    },
    {
      "date": "2025-05-23",
      "id": "110078",
      "original_text": "Sonstige Registerbekanntmachung\nBerlin Amtsgericht Berlin (Charlottenburg) HRB 191179\nDomicil Am Klostergarten GmbH – Berlin",
      "type": "Sonstige Registerbekanntmachung",
      "state": "Berlin",
      "amtsgericht": "Amtsgericht Berlin (Charlottenburg)",
      "registernummer": "HRB 191179",
      "registerart": "HRB",
      "company_name": "Domicil Am Klostergarten GmbH",
      "company_seat": "Berlin",
      "details": "23.05.2025 (Bekanntmachungsdatum)\n\nBerlin Amtsgericht Berlin (Charlottenburg) HRB 191179\nSonstige Registerbekanntmachung\n\nDomicil Am Klostergarten GmbH\nGesellschaft mit beschränkter Haftung\nBerlin\n\nAls nicht eingetragen wird veröffentlicht: Der andere Vertragsteil hat den Gläubigern dieses Rechtsträgers, deren Forderungen begründet worden sind, bevor die Eintragung der Beendigung dieses Vertrages in das Handelsregister nach § 10 des Handelsgesetzbuches als bekannt gemacht gilt, Sicherheit zu leisten, wenn sie sich binnen sechs Monaten nach der Bekanntmachung der Eintragung zu diesem Zweck bei ihm melden. Dieses Recht steht den Gläubigern nicht zu, die im Fall des Insolvenzverfahrens ein Recht auf vorzugsweise Befriedigung aus der Deckungsmasse haben, die nach gesetzlicher Vorschrift zu ihrem Schutz errichtet und staatlich überwacht ist."
    },
    {
      "date": "2025-05-23",
      "id": "110079",
      "original_text": "Registerbekanntmachung nach dem Umwandlungsgesetz\nBerlin Amtsgericht Berlin (Charlottenburg) HRA 43434\nRobert Werner Hausverwaltungen e.K. – Berlin",
      "type": "Registerbekanntmachung nach dem Umwandlungsgesetz",
      "state": "Berlin",
      "amtsgericht": "Amtsgericht Berlin (Charlottenburg)",
      "registernummer": "HRA 43434",
      "registerart": "HRA",
      "company_name": "Robert Werner Hausverwaltungen e.K.",
      "company_seat": "Berlin",
      "details": "23.05.2025 (Bekanntmachungsdatum)\n\nBerlin Amtsgericht Berlin (Charlottenburg) HRA 43434\nRegisterbekanntmachung nach dem Umwandlungsgesetz 21.05.2025 (Eintragungsdatum)\n\nRobert Werner Hausverwaltungen e.K.\nEinzelkaufmann / Einzelkauffrau\nBerlin\n\nZu Eintragungsnummer 2 vom 21.05.2025 wird als nicht eingetragen veröffentlicht:\nDen Gläubigern der an der Spaltung beteiligten Rechtsträger ist, wenn sie binnen sechs Monaten nach dem Tag, an dem die Eintragung der Spaltung in das Register des Sitzes desjenigen Rechtsträgers, dessen Gläubiger sie sind, als bekannt gemacht gilt, ihren Anspruch nach Grund und Höhe schriftlich anmelden, Sicherheit zu leisten, soweit sie nicht Befriedigung verlangen können. Dieses Recht steht den Gläubigern jedoch nur zu, wenn sie glaubhaft machen, dass durch die Spaltung die Erfüllung ihrer Forderung gefährdet wird. Das Recht, Sicherheitsleistung zu verlangen, steht Gläubigern nicht zu, die im Falle der Insolvenz ein Recht auf vorzugsweise Befriedigung aus einer Deckungsmasse haben, die nach gesetzlicher Vorschrift zu ihrem Schutz errichtet und staatlich überwacht ist."
    },
    {
      "date": "2025-05-23",
      "id": "110080",
      "original_text": "Registerbekanntmachung nach dem Umwandlungsgesetz\nBerlin Amtsgericht Berlin (Charlottenburg) HRB 275320\nRobert Werner Hausverwaltungen GmbH – Berlin",
      "type": "Registerbekanntmachung nach dem Umwandlungsgesetz",
      "state": "Berlin",
      "amtsgericht": "Amtsgericht Berlin (Charlottenburg)",
      "registernummer": "HRB 275320",
      "registerart": "HRB",
      "company_name": "Robert Werner Hausverwaltungen GmbH",
      "company_seat": "Berlin",
      "details": "23.05.2025 (Bekanntmachungsdatum)\n\nBerlin Amtsgericht Berlin (Charlottenburg) HRB 275320\nRegisterbekanntmachung nach dem Umwandlungsgesetz 21.05.2025 (Eintragungsdatum)\n\nRobert Werner Hausverwaltungen GmbH\nGesellschaft mit beschränkter Haftung\nBerlin\n\nZu Eintragungsnummer 1 vom 21.05.2025 wird als nicht eingetragen veröffentlicht:\nDen Gläubigern der an der Spaltung beteiligten Rechtsträger ist, wenn sie binnen sechs Monaten nach dem Tag, an dem die Eintragung der Spaltung in das Register des Sitzes desjenigen Rechtsträgers, dessen Gläubiger sie sind, als bekannt gemacht gilt, ihren Anspruch nach Grund und Höhe schriftlich anmelden, Sicherheit zu leisten, soweit sie nicht Befriedigung verlangen können. Dieses Recht steht den Gläubigern jedoch nur zu, wenn sie glaubhaft machen, dass durch die Spaltung die Erfüllung ihrer Forderung gefährdet wird. Das Recht, Sicherheitsleistung zu verlangen, steht Gläubigern nicht zu, die im Falle der Insolvenz ein Recht auf vorzugsweise Befriedigung aus einer Deckungsmasse haben, die nach gesetzlicher Vorschrift zu ihrem Schutz errichtet und staatlich überwacht ist."
    },
    {
      "date": "2025-05-23",
      "id": "110081",
      "original_text": "Registerbekanntmachung nach dem Umwandlungsgesetz\nBaden-Württemberg Amtsgericht Freiburg HRB 713354\nELIQUO KGSTULZ GmbH – Grafenhausen",
      "type": "Registerbekanntmachung nach dem Umwandlungsgesetz",
      "state": "Baden-Württemberg",
      "amtsgericht": "Amtsgericht Freiburg",
      "registernummer": "HRB 713354",
      "registerart": "HRB",
      "company_name": "ELIQUO KGSTULZ GmbH",
      "company_seat": "Grafenhausen",
      "details": "23.05.2025 (Bekanntmachungsdatum)\n\nBaden-Württemberg Amtsgericht Freiburg HRB 713354\nRegisterbekanntmachung nach dem Umwandlungsgesetz 23.05.2025 (Eintragungsdatum)\n\nELIQUO KGSTULZ GmbH\nGesellschaft mit beschränkter Haftung\nGrafenhausen\n\nDen Gläubigern der an der Verschmelzung beteiligten Rechtsträger ist, wenn sie binnen sechs Monaten nach dem Tag, an dem die Eintragung der Verschmelzung in das Register des Sitzes desjenigen Rechtsträgers, dessen Gläubiger sie sind, nach § 19 Abs. 3 UmwG als bekanntgemacht gilt, ihren Anspruch nach Grund und Höhe schriftlich anmelden, Sicherheit zu leisten, soweit sie nicht Befriedigung verlangen können. Dieses Recht steht den Gläubigern jedoch nur zu, wenn sie glaubhaft machen, dass durch die Verschmelzung die Erfüllung ihrer Forderung gefährdet wird."
    },
    {
      "date": "2025-05-23",
      "id": "110082",
      "original_text": "Registerbekanntmachung nach dem Umwandlungsgesetz\nBerlin Amtsgericht Berlin (Charlottenburg) HRA 63157\nAufzugsverbund Deutschland GmbH & Co. KG – Berlin",
      "type": "Registerbekanntmachung nach dem Umwandlungsgesetz",
      "state": "Berlin",
      "amtsgericht": "Amtsgericht Berlin (Charlottenburg)",
      "registernummer": "HRA 63157",
      "registerart": "HRA",
      "company_name": "Aufzugsverbund Deutschland GmbH & Co. KG",
      "company_seat": "Berlin",
      "details": "23.05.2025 (Bekanntmachungsdatum)\n\nBerlin Amtsgericht Berlin (Charlottenburg) HRA 63157\nRegisterbekanntmachung nach dem Umwandlungsgesetz 19.05.2025 (Eintragungsdatum)\n\nAufzugsverbund Deutschland GmbH & Co. KG\nKommanditgesellschaft\nBerlin\n\nZu Eintragungsnummer 15 vom 19.05.2025 wird als nicht eingetragen veröffentlicht:\nDen Gläubigern der an der Verschmelzung beteiligten Rechtsträger ist, wenn sie binnen sechs Monaten nach dem Tag, an dem die Eintragung der Verschmelzung in das Register des Sitzes desjenigen Rechtsträgers, dessen Gläubiger sie sind, als bekannt gemacht gilt, ihren Anspruch nach Grund und Höhe schriftlich anmelden, Sicherheit zu leisten, soweit sie nicht Befriedigung verlangen können. Dieses Recht steht den Gläubigern jedoch nur zu, wenn sie glaubhaft machen, dass durch die Verschmelzung die Erfüllung ihrer Forderung gefährdet wird. Das Recht, Sicherheitsleistung zu verlangen, steht Gläubigern nicht zu, die im Falle der Insolvenz ein Recht auf vorzugsweise Befriedigung aus einer Deckungsmasse haben, die nach gesetzlicher Vorschrift zu ihrem Schutz errichtet und staatlich überwacht ist."
    },
    {
      "date": "2025-05-23",
      "id": "110083",
      "original_text": "Registerbekanntmachung nach dem Umwandlungsgesetz\nBerlin Amtsgericht Berlin (Charlottenburg) HRA 63157\nAufzugsverbund Deutschland GmbH & Co. KG – Berlin",
      "type": "Registerbekanntmachung nach dem Umwandlungsgesetz",
      "state": "Berlin",
      "amtsgericht": "Amtsgericht Berlin (Charlottenburg)",
      "registernummer": "HRA 63157",
      "registerart": "HRA",
      "company_name": "Aufzugsverbund Deutschland GmbH & Co. KG",
      "company_seat": "Berlin",
      "details": "23.05.2025 (Bekanntmachungsdatum)\n\nBerlin Amtsgericht Berlin (Charlottenburg) HRA 63157\nRegisterbekanntmachung nach dem Umwandlungsgesetz 22.05.2025 (Eintragungsdatum)\n\nAufzugsverbund Deutschland GmbH & Co. KG\nKommanditgesellschaft\nBerlin\n\nZu Eintragungsnummer 16 vom 22.05.2025 wird als nicht eingetragen veröffentlicht:\nDen Gläubigern der an der Verschmelzung beteiligten Rechtsträger ist, wenn sie binnen sechs Monaten nach dem Tag, an dem die Eintragung der Verschmelzung in das Register des Sitzes desjenigen Rechtsträgers, dessen Gläubiger sie sind, als bekannt gemacht gilt, ihren Anspruch nach Grund und Höhe schriftlich anmelden, Sicherheit zu leisten, soweit sie nicht Befriedigung verlangen können. Dieses Recht steht den Gläubigern jedoch nur zu, wenn sie glaubhaft machen, dass durch die Verschmelzung die Erfüllung ihrer Forderung gefährdet wird. Das Recht, Sicherheitsleistung zu verlangen, steht Gläubigern nicht zu, die im Falle der Insolvenz ein Recht auf vorzugsweise Befriedigung aus einer Deckungsmasse haben, die nach gesetzlicher Vorschrift zu ihrem Schutz errichtet und staatlich überwacht ist."
    },
    {
      "date": "2025-05-23",
      "id": "110084",
      "original_text": "Registerbekanntmachung nach dem Umwandlungsgesetz\nSchleswig-Holstein Amtsgericht Pinneberg VR 1192 EL\nMarchingband Red Diamonds Elmshorn – Elmshorn",
      "type": "Registerbekanntmachung nach dem Umwandlungsgesetz",
      "state": "Schleswig-Holstein",
      "amtsgericht": "Amtsgericht Pinneberg",
      "registernummer": "VR 1192 EL",
      "registerart": "VR",
      "company_name": "Marchingband Red Diamonds Elmshorn",
      "company_seat": "Elmshorn",
      "details": "23.05.2025 (Bekanntmachungsdatum)\n\nSchleswig-Holstein Amtsgericht Pinneberg VR 1192 EL\nRegisterbekanntmachung nach dem Umwandlungsgesetz 21.05.2025 (Eintragungsdatum)\n\nMarchingband Red Diamonds Elmshorn\neingetragener Verein\nElmshorn\n\nZu Eintragungsnummer 4 vom 21.05.2025 wird als nicht eingetragen veröffentlicht:  Als nicht eingetragen wird veröffentlicht: Den Gläubigern der an der Verschmelzung beteiligten Rechtsträger ist, wenn sie binnen sechs Monaten nach dem Tag, an dem die Eintragung der Verschmelzung in das Register des Sitzes desjenigen Rechtsträgers, dessen Gläubiger sie sind, als bekannt gemacht gilt, ihren Anspruch nach Grund und Höhe schriftlich anmelden, Sicherheit zu leisten, soweit sie nicht Befriedigung verlangen können. Dieses Recht steht den Gläubigern jedoch nur zu, wenn sie glaubhaft machen, dass durch die Verschmelzung die Erfüllung ihrer Forderung gefährdet wird. Das Recht, Sicherheitsleistung zu verlangen, steht Gläubigern nicht zu, die im Falle der Insolvenz ein Recht auf vorzugsweise Befriedigung aus einer Deckungsmasse haben, die nach gesetzlicher Vorschrift zu ihrem Schutz errichtet und staatlich überwacht ist."
    },
    {
      "date": "2025-05-23",
      "id": "110085",
      "original_text": "Registerbekanntmachung nach dem Umwandlungsgesetz\nBerlin Amtsgericht Berlin (Charlottenburg) HRA 58437\nNeXtWind Windpark Beteiligung III GmbH & Co. KG – Berlin",
      "type": "Registerbekanntmachung nach dem Umwandlungsgesetz",
      "state": "Berlin",
      "amtsgericht": "Amtsgericht Berlin (Charlottenburg)",
      "registernummer": "HRA 58437",
      "registerart": "HRA",
      "company_name": "NeXtWind Windpark Beteiligung III GmbH & Co. KG",
      "company_seat": "Berlin",
      "details": "23.05.2025 (Bekanntmachungsdatum)\n\nBerlin Amtsgericht Berlin (Charlottenburg) HRA 58437\nRegisterbekanntmachung nach dem Umwandlungsgesetz 22.05.2025 (Eintragungsdatum)\n\nNeXtWind Windpark Beteiligung III GmbH & Co. KG\nKommanditgesellschaft\nBerlin\n\nZu Eintragungsnummer 3 vom 22.05.2025 wird als nicht eingetragen veröffentlicht:Den Gläubigern der an der Spaltung beteiligten Rechtsträger ist, wenn sie binnen sechs Monaten nach dem Tag, an dem die Eintragung der Spaltung in das Register des Sitzes desjenigen Rechtsträgers, dessen Gläubiger sie sind, als bekannt gemacht gilt, ihren Anspruch nach Grund und Höhe schriftlich anmelden, Sicherheit zu leisten, soweit sie nicht Befriedigung verlangen können. Dieses Recht steht den Gläubigern jedoch nur zu, wenn sie glaubhaft machen, dass durch die Spaltung die Erfüllung ihrer Forderung gefährdet wird. Das Recht, Sicherheitsleistung zu verlangen, steht Gläubigern nicht zu, die im Falle der Insolvenz ein Recht auf vorzugsweise Befriedigung aus einer Deckungsmasse haben, die nach gesetzlicher Vorschrift zu ihrem Schutz errichtet und staatlich überwacht ist."
    },
    {
      "date": "2025-05-23",
      "id": "110086",
      "original_text": "Registerbekanntmachung nach dem Umwandlungsgesetz\nBerlin Amtsgericht Berlin (Charlottenburg) HRA 63210\nNeXtWind Windpark Beteiligung 29 GmbH & Co. KG – Berlin",
      "type": "Registerbekanntmachung nach dem Umwandlungsgesetz",
      "state": "Berlin",
      "amtsgericht": "Amtsgericht Berlin (Charlottenburg)",
      "registernummer": "HRA 63210",
      "registerart": "HRA",
      "company_name": "NeXtWind Windpark Beteiligung 29 GmbH & Co. KG",
      "company_seat": "Berlin",
      "details": "23.05.2025 (Bekanntmachungsdatum)\n\nBerlin Amtsgericht Berlin (Charlottenburg) HRA 63210\nRegisterbekanntmachung nach dem Umwandlungsgesetz 22.05.2025 (Eintragungsdatum)\n\nNeXtWind Windpark Beteiligung 29 GmbH & Co. KG\nKommanditgesellschaft\nBerlin\n\nZu Eintragungsnummer 3 vom 22.05.2025 wird als nicht eingetragen veröffentlicht:Den Gläubigern der an der Spaltung beteiligten Rechtsträger ist, wenn sie binnen sechs Monaten nach dem Tag, an dem die Eintragung der Spaltung in das Register des Sitzes desjenigen Rechtsträgers, dessen Gläubiger sie sind, als bekannt gemacht gilt, ihren Anspruch nach Grund und Höhe schriftlich anmelden, Sicherheit zu leisten, soweit sie nicht Befriedigung verlangen können. Dieses Recht steht den Gläubigern jedoch nur zu, wenn sie glaubhaft machen, dass durch die Spaltung die Erfüllung ihrer Forderung gefährdet wird. Das Recht, Sicherheitsleistung zu verlangen, steht Gläubigern nicht zu, die im Falle der Insolvenz ein Recht auf vorzugsweise Befriedigung aus einer Deckungsmasse haben, die nach gesetzlicher Vorschrift zu ihrem Schutz errichtet und staatlich überwacht ist."
    },
    {
      "date": "2025-05-23",
      "id": "110087",
      "original_text": "Einreichung neuer Dokumente\nBaden-Württemberg Amtsgericht Stuttgart HRB 726261\nAesculap AG – Tuttlingen",
      "type": "Einreichung neuer Dokumente",
      "state": "Baden-Württemberg",
      "amtsgericht": "Amtsgericht Stuttgart",
      "registernummer": "HRB 726261",
      "registerart": "HRB",
      "company_name": "Aesculap AG",
      "company_seat": "Tuttlingen",
      "details": "23.05.2025 (Bekanntmachungsdatum)\n\nBaden-Württemberg Amtsgericht Stuttgart HRB 726261\nEinreichung neuer Dokumente\n\nAesculap AG\nAktiengesellschaft\nTuttlingen\n\nDie Gesellschaft hat am 21.05.2025 die Liste über die Zusammensetzung des Aufsichtsrats zum Handelsregister eingereicht."
    },
    {
      "date": "2025-05-23",
      "id": "110088",
      "original_text": "Einreichung neuer Dokumente\nSachsen Amtsgericht Chemnitz HRB 1360\nVogtlandmilch GmbH – Plauen",
      "type": "Einreichung neuer Dokumente",
      "state": "Sachsen",
      "amtsgericht": "Amtsgericht Chemnitz",
      "registernummer": "HRB 1360",
      "registerart": "HRB",
      "company_name": "Vogtlandmilch GmbH",
      "company_seat": "Plauen",
      "details": "23.05.2025 (Bekanntmachungsdatum)\n\nSachsen Amtsgericht Chemnitz HRB 1360\nEinreichung neuer Dokumente 23.05.2025 (Eintragungsdatum)\n\nVogtlandmilch GmbH\nGesellschaft mit beschränkter Haftung\nPlauen\n\nAm 22.05.2025 wurde beim Handelsregister des Amtsgerichts Chemnitz die Liste der Mitglieder des Aufsichtsrats gemäß § 52 GmbHG eingereicht."
    },
    {
      "date": "2025-05-23",
      "id": "110089",
      "original_text": "Registerbekanntmachung nach dem Umwandlungsgesetz\nNiedersachsen Amtsgericht Hannover VR 4415\nDeutsche Verkehrswacht- Verkehrswacht Hannover - Stadt – Hannover",
      "type": "Registerbekanntmachung nach dem Umwandlungsgesetz",
      "state": "Niedersachsen",
      "amtsgericht": "Amtsgericht Hannover",
      "registernummer": "VR 4415",
      "registerart": "VR",
      "company_name": "Deutsche Verkehrswacht- Verkehrswacht Hannover - Stadt",
      "company_seat": "Hannover",
      "details": "23.05.2025 (Bekanntmachungsdatum)\n\nNiedersachsen Amtsgericht Hannover VR 4415\nRegisterbekanntmachung nach dem Umwandlungsgesetz 23.05.2025 (Eintragungsdatum)\n\nDeutsche Verkehrswacht- Verkehrswacht Hannover - Stadt\neingetragener Verein\nHannover\n\nDen Gläubigern der an der Verschmelzung beteiligten Rechtsträger ist, wenn sie binnen sechs Monaten nach dem Tag, an dem die Eintragung der Verschmelzung in das Register des Sitzes desjenigen Rechtsträgers, dessen Gläubiger sie sind, nach § 19  Abs.  3 UmwG als bekannt gemacht gilt, ihren Anspruch nach Grund und Höhe schriftlich anmelden, Sicherheit zu leisten, soweit sie nicht Befriedigung verlangen können. Dieses Recht steht den Gläubigern jedoch nur zu, wenn sie glaubhaft machen, dass durch die Verschmelzung die Erfüllung der Forderung gefährdet wird."
    },
    {
      "date": "2025-05-23",
      "id": "110090",
      "original_text": "Registerbekanntmachung nach dem Umwandlungsgesetz\nNiedersachsen Amtsgericht Hannover VR 4429\nDeutsche Verkehrswacht - Verkehrswacht in der Region Hannover e. V. – Hannover",
      "type": "Registerbekanntmachung nach dem Umwandlungsgesetz",
      "state": "Niedersachsen",
      "amtsgericht": "Amtsgericht Hannover",
      "registernummer": "VR 4429",
      "registerart": "VR",
      "company_name": "Deutsche Verkehrswacht - Verkehrswacht in der Region Hannover e. V.",
      "company_seat": "Hannover",
      "details": "23.05.2025 (Bekanntmachungsdatum)\n\nNiedersachsen Amtsgericht Hannover VR 4429\nRegisterbekanntmachung nach dem Umwandlungsgesetz 23.05.2025 (Eintragungsdatum)\n\nDeutsche Verkehrswacht - Verkehrswacht in der Region Hannover e. V.\neingetragener Verein\nHannover\n\nDen Gläubigern der an der Verschmelzung beteiligten Rechtsträger ist, wenn sie binnen sechs Monaten nach dem Tag, an dem die Eintragung der Verschmelzung in das Register des Sitzes desjenigen Rechtsträgers, dessen Gläubiger sie sind, nach § 19  Abs.  3 UmwG als bekannt gemacht gilt, ihren Anspruch nach Grund und Höhe schriftlich anmelden, Sicherheit zu leisten, soweit sie nicht Befriedigung verlangen können. Dieses Recht steht den Gläubigern jedoch nur zu, wenn sie glaubhaft machen, dass durch die Verschmelzung die Erfüllung der Forderung gefährdet wird."
    },
    {
      "date": "2025-05-23",
      "id": "110091",
      "original_text": "Löschungsankündigung\nNiedersachsen Amtsgericht Aurich HRA 100652 früher Amtsgericht Emden\nMS \"Frisian Star\" Schiffahrts GmbH & Co. KG – Emden",
      "type": "Löschungsankündigung",
      "state": "Niedersachsen",
      "amtsgericht": "Amtsgericht Aurich",
      "registernummer": "HRA 100652",
      "registerart": "HRA",
      "company_name": "MS \"Frisian Star\" Schiffahrts GmbH & Co. KG",
      "company_seat": "Emden",
      "former_amtsgericht": "Emden",
      "details": "23.05.2025 (Bekanntmachungsdatum)\n\nNiedersachsen Amtsgericht Aurich HRA 100652 früher Amtsgericht Emden\nLöschungsankündigung 23.05.2025 (Eintragungsdatum)\n\nMS \"Frisian Star\" Schiffahrts GmbH & Co. KG\nKommanditgesellschaft\nEmden\n\nDas Registergericht beabsichtigt, die Firma von Amts wegen nach § 394 FamFG zu löschen. Die Frist zur Erhebung eines Widerspruchs ist auf 1 Monat ab dieser Registerbekanntmachung festgesetzt."
    },
    {
      "date": "2025-05-23",
      "id": "110092",
      "original_text": "Einreichung neuer Dokumente\nNiedersachsen Amtsgericht Hildesheim HRB 204918\nBundesgesellschaft für Endlagerung mbH (BGE) – Peine",
      "type": "Einreichung neuer Dokumente",
      "state": "Niedersachsen",
      "amtsgericht": "Amtsgericht Hildesheim",
      "registernummer": "HRB 204918",
      "registerart": "HRB",
      "company_name": "Bundesgesellschaft für Endlagerung mbH (BGE)",
      "company_seat": "Peine",
      "details": "23.05.2025 (Bekanntmachungsdatum)\n\nNiedersachsen Amtsgericht Hildesheim HRB 204918\nEinreichung neuer Dokumente 23.05.2025 (Eintragungsdatum)\n\nBundesgesellschaft für Endlagerung mbH (BGE)\nGesellschaft mit beschränkter Haftung\nPeine\n\nDie Liste der Mitglieder des Aufsichtsrats wurde beim Registergericht eingereicht."
    },
    {
      "date": "2025-05-23",
      "id": "110093",
      "original_text": "Einreichung neuer Dokumente\nBremen Amtsgericht Bremen HRB 18776\nINSTANT GROUP AG – Bremen",
      "type": "Einreichung neuer Dokumente",
      "state": "Bremen",
      "amtsgericht": "Amtsgericht Bremen",
      "registernummer": "HRB 18776",
      "registerart": "HRB",
      "company_name": "INSTANT GROUP AG",
      "company_seat": "Bremen",
      "details": "23.05.2025 (Bekanntmachungsdatum)\n\nBremen Amtsgericht Bremen HRB 18776\nEinreichung neuer Dokumente\n\nINSTANT GROUP AG\nAktiengesellschaft\nBremen\n\nAls nicht eingetragen wird bekannt gemacht: Liste des Aufsichtsrats wurde eingereicht."
    },
    {
      "date": "2025-05-23",
      "id": "110094",
      "original_text": "Löschungsankündigung\nBremen Amtsgericht Bremen HRB 39134\nZenit Security GmbH – Bremerhaven",
      "type": "Löschungsankündigung",
      "state": "Bremen",
      "amtsgericht": "Amtsgericht Bremen",
      "registernummer": "HRB 39134",
      "registerart": "HRB",
      "company_name": "Zenit Security GmbH",
      "company_seat": "Bremerhaven",
      "details": "23.05.2025 (Bekanntmachungsdatum)\n\nBremen Amtsgericht Bremen HRB 39134\nLöschungsankündigung\n\nZenit Security GmbH\nGesellschaft mit beschränkter Haftung\nBremerhaven\n\nEs ist beabsichtigt die im Handelsregister eingetragene Gesellschaft von Amts wegen gemäß § 394 FamFG zu löschen. Gegen die Löschung kann beim AG Bremen schriftlich oder zu Protokoll der Geschäftsstelle Widerspruch eingelegt werden. Widerspruchsfrist 4 Wochen."
    },
    {
      "date": "2025-05-23",
      "id": "110095",
      "original_text": "Sonstige Registerbekanntmachung\nBremen Amtsgericht Bremen HRB 26768\nKPS-Investitions KGaA – Bremen",
      "type": "Sonstige Registerbekanntmachung",
      "state": "Bremen",
      "amtsgericht": "Amtsgericht Bremen",
      "registernummer": "HRB 26768",
      "registerart": "HRB",
      "company_name": "KPS-Investitions KGaA",
      "company_seat": "Bremen",
      "details": "23.05.2025 (Bekanntmachungsdatum)\n\nBremen Amtsgericht Bremen HRB 26768\nSonstige Registerbekanntmachung\n\nKPS-Investitions KGaA\nKommanditgesellschaft auf Aktien\nBremen\n\nAls nicht eingetragen wird bekannt gemacht: Liste des Aufsichtsrats wurde eingereicht."
    },
    {
      "date": "2025-05-23",
      "id": "110096",
      "original_text": "Registerbekanntmachung nach dem Umwandlungsgesetz\nRheinland-Pfalz Amtsgericht Wittlich HRB 46085\nc3e VV GmbH – Kell am See",
      "type": "Registerbekanntmachung nach dem Umwandlungsgesetz",
      "state": "Rheinland-Pfalz",
      "amtsgericht": "Amtsgericht Wittlich",
      "registernummer": "HRB 46085",
      "registerart": "HRB",
      "company_name": "c3e VV GmbH",
      "company_seat": "Kell am See",
      "details": "23.05.2025 (Bekanntmachungsdatum)\n\nRheinland-Pfalz Amtsgericht Wittlich HRB 46085\nRegisterbekanntmachung nach dem Umwandlungsgesetz 23.05.2025 (Eintragungsdatum)\n\nc3e VV GmbH\nGesellschaft mit beschränkter Haftung\nKell am See\n\nAls nicht eingetragen wird veröffentlicht: Den Gläubigern der an der Verschmelzung beteiligten Rechtsträger ist, wenn sie binnen sechs Monaten nach dem Tag, an dem die Eintragung der Verschmelzung in das Register des Sitzes desjenigen Rechtsträgers,dessen Gläubiger sie sind, nach § 19 Abs. 3 UmwG als bekannt gemacht gilt, ihren Anspruch nach Grund und Höhe schriftlich anmelden, Sicherheit zu leisten, soweit sie nicht Befriedigung verlangen können. Dieses Recht steht den Gläubigern jedoch nur zu, wenn sie glaubhaft machen, dass durch die Verschmelzung die Erfüllung der Forderung gefährdet wird."
    },
    {
      "date": "2025-05-23",
      "id": "110097",
      "original_text": "Registerbekanntmachung nach dem Umwandlungsgesetz\nNordrhein-Westfalen Amtsgericht Bielefeld HRB 43339\nMALLEO GmbH – Bielefeld",
      "type": "Registerbekanntmachung nach dem Umwandlungsgesetz",
      "state": "Nordrhein-Westfalen",
      "amtsgericht": "Amtsgericht Bielefeld",
      "registernummer": "HRB 43339",
      "registerart": "HRB",
      "company_name": "MALLEO GmbH",
      "company_seat": "Bielefeld",
      "details": "23.05.2025 (Bekanntmachungsdatum)\n\nNordrhein-Westfalen Amtsgericht Bielefeld HRB 43339\nRegisterbekanntmachung nach dem Umwandlungsgesetz 23.05.2025 (Eintragungsdatum)\n\nMALLEO GmbH\nGesellschaft mit beschränkter Haftung\nBielefeld\n\nDen Gläubigern der an der Verschmelzung beteiligten Rechtsträger ist, wenn sie binnen sechs Monaten nach dem Tag, an dem die Eintragung der Verschmelzung in das Register des Sitzes desjenigen Rechtsträgers, dessen Gläubiger sie sind, nach § 19 Absatz 3 UmwG als bekanntgemacht gilt, ihren Anspruch nach Grund und Höhe schriftlich anmelden, Sicherheit zu leisten, soweit sie nicht Befriedigung verlangen können. Dieses Recht steht den Gläubigern jedoch nur zu, wenn sie glaubhaft machen, dass durch die Verschmelzung die Erfüllung ihrer Forderung gefährdet wird."
    },
    {
      "date": "2025-05-23",
      "id": "110098",
      "original_text": "Registerbekanntmachung nach dem Umwandlungsgesetz\nNordrhein-Westfalen Amtsgericht Düsseldorf HRB 92207\nPAMAC Properties GmbH – Düsseldorf",
      "type": "Registerbekanntmachung nach dem Umwandlungsgesetz",
      "state": "Nordrhein-Westfalen",
      "amtsgericht": "Amtsgericht Düsseldorf",
      "registernummer": "HRB 92207",
      "registerart": "HRB",
      "company_name": "PAMAC Properties GmbH",
      "company_seat": "Düsseldorf",
      "details": "23.05.2025 (Bekanntmachungsdatum)\n\nNordrhein-Westfalen Amtsgericht Düsseldorf HRB 92207\nRegisterbekanntmachung nach dem Umwandlungsgesetz 23.05.2025 (Eintragungsdatum)\n\nPAMAC Properties GmbH\nGesellschaft mit beschränkter Haftung\nDüsseldorf\n\nDen Gläubigern der an der Verschmelzung beteiligten Rechtsträger ist, wenn sie binnen sechs Monaten nach dem Tag, an dem die Eintragung der Verschmelzung in das Register des Sitzes desjenigen Rechtsträgers, dessen Gläubiger sie sind, nach § 19 Absatz 3 UmwG als bekanntgemacht gilt, ihren Anspruch nach Grund und Höhe schriftlich anmelden, Sicherheit zu leisten, soweit sie nicht Befriedigung verlangen können. Dieses Recht steht den Gläubigern jedoch nur zu, wenn sie glaubhaft machen, dass durch die Verschmelzung die Erfüllung ihrer Forderung gefährdet wird."
    },
    {
      "date": "2025-05-23",
      "id": "110099",
      "original_text": "Löschungsankündigung\nNordrhein-Westfalen Amtsgericht Dortmund HRB 34882\nStellarius GmbH – Dortmund",
      "type": "Löschungsankündigung",
      "state": "Nordrhein-Westfalen",
      "amtsgericht": "Amtsgericht Dortmund",
      "registernummer": "HRB 34882",
      "registerart": "HRB",
      "company_name": "Stellarius GmbH",
      "company_seat": "Dortmund",
      "details": "23.05.2025 (Bekanntmachungsdatum)\n\nNordrhein-Westfalen Amtsgericht Dortmund HRB 34882\nLöschungsankündigung 23.05.2025 (Eintragungsdatum)\n\nStellarius GmbH\nGesellschaft mit beschränkter Haftung\nDortmund\n\nDas Registergericht beabsichtigt die Gesellschaft von Amts wegen nach § 394 FamFG zu löschen. Die Frist zur Erhebung eines Widerspruchs ist auf zwei Monate festgesetzt."
    },
    {
      "date": "2025-05-23",
      "id": "110100",
      "original_text": "Löschungsankündigung\nNordrhein-Westfalen Amtsgericht Düsseldorf HRA 22948\nAVH Einkaufscentrum Wetzlar GmbH & Co. KG – Düsseldorf",
      "type": "Löschungsankündigung",
      "state": "Nordrhein-Westfalen",
      "amtsgericht": "Amtsgericht Düsseldorf",
      "registernummer": "HRA 22948",
      "registerart": "HRA",
      "company_name": "AVH Einkaufscentrum Wetzlar GmbH & Co. KG",
      "company_seat": "Düsseldorf",
      "details": "23.05.2025 (Bekanntmachungsdatum)\n\nNordrhein-Westfalen Amtsgericht Düsseldorf HRA 22948\nLöschungsankündigung\n\nAVH Einkaufscentrum Wetzlar GmbH & Co. KG\nKommanditgesellschaft\nDüsseldorf\n\nDas Registergericht beabsichtigt die Firma von Amts wegen nach § 31 HGB zu löschen, da kein Gewerbe mehr betrieben wird. Die Frist zur Erhebung eines Widerspruchs ist auf 3 Monate festgesetzt.\n\nRechtsbehelfsbelehrung:\nDas Widerspruchsrecht steht jedem zu, der an der Unterlassung der Löschung ein berechtigtes Interesse hat. Der Widerspruch ist bei dem Amtsgericht Düsseldorf -Registergericht-, Werdener Straße 1, 40227 Düsseldorf schriftlich in deutscher Sprache oder zur Niederschrift der Geschäftsstelle einzulegen. Der Widerspruch kann auch zur Niederschrift der Geschäftsstelle eines jeden Amtsgerichtes abgegeben werden. Die Einlegung ist auch durch Übertragung eines elektronischen Dokuments an die elektronische Poststelle des Gerichts möglich. Das elektronische Dokument muss für die Bearbeitung durch das Gericht geeignet und mit einer qualifizierten elektronischen Signatur der verantwortenden Person versehen sein oder von der verantwortenden Person signiert und auf einem sicheren Übermittlungsweg gemäß § 130a ZPO nach näherer Maßgabe der Verordnung über die technischen Rahmenbedingungen des elektronischen Rechtsverkehrs und über das besondere elektronische Behördenpostfach (BGBl. I, S.3803) eingereicht werden. Weitere Informationen erhalten Sie auf der Internetseite www.justiz.de.\nDer Widerspruch muss spätestens innerhalb der gesetzten Frist nach dem Datum der Bekanntmachung der Löschungsankündigung bei dem Amtsgericht - Registergericht - Düsseldorf eingegangen sein.  Dies gilt auch dann, wenn der Widerspruch zur Niederschrift der Geschäftsstelle eines anderen Amtsgerichtes abgegeben wurde. Die Frist beginnt mit dem Tage der Bekanntmachung der Löschungsankündigung in dem für die Bekanntmachung der Eintragungen in das Handelsregister bestimmten elektronischen Informations- und Kommunikationssystem nach § 10 des Handelsgesetzbuches. Fällt das Ende der Frist auf einen Sonntag, einen allgemeinen Feiertag oder Sonnabend, so endet die Frist mit Ablauf des nächsten Werktages.\nDer Widerspruch muss die Bezeichnung der angefochtenen Löschungsankündigung sowie die Erklärung enthalten, dass Widerspruch gegen diese Löschungsankündigung eingelegt wird. Er ist zu unterzeichnen und soll begründet werden."
    },
    {
      "date": "2025-05-23",
      "id": "110101",
      "original_text": "Registerbekanntmachung nach dem Umwandlungsgesetz\nNordrhein-Westfalen Amtsgericht Bonn HRB 29782\nFriedrich & Schönenberger IMMOMO GmbH – Bonn",
      "type": "Registerbekanntmachung nach dem Umwandlungsgesetz",
      "state": "Nordrhein-Westfalen",
      "amtsgericht": "Amtsgericht Bonn",
      "registernummer": "HRB 29782",
      "registerart": "HRB",
      "company_name": "Friedrich & Schönenberger IMMOMO GmbH",
      "company_seat": "Bonn",
      "details": "23.05.2025 (Bekanntmachungsdatum)\n\nNordrhein-Westfalen Amtsgericht Bonn HRB 29782\nRegisterbekanntmachung nach dem Umwandlungsgesetz 23.05.2025 (Eintragungsdatum)\n\nFriedrich & Schönenberger IMMOMO GmbH\nGesellschaft mit beschränkter Haftung\nBonn\n\nDen Gläubigern der an der Ausgliederung beteiligten Rechtsträger ist, wenn sie binnen sechs Monaten nach dem Tag, an dem die Eintragung der Ausgliederung in das Register des Sitzes desjenigen Rechtsträgers, dessen Gläubiger sie sind, nach § 19 Absatz 3 UmwG als bekanntgemacht gilt, ihren Anspruch nach Grund und Höhe schriftlich anmelden, Sicherheit zu leisten, soweit sie nicht Befriedigung verlangen können. Dieses Recht steht den Gläubigern jedoch nur zu, wenn sie glaubhaft machen, dass durch die Ausgliederung die Erfüllung ihrer Forderung gefährdet wird."
    },
    {
      "date": "2025-05-23",
      "id": "110102",
      "original_text": "Einreichung neuer Dokumente\nNordrhein-Westfalen Amtsgericht Köln HRB 39357\nA.S. Création Tapeten AG – Gummersbach",
      "type": "Einreichung neuer Dokumente",
      "state": "Nordrhein-Westfalen",
      "amtsgericht": "Amtsgericht Köln",
      "registernummer": "HRB 39357",
      "registerart": "HRB",
      "company_name": "A.S. Création Tapeten AG",
      "company_seat": "Gummersbach",
      "details": "23.05.2025 (Bekanntmachungsdatum)\n\nNordrhein-Westfalen Amtsgericht Köln HRB 39357\nEinreichung neuer Dokumente 23.05.2025 (Eintragungsdatum)\n\nA.S. Création Tapeten AG\nAktiengesellschaft\nGummersbach\n\nDem Registergericht ist eine Liste der Mitglieder des Aufsichtsrates eingereicht worden."
    },
    {
      "date": "2025-05-23",
      "id": "110103",
      "original_text": "Löschungsankündigung\nNordrhein-Westfalen Amtsgericht Kleve HRB 15199\nCP Transport und Dienstleistung UG (haftungsbeschränkt) – Rees",
      "type": "Löschungsankündigung",
      "state": "Nordrhein-Westfalen",
      "amtsgericht": "Amtsgericht Kleve",
      "registernummer": "HRB 15199",
      "registerart": "HRB",
      "company_name": "CP Transport und Dienstleistung UG (haftungsbeschränkt)",
      "company_seat": "Rees",
      "details": "23.05.2025 (Bekanntmachungsdatum)\n\nNordrhein-Westfalen Amtsgericht Kleve HRB 15199\nLöschungsankündigung\n\nCP Transport und Dienstleistung UG (haftungsbeschränkt)\nGesellschaft mit beschränkter Haftung\nRees\n\nDas Registergericht beabsichtigt die Gesellschaft von Amts wegen nach § 394 FamFG zu löschen. Die Frist zur Erhebung eines Widerspruchs ist auf einen Monat festgesetzt."
    },
    {
      "date": "2025-05-23",
      "id": "110104",
      "original_text": "Registerbekanntmachung nach dem Umwandlungsgesetz\nNordrhein-Westfalen Amtsgericht Bonn HRB 29580\nCASSIOOPEIA Holding GmbH – Bonn",
      "type": "Registerbekanntmachung nach dem Umwandlungsgesetz",
      "state": "Nordrhein-Westfalen",
      "amtsgericht": "Amtsgericht Bonn",
      "registernummer": "HRB 29580",
      "registerart": "HRB",
      "company_name": "CASSIOOPEIA Holding GmbH",
      "company_seat": "Bonn",
      "details": "23.05.2025 (Bekanntmachungsdatum)\n\nNordrhein-Westfalen Amtsgericht Bonn HRB 29580\nRegisterbekanntmachung nach dem Umwandlungsgesetz 23.05.2025 (Eintragungsdatum)\n\nCASSIOOPEIA Holding GmbH\nGesellschaft mit beschränkter Haftung\nBonn\n\nDen Gläubigern der an der Ausgliederung beteiligten Rechtsträger ist, wenn sie binnen sechs Monaten nach dem Tag, an dem die Eintragung der Ausgliederung in das Register des Sitzes desjenigen Rechtsträgers, dessen Gläubiger sie sind, nach § 19 Absatz 3 UmwG als bekanntgemacht gilt, ihren Anspruch nach Grund und Höhe schriftlich anmelden, Sicherheit zu leisten, soweit sie nicht Befriedigung verlangen können. Dieses Recht steht den Gläubigern jedoch nur zu, wenn sie glaubhaft machen, dass durch die Ausgliederung die Erfüllung ihrer Forderung gefährdet wird."
    },
    {
      "date": "2025-05-23",
      "id": "110105",
      "original_text": "Registerbekanntmachung nach dem Umwandlungsgesetz\nNordrhein-Westfalen Amtsgericht Bielefeld HRB 42995\nSevomaza GmbH – Bielefeld",
      "type": "Registerbekanntmachung nach dem Umwandlungsgesetz",
      "state": "Nordrhein-Westfalen",
      "amtsgericht": "Amtsgericht Bielefeld",
      "registernummer": "HRB 42995",
      "registerart": "HRB",
      "company_name": "Sevomaza GmbH",
      "company_seat": "Bielefeld",
      "details": "23.05.2025 (Bekanntmachungsdatum)\n\nNordrhein-Westfalen Amtsgericht Bielefeld HRB 42995\nRegisterbekanntmachung nach dem Umwandlungsgesetz 23.05.2025 (Eintragungsdatum)\n\nSevomaza GmbH\nGesellschaft mit beschränkter Haftung\nBielefeld\n\nDen Gläubigern der an der Verschmelzung beteiligten Rechtsträger ist, wenn sie binnen sechs Monaten nach dem Tag, an dem die Eintragung der Verschmelzung in das Register des Sitzes desjenigen Rechtsträgers, dessen Gläubiger sie sind, nach § 19 Absatz 3 UmwG als bekanntgemacht gilt, ihren Anspruch nach Grund und Höhe schriftlich anmelden, Sicherheit zu leisten, soweit sie nicht Befriedigung verlangen können. Dieses Recht steht den Gläubigern jedoch nur zu, wenn sie glaubhaft machen, dass durch die Verschmelzung die Erfüllung ihrer Forderung gefährdet wird."
    },
    {
      "date": "2025-05-23",
      "id": "110106",
      "original_text": "Löschungsankündigung\nNordrhein-Westfalen Amtsgericht Kleve HRB 16857\nCMR Feuerwerk GmbH – Kranenburg",
      "type": "Löschungsankündigung",
      "state": "Nordrhein-Westfalen",
      "amtsgericht": "Amtsgericht Kleve",
      "registernummer": "HRB 16857",
      "registerart": "HRB",
      "company_name": "CMR Feuerwerk GmbH",
      "company_seat": "Kranenburg",
      "details": "23.05.2025 (Bekanntmachungsdatum)\n\nNordrhein-Westfalen Amtsgericht Kleve HRB 16857\nLöschungsankündigung\n\nCMR Feuerwerk GmbH\nGesellschaft mit beschränkter Haftung\nKranenburg\n\nDas Registergericht beabsichtigt die Gesellschaft von Amts wegen nach § 394 FamFG zu löschen. Die Frist zur Erhebung eines Widerspruchs ist auf einen Monat festgesetzt."
    },
    {
      "date": "2025-05-23",
      "id": "110107",
      "original_text": "Sonstige Registerbekanntmachung\nNordrhein-Westfalen Amtsgericht Bonn HRB 27481\nDeutsche Post DHL Facility Management Deutschland GmbH – Bonn",
      "type": "Sonstige Registerbekanntmachung",
      "state": "Nordrhein-Westfalen",
      "amtsgericht": "Amtsgericht Bonn",
      "registernummer": "HRB 27481",
      "registerart": "HRB",
      "company_name": "Deutsche Post DHL Facility Management Deutschland GmbH",
      "company_seat": "Bonn",
      "details": "23.05.2025 (Bekanntmachungsdatum)\n\nNordrhein-Westfalen Amtsgericht Bonn HRB 27481\nSonstige Registerbekanntmachung 23.05.2025 (Eintragungsdatum)\n\nDeutsche Post DHL Facility Management Deutschland GmbH\nGesellschaft mit beschränkter Haftung\nBonn\n\nAls nicht eingetragen wird veröffentlicht: Den Gläubigern der Gesellschaft, deren Forderungen begründet worden sind bevor die Eintragung der Beendigung des Beherrschungsvertrages  in das Handelsregister nach § 10 des Handelsgesetzbuches als bekanntgemacht gilt, hat der andere Vertragsteil Sicherheit zu leisten, wenn sie sich binnen sechs Monaten nach der Bekanntmachung der Eintragung zu diesem Zweck bei ihm melden."
    },
    {
      "date": "2025-05-23",
      "id": "110108",
      "original_text": "Einreichung neuer Dokumente\nNordrhein-Westfalen Amtsgericht Essen HRB 31538\nWestenergie AG – Essen",
      "type": "Einreichung neuer Dokumente",
      "state": "Nordrhein-Westfalen",
      "amtsgericht": "Amtsgericht Essen",
      "registernummer": "HRB 31538",
      "registerart": "HRB",
      "company_name": "Westenergie AG",
      "company_seat": "Essen",
      "details": "23.05.2025 (Bekanntmachungsdatum)\n\nNordrhein-Westfalen Amtsgericht Essen HRB 31538\nEinreichung neuer Dokumente 23.05.2025 (Eintragungsdatum)\n\nWestenergie AG\nAktiengesellschaft\nEssen\n\nDem Registergericht ist eine neue Liste der Mitglieder des Aufsichtsrates eingereicht worden."
    },
    {
      "date": "2025-05-23",
      "id": "110109",
      "original_text": "Registerbekanntmachung nach dem Umwandlungsgesetz\nThüringen Amtsgericht Jena HRB 302913\nMerkel Jagd- und Sportwaffen GmbH – Suhl",
      "type": "Registerbekanntmachung nach dem Umwandlungsgesetz",
      "state": "Thüringen",
      "amtsgericht": "Amtsgericht Jena",
      "registernummer": "HRB 302913",
      "registerart": "HRB",
      "company_name": "Merkel Jagd- und Sportwaffen GmbH",
      "company_seat": "Suhl",
      "details": "23.05.2025 (Bekanntmachungsdatum)\n\nThüringen Amtsgericht Jena HRB 302913\nRegisterbekanntmachung nach dem Umwandlungsgesetz 23.05.2025 (Eintragungsdatum)\n\nMerkel Jagd- und Sportwaffen GmbH\nGesellschaft mit beschränkter Haftung\nSuhl\n\nNicht eingetragen: Den Gläubigern der an der Verschmelzung beteiligten Rechtsträger, ist wenn sie binnen sechs Monaten nach dem Tag, an dem die Eintragung der Verschmelzung in das Register des Sitzes desjenigen Rechtsträgers, dessen Gläubiger sie sind,  nach § 19 Abs. 3 UmwG als bekanntgemacht gilt, ihren Anspruch nach Grund und Höhe schriftlich anmelden, Sicherheit zu leisten, soweit sie nicht Befriedigung verlangen können. Dieses Recht steht ihnen jedoch nur zu, wenn sie glaubhaft machen, daß durch die Verschmelzung die Erfüllung ihrer Forderung gefährdet wird."
    },
    {
      "date": "2025-05-23",
      "id": "110110",
      "original_text": "Einreichung neuer Dokumente\nHessen Amtsgericht Offenbach am Main HRB 57448\nASB Erasmus Frankfurter Stadtschule Gymnasium gGmbH – Heusenstamm",
      "type": "Einreichung neuer Dokumente",
      "state": "Hessen",
      "amtsgericht": "Amtsgericht Offenbach am Main",
      "registernummer": "HRB 57448",
      "registerart": "HRB",
      "company_name": "ASB Erasmus Frankfurter Stadtschule Gymnasium gGmbH",
      "company_seat": "Heusenstamm",
      "details": "23.05.2025 (Bekanntmachungsdatum)\n\nHessen Amtsgericht Offenbach am Main HRB 57448\nEinreichung neuer Dokumente\n\nASB Erasmus Frankfurter Stadtschule Gymnasium gGmbH\nGesellschaft mit beschränkter Haftung\nHeusenstamm\n\nDurch eine Änderung in den Personen der Aufsichtsratsmitglieder ist eine Liste der Mitglieder des Aufsichtsrates zum Handelsregister eingereicht worden."
    },
    {
      "date": "2025-05-23",
      "id": "110111",
      "original_text": "Einreichung neuer Dokumente\nHessen Amtsgericht Frankfurt am Main HRB 48967\nASW-Südwest Assekuranz- und Finanzierungsvermittlungsservice GmbH – Frankfurt am Main",
      "type": "Einreichung neuer Dokumente",
      "state": "Hessen",
      "amtsgericht": "Amtsgericht Frankfurt am Main",
      "registernummer": "HRB 48967",
      "registerart": "HRB",
      "company_name": "ASW-Südwest Assekuranz- und Finanzierungsvermittlungsservice GmbH",
      "company_seat": "Frankfurt am Main",
      "details": "23.05.2025 (Bekanntmachungsdatum)\n\nHessen Amtsgericht Frankfurt am Main HRB 48967\nEinreichung neuer Dokumente\n\nASW-Südwest Assekuranz- und Finanzierungsvermittlungsservice GmbH\nGesellschaft mit beschränkter Haftung\nFrankfurt am Main\n\nDurch eine Änderung in den Personen der Aufsichtsratsmitglieder ist eine Liste der Mitglieder des Aufsichtsrates zum Handelsregister eingereicht worden."
    },
    {
      "date": "2025-05-23",
      "id": "110112",
      "original_text": "Registerbekanntmachung nach dem Umwandlungsgesetz\nHessen Amtsgericht Wiesbaden HRB 29504\nSera Beteiligungs GmbH – Hünstetten",
      "type": "Registerbekanntmachung nach dem Umwandlungsgesetz",
      "state": "Hessen",
      "amtsgericht": "Amtsgericht Wiesbaden",
      "registernummer": "HRB 29504",
      "registerart": "HRB",
      "company_name": "Sera Beteiligungs GmbH",
      "company_seat": "Hünstetten",
      "details": "23.05.2025 (Bekanntmachungsdatum)\n\nHessen Amtsgericht Wiesbaden HRB 29504\nRegisterbekanntmachung nach dem Umwandlungsgesetz 23.05.2025 (Eintragungsdatum)\n\nSera Beteiligungs GmbH\nGesellschaft mit beschränkter Haftung\nHünstetten\n\nDen Gläubigern der an der Verschmelzung beteiligten Rechtsträger ist, wenn sie binnen sechs Monaten nach dem Tag, an dem die Eintragung der Verschmelzung in das Register des Sitzes desjenigen Rechtsträgers, dessen Gläubiger sie sind, nach § 19 Absatz 3 UmwG bekannt gemacht worden ist, ihren Anspruch nach Grund und Höhe schriftlich anmelden, Sicherheit zu leisten, soweit sie nicht Befriedigung verlangen können. Dieses Recht steht den Gläubigern jedoch nur zu, wenn sie glaubhaft machen, dass durch die Verschmelzung die Erfüllung ihrer Forderung gefährdet wird."
    },
    {
      "date": "2025-05-23",
      "id": "110113",
      "original_text": "Löschungsankündigung\nHessen Amtsgericht Hanau HRB 95324\nBFG Trockenbau Norderney GmbH – Rodenbach",
      "type": "Löschungsankündigung",
      "state": "Hessen",
      "amtsgericht": "Amtsgericht Hanau",
      "registernummer": "HRB 95324",
      "registerart": "HRB",
      "company_name": "BFG Trockenbau Norderney GmbH",
      "company_seat": "Rodenbach",
      "details": "23.05.2025 (Bekanntmachungsdatum)\n\nHessen Amtsgericht Hanau HRB 95324\nLöschungsankündigung\n\nBFG Trockenbau Norderney GmbH\nGesellschaft mit beschränkter Haftung\nRodenbach\n\nDas Registergericht beabsichtigt die im Handelsregister eingetragene Gesellschaft von Amts wegen nach § 394 FamFG zu löschen. Die Frist zur Erhebung eines Widerspruchs gegen die beabsichtigte Löschung wird auf 3 Monate festgesetzt."
    },
    {
      "date": "2025-05-23",
      "id": "110114",
      "original_text": "Registerbekanntmachung nach dem Umwandlungsgesetz\nHessen Amtsgericht Wiesbaden HRB 25320\nvicamago GmbH – Hünstetten",
      "type": "Registerbekanntmachung nach dem Umwandlungsgesetz",
      "state": "Hessen",
      "amtsgericht": "Amtsgericht Wiesbaden",
      "registernummer": "HRB 25320",
      "registerart": "HRB",
      "company_name": "vicamago GmbH",
      "company_seat": "Hünstetten",
      "details": "23.05.2025 (Bekanntmachungsdatum)\n\nHessen Amtsgericht Wiesbaden HRB 25320\nRegisterbekanntmachung nach dem Umwandlungsgesetz 23.05.2025 (Eintragungsdatum)\n\nvicamago GmbH\nGesellschaft mit beschränkter Haftung\nHünstetten\n\nDen Gläubigern der an der Verschmelzung beteiligten Rechtsträger ist, wenn sie binnen sechs Monaten nach dem Tag, an dem die Eintragung der Verschmelzung in das Register des Sitzes derjenigen Rechtsträger deren Gläubiger sie sind, nach § 19 Absatz 3 UmwG bekannt gemacht worden ist, ihren Anspruch nach Grund und Höhe schriftlich anmelden, Sicherheit zu leisten, soweit sie nicht Befriedigung verlangen können. Dieses Recht steht den Gläubigern jedoch nur zu, wenn sie glaubhaft machen, dass durch die Verschmelzung die Erfüllung ihrer Forderung gefährdet wird."
    },
    {
      "date": "2025-05-23",
      "id": "110115",
      "original_text": "Löschungsankündigung\nHessen Amtsgericht Frankfurt am Main HRB 115855\nInfy3i IT Consulting UG (haftungsbeschränkt) – Frankfurt am Main",
      "type": "Löschungsankündigung",
      "state": "Hessen",
      "amtsgericht": "Amtsgericht Frankfurt am Main",
      "registernummer": "HRB 115855",
      "registerart": "HRB",
      "company_name": "Infy3i IT Consulting UG (haftungsbeschränkt)",
      "company_seat": "Frankfurt am Main",
      "details": "23.05.2025 (Bekanntmachungsdatum)\n\nHessen Amtsgericht Frankfurt am Main HRB 115855\nLöschungsankündigung\n\nInfy3i IT Consulting UG (haftungsbeschränkt)\nGesellschaft mit beschränkter Haftung\nFrankfurt am Main\n\nDas Registergericht beabsichtigt die im Handelsregister eingetragene Gesellschaft von Amts wegen nach § 394 FamFG zu löschen. Die Frist zur Erhebung eines Widerspruchs gegen die beabsichtigte Löschung wird auf 1 Monat festgesetzt."
    },
    {
      "date": "2025-05-23",
      "id": "110116",
      "original_text": "Löschungsankündigung\nHessen Amtsgericht Frankfurt am Main HRB 120422\nSD-Bau GmbH – Sulzbach am Taunus",
      "type": "Löschungsankündigung",
      "state": "Hessen",
      "amtsgericht": "Amtsgericht Frankfurt am Main",
      "registernummer": "HRB 120422",
      "registerart": "HRB",
      "company_name": "SD-Bau GmbH",
      "company_seat": "Sulzbach am Taunus",
      "details": "23.05.2025 (Bekanntmachungsdatum)\n\nHessen Amtsgericht Frankfurt am Main HRB 120422\nLöschungsankündigung\n\nSD-Bau GmbH\nGesellschaft mit beschränkter Haftung\nSulzbach am Taunus\n\nDas Registergericht beabsichtigt die im Handelsregister eingetragene Gesellschaft von Amts wegen nach § 394 FamFG zu löschen. Die Frist zur Erhebung eines Widerspruchs gegen die beabsichtigte Löschung wird auf 1 Monat festgesetzt."
    },
    {
      "date": "2025-05-23",
      "id": "110117",
      "original_text": "Einreichung neuer Dokumente\nHessen Amtsgericht Gießen HRB 6902\nSchunk GmbH – Heuchelheim",
      "type": "Einreichung neuer Dokumente",
      "state": "Hessen",
      "amtsgericht": "Amtsgericht Gießen",
      "registernummer": "HRB 6902",
      "registerart": "HRB",
      "company_name": "Schunk GmbH",
      "company_seat": "Heuchelheim",
      "details": "23.05.2025 (Bekanntmachungsdatum)\n\nHessen Amtsgericht Gießen HRB 6902\nEinreichung neuer Dokumente\n\nSchunk GmbH\nGesellschaft mit beschränkter Haftung\nHeuchelheim\n\nAufgrund einer Änderung in den Personen der Aufsichtsratsmitglieder ist eine Liste der Mitglieder des Aufsichtsrates zum Handelsregister eingereicht worden."
    },
    {
      "date": "2025-05-23",
      "id": "110118",
      "original_text": "Löschungsankündigung\nHessen Amtsgericht Friedberg HRB 10134\nJT Production UG (haftungsbeschränkt) – Büdingen",
      "type": "Löschungsankündigung",
      "state": "Hessen",
      "amtsgericht": "Amtsgericht Friedberg",
      "registernummer": "HRB 10134",
      "registerart": "HRB",
      "company_name": "JT Production UG (haftungsbeschränkt)",
      "company_seat": "Büdingen",
      "details": "23.05.2025 (Bekanntmachungsdatum)\n\nHessen Amtsgericht Friedberg HRB 10134\nLöschungsankündigung\n\nJT Production UG (haftungsbeschränkt)\nGesellschaft mit beschränkter Haftung\nBüdingen\n\nDas Registergericht beabsichtigt die im Handelsregister eingetragene Gesellschaft von Amts wegen nach § 394 FamFG zu löschen. Die Frist zur Erhebung eines Widerspruchs gegen die beabsichtigte Löschung wird auf 3 Monate festgesetzt."
    },
    {
      "date": "2025-05-23",
      "id": "110119",
      "original_text": "Sonstige Registerbekanntmachung\nHessen Amtsgericht Wiesbaden VR 6385\nSupport Projects - Verein für Entwicklung, Bildung und Umwelt – Wiesbaden",
      "type": "Sonstige Registerbekanntmachung",
      "state": "Hessen",
      "amtsgericht": "Amtsgericht Wiesbaden",
      "registernummer": "VR 6385",
      "registerart": "VR",
      "company_name": "Support Projects - Verein für Entwicklung, Bildung und Umwelt",
      "company_seat": "Wiesbaden",
      "details": "23.05.2025 (Bekanntmachungsdatum)\n\nHessen Amtsgericht Wiesbaden VR 6385\nSonstige Registerbekanntmachung 23.05.2025 (Eintragungsdatum)\n\nSupport Projects - Verein für Entwicklung, Bildung und Umwelt\neingetragener Verein\nWiesbaden\n\nDer Verein ist aufgelöst."
    }
  ]
}