{
  "date": "2025-05-30",
  "date_of_scrape": "2025-05-31T18:41:56.003Z",
  "tool_version": "0.2.0",
  "number_of_announcements": 107,
  "announcements": [
    {
      "date": "2025-05-30",
      "id": "110635",
      "original_text": "Registerbekanntmachung nach dem Umwandlungsgesetz\nBerlin Amtsgericht Berlin (Charlottenburg) HRB 69874\nATB Aufzugtechnik Berlin GmbH – Berlin",
      "type": "Registerbekanntmachung nach dem Umwandlungsgesetz",
      "state": "Berlin",
      "amtsgericht": "Amtsgericht Berlin (Charlottenburg)",
      "registernummer": "HRB 69874",
      "registerart": "HRB",
      "company_name": "ATB Aufzugtechnik Berlin GmbH",
      "company_seat": "Berlin",
      "details": "30.05.2025 (Bekanntmachungsdatum)\n\nBerlin Amtsgericht Berlin (Charlottenburg) HRB 69874\nRegisterbekanntmachung nach dem Umwandlungsgesetz 30.05.2025 (Eintragungsdatum)\n\nATB Aufzugtechnik Berlin GmbH\nGesellschaft mit beschränkter Haftung\nBerlin\n\nZu Eintragungsnummer 5 vom 30.05.2025 wird als nicht eingetragen veröffentlicht: Den Gläubigern der an der Verschmelzung beteiligten Rechtsträger ist, wenn sie binnen sechs Monaten nach dem Tag, an dem die Eintragung der Verschmelzung in das Register des Sitzes desjenigen Rechtsträgers, dessen Gläubiger sie sind, als bekannt gemacht gilt, ihren Anspruch nach Grund und Höhe schriftlich anmelden, Sicherheit zu leisten, soweit sie nicht Befriedigung verlangen können. Dieses Recht steht den Gläubigern jedoch nur zu, wenn sie glaubhaft machen, dass durch die Verschmelzung die Erfüllung ihrer Forderung gefährdet wird. Das Recht, Sicherheitsleistung zu verlangen, steht Gläubigern nicht zu, die im Falle der Insolvenz ein Recht auf vorzugsweise Befriedigung aus einer Deckungsmasse haben, die nach gesetzlicher Vorschrift zu ihrem Schutz errichtet und staatlich überwacht ist."
    },
    {
      "date": "2025-05-30",
      "id": "110636",
      "original_text": "Registerbekanntmachung nach dem Umwandlungsgesetz\nHamburg Amtsgericht Hamburg HRB 129793\nEDEKA Import Logistik GmbH – Hamburg",
      "type": "Registerbekanntmachung nach dem Umwandlungsgesetz",
      "state": "Hamburg",
      "amtsgericht": "Amtsgericht Hamburg",
      "registernummer": "HRB 129793",
      "registerart": "HRB",
      "company_name": "EDEKA Import Logistik GmbH",
      "company_seat": "Hamburg",
      "details": "30.05.2025 (Bekanntmachungsdatum)\n\nHamburg Amtsgericht Hamburg HRB 129793\nRegisterbekanntmachung nach dem Umwandlungsgesetz 30.05.2025 (Eintragungsdatum)\n\nEDEKA Import Logistik GmbH\nGesellschaft mit beschränkter Haftung\nHamburg\n\nAls nicht eingetragen wird bekannt gemacht:\nDen Gläubigern der an der Verschmelzung beteiligten Gesellschaften ist, wenn sie binnen sechs Monaten nach dem Tag, an dem die Eintragung der Verschmelzung in das Register des Sitzes desjenigen Rechtsträgers, dessen Gläubiger sie sind, nach § 19 Absatz 3 UmwG als bekannt gemacht gilt, ihren Anspruch nach Grund und Höhe schriftlich anmelden, Sicherheit zu leisten, soweit sie nicht Befriedigung verlangen können. Dieses Recht steht den Gläubigern jedoch nur zu, wenn sie glaubhaft machen, dass durch die Verschmelzung die Erfüllung ihrer Forderung gefährdet wird."
    },
    {
      "date": "2025-05-30",
      "id": "110637",
      "original_text": "Registerbekanntmachung nach dem Umwandlungsgesetz\nHamburg Amtsgericht Hamburg HRB 167746\nEDEKA Einkaufskontor GmbH – Hamburg",
      "type": "Registerbekanntmachung nach dem Umwandlungsgesetz",
      "state": "Hamburg",
      "amtsgericht": "Amtsgericht Hamburg",
      "registernummer": "HRB 167746",
      "registerart": "HRB",
      "company_name": "EDEKA Einkaufskontor GmbH",
      "company_seat": "Hamburg",
      "details": "30.05.2025 (Bekanntmachungsdatum)\n\nHamburg Amtsgericht Hamburg HRB 167746\nRegisterbekanntmachung nach dem Umwandlungsgesetz 30.05.2025 (Eintragungsdatum)\n\nEDEKA Einkaufskontor GmbH\nGesellschaft mit beschränkter Haftung\nHamburg\n\nAls nicht eingetragen wird bekannt gemacht:\nDen Gläubigern der an der Verschmelzung beteiligten Gesellschaften ist, wenn sie binnen sechs Monaten nach dem Tag, an dem die Eintragung der Verschmelzung in das Register des Sitzes desjenigen Rechtsträgers, dessen Gläubiger sie sind, nach § 19 Absatz 3 UmwG als bekannt gemacht gilt, ihren Anspruch nach Grund und Höhe schriftlich anmelden, Sicherheit zu leisten, soweit sie nicht Befriedigung verlangen können. Dieses Recht steht den Gläubigern jedoch nur zu, wenn sie glaubhaft machen, dass durch die Verschmelzung die Erfüllung ihrer Forderung gefährdet wird."
    },
    {
      "date": "2025-05-30",
      "id": "110638",
      "original_text": "Löschungsankündigung\nSchleswig-Holstein Amtsgericht Flensburg HRB 10760\nManturo Unternehmergesellschaft (haftungsbeschränkt) – Dollrottfeld",
      "type": "Löschungsankündigung",
      "state": "Schleswig-Holstein",
      "amtsgericht": "Amtsgericht Flensburg",
      "registernummer": "HRB 10760",
      "registerart": "HRB",
      "company_name": "Manturo Unternehmergesellschaft (haftungsbeschränkt)",
      "company_seat": "Dollrottfeld",
      "details": "30.05.2025 (Bekanntmachungsdatum)\n\nSchleswig-Holstein Amtsgericht Flensburg HRB 10760\nLöschungsankündigung\n\nManturo Unternehmergesellschaft (haftungsbeschränkt)\nGesellschaft mit beschränkter Haftung\nDollrottfeld\n\nEs ist die Löschung der nachstehenden Gesellschaft wegen Vermögenslosigkeit gemäß § 394 FamFG beabsichtigt.\nWiderspruchsfrist: 2 Monate."
    },
    {
      "date": "2025-05-30",
      "id": "110639",
      "original_text": "Registerbekanntmachung nach dem Umwandlungsgesetz\nBaden-Württemberg Amtsgericht Stuttgart HRB 1103\nMulti Packaging Solutions Services GmbH – Obersulm",
      "type": "Registerbekanntmachung nach dem Umwandlungsgesetz",
      "state": "Baden-Württemberg",
      "amtsgericht": "Amtsgericht Stuttgart",
      "registernummer": "HRB 1103",
      "registerart": "HRB",
      "company_name": "Multi Packaging Solutions Services GmbH",
      "company_seat": "Obersulm",
      "details": "30.05.2025 (Bekanntmachungsdatum)\n\nBaden-Württemberg Amtsgericht Stuttgart HRB 1103\nRegisterbekanntmachung nach dem Umwandlungsgesetz 30.05.2025 (Eintragungsdatum)\n\nMulti Packaging Solutions Services GmbH\nGesellschaft mit beschränkter Haftung\nObersulm\n\nAls nicht eingetragen wird bekanntgemacht:\nDen Gläubigern der an der Verschmelzung beteiligten Rechtsträger ist, wenn sie binnen sechs Monaten nach dem Tag, an dem die Eintragung der Verschmelzung in das Register des Sitzes desjenigen Rechtsträgers, dessen Gläubiger sie sind, nach § 19 Abs. 3 UmwG als bekanntgemacht gilt, ihren Anspruch nach Grund und Höhe schriftlich anmelden, Sicherheit zu leisten, soweit sie nicht Befriedigung verlangen können. Dieses Recht steht den Gläubigern jedoch nur zu, wenn sie glaubhaft machen, dass durch die Verschmelzung die Erfüllung ihrer Forderung gefährdet wird."
    },
    {
      "date": "2025-05-30",
      "id": "110640",
      "original_text": "Registerbekanntmachung nach dem Umwandlungsgesetz\nSchleswig-Holstein Amtsgericht Lübeck HRB 25380\nLeuchtturm GmbH – Geesthacht",
      "type": "Registerbekanntmachung nach dem Umwandlungsgesetz",
      "state": "Schleswig-Holstein",
      "amtsgericht": "Amtsgericht Lübeck",
      "registernummer": "HRB 25380",
      "registerart": "HRB",
      "company_name": "Leuchtturm GmbH",
      "company_seat": "Geesthacht",
      "details": "30.05.2025 (Bekanntmachungsdatum)\n\nSchleswig-Holstein Amtsgericht Lübeck HRB 25380\nRegisterbekanntmachung nach dem Umwandlungsgesetz 28.05.2025 (Eintragungsdatum)\n\nLeuchtturm GmbH\nGesellschaft mit beschränkter Haftung\nGeesthacht\n\nZu Eintragungsnummer 4 vom 28.05.2025 wird als nicht eingetragen veröffentlicht:  Den Gläubigern der an der Spaltung beteiligten Rechtsträger ist, wenn sie binnen sechs Monaten nach dem Tag, an dem die Eintragung der Spaltung in das Register des Sitzes desjenigen Rechtsträgers, dessen Gläubiger sie sind, als bekannt gemacht gilt, ihren Anspruch nach Grund und Höhe schriftlich anmelden, Sicherheit zu leisten, soweit sie nicht Befriedigung verlangen können. Dieses Recht steht den Gläubigern jedoch nur zu, wenn sie glaubhaft machen, dass durch die Spaltung die Erfüllung ihrer Forderung gefährdet wird."
    },
    {
      "date": "2025-05-30",
      "id": "110641",
      "original_text": "Einreichung neuer Dokumente\nSachsen-Anhalt Amtsgericht Stendal HRB 210568\nStadtwerke Halle GmbH – Halle (Saale)",
      "type": "Einreichung neuer Dokumente",
      "state": "Sachsen-Anhalt",
      "amtsgericht": "Amtsgericht Stendal",
      "registernummer": "HRB 210568",
      "registerart": "HRB",
      "company_name": "Stadtwerke Halle GmbH",
      "company_seat": "Halle (Saale)",
      "details": "30.05.2025 (Bekanntmachungsdatum)\n\nSachsen-Anhalt Amtsgericht Stendal HRB 210568\nEinreichung neuer Dokumente\n\nStadtwerke Halle GmbH\nGesellschaft mit beschränkter Haftung\nHalle (Saale)\n\nEine Liste der Mitglieder des Aufsichtsrates wurde zum Handelsregister eingereicht."
    },
    {
      "date": "2025-05-30",
      "id": "110642",
      "original_text": "Löschungsankündigung\nHamburg Amtsgericht Hamburg HRB 48242\nEKZ Vor dem Riedtore Verwaltungs-GmbH – Hamburg",
      "type": "Löschungsankündigung",
      "state": "Hamburg",
      "amtsgericht": "Amtsgericht Hamburg",
      "registernummer": "HRB 48242",
      "registerart": "HRB",
      "company_name": "EKZ Vor dem Riedtore Verwaltungs-GmbH",
      "company_seat": "Hamburg",
      "details": "30.05.2025 (Bekanntmachungsdatum)\n\nHamburg Amtsgericht Hamburg HRB 48242\nLöschungsankündigung\n\nEKZ Vor dem Riedtore Verwaltungs-GmbH\nGesellschaft mit beschränkter Haftung\nHamburg\n\nDas Registergericht beabsichtigt, die im Handelsregister eingetragene Gesellschaft von Amts wegen nach § 394 FamFG zu löschen. Die Frist zur Erhebung eines Widerspruchs gegen die beabsichtigte Löschung wird auf 3 Monate festgesetzt."
    },
    {
      "date": "2025-05-30",
      "id": "110643",
      "original_text": "Löschungsankündigung\nBerlin Amtsgericht Berlin (Charlottenburg) HRB 220945\nDimitrov Service & Bau Berlin GmbH – Berlin",
      "type": "Löschungsankündigung",
      "state": "Berlin",
      "amtsgericht": "Amtsgericht Berlin (Charlottenburg)",
      "registernummer": "HRB 220945",
      "registerart": "HRB",
      "company_name": "Dimitrov Service & Bau Berlin GmbH",
      "company_seat": "Berlin",
      "details": "30.05.2025 (Bekanntmachungsdatum)\n\nBerlin Amtsgericht Berlin (Charlottenburg) HRB 220945\nLöschungsankündigung\n\nDimitrov Service & Bau Berlin GmbH\nGesellschaft mit beschränkter Haftung\nBerlin\n\nBei der nachstehenden Gesellschaft wird das Amtslöschungsverfahren gemäß § 394 FamFG eingeleitet. Widerspruchsfrist 6 Wochen"
    },
    {
      "date": "2025-05-30",
      "id": "110644",
      "original_text": "Registerbekanntmachung nach dem Umwandlungsgesetz\nBaden-Württemberg Amtsgericht Mannheim HRB 722922\nMektec Manufacturing Corporation Europe DE GmbH – Weinheim",
      "type": "Registerbekanntmachung nach dem Umwandlungsgesetz",
      "state": "Baden-Württemberg",
      "amtsgericht": "Amtsgericht Mannheim",
      "registernummer": "HRB 722922",
      "registerart": "HRB",
      "company_name": "Mektec Manufacturing Corporation Europe DE GmbH",
      "company_seat": "Weinheim",
      "details": "30.05.2025 (Bekanntmachungsdatum)\n\nBaden-Württemberg Amtsgericht Mannheim HRB 722922\nRegisterbekanntmachung nach dem Umwandlungsgesetz 30.05.2025 (Eintragungsdatum)\n\nMektec Manufacturing Corporation Europe DE GmbH\nGesellschaft mit beschränkter Haftung\nWeinheim\n\nDen Gläubigern der an der Verschmelzung beteiligten Rechtsträger ist, wenn sie binnen sechs Monaten nach dem Tag, an dem die Eintragung der Verschmelzung in das Register des Sitzes desjenigen Rechtsträgers, dessen Gläubiger sie sind, nach § 19 Abs. 3 UmwG als bekanntgemacht gilt, ihren Anspruch nach Grund und Höhe schriftlich anmelden, Sicherheit zu leisten, soweit sie nicht Befriedigung verlangen können. Dieses Recht steht den Gläubigern jedoch nur zu, wenn sie glaubhaft machen, dass durch die Verschmelzung die Erfüllung ihrer Forderung gefährdet wird."
    },
    {
      "date": "2025-05-30",
      "id": "110645",
      "original_text": "Sonstige Registerbekanntmachung\nBaden-Württemberg Amtsgericht Mannheim HRB 722922\nMektec Manufacturing Corporation Europe DE GmbH – Weinheim",
      "type": "Sonstige Registerbekanntmachung",
      "state": "Baden-Württemberg",
      "amtsgericht": "Amtsgericht Mannheim",
      "registernummer": "HRB 722922",
      "registerart": "HRB",
      "company_name": "Mektec Manufacturing Corporation Europe DE GmbH",
      "company_seat": "Weinheim",
      "details": "30.05.2025 (Bekanntmachungsdatum)\n\nBaden-Württemberg Amtsgericht Mannheim HRB 722922\nSonstige Registerbekanntmachung 30.05.2025 (Eintragungsdatum)\n\nMektec Manufacturing Corporation Europe DE GmbH\nGesellschaft mit beschränkter Haftung\nWeinheim\n\nDen Gläubigern der Gesellschaft, deren Forderungen begründet worden sind, bevor die Eintragung der Beendigung des Vertrages in das Handelsregister nach § 10 HGB als bekanntgemacht gilt, ist vom anderen Vertragsteil Sicherheit zu leisten, wenn sie sich binnen sechs Monaten nach der Bekanntmachung zu diesem Zweck bei ihm melden."
    },
    {
      "date": "2025-05-30",
      "id": "110646",
      "original_text": "Sonstige Registerbekanntmachung\nBaden-Württemberg Amtsgericht Ulm HRB 630217\nZeppelin GmbH – Friedrichshafen",
      "type": "Sonstige Registerbekanntmachung",
      "state": "Baden-Württemberg",
      "amtsgericht": "Amtsgericht Ulm",
      "registernummer": "HRB 630217",
      "registerart": "HRB",
      "company_name": "Zeppelin GmbH",
      "company_seat": "Friedrichshafen",
      "details": "30.05.2025 (Bekanntmachungsdatum)\n\nBaden-Württemberg Amtsgericht Ulm HRB 630217\nSonstige Registerbekanntmachung\n\nZeppelin GmbH\nGesellschaft mit beschränkter Haftung\nFriedrichshafen\n\nDie Gesellschaft hat am 28.05.2025 die Liste über die Zusammensetzung des Aufsichtsrats zum Handelsregister eingereicht."
    },
    {
      "date": "2025-05-30",
      "id": "110647",
      "original_text": "Registerbekanntmachung nach dem Umwandlungsgesetz\nBaden-Württemberg Amtsgericht Mannheim HRB 336064\ntangro software components gmbh – Heidelberg",
      "type": "Registerbekanntmachung nach dem Umwandlungsgesetz",
      "state": "Baden-Württemberg",
      "amtsgericht": "Amtsgericht Mannheim",
      "registernummer": "HRB 336064",
      "registerart": "HRB",
      "company_name": "tangro software components gmbh",
      "company_seat": "Heidelberg",
      "details": "30.05.2025 (Bekanntmachungsdatum)\n\nBaden-Württemberg Amtsgericht Mannheim HRB 336064\nRegisterbekanntmachung nach dem Umwandlungsgesetz 30.05.2025 (Eintragungsdatum)\n\ntangro software components gmbh\nGesellschaft mit beschränkter Haftung\nHeidelberg\n\nDen Gläubigern der an der Verschmelzung beteiligten Rechtsträger ist, wenn sie binnen sechs Monaten nach dem Tag, an dem die Eintragung der Verschmelzung in das Register des Sitzes desjenigen Rechtsträgers, dessen Gläubiger sie sind, nach § 19 Abs. 3 UmwG als bekanntgemacht gilt, ihren Anspruch nach Grund und Höhe schriftlich anmelden, Sicherheit zu leisten, soweit sie nicht Befriedigung verlangen können. Dieses Recht steht den Gläubigern jedoch nur zu, wenn sie glaubhaft machen, dass durch die Verschmelzung die Erfüllung ihrer Forderung gefährdet wird."
    },
    {
      "date": "2025-05-30",
      "id": "110648",
      "original_text": "Registerbekanntmachung nach dem Umwandlungsgesetz\nHamburg Amtsgericht Hamburg HRB 191077\nCompanyCheck Deutschland GmbH – Hamburg",
      "type": "Registerbekanntmachung nach dem Umwandlungsgesetz",
      "state": "Hamburg",
      "amtsgericht": "Amtsgericht Hamburg",
      "registernummer": "HRB 191077",
      "registerart": "HRB",
      "company_name": "CompanyCheck Deutschland GmbH",
      "company_seat": "Hamburg",
      "details": "30.05.2025 (Bekanntmachungsdatum)\n\nHamburg Amtsgericht Hamburg HRB 191077\nRegisterbekanntmachung nach dem Umwandlungsgesetz 30.05.2025 (Eintragungsdatum)\n\nCompanyCheck Deutschland GmbH\nGesellschaft mit beschränkter Haftung\nHamburg\n\nAls nicht eingetragen wird bekannt gemacht:\nDen Gläubigern der an der Verschmelzung beteiligten Gesellschaften ist, wenn sie binnen sechs Monaten nach dem Tag, an dem die Eintragung der Verschmelzung in das Register des Sitzes desjenigen Rechtsträgers, dessen Gläubiger sie sind, nach § 19 Absatz 3 UmwG als bekannt gemacht gilt, ihren Anspruch nach Grund und Höhe schriftlich anmelden, Sicherheit zu leisten, soweit sie nicht Befriedigung verlangen können. Dieses Recht steht den Gläubigern jedoch nur zu, wenn sie glaubhaft machen, dass durch die Verschmelzung die Erfüllung ihrer Forderung gefährdet wird."
    },
    {
      "date": "2025-05-30",
      "id": "110649",
      "original_text": "Einreichung neuer Dokumente\nBaden-Württemberg Amtsgericht Ulm HRB 729780\nZeppelin Systems GmbH – Friedrichshafen",
      "type": "Einreichung neuer Dokumente",
      "state": "Baden-Württemberg",
      "amtsgericht": "Amtsgericht Ulm",
      "registernummer": "HRB 729780",
      "registerart": "HRB",
      "company_name": "Zeppelin Systems GmbH",
      "company_seat": "Friedrichshafen",
      "details": "30.05.2025 (Bekanntmachungsdatum)\n\nBaden-Württemberg Amtsgericht Ulm HRB 729780\nEinreichung neuer Dokumente\n\nZeppelin Systems GmbH\nGesellschaft mit beschränkter Haftung\nFriedrichshafen\n\nDie Gesellschaft hat am #Fall.Eingang die Liste über die Zusammensetzung des Aufsichtsrats zum Handelsregister eingereicht."
    },
    {
      "date": "2025-05-30",
      "id": "110650",
      "original_text": "Einreichung neuer Dokumente\nBerlin Amtsgericht Berlin (Charlottenburg) HRB 99726\nLandesbank Berlin AG – Berlin",
      "type": "Einreichung neuer Dokumente",
      "state": "Berlin",
      "amtsgericht": "Amtsgericht Berlin (Charlottenburg)",
      "registernummer": "HRB 99726",
      "registerart": "HRB",
      "company_name": "Landesbank Berlin AG",
      "company_seat": "Berlin",
      "details": "30.05.2025 (Bekanntmachungsdatum)\n\nBerlin Amtsgericht Berlin (Charlottenburg) HRB 99726\nEinreichung neuer Dokumente\n\nLandesbank Berlin AG\nAktiengesellschaft\nBerlin\n\nAls nicht eingetragen wird veröffentlicht: Es wurde eine neue Liste der Aufsichtsratsmitglieder eingereicht (§ 106 AktG)."
    },
    {
      "date": "2025-05-30",
      "id": "110651",
      "original_text": "Sonstige Registerbekanntmachung\nBaden-Württemberg Amtsgericht Mannheim HRB 722921\nMektec Europe Sales GmbH – Weinheim",
      "type": "Sonstige Registerbekanntmachung",
      "state": "Baden-Württemberg",
      "amtsgericht": "Amtsgericht Mannheim",
      "registernummer": "HRB 722921",
      "registerart": "HRB",
      "company_name": "Mektec Europe Sales GmbH",
      "company_seat": "Weinheim",
      "details": "30.05.2025 (Bekanntmachungsdatum)\n\nBaden-Württemberg Amtsgericht Mannheim HRB 722921\nSonstige Registerbekanntmachung 30.05.2025 (Eintragungsdatum)\n\nMektec Europe Sales GmbH\nGesellschaft mit beschränkter Haftung\nWeinheim\n\nAls nicht eingetragen wird bekanntgemacht:\nDen Gläubigern der Gesellschaft, deren Forderungen begründet worden sind, bevor die Eintragung der Beendigung des Vertrages in das Handelsregister nach § 10 HGB als bekanntgemacht gilt, ist vom anderen Vertragsteil Sicherheit zu leisten, wenn sie sich binnen sechs Monaten nach der Bekanntmachung zu diesem Zweck bei ihm melden."
    },
    {
      "date": "2025-05-30",
      "id": "110652",
      "original_text": "Einreichung neuer Dokumente\nBaden-Württemberg Amtsgericht Stuttgart HRB 771043\nKnowunity GmbH – Sindelfingen",
      "type": "Einreichung neuer Dokumente",
      "state": "Baden-Württemberg",
      "amtsgericht": "Amtsgericht Stuttgart",
      "registernummer": "HRB 771043",
      "registerart": "HRB",
      "company_name": "Knowunity GmbH",
      "company_seat": "Sindelfingen",
      "details": "30.05.2025 (Bekanntmachungsdatum)\n\nBaden-Württemberg Amtsgericht Stuttgart HRB 771043\nEinreichung neuer Dokumente 30.05.2025 (Eintragungsdatum)\n\nKnowunity GmbH\nGesellschaft mit beschränkter Haftung\nSindelfingen\n\nDie Gesellschaft hat am 21.05.2025 die Liste über die Zusammensetzung der Mitglieder des Beirats zum Handelsregister eingereicht."
    },
    {
      "date": "2025-05-30",
      "id": "110653",
      "original_text": "Löschungsankündigung\nMecklenburg-Vorpommern Amtsgericht Stralsund HRB 21042\nalethia-group GmbH – Greifswald",
      "type": "Löschungsankündigung",
      "state": "Mecklenburg-Vorpommern",
      "amtsgericht": "Amtsgericht Stralsund",
      "registernummer": "HRB 21042",
      "registerart": "HRB",
      "company_name": "alethia-group GmbH",
      "company_seat": "Greifswald",
      "details": "30.05.2025 (Bekanntmachungsdatum)\n\nMecklenburg-Vorpommern Amtsgericht Stralsund HRB 21042\nLöschungsankündigung\n\nalethia-group GmbH\nGesellschaft mit beschränkter Haftung\nGreifswald\n\nDas Registergericht beabsichtigt, die Firma von Amts wegen nach § 394 FamFG zu löschen. Die Frist zur Erhebung eines Widerspruchs ist auf 1 Monat festgesetzt."
    },
    {
      "date": "2025-05-30",
      "id": "110654",
      "original_text": "Registerbekanntmachung nach dem Umwandlungsgesetz\nBaden-Württemberg Amtsgericht Mannheim HRB 737819\nCast One GmbH – St. Leon-Rot",
      "type": "Registerbekanntmachung nach dem Umwandlungsgesetz",
      "state": "Baden-Württemberg",
      "amtsgericht": "Amtsgericht Mannheim",
      "registernummer": "HRB 737819",
      "registerart": "HRB",
      "company_name": "Cast One GmbH",
      "company_seat": "St. Leon-Rot",
      "details": "30.05.2025 (Bekanntmachungsdatum)\n\nBaden-Württemberg Amtsgericht Mannheim HRB 737819\nRegisterbekanntmachung nach dem Umwandlungsgesetz 30.05.2025 (Eintragungsdatum)\n\nCast One GmbH\nGesellschaft mit beschränkter Haftung\nSt. Leon-Rot\n\nAls nicht eingetragen wird bekanntgemacht: Den Gläubigern der an der Verschmelzung beteiligten Rechtsträger ist, wenn sie binnen sechs Monaten nach dem Tag, an dem die Eintragung der Verschmelzung in das Register des Sitzes desjenigen Rechtsträgers, dessen Gläubiger sie sind, nach § 19 Abs. 3 UmwG als bekanntgemacht gilt, ihren Anspruch nach Grund und Höhe schriftlich anmelden, Sicherheit zu leisten, soweit sie nicht Befriedigung verlangen können. Dieses Recht steht den Gläubigern jedoch nur zu, wenn sie glaubhaft machen, dass durch die Verschmelzung die Erfüllung ihrer Forderung gefährdet wird."
    },
    {
      "date": "2025-05-30",
      "id": "110655",
      "original_text": "Einreichung neuer Dokumente\nBrandenburg Amtsgericht Cottbus HRB 3595\nIngenieurgesellschaft für Bauwesen und Grundstücksverwaltung Bad Liebenwerda mbH – Bad Liebenwerda",
      "type": "Einreichung neuer Dokumente",
      "state": "Brandenburg",
      "amtsgericht": "Amtsgericht Cottbus",
      "registernummer": "HRB 3595",
      "registerart": "HRB",
      "company_name": "Ingenieurgesellschaft für Bauwesen und Grundstücksverwaltung Bad Liebenwerda mbH",
      "company_seat": "Bad Liebenwerda",
      "details": "30.05.2025 (Bekanntmachungsdatum)\n\nBrandenburg Amtsgericht Cottbus HRB 3595\nEinreichung neuer Dokumente\n\nIngenieurgesellschaft für Bauwesen und Grundstücksverwaltung Bad Liebenwerda mbH\nGesellschaft mit beschränkter Haftung\nBad Liebenwerda\n\nAls nicht eingetragen wird veröffentlicht:\nDie aktuelle Liste der Aufsichtsratsmitglieder wurde zum Handelsregister gem. § 52 Abs. 3 GmbHG eingereicht."
    },
    {
      "date": "2025-05-30",
      "id": "110656",
      "original_text": "Registerbekanntmachung nach dem Umwandlungsgesetz\nBaden-Württemberg Amtsgericht Stuttgart HRB 799256\nBaris Holding GmbH – Heilbronn",
      "type": "Registerbekanntmachung nach dem Umwandlungsgesetz",
      "state": "Baden-Württemberg",
      "amtsgericht": "Amtsgericht Stuttgart",
      "registernummer": "HRB 799256",
      "registerart": "HRB",
      "company_name": "Baris Holding GmbH",
      "company_seat": "Heilbronn",
      "details": "30.05.2025 (Bekanntmachungsdatum)\n\nBaden-Württemberg Amtsgericht Stuttgart HRB 799256\nRegisterbekanntmachung nach dem Umwandlungsgesetz 30.05.2025 (Eintragungsdatum)\n\nBaris Holding GmbH\nGesellschaft mit beschränkter Haftung\nHeilbronn\n\nDen Gläubigern der an der Abspaltung beteiligten Rechtsträger ist, wenn sie binnen sechs Monaten nach dem Tag, an dem die Eintragung der Abspaltung in das Register des Sitzes desjenigen Rechtsträgers, dessen Gläubiger sie sind, nach § 19 Abs. 3 UmwG als bekanntgemacht gilt, ihren Anspruch nach Grund und Höhe schriftlich anmelden, Sicherheit zu leisten, soweit sie nicht Befriedigung verlangen können. Dieses Recht steht den Gläubigern jedoch nur zu, wenn sie glaubhaft machen, dass durch die Abspaltung die Erfüllung ihrer Forderung gefährdet wird."
    },
    {
      "date": "2025-05-30",
      "id": "110657",
      "original_text": "Registerbekanntmachung nach dem Umwandlungsgesetz\nHamburg Amtsgericht Hamburg HRB 188058\nbp Retail Netherlands GmbH – Hamburg",
      "type": "Registerbekanntmachung nach dem Umwandlungsgesetz",
      "state": "Hamburg",
      "amtsgericht": "Amtsgericht Hamburg",
      "registernummer": "HRB 188058",
      "registerart": "HRB",
      "company_name": "bp Retail Netherlands GmbH",
      "company_seat": "Hamburg",
      "details": "30.05.2025 (Bekanntmachungsdatum)\n\nHamburg Amtsgericht Hamburg HRB 188058\nRegisterbekanntmachung nach dem Umwandlungsgesetz 30.05.2025 (Eintragungsdatum)\n\nbp Retail Netherlands GmbH\nGesellschaft mit beschränkter Haftung\nHamburg\n\nAls nicht eingetragen wird bekannt gemacht:\nDen Gläubigern der an der Ausgliederung beteiligten Gesellschaften ist, wenn sie binnen sechs Monaten nach dem Tag, an dem die Eintragung der Ausgliederung in das Register des Sitzes desjenigen Rechtsträgers, dessen Gläubiger sie sind, nach § 19 Absatz 3 UmwG als bekannt gemacht gilt, ihren Anspruch nach Grund und Höhe schriftlich anmelden, Sicherheit zu leisten, soweit sie nicht Befriedigung verlangen können. Dieses Recht steht den Gläubigern jedoch nur zu, wenn sie glaubhaft machen, dass durch die Ausgliederung die Erfüllung ihrer Forderung gefährdet wird."
    },
    {
      "date": "2025-05-30",
      "id": "110658",
      "original_text": "Registerbekanntmachung nach dem Umwandlungsgesetz\nHamburg Amtsgericht Hamburg HRB 113611\nBP Europa SE – Hamburg",
      "type": "Registerbekanntmachung nach dem Umwandlungsgesetz",
      "state": "Hamburg",
      "amtsgericht": "Amtsgericht Hamburg",
      "registernummer": "HRB 113611",
      "registerart": "HRB",
      "company_name": "BP Europa SE",
      "company_seat": "Hamburg",
      "details": "30.05.2025 (Bekanntmachungsdatum)\n\nHamburg Amtsgericht Hamburg HRB 113611\nRegisterbekanntmachung nach dem Umwandlungsgesetz 30.05.2025 (Eintragungsdatum)\n\nBP Europa SE\nEuropäische Aktiengesellschaft (SE)\nHamburg\n\nAls nicht eingetragen wird bekannt gemacht:\nDen Gläubigern der an der Ausgliederung beteiligten Gesellschaften ist, wenn sie binnen sechs Monaten nach dem Tag, an dem die Eintragung der Ausgliederung in das Register des Sitzes derjenigen Rechtsträger deren Gläubiger sie sind, nach § 19 Absatz 3 UmwG als bekannt gemacht gilt, ihren Anspruch nach Grund und Höhe schriftlich anmelden, Sicherheit zu leisten, soweit sie nicht Befriedigung verlangen können. Dieses Recht steht den Gläubigern jedoch nur zu, wenn sie glaubhaft machen, dass durch die Ausgliederung die Erfüllung ihrer Forderung gefährdet wird."
    },
    {
      "date": "2025-05-30",
      "id": "110659",
      "original_text": "Registerbekanntmachung nach dem Umwandlungsgesetz\nHamburg Amtsgericht Hamburg HRB 188022\nbp Netherlands GmbH – Hamburg",
      "type": "Registerbekanntmachung nach dem Umwandlungsgesetz",
      "state": "Hamburg",
      "amtsgericht": "Amtsgericht Hamburg",
      "registernummer": "HRB 188022",
      "registerart": "HRB",
      "company_name": "bp Netherlands GmbH",
      "company_seat": "Hamburg",
      "details": "30.05.2025 (Bekanntmachungsdatum)\n\nHamburg Amtsgericht Hamburg HRB 188022\nRegisterbekanntmachung nach dem Umwandlungsgesetz 30.05.2025 (Eintragungsdatum)\n\nbp Netherlands GmbH\nGesellschaft mit beschränkter Haftung\nHamburg\n\nAls nicht eingetragen wird bekannt gemacht:\nDen Gläubigern der an der Ausgliederung beteiligten Gesellschaften ist, wenn sie binnen sechs Monaten nach dem Tag, an dem die Eintragung der Ausgliederung in das Register des Sitzes desjenigen Rechtsträgers, dessen Gläubiger sie sind, nach § 19 Absatz 3 UmwG als bekannt gemacht gilt, ihren Anspruch nach Grund und Höhe schriftlich anmelden, Sicherheit zu leisten, soweit sie nicht Befriedigung verlangen können. Dieses Recht steht den Gläubigern jedoch nur zu, wenn sie glaubhaft machen, dass durch die Ausgliederung die Erfüllung ihrer Forderung gefährdet wird."
    },
    {
      "date": "2025-05-30",
      "id": "110660",
      "original_text": "Einreichung neuer Dokumente\nSaarland Amtsgericht Saarbrücken HRB 5222\nGesellschaft für staatsbürgerliche Bildung Saar mbH – Saarbrücken",
      "type": "Einreichung neuer Dokumente",
      "state": "Saarland",
      "amtsgericht": "Amtsgericht Saarbrücken",
      "registernummer": "HRB 5222",
      "registerart": "HRB",
      "company_name": "Gesellschaft für staatsbürgerliche Bildung Saar mbH",
      "company_seat": "Saarbrücken",
      "details": "30.05.2025 (Bekanntmachungsdatum)\n\nSaarland Amtsgericht Saarbrücken HRB 5222\nEinreichung neuer Dokumente\n\nGesellschaft für staatsbürgerliche Bildung Saar mbH\nGesellschaft mit beschränkter Haftung\nSaarbrücken\n\nDie Geschäftsführung der Gesellschaft hat eine Liste der Mitglieder des Aufsichtsrats zum Handelsregister eingereicht (§ 52 Abs. 3 Satz 2 GmbHG)."
    },
    {
      "date": "2025-05-30",
      "id": "110661",
      "original_text": "Registerbekanntmachung nach dem Umwandlungsgesetz\nBerlin Amtsgericht Berlin (Charlottenburg) HRB 245468\nFT Beteiligung GmbH – Berlin",
      "type": "Registerbekanntmachung nach dem Umwandlungsgesetz",
      "state": "Berlin",
      "amtsgericht": "Amtsgericht Berlin (Charlottenburg)",
      "registernummer": "HRB 245468",
      "registerart": "HRB",
      "company_name": "FT Beteiligung GmbH",
      "company_seat": "Berlin",
      "details": "30.05.2025 (Bekanntmachungsdatum)\n\nBerlin Amtsgericht Berlin (Charlottenburg) HRB 245468\nRegisterbekanntmachung nach dem Umwandlungsgesetz 28.05.2025 (Eintragungsdatum)\n\nFT Beteiligung GmbH\nGesellschaft mit beschränkter Haftung\nBerlin\n\nZu Eintragungsnummer 9 vom 28.05.2025 wird als nicht eingetragen veröffentlicht: Den Gläubigern der an der Verschmelzung beteiligten Rechtsträger ist, wenn sie binnen sechs Monaten nach dem Tag, an dem die Eintragung der Verschmelzung in das Register des Sitzes desjenigen Rechtsträgers, dessen Gläubiger sie sind, als bekannt gemacht gilt, ihren Anspruch nach Grund und Höhe schriftlich anmelden, Sicherheit zu leisten, soweit sie nicht Befriedigung verlangen können. Dieses Recht steht den Gläubigern jedoch nur zu, wenn sie glaubhaft machen, dass durch die Verschmelzung die Erfüllung ihrer Forderung gefährdet wird. Das Recht, Sicherheitsleistung zu verlangen, steht Gläubigern nicht zu, die im Falle der Insolvenz ein Recht auf vorzugsweise Befriedigung aus einer Deckungsmasse haben, die nach gesetzlicher Vorschrift zu ihrem Schutz errichtet und staatlich überwacht ist."
    },
    {
      "date": "2025-05-30",
      "id": "110662",
      "original_text": "Löschungsankündigung\nMecklenburg-Vorpommern Amtsgericht Stralsund HRB 8783\nMOLTO Industries GmbH – Grimmen",
      "type": "Löschungsankündigung",
      "state": "Mecklenburg-Vorpommern",
      "amtsgericht": "Amtsgericht Stralsund",
      "registernummer": "HRB 8783",
      "registerart": "HRB",
      "company_name": "MOLTO Industries GmbH",
      "company_seat": "Grimmen",
      "details": "30.05.2025 (Bekanntmachungsdatum)\n\nMecklenburg-Vorpommern Amtsgericht Stralsund HRB 8783\nLöschungsankündigung\n\nMOLTO Industries GmbH\nGesellschaft mit beschränkter Haftung\nGrimmen\n\nDas Registergericht beabsichtigt, die Firma von Amts wegen nach § 394 FamFG zu löschen. Die Frist zur Erhebung eines Widerspruchs ist auf 1 Monat festgesetzt."
    },
    {
      "date": "2025-05-30",
      "id": "110663",
      "original_text": "Registerbekanntmachung nach dem Umwandlungsgesetz\nBaden-Württemberg Amtsgericht Ulm HRA 729407\nMartin Bleicher Industriedienstleistungen e.K. – Eislingen",
      "type": "Registerbekanntmachung nach dem Umwandlungsgesetz",
      "state": "Baden-Württemberg",
      "amtsgericht": "Amtsgericht Ulm",
      "registernummer": "HRA 729407",
      "registerart": "HRA",
      "company_name": "Martin Bleicher Industriedienstleistungen e.K.",
      "company_seat": "Eislingen",
      "details": "30.05.2025 (Bekanntmachungsdatum)\n\nBaden-Württemberg Amtsgericht Ulm HRA 729407\nRegisterbekanntmachung nach dem Umwandlungsgesetz 30.05.2025 (Eintragungsdatum)\n\nMartin Bleicher Industriedienstleistungen e.K.\nEinzelkaufmann / Einzelkauffrau\nEislingen\n\nAls nicht eingetragen wird bekanntgemacht:\nDen Gläubigern der an der Ausgliederung beteiligten Rechtsträger ist, wenn sie binnen sechs Monaten nach dem Tag, an dem die Eintragung der Ausgliederung in das Register des Sitzes desjenigen Rechtsträgers, dessen Gläubiger sie sind, nach § 19 Abs. 3 UmwG als bekanntgemacht gilt, ihren Anspruch nach Grund und Höhe schriftlich anmelden, Sicherheit zu leisten, soweit sie nicht Befriedigung verlangen können. Dieses Recht steht den Gläubigern jedoch nur zu, wenn sie glaubhaft machen, dass durch die Ausgliederung die Erfüllung ihrer Forderung gefährdet wird."
    },
    {
      "date": "2025-05-30",
      "id": "110664",
      "original_text": "Registerbekanntmachung nach dem Umwandlungsgesetz\nBaden-Württemberg Amtsgericht Ulm HRB 749086\nBTS Bleicher Technik & Service GmbH – Eislingen",
      "type": "Registerbekanntmachung nach dem Umwandlungsgesetz",
      "state": "Baden-Württemberg",
      "amtsgericht": "Amtsgericht Ulm",
      "registernummer": "HRB 749086",
      "registerart": "HRB",
      "company_name": "BTS Bleicher Technik & Service GmbH",
      "company_seat": "Eislingen",
      "details": "30.05.2025 (Bekanntmachungsdatum)\n\nBaden-Württemberg Amtsgericht Ulm HRB 749086\nRegisterbekanntmachung nach dem Umwandlungsgesetz 30.05.2025 (Eintragungsdatum)\n\nBTS Bleicher Technik & Service GmbH\nGesellschaft mit beschränkter Haftung\nEislingen\n\nAls nicht eingetragen wird bekanntgemacht:\nDen Gläubigern der an der Ausgliederung beteiligten Rechtsträger ist, wenn sie binnen sechs Monaten nach dem Tag, an dem die Eintragung der Ausgliederung in das Register des Sitzes desjenigen Rechtsträgers, dessen Gläubiger sie sind, nach § 19 Abs. 3 UmwG als bekanntgemacht gilt, ihren Anspruch nach Grund und Höhe schriftlich anmelden, Sicherheit zu leisten, soweit sie nicht Befriedigung verlangen können. Dieses Recht steht den Gläubigern jedoch nur zu, wenn sie glaubhaft machen, dass durch die Ausgliederung die Erfüllung ihrer Forderung gefährdet wird."
    },
    {
      "date": "2025-05-30",
      "id": "110665",
      "original_text": "Registerbekanntmachung nach dem Umwandlungsgesetz\nBerlin Amtsgericht Berlin (Charlottenburg) HRB 226187\nSmart & Green Timber Solutions GmbH – Berlin",
      "type": "Registerbekanntmachung nach dem Umwandlungsgesetz",
      "state": "Berlin",
      "amtsgericht": "Amtsgericht Berlin (Charlottenburg)",
      "registernummer": "HRB 226187",
      "registerart": "HRB",
      "company_name": "Smart & Green Timber Solutions GmbH",
      "company_seat": "Berlin",
      "details": "30.05.2025 (Bekanntmachungsdatum)\n\nBerlin Amtsgericht Berlin (Charlottenburg) HRB 226187\nRegisterbekanntmachung nach dem Umwandlungsgesetz 28.05.2025 (Eintragungsdatum)\n\nSmart & Green Timber Solutions GmbH\nGesellschaft mit beschränkter Haftung\nBerlin\n\nZu Eintragungsnummer 3 vom 28.05.2025 wird als nicht eingetragen veröffentlicht: Den Gläubigern der an der Verschmelzung beteiligten Rechtsträger ist, wenn sie binnen sechs Monaten nach dem Tag, an dem die Eintragung der Verschmelzung in das Register des Sitzes desjenigen Rechtsträgers, dessen Gläubiger sie sind, als bekannt gemacht gilt, ihren Anspruch nach Grund und Höhe schriftlich anmelden, Sicherheit zu leisten, soweit sie nicht Befriedigung verlangen können. Dieses Recht steht den Gläubigern jedoch nur zu, wenn sie glaubhaft machen, dass durch die Verschmelzung die Erfüllung ihrer Forderung gefährdet wird. Das Recht, Sicherheitsleistung zu verlangen, steht Gläubigern nicht zu, die im Falle der Insolvenz ein Recht auf vorzugsweise Befriedigung aus einer Deckungsmasse haben, die nach gesetzlicher Vorschrift zu ihrem Schutz errichtet und staatlich überwacht ist."
    },
    {
      "date": "2025-05-30",
      "id": "110666",
      "original_text": "Löschungsankündigung\nBerlin Amtsgericht Berlin (Charlottenburg) HRB 170379\nMiddle Earth Namo Verwaltung Unternehmergesellschaft (haftungsbeschränkt) – Berlin",
      "type": "Löschungsankündigung",
      "state": "Berlin",
      "amtsgericht": "Amtsgericht Berlin (Charlottenburg)",
      "registernummer": "HRB 170379",
      "registerart": "HRB",
      "company_name": "Middle Earth Namo Verwaltung Unternehmergesellschaft (haftungsbeschränkt)",
      "company_seat": "Berlin",
      "details": "30.05.2025 (Bekanntmachungsdatum)\n\nBerlin Amtsgericht Berlin (Charlottenburg) HRB 170379\nLöschungsankündigung\n\nMiddle Earth Namo Verwaltung Unternehmergesellschaft (haftungsbeschränkt)\nGesellschaft mit beschränkter Haftung\nBerlin\n\nBei der nachstehenden Gesellschaft wird das Amtslöschungsverfahren gemäß § 394 FamFG eingeleitet. Widerspruchsfrist 6 Wochen"
    },
    {
      "date": "2025-05-30",
      "id": "110667",
      "original_text": "Registerbekanntmachung nach dem Umwandlungsgesetz\nBrandenburg Amtsgericht Potsdam HRB 26441\nGALAFA Holding GmbH – Falkensee",
      "type": "Registerbekanntmachung nach dem Umwandlungsgesetz",
      "state": "Brandenburg",
      "amtsgericht": "Amtsgericht Potsdam",
      "registernummer": "HRB 26441",
      "registerart": "HRB",
      "company_name": "GALAFA Holding GmbH",
      "company_seat": "Falkensee",
      "details": "30.05.2025 (Bekanntmachungsdatum)\n\nBrandenburg Amtsgericht Potsdam HRB 26441\nRegisterbekanntmachung nach dem Umwandlungsgesetz 27.05.2025 (Eintragungsdatum)\n\nGALAFA Holding GmbH\nGesellschaft mit beschränkter Haftung\nFalkensee\n\nZu Eintragungsnummer 4 vom 27.05.2025 wird als nicht eingetragen veröffentlicht: Den Gläubigern der an der Verschmelzung beteiligten Rechtsträger ist, wenn sie binnen sechs Monaten nach dem Tag, an dem die Eintragung der Verschmelzung in das Register des Sitzes desjenigen Rechtsträgers, dessen Gläubiger sie sind, als bekannt gemacht gilt, ihren Anspruch nach Grund und Höhe schriftlich anmelden, Sicherheit zu leisten, soweit sie nicht Befriedigung verlangen können. Dieses Recht steht den Gläubigern jedoch nur zu, wenn sie glaubhaft machen, dass durch die Verschmelzung die Erfüllung ihrer Forderung gefährdet wird."
    },
    {
      "date": "2025-05-30",
      "id": "110668",
      "original_text": "Registerbekanntmachung nach dem Umwandlungsgesetz\nNordrhein-Westfalen Amtsgericht Coesfeld HRA 10143\nGertrud Vorspohl e.K. – Ascheberg",
      "type": "Registerbekanntmachung nach dem Umwandlungsgesetz",
      "state": "Nordrhein-Westfalen",
      "amtsgericht": "Amtsgericht Coesfeld",
      "registernummer": "HRA 10143",
      "registerart": "HRA",
      "company_name": "Gertrud Vorspohl e.K.",
      "company_seat": "Ascheberg",
      "details": "30.05.2025 (Bekanntmachungsdatum)\n\nNordrhein-Westfalen Amtsgericht Coesfeld HRA 10143\nRegisterbekanntmachung nach dem Umwandlungsgesetz 30.05.2025 (Eintragungsdatum)\n\nGertrud Vorspohl e.K.\nEinzelkaufmann\nAscheberg\n\nDen Gläubigern der an der Ausgliederung beteiligten Rechtsträger ist, wenn sie binnen sechs Monaten nach dem Tag, an dem die Eintragung der Ausgliederung in das Register des Sitzes desjenigen Rechtsträgers, dessen Gläubiger sie sind, nach § 19 Absatz 3 UmwG als bekanntgemacht gilt, ihren Anspruch nach Grund und Höhe schriftlich anmelden, Sicherheit zu leisten, soweit sie nicht Befriedigung verlangen können. Dieses Recht steht den Gläubigern jedoch nur zu, wenn sie glaubhaft machen, dass durch die Ausgliederung die Erfüllung ihrer Forderung gefährdet wird."
    },
    {
      "date": "2025-05-30",
      "id": "110669",
      "original_text": "Registerbekanntmachung nach dem Umwandlungsgesetz\nBerlin Amtsgericht Berlin (Charlottenburg) HRA 58437\nNeXtWind Windpark Beteiligung III GmbH & Co. KG – Berlin",
      "type": "Registerbekanntmachung nach dem Umwandlungsgesetz",
      "state": "Berlin",
      "amtsgericht": "Amtsgericht Berlin (Charlottenburg)",
      "registernummer": "HRA 58437",
      "registerart": "HRA",
      "company_name": "NeXtWind Windpark Beteiligung III GmbH & Co. KG",
      "company_seat": "Berlin",
      "details": "30.05.2025 (Bekanntmachungsdatum)\n\nBerlin Amtsgericht Berlin (Charlottenburg) HRA 58437\nRegisterbekanntmachung nach dem Umwandlungsgesetz 28.05.2025 (Eintragungsdatum)\n\nNeXtWind Windpark Beteiligung III GmbH & Co. KG\nKommanditgesellschaft\nBerlin\n\nZu Eintragungsnummer 4 vom 28.05.2025 wird als nicht eingetragen veröffentlicht: Den Gläubigern der an der Spaltung beteiligten Rechtsträger ist, wenn sie binnen sechs Monaten nach dem Tag, an dem die Eintragung der Spaltung in das Register des Sitzes desjenigen Rechtsträgers, dessen Gläubiger sie sind, als bekannt gemacht gilt, ihren Anspruch nach Grund und Höhe schriftlich anmelden, Sicherheit zu leisten, soweit sie nicht Befriedigung verlangen können. Dieses Recht steht den Gläubigern jedoch nur zu, wenn sie glaubhaft machen, dass durch die Spaltung die Erfüllung ihrer Forderung gefährdet wird. Das Recht, Sicherheitsleistung zu verlangen, steht Gläubigern nicht zu, die im Falle der Insolvenz ein Recht auf vorzugsweise Befriedigung aus einer Deckungsmasse haben, die nach gesetzlicher Vorschrift zu ihrem Schutz errichtet und staatlich überwacht ist."
    },
    {
      "date": "2025-05-30",
      "id": "110670",
      "original_text": "Registerbekanntmachung nach dem Umwandlungsgesetz\nBerlin Amtsgericht Berlin (Charlottenburg) HRA 63210\nNeXtWind Windpark Beteiligung 29 GmbH & Co. KG – Berlin",
      "type": "Registerbekanntmachung nach dem Umwandlungsgesetz",
      "state": "Berlin",
      "amtsgericht": "Amtsgericht Berlin (Charlottenburg)",
      "registernummer": "HRA 63210",
      "registerart": "HRA",
      "company_name": "NeXtWind Windpark Beteiligung 29 GmbH & Co. KG",
      "company_seat": "Berlin",
      "details": "30.05.2025 (Bekanntmachungsdatum)\n\nBerlin Amtsgericht Berlin (Charlottenburg) HRA 63210\nRegisterbekanntmachung nach dem Umwandlungsgesetz 28.05.2025 (Eintragungsdatum)\n\nNeXtWind Windpark Beteiligung 29 GmbH & Co. KG\nKommanditgesellschaft\nBerlin\n\nZu Eintragungsnummer 4 vom 28.05.2025 wird als nicht eingetragen veröffentlicht: Den Gläubigern der an der Spaltung beteiligten Rechtsträger ist, wenn sie binnen sechs Monaten nach dem Tag, an dem die Eintragung der Spaltung in das Register des Sitzes desjenigen Rechtsträgers, dessen Gläubiger sie sind, als bekannt gemacht gilt, ihren Anspruch nach Grund und Höhe schriftlich anmelden, Sicherheit zu leisten, soweit sie nicht Befriedigung verlangen können. Dieses Recht steht den Gläubigern jedoch nur zu, wenn sie glaubhaft machen, dass durch die Spaltung die Erfüllung ihrer Forderung gefährdet wird. Das Recht, Sicherheitsleistung zu verlangen, steht Gläubigern nicht zu, die im Falle der Insolvenz ein Recht auf vorzugsweise Befriedigung aus einer Deckungsmasse haben, die nach gesetzlicher Vorschrift zu ihrem Schutz errichtet und staatlich überwacht ist."
    },
    {
      "date": "2025-05-30",
      "id": "110671",
      "original_text": "Registerbekanntmachung nach dem Umwandlungsgesetz\nHamburg Amtsgericht Hamburg HRB 94060\nDATAGROUP BIT Hamburg GmbH – Hamburg",
      "type": "Registerbekanntmachung nach dem Umwandlungsgesetz",
      "state": "Hamburg",
      "amtsgericht": "Amtsgericht Hamburg",
      "registernummer": "HRB 94060",
      "registerart": "HRB",
      "company_name": "DATAGROUP BIT Hamburg GmbH",
      "company_seat": "Hamburg",
      "details": "30.05.2025 (Bekanntmachungsdatum)\n\nHamburg Amtsgericht Hamburg HRB 94060\nRegisterbekanntmachung nach dem Umwandlungsgesetz 30.05.2025 (Eintragungsdatum)\n\nDATAGROUP BIT Hamburg GmbH\nGesellschaft mit beschränkter Haftung\nHamburg\n\nAls nicht eingetragen wird bekannt gemacht:\nDen Gläubigern der an der Verschmelzung beteiligten Gesellschaften ist, wenn sie binnen sechs Monaten nach dem Tag, an dem die Eintragung der Verschmelzung in das Register des Sitzes desjenigen Rechtsträgers, dessen Gläubiger sie sind, nach § 19 Absatz 3 UmwG als bekannt gemacht gilt, ihren Anspruch nach Grund und Höhe schriftlich anmelden, Sicherheit zu leisten, soweit sie nicht Befriedigung verlangen können. Dieses Recht steht den Gläubigern jedoch nur zu, wenn sie glaubhaft machen, dass durch die Verschmelzung die Erfüllung ihrer Forderung gefährdet wird."
    },
    {
      "date": "2025-05-30",
      "id": "110672",
      "original_text": "Registerbekanntmachung nach dem Umwandlungsgesetz\nBaden-Württemberg Amtsgericht Ulm HRB 501555\nCarl Zeiss AG – Oberkochen",
      "type": "Registerbekanntmachung nach dem Umwandlungsgesetz",
      "state": "Baden-Württemberg",
      "amtsgericht": "Amtsgericht Ulm",
      "registernummer": "HRB 501555",
      "registerart": "HRB",
      "company_name": "Carl Zeiss AG",
      "company_seat": "Oberkochen",
      "details": "30.05.2025 (Bekanntmachungsdatum)\n\nBaden-Württemberg Amtsgericht Ulm HRB 501555\nRegisterbekanntmachung nach dem Umwandlungsgesetz 30.05.2025 (Eintragungsdatum)\n\nCarl Zeiss AG\nAktiengesellschaft\nOberkochen\n\nAls nicht eingetragen wird bekanntgemacht:\nDen Gläubigern der an der Abspaltung beteiligten Rechtsträger ist, wenn sie binnen sechs Monaten nach dem Tag, an dem die Eintragung der Abspaltung in das Register des Sitzes desjenigen Rechtsträgers, dessen Gläubiger sie sind, nach § 19 Abs. 3 UmwG als bekanntgemacht gilt, ihren Anspruch nach Grund und Höhe schriftlich anmelden, Sicherheit zu leisten, soweit sie nicht Befriedigung verlangen können. Dieses Recht steht den Gläubigern jedoch nur zu, wenn sie glaubhaft machen, dass durch die Abspaltung die Erfüllung ihrer Forderung gefährdet wird."
    },
    {
      "date": "2025-05-30",
      "id": "110673",
      "original_text": "Einreichung neuer Dokumente\nHamburg Amtsgericht Hamburg HRB 161722\nWintershall Dea Deutschland GmbH – Hamburg",
      "type": "Einreichung neuer Dokumente",
      "state": "Hamburg",
      "amtsgericht": "Amtsgericht Hamburg",
      "registernummer": "HRB 161722",
      "registerart": "HRB",
      "company_name": "Wintershall Dea Deutschland GmbH",
      "company_seat": "Hamburg",
      "details": "30.05.2025 (Bekanntmachungsdatum)\n\nHamburg Amtsgericht Hamburg HRB 161722\nEinreichung neuer Dokumente\n\nWintershall Dea Deutschland GmbH\nGesellschaft mit beschränkter Haftung\nHamburg\n\nAls nicht eingetragen wird bekannt gemacht: Liste des Aufsichtsrats wurde eingereicht."
    },
    {
      "date": "2025-05-30",
      "id": "110674",
      "original_text": "Registerbekanntmachung nach dem Umwandlungsgesetz\nSchleswig-Holstein Amtsgericht Lübeck HRB 15132\nCONPLUS Mittelstandslösungen GmbH – Ahrensburg",
      "type": "Registerbekanntmachung nach dem Umwandlungsgesetz",
      "state": "Schleswig-Holstein",
      "amtsgericht": "Amtsgericht Lübeck",
      "registernummer": "HRB 15132",
      "registerart": "HRB",
      "company_name": "CONPLUS Mittelstandslösungen GmbH",
      "company_seat": "Ahrensburg",
      "details": "30.05.2025 (Bekanntmachungsdatum)\n\nSchleswig-Holstein Amtsgericht Lübeck HRB 15132\nRegisterbekanntmachung nach dem Umwandlungsgesetz 28.05.2025 (Eintragungsdatum)\n\nCONPLUS Mittelstandslösungen GmbH\nGesellschaft mit beschränkter Haftung\nAhrensburg\n\nZu Eintragungsnummer 6 vom 28.05.2025 wird als nicht eingetragen veröffentlicht:  Den Gläubigern der an der Verschmelzung beteiligten Rechtsträger ist, wenn sie binnen sechs Monaten nach dem Tag, an dem die Eintragung der Verschmelzung in das Register des Sitzes desjenigen Rechtsträgers, dessen Gläubiger sie sind, als bekannt gemacht gilt, ihren Anspruch nach Grund und Höhe schriftlich anmelden, Sicherheit zu leisten, soweit sie nicht Befriedigung verlangen können. Dieses Recht steht den Gläubigern jedoch nur zu, wenn sie glaubhaft machen, dass durch die Verschmelzung die Erfüllung ihrer Forderung gefährdet wird."
    },
    {
      "date": "2025-05-30",
      "id": "110675",
      "original_text": "Registerbekanntmachung nach dem Umwandlungsgesetz\nSchleswig-Holstein Amtsgericht Lübeck HRB 25375\nSemikolon GmbH – Geesthacht",
      "type": "Registerbekanntmachung nach dem Umwandlungsgesetz",
      "state": "Schleswig-Holstein",
      "amtsgericht": "Amtsgericht Lübeck",
      "registernummer": "HRB 25375",
      "registerart": "HRB",
      "company_name": "Semikolon GmbH",
      "company_seat": "Geesthacht",
      "details": "30.05.2025 (Bekanntmachungsdatum)\n\nSchleswig-Holstein Amtsgericht Lübeck HRB 25375\nRegisterbekanntmachung nach dem Umwandlungsgesetz 30.05.2025 (Eintragungsdatum)\n\nSemikolon GmbH\nGesellschaft mit beschränkter Haftung\nGeesthacht\n\nZu Eintragungsnummer 3 vom 30.05.2025 wird als nicht eingetragen veröffentlicht: Den Gläubigern der an der Spaltung beteiligten Rechtsträger ist, wenn sie binnen sechs Monaten nach dem Tag, an dem die Eintragung der Spaltung in das Register des Sitzes desjenigen Rechtsträgers, dessen Gläubiger sie sind, als bekannt gemacht gilt, ihren Anspruch nach Grund und Höhe schriftlich anmelden, Sicherheit zu leisten, soweit sie nicht Befriedigung verlangen können. Dieses Recht steht den Gläubigern jedoch nur zu, wenn sie glaubhaft machen, dass durch die Spaltung die Erfüllung ihrer Forderung gefährdet wird."
    },
    {
      "date": "2025-05-30",
      "id": "110676",
      "original_text": "Einreichung neuer Dokumente\nSachsen Amtsgericht Dresden HRB 39619\nServicegesellschaft Spreequellen mbH – Ebersbach-Neugersdorf",
      "type": "Einreichung neuer Dokumente",
      "state": "Sachsen",
      "amtsgericht": "Amtsgericht Dresden",
      "registernummer": "HRB 39619",
      "registerart": "HRB",
      "company_name": "Servicegesellschaft Spreequellen mbH",
      "company_seat": "Ebersbach-Neugersdorf",
      "details": "30.05.2025 (Bekanntmachungsdatum)\n\nSachsen Amtsgericht Dresden HRB 39619\nEinreichung neuer Dokumente\n\nServicegesellschaft Spreequellen mbH\nGesellschaft mit beschränkter Haftung\nEbersbach-Neugersdorf\n\nAm 28.05.2025 wurde beim Handelsregister des Amtsgerichts Dresden die Liste der Mitglieder des Aufsichtsrats gemäß § 52 GmbHG eingereicht."
    },
    {
      "date": "2025-05-30",
      "id": "110677",
      "original_text": "Registerbekanntmachung nach dem Umwandlungsgesetz\nSachsen Amtsgericht Leipzig HRB 37952\nDRCC Besitz GmbH – Delitzsch",
      "type": "Registerbekanntmachung nach dem Umwandlungsgesetz",
      "state": "Sachsen",
      "amtsgericht": "Amtsgericht Leipzig",
      "registernummer": "HRB 37952",
      "registerart": "HRB",
      "company_name": "DRCC Besitz GmbH",
      "company_seat": "Delitzsch",
      "details": "30.05.2025 (Bekanntmachungsdatum)\n\nSachsen Amtsgericht Leipzig HRB 37952\nRegisterbekanntmachung nach dem Umwandlungsgesetz 30.05.2025 (Eintragungsdatum)\n\nDRCC Besitz GmbH\nGesellschaft mit beschränkter Haftung\nDelitzsch\n\nDen Gläubigern der an der Verschmelzung beteiligten Rechtsträger ist, wenn sie binnen sechs Monaten nach dem Tag, an dem die Eintragung der Verschmelzung in das Register des Sitzes desjenigen Rechtsträgers, dessen Gläubiger sie sind, nach § 19 Abs. 3 UmwG als bekannt gemacht gilt, ihren Anspruch nach Grund und Höhe in Textform anmelden, Sicherheit zu leisten, soweit sie nicht Befriedigung verlangen können. Dieses Recht steht den Gläubigern jedoch nur zu, wenn sie glaubhaft machen, dass durch die Verschmelzung die Erfüllung der Forderung gefährdet wird."
    },
    {
      "date": "2025-05-30",
      "id": "110678",
      "original_text": "Registerbekanntmachung nach dem Umwandlungsgesetz\nSachsen Amtsgericht Leipzig HRB 37952\nDRCC Besitz GmbH – Delitzsch",
      "type": "Registerbekanntmachung nach dem Umwandlungsgesetz",
      "state": "Sachsen",
      "amtsgericht": "Amtsgericht Leipzig",
      "registernummer": "HRB 37952",
      "registerart": "HRB",
      "company_name": "DRCC Besitz GmbH",
      "company_seat": "Delitzsch",
      "details": "30.05.2025 (Bekanntmachungsdatum)\n\nSachsen Amtsgericht Leipzig HRB 37952\nRegisterbekanntmachung nach dem Umwandlungsgesetz 30.05.2025 (Eintragungsdatum)\n\nDRCC Besitz GmbH\nGesellschaft mit beschränkter Haftung\nDelitzsch\n\nDen Gläubigern der an der Verschmelzung beteiligten Rechtsträger ist, wenn sie binnen sechs Monaten nach dem Tag, an dem die Eintragung der Verschmelzung in das Register des Sitzes desjenigen Rechtsträgers, dessen Gläubiger sie sind, nach § 19 Abs. 3 UmwG als bekannt gemacht gilt, ihren Anspruch nach Grund und Höhe in Textform anmelden, Sicherheit zu leisten, soweit sie nicht Befriedigung verlangen können. Dieses Recht steht den Gläubigern jedoch nur zu, wenn sie glaubhaft machen, dass durch die Verschmelzung die Erfüllung der Forderung gefährdet wird."
    },
    {
      "date": "2025-05-30",
      "id": "110679",
      "original_text": "Einreichung neuer Dokumente\nSachsen Amtsgericht Dresden HRB 36831\nB-A-L Germany AG – Meißen",
      "type": "Einreichung neuer Dokumente",
      "state": "Sachsen",
      "amtsgericht": "Amtsgericht Dresden",
      "registernummer": "HRB 36831",
      "registerart": "HRB",
      "company_name": "B-A-L Germany AG",
      "company_seat": "Meißen",
      "details": "30.05.2025 (Bekanntmachungsdatum)\n\nSachsen Amtsgericht Dresden HRB 36831\nEinreichung neuer Dokumente\n\nB-A-L Germany AG\nAktiengesellschaft\nMeißen\n\nAm 30.05.2025 wurde beim Handelsregister des Amtsgerichts Dresden die Liste der Mitglieder des Aufsichtsrats gemäß § 106 AktG eingereicht."
    },
    {
      "date": "2025-05-30",
      "id": "110680",
      "original_text": "Registerbekanntmachung nach dem Umwandlungsgesetz\nSachsen Amtsgericht Leipzig HRB 21159\nB & V Delitzsch GmbH – Delitzsch",
      "type": "Registerbekanntmachung nach dem Umwandlungsgesetz",
      "state": "Sachsen",
      "amtsgericht": "Amtsgericht Leipzig",
      "registernummer": "HRB 21159",
      "registerart": "HRB",
      "company_name": "B & V Delitzsch GmbH",
      "company_seat": "Delitzsch",
      "details": "30.05.2025 (Bekanntmachungsdatum)\n\nSachsen Amtsgericht Leipzig HRB 21159\nRegisterbekanntmachung nach dem Umwandlungsgesetz 30.05.2025 (Eintragungsdatum)\n\nB & V Delitzsch GmbH\nGesellschaft mit beschränkter Haftung\nDelitzsch\n\nDen Gläubigern der an der Verschmelzung beteiligten Rechtsträger ist, wenn sie binnen sechs Monaten nach dem Tag, an dem die Eintragung der Verschmelzung in das Register des Sitzes desjenigen Rechtsträgers, dessen Gläubiger sie sind, nach § 19 Abs. 3 UmwG als bekannt gemacht gilt, ihren Anspruch nach Grund und Höhe in Textform anmelden, Sicherheit zu leisten, soweit sie nicht Befriedigung verlangen können. Dieses Recht steht den Gläubigern jedoch nur zu, wenn sie glaubhaft machen, dass durch die Verschmelzung die Erfüllung der Forderung gefährdet wird."
    },
    {
      "date": "2025-05-30",
      "id": "110681",
      "original_text": "Registerbekanntmachung nach dem Umwandlungsgesetz\nNordrhein-Westfalen Amtsgericht Coesfeld VR 3212\nBHD Borken Bocholt e.V. – Borken",
      "type": "Registerbekanntmachung nach dem Umwandlungsgesetz",
      "state": "Nordrhein-Westfalen",
      "amtsgericht": "Amtsgericht Coesfeld",
      "registernummer": "VR 3212",
      "registerart": "VR",
      "company_name": "BHD Borken Bocholt e.V.",
      "company_seat": "Borken",
      "details": "30.05.2025 (Bekanntmachungsdatum)\n\nNordrhein-Westfalen Amtsgericht Coesfeld VR 3212\nRegisterbekanntmachung nach dem Umwandlungsgesetz 30.05.2025 (Eintragungsdatum)\n\nBHD Borken Bocholt e.V.\neingetragener Verein\nBorken\n\nDen Gläubigern der an der Verschmelzung beteiligten Rechtsträger ist, wenn sie binnen sechs Monaten nach dem Tag, an dem die Eintragung der Verschmelzung in das Register des Sitzes desjenigen Rechtsträgers, dessen Gläubiger sie sind, nach § 19 Absatz 3 UmwG als bekanntgemacht gilt, ihren Anspruch nach Grund und Höhe schriftlich anmelden, Sicherheit zu leisten, soweit sie nicht Befriedigung verlangen können. Dieses Recht steht den Gläubigern jedoch nur zu, wenn sie glaubhaft machen, dass durch die Verschmelzung die Erfüllung ihrer Forderung gefährdet wird."
    },
    {
      "date": "2025-05-30",
      "id": "110682",
      "original_text": "Registerbekanntmachung nach dem Umwandlungsgesetz\nNiedersachsen Amtsgericht Hannover HRB 227978\nBS Invest GmbH – Wedemark",
      "type": "Registerbekanntmachung nach dem Umwandlungsgesetz",
      "state": "Niedersachsen",
      "amtsgericht": "Amtsgericht Hannover",
      "registernummer": "HRB 227978",
      "registerart": "HRB",
      "company_name": "BS Invest GmbH",
      "company_seat": "Wedemark",
      "details": "30.05.2025 (Bekanntmachungsdatum)\n\nNiedersachsen Amtsgericht Hannover HRB 227978\nRegisterbekanntmachung nach dem Umwandlungsgesetz 30.05.2025 (Eintragungsdatum)\n\nBS Invest GmbH\nGesellschaft mit beschränkter Haftung\nWedemark\n\nDen Gläubigern der an der Verschmelzung beteiligten Rechtsträger ist, wenn sie binnen sechs Monaten nach dem Tag, an dem die Eintragung der Verschmelzung in das Register des Sitzes desjenigen Rechtsträgers, dessen Gläubiger sie sind, nach § 19  Abs.  3 UmwG als bekannt gemacht gilt, ihren Anspruch nach Grund und Höhe schriftlich anmelden, Sicherheit zu leisten, soweit sie nicht Befriedigung verlangen können. Dieses Recht steht den Gläubigern jedoch nur zu, wenn sie glaubhaft machen, dass durch die Verschmelzung die Erfüllung der Forderung gefährdet wird."
    },
    {
      "date": "2025-05-30",
      "id": "110683",
      "original_text": "Löschungsankündigung\nNiedersachsen Amtsgericht Braunschweig HRB 205463\nDigitaldruck 38 GmbH – Wolfsburg",
      "type": "Löschungsankündigung",
      "state": "Niedersachsen",
      "amtsgericht": "Amtsgericht Braunschweig",
      "registernummer": "HRB 205463",
      "registerart": "HRB",
      "company_name": "Digitaldruck 38 GmbH",
      "company_seat": "Wolfsburg",
      "details": "30.05.2025 (Bekanntmachungsdatum)\n\nNiedersachsen Amtsgericht Braunschweig HRB 205463\nLöschungsankündigung\n\nDigitaldruck 38 GmbH\nGesellschaft mit beschränkter Haftung\nWolfsburg\n\nDas Registergericht beabsichtigt, die Gesellschaft von Amts wegen nach § 394 FamFG zu löschen. Die Frist zur Erhebung eines Widerspruchs ist auf 1 Monat ab dieser Registerbekanntmachung festgesetzt."
    },
    {
      "date": "2025-05-30",
      "id": "110684",
      "original_text": "Einreichung neuer Dokumente\nNiedersachsen Amtsgericht Braunschweig HRB 204046\nProjektgesellschaft Salzgitter-Watenstedt GmbH – Salzgitter",
      "type": "Einreichung neuer Dokumente",
      "state": "Niedersachsen",
      "amtsgericht": "Amtsgericht Braunschweig",
      "registernummer": "HRB 204046",
      "registerart": "HRB",
      "company_name": "Projektgesellschaft Salzgitter-Watenstedt GmbH",
      "company_seat": "Salzgitter",
      "details": "30.05.2025 (Bekanntmachungsdatum)\n\nNiedersachsen Amtsgericht Braunschweig HRB 204046\nEinreichung neuer Dokumente\n\nProjektgesellschaft Salzgitter-Watenstedt GmbH\nGesellschaft mit beschränkter Haftung\nSalzgitter\n\nDie Liste der Mitglieder des Aufsichtsrats wurde beim Registergericht eingereicht."
    },
    {
      "date": "2025-05-30",
      "id": "110685",
      "original_text": "Registerbekanntmachung nach dem Umwandlungsgesetz\nNiedersachsen Amtsgericht Osnabrück HRA 209334\nZeidler Immobilien GmbH & Co. KG – Osnabrück",
      "type": "Registerbekanntmachung nach dem Umwandlungsgesetz",
      "state": "Niedersachsen",
      "amtsgericht": "Amtsgericht Osnabrück",
      "registernummer": "HRA 209334",
      "registerart": "HRA",
      "company_name": "Zeidler Immobilien GmbH & Co. KG",
      "company_seat": "Osnabrück",
      "details": "30.05.2025 (Bekanntmachungsdatum)\n\nNiedersachsen Amtsgericht Osnabrück HRA 209334\nRegisterbekanntmachung nach dem Umwandlungsgesetz 30.05.2025 (Eintragungsdatum)\n\nZeidler Immobilien GmbH & Co. KG\nKommanditgesellschaft\nOsnabrück\n\nDen Gläubigern der an der Ausgliederung beteiligten Rechtsträger ist, wenn sie binnen sechs Monaten nach dem Tag, an dem die Eintragung der Ausgliederung in das Register des Sitzes desjenigen Rechtsträgers, dessen Gläubiger sie sind, nach § 19 Abs. 3 UmwG als bekannt gemacht gilt, ihren Anspruch nach Grund und Höhe schriftlich anmelden, Sicherheit zu leisten, soweit sie nicht Befriedigung verlangen können. Dieses Recht steht den Gläubigern jedoch nur zu, wenn sie glaubhaft machen, dass durch die Ausgliederung die Erfüllung der Forderung gefährdet wird."
    },
    {
      "date": "2025-05-30",
      "id": "110686",
      "original_text": "Löschungsankündigung\nNiedersachsen Amtsgericht Hannover HRB 219094\nA. S. Bau GmbH – Hannover",
      "type": "Löschungsankündigung",
      "state": "Niedersachsen",
      "amtsgericht": "Amtsgericht Hannover",
      "registernummer": "HRB 219094",
      "registerart": "HRB",
      "company_name": "A. S. Bau GmbH",
      "company_seat": "Hannover",
      "details": "30.05.2025 (Bekanntmachungsdatum)\n\nNiedersachsen Amtsgericht Hannover HRB 219094\nLöschungsankündigung 27.05.2025 (Eintragungsdatum)\n\nA. S. Bau GmbH\nGesellschaft mit beschränkter Haftung\nHannover\n\nDas Registergericht beabsichtigt, die Gesellschaft von Amts wegen nach § 394 FamFG zu löschen. Die Frist zur Erhebung eines Widerspruchs ist auf 1 Monat ab dieser Registerbekanntmachung festgesetzt."
    },
    {
      "date": "2025-05-30",
      "id": "110687",
      "original_text": "Registerbekanntmachung nach dem Umwandlungsgesetz\nNiedersachsen Amtsgericht Tostedt HRB 206994\nLandgard Overseas GmbH – Neu Wulmstorf",
      "type": "Registerbekanntmachung nach dem Umwandlungsgesetz",
      "state": "Niedersachsen",
      "amtsgericht": "Amtsgericht Tostedt",
      "registernummer": "HRB 206994",
      "registerart": "HRB",
      "company_name": "Landgard Overseas GmbH",
      "company_seat": "Neu Wulmstorf",
      "details": "30.05.2025 (Bekanntmachungsdatum)\n\nNiedersachsen Amtsgericht Tostedt HRB 206994\nRegisterbekanntmachung nach dem Umwandlungsgesetz 30.05.2025 (Eintragungsdatum)\n\nLandgard Overseas GmbH\nGesellschaft mit beschränkter Haftung\nNeu Wulmstorf\n\nDen Gläubigern der an der Verschmelzung beteiligten Rechtsträger ist, wenn sie binnen sechs Monaten nach dem Tag, an dem die Eintragung der Verschmelzung in das Register des Sitzes desjenigen Rechtsträgers, dessen Gläubiger sie sind, nach § 19  Abs.  3 UmwG als bekannt gemacht gilt, ihren Anspruch nach Grund und Höhe schriftlich anmelden, Sicherheit zu leisten, soweit sie nicht Befriedigung verlangen können. Dieses Recht steht den Gläubigern jedoch nur zu, wenn sie glaubhaft machen, dass durch die Verschmelzung die Erfüllung der Forderung gefährdet wird."
    },
    {
      "date": "2025-05-30",
      "id": "110688",
      "original_text": "Löschungsankündigung\nNiedersachsen Amtsgericht Braunschweig HRB 208257\nTP-ZOB-Braunschweig Verwaltungs UG (haftungsbeschränkt) – Braunschweig",
      "type": "Löschungsankündigung",
      "state": "Niedersachsen",
      "amtsgericht": "Amtsgericht Braunschweig",
      "registernummer": "HRB 208257",
      "registerart": "HRB",
      "company_name": "TP-ZOB-Braunschweig Verwaltungs UG (haftungsbeschränkt)",
      "company_seat": "Braunschweig",
      "details": "30.05.2025 (Bekanntmachungsdatum)\n\nNiedersachsen Amtsgericht Braunschweig HRB 208257\nLöschungsankündigung\n\nTP-ZOB-Braunschweig Verwaltungs UG (haftungsbeschränkt)\nGesellschaft mit beschränkter Haftung\nBraunschweig\n\nDas Registergericht beabsichtigt, die Gesellschaft von Amts wegen nach § 394 FamFG zu löschen. Die Frist zur Erhebung eines Widerspruchs ist auf 1 Monat ab dieser Registerbekanntmachung festgesetzt."
    },
    {
      "date": "2025-05-30",
      "id": "110689",
      "original_text": "Löschungsankündigung\nRheinland-Pfalz Amtsgericht Landau HRB 3119\nFPS Frei Print Service Graphische Erzeugnisse GmbH – Rohrbach bei Landau",
      "type": "Löschungsankündigung",
      "state": "Rheinland-Pfalz",
      "amtsgericht": "Amtsgericht Landau",
      "registernummer": "HRB 3119",
      "registerart": "HRB",
      "company_name": "FPS Frei Print Service Graphische Erzeugnisse GmbH",
      "company_seat": "Rohrbach bei Landau",
      "details": "30.05.2025 (Bekanntmachungsdatum)\n\nRheinland-Pfalz Amtsgericht Landau HRB 3119\nLöschungsankündigung\n\nFPS Frei Print Service Graphische Erzeugnisse GmbH\nGesellschaft mit beschränkter Haftung\nRohrbach bei  Landau\n\nDas Registergericht beabsichtigt die Gesellschaft von Amts wegen nach § 394 FamFG zu löschen. Die Frist zur Erhebung eines Widerspruchs ist auf einen Monat festgesetzt."
    },
    {
      "date": "2025-05-30",
      "id": "110690",
      "original_text": "Registerbekanntmachung nach dem Umwandlungsgesetz\nNordrhein-Westfalen Amtsgericht Duisburg HRA 13529\nApex Defence e. K., Inhaber Dennis Christian Obschernicat – Oberhausen",
      "type": "Registerbekanntmachung nach dem Umwandlungsgesetz",
      "state": "Nordrhein-Westfalen",
      "amtsgericht": "Amtsgericht Duisburg",
      "registernummer": "HRA 13529",
      "registerart": "HRA",
      "company_name": "Apex Defence e. K., Inhaber Dennis Christian Obschernicat",
      "company_seat": "Oberhausen",
      "details": "30.05.2025 (Bekanntmachungsdatum)\n\nNordrhein-Westfalen Amtsgericht Duisburg HRA 13529\nRegisterbekanntmachung nach dem Umwandlungsgesetz 30.05.2025 (Eintragungsdatum)\n\nApex Defence e. K., Inhaber Dennis Christian Obschernicat\nEinzelkaufmann / Einzelkauffrau\nOberhausen\n\nDie Gesellschaft hat Gläubigern, deren Forderungen vor dieser Bekanntmachung begründet worden sind, Sicherheit zu leisten, soweit sie nicht Befriedigung verlangen können, wenn sie sich binnen sechs Monaten zu diesem Zweck melden."
    },
    {
      "date": "2025-05-30",
      "id": "110691",
      "original_text": "Löschungsankündigung\nNordrhein-Westfalen Amtsgericht Hamm HRB 8938\nFahrschule Allround UG (haftungsbeschränkt) – Hamm",
      "type": "Löschungsankündigung",
      "state": "Nordrhein-Westfalen",
      "amtsgericht": "Amtsgericht Hamm",
      "registernummer": "HRB 8938",
      "registerart": "HRB",
      "company_name": "Fahrschule Allround UG (haftungsbeschränkt)",
      "company_seat": "Hamm",
      "details": "30.05.2025 (Bekanntmachungsdatum)\n\nNordrhein-Westfalen Amtsgericht Hamm HRB 8938\nLöschungsankündigung\n\nFahrschule Allround UG (haftungsbeschränkt)\nGesellschaft mit beschränkter Haftung\nHamm\n\nDas Registergericht beabsichtigt die Gesellschaft von Amts wegen nach § 394 FamFG zu löschen. Die Frist zur Erhebung eines Widerspruchs ist auf drei Monate festgesetzt."
    },
    {
      "date": "2025-05-30",
      "id": "110692",
      "original_text": "Registerbekanntmachung nach dem Umwandlungsgesetz\nNordrhein-Westfalen Amtsgericht Duisburg HRB 30403\nS-Servicepartner Ruhrgebiet GmbH – Oberhausen",
      "type": "Registerbekanntmachung nach dem Umwandlungsgesetz",
      "state": "Nordrhein-Westfalen",
      "amtsgericht": "Amtsgericht Duisburg",
      "registernummer": "HRB 30403",
      "registerart": "HRB",
      "company_name": "S-Servicepartner Ruhrgebiet GmbH",
      "company_seat": "Oberhausen",
      "details": "30.05.2025 (Bekanntmachungsdatum)\n\nNordrhein-Westfalen Amtsgericht Duisburg HRB 30403\nRegisterbekanntmachung nach dem Umwandlungsgesetz 30.05.2025 (Eintragungsdatum)\n\nS-Servicepartner Ruhrgebiet GmbH\nGesellschaft mit beschränkter Haftung\nOberhausen\n\nDie Gesellschaft hat Gläubigern, deren Forderungen vor dieser Bekanntmachung begründet worden sind, Sicherheit zu leisten, soweit sie nicht Befriedigung verlangen können, wenn sie sich binnen sechs Monaten zu diesem Zweck melden."
    },
    {
      "date": "2025-05-30",
      "id": "110693",
      "original_text": "Löschungsankündigung\nNordrhein-Westfalen Amtsgericht Dortmund HRB 29736\nLamazi Baubetreuung und Haustechnik GmbH – Dortmund",
      "type": "Löschungsankündigung",
      "state": "Nordrhein-Westfalen",
      "amtsgericht": "Amtsgericht Dortmund",
      "registernummer": "HRB 29736",
      "registerart": "HRB",
      "company_name": "Lamazi Baubetreuung und Haustechnik GmbH",
      "company_seat": "Dortmund",
      "details": "30.05.2025 (Bekanntmachungsdatum)\n\nNordrhein-Westfalen Amtsgericht Dortmund HRB 29736\nLöschungsankündigung 30.05.2025 (Eintragungsdatum)\n\nLamazi Baubetreuung und Haustechnik GmbH\nGesellschaft mit beschränkter Haftung\nDortmund\n\nDas Registergericht beabsichtigt die Gesellschaft von Amts wegen nach § 394 FamFG zu löschen. Die Frist zur Erhebung eines Widerspruchs ist auf zwei Monate festgesetzt."
    },
    {
      "date": "2025-05-30",
      "id": "110694",
      "original_text": "Einreichung neuer Dokumente\nNordrhein-Westfalen Amtsgericht Düsseldorf HRB 58881\nCapgemini Outsourcing Services GmbH – Düsseldorf",
      "type": "Einreichung neuer Dokumente",
      "state": "Nordrhein-Westfalen",
      "amtsgericht": "Amtsgericht Düsseldorf",
      "registernummer": "HRB 58881",
      "registerart": "HRB",
      "company_name": "Capgemini Outsourcing Services GmbH",
      "company_seat": "Düsseldorf",
      "details": "30.05.2025 (Bekanntmachungsdatum)\n\nNordrhein-Westfalen Amtsgericht Düsseldorf HRB 58881\nEinreichung neuer Dokumente\n\nCapgemini Outsourcing Services GmbH\nGesellschaft mit beschränkter Haftung\nDüsseldorf\n\nDem Registergericht ist eine neue Liste der Mitglieder des Aufsichtsrates eingereicht worden."
    },
    {
      "date": "2025-05-30",
      "id": "110695",
      "original_text": "Registerbekanntmachung nach dem Umwandlungsgesetz\nNordrhein-Westfalen Amtsgericht Bonn HRB 12623\neDoc solutions AG – Weilerswist",
      "type": "Registerbekanntmachung nach dem Umwandlungsgesetz",
      "state": "Nordrhein-Westfalen",
      "amtsgericht": "Amtsgericht Bonn",
      "registernummer": "HRB 12623",
      "registerart": "HRB",
      "company_name": "eDoc solutions AG",
      "company_seat": "Weilerswist",
      "details": "30.05.2025 (Bekanntmachungsdatum)\n\nNordrhein-Westfalen Amtsgericht Bonn HRB 12623\nRegisterbekanntmachung nach dem Umwandlungsgesetz\n\neDoc solutions AG\nAktiengesellschaft\nWeilerswist\n\nDem Registergericht ist der Entwurf eines Vertrages über die geplante Verschmelzung der eDoc solutions ERP GmbH mit der eDoc solutions AG eingereicht worden."
    },
    {
      "date": "2025-05-30",
      "id": "110696",
      "original_text": "Einreichung neuer Dokumente\nNordrhein-Westfalen Amtsgericht Essen HRB 29653\nRWE Renewables Europe & Australia GmbH – Essen",
      "type": "Einreichung neuer Dokumente",
      "state": "Nordrhein-Westfalen",
      "amtsgericht": "Amtsgericht Essen",
      "registernummer": "HRB 29653",
      "registerart": "HRB",
      "company_name": "RWE Renewables Europe & Australia GmbH",
      "company_seat": "Essen",
      "details": "30.05.2025 (Bekanntmachungsdatum)\n\nNordrhein-Westfalen Amtsgericht Essen HRB 29653\nEinreichung neuer Dokumente\n\nRWE Renewables Europe & Australia GmbH\nGesellschaft mit beschränkter Haftung\nEssen\n\nDem Registergericht ist eine neue Liste der Mitglieder des Aufsichtsrates eingereicht worden."
    },
    {
      "date": "2025-05-30",
      "id": "110697",
      "original_text": "Löschungsankündigung\nNordrhein-Westfalen Amtsgericht Bochum HRB 7643\nW & S Elektromontage GmbH – Bochum",
      "type": "Löschungsankündigung",
      "state": "Nordrhein-Westfalen",
      "amtsgericht": "Amtsgericht Bochum",
      "registernummer": "HRB 7643",
      "registerart": "HRB",
      "company_name": "W & S Elektromontage GmbH",
      "company_seat": "Bochum",
      "details": "30.05.2025 (Bekanntmachungsdatum)\n\nNordrhein-Westfalen Amtsgericht Bochum HRB 7643\nLöschungsankündigung\n\nW & S Elektromontage GmbH\nGesellschaft mit beschränkter Haftung\nBochum\n\nDas Registergericht beabsichtigt die Gesellschaft von Amts wegen nach § 394 FamFG zu löschen. Die Frist zur Erhebung eines Widerspruchs ist auf drei Monate festgesetzt."
    },
    {
      "date": "2025-05-30",
      "id": "110698",
      "original_text": "Löschungsankündigung\nNordrhein-Westfalen Amtsgericht Dortmund HRB 28587\nKunterbunt GmbH – Dortmund",
      "type": "Löschungsankündigung",
      "state": "Nordrhein-Westfalen",
      "amtsgericht": "Amtsgericht Dortmund",
      "registernummer": "HRB 28587",
      "registerart": "HRB",
      "company_name": "Kunterbunt GmbH",
      "company_seat": "Dortmund",
      "details": "30.05.2025 (Bekanntmachungsdatum)\n\nNordrhein-Westfalen Amtsgericht Dortmund HRB 28587\nLöschungsankündigung 30.05.2025 (Eintragungsdatum)\n\nKunterbunt GmbH\nGesellschaft mit beschränkter Haftung\nDortmund\n\nDas Registergericht beabsichtigt die Gesellschaft von Amts wegen nach § 394 FamFG zu löschen. Die Frist zur Erhebung eines Widerspruchs ist auf zwei Monate festgesetzt."
    },
    {
      "date": "2025-05-30",
      "id": "110699",
      "original_text": "Registerbekanntmachung nach dem Umwandlungsgesetz\nNordrhein-Westfalen Amtsgericht Hagen HRB 2920\nthyssenkrupp Hohenlimburg GmbH – Hagen",
      "type": "Registerbekanntmachung nach dem Umwandlungsgesetz",
      "state": "Nordrhein-Westfalen",
      "amtsgericht": "Amtsgericht Hagen",
      "registernummer": "HRB 2920",
      "registerart": "HRB",
      "company_name": "thyssenkrupp Hohenlimburg GmbH",
      "company_seat": "Hagen",
      "details": "30.05.2025 (Bekanntmachungsdatum)\n\nNordrhein-Westfalen Amtsgericht Hagen HRB 2920\nRegisterbekanntmachung nach dem Umwandlungsgesetz 30.05.2025 (Eintragungsdatum)\n\nthyssenkrupp Hohenlimburg GmbH\nGesellschaft mit beschränkter Haftung\nHagen\n\nDen Gläubigern der an der Verschmelzung beteiligten Rechtsträger ist, wenn sie binnen sechs Monaten nach dem Tag, an dem die Eintragung der Verschmelzung in das Register des Sitzes desjenigen Rechtsträgers, dessen Gläubiger sie sind, nach § 19 Absatz 3 UmwG als bekanntgemacht gilt, ihren Anspruch nach Grund und Höhe schriftlich anmelden, Sicherheit zu leisten, soweit sie nicht Befriedigung verlangen können. Dieses Recht steht den Gläubigern jedoch nur zu, wenn sie glaubhaft machen, dass durch die Verschmelzung die Erfüllung ihrer Forderung gefährdet wird."
    },
    {
      "date": "2025-05-30",
      "id": "110700",
      "original_text": "Registerbekanntmachung nach dem Umwandlungsgesetz\nNordrhein-Westfalen Amtsgericht Köln HRA 37793\nParfümerie & Kosmetikstudio Meller e.K. – Köln",
      "type": "Registerbekanntmachung nach dem Umwandlungsgesetz",
      "state": "Nordrhein-Westfalen",
      "amtsgericht": "Amtsgericht Köln",
      "registernummer": "HRA 37793",
      "registerart": "HRA",
      "company_name": "Parfümerie & Kosmetikstudio Meller e.K.",
      "company_seat": "Köln",
      "details": "30.05.2025 (Bekanntmachungsdatum)\n\nNordrhein-Westfalen Amtsgericht Köln HRA 37793\nRegisterbekanntmachung nach dem Umwandlungsgesetz 30.05.2025 (Eintragungsdatum)\n\nParfümerie & Kosmetikstudio Meller e.K.\nEinzelkaufmann / Einzelkauffrau\nKöln\n\nDen Gläubigern der an der Ausgliederung beteiligten Rechtsträger ist, wenn sie binnen sechs Monaten nach dem Tag, an dem die Eintragung der Ausgliederung in das Register des Sitzes desjenigen Rechtsträgers, dessen Gläubiger sie sind, nach § 19 Absatz 3 UmwG als bekanntgemacht gilt, ihren Anspruch nach Grund und Höhe schriftlich anmelden, Sicherheit zu leisten, soweit sie nicht Befriedigung verlangen können. Dieses Recht steht den Gläubigern jedoch nur zu, wenn sie glaubhaft machen, dass durch die Ausgliederung die Erfüllung ihrer Forderung gefährdet wird."
    },
    {
      "date": "2025-05-30",
      "id": "110701",
      "original_text": "Löschungsankündigung\nNordrhein-Westfalen Amtsgericht Bochum HRB 19773\nWBSS UG (haftungsbeschränkt) – Bochum",
      "type": "Löschungsankündigung",
      "state": "Nordrhein-Westfalen",
      "amtsgericht": "Amtsgericht Bochum",
      "registernummer": "HRB 19773",
      "registerart": "HRB",
      "company_name": "WBSS UG (haftungsbeschränkt)",
      "company_seat": "Bochum",
      "details": "30.05.2025 (Bekanntmachungsdatum)\n\nNordrhein-Westfalen Amtsgericht Bochum HRB 19773\nLöschungsankündigung\n\nWBSS UG (haftungsbeschränkt)\nGesellschaft mit beschränkter Haftung\nBochum\n\nDas Registergericht beabsichtigt die Gesellschaft von Amts wegen nach § 394 FamFG zu löschen. Die Frist zur Erhebung eines Widerspruchs ist auf drei Monate festgesetzt."
    },
    {
      "date": "2025-05-30",
      "id": "110702",
      "original_text": "Einreichung neuer Dokumente\nNordrhein-Westfalen Amtsgericht Recklinghausen HRB 6042\nKnappschaft Kliniken Vest GmbH – Recklinghausen",
      "type": "Einreichung neuer Dokumente",
      "state": "Nordrhein-Westfalen",
      "amtsgericht": "Amtsgericht Recklinghausen",
      "registernummer": "HRB 6042",
      "registerart": "HRB",
      "company_name": "Knappschaft Kliniken Vest GmbH",
      "company_seat": "Recklinghausen",
      "details": "30.05.2025 (Bekanntmachungsdatum)\n\nNordrhein-Westfalen Amtsgericht Recklinghausen HRB 6042\nEinreichung neuer Dokumente 30.05.2025 (Eintragungsdatum)\n\nKnappschaft Kliniken Vest GmbH\nGesellschaft mit beschränkter Haftung\nRecklinghausen\n\nDem Registergericht ist eine neue Liste der Mitglieder des Aufsichtsrates eingereicht worden."
    },
    {
      "date": "2025-05-30",
      "id": "110703",
      "original_text": "Registerbekanntmachung nach dem Umwandlungsgesetz\nNordrhein-Westfalen Amtsgericht Bad Oeynhausen HRB 20249\nTappe+Scholz GmbH – Hiddenhausen",
      "type": "Registerbekanntmachung nach dem Umwandlungsgesetz",
      "state": "Nordrhein-Westfalen",
      "amtsgericht": "Amtsgericht Bad Oeynhausen",
      "registernummer": "HRB 20249",
      "registerart": "HRB",
      "company_name": "Tappe+Scholz GmbH",
      "company_seat": "Hiddenhausen",
      "details": "30.05.2025 (Bekanntmachungsdatum)\n\nNordrhein-Westfalen Amtsgericht Bad Oeynhausen HRB 20249\nRegisterbekanntmachung nach dem Umwandlungsgesetz 30.05.2025 (Eintragungsdatum)\n\nTappe+Scholz GmbH\nGesellschaft mit beschränkter Haftung\nHiddenhausen\n\nDie Gesellschaft hat Gläubigern, deren Forderungen vor dieser Bekanntmachung begründet worden sind, Sicherheit zu leisten, soweit sie nicht Befriedigung verlangen können, wenn sie sich binnen sechs Monaten zu diesem Zweck melden.Den Gläubigern der an der Ausgliederung beteiligten Rechtsträger ist, wenn sie binnen sechs Monaten nach dem Tag, an dem die Eintragung der Ausgliederung in das Register des Sitzes derjenigen Rechtsträger deren Gläubiger sie sind, nach § 19 Absatz 3 UmwG als bekanntgemacht gilt, ihren Anspruch nach Grund und Höhe schriftlich anmelden, Sicherheit zu leisten, soweit sie nicht Befriedigung verlangen können. Dieses Recht steht den Gläubigern jedoch nur zu, wenn sie glaubhaft machen, dass durch die Ausgliederung die Erfüllung ihrer Forderung gefährdet wird."
    },
    {
      "date": "2025-05-30",
      "id": "110704",
      "original_text": "Registerbekanntmachung nach dem Umwandlungsgesetz\nNordrhein-Westfalen Amtsgericht Köln HRA 37944\nParfümerie Meller GmbH & Co. KG – Köln",
      "type": "Registerbekanntmachung nach dem Umwandlungsgesetz",
      "state": "Nordrhein-Westfalen",
      "amtsgericht": "Amtsgericht Köln",
      "registernummer": "HRA 37944",
      "registerart": "HRA",
      "company_name": "Parfümerie Meller GmbH & Co. KG",
      "company_seat": "Köln",
      "details": "30.05.2025 (Bekanntmachungsdatum)\n\nNordrhein-Westfalen Amtsgericht Köln HRA 37944\nRegisterbekanntmachung nach dem Umwandlungsgesetz 30.05.2025 (Eintragungsdatum)\n\nParfümerie Meller GmbH & Co. KG\nKommanditgesellschaft\nKöln\n\nDen Gläubigern der an der Ausgliederung beteiligten Rechtsträger ist, wenn sie binnen sechs Monaten nach dem Tag, an dem die Eintragung der Ausgliederung in das Register des Sitzes desjenigen Rechtsträgers, dessen Gläubiger sie sind, nach § 19 Absatz 3 UmwG als bekanntgemacht gilt, ihren Anspruch nach Grund und Höhe schriftlich anmelden, Sicherheit zu leisten, soweit sie nicht Befriedigung verlangen können. Dieses Recht steht den Gläubigern jedoch nur zu, wenn sie glaubhaft machen, dass durch die Ausgliederung die Erfüllung ihrer Forderung gefährdet wird."
    },
    {
      "date": "2025-05-30",
      "id": "110705",
      "original_text": "Löschungsankündigung\nNordrhein-Westfalen Amtsgericht Hamm HRB 7340\nSellmann & Eimer Verwaltungs GmbH – Unna",
      "type": "Löschungsankündigung",
      "state": "Nordrhein-Westfalen",
      "amtsgericht": "Amtsgericht Hamm",
      "registernummer": "HRB 7340",
      "registerart": "HRB",
      "company_name": "Sellmann & Eimer Verwaltungs GmbH",
      "company_seat": "Unna",
      "details": "30.05.2025 (Bekanntmachungsdatum)\n\nNordrhein-Westfalen Amtsgericht Hamm HRB 7340\nLöschungsankündigung\n\nSellmann & Eimer Verwaltungs GmbH\nGesellschaft mit beschränkter Haftung\nUnna\n\nDas Registergericht beabsichtigt die Gesellschaft von Amts wegen nach § 394 FamFG zu löschen. Die Frist zur Erhebung eines Widerspruchs ist auf drei Monate festgesetzt."
    },
    {
      "date": "2025-05-30",
      "id": "110706",
      "original_text": "Löschungsankündigung\nNordrhein-Westfalen Amtsgericht Kleve HRB 7207\nPDP GmbH-Publikationen-Dokumentationen-Präsentationen – Kamp-Lintfort",
      "type": "Löschungsankündigung",
      "state": "Nordrhein-Westfalen",
      "amtsgericht": "Amtsgericht Kleve",
      "registernummer": "HRB 7207",
      "registerart": "HRB",
      "company_name": "PDP GmbH-Publikationen-Dokumentationen-Präsentationen",
      "company_seat": "Kamp-Lintfort",
      "details": "30.05.2025 (Bekanntmachungsdatum)\n\nNordrhein-Westfalen Amtsgericht Kleve HRB 7207\nLöschungsankündigung\n\nPDP GmbH-Publikationen-Dokumentationen-Präsentationen\nGesellschaft mit beschränkter Haftung\nKamp-Lintfort\n\nDas Registergericht beabsichtigt die Gesellschaft von Amts wegen nach § 394 FamFG zu löschen. Die Frist zur Erhebung eines Widerspruchs ist auf einen Monat festgesetzt."
    },
    {
      "date": "2025-05-30",
      "id": "110707",
      "original_text": "Löschungsankündigung\nNordrhein-Westfalen Amtsgericht Wuppertal HRA 18779\nSchieferdecker GmbH & Co. KG. – Erkrath",
      "type": "Löschungsankündigung",
      "state": "Nordrhein-Westfalen",
      "amtsgericht": "Amtsgericht Wuppertal",
      "registernummer": "HRA 18779",
      "registerart": "HRA",
      "company_name": "Schieferdecker GmbH & Co. KG.",
      "company_seat": "Erkrath",
      "details": "30.05.2025 (Bekanntmachungsdatum)\n\nNordrhein-Westfalen Amtsgericht Wuppertal HRA 18779\nLöschungsankündigung 30.05.2025 (Eintragungsdatum)\n\nSchieferdecker GmbH & Co. KG.\nKommanditgesellschaft\nErkrath\n\nDas Registergericht beabsichtigt die Firma von Amts wegen nach § 393 FamFG in Verbindung mit § 31 Abs. 2 HGB zu löschen.\nDie Frist zur Erhebung eines Widerspruchs ist auf drei Monate festgesetzt."
    },
    {
      "date": "2025-05-30",
      "id": "110708",
      "original_text": "Registerbekanntmachung nach dem Umwandlungsgesetz\nNordrhein-Westfalen Amtsgericht Paderborn HRB 13537\nIMOGENT GmbH – Paderborn",
      "type": "Registerbekanntmachung nach dem Umwandlungsgesetz",
      "state": "Nordrhein-Westfalen",
      "amtsgericht": "Amtsgericht Paderborn",
      "registernummer": "HRB 13537",
      "registerart": "HRB",
      "company_name": "IMOGENT GmbH",
      "company_seat": "Paderborn",
      "details": "30.05.2025 (Bekanntmachungsdatum)\n\nNordrhein-Westfalen Amtsgericht Paderborn HRB 13537\nRegisterbekanntmachung nach dem Umwandlungsgesetz 30.05.2025 (Eintragungsdatum)\n\nIMOGENT GmbH\nGesellschaft mit beschränkter Haftung\nPaderborn\n\nDie Gesellschaft hat Gläubigern, deren Forderungen vor dieser Bekanntmachung begründet worden sind, Sicherheit zu leisten, soweit sie nicht Befriedigung verlangen können, wenn sie sich binnen sechs Monaten zu diesem Zweck melden."
    },
    {
      "date": "2025-05-30",
      "id": "110709",
      "original_text": "Löschungsankündigung\nNordrhein-Westfalen Amtsgericht Aachen HRB 8642\nKrantz Air + Filtration Systems GmbH – Aachen",
      "type": "Löschungsankündigung",
      "state": "Nordrhein-Westfalen",
      "amtsgericht": "Amtsgericht Aachen",
      "registernummer": "HRB 8642",
      "registerart": "HRB",
      "company_name": "Krantz Air + Filtration Systems GmbH",
      "company_seat": "Aachen",
      "details": "30.05.2025 (Bekanntmachungsdatum)\n\nNordrhein-Westfalen Amtsgericht Aachen HRB 8642\nLöschungsankündigung\n\nKrantz Air + Filtration Systems GmbH\nGesellschaft mit beschränkter Haftung\nAachen\n\nDas Registergericht beabsichtigt, von Amts wegen die Gesellschaft wegen Vermögenslosigkeit nach § 394 FamFG zu löschen, weil das Insolvenzverfahren Amtsgericht Köln (Az.: 75 IN 568/02) beendet und Vermögen der Gesellschaft nicht mehr erkennbar ist.\nZur Geltendmachung des Widerspruchs gegen die beabsichtigte Löschung wird hiermit eine Frist von einem Monat ab Veröffentlichung dieser Ankündigung bestimmt.\n\nRechtsbehelfsbelehrung:\n\nGegen diese Verfügung kann Widerspruch eingelegt werden. Zum Widerspruch ist jeder berechtigt, der an der Unterlassung der Löschung ein berechtigtes Interesse hat.\n\nDer Widerspruch ist bei dem Amtsgericht Aachen, Adalbertsteinweg 92, 52070 Aachen schriftlich in deutscher Sprache oder zur Niederschrift der Geschäftsstelle einzulegen. Der Widerspruch kann auch zur Niederschrift der Geschäftsstelle eines jeden Amtsgerichtes abgegeben werden.\n\nDer Widerspruch muss spätestens innerhalb der gesetzten Frist nach der Bekanntgabe der Verfügung bei dem Amtsgericht Aachen eingegangen sein. Dies gilt auch dann, wenn der Widerspruch zur Niederschrift der Geschäftsstelle eines anderen Amtsgerichtes abgegeben wurde. Die Frist beginnt mit der Bekanntgabe der Verfügung durch Veröffentlichung. Fällt das Ende der Frist auf einen Sonntag, einen allgemeinen Feiertag oder Sonnabend, so endet die Frist mit Ablauf des nächsten Werktages.\n\nDer Widerspruch muss die Bezeichnung der angefochtenen Verfügung sowie die Erklärung enthalten, dass Widerspruch gegen diese Verfügung eingelegt wird. Er ist zu unterzeichnen und soll begründet werden.\n\nDie Einlegung ist auch durch Übertragung eines elektronischen Dokuments an die elektronische Poststelle des Gerichts möglich. Das elektronische Dokument muss für die Bearbeitung durch das Gericht geeignet und mit einer qualifizierten elektronischen Signatur der verantwortenden Person versehen sein oder von der verantwortenden Person signiert und auf einem sicheren Übermittlungsweg gemäß § 130 a ZPO nach näherer Maßgabe der Verordnung über die technischen Rahmenbedingungen des elektronischen Rechtsverkehrs und über das besondere elektronische Behördenpostfach (BGBl. I, S. 3803) eingereicht werden. Weitere Informationen erhalten Sie auf der Internetseite www.justiz.de."
    },
    {
      "date": "2025-05-30",
      "id": "110710",
      "original_text": "Registerbekanntmachung nach dem Umwandlungsgesetz\nNordrhein-Westfalen Amtsgericht Düsseldorf HRB 58648\nJohnson Controls Deutschland GmbH – Ratingen",
      "type": "Registerbekanntmachung nach dem Umwandlungsgesetz",
      "state": "Nordrhein-Westfalen",
      "amtsgericht": "Amtsgericht Düsseldorf",
      "registernummer": "HRB 58648",
      "registerart": "HRB",
      "company_name": "Johnson Controls Deutschland GmbH",
      "company_seat": "Ratingen",
      "details": "30.05.2025 (Bekanntmachungsdatum)\n\nNordrhein-Westfalen Amtsgericht Düsseldorf HRB 58648\nRegisterbekanntmachung nach dem Umwandlungsgesetz 30.05.2025 (Eintragungsdatum)\n\nJohnson Controls Deutschland GmbH\nGesellschaft mit beschränkter Haftung\nRatingen\n\nDen Gläubigern der an der Verschmelzung beteiligten Rechtsträger ist, wenn sie binnen sechs Monaten nach dem Tag, an dem die Eintragung der Verschmelzung desjenigen Rechtsträgers, dessen Gläubiger sie sind, nach § 19 Absatz 3 UmwG als bekanntgemacht gilt, ihren Anspruch nach Grund und Höhe schriftlich anmelden, Sicherheit zu leisten, soweit sie nicht Befriedigung verlangen können. Dieses Recht steht den Gläubigern jedoch nur zu, wenn sie glaubhaft machen, dass durch die Verschmelzung die Erfüllung ihrer Forderung gefährdet wird."
    },
    {
      "date": "2025-05-30",
      "id": "110711",
      "original_text": "Registerbekanntmachung nach dem Umwandlungsgesetz\nNordrhein-Westfalen Amtsgericht Hagen HRB 11326\nthyssenkrupp Hohenlimburg Kompetenzwerkstatt GmbH – Hagen",
      "type": "Registerbekanntmachung nach dem Umwandlungsgesetz",
      "state": "Nordrhein-Westfalen",
      "amtsgericht": "Amtsgericht Hagen",
      "registernummer": "HRB 11326",
      "registerart": "HRB",
      "company_name": "thyssenkrupp Hohenlimburg Kompetenzwerkstatt GmbH",
      "company_seat": "Hagen",
      "details": "30.05.2025 (Bekanntmachungsdatum)\n\nNordrhein-Westfalen Amtsgericht Hagen HRB 11326\nRegisterbekanntmachung nach dem Umwandlungsgesetz 30.05.2025 (Eintragungsdatum)\n\nthyssenkrupp Hohenlimburg Kompetenzwerkstatt GmbH\nGesellschaft mit beschränkter Haftung\nHagen\n\nDen Gläubigern der an der Verschmelzung beteiligten Rechtsträger ist, wenn sie binnen sechs Monaten nach dem Tag, an dem die Eintragung der Verschmelzung in das Register des Sitzes desjenigen Rechtsträgers, dessen Gläubiger sie sind, nach § 19 Absatz 3 UmwG als bekanntgemacht gilt, ihren Anspruch nach Grund und Höhe schriftlich anmelden, Sicherheit zu leisten, soweit sie nicht Befriedigung verlangen können. Dieses Recht steht den Gläubigern jedoch nur zu, wenn sie glaubhaft machen, dass durch die Verschmelzung die Erfüllung ihrer Forderung gefährdet wird."
    },
    {
      "date": "2025-05-30",
      "id": "110712",
      "original_text": "Registerbekanntmachung nach dem Umwandlungsgesetz\nNordrhein-Westfalen Amtsgericht Düsseldorf HRB 32720\nPCS Professional Conference Systems GmbH – Düsseldorf",
      "type": "Registerbekanntmachung nach dem Umwandlungsgesetz",
      "state": "Nordrhein-Westfalen",
      "amtsgericht": "Amtsgericht Düsseldorf",
      "registernummer": "HRB 32720",
      "registerart": "HRB",
      "company_name": "PCS Professional Conference Systems GmbH",
      "company_seat": "Düsseldorf",
      "details": "30.05.2025 (Bekanntmachungsdatum)\n\nNordrhein-Westfalen Amtsgericht Düsseldorf HRB 32720\nRegisterbekanntmachung nach dem Umwandlungsgesetz 30.05.2025 (Eintragungsdatum)\n\nPCS Professional Conference Systems GmbH\nGesellschaft mit beschränkter Haftung\nDüsseldorf\n\nDen Gläubigern der an der Verschmelzung beteiligten Rechtsträger ist, wenn sie binnen sechs Monaten nach dem Tag, an dem die Eintragung der Verschmelzung in das Register des Sitzes desjenigen Rechtsträgers, dessen Gläubiger sie sind, nach § 19 Absatz 3 UmwG als bekanntgemacht gilt, ihren Anspruch nach Grund und Höhe schriftlich anmelden, Sicherheit zu leisten, soweit sie nicht Befriedigung verlangen können. Dieses Recht steht den Gläubigern jedoch nur zu, wenn sie glaubhaft machen, dass durch die Verschmelzung die Erfüllung ihrer Forderung gefährdet wird."
    },
    {
      "date": "2025-05-30",
      "id": "110713",
      "original_text": "Registerbekanntmachung nach dem Umwandlungsgesetz\nNordrhein-Westfalen Amtsgericht Düsseldorf HRB 79018\nParfümerie Douglas Deutschland GmbH – Düsseldorf",
      "type": "Registerbekanntmachung nach dem Umwandlungsgesetz",
      "state": "Nordrhein-Westfalen",
      "amtsgericht": "Amtsgericht Düsseldorf",
      "registernummer": "HRB 79018",
      "registerart": "HRB",
      "company_name": "Parfümerie Douglas Deutschland GmbH",
      "company_seat": "Düsseldorf",
      "details": "30.05.2025 (Bekanntmachungsdatum)\n\nNordrhein-Westfalen Amtsgericht Düsseldorf HRB 79018\nRegisterbekanntmachung nach dem Umwandlungsgesetz 30.05.2025 (Eintragungsdatum)\n\nParfümerie Douglas Deutschland GmbH\nGesellschaft mit beschränkter Haftung\nDüsseldorf\n\nDen Gläubigern der an der Verschmelzung beteiligten Rechtsträger ist, wenn sie binnen sechs Monaten nach dem Tag, an dem die Eintragung der Verschmelzung in das Register des Sitzes derjenigen Rechtsträger deren Gläubiger sie sind, nach § 19 Absatz 3 UmwG als bekanntgemacht gilt, ihren Anspruch nach Grund und Höhe schriftlich anmelden, Sicherheit zu leisten, soweit sie nicht Befriedigung verlangen können. Dieses Recht steht den Gläubigern jedoch nur zu, wenn sie glaubhaft machen, dass durch die Verschmelzung die Erfüllung ihrer Forderung gefährdet wird."
    },
    {
      "date": "2025-05-30",
      "id": "110714",
      "original_text": "Löschungsankündigung\nNordrhein-Westfalen Amtsgericht Düren HRB 7312\nCognitus GmbH – Linnich",
      "type": "Löschungsankündigung",
      "state": "Nordrhein-Westfalen",
      "amtsgericht": "Amtsgericht Düren",
      "registernummer": "HRB 7312",
      "registerart": "HRB",
      "company_name": "Cognitus GmbH",
      "company_seat": "Linnich",
      "details": "30.05.2025 (Bekanntmachungsdatum)\n\nNordrhein-Westfalen Amtsgericht Düren HRB 7312\nLöschungsankündigung 30.05.2025 (Eintragungsdatum)\n\nCognitus GmbH\nGesellschaft mit beschränkter Haftung\nLinnich\n\nDas Registergericht beabsichtigt die Gesellschaft von Amts wegen nach § 394 FamFG zu löschen. Die Frist zur Erhebung eines Widerspruchs ist auf drei Monate festgesetzt."
    },
    {
      "date": "2025-05-30",
      "id": "110715",
      "original_text": "Löschungsankündigung\nNordrhein-Westfalen Amtsgericht Hamm HRB 7495\nLux Construct Germany UG (haftungsbeschränkt) – Hamm",
      "type": "Löschungsankündigung",
      "state": "Nordrhein-Westfalen",
      "amtsgericht": "Amtsgericht Hamm",
      "registernummer": "HRB 7495",
      "registerart": "HRB",
      "company_name": "Lux Construct Germany UG (haftungsbeschränkt)",
      "company_seat": "Hamm",
      "details": "30.05.2025 (Bekanntmachungsdatum)\n\nNordrhein-Westfalen Amtsgericht Hamm HRB 7495\nLöschungsankündigung\n\nLux Construct Germany UG (haftungsbeschränkt)\nGesellschaft mit beschränkter Haftung\nHamm\n\nDas Registergericht beabsichtigt die Gesellschaft von Amts wegen nach § 394 FamFG zu löschen. Die Frist zur Erhebung eines Widerspruchs ist auf drei Monate festgesetzt."
    },
    {
      "date": "2025-05-30",
      "id": "110716",
      "original_text": "Löschungsankündigung\nNordrhein-Westfalen Amtsgericht Düren HRB 9322\nIronclad - Catering & Veranstaltungsservice UG (haftungsbeschränkt) – Linnich",
      "type": "Löschungsankündigung",
      "state": "Nordrhein-Westfalen",
      "amtsgericht": "Amtsgericht Düren",
      "registernummer": "HRB 9322",
      "registerart": "HRB",
      "company_name": "Ironclad - Catering & Veranstaltungsservice UG (haftungsbeschränkt)",
      "company_seat": "Linnich",
      "details": "30.05.2025 (Bekanntmachungsdatum)\n\nNordrhein-Westfalen Amtsgericht Düren HRB 9322\nLöschungsankündigung 30.05.2025 (Eintragungsdatum)\n\nIronclad - Catering & Veranstaltungsservice UG (haftungsbeschränkt)\nGesellschaft mit beschränkter Haftung\nLinnich\n\nDas Registergericht beabsichtigt die Gesellschaft von Amts wegen nach § 394 FamFG zu löschen. Die Frist zur Erhebung eines Widerspruchs ist auf drei Monate festgesetzt."
    },
    {
      "date": "2025-05-30",
      "id": "110717",
      "original_text": "Einreichung neuer Dokumente\nNordrhein-Westfalen Amtsgericht Köln HRB 39837\nTourako AG – Köln",
      "type": "Einreichung neuer Dokumente",
      "state": "Nordrhein-Westfalen",
      "amtsgericht": "Amtsgericht Köln",
      "registernummer": "HRB 39837",
      "registerart": "HRB",
      "company_name": "Tourako AG",
      "company_seat": "Köln",
      "details": "30.05.2025 (Bekanntmachungsdatum)\n\nNordrhein-Westfalen Amtsgericht Köln HRB 39837\nEinreichung neuer Dokumente 30.05.2025 (Eintragungsdatum)\n\nTourako AG\nAktiengesellschaft\nKöln\n\nDem Registergericht ist eine Liste der Mitglieder des Aufsichtsrates eingereicht worden."
    },
    {
      "date": "2025-05-30",
      "id": "110718",
      "original_text": "Registerbekanntmachung nach dem Umwandlungsgesetz\nNordrhein-Westfalen Amtsgericht Duisburg HRB 38515\nApex Defence GmbH – Oberhausen",
      "type": "Registerbekanntmachung nach dem Umwandlungsgesetz",
      "state": "Nordrhein-Westfalen",
      "amtsgericht": "Amtsgericht Duisburg",
      "registernummer": "HRB 38515",
      "registerart": "HRB",
      "company_name": "Apex Defence GmbH",
      "company_seat": "Oberhausen",
      "details": "30.05.2025 (Bekanntmachungsdatum)\n\nNordrhein-Westfalen Amtsgericht Duisburg HRB 38515\nRegisterbekanntmachung nach dem Umwandlungsgesetz 30.05.2025 (Eintragungsdatum)\n\nApex Defence GmbH\nGesellschaft mit beschränkter Haftung\nOberhausen\n\nDie Gesellschaft hat Gläubigern, deren Forderungen vor dieser Bekanntmachung begründet worden sind, Sicherheit zu leisten, soweit sie nicht Befriedigung verlangen können, wenn sie sich binnen sechs Monaten zu diesem Zweck melden."
    },
    {
      "date": "2025-05-30",
      "id": "110719",
      "original_text": "Löschungsankündigung\nNordrhein-Westfalen Amtsgericht Siegen HRB 12736\nImmobiliario GmbH – Burbach",
      "type": "Löschungsankündigung",
      "state": "Nordrhein-Westfalen",
      "amtsgericht": "Amtsgericht Siegen",
      "registernummer": "HRB 12736",
      "registerart": "HRB",
      "company_name": "Immobiliario GmbH",
      "company_seat": "Burbach",
      "details": "30.05.2025 (Bekanntmachungsdatum)\n\nNordrhein-Westfalen Amtsgericht Siegen HRB 12736\nLöschungsankündigung\n\nImmobiliario GmbH\nGesellschaft mit beschränkter Haftung\nBurbach\n\nDas Registergericht beabsichtigt die Gesellschaft von Amts wegen nach § 394 FamFG zu löschen. Die Frist zur Erhebung eines Widerspruchs ist auf drei Monate festgesetzt."
    },
    {
      "date": "2025-05-30",
      "id": "110720",
      "original_text": "Registerbekanntmachung nach dem Umwandlungsgesetz\nNordrhein-Westfalen Amtsgericht Gelsenkirchen HRA 6284\nMichael Olteanu e.K., Inh. Michael Olteanu – Haltern am See",
      "type": "Registerbekanntmachung nach dem Umwandlungsgesetz",
      "state": "Nordrhein-Westfalen",
      "amtsgericht": "Amtsgericht Gelsenkirchen",
      "registernummer": "HRA 6284",
      "registerart": "HRA",
      "company_name": "Michael Olteanu e.K., Inh. Michael Olteanu",
      "company_seat": "Haltern am See",
      "details": "30.05.2025 (Bekanntmachungsdatum)\n\nNordrhein-Westfalen Amtsgericht Gelsenkirchen HRA 6284\nRegisterbekanntmachung nach dem Umwandlungsgesetz 30.05.2025 (Eintragungsdatum)\n\nMichael Olteanu e.K., Inh. Michael Olteanu\nEinzelkaufmann / Einzelkauffrau\nHaltern am See\n\nDen Gläubigern der an der Ausgliederung beteiligten Rechtsträger ist, wenn sie binnen sechs Monaten nach dem Tag, an dem die Eintragung der Ausgliederung in das Register des Sitzes desjenigen Rechtsträgers, dessen Gläubiger sie sind, nach § 19 Absatz 3 UmwG als bekanntgemacht gilt, ihren Anspruch nach Grund und Höhe schriftlich anmelden, Sicherheit zu leisten, soweit sie nicht Befriedigung verlangen können. Dieses Recht steht den Gläubigern jedoch nur zu, wenn sie glaubhaft machen, dass durch die Ausgliederung die Erfüllung ihrer Forderung gefährdet wird."
    },
    {
      "date": "2025-05-30",
      "id": "110721",
      "original_text": "Löschungsankündigung\nBremen Amtsgericht Bremen HRA 25275\nHanse Handels- und Immobilien- Kommanditgesellschaft Wienert & Co. – Bremen",
      "type": "Löschungsankündigung",
      "state": "Bremen",
      "amtsgericht": "Amtsgericht Bremen",
      "registernummer": "HRA 25275",
      "registerart": "HRA",
      "company_name": "Hanse Handels- und Immobilien- Kommanditgesellschaft Wienert & Co.",
      "company_seat": "Bremen",
      "details": "30.05.2025 (Bekanntmachungsdatum)\n\nBremen Amtsgericht Bremen HRA 25275\nLöschungsankündigung\n\nHanse Handels- und Immobilien- Kommanditgesellschaft Wienert & Co.\nKommanditgesellschaft\nBremen\n\nEs ist beabsichtigt die im Handelsregister eingetragene Firma von Amts wegen gemäß § 31 Abs.2 HGB zu löschen. Gegen die Löschung kann beim AG Bremen schriftlich oder zu Protokoll der Geschäftsstelle Widerspruch eingelegt werden. Widerspruchsfrist 4 Wochen."
    },
    {
      "date": "2025-05-30",
      "id": "110722",
      "original_text": "Sonstige Registerbekanntmachung\nThüringen Amtsgericht Jena HRB 113031\nGothaer Stadtwerke GmbH – Gotha",
      "type": "Sonstige Registerbekanntmachung",
      "state": "Thüringen",
      "amtsgericht": "Amtsgericht Jena",
      "registernummer": "HRB 113031",
      "registerart": "HRB",
      "company_name": "Gothaer Stadtwerke GmbH",
      "company_seat": "Gotha",
      "details": "30.05.2025 (Bekanntmachungsdatum)\n\nThüringen Amtsgericht Jena HRB 113031\nSonstige Registerbekanntmachung\n\nGothaer Stadtwerke GmbH\nGesellschaft mit beschränkter Haftung\nGotha\n\nBekanntmachung gem. § 52 Abs. 3 Satz 2 GmbHG: Aufgrund einer Veränderung in den Personen der Aufsichtsratsmitglieder ist durch die Geschäftsführer eine neue Liste zum Handelsregister eingereicht worden."
    },
    {
      "date": "2025-05-30",
      "id": "110723",
      "original_text": "Einreichung neuer Dokumente\nThüringen Amtsgericht Jena HRB 506264\nKulTourStadt Gotha GmbH – Gotha",
      "type": "Einreichung neuer Dokumente",
      "state": "Thüringen",
      "amtsgericht": "Amtsgericht Jena",
      "registernummer": "HRB 506264",
      "registerart": "HRB",
      "company_name": "KulTourStadt Gotha GmbH",
      "company_seat": "Gotha",
      "details": "30.05.2025 (Bekanntmachungsdatum)\n\nThüringen Amtsgericht Jena HRB 506264\nEinreichung neuer Dokumente\n\nKulTourStadt Gotha GmbH\nGesellschaft mit beschränkter Haftung\nGotha\n\nBekanntmachung gem. § 52 Abs. 3 Satz 2 GmbHG: Aufgrund einer Veränderung in den Personen der Aufsichtsratsmitglieder ist durch die Geschäftsführer eine neue Liste zum Handelsregister eingereicht worden."
    },
    {
      "date": "2025-05-30",
      "id": "110724",
      "original_text": "Einreichung neuer Dokumente\nHessen Amtsgericht Frankfurt am Main HRB 32232\nDeutsche Börse Aktiengesellschaft – Frankfurt am Main",
      "type": "Einreichung neuer Dokumente",
      "state": "Hessen",
      "amtsgericht": "Amtsgericht Frankfurt am Main",
      "registernummer": "HRB 32232",
      "registerart": "HRB",
      "company_name": "Deutsche Börse Aktiengesellschaft",
      "company_seat": "Frankfurt am Main",
      "details": "30.05.2025 (Bekanntmachungsdatum)\n\nHessen Amtsgericht Frankfurt am Main HRB 32232\nEinreichung neuer Dokumente 30.05.2025 (Eintragungsdatum)\n\nDeutsche Börse Aktiengesellschaft\nAktiengesellschaft\nFrankfurt am Main\n\nDurch eine Änderung in den Personen der Aufsichtsratsmitglieder ist eine Liste der Mitglieder des Aufsichtsrates zum Handelsregister eingereicht worden."
    },
    {
      "date": "2025-05-30",
      "id": "110725",
      "original_text": "Registerbekanntmachung nach dem Umwandlungsgesetz\nHessen Amtsgericht Bad Hersfeld GnR 134\nVR-Bankverein Bad Hersfeld-Rotenburg eG – Bad Hersfeld",
      "type": "Registerbekanntmachung nach dem Umwandlungsgesetz",
      "state": "Hessen",
      "amtsgericht": "Amtsgericht Bad Hersfeld",
      "registernummer": "GnR 134",
      "registerart": "GnR",
      "company_name": "VR-Bankverein Bad Hersfeld-Rotenburg eG",
      "company_seat": "Bad Hersfeld",
      "details": "30.05.2025 (Bekanntmachungsdatum)\n\nHessen Amtsgericht Bad Hersfeld GnR 134\nRegisterbekanntmachung nach dem Umwandlungsgesetz 30.05.2025 (Eintragungsdatum)\n\nVR-Bankverein Bad Hersfeld-Rotenburg eG\neingetragene Genossenschaft\nBad Hersfeld\n\nDen Gläubigern der an der Verschmelzung beteiligten Rechtsträger ist, wenn sie binnen sechs Monaten nach dem Tag, an dem die Eintragung der Verschmelzung in das Register des Sitzes desjenigen Rechtsträgers, dessen Gläubiger sie sind, nach § 19 Absatz 3 UmwG bekannt gemacht worden ist, ihren Anspruch nach Grund und Höhe schriftlich anmelden, Sicherheit zu leisten, soweit sie nicht Befriedigung verlangen können. Dieses Recht steht den Gläubigern jedoch nur zu, wenn sie glaubhaft machen, dass durch die Verschmelzung die Erfüllung ihrer Forderung gefährdet wird."
    },
    {
      "date": "2025-05-30",
      "id": "110726",
      "original_text": "Löschungsankündigung\nHessen Amtsgericht Gießen HRB 6272\nMK Bad-Bedarf GmbH – Langgöns",
      "type": "Löschungsankündigung",
      "state": "Hessen",
      "amtsgericht": "Amtsgericht Gießen",
      "registernummer": "HRB 6272",
      "registerart": "HRB",
      "company_name": "MK Bad-Bedarf GmbH",
      "company_seat": "Langgöns",
      "details": "30.05.2025 (Bekanntmachungsdatum)\n\nHessen Amtsgericht Gießen HRB 6272\nLöschungsankündigung\n\nMK Bad-Bedarf GmbH\nGesellschaft mit beschränkter Haftung\nLanggöns\n\nAuf Antrag des Finaznamtes ist beabsichtigt, die Gesellschaft wegen Vermögenslosigkeit gemäß § 394 FamFG von Amts wegen zu löschen. Hiergegen kann innerhalb von drei Monaten nach dieser Veröffentlichung Widerspruch beim Amtsgericht Gießen eingelegt werden. Sollte Widerspruch eingelegt werden, dürfte dies nur mit Begründung erfolgversprechend sein. Insbesondere sollte vorhandenes Vermögen der Gesellschaft innerhalb der genannten Frist nachgewiesen werden."
    },
    {
      "date": "2025-05-30",
      "id": "110727",
      "original_text": "Löschungsankündigung\nHessen Amtsgericht Wiesbaden VR 3432\nBetreuungsverein der Kohlheckschule e. V. – Wiesbaden",
      "type": "Löschungsankündigung",
      "state": "Hessen",
      "amtsgericht": "Amtsgericht Wiesbaden",
      "registernummer": "VR 3432",
      "registerart": "VR",
      "company_name": "Betreuungsverein der Kohlheckschule e. V.",
      "company_seat": "Wiesbaden",
      "details": "30.05.2025 (Bekanntmachungsdatum)\n\nHessen Amtsgericht Wiesbaden VR 3432\nLöschungsankündigung 30.05.2025 (Eintragungsdatum)\n\nBetreuungsverein der Kohlheckschule e. V.\neingetragener Verein\nWiesbaden\n\nDer Verein ist aufgelöst."
    },
    {
      "date": "2025-05-30",
      "id": "110728",
      "original_text": "Löschungsankündigung\nHessen Amtsgericht Frankfurt am Main HRB 115232\nCaronte GmbH – Frankfurt am Main",
      "type": "Löschungsankündigung",
      "state": "Hessen",
      "amtsgericht": "Amtsgericht Frankfurt am Main",
      "registernummer": "HRB 115232",
      "registerart": "HRB",
      "company_name": "Caronte GmbH",
      "company_seat": "Frankfurt am Main",
      "details": "30.05.2025 (Bekanntmachungsdatum)\n\nHessen Amtsgericht Frankfurt am Main HRB 115232\nLöschungsankündigung\n\nCaronte GmbH\nGesellschaft mit beschränkter Haftung\nFrankfurt am Main\n\nDas Registergericht beabsichtigt die im Handelsregister eingetragene Gesellschaft von Amts wegen nach § 394 FamFG zu löschen. Die Frist zur Erhebung eines Widerspruchs gegen die beabsichtigte Löschung wird auf 1 Monat festgesetzt."
    },
    {
      "date": "2025-05-30",
      "id": "110729",
      "original_text": "Registerbekanntmachung nach dem Umwandlungsgesetz\nHessen Amtsgericht Frankfurt am Main HRB 104275\nMAINLOG GmbH – Eschborn",
      "type": "Registerbekanntmachung nach dem Umwandlungsgesetz",
      "state": "Hessen",
      "amtsgericht": "Amtsgericht Frankfurt am Main",
      "registernummer": "HRB 104275",
      "registerart": "HRB",
      "company_name": "MAINLOG GmbH",
      "company_seat": "Eschborn",
      "details": "30.05.2025 (Bekanntmachungsdatum)\n\nHessen Amtsgericht Frankfurt am Main HRB 104275\nRegisterbekanntmachung nach dem Umwandlungsgesetz 30.05.2025 (Eintragungsdatum)\n\nMAINLOG GmbH\nGesellschaft mit beschränkter Haftung\nEschborn\n\nDen Gläubigern der an der Verschmelzung beteiligten Rechtsträger ist, wenn sie binnen sechs Monaten nach dem Tag, an dem die Eintragung der Verschmelzung in das Register des Sitzes desjenigen Rechtsträgers, dessen Gläubiger sie sind, nach § 19 Absatz 3 UmwG bekannt gemacht worden ist, ihren Anspruch nach Grund und Höhe schriftlich anmelden, Sicherheit zu leisten, soweit sie nicht Befriedigung verlangen können. Dieses Recht steht den Gläubigern jedoch nur zu, wenn sie glaubhaft machen, dass durch die Verschmelzung die Erfüllung ihrer Forderung gefährdet wird."
    },
    {
      "date": "2025-05-30",
      "id": "110730",
      "original_text": "Registerbekanntmachung nach dem Umwandlungsgesetz\nHessen Amtsgericht Bad Hersfeld HRB 124\nRussek + Burkhard GmbH – Bad Hersfeld",
      "type": "Registerbekanntmachung nach dem Umwandlungsgesetz",
      "state": "Hessen",
      "amtsgericht": "Amtsgericht Bad Hersfeld",
      "registernummer": "HRB 124",
      "registerart": "HRB",
      "company_name": "Russek + Burkhard GmbH",
      "company_seat": "Bad Hersfeld",
      "details": "30.05.2025 (Bekanntmachungsdatum)\n\nHessen Amtsgericht Bad Hersfeld HRB 124\nRegisterbekanntmachung nach dem Umwandlungsgesetz 30.05.2025 (Eintragungsdatum)\n\nRussek + Burkhard GmbH\nGesellschaft mit beschränkter Haftung\nBad Hersfeld\n\nDen Gläubigern der an der Verschmelzung beteiligten Rechtsträger ist, wenn sie binnen sechs Monaten nach dem Tag, an dem die Eintragung der Verschmelzung in das Register des Sitzes desjenigen Rechtsträgers, dessen Gläubiger sie sind, nach § 19 Absatz 3 UmwG bekannt gemacht worden ist, ihren Anspruch nach Grund und Höhe schriftlich anmelden, Sicherheit zu leisten, soweit sie nicht Befriedigung verlangen können. Dieses Recht steht den Gläubigern jedoch nur zu, wenn sie glaubhaft machen, dass durch die Verschmelzung die Erfüllung ihrer Forderung gefährdet wird."
    },
    {
      "date": "2025-05-30",
      "id": "110731",
      "original_text": "Registerbekanntmachung nach dem Umwandlungsgesetz\nHessen Amtsgericht Fulda HRB 6434\nSeminarhotel Fohlenweide GmbH – Hofbieber",
      "type": "Registerbekanntmachung nach dem Umwandlungsgesetz",
      "state": "Hessen",
      "amtsgericht": "Amtsgericht Fulda",
      "registernummer": "HRB 6434",
      "registerart": "HRB",
      "company_name": "Seminarhotel Fohlenweide GmbH",
      "company_seat": "Hofbieber",
      "details": "30.05.2025 (Bekanntmachungsdatum)\n\nHessen Amtsgericht Fulda HRB 6434\nRegisterbekanntmachung nach dem Umwandlungsgesetz 30.05.2025 (Eintragungsdatum)\n\nSeminarhotel Fohlenweide GmbH\nGesellschaft mit beschränkter Haftung\nHofbieber\n\nDen Gläubigern der an der Verschmelzung beteiligten Rechtsträger ist, wenn sie binnen sechs Monaten nach dem Tag, an dem die Eintragung der Verschmelzung in das Register des Sitzes desjenigen Rechtsträgers, dessen Gläubiger sie sind, nach § 19 Absatz 3 UmwG bekannt gemacht worden ist, ihren Anspruch nach Grund und Höhe schriftlich anmelden, Sicherheit zu leisten, soweit sie nicht Befriedigung verlangen können. Dieses Recht steht den Gläubigern jedoch nur zu, wenn sie glaubhaft machen, dass durch die Verschmelzung die Erfüllung ihrer Forderung gefährdet wird."
    },
    {
      "date": "2025-05-30",
      "id": "110732",
      "original_text": "Registerbekanntmachung nach dem Umwandlungsgesetz\nHessen Amtsgericht Frankfurt am Main HRB 94070\nAPPEN GmbH – Frankfurt am Main",
      "type": "Registerbekanntmachung nach dem Umwandlungsgesetz",
      "state": "Hessen",
      "amtsgericht": "Amtsgericht Frankfurt am Main",
      "registernummer": "HRB 94070",
      "registerart": "HRB",
      "company_name": "APPEN GmbH",
      "company_seat": "Frankfurt am Main",
      "details": "30.05.2025 (Bekanntmachungsdatum)\n\nHessen Amtsgericht Frankfurt am Main HRB 94070\nRegisterbekanntmachung nach dem Umwandlungsgesetz 30.05.2025 (Eintragungsdatum)\n\nAPPEN GmbH\nGesellschaft mit beschränkter Haftung\nFrankfurt am Main\n\nDen Gläubigern der an der Verschmelzung beteiligten Rechtsträger ist, wenn sie binnen sechs Monaten nach dem Tag, an dem die Eintragung der Verschmelzung in das Register des Sitzes desjenigen Rechtsträgers, dessen Gläubiger sie sind, nach § 19 Absatz 3 UmwG bekannt gemacht worden ist, ihren Anspruch nach Grund und Höhe schriftlich anmelden, Sicherheit zu leisten, soweit sie nicht Befriedigung verlangen können. Dieses Recht steht den Gläubigern jedoch nur zu, wenn sie glaubhaft machen, dass durch die Verschmelzung die Erfüllung ihrer Forderung gefährdet wird."
    },
    {
      "date": "2025-05-30",
      "id": "110733",
      "original_text": "Löschungsankündigung\nHessen Amtsgericht Frankfurt am Main HRB 106122\nAKDENIZ Obst, Gemüse und Lebensmittel GmbH – Frankfurt am Main",
      "type": "Löschungsankündigung",
      "state": "Hessen",
      "amtsgericht": "Amtsgericht Frankfurt am Main",
      "registernummer": "HRB 106122",
      "registerart": "HRB",
      "company_name": "AKDENIZ Obst, Gemüse und Lebensmittel GmbH",
      "company_seat": "Frankfurt am Main",
      "details": "30.05.2025 (Bekanntmachungsdatum)\n\nHessen Amtsgericht Frankfurt am Main HRB 106122\nLöschungsankündigung\n\nAKDENIZ Obst, Gemüse und Lebensmittel GmbH\nGesellschaft mit beschränkter Haftung\nFrankfurt am Main\n\nDas Registergericht beabsichtigt die im Handelsregister eingetragene Gesellschaft von Amts wegen nach § 394 FamFG zu löschen. Die Frist zur Erhebung eines Widerspruchs gegen die beabsichtigte Löschung wird auf 1 Monat festgesetzt."
    },
    {
      "date": "2025-05-30",
      "id": "110734",
      "original_text": "Einreichung neuer Dokumente\nHessen Amtsgericht Hanau HRB 1012\nBAUGESELLSCHAFT HANAU Gesellschaft mit beschränkter Haftung – Hanau",
      "type": "Einreichung neuer Dokumente",
      "state": "Hessen",
      "amtsgericht": "Amtsgericht Hanau",
      "registernummer": "HRB 1012",
      "registerart": "HRB",
      "company_name": "BAUGESELLSCHAFT HANAU Gesellschaft mit beschränkter Haftung",
      "company_seat": "Hanau",
      "details": "30.05.2025 (Bekanntmachungsdatum)\n\nHessen Amtsgericht Hanau HRB 1012\nEinreichung neuer Dokumente\n\nBAUGESELLSCHAFT HANAU Gesellschaft mit beschränkter Haftung\nGesellschaft mit beschränkter Haftung\nHanau\n\nDurch eine Änderung in den Personen der Aufsichtsratsmitglieder ist eine Liste der Mitglieder des Aufsichtsrates zum Handelsregister eingereicht worden."
    },
    {
      "date": "2025-05-30",
      "id": "110735",
      "original_text": "Registerbekanntmachung nach dem Umwandlungsgesetz\nHessen Amtsgericht Frankfurt am Main HRB 50879\nDB InfraGO Aktiengesellschaft – Frankfurt am Main",
      "type": "Registerbekanntmachung nach dem Umwandlungsgesetz",
      "state": "Hessen",
      "amtsgericht": "Amtsgericht Frankfurt am Main",
      "registernummer": "HRB 50879",
      "registerart": "HRB",
      "company_name": "DB InfraGO Aktiengesellschaft",
      "company_seat": "Frankfurt am Main",
      "details": "30.05.2025 (Bekanntmachungsdatum)\n\nHessen Amtsgericht Frankfurt am Main HRB 50879\nRegisterbekanntmachung nach dem Umwandlungsgesetz 30.05.2025 (Eintragungsdatum)\n\nDB InfraGO Aktiengesellschaft\nAktiengesellschaft\nFrankfurt am Main\n\nDen Gläubigern der an der Verschmelzung beteiligten Rechtsträger ist, wenn sie binnen sechs Monaten nach dem Tag, an dem die Eintragung der Verschmelzung in das Register des Sitzes desjenigen Rechtsträgers, dessen Gläubiger sie sind, nach § 19 Absatz 3 UmwG bekannt gemacht worden ist, ihren Anspruch nach Grund und Höhe schriftlich anmelden, Sicherheit zu leisten, soweit sie nicht Befriedigung verlangen können. Dieses Recht steht den Gläubigern jedoch nur zu, wenn sie glaubhaft machen, dass durch die Verschmelzung die Erfüllung ihrer Forderung gefährdet wird."
    },
    {
      "date": "2025-05-30",
      "id": "110736",
      "original_text": "Löschungsankündigung\nHessen Amtsgericht Offenbach am Main HRB 55096\nTAMM GmbH – Dreieich",
      "type": "Löschungsankündigung",
      "state": "Hessen",
      "amtsgericht": "Amtsgericht Offenbach am Main",
      "registernummer": "HRB 55096",
      "registerart": "HRB",
      "company_name": "TAMM GmbH",
      "company_seat": "Dreieich",
      "details": "30.05.2025 (Bekanntmachungsdatum)\n\nHessen Amtsgericht Offenbach am Main HRB 55096\nLöschungsankündigung\n\nTAMM GmbH\nGesellschaft mit beschränkter Haftung\nDreieich\n\nDas Registergericht beabsichtigt die im Handelsregister eingetragene Gesellschaft von Amts wegen nach § 394 FamFG zu löschen. Die Frist zur Erhebung eines Widerspruchs gegen die beabsichtigte Löschung wird auf 3 Monate festgesetzt"
    },
    {
      "date": "2025-05-30",
      "id": "110737",
      "original_text": "Einreichung neuer Dokumente\nHessen Amtsgericht Kassel HRB 7452\nK+S Minerals and Agriculture GmbH – Kassel",
      "type": "Einreichung neuer Dokumente",
      "state": "Hessen",
      "amtsgericht": "Amtsgericht Kassel",
      "registernummer": "HRB 7452",
      "registerart": "HRB",
      "company_name": "K+S Minerals and Agriculture GmbH",
      "company_seat": "Kassel",
      "details": "30.05.2025 (Bekanntmachungsdatum)\n\nHessen Amtsgericht Kassel HRB 7452\nEinreichung neuer Dokumente\n\nK+S Minerals and Agriculture GmbH\nGesellschaft mit beschränkter Haftung\nKassel\n\nDurch eine Änderung in den Personen der Aufsichtsratsmitglieder ist eine Liste der Mitglieder des Aufsichtsrates zum Handelsregister eingereicht worden."
    },
    {
      "date": "2025-05-30",
      "id": "110738",
      "original_text": "Registerbekanntmachung nach dem Umwandlungsgesetz\nHessen Amtsgericht Frankfurt am Main HRB 119720\nDB Kommunikationstechnik GmbH – Frankfurt am Main",
      "type": "Registerbekanntmachung nach dem Umwandlungsgesetz",
      "state": "Hessen",
      "amtsgericht": "Amtsgericht Frankfurt am Main",
      "registernummer": "HRB 119720",
      "registerart": "HRB",
      "company_name": "DB Kommunikationstechnik GmbH",
      "company_seat": "Frankfurt am Main",
      "details": "30.05.2025 (Bekanntmachungsdatum)\n\nHessen Amtsgericht Frankfurt am Main HRB 119720\nRegisterbekanntmachung nach dem Umwandlungsgesetz 30.05.2025 (Eintragungsdatum)\n\nDB Kommunikationstechnik GmbH\nGesellschaft mit beschränkter Haftung\nFrankfurt am Main\n\nDen Gläubigern der an der Verschmelzung beteiligten Rechtsträger ist, wenn sie binnen sechs Monaten nach dem Tag, an dem die Eintragung der Verschmelzung in das Register des Sitzes desjenigen Rechtsträgers, dessen Gläubiger sie sind, nach § 19 Absatz 3 UmwG bekannt gemacht worden ist, ihren Anspruch nach Grund und Höhe schriftlich anmelden, Sicherheit zu leisten, soweit sie nicht Befriedigung verlangen können. Dieses Recht steht den Gläubigern jedoch nur zu, wenn sie glaubhaft machen, dass durch die Verschmelzung die Erfüllung ihrer Forderung gefährdet wird."
    },
    {
      "date": "2025-05-30",
      "id": "110739",
      "original_text": "Löschungsankündigung\nHessen Amtsgericht Frankfurt am Main HRB 13822\nATS Asphalttechnik GmbH – Eschborn",
      "type": "Löschungsankündigung",
      "state": "Hessen",
      "amtsgericht": "Amtsgericht Frankfurt am Main",
      "registernummer": "HRB 13822",
      "registerart": "HRB",
      "company_name": "ATS Asphalttechnik GmbH",
      "company_seat": "Eschborn",
      "details": "30.05.2025 (Bekanntmachungsdatum)\n\nHessen Amtsgericht Frankfurt am Main HRB 13822\nLöschungsankündigung\n\nATS Asphalttechnik GmbH\nGesellschaft mit beschränkter Haftung\nEschborn\n\nDas Registergericht beabsichtigt die im Handelsregister eingetragene Gesellschaft von Amts wegen nach § 394 FamFG zu löschen. Die Frist zur Erhebung eines Widerspruchs gegen die beabsichtigte Löschung wird auf 1 Monat festgesetzt."
    },
    {
      "date": "2025-05-30",
      "id": "110740",
      "original_text": "Sonstige Registerbekanntmachung\nHessen Amtsgericht Wetzlar VR 428\nWetzlarer Singakademie e. V. – Wetzlar",
      "type": "Sonstige Registerbekanntmachung",
      "state": "Hessen",
      "amtsgericht": "Amtsgericht Wetzlar",
      "registernummer": "VR 428",
      "registerart": "VR",
      "company_name": "Wetzlarer Singakademie e. V.",
      "company_seat": "Wetzlar",
      "details": "30.05.2025 (Bekanntmachungsdatum)\n\nHessen Amtsgericht Wetzlar VR 428\nSonstige Registerbekanntmachung 30.05.2025 (Eintragungsdatum)\n\nWetzlarer Singakademie e. V.\neingetragener Verein\nWetzlar\n\nDer Verein ist aufgelöst."
    },
    {
      "date": "2025-05-30",
      "id": "110741",
      "original_text": "Registerbekanntmachung nach dem Umwandlungsgesetz\nHessen Amtsgericht Frankfurt am Main HRB 30000\nDEUTSCHE BANK AKTIENGESELLSCHAFT – Frankfurt am Main",
      "type": "Registerbekanntmachung nach dem Umwandlungsgesetz",
      "state": "Hessen",
      "amtsgericht": "Amtsgericht Frankfurt am Main",
      "registernummer": "HRB 30000",
      "registerart": "HRB",
      "company_name": "DEUTSCHE BANK AKTIENGESELLSCHAFT",
      "company_seat": "Frankfurt am Main",
      "details": "30.05.2025 (Bekanntmachungsdatum)\n\nHessen Amtsgericht Frankfurt am Main HRB 30000\nRegisterbekanntmachung nach dem Umwandlungsgesetz\n\nDEUTSCHE BANK AKTIENGESELLSCHAFT\nAktiengesellschaft\nFrankfurt am Main\n\nDie Gesellschaft hat den Entwurf des Verschmelzungsvertrages zwischen ihr und der DBHR Solutions GmbH, Frankfurt am Main (Amtsgericht Frankfurt am Main, HRB 57206) beim Amtsgericht Frankfurt am Main (Registergericht) zur Einsichtnahme eingereicht."
    }
  ]
}