{
  "date": "2025-05-16",
  "date_of_scrape": "2025-05-31T10:47:42.862Z",
  "tool_version": "0.2.0",
  "number_of_announcements": 122,
  "announcements": [
    {
      "date": "2025-05-16",
      "id": "109269",
      "original_text": "Registerbekanntmachung nach dem Umwandlungsgesetz\nBayern Amtsgericht Augsburg HRB 29957\nAlpha-Segment GmbH – Dießen am Ammersee",
      "type": "Registerbekanntmachung nach dem Umwandlungsgesetz",
      "state": "Bayern",
      "amtsgericht": "Amtsgericht Augsburg",
      "registernummer": "HRB 29957",
      "registerart": "HRB",
      "company_name": "Alpha-Segment GmbH",
      "company_seat": "Dießen am Ammersee",
      "details": "16.05.2025 (Bekanntmachungsdatum)\n\nBayern Amtsgericht Augsburg HRB 29957\nRegisterbekanntmachung nach dem Umwandlungsgesetz 15.05.2025 (Eintragungsdatum)\n\nAlpha-Segment GmbH\nGesellschaft mit beschränkter Haftung\nDießen am Ammersee\n\nDen Gläubigern der an der Ausgliederung beteiligten Rechtsträger ist, wenn sie binnen sechs Monaten nach dem Tag, an dem die Eintragung der Ausgliederung in das Register des Sitzes desjenigen Rechtsträgers, dessen Gläubiger sie sind, nach §§ 125, 19 Abs. 3 UmwG als bekannt gemacht gilt, ihren Anspruch nach Grund und Höhe in Textform anmelden, Sicherheit zu leisten, soweit sie nicht Befriedigung verlangen können. Dieses Recht steht den Gläubigern jedoch nur zu, wenn sie glaubhaft machen, dass durch die Ausgliederung die Erfüllung ihrer Forderung gefährdet wird."
    },
    {
      "date": "2025-05-16",
      "id": "109270",
      "original_text": "Registerbekanntmachung nach dem Umwandlungsgesetz\nBayern Amtsgericht München HRB 302370\nMosa Markets GmbH – München",
      "type": "Registerbekanntmachung nach dem Umwandlungsgesetz",
      "state": "Bayern",
      "amtsgericht": "Amtsgericht München",
      "registernummer": "HRB 302370",
      "registerart": "HRB",
      "company_name": "Mosa Markets GmbH",
      "company_seat": "München",
      "details": "16.05.2025 (Bekanntmachungsdatum)\n\nBayern Amtsgericht München HRB 302370\nRegisterbekanntmachung nach dem Umwandlungsgesetz 15.05.2025 (Eintragungsdatum)\n\nMosa Markets GmbH\nGesellschaft mit beschränkter Haftung\nMünchen\n\nDen Gläubigern der an der Ausgliederung beteiligten Rechtsträger ist, wenn sie binnen sechs Monaten nach dem Tag, an dem die Eintragung der Ausgliederung in das Register des Sitzes desjenigen Rechtsträgers, dessen Gläubiger sie sind, nach §§ 125, 19 Abs. 3 UmwG als bekannt gemacht gilt, ihren Anspruch nach Grund und Höhe in Textform anmelden, Sicherheit zu leisten, soweit sie nicht Befriedigung verlangen können. Dieses Recht steht den Gläubigern jedoch nur zu, wenn sie glaubhaft machen, dass durch die Ausgliederung die Erfüllung ihrer Forderung gefährdet wird."
    },
    {
      "date": "2025-05-16",
      "id": "109271",
      "original_text": "Einreichung neuer Dokumente\nBayern Amtsgericht München HRB 57129\nhubergroup Deutschland GmbH – Kirchheim b.München",
      "type": "Einreichung neuer Dokumente",
      "state": "Bayern",
      "amtsgericht": "Amtsgericht München",
      "registernummer": "HRB 57129",
      "registerart": "HRB",
      "company_name": "hubergroup Deutschland GmbH",
      "company_seat": "Kirchheim b.München",
      "details": "16.05.2025 (Bekanntmachungsdatum)\n\nBayern Amtsgericht München HRB 57129\nEinreichung neuer Dokumente\n\nhubergroup Deutschland GmbH\nGesellschaft mit beschränkter Haftung\nKirchheim b.München\n\nDem Amtsgericht München -Registergericht- ist eine Liste der Mitglieder des Aufsichtsrats eingereicht worden, § 52 Abs. 3 S. 2 GmbHG."
    },
    {
      "date": "2025-05-16",
      "id": "109272",
      "original_text": "Einreichung neuer Dokumente\nBayern Amtsgericht München HRB 137918\nUnion Reiseversicherung Aktiengesellschaft – München",
      "type": "Einreichung neuer Dokumente",
      "state": "Bayern",
      "amtsgericht": "Amtsgericht München",
      "registernummer": "HRB 137918",
      "registerart": "HRB",
      "company_name": "Union Reiseversicherung Aktiengesellschaft",
      "company_seat": "München",
      "details": "16.05.2025 (Bekanntmachungsdatum)\n\nBayern Amtsgericht München HRB 137918\nEinreichung neuer Dokumente 15.05.2025 (Eintragungsdatum)\n\nUnion Reiseversicherung Aktiengesellschaft\nAktiengesellschaft\nMünchen\n\nDem Amtsgericht München -Registergericht- ist eine Liste der Mitglieder des Aufsichtsrats eingereicht worden, § 106 AktG."
    },
    {
      "date": "2025-05-16",
      "id": "109273",
      "original_text": "Registerbekanntmachung nach dem Umwandlungsgesetz\nBayern Amtsgericht München HRB 196628\nLightworks GmbH – Holzkirchen",
      "type": "Registerbekanntmachung nach dem Umwandlungsgesetz",
      "state": "Bayern",
      "amtsgericht": "Amtsgericht München",
      "registernummer": "HRB 196628",
      "registerart": "HRB",
      "company_name": "Lightworks GmbH",
      "company_seat": "Holzkirchen",
      "details": "16.05.2025 (Bekanntmachungsdatum)\n\nBayern Amtsgericht München HRB 196628\nRegisterbekanntmachung nach dem Umwandlungsgesetz 15.05.2025 (Eintragungsdatum)\n\nLightworks GmbH\nGesellschaft mit beschränkter Haftung\nHolzkirchen\n\nDen Gläubigern der an der Verschmelzung beteiligten Rechtsträger ist, wenn sie binnen sechs Monaten nach dem Tag, an dem die Eintragung der Verschmelzung in das Register des Sitzes desjenigen Rechtsträgers, dessen Gläubiger sie sind, nach § 19 Abs. 3 UmwG als bekannt gemacht gilt, ihren Anspruch nach Grund und Höhe in Textform anmelden, Sicherheit zu leisten, soweit sie nicht Befriedigung verlangen können. Dieses Recht steht den Gläubigern jedoch nur zu, wenn sie glaubhaft machen, dass durch die Verschmelzung die Erfüllung ihrer Forderung gefährdet wird."
    },
    {
      "date": "2025-05-16",
      "id": "109274",
      "original_text": "Registerbekanntmachung nach dem Umwandlungsgesetz\nBayern Amtsgericht München HRB 203544\nSID Immobilien GmbH – Wörthsee, OT Steinebach",
      "type": "Registerbekanntmachung nach dem Umwandlungsgesetz",
      "state": "Bayern",
      "amtsgericht": "Amtsgericht München",
      "registernummer": "HRB 203544",
      "registerart": "HRB",
      "company_name": "SID Immobilien GmbH",
      "company_seat": "Wörthsee, OT Steinebach",
      "details": "16.05.2025 (Bekanntmachungsdatum)\n\nBayern Amtsgericht München HRB 203544\nRegisterbekanntmachung nach dem Umwandlungsgesetz 15.05.2025 (Eintragungsdatum)\n\nSID Immobilien GmbH\nGesellschaft mit beschränkter Haftung\nWörthsee, OT Steinebach\n\nDen Gläubigern der an der Verschmelzung beteiligten Rechtsträger ist, wenn sie binnen sechs Monaten nach dem Tag, an dem die Eintragung der Verschmelzung in das Register des Sitzes desjenigen Rechtsträgers, dessen Gläubiger sie sind, nach § 19 Abs. 3 UmwG als bekannt gemacht gilt, ihren Anspruch nach Grund und Höhe in Textform anmelden, Sicherheit zu leisten, soweit sie nicht Befriedigung verlangen können. Dieses Recht steht den Gläubigern jedoch nur zu, wenn sie glaubhaft machen, dass durch die Verschmelzung die Erfüllung ihrer Forderung gefährdet wird."
    },
    {
      "date": "2025-05-16",
      "id": "109275",
      "original_text": "Löschungsankündigung\nBayern Amtsgericht München HRB 224205\nE + K Bauträger GmbH – München",
      "type": "Löschungsankündigung",
      "state": "Bayern",
      "amtsgericht": "Amtsgericht München",
      "registernummer": "HRB 224205",
      "registerart": "HRB",
      "company_name": "E + K Bauträger GmbH",
      "company_seat": "München",
      "details": "16.05.2025 (Bekanntmachungsdatum)\n\nBayern Amtsgericht München HRB 224205\nLöschungsankündigung 15.05.2025 (Eintragungsdatum)\n\nE + K Bauträger GmbH\nGesellschaft mit beschränkter Haftung\nMünchen\n\nDas Registergericht beabsichtigt, die im Handelsregister eingetragene Gesellschaft wegen Vermögenslosigkeit von Amts wegen nach § 394 FamFG zu löschen. Die Frist zur Erhebung eines Widerspruchs ist auf drei Monate festgesetzt."
    },
    {
      "date": "2025-05-16",
      "id": "109276",
      "original_text": "Löschungsankündigung\nBayern Amtsgericht Ansbach HRB 5361\nGourmet Tempel Ansbach GmbH – Ansbach",
      "type": "Löschungsankündigung",
      "state": "Bayern",
      "amtsgericht": "Amtsgericht Ansbach",
      "registernummer": "HRB 5361",
      "registerart": "HRB",
      "company_name": "Gourmet Tempel Ansbach GmbH",
      "company_seat": "Ansbach",
      "details": "16.05.2025 (Bekanntmachungsdatum)\n\nBayern Amtsgericht Ansbach HRB 5361\nLöschungsankündigung\n\nGourmet Tempel Ansbach GmbH\nGesellschaft mit beschränkter Haftung\nAnsbach\n\nDas Registergericht beabsichtigt, die im Handelsregister eingetragene Gesellschaft wegen Vermögenslosigkeit von Amts wegen nach § 394 FamFG zu löschen. Die Frist zur Erhebung eines Widerspruchs ist auf sechs Wochen festgesetzt."
    },
    {
      "date": "2025-05-16",
      "id": "109277",
      "original_text": "Einreichung neuer Dokumente\nBayern Amtsgericht Bamberg HRB 99\nStadtbau GmbH Bamberg – Bamberg",
      "type": "Einreichung neuer Dokumente",
      "state": "Bayern",
      "amtsgericht": "Amtsgericht Bamberg",
      "registernummer": "HRB 99",
      "registerart": "HRB",
      "company_name": "Stadtbau GmbH Bamberg",
      "company_seat": "Bamberg",
      "details": "16.05.2025 (Bekanntmachungsdatum)\n\nBayern Amtsgericht Bamberg HRB 99\nEinreichung neuer Dokumente\n\nStadtbau GmbH Bamberg\nGesellschaft mit beschränkter Haftung\nBamberg\n\nDem Amtsgericht Bamberg -Registergericht- ist eine Liste der Mitglieder des Aufsichtsrats eingereicht worden, § 52 Abs. 3 S. 2 GmbHG."
    },
    {
      "date": "2025-05-16",
      "id": "109278",
      "original_text": "Löschungsankündigung\nBayern Amtsgericht Bayreuth VR 1310\nWanderfreunde Funkendorf- Creußen und Umgebung e.V. – Prebitz OT Funkendorf",
      "type": "Löschungsankündigung",
      "state": "Bayern",
      "amtsgericht": "Amtsgericht Bayreuth",
      "registernummer": "VR 1310",
      "registerart": "VR",
      "company_name": "Wanderfreunde Funkendorf- Creußen und Umgebung e.V.",
      "company_seat": "Prebitz OT Funkendorf",
      "details": "16.05.2025 (Bekanntmachungsdatum)\n\nBayern Amtsgericht Bayreuth VR 1310\nLöschungsankündigung\n\nWanderfreunde Funkendorf- Creußen und Umgebung e.V.\neingetragener Verein\nPrebitz OT Funkendorf\n\nDas Registergericht beabsichtigt, den im Vereinsregister eingetragenen Verein von Amts wegen nach § 395 FamFG zu löschen. Die Frist zur Erhebung eines Widerspruchs ist auf einen Monat festgesetzt."
    },
    {
      "date": "2025-05-16",
      "id": "109279",
      "original_text": "Einreichung neuer Dokumente\nBayern Amtsgericht Fürth HRB 15329\nHUAC AG – Kalchreuth",
      "type": "Einreichung neuer Dokumente",
      "state": "Bayern",
      "amtsgericht": "Amtsgericht Fürth",
      "registernummer": "HRB 15329",
      "registerart": "HRB",
      "company_name": "HUAC AG",
      "company_seat": "Kalchreuth",
      "details": "16.05.2025 (Bekanntmachungsdatum)\n\nBayern Amtsgericht Fürth HRB 15329\nEinreichung neuer Dokumente\n\nHUAC AG\nAktiengesellschaft\nKalchreuth\n\nDem Amtsgericht Fürth -Registergericht- ist eine Liste der Mitglieder des Aufsichtsrats eingereicht worden, § 106 AktG."
    },
    {
      "date": "2025-05-16",
      "id": "109280",
      "original_text": "Löschungsankündigung\nBayern Amtsgericht Landshut HRA 11825\nRegaltech e. K. – Vilsbiburg",
      "type": "Löschungsankündigung",
      "state": "Bayern",
      "amtsgericht": "Amtsgericht Landshut",
      "registernummer": "HRA 11825",
      "registerart": "HRA",
      "company_name": "Regaltech e. K.",
      "company_seat": "Vilsbiburg",
      "details": "16.05.2025 (Bekanntmachungsdatum)\n\nBayern Amtsgericht Landshut HRA 11825\nLöschungsankündigung\n\nRegaltech e. K.\nEinzelkaufmann / Einzelkauffrau\nVilsbiburg\n\nDas Registergericht beabsichtigt, die im Handelsregister eingetragene Firma von Amts wegen nach § 31 Abs. 2 HGB zu löschen. Die Frist zur Erhebung eines Widerspruchs ist auf einen Monat festgesetzt."
    },
    {
      "date": "2025-05-16",
      "id": "109281",
      "original_text": "Einreichung neuer Dokumente\nBayern Amtsgericht Traunstein HRB 10968\nNITROCHEMIE ASCHAU GMBH – Aschau a. Inn",
      "type": "Einreichung neuer Dokumente",
      "state": "Bayern",
      "amtsgericht": "Amtsgericht Traunstein",
      "registernummer": "HRB 10968",
      "registerart": "HRB",
      "company_name": "NITROCHEMIE ASCHAU GMBH",
      "company_seat": "Aschau a. Inn",
      "details": "16.05.2025 (Bekanntmachungsdatum)\n\nBayern Amtsgericht Traunstein HRB 10968\nEinreichung neuer Dokumente\n\nNITROCHEMIE ASCHAU GMBH\nGesellschaft mit beschränkter Haftung\nAschau a. Inn\n\nDem Amtsgericht Traunstein -Registergericht- ist eine Liste der Mitglieder des Aufsichtsrats eingereicht worden, § 52 Abs. 3 S. 2 GmbHG."
    },
    {
      "date": "2025-05-16",
      "id": "109282",
      "original_text": "Registerbekanntmachung nach dem Umwandlungsgesetz\nBayern Amtsgericht München HRB 265955\nUlrich 31 GmbH – München",
      "type": "Registerbekanntmachung nach dem Umwandlungsgesetz",
      "state": "Bayern",
      "amtsgericht": "Amtsgericht München",
      "registernummer": "HRB 265955",
      "registerart": "HRB",
      "company_name": "Ulrich 31 GmbH",
      "company_seat": "München",
      "details": "16.05.2025 (Bekanntmachungsdatum)\n\nBayern Amtsgericht München HRB 265955\nRegisterbekanntmachung nach dem Umwandlungsgesetz 15.05.2025 (Eintragungsdatum)\n\nUlrich 31 GmbH\nGesellschaft mit beschränkter Haftung\nMünchen\n\nDen Gläubigern der an der Verschmelzung beteiligten Rechtsträger ist, wenn sie binnen sechs Monaten nach dem Tag, an dem die Eintragung der Verschmelzung in das Register des Sitzes desjenigen Rechtsträgers, dessen Gläubiger sie sind, nach § 19 Abs. 3 UmwG als bekannt gemacht gilt, ihren Anspruch nach Grund und Höhe in Textform anmelden, Sicherheit zu leisten, soweit sie nicht Befriedigung verlangen können. Dieses Recht steht den Gläubigern jedoch nur zu, wenn sie glaubhaft machen, dass durch die Verschmelzung die Erfüllung ihrer Forderung gefährdet wird."
    },
    {
      "date": "2025-05-16",
      "id": "109283",
      "original_text": "Einreichung neuer Dokumente\nBayern Amtsgericht Bamberg HRB 5765\nBGS - Bamberg.Gebäude.Service GmbH – Bamberg",
      "type": "Einreichung neuer Dokumente",
      "state": "Bayern",
      "amtsgericht": "Amtsgericht Bamberg",
      "registernummer": "HRB 5765",
      "registerart": "HRB",
      "company_name": "BGS - Bamberg.Gebäude.Service GmbH",
      "company_seat": "Bamberg",
      "details": "16.05.2025 (Bekanntmachungsdatum)\n\nBayern Amtsgericht Bamberg HRB 5765\nEinreichung neuer Dokumente\n\nBGS - Bamberg.Gebäude.Service GmbH\nGesellschaft mit beschränkter Haftung\nBamberg\n\nDem Amtsgericht Bamberg -Registergericht- ist eine Liste der Mitglieder des Aufsichtsrats eingereicht worden, § 52 Abs. 3 S. 2 GmbHG."
    },
    {
      "date": "2025-05-16",
      "id": "109284",
      "original_text": "Einreichung neuer Dokumente\nBayern Amtsgericht München HRB 235614\nPhilomaxcap AG – München",
      "type": "Einreichung neuer Dokumente",
      "state": "Bayern",
      "amtsgericht": "Amtsgericht München",
      "registernummer": "HRB 235614",
      "registerart": "HRB",
      "company_name": "Philomaxcap AG",
      "company_seat": "München",
      "details": "16.05.2025 (Bekanntmachungsdatum)\n\nBayern Amtsgericht München HRB 235614\nEinreichung neuer Dokumente\n\nPhilomaxcap AG\nAktiengesellschaft\nMünchen\n\nDem Amtsgericht München -Registergericht- ist eine Liste der Mitglieder des Aufsichtsrats eingereicht worden, § 106 AktG."
    },
    {
      "date": "2025-05-16",
      "id": "109285",
      "original_text": "Löschungsankündigung\nBayern Amtsgericht München HRA 88496\nProcher Grundbesitz GmbH & Co. KG – Großweil",
      "type": "Löschungsankündigung",
      "state": "Bayern",
      "amtsgericht": "Amtsgericht München",
      "registernummer": "HRA 88496",
      "registerart": "HRA",
      "company_name": "Procher Grundbesitz GmbH & Co. KG",
      "company_seat": "Großweil",
      "details": "16.05.2025 (Bekanntmachungsdatum)\n\nBayern Amtsgericht München HRA 88496\nLöschungsankündigung\n\nProcher Grundbesitz GmbH & Co. KG\nKommanditgesellschaft\nGroßweil\n\nDas Registergericht beabsichtigt, die im Handelsregister eingetragene Firma von Amts wegen nach § 31 Abs. 2 HGB zu löschen. Die Frist zur Erhebung eines Widerspruchs ist auf drei Monate festgesetzt."
    },
    {
      "date": "2025-05-16",
      "id": "109286",
      "original_text": "Registerbekanntmachung nach dem Umwandlungsgesetz\nBayern Amtsgericht München HRB 121734\nRSM-technik GmbH Schaltanlagen Systemhaus für Regelungstechnik – München",
      "type": "Registerbekanntmachung nach dem Umwandlungsgesetz",
      "state": "Bayern",
      "amtsgericht": "Amtsgericht München",
      "registernummer": "HRB 121734",
      "registerart": "HRB",
      "company_name": "RSM-technik GmbH Schaltanlagen Systemhaus für Regelungstechnik",
      "company_seat": "München",
      "details": "16.05.2025 (Bekanntmachungsdatum)\n\nBayern Amtsgericht München HRB 121734\nRegisterbekanntmachung nach dem Umwandlungsgesetz 15.05.2025 (Eintragungsdatum)\n\nRSM-technik GmbH Schaltanlagen Systemhaus für Regelungstechnik\nGesellschaft mit beschränkter Haftung\nMünchen\n\nDen Gläubigern der an der Verschmelzung beteiligten Rechtsträger ist, wenn sie binnen sechs Monaten nach dem Tag, an dem die Eintragung der Verschmelzung in das Register des Sitzes desjenigen Rechtsträgers, dessen Gläubiger sie sind, nach § 19 Abs. 3 UmwG als bekannt gemacht gilt, ihren Anspruch nach Grund und Höhe in Textform anmelden, Sicherheit zu leisten, soweit sie nicht Befriedigung verlangen können. Dieses Recht steht den Gläubigern jedoch nur zu, wenn sie glaubhaft machen, dass durch die Verschmelzung die Erfüllung ihrer Forderung gefährdet wird."
    },
    {
      "date": "2025-05-16",
      "id": "109287",
      "original_text": "Registerbekanntmachung nach dem Umwandlungsgesetz\nBayern Amtsgericht Augsburg HRB 35869\nNB-Management UG (haftungsbeschränkt) – Stadtbergen",
      "type": "Registerbekanntmachung nach dem Umwandlungsgesetz",
      "state": "Bayern",
      "amtsgericht": "Amtsgericht Augsburg",
      "registernummer": "HRB 35869",
      "registerart": "HRB",
      "company_name": "NB-Management UG (haftungsbeschränkt)",
      "company_seat": "Stadtbergen",
      "details": "16.05.2025 (Bekanntmachungsdatum)\n\nBayern Amtsgericht Augsburg HRB 35869\nRegisterbekanntmachung nach dem Umwandlungsgesetz 15.05.2025 (Eintragungsdatum)\n\nNB-Management UG (haftungsbeschränkt)\nGesellschaft mit beschränkter Haftung\nStadtbergen\n\nDen Gläubigern der an der Verschmelzung beteiligten Rechtsträger ist, wenn sie binnen sechs Monaten nach dem Tag, an dem die Eintragung der Verschmelzung in das Register des Sitzes desjenigen Rechtsträgers, dessen Gläubiger sie sind, nach § 19 Abs. 3 UmwG als bekannt gemacht gilt, ihren Anspruch nach Grund und Höhe in Textform anmelden, Sicherheit zu leisten, soweit sie nicht Befriedigung verlangen können. Dieses Recht steht den Gläubigern jedoch nur zu, wenn sie glaubhaft machen, dass durch die Verschmelzung die Erfüllung ihrer Forderung gefährdet wird."
    },
    {
      "date": "2025-05-16",
      "id": "109288",
      "original_text": "Einreichung neuer Dokumente\nBayern Amtsgericht München HRB 40217\nGHM Gesellschaft für Handwerksmessen mbH – München",
      "type": "Einreichung neuer Dokumente",
      "state": "Bayern",
      "amtsgericht": "Amtsgericht München",
      "registernummer": "HRB 40217",
      "registerart": "HRB",
      "company_name": "GHM Gesellschaft für Handwerksmessen mbH",
      "company_seat": "München",
      "details": "16.05.2025 (Bekanntmachungsdatum)\n\nBayern Amtsgericht München HRB 40217\nEinreichung neuer Dokumente 15.05.2025 (Eintragungsdatum)\n\nGHM Gesellschaft für Handwerksmessen mbH\nGesellschaft mit beschränkter Haftung\nMünchen\n\nDem Amtsgericht München -Registergericht- ist eine Liste der Mitglieder des Aufsichtsrats eingereicht worden, § 52 Abs. 3 S. 2 GmbHG."
    },
    {
      "date": "2025-05-16",
      "id": "109289",
      "original_text": "Registerbekanntmachung nach dem Umwandlungsgesetz\nBayern Amtsgericht München HRB 113712\nElsa Vermögens- und Beteiligungs AG – Grünwald",
      "type": "Registerbekanntmachung nach dem Umwandlungsgesetz",
      "state": "Bayern",
      "amtsgericht": "Amtsgericht München",
      "registernummer": "HRB 113712",
      "registerart": "HRB",
      "company_name": "Elsa Vermögens- und Beteiligungs AG",
      "company_seat": "Grünwald",
      "details": "16.05.2025 (Bekanntmachungsdatum)\n\nBayern Amtsgericht München HRB 113712\nRegisterbekanntmachung nach dem Umwandlungsgesetz\n\nElsa Vermögens- und Beteiligungs AG\nAktiengesellschaft\nGrünwald\n\nDem Amtsgericht München -Registergericht- ist der Entwurf eines Verschmelzungsvertrages zwischen der Elsa Vermögens- und Beteiligungs AG mit Sitz in Grünwald (Amtsgericht München, HRB 113712) als übernehmendem Rechtsträger und der Hallufix AG, Grünwald (Amtsgericht München HRB 164937) als übertragendem Rechtsträger zur Einsichtnahme eingereicht worden."
    },
    {
      "date": "2025-05-16",
      "id": "109290",
      "original_text": "Einreichung neuer Dokumente\nBayern Amtsgericht München HRB 275673\nKorian Deutschland GmbH – München",
      "type": "Einreichung neuer Dokumente",
      "state": "Bayern",
      "amtsgericht": "Amtsgericht München",
      "registernummer": "HRB 275673",
      "registerart": "HRB",
      "company_name": "Korian Deutschland GmbH",
      "company_seat": "München",
      "details": "16.05.2025 (Bekanntmachungsdatum)\n\nBayern Amtsgericht München HRB 275673\nEinreichung neuer Dokumente\n\nKorian Deutschland GmbH\nGesellschaft mit beschränkter Haftung\nMünchen\n\nDem Amtsgericht München -Registergericht- ist eine Liste der Mitglieder des Aufsichtsrats eingereicht worden, § 52 Abs. 3 S. 2 GmbHG."
    },
    {
      "date": "2025-05-16",
      "id": "109291",
      "original_text": "Registerbekanntmachung nach dem Umwandlungsgesetz\nBayern Amtsgericht München HRB 219222\nValluc Capital GmbH – Starnberg",
      "type": "Registerbekanntmachung nach dem Umwandlungsgesetz",
      "state": "Bayern",
      "amtsgericht": "Amtsgericht München",
      "registernummer": "HRB 219222",
      "registerart": "HRB",
      "company_name": "Valluc Capital GmbH",
      "company_seat": "Starnberg",
      "details": "16.05.2025 (Bekanntmachungsdatum)\n\nBayern Amtsgericht München HRB 219222\nRegisterbekanntmachung nach dem Umwandlungsgesetz 15.05.2025 (Eintragungsdatum)\n\nValluc Capital GmbH\nGesellschaft mit beschränkter Haftung\nStarnberg\n\nDen Gläubigern der an der Verschmelzung beteiligten Rechtsträger ist, wenn sie binnen sechs Monaten nach dem Tag, an dem die Eintragung der Verschmelzung in das Register des Sitzes desjenigen Rechtsträgers, dessen Gläubiger sie sind, nach § 19 Abs. 3 UmwG als bekannt gemacht gilt, ihren Anspruch nach Grund und Höhe in Textform anmelden, Sicherheit zu leisten, soweit sie nicht Befriedigung verlangen können. Dieses Recht steht den Gläubigern jedoch nur zu, wenn sie glaubhaft machen, dass durch die Verschmelzung die Erfüllung ihrer Forderung gefährdet wird."
    },
    {
      "date": "2025-05-16",
      "id": "109292",
      "original_text": "Löschungsankündigung\nBayern Amtsgericht München HRB 171296\nAladin Spa GmbH – München",
      "type": "Löschungsankündigung",
      "state": "Bayern",
      "amtsgericht": "Amtsgericht München",
      "registernummer": "HRB 171296",
      "registerart": "HRB",
      "company_name": "Aladin Spa GmbH",
      "company_seat": "München",
      "details": "16.05.2025 (Bekanntmachungsdatum)\n\nBayern Amtsgericht München HRB 171296\nLöschungsankündigung\n\nAladin Spa GmbH\nGesellschaft mit beschränkter Haftung\nMünchen\n\nDas Registergericht beabsichtigt, die im Handelsregister eingetragene Gesellschaft wegen Vermögenslosigkeit von Amts wegen nach § 394 FamFG zu löschen. Die Frist zur Erhebung eines Widerspruchs ist auf drei Monate festgesetzt."
    },
    {
      "date": "2025-05-16",
      "id": "109293",
      "original_text": "Löschungsankündigung\nBayern Amtsgericht München HRB 225989\nSusanne Mittermeier GmbH – München",
      "type": "Löschungsankündigung",
      "state": "Bayern",
      "amtsgericht": "Amtsgericht München",
      "registernummer": "HRB 225989",
      "registerart": "HRB",
      "company_name": "Susanne Mittermeier GmbH",
      "company_seat": "München",
      "details": "16.05.2025 (Bekanntmachungsdatum)\n\nBayern Amtsgericht München HRB 225989\nLöschungsankündigung\n\nSusanne Mittermeier GmbH\nGesellschaft mit beschränkter Haftung\nMünchen\n\nDas Registergericht beabsichtigt, die im Handelsregister eingetragene Gesellschaft wegen Vermögenslosigkeit von Amts wegen nach § 394 FamFG zu löschen. Die Frist zur Erhebung eines Widerspruchs ist auf drei Monate festgesetzt."
    },
    {
      "date": "2025-05-16",
      "id": "109294",
      "original_text": "Einreichung neuer Dokumente\nBayern Amtsgericht Ingolstadt HRB 172614\nLOWA Sportschuhe GmbH – Jetzendorf",
      "type": "Einreichung neuer Dokumente",
      "state": "Bayern",
      "amtsgericht": "Amtsgericht Ingolstadt",
      "registernummer": "HRB 172614",
      "registerart": "HRB",
      "company_name": "LOWA Sportschuhe GmbH",
      "company_seat": "Jetzendorf",
      "details": "16.05.2025 (Bekanntmachungsdatum)\n\nBayern Amtsgericht Ingolstadt HRB 172614\nEinreichung neuer Dokumente\n\nLOWA Sportschuhe GmbH\nGesellschaft mit beschränkter Haftung\nJetzendorf\n\nDem Amtsgericht Ingolstadt -Registergericht- ist eine Liste der Mitglieder des Aufsichtsrats eingereicht worden, § 52 Abs. 3 S. 2 GmbHG."
    },
    {
      "date": "2025-05-16",
      "id": "109295",
      "original_text": "Registerbekanntmachung nach dem Umwandlungsgesetz\nBayern Amtsgericht Traunstein HRB 2107\nPeklo GmbH Uhren-Schmuck Fachgeschäft – Kolbermoor",
      "type": "Registerbekanntmachung nach dem Umwandlungsgesetz",
      "state": "Bayern",
      "amtsgericht": "Amtsgericht Traunstein",
      "registernummer": "HRB 2107",
      "registerart": "HRB",
      "company_name": "Peklo GmbH Uhren-Schmuck Fachgeschäft",
      "company_seat": "Kolbermoor",
      "details": "16.05.2025 (Bekanntmachungsdatum)\n\nBayern Amtsgericht Traunstein HRB 2107\nRegisterbekanntmachung nach dem Umwandlungsgesetz 15.05.2025 (Eintragungsdatum)\n\nPeklo GmbH Uhren-Schmuck Fachgeschäft\nGesellschaft mit beschränkter Haftung\nKolbermoor\n\nDen Gläubigern der an der Verschmelzung beteiligten Rechtsträger ist, wenn sie binnen sechs Monaten nach dem Tag, an dem die Eintragung der Verschmelzung in das Register des Sitzes desjenigen Rechtsträgers, dessen Gläubiger sie sind, nach § 19 Abs. 3 UmwG als bekannt gemacht gilt, ihren Anspruch nach Grund und Höhe in Textform anmelden, Sicherheit zu leisten, soweit sie nicht Befriedigung verlangen können. Dieses Recht steht den Gläubigern jedoch nur zu, wenn sie glaubhaft machen, dass durch die Verschmelzung die Erfüllung ihrer Forderung gefährdet wird."
    },
    {
      "date": "2025-05-16",
      "id": "109296",
      "original_text": "Löschungsankündigung\nBayern Amtsgericht München HRB 240595\nGlobus Autovermittlung UG (haftungsbeschränkt) – München",
      "type": "Löschungsankündigung",
      "state": "Bayern",
      "amtsgericht": "Amtsgericht München",
      "registernummer": "HRB 240595",
      "registerart": "HRB",
      "company_name": "Globus Autovermittlung UG (haftungsbeschränkt)",
      "company_seat": "München",
      "details": "16.05.2025 (Bekanntmachungsdatum)\n\nBayern Amtsgericht München HRB 240595\nLöschungsankündigung\n\nGlobus Autovermittlung UG (haftungsbeschränkt)\nGesellschaft mit beschränkter Haftung\nMünchen\n\nDas Registergericht beabsichtigt, die im Handelsregister eingetragene Gesellschaft wegen Vermögenslosigkeit von Amts wegen nach § 394 FamFG zu löschen. Die Frist zur Erhebung eines Widerspruchs ist auf drei Monate festgesetzt."
    },
    {
      "date": "2025-05-16",
      "id": "109297",
      "original_text": "Registerbekanntmachung nach dem Umwandlungsgesetz\nBayern Amtsgericht Ingolstadt HRB 12178\nLightworks Manufaktur GmbH – Ingolstadt",
      "type": "Registerbekanntmachung nach dem Umwandlungsgesetz",
      "state": "Bayern",
      "amtsgericht": "Amtsgericht Ingolstadt",
      "registernummer": "HRB 12178",
      "registerart": "HRB",
      "company_name": "Lightworks Manufaktur GmbH",
      "company_seat": "Ingolstadt",
      "details": "16.05.2025 (Bekanntmachungsdatum)\n\nBayern Amtsgericht Ingolstadt HRB 12178\nRegisterbekanntmachung nach dem Umwandlungsgesetz 15.05.2025 (Eintragungsdatum)\n\nLightworks Manufaktur GmbH\nGesellschaft mit beschränkter Haftung\nIngolstadt\n\nDen Gläubigern der an der Verschmelzung beteiligten Rechtsträger ist, wenn sie binnen sechs Monaten nach dem Tag, an dem die Eintragung der Verschmelzung in das Register des Sitzes desjenigen Rechtsträgers, dessen Gläubiger sie sind, nach § 19 Abs. 3 UmwG als bekannt gemacht gilt, ihren Anspruch nach Grund und Höhe in Textform anmelden, Sicherheit zu leisten, soweit sie nicht Befriedigung verlangen können. Dieses Recht steht den Gläubigern jedoch nur zu, wenn sie glaubhaft machen, dass durch die Verschmelzung die Erfüllung ihrer Forderung gefährdet wird."
    },
    {
      "date": "2025-05-16",
      "id": "109298",
      "original_text": "Registerbekanntmachung nach dem Umwandlungsgesetz\nBayern Amtsgericht Bamberg HRB 10763\nKVW Königsberg GmbH – Königsberg i.Bay.",
      "type": "Registerbekanntmachung nach dem Umwandlungsgesetz",
      "state": "Bayern",
      "amtsgericht": "Amtsgericht Bamberg",
      "registernummer": "HRB 10763",
      "registerart": "HRB",
      "company_name": "KVW Königsberg GmbH",
      "company_seat": "Königsberg i.Bay.",
      "details": "16.05.2025 (Bekanntmachungsdatum)\n\nBayern Amtsgericht Bamberg HRB 10763\nRegisterbekanntmachung nach dem Umwandlungsgesetz 15.05.2025 (Eintragungsdatum)\n\nKVW Königsberg GmbH\nGesellschaft mit beschränkter Haftung\nKönigsberg i.Bay.\n\nDen Gläubigern der an der Verschmelzung beteiligten Rechtsträger ist, wenn sie binnen sechs Monaten nach dem Tag, an dem die Eintragung der Verschmelzung in das Register des Sitzes desjenigen Rechtsträgers, dessen Gläubiger sie sind, nach § 19 Abs. 3 UmwG als bekannt gemacht gilt, ihren Anspruch nach Grund und Höhe in Textform anmelden, Sicherheit zu leisten, soweit sie nicht Befriedigung verlangen können. Dieses Recht steht den Gläubigern jedoch nur zu, wenn sie glaubhaft machen, dass durch die Verschmelzung die Erfüllung ihrer Forderung gefährdet wird."
    },
    {
      "date": "2025-05-16",
      "id": "109299",
      "original_text": "Registerbekanntmachung nach dem Umwandlungsgesetz\nBaden-Württemberg Amtsgericht Stuttgart HRB 794220\ntrunte.it GmbH – Haiterbach",
      "type": "Registerbekanntmachung nach dem Umwandlungsgesetz",
      "state": "Baden-Württemberg",
      "amtsgericht": "Amtsgericht Stuttgart",
      "registernummer": "HRB 794220",
      "registerart": "HRB",
      "company_name": "trunte.it GmbH",
      "company_seat": "Haiterbach",
      "details": "16.05.2025 (Bekanntmachungsdatum)\n\nBaden-Württemberg Amtsgericht Stuttgart HRB 794220\nRegisterbekanntmachung nach dem Umwandlungsgesetz 16.05.2025 (Eintragungsdatum)\n\ntrunte.it GmbH\nGesellschaft mit beschränkter Haftung\nHaiterbach\n\nAls nicht eingetragen wird bekanntgemacht:\nDen Gläubigern der an der Ausgliederung beteiligten Rechtsträger ist, wenn sie binnen sechs Monaten nach dem Tag, an dem die Eintragung der Ausgliederung in das Register des Sitzes desjenigen Rechtsträgers, dessen Gläubiger sie sind, nach § 19 Abs. 3 UmwG als bekanntgemacht gilt, ihren Anspruch nach Grund und Höhe schriftlich anmelden, Sicherheit zu leisten, soweit sie nicht Befriedigung verlangen können. Dieses Recht steht den Gläubigern jedoch nur zu, wenn sie glaubhaft machen, dass durch die Ausgliederung die Erfüllung ihrer Forderung gefährdet wird."
    },
    {
      "date": "2025-05-16",
      "id": "109300",
      "original_text": "Löschungsankündigung\nBerlin Amtsgericht Berlin (Charlottenburg) HRB 250070\nClever Garage GmbH – Berlin",
      "type": "Löschungsankündigung",
      "state": "Berlin",
      "amtsgericht": "Amtsgericht Berlin (Charlottenburg)",
      "registernummer": "HRB 250070",
      "registerart": "HRB",
      "company_name": "Clever Garage GmbH",
      "company_seat": "Berlin",
      "details": "16.05.2025 (Bekanntmachungsdatum)\n\nBerlin Amtsgericht Berlin (Charlottenburg) HRB 250070\nLöschungsankündigung\n\nClever Garage GmbH\nGesellschaft mit beschränkter Haftung\nBerlin\n\nBei der nachstehenden Gesellschaft wird das Amtslöschungsverfahren gemäß § 394 FamFG eingeleitet. Widerspruchsfrist 6 Wochen"
    },
    {
      "date": "2025-05-16",
      "id": "109301",
      "original_text": "Sonstige Registerbekanntmachung\nBaden-Württemberg Amtsgericht Ulm HRB 721339\nGARDENA GmbH – Ulm",
      "type": "Sonstige Registerbekanntmachung",
      "state": "Baden-Württemberg",
      "amtsgericht": "Amtsgericht Ulm",
      "registernummer": "HRB 721339",
      "registerart": "HRB",
      "company_name": "GARDENA GmbH",
      "company_seat": "Ulm",
      "details": "16.05.2025 (Bekanntmachungsdatum)\n\nBaden-Württemberg Amtsgericht Ulm HRB 721339\nSonstige Registerbekanntmachung 16.05.2025 (Eintragungsdatum)\n\nGARDENA GmbH\nGesellschaft mit beschränkter Haftung\nUlm\n\nDie Gesellschaft hat am 08.05.2025 die Liste über die Zusammensetzung des Aufsichtsrats zum Handelsregister eingereicht."
    },
    {
      "date": "2025-05-16",
      "id": "109302",
      "original_text": "Löschungsankündigung\nBaden-Württemberg Amtsgericht Mannheim HRB 714829\nplanelektra GmbH – Bad Schönborn",
      "type": "Löschungsankündigung",
      "state": "Baden-Württemberg",
      "amtsgericht": "Amtsgericht Mannheim",
      "registernummer": "HRB 714829",
      "registerart": "HRB",
      "company_name": "planelektra GmbH",
      "company_seat": "Bad Schönborn",
      "details": "16.05.2025 (Bekanntmachungsdatum)\n\nBaden-Württemberg Amtsgericht Mannheim HRB 714829\nLöschungsankündigung\n\nplanelektra GmbH\nGesellschaft mit beschränkter Haftung\nBad Schönborn\n\nDas Gericht beabsichtigt, die Gesellschaft wegen Vermögenslosigkeit im Handelsregister von Amts wegen nach § 394 FamFG zu löschen. Die Frist zur Geltendmachung eines Widerspruchs gegen die beabsichtigte Löschung ist auf einen Monat ab Veröffentlichung bestimmt."
    },
    {
      "date": "2025-05-16",
      "id": "109303",
      "original_text": "Registerbekanntmachung nach dem Umwandlungsgesetz\nBerlin Amtsgericht Berlin (Charlottenburg) HRB 132748\nPRISOD Wohnbegleitungs GmbH – Berlin",
      "type": "Registerbekanntmachung nach dem Umwandlungsgesetz",
      "state": "Berlin",
      "amtsgericht": "Amtsgericht Berlin (Charlottenburg)",
      "registernummer": "HRB 132748",
      "registerart": "HRB",
      "company_name": "PRISOD Wohnbegleitungs GmbH",
      "company_seat": "Berlin",
      "details": "16.05.2025 (Bekanntmachungsdatum)\n\nBerlin Amtsgericht Berlin (Charlottenburg) HRB 132748\nRegisterbekanntmachung nach dem Umwandlungsgesetz 15.05.2025 (Eintragungsdatum)\n\nPRISOD Wohnbegleitungs GmbH\nGesellschaft mit beschränkter Haftung\nBerlin\n\nZu Eintragungsnummer 6 vom 15.05.2025 wird als nicht eingetragen veröffentlicht: Den Gläubigern der an der Verschmelzung beteiligten Rechtsträger ist, wenn sie binnen sechs Monaten nach dem Tag, an dem die Eintragung der Verschmelzung in das Register des Sitzes desjenigen Rechtsträgers, dessen Gläubiger sie sind, als bekannt gemacht gilt, ihren Anspruch nach Grund und Höhe schriftlich anmelden, Sicherheit zu leisten, soweit sie nicht Befriedigung verlangen können. Dieses Recht steht den Gläubigern jedoch nur zu, wenn sie glaubhaft machen, dass durch die Verschmelzung die Erfüllung ihrer Forderung gefährdet wird. Das Recht, Sicherheitsleistung zu verlangen, steht Gläubigern nicht zu, die im Falle der Insolvenz ein Recht auf vorzugsweise Befriedigung aus einer Deckungsmasse haben, die nach gesetzlicher Vorschrift zu ihrem Schutz errichtet und staatlich überwacht ist."
    },
    {
      "date": "2025-05-16",
      "id": "109304",
      "original_text": "Registerbekanntmachung nach dem Umwandlungsgesetz\nBaden-Württemberg Amtsgericht Freiburg HRB 621294\nAllTerra Deutschland West GmbH – Grafenhausen",
      "type": "Registerbekanntmachung nach dem Umwandlungsgesetz",
      "state": "Baden-Württemberg",
      "amtsgericht": "Amtsgericht Freiburg",
      "registernummer": "HRB 621294",
      "registerart": "HRB",
      "company_name": "AllTerra Deutschland West GmbH",
      "company_seat": "Grafenhausen",
      "details": "16.05.2025 (Bekanntmachungsdatum)\n\nBaden-Württemberg Amtsgericht Freiburg HRB 621294\nRegisterbekanntmachung nach dem Umwandlungsgesetz 16.05.2025 (Eintragungsdatum)\n\nAllTerra Deutschland West GmbH\nGesellschaft mit beschränkter Haftung\nGrafenhausen\n\nAls nicht eingetragen wird bekanntgemacht:\nDen Gläubigern der an der Verschmelzung beteiligten Rechtsträger ist, wenn sie binnen sechs Monaten nach dem Tag, an dem die Eintragung der Verschmelzung in das Register des Sitzes desjenigen Rechtsträgers, dessen Gläubiger sie sind, nach § 19 Abs. 3 UmwG als bekanntgemacht gilt, ihren Anspruch nach Grund und Höhe schriftlich anmelden, Sicherheit zu leisten, soweit sie nicht Befriedigung verlangen können. Dieses Recht steht den Gläubigern jedoch nur zu, wenn sie glaubhaft machen, dass durch die Verschmelzung die Erfüllung ihrer Forderung gefährdet wird."
    },
    {
      "date": "2025-05-16",
      "id": "109305",
      "original_text": "Löschungsankündigung\nBaden-Württemberg Amtsgericht Mannheim HRB 8074\nAEV Fahrzeugausstattung GmbH – Mannheim",
      "type": "Löschungsankündigung",
      "state": "Baden-Württemberg",
      "amtsgericht": "Amtsgericht Mannheim",
      "registernummer": "HRB 8074",
      "registerart": "HRB",
      "company_name": "AEV Fahrzeugausstattung GmbH",
      "company_seat": "Mannheim",
      "details": "16.05.2025 (Bekanntmachungsdatum)\n\nBaden-Württemberg Amtsgericht Mannheim HRB 8074\nLöschungsankündigung\n\nAEV Fahrzeugausstattung GmbH\nGesellschaft mit beschränkter Haftung\nMannheim\n\nDas Gericht beabsichtigt, die Gesellschaft wegen Vermögenslosigkeit im Handelsregister von Amts wegen nach § 394 FamFG zu löschen. Die Frist zur Geltendmachung eines Widerspruchs gegen die beabsichtigte Löschung ist auf einen Monat ab Veröffentlichung bestimmt."
    },
    {
      "date": "2025-05-16",
      "id": "109306",
      "original_text": "Registerbekanntmachung nach dem Umwandlungsgesetz\nBerlin Amtsgericht Berlin (Charlottenburg) HRB 117130\nPRISOD Wohnheimbetriebs GmbH – Berlin",
      "type": "Registerbekanntmachung nach dem Umwandlungsgesetz",
      "state": "Berlin",
      "amtsgericht": "Amtsgericht Berlin (Charlottenburg)",
      "registernummer": "HRB 117130",
      "registerart": "HRB",
      "company_name": "PRISOD Wohnheimbetriebs GmbH",
      "company_seat": "Berlin",
      "details": "16.05.2025 (Bekanntmachungsdatum)\n\nBerlin Amtsgericht Berlin (Charlottenburg) HRB 117130\nRegisterbekanntmachung nach dem Umwandlungsgesetz 15.05.2025 (Eintragungsdatum)\n\nPRISOD Wohnheimbetriebs GmbH\nGesellschaft mit beschränkter Haftung\nBerlin\n\nZu Eintragungsnummer 14 vom 15.05.2025 wird als nicht eingetragen veröffentlicht: Den Gläubigern der an der Verschmelzung beteiligten Rechtsträger ist, wenn sie binnen sechs Monaten nach dem Tag, an dem die Eintragung der Verschmelzung in das Register des Sitzes desjenigen Rechtsträgers, dessen Gläubiger sie sind, als bekannt gemacht gilt, ihren Anspruch nach Grund und Höhe schriftlich anmelden, Sicherheit zu leisten, soweit sie nicht Befriedigung verlangen können. Dieses Recht steht den Gläubigern jedoch nur zu, wenn sie glaubhaft machen, dass durch die Verschmelzung die Erfüllung ihrer Forderung gefährdet wird. Das Recht, Sicherheitsleistung zu verlangen, steht Gläubigern nicht zu, die im Falle der Insolvenz ein Recht auf vorzugsweise Befriedigung aus einer Deckungsmasse haben, die nach gesetzlicher Vorschrift zu ihrem Schutz errichtet und staatlich überwacht ist."
    },
    {
      "date": "2025-05-16",
      "id": "109307",
      "original_text": "Registerbekanntmachung nach dem Umwandlungsgesetz\nBaden-Württemberg Amtsgericht Ulm HRA 1519\nELIQUO KGN GmbH & Co. KG – Nellingen",
      "type": "Registerbekanntmachung nach dem Umwandlungsgesetz",
      "state": "Baden-Württemberg",
      "amtsgericht": "Amtsgericht Ulm",
      "registernummer": "HRA 1519",
      "registerart": "HRA",
      "company_name": "ELIQUO KGN GmbH & Co. KG",
      "company_seat": "Nellingen",
      "details": "16.05.2025 (Bekanntmachungsdatum)\n\nBaden-Württemberg Amtsgericht Ulm HRA 1519\nRegisterbekanntmachung nach dem Umwandlungsgesetz 16.05.2025 (Eintragungsdatum)\n\nELIQUO KGN GmbH & Co. KG\nKommanditgesellschaft\nNellingen\n\nAls nicht eingetragen wird bekanntgemacht:\nDen Gläubigern der an der Verschmelzung beteiligten Rechtsträger ist, wenn sie binnen sechs Monaten nach dem Tag, an dem die Eintragung der Verschmelzung in das Register des Sitzes desjenigen Rechtsträgers, dessen Gläubiger sie sind, nach § 19 Abs. 3 UmwG als bekanntgemacht gilt, ihren Anspruch nach Grund und Höhe schriftlich anmelden, Sicherheit zu leisten, soweit sie nicht Befriedigung verlangen können. Dieses Recht steht den Gläubigern jedoch nur zu, wenn sie glaubhaft machen, dass durch die Verschmelzung die Erfüllung ihrer Forderung gefährdet wird."
    },
    {
      "date": "2025-05-16",
      "id": "109308",
      "original_text": "Löschungsankündigung\nBerlin Amtsgericht Berlin (Charlottenburg) HRB 241045\nCL Krankenpflege GmbH – Berlin",
      "type": "Löschungsankündigung",
      "state": "Berlin",
      "amtsgericht": "Amtsgericht Berlin (Charlottenburg)",
      "registernummer": "HRB 241045",
      "registerart": "HRB",
      "company_name": "CL Krankenpflege GmbH",
      "company_seat": "Berlin",
      "details": "16.05.2025 (Bekanntmachungsdatum)\n\nBerlin Amtsgericht Berlin (Charlottenburg) HRB 241045\nLöschungsankündigung\n\nCL Krankenpflege GmbH\nGesellschaft mit beschränkter Haftung\nBerlin\n\nBei der nachstehenden Gesellschaft wird das Amtslöschungsverfahren gemäß § 394 FamFG eingeleitet. Widerspruchsfrist 6 Wochen"
    },
    {
      "date": "2025-05-16",
      "id": "109309",
      "original_text": "Registerbekanntmachung nach dem Umwandlungsgesetz\nHamburg Amtsgericht Hamburg HRB 10451\nUniCredit Leasing Finance GmbH – Hamburg",
      "type": "Registerbekanntmachung nach dem Umwandlungsgesetz",
      "state": "Hamburg",
      "amtsgericht": "Amtsgericht Hamburg",
      "registernummer": "HRB 10451",
      "registerart": "HRB",
      "company_name": "UniCredit Leasing Finance GmbH",
      "company_seat": "Hamburg",
      "details": "16.05.2025 (Bekanntmachungsdatum)\n\nHamburg Amtsgericht Hamburg HRB 10451\nRegisterbekanntmachung nach dem Umwandlungsgesetz 16.05.2025 (Eintragungsdatum)\n\nUniCredit Leasing Finance GmbH\nGesellschaft mit beschränkter Haftung\nHamburg\n\nAls nicht eingetragen wird bekannt gemacht:\nDen Gläubigern der an der Verschmelzung beteiligten Gesellschaften ist, wenn sie binnen sechs Monaten nach dem Tag, an dem die Eintragung der Verschmelzung in das Register des Sitzes desjenigen Rechtsträgers, dessen Gläubiger sie sind, nach § 19 Absatz 3 UmwG als bekannt gemacht gilt, ihren Anspruch nach Grund und Höhe schriftlich anmelden, Sicherheit zu leisten, soweit sie nicht Befriedigung verlangen können. Dieses Recht steht den Gläubigern jedoch nur zu, wenn sie glaubhaft machen, dass durch die Verschmelzung die Erfüllung ihrer Forderung gefährdet wird."
    },
    {
      "date": "2025-05-16",
      "id": "109310",
      "original_text": "Registerbekanntmachung nach dem Umwandlungsgesetz\nBaden-Württemberg Amtsgericht Freiburg HRA 709004\nMein Sonnenschirm e. K. Inhaber Jens Martin – Breisach am Rhein",
      "type": "Registerbekanntmachung nach dem Umwandlungsgesetz",
      "state": "Baden-Württemberg",
      "amtsgericht": "Amtsgericht Freiburg",
      "registernummer": "HRA 709004",
      "registerart": "HRA",
      "company_name": "Mein Sonnenschirm e. K. Inhaber Jens Martin",
      "company_seat": "Breisach am Rhein",
      "details": "16.05.2025 (Bekanntmachungsdatum)\n\nBaden-Württemberg Amtsgericht Freiburg HRA 709004\nRegisterbekanntmachung nach dem Umwandlungsgesetz 16.05.2025 (Eintragungsdatum)\n\nMein Sonnenschirm e. K. Inhaber Jens Martin\nEinzelkaufmann / Einzelkauffrau\nBreisach am Rhein\n\nDen Gläubigern der an der Ausgliederung beteiligten Rechtsträger ist, wenn sie binnen sechs Monaten nach dem Tag, an dem die Eintragung der Ausgliederung in das Register des Sitzes desjenigen Rechtsträgers, dessen Gläubiger sie sind, nach § 19 Abs. 3 UmwG als bekanntgemacht gilt, ihren Anspruch nach Grund und Höhe schriftlich anmelden, Sicherheit zu leisten, soweit sie nicht Befriedigung verlangen können. Dieses Recht steht den Gläubigern jedoch nur zu, wenn sie glaubhaft machen, dass durch die Ausgliederung die Erfüllung ihrer Forderung gefährdet wird."
    },
    {
      "date": "2025-05-16",
      "id": "109311",
      "original_text": "Registerbekanntmachung nach dem Umwandlungsgesetz\nBerlin Amtsgericht Berlin (Charlottenburg) HRB 191155\nDomicil Seniorenheim GmbH – Berlin",
      "type": "Registerbekanntmachung nach dem Umwandlungsgesetz",
      "state": "Berlin",
      "amtsgericht": "Amtsgericht Berlin (Charlottenburg)",
      "registernummer": "HRB 191155",
      "registerart": "HRB",
      "company_name": "Domicil Seniorenheim GmbH",
      "company_seat": "Berlin",
      "details": "16.05.2025 (Bekanntmachungsdatum)\n\nBerlin Amtsgericht Berlin (Charlottenburg) HRB 191155\nRegisterbekanntmachung nach dem Umwandlungsgesetz 15.05.2025 (Eintragungsdatum)\n\nDomicil Seniorenheim GmbH\nGesellschaft mit beschränkter Haftung\nBerlin\n\nZu Eintragungsnummer 14 vom 15.05.2025 wird als nicht eingetragen veröffentlicht:Den Gläubigern der an der Verschmelzung beteiligten Rechtsträger ist, wenn sie binnen sechs Monaten nach dem Tag, an dem die Eintragung der Verschmelzung in das Register des Sitzes desjenigen Rechtsträgers, dessen Gläubiger sie sind, als bekannt gemacht gilt, ihren Anspruch nach Grund und Höhe schriftlich anmelden, Sicherheit zu leisten, soweit sie nicht Befriedigung verlangen können. Dieses Recht steht den Gläubigern jedoch nur zu, wenn sie glaubhaft machen, dass durch die Verschmelzung die Erfüllung ihrer Forderung gefährdet wird. Das Recht, Sicherheitsleistung zu verlangen, steht Gläubigern nicht zu, die im Falle der Insolvenz ein Recht auf vorzugsweise Befriedigung aus einer Deckungsmasse haben, die nach gesetzlicher Vorschrift zu ihrem Schutz errichtet und staatlich überwacht ist."
    },
    {
      "date": "2025-05-16",
      "id": "109312",
      "original_text": "Löschungsankündigung\nSachsen-Anhalt Amtsgericht Stendal HRB 2536\nHotel Wittekind Restaurationsgesellschaft mbH – Burg",
      "type": "Löschungsankündigung",
      "state": "Sachsen-Anhalt",
      "amtsgericht": "Amtsgericht Stendal",
      "registernummer": "HRB 2536",
      "registerart": "HRB",
      "company_name": "Hotel Wittekind Restaurationsgesellschaft mbH",
      "company_seat": "Burg",
      "details": "16.05.2025 (Bekanntmachungsdatum)\n\nSachsen-Anhalt Amtsgericht Stendal HRB 2536\nLöschungsankündigung\n\nHotel Wittekind Restaurationsgesellschaft mbH\nGesellschaft mit beschränkter Haftung\nBurg\n\nDas Registergericht beabsichtigt, nachfolgende Gesellschaften wegen Vermögenslosigkeit von Amts wegen nach § 394 FamFG zu löschen. Die Frist zur Erhebung eines Widerspruchs gegen die beabsichtigte Löschung wird auf drei Monate festgesetzt."
    },
    {
      "date": "2025-05-16",
      "id": "109313",
      "original_text": "Einreichung neuer Dokumente\nBaden-Württemberg Amtsgericht Stuttgart HRB 760946\nBF.capital GmbH – Stuttgart",
      "type": "Einreichung neuer Dokumente",
      "state": "Baden-Württemberg",
      "amtsgericht": "Amtsgericht Stuttgart",
      "registernummer": "HRB 760946",
      "registerart": "HRB",
      "company_name": "BF.capital GmbH",
      "company_seat": "Stuttgart",
      "details": "16.05.2025 (Bekanntmachungsdatum)\n\nBaden-Württemberg Amtsgericht Stuttgart HRB 760946\nEinreichung neuer Dokumente\n\nBF.capital GmbH\nGesellschaft mit beschränkter Haftung\nStuttgart\n\nDie Gesellschaft hat am 15.05.2025 die Liste über die Zusammensetzung des Aufsichtsrats zum Handelsregister eingereicht."
    },
    {
      "date": "2025-05-16",
      "id": "109314",
      "original_text": "Registerbekanntmachung nach dem Umwandlungsgesetz\nHamburg Amtsgericht Hamburg HRB 192355\nM.K.S. Holding Verwaltungs GmbH – Hamburg",
      "type": "Registerbekanntmachung nach dem Umwandlungsgesetz",
      "state": "Hamburg",
      "amtsgericht": "Amtsgericht Hamburg",
      "registernummer": "HRB 192355",
      "registerart": "HRB",
      "company_name": "M.K.S. Holding Verwaltungs GmbH",
      "company_seat": "Hamburg",
      "details": "16.05.2025 (Bekanntmachungsdatum)\n\nHamburg Amtsgericht Hamburg HRB 192355\nRegisterbekanntmachung nach dem Umwandlungsgesetz 08.05.2025 (Eintragungsdatum)\n\nM.K.S. Holding Verwaltungs GmbH\nGesellschaft mit beschränkter Haftung\nHamburg\n\nAls nicht eingetragen wird bekannt gemacht:\nDen Gläubigern der an der formwechselnden Umwandlung beteiligten Gesellschaften ist, wenn sie binnen sechs Monaten nach dem Tag, an dem die Eintragung der formwechselnden Umwandlung in das Register des Sitzes desjenigen Rechtsträgers, dessen Gläubiger sie sind, nach § 19 Absatz 3 UmwG als bekannt gemacht gilt, ihren Anspruch nach Grund und Höhe schriftlich anmelden, Sicherheit zu leisten, soweit sie nicht Befriedigung verlangen können. Dieses Recht steht den Gläubigern jedoch nur zu, wenn sie glaubhaft machen, dass durch die formwechselnde Umwandlung die Erfüllung ihrer Forderung gefährdet wird."
    },
    {
      "date": "2025-05-16",
      "id": "109315",
      "original_text": "Löschungsankündigung\nSachsen-Anhalt Amtsgericht Stendal HRB 10496\nGfB Gesellschaft für Bau und Investitionen mit beschränkter Haftung – Holzweißig",
      "type": "Löschungsankündigung",
      "state": "Sachsen-Anhalt",
      "amtsgericht": "Amtsgericht Stendal",
      "registernummer": "HRB 10496",
      "registerart": "HRB",
      "company_name": "GfB Gesellschaft für Bau und Investitionen mit beschränkter Haftung",
      "company_seat": "Holzweißig",
      "details": "16.05.2025 (Bekanntmachungsdatum)\n\nSachsen-Anhalt Amtsgericht Stendal HRB 10496\nLöschungsankündigung\n\nGfB Gesellschaft für Bau und Investitionen mit beschränkter Haftung\nGesellschaft mit beschränkter Haftung\nHolzweißig\n\nDas Registergericht beabsichtigt, nachfolgende Gesellschaften wegen Vermögenslosigkeit von Amts wegen nach § 394 FamFG zu löschen. Die Frist zur Erhebung eines Widerspruchs gegen die beabsichtigte Löschung wird auf drei Monate festgesetzt."
    },
    {
      "date": "2025-05-16",
      "id": "109316",
      "original_text": "Registerbekanntmachung nach dem Umwandlungsgesetz\nBaden-Württemberg Amtsgericht Freiburg HRB 732774\nA & O Martin GmbH – Breisach am Rhein",
      "type": "Registerbekanntmachung nach dem Umwandlungsgesetz",
      "state": "Baden-Württemberg",
      "amtsgericht": "Amtsgericht Freiburg",
      "registernummer": "HRB 732774",
      "registerart": "HRB",
      "company_name": "A & O Martin GmbH",
      "company_seat": "Breisach am Rhein",
      "details": "16.05.2025 (Bekanntmachungsdatum)\n\nBaden-Württemberg Amtsgericht Freiburg HRB 732774\nRegisterbekanntmachung nach dem Umwandlungsgesetz 16.05.2025 (Eintragungsdatum)\n\nA & O Martin GmbH\nGesellschaft mit beschränkter Haftung\nBreisach am Rhein\n\nDen Gläubigern der an der Ausgliederung beteiligten Rechtsträger ist, wenn sie binnen sechs Monaten nach dem Tag, an dem die Eintragung der Ausgliederung in das Register des Sitzes desjenigen Rechtsträgers, dessen Gläubiger sie sind, nach §§ 125, 19 Abs. 3 UmwG als bekanntgemacht gilt, ihren Anspruch nach Grund und Höhe schriftlich anmelden, Sicherheit zu leisten, soweit sie nicht Befriedigung verlangen können. Dieses Recht steht den Gläubigern jedoch nur zu, wenn sie glaubhaft machen, dass durch die Ausgliederung die Erfüllung ihrer Forderung gefährdet wird."
    },
    {
      "date": "2025-05-16",
      "id": "109317",
      "original_text": "Registerbekanntmachung nach dem Umwandlungsgesetz\nBaden-Württemberg Amtsgericht Mannheim HRB 754528\nMixing Station GmbH – Sinsheim",
      "type": "Registerbekanntmachung nach dem Umwandlungsgesetz",
      "state": "Baden-Württemberg",
      "amtsgericht": "Amtsgericht Mannheim",
      "registernummer": "HRB 754528",
      "registerart": "HRB",
      "company_name": "Mixing Station GmbH",
      "company_seat": "Sinsheim",
      "details": "16.05.2025 (Bekanntmachungsdatum)\n\nBaden-Württemberg Amtsgericht Mannheim HRB 754528\nRegisterbekanntmachung nach dem Umwandlungsgesetz 16.05.2025 (Eintragungsdatum)\n\nMixing Station GmbH\nGesellschaft mit beschränkter Haftung\nSinsheim\n\nDen Gläubigern der an der Ausgliederung beteiligten Rechtsträger ist, wenn sie binnen sechs Monaten nach dem Tag, an dem die Eintragung der Ausgliederung in das Register des Sitzes desjenigen Rechtsträgers, dessen Gläubiger sie sind, nach § 19 Abs. 3 UmwG als bekanntgemacht gilt, ihren Anspruch nach Grund und Höhe schriftlich anmelden, Sicherheit zu leisten, soweit sie nicht Befriedigung verlangen können. Dieses Recht steht den Gläubigern jedoch nur zu, wenn sie glaubhaft machen, dass durch die Ausgliederung die Erfüllung ihrer Forderung gefährdet wird."
    },
    {
      "date": "2025-05-16",
      "id": "109318",
      "original_text": "Registerbekanntmachung nach dem Umwandlungsgesetz\nBaden-Württemberg Amtsgericht Mannheim HRA 712244\nMixing Station e.K. – Sinsheim",
      "type": "Registerbekanntmachung nach dem Umwandlungsgesetz",
      "state": "Baden-Württemberg",
      "amtsgericht": "Amtsgericht Mannheim",
      "registernummer": "HRA 712244",
      "registerart": "HRA",
      "company_name": "Mixing Station e.K.",
      "company_seat": "Sinsheim",
      "details": "16.05.2025 (Bekanntmachungsdatum)\n\nBaden-Württemberg Amtsgericht Mannheim HRA 712244\nRegisterbekanntmachung nach dem Umwandlungsgesetz 16.05.2025 (Eintragungsdatum)\n\nMixing Station e.K.\nEinzelkaufmann / Einzelkauffrau\nSinsheim\n\nDen Gläubigern der an der grenzüberschreitenden Ausgliederung beteiligten übernehmenden Rechtsträger ist, wenn sie binnen sechs Monaten nach dem Tag, an dem die Eintragung der Spaltung in das Register des Sitzes desjenigen Rechtsträgers, dessen Gläubiger sie sind, nach § 19 Absatz 3 UmwG als bekanntgemacht gilt, ihren Anspruch nach Grund und Höhe schriftlich anmelden, Sicherheit zu leisten, soweit sie nicht Befriedigung verlangen können.\nDieses Recht steht den Gläubigern jedoch nur zu, wenn sie glaubhaft machen, dass durch die Spaltung die Erfüllung ihrer Forderung gefährdet wird."
    },
    {
      "date": "2025-05-16",
      "id": "109319",
      "original_text": "Löschungsankündigung\nSchleswig-Holstein Amtsgericht Flensburg HRB 9362\nDruckzentrum Flensburg GmbH – Flensburg",
      "type": "Löschungsankündigung",
      "state": "Schleswig-Holstein",
      "amtsgericht": "Amtsgericht Flensburg",
      "registernummer": "HRB 9362",
      "registerart": "HRB",
      "company_name": "Druckzentrum Flensburg GmbH",
      "company_seat": "Flensburg",
      "details": "16.05.2025 (Bekanntmachungsdatum)\n\nSchleswig-Holstein Amtsgericht Flensburg HRB 9362\nLöschungsankündigung\n\nDruckzentrum Flensburg GmbH\nGesellschaft mit beschränkter Haftung\nFlensburg\n\nEs ist die Löschung der nachstehenden Gesellschaft wegen Vermögenslosigkeit gemäß § 394 FamFG beabsichtigt.\nWiderspruchsfrist: 2 Monate."
    },
    {
      "date": "2025-05-16",
      "id": "109320",
      "original_text": "Registerbekanntmachung nach dem Umwandlungsgesetz\nBerlin Amtsgericht Berlin (Charlottenburg) HRA 31089\nSeeger Gesundheitshaus GmbH & Co. KG – Berlin",
      "type": "Registerbekanntmachung nach dem Umwandlungsgesetz",
      "state": "Berlin",
      "amtsgericht": "Amtsgericht Berlin (Charlottenburg)",
      "registernummer": "HRA 31089",
      "registerart": "HRA",
      "company_name": "Seeger Gesundheitshaus GmbH & Co. KG",
      "company_seat": "Berlin",
      "details": "16.05.2025 (Bekanntmachungsdatum)\n\nBerlin Amtsgericht Berlin (Charlottenburg) HRA 31089\nRegisterbekanntmachung nach dem Umwandlungsgesetz 14.05.2025 (Eintragungsdatum)\n\nSeeger Gesundheitshaus GmbH & Co. KG\nKommanditgesellschaft\nBerlin\n\nZu Eintragungsnummer 22 vom 14.05.2025 wird als nicht eingetragen veröffentlicht:\nDen Gläubigern der an der Verschmelzung beteiligten Rechtsträger ist, wenn sie binnen sechs Monaten nach dem Tag, an dem die Eintragung der Verschmelzung in das Register des Sitzes desjenigen Rechtsträgers, dessen Gläubiger sie sind, als bekannt gemacht gilt, ihren Anspruch nach Grund und Höhe schriftlich anmelden, Sicherheit zu leisten, soweit sie nicht Befriedigung verlangen können. Dieses Recht steht den Gläubigern jedoch nur zu, wenn sie glaubhaft machen, dass durch die Verschmelzung die Erfüllung ihrer Forderung gefährdet wird. Das Recht, Sicherheitsleistung zu verlangen, steht Gläubigern nicht zu, die im Falle der Insolvenz ein Recht auf vorzugsweise Befriedigung aus einer Deckungsmasse haben, die nach gesetzlicher Vorschrift zu ihrem Schutz errichtet und staatlich überwacht ist."
    },
    {
      "date": "2025-05-16",
      "id": "109321",
      "original_text": "Registerbekanntmachung nach dem Umwandlungsgesetz\nBaden-Württemberg Amtsgericht Mannheim HRB 752910\nAlientech Germany GmbH – Karlsruhe",
      "type": "Registerbekanntmachung nach dem Umwandlungsgesetz",
      "state": "Baden-Württemberg",
      "amtsgericht": "Amtsgericht Mannheim",
      "registernummer": "HRB 752910",
      "registerart": "HRB",
      "company_name": "Alientech Germany GmbH",
      "company_seat": "Karlsruhe",
      "details": "16.05.2025 (Bekanntmachungsdatum)\n\nBaden-Württemberg Amtsgericht Mannheim HRB 752910\nRegisterbekanntmachung nach dem Umwandlungsgesetz 16.05.2025 (Eintragungsdatum)\n\nAlientech Germany GmbH\nGesellschaft mit beschränkter Haftung\nKarlsruhe\n\nAls nicht eingetragen wird bekanntgemacht:\nDen Gläubigern der an der Ausgliederung beteiligten Rechtsträger ist, wenn sie binnen sechs Monaten nach dem Tag, an dem die Eintragung der Ausgliederung in das Register des Sitzes desjenigen Rechtsträgers, dessen Gläubiger sie sind, nach § 19 Abs. 3 UmwG als bekanntgemacht gilt, ihren Anspruch nach Grund und Höhe schriftlich anmelden, Sicherheit zu leisten, soweit sie nicht Befriedigung verlangen können. Dieses Recht steht den Gläubigern jedoch nur zu, wenn sie glaubhaft machen, dass durch die Ausgliederung die Erfüllung ihrer Forderung gefährdet wird."
    },
    {
      "date": "2025-05-16",
      "id": "109322",
      "original_text": "Registerbekanntmachung nach dem Umwandlungsgesetz\nHamburg Amtsgericht Hamburg HRB 63663\nAccenture Song Build Germany GmbH – Hamburg",
      "type": "Registerbekanntmachung nach dem Umwandlungsgesetz",
      "state": "Hamburg",
      "amtsgericht": "Amtsgericht Hamburg",
      "registernummer": "HRB 63663",
      "registerart": "HRB",
      "company_name": "Accenture Song Build Germany GmbH",
      "company_seat": "Hamburg",
      "details": "16.05.2025 (Bekanntmachungsdatum)\n\nHamburg Amtsgericht Hamburg HRB 63663\nRegisterbekanntmachung nach dem Umwandlungsgesetz 16.05.2025 (Eintragungsdatum)\n\nAccenture Song Build Germany GmbH\nGesellschaft mit beschränkter Haftung\nHamburg\n\nAls nicht eingetragen wird bekannt gemacht:\nDen Gläubigern der an der Verschmelzung beteiligten Gesellschaften ist, wenn sie binnen sechs Monaten nach dem Tag, an dem die Eintragung der Verschmelzung in das Register des Sitzes desjenigen Rechtsträgers, dessen Gläubiger sie sind, nach § 19 Absatz 3 UmwG als bekannt gemacht gilt, ihren Anspruch nach Grund und Höhe schriftlich anmelden, Sicherheit zu leisten, soweit sie nicht Befriedigung verlangen können. Dieses Recht steht den Gläubigern jedoch nur zu, wenn sie glaubhaft machen, dass durch die Verschmelzung die Erfüllung ihrer Forderung gefährdet wird."
    },
    {
      "date": "2025-05-16",
      "id": "109323",
      "original_text": "Registerbekanntmachung nach dem Umwandlungsgesetz\nBerlin Amtsgericht Berlin (Charlottenburg) HRA 41605\nGBI Wohnungsbau GmbH & Co. KG – Berlin",
      "type": "Registerbekanntmachung nach dem Umwandlungsgesetz",
      "state": "Berlin",
      "amtsgericht": "Amtsgericht Berlin (Charlottenburg)",
      "registernummer": "HRA 41605",
      "registerart": "HRA",
      "company_name": "GBI Wohnungsbau GmbH & Co. KG",
      "company_seat": "Berlin",
      "details": "16.05.2025 (Bekanntmachungsdatum)\n\nBerlin Amtsgericht Berlin (Charlottenburg) HRA 41605\nRegisterbekanntmachung nach dem Umwandlungsgesetz 15.05.2025 (Eintragungsdatum)\n\nGBI Wohnungsbau GmbH & Co. KG\nKommanditgesellschaft\nBerlin\n\nZu Eintragungsnummer 17 vom 15.05.2025 wird als nicht eingetragen veröffentlicht:Den Gläubigern der an der Verschmelzung beteiligten Rechtsträger ist, wenn sie binnen sechs Monaten nach dem Tag, an dem die Eintragung der Verschmelzung in das Register des Sitzes desjenigen Rechtsträgers, dessen Gläubiger sie sind, als bekannt gemacht gilt, ihren Anspruch nach Grund und Höhe schriftlich anmelden, Sicherheit zu leisten, soweit sie nicht Befriedigung verlangen können. Dieses Recht steht den Gläubigern jedoch nur zu, wenn sie glaubhaft machen, dass durch die Verschmelzung die Erfüllung ihrer Forderung gefährdet wird. Das Recht, Sicherheitsleistung zu verlangen, steht Gläubigern nicht zu, die im Falle der Insolvenz ein Recht auf vorzugsweise Befriedigung aus einer Deckungsmasse haben, die nach gesetzlicher Vorschrift zu ihrem Schutz errichtet und staatlich überwacht ist."
    },
    {
      "date": "2025-05-16",
      "id": "109324",
      "original_text": "Registerbekanntmachung nach dem Umwandlungsgesetz\nBerlin Amtsgericht Berlin (Charlottenburg) HRA 41605\nGBI Wohnungsbau GmbH & Co. KG – Berlin",
      "type": "Registerbekanntmachung nach dem Umwandlungsgesetz",
      "state": "Berlin",
      "amtsgericht": "Amtsgericht Berlin (Charlottenburg)",
      "registernummer": "HRA 41605",
      "registerart": "HRA",
      "company_name": "GBI Wohnungsbau GmbH & Co. KG",
      "company_seat": "Berlin",
      "details": "16.05.2025 (Bekanntmachungsdatum)\n\nBerlin Amtsgericht Berlin (Charlottenburg) HRA 41605\nRegisterbekanntmachung nach dem Umwandlungsgesetz 15.05.2025 (Eintragungsdatum)\n\nGBI Wohnungsbau GmbH & Co. KG\nKommanditgesellschaft\nBerlin\n\nZu Eintragungsnummer 18 vom 15.05.2025 wird als nicht eingetragen veröffentlicht:Den Gläubigern der an der Verschmelzung beteiligten Rechtsträger ist, wenn sie binnen sechs Monaten nach dem Tag, an dem die Eintragung der Verschmelzung in das Register des Sitzes desjenigen Rechtsträgers, dessen Gläubiger sie sind, als bekannt gemacht gilt, ihren Anspruch nach Grund und Höhe schriftlich anmelden, Sicherheit zu leisten, soweit sie nicht Befriedigung verlangen können. Dieses Recht steht den Gläubigern jedoch nur zu, wenn sie glaubhaft machen, dass durch die Verschmelzung die Erfüllung ihrer Forderung gefährdet wird. Das Recht, Sicherheitsleistung zu verlangen, steht Gläubigern nicht zu, die im Falle der Insolvenz ein Recht auf vorzugsweise Befriedigung aus einer Deckungsmasse haben, die nach gesetzlicher Vorschrift zu ihrem Schutz errichtet und staatlich überwacht ist."
    },
    {
      "date": "2025-05-16",
      "id": "109325",
      "original_text": "Sonstige Registerbekanntmachung\nBaden-Württemberg Amtsgericht Stuttgart HRB 481316\nStraub Druck + Medien Aktiengesellschaft – Schramberg",
      "type": "Sonstige Registerbekanntmachung",
      "state": "Baden-Württemberg",
      "amtsgericht": "Amtsgericht Stuttgart",
      "registernummer": "HRB 481316",
      "registerart": "HRB",
      "company_name": "Straub Druck + Medien Aktiengesellschaft",
      "company_seat": "Schramberg",
      "details": "16.05.2025 (Bekanntmachungsdatum)\n\nBaden-Württemberg Amtsgericht Stuttgart HRB 481316\nSonstige Registerbekanntmachung 16.05.2025 (Eintragungsdatum)\n\nStraub Druck + Medien Aktiengesellschaft\nAktiengesellschaft\nSchramberg\n\nAls nicht eingetragen wird bekanntgemacht:\nDen Gläubigern, deren Forderungen begründet worden sind, bevor die Eintragung des Beschlusses bekanntgemacht worden ist, ist, wenn sie sich binnen sechs Monaten nach der Bekanntmachung zu diesem Zweck melden, Sicherheit zu leisten, soweit sie nicht Befriedigung verlangen können."
    },
    {
      "date": "2025-05-16",
      "id": "109326",
      "original_text": "Löschungsankündigung\nSchleswig-Holstein Amtsgericht Flensburg HRB 15567\nFlensburger Wohngarten GmbH – Flensburg",
      "type": "Löschungsankündigung",
      "state": "Schleswig-Holstein",
      "amtsgericht": "Amtsgericht Flensburg",
      "registernummer": "HRB 15567",
      "registerart": "HRB",
      "company_name": "Flensburger Wohngarten GmbH",
      "company_seat": "Flensburg",
      "details": "16.05.2025 (Bekanntmachungsdatum)\n\nSchleswig-Holstein Amtsgericht Flensburg HRB 15567\nLöschungsankündigung\n\nFlensburger Wohngarten GmbH\nGesellschaft mit beschränkter Haftung\nFlensburg\n\nEs ist die Löschung der nachstehenden Gesellschaft wegen Vermögenslosigkeit gemäß § 394 FamFG beabsichtigt.\nWiderspruchsfrist: 2 Monate"
    },
    {
      "date": "2025-05-16",
      "id": "109327",
      "original_text": "Registerbekanntmachung nach dem Umwandlungsgesetz\nBaden-Württemberg Amtsgericht Mannheim HRA 711733\nAlientech Germany Holger Krautt e.K. – Rheinstetten",
      "type": "Registerbekanntmachung nach dem Umwandlungsgesetz",
      "state": "Baden-Württemberg",
      "amtsgericht": "Amtsgericht Mannheim",
      "registernummer": "HRA 711733",
      "registerart": "HRA",
      "company_name": "Alientech Germany Holger Krautt e.K.",
      "company_seat": "Rheinstetten",
      "details": "16.05.2025 (Bekanntmachungsdatum)\n\nBaden-Württemberg Amtsgericht Mannheim HRA 711733\nRegisterbekanntmachung nach dem Umwandlungsgesetz 16.05.2025 (Eintragungsdatum)\n\nAlientech Germany Holger Krautt e.K.\nEinzelkaufmann / Einzelkauffrau\nRheinstetten\n\nAls nicht eingetragen wird bekanntgemacht:\nDen Gläubigern der an der Ausgliederung beteiligten Rechtsträger ist, wenn sie binnen sechs Monaten nach dem Tag, an dem die Eintragung der Ausgliederung in das Register des Sitzes desjenigen Rechtsträgers, dessen Gläubiger sie sind, nach § 19 Abs. 3 UmwG als bekanntgemacht gilt, ihren Anspruch nach Grund und Höhe schriftlich anmelden, Sicherheit zu leisten, soweit sie nicht Befriedigung verlangen können. Dieses Recht steht den Gläubigern jedoch nur zu, wenn sie glaubhaft machen, dass durch die Ausgliederung die Erfüllung ihrer Forderung gefährdet wird."
    },
    {
      "date": "2025-05-16",
      "id": "109328",
      "original_text": "Löschungsankündigung\nBerlin Amtsgericht Berlin (Charlottenburg) HRB 213575\nANKA Kurier & Paketzustellungsdienst UG (haftungsbeschränkt) – Berlin",
      "type": "Löschungsankündigung",
      "state": "Berlin",
      "amtsgericht": "Amtsgericht Berlin (Charlottenburg)",
      "registernummer": "HRB 213575",
      "registerart": "HRB",
      "company_name": "ANKA Kurier & Paketzustellungsdienst UG (haftungsbeschränkt)",
      "company_seat": "Berlin",
      "details": "16.05.2025 (Bekanntmachungsdatum)\n\nBerlin Amtsgericht Berlin (Charlottenburg) HRB 213575\nLöschungsankündigung\n\nANKA Kurier & Paketzustellungsdienst UG (haftungsbeschränkt)\nGesellschaft mit beschränkter Haftung\nBerlin\n\nBei der nachstehenden Gesellschaft wird das Amtslöschungsverfahren gemäß § 394 FamFG eingeleitet. Widerspruchsfrist 6 Wochen"
    },
    {
      "date": "2025-05-16",
      "id": "109329",
      "original_text": "Löschungsankündigung\nBerlin Amtsgericht Berlin (Charlottenburg) HRB 117229\nCommandante Capital GmbH – Berlin",
      "type": "Löschungsankündigung",
      "state": "Berlin",
      "amtsgericht": "Amtsgericht Berlin (Charlottenburg)",
      "registernummer": "HRB 117229",
      "registerart": "HRB",
      "company_name": "Commandante Capital GmbH",
      "company_seat": "Berlin",
      "details": "16.05.2025 (Bekanntmachungsdatum)\n\nBerlin Amtsgericht Berlin (Charlottenburg) HRB 117229\nLöschungsankündigung\n\nCommandante Capital GmbH\nGesellschaft mit beschränkter Haftung\nBerlin\n\nBei der nachstehenden Gesellschaft wird das Amtslöschungsverfahren gemäß § 394 FamFG eingeleitet. Widerspruchsfrist 6 Wochen"
    },
    {
      "date": "2025-05-16",
      "id": "109330",
      "original_text": "Löschungsankündigung\nThüringen Amtsgericht Jena HRB 516501\nmystarthaus.de ug (haftungsbeschränkt) – Erfurt",
      "type": "Löschungsankündigung",
      "state": "Thüringen",
      "amtsgericht": "Amtsgericht Jena",
      "registernummer": "HRB 516501",
      "registerart": "HRB",
      "company_name": "mystarthaus.de ug (haftungsbeschränkt)",
      "company_seat": "Erfurt",
      "details": "16.05.2025 (Bekanntmachungsdatum)\n\nThüringen Amtsgericht Jena HRB 516501\nDie Registerbekanntmachung ist nachträglich am 20.05.2025 um 10:22 Uhr gelöscht worden.\nWegen der Einzelheiten und näherer Auskünfte wenden Sie sich bitte an das Amtsgericht Jena ."
    },
    {
      "date": "2025-05-16",
      "id": "109331",
      "original_text": "Löschungsankündigung\nThüringen Amtsgericht Jena HRB 511351\nSAVITO GmbH – Gotha",
      "type": "Löschungsankündigung",
      "state": "Thüringen",
      "amtsgericht": "Amtsgericht Jena",
      "registernummer": "HRB 511351",
      "registerart": "HRB",
      "company_name": "SAVITO GmbH",
      "company_seat": "Gotha",
      "details": "16.05.2025 (Bekanntmachungsdatum)\n\nThüringen Amtsgericht Jena HRB 511351\nLöschungsankündigung\n\nSAVITO GmbH\nGesellschaft mit beschränkter Haftung\nGotha\n\nDas Registergericht beabsichtigt, die im Handelsregister eingetragene Gesellschaft wegen Vermögenslosigkeit nach § 394 FamFG von Amts wegen zu löschen. Die Frist zur Erhebung eines Widerspruchs gegen die beabsichtigte Löschung wird auf 6 Wochen festgesetzt."
    },
    {
      "date": "2025-05-16",
      "id": "109332",
      "original_text": "Löschungsankündigung\nThüringen Amtsgericht Jena HRB 514496\nDachdeckerfachbetrieb Harald Hill UG (haftungsbeschränkt) – Saalfeld",
      "type": "Löschungsankündigung",
      "state": "Thüringen",
      "amtsgericht": "Amtsgericht Jena",
      "registernummer": "HRB 514496",
      "registerart": "HRB",
      "company_name": "Dachdeckerfachbetrieb Harald Hill UG (haftungsbeschränkt)",
      "company_seat": "Saalfeld",
      "details": "16.05.2025 (Bekanntmachungsdatum)\n\nThüringen Amtsgericht Jena HRB 514496\nLöschungsankündigung\n\nDachdeckerfachbetrieb Harald Hill UG (haftungsbeschränkt)\nGesellschaft mit beschränkter Haftung\nSaalfeld\n\nDas Registergericht beabsichtigt, die im Handelsregister eingetragene Gesellschaft wegen Vermögenslosigkeit nach § 394 FamFG von Amts wegen zu löschen. Die Frist zur Erhebung eines Widerspruchs gegen die beabsichtigte Löschung wird auf 6 Wochen festgesetzt."
    },
    {
      "date": "2025-05-16",
      "id": "109333",
      "original_text": "Einreichung neuer Dokumente\nSaarland Amtsgericht Saarbrücken HRB 107207\nSEK Saarland GmbH – Saarbrücken",
      "type": "Einreichung neuer Dokumente",
      "state": "Saarland",
      "amtsgericht": "Amtsgericht Saarbrücken",
      "registernummer": "HRB 107207",
      "registerart": "HRB",
      "company_name": "SEK Saarland GmbH",
      "company_seat": "Saarbrücken",
      "details": "16.05.2025 (Bekanntmachungsdatum)\n\nSaarland Amtsgericht Saarbrücken HRB 107207\nEinreichung neuer Dokumente\n\nSEK Saarland GmbH\nGesellschaft mit beschränkter Haftung\nSaarbrücken\n\nDie Geschäftsführung der Gesellschaft hat eine Liste der Mitglieder des Aufsichtsrats zum Handelsregister eingereicht (§ 52 Abs. 3 Satz 2 GmbHG)."
    },
    {
      "date": "2025-05-16",
      "id": "109334",
      "original_text": "Registerbekanntmachung nach dem Umwandlungsgesetz\nMecklenburg-Vorpommern Amtsgericht Rostock HRA 4942\nKWE Windpark Meyenburg Eins GmbH & Co. KG – Stäbelow",
      "type": "Registerbekanntmachung nach dem Umwandlungsgesetz",
      "state": "Mecklenburg-Vorpommern",
      "amtsgericht": "Amtsgericht Rostock",
      "registernummer": "HRA 4942",
      "registerart": "HRA",
      "company_name": "KWE Windpark Meyenburg Eins GmbH & Co. KG",
      "company_seat": "Stäbelow",
      "details": "16.05.2025 (Bekanntmachungsdatum)\n\nMecklenburg-Vorpommern Amtsgericht Rostock HRA 4942\nRegisterbekanntmachung nach dem Umwandlungsgesetz 16.05.2025 (Eintragungsdatum)\n\nKWE Windpark Meyenburg Eins GmbH & Co. KG\nKommanditgesellschaft\nStäbelow\n\nAls nicht eingetragen wird veröffentlicht: Den Gläubigern der an der Verschmelzung beteiligten Rechtsträger ist, wenn sie binnen sechs Monaten nach dem Tag, an dem die Eintragung der Verschmelzung in das Register des Sitzes desjenigen Rechtsträgers, dessen Gläubiger sie sind, nach § 19 Abs. 3 UmwG als bekannt gemacht gilt,\nihren Anspruch nach Grund und Höhe in Textform anmelden, Sicherheit zu leisten, soweit sie nicht Befriedigung verlangen können. Dieses Recht steht den Gläubigern jedoch nur zu, wenn sie glaubhaft machen, dass durch die Verschmelzung die Erfüllung der Forderung gefährdet wird."
    },
    {
      "date": "2025-05-16",
      "id": "109335",
      "original_text": "Registerbekanntmachung nach dem Umwandlungsgesetz\nMecklenburg-Vorpommern Amtsgericht Rostock HRA 4946\nKWE Windpark Meyenburg Drei GmbH & Co. KG. – Stäbelow",
      "type": "Registerbekanntmachung nach dem Umwandlungsgesetz",
      "state": "Mecklenburg-Vorpommern",
      "amtsgericht": "Amtsgericht Rostock",
      "registernummer": "HRA 4946",
      "registerart": "HRA",
      "company_name": "KWE Windpark Meyenburg Drei GmbH & Co. KG.",
      "company_seat": "Stäbelow",
      "details": "16.05.2025 (Bekanntmachungsdatum)\n\nMecklenburg-Vorpommern Amtsgericht Rostock HRA 4946\nRegisterbekanntmachung nach dem Umwandlungsgesetz 16.05.2025 (Eintragungsdatum)\n\nKWE Windpark Meyenburg Drei GmbH & Co. KG.\nKommanditgesellschaft\nStäbelow\n\nAls nicht eingetragen wird veröffentlicht: Den Gläubigern der an der Verschmelzung beteiligten Rechtsträger ist, wenn sie binnen sechs Monaten nach dem Tag, an dem die Eintragung der Verschmelzung in das Register des Sitzes desjenigen Rechtsträgers, dessen Gläubiger sie sind, nach § 19 Abs. 3 UmwG als bekannt gemacht gilt,\nihren Anspruch nach Grund und Höhe in Textform anmelden, Sicherheit zu leisten, soweit sie nicht Befriedigung verlangen können. Dieses Recht steht den Gläubigern jedoch nur zu, wenn sie glaubhaft machen, dass durch die Verschmelzung die Erfüllung der Forderung gefährdet wird."
    },
    {
      "date": "2025-05-16",
      "id": "109336",
      "original_text": "Löschungsankündigung\nBerlin Amtsgericht Berlin (Charlottenburg) HRB 150904\nKartonkönig GmbH – Berlin",
      "type": "Löschungsankündigung",
      "state": "Berlin",
      "amtsgericht": "Amtsgericht Berlin (Charlottenburg)",
      "registernummer": "HRB 150904",
      "registerart": "HRB",
      "company_name": "Kartonkönig GmbH",
      "company_seat": "Berlin",
      "details": "16.05.2025 (Bekanntmachungsdatum)\n\nBerlin Amtsgericht Berlin (Charlottenburg) HRB 150904\nLöschungsankündigung\n\nKartonkönig GmbH\nGesellschaft mit beschränkter Haftung\nBerlin\n\nBei der nachstehenden Gesellschaft wird das Amtslöschungsverfahren gemäß § 394 FamFG eingeleitet. Widerspruchsfrist 6 Wochen"
    },
    {
      "date": "2025-05-16",
      "id": "109337",
      "original_text": "Einreichung neuer Dokumente\nBrandenburg Amtsgericht Neuruppin HRB 2246\nWohnungsverwaltungs GmbH Brüssow – Prenzlau",
      "type": "Einreichung neuer Dokumente",
      "state": "Brandenburg",
      "amtsgericht": "Amtsgericht Neuruppin",
      "registernummer": "HRB 2246",
      "registerart": "HRB",
      "company_name": "Wohnungsverwaltungs GmbH Brüssow",
      "company_seat": "Prenzlau",
      "details": "16.05.2025 (Bekanntmachungsdatum)\n\nBrandenburg Amtsgericht Neuruppin HRB 2246\nEinreichung neuer Dokumente\n\nWohnungsverwaltungs GmbH Brüssow\nGesellschaft mit beschränkter Haftung\nPrenzlau\n\nAls nicht eingetragen wird veröffentlicht: Eine Liste der Mitglieder des Aufsichtsrates wurde zum Handelsregister eingereicht."
    },
    {
      "date": "2025-05-16",
      "id": "109338",
      "original_text": "Registerbekanntmachung nach dem Umwandlungsgesetz\nBaden-Württemberg Amtsgericht Stuttgart HRB 15417\nSchwarz & Partner GmbH – Stuttgart",
      "type": "Registerbekanntmachung nach dem Umwandlungsgesetz",
      "state": "Baden-Württemberg",
      "amtsgericht": "Amtsgericht Stuttgart",
      "registernummer": "HRB 15417",
      "registerart": "HRB",
      "company_name": "Schwarz & Partner GmbH",
      "company_seat": "Stuttgart",
      "details": "16.05.2025 (Bekanntmachungsdatum)\n\nBaden-Württemberg Amtsgericht Stuttgart HRB 15417\nRegisterbekanntmachung nach dem Umwandlungsgesetz 16.05.2025 (Eintragungsdatum)\n\nSchwarz & Partner GmbH\nGesellschaft mit beschränkter Haftung\nStuttgart\n\nAls nicht eingetragen wird bekanntgemacht:\nDen Gläubigern der an der Verschmelzung beteiligten Rechtsträger ist, wenn sie binnen sechs Monaten nach dem Tag, an dem die Eintragung der Verschmelzung in das Register des Sitzes desjenigen Rechtsträgers, dessen Gläubiger sie sind, nach § 19 Abs. 3 UmwG als bekanntgemacht gilt, ihren Anspruch nach Grund und Höhe schriftlich anmelden, Sicherheit zu leisten, soweit sie nicht Befriedigung verlangen können. Dieses Recht steht den Gläubigern jedoch nur zu, wenn sie glaubhaft machen, dass durch die Verschmelzung die Erfüllung ihrer Forderung gefährdet wird."
    },
    {
      "date": "2025-05-16",
      "id": "109339",
      "original_text": "Löschungsankündigung\nBaden-Württemberg Amtsgericht Stuttgart HRB 742683\nAktiv Construct GmbH – Ludwigsburg",
      "type": "Löschungsankündigung",
      "state": "Baden-Württemberg",
      "amtsgericht": "Amtsgericht Stuttgart",
      "registernummer": "HRB 742683",
      "registerart": "HRB",
      "company_name": "Aktiv Construct GmbH",
      "company_seat": "Ludwigsburg",
      "details": "16.05.2025 (Bekanntmachungsdatum)\n\nBaden-Württemberg Amtsgericht Stuttgart HRB 742683\nLöschungsankündigung\n\nAktiv Construct GmbH\nGesellschaft mit beschränkter Haftung\nLudwigsburg\n\nAls nicht eingetragen wird bekanntgemacht:\nDas Gericht beabsichtigt, die Gesellschaft wegen Vermögenslosigkeit im Handelsregister von Amts wegen nach § 394 FamFG zu löschen. Die Frist zur Geltendmachung eines Widerspruchs gegen die beabsichtigte Löschung ist auf zwei Monate ab Veröffentlichung bestimmt."
    },
    {
      "date": "2025-05-16",
      "id": "109340",
      "original_text": "Einreichung neuer Dokumente\nBerlin Amtsgericht Berlin (Charlottenburg) HRB 182023\nScope SE & Co. KGaA – Berlin",
      "type": "Einreichung neuer Dokumente",
      "state": "Berlin",
      "amtsgericht": "Amtsgericht Berlin (Charlottenburg)",
      "registernummer": "HRB 182023",
      "registerart": "HRB",
      "company_name": "Scope SE & Co. KGaA",
      "company_seat": "Berlin",
      "details": "16.05.2025 (Bekanntmachungsdatum)\n\nBerlin Amtsgericht Berlin (Charlottenburg) HRB 182023\nEinreichung neuer Dokumente\n\nScope SE & Co. KGaA\nKommanditgesellschaft auf Aktien\nBerlin\n\nAls nicht eingetragen wird veröffentlicht: Es wurde eine neue Liste der Aufsichtsratsmitglieder eingereicht (§ 106 AktG)."
    },
    {
      "date": "2025-05-16",
      "id": "109341",
      "original_text": "Löschungsankündigung\nSaarland Amtsgericht Saarbrücken HRB 108584\nDP Stahlhandel GmbH – Dillingen",
      "type": "Löschungsankündigung",
      "state": "Saarland",
      "amtsgericht": "Amtsgericht Saarbrücken",
      "registernummer": "HRB 108584",
      "registerart": "HRB",
      "company_name": "DP Stahlhandel GmbH",
      "company_seat": "Dillingen",
      "details": "16.05.2025 (Bekanntmachungsdatum)\n\nSaarland Amtsgericht Saarbrücken HRB 108584\nLöschungsankündigung\n\nDP Stahlhandel GmbH\nGesellschaft mit beschränkter Haftung\nDillingen\n\nEs ist beabsichtigt, die Gesellschaft von Amts wegen gemäß § 394 FamFG wegen Vermögenslosigkeit zu löschen.\nGegen die Löschung von Amts wegen ist das Rechtsmittel des Widerspruchs statthaft. Der Widerspruch ist binnen einer Frist zwei Monaten beginnend mit dem Tag dieser Veröffentlichung durch Einreichen eines Widerspruchsschreibens -schriftlich oder zur Niederschrift der Geschäftsstelle beim Amtsgericht Saarbrücken, -zentrales Handelsregister-, Mainzerstr.178, 66121 Saarbrücken einzulegen.\nDer Widerspruch muss die Bezeichnung der angefochtenen Löschungsankündigung enthalten sowie die Erklärung, dass Widerspruch eingelegt wird. Er ist vom Widerspruchsführer oder seinem Bevollmächtigten zu unterzeichnen.\nDas Widerspruchsschreiben kann auch in der Form eines elektronischen Dokumentes eingereicht werden, das mit einer qualifizierten elektronischen Signatur nach dem Signaturgesetz versehen sein muss (§§ 14 Abs. 2 FamFG, 130a, 298 ZPO)."
    },
    {
      "date": "2025-05-16",
      "id": "109342",
      "original_text": "Einreichung neuer Dokumente\nHamburg Amtsgericht Hamburg HRB 10497\nhvv Hamburger Verkehrsverbund Gesellschaft mbH – Hamburg",
      "type": "Einreichung neuer Dokumente",
      "state": "Hamburg",
      "amtsgericht": "Amtsgericht Hamburg",
      "registernummer": "HRB 10497",
      "registerart": "HRB",
      "company_name": "hvv Hamburger Verkehrsverbund Gesellschaft mbH",
      "company_seat": "Hamburg",
      "details": "16.05.2025 (Bekanntmachungsdatum)\n\nHamburg Amtsgericht Hamburg HRB 10497\nEinreichung neuer Dokumente\n\nhvv Hamburger Verkehrsverbund Gesellschaft mbH\nGesellschaft mit beschränkter Haftung\nHamburg\n\nAls nicht eingetragen wird bekannt gemacht: Liste des Aufsichtsrats wurde eingereicht."
    },
    {
      "date": "2025-05-16",
      "id": "109343",
      "original_text": "Registerbekanntmachung nach dem Umwandlungsgesetz\nSchleswig-Holstein Amtsgericht Kiel HRA 4989\nRichter BioLogics GmbH & Co. KG – Bovenau",
      "type": "Registerbekanntmachung nach dem Umwandlungsgesetz",
      "state": "Schleswig-Holstein",
      "amtsgericht": "Amtsgericht Kiel",
      "registernummer": "HRA 4989",
      "registerart": "HRA",
      "company_name": "Richter BioLogics GmbH & Co. KG",
      "company_seat": "Bovenau",
      "details": "16.05.2025 (Bekanntmachungsdatum)\n\nSchleswig-Holstein Amtsgericht Kiel HRA 4989\nRegisterbekanntmachung nach dem Umwandlungsgesetz 16.05.2025 (Eintragungsdatum)\n\nRichter BioLogics GmbH & Co. KG\nKommanditgesellschaft\nBovenau\n\nZu Eintragungsnummer 8 vom 16.05.2025 wird als nicht eingetragen veröffentlicht: Den Gläubigern ist, wenn sie binnen sechs Monaten nach dem Tag, an dem die Eintragung der Umwandlung bekannt gemacht worden ist, ihren Anspruch nach Grund und Höhe schriftlich anmelden, Sicherheit zu leisten, soweit sie nicht Befriedigung verlangen können. Dieses Recht steht den Gläubigern jedoch nur zu, wenn sie glaubhaft machen, dass durch die Umwandlung die Erfüllung ihrer Forderung gefährdet wird."
    },
    {
      "date": "2025-05-16",
      "id": "109344",
      "original_text": "Registerbekanntmachung nach dem Umwandlungsgesetz\nBaden-Württemberg Amtsgericht Stuttgart HRB 760772\nDrees & Sommer SE – Stuttgart",
      "type": "Registerbekanntmachung nach dem Umwandlungsgesetz",
      "state": "Baden-Württemberg",
      "amtsgericht": "Amtsgericht Stuttgart",
      "registernummer": "HRB 760772",
      "registerart": "HRB",
      "company_name": "Drees & Sommer SE",
      "company_seat": "Stuttgart",
      "details": "16.05.2025 (Bekanntmachungsdatum)\n\nBaden-Württemberg Amtsgericht Stuttgart HRB 760772\nRegisterbekanntmachung nach dem Umwandlungsgesetz 16.05.2025 (Eintragungsdatum)\n\nDrees & Sommer SE\nEuropäische Aktiengesellschaft (SE)\nStuttgart\n\nAls nicht eingetragen wird bekanntgemacht:\nDen Gläubigern der an der Verschmelzung beteiligten Rechtsträger ist, wenn sie binnen sechs Monaten nach dem Tag, an dem die Eintragung der Verschmelzung in das Register des Sitzes desjenigen Rechtsträgers, dessen Gläubiger sie sind, nach § 19 Abs. 3 UmwG als bekanntgemacht gilt, ihren Anspruch nach Grund und Höhe schriftlich anmelden, Sicherheit zu leisten, soweit sie nicht Befriedigung verlangen können. Dieses Recht steht den Gläubigern jedoch nur zu, wenn sie glaubhaft machen, dass durch die Verschmelzung die Erfüllung ihrer Forderung gefährdet wird."
    },
    {
      "date": "2025-05-16",
      "id": "109345",
      "original_text": "Registerbekanntmachung nach dem Umwandlungsgesetz\nBrandenburg Amtsgericht Cottbus HRB 16631\nRare Applications GmbH – Cottbus",
      "type": "Registerbekanntmachung nach dem Umwandlungsgesetz",
      "state": "Brandenburg",
      "amtsgericht": "Amtsgericht Cottbus",
      "registernummer": "HRB 16631",
      "registerart": "HRB",
      "company_name": "Rare Applications GmbH",
      "company_seat": "Cottbus",
      "details": "16.05.2025 (Bekanntmachungsdatum)\n\nBrandenburg Amtsgericht Cottbus HRB 16631\nRegisterbekanntmachung nach dem Umwandlungsgesetz 16.05.2025 (Eintragungsdatum)\n\nRare Applications GmbH\nGesellschaft mit beschränkter Haftung\nCottbus\n\nZu Eintragungsnummer 2 vom 16.05.2025 wird als nicht eingetragen veröffentlicht:\nDen Gläubigern der an der Verschmelzung beteiligten Rechtsträger ist, wenn sie binnen sechs Monaten nach dem Tag, an dem die Eintragung der Verschmelzung in das Register des Sitzes desjenigen Rechtsträgers, dessen Gläubiger sie sind, als bekannt gemacht gilt, ihren Anspruch nach Grund und Höhe schriftlich anmelden, Sicherheit zu leisten, soweit sie nicht Befriedigung verlangen können. Dieses Recht steht den Gläubigern jedoch nur zu, wenn sie glaubhaft machen, dass durch die Verschmelzung die Erfüllung ihrer Forderung gefährdet wird"
    },
    {
      "date": "2025-05-16",
      "id": "109346",
      "original_text": "Löschungsankündigung\nNiedersachsen Amtsgericht Göttingen HRA 130562 früher Amtsgericht Northeim\nKarl Bötticher Inhaberin Daniela Nicolai e.K. – Osterode",
      "type": "Löschungsankündigung",
      "state": "Niedersachsen",
      "amtsgericht": "Amtsgericht Göttingen",
      "registernummer": "HRA 130562",
      "registerart": "HRA",
      "company_name": "Karl Bötticher Inhaberin Daniela Nicolai e.K.",
      "company_seat": "Osterode",
      "former_amtsgericht": "Northeim",
      "details": "16.05.2025 (Bekanntmachungsdatum)\n\nNiedersachsen Amtsgericht Göttingen HRA 130562 früher Amtsgericht Northeim\nLöschungsankündigung\n\nKarl Bötticher Inhaberin Daniela Nicolai e.K.\nEinzelkaufmann / Einzelkauffrau\nOsterode\n\nDas Registergericht beabsichtigt, die Firma von Amts wegen nach § 31 Abs. 2 Satz 2 HGB, § 393 FamFG zu löschen. Die Frist zur Erhebung eines Widerspruchs ist auf 1 Monat ab dieser Registerbekanntmachung festgesetzt."
    },
    {
      "date": "2025-05-16",
      "id": "109347",
      "original_text": "Löschungsankündigung\nNiedersachsen Amtsgericht Osnabrück HRB 214648\nMinG UG (haftungsbeschränkt) – Glandorf",
      "type": "Löschungsankündigung",
      "state": "Niedersachsen",
      "amtsgericht": "Amtsgericht Osnabrück",
      "registernummer": "HRB 214648",
      "registerart": "HRB",
      "company_name": "MinG UG (haftungsbeschränkt)",
      "company_seat": "Glandorf",
      "details": "16.05.2025 (Bekanntmachungsdatum)\n\nNiedersachsen Amtsgericht Osnabrück HRB 214648\nLöschungsankündigung\n\nMinG UG (haftungsbeschränkt)\nGesellschaft mit beschränkter Haftung\nGlandorf\n\nDas Registergericht beabsichtigt, die Gesellschaft von Amts wegen nach § 394 FamFG wegen Vermögenslosigkeit zu löschen. Die Frist zur Erhebung eines Widerspruchs ist auf 1 Monat ab dieser Registerbekanntmachung festgesetzt."
    },
    {
      "date": "2025-05-16",
      "id": "109348",
      "original_text": "Löschungsankündigung\nNiedersachsen Amtsgericht Braunschweig HRB 203853\nTaxi Landmann UG (haftungsbeschränkt) – Braunschweig",
      "type": "Löschungsankündigung",
      "state": "Niedersachsen",
      "amtsgericht": "Amtsgericht Braunschweig",
      "registernummer": "HRB 203853",
      "registerart": "HRB",
      "company_name": "Taxi Landmann UG (haftungsbeschränkt)",
      "company_seat": "Braunschweig",
      "details": "16.05.2025 (Bekanntmachungsdatum)\n\nNiedersachsen Amtsgericht Braunschweig HRB 203853\nLöschungsankündigung\n\nTaxi Landmann UG (haftungsbeschränkt)\nGesellschaft mit beschränkter Haftung\nBraunschweig\n\nDas Registergericht beabsichtigt, die Gesellschaft von Amts wegen nach § 394 FamFG zu löschen. Die Frist zur Erhebung eines Widerspruchs ist auf 1 Monat ab dieser Registerbekanntmachung festgesetzt."
    },
    {
      "date": "2025-05-16",
      "id": "109349",
      "original_text": "Registerbekanntmachung nach dem Umwandlungsgesetz\nNiedersachsen Amtsgericht Oldenburg (Oldenburg) HRB 4597\nBZN Oldenburg GmbH – Oldenburg",
      "type": "Registerbekanntmachung nach dem Umwandlungsgesetz",
      "state": "Niedersachsen",
      "amtsgericht": "Amtsgericht Oldenburg (Oldenburg)",
      "registernummer": "HRB 4597",
      "registerart": "HRB",
      "company_name": "BZN Oldenburg GmbH",
      "company_seat": "Oldenburg",
      "details": "16.05.2025 (Bekanntmachungsdatum)\n\nNiedersachsen Amtsgericht Oldenburg (Oldenburg) HRB 4597\nRegisterbekanntmachung nach dem Umwandlungsgesetz\n\nBZN Oldenburg GmbH\nGesellschaft mit beschränkter Haftung\nOldenburg\n\nDen Gläubigern der an der Verschmelzung beteiligten Rechtsträger ist, wenn sie binnen sechs Monaten nach dem Tag, an dem die Eintragung der Verschmelzung in das Register des Sitzes desjenigen Rechtsträgers, dessen Gläubiger sie sind, nach § 19  Abs.  3 UmwG als bekannt gemacht gilt, ihren Anspruch nach Grund und Höhe schriftlich anmelden, Sicherheit zu leisten, soweit sie nicht Befriedigung verlangen können. Dieses Recht steht den Gläubigern jedoch nur zu, wenn sie glaubhaft machen, dass durch die Verschmelzung die Erfüllung der Forderung gefährdet wird."
    },
    {
      "date": "2025-05-16",
      "id": "109350",
      "original_text": "Einreichung neuer Dokumente\nNiedersachsen Amtsgericht Hildesheim HRB 201254\nConsulting Team Finanz- und Vermögenstreuhand Aktiengesellschaft – Hildesheim",
      "type": "Einreichung neuer Dokumente",
      "state": "Niedersachsen",
      "amtsgericht": "Amtsgericht Hildesheim",
      "registernummer": "HRB 201254",
      "registerart": "HRB",
      "company_name": "Consulting Team Finanz- und Vermögenstreuhand Aktiengesellschaft",
      "company_seat": "Hildesheim",
      "details": "16.05.2025 (Bekanntmachungsdatum)\n\nNiedersachsen Amtsgericht Hildesheim HRB 201254\nEinreichung neuer Dokumente\n\nConsulting Team Finanz- und Vermögenstreuhand Aktiengesellschaft\nAktiengesellschaft\nHildesheim\n\nDie Liste der Mitglieder des Aufsichtsrats wurde beim Registergericht eingereicht."
    },
    {
      "date": "2025-05-16",
      "id": "109351",
      "original_text": "Einreichung neuer Dokumente\nNiedersachsen Amtsgericht Oldenburg (Oldenburg) HRB 203872\nKruse + Sohn Maschinenbau und Anlagentechnik AG – Edewecht",
      "type": "Einreichung neuer Dokumente",
      "state": "Niedersachsen",
      "amtsgericht": "Amtsgericht Oldenburg (Oldenburg)",
      "registernummer": "HRB 203872",
      "registerart": "HRB",
      "company_name": "Kruse + Sohn Maschinenbau und Anlagentechnik AG",
      "company_seat": "Edewecht",
      "details": "16.05.2025 (Bekanntmachungsdatum)\n\nNiedersachsen Amtsgericht Oldenburg (Oldenburg) HRB 203872\nEinreichung neuer Dokumente\n\nKruse + Sohn Maschinenbau und Anlagentechnik AG\nAktiengesellschaft\nEdewecht\n\nDie Liste der Mitglieder des Aufsichtsrats wurde beim Registergericht eingereicht."
    },
    {
      "date": "2025-05-16",
      "id": "109352",
      "original_text": "Registerbekanntmachung nach dem Umwandlungsgesetz\nNordrhein-Westfalen Amtsgericht Köln GnR 629\nPax-Bank eG – Köln",
      "type": "Registerbekanntmachung nach dem Umwandlungsgesetz",
      "state": "Nordrhein-Westfalen",
      "amtsgericht": "Amtsgericht Köln",
      "registernummer": "GnR 629",
      "registerart": "GnR",
      "company_name": "Pax-Bank eG",
      "company_seat": "Köln",
      "details": "16.05.2025 (Bekanntmachungsdatum)\n\nNordrhein-Westfalen Amtsgericht Köln GnR 629\nRegisterbekanntmachung nach dem Umwandlungsgesetz 15.05.2025 (Eintragungsdatum)\n\nPax-Bank eG\neingetragene Genossenschaft\nKöln\n\nDen Gläubigern der an der Verschmelzung beteiligten Rechtsträger ist, wenn sie binnen sechs Monaten nach dem Tag, an dem die Eintragung der Verschmelzung in das Register des Sitzes desjenigen Rechtsträgers, dessen Gläubiger sie sind, nach § 19 Absatz 3 UmwG als bekanntgemacht gilt, ihren Anspruch nach Grund und Höhe schriftlich anmelden, Sicherheit zu leisten, soweit sie nicht Befriedigung verlangen können. Dieses Recht steht den Gläubigern jedoch nur zu, wenn sie glaubhaft machen, dass durch die Verschmelzung die Erfüllung ihrer Forderung gefährdet wird."
    },
    {
      "date": "2025-05-16",
      "id": "109353",
      "original_text": "Einreichung neuer Dokumente\nNordrhein-Westfalen Amtsgericht Essen HRB 22760\nthyssenkrupp Materials Services GmbH – Essen",
      "type": "Einreichung neuer Dokumente",
      "state": "Nordrhein-Westfalen",
      "amtsgericht": "Amtsgericht Essen",
      "registernummer": "HRB 22760",
      "registerart": "HRB",
      "company_name": "thyssenkrupp Materials Services GmbH",
      "company_seat": "Essen",
      "details": "16.05.2025 (Bekanntmachungsdatum)\n\nNordrhein-Westfalen Amtsgericht Essen HRB 22760\nEinreichung neuer Dokumente\n\nthyssenkrupp Materials Services GmbH\nGesellschaft mit beschränkter Haftung\nEssen\n\nDem Registergericht ist eine neue Liste der Mitglieder des Aufsichtsrates eingereicht worden."
    },
    {
      "date": "2025-05-16",
      "id": "109354",
      "original_text": "Registerbekanntmachung nach dem Umwandlungsgesetz\nNordrhein-Westfalen Amtsgericht Düsseldorf HRB 36903\nRefratechnik Steel GmbH – Düsseldorf",
      "type": "Registerbekanntmachung nach dem Umwandlungsgesetz",
      "state": "Nordrhein-Westfalen",
      "amtsgericht": "Amtsgericht Düsseldorf",
      "registernummer": "HRB 36903",
      "registerart": "HRB",
      "company_name": "Refratechnik Steel GmbH",
      "company_seat": "Düsseldorf",
      "details": "16.05.2025 (Bekanntmachungsdatum)\n\nNordrhein-Westfalen Amtsgericht Düsseldorf HRB 36903\nRegisterbekanntmachung nach dem Umwandlungsgesetz 16.05.2025 (Eintragungsdatum)\n\nRefratechnik Steel GmbH\nGesellschaft mit beschränkter Haftung\nDüsseldorf\n\nDen Gläubigern der an der Verschmelzung beteiligten Rechtsträger ist, wenn sie binnen sechs Monaten nach dem Tag, an dem die Eintragung der Verschmelzung in das Register des Sitzes desjenigen Rechtsträgers, dessen Gläubiger sie sind, nach § 19 Absatz 3 UmwG als bekanntgemacht gilt, ihren Anspruch nach Grund und Höhe schriftlich anmelden, Sicherheit zu leisten, soweit sie nicht Befriedigung verlangen können. Dieses Recht steht den Gläubigern jedoch nur zu, wenn sie glaubhaft machen, dass durch die Verschmelzung die Erfüllung ihrer Forderung gefährdet wird."
    },
    {
      "date": "2025-05-16",
      "id": "109355",
      "original_text": "Löschungsankündigung\nNordrhein-Westfalen Amtsgericht Hamm HRB 5021\nBad Heizung Eckel Scholz GmbH – Kamen",
      "type": "Löschungsankündigung",
      "state": "Nordrhein-Westfalen",
      "amtsgericht": "Amtsgericht Hamm",
      "registernummer": "HRB 5021",
      "registerart": "HRB",
      "company_name": "Bad Heizung Eckel Scholz GmbH",
      "company_seat": "Kamen",
      "details": "16.05.2025 (Bekanntmachungsdatum)\n\nNordrhein-Westfalen Amtsgericht Hamm HRB 5021\nLöschungsankündigung\n\nBad Heizung Eckel Scholz GmbH\nGesellschaft mit beschränkter Haftung\nKamen\n\nDas Registergericht beabsichtigt die Gesellschaft von Amts wegen nach § 394 FamFG zu löschen. Die Frist zur Erhebung eines Widerspruchs ist auf drei Monate festgesetzt."
    },
    {
      "date": "2025-05-16",
      "id": "109356",
      "original_text": "Löschungsankündigung\nNordrhein-Westfalen Amtsgericht Krefeld HRB 15866\nHolzmann Unternehmensberatungsgesellschaft UG (haftungsbeschränkt) – Krefeld",
      "type": "Löschungsankündigung",
      "state": "Nordrhein-Westfalen",
      "amtsgericht": "Amtsgericht Krefeld",
      "registernummer": "HRB 15866",
      "registerart": "HRB",
      "company_name": "Holzmann Unternehmensberatungsgesellschaft UG (haftungsbeschränkt)",
      "company_seat": "Krefeld",
      "details": "16.05.2025 (Bekanntmachungsdatum)\n\nNordrhein-Westfalen Amtsgericht Krefeld HRB 15866\nLöschungsankündigung\n\nHolzmann Unternehmensberatungsgesellschaft UG (haftungsbeschränkt)\nGesellschaft mit beschränkter Haftung\nKrefeld\n\nDas Registergericht beabsichtigt die Gesellschaft von Amts wegen nach § 394 FamFG zu löschen. Die Frist zur Erhebung eines Widerspruchs ist auf einen Monat festgesetzt."
    },
    {
      "date": "2025-05-16",
      "id": "109357",
      "original_text": "Einreichung neuer Dokumente\nNordrhein-Westfalen Amtsgericht Düsseldorf HRB 39572\nsino Aktiengesellschaft – Düsseldorf",
      "type": "Einreichung neuer Dokumente",
      "state": "Nordrhein-Westfalen",
      "amtsgericht": "Amtsgericht Düsseldorf",
      "registernummer": "HRB 39572",
      "registerart": "HRB",
      "company_name": "sino Aktiengesellschaft",
      "company_seat": "Düsseldorf",
      "details": "16.05.2025 (Bekanntmachungsdatum)\n\nNordrhein-Westfalen Amtsgericht Düsseldorf HRB 39572\nEinreichung neuer Dokumente\n\nsino Aktiengesellschaft\nAktiengesellschaft\nDüsseldorf\n\nDem Registergericht ist eine Liste der Mitglieder des Aufsichtsrates eingereicht worden."
    },
    {
      "date": "2025-05-16",
      "id": "109358",
      "original_text": "Löschungsankündigung\nNordrhein-Westfalen Amtsgericht Düsseldorf HRB 93805\nKleine Hammerstrasse UG (haftungsbeschränkt) – Düsseldorf",
      "type": "Löschungsankündigung",
      "state": "Nordrhein-Westfalen",
      "amtsgericht": "Amtsgericht Düsseldorf",
      "registernummer": "HRB 93805",
      "registerart": "HRB",
      "company_name": "Kleine Hammerstrasse UG (haftungsbeschränkt)",
      "company_seat": "Düsseldorf",
      "details": "16.05.2025 (Bekanntmachungsdatum)\n\nNordrhein-Westfalen Amtsgericht Düsseldorf HRB 93805\nLöschungsankündigung\n\nKleine Hammerstrasse UG (haftungsbeschränkt)\nGesellschaft mit beschränkter Haftung\nDüsseldorf\n\nBetr.: Kleine Hammerstrasse UG (haftungsbeschränkt), Hingbergstr. 101, 45468 Mülheim an der Ruhr (Sitz: Düsseldorf)\n\nDas Registergericht beabsichtigt die Gesellschaft von Amts wegen nach § 394 FamFG zu löschen. Die Frist zur Erhebung eines Widerspruchs ist auf 3 Wochen festgesetzt.\n\nRechtsbehelfsbelehrung:\nDas Widerspruchsrecht steht jedem zu, der an der Unterlassung der Löschung ein berechtigtes Interesse hat. Der Widerspruch ist bei dem Amtsgericht Düsseldorf -Registergericht-, Werdener Straße 1, 40227 Düsseldorf schriftlich in deutscher Sprache oder zur Niederschrift der Geschäftsstelle einzulegen. Der Widerspruch kann auch zur Niederschrift der Geschäftsstelle eines jeden Amtsgerichtes abgegeben werden. Die Einlegung ist auch durch Übertragung eines elektronischen Dokuments an die elektronische Poststelle des Gerichts möglich. Das elektronische Dokument muss für die Bearbeitung durch das Gericht geeignet und mit einer qualifizierten elektronischen Signatur der verantwortenden Person versehen sein oder von der verantwortenden Person signiert und auf einem sicheren Übermittlungsweg gemäß § 130a ZPO nach näherer Maßgabe der Verordnung über die technischen Rahmenbedingungen des elektronischen Rechtsverkehrs und über das besondere elektronische Behördenpostfach (BGBl. I, S.3803) eingereicht werden. Weitere Informationen erhalten Sie auf der Internetseite www.justiz.de.\nDer Widerspruch muss spätestens innerhalb der gesetzten Frist nach dem Datum der Bekanntmachung der Löschungsankündigung bei dem Amtsgericht - Registergericht - Düsseldorf eingegangen sein.  Dies gilt auch dann, wenn der Widerspruch zur Niederschrift der Geschäftsstelle eines anderen Amtsgerichtes abgegeben wurde. Die Frist beginnt mit dem Tage der Bekanntmachung der Löschungsankündigung in dem für die Bekanntmachung der Eintragungen in das Handelsregister bestimmten elektronischen Informations- und Kommunikationssystem nach § 10 des Handelsgesetzbuches. Fällt das Ende der Frist auf einen Sonntag, einen allgemeinen Feiertag oder Sonnabend, so endet die Frist mit Ablauf des nächsten Werktages.\nDer Widerspruch muss die Bezeichnung der angefochtenen Löschungsankündigung sowie die Erklärung enthalten, dass Widerspruch gegen diese Löschungsankündigung eingelegt wird. Er ist zu unterzeichnen und soll begründet werden."
    },
    {
      "date": "2025-05-16",
      "id": "109359",
      "original_text": "Löschungsankündigung\nNordrhein-Westfalen Amtsgericht Köln HRB 109708\nAtrimmo Immobilien GmbH – Leverkusen",
      "type": "Löschungsankündigung",
      "state": "Nordrhein-Westfalen",
      "amtsgericht": "Amtsgericht Köln",
      "registernummer": "HRB 109708",
      "registerart": "HRB",
      "company_name": "Atrimmo Immobilien GmbH",
      "company_seat": "Leverkusen",
      "details": "16.05.2025 (Bekanntmachungsdatum)\n\nNordrhein-Westfalen Amtsgericht Köln HRB 109708\nLöschungsankündigung\n\nAtrimmo Immobilien GmbH\nGesellschaft mit beschränkter Haftung\nLeverkusen\n\nDas Registergericht beabsichtigt, die im Handelsregister eingetragene Gesellschaft gemäß § 394 Absatz 1 FamFG wegen Vermögenslosigkeit von Amts wegen zu löschen. Gegen diese Verfügung kann Widerspruch eingelegt werden. Die Frist zur Erhebung eines Widerspruchs gegen die beabsichtigte Löschung von Amts wegen ist auf einen Monat festgesetzt. Rechtsbehelfsbelehrung: Gegen diese Verfügung können Sie Widerspruch einlegen. Der Widerspruch ist bei dem Amtsgericht Köln, Reichenspergerplatz 1, 50670 Köln schriftlich in deutscher Sprache oder zur Niederschrift der Geschäftsstelle einzulegen. Der Widerspruch kann auch zur Niederschrift der Geschäftsstelle eines jeden Amtsgerichtes abgegeben werden. Die Einlegung ist auch durch Übertragung eines elektronischen Dokuments an die elektronische Poststelle des Gerichts möglich. Das elektronische Dokument muss für die Bearbeitung durch das Gericht geeignet und mit einer qualifizierten elektronischen Signatur der verantwortenden Person versehen sein oder von der verantwortenden Person signiert und auf einem sicheren Übermittlungsweg gemäß § 130a ZPO nach näherer Maßgabe der Verordnung über die technischen Rahmenbedingungen des elektronischen Rechtsverkehrs und über das besondere elektronische Behördenpostfach (BGBl. I, S.3803) eingereicht werden. Weitere Informationen erhalten Sie auf der Internetseite www.justiz.de.Der Widerspruch muss spätestens innerhalb der gesetzten Frist bei dem Amtsgericht Köln eingegangen sein. Dies gilt auch dann, wenn der Widerspruch zur Niederschrift der Geschäftsstelle eines anderen Amtsgerichtes abgegeben wurde. Die Frist beginnt mit der Veröffentlichung. Fällt das Ende der Frist auf einen Sonntag, einen allgemeinen Feiertag oder Sonnabend, so endet die Frist mit Ablauf des nächsten Werktages.\n\nDer Widerspruch muss die Bezeichnung der angefochtenen Verfügung sowie die Erklärung enthalten, dass Widerspruch gegen diese Verfügung eingelegt wird. Er ist zu unterzeichnen und soll begründet werden."
    },
    {
      "date": "2025-05-16",
      "id": "109360",
      "original_text": "Registerbekanntmachung nach dem Umwandlungsgesetz\nBremen Amtsgericht Bremen HRB 18191\nswb Services GmbH – Bremen",
      "type": "Registerbekanntmachung nach dem Umwandlungsgesetz",
      "state": "Bremen",
      "amtsgericht": "Amtsgericht Bremen",
      "registernummer": "HRB 18191",
      "registerart": "HRB",
      "company_name": "swb Services GmbH",
      "company_seat": "Bremen",
      "details": "16.05.2025 (Bekanntmachungsdatum)\n\nBremen Amtsgericht Bremen HRB 18191\nRegisterbekanntmachung nach dem Umwandlungsgesetz 13.05.2025 (Eintragungsdatum)\n\nswb Services GmbH\nGesellschaft mit beschränkter Haftung\nBremen\n\nZu Eintragungsnummer 18 vom 13.05.2025 wird als nicht eingetragen veröffentlicht: Den Gläubigern der an der Verschmelzung beteiligten Rechtsträger ist, wenn sie binnen sechs Monaten nach dem Tag, an dem die Eintragung der Verschmelzung in das Register des Sitzes desjenigen Rechtsträgers, dessen Gläubiger sie sind, als bekannt gemacht gilt, ihren Anspruch nach Grund und Höhe schriftlich anmelden, Sicherheit zu leisten, soweit sie nicht Befriedigung verlangen können. Dieses Recht steht den Gläubigern jedoch nur zu, wenn sie glaubhaft machen, dass durch die Verschmelzung die Erfüllung ihrer Forderung gefährdet wird. Das Recht, Sicherheitsleistung zu verlangen, steht Gläubigern nicht zu, die im Falle der Insolvenz ein Recht auf vorzugsweise Befriedigung aus einer Deckungsmasse haben, die nach gesetzlicher Vorschrift zu ihrem Schutz errichtet und staatlich überwacht ist."
    },
    {
      "date": "2025-05-16",
      "id": "109361",
      "original_text": "Einreichung neuer Dokumente\nNordrhein-Westfalen Amtsgericht Paderborn HRB 9859\nBENTELER Business Services GmbH – Paderborn",
      "type": "Einreichung neuer Dokumente",
      "state": "Nordrhein-Westfalen",
      "amtsgericht": "Amtsgericht Paderborn",
      "registernummer": "HRB 9859",
      "registerart": "HRB",
      "company_name": "BENTELER Business Services GmbH",
      "company_seat": "Paderborn",
      "details": "16.05.2025 (Bekanntmachungsdatum)\n\nNordrhein-Westfalen Amtsgericht Paderborn HRB 9859\nEinreichung neuer Dokumente\n\nBENTELER Business Services GmbH\nGesellschaft mit beschränkter Haftung\nPaderborn\n\nDem Registergericht ist eine neue Liste der Mitglieder des Aufsichtsrates eingereicht worden."
    },
    {
      "date": "2025-05-16",
      "id": "109362",
      "original_text": "Löschungsankündigung\nNordrhein-Westfalen Amtsgericht Dortmund HRA 18574\nGrill Store Münsterstraße Lünen UG (haftungsbeschränkt) & Co. KG – Lünen",
      "type": "Löschungsankündigung",
      "state": "Nordrhein-Westfalen",
      "amtsgericht": "Amtsgericht Dortmund",
      "registernummer": "HRA 18574",
      "registerart": "HRA",
      "company_name": "Grill Store Münsterstraße Lünen UG (haftungsbeschränkt) & Co. KG",
      "company_seat": "Lünen",
      "details": "16.05.2025 (Bekanntmachungsdatum)\n\nNordrhein-Westfalen Amtsgericht Dortmund HRA 18574\nLöschungsankündigung\n\nGrill Store Münsterstraße Lünen UG (haftungsbeschränkt) & Co. KG\nKommanditgesellschaft\nLünen\n\nDas Registergericht beabsichtigt die Firma von Amts wegen nach § 394 FamFG zu löschen. Die Frist zur Erhebung eines Widerspruchs ist auf drei Monate festgesetzt."
    },
    {
      "date": "2025-05-16",
      "id": "109363",
      "original_text": "Löschungsankündigung\nNordrhein-Westfalen Amtsgericht Hagen HRB 11520\nFIRAT GmbH – Hagen",
      "type": "Löschungsankündigung",
      "state": "Nordrhein-Westfalen",
      "amtsgericht": "Amtsgericht Hagen",
      "registernummer": "HRB 11520",
      "registerart": "HRB",
      "company_name": "FIRAT GmbH",
      "company_seat": "Hagen",
      "details": "16.05.2025 (Bekanntmachungsdatum)\n\nNordrhein-Westfalen Amtsgericht Hagen HRB 11520\nLöschungsankündigung\n\nFIRAT GmbH\nGesellschaft mit beschränkter Haftung\nHagen\n\nDas Registergericht beabsichtigt, die im Handelsregister eingetragene Gesellschaft gemäß § 394 Absatz 1 FamFG wegen Vermögenslosigkeit von Amts wegen zu löschen.  Gegen diese Verfügung kann Widerspruch eingelegt werden. Die Frist zur Erhebung eines Widerspruchs gegen die beabsichtigte Löschung von Amts wegen ist auf drei Monate festgesetzt.\n\nRechtsbehelfsbelehrung:\nGegen diese Verfügung können Sie Widerspruch einlegen.\n\nDer Widerspruch ist bei dem Amtsgericht Hagen, Heinitzstraße 42, 58097 Hagen schriftlich in deutscher Sprache oder zur Niederschrift der Geschäftsstelle einzulegen. Der Widerspruch kann auch zur Niederschrift der Geschäftsstelle eines jeden Amtsgerichtes abgegeben werden.\n\nDer Widerspruch muss spätestens innerhalb der gesetzten Frist bei dem Amtsgericht Hagen eingegangen sein. Dies gilt auch dann, wenn der Widerspruch zur Niederschrift der Geschäftsstelle eines anderen Amtsgerichtes abgegeben wurde. Die Frist beginnt mit der Veröffentlichung. Fällt das Ende der Frist auf einen Sonntag, einen allgemeinen Feiertag oder Sonnabend, so endet die Frist mit Ablauf des nächsten Werktages.\n\nDer Widerspruch muss die Bezeichnung der angefochtenen Verfügung sowie die Erklärung enthalten, dass Widerspruch gegen diese Verfügung eingelegt wird. Er ist zu unterzeichnen und soll begründet werden."
    },
    {
      "date": "2025-05-16",
      "id": "109364",
      "original_text": "Einreichung neuer Dokumente\nNordrhein-Westfalen Amtsgericht Hagen HRB 2920\nthyssenkrupp Hohenlimburg GmbH – Hagen",
      "type": "Einreichung neuer Dokumente",
      "state": "Nordrhein-Westfalen",
      "amtsgericht": "Amtsgericht Hagen",
      "registernummer": "HRB 2920",
      "registerart": "HRB",
      "company_name": "thyssenkrupp Hohenlimburg GmbH",
      "company_seat": "Hagen",
      "details": "16.05.2025 (Bekanntmachungsdatum)\n\nNordrhein-Westfalen Amtsgericht Hagen HRB 2920\nEinreichung neuer Dokumente\n\nthyssenkrupp Hohenlimburg GmbH\nGesellschaft mit beschränkter Haftung\nHagen\n\nDem Registergericht ist eine neue Liste der Mitglieder des Aufsichtsrates eingereicht worden."
    },
    {
      "date": "2025-05-16",
      "id": "109365",
      "original_text": "Löschungsankündigung\nNordrhein-Westfalen Amtsgericht Wuppertal HRB 27041\nconan media GmbH – Wuppertal",
      "type": "Löschungsankündigung",
      "state": "Nordrhein-Westfalen",
      "amtsgericht": "Amtsgericht Wuppertal",
      "registernummer": "HRB 27041",
      "registerart": "HRB",
      "company_name": "conan media GmbH",
      "company_seat": "Wuppertal",
      "details": "16.05.2025 (Bekanntmachungsdatum)\n\nNordrhein-Westfalen Amtsgericht Wuppertal HRB 27041\nLöschungsankündigung 15.05.2025 (Eintragungsdatum)\n\nconan media GmbH\nGesellschaft mit beschränkter Haftung\nWuppertal\n\nDas Registergericht beabsichtigt die Gesellschaft von Amts wegen nach § 394 FamFG zu löschen. Die Frist zur Erhebung eines Widerspruchs ist auf einen Monat festgesetzt."
    },
    {
      "date": "2025-05-16",
      "id": "109366",
      "original_text": "Löschungsankündigung\nNordrhein-Westfalen Amtsgericht Düsseldorf HRB 86969\nExvisa GmbH – Düsseldorf",
      "type": "Löschungsankündigung",
      "state": "Nordrhein-Westfalen",
      "amtsgericht": "Amtsgericht Düsseldorf",
      "registernummer": "HRB 86969",
      "registerart": "HRB",
      "company_name": "Exvisa GmbH",
      "company_seat": "Düsseldorf",
      "details": "16.05.2025 (Bekanntmachungsdatum)\n\nNordrhein-Westfalen Amtsgericht Düsseldorf HRB 86969\nLöschungsankündigung\n\nExvisa GmbH\nGesellschaft mit beschränkter Haftung\nDüsseldorf\n\nDas Registergericht beabsichtigt die Gesellschaft von Amts wegen nach § 394 FamFG zu löschen. Die Frist zur Erhebung eines Widerspruchs ist auf 3 Wochen festgesetzt.\n\nRechtsbehelfsbelehrung:\nDas Widerspruchsrecht steht jedem zu, der an der Unterlassung der Löschung ein berechtigtes Interesse hat. Der Widerspruch ist bei dem Amtsgericht Düsseldorf -Registergericht-, Werdener Straße 1, 40227 Düsseldorf schriftlich in deutscher Sprache oder zur Niederschrift der Geschäftsstelle einzulegen. Der Widerspruch kann auch zur Niederschrift der Geschäftsstelle eines jeden Amtsgerichtes abgegeben werden. Die Einlegung ist auch durch Übertragung eines elektronischen Dokuments an die elektronische Poststelle des Gerichts möglich. Das elektronische Dokument muss für die Bearbeitung durch das Gericht geeignet und mit einer qualifizierten elektronischen Signatur der verantwortenden Person versehen sein oder von der verantwortenden Person signiert und auf einem sicheren Übermittlungsweg gemäß § 130a ZPO nach näherer Maßgabe der Verordnung über die technischen Rahmenbedingungen des elektronischen Rechtsverkehrs und über das besondere elektronische Behördenpostfach (BGBl. I, S.3803) eingereicht werden. Weitere Informationen erhalten Sie auf der Internetseite www.justiz.de.\nDer Widerspruch muss spätestens innerhalb der gesetzten Frist nach dem Datum der Bekanntmachung der Löschungsankündigung bei dem Amtsgericht - Registergericht - Düsseldorf eingegangen sein.  Dies gilt auch dann, wenn der Widerspruch zur Niederschrift der Geschäftsstelle eines anderen Amtsgerichtes abgegeben wurde. Die Frist beginnt mit dem Tage der Bekanntmachung der Löschungsankündigung in dem für die Bekanntmachung der Eintragungen in das Handelsregister bestimmten elektronischen Informations- und Kommunikationssystem nach § 10 des Handelsgesetzbuches. Fällt das Ende der Frist auf einen Sonntag, einen allgemeinen Feiertag oder Sonnabend, so endet die Frist mit Ablauf des nächsten Werktages.\nDer Widerspruch muss die Bezeichnung der angefochtenen Löschungsankündigung sowie die Erklärung enthalten, dass Widerspruch gegen diese Löschungsankündigung eingelegt wird. Er ist zu unterzeichnen und soll begründet werden."
    },
    {
      "date": "2025-05-16",
      "id": "109367",
      "original_text": "Löschungsankündigung\nNordrhein-Westfalen Amtsgericht Essen HRB 32466\nSchino International Trade GmbH – Essen",
      "type": "Löschungsankündigung",
      "state": "Nordrhein-Westfalen",
      "amtsgericht": "Amtsgericht Essen",
      "registernummer": "HRB 32466",
      "registerart": "HRB",
      "company_name": "Schino International Trade GmbH",
      "company_seat": "Essen",
      "details": "16.05.2025 (Bekanntmachungsdatum)\n\nNordrhein-Westfalen Amtsgericht Essen HRB 32466\nLöschungsankündigung\n\nSchino International Trade GmbH\nGesellschaft mit beschränkter Haftung\nEssen\n\nDas Registergericht beabsichtigt die Gesellschaft von Amts wegen nach § 394 FamFG zu löschen. Die Frist zur Erhebung eines Widerspruchs ist auf zwei Monate festgesetzt."
    },
    {
      "date": "2025-05-16",
      "id": "109368",
      "original_text": "Registerbekanntmachung nach dem Umwandlungsgesetz\nNordrhein-Westfalen Amtsgericht Paderborn HRA 8834\nLeonard Vermögensverwaltungs GmbH & Co. KG – Paderborn",
      "type": "Registerbekanntmachung nach dem Umwandlungsgesetz",
      "state": "Nordrhein-Westfalen",
      "amtsgericht": "Amtsgericht Paderborn",
      "registernummer": "HRA 8834",
      "registerart": "HRA",
      "company_name": "Leonard Vermögensverwaltungs GmbH & Co. KG",
      "company_seat": "Paderborn",
      "details": "16.05.2025 (Bekanntmachungsdatum)\n\nNordrhein-Westfalen Amtsgericht Paderborn HRA 8834\nRegisterbekanntmachung nach dem Umwandlungsgesetz 16.05.2025 (Eintragungsdatum)\n\nLeonard Vermögensverwaltungs GmbH & Co. KG\nKommanditgesellschaft\nPaderborn\n\nDen Gläubigern der an der Ausgliederung beteiligten Rechtsträger ist, wenn sie binnen sechs Monaten nach dem Tag, an dem die Eintragung der Ausgliederung in das Register des Sitzes desjenigen Rechtsträgers, dessen Gläubiger sie sind, nach § 19 Absatz 3 UmwG als bekanntgemacht gilt, ihren Anspruch nach Grund und Höhe schriftlich anmelden, Sicherheit zu leisten, soweit sie nicht Befriedigung verlangen können. Dieses Recht steht den Gläubigern jedoch nur zu, wenn sie glaubhaft machen, dass durch die Ausgliederung die Erfüllung ihrer Forderung gefährdet wird."
    },
    {
      "date": "2025-05-16",
      "id": "109369",
      "original_text": "Löschungsankündigung\nThüringen Amtsgericht Jena HRB 200143\ngerana cosmetic GmbH – Gera",
      "type": "Löschungsankündigung",
      "state": "Thüringen",
      "amtsgericht": "Amtsgericht Jena",
      "registernummer": "HRB 200143",
      "registerart": "HRB",
      "company_name": "gerana cosmetic GmbH",
      "company_seat": "Gera",
      "details": "16.05.2025 (Bekanntmachungsdatum)\n\nThüringen Amtsgericht Jena HRB 200143\nLöschungsankündigung\n\ngerana cosmetic GmbH\nGesellschaft mit beschränkter Haftung\nGera\n\nDas Registergericht beabsichtigt, die im Handelsregister eingetragene Gesellschaft wegen Vermögenslosigkeit nach § 394 FamFG von Amts wegen zu löschen. Die Frist zur Erhebung eines Widerspruchs gegen die beabsichtigte Löschung wird auf 6 Wochen festgesetzt."
    },
    {
      "date": "2025-05-16",
      "id": "109370",
      "original_text": "Einreichung neuer Dokumente\nHessen Amtsgericht Frankfurt am Main HRB 12394\nDeutsche Gesellschaft für Internationale Zusammenarbeit (GIZ) GmbH – Eschborn und Bonn",
      "type": "Einreichung neuer Dokumente",
      "state": "Hessen",
      "amtsgericht": "Amtsgericht Frankfurt am Main",
      "registernummer": "HRB 12394",
      "registerart": "HRB",
      "company_name": "Deutsche Gesellschaft für Internationale Zusammenarbeit (GIZ) GmbH",
      "company_seat": "Eschborn und Bonn",
      "details": "16.05.2025 (Bekanntmachungsdatum)\n\nHessen Amtsgericht Frankfurt am Main HRB 12394\nEinreichung neuer Dokumente 16.05.2025 (Eintragungsdatum)\n\nDeutsche Gesellschaft für Internationale Zusammenarbeit (GIZ) GmbH\nGesellschaft mit beschränkter Haftung\nEschborn und Bonn\n\nDurch eine Änderung in den Personen der Aufsichtsratsmitglieder ist eine Liste der Mitglieder des Aufsichtsrates zum Handelsregister eingereicht worden."
    },
    {
      "date": "2025-05-16",
      "id": "109371",
      "original_text": "Löschungsankündigung\nHessen Amtsgericht Offenbach am Main HRB 5637\nStork GmbH, Maschinen für die grafische Industrie & Leiterplattenindustrie – Mühlheim am Main",
      "type": "Löschungsankündigung",
      "state": "Hessen",
      "amtsgericht": "Amtsgericht Offenbach am Main",
      "registernummer": "HRB 5637",
      "registerart": "HRB",
      "company_name": "Stork GmbH, Maschinen für die grafische Industrie & Leiterplattenindustrie",
      "company_seat": "Mühlheim am Main",
      "details": "16.05.2025 (Bekanntmachungsdatum)\n\nHessen Amtsgericht Offenbach am Main HRB 5637\nLöschungsankündigung\n\nStork GmbH, Maschinen für die grafische Industrie & Leiterplattenindustrie\nGesellschaft mit beschränkter Haftung\nMühlheim am Main\n\nDas Registergericht beabsichtigt die im Handelsregister eingetragene Gesellschaft von Amts wegen nach § 394 FamFG zu löschen. Die Frist zur Erhebung eines Widerspruchs gegen die beabsichtigte Löschung wird auf 3 Monate festgesetzt"
    },
    {
      "date": "2025-05-16",
      "id": "109372",
      "original_text": "Löschungsankündigung\nHessen Amtsgericht Darmstadt HRB 99031\nVERDI Bau GmbH – Rüsselsheim am Main",
      "type": "Löschungsankündigung",
      "state": "Hessen",
      "amtsgericht": "Amtsgericht Darmstadt",
      "registernummer": "HRB 99031",
      "registerart": "HRB",
      "company_name": "VERDI Bau GmbH",
      "company_seat": "Rüsselsheim am Main",
      "details": "16.05.2025 (Bekanntmachungsdatum)\n\nHessen Amtsgericht Darmstadt HRB 99031\nLöschungsankündigung\n\nVERDI Bau GmbH\nGesellschaft mit beschränkter Haftung\nRüsselsheim am Main\n\nDas Registergericht beabsichtigt die im Handelsregister eingetragene Gesellschaft von Amts wegen nach § 394 FamFG zu löschen. Die Frist zur Erhebung eines Widerspruchs gegen die beabsichtigte Löschung wird auf 3 Monate festgesetzt."
    },
    {
      "date": "2025-05-16",
      "id": "109373",
      "original_text": "Sonstige Registerbekanntmachung\nHessen Amtsgericht Frankfurt am Main HRB 91291\nASB Erasmus Frankfurter Stadtschule Grundschule gGmbH – Frankfurt am Main",
      "type": "Sonstige Registerbekanntmachung",
      "state": "Hessen",
      "amtsgericht": "Amtsgericht Frankfurt am Main",
      "registernummer": "HRB 91291",
      "registerart": "HRB",
      "company_name": "ASB Erasmus Frankfurter Stadtschule Grundschule gGmbH",
      "company_seat": "Frankfurt am Main",
      "details": "16.05.2025 (Bekanntmachungsdatum)\n\nHessen Amtsgericht Frankfurt am Main HRB 91291\nSonstige Registerbekanntmachung\n\nASB Erasmus Frankfurter Stadtschule Grundschule gGmbH\nGesellschaft mit beschränkter Haftung\nFrankfurt am Main\n\nDurch eine Änderung in den Personen der Aufsichtsratsmitglieder ist eine Liste der Mitglieder des Aufsichtsrates zum Handelsregister eingereicht worden."
    },
    {
      "date": "2025-05-16",
      "id": "109374",
      "original_text": "Löschungsankündigung\nHessen Amtsgericht Darmstadt HRB 105289\nVapuria GmbH – Alsbach-Hähnlein",
      "type": "Löschungsankündigung",
      "state": "Hessen",
      "amtsgericht": "Amtsgericht Darmstadt",
      "registernummer": "HRB 105289",
      "registerart": "HRB",
      "company_name": "Vapuria GmbH",
      "company_seat": "Alsbach-Hähnlein",
      "details": "16.05.2025 (Bekanntmachungsdatum)\n\nHessen Amtsgericht Darmstadt HRB 105289\nLöschungsankündigung\n\nVapuria GmbH\nGesellschaft mit beschränkter Haftung\nAlsbach-Hähnlein\n\nDas Registergericht beabsichtigt die im Handelsregister eingetragene Gesellschaft von Amts wegen nach § 394 FamFG zu löschen. Die Frist zur Erhebung eines Widerspruchs gegen die beabsichtigte Löschung wird auf 3 Monate festgesetzt."
    },
    {
      "date": "2025-05-16",
      "id": "109375",
      "original_text": "Löschungsankündigung\nHessen Amtsgericht Offenbach am Main HRB 46430\nCleanPower und RG GmbH – Offenbach am Main",
      "type": "Löschungsankündigung",
      "state": "Hessen",
      "amtsgericht": "Amtsgericht Offenbach am Main",
      "registernummer": "HRB 46430",
      "registerart": "HRB",
      "company_name": "CleanPower und RG GmbH",
      "company_seat": "Offenbach am Main",
      "details": "16.05.2025 (Bekanntmachungsdatum)\n\nHessen Amtsgericht Offenbach am Main HRB 46430\nLöschungsankündigung\n\nCleanPower und RG GmbH\nGesellschaft mit beschränkter Haftung\nOffenbach am Main\n\nDas Registergericht beabsichtigt die im Handelsregister eingetragene Gesellschaft von Amts wegen nach § 394 FamFG zu löschen. Die Frist zur Erhebung eines Widerspruchs gegen die beabsichtigte Löschung wird auf 3 Monate festgesetzt"
    },
    {
      "date": "2025-05-16",
      "id": "109376",
      "original_text": "Löschungsankündigung\nHessen Amtsgericht Frankfurt am Main HRB 132592\nKXINNO GmbH – Frankfurt am Main",
      "type": "Löschungsankündigung",
      "state": "Hessen",
      "amtsgericht": "Amtsgericht Frankfurt am Main",
      "registernummer": "HRB 132592",
      "registerart": "HRB",
      "company_name": "KXINNO GmbH",
      "company_seat": "Frankfurt am Main",
      "details": "16.05.2025 (Bekanntmachungsdatum)\n\nHessen Amtsgericht Frankfurt am Main HRB 132592\nLöschungsankündigung\n\nKXINNO GmbH\nGesellschaft mit beschränkter Haftung\nFrankfurt am Main\n\nDas Registergericht beabsichtigt die im Handelsregister eingetragene Gesellschaft von Amts wegen nach § 394 FamFG zu löschen. Die Frist zur Erhebung eines Widerspruchs gegen die beabsichtigte Löschung wird auf 3 Monate festgesetzt."
    },
    {
      "date": "2025-05-16",
      "id": "109377",
      "original_text": "Einreichung neuer Dokumente\nHessen Amtsgericht Darmstadt HRB 90155\nStrike Aviation AG – Mörfelden-Walldorf",
      "type": "Einreichung neuer Dokumente",
      "state": "Hessen",
      "amtsgericht": "Amtsgericht Darmstadt",
      "registernummer": "HRB 90155",
      "registerart": "HRB",
      "company_name": "Strike Aviation AG",
      "company_seat": "Mörfelden-Walldorf",
      "details": "16.05.2025 (Bekanntmachungsdatum)\n\nHessen Amtsgericht Darmstadt HRB 90155\nEinreichung neuer Dokumente 16.05.2025 (Eintragungsdatum)\n\nStrike Aviation AG\nAktiengesellschaft\nMörfelden-Walldorf\n\nDurch eine Änderung in den Personen der Aufsichtsratsmitglieder ist eine Liste der Mitglieder des Aufsichtsrates zum Handelsregister eingereicht worden."
    },
    {
      "date": "2025-05-16",
      "id": "109378",
      "original_text": "Registerbekanntmachung nach dem Umwandlungsgesetz\nHessen Amtsgericht Bad Homburg v.d.H. HRA 5331\nPrilep GmbH & Co. KG – Bad Homburg v. d. Höhe",
      "type": "Registerbekanntmachung nach dem Umwandlungsgesetz",
      "state": "Hessen",
      "amtsgericht": "Amtsgericht Bad Homburg v.d.H.",
      "registernummer": "HRA 5331",
      "registerart": "HRA",
      "company_name": "Prilep GmbH & Co. KG",
      "company_seat": "Bad Homburg v. d. Höhe",
      "details": "16.05.2025 (Bekanntmachungsdatum)\n\nHessen Amtsgericht Bad Homburg v.d.H. HRA 5331\nRegisterbekanntmachung nach dem Umwandlungsgesetz 16.05.2025 (Eintragungsdatum)\n\nPrilep GmbH & Co. KG\nKommanditgesellschaft\nBad Homburg v. d. Höhe\n\nDen Gläubigern der an der Verschmelzung beteiligten Rechtsträger ist, wenn sie binnen sechs Monaten nach dem Tag, an dem die Eintragung der Verschmelzung in das Register des Sitzes desjenigen Rechtsträgers, dessen Gläubiger sie sind, nach § 19 Absatz 3 UmwG bekannt gemacht worden ist, ihren Anspruch nach Grund und Höhe schriftlich anmelden, Sicherheit zu leisten, soweit sie nicht Befriedigung verlangen können. Dieses Recht steht den Gläubigern jedoch nur zu, wenn sie glaubhaft machen, dass durch die Verschmelzung die Erfüllung ihrer Forderung gefährdet wird."
    },
    {
      "date": "2025-05-16",
      "id": "109379",
      "original_text": "Registerbekanntmachung nach dem Umwandlungsgesetz\nHessen Amtsgericht Kassel HRB 20227\nEuropean Aviation Competence Center GmbH – Calden",
      "type": "Registerbekanntmachung nach dem Umwandlungsgesetz",
      "state": "Hessen",
      "amtsgericht": "Amtsgericht Kassel",
      "registernummer": "HRB 20227",
      "registerart": "HRB",
      "company_name": "European Aviation Competence Center GmbH",
      "company_seat": "Calden",
      "details": "16.05.2025 (Bekanntmachungsdatum)\n\nHessen Amtsgericht Kassel HRB 20227\nRegisterbekanntmachung nach dem Umwandlungsgesetz 16.05.2025 (Eintragungsdatum)\n\nEuropean Aviation Competence Center GmbH\nGesellschaft mit beschränkter Haftung\nCalden\n\nDen Gläubigern der an der formwechselnden Umwandlung beteiligten Rechtsträger ist, wenn sie binnen sechs Monaten nach dem Tag, an dem die Eintragung der formwechselnden Umwandlung in das Register des Sitzes desjenigen Rechtsträgers, dessen Gläubiger sie sind, nach § 201 UmwG bekannt gemacht worden ist, ihren Anspruch nach Grund und Höhe schriftlich anmelden, Sicherheit zu leisten, soweit sie nicht Befriedigung verlangen können. Dieses Recht steht den Gläubigern jedoch nur zu, wenn sie glaubhaft machen, dass durch die formwechselnden Umwandlung die Erfüllung ihrer Forderung gefährdet wird."
    },
    {
      "date": "2025-05-16",
      "id": "109380",
      "original_text": "Löschungsankündigung\nHessen Amtsgericht Gießen HRB 9764\nPflege Assogba UG (haftungsbeschränkt) – Buseck",
      "type": "Löschungsankündigung",
      "state": "Hessen",
      "amtsgericht": "Amtsgericht Gießen",
      "registernummer": "HRB 9764",
      "registerart": "HRB",
      "company_name": "Pflege Assogba UG (haftungsbeschränkt)",
      "company_seat": "Buseck",
      "details": "16.05.2025 (Bekanntmachungsdatum)\n\nHessen Amtsgericht Gießen HRB 9764\nLöschungsankündigung\n\nPflege Assogba UG (haftungsbeschränkt)\nGesellschaft mit beschränkter Haftung\nBuseck\n\nEs ist beabsichtigt, die Gesellschaft wegen Vermögenslosigkeit gemäß § 394 FamFG von Amts wegen zu löschen. Hiergegen kann innerhalb von drei Monaten nach dieser Veröffentlichung Widerspruch beim Amtsgericht Gießen eingelegt werden. Sollte Widerspruch eingelegt werden, dürfte dies nur mit Begründung erfolgversprechend sein. Insbesondere sollte vorhandenes Vermögen der Gesellschaft innerhalb der genannten Frist nachgewiesen werden."
    },
    {
      "date": "2025-05-16",
      "id": "109381",
      "original_text": "Sonstige Registerbekanntmachung\nHessen Amtsgericht Wetzlar VR 4295\nRETTET DEN MITTELSTAND e.V. – Wetzlar",
      "type": "Sonstige Registerbekanntmachung",
      "state": "Hessen",
      "amtsgericht": "Amtsgericht Wetzlar",
      "registernummer": "VR 4295",
      "registerart": "VR",
      "company_name": "RETTET DEN MITTELSTAND e.V.",
      "company_seat": "Wetzlar",
      "details": "16.05.2025 (Bekanntmachungsdatum)\n\nHessen Amtsgericht Wetzlar VR 4295\nSonstige Registerbekanntmachung 16.05.2025 (Eintragungsdatum)\n\nRETTET DEN MITTELSTAND e.V.\neingetragener Verein\nWetzlar\n\nDer Verein ist erloschen."
    },
    {
      "date": "2025-05-16",
      "id": "109382",
      "original_text": "Löschungsankündigung\nHessen Amtsgericht Frankfurt am Main HRB 118248\nGoldmann Immobilienservice GmbH – Frankfurt am Main",
      "type": "Löschungsankündigung",
      "state": "Hessen",
      "amtsgericht": "Amtsgericht Frankfurt am Main",
      "registernummer": "HRB 118248",
      "registerart": "HRB",
      "company_name": "Goldmann Immobilienservice GmbH",
      "company_seat": "Frankfurt am Main",
      "details": "16.05.2025 (Bekanntmachungsdatum)\n\nHessen Amtsgericht Frankfurt am Main HRB 118248\nLöschungsankündigung\n\nGoldmann Immobilienservice GmbH\nGesellschaft mit beschränkter Haftung\nFrankfurt am Main\n\nDas Registergericht beabsichtigt die im Handelsregister eingetragene Gesellschaft von Amts wegen nach § 394 FamFG zu löschen. Die Frist zur Erhebung eines Widerspruchs gegen die beabsichtigte Löschung wird auf 1 Monat festgesetzt."
    },
    {
      "date": "2025-05-16",
      "id": "109383",
      "original_text": "Löschungsankündigung\nHessen Amtsgericht Hanau HRB 98147\nBWR GmbH – Maintal",
      "type": "Löschungsankündigung",
      "state": "Hessen",
      "amtsgericht": "Amtsgericht Hanau",
      "registernummer": "HRB 98147",
      "registerart": "HRB",
      "company_name": "BWR GmbH",
      "company_seat": "Maintal",
      "details": "16.05.2025 (Bekanntmachungsdatum)\n\nHessen Amtsgericht Hanau HRB 98147\nLöschungsankündigung\n\nBWR GmbH\nGesellschaft mit beschränkter Haftung\nMaintal\n\nDas Registergericht beabsichtigt die im Handelsregister eingetragene Gesellschaft von Amts wegen nach § 394 FamFG zu löschen. Die Frist zur Erhebung eines Widerspruchs gegen die beabsichtigte Löschung wird auf 3 Monate festgesetzt."
    },
    {
      "date": "2025-05-16",
      "id": "109384",
      "original_text": "Registerbekanntmachung nach dem Umwandlungsgesetz\nHessen Amtsgericht Bad Hersfeld HRB 3244\nBickhardt Bau SE – Kirchheim",
      "type": "Registerbekanntmachung nach dem Umwandlungsgesetz",
      "state": "Hessen",
      "amtsgericht": "Amtsgericht Bad Hersfeld",
      "registernummer": "HRB 3244",
      "registerart": "HRB",
      "company_name": "Bickhardt Bau SE",
      "company_seat": "Kirchheim",
      "details": "16.05.2025 (Bekanntmachungsdatum)\n\nHessen Amtsgericht Bad Hersfeld HRB 3244\nRegisterbekanntmachung nach dem Umwandlungsgesetz 16.05.2025 (Eintragungsdatum)\n\nBickhardt Bau SE\nEuropäische Aktiengesellschaft (SE)\nKirchheim\n\nDie Gesellschaft hat den Entwurf des Verschmelzungsvertrages zwischen ihr und der Robert Ollig GmbH, Kollig (Amtsgericht Koblenz HRB 14080) beim Amtsgericht Bad Hersfeld (Registergericht) zur Einsichtnahme eingereicht."
    },
    {
      "date": "2025-05-16",
      "id": "109385",
      "original_text": "Einreichung neuer Dokumente\nHessen Amtsgericht Offenbach am Main HRB 43331\nOPAL Catering GmbH – Offenbach am Main",
      "type": "Einreichung neuer Dokumente",
      "state": "Hessen",
      "amtsgericht": "Amtsgericht Offenbach am Main",
      "registernummer": "HRB 43331",
      "registerart": "HRB",
      "company_name": "OPAL Catering GmbH",
      "company_seat": "Offenbach am Main",
      "details": "16.05.2025 (Bekanntmachungsdatum)\n\nHessen Amtsgericht Offenbach am Main HRB 43331\nEinreichung neuer Dokumente\n\nOPAL Catering GmbH\nGesellschaft mit beschränkter Haftung\nOffenbach am Main\n\nDurch eine Änderung in den Personen der Aufsichtsratsmitglieder ist eine Liste der Mitglieder des Aufsichtsrates zum Handelsregister eingereicht worden."
    },
    {
      "date": "2025-05-16",
      "id": "109386",
      "original_text": "Registerbekanntmachung nach dem Umwandlungsgesetz\nHessen Amtsgericht Kassel HRB 15160\nPiper + Jet Maintenance AG – Calden",
      "type": "Registerbekanntmachung nach dem Umwandlungsgesetz",
      "state": "Hessen",
      "amtsgericht": "Amtsgericht Kassel",
      "registernummer": "HRB 15160",
      "registerart": "HRB",
      "company_name": "Piper + Jet Maintenance AG",
      "company_seat": "Calden",
      "details": "16.05.2025 (Bekanntmachungsdatum)\n\nHessen Amtsgericht Kassel HRB 15160\nRegisterbekanntmachung nach dem Umwandlungsgesetz 16.05.2025 (Eintragungsdatum)\n\nPiper + Jet Maintenance AG\nAktiengesellschaft\nCalden\n\nDen Gläubigern der an der formwechselnden Umwandlung beteiligten Rechtsträger ist, wenn sie binnen sechs Monaten nach dem Tag, an dem die Eintragung der formwechselnden Umwandlung in das Register des Sitzes desjenigen Rechtsträgers, dessen Gläubiger sie sind, nach § 201 UmwG bekannt gemacht worden ist, ihren Anspruch nach Grund und Höhe schriftlich anmelden, Sicherheit zu leisten, soweit sie nicht Befriedigung verlangen können. Dieses Recht steht den Gläubigern jedoch nur zu, wenn sie glaubhaft machen, dass durch die formwechselnden Umwandlung die Erfüllung ihrer Forderung gefährdet wird."
    },
    {
      "date": "2025-05-16",
      "id": "109387",
      "original_text": "Löschungsankündigung\nHessen Amtsgericht Gießen HRB 10381\nC&C Dienstleistung UG (haftungsbeschränkt) – Laubach",
      "type": "Löschungsankündigung",
      "state": "Hessen",
      "amtsgericht": "Amtsgericht Gießen",
      "registernummer": "HRB 10381",
      "registerart": "HRB",
      "company_name": "C&C Dienstleistung UG (haftungsbeschränkt)",
      "company_seat": "Laubach",
      "details": "16.05.2025 (Bekanntmachungsdatum)\n\nHessen Amtsgericht Gießen HRB 10381\nLöschungsankündigung\n\nC&C Dienstleistung UG (haftungsbeschränkt)\nGesellschaft mit beschränkter Haftung\nLaubach\n\nEs ist beabsichtigt, die Gesellschaft wegen Vermögenslosigkeit gemäß § 394 FamFG von Amts wegen zu löschen. Hiergegen kann innerhalb von drei Monaten nach dieser Veröffentlichung Widerspruch beim Amtsgericht Gießen eingelegt werden. Sollte Widerspruch eingelegt werden, dürfte dies nur mit Begründung erfolgversprechend sein. Insbesondere sollte vorhandenes Vermögen der Gesellschaft innerhalb der genannten Frist nachgewiesen werden."
    },
    {
      "date": "2025-05-16",
      "id": "109388",
      "original_text": "Registerbekanntmachung nach dem Umwandlungsgesetz\nHessen Amtsgericht Frankfurt am Main HRB 115726\nEuclid Transactional Europe GmbH – Frankfurt am Main",
      "type": "Registerbekanntmachung nach dem Umwandlungsgesetz",
      "state": "Hessen",
      "amtsgericht": "Amtsgericht Frankfurt am Main",
      "registernummer": "HRB 115726",
      "registerart": "HRB",
      "company_name": "Euclid Transactional Europe GmbH",
      "company_seat": "Frankfurt am Main",
      "details": "16.05.2025 (Bekanntmachungsdatum)\n\nHessen Amtsgericht Frankfurt am Main HRB 115726\nRegisterbekanntmachung nach dem Umwandlungsgesetz 16.05.2025 (Eintragungsdatum)\n\nEuclid Transactional Europe GmbH\nGesellschaft mit beschränkter Haftung\nFrankfurt am Main\n\nDen Gläubigern der an der Verschmelzung beteiligten Rechtsträger ist, wenn sie binnen sechs Monaten nach dem Tag, an dem die Eintragung der Verschmelzung in das Register des Sitzes desjenigen Rechtsträgers, dessen Gläubiger sie sind, nach § 19 Absatz 3 UmwG bekannt gemacht worden ist, ihren Anspruch nach Grund und Höhe schriftlich anmelden, Sicherheit zu leisten, soweit sie nicht Befriedigung verlangen können. Dieses Recht steht den Gläubigern jedoch nur zu, wenn sie glaubhaft machen, dass durch die Verschmelzung die Erfüllung ihrer Forderung gefährdet wird."
    },
    {
      "date": "2025-05-16",
      "id": "109389",
      "original_text": "Einreichung neuer Dokumente\nHessen Amtsgericht Darmstadt HRB 4915\nTÜV Technische Überwachung Hessen GmbH – Darmstadt",
      "type": "Einreichung neuer Dokumente",
      "state": "Hessen",
      "amtsgericht": "Amtsgericht Darmstadt",
      "registernummer": "HRB 4915",
      "registerart": "HRB",
      "company_name": "TÜV Technische Überwachung Hessen GmbH",
      "company_seat": "Darmstadt",
      "details": "16.05.2025 (Bekanntmachungsdatum)\n\nHessen Amtsgericht Darmstadt HRB 4915\nEinreichung neuer Dokumente\n\nTÜV Technische Überwachung Hessen GmbH\nGesellschaft mit beschränkter Haftung\nDarmstadt\n\nDurch eine Änderung in den Personen der Aufsichtsratsmitglieder ist eine Liste der Mitglieder des Aufsichtsrates zum Handelsregister eingereicht worden."
    },
    {
      "date": "2025-05-16",
      "id": "109390",
      "original_text": "Registerbekanntmachung nach dem Umwandlungsgesetz\nHessen Amtsgericht Königstein HRB 5916\nDeutsche Beteiligungsgesellschaft mit beschränkter Haftung – Königstein im Taunus",
      "type": "Registerbekanntmachung nach dem Umwandlungsgesetz",
      "state": "Hessen",
      "amtsgericht": "Amtsgericht Königstein",
      "registernummer": "HRB 5916",
      "registerart": "HRB",
      "company_name": "Deutsche Beteiligungsgesellschaft mit beschränkter Haftung",
      "company_seat": "Königstein im Taunus",
      "details": "16.05.2025 (Bekanntmachungsdatum)\n\nHessen Amtsgericht Königstein HRB 5916\nRegisterbekanntmachung nach dem Umwandlungsgesetz 16.05.2025 (Eintragungsdatum)\n\nDeutsche Beteiligungsgesellschaft mit beschränkter Haftung\nGesellschaft mit beschränkter Haftung\nKönigstein im Taunus\n\nDen Gläubigern der an der Verschmelzung beteiligten Rechtsträger ist, wenn sie binnen sechs Monaten nach dem Tag, an dem die Eintragung der Verschmelzung in das Register des Sitzes desjenigen Rechtsträgers, dessen Gläubiger sie sind, nach § 19 Absatz 3 UmwG bekannt gemacht worden ist, ihren Anspruch nach Grund und Höhe schriftlich anmelden, Sicherheit zu leisten, soweit sie nicht Befriedigung verlangen können. Dieses Recht steht den Gläubigern jedoch nur zu, wenn sie glaubhaft machen, dass durch die Verschmelzung die Erfüllung ihrer Forderung gefährdet wird."
    }
  ]
}