{
  "date": "2025-05-21",
  "date_of_scrape": "2025-05-31T12:34:04.550Z",
  "tool_version": "0.2.0",
  "number_of_announcements": 172,
  "announcements": [
    {
      "date": "2025-05-21",
      "id": "109694",
      "original_text": "Registerbekanntmachung nach dem Umwandlungsgesetz\nBayern Amtsgericht München HRA 120832\nBoos Grundbesitz GmbH & Co. KG – München",
      "type": "Registerbekanntmachung nach dem Umwandlungsgesetz",
      "state": "Bayern",
      "amtsgericht": "Amtsgericht München",
      "registernummer": "HRA 120832",
      "registerart": "HRA",
      "company_name": "Boos Grundbesitz GmbH & Co. KG",
      "company_seat": "München",
      "details": "21.05.2025 (Bekanntmachungsdatum)\n\nBayern Amtsgericht München HRA 120832\nRegisterbekanntmachung nach dem Umwandlungsgesetz 20.05.2025 (Eintragungsdatum)\n\nBoos Grundbesitz GmbH & Co. KG\nKommanditgesellschaft\nMünchen\n\nDen Gläubigern der an der Verschmelzung beteiligten Rechtsträger ist, wenn sie binnen sechs Monaten nach dem Tag, an dem die Eintragung der Verschmelzung in das Register des Sitzes desjenigen Rechtsträgers, dessen Gläubiger sie sind, nach § 19 Abs. 3 UmwG als bekannt gemacht gilt, ihren Anspruch nach Grund und Höhe in Textform anmelden, Sicherheit zu leisten, soweit sie nicht Befriedigung verlangen können. Dieses Recht steht den Gläubigern jedoch nur zu, wenn sie glaubhaft machen, dass durch die Verschmelzung die Erfüllung ihrer Forderung gefährdet wird."
    },
    {
      "date": "2025-05-21",
      "id": "109695",
      "original_text": "Registerbekanntmachung nach dem Umwandlungsgesetz\nBayern Amtsgericht Würzburg HRB 6825\nRSBpro GmbH Rechner-, Software- und Betriebssystemtechnik – Karlstadt",
      "type": "Registerbekanntmachung nach dem Umwandlungsgesetz",
      "state": "Bayern",
      "amtsgericht": "Amtsgericht Würzburg",
      "registernummer": "HRB 6825",
      "registerart": "HRB",
      "company_name": "RSBpro GmbH Rechner-, Software- und Betriebssystemtechnik",
      "company_seat": "Karlstadt",
      "details": "21.05.2025 (Bekanntmachungsdatum)\n\nBayern Amtsgericht Würzburg HRB 6825\nRegisterbekanntmachung nach dem Umwandlungsgesetz 20.05.2025 (Eintragungsdatum)\n\nRSBpro GmbH Rechner-, Software- und Betriebssystemtechnik\nGesellschaft mit beschränkter Haftung\nKarlstadt\n\nDen Gläubigern der an der Verschmelzung beteiligten Rechtsträger ist, wenn sie binnen sechs Monaten nach dem Tag, an dem die Eintragung der Verschmelzung in das Register des Sitzes desjenigen Rechtsträgers, dessen Gläubiger sie sind, nach § 19 Abs. 3 UmwG als bekannt gemacht gilt, ihren Anspruch nach Grund und Höhe in Textform anmelden, Sicherheit zu leisten, soweit sie nicht Befriedigung verlangen können. Dieses Recht steht den Gläubigern jedoch nur zu, wenn sie glaubhaft machen, dass durch die Verschmelzung die Erfüllung ihrer Forderung gefährdet wird."
    },
    {
      "date": "2025-05-21",
      "id": "109696",
      "original_text": "Einreichung neuer Dokumente\nBayern Amtsgericht Kempten (Allgäu) HRB 10539\nHOCHLAND SE – Heimenkirch",
      "type": "Einreichung neuer Dokumente",
      "state": "Bayern",
      "amtsgericht": "Amtsgericht Kempten (Allgäu)",
      "registernummer": "HRB 10539",
      "registerart": "HRB",
      "company_name": "HOCHLAND SE",
      "company_seat": "Heimenkirch",
      "details": "21.05.2025 (Bekanntmachungsdatum)\n\nBayern Amtsgericht Kempten (Allgäu) HRB 10539\nEinreichung neuer Dokumente\n\nHOCHLAND SE\nEuropäische Aktiengesellschaft (SE)\nHeimenkirch\n\nDem Amtsgericht Kempten (Allgäu) -Registergericht- ist eine Liste der Mitglieder des Aufsichtsrats eingereicht worden, Art. 9 Abs. 1 Buchst. c (ii) SE-VO i.V.m. § 106 AktG."
    },
    {
      "date": "2025-05-21",
      "id": "109697",
      "original_text": "Registerbekanntmachung nach dem Umwandlungsgesetz\nBayern Amtsgericht Coburg HRB 5694\ndenkfix UG (haftungsbeschränkt) – Coburg",
      "type": "Registerbekanntmachung nach dem Umwandlungsgesetz",
      "state": "Bayern",
      "amtsgericht": "Amtsgericht Coburg",
      "registernummer": "HRB 5694",
      "registerart": "HRB",
      "company_name": "denkfix UG (haftungsbeschränkt)",
      "company_seat": "Coburg",
      "details": "21.05.2025 (Bekanntmachungsdatum)\n\nBayern Amtsgericht Coburg HRB 5694\nRegisterbekanntmachung nach dem Umwandlungsgesetz 16.05.2025 (Eintragungsdatum)\n\ndenkfix UG (haftungsbeschränkt)\nGesellschaft mit beschränkter Haftung\nCoburg\n\nDen Gläubigern der an der Verschmelzung beteiligten Rechtsträger ist, wenn sie binnen sechs Monaten nach dem Tag, an dem die Eintragung der Verschmelzung in das Register des Sitzes desjenigen Rechtsträgers, dessen Gläubiger sie sind, nach § 19 Abs. 3 UmwG als bekannt gemacht gilt, ihren Anspruch nach Grund und Höhe in Textform anmelden, Sicherheit zu leisten, soweit sie nicht Befriedigung verlangen können. Dieses Recht steht den Gläubigern jedoch nur zu, wenn sie glaubhaft machen, dass durch die Verschmelzung die Erfüllung ihrer Forderung gefährdet wird."
    },
    {
      "date": "2025-05-21",
      "id": "109698",
      "original_text": "Registerbekanntmachung nach dem Umwandlungsgesetz\nBayern Amtsgericht München HRA 89390\nBoos Immobilien und Verwaltung GmbH & Co. KG – München",
      "type": "Registerbekanntmachung nach dem Umwandlungsgesetz",
      "state": "Bayern",
      "amtsgericht": "Amtsgericht München",
      "registernummer": "HRA 89390",
      "registerart": "HRA",
      "company_name": "Boos Immobilien und Verwaltung GmbH & Co. KG",
      "company_seat": "München",
      "details": "21.05.2025 (Bekanntmachungsdatum)\n\nBayern Amtsgericht München HRA 89390\nRegisterbekanntmachung nach dem Umwandlungsgesetz 20.05.2025 (Eintragungsdatum)\n\nBoos Immobilien und Verwaltung GmbH & Co. KG\nKommanditgesellschaft\nMünchen\n\nDen Gläubigern der an der Verschmelzung beteiligten Rechtsträger ist, wenn sie binnen sechs Monaten nach dem Tag, an dem die Eintragung der Verschmelzung in das Register des Sitzes desjenigen Rechtsträgers, dessen Gläubiger sie sind, nach § 19 Abs. 3 UmwG als bekannt gemacht gilt, ihren Anspruch nach Grund und Höhe in Textform anmelden, Sicherheit zu leisten, soweit sie nicht Befriedigung verlangen können. Dieses Recht steht den Gläubigern jedoch nur zu, wenn sie glaubhaft machen, dass durch die Verschmelzung die Erfüllung ihrer Forderung gefährdet wird."
    },
    {
      "date": "2025-05-21",
      "id": "109699",
      "original_text": "Einreichung neuer Dokumente\nBayern Amtsgericht München HRB 244120\nSEDLMAYR GRUND UND IMMOBILIEN AKTIENGESELLSCHAFT – München",
      "type": "Einreichung neuer Dokumente",
      "state": "Bayern",
      "amtsgericht": "Amtsgericht München",
      "registernummer": "HRB 244120",
      "registerart": "HRB",
      "company_name": "SEDLMAYR GRUND UND IMMOBILIEN AKTIENGESELLSCHAFT",
      "company_seat": "München",
      "details": "21.05.2025 (Bekanntmachungsdatum)\n\nBayern Amtsgericht München HRB 244120\nEinreichung neuer Dokumente 20.05.2025 (Eintragungsdatum)\n\nSEDLMAYR GRUND UND IMMOBILIEN AKTIENGESELLSCHAFT\nAktiengesellschaft\nMünchen\n\nDem Amtsgericht München -Registergericht- ist eine Liste der Mitglieder des Aufsichtsrats eingereicht worden, § 106 AktG."
    },
    {
      "date": "2025-05-21",
      "id": "109700",
      "original_text": "Einreichung neuer Dokumente\nBayern Amtsgericht München HRB 150884\nSiltronic AG – München",
      "type": "Einreichung neuer Dokumente",
      "state": "Bayern",
      "amtsgericht": "Amtsgericht München",
      "registernummer": "HRB 150884",
      "registerart": "HRB",
      "company_name": "Siltronic AG",
      "company_seat": "München",
      "details": "21.05.2025 (Bekanntmachungsdatum)\n\nBayern Amtsgericht München HRB 150884\nEinreichung neuer Dokumente\n\nSiltronic AG\nAktiengesellschaft\nMünchen\n\nDem Amtsgericht München -Registergericht- ist eine Liste der Mitglieder des Aufsichtsrats eingereicht worden, § 106 AktG."
    },
    {
      "date": "2025-05-21",
      "id": "109701",
      "original_text": "Einreichung neuer Dokumente\nBayern Amtsgericht Nürnberg HRB 13174\nJost Aktiengesellschaft – Lauf a.d. Pegnitz",
      "type": "Einreichung neuer Dokumente",
      "state": "Bayern",
      "amtsgericht": "Amtsgericht Nürnberg",
      "registernummer": "HRB 13174",
      "registerart": "HRB",
      "company_name": "Jost Aktiengesellschaft",
      "company_seat": "Lauf a.d. Pegnitz",
      "details": "21.05.2025 (Bekanntmachungsdatum)\n\nBayern Amtsgericht Nürnberg HRB 13174\nEinreichung neuer Dokumente\n\nJost Aktiengesellschaft\nAktiengesellschaft\nLauf a.d. Pegnitz\n\nDem Amtsgericht Nürnberg -Registergericht- ist eine Liste der Mitglieder des Aufsichtsrats eingereicht worden, § 106 AktG."
    },
    {
      "date": "2025-05-21",
      "id": "109702",
      "original_text": "Registerbekanntmachung nach dem Umwandlungsgesetz\nBayern Amtsgericht München HRB 169422\nm3 Bauprojektmanagement GmbH – München",
      "type": "Registerbekanntmachung nach dem Umwandlungsgesetz",
      "state": "Bayern",
      "amtsgericht": "Amtsgericht München",
      "registernummer": "HRB 169422",
      "registerart": "HRB",
      "company_name": "m3 Bauprojektmanagement GmbH",
      "company_seat": "München",
      "details": "21.05.2025 (Bekanntmachungsdatum)\n\nBayern Amtsgericht München HRB 169422\nRegisterbekanntmachung nach dem Umwandlungsgesetz 20.05.2025 (Eintragungsdatum)\n\nm3 Bauprojektmanagement GmbH\nGesellschaft mit beschränkter Haftung\nMünchen\n\nDen Gläubigern der an der Verschmelzung beteiligten Rechtsträger ist, wenn sie binnen sechs Monaten nach dem Tag, an dem die Eintragung der Verschmelzung in das Register des Sitzes desjenigen Rechtsträgers, dessen Gläubiger sie sind, nach § 19 Abs. 3 UmwG als bekannt gemacht gilt, ihren Anspruch nach Grund und Höhe in Textform anmelden, Sicherheit zu leisten, soweit sie nicht Befriedigung verlangen können. Dieses Recht steht den Gläubigern jedoch nur zu, wenn sie glaubhaft machen, dass durch die Verschmelzung die Erfüllung ihrer Forderung gefährdet wird."
    },
    {
      "date": "2025-05-21",
      "id": "109703",
      "original_text": "Registerbekanntmachung nach dem Umwandlungsgesetz\nBayern Amtsgericht Nürnberg HRB 28215\nER. bahn-consulting GmbH – Nürnberg",
      "type": "Registerbekanntmachung nach dem Umwandlungsgesetz",
      "state": "Bayern",
      "amtsgericht": "Amtsgericht Nürnberg",
      "registernummer": "HRB 28215",
      "registerart": "HRB",
      "company_name": "ER. bahn-consulting GmbH",
      "company_seat": "Nürnberg",
      "details": "21.05.2025 (Bekanntmachungsdatum)\n\nBayern Amtsgericht Nürnberg HRB 28215\nRegisterbekanntmachung nach dem Umwandlungsgesetz 20.05.2025 (Eintragungsdatum)\n\nER. bahn-consulting GmbH\nGesellschaft mit beschränkter Haftung\nNürnberg\n\nDen Gläubigern der an der Spaltung beteiligten Rechtsträger ist, wenn sie binnen sechs Monaten nach dem Tag, an dem die Eintragung der Spaltung in das Register des Sitzes desjenigen Rechtsträgers, dessen Gläubiger sie sind, nach §§ 125, 19 Abs. 3 UmwG als bekannt gemacht gilt, ihren Anspruch nach Grund und Höhe in Textform anmelden, Sicherheit zu leisten, soweit sie nicht Befriedigung verlangen können. Dieses Recht steht den Gläubigern jedoch nur zu, wenn sie glaubhaft machen, dass durch die Spaltung die Erfüllung ihrer Forderung gefährdet wird."
    },
    {
      "date": "2025-05-21",
      "id": "109704",
      "original_text": "Einreichung neuer Dokumente\nBayern Amtsgericht München HRB 175695\nDeutsche Kautionskasse AG – Starnberg",
      "type": "Einreichung neuer Dokumente",
      "state": "Bayern",
      "amtsgericht": "Amtsgericht München",
      "registernummer": "HRB 175695",
      "registerart": "HRB",
      "company_name": "Deutsche Kautionskasse AG",
      "company_seat": "Starnberg",
      "details": "21.05.2025 (Bekanntmachungsdatum)\n\nBayern Amtsgericht München HRB 175695\nEinreichung neuer Dokumente\n\nDeutsche Kautionskasse AG\nAktiengesellschaft\nStarnberg\n\nDem #Re.Name ist eine Liste der Mitglieder des Aufsichtsrats eingereicht worden, § 106 AktG."
    },
    {
      "date": "2025-05-21",
      "id": "109705",
      "original_text": "Einreichung neuer Dokumente\nBayern Amtsgericht Augsburg HRB 29053\nPATRIZIA GrundInvest Kapitalverwaltungsgesellschaft mbH – Augsburg",
      "type": "Einreichung neuer Dokumente",
      "state": "Bayern",
      "amtsgericht": "Amtsgericht Augsburg",
      "registernummer": "HRB 29053",
      "registerart": "HRB",
      "company_name": "PATRIZIA GrundInvest Kapitalverwaltungsgesellschaft mbH",
      "company_seat": "Augsburg",
      "details": "21.05.2025 (Bekanntmachungsdatum)\n\nBayern Amtsgericht Augsburg HRB 29053\nEinreichung neuer Dokumente\n\nPATRIZIA GrundInvest Kapitalverwaltungsgesellschaft mbH\nGesellschaft mit beschränkter Haftung\nAugsburg\n\nDem Amtsgericht Augsburg -Registergericht- ist eine Liste der Mitglieder des Aufsichtsrats eingereicht worden, § 52 Abs. 3 S. 2 GmbHG."
    },
    {
      "date": "2025-05-21",
      "id": "109706",
      "original_text": "Einreichung neuer Dokumente\nBayern Amtsgericht München HRB 42133\nOROVIVO AG – Hallbergmoos",
      "type": "Einreichung neuer Dokumente",
      "state": "Bayern",
      "amtsgericht": "Amtsgericht München",
      "registernummer": "HRB 42133",
      "registerart": "HRB",
      "company_name": "OROVIVO AG",
      "company_seat": "Hallbergmoos",
      "details": "21.05.2025 (Bekanntmachungsdatum)\n\nBayern Amtsgericht München HRB 42133\nEinreichung neuer Dokumente\n\nOROVIVO AG\nAktiengesellschaft\nHallbergmoos\n\nDem Amtsgericht München -Registergericht- ist eine Liste der Mitglieder des Aufsichtsrats eingereicht worden, § 106 AktG."
    },
    {
      "date": "2025-05-21",
      "id": "109707",
      "original_text": "Einreichung neuer Dokumente\nBayern Amtsgericht Schweinfurt HRB 3764\nK & K Software Aktiengesellschaft – Gerolzhofen",
      "type": "Einreichung neuer Dokumente",
      "state": "Bayern",
      "amtsgericht": "Amtsgericht Schweinfurt",
      "registernummer": "HRB 3764",
      "registerart": "HRB",
      "company_name": "K & K Software Aktiengesellschaft",
      "company_seat": "Gerolzhofen",
      "details": "21.05.2025 (Bekanntmachungsdatum)\n\nBayern Amtsgericht Schweinfurt HRB 3764\nEinreichung neuer Dokumente 20.05.2025 (Eintragungsdatum)\n\nK & K Software Aktiengesellschaft\nAktiengesellschaft\nGerolzhofen\n\nDem Amtsgericht Schweinfurt -Registergericht- ist eine Liste der Mitglieder des Aufsichtsrats eingereicht worden, § 106 AktG."
    },
    {
      "date": "2025-05-21",
      "id": "109708",
      "original_text": "Einreichung neuer Dokumente\nBayern Amtsgericht München HRB 286882\nZwickRoell SE – München",
      "type": "Einreichung neuer Dokumente",
      "state": "Bayern",
      "amtsgericht": "Amtsgericht München",
      "registernummer": "HRB 286882",
      "registerart": "HRB",
      "company_name": "ZwickRoell SE",
      "company_seat": "München",
      "details": "21.05.2025 (Bekanntmachungsdatum)\n\nBayern Amtsgericht München HRB 286882\nEinreichung neuer Dokumente\n\nZwickRoell SE\nEuropäische Aktiengesellschaft (SE)\nMünchen\n\nDem Amtsgericht München -Registergericht- ist eine Liste der Mitglieder des Aufsichtsrats eingereicht worden, Art. 9 Abs. 1 Buchst. c (ii) SE-VO i.V.m. § 106 AktG."
    },
    {
      "date": "2025-05-21",
      "id": "109709",
      "original_text": "Registerbekanntmachung nach dem Umwandlungsgesetz\nBayern Amtsgericht München HRB 278613\nSMS Verwaltungs GmbH – München",
      "type": "Registerbekanntmachung nach dem Umwandlungsgesetz",
      "state": "Bayern",
      "amtsgericht": "Amtsgericht München",
      "registernummer": "HRB 278613",
      "registerart": "HRB",
      "company_name": "SMS Verwaltungs GmbH",
      "company_seat": "München",
      "details": "21.05.2025 (Bekanntmachungsdatum)\n\nBayern Amtsgericht München HRB 278613\nRegisterbekanntmachung nach dem Umwandlungsgesetz 20.05.2025 (Eintragungsdatum)\n\nSMS Verwaltungs GmbH\nGesellschaft mit beschränkter Haftung\nMünchen\n\nDen Gläubigern der an der Verschmelzung beteiligten Rechtsträger ist, wenn sie binnen sechs Monaten nach dem Tag, an dem die Eintragung der Verschmelzung in das Register des Sitzes desjenigen Rechtsträgers, dessen Gläubiger sie sind, nach § 19 Abs. 3 UmwG als bekannt gemacht gilt, ihren Anspruch nach Grund und Höhe in Textform anmelden, Sicherheit zu leisten, soweit sie nicht Befriedigung verlangen können. Dieses Recht steht den Gläubigern jedoch nur zu, wenn sie glaubhaft machen, dass durch die Verschmelzung die Erfüllung ihrer Forderung gefährdet wird."
    },
    {
      "date": "2025-05-21",
      "id": "109710",
      "original_text": "Registerbekanntmachung nach dem Umwandlungsgesetz\nBayern Amtsgericht Memmingen HRA 14257\nMarkus OESTERLE e. K. – Vöhringen",
      "type": "Registerbekanntmachung nach dem Umwandlungsgesetz",
      "state": "Bayern",
      "amtsgericht": "Amtsgericht Memmingen",
      "registernummer": "HRA 14257",
      "registerart": "HRA",
      "company_name": "Markus OESTERLE e. K.",
      "company_seat": "Vöhringen",
      "details": "21.05.2025 (Bekanntmachungsdatum)\n\nBayern Amtsgericht Memmingen HRA 14257\nRegisterbekanntmachung nach dem Umwandlungsgesetz 20.05.2025 (Eintragungsdatum)\n\nMarkus OESTERLE e. K.\nEinzelkaufmann / Einzelkauffrau\nVöhringen\n\nDen Gläubigern der an der Ausgliederung beteiligten Rechtsträger ist, wenn sie binnen sechs Monaten nach dem Tag, an dem die Eintragung der Ausgliederung in das Register des Sitzes desjenigen Rechtsträgers, dessen Gläubiger sie sind, nach §§ 125, 19 Abs. 3 UmwG als bekannt gemacht gilt, ihren Anspruch nach Grund und Höhe in Textform anmelden, Sicherheit zu leisten, soweit sie nicht Befriedigung verlangen können. Dieses Recht steht den Gläubigern jedoch nur zu, wenn sie glaubhaft machen, dass durch die Ausgliederung die Erfüllung ihrer Forderung gefährdet wird."
    },
    {
      "date": "2025-05-21",
      "id": "109711",
      "original_text": "Löschungsankündigung\nBayern Amtsgericht Kempten (Allgäu) HRB 14004\nLetscrowd GmbH – Rettenberg",
      "type": "Löschungsankündigung",
      "state": "Bayern",
      "amtsgericht": "Amtsgericht Kempten (Allgäu)",
      "registernummer": "HRB 14004",
      "registerart": "HRB",
      "company_name": "Letscrowd GmbH",
      "company_seat": "Rettenberg",
      "details": "21.05.2025 (Bekanntmachungsdatum)\n\nBayern Amtsgericht Kempten (Allgäu) HRB 14004\nLöschungsankündigung\n\nLetscrowd GmbH\nGesellschaft mit beschränkter Haftung\nRettenberg\n\nDas Registergericht beabsichtigt, die im Handelsregister eingetragene Gesellschaft wegen Vermögenslosigkeit von Amts wegen nach § 394 FamFG zu löschen. Die Frist zur Erhebung eines Widerspruchs ist auf einen Monat festgesetzt."
    },
    {
      "date": "2025-05-21",
      "id": "109712",
      "original_text": "Registerbekanntmachung nach dem Umwandlungsgesetz\nBayern Amtsgericht Fürth HRA 8955\nI. und R. Böhm Immobilien GmbH & Co. KG – Uttenreuth",
      "type": "Registerbekanntmachung nach dem Umwandlungsgesetz",
      "state": "Bayern",
      "amtsgericht": "Amtsgericht Fürth",
      "registernummer": "HRA 8955",
      "registerart": "HRA",
      "company_name": "I. und R. Böhm Immobilien GmbH & Co. KG",
      "company_seat": "Uttenreuth",
      "details": "21.05.2025 (Bekanntmachungsdatum)\n\nBayern Amtsgericht Fürth HRA 8955\nRegisterbekanntmachung nach dem Umwandlungsgesetz 20.05.2025 (Eintragungsdatum)\n\nI. und R. Böhm Immobilien GmbH & Co. KG\nKommanditgesellschaft\nUttenreuth\n\nDen Gläubigern der an der Verschmelzung beteiligten Rechtsträger ist, wenn sie binnen sechs Monaten nach dem Tag, an dem die Eintragung der Verschmelzung in das Register des Sitzes desjenigen Rechtsträgers, dessen Gläubiger sie sind, nach § 19 Abs. 3 UmwG als bekannt gemacht gilt, ihren Anspruch nach Grund und Höhe in Textform anmelden, Sicherheit zu leisten, soweit sie nicht Befriedigung verlangen können. Dieses Recht steht den Gläubigern jedoch nur zu, wenn sie glaubhaft machen, dass durch die Verschmelzung die Erfüllung ihrer Forderung gefährdet wird."
    },
    {
      "date": "2025-05-21",
      "id": "109713",
      "original_text": "Löschungsankündigung\nBayern Amtsgericht Ingolstadt HRB 4839\nTooltech Design GmbH – Ingolstadt",
      "type": "Löschungsankündigung",
      "state": "Bayern",
      "amtsgericht": "Amtsgericht Ingolstadt",
      "registernummer": "HRB 4839",
      "registerart": "HRB",
      "company_name": "Tooltech Design GmbH",
      "company_seat": "Ingolstadt",
      "details": "21.05.2025 (Bekanntmachungsdatum)\n\nBayern Amtsgericht Ingolstadt HRB 4839\nLöschungsankündigung\n\nTooltech Design GmbH\nGesellschaft mit beschränkter Haftung\nIngolstadt\n\nDas Registergericht beabsichtigt, die im Handelsregister eingetragene Gesellschaft wegen Vermögenslosigkeit von Amts wegen nach § 394 FamFG zu löschen. Die Frist zur Erhebung eines Widerspruchs ist auf einen Monat festgesetzt."
    },
    {
      "date": "2025-05-21",
      "id": "109714",
      "original_text": "Registerbekanntmachung nach dem Umwandlungsgesetz\nBayern Amtsgericht München HRB 256030\nDataciders Datalytics GmbH – München",
      "type": "Registerbekanntmachung nach dem Umwandlungsgesetz",
      "state": "Bayern",
      "amtsgericht": "Amtsgericht München",
      "registernummer": "HRB 256030",
      "registerart": "HRB",
      "company_name": "Dataciders Datalytics GmbH",
      "company_seat": "München",
      "details": "21.05.2025 (Bekanntmachungsdatum)\n\nBayern Amtsgericht München HRB 256030\nRegisterbekanntmachung nach dem Umwandlungsgesetz 20.05.2025 (Eintragungsdatum)\n\nDataciders Datalytics GmbH\nGesellschaft mit beschränkter Haftung\nMünchen\n\nDen Gläubigern der an der Verschmelzung beteiligten Rechtsträger ist, wenn sie binnen sechs Monaten nach dem Tag, an dem die Eintragung der Verschmelzung in das Register des Sitzes desjenigen Rechtsträgers, dessen Gläubiger sie sind, nach § 19 Abs. 3 UmwG als bekannt gemacht gilt, ihren Anspruch nach Grund und Höhe in Textform anmelden, Sicherheit zu leisten, soweit sie nicht Befriedigung verlangen können. Dieses Recht steht den Gläubigern jedoch nur zu, wenn sie glaubhaft machen, dass durch die Verschmelzung die Erfüllung ihrer Forderung gefährdet wird."
    },
    {
      "date": "2025-05-21",
      "id": "109715",
      "original_text": "Einreichung neuer Dokumente\nBayern Amtsgericht München HRB 132519\nSchaltbau GmbH – München",
      "type": "Einreichung neuer Dokumente",
      "state": "Bayern",
      "amtsgericht": "Amtsgericht München",
      "registernummer": "HRB 132519",
      "registerart": "HRB",
      "company_name": "Schaltbau GmbH",
      "company_seat": "München",
      "details": "21.05.2025 (Bekanntmachungsdatum)\n\nBayern Amtsgericht München HRB 132519\nEinreichung neuer Dokumente 20.05.2025 (Eintragungsdatum)\n\nSchaltbau GmbH\nGesellschaft mit beschränkter Haftung\nMünchen\n\nDem Amtsgericht München -Registergericht- ist eine Liste der Mitglieder des Aufsichtsrats eingereicht worden, § 52 Abs. 3 S. 2 GmbHG."
    },
    {
      "date": "2025-05-21",
      "id": "109716",
      "original_text": "Registerbekanntmachung nach dem Umwandlungsgesetz\nBayern Amtsgericht Memmingen HRA 13471\nOesterle Grundbesitz GmbH & Co. KG – Vöhringen",
      "type": "Registerbekanntmachung nach dem Umwandlungsgesetz",
      "state": "Bayern",
      "amtsgericht": "Amtsgericht Memmingen",
      "registernummer": "HRA 13471",
      "registerart": "HRA",
      "company_name": "Oesterle Grundbesitz GmbH & Co. KG",
      "company_seat": "Vöhringen",
      "details": "21.05.2025 (Bekanntmachungsdatum)\n\nBayern Amtsgericht Memmingen HRA 13471\nRegisterbekanntmachung nach dem Umwandlungsgesetz 20.05.2025 (Eintragungsdatum)\n\nOesterle Grundbesitz GmbH & Co. KG\nKommanditgesellschaft\nVöhringen\n\nDen Gläubigern der an der Ausgliederung beteiligten Rechtsträger ist, wenn sie binnen sechs Monaten nach dem Tag, an dem die Eintragung der Ausgliederung in das Register des Sitzes desjenigen Rechtsträgers, dessen Gläubiger sie sind, nach §§ 125, 19 Abs. 3 UmwG als bekannt gemacht gilt, ihren Anspruch nach Grund und Höhe in Textform anmelden, Sicherheit zu leisten, soweit sie nicht Befriedigung verlangen können. Dieses Recht steht den Gläubigern jedoch nur zu, wenn sie glaubhaft machen, dass durch die Ausgliederung die Erfüllung ihrer Forderung gefährdet wird."
    },
    {
      "date": "2025-05-21",
      "id": "109717",
      "original_text": "Löschungsankündigung\nBayern Amtsgericht Coburg HRB 5987\nTannen-Tante UG (haftungsbeschränkt) – Marktrodach",
      "type": "Löschungsankündigung",
      "state": "Bayern",
      "amtsgericht": "Amtsgericht Coburg",
      "registernummer": "HRB 5987",
      "registerart": "HRB",
      "company_name": "Tannen-Tante UG (haftungsbeschränkt)",
      "company_seat": "Marktrodach",
      "details": "21.05.2025 (Bekanntmachungsdatum)\n\nBayern Amtsgericht Coburg HRB 5987\nLöschungsankündigung 16.05.2025 (Eintragungsdatum)\n\nTannen-Tante UG (haftungsbeschränkt)\nGesellschaft mit beschränkter Haftung\nMarktrodach\n\nDas Registergericht beabsichtigt, die im Handelsregister eingetragene Gesellschaft wegen Vermögenslosigkeit von Amts wegen nach § 394 FamFG zu löschen. Die Frist zur Erhebung eines Widerspruchs ist auf sechs Wochen festgesetzt."
    },
    {
      "date": "2025-05-21",
      "id": "109718",
      "original_text": "Registerbekanntmachung nach dem Umwandlungsgesetz\nBayern Amtsgericht München HRA 121044\nMirjana Winklhofer e.K. – Unterhaching",
      "type": "Registerbekanntmachung nach dem Umwandlungsgesetz",
      "state": "Bayern",
      "amtsgericht": "Amtsgericht München",
      "registernummer": "HRA 121044",
      "registerart": "HRA",
      "company_name": "Mirjana Winklhofer e.K.",
      "company_seat": "Unterhaching",
      "details": "21.05.2025 (Bekanntmachungsdatum)\n\nBayern Amtsgericht München HRA 121044\nRegisterbekanntmachung nach dem Umwandlungsgesetz 20.05.2025 (Eintragungsdatum)\n\nMirjana Winklhofer e.K.\nEinzelkaufmann / Einzelkauffrau\nUnterhaching\n\nDen Gläubigern der an der Ausgliederung beteiligten Rechtsträger ist, wenn sie binnen sechs Monaten nach dem Tag, an dem die Eintragung der Ausgliederung in das Register des Sitzes desjenigen Rechtsträgers, dessen Gläubiger sie sind, nach §§ 125, 19 Abs. 3 UmwG als bekannt gemacht gilt, ihren Anspruch nach Grund und Höhe in Textform anmelden, Sicherheit zu leisten, soweit sie nicht Befriedigung verlangen können. Dieses Recht steht den Gläubigern jedoch nur zu, wenn sie glaubhaft machen, dass durch die Ausgliederung die Erfüllung ihrer Forderung gefährdet wird."
    },
    {
      "date": "2025-05-21",
      "id": "109719",
      "original_text": "Löschungsankündigung\nBaden-Württemberg Amtsgericht Mannheim HRB 721252\nSPT Dienstleistungs GmbH – Neuenbürg",
      "type": "Löschungsankündigung",
      "state": "Baden-Württemberg",
      "amtsgericht": "Amtsgericht Mannheim",
      "registernummer": "HRB 721252",
      "registerart": "HRB",
      "company_name": "SPT Dienstleistungs GmbH",
      "company_seat": "Neuenbürg",
      "details": "21.05.2025 (Bekanntmachungsdatum)\n\nBaden-Württemberg Amtsgericht Mannheim HRB 721252\nLöschungsankündigung\n\nSPT Dienstleistungs GmbH\nGesellschaft mit beschränkter Haftung\nNeuenbürg\n\nAls nicht eingetragen wird bekanntgemacht:\nDas Gericht beabsichtigt, die Gesellschaft wegen Vermögenslosigkeit im Handelsregister von Amts wegen nach § 394 FamFG zu löschen. Die Frist zur Geltendmachung eines Widerspruchs gegen die beabsichtigte Löschung ist auf einen Monat ab Veröffentlichung bestimmt."
    },
    {
      "date": "2025-05-21",
      "id": "109720",
      "original_text": "Einreichung neuer Dokumente\nSachsen-Anhalt Amtsgericht Stendal HRB 200166\nWOBAU Hohenmölsen GmbH – Hohenmölsen",
      "type": "Einreichung neuer Dokumente",
      "state": "Sachsen-Anhalt",
      "amtsgericht": "Amtsgericht Stendal",
      "registernummer": "HRB 200166",
      "registerart": "HRB",
      "company_name": "WOBAU Hohenmölsen GmbH",
      "company_seat": "Hohenmölsen",
      "details": "21.05.2025 (Bekanntmachungsdatum)\n\nSachsen-Anhalt Amtsgericht Stendal HRB 200166\nEinreichung neuer Dokumente 29.10.2024 (Eintragungsdatum)\n\nWOBAU Hohenmölsen GmbH\nGesellschaft mit beschränkter Haftung\nHohenmölsen\n\nEine Liste der Mitglieder des Aufsichtsrates wurde zum Handelsregister eingereicht."
    },
    {
      "date": "2025-05-21",
      "id": "109721",
      "original_text": "Löschungsankündigung\nBerlin Amtsgericht Berlin (Charlottenburg) HRB 160441\nHROS BROS UG (haftungsbeschränkt) – Berlin",
      "type": "Löschungsankündigung",
      "state": "Berlin",
      "amtsgericht": "Amtsgericht Berlin (Charlottenburg)",
      "registernummer": "HRB 160441",
      "registerart": "HRB",
      "company_name": "HROS BROS UG (haftungsbeschränkt)",
      "company_seat": "Berlin",
      "details": "21.05.2025 (Bekanntmachungsdatum)\n\nBerlin Amtsgericht Berlin (Charlottenburg) HRB 160441\nLöschungsankündigung\n\nHROS BROS UG (haftungsbeschränkt)\nGesellschaft mit beschränkter Haftung\nBerlin\n\nBei der nachstehenden Gesellschaft wird das Amtslöschungsverfahren gemäß § 394 FamFG eingeleitet. Widerspruchsfrist 6 Wochen"
    },
    {
      "date": "2025-05-21",
      "id": "109722",
      "original_text": "Löschungsankündigung\nBaden-Württemberg Amtsgericht Stuttgart HRB 739611\nElektro HB GmbH – Stuttgart",
      "type": "Löschungsankündigung",
      "state": "Baden-Württemberg",
      "amtsgericht": "Amtsgericht Stuttgart",
      "registernummer": "HRB 739611",
      "registerart": "HRB",
      "company_name": "Elektro HB GmbH",
      "company_seat": "Stuttgart",
      "details": "21.05.2025 (Bekanntmachungsdatum)\n\nBaden-Württemberg Amtsgericht Stuttgart HRB 739611\nLöschungsankündigung\n\nElektro HB GmbH\nGesellschaft mit beschränkter Haftung\nStuttgart\n\nAls nicht eingetragen wird bekanntgemacht:\nDas Gericht beabsichtigt, die Gesellschaft wegen Vermögenslosigkeit im Handelsregister von Amts wegen nach § 394 FamFG zu löschen. Die Frist zur Geltendmachung eines Widerspruchs gegen die beabsichtigte Löschung ist auf zwei Monate ab Veröffentlichung bestimmt."
    },
    {
      "date": "2025-05-21",
      "id": "109723",
      "original_text": "Registerbekanntmachung nach dem Umwandlungsgesetz\nBaden-Württemberg Amtsgericht Stuttgart HRB 737030\nISEC GmbH – Riederich",
      "type": "Registerbekanntmachung nach dem Umwandlungsgesetz",
      "state": "Baden-Württemberg",
      "amtsgericht": "Amtsgericht Stuttgart",
      "registernummer": "HRB 737030",
      "registerart": "HRB",
      "company_name": "ISEC GmbH",
      "company_seat": "Riederich",
      "details": "21.05.2025 (Bekanntmachungsdatum)\n\nBaden-Württemberg Amtsgericht Stuttgart HRB 737030\nRegisterbekanntmachung nach dem Umwandlungsgesetz 21.05.2025 (Eintragungsdatum)\n\nISEC GmbH\nGesellschaft mit beschränkter Haftung\nRiederich\n\nDen Gläubigern der an der Verschmelzung beteiligten Rechtsträger ist, wenn sie binnen sechs Monaten nach dem Tag, an dem die Eintragung der Verschmelzung in das Register des Sitzes desjenigen Rechtsträgers, dessen Gläubiger sie sind, nach § 19 Abs. 3 UmwG als bekanntgemacht gilt, ihren Anspruch nach Grund und Höhe schriftlich anmelden, Sicherheit zu leisten, soweit sie nicht Befriedigung verlangen können. Dieses Recht steht den Gläubigern jedoch nur zu, wenn sie glaubhaft machen, dass durch die Verschmelzung die Erfüllung ihrer Forderung gefährdet wird."
    },
    {
      "date": "2025-05-21",
      "id": "109724",
      "original_text": "Löschungsankündigung\nBerlin Amtsgericht Berlin (Charlottenburg) HRB 247352\nFKM Umbrella GmbH – Berlin",
      "type": "Löschungsankündigung",
      "state": "Berlin",
      "amtsgericht": "Amtsgericht Berlin (Charlottenburg)",
      "registernummer": "HRB 247352",
      "registerart": "HRB",
      "company_name": "FKM Umbrella GmbH",
      "company_seat": "Berlin",
      "details": "21.05.2025 (Bekanntmachungsdatum)\n\nBerlin Amtsgericht Berlin (Charlottenburg) HRB 247352\nLöschungsankündigung\n\nFKM Umbrella GmbH\nGesellschaft mit beschränkter Haftung\nBerlin\n\nBei der nachstehenden Gesellschaft wird das Amtslöschungsverfahren gemäß § 394 FamFG eingeleitet. Widerspruchsfrist 6 Wochen"
    },
    {
      "date": "2025-05-21",
      "id": "109725",
      "original_text": "Sonstige Registerbekanntmachung\nHamburg Amtsgericht Hamburg HRB 150470\nthinformatics AG – Hamburg",
      "type": "Sonstige Registerbekanntmachung",
      "state": "Hamburg",
      "amtsgericht": "Amtsgericht Hamburg",
      "registernummer": "HRB 150470",
      "registerart": "HRB",
      "company_name": "thinformatics AG",
      "company_seat": "Hamburg",
      "details": "21.05.2025 (Bekanntmachungsdatum)\n\nHamburg Amtsgericht Hamburg HRB 150470\nSonstige Registerbekanntmachung 21.05.2025 (Eintragungsdatum)\n\nthinformatics AG\nAktiengesellschaft\nHamburg\n\nAls nicht eingetragen wird bekannt gemacht: Liste des Aufsichtsrats wurde eingereicht."
    },
    {
      "date": "2025-05-21",
      "id": "109726",
      "original_text": "Löschungsankündigung\nBerlin Amtsgericht Berlin (Charlottenburg) HRB 256921\nIF BAU GmbH – Berlin",
      "type": "Löschungsankündigung",
      "state": "Berlin",
      "amtsgericht": "Amtsgericht Berlin (Charlottenburg)",
      "registernummer": "HRB 256921",
      "registerart": "HRB",
      "company_name": "IF BAU GmbH",
      "company_seat": "Berlin",
      "details": "21.05.2025 (Bekanntmachungsdatum)\n\nBerlin Amtsgericht Berlin (Charlottenburg) HRB 256921\nLöschungsankündigung\n\nIF BAU GmbH\nGesellschaft mit beschränkter Haftung\nBerlin\n\nBei der nachstehenden Gesellschaft wird das Amtslöschungsverfahren gemäß § 394 FamFG eingeleitet. Widerspruchsfrist 6 Wochen"
    },
    {
      "date": "2025-05-21",
      "id": "109727",
      "original_text": "Registerbekanntmachung nach dem Umwandlungsgesetz\nSachsen-Anhalt Amtsgericht Stendal HRB 16486\nmibe GmbH Arzneimittel – Sandersdorf-Brehna",
      "type": "Registerbekanntmachung nach dem Umwandlungsgesetz",
      "state": "Sachsen-Anhalt",
      "amtsgericht": "Amtsgericht Stendal",
      "registernummer": "HRB 16486",
      "registerart": "HRB",
      "company_name": "mibe GmbH Arzneimittel",
      "company_seat": "Sandersdorf-Brehna",
      "details": "21.05.2025 (Bekanntmachungsdatum)\n\nSachsen-Anhalt Amtsgericht Stendal HRB 16486\nRegisterbekanntmachung nach dem Umwandlungsgesetz 21.05.2025 (Eintragungsdatum)\n\nmibe GmbH Arzneimittel\nGesellschaft mit beschränkter Haftung\nSandersdorf-Brehna\n\nNicht eingetragen:\nDen Gläubigern der an der Verschmelzung beteiligten Rechtsträger ist, wenn sie binnen sechs Monaten nach dem Tag, an dem die Eintragung der Verschmelzung nach § 19 Abs. 3 UmwG als bekanntgemacht gilt, ihren Anspruch nach Grund und Höhe schriftlich anmelden, Sicherheit zu leisten, soweit sie nicht Befriedigung verlangen können. Dieses Recht steht ihnen jedoch nur zu, wenn sie glaubhaft machen, dass durch die Verschmelzung die Erfüllung ihrer Forderung gefährdet wird."
    },
    {
      "date": "2025-05-21",
      "id": "109728",
      "original_text": "Einreichung neuer Dokumente\nBaden-Württemberg Amtsgericht Stuttgart HRB 440649\nHomag Group AG – Schopfloch",
      "type": "Einreichung neuer Dokumente",
      "state": "Baden-Württemberg",
      "amtsgericht": "Amtsgericht Stuttgart",
      "registernummer": "HRB 440649",
      "registerart": "HRB",
      "company_name": "Homag Group AG",
      "company_seat": "Schopfloch",
      "details": "21.05.2025 (Bekanntmachungsdatum)\n\nBaden-Württemberg Amtsgericht Stuttgart HRB 440649\nEinreichung neuer Dokumente 19.05.2025 (Eintragungsdatum)\n\nHomag Group AG\nAktiengesellschaft\nSchopfloch\n\nDie Gesellschaft hat am 20.05.2025 die Liste über die Zusammensetzung des Aufsichtsrats zum Handelsregister eingereicht."
    },
    {
      "date": "2025-05-21",
      "id": "109729",
      "original_text": "Einreichung neuer Dokumente\nBaden-Württemberg Amtsgericht Freiburg HRB 7575\nGreiff Capital Management AG – Freiburg im Breisgau",
      "type": "Einreichung neuer Dokumente",
      "state": "Baden-Württemberg",
      "amtsgericht": "Amtsgericht Freiburg",
      "registernummer": "HRB 7575",
      "registerart": "HRB",
      "company_name": "Greiff Capital Management AG",
      "company_seat": "Freiburg im Breisgau",
      "details": "21.05.2025 (Bekanntmachungsdatum)\n\nBaden-Württemberg Amtsgericht Freiburg HRB 7575\nEinreichung neuer Dokumente\n\nGreiff Capital Management AG\nAktiengesellschaft\nFreiburg im Breisgau\n\nDie Gesellschaft hat am 19.05.2025 die Liste über die Zusammensetzung des Aufsichtsrats zum Handelsregister eingereicht."
    },
    {
      "date": "2025-05-21",
      "id": "109730",
      "original_text": "Registerbekanntmachung nach dem Umwandlungsgesetz\nSachsen-Anhalt Amtsgericht Stendal HRB 35058\nSparStromundGas GmbH – Halle (Saale)",
      "type": "Registerbekanntmachung nach dem Umwandlungsgesetz",
      "state": "Sachsen-Anhalt",
      "amtsgericht": "Amtsgericht Stendal",
      "registernummer": "HRB 35058",
      "registerart": "HRB",
      "company_name": "SparStromundGas GmbH",
      "company_seat": "Halle (Saale)",
      "details": "21.05.2025 (Bekanntmachungsdatum)\n\nSachsen-Anhalt Amtsgericht Stendal HRB 35058\nRegisterbekanntmachung nach dem Umwandlungsgesetz 21.05.2025 (Eintragungsdatum)\n\nSparStromundGas GmbH\nGesellschaft mit beschränkter Haftung\nHalle (Saale)\n\nDie Gesellschafterversammlung vom 25.02.2025 hat die Erhöhung des Stammkapitals um 200,00 EUR auf 25.200,00 EUR zum Zwecke der Ausgliederung des einzelkaufmännischen Unternehmens \"Omer Shersad Dienstleistung e.K.\" mit dem Sitz in Hamburg (Amtsgericht Hamburg HRA 131719) aus dem Vermögen des Inhabers Omer Shersad, * 14.06.1999, wohnhaft in Hamburg, und die Änderung des § 5 (Stammkapital) beschlossen. Die Ausgliederung wurde am 19.05.2025 im Register der übertragenden Rechtsträgers eingetragen (siehe Amtsgericht Hamburg HRA 131719). Nicht eingetragen: Den Gläubigern der an der Ausgliederung beteiligten Rechtsträger, ist wenn sie binnen sechs Monaten nach dem Tag, an dem die Eintragung der Ausgliederung nach §§125, 19 Abs. 3 UmwG als bekanntgemacht gilt, ihren Anspruch nach Grund und Höhe schriftlich anmelden, Sicherheit zu leisten, soweit sie nicht Befriedigung verlangen können. Diese Recht steht ihnen jedoch nur zu, wenn sie glaubhaft machen, dass durch die Ausgliederung die Erfüllung ihrer Forderung gefährdet wird."
    },
    {
      "date": "2025-05-21",
      "id": "109731",
      "original_text": "Registerbekanntmachung nach dem Umwandlungsgesetz\nSchleswig-Holstein Amtsgericht Lübeck HRB 8266\n1. VA-Beteiligungsgesellschaft mbH – Mölln",
      "type": "Registerbekanntmachung nach dem Umwandlungsgesetz",
      "state": "Schleswig-Holstein",
      "amtsgericht": "Amtsgericht Lübeck",
      "registernummer": "HRB 8266",
      "registerart": "HRB",
      "company_name": "1. VA-Beteiligungsgesellschaft mbH",
      "company_seat": "Mölln",
      "details": "21.05.2025 (Bekanntmachungsdatum)\n\nSchleswig-Holstein Amtsgericht Lübeck HRB 8266\nRegisterbekanntmachung nach dem Umwandlungsgesetz 20.05.2025 (Eintragungsdatum)\n\n1. VA-Beteiligungsgesellschaft mbH\nGesellschaft mit beschränkter Haftung\nMölln\n\nZu Eintragungsnummer 9 vom 20.05.2025 wird als nicht eingetragen veröffentlicht:  Den Gläubigern der an der Verschmelzung beteiligten Rechtsträger ist, wenn sie binnen sechs Monaten nach dem Tag, an dem die Eintragung der Verschmelzung in das Register des Sitzes desjenigen Rechtsträgers, dessen Gläubiger sie sind, als bekannt gemacht gilt, ihren Anspruch nach Grund und Höhe schriftlich anmelden, Sicherheit zu leisten, soweit sie nicht Befriedigung verlangen können. Dieses Recht steht den Gläubigern jedoch nur zu, wenn sie glaubhaft machen, dass durch die Verschmelzung die Erfüllung ihrer Forderung gefährdet wird."
    },
    {
      "date": "2025-05-21",
      "id": "109732",
      "original_text": "Einreichung neuer Dokumente\nBaden-Württemberg Amtsgericht Stuttgart HRB 751918\nFilderstadt Netze GmbH – Filderstadt",
      "type": "Einreichung neuer Dokumente",
      "state": "Baden-Württemberg",
      "amtsgericht": "Amtsgericht Stuttgart",
      "registernummer": "HRB 751918",
      "registerart": "HRB",
      "company_name": "Filderstadt Netze GmbH",
      "company_seat": "Filderstadt",
      "details": "21.05.2025 (Bekanntmachungsdatum)\n\nBaden-Württemberg Amtsgericht Stuttgart HRB 751918\nEinreichung neuer Dokumente\n\nFilderstadt Netze GmbH\nGesellschaft mit beschränkter Haftung\nFilderstadt\n\nDie Gesellschaft hat am 20.05.2025 die Liste über die Zusammensetzung des Aufsichtsrats zum Handelsregister eingereicht."
    },
    {
      "date": "2025-05-21",
      "id": "109733",
      "original_text": "Registerbekanntmachung nach dem Umwandlungsgesetz\nBaden-Württemberg Amtsgericht Freiburg HRB 718385\nAOX Group GmbH – Villingen-Schwenningen",
      "type": "Registerbekanntmachung nach dem Umwandlungsgesetz",
      "state": "Baden-Württemberg",
      "amtsgericht": "Amtsgericht Freiburg",
      "registernummer": "HRB 718385",
      "registerart": "HRB",
      "company_name": "AOX Group GmbH",
      "company_seat": "Villingen-Schwenningen",
      "details": "21.05.2025 (Bekanntmachungsdatum)\n\nBaden-Württemberg Amtsgericht Freiburg HRB 718385\nRegisterbekanntmachung nach dem Umwandlungsgesetz 21.05.2025 (Eintragungsdatum)\n\nAOX Group GmbH\nGesellschaft mit beschränkter Haftung\nVillingen-Schwenningen\n\nAls nicht eingetragen wird bekanntgemacht:\nDen Gläubigern der an der Verschmelzung beteiligten Rechtsträger ist, wenn sie binnen sechs Monaten nach dem Tag, an dem die Eintragung der Verschmelzung in das Register des Sitzes desjenigen Rechtsträgers, dessen Gläubiger sie sind, nach § 19 Abs. 3 UmwG als bekanntgemacht gilt, ihren Anspruch nach Grund und Höhe schriftlich anmelden, Sicherheit zu leisten, soweit sie nicht Befriedigung verlangen können. Dieses Recht steht den Gläubigern jedoch nur zu, wenn sie glaubhaft machen, dass durch die Verschmelzung die Erfüllung ihrer Forderung gefährdet wird."
    },
    {
      "date": "2025-05-21",
      "id": "109734",
      "original_text": "Registerbekanntmachung nach dem Umwandlungsgesetz\nBaden-Württemberg Amtsgericht Freiburg HRB 722631\nAOX Drive GmbH – Villingen-Schwenningen",
      "type": "Registerbekanntmachung nach dem Umwandlungsgesetz",
      "state": "Baden-Württemberg",
      "amtsgericht": "Amtsgericht Freiburg",
      "registernummer": "HRB 722631",
      "registerart": "HRB",
      "company_name": "AOX Drive GmbH",
      "company_seat": "Villingen-Schwenningen",
      "details": "21.05.2025 (Bekanntmachungsdatum)\n\nBaden-Württemberg Amtsgericht Freiburg HRB 722631\nRegisterbekanntmachung nach dem Umwandlungsgesetz 21.05.2025 (Eintragungsdatum)\n\nAOX Drive GmbH\nGesellschaft mit beschränkter Haftung\nVillingen-Schwenningen\n\nAls nicht eingetragen wird bekanntgemacht:\nDen Gläubigern der an der Verschmelzung beteiligten Rechtsträger ist, wenn sie binnen sechs Monaten nach dem Tag, an dem die Eintragung der Verschmelzung in das Register des Sitzes desjenigen Rechtsträgers, dessen Gläubiger sie sind, nach § 19 Abs. 3 UmwG als bekanntgemacht gilt, ihren Anspruch nach Grund und Höhe schriftlich anmelden, Sicherheit zu leisten, soweit sie nicht Befriedigung verlangen können. Dieses Recht steht den Gläubigern jedoch nur zu, wenn sie glaubhaft machen, dass durch die Verschmelzung die Erfüllung ihrer Forderung gefährdet wird."
    },
    {
      "date": "2025-05-21",
      "id": "109735",
      "original_text": "Einreichung neuer Dokumente\nBaden-Württemberg Amtsgericht Ulm HRB 551792\nOberschwabenklinik gGmbH – Ravensburg",
      "type": "Einreichung neuer Dokumente",
      "state": "Baden-Württemberg",
      "amtsgericht": "Amtsgericht Ulm",
      "registernummer": "HRB 551792",
      "registerart": "HRB",
      "company_name": "Oberschwabenklinik gGmbH",
      "company_seat": "Ravensburg",
      "details": "21.05.2025 (Bekanntmachungsdatum)\n\nBaden-Württemberg Amtsgericht Ulm HRB 551792\nEinreichung neuer Dokumente\n\nOberschwabenklinik gGmbH\nGesellschaft mit beschränkter Haftung\nRavensburg\n\nDie Gesellschaft hat am 19.05.2025 die Liste über die Zusammensetzung des Aufsichtsrats zum Handelsregister eingereicht."
    },
    {
      "date": "2025-05-21",
      "id": "109736",
      "original_text": "Einreichung neuer Dokumente\nBaden-Württemberg Amtsgericht Ulm HRB 551792\nOberschwabenklinik gGmbH – Ravensburg",
      "type": "Einreichung neuer Dokumente",
      "state": "Baden-Württemberg",
      "amtsgericht": "Amtsgericht Ulm",
      "registernummer": "HRB 551792",
      "registerart": "HRB",
      "company_name": "Oberschwabenklinik gGmbH",
      "company_seat": "Ravensburg",
      "details": "21.05.2025 (Bekanntmachungsdatum)\n\nBaden-Württemberg Amtsgericht Ulm HRB 551792\nEinreichung neuer Dokumente\n\nOberschwabenklinik gGmbH\nGesellschaft mit beschränkter Haftung\nRavensburg\n\nDie Gesellschaft hat am 05.05.2025 die Liste über die Zusammensetzung des Aufsichtsrats zum Handelsregister eingereicht."
    },
    {
      "date": "2025-05-21",
      "id": "109737",
      "original_text": "Registerbekanntmachung nach dem Umwandlungsgesetz\nHamburg Amtsgericht Hamburg HRA 131923\nGARBE Immobilien-Projektentwicklung GmbH & Co. KG – Hamburg",
      "type": "Registerbekanntmachung nach dem Umwandlungsgesetz",
      "state": "Hamburg",
      "amtsgericht": "Amtsgericht Hamburg",
      "registernummer": "HRA 131923",
      "registerart": "HRA",
      "company_name": "GARBE Immobilien-Projektentwicklung GmbH & Co. KG",
      "company_seat": "Hamburg",
      "details": "21.05.2025 (Bekanntmachungsdatum)\n\nHamburg Amtsgericht Hamburg HRA 131923\nRegisterbekanntmachung nach dem Umwandlungsgesetz 21.05.2025 (Eintragungsdatum)\n\nGARBE Immobilien-Projektentwicklung GmbH & Co. KG\nKommanditgesellschaft\nHamburg\n\nAls nicht eingetragen wird bekannt gemacht:\nDen Gläubigern der an der Ausgliederung beteiligten Gesellschaften ist, wenn sie binnen sechs Monaten nach dem Tag, an dem die Eintragung der Ausgliederung in das Register des Sitzes desjenigen Rechtsträgers, dessen Gläubiger sie sind, nach § 19 Absatz 3 UmwG als bekannt gemacht gilt, ihren Anspruch nach Grund und Höhe schriftlich anmelden, Sicherheit zu leisten, soweit sie nicht Befriedigung verlangen können. Dieses Recht steht den Gläubigern jedoch nur zu, wenn sie glaubhaft machen, dass durch die Ausgliederung die Erfüllung ihrer Forderung gefährdet wird."
    },
    {
      "date": "2025-05-21",
      "id": "109738",
      "original_text": "Registerbekanntmachung nach dem Umwandlungsgesetz\nHamburg Amtsgericht Hamburg HRB 125672\nGarbe Immobilien-Projekte GmbH – Hamburg",
      "type": "Registerbekanntmachung nach dem Umwandlungsgesetz",
      "state": "Hamburg",
      "amtsgericht": "Amtsgericht Hamburg",
      "registernummer": "HRB 125672",
      "registerart": "HRB",
      "company_name": "Garbe Immobilien-Projekte GmbH",
      "company_seat": "Hamburg",
      "details": "21.05.2025 (Bekanntmachungsdatum)\n\nHamburg Amtsgericht Hamburg HRB 125672\nRegisterbekanntmachung nach dem Umwandlungsgesetz 21.05.2025 (Eintragungsdatum)\n\nGarbe Immobilien-Projekte GmbH\nGesellschaft mit beschränkter Haftung\nHamburg\n\nAls nicht eingetragen wird bekannt gemacht:\nDen Gläubigern der an der Ausgliederung beteiligten Gesellschaften ist, wenn sie binnen sechs Monaten nach dem Tag, an dem die Eintragung der Ausgliederung in das Register des Sitzes desjenigen Rechtsträgers, dessen Gläubiger sie sind, nach § 19 Absatz 3 UmwG als bekannt gemacht gilt, ihren Anspruch nach Grund und Höhe schriftlich anmelden, Sicherheit zu leisten, soweit sie nicht Befriedigung verlangen können. Dieses Recht steht den Gläubigern jedoch nur zu, wenn sie glaubhaft machen, dass durch die Ausgliederung die Erfüllung ihrer Forderung gefährdet wird."
    },
    {
      "date": "2025-05-21",
      "id": "109739",
      "original_text": "Registerbekanntmachung nach dem Umwandlungsgesetz\nSachsen-Anhalt Amtsgericht Stendal HRB 13307\nHARALD BUSCH & CO. GMBH – Köthen (Anhalt)",
      "type": "Registerbekanntmachung nach dem Umwandlungsgesetz",
      "state": "Sachsen-Anhalt",
      "amtsgericht": "Amtsgericht Stendal",
      "registernummer": "HRB 13307",
      "registerart": "HRB",
      "company_name": "HARALD BUSCH & CO. GMBH",
      "company_seat": "Köthen (Anhalt)",
      "details": "21.05.2025 (Bekanntmachungsdatum)\n\nSachsen-Anhalt Amtsgericht Stendal HRB 13307\nRegisterbekanntmachung nach dem Umwandlungsgesetz 21.05.2025 (Eintragungsdatum)\n\nHARALD BUSCH & CO. GMBH\nGesellschaft mit beschränkter Haftung\nKöthen (Anhalt)\n\nDie Gesellschaft ist auf Grund des Verschmelzungsvertrages vom 15.05.2025 sowie des Beschlusses der Gesellschafterversammlung vom selben Tag mit dem Vermögen des Alleingesellschafters Busch Harald, Köthen (Anhalt), *20.03.1956 verschmolzen. Nicht eingetragen: Den Gläubigern der an der Verschmelzung beteiligten Rechtsträger ist, wenn sie binnen sechs Monaten nach dem Tag, an dem die Eintragung der Verschmelzung nach § 19 Abs. 3 UmwG als bekanntgemacht gilt, ihren Anspruch nach Grund und Höhe schriftlich anmelden, Sicherheit zu leisten, soweit sie nicht Befriedigung verlangen können. Dieses Recht steht ihnen jedoch nur zu, wenn sie glaubhaft machen, dass durch die Verschmelzung die Erfüllung ihrer Forderung gefährdet wird."
    },
    {
      "date": "2025-05-21",
      "id": "109740",
      "original_text": "Registerbekanntmachung nach dem Umwandlungsgesetz\nBerlin Amtsgericht Berlin (Charlottenburg) HRB 222001\nBrillant Maler GmbH – Berlin",
      "type": "Registerbekanntmachung nach dem Umwandlungsgesetz",
      "state": "Berlin",
      "amtsgericht": "Amtsgericht Berlin (Charlottenburg)",
      "registernummer": "HRB 222001",
      "registerart": "HRB",
      "company_name": "Brillant Maler GmbH",
      "company_seat": "Berlin",
      "details": "21.05.2025 (Bekanntmachungsdatum)\n\nBerlin Amtsgericht Berlin (Charlottenburg) HRB 222001\nRegisterbekanntmachung nach dem Umwandlungsgesetz 19.05.2025 (Eintragungsdatum)\n\nBrillant Maler GmbH\nGesellschaft mit beschränkter Haftung\nBerlin\n\nZu Eintragungsnummer 2 vom 19.05.2025 wird als nicht eingetragen veröffentlicht: Den Gläubigern der an der Verschmelzung beteiligten Rechtsträger ist, wenn sie binnen sechs Monaten nach dem Tag, an dem die Eintragung der Verschmelzung in das Register des Sitzes desjenigen Rechtsträgers, dessen Gläubiger sie sind, als bekannt gemacht gilt, ihren Anspruch nach Grund und Höhe schriftlich anmelden, Sicherheit zu leisten, soweit sie nicht Befriedigung verlangen können. Dieses Recht steht den Gläubigern jedoch nur zu, wenn sie glaubhaft machen, dass durch die Verschmelzung die Erfüllung ihrer Forderung gefährdet wird. Das Recht, Sicherheitsleistung zu verlangen, steht Gläubigern nicht zu, die im Falle der Insolvenz ein Recht auf vorzugsweise Befriedigung aus einer Deckungsmasse haben, die nach gesetzlicher Vorschrift zu ihrem Schutz errichtet und staatlich überwacht ist."
    },
    {
      "date": "2025-05-21",
      "id": "109741",
      "original_text": "Einreichung neuer Dokumente\nBerlin Amtsgericht Berlin (Charlottenburg) HRB 86005\nver.di Service GmbH – Berlin",
      "type": "Einreichung neuer Dokumente",
      "state": "Berlin",
      "amtsgericht": "Amtsgericht Berlin (Charlottenburg)",
      "registernummer": "HRB 86005",
      "registerart": "HRB",
      "company_name": "ver.di Service GmbH",
      "company_seat": "Berlin",
      "details": "21.05.2025 (Bekanntmachungsdatum)\n\nBerlin Amtsgericht Berlin (Charlottenburg) HRB 86005\nEinreichung neuer Dokumente\n\nver.di Service GmbH\nGesellschaft mit beschränkter Haftung\nBerlin\n\nAls nicht eingetragen wird veröffentlicht: Es wurde eine neue Liste der Aufsichtsratsmitglieder eingereicht (§52 GmbHG)."
    },
    {
      "date": "2025-05-21",
      "id": "109742",
      "original_text": "Registerbekanntmachung nach dem Umwandlungsgesetz\nBerlin Amtsgericht Berlin (Charlottenburg) HRA 57826\nNeXtWind Windpark Beteiligung II GmbH & Co. KG – Berlin",
      "type": "Registerbekanntmachung nach dem Umwandlungsgesetz",
      "state": "Berlin",
      "amtsgericht": "Amtsgericht Berlin (Charlottenburg)",
      "registernummer": "HRA 57826",
      "registerart": "HRA",
      "company_name": "NeXtWind Windpark Beteiligung II GmbH & Co. KG",
      "company_seat": "Berlin",
      "details": "21.05.2025 (Bekanntmachungsdatum)\n\nBerlin Amtsgericht Berlin (Charlottenburg) HRA 57826\nRegisterbekanntmachung nach dem Umwandlungsgesetz 20.05.2025 (Eintragungsdatum)\n\nNeXtWind Windpark Beteiligung II GmbH & Co. KG\nKommanditgesellschaft\nBerlin\n\nZu Eintragungsnummer 6 vom 20.05.2025 wird als nicht eingetragen veröffentlicht: Den Gläubigern der an der Spaltung beteiligten Rechtsträger ist, wenn sie binnen sechs Monaten nach dem Tag, an dem die Eintragung der Spaltung in das Register des Sitzes desjenigen Rechtsträgers, dessen Gläubiger sie sind, als bekannt gemacht gilt, ihren Anspruch nach Grund und Höhe schriftlich anmelden, Sicherheit zu leisten, soweit sie nicht Befriedigung verlangen können. Dieses Recht steht den Gläubigern jedoch nur zu, wenn sie glaubhaft machen, dass durch die Spaltung die Erfüllung ihrer Forderung gefährdet wird. Das Recht, Sicherheitsleistung zu verlangen, steht Gläubigern nicht zu, die im Falle der Insolvenz ein Recht auf vorzugsweise Befriedigung aus einer Deckungsmasse haben, die nach gesetzlicher Vorschrift zu ihrem Schutz errichtet und staatlich überwacht ist."
    },
    {
      "date": "2025-05-21",
      "id": "109743",
      "original_text": "Registerbekanntmachung nach dem Umwandlungsgesetz\nBaden-Württemberg Amtsgericht Ulm HRB 742977\nJMV Hydro Beteiligungen GmbH – Heidenheim an der Brenz",
      "type": "Registerbekanntmachung nach dem Umwandlungsgesetz",
      "state": "Baden-Württemberg",
      "amtsgericht": "Amtsgericht Ulm",
      "registernummer": "HRB 742977",
      "registerart": "HRB",
      "company_name": "JMV Hydro Beteiligungen GmbH",
      "company_seat": "Heidenheim an der Brenz",
      "details": "21.05.2025 (Bekanntmachungsdatum)\n\nBaden-Württemberg Amtsgericht Ulm HRB 742977\nRegisterbekanntmachung nach dem Umwandlungsgesetz 21.05.2025 (Eintragungsdatum)\n\nJMV Hydro Beteiligungen GmbH\nGesellschaft mit beschränkter Haftung\nHeidenheim an der Brenz\n\nAls nicht eingetragen wird bekanntgemacht:\nDen Gläubigern der an der Verschmelzung beteiligten Rechtsträger ist, wenn sie binnen sechs Monaten nach dem Tag, an dem die Eintragung der Verschmelzung in das Register des Sitzes desjenigen Rechtsträgers, dessen Gläubiger sie sind, nach § 19 Abs. 3 UmwG als bekanntgemacht gilt, ihren Anspruch nach Grund und Höhe schriftlich anmelden, Sicherheit zu leisten, soweit sie nicht Befriedigung verlangen können. Dieses Recht steht den Gläubigern jedoch nur zu, wenn sie glaubhaft machen, dass durch die Verschmelzung die Erfüllung ihrer Forderung gefährdet wird."
    },
    {
      "date": "2025-05-21",
      "id": "109744",
      "original_text": "Registerbekanntmachung nach dem Umwandlungsgesetz\nBaden-Württemberg Amtsgericht Ulm HRB 661424\nVoith Hydro Beteiligungen GmbH – Heidenheim an der Brenz",
      "type": "Registerbekanntmachung nach dem Umwandlungsgesetz",
      "state": "Baden-Württemberg",
      "amtsgericht": "Amtsgericht Ulm",
      "registernummer": "HRB 661424",
      "registerart": "HRB",
      "company_name": "Voith Hydro Beteiligungen GmbH",
      "company_seat": "Heidenheim an der Brenz",
      "details": "21.05.2025 (Bekanntmachungsdatum)\n\nBaden-Württemberg Amtsgericht Ulm HRB 661424\nRegisterbekanntmachung nach dem Umwandlungsgesetz 21.05.2025 (Eintragungsdatum)\n\nVoith Hydro Beteiligungen GmbH\nGesellschaft mit beschränkter Haftung\nHeidenheim an der Brenz\n\nAls nicht eingetragen wird bekanntgemacht:\nDen Gläubigern der an der Verschmelzung beteiligten Rechtsträger ist, wenn sie binnen sechs Monaten nach dem Tag, an dem die Eintragung der Verschmelzung in das Register des Sitzes desjenigen Rechtsträgers, dessen Gläubiger sie sind, nach § 19 Abs. 3 UmwG als bekanntgemacht gilt, ihren Anspruch nach Grund und Höhe schriftlich anmelden, Sicherheit zu leisten, soweit sie nicht Befriedigung verlangen können. Dieses Recht steht den Gläubigern jedoch nur zu, wenn sie glaubhaft machen, dass durch die Verschmelzung die Erfüllung ihrer Forderung gefährdet wird."
    },
    {
      "date": "2025-05-21",
      "id": "109745",
      "original_text": "Registerbekanntmachung nach dem Umwandlungsgesetz\nBerlin Amtsgericht Berlin (Charlottenburg) HRA 62219\nNeXtWind Windpark Beteiligung 28 GmbH & Co. KG – Berlin",
      "type": "Registerbekanntmachung nach dem Umwandlungsgesetz",
      "state": "Berlin",
      "amtsgericht": "Amtsgericht Berlin (Charlottenburg)",
      "registernummer": "HRA 62219",
      "registerart": "HRA",
      "company_name": "NeXtWind Windpark Beteiligung 28 GmbH & Co. KG",
      "company_seat": "Berlin",
      "details": "21.05.2025 (Bekanntmachungsdatum)\n\nBerlin Amtsgericht Berlin (Charlottenburg) HRA 62219\nRegisterbekanntmachung nach dem Umwandlungsgesetz 20.05.2025 (Eintragungsdatum)\n\nNeXtWind Windpark Beteiligung 28 GmbH & Co. KG\nKommanditgesellschaft\nBerlin\n\nZu Eintragungsnummer 3 vom 20.05.2025 wird als nicht eingetragen veröffentlicht: Den Gläubigern der an der Spaltung beteiligten Rechtsträger ist, wenn sie binnen sechs Monaten nach dem Tag, an dem die Eintragung der Spaltung in das Register des Sitzes desjenigen Rechtsträgers, dessen Gläubiger sie sind, als bekannt gemacht gilt, ihren Anspruch nach Grund und Höhe schriftlich anmelden, Sicherheit zu leisten, soweit sie nicht Befriedigung verlangen können. Dieses Recht steht den Gläubigern jedoch nur zu, wenn sie glaubhaft machen, dass durch die Spaltung die Erfüllung ihrer Forderung gefährdet wird. Das Recht, Sicherheitsleistung zu verlangen, steht Gläubigern nicht zu, die im Falle der Insolvenz ein Recht auf vorzugsweise Befriedigung aus einer Deckungsmasse haben, die nach gesetzlicher Vorschrift zu ihrem Schutz errichtet und staatlich überwacht ist."
    },
    {
      "date": "2025-05-21",
      "id": "109746",
      "original_text": "Einreichung neuer Dokumente\nBaden-Württemberg Amtsgericht Mannheim HRB 6817\nconfern Möbeltransportbetriebe GmbH – Mannheim",
      "type": "Einreichung neuer Dokumente",
      "state": "Baden-Württemberg",
      "amtsgericht": "Amtsgericht Mannheim",
      "registernummer": "HRB 6817",
      "registerart": "HRB",
      "company_name": "confern Möbeltransportbetriebe GmbH",
      "company_seat": "Mannheim",
      "details": "21.05.2025 (Bekanntmachungsdatum)\n\nBaden-Württemberg Amtsgericht Mannheim HRB 6817\nEinreichung neuer Dokumente\n\nconfern Möbeltransportbetriebe GmbH\nGesellschaft mit beschränkter Haftung\nMannheim\n\nDie Gesellschaft hat am 20.05.2025 die Liste über die Zusammensetzung des Aufsichtsrats zum Handelsregister eingereicht."
    },
    {
      "date": "2025-05-21",
      "id": "109747",
      "original_text": "Registerbekanntmachung nach dem Umwandlungsgesetz\nSachsen-Anhalt Amtsgericht Stendal VR 10076\nVerband der Bausachverständigen des Landes Sachsen-Anhalt e.V. – Magdeburg",
      "type": "Registerbekanntmachung nach dem Umwandlungsgesetz",
      "state": "Sachsen-Anhalt",
      "amtsgericht": "Amtsgericht Stendal",
      "registernummer": "VR 10076",
      "registerart": "VR",
      "company_name": "Verband der Bausachverständigen des Landes Sachsen-Anhalt e.V.",
      "company_seat": "Magdeburg",
      "details": "21.05.2025 (Bekanntmachungsdatum)\n\nSachsen-Anhalt Amtsgericht Stendal VR 10076\nRegisterbekanntmachung nach dem Umwandlungsgesetz 21.05.2025 (Eintragungsdatum)\n\nVerband der Bausachverständigen des Landes Sachsen-Anhalt e.V.\neingetragener Verein\nMagdeburg\n\nNicht eingetragen:\nDen Gläubigern der an der Verschmelzung beteiligten Rechtsträger ist, wenn sie binnen sechs Monaten nach dem Tag, an dem die Eintragung der Verschmelzung nach § 19 Abs. 3 UmwG als bekanntgemacht gilt, ihren Anspruch nach Grund und Höhe schriftlich anmelden, Sicherheit zu leisten, soweit sie nicht Befriedigung verlangen können. Dieses Recht steht ihnen jedoch nur zu, wenn sie glaubhaft machen, dass durch die Verschmelzung die Erfüllung ihrer Forderung gefährdet wird."
    },
    {
      "date": "2025-05-21",
      "id": "109748",
      "original_text": "Registerbekanntmachung nach dem Umwandlungsgesetz\nSachsen-Anhalt Amtsgericht Stendal VR 49438\nVerband der Sachverständigen für Immobilienbewertung Sachsen-Anhalt e.V. – Bitterfeld",
      "type": "Registerbekanntmachung nach dem Umwandlungsgesetz",
      "state": "Sachsen-Anhalt",
      "amtsgericht": "Amtsgericht Stendal",
      "registernummer": "VR 49438",
      "registerart": "VR",
      "company_name": "Verband der Sachverständigen für Immobilienbewertung Sachsen-Anhalt e.V.",
      "company_seat": "Bitterfeld",
      "details": "21.05.2025 (Bekanntmachungsdatum)\n\nSachsen-Anhalt Amtsgericht Stendal VR 49438\nRegisterbekanntmachung nach dem Umwandlungsgesetz 21.05.2025 (Eintragungsdatum)\n\nVerband der Sachverständigen für Immobilienbewertung Sachsen-Anhalt e.V.\neingetragener Verein\nBitterfeld\n\nNicht eingetragen:\nDen Gläubigern der an der Verschmelzung beteiligten Rechtsträger ist, wenn sie binnen sechs Monaten nach dem Tag, an dem die Eintragung der Verschmelzung nach § 19 Abs. 3 UmwG als bekanntgemacht gilt, ihren Anspruch nach Grund und Höhe schriftlich anmelden, Sicherheit zu leisten, soweit sie nicht Befriedigung verlangen können. Dieses Recht steht ihnen jedoch nur zu, wenn sie glaubhaft machen, dass durch die Verschmelzung die Erfüllung ihrer Forderung gefährdet wird."
    },
    {
      "date": "2025-05-21",
      "id": "109749",
      "original_text": "Löschungsankündigung\nBerlin Amtsgericht Berlin (Charlottenburg) HRB 224013\nLaskaja Generalbau GmbH – Berlin",
      "type": "Löschungsankündigung",
      "state": "Berlin",
      "amtsgericht": "Amtsgericht Berlin (Charlottenburg)",
      "registernummer": "HRB 224013",
      "registerart": "HRB",
      "company_name": "Laskaja Generalbau GmbH",
      "company_seat": "Berlin",
      "details": "21.05.2025 (Bekanntmachungsdatum)\n\nBerlin Amtsgericht Berlin (Charlottenburg) HRB 224013\nLöschungsankündigung\n\nLaskaja Generalbau GmbH\nGesellschaft mit beschränkter Haftung\nBerlin\n\nBei der nachstehenden Gesellschaft wird das Amtslöschungsverfahren gemäß § 394 FamFG eingeleitet. Widerspruchsfrist 6 Wochen"
    },
    {
      "date": "2025-05-21",
      "id": "109750",
      "original_text": "Sonstige Registerbekanntmachung\nSchleswig-Holstein Amtsgericht Kiel HRB 21640\nHartmann Finanzdienstleistungen GmbH – Rendsburg",
      "type": "Sonstige Registerbekanntmachung",
      "state": "Schleswig-Holstein",
      "amtsgericht": "Amtsgericht Kiel",
      "registernummer": "HRB 21640",
      "registerart": "HRB",
      "company_name": "Hartmann Finanzdienstleistungen GmbH",
      "company_seat": "Rendsburg",
      "details": "21.05.2025 (Bekanntmachungsdatum)\n\nSchleswig-Holstein Amtsgericht Kiel HRB 21640\nSonstige Registerbekanntmachung\n\nHartmann Finanzdienstleistungen GmbH\nGesellschaft mit beschränkter Haftung\nRendsburg\n\nAls nicht eingetragen wird veröffentlicht: Den Gläubigern der an der Verschmelzung beteiligten Rechtsträger ist, wenn sie binnen sechs Monaten nach dem Tag, an dem die Eintragung der Verschmelzung in das Register des Sitzes desjenigen Rechtsträgers, dessen Gläubiger sie sind, nach § 19 Abs. 3 UmwG bekannt gemacht worden ist, ihren Anspruch nach Grund und Höhe schriftlich anmelden, Sicherheit zu leisten, soweit sie nicht Befriedigung verlangen können. Dieses Recht steht den Gläubigern jedoch nur zu, wenn sie glaubhaft machen, dass durch die Verschmelzung die Erfüllung ihrer Forderung gefährdet wird."
    },
    {
      "date": "2025-05-21",
      "id": "109751",
      "original_text": "Einreichung neuer Dokumente\nThüringen Amtsgericht Jena HRB 303862\nKommunale Bau- und Entwicklungsgesellschaft Meiningen mbH , die Firmenkurzbezeichnung lautet: \"KOBEG\" – Meiningen",
      "type": "Einreichung neuer Dokumente",
      "state": "Thüringen",
      "amtsgericht": "Amtsgericht Jena",
      "registernummer": "HRB 303862",
      "registerart": "HRB",
      "company_name": "Kommunale Bau- und Entwicklungsgesellschaft Meiningen mbH , die Firmenkurzbezeichnung lautet: \"KOBEG\"",
      "company_seat": "Meiningen",
      "details": "21.05.2025 (Bekanntmachungsdatum)\n\nThüringen Amtsgericht Jena HRB 303862\nEinreichung neuer Dokumente\n\nKommunale Bau- und Entwicklungsgesellschaft Meiningen mbH , die Firmenkurzbezeichnung lautet: \"KOBEG\"\nGesellschaft mit beschränkter Haftung\nMeiningen\n\nBekanntmachung gem. § 52 Abs. 3 Satz 2 GmbHG: Aufgrund einer Veränderung in den Personen der Aufsichtsratsmitglieder ist durch die Geschäftsführer eine neue Liste zum Handelsregister eingereicht worden."
    },
    {
      "date": "2025-05-21",
      "id": "109752",
      "original_text": "Sonstige Registerbekanntmachung\nThüringen Amtsgericht Gotha VR 141694\nFörderverein der Freiwilligen Feuerwehr Luisenthal e. V. – Luisenthal",
      "type": "Sonstige Registerbekanntmachung",
      "state": "Thüringen",
      "amtsgericht": "Amtsgericht Gotha",
      "registernummer": "VR 141694",
      "registerart": "VR",
      "company_name": "Förderverein der Freiwilligen Feuerwehr Luisenthal e. V.",
      "company_seat": "Luisenthal",
      "details": "21.05.2025 (Bekanntmachungsdatum)\n\nThüringen Amtsgericht Gotha VR 141694\nSonstige Registerbekanntmachung 21.05.2025 (Eintragungsdatum)\n\nFörderverein der Freiwilligen Feuerwehr Luisenthal e. V.\neingetragener Verein\nLuisenthal"
    },
    {
      "date": "2025-05-21",
      "id": "109753",
      "original_text": "Registerbekanntmachung nach dem Umwandlungsgesetz\nBaden-Württemberg Amtsgericht Mannheim HRB 8469\nRIXIUS AG – Mannheim",
      "type": "Registerbekanntmachung nach dem Umwandlungsgesetz",
      "state": "Baden-Württemberg",
      "amtsgericht": "Amtsgericht Mannheim",
      "registernummer": "HRB 8469",
      "registerart": "HRB",
      "company_name": "RIXIUS AG",
      "company_seat": "Mannheim",
      "details": "21.05.2025 (Bekanntmachungsdatum)\n\nBaden-Württemberg Amtsgericht Mannheim HRB 8469\nRegisterbekanntmachung nach dem Umwandlungsgesetz 21.05.2025 (Eintragungsdatum)\n\nRIXIUS AG\nAktiengesellschaft\nMannheim\n\nDen Gläubigern des an dem Formwechsel beteiligten Rechtsträgers ist, wenn sie binnen sechs Monaten nach dem Tag, an dem die Eintragung des Formwechsels in das Register des Sitzes desjenigen Rechtsträgers, dessen Gläubiger sie sind, nach § 19 Abs. 3 UmwG als bekanntgemacht gilt, ihren Anspruch nach Grund und Höhe schriftlich anmelden, Sicherheit zu leisten, soweit sie nicht Befriedigung verlangen können. Dieses Recht steht den Gläubigern jedoch nur zu, wenn sie glaubhaft machen, dass durch den Formwechsel die Erfüllung ihrer Forderung gefährdet wird."
    },
    {
      "date": "2025-05-21",
      "id": "109754",
      "original_text": "Registerbekanntmachung nach dem Umwandlungsgesetz\nBaden-Württemberg Amtsgericht Mannheim HRB 4664\nABB AG – Mannheim",
      "type": "Registerbekanntmachung nach dem Umwandlungsgesetz",
      "state": "Baden-Württemberg",
      "amtsgericht": "Amtsgericht Mannheim",
      "registernummer": "HRB 4664",
      "registerart": "HRB",
      "company_name": "ABB AG",
      "company_seat": "Mannheim",
      "details": "21.05.2025 (Bekanntmachungsdatum)\n\nBaden-Württemberg Amtsgericht Mannheim HRB 4664\nRegisterbekanntmachung nach dem Umwandlungsgesetz\n\nABB AG\nAktiengesellschaft\nMannheim\n\nDie Gesellschaft hat am 20.05.2025 den Verschmelzungsvertrag vom 16.05.2025 zwischen \"ABB Striebel & John GmbH\", Sasbach (Amtsgericht Amtsgericht Mannheim HRB 220380)\nund der hiesigen Gesellschaft (übernehmender Rechtsträger) zum Handelsregister eingereicht."
    },
    {
      "date": "2025-05-21",
      "id": "109755",
      "original_text": "Registerbekanntmachung nach dem Umwandlungsgesetz\nBerlin Amtsgericht Berlin (Charlottenburg) HRB 267861\nIngenii GmbH – Berlin",
      "type": "Registerbekanntmachung nach dem Umwandlungsgesetz",
      "state": "Berlin",
      "amtsgericht": "Amtsgericht Berlin (Charlottenburg)",
      "registernummer": "HRB 267861",
      "registerart": "HRB",
      "company_name": "Ingenii GmbH",
      "company_seat": "Berlin",
      "details": "21.05.2025 (Bekanntmachungsdatum)\n\nBerlin Amtsgericht Berlin (Charlottenburg) HRB 267861\nRegisterbekanntmachung nach dem Umwandlungsgesetz 21.05.2025 (Eintragungsdatum)\n\nIngenii GmbH\nGesellschaft mit beschränkter Haftung\nBerlin\n\nZu Eintragungsnummer 2 vom 21.05.2025 wird als nicht eingetragen veröffentlicht: Den Gläubigern der an der Ausgliederung beteiligten Rechtsträger ist, wenn sie binnen sechs Monaten nach dem Tag, an dem die Eintragung der Ausgliederung in das Register des Sitzes desjenigen Rechtsträgers, dessen Gläubiger sie sind, als bekannt gemacht gilt, ihren Anspruch nach Grund und Höhe schriftlich anmelden, Sicherheit zu leisten, soweit sie nicht Befriedigung verlangen können. Dieses Recht steht den Gläubigern jedoch nur zu, wenn sie glaubhaft machen, dass durch die Ausgliederung die Erfüllung ihrer Forderung gefährdet wird. Das Recht, Sicherheitsleistung zu verlangen, steht Gläubigern nicht zu, die im Falle der Insolvenz ein Recht auf vorzugsweise Befriedigung aus einer Deckungsmasse haben, die nach gesetzlicher Vorschrift zu ihrem Schutz errichtet und staatlich überwacht ist."
    },
    {
      "date": "2025-05-21",
      "id": "109756",
      "original_text": "Registerbekanntmachung nach dem Umwandlungsgesetz\nBaden-Württemberg Amtsgericht Mannheim HRB 4664\nABB AG – Mannheim",
      "type": "Registerbekanntmachung nach dem Umwandlungsgesetz",
      "state": "Baden-Württemberg",
      "amtsgericht": "Amtsgericht Mannheim",
      "registernummer": "HRB 4664",
      "registerart": "HRB",
      "company_name": "ABB AG",
      "company_seat": "Mannheim",
      "details": "21.05.2025 (Bekanntmachungsdatum)\n\nBaden-Württemberg Amtsgericht Mannheim HRB 4664\nRegisterbekanntmachung nach dem Umwandlungsgesetz\n\nABB AG\nAktiengesellschaft\nMannheim\n\nDie Gesellschaft hat am 20.05.2025 den Verschmelzungsvertrag vom 16.05.2025 zwischen \"Busch-Jaeger Elektro GmbH\", Lüdenscheid (Amtsgericht Amtsgericht Iserlohn HRB 4411)\nund der hiesigen Gesellschaft (übernehmender Rechtsträger) zum Handelsregister eingereicht."
    },
    {
      "date": "2025-05-21",
      "id": "109757",
      "original_text": "Registerbekanntmachung nach dem Umwandlungsgesetz\nBaden-Württemberg Amtsgericht Mannheim HRB 4664\nABB AG – Mannheim",
      "type": "Registerbekanntmachung nach dem Umwandlungsgesetz",
      "state": "Baden-Württemberg",
      "amtsgericht": "Amtsgericht Mannheim",
      "registernummer": "HRB 4664",
      "registerart": "HRB",
      "company_name": "ABB AG",
      "company_seat": "Mannheim",
      "details": "21.05.2025 (Bekanntmachungsdatum)\n\nBaden-Württemberg Amtsgericht Mannheim HRB 4664\nRegisterbekanntmachung nach dem Umwandlungsgesetz\n\nABB AG\nAktiengesellschaft\nMannheim\n\nDie Gesellschaft hat am 20.05.2025 den Verschmelzungsvertrag vom 16.05.2025 zwischen \"ABB Stotz-Kontakt Gesellschaft mit beschränkter Haftung\", Heidelberg (Amtsgericht Amtsgericht Mannheim HRB 336474)\nund der hiesigen Gesellschaft (übernehmender Rechtsträger) zum Handelsregister eingereicht."
    },
    {
      "date": "2025-05-21",
      "id": "109758",
      "original_text": "Registerbekanntmachung nach dem Umwandlungsgesetz\nBaden-Württemberg Amtsgericht Mannheim HRB 4664\nABB AG – Mannheim",
      "type": "Registerbekanntmachung nach dem Umwandlungsgesetz",
      "state": "Baden-Württemberg",
      "amtsgericht": "Amtsgericht Mannheim",
      "registernummer": "HRB 4664",
      "registerart": "HRB",
      "company_name": "ABB AG",
      "company_seat": "Mannheim",
      "details": "21.05.2025 (Bekanntmachungsdatum)\n\nBaden-Württemberg Amtsgericht Mannheim HRB 4664\nRegisterbekanntmachung nach dem Umwandlungsgesetz\n\nABB AG\nAktiengesellschaft\nMannheim\n\nDie Gesellschaft hat am 20.05.2025 den Verschmelzungsvertrag vom 16.05.2025 zwischen \"ABB Patent Gesellschaft mit beschränkter Haftung\", Mannheim (Amtsgericht Mannheim HRB 432752)\nund der hiesigen Gesellschaft (übernehmender Rechtsträger) zum Handelsregister eingereicht."
    },
    {
      "date": "2025-05-21",
      "id": "109759",
      "original_text": "Löschungsankündigung\nBerlin Amtsgericht Berlin (Charlottenburg) HRB 172414\nR & M Playtime UG (haftungsbeschränkt) – Berlin",
      "type": "Löschungsankündigung",
      "state": "Berlin",
      "amtsgericht": "Amtsgericht Berlin (Charlottenburg)",
      "registernummer": "HRB 172414",
      "registerart": "HRB",
      "company_name": "R & M Playtime UG (haftungsbeschränkt)",
      "company_seat": "Berlin",
      "details": "21.05.2025 (Bekanntmachungsdatum)\n\nBerlin Amtsgericht Berlin (Charlottenburg) HRB 172414\nLöschungsankündigung\n\nR & M Playtime UG (haftungsbeschränkt)\nGesellschaft mit beschränkter Haftung\nBerlin\n\nBei der nachstehenden Gesellschaft wird das Amtslöschungsverfahren gemäß § 394 FamFG eingeleitet. Widerspruchsfrist 6 Wochen"
    },
    {
      "date": "2025-05-21",
      "id": "109760",
      "original_text": "Registerbekanntmachung nach dem Umwandlungsgesetz\nBerlin Amtsgericht Berlin (Charlottenburg) GnR 790\nCANNOVUM HEALTH eG – Berlin",
      "type": "Registerbekanntmachung nach dem Umwandlungsgesetz",
      "state": "Berlin",
      "amtsgericht": "Amtsgericht Berlin (Charlottenburg)",
      "registernummer": "GnR 790",
      "registerart": "GnR",
      "company_name": "CANNOVUM HEALTH eG",
      "company_seat": "Berlin",
      "details": "21.05.2025 (Bekanntmachungsdatum)\n\nBerlin Amtsgericht Berlin (Charlottenburg) GnR 790\nRegisterbekanntmachung nach dem Umwandlungsgesetz 19.05.2025 (Eintragungsdatum)\n\nCANNOVUM HEALTH eG\neingetragene Genossenschaft\nBerlin\n\nZu Eintragungsnummer 5 vom 19.05.2025 wird als nicht eingetragen veröffentlicht:\nDen Gläubigern ist, wenn sie binnen sechs Monaten nach dem Tag, an dem die Eintragung der Umwandlung als bekannt gemacht gilt, ihren Anspruch nach Grund und Höhe schriftlich anmelden, Sicherheit zu leisten, soweit sie nicht Befriedigung verlangen können. Dieses Recht steht den Gläubigern jedoch nur zu, wenn sie glaubhaft machen, dass durch die Umwandlung die Erfüllung ihrer Forderung gefährdet wird. Das Recht, Sicherheitsleistung zu verlangen, steht Gläubigern nicht zu, die im Falle der Insolvenz ein Recht auf vorzugsweise Befriedigung aus einer Deckungsmasse haben, die nach gesetzlicher Vorschrift zu ihrem Schutz errichtet und staatlich überwacht ist."
    },
    {
      "date": "2025-05-21",
      "id": "109761",
      "original_text": "Löschungsankündigung\nBerlin Amtsgericht Berlin (Charlottenburg) HRB 230749\nGlobal Communities Europe UG (haftungsbeschränkt) – Berlin",
      "type": "Löschungsankündigung",
      "state": "Berlin",
      "amtsgericht": "Amtsgericht Berlin (Charlottenburg)",
      "registernummer": "HRB 230749",
      "registerart": "HRB",
      "company_name": "Global Communities Europe UG (haftungsbeschränkt)",
      "company_seat": "Berlin",
      "details": "21.05.2025 (Bekanntmachungsdatum)\n\nBerlin Amtsgericht Berlin (Charlottenburg) HRB 230749\nLöschungsankündigung\n\nGlobal Communities Europe UG (haftungsbeschränkt)\nGesellschaft mit beschränkter Haftung\nBerlin\n\nBei der nachstehenden Gesellschaft wird das Amtslöschungsverfahren gemäß § 394 FamFG eingeleitet. Widerspruchsfrist 6 Wochen"
    },
    {
      "date": "2025-05-21",
      "id": "109762",
      "original_text": "Registerbekanntmachung nach dem Umwandlungsgesetz\nHamburg Amtsgericht Hamburg HRB 123586\nSHL Contracting Germany GmbH – Hamburg",
      "type": "Registerbekanntmachung nach dem Umwandlungsgesetz",
      "state": "Hamburg",
      "amtsgericht": "Amtsgericht Hamburg",
      "registernummer": "HRB 123586",
      "registerart": "HRB",
      "company_name": "SHL Contracting Germany GmbH",
      "company_seat": "Hamburg",
      "details": "21.05.2025 (Bekanntmachungsdatum)\n\nHamburg Amtsgericht Hamburg HRB 123586\nRegisterbekanntmachung nach dem Umwandlungsgesetz 21.05.2025 (Eintragungsdatum)\n\nSHL Contracting Germany GmbH\nGesellschaft mit beschränkter Haftung\nHamburg\n\nAls nicht eingetragen wird bekannt gemacht:\nDen Gläubigern der an der Verschmelzung beteiligten Gesellschaften ist, wenn sie binnen sechs Monaten nach dem Tag, an dem die Eintragung der Verschmelzung in das Register des Sitzes desjenigen Rechtsträgers, dessen Gläubiger sie sind, nach § 19 Absatz 3 UmwG als bekannt gemacht gilt, ihren Anspruch nach Grund und Höhe schriftlich anmelden, Sicherheit zu leisten, soweit sie nicht Befriedigung verlangen können. Dieses Recht steht den Gläubigern jedoch nur zu, wenn sie glaubhaft machen, dass durch die Verschmelzung die Erfüllung ihrer Forderung gefährdet wird."
    },
    {
      "date": "2025-05-21",
      "id": "109763",
      "original_text": "Löschungsankündigung\nBaden-Württemberg Amtsgericht Mannheim HRB 737077\nKovacic Printer UG (haftungsbeschränkt) – Dielheim",
      "type": "Löschungsankündigung",
      "state": "Baden-Württemberg",
      "amtsgericht": "Amtsgericht Mannheim",
      "registernummer": "HRB 737077",
      "registerart": "HRB",
      "company_name": "Kovacic Printer UG (haftungsbeschränkt)",
      "company_seat": "Dielheim",
      "details": "21.05.2025 (Bekanntmachungsdatum)\n\nBaden-Württemberg Amtsgericht Mannheim HRB 737077\nLöschungsankündigung\n\nKovacic Printer UG (haftungsbeschränkt)\nGesellschaft mit beschränkter Haftung\nDielheim\n\nDas Gericht beabsichtigt, die Gesellschaft wegen Vermögenslosigkeit im Handelsregister von Amts wegen nach § 394 FamFG zu löschen. Die Frist zur Geltendmachung eines Widerspruchs gegen die beabsichtigte Löschung ist auf einen Monat ab Veröffentlichung bestimmt."
    },
    {
      "date": "2025-05-21",
      "id": "109764",
      "original_text": "Löschungsankündigung\nBaden-Württemberg Amtsgericht Mannheim HRA 709515\nCREATOR BAU UG (haftungsbeschränkt) & Co. KG – Eisingen",
      "type": "Löschungsankündigung",
      "state": "Baden-Württemberg",
      "amtsgericht": "Amtsgericht Mannheim",
      "registernummer": "HRA 709515",
      "registerart": "HRA",
      "company_name": "CREATOR BAU UG (haftungsbeschränkt) & Co. KG",
      "company_seat": "Eisingen",
      "details": "21.05.2025 (Bekanntmachungsdatum)\n\nBaden-Württemberg Amtsgericht Mannheim HRA 709515\nLöschungsankündigung\n\nCREATOR BAU UG (haftungsbeschränkt) & Co. KG\nKommanditgesellschaft\nEisingen\n\nAls nicht eingetragen wird bekanntgemacht:\nDas Gericht beabsichtigt, die Gesellschaft wegen Vermögenslosigkeit im Handelsregister von Amts wegen nach § 394 FamFG zu löschen. Die Frist zur Geltendmachung eines Widerspruchs gegen die beabsichtigte Löschung ist auf einen Monat ab Veröffentlichung bestimmt."
    },
    {
      "date": "2025-05-21",
      "id": "109765",
      "original_text": "Löschungsankündigung\nBerlin Amtsgericht Berlin (Charlottenburg) HRA 54697\nJetpack Music GmbH & Co. KG – Berlin",
      "type": "Löschungsankündigung",
      "state": "Berlin",
      "amtsgericht": "Amtsgericht Berlin (Charlottenburg)",
      "registernummer": "HRA 54697",
      "registerart": "HRA",
      "company_name": "Jetpack Music GmbH & Co. KG",
      "company_seat": "Berlin",
      "details": "21.05.2025 (Bekanntmachungsdatum)\n\nBerlin Amtsgericht Berlin (Charlottenburg) HRA 54697\nLöschungsankündigung\n\nJetpack Music GmbH & Co. KG\nKommanditgesellschaft\nBerlin\n\nBei dem nachstehenden Unternehmen / der nachstehenden Gesellschaft wird das Amtslöschungsverfahren gemäß § 31 Abs. 2 HGB eingeleitet. Widerspruchsfrist 1 Monat"
    },
    {
      "date": "2025-05-21",
      "id": "109766",
      "original_text": "Registerbekanntmachung nach dem Umwandlungsgesetz\nBerlin Amtsgericht Berlin (Charlottenburg) HRB 242172\nProject Lane GmbH – Berlin",
      "type": "Registerbekanntmachung nach dem Umwandlungsgesetz",
      "state": "Berlin",
      "amtsgericht": "Amtsgericht Berlin (Charlottenburg)",
      "registernummer": "HRB 242172",
      "registerart": "HRB",
      "company_name": "Project Lane GmbH",
      "company_seat": "Berlin",
      "details": "21.05.2025 (Bekanntmachungsdatum)\n\nBerlin Amtsgericht Berlin (Charlottenburg) HRB 242172\nRegisterbekanntmachung nach dem Umwandlungsgesetz 14.05.2025 (Eintragungsdatum)\n\nProject Lane GmbH\nGesellschaft mit beschränkter Haftung\nBerlin\n\nZu Eintragungsnummer 6 vom 14.05.2025 wird als nicht eingetragen veröffentlicht: Den Gläubigern ist, wenn sie binnen sechs Monaten nach dem Tag, an dem die Eintragung der Umwandlung als bekannt gemacht gilt, ihren Anspruch nach Grund und Höhe schriftlich anmelden, Sicherheit zu leisten, soweit sie nicht Befriedigung verlangen können. Dieses Recht steht den Gläubigern jedoch nur zu, wenn sie glaubhaft machen, dass durch die Umwandlung die Erfüllung ihrer Forderung gefährdet wird. Das Recht, Sicherheitsleistung zu verlangen, steht Gläubigern nicht zu, die im Falle der Insolvenz ein Recht auf vorzugsweise Befriedigung aus einer Deckungsmasse haben, die nach gesetzlicher Vorschrift zu ihrem Schutz errichtet und staatlich überwacht ist."
    },
    {
      "date": "2025-05-21",
      "id": "109767",
      "original_text": "Registerbekanntmachung nach dem Umwandlungsgesetz\nHamburg Amtsgericht Hamburg HRA 132361\nBoysen Productions e.K. – Hamburg",
      "type": "Registerbekanntmachung nach dem Umwandlungsgesetz",
      "state": "Hamburg",
      "amtsgericht": "Amtsgericht Hamburg",
      "registernummer": "HRA 132361",
      "registerart": "HRA",
      "company_name": "Boysen Productions e.K.",
      "company_seat": "Hamburg",
      "details": "21.05.2025 (Bekanntmachungsdatum)\n\nHamburg Amtsgericht Hamburg HRA 132361\nRegisterbekanntmachung nach dem Umwandlungsgesetz 21.05.2025 (Eintragungsdatum)\n\nBoysen Productions e.K.\nEinzelkaufmann\nHamburg\n\nAls nicht eingetragen wird bekannt gemacht:\nDen Gläubigern der an der Ausgliederung beteiligten Gesellschaften ist, wenn sie binnen sechs Monaten nach dem Tag, an dem die Eintragung der Ausgliederung in das Register des Sitzes desjenigen Rechtsträgers, dessen Gläubiger sie sind, nach § 19 Absatz 3 UmwG als bekannt gemacht gilt, ihren Anspruch nach Grund und Höhe schriftlich anmelden, Sicherheit zu leisten, soweit sie nicht Befriedigung verlangen können. Dieses Recht steht den Gläubigern jedoch nur zu, wenn sie glaubhaft machen, dass durch die Ausgliederung die Erfüllung ihrer Forderung gefährdet wird."
    },
    {
      "date": "2025-05-21",
      "id": "109768",
      "original_text": "Registerbekanntmachung nach dem Umwandlungsgesetz\nHamburg Amtsgericht Hamburg HRB 192639\nBoysen Producions GmbH – Hamburg",
      "type": "Registerbekanntmachung nach dem Umwandlungsgesetz",
      "state": "Hamburg",
      "amtsgericht": "Amtsgericht Hamburg",
      "registernummer": "HRB 192639",
      "registerart": "HRB",
      "company_name": "Boysen Producions GmbH",
      "company_seat": "Hamburg",
      "details": "21.05.2025 (Bekanntmachungsdatum)\n\nHamburg Amtsgericht Hamburg HRB 192639\nRegisterbekanntmachung nach dem Umwandlungsgesetz 21.05.2025 (Eintragungsdatum)\n\nBoysen Producions GmbH\nGesellschaft mit beschränkter Haftung\nHamburg\n\nAls nicht eingetragen wird bekannt gemacht:\nDen Gläubigern der an der Ausgliederung beteiligten Gesellschaften ist, wenn sie binnen sechs Monaten nach dem Tag, an dem die Eintragung der Ausgliederung in das Register des Sitzes desjenigen Rechtsträgers, dessen Gläubiger sie sind, nach § 19 Absatz 3 UmwG als bekannt gemacht gilt, ihren Anspruch nach Grund und Höhe schriftlich anmelden, Sicherheit zu leisten, soweit sie nicht Befriedigung verlangen können. Dieses Recht steht den Gläubigern jedoch nur zu, wenn sie glaubhaft machen, dass durch die Ausgliederung die Erfüllung ihrer Forderung gefährdet wird."
    },
    {
      "date": "2025-05-21",
      "id": "109769",
      "original_text": "Löschungsankündigung\nBaden-Württemberg Amtsgericht Ulm HRB 732825\nECOCELL Sigmaringen GmbH – Sigmaringen",
      "type": "Löschungsankündigung",
      "state": "Baden-Württemberg",
      "amtsgericht": "Amtsgericht Ulm",
      "registernummer": "HRB 732825",
      "registerart": "HRB",
      "company_name": "ECOCELL Sigmaringen GmbH",
      "company_seat": "Sigmaringen",
      "details": "21.05.2025 (Bekanntmachungsdatum)\n\nBaden-Württemberg Amtsgericht Ulm HRB 732825\nLöschungsankündigung 21.05.2025 (Eintragungsdatum)\n\nECOCELL Sigmaringen GmbH\nGesellschaft mit beschränkter Haftung\nSigmaringen\n\nAls nicht eingetragen wird bekanntgemacht:\nDas Gericht beabsichtigt, die Gesellschaft wegen Vermögenslosigkeit im Handelsregister von Amts wegen nach § 394 FamFG zu löschen. Die Frist zur Geltendmachung eines Widerspruchs gegen die beabsichtigte Löschung ist auf  einen Monat ab Veröffentlichung bestimmt."
    },
    {
      "date": "2025-05-21",
      "id": "109770",
      "original_text": "Registerbekanntmachung nach dem Umwandlungsgesetz\nBerlin Amtsgericht Berlin (Charlottenburg) HRB 232493\nLuCa vv GmbH – Berlin",
      "type": "Registerbekanntmachung nach dem Umwandlungsgesetz",
      "state": "Berlin",
      "amtsgericht": "Amtsgericht Berlin (Charlottenburg)",
      "registernummer": "HRB 232493",
      "registerart": "HRB",
      "company_name": "LuCa vv GmbH",
      "company_seat": "Berlin",
      "details": "21.05.2025 (Bekanntmachungsdatum)\n\nBerlin Amtsgericht Berlin (Charlottenburg) HRB 232493\nRegisterbekanntmachung nach dem Umwandlungsgesetz 20.05.2025 (Eintragungsdatum)\n\nLuCa vv GmbH\nGesellschaft mit beschränkter Haftung\nBerlin\n\nZu Eintragungsnummer 2 vom 20.05.2025 wird als nicht eingetragen veröffentlicht: Den Gläubigern der an der Verschmelzung beteiligten Rechtsträger ist, wenn sie binnen sechs Monaten nach dem Tag, an dem die Eintragung der Verschmelzung in das Register des Sitzes desjenigen Rechtsträgers, dessen Gläubiger sie sind, als bekannt gemacht gilt, ihren Anspruch nach Grund und Höhe schriftlich anmelden, Sicherheit zu leisten, soweit sie nicht Befriedigung verlangen können. Dieses Recht steht den Gläubigern jedoch nur zu, wenn sie glaubhaft machen, dass durch die Verschmelzung die Erfüllung ihrer Forderung gefährdet wird. Das Recht, Sicherheitsleistung zu verlangen, steht Gläubigern nicht zu, die im Falle der Insolvenz ein Recht auf vorzugsweise Befriedigung aus einer Deckungsmasse haben, die nach gesetzlicher Vorschrift zu ihrem Schutz errichtet und staatlich überwacht ist."
    },
    {
      "date": "2025-05-21",
      "id": "109771",
      "original_text": "Registerbekanntmachung nach dem Umwandlungsgesetz\nBaden-Württemberg Amtsgericht Ulm HRB 661097\nDr. Zwissler Holding AG – Gerstetten",
      "type": "Registerbekanntmachung nach dem Umwandlungsgesetz",
      "state": "Baden-Württemberg",
      "amtsgericht": "Amtsgericht Ulm",
      "registernummer": "HRB 661097",
      "registerart": "HRB",
      "company_name": "Dr. Zwissler Holding AG",
      "company_seat": "Gerstetten",
      "details": "21.05.2025 (Bekanntmachungsdatum)\n\nBaden-Württemberg Amtsgericht Ulm HRB 661097\nRegisterbekanntmachung nach dem Umwandlungsgesetz 21.05.2025 (Eintragungsdatum)\n\nDr. Zwissler Holding AG\nAktiengesellschaft\nGerstetten\n\nAls nicht eingetragen wird bekanntgemacht:\nDen Gläubigern der an der Verschmelzung beteiligten Rechtsträger ist, wenn sie binnen sechs Monaten nach dem Tag, an dem die Eintragung der Verschmelzung in das Register des Sitzes desjenigen Rechtsträgers, dessen Gläubiger sie sind, nach § 19 Abs. 3 UmwG als bekanntgemacht gilt, ihren Anspruch nach Grund und Höhe schriftlich anmelden, Sicherheit zu leisten, soweit sie nicht Befriedigung verlangen können. Dieses Recht steht den Gläubigern jedoch nur zu, wenn sie glaubhaft machen, dass durch die Verschmelzung die Erfüllung ihrer Forderung gefährdet wird."
    },
    {
      "date": "2025-05-21",
      "id": "109772",
      "original_text": "Registerbekanntmachung nach dem Umwandlungsgesetz\nBaden-Württemberg Amtsgericht Ulm HRB 744577\nzwissSUN GmbH – Gerstetten",
      "type": "Registerbekanntmachung nach dem Umwandlungsgesetz",
      "state": "Baden-Württemberg",
      "amtsgericht": "Amtsgericht Ulm",
      "registernummer": "HRB 744577",
      "registerart": "HRB",
      "company_name": "zwissSUN GmbH",
      "company_seat": "Gerstetten",
      "details": "21.05.2025 (Bekanntmachungsdatum)\n\nBaden-Württemberg Amtsgericht Ulm HRB 744577\nRegisterbekanntmachung nach dem Umwandlungsgesetz 21.05.2025 (Eintragungsdatum)\n\nzwissSUN GmbH\nGesellschaft mit beschränkter Haftung\nGerstetten\n\nAls nicht eingetragen wird bekanntgemacht:\nDen Gläubigern der an der Verschmelzung beteiligten Rechtsträger ist, wenn sie binnen sechs Monaten nach dem Tag, an dem die Eintragung der Verschmelzung in das Register des Sitzes desjenigen Rechtsträgers, dessen Gläubiger sie sind, nach § 19 Abs. 3 UmwG als bekanntgemacht gilt, ihren Anspruch nach Grund und Höhe schriftlich anmelden, Sicherheit zu leisten, soweit sie nicht Befriedigung verlangen können. Dieses Recht steht den Gläubigern jedoch nur zu, wenn sie glaubhaft machen, dass durch die Verschmelzung die Erfüllung ihrer Forderung gefährdet wird."
    },
    {
      "date": "2025-05-21",
      "id": "109773",
      "original_text": "Registerbekanntmachung nach dem Umwandlungsgesetz\nMecklenburg-Vorpommern Amtsgericht Rostock HRB 13945\nSanitzer Immobiliengesellschaft mbH, SaIG mbH – Sanitz",
      "type": "Registerbekanntmachung nach dem Umwandlungsgesetz",
      "state": "Mecklenburg-Vorpommern",
      "amtsgericht": "Amtsgericht Rostock",
      "registernummer": "HRB 13945",
      "registerart": "HRB",
      "company_name": "Sanitzer Immobiliengesellschaft mbH, SaIG mbH",
      "company_seat": "Sanitz",
      "details": "21.05.2025 (Bekanntmachungsdatum)\n\nMecklenburg-Vorpommern Amtsgericht Rostock HRB 13945\nRegisterbekanntmachung nach dem Umwandlungsgesetz 21.05.2025 (Eintragungsdatum)\n\nSanitzer Immobiliengesellschaft mbH, SaIG mbH\nGesellschaft mit beschränkter Haftung\nSanitz\n\nAls nicht eingetragen wird veröffentlicht: Den Gläubigern der an der Verschmelzung beteiligten Rechtsträger ist, wenn sie binnen sechs Monaten nach dem Tag, an dem die Eintragung der Verschmelzung in das Register des Sitzes desjenigen Rechtsträgers, dessen Gläubiger sie sind, nach § 19 Abs. 3 UmwG als bekannt gemacht gilt,\nihren Anspruch nach Grund und Höhe in Textform anmelden, Sicherheit zu leisten, soweit sie nicht Befriedigung verlangen können. Dieses Recht steht den Gläubigern jedoch nur zu, wenn sie glaubhaft machen, dass durch die Verschmelzung die Erfüllung der Forderung gefährdet wird."
    },
    {
      "date": "2025-05-21",
      "id": "109774",
      "original_text": "Registerbekanntmachung nach dem Umwandlungsgesetz\nMecklenburg-Vorpommern Amtsgericht Rostock HRB 6071\nSanitzer Wohnungs- und Entwicklungsgesellschaft mbH, SaWEG mbH – Sanitz",
      "type": "Registerbekanntmachung nach dem Umwandlungsgesetz",
      "state": "Mecklenburg-Vorpommern",
      "amtsgericht": "Amtsgericht Rostock",
      "registernummer": "HRB 6071",
      "registerart": "HRB",
      "company_name": "Sanitzer Wohnungs- und Entwicklungsgesellschaft mbH, SaWEG mbH",
      "company_seat": "Sanitz",
      "details": "21.05.2025 (Bekanntmachungsdatum)\n\nMecklenburg-Vorpommern Amtsgericht Rostock HRB 6071\nRegisterbekanntmachung nach dem Umwandlungsgesetz 21.05.2025 (Eintragungsdatum)\n\nSanitzer Wohnungs- und Entwicklungsgesellschaft mbH, SaWEG mbH\nGesellschaft mit beschränkter Haftung\nSanitz\n\nAls nicht eingetragen wird veröffentlicht: Den Gläubigern der an der Verschmelzung beteiligten Rechtsträger ist, wenn sie binnen sechs Monaten nach dem Tag, an dem die Eintragung der Verschmelzung in das Register des Sitzes desjenigen Rechtsträgers, dessen Gläubiger sie sind, nach § 19 Abs. 3 UmwG als bekannt gemacht gilt,\nihren Anspruch nach Grund und Höhe in Textform anmelden, Sicherheit zu leisten, soweit sie nicht Befriedigung verlangen können. Dieses Recht steht den Gläubigern jedoch nur zu, wenn sie glaubhaft machen, dass durch die Verschmelzung die Erfüllung der Forderung gefährdet wird."
    },
    {
      "date": "2025-05-21",
      "id": "109775",
      "original_text": "Löschungsankündigung\nSachsen Amtsgericht Dresden HRB 40169\nSaxopex UG (haftungsbeschränkt) – Dresden",
      "type": "Löschungsankündigung",
      "state": "Sachsen",
      "amtsgericht": "Amtsgericht Dresden",
      "registernummer": "HRB 40169",
      "registerart": "HRB",
      "company_name": "Saxopex UG (haftungsbeschränkt)",
      "company_seat": "Dresden",
      "details": "21.05.2025 (Bekanntmachungsdatum)\n\nSachsen Amtsgericht Dresden HRB 40169\nLöschungsankündigung\n\nSaxopex UG (haftungsbeschränkt)\nGesellschaft mit beschränkter Haftung\nDresden\n\nDas Registergericht beabsichtigt, die im Handelsregister eingetragene Gesellschaft von Amts wegen nach § 394 FamFG zu löschen. Die Frist zu Erhebung eines Widerspruchs gegen die beabsichtigte Löschung wird auf einen Monat festgesetzt."
    },
    {
      "date": "2025-05-21",
      "id": "109776",
      "original_text": "Registerbekanntmachung nach dem Umwandlungsgesetz\nSachsen Amtsgericht Dresden HRB 46646\nQualitype GmbH – Dresden",
      "type": "Registerbekanntmachung nach dem Umwandlungsgesetz",
      "state": "Sachsen",
      "amtsgericht": "Amtsgericht Dresden",
      "registernummer": "HRB 46646",
      "registerart": "HRB",
      "company_name": "Qualitype GmbH",
      "company_seat": "Dresden",
      "details": "21.05.2025 (Bekanntmachungsdatum)\n\nSachsen Amtsgericht Dresden HRB 46646\nRegisterbekanntmachung nach dem Umwandlungsgesetz 21.05.2025 (Eintragungsdatum)\n\nQualitype GmbH\nGesellschaft mit beschränkter Haftung\nDresden\n\nDen Gläubigern der an der Spaltung beteiligten Rechtsträger ist, wenn sie binnen sechs Monaten nach dem Tag, an dem die Eintragung der Spaltung in das Register des Sitzes desjenigen Rechtsträgers, dessen Gläubiger sie sind, nach § 19 Abs. 3 UmwG als bekannt gemacht gilt, ihren Anspruch nach Grund und Höhe in Textform anmelden, Sicherheit zu leisten, soweit sie nicht Befriedigung verlangen können. Dieses Recht steht den Gläubigern jedoch nur zu, wenn sie glaubhaft machen, dass durch die Spaltung die Erfüllung der Forderung gefährdet wird."
    },
    {
      "date": "2025-05-21",
      "id": "109777",
      "original_text": "Einreichung neuer Dokumente\nSachsen Amtsgericht Dresden HRB 7136\nBUDISSA Agrarprodukte Aktiengesellschaft Niederkaina – Bautzen",
      "type": "Einreichung neuer Dokumente",
      "state": "Sachsen",
      "amtsgericht": "Amtsgericht Dresden",
      "registernummer": "HRB 7136",
      "registerart": "HRB",
      "company_name": "BUDISSA Agrarprodukte Aktiengesellschaft Niederkaina",
      "company_seat": "Bautzen",
      "details": "21.05.2025 (Bekanntmachungsdatum)\n\nSachsen Amtsgericht Dresden HRB 7136\nEinreichung neuer Dokumente\n\nBUDISSA Agrarprodukte Aktiengesellschaft Niederkaina\nAktiengesellschaft\nBautzen\n\nAm 21.05.2025 wurde beim Handelsregister des Amtsgerichts Dresden die Liste der Mitglieder des Aufsichtsrats gemäß § 106 AktG eingereicht."
    },
    {
      "date": "2025-05-21",
      "id": "109778",
      "original_text": "Registerbekanntmachung nach dem Umwandlungsgesetz\nSachsen Amtsgericht Dresden HRB 31753\nQualitype Forensics GmbH – Dresden",
      "type": "Registerbekanntmachung nach dem Umwandlungsgesetz",
      "state": "Sachsen",
      "amtsgericht": "Amtsgericht Dresden",
      "registernummer": "HRB 31753",
      "registerart": "HRB",
      "company_name": "Qualitype Forensics GmbH",
      "company_seat": "Dresden",
      "details": "21.05.2025 (Bekanntmachungsdatum)\n\nSachsen Amtsgericht Dresden HRB 31753\nRegisterbekanntmachung nach dem Umwandlungsgesetz 21.05.2025 (Eintragungsdatum)\n\nQualitype Forensics GmbH\nGesellschaft mit beschränkter Haftung\nDresden\n\nDen Gläubigern der an der Spaltung beteiligten Rechtsträger ist, wenn sie binnen sechs Monaten nach dem Tag, an dem die Eintragung der Spaltung in das Register des Sitzes desjenigen Rechtsträgers, dessen Gläubiger sie sind, nach § 19 Abs. 3 UmwG als bekannt gemacht gilt, ihren Anspruch nach Grund und Höhe in Textform anmelden, Sicherheit zu leisten, soweit sie nicht Befriedigung verlangen können. Dieses Recht steht den Gläubigern jedoch nur zu, wenn sie glaubhaft machen, dass durch die Spaltung die Erfüllung der Forderung gefährdet wird."
    },
    {
      "date": "2025-05-21",
      "id": "109779",
      "original_text": "Registerbekanntmachung nach dem Umwandlungsgesetz\nMecklenburg-Vorpommern Amtsgericht Rostock HRB 12286\nstufeeins GmbH – Rostock",
      "type": "Registerbekanntmachung nach dem Umwandlungsgesetz",
      "state": "Mecklenburg-Vorpommern",
      "amtsgericht": "Amtsgericht Rostock",
      "registernummer": "HRB 12286",
      "registerart": "HRB",
      "company_name": "stufeeins GmbH",
      "company_seat": "Rostock",
      "details": "21.05.2025 (Bekanntmachungsdatum)\n\nMecklenburg-Vorpommern Amtsgericht Rostock HRB 12286\nRegisterbekanntmachung nach dem Umwandlungsgesetz 21.05.2025 (Eintragungsdatum)\n\nstufeeins GmbH\nGesellschaft mit beschränkter Haftung\nRostock\n\nAls nicht eingetragen wird veröffentlicht: Den Gläubigern der an der Verschmelzung beteiligten Rechtsträger ist, wenn sie binnen sechs Monaten nach dem Tag, an dem die Eintragung der Verschmelzung in das Register des Sitzes desjenigen Rechtsträgers, dessen Gläubiger sie sind, nach § 19 Abs. 3 UmwG als bekannt gemacht gilt,\nihren Anspruch nach Grund und Höhe in Textform anmelden, Sicherheit zu leisten, soweit sie nicht Befriedigung verlangen können. Dieses Recht steht den Gläubigern jedoch nur zu, wenn sie glaubhaft machen, dass durch die Verschmelzung die Erfüllung der Forderung gefährdet wird."
    },
    {
      "date": "2025-05-21",
      "id": "109780",
      "original_text": "Registerbekanntmachung nach dem Umwandlungsgesetz\nMecklenburg-Vorpommern Amtsgericht Rostock HRB 14301\nSCHONENFAHRER GmbH – Rostock",
      "type": "Registerbekanntmachung nach dem Umwandlungsgesetz",
      "state": "Mecklenburg-Vorpommern",
      "amtsgericht": "Amtsgericht Rostock",
      "registernummer": "HRB 14301",
      "registerart": "HRB",
      "company_name": "SCHONENFAHRER GmbH",
      "company_seat": "Rostock",
      "details": "21.05.2025 (Bekanntmachungsdatum)\n\nMecklenburg-Vorpommern Amtsgericht Rostock HRB 14301\nRegisterbekanntmachung nach dem Umwandlungsgesetz 21.05.2025 (Eintragungsdatum)\n\nSCHONENFAHRER GmbH\nGesellschaft mit beschränkter Haftung\nRostock\n\nAls nicht eingetragen wird veröffentlicht: Den Gläubigern der an der Verschmelzung beteiligten Rechtsträger ist, wenn sie binnen sechs Monaten nach dem Tag, an dem die Eintragung der Verschmelzung in das Register des Sitzes desjenigen Rechtsträgers, dessen Gläubiger sie sind, nach § 19 Abs. 3 UmwG als bekannt gemacht gilt,\nihren Anspruch nach Grund und Höhe in Textform anmelden, Sicherheit zu leisten, soweit sie nicht Befriedigung verlangen können. Dieses Recht steht den Gläubigern jedoch nur zu, wenn sie glaubhaft machen, dass durch die Verschmelzung die Erfüllung der Forderung gefährdet wird."
    },
    {
      "date": "2025-05-21",
      "id": "109781",
      "original_text": "Registerbekanntmachung nach dem Umwandlungsgesetz\nNiedersachsen Amtsgericht Osnabrück HRA 209613\nHGL-Markt e.K. Inh. Heinrich Gartmann – Bad Iburg",
      "type": "Registerbekanntmachung nach dem Umwandlungsgesetz",
      "state": "Niedersachsen",
      "amtsgericht": "Amtsgericht Osnabrück",
      "registernummer": "HRA 209613",
      "registerart": "HRA",
      "company_name": "HGL-Markt e.K. Inh. Heinrich Gartmann",
      "company_seat": "Bad Iburg",
      "details": "21.05.2025 (Bekanntmachungsdatum)\n\nNiedersachsen Amtsgericht Osnabrück HRA 209613\nRegisterbekanntmachung nach dem Umwandlungsgesetz 21.05.2025 (Eintragungsdatum)\n\nHGL-Markt e.K. Inh. Heinrich Gartmann\nEinzelkaufmann / Einzelkauffrau\nBad Iburg\n\nDen Gläubigern der an der Verschmelzung beteiligten Rechtsträger ist, wenn sie binnen sechs Monaten nach dem Tag, an dem die Eintragung der Verschmelzung in das Register des Sitzes desjenigen Rechtsträgers, dessen Gläubiger sie sind, nach § 19  Abs.  3 UmwG als bekannt gemacht gilt, ihren Anspruch nach Grund und Höhe schriftlich anmelden, Sicherheit zu leisten, soweit sie nicht Befriedigung verlangen können. Dieses Recht steht den Gläubigern jedoch nur zu, wenn sie glaubhaft machen, dass durch die Verschmelzung die Erfüllung der Forderung gefährdet wird."
    },
    {
      "date": "2025-05-21",
      "id": "109782",
      "original_text": "Registerbekanntmachung nach dem Umwandlungsgesetz\nNiedersachsen Amtsgericht Hildesheim HRB 203966\nInterior Things GmbH – Holzminden",
      "type": "Registerbekanntmachung nach dem Umwandlungsgesetz",
      "state": "Niedersachsen",
      "amtsgericht": "Amtsgericht Hildesheim",
      "registernummer": "HRB 203966",
      "registerart": "HRB",
      "company_name": "Interior Things GmbH",
      "company_seat": "Holzminden",
      "details": "21.05.2025 (Bekanntmachungsdatum)\n\nNiedersachsen Amtsgericht Hildesheim HRB 203966\nRegisterbekanntmachung nach dem Umwandlungsgesetz 21.05.2025 (Eintragungsdatum)\n\nInterior Things GmbH\nGesellschaft mit beschränkter Haftung\nHolzminden\n\nDen Gläubigern der an der Verschmelzung beteiligten Rechtsträger ist, wenn sie binnen sechs Monaten nach dem Tag, an dem die Eintragung der Verschmelzung in das Register des Sitzes desjenigen Rechtsträgers, dessen Gläubiger sie sind, nach § 19  Abs.  3 UmwG als bekannt gemacht gilt, ihren Anspruch nach Grund und Höhe schriftlich anmelden, Sicherheit zu leisten, soweit sie nicht Befriedigung verlangen können. Dieses Recht steht den Gläubigern jedoch nur zu, wenn sie glaubhaft machen, dass durch die Verschmelzung die Erfüllung der Forderung gefährdet wird."
    },
    {
      "date": "2025-05-21",
      "id": "109783",
      "original_text": "Löschungsankündigung\nNiedersachsen Amtsgericht Hildesheim HRB 110603 früher Amtsgericht Alfeld\nFriedrich Kleine Bauunternehmen Gesellschaft mit beschränkter Haftung – Boffzen",
      "type": "Löschungsankündigung",
      "state": "Niedersachsen",
      "amtsgericht": "Amtsgericht Hildesheim",
      "registernummer": "HRB 110603",
      "registerart": "HRB",
      "company_name": "Friedrich Kleine Bauunternehmen Gesellschaft mit beschränkter Haftung",
      "company_seat": "Boffzen",
      "former_amtsgericht": "Alfeld",
      "details": "21.05.2025 (Bekanntmachungsdatum)\n\nNiedersachsen Amtsgericht Hildesheim HRB 110603 früher Amtsgericht Alfeld\nLöschungsankündigung\n\nFriedrich Kleine Bauunternehmen Gesellschaft mit beschränkter Haftung\nGesellschaft mit beschränkter Haftung\nBoffzen\n\nDas Registergericht beabsichtigt, die Gesellschaft von Amts wegen nach § 394 FamFG zu löschen. Die Frist zur Erhebung eines Widerspruchs ist auf 1 Monat ab dieser Registerbekanntmachung festgesetzt."
    },
    {
      "date": "2025-05-21",
      "id": "109784",
      "original_text": "Registerbekanntmachung nach dem Umwandlungsgesetz\nNiedersachsen Amtsgericht Osnabrück HRB 210144\nHGL-Markt-GmbH – Bad Iburg",
      "type": "Registerbekanntmachung nach dem Umwandlungsgesetz",
      "state": "Niedersachsen",
      "amtsgericht": "Amtsgericht Osnabrück",
      "registernummer": "HRB 210144",
      "registerart": "HRB",
      "company_name": "HGL-Markt-GmbH",
      "company_seat": "Bad Iburg",
      "details": "21.05.2025 (Bekanntmachungsdatum)\n\nNiedersachsen Amtsgericht Osnabrück HRB 210144\nRegisterbekanntmachung nach dem Umwandlungsgesetz 21.05.2025 (Eintragungsdatum)\n\nHGL-Markt-GmbH\nGesellschaft mit beschränkter Haftung\nBad Iburg\n\nDen Gläubigern der an der Verschmelzung beteiligten Rechtsträger ist, wenn sie binnen sechs Monaten nach dem Tag, an dem die Eintragung der Verschmelzung in das Register des Sitzes desjenigen Rechtsträgers, dessen Gläubiger sie sind, nach § 19  Abs.  3 UmwG als bekannt gemacht gilt, ihren Anspruch nach Grund und Höhe schriftlich anmelden, Sicherheit zu leisten, soweit sie nicht Befriedigung verlangen können. Dieses Recht steht den Gläubigern jedoch nur zu, wenn sie glaubhaft machen, dass durch die Verschmelzung die Erfüllung der Forderung gefährdet wird."
    },
    {
      "date": "2025-05-21",
      "id": "109785",
      "original_text": "Registerbekanntmachung nach dem Umwandlungsgesetz\nNiedersachsen Amtsgericht Oldenburg (Oldenburg) HRA 208366\nGFT Uffen e.K. – Apen",
      "type": "Registerbekanntmachung nach dem Umwandlungsgesetz",
      "state": "Niedersachsen",
      "amtsgericht": "Amtsgericht Oldenburg (Oldenburg)",
      "registernummer": "HRA 208366",
      "registerart": "HRA",
      "company_name": "GFT Uffen e.K.",
      "company_seat": "Apen",
      "details": "21.05.2025 (Bekanntmachungsdatum)\n\nNiedersachsen Amtsgericht Oldenburg (Oldenburg) HRA 208366\nRegisterbekanntmachung nach dem Umwandlungsgesetz 21.05.2025 (Eintragungsdatum)\n\nGFT Uffen e.K.\nEinzelkaufmann / Einzelkauffrau\nApen\n\nDen Gläubigern der an der Ausgliederung beteiligten Rechtsträger ist, wenn sie binnen sechs Monaten nach dem Tag, an dem die Eintragung der Ausgliederung in das Register des Sitzes desjenigen Rechtsträgers, dessen Gläubiger sie sind, nach § 19 Abs. 3 UmwG als bekannt gemacht gilt, ihren Anspruch nach Grund und Höhe schriftlich anmelden, Sicherheit zu leisten, soweit sie nicht Befriedigung verlangen können. Dieses Recht steht den Gläubigern jedoch nur zu, wenn sie glaubhaft machen, dass durch die Ausgliederung die Erfüllung der Forderung gefährdet wird."
    },
    {
      "date": "2025-05-21",
      "id": "109786",
      "original_text": "Löschungsankündigung\nNiedersachsen Amtsgericht Lüneburg HRB 210504\nAV Haustechnik GmbH – Toppenstedt",
      "type": "Löschungsankündigung",
      "state": "Niedersachsen",
      "amtsgericht": "Amtsgericht Lüneburg",
      "registernummer": "HRB 210504",
      "registerart": "HRB",
      "company_name": "AV Haustechnik GmbH",
      "company_seat": "Toppenstedt",
      "details": "21.05.2025 (Bekanntmachungsdatum)\n\nNiedersachsen Amtsgericht Lüneburg HRB 210504\nLöschungsankündigung\n\nAV Haustechnik GmbH\nGesellschaft mit beschränkter Haftung\nToppenstedt\n\nDas Registergericht beabsichtigt, die Gesellschaft von Amts wegen nach § 394 FamFG zu löschen. Die Frist zur Erhebung eines Widerspruchs ist auf 1 Monat ab dieser Registerbekanntmachung festgesetzt."
    },
    {
      "date": "2025-05-21",
      "id": "109787",
      "original_text": "Einreichung neuer Dokumente\nNiedersachsen Amtsgericht Hannover HRB 3669\nContinental Automotive Technologies GmbH – Hannover",
      "type": "Einreichung neuer Dokumente",
      "state": "Niedersachsen",
      "amtsgericht": "Amtsgericht Hannover",
      "registernummer": "HRB 3669",
      "registerart": "HRB",
      "company_name": "Continental Automotive Technologies GmbH",
      "company_seat": "Hannover",
      "details": "21.05.2025 (Bekanntmachungsdatum)\n\nNiedersachsen Amtsgericht Hannover HRB 3669\nEinreichung neuer Dokumente 21.05.2025 (Eintragungsdatum)\n\nContinental Automotive Technologies GmbH\nGesellschaft mit beschränkter Haftung\nHannover\n\nDie Liste der Mitglieder des Aufsichtsrats wurde beim Registergericht eingereicht."
    },
    {
      "date": "2025-05-21",
      "id": "109788",
      "original_text": "Löschungsankündigung\nNiedersachsen Amtsgericht Hildesheim HRB 200271\nKai Schrader Verwaltungs GmbH – Holzminden",
      "type": "Löschungsankündigung",
      "state": "Niedersachsen",
      "amtsgericht": "Amtsgericht Hildesheim",
      "registernummer": "HRB 200271",
      "registerart": "HRB",
      "company_name": "Kai Schrader Verwaltungs GmbH",
      "company_seat": "Holzminden",
      "details": "21.05.2025 (Bekanntmachungsdatum)\n\nNiedersachsen Amtsgericht Hildesheim HRB 200271\nLöschungsankündigung\n\nKai Schrader Verwaltungs GmbH\nGesellschaft mit beschränkter Haftung\nHolzminden\n\nDas Registergericht beabsichtigt, die Gesellschaft von Amts wegen nach § 394 FamFG zu löschen. Die Frist zur Erhebung eines Widerspruchs ist auf 1 Monat ab dieser Registerbekanntmachung festgesetzt."
    },
    {
      "date": "2025-05-21",
      "id": "109789",
      "original_text": "Löschungsankündigung\nNiedersachsen Amtsgericht Osnabrück VR 120004\nGEGEN - SUCHT EMSLAND e.V. – Meppen",
      "type": "Löschungsankündigung",
      "state": "Niedersachsen",
      "amtsgericht": "Amtsgericht Osnabrück",
      "registernummer": "VR 120004",
      "registerart": "VR",
      "company_name": "GEGEN - SUCHT EMSLAND e.V.",
      "company_seat": "Meppen",
      "details": "21.05.2025 (Bekanntmachungsdatum)\n\nNiedersachsen Amtsgericht Osnabrück VR 120004\nLöschungsankündigung\n\nGEGEN - SUCHT EMSLAND e.V.\neingetragener Verein\nMeppen\n\nDas Registergericht beabsichtigt, den Verein von Amts wegen nach § 395 FamFG aufgrund Wegfall aller Mitglieder zu löschen. Die Frist zur Erhebung eines Widerspruchs ist auf 3 Wochen ab dieser Registerbekanntmachung festgesetzt."
    },
    {
      "date": "2025-05-21",
      "id": "109790",
      "original_text": "Löschungsankündigung\nNiedersachsen Amtsgericht Hildesheim HRB 206646\nsponway UG (haftungsbeschränkt) – Hildesheim",
      "type": "Löschungsankündigung",
      "state": "Niedersachsen",
      "amtsgericht": "Amtsgericht Hildesheim",
      "registernummer": "HRB 206646",
      "registerart": "HRB",
      "company_name": "sponway UG (haftungsbeschränkt)",
      "company_seat": "Hildesheim",
      "details": "21.05.2025 (Bekanntmachungsdatum)\n\nNiedersachsen Amtsgericht Hildesheim HRB 206646\nLöschungsankündigung 21.05.2025 (Eintragungsdatum)\n\nsponway UG (haftungsbeschränkt)\nGesellschaft mit beschränkter Haftung\nHildesheim\n\nDas Registergericht beabsichtigt, die Gesellschaft von Amts wegen nach § 394 FamFG zu löschen. Die Frist zur Erhebung eines Widerspruchs ist auf 1 Monat ab dieser Registerbekanntmachung festgesetzt."
    },
    {
      "date": "2025-05-21",
      "id": "109791",
      "original_text": "Registerbekanntmachung nach dem Umwandlungsgesetz\nBremen Amtsgericht Bremen HRB 41170\nPREIG Tannhäuser GmbH – Bremerhaven",
      "type": "Registerbekanntmachung nach dem Umwandlungsgesetz",
      "state": "Bremen",
      "amtsgericht": "Amtsgericht Bremen",
      "registernummer": "HRB 41170",
      "registerart": "HRB",
      "company_name": "PREIG Tannhäuser GmbH",
      "company_seat": "Bremerhaven",
      "details": "21.05.2025 (Bekanntmachungsdatum)\n\nBremen Amtsgericht Bremen HRB 41170\nRegisterbekanntmachung nach dem Umwandlungsgesetz 15.05.2025 (Eintragungsdatum)\n\nPREIG Tannhäuser GmbH\nGesellschaft mit beschränkter Haftung\nBremerhaven\n\nZu Eintragungsnummer 2 vom 15.05.2025 wird als nicht eingetragen veröffentlicht: Den Gläubigern der an der Verschmelzung beteiligten Rechtsträger ist, wenn sie binnen sechs Monaten nach dem Tag, an dem die Eintragung der Verschmelzung in das Register des Sitzes desjenigen Rechtsträgers, dessen Gläubiger sie sind, als bekannt gemacht gilt, ihren Anspruch nach Grund und Höhe schriftlich anmelden, Sicherheit zu leisten, soweit sie nicht Befriedigung verlangen können. Dieses Recht steht den Gläubigern jedoch nur zu, wenn sie glaubhaft machen, dass durch die Verschmelzung die Erfüllung ihrer Forderung gefährdet wird. Das Recht, Sicherheitsleistung zu verlangen, steht Gläubigern nicht zu, die im Falle der Insolvenz ein Recht auf vorzugsweise Befriedigung aus einer Deckungsmasse haben, die nach gesetzlicher Vorschrift zu ihrem Schutz errichtet und staatlich überwacht ist."
    },
    {
      "date": "2025-05-21",
      "id": "109792",
      "original_text": "Registerbekanntmachung nach dem Umwandlungsgesetz\nBremen Amtsgericht Bremen HRB 41079\nPREIG-R GmbH – Bremerhaven",
      "type": "Registerbekanntmachung nach dem Umwandlungsgesetz",
      "state": "Bremen",
      "amtsgericht": "Amtsgericht Bremen",
      "registernummer": "HRB 41079",
      "registerart": "HRB",
      "company_name": "PREIG-R GmbH",
      "company_seat": "Bremerhaven",
      "details": "21.05.2025 (Bekanntmachungsdatum)\n\nBremen Amtsgericht Bremen HRB 41079\nRegisterbekanntmachung nach dem Umwandlungsgesetz 15.05.2025 (Eintragungsdatum)\n\nPREIG-R GmbH\nGesellschaft mit beschränkter Haftung\nBremerhaven\n\nZu Eintragungsnummer 2 vom 15.05.2025 wird als nicht eingetragen veröffentlicht: Den Gläubigern der an der Verschmelzung beteiligten Rechtsträger ist, wenn sie binnen sechs Monaten nach dem Tag, an dem die Eintragung der Verschmelzung in das Register des Sitzes desjenigen Rechtsträgers, dessen Gläubiger sie sind, als bekannt gemacht gilt, ihren Anspruch nach Grund und Höhe schriftlich anmelden, Sicherheit zu leisten, soweit sie nicht Befriedigung verlangen können. Dieses Recht steht den Gläubigern jedoch nur zu, wenn sie glaubhaft machen, dass durch die Verschmelzung die Erfüllung ihrer Forderung gefährdet wird. Das Recht, Sicherheitsleistung zu verlangen, steht Gläubigern nicht zu, die im Falle der Insolvenz ein Recht auf vorzugsweise Befriedigung aus einer Deckungsmasse haben, die nach gesetzlicher Vorschrift zu ihrem Schutz errichtet und staatlich überwacht ist."
    },
    {
      "date": "2025-05-21",
      "id": "109793",
      "original_text": "Löschungsankündigung\nBremen Amtsgericht Bremen HRB 36319\nKORONE BAU LOGISTIK SERVICE GmbH – Bremerhaven",
      "type": "Löschungsankündigung",
      "state": "Bremen",
      "amtsgericht": "Amtsgericht Bremen",
      "registernummer": "HRB 36319",
      "registerart": "HRB",
      "company_name": "KORONE BAU LOGISTIK SERVICE GmbH",
      "company_seat": "Bremerhaven",
      "details": "21.05.2025 (Bekanntmachungsdatum)\n\nBremen Amtsgericht Bremen HRB 36319\nLöschungsankündigung\n\nKORONE BAU LOGISTIK SERVICE GmbH\nGesellschaft mit beschränkter Haftung\nBremerhaven\n\nEs ist beabsichtigt die im Handelsregister eingetragene Gesellschaft von Amts wegen gemäß § 394 FamFG zu löschen. Gegen die Löschung kann beim AG Bremen schriftlich oder zu Protokoll der Geschäftsstelle Widerspruch eingelegt werden. Widerspruchsfrist 4 Wochen."
    },
    {
      "date": "2025-05-21",
      "id": "109794",
      "original_text": "Löschungsankündigung\nRheinland-Pfalz Amtsgericht Ludwigshafen a.Rhein (Ludwigshafen) HRB 66109\npixelschupser GmbH – Speyer",
      "type": "Löschungsankündigung",
      "state": "Rheinland-Pfalz",
      "amtsgericht": "Amtsgericht Ludwigshafen a.Rhein (Ludwigshafen)",
      "registernummer": "HRB 66109",
      "registerart": "HRB",
      "company_name": "pixelschupser GmbH",
      "company_seat": "Speyer",
      "details": "21.05.2025 (Bekanntmachungsdatum)\n\nRheinland-Pfalz Amtsgericht Ludwigshafen a.Rhein (Ludwigshafen) HRB 66109\nLöschungsankündigung\n\npixelschupser GmbH\nGesellschaft mit beschränkter Haftung\nSpeyer\n\nDas Registergericht beabsichtigt die Gesellschaft von Amts wegen nach § 394 FamFG zu löschen. Die Frist zur Erhebung eines Widerspruchs ist auf einen Monat festgesetzt."
    },
    {
      "date": "2025-05-21",
      "id": "109795",
      "original_text": "Einreichung neuer Dokumente\nRheinland-Pfalz Amtsgericht Mainz HRB 6091\nAareon Deutschland GmbH – Mainz",
      "type": "Einreichung neuer Dokumente",
      "state": "Rheinland-Pfalz",
      "amtsgericht": "Amtsgericht Mainz",
      "registernummer": "HRB 6091",
      "registerart": "HRB",
      "company_name": "Aareon Deutschland GmbH",
      "company_seat": "Mainz",
      "details": "21.05.2025 (Bekanntmachungsdatum)\n\nRheinland-Pfalz Amtsgericht Mainz HRB 6091\nEinreichung neuer Dokumente\n\nAareon Deutschland GmbH\nGesellschaft mit beschränkter Haftung\nMainz\n\nDem Registergericht ist eine neue Liste der Mitglieder des Aufsichtsrates eingereicht worden."
    },
    {
      "date": "2025-05-21",
      "id": "109796",
      "original_text": "Löschungsankündigung\nRheinland-Pfalz Amtsgericht Ludwigshafen a.Rhein (Ludwigshafen) HRB 64468\nfileon Unternehmergesellschaft (haftungsbeschränkt) – Ludwigshafen/Rhein",
      "type": "Löschungsankündigung",
      "state": "Rheinland-Pfalz",
      "amtsgericht": "Amtsgericht Ludwigshafen a.Rhein (Ludwigshafen)",
      "registernummer": "HRB 64468",
      "registerart": "HRB",
      "company_name": "fileon Unternehmergesellschaft (haftungsbeschränkt)",
      "company_seat": "Ludwigshafen/Rhein",
      "details": "21.05.2025 (Bekanntmachungsdatum)\n\nRheinland-Pfalz Amtsgericht Ludwigshafen a.Rhein (Ludwigshafen) HRB 64468\nLöschungsankündigung\n\nfileon Unternehmergesellschaft (haftungsbeschränkt)\nGesellschaft mit beschränkter Haftung\nLudwigshafen/Rhein\n\nDas Registergericht beabsichtigt die Gesellschaft von Amts wegen nach § 394 FamFG zu löschen. Die Frist zur Erhebung eines Widerspruchs ist auf einen Monat festgesetzt."
    },
    {
      "date": "2025-05-21",
      "id": "109797",
      "original_text": "Registerbekanntmachung nach dem Umwandlungsgesetz\nNordrhein-Westfalen Amtsgericht Köln HRB 116078\nBeelnnovations GmbH – Köln",
      "type": "Registerbekanntmachung nach dem Umwandlungsgesetz",
      "state": "Nordrhein-Westfalen",
      "amtsgericht": "Amtsgericht Köln",
      "registernummer": "HRB 116078",
      "registerart": "HRB",
      "company_name": "Beelnnovations GmbH",
      "company_seat": "Köln",
      "details": "21.05.2025 (Bekanntmachungsdatum)\n\nNordrhein-Westfalen Amtsgericht Köln HRB 116078\nRegisterbekanntmachung nach dem Umwandlungsgesetz 21.05.2025 (Eintragungsdatum)\n\nBeelnnovations GmbH\nGesellschaft mit beschränkter Haftung\nKöln\n\nDen Gläubigern der an der Verschmelzung beteiligten Rechtsträger ist, wenn sie binnen sechs Monaten nach dem Tag, an dem die Eintragung der Verschmelzung in das Register des Sitzes desjenigen Rechtsträgers, dessen Gläubiger sie sind, nach § 19 Absatz 3 UmwG als bekanntgemacht gilt, ihren Anspruch nach Grund und Höhe schriftlich anmelden, Sicherheit zu leisten, soweit sie nicht Befriedigung verlangen können. Dieses Recht steht den Gläubigern jedoch nur zu, wenn sie glaubhaft machen, dass durch die Verschmelzung die Erfüllung ihrer Forderung gefährdet wird."
    },
    {
      "date": "2025-05-21",
      "id": "109798",
      "original_text": "Löschungsankündigung\nNordrhein-Westfalen Amtsgericht Gelsenkirchen HRB 13598\nHausmeisterservice Wein UG (haftungsbeschränkt) – Haltern am See",
      "type": "Löschungsankündigung",
      "state": "Nordrhein-Westfalen",
      "amtsgericht": "Amtsgericht Gelsenkirchen",
      "registernummer": "HRB 13598",
      "registerart": "HRB",
      "company_name": "Hausmeisterservice Wein UG (haftungsbeschränkt)",
      "company_seat": "Haltern am See",
      "details": "21.05.2025 (Bekanntmachungsdatum)\n\nNordrhein-Westfalen Amtsgericht Gelsenkirchen HRB 13598\nLöschungsankündigung\n\nHausmeisterservice Wein UG (haftungsbeschränkt)\nGesellschaft mit beschränkter Haftung\nHaltern am See\n\nDas Gericht beabsichtigt, die Gesellschaft Hausmeisterservice Wein UG (haftungsbeschränkt) mit Sitz in Haltern am See, HRB 13598 Amtsgericht Gelsenkirchen, wegen Vermögenslosigkeit zu löschen.\n\nHiermit wird denjenigen, die an der Unterlassung der Löschung ein berechtigtes Interesse haben, gem. § 394 Abs. 2 FamFG Gelegenheit gegeben, gegen dieses Vorhaben binnen eines Monats nach dieser Bekanntmachung Widerspruch einzulegen. Der Widerspruch kann schriftlich oder zu Protokoll der Geschäftsstelle erhoben werden."
    },
    {
      "date": "2025-05-21",
      "id": "109799",
      "original_text": "Löschungsankündigung\nNordrhein-Westfalen Amtsgericht Düsseldorf HRB 86616\nALUCAST FÜR METALLE GmbH – Düsseldorf",
      "type": "Löschungsankündigung",
      "state": "Nordrhein-Westfalen",
      "amtsgericht": "Amtsgericht Düsseldorf",
      "registernummer": "HRB 86616",
      "registerart": "HRB",
      "company_name": "ALUCAST FÜR METALLE GmbH",
      "company_seat": "Düsseldorf",
      "details": "21.05.2025 (Bekanntmachungsdatum)\n\nNordrhein-Westfalen Amtsgericht Düsseldorf HRB 86616\nLöschungsankündigung\n\nALUCAST FÜR METALLE GmbH\nGesellschaft mit beschränkter Haftung\nDüsseldorf\n\nDas Registergericht beabsichtigt die Gesellschaft von Amts wegen nach § 394 Abs. 1 FamFG zu löschen. Die Frist zur Erhebung eines Widerspruchs ist auf einen Monat festgesetzt.\n\nRechtsbehelfsbelehrung:\nDas Widerspruchsrecht steht jedem zu, der an der Unterlassung der Löschung ein berechtigtes Interesse hat. Der Widerspruch ist bei dem Amtsgericht Düsseldorf -Registergericht-, Werdener Straße 1, 40227 Düsseldorf schriftlich in deutscher Sprache oder zur Niederschrift der Geschäftsstelle einzulegen. Der Widerspruch kann auch zur Niederschrift der Geschäftsstelle eines jeden Amtsgerichtes abgegeben werden. Die Einlegung ist auch durch Übertragung eines elektronischen Dokuments an die elektronische Poststelle des Gerichts möglich. Das elektronische Dokument muss für die Bearbeitung durch das Gericht geeignet und mit einer qualifizierten elektronischen Signatur der verantwortenden Person versehen sein oder von der verantwortenden Person signiert und auf einem sicheren Übermittlungsweg gemäß § 130a ZPO nach näherer Maßgabe der Verordnung über die technischen Rahmenbedingungen des elektronischen Rechtsverkehrs und über das besondere elektronische Behördenpostfach (BGBl. I, S.3803) eingereicht werden. Weitere Informationen erhalten Sie auf der Internetseite www.justiz.de.\nDer Widerspruch muss spätestens innerhalb der gesetzten Frist nach dem Datum der Bekanntmachung der Löschungsankündigung bei dem Amtsgericht - Registergericht - Düsseldorf eingegangen sein.  Dies gilt auch dann, wenn der Widerspruch zur Niederschrift der Geschäftsstelle eines anderen Amtsgerichtes abgegeben wurde. Die Frist beginnt mit dem Tage der Bekanntmachung der Löschungsankündigung in dem für die Bekanntmachung der Eintragungen in das Handelsregister bestimmten elektronischen Informations- und Kommunikationssystem nach § 10 des Handelsgesetzbuches. Fällt das Ende der Frist auf einen Sonntag, einen allgemeinen Feiertag oder Sonnabend, so endet die Frist mit Ablauf des nächsten Werktages.\nDer Widerspruch muss die Bezeichnung der angefochtenen Löschungsankündigung sowie die Erklärung enthalten, dass Widerspruch gegen diese Löschungsankündigung eingelegt wird. Er ist zu unterzeichnen und soll begründet werden."
    },
    {
      "date": "2025-05-21",
      "id": "109800",
      "original_text": "Löschungsankündigung\nNordrhein-Westfalen Amtsgericht Krefeld HRB 16179\nWohndesign - Fußbodentechnik UG (haftungsbeschränkt) – Krefeld",
      "type": "Löschungsankündigung",
      "state": "Nordrhein-Westfalen",
      "amtsgericht": "Amtsgericht Krefeld",
      "registernummer": "HRB 16179",
      "registerart": "HRB",
      "company_name": "Wohndesign - Fußbodentechnik UG (haftungsbeschränkt)",
      "company_seat": "Krefeld",
      "details": "21.05.2025 (Bekanntmachungsdatum)\n\nNordrhein-Westfalen Amtsgericht Krefeld HRB 16179\nLöschungsankündigung\n\nWohndesign - Fußbodentechnik UG (haftungsbeschränkt)\nGesellschaft mit beschränkter Haftung\nKrefeld\n\nDas Registergericht beabsichtigt die Gesellschaft von Amts wegen nach § 394 FamFG zu löschen. Die Frist zur Erhebung eines Widerspruchs ist auf einen Monat festgesetzt."
    },
    {
      "date": "2025-05-21",
      "id": "109801",
      "original_text": "Einreichung neuer Dokumente\nNordrhein-Westfalen Amtsgericht Münster HRB 21881\nIQ Immo Donau Wald AG – Münster",
      "type": "Einreichung neuer Dokumente",
      "state": "Nordrhein-Westfalen",
      "amtsgericht": "Amtsgericht Münster",
      "registernummer": "HRB 21881",
      "registerart": "HRB",
      "company_name": "IQ Immo Donau Wald AG",
      "company_seat": "Münster",
      "details": "21.05.2025 (Bekanntmachungsdatum)\n\nNordrhein-Westfalen Amtsgericht Münster HRB 21881\nEinreichung neuer Dokumente\n\nIQ Immo Donau Wald AG\nAktiengesellschaft\nMünster\n\nDem Registergericht ist eine neue Liste der Mitglieder des Aufsichtsrates eingereicht worden."
    },
    {
      "date": "2025-05-21",
      "id": "109802",
      "original_text": "Einreichung neuer Dokumente\nNordrhein-Westfalen Amtsgericht Köln HRB 2168\nDeutsche Lufthansa Aktiengesellschaft – Köln",
      "type": "Einreichung neuer Dokumente",
      "state": "Nordrhein-Westfalen",
      "amtsgericht": "Amtsgericht Köln",
      "registernummer": "HRB 2168",
      "registerart": "HRB",
      "company_name": "Deutsche Lufthansa Aktiengesellschaft",
      "company_seat": "Köln",
      "details": "21.05.2025 (Bekanntmachungsdatum)\n\nNordrhein-Westfalen Amtsgericht Köln HRB 2168\nEinreichung neuer Dokumente 21.05.2025 (Eintragungsdatum)\n\nDeutsche Lufthansa Aktiengesellschaft\nAktiengesellschaft\nKöln\n\nDem Registergericht ist eine neue Liste der Mitglieder des Aufsichtsrates eingereicht worden."
    },
    {
      "date": "2025-05-21",
      "id": "109803",
      "original_text": "Einreichung neuer Dokumente\nNordrhein-Westfalen Amtsgericht Hamm HRB 6730\nDistra Handels GmbH – Bönen",
      "type": "Einreichung neuer Dokumente",
      "state": "Nordrhein-Westfalen",
      "amtsgericht": "Amtsgericht Hamm",
      "registernummer": "HRB 6730",
      "registerart": "HRB",
      "company_name": "Distra Handels GmbH",
      "company_seat": "Bönen",
      "details": "21.05.2025 (Bekanntmachungsdatum)\n\nNordrhein-Westfalen Amtsgericht Hamm HRB 6730\nEinreichung neuer Dokumente\n\nDistra Handels GmbH\nGesellschaft mit beschränkter Haftung\nBönen\n\nDem Registergericht ist eine neue Liste der Mitglieder des Aufsichtsrates eingereicht worden."
    },
    {
      "date": "2025-05-21",
      "id": "109804",
      "original_text": "Löschungsankündigung\nNordrhein-Westfalen Amtsgericht Münster HRA 6186\nHapke Parkett Objekt GmbH & Co. KG – Ahlen",
      "type": "Löschungsankündigung",
      "state": "Nordrhein-Westfalen",
      "amtsgericht": "Amtsgericht Münster",
      "registernummer": "HRA 6186",
      "registerart": "HRA",
      "company_name": "Hapke Parkett Objekt GmbH & Co. KG",
      "company_seat": "Ahlen",
      "details": "21.05.2025 (Bekanntmachungsdatum)\n\nNordrhein-Westfalen Amtsgericht Münster HRA 6186\nLöschungsankündigung\n\nHapke Parkett Objekt GmbH & Co. KG\nKommanditgesellschaft\nAhlen\n\nDas Registergericht beabsichtigt die Firma von Amts wegen nach § 394 FamFG zu löschen. Die Frist zur Erhebung eines Widerspruchs ist auf einen Monat festgesetzt."
    },
    {
      "date": "2025-05-21",
      "id": "109805",
      "original_text": "Registerbekanntmachung nach dem Umwandlungsgesetz\nNordrhein-Westfalen Amtsgericht Köln HRA 36487\nFrüh VPK GmbH & Co. KG – Köln",
      "type": "Registerbekanntmachung nach dem Umwandlungsgesetz",
      "state": "Nordrhein-Westfalen",
      "amtsgericht": "Amtsgericht Köln",
      "registernummer": "HRA 36487",
      "registerart": "HRA",
      "company_name": "Früh VPK GmbH & Co. KG",
      "company_seat": "Köln",
      "details": "21.05.2025 (Bekanntmachungsdatum)\n\nNordrhein-Westfalen Amtsgericht Köln HRA 36487\nRegisterbekanntmachung nach dem Umwandlungsgesetz 21.05.2025 (Eintragungsdatum)\n\nFrüh VPK GmbH & Co. KG\nKommanditgesellschaft\nKöln\n\nDen Gläubigern der an der Ausgliederung beteiligten Rechtsträger ist, wenn sie binnen sechs Monaten nach dem Tag, an dem die Eintragung der Ausgliederung in das Register des Sitzes desjenigen Rechtsträgers, dessen Gläubiger sie sind, nach § 19 Absatz 3 UmwG als bekanntgemacht gilt, ihren Anspruch nach Grund und Höhe schriftlich anmelden, Sicherheit zu leisten, soweit sie nicht Befriedigung verlangen können. Dieses Recht steht den Gläubigern jedoch nur zu, wenn sie glaubhaft machen, dass durch die Ausgliederung die Erfüllung ihrer Forderung gefährdet wird."
    },
    {
      "date": "2025-05-21",
      "id": "109806",
      "original_text": "Löschungsankündigung\nNordrhein-Westfalen Amtsgericht Krefeld HRB 2521\nTescoha GmbH – Kiefeld",
      "type": "Löschungsankündigung",
      "state": "Nordrhein-Westfalen",
      "amtsgericht": "Amtsgericht Krefeld",
      "registernummer": "HRB 2521",
      "registerart": "HRB",
      "company_name": "Tescoha GmbH",
      "company_seat": "Kiefeld",
      "details": "21.05.2025 (Bekanntmachungsdatum)\n\nNordrhein-Westfalen Amtsgericht Krefeld HRB 2521\nLöschungsankündigung\n\nTescoha GmbH\nGesellschaft mit beschränkter Haftung\nKiefeld\n\nDas Registergericht beabsichtigt die Gesellschaft von Amts wegen nach § 394 FamFG zu löschen. Die Frist zur Erhebung eines Widerspruchs ist auf einen Monat festgesetzt."
    },
    {
      "date": "2025-05-21",
      "id": "109807",
      "original_text": "Einreichung neuer Dokumente\nNordrhein-Westfalen Amtsgericht Bochum HRB 22058\nTiemeyer Holding SE – Bochum",
      "type": "Einreichung neuer Dokumente",
      "state": "Nordrhein-Westfalen",
      "amtsgericht": "Amtsgericht Bochum",
      "registernummer": "HRB 22058",
      "registerart": "HRB",
      "company_name": "Tiemeyer Holding SE",
      "company_seat": "Bochum",
      "details": "21.05.2025 (Bekanntmachungsdatum)\n\nNordrhein-Westfalen Amtsgericht Bochum HRB 22058\nEinreichung neuer Dokumente 21.05.2025 (Eintragungsdatum)\n\nTiemeyer Holding SE\nEuropäische Aktiengesellschaft (SE)\nBochum\n\nDem Registergericht ist eine neue Liste der Mitglieder des Aufsichtsrates eingereicht worden."
    },
    {
      "date": "2025-05-21",
      "id": "109808",
      "original_text": "Registerbekanntmachung nach dem Umwandlungsgesetz\nNordrhein-Westfalen Amtsgericht Siegen HRA 10023\nJessica Bock e. K. – Attendorn",
      "type": "Registerbekanntmachung nach dem Umwandlungsgesetz",
      "state": "Nordrhein-Westfalen",
      "amtsgericht": "Amtsgericht Siegen",
      "registernummer": "HRA 10023",
      "registerart": "HRA",
      "company_name": "Jessica Bock e. K.",
      "company_seat": "Attendorn",
      "details": "21.05.2025 (Bekanntmachungsdatum)\n\nNordrhein-Westfalen Amtsgericht Siegen HRA 10023\nRegisterbekanntmachung nach dem Umwandlungsgesetz 17.04.2025 (Eintragungsdatum)\n\nJessica Bock e. K.\nEinzelkaufmann / Einzelkauffrau\nAttendorn\n\nDen Gläubigern der an der Ausgliederung beteiligten Rechtsträger ist, wenn sie binnen sechs Monaten nach dem Tag, an dem die Eintragung der Ausgliederung in das Register des Sitzes desjenigen Rechtsträgers, dessen Gläubiger sie sind, nach § 19 Absatz 3 UmwG als bekanntgemacht gilt, ihren Anspruch nach Grund und Höhe schriftlich anmelden, Sicherheit zu leisten, soweit sie nicht Befriedigung verlangen können. Dieses Recht steht den Gläubigern jedoch nur zu, wenn sie glaubhaft machen, dass durch die Ausgliederung die Erfüllung ihrer Forderung gefährdet wird."
    },
    {
      "date": "2025-05-21",
      "id": "109809",
      "original_text": "Registerbekanntmachung nach dem Umwandlungsgesetz\nNordrhein-Westfalen Amtsgericht Köln HRB 121082\nElegance Transporte GmbH – Wesseling",
      "type": "Registerbekanntmachung nach dem Umwandlungsgesetz",
      "state": "Nordrhein-Westfalen",
      "amtsgericht": "Amtsgericht Köln",
      "registernummer": "HRB 121082",
      "registerart": "HRB",
      "company_name": "Elegance Transporte GmbH",
      "company_seat": "Wesseling",
      "details": "21.05.2025 (Bekanntmachungsdatum)\n\nNordrhein-Westfalen Amtsgericht Köln HRB 121082\nRegisterbekanntmachung nach dem Umwandlungsgesetz 21.05.2025 (Eintragungsdatum)\n\nElegance Transporte GmbH\nGesellschaft mit beschränkter Haftung\nWesseling\n\nDen Gläubigern der an der Verschmelzung beteiligten Rechtsträger ist, wenn sie binnen sechs Monaten nach dem Tag, an dem die Eintragung der Verschmelzung in das Register des Sitzes desjenigen Rechtsträgers, dessen Gläubiger sie sind, nach § 19 Absatz 3 UmwG als bekanntgemacht gilt, ihren Anspruch nach Grund und Höhe schriftlich anmelden, Sicherheit zu leisten, soweit sie nicht Befriedigung verlangen können. Dieses Recht steht den Gläubigern jedoch nur zu, wenn sie glaubhaft machen, dass durch die Verschmelzung die Erfüllung ihrer Forderung gefährdet wird."
    },
    {
      "date": "2025-05-21",
      "id": "109810",
      "original_text": "Löschungsankündigung\nNordrhein-Westfalen Amtsgericht Hamm HRB 10180\nMetallbau Gadiel Geschäftsführungs- und Verwaltungs-GmbH – Hamm",
      "type": "Löschungsankündigung",
      "state": "Nordrhein-Westfalen",
      "amtsgericht": "Amtsgericht Hamm",
      "registernummer": "HRB 10180",
      "registerart": "HRB",
      "company_name": "Metallbau Gadiel Geschäftsführungs- und Verwaltungs-GmbH",
      "company_seat": "Hamm",
      "details": "21.05.2025 (Bekanntmachungsdatum)\n\nNordrhein-Westfalen Amtsgericht Hamm HRB 10180\nLöschungsankündigung\n\nMetallbau Gadiel Geschäftsführungs- und Verwaltungs-GmbH\nGesellschaft mit beschränkter Haftung\nHamm\n\nDas Registergericht beabsichtigt die Gesellschaft von Amts wegen nach § 394 FamFG zu löschen. Die Frist zur Erhebung eines Widerspruchs ist auf drei Monate festgesetzt."
    },
    {
      "date": "2025-05-21",
      "id": "109811",
      "original_text": "Einreichung neuer Dokumente\nNordrhein-Westfalen Amtsgericht Essen HRB 17474\nSchenker Aktiengesellschaft – Essen",
      "type": "Einreichung neuer Dokumente",
      "state": "Nordrhein-Westfalen",
      "amtsgericht": "Amtsgericht Essen",
      "registernummer": "HRB 17474",
      "registerart": "HRB",
      "company_name": "Schenker Aktiengesellschaft",
      "company_seat": "Essen",
      "details": "21.05.2025 (Bekanntmachungsdatum)\n\nNordrhein-Westfalen Amtsgericht Essen HRB 17474\nEinreichung neuer Dokumente\n\nSchenker Aktiengesellschaft\nAktiengesellschaft\nEssen\n\nDem Registergericht ist eine neue Liste der Mitglieder des Aufsichtsrates eingereicht worden."
    },
    {
      "date": "2025-05-21",
      "id": "109812",
      "original_text": "Löschungsankündigung\nNordrhein-Westfalen Amtsgericht Siegen HRA 9343\nAK Transsolution Ltd. & Co. KG – Olpe",
      "type": "Löschungsankündigung",
      "state": "Nordrhein-Westfalen",
      "amtsgericht": "Amtsgericht Siegen",
      "registernummer": "HRA 9343",
      "registerart": "HRA",
      "company_name": "AK Transsolution Ltd. & Co. KG",
      "company_seat": "Olpe",
      "details": "21.05.2025 (Bekanntmachungsdatum)\n\nNordrhein-Westfalen Amtsgericht Siegen HRA 9343\nLöschungsankündigung\n\nAK Transsolution Ltd. & Co. KG\nKommanditgesellschaft\nOlpe\n\nDas Registergericht beabsichtigt die Firma von Amts wegen nach § 31 Abs. 2 HGB, § 393 FamFG zu löschen. Die Frist zur Erhebung eines Widerspruchs ist auf einen Monat festgesetzt."
    },
    {
      "date": "2025-05-21",
      "id": "109813",
      "original_text": "Registerbekanntmachung nach dem Umwandlungsgesetz\nNordrhein-Westfalen Amtsgericht Essen HRB 34401\nthyssenkrupp Projekt 10 GmbH – Essen",
      "type": "Registerbekanntmachung nach dem Umwandlungsgesetz",
      "state": "Nordrhein-Westfalen",
      "amtsgericht": "Amtsgericht Essen",
      "registernummer": "HRB 34401",
      "registerart": "HRB",
      "company_name": "thyssenkrupp Projekt 10 GmbH",
      "company_seat": "Essen",
      "details": "21.05.2025 (Bekanntmachungsdatum)\n\nNordrhein-Westfalen Amtsgericht Essen HRB 34401\nRegisterbekanntmachung nach dem Umwandlungsgesetz 21.05.2025 (Eintragungsdatum)\n\nthyssenkrupp Projekt 10 GmbH\nGesellschaft mit beschränkter Haftung\nEssen\n\nDen Gläubigern der an der formwechselnden Umwandlung beteiligten Rechtsträger ist, wenn sie binnen sechs Monaten nach dem Tag, an dem die Eintragung der formwechselnden Umwandlung in das Register des Sitzes desjenigen Rechtsträgers, dessen Gläubiger sie sind, nach § 19 Absatz 3 UmwG als bekanntgemacht gilt, ihren Anspruch nach Grund und Höhe schriftlich anmelden, Sicherheit zu leisten, soweit sie nicht Befriedigung verlangen können. Dieses Recht steht den Gläubigern jedoch nur zu, wenn sie glaubhaft machen, dass durch die formwechselnden Umwandlung die Erfüllung ihrer Forderung gefährdet wird."
    },
    {
      "date": "2025-05-21",
      "id": "109814",
      "original_text": "Registerbekanntmachung nach dem Umwandlungsgesetz\nNordrhein-Westfalen Amtsgericht Bad Oeynhausen HRB 15477\nHISB Betreuungsdienst Halle Herford GmbH – Herford",
      "type": "Registerbekanntmachung nach dem Umwandlungsgesetz",
      "state": "Nordrhein-Westfalen",
      "amtsgericht": "Amtsgericht Bad Oeynhausen",
      "registernummer": "HRB 15477",
      "registerart": "HRB",
      "company_name": "HISB Betreuungsdienst Halle Herford GmbH",
      "company_seat": "Herford",
      "details": "21.05.2025 (Bekanntmachungsdatum)\n\nNordrhein-Westfalen Amtsgericht Bad Oeynhausen HRB 15477\nRegisterbekanntmachung nach dem Umwandlungsgesetz 21.05.2025 (Eintragungsdatum)\n\nHISB Betreuungsdienst Halle Herford GmbH\nGesellschaft mit beschränkter Haftung\nHerford\n\nDen Gläubigern der an der Verschmelzung beteiligten Rechtsträger ist, wenn sie binnen sechs Monaten nach dem Tag, an dem die Eintragung der Verschmelzung in das Register des Sitzes desjenigen Rechtsträgers, dessen Gläubiger sie sind, nach § 19 Absatz 3 UmwG als bekanntgemacht gilt, ihren Anspruch nach Grund und Höhe schriftlich anmelden, Sicherheit zu leisten, soweit sie nicht Befriedigung verlangen können. Dieses Recht steht den Gläubigern jedoch nur zu, wenn sie glaubhaft machen, dass durch die Verschmelzung die Erfüllung ihrer Forderung gefährdet wird."
    },
    {
      "date": "2025-05-21",
      "id": "109815",
      "original_text": "Registerbekanntmachung nach dem Umwandlungsgesetz\nNordrhein-Westfalen Amtsgericht Mönchengladbach GsR 321\nSV Zahn - Sachverständigenbüro für Brandschutz eGbR – Mönchengladbach",
      "type": "Registerbekanntmachung nach dem Umwandlungsgesetz",
      "state": "Nordrhein-Westfalen",
      "amtsgericht": "Amtsgericht Mönchengladbach",
      "registernummer": "GsR 321",
      "registerart": "GsR",
      "company_name": "SV Zahn - Sachverständigenbüro für Brandschutz eGbR",
      "company_seat": "Mönchengladbach",
      "details": "21.05.2025 (Bekanntmachungsdatum)\n\nNordrhein-Westfalen Amtsgericht Mönchengladbach GsR 321\nRegisterbekanntmachung nach dem Umwandlungsgesetz 21.05.2025 (Eintragungsdatum)\n\nSV Zahn - Sachverständigenbüro für Brandschutz eGbR\nGesellschaft bürgerlichen Rechts\nMönchengladbach\n\nDen Gläubigern der an der formwechselnden Umwandlung beteiligten Rechtsträger ist, wenn sie binnen sechs Monaten nach dem Tag, an dem die Eintragung der formwechselnden Umwandlung in das Register des Sitzes desjenigen Rechtsträgers, dessen Gläubiger sie sind, nach § 19 Absatz 3 UmwG als bekanntgemacht gilt, ihren Anspruch nach Grund und Höhe schriftlich anmelden, Sicherheit zu leisten, soweit sie nicht Befriedigung verlangen können. Dieses Recht steht den Gläubigern jedoch nur zu, wenn sie glaubhaft machen, dass durch die formwechselnden Umwandlung die Erfüllung ihrer Forderung gefährdet wird."
    },
    {
      "date": "2025-05-21",
      "id": "109816",
      "original_text": "Registerbekanntmachung nach dem Umwandlungsgesetz\nNordrhein-Westfalen Amtsgericht Hamm GsR 102\nGöke eGbR – Hamm",
      "type": "Registerbekanntmachung nach dem Umwandlungsgesetz",
      "state": "Nordrhein-Westfalen",
      "amtsgericht": "Amtsgericht Hamm",
      "registernummer": "GsR 102",
      "registerart": "GsR",
      "company_name": "Göke eGbR",
      "company_seat": "Hamm",
      "details": "21.05.2025 (Bekanntmachungsdatum)\n\nNordrhein-Westfalen Amtsgericht Hamm GsR 102\nRegisterbekanntmachung nach dem Umwandlungsgesetz 21.05.2025 (Eintragungsdatum)\n\nGöke eGbR\nGesellschaft bürgerlichen Rechts\nHamm\n\nDen Gläubigern der an der formwechselnden Umwandlung beteiligten Rechtsträger ist, wenn sie binnen sechs Monaten nach dem Tag, an dem die Eintragung der formwechselnden Umwandlung in das Register des Sitzes desjenigen Rechtsträgers, dessen Gläubiger sie sind, nach § 19 Absatz 3 UmwG als bekanntgemacht gilt, ihren Anspruch nach Grund und Höhe schriftlich anmelden, Sicherheit zu leisten, soweit sie nicht Befriedigung verlangen können. Dieses Recht steht den Gläubigern jedoch nur zu, wenn sie glaubhaft machen, dass durch die formwechselnden Umwandlung die Erfüllung ihrer Forderung gefährdet wird."
    },
    {
      "date": "2025-05-21",
      "id": "109817",
      "original_text": "Registerbekanntmachung nach dem Umwandlungsgesetz\nNordrhein-Westfalen Amtsgericht Düsseldorf HRA 28224\n7YRDS Protect GmbH & Co. KG – Düsseldorf",
      "type": "Registerbekanntmachung nach dem Umwandlungsgesetz",
      "state": "Nordrhein-Westfalen",
      "amtsgericht": "Amtsgericht Düsseldorf",
      "registernummer": "HRA 28224",
      "registerart": "HRA",
      "company_name": "7YRDS Protect GmbH & Co. KG",
      "company_seat": "Düsseldorf",
      "details": "21.05.2025 (Bekanntmachungsdatum)\n\nNordrhein-Westfalen Amtsgericht Düsseldorf HRA 28224\nRegisterbekanntmachung nach dem Umwandlungsgesetz 21.05.2025 (Eintragungsdatum)\n\n7YRDS Protect GmbH & Co. KG\nKommanditgesellschaft\nDüsseldorf\n\nDen Gläubigern der an der formwechselnden Umwandlung beteiligten Rechtsträger ist, wenn sie binnen sechs Monaten nach dem Tag, an dem die Eintragung der formwechselnden Umwandlung in das Register des Sitzes desjenigen Rechtsträgers, dessen Gläubiger sie sind, nach § 19 Absatz 3 UmwG als bekanntgemacht gilt, ihren Anspruch nach Grund und Höhe schriftlich anmelden, Sicherheit zu leisten, soweit sie nicht Befriedigung verlangen können. Dieses Recht steht den Gläubigern jedoch nur zu, wenn sie glaubhaft machen, dass durch die formwechselnden Umwandlung die Erfüllung ihrer Forderung gefährdet wird."
    },
    {
      "date": "2025-05-21",
      "id": "109818",
      "original_text": "Registerbekanntmachung nach dem Umwandlungsgesetz\nNordrhein-Westfalen Amtsgericht Köln HRB 94724\ntestbee GmbH – Köln",
      "type": "Registerbekanntmachung nach dem Umwandlungsgesetz",
      "state": "Nordrhein-Westfalen",
      "amtsgericht": "Amtsgericht Köln",
      "registernummer": "HRB 94724",
      "registerart": "HRB",
      "company_name": "testbee GmbH",
      "company_seat": "Köln",
      "details": "21.05.2025 (Bekanntmachungsdatum)\n\nNordrhein-Westfalen Amtsgericht Köln HRB 94724\nRegisterbekanntmachung nach dem Umwandlungsgesetz 21.05.2025 (Eintragungsdatum)\n\ntestbee GmbH\nGesellschaft mit beschränkter Haftung\nKöln\n\nDen Gläubigern der an der Verschmelzung beteiligten Rechtsträger ist, wenn sie binnen sechs Monaten nach dem Tag, an dem die Eintragung der Verschmelzung in das Register des Sitzes desjenigen Rechtsträgers, dessen Gläubiger sie sind, nach § 19 Absatz 3 UmwG als bekanntgemacht gilt, ihren Anspruch nach Grund und Höhe schriftlich anmelden, Sicherheit zu leisten, soweit sie nicht Befriedigung verlangen können. Dieses Recht steht den Gläubigern jedoch nur zu, wenn sie glaubhaft machen, dass durch die Verschmelzung die Erfüllung ihrer Forderung gefährdet wird."
    },
    {
      "date": "2025-05-21",
      "id": "109819",
      "original_text": "Löschungsankündigung\nNordrhein-Westfalen Amtsgericht Köln HRA 27336\nDie Makler Immobilien-Team Hegenbart e.K. – Köln",
      "type": "Löschungsankündigung",
      "state": "Nordrhein-Westfalen",
      "amtsgericht": "Amtsgericht Köln",
      "registernummer": "HRA 27336",
      "registerart": "HRA",
      "company_name": "Die Makler Immobilien-Team Hegenbart e.K.",
      "company_seat": "Köln",
      "details": "21.05.2025 (Bekanntmachungsdatum)\n\nNordrhein-Westfalen Amtsgericht Köln HRA 27336\nLöschungsankündigung 21.05.2025 (Eintragungsdatum)\n\nDie Makler Immobilien-Team Hegenbart e.K.\nEinzelkaufmann / Einzelkauffrau\nKöln\n\nDas Registergericht beabsichtigt die Firma von Amts wegen nach § 31 Abs. 2 HGB, § 393 FamFG zu löschen. Die Frist zur Erhebung eines Widerspruchs ist auf einen Monat festgesetzt."
    },
    {
      "date": "2025-05-21",
      "id": "109820",
      "original_text": "Löschungsankündigung\nNordrhein-Westfalen Amtsgericht Köln HRA 27336\nDie Makler Immobilien-Team Hegenbart e.K. – Köln",
      "type": "Löschungsankündigung",
      "state": "Nordrhein-Westfalen",
      "amtsgericht": "Amtsgericht Köln",
      "registernummer": "HRA 27336",
      "registerart": "HRA",
      "company_name": "Die Makler Immobilien-Team Hegenbart e.K.",
      "company_seat": "Köln",
      "details": "21.05.2025 (Bekanntmachungsdatum)\n\nNordrhein-Westfalen Amtsgericht Köln HRA 27336\nLöschungsankündigung\n\nDie Makler Immobilien-Team Hegenbart e.K.\nEinzelkaufmann / Einzelkauffrau\nKöln"
    },
    {
      "date": "2025-05-21",
      "id": "109821",
      "original_text": "Löschungsankündigung\nNordrhein-Westfalen Amtsgericht Köln HRA 27336\nDie Makler Immobilien-Team Hegenbart e.K. – Köln",
      "type": "Löschungsankündigung",
      "state": "Nordrhein-Westfalen",
      "amtsgericht": "Amtsgericht Köln",
      "registernummer": "HRA 27336",
      "registerart": "HRA",
      "company_name": "Die Makler Immobilien-Team Hegenbart e.K.",
      "company_seat": "Köln",
      "details": "21.05.2025 (Bekanntmachungsdatum)\n\nNordrhein-Westfalen Amtsgericht Köln HRA 27336\nLöschungsankündigung\n\nDie Makler Immobilien-Team Hegenbart e.K.\nEinzelkaufmann / Einzelkauffrau\nKöln\n\nDas Registergericht beabsichtigt die Firma von Amts wegen nach § 31 Abs. 2 HGB, § 393 FamFG zu löschen. Die Frist zur Erhebung eines Widerspruchs ist auf einen Monat festgesetzt."
    },
    {
      "date": "2025-05-21",
      "id": "109822",
      "original_text": "Löschungsankündigung\nNordrhein-Westfalen Amtsgericht Düsseldorf HRB 100351\nECDG solutions UG (haftungsbeschränkt) – Düsseldorf",
      "type": "Löschungsankündigung",
      "state": "Nordrhein-Westfalen",
      "amtsgericht": "Amtsgericht Düsseldorf",
      "registernummer": "HRB 100351",
      "registerart": "HRB",
      "company_name": "ECDG solutions UG (haftungsbeschränkt)",
      "company_seat": "Düsseldorf",
      "details": "21.05.2025 (Bekanntmachungsdatum)\n\nNordrhein-Westfalen Amtsgericht Düsseldorf HRB 100351\nLöschungsankündigung\n\nECDG solutions UG (haftungsbeschränkt)\nGesellschaft mit beschränkter Haftung\nDüsseldorf\n\nDas Registergericht beabsichtigt die Gesellschaft von Amts wegen nach § 394 FamFG zu löschen. Die Frist zur Erhebung eines Widerspruchs ist auf 3 Wochen festgesetzt.\n\nRechtsbehelfsbelehrung:\nDas Widerspruchsrecht steht jedem zu, der an der Unterlassung der Löschung ein berechtigtes Interesse hat. Der Widerspruch ist bei dem Amtsgericht Düsseldorf -Registergericht-, Werdener Straße 1, 40227 Düsseldorf schriftlich in deutscher Sprache oder zur Niederschrift der Geschäftsstelle einzulegen. Der Widerspruch kann auch zur Niederschrift der Geschäftsstelle eines jeden Amtsgerichtes abgegeben werden. Die Einlegung ist auch durch Übertragung eines elektronischen Dokuments an die elektronische Poststelle des Gerichts möglich. Das elektronische Dokument muss für die Bearbeitung durch das Gericht geeignet und mit einer qualifizierten elektronischen Signatur der verantwortenden Person versehen sein oder von der verantwortenden Person signiert und auf einem sicheren Übermittlungsweg gemäß § 130a ZPO nach näherer Maßgabe der Verordnung über die technischen Rahmenbedingungen des elektronischen Rechtsverkehrs und über das besondere elektronische Behördenpostfach (BGBl. I, S.3803) eingereicht werden. Weitere Informationen erhalten Sie auf der Internetseite www.justiz.de.\nDer Widerspruch muss spätestens innerhalb der gesetzten Frist nach dem Datum der Bekanntmachung der Löschungsankündigung bei dem Amtsgericht - Registergericht - Düsseldorf eingegangen sein.  Dies gilt auch dann, wenn der Widerspruch zur Niederschrift der Geschäftsstelle eines anderen Amtsgerichtes abgegeben wurde. Die Frist beginnt mit dem Tage der Bekanntmachung der Löschungsankündigung in dem für die Bekanntmachung der Eintragungen in das Handelsregister bestimmten elektronischen Informations- und Kommunikationssystem nach § 10 des Handelsgesetzbuches. Fällt das Ende der Frist auf einen Sonntag, einen allgemeinen Feiertag oder Sonnabend, so endet die Frist mit Ablauf des nächsten Werktages.\nDer Widerspruch muss die Bezeichnung der angefochtenen Löschungsankündigung sowie die Erklärung enthalten, dass Widerspruch gegen diese Löschungsankündigung eingelegt wird. Er ist zu unterzeichnen und soll begründet werden."
    },
    {
      "date": "2025-05-21",
      "id": "109823",
      "original_text": "Löschungsankündigung\nNordrhein-Westfalen Amtsgericht Neuss HRB 20117\nTrust in Trade Gablan UG (haftungsbeschränkt) – Neuss",
      "type": "Löschungsankündigung",
      "state": "Nordrhein-Westfalen",
      "amtsgericht": "Amtsgericht Neuss",
      "registernummer": "HRB 20117",
      "registerart": "HRB",
      "company_name": "Trust in Trade Gablan UG (haftungsbeschränkt)",
      "company_seat": "Neuss",
      "details": "21.05.2025 (Bekanntmachungsdatum)\n\nNordrhein-Westfalen Amtsgericht Neuss HRB 20117\nLöschungsankündigung 19.05.2025 (Eintragungsdatum)\n\nTrust in Trade Gablan UG (haftungsbeschränkt)\nGesellschaft mit beschränkter Haftung\nNeuss\n\nes ist beabsichtigt, die Gesellschaft wegen Vermögenslosigkeit aufgrund des § 394 Abs. 1 FamFG zu löschen. Frist zur Geltendmachung eines Widerspruchs: 1 Monat.\n\nRechtsbehelfsbelehrung:\nGegen diese Verfügung können Sie Widerspruch einlegen.\nDer Widerspruch ist bei dem Amtsgericht Neuss - Registergericht -, Breite Str. 48, 41460 Neuss schriftlich in deutscher Sprache oder zur Niederschrift der Geschäftsstelle einzulegen.\nDer Widerspruch kann auch zur Niederschrift der Geschäftsstelle eines jeden Amtsgerichtes abgegeben werden.\nDie Einlegung ist auch durch Übertragung eines elektronischen Dokuments an die elektronische Poststelle des Gerichts möglich. Das elektronische Dokument muss für die Bearbeitung durch das Gericht geeignet und mit einer qualifizierten elektronischen Signatur der verantwortenden Person versehen sein oder von der verantwortenden Person signiert und auf einem sicheren Übermittlungsweg gemäß § 130a ZPO nach näherer Maßgabe der Verordnung über die technischen Rahmenbedingungen des elektronischen Rechtsverkehrs und über das besondere elektronische Behördenpostfach (BGBl. I, S.3803) eingereicht werden. Weitere Informationen erhalten Sie auf der Internetseite www.justiz.de.\nDer Widerspruch muss spätestens innerhalb der gesetzten Frist nach der schriftlichen Bekanntgabe der Verfügung bei dem Amtsgericht - Registergericht - Neuss eingegangen sein. Dies gilt auch dann, wenn der Widerspruch zur Niederschrift der Geschäftsstelle eines anderen Amtsgerichtes abgegeben wurde. Die Frist beginnt mit der schriftlichen Bekanntgabe der Verfügung. Die Bekanntgabe ist entweder durch Zustellung oder am dritten Tage nach Aufgabe zur Post bewirkt. Fällt das Ende der Frist auf einen Sonntag, einen allgemeinen Feiertag oder Sonnabend, so endet die Frist mit Ablauf des nächsten Werktages.\n\nDer Widerspruch muss die Bezeichnung der angefochtenen Verfügung sowie die Erklärung enthalten, dass Widerspruch gegen diese Verfügung eingelegt wird. Er ist zu unterzeichnen und soll begründet werden."
    },
    {
      "date": "2025-05-21",
      "id": "109824",
      "original_text": "Löschungsankündigung\nNordrhein-Westfalen Amtsgericht Hamm HRB 9762\nBrock Elektrotechnik UG (haftungsbeschränkt) – Bönen",
      "type": "Löschungsankündigung",
      "state": "Nordrhein-Westfalen",
      "amtsgericht": "Amtsgericht Hamm",
      "registernummer": "HRB 9762",
      "registerart": "HRB",
      "company_name": "Brock Elektrotechnik UG (haftungsbeschränkt)",
      "company_seat": "Bönen",
      "details": "21.05.2025 (Bekanntmachungsdatum)\n\nNordrhein-Westfalen Amtsgericht Hamm HRB 9762\nLöschungsankündigung\n\nBrock Elektrotechnik UG (haftungsbeschränkt)\nGesellschaft mit beschränkter Haftung\nBönen\n\nDas Registergericht beabsichtigt die Gesellschaft von Amts wegen nach § 394 FamFG zu löschen. Die Frist zur Erhebung eines Widerspruchs ist auf drei Monate festgesetzt."
    },
    {
      "date": "2025-05-21",
      "id": "109825",
      "original_text": "Löschungsankündigung\nNordrhein-Westfalen Amtsgericht Hamm HRB 10331\nDampf-Discount UG (haftungsbeschränkt) – Bergkamen",
      "type": "Löschungsankündigung",
      "state": "Nordrhein-Westfalen",
      "amtsgericht": "Amtsgericht Hamm",
      "registernummer": "HRB 10331",
      "registerart": "HRB",
      "company_name": "Dampf-Discount UG (haftungsbeschränkt)",
      "company_seat": "Bergkamen",
      "details": "21.05.2025 (Bekanntmachungsdatum)\n\nNordrhein-Westfalen Amtsgericht Hamm HRB 10331\nLöschungsankündigung\n\nDampf-Discount UG (haftungsbeschränkt)\nGesellschaft mit beschränkter Haftung\nBergkamen\n\nDas Registergericht beabsichtigt die Gesellschaft von Amts wegen nach § 394 FamFG zu löschen. Die Frist zur Erhebung eines Widerspruchs ist auf drei Monate festgesetzt."
    },
    {
      "date": "2025-05-21",
      "id": "109826",
      "original_text": "Löschungsankündigung\nNordrhein-Westfalen Amtsgericht Köln HRB 117108\nCandy Town Betriebs GmbH – Köln",
      "type": "Löschungsankündigung",
      "state": "Nordrhein-Westfalen",
      "amtsgericht": "Amtsgericht Köln",
      "registernummer": "HRB 117108",
      "registerart": "HRB",
      "company_name": "Candy Town Betriebs GmbH",
      "company_seat": "Köln",
      "details": "21.05.2025 (Bekanntmachungsdatum)\n\nNordrhein-Westfalen Amtsgericht Köln HRB 117108\nLöschungsankündigung\n\nCandy Town Betriebs GmbH\nGesellschaft mit beschränkter Haftung\nKöln\n\nDas Registergericht beabsichtigt, die im Handelsregister eingetragene Gesellschaft gemäß § 394 Absatz 1 FamFG wegen Vermögenslosigkeit von Amts wegen zu löschen. Gegen diese Verfügung kann Widerspruch eingelegt werden. Die Frist zur Erhebung eines Widerspruchs gegen die beabsichtigte Löschung von Amts wegen ist auf einen Monat festgesetzt. Rechtsbehelfsbelehrung: Gegen diese Verfügung können Sie Widerspruch einlegen. Der Widerspruch ist bei dem Amtsgericht Köln, Reichenspergerplatz 1, 50670 Köln schriftlich in deutscher Sprache oder zur Niederschrift der Geschäftsstelle einzulegen. Der Widerspruch kann auch zur Niederschrift der Geschäftsstelle eines jeden Amtsgerichtes abgegeben werden. Die Einlegung ist auch durch Übertragung eines elektronischen Dokuments an die elektronische Poststelle des Gerichts möglich. Das elektronische Dokument muss für die Bearbeitung durch das Gericht geeignet und mit einer qualifizierten elektronischen Signatur der verantwortenden Person versehen sein oder von der verantwortenden Person signiert und auf einem sicheren Übermittlungsweg gemäß § 130a ZPO nach näherer Maßgabe der Verordnung über die technischen Rahmenbedingungen des elektronischen Rechtsverkehrs und über das besondere elektronische Behördenpostfach (BGBl. I, S.3803) eingereicht werden. Weitere Informationen erhalten Sie auf der Internetseite www.justiz.de.Der Widerspruch muss spätestens innerhalb der gesetzten Frist bei dem Amtsgericht Köln eingegangen sein. Dies gilt auch dann, wenn der Widerspruch zur Niederschrift der Geschäftsstelle eines anderen Amtsgerichtes abgegeben wurde. Die Frist beginnt mit der Veröffentlichung. Fällt das Ende der Frist auf einen Sonntag, einen allgemeinen Feiertag oder Sonnabend, so endet die Frist mit Ablauf des nächsten Werktages.\n\nDer Widerspruch muss die Bezeichnung der angefochtenen Verfügung sowie die Erklärung enthalten, dass Widerspruch gegen diese Verfügung eingelegt wird. Er ist zu unterzeichnen und soll begründet werden."
    },
    {
      "date": "2025-05-21",
      "id": "109827",
      "original_text": "Einreichung neuer Dokumente\nNordrhein-Westfalen Amtsgericht Köln HRB 57922\n450connect GmbH – Köln",
      "type": "Einreichung neuer Dokumente",
      "state": "Nordrhein-Westfalen",
      "amtsgericht": "Amtsgericht Köln",
      "registernummer": "HRB 57922",
      "registerart": "HRB",
      "company_name": "450connect GmbH",
      "company_seat": "Köln",
      "details": "21.05.2025 (Bekanntmachungsdatum)\n\nNordrhein-Westfalen Amtsgericht Köln HRB 57922\nEinreichung neuer Dokumente\n\n450connect GmbH\nGesellschaft mit beschränkter Haftung\nKöln\n\nDem Registergericht ist eine Liste der Mitglieder des Aufsichtsrates eingereicht worden."
    },
    {
      "date": "2025-05-21",
      "id": "109828",
      "original_text": "Sonstige Registerbekanntmachung\nNordrhein-Westfalen Amtsgericht Hagen HRB 7264\nIT-NET AG Gesellschaft für EDV Beratung, Entwicklung und Vertrieb – Schwerte",
      "type": "Sonstige Registerbekanntmachung",
      "state": "Nordrhein-Westfalen",
      "amtsgericht": "Amtsgericht Hagen",
      "registernummer": "HRB 7264",
      "registerart": "HRB",
      "company_name": "IT-NET AG Gesellschaft für EDV Beratung, Entwicklung und Vertrieb",
      "company_seat": "Schwerte",
      "details": "21.05.2025 (Bekanntmachungsdatum)\n\nNordrhein-Westfalen Amtsgericht Hagen HRB 7264\nSonstige Registerbekanntmachung\n\nIT-NET AG Gesellschaft für EDV Beratung, Entwicklung und Vertrieb\nAktiengesellschaft\nSchwerte\n\nDem Registergericht ist eine Liste der Mitglieder des Aufsichtsrates eingereicht worden."
    },
    {
      "date": "2025-05-21",
      "id": "109829",
      "original_text": "Registerbekanntmachung nach dem Umwandlungsgesetz\nNordrhein-Westfalen Amtsgericht Köln HRB 121128\nSmartLink Transporte GmbH – Wesseling",
      "type": "Registerbekanntmachung nach dem Umwandlungsgesetz",
      "state": "Nordrhein-Westfalen",
      "amtsgericht": "Amtsgericht Köln",
      "registernummer": "HRB 121128",
      "registerart": "HRB",
      "company_name": "SmartLink Transporte GmbH",
      "company_seat": "Wesseling",
      "details": "21.05.2025 (Bekanntmachungsdatum)\n\nNordrhein-Westfalen Amtsgericht Köln HRB 121128\nRegisterbekanntmachung nach dem Umwandlungsgesetz 21.05.2025 (Eintragungsdatum)\n\nSmartLink Transporte GmbH\nGesellschaft mit beschränkter Haftung\nWesseling\n\nDen Gläubigern der an der Verschmelzung beteiligten Rechtsträger ist, wenn sie binnen sechs Monaten nach dem Tag, an dem die Eintragung der Verschmelzung in das Register des Sitzes desjenigen Rechtsträgers, dessen Gläubiger sie sind, nach § 19 Absatz 3 UmwG als bekanntgemacht gilt, ihren Anspruch nach Grund und Höhe schriftlich anmelden, Sicherheit zu leisten, soweit sie nicht Befriedigung verlangen können. Dieses Recht steht den Gläubigern jedoch nur zu, wenn sie glaubhaft machen, dass durch die Verschmelzung die Erfüllung ihrer Forderung gefährdet wird."
    },
    {
      "date": "2025-05-21",
      "id": "109830",
      "original_text": "Löschungsankündigung\nNordrhein-Westfalen Amtsgericht Dortmund HRB 23084\nMedizinisches Zentrum MedHaus GmbH – Dortmund",
      "type": "Löschungsankündigung",
      "state": "Nordrhein-Westfalen",
      "amtsgericht": "Amtsgericht Dortmund",
      "registernummer": "HRB 23084",
      "registerart": "HRB",
      "company_name": "Medizinisches Zentrum MedHaus GmbH",
      "company_seat": "Dortmund",
      "details": "21.05.2025 (Bekanntmachungsdatum)\n\nNordrhein-Westfalen Amtsgericht Dortmund HRB 23084\nLöschungsankündigung\n\nMedizinisches Zentrum MedHaus GmbH\nGesellschaft mit beschränkter Haftung\nDortmund\n\nDas Registergericht beabsichtigt die Gesellschaft von Amts wegen nach § 394 FamFG zu löschen. Die Frist zur Erhebung eines Widerspruchs ist auf zwei Monate festgesetzt."
    },
    {
      "date": "2025-05-21",
      "id": "109831",
      "original_text": "Registerbekanntmachung nach dem Umwandlungsgesetz\nNordrhein-Westfalen Amtsgericht Siegen HRB 6092\nBiggetaler Fleischwaren GmbH – Finnentrop",
      "type": "Registerbekanntmachung nach dem Umwandlungsgesetz",
      "state": "Nordrhein-Westfalen",
      "amtsgericht": "Amtsgericht Siegen",
      "registernummer": "HRB 6092",
      "registerart": "HRB",
      "company_name": "Biggetaler Fleischwaren GmbH",
      "company_seat": "Finnentrop",
      "details": "21.05.2025 (Bekanntmachungsdatum)\n\nNordrhein-Westfalen Amtsgericht Siegen HRB 6092\nRegisterbekanntmachung nach dem Umwandlungsgesetz 17.05.2025 (Eintragungsdatum)\n\nBiggetaler Fleischwaren GmbH\nGesellschaft mit beschränkter Haftung\nFinnentrop\n\nDen Gläubigern der an der Verschmelzung beteiligten Rechtsträger ist, wenn sie binnen sechs Monaten nach dem Tag, an dem die Eintragung der Verschmelzung in das Register des Sitzes desjenigen Rechtsträgers, dessen Gläubiger sie sind, nach § 19 Absatz 3 UmwG als bekanntgemacht gilt, ihren Anspruch nach Grund und Höhe schriftlich anmelden, Sicherheit zu leisten, soweit sie nicht Befriedigung verlangen können. Dieses Recht steht den Gläubigern jedoch nur zu, wenn sie glaubhaft machen, dass durch die Verschmelzung die Erfüllung ihrer Forderung gefährdet wird."
    },
    {
      "date": "2025-05-21",
      "id": "109832",
      "original_text": "Registerbekanntmachung nach dem Umwandlungsgesetz\nNordrhein-Westfalen Amtsgericht Siegen HRA 9998\nPhilipp Weber Fördertechnik, Inh. Philipp Weber, e.K. – Attendorn",
      "type": "Registerbekanntmachung nach dem Umwandlungsgesetz",
      "state": "Nordrhein-Westfalen",
      "amtsgericht": "Amtsgericht Siegen",
      "registernummer": "HRA 9998",
      "registerart": "HRA",
      "company_name": "Philipp Weber Fördertechnik, Inh. Philipp Weber, e.K.",
      "company_seat": "Attendorn",
      "details": "21.05.2025 (Bekanntmachungsdatum)\n\nNordrhein-Westfalen Amtsgericht Siegen HRA 9998\nRegisterbekanntmachung nach dem Umwandlungsgesetz 17.05.2025 (Eintragungsdatum)\n\nPhilipp Weber Fördertechnik, Inh. Philipp Weber, e.K.\nEinzelkaufmann / Einzelkauffrau\nAttendorn\n\nDen Gläubigern der an der Ausgliederung beteiligten Rechtsträger ist, wenn sie binnen sechs Monaten nach dem Tag, an dem die Eintragung der Ausgliederung in das Register des Sitzes desjenigen Rechtsträgers, dessen Gläubiger sie sind, nach § 19 Absatz 3 UmwG als bekanntgemacht gilt, ihren Anspruch nach Grund und Höhe schriftlich anmelden, Sicherheit zu leisten, soweit sie nicht Befriedigung verlangen können. Dieses Recht steht den Gläubigern jedoch nur zu, wenn sie glaubhaft machen, dass durch die Ausgliederung die Erfüllung ihrer Forderung gefährdet wird."
    },
    {
      "date": "2025-05-21",
      "id": "109833",
      "original_text": "Löschungsankündigung\nNordrhein-Westfalen Amtsgericht Gelsenkirchen HRB 13063\nKSP Industriehandel GmbH – Bottrop",
      "type": "Löschungsankündigung",
      "state": "Nordrhein-Westfalen",
      "amtsgericht": "Amtsgericht Gelsenkirchen",
      "registernummer": "HRB 13063",
      "registerart": "HRB",
      "company_name": "KSP Industriehandel GmbH",
      "company_seat": "Bottrop",
      "details": "21.05.2025 (Bekanntmachungsdatum)\n\nNordrhein-Westfalen Amtsgericht Gelsenkirchen HRB 13063\nLöschungsankündigung\n\nKSP Industriehandel GmbH\nGesellschaft mit beschränkter Haftung\nBottrop\n\nDas Gericht beabsichtigt, die Gesellschaft KSP Industriehandel GmbH mit Sitz in Bottrop, HRB 13063 Amtsgericht Gelsenkirchen, wegen Vermögenslosigkeit zu löschen.\n\nHiermit wird denjenigen, die an der Unterlassung der Löschung ein berechtigtes Interesse haben, gem. § 394 Abs. 2 FamFG Gelegenheit gegeben, gegen dieses Vorhaben binnen eines Monats nach dieser Bekanntmachung Widerspruch einzulegen. Der Widerspruch kann schriftlich oder zu Protokoll der Geschäftsstelle erhoben werden."
    },
    {
      "date": "2025-05-21",
      "id": "109834",
      "original_text": "Löschungsankündigung\nNordrhein-Westfalen Amtsgericht Mönchengladbach HRB 18783\nMarian Bauunternehmen GmbH – Viersen",
      "type": "Löschungsankündigung",
      "state": "Nordrhein-Westfalen",
      "amtsgericht": "Amtsgericht Mönchengladbach",
      "registernummer": "HRB 18783",
      "registerart": "HRB",
      "company_name": "Marian Bauunternehmen GmbH",
      "company_seat": "Viersen",
      "details": "21.05.2025 (Bekanntmachungsdatum)\n\nNordrhein-Westfalen Amtsgericht Mönchengladbach HRB 18783\nLöschungsankündigung\n\nMarian Bauunternehmen GmbH\nGesellschaft mit beschränkter Haftung\nViersen\n\nDas Registergericht beabsichtigt die Gesellschaft von Amts wegen nach § 394 FamFG zu löschen. Die Frist zur Erhebung eines Widerspruchs ist auf drei Monate festgesetzt."
    },
    {
      "date": "2025-05-21",
      "id": "109835",
      "original_text": "Registerbekanntmachung nach dem Umwandlungsgesetz\nNordrhein-Westfalen Amtsgericht Siegen HRB 9542\nKAWE Management Holding GmbH – Netphen",
      "type": "Registerbekanntmachung nach dem Umwandlungsgesetz",
      "state": "Nordrhein-Westfalen",
      "amtsgericht": "Amtsgericht Siegen",
      "registernummer": "HRB 9542",
      "registerart": "HRB",
      "company_name": "KAWE Management Holding GmbH",
      "company_seat": "Netphen",
      "details": "21.05.2025 (Bekanntmachungsdatum)\n\nNordrhein-Westfalen Amtsgericht Siegen HRB 9542\nRegisterbekanntmachung nach dem Umwandlungsgesetz 17.05.2025 (Eintragungsdatum)\n\nKAWE Management Holding GmbH\nGesellschaft mit beschränkter Haftung\nNetphen\n\nDen Gläubigern der an der Verschmelzung beteiligten Rechtsträger ist, wenn sie binnen sechs Monaten nach dem Tag, an dem die Eintragung der Verschmelzung in das Register des Sitzes desjenigen Rechtsträgers, dessen Gläubiger sie sind, nach § 19 Absatz 3 UmwG als bekanntgemacht gilt, ihren Anspruch nach Grund und Höhe schriftlich anmelden, Sicherheit zu leisten, soweit sie nicht Befriedigung verlangen können. Dieses Recht steht den Gläubigern jedoch nur zu, wenn sie glaubhaft machen, dass durch die Verschmelzung die Erfüllung ihrer Forderung gefährdet wird."
    },
    {
      "date": "2025-05-21",
      "id": "109836",
      "original_text": "Registerbekanntmachung nach dem Umwandlungsgesetz\nNordrhein-Westfalen Amtsgericht Köln HRA 36938\nFrüh Gastronomie GmbH & Co. KG – Köln",
      "type": "Registerbekanntmachung nach dem Umwandlungsgesetz",
      "state": "Nordrhein-Westfalen",
      "amtsgericht": "Amtsgericht Köln",
      "registernummer": "HRA 36938",
      "registerart": "HRA",
      "company_name": "Früh Gastronomie GmbH & Co. KG",
      "company_seat": "Köln",
      "details": "21.05.2025 (Bekanntmachungsdatum)\n\nNordrhein-Westfalen Amtsgericht Köln HRA 36938\nRegisterbekanntmachung nach dem Umwandlungsgesetz 21.05.2025 (Eintragungsdatum)\n\nFrüh Gastronomie GmbH & Co. KG\nKommanditgesellschaft\nKöln\n\nDen Gläubigern der an der Abspaltung beteiligten Rechtsträger ist, wenn sie binnen sechs Monaten nach dem Tag, an dem die Eintragung der Abspaltung in das Register des Sitzes desjenigen Rechtsträgers, dessen Gläubiger sie sind, nach § 19 Absatz 3 UmwG als bekanntgemacht gilt, ihren Anspruch nach Grund und Höhe schriftlich anmelden, Sicherheit zu leisten, soweit sie nicht Befriedigung verlangen können. Dieses Recht steht den Gläubigern jedoch nur zu, wenn sie glaubhaft machen, dass durch die Abspaltung die Erfüllung ihrer Forderung gefährdet wird."
    },
    {
      "date": "2025-05-21",
      "id": "109837",
      "original_text": "Einreichung neuer Dokumente\nNordrhein-Westfalen Amtsgericht Münster HRB 12667\nNVO Nahverkehr Ostwestfalen GmbH – Münster",
      "type": "Einreichung neuer Dokumente",
      "state": "Nordrhein-Westfalen",
      "amtsgericht": "Amtsgericht Münster",
      "registernummer": "HRB 12667",
      "registerart": "HRB",
      "company_name": "NVO Nahverkehr Ostwestfalen GmbH",
      "company_seat": "Münster",
      "details": "21.05.2025 (Bekanntmachungsdatum)\n\nNordrhein-Westfalen Amtsgericht Münster HRB 12667\nEinreichung neuer Dokumente\n\nNVO Nahverkehr Ostwestfalen GmbH\nGesellschaft mit beschränkter Haftung\nMünster\n\nDem Registergericht ist eine Liste der Mitglieder des Aufsichtsrates eingereicht worden."
    },
    {
      "date": "2025-05-21",
      "id": "109838",
      "original_text": "Registerbekanntmachung nach dem Umwandlungsgesetz\nNordrhein-Westfalen Amtsgericht Dortmund HRB 36334\nThe Grey Hotel GmbH – Dortmund",
      "type": "Registerbekanntmachung nach dem Umwandlungsgesetz",
      "state": "Nordrhein-Westfalen",
      "amtsgericht": "Amtsgericht Dortmund",
      "registernummer": "HRB 36334",
      "registerart": "HRB",
      "company_name": "The Grey Hotel GmbH",
      "company_seat": "Dortmund",
      "details": "21.05.2025 (Bekanntmachungsdatum)\n\nNordrhein-Westfalen Amtsgericht Dortmund HRB 36334\nRegisterbekanntmachung nach dem Umwandlungsgesetz 21.05.2025 (Eintragungsdatum)\n\nThe Grey Hotel GmbH\nGesellschaft mit beschränkter Haftung\nDortmund\n\nDen Gläubigern der an der Ausgliederung beteiligten Rechtsträger ist, wenn sie binnen sechs Monaten nach dem Tag, an dem die Eintragung der Ausgliederung in das Register des Sitzes desjenigen Rechtsträgers, dessen Gläubiger sie sind, nach § 19 Absatz 3 UmwG als bekanntgemacht gilt, ihren Anspruch nach Grund und Höhe schriftlich anmelden, Sicherheit zu leisten, soweit sie nicht Befriedigung verlangen können. Dieses Recht steht den Gläubigern jedoch nur zu, wenn sie glaubhaft machen, dass durch die Ausgliederung die Erfüllung ihrer Forderung gefährdet wird."
    },
    {
      "date": "2025-05-21",
      "id": "109839",
      "original_text": "Registerbekanntmachung nach dem Umwandlungsgesetz\nNordrhein-Westfalen Amtsgericht Siegen HRA 6732\nMetten Fleischwaren GmbH & Co.KG – Finnentrop",
      "type": "Registerbekanntmachung nach dem Umwandlungsgesetz",
      "state": "Nordrhein-Westfalen",
      "amtsgericht": "Amtsgericht Siegen",
      "registernummer": "HRA 6732",
      "registerart": "HRA",
      "company_name": "Metten Fleischwaren GmbH & Co.KG",
      "company_seat": "Finnentrop",
      "details": "21.05.2025 (Bekanntmachungsdatum)\n\nNordrhein-Westfalen Amtsgericht Siegen HRA 6732\nRegisterbekanntmachung nach dem Umwandlungsgesetz 17.05.2025 (Eintragungsdatum)\n\nMetten Fleischwaren GmbH & Co.KG\nKommanditgesellschaft\nFinnentrop\n\nDen Gläubigern der an der Verschmelzung beteiligten Rechtsträger ist, wenn sie binnen sechs Monaten nach dem Tag, an dem die Eintragung der Verschmelzung in das Register des Sitzes desjenigen Rechtsträgers, dessen Gläubiger sie sind, nach § 19 Absatz 3 UmwG als bekanntgemacht gilt, ihren Anspruch nach Grund und Höhe schriftlich anmelden, Sicherheit zu leisten, soweit sie nicht Befriedigung verlangen können. Dieses Recht steht den Gläubigern jedoch nur zu, wenn sie glaubhaft machen, dass durch die Verschmelzung die Erfüllung ihrer Forderung gefährdet wird."
    },
    {
      "date": "2025-05-21",
      "id": "109840",
      "original_text": "Registerbekanntmachung nach dem Umwandlungsgesetz\nNordrhein-Westfalen Amtsgericht Siegen HRB 13942\nWeber-Fördertechnik GmbH – Attendorn",
      "type": "Registerbekanntmachung nach dem Umwandlungsgesetz",
      "state": "Nordrhein-Westfalen",
      "amtsgericht": "Amtsgericht Siegen",
      "registernummer": "HRB 13942",
      "registerart": "HRB",
      "company_name": "Weber-Fördertechnik GmbH",
      "company_seat": "Attendorn",
      "details": "21.05.2025 (Bekanntmachungsdatum)\n\nNordrhein-Westfalen Amtsgericht Siegen HRB 13942\nRegisterbekanntmachung nach dem Umwandlungsgesetz 17.05.2025 (Eintragungsdatum)\n\nWeber-Fördertechnik GmbH\nGesellschaft mit beschränkter Haftung\nAttendorn\n\nDen Gläubigern der an der Ausgliederung beteiligten Rechtsträger ist, wenn sie binnen sechs Monaten nach dem Tag, an dem die Eintragung der Ausgliederung in das Register des Sitzes desjenigen Rechtsträgers, dessen Gläubiger sie sind, nach § 19 Absatz 3 UmwG als bekanntgemacht gilt, ihren Anspruch nach Grund und Höhe schriftlich anmelden, Sicherheit zu leisten, soweit sie nicht Befriedigung verlangen können. Dieses Recht steht den Gläubigern jedoch nur zu, wenn sie glaubhaft machen, dass durch die Ausgliederung die Erfüllung ihrer Forderung gefährdet wird."
    },
    {
      "date": "2025-05-21",
      "id": "109841",
      "original_text": "Registerbekanntmachung nach dem Umwandlungsgesetz\nNordrhein-Westfalen Amtsgericht Siegen HRB 12934\nKADE Immobilien GmbH – Freudenberg",
      "type": "Registerbekanntmachung nach dem Umwandlungsgesetz",
      "state": "Nordrhein-Westfalen",
      "amtsgericht": "Amtsgericht Siegen",
      "registernummer": "HRB 12934",
      "registerart": "HRB",
      "company_name": "KADE Immobilien GmbH",
      "company_seat": "Freudenberg",
      "details": "21.05.2025 (Bekanntmachungsdatum)\n\nNordrhein-Westfalen Amtsgericht Siegen HRB 12934\nRegisterbekanntmachung nach dem Umwandlungsgesetz 17.05.2025 (Eintragungsdatum)\n\nKADE Immobilien GmbH\nGesellschaft mit beschränkter Haftung\nFreudenberg\n\nDen Gläubigern der an der Verschmelzung beteiligten Rechtsträger ist, wenn sie binnen sechs Monaten nach dem Tag, an dem die Eintragung der Verschmelzung in das Register des Sitzes desjenigen Rechtsträgers, dessen Gläubiger sie sind, nach § 19 Absatz 3 UmwG als bekanntgemacht gilt, ihren Anspruch nach Grund und Höhe schriftlich anmelden, Sicherheit zu leisten, soweit sie nicht Befriedigung verlangen können. Dieses Recht steht den Gläubigern jedoch nur zu, wenn sie glaubhaft machen, dass durch die Verschmelzung die Erfüllung ihrer Forderung gefährdet wird."
    },
    {
      "date": "2025-05-21",
      "id": "109842",
      "original_text": "Registerbekanntmachung nach dem Umwandlungsgesetz\nNordrhein-Westfalen Amtsgericht Siegen HRB 14211\nCaro Media GmbH – Attendorn",
      "type": "Registerbekanntmachung nach dem Umwandlungsgesetz",
      "state": "Nordrhein-Westfalen",
      "amtsgericht": "Amtsgericht Siegen",
      "registernummer": "HRB 14211",
      "registerart": "HRB",
      "company_name": "Caro Media GmbH",
      "company_seat": "Attendorn",
      "details": "21.05.2025 (Bekanntmachungsdatum)\n\nNordrhein-Westfalen Amtsgericht Siegen HRB 14211\nRegisterbekanntmachung nach dem Umwandlungsgesetz 17.04.2025 (Eintragungsdatum)\n\nCaro Media GmbH\nGesellschaft mit beschränkter Haftung\nAttendorn\n\nDen Gläubigern der an der Ausgliederung beteiligten Rechtsträger ist, wenn sie binnen sechs Monaten nach dem Tag, an dem die Eintragung der Ausgliederung in das Register des Sitzes desjenigen Rechtsträgers, dessen Gläubiger sie sind, nach § 19 Absatz 3 UmwG als bekanntgemacht gilt, ihren Anspruch nach Grund und Höhe schriftlich anmelden, Sicherheit zu leisten, soweit sie nicht Befriedigung verlangen können. Dieses Recht steht den Gläubigern jedoch nur zu, wenn sie glaubhaft machen, dass durch die Ausgliederung die Erfüllung ihrer Forderung gefährdet wird."
    },
    {
      "date": "2025-05-21",
      "id": "109843",
      "original_text": "Einreichung neuer Dokumente\nThüringen Amtsgericht Jena HRB 104689\nWohnungsbaugesellschaft Ichtershausen mit beschränkter Haftung – Amt Wachsenburg",
      "type": "Einreichung neuer Dokumente",
      "state": "Thüringen",
      "amtsgericht": "Amtsgericht Jena",
      "registernummer": "HRB 104689",
      "registerart": "HRB",
      "company_name": "Wohnungsbaugesellschaft Ichtershausen mit beschränkter Haftung",
      "company_seat": "Amt Wachsenburg",
      "details": "21.05.2025 (Bekanntmachungsdatum)\n\nThüringen Amtsgericht Jena HRB 104689\nEinreichung neuer Dokumente 21.05.2025 (Eintragungsdatum)\n\nWohnungsbaugesellschaft Ichtershausen mit beschränkter Haftung\nGesellschaft mit beschränkter Haftung\nAmt Wachsenburg\n\nBekanntmachung gem. § 52 Abs. 3 Satz 2 GmbHG: Aufgrund einer Veränderung in den Personen der Aufsichtsratsmitglieder ist durch die Geschäftsführer eine neue Liste zum Handelsregister eingereicht worden."
    },
    {
      "date": "2025-05-21",
      "id": "109844",
      "original_text": "Löschungsankündigung\nHessen Amtsgericht Frankfurt am Main HRB 127652\nPERAVA Bauleistung GmbH – Frankfurt am Main",
      "type": "Löschungsankündigung",
      "state": "Hessen",
      "amtsgericht": "Amtsgericht Frankfurt am Main",
      "registernummer": "HRB 127652",
      "registerart": "HRB",
      "company_name": "PERAVA Bauleistung GmbH",
      "company_seat": "Frankfurt am Main",
      "details": "21.05.2025 (Bekanntmachungsdatum)\n\nHessen Amtsgericht Frankfurt am Main HRB 127652\nLöschungsankündigung\n\nPERAVA Bauleistung GmbH\nGesellschaft mit beschränkter Haftung\nFrankfurt am Main\n\nDas Registergericht beabsichtigt die im Handelsregister eingetragene Gesellschaft von Amts wegen nach § 394 FamFG zu löschen. Die Frist zur Erhebung eines Widerspruchs gegen die beabsichtigte Löschung wird auf 1 Monat festgesetzt."
    },
    {
      "date": "2025-05-21",
      "id": "109845",
      "original_text": "Löschungsankündigung\nHessen Amtsgericht Darmstadt HRB 104174\nEuro-Engineering-GmbH – Rüsselsheim",
      "type": "Löschungsankündigung",
      "state": "Hessen",
      "amtsgericht": "Amtsgericht Darmstadt",
      "registernummer": "HRB 104174",
      "registerart": "HRB",
      "company_name": "Euro-Engineering-GmbH",
      "company_seat": "Rüsselsheim",
      "details": "21.05.2025 (Bekanntmachungsdatum)\n\nHessen Amtsgericht Darmstadt HRB 104174\nLöschungsankündigung 21.05.2025 (Eintragungsdatum)\n\nEuro-Engineering-GmbH\nGesellschaft mit beschränkter Haftung\nRüsselsheim\n\nDas Registergericht beabsichtigt die im Handelsregister eingetragene Gesellschaft von Amts wegen nach § 394 FamFG zu löschen. Die Frist zur Erhebung eines Widerspruchs gegen die beabsichtigte Löschung wird auf 3 Monate festgesetzt."
    },
    {
      "date": "2025-05-21",
      "id": "109846",
      "original_text": "Registerbekanntmachung nach dem Umwandlungsgesetz\nHessen Amtsgericht Eschwege HRB 1667\nRückbrodt GmbH – Waldkappel",
      "type": "Registerbekanntmachung nach dem Umwandlungsgesetz",
      "state": "Hessen",
      "amtsgericht": "Amtsgericht Eschwege",
      "registernummer": "HRB 1667",
      "registerart": "HRB",
      "company_name": "Rückbrodt GmbH",
      "company_seat": "Waldkappel",
      "details": "21.05.2025 (Bekanntmachungsdatum)\n\nHessen Amtsgericht Eschwege HRB 1667\nRegisterbekanntmachung nach dem Umwandlungsgesetz 21.05.2025 (Eintragungsdatum)\n\nRückbrodt GmbH\nGesellschaft mit beschränkter Haftung\nWaldkappel\n\nDen Gläubigern der an der Ausgliederung beteiligten Rechtsträger ist, wenn sie binnen sechs Monaten nach dem Tag, an dem die Eintragung der Ausgliederung in das Register des Sitzes desjenigen Rechtsträgers, dessen Gläubiger sie sind, nach §§ 125, 19 Absatz 3 UmwG bekannt gemacht worden ist, ihren Anspruch nach Grund und Höhe schriftlich anmelden, Sicherheit zu leisten, soweit sie nicht Befriedigung verlangen können. Dieses Recht steht den Gläubigern jedoch nur zu, wenn sie glaubhaft machen, dass durch die Ausgliederung die Erfüllung ihrer Forderung gefährdet wird."
    },
    {
      "date": "2025-05-21",
      "id": "109847",
      "original_text": "Löschungsankündigung\nHessen Amtsgericht Darmstadt HRB 99135\nWHS Dienstleistungen GmbH – Raunheim",
      "type": "Löschungsankündigung",
      "state": "Hessen",
      "amtsgericht": "Amtsgericht Darmstadt",
      "registernummer": "HRB 99135",
      "registerart": "HRB",
      "company_name": "WHS Dienstleistungen GmbH",
      "company_seat": "Raunheim",
      "details": "21.05.2025 (Bekanntmachungsdatum)\n\nHessen Amtsgericht Darmstadt HRB 99135\nLöschungsankündigung\n\nWHS Dienstleistungen GmbH\nGesellschaft mit beschränkter Haftung\nRaunheim\n\nDas Registergericht beabsichtigt die im Handelsregister eingetragene Gesellschaft von Amts wegen nach § 394 FamFG zu löschen. Die Frist zur Erhebung eines Widerspruchs gegen die beabsichtigte Löschung wird auf 3 Monate festgesetzt."
    },
    {
      "date": "2025-05-21",
      "id": "109848",
      "original_text": "Sonstige Registerbekanntmachung\nHessen Amtsgericht Wiesbaden HRB 2188\nR+V Allgemeine Versicherung Aktiengesellschaft – Wiesbaden",
      "type": "Sonstige Registerbekanntmachung",
      "state": "Hessen",
      "amtsgericht": "Amtsgericht Wiesbaden",
      "registernummer": "HRB 2188",
      "registerart": "HRB",
      "company_name": "R+V Allgemeine Versicherung Aktiengesellschaft",
      "company_seat": "Wiesbaden",
      "details": "21.05.2025 (Bekanntmachungsdatum)\n\nHessen Amtsgericht Wiesbaden HRB 2188\nSonstige Registerbekanntmachung 21.05.2025 (Eintragungsdatum)\n\nR+V Allgemeine Versicherung Aktiengesellschaft\nAktiengesellschaft\nWiesbaden\n\nDurch eine Änderung in den Personen der Aufsichtsratsmitglieder ist eine Liste der Mitglieder des Aufsichtsrates zum Handelsregister eingereicht worden."
    },
    {
      "date": "2025-05-21",
      "id": "109849",
      "original_text": "Registerbekanntmachung nach dem Umwandlungsgesetz\nHessen Amtsgericht Frankfurt am Main HRB 40334\nRQPO Beteiligungs GmbH – Frankfurt am Main",
      "type": "Registerbekanntmachung nach dem Umwandlungsgesetz",
      "state": "Hessen",
      "amtsgericht": "Amtsgericht Frankfurt am Main",
      "registernummer": "HRB 40334",
      "registerart": "HRB",
      "company_name": "RQPO Beteiligungs GmbH",
      "company_seat": "Frankfurt am Main",
      "details": "21.05.2025 (Bekanntmachungsdatum)\n\nHessen Amtsgericht Frankfurt am Main HRB 40334\nRegisterbekanntmachung nach dem Umwandlungsgesetz 14.05.2025 (Eintragungsdatum)\n\nRQPO Beteiligungs GmbH\nGesellschaft mit beschränkter Haftung\nFrankfurt am Main\n\nDen Gläubigern der an der #DV.UmF(Text=\"Bitte wählen Sie die zutreffende Art nach UmwG aus!\",Eingabe=\"Verschmelzung\",\"Aufspaltung\",\"Abspaltung\",\"Ausgliederung\",\"Vermögensübertragung\",\"formwechselnden Umwandlung\") beteiligten Rechtsträger ist, wenn sie binnen sechs Monaten nach dem Tag, an dem die Eintragung der #DV.UmF in das Register des Sitzes #DV.RTr(Text=\"Bitte wählen Sie aus, ob ein oder mehrere andere Rechtsträger betroffen sind!\",Eingabe=\"desjenigen Rechtsträgers, dessen Gläubiger\",\"derjenigen Rechtsträger deren Gläubiger\") sie sind, nach #DV.Auswahl(Text=\"Bitte wählen Sie die zutreffende Vorschrift aus!\",Eingabe=\"§ 19 Absatz 3 UmwG\"|\"§ 19 Absatz 3 UmwG (=Verschmelzung)\",\"§§ 122a Absatz 2, 19 Absatz 3 UmwG\"|\"§§ 122a Absatz 2, 19 Absatz 3 UmwG (=grenzüberschreitende Verschmelzung)\",\"§§ 125, 19 Absatz 3 UmwG\"|\"§§ 125, 19 Absatz 3 UmwG (=Spaltung)\",\"§ 201 UmwG\"|\"§ 201 UmwG (=Formwechsel)\",\"#insert(Text=\"Freitext\") UmwG\"|\"freie Eingabe\") bekannt gemacht worden ist, ihren Anspruch nach Grund und Höhe schriftlich anmelden, Sicherheit zu leisten, soweit sie nicht Befriedigung verlangen können. Dieses Recht steht den Gläubigern jedoch nur zu, wenn sie glaubhaft machen, dass durch die #DV.UmF die Erfüllung ihrer Forderung gefährdet wird."
    },
    {
      "date": "2025-05-21",
      "id": "109850",
      "original_text": "Sonstige Registerbekanntmachung\nHessen Amtsgericht Fulda VR 2028\nMännergesangverein (MGV) 1891 Rothenkirchen e.V. – Burghaun-Rothenkirchen",
      "type": "Sonstige Registerbekanntmachung",
      "state": "Hessen",
      "amtsgericht": "Amtsgericht Fulda",
      "registernummer": "VR 2028",
      "registerart": "VR",
      "company_name": "Männergesangverein (MGV) 1891 Rothenkirchen e.V.",
      "company_seat": "Burghaun-Rothenkirchen",
      "details": "21.05.2025 (Bekanntmachungsdatum)\n\nHessen Amtsgericht Fulda VR 2028\nSonstige Registerbekanntmachung 21.05.2025 (Eintragungsdatum)\n\nMännergesangverein (MGV) 1891 Rothenkirchen e.V.\neingetragener Verein\nBurghaun-Rothenkirchen\n\nDer Verein ist aufgelöst."
    },
    {
      "date": "2025-05-21",
      "id": "109851",
      "original_text": "Löschungsankündigung\nHessen Amtsgericht Frankfurt am Main HRB 120341\nConcept Data GmbH – Frankfurt am Main",
      "type": "Löschungsankündigung",
      "state": "Hessen",
      "amtsgericht": "Amtsgericht Frankfurt am Main",
      "registernummer": "HRB 120341",
      "registerart": "HRB",
      "company_name": "Concept Data GmbH",
      "company_seat": "Frankfurt am Main",
      "details": "21.05.2025 (Bekanntmachungsdatum)\n\nHessen Amtsgericht Frankfurt am Main HRB 120341\nLöschungsankündigung\n\nConcept Data GmbH\nGesellschaft mit beschränkter Haftung\nFrankfurt am Main\n\nEs ist beabsichtigt, die Gesellschaft wegen Vermögenslosigkeit gemäß § 394 FamFG von Amts wegen im Handelsregister zu löschen. Hiergegen kann innerhalb eines Monats nach dieser Veröffentlichung Widerspruch bei dem Amtsgericht Frankfurt am Main eingelegt werden."
    },
    {
      "date": "2025-05-21",
      "id": "109852",
      "original_text": "Löschungsankündigung\nHessen Amtsgericht Darmstadt HRB 103573\nDKL Bau UG (haftungsbeschränkt) – Mörfelden-Walldorf",
      "type": "Löschungsankündigung",
      "state": "Hessen",
      "amtsgericht": "Amtsgericht Darmstadt",
      "registernummer": "HRB 103573",
      "registerart": "HRB",
      "company_name": "DKL Bau UG (haftungsbeschränkt)",
      "company_seat": "Mörfelden-Walldorf",
      "details": "21.05.2025 (Bekanntmachungsdatum)\n\nHessen Amtsgericht Darmstadt HRB 103573\nLöschungsankündigung\n\nDKL Bau UG (haftungsbeschränkt)\nGesellschaft mit beschränkter Haftung\nMörfelden-Walldorf\n\nDas Registergericht beabsichtigt die im Handelsregister eingetragene Gesellschaft von Amts wegen nach § 394 FamFG zu löschen. Die Frist zur Erhebung eines Widerspruchs gegen die beabsichtigte Löschung wird auf 3 Monate festgesetzt."
    },
    {
      "date": "2025-05-21",
      "id": "109853",
      "original_text": "Löschungsankündigung\nHessen Amtsgericht Frankfurt am Main HRB 131423\nEYN Neue Materialien Technologie GmbH – Frankfurt am Main",
      "type": "Löschungsankündigung",
      "state": "Hessen",
      "amtsgericht": "Amtsgericht Frankfurt am Main",
      "registernummer": "HRB 131423",
      "registerart": "HRB",
      "company_name": "EYN Neue Materialien Technologie GmbH",
      "company_seat": "Frankfurt am Main",
      "details": "21.05.2025 (Bekanntmachungsdatum)\n\nHessen Amtsgericht Frankfurt am Main HRB 131423\nLöschungsankündigung\n\nEYN Neue Materialien Technologie GmbH\nGesellschaft mit beschränkter Haftung\nFrankfurt am Main\n\nEs ist beabsichtigt, die Gesellschaft wegen Vermögenslosigkeit gemäß § 394 FamFG von Amts wegen im Handelsregister zu löschen. Hiergegen kann innerhalb eines Monats nach dieser Veröffentlichung Widerspruch bei dem Amtsgericht Frankfurt am Main eingelegt werden."
    },
    {
      "date": "2025-05-21",
      "id": "109854",
      "original_text": "Einreichung neuer Dokumente\nHessen Amtsgericht Wiesbaden HRB 2174\nR+V Pensionsversicherung a.G. – Wiesbaden",
      "type": "Einreichung neuer Dokumente",
      "state": "Hessen",
      "amtsgericht": "Amtsgericht Wiesbaden",
      "registernummer": "HRB 2174",
      "registerart": "HRB",
      "company_name": "R+V Pensionsversicherung a.G.",
      "company_seat": "Wiesbaden",
      "details": "21.05.2025 (Bekanntmachungsdatum)\n\nHessen Amtsgericht Wiesbaden HRB 2174\nEinreichung neuer Dokumente\n\nR+V Pensionsversicherung a.G.\nVersicherungsverein auf Gegenseitigkeit\nWiesbaden\n\nDurch eine Änderung in den Personen der Aufsichtsratsmitglieder ist eine Liste der Mitglieder des Aufsichtsrates zum Handelsregister eingereicht worden."
    },
    {
      "date": "2025-05-21",
      "id": "109855",
      "original_text": "Registerbekanntmachung nach dem Umwandlungsgesetz\nHessen Amtsgericht Eschwege HRB 3651\nRettungsdienst Rückbrodt gGmbH – Waldkappel",
      "type": "Registerbekanntmachung nach dem Umwandlungsgesetz",
      "state": "Hessen",
      "amtsgericht": "Amtsgericht Eschwege",
      "registernummer": "HRB 3651",
      "registerart": "HRB",
      "company_name": "Rettungsdienst Rückbrodt gGmbH",
      "company_seat": "Waldkappel",
      "details": "21.05.2025 (Bekanntmachungsdatum)\n\nHessen Amtsgericht Eschwege HRB 3651\nRegisterbekanntmachung nach dem Umwandlungsgesetz 21.05.2025 (Eintragungsdatum)\n\nRettungsdienst Rückbrodt gGmbH\nGesellschaft mit beschränkter Haftung\nWaldkappel\n\nDen Gläubigern der an der Ausgliederung beteiligten Rechtsträger ist, wenn sie binnen sechs Monaten nach dem Tag, an dem die Eintragung der Ausgliederung in das Register des Sitzes desjenigen Rechtsträgers, dessen Gläubiger sie sind, nach §§ 125, 19 Absatz 3 UmwG bekannt gemacht worden ist, ihren Anspruch nach Grund und Höhe schriftlich anmelden, Sicherheit zu leisten, soweit sie nicht Befriedigung verlangen können. Dieses Recht steht den Gläubigern jedoch nur zu, wenn sie glaubhaft machen, dass durch die Ausgliederung die Erfüllung ihrer Forderung gefährdet wird."
    },
    {
      "date": "2025-05-21",
      "id": "109856",
      "original_text": "Sonstige Registerbekanntmachung\nHessen Amtsgericht Frankfurt am Main HRB 38486\nAVECO Holding Aktiengesellschaft – Frankfurt am Main",
      "type": "Sonstige Registerbekanntmachung",
      "state": "Hessen",
      "amtsgericht": "Amtsgericht Frankfurt am Main",
      "registernummer": "HRB 38486",
      "registerart": "HRB",
      "company_name": "AVECO Holding Aktiengesellschaft",
      "company_seat": "Frankfurt am Main",
      "details": "21.05.2025 (Bekanntmachungsdatum)\n\nHessen Amtsgericht Frankfurt am Main HRB 38486\nSonstige Registerbekanntmachung\n\nAVECO Holding Aktiengesellschaft\nAktiengesellschaft\nFrankfurt am Main\n\nDurch eine Änderung in den Personen der Aufsichtsratsmitglieder ist eine Liste der Mitglieder des Aufsichtsrates zum Handelsregister eingereicht worden."
    },
    {
      "date": "2025-05-21",
      "id": "109857",
      "original_text": "Registerbekanntmachung nach dem Umwandlungsgesetz\nHessen Amtsgericht Frankfurt am Main HRB 12169\nOWH SE I.L. – Frankfurt am Main",
      "type": "Registerbekanntmachung nach dem Umwandlungsgesetz",
      "state": "Hessen",
      "amtsgericht": "Amtsgericht Frankfurt am Main",
      "registernummer": "HRB 12169",
      "registerart": "HRB",
      "company_name": "OWH SE I.L.",
      "company_seat": "Frankfurt am Main",
      "details": "21.05.2025 (Bekanntmachungsdatum)\n\nHessen Amtsgericht Frankfurt am Main HRB 12169\nRegisterbekanntmachung nach dem Umwandlungsgesetz\n\nOWH SE I.L.\nEuropäische Aktiengesellschaft (SE)\nFrankfurt am Main\n\nDie Gesellschaft hat den Entwurf des Ausgliederungs- und Übernahmevertrages  zwischen ihr und der optus 1032. GmbH mit Sitz in Frankfurt am Main, eingetragen im Handelsregister des Amtsgerichts Frankfurt am Main unter HRB 138494 zur Einsichtnahme eingereicht."
    },
    {
      "date": "2025-05-21",
      "id": "109858",
      "original_text": "Löschungsankündigung\nHessen Amtsgericht Frankfurt am Main HRB 58963\nAvrora GmbH – Frankfurt am Main",
      "type": "Löschungsankündigung",
      "state": "Hessen",
      "amtsgericht": "Amtsgericht Frankfurt am Main",
      "registernummer": "HRB 58963",
      "registerart": "HRB",
      "company_name": "Avrora GmbH",
      "company_seat": "Frankfurt am Main",
      "details": "21.05.2025 (Bekanntmachungsdatum)\n\nHessen Amtsgericht Frankfurt am Main HRB 58963\nLöschungsankündigung\n\nAvrora GmbH\nGesellschaft mit beschränkter Haftung\nFrankfurt am Main\n\nDas Registergericht beabsichtigt die im Handelsregister eingetragene Gesellschaft von Amts wegen nach § 394 FamFG zu löschen. Die Frist zur Erhebung eines Widerspruchs gegen die beabsichtigte Löschung wird auf 1 Monat festgesetzt."
    },
    {
      "date": "2025-05-21",
      "id": "109859",
      "original_text": "Registerbekanntmachung nach dem Umwandlungsgesetz\nHessen Amtsgericht Frankfurt am Main HRB 91022\nOFFICEFIRST Advisors Germany GmbH – Frankfurt am Main",
      "type": "Registerbekanntmachung nach dem Umwandlungsgesetz",
      "state": "Hessen",
      "amtsgericht": "Amtsgericht Frankfurt am Main",
      "registernummer": "HRB 91022",
      "registerart": "HRB",
      "company_name": "OFFICEFIRST Advisors Germany GmbH",
      "company_seat": "Frankfurt am Main",
      "details": "21.05.2025 (Bekanntmachungsdatum)\n\nHessen Amtsgericht Frankfurt am Main HRB 91022\nRegisterbekanntmachung nach dem Umwandlungsgesetz 13.05.2025 (Eintragungsdatum)\n\nOFFICEFIRST Advisors Germany GmbH\nGesellschaft mit beschränkter Haftung\nFrankfurt am Main\n\nDie Gesellschaft hat den Entwurf des gemeinsamen Verschmelzungsplans beim Handelsregister des Amtsgerichts Frankfurt am Main eingereicht.\n1.Paragraph  308 Abs. 1 Satz 2 Nr. 2 und Nr. 3 UmwG\nAn der grenzueberschreitenden Verschmelzung sind folgende Gesellschaften beteiligt, die in den unten genannten Registern eingetragen sind:\na.Uebertragende Gesellschaft ist die OFFICEFIRST Advisors Germany GmbH, eine Gesellschaft mit beschraenkter Haftung nach deutschem Recht mit ihrem Sitz in Frankfurt am Main, Deutschland, und Geschaeftsanschrift Friedrich Ebert Anlage 49, 60237 Frankfurt am Main, Deutschland, eingetragen im Handelsregister des Amtsgerichts Frankfurt am Main unter HRB 91022.\nb.Uebernehmende Gesellschaft ist die Loonie Advisors Luxembourg S.a r.l., eine Gesellschaft mit beschraenkter Haftung  nach dem Recht des Grossherzogtums Luxemburg mit Geschaeftsanschrift 2 bis 4, rue Eugene Ruppert, 2453 Luxemburg, Grossherzogtum Luxemburg, eingetragen im Handelsregister und Gesellschaftsregister von Luxemburg unter der Registernummer B160395.\n\n2.Paragraph 308 Abs. 1 Satz 2 Nr. 4 UmwG\nDie Verschmelzung bedarf nach Paragraph 312 Abs. 2 i.V.m. Paragraph 307 Abs. 3 Nr. 1 UmwG nicht der Zustimmung der Gesellschafterversammlung der Gesellschaft. Stattdessen trifft die alleinige Anteilsinhaberin der Gesellschaft grundsaetzlich die Entscheidung ueber den Abschluss des Verschmelzungsplans mit der Beurkundung des Verschmelzungsplans, die aktuell fuer den Tag geplant ist, der auf den Ablauf von einem Monat nach dem Tag der Registerbekanntmachung des Entwurfs des Verschmelzungsplans folgt, oder ggfs. den naechsten Arbeitstag, wobei Samstage, Sonntage und bundesweite Feiertage nicht als Arbeitstage zaehlen.\nZusaetzlich beabsichtigen die Gesellschafter der verschmelzenden Gesellschaften hoechst-vorsorglich, am Tag der Beurkundung des Verschmelzungsplans zustimmende Beschluesse zu fassen.\nDementsprechend koennen die folgenden Personen der jeweiligen Gesellschaft spaetestens fuenf Arbeitstage vor dem Tag der Beurkundung des Verschmelzungsplans und der zustimmenden Beschluesse Bemerkungen zum Verschmelzungsplan uebermitteln:\na.die Anteilsinhaber und die Glaeubiger der an der grenzueberschreitenden Verschmelzung beteiligten Gesellschaften.\nb.die zustaendigen Betriebsraete der an der grenzueberschreitenden Verschmelzung beteiligten Gesellschaften oder, soweit es keinen Betriebsrat gibt, die Arbeitnehmer der an der grenzueberschreitenden Verschmelzung beteiligten Gesellschaften.\nEntsprechende Bemerkungen koennen an die eingetragene Geschaeftsanschrift der Gesell¬schaft gerichtet werden. Saemtliche eingehenden Bemerkungen werden der alleinigen Anteilsinhaberin der Gesellschaft zur Kenntnis gebracht. Sollte der geplante Termin der Beurkundung des Verschmelzungsplans und der zustimmenden Beschluesse aufgrund von Verzoegerungen nicht moeglich sein, wird der Termin so bald wie praktisch moeglich danach, jedenfalls aber unter Einhaltung der Monatsfrist gem. Paragraph 308 Abs. 2 UmwG seit der Einreichung des Entwurfs des Verschmelzungsplans beim Registergericht stattfinden.\nDie Gesellschaft hat den Entwurf des Verschmelzungsvertrages zwischen ihr und der #DV.Firm(Text=\"Bitte geben Sie die Firma bzw. den Namen des zu verschmelzenden Unternehmens ein!\"), #DV.Sitz(Text=\"Bitte geben Sie den Sitz des zu verschmelzenden Unternehmens ein!\") (Amtsgericht #DV.Gericht(Text=\"Bitte geben Sie das zuständige Registergericht des zu verschmelzenden Unternehmens ein!\") #DV.Reg(Text=\"Bitte wählen Sie die zutreffende Registerart aus!\",Eingabe=\"HRB\",\"HRA\",\"VR\",\"GnR\",\"PR\",\" \") #DV.Numm(Text=\"Bitte geben Sie die Registernummer ein!\")) beim Amtsgericht #DV.Gericht(Text=\"Bitte geben Sie den Ort des Registergerichts ein!\") (Registergericht) zur Einsichtnahme eingereicht."
    },
    {
      "date": "2025-05-21",
      "id": "109860",
      "original_text": "Löschungsankündigung\nHessen Amtsgericht Offenbach am Main HRB 52763\nNavi Bau GmbH – Offenbach am Main",
      "type": "Löschungsankündigung",
      "state": "Hessen",
      "amtsgericht": "Amtsgericht Offenbach am Main",
      "registernummer": "HRB 52763",
      "registerart": "HRB",
      "company_name": "Navi Bau GmbH",
      "company_seat": "Offenbach am Main",
      "details": "21.05.2025 (Bekanntmachungsdatum)\n\nHessen Amtsgericht Offenbach am Main HRB 52763\nLöschungsankündigung\n\nNavi Bau GmbH\nGesellschaft mit beschränkter Haftung\nOffenbach am Main\n\nDas Registergericht beabsichtigt die im Handelsregister eingetragene Gesellschaft von Amts wegen nach § 394 FamFG zu löschen. Die Frist zur Erhebung eines Widerspruchs gegen die beabsichtigte Löschung wird auf 3 Monate festgesetzt."
    },
    {
      "date": "2025-05-21",
      "id": "109861",
      "original_text": "Einreichung neuer Dokumente\nHessen Amtsgericht Wiesbaden HRB 30482\ngriep Vermietungs GmbH – Wiesbaden",
      "type": "Einreichung neuer Dokumente",
      "state": "Hessen",
      "amtsgericht": "Amtsgericht Wiesbaden",
      "registernummer": "HRB 30482",
      "registerart": "HRB",
      "company_name": "griep Vermietungs GmbH",
      "company_seat": "Wiesbaden",
      "details": "21.05.2025 (Bekanntmachungsdatum)\n\nHessen Amtsgericht Wiesbaden HRB 30482\nEinreichung neuer Dokumente 21.05.2025 (Eintragungsdatum)\n\ngriep Vermietungs GmbH\nGesellschaft mit beschränkter Haftung\nWiesbaden\n\nDie Gesellschaft hat Gläubigern, deren Forderungen vor dieser Bekanntmachung begründet worden sind, Sicherheit zu leisten, soweit sie nicht Befriedigung verlangen können, wenn sie sich binnen sechs Monaten nach dieser Bekanntmachung zu diesem Zweck melden."
    },
    {
      "date": "2025-05-21",
      "id": "109862",
      "original_text": "Sonstige Registerbekanntmachung\nHessen Amtsgericht Frankfurt am Main HRB 72813\nArbeiter-Samariter-Bund Wohnen und Pflege Karben GmbH – Karben",
      "type": "Sonstige Registerbekanntmachung",
      "state": "Hessen",
      "amtsgericht": "Amtsgericht Frankfurt am Main",
      "registernummer": "HRB 72813",
      "registerart": "HRB",
      "company_name": "Arbeiter-Samariter-Bund Wohnen und Pflege Karben GmbH",
      "company_seat": "Karben",
      "details": "21.05.2025 (Bekanntmachungsdatum)\n\nHessen Amtsgericht Frankfurt am Main HRB 72813\nSonstige Registerbekanntmachung 21.05.2025 (Eintragungsdatum)\n\nArbeiter-Samariter-Bund Wohnen und Pflege Karben GmbH\nGesellschaft mit beschränkter Haftung\nKarben\n\nDurch eine Änderung in den Personen der Aufsichtsratsmitglieder ist eine Liste der Mitglieder des Aufsichtsrates zum Handelsregister eingereicht worden."
    },
    {
      "date": "2025-05-21",
      "id": "109863",
      "original_text": "Registerbekanntmachung nach dem Umwandlungsgesetz\nHessen Amtsgericht Frankfurt am Main HRB 107521\nCourt HoldCo GmbH – Frankfurt am Main",
      "type": "Registerbekanntmachung nach dem Umwandlungsgesetz",
      "state": "Hessen",
      "amtsgericht": "Amtsgericht Frankfurt am Main",
      "registernummer": "HRB 107521",
      "registerart": "HRB",
      "company_name": "Court HoldCo GmbH",
      "company_seat": "Frankfurt am Main",
      "details": "21.05.2025 (Bekanntmachungsdatum)\n\nHessen Amtsgericht Frankfurt am Main HRB 107521\nRegisterbekanntmachung nach dem Umwandlungsgesetz\n\nCourt HoldCo GmbH\nGesellschaft mit beschränkter Haftung\nFrankfurt am Main\n\nDem Registergericht ist der Entwurf eines Verschmelzungsplans über die geplante grenzüberschreitende Verschmelzung der Court HoldCo GmbH mit Sitz in Frankfurt am Main (Gesellschaft mit beschränkter Haftung, eingetragen beim Amtsgericht Frankfurt am Main unter der HRB  107521) als übertragender Rechtsträger mit der Walthalla HoldCo S.à r. l. mit Sitz in Luxemburg (S.à r.l., eingetragen beim R.C.S. Luxemburg: B223803) als übertragender Rechtsträger eingereicht worden.\nDen Gläubigern der übertragenden Gesellschaft ist Sicherheit zu leisten, wenn sie innerhalb einer Frist von zwei Monaten nach Bekanntmachung des Verschmelzungsplans glaubhaft machen, dass durch die Verschmelzung die Erfüllung ihrer Forderung gefährdet wird. Die Anteilseigner der übertragenden Gesellschaft haben bei grenzüberschreitenden Verschmelzungen einen Anspruch auf angemessene Abfindung, sofern sie der Verschmelzung widersprochen haben; gegebenenfalls steht ihnen auch ein Anspruch auf bare Zuzahlung zu."
    },
    {
      "date": "2025-05-21",
      "id": "109864",
      "original_text": "Löschungsankündigung\nHessen Amtsgericht Darmstadt HRB 100883\nStrato Trading UG (haftungsbeschränkt) – Babenhausen",
      "type": "Löschungsankündigung",
      "state": "Hessen",
      "amtsgericht": "Amtsgericht Darmstadt",
      "registernummer": "HRB 100883",
      "registerart": "HRB",
      "company_name": "Strato Trading UG (haftungsbeschränkt)",
      "company_seat": "Babenhausen",
      "details": "21.05.2025 (Bekanntmachungsdatum)\n\nHessen Amtsgericht Darmstadt HRB 100883\nLöschungsankündigung\n\nStrato Trading UG (haftungsbeschränkt)\nGesellschaft mit beschränkter Haftung\nBabenhausen\n\nDas Registergericht beabsichtigt die im Handelsregister eingetragene Gesellschaft von Amts wegen nach § 394 FamFG zu löschen. Die Frist zur Erhebung eines Widerspruchs gegen die beabsichtigte Löschung wird auf 3 Monate festgesetzt."
    },
    {
      "date": "2025-05-21",
      "id": "77",
      "original_text": "Sonderregisterbekanntmachung OHNE Bezug zum elektr. Register\nBerlin Amtsgericht Berlin (Charlottenburg)\n99 AR 10734/24 B\nKOROLA Bau UG (haftungsbeschränkt)",
      "type": "Sonderregisterbekanntmachung OHNE Bezug zum elektr. Register",
      "state": "Berlin",
      "amtsgericht": "Amtsgericht Berlin (Charlottenburg)",
      "company_name": "KOROLA Bau UG (haftungsbeschränkt)",
      "sonderegister_referenz": "99 AR 10734/24 B",
      "details": "21.05.2025 (Bekanntmachungsdatum)\n\nBerlin Amtsgericht Berlin (Charlottenburg)\n99 AR 10734/24 B\nSonderregisterbekanntmachung OHNE Bezug zum elektr. Register\n\nKOROLA Bau UG (haftungsbeschränkt)\n\nDie öffentliche Zustellung des Beschlusses vom 04.03.2025 (99 AR 10734/24 B) an die KOROLA Bau UG (haftungsbeschränkt), letzte bekannte Adresse Lise-Meitner-Straße 39, 10589 Berlin, wurde bewilligt.\n\nDas Schriftstück kann in den Räumen des Amtsgerichts Charlottenburg, Hardenbergstraße 31, 10623 Berlin, Zimmer 125, 1. Stock, eingesehen werden.\n\nMit der Zustellung können Fristen in Gang gesetzt werden, nach deren Ablauf Rechtsverluste drohen können"
    }
  ]
}