{
  "date": "2025-05-05",
  "date_of_scrape": "2025-05-31T07:38:41.275Z",
  "tool_version": "0.2.0",
  "number_of_announcements": 124,
  "announcements": [
    {
      "date": "2025-05-05",
      "id": "107980",
      "original_text": "Löschungsankündigung\nMecklenburg-Vorpommern Amtsgericht Rostock HRB 16043\n\"Marktplatz\" Immobilien GmbH – Rostock",
      "type": "Löschungsankündigung",
      "state": "Mecklenburg-Vorpommern",
      "amtsgericht": "Amtsgericht Rostock",
      "registernummer": "HRB 16043",
      "registerart": "HRB",
      "company_name": "\"Marktplatz\" Immobilien GmbH",
      "company_seat": "Rostock",
      "details": "05.05.2025 (Bekanntmachungsdatum)\n\nMecklenburg-Vorpommern Amtsgericht Rostock HRB 16043\nLöschungsankündigung\n\n\"Marktplatz\" Immobilien GmbH\nGesellschaft mit beschränkter Haftung\nRostock\n\nDas Registergericht beabsichtigt, die im Handelsregister eingetragene Gesellschaft von Amts wegen nach § 394 FamFG zu löschen. Die Frist zur Erhebung eines Widerspruchs gegen die beabsichtigte Löschung wird auf einen Monat festgesetzt."
    },
    {
      "date": "2025-05-05",
      "id": "107981",
      "original_text": "Löschungsankündigung\nBerlin Amtsgericht Berlin (Charlottenburg) HRB 65636\nTIE-BREAK Modevertrieb GmbH – Berlin",
      "type": "Löschungsankündigung",
      "state": "Berlin",
      "amtsgericht": "Amtsgericht Berlin (Charlottenburg)",
      "registernummer": "HRB 65636",
      "registerart": "HRB",
      "company_name": "TIE-BREAK Modevertrieb GmbH",
      "company_seat": "Berlin",
      "details": "05.05.2025 (Bekanntmachungsdatum)\n\nBerlin Amtsgericht Berlin (Charlottenburg) HRB 65636\nLöschungsankündigung\n\nTIE-BREAK Modevertrieb GmbH\nGesellschaft mit beschränkter Haftung\nBerlin\n\nBei der nachstehenden Gesellschaft wird das Amtslöschungsverfahren gemäß § 394 FamFG eingeleitet. Widerspruchsfrist 6 Wochen"
    },
    {
      "date": "2025-05-05",
      "id": "107982",
      "original_text": "Registerbekanntmachung nach dem Umwandlungsgesetz\nHamburg Amtsgericht Hamburg HRB 145174\nHANSALOG Vertriebs GmbH – Hamburg",
      "type": "Registerbekanntmachung nach dem Umwandlungsgesetz",
      "state": "Hamburg",
      "amtsgericht": "Amtsgericht Hamburg",
      "registernummer": "HRB 145174",
      "registerart": "HRB",
      "company_name": "HANSALOG Vertriebs GmbH",
      "company_seat": "Hamburg",
      "details": "05.05.2025 (Bekanntmachungsdatum)\n\nHamburg Amtsgericht Hamburg HRB 145174\nRegisterbekanntmachung nach dem Umwandlungsgesetz 05.05.2025 (Eintragungsdatum)\n\nHANSALOG Vertriebs GmbH\nGesellschaft mit beschränkter Haftung\nHamburg\n\nAls nicht eingetragen wird bekannt gemacht:\nDen Gläubigern der an der Verschmelzung beteiligten Gesellschaften ist, wenn sie binnen sechs Monaten nach dem Tag, an dem die Eintragung der Verschmelzung in das Register des Sitzes desjenigen Rechtsträgers, dessen Gläubiger sie sind, nach § 19 Absatz 3 UmwG als bekannt gemacht gilt, ihren Anspruch nach Grund und Höhe schriftlich anmelden, Sicherheit zu leisten, soweit sie nicht Befriedigung verlangen können. Dieses Recht steht den Gläubigern jedoch nur zu, wenn sie glaubhaft machen, dass durch die Verschmelzung die Erfüllung ihrer Forderung gefährdet wird."
    },
    {
      "date": "2025-05-05",
      "id": "107983",
      "original_text": "Registerbekanntmachung nach dem Umwandlungsgesetz\nSchleswig-Holstein Amtsgericht Flensburg HRA 10039\nSterndruck GmbH & Co. KG – Schleswig",
      "type": "Registerbekanntmachung nach dem Umwandlungsgesetz",
      "state": "Schleswig-Holstein",
      "amtsgericht": "Amtsgericht Flensburg",
      "registernummer": "HRA 10039",
      "registerart": "HRA",
      "company_name": "Sterndruck GmbH & Co. KG",
      "company_seat": "Schleswig",
      "details": "05.05.2025 (Bekanntmachungsdatum)\n\nSchleswig-Holstein Amtsgericht Flensburg HRA 10039\nRegisterbekanntmachung nach dem Umwandlungsgesetz 02.05.2025 (Eintragungsdatum)\n\nSterndruck GmbH & Co. KG\nKommanditgesellschaft\nSchleswig\n\nZu Eintragungsnummer 3 vom 02.05.2025 wird als nicht eingetragen veröffentlicht: Den Gläubigern der an der Spaltung beteiligten Rechtsträger ist, wenn sie binnen sechs Monaten nach dem Tag, an dem die Eintragung der Spaltung in das Register des Sitzes desjenigen Rechtsträgers, dessen Gläubiger sie sind, als bekannt gemacht gilt, ihren Anspruch nach Grund und Höhe in Textform anmelden, Sicherheit zu leisten, soweit sie nicht Befriedigung verlangen können. Dieses Recht steht den Gläubigern jedoch nur zu, wenn sie glaubhaft machen, dass durch die Spaltung die Erfüllung ihrer Forderung gefährdet wird."
    },
    {
      "date": "2025-05-05",
      "id": "107984",
      "original_text": "Löschungsankündigung\nBrandenburg Amtsgericht Potsdam HRB 37247\nEA Investment Group GmbH – Zossen",
      "type": "Löschungsankündigung",
      "state": "Brandenburg",
      "amtsgericht": "Amtsgericht Potsdam",
      "registernummer": "HRB 37247",
      "registerart": "HRB",
      "company_name": "EA Investment Group GmbH",
      "company_seat": "Zossen",
      "details": "05.05.2025 (Bekanntmachungsdatum)\n\nBrandenburg Amtsgericht Potsdam HRB 37247\nLöschungsankündigung\n\nEA Investment Group GmbH\nGesellschaft mit beschränkter Haftung\nZossen\n\nBei der nachstehenden Gesellschaft wird das Amtslöschungsverfahren gemäß § 394 FamFG eingeleitet. Widerspruchsfrist: 8 Wochen."
    },
    {
      "date": "2025-05-05",
      "id": "107985",
      "original_text": "Registerbekanntmachung nach dem Umwandlungsgesetz\nSchleswig-Holstein Amtsgericht Flensburg HRA 5960\nHodge Werbung & Druck Inhaber: Michael Marquardt e.K. – Schleswig",
      "type": "Registerbekanntmachung nach dem Umwandlungsgesetz",
      "state": "Schleswig-Holstein",
      "amtsgericht": "Amtsgericht Flensburg",
      "registernummer": "HRA 5960",
      "registerart": "HRA",
      "company_name": "Hodge Werbung & Druck Inhaber: Michael Marquardt e.K.",
      "company_seat": "Schleswig",
      "details": "05.05.2025 (Bekanntmachungsdatum)\n\nSchleswig-Holstein Amtsgericht Flensburg HRA 5960\nRegisterbekanntmachung nach dem Umwandlungsgesetz 02.05.2025 (Eintragungsdatum)\n\nHodge Werbung & Druck Inhaber: Michael Marquardt e.K.\nEinzelkaufmann / Einzelkauffrau\nSchleswig\n\nZu Eintragungsnummer 4 vom 02.05.2025 wird als nicht eingetragen veröffentlicht:  Den Gläubigern der an der Spaltung beteiligten Rechtsträger ist, wenn sie binnen sechs Monaten nach dem Tag, an dem die Eintragung der Spaltung in das Register des Sitzes desjenigen Rechtsträgers, dessen Gläubiger sie sind, als bekannt gemacht gilt, ihren Anspruch nach Grund und Höhe in Textform anmelden, Sicherheit zu leisten, soweit sie nicht Befriedigung verlangen können. Dieses Recht steht den Gläubigern jedoch nur zu, wenn sie glaubhaft machen, dass durch die Spaltung die Erfüllung ihrer Forderung gefährdet wird."
    },
    {
      "date": "2025-05-05",
      "id": "107986",
      "original_text": "Löschungsankündigung\nBerlin Amtsgericht Berlin (Charlottenburg) HRB 137295\nLiper Elektro GmbH – Berlin",
      "type": "Löschungsankündigung",
      "state": "Berlin",
      "amtsgericht": "Amtsgericht Berlin (Charlottenburg)",
      "registernummer": "HRB 137295",
      "registerart": "HRB",
      "company_name": "Liper Elektro GmbH",
      "company_seat": "Berlin",
      "details": "05.05.2025 (Bekanntmachungsdatum)\n\nBerlin Amtsgericht Berlin (Charlottenburg) HRB 137295\nLöschungsankündigung\n\nLiper Elektro GmbH\nGesellschaft mit beschränkter Haftung\nBerlin\n\nBei der nachstehenden Gesellschaft wird das Amtslöschungsverfahren gemäß § 394 FamFG eingeleitet. Widerspruchsfrist 6 Wochen"
    },
    {
      "date": "2025-05-05",
      "id": "107987",
      "original_text": "Einreichung neuer Dokumente\nBerlin Amtsgericht Berlin (Charlottenburg) HRB 248794\nCantourage Group SE – Berlin",
      "type": "Einreichung neuer Dokumente",
      "state": "Berlin",
      "amtsgericht": "Amtsgericht Berlin (Charlottenburg)",
      "registernummer": "HRB 248794",
      "registerart": "HRB",
      "company_name": "Cantourage Group SE",
      "company_seat": "Berlin",
      "details": "05.05.2025 (Bekanntmachungsdatum)\n\nBerlin Amtsgericht Berlin (Charlottenburg) HRB 248794\nEinreichung neuer Dokumente\n\nCantourage Group SE\nEuropäische Aktiengesellschaft (SE)\nBerlin\n\nAls nicht eingetragen wird veröffentlicht:\n\nEs wurde eine neue Liste der Aufsichtsratsmitglieder eingereicht (§ 106 AktG)."
    },
    {
      "date": "2025-05-05",
      "id": "107988",
      "original_text": "Registerbekanntmachung nach dem Umwandlungsgesetz\nBerlin Amtsgericht Berlin (Charlottenburg) HRA 63454\nGennadij Bokk e.K. – Berlin",
      "type": "Registerbekanntmachung nach dem Umwandlungsgesetz",
      "state": "Berlin",
      "amtsgericht": "Amtsgericht Berlin (Charlottenburg)",
      "registernummer": "HRA 63454",
      "registerart": "HRA",
      "company_name": "Gennadij Bokk e.K.",
      "company_seat": "Berlin",
      "details": "05.05.2025 (Bekanntmachungsdatum)\n\nBerlin Amtsgericht Berlin (Charlottenburg) HRA 63454\nRegisterbekanntmachung nach dem Umwandlungsgesetz 02.05.2025 (Eintragungsdatum)\n\nGennadij Bokk e.K.\nEinzelkaufmann / Einzelkauffrau\nBerlin\n\nZu Eintragungsnummer 2 vom 02.05.2025 wird als nicht eingetragen veröffentlicht: Den Gläubigern der an der Spaltung beteiligten Rechtsträger ist, wenn sie binnen sechs Monaten nach dem Tag, an dem die Eintragung der Spaltung in das Register des Sitzes desjenigen Rechtsträgers, dessen Gläubiger sie sind, als bekannt gemacht gilt, ihren Anspruch nach Grund und Höhe schriftlich anmelden, Sicherheit zu leisten, soweit sie nicht Befriedigung verlangen können. Dieses Recht steht den Gläubigern jedoch nur zu, wenn sie glaubhaft machen, dass durch die Spaltung die Erfüllung ihrer Forderung gefährdet wird. Das Recht, Sicherheitsleistung zu verlangen, steht Gläubigern nicht zu, die im Falle der Insolvenz ein Recht auf vorzugsweise Befriedigung aus einer Deckungsmasse haben, die nach gesetzlicher Vorschrift zu ihrem Schutz errichtet und staatlich überwacht ist."
    },
    {
      "date": "2025-05-05",
      "id": "107989",
      "original_text": "Sonstige Registerbekanntmachung\nSachsen-Anhalt Amtsgericht Stendal HRB 207029\nTechnische Werke Naumburg GmbH – Naumburg (Saale)",
      "type": "Sonstige Registerbekanntmachung",
      "state": "Sachsen-Anhalt",
      "amtsgericht": "Amtsgericht Stendal",
      "registernummer": "HRB 207029",
      "registerart": "HRB",
      "company_name": "Technische Werke Naumburg GmbH",
      "company_seat": "Naumburg (Saale)",
      "details": "05.05.2025 (Bekanntmachungsdatum)\n\nSachsen-Anhalt Amtsgericht Stendal HRB 207029\nSonstige Registerbekanntmachung 05.05.2025 (Eintragungsdatum)\n\nTechnische Werke Naumburg GmbH\nGesellschaft mit beschränkter Haftung\nNaumburg (Saale)\n\nNicht eingetragen:\nAls nicht eingetragen wird veröffentlicht: Den Gläubigern der Gesellschaft, deren Forderungen begründet worden sind bevor die Eintragung der Beendigung des #DV.Art(Text=\"Art des Vertrages auswählen\",Eingabe=\"Beherrschungs- und Gewinnabführungsvertrages\",\"Beherrschungsvertrages\",\"Gewinnabführungsvertrages\",\"Teilgewinnabführungsvertrages\")  in das Handelsregister nach § 10 des Handelsgesetzbuches als bekanntgemacht gilt, hat der andere Vertragsteil Sicherheit zu leisten, wenn sie sich binnen sechs Monaten nach der Bekanntmachung der Eintragung zu diesem Zweck bei ihm melden."
    },
    {
      "date": "2025-05-05",
      "id": "107990",
      "original_text": "Löschungsankündigung\nBerlin Amtsgericht Berlin (Charlottenburg) HRB 173848\nCembay Taxi GmbH – Berlin",
      "type": "Löschungsankündigung",
      "state": "Berlin",
      "amtsgericht": "Amtsgericht Berlin (Charlottenburg)",
      "registernummer": "HRB 173848",
      "registerart": "HRB",
      "company_name": "Cembay Taxi GmbH",
      "company_seat": "Berlin",
      "details": "05.05.2025 (Bekanntmachungsdatum)\n\nBerlin Amtsgericht Berlin (Charlottenburg) HRB 173848\nLöschungsankündigung\n\nCembay Taxi GmbH\nGesellschaft mit beschränkter Haftung\nBerlin\n\nBei der nachstehenden Gesellschaft wird das Amtslöschungsverfahren gemäß § 394 FamFG eingeleitet. Widerspruchsfrist 6 Wochen"
    },
    {
      "date": "2025-05-05",
      "id": "107991",
      "original_text": "Registerbekanntmachung nach dem Umwandlungsgesetz\nHamburg Amtsgericht Hamburg HRA 131945\nBelma Hayran e. K. – Hamburg",
      "type": "Registerbekanntmachung nach dem Umwandlungsgesetz",
      "state": "Hamburg",
      "amtsgericht": "Amtsgericht Hamburg",
      "registernummer": "HRA 131945",
      "registerart": "HRA",
      "company_name": "Belma Hayran e. K.",
      "company_seat": "Hamburg",
      "details": "05.05.2025 (Bekanntmachungsdatum)\n\nHamburg Amtsgericht Hamburg HRA 131945\nRegisterbekanntmachung nach dem Umwandlungsgesetz 05.05.2025 (Eintragungsdatum)\n\nBelma Hayran e. K.\nEinzelkaufmann\nHamburg\n\nAls nicht eingetragen wird bekannt gemacht:\nDen Gläubigern der an der Ausgliederung beteiligten Gesellschaften ist, wenn sie binnen sechs Monaten nach dem Tag, an dem die Eintragung der Ausgliederung in das Register des Sitzes desjenigen Rechtsträgers, dessen Gläubiger sie sind, nach § 19 Absatz 3 UmwG als bekannt gemacht gilt, ihren Anspruch nach Grund und Höhe schriftlich anmelden, Sicherheit zu leisten, soweit sie nicht Befriedigung verlangen können. Dieses Recht steht den Gläubigern jedoch nur zu, wenn sie glaubhaft machen, dass durch die Ausgliederung die Erfüllung ihrer Forderung gefährdet wird."
    },
    {
      "date": "2025-05-05",
      "id": "107992",
      "original_text": "Registerbekanntmachung nach dem Umwandlungsgesetz\nHamburg Amtsgericht Hamburg HRA 132008\nBuchhaltungsservice Hayran GmbH & Co. KG – Hamburg",
      "type": "Registerbekanntmachung nach dem Umwandlungsgesetz",
      "state": "Hamburg",
      "amtsgericht": "Amtsgericht Hamburg",
      "registernummer": "HRA 132008",
      "registerart": "HRA",
      "company_name": "Buchhaltungsservice Hayran GmbH & Co. KG",
      "company_seat": "Hamburg",
      "details": "05.05.2025 (Bekanntmachungsdatum)\n\nHamburg Amtsgericht Hamburg HRA 132008\nRegisterbekanntmachung nach dem Umwandlungsgesetz 05.05.2025 (Eintragungsdatum)\n\nBuchhaltungsservice Hayran GmbH & Co. KG\nKommanditgesellschaft\nHamburg\n\nAls nicht eingetragen wird bekannt gemacht:\nDen Gläubigern der an der Ausgliederung beteiligten Gesellschaften ist, wenn sie binnen sechs Monaten nach dem Tag, an dem die Eintragung der Ausgliederung in das Register des Sitzes desjenigen Rechtsträgers, dessen Gläubiger sie sind, nach § 19 Absatz 3 UmwG als bekannt gemacht gilt, ihren Anspruch nach Grund und Höhe schriftlich anmelden, Sicherheit zu leisten, soweit sie nicht Befriedigung verlangen können. Dieses Recht steht den Gläubigern jedoch nur zu, wenn sie glaubhaft machen, dass durch die Ausgliederung die Erfüllung ihrer Forderung gefährdet wird."
    },
    {
      "date": "2025-05-05",
      "id": "107993",
      "original_text": "Registerbekanntmachung nach dem Umwandlungsgesetz\nHamburg Amtsgericht Hamburg HRB 83493\nPeram Handelsgesellschaft mbH – Hamburg",
      "type": "Registerbekanntmachung nach dem Umwandlungsgesetz",
      "state": "Hamburg",
      "amtsgericht": "Amtsgericht Hamburg",
      "registernummer": "HRB 83493",
      "registerart": "HRB",
      "company_name": "Peram Handelsgesellschaft mbH",
      "company_seat": "Hamburg",
      "details": "05.05.2025 (Bekanntmachungsdatum)\n\nHamburg Amtsgericht Hamburg HRB 83493\nRegisterbekanntmachung nach dem Umwandlungsgesetz 05.05.2025 (Eintragungsdatum)\n\nPeram Handelsgesellschaft mbH\nGesellschaft mit beschränkter Haftung\nHamburg\n\nAls nicht eingetragen wird bekannt gemacht:\nDen Gläubigern der an der Verschmelzung beteiligten Gesellschaften ist, wenn sie binnen sechs Monaten nach dem Tag, an dem die Eintragung der Verschmelzung in das Register des Sitzes desjenigen Rechtsträgers, dessen Gläubiger sie sind, nach § 19 Absatz 3 UmwG als bekannt gemacht gilt, ihren Anspruch nach Grund und Höhe schriftlich anmelden, Sicherheit zu leisten, soweit sie nicht Befriedigung verlangen können. Dieses Recht steht den Gläubigern jedoch nur zu, wenn sie glaubhaft machen, dass durch die Verschmelzung die Erfüllung ihrer Forderung gefährdet wird."
    },
    {
      "date": "2025-05-05",
      "id": "107994",
      "original_text": "Registerbekanntmachung nach dem Umwandlungsgesetz\nHamburg Amtsgericht Hamburg HRB 159877\nJPJ International Trading UG (haftungsbeschränkt) – Hamburg",
      "type": "Registerbekanntmachung nach dem Umwandlungsgesetz",
      "state": "Hamburg",
      "amtsgericht": "Amtsgericht Hamburg",
      "registernummer": "HRB 159877",
      "registerart": "HRB",
      "company_name": "JPJ International Trading UG (haftungsbeschränkt)",
      "company_seat": "Hamburg",
      "details": "05.05.2025 (Bekanntmachungsdatum)\n\nHamburg Amtsgericht Hamburg HRB 159877\nRegisterbekanntmachung nach dem Umwandlungsgesetz 05.05.2025 (Eintragungsdatum)\n\nJPJ International Trading UG (haftungsbeschränkt)\nGesellschaft mit beschränkter Haftung\nHamburg\n\nAls nicht eingetragen wird bekannt gemacht:\nDen Gläubigern der an der Verschmelzung beteiligten Gesellschaften ist, wenn sie binnen sechs Monaten nach dem Tag, an dem die Eintragung der Verschmelzung in das Register des Sitzes desjenigen Rechtsträgers, dessen Gläubiger sie sind, nach § 19 Absatz 3 UmwG als bekannt gemacht gilt, ihren Anspruch nach Grund und Höhe schriftlich anmelden, Sicherheit zu leisten, soweit sie nicht Befriedigung verlangen können. Dieses Recht steht den Gläubigern jedoch nur zu, wenn sie glaubhaft machen, dass durch die Verschmelzung die Erfüllung ihrer Forderung gefährdet wird."
    },
    {
      "date": "2025-05-05",
      "id": "107995",
      "original_text": "Löschungsankündigung\nNordrhein-Westfalen Amtsgericht Coesfeld HRB 19136\nCNA Bau UG (haftungsbeschränkt) – Bocholt",
      "type": "Löschungsankündigung",
      "state": "Nordrhein-Westfalen",
      "amtsgericht": "Amtsgericht Coesfeld",
      "registernummer": "HRB 19136",
      "registerart": "HRB",
      "company_name": "CNA Bau UG (haftungsbeschränkt)",
      "company_seat": "Bocholt",
      "details": "05.05.2025 (Bekanntmachungsdatum)\n\nNordrhein-Westfalen Amtsgericht Coesfeld HRB 19136\nLöschungsankündigung\n\nCNA Bau UG (haftungsbeschränkt)\nGesellschaft mit beschränkter Haftung\nBocholt\n\nDas Registergericht beabsichtigt, den Rechtsträger wegen Vermögenslosigkeit gemäß § 394 FamFG von Amts wegen zu löschen.\n\nGegen diese Verfügung kann Widerspruch eingelegt werden. Die Frist zur Erhebung eines Widerspruchs gegen die beabsichtigte Löschung ist auf zwei Monate ab Veröffentlichung festgesetzt."
    },
    {
      "date": "2025-05-05",
      "id": "107996",
      "original_text": "Registerbekanntmachung nach dem Umwandlungsgesetz\nBrandenburg Amtsgericht Cottbus HRA 4369\nAutohaus Wildau by J.A.H. e.K. – Wildau",
      "type": "Registerbekanntmachung nach dem Umwandlungsgesetz",
      "state": "Brandenburg",
      "amtsgericht": "Amtsgericht Cottbus",
      "registernummer": "HRA 4369",
      "registerart": "HRA",
      "company_name": "Autohaus Wildau by J.A.H. e.K.",
      "company_seat": "Wildau",
      "details": "05.05.2025 (Bekanntmachungsdatum)\n\nBrandenburg Amtsgericht Cottbus HRA 4369\nRegisterbekanntmachung nach dem Umwandlungsgesetz 02.05.2025 (Eintragungsdatum)\n\nAutohaus Wildau by J.A.H. e.K.\nEinzelkaufmann / Einzelkauffrau\nWildau\n\nDen Gläubigern der an der Spaltung beteiligten Rechtsträger ist, wenn sie binnen sechs Monaten nach dem Tag, an dem die Eintragung der Spaltung in das Register des Sitzes desjenigen Rechtsträgers, dessen Gläubiger sie sind, als bekannt gemacht gilt, ihren Anspruch nach Grund und Höhe schriftlich anmelden, Sicherheit zu leisten, soweit sie nicht Befriedigung verlangen können. Dieses Recht steht den Gläubigern jedoch nur zu, wenn sie glaubhaft machen, dass durch die Spaltung die Erfüllung ihrer Forderung gefährdet wird"
    },
    {
      "date": "2025-05-05",
      "id": "107997",
      "original_text": "Löschungsankündigung\nBerlin Amtsgericht Berlin (Charlottenburg) HRB 181346\nThammex exclusive Fahrzeugtransport GmbH – Berlin",
      "type": "Löschungsankündigung",
      "state": "Berlin",
      "amtsgericht": "Amtsgericht Berlin (Charlottenburg)",
      "registernummer": "HRB 181346",
      "registerart": "HRB",
      "company_name": "Thammex exclusive Fahrzeugtransport GmbH",
      "company_seat": "Berlin",
      "details": "05.05.2025 (Bekanntmachungsdatum)\n\nBerlin Amtsgericht Berlin (Charlottenburg) HRB 181346\nLöschungsankündigung\n\nThammex exclusive Fahrzeugtransport GmbH\nGesellschaft mit beschränkter Haftung\nBerlin\n\nBei der nachstehenden Gesellschaft wird das Amtslöschungsverfahren gemäß § 394 FamFG eingeleitet. Widerspruchsfrist 6 Wochen"
    },
    {
      "date": "2025-05-05",
      "id": "107998",
      "original_text": "Löschungsankündigung\nBerlin Amtsgericht Berlin (Charlottenburg) HRB 255393\nNAKT Music UG (haftungsbeschränkt) – Berlin",
      "type": "Löschungsankündigung",
      "state": "Berlin",
      "amtsgericht": "Amtsgericht Berlin (Charlottenburg)",
      "registernummer": "HRB 255393",
      "registerart": "HRB",
      "company_name": "NAKT Music UG (haftungsbeschränkt)",
      "company_seat": "Berlin",
      "details": "05.05.2025 (Bekanntmachungsdatum)\n\nBerlin Amtsgericht Berlin (Charlottenburg) HRB 255393\nLöschungsankündigung\n\nNAKT Music UG (haftungsbeschränkt)\nGesellschaft mit beschränkter Haftung\nBerlin\n\nBei der nachstehenden Gesellschaft wird das Amtslöschungsverfahren gemäß § 394 FamFG eingeleitet. Widerspruchsfrist 6 Wochen"
    },
    {
      "date": "2025-05-05",
      "id": "107999",
      "original_text": "Löschungsankündigung\nMecklenburg-Vorpommern Amtsgericht Stralsund HRB 21536\nTL Agrarhandel GmbH – Loitz",
      "type": "Löschungsankündigung",
      "state": "Mecklenburg-Vorpommern",
      "amtsgericht": "Amtsgericht Stralsund",
      "registernummer": "HRB 21536",
      "registerart": "HRB",
      "company_name": "TL Agrarhandel GmbH",
      "company_seat": "Loitz",
      "details": "05.05.2025 (Bekanntmachungsdatum)\n\nMecklenburg-Vorpommern Amtsgericht Stralsund HRB 21536\nLöschungsankündigung\n\nTL Agrarhandel GmbH\nGesellschaft mit beschränkter Haftung\nLoitz\n\nDas Registergericht beabsichtigt, die im Handelsregister eingetragene Gesellschaft von Amts wegen nach § 394 FamFG zu löschen. Die Frist zur Erhebung eines Widerspruchs gegen die beabsichtigte Löschung wird auf 1 Monat festgesetzt."
    },
    {
      "date": "2025-05-05",
      "id": "108000",
      "original_text": "Registerbekanntmachung nach dem Umwandlungsgesetz\nHamburg Amtsgericht Hamburg HRB 192005\ncobuild GmbH – Hamburg",
      "type": "Registerbekanntmachung nach dem Umwandlungsgesetz",
      "state": "Hamburg",
      "amtsgericht": "Amtsgericht Hamburg",
      "registernummer": "HRB 192005",
      "registerart": "HRB",
      "company_name": "cobuild GmbH",
      "company_seat": "Hamburg",
      "details": "05.05.2025 (Bekanntmachungsdatum)\n\nHamburg Amtsgericht Hamburg HRB 192005\nRegisterbekanntmachung nach dem Umwandlungsgesetz 05.05.2025 (Eintragungsdatum)\n\ncobuild GmbH\nGesellschaft mit beschränkter Haftung\nHamburg\n\nAls nicht eingetragen wird bekannt gemacht:\nDen Gläubigern der an der Ausgliederung beteiligten Gesellschaften ist, wenn sie binnen sechs Monaten nach dem Tag, an dem die Eintragung der Ausgliederung in das Register des Sitzes desjenigen Rechtsträgers, dessen Gläubiger sie sind, nach § 19 Absatz 3 UmwG als bekannt gemacht gilt, ihren Anspruch nach Grund und Höhe schriftlich anmelden, Sicherheit zu leisten, soweit sie nicht Befriedigung verlangen können. Dieses Recht steht den Gläubigern jedoch nur zu, wenn sie glaubhaft machen, dass durch die Ausgliederung die Erfüllung ihrer Forderung gefährdet wird."
    },
    {
      "date": "2025-05-05",
      "id": "108001",
      "original_text": "Registerbekanntmachung nach dem Umwandlungsgesetz\nHamburg Amtsgericht Hamburg HRA 132331\nKonstantin Münster e.K. – Hamburg",
      "type": "Registerbekanntmachung nach dem Umwandlungsgesetz",
      "state": "Hamburg",
      "amtsgericht": "Amtsgericht Hamburg",
      "registernummer": "HRA 132331",
      "registerart": "HRA",
      "company_name": "Konstantin Münster e.K.",
      "company_seat": "Hamburg",
      "details": "05.05.2025 (Bekanntmachungsdatum)\n\nHamburg Amtsgericht Hamburg HRA 132331\nRegisterbekanntmachung nach dem Umwandlungsgesetz 05.05.2025 (Eintragungsdatum)\n\nKonstantin Münster e.K.\nEinzelkaufmann\nHamburg\n\nAls nicht eingetragen wird bekannt gemacht:\nDen Gläubigern der an der Ausgliederung beteiligten Gesellschaften ist, wenn sie binnen sechs Monaten nach dem Tag, an dem die Eintragung der Ausgliederung in das Register des Sitzes desjenigen Rechtsträgers, dessen Gläubiger sie sind, nach § 19 Absatz 3 UmwG als bekannt gemacht gilt, ihren Anspruch nach Grund und Höhe schriftlich anmelden, Sicherheit zu leisten, soweit sie nicht Befriedigung verlangen können. Dieses Recht steht den Gläubigern jedoch nur zu, wenn sie glaubhaft machen, dass durch die Ausgliederung die Erfüllung ihrer Forderung gefährdet wird."
    },
    {
      "date": "2025-05-05",
      "id": "108002",
      "original_text": "Löschungsankündigung\nBerlin Amtsgericht Berlin (Charlottenburg) HRB 205601\nGlanz Bauleistungen GmbH – Berlin",
      "type": "Löschungsankündigung",
      "state": "Berlin",
      "amtsgericht": "Amtsgericht Berlin (Charlottenburg)",
      "registernummer": "HRB 205601",
      "registerart": "HRB",
      "company_name": "Glanz Bauleistungen GmbH",
      "company_seat": "Berlin",
      "details": "05.05.2025 (Bekanntmachungsdatum)\n\nBerlin Amtsgericht Berlin (Charlottenburg) HRB 205601\nLöschungsankündigung\n\nGlanz Bauleistungen GmbH\nGesellschaft mit beschränkter Haftung\nBerlin\n\nBei der nachstehenden Gesellschaft wird das Amtslöschungsverfahren gemäß § 394 FamFG eingeleitet. Widerspruchsfrist 6 Wochen"
    },
    {
      "date": "2025-05-05",
      "id": "108003",
      "original_text": "Löschungsankündigung\nBerlin Amtsgericht Berlin (Charlottenburg) HRB 169124\nNordberliner Dienstleistungs GmbH – Berlin",
      "type": "Löschungsankündigung",
      "state": "Berlin",
      "amtsgericht": "Amtsgericht Berlin (Charlottenburg)",
      "registernummer": "HRB 169124",
      "registerart": "HRB",
      "company_name": "Nordberliner Dienstleistungs GmbH",
      "company_seat": "Berlin",
      "details": "05.05.2025 (Bekanntmachungsdatum)\n\nBerlin Amtsgericht Berlin (Charlottenburg) HRB 169124\nLöschungsankündigung\n\nNordberliner Dienstleistungs GmbH\nGesellschaft mit beschränkter Haftung\nBerlin\n\nBei der nachstehenden Gesellschaft wird das Amtslöschungsverfahren gemäß § 394 FamFG eingeleitet. Widerspruchsfrist 6 Wochen"
    },
    {
      "date": "2025-05-05",
      "id": "108004",
      "original_text": "Einreichung neuer Dokumente\nSaarland Amtsgericht Saarbrücken HRB 52608\nGewerbepark Lebach Gesellschaft mit beschränkter Haftung – Lebach",
      "type": "Einreichung neuer Dokumente",
      "state": "Saarland",
      "amtsgericht": "Amtsgericht Saarbrücken",
      "registernummer": "HRB 52608",
      "registerart": "HRB",
      "company_name": "Gewerbepark Lebach Gesellschaft mit beschränkter Haftung",
      "company_seat": "Lebach",
      "details": "05.05.2025 (Bekanntmachungsdatum)\n\nSaarland Amtsgericht Saarbrücken HRB 52608\nEinreichung neuer Dokumente\n\nGewerbepark Lebach Gesellschaft mit beschränkter Haftung\nGesellschaft mit beschränkter Haftung\nLebach\n\nDie Geschäftsführung der Gesellschaft hat eine Liste der Mitglieder des Aufsichtsrats zum Handelsregister eingereicht (§ 52 Abs. 3 Satz 2 GmbHG)."
    },
    {
      "date": "2025-05-05",
      "id": "108005",
      "original_text": "Registerbekanntmachung nach dem Umwandlungsgesetz\nSachsen-Anhalt Amtsgericht Stendal HRB 2126\nAltmärker Getränkevertriebs GmbH – Gardelegen",
      "type": "Registerbekanntmachung nach dem Umwandlungsgesetz",
      "state": "Sachsen-Anhalt",
      "amtsgericht": "Amtsgericht Stendal",
      "registernummer": "HRB 2126",
      "registerart": "HRB",
      "company_name": "Altmärker Getränkevertriebs GmbH",
      "company_seat": "Gardelegen",
      "details": "05.05.2025 (Bekanntmachungsdatum)\n\nSachsen-Anhalt Amtsgericht Stendal HRB 2126\nRegisterbekanntmachung nach dem Umwandlungsgesetz 05.05.2025 (Eintragungsdatum)\n\nAltmärker Getränkevertriebs GmbH\nGesellschaft mit beschränkter Haftung\nGardelegen\n\nNicht eingetragen:\nDen Gläubigern der an der Verschmelzung beteiligten Rechtsträger ist, wenn sie binnen sechs Monaten nach dem Tag, an dem die Eintragung der Verschmelzung nach § 19 Abs. 3 UmwG als bekanntgemacht gilt, ihren Anspruch nach Grund und Höhe schriftlich anmelden, Sicherheit zu leisten, soweit sie nicht Befriedigung verlangen können. Dieses Recht steht ihnen jedoch nur zu, wenn sie glaubhaft machen, dass durch die Verschmelzung die Erfüllung ihrer Forderung gefährdet wird."
    },
    {
      "date": "2025-05-05",
      "id": "108006",
      "original_text": "Registerbekanntmachung nach dem Umwandlungsgesetz\nSachsen-Anhalt Amtsgericht Stendal HRB 23145\nSchesni GmbH – Gardelegen",
      "type": "Registerbekanntmachung nach dem Umwandlungsgesetz",
      "state": "Sachsen-Anhalt",
      "amtsgericht": "Amtsgericht Stendal",
      "registernummer": "HRB 23145",
      "registerart": "HRB",
      "company_name": "Schesni GmbH",
      "company_seat": "Gardelegen",
      "details": "05.05.2025 (Bekanntmachungsdatum)\n\nSachsen-Anhalt Amtsgericht Stendal HRB 23145\nRegisterbekanntmachung nach dem Umwandlungsgesetz 05.05.2025 (Eintragungsdatum)\n\nSchesni GmbH\nGesellschaft mit beschränkter Haftung\nGardelegen\n\nNicht eingetragen:\nDen Gläubigern der an der Verschmelzung beteiligten Rechtsträger ist, wenn sie binnen sechs Monaten nach dem Tag, an dem die Eintragung der Verschmelzung nach § 19 Abs. 3 UmwG als bekanntgemacht gilt, ihren Anspruch nach Grund und Höhe schriftlich anmelden, Sicherheit zu leisten, soweit sie nicht Befriedigung verlangen können. Dieses Recht steht ihnen jedoch nur zu, wenn sie glaubhaft machen, dass durch die Verschmelzung die Erfüllung ihrer Forderung gefährdet wird."
    },
    {
      "date": "2025-05-05",
      "id": "108007",
      "original_text": "Sonstige Registerbekanntmachung\nHamburg Amtsgericht Hamburg HRB 183265\nVibracoustic SE – Hamburg",
      "type": "Sonstige Registerbekanntmachung",
      "state": "Hamburg",
      "amtsgericht": "Amtsgericht Hamburg",
      "registernummer": "HRB 183265",
      "registerart": "HRB",
      "company_name": "Vibracoustic SE",
      "company_seat": "Hamburg",
      "details": "05.05.2025 (Bekanntmachungsdatum)\n\nHamburg Amtsgericht Hamburg HRB 183265\nSonstige Registerbekanntmachung 29.04.2025 (Eintragungsdatum)\n\nVibracoustic SE\nEuropäische Aktiengesellschaft (SE)\nHamburg\n\nAls nicht eingetragen wird bekannt gemacht: Liste des Aufsichtsrats wurde eingereicht."
    },
    {
      "date": "2025-05-05",
      "id": "108008",
      "original_text": "Löschungsankündigung\nThüringen Amtsgericht Jena HRB 502423\nGrundstücks- und Vermögensverwaltungsgesellschaft Am Schlosspark mbH – Gotha",
      "type": "Löschungsankündigung",
      "state": "Thüringen",
      "amtsgericht": "Amtsgericht Jena",
      "registernummer": "HRB 502423",
      "registerart": "HRB",
      "company_name": "Grundstücks- und Vermögensverwaltungsgesellschaft Am Schlosspark mbH",
      "company_seat": "Gotha",
      "details": "05.05.2025 (Bekanntmachungsdatum)\n\nThüringen Amtsgericht Jena HRB 502423\nLöschungsankündigung\n\nGrundstücks- und Vermögensverwaltungsgesellschaft Am Schlosspark mbH\nGesellschaft mit beschränkter Haftung\nGotha\n\nDas Registergericht beabsichtigt, die im Handelsregister eingetragene Gesellschaft wegen Vermögenslosigkeit nach § 394 FamFG von Amts wegen zu löschen. Die Frist zur Erhebung eines Widerspruchs gegen die beabsichtigte Löschung wird auf 6 Wochen festgesetzt."
    },
    {
      "date": "2025-05-05",
      "id": "108009",
      "original_text": "Registerbekanntmachung nach dem Umwandlungsgesetz\nBaden-Württemberg Amtsgericht Freiburg HRB 2033\nFrey & Bührer Hörsysteme GmbH – Freiburg im Breisgau",
      "type": "Registerbekanntmachung nach dem Umwandlungsgesetz",
      "state": "Baden-Württemberg",
      "amtsgericht": "Amtsgericht Freiburg",
      "registernummer": "HRB 2033",
      "registerart": "HRB",
      "company_name": "Frey & Bührer Hörsysteme GmbH",
      "company_seat": "Freiburg im Breisgau",
      "details": "05.05.2025 (Bekanntmachungsdatum)\n\nBaden-Württemberg Amtsgericht Freiburg HRB 2033\nRegisterbekanntmachung nach dem Umwandlungsgesetz 05.05.2025 (Eintragungsdatum)\n\nFrey & Bührer Hörsysteme GmbH\nGesellschaft mit beschränkter Haftung\nFreiburg im Breisgau\n\nAls nicht eingetragen wird bekanntgemacht:\nDen Gläubigern der an der Verschmelzung beteiligten Rechtsträger ist, wenn sie binnen sechs Monaten nach dem Tag, an dem die Eintragung der Verschmelzung in das Register des Sitzes desjenigen Rechtsträgers, dessen Gläubiger sie sind, nach § 19 Abs. 3 UmwG als bekanntgemacht gilt, ihren Anspruch nach Grund und Höhe schriftlich anmelden, Sicherheit zu leisten, soweit sie nicht Befriedigung verlangen können. Dieses Recht steht den Gläubigern jedoch nur zu, wenn sie glaubhaft machen, dass durch die Verschmelzung die Erfüllung ihrer Forderung gefährdet wird."
    },
    {
      "date": "2025-05-05",
      "id": "108010",
      "original_text": "Registerbekanntmachung nach dem Umwandlungsgesetz\nBaden-Württemberg Amtsgericht Freiburg HRB 711069\nDefcon GmbH – Villingen-Schwenningen",
      "type": "Registerbekanntmachung nach dem Umwandlungsgesetz",
      "state": "Baden-Württemberg",
      "amtsgericht": "Amtsgericht Freiburg",
      "registernummer": "HRB 711069",
      "registerart": "HRB",
      "company_name": "Defcon GmbH",
      "company_seat": "Villingen-Schwenningen",
      "details": "05.05.2025 (Bekanntmachungsdatum)\n\nBaden-Württemberg Amtsgericht Freiburg HRB 711069\nRegisterbekanntmachung nach dem Umwandlungsgesetz 05.05.2025 (Eintragungsdatum)\n\nDefcon GmbH\nGesellschaft mit beschränkter Haftung\nVillingen-Schwenningen\n\nDen Gläubigern der an der Verschmelzung beteiligten Rechtsträger ist, wenn sie binnen sechs Monaten nach dem Tag, an dem die Eintragung der Verschmelzung in das Register des Sitzes desjenigen Rechtsträgers, dessen Gläubiger sie sind, nach § 19 Abs. 3 UmwG als bekanntgemacht gilt, ihren Anspruch nach Grund und Höhe schriftlich anmelden, Sicherheit zu leisten, soweit sie nicht Befriedigung verlangen können. Dieses Recht steht den Gläubigern jedoch nur zu, wenn sie glaubhaft machen, dass durch die Verschmelzung die Erfüllung ihrer Forderung gefährdet wird."
    },
    {
      "date": "2025-05-05",
      "id": "108011",
      "original_text": "Registerbekanntmachung nach dem Umwandlungsgesetz\nBaden-Württemberg Amtsgericht Freiburg HRB 2033\nFrey & Bührer Hörsysteme GmbH – Freiburg im Breisgau",
      "type": "Registerbekanntmachung nach dem Umwandlungsgesetz",
      "state": "Baden-Württemberg",
      "amtsgericht": "Amtsgericht Freiburg",
      "registernummer": "HRB 2033",
      "registerart": "HRB",
      "company_name": "Frey & Bührer Hörsysteme GmbH",
      "company_seat": "Freiburg im Breisgau",
      "details": "05.05.2025 (Bekanntmachungsdatum)\n\nBaden-Württemberg Amtsgericht Freiburg HRB 2033\nRegisterbekanntmachung nach dem Umwandlungsgesetz 05.05.2025 (Eintragungsdatum)\n\nFrey & Bührer Hörsysteme GmbH\nGesellschaft mit beschränkter Haftung\nFreiburg im Breisgau\n\nAls nicht eingetragen wird bekanntgemacht:\nDen Gläubigern der an der Verschmelzung beteiligten Rechtsträger ist, wenn sie binnen sechs Monaten nach dem Tag, an dem die Eintragung der Verschmelzung in das Register des Sitzes desjenigen Rechtsträgers, dessen Gläubiger sie sind, nach § 19 Abs. 3 UmwG als bekanntgemacht gilt, ihren Anspruch nach Grund und Höhe schriftlich anmelden, Sicherheit zu leisten, soweit sie nicht Befriedigung verlangen können. Dieses Recht steht den Gläubigern jedoch nur zu, wenn sie glaubhaft machen, dass durch die Verschmelzung die Erfüllung ihrer Forderung gefährdet wird."
    },
    {
      "date": "2025-05-05",
      "id": "108012",
      "original_text": "Registerbekanntmachung nach dem Umwandlungsgesetz\nBaden-Württemberg Amtsgericht Freiburg HRB 724306\nGanter Export Import GmbH – Freiburg im Breisgau",
      "type": "Registerbekanntmachung nach dem Umwandlungsgesetz",
      "state": "Baden-Württemberg",
      "amtsgericht": "Amtsgericht Freiburg",
      "registernummer": "HRB 724306",
      "registerart": "HRB",
      "company_name": "Ganter Export Import GmbH",
      "company_seat": "Freiburg im Breisgau",
      "details": "05.05.2025 (Bekanntmachungsdatum)\n\nBaden-Württemberg Amtsgericht Freiburg HRB 724306\nRegisterbekanntmachung nach dem Umwandlungsgesetz 05.05.2025 (Eintragungsdatum)\n\nGanter Export Import GmbH\nGesellschaft mit beschränkter Haftung\nFreiburg im Breisgau\n\nAls nicht eingetragen wird bekanntgemacht:\nDen Gläubigern der an der Verschmelzung beteiligten Rechtsträger ist, wenn sie binnen sechs Monaten nach dem Tag, an dem die Eintragung der Verschmelzung in das Register des Sitzes desjenigen Rechtsträgers, dessen Gläubiger sie sind, nach § 19 Abs. 3 UmwG als bekanntgemacht gilt, ihren Anspruch nach Grund und Höhe schriftlich anmelden, Sicherheit zu leisten, soweit sie nicht Befriedigung verlangen können. Dieses Recht steht den Gläubigern jedoch nur zu, wenn sie glaubhaft machen, dass durch die Verschmelzung die Erfüllung ihrer Forderung gefährdet wird."
    },
    {
      "date": "2025-05-05",
      "id": "108013",
      "original_text": "Löschungsankündigung\nBaden-Württemberg Amtsgericht Mannheim HRB 745421\nNO LIMITS Marketing & Consulting UG (haftungsbeschränkt) – Weinheim",
      "type": "Löschungsankündigung",
      "state": "Baden-Württemberg",
      "amtsgericht": "Amtsgericht Mannheim",
      "registernummer": "HRB 745421",
      "registerart": "HRB",
      "company_name": "NO LIMITS Marketing & Consulting UG (haftungsbeschränkt)",
      "company_seat": "Weinheim",
      "details": "05.05.2025 (Bekanntmachungsdatum)\n\nBaden-Württemberg Amtsgericht Mannheim HRB 745421\nLöschungsankündigung\n\nNO LIMITS Marketing & Consulting UG (haftungsbeschränkt)\nGesellschaft mit beschränkter Haftung\nWeinheim\n\nDas Gericht beabsichtigt, die Gesellschaft wegen Vermögenslosigkeit im Handelsregister von Amts wegen nach § 394 FamFG zu löschen. Die Frist zur Geltendmachung eines Widerspruchs gegen die beabsichtigte Löschung ist auf einen Monat ab Veröffentlichung bestimmt."
    },
    {
      "date": "2025-05-05",
      "id": "108014",
      "original_text": "Löschungsankündigung\nBaden-Württemberg Amtsgericht Mannheim HRB 730756\nSL Lampert Sicherheit & Service GmbH – Mannheim",
      "type": "Löschungsankündigung",
      "state": "Baden-Württemberg",
      "amtsgericht": "Amtsgericht Mannheim",
      "registernummer": "HRB 730756",
      "registerart": "HRB",
      "company_name": "SL Lampert Sicherheit & Service GmbH",
      "company_seat": "Mannheim",
      "details": "05.05.2025 (Bekanntmachungsdatum)\n\nBaden-Württemberg Amtsgericht Mannheim HRB 730756\nLöschungsankündigung\n\nSL Lampert Sicherheit & Service GmbH\nGesellschaft mit beschränkter Haftung\nMannheim\n\nDas Gericht beabsichtigt, die Gesellschaft wegen Vermögenslosigkeit im Handelsregister von Amts wegen nach § 394 FamFG zu löschen. Die Frist zur Geltendmachung eines Widerspruchs gegen die beabsichtigte Löschung ist auf einen Monat ab Veröffentlichung bestimmt."
    },
    {
      "date": "2025-05-05",
      "id": "108015",
      "original_text": "Registerbekanntmachung nach dem Umwandlungsgesetz\nBaden-Württemberg Amtsgericht Mannheim HRB 739644\nBohlini invest GmbH – Heidelberg",
      "type": "Registerbekanntmachung nach dem Umwandlungsgesetz",
      "state": "Baden-Württemberg",
      "amtsgericht": "Amtsgericht Mannheim",
      "registernummer": "HRB 739644",
      "registerart": "HRB",
      "company_name": "Bohlini invest GmbH",
      "company_seat": "Heidelberg",
      "details": "05.05.2025 (Bekanntmachungsdatum)\n\nBaden-Württemberg Amtsgericht Mannheim HRB 739644\nRegisterbekanntmachung nach dem Umwandlungsgesetz 05.05.2025 (Eintragungsdatum)\n\nBohlini invest GmbH\nGesellschaft mit beschränkter Haftung\nHeidelberg\n\nDen Gläubigern der an der Verschmelzung beteiligten Rechtsträger ist, wenn sie binnen sechs Monaten nach dem Tag, an dem die Eintragung der Verschmelzung in das Register des Sitzes desjenigen Rechtsträgers, dessen Gläubiger sie sind, nach § 19 Abs. 3 UmwG als bekanntgemacht gilt, ihren Anspruch nach Grund und Höhe schriftlich anmelden, Sicherheit zu leisten, soweit sie nicht Befriedigung verlangen können. Dieses Recht steht den Gläubigern jedoch nur zu, wenn sie glaubhaft machen, dass durch die Verschmelzung die Erfüllung ihrer Forderung gefährdet wird."
    },
    {
      "date": "2025-05-05",
      "id": "108016",
      "original_text": "Registerbekanntmachung nach dem Umwandlungsgesetz\nBaden-Württemberg Amtsgericht Mannheim HRB 739644\nBohlini invest GmbH – Heidelberg",
      "type": "Registerbekanntmachung nach dem Umwandlungsgesetz",
      "state": "Baden-Württemberg",
      "amtsgericht": "Amtsgericht Mannheim",
      "registernummer": "HRB 739644",
      "registerart": "HRB",
      "company_name": "Bohlini invest GmbH",
      "company_seat": "Heidelberg",
      "details": "05.05.2025 (Bekanntmachungsdatum)\n\nBaden-Württemberg Amtsgericht Mannheim HRB 739644\nRegisterbekanntmachung nach dem Umwandlungsgesetz 05.05.2025 (Eintragungsdatum)\n\nBohlini invest GmbH\nGesellschaft mit beschränkter Haftung\nHeidelberg\n\nDen Gläubigern der an der Verschmelzung beteiligten Rechtsträger ist, wenn sie binnen sechs Monaten nach dem Tag, an dem die Eintragung der Verschmelzung in das Register des Sitzes desjenigen Rechtsträgers, dessen Gläubiger sie sind, nach § 19 Abs. 3 UmwG als bekanntgemacht gilt, ihren Anspruch nach Grund und Höhe schriftlich anmelden, Sicherheit zu leisten, soweit sie nicht Befriedigung verlangen können. Dieses Recht steht den Gläubigern jedoch nur zu, wenn sie glaubhaft machen, dass durch die Verschmelzung die Erfüllung ihrer Forderung gefährdet wird."
    },
    {
      "date": "2025-05-05",
      "id": "108017",
      "original_text": "Registerbekanntmachung nach dem Umwandlungsgesetz\nBaden-Württemberg Amtsgericht Mannheim HRB 337772\nBohlini Verwaltungs- und Beteiligungs-GmbH – Heidelberg",
      "type": "Registerbekanntmachung nach dem Umwandlungsgesetz",
      "state": "Baden-Württemberg",
      "amtsgericht": "Amtsgericht Mannheim",
      "registernummer": "HRB 337772",
      "registerart": "HRB",
      "company_name": "Bohlini Verwaltungs- und Beteiligungs-GmbH",
      "company_seat": "Heidelberg",
      "details": "05.05.2025 (Bekanntmachungsdatum)\n\nBaden-Württemberg Amtsgericht Mannheim HRB 337772\nRegisterbekanntmachung nach dem Umwandlungsgesetz 05.05.2025 (Eintragungsdatum)\n\nBohlini Verwaltungs- und Beteiligungs-GmbH\nGesellschaft mit beschränkter Haftung\nHeidelberg\n\nDen Gläubigern der an der Verschmelzung beteiligten Rechtsträger ist, wenn sie binnen sechs Monaten nach dem Tag, an dem die Eintragung der Verschmelzung in das Register des Sitzes desjenigen Rechtsträgers, dessen Gläubiger sie sind, nach § 19 Abs. 3 UmwG als bekanntgemacht gilt, ihren Anspruch nach Grund und Höhe schriftlich anmelden, Sicherheit zu leisten, soweit sie nicht Befriedigung verlangen können. Dieses Recht steht den Gläubigern jedoch nur zu, wenn sie glaubhaft machen, dass durch die Verschmelzung die Erfüllung ihrer Forderung gefährdet wird."
    },
    {
      "date": "2025-05-05",
      "id": "108018",
      "original_text": "Registerbekanntmachung nach dem Umwandlungsgesetz\nBaden-Württemberg Amtsgericht Freiburg HRB 2033\nFrey & Bührer Hörsysteme GmbH – Freiburg im Breisgau",
      "type": "Registerbekanntmachung nach dem Umwandlungsgesetz",
      "state": "Baden-Württemberg",
      "amtsgericht": "Amtsgericht Freiburg",
      "registernummer": "HRB 2033",
      "registerart": "HRB",
      "company_name": "Frey & Bührer Hörsysteme GmbH",
      "company_seat": "Freiburg im Breisgau",
      "details": "05.05.2025 (Bekanntmachungsdatum)\n\nBaden-Württemberg Amtsgericht Freiburg HRB 2033\nRegisterbekanntmachung nach dem Umwandlungsgesetz 05.05.2025 (Eintragungsdatum)\n\nFrey & Bührer Hörsysteme GmbH\nGesellschaft mit beschränkter Haftung\nFreiburg im Breisgau\n\nAls nicht eingetragen wird bekanntgemacht:\nDen Gläubigern der an der Verschmelzung beteiligten Rechtsträger ist, wenn sie binnen sechs Monaten nach dem Tag, an dem die Eintragung der Verschmelzung in das Register des Sitzes desjenigen Rechtsträgers, dessen Gläubiger sie sind, nach § 19 Abs. 3 UmwG als bekanntgemacht gilt, ihren Anspruch nach Grund und Höhe schriftlich anmelden, Sicherheit zu leisten, soweit sie nicht Befriedigung verlangen können. Dieses Recht steht den Gläubigern jedoch nur zu, wenn sie glaubhaft machen, dass durch die Verschmelzung die Erfüllung ihrer Forderung gefährdet wird."
    },
    {
      "date": "2025-05-05",
      "id": "108019",
      "original_text": "Einreichung neuer Dokumente\nBaden-Württemberg Amtsgericht Ulm HRB 3532\nDonau-Iller-Nahverkehrsverbund-GmbH – Ulm",
      "type": "Einreichung neuer Dokumente",
      "state": "Baden-Württemberg",
      "amtsgericht": "Amtsgericht Ulm",
      "registernummer": "HRB 3532",
      "registerart": "HRB",
      "company_name": "Donau-Iller-Nahverkehrsverbund-GmbH",
      "company_seat": "Ulm",
      "details": "05.05.2025 (Bekanntmachungsdatum)\n\nBaden-Württemberg Amtsgericht Ulm HRB 3532\nEinreichung neuer Dokumente\n\nDonau-Iller-Nahverkehrsverbund-GmbH\nGesellschaft mit beschränkter Haftung\nUlm\n\nDie Gesellschaft hat am 02.05.2025 die Liste über die Zusammensetzung des Aufsichtsrats zum Handelsregister eingereicht."
    },
    {
      "date": "2025-05-05",
      "id": "108020",
      "original_text": "Registerbekanntmachung nach dem Umwandlungsgesetz\nBaden-Württemberg Amtsgericht Freiburg HRB 2936\nBrauerei Ganter Verwaltungs GmbH – Freiburg im Breisgau",
      "type": "Registerbekanntmachung nach dem Umwandlungsgesetz",
      "state": "Baden-Württemberg",
      "amtsgericht": "Amtsgericht Freiburg",
      "registernummer": "HRB 2936",
      "registerart": "HRB",
      "company_name": "Brauerei Ganter Verwaltungs GmbH",
      "company_seat": "Freiburg im Breisgau",
      "details": "05.05.2025 (Bekanntmachungsdatum)\n\nBaden-Württemberg Amtsgericht Freiburg HRB 2936\nRegisterbekanntmachung nach dem Umwandlungsgesetz 05.05.2025 (Eintragungsdatum)\n\nBrauerei Ganter Verwaltungs GmbH\nGesellschaft mit beschränkter Haftung\nFreiburg im Breisgau\n\nAls nicht eingetragen wird bekanntgemacht:\nDen Gläubigern der an der Verschmelzung beteiligten Rechtsträger (der Brauerei Ganter Verwaltungs GmbH mit Sitz in Freiburg im Breisgau, eingetragen im Handelsregister des Amtsgerichts Freiburg i. Br. unter HRB 2936 und der Ganter Export Import GmbH mit Sitz in Freiburg im Breisgau, eingetragen im Handelsregister des Amtsgerichts Freiburg i. Br. unter HRB 724306) ist, wenn sie binnen sechs Monaten nach dem Tag, an dem die Eintragung der Verschmelzung in das Register des Sitzes desjenigen Rechtsträgers, dessen Gläubiger sie sind, nach § 19 Abs. 3 UmwG als bekanntgemacht gilt, ihren Anspruch nach Grund und Höhe schriftlich anmelden, Sicherheit zu leisten, soweit sie nicht Befriedigung verlangen können. Dieses Recht steht den Gläubigern jedoch nur zu, wenn sie glaubhaft machen, dass durch die Verschmelzung die Erfüllung ihrer Forderung gefährdet wird."
    },
    {
      "date": "2025-05-05",
      "id": "108021",
      "original_text": "Registerbekanntmachung nach dem Umwandlungsgesetz\nBaden-Württemberg Amtsgericht Stuttgart HRB 766101\nDürr thermea GmbH – Bietigheim-Bissingen",
      "type": "Registerbekanntmachung nach dem Umwandlungsgesetz",
      "state": "Baden-Württemberg",
      "amtsgericht": "Amtsgericht Stuttgart",
      "registernummer": "HRB 766101",
      "registerart": "HRB",
      "company_name": "Dürr thermea GmbH",
      "company_seat": "Bietigheim-Bissingen",
      "details": "05.05.2025 (Bekanntmachungsdatum)\n\nBaden-Württemberg Amtsgericht Stuttgart HRB 766101\nRegisterbekanntmachung nach dem Umwandlungsgesetz 04.05.2025 (Eintragungsdatum)\n\nDürr thermea GmbH\nGesellschaft mit beschränkter Haftung\nBietigheim-Bissingen\n\nAls nicht eingetragen wird bekanntgemacht:\nDen Gläubigern der an der Verschmelzung beteiligten Rechtsträger ist, wenn sie binnen sechs Monaten nach dem Tag, an dem die Eintragung der Verschmelzung in das Register des Sitzes desjenigen Rechtsträgers, dessen Gläubiger sie sind, nach § 19 Abs. 3 UmwG als bekanntgemacht gilt, ihren Anspruch nach Grund und Höhe schriftlich anmelden, Sicherheit zu leisten, soweit sie nicht Befriedigung verlangen können. Dieses Recht steht den Gläubigern jedoch nur zu, wenn sie glaubhaft machen, dass durch die Verschmelzung die Erfüllung ihrer Forderung gefährdet wird."
    },
    {
      "date": "2025-05-05",
      "id": "108022",
      "original_text": "Registerbekanntmachung nach dem Umwandlungsgesetz\nBaden-Württemberg Amtsgericht Freiburg HRB 727288\nFalk Berberich Holding GmbH – Villingen-Schwenningen",
      "type": "Registerbekanntmachung nach dem Umwandlungsgesetz",
      "state": "Baden-Württemberg",
      "amtsgericht": "Amtsgericht Freiburg",
      "registernummer": "HRB 727288",
      "registerart": "HRB",
      "company_name": "Falk Berberich Holding GmbH",
      "company_seat": "Villingen-Schwenningen",
      "details": "05.05.2025 (Bekanntmachungsdatum)\n\nBaden-Württemberg Amtsgericht Freiburg HRB 727288\nRegisterbekanntmachung nach dem Umwandlungsgesetz 05.05.2025 (Eintragungsdatum)\n\nFalk Berberich Holding GmbH\nGesellschaft mit beschränkter Haftung\nVillingen-Schwenningen\n\nAls nicht eingetragen wird bekanntgemacht:\nDen Gläubigern der an der Verschmelzung beteiligten Rechtsträger ist, wenn sie binnen sechs Monaten nach dem Tag, an dem die Eintragung der Verschmelzung in das Register des Sitzes desjenigen Rechtsträgers, dessen Gläubiger sie sind, nach § 19 Abs. 3 UmwG als bekanntgemacht gilt, ihren Anspruch nach Grund und Höhe schriftlich anmelden, Sicherheit zu leisten, soweit sie nicht Befriedigung verlangen können. Dieses Recht steht den Gläubigern jedoch nur zu, wenn sie glaubhaft machen, dass durch die Verschmelzung die Erfüllung ihrer Forderung gefährdet wird."
    },
    {
      "date": "2025-05-05",
      "id": "108023",
      "original_text": "Registerbekanntmachung nach dem Umwandlungsgesetz\nSachsen-Anhalt Amtsgericht Stendal GnR 1151\nLandgut Elbeland Axien e. G. – Annaburg",
      "type": "Registerbekanntmachung nach dem Umwandlungsgesetz",
      "state": "Sachsen-Anhalt",
      "amtsgericht": "Amtsgericht Stendal",
      "registernummer": "GnR 1151",
      "registerart": "GnR",
      "company_name": "Landgut Elbeland Axien e. G.",
      "company_seat": "Annaburg",
      "details": "05.05.2025 (Bekanntmachungsdatum)\n\nSachsen-Anhalt Amtsgericht Stendal GnR 1151\nRegisterbekanntmachung nach dem Umwandlungsgesetz 05.05.2025 (Eintragungsdatum)\n\nLandgut Elbeland Axien e. G.\neingetragene Genossenschaft\nAnnaburg\n\nNicht eingetragen:\nDen Gläubigern der an der Verschmelzung beteiligten Rechtsträger ist, wenn sie binnen sechs Monaten nach dem Tag, an dem die Eintragung der Verschmelzung nach § 19 Abs. 3 UmwG als bekanntgemacht gilt, ihren Anspruch nach Grund und Höhe schriftlich anmelden, Sicherheit zu leisten, soweit sie nicht Befriedigung verlangen können. Dieses Recht steht ihnen jedoch nur zu, wenn sie glaubhaft machen, dass durch die Verschmelzung die Erfüllung ihrer Forderung gefährdet wird."
    },
    {
      "date": "2025-05-05",
      "id": "108024",
      "original_text": "Registerbekanntmachung nach dem Umwandlungsgesetz\nSachsen-Anhalt Amtsgericht Stendal HRB 15763\nDienstleistungs GmbH Landgut \"Elbeland\" Axien – Axien",
      "type": "Registerbekanntmachung nach dem Umwandlungsgesetz",
      "state": "Sachsen-Anhalt",
      "amtsgericht": "Amtsgericht Stendal",
      "registernummer": "HRB 15763",
      "registerart": "HRB",
      "company_name": "Dienstleistungs GmbH Landgut \"Elbeland\" Axien",
      "company_seat": "Axien",
      "details": "05.05.2025 (Bekanntmachungsdatum)\n\nSachsen-Anhalt Amtsgericht Stendal HRB 15763\nRegisterbekanntmachung nach dem Umwandlungsgesetz 05.05.2025 (Eintragungsdatum)\n\nDienstleistungs GmbH Landgut \"Elbeland\" Axien\nGesellschaft mit beschränkter Haftung\nAxien\n\nDie Gesellschaft ist auf Grund des Verschmelzungsvertrages vom 29.04.2025 sowie der Beschlüsse der Gesellschafterversammlungen vom selben Tag mit der Landgut Elbeland Axien e.G. mit dem Sitz in Annaburg (Amtsgericht Stendal GnR 1151) verschmolzen. Die Verschmelzung ist mit der Eintragung der Verschmelzung in das Handelsregister der übernehmenden Gesellschaft am 05.05.2025 wirksam geworden. Nicht eingetragen: Den Gläubigern der an der Verschmelzung beteiligten Rechtsträger ist, wenn sie binnen sechs Monaten nach dem Tag, an dem die Eintragung der Verschmelzung nach § 19 Abs. 3 UmwG als bekanntgemacht gilt, ihren Anspruch nach Grund und Höhe schriftlich anmelden, Sicherheit zu leisten, soweit sie nicht Befriedigung verlangen können. Dieses Recht steht ihnen jedoch nur zu, wenn sie glaubhaft machen, dass durch die Verschmelzung die Erfüllung ihrer Forderung gefährdet wird."
    },
    {
      "date": "2025-05-05",
      "id": "108025",
      "original_text": "Einreichung neuer Dokumente\nBaden-Württemberg Amtsgericht Ulm HRB 701678\nRobert Bosch Automotive Steering GmbH – Schwäbisch Gmünd",
      "type": "Einreichung neuer Dokumente",
      "state": "Baden-Württemberg",
      "amtsgericht": "Amtsgericht Ulm",
      "registernummer": "HRB 701678",
      "registerart": "HRB",
      "company_name": "Robert Bosch Automotive Steering GmbH",
      "company_seat": "Schwäbisch Gmünd",
      "details": "05.05.2025 (Bekanntmachungsdatum)\n\nBaden-Württemberg Amtsgericht Ulm HRB 701678\nEinreichung neuer Dokumente\n\nRobert Bosch Automotive Steering GmbH\nGesellschaft mit beschränkter Haftung\nSchwäbisch Gmünd\n\nDie Gesellschaft hat am 02.05.2025 die Liste über die Zusammensetzung des Aufsichtsrats zum Handelsregister eingereicht."
    },
    {
      "date": "2025-05-05",
      "id": "108026",
      "original_text": "Registerbekanntmachung nach dem Umwandlungsgesetz\nBerlin Amtsgericht Berlin (Charlottenburg) HRB 155774\nRM 1302 Vermögensverwaltungs GmbH – Berlin",
      "type": "Registerbekanntmachung nach dem Umwandlungsgesetz",
      "state": "Berlin",
      "amtsgericht": "Amtsgericht Berlin (Charlottenburg)",
      "registernummer": "HRB 155774",
      "registerart": "HRB",
      "company_name": "RM 1302 Vermögensverwaltungs GmbH",
      "company_seat": "Berlin",
      "details": "05.05.2025 (Bekanntmachungsdatum)\n\nBerlin Amtsgericht Berlin (Charlottenburg) HRB 155774\nRegisterbekanntmachung nach dem Umwandlungsgesetz 28.04.2025 (Eintragungsdatum)\n\nRM 1302 Vermögensverwaltungs GmbH\nGesellschaft mit beschränkter Haftung\nBerlin\n\nZu Eintragungsnummer 5 vom 28.04.2025 wird als nicht eingetragen veröffentlicht: Den Gläubigern der an der Verschmelzung beteiligten Rechtsträger ist, wenn sie binnen sechs Monaten nach dem Tag, an dem die Eintragung der Verschmelzung in das Register des Sitzes desjenigen Rechtsträgers, dessen Gläubiger sie sind, als bekannt gemacht gilt, ihren Anspruch nach Grund und Höhe schriftlich anmelden, Sicherheit zu leisten, soweit sie nicht Befriedigung verlangen können. Dieses Recht steht den Gläubigern jedoch nur zu, wenn sie glaubhaft machen, dass durch die Verschmelzung die Erfüllung ihrer Forderung gefährdet wird. Das Recht, Sicherheitsleistung zu verlangen, steht Gläubigern nicht zu, die im Falle der Insolvenz ein Recht auf vorzugsweise Befriedigung aus einer Deckungsmasse haben, die nach gesetzlicher Vorschrift zu ihrem Schutz errichtet und staatlich überwacht ist."
    },
    {
      "date": "2025-05-05",
      "id": "108027",
      "original_text": "Registerbekanntmachung nach dem Umwandlungsgesetz\nBerlin Amtsgericht Berlin (Charlottenburg) HRB 111704\nSeydelstraße Beteiligungs GmbH – Berlin",
      "type": "Registerbekanntmachung nach dem Umwandlungsgesetz",
      "state": "Berlin",
      "amtsgericht": "Amtsgericht Berlin (Charlottenburg)",
      "registernummer": "HRB 111704",
      "registerart": "HRB",
      "company_name": "Seydelstraße Beteiligungs GmbH",
      "company_seat": "Berlin",
      "details": "05.05.2025 (Bekanntmachungsdatum)\n\nBerlin Amtsgericht Berlin (Charlottenburg) HRB 111704\nRegisterbekanntmachung nach dem Umwandlungsgesetz 28.04.2025 (Eintragungsdatum)\n\nSeydelstraße Beteiligungs GmbH\nGesellschaft mit beschränkter Haftung\nBerlin\n\nZu Eintragungsnummer 10 vom 28.04.2025 wird als nicht eingetragen veröffentlicht: Den Gläubigern der an der Verschmelzung beteiligten Rechtsträger ist, wenn sie binnen sechs Monaten nach dem Tag, an dem die Eintragung der Verschmelzung in das Register des Sitzes desjenigen Rechtsträgers, dessen Gläubiger sie sind, als bekannt gemacht gilt, ihren Anspruch nach Grund und Höhe schriftlich anmelden, Sicherheit zu leisten, soweit sie nicht Befriedigung verlangen können. Dieses Recht steht den Gläubigern jedoch nur zu, wenn sie glaubhaft machen, dass durch die Verschmelzung die Erfüllung ihrer Forderung gefährdet wird. Das Recht, Sicherheitsleistung zu verlangen, steht Gläubigern nicht zu, die im Falle der Insolvenz ein Recht auf vorzugsweise Befriedigung aus einer Deckungsmasse haben, die nach gesetzlicher Vorschrift zu ihrem Schutz errichtet und staatlich überwacht ist."
    },
    {
      "date": "2025-05-05",
      "id": "108028",
      "original_text": "Registerbekanntmachung nach dem Umwandlungsgesetz\nSchleswig-Holstein Amtsgericht Kiel HRA 12522\nTechnology Management Peter Witte e.K. – Kiel",
      "type": "Registerbekanntmachung nach dem Umwandlungsgesetz",
      "state": "Schleswig-Holstein",
      "amtsgericht": "Amtsgericht Kiel",
      "registernummer": "HRA 12522",
      "registerart": "HRA",
      "company_name": "Technology Management Peter Witte e.K.",
      "company_seat": "Kiel",
      "details": "05.05.2025 (Bekanntmachungsdatum)\n\nSchleswig-Holstein Amtsgericht Kiel HRA 12522\nRegisterbekanntmachung nach dem Umwandlungsgesetz 30.04.2025 (Eintragungsdatum)\n\nTechnology Management Peter Witte e.K.\nEinzelkaufmann / Einzelkauffrau\nKiel\n\nAls nicht eingetragen wird veröffentlicht: Den Gläubigern der an der Spaltung beteiligten Rechtsträger ist, wenn sie binnen sechs Monaten nach dem Tag, an dem die Eintragung der Spaltung in das Register des Sitzes desjenigen Rechtsträgers, dessen Gläubiger sie sind,  bekannt gemacht worden ist, ihren Anspruch nach Grund und Höhe schriftlich anmelden, Sicherheit zu leisten, soweit sie nicht Befriedigung verlangen können. Dieses Recht steht den Gläubigern jedoch nur zu, wenn sie glaubhaft machen, dass durch die Spaltung die Erfüllung ihrer Forderung gefährdet wird."
    },
    {
      "date": "2025-05-05",
      "id": "108029",
      "original_text": "Registerbekanntmachung nach dem Umwandlungsgesetz\nBaden-Württemberg Amtsgericht Mannheim HRA 712323\nPopice - Hohmeister e.K. – Karlsruhe",
      "type": "Registerbekanntmachung nach dem Umwandlungsgesetz",
      "state": "Baden-Württemberg",
      "amtsgericht": "Amtsgericht Mannheim",
      "registernummer": "HRA 712323",
      "registerart": "HRA",
      "company_name": "Popice - Hohmeister e.K.",
      "company_seat": "Karlsruhe",
      "details": "05.05.2025 (Bekanntmachungsdatum)\n\nBaden-Württemberg Amtsgericht Mannheim HRA 712323\nRegisterbekanntmachung nach dem Umwandlungsgesetz 05.05.2025 (Eintragungsdatum)\n\nPopice - Hohmeister e.K.\nEinzelkaufmann / Einzelkauffrau\nKarlsruhe\n\nDen Gläubigern der an der Ausgliederung beteiligten Rechtsträger ist, wenn sie binnen sechs Monaten nach dem Tag, an dem die Eintragung der Ausgliederung in das Register des Sitzes desjenigen Rechtsträgers, dessen Gläubiger sie sind, nach § 19 Abs. 3 UmwG als bekanntgemacht gilt, ihren Anspruch nach Grund und Höhe schriftlich anmelden, Sicherheit zu leisten, soweit sie nicht Befriedigung verlangen können. Dieses Recht steht den Gläubigern jedoch nur zu, wenn sie glaubhaft machen, dass durch die Ausgliederung die Erfüllung ihrer Forderung gefährdet wird."
    },
    {
      "date": "2025-05-05",
      "id": "108030",
      "original_text": "Einreichung neuer Dokumente\nBerlin Amtsgericht Berlin (Charlottenburg) HRB 54603\nVBB Verkehrsverbund Berlin-Brandenburg GmbH – Berlin",
      "type": "Einreichung neuer Dokumente",
      "state": "Berlin",
      "amtsgericht": "Amtsgericht Berlin (Charlottenburg)",
      "registernummer": "HRB 54603",
      "registerart": "HRB",
      "company_name": "VBB Verkehrsverbund Berlin-Brandenburg GmbH",
      "company_seat": "Berlin",
      "details": "05.05.2025 (Bekanntmachungsdatum)\n\nBerlin Amtsgericht Berlin (Charlottenburg) HRB 54603\nEinreichung neuer Dokumente\n\nVBB Verkehrsverbund Berlin-Brandenburg GmbH\nGesellschaft mit beschränkter Haftung\nBerlin\n\nAls nicht eingetragen wird veröffentlicht: Es wurde eine neue Liste der Aufsichtsratsmitglieder eingereicht (§52 GmbHG)."
    },
    {
      "date": "2025-05-05",
      "id": "108031",
      "original_text": "Registerbekanntmachung nach dem Umwandlungsgesetz\nBaden-Württemberg Amtsgericht Mannheim HRA 712290\nPopice Eismanufaktur GmbH & Co. KG – Karlsruhe",
      "type": "Registerbekanntmachung nach dem Umwandlungsgesetz",
      "state": "Baden-Württemberg",
      "amtsgericht": "Amtsgericht Mannheim",
      "registernummer": "HRA 712290",
      "registerart": "HRA",
      "company_name": "Popice Eismanufaktur GmbH & Co. KG",
      "company_seat": "Karlsruhe",
      "details": "05.05.2025 (Bekanntmachungsdatum)\n\nBaden-Württemberg Amtsgericht Mannheim HRA 712290\nRegisterbekanntmachung nach dem Umwandlungsgesetz 05.05.2025 (Eintragungsdatum)\n\nPopice Eismanufaktur GmbH & Co. KG\nKommanditgesellschaft\nKarlsruhe\n\nAls nicht eingetragen wird bekanntgemacht:\nDen Gläubigern der an der Ausgliederung beteiligten Rechtsträger ist, wenn sie binnen sechs Monaten nach dem Tag, an dem die Eintragung der Ausgliederung in das Register des Sitzes desjenigen Rechtsträgers, dessen Gläubiger sie sind, nach § 19 Abs. 3 UmwG als bekanntgemacht gilt, ihren Anspruch nach Grund und Höhe schriftlich anmelden, Sicherheit zu leisten, soweit sie nicht Befriedigung verlangen können. Dieses Recht steht den Gläubigern jedoch nur zu, wenn sie glaubhaft machen, dass durch die Ausgliederung die Erfüllung ihrer Forderung gefährdet wird."
    },
    {
      "date": "2025-05-05",
      "id": "108032",
      "original_text": "Registerbekanntmachung nach dem Umwandlungsgesetz\nBaden-Württemberg Amtsgericht Stuttgart HRB 765772\nScolution Verwaltungsgesellschaft mbH – Schwäbisch Hall",
      "type": "Registerbekanntmachung nach dem Umwandlungsgesetz",
      "state": "Baden-Württemberg",
      "amtsgericht": "Amtsgericht Stuttgart",
      "registernummer": "HRB 765772",
      "registerart": "HRB",
      "company_name": "Scolution Verwaltungsgesellschaft mbH",
      "company_seat": "Schwäbisch Hall",
      "details": "05.05.2025 (Bekanntmachungsdatum)\n\nBaden-Württemberg Amtsgericht Stuttgart HRB 765772\nRegisterbekanntmachung nach dem Umwandlungsgesetz 05.05.2025 (Eintragungsdatum)\n\nScolution Verwaltungsgesellschaft mbH\nGesellschaft mit beschränkter Haftung\nSchwäbisch Hall\n\nAls nicht eingetragen wird bekanntgemacht:\nDen Gläubigern der an der Verschmelzung beteiligten Rechtsträger ist, wenn sie binnen sechs Monaten nach dem Tag, an dem die Eintragung der Verschmelzung in das Register des Sitzes desjenigen Rechtsträgers, dessen Gläubiger sie sind, nach § 19 Abs. 3 UmwG als bekanntgemacht gilt, ihren Anspruch nach Grund und Höhe schriftlich anmelden, Sicherheit zu leisten, soweit sie nicht Befriedigung verlangen können. Dieses Recht steht den Gläubigern jedoch nur zu, wenn sie glaubhaft machen, dass durch die Verschmelzung die Erfüllung ihrer Forderung gefährdet wird."
    },
    {
      "date": "2025-05-05",
      "id": "108033",
      "original_text": "Löschungsankündigung\nBaden-Württemberg Amtsgericht Mannheim HRB 745061\nSchnelltest Seider & Arango GmbH – Durmersheim",
      "type": "Löschungsankündigung",
      "state": "Baden-Württemberg",
      "amtsgericht": "Amtsgericht Mannheim",
      "registernummer": "HRB 745061",
      "registerart": "HRB",
      "company_name": "Schnelltest Seider & Arango GmbH",
      "company_seat": "Durmersheim",
      "details": "05.05.2025 (Bekanntmachungsdatum)\n\nBaden-Württemberg Amtsgericht Mannheim HRB 745061\nLöschungsankündigung\n\nSchnelltest Seider & Arango GmbH\nGesellschaft mit beschränkter Haftung\nDurmersheim\n\nAls nicht eingetragen wird bekanntgemacht:\nDas Gericht beabsichtigt, die die am 23.05.2022 vorgenommene Eintragung der Bestellung von Herrn Hannes Maira Seider als Geschäftsführer der Gesellschaft gemäß § 395 FamFG von Amts wegen im Handelsregister wegen des Mangels einer wesentlichen Voraussetzung zu löschen. Die Frist zur Geltendmachung eines Widerspruchs gegen die beabsichtigte Löschung ist auf einen Monat ab Veröffentlichung bestimmt."
    },
    {
      "date": "2025-05-05",
      "id": "108034",
      "original_text": "Löschungsankündigung\nBaden-Württemberg Amtsgericht Mannheim HRB 743981\nProContoure GmbH – Karlsruhe",
      "type": "Löschungsankündigung",
      "state": "Baden-Württemberg",
      "amtsgericht": "Amtsgericht Mannheim",
      "registernummer": "HRB 743981",
      "registerart": "HRB",
      "company_name": "ProContoure GmbH",
      "company_seat": "Karlsruhe",
      "details": "05.05.2025 (Bekanntmachungsdatum)\n\nBaden-Württemberg Amtsgericht Mannheim HRB 743981\nLöschungsankündigung\n\nProContoure GmbH\nGesellschaft mit beschränkter Haftung\nKarlsruhe\n\nAls nicht eingetragen wird bekanntgemacht:\nDas Gericht beabsichtigt, die die am 23.05.2022 vorgenommene Eintragung der Bestellung von Herrn Hannes Maria Seider als Geschäftsführer der Gesellschaft gemäß § 395 FamFG von Amts wegen im Handelsregister wegen des Mangels einer wesentlichen Voraussetzung zu löschen. Die Frist zur Geltendmachung eines Widerspruchs gegen die beabsichtigte Löschung ist auf einen Monat ab Veröffentlichung bestimmt."
    },
    {
      "date": "2025-05-05",
      "id": "108035",
      "original_text": "Registerbekanntmachung nach dem Umwandlungsgesetz\nNordrhein-Westfalen Amtsgericht Coesfeld HRB 7099\nGeiger GmbH – Senden",
      "type": "Registerbekanntmachung nach dem Umwandlungsgesetz",
      "state": "Nordrhein-Westfalen",
      "amtsgericht": "Amtsgericht Coesfeld",
      "registernummer": "HRB 7099",
      "registerart": "HRB",
      "company_name": "Geiger GmbH",
      "company_seat": "Senden",
      "details": "05.05.2025 (Bekanntmachungsdatum)\n\nNordrhein-Westfalen Amtsgericht Coesfeld HRB 7099\nRegisterbekanntmachung nach dem Umwandlungsgesetz 05.05.2025 (Eintragungsdatum)\n\nGeiger GmbH\nGesellschaft mit beschränkter Haftung\nSenden\n\nDen Gläubigern der an der Verschmelzung beteiligten Rechtsträger ist, wenn sie binnen sechs Monaten nach dem Tag, an dem die Eintragung der Verschmelzung in das Register des Sitzes derjenigen Rechtsträger deren Gläubiger sie sind, nach § 19 Absatz 3 UmwG als bekanntgemacht gilt, ihren Anspruch nach Grund und Höhe schriftlich anmelden, Sicherheit zu leisten, soweit sie nicht Befriedigung verlangen können. Dieses Recht steht den Gläubigern jedoch nur zu, wenn sie glaubhaft machen, dass durch die Verschmelzung die Erfüllung ihrer Forderung gefährdet wird."
    },
    {
      "date": "2025-05-05",
      "id": "108036",
      "original_text": "Löschungsankündigung\nBaden-Württemberg Amtsgericht Stuttgart HRB 760121\nGATOR ARMOR GmbH – Ludwigsburg",
      "type": "Löschungsankündigung",
      "state": "Baden-Württemberg",
      "amtsgericht": "Amtsgericht Stuttgart",
      "registernummer": "HRB 760121",
      "registerart": "HRB",
      "company_name": "GATOR ARMOR GmbH",
      "company_seat": "Ludwigsburg",
      "details": "05.05.2025 (Bekanntmachungsdatum)\n\nBaden-Württemberg Amtsgericht Stuttgart HRB 760121\nLöschungsankündigung\n\nGATOR ARMOR GmbH\nGesellschaft mit beschränkter Haftung\nLudwigsburg\n\nAls nicht eingetragen wird bekanntgemacht:\nDas Gericht beabsichtigt, die Gesellschaft wegen Vermögenslosigkeit im Handelsregister von Amts wegen nach § 394 FamFG zu löschen. Die Frist zur Geltendmachung eines Widerspruchs gegen die beabsichtigte Löschung ist auf zwei Monate ab Veröffentlichung bestimmt."
    },
    {
      "date": "2025-05-05",
      "id": "108037",
      "original_text": "Registerbekanntmachung nach dem Umwandlungsgesetz\nSchleswig-Holstein Amtsgericht Lübeck HRA 8997\nGG Asset GmbH & Co. KG – Groß Grönau",
      "type": "Registerbekanntmachung nach dem Umwandlungsgesetz",
      "state": "Schleswig-Holstein",
      "amtsgericht": "Amtsgericht Lübeck",
      "registernummer": "HRA 8997",
      "registerart": "HRA",
      "company_name": "GG Asset GmbH & Co. KG",
      "company_seat": "Groß Grönau",
      "details": "05.05.2025 (Bekanntmachungsdatum)\n\nSchleswig-Holstein Amtsgericht Lübeck HRA 8997\nRegisterbekanntmachung nach dem Umwandlungsgesetz 02.05.2025 (Eintragungsdatum)\n\nGG Asset GmbH & Co. KG\nKommanditgesellschaft\nGroß Grönau\n\nZu Eintragungsnummer 4 vom 02.05.2025 wird als nicht eingetragen veröffentlicht: Den Gläubigern ist, wenn sie binnen sechs Monaten nach dem Tag, an dem die Eintragung der Umwandlung als bekannt gemacht gilt, ihren Anspruch nach Grund und Höhe schriftlich anmelden, Sicherheit zu leisten, soweit sie nicht Befriedigung verlangen können. Dieses Recht steht den Gläubigern jedoch nur zu, wenn sie glaubhaft machen, dass durch die Umwandlung die Erfüllung ihrer Forderung gefährdet wird."
    },
    {
      "date": "2025-05-05",
      "id": "108038",
      "original_text": "Löschungsankündigung\nBaden-Württemberg Amtsgericht Stuttgart HRA 733272\nIG-LU Gastro GmbH & Co. KG – Öhringen",
      "type": "Löschungsankündigung",
      "state": "Baden-Württemberg",
      "amtsgericht": "Amtsgericht Stuttgart",
      "registernummer": "HRA 733272",
      "registerart": "HRA",
      "company_name": "IG-LU Gastro GmbH & Co. KG",
      "company_seat": "Öhringen",
      "details": "05.05.2025 (Bekanntmachungsdatum)\n\nBaden-Württemberg Amtsgericht Stuttgart HRA 733272\nLöschungsankündigung\n\nIG-LU Gastro GmbH & Co. KG\nKommanditgesellschaft\nÖhringen\n\nDas Gericht beabsichtigt, die Gesellschaft im Handelsregister von Amts wegen nach § 31 Abs. 2 HGB zu löschen. Die Frist zur Geltendmachung eines Widerspruchs gegen die beabsichtigte Löschung ist auf zwei Monate ab Veröffentlichung bestimmt."
    },
    {
      "date": "2025-05-05",
      "id": "108039",
      "original_text": "Registerbekanntmachung nach dem Umwandlungsgesetz\nSchleswig-Holstein Amtsgericht Pinneberg HRB 2191 EL\ndocunord GmbH – Uetersen",
      "type": "Registerbekanntmachung nach dem Umwandlungsgesetz",
      "state": "Schleswig-Holstein",
      "amtsgericht": "Amtsgericht Pinneberg",
      "registernummer": "HRB 2191 EL",
      "registerart": "HRB",
      "company_name": "docunord GmbH",
      "company_seat": "Uetersen",
      "details": "05.05.2025 (Bekanntmachungsdatum)\n\nSchleswig-Holstein Amtsgericht Pinneberg HRB 2191 EL\nRegisterbekanntmachung nach dem Umwandlungsgesetz 29.04.2025 (Eintragungsdatum)\n\ndocunord GmbH\nGesellschaft mit beschränkter Haftung\nUetersen\n\nZu Eintragungsnummer 7 vom 29.04.2025 wird als nicht eingetragen veröffentlicht: Den Gläubigern der an der Verschmelzung beteiligten Rechtsträger ist, wenn sie binnen sechs Monaten nach dem Tag, an dem die Eintragung der Verschmelzung in das Register des Sitzes desjenigen Rechtsträgers, dessen Gläubiger sie sind, als bekannt gemacht gilt, ihren Anspruch nach Grund und Höhe schriftlich anmelden, Sicherheit zu leisten, soweit sie nicht Befriedigung verlangen können. Dieses Recht steht den Gläubigern jedoch nur zu, wenn sie glaubhaft machen, dass durch die Verschmelzung die Erfüllung ihrer Forderung gefährdet wird. Das Recht, Sicherheitsleistung zu verlangen, steht Gläubigern nicht zu, die im Falle der Insolvenz ein Recht auf vorzugsweise Befriedigung aus einer Deckungsmasse haben, die nach gesetzlicher Vorschrift zu ihrem Schutz errichtet und staatlich überwacht ist."
    },
    {
      "date": "2025-05-05",
      "id": "108040",
      "original_text": "Löschungsankündigung\nBerlin Amtsgericht Berlin (Charlottenburg) HRB 160684\nSende Spass Unternehmergesellschaft (haftungsbeschränkt) – Berlin",
      "type": "Löschungsankündigung",
      "state": "Berlin",
      "amtsgericht": "Amtsgericht Berlin (Charlottenburg)",
      "registernummer": "HRB 160684",
      "registerart": "HRB",
      "company_name": "Sende Spass Unternehmergesellschaft (haftungsbeschränkt)",
      "company_seat": "Berlin",
      "details": "05.05.2025 (Bekanntmachungsdatum)\n\nBerlin Amtsgericht Berlin (Charlottenburg) HRB 160684\nLöschungsankündigung\n\nSende Spass Unternehmergesellschaft (haftungsbeschränkt)\nGesellschaft mit beschränkter Haftung\nBerlin\n\nBei der nachstehenden Gesellschaft wird das Amtslöschungsverfahren gemäß § 394 FamFG eingeleitet. Widerspruchsfrist 6 Wochen"
    },
    {
      "date": "2025-05-05",
      "id": "108041",
      "original_text": "Registerbekanntmachung nach dem Umwandlungsgesetz\nBrandenburg Amtsgericht Frankfurt/Oder HRB 16027\nJESCH GmbH – Wandlitz",
      "type": "Registerbekanntmachung nach dem Umwandlungsgesetz",
      "state": "Brandenburg",
      "amtsgericht": "Amtsgericht Frankfurt/Oder",
      "registernummer": "HRB 16027",
      "registerart": "HRB",
      "company_name": "JESCH GmbH",
      "company_seat": "Wandlitz",
      "details": "05.05.2025 (Bekanntmachungsdatum)\n\nBrandenburg Amtsgericht Frankfurt/Oder HRB 16027\nRegisterbekanntmachung nach dem Umwandlungsgesetz 30.04.2025 (Eintragungsdatum)\n\nJESCH GmbH\nGesellschaft mit beschränkter Haftung\nWandlitz\n\nZu Eintragungsnummer 4 vom 30.04.2025 wird als nicht eingetragen veröffentlicht:\nDen Gläubigern der an der Verschmelzung beteiligten Rechtsträger ist, wenn sie binnen sechs Monaten nach dem Tag, an dem die Eintragung der Verschmelzung in das Register des Sitzes desjenigen Rechtsträgers, dessen Gläubiger sie sind, als bekannt gemacht gilt, ihren Anspruch nach Grund und Höhe schriftlich anmelden, Sicherheit zu leisten, soweit sie nicht Befriedigung verlangen können. Dieses Recht steht den Gläubigern jedoch nur zu, wenn sie glaubhaft machen, dass durch die Verschmelzung die Erfüllung ihrer Forderung gefährdet wird."
    },
    {
      "date": "2025-05-05",
      "id": "108042",
      "original_text": "Sonstige Registerbekanntmachung\nMecklenburg-Vorpommern Amtsgericht Rostock HRB 13072\nDeutsche Konsum REIT-AG – Broderstorf",
      "type": "Sonstige Registerbekanntmachung",
      "state": "Mecklenburg-Vorpommern",
      "amtsgericht": "Amtsgericht Rostock",
      "registernummer": "HRB 13072",
      "registerart": "HRB",
      "company_name": "Deutsche Konsum REIT-AG",
      "company_seat": "Broderstorf",
      "details": "05.05.2025 (Bekanntmachungsdatum)\n\nMecklenburg-Vorpommern Amtsgericht Rostock HRB 13072\nSonstige Registerbekanntmachung 05.05.2025 (Eintragungsdatum)\n\nDeutsche Konsum REIT-AG\nAktiengesellschaft\nBroderstorf\n\nEine Liste der Mitglieder des Aufsichtsrats ist zum Handelsregister eingereicht worden."
    },
    {
      "date": "2025-05-05",
      "id": "108043",
      "original_text": "Registerbekanntmachung nach dem Umwandlungsgesetz\nMecklenburg-Vorpommern Amtsgericht Rostock HRA 4539\nUGE Wilsen Vier GmbH & Co. KG Umweltgerechte Energie – Lohmen",
      "type": "Registerbekanntmachung nach dem Umwandlungsgesetz",
      "state": "Mecklenburg-Vorpommern",
      "amtsgericht": "Amtsgericht Rostock",
      "registernummer": "HRA 4539",
      "registerart": "HRA",
      "company_name": "UGE Wilsen Vier GmbH & Co. KG Umweltgerechte Energie",
      "company_seat": "Lohmen",
      "details": "05.05.2025 (Bekanntmachungsdatum)\n\nMecklenburg-Vorpommern Amtsgericht Rostock HRA 4539\nRegisterbekanntmachung nach dem Umwandlungsgesetz 05.05.2025 (Eintragungsdatum)\n\nUGE Wilsen Vier GmbH & Co. KG Umweltgerechte Energie\nKommanditgesellschaft\nLohmen\n\nAls nicht eingetragen wird veröffentlicht: Den Gläubigern der an der Verschmelzung beteiligten Rechtsträger ist, wenn sie binnen sechs Monaten nach dem Tag, an dem die Eintragung der Verschmelzung in das Register des Sitzes desjenigen Rechtsträgers, dessen Gläubiger sie sind, nach § 19 Abs. 3 UmwG als bekannt gemacht gilt,\nihren Anspruch nach Grund und Höhe in Textform anmelden, Sicherheit zu leisten, soweit sie nicht Befriedigung verlangen können. Dieses Recht steht den Gläubigern jedoch nur zu, wenn sie glaubhaft machen, dass durch die Verschmelzung die Erfüllung der Forderung gefährdet wird."
    },
    {
      "date": "2025-05-05",
      "id": "108044",
      "original_text": "Registerbekanntmachung nach dem Umwandlungsgesetz\nMecklenburg-Vorpommern Amtsgericht Rostock HRA 4540\nUGE Wilsen Drei GmbH & Co. KG Umweltgerechte Energie – Lohmen",
      "type": "Registerbekanntmachung nach dem Umwandlungsgesetz",
      "state": "Mecklenburg-Vorpommern",
      "amtsgericht": "Amtsgericht Rostock",
      "registernummer": "HRA 4540",
      "registerart": "HRA",
      "company_name": "UGE Wilsen Drei GmbH & Co. KG Umweltgerechte Energie",
      "company_seat": "Lohmen",
      "details": "05.05.2025 (Bekanntmachungsdatum)\n\nMecklenburg-Vorpommern Amtsgericht Rostock HRA 4540\nRegisterbekanntmachung nach dem Umwandlungsgesetz 05.05.2025 (Eintragungsdatum)\n\nUGE Wilsen Drei GmbH & Co. KG Umweltgerechte Energie\nKommanditgesellschaft\nLohmen\n\nAls nicht eingetragen wird veröffentlicht: Den Gläubigern der an der Verschmelzung beteiligten Rechtsträger ist, wenn sie binnen sechs Monaten nach dem Tag, an dem die Eintragung der Verschmelzung in das Register des Sitzes desjenigen Rechtsträgers, dessen Gläubiger sie sind, nach § 19 Abs. 3 UmwG als bekannt gemacht gilt,\nihren Anspruch nach Grund und Höhe in Textform anmelden, Sicherheit zu leisten, soweit sie nicht Befriedigung verlangen können. Dieses Recht steht den Gläubigern jedoch nur zu, wenn sie glaubhaft machen, dass durch die Verschmelzung die Erfüllung der Forderung gefährdet wird."
    },
    {
      "date": "2025-05-05",
      "id": "108045",
      "original_text": "Registerbekanntmachung nach dem Umwandlungsgesetz\nMecklenburg-Vorpommern Amtsgericht Rostock HRA 4537\nUGE Wilsen Zwei GmbH & Co. KG Umweltgerechte Energie – Lohmen",
      "type": "Registerbekanntmachung nach dem Umwandlungsgesetz",
      "state": "Mecklenburg-Vorpommern",
      "amtsgericht": "Amtsgericht Rostock",
      "registernummer": "HRA 4537",
      "registerart": "HRA",
      "company_name": "UGE Wilsen Zwei GmbH & Co. KG Umweltgerechte Energie",
      "company_seat": "Lohmen",
      "details": "05.05.2025 (Bekanntmachungsdatum)\n\nMecklenburg-Vorpommern Amtsgericht Rostock HRA 4537\nRegisterbekanntmachung nach dem Umwandlungsgesetz 05.05.2025 (Eintragungsdatum)\n\nUGE Wilsen Zwei GmbH & Co. KG Umweltgerechte Energie\nKommanditgesellschaft\nLohmen\n\nAls nicht eingetragen wird veröffentlicht: Den Gläubigern der an der Verschmelzung beteiligten Rechtsträger ist, wenn sie binnen sechs Monaten nach dem Tag, an dem die Eintragung der Verschmelzung in das Register des Sitzes desjenigen Rechtsträgers, dessen Gläubiger sie sind, nach § 19 Abs. 3 UmwG als bekannt gemacht gilt,\nihren Anspruch nach Grund und Höhe in Textform anmelden, Sicherheit zu leisten, soweit sie nicht Befriedigung verlangen können. Dieses Recht steht den Gläubigern jedoch nur zu, wenn sie glaubhaft machen, dass durch die Verschmelzung die Erfüllung der Forderung gefährdet wird."
    },
    {
      "date": "2025-05-05",
      "id": "108046",
      "original_text": "Registerbekanntmachung nach dem Umwandlungsgesetz\nMecklenburg-Vorpommern Amtsgericht Rostock HRA 4536\nUGE Wilsen Eins GmbH & Co. KG Umweltgerechte Energie – Lohmen",
      "type": "Registerbekanntmachung nach dem Umwandlungsgesetz",
      "state": "Mecklenburg-Vorpommern",
      "amtsgericht": "Amtsgericht Rostock",
      "registernummer": "HRA 4536",
      "registerart": "HRA",
      "company_name": "UGE Wilsen Eins GmbH & Co. KG Umweltgerechte Energie",
      "company_seat": "Lohmen",
      "details": "05.05.2025 (Bekanntmachungsdatum)\n\nMecklenburg-Vorpommern Amtsgericht Rostock HRA 4536\nRegisterbekanntmachung nach dem Umwandlungsgesetz 05.05.2025 (Eintragungsdatum)\n\nUGE Wilsen Eins GmbH & Co. KG Umweltgerechte Energie\nKommanditgesellschaft\nLohmen\n\nAls nicht eingetragen wird veröffentlicht: Den Gläubigern der an der Verschmelzung beteiligten Rechtsträger ist, wenn sie binnen sechs Monaten nach dem Tag, an dem die Eintragung der Verschmelzung in das Register des Sitzes desjenigen Rechtsträgers, dessen Gläubiger sie sind, nach § 19 Abs. 3 UmwG als bekannt gemacht gilt,\nihren Anspruch nach Grund und Höhe in Textform anmelden, Sicherheit zu leisten, soweit sie nicht Befriedigung verlangen können. Dieses Recht steht den Gläubigern jedoch nur zu, wenn sie glaubhaft machen, dass durch die Verschmelzung die Erfüllung der Forderung gefährdet wird."
    },
    {
      "date": "2025-05-05",
      "id": "108047",
      "original_text": "Registerbekanntmachung nach dem Umwandlungsgesetz\nBaden-Württemberg Amtsgericht Stuttgart HRB 390272\nLetzgus Fensterbau GmbH – Rottenburg am Neckar",
      "type": "Registerbekanntmachung nach dem Umwandlungsgesetz",
      "state": "Baden-Württemberg",
      "amtsgericht": "Amtsgericht Stuttgart",
      "registernummer": "HRB 390272",
      "registerart": "HRB",
      "company_name": "Letzgus Fensterbau GmbH",
      "company_seat": "Rottenburg am Neckar",
      "details": "05.05.2025 (Bekanntmachungsdatum)\n\nBaden-Württemberg Amtsgericht Stuttgart HRB 390272\nRegisterbekanntmachung nach dem Umwandlungsgesetz 05.05.2025 (Eintragungsdatum)\n\nLetzgus Fensterbau GmbH\nGesellschaft mit beschränkter Haftung\nRottenburg am Neckar\n\nAls nicht eingetragen wird bekanntgemacht:\nDen Gläubigern der an der Verschmelzung beteiligten Rechtsträger ist, wenn sie binnen sechs Monaten nach dem Tag, an dem die Eintragung der Verschmelzung in das Register des Sitzes desjenigen Rechtsträgers, dessen Gläubiger sie sind, nach § 19 Abs. 3 UmwG als bekanntgemacht gilt, ihren Anspruch nach Grund und Höhe schriftlich anmelden, Sicherheit zu leisten, soweit sie nicht Befriedigung verlangen können. Dieses Recht steht den Gläubigern jedoch nur zu, wenn sie glaubhaft machen, dass durch die Verschmelzung die Erfüllung ihrer Forderung gefährdet wird."
    },
    {
      "date": "2025-05-05",
      "id": "108048",
      "original_text": "Registerbekanntmachung nach dem Umwandlungsgesetz\nSchleswig-Holstein Amtsgericht Flensburg HRA 11455\nHausbetreuung Pozar GmbH & Co. KG – Sylt",
      "type": "Registerbekanntmachung nach dem Umwandlungsgesetz",
      "state": "Schleswig-Holstein",
      "amtsgericht": "Amtsgericht Flensburg",
      "registernummer": "HRA 11455",
      "registerart": "HRA",
      "company_name": "Hausbetreuung Pozar GmbH & Co. KG",
      "company_seat": "Sylt",
      "details": "05.05.2025 (Bekanntmachungsdatum)\n\nSchleswig-Holstein Amtsgericht Flensburg HRA 11455\nRegisterbekanntmachung nach dem Umwandlungsgesetz 30.04.2025 (Eintragungsdatum)\n\nHausbetreuung Pozar GmbH & Co. KG\nKommanditgesellschaft\nSylt\n\nZu Eintragungsnummer 2 vom 30.04.2025 wird als nicht eingetragen veröffentlicht:\nDen Gläubigern der an der Spaltung beteiligten Rechtsträger ist, wenn sie binnen sechs Monaten nach dem Tag, an dem die Eintragung der Spaltung in das Register des Sitzes desjenigen Rechtsträgers, dessen Gläubiger sie sind, als bekannt gemacht gilt, ihren Anspruch nach Grund und Höhe in Textform anmelden, Sicherheit zu leisten, soweit sie nicht Befriedigung verlangen können. Dieses Recht steht den Gläubigern jedoch nur zu, wenn sie glaubhaft machen, dass durch die Spaltung die Erfüllung ihrer Forderung gefährdet wird."
    },
    {
      "date": "2025-05-05",
      "id": "108049",
      "original_text": "Löschungsankündigung\nSachsen Amtsgericht Dresden HRB 37604\nAdmira Grundbesitz- und Beteiligungsgesellschaft UG (haftungsbeschränkt) – Olbersdorf",
      "type": "Löschungsankündigung",
      "state": "Sachsen",
      "amtsgericht": "Amtsgericht Dresden",
      "registernummer": "HRB 37604",
      "registerart": "HRB",
      "company_name": "Admira Grundbesitz- und Beteiligungsgesellschaft UG (haftungsbeschränkt)",
      "company_seat": "Olbersdorf",
      "details": "05.05.2025 (Bekanntmachungsdatum)\n\nSachsen Amtsgericht Dresden HRB 37604\nLöschungsankündigung\n\nAdmira Grundbesitz- und Beteiligungsgesellschaft UG (haftungsbeschränkt)\nGesellschaft mit beschränkter Haftung\nOlbersdorf\n\nDas Registergericht beabsichtigt, die im Handelsregister eingetragene Gesellschaft von Amts wegen nach § 394 FamFG zu löschen. Die Frist zu Erhebung eines Widerspruchs gegen die beabsichtigte Löschung wird auf einen Monat festgesetzt."
    },
    {
      "date": "2025-05-05",
      "id": "108050",
      "original_text": "Löschungsankündigung\nSachsen Amtsgericht Dresden HRB 43947\nDomizil Adelsberger Höhe UG (haftungsbeschränkt) – Dresden",
      "type": "Löschungsankündigung",
      "state": "Sachsen",
      "amtsgericht": "Amtsgericht Dresden",
      "registernummer": "HRB 43947",
      "registerart": "HRB",
      "company_name": "Domizil Adelsberger Höhe UG (haftungsbeschränkt)",
      "company_seat": "Dresden",
      "details": "05.05.2025 (Bekanntmachungsdatum)\n\nSachsen Amtsgericht Dresden HRB 43947\nLöschungsankündigung\n\nDomizil Adelsberger Höhe UG (haftungsbeschränkt)\nGesellschaft mit beschränkter Haftung\nDresden\n\nDas Registergericht beabsichtigt, die im Handelsregister eingetragene Gesellschaft von Amts wegen nach § 394 FamFG zu löschen. Die Frist zu Erhebung eines Widerspruchs gegen die beabsichtigte Löschung wird auf einen Monat festgesetzt."
    },
    {
      "date": "2025-05-05",
      "id": "108051",
      "original_text": "Einreichung neuer Dokumente\nSachsen Amtsgericht Chemnitz HRB 34370\nMUGLER SE – Oberlungwitz",
      "type": "Einreichung neuer Dokumente",
      "state": "Sachsen",
      "amtsgericht": "Amtsgericht Chemnitz",
      "registernummer": "HRB 34370",
      "registerart": "HRB",
      "company_name": "MUGLER SE",
      "company_seat": "Oberlungwitz",
      "details": "05.05.2025 (Bekanntmachungsdatum)\n\nSachsen Amtsgericht Chemnitz HRB 34370\nEinreichung neuer Dokumente 05.05.2025 (Eintragungsdatum)\n\nMUGLER SE\nEuropäische Aktiengesellschaft (SE)\nOberlungwitz\n\nAm 30.04.2025 wurde beim Handelsregister des Amtsgerichts Chemnitz die Liste der Mitglieder des Aufsichtsrats eingereicht."
    },
    {
      "date": "2025-05-05",
      "id": "108052",
      "original_text": "Löschungsankündigung\nSachsen Amtsgericht Chemnitz HRB 29974\nSicherheitsdienst Schneider UG (haftungsbeschränkt) – Chemnitz",
      "type": "Löschungsankündigung",
      "state": "Sachsen",
      "amtsgericht": "Amtsgericht Chemnitz",
      "registernummer": "HRB 29974",
      "registerart": "HRB",
      "company_name": "Sicherheitsdienst Schneider UG (haftungsbeschränkt)",
      "company_seat": "Chemnitz",
      "details": "05.05.2025 (Bekanntmachungsdatum)\n\nSachsen Amtsgericht Chemnitz HRB 29974\nLöschungsankündigung 29.04.2025 (Eintragungsdatum)\n\nSicherheitsdienst Schneider UG (haftungsbeschränkt)\nGesellschaft mit beschränkter Haftung\nChemnitz\n\nDas Registergericht beabsichtigt, die im Handelsregister eingetragene Gesellschaft von Amts wegen nach § 394 FamFG zu löschen. Die Frist zu Erhebung eines Widerspruchs gegen die beabsichtigte Löschung wird auf einen Monat festgesetzt."
    },
    {
      "date": "2025-05-05",
      "id": "108053",
      "original_text": "Löschungsankündigung\nSachsen Amtsgericht Dresden HRB 38149\nKoenitz Capital UG (haftungsbeschränkt) – Dresden",
      "type": "Löschungsankündigung",
      "state": "Sachsen",
      "amtsgericht": "Amtsgericht Dresden",
      "registernummer": "HRB 38149",
      "registerart": "HRB",
      "company_name": "Koenitz Capital UG (haftungsbeschränkt)",
      "company_seat": "Dresden",
      "details": "05.05.2025 (Bekanntmachungsdatum)\n\nSachsen Amtsgericht Dresden HRB 38149\nLöschungsankündigung\n\nKoenitz Capital UG (haftungsbeschränkt)\nGesellschaft mit beschränkter Haftung\nDresden\n\nDas Registergericht beabsichtigt, die im Handelsregister eingetragene Gesellschaft von Amts wegen nach § 394 FamFG zu löschen. Die Frist zu Erhebung eines Widerspruchs gegen die beabsichtigte Löschung wird auf einen Monat festgesetzt."
    },
    {
      "date": "2025-05-05",
      "id": "108054",
      "original_text": "Sonstige Registerbekanntmachung\nNiedersachsen Amtsgericht Oldenburg (Oldenburg) HRB 222106\nGrimme Holding AG – Damme",
      "type": "Sonstige Registerbekanntmachung",
      "state": "Niedersachsen",
      "amtsgericht": "Amtsgericht Oldenburg (Oldenburg)",
      "registernummer": "HRB 222106",
      "registerart": "HRB",
      "company_name": "Grimme Holding AG",
      "company_seat": "Damme",
      "details": "05.05.2025 (Bekanntmachungsdatum)\n\nNiedersachsen Amtsgericht Oldenburg (Oldenburg) HRB 222106\nSonstige Registerbekanntmachung\n\nGrimme Holding AG\nAktiengesellschaft\nDamme\n\nEs wird darauf hingewiesen, dass der Entwurf eines Umwandlungsplans über einen Formwechsel in die Grimme Holding SE mitsamt Satzung der Rechtsträgerin neuer Rechtsform beim Registergericht Oldenburg (Oldenburg) eingereicht worden ist.\nDanach ist beabsichtigt, die Grimme Holding AG mit Sitz in Damme formwechselnd nach den Vorschriften der SE-VO (EG) Nr. 2157/2001 umzuwandeln in eine Societas Europaea (SE). Die an der formwechselnden Umwandlung beteiligte Grimme Holding AG ist eingetragen im Handelsregister des Amtsgerichts Oldenburg (Oldenburg) HRB 222106. Die Europäische Gesellschaft (Societas Europaea (SE)) wird nach Wirksamwerden der formwechselnden Umwandlung unter der Firma Grimme Holding SE im Rechtsverkehr auftreten und ihren Sitz weiterhin in Löningen haben."
    },
    {
      "date": "2025-05-05",
      "id": "108055",
      "original_text": "Löschungsankündigung\nNiedersachsen Amtsgericht Braunschweig HRB 209237\nWM FACH-HANDLUNG GmbH – Salzgitter",
      "type": "Löschungsankündigung",
      "state": "Niedersachsen",
      "amtsgericht": "Amtsgericht Braunschweig",
      "registernummer": "HRB 209237",
      "registerart": "HRB",
      "company_name": "WM FACH-HANDLUNG GmbH",
      "company_seat": "Salzgitter",
      "details": "05.05.2025 (Bekanntmachungsdatum)\n\nNiedersachsen Amtsgericht Braunschweig HRB 209237\nLöschungsankündigung\n\nWM FACH-HANDLUNG GmbH\nGesellschaft mit beschränkter Haftung\nSalzgitter\n\nDas Registergericht beabsichtigt, die Gesellschaft von Amts wegen nach § 394 FamFG zu löschen. Die Frist zur Erhebung eines Widerspruchs ist auf 1 Monat ab dieser Registerbekanntmachung festgesetzt."
    },
    {
      "date": "2025-05-05",
      "id": "108056",
      "original_text": "Löschungsankündigung\nNiedersachsen Amtsgericht Aurich HRB 205872\nSascha Fricke Hoch-, Tief- und Straßenbau GmbH – Stedesdorf",
      "type": "Löschungsankündigung",
      "state": "Niedersachsen",
      "amtsgericht": "Amtsgericht Aurich",
      "registernummer": "HRB 205872",
      "registerart": "HRB",
      "company_name": "Sascha Fricke Hoch-, Tief- und Straßenbau GmbH",
      "company_seat": "Stedesdorf",
      "details": "05.05.2025 (Bekanntmachungsdatum)\n\nNiedersachsen Amtsgericht Aurich HRB 205872\nLöschungsankündigung\n\nSascha Fricke Hoch-, Tief- und Straßenbau GmbH\nGesellschaft mit beschränkter Haftung\nStedesdorf\n\nDas Registergericht beabsichtigt, die Gesellschaft von Amts wegen nach § 394 FamFG zu löschen. Die Frist zur Erhebung eines Widerspruchs ist auf 1 Monat ab dieser Registerbekanntmachung festgesetzt."
    },
    {
      "date": "2025-05-05",
      "id": "108057",
      "original_text": "Einreichung neuer Dokumente\nNiedersachsen Amtsgericht Hannover HRB 213652\nadesso business consulting AG – Hameln",
      "type": "Einreichung neuer Dokumente",
      "state": "Niedersachsen",
      "amtsgericht": "Amtsgericht Hannover",
      "registernummer": "HRB 213652",
      "registerart": "HRB",
      "company_name": "adesso business consulting AG",
      "company_seat": "Hameln",
      "details": "05.05.2025 (Bekanntmachungsdatum)\n\nNiedersachsen Amtsgericht Hannover HRB 213652\nEinreichung neuer Dokumente\n\nadesso business consulting AG\nAktiengesellschaft\nHameln\n\nDie Liste der Mitglieder des Aufsichtsrats wurde beim Registergericht eingereicht."
    },
    {
      "date": "2025-05-05",
      "id": "108058",
      "original_text": "Einreichung neuer Dokumente\nNiedersachsen Amtsgericht Hannover HRB 54594\nAGILA Haustierversicherung Aktiengesellschaft – Hannover",
      "type": "Einreichung neuer Dokumente",
      "state": "Niedersachsen",
      "amtsgericht": "Amtsgericht Hannover",
      "registernummer": "HRB 54594",
      "registerart": "HRB",
      "company_name": "AGILA Haustierversicherung Aktiengesellschaft",
      "company_seat": "Hannover",
      "details": "05.05.2025 (Bekanntmachungsdatum)\n\nNiedersachsen Amtsgericht Hannover HRB 54594\nEinreichung neuer Dokumente\n\nAGILA Haustierversicherung Aktiengesellschaft\nAktiengesellschaft\nHannover\n\nDie Liste der Mitglieder des Aufsichtsrats wurde beim Registergericht eingereicht."
    },
    {
      "date": "2025-05-05",
      "id": "108059",
      "original_text": "Registerbekanntmachung nach dem Umwandlungsgesetz\nNiedersachsen Amtsgericht Tostedt HRB 206642\nAM Immobilien GmbH – Breddorf",
      "type": "Registerbekanntmachung nach dem Umwandlungsgesetz",
      "state": "Niedersachsen",
      "amtsgericht": "Amtsgericht Tostedt",
      "registernummer": "HRB 206642",
      "registerart": "HRB",
      "company_name": "AM Immobilien GmbH",
      "company_seat": "Breddorf",
      "details": "05.05.2025 (Bekanntmachungsdatum)\n\nNiedersachsen Amtsgericht Tostedt HRB 206642\nRegisterbekanntmachung nach dem Umwandlungsgesetz 05.05.2025 (Eintragungsdatum)\n\nAM Immobilien GmbH\nGesellschaft mit beschränkter Haftung\nBreddorf\n\nDen Gläubigern der an der Verschmelzung beteiligten Rechtsträger ist, wenn sie binnen sechs Monaten nach dem Tag, an dem die Eintragung der Verschmelzung in das Register des Sitzes desjenigen Rechtsträgers, dessen Gläubiger sie sind, nach § 19  Abs.  3 UmwG als bekannt gemacht gilt, ihren Anspruch nach Grund und Höhe schriftlich anmelden, Sicherheit zu leisten, soweit sie nicht Befriedigung verlangen können. Dieses Recht steht den Gläubigern jedoch nur zu, wenn sie glaubhaft machen, dass durch die Verschmelzung die Erfüllung der Forderung gefährdet wird."
    },
    {
      "date": "2025-05-05",
      "id": "108060",
      "original_text": "Löschungsankündigung\nRheinland-Pfalz Amtsgericht Landau HRB 31346\nmyworkbook Deutschland GmbH – Kandel",
      "type": "Löschungsankündigung",
      "state": "Rheinland-Pfalz",
      "amtsgericht": "Amtsgericht Landau",
      "registernummer": "HRB 31346",
      "registerart": "HRB",
      "company_name": "myworkbook Deutschland GmbH",
      "company_seat": "Kandel",
      "details": "05.05.2025 (Bekanntmachungsdatum)\n\nRheinland-Pfalz Amtsgericht Landau HRB 31346\nLöschungsankündigung\n\nmyworkbook Deutschland GmbH\nGesellschaft mit beschränkter Haftung\nKandel\n\nDas Registergericht beabsichtigt die Gesellschaft von Amts wegen nach § 394 FamFG zu löschen. Die Frist zur Erhebung eines Widerspruchs ist auf einen Monat festgesetzt."
    },
    {
      "date": "2025-05-05",
      "id": "108061",
      "original_text": "Löschungsankündigung\nRheinland-Pfalz Amtsgericht Ludwigshafen a.Rhein (Ludwigshafen) HRB 67982\nAnzalone Transporte GmbH – Ludwigshafen am Rhein",
      "type": "Löschungsankündigung",
      "state": "Rheinland-Pfalz",
      "amtsgericht": "Amtsgericht Ludwigshafen a.Rhein (Ludwigshafen)",
      "registernummer": "HRB 67982",
      "registerart": "HRB",
      "company_name": "Anzalone Transporte GmbH",
      "company_seat": "Ludwigshafen am Rhein",
      "details": "05.05.2025 (Bekanntmachungsdatum)\n\nRheinland-Pfalz Amtsgericht Ludwigshafen a.Rhein (Ludwigshafen) HRB 67982\nLöschungsankündigung\n\nAnzalone Transporte GmbH\nGesellschaft mit beschränkter Haftung\nLudwigshafen am Rhein\n\nDas Registergericht beabsichtigt die Gesellschaft von Amts wegen nach § 394 FamFG zu löschen. Die Frist zur Erhebung eines Widerspruchs ist auf einen Monat festgesetzt."
    },
    {
      "date": "2025-05-05",
      "id": "108062",
      "original_text": "Registerbekanntmachung nach dem Umwandlungsgesetz\nRheinland-Pfalz Amtsgericht Zweibrücken HRB 30439\nAquaplan GmbH – Pirmasens",
      "type": "Registerbekanntmachung nach dem Umwandlungsgesetz",
      "state": "Rheinland-Pfalz",
      "amtsgericht": "Amtsgericht Zweibrücken",
      "registernummer": "HRB 30439",
      "registerart": "HRB",
      "company_name": "Aquaplan GmbH",
      "company_seat": "Pirmasens",
      "details": "05.05.2025 (Bekanntmachungsdatum)\n\nRheinland-Pfalz Amtsgericht Zweibrücken HRB 30439\nRegisterbekanntmachung nach dem Umwandlungsgesetz 05.05.2025 (Eintragungsdatum)\n\nAquaplan GmbH\nGesellschaft mit beschränkter Haftung\nPirmasens\n\nAls nicht eingetragen wird veröffentlicht: Den Gläubigern der an der Verschmelzung beteiligten Rechtsträger ist, wenn sie binnen sechs Monaten nach dem Tag, an dem die Eintragung der Verschmelzung in das Register des Sitzes desjenigen Rechtsträgers,dessen Gläubiger sie sind, nach § 19 Abs. 3 UmwG als bekannt gemacht gilt, ihren Anspruch nach Grund und Höhe schriftlich anmelden, Sicherheit zu leisten, soweit sie nicht Befriedigung verlangen können. Dieses Recht steht den Gläubigern jedoch nur zu, wenn sie glaubhaft machen, dass durch die Verschmelzung die Erfüllungd er Forderung gefährdet wird."
    },
    {
      "date": "2025-05-05",
      "id": "108063",
      "original_text": "Registerbekanntmachung nach dem Umwandlungsgesetz\nRheinland-Pfalz Amtsgericht Montabaur HRB 27292\nBiGu - Vermögensverwaltungs GmbH – Hahnstätten",
      "type": "Registerbekanntmachung nach dem Umwandlungsgesetz",
      "state": "Rheinland-Pfalz",
      "amtsgericht": "Amtsgericht Montabaur",
      "registernummer": "HRB 27292",
      "registerart": "HRB",
      "company_name": "BiGu - Vermögensverwaltungs GmbH",
      "company_seat": "Hahnstätten",
      "details": "05.05.2025 (Bekanntmachungsdatum)\n\nRheinland-Pfalz Amtsgericht Montabaur HRB 27292\nRegisterbekanntmachung nach dem Umwandlungsgesetz 05.05.2025 (Eintragungsdatum)\n\nBiGu - Vermögensverwaltungs GmbH\nGesellschaft mit beschränkter Haftung\nHahnstätten\n\nAls nicht eingetragen wird veröffentlicht: Den Gläubigern der an der Verschmelzung beteiligten Rechtsträger ist, wenn sie binnen sechs Monaten nach dem Tag, an dem die Eintragung der Verschmelzung in das Register des Sitzes desjenigen Rechtsträgers, dessen Gläubiger sie sind, nach § 19 Abs. 3 UmwG als bekannt gemacht gilt, ihren Anspruch nach Grund und Höhe schriftlich anmelden, Sicherheit zu leisten, soweit sie nicht Befriedigung verlangen können. Dieses Recht steht den Gläubigern jedoch nur zu, wenn sie glaubhaft machen, dass durch die Verschmelzung die Erfüllung der Forderung gefährdet wird."
    },
    {
      "date": "2025-05-05",
      "id": "108064",
      "original_text": "Einreichung neuer Dokumente\nRheinland-Pfalz Amtsgericht Koblenz HRB 79\nZF Active Safety GmbH – Koblenz",
      "type": "Einreichung neuer Dokumente",
      "state": "Rheinland-Pfalz",
      "amtsgericht": "Amtsgericht Koblenz",
      "registernummer": "HRB 79",
      "registerart": "HRB",
      "company_name": "ZF Active Safety GmbH",
      "company_seat": "Koblenz",
      "details": "05.05.2025 (Bekanntmachungsdatum)\n\nRheinland-Pfalz Amtsgericht Koblenz HRB 79\nEinreichung neuer Dokumente 05.05.2025 (Eintragungsdatum)\n\nZF Active Safety GmbH\nGesellschaft mit beschränkter Haftung\nKoblenz\n\nDem Registergericht ist eine neue Liste der Mitglieder des Aufsichtsrates eingereicht worden."
    },
    {
      "date": "2025-05-05",
      "id": "108065",
      "original_text": "Löschungsankündigung\nRheinland-Pfalz Amtsgericht Zweibrücken HRB 23144\nLeitenberger GmbH, Bäckerei und Café am Sommerwald – Pirmasens",
      "type": "Löschungsankündigung",
      "state": "Rheinland-Pfalz",
      "amtsgericht": "Amtsgericht Zweibrücken",
      "registernummer": "HRB 23144",
      "registerart": "HRB",
      "company_name": "Leitenberger GmbH, Bäckerei und Café am Sommerwald",
      "company_seat": "Pirmasens",
      "details": "05.05.2025 (Bekanntmachungsdatum)\n\nRheinland-Pfalz Amtsgericht Zweibrücken HRB 23144\nLöschungsankündigung\n\nLeitenberger GmbH, Bäckerei und Café am Sommerwald\nGesellschaft mit beschränkter Haftung\nPirmasens\n\nDas Registergericht beabsichtigt die Gesellschaft von Amts wegen nach § 394 FamFG zu löschen. Die Frist zur Erhebung eines Widerspruchs ist auf einen Monat festgesetzt."
    },
    {
      "date": "2025-05-05",
      "id": "108066",
      "original_text": "Löschungsankündigung\nNordrhein-Westfalen Amtsgericht Essen HRB 25650\nIP Industrial Services & Properties GmbH – Essen",
      "type": "Löschungsankündigung",
      "state": "Nordrhein-Westfalen",
      "amtsgericht": "Amtsgericht Essen",
      "registernummer": "HRB 25650",
      "registerart": "HRB",
      "company_name": "IP Industrial Services & Properties GmbH",
      "company_seat": "Essen",
      "details": "05.05.2025 (Bekanntmachungsdatum)\n\nNordrhein-Westfalen Amtsgericht Essen HRB 25650\nLöschungsankündigung\n\nIP Industrial Services & Properties GmbH\nGesellschaft mit beschränkter Haftung\nEssen\n\nDas Registergericht beabsichtigt die Gesellschaft von Amts wegen nach § 394 FamFG zu löschen. Die Frist zur Erhebung eines Widerspruchs ist auf einen Monat festgesetzt."
    },
    {
      "date": "2025-05-05",
      "id": "108067",
      "original_text": "Löschungsankündigung\nNordrhein-Westfalen Amtsgericht Köln HRB 82908\nSCHÜTZENDORF GMBH – Köln",
      "type": "Löschungsankündigung",
      "state": "Nordrhein-Westfalen",
      "amtsgericht": "Amtsgericht Köln",
      "registernummer": "HRB 82908",
      "registerart": "HRB",
      "company_name": "SCHÜTZENDORF GMBH",
      "company_seat": "Köln",
      "details": "05.05.2025 (Bekanntmachungsdatum)\n\nNordrhein-Westfalen Amtsgericht Köln HRB 82908\nLöschungsankündigung\n\nSCHÜTZENDORF GMBH\nGesellschaft mit beschränkter Haftung\nKöln\n\nDas Registergericht beabsichtigt, die im Handelsregister eingetragene Gesellschaft gemäß § 394 Absatz 1 FamFG wegen Vermögenslosigkeit von Amts wegen zu löschen. Gegen diese Verfügung kann Widerspruch eingelegt werden. Die Frist zur Erhebung eines Widerspruchs gegen die beabsichtigte Löschung von Amts wegen ist auf einen Monat festgesetzt. Rechtsbehelfsbelehrung: Gegen diese Verfügung können Sie Widerspruch einlegen. Der Widerspruch ist bei dem Amtsgericht Köln, Reichenspergerplatz 1, 50670 Köln schriftlich in deutscher Sprache oder zur Niederschrift der Geschäftsstelle einzulegen. Der Widerspruch kann auch zur Niederschrift der Geschäftsstelle eines jeden Amtsgerichtes abgegeben werden. Die Einlegung ist auch durch Übertragung eines elektronischen Dokuments an die elektronische Poststelle des Gerichts möglich. Das elektronische Dokument muss für die Bearbeitung durch das Gericht geeignet und mit einer qualifizierten elektronischen Signatur der verantwortenden Person versehen sein oder von der verantwortenden Person signiert und auf einem sicheren Übermittlungsweg gemäß § 130a ZPO nach näherer Maßgabe der Verordnung über die technischen Rahmenbedingungen des elektronischen Rechtsverkehrs und über das besondere elektronische Behördenpostfach (BGBl. I, S.3803) eingereicht werden. Weitere Informationen erhalten Sie auf der Internetseite www.justiz.de.Der Widerspruch muss spätestens innerhalb der gesetzten Frist bei dem Amtsgericht Köln eingegangen sein. Dies gilt auch dann, wenn der Widerspruch zur Niederschrift der Geschäftsstelle eines anderen Amtsgerichtes abgegeben wurde. Die Frist beginnt mit der Veröffentlichung. Fällt das Ende der Frist auf einen Sonntag, einen allgemeinen Feiertag oder Sonnabend, so endet die Frist mit Ablauf des nächsten Werktages.\n\nDer Widerspruch muss die Bezeichnung der angefochtenen Verfügung sowie die Erklärung enthalten, dass Widerspruch gegen diese Verfügung eingelegt wird. Er ist zu unterzeichnen und soll begründet werden."
    },
    {
      "date": "2025-05-05",
      "id": "108068",
      "original_text": "Registerbekanntmachung nach dem Umwandlungsgesetz\nNordrhein-Westfalen Amtsgericht Arnsberg HRB 7190\nAGRAVIS Kornhaus Westfalen-Süd GmbH – Meschede",
      "type": "Registerbekanntmachung nach dem Umwandlungsgesetz",
      "state": "Nordrhein-Westfalen",
      "amtsgericht": "Amtsgericht Arnsberg",
      "registernummer": "HRB 7190",
      "registerart": "HRB",
      "company_name": "AGRAVIS Kornhaus Westfalen-Süd GmbH",
      "company_seat": "Meschede",
      "details": "05.05.2025 (Bekanntmachungsdatum)\n\nNordrhein-Westfalen Amtsgericht Arnsberg HRB 7190\nRegisterbekanntmachung nach dem Umwandlungsgesetz 05.05.2025 (Eintragungsdatum)\n\nAGRAVIS Kornhaus Westfalen-Süd GmbH\nGesellschaft mit beschränkter Haftung\nMeschede\n\nDen Gläubigern der an der Verschmelzung beteiligten Rechtsträger ist, wenn sie binnen sechs Monaten nach dem Tag, an dem die Eintragung der Verschmelzung in das Register des Sitzes desjenigen Rechtsträgers, dessen Gläubiger sie sind, nach § 19 Absatz 3 UmwG als bekanntgemacht gilt, ihren Anspruch nach Grund und Höhe schriftlich anmelden, Sicherheit zu leisten, soweit sie nicht Befriedigung verlangen können. Dieses Recht steht den Gläubigern jedoch nur zu, wenn sie glaubhaft machen, dass durch die Verschmelzung die Erfüllung ihrer Forderung gefährdet wird."
    },
    {
      "date": "2025-05-05",
      "id": "108069",
      "original_text": "Registerbekanntmachung nach dem Umwandlungsgesetz\nNordrhein-Westfalen Amtsgericht Münster HRB 15672\nZAP-Hosting GmbH – Münster",
      "type": "Registerbekanntmachung nach dem Umwandlungsgesetz",
      "state": "Nordrhein-Westfalen",
      "amtsgericht": "Amtsgericht Münster",
      "registernummer": "HRB 15672",
      "registerart": "HRB",
      "company_name": "ZAP-Hosting GmbH",
      "company_seat": "Münster",
      "details": "05.05.2025 (Bekanntmachungsdatum)\n\nNordrhein-Westfalen Amtsgericht Münster HRB 15672\nRegisterbekanntmachung nach dem Umwandlungsgesetz 05.05.2025 (Eintragungsdatum)\n\nZAP-Hosting GmbH\nGesellschaft mit beschränkter Haftung\nMünster\n\nDen Gläubigern der an der Verschmelzung beteiligten Rechtsträger ist, wenn sie binnen sechs Monaten nach dem Tag, an dem die Eintragung der Verschmelzung in das Register des Sitzes desjenigen Rechtsträgers, dessen Gläubiger sie sind, nach § 19 Absatz 3 UmwG als bekanntgemacht gilt, ihren Anspruch nach Grund und Höhe schriftlich anmelden, Sicherheit zu leisten, soweit sie nicht Befriedigung verlangen können. Dieses Recht steht den Gläubigern jedoch nur zu, wenn sie glaubhaft machen, dass durch die Verschmelzung die Erfüllung ihrer Forderung gefährdet wird."
    },
    {
      "date": "2025-05-05",
      "id": "108070",
      "original_text": "Registerbekanntmachung nach dem Umwandlungsgesetz\nNordrhein-Westfalen Amtsgericht Dortmund HRB 27964\nPoint 8 GmbH – Dortmund",
      "type": "Registerbekanntmachung nach dem Umwandlungsgesetz",
      "state": "Nordrhein-Westfalen",
      "amtsgericht": "Amtsgericht Dortmund",
      "registernummer": "HRB 27964",
      "registerart": "HRB",
      "company_name": "Point 8 GmbH",
      "company_seat": "Dortmund",
      "details": "05.05.2025 (Bekanntmachungsdatum)\n\nNordrhein-Westfalen Amtsgericht Dortmund HRB 27964\nRegisterbekanntmachung nach dem Umwandlungsgesetz 05.05.2025 (Eintragungsdatum)\n\nPoint 8 GmbH\nGesellschaft mit beschränkter Haftung\nDortmund\n\nDen Gläubigern der an der Verschmelzung beteiligten Rechtsträger ist, wenn sie binnen sechs Monaten nach dem Tag, an dem die Eintragung der Verschmelzung in das Register des Sitzes desjenigen Rechtsträgers, dessen Gläubiger sie sind, nach § 19 Absatz 3 UmwG als bekanntgemacht gilt, ihren Anspruch nach Grund und Höhe schriftlich anmelden, Sicherheit zu leisten, soweit sie nicht Befriedigung verlangen können. Dieses Recht steht den Gläubigern jedoch nur zu, wenn sie glaubhaft machen, dass durch die Verschmelzung die Erfüllung ihrer Forderung gefährdet wird."
    },
    {
      "date": "2025-05-05",
      "id": "108071",
      "original_text": "Registerbekanntmachung nach dem Umwandlungsgesetz\nNordrhein-Westfalen Amtsgericht Münster HRB 22550\nLIPPTASTE GmbH – Münster",
      "type": "Registerbekanntmachung nach dem Umwandlungsgesetz",
      "state": "Nordrhein-Westfalen",
      "amtsgericht": "Amtsgericht Münster",
      "registernummer": "HRB 22550",
      "registerart": "HRB",
      "company_name": "LIPPTASTE GmbH",
      "company_seat": "Münster",
      "details": "05.05.2025 (Bekanntmachungsdatum)\n\nNordrhein-Westfalen Amtsgericht Münster HRB 22550\nRegisterbekanntmachung nach dem Umwandlungsgesetz 05.05.2025 (Eintragungsdatum)\n\nLIPPTASTE GmbH\nGesellschaft mit beschränkter Haftung\nMünster\n\nDen Gläubigern der an der formwechselnden Umwandlung beteiligten Rechtsträger ist, wenn sie binnen sechs Monaten nach dem Tag, an dem die Eintragung der formwechselnden Umwandlung in das Register des Sitzes desjenigen Rechtsträgers, dessen Gläubiger sie sind, nach § 19 Absatz 3 UmwG als bekanntgemacht gilt, ihren Anspruch nach Grund und Höhe schriftlich anmelden, Sicherheit zu leisten, soweit sie nicht Befriedigung verlangen können. Dieses Recht steht den Gläubigern jedoch nur zu, wenn sie glaubhaft machen, dass durch die formwechselnden Umwandlung die Erfüllung ihrer Forderung gefährdet wird."
    },
    {
      "date": "2025-05-05",
      "id": "108072",
      "original_text": "Löschungsankündigung\nNordrhein-Westfalen Amtsgericht Düsseldorf HRA 26593\nPrixer OHG – Düsseldorf",
      "type": "Löschungsankündigung",
      "state": "Nordrhein-Westfalen",
      "amtsgericht": "Amtsgericht Düsseldorf",
      "registernummer": "HRA 26593",
      "registerart": "HRA",
      "company_name": "Prixer OHG",
      "company_seat": "Düsseldorf",
      "details": "05.05.2025 (Bekanntmachungsdatum)\n\nNordrhein-Westfalen Amtsgericht Düsseldorf HRA 26593\nLöschungsankündigung\n\nPrixer OHG\nOffene Handelsgesellschaft\nDüsseldorf\n\nDas Registergericht beabsichtigt die Firma von Amts wegen nach § 31 Abs. 2 HGB zu löschen. Die Frist zur Erhebung eines Widerspruchs ist auf drei Monate festgesetzt.\n\nRechtsbehelfsbelehrung:\nDas Widerspruchsrecht steht jedem zu, der an der Unterlassung der Löschung ein berechtigtes Interesse hat. Der Widerspruch ist bei dem Amtsgericht Düsseldorf -Registergericht-, Werdener Straße 1, 40227 Düsseldorf schriftlich in deutscher Sprache oder zur Niederschrift der Geschäftsstelle einzulegen. Der Widerspruch kann auch zur Niederschrift der Geschäftsstelle eines jeden Amtsgerichtes abgegeben werden. Die Einlegung ist auch durch Übertragung eines elektronischen Dokuments an die elektronische Poststelle des Gerichts möglich. Das elektronische Dokument muss für die Bearbeitung durch das Gericht geeignet und mit einer qualifizierten elektronischen Signatur der verantwortenden Person versehen sein oder von der verantwortenden Person signiert und auf einem sicheren Übermittlungsweg gemäß § 130a ZPO nach näherer Maßgabe der Verordnung über die technischen Rahmenbedingungen des elektronischen Rechtsverkehrs und über das besondere elektronische Behördenpostfach (BGBl. I, S.3803) eingereicht werden. Weitere Informationen erhalten Sie auf der Internetseite www.justiz.de.\nDer Widerspruch muss spätestens innerhalb der gesetzten Frist nach dem Datum der Bekanntmachung der Löschungsankündigung bei dem Amtsgericht - Registergericht - Düsseldorf eingegangen sein.  Dies gilt auch dann, wenn der Widerspruch zur Niederschrift der Geschäftsstelle eines anderen Amtsgerichtes abgegeben wurde. Die Frist beginnt mit dem Tage der Bekanntmachung der Löschungsankündigung in dem für die Bekanntmachung der Eintragungen in das Handelsregister bestimmten elektronischen Informations- und Kommunikationssystem nach § 10 des Handelsgesetzbuches. Fällt das Ende der Frist auf einen Sonntag, einen allgemeinen Feiertag oder Sonnabend, so endet die Frist mit Ablauf des nächsten Werktages.\nDer Widerspruch muss die Bezeichnung der angefochtenen Löschungsankündigung sowie die Erklärung enthalten, dass Widerspruch gegen diese Löschungsankündigung eingelegt wird. Er ist zu unterzeichnen und soll begründet werden."
    },
    {
      "date": "2025-05-05",
      "id": "108073",
      "original_text": "Löschungsankündigung\nNordrhein-Westfalen Amtsgericht Düsseldorf HRB 98406\nRayana Resources GmbH – Düsseldorf",
      "type": "Löschungsankündigung",
      "state": "Nordrhein-Westfalen",
      "amtsgericht": "Amtsgericht Düsseldorf",
      "registernummer": "HRB 98406",
      "registerart": "HRB",
      "company_name": "Rayana Resources GmbH",
      "company_seat": "Düsseldorf",
      "details": "05.05.2025 (Bekanntmachungsdatum)\n\nNordrhein-Westfalen Amtsgericht Düsseldorf HRB 98406\nLöschungsankündigung\n\nRayana Resources GmbH\nGesellschaft mit beschränkter Haftung\nDüsseldorf\n\nDas Registergericht beabsichtigt die Gesellschaft von Amts wegen nach § 394 Abs. 1 FamFG zu löschen. Die Frist zur Erhebung eines Widerspruchs ist auf einen Monat festgesetzt.\n\nRechtsbehelfsbelehrung:\nDas Widerspruchsrecht steht jedem zu, der an der Unterlassung der Löschung ein berechtigtes Interesse hat. Der Widerspruch ist bei dem Amtsgericht Düsseldorf -Registergericht-, Werdener Straße 1, 40227 Düsseldorf schriftlich in deutscher Sprache oder zur Niederschrift der Geschäftsstelle einzulegen. Der Widerspruch kann auch zur Niederschrift der Geschäftsstelle eines jeden Amtsgerichtes abgegeben werden. Die Einlegung ist auch durch Übertragung eines elektronischen Dokuments an die elektronische Poststelle des Gerichts möglich. Das elektronische Dokument muss für die Bearbeitung durch das Gericht geeignet und mit einer qualifizierten elektronischen Signatur der verantwortenden Person versehen sein oder von der verantwortenden Person signiert und auf einem sicheren Übermittlungsweg gemäß § 130a ZPO nach näherer Maßgabe der Verordnung über die technischen Rahmenbedingungen des elektronischen Rechtsverkehrs und über das besondere elektronische Behördenpostfach (BGBl. I, S.3803) eingereicht werden. Weitere Informationen erhalten Sie auf der Internetseite www.justiz.de.\nDer Widerspruch muss spätestens innerhalb der gesetzten Frist nach dem Datum der Bekanntmachung der Löschungsankündigung bei dem Amtsgericht - Registergericht - Düsseldorf eingegangen sein.  Dies gilt auch dann, wenn der Widerspruch zur Niederschrift der Geschäftsstelle eines anderen Amtsgerichtes abgegeben wurde. Die Frist beginnt mit dem Tage der Bekanntmachung der Löschungsankündigung in dem für die Bekanntmachung der Eintragungen in das Handelsregister bestimmten elektronischen Informations- und Kommunikationssystem nach § 10 des Handelsgesetzbuches. Fällt das Ende der Frist auf einen Sonntag, einen allgemeinen Feiertag oder Sonnabend, so endet die Frist mit Ablauf des nächsten Werktages.\nDer Widerspruch muss die Bezeichnung der angefochtenen Löschungsankündigung sowie die Erklärung enthalten, dass Widerspruch gegen diese Löschungsankündigung eingelegt wird. Er ist zu unterzeichnen und soll begründet werden."
    },
    {
      "date": "2025-05-05",
      "id": "108074",
      "original_text": "Löschungsankündigung\nNordrhein-Westfalen Amtsgericht Dortmund HRB 4998\nPorsch & Co., Baustoffe -und Transporte, Gesellschaft mit beschränkter Haftung. – Dortmund",
      "type": "Löschungsankündigung",
      "state": "Nordrhein-Westfalen",
      "amtsgericht": "Amtsgericht Dortmund",
      "registernummer": "HRB 4998",
      "registerart": "HRB",
      "company_name": "Porsch & Co., Baustoffe -und Transporte, Gesellschaft mit beschränkter Haftung.",
      "company_seat": "Dortmund",
      "details": "05.05.2025 (Bekanntmachungsdatum)\n\nNordrhein-Westfalen Amtsgericht Dortmund HRB 4998\nLöschungsankündigung 02.05.2025 (Eintragungsdatum)\n\nPorsch & Co., Baustoffe -und Transporte, Gesellschaft mit beschränkter Haftung.\nGesellschaft mit beschränkter Haftung\nDortmund\n\nDas Registergericht beabsichtigt die Gesellschaft von Amts wegen nach § 394 FamFG zu löschen. Die Frist zur Erhebung eines Widerspruchs ist auf zwei Monate festgesetzt."
    },
    {
      "date": "2025-05-05",
      "id": "108075",
      "original_text": "Registerbekanntmachung nach dem Umwandlungsgesetz\nNordrhein-Westfalen Amtsgericht Steinfurt HRB 8405\nLohmöller Holding GmbH – Rheine",
      "type": "Registerbekanntmachung nach dem Umwandlungsgesetz",
      "state": "Nordrhein-Westfalen",
      "amtsgericht": "Amtsgericht Steinfurt",
      "registernummer": "HRB 8405",
      "registerart": "HRB",
      "company_name": "Lohmöller Holding GmbH",
      "company_seat": "Rheine",
      "details": "05.05.2025 (Bekanntmachungsdatum)\n\nNordrhein-Westfalen Amtsgericht Steinfurt HRB 8405\nRegisterbekanntmachung nach dem Umwandlungsgesetz 05.05.2025 (Eintragungsdatum)\n\nLohmöller Holding GmbH\nGesellschaft mit beschränkter Haftung\nRheine\n\nDen Gläubigern der an der formwechselnden Umwandlung beteiligten Rechtsträger ist, wenn sie binnen sechs Monaten nach dem Tag, an dem die Eintragung der formwechselnden Umwandlung in das Register des Sitzes desjenigen Rechtsträgers, dessen Gläubiger sie sind, nach § 19 Absatz 3 UmwG als bekanntgemacht gilt, ihren Anspruch nach Grund und Höhe schriftlich anmelden, Sicherheit zu leisten, soweit sie nicht Befriedigung verlangen können. Dieses Recht steht den Gläubigern jedoch nur zu, wenn sie glaubhaft machen, dass durch die formwechselnden Umwandlung die Erfüllung ihrer Forderung gefährdet wird."
    },
    {
      "date": "2025-05-05",
      "id": "108076",
      "original_text": "Löschungsankündigung\nNordrhein-Westfalen Amtsgericht Mönchengladbach HRB 16904\nFrank Hendricks Backwaren GmbH – Viersen",
      "type": "Löschungsankündigung",
      "state": "Nordrhein-Westfalen",
      "amtsgericht": "Amtsgericht Mönchengladbach",
      "registernummer": "HRB 16904",
      "registerart": "HRB",
      "company_name": "Frank Hendricks Backwaren GmbH",
      "company_seat": "Viersen",
      "details": "05.05.2025 (Bekanntmachungsdatum)\n\nNordrhein-Westfalen Amtsgericht Mönchengladbach HRB 16904\nLöschungsankündigung 05.05.2025 (Eintragungsdatum)\n\nFrank Hendricks Backwaren GmbH\nGesellschaft mit beschränkter Haftung\nViersen\n\nDas Registergericht beabsichtigt die Gesellschaft von Amts wegen nach § 394 FamFG zu löschen. Die Frist zur Erhebung eines Widerspruchs ist auf drei Monate festgesetzt."
    },
    {
      "date": "2025-05-05",
      "id": "108077",
      "original_text": "Registerbekanntmachung nach dem Umwandlungsgesetz\nNordrhein-Westfalen Amtsgericht Bochum HRB 22352\nConser Facility Management GmbH – Bochum",
      "type": "Registerbekanntmachung nach dem Umwandlungsgesetz",
      "state": "Nordrhein-Westfalen",
      "amtsgericht": "Amtsgericht Bochum",
      "registernummer": "HRB 22352",
      "registerart": "HRB",
      "company_name": "Conser Facility Management GmbH",
      "company_seat": "Bochum",
      "details": "05.05.2025 (Bekanntmachungsdatum)\n\nNordrhein-Westfalen Amtsgericht Bochum HRB 22352\nRegisterbekanntmachung nach dem Umwandlungsgesetz 30.04.2025 (Eintragungsdatum)\n\nConser Facility Management GmbH\nGesellschaft mit beschränkter Haftung\nBochum\n\nDen Gläubigern der an der Ausgliederung beteiligten Rechtsträger ist, wenn sie binnen sechs Monaten nach dem Tag, an dem die Eintragung der Ausgliederung in das Register des Sitzes derjenigen Rechtsträger deren Gläubiger sie sind, nach § 19 Absatz 3 UmwG als bekanntgemacht gilt, ihren Anspruch nach Grund und Höhe schriftlich anmelden, Sicherheit zu leisten, soweit sie nicht Befriedigung verlangen können. Dieses Recht steht den Gläubigern jedoch nur zu, wenn sie glaubhaft machen, dass durch die Ausgliederung die Erfüllung ihrer Forderung gefährdet wird."
    },
    {
      "date": "2025-05-05",
      "id": "108078",
      "original_text": "Einreichung neuer Dokumente\nNordrhein-Westfalen Amtsgericht Düsseldorf HRB 36466\nERGO Versicherung Aktiengesellschaft – Düsseldorf",
      "type": "Einreichung neuer Dokumente",
      "state": "Nordrhein-Westfalen",
      "amtsgericht": "Amtsgericht Düsseldorf",
      "registernummer": "HRB 36466",
      "registerart": "HRB",
      "company_name": "ERGO Versicherung Aktiengesellschaft",
      "company_seat": "Düsseldorf",
      "details": "05.05.2025 (Bekanntmachungsdatum)\n\nNordrhein-Westfalen Amtsgericht Düsseldorf HRB 36466\nEinreichung neuer Dokumente 05.05.2025 (Eintragungsdatum)\n\nERGO Versicherung Aktiengesellschaft\nAktiengesellschaft\nDüsseldorf\n\nDem Registergericht ist eine Liste der Mitglieder des Aufsichtsrates eingereicht worden."
    },
    {
      "date": "2025-05-05",
      "id": "108079",
      "original_text": "Löschungsankündigung\nNordrhein-Westfalen Amtsgericht Aachen HRB 23304\nFeta Bau GmbH – Heinsberg",
      "type": "Löschungsankündigung",
      "state": "Nordrhein-Westfalen",
      "amtsgericht": "Amtsgericht Aachen",
      "registernummer": "HRB 23304",
      "registerart": "HRB",
      "company_name": "Feta Bau GmbH",
      "company_seat": "Heinsberg",
      "details": "05.05.2025 (Bekanntmachungsdatum)\n\nNordrhein-Westfalen Amtsgericht Aachen HRB 23304\nLöschungsankündigung\n\nFeta Bau GmbH\nGesellschaft mit beschränkter Haftung\nHeinsberg\n\nDas Registergericht beabsichtigt, von Amts wegen die Gesellschaft wegen Vermögenslosigkeit nach § 394 FamFG zu löschen weil das Insolvenzverfahren Amtsgericht Aachen (93 IN 52/24) beendet und Vermögen der Gesellschaft nicht mehr erkennbar ist.\n\nZur Geltendmachung des Widerspruchs gegen die beabsichtigte Löschung wird hiermit eine Frist von einem Monat ab Veröffentlichung dieser Ankündigung bestimmt.\n\nRechtsbehelfsbelehrung:\n\nGegen diese Verfügung kann Widerspruch eingelegt werden. Zum Widerspruch ist jeder berechtigt, der an der Unterlassung der Löschung ein berechtigtes Interesse hat.\n\nDer Widerspruch ist bei dem Amtsgericht Aachen, Adalbertsteinweg 92, 52070 Aachen schriftlich in deutscher Sprache oder zur Niederschrift der Geschäftsstelle einzulegen. Der Widerspruch kann auch zur Niederschrift der Geschäftsstelle eines jeden Amtsgerichtes abgegeben werden.\n\nDer Widerspruch muss spätestens innerhalb der gesetzten Frist nach der Bekanntgabe der Verfügung bei dem Amtsgericht Aachen eingegangen sein. Dies gilt auch dann, wenn der Widerspruch zur Niederschrift der Geschäftsstelle eines anderen Amtsgerichtes abgegeben wurde. Die Frist beginnt mit der Bekanntgabe der Verfügung durch Veröffentlichung. Fällt das Ende der Frist auf einen Sonntag, einen allgemeinen Feiertag oder Sonnabend, so endet die Frist mit Ablauf des nächsten Werktages.\n\nDer Widerspruch muss die Bezeichnung der angefochtenen Verfügung sowie die Erklärung enthalten, dass Widerspruch gegen diese Verfügung eingelegt wird. Er ist zu unterzeichnen und soll begründet werden.\n\nDie Einlegung ist auch durch Übertragung eines elektronischen Dokuments an die elektronische Poststelle des Gerichts möglich. Das elektronische Dokument muss für die Bearbeitung durch das Gericht geeignet und mit einer qualifizierten elektronischen Signatur der verantwortenden Person versehen sein oder von der verantwortenden Person signiert und auf einem sicheren Übermittlungsweg gemäß § 130 a ZPO nach näherer Maßgabe der Verordnung über die technischen Rahmenbedingungen des elektronischen Rechtsverkehrs und über das besondere elektronische Behördenpostfach (BGBl. I, S. 3803) eingereicht werden. Weitere Informationen erhalten Sie auf der Internetseite www.justiz.de."
    },
    {
      "date": "2025-05-05",
      "id": "108080",
      "original_text": "Löschungsankündigung\nNordrhein-Westfalen Amtsgericht Bad Oeynhausen HRB 18053\nSTAR BUILDING Trocken- und Akustikbau UG (haftungsbeschränkt) – Enger",
      "type": "Löschungsankündigung",
      "state": "Nordrhein-Westfalen",
      "amtsgericht": "Amtsgericht Bad Oeynhausen",
      "registernummer": "HRB 18053",
      "registerart": "HRB",
      "company_name": "STAR BUILDING Trocken- und Akustikbau UG (haftungsbeschränkt)",
      "company_seat": "Enger",
      "details": "05.05.2025 (Bekanntmachungsdatum)\n\nNordrhein-Westfalen Amtsgericht Bad Oeynhausen HRB 18053\nLöschungsankündigung\n\nSTAR BUILDING Trocken- und Akustikbau UG (haftungsbeschränkt)\nGesellschaft mit beschränkter Haftung\nEnger\n\nDas Registergericht beabsichtigt die Gesellschaft von Amts wegen nach § 394 FamFG zu löschen. Die Frist zur Erhebung eines Widerspruchs ist auf einen Monat festgesetzt."
    },
    {
      "date": "2025-05-05",
      "id": "108081",
      "original_text": "Registerbekanntmachung nach dem Umwandlungsgesetz\nNordrhein-Westfalen Amtsgericht Duisburg HRB 15496\nGerstel Geschäftsführungs GmbH – Mülheim an der Ruhr",
      "type": "Registerbekanntmachung nach dem Umwandlungsgesetz",
      "state": "Nordrhein-Westfalen",
      "amtsgericht": "Amtsgericht Duisburg",
      "registernummer": "HRB 15496",
      "registerart": "HRB",
      "company_name": "Gerstel Geschäftsführungs GmbH",
      "company_seat": "Mülheim an der Ruhr",
      "details": "05.05.2025 (Bekanntmachungsdatum)\n\nNordrhein-Westfalen Amtsgericht Duisburg HRB 15496\nRegisterbekanntmachung nach dem Umwandlungsgesetz 05.05.2025 (Eintragungsdatum)\n\nGerstel Geschäftsführungs GmbH\nGesellschaft mit beschränkter Haftung\nMülheim an der Ruhr\n\nDen Gläubigern der an der Verschmelzung beteiligten Rechtsträger ist, wenn sie binnen sechs Monaten nach dem Tag, an dem die Eintragung der Verschmelzung in das Register des Sitzes desjenigen Rechtsträgers, dessen Gläubiger sie sind, nach § 19 Absatz 3 UmwG als bekanntgemacht gilt, ihren Anspruch nach Grund und Höhe schriftlich anmelden, Sicherheit zu leisten, soweit sie nicht Befriedigung verlangen können. Dieses Recht steht den Gläubigern jedoch nur zu, wenn sie glaubhaft machen, dass durch die Verschmelzung die Erfüllung ihrer Forderung gefährdet wird."
    },
    {
      "date": "2025-05-05",
      "id": "108082",
      "original_text": "Einreichung neuer Dokumente\nNordrhein-Westfalen Amtsgericht Bonn HRB 14178\nDeutsche Telekom Service GmbH – Bonn",
      "type": "Einreichung neuer Dokumente",
      "state": "Nordrhein-Westfalen",
      "amtsgericht": "Amtsgericht Bonn",
      "registernummer": "HRB 14178",
      "registerart": "HRB",
      "company_name": "Deutsche Telekom Service GmbH",
      "company_seat": "Bonn",
      "details": "05.05.2025 (Bekanntmachungsdatum)\n\nNordrhein-Westfalen Amtsgericht Bonn HRB 14178\nEinreichung neuer Dokumente\n\nDeutsche Telekom Service GmbH\nGesellschaft mit beschränkter Haftung\nBonn\n\nDem Registergericht ist eine neue Liste der Mitglieder des Aufsichtsrates eingereicht worden."
    },
    {
      "date": "2025-05-05",
      "id": "108083",
      "original_text": "Registerbekanntmachung nach dem Umwandlungsgesetz\nNordrhein-Westfalen Amtsgericht Münster HRB 17602\nRedxeternity UG (haftungsbeschränkt) – Münster",
      "type": "Registerbekanntmachung nach dem Umwandlungsgesetz",
      "state": "Nordrhein-Westfalen",
      "amtsgericht": "Amtsgericht Münster",
      "registernummer": "HRB 17602",
      "registerart": "HRB",
      "company_name": "Redxeternity UG (haftungsbeschränkt)",
      "company_seat": "Münster",
      "details": "05.05.2025 (Bekanntmachungsdatum)\n\nNordrhein-Westfalen Amtsgericht Münster HRB 17602\nRegisterbekanntmachung nach dem Umwandlungsgesetz 05.05.2025 (Eintragungsdatum)\n\nRedxeternity UG (haftungsbeschränkt)\nGesellschaft mit beschränkter Haftung\nMünster\n\nDen Gläubigern der an der Verschmelzung beteiligten Rechtsträger ist, wenn sie binnen sechs Monaten nach dem Tag, an dem die Eintragung der Verschmelzung in das Register des Sitzes desjenigen Rechtsträgers, dessen Gläubiger sie sind, nach § 19 Absatz 3 UmwG als bekanntgemacht gilt, ihren Anspruch nach Grund und Höhe schriftlich anmelden, Sicherheit zu leisten, soweit sie nicht Befriedigung verlangen können. Dieses Recht steht den Gläubigern jedoch nur zu, wenn sie glaubhaft machen, dass durch die Verschmelzung die Erfüllung ihrer Forderung gefährdet wird."
    },
    {
      "date": "2025-05-05",
      "id": "108084",
      "original_text": "Löschungsankündigung\nNordrhein-Westfalen Amtsgericht Aachen HRB 23011\nNW Elektronik Import und Export UG (haftungsbeschränkt) – Stolberg",
      "type": "Löschungsankündigung",
      "state": "Nordrhein-Westfalen",
      "amtsgericht": "Amtsgericht Aachen",
      "registernummer": "HRB 23011",
      "registerart": "HRB",
      "company_name": "NW Elektronik Import und Export UG (haftungsbeschränkt)",
      "company_seat": "Stolberg",
      "details": "05.05.2025 (Bekanntmachungsdatum)\n\nNordrhein-Westfalen Amtsgericht Aachen HRB 23011\nLöschungsankündigung\n\nNW Elektronik Import und Export UG (haftungsbeschränkt)\nGesellschaft mit beschränkter Haftung\nStolberg\n\nDas Registergericht beabsichtigt, von Amts wegen die Gesellschaft wegen Vermögenslosigkeit nach § 394 FamFG zu löschen, nachdem der als Geschäftsführer Eingetragene am 22.04.2024 für die Gesellschaft die Vermögensauskunft abgegeben hat und die Gesellschaft danach vollständig vermögenslos ist und  weil das Finanzamt  Aachen-Kreis mit Schreiben Umstände mitgeteilt hat, aufgrund derer das Gericht davon überzeugt ist, dass die Gesellschaft vollständig vermögenslos ist.\nZur Geltendmachung des Widerspruchs gegen die beabsichtigte Löschung wird hiermit eine Frist von einem Monat ab Veröffentlichung dieser Ankündigung bestimmt.\nRechtsbehelfsbelehrung:\nGegen diese Verfügung kann Widerspruch eingelegt werden. Zum Widerspruch ist jeder berechtigt, der an der Unterlassung der Löschung ein berechtigtes Interesse hat.\nDer Widerspruch ist bei dem Amtsgericht Aachen, Adalbertsteinweg 92, 52070 Aachen schriftlich in deutscher Sprache oder zur Niederschrift der Geschäftsstelle einzulegen. Der Widerspruch kann auch zur Niederschrift der Geschäftsstelle eines jeden Amtsgerichtes abgegeben werden.\nDer Widerspruch muss spätestens innerhalb der gesetzten Frist nach der Bekanntgabe der Verfügung bei dem Amtsgericht Aachen eingegangen sein. Dies gilt auch dann, wenn der Widerspruch zur Niederschrift der Geschäftsstelle eines anderen Amtsgerichtes abgegeben wurde. Die Frist beginnt mit der Bekanntgabe der Verfügung durch Veröffentlichung. Fällt das Ende der Frist auf einen Sonntag, einen allgemeinen Feiertag oder Sonnabend, so endet die Frist mit Ablauf des nächsten Werktages.\nDer Widerspruch muss die Bezeichnung der angefochtenen Verfügung sowie die Erklärung enthalten, dass Widerspruch gegen diese Verfügung eingelegt wird. Er ist zu unterzeichnen und soll begründet werden.\nDie Einlegung ist auch durch Übertragung eines elektronischen Dokuments an die elektronische Poststelle des Gerichts möglich. Das elektronische Dokument muss für die Bearbeitung durch das Gericht geeignet und mit einer qualifizierten elektronischen Signatur der verantwortenden Person versehen sein oder von der verantwortenden Person signiert und auf einem sicheren Übermittlungsweg gemäß § 130 a ZPO nach näherer Maßgabe der Verordnung über die technischen Rahmenbedingungen des elektronischen Rechtsverkehrs und über das besondere elektronische Behördenpostfach (BGBl. I, S. 3803) eingereicht werden. Weitere Informationen erhalten Sie auf der Internetseite www.justiz.de."
    },
    {
      "date": "2025-05-05",
      "id": "108085",
      "original_text": "Löschungsankündigung\nNordrhein-Westfalen Amtsgericht Düsseldorf HRB 96214\nEvolution Bau UG (haftungsbeschränkt) – Düsseldorf",
      "type": "Löschungsankündigung",
      "state": "Nordrhein-Westfalen",
      "amtsgericht": "Amtsgericht Düsseldorf",
      "registernummer": "HRB 96214",
      "registerart": "HRB",
      "company_name": "Evolution Bau UG (haftungsbeschränkt)",
      "company_seat": "Düsseldorf",
      "details": "05.05.2025 (Bekanntmachungsdatum)\n\nNordrhein-Westfalen Amtsgericht Düsseldorf HRB 96214\nLöschungsankündigung\n\nEvolution Bau UG (haftungsbeschränkt)\nGesellschaft mit beschränkter Haftung\nDüsseldorf\n\nDas Registergericht beabsichtigt die Gesellschaft von Amts wegen nach § 394 FamFG zu löschen. Die Frist zur Erhebung eines Widerspruchs ist auf 3 Wochen festgesetzt.\n\nRechtsbehelfsbelehrung:\nDas Widerspruchsrecht steht jedem zu, der an der Unterlassung der Löschung ein berechtigtes Interesse hat. Der Widerspruch ist bei dem Amtsgericht Düsseldorf -Registergericht-, Werdener Straße 1, 40227 Düsseldorf schriftlich in deutscher Sprache oder zur Niederschrift der Geschäftsstelle einzulegen. Der Widerspruch kann auch zur Niederschrift der Geschäftsstelle eines jeden Amtsgerichtes abgegeben werden. Die Einlegung ist auch durch Übertragung eines elektronischen Dokuments an die elektronische Poststelle des Gerichts möglich. Das elektronische Dokument muss für die Bearbeitung durch das Gericht geeignet und mit einer qualifizierten elektronischen Signatur der verantwortenden Person versehen sein oder von der verantwortenden Person signiert und auf einem sicheren Übermittlungsweg gemäß § 130a ZPO nach näherer Maßgabe der Verordnung über die technischen Rahmenbedingungen des elektronischen Rechtsverkehrs und über das besondere elektronische Behördenpostfach (BGBl. I, S.3803) eingereicht werden. Weitere Informationen erhalten Sie auf der Internetseite www.justiz.de.\nDer Widerspruch muss spätestens innerhalb der gesetzten Frist nach dem Datum der Bekanntmachung der Löschungsankündigung bei dem Amtsgericht - Registergericht - Düsseldorf eingegangen sein.  Dies gilt auch dann, wenn der Widerspruch zur Niederschrift der Geschäftsstelle eines anderen Amtsgerichtes abgegeben wurde. Die Frist beginnt mit dem Tage der Bekanntmachung der Löschungsankündigung in dem für die Bekanntmachung der Eintragungen in das Handelsregister bestimmten elektronischen Informations- und Kommunikationssystem nach § 10 des Handelsgesetzbuches. Fällt das Ende der Frist auf einen Sonntag, einen allgemeinen Feiertag oder Sonnabend, so endet die Frist mit Ablauf des nächsten Werktages.\nDer Widerspruch muss die Bezeichnung der angefochtenen Löschungsankündigung sowie die Erklärung enthalten, dass Widerspruch gegen diese Löschungsankündigung eingelegt wird. Er ist zu unterzeichnen und soll begründet werden."
    },
    {
      "date": "2025-05-05",
      "id": "108086",
      "original_text": "Löschungsankündigung\nNordrhein-Westfalen Amtsgericht Düsseldorf HRB 88772\nCabby Cars Düsseldorf GmbH – Düsseldorf",
      "type": "Löschungsankündigung",
      "state": "Nordrhein-Westfalen",
      "amtsgericht": "Amtsgericht Düsseldorf",
      "registernummer": "HRB 88772",
      "registerart": "HRB",
      "company_name": "Cabby Cars Düsseldorf GmbH",
      "company_seat": "Düsseldorf",
      "details": "05.05.2025 (Bekanntmachungsdatum)\n\nNordrhein-Westfalen Amtsgericht Düsseldorf HRB 88772\nLöschungsankündigung\n\nCabby Cars Düsseldorf GmbH\nGesellschaft mit beschränkter Haftung\nDüsseldorf\n\nDas Registergericht beabsichtigt die Gesellschaft von Amts wegen nach § 394 FamFG zu löschen. Die Frist zur Erhebung eines Widerspruchs ist auf 3 Wochen festgesetzt.\n\nRechtsbehelfsbelehrung:\nDas Widerspruchsrecht steht jedem zu, der an der Unterlassung der Löschung ein berechtigtes Interesse hat. Der Widerspruch ist bei dem Amtsgericht Düsseldorf -Registergericht-, Werdener Straße 1, 40227 Düsseldorf schriftlich in deutscher Sprache oder zur Niederschrift der Geschäftsstelle einzulegen. Der Widerspruch kann auch zur Niederschrift der Geschäftsstelle eines jeden Amtsgerichtes abgegeben werden. Die Einlegung ist auch durch Übertragung eines elektronischen Dokuments an die elektronische Poststelle des Gerichts möglich. Das elektronische Dokument muss für die Bearbeitung durch das Gericht geeignet und mit einer qualifizierten elektronischen Signatur der verantwortenden Person versehen sein oder von der verantwortenden Person signiert und auf einem sicheren Übermittlungsweg gemäß § 130a ZPO nach näherer Maßgabe der Verordnung über die technischen Rahmenbedingungen des elektronischen Rechtsverkehrs und über das besondere elektronische Behördenpostfach (BGBl. I, S.3803) eingereicht werden. Weitere Informationen erhalten Sie auf der Internetseite www.justiz.de.\nDer Widerspruch muss spätestens innerhalb der gesetzten Frist nach dem Datum der Bekanntmachung der Löschungsankündigung bei dem Amtsgericht - Registergericht - Düsseldorf eingegangen sein.  Dies gilt auch dann, wenn der Widerspruch zur Niederschrift der Geschäftsstelle eines anderen Amtsgerichtes abgegeben wurde. Die Frist beginnt mit dem Tage der Bekanntmachung der Löschungsankündigung in dem für die Bekanntmachung der Eintragungen in das Handelsregister bestimmten elektronischen Informations- und Kommunikationssystem nach § 10 des Handelsgesetzbuches. Fällt das Ende der Frist auf einen Sonntag, einen allgemeinen Feiertag oder Sonnabend, so endet die Frist mit Ablauf des nächsten Werktages.\nDer Widerspruch muss die Bezeichnung der angefochtenen Löschungsankündigung sowie die Erklärung enthalten, dass Widerspruch gegen diese Löschungsankündigung eingelegt wird. Er ist zu unterzeichnen und soll begründet werden."
    },
    {
      "date": "2025-05-05",
      "id": "108087",
      "original_text": "Löschungsankündigung\nNordrhein-Westfalen Amtsgericht Lemgo HRB 9047\nfeel mobil GmbH – Lage",
      "type": "Löschungsankündigung",
      "state": "Nordrhein-Westfalen",
      "amtsgericht": "Amtsgericht Lemgo",
      "registernummer": "HRB 9047",
      "registerart": "HRB",
      "company_name": "feel mobil GmbH",
      "company_seat": "Lage",
      "details": "05.05.2025 (Bekanntmachungsdatum)\n\nNordrhein-Westfalen Amtsgericht Lemgo HRB 9047\nLöschungsankündigung\n\nfeel mobil GmbH\nGesellschaft mit beschränkter Haftung\nLage\n\nEs ist beabsichtigt, die Gesellschaft von Amts wegen im Hinblick auf das Abmelden des Gewerbes und des Nichtzahlens von IHK-Beiträgen und der damit verbundenen Annahme, dass keine Einkünfte mehr erzielt werden, wegen Vermögenslosigkeit gemäß § 394 Abs. 1 FamFG zu löschen."
    },
    {
      "date": "2025-05-05",
      "id": "108088",
      "original_text": "Löschungsankündigung\nNordrhein-Westfalen Amtsgericht Paderborn HRB 12191\nMTZD GmbH – Paderborn",
      "type": "Löschungsankündigung",
      "state": "Nordrhein-Westfalen",
      "amtsgericht": "Amtsgericht Paderborn",
      "registernummer": "HRB 12191",
      "registerart": "HRB",
      "company_name": "MTZD GmbH",
      "company_seat": "Paderborn",
      "details": "05.05.2025 (Bekanntmachungsdatum)\n\nNordrhein-Westfalen Amtsgericht Paderborn HRB 12191\nLöschungsankündigung\n\nMTZD GmbH\nGesellschaft mit beschränkter Haftung\nPaderborn\n\nDas Registergericht beabsichtigt die Gesellschaft von Amts wegen nach § 394 FamFG zu löschen. Die Frist zur Erhebung eines Widerspruchs ist auf einen Monat festgesetzt."
    },
    {
      "date": "2025-05-05",
      "id": "108089",
      "original_text": "Einreichung neuer Dokumente\nThüringen Amtsgericht Jena HRB 205534\nSaalfelder Feengrotten und Tourismus GmbH – Saalfeld/Saale",
      "type": "Einreichung neuer Dokumente",
      "state": "Thüringen",
      "amtsgericht": "Amtsgericht Jena",
      "registernummer": "HRB 205534",
      "registerart": "HRB",
      "company_name": "Saalfelder Feengrotten und Tourismus GmbH",
      "company_seat": "Saalfeld/Saale",
      "details": "05.05.2025 (Bekanntmachungsdatum)\n\nThüringen Amtsgericht Jena HRB 205534\nEinreichung neuer Dokumente 05.11.2024 (Eintragungsdatum)\n\nSaalfelder Feengrotten und Tourismus GmbH\nGesellschaft mit beschränkter Haftung\nSaalfeld/Saale\n\nBekanntmachung gem. § 52 Abs. 3 Satz 2 GmbHG: Aufgrund einer Veränderung in den Personen der Aufsichtsratsmitglieder ist durch die Geschäftsführer eine neue Liste zum Handelsregister eingereicht worden."
    },
    {
      "date": "2025-05-05",
      "id": "108090",
      "original_text": "Löschungsankündigung\nNordrhein-Westfalen Amtsgericht Köln HRB 116500\nIncardine GmbH – Köln",
      "type": "Löschungsankündigung",
      "state": "Nordrhein-Westfalen",
      "amtsgericht": "Amtsgericht Köln",
      "registernummer": "HRB 116500",
      "registerart": "HRB",
      "company_name": "Incardine GmbH",
      "company_seat": "Köln",
      "details": "05.05.2025 (Bekanntmachungsdatum)\n\nNordrhein-Westfalen Amtsgericht Köln HRB 116500\nLöschungsankündigung\n\nIncardine GmbH\nGesellschaft mit beschränkter Haftung\nKöln\n\nDas Registergericht beabsichtigt die Gesellschaft von Amts wegen nach § 394 FamFG zu löschen. Die Frist zur Erhebung eines Widerspruchs ist auf zwei Monate festgesetzt."
    },
    {
      "date": "2025-05-05",
      "id": "108091",
      "original_text": "Löschungsankündigung\nNordrhein-Westfalen Amtsgericht Köln HRB 112229\nEntfaltungsHolding GmbH – Köln",
      "type": "Löschungsankündigung",
      "state": "Nordrhein-Westfalen",
      "amtsgericht": "Amtsgericht Köln",
      "registernummer": "HRB 112229",
      "registerart": "HRB",
      "company_name": "EntfaltungsHolding GmbH",
      "company_seat": "Köln",
      "details": "05.05.2025 (Bekanntmachungsdatum)\n\nNordrhein-Westfalen Amtsgericht Köln HRB 112229\nLöschungsankündigung\n\nEntfaltungsHolding GmbH\nGesellschaft mit beschränkter Haftung\nKöln\n\nDas Registergericht beabsichtigt die Gesellschaft von Amts wegen nach § 394 FamFG zu löschen. Die Frist zur Erhebung eines Widerspruchs ist auf einen Monat festgesetzt."
    },
    {
      "date": "2025-05-05",
      "id": "108092",
      "original_text": "Einreichung neuer Dokumente\nHessen Amtsgericht Darmstadt HRB 96587\ninnovIT360 AG – Seeheim-Jugenheim",
      "type": "Einreichung neuer Dokumente",
      "state": "Hessen",
      "amtsgericht": "Amtsgericht Darmstadt",
      "registernummer": "HRB 96587",
      "registerart": "HRB",
      "company_name": "innovIT360 AG",
      "company_seat": "Seeheim-Jugenheim",
      "details": "05.05.2025 (Bekanntmachungsdatum)\n\nHessen Amtsgericht Darmstadt HRB 96587\nEinreichung neuer Dokumente 05.05.2025 (Eintragungsdatum)\n\ninnovIT360 AG\nAktiengesellschaft\nSeeheim-Jugenheim\n\nWegen Änderungen in den Personen der Aufsichtsratsmitglieder ist eine Liste der Mitglieder des Aufsichtsrates zum Handelsregister eingereicht worden."
    },
    {
      "date": "2025-05-05",
      "id": "108093",
      "original_text": "Registerbekanntmachung nach dem Umwandlungsgesetz\nHessen Amtsgericht Frankfurt am Main HRB 25072\nDEGECOMO Grundstücksverwaltungsgesellschaft mbH – Eschborn",
      "type": "Registerbekanntmachung nach dem Umwandlungsgesetz",
      "state": "Hessen",
      "amtsgericht": "Amtsgericht Frankfurt am Main",
      "registernummer": "HRB 25072",
      "registerart": "HRB",
      "company_name": "DEGECOMO Grundstücksverwaltungsgesellschaft mbH",
      "company_seat": "Eschborn",
      "details": "05.05.2025 (Bekanntmachungsdatum)\n\nHessen Amtsgericht Frankfurt am Main HRB 25072\nRegisterbekanntmachung nach dem Umwandlungsgesetz 05.05.2025 (Eintragungsdatum)\n\nDEGECOMO Grundstücksverwaltungsgesellschaft mbH\nGesellschaft mit beschränkter Haftung\nEschborn\n\nDen Gläubigern der an der #DV.UmF(Text=\"Bitte wählen Sie die zutreffende Art nach UmwG aus!\",Eingabe=\"Verschmelzung\",\"Aufspaltung\",\"Abspaltung\",\"Ausgliederung\",\"Vermögensübertragung\",\"formwechselnden Umwandlung\") beteiligten Rechtsträger ist, wenn sie binnen sechs Monaten nach dem Tag, an dem die Eintragung der #DV.UmF in das Register des Sitzes #DV.RTr(Text=\"Bitte wählen Sie aus, ob ein oder mehrere andere Rechtsträger betroffen sind!\",Eingabe=\"desjenigen Rechtsträgers, dessen Gläubiger\",\"derjenigen Rechtsträger deren Gläubiger\") sie sind, nach #DV.Auswahl(Text=\"Bitte wählen Sie die zutreffende Vorschrift aus!\",Eingabe=\"§ 19 Absatz 3 UmwG\"|\"§ 19 Absatz 3 UmwG (=Verschmelzung)\",\"§§ 122a Absatz 2, 19 Absatz 3 UmwG\"|\"§§ 122a Absatz 2, 19 Absatz 3 UmwG (=grenzüberschreitende Verschmelzung)\",\"§§ 125, 19 Absatz 3 UmwG\"|\"§§ 125, 19 Absatz 3 UmwG (=Spaltung)\",\"§ 201 UmwG\"|\"§ 201 UmwG (=Formwechsel)\",\"#insert(Text=\"Freitext\") UmwG\"|\"freie Eingabe\") bekannt gemacht worden ist, ihren Anspruch nach Grund und Höhe schriftlich anmelden, Sicherheit zu leisten, soweit sie nicht Befriedigung verlangen können. Dieses Recht steht den Gläubigern jedoch nur zu, wenn sie glaubhaft machen, dass durch die #DV.UmF die Erfüllung ihrer Forderung gefährdet wird."
    },
    {
      "date": "2025-05-05",
      "id": "108094",
      "original_text": "Registerbekanntmachung nach dem Umwandlungsgesetz\nHessen Amtsgericht Frankfurt am Main HRB 79923\nAURIGA GmbH – Eschborn",
      "type": "Registerbekanntmachung nach dem Umwandlungsgesetz",
      "state": "Hessen",
      "amtsgericht": "Amtsgericht Frankfurt am Main",
      "registernummer": "HRB 79923",
      "registerart": "HRB",
      "company_name": "AURIGA GmbH",
      "company_seat": "Eschborn",
      "details": "05.05.2025 (Bekanntmachungsdatum)\n\nHessen Amtsgericht Frankfurt am Main HRB 79923\nRegisterbekanntmachung nach dem Umwandlungsgesetz 05.05.2025 (Eintragungsdatum)\n\nAURIGA GmbH\nGesellschaft mit beschränkter Haftung\nEschborn\n\nDen Gläubigern der an der Verschmelzung beteiligten Rechtsträger ist, wenn sie binnen sechs Monaten nach dem Tag, an dem die Eintragung der Verschmelzung in das Register des Sitzes derjenigen Rechtsträger deren Gläubiger sie sind, nach § 19 Absatz 3 UmwG bekannt gemacht worden ist, ihren Anspruch nach Grund und Höhe schriftlich anmelden, Sicherheit zu leisten, soweit sie nicht Befriedigung verlangen können. Dieses Recht steht den Gläubigern jedoch nur zu, wenn sie glaubhaft machen, dass durch die Verschmelzung die Erfüllung ihrer Forderung gefährdet wird."
    },
    {
      "date": "2025-05-05",
      "id": "108095",
      "original_text": "Registerbekanntmachung nach dem Umwandlungsgesetz\nHessen Amtsgericht Frankfurt am Main HRB 36135\nDEGENITOR Grundstücksverwaltungsgesellschaft mbH – Eschborn",
      "type": "Registerbekanntmachung nach dem Umwandlungsgesetz",
      "state": "Hessen",
      "amtsgericht": "Amtsgericht Frankfurt am Main",
      "registernummer": "HRB 36135",
      "registerart": "HRB",
      "company_name": "DEGENITOR Grundstücksverwaltungsgesellschaft mbH",
      "company_seat": "Eschborn",
      "details": "05.05.2025 (Bekanntmachungsdatum)\n\nHessen Amtsgericht Frankfurt am Main HRB 36135\nRegisterbekanntmachung nach dem Umwandlungsgesetz 05.05.2025 (Eintragungsdatum)\n\nDEGENITOR Grundstücksverwaltungsgesellschaft mbH\nGesellschaft mit beschränkter Haftung\nEschborn\n\nDen Gläubigern der an der Verschmelzung beteiligten Rechtsträger ist, wenn sie binnen sechs Monaten nach dem Tag, an dem die Eintragung der Verschmelzung in das Register des Sitzes derjenigen Rechtsträger deren Gläubiger sie sind, nach § 19 Absatz 3 UmwG bekannt gemacht worden ist, ihren Anspruch nach Grund und Höhe schriftlich anmelden, Sicherheit zu leisten, soweit sie nicht Befriedigung verlangen können. Dieses Recht steht den Gläubigern jedoch nur zu, wenn sie glaubhaft machen, dass durch die Verschmelzung die Erfüllung ihrer Forderung gefährdet wird."
    },
    {
      "date": "2025-05-05",
      "id": "108096",
      "original_text": "Löschungsankündigung\nHessen Amtsgericht Wiesbaden HRA 10423\nRestoral GmbH & Co.KG – Schlangenbad",
      "type": "Löschungsankündigung",
      "state": "Hessen",
      "amtsgericht": "Amtsgericht Wiesbaden",
      "registernummer": "HRA 10423",
      "registerart": "HRA",
      "company_name": "Restoral GmbH & Co.KG",
      "company_seat": "Schlangenbad",
      "details": "05.05.2025 (Bekanntmachungsdatum)\n\nHessen Amtsgericht Wiesbaden HRA 10423\nLöschungsankündigung\n\nRestoral GmbH & Co.KG\nKommanditgesellschaft\nSchlangenbad\n\nDas Registergericht beabsichtigt die im Handelsregister eingetragene Firma von Amts wegen nach § 394 FamFG zu löschen. Die Frist zur Erhebung eines Widerspruchs gegen die beabsichtigte Löschung wird auf 3 Monate festgesetzt."
    },
    {
      "date": "2025-05-05",
      "id": "108097",
      "original_text": "Löschungsankündigung\nHessen Amtsgericht Offenbach am Main HRB 49206\nALL IN GmbH – Offenbach am Main",
      "type": "Löschungsankündigung",
      "state": "Hessen",
      "amtsgericht": "Amtsgericht Offenbach am Main",
      "registernummer": "HRB 49206",
      "registerart": "HRB",
      "company_name": "ALL IN GmbH",
      "company_seat": "Offenbach am Main",
      "details": "05.05.2025 (Bekanntmachungsdatum)\n\nHessen Amtsgericht Offenbach am Main HRB 49206\nLöschungsankündigung\n\nALL IN GmbH\nGesellschaft mit beschränkter Haftung\nOffenbach am Main\n\nDas Registergericht beabsichtigt die im Handelsregister eingetragene Gesellschaft von Amts wegen nach § 394 FamFG zu löschen. Die Frist zur Erhebung eines Widerspruchs gegen die beabsichtigte Löschung wird auf 3 Monate festgesetzt"
    },
    {
      "date": "2025-05-05",
      "id": "108098",
      "original_text": "Sonstige Registerbekanntmachung\nHessen Amtsgericht Darmstadt VR 1930\nHeimat- und Verschönerungsverein Seeheim a.d. Bergstraße e.V. – Seeheim-Jugenheim",
      "type": "Sonstige Registerbekanntmachung",
      "state": "Hessen",
      "amtsgericht": "Amtsgericht Darmstadt",
      "registernummer": "VR 1930",
      "registerart": "VR",
      "company_name": "Heimat- und Verschönerungsverein Seeheim a.d. Bergstraße e.V.",
      "company_seat": "Seeheim-Jugenheim",
      "details": "05.05.2025 (Bekanntmachungsdatum)\n\nHessen Amtsgericht Darmstadt VR 1930\nSonstige Registerbekanntmachung 05.05.2025 (Eintragungsdatum)\n\nHeimat- und Verschönerungsverein Seeheim a.d. Bergstraße e.V.\neingetragener Verein\nSeeheim-Jugenheim\n\nDer Verein ist aufgelöst."
    },
    {
      "date": "2025-05-05",
      "id": "108099",
      "original_text": "Löschungsankündigung\nHessen Amtsgericht Wiesbaden HRB 29815\nLiman Bau GmbH – Wiesbaden",
      "type": "Löschungsankündigung",
      "state": "Hessen",
      "amtsgericht": "Amtsgericht Wiesbaden",
      "registernummer": "HRB 29815",
      "registerart": "HRB",
      "company_name": "Liman Bau GmbH",
      "company_seat": "Wiesbaden",
      "details": "05.05.2025 (Bekanntmachungsdatum)\n\nHessen Amtsgericht Wiesbaden HRB 29815\nLöschungsankündigung\n\nLiman Bau GmbH\nGesellschaft mit beschränkter Haftung\nWiesbaden\n\nDas Registergericht beabsichtigt die im Handelsregister eingetragene Gesellschaft von Amts wegen nach § 394 FamFG zu löschen. Die Frist zur Erhebung eines Widerspruchs gegen die beabsichtigte Löschung wird auf 3 Monate festgesetzt."
    },
    {
      "date": "2025-05-05",
      "id": "108100",
      "original_text": "Registerbekanntmachung nach dem Umwandlungsgesetz\nHessen Amtsgericht Frankfurt am Main HRB 105687\nflatexDEGIRO Bank AG – Frankfurt am Main",
      "type": "Registerbekanntmachung nach dem Umwandlungsgesetz",
      "state": "Hessen",
      "amtsgericht": "Amtsgericht Frankfurt am Main",
      "registernummer": "HRB 105687",
      "registerart": "HRB",
      "company_name": "flatexDEGIRO Bank AG",
      "company_seat": "Frankfurt am Main",
      "details": "05.05.2025 (Bekanntmachungsdatum)\n\nHessen Amtsgericht Frankfurt am Main HRB 105687\nRegisterbekanntmachung nach dem Umwandlungsgesetz 05.05.2025 (Eintragungsdatum)\n\nflatexDEGIRO Bank AG\nAktiengesellschaft\nFrankfurt am Main\n\nEs wird darauf hingewiesen, dass ein Verschmelzungsplan oder sein Entwurf über eine grenzüberschreitende Verschmelzung zur Aufnahme mit der flatex Projektgesellschaft Beta AG  mit Sitz in Wien/Österreich (Firmenbuch des Handelsgerichts Wien unter FN649961 a) beim Handelsregister eingereicht worden ist.\n\nDie Anteilsinhaber, die Gläubiger sowie die zuständigen Betriebsräte der an der grenzüberschreitenden Verschmelzung beteiligten Gesellschaften oder, soweit es keinen Betriebsrat gibt, die Arbeitnehmer der an der grenzüberschreitenden Verschmelzung beteiligten Gesellschaften, können der jeweiligen Gesellschaft spätestens fünf Arbeitstage vor dem Tag der Hauptversammlung Bemerkungen zum Verschmelzungsplan übermitteln."
    },
    {
      "date": "2025-05-05",
      "id": "108101",
      "original_text": "Registerbekanntmachung nach dem Umwandlungsgesetz\nHessen Amtsgericht Frankfurt am Main HRB 22009\nDURO Grundstücksverwaltungsgesellschaft mbH – Eschborn",
      "type": "Registerbekanntmachung nach dem Umwandlungsgesetz",
      "state": "Hessen",
      "amtsgericht": "Amtsgericht Frankfurt am Main",
      "registernummer": "HRB 22009",
      "registerart": "HRB",
      "company_name": "DURO Grundstücksverwaltungsgesellschaft mbH",
      "company_seat": "Eschborn",
      "details": "05.05.2025 (Bekanntmachungsdatum)\n\nHessen Amtsgericht Frankfurt am Main HRB 22009\nRegisterbekanntmachung nach dem Umwandlungsgesetz 05.05.2025 (Eintragungsdatum)\n\nDURO Grundstücksverwaltungsgesellschaft mbH\nGesellschaft mit beschränkter Haftung\nEschborn\n\nDen Gläubigern der an der Verschmelzung beteiligten Rechtsträger ist, wenn sie binnen sechs Monaten nach dem Tag, an dem die Eintragung der Verschmelzung in das Register des Sitzes derjenigen Rechtsträger deren Gläubiger sie sind, nach § 19 Absatz 3 UmwG bekannt gemacht worden ist, ihren Anspruch nach Grund und Höhe schriftlich anmelden, Sicherheit zu leisten, soweit sie nicht Befriedigung verlangen können. Dieses Recht steht den Gläubigern jedoch nur zu, wenn sie glaubhaft machen, dass durch die Verschmelzung die Erfüllung ihrer Forderung gefährdet wird."
    },
    {
      "date": "2025-05-05",
      "id": "108102",
      "original_text": "Löschungsankündigung\nHessen Amtsgericht Frankfurt am Main HRB 106549\nAvers Intelligence Systems GmbH – Frankfurt am Main",
      "type": "Löschungsankündigung",
      "state": "Hessen",
      "amtsgericht": "Amtsgericht Frankfurt am Main",
      "registernummer": "HRB 106549",
      "registerart": "HRB",
      "company_name": "Avers Intelligence Systems GmbH",
      "company_seat": "Frankfurt am Main",
      "details": "05.05.2025 (Bekanntmachungsdatum)\n\nHessen Amtsgericht Frankfurt am Main HRB 106549\nLöschungsankündigung 04.05.2025 (Eintragungsdatum)\n\nAvers Intelligence Systems GmbH\nGesellschaft mit beschränkter Haftung\nFrankfurt am Main\n\nDas Registergericht beabsichtigt die im Handelsregister eingetragene Gesellschaft von Amts wegen nach § 394 FamFG zu löschen. Die Frist zur Erhebung eines Widerspruchs gegen die beabsichtigte Löschung wird auf 1 Monat festgesetzt."
    },
    {
      "date": "2025-05-05",
      "id": "108103",
      "original_text": "Registerbekanntmachung nach dem Umwandlungsgesetz\nHessen Amtsgericht Frankfurt am Main HRB 31040\nUBS Asset Management (Deutschland) GmbH – Frankfurt am Main",
      "type": "Registerbekanntmachung nach dem Umwandlungsgesetz",
      "state": "Hessen",
      "amtsgericht": "Amtsgericht Frankfurt am Main",
      "registernummer": "HRB 31040",
      "registerart": "HRB",
      "company_name": "UBS Asset Management (Deutschland) GmbH",
      "company_seat": "Frankfurt am Main",
      "details": "05.05.2025 (Bekanntmachungsdatum)\n\nHessen Amtsgericht Frankfurt am Main HRB 31040\nRegisterbekanntmachung nach dem Umwandlungsgesetz\n\nUBS Asset Management (Deutschland) GmbH\nGesellschaft mit beschränkter Haftung\nFrankfurt am Main\n\nEs wird darauf hingewiesen, dass ein Verschmelzungsplan oder sein Entwurf über eine grenzüberschreitende Verschmelzung zur Aufnahme mit der UBS\nAsset Management (Europe) S.A., eine Aktiengesellschaft (société anonyme)\nluxemburgischen Rechts mit Sitz in Luxemburg, Großherzogtum Luxemburg, eingetragen im luxemburgischen Handels- und Firmenregister (Registre de Commerce et des Sociétés) unter der Registernummer B154210 beim Handelsregister eingereicht worden ist.\n\nDie Anteilsinhaber, die Gläubiger sowie die zuständigen Betriebsräte der an der grenzüberschreitenden Verschmelzung beteiligten Gesellschaften oder, soweit es keinen Betriebsrat gibt, die Arbeitnehmer der an der grenzüberschreitenden Verschmelzung beteiligten Gesellschaften, können der jeweiligen Gesellschaft spätestens fünf Arbeitstage vor dem Tag der Gesellschafterversammlung Bemerkungen zum Verschmelzungsplan übermitteln.\n\na) Zu § 308 Abs. 1 Satz 2 Nr. 1 UmwG: Der Entwurf des gemeinsamen\nVerschmelzungsplans betreffend die grenzüberschreitende Verschmelzung der UBS\nAsset Management (Deutschland) GmbH (übertragende Gesellschaft) auf die UBS\nAsset Management (Europe) S.A. (übernehmende Gesellschaft) wurde beim Handelsregister des Amtsgerichts Frankfurt am Main eingereicht.\nb) Zu § 308 Abs. 1 Satz 2 Nr. 2 UmwG: An der Verschmelzung sind folgende\nRechtsträger beteiligt:\naa) UBS Asset Management (Deutschland) GmbH mit Sitz in Frankfurt am Main,\neingetragen im Handelsregister des Amtsgerichts Frankfurt am Main unter der\nRegisternummer HRB 31040 und mit eingetragener Geschäftsanschrift in\nBockenheimer Landstraße 2-4, 60306 Frankfurt am Main, Deutschland, als\nübertragende Gesellschaft;\nbb) UBS Asset Management (Europe) S.A., eine Aktiengesellschaft (société\nanonyme) luxemburgischen Rechts mit Sitz in Luxemburg, Großherzogtum\nLuxemburg, eingetragen im luxemburgischen Handels- und Firmenregister\n(Registre de Commerce et des Sociétés) unter der Registernummer B154210 und\nmit eingetragener Geschäftsanschrift in 33A, avenue John F. Kennedy, 1855\nLuxemburg, Großherzogtum Luxemburg, als übernehmende Gesellschaft.\nc) Zu § 308 Abs. 1 Satz 2 Nr. 3 UmwG: Die Registerangaben zu den beteiligten\nGesellschaften lauten wie folgt:\naa) UBS Asset Management (Deutschland) GmbH, die übertragende Gesellschaft, ist im Handelsregister des Amtsgerichts Frankfurt am Main unter der\nRegisternummer HRB 31040 eingetragen.\nbb) UBS Asset Management (Europe) S.A, die übernehmende Gesellschaft, ist im\nluxemburgischen Handels- und Firmenregister (Registre de Commerce et des\nSociétés) unter der Registernummer B154210 eingetragen.\nd) Zu § 308 Abs. 1 Satz 2 Nr. 4 UmwG: Gemäß §§ 312 Abs. 2, 307 Abs. 3 Nr. 2 lit. a UmwG bedarf es keines Beschlusses der Gesellschafterversammlung der UBS Asset Management (Deutschland) GmbH als übertragender Gesellschaft über die\nZustimmung zum gemeinsamen Verschmelzungsplan, da alle Anteile der UBS Asset\nManagement (Deutschland) GmbH als übertragender Gesellschaft sowie der UBS\nAsset Management (Europe) S.A. als übernehmender Gesellschaft von der UBS Asset Management AG mit Sitz in Zürich, Schweiz, gehalten werden und der UBS Asset Management AG als Alleingesellschafterin der UBS Asset Management (Deutschland) GmbH als übertragender Gesellschaft keine Anteile gewährt werden.\nMaßgeblicher Bezugszeitpunkt für die UBS Asset Management (Deutschland) GmbH\nist nach § 308 Abs. 2 UmwG daher der Tag, an dem der Verschmelzungsplan über die grenzüberschreitende Verschmelzung notariell beurkundet werden soll. Die notarielle Beurkundung des Verschmelzungsplans soll voraussichtlich Mitte Juni 2025 erfolgen.\nDie Hauptversammlung (assemblée générale) der UBS Asset Management (Europe)\nS.A., in der über die Zustimmung zum Verschmelzungsplan Beschluss gefasst werden soll, soll am 1. Oktober 2025 stattfinden.\nAktionäre, Gläubiger sowie die zuständigen Betriebsräte und, soweit einschlägig, die\nArbeitnehmer der UBS Asset Management (Deutschland) GmbH sowie der UBS Asset Management (Europe) S.A. können der UBS Asset Management (Deutschland) GmbH spätestens fünf Arbeitstage vor dem Tag, an dem der Verschmelzungsplan beurkundet wird, Bemerkungen zum Entwurf des Verschmelzungsplans übermitteln.\nAktionäre, Gläubiger sowie die zuständigen Betriebsräte und, soweit einschlägig, die\nArbeitnehmer der UBS Asset Management (Deutschland) GmbH sowie der UBS Asset Management (Europe) S.A. können der UBS Asset Management (Europe) S.A. spätestens fünf Arbeitstage vor dem Tag der Hauptversammlung der UBS Asset Management (Europe) S.A. Bemerkungen zum Verschmelzungsplan bzw. zu dessen Entwurf übermitteln."
    }
  ]
}