{
  "date": "2025-05-29",
  "date_of_scrape": "2025-05-30T10:22:29.172Z",
  "tool_version": "0.2.0",
  "number_of_announcements": 35,
  "announcements": [
    {
      "date": "2025-05-29",
      "id": "110600",
      "original_text": "Löschungsankündigung\nBayern Amtsgericht Nürnberg HRB 33266\nC.M.E. Global GmbH – Nürnberg",
      "type": "Löschungsankündigung",
      "state": "Bayern",
      "amtsgericht": "Amtsgericht Nürnberg",
      "registernummer": "HRB 33266",
      "registerart": "HRB",
      "company_name": "C.M.E. Global GmbH",
      "company_seat": "Nürnberg",
      "details": "29.05.2025 (Bekanntmachungsdatum)\n\nBayern Amtsgericht Nürnberg HRB 33266\nLöschungsankündigung\n\nC.M.E. Global GmbH\nGesellschaft mit beschränkter Haftung\nNürnberg\n\nDas Registergericht beabsichtigt, die im Handelsregister eingetragene Gesellschaft wegen Vermögenslosigkeit von Amts wegen nach § 394 FamFG zu löschen. #insert(Text=\"zztb_V_Widerspruchsfrist\")"
    },
    {
      "date": "2025-05-29",
      "id": "110601",
      "original_text": "Sonstige Registerbekanntmachung\nBayern Amtsgericht Nürnberg HRB 40312\nFABRI AG – Nürnberg",
      "type": "Sonstige Registerbekanntmachung",
      "state": "Bayern",
      "amtsgericht": "Amtsgericht Nürnberg",
      "registernummer": "HRB 40312",
      "registerart": "HRB",
      "company_name": "FABRI AG",
      "company_seat": "Nürnberg",
      "details": "29.05.2025 (Bekanntmachungsdatum)\n\nBayern Amtsgericht Nürnberg HRB 40312\nSonstige Registerbekanntmachung\n\nFABRI AG\nAktiengesellschaft\nNürnberg\n\nDem Amtsgericht Nürnberg -Registergericht- ist eine Liste der Mitglieder des Aufsichtsrats eingereicht worden, § 106 AktG."
    },
    {
      "date": "2025-05-29",
      "id": "110602",
      "original_text": "Registerbekanntmachung nach dem Umwandlungsgesetz\nBayern Amtsgericht Fürth HRB 11264\nI. und R. Böhm Immobilien Verwaltungs GmbH – Uttenreuth",
      "type": "Registerbekanntmachung nach dem Umwandlungsgesetz",
      "state": "Bayern",
      "amtsgericht": "Amtsgericht Fürth",
      "registernummer": "HRB 11264",
      "registerart": "HRB",
      "company_name": "I. und R. Böhm Immobilien Verwaltungs GmbH",
      "company_seat": "Uttenreuth",
      "details": "29.05.2025 (Bekanntmachungsdatum)\n\nBayern Amtsgericht Fürth HRB 11264\nRegisterbekanntmachung nach dem Umwandlungsgesetz 28.05.2025 (Eintragungsdatum)\n\nI. und R. Böhm Immobilien Verwaltungs GmbH\nGesellschaft mit beschränkter Haftung\nUttenreuth\n\nDen Gläubigern der an der Verschmelzung beteiligten Rechtsträger ist, wenn sie binnen sechs Monaten nach dem Tag, an dem die Eintragung der Verschmelzung in das Register des Sitzes desjenigen Rechtsträgers, dessen Gläubiger sie sind, nach § 19 Abs. 3 UmwG als bekannt gemacht gilt, ihren Anspruch nach Grund und Höhe in Textform anmelden, Sicherheit zu leisten, soweit sie nicht Befriedigung verlangen können. Dieses Recht steht den Gläubigern jedoch nur zu, wenn sie glaubhaft machen, dass durch die Verschmelzung die Erfüllung ihrer Forderung gefährdet wird."
    },
    {
      "date": "2025-05-29",
      "id": "110603",
      "original_text": "Registerbekanntmachung nach dem Umwandlungsgesetz\nBayern Amtsgericht Nürnberg HRB 22240\nLindenhof Resort & Events GmbH – Pommelsbrunn",
      "type": "Registerbekanntmachung nach dem Umwandlungsgesetz",
      "state": "Bayern",
      "amtsgericht": "Amtsgericht Nürnberg",
      "registernummer": "HRB 22240",
      "registerart": "HRB",
      "company_name": "Lindenhof Resort & Events GmbH",
      "company_seat": "Pommelsbrunn",
      "details": "29.05.2025 (Bekanntmachungsdatum)\n\nBayern Amtsgericht Nürnberg HRB 22240\nRegisterbekanntmachung nach dem Umwandlungsgesetz 28.05.2025 (Eintragungsdatum)\n\nLindenhof Resort & Events GmbH\nGesellschaft mit beschränkter Haftung\nPommelsbrunn\n\nDen Gläubigern der an der Verschmelzung beteiligten Rechtsträger ist, wenn sie binnen sechs Monaten nach dem Tag, an dem die Eintragung der Verschmelzung in das Register des Sitzes desjenigen Rechtsträgers, dessen Gläubiger sie sind, nach § 19 Abs. 3 UmwG als bekannt gemacht gilt, ihren Anspruch nach Grund und Höhe in Textform anmelden, Sicherheit zu leisten, soweit sie nicht Befriedigung verlangen können. Dieses Recht steht den Gläubigern jedoch nur zu, wenn sie glaubhaft machen, dass durch die Verschmelzung die Erfüllung ihrer Forderung gefährdet wird."
    },
    {
      "date": "2025-05-29",
      "id": "110604",
      "original_text": "Löschungsankündigung\nBayern Amtsgericht Nürnberg HRB 30270\nRB Datenservice Unternehmensberatungs UG (haftungsbeschränkt) – Schwabach",
      "type": "Löschungsankündigung",
      "state": "Bayern",
      "amtsgericht": "Amtsgericht Nürnberg",
      "registernummer": "HRB 30270",
      "registerart": "HRB",
      "company_name": "RB Datenservice Unternehmensberatungs UG (haftungsbeschränkt)",
      "company_seat": "Schwabach",
      "details": "29.05.2025 (Bekanntmachungsdatum)\n\nBayern Amtsgericht Nürnberg HRB 30270\nLöschungsankündigung\n\nRB Datenservice Unternehmensberatungs UG (haftungsbeschränkt)\nGesellschaft mit beschränkter Haftung\nSchwabach\n\nDas Registergericht beabsichtigt, die im Handelsregister eingetragene Gesellschaft wegen Vermögenslosigkeit von Amts wegen nach § 394 FamFG zu löschen. Die Frist zur Erhebung eines Widerspruchs ist auf einen Monat festgesetzt."
    },
    {
      "date": "2025-05-29",
      "id": "110605",
      "original_text": "Löschungsankündigung\nBayern Amtsgericht Coburg HRB 6203\nENTEKO UG (haftungsbeschränkt) – Coburg",
      "type": "Löschungsankündigung",
      "state": "Bayern",
      "amtsgericht": "Amtsgericht Coburg",
      "registernummer": "HRB 6203",
      "registerart": "HRB",
      "company_name": "ENTEKO UG (haftungsbeschränkt)",
      "company_seat": "Coburg",
      "details": "29.05.2025 (Bekanntmachungsdatum)\n\nBayern Amtsgericht Coburg HRB 6203\nLöschungsankündigung\n\nENTEKO UG (haftungsbeschränkt)\nGesellschaft mit beschränkter Haftung\nCoburg\n\nDas Registergericht beabsichtigt, die im Handelsregister eingetragene Gesellschaft wegen Vermögenslosigkeit von Amts wegen nach § 394 FamFG zu löschen. Die Frist zur Erhebung eines Widerspruchs ist auf sechs Wochen festgesetzt."
    },
    {
      "date": "2025-05-29",
      "id": "110606",
      "original_text": "Einreichung neuer Dokumente\nBayern Amtsgericht Würzburg HRB 12947\nPENTADOC AG – Würzburg",
      "type": "Einreichung neuer Dokumente",
      "state": "Bayern",
      "amtsgericht": "Amtsgericht Würzburg",
      "registernummer": "HRB 12947",
      "registerart": "HRB",
      "company_name": "PENTADOC AG",
      "company_seat": "Würzburg",
      "details": "29.05.2025 (Bekanntmachungsdatum)\n\nBayern Amtsgericht Würzburg HRB 12947\nEinreichung neuer Dokumente 28.05.2025 (Eintragungsdatum)\n\nPENTADOC AG\nAktiengesellschaft\nWürzburg\n\nDem #Re.Name ist eine Liste der Mitglieder des Aufsichtsrats eingereicht worden, § 106 AktG."
    },
    {
      "date": "2025-05-29",
      "id": "110607",
      "original_text": "Einreichung neuer Dokumente\nBayern Amtsgericht Würzburg HRB 12947\nPENTADOC AG – Würzburg",
      "type": "Einreichung neuer Dokumente",
      "state": "Bayern",
      "amtsgericht": "Amtsgericht Würzburg",
      "registernummer": "HRB 12947",
      "registerart": "HRB",
      "company_name": "PENTADOC AG",
      "company_seat": "Würzburg",
      "details": "29.05.2025 (Bekanntmachungsdatum)\n\nBayern Amtsgericht Würzburg HRB 12947\nEinreichung neuer Dokumente 28.05.2025 (Eintragungsdatum)\n\nPENTADOC AG\nAktiengesellschaft\nWürzburg\n\nDem Amtsgericht Würzburg -Registergericht- ist eine Liste der Mitglieder des Aufsichtsrats eingereicht worden, § 106 AktG."
    },
    {
      "date": "2025-05-29",
      "id": "110608",
      "original_text": "Einreichung neuer Dokumente\nBayern Amtsgericht München HRB 167896\nRandstad Digital Germany AG – München",
      "type": "Einreichung neuer Dokumente",
      "state": "Bayern",
      "amtsgericht": "Amtsgericht München",
      "registernummer": "HRB 167896",
      "registerart": "HRB",
      "company_name": "Randstad Digital Germany AG",
      "company_seat": "München",
      "details": "29.05.2025 (Bekanntmachungsdatum)\n\nBayern Amtsgericht München HRB 167896\nEinreichung neuer Dokumente 28.05.2025 (Eintragungsdatum)\n\nRandstad Digital Germany AG\nAktiengesellschaft\nMünchen\n\nDem Amtsgericht München -Registergericht- ist eine Liste der Mitglieder des Aufsichtsrats eingereicht worden, § 106 AktG."
    },
    {
      "date": "2025-05-29",
      "id": "110609",
      "original_text": "Löschungsankündigung\nBayern Amtsgericht Traunstein HRA 11502\nAR AUTOMOBILE LTD & Co. KG – Rosenheim",
      "type": "Löschungsankündigung",
      "state": "Bayern",
      "amtsgericht": "Amtsgericht Traunstein",
      "registernummer": "HRA 11502",
      "registerart": "HRA",
      "company_name": "AR AUTOMOBILE LTD & Co. KG",
      "company_seat": "Rosenheim",
      "details": "29.05.2025 (Bekanntmachungsdatum)\n\nBayern Amtsgericht Traunstein HRA 11502\nLöschungsankündigung\n\nAR AUTOMOBILE LTD & Co. KG\nKommanditgesellschaft\nRosenheim\n\nDas Registergericht beabsichtigt, die im Handelsregister eingetragene Firma von Amts wegen nach § 31 Abs. 2 HGB, § 393 FamFG zu löschen. Die Frist zur Erhebung eines Widerspruchs ist auf einen Monat festgesetzt."
    },
    {
      "date": "2025-05-29",
      "id": "110610",
      "original_text": "Löschungsankündigung\nBayern Amtsgericht München HRB 265571\nKühn & Kühn GmbH – München",
      "type": "Löschungsankündigung",
      "state": "Bayern",
      "amtsgericht": "Amtsgericht München",
      "registernummer": "HRB 265571",
      "registerart": "HRB",
      "company_name": "Kühn & Kühn GmbH",
      "company_seat": "München",
      "details": "29.05.2025 (Bekanntmachungsdatum)\n\nBayern Amtsgericht München HRB 265571\nLöschungsankündigung\n\nKühn & Kühn GmbH\nGesellschaft mit beschränkter Haftung\nMünchen\n\nDas Registergericht beabsichtigt, die im Handelsregister eingetragene Gesellschaft wegen Vermögenslosigkeit von Amts wegen nach § 394 FamFG zu löschen. Die Frist zur Erhebung eines Widerspruchs ist auf drei Monate festgesetzt."
    },
    {
      "date": "2025-05-29",
      "id": "110611",
      "original_text": "Registerbekanntmachung nach dem Umwandlungsgesetz\nBayern Amtsgericht Landshut HRA 12836\nGünter Schuh Dachdeckerei e.K. – Eching",
      "type": "Registerbekanntmachung nach dem Umwandlungsgesetz",
      "state": "Bayern",
      "amtsgericht": "Amtsgericht Landshut",
      "registernummer": "HRA 12836",
      "registerart": "HRA",
      "company_name": "Günter Schuh Dachdeckerei e.K.",
      "company_seat": "Eching",
      "details": "29.05.2025 (Bekanntmachungsdatum)\n\nBayern Amtsgericht Landshut HRA 12836\nRegisterbekanntmachung nach dem Umwandlungsgesetz 28.05.2025 (Eintragungsdatum)\n\nGünter Schuh Dachdeckerei e.K.\nEinzelkaufmann / Einzelkauffrau\nEching\n\nDen Gläubigern der an der Ausgliederung beteiligten Rechtsträger ist, wenn sie binnen sechs Monaten nach dem Tag, an dem die Eintragung der Ausgliederung in das Register des Sitzes desjenigen Rechtsträgers, dessen Gläubiger sie sind, nach §§ 125, 19 Abs. 3 UmwG als bekannt gemacht gilt, ihren Anspruch nach Grund und Höhe in Textform anmelden, Sicherheit zu leisten, soweit sie nicht Befriedigung verlangen können. Dieses Recht steht den Gläubigern jedoch nur zu, wenn sie glaubhaft machen, dass durch die Ausgliederung die Erfüllung ihrer Forderung gefährdet wird."
    },
    {
      "date": "2025-05-29",
      "id": "110612",
      "original_text": "Löschungsankündigung\nBayern Amtsgericht Coburg HRB 7060\nLandgasthof Schwarzer Adler Verwaltung GmbH – Bad Staffelstein",
      "type": "Löschungsankündigung",
      "state": "Bayern",
      "amtsgericht": "Amtsgericht Coburg",
      "registernummer": "HRB 7060",
      "registerart": "HRB",
      "company_name": "Landgasthof Schwarzer Adler Verwaltung GmbH",
      "company_seat": "Bad Staffelstein",
      "details": "29.05.2025 (Bekanntmachungsdatum)\n\nBayern Amtsgericht Coburg HRB 7060\nLöschungsankündigung\n\nLandgasthof Schwarzer Adler Verwaltung GmbH\nGesellschaft mit beschränkter Haftung\nBad Staffelstein\n\nDas Registergericht beabsichtigt, die im Handelsregister eingetragene Gesellschaft wegen Vermögenslosigkeit von Amts wegen nach § 394 FamFG zu löschen. Die Frist zur Erhebung eines Widerspruchs ist auf sechs Wochen festgesetzt."
    },
    {
      "date": "2025-05-29",
      "id": "110613",
      "original_text": "Registerbekanntmachung nach dem Umwandlungsgesetz\nBayern Amtsgericht Landshut HRB 14828\nSchuh Holding GmbH – Eching",
      "type": "Registerbekanntmachung nach dem Umwandlungsgesetz",
      "state": "Bayern",
      "amtsgericht": "Amtsgericht Landshut",
      "registernummer": "HRB 14828",
      "registerart": "HRB",
      "company_name": "Schuh Holding GmbH",
      "company_seat": "Eching",
      "details": "29.05.2025 (Bekanntmachungsdatum)\n\nBayern Amtsgericht Landshut HRB 14828\nRegisterbekanntmachung nach dem Umwandlungsgesetz 28.05.2025 (Eintragungsdatum)\n\nSchuh Holding GmbH\nGesellschaft mit beschränkter Haftung\nEching\n\nDen Gläubigern der an der Ausgliederung beteiligten Rechtsträger ist, wenn sie binnen sechs Monaten nach dem Tag, an dem die Eintragung der Ausgliederung in das Register des Sitzes desjenigen Rechtsträgers, dessen Gläubiger sie sind, nach §§ 125, 19 Abs. 3 UmwG als bekannt gemacht gilt, ihren Anspruch nach Grund und Höhe in Textform anmelden, Sicherheit zu leisten, soweit sie nicht Befriedigung verlangen können. Dieses Recht steht den Gläubigern jedoch nur zu, wenn sie glaubhaft machen, dass durch die Ausgliederung die Erfüllung ihrer Forderung gefährdet wird."
    },
    {
      "date": "2025-05-29",
      "id": "110614",
      "original_text": "Registerbekanntmachung nach dem Umwandlungsgesetz\nBayern Amtsgericht Fürth HRB 15312\nCAVOG GmbH – Herzogenaurach",
      "type": "Registerbekanntmachung nach dem Umwandlungsgesetz",
      "state": "Bayern",
      "amtsgericht": "Amtsgericht Fürth",
      "registernummer": "HRB 15312",
      "registerart": "HRB",
      "company_name": "CAVOG GmbH",
      "company_seat": "Herzogenaurach",
      "details": "29.05.2025 (Bekanntmachungsdatum)\n\nBayern Amtsgericht Fürth HRB 15312\nRegisterbekanntmachung nach dem Umwandlungsgesetz 28.05.2025 (Eintragungsdatum)\n\nCAVOG GmbH\nGesellschaft mit beschränkter Haftung\nHerzogenaurach\n\nDen Gläubigern der an der Verschmelzung beteiligten Rechtsträger ist, wenn sie binnen sechs Monaten nach dem Tag, an dem die Eintragung der Verschmelzung in das Register des Sitzes desjenigen Rechtsträgers, dessen Gläubiger sie sind, nach § 19 Abs. 3 UmwG als bekannt gemacht gilt, ihren Anspruch nach Grund und Höhe in Textform anmelden, Sicherheit zu leisten, soweit sie nicht Befriedigung verlangen können. Dieses Recht steht den Gläubigern jedoch nur zu, wenn sie glaubhaft machen, dass durch die Verschmelzung die Erfüllung ihrer Forderung gefährdet wird."
    },
    {
      "date": "2025-05-29",
      "id": "110615",
      "original_text": "Registerbekanntmachung nach dem Umwandlungsgesetz\nBayern Amtsgericht Kempten (Allgäu) HRA 11538\nSindermann Wealth Management GmbH & Co. KG – Lindenberg i. Allgäu",
      "type": "Registerbekanntmachung nach dem Umwandlungsgesetz",
      "state": "Bayern",
      "amtsgericht": "Amtsgericht Kempten (Allgäu)",
      "registernummer": "HRA 11538",
      "registerart": "HRA",
      "company_name": "Sindermann Wealth Management GmbH & Co. KG",
      "company_seat": "Lindenberg i. Allgäu",
      "details": "29.05.2025 (Bekanntmachungsdatum)\n\nBayern Amtsgericht Kempten (Allgäu) HRA 11538\nRegisterbekanntmachung nach dem Umwandlungsgesetz 28.05.2025 (Eintragungsdatum)\n\nSindermann Wealth Management GmbH & Co. KG\nKommanditgesellschaft\nLindenberg i. Allgäu\n\nDen Gläubigern der an der Ausgliederung beteiligten Rechtsträger ist, wenn sie binnen sechs Monaten nach dem Tag, an dem die Eintragung der Ausgliederung in das Register des Sitzes desjenigen Rechtsträgers, dessen Gläubiger sie sind, nach §§ 125, 19 Abs. 3 UmwG als bekannt gemacht gilt, ihren Anspruch nach Grund und Höhe in Textform anmelden, Sicherheit zu leisten, soweit sie nicht Befriedigung verlangen können. Dieses Recht steht den Gläubigern jedoch nur zu, wenn sie glaubhaft machen, dass durch die Ausgliederung die Erfüllung ihrer Forderung gefährdet wird."
    },
    {
      "date": "2025-05-29",
      "id": "110616",
      "original_text": "Einreichung neuer Dokumente\nBayern Amtsgericht München HRB 280914\nSteelcase GmbH – München",
      "type": "Einreichung neuer Dokumente",
      "state": "Bayern",
      "amtsgericht": "Amtsgericht München",
      "registernummer": "HRB 280914",
      "registerart": "HRB",
      "company_name": "Steelcase GmbH",
      "company_seat": "München",
      "details": "29.05.2025 (Bekanntmachungsdatum)\n\nBayern Amtsgericht München HRB 280914\nEinreichung neuer Dokumente\n\nSteelcase GmbH\nGesellschaft mit beschränkter Haftung\nMünchen\n\nDem #Re.Name ist eine Liste der Mitglieder des Aufsichtsrats eingereicht worden, § 52 Abs. 3 S. 2 GmbHG."
    },
    {
      "date": "2025-05-29",
      "id": "110617",
      "original_text": "Registerbekanntmachung nach dem Umwandlungsgesetz\nBayern Amtsgericht Nürnberg HRB 31502\nNehemiah Gateway Services GmbH – Pommelsbrunn",
      "type": "Registerbekanntmachung nach dem Umwandlungsgesetz",
      "state": "Bayern",
      "amtsgericht": "Amtsgericht Nürnberg",
      "registernummer": "HRB 31502",
      "registerart": "HRB",
      "company_name": "Nehemiah Gateway Services GmbH",
      "company_seat": "Pommelsbrunn",
      "details": "29.05.2025 (Bekanntmachungsdatum)\n\nBayern Amtsgericht Nürnberg HRB 31502\nRegisterbekanntmachung nach dem Umwandlungsgesetz 28.05.2025 (Eintragungsdatum)\n\nNehemiah Gateway Services GmbH\nGesellschaft mit beschränkter Haftung\nPommelsbrunn\n\nDen Gläubigern der an der Verschmelzung beteiligten Rechtsträger ist, wenn sie binnen sechs Monaten nach dem Tag, an dem die Eintragung der Verschmelzung in das Register des Sitzes desjenigen Rechtsträgers, dessen Gläubiger sie sind, nach § 19 Abs. 3 UmwG als bekannt gemacht gilt, ihren Anspruch nach Grund und Höhe in Textform anmelden, Sicherheit zu leisten, soweit sie nicht Befriedigung verlangen können. Dieses Recht steht den Gläubigern jedoch nur zu, wenn sie glaubhaft machen, dass durch die Verschmelzung die Erfüllung ihrer Forderung gefährdet wird."
    },
    {
      "date": "2025-05-29",
      "id": "110618",
      "original_text": "Registerbekanntmachung nach dem Umwandlungsgesetz\nBayern Amtsgericht München HRA 121024\nVersicherungsbüro Gral, Geschäftsinhaber Alen Grajcevci e.K. – Freising",
      "type": "Registerbekanntmachung nach dem Umwandlungsgesetz",
      "state": "Bayern",
      "amtsgericht": "Amtsgericht München",
      "registernummer": "HRA 121024",
      "registerart": "HRA",
      "company_name": "Versicherungsbüro Gral, Geschäftsinhaber Alen Grajcevci e.K.",
      "company_seat": "Freising",
      "details": "29.05.2025 (Bekanntmachungsdatum)\n\nBayern Amtsgericht München HRA 121024\nRegisterbekanntmachung nach dem Umwandlungsgesetz 28.05.2025 (Eintragungsdatum)\n\nVersicherungsbüro Gral, Geschäftsinhaber Alen Grajcevci e.K.\nEinzelkaufmann / Einzelkauffrau\nFreising\n\nDen Gläubigern der an der Ausgliederung beteiligten Rechtsträger ist, wenn sie binnen sechs Monaten nach dem Tag, an dem die Eintragung der Ausgliederung in das Register des Sitzes desjenigen Rechtsträgers, dessen Gläubiger sie sind, nach §§ 125, 19 Abs. 3 UmwG als bekannt gemacht gilt, ihren Anspruch nach Grund und Höhe in Textform anmelden, Sicherheit zu leisten, soweit sie nicht Befriedigung verlangen können. Dieses Recht steht den Gläubigern jedoch nur zu, wenn sie glaubhaft machen, dass durch die Ausgliederung die Erfüllung ihrer Forderung gefährdet wird."
    },
    {
      "date": "2025-05-29",
      "id": "110619",
      "original_text": "Einreichung neuer Dokumente\nBayern Amtsgericht München HRB 162423\nPfandfinanz Holding AG – Ismaning",
      "type": "Einreichung neuer Dokumente",
      "state": "Bayern",
      "amtsgericht": "Amtsgericht München",
      "registernummer": "HRB 162423",
      "registerart": "HRB",
      "company_name": "Pfandfinanz Holding AG",
      "company_seat": "Ismaning",
      "details": "29.05.2025 (Bekanntmachungsdatum)\n\nBayern Amtsgericht München HRB 162423\nEinreichung neuer Dokumente 28.05.2025 (Eintragungsdatum)\n\nPfandfinanz Holding AG\nAktiengesellschaft\nIsmaning\n\nDem Amtsgericht München -Registergericht- ist eine Liste der Mitglieder des Aufsichtsrats eingereicht worden, § 106 AktG."
    },
    {
      "date": "2025-05-29",
      "id": "110620",
      "original_text": "Registerbekanntmachung nach dem Umwandlungsgesetz\nBayern Amtsgericht München HRA 118303\nThree-7-Project e.K. – Glonn",
      "type": "Registerbekanntmachung nach dem Umwandlungsgesetz",
      "state": "Bayern",
      "amtsgericht": "Amtsgericht München",
      "registernummer": "HRA 118303",
      "registerart": "HRA",
      "company_name": "Three-7-Project e.K.",
      "company_seat": "Glonn",
      "details": "29.05.2025 (Bekanntmachungsdatum)\n\nBayern Amtsgericht München HRA 118303\nRegisterbekanntmachung nach dem Umwandlungsgesetz 28.05.2025 (Eintragungsdatum)\n\nThree-7-Project e.K.\nEinzelkaufmann / Einzelkauffrau\nGlonn\n\nDen Gläubigern der an der Ausgliederung beteiligten Rechtsträger ist, wenn sie binnen sechs Monaten nach dem Tag, an dem die Eintragung der Ausgliederung in das Register des Sitzes desjenigen Rechtsträgers, dessen Gläubiger sie sind, nach §§ 125, 19 Abs. 3 UmwG als bekannt gemacht gilt, ihren Anspruch nach Grund und Höhe in Textform anmelden, Sicherheit zu leisten, soweit sie nicht Befriedigung verlangen können. Dieses Recht steht den Gläubigern jedoch nur zu, wenn sie glaubhaft machen, dass durch die Ausgliederung die Erfüllung ihrer Forderung gefährdet wird."
    },
    {
      "date": "2025-05-29",
      "id": "110621",
      "original_text": "Registerbekanntmachung nach dem Umwandlungsgesetz\nBayern Amtsgericht München HRB 209625\nCWM Beteiligungsgesellschaft mbH – Gräfelfing",
      "type": "Registerbekanntmachung nach dem Umwandlungsgesetz",
      "state": "Bayern",
      "amtsgericht": "Amtsgericht München",
      "registernummer": "HRB 209625",
      "registerart": "HRB",
      "company_name": "CWM Beteiligungsgesellschaft mbH",
      "company_seat": "Gräfelfing",
      "details": "29.05.2025 (Bekanntmachungsdatum)\n\nBayern Amtsgericht München HRB 209625\nRegisterbekanntmachung nach dem Umwandlungsgesetz 28.05.2025 (Eintragungsdatum)\n\nCWM Beteiligungsgesellschaft mbH\nGesellschaft mit beschränkter Haftung\nGräfelfing\n\nDen Gläubigern der an der Verschmelzung beteiligten Rechtsträger ist, wenn sie binnen sechs Monaten nach dem Tag, an dem die Eintragung der Verschmelzung in das Register des Sitzes desjenigen Rechtsträgers, dessen Gläubiger sie sind, nach § 19 Abs. 3 UmwG als bekannt gemacht gilt, ihren Anspruch nach Grund und Höhe in Textform anmelden, Sicherheit zu leisten, soweit sie nicht Befriedigung verlangen können. Dieses Recht steht den Gläubigern jedoch nur zu, wenn sie glaubhaft machen, dass durch die Verschmelzung die Erfüllung ihrer Forderung gefährdet wird."
    },
    {
      "date": "2025-05-29",
      "id": "110622",
      "original_text": "Registerbekanntmachung nach dem Umwandlungsgesetz\nBayern Amtsgericht München HRB 299489\nVEDRA AST Pensions GmbH – München",
      "type": "Registerbekanntmachung nach dem Umwandlungsgesetz",
      "state": "Bayern",
      "amtsgericht": "Amtsgericht München",
      "registernummer": "HRB 299489",
      "registerart": "HRB",
      "company_name": "VEDRA AST Pensions GmbH",
      "company_seat": "München",
      "details": "29.05.2025 (Bekanntmachungsdatum)\n\nBayern Amtsgericht München HRB 299489\nRegisterbekanntmachung nach dem Umwandlungsgesetz 28.05.2025 (Eintragungsdatum)\n\nVEDRA AST Pensions GmbH\nGesellschaft mit beschränkter Haftung\nMünchen\n\nDen Gläubigern der an der Spaltung beteiligten Rechtsträger ist, wenn sie binnen sechs Monaten nach dem Tag, an dem die Eintragung der Spaltung in das Register des Sitzes desjenigen Rechtsträgers, dessen Gläubiger sie sind, nach §§ 125, 19 Abs. 3 UmwG als bekannt gemacht gilt, ihren Anspruch nach Grund und Höhe in Textform anmelden, Sicherheit zu leisten, soweit sie nicht Befriedigung verlangen können. Dieses Recht steht den Gläubigern jedoch nur zu, wenn sie glaubhaft machen, dass durch die Spaltung die Erfüllung ihrer Forderung gefährdet wird."
    },
    {
      "date": "2025-05-29",
      "id": "110623",
      "original_text": "Löschungsankündigung\nBayern Amtsgericht Traunstein HRB 20853\nCasa Lieta GmbH – Bad Reichenhall",
      "type": "Löschungsankündigung",
      "state": "Bayern",
      "amtsgericht": "Amtsgericht Traunstein",
      "registernummer": "HRB 20853",
      "registerart": "HRB",
      "company_name": "Casa Lieta GmbH",
      "company_seat": "Bad Reichenhall",
      "details": "29.05.2025 (Bekanntmachungsdatum)\n\nBayern Amtsgericht Traunstein HRB 20853\nLöschungsankündigung 28.05.2025 (Eintragungsdatum)\n\nCasa Lieta GmbH\nGesellschaft mit beschränkter Haftung\nBad Reichenhall\n\nDas Registergericht beabsichtigt, die im Handelsregister eingetragene Gesellschaft wegen Vermögenslosigkeit von Amts wegen nach § 394 FamFG zu löschen. Die Frist zur Erhebung eines Widerspruchs ist auf drei Monate festgesetzt."
    },
    {
      "date": "2025-05-29",
      "id": "110624",
      "original_text": "Löschungsankündigung\nBayern Amtsgericht Nürnberg HRB 37577\n21 Stories GmbH – Nürnberg",
      "type": "Löschungsankündigung",
      "state": "Bayern",
      "amtsgericht": "Amtsgericht Nürnberg",
      "registernummer": "HRB 37577",
      "registerart": "HRB",
      "company_name": "21 Stories GmbH",
      "company_seat": "Nürnberg",
      "details": "29.05.2025 (Bekanntmachungsdatum)\n\nBayern Amtsgericht Nürnberg HRB 37577\nLöschungsankündigung\n\n21 Stories GmbH\nGesellschaft mit beschränkter Haftung\nNürnberg\n\nDas Registergericht beabsichtigt, die im Handelsregister eingetragene Gesellschaft wegen Vermögenslosigkeit von Amts wegen nach § 394 FamFG zu löschen. Die Frist zur Erhebung eines Widerspruchs ist auf einen Monat festgesetzt."
    },
    {
      "date": "2025-05-29",
      "id": "110625",
      "original_text": "Löschungsankündigung\nBayern Amtsgericht Nürnberg HRB 34280\nGUM Interkost UG (haftungsbeschränkt) – Nürnberg",
      "type": "Löschungsankündigung",
      "state": "Bayern",
      "amtsgericht": "Amtsgericht Nürnberg",
      "registernummer": "HRB 34280",
      "registerart": "HRB",
      "company_name": "GUM Interkost UG (haftungsbeschränkt)",
      "company_seat": "Nürnberg",
      "details": "29.05.2025 (Bekanntmachungsdatum)\n\nBayern Amtsgericht Nürnberg HRB 34280\nLöschungsankündigung\n\nGUM Interkost UG (haftungsbeschränkt)\nGesellschaft mit beschränkter Haftung\nNürnberg\n\nDas Registergericht beabsichtigt, die im Handelsregister eingetragene Gesellschaft wegen Vermögenslosigkeit von Amts wegen nach § 394 FamFG zu löschen. Die Frist zur Erhebung eines Widerspruchs ist auf einen Monat festgesetzt."
    },
    {
      "date": "2025-05-29",
      "id": "110626",
      "original_text": "Löschungsankündigung\nBayern Amtsgericht München HRB 51505\nGHW Gesellschaft für Haustechnik und Wärmewirtschaft mbH – München",
      "type": "Löschungsankündigung",
      "state": "Bayern",
      "amtsgericht": "Amtsgericht München",
      "registernummer": "HRB 51505",
      "registerart": "HRB",
      "company_name": "GHW Gesellschaft für Haustechnik und Wärmewirtschaft mbH",
      "company_seat": "München",
      "details": "29.05.2025 (Bekanntmachungsdatum)\n\nBayern Amtsgericht München HRB 51505\nLöschungsankündigung 28.05.2025 (Eintragungsdatum)\n\nGHW Gesellschaft für Haustechnik und Wärmewirtschaft mbH\nGesellschaft mit beschränkter Haftung\nMünchen\n\nDas Registergericht beabsichtigt, die im Handelsregister eingetragene Gesellschaft wegen Vermögenslosigkeit von Amts wegen nach § 394 FamFG zu löschen. Die Frist zur Erhebung eines Widerspruchs ist auf drei Monate festgesetzt."
    },
    {
      "date": "2025-05-29",
      "id": "110627",
      "original_text": "Registerbekanntmachung nach dem Umwandlungsgesetz\nBayern Amtsgericht Kempten (Allgäu) HRA 10785\nSindermann Investment e. K. – Lindenberg i. Allgäu",
      "type": "Registerbekanntmachung nach dem Umwandlungsgesetz",
      "state": "Bayern",
      "amtsgericht": "Amtsgericht Kempten (Allgäu)",
      "registernummer": "HRA 10785",
      "registerart": "HRA",
      "company_name": "Sindermann Investment e. K.",
      "company_seat": "Lindenberg i. Allgäu",
      "details": "29.05.2025 (Bekanntmachungsdatum)\n\nBayern Amtsgericht Kempten (Allgäu) HRA 10785\nRegisterbekanntmachung nach dem Umwandlungsgesetz 28.05.2025 (Eintragungsdatum)\n\nSindermann Investment e. K.\nEinzelkaufmann / Einzelkauffrau\nLindenberg i. Allgäu\n\nDen Gläubigern der an der Ausgliederung beteiligten Rechtsträger ist, wenn sie binnen sechs Monaten nach dem Tag, an dem die Eintragung der Ausgliederung in das Register des Sitzes desjenigen Rechtsträgers, dessen Gläubiger sie sind, nach §§ 125, 19 Abs. 3 UmwG als bekannt gemacht gilt, ihren Anspruch nach Grund und Höhe in Textform anmelden, Sicherheit zu leisten, soweit sie nicht Befriedigung verlangen können. Dieses Recht steht den Gläubigern jedoch nur zu, wenn sie glaubhaft machen, dass durch die Ausgliederung die Erfüllung ihrer Forderung gefährdet wird."
    },
    {
      "date": "2025-05-29",
      "id": "110628",
      "original_text": "Registerbekanntmachung nach dem Umwandlungsgesetz\nBayern Amtsgericht Bamberg HRA 7042\nFränkische Rohrwerke Gebr. Kirchner GmbH & Co. KG – Königsberg i.B.",
      "type": "Registerbekanntmachung nach dem Umwandlungsgesetz",
      "state": "Bayern",
      "amtsgericht": "Amtsgericht Bamberg",
      "registernummer": "HRA 7042",
      "registerart": "HRA",
      "company_name": "Fränkische Rohrwerke Gebr. Kirchner GmbH & Co. KG",
      "company_seat": "Königsberg i.B.",
      "details": "29.05.2025 (Bekanntmachungsdatum)\n\nBayern Amtsgericht Bamberg HRA 7042\nRegisterbekanntmachung nach dem Umwandlungsgesetz 28.05.2025 (Eintragungsdatum)\n\nFränkische Rohrwerke Gebr. Kirchner GmbH & Co. KG\nKommanditgesellschaft\nKönigsberg i.B.\n\nDen Gläubigern der an der Verschmelzung beteiligten Rechtsträger ist, wenn sie binnen sechs Monaten nach dem Tag, an dem die Eintragung der Verschmelzung in das Register des Sitzes desjenigen Rechtsträgers, dessen Gläubiger sie sind, nach § 19 Abs. 3 UmwG als bekannt gemacht gilt, ihren Anspruch nach Grund und Höhe in Textform anmelden, Sicherheit zu leisten, soweit sie nicht Befriedigung verlangen können. Dieses Recht steht den Gläubigern jedoch nur zu, wenn sie glaubhaft machen, dass durch die Verschmelzung die Erfüllung ihrer Forderung gefährdet wird."
    },
    {
      "date": "2025-05-29",
      "id": "110629",
      "original_text": "Registerbekanntmachung nach dem Umwandlungsgesetz\nBayern Amtsgericht Traunstein HRB 33561\nSaReNi GmbH – Kirchanschöring",
      "type": "Registerbekanntmachung nach dem Umwandlungsgesetz",
      "state": "Bayern",
      "amtsgericht": "Amtsgericht Traunstein",
      "registernummer": "HRB 33561",
      "registerart": "HRB",
      "company_name": "SaReNi GmbH",
      "company_seat": "Kirchanschöring",
      "details": "29.05.2025 (Bekanntmachungsdatum)\n\nBayern Amtsgericht Traunstein HRB 33561\nRegisterbekanntmachung nach dem Umwandlungsgesetz 28.05.2025 (Eintragungsdatum)\n\nSaReNi GmbH\nGesellschaft mit beschränkter Haftung\nKirchanschöring\n\nDen Gläubigern der an der Ausgliederung beteiligten Rechtsträger ist, wenn sie binnen sechs Monaten nach dem Tag, an dem die Eintragung der Ausgliederung in das Register des Sitzes desjenigen Rechtsträgers, dessen Gläubiger sie sind, nach §§ 125, 19 Abs. 3 UmwG als bekannt gemacht gilt, ihren Anspruch nach Grund und Höhe in Textform anmelden, Sicherheit zu leisten, soweit sie nicht Befriedigung verlangen können. Dieses Recht steht den Gläubigern jedoch nur zu, wenn sie glaubhaft machen, dass durch die Ausgliederung die Erfüllung ihrer Forderung gefährdet wird."
    },
    {
      "date": "2025-05-29",
      "id": "110630",
      "original_text": "Löschungsankündigung\nBerlin Amtsgericht Berlin (Charlottenburg) HRB 146632\nMiro Bauelemente UG (haftungsbeschränkt) – Berlin",
      "type": "Löschungsankündigung",
      "state": "Berlin",
      "amtsgericht": "Amtsgericht Berlin (Charlottenburg)",
      "registernummer": "HRB 146632",
      "registerart": "HRB",
      "company_name": "Miro Bauelemente UG (haftungsbeschränkt)",
      "company_seat": "Berlin",
      "details": "29.05.2025 (Bekanntmachungsdatum)\n\nBerlin Amtsgericht Berlin (Charlottenburg) HRB 146632\nLöschungsankündigung\n\nMiro Bauelemente UG (haftungsbeschränkt)\nGesellschaft mit beschränkter Haftung\nBerlin\n\nBei der nachstehenden Gesellschaft wird das Amtslöschungsverfahren gemäß § 394 FamFG eingeleitet. Widerspruchsfrist 6 Wochen"
    },
    {
      "date": "2025-05-29",
      "id": "110631",
      "original_text": "Löschungsankündigung\nBerlin Amtsgericht Berlin (Charlottenburg) HRB 175307\nBaufuerst GmbH – Berlin",
      "type": "Löschungsankündigung",
      "state": "Berlin",
      "amtsgericht": "Amtsgericht Berlin (Charlottenburg)",
      "registernummer": "HRB 175307",
      "registerart": "HRB",
      "company_name": "Baufuerst GmbH",
      "company_seat": "Berlin",
      "details": "29.05.2025 (Bekanntmachungsdatum)\n\nBerlin Amtsgericht Berlin (Charlottenburg) HRB 175307\nLöschungsankündigung\n\nBaufuerst GmbH\nGesellschaft mit beschränkter Haftung\nBerlin\n\nBei der nachstehenden Gesellschaft wird das Amtslöschungsverfahren gemäß § 394 FamFG eingeleitet. Widerspruchsfrist 6 Wochen"
    },
    {
      "date": "2025-05-29",
      "id": "110632",
      "original_text": "Einreichung neuer Dokumente\nBerlin Amtsgericht Berlin (Charlottenburg) HRB 82304\nSchrobsdorff Bau Aktiengesellschaft – Berlin",
      "type": "Einreichung neuer Dokumente",
      "state": "Berlin",
      "amtsgericht": "Amtsgericht Berlin (Charlottenburg)",
      "registernummer": "HRB 82304",
      "registerart": "HRB",
      "company_name": "Schrobsdorff Bau Aktiengesellschaft",
      "company_seat": "Berlin",
      "details": "29.05.2025 (Bekanntmachungsdatum)\n\nBerlin Amtsgericht Berlin (Charlottenburg) HRB 82304\nEinreichung neuer Dokumente\n\nSchrobsdorff Bau Aktiengesellschaft\nAktiengesellschaft\nBerlin\n\nAls nicht eingetragen wird veröffentlicht: Es wurde eine neue Liste der Aufsichtsratsmitglieder eingereicht (§ 106 AktG)."
    },
    {
      "date": "2025-05-29",
      "id": "110633",
      "original_text": "Einreichung neuer Dokumente\nBaden-Württemberg Amtsgericht Stuttgart HRB 740779\nHansgrohe SE – Schiltach",
      "type": "Einreichung neuer Dokumente",
      "state": "Baden-Württemberg",
      "amtsgericht": "Amtsgericht Stuttgart",
      "registernummer": "HRB 740779",
      "registerart": "HRB",
      "company_name": "Hansgrohe SE",
      "company_seat": "Schiltach",
      "details": "29.05.2025 (Bekanntmachungsdatum)\n\nBaden-Württemberg Amtsgericht Stuttgart HRB 740779\nEinreichung neuer Dokumente\n\nHansgrohe SE\nEuropäische Aktiengesellschaft (SE)\nSchiltach\n\nDie Gesellschaft hat am 22.05.2025 die Liste über die Zusammensetzung des Aufsichtsrats zum Handelsregister eingereicht."
    },
    {
      "date": "2025-05-29",
      "id": "110634",
      "original_text": "Registerbekanntmachung nach dem Umwandlungsgesetz\nNordrhein-Westfalen Amtsgericht Aachen HRB 8622\nBechtle GmbH – Würselen",
      "type": "Registerbekanntmachung nach dem Umwandlungsgesetz",
      "state": "Nordrhein-Westfalen",
      "amtsgericht": "Amtsgericht Aachen",
      "registernummer": "HRB 8622",
      "registerart": "HRB",
      "company_name": "Bechtle GmbH",
      "company_seat": "Würselen",
      "details": "29.05.2025 (Bekanntmachungsdatum)\n\nNordrhein-Westfalen Amtsgericht Aachen HRB 8622\nRegisterbekanntmachung nach dem Umwandlungsgesetz 29.05.2025 (Eintragungsdatum)\n\nBechtle GmbH\nGesellschaft mit beschränkter Haftung\nWürselen\n\nDen Gläubigern der an der Verschmelzung beteiligten Rechtsträger ist, wenn sie binnen sechs Monaten nach dem Tag, an dem die Eintragung der Verschmelzung in das Register des Sitzes derjenigen Rechtsträger deren Gläubiger sie sind, nach § 19 Absatz 3 UmwG als bekanntgemacht gilt, ihren Anspruch nach Grund und Höhe schriftlich anmelden, Sicherheit zu leisten, soweit sie nicht Befriedigung verlangen können. Dieses Recht steht den Gläubigern jedoch nur zu, wenn sie glaubhaft machen, dass durch die Verschmelzung die Erfüllung ihrer Forderung gefährdet wird."
    }
  ]
}