{
  "date": "2025-05-31",
  "date_of_scrape": "2025-06-01T04:14:22.025Z",
  "tool_version": "0.2.0",
  "number_of_announcements": 12,
  "announcements": [
    {
      "date": "2025-05-31",
      "id": "110742",
      "original_text": "Registerbekanntmachung nach dem Umwandlungsgesetz\nBayern Amtsgericht Hof HRA 4944\nAK Trade e.K., Inhaber Andreas Kant – Naila",
      "type": "Registerbekanntmachung nach dem Umwandlungsgesetz",
      "state": "Bayern",
      "amtsgericht": "Amtsgericht Hof",
      "registernummer": "HRA 4944",
      "registerart": "HRA",
      "company_name": "AK Trade e.K., Inhaber Andreas Kant",
      "company_seat": "Naila",
      "details": "31.05.2025 (Bekanntmachungsdatum)\n\nBayern Amtsgericht Hof HRA 4944\nRegisterbekanntmachung nach dem Umwandlungsgesetz 30.05.2025 (Eintragungsdatum)\n\nAK Trade e.K., Inhaber Andreas Kant\nEinzelkaufmann / Einzelkauffrau\nNaila\n\nDen Gläubigern der an der Verschmelzung beteiligten Rechtsträger ist, wenn sie binnen sechs Monaten nach dem Tag, an dem die Eintragung der Verschmelzung in das Register des Sitzes desjenigen Rechtsträgers, dessen Gläubiger sie sind, nach § 19 Abs. 3 UmwG als bekannt gemacht gilt, ihren Anspruch nach Grund und Höhe in Textform anmelden, Sicherheit zu leisten, soweit sie nicht Befriedigung verlangen können. Dieses Recht steht den Gläubigern jedoch nur zu, wenn sie glaubhaft machen, dass durch die Verschmelzung die Erfüllung ihrer Forderung gefährdet wird."
    },
    {
      "date": "2025-05-31",
      "id": "110743",
      "original_text": "Registerbekanntmachung nach dem Umwandlungsgesetz\nBayern Amtsgericht Würzburg HRA 8946\nArno Repmann Betriebsverpachtung e. K. – Rödelsee",
      "type": "Registerbekanntmachung nach dem Umwandlungsgesetz",
      "state": "Bayern",
      "amtsgericht": "Amtsgericht Würzburg",
      "registernummer": "HRA 8946",
      "registerart": "HRA",
      "company_name": "Arno Repmann Betriebsverpachtung e. K.",
      "company_seat": "Rödelsee",
      "details": "31.05.2025 (Bekanntmachungsdatum)\n\nBayern Amtsgericht Würzburg HRA 8946\nRegisterbekanntmachung nach dem Umwandlungsgesetz 30.05.2025 (Eintragungsdatum)\n\nArno Repmann Betriebsverpachtung e. K.\nEinzelkaufmann / Einzelkauffrau\nRödelsee\n\nDen Gläubigern der an der Ausgliederung beteiligten Rechtsträger ist, wenn sie binnen sechs Monaten nach dem Tag, an dem die Eintragung der Ausgliederung in das Register des Sitzes desjenigen Rechtsträgers, dessen Gläubiger sie sind, nach §§ 125, 19 Abs. 3 UmwG als bekannt gemacht gilt, ihren Anspruch nach Grund und Höhe in Textform anmelden, Sicherheit zu leisten, soweit sie nicht Befriedigung verlangen können. Dieses Recht steht den Gläubigern jedoch nur zu, wenn sie glaubhaft machen, dass durch die Ausgliederung die Erfüllung ihrer Forderung gefährdet wird."
    },
    {
      "date": "2025-05-31",
      "id": "110744",
      "original_text": "Registerbekanntmachung nach dem Umwandlungsgesetz\nBayern Amtsgericht Nürnberg HRB 3454\nGroßhauser Holding GmbH – Berching",
      "type": "Registerbekanntmachung nach dem Umwandlungsgesetz",
      "state": "Bayern",
      "amtsgericht": "Amtsgericht Nürnberg",
      "registernummer": "HRB 3454",
      "registerart": "HRB",
      "company_name": "Großhauser Holding GmbH",
      "company_seat": "Berching",
      "details": "31.05.2025 (Bekanntmachungsdatum)\n\nBayern Amtsgericht Nürnberg HRB 3454\nRegisterbekanntmachung nach dem Umwandlungsgesetz 30.05.2025 (Eintragungsdatum)\n\nGroßhauser Holding GmbH\nGesellschaft mit beschränkter Haftung\nBerching\n\nDen Gläubigern der an der Ausgliederung beteiligten Rechtsträger ist, wenn sie binnen sechs Monaten nach dem Tag, an dem die Eintragung der Ausgliederung in das Register des Sitzes desjenigen Rechtsträgers, dessen Gläubiger sie sind, nach §§ 125, 19 Abs. 3 UmwG als bekannt gemacht gilt, ihren Anspruch nach Grund und Höhe in Textform anmelden, Sicherheit zu leisten, soweit sie nicht Befriedigung verlangen können. Dieses Recht steht den Gläubigern jedoch nur zu, wenn sie glaubhaft machen, dass durch die Ausgliederung die Erfüllung ihrer Forderung gefährdet wird."
    },
    {
      "date": "2025-05-31",
      "id": "110745",
      "original_text": "Registerbekanntmachung nach dem Umwandlungsgesetz\nBayern Amtsgericht Hof HRB 6833\nVape Enterprise UG (haftungsbeschränkt) – Hof",
      "type": "Registerbekanntmachung nach dem Umwandlungsgesetz",
      "state": "Bayern",
      "amtsgericht": "Amtsgericht Hof",
      "registernummer": "HRB 6833",
      "registerart": "HRB",
      "company_name": "Vape Enterprise UG (haftungsbeschränkt)",
      "company_seat": "Hof",
      "details": "31.05.2025 (Bekanntmachungsdatum)\n\nBayern Amtsgericht Hof HRB 6833\nRegisterbekanntmachung nach dem Umwandlungsgesetz 30.05.2025 (Eintragungsdatum)\n\nVape Enterprise UG (haftungsbeschränkt)\nGesellschaft mit beschränkter Haftung\nHof\n\nDen Gläubigern der an der Verschmelzung beteiligten Rechtsträger ist, wenn sie binnen sechs Monaten nach dem Tag, an dem die Eintragung der Verschmelzung in das Register des Sitzes desjenigen Rechtsträgers, dessen Gläubiger sie sind, nach § 19 Abs. 3 UmwG als bekannt gemacht gilt, ihren Anspruch nach Grund und Höhe in Textform anmelden, Sicherheit zu leisten, soweit sie nicht Befriedigung verlangen können. Dieses Recht steht den Gläubigern jedoch nur zu, wenn sie glaubhaft machen, dass durch die Verschmelzung die Erfüllung ihrer Forderung gefährdet wird."
    },
    {
      "date": "2025-05-31",
      "id": "110746",
      "original_text": "Einreichung neuer Dokumente\nBayern Amtsgericht Hof HRB 3866\nSana Klinikum Hof GmbH – Hof",
      "type": "Einreichung neuer Dokumente",
      "state": "Bayern",
      "amtsgericht": "Amtsgericht Hof",
      "registernummer": "HRB 3866",
      "registerart": "HRB",
      "company_name": "Sana Klinikum Hof GmbH",
      "company_seat": "Hof",
      "details": "31.05.2025 (Bekanntmachungsdatum)\n\nBayern Amtsgericht Hof HRB 3866\nEinreichung neuer Dokumente\n\nSana Klinikum Hof GmbH\nGesellschaft mit beschränkter Haftung\nHof\n\nDem Amtsgericht Hof -Registergericht- ist eine Liste der Mitglieder des Aufsichtsrats eingereicht worden, § 52 Abs. 3 S. 2 GmbHG."
    },
    {
      "date": "2025-05-31",
      "id": "110747",
      "original_text": "Registerbekanntmachung nach dem Umwandlungsgesetz\nBayern Amtsgericht München HRB 183920\nXperts4IT GmbH – Vaterstetten",
      "type": "Registerbekanntmachung nach dem Umwandlungsgesetz",
      "state": "Bayern",
      "amtsgericht": "Amtsgericht München",
      "registernummer": "HRB 183920",
      "registerart": "HRB",
      "company_name": "Xperts4IT GmbH",
      "company_seat": "Vaterstetten",
      "details": "31.05.2025 (Bekanntmachungsdatum)\n\nBayern Amtsgericht München HRB 183920\nRegisterbekanntmachung nach dem Umwandlungsgesetz 30.05.2025 (Eintragungsdatum)\n\nXperts4IT GmbH\nGesellschaft mit beschränkter Haftung\nVaterstetten\n\nDen Gläubigern der an der Verschmelzung beteiligten Rechtsträger ist, wenn sie binnen sechs Monaten nach dem Tag, an dem die Eintragung der Verschmelzung in das Register des Sitzes desjenigen Rechtsträgers, dessen Gläubiger sie sind, nach § 19 Abs. 3 UmwG als bekannt gemacht gilt, ihren Anspruch nach Grund und Höhe in Textform anmelden, Sicherheit zu leisten, soweit sie nicht Befriedigung verlangen können. Dieses Recht steht den Gläubigern jedoch nur zu, wenn sie glaubhaft machen, dass durch die Verschmelzung die Erfüllung ihrer Forderung gefährdet wird."
    },
    {
      "date": "2025-05-31",
      "id": "110748",
      "original_text": "Registerbekanntmachung nach dem Umwandlungsgesetz\nBayern Amtsgericht München HRB 285607\nGivel-Software-Engineering UG (haftungsbeschränkt) – München",
      "type": "Registerbekanntmachung nach dem Umwandlungsgesetz",
      "state": "Bayern",
      "amtsgericht": "Amtsgericht München",
      "registernummer": "HRB 285607",
      "registerart": "HRB",
      "company_name": "Givel-Software-Engineering UG (haftungsbeschränkt)",
      "company_seat": "München",
      "details": "31.05.2025 (Bekanntmachungsdatum)\n\nBayern Amtsgericht München HRB 285607\nRegisterbekanntmachung nach dem Umwandlungsgesetz 30.05.2025 (Eintragungsdatum)\n\nGivel-Software-Engineering UG (haftungsbeschränkt)\nGesellschaft mit beschränkter Haftung\nMünchen\n\nDen Gläubigern der an der Verschmelzung beteiligten Rechtsträger ist, wenn sie binnen sechs Monaten nach dem Tag, an dem die Eintragung der Verschmelzung in das Register des Sitzes desjenigen Rechtsträgers, dessen Gläubiger sie sind, nach § 19 Abs. 3 UmwG als bekannt gemacht gilt, ihren Anspruch nach Grund und Höhe in Textform anmelden, Sicherheit zu leisten, soweit sie nicht Befriedigung verlangen können. Dieses Recht steht den Gläubigern jedoch nur zu, wenn sie glaubhaft machen, dass durch die Verschmelzung die Erfüllung ihrer Forderung gefährdet wird."
    },
    {
      "date": "2025-05-31",
      "id": "110749",
      "original_text": "Registerbekanntmachung nach dem Umwandlungsgesetz\nBayern Amtsgericht Bamberg HRB 11751\nherzwerkspirit UG (haftungsbeschränkt) – Gädheim",
      "type": "Registerbekanntmachung nach dem Umwandlungsgesetz",
      "state": "Bayern",
      "amtsgericht": "Amtsgericht Bamberg",
      "registernummer": "HRB 11751",
      "registerart": "HRB",
      "company_name": "herzwerkspirit UG (haftungsbeschränkt)",
      "company_seat": "Gädheim",
      "details": "31.05.2025 (Bekanntmachungsdatum)\n\nBayern Amtsgericht Bamberg HRB 11751\nRegisterbekanntmachung nach dem Umwandlungsgesetz 30.05.2025 (Eintragungsdatum)\n\nherzwerkspirit UG (haftungsbeschränkt)\nGesellschaft mit beschränkter Haftung\nGädheim\n\nDen Gläubigern der an der Verschmelzung beteiligten Rechtsträger ist, wenn sie binnen sechs Monaten nach dem Tag, an dem die Eintragung der Verschmelzung in das Register des Sitzes desjenigen Rechtsträgers, dessen Gläubiger sie sind, nach § 19 Abs. 3 UmwG als bekannt gemacht gilt, ihren Anspruch nach Grund und Höhe in Textform anmelden, Sicherheit zu leisten, soweit sie nicht Befriedigung verlangen können. Dieses Recht steht den Gläubigern jedoch nur zu, wenn sie glaubhaft machen, dass durch die Verschmelzung die Erfüllung ihrer Forderung gefährdet wird."
    },
    {
      "date": "2025-05-31",
      "id": "110750",
      "original_text": "Registerbekanntmachung nach dem Umwandlungsgesetz\nBayern Amtsgericht Nürnberg HRB 3454\nGroßhauser Holding GmbH – Berching",
      "type": "Registerbekanntmachung nach dem Umwandlungsgesetz",
      "state": "Bayern",
      "amtsgericht": "Amtsgericht Nürnberg",
      "registernummer": "HRB 3454",
      "registerart": "HRB",
      "company_name": "Großhauser Holding GmbH",
      "company_seat": "Berching",
      "details": "31.05.2025 (Bekanntmachungsdatum)\n\nBayern Amtsgericht Nürnberg HRB 3454\nRegisterbekanntmachung nach dem Umwandlungsgesetz 30.05.2025 (Eintragungsdatum)\n\nGroßhauser Holding GmbH\nGesellschaft mit beschränkter Haftung\nBerching\n\nDen Gläubigern der an der Ausgliederung beteiligten Rechtsträger ist, wenn sie binnen sechs Monaten nach dem Tag, an dem die Eintragung der Ausgliederung in das Register des Sitzes desjenigen Rechtsträgers, dessen Gläubiger sie sind, nach §§ 125, 19 Abs. 3 UmwG als bekannt gemacht gilt, ihren Anspruch nach Grund und Höhe in Textform anmelden, Sicherheit zu leisten, soweit sie nicht Befriedigung verlangen können. Dieses Recht steht den Gläubigern jedoch nur zu, wenn sie glaubhaft machen, dass durch die Ausgliederung die Erfüllung ihrer Forderung gefährdet wird."
    },
    {
      "date": "2025-05-31",
      "id": "110751",
      "original_text": "Registerbekanntmachung nach dem Umwandlungsgesetz\nBayern Amtsgericht Würzburg HRA 8949\nRepmann Immobilien GmbH & Co. KG – Rödelsee",
      "type": "Registerbekanntmachung nach dem Umwandlungsgesetz",
      "state": "Bayern",
      "amtsgericht": "Amtsgericht Würzburg",
      "registernummer": "HRA 8949",
      "registerart": "HRA",
      "company_name": "Repmann Immobilien GmbH & Co. KG",
      "company_seat": "Rödelsee",
      "details": "31.05.2025 (Bekanntmachungsdatum)\n\nBayern Amtsgericht Würzburg HRA 8949\nRegisterbekanntmachung nach dem Umwandlungsgesetz 30.05.2025 (Eintragungsdatum)\n\nRepmann Immobilien GmbH & Co. KG\nKommanditgesellschaft\nRödelsee\n\nDen Gläubigern der an der Ausgliederung beteiligten Rechtsträger ist, wenn sie binnen sechs Monaten nach dem Tag, an dem die Eintragung der Ausgliederung in das Register des Sitzes desjenigen Rechtsträgers, dessen Gläubiger sie sind, nach §§ 125, 19 Abs. 3 UmwG als bekannt gemacht gilt, ihren Anspruch nach Grund und Höhe in Textform anmelden, Sicherheit zu leisten, soweit sie nicht Befriedigung verlangen können. Dieses Recht steht den Gläubigern jedoch nur zu, wenn sie glaubhaft machen, dass durch die Ausgliederung die Erfüllung ihrer Forderung gefährdet wird."
    },
    {
      "date": "2025-05-31",
      "id": "110752",
      "original_text": "Löschungsankündigung\nBayern Amtsgericht München HRB 219274\nMega Investments GmbH – München",
      "type": "Löschungsankündigung",
      "state": "Bayern",
      "amtsgericht": "Amtsgericht München",
      "registernummer": "HRB 219274",
      "registerart": "HRB",
      "company_name": "Mega Investments GmbH",
      "company_seat": "München",
      "details": "31.05.2025 (Bekanntmachungsdatum)\n\nBayern Amtsgericht München HRB 219274\nLöschungsankündigung\n\nMega Investments GmbH\nGesellschaft mit beschränkter Haftung\nMünchen\n\nDas Registergericht beabsichtigt, die im Handelsregister eingetragene Gesellschaft wegen Vermögenslosigkeit von Amts wegen nach § 394 FamFG zu löschen. Die Frist zur Erhebung eines Widerspruchs ist auf drei Monate festgesetzt."
    },
    {
      "date": "2025-05-31",
      "id": "110753",
      "original_text": "Registerbekanntmachung nach dem Umwandlungsgesetz\nBayern Amtsgericht München HRB 176915\nArbor Networks GmbH – München",
      "type": "Registerbekanntmachung nach dem Umwandlungsgesetz",
      "state": "Bayern",
      "amtsgericht": "Amtsgericht München",
      "registernummer": "HRB 176915",
      "registerart": "HRB",
      "company_name": "Arbor Networks GmbH",
      "company_seat": "München",
      "details": "31.05.2025 (Bekanntmachungsdatum)\n\nBayern Amtsgericht München HRB 176915\nRegisterbekanntmachung nach dem Umwandlungsgesetz 30.05.2025 (Eintragungsdatum)\n\nArbor Networks GmbH\nGesellschaft mit beschränkter Haftung\nMünchen\n\nDen Gläubigern der an der Verschmelzung beteiligten Rechtsträger ist, wenn sie binnen sechs Monaten nach dem Tag, an dem die Eintragung der Verschmelzung in das Register des Sitzes desjenigen Rechtsträgers, dessen Gläubiger sie sind, nach § 19 Abs. 3 UmwG als bekannt gemacht gilt, ihren Anspruch nach Grund und Höhe in Textform anmelden, Sicherheit zu leisten, soweit sie nicht Befriedigung verlangen können. Dieses Recht steht den Gläubigern jedoch nur zu, wenn sie glaubhaft machen, dass durch die Verschmelzung die Erfüllung ihrer Forderung gefährdet wird."
    }
  ]
}