{
  "date": "2025-05-17",
  "date_of_scrape": "2025-05-31T10:49:13.918Z",
  "tool_version": "0.2.0",
  "number_of_announcements": 24,
  "announcements": [
    {
      "date": "2025-05-17",
      "id": "109391",
      "original_text": "Registerbekanntmachung nach dem Umwandlungsgesetz\nBayern Amtsgericht München HRB 271624\nIQ-5 GmbH – Gräfelfing",
      "type": "Registerbekanntmachung nach dem Umwandlungsgesetz",
      "state": "Bayern",
      "amtsgericht": "Amtsgericht München",
      "registernummer": "HRB 271624",
      "registerart": "HRB",
      "company_name": "IQ-5 GmbH",
      "company_seat": "Gräfelfing",
      "details": "17.05.2025 (Bekanntmachungsdatum)\n\nBayern Amtsgericht München HRB 271624\nRegisterbekanntmachung nach dem Umwandlungsgesetz 16.05.2025 (Eintragungsdatum)\n\nIQ-5 GmbH\nGesellschaft mit beschränkter Haftung\nGräfelfing\n\nDen Gläubigern der an der Verschmelzung beteiligten Rechtsträger ist, wenn sie binnen sechs Monaten nach dem Tag, an dem die Eintragung der Verschmelzung in das Register des Sitzes desjenigen Rechtsträgers, dessen Gläubiger sie sind, nach § 19 Abs. 3 UmwG als bekannt gemacht gilt, ihren Anspruch nach Grund und Höhe in Textform anmelden, Sicherheit zu leisten, soweit sie nicht Befriedigung verlangen können. Dieses Recht steht den Gläubigern jedoch nur zu, wenn sie glaubhaft machen, dass durch die Verschmelzung die Erfüllung ihrer Forderung gefährdet wird."
    },
    {
      "date": "2025-05-17",
      "id": "109392",
      "original_text": "Registerbekanntmachung nach dem Umwandlungsgesetz\nBayern Amtsgericht Ingolstadt HRB 12178\nLightworks Manufaktur GmbH – Ingolstadt",
      "type": "Registerbekanntmachung nach dem Umwandlungsgesetz",
      "state": "Bayern",
      "amtsgericht": "Amtsgericht Ingolstadt",
      "registernummer": "HRB 12178",
      "registerart": "HRB",
      "company_name": "Lightworks Manufaktur GmbH",
      "company_seat": "Ingolstadt",
      "details": "17.05.2025 (Bekanntmachungsdatum)\n\nBayern Amtsgericht Ingolstadt HRB 12178\nRegisterbekanntmachung nach dem Umwandlungsgesetz 16.05.2025 (Eintragungsdatum)\n\nLightworks Manufaktur GmbH\nGesellschaft mit beschränkter Haftung\nIngolstadt\n\nDen Gläubigern der an der Verschmelzung beteiligten Rechtsträger ist, wenn sie binnen sechs Monaten nach dem Tag, an dem die Eintragung der Verschmelzung in das Register des Sitzes desjenigen Rechtsträgers, dessen Gläubiger sie sind, nach § 19 Abs. 3 UmwG als bekannt gemacht gilt, ihren Anspruch nach Grund und Höhe in Textform anmelden, Sicherheit zu leisten, soweit sie nicht Befriedigung verlangen können. Dieses Recht steht den Gläubigern jedoch nur zu, wenn sie glaubhaft machen, dass durch die Verschmelzung die Erfüllung ihrer Forderung gefährdet wird."
    },
    {
      "date": "2025-05-17",
      "id": "109393",
      "original_text": "Registerbekanntmachung nach dem Umwandlungsgesetz\nBayern Amtsgericht München HRB 107176\nCOLLEGIO Gesellschaft für berufliche Fortbildung mbH – Holzkirchen",
      "type": "Registerbekanntmachung nach dem Umwandlungsgesetz",
      "state": "Bayern",
      "amtsgericht": "Amtsgericht München",
      "registernummer": "HRB 107176",
      "registerart": "HRB",
      "company_name": "COLLEGIO Gesellschaft für berufliche Fortbildung mbH",
      "company_seat": "Holzkirchen",
      "details": "17.05.2025 (Bekanntmachungsdatum)\n\nBayern Amtsgericht München HRB 107176\nRegisterbekanntmachung nach dem Umwandlungsgesetz 16.05.2025 (Eintragungsdatum)\n\nCOLLEGIO Gesellschaft für berufliche Fortbildung mbH\nGesellschaft mit beschränkter Haftung\nHolzkirchen\n\nDen Gläubigern der an der Verschmelzung beteiligten Rechtsträger ist, wenn sie binnen sechs Monaten nach dem Tag, an dem die Eintragung der Verschmelzung in das Register des Sitzes desjenigen Rechtsträgers, dessen Gläubiger sie sind, nach § 19 Abs. 3 UmwG als bekannt gemacht gilt, ihren Anspruch nach Grund und Höhe in Textform anmelden, Sicherheit zu leisten, soweit sie nicht Befriedigung verlangen können. Dieses Recht steht den Gläubigern jedoch nur zu, wenn sie glaubhaft machen, dass durch die Verschmelzung die Erfüllung ihrer Forderung gefährdet wird."
    },
    {
      "date": "2025-05-17",
      "id": "109394",
      "original_text": "Einreichung neuer Dokumente\nBayern Amtsgericht Ingolstadt HRB 11677\nKESSEL Solutions SE – Lenting",
      "type": "Einreichung neuer Dokumente",
      "state": "Bayern",
      "amtsgericht": "Amtsgericht Ingolstadt",
      "registernummer": "HRB 11677",
      "registerart": "HRB",
      "company_name": "KESSEL Solutions SE",
      "company_seat": "Lenting",
      "details": "17.05.2025 (Bekanntmachungsdatum)\n\nBayern Amtsgericht Ingolstadt HRB 11677\nEinreichung neuer Dokumente\n\nKESSEL Solutions SE\nEuropäische Aktiengesellschaft (SE)\nLenting\n\nDem Amtsgericht Ingolstadt -Registergericht- ist eine Liste der Mitglieder des Aufsichtsrats eingereicht worden, Art. 9 Abs. 1 Buchst. c (ii) SE-VO i.V.m. § 106 AktG."
    },
    {
      "date": "2025-05-17",
      "id": "109395",
      "original_text": "Registerbekanntmachung nach dem Umwandlungsgesetz\nBayern Amtsgericht München HRB 264193\nUlrich 31 FIII Holding GmbH – München",
      "type": "Registerbekanntmachung nach dem Umwandlungsgesetz",
      "state": "Bayern",
      "amtsgericht": "Amtsgericht München",
      "registernummer": "HRB 264193",
      "registerart": "HRB",
      "company_name": "Ulrich 31 FIII Holding GmbH",
      "company_seat": "München",
      "details": "17.05.2025 (Bekanntmachungsdatum)\n\nBayern Amtsgericht München HRB 264193\nRegisterbekanntmachung nach dem Umwandlungsgesetz 16.05.2025 (Eintragungsdatum)\n\nUlrich 31 FIII Holding GmbH\nGesellschaft mit beschränkter Haftung\nMünchen\n\nDen Gläubigern der an der Verschmelzung beteiligten Rechtsträger ist, wenn sie binnen sechs Monaten nach dem Tag, an dem die Eintragung der Verschmelzung in das Register des Sitzes desjenigen Rechtsträgers, dessen Gläubiger sie sind, nach § 19 Abs. 3 UmwG als bekannt gemacht gilt, ihren Anspruch nach Grund und Höhe in Textform anmelden, Sicherheit zu leisten, soweit sie nicht Befriedigung verlangen können. Dieses Recht steht den Gläubigern jedoch nur zu, wenn sie glaubhaft machen, dass durch die Verschmelzung die Erfüllung ihrer Forderung gefährdet wird."
    },
    {
      "date": "2025-05-17",
      "id": "109396",
      "original_text": "Registerbekanntmachung nach dem Umwandlungsgesetz\nBayern Amtsgericht Fürth HRB 16754\nMMV Wohnungsbau Alpha GmbH – Erlangen",
      "type": "Registerbekanntmachung nach dem Umwandlungsgesetz",
      "state": "Bayern",
      "amtsgericht": "Amtsgericht Fürth",
      "registernummer": "HRB 16754",
      "registerart": "HRB",
      "company_name": "MMV Wohnungsbau Alpha GmbH",
      "company_seat": "Erlangen",
      "details": "17.05.2025 (Bekanntmachungsdatum)\n\nBayern Amtsgericht Fürth HRB 16754\nRegisterbekanntmachung nach dem Umwandlungsgesetz 16.05.2025 (Eintragungsdatum)\n\nMMV Wohnungsbau Alpha GmbH\nGesellschaft mit beschränkter Haftung\nErlangen\n\nDen Gläubigern der an der Verschmelzung beteiligten Rechtsträger ist, wenn sie binnen sechs Monaten nach dem Tag, an dem die Eintragung der Verschmelzung in das Register des Sitzes desjenigen Rechtsträgers, dessen Gläubiger sie sind, nach § 19 Abs. 3 UmwG als bekannt gemacht gilt, ihren Anspruch nach Grund und Höhe in Textform anmelden, Sicherheit zu leisten, soweit sie nicht Befriedigung verlangen können. Dieses Recht steht den Gläubigern jedoch nur zu, wenn sie glaubhaft machen, dass durch die Verschmelzung die Erfüllung ihrer Forderung gefährdet wird."
    },
    {
      "date": "2025-05-17",
      "id": "109397",
      "original_text": "Registerbekanntmachung nach dem Umwandlungsgesetz\nBayern Amtsgericht Ingolstadt HRB 191273\nTec-Repair GmbH – Wolnzach",
      "type": "Registerbekanntmachung nach dem Umwandlungsgesetz",
      "state": "Bayern",
      "amtsgericht": "Amtsgericht Ingolstadt",
      "registernummer": "HRB 191273",
      "registerart": "HRB",
      "company_name": "Tec-Repair GmbH",
      "company_seat": "Wolnzach",
      "details": "17.05.2025 (Bekanntmachungsdatum)\n\nBayern Amtsgericht Ingolstadt HRB 191273\nRegisterbekanntmachung nach dem Umwandlungsgesetz 16.05.2025 (Eintragungsdatum)\n\nTec-Repair GmbH\nGesellschaft mit beschränkter Haftung\nWolnzach\n\nDen Gläubigern der an der Verschmelzung beteiligten Rechtsträger ist, wenn sie binnen sechs Monaten nach dem Tag, an dem die Eintragung der Verschmelzung in das Register des Sitzes desjenigen Rechtsträgers, dessen Gläubiger sie sind, nach § 19 Abs. 3 UmwG als bekannt gemacht gilt, ihren Anspruch nach Grund und Höhe in Textform anmelden, Sicherheit zu leisten, soweit sie nicht Befriedigung verlangen können. Dieses Recht steht den Gläubigern jedoch nur zu, wenn sie glaubhaft machen, dass durch die Verschmelzung die Erfüllung ihrer Forderung gefährdet wird."
    },
    {
      "date": "2025-05-17",
      "id": "109398",
      "original_text": "Registerbekanntmachung nach dem Umwandlungsgesetz\nBayern Amtsgericht Fürth HRB 16666\nMMV Objekt Delta GmbH – Erlangen",
      "type": "Registerbekanntmachung nach dem Umwandlungsgesetz",
      "state": "Bayern",
      "amtsgericht": "Amtsgericht Fürth",
      "registernummer": "HRB 16666",
      "registerart": "HRB",
      "company_name": "MMV Objekt Delta GmbH",
      "company_seat": "Erlangen",
      "details": "17.05.2025 (Bekanntmachungsdatum)\n\nBayern Amtsgericht Fürth HRB 16666\nRegisterbekanntmachung nach dem Umwandlungsgesetz 16.05.2025 (Eintragungsdatum)\n\nMMV Objekt Delta GmbH\nGesellschaft mit beschränkter Haftung\nErlangen\n\nDen Gläubigern der an der Verschmelzung beteiligten Rechtsträger ist, wenn sie binnen sechs Monaten nach dem Tag, an dem die Eintragung der Verschmelzung in das Register des Sitzes desjenigen Rechtsträgers, dessen Gläubiger sie sind, nach § 19 Abs. 3 UmwG als bekannt gemacht gilt, ihren Anspruch nach Grund und Höhe in Textform anmelden, Sicherheit zu leisten, soweit sie nicht Befriedigung verlangen können. Dieses Recht steht den Gläubigern jedoch nur zu, wenn sie glaubhaft machen, dass durch die Verschmelzung die Erfüllung ihrer Forderung gefährdet wird."
    },
    {
      "date": "2025-05-17",
      "id": "109399",
      "original_text": "Registerbekanntmachung nach dem Umwandlungsgesetz\nBayern Amtsgericht Schweinfurt HRA 10673\nDS Dellentechnik Schreiner e.K. – Münnerstadt",
      "type": "Registerbekanntmachung nach dem Umwandlungsgesetz",
      "state": "Bayern",
      "amtsgericht": "Amtsgericht Schweinfurt",
      "registernummer": "HRA 10673",
      "registerart": "HRA",
      "company_name": "DS Dellentechnik Schreiner e.K.",
      "company_seat": "Münnerstadt",
      "details": "17.05.2025 (Bekanntmachungsdatum)\n\nBayern Amtsgericht Schweinfurt HRA 10673\nRegisterbekanntmachung nach dem Umwandlungsgesetz 16.05.2025 (Eintragungsdatum)\n\nDS Dellentechnik Schreiner e.K.\nEinzelkaufmann / Einzelkauffrau\nMünnerstadt\n\nDen Gläubigern der an der Ausgliederung beteiligten Rechtsträger ist, wenn sie binnen sechs Monaten nach dem Tag, an dem die Eintragung der Ausgliederung in das Register des Sitzes desjenigen Rechtsträgers, dessen Gläubiger sie sind, nach §§ 125, 19 Abs. 3 UmwG als bekannt gemacht gilt, ihren Anspruch nach Grund und Höhe in Textform anmelden, Sicherheit zu leisten, soweit sie nicht Befriedigung verlangen können. Dieses Recht steht den Gläubigern jedoch nur zu, wenn sie glaubhaft machen, dass durch die Ausgliederung die Erfüllung ihrer Forderung gefährdet wird."
    },
    {
      "date": "2025-05-17",
      "id": "109400",
      "original_text": "Einreichung neuer Dokumente\nBayern Amtsgericht Traunstein HRB 19427\nMühldorfer Nutrition AG – Mühldorf a.Inn",
      "type": "Einreichung neuer Dokumente",
      "state": "Bayern",
      "amtsgericht": "Amtsgericht Traunstein",
      "registernummer": "HRB 19427",
      "registerart": "HRB",
      "company_name": "Mühldorfer Nutrition AG",
      "company_seat": "Mühldorf a.Inn",
      "details": "17.05.2025 (Bekanntmachungsdatum)\n\nBayern Amtsgericht Traunstein HRB 19427\nEinreichung neuer Dokumente\n\nMühldorfer Nutrition AG\nAktiengesellschaft\nMühldorf a.Inn\n\nDen Gläubigern Dem #Re.Name ist eine Liste der Mitglieder des Aufsichtsrats eingereicht worden, § 106 AktG.#dv.auswahl(Text=\"Bitte zutreffendes auswählen:\",Eingabe=\n\n\"der an der Verschmelzung beteiligten Rechtsträger ist, wenn sie binnen sechs Monaten nach dem Tag, an dem die Eintragung der Verschmelzung in das Register des Sitzes desjenigen Rechtsträgers, dessen Gläubiger sie sind, nach § 19 Abs. 3 UmwG als bekannt gemacht gilt, ihren Anspruch nach Grund und Höhe in Textform anmelden, Sicherheit zu leisten, soweit sie nicht Befriedigung verlangen können. Dieses Recht steht den Gläubigern jedoch nur zu, wenn sie glaubhaft machen, dass durch die Verschmelzung die Erfüllung ihrer Forderung gefährdet wird.\"|\"Verschmelzung\",\n\n\"der an der Spaltung beteiligten Rechtsträger ist, wenn sie binnen sechs Monaten nach dem Tag, an dem die Eintragung der Spaltung in das Register des Sitzes desjenigen Rechtsträgers, dessen Gläubiger sie sind, nach §§ 125, 19 Abs. 3 UmwG als bekannt gemacht gilt, ihren Anspruch nach Grund und Höhe in Textform anmelden, Sicherheit zu leisten, soweit sie nicht Befriedigung verlangen können. Dieses Recht steht den Gläubigern jedoch nur zu, wenn sie glaubhaft machen, dass durch die Spaltung die Erfüllung ihrer Forderung gefährdet wird.\"|\"Spaltung\",\n\n\"des formwechselnden Rechtsträgers ist, wenn sie binnen sechs Monaten nach dem Tag, an dem die Eintragung des Formwechsels nach § 201 UmwG als bekannt gemacht gilt, ihren Anspruch nach Grund und Höhe in Textform anmelden, Sicherheit zu leisten, soweit sie nicht Befriedigung verlangen können. Dieses Recht steht den Gläubigern jedoch nur zu, wenn sie glaubhaft machen, dass durch den Formwechsel die Erfüllung ihrer Forderung gefährdet wird.\"|\"formwechselnde Umwandlung\",\n\n\"der an der Ausgliederung beteiligten Rechtsträger ist, wenn sie binnen sechs Monaten nach dem Tag, an dem die Eintragung der Ausgliederung in das Register des Sitzes desjenigen Rechtsträgers, dessen Gläubiger sie sind, nach §§ 125, 19 Abs. 3 UmwG als bekannt gemacht gilt, ihren Anspruch nach Grund und Höhe in Textform anmelden, Sicherheit zu leisten, soweit sie nicht Befriedigung verlangen können. Dieses Recht steht den Gläubigern jedoch nur zu, wenn sie glaubhaft machen, dass durch die Ausgliederung die Erfüllung ihrer Forderung gefährdet wird.\"|\"Ausgliederung\")"
    },
    {
      "date": "2025-05-17",
      "id": "109401",
      "original_text": "Löschungsankündigung\nBayern Amtsgericht München HRA 98965\nSelfmade Capital Marketing & Vertrieb GmbH & Co. KG – Unterföhring",
      "type": "Löschungsankündigung",
      "state": "Bayern",
      "amtsgericht": "Amtsgericht München",
      "registernummer": "HRA 98965",
      "registerart": "HRA",
      "company_name": "Selfmade Capital Marketing & Vertrieb GmbH & Co. KG",
      "company_seat": "Unterföhring",
      "details": "17.05.2025 (Bekanntmachungsdatum)\n\nBayern Amtsgericht München HRA 98965\nLöschungsankündigung\n\nSelfmade Capital Marketing & Vertrieb GmbH & Co. KG\nKommanditgesellschaft\nUnterföhring\n\nDas Registergericht beabsichtigt, die im Handelsregister eingetragene Firma von Amts wegen nach § 31 Abs. 2 HGB zu löschen. Die Frist zur Erhebung eines Widerspruchs ist auf drei Monate festgesetzt."
    },
    {
      "date": "2025-05-17",
      "id": "109402",
      "original_text": "Löschungsankündigung\nBayern Amtsgericht Nürnberg HRB 32560\nBSM-Recycling Rohstoffverwertungs GmbH – Burgthann",
      "type": "Löschungsankündigung",
      "state": "Bayern",
      "amtsgericht": "Amtsgericht Nürnberg",
      "registernummer": "HRB 32560",
      "registerart": "HRB",
      "company_name": "BSM-Recycling Rohstoffverwertungs GmbH",
      "company_seat": "Burgthann",
      "details": "17.05.2025 (Bekanntmachungsdatum)\n\nBayern Amtsgericht Nürnberg HRB 32560\nLöschungsankündigung\n\nBSM-Recycling Rohstoffverwertungs GmbH\nGesellschaft mit beschränkter Haftung\nBurgthann\n\nDas Registergericht beabsichtigt, die im Handelsregister eingetragene Gesellschaft wegen Vermögenslosigkeit von Amts wegen nach § 394 FamFG zu löschen. Die Frist zur Erhebung eines Widerspruchs ist auf einen Monat festgesetzt."
    },
    {
      "date": "2025-05-17",
      "id": "109403",
      "original_text": "Einreichung neuer Dokumente\nBayern Amtsgericht München HRB 127559\nConsal Beteiligungsgesellschaft Aktiengesellschaft – München",
      "type": "Einreichung neuer Dokumente",
      "state": "Bayern",
      "amtsgericht": "Amtsgericht München",
      "registernummer": "HRB 127559",
      "registerart": "HRB",
      "company_name": "Consal Beteiligungsgesellschaft Aktiengesellschaft",
      "company_seat": "München",
      "details": "17.05.2025 (Bekanntmachungsdatum)\n\nBayern Amtsgericht München HRB 127559\nEinreichung neuer Dokumente\n\nConsal Beteiligungsgesellschaft Aktiengesellschaft\nAktiengesellschaft\nMünchen\n\nDem Amtsgericht München -Registergericht- ist eine Liste der Mitglieder des Aufsichtsrats eingereicht worden, § 106 AktG."
    },
    {
      "date": "2025-05-17",
      "id": "109404",
      "original_text": "Einreichung neuer Dokumente\nBayern Amtsgericht Ingolstadt HRB 11670\nKESSEL Beteiligungs SE – Lenting",
      "type": "Einreichung neuer Dokumente",
      "state": "Bayern",
      "amtsgericht": "Amtsgericht Ingolstadt",
      "registernummer": "HRB 11670",
      "registerart": "HRB",
      "company_name": "KESSEL Beteiligungs SE",
      "company_seat": "Lenting",
      "details": "17.05.2025 (Bekanntmachungsdatum)\n\nBayern Amtsgericht Ingolstadt HRB 11670\nEinreichung neuer Dokumente\n\nKESSEL Beteiligungs SE\nEuropäische Aktiengesellschaft (SE)\nLenting\n\nDem Amtsgericht Ingolstadt -Registergericht- ist eine Liste der Mitglieder des Aufsichtsrats eingereicht worden, Art. 9 Abs. 1 Buchst. c (ii) SE-VO i.V.m. § 106 AktG."
    },
    {
      "date": "2025-05-17",
      "id": "109405",
      "original_text": "Einreichung neuer Dokumente\nBayern Amtsgericht München HRB 141809\nBavaria Fiction GmbH – Grünwald",
      "type": "Einreichung neuer Dokumente",
      "state": "Bayern",
      "amtsgericht": "Amtsgericht München",
      "registernummer": "HRB 141809",
      "registerart": "HRB",
      "company_name": "Bavaria Fiction GmbH",
      "company_seat": "Grünwald",
      "details": "17.05.2025 (Bekanntmachungsdatum)\n\nBayern Amtsgericht München HRB 141809\nEinreichung neuer Dokumente\n\nBavaria Fiction GmbH\nGesellschaft mit beschränkter Haftung\nGrünwald\n\nDem Amtsgericht München -Registergericht- ist eine Liste der Mitglieder des Aufsichtsrats eingereicht worden, § 52 Abs. 3 S. 2 GmbHG."
    },
    {
      "date": "2025-05-17",
      "id": "109406",
      "original_text": "Registerbekanntmachung nach dem Umwandlungsgesetz\nBayern Amtsgericht Fürth HRB 16744\nMMV Wohnungsbau Gamma GmbH – Erlangen",
      "type": "Registerbekanntmachung nach dem Umwandlungsgesetz",
      "state": "Bayern",
      "amtsgericht": "Amtsgericht Fürth",
      "registernummer": "HRB 16744",
      "registerart": "HRB",
      "company_name": "MMV Wohnungsbau Gamma GmbH",
      "company_seat": "Erlangen",
      "details": "17.05.2025 (Bekanntmachungsdatum)\n\nBayern Amtsgericht Fürth HRB 16744\nRegisterbekanntmachung nach dem Umwandlungsgesetz 16.05.2025 (Eintragungsdatum)\n\nMMV Wohnungsbau Gamma GmbH\nGesellschaft mit beschränkter Haftung\nErlangen\n\nDen Gläubigern der an der Verschmelzung beteiligten Rechtsträger ist, wenn sie binnen sechs Monaten nach dem Tag, an dem die Eintragung der Verschmelzung in das Register des Sitzes desjenigen Rechtsträgers, dessen Gläubiger sie sind, nach § 19 Abs. 3 UmwG als bekannt gemacht gilt, ihren Anspruch nach Grund und Höhe in Textform anmelden, Sicherheit zu leisten, soweit sie nicht Befriedigung verlangen können. Dieses Recht steht den Gläubigern jedoch nur zu, wenn sie glaubhaft machen, dass durch die Verschmelzung die Erfüllung ihrer Forderung gefährdet wird."
    },
    {
      "date": "2025-05-17",
      "id": "109407",
      "original_text": "Registerbekanntmachung nach dem Umwandlungsgesetz\nBayern Amtsgericht Fürth HRB 14698\nWohnen am Spreefenster GmbH – Erlangen",
      "type": "Registerbekanntmachung nach dem Umwandlungsgesetz",
      "state": "Bayern",
      "amtsgericht": "Amtsgericht Fürth",
      "registernummer": "HRB 14698",
      "registerart": "HRB",
      "company_name": "Wohnen am Spreefenster GmbH",
      "company_seat": "Erlangen",
      "details": "17.05.2025 (Bekanntmachungsdatum)\n\nBayern Amtsgericht Fürth HRB 14698\nRegisterbekanntmachung nach dem Umwandlungsgesetz 16.05.2025 (Eintragungsdatum)\n\nWohnen am Spreefenster GmbH\nGesellschaft mit beschränkter Haftung\nErlangen\n\nDen Gläubigern der an der Verschmelzung beteiligten Rechtsträger ist, wenn sie binnen sechs Monaten nach dem Tag, an dem die Eintragung der Verschmelzung in das Register des Sitzes desjenigen Rechtsträgers, dessen Gläubiger sie sind, nach § 19 Abs. 3 UmwG als bekannt gemacht gilt, ihren Anspruch nach Grund und Höhe in Textform anmelden, Sicherheit zu leisten, soweit sie nicht Befriedigung verlangen können. Dieses Recht steht den Gläubigern jedoch nur zu, wenn sie glaubhaft machen, dass durch die Verschmelzung die Erfüllung ihrer Forderung gefährdet wird."
    },
    {
      "date": "2025-05-17",
      "id": "109408",
      "original_text": "Registerbekanntmachung nach dem Umwandlungsgesetz\nBayern Amtsgericht Schweinfurt HRB 9730\nDellentechnik Schreiner GmbH – Münnerstadt",
      "type": "Registerbekanntmachung nach dem Umwandlungsgesetz",
      "state": "Bayern",
      "amtsgericht": "Amtsgericht Schweinfurt",
      "registernummer": "HRB 9730",
      "registerart": "HRB",
      "company_name": "Dellentechnik Schreiner GmbH",
      "company_seat": "Münnerstadt",
      "details": "17.05.2025 (Bekanntmachungsdatum)\n\nBayern Amtsgericht Schweinfurt HRB 9730\nRegisterbekanntmachung nach dem Umwandlungsgesetz 16.05.2025 (Eintragungsdatum)\n\nDellentechnik Schreiner GmbH\nGesellschaft mit beschränkter Haftung\nMünnerstadt\n\nDen Gläubigern der an der Ausgliederung beteiligten Rechtsträger ist, wenn sie binnen sechs Monaten nach dem Tag, an dem die Eintragung der Ausgliederung in das Register des Sitzes desjenigen Rechtsträgers, dessen Gläubiger sie sind, nach §§ 125, 19 Abs. 3 UmwG als bekannt gemacht gilt, ihren Anspruch nach Grund und Höhe in Textform anmelden, Sicherheit zu leisten, soweit sie nicht Befriedigung verlangen können. Dieses Recht steht den Gläubigern jedoch nur zu, wenn sie glaubhaft machen, dass durch die Ausgliederung die Erfüllung ihrer Forderung gefährdet wird."
    },
    {
      "date": "2025-05-17",
      "id": "109409",
      "original_text": "Registerbekanntmachung nach dem Umwandlungsgesetz\nBayern Amtsgericht München HRB 279164\nDegussa Business Services GmbH – München",
      "type": "Registerbekanntmachung nach dem Umwandlungsgesetz",
      "state": "Bayern",
      "amtsgericht": "Amtsgericht München",
      "registernummer": "HRB 279164",
      "registerart": "HRB",
      "company_name": "Degussa Business Services GmbH",
      "company_seat": "München",
      "details": "17.05.2025 (Bekanntmachungsdatum)\n\nBayern Amtsgericht München HRB 279164\nRegisterbekanntmachung nach dem Umwandlungsgesetz 16.05.2025 (Eintragungsdatum)\n\nDegussa Business Services GmbH\nGesellschaft mit beschränkter Haftung\nMünchen\n\nDen Gläubigern der an der Verschmelzung beteiligten Rechtsträger ist, wenn sie binnen sechs Monaten nach dem Tag, an dem die Eintragung der Verschmelzung in das Register des Sitzes desjenigen Rechtsträgers, dessen Gläubiger sie sind, nach § 19 Abs. 3 UmwG als bekannt gemacht gilt, ihren Anspruch nach Grund und Höhe in Textform anmelden, Sicherheit zu leisten, soweit sie nicht Befriedigung verlangen können. Dieses Recht steht den Gläubigern jedoch nur zu, wenn sie glaubhaft machen, dass durch die Verschmelzung die Erfüllung ihrer Forderung gefährdet wird."
    },
    {
      "date": "2025-05-17",
      "id": "109410",
      "original_text": "Registerbekanntmachung nach dem Umwandlungsgesetz\nBayern Amtsgericht München HRB 256030\nDataciders Datalytics GmbH – München",
      "type": "Registerbekanntmachung nach dem Umwandlungsgesetz",
      "state": "Bayern",
      "amtsgericht": "Amtsgericht München",
      "registernummer": "HRB 256030",
      "registerart": "HRB",
      "company_name": "Dataciders Datalytics GmbH",
      "company_seat": "München",
      "details": "17.05.2025 (Bekanntmachungsdatum)\n\nBayern Amtsgericht München HRB 256030\nRegisterbekanntmachung nach dem Umwandlungsgesetz 16.05.2025 (Eintragungsdatum)\n\nDataciders Datalytics GmbH\nGesellschaft mit beschränkter Haftung\nMünchen\n\nDen Gläubigern der an der Verschmelzung beteiligten Rechtsträger ist, wenn sie binnen sechs Monaten nach dem Tag, an dem die Eintragung der Verschmelzung in das Register des Sitzes desjenigen Rechtsträgers, dessen Gläubiger sie sind, nach § 19 Abs. 3 UmwG als bekannt gemacht gilt, ihren Anspruch nach Grund und Höhe in Textform anmelden, Sicherheit zu leisten, soweit sie nicht Befriedigung verlangen können. Dieses Recht steht den Gläubigern jedoch nur zu, wenn sie glaubhaft machen, dass durch die Verschmelzung die Erfüllung ihrer Forderung gefährdet wird."
    },
    {
      "date": "2025-05-17",
      "id": "109411",
      "original_text": "Registerbekanntmachung nach dem Umwandlungsgesetz\nBayern Amtsgericht Fürth HRB 14732\nGBI Wohnungsbau Sigma GmbH – Erlangen",
      "type": "Registerbekanntmachung nach dem Umwandlungsgesetz",
      "state": "Bayern",
      "amtsgericht": "Amtsgericht Fürth",
      "registernummer": "HRB 14732",
      "registerart": "HRB",
      "company_name": "GBI Wohnungsbau Sigma GmbH",
      "company_seat": "Erlangen",
      "details": "17.05.2025 (Bekanntmachungsdatum)\n\nBayern Amtsgericht Fürth HRB 14732\nRegisterbekanntmachung nach dem Umwandlungsgesetz 16.05.2025 (Eintragungsdatum)\n\nGBI Wohnungsbau Sigma GmbH\nGesellschaft mit beschränkter Haftung\nErlangen\n\nDen Gläubigern der an der Verschmelzung beteiligten Rechtsträger ist, wenn sie binnen sechs Monaten nach dem Tag, an dem die Eintragung der Verschmelzung in das Register des Sitzes desjenigen Rechtsträgers, dessen Gläubiger sie sind, nach § 19 Abs. 3 UmwG als bekannt gemacht gilt, ihren Anspruch nach Grund und Höhe in Textform anmelden, Sicherheit zu leisten, soweit sie nicht Befriedigung verlangen können. Dieses Recht steht den Gläubigern jedoch nur zu, wenn sie glaubhaft machen, dass durch die Verschmelzung die Erfüllung ihrer Forderung gefährdet wird."
    },
    {
      "date": "2025-05-17",
      "id": "109412",
      "original_text": "Registerbekanntmachung nach dem Umwandlungsgesetz\nBayern Amtsgericht Fürth HRB 14767\nGBI Objekt Wandalenweg 5 GmbH – Erlangen",
      "type": "Registerbekanntmachung nach dem Umwandlungsgesetz",
      "state": "Bayern",
      "amtsgericht": "Amtsgericht Fürth",
      "registernummer": "HRB 14767",
      "registerart": "HRB",
      "company_name": "GBI Objekt Wandalenweg 5 GmbH",
      "company_seat": "Erlangen",
      "details": "17.05.2025 (Bekanntmachungsdatum)\n\nBayern Amtsgericht Fürth HRB 14767\nRegisterbekanntmachung nach dem Umwandlungsgesetz 16.05.2025 (Eintragungsdatum)\n\nGBI Objekt Wandalenweg 5 GmbH\nGesellschaft mit beschränkter Haftung\nErlangen\n\nDen Gläubigern der an der Verschmelzung beteiligten Rechtsträger ist, wenn sie binnen sechs Monaten nach dem Tag, an dem die Eintragung der Verschmelzung in das Register des Sitzes desjenigen Rechtsträgers, dessen Gläubiger sie sind, nach § 19 Abs. 3 UmwG als bekannt gemacht gilt, ihren Anspruch nach Grund und Höhe in Textform anmelden, Sicherheit zu leisten, soweit sie nicht Befriedigung verlangen können. Dieses Recht steht den Gläubigern jedoch nur zu, wenn sie glaubhaft machen, dass durch die Verschmelzung die Erfüllung ihrer Forderung gefährdet wird."
    },
    {
      "date": "2025-05-17",
      "id": "109413",
      "original_text": "Registerbekanntmachung nach dem Umwandlungsgesetz\nNordrhein-Westfalen Amtsgericht Aachen HRB 5496\nRISA Gesellschaft für chemische, technische und wissenschaftliche Planung, Konstruktion, Herstellung, Beratung und Handel mit beschränkter Haftung – Aachen",
      "type": "Registerbekanntmachung nach dem Umwandlungsgesetz",
      "state": "Nordrhein-Westfalen",
      "amtsgericht": "Amtsgericht Aachen",
      "registernummer": "HRB 5496",
      "registerart": "HRB",
      "company_name": "RISA Gesellschaft für chemische, technische und wissenschaftliche Planung, Konstruktion, Herstellung, Beratung und Handel mit beschränkter Haftung",
      "company_seat": "Aachen",
      "details": "17.05.2025 (Bekanntmachungsdatum)\n\nNordrhein-Westfalen Amtsgericht Aachen HRB 5496\nRegisterbekanntmachung nach dem Umwandlungsgesetz 17.05.2025 (Eintragungsdatum)\n\nRISA Gesellschaft für chemische, technische und wissenschaftliche Planung, Konstruktion, Herstellung, Beratung und Handel mit beschränkter Haftung\nGesellschaft mit beschränkter Haftung\nAachen\n\nDen Gläubigern der an der Verschmelzung beteiligten Rechtsträger ist, wenn sie binnen sechs Monaten nach dem Tag, an dem die Eintragung der Verschmelzung in das Register des Sitzes desjenigen Rechtsträgers, dessen Gläubiger sie sind, nach § 19 Absatz 3 UmwG als bekanntgemacht gilt, ihren Anspruch nach Grund und Höhe schriftlich anmelden, Sicherheit zu leisten, soweit sie nicht Befriedigung verlangen können. Dieses Recht steht den Gläubigern jedoch nur zu, wenn sie glaubhaft machen, dass durch die Verschmelzung die Erfüllung ihrer Forderung gefährdet wird."
    },
    {
      "date": "2025-05-17",
      "id": "109414",
      "original_text": "Registerbekanntmachung nach dem Umwandlungsgesetz\nNordrhein-Westfalen Amtsgericht Aachen HRB 6038\nILU, Institut für Untersuchungen von Lebens- und Genußmitteln, Bedarfsgegenständen sowie Kosmetika Gesellschaft mit beschränkter Haftung – Aachen",
      "type": "Registerbekanntmachung nach dem Umwandlungsgesetz",
      "state": "Nordrhein-Westfalen",
      "amtsgericht": "Amtsgericht Aachen",
      "registernummer": "HRB 6038",
      "registerart": "HRB",
      "company_name": "ILU, Institut für Untersuchungen von Lebens- und Genußmitteln, Bedarfsgegenständen sowie Kosmetika Gesellschaft mit beschränkter Haftung",
      "company_seat": "Aachen",
      "details": "17.05.2025 (Bekanntmachungsdatum)\n\nNordrhein-Westfalen Amtsgericht Aachen HRB 6038\nRegisterbekanntmachung nach dem Umwandlungsgesetz 17.05.2025 (Eintragungsdatum)\n\nILU, Institut für Untersuchungen von Lebens- und Genußmitteln, Bedarfsgegenständen sowie Kosmetika Gesellschaft mit beschränkter Haftung\nGesellschaft mit beschränkter Haftung\nAachen\n\nDen Gläubigern der an der Verschmelzung beteiligten Rechtsträger ist, wenn sie binnen sechs Monaten nach dem Tag, an dem die Eintragung der Verschmelzung in das Register des Sitzes desjenigen Rechtsträgers, dessen Gläubiger sie sind, nach § 19 Absatz 3 UmwG als bekanntgemacht gilt, ihren Anspruch nach Grund und Höhe schriftlich anmelden, Sicherheit zu leisten, soweit sie nicht Befriedigung verlangen können. Dieses Recht steht den Gläubigern jedoch nur zu, wenn sie glaubhaft machen, dass durch die Verschmelzung die Erfüllung ihrer Forderung gefährdet wird."
    }
  ]
}