{
  "date": "2025-05-26",
  "date_of_scrape": "2025-05-31T13:00:28.171Z",
  "tool_version": "0.2.0",
  "number_of_announcements": 121,
  "announcements": [
    {
      "date": "2025-05-26",
      "id": "110141",
      "original_text": "Löschungsankündigung\nBaden-Württemberg Amtsgericht Freiburg HRB 720411\nBV Dienstleistungen GmbH – Weil am Rhein",
      "type": "Löschungsankündigung",
      "state": "Baden-Württemberg",
      "amtsgericht": "Amtsgericht Freiburg",
      "registernummer": "HRB 720411",
      "registerart": "HRB",
      "company_name": "BV Dienstleistungen GmbH",
      "company_seat": "Weil am Rhein",
      "details": "26.05.2025 (Bekanntmachungsdatum)\n\nBaden-Württemberg Amtsgericht Freiburg HRB 720411\nLöschungsankündigung 26.05.2025 (Eintragungsdatum)\n\nBV Dienstleistungen GmbH\nGesellschaft mit beschränkter Haftung\nWeil am Rhein\n\nAls nicht eingetragen wird bekanntgemacht:\nDas Gericht beabsichtigt, die Gesellschaft wegen Vermögenslosigkeit im Handelsregister von Amts wegen nach § 394 FamFG zu löschen. Die Frist zur Geltendmachung eines Widerspruchs gegen die beabsichtigte Löschung ist auf einen Monat ab Veröffentlichung bestimmt."
    },
    {
      "date": "2025-05-26",
      "id": "110142",
      "original_text": "Registerbekanntmachung nach dem Umwandlungsgesetz\nBaden-Württemberg Amtsgericht Stuttgart HRB 780136\nsensified Solutions GmbH – Pfullingen",
      "type": "Registerbekanntmachung nach dem Umwandlungsgesetz",
      "state": "Baden-Württemberg",
      "amtsgericht": "Amtsgericht Stuttgart",
      "registernummer": "HRB 780136",
      "registerart": "HRB",
      "company_name": "sensified Solutions GmbH",
      "company_seat": "Pfullingen",
      "details": "26.05.2025 (Bekanntmachungsdatum)\n\nBaden-Württemberg Amtsgericht Stuttgart HRB 780136\nRegisterbekanntmachung nach dem Umwandlungsgesetz 26.05.2025 (Eintragungsdatum)\n\nsensified Solutions GmbH\nGesellschaft mit beschränkter Haftung\nPfullingen\n\nAls nicht eingetragen wird bekanntgemacht:\nDen Gläubigern der an der Verschmelzung beteiligten Rechtsträger ist, wenn sie binnen sechs Monaten nach dem Tag, an dem die Eintragung der Verschmelzung in das Register des Sitzes desjenigen Rechtsträgers, dessen Gläubiger sie sind, nach § 19 Abs. 3 UmwG als bekanntgemacht gilt, ihren Anspruch nach Grund und Höhe schriftlich anmelden, Sicherheit zu leisten, soweit sie nicht Befriedigung verlangen können. Dieses Recht steht den Gläubigern jedoch nur zu, wenn sie glaubhaft machen, dass durch die Verschmelzung die Erfüllung ihrer Forderung gefährdet wird."
    },
    {
      "date": "2025-05-26",
      "id": "110143",
      "original_text": "Registerbekanntmachung nach dem Umwandlungsgesetz\nBaden-Württemberg Amtsgericht Stuttgart HRB 16735\nParitätische Sozialdienste gGmbH – Stuttgart",
      "type": "Registerbekanntmachung nach dem Umwandlungsgesetz",
      "state": "Baden-Württemberg",
      "amtsgericht": "Amtsgericht Stuttgart",
      "registernummer": "HRB 16735",
      "registerart": "HRB",
      "company_name": "Paritätische Sozialdienste gGmbH",
      "company_seat": "Stuttgart",
      "details": "26.05.2025 (Bekanntmachungsdatum)\n\nBaden-Württemberg Amtsgericht Stuttgart HRB 16735\nRegisterbekanntmachung nach dem Umwandlungsgesetz 26.05.2025 (Eintragungsdatum)\n\nParitätische Sozialdienste gGmbH\nGesellschaft mit beschränkter Haftung\nStuttgart\n\nAls nicht eingetragen wird bekanntgemacht:\nDen Gläubigern der an der Verschmelzung beteiligten Rechtsträger ist, wenn sie binnen sechs Monaten nach dem Tag, an dem die Eintragung der Verschmelzung in das Register des Sitzes desjenigen Rechtsträgers, dessen Gläubiger sie sind, nach § 19 Abs. 3 UmwG als bekanntgemacht gilt, ihren Anspruch nach Grund und Höhe schriftlich anmelden, Sicherheit zu leisten, soweit sie nicht Befriedigung verlangen können. Dieses Recht steht den Gläubigern jedoch nur zu, wenn sie glaubhaft machen, dass durch die Verschmelzung die Erfüllung ihrer Forderung gefährdet wird."
    },
    {
      "date": "2025-05-26",
      "id": "110144",
      "original_text": "Registerbekanntmachung nach dem Umwandlungsgesetz\nBerlin Amtsgericht Berlin (Charlottenburg) HRB 215154\nAvrios Germany GmbH – Berlin",
      "type": "Registerbekanntmachung nach dem Umwandlungsgesetz",
      "state": "Berlin",
      "amtsgericht": "Amtsgericht Berlin (Charlottenburg)",
      "registernummer": "HRB 215154",
      "registerart": "HRB",
      "company_name": "Avrios Germany GmbH",
      "company_seat": "Berlin",
      "details": "26.05.2025 (Bekanntmachungsdatum)\n\nBerlin Amtsgericht Berlin (Charlottenburg) HRB 215154\nRegisterbekanntmachung nach dem Umwandlungsgesetz 23.05.2025 (Eintragungsdatum)\n\nAvrios Germany GmbH\nGesellschaft mit beschränkter Haftung\nBerlin\n\nZu Eintragungsnummer 9 vom 23.05.2025 wird als nicht eingetragen veröffentlicht: Den Gläubigern der an der Verschmelzung beteiligten Rechtsträger ist, wenn sie binnen sechs Monaten nach dem Tag, an dem die Eintragung der Verschmelzung in das Register des Sitzes desjenigen Rechtsträgers, dessen Gläubiger sie sind, als bekannt gemacht gilt, ihren Anspruch nach Grund und Höhe schriftlich anmelden, Sicherheit zu leisten, soweit sie nicht Befriedigung verlangen können. Dieses Recht steht den Gläubigern jedoch nur zu, wenn sie glaubhaft machen, dass durch die Verschmelzung die Erfüllung ihrer Forderung gefährdet wird. Das Recht, Sicherheitsleistung zu verlangen, steht Gläubigern nicht zu, die im Falle der Insolvenz ein Recht auf vorzugsweise Befriedigung aus einer Deckungsmasse haben, die nach gesetzlicher Vorschrift zu ihrem Schutz errichtet und staatlich überwacht ist."
    },
    {
      "date": "2025-05-26",
      "id": "110145",
      "original_text": "Registerbekanntmachung nach dem Umwandlungsgesetz\nBerlin Amtsgericht Berlin (Charlottenburg) HRB 216089\nBackbone Art Deutschland GmbH – Berlin",
      "type": "Registerbekanntmachung nach dem Umwandlungsgesetz",
      "state": "Berlin",
      "amtsgericht": "Amtsgericht Berlin (Charlottenburg)",
      "registernummer": "HRB 216089",
      "registerart": "HRB",
      "company_name": "Backbone Art Deutschland GmbH",
      "company_seat": "Berlin",
      "details": "26.05.2025 (Bekanntmachungsdatum)\n\nBerlin Amtsgericht Berlin (Charlottenburg) HRB 216089\nRegisterbekanntmachung nach dem Umwandlungsgesetz 23.05.2025 (Eintragungsdatum)\n\nBackbone Art Deutschland GmbH\nGesellschaft mit beschränkter Haftung\nBerlin\n\nZu Eintragungsnummer 3 vom 23.05.2025 wird als nicht eingetragen veröffentlicht: Den Gläubigern der an der Verschmelzung beteiligten Rechtsträger ist, wenn sie binnen sechs Monaten nach dem Tag, an dem die Eintragung der Verschmelzung in das Register des Sitzes desjenigen Rechtsträgers, dessen Gläubiger sie sind, als bekannt gemacht gilt, ihren Anspruch nach Grund und Höhe schriftlich anmelden, Sicherheit zu leisten, soweit sie nicht Befriedigung verlangen können. Dieses Recht steht den Gläubigern jedoch nur zu, wenn sie glaubhaft machen, dass durch die Verschmelzung die Erfüllung ihrer Forderung gefährdet wird. Das Recht, Sicherheitsleistung zu verlangen, steht Gläubigern nicht zu, die im Falle der Insolvenz ein Recht auf vorzugsweise Befriedigung aus einer Deckungsmasse haben, die nach gesetzlicher Vorschrift zu ihrem Schutz errichtet und staatlich überwacht ist."
    },
    {
      "date": "2025-05-26",
      "id": "110146",
      "original_text": "Registerbekanntmachung nach dem Umwandlungsgesetz\nBerlin Amtsgericht Berlin (Charlottenburg) HRB 247276\nShiftmove GmbH – Berlin",
      "type": "Registerbekanntmachung nach dem Umwandlungsgesetz",
      "state": "Berlin",
      "amtsgericht": "Amtsgericht Berlin (Charlottenburg)",
      "registernummer": "HRB 247276",
      "registerart": "HRB",
      "company_name": "Shiftmove GmbH",
      "company_seat": "Berlin",
      "details": "26.05.2025 (Bekanntmachungsdatum)\n\nBerlin Amtsgericht Berlin (Charlottenburg) HRB 247276\nRegisterbekanntmachung nach dem Umwandlungsgesetz 23.05.2025 (Eintragungsdatum)\n\nShiftmove GmbH\nGesellschaft mit beschränkter Haftung\nBerlin\n\nZu Eintragungsnummer 9 vom 23.05.2025 wird als nicht eingetragen veröffentlicht: Den Gläubigern der an der Verschmelzung beteiligten Rechtsträger ist, wenn sie binnen sechs Monaten nach dem Tag, an dem die Eintragung der Verschmelzung in das Register des Sitzes desjenigen Rechtsträgers, dessen Gläubiger sie sind, als bekannt gemacht gilt, ihren Anspruch nach Grund und Höhe schriftlich anmelden, Sicherheit zu leisten, soweit sie nicht Befriedigung verlangen können. Dieses Recht steht den Gläubigern jedoch nur zu, wenn sie glaubhaft machen, dass durch die Verschmelzung die Erfüllung ihrer Forderung gefährdet wird. Das Recht, Sicherheitsleistung zu verlangen, steht Gläubigern nicht zu, die im Falle der Insolvenz ein Recht auf vorzugsweise Befriedigung aus einer Deckungsmasse haben, die nach gesetzlicher Vorschrift zu ihrem Schutz errichtet und staatlich überwacht ist."
    },
    {
      "date": "2025-05-26",
      "id": "110147",
      "original_text": "Einreichung neuer Dokumente\nBaden-Württemberg Amtsgericht Mannheim HRB 503104\nVolkshochschule Pforzheim-Enzkreis GmbH – Pforzheim",
      "type": "Einreichung neuer Dokumente",
      "state": "Baden-Württemberg",
      "amtsgericht": "Amtsgericht Mannheim",
      "registernummer": "HRB 503104",
      "registerart": "HRB",
      "company_name": "Volkshochschule Pforzheim-Enzkreis GmbH",
      "company_seat": "Pforzheim",
      "details": "26.05.2025 (Bekanntmachungsdatum)\n\nBaden-Württemberg Amtsgericht Mannheim HRB 503104\nEinreichung neuer Dokumente 26.05.2025 (Eintragungsdatum)\n\nVolkshochschule Pforzheim-Enzkreis GmbH\nGesellschaft mit beschränkter Haftung\nPforzheim\n\nDie Gesellschaft hat am 22.05.2025 die Liste über die Zusammensetzung des Aufsichtsrats zum Handelsregister eingereicht."
    },
    {
      "date": "2025-05-26",
      "id": "110148",
      "original_text": "Löschungsankündigung\nBerlin Amtsgericht Berlin (Charlottenburg) HRB 168809\nRubin Bau- und Handels GmbH – Berlin",
      "type": "Löschungsankündigung",
      "state": "Berlin",
      "amtsgericht": "Amtsgericht Berlin (Charlottenburg)",
      "registernummer": "HRB 168809",
      "registerart": "HRB",
      "company_name": "Rubin Bau- und Handels GmbH",
      "company_seat": "Berlin",
      "details": "26.05.2025 (Bekanntmachungsdatum)\n\nBerlin Amtsgericht Berlin (Charlottenburg) HRB 168809\nLöschungsankündigung\n\nRubin Bau- und Handels GmbH\nGesellschaft mit beschränkter Haftung\nBerlin\n\nBei der nachstehenden Gesellschaft wird das Amtslöschungsverfahren gemäß § 394 FamFG eingeleitet. Widerspruchsfrist 6 Wochen"
    },
    {
      "date": "2025-05-26",
      "id": "110149",
      "original_text": "Registerbekanntmachung nach dem Umwandlungsgesetz\nBaden-Württemberg Amtsgericht Ulm HRB 720446\nKraftwerksgesellschaft Unterkochen GmbH – Aalen",
      "type": "Registerbekanntmachung nach dem Umwandlungsgesetz",
      "state": "Baden-Württemberg",
      "amtsgericht": "Amtsgericht Ulm",
      "registernummer": "HRB 720446",
      "registerart": "HRB",
      "company_name": "Kraftwerksgesellschaft Unterkochen GmbH",
      "company_seat": "Aalen",
      "details": "26.05.2025 (Bekanntmachungsdatum)\n\nBaden-Württemberg Amtsgericht Ulm HRB 720446\nRegisterbekanntmachung nach dem Umwandlungsgesetz 26.05.2025 (Eintragungsdatum)\n\nKraftwerksgesellschaft Unterkochen GmbH\nGesellschaft mit beschränkter Haftung\nAalen\n\nAls nicht eingetragen wird bekanntgemacht:\nDen Gläubigern der an der Verschmelzung beteiligten Rechtsträger ist, wenn sie binnen sechs Monaten nach dem Tag, an dem die Eintragung der Verschmelzung in das Register des Sitzes desjenigen Rechtsträgers, dessen Gläubiger sie sind, nach § 19 Abs. 3 UmwG als bekanntgemacht gilt, ihren Anspruch nach Grund und Höhe schriftlich anmelden, Sicherheit zu leisten, soweit sie nicht Befriedigung verlangen können. Dieses Recht steht den Gläubigern jedoch nur zu, wenn sie glaubhaft machen, dass durch die Verschmelzung die Erfüllung ihrer Forderung gefährdet wird."
    },
    {
      "date": "2025-05-26",
      "id": "110150",
      "original_text": "Registerbekanntmachung nach dem Umwandlungsgesetz\nBaden-Württemberg Amtsgericht Ulm HRB 501106\nMunksjö Unterkochen GmbH – Aalen",
      "type": "Registerbekanntmachung nach dem Umwandlungsgesetz",
      "state": "Baden-Württemberg",
      "amtsgericht": "Amtsgericht Ulm",
      "registernummer": "HRB 501106",
      "registerart": "HRB",
      "company_name": "Munksjö Unterkochen GmbH",
      "company_seat": "Aalen",
      "details": "26.05.2025 (Bekanntmachungsdatum)\n\nBaden-Württemberg Amtsgericht Ulm HRB 501106\nRegisterbekanntmachung nach dem Umwandlungsgesetz 26.05.2025 (Eintragungsdatum)\n\nMunksjö Unterkochen GmbH\nGesellschaft mit beschränkter Haftung\nAalen\n\nAls nicht eingetragen wird bekanntgemacht:\nDen Gläubigern der an der Verschmelzung beteiligten Rechtsträger ist, wenn sie binnen sechs Monaten nach dem Tag, an dem die Eintragung der Verschmelzung in das Register des Sitzes desjenigen Rechtsträgers, dessen Gläubiger sie sind, nach § 19 Abs. 3 UmwG als bekanntgemacht gilt, ihren Anspruch nach Grund und Höhe schriftlich anmelden, Sicherheit zu leisten, soweit sie nicht Befriedigung verlangen können. Dieses Recht steht den Gläubigern jedoch nur zu, wenn sie glaubhaft machen, dass durch die Verschmelzung die Erfüllung ihrer Forderung gefährdet wird."
    },
    {
      "date": "2025-05-26",
      "id": "110151",
      "original_text": "Löschungsankündigung\nBaden-Württemberg Amtsgericht Stuttgart HRB 742277\nPESEUS Invest und Vermögen AG – Böblingen",
      "type": "Löschungsankündigung",
      "state": "Baden-Württemberg",
      "amtsgericht": "Amtsgericht Stuttgart",
      "registernummer": "HRB 742277",
      "registerart": "HRB",
      "company_name": "PESEUS Invest und Vermögen AG",
      "company_seat": "Böblingen",
      "details": "26.05.2025 (Bekanntmachungsdatum)\n\nBaden-Württemberg Amtsgericht Stuttgart HRB 742277\nLöschungsankündigung 07.04.2025 (Eintragungsdatum)\n\nPESEUS Invest und Vermögen AG\nAktiengesellschaft\nBöblingen\n\nDas Gericht beabsichtigt, die Gesellschaft wegen Vermögenslosigkeit im Handelsregister von Amts wegen nach § 394 FamFG zu löschen. Die Frist zur Geltendmachung eines Widerspruchs gegen die beabsichtigte Löschung ist auf zwei Monate ab Veröffentlichung bestimmt."
    },
    {
      "date": "2025-05-26",
      "id": "110152",
      "original_text": "Einreichung neuer Dokumente\nBaden-Württemberg Amtsgericht Stuttgart HRB 777193\nVersicherungsCheck24 AG – Winnenden",
      "type": "Einreichung neuer Dokumente",
      "state": "Baden-Württemberg",
      "amtsgericht": "Amtsgericht Stuttgart",
      "registernummer": "HRB 777193",
      "registerart": "HRB",
      "company_name": "VersicherungsCheck24 AG",
      "company_seat": "Winnenden",
      "details": "26.05.2025 (Bekanntmachungsdatum)\n\nBaden-Württemberg Amtsgericht Stuttgart HRB 777193\nEinreichung neuer Dokumente\n\nVersicherungsCheck24 AG\nAktiengesellschaft\nWinnenden\n\nDie Gesellschaft hat am 22.05.2025 die Liste über die Zusammensetzung des Aufsichtsrats zum Handelsregister eingereicht."
    },
    {
      "date": "2025-05-26",
      "id": "110153",
      "original_text": "Löschungsankündigung\nBerlin Amtsgericht Berlin (Charlottenburg) HRB 179869\nAH-Restaurantbetriebsgesellschaft mbH – Berlin·",
      "type": "Löschungsankündigung",
      "state": "Berlin",
      "amtsgericht": "Amtsgericht Berlin (Charlottenburg)",
      "registernummer": "HRB 179869",
      "registerart": "HRB",
      "company_name": "AH-Restaurantbetriebsgesellschaft mbH",
      "company_seat": "Berlin·",
      "details": "26.05.2025 (Bekanntmachungsdatum)\n\nBerlin Amtsgericht Berlin (Charlottenburg) HRB 179869\nLöschungsankündigung\n\nAH-Restaurantbetriebsgesellschaft mbH\nGesellschaft mit beschränkter Haftung\nBerlin·\n\nBei der nachstehenden Gesellschaft wird das Amtslöschungsverfahren gemäß § 394 FamFG eingeleitet. Widerspruchsfrist 6 Wochen"
    },
    {
      "date": "2025-05-26",
      "id": "110154",
      "original_text": "Löschungsankündigung\nBaden-Württemberg Amtsgericht Ulm HRB 740417\nQT Swiss Systems Engineering GmbH – Berg",
      "type": "Löschungsankündigung",
      "state": "Baden-Württemberg",
      "amtsgericht": "Amtsgericht Ulm",
      "registernummer": "HRB 740417",
      "registerart": "HRB",
      "company_name": "QT Swiss Systems Engineering GmbH",
      "company_seat": "Berg",
      "details": "26.05.2025 (Bekanntmachungsdatum)\n\nBaden-Württemberg Amtsgericht Ulm HRB 740417\nLöschungsankündigung\n\nQT Swiss Systems Engineering GmbH\nGesellschaft mit beschränkter Haftung\nBerg\n\nAls nicht eingetragen wird bekanntgemacht:\nDas Gericht beabsichtigt, die Gesellschaft wegen Vermögenslosigkeit im Handelsregister von Amts wegen nach § 394 FamFG zu löschen. Die Frist zur Geltendmachung eines Widerspruchs gegen die beabsichtigte Löschung ist auf  einen Monat ab Veröffentlichung bestimmt."
    },
    {
      "date": "2025-05-26",
      "id": "110155",
      "original_text": "Registerbekanntmachung nach dem Umwandlungsgesetz\nBrandenburg Amtsgericht Cottbus HRB 18779\nSEA Nerd GmbH – Bestensee",
      "type": "Registerbekanntmachung nach dem Umwandlungsgesetz",
      "state": "Brandenburg",
      "amtsgericht": "Amtsgericht Cottbus",
      "registernummer": "HRB 18779",
      "registerart": "HRB",
      "company_name": "SEA Nerd GmbH",
      "company_seat": "Bestensee",
      "details": "26.05.2025 (Bekanntmachungsdatum)\n\nBrandenburg Amtsgericht Cottbus HRB 18779\nRegisterbekanntmachung nach dem Umwandlungsgesetz 23.05.2025 (Eintragungsdatum)\n\nSEA Nerd GmbH\nGesellschaft mit beschränkter Haftung\nBestensee\n\nAls nicht eingetragen wird veröffentlicht:\nDen Gläubigern der an der Verschmelzung beteiligten Rechtsträger ist, wenn sie binnen sechs Monaten nach dem Tag, an dem die Eintragung der Verschmelzung in das Register des Sitzes desjenigen Rechtsträgers, dessen Gläubiger sie sind, als bekannt gemacht gilt, ihren Anspruch nach Grund und Höhe schriftlich anmelden, Sicherheit zu leisten, soweit sie nicht Befriedigung verlangen können. Dieses Recht steht den Gläubigern jedoch nur zu, wenn sie glaubhaft machen, dass durch die Verschmelzung die Erfüllung ihrer Forderung gefährdet wird wird als nicht eingetragen veröffentlicht:"
    },
    {
      "date": "2025-05-26",
      "id": "110156",
      "original_text": "Registerbekanntmachung nach dem Umwandlungsgesetz\nSachsen-Anhalt Amtsgericht Stendal HRB 30407\nPROLOGA Services GmbH – Halle (Saale)",
      "type": "Registerbekanntmachung nach dem Umwandlungsgesetz",
      "state": "Sachsen-Anhalt",
      "amtsgericht": "Amtsgericht Stendal",
      "registernummer": "HRB 30407",
      "registerart": "HRB",
      "company_name": "PROLOGA Services GmbH",
      "company_seat": "Halle (Saale)",
      "details": "26.05.2025 (Bekanntmachungsdatum)\n\nSachsen-Anhalt Amtsgericht Stendal HRB 30407\nRegisterbekanntmachung nach dem Umwandlungsgesetz 26.05.2025 (Eintragungsdatum)\n\nPROLOGA Services GmbH\nGesellschaft mit beschränkter Haftung\nHalle (Saale)\n\nNicht eingetragen:\nDen Gläubigern der an der Verschmelzung beteiligten Rechtsträger ist, wenn sie binnen sechs Monaten nach dem Tag, an dem die Eintragung der Verschmelzung nach § 19 Abs. 3 UmwG als bekanntgemacht gilt, ihren Anspruch nach Grund und Höhe schriftlich anmelden, Sicherheit zu leisten, soweit sie nicht Befriedigung verlangen können. Dieses Recht steht ihnen jedoch nur zu, wenn sie glaubhaft machen, dass durch die Verschmelzung die Erfüllung ihrer Forderung gefährdet wird."
    },
    {
      "date": "2025-05-26",
      "id": "110157",
      "original_text": "Registerbekanntmachung nach dem Umwandlungsgesetz\nSachsen-Anhalt Amtsgericht Stendal HRB 213721\nPROLOGA GmbH – Halle (Saale)",
      "type": "Registerbekanntmachung nach dem Umwandlungsgesetz",
      "state": "Sachsen-Anhalt",
      "amtsgericht": "Amtsgericht Stendal",
      "registernummer": "HRB 213721",
      "registerart": "HRB",
      "company_name": "PROLOGA GmbH",
      "company_seat": "Halle (Saale)",
      "details": "26.05.2025 (Bekanntmachungsdatum)\n\nSachsen-Anhalt Amtsgericht Stendal HRB 213721\nRegisterbekanntmachung nach dem Umwandlungsgesetz 26.05.2025 (Eintragungsdatum)\n\nPROLOGA GmbH\nGesellschaft mit beschränkter Haftung\nHalle (Saale)\n\nNicht eingetragen:\nDen Gläubigern der an der Verschmelzung beteiligten Rechtsträger ist, wenn sie binnen sechs Monaten nach dem Tag, an dem die Eintragung der Verschmelzung nach § 19 Abs. 3 UmwG als bekanntgemacht gilt, ihren Anspruch nach Grund und Höhe schriftlich anmelden, Sicherheit zu leisten, soweit sie nicht Befriedigung verlangen können. Dieses Recht steht ihnen jedoch nur zu, wenn sie glaubhaft machen, dass durch die Verschmelzung die Erfüllung ihrer Forderung gefährdet wird."
    },
    {
      "date": "2025-05-26",
      "id": "110158",
      "original_text": "Registerbekanntmachung nach dem Umwandlungsgesetz\nSachsen-Anhalt Amtsgericht Stendal HRB 20475\nPROLOGA Energy GmbH – Halle (Saale)",
      "type": "Registerbekanntmachung nach dem Umwandlungsgesetz",
      "state": "Sachsen-Anhalt",
      "amtsgericht": "Amtsgericht Stendal",
      "registernummer": "HRB 20475",
      "registerart": "HRB",
      "company_name": "PROLOGA Energy GmbH",
      "company_seat": "Halle (Saale)",
      "details": "26.05.2025 (Bekanntmachungsdatum)\n\nSachsen-Anhalt Amtsgericht Stendal HRB 20475\nRegisterbekanntmachung nach dem Umwandlungsgesetz 26.05.2025 (Eintragungsdatum)\n\nPROLOGA Energy GmbH\nGesellschaft mit beschränkter Haftung\nHalle (Saale)\n\nNicht eingetragen:\nDen Gläubigern der an der Verschmelzung beteiligten Rechtsträger ist, wenn sie binnen sechs Monaten nach dem Tag, an dem die Eintragung der Verschmelzung nach § 19 Abs. 3 UmwG als bekanntgemacht gilt, ihren Anspruch nach Grund und Höhe schriftlich anmelden, Sicherheit zu leisten, soweit sie nicht Befriedigung verlangen können. Dieses Recht steht ihnen jedoch nur zu, wenn sie glaubhaft machen, dass durch die Verschmelzung die Erfüllung ihrer Forderung gefährdet wird."
    },
    {
      "date": "2025-05-26",
      "id": "110159",
      "original_text": "Registerbekanntmachung nach dem Umwandlungsgesetz\nBerlin Amtsgericht Berlin (Charlottenburg) HRB 210560\nRadtke Media GmbH – Berlin",
      "type": "Registerbekanntmachung nach dem Umwandlungsgesetz",
      "state": "Berlin",
      "amtsgericht": "Amtsgericht Berlin (Charlottenburg)",
      "registernummer": "HRB 210560",
      "registerart": "HRB",
      "company_name": "Radtke Media GmbH",
      "company_seat": "Berlin",
      "details": "26.05.2025 (Bekanntmachungsdatum)\n\nBerlin Amtsgericht Berlin (Charlottenburg) HRB 210560\nRegisterbekanntmachung nach dem Umwandlungsgesetz 26.05.2025 (Eintragungsdatum)\n\nRadtke Media GmbH\nGesellschaft mit beschränkter Haftung\nBerlin\n\nZu Eintragungsnummer 3 vom 26.05.2025 wird als nicht eingetragen veröffentlicht: Den Gläubigern der an der Verschmelzung beteiligten Rechtsträger ist, wenn sie binnen sechs Monaten nach dem Tag, an dem die Eintragung der Verschmelzung in das Register des Sitzes desjenigen Rechtsträgers, dessen Gläubiger sie sind, als bekannt gemacht gilt, ihren Anspruch nach Grund und Höhe schriftlich anmelden, Sicherheit zu leisten, soweit sie nicht Befriedigung verlangen können. Dieses Recht steht den Gläubigern jedoch nur zu, wenn sie glaubhaft machen, dass durch die Verschmelzung die Erfüllung ihrer Forderung gefährdet wird. Das Recht, Sicherheitsleistung zu verlangen, steht Gläubigern nicht zu, die im Falle der Insolvenz ein Recht auf vorzugsweise Befriedigung aus einer Deckungsmasse haben, die nach gesetzlicher Vorschrift zu ihrem Schutz errichtet und staatlich überwacht ist."
    },
    {
      "date": "2025-05-26",
      "id": "110160",
      "original_text": "Einreichung neuer Dokumente\nBerlin Amtsgericht Berlin (Charlottenburg) HRB 248259\nSolaris SE – Berlin",
      "type": "Einreichung neuer Dokumente",
      "state": "Berlin",
      "amtsgericht": "Amtsgericht Berlin (Charlottenburg)",
      "registernummer": "HRB 248259",
      "registerart": "HRB",
      "company_name": "Solaris SE",
      "company_seat": "Berlin",
      "details": "26.05.2025 (Bekanntmachungsdatum)\n\nBerlin Amtsgericht Berlin (Charlottenburg) HRB 248259\nEinreichung neuer Dokumente\n\nSolaris SE\nEuropäische Aktiengesellschaft (SE)\nBerlin\n\nAls nicht eingetragen wird veröffentlicht: Es wurde eine neue Liste der Aufsichtsratsmitglieder eingereicht (§ 106 AktG)."
    },
    {
      "date": "2025-05-26",
      "id": "110161",
      "original_text": "Registerbekanntmachung nach dem Umwandlungsgesetz\nSchleswig-Holstein Amtsgericht Lübeck HRB 3691 RE\nJUNIUS Grundstücksgesellschaft m.b.H. – Reinbek",
      "type": "Registerbekanntmachung nach dem Umwandlungsgesetz",
      "state": "Schleswig-Holstein",
      "amtsgericht": "Amtsgericht Lübeck",
      "registernummer": "HRB 3691 RE",
      "registerart": "HRB",
      "company_name": "JUNIUS Grundstücksgesellschaft m.b.H.",
      "company_seat": "Reinbek",
      "details": "26.05.2025 (Bekanntmachungsdatum)\n\nSchleswig-Holstein Amtsgericht Lübeck HRB 3691 RE\nRegisterbekanntmachung nach dem Umwandlungsgesetz 26.05.2025 (Eintragungsdatum)\n\nJUNIUS Grundstücksgesellschaft m.b.H.\nGesellschaft mit beschränkter Haftung\nReinbek\n\nZu Eintragungsnummer 4 vom 26.05.2025 wird als nicht eingetragen veröffentlicht: Den Gläubigern der an der Verschmelzung beteiligten Rechtsträger ist, wenn sie binnen sechs Monaten nach dem Tag, an dem die Eintragung der Verschmelzung in das Register des Sitzes desjenigen Rechtsträgers, dessen Gläubiger sie sind, als bekannt gemacht gilt, ihren Anspruch nach Grund und Höhe schriftlich anmelden, Sicherheit zu leisten, soweit sie nicht Befriedigung verlangen können. Dieses Recht steht den Gläubigern jedoch nur zu, wenn sie glaubhaft machen, dass durch die Verschmelzung die Erfüllung ihrer Forderung gefährdet wird."
    },
    {
      "date": "2025-05-26",
      "id": "110162",
      "original_text": "Registerbekanntmachung nach dem Umwandlungsgesetz\nBerlin Amtsgericht Berlin (Charlottenburg) HRB 269246\nMektec Europe GmbH – Berlin",
      "type": "Registerbekanntmachung nach dem Umwandlungsgesetz",
      "state": "Berlin",
      "amtsgericht": "Amtsgericht Berlin (Charlottenburg)",
      "registernummer": "HRB 269246",
      "registerart": "HRB",
      "company_name": "Mektec Europe GmbH",
      "company_seat": "Berlin",
      "details": "26.05.2025 (Bekanntmachungsdatum)\n\nBerlin Amtsgericht Berlin (Charlottenburg) HRB 269246\nRegisterbekanntmachung nach dem Umwandlungsgesetz 26.05.2025 (Eintragungsdatum)\n\nMektec Europe GmbH\nGesellschaft mit beschränkter Haftung\nBerlin\n\nZu Eintragungsnummer 4 vom 26.05.2025 wird als nicht eingetragen veröffentlicht: Den Gläubigern der an der Verschmelzung beteiligten Rechtsträger ist, wenn sie binnen sechs Monaten nach dem Tag, an dem die Eintragung der Verschmelzung in das Register des Sitzes desjenigen Rechtsträgers, dessen Gläubiger sie sind, als bekannt gemacht gilt, ihren Anspruch nach Grund und Höhe schriftlich anmelden, Sicherheit zu leisten, soweit sie nicht Befriedigung verlangen können. Dieses Recht steht den Gläubigern jedoch nur zu, wenn sie glaubhaft machen, dass durch die Verschmelzung die Erfüllung ihrer Forderung gefährdet wird. Das Recht, Sicherheitsleistung zu verlangen, steht Gläubigern nicht zu, die im Falle der Insolvenz ein Recht auf vorzugsweise Befriedigung aus einer Deckungsmasse haben, die nach gesetzlicher Vorschrift zu ihrem Schutz errichtet und staatlich überwacht ist."
    },
    {
      "date": "2025-05-26",
      "id": "110163",
      "original_text": "Löschungsankündigung\nBaden-Württemberg Amtsgericht Ulm HRB 729512\nTai Handelsgesellschaft mbH – Göppingen",
      "type": "Löschungsankündigung",
      "state": "Baden-Württemberg",
      "amtsgericht": "Amtsgericht Ulm",
      "registernummer": "HRB 729512",
      "registerart": "HRB",
      "company_name": "Tai Handelsgesellschaft mbH",
      "company_seat": "Göppingen",
      "details": "26.05.2025 (Bekanntmachungsdatum)\n\nBaden-Württemberg Amtsgericht Ulm HRB 729512\nLöschungsankündigung\n\nTai Handelsgesellschaft mbH\nGesellschaft mit beschränkter Haftung\nGöppingen\n\nAls nicht eingetragen wird bekanntgemacht:\nDas Gericht beabsichtigt, die Gesellschaft wegen Vermögenslosigkeit im Handelsregister von Amts wegen nach § 394 FamFG zu löschen. Die Frist zur Geltendmachung eines Widerspruchs gegen die beabsichtigte Löschung ist auf  einen Monat ab Veröffentlichung bestimmt."
    },
    {
      "date": "2025-05-26",
      "id": "110164",
      "original_text": "Registerbekanntmachung nach dem Umwandlungsgesetz\nBerlin Amtsgericht Berlin (Charlottenburg) HRB 247743\nKhaljani UG (haftungsbeschränkt) – Berlin",
      "type": "Registerbekanntmachung nach dem Umwandlungsgesetz",
      "state": "Berlin",
      "amtsgericht": "Amtsgericht Berlin (Charlottenburg)",
      "registernummer": "HRB 247743",
      "registerart": "HRB",
      "company_name": "Khaljani UG (haftungsbeschränkt)",
      "company_seat": "Berlin",
      "details": "26.05.2025 (Bekanntmachungsdatum)\n\nBerlin Amtsgericht Berlin (Charlottenburg) HRB 247743\nRegisterbekanntmachung nach dem Umwandlungsgesetz 23.05.2025 (Eintragungsdatum)\n\nKhaljani UG (haftungsbeschränkt)\nGesellschaft mit beschränkter Haftung\nBerlin\n\nZu Eintragungsnummer 2 vom 23.05.2025 wird als nicht eingetragen veröffentlicht: Den Gläubigern der an der Verschmelzung beteiligten Rechtsträger ist, wenn sie binnen sechs Monaten nach dem Tag, an dem die Eintragung der Verschmelzung in das Register des Sitzes desjenigen Rechtsträgers, dessen Gläubiger sie sind, als bekannt gemacht gilt, ihren Anspruch nach Grund und Höhe schriftlich anmelden, Sicherheit zu leisten, soweit sie nicht Befriedigung verlangen können. Dieses Recht steht den Gläubigern jedoch nur zu, wenn sie glaubhaft machen, dass durch die Verschmelzung die Erfüllung ihrer Forderung gefährdet wird. Das Recht, Sicherheitsleistung zu verlangen, steht Gläubigern nicht zu, die im Falle der Insolvenz ein Recht auf vorzugsweise Befriedigung aus einer Deckungsmasse haben, die nach gesetzlicher Vorschrift zu ihrem Schutz errichtet und staatlich überwacht ist."
    },
    {
      "date": "2025-05-26",
      "id": "110165",
      "original_text": "Registerbekanntmachung nach dem Umwandlungsgesetz\nBerlin Amtsgericht Berlin (Charlottenburg) HRB 249387\nLYVY GmbH – Berlin",
      "type": "Registerbekanntmachung nach dem Umwandlungsgesetz",
      "state": "Berlin",
      "amtsgericht": "Amtsgericht Berlin (Charlottenburg)",
      "registernummer": "HRB 249387",
      "registerart": "HRB",
      "company_name": "LYVY GmbH",
      "company_seat": "Berlin",
      "details": "26.05.2025 (Bekanntmachungsdatum)\n\nBerlin Amtsgericht Berlin (Charlottenburg) HRB 249387\nRegisterbekanntmachung nach dem Umwandlungsgesetz 23.05.2025 (Eintragungsdatum)\n\nLYVY GmbH\nGesellschaft mit beschränkter Haftung\nBerlin\n\nZu Eintragungsnummer 2 vom 23.05.2025 wird als nicht eingetragen veröffentlicht: Den Gläubigern der an der Verschmelzung beteiligten Rechtsträger ist, wenn sie binnen sechs Monaten nach dem Tag, an dem die Eintragung der Verschmelzung in das Register des Sitzes desjenigen Rechtsträgers, dessen Gläubiger sie sind, als bekannt gemacht gilt, ihren Anspruch nach Grund und Höhe schriftlich anmelden, Sicherheit zu leisten, soweit sie nicht Befriedigung verlangen können. Dieses Recht steht den Gläubigern jedoch nur zu, wenn sie glaubhaft machen, dass durch die Verschmelzung die Erfüllung ihrer Forderung gefährdet wird. Das Recht, Sicherheitsleistung zu verlangen, steht Gläubigern nicht zu, die im Falle der Insolvenz ein Recht auf vorzugsweise Befriedigung aus einer Deckungsmasse haben, die nach gesetzlicher Vorschrift zu ihrem Schutz errichtet und staatlich überwacht ist."
    },
    {
      "date": "2025-05-26",
      "id": "110166",
      "original_text": "Löschungsankündigung\nBrandenburg Amtsgericht Potsdam HRB 34110\nVirgo Transport Gesellschaft mbH – Falkensee",
      "type": "Löschungsankündigung",
      "state": "Brandenburg",
      "amtsgericht": "Amtsgericht Potsdam",
      "registernummer": "HRB 34110",
      "registerart": "HRB",
      "company_name": "Virgo Transport Gesellschaft mbH",
      "company_seat": "Falkensee",
      "details": "26.05.2025 (Bekanntmachungsdatum)\n\nBrandenburg Amtsgericht Potsdam HRB 34110\nLöschungsankündigung\n\nVirgo Transport Gesellschaft mbH\nGesellschaft mit beschränkter Haftung\nFalkensee\n\nBei der nachstehenden Gesellschaft wird das Amtslöschungsverfahren gemäß § 394 FamFG eingeleitet. Widerspruchsfrist: 8 Wochen."
    },
    {
      "date": "2025-05-26",
      "id": "110167",
      "original_text": "Registerbekanntmachung nach dem Umwandlungsgesetz\nBerlin Amtsgericht Berlin (Charlottenburg) HRB 237431\nSmart & Green Management Services GmbH – Berlin",
      "type": "Registerbekanntmachung nach dem Umwandlungsgesetz",
      "state": "Berlin",
      "amtsgericht": "Amtsgericht Berlin (Charlottenburg)",
      "registernummer": "HRB 237431",
      "registerart": "HRB",
      "company_name": "Smart & Green Management Services GmbH",
      "company_seat": "Berlin",
      "details": "26.05.2025 (Bekanntmachungsdatum)\n\nBerlin Amtsgericht Berlin (Charlottenburg) HRB 237431\nRegisterbekanntmachung nach dem Umwandlungsgesetz 23.05.2025 (Eintragungsdatum)\n\nSmart & Green Management Services GmbH\nGesellschaft mit beschränkter Haftung\nBerlin\n\nZu Eintragungsnummer 2 vom 23.05.2025 wird als nicht eingetragen veröffentlicht:Den Gläubigern der an der Verschmelzung beteiligten Rechtsträger ist, wenn sie binnen sechs Monaten nach dem Tag, an dem die Eintragung der Verschmelzung in das Register des Sitzes desjenigen Rechtsträgers, dessen Gläubiger sie sind, als bekannt gemacht gilt, ihren Anspruch nach Grund und Höhe schriftlich anmelden, Sicherheit zu leisten, soweit sie nicht Befriedigung verlangen können. Dieses Recht steht den Gläubigern jedoch nur zu, wenn sie glaubhaft machen, dass durch die Verschmelzung die Erfüllung ihrer Forderung gefährdet wird. Das Recht, Sicherheitsleistung zu verlangen, steht Gläubigern nicht zu, die im Falle der Insolvenz ein Recht auf vorzugsweise Befriedigung aus einer Deckungsmasse haben, die nach gesetzlicher Vorschrift zu ihrem Schutz errichtet und staatlich überwacht ist."
    },
    {
      "date": "2025-05-26",
      "id": "110168",
      "original_text": "Registerbekanntmachung nach dem Umwandlungsgesetz\nBaden-Württemberg Amtsgericht Stuttgart HRB 800006\nM-Kling IT-Training GmbH – Stuttgart",
      "type": "Registerbekanntmachung nach dem Umwandlungsgesetz",
      "state": "Baden-Württemberg",
      "amtsgericht": "Amtsgericht Stuttgart",
      "registernummer": "HRB 800006",
      "registerart": "HRB",
      "company_name": "M-Kling IT-Training GmbH",
      "company_seat": "Stuttgart",
      "details": "26.05.2025 (Bekanntmachungsdatum)\n\nBaden-Württemberg Amtsgericht Stuttgart HRB 800006\nRegisterbekanntmachung nach dem Umwandlungsgesetz 26.05.2025 (Eintragungsdatum)\n\nM-Kling IT-Training GmbH\nGesellschaft mit beschränkter Haftung\nStuttgart\n\nDen Gläubigern der an der Ausgliederung beteiligten Rechtsträger ist, wenn sie binnen sechs Monaten nach dem Tag, an dem die Eintragung der Ausgliederung in das Register des Sitzes desjenigen Rechtsträgers, dessen Gläubiger sie sind, nach § 19 Abs. 3 UmwG als bekanntgemacht gilt, ihren Anspruch nach Grund und Höhe schriftlich anmelden, Sicherheit zu leisten, soweit sie nicht Befriedigung verlangen können. Dieses Recht steht den Gläubigern jedoch nur zu, wenn sie glaubhaft machen, dass durch die Ausgliederung die Erfüllung ihrer Forderung gefährdet wird."
    },
    {
      "date": "2025-05-26",
      "id": "110169",
      "original_text": "Registerbekanntmachung nach dem Umwandlungsgesetz\nBaden-Württemberg Amtsgericht Ulm HRB 1308\nKGN Verwaltungsgesellschaft mbH – Nellingen",
      "type": "Registerbekanntmachung nach dem Umwandlungsgesetz",
      "state": "Baden-Württemberg",
      "amtsgericht": "Amtsgericht Ulm",
      "registernummer": "HRB 1308",
      "registerart": "HRB",
      "company_name": "KGN Verwaltungsgesellschaft mbH",
      "company_seat": "Nellingen",
      "details": "26.05.2025 (Bekanntmachungsdatum)\n\nBaden-Württemberg Amtsgericht Ulm HRB 1308\nRegisterbekanntmachung nach dem Umwandlungsgesetz 26.05.2025 (Eintragungsdatum)\n\nKGN Verwaltungsgesellschaft mbH\nGesellschaft mit beschränkter Haftung\nNellingen\n\nAls nicht eingetragen wird bekanntgemacht:\nDen Gläubigern der an der Verschmelzung beteiligten Rechtsträger ist, wenn sie binnen sechs Monaten nach dem Tag, an dem die Eintragung der Verschmelzung in das Register des Sitzes desjenigen Rechtsträgers, dessen Gläubiger sie sind, nach § 19 Abs. 3 UmwG als bekanntgemacht gilt, ihren Anspruch nach Grund und Höhe schriftlich anmelden, Sicherheit zu leisten, soweit sie nicht Befriedigung verlangen können. Dieses Recht steht den Gläubigern jedoch nur zu, wenn sie glaubhaft machen, dass durch die Verschmelzung die Erfüllung ihrer Forderung gefährdet wird."
    },
    {
      "date": "2025-05-26",
      "id": "110170",
      "original_text": "Registerbekanntmachung nach dem Umwandlungsgesetz\nBerlin Amtsgericht Berlin (Charlottenburg) HRB 249265\nAnsorg Investment Management GmbH – Berlin",
      "type": "Registerbekanntmachung nach dem Umwandlungsgesetz",
      "state": "Berlin",
      "amtsgericht": "Amtsgericht Berlin (Charlottenburg)",
      "registernummer": "HRB 249265",
      "registerart": "HRB",
      "company_name": "Ansorg Investment Management GmbH",
      "company_seat": "Berlin",
      "details": "26.05.2025 (Bekanntmachungsdatum)\n\nBerlin Amtsgericht Berlin (Charlottenburg) HRB 249265\nRegisterbekanntmachung nach dem Umwandlungsgesetz 26.05.2025 (Eintragungsdatum)\n\nAnsorg Investment Management GmbH\nGesellschaft mit beschränkter Haftung\nBerlin\n\nZu Eintragungsnummer 7 vom 26.05.2025 wird als nicht eingetragen veröffentlicht: Den Gläubigern der an der Verschmelzung beteiligten Rechtsträger ist, wenn sie binnen sechs Monaten nach dem Tag, an dem die Eintragung der Verschmelzung in das Register des Sitzes desjenigen Rechtsträgers, dessen Gläubiger sie sind, als bekannt gemacht gilt, ihren Anspruch nach Grund und Höhe schriftlich anmelden, Sicherheit zu leisten, soweit sie nicht Befriedigung verlangen können. Dieses Recht steht den Gläubigern jedoch nur zu, wenn sie glaubhaft machen, dass durch die Verschmelzung die Erfüllung ihrer Forderung gefährdet wird. Das Recht, Sicherheitsleistung zu verlangen, steht Gläubigern nicht zu, die im Falle der Insolvenz ein Recht auf vorzugsweise Befriedigung aus einer Deckungsmasse haben, die nach gesetzlicher Vorschrift zu ihrem Schutz errichtet und staatlich überwacht ist."
    },
    {
      "date": "2025-05-26",
      "id": "110171",
      "original_text": "Registerbekanntmachung nach dem Umwandlungsgesetz\nBaden-Württemberg Amtsgericht Mannheim HRB 742874\nAlexandra Beteiligungs-, Holding- und Vermögensverwaltungsgesellschaft mbH – Mannheim",
      "type": "Registerbekanntmachung nach dem Umwandlungsgesetz",
      "state": "Baden-Württemberg",
      "amtsgericht": "Amtsgericht Mannheim",
      "registernummer": "HRB 742874",
      "registerart": "HRB",
      "company_name": "Alexandra Beteiligungs-, Holding- und Vermögensverwaltungsgesellschaft mbH",
      "company_seat": "Mannheim",
      "details": "26.05.2025 (Bekanntmachungsdatum)\n\nBaden-Württemberg Amtsgericht Mannheim HRB 742874\nRegisterbekanntmachung nach dem Umwandlungsgesetz 26.05.2025 (Eintragungsdatum)\n\nAlexandra Beteiligungs-, Holding- und Vermögensverwaltungsgesellschaft mbH\nGesellschaft mit beschränkter Haftung\nMannheim\n\nDen Gläubigern der an der Verschmelzung beteiligten Rechtsträger ist, wenn sie binnen sechs Monaten nach dem Tag, an dem die Eintragung der Verschmelzung in das Register des Sitzes desjenigen Rechtsträgers, dessen Gläubiger sie sind, nach § 19 Abs. 3 UmwG als bekanntgemacht gilt, ihren Anspruch nach Grund und Höhe schriftlich anmelden, Sicherheit zu leisten, soweit sie nicht Befriedigung verlangen können. Dieses Recht steht den Gläubigern jedoch nur zu, wenn sie glaubhaft machen, dass durch die Verschmelzung die Erfüllung ihrer Forderung gefährdet wird."
    },
    {
      "date": "2025-05-26",
      "id": "110172",
      "original_text": "Einreichung neuer Dokumente\nThüringen Amtsgericht Jena HRB 209419\nINTERSHOP Communications Aktiengesellschaft – Jena",
      "type": "Einreichung neuer Dokumente",
      "state": "Thüringen",
      "amtsgericht": "Amtsgericht Jena",
      "registernummer": "HRB 209419",
      "registerart": "HRB",
      "company_name": "INTERSHOP Communications Aktiengesellschaft",
      "company_seat": "Jena",
      "details": "26.05.2025 (Bekanntmachungsdatum)\n\nThüringen Amtsgericht Jena HRB 209419\nEinreichung neuer Dokumente 16.05.2025 (Eintragungsdatum)\n\nINTERSHOP Communications Aktiengesellschaft\nAktiengesellschaft\nJena\n\nBekanntmachung gem. § 106 AktG: Aufgrund einer Veränderung in den Personen der Aufsichtsratsmitglieder ist durch den Vorstand eine neue Liste zum Handelsregister eingereicht worden."
    },
    {
      "date": "2025-05-26",
      "id": "110173",
      "original_text": "Löschungsankündigung\nSachsen-Anhalt Amtsgericht Stendal HRB 32216\nClass-Bau GmbH – Magdeburg",
      "type": "Löschungsankündigung",
      "state": "Sachsen-Anhalt",
      "amtsgericht": "Amtsgericht Stendal",
      "registernummer": "HRB 32216",
      "registerart": "HRB",
      "company_name": "Class-Bau GmbH",
      "company_seat": "Magdeburg",
      "details": "26.05.2025 (Bekanntmachungsdatum)\n\nSachsen-Anhalt Amtsgericht Stendal HRB 32216\nLöschungsankündigung\n\nClass-Bau GmbH\nGesellschaft mit beschränkter Haftung\nMagdeburg\n\nDas Registergericht beabsichtigt, nachfolgende Gesellschaften wegen Vermögenslosigkeit von Amts wegen nach § 394 FamFG zu löschen. Die Frist zur Erhebung eines Widerspruchs gegen die beabsichtigte Löschung wird auf drei Monate festgesetzt."
    },
    {
      "date": "2025-05-26",
      "id": "110174",
      "original_text": "Registerbekanntmachung nach dem Umwandlungsgesetz\nSchleswig-Holstein Amtsgericht Kiel HRB 15534\nJAM Logistics & Consulting GmbH – Kiel",
      "type": "Registerbekanntmachung nach dem Umwandlungsgesetz",
      "state": "Schleswig-Holstein",
      "amtsgericht": "Amtsgericht Kiel",
      "registernummer": "HRB 15534",
      "registerart": "HRB",
      "company_name": "JAM Logistics & Consulting GmbH",
      "company_seat": "Kiel",
      "details": "26.05.2025 (Bekanntmachungsdatum)\n\nSchleswig-Holstein Amtsgericht Kiel HRB 15534\nRegisterbekanntmachung nach dem Umwandlungsgesetz 23.11.2021 (Eintragungsdatum)\n\nJAM Logistics & Consulting GmbH\nGesellschaft mit beschränkter Haftung\nKiel\n\nZu Eintragungsnummer 4 vom 23.11.2021 wird als nicht eingetragen veröffentlicht: Als nicht eingetragen wird veröffentlicht: Den Gläubigern der an der Verschmelzung beteiligten Rechtsträger ist, wenn sie binnen sechs Monaten nach dem Tag, an dem die Eintragung der Verschmelzung in das Register des Sitzes desjenigen Rechtsträgers, dessen Gläubiger sie sind, nach § 19 Abs. 3 UmwG bekannt gemacht worden ist, ihren Anspruch nach Grund und Höhe schriftlich anmelden, Sicherheit zu leisten, soweit sie nicht Befriedigung verlangen können. Dieses Recht steht den Gläubigern jedoch nur zu, wenn sie glaubhaft machen, dass durch die Verschmelzung die Erfüllung ihrer Forderung gefährdet wird."
    },
    {
      "date": "2025-05-26",
      "id": "110175",
      "original_text": "Löschungsankündigung\nBerlin Amtsgericht Berlin (Charlottenburg) HRB 171742\nUniprobau GmbH – Berlin",
      "type": "Löschungsankündigung",
      "state": "Berlin",
      "amtsgericht": "Amtsgericht Berlin (Charlottenburg)",
      "registernummer": "HRB 171742",
      "registerart": "HRB",
      "company_name": "Uniprobau GmbH",
      "company_seat": "Berlin",
      "details": "26.05.2025 (Bekanntmachungsdatum)\n\nBerlin Amtsgericht Berlin (Charlottenburg) HRB 171742\nLöschungsankündigung\n\nUniprobau GmbH\nGesellschaft mit beschränkter Haftung\nBerlin\n\nBei der nachstehenden Gesellschaft wird das Amtslöschungsverfahren gemäß § 394 FamFG eingeleitet. Widerspruchsfrist 6 Wochen"
    },
    {
      "date": "2025-05-26",
      "id": "110176",
      "original_text": "Einreichung neuer Dokumente\nBaden-Württemberg Amtsgericht Mannheim HRB 202535\nRolf Schulz HR Consultants AG – Baden-Baden",
      "type": "Einreichung neuer Dokumente",
      "state": "Baden-Württemberg",
      "amtsgericht": "Amtsgericht Mannheim",
      "registernummer": "HRB 202535",
      "registerart": "HRB",
      "company_name": "Rolf Schulz HR Consultants AG",
      "company_seat": "Baden-Baden",
      "details": "26.05.2025 (Bekanntmachungsdatum)\n\nBaden-Württemberg Amtsgericht Mannheim HRB 202535\nEinreichung neuer Dokumente 26.05.2025 (Eintragungsdatum)\n\nRolf Schulz HR Consultants AG\nAktiengesellschaft\nBaden-Baden\n\nDie Gesellschaft hat am 13.05.2025 die Liste über die Zusammensetzung des Aufsichtsrats zum Handelsregister eingereicht."
    },
    {
      "date": "2025-05-26",
      "id": "110177",
      "original_text": "Sonstige Registerbekanntmachung\nBerlin Amtsgericht Berlin (Charlottenburg) HRA 63543\nPaul Schleicher Performance Marketing e.K. – Berlin",
      "type": "Sonstige Registerbekanntmachung",
      "state": "Berlin",
      "amtsgericht": "Amtsgericht Berlin (Charlottenburg)",
      "registernummer": "HRA 63543",
      "registerart": "HRA",
      "company_name": "Paul Schleicher Performance Marketing e.K.",
      "company_seat": "Berlin",
      "details": "26.05.2025 (Bekanntmachungsdatum)\n\nBerlin Amtsgericht Berlin (Charlottenburg) HRA 63543\nSonstige Registerbekanntmachung\n\nPaul Schleicher Performance Marketing e.K.\nEinzelkaufmann / Einzelkauffrau\nBerlin\n\nAls nicht eingetragen wird veröffentlicht: Den Gläubigern der an der Spaltung beteiligten Rechtsträger ist, wenn sie binnen sechs Monaten nach dem Tag, an dem die Eintragung der Spaltung in das Register des Sitzes desjenigen Rechtsträgers, dessen Gläubiger sie sind, als bekannt gemacht gilt, ihren Anspruch nach Grund und Höhe schriftlich anmelden, Sicherheit zu leisten, soweit sie nicht Befriedigung verlangen können. Dieses Recht steht den Gläubigern jedoch nur zu, wenn sie glaubhaft machen, dass durch die Spaltung die Erfüllung ihrer Forderung gefährdet wird. Das Recht, Sicherheitsleistung zu verlangen, steht Gläubigern nicht zu, die im Falle der Insolvenz ein Recht auf vorzugsweise Befriedigung aus einer Deckungsmasse haben, die nach gesetzlicher Vorschrift zu ihrem Schutz errichtet und staatlich überwacht ist."
    },
    {
      "date": "2025-05-26",
      "id": "110178",
      "original_text": "Sonstige Registerbekanntmachung\nHamburg Amtsgericht Hamburg HRB 173382\nWolf Concept Immobilien GmbH – Hamburg",
      "type": "Sonstige Registerbekanntmachung",
      "state": "Hamburg",
      "amtsgericht": "Amtsgericht Hamburg",
      "registernummer": "HRB 173382",
      "registerart": "HRB",
      "company_name": "Wolf Concept Immobilien GmbH",
      "company_seat": "Hamburg",
      "details": "26.05.2025 (Bekanntmachungsdatum)\n\nHamburg Amtsgericht Hamburg HRB 173382\nSonstige Registerbekanntmachung\n\nWolf Concept Immobilien GmbH\nGesellschaft mit beschränkter Haftung\nHamburg\n\nEs wurde beantragt einen Nachtragsliquidator zur gelöschten Gesellschaft \" Wolf Concept Immobilien GmbH \" vormals eingetragen beim Amtsgericht Hamburg, unter HRB 173382, zwecks Durchsetzung der Rechte des Gläubigers Herrn Robert A. Depner, Bergisch Gladbach, aus einer Grundschuld in Höhe von 250.000,- Euro zuzüglich Zinsen lastend auf dem Grundbesitz: Gebäude und Freifläche in Recklinghausen, eingetragen im Grundbuch von Recklinghausen, Blatt 10349, Flur 643, Flurstück 369, dessen Eigentümerin die gelöschte Gesellschaft ist, zu bestellen und die Gesellschaft wieder in das Handelsregister einzutragen, damit der Gläubiger Herr Robert A. Depner seine Rechte im Wege der Zwangsversteigerung geltend machen kann. Den Beteiligten wird zur Wahrung des rechtlichen Gehörs Gelegenheit zur Stellungnahme, binnen einer Frist von 4 Wochen, ab Veröffentlichung gewährt."
    },
    {
      "date": "2025-05-26",
      "id": "110179",
      "original_text": "Einreichung neuer Dokumente\nBerlin Amtsgericht Berlin (Charlottenburg) HRB 259709\nWallround GmbH – Berlin",
      "type": "Einreichung neuer Dokumente",
      "state": "Berlin",
      "amtsgericht": "Amtsgericht Berlin (Charlottenburg)",
      "registernummer": "HRB 259709",
      "registerart": "HRB",
      "company_name": "Wallround GmbH",
      "company_seat": "Berlin",
      "details": "26.05.2025 (Bekanntmachungsdatum)\n\nBerlin Amtsgericht Berlin (Charlottenburg) HRB 259709\nEinreichung neuer Dokumente\n\nWallround GmbH\nGesellschaft mit beschränkter Haftung\nBerlin\n\nAls nicht eingetragen wird veröffentlicht: Es wurde eine neue Liste der Beiratsmitglieder eingereicht (§52 GmbHG)."
    },
    {
      "date": "2025-05-26",
      "id": "110180",
      "original_text": "Löschungsankündigung\nBrandenburg Amtsgericht Frankfurt/Oder HRB 18676\nKWE Performance GmbH – Wandlitz",
      "type": "Löschungsankündigung",
      "state": "Brandenburg",
      "amtsgericht": "Amtsgericht Frankfurt/Oder",
      "registernummer": "HRB 18676",
      "registerart": "HRB",
      "company_name": "KWE Performance GmbH",
      "company_seat": "Wandlitz",
      "details": "26.05.2025 (Bekanntmachungsdatum)\n\nBrandenburg Amtsgericht Frankfurt/Oder HRB 18676\nLöschungsankündigung\n\nKWE Performance GmbH\nGesellschaft mit beschränkter Haftung\nWandlitz\n\nBei der nachstehenden Gesellschaft wird das Amtslöschungsverfahren gemäß § 394 FamFG eingeleitet."
    },
    {
      "date": "2025-05-26",
      "id": "110181",
      "original_text": "Löschungsankündigung\nBrandenburg Amtsgericht Cottbus HRB 7341\nHoff GmbH – Forst/Lausitz",
      "type": "Löschungsankündigung",
      "state": "Brandenburg",
      "amtsgericht": "Amtsgericht Cottbus",
      "registernummer": "HRB 7341",
      "registerart": "HRB",
      "company_name": "Hoff GmbH",
      "company_seat": "Forst/Lausitz",
      "details": "26.05.2025 (Bekanntmachungsdatum)\n\nBrandenburg Amtsgericht Cottbus HRB 7341\nLöschungsankündigung\n\nHoff GmbH\nGesellschaft mit beschränkter Haftung\nForst/Lausitz\n\nBei der nachstehenden Gesellschaft wird das Amtslöschungsverfahren gemäß § 394 FamFG eingeleitet."
    },
    {
      "date": "2025-05-26",
      "id": "110182",
      "original_text": "Registerbekanntmachung nach dem Umwandlungsgesetz\nBaden-Württemberg Amtsgericht Mannheim HRB 709365\nATASON Dritte Casino-Betriebs GmbH – Stutensee",
      "type": "Registerbekanntmachung nach dem Umwandlungsgesetz",
      "state": "Baden-Württemberg",
      "amtsgericht": "Amtsgericht Mannheim",
      "registernummer": "HRB 709365",
      "registerart": "HRB",
      "company_name": "ATASON Dritte Casino-Betriebs GmbH",
      "company_seat": "Stutensee",
      "details": "26.05.2025 (Bekanntmachungsdatum)\n\nBaden-Württemberg Amtsgericht Mannheim HRB 709365\nRegisterbekanntmachung nach dem Umwandlungsgesetz 26.05.2025 (Eintragungsdatum)\n\nATASON Dritte Casino-Betriebs GmbH\nGesellschaft mit beschränkter Haftung\nStutensee\n\nDen Gläubigern der an der Verschmelzung beteiligten Rechtsträger ist, wenn sie binnen sechs Monaten nach dem Tag, an dem die Eintragung der Verschmelzung in das Register des Sitzes desjenigen Rechtsträgers, dessen Gläubiger sie sind, nach § 19 Abs. 3 UmwG als bekanntgemacht gilt, ihren Anspruch nach Grund und Höhe schriftlich anmelden, Sicherheit zu leisten, soweit sie nicht Befriedigung verlangen können. Dieses Recht steht den Gläubigern jedoch nur zu, wenn sie glaubhaft machen, dass durch die Verschmelzung die Erfüllung ihrer Forderung gefährdet wird."
    },
    {
      "date": "2025-05-26",
      "id": "110183",
      "original_text": "Registerbekanntmachung nach dem Umwandlungsgesetz\nBaden-Württemberg Amtsgericht Mannheim HRB 712272\nTOPGAN Management GmbH – Stutensee",
      "type": "Registerbekanntmachung nach dem Umwandlungsgesetz",
      "state": "Baden-Württemberg",
      "amtsgericht": "Amtsgericht Mannheim",
      "registernummer": "HRB 712272",
      "registerart": "HRB",
      "company_name": "TOPGAN Management GmbH",
      "company_seat": "Stutensee",
      "details": "26.05.2025 (Bekanntmachungsdatum)\n\nBaden-Württemberg Amtsgericht Mannheim HRB 712272\nRegisterbekanntmachung nach dem Umwandlungsgesetz 26.05.2025 (Eintragungsdatum)\n\nTOPGAN Management GmbH\nGesellschaft mit beschränkter Haftung\nStutensee\n\nDen Gläubigern der an der Verschmelzung beteiligten Rechtsträger ist, wenn sie binnen sechs Monaten nach dem Tag, an dem die Eintragung der Verschmelzung in das Register des Sitzes desjenigen Rechtsträgers, dessen Gläubiger sie sind, nach § 19 Abs. 3 UmwG als bekanntgemacht gilt, ihren Anspruch nach Grund und Höhe schriftlich anmelden, Sicherheit zu leisten, soweit sie nicht Befriedigung verlangen können. Dieses Recht steht den Gläubigern jedoch nur zu, wenn sie glaubhaft machen, dass durch die Verschmelzung die Erfüllung ihrer Forderung gefährdet wird."
    },
    {
      "date": "2025-05-26",
      "id": "110184",
      "original_text": "Löschungsankündigung\nSchleswig-Holstein Amtsgericht Flensburg HRB 13348\nLeitec aquisition and research GmbH – Sylt",
      "type": "Löschungsankündigung",
      "state": "Schleswig-Holstein",
      "amtsgericht": "Amtsgericht Flensburg",
      "registernummer": "HRB 13348",
      "registerart": "HRB",
      "company_name": "Leitec aquisition and research GmbH",
      "company_seat": "Sylt",
      "details": "26.05.2025 (Bekanntmachungsdatum)\n\nSchleswig-Holstein Amtsgericht Flensburg HRB 13348\nLöschungsankündigung\n\nLeitec aquisition and research GmbH\nGesellschaft mit beschränkter Haftung\nSylt\n\nEs ist die Löschung der nachstehenden Gesellschaft wegen Vermögenslosigkeit gemäß § 394 FamFG beabsichtigt.\nWiderspruchsfrist: 2 Monate"
    },
    {
      "date": "2025-05-26",
      "id": "110185",
      "original_text": "Einreichung neuer Dokumente\nBaden-Württemberg Amtsgericht Freiburg HRB 390485\nHERRENKNECHT AKTIENGESELLSCHAFT – Schwanau",
      "type": "Einreichung neuer Dokumente",
      "state": "Baden-Württemberg",
      "amtsgericht": "Amtsgericht Freiburg",
      "registernummer": "HRB 390485",
      "registerart": "HRB",
      "company_name": "HERRENKNECHT AKTIENGESELLSCHAFT",
      "company_seat": "Schwanau",
      "details": "26.05.2025 (Bekanntmachungsdatum)\n\nBaden-Württemberg Amtsgericht Freiburg HRB 390485\nEinreichung neuer Dokumente\n\nHERRENKNECHT AKTIENGESELLSCHAFT\nAktiengesellschaft\nSchwanau\n\nDie Gesellschaft hat am 23.05.2025 die Liste über die Zusammensetzung des Aufsichtsrats zum Handelsregister eingereicht."
    },
    {
      "date": "2025-05-26",
      "id": "110186",
      "original_text": "Einreichung neuer Dokumente\nBerlin Amtsgericht Berlin (Charlottenburg) HRB 154517\nAxel Springer SE – Berlin",
      "type": "Einreichung neuer Dokumente",
      "state": "Berlin",
      "amtsgericht": "Amtsgericht Berlin (Charlottenburg)",
      "registernummer": "HRB 154517",
      "registerart": "HRB",
      "company_name": "Axel Springer SE",
      "company_seat": "Berlin",
      "details": "26.05.2025 (Bekanntmachungsdatum)\n\nBerlin Amtsgericht Berlin (Charlottenburg) HRB 154517\nEinreichung neuer Dokumente\n\nAxel Springer SE\nEuropäische Aktiengesellschaft (SE)\nBerlin\n\nAls nicht eingetragen wird veröffentlicht: Es wurde eine neue Liste der Aufsichtsratsmitglieder eingereicht (§ 106 AktG)."
    },
    {
      "date": "2025-05-26",
      "id": "110187",
      "original_text": "Registerbekanntmachung nach dem Umwandlungsgesetz\nSchleswig-Holstein Amtsgericht Pinneberg VR 611 EL\nFlora and the Diamonds e.V. – Elmshorn",
      "type": "Registerbekanntmachung nach dem Umwandlungsgesetz",
      "state": "Schleswig-Holstein",
      "amtsgericht": "Amtsgericht Pinneberg",
      "registernummer": "VR 611 EL",
      "registerart": "VR",
      "company_name": "Flora and the Diamonds e.V.",
      "company_seat": "Elmshorn",
      "details": "26.05.2025 (Bekanntmachungsdatum)\n\nSchleswig-Holstein Amtsgericht Pinneberg VR 611 EL\nRegisterbekanntmachung nach dem Umwandlungsgesetz 21.05.2025 (Eintragungsdatum)\n\nFlora and the Diamonds e.V.\neingetragener Verein\nElmshorn\n\nZu Eintragungsnummer 6 vom 21.05.2025 wird als nicht eingetragen veröffentlicht: Den Gläubigern der an der Verschmelzung beteiligten Rechtsträger ist, wenn sie binnen sechs Monaten nach dem Tag, an dem die Eintragung der Verschmelzung in das Register des Sitzes desjenigen Rechtsträgers, dessen Gläubiger sie sind, als bekannt gemacht gilt, ihren Anspruch nach Grund und Höhe schriftlich anmelden, Sicherheit zu leisten, soweit sie nicht Befriedigung verlangen können. Dieses Recht steht den Gläubigern jedoch nur zu, wenn sie glaubhaft machen, dass durch die Verschmelzung die Erfüllung ihrer Forderung gefährdet wird. Das Recht, Sicherheitsleistung zu verlangen, steht Gläubigern nicht zu, die im Falle der Insolvenz ein Recht auf vorzugsweise Befriedigung aus einer Deckungsmasse haben, die nach gesetzlicher Vorschrift zu ihrem Schutz errichtet und staatlich überwacht ist."
    },
    {
      "date": "2025-05-26",
      "id": "110188",
      "original_text": "Löschungsankündigung\nBaden-Württemberg Amtsgericht Stuttgart HRB 740293\nEhrle Elektromaschinenbau GmbH – Asperg",
      "type": "Löschungsankündigung",
      "state": "Baden-Württemberg",
      "amtsgericht": "Amtsgericht Stuttgart",
      "registernummer": "HRB 740293",
      "registerart": "HRB",
      "company_name": "Ehrle Elektromaschinenbau GmbH",
      "company_seat": "Asperg",
      "details": "26.05.2025 (Bekanntmachungsdatum)\n\nBaden-Württemberg Amtsgericht Stuttgart HRB 740293\nLöschungsankündigung\n\nEhrle Elektromaschinenbau GmbH\nGesellschaft mit beschränkter Haftung\nAsperg\n\nDas Gericht beabsichtigt, die Gesellschaft wegen Vermögenslosigkeit im Handelsregister von Amts wegen nach § 394 FamFG zu löschen. Die Frist zur Geltendmachung eines Widerspruchs gegen die beabsichtigte Löschung ist auf zwei Monate ab Veröffentlichung bestimmt."
    },
    {
      "date": "2025-05-26",
      "id": "110189",
      "original_text": "Löschungsankündigung\nBaden-Württemberg Amtsgericht Stuttgart HRB 778486\nÉAVN Atelier UG (haftungsbeschränkt) – Talheim",
      "type": "Löschungsankündigung",
      "state": "Baden-Württemberg",
      "amtsgericht": "Amtsgericht Stuttgart",
      "registernummer": "HRB 778486",
      "registerart": "HRB",
      "company_name": "ÉAVN Atelier UG (haftungsbeschränkt)",
      "company_seat": "Talheim",
      "details": "26.05.2025 (Bekanntmachungsdatum)\n\nBaden-Württemberg Amtsgericht Stuttgart HRB 778486\nLöschungsankündigung\n\nÉAVN Atelier UG (haftungsbeschränkt)\nGesellschaft mit beschränkter Haftung\nTalheim\n\nDas Gericht beabsichtigt, die Gesellschaft wegen Vermögenslosigkeit im Handelsregister von Amts wegen nach § 394 FamFG zu löschen. Die Frist zur Geltendmachung eines Widerspruchs gegen die beabsichtigte Löschung ist auf zwei Monate ab Veröffentlichung bestimmt."
    },
    {
      "date": "2025-05-26",
      "id": "110190",
      "original_text": "Registerbekanntmachung nach dem Umwandlungsgesetz\nHamburg Amtsgericht Hamburg HRB 116060\nNorthrail GmbH – Hamburg",
      "type": "Registerbekanntmachung nach dem Umwandlungsgesetz",
      "state": "Hamburg",
      "amtsgericht": "Amtsgericht Hamburg",
      "registernummer": "HRB 116060",
      "registerart": "HRB",
      "company_name": "Northrail GmbH",
      "company_seat": "Hamburg",
      "details": "26.05.2025 (Bekanntmachungsdatum)\n\nHamburg Amtsgericht Hamburg HRB 116060\nRegisterbekanntmachung nach dem Umwandlungsgesetz 26.05.2025 (Eintragungsdatum)\n\nNorthrail GmbH\nGesellschaft mit beschränkter Haftung\nHamburg\n\nAls nicht eingetragen wird bekannt gemacht:\nDen Gläubigern der an der Verschmelzung beteiligten Gesellschaften ist, wenn sie binnen sechs Monaten nach dem Tag, an dem die Eintragung der Verschmelzung in das Register des Sitzes desjenigen Rechtsträgers, dessen Gläubiger sie sind, nach § 19 Absatz 3 UmwG als bekannt gemacht gilt, ihren Anspruch nach Grund und Höhe schriftlich anmelden, Sicherheit zu leisten, soweit sie nicht Befriedigung verlangen können. Dieses Recht steht den Gläubigern jedoch nur zu, wenn sie glaubhaft machen, dass durch die Verschmelzung die Erfüllung ihrer Forderung gefährdet wird."
    },
    {
      "date": "2025-05-26",
      "id": "110191",
      "original_text": "Registerbekanntmachung nach dem Umwandlungsgesetz\nHamburg Amtsgericht Hamburg HRB 125655\nHAM-LOG-GRUPPE Holding GmbH – Hamburg",
      "type": "Registerbekanntmachung nach dem Umwandlungsgesetz",
      "state": "Hamburg",
      "amtsgericht": "Amtsgericht Hamburg",
      "registernummer": "HRB 125655",
      "registerart": "HRB",
      "company_name": "HAM-LOG-GRUPPE Holding GmbH",
      "company_seat": "Hamburg",
      "details": "26.05.2025 (Bekanntmachungsdatum)\n\nHamburg Amtsgericht Hamburg HRB 125655\nRegisterbekanntmachung nach dem Umwandlungsgesetz 26.05.2025 (Eintragungsdatum)\n\nHAM-LOG-GRUPPE Holding GmbH\nGesellschaft mit beschränkter Haftung\nHamburg\n\nAls nicht eingetragen wird bekannt gemacht:\nDen Gläubigern der an der Verschmelzung beteiligten Gesellschaften ist, wenn sie binnen sechs Monaten nach dem Tag, an dem die Eintragung der Verschmelzung in das Register des Sitzes desjenigen Rechtsträgers, dessen Gläubiger sie sind, nach § 19 Absatz 3 UmwG als bekannt gemacht gilt, ihren Anspruch nach Grund und Höhe schriftlich anmelden, Sicherheit zu leisten, soweit sie nicht Befriedigung verlangen können. Dieses Recht steht den Gläubigern jedoch nur zu, wenn sie glaubhaft machen, dass durch die Verschmelzung die Erfüllung ihrer Forderung gefährdet wird."
    },
    {
      "date": "2025-05-26",
      "id": "110192",
      "original_text": "Registerbekanntmachung nach dem Umwandlungsgesetz\nHamburg Amtsgericht Hamburg HRB 172743\nNorthrail AG – Hamburg",
      "type": "Registerbekanntmachung nach dem Umwandlungsgesetz",
      "state": "Hamburg",
      "amtsgericht": "Amtsgericht Hamburg",
      "registernummer": "HRB 172743",
      "registerart": "HRB",
      "company_name": "Northrail AG",
      "company_seat": "Hamburg",
      "details": "26.05.2025 (Bekanntmachungsdatum)\n\nHamburg Amtsgericht Hamburg HRB 172743\nRegisterbekanntmachung nach dem Umwandlungsgesetz 26.05.2025 (Eintragungsdatum)\n\nNorthrail AG\nAktiengesellschaft\nHamburg\n\nAls nicht eingetragen wird bekannt gemacht:\nDen Gläubigern der an der Verschmelzung beteiligten Gesellschaften ist, wenn sie binnen sechs Monaten nach dem Tag, an dem die Eintragung der Verschmelzung in das Register des Sitzes desjenigen Rechtsträgers, dessen Gläubiger sie sind, nach § 19 Absatz 3 UmwG als bekannt gemacht gilt, ihren Anspruch nach Grund und Höhe schriftlich anmelden, Sicherheit zu leisten, soweit sie nicht Befriedigung verlangen können. Dieses Recht steht den Gläubigern jedoch nur zu, wenn sie glaubhaft machen, dass durch die Verschmelzung die Erfüllung ihrer Forderung gefährdet wird."
    },
    {
      "date": "2025-05-26",
      "id": "110193",
      "original_text": "Registerbekanntmachung nach dem Umwandlungsgesetz\nHamburg Amtsgericht Hamburg HRB 172068\nHAM-LOG GRUPPE Holding GmbH – Hamburg",
      "type": "Registerbekanntmachung nach dem Umwandlungsgesetz",
      "state": "Hamburg",
      "amtsgericht": "Amtsgericht Hamburg",
      "registernummer": "HRB 172068",
      "registerart": "HRB",
      "company_name": "HAM-LOG GRUPPE Holding GmbH",
      "company_seat": "Hamburg",
      "details": "26.05.2025 (Bekanntmachungsdatum)\n\nHamburg Amtsgericht Hamburg HRB 172068\nRegisterbekanntmachung nach dem Umwandlungsgesetz 26.05.2025 (Eintragungsdatum)\n\nHAM-LOG GRUPPE Holding GmbH\nGesellschaft mit beschränkter Haftung\nHamburg\n\nAls nicht eingetragen wird bekannt gemacht:\nDen Gläubigern der an der Verschmelzung beteiligten Gesellschaften ist, wenn sie binnen sechs Monaten nach dem Tag, an dem die Eintragung der Verschmelzung in das Register des Sitzes desjenigen Rechtsträgers, dessen Gläubiger sie sind, nach § 19 Absatz 3 UmwG als bekannt gemacht gilt, ihren Anspruch nach Grund und Höhe schriftlich anmelden, Sicherheit zu leisten, soweit sie nicht Befriedigung verlangen können. Dieses Recht steht den Gläubigern jedoch nur zu, wenn sie glaubhaft machen, dass durch die Verschmelzung die Erfüllung ihrer Forderung gefährdet wird."
    },
    {
      "date": "2025-05-26",
      "id": "110194",
      "original_text": "Registerbekanntmachung nach dem Umwandlungsgesetz\nBerlin Amtsgericht Berlin (Charlottenburg) HRB 245468\nFT Beteiligung GmbH – Berlin",
      "type": "Registerbekanntmachung nach dem Umwandlungsgesetz",
      "state": "Berlin",
      "amtsgericht": "Amtsgericht Berlin (Charlottenburg)",
      "registernummer": "HRB 245468",
      "registerart": "HRB",
      "company_name": "FT Beteiligung GmbH",
      "company_seat": "Berlin",
      "details": "26.05.2025 (Bekanntmachungsdatum)\n\nBerlin Amtsgericht Berlin (Charlottenburg) HRB 245468\nRegisterbekanntmachung nach dem Umwandlungsgesetz 23.05.2025 (Eintragungsdatum)\n\nFT Beteiligung GmbH\nGesellschaft mit beschränkter Haftung\nBerlin\n\nZu Eintragungsnummer 8 vom 23.05.2025 wird als nicht eingetragen veröffentlicht: Den Gläubigern der an der Verschmelzung beteiligten Rechtsträger ist, wenn sie binnen sechs Monaten nach dem Tag, an dem die Eintragung der Verschmelzung in das Register des Sitzes desjenigen Rechtsträgers, dessen Gläubiger sie sind, als bekannt gemacht gilt, ihren Anspruch nach Grund und Höhe schriftlich anmelden, Sicherheit zu leisten, soweit sie nicht Befriedigung verlangen können. Dieses Recht steht den Gläubigern jedoch nur zu, wenn sie glaubhaft machen, dass durch die Verschmelzung die Erfüllung ihrer Forderung gefährdet wird. Das Recht, Sicherheitsleistung zu verlangen, steht Gläubigern nicht zu, die im Falle der Insolvenz ein Recht auf vorzugsweise Befriedigung aus einer Deckungsmasse haben, die nach gesetzlicher Vorschrift zu ihrem Schutz errichtet und staatlich überwacht ist."
    },
    {
      "date": "2025-05-26",
      "id": "110195",
      "original_text": "Registerbekanntmachung nach dem Umwandlungsgesetz\nSchleswig-Holstein Amtsgericht Kiel HRB 15358\nDVS Deutscher Versicherungsdienst für das Schornsteinfegerhandwerk Verwaltungs GmbH – Nortorf",
      "type": "Registerbekanntmachung nach dem Umwandlungsgesetz",
      "state": "Schleswig-Holstein",
      "amtsgericht": "Amtsgericht Kiel",
      "registernummer": "HRB 15358",
      "registerart": "HRB",
      "company_name": "DVS Deutscher Versicherungsdienst für das Schornsteinfegerhandwerk Verwaltungs GmbH",
      "company_seat": "Nortorf",
      "details": "26.05.2025 (Bekanntmachungsdatum)\n\nSchleswig-Holstein Amtsgericht Kiel HRB 15358\nRegisterbekanntmachung nach dem Umwandlungsgesetz 20.05.2025 (Eintragungsdatum)\n\nDVS Deutscher Versicherungsdienst für das Schornsteinfegerhandwerk Verwaltungs GmbH\nGesellschaft mit beschränkter Haftung\nNortorf\n\nZu Eintragungsnummer 6 vom 20.05.2025 wird als nicht eingetragen veröffentlicht: Den Gläubigern der an der Verschmelzung beteiligten Rechtsträger ist, wenn sie binnen sechs Monaten nach dem Tag, an dem die Eintragung der Verschmelzung in das Register des Sitzes desjenigen Rechtsträgers, dessen Gläubiger sie sind, nach § 19 Abs. 3 UmwG bekannt gemacht worden ist, ihren Anspruch nach Grund und Höhe schriftlich anmelden, Sicherheit zu leisten, soweit sie nicht Befriedigung verlangen können. Dieses Recht steht den Gläubigern jedoch nur zu, wenn sie glaubhaft machen, dass durch die Verschmelzung die Erfüllung ihrer Forderung gefährdet wird."
    },
    {
      "date": "2025-05-26",
      "id": "110196",
      "original_text": "Registerbekanntmachung nach dem Umwandlungsgesetz\nMecklenburg-Vorpommern Amtsgericht Stralsund HRB 5564\nHausverwaltung Fischland GmbH – Wustrow",
      "type": "Registerbekanntmachung nach dem Umwandlungsgesetz",
      "state": "Mecklenburg-Vorpommern",
      "amtsgericht": "Amtsgericht Stralsund",
      "registernummer": "HRB 5564",
      "registerart": "HRB",
      "company_name": "Hausverwaltung Fischland GmbH",
      "company_seat": "Wustrow",
      "details": "26.05.2025 (Bekanntmachungsdatum)\n\nMecklenburg-Vorpommern Amtsgericht Stralsund HRB 5564\nRegisterbekanntmachung nach dem Umwandlungsgesetz 26.05.2025 (Eintragungsdatum)\n\nHausverwaltung Fischland GmbH\nGesellschaft mit beschränkter Haftung\nWustrow\n\nAls nicht eingetragen wird veröffentlicht: Den Gläubigern der an der Verschmelzung beteiligten Rechtsträger ist, wenn sie binnen sechs Monaten nach dem Tag, an dem die Eintragung der Verschmelzung in das Register des Sitzes desjenigen Rechtsträgers, dessen Gläubiger sie sind, nach § 19 Abs. 3 UmwG als bekannt gemacht gilt,\nihren Anspruch nach Grund und Höhe in Textform anmelden, Sicherheit zu leisten, soweit sie nicht Befriedigung verlangen können. Dieses Recht steht den Gläubigern jedoch nur zu, wenn sie glaubhaft machen, dass durch die Verschmelzung die Erfüllung der Forderung gefährdet wird."
    },
    {
      "date": "2025-05-26",
      "id": "110197",
      "original_text": "Registerbekanntmachung nach dem Umwandlungsgesetz\nMecklenburg-Vorpommern Amtsgericht Stralsund HRB 3484\nDr. Trapp & Partner, Gesellschaft mit beschränkter Haftung – Wustrow",
      "type": "Registerbekanntmachung nach dem Umwandlungsgesetz",
      "state": "Mecklenburg-Vorpommern",
      "amtsgericht": "Amtsgericht Stralsund",
      "registernummer": "HRB 3484",
      "registerart": "HRB",
      "company_name": "Dr. Trapp & Partner, Gesellschaft mit beschränkter Haftung",
      "company_seat": "Wustrow",
      "details": "26.05.2025 (Bekanntmachungsdatum)\n\nMecklenburg-Vorpommern Amtsgericht Stralsund HRB 3484\nRegisterbekanntmachung nach dem Umwandlungsgesetz 26.05.2025 (Eintragungsdatum)\n\nDr. Trapp & Partner, Gesellschaft mit beschränkter Haftung\nGesellschaft mit beschränkter Haftung\nWustrow\n\nAls nicht eingetragen wird veröffentlicht: Den Gläubigern der an der Verschmelzung beteiligten Rechtsträger ist, wenn sie binnen sechs Monaten nach dem Tag, an dem die Eintragung der Verschmelzung in das Register des Sitzes desjenigen Rechtsträgers, dessen Gläubiger sie sind, nach § 19 Abs. 3 UmwG als bekannt gemacht gilt,\nihren Anspruch nach Grund und Höhe in Textform anmelden, Sicherheit zu leisten, soweit sie nicht Befriedigung verlangen können. Dieses Recht steht den Gläubigern jedoch nur zu, wenn sie glaubhaft machen, dass durch die Verschmelzung die Erfüllung der Forderung gefährdet wird."
    },
    {
      "date": "2025-05-26",
      "id": "110198",
      "original_text": "Löschungsankündigung\nSachsen Amtsgericht Dresden HRB 38524\nPALOSA Palettenlogistik Sachsen Beteiligungs GmbH – Pirna",
      "type": "Löschungsankündigung",
      "state": "Sachsen",
      "amtsgericht": "Amtsgericht Dresden",
      "registernummer": "HRB 38524",
      "registerart": "HRB",
      "company_name": "PALOSA Palettenlogistik Sachsen Beteiligungs GmbH",
      "company_seat": "Pirna",
      "details": "26.05.2025 (Bekanntmachungsdatum)\n\nSachsen Amtsgericht Dresden HRB 38524\nLöschungsankündigung\n\nPALOSA Palettenlogistik Sachsen Beteiligungs GmbH\nGesellschaft mit beschränkter Haftung\nPirna\n\nDas Registergericht beabsichtigt, die im Handelsregister eingetragene Gesellschaft von Amts wegen nach § 394 FamFG zu löschen. Die Frist zu Erhebung eines Widerspruchs gegen die beabsichtigte Löschung wird auf einen Monat festgesetzt."
    },
    {
      "date": "2025-05-26",
      "id": "110199",
      "original_text": "Löschungsankündigung\nSachsen Amtsgericht Dresden HRA 4282\nS.E.H.L. Industrie - und haustechnische Anlagen GmbH & Co. Planungs-, Projektierungs- und Verwaltungs KG – Dresden",
      "type": "Löschungsankündigung",
      "state": "Sachsen",
      "amtsgericht": "Amtsgericht Dresden",
      "registernummer": "HRA 4282",
      "registerart": "HRA",
      "company_name": "S.E.H.L. Industrie - und haustechnische Anlagen GmbH & Co. Planungs-, Projektierungs- und Verwaltungs KG",
      "company_seat": "Dresden",
      "details": "26.05.2025 (Bekanntmachungsdatum)\n\nSachsen Amtsgericht Dresden HRA 4282\nLöschungsankündigung\n\nS.E.H.L. Industrie - und haustechnische Anlagen GmbH & Co. Planungs-, Projektierungs- und Verwaltungs KG\nKommanditgesellschaft\nDresden\n\nDas Registergericht beabsichtigt, die im Handelsregister eingetragene Gesellschaft von Amts wegen nach § 394 FamFG zu löschen. Die Frist zu Erhebung eines Widerspruchs gegen die beabsichtigte Löschung wird auf einen Monat festgesetzt."
    },
    {
      "date": "2025-05-26",
      "id": "110200",
      "original_text": "Löschungsankündigung\nSachsen Amtsgericht Dresden HRB 43686\nBDL Baugruppe UG (haftungsbeschränkt) – Dresden",
      "type": "Löschungsankündigung",
      "state": "Sachsen",
      "amtsgericht": "Amtsgericht Dresden",
      "registernummer": "HRB 43686",
      "registerart": "HRB",
      "company_name": "BDL Baugruppe UG (haftungsbeschränkt)",
      "company_seat": "Dresden",
      "details": "26.05.2025 (Bekanntmachungsdatum)\n\nSachsen Amtsgericht Dresden HRB 43686\nLöschungsankündigung\n\nBDL Baugruppe UG (haftungsbeschränkt)\nGesellschaft mit beschränkter Haftung\nDresden\n\nDas Registergericht beabsichtigt, die im Handelsregister eingetragene Gesellschaft von Amts wegen nach § 394 FamFG zu löschen. Die Frist zu Erhebung eines Widerspruchs gegen die beabsichtigte Löschung wird auf einen Monat festgesetzt."
    },
    {
      "date": "2025-05-26",
      "id": "110201",
      "original_text": "Löschungsankündigung\nSachsen Amtsgericht Dresden HRB 2472\nSpieltreff GmbH Löbau – Neusalza-Spremberg",
      "type": "Löschungsankündigung",
      "state": "Sachsen",
      "amtsgericht": "Amtsgericht Dresden",
      "registernummer": "HRB 2472",
      "registerart": "HRB",
      "company_name": "Spieltreff GmbH Löbau",
      "company_seat": "Neusalza-Spremberg",
      "details": "26.05.2025 (Bekanntmachungsdatum)\n\nSachsen Amtsgericht Dresden HRB 2472\nLöschungsankündigung\n\nSpieltreff GmbH Löbau\nGesellschaft mit beschränkter Haftung\nNeusalza-Spremberg\n\nDas Registergericht beabsichtigt, die im Handelsregister eingetragene Gesellschaft von Amts wegen nach § 394 FamFG zu löschen. Die Frist zu Erhebung eines Widerspruchs gegen die beabsichtigte Löschung wird auf einen Monat festgesetzt."
    },
    {
      "date": "2025-05-26",
      "id": "110202",
      "original_text": "Registerbekanntmachung nach dem Umwandlungsgesetz\nNiedersachsen Amtsgericht Walsrode HRA 205667\nFrank Bokelmann gewerbliche Vermietung e.K. – Sulingen",
      "type": "Registerbekanntmachung nach dem Umwandlungsgesetz",
      "state": "Niedersachsen",
      "amtsgericht": "Amtsgericht Walsrode",
      "registernummer": "HRA 205667",
      "registerart": "HRA",
      "company_name": "Frank Bokelmann gewerbliche Vermietung e.K.",
      "company_seat": "Sulingen",
      "details": "26.05.2025 (Bekanntmachungsdatum)\n\nNiedersachsen Amtsgericht Walsrode HRA 205667\nRegisterbekanntmachung nach dem Umwandlungsgesetz 26.05.2025 (Eintragungsdatum)\n\nFrank Bokelmann gewerbliche Vermietung e.K.\nEinzelkaufmann / Einzelkauffrau\nSulingen\n\nDen Gläubigern der an der Ausgliederung beteiligten Rechtsträger ist, wenn sie binnen sechs Monaten nach dem Tag, an dem die Eintragung der Ausgliederung in das Register des Sitzes desjenigen Rechtsträgers, dessen Gläubiger sie sind, nach § 19 Abs. 3 UmwG als bekannt gemacht gilt, ihren Anspruch nach Grund und Höhe schriftlich anmelden, Sicherheit zu leisten, soweit sie nicht Befriedigung verlangen können. Dieses Recht steht den Gläubigern jedoch nur zu, wenn sie glaubhaft machen, dass durch die Ausgliederung die Erfüllung der Forderung gefährdet wird."
    },
    {
      "date": "2025-05-26",
      "id": "110203",
      "original_text": "Registerbekanntmachung nach dem Umwandlungsgesetz\nNiedersachsen Amtsgericht Hannover HRB 9308\nParitätische Suchthilfe Niedersachsen gGmbH – Hannover",
      "type": "Registerbekanntmachung nach dem Umwandlungsgesetz",
      "state": "Niedersachsen",
      "amtsgericht": "Amtsgericht Hannover",
      "registernummer": "HRB 9308",
      "registerart": "HRB",
      "company_name": "Paritätische Suchthilfe Niedersachsen gGmbH",
      "company_seat": "Hannover",
      "details": "26.05.2025 (Bekanntmachungsdatum)\n\nNiedersachsen Amtsgericht Hannover HRB 9308\nRegisterbekanntmachung nach dem Umwandlungsgesetz 26.05.2025 (Eintragungsdatum)\n\nParitätische Suchthilfe Niedersachsen gGmbH\nGesellschaft mit beschränkter Haftung\nHannover\n\nDen Gläubigern der an der Verschmelzung beteiligten Rechtsträger ist, wenn sie binnen sechs Monaten nach dem Tag, an dem die Eintragung der Verschmelzung in das Register des Sitzes desjenigen Rechtsträgers, dessen Gläubiger sie sind, nach § 19  Abs.  3 UmwG als bekannt gemacht gilt, ihren Anspruch nach Grund und Höhe schriftlich anmelden, Sicherheit zu leisten, soweit sie nicht Befriedigung verlangen können. Dieses Recht steht den Gläubigern jedoch nur zu, wenn sie glaubhaft machen, dass durch die Verschmelzung die Erfüllung der Forderung gefährdet wird."
    },
    {
      "date": "2025-05-26",
      "id": "110204",
      "original_text": "Einreichung neuer Dokumente\nNiedersachsen Amtsgericht Osnabrück HRB 120444 früher Amtsgericht Meppen\nBerentzen-Gruppe Aktiengesellschaft – Haselünne",
      "type": "Einreichung neuer Dokumente",
      "state": "Niedersachsen",
      "amtsgericht": "Amtsgericht Osnabrück",
      "registernummer": "HRB 120444",
      "registerart": "HRB",
      "company_name": "Berentzen-Gruppe Aktiengesellschaft",
      "company_seat": "Haselünne",
      "former_amtsgericht": "Meppen",
      "details": "26.05.2025 (Bekanntmachungsdatum)\n\nNiedersachsen Amtsgericht Osnabrück HRB 120444 früher Amtsgericht Meppen\nEinreichung neuer Dokumente 26.05.2025 (Eintragungsdatum)\n\nBerentzen-Gruppe Aktiengesellschaft\nAktiengesellschaft\nHaselünne\n\nDie Liste der Mitglieder des Aufsichtsrats wurde beim Registergericht eingereicht."
    },
    {
      "date": "2025-05-26",
      "id": "110205",
      "original_text": "Löschungsankündigung\nNiedersachsen Amtsgericht Osnabrück HRA 200310\nArtland Brauerei Hof Renze GmbH & Co. KG – Nortrup",
      "type": "Löschungsankündigung",
      "state": "Niedersachsen",
      "amtsgericht": "Amtsgericht Osnabrück",
      "registernummer": "HRA 200310",
      "registerart": "HRA",
      "company_name": "Artland Brauerei Hof Renze GmbH & Co. KG",
      "company_seat": "Nortrup",
      "details": "26.05.2025 (Bekanntmachungsdatum)\n\nNiedersachsen Amtsgericht Osnabrück HRA 200310\nLöschungsankündigung\n\nArtland Brauerei Hof Renze GmbH & Co. KG\nKommanditgesellschaft\nNortrup\n\nDas Registergericht beabsichtigt, die Firma von Amts wegen nach § 394 FamFG wegen Vermögenslosigkeit zu löschen. Die Frist zur Erhebung eines Widerspruchs ist auf 1 Monat ab dieser Registerbekanntmachung festgesetzt."
    },
    {
      "date": "2025-05-26",
      "id": "110206",
      "original_text": "Registerbekanntmachung nach dem Umwandlungsgesetz\nNiedersachsen Amtsgericht Walsrode HRA 205669\nFB VVW UG (haftungsbeschränkt) & Co. KG – Sulingen",
      "type": "Registerbekanntmachung nach dem Umwandlungsgesetz",
      "state": "Niedersachsen",
      "amtsgericht": "Amtsgericht Walsrode",
      "registernummer": "HRA 205669",
      "registerart": "HRA",
      "company_name": "FB VVW UG (haftungsbeschränkt) & Co. KG",
      "company_seat": "Sulingen",
      "details": "26.05.2025 (Bekanntmachungsdatum)\n\nNiedersachsen Amtsgericht Walsrode HRA 205669\nRegisterbekanntmachung nach dem Umwandlungsgesetz 26.05.2025 (Eintragungsdatum)\n\nFB VVW UG (haftungsbeschränkt) & Co. KG\nKommanditgesellschaft\nSulingen\n\nDen Gläubigern der an der Ausgliederung beteiligten Rechtsträger ist, wenn sie binnen sechs Monaten nach dem Tag, an dem die Eintragung der Ausgliederung in das Register des Sitzes desjenigen Rechtsträgers, dessen Gläubiger sie sind, nach § 19 Abs. 3 UmwG als bekannt gemacht gilt, ihren Anspruch nach Grund und Höhe schriftlich anmelden, Sicherheit zu leisten, soweit sie nicht Befriedigung verlangen können. Dieses Recht steht den Gläubigern jedoch nur zu, wenn sie glaubhaft machen, dass durch die Ausgliederung die Erfüllung der Forderung gefährdet wird."
    },
    {
      "date": "2025-05-26",
      "id": "110207",
      "original_text": "Einreichung neuer Dokumente\nNiedersachsen Amtsgericht Hildesheim HRB 110416 früher Amtsgericht Alfeld\nPorzellanmanufaktur FÜRSTENBERG GmbH – Fürstenberg a. d. Weser",
      "type": "Einreichung neuer Dokumente",
      "state": "Niedersachsen",
      "amtsgericht": "Amtsgericht Hildesheim",
      "registernummer": "HRB 110416",
      "registerart": "HRB",
      "company_name": "Porzellanmanufaktur FÜRSTENBERG GmbH",
      "company_seat": "Fürstenberg a. d. Weser",
      "former_amtsgericht": "Alfeld",
      "details": "26.05.2025 (Bekanntmachungsdatum)\n\nNiedersachsen Amtsgericht Hildesheim HRB 110416 früher Amtsgericht Alfeld\nEinreichung neuer Dokumente\n\nPorzellanmanufaktur FÜRSTENBERG GmbH\nGesellschaft mit beschränkter Haftung\nFürstenberg a. d. Weser\n\nDie Liste der Mitglieder des Aufsichtsrats wurde beim Registergericht eingereicht."
    },
    {
      "date": "2025-05-26",
      "id": "110208",
      "original_text": "Einreichung neuer Dokumente\nNiedersachsen Amtsgericht Braunschweig HRB 111300 früher Amtsgericht Goslar\nGoslar Marketing GmbH – Goslar",
      "type": "Einreichung neuer Dokumente",
      "state": "Niedersachsen",
      "amtsgericht": "Amtsgericht Braunschweig",
      "registernummer": "HRB 111300",
      "registerart": "HRB",
      "company_name": "Goslar Marketing GmbH",
      "company_seat": "Goslar",
      "former_amtsgericht": "Goslar",
      "details": "26.05.2025 (Bekanntmachungsdatum)\n\nNiedersachsen Amtsgericht Braunschweig HRB 111300 früher Amtsgericht Goslar\nEinreichung neuer Dokumente\n\nGoslar Marketing GmbH\nGesellschaft mit beschränkter Haftung\nGoslar\n\nDie Liste der Mitglieder des Aufsichtsrats wurde beim Registergericht eingereicht."
    },
    {
      "date": "2025-05-26",
      "id": "110209",
      "original_text": "Registerbekanntmachung nach dem Umwandlungsgesetz\nRheinland-Pfalz Amtsgericht Koblenz HRB 30644\nChristliches Klinikum Paderborn gGmbH – Koblenz",
      "type": "Registerbekanntmachung nach dem Umwandlungsgesetz",
      "state": "Rheinland-Pfalz",
      "amtsgericht": "Amtsgericht Koblenz",
      "registernummer": "HRB 30644",
      "registerart": "HRB",
      "company_name": "Christliches Klinikum Paderborn gGmbH",
      "company_seat": "Koblenz",
      "details": "26.05.2025 (Bekanntmachungsdatum)\n\nRheinland-Pfalz Amtsgericht Koblenz HRB 30644\nRegisterbekanntmachung nach dem Umwandlungsgesetz 26.05.2025 (Eintragungsdatum)\n\nChristliches Klinikum Paderborn gGmbH\nGesellschaft mit beschränkter Haftung\nKoblenz\n\nAls nicht eingetragen wird veröffentlicht: Den Gläubigern der an der Verschmelzung beteiligten Rechtsträger ist, wenn sie binnen sechs Monaten nach dem Tag, an dem die Eintragung der Verschmelzung in das Register des Sitzes desjenigen Rechtsträgers,dessen Gläubiger sie sind, nach § 19 Abs. 3 UmwG als bekannt gemacht gilt, ihren Anspruch nach Grund und Höhe schriftlich anmelden, Sicherheit zu leisten, soweit sie nicht Befriedigung verlangen können. Dieses Recht steht den Gläubigern jedoch nur zu, wenn sie glaubhaft machen, dass durch die Verschmelzung die Erfüllungd er Forderung gefährdet wird."
    },
    {
      "date": "2025-05-26",
      "id": "110210",
      "original_text": "Löschungsankündigung\nRheinland-Pfalz Amtsgericht Bad Kreuznach HRB 21946\nYan International GmbH – Hoppstädten-Weiersbach",
      "type": "Löschungsankündigung",
      "state": "Rheinland-Pfalz",
      "amtsgericht": "Amtsgericht Bad Kreuznach",
      "registernummer": "HRB 21946",
      "registerart": "HRB",
      "company_name": "Yan International GmbH",
      "company_seat": "Hoppstädten-Weiersbach",
      "details": "26.05.2025 (Bekanntmachungsdatum)\n\nRheinland-Pfalz Amtsgericht Bad Kreuznach HRB 21946\nLöschungsankündigung\n\nYan International GmbH\nGesellschaft mit beschränkter Haftung\nHoppstädten-Weiersbach\n\nDas Registergericht beabsichtigt die Gesellschaft wegen Vermögenslosigkeit im Handelsregister von Amts wegen nach § 394 FamFG zu löschen. Die Frist zur Erhebung eines Widerspruchs gegen die beabsichtigte Löschung ist auf einen Monat ab Veröffentlichung bestimmt."
    },
    {
      "date": "2025-05-26",
      "id": "110211",
      "original_text": "Löschungsankündigung\nRheinland-Pfalz Amtsgericht Ludwigshafen a.Rhein (Ludwigshafen) HRB 66171\nBulle und Bär GmbH – Harthausen",
      "type": "Löschungsankündigung",
      "state": "Rheinland-Pfalz",
      "amtsgericht": "Amtsgericht Ludwigshafen a.Rhein (Ludwigshafen)",
      "registernummer": "HRB 66171",
      "registerart": "HRB",
      "company_name": "Bulle und Bär GmbH",
      "company_seat": "Harthausen",
      "details": "26.05.2025 (Bekanntmachungsdatum)\n\nRheinland-Pfalz Amtsgericht Ludwigshafen a.Rhein (Ludwigshafen) HRB 66171\nLöschungsankündigung\n\nBulle und Bär GmbH\nGesellschaft mit beschränkter Haftung\nHarthausen\n\nDas Registergericht beabsichtigt die Gesellschaft von Amts wegen nach § 394 FamFG zu löschen. Die Frist zur Erhebung eines Widerspruchs ist auf einen Monat festgesetzt."
    },
    {
      "date": "2025-05-26",
      "id": "110212",
      "original_text": "Löschungsankündigung\nBremen Amtsgericht Bremen HRB 32862\nD & M Cleanservice GmbH – Bremerhaven",
      "type": "Löschungsankündigung",
      "state": "Bremen",
      "amtsgericht": "Amtsgericht Bremen",
      "registernummer": "HRB 32862",
      "registerart": "HRB",
      "company_name": "D & M Cleanservice GmbH",
      "company_seat": "Bremerhaven",
      "details": "26.05.2025 (Bekanntmachungsdatum)\n\nBremen Amtsgericht Bremen HRB 32862\nLöschungsankündigung\n\nD & M Cleanservice GmbH\nGesellschaft mit beschränkter Haftung\nBremerhaven\n\nEs ist beabsichtigt die im Handelsregister eingetragene Gesellschaft von Amts wegen gemäß § 394 FamFG zu löschen. Gegen die Löschung kann beim AG Bremen schriftlich oder zu Protokoll der Geschäftsstelle Widerspruch eingelegt werden. Widerspruchsfrist 4 Wochen."
    },
    {
      "date": "2025-05-26",
      "id": "110213",
      "original_text": "Löschungsankündigung\nNordrhein-Westfalen Amtsgericht Düsseldorf HRB 78334\nDYLEWSKI UG (haftungsbeschränkt) – Ratingen",
      "type": "Löschungsankündigung",
      "state": "Nordrhein-Westfalen",
      "amtsgericht": "Amtsgericht Düsseldorf",
      "registernummer": "HRB 78334",
      "registerart": "HRB",
      "company_name": "DYLEWSKI UG (haftungsbeschränkt)",
      "company_seat": "Ratingen",
      "details": "26.05.2025 (Bekanntmachungsdatum)\n\nNordrhein-Westfalen Amtsgericht Düsseldorf HRB 78334\nLöschungsankündigung\n\nDYLEWSKI UG (haftungsbeschränkt)\nGesellschaft mit beschränkter Haftung\nRatingen\n\nDas Registergericht beabsichtigt die Gesellschaft von Amts wegen nach § 394 FamFG zu löschen. Die Frist zur Erhebung eines Widerspruchs ist auf 3 Wochen festgesetzt.\n\nRechtsbehelfsbelehrung:\nDas Widerspruchsrecht steht jedem zu, der an der Unterlassung der Löschung ein berechtigtes Interesse hat. Der Widerspruch ist bei dem Amtsgericht Düsseldorf -Registergericht-, Werdener Straße 1, 40227 Düsseldorf schriftlich in deutscher Sprache oder zur Niederschrift der Geschäftsstelle einzulegen. Der Widerspruch kann auch zur Niederschrift der Geschäftsstelle eines jeden Amtsgerichtes abgegeben werden. Die Einlegung ist auch durch Übertragung eines elektronischen Dokuments an die elektronische Poststelle des Gerichts möglich. Das elektronische Dokument muss für die Bearbeitung durch das Gericht geeignet und mit einer qualifizierten elektronischen Signatur der verantwortenden Person versehen sein oder von der verantwortenden Person signiert und auf einem sicheren Übermittlungsweg gemäß § 130a ZPO nach näherer Maßgabe der Verordnung über die technischen Rahmenbedingungen des elektronischen Rechtsverkehrs und über das besondere elektronische Behördenpostfach (BGBl. I, S.3803) eingereicht werden. Weitere Informationen erhalten Sie auf der Internetseite www.justiz.de.\nDer Widerspruch muss spätestens innerhalb der gesetzten Frist nach dem Datum der Bekanntmachung der Löschungsankündigung bei dem Amtsgericht - Registergericht - Düsseldorf eingegangen sein.  Dies gilt auch dann, wenn der Widerspruch zur Niederschrift der Geschäftsstelle eines anderen Amtsgerichtes abgegeben wurde. Die Frist beginnt mit dem Tage der Bekanntmachung der Löschungsankündigung in dem für die Bekanntmachung der Eintragungen in das Handelsregister bestimmten elektronischen Informations- und Kommunikationssystem nach § 10 des Handelsgesetzbuches. Fällt das Ende der Frist auf einen Sonntag, einen allgemeinen Feiertag oder Sonnabend, so endet die Frist mit Ablauf des nächsten Werktages.\nDer Widerspruch muss die Bezeichnung der angefochtenen Löschungsankündigung sowie die Erklärung enthalten, dass Widerspruch gegen diese Löschungsankündigung eingelegt wird. Er ist zu unterzeichnen und soll begründet werden."
    },
    {
      "date": "2025-05-26",
      "id": "110214",
      "original_text": "Registerbekanntmachung nach dem Umwandlungsgesetz\nNordrhein-Westfalen Amtsgericht Neuss HRB 14686\nGFS Garten- und Landschaftsbau GmbH – Kaarst",
      "type": "Registerbekanntmachung nach dem Umwandlungsgesetz",
      "state": "Nordrhein-Westfalen",
      "amtsgericht": "Amtsgericht Neuss",
      "registernummer": "HRB 14686",
      "registerart": "HRB",
      "company_name": "GFS Garten- und Landschaftsbau GmbH",
      "company_seat": "Kaarst",
      "details": "26.05.2025 (Bekanntmachungsdatum)\n\nNordrhein-Westfalen Amtsgericht Neuss HRB 14686\nRegisterbekanntmachung nach dem Umwandlungsgesetz 26.05.2025 (Eintragungsdatum)\n\nGFS Garten- und Landschaftsbau GmbH\nGesellschaft mit beschränkter Haftung\nKaarst\n\nDen Gläubigern der an der Verschmelzung beteiligten Rechtsträger ist, wenn sie binnen sechs Monaten nach dem Tag, an dem die Eintragung der Verschmelzung in das Register des Sitzes derjenigen Rechtsträger deren Gläubiger sie sind, nach § 19 Absatz 3 UmwG als bekanntgemacht gilt, ihren Anspruch nach Grund und Höhe schriftlich anmelden, Sicherheit zu leisten, soweit sie nicht Befriedigung verlangen können. Dieses Recht steht den Gläubigern jedoch nur zu, wenn sie glaubhaft machen, dass durch die Verschmelzung die Erfüllung ihrer Forderung gefährdet wird."
    },
    {
      "date": "2025-05-26",
      "id": "110215",
      "original_text": "Registerbekanntmachung nach dem Umwandlungsgesetz\nNordrhein-Westfalen Amtsgericht Köln HRB 113063\nWo & Wo Holding GmbH – Brühl",
      "type": "Registerbekanntmachung nach dem Umwandlungsgesetz",
      "state": "Nordrhein-Westfalen",
      "amtsgericht": "Amtsgericht Köln",
      "registernummer": "HRB 113063",
      "registerart": "HRB",
      "company_name": "Wo & Wo Holding GmbH",
      "company_seat": "Brühl",
      "details": "26.05.2025 (Bekanntmachungsdatum)\n\nNordrhein-Westfalen Amtsgericht Köln HRB 113063\nRegisterbekanntmachung nach dem Umwandlungsgesetz\n\nWo & Wo Holding GmbH\nGesellschaft mit beschränkter Haftung\nBrühl\n\nEs wird darauf hingewiesen, dass ein Verschmelzungsplan oder sein Entwurf über eine grenzüberschreitende Verschmelzung zur Aufnahme mit folgenden Rechtsträgern beim Handelsregister eingereicht worden ist:  - M.A.A., société par actions simplifiée de droit francais mit Sitz in Paris/Frankreich (Registre du Commerce et des Sociétés de Paris 917629578) (Société par Actions Simplifiée Unipersonnelle - Vereinfachte Aktiengesellschaft (Einpersonengesellschaft) nach französischem Recht)\n\nDie Anteilsinhaber, die Gläubiger sowie die zuständigen Betriebsräte der an der grenzüberschreitenden Verschmelzung beteiligten Gesellschaften oder, soweit es keinen Betriebsrat gibt, die Arbeitnehmer der an der grenzüberschreitenden Verschmelzung beteiligten Gesellschaften, können der jeweiligen Gesellschaft spätestens fünf Arbeitstage vor dem Tag der Gesellschafterversammlung bzw. Hauptversammlung Bemerkungen zum Verschmelzungsplan übermitteln."
    },
    {
      "date": "2025-05-26",
      "id": "110216",
      "original_text": "Löschungsankündigung\nNordrhein-Westfalen Amtsgericht Dortmund HRB 12667\nDS-Rendite-Fonds Nr. 57 MS Cape Spear GmbH – Dortmund",
      "type": "Löschungsankündigung",
      "state": "Nordrhein-Westfalen",
      "amtsgericht": "Amtsgericht Dortmund",
      "registernummer": "HRB 12667",
      "registerart": "HRB",
      "company_name": "DS-Rendite-Fonds Nr. 57 MS Cape Spear GmbH",
      "company_seat": "Dortmund",
      "details": "26.05.2025 (Bekanntmachungsdatum)\n\nNordrhein-Westfalen Amtsgericht Dortmund HRB 12667\nLöschungsankündigung 26.05.2025 (Eintragungsdatum)\n\nDS-Rendite-Fonds Nr. 57 MS Cape Spear GmbH\nGesellschaft mit beschränkter Haftung\nDortmund\n\nDas Registergericht beabsichtigt die Gesellschaft von Amts wegen nach § 394 FamFG zu löschen. Die Frist zur Erhebung eines Widerspruchs ist auf zwei Monate festgesetzt."
    },
    {
      "date": "2025-05-26",
      "id": "110217",
      "original_text": "Registerbekanntmachung nach dem Umwandlungsgesetz\nNordrhein-Westfalen Amtsgericht Aachen HRB 22467\nFLSmidth TIPCO Tudeshki Industrial Process Control GmbH – Aachen",
      "type": "Registerbekanntmachung nach dem Umwandlungsgesetz",
      "state": "Nordrhein-Westfalen",
      "amtsgericht": "Amtsgericht Aachen",
      "registernummer": "HRB 22467",
      "registerart": "HRB",
      "company_name": "FLSmidth TIPCO Tudeshki Industrial Process Control GmbH",
      "company_seat": "Aachen",
      "details": "26.05.2025 (Bekanntmachungsdatum)\n\nNordrhein-Westfalen Amtsgericht Aachen HRB 22467\nRegisterbekanntmachung nach dem Umwandlungsgesetz 26.05.2025 (Eintragungsdatum)\n\nFLSmidth TIPCO Tudeshki Industrial Process Control GmbH\nGesellschaft mit beschränkter Haftung\nAachen\n\nDen Gläubigern der an der Verschmelzung beteiligten Rechtsträger ist, wenn sie binnen sechs Monaten nach dem Tag, an dem die Eintragung der Verschmelzung in das Register des Sitzes desjenigen Rechtsträgers, dessen Gläubiger sie sind, nach § 19 Absatz 3 UmwG als bekanntgemacht gilt, ihren Anspruch nach Grund und Höhe schriftlich anmelden, Sicherheit zu leisten, soweit sie nicht Befriedigung verlangen können. Dieses Recht steht den Gläubigern jedoch nur zu, wenn sie glaubhaft machen, dass durch die Verschmelzung die Erfüllung ihrer Forderung gefährdet wird."
    },
    {
      "date": "2025-05-26",
      "id": "110218",
      "original_text": "Registerbekanntmachung nach dem Umwandlungsgesetz\nNordrhein-Westfalen Amtsgericht Köln HRB 92975\nBetreuungs- und Pflegedienst Trepels GmbH – Bergheim",
      "type": "Registerbekanntmachung nach dem Umwandlungsgesetz",
      "state": "Nordrhein-Westfalen",
      "amtsgericht": "Amtsgericht Köln",
      "registernummer": "HRB 92975",
      "registerart": "HRB",
      "company_name": "Betreuungs- und Pflegedienst Trepels GmbH",
      "company_seat": "Bergheim",
      "details": "26.05.2025 (Bekanntmachungsdatum)\n\nNordrhein-Westfalen Amtsgericht Köln HRB 92975\nRegisterbekanntmachung nach dem Umwandlungsgesetz 26.05.2025 (Eintragungsdatum)\n\nBetreuungs- und Pflegedienst Trepels GmbH\nGesellschaft mit beschränkter Haftung\nBergheim\n\nDen Gläubigern der an der Verschmelzung beteiligten Rechtsträger ist, wenn sie binnen sechs Monaten nach dem Tag, an dem die Eintragung der Verschmelzung in das Register des Sitzes desjenigen Rechtsträgers, dessen Gläubiger sie sind, nach § 19 Absatz 3 UmwG als bekanntgemacht gilt, ihren Anspruch nach Grund und Höhe schriftlich anmelden, Sicherheit zu leisten, soweit sie nicht Befriedigung verlangen können. Dieses Recht steht den Gläubigern jedoch nur zu, wenn sie glaubhaft machen, dass durch die Verschmelzung die Erfüllung ihrer Forderung gefährdet wird."
    },
    {
      "date": "2025-05-26",
      "id": "110219",
      "original_text": "Registerbekanntmachung nach dem Umwandlungsgesetz\nNordrhein-Westfalen Amtsgericht Köln HRB 123377\nCube Real Estate AG – Leverkusen",
      "type": "Registerbekanntmachung nach dem Umwandlungsgesetz",
      "state": "Nordrhein-Westfalen",
      "amtsgericht": "Amtsgericht Köln",
      "registernummer": "HRB 123377",
      "registerart": "HRB",
      "company_name": "Cube Real Estate AG",
      "company_seat": "Leverkusen",
      "details": "26.05.2025 (Bekanntmachungsdatum)\n\nNordrhein-Westfalen Amtsgericht Köln HRB 123377\nRegisterbekanntmachung nach dem Umwandlungsgesetz 26.05.2025 (Eintragungsdatum)\n\nCube Real Estate AG\nAktiengesellschaft\nLeverkusen\n\nDen Gläubigern der an der formwechselnden Umwandlung beteiligten Rechtsträger ist, wenn sie binnen sechs Monaten nach dem Tag, an dem die Eintragung der formwechselnden Umwandlung in das Register des Sitzes desjenigen Rechtsträgers, dessen Gläubiger sie sind, nach § 19 Absatz 3 UmwG als bekanntgemacht gilt, ihren Anspruch nach Grund und Höhe schriftlich anmelden, Sicherheit zu leisten, soweit sie nicht Befriedigung verlangen können. Dieses Recht steht den Gläubigern jedoch nur zu, wenn sie glaubhaft machen, dass durch die formwechselnden Umwandlung die Erfüllung ihrer Forderung gefährdet wird."
    },
    {
      "date": "2025-05-26",
      "id": "110220",
      "original_text": "Sonstige Registerbekanntmachung\nNordrhein-Westfalen Amtsgericht Bonn HRB 15883\nDeutsche Telekom Venture Investments GmbH – Bonn",
      "type": "Sonstige Registerbekanntmachung",
      "state": "Nordrhein-Westfalen",
      "amtsgericht": "Amtsgericht Bonn",
      "registernummer": "HRB 15883",
      "registerart": "HRB",
      "company_name": "Deutsche Telekom Venture Investments GmbH",
      "company_seat": "Bonn",
      "details": "26.05.2025 (Bekanntmachungsdatum)\n\nNordrhein-Westfalen Amtsgericht Bonn HRB 15883\nSonstige Registerbekanntmachung\n\nDeutsche Telekom Venture Investments GmbH\nGesellschaft mit beschränkter Haftung\nBonn\n\nDem Registergericht ist eine neue Liste der Mitglieder des Aufsichtsrates eingereicht worden."
    },
    {
      "date": "2025-05-26",
      "id": "110221",
      "original_text": "Registerbekanntmachung nach dem Umwandlungsgesetz\nNordrhein-Westfalen Amtsgericht Hagen HRA 4819\nGetränke Groß- und Einzelhandel Rehfeld e.K. – Gevelsberg",
      "type": "Registerbekanntmachung nach dem Umwandlungsgesetz",
      "state": "Nordrhein-Westfalen",
      "amtsgericht": "Amtsgericht Hagen",
      "registernummer": "HRA 4819",
      "registerart": "HRA",
      "company_name": "Getränke Groß- und Einzelhandel Rehfeld e.K.",
      "company_seat": "Gevelsberg",
      "details": "26.05.2025 (Bekanntmachungsdatum)\n\nNordrhein-Westfalen Amtsgericht Hagen HRA 4819\nRegisterbekanntmachung nach dem Umwandlungsgesetz 26.05.2025 (Eintragungsdatum)\n\nGetränke Groß- und Einzelhandel Rehfeld e.K.\nEinzelkaufmann / Einzelkauffrau\nGevelsberg\n\nDen Gläubigern der an der Ausgliederung beteiligten Rechtsträger ist, wenn sie binnen sechs Monaten nach dem Tag, an dem die Eintragung der Ausgliederung in das Register des Sitzes desjenigen Rechtsträgers, dessen Gläubiger sie sind, nach § 19 Absatz 3 UmwG als bekanntgemacht gilt, ihren Anspruch nach Grund und Höhe schriftlich anmelden, Sicherheit zu leisten, soweit sie nicht Befriedigung verlangen können. Dieses Recht steht den Gläubigern jedoch nur zu, wenn sie glaubhaft machen, dass durch die Ausgliederung die Erfüllung ihrer Forderung gefährdet wird."
    },
    {
      "date": "2025-05-26",
      "id": "110222",
      "original_text": "Löschungsankündigung\nNordrhein-Westfalen Amtsgericht Krefeld HRB 12206\nStuckgeschäft J. Bongartz UG (haftungsbeschränkt) – Grefrath",
      "type": "Löschungsankündigung",
      "state": "Nordrhein-Westfalen",
      "amtsgericht": "Amtsgericht Krefeld",
      "registernummer": "HRB 12206",
      "registerart": "HRB",
      "company_name": "Stuckgeschäft J. Bongartz UG (haftungsbeschränkt)",
      "company_seat": "Grefrath",
      "details": "26.05.2025 (Bekanntmachungsdatum)\n\nNordrhein-Westfalen Amtsgericht Krefeld HRB 12206\nLöschungsankündigung\n\nStuckgeschäft J. Bongartz UG (haftungsbeschränkt)\nGesellschaft mit beschränkter Haftung\nGrefrath\n\nDas Registergericht beabsichtigt die Gesellschaft von Amts wegen nach § 394 FamFG zu löschen. Die Frist zur Erhebung eines Widerspruchs ist auf einen Monat festgesetzt."
    },
    {
      "date": "2025-05-26",
      "id": "110223",
      "original_text": "Löschungsankündigung\nNordrhein-Westfalen Amtsgericht Krefeld HRB 15391\nSAM Sacred Assets Management GmbH – Krefeld",
      "type": "Löschungsankündigung",
      "state": "Nordrhein-Westfalen",
      "amtsgericht": "Amtsgericht Krefeld",
      "registernummer": "HRB 15391",
      "registerart": "HRB",
      "company_name": "SAM Sacred Assets Management GmbH",
      "company_seat": "Krefeld",
      "details": "26.05.2025 (Bekanntmachungsdatum)\n\nNordrhein-Westfalen Amtsgericht Krefeld HRB 15391\nLöschungsankündigung\n\nSAM Sacred Assets Management GmbH\nGesellschaft mit beschränkter Haftung\nKrefeld\n\nDas Registergericht beabsichtigt die Gesellschaft von Amts wegen nach § 394 FamFG zu löschen. Die Frist zur Erhebung eines Widerspruchs ist auf einen Monat festgesetzt."
    },
    {
      "date": "2025-05-26",
      "id": "110224",
      "original_text": "Löschungsankündigung\nNordrhein-Westfalen Amtsgericht Neuss HRB 21868\nWork Logistik GmbH – Neuss",
      "type": "Löschungsankündigung",
      "state": "Nordrhein-Westfalen",
      "amtsgericht": "Amtsgericht Neuss",
      "registernummer": "HRB 21868",
      "registerart": "HRB",
      "company_name": "Work Logistik GmbH",
      "company_seat": "Neuss",
      "details": "26.05.2025 (Bekanntmachungsdatum)\n\nNordrhein-Westfalen Amtsgericht Neuss HRB 21868\nLöschungsankündigung\n\nWork Logistik GmbH\nGesellschaft mit beschränkter Haftung\nNeuss\n\nDas Registergericht beabsichtigt, die im Handelsregister eingetragene Gesellschaft gemäß § 394 Absatz 1 FamFG wegen Vermögenslosigkeit von Amts wegen zu löschen.\n\nFrist zur Geltendmachung eines Widerspruchs: 1 Monat\n\nRechtsbehelfsbelehrung:\nGegen diese Verfügung können Sie Widerspruch einlegen. Der Widerspruch ist bei dem Amtsgericht Neuss, Breite Straße 48, 41460 Neuss schriftlich in deutscher Sprache oder zur Niederschrift der Geschäftsstelle einzulegen. Der Widerspruch kann auch zur Niederschrift der Geschäftsstelle eines jeden Amtsgerichtes abgegeben werden. Die Einlegung ist auch durch Übertragung eines elektronischen Dokuments an die elektronische Poststelle des Gerichts möglich. Das elektronische Dokument muss für die Bearbeitung durch das Gericht geeignet und mit einer qualifizierten elektronischen Signatur der verantwortenden Person versehen sein oder von der verantwortenden Person signiert und auf einem sicheren Übermittlungsweg gemäß § 130a ZPO nach näherer Maßgabe der Verordnung über die technischen Rahmenbedingungen des elektronischen Rechtsverkehrs und über das besondere elektronische Behördenpostfach (BGBl. I, S.3803) eingereicht werden. Weitere Informationen erhalten Sie auf der Internetseite www.justiz.de.\nDer Widerspruch muss spätestens innerhalb der gesetzten Frist bei dem Amtsgericht Neuss eingegangen sein. Dies gilt auch dann, wenn der Widerspruch zur Niederschrift der Geschäftsstelle eines anderen Amtsgerichtes abgegeben wurde. Die Frist beginnt mit der Veröffentlichung. Fällt das Ende der Frist auf einen Sonntag, einen allgemeinen Feiertag oder Sonnabend, so endet die Frist mit Ablauf des nächsten Werktages. Der Widerspruch muss die Bezeichnung der angefochtenen Verfügung sowie die Erklärung enthalten, dass Widerspruch gegen diese Verfügung eingelegt wird. Er ist zu unterzeichnen und soll begründet werden."
    },
    {
      "date": "2025-05-26",
      "id": "110225",
      "original_text": "Löschungsankündigung\nNordrhein-Westfalen Amtsgericht Hamm HRB 9854\nYAY GmbH – Bergkamen",
      "type": "Löschungsankündigung",
      "state": "Nordrhein-Westfalen",
      "amtsgericht": "Amtsgericht Hamm",
      "registernummer": "HRB 9854",
      "registerart": "HRB",
      "company_name": "YAY GmbH",
      "company_seat": "Bergkamen",
      "details": "26.05.2025 (Bekanntmachungsdatum)\n\nNordrhein-Westfalen Amtsgericht Hamm HRB 9854\nLöschungsankündigung\n\nYAY GmbH\nGesellschaft mit beschränkter Haftung\nBergkamen\n\nDas Registergericht beabsichtigt die Gesellschaft von Amts wegen nach § 394 FamFG zu löschen. Die Frist zur Erhebung eines Widerspruchs ist auf drei Monate festgesetzt."
    },
    {
      "date": "2025-05-26",
      "id": "110226",
      "original_text": "Registerbekanntmachung nach dem Umwandlungsgesetz\nNordrhein-Westfalen Amtsgericht Köln HRA 37874\nRonnie Hausmann e.K. – Hückeswagen",
      "type": "Registerbekanntmachung nach dem Umwandlungsgesetz",
      "state": "Nordrhein-Westfalen",
      "amtsgericht": "Amtsgericht Köln",
      "registernummer": "HRA 37874",
      "registerart": "HRA",
      "company_name": "Ronnie Hausmann e.K.",
      "company_seat": "Hückeswagen",
      "details": "26.05.2025 (Bekanntmachungsdatum)\n\nNordrhein-Westfalen Amtsgericht Köln HRA 37874\nRegisterbekanntmachung nach dem Umwandlungsgesetz 26.05.2025 (Eintragungsdatum)\n\nRonnie Hausmann e.K.\nEinzelkaufmann / Einzelkauffrau\nHückeswagen\n\nDie Gesellschaft hat Gläubigern, deren Forderungen vor dieser Bekanntmachung begründet worden sind, Sicherheit zu leisten, soweit sie nicht Befriedigung verlangen können, wenn sie sich binnen sechs Monaten zu diesem Zweck melden."
    },
    {
      "date": "2025-05-26",
      "id": "110227",
      "original_text": "Löschungsankündigung\nNordrhein-Westfalen Amtsgericht Krefeld HRB 19121\nTete Business Development GmbH – Willich",
      "type": "Löschungsankündigung",
      "state": "Nordrhein-Westfalen",
      "amtsgericht": "Amtsgericht Krefeld",
      "registernummer": "HRB 19121",
      "registerart": "HRB",
      "company_name": "Tete Business Development GmbH",
      "company_seat": "Willich",
      "details": "26.05.2025 (Bekanntmachungsdatum)\n\nNordrhein-Westfalen Amtsgericht Krefeld HRB 19121\nLöschungsankündigung\n\nTete Business Development GmbH\nGesellschaft mit beschränkter Haftung\nWillich\n\nDas Registergericht beabsichtigt die Gesellschaft von Amts wegen nach § 394 FamFG zu löschen. Die Frist zur Erhebung eines Widerspruchs ist auf einen Monat festgesetzt."
    },
    {
      "date": "2025-05-26",
      "id": "110228",
      "original_text": "Löschungsankündigung\nNordrhein-Westfalen Amtsgericht Düsseldorf HRB 85182\nM20N21 GmbH – Düsseldorf",
      "type": "Löschungsankündigung",
      "state": "Nordrhein-Westfalen",
      "amtsgericht": "Amtsgericht Düsseldorf",
      "registernummer": "HRB 85182",
      "registerart": "HRB",
      "company_name": "M20N21 GmbH",
      "company_seat": "Düsseldorf",
      "details": "26.05.2025 (Bekanntmachungsdatum)\n\nNordrhein-Westfalen Amtsgericht Düsseldorf HRB 85182\nLöschungsankündigung\n\nM20N21 GmbH\nGesellschaft mit beschränkter Haftung\nDüsseldorf\n\nDas Registergericht beabsichtigt die Gesellschaft von Amts wegen nach § 394 FamFG zu löschen. Die Frist zur Erhebung eines Widerspruchs ist auf 3 Wochen festgesetzt.\n\nRechtsbehelfsbelehrung:\nDas Widerspruchsrecht steht jedem zu, der an der Unterlassung der Löschung ein berechtigtes Interesse hat. Der Widerspruch ist bei dem Amtsgericht Düsseldorf -Registergericht-, Werdener Straße 1, 40227 Düsseldorf schriftlich in deutscher Sprache oder zur Niederschrift der Geschäftsstelle einzulegen. Der Widerspruch kann auch zur Niederschrift der Geschäftsstelle eines jeden Amtsgerichtes abgegeben werden. Die Einlegung ist auch durch Übertragung eines elektronischen Dokuments an die elektronische Poststelle des Gerichts möglich. Das elektronische Dokument muss für die Bearbeitung durch das Gericht geeignet und mit einer qualifizierten elektronischen Signatur der verantwortenden Person versehen sein oder von der verantwortenden Person signiert und auf einem sicheren Übermittlungsweg gemäß § 130a ZPO nach näherer Maßgabe der Verordnung über die technischen Rahmenbedingungen des elektronischen Rechtsverkehrs und über das besondere elektronische Behördenpostfach (BGBl. I, S.3803) eingereicht werden. Weitere Informationen erhalten Sie auf der Internetseite www.justiz.de.\nDer Widerspruch muss spätestens innerhalb der gesetzten Frist nach dem Datum der Bekanntmachung der Löschungsankündigung bei dem Amtsgericht - Registergericht - Düsseldorf eingegangen sein.  Dies gilt auch dann, wenn der Widerspruch zur Niederschrift der Geschäftsstelle eines anderen Amtsgerichtes abgegeben wurde. Die Frist beginnt mit dem Tage der Bekanntmachung der Löschungsankündigung in dem für die Bekanntmachung der Eintragungen in das Handelsregister bestimmten elektronischen Informations- und Kommunikationssystem nach § 10 des Handelsgesetzbuches. Fällt das Ende der Frist auf einen Sonntag, einen allgemeinen Feiertag oder Sonnabend, so endet die Frist mit Ablauf des nächsten Werktages.\nDer Widerspruch muss die Bezeichnung der angefochtenen Löschungsankündigung sowie die Erklärung enthalten, dass Widerspruch gegen diese Löschungsankündigung eingelegt wird. Er ist zu unterzeichnen und soll begründet werden."
    },
    {
      "date": "2025-05-26",
      "id": "110229",
      "original_text": "Löschungsankündigung\nNordrhein-Westfalen Amtsgericht Kleve HRB 14992\nContainers 2 Go GmbH – Kranenburg",
      "type": "Löschungsankündigung",
      "state": "Nordrhein-Westfalen",
      "amtsgericht": "Amtsgericht Kleve",
      "registernummer": "HRB 14992",
      "registerart": "HRB",
      "company_name": "Containers 2 Go GmbH",
      "company_seat": "Kranenburg",
      "details": "26.05.2025 (Bekanntmachungsdatum)\n\nNordrhein-Westfalen Amtsgericht Kleve HRB 14992\nLöschungsankündigung\n\nContainers 2 Go GmbH\nGesellschaft mit beschränkter Haftung\nKranenburg\n\nDas Registergericht beabsichtigt die Gesellschaft von Amts wegen nach § 394 FamFG zu löschen. Die Frist zur Erhebung eines Widerspruchs ist auf einen Monat festgesetzt."
    },
    {
      "date": "2025-05-26",
      "id": "110230",
      "original_text": "Löschungsankündigung\nNordrhein-Westfalen Amtsgericht Krefeld HRA 6170\nGetränkesupermarkt Birol e.K. – Krefeld",
      "type": "Löschungsankündigung",
      "state": "Nordrhein-Westfalen",
      "amtsgericht": "Amtsgericht Krefeld",
      "registernummer": "HRA 6170",
      "registerart": "HRA",
      "company_name": "Getränkesupermarkt Birol e.K.",
      "company_seat": "Krefeld",
      "details": "26.05.2025 (Bekanntmachungsdatum)\n\nNordrhein-Westfalen Amtsgericht Krefeld HRA 6170\nLöschungsankündigung\n\nGetränkesupermarkt Birol e.K.\nEinzelkaufmann / Einzelkauffrau\nKrefeld\n\nDas Registergericht beabsichtigt die Firma von Amts wegen nach § 31 Abs. 2 HGB, § 393 FamFG zu löschen. Die Frist zur Erhebung eines Widerspruchs ist auf 6 Wochen festgesetzt."
    },
    {
      "date": "2025-05-26",
      "id": "110231",
      "original_text": "Registerbekanntmachung nach dem Umwandlungsgesetz\nNordrhein-Westfalen Amtsgericht Aachen HRB 13707\nPNY Technologies Quadro GmbH – Würselen",
      "type": "Registerbekanntmachung nach dem Umwandlungsgesetz",
      "state": "Nordrhein-Westfalen",
      "amtsgericht": "Amtsgericht Aachen",
      "registernummer": "HRB 13707",
      "registerart": "HRB",
      "company_name": "PNY Technologies Quadro GmbH",
      "company_seat": "Würselen",
      "details": "26.05.2025 (Bekanntmachungsdatum)\n\nNordrhein-Westfalen Amtsgericht Aachen HRB 13707\nRegisterbekanntmachung nach dem Umwandlungsgesetz 26.05.2025 (Eintragungsdatum)\n\nPNY Technologies Quadro GmbH\nGesellschaft mit beschränkter Haftung\nWürselen\n\nDen Gläubigern der an der Verschmelzung beteiligten Rechtsträger ist, wenn sie binnen sechs Monaten nach dem Tag, an dem die Eintragung der Verschmelzung in das Register des Sitzes desjenigen Rechtsträgers, dessen Gläubiger sie sind, nach § 19 Absatz 3 UmwG als bekanntgemacht gilt, ihren Anspruch nach Grund und Höhe schriftlich anmelden, Sicherheit zu leisten, soweit sie nicht Befriedigung verlangen können. Dieses Recht steht den Gläubigern jedoch nur zu, wenn sie glaubhaft machen, dass durch die Verschmelzung die Erfüllung ihrer Forderung gefährdet wird."
    },
    {
      "date": "2025-05-26",
      "id": "110232",
      "original_text": "Registerbekanntmachung nach dem Umwandlungsgesetz\nNordrhein-Westfalen Amtsgericht Aachen HRB 23069\nPNY Technologies GmbH – Würselen",
      "type": "Registerbekanntmachung nach dem Umwandlungsgesetz",
      "state": "Nordrhein-Westfalen",
      "amtsgericht": "Amtsgericht Aachen",
      "registernummer": "HRB 23069",
      "registerart": "HRB",
      "company_name": "PNY Technologies GmbH",
      "company_seat": "Würselen",
      "details": "26.05.2025 (Bekanntmachungsdatum)\n\nNordrhein-Westfalen Amtsgericht Aachen HRB 23069\nRegisterbekanntmachung nach dem Umwandlungsgesetz 26.05.2025 (Eintragungsdatum)\n\nPNY Technologies GmbH\nGesellschaft mit beschränkter Haftung\nWürselen\n\nDen Gläubigern der an der Verschmelzung beteiligten Rechtsträger ist, wenn sie binnen sechs Monaten nach dem Tag, an dem die Eintragung der Verschmelzung in das Register des Sitzes desjenigen Rechtsträgers, dessen Gläubiger sie sind, nach § 19 Absatz 3 UmwG als bekanntgemacht gilt, ihren Anspruch nach Grund und Höhe schriftlich anmelden, Sicherheit zu leisten, soweit sie nicht Befriedigung verlangen können. Dieses Recht steht den Gläubigern jedoch nur zu, wenn sie glaubhaft machen, dass durch die Verschmelzung die Erfüllung ihrer Forderung gefährdet wird."
    },
    {
      "date": "2025-05-26",
      "id": "110233",
      "original_text": "Löschungsankündigung\nNordrhein-Westfalen Amtsgericht Siegburg HRB 10716\nWorms & Sohn GmbH – Lohmar",
      "type": "Löschungsankündigung",
      "state": "Nordrhein-Westfalen",
      "amtsgericht": "Amtsgericht Siegburg",
      "registernummer": "HRB 10716",
      "registerart": "HRB",
      "company_name": "Worms & Sohn GmbH",
      "company_seat": "Lohmar",
      "details": "26.05.2025 (Bekanntmachungsdatum)\n\nNordrhein-Westfalen Amtsgericht Siegburg HRB 10716\nLöschungsankündigung\n\nWorms & Sohn GmbH\nGesellschaft mit beschränkter Haftung\nLohmar\n\nDas Registergericht hat glaubhafte Kenntnis erlangt, dass die Gesellschaft vermögenslos geworden ist, da ein Insolvenzverfahren durchgeführt und nach § 200 InsO aufgehoben wurde.\n\nEs ist daher beabsichtigt, die Gesellschaft nach § 394 FamFG im Handelsregister wegen Vermögenslosigkeit zu löschen.\nEinwände gegen die Löschung sind durch Widerspruch binnen einer Frist von 3 Monaten geltend zu machen, andernfalls die Löschung erfolgen wird.\n\nEinzulegen ist der Widerspruch bei dem Amtsgericht Siegburg, Neue Poststraße 16, 53721 Siegburg, und zwar entweder schriftlich in deutscher Sprache oder mündlich zur Niederschrift der Geschäftsstelle. Der Widerspruch kann auch zur Niederschrift der Geschäftsstelle eines jeden Amtsgerichts abgegeben werden. Der Widerspruch ist binnen der in der Verfügung bestimmten Frist einzulegen. Die Frist ist nur gewahrt, wenn der Widerspruch rechtzeitig bei dem Amtsgericht Siegburg eingeht, auch wenn der Widerspruch zur Niederschrift der Geschäftsstelle eines anderen Amtsgerichts abgegeben wurde. Die Frist beginnt jeweils mit der schriftlichen Bekanntgabe der Verfügung an die Beteiligten. Kann die schriftliche Bekanntgabe an einen Beteiligten nicht bewirkt werden, beginnt die Frist spätestens mit Ablauf von fünf Monaten nach Erlass der Verfügung. Die Bekanntgabe ist entweder durch Zustellung oder am dritten Tage nach Aufgabe zur Post bewirkt. Sofern die Löschung noch nicht erfolgt ist, kann der Widerspruch auch noch nach Ablauf der Frist eingelegt werden. Fällt das Ende der Frist auf einen Sonnabend, einen Sonntag oder einen allgemeinen Feiertag, endet die Frist mit Ablauf des nächsten Werktages. Der Widerspruch ist zu unterzeichnen. Eine Begründung des Widerspruchs ist nicht vorgeschrieben."
    },
    {
      "date": "2025-05-26",
      "id": "110234",
      "original_text": "Registerbekanntmachung nach dem Umwandlungsgesetz\nNordrhein-Westfalen Amtsgericht Bad Oeynhausen HRB 13730\nGTIT Service Verwaltungs GmbH – Minden",
      "type": "Registerbekanntmachung nach dem Umwandlungsgesetz",
      "state": "Nordrhein-Westfalen",
      "amtsgericht": "Amtsgericht Bad Oeynhausen",
      "registernummer": "HRB 13730",
      "registerart": "HRB",
      "company_name": "GTIT Service Verwaltungs GmbH",
      "company_seat": "Minden",
      "details": "26.05.2025 (Bekanntmachungsdatum)\n\nNordrhein-Westfalen Amtsgericht Bad Oeynhausen HRB 13730\nRegisterbekanntmachung nach dem Umwandlungsgesetz 26.05.2025 (Eintragungsdatum)\n\nGTIT Service Verwaltungs GmbH\nGesellschaft mit beschränkter Haftung\nMinden\n\nDen Gläubigern der an der Verschmelzung beteiligten Rechtsträger ist, wenn sie binnen sechs Monaten nach dem Tag, an dem die Eintragung der Verschmelzung in das Register des Sitzes desjenigen Rechtsträgers, dessen Gläubiger sie sind, nach § 19 Absatz 3 UmwG als bekanntgemacht gilt, ihren Anspruch nach Grund und Höhe schriftlich anmelden, Sicherheit zu leisten, soweit sie nicht Befriedigung verlangen können. Dieses Recht steht den Gläubigern jedoch nur zu, wenn sie glaubhaft machen, dass durch die Verschmelzung die Erfüllung ihrer Forderung gefährdet wird."
    },
    {
      "date": "2025-05-26",
      "id": "110235",
      "original_text": "Registerbekanntmachung nach dem Umwandlungsgesetz\nNordrhein-Westfalen Amtsgericht Köln HRB 78830\nCube Real Estate GmbH – Leverkusen",
      "type": "Registerbekanntmachung nach dem Umwandlungsgesetz",
      "state": "Nordrhein-Westfalen",
      "amtsgericht": "Amtsgericht Köln",
      "registernummer": "HRB 78830",
      "registerart": "HRB",
      "company_name": "Cube Real Estate GmbH",
      "company_seat": "Leverkusen",
      "details": "26.05.2025 (Bekanntmachungsdatum)\n\nNordrhein-Westfalen Amtsgericht Köln HRB 78830\nRegisterbekanntmachung nach dem Umwandlungsgesetz 26.05.2025 (Eintragungsdatum)\n\nCube Real Estate GmbH\nGesellschaft mit beschränkter Haftung\nLeverkusen\n\nDen Gläubigern der an der formwechselnden Umwandlung beteiligten Rechtsträger ist, wenn sie binnen sechs Monaten nach dem Tag, an dem die Eintragung der formwechselnden Umwandlung in das Register des Sitzes desjenigen Rechtsträgers, dessen Gläubiger sie sind, nach § 19 Absatz 3 UmwG als bekanntgemacht gilt, ihren Anspruch nach Grund und Höhe schriftlich anmelden, Sicherheit zu leisten, soweit sie nicht Befriedigung verlangen können. Dieses Recht steht den Gläubigern jedoch nur zu, wenn sie glaubhaft machen, dass durch die formwechselnden Umwandlung die Erfüllung ihrer Forderung gefährdet wird."
    },
    {
      "date": "2025-05-26",
      "id": "110236",
      "original_text": "Einreichung neuer Dokumente\nNordrhein-Westfalen Amtsgericht Köln HRB 2114\nGEW Köln AG – Köln",
      "type": "Einreichung neuer Dokumente",
      "state": "Nordrhein-Westfalen",
      "amtsgericht": "Amtsgericht Köln",
      "registernummer": "HRB 2114",
      "registerart": "HRB",
      "company_name": "GEW Köln AG",
      "company_seat": "Köln",
      "details": "26.05.2025 (Bekanntmachungsdatum)\n\nNordrhein-Westfalen Amtsgericht Köln HRB 2114\nEinreichung neuer Dokumente\n\nGEW Köln AG\nAktiengesellschaft\nKöln\n\nDem Registergericht ist eine neue Liste der Mitglieder des Aufsichtsrates eingereicht worden."
    },
    {
      "date": "2025-05-26",
      "id": "110237",
      "original_text": "Löschungsankündigung\nNordrhein-Westfalen Amtsgericht Düsseldorf HRB 64207\nMagna GmbH – Düsseldorf",
      "type": "Löschungsankündigung",
      "state": "Nordrhein-Westfalen",
      "amtsgericht": "Amtsgericht Düsseldorf",
      "registernummer": "HRB 64207",
      "registerart": "HRB",
      "company_name": "Magna GmbH",
      "company_seat": "Düsseldorf",
      "details": "26.05.2025 (Bekanntmachungsdatum)\n\nNordrhein-Westfalen Amtsgericht Düsseldorf HRB 64207\nLöschungsankündigung\n\nMagna GmbH\nGesellschaft mit beschränkter Haftung\nDüsseldorf\n\nDas Registergericht beabsichtigt die Gesellschaft von Amts wegen nach § 394 FamFG zu löschen. Die Frist zur Erhebung eines Widerspruchs ist auf 3 Wochen festgesetzt.\n\nRechtsbehelfsbelehrung:\nDas Widerspruchsrecht steht jedem zu, der an der Unterlassung der Löschung ein berechtigtes Interesse hat. Der Widerspruch ist bei dem Amtsgericht Düsseldorf -Registergericht-, Werdener Straße 1, 40227 Düsseldorf schriftlich in deutscher Sprache oder zur Niederschrift der Geschäftsstelle einzulegen. Der Widerspruch kann auch zur Niederschrift der Geschäftsstelle eines jeden Amtsgerichtes abgegeben werden. Die Einlegung ist auch durch Übertragung eines elektronischen Dokuments an die elektronische Poststelle des Gerichts möglich. Das elektronische Dokument muss für die Bearbeitung durch das Gericht geeignet und mit einer qualifizierten elektronischen Signatur der verantwortenden Person versehen sein oder von der verantwortenden Person signiert und auf einem sicheren Übermittlungsweg gemäß § 130a ZPO nach näherer Maßgabe der Verordnung über die technischen Rahmenbedingungen des elektronischen Rechtsverkehrs und über das besondere elektronische Behördenpostfach (BGBl. I, S.3803) eingereicht werden. Weitere Informationen erhalten Sie auf der Internetseite www.justiz.de.\nDer Widerspruch muss spätestens innerhalb der gesetzten Frist nach dem Datum der Bekanntmachung der Löschungsankündigung bei dem Amtsgericht - Registergericht - Düsseldorf eingegangen sein.  Dies gilt auch dann, wenn der Widerspruch zur Niederschrift der Geschäftsstelle eines anderen Amtsgerichtes abgegeben wurde. Die Frist beginnt mit dem Tage der Bekanntmachung der Löschungsankündigung in dem für die Bekanntmachung der Eintragungen in das Handelsregister bestimmten elektronischen Informations- und Kommunikationssystem nach § 10 des Handelsgesetzbuches. Fällt das Ende der Frist auf einen Sonntag, einen allgemeinen Feiertag oder Sonnabend, so endet die Frist mit Ablauf des nächsten Werktages.\nDer Widerspruch muss die Bezeichnung der angefochtenen Löschungsankündigung sowie die Erklärung enthalten, dass Widerspruch gegen diese Löschungsankündigung eingelegt wird. Er ist zu unterzeichnen und soll begründet werden."
    },
    {
      "date": "2025-05-26",
      "id": "110238",
      "original_text": "Einreichung neuer Dokumente\nNordrhein-Westfalen Amtsgericht Dortmund HRB 28436\nNORDWEST Handel AG – Dortmund",
      "type": "Einreichung neuer Dokumente",
      "state": "Nordrhein-Westfalen",
      "amtsgericht": "Amtsgericht Dortmund",
      "registernummer": "HRB 28436",
      "registerart": "HRB",
      "company_name": "NORDWEST Handel AG",
      "company_seat": "Dortmund",
      "details": "26.05.2025 (Bekanntmachungsdatum)\n\nNordrhein-Westfalen Amtsgericht Dortmund HRB 28436\nEinreichung neuer Dokumente\n\nNORDWEST Handel AG\nAktiengesellschaft\nDortmund\n\nDem Registergericht ist eine neue Liste der Mitglieder des Aufsichtsrates eingereicht worden."
    },
    {
      "date": "2025-05-26",
      "id": "110239",
      "original_text": "Löschungsankündigung\nNordrhein-Westfalen Amtsgericht Köln HRB 108893\nAchat Baugesellschaft mbH – Köln",
      "type": "Löschungsankündigung",
      "state": "Nordrhein-Westfalen",
      "amtsgericht": "Amtsgericht Köln",
      "registernummer": "HRB 108893",
      "registerart": "HRB",
      "company_name": "Achat Baugesellschaft mbH",
      "company_seat": "Köln",
      "details": "26.05.2025 (Bekanntmachungsdatum)\n\nNordrhein-Westfalen Amtsgericht Köln HRB 108893\nLöschungsankündigung\n\nAchat Baugesellschaft mbH\nGesellschaft mit beschränkter Haftung\nKöln\n\nDas Registergericht beabsichtigt die Gesellschaft von Amts wegen nach § 394 FamFG zu löschen. Die Frist zur Erhebung eines Widerspruchs ist auf einen Monat festgesetzt."
    },
    {
      "date": "2025-05-26",
      "id": "110240",
      "original_text": "Löschungsankündigung\nNordrhein-Westfalen Amtsgericht Köln HRB 108963\nM-Sen GmbH – Leverkusen",
      "type": "Löschungsankündigung",
      "state": "Nordrhein-Westfalen",
      "amtsgericht": "Amtsgericht Köln",
      "registernummer": "HRB 108963",
      "registerart": "HRB",
      "company_name": "M-Sen GmbH",
      "company_seat": "Leverkusen",
      "details": "26.05.2025 (Bekanntmachungsdatum)\n\nNordrhein-Westfalen Amtsgericht Köln HRB 108963\nLöschungsankündigung\n\nM-Sen GmbH\nGesellschaft mit beschränkter Haftung\nLeverkusen\n\nDas Registergericht beabsichtigt die Gesellschaft von Amts wegen nach § 394 FamFG zu löschen. Die Frist zur Erhebung eines Widerspruchs ist auf einen Monat festgesetzt."
    },
    {
      "date": "2025-05-26",
      "id": "110241",
      "original_text": "Löschungsankündigung\nNordrhein-Westfalen Amtsgericht Düsseldorf HRB 59866\narieltecture Gesellschaft von Architekten mbH – Düsseldorf",
      "type": "Löschungsankündigung",
      "state": "Nordrhein-Westfalen",
      "amtsgericht": "Amtsgericht Düsseldorf",
      "registernummer": "HRB 59866",
      "registerart": "HRB",
      "company_name": "arieltecture Gesellschaft von Architekten mbH",
      "company_seat": "Düsseldorf",
      "details": "26.05.2025 (Bekanntmachungsdatum)\n\nNordrhein-Westfalen Amtsgericht Düsseldorf HRB 59866\nLöschungsankündigung\n\narieltecture Gesellschaft von Architekten mbH\nGesellschaft mit beschränkter Haftung\nDüsseldorf\n\nDas Registergericht beabsichtigt die Gesellschaft von Amts wegen nach § 394 Abs. 1 FamFG zu löschen. Die Frist zur Erhebung eines Widerspruchs ist auf einen Monat festgesetzt.\n\nRechtsbehelfsbelehrung:\nDas Widerspruchsrecht steht jedem zu, der an der Unterlassung der Löschung ein berechtigtes Interesse hat. Der Widerspruch ist bei dem Amtsgericht Düsseldorf -Registergericht-, Werdener Straße 1, 40227 Düsseldorf schriftlich in deutscher Sprache oder zur Niederschrift der Geschäftsstelle einzulegen. Der Widerspruch kann auch zur Niederschrift der Geschäftsstelle eines jeden Amtsgerichtes abgegeben werden. Die Einlegung ist auch durch Übertragung eines elektronischen Dokuments an die elektronische Poststelle des Gerichts möglich. Das elektronische Dokument muss für die Bearbeitung durch das Gericht geeignet und mit einer qualifizierten elektronischen Signatur der verantwortenden Person versehen sein oder von der verantwortenden Person signiert und auf einem sicheren Übermittlungsweg gemäß § 130a ZPO nach näherer Maßgabe der Verordnung über die technischen Rahmenbedingungen des elektronischen Rechtsverkehrs und über das besondere elektronische Behördenpostfach (BGBl. I, S.3803) eingereicht werden. Weitere Informationen erhalten Sie auf der Internetseite www.justiz.de.\nDer Widerspruch muss spätestens innerhalb der gesetzten Frist nach dem Datum der Bekanntmachung der Löschungsankündigung bei dem Amtsgericht - Registergericht - Düsseldorf eingegangen sein.  Dies gilt auch dann, wenn der Widerspruch zur Niederschrift der Geschäftsstelle eines anderen Amtsgerichtes abgegeben wurde. Die Frist beginnt mit dem Tage der Bekanntmachung der Löschungsankündigung in dem für die Bekanntmachung der Eintragungen in das Handelsregister bestimmten elektronischen Informations- und Kommunikationssystem nach § 10 des Handelsgesetzbuches. Fällt das Ende der Frist auf einen Sonntag, einen allgemeinen Feiertag oder Sonnabend, so endet die Frist mit Ablauf des nächsten Werktages.\nDer Widerspruch muss die Bezeichnung der angefochtenen Löschungsankündigung sowie die Erklärung enthalten, dass Widerspruch gegen diese Löschungsankündigung eingelegt wird. Er ist zu unterzeichnen und soll begründet werden."
    },
    {
      "date": "2025-05-26",
      "id": "110242",
      "original_text": "Löschungsankündigung\nNordrhein-Westfalen Amtsgericht Köln HRB 70030\nMedienverlag HS GmbH – Brühl",
      "type": "Löschungsankündigung",
      "state": "Nordrhein-Westfalen",
      "amtsgericht": "Amtsgericht Köln",
      "registernummer": "HRB 70030",
      "registerart": "HRB",
      "company_name": "Medienverlag HS GmbH",
      "company_seat": "Brühl",
      "details": "26.05.2025 (Bekanntmachungsdatum)\n\nNordrhein-Westfalen Amtsgericht Köln HRB 70030\nLöschungsankündigung\n\nMedienverlag HS GmbH\nGesellschaft mit beschränkter Haftung\nBrühl\n\nDas Registergericht beabsichtigt die Gesellschaft von Amts wegen nach § 394 FamFG zu löschen. Die Frist zur Erhebung eines Widerspruchs ist auf einen Monat festgesetzt."
    },
    {
      "date": "2025-05-26",
      "id": "110243",
      "original_text": "Registerbekanntmachung nach dem Umwandlungsgesetz\nNordrhein-Westfalen Amtsgericht Hagen HRB 13419\nGetränke Rehfeld GmbH – Gevelsberg",
      "type": "Registerbekanntmachung nach dem Umwandlungsgesetz",
      "state": "Nordrhein-Westfalen",
      "amtsgericht": "Amtsgericht Hagen",
      "registernummer": "HRB 13419",
      "registerart": "HRB",
      "company_name": "Getränke Rehfeld GmbH",
      "company_seat": "Gevelsberg",
      "details": "26.05.2025 (Bekanntmachungsdatum)\n\nNordrhein-Westfalen Amtsgericht Hagen HRB 13419\nRegisterbekanntmachung nach dem Umwandlungsgesetz 23.05.2025 (Eintragungsdatum)\n\nGetränke Rehfeld GmbH\nGesellschaft mit beschränkter Haftung\nGevelsberg\n\nDie Gesellschaft hat Gläubigern, deren Forderungen vor dieser Bekanntmachung begründet worden sind, Sicherheit zu leisten, soweit sie nicht Befriedigung verlangen können, wenn sie sich binnen sechs Monaten zu diesem Zweck melden.Den Gläubigern der an der Ausgliederung beteiligten Rechtsträger ist, wenn sie binnen sechs Monaten nach dem Tag, an dem die Eintragung der Ausgliederung in das Register des Sitzes desjenigen Rechtsträgers, dessen Gläubiger sie sind, nach § 19 Absatz 3 UmwG als bekanntgemacht gilt, ihren Anspruch nach Grund und Höhe schriftlich anmelden, Sicherheit zu leisten, soweit sie nicht Befriedigung verlangen können. Dieses Recht steht den Gläubigern jedoch nur zu, wenn sie glaubhaft machen, dass durch die Ausgliederung die Erfüllung ihrer Forderung gefährdet wird."
    },
    {
      "date": "2025-05-26",
      "id": "110244",
      "original_text": "Löschungsankündigung\nNordrhein-Westfalen Amtsgericht Recklinghausen HRB 9123\nS.A.T. Bau GmbH – Waltrop",
      "type": "Löschungsankündigung",
      "state": "Nordrhein-Westfalen",
      "amtsgericht": "Amtsgericht Recklinghausen",
      "registernummer": "HRB 9123",
      "registerart": "HRB",
      "company_name": "S.A.T. Bau GmbH",
      "company_seat": "Waltrop",
      "details": "26.05.2025 (Bekanntmachungsdatum)\n\nNordrhein-Westfalen Amtsgericht Recklinghausen HRB 9123\nLöschungsankündigung\n\nS.A.T. Bau GmbH\nGesellschaft mit beschränkter Haftung\nWaltrop\n\nDas Registergericht beabsichtigt die Gesellschaft von Amts wegen nach § 394 FamFG zu löschen. Die Frist zur Erhebung eines Widerspruchs ist auf drei Monate festgesetzt."
    },
    {
      "date": "2025-05-26",
      "id": "110245",
      "original_text": "Einreichung neuer Dokumente\nNordrhein-Westfalen Amtsgericht Münster HRB 9692\nAGRAVIS RAIFFEISEN AG – Münster",
      "type": "Einreichung neuer Dokumente",
      "state": "Nordrhein-Westfalen",
      "amtsgericht": "Amtsgericht Münster",
      "registernummer": "HRB 9692",
      "registerart": "HRB",
      "company_name": "AGRAVIS RAIFFEISEN AG",
      "company_seat": "Münster",
      "details": "26.05.2025 (Bekanntmachungsdatum)\n\nNordrhein-Westfalen Amtsgericht Münster HRB 9692\nEinreichung neuer Dokumente 26.05.2025 (Eintragungsdatum)\n\nAGRAVIS RAIFFEISEN AG\nAktiengesellschaft\nMünster\n\nDem Registergericht ist eine neue Liste der Mitglieder des Aufsichtsrates eingereicht worden."
    },
    {
      "date": "2025-05-26",
      "id": "110246",
      "original_text": "Einreichung neuer Dokumente\nHessen Amtsgericht Frankfurt am Main HRB 55497\nSage GmbH – Frankfurt am Main",
      "type": "Einreichung neuer Dokumente",
      "state": "Hessen",
      "amtsgericht": "Amtsgericht Frankfurt am Main",
      "registernummer": "HRB 55497",
      "registerart": "HRB",
      "company_name": "Sage GmbH",
      "company_seat": "Frankfurt am Main",
      "details": "26.05.2025 (Bekanntmachungsdatum)\n\nHessen Amtsgericht Frankfurt am Main HRB 55497\nEinreichung neuer Dokumente\n\nSage GmbH\nGesellschaft mit beschränkter Haftung\nFrankfurt am Main\n\nDurch eine Änderung in den Personen der Aufsichtsratsmitglieder ist eine Liste der Mitglieder des Aufsichtsrates zum Handelsregister eingereicht worden."
    },
    {
      "date": "2025-05-26",
      "id": "110247",
      "original_text": "Löschungsankündigung\nHessen Amtsgericht Frankfurt am Main HRB 88469\nHartmann Schließ + Sicherheitstechnik GmbH – Frankfurt am Main",
      "type": "Löschungsankündigung",
      "state": "Hessen",
      "amtsgericht": "Amtsgericht Frankfurt am Main",
      "registernummer": "HRB 88469",
      "registerart": "HRB",
      "company_name": "Hartmann Schließ + Sicherheitstechnik GmbH",
      "company_seat": "Frankfurt am Main",
      "details": "26.05.2025 (Bekanntmachungsdatum)\n\nHessen Amtsgericht Frankfurt am Main HRB 88469\nLöschungsankündigung\n\nHartmann Schließ + Sicherheitstechnik GmbH\nGesellschaft mit beschränkter Haftung\nFrankfurt am Main\n\nDas Registergericht beabsichtigt die im Handelsregister eingetragene Gesellschaft von Amts wegen nach § 394 FamFG zu löschen. Hiergegen kann innerhalb ines Monats nach dieser Veröfentlichung Widerspruch bei dem Amtsgericht Frankfurt am Main eingelegt werden."
    },
    {
      "date": "2025-05-26",
      "id": "110248",
      "original_text": "Registerbekanntmachung nach dem Umwandlungsgesetz\nHessen Amtsgericht Bad Homburg v.d.H. HRB 11462\nLFO Holding AG – Bad Homburg v. d. Höhe",
      "type": "Registerbekanntmachung nach dem Umwandlungsgesetz",
      "state": "Hessen",
      "amtsgericht": "Amtsgericht Bad Homburg v.d.H.",
      "registernummer": "HRB 11462",
      "registerart": "HRB",
      "company_name": "LFO Holding AG",
      "company_seat": "Bad Homburg v. d. Höhe",
      "details": "26.05.2025 (Bekanntmachungsdatum)\n\nHessen Amtsgericht Bad Homburg v.d.H. HRB 11462\nRegisterbekanntmachung nach dem Umwandlungsgesetz 26.05.2025 (Eintragungsdatum)\n\nLFO Holding AG\nAktiengesellschaft\nBad Homburg v. d. Höhe\n\nDen Gläubigern der an der formwechselnden Umwandlung beteiligten Rechtsträger ist, wenn sie binnen sechs Monaten nach dem Tag, an dem die Eintragung der formwechselnden Umwandlung in das Register des Sitzes desjenigen Rechtsträgers, dessen Gläubiger sie sind, nach § 201 UmwG bekannt gemacht worden ist, ihren Anspruch nach Grund und Höhe schriftlich anmelden, Sicherheit zu leisten, soweit sie nicht Befriedigung verlangen können. Dieses Recht steht den Gläubigern jedoch nur zu, wenn sie glaubhaft machen, dass durch die formwechselnden Umwandlung die Erfüllung ihrer Forderung gefährdet wird."
    },
    {
      "date": "2025-05-26",
      "id": "110249",
      "original_text": "Registerbekanntmachung nach dem Umwandlungsgesetz\nHessen Amtsgericht Hanau HRB 93109\nSyntax Media GmbH – Bad Soden-Salmünster",
      "type": "Registerbekanntmachung nach dem Umwandlungsgesetz",
      "state": "Hessen",
      "amtsgericht": "Amtsgericht Hanau",
      "registernummer": "HRB 93109",
      "registerart": "HRB",
      "company_name": "Syntax Media GmbH",
      "company_seat": "Bad Soden-Salmünster",
      "details": "26.05.2025 (Bekanntmachungsdatum)\n\nHessen Amtsgericht Hanau HRB 93109\nRegisterbekanntmachung nach dem Umwandlungsgesetz 26.05.2025 (Eintragungsdatum)\n\nSyntax Media GmbH\nGesellschaft mit beschränkter Haftung\nBad Soden-Salmünster\n\nDen Gläubigern der an der Verschmelzung beteiligten Rechtsträger ist, wenn sie binnen sechs Monaten nach dem Tag, an dem die Eintragung der Verschmelzung in das Register des Sitzes desjenigen Rechtsträgers, dessen Gläubiger sie sind, nach § 19 Absatz 3 UmwG bekannt gemacht worden ist, ihren Anspruch nach Grund und Höhe schriftlich anmelden, Sicherheit zu leisten, soweit sie nicht Befriedigung verlangen können. Dieses Recht steht den Gläubigern jedoch nur zu, wenn sie glaubhaft machen, dass durch die Verschmelzung die Erfüllung ihrer Forderung gefährdet wird."
    },
    {
      "date": "2025-05-26",
      "id": "110250",
      "original_text": "Löschungsankündigung\nHessen Amtsgericht Frankfurt am Main HRB 76415\nChinarestaurant YAN JING GmbH – Frankfurt am Main",
      "type": "Löschungsankündigung",
      "state": "Hessen",
      "amtsgericht": "Amtsgericht Frankfurt am Main",
      "registernummer": "HRB 76415",
      "registerart": "HRB",
      "company_name": "Chinarestaurant YAN JING GmbH",
      "company_seat": "Frankfurt am Main",
      "details": "26.05.2025 (Bekanntmachungsdatum)\n\nHessen Amtsgericht Frankfurt am Main HRB 76415\nLöschungsankündigung 26.05.2025 (Eintragungsdatum)\n\nChinarestaurant YAN JING GmbH\nGesellschaft mit beschränkter Haftung\nFrankfurt am Main\n\nDas Registergericht beabsichtigt die im Handelsregister eingetragene Gesellschaft von Amts wegen nach § 394 FamFG zu löschen. Die Frist zur Erhebung eines Widerspruchs gegen die beabsichtigte Löschung wird auf 1 Monat festgesetzt."
    },
    {
      "date": "2025-05-26",
      "id": "110251",
      "original_text": "Registerbekanntmachung nach dem Umwandlungsgesetz\nHessen Amtsgericht Frankfurt am Main HRB 97817\nDERTOUR Online GmbH – Frankfurt am Main",
      "type": "Registerbekanntmachung nach dem Umwandlungsgesetz",
      "state": "Hessen",
      "amtsgericht": "Amtsgericht Frankfurt am Main",
      "registernummer": "HRB 97817",
      "registerart": "HRB",
      "company_name": "DERTOUR Online GmbH",
      "company_seat": "Frankfurt am Main",
      "details": "26.05.2025 (Bekanntmachungsdatum)\n\nHessen Amtsgericht Frankfurt am Main HRB 97817\nRegisterbekanntmachung nach dem Umwandlungsgesetz 26.05.2025 (Eintragungsdatum)\n\nDERTOUR Online GmbH\nGesellschaft mit beschränkter Haftung\nFrankfurt am Main\n\nDen Gläubigern der an der Verschmelzung beteiligten Rechtsträger ist, wenn sie binnen sechs Monaten nach dem Tag, an dem die Eintragung der Verschmelzung in das Register des Sitzes desjenigen Rechtsträgers, dessen Gläubiger sie sind, nach § 19 Absatz 3 UmwG bekannt gemacht worden ist, ihren Anspruch nach Grund und Höhe schriftlich anmelden, Sicherheit zu leisten, soweit sie nicht Befriedigung verlangen können. Dieses Recht steht den Gläubigern jedoch nur zu, wenn sie glaubhaft machen, dass durch die Verschmelzung die Erfüllung ihrer Forderung gefährdet wird."
    },
    {
      "date": "2025-05-26",
      "id": "110252",
      "original_text": "Sonstige Registerbekanntmachung\nHessen Amtsgericht Kassel VR 1642\nHundesportverein Lohfelden e.V. – Lohfelden",
      "type": "Sonstige Registerbekanntmachung",
      "state": "Hessen",
      "amtsgericht": "Amtsgericht Kassel",
      "registernummer": "VR 1642",
      "registerart": "VR",
      "company_name": "Hundesportverein Lohfelden e.V.",
      "company_seat": "Lohfelden",
      "details": "26.05.2025 (Bekanntmachungsdatum)\n\nHessen Amtsgericht Kassel VR 1642\nSonstige Registerbekanntmachung 26.05.2025 (Eintragungsdatum)\n\nHundesportverein Lohfelden e.V.\neingetragener Verein\nLohfelden\n\nDer Verein ist aufgelöst."
    },
    {
      "date": "2025-05-26",
      "id": "110253",
      "original_text": "Registerbekanntmachung nach dem Umwandlungsgesetz\nHessen Amtsgericht Frankfurt am Main HRB 50879\nDB InfraGO Aktiengesellschaft – Frankfurt am Main",
      "type": "Registerbekanntmachung nach dem Umwandlungsgesetz",
      "state": "Hessen",
      "amtsgericht": "Amtsgericht Frankfurt am Main",
      "registernummer": "HRB 50879",
      "registerart": "HRB",
      "company_name": "DB InfraGO Aktiengesellschaft",
      "company_seat": "Frankfurt am Main",
      "details": "26.05.2025 (Bekanntmachungsdatum)\n\nHessen Amtsgericht Frankfurt am Main HRB 50879\nRegisterbekanntmachung nach dem Umwandlungsgesetz 26.05.2025 (Eintragungsdatum)\n\nDB InfraGO Aktiengesellschaft\nAktiengesellschaft\nFrankfurt am Main\n\nDen Gläubigern der an der Abspaltung beteiligten Rechtsträger ist, wenn sie binnen sechs Monaten nach dem Tag, an dem die Eintragung der Abspaltung in das Register des Sitzes desjenigen Rechtsträgers, dessen Gläubiger sie sind, nach §§ 125, 19 Absatz 3 UmwG bekannt gemacht worden ist, ihren Anspruch nach Grund und Höhe schriftlich anmelden, Sicherheit zu leisten, soweit sie nicht Befriedigung verlangen können. Dieses Recht steht den Gläubigern jedoch nur zu, wenn sie glaubhaft machen, dass durch die Abspaltung die Erfüllung ihrer Forderung gefährdet wird."
    },
    {
      "date": "2025-05-26",
      "id": "110254",
      "original_text": "Sonstige Registerbekanntmachung\nHessen Amtsgericht Wetzlar VR 1237\nFreundeskreis der Wirbelsäulenerkrankten Ortsverein Wetzlar-Lahn-Dill – Wetzlar",
      "type": "Sonstige Registerbekanntmachung",
      "state": "Hessen",
      "amtsgericht": "Amtsgericht Wetzlar",
      "registernummer": "VR 1237",
      "registerart": "VR",
      "company_name": "Freundeskreis der Wirbelsäulenerkrankten Ortsverein Wetzlar-Lahn-Dill",
      "company_seat": "Wetzlar",
      "details": "26.05.2025 (Bekanntmachungsdatum)\n\nHessen Amtsgericht Wetzlar VR 1237\nSonstige Registerbekanntmachung 26.05.2025 (Eintragungsdatum)\n\nFreundeskreis der Wirbelsäulenerkrankten Ortsverein Wetzlar-Lahn-Dill\neingetragener Verein\nWetzlar\n\nDer Verein ist aufgelöst."
    },
    {
      "date": "2025-05-26",
      "id": "110255",
      "original_text": "Einreichung neuer Dokumente\nHessen Amtsgericht Frankfurt am Main HRB 108645\nNoratis AG – Eschborn",
      "type": "Einreichung neuer Dokumente",
      "state": "Hessen",
      "amtsgericht": "Amtsgericht Frankfurt am Main",
      "registernummer": "HRB 108645",
      "registerart": "HRB",
      "company_name": "Noratis AG",
      "company_seat": "Eschborn",
      "details": "26.05.2025 (Bekanntmachungsdatum)\n\nHessen Amtsgericht Frankfurt am Main HRB 108645\nEinreichung neuer Dokumente\n\nNoratis AG\nAktiengesellschaft\nEschborn\n\nDurch eine Änderung in den Personen der Aufsichtsratsmitglieder ist eine Liste der Mitglieder des Aufsichtsrates zum Handelsregister eingereicht worden."
    },
    {
      "date": "2025-05-26",
      "id": "110256",
      "original_text": "Registerbekanntmachung nach dem Umwandlungsgesetz\nHessen Amtsgericht Frankfurt am Main HRB 138098\nVIB HI Objekt 6 GmbH – Frankfurt am Main",
      "type": "Registerbekanntmachung nach dem Umwandlungsgesetz",
      "state": "Hessen",
      "amtsgericht": "Amtsgericht Frankfurt am Main",
      "registernummer": "HRB 138098",
      "registerart": "HRB",
      "company_name": "VIB HI Objekt 6 GmbH",
      "company_seat": "Frankfurt am Main",
      "details": "26.05.2025 (Bekanntmachungsdatum)\n\nHessen Amtsgericht Frankfurt am Main HRB 138098\nRegisterbekanntmachung nach dem Umwandlungsgesetz 20.03.2025 (Eintragungsdatum)\n\nVIB HI Objekt 6 GmbH\nGesellschaft mit beschränkter Haftung\nFrankfurt am Main\n\nDen Gläubigern der an der formwechselnden Umwandlung beteiligten Rechtsträger ist, wenn sie binnen sechs Monaten nach dem Tag, an dem die Eintragung der formwechselnden Umwandlung in das Register des Sitzes derjenigen Rechtsträger deren Gläubiger sie sind, nach § 201 UmwG bekannt gemacht worden ist, ihren Anspruch nach Grund und Höhe schriftlich anmelden, Sicherheit zu leisten, soweit sie nicht Befriedigung verlangen können. Dieses Recht steht den Gläubigern jedoch nur zu, wenn sie glaubhaft machen, dass durch die formwechselnden Umwandlung die Erfüllung ihrer Forderung gefährdet wird."
    },
    {
      "date": "2025-05-26",
      "id": "110257",
      "original_text": "Löschungsankündigung\nHessen Amtsgericht Frankfurt am Main HRB 109606\nHerkules Intelligent Technology GmbH – Frankfurt am Main",
      "type": "Löschungsankündigung",
      "state": "Hessen",
      "amtsgericht": "Amtsgericht Frankfurt am Main",
      "registernummer": "HRB 109606",
      "registerart": "HRB",
      "company_name": "Herkules Intelligent Technology GmbH",
      "company_seat": "Frankfurt am Main",
      "details": "26.05.2025 (Bekanntmachungsdatum)\n\nHessen Amtsgericht Frankfurt am Main HRB 109606\nLöschungsankündigung\n\nHerkules Intelligent Technology GmbH\nGesellschaft mit beschränkter Haftung\nFrankfurt am Main\n\nDas Registergericht beabsichtigt die im Handelsregister eingetragene Gesellschaft von Amts wegen nach § 394 FamFG zu löschen. Die Frist zur Erhebung eines Widerspruchs gegen die beabsichtigte Löschung wird auf 1 Monate festgesetzt."
    },
    {
      "date": "2025-05-26",
      "id": "110258",
      "original_text": "Einreichung neuer Dokumente\nHessen Amtsgericht Bad Homburg v.d.H. HRB 9357\nBaloise Sachversicherung Aktiengesellschaft Deutschland – Bad Homburg v.d.Höhe",
      "type": "Einreichung neuer Dokumente",
      "state": "Hessen",
      "amtsgericht": "Amtsgericht Bad Homburg v.d.H.",
      "registernummer": "HRB 9357",
      "registerart": "HRB",
      "company_name": "Baloise Sachversicherung Aktiengesellschaft Deutschland",
      "company_seat": "Bad Homburg v.d.Höhe",
      "details": "26.05.2025 (Bekanntmachungsdatum)\n\nHessen Amtsgericht Bad Homburg v.d.H. HRB 9357\nEinreichung neuer Dokumente 26.05.2025 (Eintragungsdatum)\n\nBaloise Sachversicherung Aktiengesellschaft Deutschland\nAktiengesellschaft\nBad Homburg v.d.Höhe\n\nDurch eine Änderung in den Personen der Aufsichtsratsmitglieder ist eine Liste der Mitglieder des Aufsichtsrates zum Handelsregister eingereicht worden."
    },
    {
      "date": "2025-05-26",
      "id": "110259",
      "original_text": "Einreichung neuer Dokumente\nHessen Amtsgericht Darmstadt HRB 88772\ninnovIT AG – Seeheim-Jugenheim",
      "type": "Einreichung neuer Dokumente",
      "state": "Hessen",
      "amtsgericht": "Amtsgericht Darmstadt",
      "registernummer": "HRB 88772",
      "registerart": "HRB",
      "company_name": "innovIT AG",
      "company_seat": "Seeheim-Jugenheim",
      "details": "26.05.2025 (Bekanntmachungsdatum)\n\nHessen Amtsgericht Darmstadt HRB 88772\nEinreichung neuer Dokumente\n\ninnovIT AG\nAktiengesellschaft\nSeeheim-Jugenheim\n\nWegen Änderungen in den Personen der Aufsichtsratsmitglieder ist eine Liste der Mitglieder des Aufsichtsrates zum Handelsregister eingereicht worden."
    },
    {
      "date": "2025-05-26",
      "id": "110260",
      "original_text": "Sonstige Registerbekanntmachung\nHessen Amtsgericht Wetzlar VR 1597\nPatchwork Naunheim - Soziale Initiative im Stadtteil e.V. – Wetzlar-Naunheim",
      "type": "Sonstige Registerbekanntmachung",
      "state": "Hessen",
      "amtsgericht": "Amtsgericht Wetzlar",
      "registernummer": "VR 1597",
      "registerart": "VR",
      "company_name": "Patchwork Naunheim - Soziale Initiative im Stadtteil e.V.",
      "company_seat": "Wetzlar-Naunheim",
      "details": "26.05.2025 (Bekanntmachungsdatum)\n\nHessen Amtsgericht Wetzlar VR 1597\nSonstige Registerbekanntmachung 26.05.2025 (Eintragungsdatum)\n\nPatchwork Naunheim - Soziale Initiative im Stadtteil e.V.\neingetragener Verein\nWetzlar-Naunheim\n\nDer Verein ist aufgelöst."
    },
    {
      "date": "2025-05-26",
      "id": "110261",
      "original_text": "Einreichung neuer Dokumente\nHessen Amtsgericht Frankfurt am Main HRB 9340\nAllianz Global Investors GmbH – Frankfurt am Main",
      "type": "Einreichung neuer Dokumente",
      "state": "Hessen",
      "amtsgericht": "Amtsgericht Frankfurt am Main",
      "registernummer": "HRB 9340",
      "registerart": "HRB",
      "company_name": "Allianz Global Investors GmbH",
      "company_seat": "Frankfurt am Main",
      "details": "26.05.2025 (Bekanntmachungsdatum)\n\nHessen Amtsgericht Frankfurt am Main HRB 9340\nEinreichung neuer Dokumente\n\nAllianz Global Investors GmbH\nGesellschaft mit beschränkter Haftung\nFrankfurt am Main\n\nDurch eine Änderung in den Personen der Aufsichtsratsmitglieder ist eine Liste der Mitglieder des Aufsichtsrates zum Handelsregister eingereicht worden."
    }
  ]
}