{
  "date": "2025-05-13",
  "date_of_scrape": "2025-05-31T08:56:59.465Z",
  "tool_version": "0.2.0",
  "number_of_announcements": 161,
  "announcements": [
    {
      "date": "2025-05-13",
      "id": "108786",
      "original_text": "Registerbekanntmachung nach dem Umwandlungsgesetz\nBayern Amtsgericht München HRB 299246\nevideli GmbH – Münsing",
      "type": "Registerbekanntmachung nach dem Umwandlungsgesetz",
      "state": "Bayern",
      "amtsgericht": "Amtsgericht München",
      "registernummer": "HRB 299246",
      "registerart": "HRB",
      "company_name": "evideli GmbH",
      "company_seat": "Münsing",
      "details": "13.05.2025 (Bekanntmachungsdatum)\n\nBayern Amtsgericht München HRB 299246\nRegisterbekanntmachung nach dem Umwandlungsgesetz 12.05.2025 (Eintragungsdatum)\n\nevideli GmbH\nGesellschaft mit beschränkter Haftung\nMünsing\n\nDen Gläubigern der an der Verschmelzung beteiligten Rechtsträger ist, wenn sie binnen sechs Monaten nach dem Tag, an dem die Eintragung der Verschmelzung in das Register des Sitzes desjenigen Rechtsträgers, dessen Gläubiger sie sind, nach § 19 Abs. 3 UmwG als bekannt gemacht gilt, ihren Anspruch nach Grund und Höhe in Textform anmelden, Sicherheit zu leisten, soweit sie nicht Befriedigung verlangen können. Dieses Recht steht den Gläubigern jedoch nur zu, wenn sie glaubhaft machen, dass durch die Verschmelzung die Erfüllung ihrer Forderung gefährdet wird."
    },
    {
      "date": "2025-05-13",
      "id": "108787",
      "original_text": "Registerbekanntmachung nach dem Umwandlungsgesetz\nBayern Amtsgericht München HRB 123355\nCloud SG Germany GmbH – München",
      "type": "Registerbekanntmachung nach dem Umwandlungsgesetz",
      "state": "Bayern",
      "amtsgericht": "Amtsgericht München",
      "registernummer": "HRB 123355",
      "registerart": "HRB",
      "company_name": "Cloud SG Germany GmbH",
      "company_seat": "München",
      "details": "13.05.2025 (Bekanntmachungsdatum)\n\nBayern Amtsgericht München HRB 123355\nRegisterbekanntmachung nach dem Umwandlungsgesetz 10.05.2025 (Eintragungsdatum)\n\nCloud SG Germany GmbH\nGesellschaft mit beschränkter Haftung\nMünchen\n\nDen Gläubigern der an der Verschmelzung beteiligten Rechtsträger ist, wenn sie binnen sechs Monaten nach dem Tag, an dem die Eintragung der Verschmelzung in das Register des Sitzes desjenigen Rechtsträgers, dessen Gläubiger sie sind, nach § 19 Abs. 3 UmwG als bekannt gemacht gilt, ihren Anspruch nach Grund und Höhe in Textform anmelden, Sicherheit zu leisten, soweit sie nicht Befriedigung verlangen können. Dieses Recht steht den Gläubigern jedoch nur zu, wenn sie glaubhaft machen, dass durch die Verschmelzung die Erfüllung ihrer Forderung gefährdet wird."
    },
    {
      "date": "2025-05-13",
      "id": "108788",
      "original_text": "Registerbekanntmachung nach dem Umwandlungsgesetz\nBayern Amtsgericht Nürnberg HRB 35659\nOvershield GmbH – Nürnberg",
      "type": "Registerbekanntmachung nach dem Umwandlungsgesetz",
      "state": "Bayern",
      "amtsgericht": "Amtsgericht Nürnberg",
      "registernummer": "HRB 35659",
      "registerart": "HRB",
      "company_name": "Overshield GmbH",
      "company_seat": "Nürnberg",
      "details": "13.05.2025 (Bekanntmachungsdatum)\n\nBayern Amtsgericht Nürnberg HRB 35659\nRegisterbekanntmachung nach dem Umwandlungsgesetz\n\nOvershield GmbH\nGesellschaft mit beschränkter Haftung\nNürnberg\n\nDem Amtsgericht Nürnberg -Registergericht- ist am 30.04.2025 ein Formwechselplan  über den geplanten grenzüberschreitenden Formwechsel der Overshield GmbH mit Sitz in Nürnberg in eine  PRIVATE COMPANY LIMITED BY SHARES nach dem Recht des Staates Zypern unter der Firma OVERSHIELD LIMITED mit Sitz in Zypern (künftige Registrierung beim Department of Registrar of Companies and Intellectual Property, Zypern) eingereicht worden.\nEin Hinweis an folgende Personen, dass sie der Gesellschaft spätestens fünf\nArbeitstage vor dem Tag der Beschlussfassung über den Formwechsel Bemerkungen\nzum Formwechselplan übermitteln können:\na) an die Anteilsinhaber Gläubiger der Gesellschaft sowie\nb) an die Arbeitnehmer der Gesellschaft.\nDa die Gesellschaft keinen Betriebsrat hat, erfolgt der Hinweis an deren Arbeitnehmer.\nDie Beschlussfassung über den Formwechsel ist für den 5. Juni 2025 vorgesehen. Das\ngenaue Datum hängt u.a. von dem Datum der Bekanntmachung ab."
    },
    {
      "date": "2025-05-13",
      "id": "108789",
      "original_text": "Registerbekanntmachung nach dem Umwandlungsgesetz\nBayern Amtsgericht München HRB 202695\nOHM8 GmbH – München",
      "type": "Registerbekanntmachung nach dem Umwandlungsgesetz",
      "state": "Bayern",
      "amtsgericht": "Amtsgericht München",
      "registernummer": "HRB 202695",
      "registerart": "HRB",
      "company_name": "OHM8 GmbH",
      "company_seat": "München",
      "details": "13.05.2025 (Bekanntmachungsdatum)\n\nBayern Amtsgericht München HRB 202695\nRegisterbekanntmachung nach dem Umwandlungsgesetz 12.05.2025 (Eintragungsdatum)\n\nOHM8 GmbH\nGesellschaft mit beschränkter Haftung\nMünchen\n\nDen Gläubigern der an der Verschmelzung beteiligten Rechtsträger ist, wenn sie binnen sechs Monaten nach dem Tag, an dem die Eintragung der Verschmelzung in das Register des Sitzes desjenigen Rechtsträgers, dessen Gläubiger sie sind, nach § 19 Abs. 3 UmwG als bekannt gemacht gilt, ihren Anspruch nach Grund und Höhe in Textform anmelden, Sicherheit zu leisten, soweit sie nicht Befriedigung verlangen können. Dieses Recht steht den Gläubigern jedoch nur zu, wenn sie glaubhaft machen, dass durch die Verschmelzung die Erfüllung ihrer Forderung gefährdet wird."
    },
    {
      "date": "2025-05-13",
      "id": "108790",
      "original_text": "Löschungsankündigung\nBayern Amtsgericht München HRB 253263\nRed Future GmbH – Planegg",
      "type": "Löschungsankündigung",
      "state": "Bayern",
      "amtsgericht": "Amtsgericht München",
      "registernummer": "HRB 253263",
      "registerart": "HRB",
      "company_name": "Red Future GmbH",
      "company_seat": "Planegg",
      "details": "13.05.2025 (Bekanntmachungsdatum)\n\nBayern Amtsgericht München HRB 253263\nLöschungsankündigung 12.05.2025 (Eintragungsdatum)\n\nRed Future GmbH\nGesellschaft mit beschränkter Haftung\nPlanegg\n\nDas Registergericht beabsichtigt, die im Handelsregister eingetragene Gesellschaft wegen Vermögenslosigkeit von Amts wegen nach § 394 FamFG zu löschen. Die Frist zur Erhebung eines Widerspruchs ist auf drei Monate festgesetzt."
    },
    {
      "date": "2025-05-13",
      "id": "108791",
      "original_text": "Löschungsankündigung\nBayern Amtsgericht Fürth HRB 16643\nWerkmal Berlin UG (haftungsbeschränkt) – Erlangen",
      "type": "Löschungsankündigung",
      "state": "Bayern",
      "amtsgericht": "Amtsgericht Fürth",
      "registernummer": "HRB 16643",
      "registerart": "HRB",
      "company_name": "Werkmal Berlin UG (haftungsbeschränkt)",
      "company_seat": "Erlangen",
      "details": "13.05.2025 (Bekanntmachungsdatum)\n\nBayern Amtsgericht Fürth HRB 16643\nLöschungsankündigung\n\nWerkmal Berlin UG (haftungsbeschränkt)\nGesellschaft mit beschränkter Haftung\nErlangen\n\nDas Registergericht beabsichtigt, die im Handelsregister eingetragene Gesellschaft wegen Vermögenslosigkeit von Amts wegen nach § 394 FamFG zu löschen. Die Frist zur Erhebung eines Widerspruchs ist auf drei Monate festgesetzt."
    },
    {
      "date": "2025-05-13",
      "id": "108792",
      "original_text": "Registerbekanntmachung nach dem Umwandlungsgesetz\nBayern Amtsgericht Traunstein HRB 22017\nFinke Zaunsysteme GmbH – Freilassing",
      "type": "Registerbekanntmachung nach dem Umwandlungsgesetz",
      "state": "Bayern",
      "amtsgericht": "Amtsgericht Traunstein",
      "registernummer": "HRB 22017",
      "registerart": "HRB",
      "company_name": "Finke Zaunsysteme GmbH",
      "company_seat": "Freilassing",
      "details": "13.05.2025 (Bekanntmachungsdatum)\n\nBayern Amtsgericht Traunstein HRB 22017\nRegisterbekanntmachung nach dem Umwandlungsgesetz 12.05.2025 (Eintragungsdatum)\n\nFinke Zaunsysteme GmbH\nGesellschaft mit beschränkter Haftung\nFreilassing\n\nDen Gläubigern der an der Verschmelzung beteiligten Rechtsträger ist, wenn sie binnen sechs Monaten nach dem Tag, an dem die Eintragung der Verschmelzung in das Register des Sitzes desjenigen Rechtsträgers, dessen Gläubiger sie sind, nach § 19 Abs. 3 UmwG als bekannt gemacht gilt, ihren Anspruch nach Grund und Höhe in Textform anmelden, Sicherheit zu leisten, soweit sie nicht Befriedigung verlangen können. Dieses Recht steht den Gläubigern jedoch nur zu, wenn sie glaubhaft machen, dass durch die Verschmelzung die Erfüllung ihrer Forderung gefährdet wird."
    },
    {
      "date": "2025-05-13",
      "id": "108793",
      "original_text": "Einreichung neuer Dokumente\nBayern Amtsgericht Nürnberg HRB 1865\nIGARASHI Motoren GmbH – Ezelsdorf",
      "type": "Einreichung neuer Dokumente",
      "state": "Bayern",
      "amtsgericht": "Amtsgericht Nürnberg",
      "registernummer": "HRB 1865",
      "registerart": "HRB",
      "company_name": "IGARASHI Motoren GmbH",
      "company_seat": "Ezelsdorf",
      "details": "13.05.2025 (Bekanntmachungsdatum)\n\nBayern Amtsgericht Nürnberg HRB 1865\nEinreichung neuer Dokumente\n\nIGARASHI Motoren GmbH\nGesellschaft mit beschränkter Haftung\nEzelsdorf\n\nDem Amtsgericht Nürnberg -Registergericht- ist eine Liste der Mitglieder des Aufsichtsrats eingereicht worden, § 52 Abs. 3 S. 2 GmbHG."
    },
    {
      "date": "2025-05-13",
      "id": "108794",
      "original_text": "Registerbekanntmachung nach dem Umwandlungsgesetz\nBayern Amtsgericht Aschaffenburg HRA 6655\nGarten- und Landschaftsbau Stegmann e.K. – Mönchberg",
      "type": "Registerbekanntmachung nach dem Umwandlungsgesetz",
      "state": "Bayern",
      "amtsgericht": "Amtsgericht Aschaffenburg",
      "registernummer": "HRA 6655",
      "registerart": "HRA",
      "company_name": "Garten- und Landschaftsbau Stegmann e.K.",
      "company_seat": "Mönchberg",
      "details": "13.05.2025 (Bekanntmachungsdatum)\n\nBayern Amtsgericht Aschaffenburg HRA 6655\nRegisterbekanntmachung nach dem Umwandlungsgesetz 12.05.2025 (Eintragungsdatum)\n\nGarten- und Landschaftsbau Stegmann e.K.\nEinzelkaufmann / Einzelkauffrau\nMönchberg\n\nDen Gläubigern der an der Ausgliederung beteiligten Rechtsträger ist, wenn sie binnen sechs Monaten nach dem Tag, an dem die Eintragung der Ausgliederung in das Register des Sitzes desjenigen Rechtsträgers, dessen Gläubiger sie sind, nach §§ 125, 19 Abs. 3 UmwG als bekannt gemacht gilt, ihren Anspruch nach Grund und Höhe in Textform anmelden, Sicherheit zu leisten, soweit sie nicht Befriedigung verlangen können. Dieses Recht steht den Gläubigern jedoch nur zu, wenn sie glaubhaft machen, dass durch die Ausgliederung die Erfüllung ihrer Forderung gefährdet wird."
    },
    {
      "date": "2025-05-13",
      "id": "108795",
      "original_text": "Registerbekanntmachung nach dem Umwandlungsgesetz\nBayern Amtsgericht Schweinfurt HRB 8067\nHydroelektra Turbinen UG (haftungsbeschränkt) – Kolitzheim",
      "type": "Registerbekanntmachung nach dem Umwandlungsgesetz",
      "state": "Bayern",
      "amtsgericht": "Amtsgericht Schweinfurt",
      "registernummer": "HRB 8067",
      "registerart": "HRB",
      "company_name": "Hydroelektra Turbinen UG (haftungsbeschränkt)",
      "company_seat": "Kolitzheim",
      "details": "13.05.2025 (Bekanntmachungsdatum)\n\nBayern Amtsgericht Schweinfurt HRB 8067\nRegisterbekanntmachung nach dem Umwandlungsgesetz 12.05.2025 (Eintragungsdatum)\n\nHydroelektra Turbinen UG (haftungsbeschränkt)\nGesellschaft mit beschränkter Haftung\nKolitzheim\n\nDen Gläubigern der an der Spaltung beteiligten Rechtsträger ist, wenn sie binnen sechs Monaten nach dem Tag, an dem die Eintragung der Spaltung in das Register des Sitzes desjenigen Rechtsträgers, dessen Gläubiger sie sind, nach §§ 125, 19 Abs. 3 UmwG als bekannt gemacht gilt, ihren Anspruch nach Grund und Höhe in Textform anmelden, Sicherheit zu leisten, soweit sie nicht Befriedigung verlangen können. Dieses Recht steht den Gläubigern jedoch nur zu, wenn sie glaubhaft machen, dass durch die Spaltung die Erfüllung ihrer Forderung gefährdet wird."
    },
    {
      "date": "2025-05-13",
      "id": "108796",
      "original_text": "Löschungsankündigung\nBayern Amtsgericht Ansbach HRB 6405\nManufacture de Silmony et Blee Naturals UG (haftungsbeschränkt) – Herrieden",
      "type": "Löschungsankündigung",
      "state": "Bayern",
      "amtsgericht": "Amtsgericht Ansbach",
      "registernummer": "HRB 6405",
      "registerart": "HRB",
      "company_name": "Manufacture de Silmony et Blee Naturals UG (haftungsbeschränkt)",
      "company_seat": "Herrieden",
      "details": "13.05.2025 (Bekanntmachungsdatum)\n\nBayern Amtsgericht Ansbach HRB 6405\nLöschungsankündigung\n\nManufacture de Silmony et Blee Naturals UG (haftungsbeschränkt)\nGesellschaft mit beschränkter Haftung\nHerrieden\n\nDas Registergericht beabsichtigt, die im Handelsregister eingetragene Gesellschaft wegen Vermögenslosigkeit von Amts wegen nach § 394 FamFG zu löschen. Die Frist zur Erhebung eines Widerspruchs ist auf sechs Wochen festgesetzt."
    },
    {
      "date": "2025-05-13",
      "id": "108797",
      "original_text": "Löschungsankündigung\nBayern Amtsgericht Nürnberg HRB 23138\nMP & Co International GmbH – Schwarzenbruck",
      "type": "Löschungsankündigung",
      "state": "Bayern",
      "amtsgericht": "Amtsgericht Nürnberg",
      "registernummer": "HRB 23138",
      "registerart": "HRB",
      "company_name": "MP & Co International GmbH",
      "company_seat": "Schwarzenbruck",
      "details": "13.05.2025 (Bekanntmachungsdatum)\n\nBayern Amtsgericht Nürnberg HRB 23138\nLöschungsankündigung\n\nMP & Co International GmbH\nGesellschaft mit beschränkter Haftung\nSchwarzenbruck\n\nDas Registergericht beabsichtigt, die im Handelsregister eingetragene Gesellschaft wegen Vermögenslosigkeit von Amts wegen nach § 394 FamFG zu löschen. Die Frist zur Erhebung eines Widerspruchs ist auf einen Monat festgesetzt."
    },
    {
      "date": "2025-05-13",
      "id": "108798",
      "original_text": "Registerbekanntmachung nach dem Umwandlungsgesetz\nBayern Amtsgericht München HRB 262547\nAmazon SZ South 4 GmbH – München",
      "type": "Registerbekanntmachung nach dem Umwandlungsgesetz",
      "state": "Bayern",
      "amtsgericht": "Amtsgericht München",
      "registernummer": "HRB 262547",
      "registerart": "HRB",
      "company_name": "Amazon SZ South 4 GmbH",
      "company_seat": "München",
      "details": "13.05.2025 (Bekanntmachungsdatum)\n\nBayern Amtsgericht München HRB 262547\nRegisterbekanntmachung nach dem Umwandlungsgesetz 12.05.2025 (Eintragungsdatum)\n\nAmazon SZ South 4 GmbH\nGesellschaft mit beschränkter Haftung\nMünchen\n\nDen Gläubigern der an der Verschmelzung beteiligten Rechtsträger ist, wenn sie binnen sechs Monaten nach dem Tag, an dem die Eintragung der Verschmelzung in das Register des Sitzes desjenigen Rechtsträgers, dessen Gläubiger sie sind, nach § 19 Abs. 3 UmwG als bekannt gemacht gilt, ihren Anspruch nach Grund und Höhe in Textform anmelden, Sicherheit zu leisten, soweit sie nicht Befriedigung verlangen können. Dieses Recht steht den Gläubigern jedoch nur zu, wenn sie glaubhaft machen, dass durch die Verschmelzung die Erfüllung ihrer Forderung gefährdet wird."
    },
    {
      "date": "2025-05-13",
      "id": "108799",
      "original_text": "Einreichung neuer Dokumente\nBayern Amtsgericht München HRB 82381\nBMW Bank GmbH – München",
      "type": "Einreichung neuer Dokumente",
      "state": "Bayern",
      "amtsgericht": "Amtsgericht München",
      "registernummer": "HRB 82381",
      "registerart": "HRB",
      "company_name": "BMW Bank GmbH",
      "company_seat": "München",
      "details": "13.05.2025 (Bekanntmachungsdatum)\n\nBayern Amtsgericht München HRB 82381\nEinreichung neuer Dokumente 12.05.2025 (Eintragungsdatum)\n\nBMW Bank GmbH\nGesellschaft mit beschränkter Haftung\nMünchen\n\nDem Amtsgericht München -Registergericht- ist eine Liste der Mitglieder des Aufsichtsrats eingereicht worden, § 52 Abs. 3 S. 2 GmbHG."
    },
    {
      "date": "2025-05-13",
      "id": "108800",
      "original_text": "Registerbekanntmachung nach dem Umwandlungsgesetz\nBayern Amtsgericht Traunstein HRB 24107\nJung Garten & Freizeit Vertriebsgesellschaft mbH – Freilassing",
      "type": "Registerbekanntmachung nach dem Umwandlungsgesetz",
      "state": "Bayern",
      "amtsgericht": "Amtsgericht Traunstein",
      "registernummer": "HRB 24107",
      "registerart": "HRB",
      "company_name": "Jung Garten & Freizeit Vertriebsgesellschaft mbH",
      "company_seat": "Freilassing",
      "details": "13.05.2025 (Bekanntmachungsdatum)\n\nBayern Amtsgericht Traunstein HRB 24107\nRegisterbekanntmachung nach dem Umwandlungsgesetz 12.05.2025 (Eintragungsdatum)\n\nJung Garten & Freizeit Vertriebsgesellschaft mbH\nGesellschaft mit beschränkter Haftung\nFreilassing\n\nDen Gläubigern der an der Verschmelzung beteiligten Rechtsträger ist, wenn sie binnen sechs Monaten nach dem Tag, an dem die Eintragung der Verschmelzung in das Register des Sitzes desjenigen Rechtsträgers, dessen Gläubiger sie sind, nach § 19 Abs. 3 UmwG als bekannt gemacht gilt, ihren Anspruch nach Grund und Höhe in Textform anmelden, Sicherheit zu leisten, soweit sie nicht Befriedigung verlangen können. Dieses Recht steht den Gläubigern jedoch nur zu, wenn sie glaubhaft machen, dass durch die Verschmelzung die Erfüllung ihrer Forderung gefährdet wird."
    },
    {
      "date": "2025-05-13",
      "id": "108801",
      "original_text": "Registerbekanntmachung nach dem Umwandlungsgesetz\nBayern Amtsgericht Traunstein HRB 4573\nWindhager GmbH – Freilassing",
      "type": "Registerbekanntmachung nach dem Umwandlungsgesetz",
      "state": "Bayern",
      "amtsgericht": "Amtsgericht Traunstein",
      "registernummer": "HRB 4573",
      "registerart": "HRB",
      "company_name": "Windhager GmbH",
      "company_seat": "Freilassing",
      "details": "13.05.2025 (Bekanntmachungsdatum)\n\nBayern Amtsgericht Traunstein HRB 4573\nRegisterbekanntmachung nach dem Umwandlungsgesetz 12.05.2025 (Eintragungsdatum)\n\nWindhager GmbH\nGesellschaft mit beschränkter Haftung\nFreilassing\n\nDen Gläubigern der an der Verschmelzung beteiligten Rechtsträger ist, wenn sie binnen sechs Monaten nach dem Tag, an dem die Eintragung der Verschmelzung in das Register des Sitzes desjenigen Rechtsträgers, dessen Gläubiger sie sind, nach § 19 Abs. 3 UmwG als bekannt gemacht gilt, ihren Anspruch nach Grund und Höhe in Textform anmelden, Sicherheit zu leisten, soweit sie nicht Befriedigung verlangen können. Dieses Recht steht den Gläubigern jedoch nur zu, wenn sie glaubhaft machen, dass durch die Verschmelzung die Erfüllung ihrer Forderung gefährdet wird."
    },
    {
      "date": "2025-05-13",
      "id": "108802",
      "original_text": "Registerbekanntmachung nach dem Umwandlungsgesetz\nBayern Amtsgericht München HRB 302279\nDr. Englhardt + Golling Architektur GmbH – München",
      "type": "Registerbekanntmachung nach dem Umwandlungsgesetz",
      "state": "Bayern",
      "amtsgericht": "Amtsgericht München",
      "registernummer": "HRB 302279",
      "registerart": "HRB",
      "company_name": "Dr. Englhardt + Golling Architektur GmbH",
      "company_seat": "München",
      "details": "13.05.2025 (Bekanntmachungsdatum)\n\nBayern Amtsgericht München HRB 302279\nRegisterbekanntmachung nach dem Umwandlungsgesetz 12.05.2025 (Eintragungsdatum)\n\nDr. Englhardt + Golling Architektur GmbH\nGesellschaft mit beschränkter Haftung\nMünchen\n\nDen Gläubigern des formwechselnden Rechtsträgers ist, wenn sie binnen sechs Monaten nach dem Tag, an dem die Eintragung des Formwechsels nach § 201 UmwG als bekannt gemacht gilt, ihren Anspruch nach Grund und Höhe in Textform anmelden, Sicherheit zu leisten, soweit sie nicht Befriedigung verlangen können. Dieses Recht steht den Gläubigern jedoch nur zu, wenn sie glaubhaft machen, dass durch den Formwechsel die Erfüllung ihrer Forderung gefährdet wird."
    },
    {
      "date": "2025-05-13",
      "id": "108803",
      "original_text": "Registerbekanntmachung nach dem Umwandlungsgesetz\nBayern Amtsgericht München HRB 238726\nCohesity Germany GmbH – München",
      "type": "Registerbekanntmachung nach dem Umwandlungsgesetz",
      "state": "Bayern",
      "amtsgericht": "Amtsgericht München",
      "registernummer": "HRB 238726",
      "registerart": "HRB",
      "company_name": "Cohesity Germany GmbH",
      "company_seat": "München",
      "details": "13.05.2025 (Bekanntmachungsdatum)\n\nBayern Amtsgericht München HRB 238726\nRegisterbekanntmachung nach dem Umwandlungsgesetz 12.05.2025 (Eintragungsdatum)\n\nCohesity Germany GmbH\nGesellschaft mit beschränkter Haftung\nMünchen\n\nDen Gläubigern der an der Verschmelzung beteiligten Rechtsträger ist, wenn sie binnen sechs Monaten nach dem Tag, an dem die Eintragung der Verschmelzung in das Register des Sitzes desjenigen Rechtsträgers, dessen Gläubiger sie sind, nach § 19 Abs. 3 UmwG als bekannt gemacht gilt, ihren Anspruch nach Grund und Höhe in Textform anmelden, Sicherheit zu leisten, soweit sie nicht Befriedigung verlangen können. Dieses Recht steht den Gläubigern jedoch nur zu, wenn sie glaubhaft machen, dass durch die Verschmelzung die Erfüllung ihrer Forderung gefährdet wird."
    },
    {
      "date": "2025-05-13",
      "id": "108804",
      "original_text": "Registerbekanntmachung nach dem Umwandlungsgesetz\nBayern Amtsgericht München HRB 243830\nMediaMarktSaturn Markenlizenz GmbH – Grünwald",
      "type": "Registerbekanntmachung nach dem Umwandlungsgesetz",
      "state": "Bayern",
      "amtsgericht": "Amtsgericht München",
      "registernummer": "HRB 243830",
      "registerart": "HRB",
      "company_name": "MediaMarktSaturn Markenlizenz GmbH",
      "company_seat": "Grünwald",
      "details": "13.05.2025 (Bekanntmachungsdatum)\n\nBayern Amtsgericht München HRB 243830\nRegisterbekanntmachung nach dem Umwandlungsgesetz 12.05.2025 (Eintragungsdatum)\n\nMediaMarktSaturn Markenlizenz GmbH\nGesellschaft mit beschränkter Haftung\nGrünwald\n\nDen Gläubigern der an der Verschmelzung beteiligten Rechtsträger ist, wenn sie binnen sechs Monaten nach dem Tag, an dem die Eintragung der Verschmelzung in das Register des Sitzes desjenigen Rechtsträgers, dessen Gläubiger sie sind, nach § 19 Abs. 3 UmwG als bekannt gemacht gilt, ihren Anspruch nach Grund und Höhe in Textform anmelden, Sicherheit zu leisten, soweit sie nicht Befriedigung verlangen können. Dieses Recht steht den Gläubigern jedoch nur zu, wenn sie glaubhaft machen, dass durch die Verschmelzung die Erfüllung ihrer Forderung gefährdet wird."
    },
    {
      "date": "2025-05-13",
      "id": "108805",
      "original_text": "Löschungsankündigung\nBayern Amtsgericht München HRB 235619\nHausmeister- und Handwerkerservice Isartal GmbH – Pullach i.Isartal",
      "type": "Löschungsankündigung",
      "state": "Bayern",
      "amtsgericht": "Amtsgericht München",
      "registernummer": "HRB 235619",
      "registerart": "HRB",
      "company_name": "Hausmeister- und Handwerkerservice Isartal GmbH",
      "company_seat": "Pullach i.Isartal",
      "details": "13.05.2025 (Bekanntmachungsdatum)\n\nBayern Amtsgericht München HRB 235619\nLöschungsankündigung 12.05.2025 (Eintragungsdatum)\n\nHausmeister- und Handwerkerservice Isartal GmbH\nGesellschaft mit beschränkter Haftung\nPullach i.Isartal\n\nDas Registergericht beabsichtigt, die im Handelsregister eingetragene Gesellschaft wegen Vermögenslosigkeit von Amts wegen nach § 394 FamFG zu löschen. Die Frist zur Erhebung eines Widerspruchs ist auf drei Monate festgesetzt."
    },
    {
      "date": "2025-05-13",
      "id": "108806",
      "original_text": "Registerbekanntmachung nach dem Umwandlungsgesetz\nBayern Amtsgericht Traunstein HRA 14829\nRoza Ilieva e.K. – Rosenheim",
      "type": "Registerbekanntmachung nach dem Umwandlungsgesetz",
      "state": "Bayern",
      "amtsgericht": "Amtsgericht Traunstein",
      "registernummer": "HRA 14829",
      "registerart": "HRA",
      "company_name": "Roza Ilieva e.K.",
      "company_seat": "Rosenheim",
      "details": "13.05.2025 (Bekanntmachungsdatum)\n\nBayern Amtsgericht Traunstein HRA 14829\nRegisterbekanntmachung nach dem Umwandlungsgesetz\n\nRoza Ilieva e.K.\nEinzelkaufmann / Einzelkauffrau\nRosenheim\n\nDen Gläubigern der an der Ausgliederung beteiligten Rechtsträger ist, wenn sie binnen sechs Monaten nach dem Tag, an dem die Eintragung der Ausgliederung in das Register des Sitzes desjenigen Rechtsträgers, dessen Gläubiger sie sind, nach §§ 125, 19 Abs. 3 UmwG als bekannt gemacht gilt, ihren Anspruch nach Grund und Höhe in Textform anmelden, Sicherheit zu leisten, soweit sie nicht Befriedigung verlangen können. Dieses Recht steht den Gläubigern jedoch nur zu, wenn sie glaubhaft machen, dass durch die Ausgliederung die Erfüllung ihrer Forderung gefährdet wird."
    },
    {
      "date": "2025-05-13",
      "id": "108807",
      "original_text": "Löschungsankündigung\nBayern Amtsgericht München HRB 219553\nTVPro UG (haftungsbeschränkt) – München",
      "type": "Löschungsankündigung",
      "state": "Bayern",
      "amtsgericht": "Amtsgericht München",
      "registernummer": "HRB 219553",
      "registerart": "HRB",
      "company_name": "TVPro UG (haftungsbeschränkt)",
      "company_seat": "München",
      "details": "13.05.2025 (Bekanntmachungsdatum)\n\nBayern Amtsgericht München HRB 219553\nLöschungsankündigung 12.05.2025 (Eintragungsdatum)\n\nTVPro UG (haftungsbeschränkt)\nGesellschaft mit beschränkter Haftung\nMünchen\n\nDas Registergericht beabsichtigt, die im Handelsregister eingetragene Gesellschaft wegen Vermögenslosigkeit von Amts wegen nach § 394 FamFG zu löschen. Die Frist zur Erhebung eines Widerspruchs ist auf drei Monate festgesetzt."
    },
    {
      "date": "2025-05-13",
      "id": "108808",
      "original_text": "Registerbekanntmachung nach dem Umwandlungsgesetz\nBayern Amtsgericht Augsburg HRA 12935\nWasserprinz e.K. – Augsburg",
      "type": "Registerbekanntmachung nach dem Umwandlungsgesetz",
      "state": "Bayern",
      "amtsgericht": "Amtsgericht Augsburg",
      "registernummer": "HRA 12935",
      "registerart": "HRA",
      "company_name": "Wasserprinz e.K.",
      "company_seat": "Augsburg",
      "details": "13.05.2025 (Bekanntmachungsdatum)\n\nBayern Amtsgericht Augsburg HRA 12935\nRegisterbekanntmachung nach dem Umwandlungsgesetz 12.05.2025 (Eintragungsdatum)\n\nWasserprinz e.K.\nEinzelkaufmann / Einzelkauffrau\nAugsburg\n\nDen Gläubigern der an der Ausgliederung beteiligten Rechtsträger ist, wenn sie binnen sechs Monaten nach dem Tag, an dem die Eintragung der Ausgliederung in das Register des Sitzes desjenigen Rechtsträgers, dessen Gläubiger sie sind, nach §§ 125, 19 Abs. 3 UmwG als bekannt gemacht gilt, ihren Anspruch nach Grund und Höhe in Textform anmelden, Sicherheit zu leisten, soweit sie nicht Befriedigung verlangen können. Dieses Recht steht den Gläubigern jedoch nur zu, wenn sie glaubhaft machen, dass durch die Ausgliederung die Erfüllung ihrer Forderung gefährdet wird."
    },
    {
      "date": "2025-05-13",
      "id": "108809",
      "original_text": "Einreichung neuer Dokumente\nBayern Amtsgericht München HRB 292066\nAgile Robots SE – München",
      "type": "Einreichung neuer Dokumente",
      "state": "Bayern",
      "amtsgericht": "Amtsgericht München",
      "registernummer": "HRB 292066",
      "registerart": "HRB",
      "company_name": "Agile Robots SE",
      "company_seat": "München",
      "details": "13.05.2025 (Bekanntmachungsdatum)\n\nBayern Amtsgericht München HRB 292066\nEinreichung neuer Dokumente\n\nAgile Robots SE\nEuropäische Aktiengesellschaft (SE)\nMünchen\n\nDem Amtsgericht München -Registergericht- ist eine Liste der Mitglieder des Aufsichtsrats eingereicht worden, Art. 9 Abs. 1 Buchst. c (ii) SE-VO i.V.m. § 106 AktG."
    },
    {
      "date": "2025-05-13",
      "id": "108810",
      "original_text": "Löschungsankündigung\nBayern Amtsgericht München HRB 238168\nDr. Chibisov Software Quality GmbH – München",
      "type": "Löschungsankündigung",
      "state": "Bayern",
      "amtsgericht": "Amtsgericht München",
      "registernummer": "HRB 238168",
      "registerart": "HRB",
      "company_name": "Dr. Chibisov Software Quality GmbH",
      "company_seat": "München",
      "details": "13.05.2025 (Bekanntmachungsdatum)\n\nBayern Amtsgericht München HRB 238168\nLöschungsankündigung 12.05.2025 (Eintragungsdatum)\n\nDr. Chibisov Software Quality GmbH\nGesellschaft mit beschränkter Haftung\nMünchen\n\nDas Registergericht beabsichtigt, die im Handelsregister eingetragene Gesellschaft wegen Vermögenslosigkeit von Amts wegen nach § 394 FamFG zu löschen. Die Frist zur Erhebung eines Widerspruchs ist auf drei Monate festgesetzt."
    },
    {
      "date": "2025-05-13",
      "id": "108811",
      "original_text": "Löschungsankündigung\nBayern Amtsgericht Landshut HRB 10688\nKLR - Kies Logistik & Recycling GmbH – Reisbach",
      "type": "Löschungsankündigung",
      "state": "Bayern",
      "amtsgericht": "Amtsgericht Landshut",
      "registernummer": "HRB 10688",
      "registerart": "HRB",
      "company_name": "KLR - Kies Logistik & Recycling GmbH",
      "company_seat": "Reisbach",
      "details": "13.05.2025 (Bekanntmachungsdatum)\n\nBayern Amtsgericht Landshut HRB 10688\nLöschungsankündigung\n\nKLR - Kies Logistik & Recycling GmbH\nGesellschaft mit beschränkter Haftung\nReisbach\n\nDas Registergericht beabsichtigt, die im Handelsregister eingetragene Gesellschaft wegen Vermögenslosigkeit von Amts wegen nach § 394 FamFG zu löschen. Die Frist zur Erhebung eines Widerspruchs ist auf einen Monat festgesetzt."
    },
    {
      "date": "2025-05-13",
      "id": "108812",
      "original_text": "Registerbekanntmachung nach dem Umwandlungsgesetz\nBayern Amtsgericht München HRB 286905\nSaHa Holding GmbH – Schäftlarn",
      "type": "Registerbekanntmachung nach dem Umwandlungsgesetz",
      "state": "Bayern",
      "amtsgericht": "Amtsgericht München",
      "registernummer": "HRB 286905",
      "registerart": "HRB",
      "company_name": "SaHa Holding GmbH",
      "company_seat": "Schäftlarn",
      "details": "13.05.2025 (Bekanntmachungsdatum)\n\nBayern Amtsgericht München HRB 286905\nRegisterbekanntmachung nach dem Umwandlungsgesetz 12.05.2025 (Eintragungsdatum)\n\nSaHa Holding GmbH\nGesellschaft mit beschränkter Haftung\nSchäftlarn\n\nDen Gläubigern der an der Verschmelzung beteiligten Rechtsträger ist, wenn sie binnen sechs Monaten nach dem Tag, an dem die Eintragung der Verschmelzung in das Register des Sitzes desjenigen Rechtsträgers, dessen Gläubiger sie sind, nach § 19 Abs. 3 UmwG als bekannt gemacht gilt, ihren Anspruch nach Grund und Höhe in Textform anmelden, Sicherheit zu leisten, soweit sie nicht Befriedigung verlangen können. Dieses Recht steht den Gläubigern jedoch nur zu, wenn sie glaubhaft machen, dass durch die Verschmelzung die Erfüllung ihrer Forderung gefährdet wird."
    },
    {
      "date": "2025-05-13",
      "id": "108813",
      "original_text": "Registerbekanntmachung nach dem Umwandlungsgesetz\nBayern Amtsgericht Aschaffenburg HRA 6656\nHorst Welzbach e.K. – Großostheim",
      "type": "Registerbekanntmachung nach dem Umwandlungsgesetz",
      "state": "Bayern",
      "amtsgericht": "Amtsgericht Aschaffenburg",
      "registernummer": "HRA 6656",
      "registerart": "HRA",
      "company_name": "Horst Welzbach e.K.",
      "company_seat": "Großostheim",
      "details": "13.05.2025 (Bekanntmachungsdatum)\n\nBayern Amtsgericht Aschaffenburg HRA 6656\nRegisterbekanntmachung nach dem Umwandlungsgesetz 12.05.2025 (Eintragungsdatum)\n\nHorst Welzbach e.K.\nEinzelkaufmann / Einzelkauffrau\nGroßostheim\n\nDen Gläubigern der an der Ausgliederung beteiligten Rechtsträger ist, wenn sie binnen sechs Monaten nach dem Tag, an dem die Eintragung der Ausgliederung in das Register des Sitzes desjenigen Rechtsträgers, dessen Gläubiger sie sind, nach §§ 125, 19 Abs. 3 UmwG als bekannt gemacht gilt, ihren Anspruch nach Grund und Höhe in Textform anmelden, Sicherheit zu leisten, soweit sie nicht Befriedigung verlangen können. Dieses Recht steht den Gläubigern jedoch nur zu, wenn sie glaubhaft machen, dass durch die Ausgliederung die Erfüllung ihrer Forderung gefährdet wird."
    },
    {
      "date": "2025-05-13",
      "id": "108814",
      "original_text": "Einreichung neuer Dokumente\nBayern Amtsgericht München HRB 135082\nTNG Technology Consulting GmbH – Unterföhring",
      "type": "Einreichung neuer Dokumente",
      "state": "Bayern",
      "amtsgericht": "Amtsgericht München",
      "registernummer": "HRB 135082",
      "registerart": "HRB",
      "company_name": "TNG Technology Consulting GmbH",
      "company_seat": "Unterföhring",
      "details": "13.05.2025 (Bekanntmachungsdatum)\n\nBayern Amtsgericht München HRB 135082\nEinreichung neuer Dokumente\n\nTNG Technology Consulting GmbH\nGesellschaft mit beschränkter Haftung\nUnterföhring\n\nDem Amtsgericht München -Registergericht- ist eine Liste der Mitglieder des Aufsichtsrats eingereicht worden, § 52 Abs. 3 S. 2 GmbHG."
    },
    {
      "date": "2025-05-13",
      "id": "108815",
      "original_text": "Registerbekanntmachung nach dem Umwandlungsgesetz\nBayern Amtsgericht Schweinfurt HRB 8062\nAP Lauter Wasserkraft GmbH – Kolitzheim",
      "type": "Registerbekanntmachung nach dem Umwandlungsgesetz",
      "state": "Bayern",
      "amtsgericht": "Amtsgericht Schweinfurt",
      "registernummer": "HRB 8062",
      "registerart": "HRB",
      "company_name": "AP Lauter Wasserkraft GmbH",
      "company_seat": "Kolitzheim",
      "details": "13.05.2025 (Bekanntmachungsdatum)\n\nBayern Amtsgericht Schweinfurt HRB 8062\nRegisterbekanntmachung nach dem Umwandlungsgesetz 12.05.2025 (Eintragungsdatum)\n\nAP Lauter Wasserkraft GmbH\nGesellschaft mit beschränkter Haftung\nKolitzheim\n\nDen Gläubigern der an der Spaltung beteiligten Rechtsträger ist, wenn sie binnen sechs Monaten nach dem Tag, an dem die Eintragung der Spaltung in das Register des Sitzes desjenigen Rechtsträgers, dessen Gläubiger sie sind, nach §§ 125, 19 Abs. 3 UmwG als bekannt gemacht gilt, ihren Anspruch nach Grund und Höhe in Textform anmelden, Sicherheit zu leisten, soweit sie nicht Befriedigung verlangen können. Dieses Recht steht den Gläubigern jedoch nur zu, wenn sie glaubhaft machen, dass durch die Spaltung die Erfüllung ihrer Forderung gefährdet wird."
    },
    {
      "date": "2025-05-13",
      "id": "108816",
      "original_text": "Registerbekanntmachung nach dem Umwandlungsgesetz\nBayern Amtsgericht Aschaffenburg HRA 6667\nSchlosserei Welzbach GmbH & Co. KG – Großostheim",
      "type": "Registerbekanntmachung nach dem Umwandlungsgesetz",
      "state": "Bayern",
      "amtsgericht": "Amtsgericht Aschaffenburg",
      "registernummer": "HRA 6667",
      "registerart": "HRA",
      "company_name": "Schlosserei Welzbach GmbH & Co. KG",
      "company_seat": "Großostheim",
      "details": "13.05.2025 (Bekanntmachungsdatum)\n\nBayern Amtsgericht Aschaffenburg HRA 6667\nRegisterbekanntmachung nach dem Umwandlungsgesetz 12.05.2025 (Eintragungsdatum)\n\nSchlosserei Welzbach GmbH & Co. KG\nKommanditgesellschaft\nGroßostheim\n\nDen Gläubigern der an der Ausgliederung beteiligten Rechtsträger ist, wenn sie binnen sechs Monaten nach dem Tag, an dem die Eintragung der Ausgliederung in das Register des Sitzes desjenigen Rechtsträgers, dessen Gläubiger sie sind, nach §§ 125, 19 Abs. 3 UmwG als bekannt gemacht gilt, ihren Anspruch nach Grund und Höhe in Textform anmelden, Sicherheit zu leisten, soweit sie nicht Befriedigung verlangen können. Dieses Recht steht den Gläubigern jedoch nur zu, wenn sie glaubhaft machen, dass durch die Ausgliederung die Erfüllung ihrer Forderung gefährdet wird."
    },
    {
      "date": "2025-05-13",
      "id": "108817",
      "original_text": "Registerbekanntmachung nach dem Umwandlungsgesetz\nBayern Amtsgericht Traunstein HRA 14901\nGebäudereinigung Ilieva - Clean for you UG (haftungsbeschränkt) & Co. KG – Rosenheim",
      "type": "Registerbekanntmachung nach dem Umwandlungsgesetz",
      "state": "Bayern",
      "amtsgericht": "Amtsgericht Traunstein",
      "registernummer": "HRA 14901",
      "registerart": "HRA",
      "company_name": "Gebäudereinigung Ilieva - Clean for you UG (haftungsbeschränkt) & Co. KG",
      "company_seat": "Rosenheim",
      "details": "13.05.2025 (Bekanntmachungsdatum)\n\nBayern Amtsgericht Traunstein HRA 14901\nRegisterbekanntmachung nach dem Umwandlungsgesetz 12.05.2025 (Eintragungsdatum)\n\nGebäudereinigung Ilieva - Clean for you UG (haftungsbeschränkt) & Co. KG\nKommanditgesellschaft\nRosenheim\n\nDen Gläubigern der an der Ausgliederung beteiligten Rechtsträger ist, wenn sie binnen sechs Monaten nach dem Tag, an dem die Eintragung der Ausgliederung in das Register des Sitzes desjenigen Rechtsträgers, dessen Gläubiger sie sind, nach §§ 125, 19 Abs. 3 UmwG als bekannt gemacht gilt, ihren Anspruch nach Grund und Höhe in Textform anmelden, Sicherheit zu leisten, soweit sie nicht Befriedigung verlangen können. Dieses Recht steht den Gläubigern jedoch nur zu, wenn sie glaubhaft machen, dass durch die Ausgliederung die Erfüllung ihrer Forderung gefährdet wird."
    },
    {
      "date": "2025-05-13",
      "id": "108818",
      "original_text": "Löschungsankündigung\nBayern Amtsgericht München HRB 99615\nTM Immobilien GmbH – München",
      "type": "Löschungsankündigung",
      "state": "Bayern",
      "amtsgericht": "Amtsgericht München",
      "registernummer": "HRB 99615",
      "registerart": "HRB",
      "company_name": "TM Immobilien GmbH",
      "company_seat": "München",
      "details": "13.05.2025 (Bekanntmachungsdatum)\n\nBayern Amtsgericht München HRB 99615\nLöschungsankündigung 12.05.2025 (Eintragungsdatum)\n\nTM Immobilien GmbH\nGesellschaft mit beschränkter Haftung\nMünchen\n\nDas Registergericht beabsichtigt, die im Handelsregister eingetragene Gesellschaft wegen Vermögenslosigkeit von Amts wegen nach § 394 FamFG zu löschen. Die Frist zur Erhebung eines Widerspruchs ist auf drei Monate festgesetzt."
    },
    {
      "date": "2025-05-13",
      "id": "108819",
      "original_text": "Registerbekanntmachung nach dem Umwandlungsgesetz\nBayern Amtsgericht Würzburg HRB 11121\nMAPUG Verwaltungs-UG (haftungsbeschränkt) – Lohr am Main",
      "type": "Registerbekanntmachung nach dem Umwandlungsgesetz",
      "state": "Bayern",
      "amtsgericht": "Amtsgericht Würzburg",
      "registernummer": "HRB 11121",
      "registerart": "HRB",
      "company_name": "MAPUG Verwaltungs-UG (haftungsbeschränkt)",
      "company_seat": "Lohr am Main",
      "details": "13.05.2025 (Bekanntmachungsdatum)\n\nBayern Amtsgericht Würzburg HRB 11121\nRegisterbekanntmachung nach dem Umwandlungsgesetz 12.05.2025 (Eintragungsdatum)\n\nMAPUG Verwaltungs-UG (haftungsbeschränkt)\nGesellschaft mit beschränkter Haftung\nLohr am Main\n\nDen Gläubigern der an der Verschmelzung beteiligten Rechtsträger ist, wenn sie binnen sechs Monaten nach dem Tag, an dem die Eintragung der Verschmelzung in das Register des Sitzes desjenigen Rechtsträgers, dessen Gläubiger sie sind, nach § 19 Abs. 3 UmwG als bekannt gemacht gilt, ihren Anspruch nach Grund und Höhe in Textform anmelden, Sicherheit zu leisten, soweit sie nicht Befriedigung verlangen können. Dieses Recht steht den Gläubigern jedoch nur zu, wenn sie glaubhaft machen, dass durch die Verschmelzung die Erfüllung ihrer Forderung gefährdet wird."
    },
    {
      "date": "2025-05-13",
      "id": "108820",
      "original_text": "Registerbekanntmachung nach dem Umwandlungsgesetz\nBayern Amtsgericht Nürnberg HRB 42692\nMETROPOL AUFZÜGE GmbH – Nürnberg",
      "type": "Registerbekanntmachung nach dem Umwandlungsgesetz",
      "state": "Bayern",
      "amtsgericht": "Amtsgericht Nürnberg",
      "registernummer": "HRB 42692",
      "registerart": "HRB",
      "company_name": "METROPOL AUFZÜGE GmbH",
      "company_seat": "Nürnberg",
      "details": "13.05.2025 (Bekanntmachungsdatum)\n\nBayern Amtsgericht Nürnberg HRB 42692\nRegisterbekanntmachung nach dem Umwandlungsgesetz 12.05.2025 (Eintragungsdatum)\n\nMETROPOL AUFZÜGE GmbH\nGesellschaft mit beschränkter Haftung\nNürnberg\n\nDen Gläubigern der an der Verschmelzung beteiligten Rechtsträger ist, wenn sie binnen sechs Monaten nach dem Tag, an dem die Eintragung der Verschmelzung in das Register des Sitzes desjenigen Rechtsträgers, dessen Gläubiger sie sind, nach § 19 Abs. 3 UmwG als bekannt gemacht gilt, ihren Anspruch nach Grund und Höhe in Textform anmelden, Sicherheit zu leisten, soweit sie nicht Befriedigung verlangen können. Dieses Recht steht den Gläubigern jedoch nur zu, wenn sie glaubhaft machen, dass durch die Verschmelzung die Erfüllung ihrer Forderung gefährdet wird."
    },
    {
      "date": "2025-05-13",
      "id": "108821",
      "original_text": "Löschungsankündigung\nBayern Amtsgericht München HRB 286154\nBitguana UG (haftungsbeschränkt) – Hohenbrunn",
      "type": "Löschungsankündigung",
      "state": "Bayern",
      "amtsgericht": "Amtsgericht München",
      "registernummer": "HRB 286154",
      "registerart": "HRB",
      "company_name": "Bitguana UG (haftungsbeschränkt)",
      "company_seat": "Hohenbrunn",
      "details": "13.05.2025 (Bekanntmachungsdatum)\n\nBayern Amtsgericht München HRB 286154\nLöschungsankündigung 12.05.2025 (Eintragungsdatum)\n\nBitguana UG (haftungsbeschränkt)\nGesellschaft mit beschränkter Haftung\nHohenbrunn\n\nDas Registergericht beabsichtigt, die im Handelsregister eingetragene Gesellschaft wegen Vermögenslosigkeit von Amts wegen nach § 394 FamFG zu löschen. Die Frist zur Erhebung eines Widerspruchs ist auf drei Monate festgesetzt."
    },
    {
      "date": "2025-05-13",
      "id": "108822",
      "original_text": "Einreichung neuer Dokumente\nBayern Amtsgericht Ingolstadt HRB 2907\nPSW automotive engineering GmbH – Gaimersheim",
      "type": "Einreichung neuer Dokumente",
      "state": "Bayern",
      "amtsgericht": "Amtsgericht Ingolstadt",
      "registernummer": "HRB 2907",
      "registerart": "HRB",
      "company_name": "PSW automotive engineering GmbH",
      "company_seat": "Gaimersheim",
      "details": "13.05.2025 (Bekanntmachungsdatum)\n\nBayern Amtsgericht Ingolstadt HRB 2907\nEinreichung neuer Dokumente\n\nPSW automotive engineering GmbH\nGesellschaft mit beschränkter Haftung\nGaimersheim\n\nDem Amtsgericht Ingolstadt -Registergericht- ist eine Liste der Mitglieder des Aufsichtsrats eingereicht worden, § 52 Abs. 3 S. 2 GmbHG."
    },
    {
      "date": "2025-05-13",
      "id": "108823",
      "original_text": "Löschungsankündigung\nBayern Amtsgericht München HRB 259448\nSPS Achtunddreißig Management GmbH – München",
      "type": "Löschungsankündigung",
      "state": "Bayern",
      "amtsgericht": "Amtsgericht München",
      "registernummer": "HRB 259448",
      "registerart": "HRB",
      "company_name": "SPS Achtunddreißig Management GmbH",
      "company_seat": "München",
      "details": "13.05.2025 (Bekanntmachungsdatum)\n\nBayern Amtsgericht München HRB 259448\nLöschungsankündigung 12.05.2025 (Eintragungsdatum)\n\nSPS Achtunddreißig Management GmbH\nGesellschaft mit beschränkter Haftung\nMünchen\n\nDas Registergericht beabsichtigt, die im Handelsregister eingetragene Gesellschaft wegen Vermögenslosigkeit von Amts wegen nach § 394 FamFG zu löschen. Die Frist zur Erhebung eines Widerspruchs ist auf drei Monate festgesetzt."
    },
    {
      "date": "2025-05-13",
      "id": "108824",
      "original_text": "Registerbekanntmachung nach dem Umwandlungsgesetz\nBayern Amtsgericht München HRB 6684\nSiemens Aktiengesellschaft – Berlin und München",
      "type": "Registerbekanntmachung nach dem Umwandlungsgesetz",
      "state": "Bayern",
      "amtsgericht": "Amtsgericht München",
      "registernummer": "HRB 6684",
      "registerart": "HRB",
      "company_name": "Siemens Aktiengesellschaft",
      "company_seat": "Berlin und München",
      "details": "13.05.2025 (Bekanntmachungsdatum)\n\nBayern Amtsgericht München HRB 6684\nRegisterbekanntmachung nach dem Umwandlungsgesetz 12.05.2025 (Eintragungsdatum)\n\nSiemens Aktiengesellschaft\nAktiengesellschaft\nBerlin und München\n\nDen Gläubigern der an der Verschmelzung beteiligten Rechtsträger ist, wenn sie binnen sechs Monaten nach dem Tag, an dem die Eintragung der Verschmelzung in das Register des Sitzes desjenigen Rechtsträgers, dessen Gläubiger sie sind, nach § 19 Abs. 3 UmwG als bekannt gemacht gilt, ihren Anspruch nach Grund und Höhe in Textform anmelden, Sicherheit zu leisten, soweit sie nicht Befriedigung verlangen können. Dieses Recht steht den Gläubigern jedoch nur zu, wenn sie glaubhaft machen, dass durch die Verschmelzung die Erfüllung ihrer Forderung gefährdet wird."
    },
    {
      "date": "2025-05-13",
      "id": "108825",
      "original_text": "Löschungsankündigung\nBerlin Amtsgericht Berlin (Charlottenburg) HRB 194438\nONE PLANET SUSTAINABLE BUILDINGS GmbH – Berlin",
      "type": "Löschungsankündigung",
      "state": "Berlin",
      "amtsgericht": "Amtsgericht Berlin (Charlottenburg)",
      "registernummer": "HRB 194438",
      "registerart": "HRB",
      "company_name": "ONE PLANET SUSTAINABLE BUILDINGS GmbH",
      "company_seat": "Berlin",
      "details": "13.05.2025 (Bekanntmachungsdatum)\n\nBerlin Amtsgericht Berlin (Charlottenburg) HRB 194438\nLöschungsankündigung\n\nONE PLANET SUSTAINABLE BUILDINGS GmbH\nGesellschaft mit beschränkter Haftung\nBerlin\n\nBei der nachstehenden Gesellschaft wird das Amtslöschungsverfahren gemäß § 394 FamFG eingeleitet. Widerspruchsfrist 6 Wochen"
    },
    {
      "date": "2025-05-13",
      "id": "108826",
      "original_text": "Löschungsankündigung\nBerlin Amtsgericht Berlin (Charlottenburg) HRB 200438\nBerSec Consulting und Sicherheit UG (haftungsbeschränkt) – Berlin",
      "type": "Löschungsankündigung",
      "state": "Berlin",
      "amtsgericht": "Amtsgericht Berlin (Charlottenburg)",
      "registernummer": "HRB 200438",
      "registerart": "HRB",
      "company_name": "BerSec Consulting und Sicherheit UG (haftungsbeschränkt)",
      "company_seat": "Berlin",
      "details": "13.05.2025 (Bekanntmachungsdatum)\n\nBerlin Amtsgericht Berlin (Charlottenburg) HRB 200438\nLöschungsankündigung\n\nBerSec Consulting und Sicherheit UG (haftungsbeschränkt)\nGesellschaft mit beschränkter Haftung\nBerlin\n\nBei der nachstehenden Gesellschaft wird das Amtslöschungsverfahren gemäß § 394 FamFG eingeleitet. Widerspruchsfrist 6 Wochen"
    },
    {
      "date": "2025-05-13",
      "id": "108827",
      "original_text": "Löschungsankündigung\nBerlin Amtsgericht Berlin (Charlottenburg) HRB 84268\nAwa Taxi GmbH – Berlin",
      "type": "Löschungsankündigung",
      "state": "Berlin",
      "amtsgericht": "Amtsgericht Berlin (Charlottenburg)",
      "registernummer": "HRB 84268",
      "registerart": "HRB",
      "company_name": "Awa Taxi GmbH",
      "company_seat": "Berlin",
      "details": "13.05.2025 (Bekanntmachungsdatum)\n\nBerlin Amtsgericht Berlin (Charlottenburg) HRB 84268\nLöschungsankündigung\n\nAwa Taxi GmbH\nGesellschaft mit beschränkter Haftung\nBerlin\n\nBei der nachstehenden Gesellschaft wird das Amtslöschungsverfahren gemäß § 394 FamFG eingeleitet. Widerspruchsfrist\n6 Wochen."
    },
    {
      "date": "2025-05-13",
      "id": "108828",
      "original_text": "Löschungsankündigung\nBerlin Amtsgericht Berlin (Charlottenburg) HRB 121546\nS.B.Y Immo GmbH – Berlin",
      "type": "Löschungsankündigung",
      "state": "Berlin",
      "amtsgericht": "Amtsgericht Berlin (Charlottenburg)",
      "registernummer": "HRB 121546",
      "registerart": "HRB",
      "company_name": "S.B.Y Immo GmbH",
      "company_seat": "Berlin",
      "details": "13.05.2025 (Bekanntmachungsdatum)\n\nBerlin Amtsgericht Berlin (Charlottenburg) HRB 121546\nLöschungsankündigung\n\nS.B.Y Immo GmbH\nGesellschaft mit beschränkter Haftung\nBerlin\n\nBei der nachstehenden Gesellschaft wird das Amtslöschungsverfahren gemäß § 394 FamFG eingeleitet. Widerspruchsfrist 6 Wochen"
    },
    {
      "date": "2025-05-13",
      "id": "108829",
      "original_text": "Löschungsankündigung\nSchleswig-Holstein Amtsgericht Flensburg HRB 10146\nE-Trading Flensburg GmbH – Harrislee",
      "type": "Löschungsankündigung",
      "state": "Schleswig-Holstein",
      "amtsgericht": "Amtsgericht Flensburg",
      "registernummer": "HRB 10146",
      "registerart": "HRB",
      "company_name": "E-Trading Flensburg GmbH",
      "company_seat": "Harrislee",
      "details": "13.05.2025 (Bekanntmachungsdatum)\n\nSchleswig-Holstein Amtsgericht Flensburg HRB 10146\nLöschungsankündigung\n\nE-Trading Flensburg GmbH\nGesellschaft mit beschränkter Haftung\nHarrislee\n\nEs ist die Löschung der nachstehenden Gesellschaft wegen Vermögenslosigkeit gemäß § 394 FamFG beabsichtigt.\n\nWiderspruchsfrist: 2 Monate."
    },
    {
      "date": "2025-05-13",
      "id": "108830",
      "original_text": "Registerbekanntmachung nach dem Umwandlungsgesetz\nNordrhein-Westfalen Amtsgericht Coesfeld HRB 19639\nMatthews Europe GmbH – Vreden",
      "type": "Registerbekanntmachung nach dem Umwandlungsgesetz",
      "state": "Nordrhein-Westfalen",
      "amtsgericht": "Amtsgericht Coesfeld",
      "registernummer": "HRB 19639",
      "registerart": "HRB",
      "company_name": "Matthews Europe GmbH",
      "company_seat": "Vreden",
      "details": "13.05.2025 (Bekanntmachungsdatum)\n\nNordrhein-Westfalen Amtsgericht Coesfeld HRB 19639\nRegisterbekanntmachung nach dem Umwandlungsgesetz 13.05.2025 (Eintragungsdatum)\n\nMatthews Europe GmbH\nGesellschaft mit beschränkter Haftung\nVreden\n\nDen Gläubigern der an der Abspaltung beteiligten Rechtsträger ist, wenn sie binnen sechs Monaten nach dem Tag, an dem die Eintragung der Abspaltung in das Register des Sitzes desjenigen Rechtsträgers, dessen Gläubiger sie sind, nach § 19 Absatz 3 UmwG als bekanntgemacht gilt, ihren Anspruch nach Grund und Höhe schriftlich anmelden, Sicherheit zu leisten, soweit sie nicht Befriedigung verlangen können. Dieses Recht steht den Gläubigern jedoch nur zu, wenn sie glaubhaft machen, dass durch die Abspaltung die Erfüllung ihrer Forderung gefährdet wird."
    },
    {
      "date": "2025-05-13",
      "id": "108831",
      "original_text": "Registerbekanntmachung nach dem Umwandlungsgesetz\nHamburg Amtsgericht Hamburg HRB 164685\nPallau Invest UG (haftungsbeschränkt) – Hamburg",
      "type": "Registerbekanntmachung nach dem Umwandlungsgesetz",
      "state": "Hamburg",
      "amtsgericht": "Amtsgericht Hamburg",
      "registernummer": "HRB 164685",
      "registerart": "HRB",
      "company_name": "Pallau Invest UG (haftungsbeschränkt)",
      "company_seat": "Hamburg",
      "details": "13.05.2025 (Bekanntmachungsdatum)\n\nHamburg Amtsgericht Hamburg HRB 164685\nRegisterbekanntmachung nach dem Umwandlungsgesetz 13.05.2025 (Eintragungsdatum)\n\nPallau Invest UG (haftungsbeschränkt)\nGesellschaft mit beschränkter Haftung\nHamburg\n\nAls nicht eingetragen wird bekannt gemacht:\nDen Gläubigern der an der Vermögensübertragung beteiligten Gesellschaften ist, wenn sie binnen sechs Monaten nach dem Tag, an dem die Eintragung der Vermögensübertragung in das Register des Sitzes desjenigen Rechtsträgers, dessen Gläubiger sie sind, nach § 19 Absatz 3 UmwG als bekannt gemacht gilt, ihren Anspruch nach Grund und Höhe schriftlich anmelden, Sicherheit zu leisten, soweit sie nicht Befriedigung verlangen können. Dieses Recht steht den Gläubigern jedoch nur zu, wenn sie glaubhaft machen, dass durch die Vermögensübertragung die Erfüllung ihrer Forderung gefährdet wird."
    },
    {
      "date": "2025-05-13",
      "id": "108832",
      "original_text": "Löschungsankündigung\nBaden-Württemberg Amtsgericht Mannheim HRA 704668\n\"sehen was kommt\" UG (haftungsbeschränkt) & Co. KG – Oftersheim",
      "type": "Löschungsankündigung",
      "state": "Baden-Württemberg",
      "amtsgericht": "Amtsgericht Mannheim",
      "registernummer": "HRA 704668",
      "registerart": "HRA",
      "company_name": "\"sehen was kommt\" UG (haftungsbeschränkt) & Co. KG",
      "company_seat": "Oftersheim",
      "details": "13.05.2025 (Bekanntmachungsdatum)\n\nBaden-Württemberg Amtsgericht Mannheim HRA 704668\nLöschungsankündigung\n\n\"sehen was kommt\" UG (haftungsbeschränkt) & Co. KG\nKommanditgesellschaft\nOftersheim\n\nAls nicht eingetragen wird bekanntgemacht:Das Gericht beabsichtigt, die Gesellschaft wegen Vermögenslosigkeit im Handelsregister von Amts wegen nach § 394 FamFG zu löschen. Die Frist zur Geltendmachung eines Widerspruchs gegen die beabsichtigte Löschung ist auf einen Monat ab Veröffentlichung bestimmt."
    },
    {
      "date": "2025-05-13",
      "id": "108833",
      "original_text": "Registerbekanntmachung nach dem Umwandlungsgesetz\nHamburg Amtsgericht Hamburg HRB 14989\nUniCredit Leasing GmbH – Hamburg",
      "type": "Registerbekanntmachung nach dem Umwandlungsgesetz",
      "state": "Hamburg",
      "amtsgericht": "Amtsgericht Hamburg",
      "registernummer": "HRB 14989",
      "registerart": "HRB",
      "company_name": "UniCredit Leasing GmbH",
      "company_seat": "Hamburg",
      "details": "13.05.2025 (Bekanntmachungsdatum)\n\nHamburg Amtsgericht Hamburg HRB 14989\nRegisterbekanntmachung nach dem Umwandlungsgesetz 13.05.2025 (Eintragungsdatum)\n\nUniCredit Leasing GmbH\nGesellschaft mit beschränkter Haftung\nHamburg\n\nAls nicht eingetragen wird bekannt gemacht:\nDen Gläubigern der an der Verschmelzung beteiligten Gesellschaften ist, wenn sie binnen sechs Monaten nach dem Tag, an dem die Eintragung der Verschmelzung in das Register des Sitzes desjenigen Rechtsträgers, dessen Gläubiger sie sind, nach § 19 Absatz 3 UmwG als bekannt gemacht gilt, ihren Anspruch nach Grund und Höhe schriftlich anmelden, Sicherheit zu leisten, soweit sie nicht Befriedigung verlangen können. Dieses Recht steht den Gläubigern jedoch nur zu, wenn sie glaubhaft machen, dass durch die Verschmelzung die Erfüllung ihrer Forderung gefährdet wird."
    },
    {
      "date": "2025-05-13",
      "id": "108834",
      "original_text": "Registerbekanntmachung nach dem Umwandlungsgesetz\nHamburg Amtsgericht Hamburg HRB 10451\nUniCredit Leasing Finance GmbH – Hamburg",
      "type": "Registerbekanntmachung nach dem Umwandlungsgesetz",
      "state": "Hamburg",
      "amtsgericht": "Amtsgericht Hamburg",
      "registernummer": "HRB 10451",
      "registerart": "HRB",
      "company_name": "UniCredit Leasing Finance GmbH",
      "company_seat": "Hamburg",
      "details": "13.05.2025 (Bekanntmachungsdatum)\n\nHamburg Amtsgericht Hamburg HRB 10451\nRegisterbekanntmachung nach dem Umwandlungsgesetz 13.05.2025 (Eintragungsdatum)\n\nUniCredit Leasing Finance GmbH\nGesellschaft mit beschränkter Haftung\nHamburg\n\nAls nicht eingetragen wird bekannt gemacht:\nDen Gläubigern der an der Verschmelzung beteiligten Gesellschaften ist, wenn sie binnen sechs Monaten nach dem Tag, an dem die Eintragung der Verschmelzung in das Register des Sitzes desjenigen Rechtsträgers, dessen Gläubiger sie sind, nach § 19 Absatz 3 UmwG als bekannt gemacht gilt, ihren Anspruch nach Grund und Höhe schriftlich anmelden, Sicherheit zu leisten, soweit sie nicht Befriedigung verlangen können. Dieses Recht steht den Gläubigern jedoch nur zu, wenn sie glaubhaft machen, dass durch die Verschmelzung die Erfüllung ihrer Forderung gefährdet wird."
    },
    {
      "date": "2025-05-13",
      "id": "108835",
      "original_text": "Registerbekanntmachung nach dem Umwandlungsgesetz\nMecklenburg-Vorpommern Amtsgericht Schwerin HRB 11746\nLUP-Rettungsdienst gGmbH (Ludwigslust-Parchimer Rettungsdienst gGmbH) – Parchim",
      "type": "Registerbekanntmachung nach dem Umwandlungsgesetz",
      "state": "Mecklenburg-Vorpommern",
      "amtsgericht": "Amtsgericht Schwerin",
      "registernummer": "HRB 11746",
      "registerart": "HRB",
      "company_name": "LUP-Rettungsdienst gGmbH (Ludwigslust-Parchimer Rettungsdienst gGmbH)",
      "company_seat": "Parchim",
      "details": "13.05.2025 (Bekanntmachungsdatum)\n\nMecklenburg-Vorpommern Amtsgericht Schwerin HRB 11746\nRegisterbekanntmachung nach dem Umwandlungsgesetz 13.05.2025 (Eintragungsdatum)\n\nLUP-Rettungsdienst gGmbH (Ludwigslust-Parchimer Rettungsdienst gGmbH)\nGesellschaft mit beschränkter Haftung\nParchim\n\nDen Gläubigern der an der Verschmelzung beteiligten Gesellschaften ist, wenn sie binnen sechs Monaten nach dem Tag, an dem die Eintragung der Verschmelzungen in das Register des Sitzes desjenigen Rechtsträgers, dessen Gläubiger sie sind, nach § 19 Absatz 3 UmwG als bekanntgemacht gilt, ihren Anspruch nach Grund und Höhe schriftlich anmelden, Sicherheit zu leisten, soweit sie nicht Befriedigung verlangen können. Dieses Recht steht den Gläubigern jedoch nur zu, wenn sie glaubhaft machen, dass durch die Verschmelzung die Erfüllung ihrer Forderung gefährdet wird."
    },
    {
      "date": "2025-05-13",
      "id": "108836",
      "original_text": "Registerbekanntmachung nach dem Umwandlungsgesetz\nMecklenburg-Vorpommern Amtsgericht Schwerin HRB 9391\nRettungsdienst Parchim Ludwigslust gGmbH – Parchim",
      "type": "Registerbekanntmachung nach dem Umwandlungsgesetz",
      "state": "Mecklenburg-Vorpommern",
      "amtsgericht": "Amtsgericht Schwerin",
      "registernummer": "HRB 9391",
      "registerart": "HRB",
      "company_name": "Rettungsdienst Parchim Ludwigslust gGmbH",
      "company_seat": "Parchim",
      "details": "13.05.2025 (Bekanntmachungsdatum)\n\nMecklenburg-Vorpommern Amtsgericht Schwerin HRB 9391\nRegisterbekanntmachung nach dem Umwandlungsgesetz 13.05.2025 (Eintragungsdatum)\n\nRettungsdienst Parchim Ludwigslust gGmbH\nGesellschaft mit beschränkter Haftung\nParchim\n\nDen Gläubigern der an der Verschmelzung beteiligten Gesellschaften ist, wenn sie binnen sechs Monaten nach dem Tag, an dem die Eintragung der Verschmelzungen in das Register des Sitzes desjenigen Rechtsträgers, dessen Gläubiger sie sind, nach § 19 Absatz 3 UmwG als bekanntgemacht gilt, ihren Anspruch nach Grund und Höhe schriftlich anmelden, Sicherheit zu leisten, soweit sie nicht Befriedigung verlangen können. Dieses Recht steht den Gläubigern jedoch nur zu, wenn sie glaubhaft machen, dass durch die Verschmelzung die Erfüllung ihrer Forderung gefährdet wird."
    },
    {
      "date": "2025-05-13",
      "id": "108837",
      "original_text": "Registerbekanntmachung nach dem Umwandlungsgesetz\nBaden-Württemberg Amtsgericht Stuttgart HRB 263284\nSüddeutsche Lebensversicherung a.G. – Fellbach",
      "type": "Registerbekanntmachung nach dem Umwandlungsgesetz",
      "state": "Baden-Württemberg",
      "amtsgericht": "Amtsgericht Stuttgart",
      "registernummer": "HRB 263284",
      "registerart": "HRB",
      "company_name": "Süddeutsche Lebensversicherung a.G.",
      "company_seat": "Fellbach",
      "details": "13.05.2025 (Bekanntmachungsdatum)\n\nBaden-Württemberg Amtsgericht Stuttgart HRB 263284\nRegisterbekanntmachung nach dem Umwandlungsgesetz\n\nSüddeutsche Lebensversicherung a.G.\nVersicherungsverein auf Gegenseitigkeit\nFellbach\n\nDie Gesellschaft hat am 12.05.2025 den Entwurf des Verschmelzungsvertrages zwischen \"Stuttgarter Lebensversicherung a.G.\", Stuttgart (Amtsgericht Stuttgart HRB 222) und der hiesigen Gesellschaft (übertragender Rechtsträger) zum Handelsregister eingereicht."
    },
    {
      "date": "2025-05-13",
      "id": "108838",
      "original_text": "Einreichung neuer Dokumente\nBaden-Württemberg Amtsgericht Stuttgart HRB 263284\nSüddeutsche Lebensversicherung a.G. – Fellbach",
      "type": "Einreichung neuer Dokumente",
      "state": "Baden-Württemberg",
      "amtsgericht": "Amtsgericht Stuttgart",
      "registernummer": "HRB 263284",
      "registerart": "HRB",
      "company_name": "Süddeutsche Lebensversicherung a.G.",
      "company_seat": "Fellbach",
      "details": "13.05.2025 (Bekanntmachungsdatum)\n\nBaden-Württemberg Amtsgericht Stuttgart HRB 263284\nEinreichung neuer Dokumente\n\nSüddeutsche Lebensversicherung a.G.\nVersicherungsverein auf Gegenseitigkeit\nFellbach\n\nDie Gesellschaft hat am 12.05.2025 den Entwurf des Verschmelzungsvertrages zwischen \"Stuttgarter Lebensversicherung a.G.\", Stuttgart (Amtsgericht Stuttgart HRB 222) und der hiesigen Gesellschaft (übertragender Rechtsträger) zum Handelsregister eingereicht."
    },
    {
      "date": "2025-05-13",
      "id": "108839",
      "original_text": "Löschungsankündigung\nSchleswig-Holstein Amtsgericht Lübeck HRB 22649\nCargo Connection Direct GmbH – Bargteheide",
      "type": "Löschungsankündigung",
      "state": "Schleswig-Holstein",
      "amtsgericht": "Amtsgericht Lübeck",
      "registernummer": "HRB 22649",
      "registerart": "HRB",
      "company_name": "Cargo Connection Direct GmbH",
      "company_seat": "Bargteheide",
      "details": "13.05.2025 (Bekanntmachungsdatum)\n\nSchleswig-Holstein Amtsgericht Lübeck HRB 22649\nLöschungsankündigung\n\nCargo Connection Direct GmbH\nGesellschaft mit beschränkter Haftung\nBargteheide\n\nEs ist die Löschung der nachstehenden Gesellschaft wegen Vermögenslosigkeit gemäß § 394 FamFG beabsichtigt. Widerspruchsfrist: 1 Monat"
    },
    {
      "date": "2025-05-13",
      "id": "108840",
      "original_text": "Löschungsankündigung\nBerlin Amtsgericht Berlin (Charlottenburg) HRB 194426\nCSA - Fahrdienst Unternehmergesellschaft (haftungsbeschränkt) – Berlin",
      "type": "Löschungsankündigung",
      "state": "Berlin",
      "amtsgericht": "Amtsgericht Berlin (Charlottenburg)",
      "registernummer": "HRB 194426",
      "registerart": "HRB",
      "company_name": "CSA - Fahrdienst Unternehmergesellschaft (haftungsbeschränkt)",
      "company_seat": "Berlin",
      "details": "13.05.2025 (Bekanntmachungsdatum)\n\nBerlin Amtsgericht Berlin (Charlottenburg) HRB 194426\nLöschungsankündigung\n\nCSA - Fahrdienst Unternehmergesellschaft (haftungsbeschränkt)\nGesellschaft mit beschränkter Haftung\nBerlin\n\nBei der nachstehenden Gesellschaft wird das Amtslöschungsverfahren gemäß § 394 FamFG eingeleitet. Widerspruchsfrist 6 Wochen"
    },
    {
      "date": "2025-05-13",
      "id": "108841",
      "original_text": "Registerbekanntmachung nach dem Umwandlungsgesetz\nBerlin Amtsgericht Berlin (Charlottenburg) HRB 12300\nSiemens Aktiengesellschaft – Berlin und München",
      "type": "Registerbekanntmachung nach dem Umwandlungsgesetz",
      "state": "Berlin",
      "amtsgericht": "Amtsgericht Berlin (Charlottenburg)",
      "registernummer": "HRB 12300",
      "registerart": "HRB",
      "company_name": "Siemens Aktiengesellschaft",
      "company_seat": "Berlin und München",
      "details": "13.05.2025 (Bekanntmachungsdatum)\n\nBerlin Amtsgericht Berlin (Charlottenburg) HRB 12300\nRegisterbekanntmachung nach dem Umwandlungsgesetz 12.05.2025 (Eintragungsdatum)\n\nSiemens Aktiengesellschaft\nAktiengesellschaft\nBerlin und München\n\nZu Eintragungsnummer 151 vom 12.05.2025 wird als nicht eingetragen veröffentlicht: Den Gläubigern der an der Verschmelzung beteiligten Rechtsträger ist, wenn sie binnen sechs Monaten nach dem Tag, an dem die Eintragung der Verschmelzung in das Register des Sitzes desjenigen Rechtsträgers, dessen Gläubiger sie sind, als bekannt gemacht gilt, ihren Anspruch nach Grund und Höhe schriftlich anmelden, Sicherheit zu leisten, soweit sie nicht Befriedigung verlangen können. Dieses Recht steht den Gläubigern jedoch nur zu, wenn sie glaubhaft machen, dass durch die Verschmelzung die Erfüllung ihrer Forderung gefährdet wird. Das Recht, Sicherheitsleistung zu verlangen, steht Gläubigern nicht zu, die im Falle der Insolvenz ein Recht auf vorzugsweise Befriedigung aus einer Deckungsmasse haben, die nach gesetzlicher Vorschrift zu ihrem Schutz errichtet und staatlich überwacht ist."
    },
    {
      "date": "2025-05-13",
      "id": "108842",
      "original_text": "Sonstige Registerbekanntmachung\nHamburg Amtsgericht Hamburg HRB 14104\nLeben mit Behinderung Hamburg Sozialeinrichtungen Gemeinnützige GmbH – Hamburg",
      "type": "Sonstige Registerbekanntmachung",
      "state": "Hamburg",
      "amtsgericht": "Amtsgericht Hamburg",
      "registernummer": "HRB 14104",
      "registerart": "HRB",
      "company_name": "Leben mit Behinderung Hamburg Sozialeinrichtungen Gemeinnützige GmbH",
      "company_seat": "Hamburg",
      "details": "13.05.2025 (Bekanntmachungsdatum)\n\nHamburg Amtsgericht Hamburg HRB 14104\nSonstige Registerbekanntmachung\n\nLeben mit Behinderung Hamburg Sozialeinrichtungen Gemeinnützige GmbH\nGesellschaft mit beschränkter Haftung\nHamburg\n\nAls nicht eingetragen wird bekannt gemacht: Liste des Aufsichtsrats wurde eingereicht."
    },
    {
      "date": "2025-05-13",
      "id": "108843",
      "original_text": "Löschungsankündigung\nBerlin Amtsgericht Berlin (Charlottenburg) HRB 226637\n3horizons GmbH – Berlin",
      "type": "Löschungsankündigung",
      "state": "Berlin",
      "amtsgericht": "Amtsgericht Berlin (Charlottenburg)",
      "registernummer": "HRB 226637",
      "registerart": "HRB",
      "company_name": "3horizons GmbH",
      "company_seat": "Berlin",
      "details": "13.05.2025 (Bekanntmachungsdatum)\n\nBerlin Amtsgericht Berlin (Charlottenburg) HRB 226637\nLöschungsankündigung\n\n3horizons GmbH\nGesellschaft mit beschränkter Haftung\nBerlin\n\nBei der nachstehenden Gesellschaft wird das Amtslöschungsverfahren gemäß § 394 FamFG eingeleitet. Widerspruchsfrist 6 Wochen"
    },
    {
      "date": "2025-05-13",
      "id": "108844",
      "original_text": "Registerbekanntmachung nach dem Umwandlungsgesetz\nBerlin Amtsgericht Berlin (Charlottenburg) HRB 140406\nTLC AG Tax – Berlin",
      "type": "Registerbekanntmachung nach dem Umwandlungsgesetz",
      "state": "Berlin",
      "amtsgericht": "Amtsgericht Berlin (Charlottenburg)",
      "registernummer": "HRB 140406",
      "registerart": "HRB",
      "company_name": "TLC AG Tax",
      "company_seat": "Berlin",
      "details": "13.05.2025 (Bekanntmachungsdatum)\n\nBerlin Amtsgericht Berlin (Charlottenburg) HRB 140406\nRegisterbekanntmachung nach dem Umwandlungsgesetz 01.05.2025 (Eintragungsdatum)\n\nTLC AG Tax\nAktiengesellschaft\nBerlin\n\nZu Eintragungsnummer 10 vom 01.05.2025 wird als nicht eingetragen veröffentlicht:\n\nDen Gläubigern ist, wenn sie binnen sechs Monaten nach dem Tag, an dem die Eintragung der Umwandlung als bekannt gemacht gilt, ihren Anspruch nach Grund und Höhe schriftlich anmelden, Sicherheit zu leisten, soweit sie nicht Befriedigung verlangen können. Dieses Recht steht den Gläubigern jedoch nur zu, wenn sie glaubhaft machen, dass durch die Umwandlung die Erfüllung ihrer Forderung gefährdet wird. Das Recht, Sicherheitsleistung zu verlangen, steht Gläubigern nicht zu, die im Falle der Insolvenz ein Recht auf vorzugsweise Befriedigung aus einer Deckungsmasse haben, die nach gesetzlicher Vorschrift zu ihrem Schutz errichtet und staatlich überwacht ist."
    },
    {
      "date": "2025-05-13",
      "id": "108845",
      "original_text": "Sonstige Registerbekanntmachung\nBaden-Württemberg Amtsgericht Mannheim HRB 711681\nPro Concept Beteiligungs GmbH – Mannheim",
      "type": "Sonstige Registerbekanntmachung",
      "state": "Baden-Württemberg",
      "amtsgericht": "Amtsgericht Mannheim",
      "registernummer": "HRB 711681",
      "registerart": "HRB",
      "company_name": "Pro Concept Beteiligungs GmbH",
      "company_seat": "Mannheim",
      "details": "13.05.2025 (Bekanntmachungsdatum)\n\nBaden-Württemberg Amtsgericht Mannheim HRB 711681\nSonstige Registerbekanntmachung 13.05.2025 (Eintragungsdatum)\n\nPro Concept Beteiligungs GmbH\nGesellschaft mit beschränkter Haftung\nMannheim\n\nAls nicht eingetragen wird bekanntgemacht:\nDen Gläubigern der Gesellschaft, deren Forderungen begründet worden sind, bevor die Eintragung der Beendigung des Vertrages in das Handelsregister nach § 10 HGB als bekanntgemacht gilt, ist vom anderen Vertragsteil Sicherheit zu leisten, wenn sie sich binnen sechs Monaten nach der Bekanntmachung zu diesem Zweck bei ihm melden."
    },
    {
      "date": "2025-05-13",
      "id": "108846",
      "original_text": "Einreichung neuer Dokumente\nBaden-Württemberg Amtsgericht Mannheim HRB 746938\nMovico Bischoff + Scheck AG – Rheinmünster",
      "type": "Einreichung neuer Dokumente",
      "state": "Baden-Württemberg",
      "amtsgericht": "Amtsgericht Mannheim",
      "registernummer": "HRB 746938",
      "registerart": "HRB",
      "company_name": "Movico Bischoff + Scheck AG",
      "company_seat": "Rheinmünster",
      "details": "13.05.2025 (Bekanntmachungsdatum)\n\nBaden-Württemberg Amtsgericht Mannheim HRB 746938\nEinreichung neuer Dokumente\n\nMovico Bischoff + Scheck AG\nAktiengesellschaft\nRheinmünster\n\nDie Gesellschaft hat am 10.04.2025 die Liste über die Zusammensetzung des Aufsichtsrats zum Handelsregister eingereicht."
    },
    {
      "date": "2025-05-13",
      "id": "108847",
      "original_text": "Registerbekanntmachung nach dem Umwandlungsgesetz\nBaden-Württemberg Amtsgericht Mannheim HRA 712592\nDHE-Gebäude- und Handwerkerservice e.K. – Karlsuhe",
      "type": "Registerbekanntmachung nach dem Umwandlungsgesetz",
      "state": "Baden-Württemberg",
      "amtsgericht": "Amtsgericht Mannheim",
      "registernummer": "HRA 712592",
      "registerart": "HRA",
      "company_name": "DHE-Gebäude- und Handwerkerservice e.K.",
      "company_seat": "Karlsuhe",
      "details": "13.05.2025 (Bekanntmachungsdatum)\n\nBaden-Württemberg Amtsgericht Mannheim HRA 712592\nRegisterbekanntmachung nach dem Umwandlungsgesetz 13.05.2025 (Eintragungsdatum)\n\nDHE-Gebäude- und Handwerkerservice e.K.\nEinzelkaufmann / Einzelkauffrau\nKarlsuhe\n\nDen Gläubigern der an der Verschmelzung beteiligten Rechtsträger ist, wenn sie binnen sechs Monaten nach dem Tag, an dem die Eintragung der Verschmelzung in das Register des Sitzes desjenigen Rechtsträgers, dessen Gläubiger sie sind, nach § 19 Abs. 3 UmwG als bekanntgemacht gilt, ihren Anspruch nach Grund und Höhe schriftlich anmelden, Sicherheit zu leisten, soweit sie nicht Befriedigung verlangen können. Dieses Recht steht den Gläubigern jedoch nur zu, wenn sie glaubhaft machen, dass durch die Verschmelzung die Erfüllung ihrer Forderung gefährdet wird."
    },
    {
      "date": "2025-05-13",
      "id": "108848",
      "original_text": "Löschungsankündigung\nBrandenburg Amtsgericht Frankfurt/Oder HRB 10569\nGasTec Gasgerätetechnik GmbH – Neuenhagen bei Berlin",
      "type": "Löschungsankündigung",
      "state": "Brandenburg",
      "amtsgericht": "Amtsgericht Frankfurt/Oder",
      "registernummer": "HRB 10569",
      "registerart": "HRB",
      "company_name": "GasTec Gasgerätetechnik GmbH",
      "company_seat": "Neuenhagen bei Berlin",
      "details": "13.05.2025 (Bekanntmachungsdatum)\n\nBrandenburg Amtsgericht Frankfurt/Oder HRB 10569\nLöschungsankündigung\n\nGasTec Gasgerätetechnik GmbH\nGesellschaft mit beschränkter Haftung\nNeuenhagen bei Berlin\n\nBei der nachstehenden Gesellschaft wird das Amtslöschungsverfahren gemäß § 394 FamFG eingeleitet."
    },
    {
      "date": "2025-05-13",
      "id": "108849",
      "original_text": "Registerbekanntmachung nach dem Umwandlungsgesetz\nBaden-Württemberg Amtsgericht Mannheim HRB 736908\nDHE Gebäude- und Handwerkerservice UG (haftungsbeschränkt) – Karlsruhe",
      "type": "Registerbekanntmachung nach dem Umwandlungsgesetz",
      "state": "Baden-Württemberg",
      "amtsgericht": "Amtsgericht Mannheim",
      "registernummer": "HRB 736908",
      "registerart": "HRB",
      "company_name": "DHE Gebäude- und Handwerkerservice UG (haftungsbeschränkt)",
      "company_seat": "Karlsruhe",
      "details": "13.05.2025 (Bekanntmachungsdatum)\n\nBaden-Württemberg Amtsgericht Mannheim HRB 736908\nRegisterbekanntmachung nach dem Umwandlungsgesetz 13.05.2025 (Eintragungsdatum)\n\nDHE Gebäude- und Handwerkerservice UG (haftungsbeschränkt)\nGesellschaft mit beschränkter Haftung\nKarlsruhe\n\nDen Gläubigern der an der Verschmelzung beteiligten Rechtsträger ist, wenn sie binnen sechs Monaten nach dem Tag, an dem die Eintragung der Verschmelzung in das Register des Sitzes desjenigen Rechtsträgers, dessen Gläubiger sie sind, nach § 19 Abs. 3 UmwG als bekanntgemacht gilt, ihren Anspruch nach Grund und Höhe schriftlich anmelden, Sicherheit zu leisten, soweit sie nicht Befriedigung verlangen können. Dieses Recht steht den Gläubigern jedoch nur zu, wenn sie glaubhaft machen, dass durch die Verschmelzung die Erfüllung ihrer Forderung gefährdet wird."
    },
    {
      "date": "2025-05-13",
      "id": "108850",
      "original_text": "Löschungsankündigung\nBaden-Württemberg Amtsgericht Mannheim HRB 717328\nUnited A.Studio Anthony GmbH – Mannheim",
      "type": "Löschungsankündigung",
      "state": "Baden-Württemberg",
      "amtsgericht": "Amtsgericht Mannheim",
      "registernummer": "HRB 717328",
      "registerart": "HRB",
      "company_name": "United A.Studio Anthony GmbH",
      "company_seat": "Mannheim",
      "details": "13.05.2025 (Bekanntmachungsdatum)\n\nBaden-Württemberg Amtsgericht Mannheim HRB 717328\nLöschungsankündigung\n\nUnited A.Studio Anthony GmbH\nGesellschaft mit beschränkter Haftung\nMannheim\n\nDas Gericht beabsichtigt, die Gesellschaft wegen Vermögenslosigkeit im Handelsregister von Amts wegen nach § 394 FamFG zu löschen. Die Frist zur Geltendmachung eines Widerspruchs gegen die beabsichtigte Löschung ist auf einen Monat ab Veröffentlichung bestimmt."
    },
    {
      "date": "2025-05-13",
      "id": "108851",
      "original_text": "Einreichung neuer Dokumente\nBaden-Württemberg Amtsgericht Mannheim HRB 8674\nRhein-Neckar-Verkehr GmbH – Mannheim",
      "type": "Einreichung neuer Dokumente",
      "state": "Baden-Württemberg",
      "amtsgericht": "Amtsgericht Mannheim",
      "registernummer": "HRB 8674",
      "registerart": "HRB",
      "company_name": "Rhein-Neckar-Verkehr GmbH",
      "company_seat": "Mannheim",
      "details": "13.05.2025 (Bekanntmachungsdatum)\n\nBaden-Württemberg Amtsgericht Mannheim HRB 8674\nEinreichung neuer Dokumente\n\nRhein-Neckar-Verkehr GmbH\nGesellschaft mit beschränkter Haftung\nMannheim\n\nDie Gesellschaft hat am 08.05.2025 die Liste über die Zusammensetzung des Aufsichtsrats zum Handelsregister eingereicht."
    },
    {
      "date": "2025-05-13",
      "id": "108852",
      "original_text": "Löschungsankündigung\nSaarland Amtsgericht Saarbrücken HRB 9088\nW.N. Pfeiffer Büromaschinen GmbH – Saarbrücken",
      "type": "Löschungsankündigung",
      "state": "Saarland",
      "amtsgericht": "Amtsgericht Saarbrücken",
      "registernummer": "HRB 9088",
      "registerart": "HRB",
      "company_name": "W.N. Pfeiffer Büromaschinen GmbH",
      "company_seat": "Saarbrücken",
      "details": "13.05.2025 (Bekanntmachungsdatum)\n\nSaarland Amtsgericht Saarbrücken HRB 9088\nLöschungsankündigung\n\nW.N. Pfeiffer Büromaschinen GmbH\nGesellschaft mit beschränkter Haftung\nSaarbrücken\n\nEs ist beabsichtigt, die Gesellschaft von Amts wegen gemäß § 394 FamFG wegen Vermögenslosigkeit zu löschen.\nGegen die Löschung von Amts wegen ist das Rechtsmittel des Widerspruchs statthaft. Der Widerspruch ist binnen einer Frist von einem Monat, beginnend mit dem Tag dieser Veröffentlichung durch Einreichen eines Widerspruchsschreibens -schriftlich oder zur Niederschrift der Geschäftsstelle beim Amtsgericht Saarbrücken, -zentrales Handelsregister-, Mainzerstr.178, 66121 Saarbrücken einzulegen.\nDer Widerspruch muss die Bezeichnung der angefochtenen Löschungsankündigung enthalten sowie die Erklärung, dass Widerspruch eingelegt wird. Er ist vom Widerspruchsführer oder seinem Bevollmächtigten zu unterzeichnen.\nDas Widerspruchsschreiben kann auch in der Form eines elektronischen Dokumentes eingereicht werden, das mit einer qualifizierten elektronischen Signatur nach dem Signaturgesetz versehen sein muss (§§ 14 Abs. 2 FamFG, 130a, 298 ZPO)."
    },
    {
      "date": "2025-05-13",
      "id": "108853",
      "original_text": "Löschungsankündigung\nBrandenburg Amtsgericht Frankfurt/Oder HRB 18663\nIST GmbH – Frankfurt (Oder)",
      "type": "Löschungsankündigung",
      "state": "Brandenburg",
      "amtsgericht": "Amtsgericht Frankfurt/Oder",
      "registernummer": "HRB 18663",
      "registerart": "HRB",
      "company_name": "IST GmbH",
      "company_seat": "Frankfurt (Oder)",
      "details": "13.05.2025 (Bekanntmachungsdatum)\n\nBrandenburg Amtsgericht Frankfurt/Oder HRB 18663\nLöschungsankündigung\n\nIST GmbH\nGesellschaft mit beschränkter Haftung\nFrankfurt (Oder)\n\nBei der nachstehenden Gesellschaft wird das Amtslöschungsverfahren gemäß § 394 FamFG eingeleitet."
    },
    {
      "date": "2025-05-13",
      "id": "108854",
      "original_text": "Löschungsankündigung\nBrandenburg Amtsgericht Frankfurt/Oder HRB 3113\nBegus Umweltschutz Entsorgungsgesellschaft für technische Geräte mbH – Wandlitz OT Schönwalde",
      "type": "Löschungsankündigung",
      "state": "Brandenburg",
      "amtsgericht": "Amtsgericht Frankfurt/Oder",
      "registernummer": "HRB 3113",
      "registerart": "HRB",
      "company_name": "Begus Umweltschutz Entsorgungsgesellschaft für technische Geräte mbH",
      "company_seat": "Wandlitz OT Schönwalde",
      "details": "13.05.2025 (Bekanntmachungsdatum)\n\nBrandenburg Amtsgericht Frankfurt/Oder HRB 3113\nLöschungsankündigung\n\nBegus Umweltschutz Entsorgungsgesellschaft für technische Geräte mbH\nGesellschaft mit beschränkter Haftung\nWandlitz OT Schönwalde\n\nBei der nachstehenden Gesellschaft wird das Amtslöschungsverfahren gemäß § 394 FamFG eingeleitet."
    },
    {
      "date": "2025-05-13",
      "id": "108855",
      "original_text": "Einreichung neuer Dokumente\nBrandenburg Amtsgericht Neuruppin HRB 1121\nStadtwerke Hennigsdorf GmbH – Hennigsdorf",
      "type": "Einreichung neuer Dokumente",
      "state": "Brandenburg",
      "amtsgericht": "Amtsgericht Neuruppin",
      "registernummer": "HRB 1121",
      "registerart": "HRB",
      "company_name": "Stadtwerke Hennigsdorf GmbH",
      "company_seat": "Hennigsdorf",
      "details": "13.05.2025 (Bekanntmachungsdatum)\n\nBrandenburg Amtsgericht Neuruppin HRB 1121\nEinreichung neuer Dokumente\n\nStadtwerke Hennigsdorf GmbH\nGesellschaft mit beschränkter Haftung\nHennigsdorf\n\nAls nicht eingetragen wird veröffentlicht: Eine Liste der Mitglieder des Aufsichtsrates wurde zum Handelsregister eingereicht."
    },
    {
      "date": "2025-05-13",
      "id": "108856",
      "original_text": "Registerbekanntmachung nach dem Umwandlungsgesetz\nThüringen Amtsgericht Jena HRB 301404\nCarUnion HESS Schmalkalden GmbH – Schmalkalden",
      "type": "Registerbekanntmachung nach dem Umwandlungsgesetz",
      "state": "Thüringen",
      "amtsgericht": "Amtsgericht Jena",
      "registernummer": "HRB 301404",
      "registerart": "HRB",
      "company_name": "CarUnion HESS Schmalkalden GmbH",
      "company_seat": "Schmalkalden",
      "details": "13.05.2025 (Bekanntmachungsdatum)\n\nThüringen Amtsgericht Jena HRB 301404\nRegisterbekanntmachung nach dem Umwandlungsgesetz 13.05.2025 (Eintragungsdatum)\n\nCarUnion HESS Schmalkalden GmbH\nGesellschaft mit beschränkter Haftung\nSchmalkalden\n\nNicht eingetragen: Den Gläubigern der an der Verschmelzung beteiligten Rechtsträger, ist wenn sie binnen sechs Monaten nach dem Tag, an dem die Eintragung der Verschmelzung in das Register des Sitzes desjenigen Rechtsträgers, dessen Gläubiger sie sind,  nach § 19 Abs. 3 UmwG als bekanntgemacht gilt, ihren Anspruch nach Grund und Höhe schriftlich anmelden, Sicherheit zu leisten, soweit sie nicht Befriedigung verlangen können. Dieses Recht steht ihnen jedoch nur zu, wenn sie glaubhaft machen, daß durch die Verschmelzung die Erfüllung ihrer Forderung gefährdet wird."
    },
    {
      "date": "2025-05-13",
      "id": "108857",
      "original_text": "Registerbekanntmachung nach dem Umwandlungsgesetz\nThüringen Amtsgericht Jena HRB 404963\nCarUnion Steinhardt GmbH – Eisenach",
      "type": "Registerbekanntmachung nach dem Umwandlungsgesetz",
      "state": "Thüringen",
      "amtsgericht": "Amtsgericht Jena",
      "registernummer": "HRB 404963",
      "registerart": "HRB",
      "company_name": "CarUnion Steinhardt GmbH",
      "company_seat": "Eisenach",
      "details": "13.05.2025 (Bekanntmachungsdatum)\n\nThüringen Amtsgericht Jena HRB 404963\nRegisterbekanntmachung nach dem Umwandlungsgesetz 13.05.2025 (Eintragungsdatum)\n\nCarUnion Steinhardt GmbH\nGesellschaft mit beschränkter Haftung\nEisenach\n\nNicht eingetragen: Den Gläubigern der an der Verschmelzung beteiligten Rechtsträger, ist wenn sie binnen sechs Monaten nach dem Tag, an dem die Eintragung der Verschmelzung in das Register des Sitzes desjenigen Rechtsträgers, dessen Gläubiger sie sind,  nach § 19 Abs. 3 UmwG als bekanntgemacht gilt, ihren Anspruch nach Grund und Höhe schriftlich anmelden, Sicherheit zu leisten, soweit sie nicht Befriedigung verlangen können. Dieses Recht steht ihnen jedoch nur zu, wenn sie glaubhaft machen, daß durch die Verschmelzung die Erfüllung ihrer Forderung gefährdet wird."
    },
    {
      "date": "2025-05-13",
      "id": "108858",
      "original_text": "Registerbekanntmachung nach dem Umwandlungsgesetz\nThüringen Amtsgericht Jena HRB 304318\nCarUnion HESS Suhl GmbH – Suhl",
      "type": "Registerbekanntmachung nach dem Umwandlungsgesetz",
      "state": "Thüringen",
      "amtsgericht": "Amtsgericht Jena",
      "registernummer": "HRB 304318",
      "registerart": "HRB",
      "company_name": "CarUnion HESS Suhl GmbH",
      "company_seat": "Suhl",
      "details": "13.05.2025 (Bekanntmachungsdatum)\n\nThüringen Amtsgericht Jena HRB 304318\nRegisterbekanntmachung nach dem Umwandlungsgesetz 13.05.2025 (Eintragungsdatum)\n\nCarUnion HESS Suhl GmbH\nGesellschaft mit beschränkter Haftung\nSuhl\n\nNicht eingetragen: Den Gläubigern der an der Verschmelzung beteiligten Rechtsträger, ist wenn sie binnen sechs Monaten nach dem Tag, an dem die Eintragung der Verschmelzung in das Register des Sitzes desjenigen Rechtsträgers, dessen Gläubiger sie sind,  nach § 19 Abs. 3 UmwG als bekanntgemacht gilt, ihren Anspruch nach Grund und Höhe schriftlich anmelden, Sicherheit zu leisten, soweit sie nicht Befriedigung verlangen können. Dieses Recht steht ihnen jedoch nur zu, wenn sie glaubhaft machen, daß durch die Verschmelzung die Erfüllung ihrer Forderung gefährdet wird."
    },
    {
      "date": "2025-05-13",
      "id": "108859",
      "original_text": "Registerbekanntmachung nach dem Umwandlungsgesetz\nThüringen Amtsgericht Jena HRB 304785\nCarUnion HESS GmbH – Bad Salzungen",
      "type": "Registerbekanntmachung nach dem Umwandlungsgesetz",
      "state": "Thüringen",
      "amtsgericht": "Amtsgericht Jena",
      "registernummer": "HRB 304785",
      "registerart": "HRB",
      "company_name": "CarUnion HESS GmbH",
      "company_seat": "Bad Salzungen",
      "details": "13.05.2025 (Bekanntmachungsdatum)\n\nThüringen Amtsgericht Jena HRB 304785\nRegisterbekanntmachung nach dem Umwandlungsgesetz 13.05.2025 (Eintragungsdatum)\n\nCarUnion HESS GmbH\nGesellschaft mit beschränkter Haftung\nBad Salzungen\n\nNicht eingetragen: Den Gläubigern der an der Verschmelzung beteiligten Rechtsträger, ist wenn sie binnen sechs Monaten nach dem Tag, an dem die Eintragung der Verschmelzung in das Register des Sitzes desjenigen Rechtsträgers, dessen Gläubiger sie sind,  nach § 19 Abs. 3 UmwG als bekanntgemacht gilt, ihren Anspruch nach Grund und Höhe schriftlich anmelden, Sicherheit zu leisten, soweit sie nicht Befriedigung verlangen können. Dieses Recht steht ihnen jedoch nur zu, wenn sie glaubhaft machen, daß durch die Verschmelzung die Erfüllung ihrer Forderung gefährdet wird."
    },
    {
      "date": "2025-05-13",
      "id": "108860",
      "original_text": "Löschungsankündigung\nThüringen Amtsgericht Jena HRB 512258\nFashionlounge Xquisit Verwaltungs GmbH – Weimar",
      "type": "Löschungsankündigung",
      "state": "Thüringen",
      "amtsgericht": "Amtsgericht Jena",
      "registernummer": "HRB 512258",
      "registerart": "HRB",
      "company_name": "Fashionlounge Xquisit Verwaltungs GmbH",
      "company_seat": "Weimar",
      "details": "13.05.2025 (Bekanntmachungsdatum)\n\nThüringen Amtsgericht Jena HRB 512258\nLöschungsankündigung\n\nFashionlounge Xquisit Verwaltungs GmbH\nGesellschaft mit beschränkter Haftung\nWeimar\n\nDas Registergericht beabsichtigt, die im Handelsregister eingetragene Gesellschaft wegen Vermögenslosigkeit nach § 394 FamFG von Amts wegen zu löschen. Die Frist zur Erhebung eines Widerspruchs gegen die beabsichtigte Löschung wird auf 6 Wochen festgesetzt."
    },
    {
      "date": "2025-05-13",
      "id": "108861",
      "original_text": "Registerbekanntmachung nach dem Umwandlungsgesetz\nThüringen Amtsgericht Jena HRB 502399\nCarUnion ALV GmbH – Gotha",
      "type": "Registerbekanntmachung nach dem Umwandlungsgesetz",
      "state": "Thüringen",
      "amtsgericht": "Amtsgericht Jena",
      "registernummer": "HRB 502399",
      "registerart": "HRB",
      "company_name": "CarUnion ALV GmbH",
      "company_seat": "Gotha",
      "details": "13.05.2025 (Bekanntmachungsdatum)\n\nThüringen Amtsgericht Jena HRB 502399\nRegisterbekanntmachung nach dem Umwandlungsgesetz 13.05.2025 (Eintragungsdatum)\n\nCarUnion ALV GmbH\nGesellschaft mit beschränkter Haftung\nGotha\n\nNicht eingetragen: Den Gläubigern der an der Verschmelzung beteiligten Rechtsträger, ist wenn sie binnen sechs Monaten nach dem Tag, an dem die Eintragung der Verschmelzung in das Register des Sitzes desjenigen Rechtsträgers, dessen Gläubiger sie sind,  nach § 19 Abs. 3 UmwG als bekanntgemacht gilt, ihren Anspruch nach Grund und Höhe schriftlich anmelden, Sicherheit zu leisten, soweit sie nicht Befriedigung verlangen können. Dieses Recht steht ihnen jedoch nur zu, wenn sie glaubhaft machen, daß durch die Verschmelzung die Erfüllung ihrer Forderung gefährdet wird."
    },
    {
      "date": "2025-05-13",
      "id": "108862",
      "original_text": "Löschungsankündigung\nBerlin Amtsgericht Berlin (Charlottenburg) HRB 242472\nMondstern Bau GmbH – Berlin",
      "type": "Löschungsankündigung",
      "state": "Berlin",
      "amtsgericht": "Amtsgericht Berlin (Charlottenburg)",
      "registernummer": "HRB 242472",
      "registerart": "HRB",
      "company_name": "Mondstern Bau GmbH",
      "company_seat": "Berlin",
      "details": "13.05.2025 (Bekanntmachungsdatum)\n\nBerlin Amtsgericht Berlin (Charlottenburg) HRB 242472\nLöschungsankündigung\n\nMondstern Bau GmbH\nGesellschaft mit beschränkter Haftung\nBerlin\n\nBei der nachstehenden Gesellschaft wird das Amtslöschungsverfahren gemäß § 394 FamFG eingeleitet. Widerspruchsfrist 6 Wochen"
    },
    {
      "date": "2025-05-13",
      "id": "108863",
      "original_text": "Registerbekanntmachung nach dem Umwandlungsgesetz\nBerlin Amtsgericht Berlin (Charlottenburg) HRB 274757\nTLC GmbH Tax – Berlin",
      "type": "Registerbekanntmachung nach dem Umwandlungsgesetz",
      "state": "Berlin",
      "amtsgericht": "Amtsgericht Berlin (Charlottenburg)",
      "registernummer": "HRB 274757",
      "registerart": "HRB",
      "company_name": "TLC GmbH Tax",
      "company_seat": "Berlin",
      "details": "13.05.2025 (Bekanntmachungsdatum)\n\nBerlin Amtsgericht Berlin (Charlottenburg) HRB 274757\nRegisterbekanntmachung nach dem Umwandlungsgesetz 01.05.2025 (Eintragungsdatum)\n\nTLC GmbH Tax\nGesellschaft mit beschränkter Haftung\nBerlin\n\nZu Eintragungsnummer 1 vom 01.05.2025 wird als nicht eingetragen veröffentlicht:Den Gläubigern ist, wenn sie binnen sechs Monaten nach dem Tag, an dem die Eintragung der Umwandlung als bekannt gemacht gilt, ihren Anspruch nach Grund und Höhe schriftlich anmelden, Sicherheit zu leisten, soweit sie nicht Befriedigung verlangen können. Dieses Recht steht den Gläubigern jedoch nur zu, wenn sie glaubhaft machen, dass durch die Umwandlung die Erfüllung ihrer Forderung gefährdet wird. Das Recht, Sicherheitsleistung zu verlangen, steht Gläubigern nicht zu, die im Falle der Insolvenz ein Recht auf vorzugsweise Befriedigung aus einer Deckungsmasse haben, die nach gesetzlicher Vorschrift zu ihrem Schutz errichtet und staatlich überwacht ist."
    },
    {
      "date": "2025-05-13",
      "id": "108864",
      "original_text": "Registerbekanntmachung nach dem Umwandlungsgesetz\nBaden-Württemberg Amtsgericht Mannheim HRB 713663\nZeiler Beteiligung GmbH – Baden-Baden",
      "type": "Registerbekanntmachung nach dem Umwandlungsgesetz",
      "state": "Baden-Württemberg",
      "amtsgericht": "Amtsgericht Mannheim",
      "registernummer": "HRB 713663",
      "registerart": "HRB",
      "company_name": "Zeiler Beteiligung GmbH",
      "company_seat": "Baden-Baden",
      "details": "13.05.2025 (Bekanntmachungsdatum)\n\nBaden-Württemberg Amtsgericht Mannheim HRB 713663\nRegisterbekanntmachung nach dem Umwandlungsgesetz 13.05.2025 (Eintragungsdatum)\n\nZeiler Beteiligung GmbH\nGesellschaft mit beschränkter Haftung\nBaden-Baden\n\nDen Gläubigern der an der Verschmelzung beteiligten Rechtsträger ist, wenn sie binnen sechs Monaten nach dem Tag, an dem die Eintragung der Verschmelzung in das Register des Sitzes desjenigen Rechtsträgers, dessen Gläubiger sie sind, nach § 19 Abs. 3 UmwG als bekanntgemacht gilt, ihren Anspruch nach Grund und Höhe schriftlich anmelden, Sicherheit zu leisten, soweit sie nicht Befriedigung verlangen können. Dieses Recht steht den Gläubigern jedoch nur zu, wenn sie glaubhaft machen, dass durch die Verschmelzung die Erfüllung ihrer Forderung gefährdet wird."
    },
    {
      "date": "2025-05-13",
      "id": "108865",
      "original_text": "Registerbekanntmachung nach dem Umwandlungsgesetz\nBaden-Württemberg Amtsgericht Mannheim HRB 713642\nZeiler Verwaltung GmbH – Baden-Baden",
      "type": "Registerbekanntmachung nach dem Umwandlungsgesetz",
      "state": "Baden-Württemberg",
      "amtsgericht": "Amtsgericht Mannheim",
      "registernummer": "HRB 713642",
      "registerart": "HRB",
      "company_name": "Zeiler Verwaltung GmbH",
      "company_seat": "Baden-Baden",
      "details": "13.05.2025 (Bekanntmachungsdatum)\n\nBaden-Württemberg Amtsgericht Mannheim HRB 713642\nRegisterbekanntmachung nach dem Umwandlungsgesetz 13.05.2025 (Eintragungsdatum)\n\nZeiler Verwaltung GmbH\nGesellschaft mit beschränkter Haftung\nBaden-Baden\n\nDen Gläubigern der an der Verschmelzung beteiligten Rechtsträger ist, wenn sie binnen sechs Monaten nach dem Tag, an dem die Eintragung der Verschmelzung in das Register des Sitzes desjenigen Rechtsträgers, dessen Gläubiger sie sind, nach § 19 Abs. 3 UmwG als bekanntgemacht gilt, ihren Anspruch nach Grund und Höhe schriftlich anmelden, Sicherheit zu leisten, soweit sie nicht Befriedigung verlangen können. Dieses Recht steht den Gläubigern jedoch nur zu, wenn sie glaubhaft machen, dass durch die Verschmelzung die Erfüllung ihrer Forderung gefährdet wird."
    },
    {
      "date": "2025-05-13",
      "id": "108866",
      "original_text": "Einreichung neuer Dokumente\nBaden-Württemberg Amtsgericht Freiburg HRB 310152\nTheresienklinik I Bad Krozingen GmbH – Bad Krozingen",
      "type": "Einreichung neuer Dokumente",
      "state": "Baden-Württemberg",
      "amtsgericht": "Amtsgericht Freiburg",
      "registernummer": "HRB 310152",
      "registerart": "HRB",
      "company_name": "Theresienklinik I Bad Krozingen GmbH",
      "company_seat": "Bad Krozingen",
      "details": "13.05.2025 (Bekanntmachungsdatum)\n\nBaden-Württemberg Amtsgericht Freiburg HRB 310152\nEinreichung neuer Dokumente 13.05.2025 (Eintragungsdatum)\n\nTheresienklinik I Bad Krozingen GmbH\nGesellschaft mit beschränkter Haftung\nBad Krozingen\n\nDie Gesellschaft hat am 12.05.2025 die Liste über die Zusammensetzung des Aufsichtsrats zum Handelsregister eingereicht."
    },
    {
      "date": "2025-05-13",
      "id": "108867",
      "original_text": "Einreichung neuer Dokumente\nBaden-Württemberg Amtsgericht Stuttgart HRB 382196\nscience + computing Aktiengesellschaft – Tübingen",
      "type": "Einreichung neuer Dokumente",
      "state": "Baden-Württemberg",
      "amtsgericht": "Amtsgericht Stuttgart",
      "registernummer": "HRB 382196",
      "registerart": "HRB",
      "company_name": "science + computing Aktiengesellschaft",
      "company_seat": "Tübingen",
      "details": "13.05.2025 (Bekanntmachungsdatum)\n\nBaden-Württemberg Amtsgericht Stuttgart HRB 382196\nEinreichung neuer Dokumente\n\nscience + computing Aktiengesellschaft\nAktiengesellschaft\nTübingen\n\nDie Gesellschaft hat am 12.05.2025 die Liste über die Zusammensetzung des Aufsichtsrats zum Handelsregister eingereicht."
    },
    {
      "date": "2025-05-13",
      "id": "108868",
      "original_text": "Löschungsankündigung\nBerlin Amtsgericht Berlin (Charlottenburg) HRB 195553\nKaffee Emporium GmbH – Berlin",
      "type": "Löschungsankündigung",
      "state": "Berlin",
      "amtsgericht": "Amtsgericht Berlin (Charlottenburg)",
      "registernummer": "HRB 195553",
      "registerart": "HRB",
      "company_name": "Kaffee Emporium GmbH",
      "company_seat": "Berlin",
      "details": "13.05.2025 (Bekanntmachungsdatum)\n\nBerlin Amtsgericht Berlin (Charlottenburg) HRB 195553\nLöschungsankündigung\n\nKaffee Emporium GmbH\nGesellschaft mit beschränkter Haftung\nBerlin\n\nBei der nachstehenden Gesellschaft wird das Amtslöschungsverfahren gemäß § 394 FamFG eingeleitet. Widerspruchsfrist 6 Wochen"
    },
    {
      "date": "2025-05-13",
      "id": "108869",
      "original_text": "Registerbekanntmachung nach dem Umwandlungsgesetz\nBaden-Württemberg Amtsgericht Ulm HRB 720077\nAlfa GmbH – Ellwangen Jagst",
      "type": "Registerbekanntmachung nach dem Umwandlungsgesetz",
      "state": "Baden-Württemberg",
      "amtsgericht": "Amtsgericht Ulm",
      "registernummer": "HRB 720077",
      "registerart": "HRB",
      "company_name": "Alfa GmbH",
      "company_seat": "Ellwangen Jagst",
      "details": "13.05.2025 (Bekanntmachungsdatum)\n\nBaden-Württemberg Amtsgericht Ulm HRB 720077\nRegisterbekanntmachung nach dem Umwandlungsgesetz 13.05.2025 (Eintragungsdatum)\n\nAlfa GmbH\nGesellschaft mit beschränkter Haftung\nEllwangen Jagst\n\nAls nicht eingetragen wird bekanntgemacht:\nDen Gläubigern der an der Verschmelzung beteiligten Rechtsträger ist, wenn sie binnen sechs Monaten nach dem Tag, an dem die Eintragung der Verschmelzung in das Register des Sitzes desjenigen Rechtsträgers, dessen Gläubiger sie sind, nach § 19 Abs. 3 UmwG als bekanntgemacht gilt, ihren Anspruch nach Grund und Höhe schriftlich anmelden, Sicherheit zu leisten, soweit sie nicht Befriedigung verlangen können. Dieses Recht steht den Gläubigern jedoch nur zu, wenn sie glaubhaft machen, dass durch die Verschmelzung die Erfüllung ihrer Forderung gefährdet wird."
    },
    {
      "date": "2025-05-13",
      "id": "108870",
      "original_text": "Registerbekanntmachung nach dem Umwandlungsgesetz\nSachsen-Anhalt Amtsgericht Stendal HRB 31921\nPALANTRO Vermögensverwaltung GmbH – Halle (Saale)",
      "type": "Registerbekanntmachung nach dem Umwandlungsgesetz",
      "state": "Sachsen-Anhalt",
      "amtsgericht": "Amtsgericht Stendal",
      "registernummer": "HRB 31921",
      "registerart": "HRB",
      "company_name": "PALANTRO Vermögensverwaltung GmbH",
      "company_seat": "Halle (Saale)",
      "details": "13.05.2025 (Bekanntmachungsdatum)\n\nSachsen-Anhalt Amtsgericht Stendal HRB 31921\nRegisterbekanntmachung nach dem Umwandlungsgesetz 13.05.2025 (Eintragungsdatum)\n\nPALANTRO Vermögensverwaltung GmbH\nGesellschaft mit beschränkter Haftung\nHalle (Saale)\n\nNicht eingetragen:\nDen Gläubigern der an der Verschmelzung beteiligten Rechtsträger ist, wenn sie binnen sechs Monaten nach dem Tag, an dem die Eintragung der Verschmelzung nach § 19 Abs. 3 UmwG als bekanntgemacht gilt, ihren Anspruch nach Grund und Höhe schriftlich anmelden, Sicherheit zu leisten, soweit sie nicht Befriedigung verlangen können. Dieses Recht steht ihnen jedoch nur zu, wenn sie glaubhaft machen, dass durch die Verschmelzung die Erfüllung ihrer Forderung gefährdet wird."
    },
    {
      "date": "2025-05-13",
      "id": "108871",
      "original_text": "Registerbekanntmachung nach dem Umwandlungsgesetz\nSachsen-Anhalt Amtsgericht Stendal HRB 30519\nasm BAU + SERVICE GmbH Halle – Halle/Saale",
      "type": "Registerbekanntmachung nach dem Umwandlungsgesetz",
      "state": "Sachsen-Anhalt",
      "amtsgericht": "Amtsgericht Stendal",
      "registernummer": "HRB 30519",
      "registerart": "HRB",
      "company_name": "asm BAU + SERVICE GmbH Halle",
      "company_seat": "Halle/Saale",
      "details": "13.05.2025 (Bekanntmachungsdatum)\n\nSachsen-Anhalt Amtsgericht Stendal HRB 30519\nRegisterbekanntmachung nach dem Umwandlungsgesetz 13.05.2025 (Eintragungsdatum)\n\nasm BAU + SERVICE GmbH Halle\nGesellschaft mit beschränkter Haftung\nHalle/Saale\n\nNicht eingetragen:\nDen Gläubigern der an der Verschmelzung beteiligten Rechtsträger ist, wenn sie binnen sechs Monaten nach dem Tag, an dem die Eintragung der Verschmelzung nach § 19 Abs. 3 UmwG als bekanntgemacht gilt, ihren Anspruch nach Grund und Höhe schriftlich anmelden, Sicherheit zu leisten, soweit sie nicht Befriedigung verlangen können. Dieses Recht steht ihnen jedoch nur zu, wenn sie glaubhaft machen, dass durch die Verschmelzung die Erfüllung ihrer Forderung gefährdet wird."
    },
    {
      "date": "2025-05-13",
      "id": "108872",
      "original_text": "Registerbekanntmachung nach dem Umwandlungsgesetz\nBaden-Württemberg Amtsgericht Mannheim HRB 716815\nLAUB Beteiligungs GmbH – Karlsruhe",
      "type": "Registerbekanntmachung nach dem Umwandlungsgesetz",
      "state": "Baden-Württemberg",
      "amtsgericht": "Amtsgericht Mannheim",
      "registernummer": "HRB 716815",
      "registerart": "HRB",
      "company_name": "LAUB Beteiligungs GmbH",
      "company_seat": "Karlsruhe",
      "details": "13.05.2025 (Bekanntmachungsdatum)\n\nBaden-Württemberg Amtsgericht Mannheim HRB 716815\nRegisterbekanntmachung nach dem Umwandlungsgesetz 13.05.2025 (Eintragungsdatum)\n\nLAUB Beteiligungs GmbH\nGesellschaft mit beschränkter Haftung\nKarlsruhe\n\nAls nicht eingetragen wird bekanntgemacht:\nDen Gläubigern der an der Verschmelzung beteiligten Rechtsträger ist, wenn sie binnen sechs Monaten nach dem Tag, an dem die Eintragung der Verschmelzung in das Register des Sitzes desjenigen Rechtsträgers, dessen Gläubiger sie sind, nach § 19 Abs. 3 UmwG als bekanntgemacht gilt, ihren Anspruch nach Grund und Höhe schriftlich anmelden, Sicherheit zu leisten, soweit sie nicht Befriedigung verlangen können. Dieses Recht steht den Gläubigern jedoch nur zu, wenn sie glaubhaft machen, dass durch die Verschmelzung die Erfüllung ihrer Forderung gefährdet wird."
    },
    {
      "date": "2025-05-13",
      "id": "108873",
      "original_text": "Registerbekanntmachung nach dem Umwandlungsgesetz\nBaden-Württemberg Amtsgericht Ulm HRB 727906\nAKON GmbH – Ellwangen Jagst",
      "type": "Registerbekanntmachung nach dem Umwandlungsgesetz",
      "state": "Baden-Württemberg",
      "amtsgericht": "Amtsgericht Ulm",
      "registernummer": "HRB 727906",
      "registerart": "HRB",
      "company_name": "AKON GmbH",
      "company_seat": "Ellwangen Jagst",
      "details": "13.05.2025 (Bekanntmachungsdatum)\n\nBaden-Württemberg Amtsgericht Ulm HRB 727906\nRegisterbekanntmachung nach dem Umwandlungsgesetz 13.05.2025 (Eintragungsdatum)\n\nAKON GmbH\nGesellschaft mit beschränkter Haftung\nEllwangen Jagst\n\nAls nicht eingetragen wird bekanntgemacht:\nDen Gläubigern der an der Verschmelzung beteiligten Rechtsträger ist, wenn sie binnen sechs Monaten nach dem Tag, an dem die Eintragung der Verschmelzung in das Register des Sitzes desjenigen Rechtsträgers, dessen Gläubiger sie sind, nach § 19 Abs. 3 UmwG als bekanntgemacht gilt, ihren Anspruch nach Grund und Höhe schriftlich anmelden, Sicherheit zu leisten, soweit sie nicht Befriedigung verlangen können. Dieses Recht steht den Gläubigern jedoch nur zu, wenn sie glaubhaft machen, dass durch die Verschmelzung die Erfüllung ihrer Forderung gefährdet wird."
    },
    {
      "date": "2025-05-13",
      "id": "108874",
      "original_text": "Einreichung neuer Dokumente\nBaden-Württemberg Amtsgericht Stuttgart HRB 21035\nStuttgarter Versicherung Aktiengesellschaft – Stuttgart",
      "type": "Einreichung neuer Dokumente",
      "state": "Baden-Württemberg",
      "amtsgericht": "Amtsgericht Stuttgart",
      "registernummer": "HRB 21035",
      "registerart": "HRB",
      "company_name": "Stuttgarter Versicherung Aktiengesellschaft",
      "company_seat": "Stuttgart",
      "details": "13.05.2025 (Bekanntmachungsdatum)\n\nBaden-Württemberg Amtsgericht Stuttgart HRB 21035\nEinreichung neuer Dokumente\n\nStuttgarter Versicherung Aktiengesellschaft\nAktiengesellschaft\nStuttgart\n\nDie Gesellschaft hat am 12.05.2025 den Entwurf des Vermögensübertragungsvertrages zwischen \"Süddeutsche Allgemeine Versicherung a.G.\", Fellbach (übertragender Rechtsträger ohne Eintragung im Handelsregister nach § 210 VAG)  und der hiesigen Gesellschaft (übernehmender Rechtsträger) zum Handelsregister eingereicht."
    },
    {
      "date": "2025-05-13",
      "id": "108875",
      "original_text": "Löschungsankündigung\nBerlin Amtsgericht Berlin (Charlottenburg) HRB 195246\nWe are Int. GmbH – Berlin",
      "type": "Löschungsankündigung",
      "state": "Berlin",
      "amtsgericht": "Amtsgericht Berlin (Charlottenburg)",
      "registernummer": "HRB 195246",
      "registerart": "HRB",
      "company_name": "We are Int. GmbH",
      "company_seat": "Berlin",
      "details": "13.05.2025 (Bekanntmachungsdatum)\n\nBerlin Amtsgericht Berlin (Charlottenburg) HRB 195246\nLöschungsankündigung\n\nWe are Int. GmbH\nGesellschaft mit beschränkter Haftung\nBerlin\n\nBei der nachstehenden Gesellschaft wird das Amtslöschungsverfahren gemäß § 394 FamFG eingeleitet. Widerspruchsfrist 6 Wochen"
    },
    {
      "date": "2025-05-13",
      "id": "108876",
      "original_text": "Löschungsankündigung\nBerlin Amtsgericht Berlin (Charlottenburg) HRB 227294\nAstrictorium GmbH – Berlin",
      "type": "Löschungsankündigung",
      "state": "Berlin",
      "amtsgericht": "Amtsgericht Berlin (Charlottenburg)",
      "registernummer": "HRB 227294",
      "registerart": "HRB",
      "company_name": "Astrictorium GmbH",
      "company_seat": "Berlin",
      "details": "13.05.2025 (Bekanntmachungsdatum)\n\nBerlin Amtsgericht Berlin (Charlottenburg) HRB 227294\nLöschungsankündigung\n\nAstrictorium GmbH\nGesellschaft mit beschränkter Haftung\nBerlin\n\nBei der nachstehenden Gesellschaft wird das Amtslöschungsverfahren gemäß § 394 FamFG eingeleitet. Widerspruchsfrist 6 Wochen"
    },
    {
      "date": "2025-05-13",
      "id": "108877",
      "original_text": "Sonstige Registerbekanntmachung\nHamburg Amtsgericht Hamburg HRB 173382\nWolf Concept Immobilien GmbH – Hamburg",
      "type": "Sonstige Registerbekanntmachung",
      "state": "Hamburg",
      "amtsgericht": "Amtsgericht Hamburg",
      "registernummer": "HRB 173382",
      "registerart": "HRB",
      "company_name": "Wolf Concept Immobilien GmbH",
      "company_seat": "Hamburg",
      "details": "13.05.2025 (Bekanntmachungsdatum)\n\nHamburg Amtsgericht Hamburg HRB 173382\nSonstige Registerbekanntmachung\n\nWolf Concept Immobilien GmbH\nGesellschaft mit beschränkter Haftung\nHamburg\n\nEs wurde beantragt einen Nachtragsliquidator zur gelöschten Gesellschaft \" Wolf Concept Immobilien GmbH \" vormals eingetragen beim Amtsgericht Hamburg, unter HRB 173382, zwecks Durchsetzung der Rechte des Gläubigers Herrn Robert A. Depner, Bergisch Gladbach, aus einer Grundschuld in Höhe von 250.000,- Euro zuzüglich Zinsen lastend auf dem Grundbesitz: Gebäude und Freifläche in Recklinghausen, eingetragen im Grundbuch von Recklinghausen, Blatt 10349, Flur 643, Flurstück 369, dessen Eigentümerin die gelöschte Gesellschaft ist, im Wege der Zwangsversteigerung geltend zu machen. Den Beteiligten wird zur Wahrung des rechtlichen Gehörs Gelegenheit zur Stellungnahme, binnen einer Frist von 4 Wochen, ab Veröffentlichung gewährt."
    },
    {
      "date": "2025-05-13",
      "id": "108878",
      "original_text": "Einreichung neuer Dokumente\nBerlin Amtsgericht Berlin (Charlottenburg) HRB 154517\nAxel Springer SE – Berlin",
      "type": "Einreichung neuer Dokumente",
      "state": "Berlin",
      "amtsgericht": "Amtsgericht Berlin (Charlottenburg)",
      "registernummer": "HRB 154517",
      "registerart": "HRB",
      "company_name": "Axel Springer SE",
      "company_seat": "Berlin",
      "details": "13.05.2025 (Bekanntmachungsdatum)\n\nBerlin Amtsgericht Berlin (Charlottenburg) HRB 154517\nEinreichung neuer Dokumente\n\nAxel Springer SE\nEuropäische Aktiengesellschaft (SE)\nBerlin\n\nAls nicht eingetragen wird veröffentlicht: Es wurde eine neue Liste der Aufsichtsratsmitglieder eingereicht (§ 106 AktG)."
    },
    {
      "date": "2025-05-13",
      "id": "108879",
      "original_text": "Registerbekanntmachung nach dem Umwandlungsgesetz\nBerlin Amtsgericht Berlin (Charlottenburg) HRB 262098\nPYUR Sales & Service GmbH – Berlin",
      "type": "Registerbekanntmachung nach dem Umwandlungsgesetz",
      "state": "Berlin",
      "amtsgericht": "Amtsgericht Berlin (Charlottenburg)",
      "registernummer": "HRB 262098",
      "registerart": "HRB",
      "company_name": "PYUR Sales & Service GmbH",
      "company_seat": "Berlin",
      "details": "13.05.2025 (Bekanntmachungsdatum)\n\nBerlin Amtsgericht Berlin (Charlottenburg) HRB 262098\nRegisterbekanntmachung nach dem Umwandlungsgesetz 12.05.2025 (Eintragungsdatum)\n\nPYUR Sales & Service GmbH\nGesellschaft mit beschränkter Haftung\nBerlin\n\nZu Eintragungsnummer 7 vom 12.05.2025 wird als nicht eingetragen veröffentlicht: Den Gläubigern der an der Spaltung beteiligten Rechtsträger ist, wenn sie binnen sechs Monaten nach dem Tag, an dem die Eintragung der Spaltung in das Register des Sitzes desjenigen Rechtsträgers, dessen Gläubiger sie sind, als bekannt gemacht gilt, ihren Anspruch nach Grund und Höhe schriftlich anmelden, Sicherheit zu leisten, soweit sie nicht Befriedigung verlangen können. Dieses Recht steht den Gläubigern jedoch nur zu, wenn sie glaubhaft machen, dass durch die Spaltung die Erfüllung ihrer Forderung gefährdet wird. Das Recht, Sicherheitsleistung zu verlangen, steht Gläubigern nicht zu, die im Falle der Insolvenz ein Recht auf vorzugsweise Befriedigung aus einer Deckungsmasse haben, die nach gesetzlicher Vorschrift zu ihrem Schutz errichtet und staatlich überwacht ist."
    },
    {
      "date": "2025-05-13",
      "id": "108880",
      "original_text": "Registerbekanntmachung nach dem Umwandlungsgesetz\nBaden-Württemberg Amtsgericht Stuttgart HRB 739501\nmo-tech GmbH – Filderstadt",
      "type": "Registerbekanntmachung nach dem Umwandlungsgesetz",
      "state": "Baden-Württemberg",
      "amtsgericht": "Amtsgericht Stuttgart",
      "registernummer": "HRB 739501",
      "registerart": "HRB",
      "company_name": "mo-tech GmbH",
      "company_seat": "Filderstadt",
      "details": "13.05.2025 (Bekanntmachungsdatum)\n\nBaden-Württemberg Amtsgericht Stuttgart HRB 739501\nRegisterbekanntmachung nach dem Umwandlungsgesetz 13.05.2025 (Eintragungsdatum)\n\nmo-tech GmbH\nGesellschaft mit beschränkter Haftung\nFilderstadt\n\nAls nicht eingetragen wird bekanntgemacht:\nDen Gläubigern der an der Verschmelzung beteiligten Rechtsträger ist, wenn sie binnen sechs Monaten nach dem Tag, an dem die Eintragung der Verschmelzung in das Register des Sitzes desjenigen Rechtsträgers, dessen Gläubiger sie sind, nach § 19 Abs. 3 UmwG als bekanntgemacht gilt, ihren Anspruch nach Grund und Höhe schriftlich anmelden, Sicherheit zu leisten, soweit sie nicht Befriedigung verlangen können. Dieses Recht steht den Gläubigern jedoch nur zu, wenn sie glaubhaft machen, dass durch die Verschmelzung die Erfüllung ihrer Forderung gefährdet wird."
    },
    {
      "date": "2025-05-13",
      "id": "108881",
      "original_text": "Registerbekanntmachung nach dem Umwandlungsgesetz\nBerlin Amtsgericht Berlin (Charlottenburg) HRB 195590\nTele Columbus Netzwerk GmbH – Berlin",
      "type": "Registerbekanntmachung nach dem Umwandlungsgesetz",
      "state": "Berlin",
      "amtsgericht": "Amtsgericht Berlin (Charlottenburg)",
      "registernummer": "HRB 195590",
      "registerart": "HRB",
      "company_name": "Tele Columbus Netzwerk GmbH",
      "company_seat": "Berlin",
      "details": "13.05.2025 (Bekanntmachungsdatum)\n\nBerlin Amtsgericht Berlin (Charlottenburg) HRB 195590\nRegisterbekanntmachung nach dem Umwandlungsgesetz 12.05.2025 (Eintragungsdatum)\n\nTele Columbus Netzwerk GmbH\nGesellschaft mit beschränkter Haftung\nBerlin\n\nZu Eintragungsnummer 20 vom 12.05.2025 wird als nicht eingetragen veröffentlicht: Den Gläubigern der an der Spaltung beteiligten Rechtsträger ist, wenn sie binnen sechs Monaten nach dem Tag, an dem die Eintragung der Spaltung in das Register des Sitzes desjenigen Rechtsträgers, dessen Gläubiger sie sind, als bekannt gemacht gilt, ihren Anspruch nach Grund und Höhe schriftlich anmelden, Sicherheit zu leisten, soweit sie nicht Befriedigung verlangen können. Dieses Recht steht den Gläubigern jedoch nur zu, wenn sie glaubhaft machen, dass durch die Spaltung die Erfüllung ihrer Forderung gefährdet wird. Das Recht, Sicherheitsleistung zu verlangen, steht Gläubigern nicht zu, die im Falle der Insolvenz ein Recht auf vorzugsweise Befriedigung aus einer Deckungsmasse haben, die nach gesetzlicher Vorschrift zu ihrem Schutz errichtet und staatlich überwacht ist."
    },
    {
      "date": "2025-05-13",
      "id": "108882",
      "original_text": "Löschungsankündigung\nSaarland Amtsgericht Saarbrücken HRB 103284\nGfSA Gemeinschaft für soziale Arbeit UG (haftungsbeschränkt) – Wadern",
      "type": "Löschungsankündigung",
      "state": "Saarland",
      "amtsgericht": "Amtsgericht Saarbrücken",
      "registernummer": "HRB 103284",
      "registerart": "HRB",
      "company_name": "GfSA Gemeinschaft für soziale Arbeit UG (haftungsbeschränkt)",
      "company_seat": "Wadern",
      "details": "13.05.2025 (Bekanntmachungsdatum)\n\nSaarland Amtsgericht Saarbrücken HRB 103284\nLöschungsankündigung\n\nGfSA Gemeinschaft für soziale Arbeit UG (haftungsbeschränkt)\nGesellschaft mit beschränkter Haftung\nWadern\n\nEs ist beabsichtigt, die Gesellschaft von Amts wegen gemäß § 394 FamFG wegen Vermögenslosigkeit zu löschen.\nGegen die Löschung von Amts wegen ist das Rechtsmittel des Widerspruchs statthaft. Der Widerspruch ist binnen einer Frist zwei Monaten beginnend mit dem Tag dieser Veröffentlichung durch Einreichen eines Widerspruchsschreibens -schriftlich oder zur Niederschrift der Geschäftsstelle beim Amtsgericht Saarbrücken, -zentrales Handelsregister-, Mainzerstr.178, 66121 Saarbrücken einzulegen.\nDer Widerspruch muss die Bezeichnung der angefochtenen Löschungsankündigung enthalten sowie die Erklärung, dass Widerspruch eingelegt wird. Er ist vom Widerspruchsführer oder seinem Bevollmächtigten zu unterzeichnen.\nDas Widerspruchsschreiben kann auch in der Form eines elektronischen Dokumentes eingereicht werden, das mit einer qualifizierten elektronischen Signatur nach dem Signaturgesetz versehen sein muss (§§ 14 Abs. 2 FamFG, 130a, 298 ZPO)."
    },
    {
      "date": "2025-05-13",
      "id": "108883",
      "original_text": "Einreichung neuer Dokumente\nBaden-Württemberg Amtsgericht Stuttgart HRB 779059\nALDI Aichtal Verwaltungs-SE – Aichtal",
      "type": "Einreichung neuer Dokumente",
      "state": "Baden-Württemberg",
      "amtsgericht": "Amtsgericht Stuttgart",
      "registernummer": "HRB 779059",
      "registerart": "HRB",
      "company_name": "ALDI Aichtal Verwaltungs-SE",
      "company_seat": "Aichtal",
      "details": "13.05.2025 (Bekanntmachungsdatum)\n\nBaden-Württemberg Amtsgericht Stuttgart HRB 779059\nEinreichung neuer Dokumente\n\nALDI Aichtal Verwaltungs-SE\nEuropäische Aktiengesellschaft (SE)\nAichtal\n\nDie Gesellschaft hat am 09.05.2025 die Liste über die Zusammensetzung des Aufsichtsrats zum Handelsregister eingereicht."
    },
    {
      "date": "2025-05-13",
      "id": "108884",
      "original_text": "Registerbekanntmachung nach dem Umwandlungsgesetz\nBrandenburg Amtsgericht Neuruppin HRB 7123\nSeifert Systemtechnik GmbH – Hennigsdorf",
      "type": "Registerbekanntmachung nach dem Umwandlungsgesetz",
      "state": "Brandenburg",
      "amtsgericht": "Amtsgericht Neuruppin",
      "registernummer": "HRB 7123",
      "registerart": "HRB",
      "company_name": "Seifert Systemtechnik GmbH",
      "company_seat": "Hennigsdorf",
      "details": "13.05.2025 (Bekanntmachungsdatum)\n\nBrandenburg Amtsgericht Neuruppin HRB 7123\nRegisterbekanntmachung nach dem Umwandlungsgesetz 09.05.2025 (Eintragungsdatum)\n\nSeifert Systemtechnik GmbH\nGesellschaft mit beschränkter Haftung\nHennigsdorf\n\nZu Eintragungsnummer 4 vom 09.05.2025 wird als nicht eingetragen veröffentlicht:\nDen Gläubigern der an der Umwandlung beteiligten Rechtsträger ist, wenn sie binnen sechs Monaten nach dem Tag, an dem die Eintragung der Umwandlung in das Register des Sitzes desjenigen Rechtsträgers, dessen Gläubiger sie sind, als bekannt gemacht gilt, ihren Anspruch nach Grund und Höhe schriftlich anmelden, Sicherheit zu leisten, soweit sie nicht Befriedigung verlangen können. Dieses Recht steht den Gläubigern jedoch nur zu, wenn sie glaubhaft machen, dass durch die Umwandlung die Erfüllung ihrer Forderung gefährdet wird"
    },
    {
      "date": "2025-05-13",
      "id": "108885",
      "original_text": "Löschungsankündigung\nSchleswig-Holstein Amtsgericht Flensburg HRB 5047\nwingtec GmbH – Eggebek",
      "type": "Löschungsankündigung",
      "state": "Schleswig-Holstein",
      "amtsgericht": "Amtsgericht Flensburg",
      "registernummer": "HRB 5047",
      "registerart": "HRB",
      "company_name": "wingtec GmbH",
      "company_seat": "Eggebek",
      "details": "13.05.2025 (Bekanntmachungsdatum)\n\nSchleswig-Holstein Amtsgericht Flensburg HRB 5047\nLöschungsankündigung\n\nwingtec GmbH\nGesellschaft mit beschränkter Haftung\nEggebek\n\nEs ist die Löschung der nachstehenden Gesellschaft wegen Vermögenslosigkeit gemäß § 394 FamFG beabsichtigt.\nWiderspruchsfrist: 2 Monate."
    },
    {
      "date": "2025-05-13",
      "id": "108886",
      "original_text": "Sonstige Registerbekanntmachung\nSachsen Amtsgericht Leipzig HRB 16384\nKreiskrankenhaus Delitzsch GmbH – Delitzsch",
      "type": "Sonstige Registerbekanntmachung",
      "state": "Sachsen",
      "amtsgericht": "Amtsgericht Leipzig",
      "registernummer": "HRB 16384",
      "registerart": "HRB",
      "company_name": "Kreiskrankenhaus Delitzsch GmbH",
      "company_seat": "Delitzsch",
      "details": "13.05.2025 (Bekanntmachungsdatum)\n\nSachsen Amtsgericht Leipzig HRB 16384\nSonstige Registerbekanntmachung\n\nKreiskrankenhaus Delitzsch GmbH\nGesellschaft mit beschränkter Haftung\nDelitzsch\n\nAm 09.05.2025 wurde beim Handelsregister des Amtsgerichts Leipzig die Liste der Mitglieder des Aufsichtsrats gemäß § 52 GmbHG eingereicht."
    },
    {
      "date": "2025-05-13",
      "id": "108887",
      "original_text": "Löschungsankündigung\nSachsen Amtsgericht Dresden HRB 36966\nGlücksfabrik UG (haftungsbeschränkt) – Dresden",
      "type": "Löschungsankündigung",
      "state": "Sachsen",
      "amtsgericht": "Amtsgericht Dresden",
      "registernummer": "HRB 36966",
      "registerart": "HRB",
      "company_name": "Glücksfabrik UG (haftungsbeschränkt)",
      "company_seat": "Dresden",
      "details": "13.05.2025 (Bekanntmachungsdatum)\n\nSachsen Amtsgericht Dresden HRB 36966\nLöschungsankündigung\n\nGlücksfabrik UG (haftungsbeschränkt)\nGesellschaft mit beschränkter Haftung\nDresden\n\nDas Registergericht beabsichtigt, die im Handelsregister eingetragene Gesellschaft von Amts wegen nach § 394 FamFG zu löschen. Die Frist zu Erhebung eines Widerspruchs gegen die beabsichtigte Löschung wird auf einen Monat festgesetzt."
    },
    {
      "date": "2025-05-13",
      "id": "108888",
      "original_text": "Löschungsankündigung\nSachsen Amtsgericht Dresden HRB 18272\nAuto Service Dresden-Süd GmbH – Dresden",
      "type": "Löschungsankündigung",
      "state": "Sachsen",
      "amtsgericht": "Amtsgericht Dresden",
      "registernummer": "HRB 18272",
      "registerart": "HRB",
      "company_name": "Auto Service Dresden-Süd GmbH",
      "company_seat": "Dresden",
      "details": "13.05.2025 (Bekanntmachungsdatum)\n\nSachsen Amtsgericht Dresden HRB 18272\nLöschungsankündigung\n\nAuto Service Dresden-Süd GmbH\nGesellschaft mit beschränkter Haftung\nDresden\n\nDas Registergericht beabsichtigt, die im Handelsregister eingetragene Gesellschaft von Amts wegen nach § 394 FamFG zu löschen. Die Frist zu Erhebung eines Widerspruchs gegen die beabsichtigte Löschung wird auf einen Monat festgesetzt."
    },
    {
      "date": "2025-05-13",
      "id": "108889",
      "original_text": "Löschungsankündigung\nSachsen Amtsgericht Dresden HRB 38652\nFull Detail Luxury Car Care UG (haftungsbeschränkt) – Dresden",
      "type": "Löschungsankündigung",
      "state": "Sachsen",
      "amtsgericht": "Amtsgericht Dresden",
      "registernummer": "HRB 38652",
      "registerart": "HRB",
      "company_name": "Full Detail Luxury Car Care UG (haftungsbeschränkt)",
      "company_seat": "Dresden",
      "details": "13.05.2025 (Bekanntmachungsdatum)\n\nSachsen Amtsgericht Dresden HRB 38652\nLöschungsankündigung\n\nFull Detail Luxury Car Care UG (haftungsbeschränkt)\nGesellschaft mit beschränkter Haftung\nDresden\n\nDas Registergericht beabsichtigt, die im Handelsregister eingetragene Gesellschaft von Amts wegen nach § 394 FamFG zu löschen. Die Frist zu Erhebung eines Widerspruchs gegen die beabsichtigte Löschung wird auf einen Monat festgesetzt."
    },
    {
      "date": "2025-05-13",
      "id": "108890",
      "original_text": "Löschungsankündigung\nSachsen Amtsgericht Dresden HRB 32657\nStahl- und Feineisenbau Pirna UG (haftungsbeschränkt) – Pirna",
      "type": "Löschungsankündigung",
      "state": "Sachsen",
      "amtsgericht": "Amtsgericht Dresden",
      "registernummer": "HRB 32657",
      "registerart": "HRB",
      "company_name": "Stahl- und Feineisenbau Pirna UG (haftungsbeschränkt)",
      "company_seat": "Pirna",
      "details": "13.05.2025 (Bekanntmachungsdatum)\n\nSachsen Amtsgericht Dresden HRB 32657\nLöschungsankündigung\n\nStahl- und Feineisenbau Pirna UG (haftungsbeschränkt)\nGesellschaft mit beschränkter Haftung\nPirna\n\nDas Registergericht beabsichtigt, die im Handelsregister eingetragene Gesellschaft von Amts wegen nach § 394 FamFG zu löschen. Die Frist zu Erhebung eines Widerspruchs gegen die beabsichtigte Löschung wird auf einen Monat festgesetzt."
    },
    {
      "date": "2025-05-13",
      "id": "108891",
      "original_text": "Löschungsankündigung\nSachsen Amtsgericht Dresden HRB 663\nAbwicklungsgesellschaft NGN Schützenstr. mbH – Nossen",
      "type": "Löschungsankündigung",
      "state": "Sachsen",
      "amtsgericht": "Amtsgericht Dresden",
      "registernummer": "HRB 663",
      "registerart": "HRB",
      "company_name": "Abwicklungsgesellschaft NGN Schützenstr. mbH",
      "company_seat": "Nossen",
      "details": "13.05.2025 (Bekanntmachungsdatum)\n\nSachsen Amtsgericht Dresden HRB 663\nLöschungsankündigung\n\nAbwicklungsgesellschaft NGN Schützenstr. mbH\nGesellschaft mit beschränkter Haftung\nNossen\n\nDas Registergericht beabsichtigt, die im Handelsregister eingetragene Gesellschaft von Amts wegen nach § 394 FamFG zu löschen. Die Frist zu Erhebung eines Widerspruchs gegen die beabsichtigte Löschung wird auf einen Monat festgesetzt."
    },
    {
      "date": "2025-05-13",
      "id": "108892",
      "original_text": "Löschungsankündigung\nSachsen Amtsgericht Leipzig HRB 43019\nBTH Anlagenservice GmbH – Leipzig",
      "type": "Löschungsankündigung",
      "state": "Sachsen",
      "amtsgericht": "Amtsgericht Leipzig",
      "registernummer": "HRB 43019",
      "registerart": "HRB",
      "company_name": "BTH Anlagenservice GmbH",
      "company_seat": "Leipzig",
      "details": "13.05.2025 (Bekanntmachungsdatum)\n\nSachsen Amtsgericht Leipzig HRB 43019\nLöschungsankündigung 13.05.2025 (Eintragungsdatum)\n\nBTH Anlagenservice GmbH\nGesellschaft mit beschränkter Haftung\nLeipzig\n\nDas Registergericht beabsichtigt, die im Handelsregister eingetragene Gesellschaft von Amts wegen nach § 394 FamFG zu löschen. Die Frist zu Erhebung eines Widerspruchs gegen die beabsichtigte Löschung wird auf einen Monat festgesetzt."
    },
    {
      "date": "2025-05-13",
      "id": "108893",
      "original_text": "Registerbekanntmachung nach dem Umwandlungsgesetz\nNiedersachsen Amtsgericht Hannover HRB 221852\nKuhlmanns Hof Verwaltung GmbH – Burgwedel",
      "type": "Registerbekanntmachung nach dem Umwandlungsgesetz",
      "state": "Niedersachsen",
      "amtsgericht": "Amtsgericht Hannover",
      "registernummer": "HRB 221852",
      "registerart": "HRB",
      "company_name": "Kuhlmanns Hof Verwaltung GmbH",
      "company_seat": "Burgwedel",
      "details": "13.05.2025 (Bekanntmachungsdatum)\n\nNiedersachsen Amtsgericht Hannover HRB 221852\nRegisterbekanntmachung nach dem Umwandlungsgesetz 13.05.2025 (Eintragungsdatum)\n\nKuhlmanns Hof Verwaltung GmbH\nGesellschaft mit beschränkter Haftung\nBurgwedel\n\nDen Gläubigern der an der Verschmelzung beteiligten Rechtsträger ist, wenn sie binnen sechs Monaten nach dem Tag, an dem die Eintragung der Verschmelzung in das Register des Sitzes desjenigen Rechtsträgers, dessen Gläubiger sie sind, nach § 19  Abs.  3 UmwG als bekannt gemacht gilt, ihren Anspruch nach Grund und Höhe schriftlich anmelden, Sicherheit zu leisten, soweit sie nicht Befriedigung verlangen können. Dieses Recht steht den Gläubigern jedoch nur zu, wenn sie glaubhaft machen, dass durch die Verschmelzung die Erfüllung der Forderung gefährdet wird."
    },
    {
      "date": "2025-05-13",
      "id": "108894",
      "original_text": "Registerbekanntmachung nach dem Umwandlungsgesetz\nNiedersachsen Amtsgericht Aurich HRB 206774\nWEC Turmbau GmbH – Aurich",
      "type": "Registerbekanntmachung nach dem Umwandlungsgesetz",
      "state": "Niedersachsen",
      "amtsgericht": "Amtsgericht Aurich",
      "registernummer": "HRB 206774",
      "registerart": "HRB",
      "company_name": "WEC Turmbau GmbH",
      "company_seat": "Aurich",
      "details": "13.05.2025 (Bekanntmachungsdatum)\n\nNiedersachsen Amtsgericht Aurich HRB 206774\nRegisterbekanntmachung nach dem Umwandlungsgesetz 13.05.2025 (Eintragungsdatum)\n\nWEC Turmbau GmbH\nGesellschaft mit beschränkter Haftung\nAurich\n\nDen Gläubigern der an der Verschmelzung beteiligten Rechtsträger ist, wenn sie binnen sechs Monaten nach dem Tag, an dem die Eintragung der Verschmelzung in das Register des Sitzes desjenigen Rechtsträgers, dessen Gläubiger sie sind, nach § 19  Abs.  3 UmwG als bekannt gemacht gilt, ihren Anspruch nach Grund und Höhe schriftlich anmelden, Sicherheit zu leisten, soweit sie nicht Befriedigung verlangen können. Dieses Recht steht den Gläubigern jedoch nur zu, wenn sie glaubhaft machen, dass durch die Verschmelzung die Erfüllung der Forderung gefährdet wird."
    },
    {
      "date": "2025-05-13",
      "id": "108895",
      "original_text": "Registerbekanntmachung nach dem Umwandlungsgesetz\nNiedersachsen Amtsgericht Aurich HRB 204516\nENERCON Field Services GmbH – Aurich",
      "type": "Registerbekanntmachung nach dem Umwandlungsgesetz",
      "state": "Niedersachsen",
      "amtsgericht": "Amtsgericht Aurich",
      "registernummer": "HRB 204516",
      "registerart": "HRB",
      "company_name": "ENERCON Field Services GmbH",
      "company_seat": "Aurich",
      "details": "13.05.2025 (Bekanntmachungsdatum)\n\nNiedersachsen Amtsgericht Aurich HRB 204516\nRegisterbekanntmachung nach dem Umwandlungsgesetz 13.05.2025 (Eintragungsdatum)\n\nENERCON Field Services GmbH\nGesellschaft mit beschränkter Haftung\nAurich\n\nDen Gläubigern der an der Verschmelzung beteiligten Rechtsträger ist, wenn sie binnen sechs Monaten nach dem Tag, an dem die Eintragung der Verschmelzung in das Register des Sitzes desjenigen Rechtsträgers, dessen Gläubiger sie sind, nach § 19  Abs.  3 UmwG als bekannt gemacht gilt, ihren Anspruch nach Grund und Höhe schriftlich anmelden, Sicherheit zu leisten, soweit sie nicht Befriedigung verlangen können. Dieses Recht steht den Gläubigern jedoch nur zu, wenn sie glaubhaft machen, dass durch die Verschmelzung die Erfüllung der Forderung gefährdet wird."
    },
    {
      "date": "2025-05-13",
      "id": "108896",
      "original_text": "Registerbekanntmachung nach dem Umwandlungsgesetz\nNiedersachsen Amtsgericht Oldenburg (Oldenburg) HRB 220294\nMathias Brinker Holding GmbH – Wardenburg",
      "type": "Registerbekanntmachung nach dem Umwandlungsgesetz",
      "state": "Niedersachsen",
      "amtsgericht": "Amtsgericht Oldenburg (Oldenburg)",
      "registernummer": "HRB 220294",
      "registerart": "HRB",
      "company_name": "Mathias Brinker Holding GmbH",
      "company_seat": "Wardenburg",
      "details": "13.05.2025 (Bekanntmachungsdatum)\n\nNiedersachsen Amtsgericht Oldenburg (Oldenburg) HRB 220294\nRegisterbekanntmachung nach dem Umwandlungsgesetz 13.05.2025 (Eintragungsdatum)\n\nMathias Brinker Holding GmbH\nGesellschaft mit beschränkter Haftung\nWardenburg\n\nDen Gläubigern der an der formwechselnden Umwandlung beteiligten Rechtsträger ist, wenn sie binnen sechs Monaten nach dem Tag, an dem die Eintragung der Umwandlung in das Register des Sitzes desjenigen Rechtsträgers, dessen Gläubiger sie sind, nach § 19 Abs. 3 UmwG als bekannt gemacht gilt, ihren Anspruch nach Grund und Höhe schriftlich anmelden, Sicherheit zu leisten, soweit sie nicht Befriedigung verlangen können. Dieses Recht steht den Gläubigern jedoch nur zu, wenn sie glaubhaft machen, dass durch die formwechselnde Umwandlung die Erfüllung der Forderung gefährdet wird."
    },
    {
      "date": "2025-05-13",
      "id": "108897",
      "original_text": "Löschungsankündigung\nRheinland-Pfalz Amtsgericht Koblenz HRB 24780\nTeam North Motorsport UG (haftungsbeschränkt) – Leimbach",
      "type": "Löschungsankündigung",
      "state": "Rheinland-Pfalz",
      "amtsgericht": "Amtsgericht Koblenz",
      "registernummer": "HRB 24780",
      "registerart": "HRB",
      "company_name": "Team North Motorsport UG (haftungsbeschränkt)",
      "company_seat": "Leimbach",
      "details": "13.05.2025 (Bekanntmachungsdatum)\n\nRheinland-Pfalz Amtsgericht Koblenz HRB 24780\nLöschungsankündigung\n\nTeam North Motorsport UG (haftungsbeschränkt)\nGesellschaft mit beschränkter Haftung\nLeimbach\n\nDas Registergericht beabsichtigt die Gesellschaft von Amts wegen nach § 394 FamFG zu löschen. Die Frist zur Erhebung eines Widerspruchs ist auf zwei Monate festgesetzt."
    },
    {
      "date": "2025-05-13",
      "id": "108898",
      "original_text": "Löschungsankündigung\nRheinland-Pfalz Amtsgericht Bad Kreuznach HRA 20595\nExpertus IT e.K. – Bad Kreuznach",
      "type": "Löschungsankündigung",
      "state": "Rheinland-Pfalz",
      "amtsgericht": "Amtsgericht Bad Kreuznach",
      "registernummer": "HRA 20595",
      "registerart": "HRA",
      "company_name": "Expertus IT e.K.",
      "company_seat": "Bad Kreuznach",
      "details": "13.05.2025 (Bekanntmachungsdatum)\n\nRheinland-Pfalz Amtsgericht Bad Kreuznach HRA 20595\nLöschungsankündigung\n\nExpertus IT e.K.\nEinzelkaufmann / Einzelkauffrau\nBad Kreuznach\n\nDas Registergericht beabsichtigt die Firma von Amts wegen nach § 31 Abs. 2 HGB, § 393 FamFG zu löschen. Die Frist zur Erhebung eines Widerspruchs ist auf einen Monat festgesetzt."
    },
    {
      "date": "2025-05-13",
      "id": "108899",
      "original_text": "Einreichung neuer Dokumente\nRheinland-Pfalz Amtsgericht Ludwigshafen a.Rhein (Ludwigshafen) HRB 3302\nTZL-TechnologieZentrum Ludwigshafen am Rhein GmbH – Ludwigshafen/Rh.",
      "type": "Einreichung neuer Dokumente",
      "state": "Rheinland-Pfalz",
      "amtsgericht": "Amtsgericht Ludwigshafen a.Rhein (Ludwigshafen)",
      "registernummer": "HRB 3302",
      "registerart": "HRB",
      "company_name": "TZL-TechnologieZentrum Ludwigshafen am Rhein GmbH",
      "company_seat": "Ludwigshafen/Rh.",
      "details": "13.05.2025 (Bekanntmachungsdatum)\n\nRheinland-Pfalz Amtsgericht Ludwigshafen a.Rhein (Ludwigshafen) HRB 3302\nEinreichung neuer Dokumente\n\nTZL-TechnologieZentrum Ludwigshafen am Rhein GmbH\nGesellschaft mit beschränkter Haftung\nLudwigshafen/Rh.\n\nDem Registergericht ist eine neue Liste der Mitglieder des Aufsichtsrates eingereicht worden."
    },
    {
      "date": "2025-05-13",
      "id": "108900",
      "original_text": "Löschungsankündigung\nRheinland-Pfalz Amtsgericht Ludwigshafen a.Rhein (Ludwigshafen) HRB 63052\nA I G GmbH – Ludwigshafen",
      "type": "Löschungsankündigung",
      "state": "Rheinland-Pfalz",
      "amtsgericht": "Amtsgericht Ludwigshafen a.Rhein (Ludwigshafen)",
      "registernummer": "HRB 63052",
      "registerart": "HRB",
      "company_name": "A I G GmbH",
      "company_seat": "Ludwigshafen",
      "details": "13.05.2025 (Bekanntmachungsdatum)\n\nRheinland-Pfalz Amtsgericht Ludwigshafen a.Rhein (Ludwigshafen) HRB 63052\nLöschungsankündigung\n\nA I G GmbH\nGesellschaft mit beschränkter Haftung\nLudwigshafen\n\nDas Registergericht beabsichtigt die Gesellschaft von Amts wegen nach § 394 FamFG zu löschen. Die Frist zur Erhebung eines Widerspruchs ist auf einen Monat festgesetzt."
    },
    {
      "date": "2025-05-13",
      "id": "108901",
      "original_text": "Registerbekanntmachung nach dem Umwandlungsgesetz\nRheinland-Pfalz Amtsgericht Koblenz HRB 23465\nmps public solutions gmbh – Koblenz",
      "type": "Registerbekanntmachung nach dem Umwandlungsgesetz",
      "state": "Rheinland-Pfalz",
      "amtsgericht": "Amtsgericht Koblenz",
      "registernummer": "HRB 23465",
      "registerart": "HRB",
      "company_name": "mps public solutions gmbh",
      "company_seat": "Koblenz",
      "details": "13.05.2025 (Bekanntmachungsdatum)\n\nRheinland-Pfalz Amtsgericht Koblenz HRB 23465\nRegisterbekanntmachung nach dem Umwandlungsgesetz 24.03.2025 (Eintragungsdatum)\n\nmps public solutions gmbh\nGesellschaft mit beschränkter Haftung\nKoblenz\n\nAls nicht eingetragen wird veröffentlicht: Den Gläubigern der an der Verschmelzung beteiligten Rechtsträger ist, wenn sie binnen sechs Monaten nach dem Tag, an dem die Eintragung der Verschmelzung in das Register des Sitzes desjenigen Rechtsträgers,dessen Gläubiger sie sind, nach § 19 Abs. 3 UmwG als bekannt gemacht gilt, ihren Anspruch nach Grund und Höhe schriftlich anmelden, Sicherheit zu leisten, soweit sie nicht Befriedigung verlangen können. Dieses Recht steht den Gläubigern jedoch nur zu, wenn sie glaubhaft machen, dass durch die Verschmelzung die Erfüllungd er Forderung gefährdet wird."
    },
    {
      "date": "2025-05-13",
      "id": "108902",
      "original_text": "Sonstige Registerbekanntmachung\nRheinland-Pfalz Amtsgericht Ludwigshafen a.Rhein (Ludwigshafen) HRB 5331\nBASF Logistics GmbH – Frankenthal/Pfalz",
      "type": "Sonstige Registerbekanntmachung",
      "state": "Rheinland-Pfalz",
      "amtsgericht": "Amtsgericht Ludwigshafen a.Rhein (Ludwigshafen)",
      "registernummer": "HRB 5331",
      "registerart": "HRB",
      "company_name": "BASF Logistics GmbH",
      "company_seat": "Frankenthal/Pfalz",
      "details": "13.05.2025 (Bekanntmachungsdatum)\n\nRheinland-Pfalz Amtsgericht Ludwigshafen a.Rhein (Ludwigshafen) HRB 5331\nSonstige Registerbekanntmachung\n\nBASF Logistics GmbH\nGesellschaft mit beschränkter Haftung\nFrankenthal/Pfalz\n\nDem Registergericht ist eine neue Liste der Mitglieder des Aufsichtsrates eingereicht worden."
    },
    {
      "date": "2025-05-13",
      "id": "108903",
      "original_text": "Registerbekanntmachung nach dem Umwandlungsgesetz\nNordrhein-Westfalen Amtsgericht Düsseldorf HRB 90668\nParfümerie Douglas Megastore GmbH – Düsseldorf",
      "type": "Registerbekanntmachung nach dem Umwandlungsgesetz",
      "state": "Nordrhein-Westfalen",
      "amtsgericht": "Amtsgericht Düsseldorf",
      "registernummer": "HRB 90668",
      "registerart": "HRB",
      "company_name": "Parfümerie Douglas Megastore GmbH",
      "company_seat": "Düsseldorf",
      "details": "13.05.2025 (Bekanntmachungsdatum)\n\nNordrhein-Westfalen Amtsgericht Düsseldorf HRB 90668\nRegisterbekanntmachung nach dem Umwandlungsgesetz 13.05.2025 (Eintragungsdatum)\n\nParfümerie Douglas Megastore GmbH\nGesellschaft mit beschränkter Haftung\nDüsseldorf\n\nDen Gläubigern der an der Verschmelzung beteiligten Rechtsträger ist, wenn sie binnen sechs Monaten nach dem Tag, an dem die Eintragung der Verschmelzung in das Register des Sitzes desjenigen Rechtsträgers, dessen Gläubiger sie sind, nach § 19 Absatz 3 UmwG als bekanntgemacht gilt, ihren Anspruch nach Grund und Höhe schriftlich anmelden, Sicherheit zu leisten, soweit sie nicht Befriedigung verlangen können. Dieses Recht steht den Gläubigern jedoch nur zu, wenn sie glaubhaft machen, dass durch die Verschmelzung die Erfüllung ihrer Forderung gefährdet wird."
    },
    {
      "date": "2025-05-13",
      "id": "108904",
      "original_text": "Löschungsankündigung\nNordrhein-Westfalen Amtsgericht Kleve HRB 16078\nRPS GmbH – Goch",
      "type": "Löschungsankündigung",
      "state": "Nordrhein-Westfalen",
      "amtsgericht": "Amtsgericht Kleve",
      "registernummer": "HRB 16078",
      "registerart": "HRB",
      "company_name": "RPS GmbH",
      "company_seat": "Goch",
      "details": "13.05.2025 (Bekanntmachungsdatum)\n\nNordrhein-Westfalen Amtsgericht Kleve HRB 16078\nLöschungsankündigung\n\nRPS GmbH\nGesellschaft mit beschränkter Haftung\nGoch\n\nDas Registergericht beabsichtigt die Gesellschaft von Amts wegen nach § 394 FamFG zu löschen. Die Frist zur Erhebung eines Widerspruchs ist auf einen Monat festgesetzt."
    },
    {
      "date": "2025-05-13",
      "id": "108905",
      "original_text": "Löschungsankündigung\nNordrhein-Westfalen Amtsgericht Köln HRB 100454\nEB Capital Support UG (haftungsbeschränkt) – Köln",
      "type": "Löschungsankündigung",
      "state": "Nordrhein-Westfalen",
      "amtsgericht": "Amtsgericht Köln",
      "registernummer": "HRB 100454",
      "registerart": "HRB",
      "company_name": "EB Capital Support UG (haftungsbeschränkt)",
      "company_seat": "Köln",
      "details": "13.05.2025 (Bekanntmachungsdatum)\n\nNordrhein-Westfalen Amtsgericht Köln HRB 100454\nLöschungsankündigung\n\nEB Capital Support UG (haftungsbeschränkt)\nGesellschaft mit beschränkter Haftung\nKöln\n\nDas Registergericht beabsichtigt die Gesellschaft von Amts wegen nach § 394 FamFG zu löschen. Die Frist zur Erhebung eines Widerspruchs ist auf einen Monat festgesetzt."
    },
    {
      "date": "2025-05-13",
      "id": "108906",
      "original_text": "Registerbekanntmachung nach dem Umwandlungsgesetz\nNordrhein-Westfalen Amtsgericht Steinfurt HRB 15433\nSportpferde Frederick Troschke GmbH – Lienen",
      "type": "Registerbekanntmachung nach dem Umwandlungsgesetz",
      "state": "Nordrhein-Westfalen",
      "amtsgericht": "Amtsgericht Steinfurt",
      "registernummer": "HRB 15433",
      "registerart": "HRB",
      "company_name": "Sportpferde Frederick Troschke GmbH",
      "company_seat": "Lienen",
      "details": "13.05.2025 (Bekanntmachungsdatum)\n\nNordrhein-Westfalen Amtsgericht Steinfurt HRB 15433\nRegisterbekanntmachung nach dem Umwandlungsgesetz 13.05.2025 (Eintragungsdatum)\n\nSportpferde Frederick Troschke GmbH\nGesellschaft mit beschränkter Haftung\nLienen\n\nDen Gläubigern der an der Ausgliederung beteiligten Rechtsträger ist, wenn sie binnen sechs Monaten nach dem Tag, an dem die Eintragung der Ausgliederung in das Register des Sitzes derjenigen Rechtsträger deren Gläubiger sie sind, nach § 19 Absatz 3 UmwG als bekanntgemacht gilt, ihren Anspruch nach Grund und Höhe schriftlich anmelden, Sicherheit zu leisten, soweit sie nicht Befriedigung verlangen können. Dieses Recht steht den Gläubigern jedoch nur zu, wenn sie glaubhaft machen, dass durch die Ausgliederung die Erfüllung ihrer Forderung gefährdet wird."
    },
    {
      "date": "2025-05-13",
      "id": "108907",
      "original_text": "Registerbekanntmachung nach dem Umwandlungsgesetz\nNordrhein-Westfalen Amtsgericht Düren VR 20371 früher Amtsgericht Jülich\nTTC 1956 Rödingen- Höllen – Titz-Rödingen",
      "type": "Registerbekanntmachung nach dem Umwandlungsgesetz",
      "state": "Nordrhein-Westfalen",
      "amtsgericht": "Amtsgericht Düren",
      "registernummer": "VR 20371",
      "registerart": "VR",
      "company_name": "TTC 1956 Rödingen- Höllen",
      "company_seat": "Titz-Rödingen",
      "former_amtsgericht": "Jülich",
      "details": "13.05.2025 (Bekanntmachungsdatum)\n\nNordrhein-Westfalen Amtsgericht Düren VR 20371 früher Amtsgericht Jülich\nRegisterbekanntmachung nach dem Umwandlungsgesetz 13.05.2025 (Eintragungsdatum)\n\nTTC 1956 Rödingen- Höllen\neingetragener Verein\nTitz-Rödingen\n\nDen Gläubigern der an der Verschmelzung beteiligten Rechtsträger ist, wenn sie binnen sechs Monaten nach dem Tag, an dem die Eintragung der Verschmelzung in das Register des Sitzes desjenigen Rechtsträgers, dessen Gläubiger sie sind, nach § 19 Absatz 3 UmwG als bekanntgemacht gilt, ihren Anspruch nach Grund und Höhe schriftlich anmelden, Sicherheit zu leisten, soweit sie nicht Befriedigung verlangen können. Dieses Recht steht den Gläubigern jedoch nur zu, wenn sie glaubhaft machen, dass durch die Verschmelzung die Erfüllung ihrer Forderung gefährdet wird."
    },
    {
      "date": "2025-05-13",
      "id": "108908",
      "original_text": "Registerbekanntmachung nach dem Umwandlungsgesetz\nNordrhein-Westfalen Amtsgericht Köln HRB 43448\nANGA Steuerberatungsgesellschaft mbH – Hürth",
      "type": "Registerbekanntmachung nach dem Umwandlungsgesetz",
      "state": "Nordrhein-Westfalen",
      "amtsgericht": "Amtsgericht Köln",
      "registernummer": "HRB 43448",
      "registerart": "HRB",
      "company_name": "ANGA Steuerberatungsgesellschaft mbH",
      "company_seat": "Hürth",
      "details": "13.05.2025 (Bekanntmachungsdatum)\n\nNordrhein-Westfalen Amtsgericht Köln HRB 43448\nRegisterbekanntmachung nach dem Umwandlungsgesetz 13.05.2025 (Eintragungsdatum)\n\nANGA Steuerberatungsgesellschaft mbH\nGesellschaft mit beschränkter Haftung\nHürth\n\nDen Gläubigern der an der Verschmelzung beteiligten Rechtsträger ist, wenn sie binnen sechs Monaten nach dem Tag, an dem die Eintragung der Verschmelzung in das Register des Sitzes desjenigen Rechtsträgers, dessen Gläubiger sie sind, nach § 19 Absatz 3 UmwG als bekanntgemacht gilt, ihren Anspruch nach Grund und Höhe schriftlich anmelden, Sicherheit zu leisten, soweit sie nicht Befriedigung verlangen können. Dieses Recht steht den Gläubigern jedoch nur zu, wenn sie glaubhaft machen, dass durch die Verschmelzung die Erfüllung ihrer Forderung gefährdet wird."
    },
    {
      "date": "2025-05-13",
      "id": "108909",
      "original_text": "Löschungsankündigung\nNordrhein-Westfalen Amtsgericht Neuss HRB 22296\nkfz schadenregulierer GmbH – Meerbusch",
      "type": "Löschungsankündigung",
      "state": "Nordrhein-Westfalen",
      "amtsgericht": "Amtsgericht Neuss",
      "registernummer": "HRB 22296",
      "registerart": "HRB",
      "company_name": "kfz schadenregulierer GmbH",
      "company_seat": "Meerbusch",
      "details": "13.05.2025 (Bekanntmachungsdatum)\n\nNordrhein-Westfalen Amtsgericht Neuss HRB 22296\nLöschungsankündigung 09.05.2025 (Eintragungsdatum)\n\nkfz schadenregulierer GmbH\nGesellschaft mit beschränkter Haftung\nMeerbusch\n\nDas Registergericht beabsichtigt die Gesellschaft von Amts wegen nach § 394 FamFG zu löschen. Die Frist zur Erhebung eines Widerspruchs ist auf einen Monat festgesetzt. Rechtsbehelfsbelehrung: Gegen diese Verfügung können Sie Widerspruch einlegen. Der Widerspruch ist bei dem Amtsgericht Neuss - Registergericht -, Breite Str. 48, 41460 Neuss schriftlich in deutscher Sprache oder zur Niederschrift der Geschäftsstelle einzulegen. Der Widerspruch kann auch zur Niederschrift der Geschäftsstelle eines jeden Amtsgerichtes abgegeben werden. Die Einlegung ist auch durch Übertragung eines elektronischen Dokuments an die elektronische Poststelle des Gerichts möglich. Das elektronische Dokument muss für die Bearbeitung durch das Gericht geeignet und mit einer qualifizierten elektronischen Signatur der verantwortenden Person versehen sein oder von der verantwortenden Person signiert und auf einem sicheren Übermittlungsweg gemäß § 130a ZPO nach näherer Maßgabe der Verordnung über die technischen Rahmenbedingungen des elektronischen Rechtsverkehrs und über das besondere elektronische Behördenpostfach (BGBl. I, S.3803) eingereicht werden. Weitere Informationen erhalten Sie auf der Internetseite www.justiz.de. Der Widerspruch muss spätestens innerhalb der gesetzten Frist nach der schriftlichen Bekanntgabe der Verfügung bei dem Amtsgericht - Registergericht - Neuss eingegangen sein. Dies gilt auch dann, wenn der Widerspruch zur Niederschrift der Geschäftsstelle eines anderen Amtsgerichtes abgegeben wurde. Die Frist beginnt mit der schriftlichen Bekanntgabe der Verfügung. Die Bekanntgabe ist entweder durch Zustellung oder am dritten Tage nach Aufgabe zur Post bewirkt. Fällt das Ende der Frist auf einen Sonntag, einen allgemeinen Feiertag oder Sonnabend, so endet die Frist mit Ablauf des nächsten Werktages. Der Widerspruch muss die Bezeichnung der angefochtenen Verfügung sowie die Erklärung enthalten, dass Widerspruch gegen diese Verfügung eingelegt wird. Er ist zu unterzeichnen und soll begründet werden."
    },
    {
      "date": "2025-05-13",
      "id": "108910",
      "original_text": "Registerbekanntmachung nach dem Umwandlungsgesetz\nNordrhein-Westfalen Amtsgericht Düsseldorf HRB 23926\nWirtschaftsbetrieb für den Industrie-Club GmbH – Düsseldorf",
      "type": "Registerbekanntmachung nach dem Umwandlungsgesetz",
      "state": "Nordrhein-Westfalen",
      "amtsgericht": "Amtsgericht Düsseldorf",
      "registernummer": "HRB 23926",
      "registerart": "HRB",
      "company_name": "Wirtschaftsbetrieb für den Industrie-Club GmbH",
      "company_seat": "Düsseldorf",
      "details": "13.05.2025 (Bekanntmachungsdatum)\n\nNordrhein-Westfalen Amtsgericht Düsseldorf HRB 23926\nRegisterbekanntmachung nach dem Umwandlungsgesetz 13.05.2025 (Eintragungsdatum)\n\nWirtschaftsbetrieb für den Industrie-Club GmbH\nGesellschaft mit beschränkter Haftung\nDüsseldorf\n\nDen Gläubigern der an der Verschmelzung beteiligten Rechtsträger ist, wenn sie binnen sechs Monaten nach dem Tag, an dem die Eintragung der Verschmelzung in das Register des Sitzes desjenigen Rechtsträgers, dessen Gläubiger sie sind, nach § 19 Absatz 3 UmwG als bekanntgemacht gilt, ihren Anspruch nach Grund und Höhe schriftlich anmelden, Sicherheit zu leisten, soweit sie nicht Befriedigung verlangen können. Dieses Recht steht den Gläubigern jedoch nur zu, wenn sie glaubhaft machen, dass durch die Verschmelzung die Erfüllung ihrer Forderung gefährdet wird."
    },
    {
      "date": "2025-05-13",
      "id": "108911",
      "original_text": "Löschungsankündigung\nNordrhein-Westfalen Amtsgericht Kleve HRB 16766\nEdelmetallhandel Rauber UG (haftungsbeschränkt) – Xanten",
      "type": "Löschungsankündigung",
      "state": "Nordrhein-Westfalen",
      "amtsgericht": "Amtsgericht Kleve",
      "registernummer": "HRB 16766",
      "registerart": "HRB",
      "company_name": "Edelmetallhandel Rauber UG (haftungsbeschränkt)",
      "company_seat": "Xanten",
      "details": "13.05.2025 (Bekanntmachungsdatum)\n\nNordrhein-Westfalen Amtsgericht Kleve HRB 16766\nLöschungsankündigung\n\nEdelmetallhandel Rauber UG (haftungsbeschränkt)\nGesellschaft mit beschränkter Haftung\nXanten\n\nDas Registergericht beabsichtigt die Gesellschaft von Amts wegen nach § 394 FamFG zu löschen. Die Frist zur Erhebung eines Widerspruchs ist auf einen Monat festgesetzt."
    },
    {
      "date": "2025-05-13",
      "id": "108912",
      "original_text": "Registerbekanntmachung nach dem Umwandlungsgesetz\nNordrhein-Westfalen Amtsgericht Düsseldorf HRB 87317\nALDI Langenfeld Verwaltungs-SE – Langenfeld",
      "type": "Registerbekanntmachung nach dem Umwandlungsgesetz",
      "state": "Nordrhein-Westfalen",
      "amtsgericht": "Amtsgericht Düsseldorf",
      "registernummer": "HRB 87317",
      "registerart": "HRB",
      "company_name": "ALDI Langenfeld Verwaltungs-SE",
      "company_seat": "Langenfeld",
      "details": "13.05.2025 (Bekanntmachungsdatum)\n\nNordrhein-Westfalen Amtsgericht Düsseldorf HRB 87317\nRegisterbekanntmachung nach dem Umwandlungsgesetz 13.05.2025 (Eintragungsdatum)\n\nALDI Langenfeld Verwaltungs-SE\nEuropäische Aktiengesellschaft (SE)\nLangenfeld\n\nDem Registergericht ist der Entwurf eines Vertrages über die geplante Verschmelzung der ALDI Langenfeld Verwaltungs_SE  mit Sitz in Langenfeld mit der ALDI Bingen Verwaltungs-SE  mit Sitz in Bingen eingereicht worden."
    },
    {
      "date": "2025-05-13",
      "id": "108913",
      "original_text": "Löschungsankündigung\nNordrhein-Westfalen Amtsgericht Neuss HRB 20636\nTyKa Share GmbH – Neuss",
      "type": "Löschungsankündigung",
      "state": "Nordrhein-Westfalen",
      "amtsgericht": "Amtsgericht Neuss",
      "registernummer": "HRB 20636",
      "registerart": "HRB",
      "company_name": "TyKa Share GmbH",
      "company_seat": "Neuss",
      "details": "13.05.2025 (Bekanntmachungsdatum)\n\nNordrhein-Westfalen Amtsgericht Neuss HRB 20636\nLöschungsankündigung 13.05.2025 (Eintragungsdatum)\n\nTyKa Share GmbH\nGesellschaft mit beschränkter Haftung\nNeuss\n\nDas Registergericht beabsichtigt die Gesellschaft von Amts wegen nach § 394 FamFG zu löschen. Die Frist zur Erhebung eines Widerspruchs ist auf einen Monat festgesetzt. Rechtsbehelfsbelehrung: Gegen diese Verfügung können Sie Widerspruch einlegen. Der Widerspruch ist bei dem Amtsgericht Neuss - Registergericht -, Breite Str. 48, 41460 Neuss schriftlich in deutscher Sprache oder zur Niederschrift der Geschäftsstelle einzulegen. Der Widerspruch kann auch zur Niederschrift der Geschäftsstelle eines jeden Amtsgerichtes abgegeben werden. Die Einlegung ist auch durch Übertragung eines elektronischen Dokuments an die elektronische Poststelle des Gerichts möglich. Das elektronische Dokument muss für die Bearbeitung durch das Gericht geeignet und mit einer qualifizierten elektronischen Signatur der verantwortenden Person versehen sein oder von der verantwortenden Person signiert und auf einem sicheren Übermittlungsweg gemäß § 130a ZPO nach näherer Maßgabe der Verordnung über die technischen Rahmenbedingungen des elektronischen Rechtsverkehrs und über das besondere elektronische Behördenpostfach (BGBl. I, S.3803) eingereicht werden. Weitere Informationen erhalten Sie auf der Internetseite www.justiz.de. Der Widerspruch muss spätestens innerhalb der gesetzten Frist nach der schriftlichen Bekanntgabe der Verfügung bei dem Amtsgericht - Registergericht - Neuss eingegangen sein. Dies gilt auch dann, wenn der Widerspruch zur Niederschrift der Geschäftsstelle eines anderen Amtsgerichtes abgegeben wurde. Die Frist beginnt mit der schriftlichen Bekanntgabe der Verfügung. Die Bekanntgabe ist entweder durch Zustellung oder am dritten Tage nach Aufgabe zur Post bewirkt. Fällt das Ende der Frist auf einen Sonntag, einen allgemeinen Feiertag oder Sonnabend, so endet die Frist mit Ablauf des nächsten Werktages. Der Widerspruch muss die Bezeichnung der angefochtenen Verfügung sowie die Erklärung enthalten, dass Widerspruch gegen diese Verfügung eingelegt wird. Er ist zu unterzeichnen und soll begründet werden."
    },
    {
      "date": "2025-05-13",
      "id": "108914",
      "original_text": "Löschungsankündigung\nNordrhein-Westfalen Amtsgericht Köln HRB 112762\nKoga Trading GmbH – Köln",
      "type": "Löschungsankündigung",
      "state": "Nordrhein-Westfalen",
      "amtsgericht": "Amtsgericht Köln",
      "registernummer": "HRB 112762",
      "registerart": "HRB",
      "company_name": "Koga Trading GmbH",
      "company_seat": "Köln",
      "details": "13.05.2025 (Bekanntmachungsdatum)\n\nNordrhein-Westfalen Amtsgericht Köln HRB 112762\nLöschungsankündigung\n\nKoga Trading GmbH\nGesellschaft mit beschränkter Haftung\nKöln\n\nDas Registergericht beabsichtigt die Gesellschaft von Amts wegen nach § 394 FamFG zu löschen. Die Frist zur Erhebung eines Widerspruchs ist auf einen Monat festgesetzt."
    },
    {
      "date": "2025-05-13",
      "id": "108915",
      "original_text": "Löschungsankündigung\nNordrhein-Westfalen Amtsgericht Köln HRB 110493\nMSI Menzel Structured Investments GmbH – Leverkusen",
      "type": "Löschungsankündigung",
      "state": "Nordrhein-Westfalen",
      "amtsgericht": "Amtsgericht Köln",
      "registernummer": "HRB 110493",
      "registerart": "HRB",
      "company_name": "MSI Menzel Structured Investments GmbH",
      "company_seat": "Leverkusen",
      "details": "13.05.2025 (Bekanntmachungsdatum)\n\nNordrhein-Westfalen Amtsgericht Köln HRB 110493\nLöschungsankündigung\n\nMSI Menzel Structured Investments GmbH\nGesellschaft mit beschränkter Haftung\nLeverkusen\n\nDas Registergericht beabsichtigt die Gesellschaft von Amts wegen nach § 394 FamFG zu löschen. Die Frist zur Erhebung eines Widerspruchs ist auf einen Monat festgesetzt."
    },
    {
      "date": "2025-05-13",
      "id": "108916",
      "original_text": "Registerbekanntmachung nach dem Umwandlungsgesetz\nNordrhein-Westfalen Amtsgericht Düsseldorf HRA 27730\nLysiros Aachen ME SARL & Co. KG – Düsseldorf",
      "type": "Registerbekanntmachung nach dem Umwandlungsgesetz",
      "state": "Nordrhein-Westfalen",
      "amtsgericht": "Amtsgericht Düsseldorf",
      "registernummer": "HRA 27730",
      "registerart": "HRA",
      "company_name": "Lysiros Aachen ME SARL & Co. KG",
      "company_seat": "Düsseldorf",
      "details": "13.05.2025 (Bekanntmachungsdatum)\n\nNordrhein-Westfalen Amtsgericht Düsseldorf HRA 27730\nDie Registerbekanntmachung ist nachträglich am 19.05.2025 um 20:01 Uhr gelöscht worden.\nWegen der Einzelheiten und näherer Auskünfte wenden Sie sich bitte an das Amtsgericht Düsseldorf ."
    },
    {
      "date": "2025-05-13",
      "id": "108917",
      "original_text": "Registerbekanntmachung nach dem Umwandlungsgesetz\nNordrhein-Westfalen Amtsgericht Düren VR 3017\nSpiel- und Sportverein Gevelsdorf-Rödingen e.V. – Titz",
      "type": "Registerbekanntmachung nach dem Umwandlungsgesetz",
      "state": "Nordrhein-Westfalen",
      "amtsgericht": "Amtsgericht Düren",
      "registernummer": "VR 3017",
      "registerart": "VR",
      "company_name": "Spiel- und Sportverein Gevelsdorf-Rödingen e.V.",
      "company_seat": "Titz",
      "details": "13.05.2025 (Bekanntmachungsdatum)\n\nNordrhein-Westfalen Amtsgericht Düren VR 3017\nRegisterbekanntmachung nach dem Umwandlungsgesetz 13.05.2025 (Eintragungsdatum)\n\nSpiel- und Sportverein Gevelsdorf-Rödingen e.V.\neingetragener Verein\nTitz\n\nDen Gläubigern der an der Verschmelzung beteiligten Rechtsträger ist, wenn sie binnen sechs Monaten nach dem Tag, an dem die Eintragung der Verschmelzung in das Register des Sitzes desjenigen Rechtsträgers, dessen Gläubiger sie sind, nach § 19 Absatz 3 UmwG als bekanntgemacht gilt, ihren Anspruch nach Grund und Höhe schriftlich anmelden, Sicherheit zu leisten, soweit sie nicht Befriedigung verlangen können. Dieses Recht steht den Gläubigern jedoch nur zu, wenn sie glaubhaft machen, dass durch die Verschmelzung die Erfüllung ihrer Forderung gefährdet wird."
    },
    {
      "date": "2025-05-13",
      "id": "108918",
      "original_text": "Löschungsankündigung\nNordrhein-Westfalen Amtsgericht Köln HRB 114695\nENNEU GmbH – Wipperfürth",
      "type": "Löschungsankündigung",
      "state": "Nordrhein-Westfalen",
      "amtsgericht": "Amtsgericht Köln",
      "registernummer": "HRB 114695",
      "registerart": "HRB",
      "company_name": "ENNEU GmbH",
      "company_seat": "Wipperfürth",
      "details": "13.05.2025 (Bekanntmachungsdatum)\n\nNordrhein-Westfalen Amtsgericht Köln HRB 114695\nLöschungsankündigung\n\nENNEU GmbH\nGesellschaft mit beschränkter Haftung\nWipperfürth\n\nDas Registergericht beabsichtigt die Gesellschaft von Amts wegen nach § 394 FamFG zu löschen. Die Frist zur Erhebung eines Widerspruchs ist auf einen Monat festgesetzt."
    },
    {
      "date": "2025-05-13",
      "id": "108919",
      "original_text": "Registerbekanntmachung nach dem Umwandlungsgesetz\nNordrhein-Westfalen Amtsgericht Dortmund HRA 19742\nFrank Czech Notstromsysteme e.K. – Lünen",
      "type": "Registerbekanntmachung nach dem Umwandlungsgesetz",
      "state": "Nordrhein-Westfalen",
      "amtsgericht": "Amtsgericht Dortmund",
      "registernummer": "HRA 19742",
      "registerart": "HRA",
      "company_name": "Frank Czech Notstromsysteme e.K.",
      "company_seat": "Lünen",
      "details": "13.05.2025 (Bekanntmachungsdatum)\n\nNordrhein-Westfalen Amtsgericht Dortmund HRA 19742\nRegisterbekanntmachung nach dem Umwandlungsgesetz 13.05.2025 (Eintragungsdatum)\n\nFrank Czech Notstromsysteme e.K.\nEinzelkaufmann / Einzelkauffrau\nLünen\n\nDen Gläubigern der an der Ausgliederung beteiligten Rechtsträger ist, wenn sie binnen sechs Monaten nach dem Tag, an dem die Eintragung der Ausgliederung in das Register des Sitzes desjenigen Rechtsträgers, dessen Gläubiger sie sind, nach § 19 Absatz 3 UmwG als bekanntgemacht gilt, ihren Anspruch nach Grund und Höhe schriftlich anmelden, Sicherheit zu leisten, soweit sie nicht Befriedigung verlangen können. Dieses Recht steht den Gläubigern jedoch nur zu, wenn sie glaubhaft machen, dass durch die Ausgliederung die Erfüllung ihrer Forderung gefährdet wird."
    },
    {
      "date": "2025-05-13",
      "id": "108920",
      "original_text": "Löschungsankündigung\nNordrhein-Westfalen Amtsgericht Mönchengladbach HRB 17711\nAkar Design GmbH – Mönchengladbach",
      "type": "Löschungsankündigung",
      "state": "Nordrhein-Westfalen",
      "amtsgericht": "Amtsgericht Mönchengladbach",
      "registernummer": "HRB 17711",
      "registerart": "HRB",
      "company_name": "Akar Design GmbH",
      "company_seat": "Mönchengladbach",
      "details": "13.05.2025 (Bekanntmachungsdatum)\n\nNordrhein-Westfalen Amtsgericht Mönchengladbach HRB 17711\nLöschungsankündigung\n\nAkar Design GmbH\nGesellschaft mit beschränkter Haftung\nMönchengladbach\n\nDas Registergericht beabsichtigt, die im Handelsregister eingetragene Gesellschaft gemäß § 394 Absatz 1 FamFG wegen Vermögenslosigkeit von Amts wegen zu löschen. Gegen diese Verfügung kann Widerspruch eingelegt werden. Die Frist zur Erhebung eines Widerspruchs gegen die beabsichtigte Löschung von Amts wegen ist auf drei Monate festgesetzt."
    },
    {
      "date": "2025-05-13",
      "id": "108921",
      "original_text": "Registerbekanntmachung nach dem Umwandlungsgesetz\nNordrhein-Westfalen Amtsgericht Paderborn HRA 4470\nAuto-Risse Reiseunternehmen GmbH & Co. – Höxter",
      "type": "Registerbekanntmachung nach dem Umwandlungsgesetz",
      "state": "Nordrhein-Westfalen",
      "amtsgericht": "Amtsgericht Paderborn",
      "registernummer": "HRA 4470",
      "registerart": "HRA",
      "company_name": "Auto-Risse Reiseunternehmen GmbH & Co.",
      "company_seat": "Höxter",
      "details": "13.05.2025 (Bekanntmachungsdatum)\n\nNordrhein-Westfalen Amtsgericht Paderborn HRA 4470\nRegisterbekanntmachung nach dem Umwandlungsgesetz 13.05.2025 (Eintragungsdatum)\n\nAuto-Risse Reiseunternehmen GmbH & Co.\nKommanditgesellschaft\nHöxter\n\nDen Gläubigern der an der Abspaltung beteiligten Rechtsträger ist, wenn sie binnen sechs Monaten nach dem Tag, an dem die Eintragung der Abspaltung in das Register des Sitzes desjenigen Rechtsträgers, dessen Gläubiger sie sind, nach § 19 Absatz 3 UmwG als bekanntgemacht gilt, ihren Anspruch nach Grund und Höhe schriftlich anmelden, Sicherheit zu leisten, soweit sie nicht Befriedigung verlangen können. Dieses Recht steht den Gläubigern jedoch nur zu, wenn sie glaubhaft machen, dass durch die Abspaltung die Erfüllung ihrer Forderung gefährdet wird."
    },
    {
      "date": "2025-05-13",
      "id": "108922",
      "original_text": "Einreichung neuer Dokumente\nNordrhein-Westfalen Amtsgericht Hagen HRB 58\nha.ge.we Hagener Gemeinnützige Wohnungsgesellschaft mbH – Hagen",
      "type": "Einreichung neuer Dokumente",
      "state": "Nordrhein-Westfalen",
      "amtsgericht": "Amtsgericht Hagen",
      "registernummer": "HRB 58",
      "registerart": "HRB",
      "company_name": "ha.ge.we Hagener Gemeinnützige Wohnungsgesellschaft mbH",
      "company_seat": "Hagen",
      "details": "13.05.2025 (Bekanntmachungsdatum)\n\nNordrhein-Westfalen Amtsgericht Hagen HRB 58\nEinreichung neuer Dokumente\n\nha.ge.we Hagener Gemeinnützige Wohnungsgesellschaft mbH\nGesellschaft mit beschränkter Haftung\nHagen\n\nDie gesetzlichen Vertreter der Gesellschaft haben eine aktuelle Liste der Aufsichtsratsmitglieder zum Handelsregister eingereicht."
    },
    {
      "date": "2025-05-13",
      "id": "108923",
      "original_text": "Löschungsankündigung\nNordrhein-Westfalen Amtsgericht Düsseldorf HRB 94237\nMO´s Fahrdienst 24 GmbH – Düsseldorf",
      "type": "Löschungsankündigung",
      "state": "Nordrhein-Westfalen",
      "amtsgericht": "Amtsgericht Düsseldorf",
      "registernummer": "HRB 94237",
      "registerart": "HRB",
      "company_name": "MO´s Fahrdienst 24 GmbH",
      "company_seat": "Düsseldorf",
      "details": "13.05.2025 (Bekanntmachungsdatum)\n\nNordrhein-Westfalen Amtsgericht Düsseldorf HRB 94237\nLöschungsankündigung\n\nMO´s Fahrdienst 24 GmbH\nGesellschaft mit beschränkter Haftung\nDüsseldorf\n\nDas Registergericht beabsichtigt die Gesellschaft von Amts wegen nach § 394 FamFG zu löschen. Die Frist zur Erhebung eines Widerspruchs ist auf 3 Wochen festgesetzt.\n\nRechtsbehelfsbelehrung:\nDas Widerspruchsrecht steht jedem zu, der an der Unterlassung der Löschung ein berechtigtes Interesse hat. Der Widerspruch ist bei dem Amtsgericht Düsseldorf -Registergericht-, Werdener Straße 1, 40227 Düsseldorf schriftlich in deutscher Sprache oder zur Niederschrift der Geschäftsstelle einzulegen. Der Widerspruch kann auch zur Niederschrift der Geschäftsstelle eines jeden Amtsgerichtes abgegeben werden. Die Einlegung ist auch durch Übertragung eines elektronischen Dokuments an die elektronische Poststelle des Gerichts möglich. Das elektronische Dokument muss für die Bearbeitung durch das Gericht geeignet und mit einer qualifizierten elektronischen Signatur der verantwortenden Person versehen sein oder von der verantwortenden Person signiert und auf einem sicheren Übermittlungsweg gemäß § 130a ZPO nach näherer Maßgabe der Verordnung über die technischen Rahmenbedingungen des elektronischen Rechtsverkehrs und über das besondere elektronische Behördenpostfach (BGBl. I, S.3803) eingereicht werden. Weitere Informationen erhalten Sie auf der Internetseite www.justiz.de.\nDer Widerspruch muss spätestens innerhalb der gesetzten Frist nach dem Datum der Bekanntmachung der Löschungsankündigung bei dem Amtsgericht - Registergericht - Düsseldorf eingegangen sein.  Dies gilt auch dann, wenn der Widerspruch zur Niederschrift der Geschäftsstelle eines anderen Amtsgerichtes abgegeben wurde. Die Frist beginnt mit dem Tage der Bekanntmachung der Löschungsankündigung in dem für die Bekanntmachung der Eintragungen in das Handelsregister bestimmten elektronischen Informations- und Kommunikationssystem nach § 10 des Handelsgesetzbuches. Fällt das Ende der Frist auf einen Sonntag, einen allgemeinen Feiertag oder Sonnabend, so endet die Frist mit Ablauf des nächsten Werktages.\nDer Widerspruch muss die Bezeichnung der angefochtenen Löschungsankündigung sowie die Erklärung enthalten, dass Widerspruch gegen diese Löschungsankündigung eingelegt wird. Er ist zu unterzeichnen und soll begründet werden."
    },
    {
      "date": "2025-05-13",
      "id": "108924",
      "original_text": "Registerbekanntmachung nach dem Umwandlungsgesetz\nNordrhein-Westfalen Amtsgericht Steinfurt HRA 8390\nSportpferde Frederick Troschke e. K. – Lienen",
      "type": "Registerbekanntmachung nach dem Umwandlungsgesetz",
      "state": "Nordrhein-Westfalen",
      "amtsgericht": "Amtsgericht Steinfurt",
      "registernummer": "HRA 8390",
      "registerart": "HRA",
      "company_name": "Sportpferde Frederick Troschke e. K.",
      "company_seat": "Lienen",
      "details": "13.05.2025 (Bekanntmachungsdatum)\n\nNordrhein-Westfalen Amtsgericht Steinfurt HRA 8390\nRegisterbekanntmachung nach dem Umwandlungsgesetz 13.05.2025 (Eintragungsdatum)\n\nSportpferde Frederick Troschke e. K.\nEinzelkaufmann / Einzelkauffrau\nLienen\n\nDen Gläubigern der an der Ausgliederung beteiligten Rechtsträger ist, wenn sie binnen sechs Monaten nach dem Tag, an dem die Eintragung der Ausgliederung in das Register des Sitzes desjenigen Rechtsträgers, dessen Gläubiger sie sind, nach § 19 Absatz 3 UmwG als bekanntgemacht gilt, ihren Anspruch nach Grund und Höhe schriftlich anmelden, Sicherheit zu leisten, soweit sie nicht Befriedigung verlangen können. Dieses Recht steht den Gläubigern jedoch nur zu, wenn sie glaubhaft machen, dass durch die Ausgliederung die Erfüllung ihrer Forderung gefährdet wird."
    },
    {
      "date": "2025-05-13",
      "id": "108925",
      "original_text": "Registerbekanntmachung nach dem Umwandlungsgesetz\nNordrhein-Westfalen Amtsgericht Düsseldorf HRB 95202\nDouglas House of Beauty GmbH – Düsseldorf",
      "type": "Registerbekanntmachung nach dem Umwandlungsgesetz",
      "state": "Nordrhein-Westfalen",
      "amtsgericht": "Amtsgericht Düsseldorf",
      "registernummer": "HRB 95202",
      "registerart": "HRB",
      "company_name": "Douglas House of Beauty GmbH",
      "company_seat": "Düsseldorf",
      "details": "13.05.2025 (Bekanntmachungsdatum)\n\nNordrhein-Westfalen Amtsgericht Düsseldorf HRB 95202\nRegisterbekanntmachung nach dem Umwandlungsgesetz 13.05.2025 (Eintragungsdatum)\n\nDouglas House of Beauty GmbH\nGesellschaft mit beschränkter Haftung\nDüsseldorf\n\nDen Gläubigern der an der Verschmelzung beteiligten Rechtsträger ist, wenn sie binnen sechs Monaten nach dem Tag, an dem die Eintragung der Verschmelzung in das Register des Sitzes desjenigen Rechtsträgers, dessen Gläubiger sie sind, nach § 19 Absatz 3 UmwG als bekanntgemacht gilt, ihren Anspruch nach Grund und Höhe schriftlich anmelden, Sicherheit zu leisten, soweit sie nicht Befriedigung verlangen können. Dieses Recht steht den Gläubigern jedoch nur zu, wenn sie glaubhaft machen, dass durch die Verschmelzung die Erfüllung ihrer Forderung gefährdet wird."
    },
    {
      "date": "2025-05-13",
      "id": "108926",
      "original_text": "Registerbekanntmachung nach dem Umwandlungsgesetz\nNordrhein-Westfalen Amtsgericht Duisburg HRB 34611\nNagel & Family GmbH – Duisburg",
      "type": "Registerbekanntmachung nach dem Umwandlungsgesetz",
      "state": "Nordrhein-Westfalen",
      "amtsgericht": "Amtsgericht Duisburg",
      "registernummer": "HRB 34611",
      "registerart": "HRB",
      "company_name": "Nagel & Family GmbH",
      "company_seat": "Duisburg",
      "details": "13.05.2025 (Bekanntmachungsdatum)\n\nNordrhein-Westfalen Amtsgericht Duisburg HRB 34611\nRegisterbekanntmachung nach dem Umwandlungsgesetz 13.05.2025 (Eintragungsdatum)\n\nNagel & Family GmbH\nGesellschaft mit beschränkter Haftung\nDuisburg\n\nDie Gesellschaft hat Gläubigern, deren Forderungen vor dieser Bekanntmachung begründet worden sind, Sicherheit zu leisten, soweit sie nicht Befriedigung verlangen können, wenn sie sich binnen sechs Monaten zu diesem Zweck melden."
    },
    {
      "date": "2025-05-13",
      "id": "108927",
      "original_text": "Registerbekanntmachung nach dem Umwandlungsgesetz\nNordrhein-Westfalen Amtsgericht Duisburg HRB 31527\nNagel & Köpfe GmbH – Duisburg",
      "type": "Registerbekanntmachung nach dem Umwandlungsgesetz",
      "state": "Nordrhein-Westfalen",
      "amtsgericht": "Amtsgericht Duisburg",
      "registernummer": "HRB 31527",
      "registerart": "HRB",
      "company_name": "Nagel & Köpfe GmbH",
      "company_seat": "Duisburg",
      "details": "13.05.2025 (Bekanntmachungsdatum)\n\nNordrhein-Westfalen Amtsgericht Duisburg HRB 31527\nRegisterbekanntmachung nach dem Umwandlungsgesetz 13.05.2025 (Eintragungsdatum)\n\nNagel & Köpfe GmbH\nGesellschaft mit beschränkter Haftung\nDuisburg\n\nDie Gesellschaft hat Gläubigern, deren Forderungen vor dieser Bekanntmachung begründet worden sind, Sicherheit zu leisten, soweit sie nicht Befriedigung verlangen können, wenn sie sich binnen sechs Monaten zu diesem Zweck melden."
    },
    {
      "date": "2025-05-13",
      "id": "108928",
      "original_text": "Löschungsankündigung\nNordrhein-Westfalen Amtsgericht Wuppertal HRB 13532\n\"Augenoptik Haarde GmbH\" – Wuppertal",
      "type": "Löschungsankündigung",
      "state": "Nordrhein-Westfalen",
      "amtsgericht": "Amtsgericht Wuppertal",
      "registernummer": "HRB 13532",
      "registerart": "HRB",
      "company_name": "\"Augenoptik Haarde GmbH\"",
      "company_seat": "Wuppertal",
      "details": "13.05.2025 (Bekanntmachungsdatum)\n\nNordrhein-Westfalen Amtsgericht Wuppertal HRB 13532\nLöschungsankündigung\n\n\"Augenoptik Haarde GmbH\"\nGesellschaft mit beschränkter Haftung\nWuppertal\n\nDas Registergericht beabsichtigt die Gesellschaft von Amts wegen nach § 394 FamFG zu löschen. Die Frist zur Erhebung eines Widerspruchs ist auf einen Monat festgesetzt."
    },
    {
      "date": "2025-05-13",
      "id": "108929",
      "original_text": "Registerbekanntmachung nach dem Umwandlungsgesetz\nNordrhein-Westfalen Amtsgericht Aachen HRB 23002\nNEUMANN & ESSER Automation GmbH – Aachen",
      "type": "Registerbekanntmachung nach dem Umwandlungsgesetz",
      "state": "Nordrhein-Westfalen",
      "amtsgericht": "Amtsgericht Aachen",
      "registernummer": "HRB 23002",
      "registerart": "HRB",
      "company_name": "NEUMANN & ESSER Automation GmbH",
      "company_seat": "Aachen",
      "details": "13.05.2025 (Bekanntmachungsdatum)\n\nNordrhein-Westfalen Amtsgericht Aachen HRB 23002\nRegisterbekanntmachung nach dem Umwandlungsgesetz 13.05.2025 (Eintragungsdatum)\n\nNEUMANN & ESSER Automation GmbH\nGesellschaft mit beschränkter Haftung\nAachen\n\nDen Gläubigern der an der Verschmelzung beteiligten Rechtsträger ist, wenn sie binnen sechs Monaten nach dem Tag, an dem die Eintragung der Verschmelzung in das Register des Sitzes derjenigen Rechtsträger deren Gläubiger sie sind, nach § 19 Absatz 3 UmwG als bekanntgemacht gilt, ihren Anspruch nach Grund und Höhe schriftlich anmelden, Sicherheit zu leisten, soweit sie nicht Befriedigung verlangen können. Dieses Recht steht den Gläubigern jedoch nur zu, wenn sie glaubhaft machen, dass durch die Verschmelzung die Erfüllung ihrer Forderung gefährdet wird."
    },
    {
      "date": "2025-05-13",
      "id": "108930",
      "original_text": "Löschungsankündigung\nNordrhein-Westfalen Amtsgericht Düsseldorf HRB 89536\nB2B Connexion UG (haftungsbeschränkt) – Ratingen",
      "type": "Löschungsankündigung",
      "state": "Nordrhein-Westfalen",
      "amtsgericht": "Amtsgericht Düsseldorf",
      "registernummer": "HRB 89536",
      "registerart": "HRB",
      "company_name": "B2B Connexion UG (haftungsbeschränkt)",
      "company_seat": "Ratingen",
      "details": "13.05.2025 (Bekanntmachungsdatum)\n\nNordrhein-Westfalen Amtsgericht Düsseldorf HRB 89536\nLöschungsankündigung\n\nB2B Connexion UG (haftungsbeschränkt)\nGesellschaft mit beschränkter Haftung\nRatingen\n\nDas Registergericht beabsichtigt die Gesellschaft von Amts wegen nach § 394 Abs. 1 FamFG zu löschen. Die Frist zur Erhebung eines Widerspruchs ist auf einen Monat festgesetzt.\n\nRechtsbehelfsbelehrung:\nDas Widerspruchsrecht steht jedem zu, der an der Unterlassung der Löschung ein berechtigtes Interesse hat. Der Widerspruch ist bei dem Amtsgericht Düsseldorf -Registergericht-, Werdener Straße 1, 40227 Düsseldorf schriftlich in deutscher Sprache oder zur Niederschrift der Geschäftsstelle einzulegen. Der Widerspruch kann auch zur Niederschrift der Geschäftsstelle eines jeden Amtsgerichtes abgegeben werden. Die Einlegung ist auch durch Übertragung eines elektronischen Dokuments an die elektronische Poststelle des Gerichts möglich. Das elektronische Dokument muss für die Bearbeitung durch das Gericht geeignet und mit einer qualifizierten elektronischen Signatur der verantwortenden Person versehen sein oder von der verantwortenden Person signiert und auf einem sicheren Übermittlungsweg gemäß § 130a ZPO nach näherer Maßgabe der Verordnung über die technischen Rahmenbedingungen des elektronischen Rechtsverkehrs und über das besondere elektronische Behördenpostfach (BGBl. I, S.3803) eingereicht werden. Weitere Informationen erhalten Sie auf der Internetseite www.justiz.de.\nDer Widerspruch muss spätestens innerhalb der gesetzten Frist nach dem Datum der Bekanntmachung der Löschungsankündigung bei dem Amtsgericht - Registergericht - Düsseldorf eingegangen sein.  Dies gilt auch dann, wenn der Widerspruch zur Niederschrift der Geschäftsstelle eines anderen Amtsgerichtes abgegeben wurde. Die Frist beginnt mit dem Tage der Bekanntmachung der Löschungsankündigung in dem für die Bekanntmachung der Eintragungen in das Handelsregister bestimmten elektronischen Informations- und Kommunikationssystem nach § 10 des Handelsgesetzbuches. Fällt das Ende der Frist auf einen Sonntag, einen allgemeinen Feiertag oder Sonnabend, so endet die Frist mit Ablauf des nächsten Werktages.\nDer Widerspruch muss die Bezeichnung der angefochtenen Löschungsankündigung sowie die Erklärung enthalten, dass Widerspruch gegen diese Löschungsankündigung eingelegt wird. Er ist zu unterzeichnen und soll begründet werden."
    },
    {
      "date": "2025-05-13",
      "id": "108931",
      "original_text": "Löschungsankündigung\nNordrhein-Westfalen Amtsgericht Duisburg VR 4899\nJugend und Schulkultur Projektwerkstatt e.V. – Mülheim an der Ruhr",
      "type": "Löschungsankündigung",
      "state": "Nordrhein-Westfalen",
      "amtsgericht": "Amtsgericht Duisburg",
      "registernummer": "VR 4899",
      "registerart": "VR",
      "company_name": "Jugend und Schulkultur Projektwerkstatt e.V.",
      "company_seat": "Mülheim an der Ruhr",
      "details": "13.05.2025 (Bekanntmachungsdatum)\n\nNordrhein-Westfalen Amtsgericht Duisburg VR 4899\nLöschungsankündigung\n\nJugend und Schulkultur Projektwerkstatt e.V.\neingetragener Verein\nMülheim an der Ruhr\n\nDas Registergericht beabsichtigt, den Verein wegen Fortfalls sämtlicher Mitglieder zu löschen (§ 4 VRV). Es besteht Gelegenheit binnen einer Frist von einem Monat gegen die Löschung des Vereins Einwendungen zu erheben. Nach Ablauf der Frist erfolgt die Löschung des Vereins von Amts wegen."
    },
    {
      "date": "2025-05-13",
      "id": "108932",
      "original_text": "Löschungsankündigung\nNordrhein-Westfalen Amtsgericht Köln HRB 90350\nBoD trade & invest GmbH – Köln",
      "type": "Löschungsankündigung",
      "state": "Nordrhein-Westfalen",
      "amtsgericht": "Amtsgericht Köln",
      "registernummer": "HRB 90350",
      "registerart": "HRB",
      "company_name": "BoD trade & invest GmbH",
      "company_seat": "Köln",
      "details": "13.05.2025 (Bekanntmachungsdatum)\n\nNordrhein-Westfalen Amtsgericht Köln HRB 90350\nLöschungsankündigung\n\nBoD trade & invest GmbH\nGesellschaft mit beschränkter Haftung\nKöln\n\nDas Registergericht beabsichtigt die Gesellschaft von Amts wegen nach § 394 FamFG zu löschen. Die Frist zur Erhebung eines Widerspruchs ist auf einen Monat festgesetzt."
    },
    {
      "date": "2025-05-13",
      "id": "108933",
      "original_text": "Einreichung neuer Dokumente\nNordrhein-Westfalen Amtsgericht Bonn HRB 15992\nDeutsche Telekom Venture Funds GmbH – Bonn",
      "type": "Einreichung neuer Dokumente",
      "state": "Nordrhein-Westfalen",
      "amtsgericht": "Amtsgericht Bonn",
      "registernummer": "HRB 15992",
      "registerart": "HRB",
      "company_name": "Deutsche Telekom Venture Funds GmbH",
      "company_seat": "Bonn",
      "details": "13.05.2025 (Bekanntmachungsdatum)\n\nNordrhein-Westfalen Amtsgericht Bonn HRB 15992\nEinreichung neuer Dokumente\n\nDeutsche Telekom Venture Funds GmbH\nGesellschaft mit beschränkter Haftung\nBonn\n\nDem Registergericht ist eine neue Liste der Mitglieder des Aufsichtsrates eingereicht worden."
    },
    {
      "date": "2025-05-13",
      "id": "108934",
      "original_text": "Löschungsankündigung\nNordrhein-Westfalen Amtsgericht Köln HRB 71680\nMy Vivenda Deutschland GmbH – Köln",
      "type": "Löschungsankündigung",
      "state": "Nordrhein-Westfalen",
      "amtsgericht": "Amtsgericht Köln",
      "registernummer": "HRB 71680",
      "registerart": "HRB",
      "company_name": "My Vivenda Deutschland GmbH",
      "company_seat": "Köln",
      "details": "13.05.2025 (Bekanntmachungsdatum)\n\nNordrhein-Westfalen Amtsgericht Köln HRB 71680\nLöschungsankündigung\n\nMy Vivenda Deutschland GmbH\nGesellschaft mit beschränkter Haftung\nKöln\n\nDas Registergericht beabsichtigt die Gesellschaft von Amts wegen nach § 394 FamFG zu löschen. Die Frist zur Erhebung eines Widerspruchs ist auf einen Monat festgesetzt."
    },
    {
      "date": "2025-05-13",
      "id": "108935",
      "original_text": "Sonstige Registerbekanntmachung\nHessen Amtsgericht Wetzlar VR 2307\nBezirkspferdezuchtverein Lahn-Dill – Dillenburg",
      "type": "Sonstige Registerbekanntmachung",
      "state": "Hessen",
      "amtsgericht": "Amtsgericht Wetzlar",
      "registernummer": "VR 2307",
      "registerart": "VR",
      "company_name": "Bezirkspferdezuchtverein Lahn-Dill",
      "company_seat": "Dillenburg",
      "details": "13.05.2025 (Bekanntmachungsdatum)\n\nHessen Amtsgericht Wetzlar VR 2307\nSonstige Registerbekanntmachung 13.05.2025 (Eintragungsdatum)\n\nBezirkspferdezuchtverein Lahn-Dill\neingetragener Verein\nDillenburg\n\nDer Verein ist aufgelöst."
    },
    {
      "date": "2025-05-13",
      "id": "108936",
      "original_text": "Löschungsankündigung\nHessen Amtsgericht Darmstadt HRB 96597\nHeFo Fahrzeugtechnik GmbH – Fürth/Odw.",
      "type": "Löschungsankündigung",
      "state": "Hessen",
      "amtsgericht": "Amtsgericht Darmstadt",
      "registernummer": "HRB 96597",
      "registerart": "HRB",
      "company_name": "HeFo Fahrzeugtechnik GmbH",
      "company_seat": "Fürth/Odw.",
      "details": "13.05.2025 (Bekanntmachungsdatum)\n\nHessen Amtsgericht Darmstadt HRB 96597\nLöschungsankündigung\n\nHeFo Fahrzeugtechnik GmbH\nGesellschaft mit beschränkter Haftung\nFürth/Odw.\n\nDas Registergericht beabsichtigt die im Handelsregister eingetragene Gesellschaft von Amts wegen nach § 394 FamFG zu löschen. Die Frist zur Erhebung eines Widerspruchs gegen die beabsichtigte Löschung wird auf 3 Monate festgesetzt."
    },
    {
      "date": "2025-05-13",
      "id": "108937",
      "original_text": "Einreichung neuer Dokumente\nHessen Amtsgericht Wiesbaden HRB 35661\nB2P Bio2Power GmbH – Wiesbaden",
      "type": "Einreichung neuer Dokumente",
      "state": "Hessen",
      "amtsgericht": "Amtsgericht Wiesbaden",
      "registernummer": "HRB 35661",
      "registerart": "HRB",
      "company_name": "B2P Bio2Power GmbH",
      "company_seat": "Wiesbaden",
      "details": "13.05.2025 (Bekanntmachungsdatum)\n\nHessen Amtsgericht Wiesbaden HRB 35661\nEinreichung neuer Dokumente 13.05.2025 (Eintragungsdatum)\n\nB2P Bio2Power GmbH\nGesellschaft mit beschränkter Haftung\nWiesbaden\n\nEs ist eine Liste der Mitglieder des Aufsichtsrates zum Handelsregister eingereicht worden."
    },
    {
      "date": "2025-05-13",
      "id": "108938",
      "original_text": "Löschungsankündigung\nHessen Amtsgericht Frankfurt am Main HRB 128369\nBossBoxx GmbH – Frankfurt am Main",
      "type": "Löschungsankündigung",
      "state": "Hessen",
      "amtsgericht": "Amtsgericht Frankfurt am Main",
      "registernummer": "HRB 128369",
      "registerart": "HRB",
      "company_name": "BossBoxx GmbH",
      "company_seat": "Frankfurt am Main",
      "details": "13.05.2025 (Bekanntmachungsdatum)\n\nHessen Amtsgericht Frankfurt am Main HRB 128369\nLöschungsankündigung\n\nBossBoxx GmbH\nGesellschaft mit beschränkter Haftung\nFrankfurt am Main\n\nDas Registergericht beabsichtigt die im Handelsregister eingetragene Gesellschaft von Amts wegen nach § 394 FamFG zu löschen. Die Frist zur Erhebung eines Widerspruchs gegen die beabsichtigte Löschung wird auf 1 Monat festgesetzt."
    },
    {
      "date": "2025-05-13",
      "id": "108939",
      "original_text": "Einreichung neuer Dokumente\nHessen Amtsgericht Wiesbaden HRB 10028\nHELIOS Dr. Horst Schmidt Kliniken Wiesbaden GmbH – Wiesbaden",
      "type": "Einreichung neuer Dokumente",
      "state": "Hessen",
      "amtsgericht": "Amtsgericht Wiesbaden",
      "registernummer": "HRB 10028",
      "registerart": "HRB",
      "company_name": "HELIOS Dr. Horst Schmidt Kliniken Wiesbaden GmbH",
      "company_seat": "Wiesbaden",
      "details": "13.05.2025 (Bekanntmachungsdatum)\n\nHessen Amtsgericht Wiesbaden HRB 10028\nEinreichung neuer Dokumente 13.05.2025 (Eintragungsdatum)\n\nHELIOS Dr. Horst Schmidt Kliniken Wiesbaden GmbH\nGesellschaft mit beschränkter Haftung\nWiesbaden\n\nDurch eine Änderung in den Personen der Aufsichtsratsmitglieder ist eine Liste der Mitglieder des Aufsichtsrates zum Handelsregister eingereicht worden."
    },
    {
      "date": "2025-05-13",
      "id": "108940",
      "original_text": "Löschungsankündigung\nHessen Amtsgericht Frankfurt am Main HRA 49714\nLPS Lennox Petrochemical Solutions GmbH & Co. KG – Frankfurt am Main",
      "type": "Löschungsankündigung",
      "state": "Hessen",
      "amtsgericht": "Amtsgericht Frankfurt am Main",
      "registernummer": "HRA 49714",
      "registerart": "HRA",
      "company_name": "LPS Lennox Petrochemical Solutions GmbH & Co. KG",
      "company_seat": "Frankfurt am Main",
      "details": "13.05.2025 (Bekanntmachungsdatum)\n\nHessen Amtsgericht Frankfurt am Main HRA 49714\nLöschungsankündigung\n\nLPS Lennox Petrochemical Solutions GmbH & Co. KG\nKommanditgesellschaft\nFrankfurt am Main\n\nDas Registergericht beabsichtigt die im Handelsregister eingetragene Firma von Amts wegen nach § 394 FamFG zu löschen. Die Frist zur Erhebung eines Widerspruchs gegen die beabsichtigte Löschung wird auf 3 Monate festgesetzt."
    },
    {
      "date": "2025-05-13",
      "id": "108941",
      "original_text": "Einreichung neuer Dokumente\nHessen Amtsgericht Frankfurt am Main HRB 32000\nCOMMERZBANK Aktiengesellschaft – Frankfurt am Main",
      "type": "Einreichung neuer Dokumente",
      "state": "Hessen",
      "amtsgericht": "Amtsgericht Frankfurt am Main",
      "registernummer": "HRB 32000",
      "registerart": "HRB",
      "company_name": "COMMERZBANK Aktiengesellschaft",
      "company_seat": "Frankfurt am Main",
      "details": "13.05.2025 (Bekanntmachungsdatum)\n\nHessen Amtsgericht Frankfurt am Main HRB 32000\nEinreichung neuer Dokumente\n\nCOMMERZBANK Aktiengesellschaft\nAktiengesellschaft\nFrankfurt am Main\n\nDurch eine Änderung in den Personen der Aufsichtsratsmitglieder ist eine Liste der Mitglieder des Aufsichtsrates zum Handelsregister eingereicht worden."
    },
    {
      "date": "2025-05-13",
      "id": "108942",
      "original_text": "Einreichung neuer Dokumente\nHessen Amtsgericht Darmstadt HRB 33745\nKüppers Vermögensverwaltung AG – Reinheim",
      "type": "Einreichung neuer Dokumente",
      "state": "Hessen",
      "amtsgericht": "Amtsgericht Darmstadt",
      "registernummer": "HRB 33745",
      "registerart": "HRB",
      "company_name": "Küppers Vermögensverwaltung AG",
      "company_seat": "Reinheim",
      "details": "13.05.2025 (Bekanntmachungsdatum)\n\nHessen Amtsgericht Darmstadt HRB 33745\nEinreichung neuer Dokumente 13.05.2025 (Eintragungsdatum)\n\nKüppers Vermögensverwaltung AG\nAktiengesellschaft\nReinheim\n\nWegen Änderungen in den Personen der Aufsichtsratsmitglieder ist eine Liste der Mitglieder des Aufsichtsrates zum Handelsregister eingereicht worden."
    },
    {
      "date": "2025-05-13",
      "id": "108943",
      "original_text": "Löschungsankündigung\nHessen Amtsgericht Frankfurt am Main HRB 104806\nWIMI DEFENCE GmbH – Frankfurt am Main",
      "type": "Löschungsankündigung",
      "state": "Hessen",
      "amtsgericht": "Amtsgericht Frankfurt am Main",
      "registernummer": "HRB 104806",
      "registerart": "HRB",
      "company_name": "WIMI DEFENCE GmbH",
      "company_seat": "Frankfurt am Main",
      "details": "13.05.2025 (Bekanntmachungsdatum)\n\nHessen Amtsgericht Frankfurt am Main HRB 104806\nLöschungsankündigung\n\nWIMI DEFENCE GmbH\nGesellschaft mit beschränkter Haftung\nFrankfurt am Main\n\nEs ist beabsichtigt die Gesellschaft wegen Vermögenslosigkeit gemäß § 394 FamFG von Amts wegen zu löschen. Hiergegen kann innerhalb eines Monats nach dieser Veröffentlichung Widerspruch bei dem Amtsgericht Frankfurt am Main eingelegt werden."
    },
    {
      "date": "2025-05-13",
      "id": "108944",
      "original_text": "Einreichung neuer Dokumente\nHessen Amtsgericht Frankfurt am Main HRB 94514\nNATIXIS Pfandbriefbank AG – Frankfurt am Main",
      "type": "Einreichung neuer Dokumente",
      "state": "Hessen",
      "amtsgericht": "Amtsgericht Frankfurt am Main",
      "registernummer": "HRB 94514",
      "registerart": "HRB",
      "company_name": "NATIXIS Pfandbriefbank AG",
      "company_seat": "Frankfurt am Main",
      "details": "13.05.2025 (Bekanntmachungsdatum)\n\nHessen Amtsgericht Frankfurt am Main HRB 94514\nEinreichung neuer Dokumente\n\nNATIXIS Pfandbriefbank AG\nAktiengesellschaft\nFrankfurt am Main\n\nDurch eine Änderung in den Personen der Aufsichtsratsmitglieder ist eine Liste der Mitglieder des Aufsichtsrates zum Handelsregister eingereicht worden."
    },
    {
      "date": "2025-05-13",
      "id": "108945",
      "original_text": "Einreichung neuer Dokumente\nHessen Amtsgericht Frankfurt am Main HRB 137595\nSW SaveThe Water Holding AG – Frankfurt am Main",
      "type": "Einreichung neuer Dokumente",
      "state": "Hessen",
      "amtsgericht": "Amtsgericht Frankfurt am Main",
      "registernummer": "HRB 137595",
      "registerart": "HRB",
      "company_name": "SW SaveThe Water Holding AG",
      "company_seat": "Frankfurt am Main",
      "details": "13.05.2025 (Bekanntmachungsdatum)\n\nHessen Amtsgericht Frankfurt am Main HRB 137595\nEinreichung neuer Dokumente 13.05.2025 (Eintragungsdatum)\n\nSW SaveThe Water Holding AG\nAktiengesellschaft\nFrankfurt am Main\n\nDurch eine Änderung in den Personen der Aufsichtsratsmitglieder ist eine Liste der Mitglieder des Aufsichtsrates zum Handelsregister eingereicht worden."
    },
    {
      "date": "2025-05-13",
      "id": "108946",
      "original_text": "Löschungsankündigung\nHessen Amtsgericht Frankfurt am Main HRB 103306\nMira Service GmbH – Frankfurt am Main",
      "type": "Löschungsankündigung",
      "state": "Hessen",
      "amtsgericht": "Amtsgericht Frankfurt am Main",
      "registernummer": "HRB 103306",
      "registerart": "HRB",
      "company_name": "Mira Service GmbH",
      "company_seat": "Frankfurt am Main",
      "details": "13.05.2025 (Bekanntmachungsdatum)\n\nHessen Amtsgericht Frankfurt am Main HRB 103306\nLöschungsankündigung\n\nMira Service GmbH\nGesellschaft mit beschränkter Haftung\nFrankfurt am Main\n\nEs ist beabsichtigt, Sie als Geschäftsführer der Gesellschaft gemäß § 395 FamFG von Amts wegen im Handelsregister zu löschen, weil gegen Sie eine Gewerbeuntersagung nach § 35 Gewerbeordnung Az: III 32-73a 70/803-2023/1 durch das Regierungspräsidium Darmstadt verhängt wurde. Hiergegen kann innerhalb eines Monats nach Zustellungs dieser Verfügung Widerspruch bei dem Amtsgericht Frankfurt am Main eingelegt werden."
    }
  ]
}