{
  "date": "2025-05-12",
  "date_of_scrape": "2025-05-31T08:49:04.063Z",
  "tool_version": "0.2.0",
  "number_of_announcements": 123,
  "announcements": [
    {
      "date": "2025-05-12",
      "id": "108663",
      "original_text": "Einreichung neuer Dokumente\nBaden-Württemberg Amtsgericht Stuttgart HRB 748054\nSchwabengarage GmbH – Stuttgart",
      "type": "Einreichung neuer Dokumente",
      "state": "Baden-Württemberg",
      "amtsgericht": "Amtsgericht Stuttgart",
      "registernummer": "HRB 748054",
      "registerart": "HRB",
      "company_name": "Schwabengarage GmbH",
      "company_seat": "Stuttgart",
      "details": "12.05.2025 (Bekanntmachungsdatum)\n\nBaden-Württemberg Amtsgericht Stuttgart HRB 748054\nEinreichung neuer Dokumente\n\nSchwabengarage GmbH\nGesellschaft mit beschränkter Haftung\nStuttgart\n\nDie Gesellschaft hat am 07.05.2025 die Liste über die Zusammensetzung des Aufsichtsrats zum Handelsregister eingereicht."
    },
    {
      "date": "2025-05-12",
      "id": "108664",
      "original_text": "Löschungsankündigung\nBaden-Württemberg Amtsgericht Mannheim HRA 240486\nPro Human Care 24 GmbH & Co KG – Oberderdingen",
      "type": "Löschungsankündigung",
      "state": "Baden-Württemberg",
      "amtsgericht": "Amtsgericht Mannheim",
      "registernummer": "HRA 240486",
      "registerart": "HRA",
      "company_name": "Pro Human Care 24 GmbH & Co KG",
      "company_seat": "Oberderdingen",
      "details": "12.05.2025 (Bekanntmachungsdatum)\n\nBaden-Württemberg Amtsgericht Mannheim HRA 240486\nLöschungsankündigung\n\nPro Human Care 24 GmbH & Co KG\nKommanditgesellschaft\nOberderdingen\n\nDas Gericht beabsichtigt, die Gesellschaft wegen Vermögenslosigkeit im Handelsregister von Amts wegen nach § 394 FamFG zu löschen. Die Frist zur Geltendmachung eines Widerspruchs gegen die beabsichtigte Löschung ist auf einen Monat ab Veröffentlichung bestimmt."
    },
    {
      "date": "2025-05-12",
      "id": "108665",
      "original_text": "Registerbekanntmachung nach dem Umwandlungsgesetz\nBerlin Amtsgericht Berlin (Charlottenburg) HRB 157759\nTele Columbus Sachsen-Anhalt GmbH – Berlin",
      "type": "Registerbekanntmachung nach dem Umwandlungsgesetz",
      "state": "Berlin",
      "amtsgericht": "Amtsgericht Berlin (Charlottenburg)",
      "registernummer": "HRB 157759",
      "registerart": "HRB",
      "company_name": "Tele Columbus Sachsen-Anhalt GmbH",
      "company_seat": "Berlin",
      "details": "12.05.2025 (Bekanntmachungsdatum)\n\nBerlin Amtsgericht Berlin (Charlottenburg) HRB 157759\nRegisterbekanntmachung nach dem Umwandlungsgesetz 09.05.2025 (Eintragungsdatum)\n\nTele Columbus Sachsen-Anhalt GmbH\nGesellschaft mit beschränkter Haftung\nBerlin\n\nDen Gläubigern der an der Verschmelzung beteiligten Rechtsträger ist, wenn sie binnen sechs Monaten nach dem Tag, an dem die Eintragung der Verschmelzung in das Register des Sitzes desjenigen Rechtsträgers, dessen Gläubiger sie sind, als bekannt gemacht gilt, ihren Anspruch nach Grund und Höhe schriftlich anmelden, Sicherheit zu leisten, soweit sie nicht Befriedigung verlangen können. Dieses Recht steht den Gläubigern jedoch nur zu, wenn sie glaubhaft machen, dass durch die Verschmelzung die Erfüllung ihrer Forderung gefährdet wird. Das Recht, Sicherheitsleistung zu verlangen, steht Gläubigern nicht zu, die im Falle der Insolvenz ein Recht auf vorzugsweise Befriedigung aus einer Deckungsmasse haben, die nach gesetzlicher Vorschrift zu ihrem Schutz errichtet und staatlich überwacht ist.Zu Eintragungsnummer 25 vom 09.05.2025 wird als nicht eingetragen veröffentlicht:"
    },
    {
      "date": "2025-05-12",
      "id": "108666",
      "original_text": "Registerbekanntmachung nach dem Umwandlungsgesetz\nBerlin Amtsgericht Berlin (Charlottenburg) HRB 157759\nTele Columbus Sachsen-Anhalt GmbH – Berlin",
      "type": "Registerbekanntmachung nach dem Umwandlungsgesetz",
      "state": "Berlin",
      "amtsgericht": "Amtsgericht Berlin (Charlottenburg)",
      "registernummer": "HRB 157759",
      "registerart": "HRB",
      "company_name": "Tele Columbus Sachsen-Anhalt GmbH",
      "company_seat": "Berlin",
      "details": "12.05.2025 (Bekanntmachungsdatum)\n\nBerlin Amtsgericht Berlin (Charlottenburg) HRB 157759\nRegisterbekanntmachung nach dem Umwandlungsgesetz 09.05.2025 (Eintragungsdatum)\n\nTele Columbus Sachsen-Anhalt GmbH\nGesellschaft mit beschränkter Haftung\nBerlin\n\nZu Eintragungsnummer 26 vom 09.05.2025 wird als nicht eingetragen veröffentlicht:Den Gläubigern der an der Verschmelzung beteiligten Rechtsträger ist, wenn sie binnen sechs Monaten nach dem Tag, an dem die Eintragung der Verschmelzung in das Register des Sitzes desjenigen Rechtsträgers, dessen Gläubiger sie sind, als bekannt gemacht gilt, ihren Anspruch nach Grund und Höhe schriftlich anmelden, Sicherheit zu leisten, soweit sie nicht Befriedigung verlangen können. Dieses Recht steht den Gläubigern jedoch nur zu, wenn sie glaubhaft machen, dass durch die Verschmelzung die Erfüllung ihrer Forderung gefährdet wird. Das Recht, Sicherheitsleistung zu verlangen, steht Gläubigern nicht zu, die im Falle der Insolvenz ein Recht auf vorzugsweise Befriedigung aus einer Deckungsmasse haben, die nach gesetzlicher Vorschrift zu ihrem Schutz errichtet und staatlich überwacht ist."
    },
    {
      "date": "2025-05-12",
      "id": "108667",
      "original_text": "Registerbekanntmachung nach dem Umwandlungsgesetz\nBerlin Amtsgericht Berlin (Charlottenburg) HRA 58459\nTele Columbus Multimedia GmbH & Co. KG – Berlin",
      "type": "Registerbekanntmachung nach dem Umwandlungsgesetz",
      "state": "Berlin",
      "amtsgericht": "Amtsgericht Berlin (Charlottenburg)",
      "registernummer": "HRA 58459",
      "registerart": "HRA",
      "company_name": "Tele Columbus Multimedia GmbH & Co. KG",
      "company_seat": "Berlin",
      "details": "12.05.2025 (Bekanntmachungsdatum)\n\nBerlin Amtsgericht Berlin (Charlottenburg) HRA 58459\nRegisterbekanntmachung nach dem Umwandlungsgesetz 09.05.2025 (Eintragungsdatum)\n\nTele Columbus Multimedia GmbH & Co. KG\nKommanditgesellschaft\nBerlin\n\nZu Eintragungsnummer 19 vom 09.05.2025 wird als nicht eingetragen veröffentlicht:Den Gläubigern der an der Verschmelzung beteiligten Rechtsträger ist, wenn sie binnen sechs Monaten nach dem Tag, an dem die Eintragung der Verschmelzung in das Register des Sitzes desjenigen Rechtsträgers, dessen Gläubiger sie sind, als bekannt gemacht gilt, ihren Anspruch nach Grund und Höhe schriftlich anmelden, Sicherheit zu leisten, soweit sie nicht Befriedigung verlangen können. Dieses Recht steht den Gläubigern jedoch nur zu, wenn sie glaubhaft machen, dass durch die Verschmelzung die Erfüllung ihrer Forderung gefährdet wird. Das Recht, Sicherheitsleistung zu verlangen, steht Gläubigern nicht zu, die im Falle der Insolvenz ein Recht auf vorzugsweise Befriedigung aus einer Deckungsmasse haben, die nach gesetzlicher Vorschrift zu ihrem Schutz errichtet und staatlich überwacht ist."
    },
    {
      "date": "2025-05-12",
      "id": "108668",
      "original_text": "Sonstige Registerbekanntmachung\nHamburg Amtsgericht Hamburg HRB 66701\nHaspa Beteiligungsgesellschaft für den Mittelstand mbH – Hamburg",
      "type": "Sonstige Registerbekanntmachung",
      "state": "Hamburg",
      "amtsgericht": "Amtsgericht Hamburg",
      "registernummer": "HRB 66701",
      "registerart": "HRB",
      "company_name": "Haspa Beteiligungsgesellschaft für den Mittelstand mbH",
      "company_seat": "Hamburg",
      "details": "12.05.2025 (Bekanntmachungsdatum)\n\nHamburg Amtsgericht Hamburg HRB 66701\nSonstige Registerbekanntmachung\n\nHaspa Beteiligungsgesellschaft für den Mittelstand mbH\nGesellschaft mit beschränkter Haftung\nHamburg\n\nAls nicht eingetragen wird bekannt gemacht: Liste des Aufsichtsrats wurde eingereicht."
    },
    {
      "date": "2025-05-12",
      "id": "108669",
      "original_text": "Löschungsankündigung\nSachsen-Anhalt Amtsgericht Stendal VR 36561\nVPA - Verein der Pflege- und Adoptiveltern im Raum Aschersleben/Staßfurt e.V. – Aschersleben",
      "type": "Löschungsankündigung",
      "state": "Sachsen-Anhalt",
      "amtsgericht": "Amtsgericht Stendal",
      "registernummer": "VR 36561",
      "registerart": "VR",
      "company_name": "VPA - Verein der Pflege- und Adoptiveltern im Raum Aschersleben/Staßfurt e.V.",
      "company_seat": "Aschersleben",
      "details": "12.05.2025 (Bekanntmachungsdatum)\n\nSachsen-Anhalt Amtsgericht Stendal VR 36561\nLöschungsankündigung\n\nVPA - Verein der Pflege- und Adoptiveltern im Raum Aschersleben/Staßfurt e.V.\neingetragener Verein\nAschersleben\n\nDas Registergericht beabsichtigt, nachfolgende Vereine wegen Mitgliederlosigkeit von Amts wegen zu löschen. Die Frist zur Erhebung eines Widerspruchs gegen die beabsichtigte Löschung wird auf drei Monate festgesetzt."
    },
    {
      "date": "2025-05-12",
      "id": "108670",
      "original_text": "Löschungsankündigung\nBrandenburg Amtsgericht Potsdam HRB 34483\nPet.Tech GmbH – Teltow",
      "type": "Löschungsankündigung",
      "state": "Brandenburg",
      "amtsgericht": "Amtsgericht Potsdam",
      "registernummer": "HRB 34483",
      "registerart": "HRB",
      "company_name": "Pet.Tech GmbH",
      "company_seat": "Teltow",
      "details": "12.05.2025 (Bekanntmachungsdatum)\n\nBrandenburg Amtsgericht Potsdam HRB 34483\nLöschungsankündigung\n\nPet.Tech GmbH\nGesellschaft mit beschränkter Haftung\nTeltow\n\nBei der nachstehenden Gesellschaft wird das Amtslöschungsverfahren gemäß § 394 FamFG eingeleitet. Widerspruchsfrist 8 Wochen."
    },
    {
      "date": "2025-05-12",
      "id": "108671",
      "original_text": "Löschungsankündigung\nSchleswig-Holstein Amtsgericht Kiel HRB 18962\nBrainalyzed Holding GmbH – Bad Bramstedt",
      "type": "Löschungsankündigung",
      "state": "Schleswig-Holstein",
      "amtsgericht": "Amtsgericht Kiel",
      "registernummer": "HRB 18962",
      "registerart": "HRB",
      "company_name": "Brainalyzed Holding GmbH",
      "company_seat": "Bad Bramstedt",
      "details": "12.05.2025 (Bekanntmachungsdatum)\n\nSchleswig-Holstein Amtsgericht Kiel HRB 18962\nLöschungsankündigung\n\nBrainalyzed Holding GmbH\nGesellschaft mit beschränkter Haftung\nBad Bramstedt\n\nEs ist die Löschung der nachstehenden Gesellschaft wegen Vermögenslosigkeit gemäß § 394 FamFG beabsichtigt. Widerspruchsfrist: 1 Monat."
    },
    {
      "date": "2025-05-12",
      "id": "108672",
      "original_text": "Sonstige Registerbekanntmachung\nHamburg Amtsgericht Hamburg HRB 172607\nHaspa BGM Invest GmbH – Hamburg",
      "type": "Sonstige Registerbekanntmachung",
      "state": "Hamburg",
      "amtsgericht": "Amtsgericht Hamburg",
      "registernummer": "HRB 172607",
      "registerart": "HRB",
      "company_name": "Haspa BGM Invest GmbH",
      "company_seat": "Hamburg",
      "details": "12.05.2025 (Bekanntmachungsdatum)\n\nHamburg Amtsgericht Hamburg HRB 172607\nSonstige Registerbekanntmachung\n\nHaspa BGM Invest GmbH\nGesellschaft mit beschränkter Haftung\nHamburg\n\nAls nicht eingetragen wird bekannt gemacht: Liste des Aufsichtsrats wurde eingereicht."
    },
    {
      "date": "2025-05-12",
      "id": "108673",
      "original_text": "Registerbekanntmachung nach dem Umwandlungsgesetz\nHamburg Amtsgericht Hamburg HRB 122356\nBomin International Holding GmbH – Hamburg",
      "type": "Registerbekanntmachung nach dem Umwandlungsgesetz",
      "state": "Hamburg",
      "amtsgericht": "Amtsgericht Hamburg",
      "registernummer": "HRB 122356",
      "registerart": "HRB",
      "company_name": "Bomin International Holding GmbH",
      "company_seat": "Hamburg",
      "details": "12.05.2025 (Bekanntmachungsdatum)\n\nHamburg Amtsgericht Hamburg HRB 122356\nRegisterbekanntmachung nach dem Umwandlungsgesetz 12.05.2025 (Eintragungsdatum)\n\nBomin International Holding GmbH\nGesellschaft mit beschränkter Haftung\nHamburg\n\nAls nicht eingetragen wird bekannt gemacht:\nDen Gläubigern der an der Verschmelzung beteiligten Gesellschaften ist, wenn sie binnen sechs Monaten nach dem Tag, an dem die Eintragung der Verschmelzung in das Register des Sitzes desjenigen Rechtsträgers, dessen Gläubiger sie sind, nach § 19 Absatz 3 UmwG als bekannt gemacht gilt, ihren Anspruch nach Grund und Höhe schriftlich anmelden, Sicherheit zu leisten, soweit sie nicht Befriedigung verlangen können. Dieses Recht steht den Gläubigern jedoch nur zu, wenn sie glaubhaft machen, dass durch die Verschmelzung die Erfüllung ihrer Forderung gefährdet wird."
    },
    {
      "date": "2025-05-12",
      "id": "108674",
      "original_text": "Registerbekanntmachung nach dem Umwandlungsgesetz\nHamburg Amtsgericht Hamburg HRB 126790\nBominship International GmbH – Hamburg",
      "type": "Registerbekanntmachung nach dem Umwandlungsgesetz",
      "state": "Hamburg",
      "amtsgericht": "Amtsgericht Hamburg",
      "registernummer": "HRB 126790",
      "registerart": "HRB",
      "company_name": "Bominship International GmbH",
      "company_seat": "Hamburg",
      "details": "12.05.2025 (Bekanntmachungsdatum)\n\nHamburg Amtsgericht Hamburg HRB 126790\nRegisterbekanntmachung nach dem Umwandlungsgesetz 12.05.2025 (Eintragungsdatum)\n\nBominship International GmbH\nGesellschaft mit beschränkter Haftung\nHamburg\n\nAls nicht eingetragen wird bekannt gemacht:\nDen Gläubigern der an der Verschmelzung beteiligten Gesellschaften ist, wenn sie binnen sechs Monaten nach dem Tag, an dem die Eintragung der Verschmelzung in das Register des Sitzes desjenigen Rechtsträgers, dessen Gläubiger sie sind, nach § 19 Absatz 3 UmwG als bekannt gemacht gilt, ihren Anspruch nach Grund und Höhe schriftlich anmelden, Sicherheit zu leisten, soweit sie nicht Befriedigung verlangen können. Dieses Recht steht den Gläubigern jedoch nur zu, wenn sie glaubhaft machen, dass durch die Verschmelzung die Erfüllung ihrer Forderung gefährdet wird."
    },
    {
      "date": "2025-05-12",
      "id": "108675",
      "original_text": "Einreichung neuer Dokumente\nSaarland Amtsgericht Saarbrücken HRB 9163\nSaarland Feuerversicherung Aktiengesellschaft – Saarbrücken",
      "type": "Einreichung neuer Dokumente",
      "state": "Saarland",
      "amtsgericht": "Amtsgericht Saarbrücken",
      "registernummer": "HRB 9163",
      "registerart": "HRB",
      "company_name": "Saarland Feuerversicherung Aktiengesellschaft",
      "company_seat": "Saarbrücken",
      "details": "12.05.2025 (Bekanntmachungsdatum)\n\nSaarland Amtsgericht Saarbrücken HRB 9163\nEinreichung neuer Dokumente 12.05.2025 (Eintragungsdatum)\n\nSaarland Feuerversicherung Aktiengesellschaft\nAktiengesellschaft\nSaarbrücken\n\nDer Vorstand der Gesellschaft hat eine Liste der Mitglieder des Aufsichtsrats zum Handelsregister eingereicht (§ 106 AktG)."
    },
    {
      "date": "2025-05-12",
      "id": "108676",
      "original_text": "Löschungsankündigung\nBerlin Amtsgericht Berlin (Charlottenburg) HRB 239651\nI-CONT UG (haftungsbeschränkt) – Berlin",
      "type": "Löschungsankündigung",
      "state": "Berlin",
      "amtsgericht": "Amtsgericht Berlin (Charlottenburg)",
      "registernummer": "HRB 239651",
      "registerart": "HRB",
      "company_name": "I-CONT UG (haftungsbeschränkt)",
      "company_seat": "Berlin",
      "details": "12.05.2025 (Bekanntmachungsdatum)\n\nBerlin Amtsgericht Berlin (Charlottenburg) HRB 239651\nLöschungsankündigung\n\nI-CONT UG (haftungsbeschränkt)\nGesellschaft mit beschränkter Haftung\nBerlin\n\nBei der nachstehenden Gesellschaft wird das Amtslöschungsverfahren gemäß § 394 FamFG eingeleitet. Widerspruchsfrist 6 Wochen"
    },
    {
      "date": "2025-05-12",
      "id": "108677",
      "original_text": "Einreichung neuer Dokumente\nBerlin Amtsgericht Berlin (Charlottenburg) HRB 5011\nHilfswerk-Siedlung Gesellschaft mit beschränkter Haftung Evangelisches Wohnungsunternehmen in Berlin – Berlin",
      "type": "Einreichung neuer Dokumente",
      "state": "Berlin",
      "amtsgericht": "Amtsgericht Berlin (Charlottenburg)",
      "registernummer": "HRB 5011",
      "registerart": "HRB",
      "company_name": "Hilfswerk-Siedlung Gesellschaft mit beschränkter Haftung Evangelisches Wohnungsunternehmen in Berlin",
      "company_seat": "Berlin",
      "details": "12.05.2025 (Bekanntmachungsdatum)\n\nBerlin Amtsgericht Berlin (Charlottenburg) HRB 5011\nEinreichung neuer Dokumente\n\nHilfswerk-Siedlung Gesellschaft mit beschränkter Haftung Evangelisches Wohnungsunternehmen in Berlin\nGesellschaft mit beschränkter Haftung\nBerlin\n\nAls nicht eingetragen wird veröffentlicht: Es wurde eine neue Liste der Aufsichtsratsmitglieder eingereicht (§52 GmbHG)."
    },
    {
      "date": "2025-05-12",
      "id": "108678",
      "original_text": "Registerbekanntmachung nach dem Umwandlungsgesetz\nBaden-Württemberg Amtsgericht Stuttgart HRB 776333\nRoad House Club UG (haftungsbeschränkt) – Heilbronn",
      "type": "Registerbekanntmachung nach dem Umwandlungsgesetz",
      "state": "Baden-Württemberg",
      "amtsgericht": "Amtsgericht Stuttgart",
      "registernummer": "HRB 776333",
      "registerart": "HRB",
      "company_name": "Road House Club UG (haftungsbeschränkt)",
      "company_seat": "Heilbronn",
      "details": "12.05.2025 (Bekanntmachungsdatum)\n\nBaden-Württemberg Amtsgericht Stuttgart HRB 776333\nRegisterbekanntmachung nach dem Umwandlungsgesetz 12.05.2025 (Eintragungsdatum)\n\nRoad House Club UG (haftungsbeschränkt)\nGesellschaft mit beschränkter Haftung\nHeilbronn\n\nAls nicht eingetragen wird bekanntgemacht:\nDen Gläubigern der an der Verschmelzung beteiligten Rechtsträger ist, wenn sie binnen sechs Monaten nach dem Tag, an dem die Eintragung der Verschmelzung in das Register des Sitzes desjenigen Rechtsträgers, dessen Gläubiger sie sind, nach § 19 Abs. 3 UmwG als bekanntgemacht gilt, ihren Anspruch nach Grund und Höhe schriftlich anmelden, Sicherheit zu leisten, soweit sie nicht Befriedigung verlangen können. Dieses Recht steht den Gläubigern jedoch nur zu, wenn sie glaubhaft machen, dass durch die Verschmelzung die Erfüllung ihrer Forderung gefährdet wird."
    },
    {
      "date": "2025-05-12",
      "id": "108679",
      "original_text": "Löschungsankündigung\nBerlin Amtsgericht Berlin (Charlottenburg) HRA 53492\nFTA INDUSTRIAL SERVICES LTD. & Co. KG – Berlin",
      "type": "Löschungsankündigung",
      "state": "Berlin",
      "amtsgericht": "Amtsgericht Berlin (Charlottenburg)",
      "registernummer": "HRA 53492",
      "registerart": "HRA",
      "company_name": "FTA INDUSTRIAL SERVICES LTD. & Co. KG",
      "company_seat": "Berlin",
      "details": "12.05.2025 (Bekanntmachungsdatum)\n\nBerlin Amtsgericht Berlin (Charlottenburg) HRA 53492\nLöschungsankündigung\n\nFTA INDUSTRIAL SERVICES LTD. & Co. KG\nKommanditgesellschaft\nBerlin\n\nBei dem nachstehenden Unternehmen / der nachstehenden Gesellschaft wird das Amtslöschungsverfahren gemäß § 31 Abs. 2 HGB eingeleitet. Widerspruchsfrist 1 Monat"
    },
    {
      "date": "2025-05-12",
      "id": "108680",
      "original_text": "Einreichung neuer Dokumente\nBaden-Württemberg Amtsgericht Mannheim HRB 560103\nEckert Erdbau und Industrie-Abbruch GmbH – Lauda-Königshofen",
      "type": "Einreichung neuer Dokumente",
      "state": "Baden-Württemberg",
      "amtsgericht": "Amtsgericht Mannheim",
      "registernummer": "HRB 560103",
      "registerart": "HRB",
      "company_name": "Eckert Erdbau und Industrie-Abbruch GmbH",
      "company_seat": "Lauda-Königshofen",
      "details": "12.05.2025 (Bekanntmachungsdatum)\n\nBaden-Württemberg Amtsgericht Mannheim HRB 560103\nEinreichung neuer Dokumente 12.05.2025 (Eintragungsdatum)\n\nEckert Erdbau und Industrie-Abbruch GmbH\nGesellschaft mit beschränkter Haftung\nLauda-Königshofen\n\nDie Gesellschaft hat am 11.04.2024 die Liste über die Zusammensetzung des Aufsichtsrats zum Handelsregister eingereicht."
    },
    {
      "date": "2025-05-12",
      "id": "108681",
      "original_text": "Registerbekanntmachung nach dem Umwandlungsgesetz\nBerlin Amtsgericht Berlin (Charlottenburg) HRA 63195\nGebrüder Michels GmbH & Co. KG – Berlin",
      "type": "Registerbekanntmachung nach dem Umwandlungsgesetz",
      "state": "Berlin",
      "amtsgericht": "Amtsgericht Berlin (Charlottenburg)",
      "registernummer": "HRA 63195",
      "registerart": "HRA",
      "company_name": "Gebrüder Michels GmbH & Co. KG",
      "company_seat": "Berlin",
      "details": "12.05.2025 (Bekanntmachungsdatum)\n\nBerlin Amtsgericht Berlin (Charlottenburg) HRA 63195\nRegisterbekanntmachung nach dem Umwandlungsgesetz 07.05.2025 (Eintragungsdatum)\n\nGebrüder Michels GmbH & Co. KG\nKommanditgesellschaft\nBerlin\n\nZu Eintragungsnummer 9 vom 07.05.2025 wird als nicht eingetragen veröffentlicht:\nDen Gläubigern der an der Verschmelzung beteiligten Rechtsträger ist, wenn sie binnen sechs Monaten nach dem Tag, an dem die Eintragung der Verschmelzung in das Register des Sitzes desjenigen Rechtsträgers, dessen Gläubiger sie sind, als bekannt gemacht gilt, ihren Anspruch nach Grund und Höhe schriftlich anmelden, Sicherheit zu leisten, soweit sie nicht Befriedigung verlangen können. Dieses Recht steht den Gläubigern jedoch nur zu, wenn sie glaubhaft machen, dass durch die Verschmelzung die Erfüllung ihrer Forderung gefährdet wird. Das Recht, Sicherheitsleistung zu verlangen, steht Gläubigern nicht zu, die im Falle der Insolvenz ein Recht auf vorzugsweise Befriedigung aus einer Deckungsmasse haben, die nach gesetzlicher Vorschrift zu ihrem Schutz errichtet und staatlich überwacht ist."
    },
    {
      "date": "2025-05-12",
      "id": "108682",
      "original_text": "Löschungsankündigung\nBerlin Amtsgericht Berlin (Charlottenburg) HRB 208057\ntractionpartner GmbH – Berlin",
      "type": "Löschungsankündigung",
      "state": "Berlin",
      "amtsgericht": "Amtsgericht Berlin (Charlottenburg)",
      "registernummer": "HRB 208057",
      "registerart": "HRB",
      "company_name": "tractionpartner GmbH",
      "company_seat": "Berlin",
      "details": "12.05.2025 (Bekanntmachungsdatum)\n\nBerlin Amtsgericht Berlin (Charlottenburg) HRB 208057\nLöschungsankündigung\n\ntractionpartner GmbH\nGesellschaft mit beschränkter Haftung\nBerlin\n\nBei der nachstehenden Gesellschaft wird das Amtslöschungsverfahren gemäß § 394 FamFG eingeleitet. Widerspruchsfrist 6 Wochen"
    },
    {
      "date": "2025-05-12",
      "id": "108683",
      "original_text": "Registerbekanntmachung nach dem Umwandlungsgesetz\nBaden-Württemberg Amtsgericht Ulm HRB 748182\nNaitOut GmbH – Ravensburg",
      "type": "Registerbekanntmachung nach dem Umwandlungsgesetz",
      "state": "Baden-Württemberg",
      "amtsgericht": "Amtsgericht Ulm",
      "registernummer": "HRB 748182",
      "registerart": "HRB",
      "company_name": "NaitOut GmbH",
      "company_seat": "Ravensburg",
      "details": "12.05.2025 (Bekanntmachungsdatum)\n\nBaden-Württemberg Amtsgericht Ulm HRB 748182\nRegisterbekanntmachung nach dem Umwandlungsgesetz 12.05.2025 (Eintragungsdatum)\n\nNaitOut GmbH\nGesellschaft mit beschränkter Haftung\nRavensburg\n\nAls nicht eingetragen wird bekanntgemacht:\nDen Gläubigern der an der Verschmelzung beteiligten Rechtsträger ist, wenn sie binnen sechs Monaten nach dem Tag, an dem die Eintragung der Verschmelzung in das Register des Sitzes desjenigen Rechtsträgers, dessen Gläubiger sie sind, nach § 19 Abs. 3 UmwG als bekanntgemacht gilt, ihren Anspruch nach Grund und Höhe schriftlich anmelden, Sicherheit zu leisten, soweit sie nicht Befriedigung verlangen können. Dieses Recht steht den Gläubigern jedoch nur zu, wenn sie glaubhaft machen, dass durch die Verschmelzung die Erfüllung ihrer Forderung gefährdet wird."
    },
    {
      "date": "2025-05-12",
      "id": "108684",
      "original_text": "Registerbekanntmachung nach dem Umwandlungsgesetz\nBrandenburg Amtsgericht Cottbus HRB 12330\nMAZ Süd Zeitungs-Vertriebs-GmbH – Königs Wusterhausen",
      "type": "Registerbekanntmachung nach dem Umwandlungsgesetz",
      "state": "Brandenburg",
      "amtsgericht": "Amtsgericht Cottbus",
      "registernummer": "HRB 12330",
      "registerart": "HRB",
      "company_name": "MAZ Süd Zeitungs-Vertriebs-GmbH",
      "company_seat": "Königs Wusterhausen",
      "details": "12.05.2025 (Bekanntmachungsdatum)\n\nBrandenburg Amtsgericht Cottbus HRB 12330\nRegisterbekanntmachung nach dem Umwandlungsgesetz 10.05.2025 (Eintragungsdatum)\n\nMAZ Süd Zeitungs-Vertriebs-GmbH\nGesellschaft mit beschränkter Haftung\nKönigs Wusterhausen\n\nZu Eintragungsnummer 5 vom 10.05.2025 wird als nicht eingetragen veröffentlicht: Als nicht eingetragen wird veröffentlicht:\nDen Gläubigern der an der Verschmelzung beteiligten Rechtsträger ist, wenn sie binnen sechs Monaten nach dem Tag, an dem die Eintragung der Verschmelzung in das Register des Sitzes desjenigen Rechtsträgers, dessen Gläubiger sie sind, als bekannt gemacht gilt, ihren Anspruch nach Grund und Höhe schriftlich anmelden, Sicherheit zu leisten, soweit sie nicht Befriedigung verlangen können. Dieses Recht steht den Gläubigern jedoch nur zu, wenn sie glaubhaft machen, dass durch die Verschmelzung die Erfüllung ihrer Forderung gefährdet wird"
    },
    {
      "date": "2025-05-12",
      "id": "108685",
      "original_text": "Registerbekanntmachung nach dem Umwandlungsgesetz\nBaden-Württemberg Amtsgericht Ulm HRB 741516\nSIVISIONS GmbH – Ravensburg",
      "type": "Registerbekanntmachung nach dem Umwandlungsgesetz",
      "state": "Baden-Württemberg",
      "amtsgericht": "Amtsgericht Ulm",
      "registernummer": "HRB 741516",
      "registerart": "HRB",
      "company_name": "SIVISIONS GmbH",
      "company_seat": "Ravensburg",
      "details": "12.05.2025 (Bekanntmachungsdatum)\n\nBaden-Württemberg Amtsgericht Ulm HRB 741516\nRegisterbekanntmachung nach dem Umwandlungsgesetz 12.05.2025 (Eintragungsdatum)\n\nSIVISIONS GmbH\nGesellschaft mit beschränkter Haftung\nRavensburg\n\nAls nicht eingetragen wird bekanntgemacht:\nDen Gläubigern der an der Verschmelzung beteiligten Rechtsträger ist, wenn sie binnen sechs Monaten nach dem Tag, an dem die Eintragung der Verschmelzung in das Register des Sitzes desjenigen Rechtsträgers, dessen Gläubiger sie sind, nach § 19 Abs. 3 UmwG als bekanntgemacht gilt, ihren Anspruch nach Grund und Höhe schriftlich anmelden, Sicherheit zu leisten, soweit sie nicht Befriedigung verlangen können. Dieses Recht steht den Gläubigern jedoch nur zu, wenn sie glaubhaft machen, dass durch die Verschmelzung die Erfüllung ihrer Forderung gefährdet wird."
    },
    {
      "date": "2025-05-12",
      "id": "108686",
      "original_text": "Löschungsankündigung\nBrandenburg Amtsgericht Frankfurt/Oder HRB 18942\nVENDHAUS Trade UG (haftungsbeschränkt) – Vierlinden",
      "type": "Löschungsankündigung",
      "state": "Brandenburg",
      "amtsgericht": "Amtsgericht Frankfurt/Oder",
      "registernummer": "HRB 18942",
      "registerart": "HRB",
      "company_name": "VENDHAUS Trade UG (haftungsbeschränkt)",
      "company_seat": "Vierlinden",
      "details": "12.05.2025 (Bekanntmachungsdatum)\n\nBrandenburg Amtsgericht Frankfurt/Oder HRB 18942\nLöschungsankündigung\n\nVENDHAUS Trade UG (haftungsbeschränkt)\nGesellschaft mit beschränkter Haftung\nVierlinden\n\nBei der nachstehenden Gesellschaft wird das Amtslöschungsverfahren gemäß § 394 FamFG eingeleitet."
    },
    {
      "date": "2025-05-12",
      "id": "108687",
      "original_text": "Löschungsankündigung\nThüringen Amtsgericht Jena HRA 506672\nDachwerk Lippoldt NRW 24 GmbH & Co. KG – Erfurt",
      "type": "Löschungsankündigung",
      "state": "Thüringen",
      "amtsgericht": "Amtsgericht Jena",
      "registernummer": "HRA 506672",
      "registerart": "HRA",
      "company_name": "Dachwerk Lippoldt NRW 24 GmbH & Co. KG",
      "company_seat": "Erfurt",
      "details": "12.05.2025 (Bekanntmachungsdatum)\n\nThüringen Amtsgericht Jena HRA 506672\nLöschungsankündigung\n\nDachwerk Lippoldt NRW 24 GmbH & Co. KG\nKommanditgesellschaft\nErfurt\n\nDas Registergericht beabsichtigt, die im Handelsregister eingetragene Gesellschaft wegen Vermögenslosigkeit nach § 31 Abs.2 HGB iVm § 393 FamFG  von Amts wegen zu löschen. Die Frist zur Erhebung eines Widerspruchs gegen die beabsichtigte Löschung wird auf 6 Wochen festgesetzt."
    },
    {
      "date": "2025-05-12",
      "id": "108688",
      "original_text": "Löschungsankündigung\nBrandenburg Amtsgericht Frankfurt/Oder HRB 19257\nWürfelbau GmbH – Bad Freienwalde (Oder)",
      "type": "Löschungsankündigung",
      "state": "Brandenburg",
      "amtsgericht": "Amtsgericht Frankfurt/Oder",
      "registernummer": "HRB 19257",
      "registerart": "HRB",
      "company_name": "Würfelbau GmbH",
      "company_seat": "Bad Freienwalde (Oder)",
      "details": "12.05.2025 (Bekanntmachungsdatum)\n\nBrandenburg Amtsgericht Frankfurt/Oder HRB 19257\nLöschungsankündigung\n\nWürfelbau GmbH\nGesellschaft mit beschränkter Haftung\nBad Freienwalde (Oder)\n\nBei der nachstehenden Gesellschaft wird das Amtslöschungsverfahren gemäß § 394 Abs. 1 FamFG eingeleitet."
    },
    {
      "date": "2025-05-12",
      "id": "108689",
      "original_text": "Registerbekanntmachung nach dem Umwandlungsgesetz\nBaden-Württemberg Amtsgericht Stuttgart HRB 222\nStuttgarter Lebensversicherung a.G. – Stuttgart",
      "type": "Registerbekanntmachung nach dem Umwandlungsgesetz",
      "state": "Baden-Württemberg",
      "amtsgericht": "Amtsgericht Stuttgart",
      "registernummer": "HRB 222",
      "registerart": "HRB",
      "company_name": "Stuttgarter Lebensversicherung a.G.",
      "company_seat": "Stuttgart",
      "details": "12.05.2025 (Bekanntmachungsdatum)\n\nBaden-Württemberg Amtsgericht Stuttgart HRB 222\nRegisterbekanntmachung nach dem Umwandlungsgesetz\n\nStuttgarter Lebensversicherung a.G.\nVersicherungsverein auf Gegenseitigkeit\nStuttgart\n\nDie Gesellschaft hat am 12.05.2025 den Entwurf des Verschmelzungsvertrages zwischen \"Süddeutsche Lebensversicherung a.G.\", Fellbach (Amtsgericht Amtsgericht Stuttgart HRB 263284)  und der hiesigen Gesellschaft (übernehmender Rechtsträger) zum Handelsregister eingereicht."
    },
    {
      "date": "2025-05-12",
      "id": "108690",
      "original_text": "Löschungsankündigung\nBaden-Württemberg Amtsgericht Freiburg HRB 715382\nOffice4all UG (haftungsbeschränkt) – Engen",
      "type": "Löschungsankündigung",
      "state": "Baden-Württemberg",
      "amtsgericht": "Amtsgericht Freiburg",
      "registernummer": "HRB 715382",
      "registerart": "HRB",
      "company_name": "Office4all UG (haftungsbeschränkt)",
      "company_seat": "Engen",
      "details": "12.05.2025 (Bekanntmachungsdatum)\n\nBaden-Württemberg Amtsgericht Freiburg HRB 715382\nLöschungsankündigung\n\nOffice4all UG (haftungsbeschränkt)\nGesellschaft mit beschränkter Haftung\nEngen\n\nAls nicht eingetragen wird bekanntgemacht:\nDas Gericht beabsichtigt, die Gesellschaft wegen Vermögenslosigkeit im Handelsregister von Amts wegen nach § 394 FamFG zu löschen. Die Frist zur Geltendmachung eines Widerspruchs gegen die beabsichtigte Löschung ist auf einen Monat ab Veröffentlichung bestimmt."
    },
    {
      "date": "2025-05-12",
      "id": "108691",
      "original_text": "Registerbekanntmachung nach dem Umwandlungsgesetz\nBrandenburg Amtsgericht Potsdam HRB 40654\nwisefood GmbH – Potsdam",
      "type": "Registerbekanntmachung nach dem Umwandlungsgesetz",
      "state": "Brandenburg",
      "amtsgericht": "Amtsgericht Potsdam",
      "registernummer": "HRB 40654",
      "registerart": "HRB",
      "company_name": "wisefood GmbH",
      "company_seat": "Potsdam",
      "details": "12.05.2025 (Bekanntmachungsdatum)\n\nBrandenburg Amtsgericht Potsdam HRB 40654\nRegisterbekanntmachung nach dem Umwandlungsgesetz 01.05.2025 (Eintragungsdatum)\n\nwisefood GmbH\nGesellschaft mit beschränkter Haftung\nPotsdam\n\nZu Eintragungsnummer 2 vom 01.05.2025 wird als nicht eingetragen veröffentlicht: Den Gläubigern der an der Verschmelzung beteiligten Rechtsträger ist, wenn sie binnen sechs Monaten nach dem Tag, an dem die Eintragung der Verschmelzung in das Register des Sitzes desjenigen Rechtsträgers, dessen Gläubiger sie sind, als bekannt gemacht gilt, ihren Anspruch nach Grund und Höhe schriftlich anmelden, Sicherheit zu leisten, soweit sie nicht Befriedigung verlangen können. Dieses Recht steht den Gläubigern jedoch nur zu, wenn sie glaubhaft machen, dass durch die Verschmelzung die Erfüllung ihrer Forderung gefährdet wird."
    },
    {
      "date": "2025-05-12",
      "id": "108692",
      "original_text": "Registerbekanntmachung nach dem Umwandlungsgesetz\nHamburg Amtsgericht Hamburg HRA 131864\nDr. Finzel Pro Health Coaching LLC & Co. KG – Hamburg",
      "type": "Registerbekanntmachung nach dem Umwandlungsgesetz",
      "state": "Hamburg",
      "amtsgericht": "Amtsgericht Hamburg",
      "registernummer": "HRA 131864",
      "registerart": "HRA",
      "company_name": "Dr. Finzel Pro Health Coaching LLC & Co. KG",
      "company_seat": "Hamburg",
      "details": "12.05.2025 (Bekanntmachungsdatum)\n\nHamburg Amtsgericht Hamburg HRA 131864\nRegisterbekanntmachung nach dem Umwandlungsgesetz 12.05.2025 (Eintragungsdatum)\n\nDr. Finzel Pro Health Coaching LLC & Co. KG\nKommanditgesellschaft\nHamburg\n\nAls nicht eingetragen wird bekannt gemacht:\nDen Gläubigern der an der Verschmelzung beteiligten Gesellschaften ist, wenn sie binnen sechs Monaten nach dem Tag, an dem die Eintragung der Verschmelzung in das Register des Sitzes desjenigen Rechtsträgers, dessen Gläubiger sie sind, nach § 19 Absatz 3 UmwG als bekannt gemacht gilt, ihren Anspruch nach Grund und Höhe schriftlich anmelden, Sicherheit zu leisten, soweit sie nicht Befriedigung verlangen können. Dieses Recht steht den Gläubigern jedoch nur zu, wenn sie glaubhaft machen, dass durch die Verschmelzung die Erfüllung ihrer Forderung gefährdet wird."
    },
    {
      "date": "2025-05-12",
      "id": "108693",
      "original_text": "Registerbekanntmachung nach dem Umwandlungsgesetz\nHamburg Amtsgericht Hamburg HRB 75982\nDr. Finzel Pro Gesundheit GmbH – Hamburg",
      "type": "Registerbekanntmachung nach dem Umwandlungsgesetz",
      "state": "Hamburg",
      "amtsgericht": "Amtsgericht Hamburg",
      "registernummer": "HRB 75982",
      "registerart": "HRB",
      "company_name": "Dr. Finzel Pro Gesundheit GmbH",
      "company_seat": "Hamburg",
      "details": "12.05.2025 (Bekanntmachungsdatum)\n\nHamburg Amtsgericht Hamburg HRB 75982\nRegisterbekanntmachung nach dem Umwandlungsgesetz 12.05.2025 (Eintragungsdatum)\n\nDr. Finzel Pro Gesundheit GmbH\nGesellschaft mit beschränkter Haftung\nHamburg\n\nAls nicht eingetragen wird bekannt gemacht:\nDen Gläubigern der an der Verschmelzung beteiligten Gesellschaften ist, wenn sie binnen sechs Monaten nach dem Tag, an dem die Eintragung der Verschmelzung in das Register des Sitzes desjenigen Rechtsträgers, dessen Gläubiger sie sind, nach § 19 Absatz 3 UmwG als bekannt gemacht gilt, ihren Anspruch nach Grund und Höhe schriftlich anmelden, Sicherheit zu leisten, soweit sie nicht Befriedigung verlangen können. Dieses Recht steht den Gläubigern jedoch nur zu, wenn sie glaubhaft machen, dass durch die Verschmelzung die Erfüllung ihrer Forderung gefährdet wird."
    },
    {
      "date": "2025-05-12",
      "id": "108694",
      "original_text": "Registerbekanntmachung nach dem Umwandlungsgesetz\nBerlin Amtsgericht Berlin (Charlottenburg) HRB 221144\nInf Re-Invest GmbH – Berlin",
      "type": "Registerbekanntmachung nach dem Umwandlungsgesetz",
      "state": "Berlin",
      "amtsgericht": "Amtsgericht Berlin (Charlottenburg)",
      "registernummer": "HRB 221144",
      "registerart": "HRB",
      "company_name": "Inf Re-Invest GmbH",
      "company_seat": "Berlin",
      "details": "12.05.2025 (Bekanntmachungsdatum)\n\nBerlin Amtsgericht Berlin (Charlottenburg) HRB 221144\nRegisterbekanntmachung nach dem Umwandlungsgesetz 09.05.2025 (Eintragungsdatum)\n\nInf Re-Invest GmbH\nGesellschaft mit beschränkter Haftung\nBerlin\n\nZu Eintragungsnummer 6 vom 09.05.2025 wird als nicht eingetragen veröffentlicht:Den Gläubigern der an der Verschmelzung beteiligten Rechtsträger ist, wenn sie binnen sechs Monaten nach dem Tag, an dem die Eintragung der Verschmelzung in das Register des Sitzes desjenigen Rechtsträgers, dessen Gläubiger sie sind, als bekannt gemacht gilt, ihren Anspruch nach Grund und Höhe schriftlich anmelden, Sicherheit zu leisten, soweit sie nicht Befriedigung verlangen können. Dieses Recht steht den Gläubigern jedoch nur zu, wenn sie glaubhaft machen, dass durch die Verschmelzung die Erfüllung ihrer Forderung gefährdet wird. Das Recht, Sicherheitsleistung zu verlangen, steht Gläubigern nicht zu, die im Falle der Insolvenz ein Recht auf vorzugsweise Befriedigung aus einer Deckungsmasse haben, die nach gesetzlicher Vorschrift zu ihrem Schutz errichtet und staatlich überwacht ist."
    },
    {
      "date": "2025-05-12",
      "id": "108695",
      "original_text": "Löschungsankündigung\nBerlin Amtsgericht Berlin (Charlottenburg) HRB 141516\nmovinary UG (haftungsbeschränkt) – Berlin",
      "type": "Löschungsankündigung",
      "state": "Berlin",
      "amtsgericht": "Amtsgericht Berlin (Charlottenburg)",
      "registernummer": "HRB 141516",
      "registerart": "HRB",
      "company_name": "movinary UG (haftungsbeschränkt)",
      "company_seat": "Berlin",
      "details": "12.05.2025 (Bekanntmachungsdatum)\n\nBerlin Amtsgericht Berlin (Charlottenburg) HRB 141516\nLöschungsankündigung\n\nmovinary UG (haftungsbeschränkt)\nGesellschaft mit beschränkter Haftung\nBerlin\n\nBei der nachstehenden Gesellschaft wird das Amtslöschungsverfahren gemäß § 394 FamFG eingeleitet. Widerspruchsfrist: 6 Wochen."
    },
    {
      "date": "2025-05-12",
      "id": "108696",
      "original_text": "Registerbekanntmachung nach dem Umwandlungsgesetz\nBaden-Württemberg Amtsgericht Stuttgart HRB 737222\nTÜV SÜD Auto Plus GmbH – Stuttgart",
      "type": "Registerbekanntmachung nach dem Umwandlungsgesetz",
      "state": "Baden-Württemberg",
      "amtsgericht": "Amtsgericht Stuttgart",
      "registernummer": "HRB 737222",
      "registerart": "HRB",
      "company_name": "TÜV SÜD Auto Plus GmbH",
      "company_seat": "Stuttgart",
      "details": "12.05.2025 (Bekanntmachungsdatum)\n\nBaden-Württemberg Amtsgericht Stuttgart HRB 737222\nRegisterbekanntmachung nach dem Umwandlungsgesetz 12.05.2025 (Eintragungsdatum)\n\nTÜV SÜD Auto Plus GmbH\nGesellschaft mit beschränkter Haftung\nStuttgart\n\nAls nicht eingetragen wird bekanntgemacht:\nDen Gläubigern der an der Verschmelzung beteiligten Rechtsträger ist, wenn sie binnen sechs Monaten nach dem Tag, an dem die Eintragung der Verschmelzung in das Register des Sitzes desjenigen Rechtsträgers, dessen Gläubiger sie sind, nach § 19 Abs. 3 UmwG als bekanntgemacht gilt, ihren Anspruch nach Grund und Höhe schriftlich anmelden, Sicherheit zu leisten, soweit sie nicht Befriedigung verlangen können. Dieses Recht steht den Gläubigern jedoch nur zu, wenn sie glaubhaft machen, dass durch die Verschmelzung die Erfüllung ihrer Forderung gefährdet wird."
    },
    {
      "date": "2025-05-12",
      "id": "108697",
      "original_text": "Löschungsankündigung\nBerlin Amtsgericht Berlin (Charlottenburg) HRB 252469\nKey Berlin GmbH – Berlin",
      "type": "Löschungsankündigung",
      "state": "Berlin",
      "amtsgericht": "Amtsgericht Berlin (Charlottenburg)",
      "registernummer": "HRB 252469",
      "registerart": "HRB",
      "company_name": "Key Berlin GmbH",
      "company_seat": "Berlin",
      "details": "12.05.2025 (Bekanntmachungsdatum)\n\nBerlin Amtsgericht Berlin (Charlottenburg) HRB 252469\nLöschungsankündigung\n\nKey Berlin GmbH\nGesellschaft mit beschränkter Haftung\nBerlin\n\nBei der nachstehenden Gesellschaft wird das Amtslöschungsverfahren gemäß § 394 FamFG eingeleitet. Widerspruchsfrist: 6 Wochen."
    },
    {
      "date": "2025-05-12",
      "id": "108698",
      "original_text": "Löschungsankündigung\nBaden-Württemberg Amtsgericht Mannheim HRB 211280\nGrolit GmbH – Bühl",
      "type": "Löschungsankündigung",
      "state": "Baden-Württemberg",
      "amtsgericht": "Amtsgericht Mannheim",
      "registernummer": "HRB 211280",
      "registerart": "HRB",
      "company_name": "Grolit GmbH",
      "company_seat": "Bühl",
      "details": "12.05.2025 (Bekanntmachungsdatum)\n\nBaden-Württemberg Amtsgericht Mannheim HRB 211280\nLöschungsankündigung\n\nGrolit GmbH\nGesellschaft mit beschränkter Haftung\nBühl\n\nDas Gericht beabsichtigt, die Gesellschaft wegen Vermögenslosigkeit im Handelsregister von Amts wegen nach § 394 FamFG zu löschen. Die Frist zur Geltendmachung eines Widerspruchs gegen die beabsichtigte Löschung ist auf einen Monat ab Veröffentlichung bestimmt."
    },
    {
      "date": "2025-05-12",
      "id": "108699",
      "original_text": "Sonstige Registerbekanntmachung\nHamburg Amtsgericht Hamburg HRB 19721\nATG Alster-Touristik GmbH. – Hamburg",
      "type": "Sonstige Registerbekanntmachung",
      "state": "Hamburg",
      "amtsgericht": "Amtsgericht Hamburg",
      "registernummer": "HRB 19721",
      "registerart": "HRB",
      "company_name": "ATG Alster-Touristik GmbH.",
      "company_seat": "Hamburg",
      "details": "12.05.2025 (Bekanntmachungsdatum)\n\nHamburg Amtsgericht Hamburg HRB 19721\nSonstige Registerbekanntmachung\n\nATG Alster-Touristik GmbH.\nGesellschaft mit beschränkter Haftung\nHamburg\n\nAls nicht eingetragen wird bekannt gemacht: Liste des Aufsichtsrats wurde eingereicht."
    },
    {
      "date": "2025-05-12",
      "id": "108700",
      "original_text": "Löschungsankündigung\nBaden-Württemberg Amtsgericht Mannheim HRB 520526\nAutohaus Vollmer u. Sack GmbH – Rastatt",
      "type": "Löschungsankündigung",
      "state": "Baden-Württemberg",
      "amtsgericht": "Amtsgericht Mannheim",
      "registernummer": "HRB 520526",
      "registerart": "HRB",
      "company_name": "Autohaus Vollmer u. Sack GmbH",
      "company_seat": "Rastatt",
      "details": "12.05.2025 (Bekanntmachungsdatum)\n\nBaden-Württemberg Amtsgericht Mannheim HRB 520526\nLöschungsankündigung\n\nAutohaus Vollmer u. Sack GmbH\nGesellschaft mit beschränkter Haftung\nRastatt\n\nDas Gericht beabsichtigt, die Gesellschaft wegen Vermögenslosigkeit im Handelsregister von Amts wegen nach § 394 FamFG zu löschen. Die Frist zur Geltendmachung eines Widerspruchs gegen die beabsichtigte Löschung ist auf einen Monat ab Veröffentlichung bestimmt."
    },
    {
      "date": "2025-05-12",
      "id": "108701",
      "original_text": "Registerbekanntmachung nach dem Umwandlungsgesetz\nHamburg Amtsgericht Hamburg HRB 172384\nwe speak fluent cx GmbH – Hamburg",
      "type": "Registerbekanntmachung nach dem Umwandlungsgesetz",
      "state": "Hamburg",
      "amtsgericht": "Amtsgericht Hamburg",
      "registernummer": "HRB 172384",
      "registerart": "HRB",
      "company_name": "we speak fluent cx GmbH",
      "company_seat": "Hamburg",
      "details": "12.05.2025 (Bekanntmachungsdatum)\n\nHamburg Amtsgericht Hamburg HRB 172384\nRegisterbekanntmachung nach dem Umwandlungsgesetz 12.05.2025 (Eintragungsdatum)\n\nwe speak fluent cx GmbH\nGesellschaft mit beschränkter Haftung\nHamburg\n\nAls nicht eingetragen wird bekannt gemacht:\nDen Gläubigern der an der Verschmelzung beteiligten Gesellschaften ist, wenn sie binnen sechs Monaten nach dem Tag, an dem die Eintragung der Verschmelzung in das Register des Sitzes desjenigen Rechtsträgers, dessen Gläubiger sie sind, nach § 19 Absatz 3 UmwG als bekannt gemacht gilt, ihren Anspruch nach Grund und Höhe schriftlich anmelden, Sicherheit zu leisten, soweit sie nicht Befriedigung verlangen können. Dieses Recht steht den Gläubigern jedoch nur zu, wenn sie glaubhaft machen, dass durch die Verschmelzung die Erfüllung ihrer Forderung gefährdet wird."
    },
    {
      "date": "2025-05-12",
      "id": "108702",
      "original_text": "Löschungsankündigung\nBrandenburg Amtsgericht Potsdam HRB 38722\nVivienne Benitz UG (haftungsbeschränkt) – Stahnsdorf",
      "type": "Löschungsankündigung",
      "state": "Brandenburg",
      "amtsgericht": "Amtsgericht Potsdam",
      "registernummer": "HRB 38722",
      "registerart": "HRB",
      "company_name": "Vivienne Benitz UG (haftungsbeschränkt)",
      "company_seat": "Stahnsdorf",
      "details": "12.05.2025 (Bekanntmachungsdatum)\n\nBrandenburg Amtsgericht Potsdam HRB 38722\nLöschungsankündigung\n\nVivienne Benitz UG (haftungsbeschränkt)\nGesellschaft mit beschränkter Haftung\nStahnsdorf\n\nBei der nachstehenden Gesellschaft wird das Amtslöschungsverfahren gemäß § 394 FamFG eingeleitet. Widerspruchsfrist: 8 Wochen"
    },
    {
      "date": "2025-05-12",
      "id": "108703",
      "original_text": "Sonstige Registerbekanntmachung\nMecklenburg-Vorpommern Amtsgericht Rostock HRB 9080\ndas institut betriebliche altersversorgung + wertkonten beratungsgesellschaft nord-ost aktiengesellschaft – Güstrow",
      "type": "Sonstige Registerbekanntmachung",
      "state": "Mecklenburg-Vorpommern",
      "amtsgericht": "Amtsgericht Rostock",
      "registernummer": "HRB 9080",
      "registerart": "HRB",
      "company_name": "das institut betriebliche altersversorgung + wertkonten beratungsgesellschaft nord-ost aktiengesellschaft",
      "company_seat": "Güstrow",
      "details": "12.05.2025 (Bekanntmachungsdatum)\n\nMecklenburg-Vorpommern Amtsgericht Rostock HRB 9080\nSonstige Registerbekanntmachung\n\ndas institut betriebliche altersversorgung + wertkonten beratungsgesellschaft nord-ost aktiengesellschaft\nAktiengesellschaft\nGüstrow\n\nEine Liste der Mitglieder des Aufsichtsrats ist zum Handelsregister eingereicht worden."
    },
    {
      "date": "2025-05-12",
      "id": "108704",
      "original_text": "Sonstige Registerbekanntmachung\nHamburg Amtsgericht Hamburg HRB 89500\nBaloise Sach Holding AG – Hamburg",
      "type": "Sonstige Registerbekanntmachung",
      "state": "Hamburg",
      "amtsgericht": "Amtsgericht Hamburg",
      "registernummer": "HRB 89500",
      "registerart": "HRB",
      "company_name": "Baloise Sach Holding AG",
      "company_seat": "Hamburg",
      "details": "12.05.2025 (Bekanntmachungsdatum)\n\nHamburg Amtsgericht Hamburg HRB 89500\nSonstige Registerbekanntmachung\n\nBaloise Sach Holding AG\nAktiengesellschaft\nHamburg\n\nAls nicht eingetragen wird bekannt gemacht: Liste des Aufsichtsrats wurde eingereicht."
    },
    {
      "date": "2025-05-12",
      "id": "108705",
      "original_text": "Sonstige Registerbekanntmachung\nHamburg Amtsgericht Hamburg HRB 4659\nBaloise Lebensversicherung Aktiengesellschaft Deutschland – Hamburg",
      "type": "Sonstige Registerbekanntmachung",
      "state": "Hamburg",
      "amtsgericht": "Amtsgericht Hamburg",
      "registernummer": "HRB 4659",
      "registerart": "HRB",
      "company_name": "Baloise Lebensversicherung Aktiengesellschaft Deutschland",
      "company_seat": "Hamburg",
      "details": "12.05.2025 (Bekanntmachungsdatum)\n\nHamburg Amtsgericht Hamburg HRB 4659\nSonstige Registerbekanntmachung\n\nBaloise Lebensversicherung Aktiengesellschaft Deutschland\nAktiengesellschaft\nHamburg\n\nAls nicht eingetragen wird bekannt gemacht: Liste des Aufsichtsrats wurde eingereicht."
    },
    {
      "date": "2025-05-12",
      "id": "108706",
      "original_text": "Löschungsankündigung\nBrandenburg Amtsgericht Potsdam HRB 40072\nterra GmbH – Mühlenberge",
      "type": "Löschungsankündigung",
      "state": "Brandenburg",
      "amtsgericht": "Amtsgericht Potsdam",
      "registernummer": "HRB 40072",
      "registerart": "HRB",
      "company_name": "terra GmbH",
      "company_seat": "Mühlenberge",
      "details": "12.05.2025 (Bekanntmachungsdatum)\n\nBrandenburg Amtsgericht Potsdam HRB 40072\nLöschungsankündigung\n\nterra GmbH\nGesellschaft mit beschränkter Haftung\nMühlenberge\n\nBei der nachstehenden Gesellschaft wird das Amtslöschungsverfahren gemäß § 394 FamFG eingeleitet. Widerspruchsfrist: 8 Wochen"
    },
    {
      "date": "2025-05-12",
      "id": "108707",
      "original_text": "Löschungsankündigung\nBaden-Württemberg Amtsgericht Stuttgart HRB 15186\nHOLLENBACH Wohnbau GmbH – Stuttgart",
      "type": "Löschungsankündigung",
      "state": "Baden-Württemberg",
      "amtsgericht": "Amtsgericht Stuttgart",
      "registernummer": "HRB 15186",
      "registerart": "HRB",
      "company_name": "HOLLENBACH Wohnbau GmbH",
      "company_seat": "Stuttgart",
      "details": "12.05.2025 (Bekanntmachungsdatum)\n\nBaden-Württemberg Amtsgericht Stuttgart HRB 15186\nLöschungsankündigung\n\nHOLLENBACH Wohnbau GmbH\nGesellschaft mit beschränkter Haftung\nStuttgart\n\nDas Gericht beabsichtigt, die Gesellschaft wegen Vermögenslosigkeit im Handelsregister von Amts wegen nach § 394 FamFG zu löschen. Die Frist zur Geltendmachung eines Widerspruchs gegen die beabsichtigte Löschung ist auf zwei Monate ab Veröffentlichung bestimmt."
    },
    {
      "date": "2025-05-12",
      "id": "108708",
      "original_text": "Löschungsankündigung\nSachsen-Anhalt Amtsgericht Stendal VR 1690\nFörderkreis Berufsbildung Handel/ Tourismus/ allgemeine Wirtschaft Sachsen-Anhalt e.V. – Aschersleben",
      "type": "Löschungsankündigung",
      "state": "Sachsen-Anhalt",
      "amtsgericht": "Amtsgericht Stendal",
      "registernummer": "VR 1690",
      "registerart": "VR",
      "company_name": "Förderkreis Berufsbildung Handel/ Tourismus/ allgemeine Wirtschaft Sachsen-Anhalt e.V.",
      "company_seat": "Aschersleben",
      "details": "12.05.2025 (Bekanntmachungsdatum)\n\nSachsen-Anhalt Amtsgericht Stendal VR 1690\nLöschungsankündigung\n\nFörderkreis Berufsbildung Handel/ Tourismus/ allgemeine Wirtschaft Sachsen-Anhalt e.V.\neingetragener Verein\nAschersleben\n\nDas Registergericht beabsichtigt, vorstehenden Verein infolge Wegfalls sämtlicher Mitglieder bzw. vollständiger Aufgabe des Vereinszwecks v.A.w. zu löschen. Die Frist zur Erhebung eines Widerspruchs gegen die beabsichtigte Löschung wird auf zwei Monate festgesetzt."
    },
    {
      "date": "2025-05-12",
      "id": "108709",
      "original_text": "Registerbekanntmachung nach dem Umwandlungsgesetz\nHamburg Amtsgericht Hamburg HRB 115894\nINTTRA Germany GmbH – Hamburg",
      "type": "Registerbekanntmachung nach dem Umwandlungsgesetz",
      "state": "Hamburg",
      "amtsgericht": "Amtsgericht Hamburg",
      "registernummer": "HRB 115894",
      "registerart": "HRB",
      "company_name": "INTTRA Germany GmbH",
      "company_seat": "Hamburg",
      "details": "12.05.2025 (Bekanntmachungsdatum)\n\nHamburg Amtsgericht Hamburg HRB 115894\nRegisterbekanntmachung nach dem Umwandlungsgesetz 12.05.2025 (Eintragungsdatum)\n\nINTTRA Germany GmbH\nGesellschaft mit beschränkter Haftung\nHamburg\n\nAls nicht eingetragen wird bekannt gemacht:\nDen Gläubigern der an der Verschmelzung beteiligten Gesellschaften ist, wenn sie binnen sechs Monaten nach dem Tag, an dem die Eintragung der Verschmelzung in das Register des Sitzes desjenigen Rechtsträgers, dessen Gläubiger sie sind, nach § 19 Absatz 3 UmwG als bekannt gemacht gilt, ihren Anspruch nach Grund und Höhe schriftlich anmelden, Sicherheit zu leisten, soweit sie nicht Befriedigung verlangen können. Dieses Recht steht den Gläubigern jedoch nur zu, wenn sie glaubhaft machen, dass durch die Verschmelzung die Erfüllung ihrer Forderung gefährdet wird."
    },
    {
      "date": "2025-05-12",
      "id": "108710",
      "original_text": "Registerbekanntmachung nach dem Umwandlungsgesetz\nSachsen Amtsgericht Chemnitz HRB 35812\nIKV Containerlogistik GmbH – Glauchau",
      "type": "Registerbekanntmachung nach dem Umwandlungsgesetz",
      "state": "Sachsen",
      "amtsgericht": "Amtsgericht Chemnitz",
      "registernummer": "HRB 35812",
      "registerart": "HRB",
      "company_name": "IKV Containerlogistik GmbH",
      "company_seat": "Glauchau",
      "details": "12.05.2025 (Bekanntmachungsdatum)\n\nSachsen Amtsgericht Chemnitz HRB 35812\nRegisterbekanntmachung nach dem Umwandlungsgesetz 12.05.2025 (Eintragungsdatum)\n\nIKV Containerlogistik GmbH\nGesellschaft mit beschränkter Haftung\nGlauchau\n\nDen Gläubigern der an der Verschmelzung beteiligten Rechtsträger ist, wenn sie binnen sechs Monaten nach dem Tag, an dem die Eintragung der Verschmelzung in das Register des Sitzes desjenigen Rechtsträgers, dessen Gläubiger sie sind, nach § 19 Abs. 3 UmwG als bekannt gemacht gilt, ihren Anspruch nach Grund und Höhe in Textform anmelden, Sicherheit zu leisten, soweit sie nicht Befriedigung verlangen können. Dieses Recht steht den Gläubigern jedoch nur zu, wenn sie glaubhaft machen, dass durch die Verschmelzung die Erfüllung der Forderung gefährdet wird."
    },
    {
      "date": "2025-05-12",
      "id": "108711",
      "original_text": "Registerbekanntmachung nach dem Umwandlungsgesetz\nSachsen Amtsgericht Chemnitz HRB 35817\nSFL Sachsen-Franken Logistik GmbH – Glauchau",
      "type": "Registerbekanntmachung nach dem Umwandlungsgesetz",
      "state": "Sachsen",
      "amtsgericht": "Amtsgericht Chemnitz",
      "registernummer": "HRB 35817",
      "registerart": "HRB",
      "company_name": "SFL Sachsen-Franken Logistik GmbH",
      "company_seat": "Glauchau",
      "details": "12.05.2025 (Bekanntmachungsdatum)\n\nSachsen Amtsgericht Chemnitz HRB 35817\nRegisterbekanntmachung nach dem Umwandlungsgesetz 12.05.2025 (Eintragungsdatum)\n\nSFL Sachsen-Franken Logistik GmbH\nGesellschaft mit beschränkter Haftung\nGlauchau\n\nDen Gläubigern der an der Verschmelzung beteiligten Rechtsträger ist, wenn sie binnen sechs Monaten nach dem Tag, an dem die Eintragung der Verschmelzung in das Register des Sitzes desjenigen Rechtsträgers, dessen Gläubiger sie sind, nach § 19 Abs. 3 UmwG als bekannt gemacht gilt, ihren Anspruch nach Grund und Höhe in Textform anmelden, Sicherheit zu leisten, soweit sie nicht Befriedigung verlangen können. Dieses Recht steht den Gläubigern jedoch nur zu, wenn sie glaubhaft machen, dass durch die Verschmelzung die Erfüllung der Forderung gefährdet wird."
    },
    {
      "date": "2025-05-12",
      "id": "108712",
      "original_text": "Registerbekanntmachung nach dem Umwandlungsgesetz\nSachsen Amtsgericht Dresden HRB 36093\nRMG Holding GmbH – Dresden",
      "type": "Registerbekanntmachung nach dem Umwandlungsgesetz",
      "state": "Sachsen",
      "amtsgericht": "Amtsgericht Dresden",
      "registernummer": "HRB 36093",
      "registerart": "HRB",
      "company_name": "RMG Holding GmbH",
      "company_seat": "Dresden",
      "details": "12.05.2025 (Bekanntmachungsdatum)\n\nSachsen Amtsgericht Dresden HRB 36093\nRegisterbekanntmachung nach dem Umwandlungsgesetz 12.05.2025 (Eintragungsdatum)\n\nRMG Holding GmbH\nGesellschaft mit beschränkter Haftung\nDresden\n\nDen Gläubigern der an der Verschmelzung beteiligten Rechtsträger ist, wenn sie binnen sechs Monaten nach dem Tag, an dem die Eintragung der Verschmelzung in das Register des Sitzes desjenigen Rechtsträgers, dessen Gläubiger sie sind, nach § 19 Abs. 3 UmwG als bekannt gemacht gilt, ihren Anspruch nach Grund und Höhe in Textform anmelden, Sicherheit zu leisten, soweit sie nicht Befriedigung verlangen können. Dieses Recht steht den Gläubigern jedoch nur zu, wenn sie glaubhaft machen, dass durch die Verschmelzung die Erfüllung der Forderung gefährdet wird."
    },
    {
      "date": "2025-05-12",
      "id": "108713",
      "original_text": "Löschungsankündigung\nSachsen Amtsgericht Dresden HRB 45015\nLaWe Online UG (haftungsbeschränkt) – Pulsnitz",
      "type": "Löschungsankündigung",
      "state": "Sachsen",
      "amtsgericht": "Amtsgericht Dresden",
      "registernummer": "HRB 45015",
      "registerart": "HRB",
      "company_name": "LaWe Online UG (haftungsbeschränkt)",
      "company_seat": "Pulsnitz",
      "details": "12.05.2025 (Bekanntmachungsdatum)\n\nSachsen Amtsgericht Dresden HRB 45015\nLöschungsankündigung\n\nLaWe Online UG (haftungsbeschränkt)\nGesellschaft mit beschränkter Haftung\nPulsnitz\n\nDas Registergericht beabsichtigt, die im Handelsregister eingetragene Gesellschaft von Amts wegen nach § 394 FamFG zu löschen. Die Frist zu Erhebung eines Widerspruchs gegen die beabsichtigte Löschung wird auf einen Monat festgesetzt."
    },
    {
      "date": "2025-05-12",
      "id": "108714",
      "original_text": "Registerbekanntmachung nach dem Umwandlungsgesetz\nNiedersachsen Amtsgericht Lüneburg HRA 204456\nFliesen Henke OHG – Stelle",
      "type": "Registerbekanntmachung nach dem Umwandlungsgesetz",
      "state": "Niedersachsen",
      "amtsgericht": "Amtsgericht Lüneburg",
      "registernummer": "HRA 204456",
      "registerart": "HRA",
      "company_name": "Fliesen Henke OHG",
      "company_seat": "Stelle",
      "details": "12.05.2025 (Bekanntmachungsdatum)\n\nNiedersachsen Amtsgericht Lüneburg HRA 204456\nRegisterbekanntmachung nach dem Umwandlungsgesetz 12.05.2025 (Eintragungsdatum)\n\nFliesen Henke OHG\nOffene Handelsgesellschaft\nStelle\n\nDen Gläubigern der an der Ausgliederung beteiligten Rechtsträger ist, wenn sie binnen sechs Monaten nach dem Tag, an dem die Eintragung der Ausgliederung in das Register des Sitzes desjenigen Rechtsträgers, dessen Gläubiger sie sind, nach § 19 Abs. 3 UmwG als bekannt gemacht gilt, ihren Anspruch nach Grund und Höhe schriftlich anmelden, Sicherheit zu leisten, soweit sie nicht Befriedigung verlangen können. Dieses Recht steht den Gläubigern jedoch nur zu, wenn sie glaubhaft machen, dass durch die Ausgliederung die Erfüllung der Forderung gefährdet wird."
    },
    {
      "date": "2025-05-12",
      "id": "108715",
      "original_text": "Registerbekanntmachung nach dem Umwandlungsgesetz\nNiedersachsen Amtsgericht Walsrode HRB 212725\nFarbenspiel GmbH – Rotenburg (Wümme)",
      "type": "Registerbekanntmachung nach dem Umwandlungsgesetz",
      "state": "Niedersachsen",
      "amtsgericht": "Amtsgericht Walsrode",
      "registernummer": "HRB 212725",
      "registerart": "HRB",
      "company_name": "Farbenspiel GmbH",
      "company_seat": "Rotenburg (Wümme)",
      "details": "12.05.2025 (Bekanntmachungsdatum)\n\nNiedersachsen Amtsgericht Walsrode HRB 212725\nRegisterbekanntmachung nach dem Umwandlungsgesetz 12.05.2025 (Eintragungsdatum)\n\nFarbenspiel GmbH\nGesellschaft mit beschränkter Haftung\nRotenburg (Wümme)\n\nDen Gläubigern der an der Ausgliederung beteiligten Rechtsträger ist, wenn sie binnen sechs Monaten nach dem Tag, an dem die Eintragung der Ausgliederung in das Register des Sitzes desjenigen Rechtsträgers, dessen Gläubiger sie sind, nach § 19 Abs. 3 UmwG als bekannt gemacht gilt, ihren Anspruch nach Grund und Höhe schriftlich anmelden, Sicherheit zu leisten, soweit sie nicht Befriedigung verlangen können. Dieses Recht steht den Gläubigern jedoch nur zu, wenn sie glaubhaft machen, dass durch die Ausgliederung die Erfüllung der Forderung gefährdet wird."
    },
    {
      "date": "2025-05-12",
      "id": "108716",
      "original_text": "Registerbekanntmachung nach dem Umwandlungsgesetz\nNiedersachsen Amtsgericht Hannover HRB 204604\nReal G.A. GmbH – Hameln",
      "type": "Registerbekanntmachung nach dem Umwandlungsgesetz",
      "state": "Niedersachsen",
      "amtsgericht": "Amtsgericht Hannover",
      "registernummer": "HRB 204604",
      "registerart": "HRB",
      "company_name": "Real G.A. GmbH",
      "company_seat": "Hameln",
      "details": "12.05.2025 (Bekanntmachungsdatum)\n\nNiedersachsen Amtsgericht Hannover HRB 204604\nRegisterbekanntmachung nach dem Umwandlungsgesetz 12.05.2025 (Eintragungsdatum)\n\nReal G.A. GmbH\nGesellschaft mit beschränkter Haftung\nHameln\n\nDen Gläubigern der an der Verschmelzung beteiligten Rechtsträger ist, wenn sie binnen sechs Monaten nach dem Tag, an dem die Eintragung der Verschmelzung in das Register des Sitzes desjenigen Rechtsträgers, dessen Gläubiger sie sind, nach § 19  Abs.  3 UmwG als bekannt gemacht gilt, ihren Anspruch nach Grund und Höhe schriftlich anmelden, Sicherheit zu leisten, soweit sie nicht Befriedigung verlangen können. Dieses Recht steht den Gläubigern jedoch nur zu, wenn sie glaubhaft machen, dass durch die Verschmelzung die Erfüllung der Forderung gefährdet wird."
    },
    {
      "date": "2025-05-12",
      "id": "108717",
      "original_text": "Registerbekanntmachung nach dem Umwandlungsgesetz\nNiedersachsen Amtsgericht Lüneburg HRA 110166 früher Amtsgericht Winsen\nFliesen - Helmut Henke, Inh. Matthias Stevenz e.K. – Stelle",
      "type": "Registerbekanntmachung nach dem Umwandlungsgesetz",
      "state": "Niedersachsen",
      "amtsgericht": "Amtsgericht Lüneburg",
      "registernummer": "HRA 110166",
      "registerart": "HRA",
      "company_name": "Fliesen - Helmut Henke, Inh. Matthias Stevenz e.K.",
      "company_seat": "Stelle",
      "former_amtsgericht": "Winsen",
      "details": "12.05.2025 (Bekanntmachungsdatum)\n\nNiedersachsen Amtsgericht Lüneburg HRA 110166 früher Amtsgericht Winsen\nRegisterbekanntmachung nach dem Umwandlungsgesetz 12.05.2025 (Eintragungsdatum)\n\nFliesen - Helmut Henke, Inh. Matthias Stevenz e.K.\nEinzelkaufmann / Einzelkauffrau\nStelle\n\nDen Gläubigern der an der Ausgliederung beteiligten Rechtsträger ist, wenn sie binnen sechs Monaten nach dem Tag, an dem die Eintragung der Ausgliederung in das Register des Sitzes desjenigen Rechtsträgers, dessen Gläubiger sie sind, nach § 19 Abs. 3 UmwG als bekannt gemacht gilt, ihren Anspruch nach Grund und Höhe schriftlich anmelden, Sicherheit zu leisten, soweit sie nicht Befriedigung verlangen können. Dieses Recht steht den Gläubigern jedoch nur zu, wenn sie glaubhaft machen, dass durch die Ausgliederung die Erfüllung der Forderung gefährdet wird."
    },
    {
      "date": "2025-05-12",
      "id": "108718",
      "original_text": "Löschungsankündigung\nNiedersachsen Amtsgericht Braunschweig HRB 203429\nAutohaus Lorenz GmbH – Wolfenbüttel",
      "type": "Löschungsankündigung",
      "state": "Niedersachsen",
      "amtsgericht": "Amtsgericht Braunschweig",
      "registernummer": "HRB 203429",
      "registerart": "HRB",
      "company_name": "Autohaus Lorenz GmbH",
      "company_seat": "Wolfenbüttel",
      "details": "12.05.2025 (Bekanntmachungsdatum)\n\nNiedersachsen Amtsgericht Braunschweig HRB 203429\nLöschungsankündigung 12.05.2025 (Eintragungsdatum)\n\nAutohaus Lorenz GmbH\nGesellschaft mit beschränkter Haftung\nWolfenbüttel\n\nDas Registergericht beabsichtigt, die Gesellschaft von Amts wegen nach § 394 FamFG zu löschen. Die Frist zur Erhebung eines Widerspruchs ist auf 1 Monat ab dieser Registerbekanntmachung festgesetzt."
    },
    {
      "date": "2025-05-12",
      "id": "108719",
      "original_text": "Löschungsankündigung\nNiedersachsen Amtsgericht Oldenburg (Oldenburg) HRA 130553 früher Amtsgericht Wilhelmshaven\nSchuster Recycling GmbH u. Co. KG – Sande",
      "type": "Löschungsankündigung",
      "state": "Niedersachsen",
      "amtsgericht": "Amtsgericht Oldenburg (Oldenburg)",
      "registernummer": "HRA 130553",
      "registerart": "HRA",
      "company_name": "Schuster Recycling GmbH u. Co. KG",
      "company_seat": "Sande",
      "former_amtsgericht": "Wilhelmshaven",
      "details": "12.05.2025 (Bekanntmachungsdatum)\n\nNiedersachsen Amtsgericht Oldenburg (Oldenburg) HRA 130553 früher Amtsgericht Wilhelmshaven\nLöschungsankündigung 12.05.2025 (Eintragungsdatum)\n\nSchuster Recycling GmbH u. Co. KG\nKommanditgesellschaft\nSande\n\nDas Registergericht beabsichtigt, die Gesellschaft von Amts wegen nach § 394 FamFG zu löschen. Die Frist zur Erhebung eines Widerspruchs ist auf 1 Monat ab dieser Registerbekanntmachung festgesetzt."
    },
    {
      "date": "2025-05-12",
      "id": "108720",
      "original_text": "Einreichung neuer Dokumente\nNiedersachsen Amtsgericht Göttingen HRB 1439\nStadtwerke Göttingen Aktiengesellschaft – Göttingen",
      "type": "Einreichung neuer Dokumente",
      "state": "Niedersachsen",
      "amtsgericht": "Amtsgericht Göttingen",
      "registernummer": "HRB 1439",
      "registerart": "HRB",
      "company_name": "Stadtwerke Göttingen Aktiengesellschaft",
      "company_seat": "Göttingen",
      "details": "12.05.2025 (Bekanntmachungsdatum)\n\nNiedersachsen Amtsgericht Göttingen HRB 1439\nEinreichung neuer Dokumente\n\nStadtwerke Göttingen Aktiengesellschaft\nAktiengesellschaft\nGöttingen\n\nDie Liste der Mitglieder des Aufsichtsrats wurde beim Registergericht eingereicht."
    },
    {
      "date": "2025-05-12",
      "id": "108721",
      "original_text": "Einreichung neuer Dokumente\nNiedersachsen Amtsgericht Osnabrück HRB 18734\n3H Haustechnik, Handel und Holding Aktiengesellschaft – Osnabrück",
      "type": "Einreichung neuer Dokumente",
      "state": "Niedersachsen",
      "amtsgericht": "Amtsgericht Osnabrück",
      "registernummer": "HRB 18734",
      "registerart": "HRB",
      "company_name": "3H Haustechnik, Handel und Holding Aktiengesellschaft",
      "company_seat": "Osnabrück",
      "details": "12.05.2025 (Bekanntmachungsdatum)\n\nNiedersachsen Amtsgericht Osnabrück HRB 18734\nEinreichung neuer Dokumente 12.05.2025 (Eintragungsdatum)\n\n3H Haustechnik, Handel und Holding Aktiengesellschaft\nAktiengesellschaft\nOsnabrück\n\nDie Listen der Mitglieder des Aufsichtsrats wurden beim Registergericht eingereicht."
    },
    {
      "date": "2025-05-12",
      "id": "108722",
      "original_text": "Löschungsankündigung\nNiedersachsen Amtsgericht Tostedt HRB 208801\nPCC Projekt Coordination Company GmbH – Buchholz in der Nordheide",
      "type": "Löschungsankündigung",
      "state": "Niedersachsen",
      "amtsgericht": "Amtsgericht Tostedt",
      "registernummer": "HRB 208801",
      "registerart": "HRB",
      "company_name": "PCC Projekt Coordination Company GmbH",
      "company_seat": "Buchholz in der Nordheide",
      "details": "12.05.2025 (Bekanntmachungsdatum)\n\nNiedersachsen Amtsgericht Tostedt HRB 208801\nLöschungsankündigung\n\nPCC Projekt Coordination Company GmbH\nGesellschaft mit beschränkter Haftung\nBuchholz in der Nordheide\n\nDas Registergericht beabsichtigt, die Gesellschaft von Amts wegen nach § 394 FamFG zu löschen. Die Frist zur Erhebung eines Widerspruchs ist auf 1 Monat ab dieser Registerbekanntmachung festgesetzt."
    },
    {
      "date": "2025-05-12",
      "id": "108723",
      "original_text": "Registerbekanntmachung nach dem Umwandlungsgesetz\nNiedersachsen Amtsgericht Osnabrück HRB 452\nA.S. Aufzug und Service Dienstleistungs GmbH – Bissendorf",
      "type": "Registerbekanntmachung nach dem Umwandlungsgesetz",
      "state": "Niedersachsen",
      "amtsgericht": "Amtsgericht Osnabrück",
      "registernummer": "HRB 452",
      "registerart": "HRB",
      "company_name": "A.S. Aufzug und Service Dienstleistungs GmbH",
      "company_seat": "Bissendorf",
      "details": "12.05.2025 (Bekanntmachungsdatum)\n\nNiedersachsen Amtsgericht Osnabrück HRB 452\nRegisterbekanntmachung nach dem Umwandlungsgesetz 12.05.2025 (Eintragungsdatum)\n\nA.S. Aufzug und Service Dienstleistungs GmbH\nGesellschaft mit beschränkter Haftung\nBissendorf\n\nDen Gläubigern der an der Verschmelzung beteiligten Rechtsträger ist, wenn sie binnen sechs Monaten nach dem Tag, an dem die Eintragung der Verschmelzung in das Register des Sitzes desjenigen Rechtsträgers, dessen Gläubiger sie sind, nach § 19  Abs.  3 UmwG als bekannt gemacht gilt, ihren Anspruch nach Grund und Höhe schriftlich anmelden, Sicherheit zu leisten, soweit sie nicht Befriedigung verlangen können. Dieses Recht steht den Gläubigern jedoch nur zu, wenn sie glaubhaft machen, dass durch die Verschmelzung die Erfüllung der Forderung gefährdet wird."
    },
    {
      "date": "2025-05-12",
      "id": "108724",
      "original_text": "Registerbekanntmachung nach dem Umwandlungsgesetz\nNiedersachsen Amtsgericht Hannover HRB 224307\nReal BK Immobilien GmbH – Hameln",
      "type": "Registerbekanntmachung nach dem Umwandlungsgesetz",
      "state": "Niedersachsen",
      "amtsgericht": "Amtsgericht Hannover",
      "registernummer": "HRB 224307",
      "registerart": "HRB",
      "company_name": "Real BK Immobilien GmbH",
      "company_seat": "Hameln",
      "details": "12.05.2025 (Bekanntmachungsdatum)\n\nNiedersachsen Amtsgericht Hannover HRB 224307\nRegisterbekanntmachung nach dem Umwandlungsgesetz 12.05.2025 (Eintragungsdatum)\n\nReal BK Immobilien GmbH\nGesellschaft mit beschränkter Haftung\nHameln\n\nDen Gläubigern der an der Verschmelzung beteiligten Rechtsträger ist, wenn sie binnen sechs Monaten nach dem Tag, an dem die Eintragung der Verschmelzung in das Register des Sitzes desjenigen Rechtsträgers, dessen Gläubiger sie sind, nach § 19  Abs.  3 UmwG als bekannt gemacht gilt, ihren Anspruch nach Grund und Höhe schriftlich anmelden, Sicherheit zu leisten, soweit sie nicht Befriedigung verlangen können. Dieses Recht steht den Gläubigern jedoch nur zu, wenn sie glaubhaft machen, dass durch die Verschmelzung die Erfüllung der Forderung gefährdet wird."
    },
    {
      "date": "2025-05-12",
      "id": "108725",
      "original_text": "Löschungsankündigung\nNiedersachsen Amtsgericht Braunschweig HRB 210202\nRR-Bau UG (haftungsbeschränkt) – Braunschweig",
      "type": "Löschungsankündigung",
      "state": "Niedersachsen",
      "amtsgericht": "Amtsgericht Braunschweig",
      "registernummer": "HRB 210202",
      "registerart": "HRB",
      "company_name": "RR-Bau UG (haftungsbeschränkt)",
      "company_seat": "Braunschweig",
      "details": "12.05.2025 (Bekanntmachungsdatum)\n\nNiedersachsen Amtsgericht Braunschweig HRB 210202\nLöschungsankündigung\n\nRR-Bau UG (haftungsbeschränkt)\nGesellschaft mit beschränkter Haftung\nBraunschweig\n\nDas Registergericht beabsichtigt, die Gesellschaft von Amts wegen nach § 394 FamFG zu löschen. Die Frist zur Erhebung eines Widerspruchs ist auf 1 Monat ab dieser Registerbekanntmachung festgesetzt."
    },
    {
      "date": "2025-05-12",
      "id": "108726",
      "original_text": "Registerbekanntmachung nach dem Umwandlungsgesetz\nNiedersachsen Amtsgericht Osnabrück HRB 122008 früher Amtsgericht Meppen\nELWA Wassertechnik GmbH – Twist",
      "type": "Registerbekanntmachung nach dem Umwandlungsgesetz",
      "state": "Niedersachsen",
      "amtsgericht": "Amtsgericht Osnabrück",
      "registernummer": "HRB 122008",
      "registerart": "HRB",
      "company_name": "ELWA Wassertechnik GmbH",
      "company_seat": "Twist",
      "former_amtsgericht": "Meppen",
      "details": "12.05.2025 (Bekanntmachungsdatum)\n\nNiedersachsen Amtsgericht Osnabrück HRB 122008 früher Amtsgericht Meppen\nRegisterbekanntmachung nach dem Umwandlungsgesetz 12.05.2025 (Eintragungsdatum)\n\nELWA Wassertechnik GmbH\nGesellschaft mit beschränkter Haftung\nTwist\n\nDen Gläubigern der an der Verschmelzung beteiligten Rechtsträger ist, wenn sie binnen sechs Monaten nach dem Tag, an dem die Eintragung der Verschmelzung in das Register des Sitzes desjenigen Rechtsträgers, dessen Gläubiger sie sind, nach § 19  Abs.  3 UmwG als bekannt gemacht gilt, ihren Anspruch nach Grund und Höhe schriftlich anmelden, Sicherheit zu leisten, soweit sie nicht Befriedigung verlangen können. Dieses Recht steht den Gläubigern jedoch nur zu, wenn sie glaubhaft machen, dass durch die Verschmelzung die Erfüllung der Forderung gefährdet wird."
    },
    {
      "date": "2025-05-12",
      "id": "108727",
      "original_text": "Löschungsankündigung\nNiedersachsen Amtsgericht Aurich HRB 205233\nGraes Haustechnik GmbH – Schwerinsdorf",
      "type": "Löschungsankündigung",
      "state": "Niedersachsen",
      "amtsgericht": "Amtsgericht Aurich",
      "registernummer": "HRB 205233",
      "registerart": "HRB",
      "company_name": "Graes Haustechnik GmbH",
      "company_seat": "Schwerinsdorf",
      "details": "12.05.2025 (Bekanntmachungsdatum)\n\nNiedersachsen Amtsgericht Aurich HRB 205233\nLöschungsankündigung\n\nGraes Haustechnik GmbH\nGesellschaft mit beschränkter Haftung\nSchwerinsdorf\n\nDas Registergericht beabsichtigt, die Gesellschaft von Amts wegen nach § 394 FamFG zu löschen. Die Frist zur Erhebung eines Widerspruchs ist auf 1 Monat ab dieser Registerbekanntmachung festgesetzt."
    },
    {
      "date": "2025-05-12",
      "id": "108728",
      "original_text": "Einreichung neuer Dokumente\nRheinland-Pfalz Amtsgericht Mainz HRB 51356\nJUWI GmbH – Wörrstadt",
      "type": "Einreichung neuer Dokumente",
      "state": "Rheinland-Pfalz",
      "amtsgericht": "Amtsgericht Mainz",
      "registernummer": "HRB 51356",
      "registerart": "HRB",
      "company_name": "JUWI GmbH",
      "company_seat": "Wörrstadt",
      "details": "12.05.2025 (Bekanntmachungsdatum)\n\nRheinland-Pfalz Amtsgericht Mainz HRB 51356\nEinreichung neuer Dokumente\n\nJUWI GmbH\nGesellschaft mit beschränkter Haftung\nWörrstadt\n\nDem Registergericht ist eine neue Liste der Mitglieder des Aufsichtsrates eingereicht worden."
    },
    {
      "date": "2025-05-12",
      "id": "108729",
      "original_text": "Registerbekanntmachung nach dem Umwandlungsgesetz\nRheinland-Pfalz Amtsgericht Montabaur HRB 27667\nBirkenstock Europe GmbH – Linz am Rhein",
      "type": "Registerbekanntmachung nach dem Umwandlungsgesetz",
      "state": "Rheinland-Pfalz",
      "amtsgericht": "Amtsgericht Montabaur",
      "registernummer": "HRB 27667",
      "registerart": "HRB",
      "company_name": "Birkenstock Europe GmbH",
      "company_seat": "Linz am Rhein",
      "details": "12.05.2025 (Bekanntmachungsdatum)\n\nRheinland-Pfalz Amtsgericht Montabaur HRB 27667\nRegisterbekanntmachung nach dem Umwandlungsgesetz 12.05.2025 (Eintragungsdatum)\n\nBirkenstock Europe GmbH\nGesellschaft mit beschränkter Haftung\nLinz am Rhein\n\nGläubigern der an der Abspaltung beteiligten Rechtsträger ist, wenn sie binnen sechs Monaten nach dem Tag, an dem die Eintragung der Abspaltung in das Register des Sitzes desjenigen Rechtsträgers, dessen Gläubiger sie sind, nach § 19 Absatz 3 UmwG als bekanntgemacht gilt, ihren Anspruch nach Grund und Höhe schriftlich anmelden, Sicherheit zu leisten, soweit sie nicht Befriedigung verlangen können.\n\nDieses Recht steht den Gläubigern jedoch nur zu, wenn sie glaubhaft machen, dass durch die Abspaltung die Erfüllung ihrer Forderung gefährdet wird."
    },
    {
      "date": "2025-05-12",
      "id": "108730",
      "original_text": "Löschungsankündigung\nRheinland-Pfalz Amtsgericht Koblenz HRB 4739\nAckermann GmbH – Fachbach",
      "type": "Löschungsankündigung",
      "state": "Rheinland-Pfalz",
      "amtsgericht": "Amtsgericht Koblenz",
      "registernummer": "HRB 4739",
      "registerart": "HRB",
      "company_name": "Ackermann GmbH",
      "company_seat": "Fachbach",
      "details": "12.05.2025 (Bekanntmachungsdatum)\n\nRheinland-Pfalz Amtsgericht Koblenz HRB 4739\nLöschungsankündigung\n\nAckermann GmbH\nGesellschaft mit beschränkter Haftung\nFachbach\n\nDas Registergericht beabsichtigt die Gesellschaft von Amts wegen nach § 394 FamFG zu löschen. Die Frist zur Erhebung eines Widerspruchs ist auf zwei Monate festgesetzt."
    },
    {
      "date": "2025-05-12",
      "id": "108731",
      "original_text": "Registerbekanntmachung nach dem Umwandlungsgesetz\nRheinland-Pfalz Amtsgericht Koblenz HRB 20630\nOntex Inko Deutschland GmbH – Mayen",
      "type": "Registerbekanntmachung nach dem Umwandlungsgesetz",
      "state": "Rheinland-Pfalz",
      "amtsgericht": "Amtsgericht Koblenz",
      "registernummer": "HRB 20630",
      "registerart": "HRB",
      "company_name": "Ontex Inko Deutschland GmbH",
      "company_seat": "Mayen",
      "details": "12.05.2025 (Bekanntmachungsdatum)\n\nRheinland-Pfalz Amtsgericht Koblenz HRB 20630\nRegisterbekanntmachung nach dem Umwandlungsgesetz 12.05.2025 (Eintragungsdatum)\n\nOntex Inko Deutschland GmbH\nGesellschaft mit beschränkter Haftung\nMayen\n\nAls nicht eingetragen wird veröffentlicht: Den Gläubigern der an der Verschmelzung beteiligten Rechtsträger ist, wenn sie binnen sechs Monaten nach dem Tag, an dem die Eintragung der Verschmelzung in das Register des Sitzes desjenigen Rechtsträgers,dessen Gläubiger sie sind, nach § 19 Abs. 3 UmwG als bekannt gemacht gilt, ihren Anspruch nach Grund und Höhe schriftlich anmelden, Sicherheit zu leisten, soweit sie nicht Befriedigung verlangen können. Dieses Recht steht den Gläubigern jedoch nur zu, wenn sie glaubhaft machen, dass durch die Verschmelzung die Erfüllungd er Forderung gefährdet wird."
    },
    {
      "date": "2025-05-12",
      "id": "108732",
      "original_text": "Registerbekanntmachung nach dem Umwandlungsgesetz\nRheinland-Pfalz Amtsgericht Koblenz HRB 11699\nOntex Global Excellence Center GmbH – Mayen",
      "type": "Registerbekanntmachung nach dem Umwandlungsgesetz",
      "state": "Rheinland-Pfalz",
      "amtsgericht": "Amtsgericht Koblenz",
      "registernummer": "HRB 11699",
      "registerart": "HRB",
      "company_name": "Ontex Global Excellence Center GmbH",
      "company_seat": "Mayen",
      "details": "12.05.2025 (Bekanntmachungsdatum)\n\nRheinland-Pfalz Amtsgericht Koblenz HRB 11699\nRegisterbekanntmachung nach dem Umwandlungsgesetz 12.05.2025 (Eintragungsdatum)\n\nOntex Global Excellence Center GmbH\nGesellschaft mit beschränkter Haftung\nMayen\n\nAls nicht eingetragen wird veröffentlicht: Den Gläubigern der an der Verschmelzung beteiligten Rechtsträger ist, wenn sie binnen sechs Monaten nach dem Tag, an dem die Eintragung der Verschmelzung in das Register des Sitzes desjenigen Rechtsträgers,dessen Gläubiger sie sind, nach § 19 Abs. 3 UmwG als bekannt gemacht gilt, ihren Anspruch nach Grund und Höhe schriftlich anmelden, Sicherheit zu leisten, soweit sie nicht Befriedigung verlangen können. Dieses Recht steht den Gläubigern jedoch nur zu, wenn sie glaubhaft machen, dass durch die Verschmelzung die Erfüllungd er Forderung gefährdet wird."
    },
    {
      "date": "2025-05-12",
      "id": "108733",
      "original_text": "Registerbekanntmachung nach dem Umwandlungsgesetz\nRheinland-Pfalz Amtsgericht Koblenz HRB 11498\nWS Windel-Shop GmbH – Mayen",
      "type": "Registerbekanntmachung nach dem Umwandlungsgesetz",
      "state": "Rheinland-Pfalz",
      "amtsgericht": "Amtsgericht Koblenz",
      "registernummer": "HRB 11498",
      "registerart": "HRB",
      "company_name": "WS Windel-Shop GmbH",
      "company_seat": "Mayen",
      "details": "12.05.2025 (Bekanntmachungsdatum)\n\nRheinland-Pfalz Amtsgericht Koblenz HRB 11498\nRegisterbekanntmachung nach dem Umwandlungsgesetz 12.05.2025 (Eintragungsdatum)\n\nWS Windel-Shop GmbH\nGesellschaft mit beschränkter Haftung\nMayen\n\nAls nicht eingetragen wird veröffentlicht: Den Gläubigern der an der Verschmelzung beteiligten Rechtsträger ist, wenn sie binnen sechs Monaten nach dem Tag, an dem die Eintragung der Verschmelzung in das Register des Sitzes desjenigen Rechtsträgers,dessen Gläubiger sie sind, nach § 19 Abs. 3 UmwG als bekannt gemacht gilt, ihren Anspruch nach Grund und Höhe schriftlich anmelden, Sicherheit zu leisten, soweit sie nicht Befriedigung verlangen können. Dieses Recht steht den Gläubigern jedoch nur zu, wenn sie glaubhaft machen, dass durch die Verschmelzung die Erfüllungd er Forderung gefährdet wird."
    },
    {
      "date": "2025-05-12",
      "id": "108734",
      "original_text": "Löschungsankündigung\nNordrhein-Westfalen Amtsgericht Hamm HRB 8793\nAMZ Service UG (haftungsbeschränkt) – Hamm",
      "type": "Löschungsankündigung",
      "state": "Nordrhein-Westfalen",
      "amtsgericht": "Amtsgericht Hamm",
      "registernummer": "HRB 8793",
      "registerart": "HRB",
      "company_name": "AMZ Service UG (haftungsbeschränkt)",
      "company_seat": "Hamm",
      "details": "12.05.2025 (Bekanntmachungsdatum)\n\nNordrhein-Westfalen Amtsgericht Hamm HRB 8793\nLöschungsankündigung\n\nAMZ Service UG (haftungsbeschränkt)\nGesellschaft mit beschränkter Haftung\nHamm\n\nDas Registergericht beabsichtigt die Gesellschaft von Amts wegen nach § 394 FamFG zu löschen. Die Frist zur Erhebung eines Widerspruchs ist auf drei Monate festgesetzt."
    },
    {
      "date": "2025-05-12",
      "id": "108735",
      "original_text": "Sonstige Registerbekanntmachung\nNordrhein-Westfalen Amtsgericht Köln HRB 95741\nDC ONE Security GmbH – Köln",
      "type": "Sonstige Registerbekanntmachung",
      "state": "Nordrhein-Westfalen",
      "amtsgericht": "Amtsgericht Köln",
      "registernummer": "HRB 95741",
      "registerart": "HRB",
      "company_name": "DC ONE Security GmbH",
      "company_seat": "Köln",
      "details": "12.05.2025 (Bekanntmachungsdatum)\n\nNordrhein-Westfalen Amtsgericht Köln HRB 95741\nSonstige Registerbekanntmachung\n\nDC ONE Security GmbH\nGesellschaft mit beschränkter Haftung\nKöln\n\nDas Registergericht beabsichtigt den Geschäftsführer von Amts wegen nach § 395 FamFG zu löschen. Die Frist zur Erhebung eines Widerspruchs ist auf einen Monat festgesetzt."
    },
    {
      "date": "2025-05-12",
      "id": "108736",
      "original_text": "Einreichung neuer Dokumente\nNordrhein-Westfalen Amtsgericht Köln HRB 100486\nZurich Deutscher Herold Lebensversicherung Aktiengesellschaft – Köln",
      "type": "Einreichung neuer Dokumente",
      "state": "Nordrhein-Westfalen",
      "amtsgericht": "Amtsgericht Köln",
      "registernummer": "HRB 100486",
      "registerart": "HRB",
      "company_name": "Zurich Deutscher Herold Lebensversicherung Aktiengesellschaft",
      "company_seat": "Köln",
      "details": "12.05.2025 (Bekanntmachungsdatum)\n\nNordrhein-Westfalen Amtsgericht Köln HRB 100486\nEinreichung neuer Dokumente\n\nZurich Deutscher Herold Lebensversicherung Aktiengesellschaft\nAktiengesellschaft\nKöln\n\nDem Registergericht ist eine Liste der Mitglieder des Aufsichtsrates eingereicht worden."
    },
    {
      "date": "2025-05-12",
      "id": "108737",
      "original_text": "Registerbekanntmachung nach dem Umwandlungsgesetz\nNordrhein-Westfalen Amtsgericht Mönchengladbach HRB 23106\nbatec group GmbH – Wegberg",
      "type": "Registerbekanntmachung nach dem Umwandlungsgesetz",
      "state": "Nordrhein-Westfalen",
      "amtsgericht": "Amtsgericht Mönchengladbach",
      "registernummer": "HRB 23106",
      "registerart": "HRB",
      "company_name": "batec group GmbH",
      "company_seat": "Wegberg",
      "details": "12.05.2025 (Bekanntmachungsdatum)\n\nNordrhein-Westfalen Amtsgericht Mönchengladbach HRB 23106\nRegisterbekanntmachung nach dem Umwandlungsgesetz 12.05.2025 (Eintragungsdatum)\n\nbatec group GmbH\nGesellschaft mit beschränkter Haftung\nWegberg\n\nDen Gläubigern der an der Ausgliederung beteiligten Rechtsträger ist, wenn sie binnen sechs Monaten nach dem Tag, an dem die Eintragung der Ausgliederung in das Register des Sitzes desjenigen Rechtsträgers, dessen Gläubiger sie sind, nach § 19 Absatz 3 UmwG als bekanntgemacht gilt, ihren Anspruch nach Grund und Höhe schriftlich anmelden, Sicherheit zu leisten, soweit sie nicht Befriedigung verlangen können. Dieses Recht steht den Gläubigern jedoch nur zu, wenn sie glaubhaft machen, dass durch die Ausgliederung die Erfüllung ihrer Forderung gefährdet wird."
    },
    {
      "date": "2025-05-12",
      "id": "108738",
      "original_text": "Registerbekanntmachung nach dem Umwandlungsgesetz\nNordrhein-Westfalen Amtsgericht Köln GsR 854\nOdysseum eGbR – Köln",
      "type": "Registerbekanntmachung nach dem Umwandlungsgesetz",
      "state": "Nordrhein-Westfalen",
      "amtsgericht": "Amtsgericht Köln",
      "registernummer": "GsR 854",
      "registerart": "GsR",
      "company_name": "Odysseum eGbR",
      "company_seat": "Köln",
      "details": "12.05.2025 (Bekanntmachungsdatum)\n\nNordrhein-Westfalen Amtsgericht Köln GsR 854\nRegisterbekanntmachung nach dem Umwandlungsgesetz 12.05.2025 (Eintragungsdatum)\n\nOdysseum eGbR\nGesellschaft bürgerlichen Rechts\nKöln\n\nDen Gläubigern der an der formwechselnden Umwandlung beteiligten Rechtsträger ist, wenn sie binnen sechs Monaten nach dem Tag, an dem die Eintragung der formwechselnden Umwandlung in das Register des Sitzes desjenigen Rechtsträgers, dessen Gläubiger sie sind, nach § 19 Absatz 3 UmwG als bekanntgemacht gilt, ihren Anspruch nach Grund und Höhe schriftlich anmelden, Sicherheit zu leisten, soweit sie nicht Befriedigung verlangen können. Dieses Recht steht den Gläubigern jedoch nur zu, wenn sie glaubhaft machen, dass durch die formwechselnden Umwandlung die Erfüllung ihrer Forderung gefährdet wird."
    },
    {
      "date": "2025-05-12",
      "id": "108739",
      "original_text": "Löschungsankündigung\nNordrhein-Westfalen Amtsgericht Bochum HRB 21390\nEssi Europe GmbH – Bochum",
      "type": "Löschungsankündigung",
      "state": "Nordrhein-Westfalen",
      "amtsgericht": "Amtsgericht Bochum",
      "registernummer": "HRB 21390",
      "registerart": "HRB",
      "company_name": "Essi Europe GmbH",
      "company_seat": "Bochum",
      "details": "12.05.2025 (Bekanntmachungsdatum)\n\nNordrhein-Westfalen Amtsgericht Bochum HRB 21390\nLöschungsankündigung\n\nEssi Europe GmbH\nGesellschaft mit beschränkter Haftung\nBochum\n\nDas Registergericht beabsichtigt die Gesellschaft von Amts wegen nach § 394 FamFG zu löschen. Die Frist zur Erhebung eines Widerspruchs ist auf drei Monate festgesetzt."
    },
    {
      "date": "2025-05-12",
      "id": "108740",
      "original_text": "Registerbekanntmachung nach dem Umwandlungsgesetz\nNordrhein-Westfalen Amtsgericht Köln HRB 54079\nFranziskushöhe GmbH – Hürth",
      "type": "Registerbekanntmachung nach dem Umwandlungsgesetz",
      "state": "Nordrhein-Westfalen",
      "amtsgericht": "Amtsgericht Köln",
      "registernummer": "HRB 54079",
      "registerart": "HRB",
      "company_name": "Franziskushöhe GmbH",
      "company_seat": "Hürth",
      "details": "12.05.2025 (Bekanntmachungsdatum)\n\nNordrhein-Westfalen Amtsgericht Köln HRB 54079\nRegisterbekanntmachung nach dem Umwandlungsgesetz 12.05.2025 (Eintragungsdatum)\n\nFranziskushöhe GmbH\nGesellschaft mit beschränkter Haftung\nHürth\n\nDen Gläubigern der an der Verschmelzung beteiligten Rechtsträger ist, wenn sie binnen sechs Monaten nach dem Tag, an dem die Eintragung der Verschmelzung in das Register des Sitzes derjenigen Rechtsträger deren Gläubiger sie sind, nach § 19 Absatz 3 UmwG als bekanntgemacht gilt, ihren Anspruch nach Grund und Höhe schriftlich anmelden, Sicherheit zu leisten, soweit sie nicht Befriedigung verlangen können. Dieses Recht steht den Gläubigern jedoch nur zu, wenn sie glaubhaft machen, dass durch die Verschmelzung die Erfüllung ihrer Forderung gefährdet wird."
    },
    {
      "date": "2025-05-12",
      "id": "108741",
      "original_text": "Registerbekanntmachung nach dem Umwandlungsgesetz\nNordrhein-Westfalen Amtsgericht Köln HRB 74439\nhands-on producers GmbH – Hürth",
      "type": "Registerbekanntmachung nach dem Umwandlungsgesetz",
      "state": "Nordrhein-Westfalen",
      "amtsgericht": "Amtsgericht Köln",
      "registernummer": "HRB 74439",
      "registerart": "HRB",
      "company_name": "hands-on producers GmbH",
      "company_seat": "Hürth",
      "details": "12.05.2025 (Bekanntmachungsdatum)\n\nNordrhein-Westfalen Amtsgericht Köln HRB 74439\nRegisterbekanntmachung nach dem Umwandlungsgesetz 12.05.2025 (Eintragungsdatum)\n\nhands-on producers GmbH\nGesellschaft mit beschränkter Haftung\nHürth\n\nDen Gläubigern der an der Verschmelzung beteiligten Rechtsträger ist, wenn sie binnen sechs Monaten nach dem Tag, an dem die Eintragung der Verschmelzung in das Register des Sitzes derjenigen Rechtsträger deren Gläubiger sie sind, nach § 19 Absatz 3 UmwG als bekanntgemacht gilt, ihren Anspruch nach Grund und Höhe schriftlich anmelden, Sicherheit zu leisten, soweit sie nicht Befriedigung verlangen können. Dieses Recht steht den Gläubigern jedoch nur zu, wenn sie glaubhaft machen, dass durch die Verschmelzung die Erfüllung ihrer Forderung gefährdet wird."
    },
    {
      "date": "2025-05-12",
      "id": "108742",
      "original_text": "Registerbekanntmachung nach dem Umwandlungsgesetz\nNordrhein-Westfalen Amtsgericht Dortmund HRA 19820\nCNS - Notstromsysteme GmbH & Co. KG – Lünen",
      "type": "Registerbekanntmachung nach dem Umwandlungsgesetz",
      "state": "Nordrhein-Westfalen",
      "amtsgericht": "Amtsgericht Dortmund",
      "registernummer": "HRA 19820",
      "registerart": "HRA",
      "company_name": "CNS - Notstromsysteme GmbH & Co. KG",
      "company_seat": "Lünen",
      "details": "12.05.2025 (Bekanntmachungsdatum)\n\nNordrhein-Westfalen Amtsgericht Dortmund HRA 19820\nRegisterbekanntmachung nach dem Umwandlungsgesetz 12.05.2025 (Eintragungsdatum)\n\nCNS - Notstromsysteme GmbH & Co. KG\nKommanditgesellschaft\nLünen\n\nDen Gläubigern der an der Ausgliederung beteiligten Rechtsträger ist, wenn sie binnen sechs Monaten nach dem Tag, an dem die Eintragung der Ausgliederung in das Register des Sitzes desjenigen Rechtsträgers, dessen Gläubiger sie sind, nach § 19 Absatz 3 UmwG als bekanntgemacht gilt, ihren Anspruch nach Grund und Höhe schriftlich anmelden, Sicherheit zu leisten, soweit sie nicht Befriedigung verlangen können. Dieses Recht steht den Gläubigern jedoch nur zu, wenn sie glaubhaft machen, dass durch die Ausgliederung die Erfüllung ihrer Forderung gefährdet wird."
    },
    {
      "date": "2025-05-12",
      "id": "108743",
      "original_text": "Registerbekanntmachung nach dem Umwandlungsgesetz\nNordrhein-Westfalen Amtsgericht Paderborn HRB 14963\nAGRAVIS Westfalen-Hessen GmbH – Brakel",
      "type": "Registerbekanntmachung nach dem Umwandlungsgesetz",
      "state": "Nordrhein-Westfalen",
      "amtsgericht": "Amtsgericht Paderborn",
      "registernummer": "HRB 14963",
      "registerart": "HRB",
      "company_name": "AGRAVIS Westfalen-Hessen GmbH",
      "company_seat": "Brakel",
      "details": "12.05.2025 (Bekanntmachungsdatum)\n\nNordrhein-Westfalen Amtsgericht Paderborn HRB 14963\nRegisterbekanntmachung nach dem Umwandlungsgesetz 12.05.2025 (Eintragungsdatum)\n\nAGRAVIS Westfalen-Hessen GmbH\nGesellschaft mit beschränkter Haftung\nBrakel\n\nDen Gläubigern der an der Verschmelzung beteiligten Rechtsträger ist, wenn sie binnen sechs Monaten nach dem Tag, an dem die Eintragung der Verschmelzung in das Register des Sitzes desjenigen Rechtsträgers, dessen Gläubiger sie sind, nach § 19 Absatz 3 UmwG als bekanntgemacht gilt, ihren Anspruch nach Grund und Höhe schriftlich anmelden, Sicherheit zu leisten, soweit sie nicht Befriedigung verlangen können. Dieses Recht steht den Gläubigern jedoch nur zu, wenn sie glaubhaft machen, dass durch die Verschmelzung die Erfüllung ihrer Forderung gefährdet wird."
    },
    {
      "date": "2025-05-12",
      "id": "108744",
      "original_text": "Einreichung neuer Dokumente\nNordrhein-Westfalen Amtsgericht Aachen HRB 13957\nGenerali Deutschland Services GmbH – Aachen",
      "type": "Einreichung neuer Dokumente",
      "state": "Nordrhein-Westfalen",
      "amtsgericht": "Amtsgericht Aachen",
      "registernummer": "HRB 13957",
      "registerart": "HRB",
      "company_name": "Generali Deutschland Services GmbH",
      "company_seat": "Aachen",
      "details": "12.05.2025 (Bekanntmachungsdatum)\n\nNordrhein-Westfalen Amtsgericht Aachen HRB 13957\nEinreichung neuer Dokumente 07.05.2025 (Eintragungsdatum)\n\nGenerali Deutschland Services GmbH\nGesellschaft mit beschränkter Haftung\nAachen\n\nDem Registergericht ist eine Liste der Mitglieder des Aufsichtsrates eingereicht worden."
    },
    {
      "date": "2025-05-12",
      "id": "108745",
      "original_text": "Löschungsankündigung\nNordrhein-Westfalen Amtsgericht Essen HRB 33658\nIntosight UG (haftungsbeschränkt) – Essen",
      "type": "Löschungsankündigung",
      "state": "Nordrhein-Westfalen",
      "amtsgericht": "Amtsgericht Essen",
      "registernummer": "HRB 33658",
      "registerart": "HRB",
      "company_name": "Intosight UG (haftungsbeschränkt)",
      "company_seat": "Essen",
      "details": "12.05.2025 (Bekanntmachungsdatum)\n\nNordrhein-Westfalen Amtsgericht Essen HRB 33658\nLöschungsankündigung\n\nIntosight UG (haftungsbeschränkt)\nGesellschaft mit beschränkter Haftung\nEssen\n\nDas Registergericht beabsichtigt die Gesellschaft von Amts wegen nach § 394 FamFG zu löschen. Die Frist zur Erhebung eines Widerspruchs ist auf einen Monat festgesetzt."
    },
    {
      "date": "2025-05-12",
      "id": "108746",
      "original_text": "Registerbekanntmachung nach dem Umwandlungsgesetz\nNordrhein-Westfalen Amtsgericht Hagen HRB 13415\nHADItec GmbH – Gevelsberg",
      "type": "Registerbekanntmachung nach dem Umwandlungsgesetz",
      "state": "Nordrhein-Westfalen",
      "amtsgericht": "Amtsgericht Hagen",
      "registernummer": "HRB 13415",
      "registerart": "HRB",
      "company_name": "HADItec GmbH",
      "company_seat": "Gevelsberg",
      "details": "12.05.2025 (Bekanntmachungsdatum)\n\nNordrhein-Westfalen Amtsgericht Hagen HRB 13415\nRegisterbekanntmachung nach dem Umwandlungsgesetz 08.05.2025 (Eintragungsdatum)\n\nHADItec GmbH\nGesellschaft mit beschränkter Haftung\nGevelsberg\n\nDen Gläubigern der an der Spaltung beteiligten Rechtsträger ist, wenn sie binnen sechs Monaten nach dem Tag, an dem die Eintragung der Spaltung in das Register des Sitzes desjenigen Rechtsträgers, dessen Gläubiger sie sind, nach § 19 Abs. 3 UmwG als bekannt gemacht gilt, ihren Anspruch nach Grund und Höhe schriftlich anmelden, Sicherheit zu leisten, soweit sie nicht Befriedigung verlangen können. Dieses Recht steht ihnen jedoch nur zu, wenn sie glaubhaft machen, dass durch die Spaltung die Erfüllung ihrer Forderung gefährdet wird."
    },
    {
      "date": "2025-05-12",
      "id": "108747",
      "original_text": "Registerbekanntmachung nach dem Umwandlungsgesetz\nNordrhein-Westfalen Amtsgericht Mönchengladbach HRB 23099\nbatec facility GmbH – Wegberg",
      "type": "Registerbekanntmachung nach dem Umwandlungsgesetz",
      "state": "Nordrhein-Westfalen",
      "amtsgericht": "Amtsgericht Mönchengladbach",
      "registernummer": "HRB 23099",
      "registerart": "HRB",
      "company_name": "batec facility GmbH",
      "company_seat": "Wegberg",
      "details": "12.05.2025 (Bekanntmachungsdatum)\n\nNordrhein-Westfalen Amtsgericht Mönchengladbach HRB 23099\nRegisterbekanntmachung nach dem Umwandlungsgesetz 12.05.2025 (Eintragungsdatum)\n\nbatec facility GmbH\nGesellschaft mit beschränkter Haftung\nWegberg\n\nDen Gläubigern der an der Ausgliederung beteiligten Rechtsträger ist, wenn sie binnen sechs Monaten nach dem Tag, an dem die Eintragung der Ausgliederung in das Register des Sitzes desjenigen Rechtsträgers, dessen Gläubiger sie sind, nach § 19 Absatz 3 UmwG als bekanntgemacht gilt, ihren Anspruch nach Grund und Höhe schriftlich anmelden, Sicherheit zu leisten, soweit sie nicht Befriedigung verlangen können. Dieses Recht steht den Gläubigern jedoch nur zu, wenn sie glaubhaft machen, dass durch die Ausgliederung die Erfüllung ihrer Forderung gefährdet wird."
    },
    {
      "date": "2025-05-12",
      "id": "108748",
      "original_text": "Löschungsankündigung\nBremen Amtsgericht Bremen HRB 36830\nOOKOS INDUSTRIEBETONBODEN GmbH – Bremen",
      "type": "Löschungsankündigung",
      "state": "Bremen",
      "amtsgericht": "Amtsgericht Bremen",
      "registernummer": "HRB 36830",
      "registerart": "HRB",
      "company_name": "OOKOS INDUSTRIEBETONBODEN GmbH",
      "company_seat": "Bremen",
      "details": "12.05.2025 (Bekanntmachungsdatum)\n\nBremen Amtsgericht Bremen HRB 36830\nLöschungsankündigung\n\nOOKOS INDUSTRIEBETONBODEN GmbH\nGesellschaft mit beschränkter Haftung\nBremen\n\nEs ist beabsichtigt die im Handelsregister eingetragene Gesellschaft von Amts wegen gemäß § 394 FamFG zu löschen. Gegen die Löschung kann beim AG Bremen schriftlich oder zu Protokoll der Geschäftsstelle Widerspruch eingelegt werden. Widerspruchsfrist 4 Wochen."
    },
    {
      "date": "2025-05-12",
      "id": "108749",
      "original_text": "Registerbekanntmachung nach dem Umwandlungsgesetz\nNordrhein-Westfalen Amtsgericht Steinfurt HRB 4867\nJ. W. Holding GmbH – Ibbenbüren",
      "type": "Registerbekanntmachung nach dem Umwandlungsgesetz",
      "state": "Nordrhein-Westfalen",
      "amtsgericht": "Amtsgericht Steinfurt",
      "registernummer": "HRB 4867",
      "registerart": "HRB",
      "company_name": "J. W. Holding GmbH",
      "company_seat": "Ibbenbüren",
      "details": "12.05.2025 (Bekanntmachungsdatum)\n\nNordrhein-Westfalen Amtsgericht Steinfurt HRB 4867\nRegisterbekanntmachung nach dem Umwandlungsgesetz 12.05.2025 (Eintragungsdatum)\n\nJ. W. Holding GmbH\nGesellschaft mit beschränkter Haftung\nIbbenbüren\n\nDen Gläubigern der an der Verschmelzung beteiligten Rechtsträger ist, wenn sie binnen sechs Monaten nach dem Tag, an dem die Eintragung der Verschmelzung in das Register des Sitzes derjenigen Rechtsträger deren Gläubiger sie sind, nach § 19 Absatz 3 UmwG als bekanntgemacht gilt, ihren Anspruch nach Grund und Höhe schriftlich anmelden, Sicherheit zu leisten, soweit sie nicht Befriedigung verlangen können. Dieses Recht steht den Gläubigern jedoch nur zu, wenn sie glaubhaft machen, dass durch die Verschmelzung die Erfüllung ihrer Forderung gefährdet wird."
    },
    {
      "date": "2025-05-12",
      "id": "108750",
      "original_text": "Löschungsankündigung\nNordrhein-Westfalen Amtsgericht Kleve HRB 15899\nRMRM Reitsportmesse RheinMain UG (haftungsbeschränkt) – Xanten",
      "type": "Löschungsankündigung",
      "state": "Nordrhein-Westfalen",
      "amtsgericht": "Amtsgericht Kleve",
      "registernummer": "HRB 15899",
      "registerart": "HRB",
      "company_name": "RMRM Reitsportmesse RheinMain UG (haftungsbeschränkt)",
      "company_seat": "Xanten",
      "details": "12.05.2025 (Bekanntmachungsdatum)\n\nNordrhein-Westfalen Amtsgericht Kleve HRB 15899\nLöschungsankündigung\n\nRMRM Reitsportmesse RheinMain UG (haftungsbeschränkt)\nGesellschaft mit beschränkter Haftung\nXanten\n\nDas Registergericht beabsichtigt die Gesellschaft von Amts wegen nach § 394 FamFG zu löschen. Die Frist zur Erhebung eines Widerspruchs ist auf einen Monat festgesetzt."
    },
    {
      "date": "2025-05-12",
      "id": "108751",
      "original_text": "Löschungsankündigung\nNordrhein-Westfalen Amtsgericht Köln HRB 85621\nBotan Druck Verwaltungs UG (haftungsbeschränkt) – Köln",
      "type": "Löschungsankündigung",
      "state": "Nordrhein-Westfalen",
      "amtsgericht": "Amtsgericht Köln",
      "registernummer": "HRB 85621",
      "registerart": "HRB",
      "company_name": "Botan Druck Verwaltungs UG (haftungsbeschränkt)",
      "company_seat": "Köln",
      "details": "12.05.2025 (Bekanntmachungsdatum)\n\nNordrhein-Westfalen Amtsgericht Köln HRB 85621\nLöschungsankündigung\n\nBotan Druck Verwaltungs UG (haftungsbeschränkt)\nGesellschaft mit beschränkter Haftung\nKöln\n\nDas Registergericht beabsichtigt die Gesellschaft von Amts wegen nach § 394 FamFG zu löschen. Die Frist zur Erhebung eines Widerspruchs ist auf einen Monat festgesetzt."
    },
    {
      "date": "2025-05-12",
      "id": "108752",
      "original_text": "Löschungsankündigung\nNordrhein-Westfalen Amtsgericht Köln HRB 79876\nAGS GmbH – Köln",
      "type": "Löschungsankündigung",
      "state": "Nordrhein-Westfalen",
      "amtsgericht": "Amtsgericht Köln",
      "registernummer": "HRB 79876",
      "registerart": "HRB",
      "company_name": "AGS GmbH",
      "company_seat": "Köln",
      "details": "12.05.2025 (Bekanntmachungsdatum)\n\nNordrhein-Westfalen Amtsgericht Köln HRB 79876\nLöschungsankündigung\n\nAGS GmbH\nGesellschaft mit beschränkter Haftung\nKöln\n\nDas Registergericht beabsichtigt die Gesellschaft von Amts wegen nach § 394 FamFG zu löschen. Die Frist zur Erhebung eines Widerspruchs ist auf einen Monat festgesetzt."
    },
    {
      "date": "2025-05-12",
      "id": "108753",
      "original_text": "Löschungsankündigung\nNordrhein-Westfalen Amtsgericht Köln HRB 116952\nPutz und Stuck Etzig UG (haftungsbeschränkt) – Elsdorf",
      "type": "Löschungsankündigung",
      "state": "Nordrhein-Westfalen",
      "amtsgericht": "Amtsgericht Köln",
      "registernummer": "HRB 116952",
      "registerart": "HRB",
      "company_name": "Putz und Stuck Etzig UG (haftungsbeschränkt)",
      "company_seat": "Elsdorf",
      "details": "12.05.2025 (Bekanntmachungsdatum)\n\nNordrhein-Westfalen Amtsgericht Köln HRB 116952\nLöschungsankündigung\n\nPutz und Stuck Etzig UG (haftungsbeschränkt)\nGesellschaft mit beschränkter Haftung\nElsdorf\n\nDas Registergericht beabsichtigt die Gesellschaft von Amts wegen nach § 394 FamFG zu löschen. Die Frist zur Erhebung eines Widerspruchs ist auf einen Monat festgesetzt."
    },
    {
      "date": "2025-05-12",
      "id": "108754",
      "original_text": "Löschungsankündigung\nNordrhein-Westfalen Amtsgericht Düsseldorf HRB 74906\nTaxi Üctas GmbH – Düsseldorf",
      "type": "Löschungsankündigung",
      "state": "Nordrhein-Westfalen",
      "amtsgericht": "Amtsgericht Düsseldorf",
      "registernummer": "HRB 74906",
      "registerart": "HRB",
      "company_name": "Taxi Üctas GmbH",
      "company_seat": "Düsseldorf",
      "details": "12.05.2025 (Bekanntmachungsdatum)\n\nNordrhein-Westfalen Amtsgericht Düsseldorf HRB 74906\nLöschungsankündigung\n\nTaxi Üctas GmbH\nGesellschaft mit beschränkter Haftung\nDüsseldorf\n\nDas Registergericht beabsichtigt die Gesellschaft von Amts wegen nach § 394 Abs. 1 FamFG zu löschen. Die Frist zur Erhebung eines Widerspruchs ist auf einen Monat festgesetzt.\n\nRechtsbehelfsbelehrung:\nDas Widerspruchsrecht steht jedem zu, der an der Unterlassung der Löschung ein berechtigtes Interesse hat. Der Widerspruch ist bei dem Amtsgericht Düsseldorf -Registergericht-, Werdener Straße 1, 40227 Düsseldorf schriftlich in deutscher Sprache oder zur Niederschrift der Geschäftsstelle einzulegen. Der Widerspruch kann auch zur Niederschrift der Geschäftsstelle eines jeden Amtsgerichtes abgegeben werden. Die Einlegung ist auch durch Übertragung eines elektronischen Dokuments an die elektronische Poststelle des Gerichts möglich. Das elektronische Dokument muss für die Bearbeitung durch das Gericht geeignet und mit einer qualifizierten elektronischen Signatur der verantwortenden Person versehen sein oder von der verantwortenden Person signiert und auf einem sicheren Übermittlungsweg gemäß § 130a ZPO nach näherer Maßgabe der Verordnung über die technischen Rahmenbedingungen des elektronischen Rechtsverkehrs und über das besondere elektronische Behördenpostfach (BGBl. I, S.3803) eingereicht werden. Weitere Informationen erhalten Sie auf der Internetseite www.justiz.de.\nDer Widerspruch muss spätestens innerhalb der gesetzten Frist nach dem Datum der Bekanntmachung der Löschungsankündigung bei dem Amtsgericht - Registergericht - Düsseldorf eingegangen sein.  Dies gilt auch dann, wenn der Widerspruch zur Niederschrift der Geschäftsstelle eines anderen Amtsgerichtes abgegeben wurde. Die Frist beginnt mit dem Tage der Bekanntmachung der Löschungsankündigung in dem für die Bekanntmachung der Eintragungen in das Handelsregister bestimmten elektronischen Informations- und Kommunikationssystem nach § 10 des Handelsgesetzbuches. Fällt das Ende der Frist auf einen Sonntag, einen allgemeinen Feiertag oder Sonnabend, so endet die Frist mit Ablauf des nächsten Werktages.\nDer Widerspruch muss die Bezeichnung der angefochtenen Löschungsankündigung sowie die Erklärung enthalten, dass Widerspruch gegen diese Löschungsankündigung eingelegt wird. Er ist zu unterzeichnen und soll begründet werden."
    },
    {
      "date": "2025-05-12",
      "id": "108755",
      "original_text": "Einreichung neuer Dokumente\nNordrhein-Westfalen Amtsgericht Essen HRB 14525\nRWE Aktiengesellschaft – Essen",
      "type": "Einreichung neuer Dokumente",
      "state": "Nordrhein-Westfalen",
      "amtsgericht": "Amtsgericht Essen",
      "registernummer": "HRB 14525",
      "registerart": "HRB",
      "company_name": "RWE Aktiengesellschaft",
      "company_seat": "Essen",
      "details": "12.05.2025 (Bekanntmachungsdatum)\n\nNordrhein-Westfalen Amtsgericht Essen HRB 14525\nEinreichung neuer Dokumente\n\nRWE Aktiengesellschaft\nAktiengesellschaft\nEssen\n\nDem Registergericht ist eine Liste der Mitglieder des Aufsichtsrates eingereicht worden."
    },
    {
      "date": "2025-05-12",
      "id": "108756",
      "original_text": "Einreichung neuer Dokumente\nNordrhein-Westfalen Amtsgericht Duisburg HRB 20299\nThyssenKrupp MillServices & Systems GmbH – Duisburg",
      "type": "Einreichung neuer Dokumente",
      "state": "Nordrhein-Westfalen",
      "amtsgericht": "Amtsgericht Duisburg",
      "registernummer": "HRB 20299",
      "registerart": "HRB",
      "company_name": "ThyssenKrupp MillServices & Systems GmbH",
      "company_seat": "Duisburg",
      "details": "12.05.2025 (Bekanntmachungsdatum)\n\nNordrhein-Westfalen Amtsgericht Duisburg HRB 20299\nEinreichung neuer Dokumente\n\nThyssenKrupp MillServices & Systems GmbH\nGesellschaft mit beschränkter Haftung\nDuisburg\n\nDem Registergericht ist eine Liste der Mitglieder des Aufsichtsrates eingereicht worden."
    },
    {
      "date": "2025-05-12",
      "id": "108757",
      "original_text": "Registerbekanntmachung nach dem Umwandlungsgesetz\nNordrhein-Westfalen Amtsgericht Bonn HRB 14480\nHerzog + Mandt Vermessungssysteme GmbH – Swisttal",
      "type": "Registerbekanntmachung nach dem Umwandlungsgesetz",
      "state": "Nordrhein-Westfalen",
      "amtsgericht": "Amtsgericht Bonn",
      "registernummer": "HRB 14480",
      "registerart": "HRB",
      "company_name": "Herzog + Mandt Vermessungssysteme GmbH",
      "company_seat": "Swisttal",
      "details": "12.05.2025 (Bekanntmachungsdatum)\n\nNordrhein-Westfalen Amtsgericht Bonn HRB 14480\nRegisterbekanntmachung nach dem Umwandlungsgesetz 12.05.2025 (Eintragungsdatum)\n\nHerzog + Mandt Vermessungssysteme GmbH\nGesellschaft mit beschränkter Haftung\nSwisttal\n\nDen Gläubigern der an der Verschmelzung beteiligten Rechtsträger ist, wenn sie binnen sechs Monaten nach dem Tag, an dem die Eintragung der Verschmelzung in das Register des Sitzes desjenigen Rechtsträgers, dessen Gläubiger sie sind, nach § 19 Absatz 3 UmwG als bekanntgemacht gilt, ihren Anspruch nach Grund und Höhe schriftlich anmelden, Sicherheit zu leisten, soweit sie nicht Befriedigung verlangen können. Dieses Recht steht den Gläubigern jedoch nur zu, wenn sie glaubhaft machen, dass durch die Verschmelzung die Erfüllung ihrer Forderung gefährdet wird."
    },
    {
      "date": "2025-05-12",
      "id": "108758",
      "original_text": "Löschungsankündigung\nNordrhein-Westfalen Amtsgericht Essen HRB 24551\nStuckmeister GmbH – Essen",
      "type": "Löschungsankündigung",
      "state": "Nordrhein-Westfalen",
      "amtsgericht": "Amtsgericht Essen",
      "registernummer": "HRB 24551",
      "registerart": "HRB",
      "company_name": "Stuckmeister GmbH",
      "company_seat": "Essen",
      "details": "12.05.2025 (Bekanntmachungsdatum)\n\nNordrhein-Westfalen Amtsgericht Essen HRB 24551\nLöschungsankündigung\n\nStuckmeister GmbH\nGesellschaft mit beschränkter Haftung\nEssen\n\nDas Registergericht beabsichtigt die Gesellschaft von Amts wegen nach § 394 FamFG zu löschen. Die Frist zur Erhebung eines Widerspruchs ist auf zwei Monate festgesetzt."
    },
    {
      "date": "2025-05-12",
      "id": "108759",
      "original_text": "Einreichung neuer Dokumente\nNordrhein-Westfalen Amtsgericht Dortmund HRB 28550\nVOLKSWOHL BUND Holding AG – Dortmund",
      "type": "Einreichung neuer Dokumente",
      "state": "Nordrhein-Westfalen",
      "amtsgericht": "Amtsgericht Dortmund",
      "registernummer": "HRB 28550",
      "registerart": "HRB",
      "company_name": "VOLKSWOHL BUND Holding AG",
      "company_seat": "Dortmund",
      "details": "12.05.2025 (Bekanntmachungsdatum)\n\nNordrhein-Westfalen Amtsgericht Dortmund HRB 28550\nEinreichung neuer Dokumente\n\nVOLKSWOHL BUND Holding AG\nAktiengesellschaft\nDortmund\n\nDem Registergericht ist eine neue Liste der Mitglieder des Aufsichtsrates eingereicht worden."
    },
    {
      "date": "2025-05-12",
      "id": "108760",
      "original_text": "Registerbekanntmachung nach dem Umwandlungsgesetz\nNordrhein-Westfalen Amtsgericht Köln HRB 25495\nACTION CONCEPT GmbH – Köln",
      "type": "Registerbekanntmachung nach dem Umwandlungsgesetz",
      "state": "Nordrhein-Westfalen",
      "amtsgericht": "Amtsgericht Köln",
      "registernummer": "HRB 25495",
      "registerart": "HRB",
      "company_name": "ACTION CONCEPT GmbH",
      "company_seat": "Köln",
      "details": "12.05.2025 (Bekanntmachungsdatum)\n\nNordrhein-Westfalen Amtsgericht Köln HRB 25495\nRegisterbekanntmachung nach dem Umwandlungsgesetz 12.05.2025 (Eintragungsdatum)\n\nACTION CONCEPT GmbH\nGesellschaft mit beschränkter Haftung\nKöln\n\nDen Gläubigern der an der Verschmelzung beteiligten Rechtsträger ist, wenn sie binnen sechs Monaten nach dem Tag, an dem die Eintragung der Verschmelzung in das Register des Sitzes derjenigen Rechtsträger deren Gläubiger sie sind, nach § 19 Absatz 3 UmwG als bekanntgemacht gilt, ihren Anspruch nach Grund und Höhe schriftlich anmelden, Sicherheit zu leisten, soweit sie nicht Befriedigung verlangen können. Dieses Recht steht den Gläubigern jedoch nur zu, wenn sie glaubhaft machen, dass durch die Verschmelzung die Erfüllung ihrer Forderung gefährdet wird."
    },
    {
      "date": "2025-05-12",
      "id": "108761",
      "original_text": "Einreichung neuer Dokumente\nNordrhein-Westfalen Amtsgericht Neuss HRB 1271\nALUMINIUM NORF Gesellschaft mit beschränkter Haftung – Neuss-Norf",
      "type": "Einreichung neuer Dokumente",
      "state": "Nordrhein-Westfalen",
      "amtsgericht": "Amtsgericht Neuss",
      "registernummer": "HRB 1271",
      "registerart": "HRB",
      "company_name": "ALUMINIUM NORF Gesellschaft mit beschränkter Haftung",
      "company_seat": "Neuss-Norf",
      "details": "12.05.2025 (Bekanntmachungsdatum)\n\nNordrhein-Westfalen Amtsgericht Neuss HRB 1271\nEinreichung neuer Dokumente\n\nALUMINIUM NORF Gesellschaft mit beschränkter Haftung\nGesellschaft mit beschränkter Haftung\nNeuss-Norf\n\nDem Registergericht ist eine neue Liste der Mitglieder des Aufsichtsrates eingereicht worden."
    },
    {
      "date": "2025-05-12",
      "id": "108762",
      "original_text": "Löschungsankündigung\nNordrhein-Westfalen Amtsgericht Gelsenkirchen HRA 3374\nGeorg Kohl KG Holz- und Baustoffgroßhandlung – Dorsten",
      "type": "Löschungsankündigung",
      "state": "Nordrhein-Westfalen",
      "amtsgericht": "Amtsgericht Gelsenkirchen",
      "registernummer": "HRA 3374",
      "registerart": "HRA",
      "company_name": "Georg Kohl KG Holz- und Baustoffgroßhandlung",
      "company_seat": "Dorsten",
      "details": "12.05.2025 (Bekanntmachungsdatum)\n\nNordrhein-Westfalen Amtsgericht Gelsenkirchen HRA 3374\nLöschungsankündigung 12.05.2025 (Eintragungsdatum)\n\nGeorg Kohl KG Holz- und Baustoffgroßhandlung\nKommanditgesellschaft\nDorsten\n\nDas Registergericht beabsichtigt die Firma von Amts wegen nach § 394 FamFG zu löschen. Die Frist zur Erhebung eines Widerspruchs ist auf einen Monat festgesetzt."
    },
    {
      "date": "2025-05-12",
      "id": "108763",
      "original_text": "Löschungsankündigung\nNordrhein-Westfalen Amtsgericht Hagen HRB 11109\nH & P Food Produktion und Vertriebs GmbH – Hagen",
      "type": "Löschungsankündigung",
      "state": "Nordrhein-Westfalen",
      "amtsgericht": "Amtsgericht Hagen",
      "registernummer": "HRB 11109",
      "registerart": "HRB",
      "company_name": "H & P Food Produktion und Vertriebs GmbH",
      "company_seat": "Hagen",
      "details": "12.05.2025 (Bekanntmachungsdatum)\n\nNordrhein-Westfalen Amtsgericht Hagen HRB 11109\nLöschungsankündigung\n\nH & P Food Produktion und Vertriebs GmbH\nGesellschaft mit beschränkter Haftung\nHagen\n\nDas Registergericht beabsichtigt, die im Handelsregister eingetragene Gesellschaft gemäß § 394 Absatz 1 FamFG wegen Vermögenslosigkeit von Amts wegen zu löschen.  Gegen diese Verfügung kann Widerspruch eingelegt werden. Die Frist zur Erhebung eines Widerspruchs gegen die beabsichtigte Löschung von Amts wegen ist auf drei Monate festgesetzt.\n\nRechtsbehelfsbelehrung:\nGegen diese Verfügung können Sie Widerspruch einlegen.\n\nDer Widerspruch ist bei dem Amtsgericht Hagen, Heinitzstraße 42, 58097 Hagen schriftlich in deutscher Sprache oder zur Niederschrift der Geschäftsstelle einzulegen. Der Widerspruch kann auch zur Niederschrift der Geschäftsstelle eines jeden Amtsgerichtes abgegeben werden.\n\nDer Widerspruch muss spätestens innerhalb der gesetzten Frist bei dem Amtsgericht Hagen eingegangen sein. Dies gilt auch dann, wenn der Widerspruch zur Niederschrift der Geschäftsstelle eines anderen Amtsgerichtes abgegeben wurde. Die Frist beginnt mit der Veröffentlichung. Fällt das Ende der Frist auf einen Sonntag, einen allgemeinen Feiertag oder Sonnabend, so endet die Frist mit Ablauf des nächsten Werktages.\n\nDer Widerspruch muss die Bezeichnung der angefochtenen Verfügung sowie die Erklärung enthalten, dass Widerspruch gegen diese Verfügung eingelegt wird. Er ist zu unterzeichnen und soll begründet werden."
    },
    {
      "date": "2025-05-12",
      "id": "108764",
      "original_text": "Registerbekanntmachung nach dem Umwandlungsgesetz\nNordrhein-Westfalen Amtsgericht Steinfurt HRB 3687\nA. W. Holding GmbH – Ibbenbüren",
      "type": "Registerbekanntmachung nach dem Umwandlungsgesetz",
      "state": "Nordrhein-Westfalen",
      "amtsgericht": "Amtsgericht Steinfurt",
      "registernummer": "HRB 3687",
      "registerart": "HRB",
      "company_name": "A. W. Holding GmbH",
      "company_seat": "Ibbenbüren",
      "details": "12.05.2025 (Bekanntmachungsdatum)\n\nNordrhein-Westfalen Amtsgericht Steinfurt HRB 3687\nRegisterbekanntmachung nach dem Umwandlungsgesetz 12.05.2025 (Eintragungsdatum)\n\nA. W. Holding GmbH\nGesellschaft mit beschränkter Haftung\nIbbenbüren\n\nDen Gläubigern der an der Verschmelzung beteiligten Rechtsträger ist, wenn sie binnen sechs Monaten nach dem Tag, an dem die Eintragung der Verschmelzung in das Register des Sitzes derjenigen Rechtsträger deren Gläubiger sie sind, nach § 19 Absatz 3 UmwG als bekanntgemacht gilt, ihren Anspruch nach Grund und Höhe schriftlich anmelden, Sicherheit zu leisten, soweit sie nicht Befriedigung verlangen können. Dieses Recht steht den Gläubigern jedoch nur zu, wenn sie glaubhaft machen, dass durch die Verschmelzung die Erfüllung ihrer Forderung gefährdet wird."
    },
    {
      "date": "2025-05-12",
      "id": "108765",
      "original_text": "Einreichung neuer Dokumente\nNordrhein-Westfalen Amtsgericht Hagen HRB 2920\nthyssenkrupp Hohenlimburg GmbH – Hagen",
      "type": "Einreichung neuer Dokumente",
      "state": "Nordrhein-Westfalen",
      "amtsgericht": "Amtsgericht Hagen",
      "registernummer": "HRB 2920",
      "registerart": "HRB",
      "company_name": "thyssenkrupp Hohenlimburg GmbH",
      "company_seat": "Hagen",
      "details": "12.05.2025 (Bekanntmachungsdatum)\n\nNordrhein-Westfalen Amtsgericht Hagen HRB 2920\nEinreichung neuer Dokumente\n\nthyssenkrupp Hohenlimburg GmbH\nGesellschaft mit beschränkter Haftung\nHagen\n\nDie gesetzlichen Vertreter der Gesellschaft haben eine aktuelle Liste der Aufsichtsratsmitglieder zum Handelsregister eingereicht."
    },
    {
      "date": "2025-05-12",
      "id": "108766",
      "original_text": "Registerbekanntmachung nach dem Umwandlungsgesetz\nNordrhein-Westfalen Amtsgericht Düsseldorf HRB 65514\nCoaching Change UG (haftungsbeschränkt) – Düsseldorf",
      "type": "Registerbekanntmachung nach dem Umwandlungsgesetz",
      "state": "Nordrhein-Westfalen",
      "amtsgericht": "Amtsgericht Düsseldorf",
      "registernummer": "HRB 65514",
      "registerart": "HRB",
      "company_name": "Coaching Change UG (haftungsbeschränkt)",
      "company_seat": "Düsseldorf",
      "details": "12.05.2025 (Bekanntmachungsdatum)\n\nNordrhein-Westfalen Amtsgericht Düsseldorf HRB 65514\nRegisterbekanntmachung nach dem Umwandlungsgesetz 12.05.2025 (Eintragungsdatum)\n\nCoaching Change UG (haftungsbeschränkt)\nGesellschaft mit beschränkter Haftung\nDüsseldorf\n\nDen Gläubigern der an der Verschmelzung beteiligten Rechtsträger ist, wenn sie binnen sechs Monaten nach dem Tag, an dem die Eintragung der Verschmelzung in das Register des Sitzes desjenigen Rechtsträgers, dessen Gläubiger sie sind, nach § 19 Absatz 3 UmwG als bekanntgemacht gilt, ihren Anspruch nach Grund und Höhe schriftlich anmelden, Sicherheit zu leisten, soweit sie nicht Befriedigung verlangen können. Dieses Recht steht den Gläubigern jedoch nur zu, wenn sie glaubhaft machen, dass durch die Verschmelzung die Erfüllung ihrer Forderung gefährdet wird."
    },
    {
      "date": "2025-05-12",
      "id": "108767",
      "original_text": "Sonstige Registerbekanntmachung\nNordrhein-Westfalen Amtsgericht Düsseldorf HRB 40871\nERGO International Aktiengesellschaft – Düsseldorf",
      "type": "Sonstige Registerbekanntmachung",
      "state": "Nordrhein-Westfalen",
      "amtsgericht": "Amtsgericht Düsseldorf",
      "registernummer": "HRB 40871",
      "registerart": "HRB",
      "company_name": "ERGO International Aktiengesellschaft",
      "company_seat": "Düsseldorf",
      "details": "12.05.2025 (Bekanntmachungsdatum)\n\nNordrhein-Westfalen Amtsgericht Düsseldorf HRB 40871\nSonstige Registerbekanntmachung\n\nERGO International Aktiengesellschaft\nAktiengesellschaft\nDüsseldorf\n\nDem Registergericht ist eine Liste der Mitglieder des Aufsichtsrates eingereicht worden."
    },
    {
      "date": "2025-05-12",
      "id": "108768",
      "original_text": "Registerbekanntmachung nach dem Umwandlungsgesetz\nNordrhein-Westfalen Amtsgericht Köln HRB 43409\nPelzer Fördertechnik GmbH – Kerpen",
      "type": "Registerbekanntmachung nach dem Umwandlungsgesetz",
      "state": "Nordrhein-Westfalen",
      "amtsgericht": "Amtsgericht Köln",
      "registernummer": "HRB 43409",
      "registerart": "HRB",
      "company_name": "Pelzer Fördertechnik GmbH",
      "company_seat": "Kerpen",
      "details": "12.05.2025 (Bekanntmachungsdatum)\n\nNordrhein-Westfalen Amtsgericht Köln HRB 43409\nRegisterbekanntmachung nach dem Umwandlungsgesetz 12.05.2025 (Eintragungsdatum)\n\nPelzer Fördertechnik GmbH\nGesellschaft mit beschränkter Haftung\nKerpen\n\nDen Gläubigern der an der Verschmelzung beteiligten Rechtsträger ist, wenn sie binnen sechs Monaten nach dem Tag, an dem die Eintragung der Verschmelzung in das Register des Sitzes derjenigen Rechtsträger deren Gläubiger sie sind, nach § 19 Absatz 3 UmwG als bekanntgemacht gilt, ihren Anspruch nach Grund und Höhe schriftlich anmelden, Sicherheit zu leisten, soweit sie nicht Befriedigung verlangen können. Dieses Recht steht den Gläubigern jedoch nur zu, wenn sie glaubhaft machen, dass durch die Verschmelzung die Erfüllung ihrer Forderung gefährdet wird."
    },
    {
      "date": "2025-05-12",
      "id": "108769",
      "original_text": "Löschungsankündigung\nNordrhein-Westfalen Amtsgericht Krefeld HRB 18763\nCiminy Textil GmbH – Krefeld",
      "type": "Löschungsankündigung",
      "state": "Nordrhein-Westfalen",
      "amtsgericht": "Amtsgericht Krefeld",
      "registernummer": "HRB 18763",
      "registerart": "HRB",
      "company_name": "Ciminy Textil GmbH",
      "company_seat": "Krefeld",
      "details": "12.05.2025 (Bekanntmachungsdatum)\n\nNordrhein-Westfalen Amtsgericht Krefeld HRB 18763\nLöschungsankündigung\n\nCiminy Textil GmbH\nGesellschaft mit beschränkter Haftung\nKrefeld\n\nDas Registergericht beabsichtigt die Gesellschaft von Amts wegen nach § 394 FamFG zu löschen. Die Frist zur Erhebung eines Widerspruchs ist auf einen Monat festgesetzt."
    },
    {
      "date": "2025-05-12",
      "id": "108770",
      "original_text": "Registerbekanntmachung nach dem Umwandlungsgesetz\nNordrhein-Westfalen Amtsgericht Wuppertal GsR 477\nTeampflege eGbR – Remscheid",
      "type": "Registerbekanntmachung nach dem Umwandlungsgesetz",
      "state": "Nordrhein-Westfalen",
      "amtsgericht": "Amtsgericht Wuppertal",
      "registernummer": "GsR 477",
      "registerart": "GsR",
      "company_name": "Teampflege eGbR",
      "company_seat": "Remscheid",
      "details": "12.05.2025 (Bekanntmachungsdatum)\n\nNordrhein-Westfalen Amtsgericht Wuppertal GsR 477\nRegisterbekanntmachung nach dem Umwandlungsgesetz 12.05.2025 (Eintragungsdatum)\n\nTeampflege eGbR\nGesellschaft bürgerlichen Rechts\nRemscheid\n\nDen Gläubigern der an der Verschmelzung beteiligten Rechtsträger ist, wenn sie binnen sechs Monaten nach dem Tag, an dem die Eintragung der Verschmelzung in das Register des Sitzes desjenigen Rechtsträgers, dessen Gläubiger sie sind, nach § 19 Absatz 3 UmwG als bekanntgemacht gilt, ihren Anspruch nach Grund und Höhe schriftlich anmelden, Sicherheit zu leisten, soweit sie nicht Befriedigung verlangen können. Dieses Recht steht den Gläubigern jedoch nur zu, wenn sie glaubhaft machen, dass durch die Verschmelzung die Erfüllung ihrer Forderung gefährdet wird."
    },
    {
      "date": "2025-05-12",
      "id": "108771",
      "original_text": "Registerbekanntmachung nach dem Umwandlungsgesetz\nThüringen Amtsgericht Jena HRB 201381\nMWS Mischwerk Saalfeld Verwaltungs-GmbH – Saalfeld/Saale",
      "type": "Registerbekanntmachung nach dem Umwandlungsgesetz",
      "state": "Thüringen",
      "amtsgericht": "Amtsgericht Jena",
      "registernummer": "HRB 201381",
      "registerart": "HRB",
      "company_name": "MWS Mischwerk Saalfeld Verwaltungs-GmbH",
      "company_seat": "Saalfeld/Saale",
      "details": "12.05.2025 (Bekanntmachungsdatum)\n\nThüringen Amtsgericht Jena HRB 201381\nRegisterbekanntmachung nach dem Umwandlungsgesetz 12.05.2025 (Eintragungsdatum)\n\nMWS Mischwerk Saalfeld Verwaltungs-GmbH\nGesellschaft mit beschränkter Haftung\nSaalfeld/Saale\n\nNicht eingetragen: Den Gläubigern der an der Verschmelzung beteiligten Rechtsträger, ist wenn sie binnen sechs Monaten nach dem Tag, an dem die Eintragung der Verschmelzung in das Register des Sitzes desjenigen Rechtsträgers, dessen Gläubiger sie sind,  nach § 19 Abs. 3 UmwG als bekanntgemacht gilt, ihren Anspruch nach Grund und Höhe schriftlich anmelden, Sicherheit zu leisten, soweit sie nicht Befriedigung verlangen können. Dieses Recht steht ihnen jedoch nur zu, wenn sie glaubhaft machen, daß durch die Verschmelzung die Erfüllung ihrer Forderung gefährdet wird."
    },
    {
      "date": "2025-05-12",
      "id": "108772",
      "original_text": "Registerbekanntmachung nach dem Umwandlungsgesetz\nThüringen Amtsgericht Jena HRB 112081\nK & W Mineralölgesellschaft Erfurt mbH – Erfurt",
      "type": "Registerbekanntmachung nach dem Umwandlungsgesetz",
      "state": "Thüringen",
      "amtsgericht": "Amtsgericht Jena",
      "registernummer": "HRB 112081",
      "registerart": "HRB",
      "company_name": "K & W Mineralölgesellschaft Erfurt mbH",
      "company_seat": "Erfurt",
      "details": "12.05.2025 (Bekanntmachungsdatum)\n\nThüringen Amtsgericht Jena HRB 112081\nRegisterbekanntmachung nach dem Umwandlungsgesetz 12.05.2025 (Eintragungsdatum)\n\nK & W Mineralölgesellschaft Erfurt mbH\nGesellschaft mit beschränkter Haftung\nErfurt\n\nNicht eingetragen: Den Gläubigern der Gesellschaft, deren Forderungen begründet worden sind, bevor die Eintragung der Beendigung des Vertrages in das Handelsregister nach § 10 des Handelsgesetzbuches als bekanntgemacht gilt, hat der andere Vertragsteil Sicherheit zu leisten, wenn sie sich binnen sechs Monaten nach der Bekanntmachung der Eintragung zu diesem Zweck bei ihm melden."
    },
    {
      "date": "2025-05-12",
      "id": "108773",
      "original_text": "Registerbekanntmachung nach dem Umwandlungsgesetz\nThüringen Amtsgericht Jena HRB 503465\nDie Wohnmacher GmbH – Gera",
      "type": "Registerbekanntmachung nach dem Umwandlungsgesetz",
      "state": "Thüringen",
      "amtsgericht": "Amtsgericht Jena",
      "registernummer": "HRB 503465",
      "registerart": "HRB",
      "company_name": "Die Wohnmacher GmbH",
      "company_seat": "Gera",
      "details": "12.05.2025 (Bekanntmachungsdatum)\n\nThüringen Amtsgericht Jena HRB 503465\nRegisterbekanntmachung nach dem Umwandlungsgesetz 12.05.2025 (Eintragungsdatum)\n\nDie Wohnmacher GmbH\nGesellschaft mit beschränkter Haftung\nGera\n\nNicht eingetragen: Den Gläubigern der an der Verschmelzung beteiligten Rechtsträger, ist wenn sie binnen sechs Monaten nach dem Tag, an dem die Eintragung der Verschmelzung in das Register des Sitzes desjenigen Rechtsträgers, dessen Gläubiger sie sind,  nach § 19 Abs. 3 UmwG als bekanntgemacht gilt, ihren Anspruch nach Grund und Höhe schriftlich anmelden, Sicherheit zu leisten, soweit sie nicht Befriedigung verlangen können. Dieses Recht steht ihnen jedoch nur zu, wenn sie glaubhaft machen, daß durch die Verschmelzung die Erfüllung ihrer Forderung gefährdet wird."
    },
    {
      "date": "2025-05-12",
      "id": "108774",
      "original_text": "Sonstige Registerbekanntmachung\nHessen Amtsgericht Frankfurt am Main VR 11108\nToplum Diyalogus – Frankfurt am Main",
      "type": "Sonstige Registerbekanntmachung",
      "state": "Hessen",
      "amtsgericht": "Amtsgericht Frankfurt am Main",
      "registernummer": "VR 11108",
      "registerart": "VR",
      "company_name": "Toplum Diyalogus",
      "company_seat": "Frankfurt am Main",
      "details": "12.05.2025 (Bekanntmachungsdatum)\n\nHessen Amtsgericht Frankfurt am Main VR 11108\nSonstige Registerbekanntmachung 12.05.2025 (Eintragungsdatum)\n\nToplum Diyalogus\neingetragener Verein\nFrankfurt am Main\n\nDer Verein ist aufgelöst."
    },
    {
      "date": "2025-05-12",
      "id": "108775",
      "original_text": "Löschungsankündigung\nHessen Amtsgericht Hanau HRB 94553\nVIPWORLD Reisen GmbH – Hanau",
      "type": "Löschungsankündigung",
      "state": "Hessen",
      "amtsgericht": "Amtsgericht Hanau",
      "registernummer": "HRB 94553",
      "registerart": "HRB",
      "company_name": "VIPWORLD Reisen GmbH",
      "company_seat": "Hanau",
      "details": "12.05.2025 (Bekanntmachungsdatum)\n\nHessen Amtsgericht Hanau HRB 94553\nLöschungsankündigung\n\nVIPWORLD Reisen GmbH\nGesellschaft mit beschränkter Haftung\nHanau\n\nDas Registergericht beabsichtigt die im Handelsregister eingetragene Gesellschaft von Amts wegen nach § 394 FamFG zu löschen. Die Frist zur Erhebung eines Widerspruchs gegen die beabsichtigte Löschung wird auf 3 Monate festgesetzt."
    },
    {
      "date": "2025-05-12",
      "id": "108776",
      "original_text": "Sonstige Registerbekanntmachung\nHessen Amtsgericht Wetzlar VR 3324\nAktion für Behinderte, Verein für Behinderte und ihre Familien e.V. – Herborn",
      "type": "Sonstige Registerbekanntmachung",
      "state": "Hessen",
      "amtsgericht": "Amtsgericht Wetzlar",
      "registernummer": "VR 3324",
      "registerart": "VR",
      "company_name": "Aktion für Behinderte, Verein für Behinderte und ihre Familien e.V.",
      "company_seat": "Herborn",
      "details": "12.05.2025 (Bekanntmachungsdatum)\n\nHessen Amtsgericht Wetzlar VR 3324\nSonstige Registerbekanntmachung 12.05.2025 (Eintragungsdatum)\n\nAktion für Behinderte, Verein für Behinderte und ihre Familien e.V.\neingetragener Verein\nHerborn\n\nDer Verein ist aufgelöst."
    },
    {
      "date": "2025-05-12",
      "id": "108777",
      "original_text": "Registerbekanntmachung nach dem Umwandlungsgesetz\nHessen Amtsgericht Frankfurt am Main HRB 106359\nschöne räume ai GmbH – Frankfurt am Main",
      "type": "Registerbekanntmachung nach dem Umwandlungsgesetz",
      "state": "Hessen",
      "amtsgericht": "Amtsgericht Frankfurt am Main",
      "registernummer": "HRB 106359",
      "registerart": "HRB",
      "company_name": "schöne räume ai GmbH",
      "company_seat": "Frankfurt am Main",
      "details": "12.05.2025 (Bekanntmachungsdatum)\n\nHessen Amtsgericht Frankfurt am Main HRB 106359\nRegisterbekanntmachung nach dem Umwandlungsgesetz 12.05.2025 (Eintragungsdatum)\n\nschöne räume ai GmbH\nGesellschaft mit beschränkter Haftung\nFrankfurt am Main\n\nDen Gläubigern der an der Verschmelzung beteiligten Rechtsträger ist, wenn sie binnen sechs Monaten nach dem Tag, an dem die Eintragung der Verschmelzung in das Register des Sitzes desjenigen Rechtsträgers, dessen Gläubiger sie sind, nach § 19 Absatz 3 UmwG bekannt gemacht worden ist, ihren Anspruch nach Grund und Höhe schriftlich anmelden, Sicherheit zu leisten, soweit sie nicht Befriedigung verlangen können. Dieses Recht steht den Gläubigern jedoch nur zu, wenn sie glaubhaft machen, dass durch die Verschmelzung die Erfüllung ihrer Forderung gefährdet wird."
    },
    {
      "date": "2025-05-12",
      "id": "108778",
      "original_text": "Löschungsankündigung\nHessen Amtsgericht Kassel VR 5659\nInitiative für Gründung und Demokratie (IGD) e.V. – Kassel",
      "type": "Löschungsankündigung",
      "state": "Hessen",
      "amtsgericht": "Amtsgericht Kassel",
      "registernummer": "VR 5659",
      "registerart": "VR",
      "company_name": "Initiative für Gründung und Demokratie (IGD) e.V.",
      "company_seat": "Kassel",
      "details": "12.05.2025 (Bekanntmachungsdatum)\n\nHessen Amtsgericht Kassel VR 5659\nLöschungsankündigung\n\nInitiative für Gründung und Demokratie (IGD) e.V.\neingetragener Verein\nKassel\n\nDas Registergericht geht davon aus, dass der Verein durch Wegfall sämtlicher Mitglieder erloschen ist. Es ist daher beabsichtigt, den Verein von Amts wegen im Vereinsregister zu löschen.\nEs wird Gelegenheit gegeben, der beabsichtigten Löschung binnen 6 Wochen zu widersprechen. Dies kann schriftlich oder zu Protokoll der Geschäftsstelle bei dem Registergericht des Amtsgerichts Kassel, Friedrichsstraße 32-34, 34117 Kassel innerhalb von 6 Wochen ab Veröffentlichung dieser Löschungsankündigung geschehen."
    },
    {
      "date": "2025-05-12",
      "id": "108779",
      "original_text": "Löschungsankündigung\nHessen Amtsgericht Darmstadt HRB 4898\nWalter Gehrisch GmbH – Ober-Ramstadt",
      "type": "Löschungsankündigung",
      "state": "Hessen",
      "amtsgericht": "Amtsgericht Darmstadt",
      "registernummer": "HRB 4898",
      "registerart": "HRB",
      "company_name": "Walter Gehrisch GmbH",
      "company_seat": "Ober-Ramstadt",
      "details": "12.05.2025 (Bekanntmachungsdatum)\n\nHessen Amtsgericht Darmstadt HRB 4898\nLöschungsankündigung\n\nWalter Gehrisch GmbH\nGesellschaft mit beschränkter Haftung\nOber-Ramstadt\n\nDas Registergericht beabsichtigt die im Handelsregister eingetragene Gesellschaft von Amts wegen nach § 394 FamFG zu löschen. Die Frist zur Erhebung eines Widerspruchs gegen die beabsichtigte Löschung wird auf 3 Monate festgesetzt."
    },
    {
      "date": "2025-05-12",
      "id": "108780",
      "original_text": "Löschungsankündigung\nHessen Amtsgericht Darmstadt HRB 95784\nDa long UG (haftungsbeschränkt) – Darmstadt",
      "type": "Löschungsankündigung",
      "state": "Hessen",
      "amtsgericht": "Amtsgericht Darmstadt",
      "registernummer": "HRB 95784",
      "registerart": "HRB",
      "company_name": "Da long UG (haftungsbeschränkt)",
      "company_seat": "Darmstadt",
      "details": "12.05.2025 (Bekanntmachungsdatum)\n\nHessen Amtsgericht Darmstadt HRB 95784\nLöschungsankündigung 10.05.2025 (Eintragungsdatum)\n\nDa long UG (haftungsbeschränkt)\nGesellschaft mit beschränkter Haftung\nDarmstadt\n\nDas Registergericht beabsichtigt die im Handelsregister eingetragene Gesellschaft von Amts wegen nach § 394 FamFG zu löschen. Die Frist zur Erhebung eines Widerspruchs gegen die beabsichtigte Löschung wird auf 3 Monate festgesetzt."
    },
    {
      "date": "2025-05-12",
      "id": "108781",
      "original_text": "Löschungsankündigung\nHessen Amtsgericht Wiesbaden VR 7446\nAbklatsch e.V. – Wiesbaden",
      "type": "Löschungsankündigung",
      "state": "Hessen",
      "amtsgericht": "Amtsgericht Wiesbaden",
      "registernummer": "VR 7446",
      "registerart": "VR",
      "company_name": "Abklatsch e.V.",
      "company_seat": "Wiesbaden",
      "details": "12.05.2025 (Bekanntmachungsdatum)\n\nHessen Amtsgericht Wiesbaden VR 7446\nLöschungsankündigung 11.05.2025 (Eintragungsdatum)\n\nAbklatsch e.V.\neingetragener Verein\nWiesbaden\n\nDer Verein ist aufgelöst."
    },
    {
      "date": "2025-05-12",
      "id": "108782",
      "original_text": "Sonstige Registerbekanntmachung\nHessen Amtsgericht Frankfurt am Main HRB 94361\nIsbank AG – Frankfurt am Main",
      "type": "Sonstige Registerbekanntmachung",
      "state": "Hessen",
      "amtsgericht": "Amtsgericht Frankfurt am Main",
      "registernummer": "HRB 94361",
      "registerart": "HRB",
      "company_name": "Isbank AG",
      "company_seat": "Frankfurt am Main",
      "details": "12.05.2025 (Bekanntmachungsdatum)\n\nHessen Amtsgericht Frankfurt am Main HRB 94361\nSonstige Registerbekanntmachung 01.07.2022 (Eintragungsdatum)\n\nIsbank AG\nAktiengesellschaft\nFrankfurt am Main\n\nDurch eine Änderung in den Personen der Aufsichtsratsmitglieder ist eine Liste der Mitglieder des Aufsichtsrates zum Handelsregister eingereicht worden."
    },
    {
      "date": "2025-05-12",
      "id": "108783",
      "original_text": "Löschungsankündigung\nHessen Amtsgericht Limburg HRB 5791\nRocki Bau UG (haftungsbeschränkt) – Limburg",
      "type": "Löschungsankündigung",
      "state": "Hessen",
      "amtsgericht": "Amtsgericht Limburg",
      "registernummer": "HRB 5791",
      "registerart": "HRB",
      "company_name": "Rocki Bau UG (haftungsbeschränkt)",
      "company_seat": "Limburg",
      "details": "12.05.2025 (Bekanntmachungsdatum)\n\nHessen Amtsgericht Limburg HRB 5791\nLöschungsankündigung\n\nRocki Bau UG (haftungsbeschränkt)\nGesellschaft mit beschränkter Haftung\nLimburg\n\nDas Registergericht beabsichtigt die im Handelsregister eingetragene Gesellschaft von Amts wegen nach § 394 FamFG zu löschen. Die Frist zur Erhebung eines Widerspruchs gegen die beabsichtigte Löschung wird auf 2 Monate festgesetzt."
    },
    {
      "date": "2025-05-12",
      "id": "108784",
      "original_text": "Sonstige Registerbekanntmachung\nHessen Amtsgericht Frankfurt am Main HRB 110139\nRBC Capital Markets (Europe) GmbH – Frankfurt am Main",
      "type": "Sonstige Registerbekanntmachung",
      "state": "Hessen",
      "amtsgericht": "Amtsgericht Frankfurt am Main",
      "registernummer": "HRB 110139",
      "registerart": "HRB",
      "company_name": "RBC Capital Markets (Europe) GmbH",
      "company_seat": "Frankfurt am Main",
      "details": "12.05.2025 (Bekanntmachungsdatum)\n\nHessen Amtsgericht Frankfurt am Main HRB 110139\nSonstige Registerbekanntmachung\n\nRBC Capital Markets (Europe) GmbH\nGesellschaft mit beschränkter Haftung\nFrankfurt am Main\n\nDurch eine Änderung in den Personen der Aufsichtsratsmitglieder ist eine Liste der Mitglieder des Aufsichtsrates zum Handelsregister eingereicht worden."
    },
    {
      "date": "2025-05-12",
      "id": "108785",
      "original_text": "Löschungsankündigung\nHessen Amtsgericht Frankfurt am Main HRB 130973\nMobileParts+ UG (haftungsbeschränkt) – Frankfurt am Main",
      "type": "Löschungsankündigung",
      "state": "Hessen",
      "amtsgericht": "Amtsgericht Frankfurt am Main",
      "registernummer": "HRB 130973",
      "registerart": "HRB",
      "company_name": "MobileParts+ UG (haftungsbeschränkt)",
      "company_seat": "Frankfurt am Main",
      "details": "12.05.2025 (Bekanntmachungsdatum)\n\nHessen Amtsgericht Frankfurt am Main HRB 130973\nLöschungsankündigung\n\nMobileParts+ UG (haftungsbeschränkt)\nGesellschaft mit beschränkter Haftung\nFrankfurt am Main\n\nDas Registergericht beabsichtigt die im Handelsregister eingetragene Gesellschaft von Amts wegen nach § 394 FamFG zu löschen. Die Frist zur Erhebung eines Widerspruchs gegen die beabsichtigte Löschung wird auf 1Monate festgesetzt."
    }
  ]
}