{
  "date": "2025-05-22",
  "date_of_scrape": "2025-05-31T12:42:02.456Z",
  "tool_version": "0.2.0",
  "number_of_announcements": 166,
  "announcements": [
    {
      "date": "2025-05-22",
      "id": "109865",
      "original_text": "Registerbekanntmachung nach dem Umwandlungsgesetz\nBayern Amtsgericht München HRB 244380\nWealthcap Immobilien 47 Komplementär GmbH – München",
      "type": "Registerbekanntmachung nach dem Umwandlungsgesetz",
      "state": "Bayern",
      "amtsgericht": "Amtsgericht München",
      "registernummer": "HRB 244380",
      "registerart": "HRB",
      "company_name": "Wealthcap Immobilien 47 Komplementär GmbH",
      "company_seat": "München",
      "details": "22.05.2025 (Bekanntmachungsdatum)\n\nBayern Amtsgericht München HRB 244380\nRegisterbekanntmachung nach dem Umwandlungsgesetz 21.05.2025 (Eintragungsdatum)\n\nWealthcap Immobilien 47 Komplementär GmbH\nGesellschaft mit beschränkter Haftung\nMünchen\n\nDen Gläubigern der an der Verschmelzung beteiligten Rechtsträger ist, wenn sie binnen sechs Monaten nach dem Tag, an dem die Eintragung der Verschmelzung in das Register des Sitzes desjenigen Rechtsträgers, dessen Gläubiger sie sind, nach § 19 Abs. 3 UmwG als bekannt gemacht gilt, ihren Anspruch nach Grund und Höhe in Textform anmelden, Sicherheit zu leisten, soweit sie nicht Befriedigung verlangen können. Dieses Recht steht den Gläubigern jedoch nur zu, wenn sie glaubhaft machen, dass durch die Verschmelzung die Erfüllung ihrer Forderung gefährdet wird."
    },
    {
      "date": "2025-05-22",
      "id": "109866",
      "original_text": "Einreichung neuer Dokumente\nBayern Amtsgericht Würzburg HRB 12485\nIRS Stahlwasserbau Consulting AG – Würzburg",
      "type": "Einreichung neuer Dokumente",
      "state": "Bayern",
      "amtsgericht": "Amtsgericht Würzburg",
      "registernummer": "HRB 12485",
      "registerart": "HRB",
      "company_name": "IRS Stahlwasserbau Consulting AG",
      "company_seat": "Würzburg",
      "details": "22.05.2025 (Bekanntmachungsdatum)\n\nBayern Amtsgericht Würzburg HRB 12485\nEinreichung neuer Dokumente 21.05.2025 (Eintragungsdatum)\n\nIRS Stahlwasserbau Consulting AG\nAktiengesellschaft\nWürzburg\n\nDem Amtsgericht Würzburg -Registergericht- ist eine Liste der Mitglieder des Aufsichtsrats eingereicht worden, § 106 AktG."
    },
    {
      "date": "2025-05-22",
      "id": "109867",
      "original_text": "Löschungsankündigung\nBayern Amtsgericht Fürth HRB 21356\nORLAUSKAS GmbH – Fürth",
      "type": "Löschungsankündigung",
      "state": "Bayern",
      "amtsgericht": "Amtsgericht Fürth",
      "registernummer": "HRB 21356",
      "registerart": "HRB",
      "company_name": "ORLAUSKAS GmbH",
      "company_seat": "Fürth",
      "details": "22.05.2025 (Bekanntmachungsdatum)\n\nBayern Amtsgericht Fürth HRB 21356\nLöschungsankündigung 21.05.2025 (Eintragungsdatum)\n\nORLAUSKAS GmbH\nGesellschaft mit beschränkter Haftung\nFürth\n\nDas Registergericht beabsichtigt, die im Handelsregister eingetragene Gesellschaft wegen Vermögenslosigkeit von Amts wegen nach § 394 FamFG zu löschen. Die Frist zur Erhebung eines Widerspruchs ist auf drei Monate festgesetzt."
    },
    {
      "date": "2025-05-22",
      "id": "109868",
      "original_text": "Einreichung neuer Dokumente\nBayern Amtsgericht München HRB 169051\nCatella Real Estate AG – München",
      "type": "Einreichung neuer Dokumente",
      "state": "Bayern",
      "amtsgericht": "Amtsgericht München",
      "registernummer": "HRB 169051",
      "registerart": "HRB",
      "company_name": "Catella Real Estate AG",
      "company_seat": "München",
      "details": "22.05.2025 (Bekanntmachungsdatum)\n\nBayern Amtsgericht München HRB 169051\nEinreichung neuer Dokumente 21.05.2025 (Eintragungsdatum)\n\nCatella Real Estate AG\nAktiengesellschaft\nMünchen\n\nDem Amtsgericht München -Registergericht- ist eine Liste der Mitglieder des Aufsichtsrats eingereicht worden, § 106 AktG."
    },
    {
      "date": "2025-05-22",
      "id": "109869",
      "original_text": "Einreichung neuer Dokumente\nBayern Amtsgericht Würzburg HRB 15712\nALDI Helmstadt Verwaltungs-SE – Helmstadt",
      "type": "Einreichung neuer Dokumente",
      "state": "Bayern",
      "amtsgericht": "Amtsgericht Würzburg",
      "registernummer": "HRB 15712",
      "registerart": "HRB",
      "company_name": "ALDI Helmstadt Verwaltungs-SE",
      "company_seat": "Helmstadt",
      "details": "22.05.2025 (Bekanntmachungsdatum)\n\nBayern Amtsgericht Würzburg HRB 15712\nEinreichung neuer Dokumente\n\nALDI Helmstadt Verwaltungs-SE\nEuropäische Aktiengesellschaft (SE)\nHelmstadt\n\nDem Amtsgericht Würzburg -Registergericht- ist eine Liste der Mitglieder des Aufsichtsrats eingereicht worden, Art. 9 Abs. 1 Buchst. c (ii) SE-VO i.V.m. § 106 AktG."
    },
    {
      "date": "2025-05-22",
      "id": "109870",
      "original_text": "Löschungsankündigung\nBayern Amtsgericht Fürth VR 21698\nStadt-SMV Erlangen e.V. – Erlangen",
      "type": "Löschungsankündigung",
      "state": "Bayern",
      "amtsgericht": "Amtsgericht Fürth",
      "registernummer": "VR 21698",
      "registerart": "VR",
      "company_name": "Stadt-SMV Erlangen e.V.",
      "company_seat": "Erlangen",
      "details": "22.05.2025 (Bekanntmachungsdatum)\n\nBayern Amtsgericht Fürth VR 21698\nLöschungsankündigung\n\nStadt-SMV Erlangen e.V.\neingetragener Verein\nErlangen\n\nDas Registergericht beabsichtigt, den im Vereinsregister eingetragenen Verein wegen Wegfalls sämtlicher Mitglieder zu löschen. Einwendungen können binnen einer Frist von vier Wochern beim zuständigen Registergericht erhoben werden."
    },
    {
      "date": "2025-05-22",
      "id": "109871",
      "original_text": "Registerbekanntmachung nach dem Umwandlungsgesetz\nBayern Amtsgericht Nürnberg HRA 18443\nSand Adler Dillberg e. K. – Lauf a.d. Pegnitz",
      "type": "Registerbekanntmachung nach dem Umwandlungsgesetz",
      "state": "Bayern",
      "amtsgericht": "Amtsgericht Nürnberg",
      "registernummer": "HRA 18443",
      "registerart": "HRA",
      "company_name": "Sand Adler Dillberg e. K.",
      "company_seat": "Lauf a.d. Pegnitz",
      "details": "22.05.2025 (Bekanntmachungsdatum)\n\nBayern Amtsgericht Nürnberg HRA 18443\nRegisterbekanntmachung nach dem Umwandlungsgesetz 21.05.2025 (Eintragungsdatum)\n\nSand Adler Dillberg e. K.\nEinzelkaufmann / Einzelkauffrau\nLauf a.d. Pegnitz\n\nDen Gläubigern der an der Verschmelzung beteiligten Rechtsträger ist, wenn sie binnen sechs Monaten nach dem Tag, an dem die Eintragung der Verschmelzung in das Register des Sitzes desjenigen Rechtsträgers, dessen Gläubiger sie sind, nach § 19 Abs. 3 UmwG als bekannt gemacht gilt, ihren Anspruch nach Grund und Höhe in Textform anmelden, Sicherheit zu leisten, soweit sie nicht Befriedigung verlangen können. Dieses Recht steht den Gläubigern jedoch nur zu, wenn sie glaubhaft machen, dass durch die Verschmelzung die Erfüllung ihrer Forderung gefährdet wird."
    },
    {
      "date": "2025-05-22",
      "id": "109872",
      "original_text": "Registerbekanntmachung nach dem Umwandlungsgesetz\nBayern Amtsgericht München HRB 281462\nTRESEC Forensik GmbH – München",
      "type": "Registerbekanntmachung nach dem Umwandlungsgesetz",
      "state": "Bayern",
      "amtsgericht": "Amtsgericht München",
      "registernummer": "HRB 281462",
      "registerart": "HRB",
      "company_name": "TRESEC Forensik GmbH",
      "company_seat": "München",
      "details": "22.05.2025 (Bekanntmachungsdatum)\n\nBayern Amtsgericht München HRB 281462\nRegisterbekanntmachung nach dem Umwandlungsgesetz 21.05.2025 (Eintragungsdatum)\n\nTRESEC Forensik GmbH\nGesellschaft mit beschränkter Haftung\nMünchen\n\nDen Gläubigern der an der Verschmelzung beteiligten Rechtsträger ist, wenn sie binnen sechs Monaten nach dem Tag, an dem die Eintragung der Verschmelzung in das Register des Sitzes desjenigen Rechtsträgers, dessen Gläubiger sie sind, nach § 19 Abs. 3 UmwG als bekannt gemacht gilt, ihren Anspruch nach Grund und Höhe in Textform anmelden, Sicherheit zu leisten, soweit sie nicht Befriedigung verlangen können. Dieses Recht steht den Gläubigern jedoch nur zu, wenn sie glaubhaft machen, dass durch die Verschmelzung die Erfüllung ihrer Forderung gefährdet wird."
    },
    {
      "date": "2025-05-22",
      "id": "109873",
      "original_text": "Einreichung neuer Dokumente\nBayern Amtsgericht Würzburg HRB 75\nWürzburger Straßenbahn Gesellschaft mit beschränkter Haftung – Würzburg",
      "type": "Einreichung neuer Dokumente",
      "state": "Bayern",
      "amtsgericht": "Amtsgericht Würzburg",
      "registernummer": "HRB 75",
      "registerart": "HRB",
      "company_name": "Würzburger Straßenbahn Gesellschaft mit beschränkter Haftung",
      "company_seat": "Würzburg",
      "details": "22.05.2025 (Bekanntmachungsdatum)\n\nBayern Amtsgericht Würzburg HRB 75\nEinreichung neuer Dokumente 21.05.2025 (Eintragungsdatum)\n\nWürzburger Straßenbahn Gesellschaft mit beschränkter Haftung\nGesellschaft mit beschränkter Haftung\nWürzburg\n\nDem Amtsgericht Würzburg -Registergericht- ist eine Liste der Mitglieder des Aufsichtsrats eingereicht worden, § 52 Abs. 3 S. 2 GmbHG."
    },
    {
      "date": "2025-05-22",
      "id": "109874",
      "original_text": "Löschungsankündigung\nBayern Amtsgericht München HRA 77634\nSierra Grundstücksentwicklung GmbH & Co. KG – Grünwald",
      "type": "Löschungsankündigung",
      "state": "Bayern",
      "amtsgericht": "Amtsgericht München",
      "registernummer": "HRA 77634",
      "registerart": "HRA",
      "company_name": "Sierra Grundstücksentwicklung GmbH & Co. KG",
      "company_seat": "Grünwald",
      "details": "22.05.2025 (Bekanntmachungsdatum)\n\nBayern Amtsgericht München HRA 77634\nLöschungsankündigung 20.05.2025 (Eintragungsdatum)\n\nSierra Grundstücksentwicklung GmbH & Co. KG\nKommanditgesellschaft\nGrünwald\n\nDas Registergericht beabsichtigt, das im Handelsregister eingetragene Ausscheiden der Sierra Beteiligungs GmbH (nunnmehr Sierra Verwaltung GmbH) und Eintreten der nu concept Asset Management GmbH im Wege der Gesamtrechtsnachfolge sowie die Auflösung und das Erlöschen der Firma  von Amts wegen nach § 395 FamFG zu löschen. Die Frist zur Erhebung eines Widerspruchs ist auf einen Monat festgesetzt."
    },
    {
      "date": "2025-05-22",
      "id": "109875",
      "original_text": "Registerbekanntmachung nach dem Umwandlungsgesetz\nBayern Amtsgericht Nürnberg HRB 35901\nSand Adler Dillberg Verwaltungsgesellschaft mbH – Lauterhofen",
      "type": "Registerbekanntmachung nach dem Umwandlungsgesetz",
      "state": "Bayern",
      "amtsgericht": "Amtsgericht Nürnberg",
      "registernummer": "HRB 35901",
      "registerart": "HRB",
      "company_name": "Sand Adler Dillberg Verwaltungsgesellschaft mbH",
      "company_seat": "Lauterhofen",
      "details": "22.05.2025 (Bekanntmachungsdatum)\n\nBayern Amtsgericht Nürnberg HRB 35901\nRegisterbekanntmachung nach dem Umwandlungsgesetz 21.05.2025 (Eintragungsdatum)\n\nSand Adler Dillberg Verwaltungsgesellschaft mbH\nGesellschaft mit beschränkter Haftung\nLauterhofen\n\nDen Gläubigern der an der Verschmelzung beteiligten Rechtsträger ist, wenn sie binnen sechs Monaten nach dem Tag, an dem die Eintragung der Verschmelzung in das Register des Sitzes desjenigen Rechtsträgers, dessen Gläubiger sie sind, nach § 19 Abs. 3 UmwG als bekannt gemacht gilt, ihren Anspruch nach Grund und Höhe in Textform anmelden, Sicherheit zu leisten, soweit sie nicht Befriedigung verlangen können. Dieses Recht steht den Gläubigern jedoch nur zu, wenn sie glaubhaft machen, dass durch die Verschmelzung die Erfüllung ihrer Forderung gefährdet wird."
    },
    {
      "date": "2025-05-22",
      "id": "109876",
      "original_text": "Löschungsankündigung\nBayern Amtsgericht München HRA 77634\nSierra Grundstücksentwicklung GmbH & Co. KG – Grünwald",
      "type": "Löschungsankündigung",
      "state": "Bayern",
      "amtsgericht": "Amtsgericht München",
      "registernummer": "HRA 77634",
      "registerart": "HRA",
      "company_name": "Sierra Grundstücksentwicklung GmbH & Co. KG",
      "company_seat": "Grünwald",
      "details": "22.05.2025 (Bekanntmachungsdatum)\n\nBayern Amtsgericht München HRA 77634\nLöschungsankündigung 20.05.2025 (Eintragungsdatum)\n\nSierra Grundstücksentwicklung GmbH & Co. KG\nKommanditgesellschaft\nGrünwald\n\nDas Registergericht beabsichtigt, das im Handelsregister eingetragene Ausscheiden der Sierra Beteiligungs GmbH (nunnmehr Sierra Verwaltung GmbH) und Eintreten der nu concept Asset Management GmbH im Wege der Gesamtrechtsnachfolge sowie die Auflösung und das Erlöschen der Firma  von Amts wegen nach § 395 FamFG zu löschen. #insert(Text=\"zztb_V_Widerspruchsfrist\")"
    },
    {
      "date": "2025-05-22",
      "id": "109877",
      "original_text": "Einreichung neuer Dokumente\nBayern Amtsgericht München HRB 252323\nMedical & Science Aktiengesellschaft – München",
      "type": "Einreichung neuer Dokumente",
      "state": "Bayern",
      "amtsgericht": "Amtsgericht München",
      "registernummer": "HRB 252323",
      "registerart": "HRB",
      "company_name": "Medical & Science Aktiengesellschaft",
      "company_seat": "München",
      "details": "22.05.2025 (Bekanntmachungsdatum)\n\nBayern Amtsgericht München HRB 252323\nEinreichung neuer Dokumente 21.05.2025 (Eintragungsdatum)\n\nMedical & Science Aktiengesellschaft\nAktiengesellschaft\nMünchen\n\nDem Amtsgericht München -Registergericht- ist eine Liste der Mitglieder des Aufsichtsrats eingereicht worden, § 106 AktG."
    },
    {
      "date": "2025-05-22",
      "id": "109878",
      "original_text": "Einreichung neuer Dokumente\nBayern Amtsgericht Bayreuth HRB 4203\nSana Klinik Pegnitz GmbH – Pegnitz",
      "type": "Einreichung neuer Dokumente",
      "state": "Bayern",
      "amtsgericht": "Amtsgericht Bayreuth",
      "registernummer": "HRB 4203",
      "registerart": "HRB",
      "company_name": "Sana Klinik Pegnitz GmbH",
      "company_seat": "Pegnitz",
      "details": "22.05.2025 (Bekanntmachungsdatum)\n\nBayern Amtsgericht Bayreuth HRB 4203\nEinreichung neuer Dokumente\n\nSana Klinik Pegnitz GmbH\nGesellschaft mit beschränkter Haftung\nPegnitz\n\nDem Amtsgericht Bayreuth -Registergericht- ist eine Liste der Mitglieder des Aufsichtsrats eingereicht worden, § 52 Abs. 3 S. 2 GmbHG."
    },
    {
      "date": "2025-05-22",
      "id": "109879",
      "original_text": "Registerbekanntmachung nach dem Umwandlungsgesetz\nBayern Amtsgericht Fürth HRB 21665\nThomas Pils GmbH – Oberscheinfeld",
      "type": "Registerbekanntmachung nach dem Umwandlungsgesetz",
      "state": "Bayern",
      "amtsgericht": "Amtsgericht Fürth",
      "registernummer": "HRB 21665",
      "registerart": "HRB",
      "company_name": "Thomas Pils GmbH",
      "company_seat": "Oberscheinfeld",
      "details": "22.05.2025 (Bekanntmachungsdatum)\n\nBayern Amtsgericht Fürth HRB 21665\nRegisterbekanntmachung nach dem Umwandlungsgesetz 21.05.2025 (Eintragungsdatum)\n\nThomas Pils GmbH\nGesellschaft mit beschränkter Haftung\nOberscheinfeld\n\nDen Gläubigern der an der Ausgliederung beteiligten Rechtsträger ist, wenn sie binnen sechs Monaten nach dem Tag, an dem die Eintragung der Ausgliederung in das Register des Sitzes desjenigen Rechtsträgers, dessen Gläubiger sie sind, nach §§ 125, 19 Abs. 3 UmwG als bekannt gemacht gilt, ihren Anspruch nach Grund und Höhe in Textform anmelden, Sicherheit zu leisten, soweit sie nicht Befriedigung verlangen können. Dieses Recht steht den Gläubigern jedoch nur zu, wenn sie glaubhaft machen, dass durch die Ausgliederung die Erfüllung ihrer Forderung gefährdet wird."
    },
    {
      "date": "2025-05-22",
      "id": "109880",
      "original_text": "Registerbekanntmachung nach dem Umwandlungsgesetz\nBayern Amtsgericht Ansbach HRB 3870\najco solutions GmbH – Ansbach",
      "type": "Registerbekanntmachung nach dem Umwandlungsgesetz",
      "state": "Bayern",
      "amtsgericht": "Amtsgericht Ansbach",
      "registernummer": "HRB 3870",
      "registerart": "HRB",
      "company_name": "ajco solutions GmbH",
      "company_seat": "Ansbach",
      "details": "22.05.2025 (Bekanntmachungsdatum)\n\nBayern Amtsgericht Ansbach HRB 3870\nRegisterbekanntmachung nach dem Umwandlungsgesetz 21.05.2025 (Eintragungsdatum)\n\najco solutions GmbH\nGesellschaft mit beschränkter Haftung\nAnsbach\n\nDen Gläubigern der an der Verschmelzung beteiligten Rechtsträger ist, wenn sie binnen sechs Monaten nach dem Tag, an dem die Eintragung der Verschmelzung in das Register des Sitzes desjenigen Rechtsträgers, dessen Gläubiger sie sind, nach § 19 Abs. 3 UmwG als bekannt gemacht gilt, ihren Anspruch nach Grund und Höhe in Textform anmelden, Sicherheit zu leisten, soweit sie nicht Befriedigung verlangen können. Dieses Recht steht den Gläubigern jedoch nur zu, wenn sie glaubhaft machen, dass durch die Verschmelzung die Erfüllung ihrer Forderung gefährdet wird."
    },
    {
      "date": "2025-05-22",
      "id": "109881",
      "original_text": "Registerbekanntmachung nach dem Umwandlungsgesetz\nBayern Amtsgericht Fürth HRA 6079\nAlois Pils e.K. Inhaber Thomas Pils – Oberscheinfeld, Ortsteil Stierhöfstetten",
      "type": "Registerbekanntmachung nach dem Umwandlungsgesetz",
      "state": "Bayern",
      "amtsgericht": "Amtsgericht Fürth",
      "registernummer": "HRA 6079",
      "registerart": "HRA",
      "company_name": "Alois Pils e.K. Inhaber Thomas Pils",
      "company_seat": "Oberscheinfeld, Ortsteil Stierhöfstetten",
      "details": "22.05.2025 (Bekanntmachungsdatum)\n\nBayern Amtsgericht Fürth HRA 6079\nRegisterbekanntmachung nach dem Umwandlungsgesetz 21.05.2025 (Eintragungsdatum)\n\nAlois Pils e.K. Inhaber Thomas Pils\nEinzelkaufmann / Einzelkauffrau\nOberscheinfeld, Ortsteil Stierhöfstetten\n\nDen Gläubigern der an der Ausgliederung beteiligten Rechtsträger ist, wenn sie binnen sechs Monaten nach dem Tag, an dem die Eintragung der Ausgliederung in das Register des Sitzes desjenigen Rechtsträgers, dessen Gläubiger sie sind, nach §§ 125, 19 Abs. 3 UmwG als bekannt gemacht gilt, ihren Anspruch nach Grund und Höhe in Textform anmelden, Sicherheit zu leisten, soweit sie nicht Befriedigung verlangen können. Dieses Recht steht den Gläubigern jedoch nur zu, wenn sie glaubhaft machen, dass durch die Ausgliederung die Erfüllung ihrer Forderung gefährdet wird."
    },
    {
      "date": "2025-05-22",
      "id": "109882",
      "original_text": "Löschungsankündigung\nBayern Amtsgericht Augsburg HRB 27901\nGötz Waagen Augsburg GmbH – Augsburg",
      "type": "Löschungsankündigung",
      "state": "Bayern",
      "amtsgericht": "Amtsgericht Augsburg",
      "registernummer": "HRB 27901",
      "registerart": "HRB",
      "company_name": "Götz Waagen Augsburg GmbH",
      "company_seat": "Augsburg",
      "details": "22.05.2025 (Bekanntmachungsdatum)\n\nBayern Amtsgericht Augsburg HRB 27901\nLöschungsankündigung\n\nGötz Waagen Augsburg GmbH\nGesellschaft mit beschränkter Haftung\nAugsburg\n\nDas Registergericht beabsichtigt, die im Handelsregister eingetragene Gesellschaft wegen Vermögenslosigkeit von Amts wegen nach § 394 FamFG zu löschen. Die Frist zur Erhebung eines Widerspruchs ist auf einen Monat festgesetzt."
    },
    {
      "date": "2025-05-22",
      "id": "109883",
      "original_text": "Registerbekanntmachung nach dem Umwandlungsgesetz\nBayern Amtsgericht Coburg HRB 239\namo-Asphalt-Verwaltungs-GmbH – Untersiemau",
      "type": "Registerbekanntmachung nach dem Umwandlungsgesetz",
      "state": "Bayern",
      "amtsgericht": "Amtsgericht Coburg",
      "registernummer": "HRB 239",
      "registerart": "HRB",
      "company_name": "amo-Asphalt-Verwaltungs-GmbH",
      "company_seat": "Untersiemau",
      "details": "22.05.2025 (Bekanntmachungsdatum)\n\nBayern Amtsgericht Coburg HRB 239\nRegisterbekanntmachung nach dem Umwandlungsgesetz 19.05.2025 (Eintragungsdatum)\n\namo-Asphalt-Verwaltungs-GmbH\nGesellschaft mit beschränkter Haftung\nUntersiemau\n\nDen Gläubigern der an der Verschmelzung beteiligten Rechtsträger ist, wenn sie binnen sechs Monaten nach dem Tag, an dem die Eintragung der Verschmelzung in das Register des Sitzes desjenigen Rechtsträgers, dessen Gläubiger sie sind, nach § 19 Abs. 3 UmwG als bekannt gemacht gilt, ihren Anspruch nach Grund und Höhe in Textform anmelden, Sicherheit zu leisten, soweit sie nicht Befriedigung verlangen können. Dieses Recht steht den Gläubigern jedoch nur zu, wenn sie glaubhaft machen, dass durch die Verschmelzung die Erfüllung ihrer Forderung gefährdet wird."
    },
    {
      "date": "2025-05-22",
      "id": "109884",
      "original_text": "Registerbekanntmachung nach dem Umwandlungsgesetz\nBayern Amtsgericht München HRB 182783\nThello GmbH – Wörthsee, OT Steinebach",
      "type": "Registerbekanntmachung nach dem Umwandlungsgesetz",
      "state": "Bayern",
      "amtsgericht": "Amtsgericht München",
      "registernummer": "HRB 182783",
      "registerart": "HRB",
      "company_name": "Thello GmbH",
      "company_seat": "Wörthsee, OT Steinebach",
      "details": "22.05.2025 (Bekanntmachungsdatum)\n\nBayern Amtsgericht München HRB 182783\nRegisterbekanntmachung nach dem Umwandlungsgesetz 21.05.2025 (Eintragungsdatum)\n\nThello GmbH\nGesellschaft mit beschränkter Haftung\nWörthsee, OT Steinebach\n\nDen Gläubigern der an der Verschmelzung beteiligten Rechtsträger ist, wenn sie binnen sechs Monaten nach dem Tag, an dem die Eintragung der Verschmelzung in das Register des Sitzes desjenigen Rechtsträgers, dessen Gläubiger sie sind, nach § 19 Abs. 3 UmwG als bekannt gemacht gilt, ihren Anspruch nach Grund und Höhe in Textform anmelden, Sicherheit zu leisten, soweit sie nicht Befriedigung verlangen können. Dieses Recht steht den Gläubigern jedoch nur zu, wenn sie glaubhaft machen, dass durch die Verschmelzung die Erfüllung ihrer Forderung gefährdet wird."
    },
    {
      "date": "2025-05-22",
      "id": "109885",
      "original_text": "Registerbekanntmachung nach dem Umwandlungsgesetz\nBayern Amtsgericht München HRB 298994\nGRAL Concept GmbH – Freising",
      "type": "Registerbekanntmachung nach dem Umwandlungsgesetz",
      "state": "Bayern",
      "amtsgericht": "Amtsgericht München",
      "registernummer": "HRB 298994",
      "registerart": "HRB",
      "company_name": "GRAL Concept GmbH",
      "company_seat": "Freising",
      "details": "22.05.2025 (Bekanntmachungsdatum)\n\nBayern Amtsgericht München HRB 298994\nRegisterbekanntmachung nach dem Umwandlungsgesetz 21.05.2025 (Eintragungsdatum)\n\nGRAL Concept GmbH\nGesellschaft mit beschränkter Haftung\nFreising\n\nDen Gläubigern der an der Ausgliederung beteiligten Rechtsträger ist, wenn sie binnen sechs Monaten nach dem Tag, an dem die Eintragung der Ausgliederung in das Register des Sitzes desjenigen Rechtsträgers, dessen Gläubiger sie sind, nach §§ 125, 19 Abs. 3 UmwG als bekannt gemacht gilt, ihren Anspruch nach Grund und Höhe in Textform anmelden, Sicherheit zu leisten, soweit sie nicht Befriedigung verlangen können. Dieses Recht steht den Gläubigern jedoch nur zu, wenn sie glaubhaft machen, dass durch die Ausgliederung die Erfüllung ihrer Forderung gefährdet wird."
    },
    {
      "date": "2025-05-22",
      "id": "109886",
      "original_text": "Sonstige Registerbekanntmachung\nBayern Amtsgericht Augsburg GnR 1672\nBürgerwärmenetz Auchsesheim eG – Donauwörth",
      "type": "Sonstige Registerbekanntmachung",
      "state": "Bayern",
      "amtsgericht": "Amtsgericht Augsburg",
      "registernummer": "GnR 1672",
      "registerart": "GnR",
      "company_name": "Bürgerwärmenetz Auchsesheim eG",
      "company_seat": "Donauwörth",
      "details": "22.05.2025 (Bekanntmachungsdatum)\n\nBayern Amtsgericht Augsburg GnR 1672\nSonstige Registerbekanntmachung 21.05.2025 (Eintragungsdatum)\n\nBürgerwärmenetz Auchsesheim eG\neingetragene Genossenschaft\nDonauwörth\n\nDen Gläubigern der Genossenschaft ist gemäß §§ 22a i.V.m. 22 GenG, wenn sie sich binnen sechs Monaten nach der Bekanntmachung bei der Genossenschaft zu diesem Zweck melden, Sicherheit zu leisten, soweit sie nicht Befriedigung verlangen können. Die Nachschusspflicht wurde aufgehoben."
    },
    {
      "date": "2025-05-22",
      "id": "109887",
      "original_text": "Löschungsankündigung\nBayern Amtsgericht Aschaffenburg HRB 17710\nRanch & Sea Steakhouse GmbH – Mainaschaff",
      "type": "Löschungsankündigung",
      "state": "Bayern",
      "amtsgericht": "Amtsgericht Aschaffenburg",
      "registernummer": "HRB 17710",
      "registerart": "HRB",
      "company_name": "Ranch & Sea Steakhouse GmbH",
      "company_seat": "Mainaschaff",
      "details": "22.05.2025 (Bekanntmachungsdatum)\n\nBayern Amtsgericht Aschaffenburg HRB 17710\nLöschungsankündigung\n\nRanch & Sea Steakhouse GmbH\nGesellschaft mit beschränkter Haftung\nMainaschaff\n\nDas Registergericht beabsichtigt, die im Handelsregister eingetragene Gesellschaft wegen Vermögenslosigkeit von Amts wegen nach § 394 FamFG zu löschen. Die Frist zur Erhebung eines Widerspruchs ist auf drei Monate festgesetzt."
    },
    {
      "date": "2025-05-22",
      "id": "109888",
      "original_text": "Registerbekanntmachung nach dem Umwandlungsgesetz\nBayern Amtsgericht München HRB 298003\nMPEP Advisors GmbH – Oberhaching",
      "type": "Registerbekanntmachung nach dem Umwandlungsgesetz",
      "state": "Bayern",
      "amtsgericht": "Amtsgericht München",
      "registernummer": "HRB 298003",
      "registerart": "HRB",
      "company_name": "MPEP Advisors GmbH",
      "company_seat": "Oberhaching",
      "details": "22.05.2025 (Bekanntmachungsdatum)\n\nBayern Amtsgericht München HRB 298003\nRegisterbekanntmachung nach dem Umwandlungsgesetz 21.05.2025 (Eintragungsdatum)\n\nMPEP Advisors GmbH\nGesellschaft mit beschränkter Haftung\nOberhaching\n\nDen Gläubigern des formwechselnden Rechtsträgers ist, wenn sie binnen sechs Monaten nach dem Tag, an dem die Eintragung des Formwechsels nach § 201 UmwG als bekannt gemacht gilt, ihren Anspruch nach Grund und Höhe in Textform anmelden, Sicherheit zu leisten, soweit sie nicht Befriedigung verlangen können. Dieses Recht steht den Gläubigern jedoch nur zu, wenn sie glaubhaft machen, dass durch den Formwechsel die Erfüllung ihrer Forderung gefährdet wird."
    },
    {
      "date": "2025-05-22",
      "id": "109889",
      "original_text": "Löschungsankündigung\nBayern Amtsgericht München HRB 217876\nMI2 GmbH – München",
      "type": "Löschungsankündigung",
      "state": "Bayern",
      "amtsgericht": "Amtsgericht München",
      "registernummer": "HRB 217876",
      "registerart": "HRB",
      "company_name": "MI2 GmbH",
      "company_seat": "München",
      "details": "22.05.2025 (Bekanntmachungsdatum)\n\nBayern Amtsgericht München HRB 217876\nLöschungsankündigung\n\nMI2 GmbH\nGesellschaft mit beschränkter Haftung\nMünchen\n\nDas Registergericht beabsichtigt, die im Handelsregister eingetragene Gesellschaft wegen Vermögenslosigkeit von Amts wegen nach § 394 FamFG zu löschen. Die Frist zur Erhebung eines Widerspruchs ist auf drei Monate festgesetzt."
    },
    {
      "date": "2025-05-22",
      "id": "109890",
      "original_text": "Löschungsankündigung\nBayern Amtsgericht Kempten (Allgäu) HRB 4322\nGustav Lindner GmbH – Kaufbeuren",
      "type": "Löschungsankündigung",
      "state": "Bayern",
      "amtsgericht": "Amtsgericht Kempten (Allgäu)",
      "registernummer": "HRB 4322",
      "registerart": "HRB",
      "company_name": "Gustav Lindner GmbH",
      "company_seat": "Kaufbeuren",
      "details": "22.05.2025 (Bekanntmachungsdatum)\n\nBayern Amtsgericht Kempten (Allgäu) HRB 4322\nLöschungsankündigung\n\nGustav Lindner GmbH\nGesellschaft mit beschränkter Haftung\nKaufbeuren\n\nDas Registergericht beabsichtigt, die im Handelsregister eingetragene Gesellschaft wegen Vermögenslosigkeit von Amts wegen nach § 394 FamFG zu löschen. Die Frist zur Erhebung eines Widerspruchs ist auf einen Monat festgesetzt."
    },
    {
      "date": "2025-05-22",
      "id": "109891",
      "original_text": "Registerbekanntmachung nach dem Umwandlungsgesetz\nBayern Amtsgericht Regensburg HRB 6592\nA.U.S. Umweltberatungsgesellschaft Martin Zeiml mbH – Tegernheim",
      "type": "Registerbekanntmachung nach dem Umwandlungsgesetz",
      "state": "Bayern",
      "amtsgericht": "Amtsgericht Regensburg",
      "registernummer": "HRB 6592",
      "registerart": "HRB",
      "company_name": "A.U.S. Umweltberatungsgesellschaft Martin Zeiml mbH",
      "company_seat": "Tegernheim",
      "details": "22.05.2025 (Bekanntmachungsdatum)\n\nBayern Amtsgericht Regensburg HRB 6592\nRegisterbekanntmachung nach dem Umwandlungsgesetz 21.05.2025 (Eintragungsdatum)\n\nA.U.S. Umweltberatungsgesellschaft Martin Zeiml mbH\nGesellschaft mit beschränkter Haftung\nTegernheim\n\nDen Gläubigern der an der Verschmelzung beteiligten Rechtsträger ist, wenn sie binnen sechs Monaten nach dem Tag, an dem die Eintragung der Verschmelzung in das Register des Sitzes desjenigen Rechtsträgers, dessen Gläubiger sie sind, nach § 19 Abs. 3 UmwG als bekannt gemacht gilt, ihren Anspruch nach Grund und Höhe in Textform anmelden, Sicherheit zu leisten, soweit sie nicht Befriedigung verlangen können. Dieses Recht steht den Gläubigern jedoch nur zu, wenn sie glaubhaft machen, dass durch die Verschmelzung die Erfüllung ihrer Forderung gefährdet wird."
    },
    {
      "date": "2025-05-22",
      "id": "109892",
      "original_text": "Löschungsankündigung\nBayern Amtsgericht Kempten (Allgäu) HRB 16620\nLebenPlus - Kaufbeurer Pflegedienst GmbH – Kaufbeuren",
      "type": "Löschungsankündigung",
      "state": "Bayern",
      "amtsgericht": "Amtsgericht Kempten (Allgäu)",
      "registernummer": "HRB 16620",
      "registerart": "HRB",
      "company_name": "LebenPlus - Kaufbeurer Pflegedienst GmbH",
      "company_seat": "Kaufbeuren",
      "details": "22.05.2025 (Bekanntmachungsdatum)\n\nBayern Amtsgericht Kempten (Allgäu) HRB 16620\nLöschungsankündigung\n\nLebenPlus - Kaufbeurer Pflegedienst GmbH\nGesellschaft mit beschränkter Haftung\nKaufbeuren\n\nDas Registergericht beabsichtigt, die im Handelsregister eingetragene Gesellschaft wegen Vermögenslosigkeit von Amts wegen nach § 394 FamFG zu löschen. Die Frist zur Erhebung eines Widerspruchs ist auf einen Monat festgesetzt."
    },
    {
      "date": "2025-05-22",
      "id": "109893",
      "original_text": "Löschungsankündigung\nSchleswig-Holstein Amtsgericht Flensburg HRB 8411\nKOMM 4 BUY GmbH – Flensburg",
      "type": "Löschungsankündigung",
      "state": "Schleswig-Holstein",
      "amtsgericht": "Amtsgericht Flensburg",
      "registernummer": "HRB 8411",
      "registerart": "HRB",
      "company_name": "KOMM 4 BUY GmbH",
      "company_seat": "Flensburg",
      "details": "22.05.2025 (Bekanntmachungsdatum)\n\nSchleswig-Holstein Amtsgericht Flensburg HRB 8411\nLöschungsankündigung\n\nKOMM 4 BUY GmbH\nGesellschaft mit beschränkter Haftung\nFlensburg\n\nEs ist die Löschung der nachstehenden Gesellschaft wegen Vermögenslosigkeit gemäß § 394 FamFG beabsichtigt.\nWiderspruchsfrist: 2 Monate."
    },
    {
      "date": "2025-05-22",
      "id": "109894",
      "original_text": "Löschungsankündigung\nBerlin Amtsgericht Berlin (Charlottenburg) HRB 163331\nEstelle Verwaltungs GmbH – Berlin",
      "type": "Löschungsankündigung",
      "state": "Berlin",
      "amtsgericht": "Amtsgericht Berlin (Charlottenburg)",
      "registernummer": "HRB 163331",
      "registerart": "HRB",
      "company_name": "Estelle Verwaltungs GmbH",
      "company_seat": "Berlin",
      "details": "22.05.2025 (Bekanntmachungsdatum)\n\nBerlin Amtsgericht Berlin (Charlottenburg) HRB 163331\nLöschungsankündigung\n\nEstelle Verwaltungs GmbH\nGesellschaft mit beschränkter Haftung\nBerlin\n\nBei der nachstehenden Gesellschaft wird das Amtslöschungsverfahren gemäß § 394 FamFG eingeleitet. Widerspruchsfrist 6 Wochen"
    },
    {
      "date": "2025-05-22",
      "id": "109895",
      "original_text": "Sonstige Registerbekanntmachung\nHamburg Amtsgericht Hamburg HRB 64651\nHarburg-Freudenberger Maschinenbau GmbH – Hamburg",
      "type": "Sonstige Registerbekanntmachung",
      "state": "Hamburg",
      "amtsgericht": "Amtsgericht Hamburg",
      "registernummer": "HRB 64651",
      "registerart": "HRB",
      "company_name": "Harburg-Freudenberger Maschinenbau GmbH",
      "company_seat": "Hamburg",
      "details": "22.05.2025 (Bekanntmachungsdatum)\n\nHamburg Amtsgericht Hamburg HRB 64651\nSonstige Registerbekanntmachung\n\nHarburg-Freudenberger Maschinenbau GmbH\nGesellschaft mit beschränkter Haftung\nHamburg\n\nAls nicht eingetragen wird bekannt gemacht: Liste des Aufsichtsrats wurde eingereicht."
    },
    {
      "date": "2025-05-22",
      "id": "109896",
      "original_text": "Registerbekanntmachung nach dem Umwandlungsgesetz\nBaden-Württemberg Amtsgericht Mannheim HRB 745630\nKurz Gruppe BaW GmbH – Friolzheim",
      "type": "Registerbekanntmachung nach dem Umwandlungsgesetz",
      "state": "Baden-Württemberg",
      "amtsgericht": "Amtsgericht Mannheim",
      "registernummer": "HRB 745630",
      "registerart": "HRB",
      "company_name": "Kurz Gruppe BaW GmbH",
      "company_seat": "Friolzheim",
      "details": "22.05.2025 (Bekanntmachungsdatum)\n\nBaden-Württemberg Amtsgericht Mannheim HRB 745630\nRegisterbekanntmachung nach dem Umwandlungsgesetz 22.05.2025 (Eintragungsdatum)\n\nKurz Gruppe BaW GmbH\nGesellschaft mit beschränkter Haftung\nFriolzheim\n\nDen Gläubigern der an der Verschmelzung beteiligten Rechtsträger ist, wenn sie binnen sechs Monaten nach dem Tag, an dem die Eintragung der Verschmelzung in das Register des Sitzes desjenigen Rechtsträgers, dessen Gläubiger sie sind, nach § 19 Abs. 3 UmwG als bekanntgemacht gilt, ihren Anspruch nach Grund und Höhe schriftlich anmelden, Sicherheit zu leisten, soweit sie nicht Befriedigung verlangen können. Dieses Recht steht den Gläubigern jedoch nur zu, wenn sie glaubhaft machen, dass durch die Verschmelzung die Erfüllung ihrer Forderung gefährdet wird."
    },
    {
      "date": "2025-05-22",
      "id": "109897",
      "original_text": "Registerbekanntmachung nach dem Umwandlungsgesetz\nBaden-Württemberg Amtsgericht Mannheim HRB 743566\nKurz Gruppe Steinbruch Logistik GmbH – Friolzheim",
      "type": "Registerbekanntmachung nach dem Umwandlungsgesetz",
      "state": "Baden-Württemberg",
      "amtsgericht": "Amtsgericht Mannheim",
      "registernummer": "HRB 743566",
      "registerart": "HRB",
      "company_name": "Kurz Gruppe Steinbruch Logistik GmbH",
      "company_seat": "Friolzheim",
      "details": "22.05.2025 (Bekanntmachungsdatum)\n\nBaden-Württemberg Amtsgericht Mannheim HRB 743566\nRegisterbekanntmachung nach dem Umwandlungsgesetz 22.05.2025 (Eintragungsdatum)\n\nKurz Gruppe Steinbruch Logistik GmbH\nGesellschaft mit beschränkter Haftung\nFriolzheim\n\nAls nicht eingetragen wird bekanntgemacht:\nDen Gläubigern der an der Verschmelzung beteiligten Rechtsträger ist, wenn sie binnen sechs Monaten nach dem Tag, an dem die Eintragung der Verschmelzung in das Register des Sitzes desjenigen Rechtsträgers, dessen Gläubiger sie sind, nach § 19 Abs. 3 UmwG als bekanntgemacht gilt, ihren Anspruch nach Grund und Höhe schriftlich anmelden, Sicherheit zu leisten, soweit sie nicht Befriedigung verlangen können. Dieses Recht steht den Gläubigern jedoch nur zu, wenn sie glaubhaft machen, dass durch die Verschmelzung die Erfüllung ihrer Forderung gefährdet wird."
    },
    {
      "date": "2025-05-22",
      "id": "109898",
      "original_text": "Einreichung neuer Dokumente\nBaden-Württemberg Amtsgericht Freiburg HRB 930\nStadtwerke Freiburg GmbH – Freiburg im Breisgau",
      "type": "Einreichung neuer Dokumente",
      "state": "Baden-Württemberg",
      "amtsgericht": "Amtsgericht Freiburg",
      "registernummer": "HRB 930",
      "registerart": "HRB",
      "company_name": "Stadtwerke Freiburg GmbH",
      "company_seat": "Freiburg im Breisgau",
      "details": "22.05.2025 (Bekanntmachungsdatum)\n\nBaden-Württemberg Amtsgericht Freiburg HRB 930\nEinreichung neuer Dokumente\n\nStadtwerke Freiburg GmbH\nGesellschaft mit beschränkter Haftung\nFreiburg im Breisgau\n\nDie Gesellschaft hat am 21.05.2025 die Liste über die Zusammensetzung des Aufsichtsrats zum Handelsregister eingereicht."
    },
    {
      "date": "2025-05-22",
      "id": "109899",
      "original_text": "Registerbekanntmachung nach dem Umwandlungsgesetz\nHamburg Amtsgericht Hamburg HRB 2905\nMontblanc-Simplo GmbH – Hamburg",
      "type": "Registerbekanntmachung nach dem Umwandlungsgesetz",
      "state": "Hamburg",
      "amtsgericht": "Amtsgericht Hamburg",
      "registernummer": "HRB 2905",
      "registerart": "HRB",
      "company_name": "Montblanc-Simplo GmbH",
      "company_seat": "Hamburg",
      "details": "22.05.2025 (Bekanntmachungsdatum)\n\nHamburg Amtsgericht Hamburg HRB 2905\nRegisterbekanntmachung nach dem Umwandlungsgesetz 22.05.2025 (Eintragungsdatum)\n\nMontblanc-Simplo GmbH\nGesellschaft mit beschränkter Haftung\nHamburg\n\nAls nicht eingetragen wird bekannt gemacht:\nDen Gläubigern der an der Verschmelzung beteiligten Gesellschaften ist, wenn sie binnen sechs Monaten nach dem Tag, an dem die Eintragung der Verschmelzung in das Register des Sitzes desjenigen Rechtsträgers, dessen Gläubiger sie sind, nach § 19 Absatz 3 UmwG als bekannt gemacht gilt, ihren Anspruch nach Grund und Höhe schriftlich anmelden, Sicherheit zu leisten, soweit sie nicht Befriedigung verlangen können. Dieses Recht steht den Gläubigern jedoch nur zu, wenn sie glaubhaft machen, dass durch die Verschmelzung die Erfüllung ihrer Forderung gefährdet wird."
    },
    {
      "date": "2025-05-22",
      "id": "109900",
      "original_text": "Registerbekanntmachung nach dem Umwandlungsgesetz\nHamburg Amtsgericht Hamburg HRB 173919\nMontblanc-Ferdinand Wagner GmbH L´Éstamperie gegr. 1849 – Hamburg",
      "type": "Registerbekanntmachung nach dem Umwandlungsgesetz",
      "state": "Hamburg",
      "amtsgericht": "Amtsgericht Hamburg",
      "registernummer": "HRB 173919",
      "registerart": "HRB",
      "company_name": "Montblanc-Ferdinand Wagner GmbH L´Éstamperie gegr. 1849",
      "company_seat": "Hamburg",
      "details": "22.05.2025 (Bekanntmachungsdatum)\n\nHamburg Amtsgericht Hamburg HRB 173919\nRegisterbekanntmachung nach dem Umwandlungsgesetz 22.05.2025 (Eintragungsdatum)\n\nMontblanc-Ferdinand Wagner GmbH L´Éstamperie gegr. 1849\nGesellschaft mit beschränkter Haftung\nHamburg\n\nAls nicht eingetragen wird bekannt gemacht:\nDen Gläubigern der an der Verschmelzung beteiligten Gesellschaften ist, wenn sie binnen sechs Monaten nach dem Tag, an dem die Eintragung der Verschmelzung in das Register des Sitzes desjenigen Rechtsträgers, dessen Gläubiger sie sind, nach § 19 Absatz 3 UmwG als bekannt gemacht gilt, ihren Anspruch nach Grund und Höhe schriftlich anmelden, Sicherheit zu leisten, soweit sie nicht Befriedigung verlangen können. Dieses Recht steht den Gläubigern jedoch nur zu, wenn sie glaubhaft machen, dass durch die Verschmelzung die Erfüllung ihrer Forderung gefährdet wird."
    },
    {
      "date": "2025-05-22",
      "id": "109901",
      "original_text": "Sonstige Registerbekanntmachung\nBerlin Amtsgericht Berlin (Charlottenburg) HRB 253066\nAdcrease GmbH – Berlin",
      "type": "Sonstige Registerbekanntmachung",
      "state": "Berlin",
      "amtsgericht": "Amtsgericht Berlin (Charlottenburg)",
      "registernummer": "HRB 253066",
      "registerart": "HRB",
      "company_name": "Adcrease GmbH",
      "company_seat": "Berlin",
      "details": "22.05.2025 (Bekanntmachungsdatum)\n\nBerlin Amtsgericht Berlin (Charlottenburg) HRB 253066\nSonstige Registerbekanntmachung\n\nAdcrease GmbH\nGesellschaft mit beschränkter Haftung\nBerlin\n\nAls nicht eingetragen wird veröffentlicht: Den Gläubigern der an der Spaltung beteiligten Rechtsträger ist, wenn sie binnen sechs Monaten nach dem Tag, an dem die Eintragung der Spaltung in das Register des Sitzes desjenigen Rechtsträgers, dessen Gläubiger sie sind, als bekannt gemacht gilt, ihren Anspruch nach Grund und Höhe schriftlich anmelden, Sicherheit zu leisten, soweit sie nicht Befriedigung verlangen können. Dieses Recht steht den Gläubigern jedoch nur zu, wenn sie glaubhaft machen, dass durch die Spaltung die Erfüllung ihrer Forderung gefährdet wird. Das Recht, Sicherheitsleistung zu verlangen, steht Gläubigern nicht zu, die im Falle der Insolvenz ein Recht auf vorzugsweise Befriedigung aus einer Deckungsmasse haben, die nach gesetzlicher Vorschrift zu ihrem Schutz errichtet und staatlich überwacht ist."
    },
    {
      "date": "2025-05-22",
      "id": "109902",
      "original_text": "Löschungsankündigung\nSaarland Amtsgericht Saarbrücken HRB 101002\nGebäudemanagement & Immobilien Plavulj GmbH – Quierschied",
      "type": "Löschungsankündigung",
      "state": "Saarland",
      "amtsgericht": "Amtsgericht Saarbrücken",
      "registernummer": "HRB 101002",
      "registerart": "HRB",
      "company_name": "Gebäudemanagement & Immobilien Plavulj GmbH",
      "company_seat": "Quierschied",
      "details": "22.05.2025 (Bekanntmachungsdatum)\n\nSaarland Amtsgericht Saarbrücken HRB 101002\nLöschungsankündigung\n\nGebäudemanagement & Immobilien Plavulj GmbH\nGesellschaft mit beschränkter Haftung\nQuierschied\n\nEs ist beabsichtigt, die Gesellschaft von Amts wegen gemäß § 394 FamFG wegen Vermögenslosigkeit zu löschen.\nGegen die Löschung von Amts wegen ist das Rechtsmittel des Widerspruchs statthaft. Der Widerspruch ist binnen einer Frist zwei Monaten beginnend mit dem Tag dieser Veröffentlichung durch Einreichen eines Widerspruchsschreibens -schriftlich oder zur Niederschrift der Geschäftsstelle beim Amtsgericht Saarbrücken, -zentrales Handelsregister-, Mainzerstr.178, 66121 Saarbrücken einzulegen.\nDer Widerspruch muss die Bezeichnung der angefochtenen Löschungsankündigung enthalten sowie die Erklärung, dass Widerspruch eingelegt wird. Er ist vom Widerspruchsführer oder seinem Bevollmächtigten zu unterzeichnen.\nDas Widerspruchsschreiben kann auch in der Form eines elektronischen Dokumentes eingereicht werden, das mit einer qualifizierten elektronischen Signatur nach dem Signaturgesetz versehen sein muss (§§ 14 Abs. 2 FamFG, 130a, 298 ZPO)."
    },
    {
      "date": "2025-05-22",
      "id": "109903",
      "original_text": "Registerbekanntmachung nach dem Umwandlungsgesetz\nBaden-Württemberg Amtsgericht Stuttgart HRA 742021\nDieter Heuser Betriebsverpachtung e.K. – Heilbronn",
      "type": "Registerbekanntmachung nach dem Umwandlungsgesetz",
      "state": "Baden-Württemberg",
      "amtsgericht": "Amtsgericht Stuttgart",
      "registernummer": "HRA 742021",
      "registerart": "HRA",
      "company_name": "Dieter Heuser Betriebsverpachtung e.K.",
      "company_seat": "Heilbronn",
      "details": "22.05.2025 (Bekanntmachungsdatum)\n\nBaden-Württemberg Amtsgericht Stuttgart HRA 742021\nRegisterbekanntmachung nach dem Umwandlungsgesetz 22.05.2025 (Eintragungsdatum)\n\nDieter Heuser Betriebsverpachtung e.K.\nEinzelkaufmann / Einzelkauffrau\nHeilbronn\n\nDen Gläubigern der an der Ausgliederung beteiligten Rechtsträger ist, wenn sie binnen sechs Monaten nach dem Tag, an dem die Eintragung der Ausgliederung in das Register des Sitzes desjenigen Rechtsträgers, dessen Gläubiger sie sind, nach § 19 Abs. 3 UmwG als bekanntgemacht gilt, ihren Anspruch nach Grund und Höhe schriftlich anmelden, Sicherheit zu leisten, soweit sie nicht Befriedigung verlangen können. Dieses Recht steht den Gläubigern jedoch nur zu, wenn sie glaubhaft machen, dass durch die Ausgliederung die Erfüllung ihrer Forderung gefährdet wird."
    },
    {
      "date": "2025-05-22",
      "id": "109904",
      "original_text": "Einreichung neuer Dokumente\nBerlin Amtsgericht Berlin (Charlottenburg) HRB 50000\nDeutsche Bahn Aktiengesellschaft – Berlin",
      "type": "Einreichung neuer Dokumente",
      "state": "Berlin",
      "amtsgericht": "Amtsgericht Berlin (Charlottenburg)",
      "registernummer": "HRB 50000",
      "registerart": "HRB",
      "company_name": "Deutsche Bahn Aktiengesellschaft",
      "company_seat": "Berlin",
      "details": "22.05.2025 (Bekanntmachungsdatum)\n\nBerlin Amtsgericht Berlin (Charlottenburg) HRB 50000\nEinreichung neuer Dokumente\n\nDeutsche Bahn Aktiengesellschaft\nAktiengesellschaft\nBerlin\n\nAls nicht eingetragen wird veröffentlicht: wurde ein Verschmelzungsvertrag der Gesellschaft vom 20.5.25 mit der Deutsche Bahn Finance GmbH Berlin  (Amtsgericht Charlottenburg, HRB 189333 B) eingereicht"
    },
    {
      "date": "2025-05-22",
      "id": "109905",
      "original_text": "Löschungsankündigung\nSachsen-Anhalt Amtsgericht Stendal VR 51301\nBeratungsgemeinschaft Lohnsteuerhilfeverein e.V. – Klötze",
      "type": "Löschungsankündigung",
      "state": "Sachsen-Anhalt",
      "amtsgericht": "Amtsgericht Stendal",
      "registernummer": "VR 51301",
      "registerart": "VR",
      "company_name": "Beratungsgemeinschaft Lohnsteuerhilfeverein e.V.",
      "company_seat": "Klötze",
      "details": "22.05.2025 (Bekanntmachungsdatum)\n\nSachsen-Anhalt Amtsgericht Stendal VR 51301\nLöschungsankündigung\n\nBeratungsgemeinschaft Lohnsteuerhilfeverein e.V.\neingetragener Verein\nKlötze\n\nDas Registergericht beabsichtigt, nachfolgende Vereine wegen Mitgliederlosigkeit von Amts wegen zu löschen. Die Frist zur Erhebung eines Widerspruchs gegen die beabsichtigte Löschung wird auf einen Monat festgesetzt."
    },
    {
      "date": "2025-05-22",
      "id": "109906",
      "original_text": "Einreichung neuer Dokumente\nBaden-Württemberg Amtsgericht Stuttgart HRB 721335\nStädtische Holding Fellbach GmbH – Fellbach",
      "type": "Einreichung neuer Dokumente",
      "state": "Baden-Württemberg",
      "amtsgericht": "Amtsgericht Stuttgart",
      "registernummer": "HRB 721335",
      "registerart": "HRB",
      "company_name": "Städtische Holding Fellbach GmbH",
      "company_seat": "Fellbach",
      "details": "22.05.2025 (Bekanntmachungsdatum)\n\nBaden-Württemberg Amtsgericht Stuttgart HRB 721335\nEinreichung neuer Dokumente\n\nStädtische Holding Fellbach GmbH\nGesellschaft mit beschränkter Haftung\nFellbach\n\nDie Gesellschaft hat am 21.05.2025 die Liste über die Zusammensetzung des Aufsichtsrats zum Handelsregister eingereicht."
    },
    {
      "date": "2025-05-22",
      "id": "109907",
      "original_text": "Sonstige Registerbekanntmachung\nHamburg Amtsgericht Hamburg HRB 96218\nmultidos AG – Hamburg",
      "type": "Sonstige Registerbekanntmachung",
      "state": "Hamburg",
      "amtsgericht": "Amtsgericht Hamburg",
      "registernummer": "HRB 96218",
      "registerart": "HRB",
      "company_name": "multidos AG",
      "company_seat": "Hamburg",
      "details": "22.05.2025 (Bekanntmachungsdatum)\n\nHamburg Amtsgericht Hamburg HRB 96218\nSonstige Registerbekanntmachung\n\nmultidos AG\nAktiengesellschaft\nHamburg\n\nAls nicht eingetragen wird bekannt gemacht: Liste des Aufsichtsrats wurde eingereicht."
    },
    {
      "date": "2025-05-22",
      "id": "109908",
      "original_text": "Einreichung neuer Dokumente\nBaden-Württemberg Amtsgericht Stuttgart HRB 538\nBürgschaftsbank Baden-Württemberg Gesellschaft mit beschränkter Haftung – Stuttgart",
      "type": "Einreichung neuer Dokumente",
      "state": "Baden-Württemberg",
      "amtsgericht": "Amtsgericht Stuttgart",
      "registernummer": "HRB 538",
      "registerart": "HRB",
      "company_name": "Bürgschaftsbank Baden-Württemberg Gesellschaft mit beschränkter Haftung",
      "company_seat": "Stuttgart",
      "details": "22.05.2025 (Bekanntmachungsdatum)\n\nBaden-Württemberg Amtsgericht Stuttgart HRB 538\nEinreichung neuer Dokumente\n\nBürgschaftsbank Baden-Württemberg Gesellschaft mit beschränkter Haftung\nGesellschaft mit beschränkter Haftung\nStuttgart\n\nDie Gesellschaft hat am 21.05.2025 die Liste über die Zusammensetzung des Aufsichtsrats zum Handelsregister eingereicht."
    },
    {
      "date": "2025-05-22",
      "id": "109909",
      "original_text": "Registerbekanntmachung nach dem Umwandlungsgesetz\nBaden-Württemberg Amtsgericht Stuttgart HRB 787629\nFrontEnd IT GmbH – Böblingen",
      "type": "Registerbekanntmachung nach dem Umwandlungsgesetz",
      "state": "Baden-Württemberg",
      "amtsgericht": "Amtsgericht Stuttgart",
      "registernummer": "HRB 787629",
      "registerart": "HRB",
      "company_name": "FrontEnd IT GmbH",
      "company_seat": "Böblingen",
      "details": "22.05.2025 (Bekanntmachungsdatum)\n\nBaden-Württemberg Amtsgericht Stuttgart HRB 787629\nRegisterbekanntmachung nach dem Umwandlungsgesetz 22.05.2025 (Eintragungsdatum)\n\nFrontEnd IT GmbH\nGesellschaft mit beschränkter Haftung\nBöblingen\n\nDen Gläubigern des an dem Formwechsel beteiligten Rechtsträgers ist, wenn sie binnen sechs Monaten nach dem Tag, an dem die Eintragung des Formwechsels in das Register des Sitzes desjenigen Rechtsträgers, dessen Gläubiger sie sind, nach § 19 Abs. 3 UmwG als bekanntgemacht gilt, ihren Anspruch nach Grund und Höhe schriftlich anmelden, Sicherheit zu leisten, soweit sie nicht Befriedigung verlangen können. Dieses Recht steht den Gläubigern jedoch nur zu, wenn sie glaubhaft machen, dass durch den Formwechsel die Erfüllung ihrer Forderung gefährdet wird."
    },
    {
      "date": "2025-05-22",
      "id": "109910",
      "original_text": "Registerbekanntmachung nach dem Umwandlungsgesetz\nSchleswig-Holstein Amtsgericht Kiel HRA 12641\nGabriele Pavel e.K. – Kiel",
      "type": "Registerbekanntmachung nach dem Umwandlungsgesetz",
      "state": "Schleswig-Holstein",
      "amtsgericht": "Amtsgericht Kiel",
      "registernummer": "HRA 12641",
      "registerart": "HRA",
      "company_name": "Gabriele Pavel e.K.",
      "company_seat": "Kiel",
      "details": "22.05.2025 (Bekanntmachungsdatum)\n\nSchleswig-Holstein Amtsgericht Kiel HRA 12641\nRegisterbekanntmachung nach dem Umwandlungsgesetz 21.05.2025 (Eintragungsdatum)\n\nGabriele Pavel e.K.\nEinzelkaufmann / Einzelkauffrau\nKiel\n\nZu Eintragungsnummer 2 vom 21.05.2025 wird als nicht eingetragen veröffentlicht:  Als nicht eingetragen wird veröffentlicht: Den Gläubigern der an der Verschmelzung beteiligten Rechtsträger ist, wenn sie binnen sechs Monaten nach dem Tag, an dem die Eintragung der Verschmelzung in das Register des Sitzes desjenigen Rechtsträgers, dessen Gläubiger sie sind, nach § 19 Abs. 3 UmwG bekannt gemacht worden ist, ihren Anspruch nach Grund und Höhe schriftlich anmelden, Sicherheit zu leisten, soweit sie nicht Befriedigung verlangen können. Dieses Recht steht den Gläubigern jedoch nur zu, wenn sie glaubhaft machen, dass durch die Verschmelzung die Erfüllung ihrer Forderung gefährdet wird."
    },
    {
      "date": "2025-05-22",
      "id": "109911",
      "original_text": "Einreichung neuer Dokumente\nBaden-Württemberg Amtsgericht Ulm HRB 710002\nGSW Gesellschaft für Siedlungs- und Wohnungsbau Baden-Württemberg mit beschränkter Haftung - Bauträgerunternehmen des VdK - – Sigmaringen",
      "type": "Einreichung neuer Dokumente",
      "state": "Baden-Württemberg",
      "amtsgericht": "Amtsgericht Ulm",
      "registernummer": "HRB 710002",
      "registerart": "HRB",
      "company_name": "GSW Gesellschaft für Siedlungs- und Wohnungsbau Baden-Württemberg mit beschränkter Haftung - Bauträgerunternehmen des VdK -",
      "company_seat": "Sigmaringen",
      "details": "22.05.2025 (Bekanntmachungsdatum)\n\nBaden-Württemberg Amtsgericht Ulm HRB 710002\nEinreichung neuer Dokumente\n\nGSW Gesellschaft für Siedlungs- und Wohnungsbau Baden-Württemberg mit beschränkter Haftung - Bauträgerunternehmen des VdK -\nGesellschaft mit beschränkter Haftung\nSigmaringen\n\nDie Gesellschaft hat am 21.05.2025 die Liste über die Zusammensetzung des Aufsichtsrats zum Handelsregister eingereicht."
    },
    {
      "date": "2025-05-22",
      "id": "109912",
      "original_text": "Löschungsankündigung\nBaden-Württemberg Amtsgericht Stuttgart HRA 731484\nErba - Sirup aus dem Neckartal GmbH & Co. KG – Tübingen",
      "type": "Löschungsankündigung",
      "state": "Baden-Württemberg",
      "amtsgericht": "Amtsgericht Stuttgart",
      "registernummer": "HRA 731484",
      "registerart": "HRA",
      "company_name": "Erba - Sirup aus dem Neckartal GmbH & Co. KG",
      "company_seat": "Tübingen",
      "details": "22.05.2025 (Bekanntmachungsdatum)\n\nBaden-Württemberg Amtsgericht Stuttgart HRA 731484\nLöschungsankündigung\n\nErba - Sirup aus dem Neckartal GmbH & Co. KG\nKommanditgesellschaft\nTübingen\n\nAls nicht eingetragen wird bekanntgemacht:\nDas Gericht beabsichtigt, die Gesellschaft wegen Vermögenslosigkeit im Handelsregister von Amts wegen nach § 394 FamFG zu löschen. Die Frist zur Geltendmachung eines Widerspruchs gegen die beabsichtigte Löschung ist auf zwei Monate ab Veröffentlichung bestimmt."
    },
    {
      "date": "2025-05-22",
      "id": "109913",
      "original_text": "Einreichung neuer Dokumente\nBerlin Amtsgericht Berlin (Charlottenburg) HRB 124422\nDB Bahnbau Gruppe GmbH – Berlin",
      "type": "Einreichung neuer Dokumente",
      "state": "Berlin",
      "amtsgericht": "Amtsgericht Berlin (Charlottenburg)",
      "registernummer": "HRB 124422",
      "registerart": "HRB",
      "company_name": "DB Bahnbau Gruppe GmbH",
      "company_seat": "Berlin",
      "details": "22.05.2025 (Bekanntmachungsdatum)\n\nBerlin Amtsgericht Berlin (Charlottenburg) HRB 124422\nEinreichung neuer Dokumente\n\nDB Bahnbau Gruppe GmbH\nGesellschaft mit beschränkter Haftung\nBerlin\n\nAls nicht eingetragen wird veröffentlicht:Es wurde eine neue Liste der Aufsichtsratsmitglieder eingereicht (§52 GmbHG)."
    },
    {
      "date": "2025-05-22",
      "id": "109914",
      "original_text": "Registerbekanntmachung nach dem Umwandlungsgesetz\nBaden-Württemberg Amtsgericht Stuttgart HRB 766508\nRTW Logistik & Service Verwaltungs-GmbH – Reutlingen",
      "type": "Registerbekanntmachung nach dem Umwandlungsgesetz",
      "state": "Baden-Württemberg",
      "amtsgericht": "Amtsgericht Stuttgart",
      "registernummer": "HRB 766508",
      "registerart": "HRB",
      "company_name": "RTW Logistik & Service Verwaltungs-GmbH",
      "company_seat": "Reutlingen",
      "details": "22.05.2025 (Bekanntmachungsdatum)\n\nBaden-Württemberg Amtsgericht Stuttgart HRB 766508\nRegisterbekanntmachung nach dem Umwandlungsgesetz 22.05.2025 (Eintragungsdatum)\n\nRTW Logistik & Service Verwaltungs-GmbH\nGesellschaft mit beschränkter Haftung\nReutlingen\n\nDen Gläubigern der an der Verschmelzung beteiligten Rechtsträger ist, wenn sie binnen sechs Monaten nach dem Tag, an dem die Eintragung der Verschmelzung in das Register des Sitzes desjenigen Rechtsträgers, dessen Gläubiger sie sind, nach § 19 Abs. 3 UmwG als bekanntgemacht gilt, ihren Anspruch nach Grund und Höhe schriftlich anmelden, Sicherheit zu leisten, soweit sie nicht Befriedigung verlangen können. Dieses Recht steht den Gläubigern jedoch nur zu, wenn sie glaubhaft machen, dass durch die Verschmelzung die Erfüllung ihrer Forderung gefährdet wird."
    },
    {
      "date": "2025-05-22",
      "id": "109915",
      "original_text": "Registerbekanntmachung nach dem Umwandlungsgesetz\nBaden-Württemberg Amtsgericht Ulm HRB 1308\nKGN Verwaltungsgesellschaft mbH – Nellingen",
      "type": "Registerbekanntmachung nach dem Umwandlungsgesetz",
      "state": "Baden-Württemberg",
      "amtsgericht": "Amtsgericht Ulm",
      "registernummer": "HRB 1308",
      "registerart": "HRB",
      "company_name": "KGN Verwaltungsgesellschaft mbH",
      "company_seat": "Nellingen",
      "details": "22.05.2025 (Bekanntmachungsdatum)\n\nBaden-Württemberg Amtsgericht Ulm HRB 1308\nRegisterbekanntmachung nach dem Umwandlungsgesetz 22.05.2025 (Eintragungsdatum)\n\nKGN Verwaltungsgesellschaft mbH\nGesellschaft mit beschränkter Haftung\nNellingen\n\nAls nicht eingetragen wird bekanntgemacht:\nDen Gläubigern der an der Verschmelzung beteiligten Rechtsträger ist, wenn sie binnen sechs Monaten nach dem Tag, an dem die Eintragung der Verschmelzung in das Register des Sitzes desjenigen Rechtsträgers, dessen Gläubiger sie sind, nach § 19 Abs. 3 UmwG als bekanntgemacht gilt, ihren Anspruch nach Grund und Höhe schriftlich anmelden, Sicherheit zu leisten, soweit sie nicht Befriedigung verlangen können. Dieses Recht steht den Gläubigern jedoch nur zu, wenn sie glaubhaft machen, dass durch die Verschmelzung die Erfüllung ihrer Forderung gefährdet wird."
    },
    {
      "date": "2025-05-22",
      "id": "109916",
      "original_text": "Registerbekanntmachung nach dem Umwandlungsgesetz\nBrandenburg Amtsgericht Cottbus HRB 12691\nLEAG GmbH – Cottbus",
      "type": "Registerbekanntmachung nach dem Umwandlungsgesetz",
      "state": "Brandenburg",
      "amtsgericht": "Amtsgericht Cottbus",
      "registernummer": "HRB 12691",
      "registerart": "HRB",
      "company_name": "LEAG GmbH",
      "company_seat": "Cottbus",
      "details": "22.05.2025 (Bekanntmachungsdatum)\n\nBrandenburg Amtsgericht Cottbus HRB 12691\nRegisterbekanntmachung nach dem Umwandlungsgesetz 15.05.2025 (Eintragungsdatum)\n\nLEAG GmbH\nGesellschaft mit beschränkter Haftung\nCottbus\n\nZu Eintragungsnummer 15 vom 15.05.2025 wird als nicht eingetragen veröffentlicht:\nDen Gläubigern der an der Spaltung beteiligten Rechtsträger ist, wenn sie binnen sechs Monaten nach dem Tag, an dem die Eintragung der Spaltung in das Register des Sitzes desjenigen Rechtsträgers, dessen Gläubiger sie sind, als bekannt gemacht gilt, ihren Anspruch nach Grund und Höhe schriftlich anmelden, Sicherheit zu leisten, soweit sie nicht Befriedigung verlangen können. Dieses Recht steht den Gläubigern jedoch nur zu, wenn sie glaubhaft machen, dass durch die Spaltung die Erfüllung ihrer Forderung gefährdet wird"
    },
    {
      "date": "2025-05-22",
      "id": "109917",
      "original_text": "Löschungsankündigung\nHamburg Amtsgericht Hamburg HRB 178215\nHamburg Kinetic UG (haftungsbeschränkt) – Hamburg",
      "type": "Löschungsankündigung",
      "state": "Hamburg",
      "amtsgericht": "Amtsgericht Hamburg",
      "registernummer": "HRB 178215",
      "registerart": "HRB",
      "company_name": "Hamburg Kinetic UG (haftungsbeschränkt)",
      "company_seat": "Hamburg",
      "details": "22.05.2025 (Bekanntmachungsdatum)\n\nHamburg Amtsgericht Hamburg HRB 178215\nLöschungsankündigung\n\nHamburg Kinetic UG (haftungsbeschränkt)\nGesellschaft mit beschränkter Haftung\nHamburg\n\nDas Registergericht beabsichtigt, die im Handelsregister eingetragene Gesellschaft von Amts wegen nach § 394 FamFG zu löschen. Die Frist zur Erhebung eines Widerspruchs gegen die beabsichtigte Löschung wird auf 3 Monate festgesetzt."
    },
    {
      "date": "2025-05-22",
      "id": "109918",
      "original_text": "Löschungsankündigung\nHamburg Amtsgericht Hamburg HRB 183568\nLeverint Service GmbH – Hamburg",
      "type": "Löschungsankündigung",
      "state": "Hamburg",
      "amtsgericht": "Amtsgericht Hamburg",
      "registernummer": "HRB 183568",
      "registerart": "HRB",
      "company_name": "Leverint Service GmbH",
      "company_seat": "Hamburg",
      "details": "22.05.2025 (Bekanntmachungsdatum)\n\nHamburg Amtsgericht Hamburg HRB 183568\nLöschungsankündigung\n\nLeverint Service GmbH\nGesellschaft mit beschränkter Haftung\nHamburg\n\nDas Registergericht beabsichtigt, die im Handelsregister eingetragene Gesellschaft von Amts wegen nach § 394 FamFG zu löschen. Die Frist zur Erhebung eines Widerspruchs gegen die beabsichtigte Löschung wird auf 3 Monate festgesetzt."
    },
    {
      "date": "2025-05-22",
      "id": "109919",
      "original_text": "Löschungsankündigung\nHamburg Amtsgericht Hamburg HRB 119051\nOlivan Lizenz und Consulting GmbH – Hamburg",
      "type": "Löschungsankündigung",
      "state": "Hamburg",
      "amtsgericht": "Amtsgericht Hamburg",
      "registernummer": "HRB 119051",
      "registerart": "HRB",
      "company_name": "Olivan Lizenz und Consulting GmbH",
      "company_seat": "Hamburg",
      "details": "22.05.2025 (Bekanntmachungsdatum)\n\nHamburg Amtsgericht Hamburg HRB 119051\nLöschungsankündigung\n\nOlivan Lizenz und Consulting GmbH\nGesellschaft mit beschränkter Haftung\nHamburg\n\nDas Registergericht beabsichtigt, die im Handelsregister eingetragene Gesellschaft von Amts wegen nach § 394 FamFG zu löschen. Die Frist zur Erhebung eines Widerspruchs gegen die beabsichtigte Löschung wird auf 3 Monate festgesetzt."
    },
    {
      "date": "2025-05-22",
      "id": "109920",
      "original_text": "Löschungsankündigung\nHamburg Amtsgericht Hamburg HRB 111509\nRLD Retail Light Deutschland GmbH – Hamburg",
      "type": "Löschungsankündigung",
      "state": "Hamburg",
      "amtsgericht": "Amtsgericht Hamburg",
      "registernummer": "HRB 111509",
      "registerart": "HRB",
      "company_name": "RLD Retail Light Deutschland GmbH",
      "company_seat": "Hamburg",
      "details": "22.05.2025 (Bekanntmachungsdatum)\n\nHamburg Amtsgericht Hamburg HRB 111509\nLöschungsankündigung\n\nRLD Retail Light Deutschland GmbH\nGesellschaft mit beschränkter Haftung\nHamburg\n\nDas Registergericht beabsichtigt, die im Handelsregister eingetragene Gesellschaft von Amts wegen nach § 394 FamFG zu löschen. Die Frist zur Erhebung eines Widerspruchs gegen die beabsichtigte Löschung wird auf 3 Monate festgesetzt."
    },
    {
      "date": "2025-05-22",
      "id": "109921",
      "original_text": "Löschungsankündigung\nHamburg Amtsgericht Hamburg HRB 72659\nECKA Granulate MicroMet GmbH – Hamburg",
      "type": "Löschungsankündigung",
      "state": "Hamburg",
      "amtsgericht": "Amtsgericht Hamburg",
      "registernummer": "HRB 72659",
      "registerart": "HRB",
      "company_name": "ECKA Granulate MicroMet GmbH",
      "company_seat": "Hamburg",
      "details": "22.05.2025 (Bekanntmachungsdatum)\n\nHamburg Amtsgericht Hamburg HRB 72659\nLöschungsankündigung\n\nECKA Granulate MicroMet GmbH\nGesellschaft mit beschränkter Haftung\nHamburg\n\nDas Registergericht beabsichtigt, die im Handelsregister eingetragene Gesellschaft von Amts wegen nach § 394 FamFG zu löschen. Die Frist zur Erhebung eines Widerspruchs gegen die beabsichtigte Löschung wird auf 3 Monate festgesetzt."
    },
    {
      "date": "2025-05-22",
      "id": "109922",
      "original_text": "Registerbekanntmachung nach dem Umwandlungsgesetz\nHamburg Amtsgericht Hamburg HRB 166115\nMelting Visions GmbH – Hamburg",
      "type": "Registerbekanntmachung nach dem Umwandlungsgesetz",
      "state": "Hamburg",
      "amtsgericht": "Amtsgericht Hamburg",
      "registernummer": "HRB 166115",
      "registerart": "HRB",
      "company_name": "Melting Visions GmbH",
      "company_seat": "Hamburg",
      "details": "22.05.2025 (Bekanntmachungsdatum)\n\nHamburg Amtsgericht Hamburg HRB 166115\nRegisterbekanntmachung nach dem Umwandlungsgesetz 22.05.2025 (Eintragungsdatum)\n\nMelting Visions GmbH\nGesellschaft mit beschränkter Haftung\nHamburg\n\nAls nicht eingetragen wird bekannt gemacht:\nDen Gläubigern der an der Verschmelzung beteiligten Gesellschaften ist, wenn sie binnen sechs Monaten nach dem Tag, an dem die Eintragung der Verschmelzung in das Register des Sitzes desjenigen Rechtsträgers, dessen Gläubiger sie sind, nach § 19 Absatz 3 UmwG als bekannt gemacht gilt, ihren Anspruch nach Grund und Höhe schriftlich anmelden, Sicherheit zu leisten, soweit sie nicht Befriedigung verlangen können. Dieses Recht steht den Gläubigern jedoch nur zu, wenn sie glaubhaft machen, dass durch die Verschmelzung die Erfüllung ihrer Forderung gefährdet wird."
    },
    {
      "date": "2025-05-22",
      "id": "109923",
      "original_text": "Löschungsankündigung\nHamburg Amtsgericht Hamburg HRB 140213\nORPAR GROUP GmbH – Hamburg",
      "type": "Löschungsankündigung",
      "state": "Hamburg",
      "amtsgericht": "Amtsgericht Hamburg",
      "registernummer": "HRB 140213",
      "registerart": "HRB",
      "company_name": "ORPAR GROUP GmbH",
      "company_seat": "Hamburg",
      "details": "22.05.2025 (Bekanntmachungsdatum)\n\nHamburg Amtsgericht Hamburg HRB 140213\nLöschungsankündigung\n\nORPAR GROUP GmbH\nGesellschaft mit beschränkter Haftung\nHamburg\n\nDas Registergericht beabsichtigt, die im Handelsregister eingetragene Gesellschaft von Amts wegen nach § 394 FamFG zu löschen. Die Frist zur Erhebung eines Widerspruchs gegen die beabsichtigte Löschung wird auf 3 Monate festgesetzt."
    },
    {
      "date": "2025-05-22",
      "id": "109924",
      "original_text": "Registerbekanntmachung nach dem Umwandlungsgesetz\nHamburg Amtsgericht Hamburg HRB 166651\nDogs Places UG (haftungsbeschränkt) – Hamburg",
      "type": "Registerbekanntmachung nach dem Umwandlungsgesetz",
      "state": "Hamburg",
      "amtsgericht": "Amtsgericht Hamburg",
      "registernummer": "HRB 166651",
      "registerart": "HRB",
      "company_name": "Dogs Places UG (haftungsbeschränkt)",
      "company_seat": "Hamburg",
      "details": "22.05.2025 (Bekanntmachungsdatum)\n\nHamburg Amtsgericht Hamburg HRB 166651\nRegisterbekanntmachung nach dem Umwandlungsgesetz 22.05.2025 (Eintragungsdatum)\n\nDogs Places UG (haftungsbeschränkt)\nGesellschaft mit beschränkter Haftung\nHamburg\n\nAls nicht eingetragen wird bekannt gemacht:\nDen Gläubigern der an der Verschmelzung beteiligten Gesellschaften ist, wenn sie binnen sechs Monaten nach dem Tag, an dem die Eintragung der Verschmelzung in das Register des Sitzes desjenigen Rechtsträgers, dessen Gläubiger sie sind, nach § 19 Absatz 3 UmwG als bekannt gemacht gilt, ihren Anspruch nach Grund und Höhe schriftlich anmelden, Sicherheit zu leisten, soweit sie nicht Befriedigung verlangen können. Dieses Recht steht den Gläubigern jedoch nur zu, wenn sie glaubhaft machen, dass durch die Verschmelzung die Erfüllung ihrer Forderung gefährdet wird."
    },
    {
      "date": "2025-05-22",
      "id": "109925",
      "original_text": "Löschungsankündigung\nBerlin Amtsgericht Berlin (Charlottenburg) HRB 216981\nBau Handwerker Verbund Rhein Main Immobilien GmbH – Berlin",
      "type": "Löschungsankündigung",
      "state": "Berlin",
      "amtsgericht": "Amtsgericht Berlin (Charlottenburg)",
      "registernummer": "HRB 216981",
      "registerart": "HRB",
      "company_name": "Bau Handwerker Verbund Rhein Main Immobilien GmbH",
      "company_seat": "Berlin",
      "details": "22.05.2025 (Bekanntmachungsdatum)\n\nBerlin Amtsgericht Berlin (Charlottenburg) HRB 216981\nLöschungsankündigung\n\nBau Handwerker Verbund Rhein Main Immobilien GmbH\nGesellschaft mit beschränkter Haftung\nBerlin\n\nBei der nachstehenden Gesellschaft wird das Amtslöschungsverfahren gemäß § 394 FamFG eingeleitet. Widerspruchsfrist 6 Wochen"
    },
    {
      "date": "2025-05-22",
      "id": "109926",
      "original_text": "Löschungsankündigung\nBerlin Amtsgericht Berlin (Charlottenburg) HRB 176983\nSunran GmbH – Berlin",
      "type": "Löschungsankündigung",
      "state": "Berlin",
      "amtsgericht": "Amtsgericht Berlin (Charlottenburg)",
      "registernummer": "HRB 176983",
      "registerart": "HRB",
      "company_name": "Sunran GmbH",
      "company_seat": "Berlin",
      "details": "22.05.2025 (Bekanntmachungsdatum)\n\nBerlin Amtsgericht Berlin (Charlottenburg) HRB 176983\nLöschungsankündigung\n\nSunran GmbH\nGesellschaft mit beschränkter Haftung\nBerlin\n\nBei der nachstehenden Gesellschaft wird das Amtslöschungsverfahren gemäß § 394 FamFG eingeleitet. Widerspruchsfrist 6 Wochen"
    },
    {
      "date": "2025-05-22",
      "id": "109927",
      "original_text": "Löschungsankündigung\nHamburg Amtsgericht Hamburg HRB 141056\nCalvin Holding UG (haftungsbeschränkt) – Hamburg",
      "type": "Löschungsankündigung",
      "state": "Hamburg",
      "amtsgericht": "Amtsgericht Hamburg",
      "registernummer": "HRB 141056",
      "registerart": "HRB",
      "company_name": "Calvin Holding UG (haftungsbeschränkt)",
      "company_seat": "Hamburg",
      "details": "22.05.2025 (Bekanntmachungsdatum)\n\nHamburg Amtsgericht Hamburg HRB 141056\nLöschungsankündigung\n\nCalvin Holding UG (haftungsbeschränkt)\nGesellschaft mit beschränkter Haftung\nHamburg\n\nDas Registergericht beabsichtigt, die im Handelsregister eingetragene Gesellschaft von Amts wegen nach § 394 FamFG zu löschen. Die Frist zur Erhebung eines Widerspruchs gegen die beabsichtigte Löschung wird auf 3 Monate festgesetzt."
    },
    {
      "date": "2025-05-22",
      "id": "109928",
      "original_text": "Löschungsankündigung\nHamburg Amtsgericht Hamburg HRB 154358\nVIOBETTA GmbH – Hamburg",
      "type": "Löschungsankündigung",
      "state": "Hamburg",
      "amtsgericht": "Amtsgericht Hamburg",
      "registernummer": "HRB 154358",
      "registerart": "HRB",
      "company_name": "VIOBETTA GmbH",
      "company_seat": "Hamburg",
      "details": "22.05.2025 (Bekanntmachungsdatum)\n\nHamburg Amtsgericht Hamburg HRB 154358\nLöschungsankündigung\n\nVIOBETTA GmbH\nGesellschaft mit beschränkter Haftung\nHamburg\n\nDas Registergericht beabsichtigt, die im Handelsregister eingetragene Gesellschaft von Amts wegen nach § 394 FamFG zu löschen. Die Frist zur Erhebung eines Widerspruchs gegen die beabsichtigte Löschung wird auf 3 Monate festgesetzt."
    },
    {
      "date": "2025-05-22",
      "id": "109929",
      "original_text": "Registerbekanntmachung nach dem Umwandlungsgesetz\nBerlin Amtsgericht Berlin (Charlottenburg) HRB 275329\nBetreuung Soziale Teilhabe Wohnen (B.S.T.W.) gGmbH – Berlin",
      "type": "Registerbekanntmachung nach dem Umwandlungsgesetz",
      "state": "Berlin",
      "amtsgericht": "Amtsgericht Berlin (Charlottenburg)",
      "registernummer": "HRB 275329",
      "registerart": "HRB",
      "company_name": "Betreuung Soziale Teilhabe Wohnen (B.S.T.W.) gGmbH",
      "company_seat": "Berlin",
      "details": "22.05.2025 (Bekanntmachungsdatum)\n\nBerlin Amtsgericht Berlin (Charlottenburg) HRB 275329\nRegisterbekanntmachung nach dem Umwandlungsgesetz 21.05.2025 (Eintragungsdatum)\n\nBetreuung Soziale Teilhabe Wohnen (B.S.T.W.) gGmbH\nGesellschaft mit beschränkter Haftung\nBerlin\n\nDen Gläubigern ist, wenn sie binnen sechs Monaten nach dem Tag, an dem die Eintragung der Umwandlung als bekannt gemacht gilt, ihren Anspruch nach Grund und Höhe schriftlich anmelden, Sicherheit zu leisten, soweit sie nicht Befriedigung verlangen können. Dieses Recht steht den Gläubigern jedoch nur zu, wenn sie glaubhaft machen, dass durch die Umwandlung die Erfüllung ihrer Forderung gefährdet wird. Das Recht, Sicherheitsleistung zu verlangen, steht Gläubigern nicht zu, die im Falle der Insolvenz ein Recht auf vorzugsweise Befriedigung aus einer Deckungsmasse haben, die nach gesetzlicher Vorschrift zu ihrem Schutz errichtet und staatlich überwacht ist.Zu Eintragungsnummer 1 vom 21.05.2025 wird als nicht eingetragen veröffentlicht:"
    },
    {
      "date": "2025-05-22",
      "id": "109930",
      "original_text": "Einreichung neuer Dokumente\nBaden-Württemberg Amtsgericht Stuttgart HRB 4409\nMBG Mittelständische Beteiligungsgesellschaft Baden-Württemberg Gesellschaft mit beschränkter Haftung – Stuttgart",
      "type": "Einreichung neuer Dokumente",
      "state": "Baden-Württemberg",
      "amtsgericht": "Amtsgericht Stuttgart",
      "registernummer": "HRB 4409",
      "registerart": "HRB",
      "company_name": "MBG Mittelständische Beteiligungsgesellschaft Baden-Württemberg Gesellschaft mit beschränkter Haftung",
      "company_seat": "Stuttgart",
      "details": "22.05.2025 (Bekanntmachungsdatum)\n\nBaden-Württemberg Amtsgericht Stuttgart HRB 4409\nEinreichung neuer Dokumente\n\nMBG Mittelständische Beteiligungsgesellschaft Baden-Württemberg Gesellschaft mit beschränkter Haftung\nGesellschaft mit beschränkter Haftung\nStuttgart\n\nDie Gesellschaft hat am 21.05.2025 die Liste über die Zusammensetzung des Aufsichtsrats zum Handelsregister eingereicht."
    },
    {
      "date": "2025-05-22",
      "id": "109931",
      "original_text": "Sonstige Registerbekanntmachung\nMecklenburg-Vorpommern Amtsgericht Rostock HRB 12857\nFantasia AG – Rostock",
      "type": "Sonstige Registerbekanntmachung",
      "state": "Mecklenburg-Vorpommern",
      "amtsgericht": "Amtsgericht Rostock",
      "registernummer": "HRB 12857",
      "registerart": "HRB",
      "company_name": "Fantasia AG",
      "company_seat": "Rostock",
      "details": "22.05.2025 (Bekanntmachungsdatum)\n\nMecklenburg-Vorpommern Amtsgericht Rostock HRB 12857\nSonstige Registerbekanntmachung\n\nFantasia AG\nAktiengesellschaft\nRostock\n\nEine Liste der Mitglieder des Aufsichtsrats ist zum Handelsregister eingereicht worden."
    },
    {
      "date": "2025-05-22",
      "id": "109932",
      "original_text": "Sonstige Registerbekanntmachung\nSchleswig-Holstein Amtsgericht Kiel HRB 18650\nPhi-Stone AG – Kiel",
      "type": "Sonstige Registerbekanntmachung",
      "state": "Schleswig-Holstein",
      "amtsgericht": "Amtsgericht Kiel",
      "registernummer": "HRB 18650",
      "registerart": "HRB",
      "company_name": "Phi-Stone AG",
      "company_seat": "Kiel",
      "details": "22.05.2025 (Bekanntmachungsdatum)\n\nSchleswig-Holstein Amtsgericht Kiel HRB 18650\nSonstige Registerbekanntmachung 20.05.2025 (Eintragungsdatum)\n\nPhi-Stone AG\nAktiengesellschaft\nKiel\n\nAls nicht eingetragen wird veröffentlicht: Gläubigern, deren Forderungen begründet worden sind, bevor die Eintragung des Beschlusses als nach § 10 des Handelsgesetzbuches bekannt gemacht gilt, ist, wenn sie sich binnen sechs Monaten nach der Bekanntmachung zu diesem Zweck melden, Sicherheit zu leisten, soweit sie nicht Befriedigung verlangen können. Dieses Recht steht den Gläubigern nicht zu, die im Fall des Insolvenzverfahrens ein Recht auf vorzugsweise Befriedigung aus der Deckungsmasse haben, die nach gesetzlicher Vorschrift zu ihrem Schutz errichtet und staatlich überwacht ist."
    },
    {
      "date": "2025-05-22",
      "id": "109933",
      "original_text": "Löschungsankündigung\nHamburg Amtsgericht Hamburg HRB 176531\nSellcom sales GmbH – Hamburg",
      "type": "Löschungsankündigung",
      "state": "Hamburg",
      "amtsgericht": "Amtsgericht Hamburg",
      "registernummer": "HRB 176531",
      "registerart": "HRB",
      "company_name": "Sellcom sales GmbH",
      "company_seat": "Hamburg",
      "details": "22.05.2025 (Bekanntmachungsdatum)\n\nHamburg Amtsgericht Hamburg HRB 176531\nLöschungsankündigung\n\nSellcom sales GmbH\nGesellschaft mit beschränkter Haftung\nHamburg\n\nDas Registergericht beabsichtigt, die im Handelsregister eingetragene Gesellschaft von Amts wegen nach § 394 FamFG zu löschen. Die Frist zur Erhebung eines Widerspruchs gegen die beabsichtigte Löschung wird auf 3 Monate festgesetzt."
    },
    {
      "date": "2025-05-22",
      "id": "109934",
      "original_text": "Löschungsankündigung\nBaden-Württemberg Amtsgericht Ulm HRA 721856\nJens Wiegräfe e.K. Digitale Druck- und Werbetechnik – Bad Waldsee",
      "type": "Löschungsankündigung",
      "state": "Baden-Württemberg",
      "amtsgericht": "Amtsgericht Ulm",
      "registernummer": "HRA 721856",
      "registerart": "HRA",
      "company_name": "Jens Wiegräfe e.K. Digitale Druck- und Werbetechnik",
      "company_seat": "Bad Waldsee",
      "details": "22.05.2025 (Bekanntmachungsdatum)\n\nBaden-Württemberg Amtsgericht Ulm HRA 721856\nLöschungsankündigung\n\nJens Wiegräfe e.K. Digitale Druck- und Werbetechnik\nEinzelkaufmann / Einzelkauffrau\nBad Waldsee\n\nDas Registergericht beabsichtigt, die Firma im Handelsregister von Amts wegen nach § 31 Abs. 2 HGB zu löschen. Die Frist zur Geltendmachung eines Widerspruchs gegen die beabsichtigte Löschung ist auf einen Monat ab Veröffentlichung bestimmt."
    },
    {
      "date": "2025-05-22",
      "id": "109935",
      "original_text": "Registerbekanntmachung nach dem Umwandlungsgesetz\nBaden-Württemberg Amtsgericht Mannheim HRB 570172\nRückert GmbH – Wertheim",
      "type": "Registerbekanntmachung nach dem Umwandlungsgesetz",
      "state": "Baden-Württemberg",
      "amtsgericht": "Amtsgericht Mannheim",
      "registernummer": "HRB 570172",
      "registerart": "HRB",
      "company_name": "Rückert GmbH",
      "company_seat": "Wertheim",
      "details": "22.05.2025 (Bekanntmachungsdatum)\n\nBaden-Württemberg Amtsgericht Mannheim HRB 570172\nRegisterbekanntmachung nach dem Umwandlungsgesetz 22.05.2025 (Eintragungsdatum)\n\nRückert GmbH\nGesellschaft mit beschränkter Haftung\nWertheim\n\nDen Gläubigern der an der Verschmelzung beteiligten Rechtsträger ist, wenn sie binnen sechs Monaten nach dem Tag, an dem die Eintragung der Verschmelzung in das Register des Sitzes desjenigen Rechtsträgers, dessen Gläubiger sie sind, nach § 19 Abs. 3 UmwG als bekanntgemacht gilt, ihren Anspruch nach Grund und Höhe schriftlich anmelden, Sicherheit zu leisten, soweit sie nicht Befriedigung verlangen können. Dieses Recht steht den Gläubigern jedoch nur zu, wenn sie glaubhaft machen, dass durch die Verschmelzung die Erfüllung ihrer Forderung gefährdet wird."
    },
    {
      "date": "2025-05-22",
      "id": "109936",
      "original_text": "Einreichung neuer Dokumente\nBaden-Württemberg Amtsgericht Stuttgart HRB 771782\nHeller Management SE – Nürtingen",
      "type": "Einreichung neuer Dokumente",
      "state": "Baden-Württemberg",
      "amtsgericht": "Amtsgericht Stuttgart",
      "registernummer": "HRB 771782",
      "registerart": "HRB",
      "company_name": "Heller Management SE",
      "company_seat": "Nürtingen",
      "details": "22.05.2025 (Bekanntmachungsdatum)\n\nBaden-Württemberg Amtsgericht Stuttgart HRB 771782\nEinreichung neuer Dokumente\n\nHeller Management SE\nEuropäische Aktiengesellschaft (SE)\nNürtingen\n\nDie Gesellschaft hat am 21.05.2025 die Liste über die Zusammensetzung des Aufsichtsrats zum Handelsregister eingereicht."
    },
    {
      "date": "2025-05-22",
      "id": "109937",
      "original_text": "Registerbekanntmachung nach dem Umwandlungsgesetz\nMecklenburg-Vorpommern Amtsgericht Neubrandenburg HRA 3205\nStelzer Landwirtschaftsbetrieb GmbH & Co. KG – Grambow",
      "type": "Registerbekanntmachung nach dem Umwandlungsgesetz",
      "state": "Mecklenburg-Vorpommern",
      "amtsgericht": "Amtsgericht Neubrandenburg",
      "registernummer": "HRA 3205",
      "registerart": "HRA",
      "company_name": "Stelzer Landwirtschaftsbetrieb GmbH & Co. KG",
      "company_seat": "Grambow",
      "details": "22.05.2025 (Bekanntmachungsdatum)\n\nMecklenburg-Vorpommern Amtsgericht Neubrandenburg HRA 3205\nRegisterbekanntmachung nach dem Umwandlungsgesetz 22.05.2025 (Eintragungsdatum)\n\nStelzer Landwirtschaftsbetrieb GmbH & Co. KG\nKommanditgesellschaft\nGrambow\n\nAls nicht eingetragen wird veröffentlicht: Den Gläubigern der an der Ausgliederung beteiligten Rechtsträger ist, wenn sie binnen sechs Monaten nach dem Tag, an dem die Eintragung der Ausgliederung in das Register des Sitzes desjenigen Rechtsträgers, dessen Gläubiger sie sind, nach § 19 Abs. 3 UmwG als bekannt gemacht gilt, ihren Anspruch nach Grund und Höhe in Textform anmelden,\nSicherheit zu leisten, soweit sie nicht Befriedigung verlangen können. Dieses Recht steht den Gläubigern jedoch nur zu, wenn sie glaubhaft machen, dass durch die Ausgliederung die Erfüllung der Forderung gefährdet wird."
    },
    {
      "date": "2025-05-22",
      "id": "109938",
      "original_text": "Registerbekanntmachung nach dem Umwandlungsgesetz\nMecklenburg-Vorpommern Amtsgericht Neubrandenburg HRA 3191\nHartmut Stelzer Landwirtschaftsbetrieb e. K. – Grambow",
      "type": "Registerbekanntmachung nach dem Umwandlungsgesetz",
      "state": "Mecklenburg-Vorpommern",
      "amtsgericht": "Amtsgericht Neubrandenburg",
      "registernummer": "HRA 3191",
      "registerart": "HRA",
      "company_name": "Hartmut Stelzer Landwirtschaftsbetrieb e. K.",
      "company_seat": "Grambow",
      "details": "22.05.2025 (Bekanntmachungsdatum)\n\nMecklenburg-Vorpommern Amtsgericht Neubrandenburg HRA 3191\nRegisterbekanntmachung nach dem Umwandlungsgesetz 22.05.2025 (Eintragungsdatum)\n\nHartmut Stelzer Landwirtschaftsbetrieb e. K.\nEinzelkaufmann / Einzelkauffrau\nGrambow\n\nAls nicht eingetragen wird veröffentlicht: Den Gläubigern der an der Ausgliederung beteiligten Rechtsträger ist, wenn sie binnen sechs Monaten nach dem Tag, an dem die Eintragung der Ausgliederung in das Register des Sitzes desjenigen Rechtsträgers, dessen Gläubiger sie sind, nach § 19 Abs. 3 UmwG als bekannt gemacht gilt, ihren Anspruch nach Grund und Höhe in Textform anmelden,\nSicherheit zu leisten, soweit sie nicht Befriedigung verlangen können. Dieses Recht steht den Gläubigern jedoch nur zu, wenn sie glaubhaft machen, dass durch die Ausgliederung die Erfüllung der Forderung gefährdet wird."
    },
    {
      "date": "2025-05-22",
      "id": "109939",
      "original_text": "Registerbekanntmachung nach dem Umwandlungsgesetz\nThüringen Amtsgericht Jena HRA 507084\nIntelligence Financial Division GmbH & Co. KG – Bad Langensalza",
      "type": "Registerbekanntmachung nach dem Umwandlungsgesetz",
      "state": "Thüringen",
      "amtsgericht": "Amtsgericht Jena",
      "registernummer": "HRA 507084",
      "registerart": "HRA",
      "company_name": "Intelligence Financial Division GmbH & Co. KG",
      "company_seat": "Bad Langensalza",
      "details": "22.05.2025 (Bekanntmachungsdatum)\n\nThüringen Amtsgericht Jena HRA 507084\nRegisterbekanntmachung nach dem Umwandlungsgesetz 22.05.2025 (Eintragungsdatum)\n\nIntelligence Financial Division GmbH & Co. KG\nKommanditgesellschaft\nBad Langensalza\n\nNicht eingetragen: Den Gläubigern des formwechselnden  Rechtsträgers, ist wenn sie binnen sechs Monaten nach dem Tag, an dem die Eintragung des Formwechsels nach § 201 UmwG als bekanntgemacht gilt, ihren Anspruch nach Grund und Höhe schriftlich anmelden, Sicherheit zu leisten, soweit sie nicht Befriedigung verlangen können. Dieses Recht steht ihnen jedoch nur zu, wenn sie glaubhaft machen, daß durch den Formwechsel die Erfüllung ihrer Forderung gefährdet wird."
    },
    {
      "date": "2025-05-22",
      "id": "109940",
      "original_text": "Registerbekanntmachung nach dem Umwandlungsgesetz\nThüringen Amtsgericht Jena HRB 506394\nIntelligence Financial Division GmbH – Bad Langensalza",
      "type": "Registerbekanntmachung nach dem Umwandlungsgesetz",
      "state": "Thüringen",
      "amtsgericht": "Amtsgericht Jena",
      "registernummer": "HRB 506394",
      "registerart": "HRB",
      "company_name": "Intelligence Financial Division GmbH",
      "company_seat": "Bad Langensalza",
      "details": "22.05.2025 (Bekanntmachungsdatum)\n\nThüringen Amtsgericht Jena HRB 506394\nRegisterbekanntmachung nach dem Umwandlungsgesetz 22.05.2025 (Eintragungsdatum)\n\nIntelligence Financial Division GmbH\nGesellschaft mit beschränkter Haftung\nBad Langensalza\n\nNicht eingetragen: Den Gläubigern des formwechselnden  Rechtsträgers, ist wenn sie binnen sechs Monaten nach dem Tag, an dem die Eintragung des Formwechsels nach § 201 UmwG als bekanntgemacht gilt, ihren Anspruch nach Grund und Höhe schriftlich anmelden, Sicherheit zu leisten, soweit sie nicht Befriedigung verlangen können. Dieses Recht steht ihnen jedoch nur zu, wenn sie glaubhaft machen, daß durch den Formwechsel die Erfüllung ihrer Forderung gefährdet wird."
    },
    {
      "date": "2025-05-22",
      "id": "109941",
      "original_text": "Registerbekanntmachung nach dem Umwandlungsgesetz\nBaden-Württemberg Amtsgericht Stuttgart HRA 742155\nHeuser Verwaltungs GmbH & Co. KG – Heilbronn",
      "type": "Registerbekanntmachung nach dem Umwandlungsgesetz",
      "state": "Baden-Württemberg",
      "amtsgericht": "Amtsgericht Stuttgart",
      "registernummer": "HRA 742155",
      "registerart": "HRA",
      "company_name": "Heuser Verwaltungs GmbH & Co. KG",
      "company_seat": "Heilbronn",
      "details": "22.05.2025 (Bekanntmachungsdatum)\n\nBaden-Württemberg Amtsgericht Stuttgart HRA 742155\nRegisterbekanntmachung nach dem Umwandlungsgesetz 22.05.2025 (Eintragungsdatum)\n\nHeuser Verwaltungs GmbH & Co. KG\nKommanditgesellschaft\nHeilbronn\n\nAls nicht eingetragen wird bekanntgemacht:\nDen Gläubigern der an der Ausgliederung beteiligten Rechtsträger ist, wenn sie binnen sechs Monaten nach dem Tag, an dem die Eintragung der Ausgliederung in das Register des Sitzes desjenigen Rechtsträgers, dessen Gläubiger sie sind, nach § 19 Abs. 3 UmwG als bekanntgemacht gilt, ihren Anspruch nach Grund und Höhe schriftlich anmelden, Sicherheit zu leisten, soweit sie nicht Befriedigung verlangen können. Dieses Recht steht den Gläubigern jedoch nur zu, wenn sie glaubhaft machen, dass durch die Ausgliederung die Erfüllung ihrer Forderung gefährdet wird."
    },
    {
      "date": "2025-05-22",
      "id": "109942",
      "original_text": "Löschungsankündigung\nBrandenburg Amtsgericht Cottbus HRB 14641\nBeta Bau UG (haftungsbeschränkt) – Kolkwitz",
      "type": "Löschungsankündigung",
      "state": "Brandenburg",
      "amtsgericht": "Amtsgericht Cottbus",
      "registernummer": "HRB 14641",
      "registerart": "HRB",
      "company_name": "Beta Bau UG (haftungsbeschränkt)",
      "company_seat": "Kolkwitz",
      "details": "22.05.2025 (Bekanntmachungsdatum)\n\nBrandenburg Amtsgericht Cottbus HRB 14641\nLöschungsankündigung\n\nBeta Bau UG (haftungsbeschränkt)\nGesellschaft mit beschränkter Haftung\nKolkwitz\n\nBei der nachstehenden Gesellschaft wird das Amtslöschungsverfahren gemäß § 394 FamFG eingeleitet."
    },
    {
      "date": "2025-05-22",
      "id": "109943",
      "original_text": "Registerbekanntmachung nach dem Umwandlungsgesetz\nBaden-Württemberg Amtsgericht Stuttgart HRB 788598\nsensified Ecosystem GmbH – Pfullingen",
      "type": "Registerbekanntmachung nach dem Umwandlungsgesetz",
      "state": "Baden-Württemberg",
      "amtsgericht": "Amtsgericht Stuttgart",
      "registernummer": "HRB 788598",
      "registerart": "HRB",
      "company_name": "sensified Ecosystem GmbH",
      "company_seat": "Pfullingen",
      "details": "22.05.2025 (Bekanntmachungsdatum)\n\nBaden-Württemberg Amtsgericht Stuttgart HRB 788598\nRegisterbekanntmachung nach dem Umwandlungsgesetz 22.05.2025 (Eintragungsdatum)\n\nsensified Ecosystem GmbH\nGesellschaft mit beschränkter Haftung\nPfullingen\n\nAls nicht eingetragen wird bekanntgemacht:\nDen Gläubigern der an der Verschmelzung beteiligten Rechtsträger ist, wenn sie binnen sechs Monaten nach dem Tag, an dem die Eintragung der Verschmelzung in das Register des Sitzes desjenigen Rechtsträgers, dessen Gläubiger sie sind, nach § 19 Abs. 3 UmwG als bekanntgemacht gilt, ihren Anspruch nach Grund und Höhe schriftlich anmelden, Sicherheit zu leisten, soweit sie nicht Befriedigung verlangen können. Dieses Recht steht den Gläubigern jedoch nur zu, wenn sie glaubhaft machen, dass durch die Verschmelzung die Erfüllung ihrer Forderung gefährdet wird."
    },
    {
      "date": "2025-05-22",
      "id": "109944",
      "original_text": "Registerbekanntmachung nach dem Umwandlungsgesetz\nHamburg Amtsgericht Hamburg HRB 115687\nPRIMETAS Verwaltungen GmbH – Hamburg",
      "type": "Registerbekanntmachung nach dem Umwandlungsgesetz",
      "state": "Hamburg",
      "amtsgericht": "Amtsgericht Hamburg",
      "registernummer": "HRB 115687",
      "registerart": "HRB",
      "company_name": "PRIMETAS Verwaltungen GmbH",
      "company_seat": "Hamburg",
      "details": "22.05.2025 (Bekanntmachungsdatum)\n\nHamburg Amtsgericht Hamburg HRB 115687\nRegisterbekanntmachung nach dem Umwandlungsgesetz 22.05.2025 (Eintragungsdatum)\n\nPRIMETAS Verwaltungen GmbH\nGesellschaft mit beschränkter Haftung\nHamburg\n\nAls nicht eingetragen wird bekannt gemacht:\nDen Gläubigern der an der Verschmelzung beteiligten Gesellschaften ist, wenn sie binnen sechs Monaten nach dem Tag, an dem die Eintragung der Verschmelzung in das Register des Sitzes desjenigen Rechtsträgers, dessen Gläubiger sie sind, nach § 19 Absatz 3 UmwG als bekannt gemacht gilt, ihren Anspruch nach Grund und Höhe schriftlich anmelden, Sicherheit zu leisten, soweit sie nicht Befriedigung verlangen können. Dieses Recht steht den Gläubigern jedoch nur zu, wenn sie glaubhaft machen, dass durch die Verschmelzung die Erfüllung ihrer Forderung gefährdet wird."
    },
    {
      "date": "2025-05-22",
      "id": "109945",
      "original_text": "Registerbekanntmachung nach dem Umwandlungsgesetz\nHamburg Amtsgericht Hamburg HRB 110369\nPRIME site development GmbH – Hamburg",
      "type": "Registerbekanntmachung nach dem Umwandlungsgesetz",
      "state": "Hamburg",
      "amtsgericht": "Amtsgericht Hamburg",
      "registernummer": "HRB 110369",
      "registerart": "HRB",
      "company_name": "PRIME site development GmbH",
      "company_seat": "Hamburg",
      "details": "22.05.2025 (Bekanntmachungsdatum)\n\nHamburg Amtsgericht Hamburg HRB 110369\nRegisterbekanntmachung nach dem Umwandlungsgesetz 22.05.2025 (Eintragungsdatum)\n\nPRIME site development GmbH\nGesellschaft mit beschränkter Haftung\nHamburg\n\nAls nicht eingetragen wird bekannt gemacht:\nDen Gläubigern der an der Verschmelzung beteiligten Gesellschaften ist, wenn sie binnen sechs Monaten nach dem Tag, an dem die Eintragung der Verschmelzung in das Register des Sitzes desjenigen Rechtsträgers, dessen Gläubiger sie sind, nach § 19 Absatz 3 UmwG als bekannt gemacht gilt, ihren Anspruch nach Grund und Höhe schriftlich anmelden, Sicherheit zu leisten, soweit sie nicht Befriedigung verlangen können. Dieses Recht steht den Gläubigern jedoch nur zu, wenn sie glaubhaft machen, dass durch die Verschmelzung die Erfüllung ihrer Forderung gefährdet wird."
    },
    {
      "date": "2025-05-22",
      "id": "109946",
      "original_text": "Registerbekanntmachung nach dem Umwandlungsgesetz\nBaden-Württemberg Amtsgericht Stuttgart HRB 780524\nRML 515 Grundstücksgesellschaft mbH – Remshalden",
      "type": "Registerbekanntmachung nach dem Umwandlungsgesetz",
      "state": "Baden-Württemberg",
      "amtsgericht": "Amtsgericht Stuttgart",
      "registernummer": "HRB 780524",
      "registerart": "HRB",
      "company_name": "RML 515 Grundstücksgesellschaft mbH",
      "company_seat": "Remshalden",
      "details": "22.05.2025 (Bekanntmachungsdatum)\n\nBaden-Württemberg Amtsgericht Stuttgart HRB 780524\nRegisterbekanntmachung nach dem Umwandlungsgesetz 22.05.2025 (Eintragungsdatum)\n\nRML 515 Grundstücksgesellschaft mbH\nGesellschaft mit beschränkter Haftung\nRemshalden\n\nAls nicht eingetragen wird bekanntgemacht:\nDen Gläubigern der an der Verschmelzung beteiligten Rechtsträger ist, wenn sie binnen sechs Monaten nach dem Tag, an dem die Eintragung der Verschmelzung in das Register des Sitzes desjenigen Rechtsträgers, dessen Gläubiger sie sind, nach § 19 Abs. 3 UmwG als bekanntgemacht gilt, ihren Anspruch nach Grund und Höhe schriftlich anmelden, Sicherheit zu leisten, soweit sie nicht Befriedigung verlangen können. Dieses Recht steht den Gläubigern jedoch nur zu, wenn sie glaubhaft machen, dass durch die Verschmelzung die Erfüllung ihrer Forderung gefährdet wird."
    },
    {
      "date": "2025-05-22",
      "id": "109947",
      "original_text": "Registerbekanntmachung nach dem Umwandlungsgesetz\nBerlin Amtsgericht Berlin (Charlottenburg) HRB 270718\nRA Vermögensverwaltung GmbH – Berlin",
      "type": "Registerbekanntmachung nach dem Umwandlungsgesetz",
      "state": "Berlin",
      "amtsgericht": "Amtsgericht Berlin (Charlottenburg)",
      "registernummer": "HRB 270718",
      "registerart": "HRB",
      "company_name": "RA Vermögensverwaltung GmbH",
      "company_seat": "Berlin",
      "details": "22.05.2025 (Bekanntmachungsdatum)\n\nBerlin Amtsgericht Berlin (Charlottenburg) HRB 270718\nRegisterbekanntmachung nach dem Umwandlungsgesetz\n\nRA Vermögensverwaltung GmbH\nGesellschaft mit beschränkter Haftung\nBerlin\n\nAls nicht eingetragen wird veröffentlicht: Gläubigern, deren Forderungen begründet worden sind, bevor die Eintragung des Beschlusses als nach § 10 des Handelsgesetzbuches bekannt gemacht gilt, ist, wenn sie sich binnen sechs Monaten nach der Bekanntmachung zu diesem Zweck melden, Sicherheit zu leisten, soweit sie nicht Befriedigung verlangen können. Dieses Recht steht den Gläubigern nicht zu, die im Fall des Insolvenzverfahrens ein Recht auf vorzugsweise Befriedigung aus der Deckungsmasse haben, die nach gesetzlicher Vorschrift zu ihrem Schutz errichtet und staatlich überwacht ist.\n\n1. Die Gesellschaft hat einen Verschmelzungsplan-Entwurf betreffend die Verschmelzung der „AQUAMARININVEST“ EOOD mit Sitz in Sofia/Bulgarien als übertragende Gesellschaft auf die Gesellschaft, die RA Vermögensverwaltung GmbH mit Sitz in Berlin/Deutschland als übernehmende Gesellschaft, beim Handelsregister eingereicht worden ist,\n\n2. Die übertragende Gesellschaft mit der Firma „AQUAMARININVEST“ EOOD und mit Sitz in Sofia/Bulgarien ist eine Gesellschaft mit beschränkter Haftung nach bulgarischem Recht. Die übernehmende Gesellschaft mit der Firma RA Vermögensverwaltung GmbH und mit Sitz in Berlin/Deutschland ist eine Gesellschaft mit beschränkter Haftung nach deutschem Recht.\n\n3. Die „AQUAMARININVEST“ EOOD ist eingetragen beim Justizministerium Eintragungsagentur in Sofia / Bulgarien zu EIK 131261768. Die RA Vermögensverwaltung GmbH ist eingetragen im Handelsregister des Amtsgerichts Charlottenburg zu HRB 270718 B.\n\n4. Die folgenden Personen werden darauf hingewiesen, dass sie der jeweiligen Gesellschaft spätestens fünf Arbeitstage vor dem Tag der Gesellschafterversammlung, die über die Zustimmung zur Verschmelzung beschließen soll, Bemerkungen zum Verschmelzungsplan übermitteln können:\n\na) die Anteilsinhaber, d.h. Renate Andreewa, geborene Mohrahrend, Berlin, jeweils als Alleingesellschafterin der übertragenden und der übernehmenden Gesellschaft, und die Gläubiger der an der grenzüberschreitenden Verschmelzung beteiligten Gesellschaften sowie\n\nb) die zuständigen Betriebsräte der an der grenzüberschreitenden Verschmelzung beteiligten Gesellschaften oder, soweit es keinen Betriebsrat gibt, an die Arbeitnehmer der an der grenzüberschreitenden Verschmelzung beteiligten Gesellschaften.\n\nGläubiger der Gesellschaften sollen ihre behaupteten Ansprüche / die Ausübung ihrer Rechte bei der Geschäftsführung am Sitz der betroffenen Gesellschaft geltend machen. Vollständige Auskünfte über die Modalitäten der Ausübung solcher Rechte können bei den von der Verschmelzung betroffenen Gesellschaften unter folgenden Anschriften kostenlos eingeholt werden:\n\n- „AQUAMARININVEST“ EOOD: Sofia 1517, Stadtteil Podujane, Blvd. „Botevgradsko Chaussee 247\n- RA Vermögensverwaltung GmbH: c/o REALIUS GmbH, Kurfürstendamm 64, 10707 Berlin."
    },
    {
      "date": "2025-05-22",
      "id": "109948",
      "original_text": "Löschungsankündigung\nBaden-Württemberg Amtsgericht Mannheim HRB 728202\nDienstleistungen \"INA\" UG (haftungsbeschränkt) – Karlsruhe",
      "type": "Löschungsankündigung",
      "state": "Baden-Württemberg",
      "amtsgericht": "Amtsgericht Mannheim",
      "registernummer": "HRB 728202",
      "registerart": "HRB",
      "company_name": "Dienstleistungen \"INA\" UG (haftungsbeschränkt)",
      "company_seat": "Karlsruhe",
      "details": "22.05.2025 (Bekanntmachungsdatum)\n\nBaden-Württemberg Amtsgericht Mannheim HRB 728202\nLöschungsankündigung\n\nDienstleistungen \"INA\" UG (haftungsbeschränkt)\nGesellschaft mit beschränkter Haftung\nKarlsruhe\n\nDas Gericht beabsichtigt, die Gesellschaft wegen Vermögenslosigkeit im Handelsregister von Amts wegen nach § 394 FamFG zu löschen. Die Frist zur Geltendmachung eines Widerspruchs gegen die beabsichtigte Löschung ist auf einen Monat ab Veröffentlichung bestimmt."
    },
    {
      "date": "2025-05-22",
      "id": "109949",
      "original_text": "Registerbekanntmachung nach dem Umwandlungsgesetz\nBerlin Amtsgericht Berlin (Charlottenburg) HRB 199673\nBSMV Liegenschaften GmbH – Berlin",
      "type": "Registerbekanntmachung nach dem Umwandlungsgesetz",
      "state": "Berlin",
      "amtsgericht": "Amtsgericht Berlin (Charlottenburg)",
      "registernummer": "HRB 199673",
      "registerart": "HRB",
      "company_name": "BSMV Liegenschaften GmbH",
      "company_seat": "Berlin",
      "details": "22.05.2025 (Bekanntmachungsdatum)\n\nBerlin Amtsgericht Berlin (Charlottenburg) HRB 199673\nRegisterbekanntmachung nach dem Umwandlungsgesetz 22.05.2025 (Eintragungsdatum)\n\nBSMV Liegenschaften GmbH\nGesellschaft mit beschränkter Haftung\nBerlin\n\nZu Eintragungsnummer 11 vom 22.05.2025 wird als nicht eingetragen veröffentlicht: Den Gläubigern der an der Verschmelzung beteiligten Rechtsträger ist, wenn sie binnen sechs Monaten nach dem Tag, an dem die Eintragung der Verschmelzung in das Register des Sitzes desjenigen Rechtsträgers, dessen Gläubiger sie sind, als bekannt gemacht gilt, ihren Anspruch nach Grund und Höhe schriftlich anmelden, Sicherheit zu leisten, soweit sie nicht Befriedigung verlangen können. Dieses Recht steht den Gläubigern jedoch nur zu, wenn sie glaubhaft machen, dass durch die Verschmelzung die Erfüllung ihrer Forderung gefährdet wird. Das Recht, Sicherheitsleistung zu verlangen, steht Gläubigern nicht zu, die im Falle der Insolvenz ein Recht auf vorzugsweise Befriedigung aus einer Deckungsmasse haben, die nach gesetzlicher Vorschrift zu ihrem Schutz errichtet und staatlich überwacht ist."
    },
    {
      "date": "2025-05-22",
      "id": "109950",
      "original_text": "Registerbekanntmachung nach dem Umwandlungsgesetz\nSchleswig-Holstein Amtsgericht Lübeck HRB 23875\nNur Hier GmbH – Mölln",
      "type": "Registerbekanntmachung nach dem Umwandlungsgesetz",
      "state": "Schleswig-Holstein",
      "amtsgericht": "Amtsgericht Lübeck",
      "registernummer": "HRB 23875",
      "registerart": "HRB",
      "company_name": "Nur Hier GmbH",
      "company_seat": "Mölln",
      "details": "22.05.2025 (Bekanntmachungsdatum)\n\nSchleswig-Holstein Amtsgericht Lübeck HRB 23875\nRegisterbekanntmachung nach dem Umwandlungsgesetz 20.05.2025 (Eintragungsdatum)\n\nNur Hier GmbH\nGesellschaft mit beschränkter Haftung\nMölln\n\nZu Eintragungsnummer 5 vom 20.05.2025 wird als nicht eingetragen veröffentlicht: Den Gläubigern der an der Verschmelzung beteiligten Rechtsträger ist, wenn sie binnen sechs Monaten nach dem Tag, an dem die Eintragung der Verschmelzung in das Register des Sitzes desjenigen Rechtsträgers, dessen Gläubiger sie sind, als bekannt gemacht gilt, ihren Anspruch nach Grund und Höhe schriftlich anmelden, Sicherheit zu leisten, soweit sie nicht Befriedigung verlangen können. Dieses Recht steht den Gläubigern jedoch nur zu, wenn sie glaubhaft machen, dass durch die Verschmelzung die Erfüllung ihrer Forderung gefährdet wird."
    },
    {
      "date": "2025-05-22",
      "id": "109951",
      "original_text": "Registerbekanntmachung nach dem Umwandlungsgesetz\nBaden-Württemberg Amtsgericht Stuttgart HRB 732929\nCMS Gutzan GmbH – Weil der Stadt",
      "type": "Registerbekanntmachung nach dem Umwandlungsgesetz",
      "state": "Baden-Württemberg",
      "amtsgericht": "Amtsgericht Stuttgart",
      "registernummer": "HRB 732929",
      "registerart": "HRB",
      "company_name": "CMS Gutzan GmbH",
      "company_seat": "Weil der Stadt",
      "details": "22.05.2025 (Bekanntmachungsdatum)\n\nBaden-Württemberg Amtsgericht Stuttgart HRB 732929\nRegisterbekanntmachung nach dem Umwandlungsgesetz 22.05.2025 (Eintragungsdatum)\n\nCMS Gutzan GmbH\nGesellschaft mit beschränkter Haftung\nWeil der Stadt\n\nDen Gläubigern der an der Verschmelzung beteiligten Rechtsträger ist, wenn sie binnen sechs Monaten nach dem Tag, an dem die Eintragung der Verschmelzung in das Register des Sitzes desjenigen Rechtsträgers, dessen Gläubiger sie sind, nach § 19 Abs. 3 UmwG als bekanntgemacht gilt, ihren Anspruch nach Grund und Höhe schriftlich anmelden, Sicherheit zu leisten, soweit sie nicht Befriedigung verlangen können. Dieses Recht steht den Gläubigern jedoch nur zu, wenn sie glaubhaft machen, dass durch die Verschmelzung die Erfüllung ihrer Forderung gefährdet wird."
    },
    {
      "date": "2025-05-22",
      "id": "109952",
      "original_text": "Registerbekanntmachung nach dem Umwandlungsgesetz\nBerlin Amtsgericht Berlin (Charlottenburg) HRB 226051\nAS72a Liegenschaften GmbH – Berlin",
      "type": "Registerbekanntmachung nach dem Umwandlungsgesetz",
      "state": "Berlin",
      "amtsgericht": "Amtsgericht Berlin (Charlottenburg)",
      "registernummer": "HRB 226051",
      "registerart": "HRB",
      "company_name": "AS72a Liegenschaften GmbH",
      "company_seat": "Berlin",
      "details": "22.05.2025 (Bekanntmachungsdatum)\n\nBerlin Amtsgericht Berlin (Charlottenburg) HRB 226051\nRegisterbekanntmachung nach dem Umwandlungsgesetz 22.05.2025 (Eintragungsdatum)\n\nAS72a Liegenschaften GmbH\nGesellschaft mit beschränkter Haftung\nBerlin\n\nZu Eintragungsnummer 3 vom 22.05.2025 wird als nicht eingetragen veröffentlicht: Den Gläubigern der an der Verschmelzung beteiligten Rechtsträger ist, wenn sie binnen sechs Monaten nach dem Tag, an dem die Eintragung der Verschmelzung in das Register des Sitzes desjenigen Rechtsträgers, dessen Gläubiger sie sind, als bekannt gemacht gilt, ihren Anspruch nach Grund und Höhe schriftlich anmelden, Sicherheit zu leisten, soweit sie nicht Befriedigung verlangen können. Dieses Recht steht den Gläubigern jedoch nur zu, wenn sie glaubhaft machen, dass durch die Verschmelzung die Erfüllung ihrer Forderung gefährdet wird. Das Recht, Sicherheitsleistung zu verlangen, steht Gläubigern nicht zu, die im Falle der Insolvenz ein Recht auf vorzugsweise Befriedigung aus einer Deckungsmasse haben, die nach gesetzlicher Vorschrift zu ihrem Schutz errichtet und staatlich überwacht ist."
    },
    {
      "date": "2025-05-22",
      "id": "109953",
      "original_text": "Einreichung neuer Dokumente\nHamburg Amtsgericht Hamburg HRB 95967\nHermes Fulfilment GmbH – Hamburg",
      "type": "Einreichung neuer Dokumente",
      "state": "Hamburg",
      "amtsgericht": "Amtsgericht Hamburg",
      "registernummer": "HRB 95967",
      "registerart": "HRB",
      "company_name": "Hermes Fulfilment GmbH",
      "company_seat": "Hamburg",
      "details": "22.05.2025 (Bekanntmachungsdatum)\n\nHamburg Amtsgericht Hamburg HRB 95967\nEinreichung neuer Dokumente\n\nHermes Fulfilment GmbH\nGesellschaft mit beschränkter Haftung\nHamburg\n\nAls nicht eingetragen wird bekannt gemacht: Liste des Aufsichtsrats wurde eingereicht."
    },
    {
      "date": "2025-05-22",
      "id": "109954",
      "original_text": "Einreichung neuer Dokumente\nBaden-Württemberg Amtsgericht Freiburg HRB 705638\nOSYPKA AG – Rheinfelden Baden",
      "type": "Einreichung neuer Dokumente",
      "state": "Baden-Württemberg",
      "amtsgericht": "Amtsgericht Freiburg",
      "registernummer": "HRB 705638",
      "registerart": "HRB",
      "company_name": "OSYPKA AG",
      "company_seat": "Rheinfelden Baden",
      "details": "22.05.2025 (Bekanntmachungsdatum)\n\nBaden-Württemberg Amtsgericht Freiburg HRB 705638\nEinreichung neuer Dokumente 22.05.2025 (Eintragungsdatum)\n\nOSYPKA AG\nAktiengesellschaft\nRheinfelden Baden\n\nDie Gesellschaft hat am 21.05.2025 die Liste über die Zusammensetzung des Aufsichtsrats zum Handelsregister eingereicht."
    },
    {
      "date": "2025-05-22",
      "id": "109955",
      "original_text": "Löschungsankündigung\nBaden-Württemberg Amtsgericht Mannheim HRB 737967\nÖZEL Bau GmbH – Wiesloch",
      "type": "Löschungsankündigung",
      "state": "Baden-Württemberg",
      "amtsgericht": "Amtsgericht Mannheim",
      "registernummer": "HRB 737967",
      "registerart": "HRB",
      "company_name": "ÖZEL Bau GmbH",
      "company_seat": "Wiesloch",
      "details": "22.05.2025 (Bekanntmachungsdatum)\n\nBaden-Württemberg Amtsgericht Mannheim HRB 737967\nLöschungsankündigung\n\nÖZEL Bau GmbH\nGesellschaft mit beschränkter Haftung\nWiesloch\n\nDas Gericht beabsichtigt, die Gesellschaft wegen Vermögenslosigkeit im Handelsregister von Amts wegen nach § 394 FamFG zu löschen. Die Frist zur Geltendmachung eines Widerspruchs gegen die beabsichtigte Löschung ist auf einen Monat ab Veröffentlichung bestimmt."
    },
    {
      "date": "2025-05-22",
      "id": "109956",
      "original_text": "Registerbekanntmachung nach dem Umwandlungsgesetz\nBaden-Württemberg Amtsgericht Mannheim HRB 500882\nHans Rivoir Gesellschaft mit beschränkter Haftung – Pforzheim",
      "type": "Registerbekanntmachung nach dem Umwandlungsgesetz",
      "state": "Baden-Württemberg",
      "amtsgericht": "Amtsgericht Mannheim",
      "registernummer": "HRB 500882",
      "registerart": "HRB",
      "company_name": "Hans Rivoir Gesellschaft mit beschränkter Haftung",
      "company_seat": "Pforzheim",
      "details": "22.05.2025 (Bekanntmachungsdatum)\n\nBaden-Württemberg Amtsgericht Mannheim HRB 500882\nRegisterbekanntmachung nach dem Umwandlungsgesetz 22.05.2025 (Eintragungsdatum)\n\nHans Rivoir Gesellschaft mit beschränkter Haftung\nGesellschaft mit beschränkter Haftung\nPforzheim\n\nDen Gläubigern der an der Verschmelzung beteiligten Rechtsträger ist, wenn sie binnen sechs Monaten nach dem Tag, an dem die Eintragung der Verschmelzung in das Register des Sitzes desjenigen Rechtsträgers, dessen Gläubiger sie sind, nach § 19 Abs. 3 UmwG als bekanntgemacht gilt, ihren Anspruch nach Grund und Höhe schriftlich anmelden, Sicherheit zu leisten, soweit sie nicht Befriedigung verlangen können. Dieses Recht steht den Gläubigern jedoch nur zu, wenn sie glaubhaft machen, dass durch die Verschmelzung die Erfüllung ihrer Forderung gefährdet wird."
    },
    {
      "date": "2025-05-22",
      "id": "109957",
      "original_text": "Registerbekanntmachung nach dem Umwandlungsgesetz\nSchleswig-Holstein Amtsgericht Pinneberg HRB 14480\n1. B&R Verwaltungs GmbH – Prisdorf",
      "type": "Registerbekanntmachung nach dem Umwandlungsgesetz",
      "state": "Schleswig-Holstein",
      "amtsgericht": "Amtsgericht Pinneberg",
      "registernummer": "HRB 14480",
      "registerart": "HRB",
      "company_name": "1. B&R Verwaltungs GmbH",
      "company_seat": "Prisdorf",
      "details": "22.05.2025 (Bekanntmachungsdatum)\n\nSchleswig-Holstein Amtsgericht Pinneberg HRB 14480\nRegisterbekanntmachung nach dem Umwandlungsgesetz 22.05.2025 (Eintragungsdatum)\n\n1. B&R Verwaltungs GmbH\nGesellschaft mit beschränkter Haftung\nPrisdorf\n\nZu Eintragungsnummer 3 vom 22.05.2025 wird als nicht eingetragen veröffentlicht:  Als nicht eingetragen wird veröffentlicht: Den Gläubigern der an der Verschmelzung beteiligten Rechtsträger ist, wenn sie binnen sechs Monaten nach dem Tag, an dem die Eintragung der Verschmelzung in das Register des Sitzes desjenigen Rechtsträgers, dessen Gläubiger sie sind, als bekannt gemacht gilt, ihren Anspruch nach Grund und Höhe schriftlich anmelden, Sicherheit zu leisten, soweit sie nicht Befriedigung verlangen können. Dieses Recht steht den Gläubigern jedoch nur zu, wenn sie glaubhaft machen, dass durch die Verschmelzung die Erfüllung ihrer Forderung gefährdet wird. Das Recht, Sicherheitsleistung zu verlangen, steht Gläubigern nicht zu, die im Falle der Insolvenz ein Recht auf vorzugsweise Befriedigung aus einer Deckungsmasse haben, die nach gesetzlicher Vorschrift zu ihrem Schutz errichtet und staatlich überwacht ist."
    },
    {
      "date": "2025-05-22",
      "id": "109958",
      "original_text": "Löschungsankündigung\nBaden-Württemberg Amtsgericht Mannheim HRB 721372\nZeus Gaststättenbetrieb Karlsruhe UG (haftungsbeschränkt) – Karlsruhe",
      "type": "Löschungsankündigung",
      "state": "Baden-Württemberg",
      "amtsgericht": "Amtsgericht Mannheim",
      "registernummer": "HRB 721372",
      "registerart": "HRB",
      "company_name": "Zeus Gaststättenbetrieb Karlsruhe UG (haftungsbeschränkt)",
      "company_seat": "Karlsruhe",
      "details": "22.05.2025 (Bekanntmachungsdatum)\n\nBaden-Württemberg Amtsgericht Mannheim HRB 721372\nLöschungsankündigung\n\nZeus Gaststättenbetrieb Karlsruhe UG (haftungsbeschränkt)\nGesellschaft mit beschränkter Haftung\nKarlsruhe\n\nDas Gericht beabsichtigt, die Gesellschaft wegen Vermögenslosigkeit im Handelsregister von Amts wegen nach § 394 FamFG zu löschen. Die Frist zur Geltendmachung eines Widerspruchs gegen die beabsichtigte Löschung ist auf einen Monat ab Veröffentlichung bestimmt."
    },
    {
      "date": "2025-05-22",
      "id": "109959",
      "original_text": "Einreichung neuer Dokumente\nBaden-Württemberg Amtsgericht Mannheim HRB 751867\nEnergie Kieselbronn GmbH – Kieselbronn",
      "type": "Einreichung neuer Dokumente",
      "state": "Baden-Württemberg",
      "amtsgericht": "Amtsgericht Mannheim",
      "registernummer": "HRB 751867",
      "registerart": "HRB",
      "company_name": "Energie Kieselbronn GmbH",
      "company_seat": "Kieselbronn",
      "details": "22.05.2025 (Bekanntmachungsdatum)\n\nBaden-Württemberg Amtsgericht Mannheim HRB 751867\nEinreichung neuer Dokumente\n\nEnergie Kieselbronn GmbH\nGesellschaft mit beschränkter Haftung\nKieselbronn\n\nDie Gesellschaft hat am 22.05.2025 die Liste über die Zusammensetzung des Aufsichtsrats zum Handelsregister eingereicht."
    },
    {
      "date": "2025-05-22",
      "id": "109960",
      "original_text": "Registerbekanntmachung nach dem Umwandlungsgesetz\nBaden-Württemberg Amtsgericht Stuttgart HRB 350542\nReutlinger Wochenblatt Gesellschaft mit beschränkter Haftung – Reutlingen",
      "type": "Registerbekanntmachung nach dem Umwandlungsgesetz",
      "state": "Baden-Württemberg",
      "amtsgericht": "Amtsgericht Stuttgart",
      "registernummer": "HRB 350542",
      "registerart": "HRB",
      "company_name": "Reutlinger Wochenblatt Gesellschaft mit beschränkter Haftung",
      "company_seat": "Reutlingen",
      "details": "22.05.2025 (Bekanntmachungsdatum)\n\nBaden-Württemberg Amtsgericht Stuttgart HRB 350542\nRegisterbekanntmachung nach dem Umwandlungsgesetz 22.05.2025 (Eintragungsdatum)\n\nReutlinger Wochenblatt Gesellschaft mit beschränkter Haftung\nGesellschaft mit beschränkter Haftung\nReutlingen\n\nAls nicht eingetragen wird bekanntgemacht: Den Gläubigern der an der Verschmelzung beteiligten Rechtsträger ist, wenn sie binnen sechs Monaten nach dem Tag, an dem die Eintragung der Verschmelzung in das Register des Sitzes desjenigen Rechtsträgers, dessen Gläubiger sie sind, nach § 19 Abs. 3 UmwG als bekanntgemacht gilt, ihren Anspruch nach Grund und Höhe schriftlich anmelden, Sicherheit zu leisten, soweit sie nicht Befriedigung verlangen können. Dieses Recht steht den Gläubigern jedoch nur zu, wenn sie glaubhaft machen, dass durch die Verschmelzung die Erfüllung ihrer Forderung gefährdet wird."
    },
    {
      "date": "2025-05-22",
      "id": "109961",
      "original_text": "Registerbekanntmachung nach dem Umwandlungsgesetz\nBaden-Württemberg Amtsgericht Stuttgart HRB 780451\nZBI Zimmer Beteiligungs- und Investmentgesellschaft mbH – Remshalden",
      "type": "Registerbekanntmachung nach dem Umwandlungsgesetz",
      "state": "Baden-Württemberg",
      "amtsgericht": "Amtsgericht Stuttgart",
      "registernummer": "HRB 780451",
      "registerart": "HRB",
      "company_name": "ZBI Zimmer Beteiligungs- und Investmentgesellschaft mbH",
      "company_seat": "Remshalden",
      "details": "22.05.2025 (Bekanntmachungsdatum)\n\nBaden-Württemberg Amtsgericht Stuttgart HRB 780451\nRegisterbekanntmachung nach dem Umwandlungsgesetz 22.05.2025 (Eintragungsdatum)\n\nZBI Zimmer Beteiligungs- und Investmentgesellschaft mbH\nGesellschaft mit beschränkter Haftung\nRemshalden\n\nDen Gläubigern der an der Verschmelzung beteiligten Rechtsträger ist, wenn sie binnen sechs Monaten nach dem Tag, an dem die Eintragung der Verschmelzung in das Register des Sitzes desjenigen Rechtsträgers, dessen Gläubiger sie sind, nach § 19 Abs. 3 UmwG als bekanntgemacht gilt, ihren Anspruch nach Grund und Höhe schriftlich anmelden, Sicherheit zu leisten, soweit sie nicht Befriedigung verlangen können. Dieses Recht steht den Gläubigern jedoch nur zu, wenn sie glaubhaft machen, dass durch die Verschmelzung die Erfüllung ihrer Forderung gefährdet wird."
    },
    {
      "date": "2025-05-22",
      "id": "109962",
      "original_text": "Löschungsankündigung\nBaden-Württemberg Amtsgericht Stuttgart HRA 732659\nFeinkost Horn UG (haftungsbeschränkt) & Co. KG – Esslingen am Neckar",
      "type": "Löschungsankündigung",
      "state": "Baden-Württemberg",
      "amtsgericht": "Amtsgericht Stuttgart",
      "registernummer": "HRA 732659",
      "registerart": "HRA",
      "company_name": "Feinkost Horn UG (haftungsbeschränkt) & Co. KG",
      "company_seat": "Esslingen am Neckar",
      "details": "22.05.2025 (Bekanntmachungsdatum)\n\nBaden-Württemberg Amtsgericht Stuttgart HRA 732659\nLöschungsankündigung\n\nFeinkost Horn UG (haftungsbeschränkt) & Co. KG\nKommanditgesellschaft\nEsslingen am Neckar\n\nAls nicht eingetragen wird bekanntgemacht:\nDas Gericht beabsichtigt, die Gesellschaft wegen Vermögenslosigkeit im Handelsregister von Amts wegen nach § 394 FamFG zu löschen. Die Frist zur Geltendmachung eines Widerspruchs gegen die beabsichtigte Löschung ist auf zwei Monate ab Veröffentlichung bestimmt."
    },
    {
      "date": "2025-05-22",
      "id": "109963",
      "original_text": "Löschungsankündigung\nBaden-Württemberg Amtsgericht Mannheim HRB 716116\nAb in die Kur GmbH – Heidelberg",
      "type": "Löschungsankündigung",
      "state": "Baden-Württemberg",
      "amtsgericht": "Amtsgericht Mannheim",
      "registernummer": "HRB 716116",
      "registerart": "HRB",
      "company_name": "Ab in die Kur GmbH",
      "company_seat": "Heidelberg",
      "details": "22.05.2025 (Bekanntmachungsdatum)\n\nBaden-Württemberg Amtsgericht Mannheim HRB 716116\nLöschungsankündigung 22.05.2025 (Eintragungsdatum)\n\nAb in die Kur GmbH\nGesellschaft mit beschränkter Haftung\nHeidelberg\n\nDas Gericht beabsichtigt, die Gesellschaft wegen Vermögenslosigkeit im Handelsregister von Amts wegen nach § 394 FamFG zu löschen. Die Frist zur Geltendmachung eines Widerspruchs gegen die beabsichtigte Löschung ist auf einen Monat ab Veröffentlichung bestimmt."
    },
    {
      "date": "2025-05-22",
      "id": "109964",
      "original_text": "Löschungsankündigung\nSachsen Amtsgericht Leipzig HRB 27419\nInnenausbau Großdeuben UG (haftungsbeschränkt) – Böhlen OT Großdeuben",
      "type": "Löschungsankündigung",
      "state": "Sachsen",
      "amtsgericht": "Amtsgericht Leipzig",
      "registernummer": "HRB 27419",
      "registerart": "HRB",
      "company_name": "Innenausbau Großdeuben UG (haftungsbeschränkt)",
      "company_seat": "Böhlen OT Großdeuben",
      "details": "22.05.2025 (Bekanntmachungsdatum)\n\nSachsen Amtsgericht Leipzig HRB 27419\nLöschungsankündigung 22.05.2025 (Eintragungsdatum)\n\nInnenausbau Großdeuben UG (haftungsbeschränkt)\nGesellschaft mit beschränkter Haftung\nBöhlen OT Großdeuben\n\nDas Registergericht beabsichtigt, die im Handelsregister eingetragene Gesellschaft von Amts wegen nach § 394 FamFG zu löschen. Die Frist zu Erhebung eines Widerspruchs gegen die beabsichtigte Löschung wird auf einen Monat festgesetzt."
    },
    {
      "date": "2025-05-22",
      "id": "109965",
      "original_text": "Löschungsankündigung\nSachsen Amtsgericht Dresden HRB 35491\nKnusper Grill Sachsen GmbH – Großenhain",
      "type": "Löschungsankündigung",
      "state": "Sachsen",
      "amtsgericht": "Amtsgericht Dresden",
      "registernummer": "HRB 35491",
      "registerart": "HRB",
      "company_name": "Knusper Grill Sachsen GmbH",
      "company_seat": "Großenhain",
      "details": "22.05.2025 (Bekanntmachungsdatum)\n\nSachsen Amtsgericht Dresden HRB 35491\nLöschungsankündigung\n\nKnusper Grill Sachsen GmbH\nGesellschaft mit beschränkter Haftung\nGroßenhain\n\nDas Registergericht beabsichtigt, die im Handelsregister eingetragene Gesellschaft von Amts wegen nach § 394 FamFG zu löschen. Die Frist zu Erhebung eines Widerspruchs gegen die beabsichtigte Löschung wird auf einen Monat festgesetzt."
    },
    {
      "date": "2025-05-22",
      "id": "109966",
      "original_text": "Löschungsankündigung\nSachsen Amtsgericht Dresden HRB 4268\nZamek Nahrungsmittel Dresden GmbH – Dresden",
      "type": "Löschungsankündigung",
      "state": "Sachsen",
      "amtsgericht": "Amtsgericht Dresden",
      "registernummer": "HRB 4268",
      "registerart": "HRB",
      "company_name": "Zamek Nahrungsmittel Dresden GmbH",
      "company_seat": "Dresden",
      "details": "22.05.2025 (Bekanntmachungsdatum)\n\nSachsen Amtsgericht Dresden HRB 4268\nLöschungsankündigung\n\nZamek Nahrungsmittel Dresden GmbH\nGesellschaft mit beschränkter Haftung\nDresden\n\nDas Registergericht beabsichtigt, die im Handelsregister eingetragene Gesellschaft von Amts wegen nach § 394 FamFG zu löschen. Die Frist zu Erhebung eines Widerspruchs gegen die beabsichtigte Löschung wird auf einen Monat festgesetzt."
    },
    {
      "date": "2025-05-22",
      "id": "109967",
      "original_text": "Löschungsankündigung\nSachsen Amtsgericht Dresden HRB 37175\nRosanna Betriebs GmbH – Dresden",
      "type": "Löschungsankündigung",
      "state": "Sachsen",
      "amtsgericht": "Amtsgericht Dresden",
      "registernummer": "HRB 37175",
      "registerart": "HRB",
      "company_name": "Rosanna Betriebs GmbH",
      "company_seat": "Dresden",
      "details": "22.05.2025 (Bekanntmachungsdatum)\n\nSachsen Amtsgericht Dresden HRB 37175\nLöschungsankündigung\n\nRosanna Betriebs GmbH\nGesellschaft mit beschränkter Haftung\nDresden\n\nDas Registergericht beabsichtigt, die im Handelsregister eingetragene Gesellschaft von Amts wegen nach § 394 FamFG zu löschen. Die Frist zu Erhebung eines Widerspruchs gegen die beabsichtigte Löschung wird auf einen Monat festgesetzt."
    },
    {
      "date": "2025-05-22",
      "id": "109968",
      "original_text": "Registerbekanntmachung nach dem Umwandlungsgesetz\nHamburg Amtsgericht Hamburg HRB 171807\ninitions GmbH – Hamburg",
      "type": "Registerbekanntmachung nach dem Umwandlungsgesetz",
      "state": "Hamburg",
      "amtsgericht": "Amtsgericht Hamburg",
      "registernummer": "HRB 171807",
      "registerart": "HRB",
      "company_name": "initions GmbH",
      "company_seat": "Hamburg",
      "details": "22.05.2025 (Bekanntmachungsdatum)\n\nHamburg Amtsgericht Hamburg HRB 171807\nRegisterbekanntmachung nach dem Umwandlungsgesetz 22.05.2025 (Eintragungsdatum)\n\ninitions GmbH\nGesellschaft mit beschränkter Haftung\nHamburg\n\nAls nicht eingetragen wird bekannt gemacht:\nDen Gläubigern der an der Verschmelzung beteiligten Gesellschaften ist, wenn sie binnen sechs Monaten nach dem Tag, an dem die Eintragung der Verschmelzung in das Register des Sitzes desjenigen Rechtsträgers, dessen Gläubiger sie sind, nach § 19 Absatz 3 UmwG als bekannt gemacht gilt, ihren Anspruch nach Grund und Höhe schriftlich anmelden, Sicherheit zu leisten, soweit sie nicht Befriedigung verlangen können. Dieses Recht steht den Gläubigern jedoch nur zu, wenn sie glaubhaft machen, dass durch die Verschmelzung die Erfüllung ihrer Forderung gefährdet wird."
    },
    {
      "date": "2025-05-22",
      "id": "109969",
      "original_text": "Registerbekanntmachung nach dem Umwandlungsgesetz\nNiedersachsen Amtsgericht Osnabrück HRB 120226 früher Amtsgericht Meppen\nWavin Beteiligungen GmbH – Twist",
      "type": "Registerbekanntmachung nach dem Umwandlungsgesetz",
      "state": "Niedersachsen",
      "amtsgericht": "Amtsgericht Osnabrück",
      "registernummer": "HRB 120226",
      "registerart": "HRB",
      "company_name": "Wavin Beteiligungen GmbH",
      "company_seat": "Twist",
      "former_amtsgericht": "Meppen",
      "details": "22.05.2025 (Bekanntmachungsdatum)\n\nNiedersachsen Amtsgericht Osnabrück HRB 120226 früher Amtsgericht Meppen\nRegisterbekanntmachung nach dem Umwandlungsgesetz 22.05.2025 (Eintragungsdatum)\n\nWavin Beteiligungen GmbH\nGesellschaft mit beschränkter Haftung\nTwist\n\nDen Gläubigern der an der Verschmelzung beteiligten Rechtsträger ist, wenn sie binnen sechs Monaten nach dem Tag, an dem die Eintragung der Verschmelzung in das Register des Sitzes desjenigen Rechtsträgers, dessen Gläubiger sie sind, nach § 19  Abs.  3 UmwG als bekannt gemacht gilt, ihren Anspruch nach Grund und Höhe schriftlich anmelden, Sicherheit zu leisten, soweit sie nicht Befriedigung verlangen können. Dieses Recht steht den Gläubigern jedoch nur zu, wenn sie glaubhaft machen, dass durch die Verschmelzung die Erfüllung der Forderung gefährdet wird."
    },
    {
      "date": "2025-05-22",
      "id": "109970",
      "original_text": "Löschungsankündigung\nNiedersachsen Amtsgericht Braunschweig HRB 210737\nVISITATIS Service GmbH – Bad Harzburg",
      "type": "Löschungsankündigung",
      "state": "Niedersachsen",
      "amtsgericht": "Amtsgericht Braunschweig",
      "registernummer": "HRB 210737",
      "registerart": "HRB",
      "company_name": "VISITATIS Service GmbH",
      "company_seat": "Bad Harzburg",
      "details": "22.05.2025 (Bekanntmachungsdatum)\n\nNiedersachsen Amtsgericht Braunschweig HRB 210737\nLöschungsankündigung\n\nVISITATIS Service GmbH\nGesellschaft mit beschränkter Haftung\nBad Harzburg\n\nDas Registergericht beabsichtigt, die Gesellschaft von Amts wegen nach § 394 FamFG zu löschen. Die Frist zur Erhebung eines Widerspruchs ist auf 1 Monat ab dieser Registerbekanntmachung festgesetzt."
    },
    {
      "date": "2025-05-22",
      "id": "109971",
      "original_text": "Einreichung neuer Dokumente\nNiedersachsen Amtsgericht Oldenburg (Oldenburg) HRB 201466\nEnviTec Biogas AG – Lohne",
      "type": "Einreichung neuer Dokumente",
      "state": "Niedersachsen",
      "amtsgericht": "Amtsgericht Oldenburg (Oldenburg)",
      "registernummer": "HRB 201466",
      "registerart": "HRB",
      "company_name": "EnviTec Biogas AG",
      "company_seat": "Lohne",
      "details": "22.05.2025 (Bekanntmachungsdatum)\n\nNiedersachsen Amtsgericht Oldenburg (Oldenburg) HRB 201466\nEinreichung neuer Dokumente\n\nEnviTec Biogas AG\nAktiengesellschaft\nLohne\n\nDie Liste der Mitglieder des Aufsichtsrats wurde beim Registergericht eingereicht."
    },
    {
      "date": "2025-05-22",
      "id": "109972",
      "original_text": "Löschungsankündigung\nNiedersachsen Amtsgericht Hildesheim HRA 200486\nKlauser Kälte- und Klimaanlagen, Lehrte e.K. – Lehrte",
      "type": "Löschungsankündigung",
      "state": "Niedersachsen",
      "amtsgericht": "Amtsgericht Hildesheim",
      "registernummer": "HRA 200486",
      "registerart": "HRA",
      "company_name": "Klauser Kälte- und Klimaanlagen, Lehrte e.K.",
      "company_seat": "Lehrte",
      "details": "22.05.2025 (Bekanntmachungsdatum)\n\nNiedersachsen Amtsgericht Hildesheim HRA 200486\nLöschungsankündigung 22.05.2025 (Eintragungsdatum)\n\nKlauser Kälte- und Klimaanlagen, Lehrte e.K.\nEinzelkaufmann / Einzelkauffrau\nLehrte\n\nDas Registergericht beabsichtigt, die Firma von Amts wegen nach § 31 Abs. 2 Satz 2 HGB, § 393 FamFG zu löschen. Die Frist zur Erhebung eines Widerspruchs ist auf 1 Monat ab dieser Registerbekanntmachung festgesetzt."
    },
    {
      "date": "2025-05-22",
      "id": "109973",
      "original_text": "Löschungsankündigung\nNiedersachsen Amtsgericht Osnabrück HRB 216259\nF & M GmbH, Fach- und Montageservice – Papenburg",
      "type": "Löschungsankündigung",
      "state": "Niedersachsen",
      "amtsgericht": "Amtsgericht Osnabrück",
      "registernummer": "HRB 216259",
      "registerart": "HRB",
      "company_name": "F & M GmbH, Fach- und Montageservice",
      "company_seat": "Papenburg",
      "details": "22.05.2025 (Bekanntmachungsdatum)\n\nNiedersachsen Amtsgericht Osnabrück HRB 216259\nLöschungsankündigung\n\nF & M GmbH, Fach- und Montageservice\nGesellschaft mit beschränkter Haftung\nPapenburg\n\nDas Registergericht beabsichtigt, die Gesellschaft von Amts wegen nach § 394 FamFG wegen Vermögenslosigkeit zu löschen. Die Frist zur Erhebung eines Widerspruchs ist auf 1 Monat ab dieser Registerbekanntmachung festgesetzt."
    },
    {
      "date": "2025-05-22",
      "id": "109974",
      "original_text": "Registerbekanntmachung nach dem Umwandlungsgesetz\nNiedersachsen Amtsgericht Hildesheim HRB 101532 früher Amtsgericht Gifhorn\nKlemm & Hänsel GmbH – Peine",
      "type": "Registerbekanntmachung nach dem Umwandlungsgesetz",
      "state": "Niedersachsen",
      "amtsgericht": "Amtsgericht Hildesheim",
      "registernummer": "HRB 101532",
      "registerart": "HRB",
      "company_name": "Klemm & Hänsel GmbH",
      "company_seat": "Peine",
      "former_amtsgericht": "Gifhorn",
      "details": "22.05.2025 (Bekanntmachungsdatum)\n\nNiedersachsen Amtsgericht Hildesheim HRB 101532 früher Amtsgericht Gifhorn\nRegisterbekanntmachung nach dem Umwandlungsgesetz 22.05.2025 (Eintragungsdatum)\n\nKlemm & Hänsel GmbH\nGesellschaft mit beschränkter Haftung\nPeine\n\nDen Gläubigern der an der Verschmelzung beteiligten Rechtsträger ist, wenn sie binnen sechs Monaten nach dem Tag, an dem die Eintragung der Verschmelzung in das Register des Sitzes desjenigen Rechtsträgers, dessen Gläubiger sie sind, nach § 19  Abs.  3 UmwG als bekannt gemacht gilt, ihren Anspruch nach Grund und Höhe schriftlich anmelden, Sicherheit zu leisten, soweit sie nicht Befriedigung verlangen können. Dieses Recht steht den Gläubigern jedoch nur zu, wenn sie glaubhaft machen, dass durch die Verschmelzung die Erfüllung der Forderung gefährdet wird."
    },
    {
      "date": "2025-05-22",
      "id": "109975",
      "original_text": "Einreichung neuer Dokumente\nBremen Amtsgericht Bremen HRB 3354\nWFB Wirtschaftsförderung Bremen GmbH – Bremen",
      "type": "Einreichung neuer Dokumente",
      "state": "Bremen",
      "amtsgericht": "Amtsgericht Bremen",
      "registernummer": "HRB 3354",
      "registerart": "HRB",
      "company_name": "WFB Wirtschaftsförderung Bremen GmbH",
      "company_seat": "Bremen",
      "details": "22.05.2025 (Bekanntmachungsdatum)\n\nBremen Amtsgericht Bremen HRB 3354\nEinreichung neuer Dokumente\n\nWFB Wirtschaftsförderung Bremen GmbH\nGesellschaft mit beschränkter Haftung\nBremen\n\nAls nicht eingetragen wird bekannt gemacht: Liste des Aufsichtsrats wurde eingereicht."
    },
    {
      "date": "2025-05-22",
      "id": "109976",
      "original_text": "Löschungsankündigung\nBremen Amtsgericht Bremen HRB 36492\nCS.Dogan Bauunternehmen GmbH – Bremen",
      "type": "Löschungsankündigung",
      "state": "Bremen",
      "amtsgericht": "Amtsgericht Bremen",
      "registernummer": "HRB 36492",
      "registerart": "HRB",
      "company_name": "CS.Dogan Bauunternehmen GmbH",
      "company_seat": "Bremen",
      "details": "22.05.2025 (Bekanntmachungsdatum)\n\nBremen Amtsgericht Bremen HRB 36492\nLöschungsankündigung\n\nCS.Dogan Bauunternehmen GmbH\nGesellschaft mit beschränkter Haftung\nBremen\n\nEs ist beabsichtigt die im Handelsregister eingetragene Gesellschaft von Amts wegen gemäß § 394 FamFG zu löschen. Gegen die Löschung kann beim AG Bremen schriftlich oder zu Protokoll der Geschäftsstelle Widerspruch eingelegt werden. Widerspruchsfrist 4 Wochen."
    },
    {
      "date": "2025-05-22",
      "id": "109977",
      "original_text": "Einreichung neuer Dokumente\nRheinland-Pfalz Amtsgericht Wittlich HRB 4616\nTELENETWORK AG – Trier",
      "type": "Einreichung neuer Dokumente",
      "state": "Rheinland-Pfalz",
      "amtsgericht": "Amtsgericht Wittlich",
      "registernummer": "HRB 4616",
      "registerart": "HRB",
      "company_name": "TELENETWORK AG",
      "company_seat": "Trier",
      "details": "22.05.2025 (Bekanntmachungsdatum)\n\nRheinland-Pfalz Amtsgericht Wittlich HRB 4616\nEinreichung neuer Dokumente 22.05.2025 (Eintragungsdatum)\n\nTELENETWORK AG\nAktiengesellschaft\nTrier\n\nDem Registergericht ist eine neue Liste der Mitglieder des Aufsichtsrates eingereicht worden."
    },
    {
      "date": "2025-05-22",
      "id": "109978",
      "original_text": "Löschungsankündigung\nRheinland-Pfalz Amtsgericht Montabaur HRA 22637\nnz flächenheizung e.K. Inhaber Nikolai Zink – Etzbach",
      "type": "Löschungsankündigung",
      "state": "Rheinland-Pfalz",
      "amtsgericht": "Amtsgericht Montabaur",
      "registernummer": "HRA 22637",
      "registerart": "HRA",
      "company_name": "nz flächenheizung e.K. Inhaber Nikolai Zink",
      "company_seat": "Etzbach",
      "details": "22.05.2025 (Bekanntmachungsdatum)\n\nRheinland-Pfalz Amtsgericht Montabaur HRA 22637\nLöschungsankündigung 22.05.2025 (Eintragungsdatum)\n\nnz flächenheizung e.K. Inhaber Nikolai Zink\nEinzelkaufmann / Einzelkauffrau\nEtzbach\n\nDas Registergericht beabsichtigt die Firma von Amts wegen nach § 394 FamFG zu löschen. Die Frist zur Erhebung eines Widerspruchs ist auf 1 Monat festgesetzt."
    },
    {
      "date": "2025-05-22",
      "id": "109979",
      "original_text": "Registerbekanntmachung nach dem Umwandlungsgesetz\nRheinland-Pfalz Amtsgericht Wittlich HRB 46146\nGPH GmbH – Kell am See",
      "type": "Registerbekanntmachung nach dem Umwandlungsgesetz",
      "state": "Rheinland-Pfalz",
      "amtsgericht": "Amtsgericht Wittlich",
      "registernummer": "HRB 46146",
      "registerart": "HRB",
      "company_name": "GPH GmbH",
      "company_seat": "Kell am See",
      "details": "22.05.2025 (Bekanntmachungsdatum)\n\nRheinland-Pfalz Amtsgericht Wittlich HRB 46146\nRegisterbekanntmachung nach dem Umwandlungsgesetz 22.05.2025 (Eintragungsdatum)\n\nGPH GmbH\nGesellschaft mit beschränkter Haftung\nKell am See\n\nAls nicht eingetragen wird veröffentlicht: Den Gläubigern der an der Verschmelzung beteiligten Rechtsträger ist, wenn sie binnen sechs Monaten nach dem Tag, an dem die Eintragung der Verschmelzung in das Register des Sitzes desjenigen Rechtsträgers,dessen Gläubiger sie sind, nach § 19 Abs. 3 UmwG als bekannt gemacht gilt, ihren Anspruch nach Grund und Höhe schriftlich anmelden, Sicherheit zu leisten, soweit sie nicht Befriedigung verlangen können. Dieses Recht steht den Gläubigern jedoch nur zu, wenn sie glaubhaft machen, dass durch die Verschmelzung die Erfüllung der Forderung gefährdet wird."
    },
    {
      "date": "2025-05-22",
      "id": "109980",
      "original_text": "Registerbekanntmachung nach dem Umwandlungsgesetz\nRheinland-Pfalz Amtsgericht Wittlich HRB 4861\nttt-it AG – Trier",
      "type": "Registerbekanntmachung nach dem Umwandlungsgesetz",
      "state": "Rheinland-Pfalz",
      "amtsgericht": "Amtsgericht Wittlich",
      "registernummer": "HRB 4861",
      "registerart": "HRB",
      "company_name": "ttt-it AG",
      "company_seat": "Trier",
      "details": "22.05.2025 (Bekanntmachungsdatum)\n\nRheinland-Pfalz Amtsgericht Wittlich HRB 4861\nRegisterbekanntmachung nach dem Umwandlungsgesetz 22.05.2025 (Eintragungsdatum)\n\nttt-it AG\nAktiengesellschaft\nTrier\n\nAls nicht eingetragen wird veröffentlicht: Den Gläubigern der an der Verschmelzung beteiligten Rechtsträger ist, wenn sie binnen sechs Monaten nach dem Tag, an dem die Eintragung der Verschmelzung in das Register des Sitzes desjenigen Rechtsträgers,dessen Gläubiger sie sind, nach § 19 Abs. 3 UmwG als bekannt gemacht gilt, ihren Anspruch nach Grund und Höhe schriftlich anmelden, Sicherheit zu leisten, soweit sie nicht Befriedigung verlangen können. Dieses Recht steht den Gläubigern jedoch nur zu, wenn sie glaubhaft machen, dass durch die Verschmelzung die Erfüllungd er Forderung gefährdet wird."
    },
    {
      "date": "2025-05-22",
      "id": "109981",
      "original_text": "Sonstige Registerbekanntmachung\nNordrhein-Westfalen Amtsgericht Düsseldorf HRB 48032\nIFIC Holding AG – Düsseldorf",
      "type": "Sonstige Registerbekanntmachung",
      "state": "Nordrhein-Westfalen",
      "amtsgericht": "Amtsgericht Düsseldorf",
      "registernummer": "HRB 48032",
      "registerart": "HRB",
      "company_name": "IFIC Holding AG",
      "company_seat": "Düsseldorf",
      "details": "22.05.2025 (Bekanntmachungsdatum)\n\nNordrhein-Westfalen Amtsgericht Düsseldorf HRB 48032\nSonstige Registerbekanntmachung\n\nIFIC Holding AG\nAktiengesellschaft\nDüsseldorf\n\nDem Registergericht ist eine Liste der Mitglieder des Aufsichtsrates eingereicht worden."
    },
    {
      "date": "2025-05-22",
      "id": "109982",
      "original_text": "Einreichung neuer Dokumente\nNordrhein-Westfalen Amtsgericht Wuppertal HRB 2174\nGemeinnützige Wohnungsbaugesellschaft mbH Wuppertal – Wuppertal",
      "type": "Einreichung neuer Dokumente",
      "state": "Nordrhein-Westfalen",
      "amtsgericht": "Amtsgericht Wuppertal",
      "registernummer": "HRB 2174",
      "registerart": "HRB",
      "company_name": "Gemeinnützige Wohnungsbaugesellschaft mbH Wuppertal",
      "company_seat": "Wuppertal",
      "details": "22.05.2025 (Bekanntmachungsdatum)\n\nNordrhein-Westfalen Amtsgericht Wuppertal HRB 2174\nEinreichung neuer Dokumente 22.05.2025 (Eintragungsdatum)\n\nGemeinnützige Wohnungsbaugesellschaft mbH Wuppertal\nGesellschaft mit beschränkter Haftung\nWuppertal\n\nDem Registergericht ist eine neue Liste der Mitglieder des Aufsichtsrates eingereicht worden."
    },
    {
      "date": "2025-05-22",
      "id": "109983",
      "original_text": "Registerbekanntmachung nach dem Umwandlungsgesetz\nNordrhein-Westfalen Amtsgericht Köln HRB 84989\nfirstwire GmbH – Köln",
      "type": "Registerbekanntmachung nach dem Umwandlungsgesetz",
      "state": "Nordrhein-Westfalen",
      "amtsgericht": "Amtsgericht Köln",
      "registernummer": "HRB 84989",
      "registerart": "HRB",
      "company_name": "firstwire GmbH",
      "company_seat": "Köln",
      "details": "22.05.2025 (Bekanntmachungsdatum)\n\nNordrhein-Westfalen Amtsgericht Köln HRB 84989\nRegisterbekanntmachung nach dem Umwandlungsgesetz 22.05.2025 (Eintragungsdatum)\n\nfirstwire GmbH\nGesellschaft mit beschränkter Haftung\nKöln\n\nDen Gläubigern der an der Verschmelzung beteiligten Rechtsträger ist, wenn sie binnen sechs Monaten nach dem Tag, an dem die Eintragung der Verschmelzung in das Register des Sitzes desjenigen Rechtsträgers, dessen Gläubiger sie sind, nach § 19 Absatz 3 UmwG als bekanntgemacht gilt, ihren Anspruch nach Grund und Höhe schriftlich anmelden, Sicherheit zu leisten, soweit sie nicht Befriedigung verlangen können. Dieses Recht steht den Gläubigern jedoch nur zu, wenn sie glaubhaft machen, dass durch die Verschmelzung die Erfüllung ihrer Forderung gefährdet wird."
    },
    {
      "date": "2025-05-22",
      "id": "109984",
      "original_text": "Registerbekanntmachung nach dem Umwandlungsgesetz\nNordrhein-Westfalen Amtsgericht Köln HRB 78642\nfirstwire consulting GmbH – Köln",
      "type": "Registerbekanntmachung nach dem Umwandlungsgesetz",
      "state": "Nordrhein-Westfalen",
      "amtsgericht": "Amtsgericht Köln",
      "registernummer": "HRB 78642",
      "registerart": "HRB",
      "company_name": "firstwire consulting GmbH",
      "company_seat": "Köln",
      "details": "22.05.2025 (Bekanntmachungsdatum)\n\nNordrhein-Westfalen Amtsgericht Köln HRB 78642\nRegisterbekanntmachung nach dem Umwandlungsgesetz 22.05.2025 (Eintragungsdatum)\n\nfirstwire consulting GmbH\nGesellschaft mit beschränkter Haftung\nKöln\n\nDen Gläubigern der an der Verschmelzung beteiligten Rechtsträger ist, wenn sie binnen sechs Monaten nach dem Tag, an dem die Eintragung der Verschmelzung in das Register des Sitzes desjenigen Rechtsträgers, dessen Gläubiger sie sind, nach § 19 Absatz 3 UmwG als bekanntgemacht gilt, ihren Anspruch nach Grund und Höhe schriftlich anmelden, Sicherheit zu leisten, soweit sie nicht Befriedigung verlangen können. Dieses Recht steht den Gläubigern jedoch nur zu, wenn sie glaubhaft machen, dass durch die Verschmelzung die Erfüllung ihrer Forderung gefährdet wird."
    },
    {
      "date": "2025-05-22",
      "id": "109985",
      "original_text": "Registerbekanntmachung nach dem Umwandlungsgesetz\nNordrhein-Westfalen Amtsgericht Düsseldorf HRB 68803\nMTS Security GmbH – Düsseldorf",
      "type": "Registerbekanntmachung nach dem Umwandlungsgesetz",
      "state": "Nordrhein-Westfalen",
      "amtsgericht": "Amtsgericht Düsseldorf",
      "registernummer": "HRB 68803",
      "registerart": "HRB",
      "company_name": "MTS Security GmbH",
      "company_seat": "Düsseldorf",
      "details": "22.05.2025 (Bekanntmachungsdatum)\n\nNordrhein-Westfalen Amtsgericht Düsseldorf HRB 68803\nRegisterbekanntmachung nach dem Umwandlungsgesetz 22.05.2025 (Eintragungsdatum)\n\nMTS Security GmbH\nGesellschaft mit beschränkter Haftung\nDüsseldorf\n\nDen Gläubigern der an der formwechselnden Umwandlung beteiligten Rechtsträger ist, wenn sie binnen sechs Monaten nach dem Tag, an dem die Eintragung der formwechselnden Umwandlung in das Register des Sitzes desjenigen Rechtsträgers, dessen Gläubiger sie sind, nach § 19 Absatz 3 UmwG als bekanntgemacht gilt, ihren Anspruch nach Grund und Höhe schriftlich anmelden, Sicherheit zu leisten, soweit sie nicht Befriedigung verlangen können. Dieses Recht steht den Gläubigern jedoch nur zu, wenn sie glaubhaft machen, dass durch die formwechselnden Umwandlung die Erfüllung ihrer Forderung gefährdet wird."
    },
    {
      "date": "2025-05-22",
      "id": "109986",
      "original_text": "Registerbekanntmachung nach dem Umwandlungsgesetz\nNordrhein-Westfalen Amtsgericht Münster HRA 9424\nAschendorff Medien GmbH & Co. KG – Münster",
      "type": "Registerbekanntmachung nach dem Umwandlungsgesetz",
      "state": "Nordrhein-Westfalen",
      "amtsgericht": "Amtsgericht Münster",
      "registernummer": "HRA 9424",
      "registerart": "HRA",
      "company_name": "Aschendorff Medien GmbH & Co. KG",
      "company_seat": "Münster",
      "details": "22.05.2025 (Bekanntmachungsdatum)\n\nNordrhein-Westfalen Amtsgericht Münster HRA 9424\nRegisterbekanntmachung nach dem Umwandlungsgesetz 22.05.2025 (Eintragungsdatum)\n\nAschendorff Medien GmbH & Co. KG\nKommanditgesellschaft\nMünster\n\nDen Gläubigern der an der Verschmelzung beteiligten Rechtsträger ist, wenn sie binnen sechs Monaten nach dem Tag, an dem die Eintragung der Verschmelzung in das Register des Sitzes derjenigen Rechtsträger deren Gläubiger sie sind, nach § 19 Absatz 3 UmwG als bekanntgemacht gilt, ihren Anspruch nach Grund und Höhe schriftlich anmelden, Sicherheit zu leisten, soweit sie nicht Befriedigung verlangen können. Dieses Recht steht den Gläubigern jedoch nur zu, wenn sie glaubhaft machen, dass durch die Verschmelzung die Erfüllung ihrer Forderung gefährdet wird."
    },
    {
      "date": "2025-05-22",
      "id": "109987",
      "original_text": "Löschungsankündigung\nNordrhein-Westfalen Amtsgericht Gelsenkirchen HRA 5839\nTOP Energie Vertrieb UG (haftungsbeschränkt) & Co. KG – Gelsenkirchen",
      "type": "Löschungsankündigung",
      "state": "Nordrhein-Westfalen",
      "amtsgericht": "Amtsgericht Gelsenkirchen",
      "registernummer": "HRA 5839",
      "registerart": "HRA",
      "company_name": "TOP Energie Vertrieb UG (haftungsbeschränkt) & Co. KG",
      "company_seat": "Gelsenkirchen",
      "details": "22.05.2025 (Bekanntmachungsdatum)\n\nNordrhein-Westfalen Amtsgericht Gelsenkirchen HRA 5839\nLöschungsankündigung 22.05.2025 (Eintragungsdatum)\n\nTOP Energie Vertrieb UG (haftungsbeschränkt) & Co. KG\nKommanditgesellschaft\nGelsenkirchen\n\nDas Registergericht beabsichtigt die Firma von Amts wegen nach § 394 FamFG zu löschen. Die Frist zur Erhebung eines Widerspruchs ist auf einen Monat festgesetzt."
    },
    {
      "date": "2025-05-22",
      "id": "109988",
      "original_text": "Löschungsankündigung\nNordrhein-Westfalen Amtsgericht Dortmund HRA 16377\nKonjuhi GmbH & Co. KG – Dortmund",
      "type": "Löschungsankündigung",
      "state": "Nordrhein-Westfalen",
      "amtsgericht": "Amtsgericht Dortmund",
      "registernummer": "HRA 16377",
      "registerart": "HRA",
      "company_name": "Konjuhi GmbH & Co. KG",
      "company_seat": "Dortmund",
      "details": "22.05.2025 (Bekanntmachungsdatum)\n\nNordrhein-Westfalen Amtsgericht Dortmund HRA 16377\nLöschungsankündigung\n\nKonjuhi GmbH & Co. KG\nKommanditgesellschaft\nDortmund\n\nDas Registergericht beabsichtigt die Firma von Amts wegen nach §§ 31 Abs. 2 HGB, 393 FamFG zu löschen. Die Frist zur Erhebung eines Widerspruchs ist auf drei Monate festgesetzt."
    },
    {
      "date": "2025-05-22",
      "id": "109989",
      "original_text": "Registerbekanntmachung nach dem Umwandlungsgesetz\nNordrhein-Westfalen Amtsgericht Essen HRB 34127\nOstsee LNG Holding GmbH – Essen",
      "type": "Registerbekanntmachung nach dem Umwandlungsgesetz",
      "state": "Nordrhein-Westfalen",
      "amtsgericht": "Amtsgericht Essen",
      "registernummer": "HRB 34127",
      "registerart": "HRB",
      "company_name": "Ostsee LNG Holding GmbH",
      "company_seat": "Essen",
      "details": "22.05.2025 (Bekanntmachungsdatum)\n\nNordrhein-Westfalen Amtsgericht Essen HRB 34127\nRegisterbekanntmachung nach dem Umwandlungsgesetz 22.05.2025 (Eintragungsdatum)\n\nOstsee LNG Holding GmbH\nGesellschaft mit beschränkter Haftung\nEssen\n\nDen Gläubigern der an der Verschmelzung beteiligten Rechtsträger ist, wenn sie binnen sechs Monaten nach dem Tag, an dem die Eintragung der Verschmelzung in das Register des Sitzes derjenigen Rechtsträger deren Gläubiger sie sind, nach § 19 Absatz 3 UmwG als bekanntgemacht gilt, ihren Anspruch nach Grund und Höhe schriftlich anmelden, Sicherheit zu leisten, soweit sie nicht Befriedigung verlangen können. Dieses Recht steht den Gläubigern jedoch nur zu, wenn sie glaubhaft machen, dass durch die Verschmelzung die Erfüllung ihrer Forderung gefährdet wird."
    },
    {
      "date": "2025-05-22",
      "id": "109990",
      "original_text": "Löschungsankündigung\nNordrhein-Westfalen Amtsgericht Kleve HRB 17509\nPachel Deutschland GmbH – Kranenburg",
      "type": "Löschungsankündigung",
      "state": "Nordrhein-Westfalen",
      "amtsgericht": "Amtsgericht Kleve",
      "registernummer": "HRB 17509",
      "registerart": "HRB",
      "company_name": "Pachel Deutschland GmbH",
      "company_seat": "Kranenburg",
      "details": "22.05.2025 (Bekanntmachungsdatum)\n\nNordrhein-Westfalen Amtsgericht Kleve HRB 17509\nLöschungsankündigung\n\nPachel Deutschland GmbH\nGesellschaft mit beschränkter Haftung\nKranenburg\n\nDas Registergericht beabsichtigt die Gesellschaft von Amts wegen nach § 394 FamFG zu löschen. Die Frist zur Erhebung eines Widerspruchs ist auf einen Monat festgesetzt."
    },
    {
      "date": "2025-05-22",
      "id": "109991",
      "original_text": "Einreichung neuer Dokumente\nNordrhein-Westfalen Amtsgericht Düsseldorf HRB 39473\nCECONOMY AG – Düsseldorf",
      "type": "Einreichung neuer Dokumente",
      "state": "Nordrhein-Westfalen",
      "amtsgericht": "Amtsgericht Düsseldorf",
      "registernummer": "HRB 39473",
      "registerart": "HRB",
      "company_name": "CECONOMY AG",
      "company_seat": "Düsseldorf",
      "details": "22.05.2025 (Bekanntmachungsdatum)\n\nNordrhein-Westfalen Amtsgericht Düsseldorf HRB 39473\nEinreichung neuer Dokumente\n\nCECONOMY AG\nAktiengesellschaft\nDüsseldorf\n\nDem Registergericht ist eine Liste der Mitglieder des Aufsichtsrates eingereicht worden."
    },
    {
      "date": "2025-05-22",
      "id": "109992",
      "original_text": "Registerbekanntmachung nach dem Umwandlungsgesetz\nNordrhein-Westfalen Amtsgericht Münster HRB 3309\nPrester GmbH – Münster",
      "type": "Registerbekanntmachung nach dem Umwandlungsgesetz",
      "state": "Nordrhein-Westfalen",
      "amtsgericht": "Amtsgericht Münster",
      "registernummer": "HRB 3309",
      "registerart": "HRB",
      "company_name": "Prester GmbH",
      "company_seat": "Münster",
      "details": "22.05.2025 (Bekanntmachungsdatum)\n\nNordrhein-Westfalen Amtsgericht Münster HRB 3309\nRegisterbekanntmachung nach dem Umwandlungsgesetz 22.05.2025 (Eintragungsdatum)\n\nPrester GmbH\nGesellschaft mit beschränkter Haftung\nMünster\n\nDen Gläubigern der an der Verschmelzung beteiligten Rechtsträger ist, wenn sie binnen sechs Monaten nach dem Tag, an dem die Eintragung der Verschmelzung in das Register des Sitzes desjenigen Rechtsträgers, dessen Gläubiger sie sind, nach § 19 Absatz 3 UmwG als bekanntgemacht gilt, ihren Anspruch nach Grund und Höhe schriftlich anmelden, Sicherheit zu leisten, soweit sie nicht Befriedigung verlangen können. Dieses Recht steht den Gläubigern jedoch nur zu, wenn sie glaubhaft machen, dass durch die Verschmelzung die Erfüllung ihrer Forderung gefährdet wird."
    },
    {
      "date": "2025-05-22",
      "id": "109993",
      "original_text": "Einreichung neuer Dokumente\nNordrhein-Westfalen Amtsgericht Gelsenkirchen HRB 7796\nthyssenkrupp Electrical Steel GmbH – Gelsenkirchen",
      "type": "Einreichung neuer Dokumente",
      "state": "Nordrhein-Westfalen",
      "amtsgericht": "Amtsgericht Gelsenkirchen",
      "registernummer": "HRB 7796",
      "registerart": "HRB",
      "company_name": "thyssenkrupp Electrical Steel GmbH",
      "company_seat": "Gelsenkirchen",
      "details": "22.05.2025 (Bekanntmachungsdatum)\n\nNordrhein-Westfalen Amtsgericht Gelsenkirchen HRB 7796\nEinreichung neuer Dokumente 22.05.2025 (Eintragungsdatum)\n\nthyssenkrupp Electrical Steel GmbH\nGesellschaft mit beschränkter Haftung\nGelsenkirchen\n\nDem Registergericht ist eine neue Liste der Mitglieder des Aufsichtsrates eingereicht worden."
    },
    {
      "date": "2025-05-22",
      "id": "109994",
      "original_text": "Sonstige Registerbekanntmachung\nNordrhein-Westfalen Amtsgericht Wuppertal HRB 8891\nGWG Stadt- und Projektentwicklungsgesellschaft mbH – Wuppertal",
      "type": "Sonstige Registerbekanntmachung",
      "state": "Nordrhein-Westfalen",
      "amtsgericht": "Amtsgericht Wuppertal",
      "registernummer": "HRB 8891",
      "registerart": "HRB",
      "company_name": "GWG Stadt- und Projektentwicklungsgesellschaft mbH",
      "company_seat": "Wuppertal",
      "details": "22.05.2025 (Bekanntmachungsdatum)\n\nNordrhein-Westfalen Amtsgericht Wuppertal HRB 8891\nSonstige Registerbekanntmachung\n\nGWG Stadt- und Projektentwicklungsgesellschaft mbH\nGesellschaft mit beschränkter Haftung\nWuppertal\n\nDem Registergericht ist eine neue Liste der Mitglieder des Aufsichtsrates eingereicht worden."
    },
    {
      "date": "2025-05-22",
      "id": "109995",
      "original_text": "Registerbekanntmachung nach dem Umwandlungsgesetz\nNordrhein-Westfalen Amtsgericht Essen HRB 30700\nVan Meenen-Holding GmbH – Essen",
      "type": "Registerbekanntmachung nach dem Umwandlungsgesetz",
      "state": "Nordrhein-Westfalen",
      "amtsgericht": "Amtsgericht Essen",
      "registernummer": "HRB 30700",
      "registerart": "HRB",
      "company_name": "Van Meenen-Holding GmbH",
      "company_seat": "Essen",
      "details": "22.05.2025 (Bekanntmachungsdatum)\n\nNordrhein-Westfalen Amtsgericht Essen HRB 30700\nRegisterbekanntmachung nach dem Umwandlungsgesetz 22.05.2025 (Eintragungsdatum)\n\nVan Meenen-Holding GmbH\nGesellschaft mit beschränkter Haftung\nEssen\n\nDen Gläubigern der an der Verschmelzung beteiligten Rechtsträger ist, wenn sie binnen sechs Monaten nach dem Tag, an dem die Eintragung der Verschmelzung in das Register des Sitzes desjenigen Rechtsträgers, dessen Gläubiger sie sind, nach § 19 Absatz 3 UmwG als bekanntgemacht gilt, ihren Anspruch nach Grund und Höhe schriftlich anmelden, Sicherheit zu leisten, soweit sie nicht Befriedigung verlangen können. Dieses Recht steht den Gläubigern jedoch nur zu, wenn sie glaubhaft machen, dass durch die Verschmelzung die Erfüllung ihrer Forderung gefährdet wird."
    },
    {
      "date": "2025-05-22",
      "id": "109996",
      "original_text": "Löschungsankündigung\nNordrhein-Westfalen Amtsgericht Düsseldorf HRB 99430\nStay Booking Point GmbH – Düsseldorf",
      "type": "Löschungsankündigung",
      "state": "Nordrhein-Westfalen",
      "amtsgericht": "Amtsgericht Düsseldorf",
      "registernummer": "HRB 99430",
      "registerart": "HRB",
      "company_name": "Stay Booking Point GmbH",
      "company_seat": "Düsseldorf",
      "details": "22.05.2025 (Bekanntmachungsdatum)\n\nNordrhein-Westfalen Amtsgericht Düsseldorf HRB 99430\nLöschungsankündigung\n\nStay Booking Point GmbH\nGesellschaft mit beschränkter Haftung\nDüsseldorf\n\nDas Registergericht beabsichtigt die Gesellschaft von Amts wegen nach § 394 FamFG zu löschen. Die Frist zur Erhebung eines Widerspruchs ist auf 3 Wochen festgesetzt.\n\nRechtsbehelfsbelehrung:\nDas Widerspruchsrecht steht jedem zu, der an der Unterlassung der Löschung ein berechtigtes Interesse hat. Der Widerspruch ist bei dem Amtsgericht Düsseldorf -Registergericht-, Werdener Straße 1, 40227 Düsseldorf schriftlich in deutscher Sprache oder zur Niederschrift der Geschäftsstelle einzulegen. Der Widerspruch kann auch zur Niederschrift der Geschäftsstelle eines jeden Amtsgerichtes abgegeben werden. Die Einlegung ist auch durch Übertragung eines elektronischen Dokuments an die elektronische Poststelle des Gerichts möglich. Das elektronische Dokument muss für die Bearbeitung durch das Gericht geeignet und mit einer qualifizierten elektronischen Signatur der verantwortenden Person versehen sein oder von der verantwortenden Person signiert und auf einem sicheren Übermittlungsweg gemäß § 130a ZPO nach näherer Maßgabe der Verordnung über die technischen Rahmenbedingungen des elektronischen Rechtsverkehrs und über das besondere elektronische Behördenpostfach (BGBl. I, S.3803) eingereicht werden. Weitere Informationen erhalten Sie auf der Internetseite www.justiz.de.\nDer Widerspruch muss spätestens innerhalb der gesetzten Frist nach dem Datum der Bekanntmachung der Löschungsankündigung bei dem Amtsgericht - Registergericht - Düsseldorf eingegangen sein.  Dies gilt auch dann, wenn der Widerspruch zur Niederschrift der Geschäftsstelle eines anderen Amtsgerichtes abgegeben wurde. Die Frist beginnt mit dem Tage der Bekanntmachung der Löschungsankündigung in dem für die Bekanntmachung der Eintragungen in das Handelsregister bestimmten elektronischen Informations- und Kommunikationssystem nach § 10 des Handelsgesetzbuches. Fällt das Ende der Frist auf einen Sonntag, einen allgemeinen Feiertag oder Sonnabend, so endet die Frist mit Ablauf des nächsten Werktages.\nDer Widerspruch muss die Bezeichnung der angefochtenen Löschungsankündigung sowie die Erklärung enthalten, dass Widerspruch gegen diese Löschungsankündigung eingelegt wird. Er ist zu unterzeichnen und soll begründet werden."
    },
    {
      "date": "2025-05-22",
      "id": "109997",
      "original_text": "Löschungsankündigung\nNordrhein-Westfalen Amtsgericht Dortmund HRB 28775\nTrivo Shopping GmbH – Dortmund",
      "type": "Löschungsankündigung",
      "state": "Nordrhein-Westfalen",
      "amtsgericht": "Amtsgericht Dortmund",
      "registernummer": "HRB 28775",
      "registerart": "HRB",
      "company_name": "Trivo Shopping GmbH",
      "company_seat": "Dortmund",
      "details": "22.05.2025 (Bekanntmachungsdatum)\n\nNordrhein-Westfalen Amtsgericht Dortmund HRB 28775\nLöschungsankündigung\n\nTrivo Shopping GmbH\nGesellschaft mit beschränkter Haftung\nDortmund\n\nDas Registergericht beabsichtigt die Gesellschaft von Amts wegen nach § 394 FamFG zu löschen. Die Frist zur Erhebung eines Widerspruchs ist auf zwei Monate festgesetzt."
    },
    {
      "date": "2025-05-22",
      "id": "109998",
      "original_text": "Registerbekanntmachung nach dem Umwandlungsgesetz\nNordrhein-Westfalen Amtsgericht Bad Oeynhausen HRB 19926\nSBO Germany GmbH – Vlotho",
      "type": "Registerbekanntmachung nach dem Umwandlungsgesetz",
      "state": "Nordrhein-Westfalen",
      "amtsgericht": "Amtsgericht Bad Oeynhausen",
      "registernummer": "HRB 19926",
      "registerart": "HRB",
      "company_name": "SBO Germany GmbH",
      "company_seat": "Vlotho",
      "details": "22.05.2025 (Bekanntmachungsdatum)\n\nNordrhein-Westfalen Amtsgericht Bad Oeynhausen HRB 19926\nRegisterbekanntmachung nach dem Umwandlungsgesetz 22.05.2025 (Eintragungsdatum)\n\nSBO Germany GmbH\nGesellschaft mit beschränkter Haftung\nVlotho\n\nDen Gläubigern der an der Ausgliederung beteiligten Rechtsträger ist, wenn sie binnen sechs Monaten nach dem Tag, an dem die Eintragung der Ausgliederung in das Register des Sitzes desjenigen Rechtsträgers, dessen Gläubiger sie sind, nach § 19 Absatz 3 UmwG als bekanntgemacht gilt, ihren Anspruch nach Grund und Höhe schriftlich anmelden, Sicherheit zu leisten, soweit sie nicht Befriedigung verlangen können. Dieses Recht steht den Gläubigern jedoch nur zu, wenn sie glaubhaft machen, dass durch die Ausgliederung die Erfüllung ihrer Forderung gefährdet wird."
    },
    {
      "date": "2025-05-22",
      "id": "109999",
      "original_text": "Registerbekanntmachung nach dem Umwandlungsgesetz\nNordrhein-Westfalen Amtsgericht Dortmund HRB 24252\nEGU Industrievertriebs GmbH – Dortmund",
      "type": "Registerbekanntmachung nach dem Umwandlungsgesetz",
      "state": "Nordrhein-Westfalen",
      "amtsgericht": "Amtsgericht Dortmund",
      "registernummer": "HRB 24252",
      "registerart": "HRB",
      "company_name": "EGU Industrievertriebs GmbH",
      "company_seat": "Dortmund",
      "details": "22.05.2025 (Bekanntmachungsdatum)\n\nNordrhein-Westfalen Amtsgericht Dortmund HRB 24252\nRegisterbekanntmachung nach dem Umwandlungsgesetz 22.05.2025 (Eintragungsdatum)\n\nEGU Industrievertriebs GmbH\nGesellschaft mit beschränkter Haftung\nDortmund\n\nDen Gläubigern der an der Verschmelzung beteiligten Rechtsträger ist, wenn sie binnen sechs Monaten nach dem Tag, an dem die Eintragung der Verschmelzung in das Register des Sitzes desjenigen Rechtsträgers, dessen Gläubiger sie sind, nach § 19 Absatz 3 UmwG als bekanntgemacht gilt, ihren Anspruch nach Grund und Höhe schriftlich anmelden, Sicherheit zu leisten, soweit sie nicht Befriedigung verlangen können. Dieses Recht steht den Gläubigern jedoch nur zu, wenn sie glaubhaft machen, dass durch die Verschmelzung die Erfüllung ihrer Forderung gefährdet wird."
    },
    {
      "date": "2025-05-22",
      "id": "110000",
      "original_text": "Löschungsankündigung\nNordrhein-Westfalen Amtsgericht Düsseldorf HRB 96262\nSOLAR costruzioni GmbH – Hilden",
      "type": "Löschungsankündigung",
      "state": "Nordrhein-Westfalen",
      "amtsgericht": "Amtsgericht Düsseldorf",
      "registernummer": "HRB 96262",
      "registerart": "HRB",
      "company_name": "SOLAR costruzioni GmbH",
      "company_seat": "Hilden",
      "details": "22.05.2025 (Bekanntmachungsdatum)\n\nNordrhein-Westfalen Amtsgericht Düsseldorf HRB 96262\nLöschungsankündigung\n\nSOLAR costruzioni GmbH\nGesellschaft mit beschränkter Haftung\nHilden\n\nDas Registergericht beabsichtigt die Gesellschaft von Amts wegen nach § 394 FamFG zu löschen. Die Frist zur Erhebung eines Widerspruchs ist auf 3 Wochen festgesetzt.\n\nRechtsbehelfsbelehrung:\nDas Widerspruchsrecht steht jedem zu, der an der Unterlassung der Löschung ein berechtigtes Interesse hat. Der Widerspruch ist bei dem Amtsgericht Düsseldorf -Registergericht-, Werdener Straße 1, 40227 Düsseldorf schriftlich in deutscher Sprache oder zur Niederschrift der Geschäftsstelle einzulegen. Der Widerspruch kann auch zur Niederschrift der Geschäftsstelle eines jeden Amtsgerichtes abgegeben werden. Die Einlegung ist auch durch Übertragung eines elektronischen Dokuments an die elektronische Poststelle des Gerichts möglich. Das elektronische Dokument muss für die Bearbeitung durch das Gericht geeignet und mit einer qualifizierten elektronischen Signatur der verantwortenden Person versehen sein oder von der verantwortenden Person signiert und auf einem sicheren Übermittlungsweg gemäß § 130a ZPO nach näherer Maßgabe der Verordnung über die technischen Rahmenbedingungen des elektronischen Rechtsverkehrs und über das besondere elektronische Behördenpostfach (BGBl. I, S.3803) eingereicht werden. Weitere Informationen erhalten Sie auf der Internetseite www.justiz.de.\nDer Widerspruch muss spätestens innerhalb der gesetzten Frist nach dem Datum der Bekanntmachung der Löschungsankündigung bei dem Amtsgericht - Registergericht - Düsseldorf eingegangen sein.  Dies gilt auch dann, wenn der Widerspruch zur Niederschrift der Geschäftsstelle eines anderen Amtsgerichtes abgegeben wurde. Die Frist beginnt mit dem Tage der Bekanntmachung der Löschungsankündigung in dem für die Bekanntmachung der Eintragungen in das Handelsregister bestimmten elektronischen Informations- und Kommunikationssystem nach § 10 des Handelsgesetzbuches. Fällt das Ende der Frist auf einen Sonntag, einen allgemeinen Feiertag oder Sonnabend, so endet die Frist mit Ablauf des nächsten Werktages.\nDer Widerspruch muss die Bezeichnung der angefochtenen Löschungsankündigung sowie die Erklärung enthalten, dass Widerspruch gegen diese Löschungsankündigung eingelegt wird. Er ist zu unterzeichnen und soll begründet werden."
    },
    {
      "date": "2025-05-22",
      "id": "110001",
      "original_text": "Registerbekanntmachung nach dem Umwandlungsgesetz\nNordrhein-Westfalen Amtsgericht Essen HRB 34128\nOstsee LNG Terminal GmbH – Essen",
      "type": "Registerbekanntmachung nach dem Umwandlungsgesetz",
      "state": "Nordrhein-Westfalen",
      "amtsgericht": "Amtsgericht Essen",
      "registernummer": "HRB 34128",
      "registerart": "HRB",
      "company_name": "Ostsee LNG Terminal GmbH",
      "company_seat": "Essen",
      "details": "22.05.2025 (Bekanntmachungsdatum)\n\nNordrhein-Westfalen Amtsgericht Essen HRB 34128\nRegisterbekanntmachung nach dem Umwandlungsgesetz 22.05.2025 (Eintragungsdatum)\n\nOstsee LNG Terminal GmbH\nGesellschaft mit beschränkter Haftung\nEssen\n\nDen Gläubigern der an der Verschmelzung beteiligten Rechtsträger ist, wenn sie binnen sechs Monaten nach dem Tag, an dem die Eintragung der Verschmelzung in das Register des Sitzes derjenigen Rechtsträger deren Gläubiger sie sind, nach § 19 Absatz 3 UmwG als bekanntgemacht gilt, ihren Anspruch nach Grund und Höhe schriftlich anmelden, Sicherheit zu leisten, soweit sie nicht Befriedigung verlangen können. Dieses Recht steht den Gläubigern jedoch nur zu, wenn sie glaubhaft machen, dass durch die Verschmelzung die Erfüllung ihrer Forderung gefährdet wird."
    },
    {
      "date": "2025-05-22",
      "id": "110002",
      "original_text": "Löschungsankündigung\nNordrhein-Westfalen Amtsgericht Paderborn HRB 10670\nEMpower Fitness Lippstadt GmbH – Lippstadt",
      "type": "Löschungsankündigung",
      "state": "Nordrhein-Westfalen",
      "amtsgericht": "Amtsgericht Paderborn",
      "registernummer": "HRB 10670",
      "registerart": "HRB",
      "company_name": "EMpower Fitness Lippstadt GmbH",
      "company_seat": "Lippstadt",
      "details": "22.05.2025 (Bekanntmachungsdatum)\n\nNordrhein-Westfalen Amtsgericht Paderborn HRB 10670\nLöschungsankündigung\n\nEMpower Fitness Lippstadt GmbH\nGesellschaft mit beschränkter Haftung\nLippstadt\n\nDas Registergericht beabsichtigt die Gesellschaft von Amts wegen nach § 394 FamFG zu löschen. Die Frist zur Erhebung eines Widerspruchs ist auf einen Monat festgesetzt."
    },
    {
      "date": "2025-05-22",
      "id": "110003",
      "original_text": "Registerbekanntmachung nach dem Umwandlungsgesetz\nNordrhein-Westfalen Amtsgericht Gütersloh HRA 4350\nBekleidung Fabrik Heiner Bessmann seit 1898 GmbH & Co. KG. – Harsewinkel",
      "type": "Registerbekanntmachung nach dem Umwandlungsgesetz",
      "state": "Nordrhein-Westfalen",
      "amtsgericht": "Amtsgericht Gütersloh",
      "registernummer": "HRA 4350",
      "registerart": "HRA",
      "company_name": "Bekleidung Fabrik Heiner Bessmann seit 1898 GmbH & Co. KG.",
      "company_seat": "Harsewinkel",
      "details": "22.05.2025 (Bekanntmachungsdatum)\n\nNordrhein-Westfalen Amtsgericht Gütersloh HRA 4350\nRegisterbekanntmachung nach dem Umwandlungsgesetz 22.05.2025 (Eintragungsdatum)\n\nBekleidung Fabrik Heiner Bessmann seit 1898 GmbH & Co. KG.\nKommanditgesellschaft\nHarsewinkel\n\nDen Gläubigern der an der Verschmelzung beteiligten Rechtsträger ist, wenn sie binnen sechs Monaten nach dem Tag, an dem die Eintragung der Verschmelzung in das Register des Sitzes desjenigen Rechtsträgers, dessen Gläubiger sie sind, nach § 19 Absatz 3 UmwG als bekanntgemacht gilt, ihren Anspruch nach Grund und Höhe schriftlich anmelden, Sicherheit zu leisten, soweit sie nicht Befriedigung verlangen können. Dieses Recht steht den Gläubigern jedoch nur zu, wenn sie glaubhaft machen, dass durch die Verschmelzung die Erfüllung ihrer Forderung gefährdet wird."
    },
    {
      "date": "2025-05-22",
      "id": "110004",
      "original_text": "Löschungsankündigung\nThüringen Amtsgericht Jena HRB 505953\nMercurius Verwaltungs GmbH – Blankenhain",
      "type": "Löschungsankündigung",
      "state": "Thüringen",
      "amtsgericht": "Amtsgericht Jena",
      "registernummer": "HRB 505953",
      "registerart": "HRB",
      "company_name": "Mercurius Verwaltungs GmbH",
      "company_seat": "Blankenhain",
      "details": "22.05.2025 (Bekanntmachungsdatum)\n\nThüringen Amtsgericht Jena HRB 505953\nLöschungsankündigung\n\nMercurius Verwaltungs GmbH\nGesellschaft mit beschränkter Haftung\nBlankenhain\n\nDas Registergericht beabsichtigt, die im Handelsregister eingetragene Gesellschaft wegen Vermögenslosigkeit nach § 394 FamFG von Amts wegen zu löschen. Die Frist zur Erhebung eines Widerspruchs gegen die beabsichtigte Löschung wird auf 6 Wochen festgesetzt."
    },
    {
      "date": "2025-05-22",
      "id": "110005",
      "original_text": "Registerbekanntmachung nach dem Umwandlungsgesetz\nHessen Amtsgericht Frankfurt am Main HRB 84569\norim Trade Europe GmbH – Frankfurt am Main",
      "type": "Registerbekanntmachung nach dem Umwandlungsgesetz",
      "state": "Hessen",
      "amtsgericht": "Amtsgericht Frankfurt am Main",
      "registernummer": "HRB 84569",
      "registerart": "HRB",
      "company_name": "orim Trade Europe GmbH",
      "company_seat": "Frankfurt am Main",
      "details": "22.05.2025 (Bekanntmachungsdatum)\n\nHessen Amtsgericht Frankfurt am Main HRB 84569\nRegisterbekanntmachung nach dem Umwandlungsgesetz 22.05.2025 (Eintragungsdatum)\n\norim Trade Europe GmbH\nGesellschaft mit beschränkter Haftung\nFrankfurt am Main\n\nDen Gläubigern der an der Verschmelzung beteiligten Rechtsträger ist, wenn sie binnen sechs Monaten nach dem Tag, an dem die Eintragung der Verschmelzung in das Register des Sitzes derjenigen Rechtsträger deren Gläubiger sie sind, nach § 19 Absatz 3 UmwG bekannt gemacht worden ist, ihren Anspruch nach Grund und Höhe schriftlich anmelden, Sicherheit zu leisten, soweit sie nicht Befriedigung verlangen können. Dieses Recht steht den Gläubigern jedoch nur zu, wenn sie glaubhaft machen, dass durch die Verschmelzung die Erfüllung ihrer Forderung gefährdet wird."
    },
    {
      "date": "2025-05-22",
      "id": "110006",
      "original_text": "Löschungsankündigung\nHessen Amtsgericht Frankfurt am Main HRB 115952\nBolongarostraße 61-63a GmbH – Frankfurt am Main",
      "type": "Löschungsankündigung",
      "state": "Hessen",
      "amtsgericht": "Amtsgericht Frankfurt am Main",
      "registernummer": "HRB 115952",
      "registerart": "HRB",
      "company_name": "Bolongarostraße 61-63a GmbH",
      "company_seat": "Frankfurt am Main",
      "details": "22.05.2025 (Bekanntmachungsdatum)\n\nHessen Amtsgericht Frankfurt am Main HRB 115952\nLöschungsankündigung\n\nBolongarostraße 61-63a GmbH\nGesellschaft mit beschränkter Haftung\nFrankfurt am Main\n\nDas Registergericht beabsichtigt die im Handelsregister eingetragene Gesellschaft von Amts wegen nach § 394 FamFG zu löschen. Die Frist zur Erhebung eines Widerspruchs gegen die beabsichtigte Löschung wird auf 1 Monat festgesetzt."
    },
    {
      "date": "2025-05-22",
      "id": "110007",
      "original_text": "Sonstige Registerbekanntmachung\nHessen Amtsgericht Frankfurt am Main HRB 7037\nHLB Basis AG – Frankfurt am Main",
      "type": "Sonstige Registerbekanntmachung",
      "state": "Hessen",
      "amtsgericht": "Amtsgericht Frankfurt am Main",
      "registernummer": "HRB 7037",
      "registerart": "HRB",
      "company_name": "HLB Basis AG",
      "company_seat": "Frankfurt am Main",
      "details": "22.05.2025 (Bekanntmachungsdatum)\n\nHessen Amtsgericht Frankfurt am Main HRB 7037\nSonstige Registerbekanntmachung\n\nHLB Basis AG\nAktiengesellschaft\nFrankfurt am Main\n\nDurch eine Änderung in den Personen der Aufsichtsratsmitglieder ist eine Liste der Mitglieder des Aufsichtsrates zum Handelsregister eingereicht worden."
    },
    {
      "date": "2025-05-22",
      "id": "110008",
      "original_text": "Sonstige Registerbekanntmachung\nHessen Amtsgericht Darmstadt VR 720\nRenn- und Touring Club Darmstadt-Eberstadt e.V. im ADAC – Darmstadt-Eberstadt",
      "type": "Sonstige Registerbekanntmachung",
      "state": "Hessen",
      "amtsgericht": "Amtsgericht Darmstadt",
      "registernummer": "VR 720",
      "registerart": "VR",
      "company_name": "Renn- und Touring Club Darmstadt-Eberstadt e.V. im ADAC",
      "company_seat": "Darmstadt-Eberstadt",
      "details": "22.05.2025 (Bekanntmachungsdatum)\n\nHessen Amtsgericht Darmstadt VR 720\nSonstige Registerbekanntmachung 22.05.2025 (Eintragungsdatum)\n\nRenn- und Touring Club Darmstadt-Eberstadt e.V. im ADAC\neingetragener Verein\nDarmstadt-Eberstadt\n\nDer Verein ist aufgelöst."
    },
    {
      "date": "2025-05-22",
      "id": "110009",
      "original_text": "Einreichung neuer Dokumente\nHessen Amtsgericht Hanau HRB 94473\nNORMA Group SE – Maintal",
      "type": "Einreichung neuer Dokumente",
      "state": "Hessen",
      "amtsgericht": "Amtsgericht Hanau",
      "registernummer": "HRB 94473",
      "registerart": "HRB",
      "company_name": "NORMA Group SE",
      "company_seat": "Maintal",
      "details": "22.05.2025 (Bekanntmachungsdatum)\n\nHessen Amtsgericht Hanau HRB 94473\nEinreichung neuer Dokumente\n\nNORMA Group SE\nEuropäische Aktiengesellschaft (SE)\nMaintal\n\nDurch eine Änderung in den Personen der Aufsichtsratsmitglieder ist eine Liste der Mitglieder des Aufsichtsrates zum Handelsregister eingereicht worden."
    },
    {
      "date": "2025-05-22",
      "id": "110010",
      "original_text": "Einreichung neuer Dokumente\nHessen Amtsgericht Darmstadt HRB 1818\nCarl Schenck Aktiengesellschaft – Darmstadt",
      "type": "Einreichung neuer Dokumente",
      "state": "Hessen",
      "amtsgericht": "Amtsgericht Darmstadt",
      "registernummer": "HRB 1818",
      "registerart": "HRB",
      "company_name": "Carl Schenck Aktiengesellschaft",
      "company_seat": "Darmstadt",
      "details": "22.05.2025 (Bekanntmachungsdatum)\n\nHessen Amtsgericht Darmstadt HRB 1818\nEinreichung neuer Dokumente 22.05.2025 (Eintragungsdatum)\n\nCarl Schenck Aktiengesellschaft\nAktiengesellschaft\nDarmstadt\n\nWegen Änderungen in den Personen der Aufsichtsratsmitglieder ist eine Liste der Mitglieder des Aufsichtsrates zum Handelsregister eingereicht worden."
    },
    {
      "date": "2025-05-22",
      "id": "110011",
      "original_text": "Löschungsankündigung\nHessen Amtsgericht Offenbach am Main HRB 48276\nNOVUM GmbH – Offenbach am Main",
      "type": "Löschungsankündigung",
      "state": "Hessen",
      "amtsgericht": "Amtsgericht Offenbach am Main",
      "registernummer": "HRB 48276",
      "registerart": "HRB",
      "company_name": "NOVUM GmbH",
      "company_seat": "Offenbach am Main",
      "details": "22.05.2025 (Bekanntmachungsdatum)\n\nHessen Amtsgericht Offenbach am Main HRB 48276\nLöschungsankündigung\n\nNOVUM GmbH\nGesellschaft mit beschränkter Haftung\nOffenbach am Main\n\nDas Registergericht beabsichtigt die im Handelsregister eingetragene Geselslchaft von Amts wegen nach § 394 FamFG zu löschen. Die Frist zur Erhebung eines Widerspruchs gegen die beabsichtigte Löschung wird auf 3 Monate festgesetzt."
    },
    {
      "date": "2025-05-22",
      "id": "110012",
      "original_text": "Löschungsankündigung\nHessen Amtsgericht Frankfurt am Main HRB 104774\nNova Dream GmbH – Frankfurt am Main",
      "type": "Löschungsankündigung",
      "state": "Hessen",
      "amtsgericht": "Amtsgericht Frankfurt am Main",
      "registernummer": "HRB 104774",
      "registerart": "HRB",
      "company_name": "Nova Dream GmbH",
      "company_seat": "Frankfurt am Main",
      "details": "22.05.2025 (Bekanntmachungsdatum)\n\nHessen Amtsgericht Frankfurt am Main HRB 104774\nLöschungsankündigung\n\nNova Dream GmbH\nGesellschaft mit beschränkter Haftung\nFrankfurt am Main\n\nEs ist beabsichtigt, die am 03. Juli 2024 eingetragene Geschäftsanschrift gemäß § 395 FamFG von Amts wegen im Handelsregister zu löschen.\nDie Eigentümerin der Immobilie hat mitgeteilt, dass das Unternehmen dort nicht geschäftsansässig ist und eine Erlaubnis ihrerseits zur Verwendung ihrer Privatanschrift nicht erteilt wurde.\nGemäß § 395 FamFG kann eine Eintragung welche mangels einer wesentlichen Voraussetzung unzulässig ist, gelöscht werden."
    },
    {
      "date": "2025-05-22",
      "id": "110013",
      "original_text": "Löschungsankündigung\nHessen Amtsgericht Frankfurt am Main HRB 104774\nNova Dream GmbH – Frankfurt am Main",
      "type": "Löschungsankündigung",
      "state": "Hessen",
      "amtsgericht": "Amtsgericht Frankfurt am Main",
      "registernummer": "HRB 104774",
      "registerart": "HRB",
      "company_name": "Nova Dream GmbH",
      "company_seat": "Frankfurt am Main",
      "details": "22.05.2025 (Bekanntmachungsdatum)\n\nHessen Amtsgericht Frankfurt am Main HRB 104774\nLöschungsankündigung\n\nNova Dream GmbH\nGesellschaft mit beschränkter Haftung\nFrankfurt am Main\n\nEs ist beabsichtigt, die am 03. Juli 2024 eingetragene Geschäftsanschrift gemäß § 395 FamFG von Amts wegen im Handelsregister zu löschen.\nDie Eigentümerin der Immobilie hat mitgeteilt, dass das Unternehmen dort nicht geschäftsansässig ist und eine Erlaubnis ihrerseits zur Verwendung ihrer Privatanschrift nicht erteilt wurde.\nGemäß § 395 FamFG kann eine Eintragung welche mangels einer wesentlichen Voraussetzung unzulässig ist, gelöscht werden.\nHiergegen kann innerhalb eines Monats nach dieser Veröffentlichung Widerspruch bei dem Amtsgericht Frankfurt am Main eingelegt werden."
    },
    {
      "date": "2025-05-22",
      "id": "110014",
      "original_text": "Registerbekanntmachung nach dem Umwandlungsgesetz\nHessen Amtsgericht Frankfurt am Main HRB 80245\nDBM Fonds II GmbH – Frankfurt am Main",
      "type": "Registerbekanntmachung nach dem Umwandlungsgesetz",
      "state": "Hessen",
      "amtsgericht": "Amtsgericht Frankfurt am Main",
      "registernummer": "HRB 80245",
      "registerart": "HRB",
      "company_name": "DBM Fonds II GmbH",
      "company_seat": "Frankfurt am Main",
      "details": "22.05.2025 (Bekanntmachungsdatum)\n\nHessen Amtsgericht Frankfurt am Main HRB 80245\nRegisterbekanntmachung nach dem Umwandlungsgesetz 22.05.2025 (Eintragungsdatum)\n\nDBM Fonds II GmbH\nGesellschaft mit beschränkter Haftung\nFrankfurt am Main\n\nDen Gläubigern der an der Verschmelzung beteiligten Rechtsträger ist, wenn sie binnen sechs Monaten nach dem Tag, an dem die Eintragung der Verschmelzung in das Register des Sitzes derjenigen Rechtsträger deren Gläubiger sie sind, nach § 19 Absatz 3 UmwG bekannt gemacht worden ist, ihren Anspruch nach Grund und Höhe schriftlich anmelden, Sicherheit zu leisten, soweit sie nicht Befriedigung verlangen können. Dieses Recht steht den Gläubigern jedoch nur zu, wenn sie glaubhaft machen, dass durch die Verschmelzung die Erfüllung ihrer Forderung gefährdet wird."
    },
    {
      "date": "2025-05-22",
      "id": "110015",
      "original_text": "Registerbekanntmachung nach dem Umwandlungsgesetz\nHessen Amtsgericht Frankfurt am Main HRB 57273\nDBM Fonds GmbH – Frankfurt am Main",
      "type": "Registerbekanntmachung nach dem Umwandlungsgesetz",
      "state": "Hessen",
      "amtsgericht": "Amtsgericht Frankfurt am Main",
      "registernummer": "HRB 57273",
      "registerart": "HRB",
      "company_name": "DBM Fonds GmbH",
      "company_seat": "Frankfurt am Main",
      "details": "22.05.2025 (Bekanntmachungsdatum)\n\nHessen Amtsgericht Frankfurt am Main HRB 57273\nRegisterbekanntmachung nach dem Umwandlungsgesetz 22.05.2025 (Eintragungsdatum)\n\nDBM Fonds GmbH\nGesellschaft mit beschränkter Haftung\nFrankfurt am Main\n\nDen Gläubigern der an der Verschmelzung beteiligten Rechtsträger ist, wenn sie binnen sechs Monaten nach dem Tag, an dem die Eintragung der Verschmelzung in das Register des Sitzes derjenigen Rechtsträger deren Gläubiger sie sind, nach § 19 Absatz 3 UmwG bekannt gemacht worden ist, ihren Anspruch nach Grund und Höhe schriftlich anmelden, Sicherheit zu leisten, soweit sie nicht Befriedigung verlangen können. Dieses Recht steht den Gläubigern jedoch nur zu, wenn sie glaubhaft machen, dass durch die Verschmelzung die Erfüllung ihrer Forderung gefährdet wird."
    },
    {
      "date": "2025-05-22",
      "id": "110016",
      "original_text": "Sonstige Registerbekanntmachung\nHessen Amtsgericht Darmstadt VR 40295\nANATOLISCHE - JUGEND S-V – Birkenau",
      "type": "Sonstige Registerbekanntmachung",
      "state": "Hessen",
      "amtsgericht": "Amtsgericht Darmstadt",
      "registernummer": "VR 40295",
      "registerart": "VR",
      "company_name": "ANATOLISCHE - JUGEND S-V",
      "company_seat": "Birkenau",
      "details": "22.05.2025 (Bekanntmachungsdatum)\n\nHessen Amtsgericht Darmstadt VR 40295\nSonstige Registerbekanntmachung 22.05.2025 (Eintragungsdatum)\n\nANATOLISCHE - JUGEND S-V\neingetragener Verein\nBirkenau\n\nDer Verein ist aufgelöst."
    },
    {
      "date": "2025-05-22",
      "id": "110017",
      "original_text": "Einreichung neuer Dokumente\nHessen Amtsgericht Frankfurt am Main HRB 50142\narago Consulting GmbH – Frankfurt am Main",
      "type": "Einreichung neuer Dokumente",
      "state": "Hessen",
      "amtsgericht": "Amtsgericht Frankfurt am Main",
      "registernummer": "HRB 50142",
      "registerart": "HRB",
      "company_name": "arago Consulting GmbH",
      "company_seat": "Frankfurt am Main",
      "details": "22.05.2025 (Bekanntmachungsdatum)\n\nHessen Amtsgericht Frankfurt am Main HRB 50142\nEinreichung neuer Dokumente\n\narago Consulting GmbH\nGesellschaft mit beschränkter Haftung\nFrankfurt am Main\n\nDurch eine Änderung in den Personen der Aufsichtsratsmitglieder ist eine Liste der Mitglieder des Aufsichtsrates zum Handelsregister eingereicht worden."
    },
    {
      "date": "2025-05-22",
      "id": "110018",
      "original_text": "Löschungsankündigung\nHessen Amtsgericht Frankfurt am Main HRB 133289\nNTG Express GmbH – Frankfurt am Main",
      "type": "Löschungsankündigung",
      "state": "Hessen",
      "amtsgericht": "Amtsgericht Frankfurt am Main",
      "registernummer": "HRB 133289",
      "registerart": "HRB",
      "company_name": "NTG Express GmbH",
      "company_seat": "Frankfurt am Main",
      "details": "22.05.2025 (Bekanntmachungsdatum)\n\nHessen Amtsgericht Frankfurt am Main HRB 133289\nLöschungsankündigung\n\nNTG Express GmbH\nGesellschaft mit beschränkter Haftung\nFrankfurt am Main\n\nEs ist beabsichtigt, die Gesellschaft wegen Vermögenslosigkeit gemäß § 394 FamFG von Amts wegen im Handelsregister zu löschen. Hiergegen kann innerhalb eines Monats nach dieser Veröffentlichung Widerspruch bei dem Amtsgericht Frankfurt am Main eingelegt werden."
    },
    {
      "date": "2025-05-22",
      "id": "110019",
      "original_text": "Löschungsankündigung\nHessen Amtsgericht Frankfurt am Main HRB 119548\nB & B GmbH – Frankfurt am Main",
      "type": "Löschungsankündigung",
      "state": "Hessen",
      "amtsgericht": "Amtsgericht Frankfurt am Main",
      "registernummer": "HRB 119548",
      "registerart": "HRB",
      "company_name": "B & B GmbH",
      "company_seat": "Frankfurt am Main",
      "details": "22.05.2025 (Bekanntmachungsdatum)\n\nHessen Amtsgericht Frankfurt am Main HRB 119548\nLöschungsankündigung\n\nB & B GmbH\nGesellschaft mit beschränkter Haftung\nFrankfurt am Main\n\nDas Registergericht beabsichtigt die im Handelsregister eingetragene Gesellschaft von Amts wegen nach § 394 FamFG zu löschen. Die Frist zur Erhebung eines Widerspruchs gegen die beabsichtigte Löschung wird auf 1 Monate festgesetzt."
    },
    {
      "date": "2025-05-22",
      "id": "110020",
      "original_text": "Sonstige Registerbekanntmachung\nHessen Amtsgericht Frankfurt am Main HRB 9937\nUniversal-Investment-Gesellschaft mit beschränkter Haftung – Frankfurt am Main",
      "type": "Sonstige Registerbekanntmachung",
      "state": "Hessen",
      "amtsgericht": "Amtsgericht Frankfurt am Main",
      "registernummer": "HRB 9937",
      "registerart": "HRB",
      "company_name": "Universal-Investment-Gesellschaft mit beschränkter Haftung",
      "company_seat": "Frankfurt am Main",
      "details": "22.05.2025 (Bekanntmachungsdatum)\n\nHessen Amtsgericht Frankfurt am Main HRB 9937\nSonstige Registerbekanntmachung\n\nUniversal-Investment-Gesellschaft mit beschränkter Haftung\nGesellschaft mit beschränkter Haftung\nFrankfurt am Main\n\nDurch eine Änderung in den Personen der Aufsichtsratsmitglieder ist eine Liste der Mitglieder des Aufsichtsrates zum Handelsregister eingereicht worden."
    },
    {
      "date": "2025-05-22",
      "id": "110021",
      "original_text": "Sonstige Registerbekanntmachung\nHessen Amtsgericht Frankfurt am Main HRB 99686\nTauris Capital AG – Frankfurt am Main",
      "type": "Sonstige Registerbekanntmachung",
      "state": "Hessen",
      "amtsgericht": "Amtsgericht Frankfurt am Main",
      "registernummer": "HRB 99686",
      "registerart": "HRB",
      "company_name": "Tauris Capital AG",
      "company_seat": "Frankfurt am Main",
      "details": "22.05.2025 (Bekanntmachungsdatum)\n\nHessen Amtsgericht Frankfurt am Main HRB 99686\nSonstige Registerbekanntmachung 22.05.2025 (Eintragungsdatum)\n\nTauris Capital AG\nAktiengesellschaft\nFrankfurt am Main\n\nDurch eine Änderung in den Personen der Aufsichtsratsmitglieder ist eine Liste der Mitglieder des Aufsichtsrates zum Handelsregister eingereicht worden."
    },
    {
      "date": "2025-05-22",
      "id": "110022",
      "original_text": "Löschungsankündigung\nHessen Amtsgericht Frankfurt am Main HRB 46724\nVision Direct Werbeagentur GmbH – Frankfurt am Main",
      "type": "Löschungsankündigung",
      "state": "Hessen",
      "amtsgericht": "Amtsgericht Frankfurt am Main",
      "registernummer": "HRB 46724",
      "registerart": "HRB",
      "company_name": "Vision Direct Werbeagentur GmbH",
      "company_seat": "Frankfurt am Main",
      "details": "22.05.2025 (Bekanntmachungsdatum)\n\nHessen Amtsgericht Frankfurt am Main HRB 46724\nLöschungsankündigung\n\nVision Direct Werbeagentur GmbH\nGesellschaft mit beschränkter Haftung\nFrankfurt am Main\n\nDas Registergericht beabsichtigt die im Handelsregister eingetragene Gesellschaft von Amts wegen nach § 394 FamFG zu löschen. Die Frist zur Erhebung eines Widerspruchs gegen die beabsichtigte Löschung wird auf 1 Monat festgesetzt."
    },
    {
      "date": "2025-05-22",
      "id": "110023",
      "original_text": "Sonstige Registerbekanntmachung\nHessen Amtsgericht Darmstadt VR 84482\nHundehilfe Kosovo e.V. – Heppenheim",
      "type": "Sonstige Registerbekanntmachung",
      "state": "Hessen",
      "amtsgericht": "Amtsgericht Darmstadt",
      "registernummer": "VR 84482",
      "registerart": "VR",
      "company_name": "Hundehilfe Kosovo e.V.",
      "company_seat": "Heppenheim",
      "details": "22.05.2025 (Bekanntmachungsdatum)\n\nHessen Amtsgericht Darmstadt VR 84482\nSonstige Registerbekanntmachung 22.05.2025 (Eintragungsdatum)\n\nHundehilfe Kosovo e.V.\neingetragener Verein\nHeppenheim\n\nDer Verein ist aufgelöst."
    },
    {
      "date": "2025-05-22",
      "id": "110024",
      "original_text": "Registerbekanntmachung nach dem Umwandlungsgesetz\nHessen Amtsgericht Frankfurt am Main HRB 84491\nmiro Marketing + Service GmbH – Frankfurt am Main",
      "type": "Registerbekanntmachung nach dem Umwandlungsgesetz",
      "state": "Hessen",
      "amtsgericht": "Amtsgericht Frankfurt am Main",
      "registernummer": "HRB 84491",
      "registerart": "HRB",
      "company_name": "miro Marketing + Service GmbH",
      "company_seat": "Frankfurt am Main",
      "details": "22.05.2025 (Bekanntmachungsdatum)\n\nHessen Amtsgericht Frankfurt am Main HRB 84491\nRegisterbekanntmachung nach dem Umwandlungsgesetz 22.05.2025 (Eintragungsdatum)\n\nmiro Marketing + Service GmbH\nGesellschaft mit beschränkter Haftung\nFrankfurt am Main\n\nDen Gläubigern der an der Verschmelzung beteiligten Rechtsträger ist, wenn sie binnen sechs Monaten nach dem Tag, an dem die Eintragung der Verschmelzung in das Register des Sitzes derjenigen Rechtsträger deren Gläubiger sie sind, nach § 19 Absatz 3 UmwG bekannt gemacht worden ist, ihren Anspruch nach Grund und Höhe schriftlich anmelden, Sicherheit zu leisten, soweit sie nicht Befriedigung verlangen können. Dieses Recht steht den Gläubigern jedoch nur zu, wenn sie glaubhaft machen, dass durch die Verschmelzung die Erfüllung ihrer Forderung gefährdet wird."
    },
    {
      "date": "2025-05-22",
      "id": "110025",
      "original_text": "Registerbekanntmachung nach dem Umwandlungsgesetz\nHessen Amtsgericht Offenbach am Main HRB 30378\nArrow Eastern Europe GmbH – Neu-Isenburg",
      "type": "Registerbekanntmachung nach dem Umwandlungsgesetz",
      "state": "Hessen",
      "amtsgericht": "Amtsgericht Offenbach am Main",
      "registernummer": "HRB 30378",
      "registerart": "HRB",
      "company_name": "Arrow Eastern Europe GmbH",
      "company_seat": "Neu-Isenburg",
      "details": "22.05.2025 (Bekanntmachungsdatum)\n\nHessen Amtsgericht Offenbach am Main HRB 30378\nRegisterbekanntmachung nach dem Umwandlungsgesetz 22.05.2025 (Eintragungsdatum)\n\nArrow Eastern Europe GmbH\nGesellschaft mit beschränkter Haftung\nNeu-Isenburg\n\nDen Gläubigern der an der Verschmelzung beteiligten Rechtsträger ist, wenn sie binnen sechs Monaten nach dem Tag, an dem die Eintragung der Verschmelzung in das Register des Sitzes desjenigen Rechtsträgers, dessen Gläubiger sie sind, nach § 19 Absatz 3 UmwG bekannt gemacht worden ist, ihren Anspruch nach Grund und Höhe schriftlich anmelden, Sicherheit zu leisten, soweit sie nicht Befriedigung verlangen können. Dieses Recht steht den Gläubigern jedoch nur zu, wenn sie glaubhaft machen, dass durch die Verschmelzung die Erfüllung ihrer Forderung gefährdet wird."
    },
    {
      "date": "2025-05-22",
      "id": "110026",
      "original_text": "Einreichung neuer Dokumente\nHessen Amtsgericht Wiesbaden HRB 31192\nCHEMIE Pensionsfonds AG – Wiesbaden",
      "type": "Einreichung neuer Dokumente",
      "state": "Hessen",
      "amtsgericht": "Amtsgericht Wiesbaden",
      "registernummer": "HRB 31192",
      "registerart": "HRB",
      "company_name": "CHEMIE Pensionsfonds AG",
      "company_seat": "Wiesbaden",
      "details": "22.05.2025 (Bekanntmachungsdatum)\n\nHessen Amtsgericht Wiesbaden HRB 31192\nEinreichung neuer Dokumente 22.05.2025 (Eintragungsdatum)\n\nCHEMIE Pensionsfonds AG\nAktiengesellschaft\nWiesbaden\n\nDurch eine Änderung in den Personen der Aufsichtsratsmitglieder ist eine Liste der Mitglieder des Aufsichtsrates zum Handelsregister eingereicht worden."
    },
    {
      "date": "2025-05-22",
      "id": "110027",
      "original_text": "Registerbekanntmachung nach dem Umwandlungsgesetz\nHessen Amtsgericht Gießen HRB 1343\nSPIE Lück GmbH – Lich",
      "type": "Registerbekanntmachung nach dem Umwandlungsgesetz",
      "state": "Hessen",
      "amtsgericht": "Amtsgericht Gießen",
      "registernummer": "HRB 1343",
      "registerart": "HRB",
      "company_name": "SPIE Lück GmbH",
      "company_seat": "Lich",
      "details": "22.05.2025 (Bekanntmachungsdatum)\n\nHessen Amtsgericht Gießen HRB 1343\nRegisterbekanntmachung nach dem Umwandlungsgesetz 22.05.2025 (Eintragungsdatum)\n\nSPIE Lück GmbH\nGesellschaft mit beschränkter Haftung\nLich\n\nDen Gläubigern der an der Abspaltung beteiligten Rechtsträger ist, wenn sie binnen sechs Monaten nach dem Tag, an dem die Eintragung der Abspaltung in das Register des Sitzes desjenigen Rechtsträgers, dessen Gläubiger sie sind, nach §§ 125, 19 Absatz 3 UmwG bekannt gemacht worden ist, ihren Anspruch nach Grund und Höhe schriftlich anmelden, Sicherheit zu leisten, soweit sie nicht Befriedigung verlangen können. Dieses Recht steht den Gläubigern jedoch nur zu, wenn sie glaubhaft machen, dass durch die Abspaltung die Erfüllung ihrer Forderung gefährdet wird."
    },
    {
      "date": "2025-05-22",
      "id": "110028",
      "original_text": "Löschungsankündigung\nHessen Amtsgericht Frankfurt am Main HRB 118887\nCTM Consulting Chemische, Technische, Mikrobiologische GmbH – Frankfurt am Main",
      "type": "Löschungsankündigung",
      "state": "Hessen",
      "amtsgericht": "Amtsgericht Frankfurt am Main",
      "registernummer": "HRB 118887",
      "registerart": "HRB",
      "company_name": "CTM Consulting Chemische, Technische, Mikrobiologische GmbH",
      "company_seat": "Frankfurt am Main",
      "details": "22.05.2025 (Bekanntmachungsdatum)\n\nHessen Amtsgericht Frankfurt am Main HRB 118887\nLöschungsankündigung\n\nCTM Consulting Chemische, Technische, Mikrobiologische GmbH\nGesellschaft mit beschränkter Haftung\nFrankfurt am Main\n\nEs ist beabsichtigt, die Gesellschaft wegen Vermögenslosigkeit gemäß § 394 FamFG von Amts wegen im Handelsregister zu löschen. Hiergegen kann innerhalb eines Monats nach dieser Veröffentlichung Widerspruch bei dem Amtsgericht Frankfurt am Main eingelegt werden."
    },
    {
      "date": "2025-05-22",
      "id": "110029",
      "original_text": "Registerbekanntmachung nach dem Umwandlungsgesetz\nHessen Amtsgericht Offenbach am Main HRB 10386\nTimeWare Gesellschaft für Zeitarbeitssoftware und Systemlösungen mbH – Heusenstamm",
      "type": "Registerbekanntmachung nach dem Umwandlungsgesetz",
      "state": "Hessen",
      "amtsgericht": "Amtsgericht Offenbach am Main",
      "registernummer": "HRB 10386",
      "registerart": "HRB",
      "company_name": "TimeWare Gesellschaft für Zeitarbeitssoftware und Systemlösungen mbH",
      "company_seat": "Heusenstamm",
      "details": "22.05.2025 (Bekanntmachungsdatum)\n\nHessen Amtsgericht Offenbach am Main HRB 10386\nRegisterbekanntmachung nach dem Umwandlungsgesetz 22.05.2025 (Eintragungsdatum)\n\nTimeWare Gesellschaft für Zeitarbeitssoftware und Systemlösungen mbH\nGesellschaft mit beschränkter Haftung\nHeusenstamm\n\nDen Gläubigern der an der Verschmelzung beteiligten Rechtsträger ist, wenn sie binnen sechs Monaten nach dem Tag, an dem die Eintragung der Verschmelzung in das Register des Sitzes desjenigen Rechtsträgers, dessen Gläubiger sie sind, nach § 19 Absatz 3 UmwG bekannt gemacht worden ist, ihren Anspruch nach Grund und Höhe schriftlich anmelden, Sicherheit zu leisten, soweit sie nicht Befriedigung verlangen können. Dieses Recht steht den Gläubigern jedoch nur zu, wenn sie glaubhaft machen, dass durch die Verschmelzung die Erfüllung ihrer Forderung gefährdet wird."
    },
    {
      "date": "2025-05-22",
      "id": "110030",
      "original_text": "Löschungsankündigung\nHessen Amtsgericht Frankfurt am Main HRB 129357\nTR Hoch- und Tiefbau UG (haftungsbeschränkt) – Frankfurt am Main",
      "type": "Löschungsankündigung",
      "state": "Hessen",
      "amtsgericht": "Amtsgericht Frankfurt am Main",
      "registernummer": "HRB 129357",
      "registerart": "HRB",
      "company_name": "TR Hoch- und Tiefbau UG (haftungsbeschränkt)",
      "company_seat": "Frankfurt am Main",
      "details": "22.05.2025 (Bekanntmachungsdatum)\n\nHessen Amtsgericht Frankfurt am Main HRB 129357\nLöschungsankündigung\n\nTR Hoch- und Tiefbau UG (haftungsbeschränkt)\nGesellschaft mit beschränkter Haftung\nFrankfurt am Main\n\nDas Registergericht beabsichtigt die im Handelsregister eingetragene Gesellschaft von Amts wegen nach § 394 FamFG zu löschen. Die Frist zur Erhebung eines Widerspruchs gegen die beabsichtigte Löschung wird auf 1 Monat festgesetzt."
    }
  ]
}