{
  "date": "2025-05-20",
  "date_of_scrape": "2025-05-31T11:06:21.822Z",
  "tool_version": "0.2.0",
  "number_of_announcements": 138,
  "announcements": [
    {
      "date": "2025-05-20",
      "id": "109556",
      "original_text": "Registerbekanntmachung nach dem Umwandlungsgesetz\nBayern Amtsgericht München HRB 200801\nFormycon AG – München",
      "type": "Registerbekanntmachung nach dem Umwandlungsgesetz",
      "state": "Bayern",
      "amtsgericht": "Amtsgericht München",
      "registernummer": "HRB 200801",
      "registerart": "HRB",
      "company_name": "Formycon AG",
      "company_seat": "München",
      "details": "20.05.2025 (Bekanntmachungsdatum)\n\nBayern Amtsgericht München HRB 200801\nRegisterbekanntmachung nach dem Umwandlungsgesetz\n\nFormycon AG\nAktiengesellschaft\nMünchen\n\nDem Amtsgericht München -Registergericht- ist der Entwurf eines Verschmelzungsvertrages zwischen der Gesellschaft als übernehmendem Rechtsträger und der Clinical Research GmbH, Holzkirchen (Amtsgericht München HRB 213211) zur Einsichtnahme eingereicht worden."
    },
    {
      "date": "2025-05-20",
      "id": "109557",
      "original_text": "Registerbekanntmachung nach dem Umwandlungsgesetz\nBayern Amtsgericht Kempten (Allgäu) HRA 11662\nBikesports Bernd Holzer e.K. – Kempten (Allgäu)",
      "type": "Registerbekanntmachung nach dem Umwandlungsgesetz",
      "state": "Bayern",
      "amtsgericht": "Amtsgericht Kempten (Allgäu)",
      "registernummer": "HRA 11662",
      "registerart": "HRA",
      "company_name": "Bikesports Bernd Holzer e.K.",
      "company_seat": "Kempten (Allgäu)",
      "details": "20.05.2025 (Bekanntmachungsdatum)\n\nBayern Amtsgericht Kempten (Allgäu) HRA 11662\nRegisterbekanntmachung nach dem Umwandlungsgesetz 19.05.2025 (Eintragungsdatum)\n\nBikesports Bernd Holzer e.K.\nEinzelkaufmann / Einzelkauffrau\nKempten (Allgäu)\n\nDas Unternehmen Bikesports Bernd Holzer e.K. (HRA 11662 Amtsgericht Kempten (Allgäu)) ist auf die Bikesports Holzer OHG (HRA 11671 Amtsgericht Kempten (Allgäu)) ausgegliedert.\nDen Gläubigern der an der Ausgliederung beteiligten Rechtsträger ist, wenn sie binnen sechs Monaten nach dem Tag, an dem die Eintragung der Ausgliederung in das Register des Sitzes desjenigen Rechtsträgers, dessen Gläubiger sie sind, nach §§ 125, 19 Abs. 3 UmwG als bekannt gemacht gilt, ihren Anspruch nach Grund und Höhe in Textform anmelden, Sicherheit zu leisten, soweit sie nicht Befriedigung verlangen können. Dieses Recht steht den Gläubigern jedoch nur zu, wenn sie glaubhaft machen, dass durch die Ausgliederung die Erfüllung ihrer Forderung gefährdet wird."
    },
    {
      "date": "2025-05-20",
      "id": "109558",
      "original_text": "Einreichung neuer Dokumente\nBayern Amtsgericht München HRB 227195\nAllane SE – Pullach i.Isartal",
      "type": "Einreichung neuer Dokumente",
      "state": "Bayern",
      "amtsgericht": "Amtsgericht München",
      "registernummer": "HRB 227195",
      "registerart": "HRB",
      "company_name": "Allane SE",
      "company_seat": "Pullach i.Isartal",
      "details": "20.05.2025 (Bekanntmachungsdatum)\n\nBayern Amtsgericht München HRB 227195\nEinreichung neuer Dokumente\n\nAllane SE\nEuropäische Aktiengesellschaft (SE)\nPullach i.Isartal\n\nDem #Re.Name ist eine Liste der Mitglieder des Aufsichtsrats eingereicht worden, Art. 9 Abs. 1 Buchst. c (ii) SE-VO i.V.m. § 106 AktG."
    },
    {
      "date": "2025-05-20",
      "id": "109559",
      "original_text": "Löschungsankündigung\nBayern Amtsgericht Fürth HRB 18629\nASI Aviation Sales International GmbH – Neustadt a.d.Aisch",
      "type": "Löschungsankündigung",
      "state": "Bayern",
      "amtsgericht": "Amtsgericht Fürth",
      "registernummer": "HRB 18629",
      "registerart": "HRB",
      "company_name": "ASI Aviation Sales International GmbH",
      "company_seat": "Neustadt a.d.Aisch",
      "details": "20.05.2025 (Bekanntmachungsdatum)\n\nBayern Amtsgericht Fürth HRB 18629\nLöschungsankündigung\n\nASI Aviation Sales International GmbH\nGesellschaft mit beschränkter Haftung\nNeustadt a.d.Aisch\n\nDas Registergericht beabsichtigt, die im Handelsregister eingetragene Gesellschaft wegen Vermögenslosigkeit von Amts wegen nach § 394 FamFG zu löschen. Die Frist zur Erhebung eines Widerspruchs ist auf drei Monate festgesetzt."
    },
    {
      "date": "2025-05-20",
      "id": "109560",
      "original_text": "Löschungsankündigung\nBayern Amtsgericht Bayreuth HRA 3948\nMR Bioenergie Bayreuth UG (haftungsbeschränkt) & Co. KG – Bayreuth",
      "type": "Löschungsankündigung",
      "state": "Bayern",
      "amtsgericht": "Amtsgericht Bayreuth",
      "registernummer": "HRA 3948",
      "registerart": "HRA",
      "company_name": "MR Bioenergie Bayreuth UG (haftungsbeschränkt) & Co. KG",
      "company_seat": "Bayreuth",
      "details": "20.05.2025 (Bekanntmachungsdatum)\n\nBayern Amtsgericht Bayreuth HRA 3948\nLöschungsankündigung\n\nMR Bioenergie Bayreuth UG (haftungsbeschränkt) & Co. KG\nKommanditgesellschaft\nBayreuth\n\nDas Registergericht beabsichtigt, die im Handelsregister eingetragene Firma wegen Vermögenslosigkeit von Amts wegen nach § 394 FamFG zu löschen. Die Frist zur Erhebung eines Widerspruchs ist auf einen Monat festgesetzt."
    },
    {
      "date": "2025-05-20",
      "id": "109561",
      "original_text": "Löschungsankündigung\nBayern Amtsgericht Nürnberg HRA 14563\nJ.S. Immobilienbeteiligungen e. K. – Nürnberg",
      "type": "Löschungsankündigung",
      "state": "Bayern",
      "amtsgericht": "Amtsgericht Nürnberg",
      "registernummer": "HRA 14563",
      "registerart": "HRA",
      "company_name": "J.S. Immobilienbeteiligungen e. K.",
      "company_seat": "Nürnberg",
      "details": "20.05.2025 (Bekanntmachungsdatum)\n\nBayern Amtsgericht Nürnberg HRA 14563\nLöschungsankündigung\n\nJ.S. Immobilienbeteiligungen e. K.\nEinzelkaufmann / Einzelkauffrau\nNürnberg\n\nDas Registergericht beabsichtigt, die im Handelsregister eingetragene Firma von Amts wegen nach § 31 Abs. 2 HGB zu löschen. Die Frist zur Erhebung eines Widerspruchs ist auf einen Monat festgesetzt."
    },
    {
      "date": "2025-05-20",
      "id": "109562",
      "original_text": "Registerbekanntmachung nach dem Umwandlungsgesetz\nBayern Amtsgericht Traunstein HRA 14978\nChristopher Klemenz eK – Ampfing",
      "type": "Registerbekanntmachung nach dem Umwandlungsgesetz",
      "state": "Bayern",
      "amtsgericht": "Amtsgericht Traunstein",
      "registernummer": "HRA 14978",
      "registerart": "HRA",
      "company_name": "Christopher Klemenz eK",
      "company_seat": "Ampfing",
      "details": "20.05.2025 (Bekanntmachungsdatum)\n\nBayern Amtsgericht Traunstein HRA 14978\nRegisterbekanntmachung nach dem Umwandlungsgesetz 19.05.2025 (Eintragungsdatum)\n\nChristopher Klemenz eK\nEinzelkaufmann / Einzelkauffrau\nAmpfing\n\nDen Gläubigern der an der Ausgliederung beteiligten Rechtsträger ist, wenn sie binnen sechs Monaten nach dem Tag, an dem die Eintragung der Ausgliederung in das Register des Sitzes desjenigen Rechtsträgers, dessen Gläubiger sie sind, nach §§ 125, 19 Abs. 3 UmwG als bekannt gemacht gilt, ihren Anspruch nach Grund und Höhe in Textform anmelden, Sicherheit zu leisten, soweit sie nicht Befriedigung verlangen können. Dieses Recht steht den Gläubigern jedoch nur zu, wenn sie glaubhaft machen, dass durch die Ausgliederung die Erfüllung ihrer Forderung gefährdet wird."
    },
    {
      "date": "2025-05-20",
      "id": "109563",
      "original_text": "Registerbekanntmachung nach dem Umwandlungsgesetz\nBayern Amtsgericht München HRB 300859\nDie Pflegepraktiker GmbH – Maisach",
      "type": "Registerbekanntmachung nach dem Umwandlungsgesetz",
      "state": "Bayern",
      "amtsgericht": "Amtsgericht München",
      "registernummer": "HRB 300859",
      "registerart": "HRB",
      "company_name": "Die Pflegepraktiker GmbH",
      "company_seat": "Maisach",
      "details": "20.05.2025 (Bekanntmachungsdatum)\n\nBayern Amtsgericht München HRB 300859\nRegisterbekanntmachung nach dem Umwandlungsgesetz 19.05.2025 (Eintragungsdatum)\n\nDie Pflegepraktiker GmbH\nGesellschaft mit beschränkter Haftung\nMaisach\n\nDen Gläubigern der an der Ausgliederung beteiligten Rechtsträger ist, wenn sie binnen sechs Monaten nach dem Tag, an dem die Eintragung der Ausgliederung in das Register des Sitzes desjenigen Rechtsträgers, dessen Gläubiger sie sind, nach §§ 125, 19 Abs. 3 UmwG als bekannt gemacht gilt, ihren Anspruch nach Grund und Höhe in Textform anmelden, Sicherheit zu leisten, soweit sie nicht Befriedigung verlangen können. Dieses Recht steht den Gläubigern jedoch nur zu, wenn sie glaubhaft machen, dass durch die Ausgliederung die Erfüllung ihrer Forderung gefährdet wird."
    },
    {
      "date": "2025-05-20",
      "id": "109564",
      "original_text": "Löschungsankündigung\nBayern Amtsgericht München HRB 258505\nSmart Delivery Solutions GmbH – München",
      "type": "Löschungsankündigung",
      "state": "Bayern",
      "amtsgericht": "Amtsgericht München",
      "registernummer": "HRB 258505",
      "registerart": "HRB",
      "company_name": "Smart Delivery Solutions GmbH",
      "company_seat": "München",
      "details": "20.05.2025 (Bekanntmachungsdatum)\n\nBayern Amtsgericht München HRB 258505\nLöschungsankündigung 19.05.2025 (Eintragungsdatum)\n\nSmart Delivery Solutions GmbH\nGesellschaft mit beschränkter Haftung\nMünchen\n\nDas Registergericht beabsichtigt, die im Handelsregister eingetragene Gesellschaft wegen Vermögenslosigkeit von Amts wegen nach § 394 FamFG zu löschen. Die Frist zur Erhebung eines Widerspruchs ist auf drei Monate festgesetzt."
    },
    {
      "date": "2025-05-20",
      "id": "109565",
      "original_text": "Registerbekanntmachung nach dem Umwandlungsgesetz\nBayern Amtsgericht München HRB 278613\nSMS Verwaltungs GmbH – München",
      "type": "Registerbekanntmachung nach dem Umwandlungsgesetz",
      "state": "Bayern",
      "amtsgericht": "Amtsgericht München",
      "registernummer": "HRB 278613",
      "registerart": "HRB",
      "company_name": "SMS Verwaltungs GmbH",
      "company_seat": "München",
      "details": "20.05.2025 (Bekanntmachungsdatum)\n\nBayern Amtsgericht München HRB 278613\nRegisterbekanntmachung nach dem Umwandlungsgesetz 19.05.2025 (Eintragungsdatum)\n\nSMS Verwaltungs GmbH\nGesellschaft mit beschränkter Haftung\nMünchen\n\nDen Gläubigern der an der Verschmelzung beteiligten Rechtsträger ist, wenn sie binnen sechs Monaten nach dem Tag, an dem die Eintragung der Verschmelzung in das Register des Sitzes desjenigen Rechtsträgers, dessen Gläubiger sie sind, nach § 19 Abs. 3 UmwG als bekannt gemacht gilt, ihren Anspruch nach Grund und Höhe in Textform anmelden, Sicherheit zu leisten, soweit sie nicht Befriedigung verlangen können. Dieses Recht steht den Gläubigern jedoch nur zu, wenn sie glaubhaft machen, dass durch die Verschmelzung die Erfüllung ihrer Forderung gefährdet wird."
    },
    {
      "date": "2025-05-20",
      "id": "109566",
      "original_text": "Registerbekanntmachung nach dem Umwandlungsgesetz\nBayern Amtsgericht München HRA 116711\nMosa Ventures e.K. – München",
      "type": "Registerbekanntmachung nach dem Umwandlungsgesetz",
      "state": "Bayern",
      "amtsgericht": "Amtsgericht München",
      "registernummer": "HRA 116711",
      "registerart": "HRA",
      "company_name": "Mosa Ventures e.K.",
      "company_seat": "München",
      "details": "20.05.2025 (Bekanntmachungsdatum)\n\nBayern Amtsgericht München HRA 116711\nRegisterbekanntmachung nach dem Umwandlungsgesetz 19.05.2025 (Eintragungsdatum)\n\nMosa Ventures e.K.\nEinzelkaufmann / Einzelkauffrau\nMünchen\n\nDen Gläubigern der an der Ausgliederung beteiligten Rechtsträger ist, wenn sie binnen sechs Monaten nach dem Tag, an dem die Eintragung der Ausgliederung in das Register des Sitzes desjenigen Rechtsträgers, dessen Gläubiger sie sind, nach §§ 125, 19 Abs. 3 UmwG als bekannt gemacht gilt, ihren Anspruch nach Grund und Höhe in Textform anmelden, Sicherheit zu leisten, soweit sie nicht Befriedigung verlangen können. Dieses Recht steht den Gläubigern jedoch nur zu, wenn sie glaubhaft machen, dass durch die Ausgliederung die Erfüllung ihrer Forderung gefährdet wird."
    },
    {
      "date": "2025-05-20",
      "id": "109567",
      "original_text": "Registerbekanntmachung nach dem Umwandlungsgesetz\nBayern Amtsgericht Augsburg VR 1875\nNordschwäbischer Dartverband e.V. – Augsburg",
      "type": "Registerbekanntmachung nach dem Umwandlungsgesetz",
      "state": "Bayern",
      "amtsgericht": "Amtsgericht Augsburg",
      "registernummer": "VR 1875",
      "registerart": "VR",
      "company_name": "Nordschwäbischer Dartverband e.V.",
      "company_seat": "Augsburg",
      "details": "20.05.2025 (Bekanntmachungsdatum)\n\nBayern Amtsgericht Augsburg VR 1875\nRegisterbekanntmachung nach dem Umwandlungsgesetz 19.05.2025 (Eintragungsdatum)\n\nNordschwäbischer Dartverband e.V.\neingetragener Verein\nAugsburg\n\nDen Gläubigern der an der Verschmelzung beteiligten Rechtsträger ist, wenn sie binnen sechs Monaten nach dem Tag, an dem die Eintragung der Verschmelzung in das Register des Sitzes desjenigen Rechtsträgers, dessen Gläubiger sie sind, nach § 19 Abs. 3 UmwG als bekannt gemacht gilt, ihren Anspruch nach Grund und Höhe in Textform anmelden, Sicherheit zu leisten, soweit sie nicht Befriedigung verlangen können. Dieses Recht steht den Gläubigern jedoch nur zu, wenn sie glaubhaft machen, dass durch die Verschmelzung die Erfüllung ihrer Forderung gefährdet wird."
    },
    {
      "date": "2025-05-20",
      "id": "109568",
      "original_text": "Registerbekanntmachung nach dem Umwandlungsgesetz\nBayern Amtsgericht München HRB 289472\nUniCredit Bank GmbH – München",
      "type": "Registerbekanntmachung nach dem Umwandlungsgesetz",
      "state": "Bayern",
      "amtsgericht": "Amtsgericht München",
      "registernummer": "HRB 289472",
      "registerart": "HRB",
      "company_name": "UniCredit Bank GmbH",
      "company_seat": "München",
      "details": "20.05.2025 (Bekanntmachungsdatum)\n\nBayern Amtsgericht München HRB 289472\nRegisterbekanntmachung nach dem Umwandlungsgesetz 19.05.2025 (Eintragungsdatum)\n\nUniCredit Bank GmbH\nGesellschaft mit beschränkter Haftung\nMünchen\n\nDen Gläubigern der an der Verschmelzung beteiligten Rechtsträger ist, wenn sie binnen sechs Monaten nach dem Tag, an dem die Eintragung der Verschmelzung in das Register des Sitzes desjenigen Rechtsträgers, dessen Gläubiger sie sind, nach § 19 Abs. 3 UmwG als bekannt gemacht gilt, ihren Anspruch nach Grund und Höhe in Textform anmelden, Sicherheit zu leisten, soweit sie nicht Befriedigung verlangen können. Dieses Recht steht den Gläubigern jedoch nur zu, wenn sie glaubhaft machen, dass durch die Verschmelzung die Erfüllung ihrer Forderung gefährdet wird."
    },
    {
      "date": "2025-05-20",
      "id": "109569",
      "original_text": "Registerbekanntmachung nach dem Umwandlungsgesetz\nBayern Amtsgericht Aschaffenburg HRA 6661\nDirk Sayer Moped e. K. – Aschaffenburg",
      "type": "Registerbekanntmachung nach dem Umwandlungsgesetz",
      "state": "Bayern",
      "amtsgericht": "Amtsgericht Aschaffenburg",
      "registernummer": "HRA 6661",
      "registerart": "HRA",
      "company_name": "Dirk Sayer Moped e. K.",
      "company_seat": "Aschaffenburg",
      "details": "20.05.2025 (Bekanntmachungsdatum)\n\nBayern Amtsgericht Aschaffenburg HRA 6661\nRegisterbekanntmachung nach dem Umwandlungsgesetz 19.05.2025 (Eintragungsdatum)\n\nDirk Sayer Moped e. K.\nEinzelkaufmann / Einzelkauffrau\nAschaffenburg\n\nDen Gläubigern der an der Ausgliederung beteiligten Rechtsträger ist, wenn sie binnen sechs Monaten nach dem Tag, an dem die Eintragung der Ausgliederung in das Register des Sitzes desjenigen Rechtsträgers, dessen Gläubiger sie sind, nach §§ 125, 19 Abs. 3 UmwG als bekannt gemacht gilt, ihren Anspruch nach Grund und Höhe in Textform anmelden, Sicherheit zu leisten, soweit sie nicht Befriedigung verlangen können. Dieses Recht steht den Gläubigern jedoch nur zu, wenn sie glaubhaft machen, dass durch die Ausgliederung die Erfüllung ihrer Forderung gefährdet wird."
    },
    {
      "date": "2025-05-20",
      "id": "109570",
      "original_text": "Registerbekanntmachung nach dem Umwandlungsgesetz\nBayern Amtsgericht Traunstein HRB 18972\nWINGPRINT UG (haftungsbeschränkt) – Stephanskirchen",
      "type": "Registerbekanntmachung nach dem Umwandlungsgesetz",
      "state": "Bayern",
      "amtsgericht": "Amtsgericht Traunstein",
      "registernummer": "HRB 18972",
      "registerart": "HRB",
      "company_name": "WINGPRINT UG (haftungsbeschränkt)",
      "company_seat": "Stephanskirchen",
      "details": "20.05.2025 (Bekanntmachungsdatum)\n\nBayern Amtsgericht Traunstein HRB 18972\nRegisterbekanntmachung nach dem Umwandlungsgesetz 19.05.2025 (Eintragungsdatum)\n\nWINGPRINT UG (haftungsbeschränkt)\nGesellschaft mit beschränkter Haftung\nStephanskirchen\n\nDen Gläubigern der an der Verschmelzung beteiligten Rechtsträger ist, wenn sie binnen sechs Monaten nach dem Tag, an dem die Eintragung der Verschmelzung in das Register des Sitzes desjenigen Rechtsträgers, dessen Gläubiger sie sind, nach § 19 Abs. 3 UmwG als bekannt gemacht gilt, ihren Anspruch nach Grund und Höhe in Textform anmelden, Sicherheit zu leisten, soweit sie nicht Befriedigung verlangen können. Dieses Recht steht den Gläubigern jedoch nur zu, wenn sie glaubhaft machen, dass durch die Verschmelzung die Erfüllung ihrer Forderung gefährdet wird."
    },
    {
      "date": "2025-05-20",
      "id": "109571",
      "original_text": "Registerbekanntmachung nach dem Umwandlungsgesetz\nBayern Amtsgericht Memmingen HRB 19227\nLauber Verwaltungs GmbH – Neu-Ulm",
      "type": "Registerbekanntmachung nach dem Umwandlungsgesetz",
      "state": "Bayern",
      "amtsgericht": "Amtsgericht Memmingen",
      "registernummer": "HRB 19227",
      "registerart": "HRB",
      "company_name": "Lauber Verwaltungs GmbH",
      "company_seat": "Neu-Ulm",
      "details": "20.05.2025 (Bekanntmachungsdatum)\n\nBayern Amtsgericht Memmingen HRB 19227\nRegisterbekanntmachung nach dem Umwandlungsgesetz 19.05.2025 (Eintragungsdatum)\n\nLauber Verwaltungs GmbH\nGesellschaft mit beschränkter Haftung\nNeu-Ulm\n\nDen Gläubigern des formwechselnden Rechtsträgers ist, wenn sie binnen sechs Monaten nach dem Tag, an dem die Eintragung des Formwechsels nach § 201 UmwG als bekannt gemacht gilt, ihren Anspruch nach Grund und Höhe in Textform anmelden, Sicherheit zu leisten, soweit sie nicht Befriedigung verlangen können. Dieses Recht steht den Gläubigern jedoch nur zu, wenn sie glaubhaft machen, dass durch den Formwechsel die Erfüllung ihrer Forderung gefährdet wird."
    },
    {
      "date": "2025-05-20",
      "id": "109572",
      "original_text": "Registerbekanntmachung nach dem Umwandlungsgesetz\nBayern Amtsgericht Kempten (Allgäu) HRA 11671\nBikesports Holzer OHG – Kempten (Allgäu)",
      "type": "Registerbekanntmachung nach dem Umwandlungsgesetz",
      "state": "Bayern",
      "amtsgericht": "Amtsgericht Kempten (Allgäu)",
      "registernummer": "HRA 11671",
      "registerart": "HRA",
      "company_name": "Bikesports Holzer OHG",
      "company_seat": "Kempten (Allgäu)",
      "details": "20.05.2025 (Bekanntmachungsdatum)\n\nBayern Amtsgericht Kempten (Allgäu) HRA 11671\nRegisterbekanntmachung nach dem Umwandlungsgesetz 19.05.2025 (Eintragungsdatum)\n\nBikesports Holzer OHG\nOffene Handelsgesellschaft\nKempten (Allgäu)\n\nDas Unternehmen Bikesports Bernd Holzer e.K. (HRA 11662 Amtsgericht Kempten (Allgäu) wurde im Wege der Ausgliederung von der Bikesports Holzer OHG (HRA 11671 Amtsgericht Kempten (Allgäu) übernommen.\nDen Gläubigern der an der Ausgliederung beteiligten Rechtsträger ist, wenn sie binnen sechs Monaten nach dem Tag, an dem die Eintragung der Ausgliederung in das Register des Sitzes desjenigen Rechtsträgers, dessen Gläubiger sie sind, nach §§ 125, 19 Abs. 3 UmwG als bekannt gemacht gilt, ihren Anspruch nach Grund und Höhe in Textform anmelden, Sicherheit zu leisten, soweit sie nicht Befriedigung verlangen können. Dieses Recht steht den Gläubigern jedoch nur zu, wenn sie glaubhaft machen, dass durch die Ausgliederung die Erfüllung ihrer Forderung gefährdet wird."
    },
    {
      "date": "2025-05-20",
      "id": "109573",
      "original_text": "Registerbekanntmachung nach dem Umwandlungsgesetz\nBayern Amtsgericht Traunstein HRB 11701\nGesundheitszentrum Dorfen GmbH – Wasserburg a. Inn",
      "type": "Registerbekanntmachung nach dem Umwandlungsgesetz",
      "state": "Bayern",
      "amtsgericht": "Amtsgericht Traunstein",
      "registernummer": "HRB 11701",
      "registerart": "HRB",
      "company_name": "Gesundheitszentrum Dorfen GmbH",
      "company_seat": "Wasserburg a. Inn",
      "details": "20.05.2025 (Bekanntmachungsdatum)\n\nBayern Amtsgericht Traunstein HRB 11701\nRegisterbekanntmachung nach dem Umwandlungsgesetz 19.05.2025 (Eintragungsdatum)\n\nGesundheitszentrum Dorfen GmbH\nGesellschaft mit beschränkter Haftung\nWasserburg a. Inn\n\nDen Gläubigern der an der Verschmelzung beteiligten Rechtsträger ist, wenn sie binnen sechs Monaten nach dem Tag, an dem die Eintragung der Verschmelzung in das Register des Sitzes desjenigen Rechtsträgers, dessen Gläubiger sie sind, nach § 19 Abs. 3 UmwG als bekannt gemacht gilt, ihren Anspruch nach Grund und Höhe in Textform anmelden, Sicherheit zu leisten, soweit sie nicht Befriedigung verlangen können. Dieses Recht steht den Gläubigern jedoch nur zu, wenn sie glaubhaft machen, dass durch die Verschmelzung die Erfüllung ihrer Forderung gefährdet wird."
    },
    {
      "date": "2025-05-20",
      "id": "109574",
      "original_text": "Registerbekanntmachung nach dem Umwandlungsgesetz\nBayern Amtsgericht München HRB 290150\nANR Espressobar UG (haftungsbeschränkt) – München",
      "type": "Registerbekanntmachung nach dem Umwandlungsgesetz",
      "state": "Bayern",
      "amtsgericht": "Amtsgericht München",
      "registernummer": "HRB 290150",
      "registerart": "HRB",
      "company_name": "ANR Espressobar UG (haftungsbeschränkt)",
      "company_seat": "München",
      "details": "20.05.2025 (Bekanntmachungsdatum)\n\nBayern Amtsgericht München HRB 290150\nRegisterbekanntmachung nach dem Umwandlungsgesetz 17.05.2025 (Eintragungsdatum)\n\nANR Espressobar UG (haftungsbeschränkt)\nGesellschaft mit beschränkter Haftung\nMünchen\n\nDen Gläubigern der an der Verschmelzung beteiligten Rechtsträger ist, wenn sie binnen sechs Monaten nach dem Tag, an dem die Eintragung der Verschmelzung in das Register des Sitzes desjenigen Rechtsträgers, dessen Gläubiger sie sind, nach § 19 Abs. 3 UmwG als bekannt gemacht gilt, ihren Anspruch nach Grund und Höhe in Textform anmelden, Sicherheit zu leisten, soweit sie nicht Befriedigung verlangen können. Dieses Recht steht den Gläubigern jedoch nur zu, wenn sie glaubhaft machen, dass durch die Verschmelzung die Erfüllung ihrer Forderung gefährdet wird."
    },
    {
      "date": "2025-05-20",
      "id": "109575",
      "original_text": "Registerbekanntmachung nach dem Umwandlungsgesetz\nBayern Amtsgericht München HRB 274358\nAmazon Deutschland E19 Transport GmbH – München",
      "type": "Registerbekanntmachung nach dem Umwandlungsgesetz",
      "state": "Bayern",
      "amtsgericht": "Amtsgericht München",
      "registernummer": "HRB 274358",
      "registerart": "HRB",
      "company_name": "Amazon Deutschland E19 Transport GmbH",
      "company_seat": "München",
      "details": "20.05.2025 (Bekanntmachungsdatum)\n\nBayern Amtsgericht München HRB 274358\nRegisterbekanntmachung nach dem Umwandlungsgesetz 19.05.2025 (Eintragungsdatum)\n\nAmazon Deutschland E19 Transport GmbH\nGesellschaft mit beschränkter Haftung\nMünchen\n\nDen Gläubigern der an der Verschmelzung beteiligten Rechtsträger ist, wenn sie binnen sechs Monaten nach dem Tag, an dem die Eintragung der Verschmelzung in das Register des Sitzes desjenigen Rechtsträgers, dessen Gläubiger sie sind, nach § 19 Abs. 3 UmwG als bekannt gemacht gilt, ihren Anspruch nach Grund und Höhe in Textform anmelden, Sicherheit zu leisten, soweit sie nicht Befriedigung verlangen können. Dieses Recht steht den Gläubigern jedoch nur zu, wenn sie glaubhaft machen, dass durch die Verschmelzung die Erfüllung ihrer Forderung gefährdet wird."
    },
    {
      "date": "2025-05-20",
      "id": "109576",
      "original_text": "Registerbekanntmachung nach dem Umwandlungsgesetz\nBayern Amtsgericht Traunstein HRB 11701\nGesundheitszentrum Dorfen GmbH – Wasserburg a. Inn",
      "type": "Registerbekanntmachung nach dem Umwandlungsgesetz",
      "state": "Bayern",
      "amtsgericht": "Amtsgericht Traunstein",
      "registernummer": "HRB 11701",
      "registerart": "HRB",
      "company_name": "Gesundheitszentrum Dorfen GmbH",
      "company_seat": "Wasserburg a. Inn",
      "details": "20.05.2025 (Bekanntmachungsdatum)\n\nBayern Amtsgericht Traunstein HRB 11701\nRegisterbekanntmachung nach dem Umwandlungsgesetz 19.05.2025 (Eintragungsdatum)\n\nGesundheitszentrum Dorfen GmbH\nGesellschaft mit beschränkter Haftung\nWasserburg a. Inn\n\nDen Gläubigern der an der Verschmelzung beteiligten Rechtsträger ist, wenn sie binnen sechs Monaten nach dem Tag, an dem die Eintragung der Verschmelzung in das Register des Sitzes desjenigen Rechtsträgers, dessen Gläubiger sie sind, nach § 19 Abs. 3 UmwG als bekannt gemacht gilt, ihren Anspruch nach Grund und Höhe in Textform anmelden, Sicherheit zu leisten, soweit sie nicht Befriedigung verlangen können. Dieses Recht steht den Gläubigern jedoch nur zu, wenn sie glaubhaft machen, dass durch die Verschmelzung die Erfüllung ihrer Forderung gefährdet wird."
    },
    {
      "date": "2025-05-20",
      "id": "109577",
      "original_text": "Registerbekanntmachung nach dem Umwandlungsgesetz\nBayern Amtsgericht München HRB 138300\nLudwig Beck Beteiligungs GmbH – München",
      "type": "Registerbekanntmachung nach dem Umwandlungsgesetz",
      "state": "Bayern",
      "amtsgericht": "Amtsgericht München",
      "registernummer": "HRB 138300",
      "registerart": "HRB",
      "company_name": "Ludwig Beck Beteiligungs GmbH",
      "company_seat": "München",
      "details": "20.05.2025 (Bekanntmachungsdatum)\n\nBayern Amtsgericht München HRB 138300\nRegisterbekanntmachung nach dem Umwandlungsgesetz 19.05.2025 (Eintragungsdatum)\n\nLudwig Beck Beteiligungs GmbH\nGesellschaft mit beschränkter Haftung\nMünchen\n\nDen Gläubigern der an der Verschmelzung beteiligten Rechtsträger ist, wenn sie binnen sechs Monaten nach dem Tag, an dem die Eintragung der Verschmelzung in das Register des Sitzes desjenigen Rechtsträgers, dessen Gläubiger sie sind, nach § 19 Abs. 3 UmwG als bekannt gemacht gilt, ihren Anspruch nach Grund und Höhe in Textform anmelden, Sicherheit zu leisten, soweit sie nicht Befriedigung verlangen können. Dieses Recht steht den Gläubigern jedoch nur zu, wenn sie glaubhaft machen, dass durch die Verschmelzung die Erfüllung ihrer Forderung gefährdet wird."
    },
    {
      "date": "2025-05-20",
      "id": "109578",
      "original_text": "Löschungsankündigung\nBayern Amtsgericht Nürnberg HRA 13490\nKarl Krestel gastronomische Betriebe e.K. – Nürnberg",
      "type": "Löschungsankündigung",
      "state": "Bayern",
      "amtsgericht": "Amtsgericht Nürnberg",
      "registernummer": "HRA 13490",
      "registerart": "HRA",
      "company_name": "Karl Krestel gastronomische Betriebe e.K.",
      "company_seat": "Nürnberg",
      "details": "20.05.2025 (Bekanntmachungsdatum)\n\nBayern Amtsgericht Nürnberg HRA 13490\nLöschungsankündigung\n\nKarl Krestel gastronomische Betriebe e.K.\nEinzelkaufmann / Einzelkauffrau\nNürnberg\n\nDas Registergericht beabsichtigt, die im Handelsregister eingetragene Firma von Amts wegen nach § 31 Abs. 2 HGB zu löschen. Die Frist zur Erhebung eines Widerspruchs ist auf einen Monat festgesetzt."
    },
    {
      "date": "2025-05-20",
      "id": "109579",
      "original_text": "Löschungsankündigung\nBayern Amtsgericht Hof HRB 4407\nLavaris Technologies GmbH – Hof",
      "type": "Löschungsankündigung",
      "state": "Bayern",
      "amtsgericht": "Amtsgericht Hof",
      "registernummer": "HRB 4407",
      "registerart": "HRB",
      "company_name": "Lavaris Technologies GmbH",
      "company_seat": "Hof",
      "details": "20.05.2025 (Bekanntmachungsdatum)\n\nBayern Amtsgericht Hof HRB 4407\nLöschungsankündigung\n\nLavaris Technologies GmbH\nGesellschaft mit beschränkter Haftung\nHof\n\nDas Registergericht beabsichtigt, die im Handelsregister eingetragene Gesellschaft wegen Vermögenslosigkeit von Amts wegen nach § 394 FamFG zu löschen. Die Frist zur Erhebung eines Widerspruchs ist auf sechs Wochen festgesetzt."
    },
    {
      "date": "2025-05-20",
      "id": "109580",
      "original_text": "Löschungsankündigung\nBayern Amtsgericht Coburg HRB 1402\nAutozentrum Luther Verwaltungsgesellschaft mbH – Niederfüllbach",
      "type": "Löschungsankündigung",
      "state": "Bayern",
      "amtsgericht": "Amtsgericht Coburg",
      "registernummer": "HRB 1402",
      "registerart": "HRB",
      "company_name": "Autozentrum Luther Verwaltungsgesellschaft mbH",
      "company_seat": "Niederfüllbach",
      "details": "20.05.2025 (Bekanntmachungsdatum)\n\nBayern Amtsgericht Coburg HRB 1402\nLöschungsankündigung\n\nAutozentrum Luther Verwaltungsgesellschaft mbH\nGesellschaft mit beschränkter Haftung\nNiederfüllbach\n\nDas Registergericht beabsichtigt, die im Handelsregister eingetragene Gesellschaft wegen Vermögenslosigkeit von Amts wegen nach § 394 FamFG zu löschen. Die Frist zur Erhebung eines Widerspruchs ist auf sechs Wochen festgesetzt."
    },
    {
      "date": "2025-05-20",
      "id": "109581",
      "original_text": "Registerbekanntmachung nach dem Umwandlungsgesetz\nBayern Amtsgericht München HRB 119257\nCOMP MALL Computer-Vertriebs GmbH – München",
      "type": "Registerbekanntmachung nach dem Umwandlungsgesetz",
      "state": "Bayern",
      "amtsgericht": "Amtsgericht München",
      "registernummer": "HRB 119257",
      "registerart": "HRB",
      "company_name": "COMP MALL Computer-Vertriebs GmbH",
      "company_seat": "München",
      "details": "20.05.2025 (Bekanntmachungsdatum)\n\nBayern Amtsgericht München HRB 119257\nRegisterbekanntmachung nach dem Umwandlungsgesetz 17.05.2025 (Eintragungsdatum)\n\nCOMP MALL Computer-Vertriebs GmbH\nGesellschaft mit beschränkter Haftung\nMünchen\n\nDen Gläubigern der an der Verschmelzung beteiligten Rechtsträger ist, wenn sie binnen sechs Monaten nach dem Tag, an dem die Eintragung der Verschmelzung in das Register des Sitzes desjenigen Rechtsträgers, dessen Gläubiger sie sind, nach § 19 Abs. 3 UmwG als bekannt gemacht gilt, ihren Anspruch nach Grund und Höhe in Textform anmelden, Sicherheit zu leisten, soweit sie nicht Befriedigung verlangen können. Dieses Recht steht den Gläubigern jedoch nur zu, wenn sie glaubhaft machen, dass durch die Verschmelzung die Erfüllung ihrer Forderung gefährdet wird."
    },
    {
      "date": "2025-05-20",
      "id": "109582",
      "original_text": "Registerbekanntmachung nach dem Umwandlungsgesetz\nBayern Amtsgericht München HRB 106810\nCentral European Division Wolfgang Mahling Verwaltungs GmbH – Straßlach",
      "type": "Registerbekanntmachung nach dem Umwandlungsgesetz",
      "state": "Bayern",
      "amtsgericht": "Amtsgericht München",
      "registernummer": "HRB 106810",
      "registerart": "HRB",
      "company_name": "Central European Division Wolfgang Mahling Verwaltungs GmbH",
      "company_seat": "Straßlach",
      "details": "20.05.2025 (Bekanntmachungsdatum)\n\nBayern Amtsgericht München HRB 106810\nRegisterbekanntmachung nach dem Umwandlungsgesetz 19.05.2025 (Eintragungsdatum)\n\nCentral European Division Wolfgang Mahling Verwaltungs GmbH\nGesellschaft mit beschränkter Haftung\nStraßlach\n\nDen Gläubigern der an der Verschmelzung beteiligten Rechtsträger ist, wenn sie binnen sechs Monaten nach dem Tag, an dem die Eintragung der Verschmelzung in das Register des Sitzes desjenigen Rechtsträgers, dessen Gläubiger sie sind, nach § 19 Abs. 3 UmwG als bekannt gemacht gilt, ihren Anspruch nach Grund und Höhe in Textform anmelden, Sicherheit zu leisten, soweit sie nicht Befriedigung verlangen können. Dieses Recht steht den Gläubigern jedoch nur zu, wenn sie glaubhaft machen, dass durch die Verschmelzung die Erfüllung ihrer Forderung gefährdet wird."
    },
    {
      "date": "2025-05-20",
      "id": "109583",
      "original_text": "Registerbekanntmachung nach dem Umwandlungsgesetz\nBayern Amtsgericht Würzburg HRB 803\nVerlag \"Die Schwestern-Revue\" Gesellschaft mit beschränkter Haftung – Würzburg",
      "type": "Registerbekanntmachung nach dem Umwandlungsgesetz",
      "state": "Bayern",
      "amtsgericht": "Amtsgericht Würzburg",
      "registernummer": "HRB 803",
      "registerart": "HRB",
      "company_name": "Verlag \"Die Schwestern-Revue\" Gesellschaft mit beschränkter Haftung",
      "company_seat": "Würzburg",
      "details": "20.05.2025 (Bekanntmachungsdatum)\n\nBayern Amtsgericht Würzburg HRB 803\nRegisterbekanntmachung nach dem Umwandlungsgesetz 17.05.2025 (Eintragungsdatum)\n\nVerlag \"Die Schwestern-Revue\" Gesellschaft mit beschränkter Haftung\nGesellschaft mit beschränkter Haftung\nWürzburg\n\nDen Gläubigern der an der Verschmelzung beteiligten Rechtsträger ist, wenn sie binnen sechs Monaten nach dem Tag, an dem die Eintragung der Verschmelzung in das Register des Sitzes desjenigen Rechtsträgers, dessen Gläubiger sie sind, nach § 19 Abs. 3 UmwG als bekannt gemacht gilt, ihren Anspruch nach Grund und Höhe in Textform anmelden, Sicherheit zu leisten, soweit sie nicht Befriedigung verlangen können. Dieses Recht steht den Gläubigern jedoch nur zu, wenn sie glaubhaft machen, dass durch die Verschmelzung die Erfüllung ihrer Forderung gefährdet wird."
    },
    {
      "date": "2025-05-20",
      "id": "109584",
      "original_text": "Registerbekanntmachung nach dem Umwandlungsgesetz\nBayern Amtsgericht München HRA 120825\nJeanette Carollo e.K. – Maisach",
      "type": "Registerbekanntmachung nach dem Umwandlungsgesetz",
      "state": "Bayern",
      "amtsgericht": "Amtsgericht München",
      "registernummer": "HRA 120825",
      "registerart": "HRA",
      "company_name": "Jeanette Carollo e.K.",
      "company_seat": "Maisach",
      "details": "20.05.2025 (Bekanntmachungsdatum)\n\nBayern Amtsgericht München HRA 120825\nRegisterbekanntmachung nach dem Umwandlungsgesetz 19.05.2025 (Eintragungsdatum)\n\nJeanette Carollo e.K.\nEinzelkaufmann / Einzelkauffrau\nMaisach\n\nDen Gläubigern der an der Ausgliederung beteiligten Rechtsträger ist, wenn sie binnen sechs Monaten nach dem Tag, an dem die Eintragung der Ausgliederung in das Register des Sitzes desjenigen Rechtsträgers, dessen Gläubiger sie sind, nach §§ 125, 19 Abs. 3 UmwG als bekannt gemacht gilt, ihren Anspruch nach Grund und Höhe in Textform anmelden, Sicherheit zu leisten, soweit sie nicht Befriedigung verlangen können. Dieses Recht steht den Gläubigern jedoch nur zu, wenn sie glaubhaft machen, dass durch die Ausgliederung die Erfüllung ihrer Forderung gefährdet wird."
    },
    {
      "date": "2025-05-20",
      "id": "109585",
      "original_text": "Sonstige Registerbekanntmachung\nBayern Amtsgericht Aschaffenburg HRB 17849\nDISA MOPEDSTORE GmbH – Aschaffenburg",
      "type": "Sonstige Registerbekanntmachung",
      "state": "Bayern",
      "amtsgericht": "Amtsgericht Aschaffenburg",
      "registernummer": "HRB 17849",
      "registerart": "HRB",
      "company_name": "DISA MOPEDSTORE GmbH",
      "company_seat": "Aschaffenburg",
      "details": "20.05.2025 (Bekanntmachungsdatum)\n\nBayern Amtsgericht Aschaffenburg HRB 17849\nSonstige Registerbekanntmachung 19.05.2025 (Eintragungsdatum)\n\nDISA MOPEDSTORE GmbH\nGesellschaft mit beschränkter Haftung\nAschaffenburg\n\nDen Gläubigern der an der Ausgliederung beteiligten Rechtsträger ist, wenn sie binnen sechs Monaten nach dem Tag, an dem die Eintragung der Ausgliederung in das Register des Sitzes desjenigen Rechtsträgers, dessen Gläubiger sie sind, nach §§ 125, 19 Abs. 3 UmwG als bekannt gemacht gilt, ihren Anspruch nach Grund und Höhe in Textform anmelden, Sicherheit zu leisten, soweit sie nicht Befriedigung verlangen können. Dieses Recht steht den Gläubigern jedoch nur zu, wenn sie glaubhaft machen, dass durch die Ausgliederung die Erfüllung ihrer Forderung gefährdet wird."
    },
    {
      "date": "2025-05-20",
      "id": "109586",
      "original_text": "Einreichung neuer Dokumente\nBayern Amtsgericht München HRB 301745\nEhret+Klein AG – Starnberg",
      "type": "Einreichung neuer Dokumente",
      "state": "Bayern",
      "amtsgericht": "Amtsgericht München",
      "registernummer": "HRB 301745",
      "registerart": "HRB",
      "company_name": "Ehret+Klein AG",
      "company_seat": "Starnberg",
      "details": "20.05.2025 (Bekanntmachungsdatum)\n\nBayern Amtsgericht München HRB 301745\nEinreichung neuer Dokumente\n\nEhret+Klein AG\nAktiengesellschaft\nStarnberg\n\nDem Amtsgericht München -Registergericht- ist eine Liste der Mitglieder des Aufsichtsrats eingereicht worden, § 106 AktG."
    },
    {
      "date": "2025-05-20",
      "id": "109587",
      "original_text": "Registerbekanntmachung nach dem Umwandlungsgesetz\nBaden-Württemberg Amtsgericht Mannheim HRB 740775\nHEDGEHOG Applications AG – Karlsruhe",
      "type": "Registerbekanntmachung nach dem Umwandlungsgesetz",
      "state": "Baden-Württemberg",
      "amtsgericht": "Amtsgericht Mannheim",
      "registernummer": "HRB 740775",
      "registerart": "HRB",
      "company_name": "HEDGEHOG Applications AG",
      "company_seat": "Karlsruhe",
      "details": "20.05.2025 (Bekanntmachungsdatum)\n\nBaden-Württemberg Amtsgericht Mannheim HRB 740775\nRegisterbekanntmachung nach dem Umwandlungsgesetz\n\nHEDGEHOG Applications AG\nAktiengesellschaft\nKarlsruhe\n\nDie Gesellschaft hat am 19.05.2025 den Entwurf des Verschmelzungsvertrages zwischen der  \"PHOENIS Gesellschaft für angewandte Informatik mbH\", Appenweier (Amtsgericht Freiburg im Breisgau HRB 472243 )\nund der hiesigen Gesellschaft (übernehmender Rechtsträger) zum Handelsregister eingereicht."
    },
    {
      "date": "2025-05-20",
      "id": "109588",
      "original_text": "Registerbekanntmachung nach dem Umwandlungsgesetz\nHamburg Amtsgericht Hamburg HRB 177474\nMorgan Thermal Ceramics Deutschland GmbH – Hamburg",
      "type": "Registerbekanntmachung nach dem Umwandlungsgesetz",
      "state": "Hamburg",
      "amtsgericht": "Amtsgericht Hamburg",
      "registernummer": "HRB 177474",
      "registerart": "HRB",
      "company_name": "Morgan Thermal Ceramics Deutschland GmbH",
      "company_seat": "Hamburg",
      "details": "20.05.2025 (Bekanntmachungsdatum)\n\nHamburg Amtsgericht Hamburg HRB 177474\nRegisterbekanntmachung nach dem Umwandlungsgesetz 20.05.2025 (Eintragungsdatum)\n\nMorgan Thermal Ceramics Deutschland GmbH\nGesellschaft mit beschränkter Haftung\nHamburg\n\nAls nicht eingetragen wird bekannt gemacht:\nDen Gläubigern der an der Verschmelzung beteiligten Gesellschaften ist, wenn sie binnen sechs Monaten nach dem Tag, an dem die Eintragung der Verschmelzung in das Register des Sitzes desjenigen Rechtsträgers, dessen Gläubiger sie sind, nach § 19 Absatz 3 UmwG als bekannt gemacht gilt, ihren Anspruch nach Grund und Höhe schriftlich anmelden, Sicherheit zu leisten, soweit sie nicht Befriedigung verlangen können. Dieses Recht steht den Gläubigern jedoch nur zu, wenn sie glaubhaft machen, dass durch die Verschmelzung die Erfüllung ihrer Forderung gefährdet wird."
    },
    {
      "date": "2025-05-20",
      "id": "109589",
      "original_text": "Registerbekanntmachung nach dem Umwandlungsgesetz\nBrandenburg Amtsgericht Cottbus HRB 15342\nMFPV Film GmbH – Schönefeld",
      "type": "Registerbekanntmachung nach dem Umwandlungsgesetz",
      "state": "Brandenburg",
      "amtsgericht": "Amtsgericht Cottbus",
      "registernummer": "HRB 15342",
      "registerart": "HRB",
      "company_name": "MFPV Film GmbH",
      "company_seat": "Schönefeld",
      "details": "20.05.2025 (Bekanntmachungsdatum)\n\nBrandenburg Amtsgericht Cottbus HRB 15342\nRegisterbekanntmachung nach dem Umwandlungsgesetz 20.05.2025 (Eintragungsdatum)\n\nMFPV Film GmbH\nGesellschaft mit beschränkter Haftung\nSchönefeld\n\nZu Eintragungsnummer 4 vom 20.05.2025 wird als nicht eingetragen veröffentlicht:\nDen Gläubigern der an der Verschmelzung beteiligten Rechtsträger ist, wenn sie binnen sechs Monaten nach dem Tag, an dem die Eintragung der Verschmelzung in das Register des Sitzes desjenigen Rechtsträgers, dessen Gläubiger sie sind, als bekannt gemacht gilt, ihren Anspruch nach Grund und Höhe schriftlich anmelden, Sicherheit zu leisten, soweit sie nicht Befriedigung verlangen können. Dieses Recht steht den Gläubigern jedoch nur zu, wenn sie glaubhaft machen, dass durch die Verschmelzung die Erfüllung ihrer Forderung gefährdet wird"
    },
    {
      "date": "2025-05-20",
      "id": "109590",
      "original_text": "Registerbekanntmachung nach dem Umwandlungsgesetz\nBrandenburg Amtsgericht Cottbus HRB 15501\nVEM Vermögensbeteiligung GmbH – Schönefeld",
      "type": "Registerbekanntmachung nach dem Umwandlungsgesetz",
      "state": "Brandenburg",
      "amtsgericht": "Amtsgericht Cottbus",
      "registernummer": "HRB 15501",
      "registerart": "HRB",
      "company_name": "VEM Vermögensbeteiligung GmbH",
      "company_seat": "Schönefeld",
      "details": "20.05.2025 (Bekanntmachungsdatum)\n\nBrandenburg Amtsgericht Cottbus HRB 15501\nRegisterbekanntmachung nach dem Umwandlungsgesetz 20.05.2025 (Eintragungsdatum)\n\nVEM Vermögensbeteiligung GmbH\nGesellschaft mit beschränkter Haftung\nSchönefeld\n\nZu Eintragungsnummer 7 vom 20.05.2025 wird als nicht eingetragen veröffentlicht:\nDen Gläubigern der an der Verschmelzung beteiligten Rechtsträger ist, wenn sie binnen sechs Monaten nach dem Tag, an dem die Eintragung der Verschmelzung in das Register des Sitzes desjenigen Rechtsträgers, dessen Gläubiger sie sind, als bekannt gemacht gilt, ihren Anspruch nach Grund und Höhe schriftlich anmelden, Sicherheit zu leisten, soweit sie nicht Befriedigung verlangen können. Dieses Recht steht den Gläubigern jedoch nur zu, wenn sie glaubhaft machen, dass durch die Verschmelzung die Erfüllung ihrer Forderung gefährdet wird"
    },
    {
      "date": "2025-05-20",
      "id": "109591",
      "original_text": "Löschungsankündigung\nBerlin Amtsgericht Berlin (Charlottenburg) HRB 170255\nLOT Europe UG (haftungsbeschränkt) – Berlin",
      "type": "Löschungsankündigung",
      "state": "Berlin",
      "amtsgericht": "Amtsgericht Berlin (Charlottenburg)",
      "registernummer": "HRB 170255",
      "registerart": "HRB",
      "company_name": "LOT Europe UG (haftungsbeschränkt)",
      "company_seat": "Berlin",
      "details": "20.05.2025 (Bekanntmachungsdatum)\n\nBerlin Amtsgericht Berlin (Charlottenburg) HRB 170255\nLöschungsankündigung\n\nLOT Europe UG (haftungsbeschränkt)\nGesellschaft mit beschränkter Haftung\nBerlin\n\nBei der nachstehenden Gesellschaft wird das Amtslöschungsverfahren gemäß § 394 FamFG eingeleitet. Widerspruchsfrist 6 Wochen"
    },
    {
      "date": "2025-05-20",
      "id": "109592",
      "original_text": "Sonstige Registerbekanntmachung\nBrandenburg Amtsgericht Potsdam HRB 27544\nJABIS international Trading-Consulting GmbH – Teltow",
      "type": "Sonstige Registerbekanntmachung",
      "state": "Brandenburg",
      "amtsgericht": "Amtsgericht Potsdam",
      "registernummer": "HRB 27544",
      "registerart": "HRB",
      "company_name": "JABIS international Trading-Consulting GmbH",
      "company_seat": "Teltow",
      "details": "20.05.2025 (Bekanntmachungsdatum)\n\nBrandenburg Amtsgericht Potsdam HRB 27544\nSonstige Registerbekanntmachung\n\nJABIS international Trading-Consulting GmbH\nGesellschaft mit beschränkter Haftung\nTeltow\n\nAls nicht eingetragen wird veröffentlicht: das mit Beschluss vom 23.05.2024  eingeleitete Amtslöschungsverfahren wird eingestellt."
    },
    {
      "date": "2025-05-20",
      "id": "109593",
      "original_text": "Löschungsankündigung\nBaden-Württemberg Amtsgericht Stuttgart HRB 760283\nAndreas Bedachungen GmbH – Weinstadt",
      "type": "Löschungsankündigung",
      "state": "Baden-Württemberg",
      "amtsgericht": "Amtsgericht Stuttgart",
      "registernummer": "HRB 760283",
      "registerart": "HRB",
      "company_name": "Andreas Bedachungen GmbH",
      "company_seat": "Weinstadt",
      "details": "20.05.2025 (Bekanntmachungsdatum)\n\nBaden-Württemberg Amtsgericht Stuttgart HRB 760283\nLöschungsankündigung\n\nAndreas Bedachungen GmbH\nGesellschaft mit beschränkter Haftung\nWeinstadt\n\nAls nicht eingetragen wird bekanntgemacht:\nDas Gericht beabsichtigt, die Gesellschaft wegen Vermögenslosigkeit im Handelsregister von Amts wegen nach § 394 FamFG zu löschen. Die Frist zur Geltendmachung eines Widerspruchs gegen die beabsichtigte Löschung ist auf zwei Monate ab Veröffentlichung bestimmt."
    },
    {
      "date": "2025-05-20",
      "id": "109594",
      "original_text": "Einreichung neuer Dokumente\nBrandenburg Amtsgericht Cottbus HRB 9483\n\"Wärmeversorgungsgesellschaft Königs Wusterhausen mbH\" – Königs Wusterhausen",
      "type": "Einreichung neuer Dokumente",
      "state": "Brandenburg",
      "amtsgericht": "Amtsgericht Cottbus",
      "registernummer": "HRB 9483",
      "registerart": "HRB",
      "company_name": "\"Wärmeversorgungsgesellschaft Königs Wusterhausen mbH\"",
      "company_seat": "Königs Wusterhausen",
      "details": "20.05.2025 (Bekanntmachungsdatum)\n\nBrandenburg Amtsgericht Cottbus HRB 9483\nEinreichung neuer Dokumente\n\n\"Wärmeversorgungsgesellschaft Königs Wusterhausen mbH\"\nGesellschaft mit beschränkter Haftung\nKönigs Wusterhausen\n\nDie aktuelle Liste der Aufsichtsratsmitglieder wurde zum Handelsregister gem. § 52 Abs. 3 GmbHG eingereicht."
    },
    {
      "date": "2025-05-20",
      "id": "109595",
      "original_text": "Registerbekanntmachung nach dem Umwandlungsgesetz\nHamburg Amtsgericht Hamburg HRB 98123\nGunske-Höfe GmbH – Hamburg",
      "type": "Registerbekanntmachung nach dem Umwandlungsgesetz",
      "state": "Hamburg",
      "amtsgericht": "Amtsgericht Hamburg",
      "registernummer": "HRB 98123",
      "registerart": "HRB",
      "company_name": "Gunske-Höfe GmbH",
      "company_seat": "Hamburg",
      "details": "20.05.2025 (Bekanntmachungsdatum)\n\nHamburg Amtsgericht Hamburg HRB 98123\nRegisterbekanntmachung nach dem Umwandlungsgesetz 20.05.2025 (Eintragungsdatum)\n\nGunske-Höfe GmbH\nGesellschaft mit beschränkter Haftung\nHamburg\n\nAls nicht eingetragen wird bekannt gemacht:\nDen Gläubigern der an der Verschmelzung beteiligten Gesellschaften ist, wenn sie binnen sechs Monaten nach dem Tag, an dem die Eintragung der Verschmelzung in das Register des Sitzes desjenigen Rechtsträgers, dessen Gläubiger sie sind, nach § 19 Absatz 3 UmwG als bekannt gemacht gilt, ihren Anspruch nach Grund und Höhe schriftlich anmelden, Sicherheit zu leisten, soweit sie nicht Befriedigung verlangen können. Dieses Recht steht den Gläubigern jedoch nur zu, wenn sie glaubhaft machen, dass durch die Verschmelzung die Erfüllung ihrer Forderung gefährdet wird."
    },
    {
      "date": "2025-05-20",
      "id": "109596",
      "original_text": "Registerbekanntmachung nach dem Umwandlungsgesetz\nHamburg Amtsgericht Hamburg HRB 142904\nLerchenstraße 16 Verwaltungs GmbH – Hamburg",
      "type": "Registerbekanntmachung nach dem Umwandlungsgesetz",
      "state": "Hamburg",
      "amtsgericht": "Amtsgericht Hamburg",
      "registernummer": "HRB 142904",
      "registerart": "HRB",
      "company_name": "Lerchenstraße 16 Verwaltungs GmbH",
      "company_seat": "Hamburg",
      "details": "20.05.2025 (Bekanntmachungsdatum)\n\nHamburg Amtsgericht Hamburg HRB 142904\nRegisterbekanntmachung nach dem Umwandlungsgesetz 20.05.2025 (Eintragungsdatum)\n\nLerchenstraße 16 Verwaltungs GmbH\nGesellschaft mit beschränkter Haftung\nHamburg\n\nAls nicht eingetragen wird bekannt gemacht:\nDen Gläubigern der an der Verschmelzung beteiligten Gesellschaften ist, wenn sie binnen sechs Monaten nach dem Tag, an dem die Eintragung der Verschmelzung in das Register des Sitzes desjenigen Rechtsträgers, dessen Gläubiger sie sind, nach § 19 Absatz 3 UmwG als bekannt gemacht gilt, ihren Anspruch nach Grund und Höhe schriftlich anmelden, Sicherheit zu leisten, soweit sie nicht Befriedigung verlangen können. Dieses Recht steht den Gläubigern jedoch nur zu, wenn sie glaubhaft machen, dass durch die Verschmelzung die Erfüllung ihrer Forderung gefährdet wird."
    },
    {
      "date": "2025-05-20",
      "id": "109597",
      "original_text": "Löschungsankündigung\nBrandenburg Amtsgericht Neuruppin HRB 12938\nPIK-TRANS GmbH – Schwedt/Oder",
      "type": "Löschungsankündigung",
      "state": "Brandenburg",
      "amtsgericht": "Amtsgericht Neuruppin",
      "registernummer": "HRB 12938",
      "registerart": "HRB",
      "company_name": "PIK-TRANS GmbH",
      "company_seat": "Schwedt/Oder",
      "details": "20.05.2025 (Bekanntmachungsdatum)\n\nBrandenburg Amtsgericht Neuruppin HRB 12938\nLöschungsankündigung\n\nPIK-TRANS GmbH\nGesellschaft mit beschränkter Haftung\nSchwedt/Oder\n\nBei der nachstehenden Gesellschaft wird das Amtslöschungsverfahren gemäß § 394 FamFG eingeleitet.\nWiderspruchsfrist: 1 Monat"
    },
    {
      "date": "2025-05-20",
      "id": "109598",
      "original_text": "Registerbekanntmachung nach dem Umwandlungsgesetz\nBaden-Württemberg Amtsgericht Stuttgart HRB 768216\nAdolf Schreiber GmbH – Münsingen",
      "type": "Registerbekanntmachung nach dem Umwandlungsgesetz",
      "state": "Baden-Württemberg",
      "amtsgericht": "Amtsgericht Stuttgart",
      "registernummer": "HRB 768216",
      "registerart": "HRB",
      "company_name": "Adolf Schreiber GmbH",
      "company_seat": "Münsingen",
      "details": "20.05.2025 (Bekanntmachungsdatum)\n\nBaden-Württemberg Amtsgericht Stuttgart HRB 768216\nRegisterbekanntmachung nach dem Umwandlungsgesetz 20.05.2025 (Eintragungsdatum)\n\nAdolf Schreiber GmbH\nGesellschaft mit beschränkter Haftung\nMünsingen\n\nAls nicht eingetragen wird bekanntgemacht:\nDen Gläubigern der an der Verschmelzung beteiligten Rechtsträger ist, wenn sie binnen sechs Monaten nach dem Tag, an dem die Eintragung der Verschmelzung in das Register des Sitzes desjenigen Rechtsträgers, dessen Gläubiger sie sind, nach § 19 Abs. 3 UmwG als bekanntgemacht gilt, ihren Anspruch nach Grund und Höhe schriftlich anmelden, Sicherheit zu leisten, soweit sie nicht Befriedigung verlangen können. Dieses Recht steht den Gläubigern jedoch nur zu, wenn sie glaubhaft machen, dass durch die Verschmelzung die Erfüllung ihrer Forderung gefährdet wird."
    },
    {
      "date": "2025-05-20",
      "id": "109599",
      "original_text": "Registerbekanntmachung nach dem Umwandlungsgesetz\nBerlin Amtsgericht Berlin (Charlottenburg) HRB 231246\nJuna Estate Services & Solutions GmbH – Berlin",
      "type": "Registerbekanntmachung nach dem Umwandlungsgesetz",
      "state": "Berlin",
      "amtsgericht": "Amtsgericht Berlin (Charlottenburg)",
      "registernummer": "HRB 231246",
      "registerart": "HRB",
      "company_name": "Juna Estate Services & Solutions GmbH",
      "company_seat": "Berlin",
      "details": "20.05.2025 (Bekanntmachungsdatum)\n\nBerlin Amtsgericht Berlin (Charlottenburg) HRB 231246\nRegisterbekanntmachung nach dem Umwandlungsgesetz 19.05.2025 (Eintragungsdatum)\n\nJuna Estate Services & Solutions GmbH\nGesellschaft mit beschränkter Haftung\nBerlin\n\nZu Eintragungsnummer 4 vom 19.05.2025 wird als nicht eingetragen veröffentlicht:Den Gläubigern der an der Spaltung beteiligten Rechtsträger ist, wenn sie binnen sechs Monaten nach dem Tag, an dem die Eintragung der Spaltung in das Register des Sitzes desjenigen Rechtsträgers, dessen Gläubiger sie sind, als bekannt gemacht gilt, ihren Anspruch nach Grund und Höhe schriftlich anmelden, Sicherheit zu leisten, soweit sie nicht Befriedigung verlangen können. Dieses Recht steht den Gläubigern jedoch nur zu, wenn sie glaubhaft machen, dass durch die Spaltung die Erfüllung ihrer Forderung gefährdet wird. Das Recht, Sicherheitsleistung zu verlangen, steht Gläubigern nicht zu, die im Falle der Insolvenz ein Recht auf vorzugsweise Befriedigung aus einer Deckungsmasse haben, die nach gesetzlicher Vorschrift zu ihrem Schutz errichtet und staatlich überwacht ist."
    },
    {
      "date": "2025-05-20",
      "id": "109600",
      "original_text": "Registerbekanntmachung nach dem Umwandlungsgesetz\nSachsen-Anhalt Amtsgericht Stendal HRB 113118\nRothenseer Anlagenbau GmbH – Magdeburg",
      "type": "Registerbekanntmachung nach dem Umwandlungsgesetz",
      "state": "Sachsen-Anhalt",
      "amtsgericht": "Amtsgericht Stendal",
      "registernummer": "HRB 113118",
      "registerart": "HRB",
      "company_name": "Rothenseer Anlagenbau GmbH",
      "company_seat": "Magdeburg",
      "details": "20.05.2025 (Bekanntmachungsdatum)\n\nSachsen-Anhalt Amtsgericht Stendal HRB 113118\nRegisterbekanntmachung nach dem Umwandlungsgesetz 20.05.2025 (Eintragungsdatum)\n\nRothenseer Anlagenbau GmbH\nGesellschaft mit beschränkter Haftung\nMagdeburg\n\nDie Gesellschaft ist auf Grund des Verschmelzungsvertrages vom 09.04.2025 sowie der Beschlüsse der Gesellschafterversammlungen vom selben Tag mit der ENERCON Field Services GmbH mit dem Sitz in Aurich (Amtsgericht Aurich HRB 204516) verschmolzen.  Die Verschmelzung wurde am 13.05.2025 im Register der übernehmenden Gesellschaft eingetragen (siehe AG Aurich HRB 204516). Nicht eingetragen: Den Gläubigern der an der Verschmelzung beteiligten Rechtsträger ist, wenn sie binnen sechs Monaten nach dem Tag, an dem die Eintragung der Verschmelzung nach § 19 Abs. 3 UmwG als bekanntgemacht gilt, ihren Anspruch nach Grund und Höhe schriftlich anmelden, Sicherheit zu leisten, soweit sie nicht Befriedigung verlangen können. Dieses Recht steht ihnen jedoch nur zu, wenn sie glaubhaft machen, dass durch die Verschmelzung die Erfüllung ihrer Forderung gefährdet wird."
    },
    {
      "date": "2025-05-20",
      "id": "109601",
      "original_text": "Registerbekanntmachung nach dem Umwandlungsgesetz\nSachsen-Anhalt Amtsgericht Stendal HRA 8001\nLandwirtschaftsbetrieb Dietmar Schumann e.K. – Lützen",
      "type": "Registerbekanntmachung nach dem Umwandlungsgesetz",
      "state": "Sachsen-Anhalt",
      "amtsgericht": "Amtsgericht Stendal",
      "registernummer": "HRA 8001",
      "registerart": "HRA",
      "company_name": "Landwirtschaftsbetrieb Dietmar Schumann e.K.",
      "company_seat": "Lützen",
      "details": "20.05.2025 (Bekanntmachungsdatum)\n\nSachsen-Anhalt Amtsgericht Stendal HRA 8001\nRegisterbekanntmachung nach dem Umwandlungsgesetz 20.05.2025 (Eintragungsdatum)\n\nLandwirtschaftsbetrieb Dietmar Schumann e.K.\nEinzelkaufmann / Einzelkauffrau\nLützen\n\nNicht eingetragen:\nDen Gläubigern der an der Ausgliederung beteiligten Rechtsträger, ist wenn sie binnen sechs Monaten nach dem Tag, an dem die Eintragung der Ausgliederung nach §§125, 19 Abs. 3 UmwG als bekanntgemacht gilt, ihren Anspruch nach Grund und Höhe schriftlich anmelden, Sicherheit zu leisten, soweit sie nicht Befriedigung verlangen können. Diese Recht steht ihnen jedoch nur zu, wenn sie glaubhaft machen, dass durch die Ausgliederung die Erfüllung ihrer Forderung gefährdet wird."
    },
    {
      "date": "2025-05-20",
      "id": "109602",
      "original_text": "Registerbekanntmachung nach dem Umwandlungsgesetz\nSachsen-Anhalt Amtsgericht Stendal HRA 8068\nAgrarbetrieb Gerstewitz GmbH & Co. KG – Lützen OT Gerstewitz",
      "type": "Registerbekanntmachung nach dem Umwandlungsgesetz",
      "state": "Sachsen-Anhalt",
      "amtsgericht": "Amtsgericht Stendal",
      "registernummer": "HRA 8068",
      "registerart": "HRA",
      "company_name": "Agrarbetrieb Gerstewitz GmbH & Co. KG",
      "company_seat": "Lützen OT Gerstewitz",
      "details": "20.05.2025 (Bekanntmachungsdatum)\n\nSachsen-Anhalt Amtsgericht Stendal HRA 8068\nRegisterbekanntmachung nach dem Umwandlungsgesetz 20.05.2025 (Eintragungsdatum)\n\nAgrarbetrieb Gerstewitz GmbH & Co. KG\nKommanditgesellschaft\nLützen OT Gerstewitz\n\nNicht eingetragen:\nDen Gläubigern der an der Ausgliederung beteiligten Rechtsträger, ist wenn sie binnen sechs Monaten nach dem Tag, an dem die Eintragung der Ausgliederung nach §§125, 19 Abs. 3 UmwG als bekanntgemacht gilt, ihren Anspruch nach Grund und Höhe schriftlich anmelden, Sicherheit zu leisten, soweit sie nicht Befriedigung verlangen können. Diese Recht steht ihnen jedoch nur zu, wenn sie glaubhaft machen, dass durch die Ausgliederung die Erfüllung ihrer Forderung gefährdet wird."
    },
    {
      "date": "2025-05-20",
      "id": "109603",
      "original_text": "Registerbekanntmachung nach dem Umwandlungsgesetz\nSchleswig-Holstein Amtsgericht Flensburg HRB 17633\nWohnbau Volquardsen GmbH – Struckum",
      "type": "Registerbekanntmachung nach dem Umwandlungsgesetz",
      "state": "Schleswig-Holstein",
      "amtsgericht": "Amtsgericht Flensburg",
      "registernummer": "HRB 17633",
      "registerart": "HRB",
      "company_name": "Wohnbau Volquardsen GmbH",
      "company_seat": "Struckum",
      "details": "20.05.2025 (Bekanntmachungsdatum)\n\nSchleswig-Holstein Amtsgericht Flensburg HRB 17633\nRegisterbekanntmachung nach dem Umwandlungsgesetz 19.05.2025 (Eintragungsdatum)\n\nWohnbau Volquardsen GmbH\nGesellschaft mit beschränkter Haftung\nStruckum\n\nZu Eintragungsnummer 1 vom 19.05.2025 wird als nicht eingetragen veröffentlicht: Den Gläubigern ist, wenn sie binnen sechs Monaten nach dem Tag, an dem die Eintragung der Umwandlung als bekannt gemacht gilt, ihren Anspruch nach Grund und Höhe in Textform anmelden, Sicherheit zu leisten, soweit sie nicht Befriedigung verlangen können. Dieses Recht steht den Gläubigern jedoch nur zu, wenn sie glaubhaft machen, dass durch die Umwandlung die Erfüllung ihrer Forderung gefährdet wird."
    },
    {
      "date": "2025-05-20",
      "id": "109604",
      "original_text": "Registerbekanntmachung nach dem Umwandlungsgesetz\nHamburg Amtsgericht Hamburg HRB 164091\nPLIXXENT Holding GmbH – Hamburg",
      "type": "Registerbekanntmachung nach dem Umwandlungsgesetz",
      "state": "Hamburg",
      "amtsgericht": "Amtsgericht Hamburg",
      "registernummer": "HRB 164091",
      "registerart": "HRB",
      "company_name": "PLIXXENT Holding GmbH",
      "company_seat": "Hamburg",
      "details": "20.05.2025 (Bekanntmachungsdatum)\n\nHamburg Amtsgericht Hamburg HRB 164091\nRegisterbekanntmachung nach dem Umwandlungsgesetz 12.05.2025 (Eintragungsdatum)\n\nPLIXXENT Holding GmbH\nGesellschaft mit beschränkter Haftung\nHamburg\n\nAls nicht eingetragen wird bekannt gemacht:\nDen Gläubigern der an der Verschmelzung beteiligten Gesellschaften ist, wenn sie binnen sechs Monaten nach dem Tag, an dem die Eintragung der Verschmelzung in das Register des Sitzes desjenigen Rechtsträgers, dessen Gläubiger sie sind, nach § 19 Absatz 3 UmwG als bekannt gemacht gilt, ihren Anspruch nach Grund und Höhe schriftlich anmelden, Sicherheit zu leisten, soweit sie nicht Befriedigung verlangen können. Dieses Recht steht den Gläubigern jedoch nur zu, wenn sie glaubhaft machen, dass durch die Verschmelzung die Erfüllung ihrer Forderung gefährdet wird."
    },
    {
      "date": "2025-05-20",
      "id": "109605",
      "original_text": "Registerbekanntmachung nach dem Umwandlungsgesetz\nThüringen Amtsgericht Jena HRB 518209\nCIPO4admin Holding GmbH – Uhlstädt-Kirchhasel",
      "type": "Registerbekanntmachung nach dem Umwandlungsgesetz",
      "state": "Thüringen",
      "amtsgericht": "Amtsgericht Jena",
      "registernummer": "HRB 518209",
      "registerart": "HRB",
      "company_name": "CIPO4admin Holding GmbH",
      "company_seat": "Uhlstädt-Kirchhasel",
      "details": "20.05.2025 (Bekanntmachungsdatum)\n\nThüringen Amtsgericht Jena HRB 518209\nRegisterbekanntmachung nach dem Umwandlungsgesetz 20.05.2025 (Eintragungsdatum)\n\nCIPO4admin Holding GmbH\nGesellschaft mit beschränkter Haftung\nUhlstädt-Kirchhasel\n\nNicht eingetragen: Den Gläubigern der an der Verschmelzung beteiligten Rechtsträger, ist wenn sie binnen sechs Monaten nach dem Tag, an dem die Eintragung der Verschmelzung in das Register des Sitzes desjenigen Rechtsträgers, dessen Gläubiger sie sind,  nach § 19 Abs. 3 UmwG als bekanntgemacht gilt, ihren Anspruch nach Grund und Höhe schriftlich anmelden, Sicherheit zu leisten, soweit sie nicht Befriedigung verlangen können. Dieses Recht steht ihnen jedoch nur zu, wenn sie glaubhaft machen, daß durch die Verschmelzung die Erfüllung ihrer Forderung gefährdet wird."
    },
    {
      "date": "2025-05-20",
      "id": "109606",
      "original_text": "Registerbekanntmachung nach dem Umwandlungsgesetz\nThüringen Amtsgericht Jena HRB 518371\nCIPO2do GmbH – Uhlstädt-Kirchhasel",
      "type": "Registerbekanntmachung nach dem Umwandlungsgesetz",
      "state": "Thüringen",
      "amtsgericht": "Amtsgericht Jena",
      "registernummer": "HRB 518371",
      "registerart": "HRB",
      "company_name": "CIPO2do GmbH",
      "company_seat": "Uhlstädt-Kirchhasel",
      "details": "20.05.2025 (Bekanntmachungsdatum)\n\nThüringen Amtsgericht Jena HRB 518371\nRegisterbekanntmachung nach dem Umwandlungsgesetz 20.05.2025 (Eintragungsdatum)\n\nCIPO2do GmbH\nGesellschaft mit beschränkter Haftung\nUhlstädt-Kirchhasel\n\nNicht eingetragen: Den Gläubigern der an der Verschmelzung beteiligten Rechtsträger, ist wenn sie binnen sechs Monaten nach dem Tag, an dem die Eintragung der Verschmelzung in das Register des Sitzes desjenigen Rechtsträgers, dessen Gläubiger sie sind,  nach § 19 Abs. 3 UmwG als bekanntgemacht gilt, ihren Anspruch nach Grund und Höhe schriftlich anmelden, Sicherheit zu leisten, soweit sie nicht Befriedigung verlangen können. Dieses Recht steht ihnen jedoch nur zu, wenn sie glaubhaft machen, daß durch die Verschmelzung die Erfüllung ihrer Forderung gefährdet wird."
    },
    {
      "date": "2025-05-20",
      "id": "109607",
      "original_text": "Registerbekanntmachung nach dem Umwandlungsgesetz\nMecklenburg-Vorpommern Amtsgericht Schwerin HRB 6076\nMerse & Otto Transport GmbH – Hagenow - Viez",
      "type": "Registerbekanntmachung nach dem Umwandlungsgesetz",
      "state": "Mecklenburg-Vorpommern",
      "amtsgericht": "Amtsgericht Schwerin",
      "registernummer": "HRB 6076",
      "registerart": "HRB",
      "company_name": "Merse & Otto Transport GmbH",
      "company_seat": "Hagenow - Viez",
      "details": "20.05.2025 (Bekanntmachungsdatum)\n\nMecklenburg-Vorpommern Amtsgericht Schwerin HRB 6076\nRegisterbekanntmachung nach dem Umwandlungsgesetz 20.05.2025 (Eintragungsdatum)\n\nMerse & Otto Transport GmbH\nGesellschaft mit beschränkter Haftung\nHagenow - Viez\n\nDen Gläubigern der an der Verschmelzung beteiligten Gesellschaft und des Kaufmanns ist, wenn sie binnen sechs Monaten nach dem Tag, an dem die Eintragung der Verschmelzungen in das Register des Sitzes desjenigen Rechtsträgers, dessen Gläubiger sie sind, nach § 19 Absatz 3 UmwG als bekanntgemacht gilt, ihren Anspruch nach Grund und Höhe schriftlich anmelden, Sicherheit zu leisten, soweit sie nicht Befriedigung verlangen können. Dieses Recht steht den Gläubigern jedoch nur zu, wenn sie glaubhaft machen, dass durch die Verschmelzung die Erfüllung ihrer Forderung gefährdet wird."
    },
    {
      "date": "2025-05-20",
      "id": "109608",
      "original_text": "Registerbekanntmachung nach dem Umwandlungsgesetz\nSchleswig-Holstein Amtsgericht Lübeck HRB 314 MÖ\nEN Backwarenvertriebsgesellschaft mbH – Mölln",
      "type": "Registerbekanntmachung nach dem Umwandlungsgesetz",
      "state": null,
      "amtsgericht": null,
      "registernummer": null,
      "registerart": null,
      "company_name": "EN Backwarenvertriebsgesellschaft mbH",
      "company_seat": "Mölln",
      "details": "20.05.2025 (Bekanntmachungsdatum)\n\nSchleswig-Holstein Amtsgericht Lübeck HRB 314 MÖ\nRegisterbekanntmachung nach dem Umwandlungsgesetz 20.05.2025 (Eintragungsdatum)\n\nEN Backwarenvertriebsgesellschaft mbH\nGesellschaft mit beschränkter Haftung\nMölln\n\nAls nicht eingetragen wird veröffentlicht: Den Gläubigern der an der Verschmelzung beteiligten Rechtsträger ist, wenn sie binnen sechs Monaten nach dem Tag, an dem die Eintragung der Verschmelzung in das Register des Sitzes desjenigen Rechtsträgers, dessen Gläubiger sie sind, als bekannt gemacht gilt, ihren Anspruch nach Grund und Höhe schriftlich anmelden, Sicherheit zu leisten, soweit sie nicht Befriedigung verlangen können. Dieses Recht steht den Gläubigern jedoch nur zu, wenn sie glaubhaft machen, dass durch die Verschmelzung die Erfüllung ihrer Forderung gefährdet wird."
    },
    {
      "date": "2025-05-20",
      "id": "109609",
      "original_text": "Registerbekanntmachung nach dem Umwandlungsgesetz\nSachsen-Anhalt Amtsgericht Stendal HRB 206860\nB & S GmbH Betriebswirtschafts- und Softwareservice – Halle",
      "type": "Registerbekanntmachung nach dem Umwandlungsgesetz",
      "state": "Sachsen-Anhalt",
      "amtsgericht": "Amtsgericht Stendal",
      "registernummer": "HRB 206860",
      "registerart": "HRB",
      "company_name": "B & S GmbH Betriebswirtschafts- und Softwareservice",
      "company_seat": "Halle",
      "details": "20.05.2025 (Bekanntmachungsdatum)\n\nSachsen-Anhalt Amtsgericht Stendal HRB 206860\nRegisterbekanntmachung nach dem Umwandlungsgesetz 20.05.2025 (Eintragungsdatum)\n\nB & S  GmbH Betriebswirtschafts- und Softwareservice\nGesellschaft mit beschränkter Haftung\nHalle\n\nNicht eingetragen:\nDen Gläubigern der an der Verschmelzung beteiligten Rechtsträger ist, wenn sie binnen sechs Monaten nach dem Tag, an dem die Eintragung der Verschmelzung nach § 19 Abs. 3 UmwG als bekanntgemacht gilt, ihren Anspruch nach Grund und Höhe schriftlich anmelden, Sicherheit zu leisten, soweit sie nicht Befriedigung verlangen können. Dieses Recht steht ihnen jedoch nur zu, wenn sie glaubhaft machen, dass durch die Verschmelzung die Erfüllung ihrer Forderung gefährdet wird."
    },
    {
      "date": "2025-05-20",
      "id": "109610",
      "original_text": "Registerbekanntmachung nach dem Umwandlungsgesetz\nSachsen-Anhalt Amtsgericht Stendal HRA 8179\nB & S Betriebswirtschafts- und Softwareservice Jürgen Sauthoff e.K. – Mansfeld OT Annarode",
      "type": "Registerbekanntmachung nach dem Umwandlungsgesetz",
      "state": "Sachsen-Anhalt",
      "amtsgericht": "Amtsgericht Stendal",
      "registernummer": "HRA 8179",
      "registerart": "HRA",
      "company_name": "B & S Betriebswirtschafts- und Softwareservice Jürgen Sauthoff e.K.",
      "company_seat": "Mansfeld OT Annarode",
      "details": "20.05.2025 (Bekanntmachungsdatum)\n\nSachsen-Anhalt Amtsgericht Stendal HRA 8179\nRegisterbekanntmachung nach dem Umwandlungsgesetz 20.05.2025 (Eintragungsdatum)\n\nB & S Betriebswirtschafts- und Softwareservice Jürgen Sauthoff e.K.\nEinzelkaufmann / Einzelkauffrau\nMansfeld OT Annarode\n\nNicht eingetragen:\nDen Gläubigern der an der Verschmelzung beteiligten Rechtsträger ist, wenn sie binnen sechs Monaten nach dem Tag, an dem die Eintragung der Verschmelzung nach § 19 Abs. 3 UmwG als bekanntgemacht gilt, ihren Anspruch nach Grund und Höhe schriftlich anmelden, Sicherheit zu leisten, soweit sie nicht Befriedigung verlangen können. Dieses Recht steht ihnen jedoch nur zu, wenn sie glaubhaft machen, dass durch die Verschmelzung die Erfüllung ihrer Forderung gefährdet wird."
    },
    {
      "date": "2025-05-20",
      "id": "109611",
      "original_text": "Löschungsankündigung\nBerlin Amtsgericht Berlin (Charlottenburg) HRB 223341\nBrockhausen & Brockhausen UG (haftungsbeschränkt) – Berlin",
      "type": "Löschungsankündigung",
      "state": "Berlin",
      "amtsgericht": "Amtsgericht Berlin (Charlottenburg)",
      "registernummer": "HRB 223341",
      "registerart": "HRB",
      "company_name": "Brockhausen & Brockhausen UG (haftungsbeschränkt)",
      "company_seat": "Berlin",
      "details": "20.05.2025 (Bekanntmachungsdatum)\n\nBerlin Amtsgericht Berlin (Charlottenburg) HRB 223341\nLöschungsankündigung\n\nBrockhausen & Brockhausen UG (haftungsbeschränkt)\nGesellschaft mit beschränkter Haftung\nBerlin\n\nBei der nachstehenden Gesellschaft wird das Amtslöschungsverfahren gemäß § 394 FamFG eingeleitet. Widerspruchsfrist 6 Wochen"
    },
    {
      "date": "2025-05-20",
      "id": "109612",
      "original_text": "Löschungsankündigung\nBaden-Württemberg Amtsgericht Stuttgart HRB 755741\nAIR MED Stuttgart GmbH – Stuttgart",
      "type": "Löschungsankündigung",
      "state": "Baden-Württemberg",
      "amtsgericht": "Amtsgericht Stuttgart",
      "registernummer": "HRB 755741",
      "registerart": "HRB",
      "company_name": "AIR MED Stuttgart GmbH",
      "company_seat": "Stuttgart",
      "details": "20.05.2025 (Bekanntmachungsdatum)\n\nBaden-Württemberg Amtsgericht Stuttgart HRB 755741\nLöschungsankündigung\n\nAIR MED Stuttgart GmbH\nGesellschaft mit beschränkter Haftung\nStuttgart\n\nEs ist  beabsichtigt, die Eintragung der Löschung der Gesellschaft aufgrund Vermögenslosigkeit gemäß § 394 FamFG vom 14.04.2025 von Amts wegen aufgrund Unzulässigkeit nach § 395 FamFG wieder zu löschen.\nEs wird hierzu Gelegenheit zur Erhebung eines Widerspruchs binnen 1 Monat ab Veröffentlichung gegeben."
    },
    {
      "date": "2025-05-20",
      "id": "109613",
      "original_text": "Registerbekanntmachung nach dem Umwandlungsgesetz\nBerlin Amtsgericht Berlin (Charlottenburg) HRB 99271\nDataciders ixto GmbH – Berlin",
      "type": "Registerbekanntmachung nach dem Umwandlungsgesetz",
      "state": "Berlin",
      "amtsgericht": "Amtsgericht Berlin (Charlottenburg)",
      "registernummer": "HRB 99271",
      "registerart": "HRB",
      "company_name": "Dataciders ixto GmbH",
      "company_seat": "Berlin",
      "details": "20.05.2025 (Bekanntmachungsdatum)\n\nBerlin Amtsgericht Berlin (Charlottenburg) HRB 99271\nRegisterbekanntmachung nach dem Umwandlungsgesetz 20.05.2025 (Eintragungsdatum)\n\nDataciders ixto GmbH\nGesellschaft mit beschränkter Haftung\nBerlin\n\nZu Eintragungsnummer 14 vom 20.05.2025 wird als nicht eingetragen veröffentlicht: Den Gläubigern der an der Verschmelzung beteiligten Rechtsträger ist, wenn sie binnen sechs Monaten nach dem Tag, an dem die Eintragung der Verschmelzung in das Register des Sitzes desjenigen Rechtsträgers, dessen Gläubiger sie sind, als bekannt gemacht gilt, ihren Anspruch nach Grund und Höhe schriftlich anmelden, Sicherheit zu leisten, soweit sie nicht Befriedigung verlangen können. Dieses Recht steht den Gläubigern jedoch nur zu, wenn sie glaubhaft machen, dass durch die Verschmelzung die Erfüllung ihrer Forderung gefährdet wird. Das Recht, Sicherheitsleistung zu verlangen, steht Gläubigern nicht zu, die im Falle der Insolvenz ein Recht auf vorzugsweise Befriedigung aus einer Deckungsmasse haben, die nach gesetzlicher Vorschrift zu ihrem Schutz errichtet und staatlich überwacht ist."
    },
    {
      "date": "2025-05-20",
      "id": "109614",
      "original_text": "Registerbekanntmachung nach dem Umwandlungsgesetz\nBerlin Amtsgericht Berlin (Charlottenburg) HRB 154583\nRoyfelder-Hools Productions UG (haftungsbeschränkt) – Berlin",
      "type": "Registerbekanntmachung nach dem Umwandlungsgesetz",
      "state": "Berlin",
      "amtsgericht": "Amtsgericht Berlin (Charlottenburg)",
      "registernummer": "HRB 154583",
      "registerart": "HRB",
      "company_name": "Royfelder-Hools Productions UG (haftungsbeschränkt)",
      "company_seat": "Berlin",
      "details": "20.05.2025 (Bekanntmachungsdatum)\n\nBerlin Amtsgericht Berlin (Charlottenburg) HRB 154583\nRegisterbekanntmachung nach dem Umwandlungsgesetz 20.05.2025 (Eintragungsdatum)\n\nRoyfelder-Hools Productions UG (haftungsbeschränkt)\nGesellschaft mit beschränkter Haftung\nBerlin\n\nZu Eintragungsnummer 2 vom 20.05.2025 wird als nicht eingetragen veröffentlicht: Den Gläubigern ist, wenn sie binnen sechs Monaten nach dem Tag, an dem die Eintragung der Umwandlung als bekannt gemacht gilt, ihren Anspruch nach Grund und Höhe schriftlich anmelden, Sicherheit zu leisten, soweit sie nicht Befriedigung verlangen können. Dieses Recht steht den Gläubigern jedoch nur zu, wenn sie glaubhaft machen, dass durch die Umwandlung die Erfüllung ihrer Forderung gefährdet wird. Das Recht, Sicherheitsleistung zu verlangen, steht Gläubigern nicht zu, die im Falle der Insolvenz ein Recht auf vorzugsweise Befriedigung aus einer Deckungsmasse haben, die nach gesetzlicher Vorschrift zu ihrem Schutz errichtet und staatlich überwacht ist."
    },
    {
      "date": "2025-05-20",
      "id": "109615",
      "original_text": "Registerbekanntmachung nach dem Umwandlungsgesetz\nBerlin Amtsgericht Berlin (Charlottenburg) GsR 3297\nHoolfelder Roy Productions eGbR – Berlin",
      "type": "Registerbekanntmachung nach dem Umwandlungsgesetz",
      "state": "Berlin",
      "amtsgericht": "Amtsgericht Berlin (Charlottenburg)",
      "registernummer": "GsR 3297",
      "registerart": "GsR",
      "company_name": "Hoolfelder Roy Productions eGbR",
      "company_seat": "Berlin",
      "details": "20.05.2025 (Bekanntmachungsdatum)\n\nBerlin Amtsgericht Berlin (Charlottenburg) GsR 3297\nRegisterbekanntmachung nach dem Umwandlungsgesetz 20.05.2025 (Eintragungsdatum)\n\nHoolfelder Roy Productions eGbR\nGesellschaft bürgerlichen Rechts\nBerlin\n\nZu Eintragungsnummer 1 vom 20.05.2025 wird als nicht eingetragen veröffentlicht: Den Gläubigern ist, wenn sie binnen sechs Monaten nach dem Tag, an dem die Eintragung der Umwandlung als bekannt gemacht gilt, ihren Anspruch nach Grund und Höhe schriftlich anmelden, Sicherheit zu leisten, soweit sie nicht Befriedigung verlangen können. Dieses Recht steht den Gläubigern jedoch nur zu, wenn sie glaubhaft machen, dass durch die Umwandlung die Erfüllung ihrer Forderung gefährdet wird. Das Recht, Sicherheitsleistung zu verlangen, steht Gläubigern nicht zu, die im Falle der Insolvenz ein Recht auf vorzugsweise Befriedigung aus einer Deckungsmasse haben, die nach gesetzlicher Vorschrift zu ihrem Schutz errichtet und staatlich überwacht ist."
    },
    {
      "date": "2025-05-20",
      "id": "109616",
      "original_text": "Löschungsankündigung\nBerlin Amtsgericht Berlin (Charlottenburg) HRB 145974\nEonym GmbH – Berlin",
      "type": "Löschungsankündigung",
      "state": "Berlin",
      "amtsgericht": "Amtsgericht Berlin (Charlottenburg)",
      "registernummer": "HRB 145974",
      "registerart": "HRB",
      "company_name": "Eonym GmbH",
      "company_seat": "Berlin",
      "details": "20.05.2025 (Bekanntmachungsdatum)\n\nBerlin Amtsgericht Berlin (Charlottenburg) HRB 145974\nLöschungsankündigung\n\nEonym GmbH\nGesellschaft mit beschränkter Haftung\nBerlin\n\nBei der nachstehenden Gesellschaft wird das Amtslöschungsverfahren gemäß § 394 FamFG eingeleitet. Widerspruchsfrist 6 Wochen"
    },
    {
      "date": "2025-05-20",
      "id": "109617",
      "original_text": "Löschungsankündigung\nBaden-Württemberg Amtsgericht Mannheim HRB 738982\nFixTrans UG (haftungsbeschränkt) – Hockenheim",
      "type": "Löschungsankündigung",
      "state": "Baden-Württemberg",
      "amtsgericht": "Amtsgericht Mannheim",
      "registernummer": "HRB 738982",
      "registerart": "HRB",
      "company_name": "FixTrans UG (haftungsbeschränkt)",
      "company_seat": "Hockenheim",
      "details": "20.05.2025 (Bekanntmachungsdatum)\n\nBaden-Württemberg Amtsgericht Mannheim HRB 738982\nLöschungsankündigung\n\nFixTrans UG (haftungsbeschränkt)\nGesellschaft mit beschränkter Haftung\nHockenheim\n\nDas Gericht beabsichtigt, die Gesellschaft wegen Vermögenslosigkeit im Handelsregister von Amts wegen nach § 394 FamFG zu löschen. Die Frist zur Geltendmachung eines Widerspruchs gegen die beabsichtigte Löschung ist auf einen Monat ab Veröffentlichung bestimmt."
    },
    {
      "date": "2025-05-20",
      "id": "109618",
      "original_text": "Löschungsankündigung\nBerlin Amtsgericht Berlin (Charlottenburg) HRB 170766\nPOP - MULTIMEDIA GmbH – Berlin",
      "type": "Löschungsankündigung",
      "state": "Berlin",
      "amtsgericht": "Amtsgericht Berlin (Charlottenburg)",
      "registernummer": "HRB 170766",
      "registerart": "HRB",
      "company_name": "POP - MULTIMEDIA GmbH",
      "company_seat": "Berlin",
      "details": "20.05.2025 (Bekanntmachungsdatum)\n\nBerlin Amtsgericht Berlin (Charlottenburg) HRB 170766\nLöschungsankündigung\n\nPOP - MULTIMEDIA GmbH\nGesellschaft mit beschränkter Haftung\nBerlin\n\nBei der nachstehenden Gesellschaft wird das Amtslöschungsverfahren gemäß § 394 FamFG eingeleitet. Widerspruchsfrist 6 Wochen"
    },
    {
      "date": "2025-05-20",
      "id": "109619",
      "original_text": "Registerbekanntmachung nach dem Umwandlungsgesetz\nBerlin Amtsgericht Berlin (Charlottenburg) HRA 54632\nJuna Estate Services & Solutions e.Kfr. – Berlin",
      "type": "Registerbekanntmachung nach dem Umwandlungsgesetz",
      "state": "Berlin",
      "amtsgericht": "Amtsgericht Berlin (Charlottenburg)",
      "registernummer": "HRA 54632",
      "registerart": "HRA",
      "company_name": "Juna Estate Services & Solutions e.Kfr.",
      "company_seat": "Berlin",
      "details": "20.05.2025 (Bekanntmachungsdatum)\n\nBerlin Amtsgericht Berlin (Charlottenburg) HRA 54632\nRegisterbekanntmachung nach dem Umwandlungsgesetz 19.05.2025 (Eintragungsdatum)\n\nJuna Estate Services & Solutions e.Kfr.\nEinzelkaufmann / Einzelkauffrau\nBerlin\n\nZu Eintragungsnummer 5 vom 19.05.2025 wird als nicht eingetragen veröffentlicht:Den Gläubigern der an der Spaltung beteiligten Rechtsträger ist, wenn sie binnen sechs Monaten nach dem Tag, an dem die Eintragung der Spaltung in das Register des Sitzes desjenigen Rechtsträgers, dessen Gläubiger sie sind, als bekannt gemacht gilt, ihren Anspruch nach Grund und Höhe schriftlich anmelden, Sicherheit zu leisten, soweit sie nicht Befriedigung verlangen können. Dieses Recht steht den Gläubigern jedoch nur zu, wenn sie glaubhaft machen, dass durch die Spaltung die Erfüllung ihrer Forderung gefährdet wird. Das Recht, Sicherheitsleistung zu verlangen, steht Gläubigern nicht zu, die im Falle der Insolvenz ein Recht auf vorzugsweise Befriedigung aus einer Deckungsmasse haben, die nach gesetzlicher Vorschrift zu ihrem Schutz errichtet und staatlich überwacht ist."
    },
    {
      "date": "2025-05-20",
      "id": "109620",
      "original_text": "Registerbekanntmachung nach dem Umwandlungsgesetz\nBerlin Amtsgericht Berlin (Charlottenburg) HRA 54632\nJuna Estate Services & Solutions e.Kfr. – Berlin",
      "type": "Registerbekanntmachung nach dem Umwandlungsgesetz",
      "state": "Berlin",
      "amtsgericht": "Amtsgericht Berlin (Charlottenburg)",
      "registernummer": "HRA 54632",
      "registerart": "HRA",
      "company_name": "Juna Estate Services & Solutions e.Kfr.",
      "company_seat": "Berlin",
      "details": "20.05.2025 (Bekanntmachungsdatum)\n\nBerlin Amtsgericht Berlin (Charlottenburg) HRA 54632\nRegisterbekanntmachung nach dem Umwandlungsgesetz 19.05.2025 (Eintragungsdatum)\n\nJuna Estate Services & Solutions e.Kfr.\nEinzelkaufmann / Einzelkauffrau\nBerlin\n\nZu Eintragungsnummer 5 vom 19.05.2025 wird als nicht eingetragen veröffentlicht:Den Gläubigern der an der Spaltung beteiligten Rechtsträger ist, wenn sie binnen sechs Monaten nach dem Tag, an dem die Eintragung der Spaltung in das Register des Sitzes desjenigen Rechtsträgers, dessen Gläubiger sie sind, als bekannt gemacht gilt, ihren Anspruch nach Grund und Höhe schriftlich anmelden, Sicherheit zu leisten, soweit sie nicht Befriedigung verlangen können. Dieses Recht steht den Gläubigern jedoch nur zu, wenn sie glaubhaft machen, dass durch die Spaltung die Erfüllung ihrer Forderung gefährdet wird. Das Recht, Sicherheitsleistung zu verlangen, steht Gläubigern nicht zu, die im Falle der Insolvenz ein Recht auf vorzugsweise Befriedigung aus einer Deckungsmasse haben, die nach gesetzlicher Vorschrift zu ihrem Schutz errichtet und staatlich überwacht ist."
    },
    {
      "date": "2025-05-20",
      "id": "109621",
      "original_text": "Registerbekanntmachung nach dem Umwandlungsgesetz\nBerlin Amtsgericht Berlin (Charlottenburg) HRB 275232\nCannovum Health GmbH – Berlin",
      "type": "Registerbekanntmachung nach dem Umwandlungsgesetz",
      "state": "Berlin",
      "amtsgericht": "Amtsgericht Berlin (Charlottenburg)",
      "registernummer": "HRB 275232",
      "registerart": "HRB",
      "company_name": "Cannovum Health GmbH",
      "company_seat": "Berlin",
      "details": "20.05.2025 (Bekanntmachungsdatum)\n\nBerlin Amtsgericht Berlin (Charlottenburg) HRB 275232\nRegisterbekanntmachung nach dem Umwandlungsgesetz 19.05.2025 (Eintragungsdatum)\n\nCannovum Health GmbH\nGesellschaft mit beschränkter Haftung\nBerlin\n\nZu Eintragungsnummer 1 vom 19.05.2025 wird als nicht eingetragen veröffentlicht: Den Gläubigern ist, wenn sie binnen sechs Monaten nach dem Tag, an dem die Eintragung der Umwandlung als bekannt gemacht gilt, ihren Anspruch nach Grund und Höhe schriftlich anmelden, Sicherheit zu leisten, soweit sie nicht Befriedigung verlangen können. Dieses Recht steht den Gläubigern jedoch nur zu, wenn sie glaubhaft machen, dass durch die Umwandlung die Erfüllung ihrer Forderung gefährdet wird. Das Recht, Sicherheitsleistung zu verlangen, steht Gläubigern nicht zu, die im Falle der Insolvenz ein Recht auf vorzugsweise Befriedigung aus einer Deckungsmasse haben, die nach gesetzlicher Vorschrift zu ihrem Schutz errichtet und staatlich überwacht ist."
    },
    {
      "date": "2025-05-20",
      "id": "109622",
      "original_text": "Registerbekanntmachung nach dem Umwandlungsgesetz\nBrandenburg Amtsgericht Cottbus HRB 18757\nLausitz Energie Verwaltungs GmbH – Cottbus",
      "type": "Registerbekanntmachung nach dem Umwandlungsgesetz",
      "state": "Brandenburg",
      "amtsgericht": "Amtsgericht Cottbus",
      "registernummer": "HRB 18757",
      "registerart": "HRB",
      "company_name": "Lausitz Energie Verwaltungs GmbH",
      "company_seat": "Cottbus",
      "details": "20.05.2025 (Bekanntmachungsdatum)\n\nBrandenburg Amtsgericht Cottbus HRB 18757\nRegisterbekanntmachung nach dem Umwandlungsgesetz 15.05.2025 (Eintragungsdatum)\n\nLausitz Energie Verwaltungs GmbH\nGesellschaft mit beschränkter Haftung\nCottbus\n\nZu Eintragungsnummer 1 vom 15.05.2025 wird als nicht eingetragen veröffentlicht:\nDen Gläubigern der an der Spaltung beteiligten Rechtsträger ist, wenn sie binnen sechs Monaten nach dem Tag, an dem die Eintragung der Spaltung in das Register des Sitzes desjenigen Rechtsträgers, dessen Gläubiger sie sind, als bekannt gemacht gilt, ihren Anspruch nach Grund und Höhe schriftlich anmelden, Sicherheit zu leisten, soweit sie nicht Befriedigung verlangen können. Dieses Recht steht den Gläubigern jedoch nur zu, wenn sie glaubhaft machen, dass durch die Spaltung die Erfüllung ihrer Forderung gefährdet wird."
    },
    {
      "date": "2025-05-20",
      "id": "109623",
      "original_text": "Sonstige Registerbekanntmachung\nHamburg Amtsgericht Hamburg HRB 93371\nAsklepios Kliniken Hamburg GmbH – Hamburg",
      "type": "Sonstige Registerbekanntmachung",
      "state": "Hamburg",
      "amtsgericht": "Amtsgericht Hamburg",
      "registernummer": "HRB 93371",
      "registerart": "HRB",
      "company_name": "Asklepios Kliniken Hamburg GmbH",
      "company_seat": "Hamburg",
      "details": "20.05.2025 (Bekanntmachungsdatum)\n\nHamburg Amtsgericht Hamburg HRB 93371\nSonstige Registerbekanntmachung\n\nAsklepios Kliniken Hamburg GmbH\nGesellschaft mit beschränkter Haftung\nHamburg\n\nAls nicht eingetragen wird bekannt gemacht: Liste des Aufsichtsrats wurde eingereicht."
    },
    {
      "date": "2025-05-20",
      "id": "109624",
      "original_text": "Registerbekanntmachung nach dem Umwandlungsgesetz\nSachsen Amtsgericht Dresden HRB 28442\nSB Sächsische Baustoffwerke Borna GmbH – Dresden",
      "type": "Registerbekanntmachung nach dem Umwandlungsgesetz",
      "state": "Sachsen",
      "amtsgericht": "Amtsgericht Dresden",
      "registernummer": "HRB 28442",
      "registerart": "HRB",
      "company_name": "SB Sächsische Baustoffwerke Borna GmbH",
      "company_seat": "Dresden",
      "details": "20.05.2025 (Bekanntmachungsdatum)\n\nSachsen Amtsgericht Dresden HRB 28442\nRegisterbekanntmachung nach dem Umwandlungsgesetz 20.05.2025 (Eintragungsdatum)\n\nSB Sächsische Baustoffwerke Borna GmbH\nGesellschaft mit beschränkter Haftung\nDresden\n\nDen Gläubigern der an der Verschmelzung beteiligten Rechtsträger ist, wenn sie binnen sechs Monaten nach dem Tag, an dem die Eintragung der Verschmelzung in das Register des Sitzes desjenigen Rechtsträgers, dessen Gläubiger sie sind, nach § 19 Abs. 3 UmwG als bekannt gemacht gilt, ihren Anspruch nach Grund und Höhe in Textform anmelden, Sicherheit zu leisten, soweit sie nicht Befriedigung verlangen können. Dieses Recht steht den Gläubigern jedoch nur zu, wenn sie glaubhaft machen, dass durch die Verschmelzung die Erfüllung der Forderung gefährdet wird.Den Gläubigern der an der Verschmelzung beteiligten Rechtsträger ist, wenn sie binnen sechs Monaten nach dem Tag, an dem die Eintragung der Verschmelzung in das Register des Sitzes desjenigen Rechtsträgers, dessen Gläubiger sie sind, nach § 19 Abs. 3 UmwG als bekannt gemacht gilt, ihren Anspruch nach Grund und Höhe in Textform anmelden, Sicherheit zu leisten, soweit sie nicht Befriedigung verlangen können. Dieses Recht steht den Gläubigern jedoch nur zu, wenn sie glaubhaft machen, dass durch die Verschmelzung die Erfüllung der Forderung gefährdet wird."
    },
    {
      "date": "2025-05-20",
      "id": "109625",
      "original_text": "Einreichung neuer Dokumente\nSachsen Amtsgericht Dresden HRB 22171\nOberlausitz - Kliniken gGmbH – Bautzen",
      "type": "Einreichung neuer Dokumente",
      "state": "Sachsen",
      "amtsgericht": "Amtsgericht Dresden",
      "registernummer": "HRB 22171",
      "registerart": "HRB",
      "company_name": "Oberlausitz - Kliniken gGmbH",
      "company_seat": "Bautzen",
      "details": "20.05.2025 (Bekanntmachungsdatum)\n\nSachsen Amtsgericht Dresden HRB 22171\nEinreichung neuer Dokumente\n\nOberlausitz - Kliniken gGmbH\nGesellschaft mit beschränkter Haftung\nBautzen\n\nAm 19.05.2025 wurde beim Handelsregister des Amtsgerichts Dresden die Liste der Mitglieder des Aufsichtsrats gemäß § 52 GmbHG eingereicht."
    },
    {
      "date": "2025-05-20",
      "id": "109626",
      "original_text": "Registerbekanntmachung nach dem Umwandlungsgesetz\nSachsen Amtsgericht Chemnitz HRA 10194\nHilfe mit Herz e.K. Inh. Gabriele Zschau – Thermalbad Wiesenbad",
      "type": "Registerbekanntmachung nach dem Umwandlungsgesetz",
      "state": "Sachsen",
      "amtsgericht": "Amtsgericht Chemnitz",
      "registernummer": "HRA 10194",
      "registerart": "HRA",
      "company_name": "Hilfe mit Herz e.K. Inh. Gabriele Zschau",
      "company_seat": "Thermalbad Wiesenbad",
      "details": "20.05.2025 (Bekanntmachungsdatum)\n\nSachsen Amtsgericht Chemnitz HRA 10194\nRegisterbekanntmachung nach dem Umwandlungsgesetz 20.05.2025 (Eintragungsdatum)\n\nHilfe mit Herz e.K. Inh. Gabriele Zschau\nEinzelkaufmann / Einzelkauffrau\nThermalbad Wiesenbad\n\nDen Gläubigern der an der Ausgliederung beteiligten Rechtsträger ist, wenn sie binnen sechs Monaten nach dem Tag, an dem die Eintragung der Ausgliederung in das Register des Sitzes desjenigen Rechtsträgers, dessen Gläubiger sie sind, nach § 19 Abs. 3 UmwG als bekannt gemacht gilt, ihren Anspruch nach Grund und Höhe in Textform anmelden, Sicherheit zu leisten, soweit sie nicht Befriedigung verlangen können. Dieses Recht steht den Gläubigern jedoch nur zu, wenn sie glaubhaft machen, dass durch die Ausgliederung die Erfüllung der Forderung gefährdet wird."
    },
    {
      "date": "2025-05-20",
      "id": "109627",
      "original_text": "Registerbekanntmachung nach dem Umwandlungsgesetz\nSachsen Amtsgericht Dresden HRB 13251\nST Sandabbau und Rekultivierung GmbH Dresden – Dresden",
      "type": "Registerbekanntmachung nach dem Umwandlungsgesetz",
      "state": "Sachsen",
      "amtsgericht": "Amtsgericht Dresden",
      "registernummer": "HRB 13251",
      "registerart": "HRB",
      "company_name": "ST Sandabbau und Rekultivierung GmbH Dresden",
      "company_seat": "Dresden",
      "details": "20.05.2025 (Bekanntmachungsdatum)\n\nSachsen Amtsgericht Dresden HRB 13251\nRegisterbekanntmachung nach dem Umwandlungsgesetz\n\nST Sandabbau und Rekultivierung GmbH Dresden\nGesellschaft mit beschränkter Haftung\nDresden\n\nDen Gläubigern der an der Verschmelzung beteiligten Rechtsträger ist, wenn sie binnen sechs Monaten nach dem Tag, an dem die Eintragung der Verschmelzung in das Register des Sitzes desjenigen Rechtsträgers, dessen Gläubiger sie sind, nach § 19 Abs. 3 UmwG als bekannt gemacht gilt, ihren Anspruch nach Grund und Höhe in Textform anmelden, Sicherheit zu leisten, soweit sie nicht Befriedigung verlangen können. Dieses Recht steht den Gläubigern jedoch nur zu, wenn sie glaubhaft machen, dass durch die Verschmelzung die Erfüllung der Forderung gefährdet wird."
    },
    {
      "date": "2025-05-20",
      "id": "109628",
      "original_text": "Registerbekanntmachung nach dem Umwandlungsgesetz\nSachsen Amtsgericht Chemnitz HRB 37298\nHilfe mit Herz gGmbH – Thermalbad Wiesenbad",
      "type": "Registerbekanntmachung nach dem Umwandlungsgesetz",
      "state": "Sachsen",
      "amtsgericht": "Amtsgericht Chemnitz",
      "registernummer": "HRB 37298",
      "registerart": "HRB",
      "company_name": "Hilfe mit Herz gGmbH",
      "company_seat": "Thermalbad Wiesenbad",
      "details": "20.05.2025 (Bekanntmachungsdatum)\n\nSachsen Amtsgericht Chemnitz HRB 37298\nRegisterbekanntmachung nach dem Umwandlungsgesetz 20.05.2025 (Eintragungsdatum)\n\nHilfe mit Herz gGmbH\nGesellschaft mit beschränkter Haftung\nThermalbad Wiesenbad\n\nDen Gläubigern der an der Ausgliederung beteiligten Rechtsträger ist, wenn sie binnen sechs Monaten nach dem Tag, an dem die Eintragung der Ausgliederung in das Register des Sitzes desjenigen Rechtsträgers, dessen Gläubiger sie sind, nach § 19 Abs. 3 UmwG als bekannt gemacht gilt, ihren Anspruch nach Grund und Höhe in Textform anmelden, Sicherheit zu leisten, soweit sie nicht Befriedigung verlangen können. Dieses Recht steht den Gläubigern jedoch nur zu, wenn sie glaubhaft machen, dass durch die Ausgliederung die Erfüllung der Forderung gefährdet wird."
    },
    {
      "date": "2025-05-20",
      "id": "109629",
      "original_text": "Einreichung neuer Dokumente\nSachsen Amtsgericht Dresden HRB 22967\nOberlausitz Pflegeheim & Kurzzeitpflege gGmbH – Bischofswerda",
      "type": "Einreichung neuer Dokumente",
      "state": "Sachsen",
      "amtsgericht": "Amtsgericht Dresden",
      "registernummer": "HRB 22967",
      "registerart": "HRB",
      "company_name": "Oberlausitz Pflegeheim & Kurzzeitpflege gGmbH",
      "company_seat": "Bischofswerda",
      "details": "20.05.2025 (Bekanntmachungsdatum)\n\nSachsen Amtsgericht Dresden HRB 22967\nEinreichung neuer Dokumente\n\nOberlausitz Pflegeheim & Kurzzeitpflege gGmbH\nGesellschaft mit beschränkter Haftung\nBischofswerda\n\nAm 19.05.2025 wurde beim Handelsregister des Amtsgerichts Dresden die Liste der Mitglieder des Aufsichtsrats gemäß § 52 GmbHG eingereicht."
    },
    {
      "date": "2025-05-20",
      "id": "109630",
      "original_text": "Löschungsankündigung\nSachsen Amtsgericht Dresden HRB 10219\nIVR Immobilien- und Verwaltungsgesellschaft mbH Riesa – Riesa",
      "type": "Löschungsankündigung",
      "state": "Sachsen",
      "amtsgericht": "Amtsgericht Dresden",
      "registernummer": "HRB 10219",
      "registerart": "HRB",
      "company_name": "IVR Immobilien- und Verwaltungsgesellschaft mbH Riesa",
      "company_seat": "Riesa",
      "details": "20.05.2025 (Bekanntmachungsdatum)\n\nSachsen Amtsgericht Dresden HRB 10219\nLöschungsankündigung\n\nIVR Immobilien- und Verwaltungsgesellschaft mbH Riesa\nGesellschaft mit beschränkter Haftung\nRiesa\n\nDas Registergericht beabsichtigt, die im Handelsregister eingetragene Gesellschaft von Amts wegen nach § 394 FamFG zu löschen. Die Frist zu Erhebung eines Widerspruchs gegen die beabsichtigte Löschung wird auf einen Monat festgesetzt."
    },
    {
      "date": "2025-05-20",
      "id": "109631",
      "original_text": "Registerbekanntmachung nach dem Umwandlungsgesetz\nNiedersachsen Amtsgericht Osnabrück HRB 19171\nteam4media GmbH – Osnabrück",
      "type": "Registerbekanntmachung nach dem Umwandlungsgesetz",
      "state": "Niedersachsen",
      "amtsgericht": "Amtsgericht Osnabrück",
      "registernummer": "HRB 19171",
      "registerart": "HRB",
      "company_name": "team4media GmbH",
      "company_seat": "Osnabrück",
      "details": "20.05.2025 (Bekanntmachungsdatum)\n\nNiedersachsen Amtsgericht Osnabrück HRB 19171\nRegisterbekanntmachung nach dem Umwandlungsgesetz 20.05.2025 (Eintragungsdatum)\n\nteam4media GmbH\nGesellschaft mit beschränkter Haftung\nOsnabrück\n\nDen Gläubigern der an der formwechselnden Umwandlung beteiligten Rechtsträger ist, wenn sie binnen sechs Monaten nach dem Tag, an dem die Eintragung der Umwandlung in das Register des Sitzes desjenigen Rechtsträgers, dessen Gläubiger sie sind, nach § 19 Abs. 3 UmwG als bekannt gemacht gilt, ihren Anspruch nach Grund und Höhe schriftlich anmelden, Sicherheit zu leisten, soweit sie nicht Befriedigung verlangen können. Dieses Recht steht den Gläubigern jedoch nur zu, wenn sie glaubhaft machen, dass durch die formwechselnde Umwandlung die Erfüllung der Forderung gefährdet wird."
    },
    {
      "date": "2025-05-20",
      "id": "109632",
      "original_text": "Löschungsankündigung\nNiedersachsen Amtsgericht Braunschweig HRB 210037\nMKIT Bau Wolfsburg GmbH – Wolfsburg",
      "type": "Löschungsankündigung",
      "state": "Niedersachsen",
      "amtsgericht": "Amtsgericht Braunschweig",
      "registernummer": "HRB 210037",
      "registerart": "HRB",
      "company_name": "MKIT Bau Wolfsburg GmbH",
      "company_seat": "Wolfsburg",
      "details": "20.05.2025 (Bekanntmachungsdatum)\n\nNiedersachsen Amtsgericht Braunschweig HRB 210037\nLöschungsankündigung\n\nMKIT Bau Wolfsburg GmbH\nGesellschaft mit beschränkter Haftung\nWolfsburg\n\nDas Registergericht beabsichtigt, die Gesellschaft von Amts wegen nach § 394 FamFG zu löschen. Die Frist zur Erhebung eines Widerspruchs ist auf 1 Monat ab dieser Registerbekanntmachung festgesetzt."
    },
    {
      "date": "2025-05-20",
      "id": "109633",
      "original_text": "Löschungsankündigung\nNiedersachsen Amtsgericht Osnabrück HRA 203747\nNSG GmbH & Co. KG – Nordhorn",
      "type": "Löschungsankündigung",
      "state": "Niedersachsen",
      "amtsgericht": "Amtsgericht Osnabrück",
      "registernummer": "HRA 203747",
      "registerart": "HRA",
      "company_name": "NSG GmbH & Co. KG",
      "company_seat": "Nordhorn",
      "details": "20.05.2025 (Bekanntmachungsdatum)\n\nNiedersachsen Amtsgericht Osnabrück HRA 203747\nLöschungsankündigung\n\nNSG GmbH & Co. KG\nKommanditgesellschaft\nNordhorn\n\nDas Registergericht beabsichtigt, die Firma von Amts wegen nach § 394 FamFG wegen Vermögenslosigkeit zu löschen. Die Frist zur Erhebung eines Widerspruchs ist auf 1 Monat ab dieser Registerbekanntmachung festgesetzt."
    },
    {
      "date": "2025-05-20",
      "id": "109634",
      "original_text": "Einreichung neuer Dokumente\nNiedersachsen Amtsgericht Osnabrück HRB 18913\nMICHAELTELECOM AG – Bohmte",
      "type": "Einreichung neuer Dokumente",
      "state": "Niedersachsen",
      "amtsgericht": "Amtsgericht Osnabrück",
      "registernummer": "HRB 18913",
      "registerart": "HRB",
      "company_name": "MICHAELTELECOM AG",
      "company_seat": "Bohmte",
      "details": "20.05.2025 (Bekanntmachungsdatum)\n\nNiedersachsen Amtsgericht Osnabrück HRB 18913\nEinreichung neuer Dokumente\n\nMICHAELTELECOM AG\nAktiengesellschaft\nBohmte\n\nDie Liste der Mitglieder des Aufsichtsrats wurde beim Registergericht eingereicht."
    },
    {
      "date": "2025-05-20",
      "id": "109635",
      "original_text": "Löschungsankündigung\nNiedersachsen Amtsgericht Osnabrück HRB 216826\nBuffalo 12 UG (haftungsbeschränkt) – Osnabrück",
      "type": "Löschungsankündigung",
      "state": "Niedersachsen",
      "amtsgericht": "Amtsgericht Osnabrück",
      "registernummer": "HRB 216826",
      "registerart": "HRB",
      "company_name": "Buffalo 12 UG (haftungsbeschränkt)",
      "company_seat": "Osnabrück",
      "details": "20.05.2025 (Bekanntmachungsdatum)\n\nNiedersachsen Amtsgericht Osnabrück HRB 216826\nLöschungsankündigung\n\nBuffalo 12 UG (haftungsbeschränkt)\nGesellschaft mit beschränkter Haftung\nOsnabrück\n\nDas Registergericht beabsichtigt, die Gesellschaft von Amts wegen nach § 394 FamFG wegen Vermögenslosigkeit zu löschen. Die Frist zur Erhebung eines Widerspruchs ist auf 1 Monat ab dieser Registerbekanntmachung festgesetzt."
    },
    {
      "date": "2025-05-20",
      "id": "109636",
      "original_text": "Registerbekanntmachung nach dem Umwandlungsgesetz\nNiedersachsen Amtsgericht Hannover HRB 57347\nBÖCON Planungs-,Vertriebs- und Baubetreuungsgesellschaft mbH – Seelze",
      "type": "Registerbekanntmachung nach dem Umwandlungsgesetz",
      "state": "Niedersachsen",
      "amtsgericht": "Amtsgericht Hannover",
      "registernummer": "HRB 57347",
      "registerart": "HRB",
      "company_name": "BÖCON Planungs-,Vertriebs- und Baubetreuungsgesellschaft mbH",
      "company_seat": "Seelze",
      "details": "20.05.2025 (Bekanntmachungsdatum)\n\nNiedersachsen Amtsgericht Hannover HRB 57347\nRegisterbekanntmachung nach dem Umwandlungsgesetz 20.05.2025 (Eintragungsdatum)\n\nBÖCON Planungs-,Vertriebs- und Baubetreuungsgesellschaft mbH\nGesellschaft mit beschränkter Haftung\nSeelze\n\nDen Gläubigern der an der Verschmelzung beteiligten Rechtsträger ist, wenn sie binnen sechs Monaten nach dem Tag, an dem die Eintragung der Verschmelzung in das Register des Sitzes desjenigen Rechtsträgers, dessen Gläubiger sie sind, nach § 19  Abs.  3 UmwG als bekannt gemacht gilt, ihren Anspruch nach Grund und Höhe schriftlich anmelden, Sicherheit zu leisten, soweit sie nicht Befriedigung verlangen können. Dieses Recht steht den Gläubigern jedoch nur zu, wenn sie glaubhaft machen, dass durch die Verschmelzung die Erfüllung der Forderung gefährdet wird."
    },
    {
      "date": "2025-05-20",
      "id": "109637",
      "original_text": "Löschungsankündigung\nNiedersachsen Amtsgericht Osnabrück HRA 201065\nSchepers Liberty Trans GmbH & Co. KG – Haren",
      "type": "Löschungsankündigung",
      "state": "Niedersachsen",
      "amtsgericht": "Amtsgericht Osnabrück",
      "registernummer": "HRA 201065",
      "registerart": "HRA",
      "company_name": "Schepers Liberty Trans GmbH & Co. KG",
      "company_seat": "Haren",
      "details": "20.05.2025 (Bekanntmachungsdatum)\n\nNiedersachsen Amtsgericht Osnabrück HRA 201065\nLöschungsankündigung\n\nSchepers Liberty Trans GmbH & Co. KG\nKommanditgesellschaft\nHaren\n\nDas Registergericht beabsichtigt, die Firma von Amts wegen nach § 394 FamFG wegen Vermögenslosigkeit zu löschen. Die Frist zur Erhebung eines Widerspruchs ist auf 1 Monat ab dieser Registerbekanntmachung festgesetzt."
    },
    {
      "date": "2025-05-20",
      "id": "109638",
      "original_text": "Registerbekanntmachung nach dem Umwandlungsgesetz\nNiedersachsen Amtsgericht Hannover HRB 222737\nBöCon Projekt Benther Blick GmbH – Seelze",
      "type": "Registerbekanntmachung nach dem Umwandlungsgesetz",
      "state": "Niedersachsen",
      "amtsgericht": "Amtsgericht Hannover",
      "registernummer": "HRB 222737",
      "registerart": "HRB",
      "company_name": "BöCon Projekt Benther Blick GmbH",
      "company_seat": "Seelze",
      "details": "20.05.2025 (Bekanntmachungsdatum)\n\nNiedersachsen Amtsgericht Hannover HRB 222737\nRegisterbekanntmachung nach dem Umwandlungsgesetz 20.05.2025 (Eintragungsdatum)\n\nBöCon Projekt Benther Blick GmbH\nGesellschaft mit beschränkter Haftung\nSeelze\n\nDen Gläubigern der an der Verschmelzung beteiligten Rechtsträger ist, wenn sie binnen sechs Monaten nach dem Tag, an dem die Eintragung der Verschmelzung in das Register des Sitzes desjenigen Rechtsträgers, dessen Gläubiger sie sind, nach § 19  Abs.  3 UmwG als bekannt gemacht gilt, ihren Anspruch nach Grund und Höhe schriftlich anmelden, Sicherheit zu leisten, soweit sie nicht Befriedigung verlangen können. Dieses Recht steht den Gläubigern jedoch nur zu, wenn sie glaubhaft machen, dass durch die Verschmelzung die Erfüllung der Forderung gefährdet wird."
    },
    {
      "date": "2025-05-20",
      "id": "109639",
      "original_text": "Löschungsankündigung\nNiedersachsen Amtsgericht Osnabrück VR 110382\nFörderverein für Nachmittagsbetreuung in der Gemeinde Bad Rothenfelde – Bad Rothenfelde",
      "type": "Löschungsankündigung",
      "state": "Niedersachsen",
      "amtsgericht": "Amtsgericht Osnabrück",
      "registernummer": "VR 110382",
      "registerart": "VR",
      "company_name": "Förderverein für Nachmittagsbetreuung in der Gemeinde Bad Rothenfelde",
      "company_seat": "Bad Rothenfelde",
      "details": "20.05.2025 (Bekanntmachungsdatum)\n\nNiedersachsen Amtsgericht Osnabrück VR 110382\nLöschungsankündigung 20.05.2025 (Eintragungsdatum)\n\nFörderverein für Nachmittagsbetreuung in der Gemeinde Bad Rothenfelde\neingetragener Verein\nBad Rothenfelde\n\nDas Registergericht beabsichtigt, den Verein von Amts wegen nach § 395 FamFG zu löschen. Die Frist zur Erhebung eines Widerspruchs ist auf 1 Monat ab dieser Registerbekanntmachung festgesetzt."
    },
    {
      "date": "2025-05-20",
      "id": "109640",
      "original_text": "Registerbekanntmachung nach dem Umwandlungsgesetz\nBremen Amtsgericht Bremen HRB 41113\nSaVa Tannhäuser GmbH – Bremerhaven",
      "type": "Registerbekanntmachung nach dem Umwandlungsgesetz",
      "state": "Bremen",
      "amtsgericht": "Amtsgericht Bremen",
      "registernummer": "HRB 41113",
      "registerart": "HRB",
      "company_name": "SaVa Tannhäuser GmbH",
      "company_seat": "Bremerhaven",
      "details": "20.05.2025 (Bekanntmachungsdatum)\n\nBremen Amtsgericht Bremen HRB 41113\nRegisterbekanntmachung nach dem Umwandlungsgesetz 15.05.2025 (Eintragungsdatum)\n\nSaVa Tannhäuser GmbH\nGesellschaft mit beschränkter Haftung\nBremerhaven\n\nZu Eintragungsnummer 2 vom 15.05.2025 wird als nicht eingetragen veröffentlicht: Den Gläubigern der an der Verschmelzung beteiligten Rechtsträger ist, wenn sie binnen sechs Monaten nach dem Tag, an dem die Eintragung der Verschmelzung in das Register des Sitzes desjenigen Rechtsträgers, dessen Gläubiger sie sind, als bekannt gemacht gilt, ihren Anspruch nach Grund und Höhe schriftlich anmelden, Sicherheit zu leisten, soweit sie nicht Befriedigung verlangen können. Dieses Recht steht den Gläubigern jedoch nur zu, wenn sie glaubhaft machen, dass durch die Verschmelzung die Erfüllung ihrer Forderung gefährdet wird. Das Recht, Sicherheitsleistung zu verlangen, steht Gläubigern nicht zu, die im Falle der Insolvenz ein Recht auf vorzugsweise Befriedigung aus einer Deckungsmasse haben, die nach gesetzlicher Vorschrift zu ihrem Schutz errichtet und staatlich überwacht ist."
    },
    {
      "date": "2025-05-20",
      "id": "109641",
      "original_text": "Registerbekanntmachung nach dem Umwandlungsgesetz\nBremen Amtsgericht Bremen HRB 41031\nElevate Gym Sport GmbH – Bremen",
      "type": "Registerbekanntmachung nach dem Umwandlungsgesetz",
      "state": "Bremen",
      "amtsgericht": "Amtsgericht Bremen",
      "registernummer": "HRB 41031",
      "registerart": "HRB",
      "company_name": "Elevate Gym Sport GmbH",
      "company_seat": "Bremen",
      "details": "20.05.2025 (Bekanntmachungsdatum)\n\nBremen Amtsgericht Bremen HRB 41031\nRegisterbekanntmachung nach dem Umwandlungsgesetz 19.05.2025 (Eintragungsdatum)\n\nElevate Gym Sport GmbH\nGesellschaft mit beschränkter Haftung\nBremen\n\nZu Eintragungsnummer 2 vom 19.05.2025 wird als nicht eingetragen veröffentlicht: Den Gläubigern der an der Spaltung beteiligten Rechtsträger ist, wenn sie binnen sechs Monaten nach dem Tag, an dem die Eintragung der Spaltung in das Register des Sitzes desjenigen Rechtsträgers, dessen Gläubiger sie sind, als bekannt gemacht gilt, ihren Anspruch nach Grund und Höhe schriftlich anmelden, Sicherheit zu leisten, soweit sie nicht Befriedigung verlangen können. Dieses Recht steht den Gläubigern jedoch nur zu, wenn sie glaubhaft machen, dass durch die Spaltung die Erfüllung ihrer Forderung gefährdet wird. Das Recht, Sicherheitsleistung zu verlangen, steht Gläubigern nicht zu, die im Falle der Insolvenz ein Recht auf vorzugsweise Befriedigung aus einer Deckungsmasse haben, die nach gesetzlicher Vorschrift zu ihrem Schutz errichtet und staatlich überwacht ist."
    },
    {
      "date": "2025-05-20",
      "id": "109642",
      "original_text": "Löschungsankündigung\nRheinland-Pfalz Amtsgericht Montabaur HRB 28815\nGlobag UG (haftungsbeschränkt) – Dierdorf",
      "type": "Löschungsankündigung",
      "state": "Rheinland-Pfalz",
      "amtsgericht": "Amtsgericht Montabaur",
      "registernummer": "HRB 28815",
      "registerart": "HRB",
      "company_name": "Globag UG (haftungsbeschränkt)",
      "company_seat": "Dierdorf",
      "details": "20.05.2025 (Bekanntmachungsdatum)\n\nRheinland-Pfalz Amtsgericht Montabaur HRB 28815\nLöschungsankündigung\n\nGlobag UG (haftungsbeschränkt)\nGesellschaft mit beschränkter Haftung\nDierdorf\n\nDas Registergericht beabsichtigt die Gesellschaft von Amts wegen nach § 394 FamFG zu löschen. Die Frist zur Erhebung eines Widerspruchs ist auf einen Monat festgesetzt."
    },
    {
      "date": "2025-05-20",
      "id": "109643",
      "original_text": "Löschungsankündigung\nRheinland-Pfalz Amtsgericht Zweibrücken HRB 32509\nInternational Trading Sales GmbH – Pirmasens",
      "type": "Löschungsankündigung",
      "state": "Rheinland-Pfalz",
      "amtsgericht": "Amtsgericht Zweibrücken",
      "registernummer": "HRB 32509",
      "registerart": "HRB",
      "company_name": "International Trading Sales GmbH",
      "company_seat": "Pirmasens",
      "details": "20.05.2025 (Bekanntmachungsdatum)\n\nRheinland-Pfalz Amtsgericht Zweibrücken HRB 32509\nLöschungsankündigung\n\nInternational Trading Sales GmbH\nGesellschaft mit beschränkter Haftung\nPirmasens\n\nDas Registergericht beabsichtigt die Gesellschaft von Amts wegen nach § 394 FamFG zu löschen. Die Frist zur Erhebung eines Widerspruchs ist auf einen Monat festgesetzt."
    },
    {
      "date": "2025-05-20",
      "id": "109644",
      "original_text": "Registerbekanntmachung nach dem Umwandlungsgesetz\nRheinland-Pfalz Amtsgericht Bad Kreuznach HRB 24151\nABC Consulting GmbH – Kastellaun",
      "type": "Registerbekanntmachung nach dem Umwandlungsgesetz",
      "state": "Rheinland-Pfalz",
      "amtsgericht": "Amtsgericht Bad Kreuznach",
      "registernummer": "HRB 24151",
      "registerart": "HRB",
      "company_name": "ABC Consulting GmbH",
      "company_seat": "Kastellaun",
      "details": "20.05.2025 (Bekanntmachungsdatum)\n\nRheinland-Pfalz Amtsgericht Bad Kreuznach HRB 24151\nRegisterbekanntmachung nach dem Umwandlungsgesetz 20.05.2025 (Eintragungsdatum)\n\nABC Consulting GmbH\nGesellschaft mit beschränkter Haftung\nKastellaun\n\nAls nicht eingetragen wird veröffentlicht: Den Gläubigern der an der Verschmelzung beteiligten Rechtsträger ist, wenn sie binnen sechs Monaten nach dem Tag, an dem die Eintragung der Verschmelzung in das Register des Sitzes desjenigen Rechtsträgers, dessen Gläubiger sie sind, nach § 19 Abs. 3 UmwG als bekannt gemacht gilt, ihren Anspruch nach Grund und Höhe schriftlich anmelden, Sicherheit zu leisten, soweit sie nicht Befriedigung verlangen können. Dieses Recht steht den Gläubigern jedoch nur zu, wenn sie glaubhaft machen, dass durch die Verschmelzung die Erfüllung der Forderung gefährdet wird."
    },
    {
      "date": "2025-05-20",
      "id": "109645",
      "original_text": "Löschungsankündigung\nRheinland-Pfalz Amtsgericht Montabaur HRA 23072\nenen PV Freiflächen Projekte UG (haftungsbeschränkt) 2 & Co.KG Parks 1 – Müschenbach",
      "type": "Löschungsankündigung",
      "state": "Rheinland-Pfalz",
      "amtsgericht": "Amtsgericht Montabaur",
      "registernummer": "HRA 23072",
      "registerart": "HRA",
      "company_name": "enen PV Freiflächen Projekte UG (haftungsbeschränkt) 2 & Co.KG Parks 1",
      "company_seat": "Müschenbach",
      "details": "20.05.2025 (Bekanntmachungsdatum)\n\nRheinland-Pfalz Amtsgericht Montabaur HRA 23072\nLöschungsankündigung\n\nenen PV Freiflächen Projekte UG (haftungsbeschränkt) 2 & Co.KG Parks 1\nKommanditgesellschaft\nMüschenbach\n\nDas Registergericht beabsichtigt die Firma von Amts wegen nach § 394 FamFG zu löschen. Die Frist zur Erhebung eines Widerspruchs ist auf einen Monat festgesetzt."
    },
    {
      "date": "2025-05-20",
      "id": "109646",
      "original_text": "Registerbekanntmachung nach dem Umwandlungsgesetz\nNordrhein-Westfalen Amtsgericht Düsseldorf HRB 65211\nAzerion AG – Düsseldorf",
      "type": "Registerbekanntmachung nach dem Umwandlungsgesetz",
      "state": "Nordrhein-Westfalen",
      "amtsgericht": "Amtsgericht Düsseldorf",
      "registernummer": "HRB 65211",
      "registerart": "HRB",
      "company_name": "Azerion AG",
      "company_seat": "Düsseldorf",
      "details": "20.05.2025 (Bekanntmachungsdatum)\n\nNordrhein-Westfalen Amtsgericht Düsseldorf HRB 65211\nRegisterbekanntmachung nach dem Umwandlungsgesetz 20.05.2025 (Eintragungsdatum)\n\nAzerion AG\nAktiengesellschaft\nDüsseldorf\n\nDem Registergericht ist der Entwurf eines Vertrages über die geplante Verschmelzung der Hawk GmbH, TargetSpot Deutschland GmbH, Vlyby Digital GmbH mit der Azerion AG eingereicht worden."
    },
    {
      "date": "2025-05-20",
      "id": "109647",
      "original_text": "Löschungsankündigung\nNordrhein-Westfalen Amtsgericht Aachen HRB 26554\nB & E Gebäudeservice UG (haftungsbeschränkt) – Eschweiler",
      "type": "Löschungsankündigung",
      "state": "Nordrhein-Westfalen",
      "amtsgericht": "Amtsgericht Aachen",
      "registernummer": "HRB 26554",
      "registerart": "HRB",
      "company_name": "B & E Gebäudeservice UG (haftungsbeschränkt)",
      "company_seat": "Eschweiler",
      "details": "20.05.2025 (Bekanntmachungsdatum)\n\nNordrhein-Westfalen Amtsgericht Aachen HRB 26554\nLöschungsankündigung\n\nB & E Gebäudeservice UG (haftungsbeschränkt)\nGesellschaft mit beschränkter Haftung\nEschweiler\n\nDas Registergericht beabsichtigt, von Amts wegen die Gesellschaft wegen Vermögenslosigkeit nach § 394 FamFG zu löschen, weil das Insolvenzverfahren Amtsgericht Aachen (92 IN 176/24) beendet und Vermögen der Gesellschaft nicht mehr erkennbar ist.\n\nZur Geltendmachung des Widerspruchs gegen die beabsichtigte Löschung wird hiermit eine Frist von einem Monat ab Veröffentlichung dieser Ankündigung bestimmt.\n\nRechtsbehelfsbelehrung:\n\nGegen diese Verfügung kann Widerspruch eingelegt werden. Zum Widerspruch ist jeder berechtigt, der an der Unterlassung der Löschung ein berechtigtes Interesse hat.\n\nDer Widerspruch ist bei dem Amtsgericht Aachen, Adalbertsteinweg 92, 52070 Aachen schriftlich in deutscher Sprache oder zur Niederschrift der Geschäftsstelle einzulegen. Der Widerspruch kann auch zur Niederschrift der Geschäftsstelle eines jeden Amtsgerichtes abgegeben werden.\n\nDer Widerspruch muss spätestens innerhalb der gesetzten Frist nach der Bekanntgabe der Verfügung bei dem Amtsgericht Aachen eingegangen sein. Dies gilt auch dann, wenn der Widerspruch zur Niederschrift der Geschäftsstelle eines anderen Amtsgerichtes abgegeben wurde. Die Frist beginnt mit der Bekanntgabe der Verfügung durch Veröffentlichung. Fällt das Ende der Frist auf einen Sonntag, einen allgemeinen Feiertag oder Sonnabend, so endet die Frist mit Ablauf des nächsten Werktages.\n\nDer Widerspruch muss die Bezeichnung der angefochtenen Verfügung sowie die Erklärung enthalten, dass Widerspruch gegen diese Verfügung eingelegt wird. Er ist zu unterzeichnen und soll begründet werden.\n\nDie Einlegung ist auch durch Übertragung eines elektronischen Dokuments an die elektronische Poststelle des Gerichts möglich. Das elektronische Dokument muss für die Bearbeitung durch das Gericht geeignet und mit einer qualifizierten elektronischen Signatur der verantwortenden Person versehen sein oder von der verantwortenden Person signiert und auf einem sicheren Übermittlungsweg gemäß § 130 a ZPO nach näherer Maßgabe der Verordnung über die technischen Rahmenbedingungen des elektronischen Rechtsverkehrs und über das besondere elektronische Behördenpostfach (BGBl. I, S. 3803) eingereicht werden. Weitere Informationen erhalten Sie auf der Internetseite www.justiz.de."
    },
    {
      "date": "2025-05-20",
      "id": "109648",
      "original_text": "Sonstige Registerbekanntmachung\nNordrhein-Westfalen Amtsgericht Düren HRB 6224\n5flow GmbH – Jülich",
      "type": "Sonstige Registerbekanntmachung",
      "state": "Nordrhein-Westfalen",
      "amtsgericht": "Amtsgericht Düren",
      "registernummer": "HRB 6224",
      "registerart": "HRB",
      "company_name": "5flow GmbH",
      "company_seat": "Jülich",
      "details": "20.05.2025 (Bekanntmachungsdatum)\n\nNordrhein-Westfalen Amtsgericht Düren HRB 6224\nSonstige Registerbekanntmachung 19.05.2025 (Eintragungsdatum)\n\n5flow GmbH\nGesellschaft mit beschränkter Haftung\nJülich\n\nAls nicht eingetragen wird veröffentlicht: Den Gläubigern der Gesellschaft, deren Forderungen begründet worden sind bevor die Eintragung der Beendigung des Vertrages  in das Handelsregister nach § 10 des Handelsgesetzbuches als bekanntgemacht gilt, hat der andere Vertragsteil Sicherheit zu leisten, wenn sie sich binnen sechs Monaten nach der Bekanntmachung der Eintragung zu diesem Zweck bei ihm melden."
    },
    {
      "date": "2025-05-20",
      "id": "109649",
      "original_text": "Löschungsankündigung\nNordrhein-Westfalen Amtsgericht Krefeld HRB 17992\nKaczor UG (haftungsbeschränkt) – Krefeld",
      "type": "Löschungsankündigung",
      "state": "Nordrhein-Westfalen",
      "amtsgericht": "Amtsgericht Krefeld",
      "registernummer": "HRB 17992",
      "registerart": "HRB",
      "company_name": "Kaczor UG (haftungsbeschränkt)",
      "company_seat": "Krefeld",
      "details": "20.05.2025 (Bekanntmachungsdatum)\n\nNordrhein-Westfalen Amtsgericht Krefeld HRB 17992\nLöschungsankündigung\n\nKaczor UG (haftungsbeschränkt)\nGesellschaft mit beschränkter Haftung\nKrefeld\n\nDas Registergericht beabsichtigt die Gesellschaft von Amts wegen nach § 394 FamFG zu löschen. Die Frist zur Erhebung eines Widerspruchs ist auf einen Monat festgesetzt."
    },
    {
      "date": "2025-05-20",
      "id": "109650",
      "original_text": "Registerbekanntmachung nach dem Umwandlungsgesetz\nNordrhein-Westfalen Amtsgericht Köln HRB 123318\nBesau & Langenhorst Rechtsanwaltsgesellschaft mbH – Hürth",
      "type": "Registerbekanntmachung nach dem Umwandlungsgesetz",
      "state": "Nordrhein-Westfalen",
      "amtsgericht": "Amtsgericht Köln",
      "registernummer": "HRB 123318",
      "registerart": "HRB",
      "company_name": "Besau & Langenhorst Rechtsanwaltsgesellschaft mbH",
      "company_seat": "Hürth",
      "details": "20.05.2025 (Bekanntmachungsdatum)\n\nNordrhein-Westfalen Amtsgericht Köln HRB 123318\nRegisterbekanntmachung nach dem Umwandlungsgesetz 20.05.2025 (Eintragungsdatum)\n\nBesau & Langenhorst Rechtsanwaltsgesellschaft mbH\nGesellschaft mit beschränkter Haftung\nHürth\n\nDen Gläubigern der an der formwechselnden Umwandlung beteiligten Rechtsträger ist, wenn sie binnen sechs Monaten nach dem Tag, an dem die Eintragung der formwechselnden Umwandlung in das Register des Sitzes desjenigen Rechtsträgers, dessen Gläubiger sie sind, nach § 19 Absatz 3 UmwG als bekanntgemacht gilt, ihren Anspruch nach Grund und Höhe schriftlich anmelden, Sicherheit zu leisten, soweit sie nicht Befriedigung verlangen können. Dieses Recht steht den Gläubigern jedoch nur zu, wenn sie glaubhaft machen, dass durch die formwechselnden Umwandlung die Erfüllung ihrer Forderung gefährdet wird."
    },
    {
      "date": "2025-05-20",
      "id": "109651",
      "original_text": "Löschungsankündigung\nNordrhein-Westfalen Amtsgericht Aachen HRB 17494\nSCRIMPPCORP Management UG (haftungsbeschränkt) – Würselen",
      "type": "Löschungsankündigung",
      "state": "Nordrhein-Westfalen",
      "amtsgericht": "Amtsgericht Aachen",
      "registernummer": "HRB 17494",
      "registerart": "HRB",
      "company_name": "SCRIMPPCORP Management UG (haftungsbeschränkt)",
      "company_seat": "Würselen",
      "details": "20.05.2025 (Bekanntmachungsdatum)\n\nNordrhein-Westfalen Amtsgericht Aachen HRB 17494\nLöschungsankündigung\n\nSCRIMPPCORP Management UG (haftungsbeschränkt)\nGesellschaft mit beschränkter Haftung\nWürselen\n\nDas Registergericht beabsichtigt, von Amts wegen die Gesellschaft wegen Vermögenslosigkeit nach § 394 FamFG zu löschen, weil das Insolvenzverfahren Amtsgericht Aachen (Az.: 92 IN 301/24) beendet und Vermögen der Gesellschaft nicht mehr erkennbar ist.\n\nZur Geltendmachung des Widerspruchs gegen die beabsichtigte Löschung wird hiermit eine Frist von einem Monat ab Veröffentlichung dieser Ankündigung bestimmt.\n\nRechtsbehelfsbelehrung:\n\nGegen diese Verfügung kann Widerspruch eingelegt werden. Zum Widerspruch ist jeder berechtigt, der an der Unterlassung der Löschung ein berechtigtes Interesse hat.\n\nDer Widerspruch ist bei dem Amtsgericht Aachen, Adalbertsteinweg 92, 52070 Aachen schriftlich in deutscher Sprache oder zur Niederschrift der Geschäftsstelle einzulegen. Der Widerspruch kann auch zur Niederschrift der Geschäftsstelle eines jeden Amtsgerichtes abgegeben werden.\n\nDer Widerspruch muss spätestens innerhalb der gesetzten Frist nach der Bekanntgabe der Verfügung bei dem Amtsgericht Aachen eingegangen sein. Dies gilt auch dann, wenn der Widerspruch zur Niederschrift der Geschäftsstelle eines anderen Amtsgerichtes abgegeben wurde. Die Frist beginnt mit der Bekanntgabe der Verfügung durch Veröffentlichung. Fällt das Ende der Frist auf einen Sonntag, einen allgemeinen Feiertag oder Sonnabend, so endet die Frist mit Ablauf des nächsten Werktages.\n\nDer Widerspruch muss die Bezeichnung der angefochtenen Verfügung sowie die Erklärung enthalten, dass Widerspruch gegen diese Verfügung eingelegt wird. Er ist zu unterzeichnen und soll begründet werden.\n\nDie Einlegung ist auch durch Übertragung eines elektronischen Dokuments an die elektronische Poststelle des Gerichts möglich. Das elektronische Dokument muss für die Bearbeitung durch das Gericht geeignet und mit einer qualifizierten elektronischen Signatur der verantwortenden Person versehen sein oder von der verantwortenden Person signiert und auf einem sicheren Übermittlungsweg gemäß § 130 a ZPO nach näherer Maßgabe der Verordnung über die technischen Rahmenbedingungen des elektronischen Rechtsverkehrs und über das besondere elektronische Behördenpostfach (BGBl. I, S. 3803) eingereicht werden. Weitere Informationen erhalten Sie auf der Internetseite www.justiz.de."
    },
    {
      "date": "2025-05-20",
      "id": "109652",
      "original_text": "Löschungsankündigung\nNordrhein-Westfalen Amtsgericht Dortmund HRB 31332\nBW Holding UG (haftungsbeschränkt) – Castrop-Rauxel",
      "type": "Löschungsankündigung",
      "state": "Nordrhein-Westfalen",
      "amtsgericht": "Amtsgericht Dortmund",
      "registernummer": "HRB 31332",
      "registerart": "HRB",
      "company_name": "BW Holding UG (haftungsbeschränkt)",
      "company_seat": "Castrop-Rauxel",
      "details": "20.05.2025 (Bekanntmachungsdatum)\n\nNordrhein-Westfalen Amtsgericht Dortmund HRB 31332\nLöschungsankündigung\n\nBW Holding UG (haftungsbeschränkt)\nGesellschaft mit beschränkter Haftung\nCastrop-Rauxel\n\nDas Registergericht beabsichtigt die Gesellschaft von Amts wegen nach § 394 FamFG zu löschen. Die Frist zur Erhebung eines Widerspruchs ist auf zwei Monate festgesetzt."
    },
    {
      "date": "2025-05-20",
      "id": "109653",
      "original_text": "Registerbekanntmachung nach dem Umwandlungsgesetz\nNordrhein-Westfalen Amtsgericht Duisburg HRA 8846\nGerstel GmbH & Co. KG – Mülheim an der Ruhr",
      "type": "Registerbekanntmachung nach dem Umwandlungsgesetz",
      "state": "Nordrhein-Westfalen",
      "amtsgericht": "Amtsgericht Duisburg",
      "registernummer": "HRA 8846",
      "registerart": "HRA",
      "company_name": "Gerstel GmbH & Co. KG",
      "company_seat": "Mülheim an der Ruhr",
      "details": "20.05.2025 (Bekanntmachungsdatum)\n\nNordrhein-Westfalen Amtsgericht Duisburg HRA 8846\nRegisterbekanntmachung nach dem Umwandlungsgesetz 20.05.2025 (Eintragungsdatum)\n\nGerstel GmbH & Co. KG\nKommanditgesellschaft\nMülheim an der Ruhr\n\nDen Gläubigern der an der Verschmelzung beteiligten Rechtsträger ist, wenn sie binnen sechs Monaten nach dem Tag, an dem die Eintragung der Verschmelzung in das Register des Sitzes desjenigen Rechtsträgers, dessen Gläubiger sie sind, nach § 19 Absatz 3 UmwG als bekanntgemacht gilt, ihren Anspruch nach Grund und Höhe schriftlich anmelden, Sicherheit zu leisten, soweit sie nicht Befriedigung verlangen können. Dieses Recht steht den Gläubigern jedoch nur zu, wenn sie glaubhaft machen, dass durch die Verschmelzung die Erfüllung ihrer Forderung gefährdet wird."
    },
    {
      "date": "2025-05-20",
      "id": "109654",
      "original_text": "Löschungsankündigung\nNordrhein-Westfalen Amtsgericht Siegburg HRB 16132\nUBA Trading GmbH – Troisdorf",
      "type": "Löschungsankündigung",
      "state": "Nordrhein-Westfalen",
      "amtsgericht": "Amtsgericht Siegburg",
      "registernummer": "HRB 16132",
      "registerart": "HRB",
      "company_name": "UBA Trading GmbH",
      "company_seat": "Troisdorf",
      "details": "20.05.2025 (Bekanntmachungsdatum)\n\nNordrhein-Westfalen Amtsgericht Siegburg HRB 16132\nLöschungsankündigung\n\nUBA Trading GmbH\nGesellschaft mit beschränkter Haftung\nTroisdorf\n\nDas Registergericht hat glaubhafte Kenntnis erlangt, dass die Gesellschaft vermögenslos geworden ist, da Zwangsvollstreckungsmaßnahmen des Finanzamtes Siegburg erfolglos geblieben sind.\n\nEs ist daher beabsichtigt, die Gesellschaft nach § 394 FamFG im Handelsregister wegen Vermögenslosigkeit zu löschen.\n\nEinwände gegen die Löschung sind durch Widerspruch binnen einer Frist von 3 Monaten geltend zu machen, andernfalls die Löschung erfolgen wird.\n\nEinzulegen ist der Widerspruch bei dem Amtsgericht Siegburg, Neue Poststraße 16, 53721 Siegburg, und zwar entweder schriftlich in deutscher Sprache oder mündlich zur Niederschrift der Geschäftsstelle. Der Widerspruch kann auch zur Niederschrift der Geschäftsstelle eines jeden Amtsgerichts abgegeben werden. Der Widerspruch ist binnen der in der Verfügung bestimmten Frist einzulegen. Die Frist ist nur gewahrt, wenn der Widerspruch rechtzeitig bei dem Amtsgericht Siegburg eingeht, auch wenn der Widerspruch zur Niederschrift der Geschäftsstelle eines anderen Amtsgerichts abgegeben wurde. Die Frist beginnt jeweils mit der schriftlichen Bekanntgabe der Verfügung an die Beteiligten. Kann die schriftliche Bekanntgabe an einen Beteiligten nicht bewirkt werden, beginnt die Frist spätestens mit Ablauf von fünf Monaten nach Erlass der Verfügung. Die Bekanntgabe ist entweder durch Zustellung oder am dritten Tage nach Aufgabe zur Post bewirkt. Sofern die Löschung noch nicht erfolgt ist, kann der Widerspruch auch noch nach Ablauf der Frist eingelegt werden. Fällt das Ende der Frist auf einen Sonnabend, einen Sonntag oder einen allgemeinen Feiertag, endet die Frist mit Ablauf des nächsten Werktages. Der Widerspruch ist zu unterzeichnen. Eine Begründung des Widerspruchs ist nicht vorgeschrieben."
    },
    {
      "date": "2025-05-20",
      "id": "109655",
      "original_text": "Registerbekanntmachung nach dem Umwandlungsgesetz\nNordrhein-Westfalen Amtsgericht Düsseldorf HRB 68039\nWIZOO Publishing GmbH – Düsseldorf",
      "type": "Registerbekanntmachung nach dem Umwandlungsgesetz",
      "state": "Nordrhein-Westfalen",
      "amtsgericht": "Amtsgericht Düsseldorf",
      "registernummer": "HRB 68039",
      "registerart": "HRB",
      "company_name": "WIZOO Publishing GmbH",
      "company_seat": "Düsseldorf",
      "details": "20.05.2025 (Bekanntmachungsdatum)\n\nNordrhein-Westfalen Amtsgericht Düsseldorf HRB 68039\nRegisterbekanntmachung nach dem Umwandlungsgesetz 20.05.2025 (Eintragungsdatum)\n\nWIZOO Publishing GmbH\nGesellschaft mit beschränkter Haftung\nDüsseldorf\n\nDen Gläubigern der an der Verschmelzung beteiligten Rechtsträger ist, wenn sie binnen sechs Monaten nach dem Tag, an dem die Eintragung der Verschmelzung in das Register des Sitzes desjenigen Rechtsträgers, dessen Gläubiger sie sind, nach § 19 Absatz 3 UmwG als bekanntgemacht gilt, ihren Anspruch nach Grund und Höhe schriftlich anmelden, Sicherheit zu leisten, soweit sie nicht Befriedigung verlangen können. Dieses Recht steht den Gläubigern jedoch nur zu, wenn sie glaubhaft machen, dass durch die Verschmelzung die Erfüllung ihrer Forderung gefährdet wird."
    },
    {
      "date": "2025-05-20",
      "id": "109656",
      "original_text": "Registerbekanntmachung nach dem Umwandlungsgesetz\nNordrhein-Westfalen Amtsgericht Bonn HRB 12905\nDeutsche Telekom Corporate Investments GmbH – Bonn",
      "type": "Registerbekanntmachung nach dem Umwandlungsgesetz",
      "state": "Nordrhein-Westfalen",
      "amtsgericht": "Amtsgericht Bonn",
      "registernummer": "HRB 12905",
      "registerart": "HRB",
      "company_name": "Deutsche Telekom Corporate Investments GmbH",
      "company_seat": "Bonn",
      "details": "20.05.2025 (Bekanntmachungsdatum)\n\nNordrhein-Westfalen Amtsgericht Bonn HRB 12905\nRegisterbekanntmachung nach dem Umwandlungsgesetz 20.05.2025 (Eintragungsdatum)\n\nDeutsche Telekom Corporate Investments GmbH\nGesellschaft mit beschränkter Haftung\nBonn\n\nDen Gläubigern der an der Verschmelzung beteiligten Rechtsträger ist, wenn sie binnen sechs Monaten nach dem Tag, an dem die Eintragung der Verschmelzung in das Register des Sitzes derjenigen Rechtsträger deren Gläubiger sie sind, nach § 19 Absatz 3 UmwG als bekanntgemacht gilt, ihren Anspruch nach Grund und Höhe schriftlich anmelden, Sicherheit zu leisten, soweit sie nicht Befriedigung verlangen können. Dieses Recht steht den Gläubigern jedoch nur zu, wenn sie glaubhaft machen, dass durch die Verschmelzung die Erfüllung ihrer Forderung gefährdet wird."
    },
    {
      "date": "2025-05-20",
      "id": "109657",
      "original_text": "Registerbekanntmachung nach dem Umwandlungsgesetz\nNordrhein-Westfalen Amtsgericht Münster HRB 22125\nProvinzial Next Aktiengesellschaft – Münster",
      "type": "Registerbekanntmachung nach dem Umwandlungsgesetz",
      "state": "Nordrhein-Westfalen",
      "amtsgericht": "Amtsgericht Münster",
      "registernummer": "HRB 22125",
      "registerart": "HRB",
      "company_name": "Provinzial Next Aktiengesellschaft",
      "company_seat": "Münster",
      "details": "20.05.2025 (Bekanntmachungsdatum)\n\nNordrhein-Westfalen Amtsgericht Münster HRB 22125\nRegisterbekanntmachung nach dem Umwandlungsgesetz\n\nProvinzial Next Aktiengesellschaft\nAktiengesellschaft\nMünster\n\nDem Registergericht ist der Entwurf eines Vertrages über die geplante Abspaltung von Vermögensteilen der Provinzial Versicherung Aktiengesellschaft, Düsseldorf, Amtsgericht Düsseldorf HRB 41241, auf die Provinzial Next Aktiengesellschaft, Münster, Amtsgericht Münster HRB 22125, dem die für den 26.06.2025 vorgesehene Hauptversammlung zustimmen soll, eingereicht worden."
    },
    {
      "date": "2025-05-20",
      "id": "109658",
      "original_text": "Registerbekanntmachung nach dem Umwandlungsgesetz\nNordrhein-Westfalen Amtsgericht Münster HRB 22125\nProvinzial Next Aktiengesellschaft – Münster",
      "type": "Registerbekanntmachung nach dem Umwandlungsgesetz",
      "state": "Nordrhein-Westfalen",
      "amtsgericht": "Amtsgericht Münster",
      "registernummer": "HRB 22125",
      "registerart": "HRB",
      "company_name": "Provinzial Next Aktiengesellschaft",
      "company_seat": "Münster",
      "details": "20.05.2025 (Bekanntmachungsdatum)\n\nNordrhein-Westfalen Amtsgericht Münster HRB 22125\nRegisterbekanntmachung nach dem Umwandlungsgesetz\n\nProvinzial Next Aktiengesellschaft\nAktiengesellschaft\nMünster\n\nDem Registergericht ist der Entwurf eines Vertrages über die geplante Abspaltung von Vermögensteilen der Provinzial Beteiligungsgesellschaft mbH, Münster, Amtsgericht Münster HRB 17112, auf die Provinzial Next Aktiengesellschaft, Münster, Amtsgericht Münster HRB 22125, dem die für den 26.06.2025 vorgesehene Hauptversammlung zustimmen soll, eingereicht worden."
    },
    {
      "date": "2025-05-20",
      "id": "109659",
      "original_text": "Einreichung neuer Dokumente\nNordrhein-Westfalen Amtsgericht Siegburg HRB 13275\nEmitec Technologies GmbH – Lohmar",
      "type": "Einreichung neuer Dokumente",
      "state": "Nordrhein-Westfalen",
      "amtsgericht": "Amtsgericht Siegburg",
      "registernummer": "HRB 13275",
      "registerart": "HRB",
      "company_name": "Emitec Technologies GmbH",
      "company_seat": "Lohmar",
      "details": "20.05.2025 (Bekanntmachungsdatum)\n\nNordrhein-Westfalen Amtsgericht Siegburg HRB 13275\nEinreichung neuer Dokumente\n\nEmitec Technologies GmbH\nGesellschaft mit beschränkter Haftung\nLohmar\n\nDem Registergericht ist eine Liste der Mitglieder des Aufsichtsrates eingereicht worden."
    },
    {
      "date": "2025-05-20",
      "id": "109660",
      "original_text": "Registerbekanntmachung nach dem Umwandlungsgesetz\nNordrhein-Westfalen Amtsgericht Bonn HRB 15994\nDeutsche Telekom hub:raum Fund GmbH – Bonn",
      "type": "Registerbekanntmachung nach dem Umwandlungsgesetz",
      "state": "Nordrhein-Westfalen",
      "amtsgericht": "Amtsgericht Bonn",
      "registernummer": "HRB 15994",
      "registerart": "HRB",
      "company_name": "Deutsche Telekom hub:raum Fund GmbH",
      "company_seat": "Bonn",
      "details": "20.05.2025 (Bekanntmachungsdatum)\n\nNordrhein-Westfalen Amtsgericht Bonn HRB 15994\nRegisterbekanntmachung nach dem Umwandlungsgesetz 20.05.2025 (Eintragungsdatum)\n\nDeutsche Telekom hub:raum Fund GmbH\nGesellschaft mit beschränkter Haftung\nBonn\n\nDen Gläubigern der an der Verschmelzung beteiligten Rechtsträger ist, wenn sie binnen sechs Monaten nach dem Tag, an dem die Eintragung der Verschmelzung in das Register des Sitzes derjenigen Rechtsträger deren Gläubiger sie sind, nach § 19 Absatz 3 UmwG als bekanntgemacht gilt, ihren Anspruch nach Grund und Höhe schriftlich anmelden, Sicherheit zu leisten, soweit sie nicht Befriedigung verlangen können. Dieses Recht steht den Gläubigern jedoch nur zu, wenn sie glaubhaft machen, dass durch die Verschmelzung die Erfüllung ihrer Forderung gefährdet wird."
    },
    {
      "date": "2025-05-20",
      "id": "109661",
      "original_text": "Löschungsankündigung\nNordrhein-Westfalen Amtsgericht Krefeld HRB 12425\nBeSt Verwaltungs GmbH – Willich",
      "type": "Löschungsankündigung",
      "state": "Nordrhein-Westfalen",
      "amtsgericht": "Amtsgericht Krefeld",
      "registernummer": "HRB 12425",
      "registerart": "HRB",
      "company_name": "BeSt Verwaltungs GmbH",
      "company_seat": "Willich",
      "details": "20.05.2025 (Bekanntmachungsdatum)\n\nNordrhein-Westfalen Amtsgericht Krefeld HRB 12425\nLöschungsankündigung\n\nBeSt Verwaltungs GmbH\nGesellschaft mit beschränkter Haftung\nWillich\n\nDas Registergericht beabsichtigt die Gesellschaft von Amts wegen nach § 394 FamFG zu löschen. Die Frist zur Erhebung eines Widerspruchs ist auf einen Monat festgesetzt."
    },
    {
      "date": "2025-05-20",
      "id": "109662",
      "original_text": "Registerbekanntmachung nach dem Umwandlungsgesetz\nNordrhein-Westfalen Amtsgericht Duisburg HRB 19797\nRemise 3 Medienservice Agentur GmbH – Dinslaken",
      "type": "Registerbekanntmachung nach dem Umwandlungsgesetz",
      "state": "Nordrhein-Westfalen",
      "amtsgericht": "Amtsgericht Duisburg",
      "registernummer": "HRB 19797",
      "registerart": "HRB",
      "company_name": "Remise 3 Medienservice Agentur GmbH",
      "company_seat": "Dinslaken",
      "details": "20.05.2025 (Bekanntmachungsdatum)\n\nNordrhein-Westfalen Amtsgericht Duisburg HRB 19797\nRegisterbekanntmachung nach dem Umwandlungsgesetz 20.05.2025 (Eintragungsdatum)\n\nRemise 3 Medienservice Agentur GmbH\nGesellschaft mit beschränkter Haftung\nDinslaken\n\nDie Gesellschaft hat Gläubigern, deren Forderungen vor dieser Bekanntmachung begründet worden sind, Sicherheit zu leisten, soweit sie nicht Befriedigung verlangen können, wenn sie sich binnen sechs Monaten zu diesem Zweck melden."
    },
    {
      "date": "2025-05-20",
      "id": "109663",
      "original_text": "Registerbekanntmachung nach dem Umwandlungsgesetz\nNordrhein-Westfalen Amtsgericht Siegburg HRB 408\nSchoeller Eitorf Aktiengesellschaft – Eitorf",
      "type": "Registerbekanntmachung nach dem Umwandlungsgesetz",
      "state": "Nordrhein-Westfalen",
      "amtsgericht": "Amtsgericht Siegburg",
      "registernummer": "HRB 408",
      "registerart": "HRB",
      "company_name": "Schoeller Eitorf Aktiengesellschaft",
      "company_seat": "Eitorf",
      "details": "20.05.2025 (Bekanntmachungsdatum)\n\nNordrhein-Westfalen Amtsgericht Siegburg HRB 408\nRegisterbekanntmachung nach dem Umwandlungsgesetz 20.05.2025 (Eintragungsdatum)\n\nSchoeller Eitorf Aktiengesellschaft\nAktiengesellschaft\nEitorf\n\nDen Gläubigern der an der Verschmelzung beteiligten Rechtsträger ist, wenn sie binnen sechs Monaten nach dem Tag, an dem die Eintragung der Verschmelzung in das Register des Sitzes desjenigen Rechtsträgers, dessen Gläubiger sie sind, nach § 19 Absatz 3 UmwG als bekanntgemacht gilt, ihren Anspruch nach Grund und Höhe schriftlich anmelden, Sicherheit zu leisten, soweit sie nicht Befriedigung verlangen können. Dieses Recht steht den Gläubigern jedoch nur zu, wenn sie glaubhaft machen, dass durch die Verschmelzung die Erfüllung ihrer Forderung gefährdet wird."
    },
    {
      "date": "2025-05-20",
      "id": "109664",
      "original_text": "Registerbekanntmachung nach dem Umwandlungsgesetz\nNordrhein-Westfalen Amtsgericht Hamm VR 10151 früher Amtsgericht Kamen\nTennisverein Blau-Weiß Bergkamen 1979 e.V. – Bergkamen",
      "type": "Registerbekanntmachung nach dem Umwandlungsgesetz",
      "state": "Nordrhein-Westfalen",
      "amtsgericht": "Amtsgericht Hamm",
      "registernummer": "VR 10151",
      "registerart": "VR",
      "company_name": "Tennisverein Blau-Weiß Bergkamen 1979 e.V.",
      "company_seat": "Bergkamen",
      "former_amtsgericht": "Kamen",
      "details": "20.05.2025 (Bekanntmachungsdatum)\n\nNordrhein-Westfalen Amtsgericht Hamm VR 10151 früher Amtsgericht Kamen\nRegisterbekanntmachung nach dem Umwandlungsgesetz 20.05.2025 (Eintragungsdatum)\n\nTennisverein Blau-Weiß Bergkamen 1979 e.V.\neingetragener Verein\nBergkamen\n\nDen Gläubigern der an der Verschmelzung beteiligten Rechtsträger ist, wenn sie binnen sechs Monaten nach dem Tag, an dem die Eintragung der Verschmelzung in das Register des Sitzes desjenigen Rechtsträgers, dessen Gläubiger sie sind, nach § 19 Absatz 3 UmwG als bekanntgemacht gilt, ihren Anspruch nach Grund und Höhe schriftlich anmelden, Sicherheit zu leisten, soweit sie nicht Befriedigung verlangen können. Dieses Recht steht den Gläubigern jedoch nur zu, wenn sie glaubhaft machen, dass durch die Verschmelzung die Erfüllung ihrer Forderung gefährdet wird."
    },
    {
      "date": "2025-05-20",
      "id": "109665",
      "original_text": "Löschungsankündigung\nNordrhein-Westfalen Amtsgericht Düsseldorf HRB 67924\nCRETECH GmbH – Düsseldorf",
      "type": "Löschungsankündigung",
      "state": "Nordrhein-Westfalen",
      "amtsgericht": "Amtsgericht Düsseldorf",
      "registernummer": "HRB 67924",
      "registerart": "HRB",
      "company_name": "CRETECH GmbH",
      "company_seat": "Düsseldorf",
      "details": "20.05.2025 (Bekanntmachungsdatum)\n\nNordrhein-Westfalen Amtsgericht Düsseldorf HRB 67924\nLöschungsankündigung\n\nCRETECH GmbH\nGesellschaft mit beschränkter Haftung\nDüsseldorf\n\nDas Registergericht beabsichtigt die Gesellschaft von Amts wegen nach § 394 FamFG zu löschen. Die Frist zur Erhebung eines Widerspruchs ist auf 3 Wochen festgesetzt.\n\nRechtsbehelfsbelehrung:\nDas Widerspruchsrecht steht jedem zu, der an der Unterlassung der Löschung ein berechtigtes Interesse hat. Der Widerspruch ist bei dem Amtsgericht Düsseldorf -Registergericht-, Werdener Straße 1, 40227 Düsseldorf schriftlich in deutscher Sprache oder zur Niederschrift der Geschäftsstelle einzulegen. Der Widerspruch kann auch zur Niederschrift der Geschäftsstelle eines jeden Amtsgerichtes abgegeben werden. Die Einlegung ist auch durch Übertragung eines elektronischen Dokuments an die elektronische Poststelle des Gerichts möglich. Das elektronische Dokument muss für die Bearbeitung durch das Gericht geeignet und mit einer qualifizierten elektronischen Signatur der verantwortenden Person versehen sein oder von der verantwortenden Person signiert und auf einem sicheren Übermittlungsweg gemäß § 130a ZPO nach näherer Maßgabe der Verordnung über die technischen Rahmenbedingungen des elektronischen Rechtsverkehrs und über das besondere elektronische Behördenpostfach (BGBl. I, S.3803) eingereicht werden. Weitere Informationen erhalten Sie auf der Internetseite www.justiz.de.\nDer Widerspruch muss spätestens innerhalb der gesetzten Frist nach dem Datum der Bekanntmachung der Löschungsankündigung bei dem Amtsgericht - Registergericht - Düsseldorf eingegangen sein.  Dies gilt auch dann, wenn der Widerspruch zur Niederschrift der Geschäftsstelle eines anderen Amtsgerichtes abgegeben wurde. Die Frist beginnt mit dem Tage der Bekanntmachung der Löschungsankündigung in dem für die Bekanntmachung der Eintragungen in das Handelsregister bestimmten elektronischen Informations- und Kommunikationssystem nach § 10 des Handelsgesetzbuches. Fällt das Ende der Frist auf einen Sonntag, einen allgemeinen Feiertag oder Sonnabend, so endet die Frist mit Ablauf des nächsten Werktages.\nDer Widerspruch muss die Bezeichnung der angefochtenen Löschungsankündigung sowie die Erklärung enthalten, dass Widerspruch gegen diese Löschungsankündigung eingelegt wird. Er ist zu unterzeichnen und soll begründet werden."
    },
    {
      "date": "2025-05-20",
      "id": "109666",
      "original_text": "Registerbekanntmachung nach dem Umwandlungsgesetz\nNordrhein-Westfalen Amtsgericht Düsseldorf HRA 20613\nNaxos Objekt Lüdenscheid SARL & Co. KG – Düsseldorf",
      "type": "Registerbekanntmachung nach dem Umwandlungsgesetz",
      "state": "Nordrhein-Westfalen",
      "amtsgericht": "Amtsgericht Düsseldorf",
      "registernummer": "HRA 20613",
      "registerart": "HRA",
      "company_name": "Naxos Objekt Lüdenscheid SARL & Co. KG",
      "company_seat": "Düsseldorf",
      "details": "20.05.2025 (Bekanntmachungsdatum)\n\nNordrhein-Westfalen Amtsgericht Düsseldorf HRA 20613\nRegisterbekanntmachung nach dem Umwandlungsgesetz\n\nNaxos Objekt Lüdenscheid SARL & Co. KG\nKommanditgesellschaft\nDüsseldorf\n\nEs wird darauf hingewiesen, dass ein Entwurf des Formwechselplans vom 28.03.2025 über einen grenzüberschreitenden vollständigen Formwechsel der bisher binationalen Kommanditgesellschaft Naxos Objekt Lüdenscheid SARL & Co. KG mit Sitz in Düsseldorf (Amtsgericht Düsseldorf, HRA 20613)  in die Naxos Objekt Lüdenscheid SCS (société en commandite simple) mit Sitz in Luxemburg, Großherzogtum Luxemburg, (Registre de Commerce et des Sociétés de Luxembourg, B290015) beim Handelsregister eingereicht worden ist.\nDie Anteilsinhaber, die Gläubiger, sowie die zuständigen Betriebsräte der an dem grenzüberschreitenden Formwechsel beteiligten Gesellschaft oder, soweit es keinen Betriebsrat gibt, die Arbeitnehmer der an dem grenzüberschreitenden Formwechsel beteiligten Gesellschaft, können der Gesellschaft spätestens fünf Arbeitstage vor dem Tag der Gesellschafterversammlung Bemerkungen zum Formwechselplan übermitteln."
    },
    {
      "date": "2025-05-20",
      "id": "109667",
      "original_text": "Registerbekanntmachung nach dem Umwandlungsgesetz\nNordrhein-Westfalen Amtsgericht Düsseldorf HRB 69881\ndigital dna GmbH – Düsseldorf",
      "type": "Registerbekanntmachung nach dem Umwandlungsgesetz",
      "state": "Nordrhein-Westfalen",
      "amtsgericht": "Amtsgericht Düsseldorf",
      "registernummer": "HRB 69881",
      "registerart": "HRB",
      "company_name": "digital dna GmbH",
      "company_seat": "Düsseldorf",
      "details": "20.05.2025 (Bekanntmachungsdatum)\n\nNordrhein-Westfalen Amtsgericht Düsseldorf HRB 69881\nRegisterbekanntmachung nach dem Umwandlungsgesetz 20.05.2025 (Eintragungsdatum)\n\ndigital dna GmbH\nGesellschaft mit beschränkter Haftung\nDüsseldorf\n\nDen Gläubigern der an der Verschmelzung beteiligten Rechtsträger ist, wenn sie binnen sechs Monaten nach dem Tag, an dem die Eintragung der Verschmelzung in das Register des Sitzes desjenigen Rechtsträgers, dessen Gläubiger sie sind, nach § 19 Absatz 3 UmwG als bekanntgemacht gilt, ihren Anspruch nach Grund und Höhe schriftlich anmelden, Sicherheit zu leisten, soweit sie nicht Befriedigung verlangen können. Dieses Recht steht den Gläubigern jedoch nur zu, wenn sie glaubhaft machen, dass durch die Verschmelzung die Erfüllung ihrer Forderung gefährdet wird."
    },
    {
      "date": "2025-05-20",
      "id": "109668",
      "original_text": "Löschungsankündigung\nNordrhein-Westfalen Amtsgericht Düsseldorf HRB 92932\nNovelta GmbH – Düsseldorf",
      "type": "Löschungsankündigung",
      "state": "Nordrhein-Westfalen",
      "amtsgericht": "Amtsgericht Düsseldorf",
      "registernummer": "HRB 92932",
      "registerart": "HRB",
      "company_name": "Novelta GmbH",
      "company_seat": "Düsseldorf",
      "details": "20.05.2025 (Bekanntmachungsdatum)\n\nNordrhein-Westfalen Amtsgericht Düsseldorf HRB 92932\nLöschungsankündigung\n\nNovelta GmbH\nGesellschaft mit beschränkter Haftung\nDüsseldorf\n\nDas Registergericht beabsichtigt die Gesellschaft von Amts wegen nach § 394 FamFG zu löschen. Die Frist zur Erhebung eines Widerspruchs ist auf 3 Wochen festgesetzt.\n\nRechtsbehelfsbelehrung:\nDas Widerspruchsrecht steht jedem zu, der an der Unterlassung der Löschung ein berechtigtes Interesse hat. Der Widerspruch ist bei dem Amtsgericht Düsseldorf -Registergericht-, Werdener Straße 1, 40227 Düsseldorf schriftlich in deutscher Sprache oder zur Niederschrift der Geschäftsstelle einzulegen. Der Widerspruch kann auch zur Niederschrift der Geschäftsstelle eines jeden Amtsgerichtes abgegeben werden. Die Einlegung ist auch durch Übertragung eines elektronischen Dokuments an die elektronische Poststelle des Gerichts möglich. Das elektronische Dokument muss für die Bearbeitung durch das Gericht geeignet und mit einer qualifizierten elektronischen Signatur der verantwortenden Person versehen sein oder von der verantwortenden Person signiert und auf einem sicheren Übermittlungsweg gemäß § 130a ZPO nach näherer Maßgabe der Verordnung über die technischen Rahmenbedingungen des elektronischen Rechtsverkehrs und über das besondere elektronische Behördenpostfach (BGBl. I, S.3803) eingereicht werden. Weitere Informationen erhalten Sie auf der Internetseite www.justiz.de.\nDer Widerspruch muss spätestens innerhalb der gesetzten Frist nach dem Datum der Bekanntmachung der Löschungsankündigung bei dem Amtsgericht - Registergericht - Düsseldorf eingegangen sein.  Dies gilt auch dann, wenn der Widerspruch zur Niederschrift der Geschäftsstelle eines anderen Amtsgerichtes abgegeben wurde. Die Frist beginnt mit dem Tage der Bekanntmachung der Löschungsankündigung in dem für die Bekanntmachung der Eintragungen in das Handelsregister bestimmten elektronischen Informations- und Kommunikationssystem nach § 10 des Handelsgesetzbuches. Fällt das Ende der Frist auf einen Sonntag, einen allgemeinen Feiertag oder Sonnabend, so endet die Frist mit Ablauf des nächsten Werktages.\nDer Widerspruch muss die Bezeichnung der angefochtenen Löschungsankündigung sowie die Erklärung enthalten, dass Widerspruch gegen diese Löschungsankündigung eingelegt wird. Er ist zu unterzeichnen und soll begründet werden."
    },
    {
      "date": "2025-05-20",
      "id": "109669",
      "original_text": "Registerbekanntmachung nach dem Umwandlungsgesetz\nNordrhein-Westfalen Amtsgericht Köln HRB 123331\nMontagetechnik Eulen und Weischer GmbH – Köln",
      "type": "Registerbekanntmachung nach dem Umwandlungsgesetz",
      "state": "Nordrhein-Westfalen",
      "amtsgericht": "Amtsgericht Köln",
      "registernummer": "HRB 123331",
      "registerart": "HRB",
      "company_name": "Montagetechnik Eulen und Weischer GmbH",
      "company_seat": "Köln",
      "details": "20.05.2025 (Bekanntmachungsdatum)\n\nNordrhein-Westfalen Amtsgericht Köln HRB 123331\nRegisterbekanntmachung nach dem Umwandlungsgesetz 20.05.2025 (Eintragungsdatum)\n\nMontagetechnik Eulen und Weischer GmbH\nGesellschaft mit beschränkter Haftung\nKöln\n\nDen Gläubigern der an der formwechselnden Umwandlung beteiligten Rechtsträger ist, wenn sie binnen sechs Monaten nach dem Tag, an dem die Eintragung der formwechselnden Umwandlung in das Register des Sitzes derjenigen Rechtsträger deren Gläubiger sie sind, nach § 19 Absatz 3 UmwG als bekanntgemacht gilt, ihren Anspruch nach Grund und Höhe schriftlich anmelden, Sicherheit zu leisten, soweit sie nicht Befriedigung verlangen können. Dieses Recht steht den Gläubigern jedoch nur zu, wenn sie glaubhaft machen, dass durch die formwechselnden Umwandlung die Erfüllung ihrer Forderung gefährdet wird."
    },
    {
      "date": "2025-05-20",
      "id": "109670",
      "original_text": "Löschungsankündigung\nNordrhein-Westfalen Amtsgericht Köln HRB 24039\nWinand Transporte und Verpackung GmbH – Köln",
      "type": "Löschungsankündigung",
      "state": "Nordrhein-Westfalen",
      "amtsgericht": "Amtsgericht Köln",
      "registernummer": "HRB 24039",
      "registerart": "HRB",
      "company_name": "Winand Transporte und Verpackung GmbH",
      "company_seat": "Köln",
      "details": "20.05.2025 (Bekanntmachungsdatum)\n\nNordrhein-Westfalen Amtsgericht Köln HRB 24039\nLöschungsankündigung\n\nWinand Transporte und Verpackung GmbH\nGesellschaft mit beschränkter Haftung\nKöln\n\nDas Registergericht beabsichtigt die Gesellschaft von Amts wegen nach § 394 FamFG zu löschen. Die Frist zur Erhebung eines Widerspruchs ist auf einen Monat festgesetzt."
    },
    {
      "date": "2025-05-20",
      "id": "109671",
      "original_text": "Registerbekanntmachung nach dem Umwandlungsgesetz\nNordrhein-Westfalen Amtsgericht Bielefeld HRB 43342\nnettrade GmbH – Bielefeld",
      "type": "Registerbekanntmachung nach dem Umwandlungsgesetz",
      "state": "Nordrhein-Westfalen",
      "amtsgericht": "Amtsgericht Bielefeld",
      "registernummer": "HRB 43342",
      "registerart": "HRB",
      "company_name": "nettrade GmbH",
      "company_seat": "Bielefeld",
      "details": "20.05.2025 (Bekanntmachungsdatum)\n\nNordrhein-Westfalen Amtsgericht Bielefeld HRB 43342\nRegisterbekanntmachung nach dem Umwandlungsgesetz 20.05.2025 (Eintragungsdatum)\n\nnettrade GmbH\nGesellschaft mit beschränkter Haftung\nBielefeld\n\nDen Gläubigern der an der Verschmelzung beteiligten Rechtsträger ist, wenn sie binnen sechs Monaten nach dem Tag, an dem die Eintragung der Verschmelzung in das Register des Sitzes desjenigen Rechtsträgers, dessen Gläubiger sie sind, nach § 19 Absatz 3 UmwG als bekanntgemacht gilt, ihren Anspruch nach Grund und Höhe schriftlich anmelden, Sicherheit zu leisten, soweit sie nicht Befriedigung verlangen können. Dieses Recht steht den Gläubigern jedoch nur zu, wenn sie glaubhaft machen, dass durch die Verschmelzung die Erfüllung ihrer Forderung gefährdet wird."
    },
    {
      "date": "2025-05-20",
      "id": "109672",
      "original_text": "Registerbekanntmachung nach dem Umwandlungsgesetz\nNordrhein-Westfalen Amtsgericht Düsseldorf HRA 21954\nNaxos Erste Objekt SARL & Co. KG – Düsseldorf",
      "type": "Registerbekanntmachung nach dem Umwandlungsgesetz",
      "state": "Nordrhein-Westfalen",
      "amtsgericht": "Amtsgericht Düsseldorf",
      "registernummer": "HRA 21954",
      "registerart": "HRA",
      "company_name": "Naxos Erste Objekt SARL & Co. KG",
      "company_seat": "Düsseldorf",
      "details": "20.05.2025 (Bekanntmachungsdatum)\n\nNordrhein-Westfalen Amtsgericht Düsseldorf HRA 21954\nRegisterbekanntmachung nach dem Umwandlungsgesetz\n\nNaxos Erste Objekt SARL & Co. KG\nKommanditgesellschaft\nDüsseldorf\n\nEs wird darauf hingewiesen, dass ein Entwurf des Formwechselplans vom 28.03.2025 über einen grenzüberschreitenden vollständigen Formwechsel der bisher binationalen Kommanditgesellschaft Naxos Erste Objekt SARL & Co. KG mit Sitz in Düsseldorf (Amtsgericht Düsseldorf, HRA 21954)  in die Firma Naxos Erste Objekt SCS (société en commandite simple) mit Sitz in Luxemburg, Großherzogtum Luxemburg, (Registre de Commerce et des Sociétés de Luxembourg, B290016) beim Handelsregister eingereicht worden ist.\nDie Anteilsinhaber, die Gläubiger, sowie die zuständigen Betriebsräte der an dem grenzüberschreitenden Formwechsel beteiligten Gesellschaft oder, soweit es keinen Betriebsrat gibt, die Arbeitnehmer der an dem grenzüberschreitenden Formwechsel beteiligten Gesellschaft, können der Gesellschaft spätestens fünf Arbeitstage vor dem Tag der Gesellschafterversammlung Bemerkungen zum Formwechselplan übermitteln."
    },
    {
      "date": "2025-05-20",
      "id": "109673",
      "original_text": "Registerbekanntmachung nach dem Umwandlungsgesetz\nNordrhein-Westfalen Amtsgericht Köln HRB 107505\nAvenga International Holding GmbH – Köln",
      "type": "Registerbekanntmachung nach dem Umwandlungsgesetz",
      "state": "Nordrhein-Westfalen",
      "amtsgericht": "Amtsgericht Köln",
      "registernummer": "HRB 107505",
      "registerart": "HRB",
      "company_name": "Avenga International Holding GmbH",
      "company_seat": "Köln",
      "details": "20.05.2025 (Bekanntmachungsdatum)\n\nNordrhein-Westfalen Amtsgericht Köln HRB 107505\nRegisterbekanntmachung nach dem Umwandlungsgesetz 20.05.2025 (Eintragungsdatum)\n\nAvenga International Holding GmbH\nGesellschaft mit beschränkter Haftung\nKöln\n\nDen Gläubigern der an der Verschmelzung beteiligten Rechtsträger ist, wenn sie binnen sechs Monaten nach dem Tag, an dem die Eintragung der Verschmelzung in das Register des Sitzes desjenigen Rechtsträgers, dessen Gläubiger sie sind, nach § 19 Absatz 3 UmwG als bekanntgemacht gilt, ihren Anspruch nach Grund und Höhe schriftlich anmelden, Sicherheit zu leisten, soweit sie nicht Befriedigung verlangen können. Dieses Recht steht den Gläubigern jedoch nur zu, wenn sie glaubhaft machen, dass durch die Verschmelzung die Erfüllung ihrer Forderung gefährdet wird."
    },
    {
      "date": "2025-05-20",
      "id": "109674",
      "original_text": "Einreichung neuer Dokumente\nNordrhein-Westfalen Amtsgericht Wuppertal HRB 14521\n\"Stadtwerke Haan GmbH\" – Haan",
      "type": "Einreichung neuer Dokumente",
      "state": "Nordrhein-Westfalen",
      "amtsgericht": "Amtsgericht Wuppertal",
      "registernummer": "HRB 14521",
      "registerart": "HRB",
      "company_name": "\"Stadtwerke Haan GmbH\"",
      "company_seat": "Haan",
      "details": "20.05.2025 (Bekanntmachungsdatum)\n\nNordrhein-Westfalen Amtsgericht Wuppertal HRB 14521\nEinreichung neuer Dokumente 20.05.2025 (Eintragungsdatum)\n\n\"Stadtwerke Haan GmbH\"\nGesellschaft mit beschränkter Haftung\nHaan\n\nDem Registergericht ist eine neue Liste der Mitglieder des Aufsichtsrates eingereicht worden."
    },
    {
      "date": "2025-05-20",
      "id": "109675",
      "original_text": "Registerbekanntmachung nach dem Umwandlungsgesetz\nNordrhein-Westfalen Amtsgericht Köln HRA 38077\nPatrick Eulen und Tilmann Weischer oHG – Köln",
      "type": "Registerbekanntmachung nach dem Umwandlungsgesetz",
      "state": "Nordrhein-Westfalen",
      "amtsgericht": "Amtsgericht Köln",
      "registernummer": "HRA 38077",
      "registerart": "HRA",
      "company_name": "Patrick Eulen und Tilmann Weischer oHG",
      "company_seat": "Köln",
      "details": "20.05.2025 (Bekanntmachungsdatum)\n\nNordrhein-Westfalen Amtsgericht Köln HRA 38077\nRegisterbekanntmachung nach dem Umwandlungsgesetz 20.05.2025 (Eintragungsdatum)\n\nPatrick Eulen und Tilmann Weischer oHG\nOffene Handelsgesellschaft\nKöln\n\nDen Gläubigern der an der formwechselnden Umwandlung beteiligten Rechtsträger ist, wenn sie binnen sechs Monaten nach dem Tag, an dem die Eintragung der formwechselnden Umwandlung in das Register des Sitzes desjenigen Rechtsträgers, dessen Gläubiger sie sind, nach § 19 Absatz 3 UmwG als bekanntgemacht gilt, ihren Anspruch nach Grund und Höhe schriftlich anmelden, Sicherheit zu leisten, soweit sie nicht Befriedigung verlangen können. Dieses Recht steht den Gläubigern jedoch nur zu, wenn sie glaubhaft machen, dass durch die formwechselnden Umwandlung die Erfüllung ihrer Forderung gefährdet wird."
    },
    {
      "date": "2025-05-20",
      "id": "109676",
      "original_text": "Registerbekanntmachung nach dem Umwandlungsgesetz\nNordrhein-Westfalen Amtsgericht Siegburg HRB 13257\nTeamwork Instore Services GmbH – Lohmar",
      "type": "Registerbekanntmachung nach dem Umwandlungsgesetz",
      "state": "Nordrhein-Westfalen",
      "amtsgericht": "Amtsgericht Siegburg",
      "registernummer": "HRB 13257",
      "registerart": "HRB",
      "company_name": "Teamwork Instore Services GmbH",
      "company_seat": "Lohmar",
      "details": "20.05.2025 (Bekanntmachungsdatum)\n\nNordrhein-Westfalen Amtsgericht Siegburg HRB 13257\nRegisterbekanntmachung nach dem Umwandlungsgesetz 20.05.2025 (Eintragungsdatum)\n\nTeamwork Instore Services GmbH\nGesellschaft mit beschränkter Haftung\nLohmar\n\nDen Gläubigern der an der Verschmelzung beteiligten Rechtsträger ist, wenn sie binnen sechs Monaten nach dem Tag, an dem die Eintragung der Verschmelzung in das Register des Sitzes desjenigen Rechtsträgers, dessen Gläubiger sie sind, nach § 19 Absatz 3 UmwG als bekanntgemacht gilt, ihren Anspruch nach Grund und Höhe schriftlich anmelden, Sicherheit zu leisten, soweit sie nicht Befriedigung verlangen können. Dieses Recht steht den Gläubigern jedoch nur zu, wenn sie glaubhaft machen, dass durch die Verschmelzung die Erfüllung ihrer Forderung gefährdet wird."
    },
    {
      "date": "2025-05-20",
      "id": "109677",
      "original_text": "Löschungsankündigung\nNordrhein-Westfalen Amtsgericht Dortmund HRB 27401\nCarparts One GmbH – Dortmund",
      "type": "Löschungsankündigung",
      "state": "Nordrhein-Westfalen",
      "amtsgericht": "Amtsgericht Dortmund",
      "registernummer": "HRB 27401",
      "registerart": "HRB",
      "company_name": "Carparts One GmbH",
      "company_seat": "Dortmund",
      "details": "20.05.2025 (Bekanntmachungsdatum)\n\nNordrhein-Westfalen Amtsgericht Dortmund HRB 27401\nLöschungsankündigung\n\nCarparts One GmbH\nGesellschaft mit beschränkter Haftung\nDortmund\n\nDas Registergericht beabsichtigt die Gesellschaft von Amts wegen nach § 394 FamFG zu löschen. Die Frist zur Erhebung eines Widerspruchs ist auf zwei Monate festgesetzt."
    },
    {
      "date": "2025-05-20",
      "id": "109678",
      "original_text": "Löschungsankündigung\nNordrhein-Westfalen Amtsgericht Düsseldorf HRB 93304\nWestan Bau GmbH – Düsseldorf",
      "type": "Löschungsankündigung",
      "state": "Nordrhein-Westfalen",
      "amtsgericht": "Amtsgericht Düsseldorf",
      "registernummer": "HRB 93304",
      "registerart": "HRB",
      "company_name": "Westan Bau GmbH",
      "company_seat": "Düsseldorf",
      "details": "20.05.2025 (Bekanntmachungsdatum)\n\nNordrhein-Westfalen Amtsgericht Düsseldorf HRB 93304\nLöschungsankündigung\n\nWestan Bau GmbH\nGesellschaft mit beschränkter Haftung\nDüsseldorf\n\nDas Registergericht beabsichtigt die Gesellschaft von Amts wegen nach § 394 FamFG zu löschen. Die Frist zur Erhebung eines Widerspruchs ist auf 3 Wochen festgesetzt.\n\nRechtsbehelfsbelehrung:\nDas Widerspruchsrecht steht jedem zu, der an der Unterlassung der Löschung ein berechtigtes Interesse hat. Der Widerspruch ist bei dem Amtsgericht Düsseldorf -Registergericht-, Werdener Straße 1, 40227 Düsseldorf schriftlich in deutscher Sprache oder zur Niederschrift der Geschäftsstelle einzulegen. Der Widerspruch kann auch zur Niederschrift der Geschäftsstelle eines jeden Amtsgerichtes abgegeben werden. Die Einlegung ist auch durch Übertragung eines elektronischen Dokuments an die elektronische Poststelle des Gerichts möglich. Das elektronische Dokument muss für die Bearbeitung durch das Gericht geeignet und mit einer qualifizierten elektronischen Signatur der verantwortenden Person versehen sein oder von der verantwortenden Person signiert und auf einem sicheren Übermittlungsweg gemäß § 130a ZPO nach näherer Maßgabe der Verordnung über die technischen Rahmenbedingungen des elektronischen Rechtsverkehrs und über das besondere elektronische Behördenpostfach (BGBl. I, S.3803) eingereicht werden. Weitere Informationen erhalten Sie auf der Internetseite www.justiz.de.\nDer Widerspruch muss spätestens innerhalb der gesetzten Frist nach dem Datum der Bekanntmachung der Löschungsankündigung bei dem Amtsgericht - Registergericht - Düsseldorf eingegangen sein.  Dies gilt auch dann, wenn der Widerspruch zur Niederschrift der Geschäftsstelle eines anderen Amtsgerichtes abgegeben wurde. Die Frist beginnt mit dem Tage der Bekanntmachung der Löschungsankündigung in dem für die Bekanntmachung der Eintragungen in das Handelsregister bestimmten elektronischen Informations- und Kommunikationssystem nach § 10 des Handelsgesetzbuches. Fällt das Ende der Frist auf einen Sonntag, einen allgemeinen Feiertag oder Sonnabend, so endet die Frist mit Ablauf des nächsten Werktages.\nDer Widerspruch muss die Bezeichnung der angefochtenen Löschungsankündigung sowie die Erklärung enthalten, dass Widerspruch gegen diese Löschungsankündigung eingelegt wird. Er ist zu unterzeichnen und soll begründet werden."
    },
    {
      "date": "2025-05-20",
      "id": "109679",
      "original_text": "Registerbekanntmachung nach dem Umwandlungsgesetz\nNordrhein-Westfalen Amtsgericht Bonn HRB 15992\nDeutsche Telekom Venture Funds GmbH – Bonn",
      "type": "Registerbekanntmachung nach dem Umwandlungsgesetz",
      "state": "Nordrhein-Westfalen",
      "amtsgericht": "Amtsgericht Bonn",
      "registernummer": "HRB 15992",
      "registerart": "HRB",
      "company_name": "Deutsche Telekom Venture Funds GmbH",
      "company_seat": "Bonn",
      "details": "20.05.2025 (Bekanntmachungsdatum)\n\nNordrhein-Westfalen Amtsgericht Bonn HRB 15992\nRegisterbekanntmachung nach dem Umwandlungsgesetz 20.05.2025 (Eintragungsdatum)\n\nDeutsche Telekom Venture Funds GmbH\nGesellschaft mit beschränkter Haftung\nBonn\n\nDen Gläubigern der an der Verschmelzung beteiligten Rechtsträger ist, wenn sie binnen sechs Monaten nach dem Tag, an dem die Eintragung der Verschmelzung in das Register des Sitzes derjenigen Rechtsträger deren Gläubiger sie sind, nach § 19 Absatz 3 UmwG als bekanntgemacht gilt, ihren Anspruch nach Grund und Höhe schriftlich anmelden, Sicherheit zu leisten, soweit sie nicht Befriedigung verlangen können. Dieses Recht steht den Gläubigern jedoch nur zu, wenn sie glaubhaft machen, dass durch die Verschmelzung die Erfüllung ihrer Forderung gefährdet wird."
    },
    {
      "date": "2025-05-20",
      "id": "109680",
      "original_text": "Löschungsankündigung\nThüringen Amtsgericht Jena HRB 513795\nPraetorian Trading GmbH – Neuhaus am Rennweg",
      "type": "Löschungsankündigung",
      "state": "Thüringen",
      "amtsgericht": "Amtsgericht Jena",
      "registernummer": "HRB 513795",
      "registerart": "HRB",
      "company_name": "Praetorian Trading GmbH",
      "company_seat": "Neuhaus am Rennweg",
      "details": "20.05.2025 (Bekanntmachungsdatum)\n\nThüringen Amtsgericht Jena HRB 513795\nLöschungsankündigung\n\nPraetorian Trading GmbH\nGesellschaft mit beschränkter Haftung\nNeuhaus am Rennweg\n\nDas Registergericht beabsichtigt, die im Handelsregister eingetragene Gesellschaft wegen Vermögenslosigkeit nach § 394 FamFG von Amts wegen zu löschen. Die Frist zur Erhebung eines Widerspruchs gegen die beabsichtigte Löschung wird auf 6 Wochen festgesetzt."
    },
    {
      "date": "2025-05-20",
      "id": "109681",
      "original_text": "Einreichung neuer Dokumente\nThüringen Amtsgericht Jena HRB 302008\nWohnungsbaugesellschaft mbH Meiningen – Meiningen",
      "type": "Einreichung neuer Dokumente",
      "state": "Thüringen",
      "amtsgericht": "Amtsgericht Jena",
      "registernummer": "HRB 302008",
      "registerart": "HRB",
      "company_name": "Wohnungsbaugesellschaft mbH Meiningen",
      "company_seat": "Meiningen",
      "details": "20.05.2025 (Bekanntmachungsdatum)\n\nThüringen Amtsgericht Jena HRB 302008\nEinreichung neuer Dokumente\n\nWohnungsbaugesellschaft mbH Meiningen\nGesellschaft mit beschränkter Haftung\nMeiningen\n\nBekanntmachung gem. § 52 Abs. 3 Satz 2 GmbHG: Aufgrund einer Veränderung in den Personen der Aufsichtsratsmitglieder ist durch die Geschäftsführer eine neue Liste zum Handelsregister eingereicht worden."
    },
    {
      "date": "2025-05-20",
      "id": "109682",
      "original_text": "Registerbekanntmachung nach dem Umwandlungsgesetz\nThüringen Amtsgericht Jena HRA 506822\nKörnerbude e.K. – Grammetal",
      "type": "Registerbekanntmachung nach dem Umwandlungsgesetz",
      "state": "Thüringen",
      "amtsgericht": "Amtsgericht Jena",
      "registernummer": "HRA 506822",
      "registerart": "HRA",
      "company_name": "Körnerbude e.K.",
      "company_seat": "Grammetal",
      "details": "20.05.2025 (Bekanntmachungsdatum)\n\nThüringen Amtsgericht Jena HRA 506822\nRegisterbekanntmachung nach dem Umwandlungsgesetz 20.05.2025 (Eintragungsdatum)\n\nKörnerbude e.K.\nEinzelkaufmann / Einzelkauffrau\nGrammetal\n\nEintragung lfd. Nr. 2, Sp. 5, Buchst. b), von Amts wegen berichtigt:\nDas von der Einzelkauffrau Reichmann, Anja, Weimar, *18.01.1972  unter der Firma Körnerbude e.K. mit dem Sitz in Grammetal betriebene Unternehmen ist aus dem Vermögen gemäß Ausgliederungserklärung vom 13.03.2025 auf die neu gegründete Körnerbude GmbH mit dem Sitz in Grammetal (Amtsgericht Jena HRB 523302) ausgegliedert.\n\nDie Firma ist erloschen. Von Amts wegen eingetragen aufgrund § 155 UmwG.\n\nNicht eingetragen: Den Gläubigern der an der Ausgliederung beteiligten Rechtsträger, ist wenn sie binnen sechs Monaten nach dem Tag, an dem die Eintragung der Ausgliederung in das Register des Sitzes desjenigen Rechtsträgers, dessen Gläubiger sie sind, nach §§125, 19 Abs. 3 UmwG als bekanntgemacht gilt, ihren Anspruch nach Grund und Höhe schriftlich anmelden, Sicherheit zu leisten, soweit sie nicht Befriedigung verlangen können. Dieses Recht steht ihnen jedoch nur zu, wenn sie glaubhaft machen, daß durch die Ausgliederung die Erfüllung ihrer Forderung gefährdet wird."
    },
    {
      "date": "2025-05-20",
      "id": "109683",
      "original_text": "Löschungsankündigung\nThüringen Amtsgericht Jena HRB 513367\nKilic Bau GmbH – Gera",
      "type": "Löschungsankündigung",
      "state": "Thüringen",
      "amtsgericht": "Amtsgericht Jena",
      "registernummer": "HRB 513367",
      "registerart": "HRB",
      "company_name": "Kilic Bau GmbH",
      "company_seat": "Gera",
      "details": "20.05.2025 (Bekanntmachungsdatum)\n\nThüringen Amtsgericht Jena HRB 513367\nLöschungsankündigung\n\nKilic Bau GmbH\nGesellschaft mit beschränkter Haftung\nGera\n\nDas Registergericht beabsichtigt, die im Handelsregister eingetragene Gesellschaft wegen Vermögenslosigkeit nach § 394 FamFG von Amts wegen zu löschen. Die Frist zur Erhebung eines Widerspruchs gegen die beabsichtigte Löschung wird auf 6 Wochen festgesetzt."
    },
    {
      "date": "2025-05-20",
      "id": "109684",
      "original_text": "Registerbekanntmachung nach dem Umwandlungsgesetz\nThüringen Amtsgericht Jena HRB 112560\nAmbulanz Erfurt - Privater Rettungsdienst GmbH – Erfurt",
      "type": "Registerbekanntmachung nach dem Umwandlungsgesetz",
      "state": "Thüringen",
      "amtsgericht": "Amtsgericht Jena",
      "registernummer": "HRB 112560",
      "registerart": "HRB",
      "company_name": "Ambulanz Erfurt - Privater Rettungsdienst GmbH",
      "company_seat": "Erfurt",
      "details": "20.05.2025 (Bekanntmachungsdatum)\n\nThüringen Amtsgericht Jena HRB 112560\nRegisterbekanntmachung nach dem Umwandlungsgesetz 20.05.2025 (Eintragungsdatum)\n\nAmbulanz Erfurt - Privater Rettungsdienst GmbH\nGesellschaft mit beschränkter Haftung\nErfurt\n\nNicht eingetragen: Den Gläubigern der an der Spaltung beteiligten Rechtsträger, ist wenn sie binnen sechs Monaten nach dem Tag, an dem die Eintragung der Spaltung in das Register des Sitzes desjenigen Rechtsträgers, dessen Gläubiger sie sind,  nach §§ 125, 19 Abs. 3 UmwG als bekanntgemacht gilt, ihren Anspruch nach Grund und Höhe schriftlich anmelden, Sicherheit zu leisten, soweit sie nicht Befriedigung verlangen können. Dieses Recht steht ihnen jedoch nur zu, wenn sie glaubhaft machen, daß durch die Spaltung die Erfüllung ihrer Forderung gefährdet wird."
    },
    {
      "date": "2025-05-20",
      "id": "109685",
      "original_text": "Löschungsankündigung\nHessen Amtsgericht Frankfurt am Main HRB 90799\nD+R GmbH – Frankfurt am Main",
      "type": "Löschungsankündigung",
      "state": "Hessen",
      "amtsgericht": "Amtsgericht Frankfurt am Main",
      "registernummer": "HRB 90799",
      "registerart": "HRB",
      "company_name": "D+R GmbH",
      "company_seat": "Frankfurt am Main",
      "details": "20.05.2025 (Bekanntmachungsdatum)\n\nHessen Amtsgericht Frankfurt am Main HRB 90799\nLöschungsankündigung\n\nD+R GmbH\nGesellschaft mit beschränkter Haftung\nFrankfurt am Main\n\nDas Registergericht beabsichtigt die im Handelsregister eingetragene Gesellschaft von Amts wegen nach § 394 FamFG zu löschen. Die Frist zur Erhebung eines Widerspruchs gegen die beabsichtigte Löschung wird auf 1 Monat festgesetzt."
    },
    {
      "date": "2025-05-20",
      "id": "109686",
      "original_text": "Einreichung neuer Dokumente\nHessen Amtsgericht Wiesbaden HRB 2269\nSEG Stadtentwicklungsgesellschaft Wiesbaden mbH – Wiesbaden",
      "type": "Einreichung neuer Dokumente",
      "state": "Hessen",
      "amtsgericht": "Amtsgericht Wiesbaden",
      "registernummer": "HRB 2269",
      "registerart": "HRB",
      "company_name": "SEG Stadtentwicklungsgesellschaft Wiesbaden mbH",
      "company_seat": "Wiesbaden",
      "details": "20.05.2025 (Bekanntmachungsdatum)\n\nHessen Amtsgericht Wiesbaden HRB 2269\nEinreichung neuer Dokumente\n\nSEG Stadtentwicklungsgesellschaft Wiesbaden mbH\nGesellschaft mit beschränkter Haftung\nWiesbaden\n\nDurch eine Änderung in den Personen der Aufsichtsratsmitglieder ist eine Liste der Mitglieder des Aufsichtsrates zum Handelsregister eingereicht worden."
    },
    {
      "date": "2025-05-20",
      "id": "109687",
      "original_text": "Registerbekanntmachung nach dem Umwandlungsgesetz\nHessen Amtsgericht Darmstadt HRB 100806\nImplenia Immobilien Deutschland GmbH – Raunheim",
      "type": "Registerbekanntmachung nach dem Umwandlungsgesetz",
      "state": "Hessen",
      "amtsgericht": "Amtsgericht Darmstadt",
      "registernummer": "HRB 100806",
      "registerart": "HRB",
      "company_name": "Implenia Immobilien Deutschland GmbH",
      "company_seat": "Raunheim",
      "details": "20.05.2025 (Bekanntmachungsdatum)\n\nHessen Amtsgericht Darmstadt HRB 100806\nRegisterbekanntmachung nach dem Umwandlungsgesetz 20.05.2025 (Eintragungsdatum)\n\nImplenia Immobilien Deutschland GmbH\nGesellschaft mit beschränkter Haftung\nRaunheim\n\nDen Gläubigern der an der Verschmelzung beteiligten Rechtsträger ist, wenn sie binnen sechs Monaten nach dem Tag, an dem die Eintragung der Verschmelzung in das Register des Sitzes derjenigen Rechtsträger deren Gläubiger sie sind, nach § 19 Absatz 3 UmwG bekannt gemacht worden ist, ihren Anspruch nach Grund und Höhe schriftlich anmelden, Sicherheit zu leisten, soweit sie nicht Befriedigung verlangen können. Dieses Recht steht den Gläubigern jedoch nur zu, wenn sie glaubhaft machen, dass durch die Verschmelzung die Erfüllung ihrer Forderung gefährdet wird."
    },
    {
      "date": "2025-05-20",
      "id": "109688",
      "original_text": "Löschungsankündigung\nHessen Amtsgericht Frankfurt am Main HRB 104471\nT & T Steakhouse GmbH – Frankfurt am Main",
      "type": "Löschungsankündigung",
      "state": "Hessen",
      "amtsgericht": "Amtsgericht Frankfurt am Main",
      "registernummer": "HRB 104471",
      "registerart": "HRB",
      "company_name": "T & T Steakhouse GmbH",
      "company_seat": "Frankfurt am Main",
      "details": "20.05.2025 (Bekanntmachungsdatum)\n\nHessen Amtsgericht Frankfurt am Main HRB 104471\nLöschungsankündigung 20.05.2025 (Eintragungsdatum)\n\nT & T Steakhouse GmbH\nGesellschaft mit beschränkter Haftung\nFrankfurt am Main\n\nDas Registergericht beabsichtigt die im Handelsregister eingetragene Gesellschaft von Amts wegen nach § 394 FamFG zu löschen. Die Frist zur Erhebung eines Widerspruchs gegen die beabsichtigte Löschung wird auf 1 Monat festgesetzt."
    },
    {
      "date": "2025-05-20",
      "id": "109689",
      "original_text": "Löschungsankündigung\nHessen Amtsgericht Darmstadt HRB 91951\nBrauKunstKeller GmbH – Michelstadt",
      "type": "Löschungsankündigung",
      "state": "Hessen",
      "amtsgericht": "Amtsgericht Darmstadt",
      "registernummer": "HRB 91951",
      "registerart": "HRB",
      "company_name": "BrauKunstKeller GmbH",
      "company_seat": "Michelstadt",
      "details": "20.05.2025 (Bekanntmachungsdatum)\n\nHessen Amtsgericht Darmstadt HRB 91951\nLöschungsankündigung\n\nBrauKunstKeller GmbH\nGesellschaft mit beschränkter Haftung\nMichelstadt\n\nDas Registergericht beabsichtigt die im Handelsregister eingetragene Gesellschaft von Amts wegen nach § 394 FamFG zu löschen. Die Frist zur Erhebung eines Widerspruchs gegen die beabsichtigte Löschung wird auf 3 Monate festgesetzt."
    },
    {
      "date": "2025-05-20",
      "id": "109690",
      "original_text": "Registerbekanntmachung nach dem Umwandlungsgesetz\nHessen Amtsgericht Darmstadt HRB 102307\nImplenia SPV7 Holding GmbH – Raunheim",
      "type": "Registerbekanntmachung nach dem Umwandlungsgesetz",
      "state": "Hessen",
      "amtsgericht": "Amtsgericht Darmstadt",
      "registernummer": "HRB 102307",
      "registerart": "HRB",
      "company_name": "Implenia SPV7 Holding GmbH",
      "company_seat": "Raunheim",
      "details": "20.05.2025 (Bekanntmachungsdatum)\n\nHessen Amtsgericht Darmstadt HRB 102307\nRegisterbekanntmachung nach dem Umwandlungsgesetz 20.05.2025 (Eintragungsdatum)\n\nImplenia SPV7 Holding GmbH\nGesellschaft mit beschränkter Haftung\nRaunheim\n\nDen Gläubigern der an der Verschmelzung beteiligten Rechtsträger ist, wenn sie binnen sechs Monaten nach dem Tag, an dem die Eintragung der Verschmelzung in das Register des Sitzes derjenigen Rechtsträger deren Gläubiger sie sind, nach § 19 Absatz 3 UmwG bekannt gemacht worden ist, ihren Anspruch nach Grund und Höhe schriftlich anmelden, Sicherheit zu leisten, soweit sie nicht Befriedigung verlangen können. Dieses Recht steht den Gläubigern jedoch nur zu, wenn sie glaubhaft machen, dass durch die Verschmelzung die Erfüllung ihrer Forderung gefährdet wird."
    },
    {
      "date": "2025-05-20",
      "id": "109691",
      "original_text": "Löschungsankündigung\nHessen Amtsgericht Bad Hersfeld HRB 2689\nW & L Consulting GmbH – Bad Hersfeld",
      "type": "Löschungsankündigung",
      "state": "Hessen",
      "amtsgericht": "Amtsgericht Bad Hersfeld",
      "registernummer": "HRB 2689",
      "registerart": "HRB",
      "company_name": "W & L Consulting GmbH",
      "company_seat": "Bad Hersfeld",
      "details": "20.05.2025 (Bekanntmachungsdatum)\n\nHessen Amtsgericht Bad Hersfeld HRB 2689\nLöschungsankündigung\n\nW & L Consulting GmbH\nGesellschaft mit beschränkter Haftung\nBad Hersfeld\n\nDas Registergericht beabsichtigt die im Handelsregister eingetragene Gesellschaft von Amts wegen nach § 394 FamFG zu löschen. Die Frist zur Erhebung eines Widerspruchs gegen die beabsichtigte Löschung wird auf 6 Wochen festgesetzt."
    },
    {
      "date": "2025-05-20",
      "id": "109692",
      "original_text": "Löschungsankündigung\nHessen Amtsgericht Frankfurt am Main HRB 82588\nMLS-GmbH – Frankfurt am Main",
      "type": "Löschungsankündigung",
      "state": "Hessen",
      "amtsgericht": "Amtsgericht Frankfurt am Main",
      "registernummer": "HRB 82588",
      "registerart": "HRB",
      "company_name": "MLS-GmbH",
      "company_seat": "Frankfurt am Main",
      "details": "20.05.2025 (Bekanntmachungsdatum)\n\nHessen Amtsgericht Frankfurt am Main HRB 82588\nLöschungsankündigung\n\nMLS-GmbH\nGesellschaft mit beschränkter Haftung\nFrankfurt am Main\n\nEs ist beabsichtigt, die Gesellschaft wegen Vermögenslosigkeit gemäß § 394 FamFG von Amts wegen im Handelsregister zu löschen. Hiergegen kann innerhalb eines Monats nach dieser Veröffentlichung Widerspruch bei dem Amtsgericht Frankfurt am Main eingelegt werden."
    },
    {
      "date": "2025-05-20",
      "id": "109693",
      "original_text": "Sonstige Registerbekanntmachung\nHessen Amtsgericht Wiesbaden VR 2109\nVerband Deutscher Musterhersteller e.V. – Wiesbaden",
      "type": "Sonstige Registerbekanntmachung",
      "state": "Hessen",
      "amtsgericht": "Amtsgericht Wiesbaden",
      "registernummer": "VR 2109",
      "registerart": "VR",
      "company_name": "Verband Deutscher Musterhersteller e.V.",
      "company_seat": "Wiesbaden",
      "details": "20.05.2025 (Bekanntmachungsdatum)\n\nHessen Amtsgericht Wiesbaden VR 2109\nSonstige Registerbekanntmachung 20.05.2025 (Eintragungsdatum)\n\nVerband Deutscher Musterhersteller e.V.\neingetragener Verein\nWiesbaden\n\nDer Verein ist aufgelöst."
    }
  ]
}