{
  "date": "2025-07-11",
  "date_of_scrape": "2025-08-26T12:56:30.407Z",
  "tool_version": "0.2.0",
  "number_of_announcements": 184,
  "announcements": [
    {
      "date": "2025-07-11",
      "id": "115457",
      "original_text": "Registerbekanntmachung nach dem Umwandlungsgesetz\nBayern Amtsgericht München HRB 239437\nMansfield Software GmbH – Inning a.Ammersee",
      "type": "Registerbekanntmachung nach dem Umwandlungsgesetz",
      "state": "Bayern",
      "amtsgericht": "Amtsgericht München",
      "registernummer": "HRB 239437",
      "registerart": "HRB",
      "company_name": "Mansfield Software GmbH",
      "company_seat": "Inning a.Ammersee",
      "details": "11.07.2025 (Bekanntmachungsdatum)\n\nBayern Amtsgericht München HRB 239437\nRegisterbekanntmachung nach dem Umwandlungsgesetz 10.07.2025 (Eintragungsdatum)\n\nMansfield Software GmbH\nGesellschaft mit beschränkter Haftung\nInning a.Ammersee\n\nDen Gläubigern der an der Verschmelzung beteiligten Rechtsträger ist, wenn sie binnen sechs Monaten nach dem Tag, an dem die Eintragung der Verschmelzung in das Register des Sitzes desjenigen Rechtsträgers, dessen Gläubiger sie sind, nach § 19 Abs. 3 UmwG als bekannt gemacht gilt, ihren Anspruch nach Grund und Höhe in Textform anmelden, Sicherheit zu leisten, soweit sie nicht Befriedigung verlangen können. Dieses Recht steht den Gläubigern jedoch nur zu, wenn sie glaubhaft machen, dass durch die Verschmelzung die Erfüllung ihrer Forderung gefährdet wird."
    },
    {
      "date": "2025-07-11",
      "id": "115458",
      "original_text": "Registerbekanntmachung nach dem Umwandlungsgesetz\nBayern Amtsgericht Nürnberg HRB 25345\nnetfabb GmbH – Parsberg",
      "type": "Registerbekanntmachung nach dem Umwandlungsgesetz",
      "state": "Bayern",
      "amtsgericht": "Amtsgericht Nürnberg",
      "registernummer": "HRB 25345",
      "registerart": "HRB",
      "company_name": "netfabb GmbH",
      "company_seat": "Parsberg",
      "details": "11.07.2025 (Bekanntmachungsdatum)\n\nBayern Amtsgericht Nürnberg HRB 25345\nRegisterbekanntmachung nach dem Umwandlungsgesetz 10.07.2025 (Eintragungsdatum)\n\nnetfabb GmbH\nGesellschaft mit beschränkter Haftung\nParsberg\n\nDen Gläubigern der an der Verschmelzung beteiligten Rechtsträger ist, wenn sie binnen sechs Monaten nach dem Tag, an dem die Eintragung der Verschmelzung in das Register des Sitzes desjenigen Rechtsträgers, dessen Gläubiger sie sind, nach § 19 Abs. 3 UmwG als bekannt gemacht gilt, ihren Anspruch nach Grund und Höhe in Textform anmelden, Sicherheit zu leisten, soweit sie nicht Befriedigung verlangen können. Dieses Recht steht den Gläubigern jedoch nur zu, wenn sie glaubhaft machen, dass durch die Verschmelzung die Erfüllung ihrer Forderung gefährdet wird."
    },
    {
      "date": "2025-07-11",
      "id": "115459",
      "original_text": "Registerbekanntmachung nach dem Umwandlungsgesetz\nBayern Amtsgericht München HRB 248309\nWorkspire GmbH – München",
      "type": "Registerbekanntmachung nach dem Umwandlungsgesetz",
      "state": "Bayern",
      "amtsgericht": "Amtsgericht München",
      "registernummer": "HRB 248309",
      "registerart": "HRB",
      "company_name": "Workspire GmbH",
      "company_seat": "München",
      "details": "11.07.2025 (Bekanntmachungsdatum)\n\nBayern Amtsgericht München HRB 248309\nRegisterbekanntmachung nach dem Umwandlungsgesetz 10.07.2025 (Eintragungsdatum)\n\nWorkspire GmbH\nGesellschaft mit beschränkter Haftung\nMünchen\n\nDen Gläubigern der an der Verschmelzung beteiligten Rechtsträger ist, wenn sie binnen sechs Monaten nach dem Tag, an dem die Eintragung der Verschmelzung in das Register des Sitzes desjenigen Rechtsträgers, dessen Gläubiger sie sind, nach § 19 Abs. 3 UmwG als bekannt gemacht gilt, ihren Anspruch nach Grund und Höhe in Textform anmelden, Sicherheit zu leisten, soweit sie nicht Befriedigung verlangen können. Dieses Recht steht den Gläubigern jedoch nur zu, wenn sie glaubhaft machen, dass durch die Verschmelzung die Erfüllung ihrer Forderung gefährdet wird."
    },
    {
      "date": "2025-07-11",
      "id": "115460",
      "original_text": "Einreichung neuer Dokumente\nBayern Amtsgericht Nürnberg HRB 35785\nproMX AG – Nürnberg",
      "type": "Einreichung neuer Dokumente",
      "state": "Bayern",
      "amtsgericht": "Amtsgericht Nürnberg",
      "registernummer": "HRB 35785",
      "registerart": "HRB",
      "company_name": "proMX AG",
      "company_seat": "Nürnberg",
      "details": "11.07.2025 (Bekanntmachungsdatum)\n\nBayern Amtsgericht Nürnberg HRB 35785\nEinreichung neuer Dokumente\n\nproMX AG\nAktiengesellschaft\nNürnberg\n\nDem Amtsgericht Nürnberg -Registergericht- ist eine Liste der Mitglieder des Aufsichtsrats eingereicht worden, § 106 AktG."
    },
    {
      "date": "2025-07-11",
      "id": "115461",
      "original_text": "Löschungsankündigung\nBayern Amtsgericht München HRA 112348\nKEA298 Ltd. & Co. KG – München",
      "type": "Löschungsankündigung",
      "state": "Bayern",
      "amtsgericht": "Amtsgericht München",
      "registernummer": "HRA 112348",
      "registerart": "HRA",
      "company_name": "KEA298 Ltd. & Co. KG",
      "company_seat": "München",
      "details": "11.07.2025 (Bekanntmachungsdatum)\n\nBayern Amtsgericht München HRA 112348\nLöschungsankündigung 10.07.2025 (Eintragungsdatum)\n\nKEA298 Ltd. & Co. KG\nKommanditgesellschaft\nMünchen\n\nDas Registergericht beabsichtigt, die im Handelsregister eingetragene Firma von Amts wegen nach § 31 Abs. 2 HGB zu löschen. Die Frist zur Erhebung eines Widerspruchs ist auf drei Monate festgesetzt."
    },
    {
      "date": "2025-07-11",
      "id": "115462",
      "original_text": "Registerbekanntmachung nach dem Umwandlungsgesetz\nBayern Amtsgericht München HRB 160008\nWiesendanger medien GmbH – Murnau a.Staffelsee",
      "type": "Registerbekanntmachung nach dem Umwandlungsgesetz",
      "state": "Bayern",
      "amtsgericht": "Amtsgericht München",
      "registernummer": "HRB 160008",
      "registerart": "HRB",
      "company_name": "Wiesendanger medien GmbH",
      "company_seat": "Murnau a.Staffelsee",
      "details": "11.07.2025 (Bekanntmachungsdatum)\n\nBayern Amtsgericht München HRB 160008\nRegisterbekanntmachung nach dem Umwandlungsgesetz 10.07.2025 (Eintragungsdatum)\n\nWiesendanger medien GmbH\nGesellschaft mit beschränkter Haftung\nMurnau a.Staffelsee\n\nDen Gläubigern der an der Verschmelzung beteiligten Rechtsträger ist, wenn sie binnen sechs Monaten nach dem Tag, an dem die Eintragung der Verschmelzung in das Register des Sitzes desjenigen Rechtsträgers, dessen Gläubiger sie sind, nach § 19 Abs. 3 UmwG als bekannt gemacht gilt, ihren Anspruch nach Grund und Höhe in Textform anmelden, Sicherheit zu leisten, soweit sie nicht Befriedigung verlangen können. Dieses Recht steht den Gläubigern jedoch nur zu, wenn sie glaubhaft machen, dass durch die Verschmelzung die Erfüllung ihrer Forderung gefährdet wird."
    },
    {
      "date": "2025-07-11",
      "id": "115463",
      "original_text": "Registerbekanntmachung nach dem Umwandlungsgesetz\nBayern Amtsgericht München HRB 299746\nWAGNERS GmbH – München",
      "type": "Registerbekanntmachung nach dem Umwandlungsgesetz",
      "state": "Bayern",
      "amtsgericht": "Amtsgericht München",
      "registernummer": "HRB 299746",
      "registerart": "HRB",
      "company_name": "WAGNERS GmbH",
      "company_seat": "München",
      "details": "11.07.2025 (Bekanntmachungsdatum)\n\nBayern Amtsgericht München HRB 299746\nRegisterbekanntmachung nach dem Umwandlungsgesetz 10.07.2025 (Eintragungsdatum)\n\nWAGNERS GmbH\nGesellschaft mit beschränkter Haftung\nMünchen\n\nDen Gläubigern der an der Ausgliederung beteiligten Rechtsträger ist, wenn sie binnen sechs Monaten nach dem Tag, an dem die Eintragung der Ausgliederung in das Register des Sitzes desjenigen Rechtsträgers, dessen Gläubiger sie sind, nach §§ 125, 19 Abs. 3 UmwG als bekannt gemacht gilt, ihren Anspruch nach Grund und Höhe in Textform anmelden, Sicherheit zu leisten, soweit sie nicht Befriedigung verlangen können. Dieses Recht steht den Gläubigern jedoch nur zu, wenn sie glaubhaft machen, dass durch die Ausgliederung die Erfüllung ihrer Forderung gefährdet wird."
    },
    {
      "date": "2025-07-11",
      "id": "115464",
      "original_text": "Löschungsankündigung\nBayern Amtsgericht Nürnberg HRB 37329\nCompany Maxi-Management UG (haftungsbeschränkt) – Nürnberg",
      "type": "Löschungsankündigung",
      "state": "Bayern",
      "amtsgericht": "Amtsgericht Nürnberg",
      "registernummer": "HRB 37329",
      "registerart": "HRB",
      "company_name": "Company Maxi-Management UG (haftungsbeschränkt)",
      "company_seat": "Nürnberg",
      "details": "11.07.2025 (Bekanntmachungsdatum)\n\nBayern Amtsgericht Nürnberg HRB 37329\nLöschungsankündigung\n\nCompany Maxi-Management UG (haftungsbeschränkt)\nGesellschaft mit beschränkter Haftung\nNürnberg\n\nDas Registergericht beabsichtigt, die im Handelsregister eingetragene Gesellschaft wegen Vermögenslosigkeit von Amts wegen nach § 394 FamFG zu löschen. Die Frist zur Erhebung eines Widerspruchs ist auf einen Monat festgesetzt."
    },
    {
      "date": "2025-07-11",
      "id": "115465",
      "original_text": "Registerbekanntmachung nach dem Umwandlungsgesetz\nBayern Amtsgericht München HRB 48424\nKlick to Print GmbH – Bergkirchen",
      "type": "Registerbekanntmachung nach dem Umwandlungsgesetz",
      "state": "Bayern",
      "amtsgericht": "Amtsgericht München",
      "registernummer": "HRB 48424",
      "registerart": "HRB",
      "company_name": "Klick to Print GmbH",
      "company_seat": "Bergkirchen",
      "details": "11.07.2025 (Bekanntmachungsdatum)\n\nBayern Amtsgericht München HRB 48424\nRegisterbekanntmachung nach dem Umwandlungsgesetz 10.07.2025 (Eintragungsdatum)\n\nKlick to Print GmbH\nGesellschaft mit beschränkter Haftung\nBergkirchen\n\nDen Gläubigern der an der Verschmelzung beteiligten Rechtsträger ist, wenn sie binnen sechs Monaten nach dem Tag, an dem die Eintragung der Verschmelzung in das Register des Sitzes desjenigen Rechtsträgers, dessen Gläubiger sie sind, nach § 19 Abs. 3 UmwG als bekannt gemacht gilt, ihren Anspruch nach Grund und Höhe in Textform anmelden, Sicherheit zu leisten, soweit sie nicht Befriedigung verlangen können. Dieses Recht steht den Gläubigern jedoch nur zu, wenn sie glaubhaft machen, dass durch die Verschmelzung die Erfüllung ihrer Forderung gefährdet wird."
    },
    {
      "date": "2025-07-11",
      "id": "115466",
      "original_text": "Einreichung neuer Dokumente\nBayern Amtsgericht München HRB 182906\nMünchner Wohnen GmbH – München",
      "type": "Einreichung neuer Dokumente",
      "state": "Bayern",
      "amtsgericht": "Amtsgericht München",
      "registernummer": "HRB 182906",
      "registerart": "HRB",
      "company_name": "Münchner Wohnen GmbH",
      "company_seat": "München",
      "details": "11.07.2025 (Bekanntmachungsdatum)\n\nBayern Amtsgericht München HRB 182906\nEinreichung neuer Dokumente\n\nMünchner Wohnen GmbH\nGesellschaft mit beschränkter Haftung\nMünchen\n\nDem Amtsgericht München -Registergericht- ist eine Liste der Mitglieder des Aufsichtsrats eingereicht worden, § 52 Abs. 3 S. 2 GmbHG."
    },
    {
      "date": "2025-07-11",
      "id": "115467",
      "original_text": "Registerbekanntmachung nach dem Umwandlungsgesetz\nBayern Amtsgericht Würzburg HRB 6101\nGeoinform Softwarevertrieb Aktiengesellschaft – Würzburg",
      "type": "Registerbekanntmachung nach dem Umwandlungsgesetz",
      "state": "Bayern",
      "amtsgericht": "Amtsgericht Würzburg",
      "registernummer": "HRB 6101",
      "registerart": "HRB",
      "company_name": "Geoinform Softwarevertrieb Aktiengesellschaft",
      "company_seat": "Würzburg",
      "details": "11.07.2025 (Bekanntmachungsdatum)\n\nBayern Amtsgericht Würzburg HRB 6101\nRegisterbekanntmachung nach dem Umwandlungsgesetz 10.07.2025 (Eintragungsdatum)\n\nGeoinform Softwarevertrieb Aktiengesellschaft\nAktiengesellschaft\nWürzburg\n\nDen Gläubigern des formwechselnden Rechtsträgers ist, wenn sie binnen sechs Monaten nach dem Tag, an dem die Eintragung des Formwechsels nach § 201 UmwG als bekannt gemacht gilt, ihren Anspruch nach Grund und Höhe in Textform anmelden, Sicherheit zu leisten, soweit sie nicht Befriedigung verlangen können. Dieses Recht steht den Gläubigern jedoch nur zu, wenn sie glaubhaft machen, dass durch den Formwechsel die Erfüllung ihrer Forderung gefährdet wird."
    },
    {
      "date": "2025-07-11",
      "id": "115468",
      "original_text": "Registerbekanntmachung nach dem Umwandlungsgesetz\nBayern Amtsgericht München HRB 134406\nSTULZ Druck und Medien GmbH – München",
      "type": "Registerbekanntmachung nach dem Umwandlungsgesetz",
      "state": "Bayern",
      "amtsgericht": "Amtsgericht München",
      "registernummer": "HRB 134406",
      "registerart": "HRB",
      "company_name": "STULZ Druck und Medien GmbH",
      "company_seat": "München",
      "details": "11.07.2025 (Bekanntmachungsdatum)\n\nBayern Amtsgericht München HRB 134406\nRegisterbekanntmachung nach dem Umwandlungsgesetz 10.07.2025 (Eintragungsdatum)\n\nSTULZ Druck und Medien GmbH\nGesellschaft mit beschränkter Haftung\nMünchen\n\nDen Gläubigern der an der Verschmelzung beteiligten Rechtsträger ist, wenn sie binnen sechs Monaten nach dem Tag, an dem die Eintragung der Verschmelzung in das Register des Sitzes desjenigen Rechtsträgers, dessen Gläubiger sie sind, nach § 19 Abs. 3 UmwG als bekannt gemacht gilt, ihren Anspruch nach Grund und Höhe in Textform anmelden, Sicherheit zu leisten, soweit sie nicht Befriedigung verlangen können. Dieses Recht steht den Gläubigern jedoch nur zu, wenn sie glaubhaft machen, dass durch die Verschmelzung die Erfüllung ihrer Forderung gefährdet wird."
    },
    {
      "date": "2025-07-11",
      "id": "115469",
      "original_text": "Registerbekanntmachung nach dem Umwandlungsgesetz\nBayern Amtsgericht München HRB 163718\nBrav Germany GmbH – Puchheim",
      "type": "Registerbekanntmachung nach dem Umwandlungsgesetz",
      "state": "Bayern",
      "amtsgericht": "Amtsgericht München",
      "registernummer": "HRB 163718",
      "registerart": "HRB",
      "company_name": "Brav Germany GmbH",
      "company_seat": "Puchheim",
      "details": "11.07.2025 (Bekanntmachungsdatum)\n\nBayern Amtsgericht München HRB 163718\nRegisterbekanntmachung nach dem Umwandlungsgesetz 10.07.2025 (Eintragungsdatum)\n\nBrav Germany GmbH\nGesellschaft mit beschränkter Haftung\nPuchheim\n\nDen Gläubigern der an der Verschmelzung beteiligten Rechtsträger ist, wenn sie binnen sechs Monaten nach dem Tag, an dem die Eintragung der Verschmelzung in das Register des Sitzes desjenigen Rechtsträgers, dessen Gläubiger sie sind, nach § 19 Abs. 3 UmwG als bekannt gemacht gilt, ihren Anspruch nach Grund und Höhe in Textform anmelden, Sicherheit zu leisten, soweit sie nicht Befriedigung verlangen können. Dieses Recht steht den Gläubigern jedoch nur zu, wenn sie glaubhaft machen, dass durch die Verschmelzung die Erfüllung ihrer Forderung gefährdet wird."
    },
    {
      "date": "2025-07-11",
      "id": "115470",
      "original_text": "Registerbekanntmachung nach dem Umwandlungsgesetz\nBayern Amtsgericht München HRB 203118\nTURTLEBOX GmbH – München",
      "type": "Registerbekanntmachung nach dem Umwandlungsgesetz",
      "state": "Bayern",
      "amtsgericht": "Amtsgericht München",
      "registernummer": "HRB 203118",
      "registerart": "HRB",
      "company_name": "TURTLEBOX GmbH",
      "company_seat": "München",
      "details": "11.07.2025 (Bekanntmachungsdatum)\n\nBayern Amtsgericht München HRB 203118\nRegisterbekanntmachung nach dem Umwandlungsgesetz 10.07.2025 (Eintragungsdatum)\n\nTURTLEBOX GmbH\nGesellschaft mit beschränkter Haftung\nMünchen\n\nDen Gläubigern der an der Verschmelzung beteiligten Rechtsträger ist, wenn sie binnen sechs Monaten nach dem Tag, an dem die Eintragung der Verschmelzung in das Register des Sitzes desjenigen Rechtsträgers, dessen Gläubiger sie sind, nach § 19 Abs. 3 UmwG als bekannt gemacht gilt, ihren Anspruch nach Grund und Höhe in Textform anmelden, Sicherheit zu leisten, soweit sie nicht Befriedigung verlangen können. Dieses Recht steht den Gläubigern jedoch nur zu, wenn sie glaubhaft machen, dass durch die Verschmelzung die Erfüllung ihrer Forderung gefährdet wird."
    },
    {
      "date": "2025-07-11",
      "id": "115471",
      "original_text": "Registerbekanntmachung nach dem Umwandlungsgesetz\nBayern Amtsgericht München HRB 148605\nHeye GmbH – München",
      "type": "Registerbekanntmachung nach dem Umwandlungsgesetz",
      "state": "Bayern",
      "amtsgericht": "Amtsgericht München",
      "registernummer": "HRB 148605",
      "registerart": "HRB",
      "company_name": "Heye GmbH",
      "company_seat": "München",
      "details": "11.07.2025 (Bekanntmachungsdatum)\n\nBayern Amtsgericht München HRB 148605\nRegisterbekanntmachung nach dem Umwandlungsgesetz 10.07.2025 (Eintragungsdatum)\n\nHeye GmbH\nGesellschaft mit beschränkter Haftung\nMünchen\n\nDen Gläubigern der an der Verschmelzung beteiligten Rechtsträger ist, wenn sie binnen sechs Monaten nach dem Tag, an dem die Eintragung der Verschmelzung in das Register des Sitzes desjenigen Rechtsträgers, dessen Gläubiger sie sind, nach § 19 Abs. 3 UmwG als bekannt gemacht gilt, ihren Anspruch nach Grund und Höhe in Textform anmelden, Sicherheit zu leisten, soweit sie nicht Befriedigung verlangen können. Dieses Recht steht den Gläubigern jedoch nur zu, wenn sie glaubhaft machen, dass durch die Verschmelzung die Erfüllung ihrer Forderung gefährdet wird."
    },
    {
      "date": "2025-07-11",
      "id": "115472",
      "original_text": "Registerbekanntmachung nach dem Umwandlungsgesetz\nBayern Amtsgericht München HRB 252590\nLCM Media GmbH – Inning a.Ammersee",
      "type": "Registerbekanntmachung nach dem Umwandlungsgesetz",
      "state": "Bayern",
      "amtsgericht": "Amtsgericht München",
      "registernummer": "HRB 252590",
      "registerart": "HRB",
      "company_name": "LCM Media GmbH",
      "company_seat": "Inning a.Ammersee",
      "details": "11.07.2025 (Bekanntmachungsdatum)\n\nBayern Amtsgericht München HRB 252590\nRegisterbekanntmachung nach dem Umwandlungsgesetz 10.07.2025 (Eintragungsdatum)\n\nLCM Media GmbH\nGesellschaft mit beschränkter Haftung\nInning a.Ammersee\n\nDen Gläubigern der an der Verschmelzung beteiligten Rechtsträger ist, wenn sie binnen sechs Monaten nach dem Tag, an dem die Eintragung der Verschmelzung in das Register des Sitzes desjenigen Rechtsträgers, dessen Gläubiger sie sind, nach § 19 Abs. 3 UmwG als bekannt gemacht gilt, ihren Anspruch nach Grund und Höhe in Textform anmelden, Sicherheit zu leisten, soweit sie nicht Befriedigung verlangen können. Dieses Recht steht den Gläubigern jedoch nur zu, wenn sie glaubhaft machen, dass durch die Verschmelzung die Erfüllung ihrer Forderung gefährdet wird."
    },
    {
      "date": "2025-07-11",
      "id": "115473",
      "original_text": "Löschungsankündigung\nBayern Amtsgericht Traunstein HRA 14496\nDie Bodenschmiede e.K. – Bernau a.Chiemsee",
      "type": "Löschungsankündigung",
      "state": "Bayern",
      "amtsgericht": "Amtsgericht Traunstein",
      "registernummer": "HRA 14496",
      "registerart": "HRA",
      "company_name": "Die Bodenschmiede e.K.",
      "company_seat": "Bernau a.Chiemsee",
      "details": "11.07.2025 (Bekanntmachungsdatum)\n\nBayern Amtsgericht Traunstein HRA 14496\nLöschungsankündigung\n\nDie Bodenschmiede e.K.\nEinzelkaufmann / Einzelkauffrau\nBernau a.Chiemsee\n\nDas Registergericht beabsichtigt, die im Handelsregister eingetragene Firma von Amts wegen nach § 31 Abs. 2 HGB, § 393 FamFG zu löschen. #insert(Text=\"zztb_V_Widerspruchsfrist\")"
    },
    {
      "date": "2025-07-11",
      "id": "115474",
      "original_text": "Registerbekanntmachung nach dem Umwandlungsgesetz\nBayern Amtsgericht München HRB 259430\nALTER EGO Siebenundvierzigste Beteiligungsgesellschaft mbH – München",
      "type": "Registerbekanntmachung nach dem Umwandlungsgesetz",
      "state": "Bayern",
      "amtsgericht": "Amtsgericht München",
      "registernummer": "HRB 259430",
      "registerart": "HRB",
      "company_name": "ALTER EGO Siebenundvierzigste Beteiligungsgesellschaft mbH",
      "company_seat": "München",
      "details": "11.07.2025 (Bekanntmachungsdatum)\n\nBayern Amtsgericht München HRB 259430\nRegisterbekanntmachung nach dem Umwandlungsgesetz 10.07.2025 (Eintragungsdatum)\n\nALTER EGO Siebenundvierzigste Beteiligungsgesellschaft mbH\nGesellschaft mit beschränkter Haftung\nMünchen\n\nDen Gläubigern der an der Verschmelzung beteiligten Rechtsträger ist, wenn sie binnen sechs Monaten nach dem Tag, an dem die Eintragung der Verschmelzung in das Register des Sitzes desjenigen Rechtsträgers, dessen Gläubiger sie sind, nach § 19 Abs. 3 UmwG als bekannt gemacht gilt, ihren Anspruch nach Grund und Höhe in Textform anmelden, Sicherheit zu leisten, soweit sie nicht Befriedigung verlangen können. Dieses Recht steht den Gläubigern jedoch nur zu, wenn sie glaubhaft machen, dass durch die Verschmelzung die Erfüllung ihrer Forderung gefährdet wird."
    },
    {
      "date": "2025-07-11",
      "id": "115475",
      "original_text": "Registerbekanntmachung nach dem Umwandlungsgesetz\nBayern Amtsgericht München HRB 258577\nSchumacher medTech group GmbH – Gräfelfing",
      "type": "Registerbekanntmachung nach dem Umwandlungsgesetz",
      "state": "Bayern",
      "amtsgericht": "Amtsgericht München",
      "registernummer": "HRB 258577",
      "registerart": "HRB",
      "company_name": "Schumacher medTech group GmbH",
      "company_seat": "Gräfelfing",
      "details": "11.07.2025 (Bekanntmachungsdatum)\n\nBayern Amtsgericht München HRB 258577\nRegisterbekanntmachung nach dem Umwandlungsgesetz 10.07.2025 (Eintragungsdatum)\n\nSchumacher medTech group GmbH\nGesellschaft mit beschränkter Haftung\nGräfelfing\n\nDen Gläubigern der an der Verschmelzung beteiligten Rechtsträger ist, wenn sie binnen sechs Monaten nach dem Tag, an dem die Eintragung der Verschmelzung in das Register des Sitzes desjenigen Rechtsträgers, dessen Gläubiger sie sind, nach § 19 Abs. 3 UmwG als bekannt gemacht gilt, ihren Anspruch nach Grund und Höhe in Textform anmelden, Sicherheit zu leisten, soweit sie nicht Befriedigung verlangen können. Dieses Recht steht den Gläubigern jedoch nur zu, wenn sie glaubhaft machen, dass durch die Verschmelzung die Erfüllung ihrer Forderung gefährdet wird."
    },
    {
      "date": "2025-07-11",
      "id": "115476",
      "original_text": "Löschungsankündigung\nBayern Amtsgericht Nürnberg HRA 17726\naxuma GmbH & Co. KG – Nürnberg",
      "type": "Löschungsankündigung",
      "state": "Bayern",
      "amtsgericht": "Amtsgericht Nürnberg",
      "registernummer": "HRA 17726",
      "registerart": "HRA",
      "company_name": "axuma GmbH & Co. KG",
      "company_seat": "Nürnberg",
      "details": "11.07.2025 (Bekanntmachungsdatum)\n\nBayern Amtsgericht Nürnberg HRA 17726\nLöschungsankündigung\n\naxuma GmbH & Co. KG\nKommanditgesellschaft\nNürnberg\n\nDas Registergericht beabsichtigt, die im Handelsregister eingetragene Gesellschaft wegen Vermögenslosigkeit von Amts wegen nach § 394 Abs. 4 FamFG zu löschen. Die Frist zur Erhebung eines Widerspruchs ist auf einen Monat festgesetzt."
    },
    {
      "date": "2025-07-11",
      "id": "115477",
      "original_text": "Löschungsankündigung\nBayern Amtsgericht München HRB 121617\nGamebridge AG – Weilheim i.OB",
      "type": "Löschungsankündigung",
      "state": "Bayern",
      "amtsgericht": "Amtsgericht München",
      "registernummer": "HRB 121617",
      "registerart": "HRB",
      "company_name": "Gamebridge AG",
      "company_seat": "Weilheim i.OB",
      "details": "11.07.2025 (Bekanntmachungsdatum)\n\nBayern Amtsgericht München HRB 121617\nLöschungsankündigung 10.07.2025 (Eintragungsdatum)\n\nGamebridge AG\nAktiengesellschaft\nWeilheim i.OB\n\nDas Registergericht beabsichtigt, die im Handelsregister eingetragene Gesellschaft wegen Vermögenslosigkeit von Amts wegen nach § 394 FamFG zu löschen. #insert(Text=\"zztb_V_Widerspruchsfrist\")"
    },
    {
      "date": "2025-07-11",
      "id": "115478",
      "original_text": "Registerbekanntmachung nach dem Umwandlungsgesetz\nBayern Amtsgericht München HRB 193621\nGSK Vaccines Vertriebs GmbH – Holzkirchen",
      "type": "Registerbekanntmachung nach dem Umwandlungsgesetz",
      "state": "Bayern",
      "amtsgericht": "Amtsgericht München",
      "registernummer": "HRB 193621",
      "registerart": "HRB",
      "company_name": "GSK Vaccines Vertriebs GmbH",
      "company_seat": "Holzkirchen",
      "details": "11.07.2025 (Bekanntmachungsdatum)\n\nBayern Amtsgericht München HRB 193621\nRegisterbekanntmachung nach dem Umwandlungsgesetz 10.07.2025 (Eintragungsdatum)\n\nGSK Vaccines Vertriebs GmbH\nGesellschaft mit beschränkter Haftung\nHolzkirchen\n\nDen Gläubigern der an der Verschmelzung beteiligten Rechtsträger ist, wenn sie binnen sechs Monaten nach dem Tag, an dem die Eintragung der Verschmelzung in das Register des Sitzes desjenigen Rechtsträgers, dessen Gläubiger sie sind, nach § 19 Abs. 3 UmwG als bekannt gemacht gilt, ihren Anspruch nach Grund und Höhe in Textform anmelden, Sicherheit zu leisten, soweit sie nicht Befriedigung verlangen können. Dieses Recht steht den Gläubigern jedoch nur zu, wenn sie glaubhaft machen, dass durch die Verschmelzung die Erfüllung ihrer Forderung gefährdet wird."
    },
    {
      "date": "2025-07-11",
      "id": "115479",
      "original_text": "Einreichung neuer Dokumente\nBayern Amtsgericht München HRB 275610\nVIRIDIS - GREEN-TECH INVESTMENT AG – München",
      "type": "Einreichung neuer Dokumente",
      "state": "Bayern",
      "amtsgericht": "Amtsgericht München",
      "registernummer": "HRB 275610",
      "registerart": "HRB",
      "company_name": "VIRIDIS - GREEN-TECH INVESTMENT AG",
      "company_seat": "München",
      "details": "11.07.2025 (Bekanntmachungsdatum)\n\nBayern Amtsgericht München HRB 275610\nEinreichung neuer Dokumente\n\nVIRIDIS - GREEN-TECH INVESTMENT AG\nAktiengesellschaft\nMünchen\n\nDem Amtsgericht München -Registergericht- ist eine Liste der Mitglieder des Aufsichtsrats eingereicht worden, § 106 AktG."
    },
    {
      "date": "2025-07-11",
      "id": "115480",
      "original_text": "Einreichung neuer Dokumente\nBayern Amtsgericht München HRB 136885\nSECURETEC Detektions-Systeme AG – Neubiberg",
      "type": "Einreichung neuer Dokumente",
      "state": "Bayern",
      "amtsgericht": "Amtsgericht München",
      "registernummer": "HRB 136885",
      "registerart": "HRB",
      "company_name": "SECURETEC Detektions-Systeme AG",
      "company_seat": "Neubiberg",
      "details": "11.07.2025 (Bekanntmachungsdatum)\n\nBayern Amtsgericht München HRB 136885\nEinreichung neuer Dokumente\n\nSECURETEC Detektions-Systeme AG\nAktiengesellschaft\nNeubiberg\n\nDem Amtsgericht München -Registergericht- ist eine Liste der Mitglieder des Aufsichtsrats eingereicht worden, § 106 AktG."
    },
    {
      "date": "2025-07-11",
      "id": "115481",
      "original_text": "Registerbekanntmachung nach dem Umwandlungsgesetz\nBayern Amtsgericht München HRA 114449\nJörg Rustemeyer e.K., Inhaber Sebastian Rustemeyer – Penzberg",
      "type": "Registerbekanntmachung nach dem Umwandlungsgesetz",
      "state": "Bayern",
      "amtsgericht": "Amtsgericht München",
      "registernummer": "HRA 114449",
      "registerart": "HRA",
      "company_name": "Jörg Rustemeyer e.K., Inhaber Sebastian Rustemeyer",
      "company_seat": "Penzberg",
      "details": "11.07.2025 (Bekanntmachungsdatum)\n\nBayern Amtsgericht München HRA 114449\nRegisterbekanntmachung nach dem Umwandlungsgesetz 10.07.2025 (Eintragungsdatum)\n\nJörg Rustemeyer e.K., Inhaber Sebastian Rustemeyer\nEinzelkaufmann / Einzelkauffrau\nPenzberg\n\nDen Gläubigern der an der Ausgliederung beteiligten Rechtsträger ist, wenn sie binnen sechs Monaten nach dem Tag, an dem die Eintragung der Ausgliederung in das Register des Sitzes desjenigen Rechtsträgers, dessen Gläubiger sie sind, nach §§ 125, 19 Abs. 3 UmwG als bekannt gemacht gilt, ihren Anspruch nach Grund und Höhe in Textform anmelden, Sicherheit zu leisten, soweit sie nicht Befriedigung verlangen können. Dieses Recht steht den Gläubigern jedoch nur zu, wenn sie glaubhaft machen, dass durch die Ausgliederung die Erfüllung ihrer Forderung gefährdet wird."
    },
    {
      "date": "2025-07-11",
      "id": "115482",
      "original_text": "Sonstige Registerbekanntmachung\nBayern Amtsgericht München HRB 109326\nTÜV SÜD Aktiengesellschaft – München",
      "type": "Sonstige Registerbekanntmachung",
      "state": "Bayern",
      "amtsgericht": "Amtsgericht München",
      "registernummer": "HRB 109326",
      "registerart": "HRB",
      "company_name": "TÜV SÜD Aktiengesellschaft",
      "company_seat": "München",
      "details": "11.07.2025 (Bekanntmachungsdatum)\n\nBayern Amtsgericht München HRB 109326\nSonstige Registerbekanntmachung 10.07.2025 (Eintragungsdatum)\n\nTÜV SÜD Aktiengesellschaft\nAktiengesellschaft\nMünchen\n\nDem Amtsgericht München -Registergericht- ist eine Liste der Mitglieder des Aufsichtsrats eingereicht worden, § 106 AktG."
    },
    {
      "date": "2025-07-11",
      "id": "115483",
      "original_text": "Registerbekanntmachung nach dem Umwandlungsgesetz\nBayern Amtsgericht München HRB 221973\nMatzinger GmbH – Gräfelfing",
      "type": "Registerbekanntmachung nach dem Umwandlungsgesetz",
      "state": "Bayern",
      "amtsgericht": "Amtsgericht München",
      "registernummer": "HRB 221973",
      "registerart": "HRB",
      "company_name": "Matzinger GmbH",
      "company_seat": "Gräfelfing",
      "details": "11.07.2025 (Bekanntmachungsdatum)\n\nBayern Amtsgericht München HRB 221973\nRegisterbekanntmachung nach dem Umwandlungsgesetz 10.07.2025 (Eintragungsdatum)\n\nMatzinger GmbH\nGesellschaft mit beschränkter Haftung\nGräfelfing\n\nDen Gläubigern der an der Verschmelzung beteiligten Rechtsträger ist, wenn sie binnen sechs Monaten nach dem Tag, an dem die Eintragung der Verschmelzung in das Register des Sitzes desjenigen Rechtsträgers, dessen Gläubiger sie sind, nach § 19 Abs. 3 UmwG als bekannt gemacht gilt, ihren Anspruch nach Grund und Höhe in Textform anmelden, Sicherheit zu leisten, soweit sie nicht Befriedigung verlangen können. Dieses Recht steht den Gläubigern jedoch nur zu, wenn sie glaubhaft machen, dass durch die Verschmelzung die Erfüllung ihrer Forderung gefährdet wird."
    },
    {
      "date": "2025-07-11",
      "id": "115484",
      "original_text": "Registerbekanntmachung nach dem Umwandlungsgesetz\nBayern Amtsgericht Ingolstadt HRB 6228\nInterpark Immobilien GmbH – Neuburg a. d. Donau",
      "type": "Registerbekanntmachung nach dem Umwandlungsgesetz",
      "state": "Bayern",
      "amtsgericht": "Amtsgericht Ingolstadt",
      "registernummer": "HRB 6228",
      "registerart": "HRB",
      "company_name": "Interpark Immobilien GmbH",
      "company_seat": "Neuburg a. d. Donau",
      "details": "11.07.2025 (Bekanntmachungsdatum)\n\nBayern Amtsgericht Ingolstadt HRB 6228\nRegisterbekanntmachung nach dem Umwandlungsgesetz 10.07.2025 (Eintragungsdatum)\n\nInterpark Immobilien GmbH\nGesellschaft mit beschränkter Haftung\nNeuburg a. d. Donau\n\nDen Gläubigern der an der Verschmelzung beteiligten Rechtsträger ist, wenn sie binnen sechs Monaten nach dem Tag, an dem die Eintragung der Verschmelzung in das Register des Sitzes desjenigen Rechtsträgers, dessen Gläubiger sie sind, nach § 19 Abs. 3 UmwG als bekannt gemacht gilt, ihren Anspruch nach Grund und Höhe in Textform anmelden, Sicherheit zu leisten, soweit sie nicht Befriedigung verlangen können. Dieses Recht steht den Gläubigern jedoch nur zu, wenn sie glaubhaft machen, dass durch die Verschmelzung die Erfüllung ihrer Forderung gefährdet wird."
    },
    {
      "date": "2025-07-11",
      "id": "115485",
      "original_text": "Registerbekanntmachung nach dem Umwandlungsgesetz\nBayern Amtsgericht München HRB 70458\nA B S Hydraulik-Service GmbH – Hallbergmoos",
      "type": "Registerbekanntmachung nach dem Umwandlungsgesetz",
      "state": "Bayern",
      "amtsgericht": "Amtsgericht München",
      "registernummer": "HRB 70458",
      "registerart": "HRB",
      "company_name": "A B S Hydraulik-Service GmbH",
      "company_seat": "Hallbergmoos",
      "details": "11.07.2025 (Bekanntmachungsdatum)\n\nBayern Amtsgericht München HRB 70458\nRegisterbekanntmachung nach dem Umwandlungsgesetz 10.07.2025 (Eintragungsdatum)\n\nA B S Hydraulik-Service GmbH\nGesellschaft mit beschränkter Haftung\nHallbergmoos\n\nDen Gläubigern der an der Verschmelzung beteiligten Rechtsträger ist, wenn sie binnen sechs Monaten nach dem Tag, an dem die Eintragung der Verschmelzung in das Register des Sitzes desjenigen Rechtsträgers, dessen Gläubiger sie sind, nach § 19 Abs. 3 UmwG als bekannt gemacht gilt, ihren Anspruch nach Grund und Höhe in Textform anmelden, Sicherheit zu leisten, soweit sie nicht Befriedigung verlangen können. Dieses Recht steht den Gläubigern jedoch nur zu, wenn sie glaubhaft machen, dass durch die Verschmelzung die Erfüllung ihrer Forderung gefährdet wird."
    },
    {
      "date": "2025-07-11",
      "id": "115486",
      "original_text": "Registerbekanntmachung nach dem Umwandlungsgesetz\nBayern Amtsgericht München HRB 159670\nFonds Finanz Maklerservice GmbH – München",
      "type": "Registerbekanntmachung nach dem Umwandlungsgesetz",
      "state": "Bayern",
      "amtsgericht": "Amtsgericht München",
      "registernummer": "HRB 159670",
      "registerart": "HRB",
      "company_name": "Fonds Finanz Maklerservice GmbH",
      "company_seat": "München",
      "details": "11.07.2025 (Bekanntmachungsdatum)\n\nBayern Amtsgericht München HRB 159670\nRegisterbekanntmachung nach dem Umwandlungsgesetz 10.07.2025 (Eintragungsdatum)\n\nFonds Finanz Maklerservice GmbH\nGesellschaft mit beschränkter Haftung\nMünchen\n\nDen Gläubigern der an der Verschmelzung beteiligten Rechtsträger ist, wenn sie binnen sechs Monaten nach dem Tag, an dem die Eintragung der Verschmelzung in das Register des Sitzes desjenigen Rechtsträgers, dessen Gläubiger sie sind, nach § 19 Abs. 3 UmwG als bekannt gemacht gilt, ihren Anspruch nach Grund und Höhe in Textform anmelden, Sicherheit zu leisten, soweit sie nicht Befriedigung verlangen können. Dieses Recht steht den Gläubigern jedoch nur zu, wenn sie glaubhaft machen, dass durch die Verschmelzung die Erfüllung ihrer Forderung gefährdet wird."
    },
    {
      "date": "2025-07-11",
      "id": "115487",
      "original_text": "Sonstige Registerbekanntmachung\nBayern Amtsgericht Würzburg HRB 17993\nKP Sport und Fitness GmbH – Waldbrunn",
      "type": "Sonstige Registerbekanntmachung",
      "state": "Bayern",
      "amtsgericht": "Amtsgericht Würzburg",
      "registernummer": "HRB 17993",
      "registerart": "HRB",
      "company_name": "KP Sport und Fitness GmbH",
      "company_seat": "Waldbrunn",
      "details": "11.07.2025 (Bekanntmachungsdatum)\n\nBayern Amtsgericht Würzburg HRB 17993\nSonstige Registerbekanntmachung 10.07.2025 (Eintragungsdatum)\n\nKP Sport und Fitness GmbH\nGesellschaft mit beschränkter Haftung\nWaldbrunn\n\nDen Gläubigern der Gesellschaft, deren Forderungen begründet worden sind, bevor die Eintragung der Beendigung des Gewinnabführungsvertrages in das Handelsregister nach § 10 des Handelsgesetzbuches als bekanntgemacht gilt, hat der andere Vertragsteil Sicherheit zu leisten, wenn sie sich binnen sechs Monaten nach der Bekanntmachung der Eintragung zu diesem Zweck bei ihm melden."
    },
    {
      "date": "2025-07-11",
      "id": "115488",
      "original_text": "Einreichung neuer Dokumente\nBayern Amtsgericht München HRB 227195\nAllane SE – Pullach i.Isartal",
      "type": "Einreichung neuer Dokumente",
      "state": "Bayern",
      "amtsgericht": "Amtsgericht München",
      "registernummer": "HRB 227195",
      "registerart": "HRB",
      "company_name": "Allane SE",
      "company_seat": "Pullach i.Isartal",
      "details": "11.07.2025 (Bekanntmachungsdatum)\n\nBayern Amtsgericht München HRB 227195\nEinreichung neuer Dokumente\n\nAllane SE\nEuropäische Aktiengesellschaft (SE)\nPullach i.Isartal\n\nDem #Re.Name ist eine Liste der Mitglieder des Aufsichtsrats eingereicht worden, Art. 9 Abs. 1 Buchst. c (ii) SE-VO i.V.m. § 106 AktG."
    },
    {
      "date": "2025-07-11",
      "id": "115489",
      "original_text": "Löschungsankündigung\nBayern Amtsgericht München HRB 244169\nBau3 GmbH – München",
      "type": "Löschungsankündigung",
      "state": "Bayern",
      "amtsgericht": "Amtsgericht München",
      "registernummer": "HRB 244169",
      "registerart": "HRB",
      "company_name": "Bau3 GmbH",
      "company_seat": "München",
      "details": "11.07.2025 (Bekanntmachungsdatum)\n\nBayern Amtsgericht München HRB 244169\nLöschungsankündigung\n\nBau3 GmbH\nGesellschaft mit beschränkter Haftung\nMünchen\n\nDas Registergericht beabsichtigt, die im Handelsregister eingetragene Gesellschaft wegen Vermögenslosigkeit von Amts wegen nach § 394 FamFG zu löschen. Die Frist zur Erhebung eines Widerspruchs ist auf drei Monate festgesetzt."
    },
    {
      "date": "2025-07-11",
      "id": "115490",
      "original_text": "Löschungsankündigung\nBayern Amtsgericht Aschaffenburg HRB 14614\nWozniak GmbH – Alzenau",
      "type": "Löschungsankündigung",
      "state": "Bayern",
      "amtsgericht": "Amtsgericht Aschaffenburg",
      "registernummer": "HRB 14614",
      "registerart": "HRB",
      "company_name": "Wozniak GmbH",
      "company_seat": "Alzenau",
      "details": "11.07.2025 (Bekanntmachungsdatum)\n\nBayern Amtsgericht Aschaffenburg HRB 14614\nLöschungsankündigung\n\nWozniak GmbH\nGesellschaft mit beschränkter Haftung\nAlzenau\n\nDas Registergericht beabsichtigt, die im Handelsregister eingetragene Gesellschaft wegen Vermögenslosigkeit von Amts wegen nach § 394 FamFG zu löschen. Die Frist zur Erhebung eines Widerspruchs ist auf drei Monate festgesetzt."
    },
    {
      "date": "2025-07-11",
      "id": "115491",
      "original_text": "Registerbekanntmachung nach dem Umwandlungsgesetz\nBaden-Württemberg Amtsgericht Stuttgart HRA 290436\nMax Walz e.K. – Vaihingen an der Enz",
      "type": "Registerbekanntmachung nach dem Umwandlungsgesetz",
      "state": "Baden-Württemberg",
      "amtsgericht": "Amtsgericht Stuttgart",
      "registernummer": "HRA 290436",
      "registerart": "HRA",
      "company_name": "Max Walz e.K.",
      "company_seat": "Vaihingen an der Enz",
      "details": "11.07.2025 (Bekanntmachungsdatum)\n\nBaden-Württemberg Amtsgericht Stuttgart HRA 290436\nRegisterbekanntmachung nach dem Umwandlungsgesetz 11.07.2025 (Eintragungsdatum)\n\nMax Walz e.K.\nEinzelkaufmann / Einzelkauffrau\nVaihingen an der Enz\n\nDen Gläubigern der an der Ausgliederung beteiligten Rechtsträger ist, wenn sie binnen sechs Monaten nach dem Tag, an dem die Eintragung der Ausgliederung in das Register des Sitzes desjenigen Rechtsträgers, dessen Gläubiger sie sind, nach § 19 Abs. 3 UmwG als bekanntgemacht gilt, ihren Anspruch nach Grund und Höhe schriftlich anmelden, Sicherheit zu leisten, soweit sie nicht Befriedigung verlangen können. Dieses Recht steht den Gläubigern jedoch nur zu, wenn sie glaubhaft machen, dass durch die Ausgliederung die Erfüllung ihrer Forderung gefährdet wird."
    },
    {
      "date": "2025-07-11",
      "id": "115492",
      "original_text": "Registerbekanntmachung nach dem Umwandlungsgesetz\nBaden-Württemberg Amtsgericht Stuttgart HRB 783831\nAUDERE Mobile Solutions GmbH – Fellbach",
      "type": "Registerbekanntmachung nach dem Umwandlungsgesetz",
      "state": "Baden-Württemberg",
      "amtsgericht": "Amtsgericht Stuttgart",
      "registernummer": "HRB 783831",
      "registerart": "HRB",
      "company_name": "AUDERE Mobile Solutions GmbH",
      "company_seat": "Fellbach",
      "details": "11.07.2025 (Bekanntmachungsdatum)\n\nBaden-Württemberg Amtsgericht Stuttgart HRB 783831\nRegisterbekanntmachung nach dem Umwandlungsgesetz 11.07.2025 (Eintragungsdatum)\n\nAUDERE Mobile Solutions GmbH\nGesellschaft mit beschränkter Haftung\nFellbach\n\nDen Gläubigern der an der Verschmelzung beteiligten Rechtsträger ist, wenn sie binnen sechs Monaten nach dem Tag, an dem die Eintragung der Verschmelzung in das Register des Sitzes desjenigen Rechtsträgers, dessen Gläubiger sie sind, nach § 19 Abs. 3 UmwG als bekanntgemacht gilt, ihren Anspruch nach Grund und Höhe schriftlich anmelden, Sicherheit zu leisten, soweit sie nicht Befriedigung verlangen können. Dieses Recht steht den Gläubigern jedoch nur zu, wenn sie glaubhaft machen, dass durch die Verschmelzung die Erfüllung ihrer Forderung gefährdet wird."
    },
    {
      "date": "2025-07-11",
      "id": "115493",
      "original_text": "Registerbekanntmachung nach dem Umwandlungsgesetz\nBaden-Württemberg Amtsgericht Stuttgart HRB 781893\nBosler Holding GmbH – Filderstadt",
      "type": "Registerbekanntmachung nach dem Umwandlungsgesetz",
      "state": "Baden-Württemberg",
      "amtsgericht": "Amtsgericht Stuttgart",
      "registernummer": "HRB 781893",
      "registerart": "HRB",
      "company_name": "Bosler Holding GmbH",
      "company_seat": "Filderstadt",
      "details": "11.07.2025 (Bekanntmachungsdatum)\n\nBaden-Württemberg Amtsgericht Stuttgart HRB 781893\nRegisterbekanntmachung nach dem Umwandlungsgesetz 11.07.2025 (Eintragungsdatum)\n\nBosler Holding GmbH\nGesellschaft mit beschränkter Haftung\nFilderstadt\n\nAls nicht eingetragen wird bekanntgemacht:\nDen Gläubigern der an der Verschmelzung beteiligten Rechtsträger ist, wenn sie binnen sechs Monaten nach dem Tag, an dem die Eintragung der Verschmelzung in das Register des Sitzes desjenigen Rechtsträgers, dessen Gläubiger sie sind, nach § 19 Abs. 3 UmwG als bekanntgemacht gilt, ihren Anspruch nach Grund und Höhe schriftlich anmelden, Sicherheit zu leisten, soweit sie nicht Befriedigung verlangen können. Dieses Recht steht den Gläubigern jedoch nur zu, wenn sie glaubhaft machen, dass durch die Verschmelzung die Erfüllung ihrer Forderung gefährdet wird."
    },
    {
      "date": "2025-07-11",
      "id": "115494",
      "original_text": "Registerbekanntmachung nach dem Umwandlungsgesetz\nBaden-Württemberg Amtsgericht Mannheim HRB 6924\ntrio-group communication & marketing gmbh – Mannheim",
      "type": "Registerbekanntmachung nach dem Umwandlungsgesetz",
      "state": "Baden-Württemberg",
      "amtsgericht": "Amtsgericht Mannheim",
      "registernummer": "HRB 6924",
      "registerart": "HRB",
      "company_name": "trio-group communication & marketing gmbh",
      "company_seat": "Mannheim",
      "details": "11.07.2025 (Bekanntmachungsdatum)\n\nBaden-Württemberg Amtsgericht Mannheim HRB 6924\nRegisterbekanntmachung nach dem Umwandlungsgesetz 11.07.2025 (Eintragungsdatum)\n\ntrio-group communication & marketing gmbh\nGesellschaft mit beschränkter Haftung\nMannheim\n\nAls nicht eingetragen wird bekanntgemacht:\nDen Gläubigern der an der Verschmelzung beteiligten Rechtsträger ist, wenn sie binnen sechs Monaten nach dem Tag, an dem die Eintragung der Verschmelzung in das Register des Sitzes desjenigen Rechtsträgers, dessen Gläubiger sie sind, nach § 19 Abs. 3 UmwG als bekanntgemacht gilt, ihren Anspruch nach Grund und Höhe schriftlich anmelden, Sicherheit zu leisten, soweit sie nicht Befriedigung verlangen können. Dieses Recht steht den Gläubigern jedoch nur zu, wenn sie glaubhaft machen, dass durch die Verschmelzung die Erfüllung ihrer Forderung gefährdet wird."
    },
    {
      "date": "2025-07-11",
      "id": "115495",
      "original_text": "Registerbekanntmachung nach dem Umwandlungsgesetz\nBerlin Amtsgericht Berlin (Charlottenburg) HRB 260054\nAF Digital Tools GmbH – Berlin",
      "type": "Registerbekanntmachung nach dem Umwandlungsgesetz",
      "state": "Berlin",
      "amtsgericht": "Amtsgericht Berlin (Charlottenburg)",
      "registernummer": "HRB 260054",
      "registerart": "HRB",
      "company_name": "AF Digital Tools GmbH",
      "company_seat": "Berlin",
      "details": "11.07.2025 (Bekanntmachungsdatum)\n\nBerlin Amtsgericht Berlin (Charlottenburg) HRB 260054\nRegisterbekanntmachung nach dem Umwandlungsgesetz 10.07.2025 (Eintragungsdatum)\n\nAF Digital Tools GmbH\nGesellschaft mit beschränkter Haftung\nBerlin\n\nDen Gläubigern der an der Verschmelzung beteiligten Rechtsträger ist, wenn sie binnen sechs Monaten nach dem Tag, an dem die Eintragung der Verschmelzung in das Register des Sitzes desjenigen Rechtsträgers, dessen Gläubiger sie sind, als bekannt gemacht gilt, ihren Anspruch nach Grund und Höhe schriftlich anmelden, Sicherheit zu leisten, soweit sie nicht Befriedigung verlangen können. Dieses Recht steht den Gläubigern jedoch nur zu, wenn sie glaubhaft machen, dass durch die Verschmelzung die Erfüllung ihrer Forderung gefährdet wird. Das Recht, Sicherheitsleistung zu verlangen, steht Gläubigern nicht zu, die im Falle der Insolvenz ein Recht auf vorzugsweise Befriedigung aus einer Deckungsmasse haben, die nach gesetzlicher Vorschrift zu ihrem Schutz errichtet und staatlich überwacht ist.Zu Eintragungsnummer 3 vom 10.07.2025 wird als nicht eingetragen veröffentlicht:"
    },
    {
      "date": "2025-07-11",
      "id": "115496",
      "original_text": "Löschungsankündigung\nBerlin Amtsgericht Berlin (Charlottenburg) HRB 52311\nAMBO Immobilien und Verwaltungs GmbH – Berlin",
      "type": "Löschungsankündigung",
      "state": "Berlin",
      "amtsgericht": "Amtsgericht Berlin (Charlottenburg)",
      "registernummer": "HRB 52311",
      "registerart": "HRB",
      "company_name": "AMBO Immobilien und Verwaltungs GmbH",
      "company_seat": "Berlin",
      "details": "11.07.2025 (Bekanntmachungsdatum)\n\nBerlin Amtsgericht Berlin (Charlottenburg) HRB 52311\nLöschungsankündigung\n\nAMBO Immobilien und Verwaltungs GmbH\nGesellschaft mit beschränkter Haftung\nBerlin\n\nBei der nachstehenden Gesellschaft wird das Amtslöschungsverfahren gemäß § 394 FamFG eingeleitet. Widerspruchsfrist 6 Wochen."
    },
    {
      "date": "2025-07-11",
      "id": "115497",
      "original_text": "Registerbekanntmachung nach dem Umwandlungsgesetz\nBaden-Württemberg Amtsgericht Mannheim HRB 755033\nRSCapital GmbH – Ubstadt-Weiher",
      "type": "Registerbekanntmachung nach dem Umwandlungsgesetz",
      "state": "Baden-Württemberg",
      "amtsgericht": "Amtsgericht Mannheim",
      "registernummer": "HRB 755033",
      "registerart": "HRB",
      "company_name": "RSCapital GmbH",
      "company_seat": "Ubstadt-Weiher",
      "details": "11.07.2025 (Bekanntmachungsdatum)\n\nBaden-Württemberg Amtsgericht Mannheim HRB 755033\nRegisterbekanntmachung nach dem Umwandlungsgesetz 11.07.2025 (Eintragungsdatum)\n\nRSCapital GmbH\nGesellschaft mit beschränkter Haftung\nUbstadt-Weiher\n\nDen Gläubigern der an der Ausgliederung beteiligten Rechtsträger ist, wenn sie binnen sechs Monaten nach dem Tag, an dem die Eintragung der Ausgliederung in das Register des Sitzes desjenigen Rechtsträgers, dessen Gläubiger sie sind, nach § 19 Abs. 3 UmwG als bekanntgemacht gilt, ihren Anspruch nach Grund und Höhe schriftlich anmelden, Sicherheit zu leisten, soweit sie nicht Befriedigung verlangen können. Dieses Recht steht den Gläubigern jedoch nur zu, wenn sie glaubhaft machen, dass durch die Ausgliederung die Erfüllung ihrer Forderung gefährdet wird."
    },
    {
      "date": "2025-07-11",
      "id": "115498",
      "original_text": "Einreichung neuer Dokumente\nBaden-Württemberg Amtsgericht Stuttgart HRB 765363\naudius SE – Weinstadt",
      "type": "Einreichung neuer Dokumente",
      "state": "Baden-Württemberg",
      "amtsgericht": "Amtsgericht Stuttgart",
      "registernummer": "HRB 765363",
      "registerart": "HRB",
      "company_name": "audius SE",
      "company_seat": "Weinstadt",
      "details": "11.07.2025 (Bekanntmachungsdatum)\n\nBaden-Württemberg Amtsgericht Stuttgart HRB 765363\nEinreichung neuer Dokumente 11.07.2025 (Eintragungsdatum)\n\naudius SE\nEuropäische Aktiengesellschaft (SE)\nWeinstadt\n\nDie Gesellschaft hat am 10.07.2025 die Liste über die Zusammensetzung des Aufsichtsrats zum Handelsregister eingereicht."
    },
    {
      "date": "2025-07-11",
      "id": "115499",
      "original_text": "Registerbekanntmachung nach dem Umwandlungsgesetz\nBaden-Württemberg Amtsgericht Mannheim HRB 729904\nGerstäcker - Bauwerk Aktiengesellschaft Künstlerbedarf und Material – Karlsruhe",
      "type": "Registerbekanntmachung nach dem Umwandlungsgesetz",
      "state": "Baden-Württemberg",
      "amtsgericht": "Amtsgericht Mannheim",
      "registernummer": "HRB 729904",
      "registerart": "HRB",
      "company_name": "Gerstäcker - Bauwerk Aktiengesellschaft Künstlerbedarf und Material",
      "company_seat": "Karlsruhe",
      "details": "11.07.2025 (Bekanntmachungsdatum)\n\nBaden-Württemberg Amtsgericht Mannheim HRB 729904\nRegisterbekanntmachung nach dem Umwandlungsgesetz 11.07.2025 (Eintragungsdatum)\n\nGerstäcker - Bauwerk Aktiengesellschaft Künstlerbedarf und Material\nAktiengesellschaft\nKarlsruhe\n\nDen Gläubigern des an dem Formwechsel beteiligten Rechtsträgers ist, wenn sie binnen sechs Monaten nach dem Tag, an dem die Eintragung des Formwechsels in das Register des Sitzes desjenigen Rechtsträgers, dessen Gläubiger sie sind, nach § 19 Abs. 3 UmwG als bekanntgemacht gilt, ihren Anspruch nach Grund und Höhe schriftlich anmelden, Sicherheit zu leisten, soweit sie nicht Befriedigung verlangen können. Dieses Recht steht den Gläubigern jedoch nur zu, wenn sie glaubhaft machen, dass durch den Formwechsel die Erfüllung ihrer Forderung gefährdet wird."
    },
    {
      "date": "2025-07-11",
      "id": "115500",
      "original_text": "Einreichung neuer Dokumente\nBerlin Amtsgericht Berlin (Charlottenburg) HRB 248794\nCantourage Group SE – Berlin",
      "type": "Einreichung neuer Dokumente",
      "state": "Berlin",
      "amtsgericht": "Amtsgericht Berlin (Charlottenburg)",
      "registernummer": "HRB 248794",
      "registerart": "HRB",
      "company_name": "Cantourage Group SE",
      "company_seat": "Berlin",
      "details": "11.07.2025 (Bekanntmachungsdatum)\n\nBerlin Amtsgericht Berlin (Charlottenburg) HRB 248794\nEinreichung neuer Dokumente\n\nCantourage Group SE\nEuropäische Aktiengesellschaft (SE)\nBerlin\n\nAls nicht eingetragen wird veröffentlicht: Es wurde eine neue Liste der Aufsichtsratsmitglieder eingereicht (§ 106 AktG)."
    },
    {
      "date": "2025-07-11",
      "id": "115501",
      "original_text": "Registerbekanntmachung nach dem Umwandlungsgesetz\nBaden-Württemberg Amtsgericht Mannheim HRA 712663\nRamón Schiff e.K. – Ubstadt-Weiher",
      "type": "Registerbekanntmachung nach dem Umwandlungsgesetz",
      "state": "Baden-Württemberg",
      "amtsgericht": "Amtsgericht Mannheim",
      "registernummer": "HRA 712663",
      "registerart": "HRA",
      "company_name": "Ramón Schiff e.K.",
      "company_seat": "Ubstadt-Weiher",
      "details": "11.07.2025 (Bekanntmachungsdatum)\n\nBaden-Württemberg Amtsgericht Mannheim HRA 712663\nRegisterbekanntmachung nach dem Umwandlungsgesetz 11.07.2025 (Eintragungsdatum)\n\nRamón Schiff e.K.\nEinzelkaufmann / Einzelkauffrau\nUbstadt-Weiher\n\nDen Gläubigern der an der Ausgliederung beteiligten Rechtsträger ist, wenn sie binnen sechs Monaten nach dem Tag, an dem die Eintragung der Ausgliederung in das Register des Sitzes desjenigen Rechtsträgers, dessen Gläubiger sie sind, nach § 19 Abs. 3 UmwG als bekanntgemacht gilt, ihren Anspruch nach Grund und Höhe schriftlich anmelden, Sicherheit zu leisten, soweit sie nicht Befriedigung verlangen können. Dieses Recht steht den Gläubigern jedoch nur zu, wenn sie glaubhaft machen, dass durch die Ausgliederung die Erfüllung ihrer Forderung gefährdet wird."
    },
    {
      "date": "2025-07-11",
      "id": "115502",
      "original_text": "Registerbekanntmachung nach dem Umwandlungsgesetz\nBaden-Württemberg Amtsgericht Mannheim HRB 755034\nGerstäcker - Bauwerk Künstlerbedarf und Material GmbH – Karlsruhe",
      "type": "Registerbekanntmachung nach dem Umwandlungsgesetz",
      "state": "Baden-Württemberg",
      "amtsgericht": "Amtsgericht Mannheim",
      "registernummer": "HRB 755034",
      "registerart": "HRB",
      "company_name": "Gerstäcker - Bauwerk Künstlerbedarf und Material GmbH",
      "company_seat": "Karlsruhe",
      "details": "11.07.2025 (Bekanntmachungsdatum)\n\nBaden-Württemberg Amtsgericht Mannheim HRB 755034\nRegisterbekanntmachung nach dem Umwandlungsgesetz 11.07.2025 (Eintragungsdatum)\n\nGerstäcker - Bauwerk Künstlerbedarf und Material GmbH\nGesellschaft mit beschränkter Haftung\nKarlsruhe\n\nDen Gläubigern des an dem Formwechsel beteiligten Rechtsträgers ist, wenn sie binnen sechs Monaten nach dem Tag, an dem die Eintragung des Formwechsels in das Register des Sitzes desjenigen Rechtsträgers, dessen Gläubiger sie sind, nach § 19 Abs. 3 UmwG als bekanntgemacht gilt, ihren Anspruch nach Grund und Höhe schriftlich anmelden, Sicherheit zu leisten, soweit sie nicht Befriedigung verlangen können. Dieses Recht steht den Gläubigern jedoch nur zu, wenn sie glaubhaft machen, dass durch den Formwechsel die Erfüllung ihrer Forderung gefährdet wird."
    },
    {
      "date": "2025-07-11",
      "id": "115503",
      "original_text": "Löschungsankündigung\nBerlin Amtsgericht Berlin (Charlottenburg) HRB 231176\nALG Wealth Management GmbH – Berlin",
      "type": "Löschungsankündigung",
      "state": "Berlin",
      "amtsgericht": "Amtsgericht Berlin (Charlottenburg)",
      "registernummer": "HRB 231176",
      "registerart": "HRB",
      "company_name": "ALG Wealth Management GmbH",
      "company_seat": "Berlin",
      "details": "11.07.2025 (Bekanntmachungsdatum)\n\nBerlin Amtsgericht Berlin (Charlottenburg) HRB 231176\nLöschungsankündigung\n\nALG Wealth Management GmbH\nGesellschaft mit beschränkter Haftung\nBerlin\n\nBei der nachstehenden Gesellschaft wird das Amtslöschungsverfahren gemäß § 394 FamFG eingeleitet. Widerspruchsfrist 6 Wochen"
    },
    {
      "date": "2025-07-11",
      "id": "115504",
      "original_text": "Registerbekanntmachung nach dem Umwandlungsgesetz\nMecklenburg-Vorpommern Amtsgericht Neubrandenburg HRB 20523\nKDW Management GmbH – Neustrelitz",
      "type": "Registerbekanntmachung nach dem Umwandlungsgesetz",
      "state": "Mecklenburg-Vorpommern",
      "amtsgericht": "Amtsgericht Neubrandenburg",
      "registernummer": "HRB 20523",
      "registerart": "HRB",
      "company_name": "KDW Management GmbH",
      "company_seat": "Neustrelitz",
      "details": "11.07.2025 (Bekanntmachungsdatum)\n\nMecklenburg-Vorpommern Amtsgericht Neubrandenburg HRB 20523\nRegisterbekanntmachung nach dem Umwandlungsgesetz 11.07.2025 (Eintragungsdatum)\n\nKDW Management GmbH\nGesellschaft mit beschränkter Haftung\nNeustrelitz\n\nAls nicht eingetragen wird veröffentlicht: Den Gläubigern der an der Spaltung beteiligten Rechtsträger ist, wenn sie binnen sechs Monaten nach dem Tag, an dem die Eintragung der Spaltung in das Register des Sitzes desjenigen Rechtsträgers, dessen Gläubiger sie sind, nach § 19 Abs. 3 UmwG als bekannt gemacht gilt, ihren Anspruch nach Grund und Höhe schriftlich anmelden, Sicherheit zu leisten, soweit sie nicht Befriedigung verlangen können. Dieses Recht steht den Gläubigern jedoch nur zu, wenn sie glaubhaft machen, dass durch die Spaltung die Erfüllung der Forderung gefährdet wird."
    },
    {
      "date": "2025-07-11",
      "id": "115505",
      "original_text": "Löschungsankündigung\nBerlin Amtsgericht Berlin (Charlottenburg) HRB 254764\nFenster Concept X GmbH – Berlin",
      "type": "Löschungsankündigung",
      "state": "Berlin",
      "amtsgericht": "Amtsgericht Berlin (Charlottenburg)",
      "registernummer": "HRB 254764",
      "registerart": "HRB",
      "company_name": "Fenster Concept X GmbH",
      "company_seat": "Berlin",
      "details": "11.07.2025 (Bekanntmachungsdatum)\n\nBerlin Amtsgericht Berlin (Charlottenburg) HRB 254764\nLöschungsankündigung\n\nFenster Concept X GmbH\nGesellschaft mit beschränkter Haftung\nBerlin\n\nBei der nachstehenden Gesellschaft wird das Amtslöschungsverfahren gemäß § 394 FamFG eingeleitet. Widerspruchsfrist 6 Wochen"
    },
    {
      "date": "2025-07-11",
      "id": "115506",
      "original_text": "Registerbekanntmachung nach dem Umwandlungsgesetz\nBaden-Württemberg Amtsgericht Freiburg HRA 708302\nMartin Schöndienst Vermietung und Verpachtung GmbH & Co. KG – Hüfingen",
      "type": "Registerbekanntmachung nach dem Umwandlungsgesetz",
      "state": "Baden-Württemberg",
      "amtsgericht": "Amtsgericht Freiburg",
      "registernummer": "HRA 708302",
      "registerart": "HRA",
      "company_name": "Martin Schöndienst Vermietung und Verpachtung GmbH & Co. KG",
      "company_seat": "Hüfingen",
      "details": "11.07.2025 (Bekanntmachungsdatum)\n\nBaden-Württemberg Amtsgericht Freiburg HRA 708302\nRegisterbekanntmachung nach dem Umwandlungsgesetz 11.07.2025 (Eintragungsdatum)\n\nMartin Schöndienst Vermietung und Verpachtung GmbH & Co. KG\nKommanditgesellschaft\nHüfingen\n\nDen Gläubigern der an der Ausgliederung beteiligten Rechtsträger ist, wenn sie binnen sechs Monaten nach dem Tag, an dem die Eintragung der Ausgliederung in das Register des Sitzes desjenigen Rechtsträgers, dessen Gläubiger sie sind, nach § 19 Abs. 3 UmwG als bekanntgemacht gilt, ihren Anspruch nach Grund und Höhe schriftlich anmelden, Sicherheit zu leisten, soweit sie nicht Befriedigung verlangen können. Dieses Recht steht den Gläubigern jedoch nur zu, wenn sie glaubhaft machen, dass durch die Ausgliederung die Erfüllung ihrer Forderung gefährdet wird."
    },
    {
      "date": "2025-07-11",
      "id": "115507",
      "original_text": "Einreichung neuer Dokumente\nBaden-Württemberg Amtsgericht Stuttgart HRB 772815\nLH EnergyHOME AG – Hochdorf",
      "type": "Einreichung neuer Dokumente",
      "state": "Baden-Württemberg",
      "amtsgericht": "Amtsgericht Stuttgart",
      "registernummer": "HRB 772815",
      "registerart": "HRB",
      "company_name": "LH EnergyHOME AG",
      "company_seat": "Hochdorf",
      "details": "11.07.2025 (Bekanntmachungsdatum)\n\nBaden-Württemberg Amtsgericht Stuttgart HRB 772815\nEinreichung neuer Dokumente 11.07.2025 (Eintragungsdatum)\n\nLH EnergyHOME AG\nAktiengesellschaft\nHochdorf\n\nDie Gesellschaft hat am 10.07.2025 die Liste über die Zusammensetzung des Aufsichtsrats zum Handelsregister eingereicht."
    },
    {
      "date": "2025-07-11",
      "id": "115508",
      "original_text": "Registerbekanntmachung nach dem Umwandlungsgesetz\nHamburg Amtsgericht Hamburg HRA 106591\nASU Magdalenen GmbH & Co. KG – Hamburg",
      "type": "Registerbekanntmachung nach dem Umwandlungsgesetz",
      "state": "Hamburg",
      "amtsgericht": "Amtsgericht Hamburg",
      "registernummer": "HRA 106591",
      "registerart": "HRA",
      "company_name": "ASU Magdalenen GmbH & Co. KG",
      "company_seat": "Hamburg",
      "details": "11.07.2025 (Bekanntmachungsdatum)\n\nHamburg Amtsgericht Hamburg HRA 106591\nRegisterbekanntmachung nach dem Umwandlungsgesetz 11.07.2025 (Eintragungsdatum)\n\nASU Magdalenen GmbH & Co. KG\nKommanditgesellschaft\nHamburg\n\nAls nicht eingetragen wird bekannt gemacht:\nDen Gläubigern der an der formwechselnden Umwandlung beteiligten Gesellschaften ist, wenn sie binnen sechs Monaten nach dem Tag, an dem die Eintragung der formwechselnden Umwandlung in das Register des Sitzes desjenigen Rechtsträgers, dessen Gläubiger sie sind, nach § 19 Absatz 3 UmwG als bekannt gemacht gilt, ihren Anspruch nach Grund und Höhe schriftlich anmelden, Sicherheit zu leisten, soweit sie nicht Befriedigung verlangen können. Dieses Recht steht den Gläubigern jedoch nur zu, wenn sie glaubhaft machen, dass durch die formwechselnde Umwandlung die Erfüllung ihrer Forderung gefährdet wird."
    },
    {
      "date": "2025-07-11",
      "id": "115509",
      "original_text": "Löschungsankündigung\nBerlin Amtsgericht Berlin (Charlottenburg) HRB 245687\nBorzuta & Partner UG (haftungsbeschränkt) – Berlin",
      "type": "Löschungsankündigung",
      "state": "Berlin",
      "amtsgericht": "Amtsgericht Berlin (Charlottenburg)",
      "registernummer": "HRB 245687",
      "registerart": "HRB",
      "company_name": "Borzuta & Partner UG (haftungsbeschränkt)",
      "company_seat": "Berlin",
      "details": "11.07.2025 (Bekanntmachungsdatum)\n\nBerlin Amtsgericht Berlin (Charlottenburg) HRB 245687\nLöschungsankündigung\n\nBorzuta & Partner UG (haftungsbeschränkt)\nGesellschaft mit beschränkter Haftung\nBerlin\n\nBei der nachstehenden Gesellschaft wird das Amtslöschungsverfahren gemäß § 394 FamFG eingeleitet. Widerspruchsfrist 6 Wochen"
    },
    {
      "date": "2025-07-11",
      "id": "115510",
      "original_text": "Registerbekanntmachung nach dem Umwandlungsgesetz\nBaden-Württemberg Amtsgericht Stuttgart HRB 411393\nBWPOST Zollernalb GmbH – Balingen",
      "type": "Registerbekanntmachung nach dem Umwandlungsgesetz",
      "state": "Baden-Württemberg",
      "amtsgericht": "Amtsgericht Stuttgart",
      "registernummer": "HRB 411393",
      "registerart": "HRB",
      "company_name": "BWPOST Zollernalb GmbH",
      "company_seat": "Balingen",
      "details": "11.07.2025 (Bekanntmachungsdatum)\n\nBaden-Württemberg Amtsgericht Stuttgart HRB 411393\nRegisterbekanntmachung nach dem Umwandlungsgesetz 11.07.2025 (Eintragungsdatum)\n\nBWPOST Zollernalb GmbH\nGesellschaft mit beschränkter Haftung\nBalingen\n\nAls nicht eingetragen wird bekanntgemacht:\nDen Gläubigern der an der Verschmelzung beteiligten Rechtsträger ist, wenn sie binnen sechs Monaten nach dem Tag, an dem die Eintragung der Verschmelzung in das Register des Sitzes desjenigen Rechtsträgers, dessen Gläubiger sie sind, nach § 19 Abs. 3 UmwG als bekanntgemacht gilt, ihren Anspruch nach Grund und Höhe schriftlich anmelden, Sicherheit zu leisten, soweit sie nicht Befriedigung verlangen können. Dieses Recht steht den Gläubigern jedoch nur zu, wenn sie glaubhaft machen, dass durch die Verschmelzung die Erfüllung ihrer Forderung gefährdet wird."
    },
    {
      "date": "2025-07-11",
      "id": "115511",
      "original_text": "Registerbekanntmachung nach dem Umwandlungsgesetz\nSaarland Amtsgericht Saarbrücken HRB 111369\nMeiser Stahlgestelle Photovoltaik GmbH – Losheim am See",
      "type": "Registerbekanntmachung nach dem Umwandlungsgesetz",
      "state": "Saarland",
      "amtsgericht": "Amtsgericht Saarbrücken",
      "registernummer": "HRB 111369",
      "registerart": "HRB",
      "company_name": "Meiser Stahlgestelle Photovoltaik GmbH",
      "company_seat": "Losheim am See",
      "details": "11.07.2025 (Bekanntmachungsdatum)\n\nSaarland Amtsgericht Saarbrücken HRB 111369\nRegisterbekanntmachung nach dem Umwandlungsgesetz 11.07.2025 (Eintragungsdatum)\n\nMeiser Stahlgestelle Photovoltaik GmbH\nGesellschaft mit beschränkter Haftung\nLosheim am See\n\nAls nicht eingetragen wird bekannt gemacht: Den Gläubigern der an der Verschmelzung beteiligten Gesellschaften ist, wenn sie binnen sechs Monaten nach dem Tag, an dem die Eintragung der Verschmelzung in das Register des Sitzes desjenigen Rechtsträgers, dessen Gläubiger sie sind, nach § 19 Absatz 3 UmwG bekannt gemacht worden ist, ihren Anspruch nach Grund und Höhe schriftlich anmelden, Sicherheit zu leisten, soweit sie nicht Befriedigung verlangen können. Dieses Recht steht den Gläubigern jedoch nur zu, wenn sie glaubhaft machen, dass durch die Verschmelzung die Erfüllung ihrer Forderung gefährdet wird."
    },
    {
      "date": "2025-07-11",
      "id": "115512",
      "original_text": "Registerbekanntmachung nach dem Umwandlungsgesetz\nBaden-Württemberg Amtsgericht Freiburg HRA 709050\nMartin Schöndienst Arbeitssicherheit e.K. – Hüfingen",
      "type": "Registerbekanntmachung nach dem Umwandlungsgesetz",
      "state": "Baden-Württemberg",
      "amtsgericht": "Amtsgericht Freiburg",
      "registernummer": "HRA 709050",
      "registerart": "HRA",
      "company_name": "Martin Schöndienst Arbeitssicherheit e.K.",
      "company_seat": "Hüfingen",
      "details": "11.07.2025 (Bekanntmachungsdatum)\n\nBaden-Württemberg Amtsgericht Freiburg HRA 709050\nRegisterbekanntmachung nach dem Umwandlungsgesetz 11.07.2025 (Eintragungsdatum)\n\nMartin Schöndienst Arbeitssicherheit e.K.\nEinzelkaufmann / Einzelkauffrau\nHüfingen\n\nDen Gläubigern der an der Ausgliederung beteiligten Rechtsträger ist, wenn sie binnen sechs Monaten nach dem Tag, an dem die Eintragung der Ausgliederung in das Register des Sitzes desjenigen Rechtsträgers, dessen Gläubiger sie sind, nach § 19 Abs. 3 UmwG als bekanntgemacht gilt, ihren Anspruch nach Grund und Höhe schriftlich anmelden, Sicherheit zu leisten, soweit sie nicht Befriedigung verlangen können. Dieses Recht steht den Gläubigern jedoch nur zu, wenn sie glaubhaft machen, dass durch die Ausgliederung die Erfüllung ihrer Forderung gefährdet wird."
    },
    {
      "date": "2025-07-11",
      "id": "115513",
      "original_text": "Registerbekanntmachung nach dem Umwandlungsgesetz\nSaarland Amtsgericht Saarbrücken HRB 43883\nMeiser Straßenausstattung GmbH – Schmelz",
      "type": "Registerbekanntmachung nach dem Umwandlungsgesetz",
      "state": "Saarland",
      "amtsgericht": "Amtsgericht Saarbrücken",
      "registernummer": "HRB 43883",
      "registerart": "HRB",
      "company_name": "Meiser Straßenausstattung GmbH",
      "company_seat": "Schmelz",
      "details": "11.07.2025 (Bekanntmachungsdatum)\n\nSaarland Amtsgericht Saarbrücken HRB 43883\nRegisterbekanntmachung nach dem Umwandlungsgesetz 11.07.2025 (Eintragungsdatum)\n\nMeiser Straßenausstattung GmbH\nGesellschaft mit beschränkter Haftung\nSchmelz\n\nAls nicht eingetragen wird bekannt gemacht: Den Gläubigern der an der Verschmelzung beteiligten Gesellschaften ist, wenn sie binnen sechs Monaten nach dem Tag, an dem die Eintragung der Verschmelzung in das Register des Sitzes desjenigen Rechtsträgers, dessen Gläubiger sie sind, nach § 19 Absatz 3 UmwG bekannt gemacht worden ist, ihren Anspruch nach Grund und Höhe schriftlich anmelden, Sicherheit zu leisten, soweit sie nicht Befriedigung verlangen können. Dieses Recht steht den Gläubigern jedoch nur zu, wenn sie glaubhaft machen, dass durch die Verschmelzung die Erfüllung ihrer Forderung gefährdet wird."
    },
    {
      "date": "2025-07-11",
      "id": "115514",
      "original_text": "Registerbekanntmachung nach dem Umwandlungsgesetz\nBaden-Württemberg Amtsgericht Ulm HRB 736810\nMotke GmbH – Ravensburg",
      "type": "Registerbekanntmachung nach dem Umwandlungsgesetz",
      "state": "Baden-Württemberg",
      "amtsgericht": "Amtsgericht Ulm",
      "registernummer": "HRB 736810",
      "registerart": "HRB",
      "company_name": "Motke GmbH",
      "company_seat": "Ravensburg",
      "details": "11.07.2025 (Bekanntmachungsdatum)\n\nBaden-Württemberg Amtsgericht Ulm HRB 736810\nRegisterbekanntmachung nach dem Umwandlungsgesetz 11.07.2025 (Eintragungsdatum)\n\nMotke GmbH\nGesellschaft mit beschränkter Haftung\nRavensburg\n\nDen Gläubigern der an der Ausgliederung beteiligten Rechtsträger ist, wenn sie binnen sechs Monaten nach dem Tag, an dem die Eintragung der Ausgliederung in das Register des Sitzes desjenigen Rechtsträgers, dessen Gläubiger sie sind, nach § 19 Abs. 3 UmwG als bekanntgemacht gilt, ihren Anspruch nach Grund und Höhe schriftlich anmelden, Sicherheit zu leisten, soweit sie nicht Befriedigung verlangen können. Dieses Recht steht den Gläubigern jedoch nur zu, wenn sie glaubhaft machen, dass durch die Ausgliederung die Erfüllung ihrer Forderung gefährdet wird."
    },
    {
      "date": "2025-07-11",
      "id": "115515",
      "original_text": "Registerbekanntmachung nach dem Umwandlungsgesetz\nBaden-Württemberg Amtsgericht Stuttgart HRB 743027\nSchweizer Leder Beteiligungs GmbH – Stuttgart",
      "type": "Registerbekanntmachung nach dem Umwandlungsgesetz",
      "state": "Baden-Württemberg",
      "amtsgericht": "Amtsgericht Stuttgart",
      "registernummer": "HRB 743027",
      "registerart": "HRB",
      "company_name": "Schweizer Leder Beteiligungs GmbH",
      "company_seat": "Stuttgart",
      "details": "11.07.2025 (Bekanntmachungsdatum)\n\nBaden-Württemberg Amtsgericht Stuttgart HRB 743027\nRegisterbekanntmachung nach dem Umwandlungsgesetz 11.07.2025 (Eintragungsdatum)\n\nSchweizer Leder Beteiligungs GmbH\nGesellschaft mit beschränkter Haftung\nStuttgart\n\nDen Gläubigern der an der Verschmelzung beteiligten Rechtsträger ist, wenn sie binnen sechs Monaten nach dem Tag, an dem die Eintragung der Verschmelzung in das Register des Sitzes desjenigen Rechtsträgers, dessen Gläubiger sie sind, nach § 19 Abs. 3 UmwG als bekanntgemacht gilt, ihren Anspruch nach Grund und Höhe schriftlich anmelden, Sicherheit zu leisten, soweit sie nicht Befriedigung verlangen können. Dieses Recht steht den Gläubigern jedoch nur zu, wenn sie glaubhaft machen, dass durch die Verschmelzung die Erfüllung ihrer Forderung gefährdet wird."
    },
    {
      "date": "2025-07-11",
      "id": "115516",
      "original_text": "Registerbekanntmachung nach dem Umwandlungsgesetz\nBaden-Württemberg Amtsgericht Ulm HRB 552093\nhuGo's GmbH Gastronomiebetriebe – Ravensburg",
      "type": "Registerbekanntmachung nach dem Umwandlungsgesetz",
      "state": "Baden-Württemberg",
      "amtsgericht": "Amtsgericht Ulm",
      "registernummer": "HRB 552093",
      "registerart": "HRB",
      "company_name": "huGo's GmbH Gastronomiebetriebe",
      "company_seat": "Ravensburg",
      "details": "11.07.2025 (Bekanntmachungsdatum)\n\nBaden-Württemberg Amtsgericht Ulm HRB 552093\nRegisterbekanntmachung nach dem Umwandlungsgesetz 11.07.2025 (Eintragungsdatum)\n\nhuGo's GmbH Gastronomiebetriebe\nGesellschaft mit beschränkter Haftung\nRavensburg\n\nAls nicht eingetragen wird bekanntgemacht:\nDen Gläubigern der an der Ausgliederung beteiligten Rechtsträger ist, wenn sie binnen sechs Monaten nach dem Tag, an dem die Eintragung der Ausgliederung in das Register des Sitzes desjenigen Rechtsträgers, dessen Gläubiger sie sind, nach § 19 Abs. 3 UmwG als bekanntgemacht gilt, ihren Anspruch nach Grund und Höhe schriftlich anmelden, Sicherheit zu leisten, soweit sie nicht Befriedigung verlangen können. Dieses Recht steht den Gläubigern jedoch nur zu, wenn sie glaubhaft machen, dass durch die Ausgliederung die Erfüllung ihrer Forderung gefährdet wird."
    },
    {
      "date": "2025-07-11",
      "id": "115517",
      "original_text": "Registerbekanntmachung nach dem Umwandlungsgesetz\nSchleswig-Holstein Amtsgericht Lübeck HRB 7728\nHAY TecTrans GmbH – Wentorf",
      "type": "Registerbekanntmachung nach dem Umwandlungsgesetz",
      "state": "Schleswig-Holstein",
      "amtsgericht": "Amtsgericht Lübeck",
      "registernummer": "HRB 7728",
      "registerart": "HRB",
      "company_name": "HAY TecTrans GmbH",
      "company_seat": "Wentorf",
      "details": "11.07.2025 (Bekanntmachungsdatum)\n\nSchleswig-Holstein Amtsgericht Lübeck HRB 7728\nRegisterbekanntmachung nach dem Umwandlungsgesetz 10.07.2025 (Eintragungsdatum)\n\nHAY  TecTrans GmbH\nGesellschaft mit beschränkter Haftung\nWentorf\n\nZu Eintragungsnummer 2 vom 10.07.2025 wird als nicht eingetragen veröffentlicht:\nAls nicht eingetragen wird veröffentlicht: Den Gläubigern der an der Verschmelzung beteiligten Rechtsträger ist, wenn sie binnen sechs Monaten nach dem Tag, an dem die Eintragung der Verschmelzung in das Register des Sitzes desjenigen Rechtsträgers, dessen Gläubiger sie sind, als bekannt gemacht gilt, ihren Anspruch nach Grund und Höhe schriftlich anmelden, Sicherheit zu leisten, soweit sie nicht Befriedigung verlangen können. Dieses Recht steht den Gläubigern jedoch nur zu, wenn sie glaubhaft machen, dass durch die Verschmelzung die Erfüllung ihrer Forderung gefährdet wird."
    },
    {
      "date": "2025-07-11",
      "id": "115518",
      "original_text": "Registerbekanntmachung nach dem Umwandlungsgesetz\nBaden-Württemberg Amtsgericht Stuttgart HRB 24923\nNeckarwerke Stuttgart GmbH – Stuttgart",
      "type": "Registerbekanntmachung nach dem Umwandlungsgesetz",
      "state": "Baden-Württemberg",
      "amtsgericht": "Amtsgericht Stuttgart",
      "registernummer": "HRB 24923",
      "registerart": "HRB",
      "company_name": "Neckarwerke Stuttgart GmbH",
      "company_seat": "Stuttgart",
      "details": "11.07.2025 (Bekanntmachungsdatum)\n\nBaden-Württemberg Amtsgericht Stuttgart HRB 24923\nRegisterbekanntmachung nach dem Umwandlungsgesetz 11.07.2025 (Eintragungsdatum)\n\nNeckarwerke Stuttgart GmbH\nGesellschaft mit beschränkter Haftung\nStuttgart\n\nAls nicht eingetragen wird bekanntgemacht:\nDen Gläubigern der an der Ausgliederung beteiligten Rechtsträger ist, wenn sie binnen sechs Monaten nach dem Tag, an dem die Eintragung der Ausgliederung in das Register des Sitzes desjenigen Rechtsträgers, dessen Gläubiger sie sind, nach § 19 Abs. 3 UmwG als bekanntgemacht gilt, ihren Anspruch nach Grund und Höhe schriftlich anmelden, Sicherheit zu leisten, soweit sie nicht Befriedigung verlangen können. Dieses Recht steht den Gläubigern jedoch nur zu, wenn sie glaubhaft machen, dass durch die Ausgliederung die Erfüllung ihrer Forderung gefährdet wird."
    },
    {
      "date": "2025-07-11",
      "id": "115519",
      "original_text": "Sonstige Registerbekanntmachung\nHamburg Amtsgericht Hamburg HRB 132927\nRegionalwert AG Hamburg – Hamburg",
      "type": "Sonstige Registerbekanntmachung",
      "state": "Hamburg",
      "amtsgericht": "Amtsgericht Hamburg",
      "registernummer": "HRB 132927",
      "registerart": "HRB",
      "company_name": "Regionalwert AG Hamburg",
      "company_seat": "Hamburg",
      "details": "11.07.2025 (Bekanntmachungsdatum)\n\nHamburg Amtsgericht Hamburg HRB 132927\nSonstige Registerbekanntmachung\n\nRegionalwert AG Hamburg\nAktiengesellschaft\nHamburg\n\nAls nicht eingetragen wird bekannt gemacht: Liste des Aufsichtsrats wurde eingereicht."
    },
    {
      "date": "2025-07-11",
      "id": "115520",
      "original_text": "Registerbekanntmachung nach dem Umwandlungsgesetz\nBerlin Amtsgericht Berlin (Charlottenburg) HRA 64247\nTrisor Berlin GmbH & Co. KG – Berlin",
      "type": "Registerbekanntmachung nach dem Umwandlungsgesetz",
      "state": "Berlin",
      "amtsgericht": "Amtsgericht Berlin (Charlottenburg)",
      "registernummer": "HRA 64247",
      "registerart": "HRA",
      "company_name": "Trisor Berlin GmbH & Co. KG",
      "company_seat": "Berlin",
      "details": "11.07.2025 (Bekanntmachungsdatum)\n\nBerlin Amtsgericht Berlin (Charlottenburg) HRA 64247\nRegisterbekanntmachung nach dem Umwandlungsgesetz 10.07.2025 (Eintragungsdatum)\n\nTrisor Berlin GmbH & Co. KG\nKommanditgesellschaft\nBerlin\n\nZu Eintragungsnummer 2 vom 10.07.2025 wird als nicht eingetragen veröffentlicht: Den Gläubigern der an der Spaltung beteiligten Rechtsträger ist, wenn sie binnen sechs Monaten nach dem Tag, an dem die Eintragung der Spaltung in das Register des Sitzes desjenigen Rechtsträgers, dessen Gläubiger sie sind, als bekannt gemacht gilt, ihren Anspruch nach Grund und Höhe schriftlich anmelden, Sicherheit zu leisten, soweit sie nicht Befriedigung verlangen können. Dieses Recht steht den Gläubigern jedoch nur zu, wenn sie glaubhaft machen, dass durch die Spaltung die Erfüllung ihrer Forderung gefährdet wird. Das Recht, Sicherheitsleistung zu verlangen, steht Gläubigern nicht zu, die im Falle der Insolvenz ein Recht auf vorzugsweise Befriedigung aus einer Deckungsmasse haben, die nach gesetzlicher Vorschrift zu ihrem Schutz errichtet und staatlich überwacht ist."
    },
    {
      "date": "2025-07-11",
      "id": "115521",
      "original_text": "Registerbekanntmachung nach dem Umwandlungsgesetz\nNordrhein-Westfalen Amtsgericht Coesfeld VR 3537\nBehinderten-Sportgemeinschaft Borken e.V. – Borken",
      "type": "Registerbekanntmachung nach dem Umwandlungsgesetz",
      "state": "Nordrhein-Westfalen",
      "amtsgericht": "Amtsgericht Coesfeld",
      "registernummer": "VR 3537",
      "registerart": "VR",
      "company_name": "Behinderten-Sportgemeinschaft Borken e.V.",
      "company_seat": "Borken",
      "details": "11.07.2025 (Bekanntmachungsdatum)\n\nNordrhein-Westfalen Amtsgericht Coesfeld VR 3537\nRegisterbekanntmachung nach dem Umwandlungsgesetz 11.07.2025 (Eintragungsdatum)\n\nBehinderten-Sportgemeinschaft Borken e.V.\neingetragener Verein\nBorken\n\nAls nicht eingetragen wird bekanntgemacht: Den Gläubigern der an der Verschmelzung beteiligten Rechtsträger ist, wenn sie binnen sechs Monaten nach dem Tag, an dem die Eintragung der Verschmelzung in das Register des Sitzes desjenigen Rechtsträgers, dessen Gläubiger sie sind, nach § 19 Absatz 3 UmwG als bekanntgemacht gilt, ihren Anspruch nach Grund und Höhe schriftlich anmelden, Sicherheit zu leisten, soweit sie nicht Befriedigung verlangen können. Dieses Recht steht den Gläubigern jedoch nur zu, wenn sie glaubhaft machen, dass durch die Verschmelzung die Erfüllung ihrer Forderung gefährdet wird. Das Recht, Sicherheitsleistung zu verlangen, steht Gläubigern nicht zu, die im Fall des Insolvenzverfahrens ein Recht auf vorzugsweise Befriedigung aus einer Deckungsmasse haben, die nach gesetzlicher Vorschrift zu ihrem Schutz errichtet und staatlich überwacht ist."
    },
    {
      "date": "2025-07-11",
      "id": "115522",
      "original_text": "Sonstige Registerbekanntmachung\nBaden-Württemberg Amtsgericht Freiburg HRB 700791\nKristian`s GmbH – Bad Säckingen",
      "type": "Sonstige Registerbekanntmachung",
      "state": "Baden-Württemberg",
      "amtsgericht": "Amtsgericht Freiburg",
      "registernummer": "HRB 700791",
      "registerart": "HRB",
      "company_name": "Kristian`s GmbH",
      "company_seat": "Bad Säckingen",
      "details": "11.07.2025 (Bekanntmachungsdatum)\n\nBaden-Württemberg Amtsgericht Freiburg HRB 700791\nSonstige Registerbekanntmachung 11.07.2025 (Eintragungsdatum)\n\nKristian`s GmbH\nGesellschaft mit beschränkter Haftung\nBad Säckingen\n\nAls nicht eingetragen wird bekanntgemacht:\nDen Gläubigern der Gesellschaft, deren Forderungen begründet worden sind, bevor die Eintragung der Beendigung des Vertrages in das Handelsregister nach § 10 HGB als bekanntgemacht gilt, ist vom anderen Vertragsteil Sicherheit zu leisten, wenn sie sich binnen sechs Monaten nach der Bekanntmachung zu diesem Zweck bei ihm melden."
    },
    {
      "date": "2025-07-11",
      "id": "115523",
      "original_text": "Registerbekanntmachung nach dem Umwandlungsgesetz\nHamburg Amtsgericht Hamburg HRB 190081\napera engineers GmbH – Hamburg",
      "type": "Registerbekanntmachung nach dem Umwandlungsgesetz",
      "state": "Hamburg",
      "amtsgericht": "Amtsgericht Hamburg",
      "registernummer": "HRB 190081",
      "registerart": "HRB",
      "company_name": "apera engineers GmbH",
      "company_seat": "Hamburg",
      "details": "11.07.2025 (Bekanntmachungsdatum)\n\nHamburg Amtsgericht Hamburg HRB 190081\nRegisterbekanntmachung nach dem Umwandlungsgesetz 11.07.2025 (Eintragungsdatum)\n\napera engineers GmbH\nGesellschaft mit beschränkter Haftung\nHamburg\n\nAls nicht eingetragen wird bekannt gemacht:\nDen Gläubigern der an der Ausgliederung beteiligten Gesellschaften ist, wenn sie binnen sechs Monaten nach dem Tag, an dem die Eintragung der Ausgliederung in das Register des Sitzes desjenigen Rechtsträgers, dessen Gläubiger sie sind, nach § 19 Absatz 3 UmwG als bekannt gemacht gilt, ihren Anspruch nach Grund und Höhe schriftlich anmelden, Sicherheit zu leisten, soweit sie nicht Befriedigung verlangen können. Dieses Recht steht den Gläubigern jedoch nur zu, wenn sie glaubhaft machen, dass durch die Ausgliederung die Erfüllung ihrer Forderung gefährdet wird."
    },
    {
      "date": "2025-07-11",
      "id": "115524",
      "original_text": "Registerbekanntmachung nach dem Umwandlungsgesetz\nBaden-Württemberg Amtsgericht Stuttgart HRB 742747\nCETRO GmbH – Stuttgart",
      "type": "Registerbekanntmachung nach dem Umwandlungsgesetz",
      "state": "Baden-Württemberg",
      "amtsgericht": "Amtsgericht Stuttgart",
      "registernummer": "HRB 742747",
      "registerart": "HRB",
      "company_name": "CETRO GmbH",
      "company_seat": "Stuttgart",
      "details": "11.07.2025 (Bekanntmachungsdatum)\n\nBaden-Württemberg Amtsgericht Stuttgart HRB 742747\nRegisterbekanntmachung nach dem Umwandlungsgesetz 11.07.2025 (Eintragungsdatum)\n\nCETRO GmbH\nGesellschaft mit beschränkter Haftung\nStuttgart\n\nAls nicht eingetragen wird bekanntgemacht: Den Gläubigern der an der Verschmelzung beteiligten Rechtsträger ist, wenn sie binnen sechs Monaten nach dem Tag, an dem die Eintragung der Verschmelzung in das Register des Sitzes desjenigen Rechtsträgers, dessen Gläubiger sie sind, nach § 19 Abs. 3 UmwG als bekanntgemacht gilt, ihren Anspruch nach Grund und Höhe schriftlich anmelden, Sicherheit zu leisten, soweit sie nicht Befriedigung verlangen können. Dieses Recht steht den Gläubigern jedoch nur zu, wenn sie glaubhaft machen, dass durch die Verschmelzung die Erfüllung ihrer Forderung gefährdet wird."
    },
    {
      "date": "2025-07-11",
      "id": "115525",
      "original_text": "Löschungsankündigung\nBerlin Amtsgericht Berlin (Charlottenburg) HRB 183421\nfoldAirs GmbH – Berlin",
      "type": "Löschungsankündigung",
      "state": "Berlin",
      "amtsgericht": "Amtsgericht Berlin (Charlottenburg)",
      "registernummer": "HRB 183421",
      "registerart": "HRB",
      "company_name": "foldAirs GmbH",
      "company_seat": "Berlin",
      "details": "11.07.2025 (Bekanntmachungsdatum)\n\nBerlin Amtsgericht Berlin (Charlottenburg) HRB 183421\nLöschungsankündigung\n\nfoldAirs GmbH\nGesellschaft mit beschränkter Haftung\nBerlin\n\nBei der nachstehenden Gesellschaft wird das Amtslöschungsverfahren gemäß § 394 FamFG eingeleitet. Widerspruchsfrist 6 Wochen"
    },
    {
      "date": "2025-07-11",
      "id": "115526",
      "original_text": "Registerbekanntmachung nach dem Umwandlungsgesetz\nNordrhein-Westfalen Amtsgericht Coesfeld HRB 19103\nMatthews International GmbH – Vreden",
      "type": "Registerbekanntmachung nach dem Umwandlungsgesetz",
      "state": "Nordrhein-Westfalen",
      "amtsgericht": "Amtsgericht Coesfeld",
      "registernummer": "HRB 19103",
      "registerart": "HRB",
      "company_name": "Matthews International GmbH",
      "company_seat": "Vreden",
      "details": "11.07.2025 (Bekanntmachungsdatum)\n\nNordrhein-Westfalen Amtsgericht Coesfeld HRB 19103\nRegisterbekanntmachung nach dem Umwandlungsgesetz 11.07.2025 (Eintragungsdatum)\n\nMatthews International GmbH\nGesellschaft mit beschränkter Haftung\nVreden\n\nDen Gläubigern der an der Abspaltung beteiligten Rechtsträger ist, wenn sie binnen sechs Monaten nach dem Tag, an dem die Eintragung der Abspaltung in das Register des Sitzes derjenigen Rechtsträger deren Gläubiger sie sind, nach § 19 Absatz 3 UmwG als bekanntgemacht gilt, ihren Anspruch nach Grund und Höhe schriftlich anmelden, Sicherheit zu leisten, soweit sie nicht Befriedigung verlangen können. Dieses Recht steht den Gläubigern jedoch nur zu, wenn sie glaubhaft machen, dass durch die Abspaltung die Erfüllung ihrer Forderung gefährdet wird."
    },
    {
      "date": "2025-07-11",
      "id": "115527",
      "original_text": "Registerbekanntmachung nach dem Umwandlungsgesetz\nNordrhein-Westfalen Amtsgericht Coesfeld HRA 10164\nSaueressig Vreden GmbH & Co. KG – Vreden",
      "type": "Registerbekanntmachung nach dem Umwandlungsgesetz",
      "state": "Nordrhein-Westfalen",
      "amtsgericht": "Amtsgericht Coesfeld",
      "registernummer": "HRA 10164",
      "registerart": "HRA",
      "company_name": "Saueressig Vreden GmbH & Co. KG",
      "company_seat": "Vreden",
      "details": "11.07.2025 (Bekanntmachungsdatum)\n\nNordrhein-Westfalen Amtsgericht Coesfeld HRA 10164\nRegisterbekanntmachung nach dem Umwandlungsgesetz 11.07.2025 (Eintragungsdatum)\n\nSaueressig Vreden GmbH & Co. KG\nKommanditgesellschaft\nVreden\n\nAls nicht eingetragen wird bekanntgemacht: Den Gläubigern der an der Ausgliederung beteiligten Rechtsträger ist, wenn sie binnen sechs Monaten nach dem Tag, an dem die Eintragung der Ausgliederung in das Register des Sitzes desjenigen Rechtsträgers, dessen Gläubiger sie sind, nach § 19 Absatz 3 UmwG als bekanntgemacht gilt, ihren Anspruch nach Grund und Höhe schriftlich anmelden, Sicherheit zu leisten, soweit sie nicht Befriedigung verlangen können. Dieses Recht steht den Gläubigern jedoch nur zu, wenn sie glaubhaft machen, dass durch die Ausgliederung die Erfüllung ihrer Forderung gefährdet wird. Das Recht, Sicherheitsleistung zu verlangen, steht Gläubigern nicht zu, die im Fall des Insolvenzverfahrens ein Recht auf vorzugsweise Befriedigung aus einer Deckungsmasse haben, die nach gesetzlicher Vorschrift zu ihrem Schutz errichtet und staatlich überwacht ist."
    },
    {
      "date": "2025-07-11",
      "id": "115528",
      "original_text": "Löschungsankündigung\nBrandenburg Amtsgericht Potsdam HRB 13440\nHotel Berlin GmbH – Zossen",
      "type": "Löschungsankündigung",
      "state": "Brandenburg",
      "amtsgericht": "Amtsgericht Potsdam",
      "registernummer": "HRB 13440",
      "registerart": "HRB",
      "company_name": "Hotel Berlin GmbH",
      "company_seat": "Zossen",
      "details": "11.07.2025 (Bekanntmachungsdatum)\n\nBrandenburg Amtsgericht Potsdam HRB 13440\nLöschungsankündigung\n\nHotel Berlin GmbH\nGesellschaft mit beschränkter Haftung\nZossen\n\nBei der nachstehenden Gesellschaft wird das Amtslöschungsverfahren gemäß § 394 FamFG eingeleitet. Widerspruchsfrist: 8 Wochen."
    },
    {
      "date": "2025-07-11",
      "id": "115529",
      "original_text": "Registerbekanntmachung nach dem Umwandlungsgesetz\nBaden-Württemberg Amtsgericht Mannheim HRB 734983\nGC Ventures UG (haftungsbeschränkt) – Heidelberg",
      "type": "Registerbekanntmachung nach dem Umwandlungsgesetz",
      "state": "Baden-Württemberg",
      "amtsgericht": "Amtsgericht Mannheim",
      "registernummer": "HRB 734983",
      "registerart": "HRB",
      "company_name": "GC Ventures UG (haftungsbeschränkt)",
      "company_seat": "Heidelberg",
      "details": "11.07.2025 (Bekanntmachungsdatum)\n\nBaden-Württemberg Amtsgericht Mannheim HRB 734983\nRegisterbekanntmachung nach dem Umwandlungsgesetz 11.07.2025 (Eintragungsdatum)\n\nGC Ventures UG (haftungsbeschränkt)\nGesellschaft mit beschränkter Haftung\nHeidelberg\n\nDen Gläubigern der an der Verschmelzung beteiligten Rechtsträger ist, wenn sie binnen sechs Monaten nach dem Tag, an dem die Eintragung der Verschmelzung in das Register des Sitzes desjenigen Rechtsträgers, dessen Gläubiger sie sind, nach § 19 Abs. 3 UmwG als bekanntgemacht gilt, ihren Anspruch nach Grund und Höhe schriftlich anmelden, Sicherheit zu leisten, soweit sie nicht Befriedigung verlangen können. Dieses Recht steht den Gläubigern jedoch nur zu, wenn sie glaubhaft machen, dass durch die Verschmelzung die Erfüllung ihrer Forderung gefährdet wird."
    },
    {
      "date": "2025-07-11",
      "id": "115530",
      "original_text": "Registerbekanntmachung nach dem Umwandlungsgesetz\nHamburg Amtsgericht Hamburg HRA 131619\nMarc Müller - Arbeiten im Garten und am Haus e.K. – Hamburg",
      "type": "Registerbekanntmachung nach dem Umwandlungsgesetz",
      "state": "Hamburg",
      "amtsgericht": "Amtsgericht Hamburg",
      "registernummer": "HRA 131619",
      "registerart": "HRA",
      "company_name": "Marc Müller - Arbeiten im Garten und am Haus e.K.",
      "company_seat": "Hamburg",
      "details": "11.07.2025 (Bekanntmachungsdatum)\n\nHamburg Amtsgericht Hamburg HRA 131619\nRegisterbekanntmachung nach dem Umwandlungsgesetz 11.07.2025 (Eintragungsdatum)\n\nMarc Müller - Arbeiten im Garten und am Haus e.K.\nEinzelkaufmann\nHamburg\n\nAls nicht eingetragen wird bekannt gemacht:\nDen Gläubigern der an der Ausgliederung beteiligten Gesellschaften ist, wenn sie binnen sechs Monaten nach dem Tag, an dem die Eintragung der Ausgliederung in das Register des Sitzes desjenigen Rechtsträgers, dessen Gläubiger sie sind, nach § 19 Absatz 3 UmwG als bekannt gemacht gilt, ihren Anspruch nach Grund und Höhe schriftlich anmelden, Sicherheit zu leisten, soweit sie nicht Befriedigung verlangen können. Dieses Recht steht den Gläubigern jedoch nur zu, wenn sie glaubhaft machen, dass durch die Ausgliederung die Erfüllung ihrer Forderung gefährdet wird."
    },
    {
      "date": "2025-07-11",
      "id": "115531",
      "original_text": "Registerbekanntmachung nach dem Umwandlungsgesetz\nHamburg Amtsgericht Hamburg HRB 193481\nBaumgrenzen-Hamburg GmbH – Hamburg",
      "type": "Registerbekanntmachung nach dem Umwandlungsgesetz",
      "state": "Hamburg",
      "amtsgericht": "Amtsgericht Hamburg",
      "registernummer": "HRB 193481",
      "registerart": "HRB",
      "company_name": "Baumgrenzen-Hamburg GmbH",
      "company_seat": "Hamburg",
      "details": "11.07.2025 (Bekanntmachungsdatum)\n\nHamburg Amtsgericht Hamburg HRB 193481\nRegisterbekanntmachung nach dem Umwandlungsgesetz 11.07.2025 (Eintragungsdatum)\n\nBaumgrenzen-Hamburg GmbH\nGesellschaft mit beschränkter Haftung\nHamburg\n\nAls nicht eingetragen wird bekannt gemacht:\nDen Gläubigern der an der Ausgliederung beteiligten Gesellschaften ist, wenn sie binnen sechs Monaten nach dem Tag, an dem die Eintragung der Ausgliederung in das Register des Sitzes desjenigen Rechtsträgers, dessen Gläubiger sie sind, nach § 19 Absatz 3 UmwG als bekannt gemacht gilt, ihren Anspruch nach Grund und Höhe schriftlich anmelden, Sicherheit zu leisten, soweit sie nicht Befriedigung verlangen können. Dieses Recht steht den Gläubigern jedoch nur zu, wenn sie glaubhaft machen, dass durch die Ausgliederung die Erfüllung ihrer Forderung gefährdet wird."
    },
    {
      "date": "2025-07-11",
      "id": "115532",
      "original_text": "Registerbekanntmachung nach dem Umwandlungsgesetz\nBaden-Württemberg Amtsgericht Mannheim HRB 728821\nstark.marketing GmbH – Heidelberg",
      "type": "Registerbekanntmachung nach dem Umwandlungsgesetz",
      "state": "Baden-Württemberg",
      "amtsgericht": "Amtsgericht Mannheim",
      "registernummer": "HRB 728821",
      "registerart": "HRB",
      "company_name": "stark.marketing GmbH",
      "company_seat": "Heidelberg",
      "details": "11.07.2025 (Bekanntmachungsdatum)\n\nBaden-Württemberg Amtsgericht Mannheim HRB 728821\nRegisterbekanntmachung nach dem Umwandlungsgesetz 11.07.2025 (Eintragungsdatum)\n\nstark.marketing GmbH\nGesellschaft mit beschränkter Haftung\nHeidelberg\n\nAls nicht eingetragen wird bekanntgemacht:\nDen Gläubigern der an der Verschmelzung beteiligten Rechtsträger ist, wenn sie binnen sechs Monaten nach dem Tag, an dem die Eintragung der Verschmelzung in das Register des Sitzes desjenigen Rechtsträgers, dessen Gläubiger sie sind, nach § 19 Abs. 3 UmwG als bekanntgemacht gilt, ihren Anspruch nach Grund und Höhe schriftlich anmelden, Sicherheit zu leisten, soweit sie nicht Befriedigung verlangen können. Dieses Recht steht den Gläubigern jedoch nur zu, wenn sie glaubhaft machen, dass durch die Verschmelzung die Erfüllung ihrer Forderung gefährdet wird."
    },
    {
      "date": "2025-07-11",
      "id": "115533",
      "original_text": "Registerbekanntmachung nach dem Umwandlungsgesetz\nBerlin Amtsgericht Berlin (Charlottenburg) HRB 268109\nFriedrich-Aufzüge Verwaltungs-GmbH – Berlin",
      "type": "Registerbekanntmachung nach dem Umwandlungsgesetz",
      "state": "Berlin",
      "amtsgericht": "Amtsgericht Berlin (Charlottenburg)",
      "registernummer": "HRB 268109",
      "registerart": "HRB",
      "company_name": "Friedrich-Aufzüge Verwaltungs-GmbH",
      "company_seat": "Berlin",
      "details": "11.07.2025 (Bekanntmachungsdatum)\n\nBerlin Amtsgericht Berlin (Charlottenburg) HRB 268109\nRegisterbekanntmachung nach dem Umwandlungsgesetz 10.07.2025 (Eintragungsdatum)\n\nFriedrich-Aufzüge Verwaltungs-GmbH\nGesellschaft mit beschränkter Haftung\nBerlin\n\nZu Eintragungsnummer 4 vom 10.07.2025 wird als nicht eingetragen veröffentlicht:Den Gläubigern der an der Verschmelzung beteiligten Rechtsträger ist, wenn sie binnen sechs Monaten nach dem Tag, an dem die Eintragung der Verschmelzung in das Register des Sitzes desjenigen Rechtsträgers, dessen Gläubiger sie sind, als bekannt gemacht gilt, ihren Anspruch nach Grund und Höhe schriftlich anmelden, Sicherheit zu leisten, soweit sie nicht Befriedigung verlangen können. Dieses Recht steht den Gläubigern jedoch nur zu, wenn sie glaubhaft machen, dass durch die Verschmelzung die Erfüllung ihrer Forderung gefährdet wird. Das Recht, Sicherheitsleistung zu verlangen, steht Gläubigern nicht zu, die im Falle der Insolvenz ein Recht auf vorzugsweise Befriedigung aus einer Deckungsmasse haben, die nach gesetzlicher Vorschrift zu ihrem Schutz errichtet und staatlich überwacht ist."
    },
    {
      "date": "2025-07-11",
      "id": "115534",
      "original_text": "Registerbekanntmachung nach dem Umwandlungsgesetz\nBaden-Württemberg Amtsgericht Stuttgart HRA 105009\nSchwarz Corporate Solutions KG – Neckarsulm",
      "type": "Registerbekanntmachung nach dem Umwandlungsgesetz",
      "state": "Baden-Württemberg",
      "amtsgericht": "Amtsgericht Stuttgart",
      "registernummer": "HRA 105009",
      "registerart": "HRA",
      "company_name": "Schwarz Corporate Solutions KG",
      "company_seat": "Neckarsulm",
      "details": "11.07.2025 (Bekanntmachungsdatum)\n\nBaden-Württemberg Amtsgericht Stuttgart HRA 105009\nRegisterbekanntmachung nach dem Umwandlungsgesetz 11.07.2025 (Eintragungsdatum)\n\nSchwarz Corporate Solutions KG\nKommanditgesellschaft\nNeckarsulm\n\nDen Gläubigern der an der Abspaltung beteiligten Rechtsträger ist, wenn sie binnen sechs Monaten nach dem Tag, an dem die Eintragung der Abspaltung in das Register des Sitzes desjenigen Rechtsträgers, dessen Gläubiger sie sind, nach § 19 Abs. 3 UmwG als bekanntgemacht gilt, ihren Anspruch nach Grund und Höhe schriftlich anmelden, Sicherheit zu leisten, soweit sie nicht Befriedigung verlangen können. Dieses Recht steht den Gläubigern jedoch nur zu, wenn sie glaubhaft machen, dass durch die Abspaltung die Erfüllung ihrer Forderung gefährdet wird."
    },
    {
      "date": "2025-07-11",
      "id": "115535",
      "original_text": "Registerbekanntmachung nach dem Umwandlungsgesetz\nBaden-Württemberg Amtsgericht Stuttgart HRA 740636\nSchwarz Digits Beteiligung GmbH & Co. KG – Neckarsulm",
      "type": "Registerbekanntmachung nach dem Umwandlungsgesetz",
      "state": "Baden-Württemberg",
      "amtsgericht": "Amtsgericht Stuttgart",
      "registernummer": "HRA 740636",
      "registerart": "HRA",
      "company_name": "Schwarz Digits Beteiligung GmbH & Co. KG",
      "company_seat": "Neckarsulm",
      "details": "11.07.2025 (Bekanntmachungsdatum)\n\nBaden-Württemberg Amtsgericht Stuttgart HRA 740636\nRegisterbekanntmachung nach dem Umwandlungsgesetz 11.07.2025 (Eintragungsdatum)\n\nSchwarz Digits Beteiligung GmbH & Co. KG\nKommanditgesellschaft\nNeckarsulm\n\nDen Gläubigern der an der Abspaltung beteiligten Rechtsträger ist, wenn sie binnen sechs Monaten nach dem Tag, an dem die Eintragung der Abspaltung in das Register des Sitzes desjenigen Rechtsträgers, dessen Gläubiger sie sind, nach § 19 Abs. 3 UmwG als bekanntgemacht gilt, ihren Anspruch nach Grund und Höhe schriftlich anmelden, Sicherheit zu leisten, soweit sie nicht Befriedigung verlangen können. Dieses Recht steht den Gläubigern jedoch nur zu, wenn sie glaubhaft machen, dass durch die Abspaltung die Erfüllung ihrer Forderung gefährdet wird."
    },
    {
      "date": "2025-07-11",
      "id": "115536",
      "original_text": "Registerbekanntmachung nach dem Umwandlungsgesetz\nBerlin Amtsgericht Berlin (Charlottenburg) HRB 212779\nTrisor GmbH – Berlin",
      "type": "Registerbekanntmachung nach dem Umwandlungsgesetz",
      "state": "Berlin",
      "amtsgericht": "Amtsgericht Berlin (Charlottenburg)",
      "registernummer": "HRB 212779",
      "registerart": "HRB",
      "company_name": "Trisor GmbH",
      "company_seat": "Berlin",
      "details": "11.07.2025 (Bekanntmachungsdatum)\n\nBerlin Amtsgericht Berlin (Charlottenburg) HRB 212779\nRegisterbekanntmachung nach dem Umwandlungsgesetz 10.07.2025 (Eintragungsdatum)\n\nTrisor GmbH\nGesellschaft mit beschränkter Haftung\nBerlin\n\nZu Eintragungsnummer 13 vom 10.07.2025 wird als nicht eingetragen veröffentlicht: Den Gläubigern der an der Spaltung beteiligten Rechtsträger ist, wenn sie binnen sechs Monaten nach dem Tag, an dem die Eintragung der Spaltung in das Register des Sitzes desjenigen Rechtsträgers, dessen Gläubiger sie sind, als bekannt gemacht gilt, ihren Anspruch nach Grund und Höhe schriftlich anmelden, Sicherheit zu leisten, soweit sie nicht Befriedigung verlangen können. Dieses Recht steht den Gläubigern jedoch nur zu, wenn sie glaubhaft machen, dass durch die Spaltung die Erfüllung ihrer Forderung gefährdet wird. Das Recht, Sicherheitsleistung zu verlangen, steht Gläubigern nicht zu, die im Falle der Insolvenz ein Recht auf vorzugsweise Befriedigung aus einer Deckungsmasse haben, die nach gesetzlicher Vorschrift zu ihrem Schutz errichtet und staatlich überwacht ist."
    },
    {
      "date": "2025-07-11",
      "id": "115537",
      "original_text": "Registerbekanntmachung nach dem Umwandlungsgesetz\nHamburg Amtsgericht Hamburg HRB 70777\nQuantum Immobilien Aktiengesellschaft – Hamburg",
      "type": "Registerbekanntmachung nach dem Umwandlungsgesetz",
      "state": "Hamburg",
      "amtsgericht": "Amtsgericht Hamburg",
      "registernummer": "HRB 70777",
      "registerart": "HRB",
      "company_name": "Quantum Immobilien Aktiengesellschaft",
      "company_seat": "Hamburg",
      "details": "11.07.2025 (Bekanntmachungsdatum)\n\nHamburg Amtsgericht Hamburg HRB 70777\nRegisterbekanntmachung nach dem Umwandlungsgesetz 11.07.2025 (Eintragungsdatum)\n\nQuantum Immobilien Aktiengesellschaft\nAktiengesellschaft\nHamburg\n\nAls nicht eingetragen wird bekannt gemacht:\nDen Gläubigern der an der Verschmelzung beteiligten Gesellschaften ist, wenn sie binnen sechs Monaten nach dem Tag, an dem die Eintragung der Verschmelzung in das Register des Sitzes derjenigen Rechtsträger deren Gläubiger sie sind, nach § 19 Absatz 3 UmwG als bekannt gemacht gilt, ihren Anspruch nach Grund und Höhe schriftlich anmelden, Sicherheit zu leisten, soweit sie nicht Befriedigung verlangen können. Dieses Recht steht den Gläubigern jedoch nur zu, wenn sie glaubhaft machen, dass durch die Verschmelzung die Erfüllung ihrer Forderung gefährdet wird."
    },
    {
      "date": "2025-07-11",
      "id": "115538",
      "original_text": "Registerbekanntmachung nach dem Umwandlungsgesetz\nHamburg Amtsgericht Hamburg HRB 186483\nCCN Projektgesellschaft mbH – Hamburg",
      "type": "Registerbekanntmachung nach dem Umwandlungsgesetz",
      "state": "Hamburg",
      "amtsgericht": "Amtsgericht Hamburg",
      "registernummer": "HRB 186483",
      "registerart": "HRB",
      "company_name": "CCN Projektgesellschaft mbH",
      "company_seat": "Hamburg",
      "details": "11.07.2025 (Bekanntmachungsdatum)\n\nHamburg Amtsgericht Hamburg HRB 186483\nRegisterbekanntmachung nach dem Umwandlungsgesetz 11.07.2025 (Eintragungsdatum)\n\nCCN Projektgesellschaft mbH\nGesellschaft mit beschränkter Haftung\nHamburg\n\nAls nicht eingetragen wird bekannt gemacht:\nDen Gläubigern der an der Verschmelzung beteiligten Gesellschaften ist, wenn sie binnen sechs Monaten nach dem Tag, an dem die Eintragung der Verschmelzung in das Register des Sitzes desjenigen Rechtsträgers, dessen Gläubiger sie sind, nach § 19 Absatz 3 UmwG als bekannt gemacht gilt, ihren Anspruch nach Grund und Höhe schriftlich anmelden, Sicherheit zu leisten, soweit sie nicht Befriedigung verlangen können. Dieses Recht steht den Gläubigern jedoch nur zu, wenn sie glaubhaft machen, dass durch die Verschmelzung die Erfüllung ihrer Forderung gefährdet wird."
    },
    {
      "date": "2025-07-11",
      "id": "115539",
      "original_text": "Registerbekanntmachung nach dem Umwandlungsgesetz\nHamburg Amtsgericht Hamburg HRB 186816\nEH-Campus Neubau GmbH – Hamburg",
      "type": "Registerbekanntmachung nach dem Umwandlungsgesetz",
      "state": "Hamburg",
      "amtsgericht": "Amtsgericht Hamburg",
      "registernummer": "HRB 186816",
      "registerart": "HRB",
      "company_name": "EH-Campus Neubau GmbH",
      "company_seat": "Hamburg",
      "details": "11.07.2025 (Bekanntmachungsdatum)\n\nHamburg Amtsgericht Hamburg HRB 186816\nRegisterbekanntmachung nach dem Umwandlungsgesetz 11.07.2025 (Eintragungsdatum)\n\nEH-Campus Neubau GmbH\nGesellschaft mit beschränkter Haftung\nHamburg\n\nAls nicht eingetragen wird bekannt gemacht:\nDen Gläubigern der an der Verschmelzung beteiligten Gesellschaften ist, wenn sie binnen sechs Monaten nach dem Tag, an dem die Eintragung der Verschmelzung in das Register des Sitzes desjenigen Rechtsträgers, dessen Gläubiger sie sind, nach § 19 Absatz 3 UmwG als bekannt gemacht gilt, ihren Anspruch nach Grund und Höhe schriftlich anmelden, Sicherheit zu leisten, soweit sie nicht Befriedigung verlangen können. Dieses Recht steht den Gläubigern jedoch nur zu, wenn sie glaubhaft machen, dass durch die Verschmelzung die Erfüllung ihrer Forderung gefährdet wird."
    },
    {
      "date": "2025-07-11",
      "id": "115540",
      "original_text": "Registerbekanntmachung nach dem Umwandlungsgesetz\nHamburg Amtsgericht Hamburg HRB 62888\nVerwaltung MS \"E. R. SANTIAGO\" Schiffahrtsgesellschaft mbH – Hamburg",
      "type": "Registerbekanntmachung nach dem Umwandlungsgesetz",
      "state": "Hamburg",
      "amtsgericht": "Amtsgericht Hamburg",
      "registernummer": "HRB 62888",
      "registerart": "HRB",
      "company_name": "Verwaltung MS \"E. R. SANTIAGO\" Schiffahrtsgesellschaft mbH",
      "company_seat": "Hamburg",
      "details": "11.07.2025 (Bekanntmachungsdatum)\n\nHamburg Amtsgericht Hamburg HRB 62888\nRegisterbekanntmachung nach dem Umwandlungsgesetz 10.07.2025 (Eintragungsdatum)\n\nVerwaltung MS \"E. R. SANTIAGO\" Schiffahrtsgesellschaft mbH\nGesellschaft mit beschränkter Haftung\nHamburg\n\nAls nicht eingetragen wird bekannt gemacht:\nDen Gläubigern der an der Verschmelzung beteiligten Gesellschaften ist, wenn sie binnen sechs Monaten nach dem Tag, an dem die Eintragung der Verschmelzung in das Register des Sitzes desjenigen Rechtsträgers, dessen Gläubiger sie sind, nach § 19 Absatz 3 UmwG als bekannt gemacht gilt, ihren Anspruch nach Grund und Höhe schriftlich anmelden, Sicherheit zu leisten, soweit sie nicht Befriedigung verlangen können. Dieses Recht steht den Gläubigern jedoch nur zu, wenn sie glaubhaft machen, dass durch die Verschmelzung die Erfüllung ihrer Forderung gefährdet wird."
    },
    {
      "date": "2025-07-11",
      "id": "115541",
      "original_text": "Sonstige Registerbekanntmachung\nSchleswig-Holstein Amtsgericht Lübeck GnR 275\nBalticap Holding eG – Fehmarn",
      "type": "Sonstige Registerbekanntmachung",
      "state": "Schleswig-Holstein",
      "amtsgericht": "Amtsgericht Lübeck",
      "registernummer": "GnR 275",
      "registerart": "GnR",
      "company_name": "Balticap Holding eG",
      "company_seat": "Fehmarn",
      "details": "11.07.2025 (Bekanntmachungsdatum)\n\nSchleswig-Holstein Amtsgericht Lübeck GnR 275\nSonstige Registerbekanntmachung\n\nBalticap Holding eG\neingetragene Genossenschaft\nFehmarn\n\nAls nicht eingetragen wird veröffentlicht: Die Geschäftsanschrift lautet: Meiereikoppel 8, 23769 Fehmarn."
    },
    {
      "date": "2025-07-11",
      "id": "115542",
      "original_text": "Registerbekanntmachung nach dem Umwandlungsgesetz\nHamburg Amtsgericht Hamburg HRB 165412\nKorrektorius Management UG (haftungsbeschränkt) – Hamburg",
      "type": "Registerbekanntmachung nach dem Umwandlungsgesetz",
      "state": "Hamburg",
      "amtsgericht": "Amtsgericht Hamburg",
      "registernummer": "HRB 165412",
      "registerart": "HRB",
      "company_name": "Korrektorius Management UG (haftungsbeschränkt)",
      "company_seat": "Hamburg",
      "details": "11.07.2025 (Bekanntmachungsdatum)\n\nHamburg Amtsgericht Hamburg HRB 165412\nRegisterbekanntmachung nach dem Umwandlungsgesetz 11.07.2025 (Eintragungsdatum)\n\nKorrektorius Management UG (haftungsbeschränkt)\nGesellschaft mit beschränkter Haftung\nHamburg\n\nAls nicht eingetragen wird bekannt gemacht:\nDen Gläubigern der an der Verschmelzung beteiligten Gesellschaften ist, wenn sie binnen sechs Monaten nach dem Tag, an dem die Eintragung der Verschmelzung in das Register des Sitzes desjenigen Rechtsträgers, dessen Gläubiger sie sind, nach § 19 Absatz 3 UmwG als bekannt gemacht gilt, ihren Anspruch nach Grund und Höhe schriftlich anmelden, Sicherheit zu leisten, soweit sie nicht Befriedigung verlangen können. Dieses Recht steht den Gläubigern jedoch nur zu, wenn sie glaubhaft machen, dass durch die Verschmelzung die Erfüllung ihrer Forderung gefährdet wird."
    },
    {
      "date": "2025-07-11",
      "id": "115543",
      "original_text": "Registerbekanntmachung nach dem Umwandlungsgesetz\nHamburg Amtsgericht Hamburg HRA 132560\nLektorat Korrektorius Lars Dohrmann e.K. – Hamburg",
      "type": "Registerbekanntmachung nach dem Umwandlungsgesetz",
      "state": "Hamburg",
      "amtsgericht": "Amtsgericht Hamburg",
      "registernummer": "HRA 132560",
      "registerart": "HRA",
      "company_name": "Lektorat Korrektorius Lars Dohrmann e.K.",
      "company_seat": "Hamburg",
      "details": "11.07.2025 (Bekanntmachungsdatum)\n\nHamburg Amtsgericht Hamburg HRA 132560\nRegisterbekanntmachung nach dem Umwandlungsgesetz 11.07.2025 (Eintragungsdatum)\n\nLektorat Korrektorius Lars Dohrmann e.K.\nEinzelkaufmann\nHamburg\n\nAls nicht eingetragen wird bekannt gemacht:\nDen Gläubigern der an der Verschmelzung beteiligten Gesellschaften ist, wenn sie binnen sechs Monaten nach dem Tag, an dem die Eintragung der Verschmelzung in das Register des Sitzes desjenigen Rechtsträgers, dessen Gläubiger sie sind, nach § 19 Absatz 3 UmwG als bekannt gemacht gilt, ihren Anspruch nach Grund und Höhe schriftlich anmelden, Sicherheit zu leisten, soweit sie nicht Befriedigung verlangen können. Dieses Recht steht den Gläubigern jedoch nur zu, wenn sie glaubhaft machen, dass durch die Verschmelzung die Erfüllung ihrer Forderung gefährdet wird."
    },
    {
      "date": "2025-07-11",
      "id": "115544",
      "original_text": "Registerbekanntmachung nach dem Umwandlungsgesetz\nHamburg Amtsgericht Hamburg HRB 25938\nvon Rauchhaupt & Senftleben GmbH – Hamburg",
      "type": "Registerbekanntmachung nach dem Umwandlungsgesetz",
      "state": "Hamburg",
      "amtsgericht": "Amtsgericht Hamburg",
      "registernummer": "HRB 25938",
      "registerart": "HRB",
      "company_name": "von Rauchhaupt & Senftleben GmbH",
      "company_seat": "Hamburg",
      "details": "11.07.2025 (Bekanntmachungsdatum)\n\nHamburg Amtsgericht Hamburg HRB 25938\nRegisterbekanntmachung nach dem Umwandlungsgesetz 11.07.2025 (Eintragungsdatum)\n\nvon Rauchhaupt & Senftleben GmbH\nGesellschaft mit beschränkter Haftung\nHamburg\n\nAls nicht eingetragen wird bekannt gemacht:\nDen Gläubigern der an der Verschmelzung beteiligten Gesellschaften ist, wenn sie binnen sechs Monaten nach dem Tag, an dem die Eintragung der Verschmelzung in das Register des Sitzes desjenigen Rechtsträgers, dessen Gläubiger sie sind, nach § 19 Absatz 3 UmwG als bekannt gemacht gilt, ihren Anspruch nach Grund und Höhe schriftlich anmelden, Sicherheit zu leisten, soweit sie nicht Befriedigung verlangen können. Dieses Recht steht den Gläubigern jedoch nur zu, wenn sie glaubhaft machen, dass durch die Verschmelzung die Erfüllung ihrer Forderung gefährdet wird."
    },
    {
      "date": "2025-07-11",
      "id": "115545",
      "original_text": "Registerbekanntmachung nach dem Umwandlungsgesetz\nHamburg Amtsgericht Hamburg HRB 31245\nWolf-Eckart Kern Verwaltungsgesellschaft mbH – Hamburg",
      "type": "Registerbekanntmachung nach dem Umwandlungsgesetz",
      "state": "Hamburg",
      "amtsgericht": "Amtsgericht Hamburg",
      "registernummer": "HRB 31245",
      "registerart": "HRB",
      "company_name": "Wolf-Eckart Kern Verwaltungsgesellschaft mbH",
      "company_seat": "Hamburg",
      "details": "11.07.2025 (Bekanntmachungsdatum)\n\nHamburg Amtsgericht Hamburg HRB 31245\nRegisterbekanntmachung nach dem Umwandlungsgesetz 11.07.2025 (Eintragungsdatum)\n\nWolf-Eckart Kern Verwaltungsgesellschaft mbH\nGesellschaft mit beschränkter Haftung\nHamburg\n\nAls nicht eingetragen wird bekannt gemacht:\nDen Gläubigern der an der Verschmelzung beteiligten Gesellschaften ist, wenn sie binnen sechs Monaten nach dem Tag, an dem die Eintragung der Verschmelzung in das Register des Sitzes desjenigen Rechtsträgers, dessen Gläubiger sie sind, nach § 19 Absatz 3 UmwG als bekannt gemacht gilt, ihren Anspruch nach Grund und Höhe schriftlich anmelden, Sicherheit zu leisten, soweit sie nicht Befriedigung verlangen können. Dieses Recht steht den Gläubigern jedoch nur zu, wenn sie glaubhaft machen, dass durch die Verschmelzung die Erfüllung ihrer Forderung gefährdet wird."
    },
    {
      "date": "2025-07-11",
      "id": "115546",
      "original_text": "Sonstige Registerbekanntmachung\nBrandenburg Amtsgericht Frankfurt/Oder HRB 16399\nABASA Gesundheitssport UG (haftungsbeschränkt) – Eisenhüttenstadt",
      "type": "Sonstige Registerbekanntmachung",
      "state": "Brandenburg",
      "amtsgericht": "Amtsgericht Frankfurt/Oder",
      "registernummer": "HRB 16399",
      "registerart": "HRB",
      "company_name": "ABASA Gesundheitssport UG (haftungsbeschränkt)",
      "company_seat": "Eisenhüttenstadt",
      "details": "11.07.2025 (Bekanntmachungsdatum)\n\nBrandenburg Amtsgericht Frankfurt/Oder HRB 16399\nSonstige Registerbekanntmachung 10.07.2025 (Eintragungsdatum)\n\nABASA Gesundheitssport UG (haftungsbeschränkt)\nGesellschaft mit beschränkter Haftung\nEisenhüttenstadt\n\nAls nicht eingetragen wird veröffentlicht:\nDen Gläubigern der an der Verschmelzung beteiligten Rechtsträger ist, wenn sie binnen sechs Monaten nach dem Tag, an dem die Eintragung der Verschmelzung in das Register des Sitzes desjenigen Rechtsträgers, dessen Gläubiger sie sind, als bekannt gemacht gilt, ihren Anspruch nach Grund und Höhe schriftlich anmelden, Sicherheit zu leisten, soweit sie nicht Befriedigung verlangen können. Dieses Recht steht den Gläubigern jedoch nur zu, wenn sie glaubhaft machen, dass durch die Verschmelzung die Erfüllung ihrer Forderung gefährdet wird"
    },
    {
      "date": "2025-07-11",
      "id": "115547",
      "original_text": "Löschungsankündigung\nSchleswig-Holstein Amtsgericht Lübeck HRB 23614\nMB Verputzer GmbH – Lübeck",
      "type": "Löschungsankündigung",
      "state": "Schleswig-Holstein",
      "amtsgericht": "Amtsgericht Lübeck",
      "registernummer": "HRB 23614",
      "registerart": "HRB",
      "company_name": "MB Verputzer GmbH",
      "company_seat": "Lübeck",
      "details": "11.07.2025 (Bekanntmachungsdatum)\n\nSchleswig-Holstein Amtsgericht Lübeck HRB 23614\nLöschungsankündigung\n\nMB Verputzer GmbH\nGesellschaft mit beschränkter Haftung\nLübeck\n\nAn Frau Linda Bruhn\n- per Veröffentlichung -\n\nSehr geehrte Frau Bruhn,\n\nin der Handelsregistersache der\nMB Verputzer GmbH\n\nergeben sich aus den mir vorliegenden Unterlagen Anhaltspunkte dafür, dass die Gesellschaft, als deren Geschäftsführerin Sie noch eingetragen sind, vermögenslos ist.\n\nEs ist daher beabsichtigt, die Gesellschaft wegen Vermögenslosigkeit gemäß § 394 FamFG zu löschen.\n\nEs wird eine Frist von drei Monaten zur Geltendmachung eines Widerspruchs gegen die Löschung, § 394 Abs. 2 S. 1 FamFG bestimmt.\n\nWeiter bitte ich Sie, mir binnen derselben Frist mitzuteilen, ob die genannte Gesellschaft noch Vermögen hat, ggf. welche Vermögensgegenstände sie besitzt, ob die Gesellschaft noch Partei eines noch nicht rechtskräftig abgeschlossenen Rechtsstreits ist oder ob sonst noch eine Abwicklung stattfindet.\n\nNach Fristablauf ohne Widerspruch von Ihnen oder anderer Seite wird die Gesellschaft gelöscht.\n\nMit freundlichen Grüßen\n\nSchuppenhauer\nDipl.-Rechtspflegerin (FH)"
    },
    {
      "date": "2025-07-11",
      "id": "115548",
      "original_text": "Registerbekanntmachung nach dem Umwandlungsgesetz\nHamburg Amtsgericht Hamburg HRB 177725\nMetatravel Service GmbH – Hamburg",
      "type": "Registerbekanntmachung nach dem Umwandlungsgesetz",
      "state": "Hamburg",
      "amtsgericht": "Amtsgericht Hamburg",
      "registernummer": "HRB 177725",
      "registerart": "HRB",
      "company_name": "Metatravel Service GmbH",
      "company_seat": "Hamburg",
      "details": "11.07.2025 (Bekanntmachungsdatum)\n\nHamburg Amtsgericht Hamburg HRB 177725\nRegisterbekanntmachung nach dem Umwandlungsgesetz 11.07.2025 (Eintragungsdatum)\n\nMetatravel Service GmbH\nGesellschaft mit beschränkter Haftung\nHamburg\n\nAls nicht eingetragen wird bekannt gemacht:\nDen Gläubigern der an der Verschmelzung beteiligten Gesellschaften ist, wenn sie binnen sechs Monaten nach dem Tag, an dem die Eintragung der Verschmelzung in das Register des Sitzes desjenigen Rechtsträgers, dessen Gläubiger sie sind, nach § 19 Absatz 3 UmwG als bekannt gemacht gilt, ihren Anspruch nach Grund und Höhe schriftlich anmelden, Sicherheit zu leisten, soweit sie nicht Befriedigung verlangen können. Dieses Recht steht den Gläubigern jedoch nur zu, wenn sie glaubhaft machen, dass durch die Verschmelzung die Erfüllung ihrer Forderung gefährdet wird."
    },
    {
      "date": "2025-07-11",
      "id": "115549",
      "original_text": "Registerbekanntmachung nach dem Umwandlungsgesetz\nHamburg Amtsgericht Hamburg HRB 170305\nMetatravel Deutschland GmbH – Hamburg",
      "type": "Registerbekanntmachung nach dem Umwandlungsgesetz",
      "state": "Hamburg",
      "amtsgericht": "Amtsgericht Hamburg",
      "registernummer": "HRB 170305",
      "registerart": "HRB",
      "company_name": "Metatravel Deutschland GmbH",
      "company_seat": "Hamburg",
      "details": "11.07.2025 (Bekanntmachungsdatum)\n\nHamburg Amtsgericht Hamburg HRB 170305\nRegisterbekanntmachung nach dem Umwandlungsgesetz 11.07.2025 (Eintragungsdatum)\n\nMetatravel Deutschland GmbH\nGesellschaft mit beschränkter Haftung\nHamburg\n\nAls nicht eingetragen wird bekannt gemacht:\nDen Gläubigern der an der Verschmelzung beteiligten Gesellschaften ist, wenn sie binnen sechs Monaten nach dem Tag, an dem die Eintragung der Verschmelzung in das Register des Sitzes desjenigen Rechtsträgers, dessen Gläubiger sie sind, nach § 19 Absatz 3 UmwG als bekannt gemacht gilt, ihren Anspruch nach Grund und Höhe schriftlich anmelden, Sicherheit zu leisten, soweit sie nicht Befriedigung verlangen können. Dieses Recht steht den Gläubigern jedoch nur zu, wenn sie glaubhaft machen, dass durch die Verschmelzung die Erfüllung ihrer Forderung gefährdet wird."
    },
    {
      "date": "2025-07-11",
      "id": "115550",
      "original_text": "Registerbekanntmachung nach dem Umwandlungsgesetz\nBaden-Württemberg Amtsgericht Freiburg HRB 721299\ne.optimum Energieconsulting GmbH – Offenburg",
      "type": "Registerbekanntmachung nach dem Umwandlungsgesetz",
      "state": "Baden-Württemberg",
      "amtsgericht": "Amtsgericht Freiburg",
      "registernummer": "HRB 721299",
      "registerart": "HRB",
      "company_name": "e.optimum Energieconsulting GmbH",
      "company_seat": "Offenburg",
      "details": "11.07.2025 (Bekanntmachungsdatum)\n\nBaden-Württemberg Amtsgericht Freiburg HRB 721299\nRegisterbekanntmachung nach dem Umwandlungsgesetz 11.07.2025 (Eintragungsdatum)\n\ne.optimum Energieconsulting GmbH\nGesellschaft mit beschränkter Haftung\nOffenburg\n\nDen Gläubigern der an der Verschmelzung beteiligten Rechtsträger (\"e.optimum Energieconsulting GmbH\", Offenburg, Amtsgericht Freiburg i. Br. HRB 721299 und \"e.optimum Energie GmbH\", Offenburg (Amtsgericht Freiburg i. Br. HRB 725727) ist, wenn sie binnen sechs Monaten nach dem Tag, an dem die Eintragung der Verschmelzung in das Register des Sitzes desjenigen Rechtsträgers, dessen Gläubiger sie sind, nach § 19 Abs. 3 UmwG als bekanntgemacht gilt, ihren Anspruch nach Grund und Höhe schriftlich anmelden, Sicherheit zu leisten, soweit sie nicht Befriedigung verlangen können. Dieses Recht steht den Gläubigern jedoch nur zu, wenn sie glaubhaft machen, dass durch die Verschmelzung die Erfüllung ihrer Forderung gefährdet wird."
    },
    {
      "date": "2025-07-11",
      "id": "115551",
      "original_text": "Registerbekanntmachung nach dem Umwandlungsgesetz\nBaden-Württemberg Amtsgericht Stuttgart HRB 481316\nStraub Druck + Medien Aktiengesellschaft – Schramberg",
      "type": "Registerbekanntmachung nach dem Umwandlungsgesetz",
      "state": "Baden-Württemberg",
      "amtsgericht": "Amtsgericht Stuttgart",
      "registernummer": "HRB 481316",
      "registerart": "HRB",
      "company_name": "Straub Druck + Medien Aktiengesellschaft",
      "company_seat": "Schramberg",
      "details": "11.07.2025 (Bekanntmachungsdatum)\n\nBaden-Württemberg Amtsgericht Stuttgart HRB 481316\nRegisterbekanntmachung nach dem Umwandlungsgesetz 11.07.2025 (Eintragungsdatum)\n\nStraub Druck + Medien Aktiengesellschaft\nAktiengesellschaft\nSchramberg\n\nAls nicht eingetragen wird bekanntgemacht:\nDen Gläubigern des an dem Formwechsel beteiligten Rechtsträgers ist, wenn sie binnen sechs Monaten nach dem Tag, an dem die Eintragung des Formwechsels in das Register des Sitzes desjenigen Rechtsträgers, dessen Gläubiger sie sind, nach § 19 Abs. 3 UmwG als bekanntgemacht gilt, ihren Anspruch nach Grund und Höhe schriftlich anmelden, Sicherheit zu leisten, soweit sie nicht Befriedigung verlangen können. Dieses Recht steht den Gläubigern jedoch nur zu, wenn sie glaubhaft machen, dass durch den Formwechsel die Erfüllung ihrer Forderung gefährdet wird."
    },
    {
      "date": "2025-07-11",
      "id": "115552",
      "original_text": "Registerbekanntmachung nach dem Umwandlungsgesetz\nBaden-Württemberg Amtsgericht Stuttgart HRB 800666\nStraub Druck+ Medien GmbH – Schramberg",
      "type": "Registerbekanntmachung nach dem Umwandlungsgesetz",
      "state": "Baden-Württemberg",
      "amtsgericht": "Amtsgericht Stuttgart",
      "registernummer": "HRB 800666",
      "registerart": "HRB",
      "company_name": "Straub Druck+ Medien GmbH",
      "company_seat": "Schramberg",
      "details": "11.07.2025 (Bekanntmachungsdatum)\n\nBaden-Württemberg Amtsgericht Stuttgart HRB 800666\nRegisterbekanntmachung nach dem Umwandlungsgesetz 11.07.2025 (Eintragungsdatum)\n\nStraub Druck+ Medien GmbH\nGesellschaft mit beschränkter Haftung\nSchramberg\n\nAls nicht eingetragen wird bekanntgemacht:\nDen Gläubigern des an dem Formwechsel beteiligten Rechtsträgers ist, wenn sie binnen sechs Monaten nach dem Tag, an dem die Eintragung des Formwechsels in das Register des Sitzes desjenigen Rechtsträgers, dessen Gläubiger sie sind, nach § 19 Abs. 3 UmwG als bekanntgemacht gilt, ihren Anspruch nach Grund und Höhe schriftlich anmelden, Sicherheit zu leisten, soweit sie nicht Befriedigung verlangen können. Dieses Recht steht den Gläubigern jedoch nur zu, wenn sie glaubhaft machen, dass durch den Formwechsel die Erfüllung ihrer Forderung gefährdet wird."
    },
    {
      "date": "2025-07-11",
      "id": "115553",
      "original_text": "Löschungsankündigung\nSachsen Amtsgericht Leipzig VR 5983\nKindersportzentrum Neuseenland e.V. – Böhlen",
      "type": "Löschungsankündigung",
      "state": "Sachsen",
      "amtsgericht": "Amtsgericht Leipzig",
      "registernummer": "VR 5983",
      "registerart": "VR",
      "company_name": "Kindersportzentrum Neuseenland e.V.",
      "company_seat": "Böhlen",
      "details": "11.07.2025 (Bekanntmachungsdatum)\n\nSachsen Amtsgericht Leipzig VR 5983\nLöschungsankündigung\n\nKindersportzentrum Neuseenland e.V.\neingetragener Verein\nBöhlen\n\nDas Gericht beabsichtigt, gemäß § 4 Absatz 2 Ziffer 1 der Verordnung über das Vereinsregister das Registerblatt  des Vereins zu schließen, da nach Mitteilung des bisherigen Vorstandes sämtliche Mitglieder aus dem Verein ausgeschieden sind. Zur Geltendmachung eines Widerspruchs gegen die beabsichtigte Schließung wird eine Frist von einem Monat nach der Veröffentlichung bestimmt."
    },
    {
      "date": "2025-07-11",
      "id": "115554",
      "original_text": "Registerbekanntmachung nach dem Umwandlungsgesetz\nSachsen Amtsgericht Chemnitz HRB 17262\nINFRAPLAN INGENIEURE GmbH – Burgstädt",
      "type": "Registerbekanntmachung nach dem Umwandlungsgesetz",
      "state": "Sachsen",
      "amtsgericht": "Amtsgericht Chemnitz",
      "registernummer": "HRB 17262",
      "registerart": "HRB",
      "company_name": "INFRAPLAN INGENIEURE GmbH",
      "company_seat": "Burgstädt",
      "details": "11.07.2025 (Bekanntmachungsdatum)\n\nSachsen Amtsgericht Chemnitz HRB 17262\nRegisterbekanntmachung nach dem Umwandlungsgesetz 11.07.2025 (Eintragungsdatum)\n\nINFRAPLAN INGENIEURE GmbH\nGesellschaft mit beschränkter Haftung\nBurgstädt\n\nDen Gläubigern der an der Verschmelzung beteiligten Rechtsträger ist, wenn sie binnen sechs Monaten nach dem Tag, an dem die Eintragung der Verschmelzung in das Register des Sitzes desjenigen Rechtsträgers, dessen Gläubiger sie sind, nach § 19 Abs. 3 UmwG als bekannt gemacht gilt, ihren Anspruch nach Grund und Höhe in Textform anmelden, Sicherheit zu leisten, soweit sie nicht Befriedigung verlangen können. Dieses Recht steht den Gläubigern jedoch nur zu, wenn sie glaubhaft machen, dass durch die Verschmelzung die Erfüllung der Forderung gefährdet wird."
    },
    {
      "date": "2025-07-11",
      "id": "115555",
      "original_text": "Registerbekanntmachung nach dem Umwandlungsgesetz\nSachsen Amtsgericht Leipzig HRB 32055\nSTERNAUTO GmbH – Leipzig",
      "type": "Registerbekanntmachung nach dem Umwandlungsgesetz",
      "state": "Sachsen",
      "amtsgericht": "Amtsgericht Leipzig",
      "registernummer": "HRB 32055",
      "registerart": "HRB",
      "company_name": "STERNAUTO GmbH",
      "company_seat": "Leipzig",
      "details": "11.07.2025 (Bekanntmachungsdatum)\n\nSachsen Amtsgericht Leipzig HRB 32055\nRegisterbekanntmachung nach dem Umwandlungsgesetz 11.07.2025 (Eintragungsdatum)\n\nSTERNAUTO GmbH\nGesellschaft mit beschränkter Haftung\nLeipzig\n\nDen Gläubigern der an der Verschmelzung beteiligten Rechtsträger ist, wenn sie binnen sechs Monaten nach dem Tag, an dem die Eintragung der Verschmelzung in das Register des Sitzes desjenigen Rechtsträgers, dessen Gläubiger sie sind, nach § 19 Abs. 3 UmwG als bekannt gemacht gilt, ihren Anspruch nach Grund und Höhe in Textform anmelden, Sicherheit zu leisten, soweit sie nicht Befriedigung verlangen können. Dieses Recht steht den Gläubigern jedoch nur zu, wenn sie glaubhaft machen, dass durch die Verschmelzung die Erfüllung der Forderung gefährdet wird."
    },
    {
      "date": "2025-07-11",
      "id": "115556",
      "original_text": "Registerbekanntmachung nach dem Umwandlungsgesetz\nSachsen Amtsgericht Leipzig HRB 33386\nMIB Siebzehnte Investitionsgesellschaft mbH – Leipzig",
      "type": "Registerbekanntmachung nach dem Umwandlungsgesetz",
      "state": "Sachsen",
      "amtsgericht": "Amtsgericht Leipzig",
      "registernummer": "HRB 33386",
      "registerart": "HRB",
      "company_name": "MIB Siebzehnte Investitionsgesellschaft mbH",
      "company_seat": "Leipzig",
      "details": "11.07.2025 (Bekanntmachungsdatum)\n\nSachsen Amtsgericht Leipzig HRB 33386\nRegisterbekanntmachung nach dem Umwandlungsgesetz 11.07.2025 (Eintragungsdatum)\n\nMIB Siebzehnte Investitionsgesellschaft mbH\nGesellschaft mit beschränkter Haftung\nLeipzig\n\nDen Gläubigern der an der Verschmelzung beteiligten Rechtsträger ist, wenn sie binnen sechs Monaten nach dem Tag, an dem die Eintragung der Verschmelzung in das Register des Sitzes desjenigen Rechtsträgers, dessen Gläubiger sie sind, nach § 19 Abs. 3 UmwG als bekannt gemacht gilt, ihren Anspruch nach Grund und Höhe in Textform anmelden, Sicherheit zu leisten, soweit sie nicht Befriedigung verlangen können. Dieses Recht steht den Gläubigern jedoch nur zu, wenn sie glaubhaft machen, dass durch die Verschmelzung die Erfüllung der Forderung gefährdet wird."
    },
    {
      "date": "2025-07-11",
      "id": "115557",
      "original_text": "Registerbekanntmachung nach dem Umwandlungsgesetz\nSachsen Amtsgericht Leipzig HRB 25475\nMIB Projektentwicklung GmbH – Leipzig",
      "type": "Registerbekanntmachung nach dem Umwandlungsgesetz",
      "state": "Sachsen",
      "amtsgericht": "Amtsgericht Leipzig",
      "registernummer": "HRB 25475",
      "registerart": "HRB",
      "company_name": "MIB Projektentwicklung GmbH",
      "company_seat": "Leipzig",
      "details": "11.07.2025 (Bekanntmachungsdatum)\n\nSachsen Amtsgericht Leipzig HRB 25475\nRegisterbekanntmachung nach dem Umwandlungsgesetz 11.07.2025 (Eintragungsdatum)\n\nMIB Projektentwicklung GmbH\nGesellschaft mit beschränkter Haftung\nLeipzig\n\nDen Gläubigern der an der Verschmelzung beteiligten Rechtsträger ist, wenn sie binnen sechs Monaten nach dem Tag, an dem die Eintragung der Verschmelzung in das Register des Sitzes desjenigen Rechtsträgers, dessen Gläubiger sie sind, nach § 19 Abs. 3 UmwG als bekannt gemacht gilt, ihren Anspruch nach Grund und Höhe in Textform anmelden, Sicherheit zu leisten, soweit sie nicht Befriedigung verlangen können. Dieses Recht steht den Gläubigern jedoch nur zu, wenn sie glaubhaft machen, dass durch die Verschmelzung die Erfüllung der Forderung gefährdet wird."
    },
    {
      "date": "2025-07-11",
      "id": "115558",
      "original_text": "Registerbekanntmachung nach dem Umwandlungsgesetz\nSachsen Amtsgericht Leipzig HRB 37568\nExklusiv Chemie GmbH – Taucha",
      "type": "Registerbekanntmachung nach dem Umwandlungsgesetz",
      "state": "Sachsen",
      "amtsgericht": "Amtsgericht Leipzig",
      "registernummer": "HRB 37568",
      "registerart": "HRB",
      "company_name": "Exklusiv Chemie GmbH",
      "company_seat": "Taucha",
      "details": "11.07.2025 (Bekanntmachungsdatum)\n\nSachsen Amtsgericht Leipzig HRB 37568\nRegisterbekanntmachung nach dem Umwandlungsgesetz 11.07.2025 (Eintragungsdatum)\n\nExklusiv Chemie GmbH\nGesellschaft mit beschränkter Haftung\nTaucha\n\nDen Gläubigern der an der Ausgliederung beteiligten Rechtsträger ist, wenn sie binnen sechs Monaten nach dem Tag, an dem die Eintragung der Ausgliederung in das Register des Sitzes desjenigen Rechtsträgers, dessen Gläubiger sie sind, nach § 19 Abs. 3 UmwG als bekannt gemacht gilt, ihren Anspruch nach Grund und Höhe in Textform anmelden, Sicherheit zu leisten, soweit sie nicht Befriedigung verlangen können. Dieses Recht steht den Gläubigern jedoch nur zu, wenn sie glaubhaft machen, dass durch die Ausgliederung die Erfüllung der Forderung gefährdet wird."
    },
    {
      "date": "2025-07-11",
      "id": "115559",
      "original_text": "Löschungsankündigung\nNiedersachsen Amtsgericht Braunschweig HRB 206005\nGaLa Vario System GmbH – Wolfenbüttel",
      "type": "Löschungsankündigung",
      "state": "Niedersachsen",
      "amtsgericht": "Amtsgericht Braunschweig",
      "registernummer": "HRB 206005",
      "registerart": "HRB",
      "company_name": "GaLa Vario System GmbH",
      "company_seat": "Wolfenbüttel",
      "details": "11.07.2025 (Bekanntmachungsdatum)\n\nNiedersachsen Amtsgericht Braunschweig HRB 206005\nLöschungsankündigung 11.07.2025 (Eintragungsdatum)\n\nGaLa Vario System GmbH\nGesellschaft mit beschränkter Haftung\nWolfenbüttel\n\nDas Registergericht beabsichtigt, die Gesellschaft von Amts wegen nach § 394 FamFG zu löschen. Die Frist zur Erhebung eines Widerspruchs ist auf 1 Monat ab dieser Registerbekanntmachung festgesetzt."
    },
    {
      "date": "2025-07-11",
      "id": "115560",
      "original_text": "Registerbekanntmachung nach dem Umwandlungsgesetz\nNiedersachsen Amtsgericht Hildesheim HRA 203061\nKalkmann Kontakt-Kunst e.K. – Bad Salzdetfurth",
      "type": "Registerbekanntmachung nach dem Umwandlungsgesetz",
      "state": "Niedersachsen",
      "amtsgericht": "Amtsgericht Hildesheim",
      "registernummer": "HRA 203061",
      "registerart": "HRA",
      "company_name": "Kalkmann Kontakt-Kunst e.K.",
      "company_seat": "Bad Salzdetfurth",
      "details": "11.07.2025 (Bekanntmachungsdatum)\n\nNiedersachsen Amtsgericht Hildesheim HRA 203061\nRegisterbekanntmachung nach dem Umwandlungsgesetz 11.07.2025 (Eintragungsdatum)\n\nKalkmann Kontakt-Kunst e.K.\nEinzelkaufmann / Einzelkauffrau\nBad Salzdetfurth\n\nDen Gläubigern der an der Vermögensübertragung beteiligten Rechtsträger ist, wenn sie binnen sechs Monaten nach dem Tag, an dem die Eintragung der Spaltung in das Register des Sitzes desjenigen Rechtsträgers, dessen Gläubiger sie sind, nach § 19 Abs. 3 UmwG als bekannt gemacht gilt, ihren Anspruch nach Grund und Höhe schriftlich anmelden, Sicherheit zu leisten, soweit sie nicht Befriedigung verlangen können. Dieses Recht steht den Gläubigern jedoch nur zu, wenn sie glaubhaft machen, dass durch die Spaltung die Erfüllung der Forderung gefährdet wird."
    },
    {
      "date": "2025-07-11",
      "id": "115561",
      "original_text": "Einreichung neuer Dokumente\nNiedersachsen Amtsgericht Hannover HRB 120534 früher Amtsgericht Burgwedel\nPioch Verwaltungsgesellschaft mbH – Wedemark",
      "type": "Einreichung neuer Dokumente",
      "state": "Niedersachsen",
      "amtsgericht": "Amtsgericht Hannover",
      "registernummer": "HRB 120534",
      "registerart": "HRB",
      "company_name": "Pioch Verwaltungsgesellschaft mbH",
      "company_seat": "Wedemark",
      "former_amtsgericht": "Burgwedel",
      "details": "11.07.2025 (Bekanntmachungsdatum)\n\nNiedersachsen Amtsgericht Hannover HRB 120534 früher Amtsgericht Burgwedel\nEinreichung neuer Dokumente 11.07.2025 (Eintragungsdatum)\n\nPioch Verwaltungsgesellschaft mbH\nGesellschaft mit beschränkter Haftung\nWedemark\n\nDen Gläubigern der an der Verschmelzung beteiligten Rechtsträger ist, wenn sie binnen sechs Monaten nach dem Tag, an dem die Eintragung der Verschmelzung in das Register des Sitzes desjenigen Rechtsträgers, dessen Gläubiger sie sind, nach § 19  Abs.  3 UmwG als bekannt gemacht gilt, ihren Anspruch nach Grund und Höhe schriftlich anmelden, Sicherheit zu leisten, soweit sie nicht Befriedigung verlangen können. Dieses Recht steht den Gläubigern jedoch nur zu, wenn sie glaubhaft machen, dass durch die Verschmelzung die Erfüllung der Forderung gefährdet wird."
    },
    {
      "date": "2025-07-11",
      "id": "115562",
      "original_text": "Registerbekanntmachung nach dem Umwandlungsgesetz\nNiedersachsen Amtsgericht Göttingen HRB 201435\nLöwer Immobilien Beteiligungsgesellschaft mbH – Götingen",
      "type": "Registerbekanntmachung nach dem Umwandlungsgesetz",
      "state": "Niedersachsen",
      "amtsgericht": "Amtsgericht Göttingen",
      "registernummer": "HRB 201435",
      "registerart": "HRB",
      "company_name": "Löwer Immobilien Beteiligungsgesellschaft mbH",
      "company_seat": "Götingen",
      "details": "11.07.2025 (Bekanntmachungsdatum)\n\nNiedersachsen Amtsgericht Göttingen HRB 201435\nRegisterbekanntmachung nach dem Umwandlungsgesetz 11.07.2025 (Eintragungsdatum)\n\nLöwer Immobilien Beteiligungsgesellschaft mbH\nGesellschaft mit beschränkter Haftung\nGötingen\n\nDen Gläubigern der an der Verschmelzung beteiligten Rechtsträger ist, wenn sie binnen sechs Monaten nach dem Tag, an dem die Eintragung der Verschmelzung in das Register des Sitzes desjenigen Rechtsträgers, dessen Gläubiger sie sind, nach § 19  Abs.  3 UmwG als bekannt gemacht gilt, ihren Anspruch nach Grund und Höhe schriftlich anmelden, Sicherheit zu leisten, soweit sie nicht Befriedigung verlangen können. Dieses Recht steht den Gläubigern jedoch nur zu, wenn sie glaubhaft machen, dass durch die Verschmelzung die Erfüllung der Forderung gefährdet wird."
    },
    {
      "date": "2025-07-11",
      "id": "115563",
      "original_text": "Registerbekanntmachung nach dem Umwandlungsgesetz\nNiedersachsen Amtsgericht Hannover HRA 206099\nGoetze Immobilienberatung e. K. – Hannover",
      "type": "Registerbekanntmachung nach dem Umwandlungsgesetz",
      "state": "Niedersachsen",
      "amtsgericht": "Amtsgericht Hannover",
      "registernummer": "HRA 206099",
      "registerart": "HRA",
      "company_name": "Goetze Immobilienberatung e. K.",
      "company_seat": "Hannover",
      "details": "11.07.2025 (Bekanntmachungsdatum)\n\nNiedersachsen Amtsgericht Hannover HRA 206099\nRegisterbekanntmachung nach dem Umwandlungsgesetz 11.07.2025 (Eintragungsdatum)\n\nGoetze Immobilienberatung e. K.\nEinzelkaufmann / Einzelkauffrau\nHannover\n\nDen Gläubigern der an der Ausgliederung beteiligten Rechtsträger ist, wenn sie binnen sechs Monaten nach dem Tag, an dem die Eintragung der Ausgliederung in das Register des Sitzes desjenigen Rechtsträgers, dessen Gläubiger sie sind, nach § 19 Abs. 3 UmwG als bekannt gemacht gilt, ihren Anspruch nach Grund und Höhe schriftlich anmelden, Sicherheit zu leisten, soweit sie nicht Befriedigung verlangen können. Dieses Recht steht den Gläubigern jedoch nur zu, wenn sie glaubhaft machen, dass durch die Ausgliederung die Erfüllung der Forderung gefährdet wird."
    },
    {
      "date": "2025-07-11",
      "id": "115564",
      "original_text": "Registerbekanntmachung nach dem Umwandlungsgesetz\nNiedersachsen Amtsgericht Göttingen HRA 1939\nDEPPE GmbH & Co. KG – Bad Lauterberg",
      "type": "Registerbekanntmachung nach dem Umwandlungsgesetz",
      "state": "Niedersachsen",
      "amtsgericht": "Amtsgericht Göttingen",
      "registernummer": "HRA 1939",
      "registerart": "HRA",
      "company_name": "DEPPE GmbH & Co. KG",
      "company_seat": "Bad Lauterberg",
      "details": "11.07.2025 (Bekanntmachungsdatum)\n\nNiedersachsen Amtsgericht Göttingen HRA 1939\nRegisterbekanntmachung nach dem Umwandlungsgesetz 11.07.2025 (Eintragungsdatum)\n\nDEPPE GmbH & Co. KG\nKommanditgesellschaft\nBad Lauterberg\n\nDen Gläubigern der an der Verschmelzung beteiligten Rechtsträger ist, wenn sie binnen sechs Monaten nach dem Tag, an dem die Eintragung der Verschmelzung in das Register des Sitzes desjenigen Rechtsträgers, dessen Gläubiger sie sind, nach § 19  Abs.  3 UmwG als bekannt gemacht gilt, ihren Anspruch nach Grund und Höhe schriftlich anmelden, Sicherheit zu leisten, soweit sie nicht Befriedigung verlangen können. Dieses Recht steht den Gläubigern jedoch nur zu, wenn sie glaubhaft machen, dass durch die Verschmelzung die Erfüllung der Forderung gefährdet wird."
    },
    {
      "date": "2025-07-11",
      "id": "115565",
      "original_text": "Registerbekanntmachung nach dem Umwandlungsgesetz\nNiedersachsen Amtsgericht Göttingen HRB 201124\nLöwer Beteiligungsmanagement GmbH – Göttingen",
      "type": "Registerbekanntmachung nach dem Umwandlungsgesetz",
      "state": "Niedersachsen",
      "amtsgericht": "Amtsgericht Göttingen",
      "registernummer": "HRB 201124",
      "registerart": "HRB",
      "company_name": "Löwer Beteiligungsmanagement GmbH",
      "company_seat": "Göttingen",
      "details": "11.07.2025 (Bekanntmachungsdatum)\n\nNiedersachsen Amtsgericht Göttingen HRB 201124\nRegisterbekanntmachung nach dem Umwandlungsgesetz 11.07.2025 (Eintragungsdatum)\n\nLöwer Beteiligungsmanagement GmbH\nGesellschaft mit beschränkter Haftung\nGöttingen\n\nDen Gläubigern der an der Verschmelzung beteiligten Rechtsträger ist, wenn sie binnen sechs Monaten nach dem Tag, an dem die Eintragung der Verschmelzung in das Register des Sitzes desjenigen Rechtsträgers, dessen Gläubiger sie sind, nach § 19  Abs.  3 UmwG als bekannt gemacht gilt, ihren Anspruch nach Grund und Höhe schriftlich anmelden, Sicherheit zu leisten, soweit sie nicht Befriedigung verlangen können. Dieses Recht steht den Gläubigern jedoch nur zu, wenn sie glaubhaft machen, dass durch die Verschmelzung die Erfüllung der Forderung gefährdet wird."
    },
    {
      "date": "2025-07-11",
      "id": "115566",
      "original_text": "Löschungsankündigung\nNiedersachsen Amtsgericht Braunschweig HRB 209970\nOgonowski-Bau UG (haftungsbeschränkt) – Braunschweig",
      "type": "Löschungsankündigung",
      "state": "Niedersachsen",
      "amtsgericht": "Amtsgericht Braunschweig",
      "registernummer": "HRB 209970",
      "registerart": "HRB",
      "company_name": "Ogonowski-Bau UG (haftungsbeschränkt)",
      "company_seat": "Braunschweig",
      "details": "11.07.2025 (Bekanntmachungsdatum)\n\nNiedersachsen Amtsgericht Braunschweig HRB 209970\nLöschungsankündigung\n\nOgonowski-Bau UG (haftungsbeschränkt)\nGesellschaft mit beschränkter Haftung\nBraunschweig\n\nDas Registergericht beabsichtigt, die Gesellschaft von Amts wegen nach § 394 FamFG zu löschen. Die Frist zur Erhebung eines Widerspruchs ist auf 1 Monat ab dieser Registerbekanntmachung festgesetzt."
    },
    {
      "date": "2025-07-11",
      "id": "115567",
      "original_text": "Registerbekanntmachung nach dem Umwandlungsgesetz\nNiedersachsen Amtsgericht Hannover HRA 206581\nEhlers Garten- und Landschaftsbau, Inhaberin Frauke Wientzek e.Kfr. – Langenhagen",
      "type": "Registerbekanntmachung nach dem Umwandlungsgesetz",
      "state": "Niedersachsen",
      "amtsgericht": "Amtsgericht Hannover",
      "registernummer": "HRA 206581",
      "registerart": "HRA",
      "company_name": "Ehlers Garten- und Landschaftsbau, Inhaberin Frauke Wientzek e.Kfr.",
      "company_seat": "Langenhagen",
      "details": "11.07.2025 (Bekanntmachungsdatum)\n\nNiedersachsen Amtsgericht Hannover HRA 206581\nRegisterbekanntmachung nach dem Umwandlungsgesetz 11.07.2025 (Eintragungsdatum)\n\nEhlers Garten- und Landschaftsbau, Inhaberin Frauke Wientzek e.Kfr.\nEinzelkaufmann / Einzelkauffrau\nLangenhagen\n\nDen Gläubigern der an der Ausgliederung beteiligten Rechtsträger ist, wenn sie binnen sechs Monaten nach dem Tag, an dem die Eintragung der Ausgliederung in das Register des Sitzes desjenigen Rechtsträgers, dessen Gläubiger sie sind, nach § 19 Abs. 3 UmwG als bekannt gemacht gilt, ihren Anspruch nach Grund und Höhe schriftlich anmelden, Sicherheit zu leisten, soweit sie nicht Befriedigung verlangen können. Dieses Recht steht den Gläubigern jedoch nur zu, wenn sie glaubhaft machen, dass durch die Ausgliederung die Erfüllung der Forderung gefährdet wird."
    },
    {
      "date": "2025-07-11",
      "id": "115568",
      "original_text": "Registerbekanntmachung nach dem Umwandlungsgesetz\nNiedersachsen Amtsgericht Hildesheim HRA 203112\nKalkmann Kontakt-Kunst GmbH & Co. KG – Bad Salzdetfurth",
      "type": "Registerbekanntmachung nach dem Umwandlungsgesetz",
      "state": "Niedersachsen",
      "amtsgericht": "Amtsgericht Hildesheim",
      "registernummer": "HRA 203112",
      "registerart": "HRA",
      "company_name": "Kalkmann Kontakt-Kunst GmbH & Co. KG",
      "company_seat": "Bad Salzdetfurth",
      "details": "11.07.2025 (Bekanntmachungsdatum)\n\nNiedersachsen Amtsgericht Hildesheim HRA 203112\nRegisterbekanntmachung nach dem Umwandlungsgesetz 11.07.2025 (Eintragungsdatum)\n\nKalkmann Kontakt-Kunst GmbH & Co. KG\nKommanditgesellschaft\nBad Salzdetfurth\n\nDen Gläubigern der an der Vermögensübertragung beteiligten Rechtsträger ist, wenn sie binnen sechs Monaten nach dem Tag, an dem die Eintragung der Spaltung in das Register des Sitzes desjenigen Rechtsträgers, dessen Gläubiger sie sind, nach § 19 Abs. 3 UmwG als bekannt gemacht gilt, ihren Anspruch nach Grund und Höhe schriftlich anmelden, Sicherheit zu leisten, soweit sie nicht Befriedigung verlangen können. Dieses Recht steht den Gläubigern jedoch nur zu, wenn sie glaubhaft machen, dass durch die Spaltung die Erfüllung der Forderung gefährdet wird."
    },
    {
      "date": "2025-07-11",
      "id": "115569",
      "original_text": "Löschungsankündigung\nNiedersachsen Amtsgericht Braunschweig HRB 208811\nREALTALK UG (haftungsbeschränkt) – Salzgitter",
      "type": "Löschungsankündigung",
      "state": "Niedersachsen",
      "amtsgericht": "Amtsgericht Braunschweig",
      "registernummer": "HRB 208811",
      "registerart": "HRB",
      "company_name": "REALTALK UG (haftungsbeschränkt)",
      "company_seat": "Salzgitter",
      "details": "11.07.2025 (Bekanntmachungsdatum)\n\nNiedersachsen Amtsgericht Braunschweig HRB 208811\nLöschungsankündigung 11.07.2025 (Eintragungsdatum)\n\nREALTALK UG (haftungsbeschränkt)\nGesellschaft mit beschränkter Haftung\nSalzgitter\n\nDas Registergericht beabsichtigt, die Gesellschaft von Amts wegen nach § 394 FamFG zu löschen. Die Frist zur Erhebung eines Widerspruchs ist auf 1 Monat ab dieser Registerbekanntmachung festgesetzt."
    },
    {
      "date": "2025-07-11",
      "id": "115570",
      "original_text": "Einreichung neuer Dokumente\nNiedersachsen Amtsgericht Hildesheim HRB 204918\nBundesgesellschaft für Endlagerung mbH (BGE) – Peine",
      "type": "Einreichung neuer Dokumente",
      "state": "Niedersachsen",
      "amtsgericht": "Amtsgericht Hildesheim",
      "registernummer": "HRB 204918",
      "registerart": "HRB",
      "company_name": "Bundesgesellschaft für Endlagerung mbH (BGE)",
      "company_seat": "Peine",
      "details": "11.07.2025 (Bekanntmachungsdatum)\n\nNiedersachsen Amtsgericht Hildesheim HRB 204918\nEinreichung neuer Dokumente 11.07.2025 (Eintragungsdatum)\n\nBundesgesellschaft für Endlagerung mbH (BGE)\nGesellschaft mit beschränkter Haftung\nPeine\n\nDie Liste der Mitglieder des Aufsichtsrats wurde beim Registergericht eingereicht."
    },
    {
      "date": "2025-07-11",
      "id": "115571",
      "original_text": "Registerbekanntmachung nach dem Umwandlungsgesetz\nNiedersachsen Amtsgericht Hannover HRA 206294\nGoetze Management GmbH & Co. KG – Hannover",
      "type": "Registerbekanntmachung nach dem Umwandlungsgesetz",
      "state": "Niedersachsen",
      "amtsgericht": "Amtsgericht Hannover",
      "registernummer": "HRA 206294",
      "registerart": "HRA",
      "company_name": "Goetze Management GmbH & Co. KG",
      "company_seat": "Hannover",
      "details": "11.07.2025 (Bekanntmachungsdatum)\n\nNiedersachsen Amtsgericht Hannover HRA 206294\nRegisterbekanntmachung nach dem Umwandlungsgesetz 11.07.2025 (Eintragungsdatum)\n\nGoetze Management GmbH & Co. KG\nKommanditgesellschaft\nHannover\n\nDen Gläubigern der an der Ausgliederung beteiligten Rechtsträger ist, wenn sie binnen sechs Monaten nach dem Tag, an dem die Eintragung der Ausgliederung in das Register des Sitzes desjenigen Rechtsträgers, dessen Gläubiger sie sind, nach § 19 Abs. 3 UmwG als bekannt gemacht gilt, ihren Anspruch nach Grund und Höhe schriftlich anmelden, Sicherheit zu leisten, soweit sie nicht Befriedigung verlangen können. Dieses Recht steht den Gläubigern jedoch nur zu, wenn sie glaubhaft machen, dass durch die Ausgliederung die Erfüllung der Forderung gefährdet wird."
    },
    {
      "date": "2025-07-11",
      "id": "115572",
      "original_text": "Registerbekanntmachung nach dem Umwandlungsgesetz\nNiedersachsen Amtsgericht Oldenburg (Oldenburg) HRB 222343\nAtrium 250. Europäische VV SE – Damme",
      "type": "Registerbekanntmachung nach dem Umwandlungsgesetz",
      "state": "Niedersachsen",
      "amtsgericht": "Amtsgericht Oldenburg (Oldenburg)",
      "registernummer": "HRB 222343",
      "registerart": "HRB",
      "company_name": "Atrium 250. Europäische VV SE",
      "company_seat": "Damme",
      "details": "11.07.2025 (Bekanntmachungsdatum)\n\nNiedersachsen Amtsgericht Oldenburg (Oldenburg) HRB 222343\nRegisterbekanntmachung nach dem Umwandlungsgesetz 17.04.2025 (Eintragungsdatum)\n\nAtrium 250. Europäische VV SE\nEuropäische Aktiengesellschaft (SE)\nDamme\n\nBeim Handelsregister ist am 17.04.2025 der Entwurf eines Verschmelzungsvertrages eingereicht worden. Danach soll die Grimme Beteiligungs GmbH mit Sitz in Damme (Amtsgericht Oldenburg (Oldenburg) HRB 207356) als übertragende Gesellschaft mit der Atrium 250. Europäische VV SE (Amtsgericht Oldenburg (Oldenburg) HRB 222343) als übernehmende Gesellschaft verschmolzen werden."
    },
    {
      "date": "2025-07-11",
      "id": "115573",
      "original_text": "Registerbekanntmachung nach dem Umwandlungsgesetz\nNiedersachsen Amtsgericht Lüneburg HRB 102059 früher Amtsgericht Celle\nFliesenverlegung GmbH H. Theilmann – Bergen",
      "type": "Registerbekanntmachung nach dem Umwandlungsgesetz",
      "state": "Niedersachsen",
      "amtsgericht": "Amtsgericht Lüneburg",
      "registernummer": "HRB 102059",
      "registerart": "HRB",
      "company_name": "Fliesenverlegung GmbH H. Theilmann",
      "company_seat": "Bergen",
      "former_amtsgericht": "Celle",
      "details": "11.07.2025 (Bekanntmachungsdatum)\n\nNiedersachsen Amtsgericht Lüneburg HRB 102059 früher Amtsgericht Celle\nRegisterbekanntmachung nach dem Umwandlungsgesetz 11.07.2025 (Eintragungsdatum)\n\nFliesenverlegung GmbH H. Theilmann\nGesellschaft mit beschränkter Haftung\nBergen\n\nDen Gläubigern der an der Verschmelzung beteiligten Rechtsträger ist, wenn sie binnen sechs Monaten nach dem Tag, an dem die Eintragung der Verschmelzung in das Register des Sitzes desjenigen Rechtsträgers, dessen Gläubiger sie sind, nach § 19  Abs.  3 UmwG als bekannt gemacht gilt, ihren Anspruch nach Grund und Höhe schriftlich anmelden, Sicherheit zu leisten, soweit sie nicht Befriedigung verlangen können. Dieses Recht steht den Gläubigern jedoch nur zu, wenn sie glaubhaft machen, dass durch die Verschmelzung die Erfüllung der Forderung gefährdet wird."
    },
    {
      "date": "2025-07-11",
      "id": "115574",
      "original_text": "Löschungsankündigung\nNiedersachsen Amtsgericht Osnabrück HRB 206276\nGreen Plaza GmbH – Nordhorn",
      "type": "Löschungsankündigung",
      "state": "Niedersachsen",
      "amtsgericht": "Amtsgericht Osnabrück",
      "registernummer": "HRB 206276",
      "registerart": "HRB",
      "company_name": "Green Plaza GmbH",
      "company_seat": "Nordhorn",
      "details": "11.07.2025 (Bekanntmachungsdatum)\n\nNiedersachsen Amtsgericht Osnabrück HRB 206276\nLöschungsankündigung\n\nGreen Plaza GmbH\nGesellschaft mit beschränkter Haftung\nNordhorn\n\nDas Registergericht beabsichtigt, die Gesellschaft von Amts wegen nach § 394 FamFG wegen Vermögenslosigkeit zu löschen. Die Frist zur Erhebung eines Widerspruchs ist auf 1 Monat ab dieser Registerbekanntmachung festgesetzt."
    },
    {
      "date": "2025-07-11",
      "id": "115575",
      "original_text": "Registerbekanntmachung nach dem Umwandlungsgesetz\nBremen Amtsgericht Bremen HRB 38887\nPromedis24 GmbH – Bremen",
      "type": "Registerbekanntmachung nach dem Umwandlungsgesetz",
      "state": "Bremen",
      "amtsgericht": "Amtsgericht Bremen",
      "registernummer": "HRB 38887",
      "registerart": "HRB",
      "company_name": "Promedis24 GmbH",
      "company_seat": "Bremen",
      "details": "11.07.2025 (Bekanntmachungsdatum)\n\nBremen Amtsgericht Bremen HRB 38887\nRegisterbekanntmachung nach dem Umwandlungsgesetz 07.07.2025 (Eintragungsdatum)\n\nPromedis24 GmbH\nGesellschaft mit beschränkter Haftung\nBremen\n\nZu Eintragungsnummer 4 vom 07.07.2025 wird als nicht eingetragen veröffentlicht:\nDen Gläubigern der an der Verschmelzung beteiligten Rechtsträger ist, wenn sie binnen sechs Monaten nach dem Tag, an dem die Eintragung der Verschmelzung in das Register des Sitzes desjenigen Rechtsträgers, dessen Gläubiger sie sind, als bekannt gemacht gilt, ihren Anspruch nach Grund und Höhe schriftlich anmelden, Sicherheit zu leisten, soweit sie nicht Befriedigung verlangen können. Dieses Recht steht den Gläubigern jedoch nur zu, wenn sie glaubhaft machen, dass durch die Verschmelzung die Erfüllung ihrer Forderung gefährdet wird. Das Recht, Sicherheitsleistung zu verlangen, steht Gläubigern nicht zu, die im Falle der Insolvenz ein Recht auf vorzugsweise Befriedigung aus einer Deckungsmasse haben, die nach gesetzlicher Vorschrift zu ihrem Schutz errichtet und staatlich überwacht ist."
    },
    {
      "date": "2025-07-11",
      "id": "115576",
      "original_text": "Registerbekanntmachung nach dem Umwandlungsgesetz\nRheinland-Pfalz Amtsgericht Ludwigshafen a.Rhein (Ludwigshafen) HRB 67928\nAHORN Camp GmbH – Speyer",
      "type": "Registerbekanntmachung nach dem Umwandlungsgesetz",
      "state": "Rheinland-Pfalz",
      "amtsgericht": "Amtsgericht Ludwigshafen a.Rhein (Ludwigshafen)",
      "registernummer": "HRB 67928",
      "registerart": "HRB",
      "company_name": "AHORN Camp GmbH",
      "company_seat": "Speyer",
      "details": "11.07.2025 (Bekanntmachungsdatum)\n\nRheinland-Pfalz Amtsgericht Ludwigshafen a.Rhein (Ludwigshafen) HRB 67928\nRegisterbekanntmachung nach dem Umwandlungsgesetz 11.07.2025 (Eintragungsdatum)\n\nAHORN Camp GmbH\nGesellschaft mit beschränkter Haftung\nSpeyer\n\nAls nicht eingetragen wird veröffentlicht: Den Gläubigern der an der Verschmelzung beteiligten Rechtsträger ist, wenn sie binnen sechs Monaten nach dem Tag, an dem die Eintragung der Verschmelzung in das Register des Sitzes desjenigen Rechtsträgers,dessen Gläubiger sie sind, nach § 19 Abs. 3 UmwG als bekannt gemacht gilt, ihren Anspruch nach Grund und Höhe schriftlich anmelden, Sicherheit zu leisten, soweit sie nicht Befriedigung verlangen können. Dieses Recht steht den Gläubigern jedoch nur zu, wenn sie glaubhaft machen, dass durch die Verschmelzung die Erfüllungd er Forderung gefährdet wird."
    },
    {
      "date": "2025-07-11",
      "id": "115577",
      "original_text": "Registerbekanntmachung nach dem Umwandlungsgesetz\nRheinland-Pfalz Amtsgericht Ludwigshafen a.Rhein (Ludwigshafen) HRB 1697\nOQEMA Terminal Management GmbH – Ludwigshafen/Rh.",
      "type": "Registerbekanntmachung nach dem Umwandlungsgesetz",
      "state": "Rheinland-Pfalz",
      "amtsgericht": "Amtsgericht Ludwigshafen a.Rhein (Ludwigshafen)",
      "registernummer": "HRB 1697",
      "registerart": "HRB",
      "company_name": "OQEMA Terminal Management GmbH",
      "company_seat": "Ludwigshafen/Rh.",
      "details": "11.07.2025 (Bekanntmachungsdatum)\n\nRheinland-Pfalz Amtsgericht Ludwigshafen a.Rhein (Ludwigshafen) HRB 1697\nRegisterbekanntmachung nach dem Umwandlungsgesetz 11.07.2025 (Eintragungsdatum)\n\nOQEMA Terminal Management GmbH\nGesellschaft mit beschränkter Haftung\nLudwigshafen/Rh.\n\nAls nicht eingetragen wird veröffentlicht: Den Gläubigern der an der Verschmelzung beteiligten Rechtsträger ist, wenn sie binnen sechs Monaten nach dem Tag, an dem die Eintragung der Verschmelzung in das Register des Sitzes desjenigen Rechtsträgers,dessen Gläubiger sie sind, nach § 19 Abs. 3 UmwG als bekannt gemacht gilt, ihren Anspruch nach Grund und Höhe schriftlich anmelden, Sicherheit zu leisten, soweit sie nicht Befriedigung verlangen können. Dieses Recht steht den Gläubigern jedoch nur zu, wenn sie glaubhaft machen, dass durch die Verschmelzung die Erfüllungd er Forderung gefährdet wird."
    },
    {
      "date": "2025-07-11",
      "id": "115578",
      "original_text": "Registerbekanntmachung nach dem Umwandlungsgesetz\nNordrhein-Westfalen Amtsgericht Köln HRB 112955\nZahlenheldin GmbH – Köln",
      "type": "Registerbekanntmachung nach dem Umwandlungsgesetz",
      "state": "Nordrhein-Westfalen",
      "amtsgericht": "Amtsgericht Köln",
      "registernummer": "HRB 112955",
      "registerart": "HRB",
      "company_name": "Zahlenheldin GmbH",
      "company_seat": "Köln",
      "details": "11.07.2025 (Bekanntmachungsdatum)\n\nNordrhein-Westfalen Amtsgericht Köln HRB 112955\nRegisterbekanntmachung nach dem Umwandlungsgesetz 11.07.2025 (Eintragungsdatum)\n\nZahlenheldin GmbH\nGesellschaft mit beschränkter Haftung\nKöln\n\nDen Gläubigern der an der Verschmelzung beteiligten Rechtsträger ist, wenn sie binnen sechs Monaten nach dem Tag, an dem die Eintragung der Verschmelzung in das Register des Sitzes desjenigen Rechtsträgers, dessen Gläubiger sie sind, nach § 19 Absatz 3 UmwG als bekanntgemacht gilt, ihren Anspruch nach Grund und Höhe schriftlich anmelden, Sicherheit zu leisten, soweit sie nicht Befriedigung verlangen können. Dieses Recht steht den Gläubigern jedoch nur zu, wenn sie glaubhaft machen, dass durch die Verschmelzung die Erfüllung ihrer Forderung gefährdet wird."
    },
    {
      "date": "2025-07-11",
      "id": "115579",
      "original_text": "Löschungsankündigung\nNordrhein-Westfalen Amtsgericht Bochum HRB 20820\nBK GmbH – Bochum",
      "type": "Löschungsankündigung",
      "state": "Nordrhein-Westfalen",
      "amtsgericht": "Amtsgericht Bochum",
      "registernummer": "HRB 20820",
      "registerart": "HRB",
      "company_name": "BK GmbH",
      "company_seat": "Bochum",
      "details": "11.07.2025 (Bekanntmachungsdatum)\n\nNordrhein-Westfalen Amtsgericht Bochum HRB 20820\nLöschungsankündigung\n\nBK GmbH\nGesellschaft mit beschränkter Haftung\nBochum\n\nDas Registergericht beabsichtigt die Gesellschaft von Amts wegen nach § 394 FamFG zu löschen. Die Frist zur Erhebung eines Widerspruchs ist auf drei Monate festgesetzt."
    },
    {
      "date": "2025-07-11",
      "id": "115580",
      "original_text": "Registerbekanntmachung nach dem Umwandlungsgesetz\nNordrhein-Westfalen Amtsgericht Düsseldorf HRB 61628\nRadio Media West GmbH – Düsseldorf",
      "type": "Registerbekanntmachung nach dem Umwandlungsgesetz",
      "state": "Nordrhein-Westfalen",
      "amtsgericht": "Amtsgericht Düsseldorf",
      "registernummer": "HRB 61628",
      "registerart": "HRB",
      "company_name": "Radio Media West GmbH",
      "company_seat": "Düsseldorf",
      "details": "11.07.2025 (Bekanntmachungsdatum)\n\nNordrhein-Westfalen Amtsgericht Düsseldorf HRB 61628\nRegisterbekanntmachung nach dem Umwandlungsgesetz 11.07.2025 (Eintragungsdatum)\n\nRadio Media West GmbH\nGesellschaft mit beschränkter Haftung\nDüsseldorf\n\nDen Gläubigern der an der Verschmelzung beteiligten Rechtsträger ist, wenn sie binnen sechs Monaten nach dem Tag, an dem die Eintragung der Verschmelzung in das Register des Sitzes desjenigen Rechtsträgers, dessen Gläubiger sie sind, nach § 19 Absatz 3 UmwG als bekanntgemacht gilt, ihren Anspruch nach Grund und Höhe schriftlich anmelden, Sicherheit zu leisten, soweit sie nicht Befriedigung verlangen können. Dieses Recht steht den Gläubigern jedoch nur zu, wenn sie glaubhaft machen, dass durch die Verschmelzung die Erfüllung ihrer Forderung gefährdet wird."
    },
    {
      "date": "2025-07-11",
      "id": "115581",
      "original_text": "Löschungsankündigung\nNordrhein-Westfalen Amtsgericht Duisburg HRB 31225\nBMC ELEVEN GmbH – Duisburg",
      "type": "Löschungsankündigung",
      "state": "Nordrhein-Westfalen",
      "amtsgericht": "Amtsgericht Duisburg",
      "registernummer": "HRB 31225",
      "registerart": "HRB",
      "company_name": "BMC ELEVEN GmbH",
      "company_seat": "Duisburg",
      "details": "11.07.2025 (Bekanntmachungsdatum)\n\nNordrhein-Westfalen Amtsgericht Duisburg HRB 31225\nLöschungsankündigung\n\nBMC ELEVEN GmbH\nGesellschaft mit beschränkter Haftung\nDuisburg\n\nDas Registergericht beabsichtigt, die im Handelsregister eingetragene Gesellschaft BMC ELEVEN GmbH gemäß § 394 Absatz 1 FamFG wegen Vermögenslosigkeit von Amts wegen zu löschen. Gegen diese Verfügung kann Widerspruch eingelegt werden. Die Frist zur Erhebung eines Widerspruchs gegen die beabsichtigte Löschung von Amts wegen ist auf drei Monate festgesetzt. Rechtsbehelfsbelehrung Der Widerspruch ist bei dem Amtsgericht Duisburg, Kardinal-Galen-Str. 124-132, 47058 Duisburg schriftlich in deutscher Sprache oder zur Niederschrift der Geschäftsstelle einzulegen. Der Widerspruch kann auch zur Niederschrift der Geschäftsstelle eines jeden Amtsgerichtes abgegeben werden. Die Einlegung ist auch durch Übertragung eines elektronischen Dokuments an die elektronische Poststelle des Gerichts möglich. Das elektronische Dokument muss für die Bearbeitung durch das Gericht geeignet und mit einer qualifizierten elektronischen Signatur der verantwortenden Person versehen sein oder von der verantwortenden Person signiert und auf einem sicheren Übermittlungsweg gemäß § 130 a ZPO nach näherer Maßgabe der Verordnung über die technischen Rahmenbedingungen des elektronischen Rechtsverkehrs und über das besondere elektronische Behördenpostfach (BGBl. I, S. 3803) eingereicht werden. Weitere Informationen erhalten Sie auf der Internetseite www.justiz.de <http://www.justiz.de>. Der Widerspruch muss spätestens innerhalb der gesetzten Frist bei dem Amtsgericht Duisburg eingegangen sein. Dies gilt auch dann, wenn der Widerspruch zur Niederschrift der Geschäftsstelle eines anderen Amtsgerichtes abgegeben wurde. Die Frist beginnt mit der Veröffentlichung. Fällt das Ende der Frist auf einen Sonntag, einen allgemeinen Feiertag oder Sonnabend, so endet die Frist mit Ablauf des nächsten Werktages. Der Widerspruch muss die Bezeichnung der angefochtenen Verfügung sowie die Erklärung enthalten, dass Widerspruch gegen diese Verfügung eingelegt wird. Er ist zu unterzeichnen und soll begründet werden."
    },
    {
      "date": "2025-07-11",
      "id": "115582",
      "original_text": "Registerbekanntmachung nach dem Umwandlungsgesetz\nNordrhein-Westfalen Amtsgericht Essen HRB 37016\nSC Nachfolge GmbH – Essen",
      "type": "Registerbekanntmachung nach dem Umwandlungsgesetz",
      "state": "Nordrhein-Westfalen",
      "amtsgericht": "Amtsgericht Essen",
      "registernummer": "HRB 37016",
      "registerart": "HRB",
      "company_name": "SC Nachfolge GmbH",
      "company_seat": "Essen",
      "details": "11.07.2025 (Bekanntmachungsdatum)\n\nNordrhein-Westfalen Amtsgericht Essen HRB 37016\nRegisterbekanntmachung nach dem Umwandlungsgesetz 11.07.2025 (Eintragungsdatum)\n\nSC Nachfolge GmbH\nGesellschaft mit beschränkter Haftung\nEssen\n\nDen Gläubigern der an der formwechselnden Umwandlung beteiligten Rechtsträger ist, wenn sie binnen sechs Monaten nach dem Tag, an dem die Eintragung der formwechselnden Umwandlung in das Register des Sitzes desjenigen Rechtsträgers, dessen Gläubiger sie sind, nach § 19 Absatz 3 UmwG als bekanntgemacht gilt, ihren Anspruch nach Grund und Höhe schriftlich anmelden, Sicherheit zu leisten, soweit sie nicht Befriedigung verlangen können. Dieses Recht steht den Gläubigern jedoch nur zu, wenn sie glaubhaft machen, dass durch die formwechselnden Umwandlung die Erfüllung ihrer Forderung gefährdet wird."
    },
    {
      "date": "2025-07-11",
      "id": "115583",
      "original_text": "Löschungsankündigung\nNordrhein-Westfalen Amtsgericht Neuss HRA 8080\nKNOWHOWOPTIONS LTD. & CO. KG – Meerbusch",
      "type": "Löschungsankündigung",
      "state": "Nordrhein-Westfalen",
      "amtsgericht": "Amtsgericht Neuss",
      "registernummer": "HRA 8080",
      "registerart": "HRA",
      "company_name": "KNOWHOWOPTIONS LTD. & CO. KG",
      "company_seat": "Meerbusch",
      "details": "11.07.2025 (Bekanntmachungsdatum)\n\nNordrhein-Westfalen Amtsgericht Neuss HRA 8080\nLöschungsankündigung 11.07.2025 (Eintragungsdatum)\n\nKNOWHOWOPTIONS LTD. & CO. KG\nKommanditgesellschaft\nMeerbusch\n\nDas Registergericht beabsichtigt die Gesellschaft gemäß § 31 Absatz II HGB i.V. m § 394 Absatz IV FamFG im Handelsregister zu löschen.\nGegen die Löschung kann binnen eines Monats jeder Widerspruch erheben, der an der Unterlassung der Löschung ein berechtigtes Interesse hat."
    },
    {
      "date": "2025-07-11",
      "id": "115584",
      "original_text": "Löschungsankündigung\nNordrhein-Westfalen Amtsgericht Wuppertal HRA 19697\nEwald Rosenow GmbH & Cie. – Solingen",
      "type": "Löschungsankündigung",
      "state": "Nordrhein-Westfalen",
      "amtsgericht": "Amtsgericht Wuppertal",
      "registernummer": "HRA 19697",
      "registerart": "HRA",
      "company_name": "Ewald Rosenow GmbH & Cie.",
      "company_seat": "Solingen",
      "details": "11.07.2025 (Bekanntmachungsdatum)\n\nNordrhein-Westfalen Amtsgericht Wuppertal HRA 19697\nLöschungsankündigung 11.07.2025 (Eintragungsdatum)\n\nEwald Rosenow GmbH & Cie.\nKommanditgesellschaft\nSolingen\n\nDas Registergericht beabsichtigt die Firma von Amts wegen nach § 393 FamFG zu löschen. Die Frist zur Erhebung eines Widerspruchs ist auf drei Monate festgesetzt."
    },
    {
      "date": "2025-07-11",
      "id": "115585",
      "original_text": "Registerbekanntmachung nach dem Umwandlungsgesetz\nNordrhein-Westfalen Amtsgericht Duisburg HRA 13542\nAutech Lars Hörnemann e.K. – Wesel",
      "type": "Registerbekanntmachung nach dem Umwandlungsgesetz",
      "state": "Nordrhein-Westfalen",
      "amtsgericht": "Amtsgericht Duisburg",
      "registernummer": "HRA 13542",
      "registerart": "HRA",
      "company_name": "Autech Lars Hörnemann e.K.",
      "company_seat": "Wesel",
      "details": "11.07.2025 (Bekanntmachungsdatum)\n\nNordrhein-Westfalen Amtsgericht Duisburg HRA 13542\nRegisterbekanntmachung nach dem Umwandlungsgesetz 11.07.2025 (Eintragungsdatum)\n\nAutech Lars Hörnemann e.K.\nEinzelkaufmann / Einzelkauffrau\nWesel\n\nDen Gläubigern der an der Ausgliederung beteiligten Rechtsträger ist, wenn sie binnen sechs Monaten nach dem Tag, an dem die Eintragung der desjenigen Rechtsträgers, dessen Gläubiger sie sind, nach § 19 Absatz 3 UmwG als bekanntgemacht gilt, ihren Anspruch nach Grund und Höhe schriftlich anmelden, Sicherheit zu leisten, soweit sie nicht Befriedigung verlangen können. Dieses Recht steht den Gläubigern jedoch nur zu, wenn sie glaubhaft machen, dass durch die Ausgliederung die Erfüllung ihrer Forderung gefährdet wird."
    },
    {
      "date": "2025-07-11",
      "id": "115586",
      "original_text": "Registerbekanntmachung nach dem Umwandlungsgesetz\nNordrhein-Westfalen Amtsgericht Recklinghausen HRB 9534\nB & P Campus GmbH – Datteln",
      "type": "Registerbekanntmachung nach dem Umwandlungsgesetz",
      "state": "Nordrhein-Westfalen",
      "amtsgericht": "Amtsgericht Recklinghausen",
      "registernummer": "HRB 9534",
      "registerart": "HRB",
      "company_name": "B & P Campus GmbH",
      "company_seat": "Datteln",
      "details": "11.07.2025 (Bekanntmachungsdatum)\n\nNordrhein-Westfalen Amtsgericht Recklinghausen HRB 9534\nRegisterbekanntmachung nach dem Umwandlungsgesetz 10.07.2025 (Eintragungsdatum)\n\nB & P Campus GmbH\nGesellschaft mit beschränkter Haftung\nDatteln\n\nDen Gläubigern der an der Verschmelzung beteiligten Rechtsträger ist, wenn sie binnen sechs Monaten nach dem Tag, an dem die Eintragung der Verschmelzung in das Register des Sitzes desjenigen Rechtsträgers, dessen Gläubiger sie sind, nach § 19 Absatz 3 UmwG als bekanntgemacht gilt, ihren Anspruch nach Grund und Höhe schriftlich anmelden, Sicherheit zu leisten, soweit sie nicht Befriedigung verlangen können. Dieses Recht steht den Gläubigern jedoch nur zu, wenn sie glaubhaft machen, dass durch die Verschmelzung die Erfüllung ihrer Forderung gefährdet wird."
    },
    {
      "date": "2025-07-11",
      "id": "115587",
      "original_text": "Sonstige Registerbekanntmachung\nNordrhein-Westfalen Amtsgericht Duisburg HRA 13619\nAutech Hörnemann GmbH & Co. KG – Wesel",
      "type": "Sonstige Registerbekanntmachung",
      "state": "Nordrhein-Westfalen",
      "amtsgericht": "Amtsgericht Duisburg",
      "registernummer": "HRA 13619",
      "registerart": "HRA",
      "company_name": "Autech Hörnemann GmbH & Co. KG",
      "company_seat": "Wesel",
      "details": "11.07.2025 (Bekanntmachungsdatum)\n\nNordrhein-Westfalen Amtsgericht Duisburg HRA 13619\nSonstige Registerbekanntmachung 11.07.2025 (Eintragungsdatum)\n\nAutech Hörnemann GmbH & Co. KG\nKommanditgesellschaft\nWesel\n\nDen Gläubigern der an der Ausgliederung beteiligten Rechtsträger ist, wenn sie binnen sechs Monaten nach dem Tag, an dem die Eintragung desjenigen Rechtsträgers, dessen Gläubiger sie sind, nach § 19 Absatz 3 UmwG als bekanntgemacht gilt, ihren Anspruch nach Grund und Höhe schriftlich anmelden, Sicherheit zu leisten, soweit sie nicht Befriedigung verlangen können. Dieses Recht steht den Gläubigern jedoch nur zu, wenn sie glaubhaft machen, dass durch die Ausgliederung die Erfüllung ihrer Forderung gefährdet wird."
    },
    {
      "date": "2025-07-11",
      "id": "115588",
      "original_text": "Registerbekanntmachung nach dem Umwandlungsgesetz\nNordrhein-Westfalen Amtsgericht Köln HRB 92510\nPlusnet GmbH – Köln",
      "type": "Registerbekanntmachung nach dem Umwandlungsgesetz",
      "state": "Nordrhein-Westfalen",
      "amtsgericht": "Amtsgericht Köln",
      "registernummer": "HRB 92510",
      "registerart": "HRB",
      "company_name": "Plusnet GmbH",
      "company_seat": "Köln",
      "details": "11.07.2025 (Bekanntmachungsdatum)\n\nNordrhein-Westfalen Amtsgericht Köln HRB 92510\nRegisterbekanntmachung nach dem Umwandlungsgesetz 11.07.2025 (Eintragungsdatum)\n\nPlusnet GmbH\nGesellschaft mit beschränkter Haftung\nKöln\n\nDen Gläubigern der an der Verschmelzung beteiligten Rechtsträger ist, wenn sie binnen sechs Monaten nach dem Tag, an dem die Eintragung der Verschmelzung in das Register des Sitzes desjenigen Rechtsträgers, dessen Gläubiger sie sind, nach § 19 Absatz 3 UmwG als bekanntgemacht gilt, ihren Anspruch nach Grund und Höhe schriftlich anmelden, Sicherheit zu leisten, soweit sie nicht Befriedigung verlangen können. Dieses Recht steht den Gläubigern jedoch nur zu, wenn sie glaubhaft machen, dass durch die Verschmelzung die Erfüllung ihrer Forderung gefährdet wird."
    },
    {
      "date": "2025-07-11",
      "id": "115589",
      "original_text": "Registerbekanntmachung nach dem Umwandlungsgesetz\nNordrhein-Westfalen Amtsgericht Köln HRB 92510\nPlusnet GmbH – Köln",
      "type": "Registerbekanntmachung nach dem Umwandlungsgesetz",
      "state": "Nordrhein-Westfalen",
      "amtsgericht": "Amtsgericht Köln",
      "registernummer": "HRB 92510",
      "registerart": "HRB",
      "company_name": "Plusnet GmbH",
      "company_seat": "Köln",
      "details": "11.07.2025 (Bekanntmachungsdatum)\n\nNordrhein-Westfalen Amtsgericht Köln HRB 92510\nRegisterbekanntmachung nach dem Umwandlungsgesetz 11.07.2025 (Eintragungsdatum)\n\nPlusnet GmbH\nGesellschaft mit beschränkter Haftung\nKöln\n\nDen Gläubigern der an der Verschmelzung beteiligten Rechtsträger ist, wenn sie binnen sechs Monaten nach dem Tag, an dem die Eintragung der Verschmelzung in das Register des Sitzes desjenigen Rechtsträgers, dessen Gläubiger sie sind, nach § 19 Absatz 3 UmwG als bekanntgemacht gilt, ihren Anspruch nach Grund und Höhe schriftlich anmelden, Sicherheit zu leisten, soweit sie nicht Befriedigung verlangen können. Dieses Recht steht den Gläubigern jedoch nur zu, wenn sie glaubhaft machen, dass durch die Verschmelzung die Erfüllung ihrer Forderung gefährdet wird."
    },
    {
      "date": "2025-07-11",
      "id": "115590",
      "original_text": "Registerbekanntmachung nach dem Umwandlungsgesetz\nNordrhein-Westfalen Amtsgericht Köln HRB 92510\nPlusnet GmbH – Köln",
      "type": "Registerbekanntmachung nach dem Umwandlungsgesetz",
      "state": "Nordrhein-Westfalen",
      "amtsgericht": "Amtsgericht Köln",
      "registernummer": "HRB 92510",
      "registerart": "HRB",
      "company_name": "Plusnet GmbH",
      "company_seat": "Köln",
      "details": "11.07.2025 (Bekanntmachungsdatum)\n\nNordrhein-Westfalen Amtsgericht Köln HRB 92510\nRegisterbekanntmachung nach dem Umwandlungsgesetz 11.07.2025 (Eintragungsdatum)\n\nPlusnet GmbH\nGesellschaft mit beschränkter Haftung\nKöln\n\nDen Gläubigern der an der Verschmelzung beteiligten Rechtsträger ist, wenn sie binnen sechs Monaten nach dem Tag, an dem die Eintragung der Verschmelzung in das Register des Sitzes desjenigen Rechtsträgers, dessen Gläubiger sie sind, nach § 19 Absatz 3 UmwG als bekanntgemacht gilt, ihren Anspruch nach Grund und Höhe schriftlich anmelden, Sicherheit zu leisten, soweit sie nicht Befriedigung verlangen können. Dieses Recht steht den Gläubigern jedoch nur zu, wenn sie glaubhaft machen, dass durch die Verschmelzung die Erfüllung ihrer Forderung gefährdet wird."
    },
    {
      "date": "2025-07-11",
      "id": "115591",
      "original_text": "Registerbekanntmachung nach dem Umwandlungsgesetz\nNordrhein-Westfalen Amtsgericht Köln HRB 110346\nStark Ventures GmbH – Köln",
      "type": "Registerbekanntmachung nach dem Umwandlungsgesetz",
      "state": "Nordrhein-Westfalen",
      "amtsgericht": "Amtsgericht Köln",
      "registernummer": "HRB 110346",
      "registerart": "HRB",
      "company_name": "Stark Ventures GmbH",
      "company_seat": "Köln",
      "details": "11.07.2025 (Bekanntmachungsdatum)\n\nNordrhein-Westfalen Amtsgericht Köln HRB 110346\nRegisterbekanntmachung nach dem Umwandlungsgesetz 11.07.2025 (Eintragungsdatum)\n\nStark Ventures GmbH\nGesellschaft mit beschränkter Haftung\nKöln\n\nDen Gläubigern der an der Verschmelzung beteiligten Rechtsträger ist, wenn sie binnen sechs Monaten nach dem Tag, an dem die Eintragung der Verschmelzung in das Register des Sitzes desjenigen Rechtsträgers, dessen Gläubiger sie sind, nach § 19 Absatz 3 UmwG als bekanntgemacht gilt, ihren Anspruch nach Grund und Höhe schriftlich anmelden, Sicherheit zu leisten, soweit sie nicht Befriedigung verlangen können. Dieses Recht steht den Gläubigern jedoch nur zu, wenn sie glaubhaft machen, dass durch die Verschmelzung die Erfüllung ihrer Forderung gefährdet wird."
    },
    {
      "date": "2025-07-11",
      "id": "115592",
      "original_text": "Registerbekanntmachung nach dem Umwandlungsgesetz\nNordrhein-Westfalen Amtsgericht Recklinghausen HRB 9334\nBernemann Real Estate GmbH – Recklinghausen",
      "type": "Registerbekanntmachung nach dem Umwandlungsgesetz",
      "state": "Nordrhein-Westfalen",
      "amtsgericht": "Amtsgericht Recklinghausen",
      "registernummer": "HRB 9334",
      "registerart": "HRB",
      "company_name": "Bernemann Real Estate GmbH",
      "company_seat": "Recklinghausen",
      "details": "11.07.2025 (Bekanntmachungsdatum)\n\nNordrhein-Westfalen Amtsgericht Recklinghausen HRB 9334\nRegisterbekanntmachung nach dem Umwandlungsgesetz 10.07.2025 (Eintragungsdatum)\n\nBernemann Real Estate GmbH\nGesellschaft mit beschränkter Haftung\nRecklinghausen\n\nDen Gläubigern der an der Verschmelzung beteiligten Rechtsträger ist, wenn sie binnen sechs Monaten nach dem Tag, an dem die Eintragung der Verschmelzung in das Register des Sitzes desjenigen Rechtsträgers, dessen Gläubiger sie sind, nach § 19 Absatz 3 UmwG als bekanntgemacht gilt, ihren Anspruch nach Grund und Höhe schriftlich anmelden, Sicherheit zu leisten, soweit sie nicht Befriedigung verlangen können. Dieses Recht steht den Gläubigern jedoch nur zu, wenn sie glaubhaft machen, dass durch die Verschmelzung die Erfüllung ihrer Forderung gefährdet wird."
    },
    {
      "date": "2025-07-11",
      "id": "115593",
      "original_text": "Registerbekanntmachung nach dem Umwandlungsgesetz\nNordrhein-Westfalen Amtsgericht Köln HRB 78396\nZentrum für Trauma- und Konfliktmanagement (ZTK) GmbH – Köln",
      "type": "Registerbekanntmachung nach dem Umwandlungsgesetz",
      "state": "Nordrhein-Westfalen",
      "amtsgericht": "Amtsgericht Köln",
      "registernummer": "HRB 78396",
      "registerart": "HRB",
      "company_name": "Zentrum für Trauma- und Konfliktmanagement (ZTK) GmbH",
      "company_seat": "Köln",
      "details": "11.07.2025 (Bekanntmachungsdatum)\n\nNordrhein-Westfalen Amtsgericht Köln HRB 78396\nRegisterbekanntmachung nach dem Umwandlungsgesetz 11.07.2025 (Eintragungsdatum)\n\nZentrum für Trauma- und Konfliktmanagement (ZTK) GmbH\nGesellschaft mit beschränkter Haftung\nKöln\n\nDen Gläubigern der an der Verschmelzung beteiligten Rechtsträger ist, wenn sie binnen sechs Monaten nach dem Tag, an dem die Eintragung der Verschmelzung in das Register des Sitzes desjenigen Rechtsträgers, dessen Gläubiger sie sind, nach § 19 Absatz 3 UmwG als bekanntgemacht gilt, ihren Anspruch nach Grund und Höhe schriftlich anmelden, Sicherheit zu leisten, soweit sie nicht Befriedigung verlangen können. Dieses Recht steht den Gläubigern jedoch nur zu, wenn sie glaubhaft machen, dass durch die Verschmelzung die Erfüllung ihrer Forderung gefährdet wird."
    },
    {
      "date": "2025-07-11",
      "id": "115594",
      "original_text": "Registerbekanntmachung nach dem Umwandlungsgesetz\nNordrhein-Westfalen Amtsgericht Köln HRB 101466\nKLINIK- und LABOR-Versorgung GmbH – Bergisch Gladbach",
      "type": "Registerbekanntmachung nach dem Umwandlungsgesetz",
      "state": "Nordrhein-Westfalen",
      "amtsgericht": "Amtsgericht Köln",
      "registernummer": "HRB 101466",
      "registerart": "HRB",
      "company_name": "KLINIK- und LABOR-Versorgung GmbH",
      "company_seat": "Bergisch Gladbach",
      "details": "11.07.2025 (Bekanntmachungsdatum)\n\nNordrhein-Westfalen Amtsgericht Köln HRB 101466\nRegisterbekanntmachung nach dem Umwandlungsgesetz 11.07.2025 (Eintragungsdatum)\n\nKLINIK- und LABOR-Versorgung GmbH\nGesellschaft mit beschränkter Haftung\nBergisch Gladbach\n\nDen Gläubigern der an der Verschmelzung beteiligten Rechtsträger ist, wenn sie binnen sechs Monaten nach dem Tag, an dem die Eintragung der Verschmelzung in das Register des Sitzes desjenigen Rechtsträgers, dessen Gläubiger sie sind, nach § 19 Absatz 3 UmwG als bekanntgemacht gilt, ihren Anspruch nach Grund und Höhe schriftlich anmelden, Sicherheit zu leisten, soweit sie nicht Befriedigung verlangen können. Dieses Recht steht den Gläubigern jedoch nur zu, wenn sie glaubhaft machen, dass durch die Verschmelzung die Erfüllung ihrer Forderung gefährdet wird."
    },
    {
      "date": "2025-07-11",
      "id": "115595",
      "original_text": "Einreichung neuer Dokumente\nNordrhein-Westfalen Amtsgericht Köln HRB 49226\nBayer Vital GmbH – Leverkusen",
      "type": "Einreichung neuer Dokumente",
      "state": "Nordrhein-Westfalen",
      "amtsgericht": "Amtsgericht Köln",
      "registernummer": "HRB 49226",
      "registerart": "HRB",
      "company_name": "Bayer Vital GmbH",
      "company_seat": "Leverkusen",
      "details": "11.07.2025 (Bekanntmachungsdatum)\n\nNordrhein-Westfalen Amtsgericht Köln HRB 49226\nEinreichung neuer Dokumente\n\nBayer Vital GmbH\nGesellschaft mit beschränkter Haftung\nLeverkusen\n\nDem Registergericht ist eine Liste der Mitglieder des Aufsichtsrates eingereicht worden."
    },
    {
      "date": "2025-07-11",
      "id": "115596",
      "original_text": "Registerbekanntmachung nach dem Umwandlungsgesetz\nNordrhein-Westfalen Amtsgericht Köln HRB 92510\nPlusnet GmbH – Köln",
      "type": "Registerbekanntmachung nach dem Umwandlungsgesetz",
      "state": "Nordrhein-Westfalen",
      "amtsgericht": "Amtsgericht Köln",
      "registernummer": "HRB 92510",
      "registerart": "HRB",
      "company_name": "Plusnet GmbH",
      "company_seat": "Köln",
      "details": "11.07.2025 (Bekanntmachungsdatum)\n\nNordrhein-Westfalen Amtsgericht Köln HRB 92510\nRegisterbekanntmachung nach dem Umwandlungsgesetz 11.07.2025 (Eintragungsdatum)\n\nPlusnet GmbH\nGesellschaft mit beschränkter Haftung\nKöln\n\nDen Gläubigern der an der Verschmelzung beteiligten Rechtsträger ist, wenn sie binnen sechs Monaten nach dem Tag, an dem die Eintragung der Verschmelzung in das Register des Sitzes desjenigen Rechtsträgers, dessen Gläubiger sie sind, nach § 19 Absatz 3 UmwG als bekanntgemacht gilt, ihren Anspruch nach Grund und Höhe schriftlich anmelden, Sicherheit zu leisten, soweit sie nicht Befriedigung verlangen können. Dieses Recht steht den Gläubigern jedoch nur zu, wenn sie glaubhaft machen, dass durch die Verschmelzung die Erfüllung ihrer Forderung gefährdet wird."
    },
    {
      "date": "2025-07-11",
      "id": "115597",
      "original_text": "Registerbekanntmachung nach dem Umwandlungsgesetz\nNordrhein-Westfalen Amtsgericht Köln HRB 92510\nPlusnet GmbH – Köln",
      "type": "Registerbekanntmachung nach dem Umwandlungsgesetz",
      "state": "Nordrhein-Westfalen",
      "amtsgericht": "Amtsgericht Köln",
      "registernummer": "HRB 92510",
      "registerart": "HRB",
      "company_name": "Plusnet GmbH",
      "company_seat": "Köln",
      "details": "11.07.2025 (Bekanntmachungsdatum)\n\nNordrhein-Westfalen Amtsgericht Köln HRB 92510\nRegisterbekanntmachung nach dem Umwandlungsgesetz 11.07.2025 (Eintragungsdatum)\n\nPlusnet GmbH\nGesellschaft mit beschränkter Haftung\nKöln\n\nDen Gläubigern der an der Verschmelzung beteiligten Rechtsträger ist, wenn sie binnen sechs Monaten nach dem Tag, an dem die Eintragung der Verschmelzung in das Register des Sitzes desjenigen Rechtsträgers, dessen Gläubiger sie sind, nach § 19 Absatz 3 UmwG als bekanntgemacht gilt, ihren Anspruch nach Grund und Höhe schriftlich anmelden, Sicherheit zu leisten, soweit sie nicht Befriedigung verlangen können. Dieses Recht steht den Gläubigern jedoch nur zu, wenn sie glaubhaft machen, dass durch die Verschmelzung die Erfüllung ihrer Forderung gefährdet wird."
    },
    {
      "date": "2025-07-11",
      "id": "115598",
      "original_text": "Registerbekanntmachung nach dem Umwandlungsgesetz\nNordrhein-Westfalen Amtsgericht Köln HRB 92510\nPlusnet GmbH – Köln",
      "type": "Registerbekanntmachung nach dem Umwandlungsgesetz",
      "state": "Nordrhein-Westfalen",
      "amtsgericht": "Amtsgericht Köln",
      "registernummer": "HRB 92510",
      "registerart": "HRB",
      "company_name": "Plusnet GmbH",
      "company_seat": "Köln",
      "details": "11.07.2025 (Bekanntmachungsdatum)\n\nNordrhein-Westfalen Amtsgericht Köln HRB 92510\nRegisterbekanntmachung nach dem Umwandlungsgesetz 11.07.2025 (Eintragungsdatum)\n\nPlusnet GmbH\nGesellschaft mit beschränkter Haftung\nKöln\n\nDen Gläubigern der an der Verschmelzung beteiligten Rechtsträger ist, wenn sie binnen sechs Monaten nach dem Tag, an dem die Eintragung der Verschmelzung in das Register des Sitzes desjenigen Rechtsträgers, dessen Gläubiger sie sind, nach § 19 Absatz 3 UmwG als bekanntgemacht gilt, ihren Anspruch nach Grund und Höhe schriftlich anmelden, Sicherheit zu leisten, soweit sie nicht Befriedigung verlangen können. Dieses Recht steht den Gläubigern jedoch nur zu, wenn sie glaubhaft machen, dass durch die Verschmelzung die Erfüllung ihrer Forderung gefährdet wird."
    },
    {
      "date": "2025-07-11",
      "id": "115599",
      "original_text": "Registerbekanntmachung nach dem Umwandlungsgesetz\nNordrhein-Westfalen Amtsgericht Köln HRB 68236\n010088 Telecom GmbH – Köln",
      "type": "Registerbekanntmachung nach dem Umwandlungsgesetz",
      "state": "Nordrhein-Westfalen",
      "amtsgericht": "Amtsgericht Köln",
      "registernummer": "HRB 68236",
      "registerart": "HRB",
      "company_name": "010088 Telecom GmbH",
      "company_seat": "Köln",
      "details": "11.07.2025 (Bekanntmachungsdatum)\n\nNordrhein-Westfalen Amtsgericht Köln HRB 68236\nRegisterbekanntmachung nach dem Umwandlungsgesetz 11.07.2025 (Eintragungsdatum)\n\n010088 Telecom GmbH\nGesellschaft mit beschränkter Haftung\nKöln\n\nDen Gläubigern der an der Verschmelzung beteiligten Rechtsträger ist, wenn sie binnen sechs Monaten nach dem Tag, an dem die Eintragung der Verschmelzung in das Register des Sitzes desjenigen Rechtsträgers, dessen Gläubiger sie sind, nach § 19 Absatz 3 UmwG als bekanntgemacht gilt, ihren Anspruch nach Grund und Höhe schriftlich anmelden, Sicherheit zu leisten, soweit sie nicht Befriedigung verlangen können. Dieses Recht steht den Gläubigern jedoch nur zu, wenn sie glaubhaft machen, dass durch die Verschmelzung die Erfüllung ihrer Forderung gefährdet wird."
    },
    {
      "date": "2025-07-11",
      "id": "115600",
      "original_text": "Registerbekanntmachung nach dem Umwandlungsgesetz\nNordrhein-Westfalen Amtsgericht Köln HRB 56857\n010090 GmbH – Köln",
      "type": "Registerbekanntmachung nach dem Umwandlungsgesetz",
      "state": "Nordrhein-Westfalen",
      "amtsgericht": "Amtsgericht Köln",
      "registernummer": "HRB 56857",
      "registerart": "HRB",
      "company_name": "010090 GmbH",
      "company_seat": "Köln",
      "details": "11.07.2025 (Bekanntmachungsdatum)\n\nNordrhein-Westfalen Amtsgericht Köln HRB 56857\nRegisterbekanntmachung nach dem Umwandlungsgesetz 11.07.2025 (Eintragungsdatum)\n\n010090 GmbH\nGesellschaft mit beschränkter Haftung\nKöln\n\nDen Gläubigern der an der Verschmelzung beteiligten Rechtsträger ist, wenn sie binnen sechs Monaten nach dem Tag, an dem die Eintragung der Verschmelzung in das Register des Sitzes desjenigen Rechtsträgers, dessen Gläubiger sie sind, nach § 19 Absatz 3 UmwG als bekanntgemacht gilt, ihren Anspruch nach Grund und Höhe schriftlich anmelden, Sicherheit zu leisten, soweit sie nicht Befriedigung verlangen können. Dieses Recht steht den Gläubigern jedoch nur zu, wenn sie glaubhaft machen, dass durch die Verschmelzung die Erfüllung ihrer Forderung gefährdet wird."
    },
    {
      "date": "2025-07-11",
      "id": "115601",
      "original_text": "Registerbekanntmachung nach dem Umwandlungsgesetz\nNordrhein-Westfalen Amtsgericht Köln HRB 63979\n01012 Telecom GmbH – Köln",
      "type": "Registerbekanntmachung nach dem Umwandlungsgesetz",
      "state": "Nordrhein-Westfalen",
      "amtsgericht": "Amtsgericht Köln",
      "registernummer": "HRB 63979",
      "registerart": "HRB",
      "company_name": "01012 Telecom GmbH",
      "company_seat": "Köln",
      "details": "11.07.2025 (Bekanntmachungsdatum)\n\nNordrhein-Westfalen Amtsgericht Köln HRB 63979\nRegisterbekanntmachung nach dem Umwandlungsgesetz 11.07.2025 (Eintragungsdatum)\n\n01012 Telecom GmbH\nGesellschaft mit beschränkter Haftung\nKöln\n\nDen Gläubigern der an der Verschmelzung beteiligten Rechtsträger ist, wenn sie binnen sechs Monaten nach dem Tag, an dem die Eintragung der Verschmelzung in das Register des Sitzes desjenigen Rechtsträgers, dessen Gläubiger sie sind, nach § 19 Absatz 3 UmwG als bekanntgemacht gilt, ihren Anspruch nach Grund und Höhe schriftlich anmelden, Sicherheit zu leisten, soweit sie nicht Befriedigung verlangen können. Dieses Recht steht den Gläubigern jedoch nur zu, wenn sie glaubhaft machen, dass durch die Verschmelzung die Erfüllung ihrer Forderung gefährdet wird."
    },
    {
      "date": "2025-07-11",
      "id": "115602",
      "original_text": "Registerbekanntmachung nach dem Umwandlungsgesetz\nNordrhein-Westfalen Amtsgericht Köln HRB 71908\n01052 Communication GmbH – Köln",
      "type": "Registerbekanntmachung nach dem Umwandlungsgesetz",
      "state": "Nordrhein-Westfalen",
      "amtsgericht": "Amtsgericht Köln",
      "registernummer": "HRB 71908",
      "registerart": "HRB",
      "company_name": "01052 Communication GmbH",
      "company_seat": "Köln",
      "details": "11.07.2025 (Bekanntmachungsdatum)\n\nNordrhein-Westfalen Amtsgericht Köln HRB 71908\nRegisterbekanntmachung nach dem Umwandlungsgesetz 11.07.2025 (Eintragungsdatum)\n\n01052 Communication GmbH\nGesellschaft mit beschränkter Haftung\nKöln\n\nDen Gläubigern der an der Verschmelzung beteiligten Rechtsträger ist, wenn sie binnen sechs Monaten nach dem Tag, an dem die Eintragung der Verschmelzung in das Register des Sitzes desjenigen Rechtsträgers, dessen Gläubiger sie sind, nach § 19 Absatz 3 UmwG als bekanntgemacht gilt, ihren Anspruch nach Grund und Höhe schriftlich anmelden, Sicherheit zu leisten, soweit sie nicht Befriedigung verlangen können. Dieses Recht steht den Gläubigern jedoch nur zu, wenn sie glaubhaft machen, dass durch die Verschmelzung die Erfüllung ihrer Forderung gefährdet wird."
    },
    {
      "date": "2025-07-11",
      "id": "115603",
      "original_text": "Registerbekanntmachung nach dem Umwandlungsgesetz\nNordrhein-Westfalen Amtsgericht Wuppertal HRA 22518\nSchmahl Grundstücks GmbH + Co. KG – Velbert",
      "type": "Registerbekanntmachung nach dem Umwandlungsgesetz",
      "state": "Nordrhein-Westfalen",
      "amtsgericht": "Amtsgericht Wuppertal",
      "registernummer": "HRA 22518",
      "registerart": "HRA",
      "company_name": "Schmahl Grundstücks GmbH + Co. KG",
      "company_seat": "Velbert",
      "details": "11.07.2025 (Bekanntmachungsdatum)\n\nNordrhein-Westfalen Amtsgericht Wuppertal HRA 22518\nRegisterbekanntmachung nach dem Umwandlungsgesetz 11.07.2025 (Eintragungsdatum)\n\nSchmahl Grundstücks GmbH + Co. KG\nKommanditgesellschaft\nVelbert\n\nDen Gläubigern der an der Verschmelzung beteiligten Rechtsträger ist, wenn sie binnen sechs Monaten nach dem Tag, an dem die Eintragung der Verschmelzung in das Register des Sitzes desjenigen Rechtsträgers, dessen Gläubiger sie sind, nach § 19 Absatz 3 UmwG als bekanntgemacht gilt, ihren Anspruch nach Grund und Höhe schriftlich anmelden, Sicherheit zu leisten, soweit sie nicht Befriedigung verlangen können. Dieses Recht steht den Gläubigern jedoch nur zu, wenn sie glaubhaft machen, dass durch die Verschmelzung die Erfüllung ihrer Forderung gefährdet wird."
    },
    {
      "date": "2025-07-11",
      "id": "115604",
      "original_text": "Registerbekanntmachung nach dem Umwandlungsgesetz\nNordrhein-Westfalen Amtsgericht Köln HRB 51562\nMEDFACILITIES GmbH – Köln",
      "type": "Registerbekanntmachung nach dem Umwandlungsgesetz",
      "state": "Nordrhein-Westfalen",
      "amtsgericht": "Amtsgericht Köln",
      "registernummer": "HRB 51562",
      "registerart": "HRB",
      "company_name": "MEDFACILITIES GmbH",
      "company_seat": "Köln",
      "details": "11.07.2025 (Bekanntmachungsdatum)\n\nNordrhein-Westfalen Amtsgericht Köln HRB 51562\nRegisterbekanntmachung nach dem Umwandlungsgesetz 11.07.2025 (Eintragungsdatum)\n\nMEDFACILITIES GmbH\nGesellschaft mit beschränkter Haftung\nKöln\n\nDen Gläubigern der an der Verschmelzung beteiligten Rechtsträger ist, wenn sie binnen sechs Monaten nach dem Tag, an dem die Eintragung der Verschmelzung in das Register des Sitzes desjenigen Rechtsträgers, dessen Gläubiger sie sind, nach § 19 Absatz 3 UmwG als bekanntgemacht gilt, ihren Anspruch nach Grund und Höhe schriftlich anmelden, Sicherheit zu leisten, soweit sie nicht Befriedigung verlangen können. Dieses Recht steht den Gläubigern jedoch nur zu, wenn sie glaubhaft machen, dass durch die Verschmelzung die Erfüllung ihrer Forderung gefährdet wird."
    },
    {
      "date": "2025-07-11",
      "id": "115605",
      "original_text": "Einreichung neuer Dokumente\nNordrhein-Westfalen Amtsgericht Duisburg HRB 4\nHAMBORNER REIT AG – Duisburg",
      "type": "Einreichung neuer Dokumente",
      "state": "Nordrhein-Westfalen",
      "amtsgericht": "Amtsgericht Duisburg",
      "registernummer": "HRB 4",
      "registerart": "HRB",
      "company_name": "HAMBORNER REIT AG",
      "company_seat": "Duisburg",
      "details": "11.07.2025 (Bekanntmachungsdatum)\n\nNordrhein-Westfalen Amtsgericht Duisburg HRB 4\nEinreichung neuer Dokumente 11.07.2025 (Eintragungsdatum)\n\nHAMBORNER REIT AG\nAktiengesellschaft\nDuisburg\n\nDem Registergericht ist eine Liste der Mitglieder des Aufsichtsrates eingereicht worden."
    },
    {
      "date": "2025-07-11",
      "id": "115606",
      "original_text": "Einreichung neuer Dokumente\nNordrhein-Westfalen Amtsgericht Bochum HRB 7956 früher Amtsgericht Witten\nBauunternehmen Stracke GmbH – Witten",
      "type": "Einreichung neuer Dokumente",
      "state": "Nordrhein-Westfalen",
      "amtsgericht": "Amtsgericht Bochum",
      "registernummer": "HRB 7956",
      "registerart": "HRB",
      "company_name": "Bauunternehmen Stracke GmbH",
      "company_seat": "Witten",
      "former_amtsgericht": "Witten",
      "details": "11.07.2025 (Bekanntmachungsdatum)\n\nNordrhein-Westfalen Amtsgericht Bochum HRB 7956 früher Amtsgericht Witten\nEinreichung neuer Dokumente 10.07.2025 (Eintragungsdatum)\n\nBauunternehmen Stracke GmbH\nGesellschaft mit beschränkter Haftung\nWitten\n\nAls nicht eingetragen wird veröffentlicht: Den Gläubigern der Gesellschaft, deren Forderungen begründet worden sind bevor die Eintragung der Beendigung des Ergebnisabführungsvertrages  in das Handelsregister nach § 10 des Handelsgesetzbuches als bekanntgemacht gilt, hat der andere Vertragsteil Sicherheit zu leisten, wenn sie sich binnen sechs Monaten nach der Bekanntmachung der Eintragung zu diesem Zweck bei ihm melden."
    },
    {
      "date": "2025-07-11",
      "id": "115607",
      "original_text": "Löschungsankündigung\nNordrhein-Westfalen Amtsgericht Neuss VR 3140\nMiteinander e.V. – Neuss",
      "type": "Löschungsankündigung",
      "state": "Nordrhein-Westfalen",
      "amtsgericht": "Amtsgericht Neuss",
      "registernummer": "VR 3140",
      "registerart": "VR",
      "company_name": "Miteinander e.V.",
      "company_seat": "Neuss",
      "details": "11.07.2025 (Bekanntmachungsdatum)\n\nNordrhein-Westfalen Amtsgericht Neuss VR 3140\nLöschungsankündigung 09.07.2025 (Eintragungsdatum)\n\nMiteinander e.V.\neingetragener Verein\nNeuss\n\nDas Registergericht beabsichtigt, den im Vereinsregister eingetragenen Verein gemäß § 395 FamFG im Vereinsregister zu löschen. Gegen die Löschung kann binnen eines Monats jeder Widerspruch erheben, der an der Unterlassung der Löschung ein berechtigtes Interesse hat."
    },
    {
      "date": "2025-07-11",
      "id": "115608",
      "original_text": "Registerbekanntmachung nach dem Umwandlungsgesetz\nNordrhein-Westfalen Amtsgericht Köln HRB 63649\n01098 Telecom GmbH – Köln",
      "type": "Registerbekanntmachung nach dem Umwandlungsgesetz",
      "state": "Nordrhein-Westfalen",
      "amtsgericht": "Amtsgericht Köln",
      "registernummer": "HRB 63649",
      "registerart": "HRB",
      "company_name": "01098 Telecom GmbH",
      "company_seat": "Köln",
      "details": "11.07.2025 (Bekanntmachungsdatum)\n\nNordrhein-Westfalen Amtsgericht Köln HRB 63649\nRegisterbekanntmachung nach dem Umwandlungsgesetz 11.07.2025 (Eintragungsdatum)\n\n01098 Telecom GmbH\nGesellschaft mit beschränkter Haftung\nKöln\n\nDen Gläubigern der an der Verschmelzung beteiligten Rechtsträger ist, wenn sie binnen sechs Monaten nach dem Tag, an dem die Eintragung der Verschmelzung in das Register des Sitzes desjenigen Rechtsträgers, dessen Gläubiger sie sind, nach § 19 Absatz 3 UmwG als bekanntgemacht gilt, ihren Anspruch nach Grund und Höhe schriftlich anmelden, Sicherheit zu leisten, soweit sie nicht Befriedigung verlangen können. Dieses Recht steht den Gläubigern jedoch nur zu, wenn sie glaubhaft machen, dass durch die Verschmelzung die Erfüllung ihrer Forderung gefährdet wird."
    },
    {
      "date": "2025-07-11",
      "id": "115609",
      "original_text": "Löschungsankündigung\nNordrhein-Westfalen Amtsgericht Neuss HRB 18141\nVISION 3000 enterprises GmbH – Kaarst",
      "type": "Löschungsankündigung",
      "state": "Nordrhein-Westfalen",
      "amtsgericht": "Amtsgericht Neuss",
      "registernummer": "HRB 18141",
      "registerart": "HRB",
      "company_name": "VISION 3000 enterprises GmbH",
      "company_seat": "Kaarst",
      "details": "11.07.2025 (Bekanntmachungsdatum)\n\nNordrhein-Westfalen Amtsgericht Neuss HRB 18141\nLöschungsankündigung 08.07.2025 (Eintragungsdatum)\n\nVISION 3000 enterprises GmbH\nGesellschaft mit beschränkter Haftung\nKaarst\n\nDas Registergericht beabsichtigt die Gesellschaft wegen Vermögenslosigkeit aufgrund des § 394 Abs. 1 FamFG zu löschen. Frist zur Geltendmachung eines Widerspruchs: 1 Monat.\nRechtsbehelfsbelehrung:\nGegen diese Verfügung können Sie Widerspruch einlegen.\nDer Widerspruch ist bei dem Amtsgericht Neuss - Registergericht -, Breite Str. 48, 41460 Neuss schriftlich in deutscher Sprache oder zur Niederschrift der Geschäftsstelle einzulegen.\nDer Widerspruch kann auch zur Niederschrift der Geschäftsstelle eines jeden Amtsgerichtes abgegeben werden.\nDie Einlegung ist auch durch Übertragung eines elektronischen Dokuments an die elektronische Poststelle des Gerichts möglich. Das elektronische Dokument muss für die Bearbeitung durch das Gericht geeignet und mit einer qualifizierten elektronischen Signatur der verantwortenden Person versehen sein oder von der verantwortenden Person signiert und auf einem sicheren Übermittlungsweg gemäß § 130a ZPO nach näherer Maßgabe der Verordnung über die technischen Rahmenbedingungen des elektronischen Rechtsverkehrs und über das besondere elektronische Behördenpostfach (BGBl. I, S.3803) eingereicht werden. Weitere Informationen erhalten Sie auf der Internetseite www.justiz.de.\nDer Widerspruch muss spätestens innerhalb der gesetzten Frist nach der schriftlichen Bekanntgabe der Verfügung bei dem Amtsgericht - Registergericht - Neuss eingegangen sein. Dies gilt auch dann, wenn der Widerspruch zur Niederschrift der Geschäftsstelle eines anderen Amtsgerichtes abgegeben wurde. Die Frist beginnt mit der schriftlichen Bekanntgabe der Verfügung. Die Bekanntgabe ist entweder durch Zustellung oder am dritten Tage nach Aufgabe zur Post bewirkt. Fällt das Ende der Frist auf einen Sonntag, einen allgemeinen Feiertag oder Sonnabend, so endet die Frist mit Ablauf des nächsten Werktages.\nDer Widerspruch muss die Bezeichnung der angefochtenen Verfügung sowie die Erklärung enthalten, dass Widerspruch gegen diese Verfügung eingelegt wird. Er ist zu unterzeichnen und soll begründet werden."
    },
    {
      "date": "2025-07-11",
      "id": "115610",
      "original_text": "Löschungsankündigung\nNordrhein-Westfalen Amtsgericht Kleve HRB 15015\nHFC Helal Food Center GmbH – Goch",
      "type": "Löschungsankündigung",
      "state": "Nordrhein-Westfalen",
      "amtsgericht": "Amtsgericht Kleve",
      "registernummer": "HRB 15015",
      "registerart": "HRB",
      "company_name": "HFC Helal Food Center GmbH",
      "company_seat": "Goch",
      "details": "11.07.2025 (Bekanntmachungsdatum)\n\nNordrhein-Westfalen Amtsgericht Kleve HRB 15015\nLöschungsankündigung\n\nHFC Helal Food Center GmbH\nGesellschaft mit beschränkter Haftung\nGoch\n\nDas Registergericht beabsichtigt die Gesellschaft von Amts wegen nach § 394 FamFG zu löschen. Die Frist zur Erhebung eines Widerspruchs ist auf einen Monat festgesetzt."
    },
    {
      "date": "2025-07-11",
      "id": "115611",
      "original_text": "Registerbekanntmachung nach dem Umwandlungsgesetz\nNordrhein-Westfalen Amtsgericht Essen HRB 34091\nSalvaCors AG – Essen",
      "type": "Registerbekanntmachung nach dem Umwandlungsgesetz",
      "state": "Nordrhein-Westfalen",
      "amtsgericht": "Amtsgericht Essen",
      "registernummer": "HRB 34091",
      "registerart": "HRB",
      "company_name": "SalvaCors AG",
      "company_seat": "Essen",
      "details": "11.07.2025 (Bekanntmachungsdatum)\n\nNordrhein-Westfalen Amtsgericht Essen HRB 34091\nRegisterbekanntmachung nach dem Umwandlungsgesetz 11.07.2025 (Eintragungsdatum)\n\nSalvaCors AG\nAktiengesellschaft\nEssen\n\nDen Gläubigern der an der formwechselnden Umwandlung beteiligten Rechtsträger ist, wenn sie binnen sechs Monaten nach dem Tag, an dem die Eintragung der formwechselnden Umwandlung in das Register des Sitzes desjenigen Rechtsträgers, dessen Gläubiger sie sind, nach § 19 Absatz 3 UmwG als bekanntgemacht gilt, ihren Anspruch nach Grund und Höhe schriftlich anmelden, Sicherheit zu leisten, soweit sie nicht Befriedigung verlangen können. Dieses Recht steht den Gläubigern jedoch nur zu, wenn sie glaubhaft machen, dass durch die formwechselnden Umwandlung die Erfüllung ihrer Forderung gefährdet wird."
    },
    {
      "date": "2025-07-11",
      "id": "115612",
      "original_text": "Registerbekanntmachung nach dem Umwandlungsgesetz\nNordrhein-Westfalen Amtsgericht Wuppertal HRA 23551\nM. Charter GmbH & Co. KG – Wuppertal",
      "type": "Registerbekanntmachung nach dem Umwandlungsgesetz",
      "state": "Nordrhein-Westfalen",
      "amtsgericht": "Amtsgericht Wuppertal",
      "registernummer": "HRA 23551",
      "registerart": "HRA",
      "company_name": "M. Charter GmbH & Co. KG",
      "company_seat": "Wuppertal",
      "details": "11.07.2025 (Bekanntmachungsdatum)\n\nNordrhein-Westfalen Amtsgericht Wuppertal HRA 23551\nRegisterbekanntmachung nach dem Umwandlungsgesetz 11.07.2025 (Eintragungsdatum)\n\nM. Charter GmbH & Co. KG\nKommanditgesellschaft\nWuppertal\n\nDen Gläubigern der an der Verschmelzung beteiligten Rechtsträger ist, wenn sie binnen sechs Monaten nach dem Tag, an dem die Eintragung der Verschmelzung in das Register des Sitzes desjenigen Rechtsträgers, dessen Gläubiger sie sind, nach § 19 Absatz 3 UmwG als bekanntgemacht gilt, ihren Anspruch nach Grund und Höhe schriftlich anmelden, Sicherheit zu leisten, soweit sie nicht Befriedigung verlangen können. Dieses Recht steht den Gläubigern jedoch nur zu, wenn sie glaubhaft machen, dass durch die Verschmelzung die Erfüllung ihrer Forderung gefährdet wird."
    },
    {
      "date": "2025-07-11",
      "id": "115613",
      "original_text": "Löschungsankündigung\nNordrhein-Westfalen Amtsgericht Dortmund HRB 26398\nAllgemeines Netzwerk für Ingenieure und Architekten GmbH – Dortmund",
      "type": "Löschungsankündigung",
      "state": "Nordrhein-Westfalen",
      "amtsgericht": "Amtsgericht Dortmund",
      "registernummer": "HRB 26398",
      "registerart": "HRB",
      "company_name": "Allgemeines Netzwerk für Ingenieure und Architekten GmbH",
      "company_seat": "Dortmund",
      "details": "11.07.2025 (Bekanntmachungsdatum)\n\nNordrhein-Westfalen Amtsgericht Dortmund HRB 26398\nLöschungsankündigung 11.07.2025 (Eintragungsdatum)\n\nAllgemeines Netzwerk für Ingenieure und Architekten GmbH\nGesellschaft mit beschränkter Haftung\nDortmund\n\nDas Registergericht beabsichtigt die Gesellschaft von Amts wegen nach § 394 FamFG zu löschen. Die Frist zur Erhebung eines Widerspruchs ist auf zwei Monate festgesetzt."
    },
    {
      "date": "2025-07-11",
      "id": "115614",
      "original_text": "Registerbekanntmachung nach dem Umwandlungsgesetz\nNordrhein-Westfalen Amtsgericht Essen HRB 36499\nCONDOR Solutions GmbH – Essen",
      "type": "Registerbekanntmachung nach dem Umwandlungsgesetz",
      "state": "Nordrhein-Westfalen",
      "amtsgericht": "Amtsgericht Essen",
      "registernummer": "HRB 36499",
      "registerart": "HRB",
      "company_name": "CONDOR Solutions GmbH",
      "company_seat": "Essen",
      "details": "11.07.2025 (Bekanntmachungsdatum)\n\nNordrhein-Westfalen Amtsgericht Essen HRB 36499\nRegisterbekanntmachung nach dem Umwandlungsgesetz 11.07.2025 (Eintragungsdatum)\n\nCONDOR Solutions GmbH\nGesellschaft mit beschränkter Haftung\nEssen\n\nDen Gläubigern der an der Abspaltung beteiligten Rechtsträger ist, wenn sie binnen sechs Monaten nach dem Tag, an dem die Eintragung der Abspaltung in das Register des Sitzes desjenigen Rechtsträgers, dessen Gläubiger sie sind, nach § 19 Absatz 3 UmwG als bekanntgemacht gilt, ihren Anspruch nach Grund und Höhe schriftlich anmelden, Sicherheit zu leisten, soweit sie nicht Befriedigung verlangen können. Dieses Recht steht den Gläubigern jedoch nur zu, wenn sie glaubhaft machen, dass durch die Abspaltung die Erfüllung ihrer Forderung gefährdet wird."
    },
    {
      "date": "2025-07-11",
      "id": "115615",
      "original_text": "Registerbekanntmachung nach dem Umwandlungsgesetz\nNordrhein-Westfalen Amtsgericht Köln HRB 64650\n010052 Telecom GmbH – Köln",
      "type": "Registerbekanntmachung nach dem Umwandlungsgesetz",
      "state": "Nordrhein-Westfalen",
      "amtsgericht": "Amtsgericht Köln",
      "registernummer": "HRB 64650",
      "registerart": "HRB",
      "company_name": "010052 Telecom GmbH",
      "company_seat": "Köln",
      "details": "11.07.2025 (Bekanntmachungsdatum)\n\nNordrhein-Westfalen Amtsgericht Köln HRB 64650\nRegisterbekanntmachung nach dem Umwandlungsgesetz 11.07.2025 (Eintragungsdatum)\n\n010052 Telecom GmbH\nGesellschaft mit beschränkter Haftung\nKöln\n\nDen Gläubigern der an der Verschmelzung beteiligten Rechtsträger ist, wenn sie binnen sechs Monaten nach dem Tag, an dem die Eintragung der Verschmelzung in das Register des Sitzes desjenigen Rechtsträgers, dessen Gläubiger sie sind, nach § 19 Absatz 3 UmwG als bekanntgemacht gilt, ihren Anspruch nach Grund und Höhe schriftlich anmelden, Sicherheit zu leisten, soweit sie nicht Befriedigung verlangen können. Dieses Recht steht den Gläubigern jedoch nur zu, wenn sie glaubhaft machen, dass durch die Verschmelzung die Erfüllung ihrer Forderung gefährdet wird."
    },
    {
      "date": "2025-07-11",
      "id": "115616",
      "original_text": "Löschungsankündigung\nNordrhein-Westfalen Amtsgericht Köln HRB 13794\nDAMMAS Pharma GmbH – Köln",
      "type": "Löschungsankündigung",
      "state": "Nordrhein-Westfalen",
      "amtsgericht": "Amtsgericht Köln",
      "registernummer": "HRB 13794",
      "registerart": "HRB",
      "company_name": "DAMMAS Pharma GmbH",
      "company_seat": "Köln",
      "details": "11.07.2025 (Bekanntmachungsdatum)\n\nNordrhein-Westfalen Amtsgericht Köln HRB 13794\nLöschungsankündigung\n\nDAMMAS Pharma GmbH\nGesellschaft mit beschränkter Haftung\nKöln\n\nDas Registergericht beabsichtigt die Gesellschaft von Amts wegen nach § 394 FamFG zu löschen. Die Frist zur Erhebung eines Widerspruchs ist auf einen Monat festgesetzt."
    },
    {
      "date": "2025-07-11",
      "id": "115617",
      "original_text": "Registerbekanntmachung nach dem Umwandlungsgesetz\nNordrhein-Westfalen Amtsgericht Köln HRB 101839\nedigo Verlag GmbH – Köln",
      "type": "Registerbekanntmachung nach dem Umwandlungsgesetz",
      "state": "Nordrhein-Westfalen",
      "amtsgericht": "Amtsgericht Köln",
      "registernummer": "HRB 101839",
      "registerart": "HRB",
      "company_name": "edigo Verlag GmbH",
      "company_seat": "Köln",
      "details": "11.07.2025 (Bekanntmachungsdatum)\n\nNordrhein-Westfalen Amtsgericht Köln HRB 101839\nRegisterbekanntmachung nach dem Umwandlungsgesetz 11.07.2025 (Eintragungsdatum)\n\nedigo Verlag GmbH\nGesellschaft mit beschränkter Haftung\nKöln\n\nDen Gläubigern der an der Verschmelzung beteiligten Rechtsträger ist, wenn sie binnen sechs Monaten nach dem Tag, an dem die Eintragung der Verschmelzung in das Register des Sitzes desjenigen Rechtsträgers, dessen Gläubiger sie sind, nach § 19 Absatz 3 UmwG als bekanntgemacht gilt, ihren Anspruch nach Grund und Höhe schriftlich anmelden, Sicherheit zu leisten, soweit sie nicht Befriedigung verlangen können. Dieses Recht steht den Gläubigern jedoch nur zu, wenn sie glaubhaft machen, dass durch die Verschmelzung die Erfüllung ihrer Forderung gefährdet wird.\n\nAls nicht eingetragen wird veröffentlicht: Den Gläubigern der Gesellschaft, deren Forderungen begründet worden sind bevor die Eintragung der Beendigung des Gewinnabführungsvertrages  in das Handelsregister nach § 10 des Handelsgesetzbuches als bekanntgemacht gilt, hat der andere Vertragsteil Sicherheit zu leisten, wenn sie sich binnen sechs Monaten nach der Bekanntmachung der Eintragung zu diesem Zweck bei ihm melden."
    },
    {
      "date": "2025-07-11",
      "id": "115618",
      "original_text": "Einreichung neuer Dokumente\nNordrhein-Westfalen Amtsgericht Bonn HRB 15257\nScopevisio AG – Bonn",
      "type": "Einreichung neuer Dokumente",
      "state": "Nordrhein-Westfalen",
      "amtsgericht": "Amtsgericht Bonn",
      "registernummer": "HRB 15257",
      "registerart": "HRB",
      "company_name": "Scopevisio AG",
      "company_seat": "Bonn",
      "details": "11.07.2025 (Bekanntmachungsdatum)\n\nNordrhein-Westfalen Amtsgericht Bonn HRB 15257\nEinreichung neuer Dokumente\n\nScopevisio AG\nAktiengesellschaft\nBonn\n\nDem Registergericht ist eine neue Liste der Mitglieder des Aufsichtsrates eingereicht worden."
    },
    {
      "date": "2025-07-11",
      "id": "115619",
      "original_text": "Löschungsankündigung\nHessen Amtsgericht Frankfurt am Main HRB 111918\nTriple C Games UG (haftungsbeschränkt) – Frankfurt am Main",
      "type": "Löschungsankündigung",
      "state": "Hessen",
      "amtsgericht": "Amtsgericht Frankfurt am Main",
      "registernummer": "HRB 111918",
      "registerart": "HRB",
      "company_name": "Triple C Games UG (haftungsbeschränkt)",
      "company_seat": "Frankfurt am Main",
      "details": "11.07.2025 (Bekanntmachungsdatum)\n\nHessen Amtsgericht Frankfurt am Main HRB 111918\nLöschungsankündigung\n\nTriple C Games UG (haftungsbeschränkt)\nGesellschaft mit beschränkter Haftung\nFrankfurt am Main\n\nDas Registergericht beabsichtigt die im Handelsregister eingetragene Gesellschaft von Amts wegen nach § 394 FamFG zu löschen. Die Frist zur Erhebung eines Widerspruchs gegen die beabsichtigte Löschung wird auf 3 Monate festgesetzt."
    },
    {
      "date": "2025-07-11",
      "id": "115620",
      "original_text": "Einreichung neuer Dokumente\nHessen Amtsgericht Gießen HRB 12108\nSoftTech Digital AG – Hungen",
      "type": "Einreichung neuer Dokumente",
      "state": "Hessen",
      "amtsgericht": "Amtsgericht Gießen",
      "registernummer": "HRB 12108",
      "registerart": "HRB",
      "company_name": "SoftTech Digital AG",
      "company_seat": "Hungen",
      "details": "11.07.2025 (Bekanntmachungsdatum)\n\nHessen Amtsgericht Gießen HRB 12108\nEinreichung neuer Dokumente\n\nSoftTech Digital AG\nAktiengesellschaft\nHungen\n\nDurch eine Änderung in den Personen der Aufsichtsratsmitglieder ist eine Liste der Mitglieder des Aufsichtsrates zum Handelsregister eingereicht worden."
    },
    {
      "date": "2025-07-11",
      "id": "115621",
      "original_text": "Löschungsankündigung\nHessen Amtsgericht Frankfurt am Main HRB 42626\nProAudio Kontakt Medientechnologie GmbH – Frankfurt am Main",
      "type": "Löschungsankündigung",
      "state": "Hessen",
      "amtsgericht": "Amtsgericht Frankfurt am Main",
      "registernummer": "HRB 42626",
      "registerart": "HRB",
      "company_name": "ProAudio Kontakt Medientechnologie GmbH",
      "company_seat": "Frankfurt am Main",
      "details": "11.07.2025 (Bekanntmachungsdatum)\n\nHessen Amtsgericht Frankfurt am Main HRB 42626\nLöschungsankündigung 11.07.2025 (Eintragungsdatum)\n\nProAudio Kontakt Medientechnologie GmbH\nGesellschaft mit beschränkter Haftung\nFrankfurt am Main\n\nDas Registergericht beabsichtigt die im Handelsregister eingetragene Gesellschaft von Amts wegen nach § 394 FamFG zu löschen. Die Frist zur Erhebung eines Widerspruchs gegen die beabsichtigte Löschung wird auf 1 Monat festgesetzt."
    },
    {
      "date": "2025-07-11",
      "id": "115622",
      "original_text": "Löschungsankündigung\nHessen Amtsgericht Darmstadt HRB 21115\n3 K - Büromöbel Gesellschaft mit beschränkter Haftung – Lorsch",
      "type": "Löschungsankündigung",
      "state": "Hessen",
      "amtsgericht": "Amtsgericht Darmstadt",
      "registernummer": "HRB 21115",
      "registerart": "HRB",
      "company_name": "3 K - Büromöbel Gesellschaft mit beschränkter Haftung",
      "company_seat": "Lorsch",
      "details": "11.07.2025 (Bekanntmachungsdatum)\n\nHessen Amtsgericht Darmstadt HRB 21115\nLöschungsankündigung\n\n3 K - Büromöbel Gesellschaft mit beschränkter Haftung\nGesellschaft mit beschränkter Haftung\nLorsch\n\nDas Registergericht beabsichtigt die im Handelsregister eingetragene Gesellschaft von Amts wegen nach § 394 FamFG zu löschen. Die Frist zur Erhebung eines Widerspruchs gegen die beabsichtigte Löschung wird auf 3 Monate festgesetzt."
    },
    {
      "date": "2025-07-11",
      "id": "115623",
      "original_text": "Registerbekanntmachung nach dem Umwandlungsgesetz\nHessen Amtsgericht Königstein VR 781\nGesundheit für Alle. Kelkheimer Verein für Bewegungstherapie und Herzsport e.V. – Kelkheim (Taunus)",
      "type": "Registerbekanntmachung nach dem Umwandlungsgesetz",
      "state": "Hessen",
      "amtsgericht": "Amtsgericht Königstein",
      "registernummer": "VR 781",
      "registerart": "VR",
      "company_name": "Gesundheit für Alle. Kelkheimer Verein für Bewegungstherapie und Herzsport e.V.",
      "company_seat": "Kelkheim (Taunus)",
      "details": "11.07.2025 (Bekanntmachungsdatum)\n\nHessen Amtsgericht Königstein VR 781\nRegisterbekanntmachung nach dem Umwandlungsgesetz 11.07.2025 (Eintragungsdatum)\n\nGesundheit für Alle. Kelkheimer Verein für Bewegungstherapie und Herzsport e.V.\neingetragener Verein\nKelkheim (Taunus)\n\nDen Gläubigern der an der Verschmelzung beteiligten Rechtsträger ist, wenn sie binnen sechs Monaten nach dem Tag, an dem die Eintragung der Verschmelzung in das Register des Sitzes derjenigen Rechtsträger deren Gläubiger sie sind, nach § 19 Absatz 3 UmwG bekannt gemacht worden ist, ihren Anspruch nach Grund und Höhe schriftlich anmelden, Sicherheit zu leisten, soweit sie nicht Befriedigung verlangen können. Dieses Recht steht den Gläubigern jedoch nur zu, wenn sie glaubhaft machen, dass durch die Verschmelzung die Erfüllung ihrer Forderung gefährdet wird."
    },
    {
      "date": "2025-07-11",
      "id": "115624",
      "original_text": "Registerbekanntmachung nach dem Umwandlungsgesetz\nHessen Amtsgericht Offenbach am Main HRB 53074\nIBB Logistik GmbH – Offenbach am Main",
      "type": "Registerbekanntmachung nach dem Umwandlungsgesetz",
      "state": "Hessen",
      "amtsgericht": "Amtsgericht Offenbach am Main",
      "registernummer": "HRB 53074",
      "registerart": "HRB",
      "company_name": "IBB Logistik GmbH",
      "company_seat": "Offenbach am Main",
      "details": "11.07.2025 (Bekanntmachungsdatum)\n\nHessen Amtsgericht Offenbach am Main HRB 53074\nRegisterbekanntmachung nach dem Umwandlungsgesetz 11.07.2025 (Eintragungsdatum)\n\nIBB Logistik GmbH\nGesellschaft mit beschränkter Haftung\nOffenbach am Main\n\nDen Gläubigern der an der Verschmelzung beteiligten Rechtsträger ist, wenn sie binnen sechs Monaten nach dem Tag, an dem die Eintragung der Verschmelzung in das Register des Sitzes desjenigen Rechtsträgers, dessen Gläubiger sie sind, nach § 19 Absatz 3 UmwG bekannt gemacht worden ist, ihren Anspruch nach Grund und Höhe schriftlich anmelden, Sicherheit zu leisten, soweit sie nicht Befriedigung verlangen können. Dieses Recht steht den Gläubigern jedoch nur zu, wenn sie glaubhaft machen, dass durch die Verschmelzung die Erfüllung ihrer Forderung gefährdet wird."
    },
    {
      "date": "2025-07-11",
      "id": "115625",
      "original_text": "Löschungsankündigung\nHessen Amtsgericht Frankfurt am Main HRB 105766\nPark + Lager UG (haftungsbeschränkt) – Frankfurt am Main",
      "type": "Löschungsankündigung",
      "state": "Hessen",
      "amtsgericht": "Amtsgericht Frankfurt am Main",
      "registernummer": "HRB 105766",
      "registerart": "HRB",
      "company_name": "Park + Lager UG (haftungsbeschränkt)",
      "company_seat": "Frankfurt am Main",
      "details": "11.07.2025 (Bekanntmachungsdatum)\n\nHessen Amtsgericht Frankfurt am Main HRB 105766\nLöschungsankündigung 11.07.2025 (Eintragungsdatum)\n\nPark + Lager UG (haftungsbeschränkt)\nGesellschaft mit beschränkter Haftung\nFrankfurt am Main\n\nDas Registergericht beabsichtigt die im Handelsregister eingetragene Gesellschaft von Amts wegen nach § 394 FamFG zu löschen. Die Frist zur Erhebung eines Widerspruchs gegen die beabsichtigte Löschung wird auf 1 Monat festgesetzt."
    },
    {
      "date": "2025-07-11",
      "id": "115626",
      "original_text": "Registerbekanntmachung nach dem Umwandlungsgesetz\nHessen Amtsgericht Offenbach am Main HRB 54996\nIBB Personaldienstleistungen GmbH – Offenbach am Main",
      "type": "Registerbekanntmachung nach dem Umwandlungsgesetz",
      "state": "Hessen",
      "amtsgericht": "Amtsgericht Offenbach am Main",
      "registernummer": "HRB 54996",
      "registerart": "HRB",
      "company_name": "IBB Personaldienstleistungen GmbH",
      "company_seat": "Offenbach am Main",
      "details": "11.07.2025 (Bekanntmachungsdatum)\n\nHessen Amtsgericht Offenbach am Main HRB 54996\nRegisterbekanntmachung nach dem Umwandlungsgesetz 11.07.2025 (Eintragungsdatum)\n\nIBB Personaldienstleistungen GmbH\nGesellschaft mit beschränkter Haftung\nOffenbach am Main\n\nDen Gläubigern der an der Verschmelzung beteiligten Rechtsträger ist, wenn sie binnen sechs Monaten nach dem Tag, an dem die Eintragung der Verschmelzung in das Register des Sitzes desjenigen Rechtsträgers, dessen Gläubiger sie sind, nach § 19 Absatz 3 UmwG bekannt gemacht worden ist, ihren Anspruch nach Grund und Höhe schriftlich anmelden, Sicherheit zu leisten, soweit sie nicht Befriedigung verlangen können. Dieses Recht steht den Gläubigern jedoch nur zu, wenn sie glaubhaft machen, dass durch die Verschmelzung die Erfüllung ihrer Forderung gefährdet wird."
    },
    {
      "date": "2025-07-11",
      "id": "115627",
      "original_text": "Löschungsankündigung\nHessen Amtsgericht Gießen HRB 11663\nBesnik Bau GmbH – Allendorf",
      "type": "Löschungsankündigung",
      "state": "Hessen",
      "amtsgericht": "Amtsgericht Gießen",
      "registernummer": "HRB 11663",
      "registerart": "HRB",
      "company_name": "Besnik Bau GmbH",
      "company_seat": "Allendorf",
      "details": "11.07.2025 (Bekanntmachungsdatum)\n\nHessen Amtsgericht Gießen HRB 11663\nLöschungsankündigung\n\nBesnik Bau GmbH\nGesellschaft mit beschränkter Haftung\nAllendorf\n\nEs ist beabsichtigt, die Gesellschaft wegen Vermögenslosigkeit gemäß § 394 FamFG von Amts wegen zu löschen. Hiergegen kann innerhalb von drei Monaten nach dieser Veröffentlichung Widerspruch beim Amtsgericht Gießen eingelegt werden. Sollte Widerspruch eingelegt werden, dürfte dies nur mit Begründung erfolgversprechend sein. Insbesondere sollte vorhandenes Vermögen der Gesellschaft innerhalb der genannten Frist nachgewiesen werden."
    },
    {
      "date": "2025-07-11",
      "id": "115628",
      "original_text": "Registerbekanntmachung nach dem Umwandlungsgesetz\nHessen Amtsgericht Offenbach am Main HRB 51256\nIfM Institut für Marktdaten GmbH – Mainhausen",
      "type": "Registerbekanntmachung nach dem Umwandlungsgesetz",
      "state": "Hessen",
      "amtsgericht": "Amtsgericht Offenbach am Main",
      "registernummer": "HRB 51256",
      "registerart": "HRB",
      "company_name": "IfM Institut für Marktdaten GmbH",
      "company_seat": "Mainhausen",
      "details": "11.07.2025 (Bekanntmachungsdatum)\n\nHessen Amtsgericht Offenbach am Main HRB 51256\nRegisterbekanntmachung nach dem Umwandlungsgesetz 11.07.2025 (Eintragungsdatum)\n\nIfM Institut für Marktdaten GmbH\nGesellschaft mit beschränkter Haftung\nMainhausen\n\nDen Gläubigern der an der Verschmelzung beteiligten Rechtsträger ist, wenn sie binnen sechs Monaten nach dem Tag, an dem die Eintragung der Verschmelzung in das Register des Sitzes desjenigen Rechtsträgers, dessen Gläubiger sie sind, nach § 19 Absatz 3 UmwG bekannt gemacht worden ist, ihren Anspruch nach Grund und Höhe schriftlich anmelden, Sicherheit zu leisten, soweit sie nicht Befriedigung verlangen können. Dieses Recht steht den Gläubigern jedoch nur zu, wenn sie glaubhaft machen, dass durch die Verschmelzung die Erfüllung ihrer Forderung gefährdet wird."
    },
    {
      "date": "2025-07-11",
      "id": "115629",
      "original_text": "Löschungsankündigung\nHessen Amtsgericht Darmstadt HRB 96653\nHochstein GmbH – Bischofsheim",
      "type": "Löschungsankündigung",
      "state": "Hessen",
      "amtsgericht": "Amtsgericht Darmstadt",
      "registernummer": "HRB 96653",
      "registerart": "HRB",
      "company_name": "Hochstein GmbH",
      "company_seat": "Bischofsheim",
      "details": "11.07.2025 (Bekanntmachungsdatum)\n\nHessen Amtsgericht Darmstadt HRB 96653\nLöschungsankündigung\n\nHochstein GmbH\nGesellschaft mit beschränkter Haftung\nBischofsheim\n\nDas Registergericht beabsichtigt die im Handelsregister eingetragene Gesellschaft von Amts wegen nach § 394 FamFG zu löschen. Die Frist zur Erhebung eines Widerspruchs gegen die beabsichtigte Löschung wird auf 3 Monate festgesetzt."
    },
    {
      "date": "2025-07-11",
      "id": "115630",
      "original_text": "Registerbekanntmachung nach dem Umwandlungsgesetz\nHessen Amtsgericht Frankfurt am Main HRB 137875\nFRATAX Solution Steuerberatungsgesellschaft mbH – Frankfurt am Main",
      "type": "Registerbekanntmachung nach dem Umwandlungsgesetz",
      "state": "Hessen",
      "amtsgericht": "Amtsgericht Frankfurt am Main",
      "registernummer": "HRB 137875",
      "registerart": "HRB",
      "company_name": "FRATAX Solution Steuerberatungsgesellschaft mbH",
      "company_seat": "Frankfurt am Main",
      "details": "11.07.2025 (Bekanntmachungsdatum)\n\nHessen Amtsgericht Frankfurt am Main HRB 137875\nRegisterbekanntmachung nach dem Umwandlungsgesetz 11.07.2025 (Eintragungsdatum)\n\nFRATAX Solution Steuerberatungsgesellschaft mbH\nGesellschaft mit beschränkter Haftung\nFrankfurt am Main\n\nDen Gläubigern der an der Abspaltung beteiligten Rechtsträger ist, wenn sie binnen sechs Monaten nach dem Tag, an dem die Eintragung der Abspaltung in das Register des Sitzes desjenigen Rechtsträgers, dessen Gläubiger sie sind, nach §§ 125, 19 Absatz 3 UmwG bekannt gemacht worden ist, ihren Anspruch nach Grund und Höhe schriftlich anmelden, Sicherheit zu leisten, soweit sie nicht Befriedigung verlangen können. Dieses Recht steht den Gläubigern jedoch nur zu, wenn sie glaubhaft machen, dass durch die Abspaltung die Erfüllung ihrer Forderung gefährdet wird."
    },
    {
      "date": "2025-07-11",
      "id": "115631",
      "original_text": "Löschungsankündigung\nHessen Amtsgericht Frankfurt am Main HRB 133851\n0800 Projektentwicklung GmbH – Frankfurt am Main",
      "type": "Löschungsankündigung",
      "state": "Hessen",
      "amtsgericht": "Amtsgericht Frankfurt am Main",
      "registernummer": "HRB 133851",
      "registerart": "HRB",
      "company_name": "0800 Projektentwicklung GmbH",
      "company_seat": "Frankfurt am Main",
      "details": "11.07.2025 (Bekanntmachungsdatum)\n\nHessen Amtsgericht Frankfurt am Main HRB 133851\nLöschungsankündigung\n\n0800 Projektentwicklung GmbH\nGesellschaft mit beschränkter Haftung\nFrankfurt am Main\n\nDas Registergericht beabsichtigt die im Handelsregister eingetragene Gesellschaft von Amts wegen nach § 394 FamFG zu löschen. Die Frist zur Erhebung eines Widerspruchs gegen die beabsichtigte Löschung wird auf 1 Monat festgesetzt."
    },
    {
      "date": "2025-07-11",
      "id": "115632",
      "original_text": "Löschungsankündigung\nHessen Amtsgericht Frankfurt am Main HRB 116786\nMFF GmbH – Frankfurt am Main",
      "type": "Löschungsankündigung",
      "state": "Hessen",
      "amtsgericht": "Amtsgericht Frankfurt am Main",
      "registernummer": "HRB 116786",
      "registerart": "HRB",
      "company_name": "MFF GmbH",
      "company_seat": "Frankfurt am Main",
      "details": "11.07.2025 (Bekanntmachungsdatum)\n\nHessen Amtsgericht Frankfurt am Main HRB 116786\nLöschungsankündigung 11.07.2025 (Eintragungsdatum)\n\nMFF GmbH\nGesellschaft mit beschränkter Haftung\nFrankfurt am Main\n\nDas Registergericht beabsichtigt die im Handelsregister eingetragene Gesellschaft von Amts wegen nach § 394 FamFG zu löschen. Die Frist zur Erhebung eines Widerspruchs gegen die beabsichtigte Löschung wird auf 1 Monat festgesetzt."
    },
    {
      "date": "2025-07-11",
      "id": "115633",
      "original_text": "Einreichung neuer Dokumente\nHessen Amtsgericht Bad Homburg v.d.H. HRB 1663\nALTE LEIPZIGER Bauspar AG – Oberursel (Taunus)",
      "type": "Einreichung neuer Dokumente",
      "state": "Hessen",
      "amtsgericht": "Amtsgericht Bad Homburg v.d.H.",
      "registernummer": "HRB 1663",
      "registerart": "HRB",
      "company_name": "ALTE LEIPZIGER Bauspar AG",
      "company_seat": "Oberursel (Taunus)",
      "details": "11.07.2025 (Bekanntmachungsdatum)\n\nHessen Amtsgericht Bad Homburg v.d.H. HRB 1663\nEinreichung neuer Dokumente\n\nALTE LEIPZIGER Bauspar AG\nAktiengesellschaft\nOberursel (Taunus)\n\nDurch eine Änderung in den Personen der Aufsichtsratsmitglieder ist eine Liste der Mitglieder des Aufsichtsrates zum Handelsregister eingereicht worden."
    },
    {
      "date": "2025-07-11",
      "id": "115634",
      "original_text": "Sonstige Registerbekanntmachung\nHessen Amtsgericht Frankfurt am Main HRB 89384\nHouse of Logistics & Mobility (HOLM) GmbH – Frankfurt am Main",
      "type": "Sonstige Registerbekanntmachung",
      "state": "Hessen",
      "amtsgericht": "Amtsgericht Frankfurt am Main",
      "registernummer": "HRB 89384",
      "registerart": "HRB",
      "company_name": "House of Logistics & Mobility (HOLM) GmbH",
      "company_seat": "Frankfurt am Main",
      "details": "11.07.2025 (Bekanntmachungsdatum)\n\nHessen Amtsgericht Frankfurt am Main HRB 89384\nSonstige Registerbekanntmachung 11.07.2025 (Eintragungsdatum)\n\nHouse of Logistics & Mobility (HOLM) GmbH\nGesellschaft mit beschränkter Haftung\nFrankfurt am Main\n\nDurch eine Änderung in den Personen der Aufsichtsratsmitglieder ist eine Liste der Mitglieder des Aufsichtsrates zum Handelsregister eingereicht worden."
    },
    {
      "date": "2025-07-11",
      "id": "115635",
      "original_text": "Sonstige Registerbekanntmachung\nHessen Amtsgericht Frankfurt am Main HRB 89384\nHouse of Logistics & Mobility (HOLM) GmbH – Frankfurt am Main",
      "type": "Sonstige Registerbekanntmachung",
      "state": "Hessen",
      "amtsgericht": "Amtsgericht Frankfurt am Main",
      "registernummer": "HRB 89384",
      "registerart": "HRB",
      "company_name": "House of Logistics & Mobility (HOLM) GmbH",
      "company_seat": "Frankfurt am Main",
      "details": "11.07.2025 (Bekanntmachungsdatum)\n\nHessen Amtsgericht Frankfurt am Main HRB 89384\nSonstige Registerbekanntmachung 11.07.2025 (Eintragungsdatum)\n\nHouse of Logistics & Mobility (HOLM) GmbH\nGesellschaft mit beschränkter Haftung\nFrankfurt am Main\n\nDurch eine Änderung in den Personen der Aufsichtsratsmitglieder ist eine Liste der Mitglieder des Aufsichtsrates zum Handelsregister eingereicht worden."
    },
    {
      "date": "2025-07-11",
      "id": "115636",
      "original_text": "Registerbekanntmachung nach dem Umwandlungsgesetz\nHessen Amtsgericht Offenbach am Main HRB 45888\nANWR-Data GmbH – Mainhausen",
      "type": "Registerbekanntmachung nach dem Umwandlungsgesetz",
      "state": "Hessen",
      "amtsgericht": "Amtsgericht Offenbach am Main",
      "registernummer": "HRB 45888",
      "registerart": "HRB",
      "company_name": "ANWR-Data GmbH",
      "company_seat": "Mainhausen",
      "details": "11.07.2025 (Bekanntmachungsdatum)\n\nHessen Amtsgericht Offenbach am Main HRB 45888\nRegisterbekanntmachung nach dem Umwandlungsgesetz 11.07.2025 (Eintragungsdatum)\n\nANWR-Data GmbH\nGesellschaft mit beschränkter Haftung\nMainhausen\n\nDen Gläubigern der an der Verschmelzung beteiligten Rechtsträger ist, wenn sie binnen sechs Monaten nach dem Tag, an dem die Eintragung der Verschmelzung in das Register des Sitzes desjenigen Rechtsträgers, dessen Gläubiger sie sind, nach § 19 Absatz 3 UmwG bekannt gemacht worden ist, ihren Anspruch nach Grund und Höhe schriftlich anmelden, Sicherheit zu leisten, soweit sie nicht Befriedigung verlangen können. Dieses Recht steht den Gläubigern jedoch nur zu, wenn sie glaubhaft machen, dass durch die Verschmelzung die Erfüllung ihrer Forderung gefährdet wird."
    },
    {
      "date": "2025-07-11",
      "id": "115637",
      "original_text": "Einreichung neuer Dokumente\nHessen Amtsgericht Bad Homburg v.d.H. HRB 1585\nAlte Leipziger Versicherung Aktiengesellschaft – Oberursel (Taunus)",
      "type": "Einreichung neuer Dokumente",
      "state": "Hessen",
      "amtsgericht": "Amtsgericht Bad Homburg v.d.H.",
      "registernummer": "HRB 1585",
      "registerart": "HRB",
      "company_name": "Alte Leipziger Versicherung Aktiengesellschaft",
      "company_seat": "Oberursel (Taunus)",
      "details": "11.07.2025 (Bekanntmachungsdatum)\n\nHessen Amtsgericht Bad Homburg v.d.H. HRB 1585\nEinreichung neuer Dokumente\n\nAlte Leipziger Versicherung Aktiengesellschaft\nAktiengesellschaft\nOberursel (Taunus)\n\nDurch eine Änderung in den Personen der Aufsichtsratsmitglieder ist eine Liste der Mitglieder des Aufsichtsrates zum Handelsregister eingereicht worden."
    },
    {
      "date": "2025-07-11",
      "id": "115638",
      "original_text": "Löschungsankündigung\nHessen Amtsgericht Darmstadt HRB 102434\nAGE GmbH (A abbruch G gala garten und landschaftsbau E entsorgung) – Darmstadt",
      "type": "Löschungsankündigung",
      "state": "Hessen",
      "amtsgericht": "Amtsgericht Darmstadt",
      "registernummer": "HRB 102434",
      "registerart": "HRB",
      "company_name": "AGE GmbH (A abbruch G gala garten und landschaftsbau E entsorgung)",
      "company_seat": "Darmstadt",
      "details": "11.07.2025 (Bekanntmachungsdatum)\n\nHessen Amtsgericht Darmstadt HRB 102434\nLöschungsankündigung\n\nAGE GmbH (A abbruch G gala garten und landschaftsbau E entsorgung)\nGesellschaft mit beschränkter Haftung\nDarmstadt\n\nDas Registergericht beabsichtigt die im Handelsregister eingetragene Gesellschaft von Amts wegen nach § 394 FamFG zu löschen. Die Frist zur Erhebung eines Widerspruchs gegen die beabsichtigte Löschung wird auf 3 Monate festgesetzt."
    },
    {
      "date": "2025-07-11",
      "id": "115639",
      "original_text": "Registerbekanntmachung nach dem Umwandlungsgesetz\nHessen Amtsgericht Königstein VR 372\nSportverein Fischbach 1912 e. V. – Kelkheim (Taunus)",
      "type": "Registerbekanntmachung nach dem Umwandlungsgesetz",
      "state": "Hessen",
      "amtsgericht": "Amtsgericht Königstein",
      "registernummer": "VR 372",
      "registerart": "VR",
      "company_name": "Sportverein Fischbach 1912 e. V.",
      "company_seat": "Kelkheim (Taunus)",
      "details": "11.07.2025 (Bekanntmachungsdatum)\n\nHessen Amtsgericht Königstein VR 372\nRegisterbekanntmachung nach dem Umwandlungsgesetz\n\nSportverein Fischbach 1912 e. V.\neingetragener Verein\nKelkheim (Taunus)\n\nDen Gläubigern der an der Verschmelzung beteiligten Rechtsträger ist, wenn sie binnen sechs Monaten nach dem Tag, an dem die Eintragung der Verschmelzung in das Register des Sitzes desjenigen Rechtsträgers, dessen Gläubiger sie sind, nach § 19 Absatz 3 UmwG bekannt gemacht worden ist, ihren Anspruch nach Grund und Höhe schriftlich anmelden, Sicherheit zu leisten, soweit sie nicht Befriedigung verlangen können. Dieses Recht steht den Gläubigern jedoch nur zu, wenn sie glaubhaft machen, dass durch die Verschmelzung die Erfüllung ihrer Forderung gefährdet wird."
    },
    {
      "date": "2025-07-11",
      "id": "115640",
      "original_text": "Registerbekanntmachung nach dem Umwandlungsgesetz\nHessen Amtsgericht Darmstadt HRB 95005\nDöhler Group SE – Darmstadt",
      "type": "Registerbekanntmachung nach dem Umwandlungsgesetz",
      "state": "Hessen",
      "amtsgericht": "Amtsgericht Darmstadt",
      "registernummer": "HRB 95005",
      "registerart": "HRB",
      "company_name": "Döhler Group SE",
      "company_seat": "Darmstadt",
      "details": "11.07.2025 (Bekanntmachungsdatum)\n\nHessen Amtsgericht Darmstadt HRB 95005\nRegisterbekanntmachung nach dem Umwandlungsgesetz\n\nDöhler Group SE\nEuropäische Aktiengesellschaft (SE)\nDarmstadt\n\nDen Gläubigern der an der Ausgliederung beteiligten Rechtsträger ist, wenn sie binnen sechs Monaten nach dem Tag, an dem die Eintragung der Ausgliederung in das Register des Sitzes desjenigen Rechtsträgers, dessen Gläubiger sie sind, nach §§ 125, 19 Absatz 3 UmwG bekannt gemacht worden ist, ihren Anspruch nach Grund und Höhe schriftlich anmelden, Sicherheit zu leisten, soweit sie nicht Befriedigung verlangen können. Dieses Recht steht den Gläubigern jedoch nur zu, wenn sie glaubhaft machen, dass durch die Ausgliederung die Erfüllung ihrer Forderung gefährdet wird."
    }
  ]
}