{
  "date": "2025-07-01",
  "date_of_scrape": "2025-07-02T04:21:16.380Z",
  "tool_version": "0.2.0",
  "number_of_announcements": 214,
  "announcements": [
    {
      "date": "2025-07-01",
      "id": "113980",
      "original_text": "Registerbekanntmachung nach dem Umwandlungsgesetz\nBayern Amtsgericht Ansbach HRB 7229\nBeyer Zimmerei Schreinerei Verwaltungs GmbH – Heidenheim",
      "type": "Registerbekanntmachung nach dem Umwandlungsgesetz",
      "state": "Bayern",
      "amtsgericht": "Amtsgericht Ansbach",
      "registernummer": "HRB 7229",
      "registerart": "HRB",
      "company_name": "Beyer Zimmerei Schreinerei Verwaltungs GmbH",
      "company_seat": "Heidenheim",
      "details": "01.07.2025 (Bekanntmachungsdatum)\n\nBayern Amtsgericht Ansbach HRB 7229\nRegisterbekanntmachung nach dem Umwandlungsgesetz 30.06.2025 (Eintragungsdatum)\n\nBeyer Zimmerei Schreinerei Verwaltungs GmbH\nGesellschaft mit beschränkter Haftung\nHeidenheim\n\nDen Gläubigern der an der Verschmelzung beteiligten Rechtsträger ist, wenn sie binnen sechs Monaten nach dem Tag, an dem die Eintragung der Verschmelzung in das Register des Sitzes desjenigen Rechtsträgers, dessen Gläubiger sie sind, nach § 19 Abs. 3 UmwG als bekannt gemacht gilt, ihren Anspruch nach Grund und Höhe in Textform anmelden, Sicherheit zu leisten, soweit sie nicht Befriedigung verlangen können. Dieses Recht steht den Gläubigern jedoch nur zu, wenn sie glaubhaft machen, dass durch die Verschmelzung die Erfüllung ihrer Forderung gefährdet wird."
    },
    {
      "date": "2025-07-01",
      "id": "113981",
      "original_text": "Registerbekanntmachung nach dem Umwandlungsgesetz\nBayern Amtsgericht München HRA 120498\nKickserve GmbH & Co. KG – München",
      "type": "Registerbekanntmachung nach dem Umwandlungsgesetz",
      "state": "Bayern",
      "amtsgericht": "Amtsgericht München",
      "registernummer": "HRA 120498",
      "registerart": "HRA",
      "company_name": "Kickserve GmbH & Co. KG",
      "company_seat": "München",
      "details": "01.07.2025 (Bekanntmachungsdatum)\n\nBayern Amtsgericht München HRA 120498\nRegisterbekanntmachung nach dem Umwandlungsgesetz 30.06.2025 (Eintragungsdatum)\n\nKickserve GmbH & Co. KG\nKommanditgesellschaft\nMünchen\n\nDen Gläubigern der an der Ausgliederung beteiligten Rechtsträger ist, wenn sie binnen sechs Monaten nach dem Tag, an dem die Eintragung der Ausgliederung in das Register des Sitzes desjenigen Rechtsträgers, dessen Gläubiger sie sind, nach §§ 125, 19 Abs. 3 UmwG als bekannt gemacht gilt, ihren Anspruch nach Grund und Höhe in Textform anmelden, Sicherheit zu leisten, soweit sie nicht Befriedigung verlangen können. Dieses Recht steht den Gläubigern jedoch nur zu, wenn sie glaubhaft machen, dass durch die Ausgliederung die Erfüllung ihrer Forderung gefährdet wird."
    },
    {
      "date": "2025-07-01",
      "id": "113982",
      "original_text": "Registerbekanntmachung nach dem Umwandlungsgesetz\nBayern Amtsgericht München HRB 191756\nObermühlner GmbH – Pähl",
      "type": "Registerbekanntmachung nach dem Umwandlungsgesetz",
      "state": "Bayern",
      "amtsgericht": "Amtsgericht München",
      "registernummer": "HRB 191756",
      "registerart": "HRB",
      "company_name": "Obermühlner GmbH",
      "company_seat": "Pähl",
      "details": "01.07.2025 (Bekanntmachungsdatum)\n\nBayern Amtsgericht München HRB 191756\nRegisterbekanntmachung nach dem Umwandlungsgesetz 30.06.2025 (Eintragungsdatum)\n\nObermühlner GmbH\nGesellschaft mit beschränkter Haftung\nPähl\n\nDen Gläubigern der an der Verschmelzung beteiligten Rechtsträger ist, wenn sie binnen sechs Monaten nach dem Tag, an dem die Eintragung der Verschmelzung in das Register des Sitzes desjenigen Rechtsträgers, dessen Gläubiger sie sind, nach § 19 Abs. 3 UmwG als bekannt gemacht gilt, ihren Anspruch nach Grund und Höhe in Textform anmelden, Sicherheit zu leisten, soweit sie nicht Befriedigung verlangen können. Dieses Recht steht den Gläubigern jedoch nur zu, wenn sie glaubhaft machen, dass durch die Verschmelzung die Erfüllung ihrer Forderung gefährdet wird."
    },
    {
      "date": "2025-07-01",
      "id": "113983",
      "original_text": "Registerbekanntmachung nach dem Umwandlungsgesetz\nBayern Amtsgericht Passau HRB 7983\nPARAT Technology Group GmbH – Neureichenau",
      "type": "Registerbekanntmachung nach dem Umwandlungsgesetz",
      "state": "Bayern",
      "amtsgericht": "Amtsgericht Passau",
      "registernummer": "HRB 7983",
      "registerart": "HRB",
      "company_name": "PARAT Technology Group GmbH",
      "company_seat": "Neureichenau",
      "details": "01.07.2025 (Bekanntmachungsdatum)\n\nBayern Amtsgericht Passau HRB 7983\nRegisterbekanntmachung nach dem Umwandlungsgesetz 30.06.2025 (Eintragungsdatum)\n\nPARAT Technology Group GmbH\nGesellschaft mit beschränkter Haftung\nNeureichenau\n\nDen Gläubigern der an der Verschmelzung beteiligten Rechtsträger ist, wenn sie binnen sechs Monaten nach dem Tag, an dem die Eintragung der Verschmelzung in das Register des Sitzes desjenigen Rechtsträgers, dessen Gläubiger sie sind, nach § 19 Abs. 3 UmwG als bekannt gemacht gilt, ihren Anspruch nach Grund und Höhe in Textform anmelden, Sicherheit zu leisten, soweit sie nicht Befriedigung verlangen können. Dieses Recht steht den Gläubigern jedoch nur zu, wenn sie glaubhaft machen, dass durch die Verschmelzung die Erfüllung ihrer Forderung gefährdet wird."
    },
    {
      "date": "2025-07-01",
      "id": "113984",
      "original_text": "Registerbekanntmachung nach dem Umwandlungsgesetz\nBayern Amtsgericht Aschaffenburg HRB 1027\nRaiffeisen Immobilien- und Versicherungsvermittlungs-GmbH Aschaffenburg – Aschaffenburg",
      "type": "Registerbekanntmachung nach dem Umwandlungsgesetz",
      "state": "Bayern",
      "amtsgericht": "Amtsgericht Aschaffenburg",
      "registernummer": "HRB 1027",
      "registerart": "HRB",
      "company_name": "Raiffeisen Immobilien- und Versicherungsvermittlungs-GmbH Aschaffenburg",
      "company_seat": "Aschaffenburg",
      "details": "01.07.2025 (Bekanntmachungsdatum)\n\nBayern Amtsgericht Aschaffenburg HRB 1027\nRegisterbekanntmachung nach dem Umwandlungsgesetz 30.06.2025 (Eintragungsdatum)\n\nRaiffeisen Immobilien- und Versicherungsvermittlungs-GmbH Aschaffenburg\nGesellschaft mit beschränkter Haftung\nAschaffenburg\n\nDen Gläubigern der an der Verschmelzung beteiligten Rechtsträger ist, wenn sie binnen sechs Monaten nach dem Tag, an dem die Eintragung der Verschmelzung in das Register des Sitzes desjenigen Rechtsträgers, dessen Gläubiger sie sind, nach § 19 Abs. 3 UmwG als bekannt gemacht gilt, ihren Anspruch nach Grund und Höhe in Textform anmelden, Sicherheit zu leisten, soweit sie nicht Befriedigung verlangen können. Dieses Recht steht den Gläubigern jedoch nur zu, wenn sie glaubhaft machen, dass durch die Verschmelzung die Erfüllung ihrer Forderung gefährdet wird."
    },
    {
      "date": "2025-07-01",
      "id": "113985",
      "original_text": "Löschungsankündigung\nBayern Amtsgericht München HRB 237186\nCITO JN Munich UG (haftungsbeschränkt) – München",
      "type": "Löschungsankündigung",
      "state": "Bayern",
      "amtsgericht": "Amtsgericht München",
      "registernummer": "HRB 237186",
      "registerart": "HRB",
      "company_name": "CITO JN Munich UG (haftungsbeschränkt)",
      "company_seat": "München",
      "details": "01.07.2025 (Bekanntmachungsdatum)\n\nBayern Amtsgericht München HRB 237186\nLöschungsankündigung\n\nCITO JN Munich UG (haftungsbeschränkt)\nGesellschaft mit beschränkter Haftung\nMünchen\n\nDas Registergericht beabsichtigt, die im Handelsregister eingetragene Gesellschaft wegen Vermögenslosigkeit von Amts wegen nach § 394 FamFG zu löschen. Die Frist zur Erhebung eines Widerspruchs ist auf drei Monate festgesetzt."
    },
    {
      "date": "2025-07-01",
      "id": "113986",
      "original_text": "Löschungsankündigung\nBayern Amtsgericht München HRA 84223\nMK Gebäudereinigung & Hausmeisterservice e.K. – Unterhaching",
      "type": "Löschungsankündigung",
      "state": "Bayern",
      "amtsgericht": "Amtsgericht München",
      "registernummer": "HRA 84223",
      "registerart": "HRA",
      "company_name": "MK Gebäudereinigung & Hausmeisterservice e.K.",
      "company_seat": "Unterhaching",
      "details": "01.07.2025 (Bekanntmachungsdatum)\n\nBayern Amtsgericht München HRA 84223\nLöschungsankündigung 30.06.2025 (Eintragungsdatum)\n\nMK Gebäudereinigung & Hausmeisterservice e.K.\nEinzelkaufmann / Einzelkauffrau\nUnterhaching\n\nDas Registergericht beabsichtigt, die im Handelsregister eingetragene Firma von Amts wegen nach § 31 Abs. 2 HGB zu löschen. Die Frist zur Erhebung eines Widerspruchs ist auf drei Monate festgesetzt."
    },
    {
      "date": "2025-07-01",
      "id": "113987",
      "original_text": "Registerbekanntmachung nach dem Umwandlungsgesetz\nBayern Amtsgericht Kempten (Allgäu) HRB 17413\nentelecheia UG (haftungsbeschränkt) – Füssen",
      "type": "Registerbekanntmachung nach dem Umwandlungsgesetz",
      "state": "Bayern",
      "amtsgericht": "Amtsgericht Kempten (Allgäu)",
      "registernummer": "HRB 17413",
      "registerart": "HRB",
      "company_name": "entelecheia UG (haftungsbeschränkt)",
      "company_seat": "Füssen",
      "details": "01.07.2025 (Bekanntmachungsdatum)\n\nBayern Amtsgericht Kempten (Allgäu) HRB 17413\nRegisterbekanntmachung nach dem Umwandlungsgesetz 28.06.2025 (Eintragungsdatum)\n\nentelecheia UG (haftungsbeschränkt)\nGesellschaft mit beschränkter Haftung\nFüssen\n\nDen Gläubigern der an der Verschmelzung beteiligten Rechtsträger ist, wenn sie binnen sechs Monaten nach dem Tag, an dem die Eintragung der Verschmelzung in das Register des Sitzes desjenigen Rechtsträgers, dessen Gläubiger sie sind, nach § 19 Abs. 3 UmwG als bekannt gemacht gilt, ihren Anspruch nach Grund und Höhe in Textform anmelden, Sicherheit zu leisten, soweit sie nicht Befriedigung verlangen können. Dieses Recht steht den Gläubigern jedoch nur zu, wenn sie glaubhaft machen, dass durch die Verschmelzung die Erfüllung ihrer Forderung gefährdet wird."
    },
    {
      "date": "2025-07-01",
      "id": "113988",
      "original_text": "Registerbekanntmachung nach dem Umwandlungsgesetz\nBayern Amtsgericht Ansbach HRA 4899\nBeyer Zimmerei e.K. – Heidenheim",
      "type": "Registerbekanntmachung nach dem Umwandlungsgesetz",
      "state": "Bayern",
      "amtsgericht": "Amtsgericht Ansbach",
      "registernummer": "HRA 4899",
      "registerart": "HRA",
      "company_name": "Beyer Zimmerei e.K.",
      "company_seat": "Heidenheim",
      "details": "01.07.2025 (Bekanntmachungsdatum)\n\nBayern Amtsgericht Ansbach HRA 4899\nRegisterbekanntmachung nach dem Umwandlungsgesetz 30.06.2025 (Eintragungsdatum)\n\nBeyer Zimmerei e.K.\nEinzelkaufmann / Einzelkauffrau\nHeidenheim\n\nDen Gläubigern der an der Verschmelzung beteiligten Rechtsträger ist, wenn sie binnen sechs Monaten nach dem Tag, an dem die Eintragung der Verschmelzung in das Register des Sitzes desjenigen Rechtsträgers, dessen Gläubiger sie sind, nach § 19 Abs. 3 UmwG als bekannt gemacht gilt, ihren Anspruch nach Grund und Höhe in Textform anmelden, Sicherheit zu leisten, soweit sie nicht Befriedigung verlangen können. Dieses Recht steht den Gläubigern jedoch nur zu, wenn sie glaubhaft machen, dass durch die Verschmelzung die Erfüllung ihrer Forderung gefährdet wird."
    },
    {
      "date": "2025-07-01",
      "id": "113989",
      "original_text": "Einreichung neuer Dokumente\nBayern Amtsgericht München HRB 151905\nCGM Invest AG – München",
      "type": "Einreichung neuer Dokumente",
      "state": "Bayern",
      "amtsgericht": "Amtsgericht München",
      "registernummer": "HRB 151905",
      "registerart": "HRB",
      "company_name": "CGM Invest AG",
      "company_seat": "München",
      "details": "01.07.2025 (Bekanntmachungsdatum)\n\nBayern Amtsgericht München HRB 151905\nEinreichung neuer Dokumente 30.06.2025 (Eintragungsdatum)\n\nCGM Invest AG\nAktiengesellschaft\nMünchen\n\nDem Amtsgericht München -Registergericht- ist eine Liste der Mitglieder des Aufsichtsrats eingereicht worden, § 106 AktG."
    },
    {
      "date": "2025-07-01",
      "id": "113990",
      "original_text": "Registerbekanntmachung nach dem Umwandlungsgesetz\nBayern Amtsgericht Passau HRB 9006\nPARAT Technology Verwaltungs GmbH – Neureichenau",
      "type": "Registerbekanntmachung nach dem Umwandlungsgesetz",
      "state": "Bayern",
      "amtsgericht": "Amtsgericht Passau",
      "registernummer": "HRB 9006",
      "registerart": "HRB",
      "company_name": "PARAT Technology Verwaltungs GmbH",
      "company_seat": "Neureichenau",
      "details": "01.07.2025 (Bekanntmachungsdatum)\n\nBayern Amtsgericht Passau HRB 9006\nRegisterbekanntmachung nach dem Umwandlungsgesetz 30.06.2025 (Eintragungsdatum)\n\nPARAT Technology Verwaltungs GmbH\nGesellschaft mit beschränkter Haftung\nNeureichenau\n\nDen Gläubigern der an der Verschmelzung beteiligten Rechtsträger ist, wenn sie binnen sechs Monaten nach dem Tag, an dem die Eintragung der Verschmelzung in das Register des Sitzes desjenigen Rechtsträgers, dessen Gläubiger sie sind, nach § 19 Abs. 3 UmwG als bekannt gemacht gilt, ihren Anspruch nach Grund und Höhe in Textform anmelden, Sicherheit zu leisten, soweit sie nicht Befriedigung verlangen können. Dieses Recht steht den Gläubigern jedoch nur zu, wenn sie glaubhaft machen, dass durch die Verschmelzung die Erfüllung ihrer Forderung gefährdet wird."
    },
    {
      "date": "2025-07-01",
      "id": "113991",
      "original_text": "Registerbekanntmachung nach dem Umwandlungsgesetz\nBayern Amtsgericht Kempten (Allgäu) HRB 9907\nTrollgames GmbH – Füssen",
      "type": "Registerbekanntmachung nach dem Umwandlungsgesetz",
      "state": "Bayern",
      "amtsgericht": "Amtsgericht Kempten (Allgäu)",
      "registernummer": "HRB 9907",
      "registerart": "HRB",
      "company_name": "Trollgames GmbH",
      "company_seat": "Füssen",
      "details": "01.07.2025 (Bekanntmachungsdatum)\n\nBayern Amtsgericht Kempten (Allgäu) HRB 9907\nRegisterbekanntmachung nach dem Umwandlungsgesetz 28.06.2025 (Eintragungsdatum)\n\nTrollgames GmbH\nGesellschaft mit beschränkter Haftung\nFüssen\n\nDen Gläubigern der an der Verschmelzung beteiligten Rechtsträger ist, wenn sie binnen sechs Monaten nach dem Tag, an dem die Eintragung der Verschmelzung in das Register des Sitzes desjenigen Rechtsträgers, dessen Gläubiger sie sind, nach § 19 Abs. 3 UmwG als bekannt gemacht gilt, ihren Anspruch nach Grund und Höhe in Textform anmelden, Sicherheit zu leisten, soweit sie nicht Befriedigung verlangen können. Dieses Recht steht den Gläubigern jedoch nur zu, wenn sie glaubhaft machen, dass durch die Verschmelzung die Erfüllung ihrer Forderung gefährdet wird."
    },
    {
      "date": "2025-07-01",
      "id": "113992",
      "original_text": "Registerbekanntmachung nach dem Umwandlungsgesetz\nBayern Amtsgericht Traunstein HRB 33794\nVia Unita Prima GmbH – Stephanskirchen",
      "type": "Registerbekanntmachung nach dem Umwandlungsgesetz",
      "state": "Bayern",
      "amtsgericht": "Amtsgericht Traunstein",
      "registernummer": "HRB 33794",
      "registerart": "HRB",
      "company_name": "Via Unita Prima GmbH",
      "company_seat": "Stephanskirchen",
      "details": "01.07.2025 (Bekanntmachungsdatum)\n\nBayern Amtsgericht Traunstein HRB 33794\nRegisterbekanntmachung nach dem Umwandlungsgesetz 30.06.2025 (Eintragungsdatum)\n\nVia Unita Prima GmbH\nGesellschaft mit beschränkter Haftung\nStephanskirchen\n\nDen Gläubigern der an der Verschmelzung beteiligten Rechtsträger ist, wenn sie binnen sechs Monaten nach dem Tag, an dem die Eintragung der Verschmelzung in das Register des Sitzes desjenigen Rechtsträgers, dessen Gläubiger sie sind, nach § 19 Abs. 3 UmwG als bekannt gemacht gilt, ihren Anspruch nach Grund und Höhe in Textform anmelden, Sicherheit zu leisten, soweit sie nicht Befriedigung verlangen können. Dieses Recht steht den Gläubigern jedoch nur zu, wenn sie glaubhaft machen, dass durch die Verschmelzung die Erfüllung ihrer Forderung gefährdet wird."
    },
    {
      "date": "2025-07-01",
      "id": "113993",
      "original_text": "Registerbekanntmachung nach dem Umwandlungsgesetz\nBayern Amtsgericht München HRA 114616\nimt Zinssmeister OHG – Hohenpeißenberg",
      "type": "Registerbekanntmachung nach dem Umwandlungsgesetz",
      "state": "Bayern",
      "amtsgericht": "Amtsgericht München",
      "registernummer": "HRA 114616",
      "registerart": "HRA",
      "company_name": "imt Zinssmeister OHG",
      "company_seat": "Hohenpeißenberg",
      "details": "01.07.2025 (Bekanntmachungsdatum)\n\nBayern Amtsgericht München HRA 114616\nRegisterbekanntmachung nach dem Umwandlungsgesetz 30.06.2025 (Eintragungsdatum)\n\nimt Zinssmeister OHG\nOffene Handelsgesellschaft\nHohenpeißenberg\n\nZur formwechselnden Umwandlung der imt Zinssmeister OHG mit Sitz in Hohenpeißenberg (Amtsgericht München, HRA 114616), in die imt Tool Solutions GmbH mit Sitz in Hohenpeißenberg:\nDen Gläubigern des formwechselnden Rechtsträgers ist, wenn sie binnen sechs Monaten nach dem Tag, an dem die Eintragung des Formwechsels nach § 201 UmwG als bekannt gemacht gilt, ihren Anspruch nach Grund und Höhe in Textform anmelden, Sicherheit zu leisten, soweit sie nicht Befriedigung verlangen können. Dieses Recht steht den Gläubigern jedoch nur zu, wenn sie glaubhaft machen, dass durch den Formwechsel die Erfüllung ihrer Forderung gefährdet wird."
    },
    {
      "date": "2025-07-01",
      "id": "113994",
      "original_text": "Registerbekanntmachung nach dem Umwandlungsgesetz\nBayern Amtsgericht Traunstein HRB 12010\nProduktPlan GmbH – Raubling",
      "type": "Registerbekanntmachung nach dem Umwandlungsgesetz",
      "state": "Bayern",
      "amtsgericht": "Amtsgericht Traunstein",
      "registernummer": "HRB 12010",
      "registerart": "HRB",
      "company_name": "ProduktPlan GmbH",
      "company_seat": "Raubling",
      "details": "01.07.2025 (Bekanntmachungsdatum)\n\nBayern Amtsgericht Traunstein HRB 12010\nRegisterbekanntmachung nach dem Umwandlungsgesetz 30.06.2025 (Eintragungsdatum)\n\nProduktPlan GmbH\nGesellschaft mit beschränkter Haftung\nRaubling\n\nDen Gläubigern der an der Verschmelzung beteiligten Rechtsträger ist, wenn sie binnen sechs Monaten nach dem Tag, an dem die Eintragung der Verschmelzung in das Register des Sitzes desjenigen Rechtsträgers, dessen Gläubiger sie sind, nach § 19 Abs. 3 UmwG als bekannt gemacht gilt, ihren Anspruch nach Grund und Höhe in Textform anmelden, Sicherheit zu leisten, soweit sie nicht Befriedigung verlangen können. Dieses Recht steht den Gläubigern jedoch nur zu, wenn sie glaubhaft machen, dass durch die Verschmelzung die Erfüllung ihrer Forderung gefährdet wird."
    },
    {
      "date": "2025-07-01",
      "id": "113995",
      "original_text": "Einreichung neuer Dokumente\nBayern Amtsgericht München HRB 285299\nNTT DATA Deutschland SE – München",
      "type": "Einreichung neuer Dokumente",
      "state": "Bayern",
      "amtsgericht": "Amtsgericht München",
      "registernummer": "HRB 285299",
      "registerart": "HRB",
      "company_name": "NTT DATA Deutschland SE",
      "company_seat": "München",
      "details": "01.07.2025 (Bekanntmachungsdatum)\n\nBayern Amtsgericht München HRB 285299\nEinreichung neuer Dokumente\n\nNTT DATA Deutschland SE\nEuropäische Aktiengesellschaft (SE)\nMünchen\n\nDem Amtsgericht München -Registergericht- ist eine Liste der Mitglieder des Aufsichtsrats eingereicht worden, Art. 9 Abs. 1 Buchst. c (ii) SE-VO i.V.m. § 106 AktG."
    },
    {
      "date": "2025-07-01",
      "id": "113996",
      "original_text": "Registerbekanntmachung nach dem Umwandlungsgesetz\nBayern Amtsgericht München HRB 66234\nDDB München GmbH – München",
      "type": "Registerbekanntmachung nach dem Umwandlungsgesetz",
      "state": "Bayern",
      "amtsgericht": "Amtsgericht München",
      "registernummer": "HRB 66234",
      "registerart": "HRB",
      "company_name": "DDB München GmbH",
      "company_seat": "München",
      "details": "01.07.2025 (Bekanntmachungsdatum)\n\nBayern Amtsgericht München HRB 66234\nRegisterbekanntmachung nach dem Umwandlungsgesetz 30.06.2025 (Eintragungsdatum)\n\nDDB München GmbH\nGesellschaft mit beschränkter Haftung\nMünchen\n\nDen Gläubigern der an der Verschmelzung beteiligten Rechtsträger ist, wenn sie binnen sechs Monaten nach dem Tag, an dem die Eintragung der Verschmelzung in das Register des Sitzes desjenigen Rechtsträgers, dessen Gläubiger sie sind, nach § 19 Abs. 3 UmwG als bekannt gemacht gilt, ihren Anspruch nach Grund und Höhe in Textform anmelden, Sicherheit zu leisten, soweit sie nicht Befriedigung verlangen können. Dieses Recht steht den Gläubigern jedoch nur zu, wenn sie glaubhaft machen, dass durch die Verschmelzung die Erfüllung ihrer Forderung gefährdet wird."
    },
    {
      "date": "2025-07-01",
      "id": "113997",
      "original_text": "Registerbekanntmachung nach dem Umwandlungsgesetz\nBayern Amtsgericht Fürth HRB 17140\nGBI Wohnbau 1 GmbH – Erlangen",
      "type": "Registerbekanntmachung nach dem Umwandlungsgesetz",
      "state": "Bayern",
      "amtsgericht": "Amtsgericht Fürth",
      "registernummer": "HRB 17140",
      "registerart": "HRB",
      "company_name": "GBI Wohnbau 1 GmbH",
      "company_seat": "Erlangen",
      "details": "01.07.2025 (Bekanntmachungsdatum)\n\nBayern Amtsgericht Fürth HRB 17140\nRegisterbekanntmachung nach dem Umwandlungsgesetz 30.06.2025 (Eintragungsdatum)\n\nGBI Wohnbau 1 GmbH\nGesellschaft mit beschränkter Haftung\nErlangen\n\nDen Gläubigern der an der Verschmelzung beteiligten Rechtsträger ist, wenn sie binnen sechs Monaten nach dem Tag, an dem die Eintragung der Verschmelzung in das Register des Sitzes desjenigen Rechtsträgers, dessen Gläubiger sie sind, nach § 19 Abs. 3 UmwG als bekannt gemacht gilt, ihren Anspruch nach Grund und Höhe in Textform anmelden, Sicherheit zu leisten, soweit sie nicht Befriedigung verlangen können. Dieses Recht steht den Gläubigern jedoch nur zu, wenn sie glaubhaft machen, dass durch die Verschmelzung die Erfüllung ihrer Forderung gefährdet wird."
    },
    {
      "date": "2025-07-01",
      "id": "113998",
      "original_text": "Registerbekanntmachung nach dem Umwandlungsgesetz\nBayern Amtsgericht München HRB 245634\nAspio GmbH – München",
      "type": "Registerbekanntmachung nach dem Umwandlungsgesetz",
      "state": "Bayern",
      "amtsgericht": "Amtsgericht München",
      "registernummer": "HRB 245634",
      "registerart": "HRB",
      "company_name": "Aspio GmbH",
      "company_seat": "München",
      "details": "01.07.2025 (Bekanntmachungsdatum)\n\nBayern Amtsgericht München HRB 245634\nRegisterbekanntmachung nach dem Umwandlungsgesetz 30.06.2025 (Eintragungsdatum)\n\nAspio GmbH\nGesellschaft mit beschränkter Haftung\nMünchen\n\nDen Gläubigern der an der Verschmelzung beteiligten Rechtsträger ist, wenn sie binnen sechs Monaten nach dem Tag, an dem die Eintragung der Verschmelzung in das Register des Sitzes desjenigen Rechtsträgers, dessen Gläubiger sie sind, nach § 19 Abs. 3 UmwG als bekannt gemacht gilt, ihren Anspruch nach Grund und Höhe in Textform anmelden, Sicherheit zu leisten, soweit sie nicht Befriedigung verlangen können. Dieses Recht steht den Gläubigern jedoch nur zu, wenn sie glaubhaft machen, dass durch die Verschmelzung die Erfüllung ihrer Forderung gefährdet wird."
    },
    {
      "date": "2025-07-01",
      "id": "113999",
      "original_text": "Registerbekanntmachung nach dem Umwandlungsgesetz\nBayern Amtsgericht München HRB 160941\naccompio SmarTec GmbH – Grasbrunn",
      "type": "Registerbekanntmachung nach dem Umwandlungsgesetz",
      "state": "Bayern",
      "amtsgericht": "Amtsgericht München",
      "registernummer": "HRB 160941",
      "registerart": "HRB",
      "company_name": "accompio SmarTec GmbH",
      "company_seat": "Grasbrunn",
      "details": "01.07.2025 (Bekanntmachungsdatum)\n\nBayern Amtsgericht München HRB 160941\nRegisterbekanntmachung nach dem Umwandlungsgesetz 30.06.2025 (Eintragungsdatum)\n\naccompio SmarTec GmbH\nGesellschaft mit beschränkter Haftung\nGrasbrunn\n\nDen Gläubigern der an der Verschmelzung beteiligten Rechtsträger ist, wenn sie binnen sechs Monaten nach dem Tag, an dem die Eintragung der Verschmelzung in das Register des Sitzes desjenigen Rechtsträgers, dessen Gläubiger sie sind, nach § 19 Abs. 3 UmwG als bekannt gemacht gilt, ihren Anspruch nach Grund und Höhe in Textform anmelden, Sicherheit zu leisten, soweit sie nicht Befriedigung verlangen können. Dieses Recht steht den Gläubigern jedoch nur zu, wenn sie glaubhaft machen, dass durch die Verschmelzung die Erfüllung ihrer Forderung gefährdet wird."
    },
    {
      "date": "2025-07-01",
      "id": "114000",
      "original_text": "Einreichung neuer Dokumente\nBayern Amtsgericht München HRB 131060\nCA Akademie privates Institut für Controlling und Unternehmensführung Aktiengesellschaft – Wörthsee",
      "type": "Einreichung neuer Dokumente",
      "state": "Bayern",
      "amtsgericht": "Amtsgericht München",
      "registernummer": "HRB 131060",
      "registerart": "HRB",
      "company_name": "CA Akademie privates Institut für Controlling und Unternehmensführung Aktiengesellschaft",
      "company_seat": "Wörthsee",
      "details": "01.07.2025 (Bekanntmachungsdatum)\n\nBayern Amtsgericht München HRB 131060\nEinreichung neuer Dokumente\n\nCA Akademie privates Institut für Controlling und Unternehmensführung Aktiengesellschaft\nAktiengesellschaft\nWörthsee\n\nDem Amtsgericht München -Registergericht- ist eine Liste der Mitglieder des Aufsichtsrats eingereicht worden, § 106 AktG."
    },
    {
      "date": "2025-07-01",
      "id": "114001",
      "original_text": "Registerbekanntmachung nach dem Umwandlungsgesetz\nBayern Amtsgericht Kempten (Allgäu) HRB 10941\nETECAS UG (haftungsbeschränkt) – Dietmannsried",
      "type": "Registerbekanntmachung nach dem Umwandlungsgesetz",
      "state": "Bayern",
      "amtsgericht": "Amtsgericht Kempten (Allgäu)",
      "registernummer": "HRB 10941",
      "registerart": "HRB",
      "company_name": "ETECAS UG (haftungsbeschränkt)",
      "company_seat": "Dietmannsried",
      "details": "01.07.2025 (Bekanntmachungsdatum)\n\nBayern Amtsgericht Kempten (Allgäu) HRB 10941\nRegisterbekanntmachung nach dem Umwandlungsgesetz 28.06.2025 (Eintragungsdatum)\n\nETECAS UG (haftungsbeschränkt)\nGesellschaft mit beschränkter Haftung\nDietmannsried\n\nDen Gläubigern der an der Verschmelzung beteiligten Rechtsträger ist, wenn sie binnen sechs Monaten nach dem Tag, an dem die Eintragung der Verschmelzung in das Register des Sitzes desjenigen Rechtsträgers, dessen Gläubiger sie sind, nach § 19 Abs. 3 UmwG als bekannt gemacht gilt, ihren Anspruch nach Grund und Höhe in Textform anmelden, Sicherheit zu leisten, soweit sie nicht Befriedigung verlangen können. Dieses Recht steht den Gläubigern jedoch nur zu, wenn sie glaubhaft machen, dass durch die Verschmelzung die Erfüllung ihrer Forderung gefährdet wird."
    },
    {
      "date": "2025-07-01",
      "id": "114002",
      "original_text": "Registerbekanntmachung nach dem Umwandlungsgesetz\nBayern Amtsgericht Memmingen HRA 10201\nBüro Konstanzer e.K. – Neu-Ulm",
      "type": "Registerbekanntmachung nach dem Umwandlungsgesetz",
      "state": "Bayern",
      "amtsgericht": "Amtsgericht Memmingen",
      "registernummer": "HRA 10201",
      "registerart": "HRA",
      "company_name": "Büro Konstanzer e.K.",
      "company_seat": "Neu-Ulm",
      "details": "01.07.2025 (Bekanntmachungsdatum)\n\nBayern Amtsgericht Memmingen HRA 10201\nRegisterbekanntmachung nach dem Umwandlungsgesetz 29.06.2025 (Eintragungsdatum)\n\nBüro Konstanzer e.K.\nEinzelkaufmann / Einzelkauffrau\nNeu-Ulm\n\nDen Gläubigern der an der Ausgliederung beteiligten Rechtsträger ist, wenn sie binnen sechs Monaten nach dem Tag, an dem die Eintragung der Ausgliederung in das Register des Sitzes desjenigen Rechtsträgers, dessen Gläubiger sie sind, nach §§ 125, 19 Abs. 3 UmwG als bekannt gemacht gilt, ihren Anspruch nach Grund und Höhe in Textform anmelden, Sicherheit zu leisten, soweit sie nicht Befriedigung verlangen können. Dieses Recht steht den Gläubigern jedoch nur zu, wenn sie glaubhaft machen, dass durch die Ausgliederung die Erfüllung ihrer Forderung gefährdet wird."
    },
    {
      "date": "2025-07-01",
      "id": "114003",
      "original_text": "Löschungsankündigung\nBayern Amtsgericht München HRB 208689\nTerra Invest Verwaltungsgesellschaft mbH Investoren & Stiftungen – Grünwald",
      "type": "Löschungsankündigung",
      "state": "Bayern",
      "amtsgericht": "Amtsgericht München",
      "registernummer": "HRB 208689",
      "registerart": "HRB",
      "company_name": "Terra Invest Verwaltungsgesellschaft mbH Investoren & Stiftungen",
      "company_seat": "Grünwald",
      "details": "01.07.2025 (Bekanntmachungsdatum)\n\nBayern Amtsgericht München HRB 208689\nLöschungsankündigung\n\nTerra Invest Verwaltungsgesellschaft mbH Investoren & Stiftungen\nGesellschaft mit beschränkter Haftung\nGrünwald\n\nDas Registergericht beabsichtigt, die im Handelsregister eingetragene Gesellschaft wegen Vermögenslosigkeit von Amts wegen nach § 394 FamFG zu löschen. Die Frist zur Erhebung eines Widerspruchs ist auf drei Monate festgesetzt."
    },
    {
      "date": "2025-07-01",
      "id": "114004",
      "original_text": "Registerbekanntmachung nach dem Umwandlungsgesetz\nBayern Amtsgericht Fürth HRB 14314\nGBI Wohnungsbau GmbH – Erlangen",
      "type": "Registerbekanntmachung nach dem Umwandlungsgesetz",
      "state": "Bayern",
      "amtsgericht": "Amtsgericht Fürth",
      "registernummer": "HRB 14314",
      "registerart": "HRB",
      "company_name": "GBI Wohnungsbau GmbH",
      "company_seat": "Erlangen",
      "details": "01.07.2025 (Bekanntmachungsdatum)\n\nBayern Amtsgericht Fürth HRB 14314\nRegisterbekanntmachung nach dem Umwandlungsgesetz 30.06.2025 (Eintragungsdatum)\n\nGBI Wohnungsbau GmbH\nGesellschaft mit beschränkter Haftung\nErlangen\n\nDen Gläubigern der an der Verschmelzung beteiligten Rechtsträger ist, wenn sie binnen sechs Monaten nach dem Tag, an dem die Eintragung der Verschmelzung in das Register des Sitzes desjenigen Rechtsträgers, dessen Gläubiger sie sind, nach § 19 Abs. 3 UmwG als bekannt gemacht gilt, ihren Anspruch nach Grund und Höhe in Textform anmelden, Sicherheit zu leisten, soweit sie nicht Befriedigung verlangen können. Dieses Recht steht den Gläubigern jedoch nur zu, wenn sie glaubhaft machen, dass durch die Verschmelzung die Erfüllung ihrer Forderung gefährdet wird."
    },
    {
      "date": "2025-07-01",
      "id": "114005",
      "original_text": "Löschungsankündigung\nBayern Amtsgericht Traunstein HRB 26833\nS & K Bau GmbH – Töging a.Inn",
      "type": "Löschungsankündigung",
      "state": "Bayern",
      "amtsgericht": "Amtsgericht Traunstein",
      "registernummer": "HRB 26833",
      "registerart": "HRB",
      "company_name": "S & K Bau GmbH",
      "company_seat": "Töging a.Inn",
      "details": "01.07.2025 (Bekanntmachungsdatum)\n\nBayern Amtsgericht Traunstein HRB 26833\nLöschungsankündigung 30.06.2025 (Eintragungsdatum)\n\nS & K Bau GmbH\nGesellschaft mit beschränkter Haftung\nTöging a.Inn\n\nDas Registergericht beabsichtigt, die im Handelsregister eingetragene Gesellschaft wegen Vermögenslosigkeit von Amts wegen nach § 394 FamFG zu löschen. Die Frist zur Erhebung eines Widerspruchs ist auf einen Monat festgesetzt."
    },
    {
      "date": "2025-07-01",
      "id": "114006",
      "original_text": "Löschungsankündigung\nBayern Amtsgericht München HRB 184192\nVEGO GmbH – München",
      "type": "Löschungsankündigung",
      "state": "Bayern",
      "amtsgericht": "Amtsgericht München",
      "registernummer": "HRB 184192",
      "registerart": "HRB",
      "company_name": "VEGO GmbH",
      "company_seat": "München",
      "details": "01.07.2025 (Bekanntmachungsdatum)\n\nBayern Amtsgericht München HRB 184192\nLöschungsankündigung\n\nVEGO GmbH\nGesellschaft mit beschränkter Haftung\nMünchen\n\nDas Registergericht beabsichtigt, die im Handelsregister eingetragene Gesellschaft wegen Vermögenslosigkeit von Amts wegen nach § 394 FamFG zu löschen. Die Frist zur Erhebung eines Widerspruchs ist auf drei Monate festgesetzt."
    },
    {
      "date": "2025-07-01",
      "id": "114007",
      "original_text": "Registerbekanntmachung nach dem Umwandlungsgesetz\nBayern Amtsgericht Traunstein HRB 33737\nOSW 10 Ookam Beteiligungs GmbH – Stephanskirchen",
      "type": "Registerbekanntmachung nach dem Umwandlungsgesetz",
      "state": "Bayern",
      "amtsgericht": "Amtsgericht Traunstein",
      "registernummer": "HRB 33737",
      "registerart": "HRB",
      "company_name": "OSW 10 Ookam Beteiligungs GmbH",
      "company_seat": "Stephanskirchen",
      "details": "01.07.2025 (Bekanntmachungsdatum)\n\nBayern Amtsgericht Traunstein HRB 33737\nRegisterbekanntmachung nach dem Umwandlungsgesetz 30.06.2025 (Eintragungsdatum)\n\nOSW 10 Ookam Beteiligungs GmbH\nGesellschaft mit beschränkter Haftung\nStephanskirchen\n\nDen Gläubigern der an der Verschmelzung beteiligten Rechtsträger ist, wenn sie binnen sechs Monaten nach dem Tag, an dem die Eintragung der Verschmelzung in das Register des Sitzes desjenigen Rechtsträgers, dessen Gläubiger sie sind, nach § 19 Abs. 3 UmwG als bekannt gemacht gilt, ihren Anspruch nach Grund und Höhe in Textform anmelden, Sicherheit zu leisten, soweit sie nicht Befriedigung verlangen können. Dieses Recht steht den Gläubigern jedoch nur zu, wenn sie glaubhaft machen, dass durch die Verschmelzung die Erfüllung ihrer Forderung gefährdet wird."
    },
    {
      "date": "2025-07-01",
      "id": "114008",
      "original_text": "Registerbekanntmachung nach dem Umwandlungsgesetz\nBayern Amtsgericht Augsburg HRB 35799\nFLSmidth Germany GmbH – Augsburg",
      "type": "Registerbekanntmachung nach dem Umwandlungsgesetz",
      "state": "Bayern",
      "amtsgericht": "Amtsgericht Augsburg",
      "registernummer": "HRB 35799",
      "registerart": "HRB",
      "company_name": "FLSmidth Germany GmbH",
      "company_seat": "Augsburg",
      "details": "01.07.2025 (Bekanntmachungsdatum)\n\nBayern Amtsgericht Augsburg HRB 35799\nRegisterbekanntmachung nach dem Umwandlungsgesetz 30.06.2025 (Eintragungsdatum)\n\nFLSmidth Germany GmbH\nGesellschaft mit beschränkter Haftung\nAugsburg\n\nDen Gläubigern der an der Verschmelzung beteiligten Rechtsträger ist, wenn sie binnen sechs Monaten nach dem Tag, an dem die Eintragung der Verschmelzung in das Register des Sitzes desjenigen Rechtsträgers, dessen Gläubiger sie sind, nach § 19 Abs. 3 UmwG als bekannt gemacht gilt, ihren Anspruch nach Grund und Höhe in Textform anmelden, Sicherheit zu leisten, soweit sie nicht Befriedigung verlangen können. Dieses Recht steht den Gläubigern jedoch nur zu, wenn sie glaubhaft machen, dass durch die Verschmelzung die Erfüllung ihrer Forderung gefährdet wird."
    },
    {
      "date": "2025-07-01",
      "id": "114009",
      "original_text": "Registerbekanntmachung nach dem Umwandlungsgesetz\nBayern Amtsgericht München HRB 288178\nHowden Deutschland AG – München",
      "type": "Registerbekanntmachung nach dem Umwandlungsgesetz",
      "state": "Bayern",
      "amtsgericht": "Amtsgericht München",
      "registernummer": "HRB 288178",
      "registerart": "HRB",
      "company_name": "Howden Deutschland AG",
      "company_seat": "München",
      "details": "01.07.2025 (Bekanntmachungsdatum)\n\nBayern Amtsgericht München HRB 288178\nRegisterbekanntmachung nach dem Umwandlungsgesetz 30.06.2025 (Eintragungsdatum)\n\nHowden Deutschland AG\nAktiengesellschaft\nMünchen\n\nDen Gläubigern der an der Verschmelzung beteiligten Rechtsträger ist, wenn sie binnen sechs Monaten nach dem Tag, an dem die Eintragung der Verschmelzung in das Register des Sitzes desjenigen Rechtsträgers, dessen Gläubiger sie sind, nach § 19 Abs. 3 UmwG als bekannt gemacht gilt, ihren Anspruch nach Grund und Höhe in Textform anmelden, Sicherheit zu leisten, soweit sie nicht Befriedigung verlangen können. Dieses Recht steht den Gläubigern jedoch nur zu, wenn sie glaubhaft machen, dass durch die Verschmelzung die Erfüllung ihrer Forderung gefährdet wird."
    },
    {
      "date": "2025-07-01",
      "id": "114010",
      "original_text": "Einreichung neuer Dokumente\nBayern Amtsgericht München HRB 205601\neXaring AG – München",
      "type": "Einreichung neuer Dokumente",
      "state": "Bayern",
      "amtsgericht": "Amtsgericht München",
      "registernummer": "HRB 205601",
      "registerart": "HRB",
      "company_name": "eXaring AG",
      "company_seat": "München",
      "details": "01.07.2025 (Bekanntmachungsdatum)\n\nBayern Amtsgericht München HRB 205601\nEinreichung neuer Dokumente 30.06.2025 (Eintragungsdatum)\n\neXaring AG\nAktiengesellschaft\nMünchen\n\nDem Amtsgericht München -Registergericht- ist eine Liste der Mitglieder des Aufsichtsrats eingereicht worden, § 106 AktG."
    },
    {
      "date": "2025-07-01",
      "id": "114011",
      "original_text": "Registerbekanntmachung nach dem Umwandlungsgesetz\nBayern Amtsgericht Ansbach HRA 4468\nBeyer Zimmerei Schreinerei GmbH & Co. KG – Heidenheim",
      "type": "Registerbekanntmachung nach dem Umwandlungsgesetz",
      "state": "Bayern",
      "amtsgericht": "Amtsgericht Ansbach",
      "registernummer": "HRA 4468",
      "registerart": "HRA",
      "company_name": "Beyer Zimmerei Schreinerei GmbH & Co. KG",
      "company_seat": "Heidenheim",
      "details": "01.07.2025 (Bekanntmachungsdatum)\n\nBayern Amtsgericht Ansbach HRA 4468\nRegisterbekanntmachung nach dem Umwandlungsgesetz 30.06.2025 (Eintragungsdatum)\n\nBeyer Zimmerei Schreinerei GmbH & Co. KG\nKommanditgesellschaft\nHeidenheim\n\nDen Gläubigern der an der Verschmelzung beteiligten Rechtsträger ist, wenn sie binnen sechs Monaten nach dem Tag, an dem die Eintragung der Verschmelzung in das Register des Sitzes desjenigen Rechtsträgers, dessen Gläubiger sie sind, nach § 19 Abs. 3 UmwG als bekannt gemacht gilt, ihren Anspruch nach Grund und Höhe in Textform anmelden, Sicherheit zu leisten, soweit sie nicht Befriedigung verlangen können. Dieses Recht steht den Gläubigern jedoch nur zu, wenn sie glaubhaft machen, dass durch die Verschmelzung die Erfüllung ihrer Forderung gefährdet wird."
    },
    {
      "date": "2025-07-01",
      "id": "114012",
      "original_text": "Löschungsankündigung\nBayern Amtsgericht Nürnberg HRB 26191\nFerstl - Schultheiss UG (haftungsbeschränkt) – Nürnberg",
      "type": "Löschungsankündigung",
      "state": "Bayern",
      "amtsgericht": "Amtsgericht Nürnberg",
      "registernummer": "HRB 26191",
      "registerart": "HRB",
      "company_name": "Ferstl - Schultheiss UG (haftungsbeschränkt)",
      "company_seat": "Nürnberg",
      "details": "01.07.2025 (Bekanntmachungsdatum)\n\nBayern Amtsgericht Nürnberg HRB 26191\nLöschungsankündigung\n\nFerstl - Schultheiss UG (haftungsbeschränkt)\nGesellschaft mit beschränkter Haftung\nNürnberg\n\nDas Registergericht beabsichtigt, die im Handelsregister eingetragene Gesellschaft wegen Vermögenslosigkeit von Amts wegen nach § 394 FamFG zu löschen. Die Frist zur Erhebung eines Widerspruchs ist auf einen Monat festgesetzt."
    },
    {
      "date": "2025-07-01",
      "id": "114013",
      "original_text": "Löschungsankündigung\nBayern Amtsgericht Ansbach HRB 6723\nNaturholz 99 UG (haftungsbeschränkt) – Absberg",
      "type": "Löschungsankündigung",
      "state": "Bayern",
      "amtsgericht": "Amtsgericht Ansbach",
      "registernummer": "HRB 6723",
      "registerart": "HRB",
      "company_name": "Naturholz 99 UG (haftungsbeschränkt)",
      "company_seat": "Absberg",
      "details": "01.07.2025 (Bekanntmachungsdatum)\n\nBayern Amtsgericht Ansbach HRB 6723\nLöschungsankündigung\n\nNaturholz 99 UG (haftungsbeschränkt)\nGesellschaft mit beschränkter Haftung\nAbsberg\n\nDas Registergericht beabsichtigt, die im Handelsregister eingetragene Gesellschaft wegen Vermögenslosigkeit von Amts wegen nach § 394 FamFG zu löschen. Die Frist zur Erhebung eines Widerspruchs ist auf sechs Wochen festgesetzt."
    },
    {
      "date": "2025-07-01",
      "id": "114014",
      "original_text": "Registerbekanntmachung nach dem Umwandlungsgesetz\nBayern Amtsgericht Hof HRB 6575\nbeosh GmbH – Hof",
      "type": "Registerbekanntmachung nach dem Umwandlungsgesetz",
      "state": "Bayern",
      "amtsgericht": "Amtsgericht Hof",
      "registernummer": "HRB 6575",
      "registerart": "HRB",
      "company_name": "beosh GmbH",
      "company_seat": "Hof",
      "details": "01.07.2025 (Bekanntmachungsdatum)\n\nBayern Amtsgericht Hof HRB 6575\nRegisterbekanntmachung nach dem Umwandlungsgesetz 30.06.2025 (Eintragungsdatum)\n\nbeosh GmbH\nGesellschaft mit beschränkter Haftung\nHof\n\nDen Gläubigern der an der Verschmelzung beteiligten Rechtsträger ist, wenn sie binnen sechs Monaten nach dem Tag, an dem die Eintragung der Verschmelzung in das Register des Sitzes desjenigen Rechtsträgers, dessen Gläubiger sie sind, nach § 19 Abs. 3 UmwG als bekannt gemacht gilt, ihren Anspruch nach Grund und Höhe in Textform anmelden, Sicherheit zu leisten, soweit sie nicht Befriedigung verlangen können. Dieses Recht steht den Gläubigern jedoch nur zu, wenn sie glaubhaft machen, dass durch die Verschmelzung die Erfüllung ihrer Forderung gefährdet wird."
    },
    {
      "date": "2025-07-01",
      "id": "114015",
      "original_text": "Registerbekanntmachung nach dem Umwandlungsgesetz\nBayern Amtsgericht München HRB 254053\nTierärzte IVC Evidensia GmbH – München",
      "type": "Registerbekanntmachung nach dem Umwandlungsgesetz",
      "state": "Bayern",
      "amtsgericht": "Amtsgericht München",
      "registernummer": "HRB 254053",
      "registerart": "HRB",
      "company_name": "Tierärzte IVC Evidensia GmbH",
      "company_seat": "München",
      "details": "01.07.2025 (Bekanntmachungsdatum)\n\nBayern Amtsgericht München HRB 254053\nRegisterbekanntmachung nach dem Umwandlungsgesetz 30.06.2025 (Eintragungsdatum)\n\nTierärzte IVC Evidensia GmbH\nGesellschaft mit beschränkter Haftung\nMünchen\n\nDen Gläubigern der an der Verschmelzung beteiligten Rechtsträger ist, wenn sie binnen sechs Monaten nach dem Tag, an dem die Eintragung der Verschmelzung in das Register des Sitzes desjenigen Rechtsträgers, dessen Gläubiger sie sind, nach § 19 Abs. 3 UmwG als bekannt gemacht gilt, ihren Anspruch nach Grund und Höhe in Textform anmelden, Sicherheit zu leisten, soweit sie nicht Befriedigung verlangen können. Dieses Recht steht den Gläubigern jedoch nur zu, wenn sie glaubhaft machen, dass durch die Verschmelzung die Erfüllung ihrer Forderung gefährdet wird."
    },
    {
      "date": "2025-07-01",
      "id": "114016",
      "original_text": "Löschungsankündigung\nBayern Amtsgericht Bayreuth HRB 4183\nH + M Fahrzeugservice GmbH – Plankenfels",
      "type": "Löschungsankündigung",
      "state": "Bayern",
      "amtsgericht": "Amtsgericht Bayreuth",
      "registernummer": "HRB 4183",
      "registerart": "HRB",
      "company_name": "H + M Fahrzeugservice GmbH",
      "company_seat": "Plankenfels",
      "details": "01.07.2025 (Bekanntmachungsdatum)\n\nBayern Amtsgericht Bayreuth HRB 4183\nLöschungsankündigung\n\nH + M Fahrzeugservice GmbH\nGesellschaft mit beschränkter Haftung\nPlankenfels\n\nDas Registergericht beabsichtigt, die im Handelsregister eingetragene Gesellschaft wegen Vermögenslosigkeit von Amts wegen nach § 394 FamFG zu löschen. Die Frist zur Erhebung eines Widerspruchs ist auf einen Monat festgesetzt."
    },
    {
      "date": "2025-07-01",
      "id": "114017",
      "original_text": "Einreichung neuer Dokumente\nBayern Amtsgericht München HRB 140987\nKonrad Unsin AG – Erdweg",
      "type": "Einreichung neuer Dokumente",
      "state": "Bayern",
      "amtsgericht": "Amtsgericht München",
      "registernummer": "HRB 140987",
      "registerart": "HRB",
      "company_name": "Konrad Unsin AG",
      "company_seat": "Erdweg",
      "details": "01.07.2025 (Bekanntmachungsdatum)\n\nBayern Amtsgericht München HRB 140987\nEinreichung neuer Dokumente\n\nKonrad Unsin AG\nAktiengesellschaft\nErdweg\n\nDem Amtsgericht München -Registergericht- ist eine Liste der Mitglieder des Aufsichtsrats eingereicht worden, § 106 AktG."
    },
    {
      "date": "2025-07-01",
      "id": "114018",
      "original_text": "Registerbekanntmachung nach dem Umwandlungsgesetz\nBayern Amtsgericht München HRB 247550\nAglini Holding GmbH – München",
      "type": "Registerbekanntmachung nach dem Umwandlungsgesetz",
      "state": "Bayern",
      "amtsgericht": "Amtsgericht München",
      "registernummer": "HRB 247550",
      "registerart": "HRB",
      "company_name": "Aglini Holding GmbH",
      "company_seat": "München",
      "details": "01.07.2025 (Bekanntmachungsdatum)\n\nBayern Amtsgericht München HRB 247550\nRegisterbekanntmachung nach dem Umwandlungsgesetz 30.06.2025 (Eintragungsdatum)\n\nAglini Holding GmbH\nGesellschaft mit beschränkter Haftung\nMünchen\n\nDen Gläubigern der an der Verschmelzung beteiligten Rechtsträger ist, wenn sie binnen sechs Monaten nach dem Tag, an dem die Eintragung der Verschmelzung in das Register des Sitzes desjenigen Rechtsträgers, dessen Gläubiger sie sind, nach § 19 Abs. 3 UmwG als bekannt gemacht gilt, ihren Anspruch nach Grund und Höhe in Textform anmelden, Sicherheit zu leisten, soweit sie nicht Befriedigung verlangen können. Dieses Recht steht den Gläubigern jedoch nur zu, wenn sie glaubhaft machen, dass durch die Verschmelzung die Erfüllung ihrer Forderung gefährdet wird."
    },
    {
      "date": "2025-07-01",
      "id": "114019",
      "original_text": "Registerbekanntmachung nach dem Umwandlungsgesetz\nBayern Amtsgericht München HRB 204580\nLHI Kapitalverwaltungsgesellschaft mbH – Pullach i.Isartal",
      "type": "Registerbekanntmachung nach dem Umwandlungsgesetz",
      "state": "Bayern",
      "amtsgericht": "Amtsgericht München",
      "registernummer": "HRB 204580",
      "registerart": "HRB",
      "company_name": "LHI Kapitalverwaltungsgesellschaft mbH",
      "company_seat": "Pullach i.Isartal",
      "details": "01.07.2025 (Bekanntmachungsdatum)\n\nBayern Amtsgericht München HRB 204580\nRegisterbekanntmachung nach dem Umwandlungsgesetz 30.06.2025 (Eintragungsdatum)\n\nLHI Kapitalverwaltungsgesellschaft mbH\nGesellschaft mit beschränkter Haftung\nPullach i.Isartal\n\nDen Gläubigern der an der Verschmelzung beteiligten Rechtsträger ist, wenn sie binnen sechs Monaten nach dem Tag, an dem die Eintragung der Verschmelzung in das Register des Sitzes desjenigen Rechtsträgers, dessen Gläubiger sie sind, nach § 19 Abs. 3 UmwG als bekannt gemacht gilt, ihren Anspruch nach Grund und Höhe in Textform anmelden, Sicherheit zu leisten, soweit sie nicht Befriedigung verlangen können. Dieses Recht steht den Gläubigern jedoch nur zu, wenn sie glaubhaft machen, dass durch die Verschmelzung die Erfüllung ihrer Forderung gefährdet wird."
    },
    {
      "date": "2025-07-01",
      "id": "114020",
      "original_text": "Registerbekanntmachung nach dem Umwandlungsgesetz\nBayern Amtsgericht Traunstein HRB 33795\nOSW 7 Ookam Beteiligungs GmbH – Stephanskirchen",
      "type": "Registerbekanntmachung nach dem Umwandlungsgesetz",
      "state": "Bayern",
      "amtsgericht": "Amtsgericht Traunstein",
      "registernummer": "HRB 33795",
      "registerart": "HRB",
      "company_name": "OSW 7 Ookam Beteiligungs GmbH",
      "company_seat": "Stephanskirchen",
      "details": "01.07.2025 (Bekanntmachungsdatum)\n\nBayern Amtsgericht Traunstein HRB 33795\nRegisterbekanntmachung nach dem Umwandlungsgesetz 30.06.2025 (Eintragungsdatum)\n\nOSW 7 Ookam Beteiligungs GmbH\nGesellschaft mit beschränkter Haftung\nStephanskirchen\n\nDen Gläubigern der an der Verschmelzung beteiligten Rechtsträger ist, wenn sie binnen sechs Monaten nach dem Tag, an dem die Eintragung der Verschmelzung in das Register des Sitzes desjenigen Rechtsträgers, dessen Gläubiger sie sind, nach § 19 Abs. 3 UmwG als bekannt gemacht gilt, ihren Anspruch nach Grund und Höhe in Textform anmelden, Sicherheit zu leisten, soweit sie nicht Befriedigung verlangen können. Dieses Recht steht den Gläubigern jedoch nur zu, wenn sie glaubhaft machen, dass durch die Verschmelzung die Erfüllung ihrer Forderung gefährdet wird."
    },
    {
      "date": "2025-07-01",
      "id": "114021",
      "original_text": "Registerbekanntmachung nach dem Umwandlungsgesetz\nBayern Amtsgericht Schweinfurt HRB 7868\nGrindConsult UG (haftungsbeschränkt) – Gerolzhofen",
      "type": "Registerbekanntmachung nach dem Umwandlungsgesetz",
      "state": "Bayern",
      "amtsgericht": "Amtsgericht Schweinfurt",
      "registernummer": "HRB 7868",
      "registerart": "HRB",
      "company_name": "GrindConsult UG (haftungsbeschränkt)",
      "company_seat": "Gerolzhofen",
      "details": "01.07.2025 (Bekanntmachungsdatum)\n\nBayern Amtsgericht Schweinfurt HRB 7868\nRegisterbekanntmachung nach dem Umwandlungsgesetz 30.06.2025 (Eintragungsdatum)\n\nGrindConsult UG (haftungsbeschränkt)\nGesellschaft mit beschränkter Haftung\nGerolzhofen\n\nDen Gläubigern der an der Verschmelzung beteiligten Rechtsträger ist, wenn sie binnen sechs Monaten nach dem Tag, an dem die Eintragung der Verschmelzung in das Register des Sitzes desjenigen Rechtsträgers, dessen Gläubiger sie sind, nach § 19 Abs. 3 UmwG als bekannt gemacht gilt, ihren Anspruch nach Grund und Höhe in Textform anmelden, Sicherheit zu leisten, soweit sie nicht Befriedigung verlangen können. Dieses Recht steht den Gläubigern jedoch nur zu, wenn sie glaubhaft machen, dass durch die Verschmelzung die Erfüllung ihrer Forderung gefährdet wird."
    },
    {
      "date": "2025-07-01",
      "id": "114022",
      "original_text": "Registerbekanntmachung nach dem Umwandlungsgesetz\nBayern Amtsgericht Augsburg HRB 19462\nFahrschule Naßl GmbH – Aindling",
      "type": "Registerbekanntmachung nach dem Umwandlungsgesetz",
      "state": "Bayern",
      "amtsgericht": "Amtsgericht Augsburg",
      "registernummer": "HRB 19462",
      "registerart": "HRB",
      "company_name": "Fahrschule Naßl GmbH",
      "company_seat": "Aindling",
      "details": "01.07.2025 (Bekanntmachungsdatum)\n\nBayern Amtsgericht Augsburg HRB 19462\nRegisterbekanntmachung nach dem Umwandlungsgesetz 30.06.2025 (Eintragungsdatum)\n\nFahrschule Naßl GmbH\nGesellschaft mit beschränkter Haftung\nAindling\n\nDen Gläubigern der an der Verschmelzung beteiligten Rechtsträger ist, wenn sie binnen sechs Monaten nach dem Tag, an dem die Eintragung der Verschmelzung in das Register des Sitzes desjenigen Rechtsträgers, dessen Gläubiger sie sind, nach § 19 Abs. 3 UmwG als bekannt gemacht gilt, ihren Anspruch nach Grund und Höhe in Textform anmelden, Sicherheit zu leisten, soweit sie nicht Befriedigung verlangen können. Dieses Recht steht den Gläubigern jedoch nur zu, wenn sie glaubhaft machen, dass durch die Verschmelzung die Erfüllung ihrer Forderung gefährdet wird."
    },
    {
      "date": "2025-07-01",
      "id": "114023",
      "original_text": "Registerbekanntmachung nach dem Umwandlungsgesetz\nBayern Amtsgericht München HRB 288475\nSarakatsanis Holding GmbH – München",
      "type": "Registerbekanntmachung nach dem Umwandlungsgesetz",
      "state": "Bayern",
      "amtsgericht": "Amtsgericht München",
      "registernummer": "HRB 288475",
      "registerart": "HRB",
      "company_name": "Sarakatsanis Holding GmbH",
      "company_seat": "München",
      "details": "01.07.2025 (Bekanntmachungsdatum)\n\nBayern Amtsgericht München HRB 288475\nRegisterbekanntmachung nach dem Umwandlungsgesetz 30.06.2025 (Eintragungsdatum)\n\nSarakatsanis Holding GmbH\nGesellschaft mit beschränkter Haftung\nMünchen\n\nDen Gläubigern der an der Verschmelzung beteiligten Rechtsträger ist, wenn sie binnen sechs Monaten nach dem Tag, an dem die Eintragung der Verschmelzung in das Register des Sitzes desjenigen Rechtsträgers, dessen Gläubiger sie sind, nach § 19 Abs. 3 UmwG als bekannt gemacht gilt, ihren Anspruch nach Grund und Höhe in Textform anmelden, Sicherheit zu leisten, soweit sie nicht Befriedigung verlangen können. Dieses Recht steht den Gläubigern jedoch nur zu, wenn sie glaubhaft machen, dass durch die Verschmelzung die Erfüllung ihrer Forderung gefährdet wird."
    },
    {
      "date": "2025-07-01",
      "id": "114024",
      "original_text": "Einreichung neuer Dokumente\nBayern Amtsgericht München HRB 228044\nPlasmed AG – Schongau",
      "type": "Einreichung neuer Dokumente",
      "state": "Bayern",
      "amtsgericht": "Amtsgericht München",
      "registernummer": "HRB 228044",
      "registerart": "HRB",
      "company_name": "Plasmed AG",
      "company_seat": "Schongau",
      "details": "01.07.2025 (Bekanntmachungsdatum)\n\nBayern Amtsgericht München HRB 228044\nEinreichung neuer Dokumente 30.06.2025 (Eintragungsdatum)\n\nPlasmed AG\nAktiengesellschaft\nSchongau\n\nDem Amtsgericht München -Registergericht- ist eine Liste der Mitglieder des Aufsichtsrats eingereicht worden, § 106 AktG."
    },
    {
      "date": "2025-07-01",
      "id": "114025",
      "original_text": "Registerbekanntmachung nach dem Umwandlungsgesetz\nBayern Amtsgericht Memmingen HRA 14259\nKonstanzer Versicherungsmakler GmbH & Co. KG – Neu-Ulm",
      "type": "Registerbekanntmachung nach dem Umwandlungsgesetz",
      "state": "Bayern",
      "amtsgericht": "Amtsgericht Memmingen",
      "registernummer": "HRA 14259",
      "registerart": "HRA",
      "company_name": "Konstanzer Versicherungsmakler GmbH & Co. KG",
      "company_seat": "Neu-Ulm",
      "details": "01.07.2025 (Bekanntmachungsdatum)\n\nBayern Amtsgericht Memmingen HRA 14259\nRegisterbekanntmachung nach dem Umwandlungsgesetz 29.06.2025 (Eintragungsdatum)\n\nKonstanzer Versicherungsmakler GmbH & Co. KG\nKommanditgesellschaft\nNeu-Ulm\n\nDen Gläubigern der an der Ausgliederung beteiligten Rechtsträger ist, wenn sie binnen sechs Monaten nach dem Tag, an dem die Eintragung der Ausgliederung in das Register des Sitzes desjenigen Rechtsträgers, dessen Gläubiger sie sind, nach §§ 125, 19 Abs. 3 UmwG als bekannt gemacht gilt, ihren Anspruch nach Grund und Höhe in Textform anmelden, Sicherheit zu leisten, soweit sie nicht Befriedigung verlangen können. Dieses Recht steht den Gläubigern jedoch nur zu, wenn sie glaubhaft machen, dass durch die Ausgliederung die Erfüllung ihrer Forderung gefährdet wird."
    },
    {
      "date": "2025-07-01",
      "id": "114026",
      "original_text": "Einreichung neuer Dokumente\nBaden-Württemberg Amtsgericht Stuttgart HRB 778870\nhGears AG – Schramberg",
      "type": "Einreichung neuer Dokumente",
      "state": "Baden-Württemberg",
      "amtsgericht": "Amtsgericht Stuttgart",
      "registernummer": "HRB 778870",
      "registerart": "HRB",
      "company_name": "hGears AG",
      "company_seat": "Schramberg",
      "details": "01.07.2025 (Bekanntmachungsdatum)\n\nBaden-Württemberg Amtsgericht Stuttgart HRB 778870\nEinreichung neuer Dokumente 01.07.2025 (Eintragungsdatum)\n\nhGears AG\nAktiengesellschaft\nSchramberg\n\nDie Gesellschaft hat am 26.06.2025 die Liste über die Zusammensetzung des Aufsichtsrats zum Handelsregister eingereicht."
    },
    {
      "date": "2025-07-01",
      "id": "114027",
      "original_text": "Registerbekanntmachung nach dem Umwandlungsgesetz\nBaden-Württemberg Amtsgericht Mannheim HRB 719592\nAK Vertriebs GmbH – Ubstadt-Weiher",
      "type": "Registerbekanntmachung nach dem Umwandlungsgesetz",
      "state": "Baden-Württemberg",
      "amtsgericht": "Amtsgericht Mannheim",
      "registernummer": "HRB 719592",
      "registerart": "HRB",
      "company_name": "AK Vertriebs GmbH",
      "company_seat": "Ubstadt-Weiher",
      "details": "01.07.2025 (Bekanntmachungsdatum)\n\nBaden-Württemberg Amtsgericht Mannheim HRB 719592\nRegisterbekanntmachung nach dem Umwandlungsgesetz 01.07.2025 (Eintragungsdatum)\n\nAK Vertriebs GmbH\nGesellschaft mit beschränkter Haftung\nUbstadt-Weiher\n\nAls nicht eingetragen wird bekanntgemacht:\nDen Gläubigern der an der Verschmelzung beteiligten Rechtsträger ist, wenn sie binnen sechs Monaten nach dem Tag, an dem die Eintragung der Verschmelzung in das Register des Sitzes desjenigen Rechtsträgers, dessen Gläubiger sie sind, nach § 19 Abs. 3 UmwG als bekanntgemacht gilt, ihren Anspruch nach Grund und Höhe schriftlich anmelden, Sicherheit zu leisten, soweit sie nicht Befriedigung verlangen können. Dieses Recht steht den Gläubigern jedoch nur zu, wenn sie glaubhaft machen, dass durch die Verschmelzung die Erfüllung ihrer Forderung gefährdet wird."
    },
    {
      "date": "2025-07-01",
      "id": "114028",
      "original_text": "Registerbekanntmachung nach dem Umwandlungsgesetz\nHamburg Amtsgericht Hamburg HRB 95967\nHermes Fulfilment GmbH – Hamburg",
      "type": "Registerbekanntmachung nach dem Umwandlungsgesetz",
      "state": "Hamburg",
      "amtsgericht": "Amtsgericht Hamburg",
      "registernummer": "HRB 95967",
      "registerart": "HRB",
      "company_name": "Hermes Fulfilment GmbH",
      "company_seat": "Hamburg",
      "details": "01.07.2025 (Bekanntmachungsdatum)\n\nHamburg Amtsgericht Hamburg HRB 95967\nRegisterbekanntmachung nach dem Umwandlungsgesetz 01.07.2025 (Eintragungsdatum)\n\nHermes Fulfilment GmbH\nGesellschaft mit beschränkter Haftung\nHamburg\n\nAls nicht eingetragen wird bekannt gemacht:\nDen Gläubigern der an der Verschmelzung beteiligten Gesellschaften ist, wenn sie binnen sechs Monaten nach dem Tag, an dem die Eintragung der Verschmelzung in das Register des Sitzes desjenigen Rechtsträgers, dessen Gläubiger sie sind, nach § 19 Absatz 3 UmwG als bekannt gemacht gilt, ihren Anspruch nach Grund und Höhe schriftlich anmelden, Sicherheit zu leisten, soweit sie nicht Befriedigung verlangen können. Dieses Recht steht den Gläubigern jedoch nur zu, wenn sie glaubhaft machen, dass durch die Verschmelzung die Erfüllung ihrer Forderung gefährdet wird."
    },
    {
      "date": "2025-07-01",
      "id": "114029",
      "original_text": "Sonstige Registerbekanntmachung\nBaden-Württemberg Amtsgericht Mannheim HRB 106177\nSteurer GmbH – Karlsruhe",
      "type": "Sonstige Registerbekanntmachung",
      "state": "Baden-Württemberg",
      "amtsgericht": "Amtsgericht Mannheim",
      "registernummer": "HRB 106177",
      "registerart": "HRB",
      "company_name": "Steurer GmbH",
      "company_seat": "Karlsruhe",
      "details": "01.07.2025 (Bekanntmachungsdatum)\n\nBaden-Württemberg Amtsgericht Mannheim HRB 106177\nSonstige Registerbekanntmachung 01.07.2025 (Eintragungsdatum)\n\nSteurer GmbH\nGesellschaft mit beschränkter Haftung\nKarlsruhe\n\nDen Gläubigern der Gesellschaft, deren Forderungen begründet worden sind, bevor die Eintragung der Beendigung des Vertrages in das Handelsregister nach § 10 HGB als bekanntgemacht gilt, ist vom anderen Vertragsteil Sicherheit zu leisten, wenn sie sich binnen sechs Monaten nach der Bekanntmachung zu diesem Zweck bei ihm melden."
    },
    {
      "date": "2025-07-01",
      "id": "114030",
      "original_text": "Registerbekanntmachung nach dem Umwandlungsgesetz\nHamburg Amtsgericht Hamburg HRB 153466\nHermes Auslieferungsbasis Ohrdruf GmbH – Hamburg",
      "type": "Registerbekanntmachung nach dem Umwandlungsgesetz",
      "state": "Hamburg",
      "amtsgericht": "Amtsgericht Hamburg",
      "registernummer": "HRB 153466",
      "registerart": "HRB",
      "company_name": "Hermes Auslieferungsbasis Ohrdruf GmbH",
      "company_seat": "Hamburg",
      "details": "01.07.2025 (Bekanntmachungsdatum)\n\nHamburg Amtsgericht Hamburg HRB 153466\nRegisterbekanntmachung nach dem Umwandlungsgesetz 01.07.2025 (Eintragungsdatum)\n\nHermes Auslieferungsbasis Ohrdruf GmbH\nGesellschaft mit beschränkter Haftung\nHamburg\n\nAls nicht eingetragen wird bekannt gemacht:\nDen Gläubigern der an der Verschmelzung beteiligten Gesellschaften ist, wenn sie binnen sechs Monaten nach dem Tag, an dem die Eintragung der Verschmelzung in das Register des Sitzes desjenigen Rechtsträgers, dessen Gläubiger sie sind, nach § 19 Absatz 3 UmwG als bekannt gemacht gilt, ihren Anspruch nach Grund und Höhe schriftlich anmelden, Sicherheit zu leisten, soweit sie nicht Befriedigung verlangen können. Dieses Recht steht den Gläubigern jedoch nur zu, wenn sie glaubhaft machen, dass durch die Verschmelzung die Erfüllung ihrer Forderung gefährdet wird."
    },
    {
      "date": "2025-07-01",
      "id": "114031",
      "original_text": "Registerbekanntmachung nach dem Umwandlungsgesetz\nBaden-Württemberg Amtsgericht Freiburg HRB 31\nSchwarzwald Reisebüro Freiburg, Gesellschaft mit beschränkter Haftung, – Freiburg im Breisgau",
      "type": "Registerbekanntmachung nach dem Umwandlungsgesetz",
      "state": "Baden-Württemberg",
      "amtsgericht": "Amtsgericht Freiburg",
      "registernummer": "HRB 31",
      "registerart": "HRB",
      "company_name": "Schwarzwald Reisebüro Freiburg, Gesellschaft mit beschränkter Haftung,",
      "company_seat": "Freiburg im Breisgau",
      "details": "01.07.2025 (Bekanntmachungsdatum)\n\nBaden-Württemberg Amtsgericht Freiburg HRB 31\nRegisterbekanntmachung nach dem Umwandlungsgesetz 01.07.2025 (Eintragungsdatum)\n\nSchwarzwald Reisebüro Freiburg, Gesellschaft mit beschränkter Haftung,\nGesellschaft mit beschränkter Haftung\nFreiburg im Breisgau\n\nAls nicht eingetragen wird bekanntgemacht:\nDen Gläubigern der an der Verschmelzung beteiligten Rechtsträger ist, wenn sie binnen sechs Monaten nach dem Tag, an dem die Eintragung der Verschmelzung in das Register des Sitzes desjenigen Rechtsträgers, dessen Gläubiger sie sind, nach § 19 Abs. 3 UmwG als bekanntgemacht gilt, ihren Anspruch nach Grund und Höhe schriftlich anmelden, Sicherheit zu leisten, soweit sie nicht Befriedigung verlangen können. Dieses Recht steht den Gläubigern jedoch nur zu, wenn sie glaubhaft machen, dass durch die Verschmelzung die Erfüllung ihrer Forderung gefährdet wird."
    },
    {
      "date": "2025-07-01",
      "id": "114032",
      "original_text": "Registerbekanntmachung nach dem Umwandlungsgesetz\nHamburg Amtsgericht Hamburg HRB 133037\nNewell Brands Germany GmbH – Hamburg",
      "type": "Registerbekanntmachung nach dem Umwandlungsgesetz",
      "state": "Hamburg",
      "amtsgericht": "Amtsgericht Hamburg",
      "registernummer": "HRB 133037",
      "registerart": "HRB",
      "company_name": "Newell Brands Germany GmbH",
      "company_seat": "Hamburg",
      "details": "01.07.2025 (Bekanntmachungsdatum)\n\nHamburg Amtsgericht Hamburg HRB 133037\nRegisterbekanntmachung nach dem Umwandlungsgesetz 01.07.2025 (Eintragungsdatum)\n\nNewell Brands Germany GmbH\nGesellschaft mit beschränkter Haftung\nHamburg\n\nAls nicht eingetragen wird bekannt gemacht:\nDen Gläubigern der an der Verschmelzung beteiligten Gesellschaften ist, wenn sie binnen sechs Monaten nach dem Tag, an dem die Eintragung der Verschmelzung in das Register des Sitzes desjenigen Rechtsträgers, dessen Gläubiger sie sind, nach § 19 Absatz 3 UmwG als bekannt gemacht gilt, ihren Anspruch nach Grund und Höhe schriftlich anmelden, Sicherheit zu leisten, soweit sie nicht Befriedigung verlangen können. Dieses Recht steht den Gläubigern jedoch nur zu, wenn sie glaubhaft machen, dass durch die Verschmelzung die Erfüllung ihrer Forderung gefährdet wird."
    },
    {
      "date": "2025-07-01",
      "id": "114033",
      "original_text": "Registerbekanntmachung nach dem Umwandlungsgesetz\nHamburg Amtsgericht Hamburg HRB 189212\nYankee Candle Deutschland GmbH – Hamburg",
      "type": "Registerbekanntmachung nach dem Umwandlungsgesetz",
      "state": "Hamburg",
      "amtsgericht": "Amtsgericht Hamburg",
      "registernummer": "HRB 189212",
      "registerart": "HRB",
      "company_name": "Yankee Candle Deutschland GmbH",
      "company_seat": "Hamburg",
      "details": "01.07.2025 (Bekanntmachungsdatum)\n\nHamburg Amtsgericht Hamburg HRB 189212\nRegisterbekanntmachung nach dem Umwandlungsgesetz 01.07.2025 (Eintragungsdatum)\n\nYankee Candle Deutschland GmbH\nGesellschaft mit beschränkter Haftung\nHamburg\n\nAls nicht eingetragen wird bekannt gemacht:\nDen Gläubigern der an der Verschmelzung beteiligten Gesellschaften ist, wenn sie binnen sechs Monaten nach dem Tag, an dem die Eintragung der Verschmelzung in das Register des Sitzes desjenigen Rechtsträgers, dessen Gläubiger sie sind, nach § 19 Absatz 3 UmwG als bekannt gemacht gilt, ihren Anspruch nach Grund und Höhe schriftlich anmelden, Sicherheit zu leisten, soweit sie nicht Befriedigung verlangen können. Dieses Recht steht den Gläubigern jedoch nur zu, wenn sie glaubhaft machen, dass durch die Verschmelzung die Erfüllung ihrer Forderung gefährdet wird."
    },
    {
      "date": "2025-07-01",
      "id": "114034",
      "original_text": "Registerbekanntmachung nach dem Umwandlungsgesetz\nHamburg Amtsgericht Hamburg HRB 106017\nTÜV SÜD Auto Partner GmbH – Hamburg",
      "type": "Registerbekanntmachung nach dem Umwandlungsgesetz",
      "state": "Hamburg",
      "amtsgericht": "Amtsgericht Hamburg",
      "registernummer": "HRB 106017",
      "registerart": "HRB",
      "company_name": "TÜV SÜD Auto Partner GmbH",
      "company_seat": "Hamburg",
      "details": "01.07.2025 (Bekanntmachungsdatum)\n\nHamburg Amtsgericht Hamburg HRB 106017\nRegisterbekanntmachung nach dem Umwandlungsgesetz 01.07.2025 (Eintragungsdatum)\n\nTÜV SÜD Auto Partner GmbH\nGesellschaft mit beschränkter Haftung\nHamburg\n\nAls nicht eingetragen wird bekannt gemacht:\nDen Gläubigern der an der Verschmelzung beteiligten Gesellschaften ist, wenn sie binnen sechs Monaten nach dem Tag, an dem die Eintragung der Verschmelzung in das Register des Sitzes desjenigen Rechtsträgers, dessen Gläubiger sie sind, nach § 19 Absatz 3 UmwG als bekannt gemacht gilt, ihren Anspruch nach Grund und Höhe schriftlich anmelden, Sicherheit zu leisten, soweit sie nicht Befriedigung verlangen können. Dieses Recht steht den Gläubigern jedoch nur zu, wenn sie glaubhaft machen, dass durch die Verschmelzung die Erfüllung ihrer Forderung gefährdet wird."
    },
    {
      "date": "2025-07-01",
      "id": "114035",
      "original_text": "Registerbekanntmachung nach dem Umwandlungsgesetz\nSachsen-Anhalt Amtsgericht Stendal HRB 1500\nIngenieurbüro für Gebäudetechnik GmbH – Burg",
      "type": "Registerbekanntmachung nach dem Umwandlungsgesetz",
      "state": "Sachsen-Anhalt",
      "amtsgericht": "Amtsgericht Stendal",
      "registernummer": "HRB 1500",
      "registerart": "HRB",
      "company_name": "Ingenieurbüro für Gebäudetechnik GmbH",
      "company_seat": "Burg",
      "details": "01.07.2025 (Bekanntmachungsdatum)\n\nSachsen-Anhalt Amtsgericht Stendal HRB 1500\nRegisterbekanntmachung nach dem Umwandlungsgesetz 01.07.2025 (Eintragungsdatum)\n\nIngenieurbüro für Gebäudetechnik GmbH\nGesellschaft mit beschränkter Haftung\nBurg\n\nNicht eingetragen:\nDen Gläubigern der an der Verschmelzung beteiligten Rechtsträger ist, wenn sie binnen sechs Monaten nach dem Tag, an dem die Eintragung der Verschmelzung nach § 19 Abs. 3 UmwG als bekanntgemacht gilt, ihren Anspruch nach Grund und Höhe schriftlich anmelden, Sicherheit zu leisten, soweit sie nicht Befriedigung verlangen können. Dieses Recht steht ihnen jedoch nur zu, wenn sie glaubhaft machen, dass durch die Verschmelzung die Erfüllung ihrer Forderung gefährdet wird."
    },
    {
      "date": "2025-07-01",
      "id": "114036",
      "original_text": "Löschungsankündigung\nBaden-Württemberg Amtsgericht Stuttgart HRB 798230\nM1 GmbH – Rottweil",
      "type": "Löschungsankündigung",
      "state": "Baden-Württemberg",
      "amtsgericht": "Amtsgericht Stuttgart",
      "registernummer": "HRB 798230",
      "registerart": "HRB",
      "company_name": "M1 GmbH",
      "company_seat": "Rottweil",
      "details": "01.07.2025 (Bekanntmachungsdatum)\n\nBaden-Württemberg Amtsgericht Stuttgart HRB 798230\nLöschungsankündigung\n\nM1 GmbH\nGesellschaft mit beschränkter Haftung\nRottweil\n\nDas Gericht beabsichtigt, die Gesellschaft wegen Vermögenslosigkeit im Handelsregister von Amts wegen nach § 394 FamFG zu löschen. Die Frist zur Geltendmachung eines Widerspruchs gegen die beabsichtigte Löschung ist auf zwei Monate ab Veröffentlichung bestimmt."
    },
    {
      "date": "2025-07-01",
      "id": "114037",
      "original_text": "Einreichung neuer Dokumente\nSchleswig-Holstein Amtsgericht Pinneberg HRB 5166\nStadtwerke Wedel GmbH – Wedel",
      "type": "Einreichung neuer Dokumente",
      "state": "Schleswig-Holstein",
      "amtsgericht": "Amtsgericht Pinneberg",
      "registernummer": "HRB 5166",
      "registerart": "HRB",
      "company_name": "Stadtwerke Wedel GmbH",
      "company_seat": "Wedel",
      "details": "01.07.2025 (Bekanntmachungsdatum)\n\nSchleswig-Holstein Amtsgericht Pinneberg HRB 5166\nEinreichung neuer Dokumente\n\nStadtwerke Wedel GmbH\nGesellschaft mit beschränkter Haftung\nWedel\n\nAls nicht eingetragen wird veröffentlicht: Es ist eine neue Liste der Aufsichtsratsmitglieder gemäß § 52 Abs. 3 2 Hs. GmbHG i.V.m. § 10 HGB zum Handelsregister eingereicht worden."
    },
    {
      "date": "2025-07-01",
      "id": "114038",
      "original_text": "Einreichung neuer Dokumente\nSchleswig-Holstein Amtsgericht Pinneberg HRB 17561\nwechselstrom und wechselgas GmbH – Wedel",
      "type": "Einreichung neuer Dokumente",
      "state": "Schleswig-Holstein",
      "amtsgericht": "Amtsgericht Pinneberg",
      "registernummer": "HRB 17561",
      "registerart": "HRB",
      "company_name": "wechselstrom und wechselgas GmbH",
      "company_seat": "Wedel",
      "details": "01.07.2025 (Bekanntmachungsdatum)\n\nSchleswig-Holstein Amtsgericht Pinneberg HRB 17561\nEinreichung neuer Dokumente\n\nwechselstrom und wechselgas GmbH\nGesellschaft mit beschränkter Haftung\nWedel\n\nAls nicht eingetragen wird veröffentlicht:  Es ist eine neue Liste der Aufsichtsratsmitglieder gemäß § 52 Abs. 3 2 Hs. GmbHG i.V.m. § 10 HGB zum Handelsregister eingereicht worden."
    },
    {
      "date": "2025-07-01",
      "id": "114039",
      "original_text": "Registerbekanntmachung nach dem Umwandlungsgesetz\nBaden-Württemberg Amtsgericht Stuttgart HRB 244081\nHewlett-Packard GmbH – Böblingen",
      "type": "Registerbekanntmachung nach dem Umwandlungsgesetz",
      "state": "Baden-Württemberg",
      "amtsgericht": "Amtsgericht Stuttgart",
      "registernummer": "HRB 244081",
      "registerart": "HRB",
      "company_name": "Hewlett-Packard GmbH",
      "company_seat": "Böblingen",
      "details": "01.07.2025 (Bekanntmachungsdatum)\n\nBaden-Württemberg Amtsgericht Stuttgart HRB 244081\nRegisterbekanntmachung nach dem Umwandlungsgesetz 01.07.2025 (Eintragungsdatum)\n\nHewlett-Packard GmbH\nGesellschaft mit beschränkter Haftung\nBöblingen\n\nAls nicht eingetragen wird bekanntgemacht:\nDen Gläubigern der an der Verschmelzung beteiligten Rechtsträger ist, wenn sie binnen sechs Monaten nach dem Tag, an dem die Eintragung der Verschmelzung in das Register des Sitzes desjenigen Rechtsträgers, dessen Gläubiger sie sind, nach § 19 Abs. 3 UmwG als bekanntgemacht gilt, ihren Anspruch nach Grund und Höhe schriftlich anmelden, Sicherheit zu leisten, soweit sie nicht Befriedigung verlangen können. Dieses Recht steht den Gläubigern jedoch nur zu, wenn sie glaubhaft machen, dass durch die Verschmelzung die Erfüllung ihrer Forderung gefährdet wird."
    },
    {
      "date": "2025-07-01",
      "id": "114040",
      "original_text": "Löschungsankündigung\nBrandenburg Amtsgericht Neuruppin HRB 9491\nNast GmbH – Oranienburg",
      "type": "Löschungsankündigung",
      "state": "Brandenburg",
      "amtsgericht": "Amtsgericht Neuruppin",
      "registernummer": "HRB 9491",
      "registerart": "HRB",
      "company_name": "Nast GmbH",
      "company_seat": "Oranienburg",
      "details": "01.07.2025 (Bekanntmachungsdatum)\n\nBrandenburg Amtsgericht Neuruppin HRB 9491\nLöschungsankündigung\n\nNast GmbH\nGesellschaft mit beschränkter Haftung\nOranienburg\n\nBei der nachstehenden Gesellschaft wird das Amtslöschungsverfahren gemäß § 394 FamFG eingeleitet.\nWiderspruchsfrist: 1 Monat"
    },
    {
      "date": "2025-07-01",
      "id": "114041",
      "original_text": "Registerbekanntmachung nach dem Umwandlungsgesetz\nBerlin Amtsgericht Berlin (Charlottenburg) HRB 186702\nINICIA Unternehmergesellschaft (haftungsbeschränkt) – Berlin",
      "type": "Registerbekanntmachung nach dem Umwandlungsgesetz",
      "state": "Berlin",
      "amtsgericht": "Amtsgericht Berlin (Charlottenburg)",
      "registernummer": "HRB 186702",
      "registerart": "HRB",
      "company_name": "INICIA Unternehmergesellschaft (haftungsbeschränkt)",
      "company_seat": "Berlin",
      "details": "01.07.2025 (Bekanntmachungsdatum)\n\nBerlin Amtsgericht Berlin (Charlottenburg) HRB 186702\nRegisterbekanntmachung nach dem Umwandlungsgesetz 01.07.2025 (Eintragungsdatum)\n\nINICIA Unternehmergesellschaft (haftungsbeschränkt)\nGesellschaft mit beschränkter Haftung\nBerlin\n\nZu Eintragungsnummer 3 vom 01.07.2025 wird als nicht eingetragen veröffentlicht: Den Gläubigern der an der Verschmelzung beteiligten Rechtsträger ist, wenn sie binnen sechs Monaten nach dem Tag, an dem die Eintragung der Verschmelzung in das Register des Sitzes desjenigen Rechtsträgers, dessen Gläubiger sie sind, als bekannt gemacht gilt, ihren Anspruch nach Grund und Höhe schriftlich anmelden, Sicherheit zu leisten, soweit sie nicht Befriedigung verlangen können. Dieses Recht steht den Gläubigern jedoch nur zu, wenn sie glaubhaft machen, dass durch die Verschmelzung die Erfüllung ihrer Forderung gefährdet wird. Das Recht, Sicherheitsleistung zu verlangen, steht Gläubigern nicht zu, die im Falle der Insolvenz ein Recht auf vorzugsweise Befriedigung aus einer Deckungsmasse haben, die nach gesetzlicher Vorschrift zu ihrem Schutz errichtet und staatlich überwacht ist."
    },
    {
      "date": "2025-07-01",
      "id": "114042",
      "original_text": "Registerbekanntmachung nach dem Umwandlungsgesetz\nBaden-Württemberg Amtsgericht Mannheim HRB 700619\nStilhaus GmbH – Mannheim",
      "type": "Registerbekanntmachung nach dem Umwandlungsgesetz",
      "state": "Baden-Württemberg",
      "amtsgericht": "Amtsgericht Mannheim",
      "registernummer": "HRB 700619",
      "registerart": "HRB",
      "company_name": "Stilhaus GmbH",
      "company_seat": "Mannheim",
      "details": "01.07.2025 (Bekanntmachungsdatum)\n\nBaden-Württemberg Amtsgericht Mannheim HRB 700619\nRegisterbekanntmachung nach dem Umwandlungsgesetz 01.07.2025 (Eintragungsdatum)\n\nStilhaus GmbH\nGesellschaft mit beschränkter Haftung\nMannheim\n\nAls nicht eingetragen wird bekanntgemacht: Den Gläubigern der an der Verschmelzung beteiligten Rechtsträger ist, wenn sie binnen sechs Monaten nach dem Tag, an dem die Eintragung der Verschmelzung in das Register des Sitzes desjenigen Rechtsträgers, dessen Gläubiger sie sind, nach § 19 Abs. 3 UmwG als bekanntgemacht gilt, ihren Anspruch nach Grund und Höhe schriftlich anmelden, Sicherheit zu leisten, soweit sie nicht Befriedigung verlangen können. Dieses Recht steht den Gläubigern jedoch nur zu, wenn sie glaubhaft machen, dass durch die Verschmelzung die Erfüllung ihrer Forderung gefährdet wird."
    },
    {
      "date": "2025-07-01",
      "id": "114043",
      "original_text": "Registerbekanntmachung nach dem Umwandlungsgesetz\nBerlin Amtsgericht Berlin (Charlottenburg) HRB 151856\nLa Plata Real Estate Verwaltungs GmbH – Berlin",
      "type": "Registerbekanntmachung nach dem Umwandlungsgesetz",
      "state": "Berlin",
      "amtsgericht": "Amtsgericht Berlin (Charlottenburg)",
      "registernummer": "HRB 151856",
      "registerart": "HRB",
      "company_name": "La Plata Real Estate Verwaltungs GmbH",
      "company_seat": "Berlin",
      "details": "01.07.2025 (Bekanntmachungsdatum)\n\nBerlin Amtsgericht Berlin (Charlottenburg) HRB 151856\nRegisterbekanntmachung nach dem Umwandlungsgesetz 01.07.2025 (Eintragungsdatum)\n\nLa Plata Real Estate Verwaltungs GmbH\nGesellschaft mit beschränkter Haftung\nBerlin\n\nZu Eintragungsnummer 6 vom 01.07.2025 wird als nicht eingetragen veröffentlicht: Den Gläubigern der an der Verschmelzung beteiligten Rechtsträger ist, wenn sie binnen sechs Monaten nach dem Tag, an dem die Eintragung der Verschmelzung in das Register des Sitzes desjenigen Rechtsträgers, dessen Gläubiger sie sind, als bekannt gemacht gilt, ihren Anspruch nach Grund und Höhe schriftlich anmelden, Sicherheit zu leisten, soweit sie nicht Befriedigung verlangen können. Dieses Recht steht den Gläubigern jedoch nur zu, wenn sie glaubhaft machen, dass durch die Verschmelzung die Erfüllung ihrer Forderung gefährdet wird. Das Recht, Sicherheitsleistung zu verlangen, steht Gläubigern nicht zu, die im Falle der Insolvenz ein Recht auf vorzugsweise Befriedigung aus einer Deckungsmasse haben, die nach gesetzlicher Vorschrift zu ihrem Schutz errichtet und staatlich überwacht ist."
    },
    {
      "date": "2025-07-01",
      "id": "114044",
      "original_text": "Registerbekanntmachung nach dem Umwandlungsgesetz\nNordrhein-Westfalen Amtsgericht Coesfeld HRB 22762\nWP Generator GmbH – Bocholt",
      "type": "Registerbekanntmachung nach dem Umwandlungsgesetz",
      "state": "Nordrhein-Westfalen",
      "amtsgericht": "Amtsgericht Coesfeld",
      "registernummer": "HRB 22762",
      "registerart": "HRB",
      "company_name": "WP Generator GmbH",
      "company_seat": "Bocholt",
      "details": "01.07.2025 (Bekanntmachungsdatum)\n\nNordrhein-Westfalen Amtsgericht Coesfeld HRB 22762\nRegisterbekanntmachung nach dem Umwandlungsgesetz 01.07.2025 (Eintragungsdatum)\n\nWP Generator GmbH\nGesellschaft mit beschränkter Haftung\nBocholt\n\nDen Gläubigern der an der Ausgliederung beteiligten Rechtsträger ist, wenn sie binnen sechs Monaten nach dem Tag, an dem die Eintragung der Ausgliederung in das Register des Sitzes desjenigen Rechtsträgers, dessen Gläubiger sie sind, nach § 19 Absatz 3 UmwG als bekanntgemacht gilt, ihren Anspruch nach Grund und Höhe schriftlich anmelden, Sicherheit zu leisten, soweit sie nicht Befriedigung verlangen können. Dieses Recht steht den Gläubigern jedoch nur zu, wenn sie glaubhaft machen, dass durch die Ausgliederung die Erfüllung ihrer Forderung gefährdet wird."
    },
    {
      "date": "2025-07-01",
      "id": "114045",
      "original_text": "Löschungsankündigung\nSaarland Amtsgericht Saarbrücken HRB 103073\nGarden Trans GmbH – Saarlouis",
      "type": "Löschungsankündigung",
      "state": "Saarland",
      "amtsgericht": "Amtsgericht Saarbrücken",
      "registernummer": "HRB 103073",
      "registerart": "HRB",
      "company_name": "Garden Trans GmbH",
      "company_seat": "Saarlouis",
      "details": "01.07.2025 (Bekanntmachungsdatum)\n\nSaarland Amtsgericht Saarbrücken HRB 103073\nLöschungsankündigung\n\nGarden Trans GmbH\nGesellschaft mit beschränkter Haftung\nSaarlouis\n\nEs ist beabsichtigt, die Gesellschaft von Amts wegen gemäß § 394 FamFG wegen Vermögenslosigkeit zu löschen.\nGegen die Löschung von Amts wegen ist das Rechtsmittel des Widerspruchs statthaft. Der Widerspruch ist binnen einer Frist drei Monaten beginnend mit dem Tag dieser Veröffentlichung durch Einreichen eines Widerspruchsschreibens -schriftlich oder zur Niederschrift der Geschäftsstelle beim Amtsgericht Saarbrücken, -zentrales Handelsregister-, Mainzerstr.178, 66121 Saarbrücken einzulegen.\nDer Widerspruch muss die Bezeichnung der angefochtenen Löschungsankündigung enthalten sowie die Erklärung, dass Widerspruch eingelegt wird. Er ist vom Widerspruchsführer oder seinem Bevollmächtigten zu unterzeichnen.\nDas Widerspruchsschreiben kann auch in der Form eines elektronischen Dokumentes eingereicht werden, das mit einer qualifizierten elektronischen Signatur nach dem Signaturgesetz versehen sein muss (§§ 14 Abs. 2 FamFG, 130a, 298 ZPO)."
    },
    {
      "date": "2025-07-01",
      "id": "114046",
      "original_text": "Einreichung neuer Dokumente\nSachsen-Anhalt Amtsgericht Stendal HRB 30800\nFragster AG – Magdeburg",
      "type": "Einreichung neuer Dokumente",
      "state": "Sachsen-Anhalt",
      "amtsgericht": "Amtsgericht Stendal",
      "registernummer": "HRB 30800",
      "registerart": "HRB",
      "company_name": "Fragster AG",
      "company_seat": "Magdeburg",
      "details": "01.07.2025 (Bekanntmachungsdatum)\n\nSachsen-Anhalt Amtsgericht Stendal HRB 30800\nEinreichung neuer Dokumente 01.07.2025 (Eintragungsdatum)\n\nFragster AG\nAktiengesellschaft\nMagdeburg\n\nEine Liste der Mitglieder des Aufsichtsrates wurde zum Handelsregister eingereicht."
    },
    {
      "date": "2025-07-01",
      "id": "114047",
      "original_text": "Registerbekanntmachung nach dem Umwandlungsgesetz\nSchleswig-Holstein Amtsgericht Flensburg VR 44 SL\nTurn- und Schwimmverein von 1864 Schleswig e.V. – Schleswig",
      "type": "Registerbekanntmachung nach dem Umwandlungsgesetz",
      "state": "Schleswig-Holstein",
      "amtsgericht": "Amtsgericht Flensburg",
      "registernummer": "VR 44 SL",
      "registerart": "VR",
      "company_name": "Turn- und Schwimmverein von 1864 Schleswig e.V.",
      "company_seat": "Schleswig",
      "details": "01.07.2025 (Bekanntmachungsdatum)\n\nSchleswig-Holstein Amtsgericht Flensburg VR 44 SL\nRegisterbekanntmachung nach dem Umwandlungsgesetz 30.06.2025 (Eintragungsdatum)\n\nTurn- und Schwimmverein von 1864 Schleswig e.V.\neingetragener Verein\nSchleswig\n\nZu Eintragungsnummer 11 vom 30.06.2025 wird als nicht eingetragen veröffentlicht: Den Gläubigern der an der Verschmelzung beteiligten Rechtsträger ist, wenn sie binnen sechs Monaten nach dem Tag, an dem die Eintragung der Verschmelzung in das Register des Sitzes desjenigen Rechtsträgers, dessen Gläubiger sie sind, als bekannt gemacht gilt, ihren Anspruch nach Grund und Höhe schriftlich anmelden, Sicherheit zu leisten, soweit sie nicht Befriedigung verlangen können. Dieses Recht steht den Gläubigern jedoch nur zu, wenn sie glaubhaft machen, dass durch die Verschmelzung die Erfüllung ihrer Forderung gefährdet wird. Das Recht, Sicherheitsleistung zu verlangen, steht Gläubigern nicht zu, die im Falle der Insolvenz ein Recht auf vorzugsweise Befriedigung aus einer Deckungsmasse haben, die nach gesetzlicher Vorschrift zu ihrem Schutz errichtet und staatlich überwacht ist."
    },
    {
      "date": "2025-07-01",
      "id": "114048",
      "original_text": "Löschungsankündigung\nBerlin Amtsgericht Berlin (Charlottenburg) HRB 211867\nYunev GmbH – Berlin",
      "type": "Löschungsankündigung",
      "state": "Berlin",
      "amtsgericht": "Amtsgericht Berlin (Charlottenburg)",
      "registernummer": "HRB 211867",
      "registerart": "HRB",
      "company_name": "Yunev GmbH",
      "company_seat": "Berlin",
      "details": "01.07.2025 (Bekanntmachungsdatum)\n\nBerlin Amtsgericht Berlin (Charlottenburg) HRB 211867\nLöschungsankündigung\n\nYunev GmbH\nGesellschaft mit beschränkter Haftung\nBerlin\n\nBei der nachstehenden Gesellschaft wird das Amtslöschungsverfahren gemäß § 394 FamFG eingeleitet. Widerspruchsfrist 6 Wochen"
    },
    {
      "date": "2025-07-01",
      "id": "114049",
      "original_text": "Registerbekanntmachung nach dem Umwandlungsgesetz\nBaden-Württemberg Amtsgericht Ulm HRB 501111\nRossaro Kanaltechnik Geschäftsführungs GmbH – Aalen",
      "type": "Registerbekanntmachung nach dem Umwandlungsgesetz",
      "state": "Baden-Württemberg",
      "amtsgericht": "Amtsgericht Ulm",
      "registernummer": "HRB 501111",
      "registerart": "HRB",
      "company_name": "Rossaro Kanaltechnik Geschäftsführungs GmbH",
      "company_seat": "Aalen",
      "details": "01.07.2025 (Bekanntmachungsdatum)\n\nBaden-Württemberg Amtsgericht Ulm HRB 501111\nRegisterbekanntmachung nach dem Umwandlungsgesetz 01.07.2025 (Eintragungsdatum)\n\nRossaro Kanaltechnik Geschäftsführungs GmbH\nGesellschaft mit beschränkter Haftung\nAalen\n\nAls nicht eingetragen wird bekanntgemacht:\nDen Gläubigern der an der Verschmelzung beteiligten Rechtsträger ist, wenn sie binnen sechs Monaten nach dem Tag, an dem die Eintragung der Verschmelzung in das Register des Sitzes desjenigen Rechtsträgers, dessen Gläubiger sie sind, nach § 19 Abs. 3 UmwG als bekanntgemacht gilt, ihren Anspruch nach Grund und Höhe schriftlich anmelden, Sicherheit zu leisten, soweit sie nicht Befriedigung verlangen können. Dieses Recht steht den Gläubigern jedoch nur zu, wenn sie glaubhaft machen, dass durch die Verschmelzung die Erfüllung ihrer Forderung gefährdet wird."
    },
    {
      "date": "2025-07-01",
      "id": "114050",
      "original_text": "Registerbekanntmachung nach dem Umwandlungsgesetz\nBaden-Württemberg Amtsgericht Freiburg HRB 710333\nErwin Junker Holding GmbH – Nordrach",
      "type": "Registerbekanntmachung nach dem Umwandlungsgesetz",
      "state": "Baden-Württemberg",
      "amtsgericht": "Amtsgericht Freiburg",
      "registernummer": "HRB 710333",
      "registerart": "HRB",
      "company_name": "Erwin Junker Holding GmbH",
      "company_seat": "Nordrach",
      "details": "01.07.2025 (Bekanntmachungsdatum)\n\nBaden-Württemberg Amtsgericht Freiburg HRB 710333\nRegisterbekanntmachung nach dem Umwandlungsgesetz 01.07.2025 (Eintragungsdatum)\n\nErwin Junker Holding GmbH\nGesellschaft mit beschränkter Haftung\nNordrach\n\nAls nicht eingetragen wird bekanntgemacht:\nDen Gläubigern der an der Verschmelzung beteiligten Rechtsträger ist, wenn sie binnen sechs Monaten nach dem Tag, an dem die Eintragung der Verschmelzung in das Register des Sitzes desjenigen Rechtsträgers, dessen Gläubiger sie sind, nach § 19 Abs. 3 UmwG als bekanntgemacht gilt, ihren Anspruch nach Grund und Höhe schriftlich anmelden, Sicherheit zu leisten, soweit sie nicht Befriedigung verlangen können. Dieses Recht steht den Gläubigern jedoch nur zu, wenn sie glaubhaft machen, dass durch die Verschmelzung die Erfüllung ihrer Forderung gefährdet wird."
    },
    {
      "date": "2025-07-01",
      "id": "114051",
      "original_text": "Registerbekanntmachung nach dem Umwandlungsgesetz\nBaden-Württemberg Amtsgericht Freiburg HRB 480032\nJunker Verwaltungsgesellschaft mit beschränkter Haftung – Nordrach",
      "type": "Registerbekanntmachung nach dem Umwandlungsgesetz",
      "state": "Baden-Württemberg",
      "amtsgericht": "Amtsgericht Freiburg",
      "registernummer": "HRB 480032",
      "registerart": "HRB",
      "company_name": "Junker Verwaltungsgesellschaft mit beschränkter Haftung",
      "company_seat": "Nordrach",
      "details": "01.07.2025 (Bekanntmachungsdatum)\n\nBaden-Württemberg Amtsgericht Freiburg HRB 480032\nRegisterbekanntmachung nach dem Umwandlungsgesetz 01.07.2025 (Eintragungsdatum)\n\nJunker Verwaltungsgesellschaft mit beschränkter Haftung\nGesellschaft mit beschränkter Haftung\nNordrach\n\nAls nicht eingetragen wird bekanntgemacht:\nDen Gläubigern der an der Verschmelzung beteiligten Rechtsträger ist, wenn sie binnen sechs Monaten nach dem Tag, an dem die Eintragung der Verschmelzung in das Register des Sitzes desjenigen Rechtsträgers, dessen Gläubiger sie sind, nach § 19 Abs. 3 UmwG als bekanntgemacht gilt, ihren Anspruch nach Grund und Höhe schriftlich anmelden, Sicherheit zu leisten, soweit sie nicht Befriedigung verlangen können. Dieses Recht steht den Gläubigern jedoch nur zu, wenn sie glaubhaft machen, dass durch die Verschmelzung die Erfüllung ihrer Forderung gefährdet wird."
    },
    {
      "date": "2025-07-01",
      "id": "114052",
      "original_text": "Registerbekanntmachung nach dem Umwandlungsgesetz\nSachsen-Anhalt Amtsgericht Stendal VR 43277\nVerein Mansfelder Berg- und Hüttenleute e. V. – Lutherstadt Eisleben",
      "type": "Registerbekanntmachung nach dem Umwandlungsgesetz",
      "state": "Sachsen-Anhalt",
      "amtsgericht": "Amtsgericht Stendal",
      "registernummer": "VR 43277",
      "registerart": "VR",
      "company_name": "Verein Mansfelder Berg- und Hüttenleute e. V.",
      "company_seat": "Lutherstadt Eisleben",
      "details": "01.07.2025 (Bekanntmachungsdatum)\n\nSachsen-Anhalt Amtsgericht Stendal VR 43277\nRegisterbekanntmachung nach dem Umwandlungsgesetz 01.07.2025 (Eintragungsdatum)\n\nVerein Mansfelder Berg- und Hüttenleute e. V.\neingetragener Verein\nLutherstadt Eisleben\n\nNicht eingetragen:\nDen Gläubigern der an der Verschmelzung beteiligten Rechtsträger ist, wenn sie binnen sechs Monaten nach dem Tag, an dem die Eintragung der Verschmelzung nach § 19 Abs. 3 UmwG als bekanntgemacht gilt, ihren Anspruch nach Grund und Höhe schriftlich anmelden, Sicherheit zu leisten, soweit sie nicht Befriedigung verlangen können. Dieses Recht steht ihnen jedoch nur zu, wenn sie glaubhaft machen, dass durch die Verschmelzung die Erfüllung ihrer Forderung gefährdet wird."
    },
    {
      "date": "2025-07-01",
      "id": "114053",
      "original_text": "Registerbekanntmachung nach dem Umwandlungsgesetz\nSachsen-Anhalt Amtsgericht Stendal VR 43198\nTraditionsverein Bergschule Eisleben e.V (TVB) – Lutherstadt Eisleben",
      "type": "Registerbekanntmachung nach dem Umwandlungsgesetz",
      "state": "Sachsen-Anhalt",
      "amtsgericht": "Amtsgericht Stendal",
      "registernummer": "VR 43198",
      "registerart": "VR",
      "company_name": "Traditionsverein Bergschule Eisleben e.V (TVB)",
      "company_seat": "Lutherstadt Eisleben",
      "details": "01.07.2025 (Bekanntmachungsdatum)\n\nSachsen-Anhalt Amtsgericht Stendal VR 43198\nRegisterbekanntmachung nach dem Umwandlungsgesetz 01.07.2025 (Eintragungsdatum)\n\nTraditionsverein Bergschule Eisleben e.V (TVB)\neingetragener Verein\nLutherstadt Eisleben\n\nNicht eingetragen:\nDen Gläubigern der an der Verschmelzung beteiligten Rechtsträger ist, wenn sie binnen sechs Monaten nach dem Tag, an dem die Eintragung der Verschmelzung nach § 19 Abs. 3 UmwG als bekanntgemacht gilt, ihren Anspruch nach Grund und Höhe schriftlich anmelden, Sicherheit zu leisten, soweit sie nicht Befriedigung verlangen können. Dieses Recht steht ihnen jedoch nur zu, wenn sie glaubhaft machen, dass durch die Verschmelzung die Erfüllung ihrer Forderung gefährdet wird."
    },
    {
      "date": "2025-07-01",
      "id": "114054",
      "original_text": "Sonstige Registerbekanntmachung\nHamburg Amtsgericht Hamburg HRB 38204\nBijou Brigitte modische Accessoires Aktiengesellschaft – Hamburg",
      "type": "Sonstige Registerbekanntmachung",
      "state": "Hamburg",
      "amtsgericht": "Amtsgericht Hamburg",
      "registernummer": "HRB 38204",
      "registerart": "HRB",
      "company_name": "Bijou Brigitte modische Accessoires Aktiengesellschaft",
      "company_seat": "Hamburg",
      "details": "01.07.2025 (Bekanntmachungsdatum)\n\nHamburg Amtsgericht Hamburg HRB 38204\nSonstige Registerbekanntmachung\n\nBijou Brigitte modische Accessoires Aktiengesellschaft\nAktiengesellschaft\nHamburg\n\nAls nicht eingetragen wird bekannt gemacht: Liste des Aufsichtsrats wurde eingereicht."
    },
    {
      "date": "2025-07-01",
      "id": "114055",
      "original_text": "Registerbekanntmachung nach dem Umwandlungsgesetz\nNordrhein-Westfalen Amtsgericht Coesfeld HRB 4036\nA + B -Werkzeuge Maschinen Handels GmbH – Ahaus",
      "type": "Registerbekanntmachung nach dem Umwandlungsgesetz",
      "state": "Nordrhein-Westfalen",
      "amtsgericht": "Amtsgericht Coesfeld",
      "registernummer": "HRB 4036",
      "registerart": "HRB",
      "company_name": "A + B -Werkzeuge Maschinen Handels GmbH",
      "company_seat": "Ahaus",
      "details": "01.07.2025 (Bekanntmachungsdatum)\n\nNordrhein-Westfalen Amtsgericht Coesfeld HRB 4036\nRegisterbekanntmachung nach dem Umwandlungsgesetz 01.07.2025 (Eintragungsdatum)\n\nA + B -Werkzeuge Maschinen Handels GmbH\nGesellschaft mit beschränkter Haftung\nAhaus\n\nDen Gläubigern der an der Verschmelzung beteiligten Rechtsträger ist, wenn sie binnen sechs Monaten nach dem Tag, an dem die Eintragung der Verschmelzung in das Register des Sitzes desjenigen Rechtsträgers, dessen Gläubiger sie sind, nach § 19 Absatz 3 UmwG als bekanntgemacht gilt, ihren Anspruch nach Grund und Höhe schriftlich anmelden, Sicherheit zu leisten, soweit sie nicht Befriedigung verlangen können. Dieses Recht steht den Gläubigern jedoch nur zu, wenn sie glaubhaft machen, dass durch die Verschmelzung die Erfüllung ihrer Forderung gefährdet wird."
    },
    {
      "date": "2025-07-01",
      "id": "114056",
      "original_text": "Löschungsankündigung\nBaden-Württemberg Amtsgericht Stuttgart HRB 745601\nMellina Beauté GmbH – Stuttgart",
      "type": "Löschungsankündigung",
      "state": "Baden-Württemberg",
      "amtsgericht": "Amtsgericht Stuttgart",
      "registernummer": "HRB 745601",
      "registerart": "HRB",
      "company_name": "Mellina Beauté GmbH",
      "company_seat": "Stuttgart",
      "details": "01.07.2025 (Bekanntmachungsdatum)\n\nBaden-Württemberg Amtsgericht Stuttgart HRB 745601\nLöschungsankündigung\n\nMellina Beauté GmbH\nGesellschaft mit beschränkter Haftung\nStuttgart\n\nAls nicht eingetragen wird bekanntgemacht:\nDas Gericht beabsichtigt, die Gesellschaft wegen Vermögenslosigkeit im Handelsregister von Amts wegen nach § 394 FamFG zu löschen. Die Frist zur Geltendmachung eines Widerspruchs gegen die beabsichtigte Löschung ist auf zwei Monate ab Veröffentlichung bestimmt."
    },
    {
      "date": "2025-07-01",
      "id": "114057",
      "original_text": "Registerbekanntmachung nach dem Umwandlungsgesetz\nBaden-Württemberg Amtsgericht Mannheim HRB 210648\nSturm-Transmar GmbH – Bühl",
      "type": "Registerbekanntmachung nach dem Umwandlungsgesetz",
      "state": "Baden-Württemberg",
      "amtsgericht": "Amtsgericht Mannheim",
      "registernummer": "HRB 210648",
      "registerart": "HRB",
      "company_name": "Sturm-Transmar GmbH",
      "company_seat": "Bühl",
      "details": "01.07.2025 (Bekanntmachungsdatum)\n\nBaden-Württemberg Amtsgericht Mannheim HRB 210648\nRegisterbekanntmachung nach dem Umwandlungsgesetz 01.07.2025 (Eintragungsdatum)\n\nSturm-Transmar GmbH\nGesellschaft mit beschränkter Haftung\nBühl\n\nAls nicht eingetragen wird bekanntgemacht:\nDen Gläubigern der an der Verschmelzung beteiligten Rechtsträger ist, wenn sie binnen sechs Monaten nach dem Tag, an dem die Eintragung der Verschmelzung in das Register des Sitzes desjenigen Rechtsträgers, dessen Gläubiger sie sind, nach § 19 Abs. 3 UmwG als bekanntgemacht gilt, ihren Anspruch nach Grund und Höhe schriftlich anmelden, Sicherheit zu leisten, soweit sie nicht Befriedigung verlangen können. Dieses Recht steht den Gläubigern jedoch nur zu, wenn sie glaubhaft machen, dass durch die Verschmelzung die Erfüllung ihrer Forderung gefährdet wird."
    },
    {
      "date": "2025-07-01",
      "id": "114058",
      "original_text": "Registerbekanntmachung nach dem Umwandlungsgesetz\nBaden-Württemberg Amtsgericht Mannheim HRB 210651\nUHU GmbH – Bühl",
      "type": "Registerbekanntmachung nach dem Umwandlungsgesetz",
      "state": "Baden-Württemberg",
      "amtsgericht": "Amtsgericht Mannheim",
      "registernummer": "HRB 210651",
      "registerart": "HRB",
      "company_name": "UHU GmbH",
      "company_seat": "Bühl",
      "details": "01.07.2025 (Bekanntmachungsdatum)\n\nBaden-Württemberg Amtsgericht Mannheim HRB 210651\nRegisterbekanntmachung nach dem Umwandlungsgesetz 01.07.2025 (Eintragungsdatum)\n\nUHU GmbH\nGesellschaft mit beschränkter Haftung\nBühl\n\nAls nicht eingetragen wird bekanntgemacht:\nDen Gläubigern der an der Verschmelzung beteiligten Rechtsträger ist, wenn sie binnen sechs Monaten nach dem Tag, an dem die Eintragung der Verschmelzung in das Register des Sitzes desjenigen Rechtsträgers, dessen Gläubiger sie sind, nach § 19 Abs. 3 UmwG als bekanntgemacht gilt, ihren Anspruch nach Grund und Höhe schriftlich anmelden, Sicherheit zu leisten, soweit sie nicht Befriedigung verlangen können. Dieses Recht steht den Gläubigern jedoch nur zu, wenn sie glaubhaft machen, dass durch die Verschmelzung die Erfüllung ihrer Forderung gefährdet wird."
    },
    {
      "date": "2025-07-01",
      "id": "114059",
      "original_text": "Registerbekanntmachung nach dem Umwandlungsgesetz\nBaden-Württemberg Amtsgericht Stuttgart HRB 799536\nInfoniqa Group Holding GmbH – Böblingen",
      "type": "Registerbekanntmachung nach dem Umwandlungsgesetz",
      "state": "Baden-Württemberg",
      "amtsgericht": "Amtsgericht Stuttgart",
      "registernummer": "HRB 799536",
      "registerart": "HRB",
      "company_name": "Infoniqa Group Holding GmbH",
      "company_seat": "Böblingen",
      "details": "01.07.2025 (Bekanntmachungsdatum)\n\nBaden-Württemberg Amtsgericht Stuttgart HRB 799536\nRegisterbekanntmachung nach dem Umwandlungsgesetz 01.07.2025 (Eintragungsdatum)\n\nInfoniqa Group Holding GmbH\nGesellschaft mit beschränkter Haftung\nBöblingen\n\nDen Gläubigern der an der Verschmelzung beteiligten Rechtsträger ist, wenn sie binnen sechs Monaten nach dem Tag, an dem die Eintragung der Verschmelzung in das Register des Sitzes desjenigen Rechtsträgers, dessen Gläubiger sie sind, nach § 19 Abs. 3 UmwG als bekanntgemacht gilt, ihren Anspruch nach Grund und Höhe schriftlich anmelden, Sicherheit zu leisten, soweit sie nicht Befriedigung verlangen können. Dieses Recht steht den Gläubigern jedoch nur zu, wenn sie glaubhaft machen, dass durch die Verschmelzung die Erfüllung ihrer Forderung gefährdet wird."
    },
    {
      "date": "2025-07-01",
      "id": "114060",
      "original_text": "Einreichung neuer Dokumente\nBerlin Amtsgericht Berlin (Charlottenburg) HRB 81404\nDB Zeitarbeit GmbH – Berlin",
      "type": "Einreichung neuer Dokumente",
      "state": "Berlin",
      "amtsgericht": "Amtsgericht Berlin (Charlottenburg)",
      "registernummer": "HRB 81404",
      "registerart": "HRB",
      "company_name": "DB Zeitarbeit GmbH",
      "company_seat": "Berlin",
      "details": "01.07.2025 (Bekanntmachungsdatum)\n\nBerlin Amtsgericht Berlin (Charlottenburg) HRB 81404\nEinreichung neuer Dokumente\n\nDB Zeitarbeit GmbH\nGesellschaft mit beschränkter Haftung\nBerlin\n\nAls nicht eingetragen wird veröffentlicht: Es wurde eine neue Liste der Aufsichtsratsmitglieder eingereicht (§ 52 Abs. 3 GmbHG)."
    },
    {
      "date": "2025-07-01",
      "id": "114061",
      "original_text": "Löschungsankündigung\nBerlin Amtsgericht Berlin (Charlottenburg) HRB 178808\nS S M B - Service, Sales und Managementberatungsgesellschaft mbH – Berlin",
      "type": "Löschungsankündigung",
      "state": "Berlin",
      "amtsgericht": "Amtsgericht Berlin (Charlottenburg)",
      "registernummer": "HRB 178808",
      "registerart": "HRB",
      "company_name": "S S M B - Service, Sales und Managementberatungsgesellschaft mbH",
      "company_seat": "Berlin",
      "details": "01.07.2025 (Bekanntmachungsdatum)\n\nBerlin Amtsgericht Berlin (Charlottenburg) HRB 178808\nLöschungsankündigung\n\nS S M B - Service, Sales und Managementberatungsgesellschaft mbH\nGesellschaft mit beschränkter Haftung\nBerlin\n\nBei der nachstehenden Gesellschaft wird das Amtslöschungsverfahren gemäß § 394 FamFG eingeleitet. Widerspruchsfrist 6 Wochen"
    },
    {
      "date": "2025-07-01",
      "id": "114062",
      "original_text": "Registerbekanntmachung nach dem Umwandlungsgesetz\nBaden-Württemberg Amtsgericht Stuttgart HRB 758292\n4base lab AG advanced molecular analysis – Kusterdingen",
      "type": "Registerbekanntmachung nach dem Umwandlungsgesetz",
      "state": "Baden-Württemberg",
      "amtsgericht": "Amtsgericht Stuttgart",
      "registernummer": "HRB 758292",
      "registerart": "HRB",
      "company_name": "4base lab AG advanced molecular analysis",
      "company_seat": "Kusterdingen",
      "details": "01.07.2025 (Bekanntmachungsdatum)\n\nBaden-Württemberg Amtsgericht Stuttgart HRB 758292\nRegisterbekanntmachung nach dem Umwandlungsgesetz 01.07.2025 (Eintragungsdatum)\n\n4base lab AG advanced molecular analysis\nAktiengesellschaft\nKusterdingen\n\nAls nicht eingetragen wird bekanntgemacht:\nDen Gläubigern des an dem Formwechsel beteiligten Rechtsträgers ist, wenn sie binnen sechs Monaten nach dem Tag, an dem die Eintragung des Formwechsels in das Register des Sitzes desjenigen Rechtsträgers, dessen Gläubiger sie sind, nach § 19 Abs. 3 UmwG als bekanntgemacht gilt, ihren Anspruch nach Grund und Höhe schriftlich anmelden, Sicherheit zu leisten, soweit sie nicht Befriedigung verlangen können. Dieses Recht steht den Gläubigern jedoch nur zu, wenn sie glaubhaft machen, dass durch den Formwechsel die Erfüllung ihrer Forderung gefährdet wird."
    },
    {
      "date": "2025-07-01",
      "id": "114063",
      "original_text": "Registerbekanntmachung nach dem Umwandlungsgesetz\nBaden-Württemberg Amtsgericht Stuttgart HRA 390265\nBechtle GmbH & Co.KG – Rottenburg am Neckar",
      "type": "Registerbekanntmachung nach dem Umwandlungsgesetz",
      "state": "Baden-Württemberg",
      "amtsgericht": "Amtsgericht Stuttgart",
      "registernummer": "HRA 390265",
      "registerart": "HRA",
      "company_name": "Bechtle GmbH & Co.KG",
      "company_seat": "Rottenburg am Neckar",
      "details": "01.07.2025 (Bekanntmachungsdatum)\n\nBaden-Württemberg Amtsgericht Stuttgart HRA 390265\nRegisterbekanntmachung nach dem Umwandlungsgesetz 01.07.2025 (Eintragungsdatum)\n\nBechtle GmbH & Co.KG\nKommanditgesellschaft\nRottenburg am Neckar\n\nAls nicht eingetragen wird bekanntgemacht:\nDen Gläubigern der an der Verschmelzung beteiligten Rechtsträger ist, wenn sie binnen sechs Monaten nach dem Tag, an dem die Eintragung der Verschmelzung in das Register des Sitzes desjenigen Rechtsträgers, dessen Gläubiger sie sind, nach § 19 Abs. 3 UmwG als bekanntgemacht gilt, ihren Anspruch nach Grund und Höhe schriftlich anmelden, Sicherheit zu leisten, soweit sie nicht Befriedigung verlangen können. Dieses Recht steht den Gläubigern jedoch nur zu, wenn sie glaubhaft machen, dass durch die Verschmelzung die Erfüllung ihrer Forderung gefährdet wird."
    },
    {
      "date": "2025-07-01",
      "id": "114064",
      "original_text": "Löschungsankündigung\nBaden-Württemberg Amtsgericht Stuttgart HRA 361064\nRuKo Fahrzeugtechnik GmbH & Co. KG – Metzingen",
      "type": "Löschungsankündigung",
      "state": "Baden-Württemberg",
      "amtsgericht": "Amtsgericht Stuttgart",
      "registernummer": "HRA 361064",
      "registerart": "HRA",
      "company_name": "RuKo Fahrzeugtechnik GmbH & Co. KG",
      "company_seat": "Metzingen",
      "details": "01.07.2025 (Bekanntmachungsdatum)\n\nBaden-Württemberg Amtsgericht Stuttgart HRA 361064\nLöschungsankündigung 28.02.2024 (Eintragungsdatum)\n\nRuKo Fahrzeugtechnik GmbH & Co. KG\nKommanditgesellschaft\nMetzingen\n\nAls nicht eingetragen wird bekanntgemacht:\nDas Gericht beabsichtigt, die Gesellschaft wegen Vermögenslosigkeit im Handelsregister von Amts wegen nach § 394 FamFG zu löschen. Die Frist zur Geltendmachung eines Widerspruchs gegen die beabsichtigte Löschung ist auf zwei Monate ab Veröffentlichung bestimmt."
    },
    {
      "date": "2025-07-01",
      "id": "114065",
      "original_text": "Registerbekanntmachung nach dem Umwandlungsgesetz\nSchleswig-Holstein Amtsgericht Flensburg VR 11 SL\nI. Schleswiger Sportverein von 1906 e.V. – Schleswig",
      "type": "Registerbekanntmachung nach dem Umwandlungsgesetz",
      "state": "Schleswig-Holstein",
      "amtsgericht": "Amtsgericht Flensburg",
      "registernummer": "VR 11 SL",
      "registerart": "VR",
      "company_name": "I. Schleswiger Sportverein von 1906 e.V.",
      "company_seat": "Schleswig",
      "details": "01.07.2025 (Bekanntmachungsdatum)\n\nSchleswig-Holstein Amtsgericht Flensburg VR 11 SL\nRegisterbekanntmachung nach dem Umwandlungsgesetz 30.06.2025 (Eintragungsdatum)\n\nI. Schleswiger Sportverein von 1906 e.V.\neingetragener Verein\nSchleswig\n\nZu Eintragungsnummer 14 vom 30.06.2025 wird als nicht eingetragen veröffentlicht:\nDen Gläubigern der an der Verschmelzung beteiligten Rechtsträger ist, wenn sie binnen sechs Monaten nach dem Tag, an dem die Eintragung der Verschmelzung in das Register des Sitzes desjenigen Rechtsträgers, dessen Gläubiger sie sind, als bekannt gemacht gilt, ihren Anspruch nach Grund und Höhe schriftlich anmelden, Sicherheit zu leisten, soweit sie nicht Befriedigung verlangen können. Dieses Recht steht den Gläubigern jedoch nur zu, wenn sie glaubhaft machen, dass durch die Verschmelzung die Erfüllung ihrer Forderung gefährdet wird. Das Recht, Sicherheitsleistung zu verlangen, steht Gläubigern nicht zu, die im Falle der Insolvenz ein Recht auf vorzugsweise Befriedigung aus einer Deckungsmasse haben, die nach gesetzlicher Vorschrift zu ihrem Schutz errichtet und staatlich überwacht ist."
    },
    {
      "date": "2025-07-01",
      "id": "114066",
      "original_text": "Registerbekanntmachung nach dem Umwandlungsgesetz\nThüringen Amtsgericht Jena HRB 514539\nSeidler Catering UG (haftungsbeschränkt) – Bad Köstritz",
      "type": "Registerbekanntmachung nach dem Umwandlungsgesetz",
      "state": "Thüringen",
      "amtsgericht": "Amtsgericht Jena",
      "registernummer": "HRB 514539",
      "registerart": "HRB",
      "company_name": "Seidler Catering UG (haftungsbeschränkt)",
      "company_seat": "Bad Köstritz",
      "details": "01.07.2025 (Bekanntmachungsdatum)\n\nThüringen Amtsgericht Jena HRB 514539\nRegisterbekanntmachung nach dem Umwandlungsgesetz 01.07.2025 (Eintragungsdatum)\n\nSeidler Catering UG (haftungsbeschränkt)\nGesellschaft mit beschränkter Haftung\nBad Köstritz\n\nNicht eingetragen: Den Gläubigern der an der Verschmelzung beteiligten Rechtsträger, ist wenn sie binnen sechs Monaten nach dem Tag, an dem die Eintragung der Verschmelzung in das Register des Sitzes desjenigen Rechtsträgers, dessen Gläubiger sie sind,  nach § 19 Abs. 3 UmwG als bekanntgemacht gilt, ihren Anspruch nach Grund und Höhe schriftlich anmelden, Sicherheit zu leisten, soweit sie nicht Befriedigung verlangen können. Dieses Recht steht ihnen jedoch nur zu, wenn sie glaubhaft machen, daß durch die Verschmelzung die Erfüllung ihrer Forderung gefährdet wird."
    },
    {
      "date": "2025-07-01",
      "id": "114067",
      "original_text": "Löschungsankündigung\nThüringen Amtsgericht Jena HRB 513596\nBKL Fahrzeug- und Getriebetechnik UG (hatungsbeschränkt) – Riethnordhausen",
      "type": "Löschungsankündigung",
      "state": "Thüringen",
      "amtsgericht": "Amtsgericht Jena",
      "registernummer": "HRB 513596",
      "registerart": "HRB",
      "company_name": "BKL Fahrzeug- und Getriebetechnik UG (hatungsbeschränkt)",
      "company_seat": "Riethnordhausen",
      "details": "01.07.2025 (Bekanntmachungsdatum)\n\nThüringen Amtsgericht Jena HRB 513596\nLöschungsankündigung\n\nBKL Fahrzeug- und Getriebetechnik UG (hatungsbeschränkt)\nGesellschaft mit beschränkter Haftung\nRiethnordhausen\n\nDas Registergericht beabsichtigt, die im Handelsregister eingetragene Gesellschaft wegen Vermögenslosigkeit nach § 394 FamFG von Amts wegen zu löschen. Die Frist zur Erhebung eines Widerspruchs gegen die beabsichtigte Löschung wird auf 6 Wochen festgesetzt."
    },
    {
      "date": "2025-07-01",
      "id": "114068",
      "original_text": "Einreichung neuer Dokumente\nThüringen Amtsgericht Jena HRB 201683\nStadtwerke Neustadt an der Orla GmbH – Neustadt an der Orla",
      "type": "Einreichung neuer Dokumente",
      "state": "Thüringen",
      "amtsgericht": "Amtsgericht Jena",
      "registernummer": "HRB 201683",
      "registerart": "HRB",
      "company_name": "Stadtwerke Neustadt an der Orla GmbH",
      "company_seat": "Neustadt an der Orla",
      "details": "01.07.2025 (Bekanntmachungsdatum)\n\nThüringen Amtsgericht Jena HRB 201683\nEinreichung neuer Dokumente\n\nStadtwerke Neustadt an der Orla GmbH\nGesellschaft mit beschränkter Haftung\nNeustadt an der Orla\n\nBekanntmachung gem. § 52 Abs. 3 Satz 2 GmbHG: Aufgrund einer Veränderung in den Personen der Aufsichtsratsmitglieder ist durch die Geschäftsführer eine neue Liste zum Handelsregister eingereicht worden."
    },
    {
      "date": "2025-07-01",
      "id": "114069",
      "original_text": "Einreichung neuer Dokumente\nSchleswig-Holstein Amtsgericht Flensburg HRB 926 HU\nPflegediakonie Nordfriesland gemeinnützige GmbH – Husum",
      "type": "Einreichung neuer Dokumente",
      "state": "Schleswig-Holstein",
      "amtsgericht": "Amtsgericht Flensburg",
      "registernummer": "HRB 926 HU",
      "registerart": "HRB",
      "company_name": "Pflegediakonie Nordfriesland gemeinnützige GmbH",
      "company_seat": "Husum",
      "details": "01.07.2025 (Bekanntmachungsdatum)\n\nSchleswig-Holstein Amtsgericht Flensburg HRB 926 HU\nEinreichung neuer Dokumente\n\nPflegediakonie Nordfriesland gemeinnützige GmbH\nGesellschaft mit beschränkter Haftung\nHusum\n\nAls nicht eingetragen wird veröffentlicht: Neue Aufsichtsratsliste nach Änderung eingereicht am 27.06.2025."
    },
    {
      "date": "2025-07-01",
      "id": "114070",
      "original_text": "Registerbekanntmachung nach dem Umwandlungsgesetz\nBerlin Amtsgericht Berlin (Charlottenburg) HRB 233599\nSyntax GmbH für Aus- und Weiterbildung – Berlin",
      "type": "Registerbekanntmachung nach dem Umwandlungsgesetz",
      "state": "Berlin",
      "amtsgericht": "Amtsgericht Berlin (Charlottenburg)",
      "registernummer": "HRB 233599",
      "registerart": "HRB",
      "company_name": "Syntax GmbH für Aus- und Weiterbildung",
      "company_seat": "Berlin",
      "details": "01.07.2025 (Bekanntmachungsdatum)\n\nBerlin Amtsgericht Berlin (Charlottenburg) HRB 233599\nRegisterbekanntmachung nach dem Umwandlungsgesetz 30.06.2025 (Eintragungsdatum)\n\nSyntax GmbH für Aus- und Weiterbildung\nGesellschaft mit beschränkter Haftung\nBerlin\n\nZu Eintragungsnummer 6 vom 30.06.2025 wird als nicht eingetragen veröffentlicht: Den Gläubigern der an der Verschmelzung beteiligten Rechtsträger ist, wenn sie binnen sechs Monaten nach dem Tag, an dem die Eintragung der Verschmelzung in das Register des Sitzes desjenigen Rechtsträgers, dessen Gläubiger sie sind, als bekannt gemacht gilt, ihren Anspruch nach Grund und Höhe schriftlich anmelden, Sicherheit zu leisten, soweit sie nicht Befriedigung verlangen können. Dieses Recht steht den Gläubigern jedoch nur zu, wenn sie glaubhaft machen, dass durch die Verschmelzung die Erfüllung ihrer Forderung gefährdet wird. Das Recht, Sicherheitsleistung zu verlangen, steht Gläubigern nicht zu, die im Falle der Insolvenz ein Recht auf vorzugsweise Befriedigung aus einer Deckungsmasse haben, die nach gesetzlicher Vorschrift zu ihrem Schutz errichtet und staatlich überwacht ist."
    },
    {
      "date": "2025-07-01",
      "id": "114071",
      "original_text": "Einreichung neuer Dokumente\nBaden-Württemberg Amtsgericht Freiburg HRB 709111\nMedizinisches Versorgungszentrum des Klinikum Konstanz GmbH – Konstanz",
      "type": "Einreichung neuer Dokumente",
      "state": "Baden-Württemberg",
      "amtsgericht": "Amtsgericht Freiburg",
      "registernummer": "HRB 709111",
      "registerart": "HRB",
      "company_name": "Medizinisches Versorgungszentrum des Klinikum Konstanz GmbH",
      "company_seat": "Konstanz",
      "details": "01.07.2025 (Bekanntmachungsdatum)\n\nBaden-Württemberg Amtsgericht Freiburg HRB 709111\nEinreichung neuer Dokumente 01.07.2025 (Eintragungsdatum)\n\nMedizinisches Versorgungszentrum des Klinikum Konstanz GmbH\nGesellschaft mit beschränkter Haftung\nKonstanz\n\nDie Gesellschaft hat am 30.06.2025 die Liste über die Zusammensetzung des Aufsichtsrats zum Handelsregister eingereicht."
    },
    {
      "date": "2025-07-01",
      "id": "114072",
      "original_text": "Löschungsankündigung\nBerlin Amtsgericht Berlin (Charlottenburg) HRA 41634\nemporium34 GmbH & Co. KG – Berlin",
      "type": "Löschungsankündigung",
      "state": "Berlin",
      "amtsgericht": "Amtsgericht Berlin (Charlottenburg)",
      "registernummer": "HRA 41634",
      "registerart": "HRA",
      "company_name": "emporium34 GmbH & Co. KG",
      "company_seat": "Berlin",
      "details": "01.07.2025 (Bekanntmachungsdatum)\n\nBerlin Amtsgericht Berlin (Charlottenburg) HRA 41634\nLöschungsankündigung\n\nemporium34 GmbH & Co. KG\nKommanditgesellschaft\nBerlin\n\nBei dem nachstehenden Unternehmen / der nachstehenden Gesellschaft wird das Amtslöschungsverfahren gemäß § 31 Abs. 2 HGB eingeleitet. Widerspruchsfrist 1 Monat"
    },
    {
      "date": "2025-07-01",
      "id": "114073",
      "original_text": "Registerbekanntmachung nach dem Umwandlungsgesetz\nBerlin Amtsgericht Berlin (Charlottenburg) HRB 117589\nEnercollect GmbH – Berlin",
      "type": "Registerbekanntmachung nach dem Umwandlungsgesetz",
      "state": "Berlin",
      "amtsgericht": "Amtsgericht Berlin (Charlottenburg)",
      "registernummer": "HRB 117589",
      "registerart": "HRB",
      "company_name": "Enercollect GmbH",
      "company_seat": "Berlin",
      "details": "01.07.2025 (Bekanntmachungsdatum)\n\nBerlin Amtsgericht Berlin (Charlottenburg) HRB 117589\nRegisterbekanntmachung nach dem Umwandlungsgesetz 30.06.2025 (Eintragungsdatum)\n\nEnercollect GmbH\nGesellschaft mit beschränkter Haftung\nBerlin\n\nZu Eintragungsnummer 5 vom 30.06.2025 wird als nicht eingetragen veröffentlicht: Den Gläubigern der an der Verschmelzung beteiligten Rechtsträger ist, wenn sie binnen sechs Monaten nach dem Tag, an dem die Eintragung der Verschmelzung in das Register des Sitzes desjenigen Rechtsträgers, dessen Gläubiger sie sind, als bekannt gemacht gilt, ihren Anspruch nach Grund und Höhe schriftlich anmelden, Sicherheit zu leisten, soweit sie nicht Befriedigung verlangen können. Dieses Recht steht den Gläubigern jedoch nur zu, wenn sie glaubhaft machen, dass durch die Verschmelzung die Erfüllung ihrer Forderung gefährdet wird. Das Recht, Sicherheitsleistung zu verlangen, steht Gläubigern nicht zu, die im Falle der Insolvenz ein Recht auf vorzugsweise Befriedigung aus einer Deckungsmasse haben, die nach gesetzlicher Vorschrift zu ihrem Schutz errichtet und staatlich überwacht ist."
    },
    {
      "date": "2025-07-01",
      "id": "114074",
      "original_text": "Registerbekanntmachung nach dem Umwandlungsgesetz\nBerlin Amtsgericht Berlin (Charlottenburg) HRB 174561\nXemio GmbH – Berlin",
      "type": "Registerbekanntmachung nach dem Umwandlungsgesetz",
      "state": "Berlin",
      "amtsgericht": "Amtsgericht Berlin (Charlottenburg)",
      "registernummer": "HRB 174561",
      "registerart": "HRB",
      "company_name": "Xemio GmbH",
      "company_seat": "Berlin",
      "details": "01.07.2025 (Bekanntmachungsdatum)\n\nBerlin Amtsgericht Berlin (Charlottenburg) HRB 174561\nRegisterbekanntmachung nach dem Umwandlungsgesetz 30.06.2025 (Eintragungsdatum)\n\nXemio GmbH\nGesellschaft mit beschränkter Haftung\nBerlin\n\nZu Eintragungsnummer 4 vom 30.06.2025 wird als nicht eingetragen veröffentlicht: Den Gläubigern der an der Verschmelzung beteiligten Rechtsträger ist, wenn sie binnen sechs Monaten nach dem Tag, an dem die Eintragung der Verschmelzung in das Register des Sitzes desjenigen Rechtsträgers, dessen Gläubiger sie sind, als bekannt gemacht gilt, ihren Anspruch nach Grund und Höhe schriftlich anmelden, Sicherheit zu leisten, soweit sie nicht Befriedigung verlangen können. Dieses Recht steht den Gläubigern jedoch nur zu, wenn sie glaubhaft machen, dass durch die Verschmelzung die Erfüllung ihrer Forderung gefährdet wird. Das Recht, Sicherheitsleistung zu verlangen, steht Gläubigern nicht zu, die im Falle der Insolvenz ein Recht auf vorzugsweise Befriedigung aus einer Deckungsmasse haben, die nach gesetzlicher Vorschrift zu ihrem Schutz errichtet und staatlich überwacht ist."
    },
    {
      "date": "2025-07-01",
      "id": "114075",
      "original_text": "Registerbekanntmachung nach dem Umwandlungsgesetz\nHamburg Amtsgericht Hamburg HRB 32386\nEvonik Dr. Straetmans GmbH – Hamburg",
      "type": "Registerbekanntmachung nach dem Umwandlungsgesetz",
      "state": "Hamburg",
      "amtsgericht": "Amtsgericht Hamburg",
      "registernummer": "HRB 32386",
      "registerart": "HRB",
      "company_name": "Evonik Dr. Straetmans GmbH",
      "company_seat": "Hamburg",
      "details": "01.07.2025 (Bekanntmachungsdatum)\n\nHamburg Amtsgericht Hamburg HRB 32386\nRegisterbekanntmachung nach dem Umwandlungsgesetz 01.07.2025 (Eintragungsdatum)\n\nEvonik Dr. Straetmans GmbH\nGesellschaft mit beschränkter Haftung\nHamburg\n\nAls nicht eingetragen wird bekannt gemacht:\nDen Gläubigern der an der Verschmelzung beteiligten Gesellschaften ist, wenn sie binnen sechs Monaten nach dem Tag, an dem die Eintragung der Verschmelzung in das Register des Sitzes desjenigen Rechtsträgers, dessen Gläubiger sie sind, nach § 19 Absatz 3 UmwG als bekannt gemacht gilt, ihren Anspruch nach Grund und Höhe schriftlich anmelden, Sicherheit zu leisten, soweit sie nicht Befriedigung verlangen können. Dieses Recht steht den Gläubigern jedoch nur zu, wenn sie glaubhaft machen, dass durch die Verschmelzung die Erfüllung ihrer Forderung gefährdet wird."
    },
    {
      "date": "2025-07-01",
      "id": "114076",
      "original_text": "Registerbekanntmachung nach dem Umwandlungsgesetz\nBerlin Amtsgericht Berlin (Charlottenburg) HRA 57244\nGlobalSprachTeam Sassenberg e.K. – Berlin",
      "type": "Registerbekanntmachung nach dem Umwandlungsgesetz",
      "state": "Berlin",
      "amtsgericht": "Amtsgericht Berlin (Charlottenburg)",
      "registernummer": "HRA 57244",
      "registerart": "HRA",
      "company_name": "GlobalSprachTeam Sassenberg e.K.",
      "company_seat": "Berlin",
      "details": "01.07.2025 (Bekanntmachungsdatum)\n\nBerlin Amtsgericht Berlin (Charlottenburg) HRA 57244\nRegisterbekanntmachung nach dem Umwandlungsgesetz 30.06.2025 (Eintragungsdatum)\n\nGlobalSprachTeam Sassenberg e.K.\nEinzelkaufmann / Einzelkauffrau\nBerlin\n\nZu Eintragungsnummer 3 vom 30.06.2025 wird als nicht eingetragen veröffentlicht: Den Gläubigern der an der Ausgliederung beteiligten Rechtsträger ist, wenn sie binnen sechs Monaten nach dem Tag, an dem die Eintragung der Ausgliederung in das Register des Sitzes desjenigen Rechtsträgers, dessen Gläubiger sie sind, als bekannt gemacht gilt, ihren Anspruch nach Grund und Höhe schriftlich anmelden, Sicherheit zu leisten, soweit sie nicht Befriedigung verlangen können. Dieses Recht steht den Gläubigern jedoch nur zu, wenn sie glaubhaft machen, dass durch die Ausgliederung die Erfüllung ihrer Forderung gefährdet wird. Das Recht, Sicherheitsleistung zu verlangen, steht Gläubigern nicht zu, die im Falle der Insolvenz ein Recht auf vorzugsweise Befriedigung aus einer Deckungsmasse haben, die nach gesetzlicher Vorschrift zu ihrem Schutz errichtet und staatlich überwacht ist."
    },
    {
      "date": "2025-07-01",
      "id": "114077",
      "original_text": "Einreichung neuer Dokumente\nSaarland Amtsgericht Saarbrücken HRB 12286\nIKS IndustrieKultur Saar Gesellschaft mit beschränkter Haftung – Quierschied",
      "type": "Einreichung neuer Dokumente",
      "state": "Saarland",
      "amtsgericht": "Amtsgericht Saarbrücken",
      "registernummer": "HRB 12286",
      "registerart": "HRB",
      "company_name": "IKS IndustrieKultur Saar Gesellschaft mit beschränkter Haftung",
      "company_seat": "Quierschied",
      "details": "01.07.2025 (Bekanntmachungsdatum)\n\nSaarland Amtsgericht Saarbrücken HRB 12286\nEinreichung neuer Dokumente\n\nIKS IndustrieKultur Saar Gesellschaft mit beschränkter Haftung\nGesellschaft mit beschränkter Haftung\nQuierschied\n\nDie Geschäftsführung der Gesellschaft hat eine Liste der Mitglieder des Aufsichtsrats zum Handelsregister eingereicht (§ 52 Abs. 3 Satz 2 GmbHG)."
    },
    {
      "date": "2025-07-01",
      "id": "114078",
      "original_text": "Registerbekanntmachung nach dem Umwandlungsgesetz\nBerlin Amtsgericht Berlin (Charlottenburg) HRB 276550\nGST GlobalSprachTeam GmbH – Berlin",
      "type": "Registerbekanntmachung nach dem Umwandlungsgesetz",
      "state": "Berlin",
      "amtsgericht": "Amtsgericht Berlin (Charlottenburg)",
      "registernummer": "HRB 276550",
      "registerart": "HRB",
      "company_name": "GST GlobalSprachTeam GmbH",
      "company_seat": "Berlin",
      "details": "01.07.2025 (Bekanntmachungsdatum)\n\nBerlin Amtsgericht Berlin (Charlottenburg) HRB 276550\nRegisterbekanntmachung nach dem Umwandlungsgesetz 30.06.2025 (Eintragungsdatum)\n\nGST GlobalSprachTeam GmbH\nGesellschaft mit beschränkter Haftung\nBerlin\n\nZu Eintragungsnummer 1 vom 30.06.2025 wird als nicht eingetragen veröffentlicht: Den Gläubigern der an der Spaltung beteiligten Rechtsträger ist, wenn sie binnen sechs Monaten nach dem Tag, an dem die Eintragung der Spaltung in das Register des Sitzes desjenigen Rechtsträgers, dessen Gläubiger sie sind, als bekannt gemacht gilt, ihren Anspruch nach Grund und Höhe schriftlich anmelden, Sicherheit zu leisten, soweit sie nicht Befriedigung verlangen können. Dieses Recht steht den Gläubigern jedoch nur zu, wenn sie glaubhaft machen, dass durch die Spaltung die Erfüllung ihrer Forderung gefährdet wird. Das Recht, Sicherheitsleistung zu verlangen, steht Gläubigern nicht zu, die im Falle der Insolvenz ein Recht auf vorzugsweise Befriedigung aus einer Deckungsmasse haben, die nach gesetzlicher Vorschrift zu ihrem Schutz errichtet und staatlich überwacht ist."
    },
    {
      "date": "2025-07-01",
      "id": "114079",
      "original_text": "Einreichung neuer Dokumente\nBerlin Amtsgericht Berlin (Charlottenburg) HRB 234708\ntillit Management GmbH – Berlin",
      "type": "Einreichung neuer Dokumente",
      "state": "Berlin",
      "amtsgericht": "Amtsgericht Berlin (Charlottenburg)",
      "registernummer": "HRB 234708",
      "registerart": "HRB",
      "company_name": "tillit Management GmbH",
      "company_seat": "Berlin",
      "details": "01.07.2025 (Bekanntmachungsdatum)\n\nBerlin Amtsgericht Berlin (Charlottenburg) HRB 234708\nEinreichung neuer Dokumente\n\ntillit Management GmbH\nGesellschaft mit beschränkter Haftung\nBerlin\n\nAls nicht eingetragen wird veröffentlicht: Es wurde eine neue Liste der Beiratsmitglieder eingereicht (§52 GmbHG)."
    },
    {
      "date": "2025-07-01",
      "id": "114080",
      "original_text": "Löschungsankündigung\nBrandenburg Amtsgericht Neuruppin HRB 11665\nRTK Bau GmbH – Oranienburg",
      "type": "Löschungsankündigung",
      "state": "Brandenburg",
      "amtsgericht": "Amtsgericht Neuruppin",
      "registernummer": "HRB 11665",
      "registerart": "HRB",
      "company_name": "RTK Bau GmbH",
      "company_seat": "Oranienburg",
      "details": "01.07.2025 (Bekanntmachungsdatum)\n\nBrandenburg Amtsgericht Neuruppin HRB 11665\nLöschungsankündigung\n\nRTK Bau GmbH\nGesellschaft mit beschränkter Haftung\nOranienburg\n\nBei der nachstehenden Gesellschaft wird das Amtslöschungsverfahren gemäß § 394 FamFG eingeleitet.\nWiderspruchsfrist: 1 Monat"
    },
    {
      "date": "2025-07-01",
      "id": "114081",
      "original_text": "Registerbekanntmachung nach dem Umwandlungsgesetz\nBerlin Amtsgericht Berlin (Charlottenburg) HRB 117589\nEnercollect GmbH – Berlin",
      "type": "Registerbekanntmachung nach dem Umwandlungsgesetz",
      "state": "Berlin",
      "amtsgericht": "Amtsgericht Berlin (Charlottenburg)",
      "registernummer": "HRB 117589",
      "registerart": "HRB",
      "company_name": "Enercollect GmbH",
      "company_seat": "Berlin",
      "details": "01.07.2025 (Bekanntmachungsdatum)\n\nBerlin Amtsgericht Berlin (Charlottenburg) HRB 117589\nRegisterbekanntmachung nach dem Umwandlungsgesetz 30.06.2025 (Eintragungsdatum)\n\nEnercollect GmbH\nGesellschaft mit beschränkter Haftung\nBerlin\n\nZu Eintragungsnummer 5 vom 30.06.2025 wird als nicht eingetragen veröffentlicht: Den Gläubigern der an der Verschmelzung beteiligten Rechtsträger ist, wenn sie binnen sechs Monaten nach dem Tag, an dem die Eintragung der Verschmelzung in das Register des Sitzes desjenigen Rechtsträgers, dessen Gläubiger sie sind, als bekannt gemacht gilt, ihren Anspruch nach Grund und Höhe schriftlich anmelden, Sicherheit zu leisten, soweit sie nicht Befriedigung verlangen können. Dieses Recht steht den Gläubigern jedoch nur zu, wenn sie glaubhaft machen, dass durch die Verschmelzung die Erfüllung ihrer Forderung gefährdet wird. Das Recht, Sicherheitsleistung zu verlangen, steht Gläubigern nicht zu, die im Falle der Insolvenz ein Recht auf vorzugsweise Befriedigung aus einer Deckungsmasse haben, die nach gesetzlicher Vorschrift zu ihrem Schutz errichtet und staatlich überwacht ist."
    },
    {
      "date": "2025-07-01",
      "id": "114082",
      "original_text": "Registerbekanntmachung nach dem Umwandlungsgesetz\nBaden-Württemberg Amtsgericht Mannheim HRB 742455\nRK Invest GmbH – Karlsruhe",
      "type": "Registerbekanntmachung nach dem Umwandlungsgesetz",
      "state": "Baden-Württemberg",
      "amtsgericht": "Amtsgericht Mannheim",
      "registernummer": "HRB 742455",
      "registerart": "HRB",
      "company_name": "RK Invest GmbH",
      "company_seat": "Karlsruhe",
      "details": "01.07.2025 (Bekanntmachungsdatum)\n\nBaden-Württemberg Amtsgericht Mannheim HRB 742455\nRegisterbekanntmachung nach dem Umwandlungsgesetz 30.06.2025 (Eintragungsdatum)\n\nRK Invest GmbH\nGesellschaft mit beschränkter Haftung\nKarlsruhe\n\nDen Gläubigern der an der Verschmelzung beteiligten Rechtsträger ist, wenn sie binnen sechs Monaten nach dem Tag, an dem die Eintragung der Verschmelzung in das Register des Sitzes desjenigen Rechtsträgers, dessen Gläubiger sie sind, nach § 19 Abs. 3 UmwG als bekanntgemacht gilt, ihren Anspruch nach Grund und Höhe schriftlich anmelden, Sicherheit zu leisten, soweit sie nicht Befriedigung verlangen können. Dieses Recht steht den Gläubigern jedoch nur zu, wenn sie glaubhaft machen, dass durch die Verschmelzung die Erfüllung ihrer Forderung gefährdet wird."
    },
    {
      "date": "2025-07-01",
      "id": "114083",
      "original_text": "Registerbekanntmachung nach dem Umwandlungsgesetz\nBrandenburg Amtsgericht Neuruppin HRB 10725\nBirgit Dehn aktiv & gesund Unternehmergesellschaft (haftungsbeschränkt) – Hennigsdorf",
      "type": "Registerbekanntmachung nach dem Umwandlungsgesetz",
      "state": "Brandenburg",
      "amtsgericht": "Amtsgericht Neuruppin",
      "registernummer": "HRB 10725",
      "registerart": "HRB",
      "company_name": "Birgit Dehn aktiv & gesund Unternehmergesellschaft (haftungsbeschränkt)",
      "company_seat": "Hennigsdorf",
      "details": "01.07.2025 (Bekanntmachungsdatum)\n\nBrandenburg Amtsgericht Neuruppin HRB 10725\nRegisterbekanntmachung nach dem Umwandlungsgesetz 30.06.2025 (Eintragungsdatum)\n\nBirgit Dehn aktiv & gesund Unternehmergesellschaft (haftungsbeschränkt)\nGesellschaft mit beschränkter Haftung\nHennigsdorf\n\nZu Eintragungsnummer 2 vom 30.06.2025 wird als nicht eingetragen veröffentlicht:\nDen Gläubigern der an der Umwandlung beteiligten Rechtsträger ist, wenn sie binnen sechs Monaten nach dem Tag, an dem die Eintragung der Umwandlung in das Register des Sitzes desjenigen Rechtsträgers, dessen Gläubiger sie sind, als bekannt gemacht gilt, ihren Anspruch nach Grund und Höhe schriftlich anmelden, Sicherheit zu leisten, soweit sie nicht Befriedigung verlangen können. Dieses Recht steht den Gläubigern jedoch nur zu, wenn sie glaubhaft machen, dass durch die Umwandlung die Erfüllung ihrer Forderung gefährdet wird"
    },
    {
      "date": "2025-07-01",
      "id": "114084",
      "original_text": "Registerbekanntmachung nach dem Umwandlungsgesetz\nBerlin Amtsgericht Berlin (Charlottenburg) HRB 192178\nLEAD Investment Zweite GmbH – Berlin",
      "type": "Registerbekanntmachung nach dem Umwandlungsgesetz",
      "state": "Berlin",
      "amtsgericht": "Amtsgericht Berlin (Charlottenburg)",
      "registernummer": "HRB 192178",
      "registerart": "HRB",
      "company_name": "LEAD Investment Zweite GmbH",
      "company_seat": "Berlin",
      "details": "01.07.2025 (Bekanntmachungsdatum)\n\nBerlin Amtsgericht Berlin (Charlottenburg) HRB 192178\nRegisterbekanntmachung nach dem Umwandlungsgesetz 30.06.2025 (Eintragungsdatum)\n\nLEAD Investment Zweite GmbH\nGesellschaft mit beschränkter Haftung\nBerlin\n\nZu Eintragungsnummer 4 vom 30.06.2025 wird als nicht eingetragen veröffentlicht: Den Gläubigern der an der Verschmelzung beteiligten Rechtsträger ist, wenn sie binnen sechs Monaten nach dem Tag, an dem die Eintragung der Verschmelzung in das Register des Sitzes desjenigen Rechtsträgers, dessen Gläubiger sie sind, als bekannt gemacht gilt, ihren Anspruch nach Grund und Höhe schriftlich anmelden, Sicherheit zu leisten, soweit sie nicht Befriedigung verlangen können. Dieses Recht steht den Gläubigern jedoch nur zu, wenn sie glaubhaft machen, dass durch die Verschmelzung die Erfüllung ihrer Forderung gefährdet wird. Das Recht, Sicherheitsleistung zu verlangen, steht Gläubigern nicht zu, die im Falle der Insolvenz ein Recht auf vorzugsweise Befriedigung aus einer Deckungsmasse haben, die nach gesetzlicher Vorschrift zu ihrem Schutz errichtet und staatlich überwacht ist."
    },
    {
      "date": "2025-07-01",
      "id": "114085",
      "original_text": "Löschungsankündigung\nBaden-Württemberg Amtsgericht Mannheim HRB 737206\ndie bleibenden Werte UG (haftungsbeschränkt) – Pfinztal",
      "type": "Löschungsankündigung",
      "state": "Baden-Württemberg",
      "amtsgericht": "Amtsgericht Mannheim",
      "registernummer": "HRB 737206",
      "registerart": "HRB",
      "company_name": "die bleibenden Werte UG (haftungsbeschränkt)",
      "company_seat": "Pfinztal",
      "details": "01.07.2025 (Bekanntmachungsdatum)\n\nBaden-Württemberg Amtsgericht Mannheim HRB 737206\nLöschungsankündigung\n\ndie bleibenden Werte UG (haftungsbeschränkt)\nGesellschaft mit beschränkter Haftung\nPfinztal\n\nDas Gericht beabsichtigt, die Gesellschaft wegen Vermögenslosigkeit im Handelsregister von Amts wegen nach § 394 FamFG zu löschen. Die Frist zur Geltendmachung eines Widerspruchs gegen die beabsichtigte Löschung ist auf einen Monat ab Veröffentlichung bestimmt."
    },
    {
      "date": "2025-07-01",
      "id": "114086",
      "original_text": "Sonstige Registerbekanntmachung\nHamburg Amtsgericht Hamburg HRB 14181\nGRUNDVERMÖGEN Handels- und Verwaltungs - Aktiengesellschaft – Hamburg",
      "type": "Sonstige Registerbekanntmachung",
      "state": "Hamburg",
      "amtsgericht": "Amtsgericht Hamburg",
      "registernummer": "HRB 14181",
      "registerart": "HRB",
      "company_name": "GRUNDVERMÖGEN Handels- und Verwaltungs - Aktiengesellschaft",
      "company_seat": "Hamburg",
      "details": "01.07.2025 (Bekanntmachungsdatum)\n\nHamburg Amtsgericht Hamburg HRB 14181\nSonstige Registerbekanntmachung\n\nGRUNDVERMÖGEN Handels- und Verwaltungs - Aktiengesellschaft\nAktiengesellschaft\nHamburg\n\nAls nicht eingetragen wird bekannt gemacht: Liste des Aufsichtsrats wurde eingereicht."
    },
    {
      "date": "2025-07-01",
      "id": "114087",
      "original_text": "Registerbekanntmachung nach dem Umwandlungsgesetz\nSchleswig-Holstein Amtsgericht Flensburg VR 3612\nSchleswiger Sportverein von 1864 und 1906 e.V. – Schleswig",
      "type": "Registerbekanntmachung nach dem Umwandlungsgesetz",
      "state": "Schleswig-Holstein",
      "amtsgericht": "Amtsgericht Flensburg",
      "registernummer": "VR 3612",
      "registerart": "VR",
      "company_name": "Schleswiger Sportverein von 1864 und 1906 e.V.",
      "company_seat": "Schleswig",
      "details": "01.07.2025 (Bekanntmachungsdatum)\n\nSchleswig-Holstein Amtsgericht Flensburg VR 3612\nRegisterbekanntmachung nach dem Umwandlungsgesetz 30.06.2025 (Eintragungsdatum)\n\nSchleswiger Sportverein von 1864 und 1906 e.V.\neingetragener Verein\nSchleswig\n\nAls nicht eingetragen wird veröffentlicht: Den Gläubigern der an der Verschmelzung beteiligten Rechtsträger ist, wenn sie binnen sechs Monaten nach dem Tag, an dem die Eintragung der Verschmelzung in das Register des Sitzes desjenigen Rechtsträgers, dessen Gläubiger sie sind, als bekannt gemacht gilt, ihren Anspruch nach Grund und Höhe schriftlich anmelden, Sicherheit zu leisten, soweit sie nicht Befriedigung verlangen können. Dieses Recht steht den Gläubigern jedoch nur zu, wenn sie glaubhaft machen, dass durch die Verschmelzung die Erfüllung ihrer Forderung gefährdet wird. Das Recht, Sicherheitsleistung zu verlangen, steht Gläubigern nicht zu, die im Falle der Insolvenz ein Recht auf vorzugsweise Befriedigung aus einer Deckungsmasse haben, die nach gesetzlicher Vorschrift zu ihrem Schutz errichtet und staatlich überwacht ist."
    },
    {
      "date": "2025-07-01",
      "id": "114088",
      "original_text": "Löschungsankündigung\nMecklenburg-Vorpommern Amtsgericht Neubrandenburg HRB 8206\nBau- und Projektmanagement Klink UG (haftungsbeschränkt) – Klink",
      "type": "Löschungsankündigung",
      "state": "Mecklenburg-Vorpommern",
      "amtsgericht": "Amtsgericht Neubrandenburg",
      "registernummer": "HRB 8206",
      "registerart": "HRB",
      "company_name": "Bau- und Projektmanagement Klink UG (haftungsbeschränkt)",
      "company_seat": "Klink",
      "details": "01.07.2025 (Bekanntmachungsdatum)\n\nMecklenburg-Vorpommern Amtsgericht Neubrandenburg HRB 8206\nLöschungsankündigung 01.07.2025 (Eintragungsdatum)\n\nBau- und Projektmanagement Klink UG (haftungsbeschränkt)\nGesellschaft mit beschränkter Haftung\nKlink\n\nDas Registergericht beabsichtigt, die im Handelsregister eingetragene Gesellschaft von Amts wegen nach § 394 FamFG zu löschen. Die Frist zur Erhebung eines Widerspruchs gegen die beabsichtigte Löschung wird auf drei Monate festgesetzt."
    },
    {
      "date": "2025-07-01",
      "id": "114089",
      "original_text": "Löschungsankündigung\nBerlin Amtsgericht Berlin (Charlottenburg) HRB 270743\nLMTK Dienstleistungen UG (haftungsbeschränkt) – Berlin",
      "type": "Löschungsankündigung",
      "state": "Berlin",
      "amtsgericht": "Amtsgericht Berlin (Charlottenburg)",
      "registernummer": "HRB 270743",
      "registerart": "HRB",
      "company_name": "LMTK Dienstleistungen UG (haftungsbeschränkt)",
      "company_seat": "Berlin",
      "details": "01.07.2025 (Bekanntmachungsdatum)\n\nBerlin Amtsgericht Berlin (Charlottenburg) HRB 270743\nLöschungsankündigung\n\nLMTK Dienstleistungen UG (haftungsbeschränkt)\nGesellschaft mit beschränkter Haftung\nBerlin\n\nBei der nachstehenden Gesellschaft wird das Amtslöschungsverfahren gemäß § 394 FamFG eingeleitet. Widerspruchsfrist 6 Wochen"
    },
    {
      "date": "2025-07-01",
      "id": "114090",
      "original_text": "Löschungsankündigung\nBrandenburg Amtsgericht Frankfurt/Oder HRB 16937\nSkysbike GmbH – Frankfurt (Oder)",
      "type": "Löschungsankündigung",
      "state": "Brandenburg",
      "amtsgericht": "Amtsgericht Frankfurt/Oder",
      "registernummer": "HRB 16937",
      "registerart": "HRB",
      "company_name": "Skysbike GmbH",
      "company_seat": "Frankfurt (Oder)",
      "details": "01.07.2025 (Bekanntmachungsdatum)\n\nBrandenburg Amtsgericht Frankfurt/Oder HRB 16937\nLöschungsankündigung\n\nSkysbike GmbH\nGesellschaft mit beschränkter Haftung\nFrankfurt (Oder)\n\nBei der nachstehenden Gesellschaft wird das Amtslöschungsverfahren gemäß § 394 Abs. 1 FamFG eingeleitet."
    },
    {
      "date": "2025-07-01",
      "id": "114091",
      "original_text": "Registerbekanntmachung nach dem Umwandlungsgesetz\nSachsen-Anhalt Amtsgericht Stendal HRA 8229\nChristoph Walther - HelpDev e.K. – Dessau-Roßlau",
      "type": "Registerbekanntmachung nach dem Umwandlungsgesetz",
      "state": "Sachsen-Anhalt",
      "amtsgericht": "Amtsgericht Stendal",
      "registernummer": "HRA 8229",
      "registerart": "HRA",
      "company_name": "Christoph Walther - HelpDev e.K.",
      "company_seat": "Dessau-Roßlau",
      "details": "01.07.2025 (Bekanntmachungsdatum)\n\nSachsen-Anhalt Amtsgericht Stendal HRA 8229\nRegisterbekanntmachung nach dem Umwandlungsgesetz 01.07.2025 (Eintragungsdatum)\n\nChristoph Walther - HelpDev e.K.\nEinzelkaufmann / Einzelkauffrau\nDessau-Roßlau\n\nNicht eingetragen:\nDen Gläubigern der an der Ausgliederung beteiligten Rechtsträger ist, wenn sie binnen sechs Monaten nach dem Tag, an dem die Eintragung der Ausgliederung nach §§125, 19 Abs. 3 UmwG als bekanntgemacht gilt, ihren Anspruch nach Grund und Höhe schriftlich anmelden, Sicherheit zu leisten, soweit sie nicht Befriedigung verlangen können. Dieses Recht steht ihnen jedoch nur zu, wenn sie glaubhaft machen, dass durch die Ausgliederung die Erfüllung ihrer Forderung gefährdet wird."
    },
    {
      "date": "2025-07-01",
      "id": "114092",
      "original_text": "Registerbekanntmachung nach dem Umwandlungsgesetz\nSachsen-Anhalt Amtsgericht Stendal HRB 35939\nHelpDev GmbH – Dessau-Roßlau",
      "type": "Registerbekanntmachung nach dem Umwandlungsgesetz",
      "state": "Sachsen-Anhalt",
      "amtsgericht": "Amtsgericht Stendal",
      "registernummer": "HRB 35939",
      "registerart": "HRB",
      "company_name": "HelpDev GmbH",
      "company_seat": "Dessau-Roßlau",
      "details": "01.07.2025 (Bekanntmachungsdatum)\n\nSachsen-Anhalt Amtsgericht Stendal HRB 35939\nRegisterbekanntmachung nach dem Umwandlungsgesetz 01.07.2025 (Eintragungsdatum)\n\nHelpDev GmbH\nGesellschaft mit beschränkter Haftung\nDessau-Roßlau\n\nNicht eingetragen:\nDen Gläubigern der an der Spaltung beteiligten Rechtsträger, ist wenn sie binnen sechs Monaten nach dem Tag, an dem die Eintragung der Spaltung nach §§ 125, 19 Abs. 3 UmwG als bekanntgemacht gilt, ihren Anspruch nach Grund und Höhe schriftlich anmelden, Sicherheit zu leisten, soweit sie nicht Befriedigung verlangen können. Dieses Recht steht ihnen jedoch nur zu, wenn sie glaubhaft machen, daß durch die Spaltung die Erfüllung ihrer Forderung gefährdet wird."
    },
    {
      "date": "2025-07-01",
      "id": "114093",
      "original_text": "Löschungsankündigung\nBerlin Amtsgericht Berlin (Charlottenburg) HRA 39555\nSobasa Raunheim GmbH & Co. KG – Berlin",
      "type": "Löschungsankündigung",
      "state": "Berlin",
      "amtsgericht": "Amtsgericht Berlin (Charlottenburg)",
      "registernummer": "HRA 39555",
      "registerart": "HRA",
      "company_name": "Sobasa Raunheim GmbH & Co. KG",
      "company_seat": "Berlin",
      "details": "01.07.2025 (Bekanntmachungsdatum)\n\nBerlin Amtsgericht Berlin (Charlottenburg) HRA 39555\nLöschungsankündigung\n\nSobasa Raunheim GmbH & Co. KG\nKommanditgesellschaft\nBerlin\n\nBei dem nachstehenden Unternehmen / der nachstehenden Gesellschaft wird das Amtslöschungsverfahren gemäß § 31 Abs. 2 HGB eingeleitet. Widerspruchsfrist 2 Monate"
    },
    {
      "date": "2025-07-01",
      "id": "114094",
      "original_text": "Löschungsankündigung\nBaden-Württemberg Amtsgericht Ulm HRB 725231\nBULLYLAND GmbH – Spraitbach",
      "type": "Löschungsankündigung",
      "state": "Baden-Württemberg",
      "amtsgericht": "Amtsgericht Ulm",
      "registernummer": "HRB 725231",
      "registerart": "HRB",
      "company_name": "BULLYLAND GmbH",
      "company_seat": "Spraitbach",
      "details": "01.07.2025 (Bekanntmachungsdatum)\n\nBaden-Württemberg Amtsgericht Ulm HRB 725231\nLöschungsankündigung\n\nBULLYLAND GmbH\nGesellschaft mit beschränkter Haftung\nSpraitbach\n\nDas Gericht beabsichtigt, die Gesellschaft wegen Vermögenslosigkeit im Handelsregister von Amts wegen nach § 394 FamFG zu löschen. Die Frist zur Geltendmachung eines Widerspruchs gegen die beabsichtigte Löschung ist auf  einen Monat ab Veröffentlichung bestimmt."
    },
    {
      "date": "2025-07-01",
      "id": "114095",
      "original_text": "Löschungsankündigung\nBaden-Württemberg Amtsgericht Ulm HRA 701271\nSAS Vermögensverwaltung GmbH & Co. KG – Gingen an der Fils",
      "type": "Löschungsankündigung",
      "state": "Baden-Württemberg",
      "amtsgericht": "Amtsgericht Ulm",
      "registernummer": "HRA 701271",
      "registerart": "HRA",
      "company_name": "SAS Vermögensverwaltung GmbH & Co. KG",
      "company_seat": "Gingen an der Fils",
      "details": "01.07.2025 (Bekanntmachungsdatum)\n\nBaden-Württemberg Amtsgericht Ulm HRA 701271\nLöschungsankündigung 01.07.2025 (Eintragungsdatum)\n\nSAS Vermögensverwaltung GmbH & Co. KG\nKommanditgesellschaft\nGingen an der Fils\n\nDas Gericht beabsichtigt, die Gesellschaft wegen Vermögenslosigkeit im Handelsregister von Amts wegen nach § 394 FamFG zu löschen. Die Frist zur Geltendmachung eines Widerspruchs gegen die beabsichtigte Löschung ist auf  einen Monat ab Veröffentlichung bestimmt."
    },
    {
      "date": "2025-07-01",
      "id": "114096",
      "original_text": "Registerbekanntmachung nach dem Umwandlungsgesetz\nBaden-Württemberg Amtsgericht Mannheim HRB 720422\nK & H GmbH – Gaggenau",
      "type": "Registerbekanntmachung nach dem Umwandlungsgesetz",
      "state": "Baden-Württemberg",
      "amtsgericht": "Amtsgericht Mannheim",
      "registernummer": "HRB 720422",
      "registerart": "HRB",
      "company_name": "K & H GmbH",
      "company_seat": "Gaggenau",
      "details": "01.07.2025 (Bekanntmachungsdatum)\n\nBaden-Württemberg Amtsgericht Mannheim HRB 720422\nRegisterbekanntmachung nach dem Umwandlungsgesetz 01.07.2025 (Eintragungsdatum)\n\nK & H GmbH\nGesellschaft mit beschränkter Haftung\nGaggenau\n\nDen Gläubigern der an der Verschmelzung beteiligten Rechtsträger ist, wenn sie binnen sechs Monaten nach dem Tag, an dem die Eintragung der Verschmelzung in das Register des Sitzes desjenigen Rechtsträgers, dessen Gläubiger sie sind, nach § 19 Abs. 3 UmwG als bekanntgemacht gilt, ihren Anspruch nach Grund und Höhe schriftlich anmelden, Sicherheit zu leisten, soweit sie nicht Befriedigung verlangen können. Dieses Recht steht den Gläubigern jedoch nur zu, wenn sie glaubhaft machen, dass durch die Verschmelzung die Erfüllung ihrer Forderung gefährdet wird."
    },
    {
      "date": "2025-07-01",
      "id": "114097",
      "original_text": "Registerbekanntmachung nach dem Umwandlungsgesetz\nBaden-Württemberg Amtsgericht Mannheim HRB 738272\nK&L Automation-Systems GmbH – Gaggenau",
      "type": "Registerbekanntmachung nach dem Umwandlungsgesetz",
      "state": "Baden-Württemberg",
      "amtsgericht": "Amtsgericht Mannheim",
      "registernummer": "HRB 738272",
      "registerart": "HRB",
      "company_name": "K&L Automation-Systems GmbH",
      "company_seat": "Gaggenau",
      "details": "01.07.2025 (Bekanntmachungsdatum)\n\nBaden-Württemberg Amtsgericht Mannheim HRB 738272\nRegisterbekanntmachung nach dem Umwandlungsgesetz 01.07.2025 (Eintragungsdatum)\n\nK&L Automation-Systems GmbH\nGesellschaft mit beschränkter Haftung\nGaggenau\n\nDen Gläubigern der an der Verschmelzung beteiligten Rechtsträger ist, wenn sie binnen sechs Monaten nach dem Tag, an dem die Eintragung der Verschmelzung in das Register des Sitzes desjenigen Rechtsträgers, dessen Gläubiger sie sind, nach § 19 Abs. 3 UmwG als bekanntgemacht gilt, ihren Anspruch nach Grund und Höhe schriftlich anmelden, Sicherheit zu leisten, soweit sie nicht Befriedigung verlangen können. Dieses Recht steht den Gläubigern jedoch nur zu, wenn sie glaubhaft machen, dass durch die Verschmelzung die Erfüllung ihrer Forderung gefährdet wird."
    },
    {
      "date": "2025-07-01",
      "id": "114098",
      "original_text": "Löschungsankündigung\nBaden-Württemberg Amtsgericht Ulm HRB 702233\nSAS Verwaltungs GmbH – Gingen an der Fils",
      "type": "Löschungsankündigung",
      "state": "Baden-Württemberg",
      "amtsgericht": "Amtsgericht Ulm",
      "registernummer": "HRB 702233",
      "registerart": "HRB",
      "company_name": "SAS Verwaltungs GmbH",
      "company_seat": "Gingen an der Fils",
      "details": "01.07.2025 (Bekanntmachungsdatum)\n\nBaden-Württemberg Amtsgericht Ulm HRB 702233\nLöschungsankündigung\n\nSAS Verwaltungs GmbH\nGesellschaft mit beschränkter Haftung\nGingen an der Fils\n\nDas Gericht beabsichtigt, die Gesellschaft wegen Vermögenslosigkeit im Handelsregister von Amts wegen nach § 394 FamFG zu löschen. Die Frist zur Geltendmachung eines Widerspruchs gegen die beabsichtigte Löschung ist auf  einen Monat ab Veröffentlichung bestimmt."
    },
    {
      "date": "2025-07-01",
      "id": "114099",
      "original_text": "Einreichung neuer Dokumente\nBaden-Württemberg Amtsgericht Stuttgart HRB 220233\nGebr. Heller Maschinenfabrik GmbH – Nürtingen",
      "type": "Einreichung neuer Dokumente",
      "state": "Baden-Württemberg",
      "amtsgericht": "Amtsgericht Stuttgart",
      "registernummer": "HRB 220233",
      "registerart": "HRB",
      "company_name": "Gebr. Heller Maschinenfabrik GmbH",
      "company_seat": "Nürtingen",
      "details": "01.07.2025 (Bekanntmachungsdatum)\n\nBaden-Württemberg Amtsgericht Stuttgart HRB 220233\nEinreichung neuer Dokumente\n\nGebr. Heller Maschinenfabrik GmbH\nGesellschaft mit beschränkter Haftung\nNürtingen\n\nDie Gesellschaft hat am 26.06.2025 die Liste über die Zusammensetzung des Aufsichtsrats zum Handelsregister eingereicht."
    },
    {
      "date": "2025-07-01",
      "id": "114100",
      "original_text": "Sonstige Registerbekanntmachung\nSchleswig-Holstein Amtsgericht Lübeck HRB 14848\nRay Germany GmbH – Bad Schwartau",
      "type": "Sonstige Registerbekanntmachung",
      "state": "Schleswig-Holstein",
      "amtsgericht": "Amtsgericht Lübeck",
      "registernummer": "HRB 14848",
      "registerart": "HRB",
      "company_name": "Ray Germany GmbH",
      "company_seat": "Bad Schwartau",
      "details": "01.07.2025 (Bekanntmachungsdatum)\n\nSchleswig-Holstein Amtsgericht Lübeck HRB 14848\nSonstige Registerbekanntmachung\n\nRay Germany GmbH\nGesellschaft mit beschränkter Haftung\nBad Schwartau\n\nAls nicht eingetragen wird veröffentlicht:\nAmtsgericht Lübeck, Am Burgfeld 7, 23568 Lübeck\n\nHerr\nSergey Andreev-Dikiy\nzurzeit unbekannten Aufenthalts\n\nDatum: 25.06.2025\n\nSehr geehrter Herr Andreev-Dikiy,\n\nin der Handelsregistersache der\n\nRay Germany GmbH\n\nergeben sich aus den mir vorliegenden Unterlagen Anhaltspunkte dafür, dass die Gesellschaft, als deren Geschäftsführer Sie noch eingetragen sind, vermögenslos ist:\n\nSchreiben des Finanzamtes Lübeck vom 03.04.2025 sowie Schreiben vom Gewerbeamt vom 04.03.2025\n\nIch beabsichtige daher, die Gesellschaft wegen Vermögenslosigkeit gemäß § 394 FamFG zu löschen.\n\nIch bestimme eine Frist von einem Monat zur Geltendmachung eines Widerspruchs gegen die Löschung, § 394 Abs. 2 S. 1 FamFG.\n\nWeiter bitte ich Sie, mir binnen derselben Frist mitzuteilen, ob die genannte Gesellschaft noch Vermögen hat, ggf. welche Vermögensgegenstände sie besitzt, ob die Gesellschaft noch Partei eines noch nicht rechtskräftig abgeschlossenen Rechtsstreits ist oder ob sonst noch eine Abwicklung stattfindet.\n\nNach Fristablauf ohne Widerspruch von Ihnen oder anderer Seite wird die Gesellschaft gelöscht.\n\nMit freundlichen Grüßen\n\nWolski,\nDipl.-Rechtspflegerin (FH)"
    },
    {
      "date": "2025-07-01",
      "id": "114101",
      "original_text": "Löschungsankündigung\nSchleswig-Holstein Amtsgericht Lübeck HRB 14848\nRay Germany GmbH – Bad Schwartau",
      "type": "Löschungsankündigung",
      "state": "Schleswig-Holstein",
      "amtsgericht": "Amtsgericht Lübeck",
      "registernummer": "HRB 14848",
      "registerart": "HRB",
      "company_name": "Ray Germany GmbH",
      "company_seat": "Bad Schwartau",
      "details": "01.07.2025 (Bekanntmachungsdatum)\n\nSchleswig-Holstein Amtsgericht Lübeck HRB 14848\nLöschungsankündigung\n\nRay Germany GmbH\nGesellschaft mit beschränkter Haftung\nBad Schwartau\n\nEs ist die Löschung der nachstehenden Gesellschaft wegen Vermögenslosigkeit gemäß § 394 FamFG beabsichtigt. Widerspruchsfrist: 1 Monat."
    },
    {
      "date": "2025-07-01",
      "id": "114102",
      "original_text": "Registerbekanntmachung nach dem Umwandlungsgesetz\nMecklenburg-Vorpommern Amtsgericht Neubrandenburg VR 1\nBehindertenverband Neubrandenburg e. V. – Neubrandenburg",
      "type": "Registerbekanntmachung nach dem Umwandlungsgesetz",
      "state": "Mecklenburg-Vorpommern",
      "amtsgericht": "Amtsgericht Neubrandenburg",
      "registernummer": "VR 1",
      "registerart": "VR",
      "company_name": "Behindertenverband Neubrandenburg e. V.",
      "company_seat": "Neubrandenburg",
      "details": "01.07.2025 (Bekanntmachungsdatum)\n\nMecklenburg-Vorpommern Amtsgericht Neubrandenburg VR 1\nRegisterbekanntmachung nach dem Umwandlungsgesetz 01.07.2025 (Eintragungsdatum)\n\nBehindertenverband Neubrandenburg e. V.\neingetragener Verein\nNeubrandenburg\n\nAls nicht eingetragen wird veröffentlicht: Den Gläubigern der an der Verschmelzung beteiligten Rechtsträger ist, wenn sie binnen sechs Monaten nach dem Tag, an dem die Eintragung der Verschmelzung in das Register des Sitzes desjenigen Rechtsträgers, dessen Gläubiger sie sind, nach § 19 Abs. 3 UmwG als bekannt gemacht gilt,\nihren Anspruch nach Grund und Höhe in Textform anmelden, Sicherheit zu leisten, soweit sie nicht Befriedigung verlangen können. Dieses Recht steht den Gläubigern jedoch nur zu, wenn sie glaubhaft machen, dass durch die Verschmelzung die Erfüllung der Forderung gefährdet wird."
    },
    {
      "date": "2025-07-01",
      "id": "114103",
      "original_text": "Registerbekanntmachung nach dem Umwandlungsgesetz\nMecklenburg-Vorpommern Amtsgericht Neubrandenburg VR 753\n\"Elternverein Zwergenstübchen\" e.V. – Salow",
      "type": "Registerbekanntmachung nach dem Umwandlungsgesetz",
      "state": "Mecklenburg-Vorpommern",
      "amtsgericht": "Amtsgericht Neubrandenburg",
      "registernummer": "VR 753",
      "registerart": "VR",
      "company_name": "\"Elternverein Zwergenstübchen\" e.V.",
      "company_seat": "Salow",
      "details": "01.07.2025 (Bekanntmachungsdatum)\n\nMecklenburg-Vorpommern Amtsgericht Neubrandenburg VR 753\nRegisterbekanntmachung nach dem Umwandlungsgesetz 01.07.2025 (Eintragungsdatum)\n\n\"Elternverein Zwergenstübchen\" e.V.\neingetragener Verein\nSalow\n\nAls nicht eingetragen wird veröffentlicht: Den Gläubigern der an der Verschmelzung beteiligten Rechtsträger ist, wenn sie binnen sechs Monaten nach dem Tag, an dem die Eintragung der Verschmelzung in das Register des Sitzes desjenigen Rechtsträgers, dessen Gläubiger sie sind, nach § 19 Abs. 3 UmwG als bekannt gemacht gilt,\nihren Anspruch nach Grund und Höhe in Textform anmelden, Sicherheit zu leisten, soweit sie nicht Befriedigung verlangen können. Dieses Recht steht den Gläubigern jedoch nur zu, wenn sie glaubhaft machen, dass durch die Verschmelzung die Erfüllung der Forderung gefährdet wird."
    },
    {
      "date": "2025-07-01",
      "id": "114104",
      "original_text": "Registerbekanntmachung nach dem Umwandlungsgesetz\nBerlin Amtsgericht Berlin (Charlottenburg) HRB 272629\nDL aktives Liquiditätsmanagement GmbH – Berlin",
      "type": "Registerbekanntmachung nach dem Umwandlungsgesetz",
      "state": "Berlin",
      "amtsgericht": "Amtsgericht Berlin (Charlottenburg)",
      "registernummer": "HRB 272629",
      "registerart": "HRB",
      "company_name": "DL aktives Liquiditätsmanagement GmbH",
      "company_seat": "Berlin",
      "details": "01.07.2025 (Bekanntmachungsdatum)\n\nBerlin Amtsgericht Berlin (Charlottenburg) HRB 272629\nRegisterbekanntmachung nach dem Umwandlungsgesetz 30.06.2025 (Eintragungsdatum)\n\nDL aktives Liquiditätsmanagement GmbH\nGesellschaft mit beschränkter Haftung\nBerlin\n\nZu Eintragungsnummer 2 vom 30.06.2025 wird als nicht eingetragen veröffentlicht: Den Gläubigern ist, wenn sie binnen sechs Monaten nach dem Tag, an dem die Eintragung der Umwandlung als bekannt gemacht gilt, ihren Anspruch nach Grund und Höhe schriftlich anmelden, Sicherheit zu leisten, soweit sie nicht Befriedigung verlangen können. Dieses Recht steht den Gläubigern jedoch nur zu, wenn sie glaubhaft machen, dass durch die Umwandlung die Erfüllung ihrer Forderung gefährdet wird. Das Recht, Sicherheitsleistung zu verlangen, steht Gläubigern nicht zu, die im Falle der Insolvenz ein Recht auf vorzugsweise Befriedigung aus einer Deckungsmasse haben, die nach gesetzlicher Vorschrift zu ihrem Schutz errichtet und staatlich überwacht ist."
    },
    {
      "date": "2025-07-01",
      "id": "114105",
      "original_text": "Einreichung neuer Dokumente\nMecklenburg-Vorpommern Amtsgericht Stralsund HRB 2261\nWärmeversorgung Wolgast GmbH – Wolgast",
      "type": "Einreichung neuer Dokumente",
      "state": "Mecklenburg-Vorpommern",
      "amtsgericht": "Amtsgericht Stralsund",
      "registernummer": "HRB 2261",
      "registerart": "HRB",
      "company_name": "Wärmeversorgung Wolgast GmbH",
      "company_seat": "Wolgast",
      "details": "01.07.2025 (Bekanntmachungsdatum)\n\nMecklenburg-Vorpommern Amtsgericht Stralsund HRB 2261\nEinreichung neuer Dokumente\n\nWärmeversorgung Wolgast GmbH\nGesellschaft mit beschränkter Haftung\nWolgast\n\nEine Liste der Mitglieder des Aufsichtsrats ist zum Handelsregister eingereicht worden."
    },
    {
      "date": "2025-07-01",
      "id": "114106",
      "original_text": "Einreichung neuer Dokumente\nBaden-Württemberg Amtsgericht Mannheim HRB 338007\nHeidelberger Beteiligungsholding AG – Heidelberg",
      "type": "Einreichung neuer Dokumente",
      "state": "Baden-Württemberg",
      "amtsgericht": "Amtsgericht Mannheim",
      "registernummer": "HRB 338007",
      "registerart": "HRB",
      "company_name": "Heidelberger Beteiligungsholding AG",
      "company_seat": "Heidelberg",
      "details": "01.07.2025 (Bekanntmachungsdatum)\n\nBaden-Württemberg Amtsgericht Mannheim HRB 338007\nEinreichung neuer Dokumente\n\nHeidelberger Beteiligungsholding AG\nAktiengesellschaft\nHeidelberg\n\nDie Gesellschaft hat am 30.06.2025 die Liste über die Zusammensetzung des Aufsichtsrats zum Handelsregister eingereicht."
    },
    {
      "date": "2025-07-01",
      "id": "114107",
      "original_text": "Registerbekanntmachung nach dem Umwandlungsgesetz\nHamburg Amtsgericht Hamburg HRB 169004\nOpheo Solutions GmbH – Hamburg",
      "type": "Registerbekanntmachung nach dem Umwandlungsgesetz",
      "state": "Hamburg",
      "amtsgericht": "Amtsgericht Hamburg",
      "registernummer": "HRB 169004",
      "registerart": "HRB",
      "company_name": "Opheo Solutions GmbH",
      "company_seat": "Hamburg",
      "details": "01.07.2025 (Bekanntmachungsdatum)\n\nHamburg Amtsgericht Hamburg HRB 169004\nRegisterbekanntmachung nach dem Umwandlungsgesetz 30.06.2025 (Eintragungsdatum)\n\nOpheo Solutions GmbH\nGesellschaft mit beschränkter Haftung\nHamburg\n\nAls nicht eingetragen wird bekannt gemacht:\nDen Gläubigern der an der Verschmelzung beteiligten Gesellschaften ist, wenn sie binnen sechs Monaten nach dem Tag, an dem die Eintragung der Verschmelzung in das Register des Sitzes desjenigen Rechtsträgers, dessen Gläubiger sie sind, nach § 19 Absatz 3 UmwG als bekannt gemacht gilt, ihren Anspruch nach Grund und Höhe schriftlich anmelden, Sicherheit zu leisten, soweit sie nicht Befriedigung verlangen können. Dieses Recht steht den Gläubigern jedoch nur zu, wenn sie glaubhaft machen, dass durch die Verschmelzung die Erfüllung ihrer Forderung gefährdet wird."
    },
    {
      "date": "2025-07-01",
      "id": "114108",
      "original_text": "Einreichung neuer Dokumente\nBaden-Württemberg Amtsgericht Stuttgart HRB 440121\nRöchling Medical Waldachtal AG – Waldachtal",
      "type": "Einreichung neuer Dokumente",
      "state": "Baden-Württemberg",
      "amtsgericht": "Amtsgericht Stuttgart",
      "registernummer": "HRB 440121",
      "registerart": "HRB",
      "company_name": "Röchling Medical Waldachtal AG",
      "company_seat": "Waldachtal",
      "details": "01.07.2025 (Bekanntmachungsdatum)\n\nBaden-Württemberg Amtsgericht Stuttgart HRB 440121\nEinreichung neuer Dokumente\n\nRöchling Medical Waldachtal AG\nAktiengesellschaft\nWaldachtal\n\nDie Gesellschaft hat am 01.07.2025 die Liste über die Zusammensetzung des Aufsichtsrats zum Handelsregister eingereicht."
    },
    {
      "date": "2025-07-01",
      "id": "114109",
      "original_text": "Einreichung neuer Dokumente\nBaden-Württemberg Amtsgericht Stuttgart HRB 16264\nSV SparkassenVersicherung Gebäudeversicherung Aktiengesellschaft – Stuttgart",
      "type": "Einreichung neuer Dokumente",
      "state": "Baden-Württemberg",
      "amtsgericht": "Amtsgericht Stuttgart",
      "registernummer": "HRB 16264",
      "registerart": "HRB",
      "company_name": "SV SparkassenVersicherung Gebäudeversicherung Aktiengesellschaft",
      "company_seat": "Stuttgart",
      "details": "01.07.2025 (Bekanntmachungsdatum)\n\nBaden-Württemberg Amtsgericht Stuttgart HRB 16264\nEinreichung neuer Dokumente\n\nSV SparkassenVersicherung Gebäudeversicherung Aktiengesellschaft\nAktiengesellschaft\nStuttgart\n\nDie Gesellschaft hat am 30.06.2025 die Liste über die Zusammensetzung des Aufsichtsrats zum Handelsregister eingereicht."
    },
    {
      "date": "2025-07-01",
      "id": "114110",
      "original_text": "Löschungsankündigung\nSachsen Amtsgericht Dresden HRB 28201\nBeljan Energie GmbH – Arnsdorf",
      "type": "Löschungsankündigung",
      "state": "Sachsen",
      "amtsgericht": "Amtsgericht Dresden",
      "registernummer": "HRB 28201",
      "registerart": "HRB",
      "company_name": "Beljan Energie GmbH",
      "company_seat": "Arnsdorf",
      "details": "01.07.2025 (Bekanntmachungsdatum)\n\nSachsen Amtsgericht Dresden HRB 28201\nLöschungsankündigung\n\nBeljan Energie GmbH\nGesellschaft mit beschränkter Haftung\nArnsdorf\n\nDas Registergericht beabsichtigt, die im Handelsregister eingetragene Gesellschaft von Amts wegen nach § 394 FamFG zu löschen. Die Frist zu Erhebung eines Widerspruchs gegen die beabsichtigte Löschung wird auf einen Monat festgesetzt."
    },
    {
      "date": "2025-07-01",
      "id": "114111",
      "original_text": "Einreichung neuer Dokumente\nSachsen Amtsgericht Leipzig HRB 17416\nMitteldeutsche Flughafen Aktiengesellschaft – Leipzig",
      "type": "Einreichung neuer Dokumente",
      "state": "Sachsen",
      "amtsgericht": "Amtsgericht Leipzig",
      "registernummer": "HRB 17416",
      "registerart": "HRB",
      "company_name": "Mitteldeutsche Flughafen Aktiengesellschaft",
      "company_seat": "Leipzig",
      "details": "01.07.2025 (Bekanntmachungsdatum)\n\nSachsen Amtsgericht Leipzig HRB 17416\nEinreichung neuer Dokumente\n\nMitteldeutsche Flughafen Aktiengesellschaft\nAktiengesellschaft\nLeipzig\n\nAm 04.06.2025 wurde beim Handelsregister des Amtsgerichts Leipzig die Liste der Mitglieder des Aufsichtsrats gemäß § 106 AktG eingereicht."
    },
    {
      "date": "2025-07-01",
      "id": "114112",
      "original_text": "Löschungsankündigung\nSachsen Amtsgericht Dresden HRB 17076\nAktiv Solarstrom GmbH – Radebeul",
      "type": "Löschungsankündigung",
      "state": "Sachsen",
      "amtsgericht": "Amtsgericht Dresden",
      "registernummer": "HRB 17076",
      "registerart": "HRB",
      "company_name": "Aktiv Solarstrom GmbH",
      "company_seat": "Radebeul",
      "details": "01.07.2025 (Bekanntmachungsdatum)\n\nSachsen Amtsgericht Dresden HRB 17076\nLöschungsankündigung\n\nAktiv Solarstrom GmbH\nGesellschaft mit beschränkter Haftung\nRadebeul\n\nDas Registergericht beabsichtigt, die im Handelsregister eingetragene Gesellschaft von Amts wegen nach § 394 FamFG zu löschen. Die Frist zu Erhebung eines Widerspruchs gegen die beabsichtigte Löschung wird auf einen Monat festgesetzt."
    },
    {
      "date": "2025-07-01",
      "id": "114113",
      "original_text": "Löschungsankündigung\nSachsen Amtsgericht Chemnitz HRB 26576\nMANTASTIC SixxPaxx GmbH – Bad Brambach",
      "type": "Löschungsankündigung",
      "state": "Sachsen",
      "amtsgericht": "Amtsgericht Chemnitz",
      "registernummer": "HRB 26576",
      "registerart": "HRB",
      "company_name": "MANTASTIC SixxPaxx GmbH",
      "company_seat": "Bad Brambach",
      "details": "01.07.2025 (Bekanntmachungsdatum)\n\nSachsen Amtsgericht Chemnitz HRB 26576\nLöschungsankündigung 01.07.2025 (Eintragungsdatum)\n\nMANTASTIC SixxPaxx GmbH\nGesellschaft mit beschränkter Haftung\nBad Brambach\n\nDas Registergericht beabsichtigt, die im Handelsregister eingetragene Gesellschaft von Amts wegen nach § 394 FamFG zu löschen. Die Frist zu Erhebung eines Widerspruchs gegen die beabsichtigte Löschung wird auf einen Monat festgesetzt."
    },
    {
      "date": "2025-07-01",
      "id": "114114",
      "original_text": "Löschungsankündigung\nSachsen Amtsgericht Dresden HRB 33378\nKypa GmbH – Großröhrsdorf",
      "type": "Löschungsankündigung",
      "state": "Sachsen",
      "amtsgericht": "Amtsgericht Dresden",
      "registernummer": "HRB 33378",
      "registerart": "HRB",
      "company_name": "Kypa GmbH",
      "company_seat": "Großröhrsdorf",
      "details": "01.07.2025 (Bekanntmachungsdatum)\n\nSachsen Amtsgericht Dresden HRB 33378\nLöschungsankündigung\n\nKypa GmbH\nGesellschaft mit beschränkter Haftung\nGroßröhrsdorf\n\nDas Registergericht beabsichtigt, die im Handelsregister eingetragene Gesellschaft von Amts wegen nach § 394 FamFG zu löschen. Die Frist zu Erhebung eines Widerspruchs gegen die beabsichtigte Löschung wird auf einen Monat festgesetzt."
    },
    {
      "date": "2025-07-01",
      "id": "114115",
      "original_text": "Löschungsankündigung\nSachsen Amtsgericht Dresden HRB 42564\nLaccery Deutschland GmbH – Dresden",
      "type": "Löschungsankündigung",
      "state": "Sachsen",
      "amtsgericht": "Amtsgericht Dresden",
      "registernummer": "HRB 42564",
      "registerart": "HRB",
      "company_name": "Laccery Deutschland GmbH",
      "company_seat": "Dresden",
      "details": "01.07.2025 (Bekanntmachungsdatum)\n\nSachsen Amtsgericht Dresden HRB 42564\nLöschungsankündigung\n\nLaccery Deutschland GmbH\nGesellschaft mit beschränkter Haftung\nDresden\n\nDas Registergericht beabsichtigt, die im Handelsregister eingetragene Gesellschaft von Amts wegen nach § 394 FamFG zu löschen. Die Frist zu Erhebung eines Widerspruchs gegen die beabsichtigte Löschung wird auf einen Monat festgesetzt."
    },
    {
      "date": "2025-07-01",
      "id": "114116",
      "original_text": "Löschungsankündigung\nSachsen Amtsgericht Dresden HRB 41304\nPMT Produkt-, Marketing- & Technologietransfer GmbH – Vierkirchen",
      "type": "Löschungsankündigung",
      "state": "Sachsen",
      "amtsgericht": "Amtsgericht Dresden",
      "registernummer": "HRB 41304",
      "registerart": "HRB",
      "company_name": "PMT Produkt-, Marketing- & Technologietransfer GmbH",
      "company_seat": "Vierkirchen",
      "details": "01.07.2025 (Bekanntmachungsdatum)\n\nSachsen Amtsgericht Dresden HRB 41304\nLöschungsankündigung\n\nPMT Produkt-, Marketing- & Technologietransfer GmbH\nGesellschaft mit beschränkter Haftung\nVierkirchen\n\nDas Registergericht beabsichtigt, die im Handelsregister eingetragene Gesellschaft von Amts wegen nach § 394 FamFG zu löschen. Die Frist zu Erhebung eines Widerspruchs gegen die beabsichtigte Löschung wird auf einen Monat festgesetzt."
    },
    {
      "date": "2025-07-01",
      "id": "114117",
      "original_text": "Registerbekanntmachung nach dem Umwandlungsgesetz\nNiedersachsen Amtsgericht Hannover HRB 59424\nContinental Automotive GmbH – Hannover",
      "type": "Registerbekanntmachung nach dem Umwandlungsgesetz",
      "state": "Niedersachsen",
      "amtsgericht": "Amtsgericht Hannover",
      "registernummer": "HRB 59424",
      "registerart": "HRB",
      "company_name": "Continental Automotive GmbH",
      "company_seat": "Hannover",
      "details": "01.07.2025 (Bekanntmachungsdatum)\n\nNiedersachsen Amtsgericht Hannover HRB 59424\nRegisterbekanntmachung nach dem Umwandlungsgesetz 01.07.2025 (Eintragungsdatum)\n\nContinental Automotive GmbH\nGesellschaft mit beschränkter Haftung\nHannover\n\nDen Gläubigern der an der Verschmelzung beteiligten Rechtsträger ist, wenn sie binnen sechs Monaten nach dem Tag, an dem die Eintragung der Verschmelzung in das Register des Sitzes desjenigen Rechtsträgers, dessen Gläubiger sie sind, nach § 19  Abs.  3 UmwG als bekannt gemacht gilt, ihren Anspruch nach Grund und Höhe schriftlich anmelden, Sicherheit zu leisten, soweit sie nicht Befriedigung verlangen können. Dieses Recht steht den Gläubigern jedoch nur zu, wenn sie glaubhaft machen, dass durch die Verschmelzung die Erfüllung der Forderung gefährdet wird."
    },
    {
      "date": "2025-07-01",
      "id": "114118",
      "original_text": "Löschungsankündigung\nNiedersachsen Amtsgericht Hannover HRB 225202\nJan GmbH – Hannover",
      "type": "Löschungsankündigung",
      "state": "Niedersachsen",
      "amtsgericht": "Amtsgericht Hannover",
      "registernummer": "HRB 225202",
      "registerart": "HRB",
      "company_name": "Jan GmbH",
      "company_seat": "Hannover",
      "details": "01.07.2025 (Bekanntmachungsdatum)\n\nNiedersachsen Amtsgericht Hannover HRB 225202\nLöschungsankündigung\n\nJan GmbH\nGesellschaft mit beschränkter Haftung\nHannover\n\nDas Registergericht beabsichtigt, die Gesellschaft von Amts wegen nach § 394 FamFG zu löschen. Die Frist zur Erhebung eines Widerspruchs ist auf 1 Monat ab dieser Registerbekanntmachung festgesetzt."
    },
    {
      "date": "2025-07-01",
      "id": "114119",
      "original_text": "Registerbekanntmachung nach dem Umwandlungsgesetz\nNiedersachsen Amtsgericht Aurich HRB 200201\nÖKORENTA Invest GmbH – Aurich",
      "type": "Registerbekanntmachung nach dem Umwandlungsgesetz",
      "state": "Niedersachsen",
      "amtsgericht": "Amtsgericht Aurich",
      "registernummer": "HRB 200201",
      "registerart": "HRB",
      "company_name": "ÖKORENTA Invest GmbH",
      "company_seat": "Aurich",
      "details": "01.07.2025 (Bekanntmachungsdatum)\n\nNiedersachsen Amtsgericht Aurich HRB 200201\nRegisterbekanntmachung nach dem Umwandlungsgesetz 01.07.2025 (Eintragungsdatum)\n\nÖKORENTA Invest GmbH\nGesellschaft mit beschränkter Haftung\nAurich\n\nDen Gläubigern des formwechselnden Rechtsträgers ist, wenn sie binnen sechs Monaten nach dem Tag, an dem die Eintragung der Formwechsels nach § 201 UmwG als bekannt gemacht gilt, ihren Anspruch nach Grund und Höhe schriftlich anmelden, Sicherheit zu leisten, soweit sie nicht Befriedigung verlangen können. Dieses Recht steht den Gläubigern jedoch nur zu, wenn sie glaubhaft machen, dass durch die formwechselnde Umwandlung die Erfüllung der Forderung gefährdet wird."
    },
    {
      "date": "2025-07-01",
      "id": "114120",
      "original_text": "Einreichung neuer Dokumente\nNiedersachsen Amtsgericht Hildesheim HRB 203709\nConsulting Team Holding Aktiengesellschaft – Hildesheim",
      "type": "Einreichung neuer Dokumente",
      "state": "Niedersachsen",
      "amtsgericht": "Amtsgericht Hildesheim",
      "registernummer": "HRB 203709",
      "registerart": "HRB",
      "company_name": "Consulting Team Holding Aktiengesellschaft",
      "company_seat": "Hildesheim",
      "details": "01.07.2025 (Bekanntmachungsdatum)\n\nNiedersachsen Amtsgericht Hildesheim HRB 203709\nEinreichung neuer Dokumente\n\nConsulting Team Holding Aktiengesellschaft\nAktiengesellschaft\nHildesheim\n\nDie Liste der Mitglieder des Aufsichtsrats wurde beim Registergericht eingereicht."
    },
    {
      "date": "2025-07-01",
      "id": "114121",
      "original_text": "Registerbekanntmachung nach dem Umwandlungsgesetz\nNiedersachsen Amtsgericht Hildesheim HRA 100011 früher Amtsgericht Gifhorn\nSchulz-Hausbrandt GmbH & Co. KG – Wittingen",
      "type": "Registerbekanntmachung nach dem Umwandlungsgesetz",
      "state": "Niedersachsen",
      "amtsgericht": "Amtsgericht Hildesheim",
      "registernummer": "HRA 100011",
      "registerart": "HRA",
      "company_name": "Schulz-Hausbrandt GmbH & Co. KG",
      "company_seat": "Wittingen",
      "former_amtsgericht": "Gifhorn",
      "details": "01.07.2025 (Bekanntmachungsdatum)\n\nNiedersachsen Amtsgericht Hildesheim HRA 100011 früher Amtsgericht Gifhorn\nRegisterbekanntmachung nach dem Umwandlungsgesetz 01.07.2025 (Eintragungsdatum)\n\nSchulz-Hausbrandt GmbH & Co. KG\nKommanditgesellschaft\nWittingen\n\nDen Gläubigern der an der Verschmelzung beteiligten Rechtsträger ist, wenn sie binnen sechs Monaten nach dem Tag, an dem die Eintragung der Verschmelzung in das Register des Sitzes desjenigen Rechtsträgers, dessen Gläubiger sie sind, nach § 19  Abs.  3 UmwG als bekannt gemacht gilt, ihren Anspruch nach Grund und Höhe schriftlich anmelden, Sicherheit zu leisten, soweit sie nicht Befriedigung verlangen können. Dieses Recht steht den Gläubigern jedoch nur zu, wenn sie glaubhaft machen, dass durch die Verschmelzung die Erfüllung der Forderung gefährdet wird."
    },
    {
      "date": "2025-07-01",
      "id": "114122",
      "original_text": "Registerbekanntmachung nach dem Umwandlungsgesetz\nNiedersachsen Amtsgericht Osnabrück HRB 19165\nGO-Bau GmbH – Wallenhorst",
      "type": "Registerbekanntmachung nach dem Umwandlungsgesetz",
      "state": "Niedersachsen",
      "amtsgericht": "Amtsgericht Osnabrück",
      "registernummer": "HRB 19165",
      "registerart": "HRB",
      "company_name": "GO-Bau GmbH",
      "company_seat": "Wallenhorst",
      "details": "01.07.2025 (Bekanntmachungsdatum)\n\nNiedersachsen Amtsgericht Osnabrück HRB 19165\nRegisterbekanntmachung nach dem Umwandlungsgesetz 01.07.2025 (Eintragungsdatum)\n\nGO-Bau GmbH\nGesellschaft mit beschränkter Haftung\nWallenhorst\n\nDen Gläubigern der an der Verschmelzung beteiligten Rechtsträger ist, wenn sie binnen sechs Monaten nach dem Tag, an dem die Eintragung der Verschmelzung in das Register des Sitzes desjenigen Rechtsträgers, dessen Gläubiger sie sind, nach § 19  Abs.  3 UmwG als bekannt gemacht gilt, ihren Anspruch nach Grund und Höhe schriftlich anmelden, Sicherheit zu leisten, soweit sie nicht Befriedigung verlangen können. Dieses Recht steht den Gläubigern jedoch nur zu, wenn sie glaubhaft machen, dass durch die Verschmelzung die Erfüllung der Forderung gefährdet wird."
    },
    {
      "date": "2025-07-01",
      "id": "114123",
      "original_text": "Löschungsankündigung\nNiedersachsen Amtsgericht Aurich HRA 200734\nMS \"Jannie C\" UG (haftungsbeschränkt) & Co. KG – Leer (Ostfriesland)",
      "type": "Löschungsankündigung",
      "state": "Niedersachsen",
      "amtsgericht": "Amtsgericht Aurich",
      "registernummer": "HRA 200734",
      "registerart": "HRA",
      "company_name": "MS \"Jannie C\" UG (haftungsbeschränkt) & Co. KG",
      "company_seat": "Leer (Ostfriesland)",
      "details": "01.07.2025 (Bekanntmachungsdatum)\n\nNiedersachsen Amtsgericht Aurich HRA 200734\nLöschungsankündigung 01.07.2025 (Eintragungsdatum)\n\nMS \"Jannie C\" UG (haftungsbeschränkt) & Co. KG\nKommanditgesellschaft\nLeer (Ostfriesland)\n\nDas Registergericht beabsichtigt, die Firma von Amts wegen nach § 395 FamFG zu löschen. Die Frist zur Erhebung eines Widerspruchs ist auf 1 Monat ab dieser Registerbekanntmachung festgesetzt."
    },
    {
      "date": "2025-07-01",
      "id": "114124",
      "original_text": "Registerbekanntmachung nach dem Umwandlungsgesetz\nNiedersachsen Amtsgericht Hannover HRB 3527\nContinental Aktiengesellschaft – Hannover",
      "type": "Registerbekanntmachung nach dem Umwandlungsgesetz",
      "state": "Niedersachsen",
      "amtsgericht": "Amtsgericht Hannover",
      "registernummer": "HRB 3527",
      "registerart": "HRB",
      "company_name": "Continental Aktiengesellschaft",
      "company_seat": "Hannover",
      "details": "01.07.2025 (Bekanntmachungsdatum)\n\nNiedersachsen Amtsgericht Hannover HRB 3527\nRegisterbekanntmachung nach dem Umwandlungsgesetz 01.07.2025 (Eintragungsdatum)\n\nContinental Aktiengesellschaft\nAktiengesellschaft\nHannover\n\nDen Gläubigern der an der Verschmelzung beteiligten Rechtsträger ist, wenn sie binnen sechs Monaten nach dem Tag, an dem die Eintragung der Verschmelzung in das Register des Sitzes desjenigen Rechtsträgers, dessen Gläubiger sie sind, nach § 19  Abs.  3 UmwG als bekannt gemacht gilt, ihren Anspruch nach Grund und Höhe schriftlich anmelden, Sicherheit zu leisten, soweit sie nicht Befriedigung verlangen können. Dieses Recht steht den Gläubigern jedoch nur zu, wenn sie glaubhaft machen, dass durch die Verschmelzung die Erfüllung der Forderung gefährdet wird."
    },
    {
      "date": "2025-07-01",
      "id": "114125",
      "original_text": "Löschungsankündigung\nNiedersachsen Amtsgericht Aurich HRB 203123\nDeBoTek GmbH – Ihlow/Riepe",
      "type": "Löschungsankündigung",
      "state": "Niedersachsen",
      "amtsgericht": "Amtsgericht Aurich",
      "registernummer": "HRB 203123",
      "registerart": "HRB",
      "company_name": "DeBoTek GmbH",
      "company_seat": "Ihlow/Riepe",
      "details": "01.07.2025 (Bekanntmachungsdatum)\n\nNiedersachsen Amtsgericht Aurich HRB 203123\nLöschungsankündigung\n\nDeBoTek GmbH\nGesellschaft mit beschränkter Haftung\nIhlow/Riepe\n\nDas Registergericht beabsichtigt, die Gesellschaft von Amts wegen nach § 394 FamFG zu löschen. Die Frist zur Erhebung eines Widerspruchs ist auf 1 Monat ab dieser Registerbekanntmachung festgesetzt."
    },
    {
      "date": "2025-07-01",
      "id": "114126",
      "original_text": "Löschungsankündigung\nNiedersachsen Amtsgericht Hannover HRB 208735\nG & G Rethen GmbH Steuerberatungsgesellschaft – Laatzen",
      "type": "Löschungsankündigung",
      "state": "Niedersachsen",
      "amtsgericht": "Amtsgericht Hannover",
      "registernummer": "HRB 208735",
      "registerart": "HRB",
      "company_name": "G & G Rethen GmbH Steuerberatungsgesellschaft",
      "company_seat": "Laatzen",
      "details": "01.07.2025 (Bekanntmachungsdatum)\n\nNiedersachsen Amtsgericht Hannover HRB 208735\nLöschungsankündigung\n\nG & G Rethen GmbH Steuerberatungsgesellschaft\nGesellschaft mit beschränkter Haftung\nLaatzen\n\nDas Registergericht beabsichtigt, die Gesellschaft von Amts wegen nach § 394 FamFG zu löschen. Die Frist zur Erhebung eines Widerspruchs ist auf 1 Monat ab dieser Registerbekanntmachung festgesetzt."
    },
    {
      "date": "2025-07-01",
      "id": "114127",
      "original_text": "Löschungsankündigung\nNiedersachsen Amtsgericht Lüneburg HRB 209892\nR & M GmbH – Undeloh",
      "type": "Löschungsankündigung",
      "state": "Niedersachsen",
      "amtsgericht": "Amtsgericht Lüneburg",
      "registernummer": "HRB 209892",
      "registerart": "HRB",
      "company_name": "R & M GmbH",
      "company_seat": "Undeloh",
      "details": "01.07.2025 (Bekanntmachungsdatum)\n\nNiedersachsen Amtsgericht Lüneburg HRB 209892\nLöschungsankündigung\n\nR & M GmbH\nGesellschaft mit beschränkter Haftung\nUndeloh\n\nDas Registergericht beabsichtigt, die Gesellschaft von Amts wegen nach § 394 FamFG zu löschen. Die Frist zur Erhebung eines Widerspruchs ist auf 1 Monat ab dieser Registerbekanntmachung festgesetzt."
    },
    {
      "date": "2025-07-01",
      "id": "114128",
      "original_text": "Registerbekanntmachung nach dem Umwandlungsgesetz\nNiedersachsen Amtsgericht Osnabrück HRB 215542\nWELLER Premium GmbH – Osnabrück",
      "type": "Registerbekanntmachung nach dem Umwandlungsgesetz",
      "state": "Niedersachsen",
      "amtsgericht": "Amtsgericht Osnabrück",
      "registernummer": "HRB 215542",
      "registerart": "HRB",
      "company_name": "WELLER Premium GmbH",
      "company_seat": "Osnabrück",
      "details": "01.07.2025 (Bekanntmachungsdatum)\n\nNiedersachsen Amtsgericht Osnabrück HRB 215542\nRegisterbekanntmachung nach dem Umwandlungsgesetz 01.07.2025 (Eintragungsdatum)\n\nWELLER Premium GmbH\nGesellschaft mit beschränkter Haftung\nOsnabrück\n\nDen Gläubigern der an der Verschmelzung beteiligten Rechtsträger ist, wenn sie binnen sechs Monaten nach dem Tag, an dem die Eintragung der Verschmelzung in das Register des Sitzes desjenigen Rechtsträgers, dessen Gläubiger sie sind, nach § 19  Abs.  3 UmwG als bekannt gemacht gilt, ihren Anspruch nach Grund und Höhe schriftlich anmelden, Sicherheit zu leisten, soweit sie nicht Befriedigung verlangen können. Dieses Recht steht den Gläubigern jedoch nur zu, wenn sie glaubhaft machen, dass durch die Verschmelzung die Erfüllung der Forderung gefährdet wird."
    },
    {
      "date": "2025-07-01",
      "id": "114129",
      "original_text": "Registerbekanntmachung nach dem Umwandlungsgesetz\nNiedersachsen Amtsgericht Braunschweig HRB 1819\nVolkswagen Bank Gesellschaft mit beschränkter Haftung – Braunschweig",
      "type": "Registerbekanntmachung nach dem Umwandlungsgesetz",
      "state": "Niedersachsen",
      "amtsgericht": "Amtsgericht Braunschweig",
      "registernummer": "HRB 1819",
      "registerart": "HRB",
      "company_name": "Volkswagen Bank Gesellschaft mit beschränkter Haftung",
      "company_seat": "Braunschweig",
      "details": "01.07.2025 (Bekanntmachungsdatum)\n\nNiedersachsen Amtsgericht Braunschweig HRB 1819\nRegisterbekanntmachung nach dem Umwandlungsgesetz 01.07.2025 (Eintragungsdatum)\n\nVolkswagen Bank Gesellschaft mit beschränkter Haftung\nGesellschaft mit beschränkter Haftung\nBraunschweig\n\nDen Gläubigern der an der grenzüberschreitenden Verschmelzung beteiligten übernehmenden Rechtsträger ist, wenn sie binnen sechs Monaten nach dem Tag, an dem die Eintragung der Verschmelzung in das Register des Sitzes desjenigen Rechtsträgers, dessen Gläubiger sie sind, nach § 19 Absatz 3 UmwG als bekanntgemacht gilt, ihren Anspruch nach Grund und Höhe schriftlich anmelden, Sicherheit zu leisten, soweit sie nicht Befriedigung verlangen können.\n\nDieses Recht steht den Gläubigern jedoch nur zu, wenn sie glaubhaft machen, dass durch die Verschmelzung die Erfüllung ihrer Forderung gefährdet wird."
    },
    {
      "date": "2025-07-01",
      "id": "114130",
      "original_text": "Registerbekanntmachung nach dem Umwandlungsgesetz\nRheinland-Pfalz Amtsgericht Kaiserslautern HRB 33852\nSchneider + Nölke - mp2 Unternehmergesellschaft (haftungsbeschränkt) – Altenglan",
      "type": "Registerbekanntmachung nach dem Umwandlungsgesetz",
      "state": "Rheinland-Pfalz",
      "amtsgericht": "Amtsgericht Kaiserslautern",
      "registernummer": "HRB 33852",
      "registerart": "HRB",
      "company_name": "Schneider + Nölke - mp2 Unternehmergesellschaft (haftungsbeschränkt)",
      "company_seat": "Altenglan",
      "details": "01.07.2025 (Bekanntmachungsdatum)\n\nRheinland-Pfalz Amtsgericht Kaiserslautern HRB 33852\nRegisterbekanntmachung nach dem Umwandlungsgesetz 01.07.2025 (Eintragungsdatum)\n\nSchneider + Nölke - mp2 Unternehmergesellschaft (haftungsbeschränkt)\nGesellschaft mit beschränkter Haftung\nAltenglan\n\nAls nicht eingetragen wird veröffentlicht: Den Gläubigern der an der Verschmelzung beteiligten Rechtsträger ist, wenn sie binnen sechs Monaten nach dem Tag, an dem die Eintragung der Verschmelzung in das Register des Sitzes desjenigen Rechtsträgers,dessen Gläubiger sie sind, nach § 19 Abs. 3 UmwG als bekannt gemacht gilt, ihren Anspruch nach Grund und Höhe schriftlich anmelden, Sicherheit zu leisten, soweit sie nicht Befriedigung verlangen können. Dieses Recht steht den Gläubigern jedoch nur zu, wenn sie glaubhaft machen, dass durch die Verschmelzung die Erfüllung der Forderung gefährdet wird."
    },
    {
      "date": "2025-07-01",
      "id": "114131",
      "original_text": "Registerbekanntmachung nach dem Umwandlungsgesetz\nRheinland-Pfalz Amtsgericht Kaiserslautern HRB 32648\nmp2 GmbH – Altenglan",
      "type": "Registerbekanntmachung nach dem Umwandlungsgesetz",
      "state": "Rheinland-Pfalz",
      "amtsgericht": "Amtsgericht Kaiserslautern",
      "registernummer": "HRB 32648",
      "registerart": "HRB",
      "company_name": "mp2 GmbH",
      "company_seat": "Altenglan",
      "details": "01.07.2025 (Bekanntmachungsdatum)\n\nRheinland-Pfalz Amtsgericht Kaiserslautern HRB 32648\nRegisterbekanntmachung nach dem Umwandlungsgesetz 01.07.2025 (Eintragungsdatum)\n\nmp2 GmbH\nGesellschaft mit beschränkter Haftung\nAltenglan\n\nAls nicht eingetragen wird veröffentlicht: Den Gläubigern der an der Verschmelzung beteiligten Rechtsträger ist, wenn sie binnen sechs Monaten nach dem Tag, an dem die Eintragung der Verschmelzung in das Register des Sitzes desjenigen Rechtsträgers,dessen Gläubiger sie sind, nach § 19 Abs. 3 UmwG als bekannt gemacht gilt, ihren Anspruch nach Grund und Höhe schriftlich anmelden, Sicherheit zu leisten, soweit sie nicht Befriedigung verlangen können. Dieses Recht steht den Gläubigern jedoch nur zu, wenn sie glaubhaft machen, dass durch die Verschmelzung die Erfüllung der Forderung gefährdet wird."
    },
    {
      "date": "2025-07-01",
      "id": "114132",
      "original_text": "Registerbekanntmachung nach dem Umwandlungsgesetz\nRheinland-Pfalz Amtsgericht Koblenz HRB 21024\nOntex Care GmbH – Mayen",
      "type": "Registerbekanntmachung nach dem Umwandlungsgesetz",
      "state": "Rheinland-Pfalz",
      "amtsgericht": "Amtsgericht Koblenz",
      "registernummer": "HRB 21024",
      "registerart": "HRB",
      "company_name": "Ontex Care GmbH",
      "company_seat": "Mayen",
      "details": "01.07.2025 (Bekanntmachungsdatum)\n\nRheinland-Pfalz Amtsgericht Koblenz HRB 21024\nRegisterbekanntmachung nach dem Umwandlungsgesetz 01.07.2025 (Eintragungsdatum)\n\nOntex Care GmbH\nGesellschaft mit beschränkter Haftung\nMayen\n\nAls nicht eingetragen wird veröffentlicht: Den Gläubigern der an der Verschmelzung beteiligten Rechtsträger ist, wenn sie binnen sechs Monaten nach dem Tag, an dem die Eintragung der Verschmelzung in das Register des Sitzes desjenigen Rechtsträgers,dessen Gläubiger sie sind, nach § 19 Abs. 3 UmwG als bekannt gemacht gilt, ihren Anspruch nach Grund und Höhe schriftlich anmelden, Sicherheit zu leisten, soweit sie nicht Befriedigung verlangen können. Dieses Recht steht den Gläubigern jedoch nur zu, wenn sie glaubhaft machen, dass durch die Verschmelzung die Erfüllungd er Forderung gefährdet wird."
    },
    {
      "date": "2025-07-01",
      "id": "114133",
      "original_text": "Löschungsankündigung\nRheinland-Pfalz Amtsgericht Zweibrücken HRB 31379\nHüter Planungs GmbH – Pirmasens",
      "type": "Löschungsankündigung",
      "state": "Rheinland-Pfalz",
      "amtsgericht": "Amtsgericht Zweibrücken",
      "registernummer": "HRB 31379",
      "registerart": "HRB",
      "company_name": "Hüter Planungs GmbH",
      "company_seat": "Pirmasens",
      "details": "01.07.2025 (Bekanntmachungsdatum)\n\nRheinland-Pfalz Amtsgericht Zweibrücken HRB 31379\nLöschungsankündigung\n\nHüter Planungs GmbH\nGesellschaft mit beschränkter Haftung\nPirmasens\n\nDas Registergericht beabsichtigt die Gesellschaft von Amts wegen nach § 394 FamFG zu löschen. Die Frist zur Erhebung eines Widerspruchs ist auf einen Monat festgesetzt."
    },
    {
      "date": "2025-07-01",
      "id": "114134",
      "original_text": "Registerbekanntmachung nach dem Umwandlungsgesetz\nBremen Amtsgericht Bremen HRB 41599\nWitthus Glas + Bauelemente GmbH – Bremen",
      "type": "Registerbekanntmachung nach dem Umwandlungsgesetz",
      "state": "Bremen",
      "amtsgericht": "Amtsgericht Bremen",
      "registernummer": "HRB 41599",
      "registerart": "HRB",
      "company_name": "Witthus Glas + Bauelemente GmbH",
      "company_seat": "Bremen",
      "details": "01.07.2025 (Bekanntmachungsdatum)\n\nBremen Amtsgericht Bremen HRB 41599\nRegisterbekanntmachung nach dem Umwandlungsgesetz 24.06.2025 (Eintragungsdatum)\n\nWitthus Glas + Bauelemente GmbH\nGesellschaft mit beschränkter Haftung\nBremen\n\nZu Eintragungsnummer 1 vom 24.06.2025 wird als nicht eingetragen veröffentlicht: Den Gläubigern ist, wenn sie binnen sechs Monaten nach dem Tag, an dem die Eintragung der Umwandlung als bekannt gemacht gilt, ihren Anspruch nach Grund und Höhe schriftlich anmelden, Sicherheit zu leisten, soweit sie nicht Befriedigung verlangen können. Dieses Recht steht den Gläubigern jedoch nur zu, wenn sie glaubhaft machen, dass durch die Umwandlung die Erfüllung ihrer Forderung gefährdet wird. Das Recht, Sicherheitsleistung zu verlangen, steht Gläubigern nicht zu, die im Falle der Insolvenz ein Recht auf vorzugsweise Befriedigung aus einer Deckungsmasse haben, die nach gesetzlicher Vorschrift zu ihrem Schutz errichtet und staatlich überwacht ist."
    },
    {
      "date": "2025-07-01",
      "id": "114135",
      "original_text": "Registerbekanntmachung nach dem Umwandlungsgesetz\nBremen Amtsgericht Bremen HRA 30673\nWitthus Glasdecor Gerald Witthus e.K. – Bremen",
      "type": "Registerbekanntmachung nach dem Umwandlungsgesetz",
      "state": "Bremen",
      "amtsgericht": "Amtsgericht Bremen",
      "registernummer": "HRA 30673",
      "registerart": "HRA",
      "company_name": "Witthus Glasdecor Gerald Witthus e.K.",
      "company_seat": "Bremen",
      "details": "01.07.2025 (Bekanntmachungsdatum)\n\nBremen Amtsgericht Bremen HRA 30673\nRegisterbekanntmachung nach dem Umwandlungsgesetz 24.06.2025 (Eintragungsdatum)\n\nWitthus Glasdecor Gerald Witthus e.K.\nEinzelkaufmann / Einzelkauffrau\nBremen\n\nZu Eintragungsnummer 2 vom 24.06.2025 wird als nicht eingetragen veröffentlicht: Den Gläubigern ist, wenn sie binnen sechs Monaten nach dem Tag, an dem die Eintragung der Umwandlung als bekannt gemacht gilt, ihren Anspruch nach Grund und Höhe schriftlich anmelden, Sicherheit zu leisten, soweit sie nicht Befriedigung verlangen können. Dieses Recht steht den Gläubigern jedoch nur zu, wenn sie glaubhaft machen, dass durch die Umwandlung die Erfüllung ihrer Forderung gefährdet wird. Das Recht, Sicherheitsleistung zu verlangen, steht Gläubigern nicht zu, die im Falle der Insolvenz ein Recht auf vorzugsweise Befriedigung aus einer Deckungsmasse haben, die nach gesetzlicher Vorschrift zu ihrem Schutz errichtet und staatlich überwacht ist."
    },
    {
      "date": "2025-07-01",
      "id": "114136",
      "original_text": "Registerbekanntmachung nach dem Umwandlungsgesetz\nNordrhein-Westfalen Amtsgericht Lemgo HRB 4325\nEcclesia Versicherungsdienst GmbH – Detmold",
      "type": "Registerbekanntmachung nach dem Umwandlungsgesetz",
      "state": "Nordrhein-Westfalen",
      "amtsgericht": "Amtsgericht Lemgo",
      "registernummer": "HRB 4325",
      "registerart": "HRB",
      "company_name": "Ecclesia Versicherungsdienst GmbH",
      "company_seat": "Detmold",
      "details": "01.07.2025 (Bekanntmachungsdatum)\n\nNordrhein-Westfalen Amtsgericht Lemgo HRB 4325\nRegisterbekanntmachung nach dem Umwandlungsgesetz 01.07.2025 (Eintragungsdatum)\n\nEcclesia Versicherungsdienst GmbH\nGesellschaft mit beschränkter Haftung\nDetmold\n\nDen Gläubigern der an der Verschmelzung beteiligten Rechtsträger ist, wenn sie binnen sechs Monaten nach dem Tag, an dem die Eintragung der Verschmelzung in das Register des Sitzes desjenigen Rechtsträgers, dessen Gläubiger sie sind, nach § 19 Absatz 3 UmwG als bekanntgemacht gilt, ihren Anspruch nach Grund und Höhe schriftlich anmelden, Sicherheit zu leisten, soweit sie nicht Befriedigung verlangen können. Dieses Recht steht den Gläubigern jedoch nur zu, wenn sie glaubhaft machen, dass durch die Verschmelzung die Erfüllung ihrer Forderung gefährdet wird."
    },
    {
      "date": "2025-07-01",
      "id": "114137",
      "original_text": "Sonstige Registerbekanntmachung\nNordrhein-Westfalen Amtsgericht Köln HRB 105506\nHDL Hasani Trockenbau UG (haftungsbeschränkt) – Leverkusen",
      "type": "Sonstige Registerbekanntmachung",
      "state": "Nordrhein-Westfalen",
      "amtsgericht": "Amtsgericht Köln",
      "registernummer": "HRB 105506",
      "registerart": "HRB",
      "company_name": "HDL Hasani Trockenbau UG (haftungsbeschränkt)",
      "company_seat": "Leverkusen",
      "details": "01.07.2025 (Bekanntmachungsdatum)\n\nNordrhein-Westfalen Amtsgericht Köln HRB 105506\nSonstige Registerbekanntmachung 01.07.2025 (Eintragungsdatum)\n\nHDL Hasani Trockenbau UG (haftungsbeschränkt)\nGesellschaft mit beschränkter Haftung\nLeverkusen"
    },
    {
      "date": "2025-07-01",
      "id": "114138",
      "original_text": "Registerbekanntmachung nach dem Umwandlungsgesetz\nNordrhein-Westfalen Amtsgericht Bielefeld HRA 15132\nh + p hachmeister + partner GmbH & Co. KG – Bielefeld",
      "type": "Registerbekanntmachung nach dem Umwandlungsgesetz",
      "state": "Nordrhein-Westfalen",
      "amtsgericht": "Amtsgericht Bielefeld",
      "registernummer": "HRA 15132",
      "registerart": "HRA",
      "company_name": "h + p hachmeister + partner GmbH & Co. KG",
      "company_seat": "Bielefeld",
      "details": "01.07.2025 (Bekanntmachungsdatum)\n\nNordrhein-Westfalen Amtsgericht Bielefeld HRA 15132\nRegisterbekanntmachung nach dem Umwandlungsgesetz 01.07.2025 (Eintragungsdatum)\n\nh + p hachmeister + partner GmbH & Co. KG\nKommanditgesellschaft\nBielefeld\n\nDen Gläubigern der an der formwechselnden Umwandlung beteiligten Rechtsträger ist, wenn sie binnen sechs Monaten nach dem Tag, an dem die Eintragung der formwechselnden Umwandlung in das Register des Sitzes desjenigen Rechtsträgers, dessen Gläubiger sie sind, nach § 19 Absatz 3 UmwG als bekanntgemacht gilt, ihren Anspruch nach Grund und Höhe schriftlich anmelden, Sicherheit zu leisten, soweit sie nicht Befriedigung verlangen können. Dieses Recht steht den Gläubigern jedoch nur zu, wenn sie glaubhaft machen, dass durch die formwechselnden Umwandlung die Erfüllung ihrer Forderung gefährdet wird."
    },
    {
      "date": "2025-07-01",
      "id": "114139",
      "original_text": "Löschungsankündigung\nNordrhein-Westfalen Amtsgericht Neuss HRB 18185\nUnique Fit Finance & Asset GmbH – Neuss",
      "type": "Löschungsankündigung",
      "state": "Nordrhein-Westfalen",
      "amtsgericht": "Amtsgericht Neuss",
      "registernummer": "HRB 18185",
      "registerart": "HRB",
      "company_name": "Unique Fit Finance & Asset GmbH",
      "company_seat": "Neuss",
      "details": "01.07.2025 (Bekanntmachungsdatum)\n\nNordrhein-Westfalen Amtsgericht Neuss HRB 18185\nLöschungsankündigung 30.06.2025 (Eintragungsdatum)\n\nUnique Fit Finance & Asset GmbH\nGesellschaft mit beschränkter Haftung\nNeuss\n\nDas Registergericht beabsichtigt die Gesellschaft von Amts wegen nach § 394 FamFG zu löschen. Die Frist zur Erhebung eines Widerspruchs ist auf einen Monat festgesetzt. Rechtsbehelfsbelehrung: Gegen diese Verfügung können Sie Widerspruch einlegen. Der Widerspruch ist bei dem Amtsgericht Neuss - Registergericht -, Breite Str. 48, 41460 Neuss schriftlich in deutscher Sprache oder zur Niederschrift der Geschäftsstelle einzulegen. Der Widerspruch kann auch zur Niederschrift der Geschäftsstelle eines jeden Amtsgerichtes abgegeben werden. Die Einlegung ist auch durch Übertragung eines elektronischen Dokuments an die elektronische Poststelle des Gerichts möglich. Das elektronische Dokument muss für die Bearbeitung durch das Gericht geeignet und mit einer qualifizierten elektronischen Signatur der verantwortenden Person versehen sein oder von der verantwortenden Person signiert und auf einem sicheren Übermittlungsweg gemäß § 130a ZPO nach näherer Maßgabe der Verordnung über die technischen Rahmenbedingungen des elektronischen Rechtsverkehrs und über das besondere elektronische Behördenpostfach (BGBl. I, S.3803) eingereicht werden. Weitere Informationen erhalten Sie auf der Internetseite www.justiz.de. Der Widerspruch muss spätestens innerhalb der gesetzten Frist nach der schriftlichen Bekanntgabe der Verfügung bei dem Amtsgericht - Registergericht - Neuss eingegangen sein. Dies gilt auch dann, wenn der Widerspruch zur Niederschrift der Geschäftsstelle eines anderen Amtsgerichtes abgegeben wurde. Die Frist beginnt mit der schriftlichen Bekanntgabe der Verfügung. Die Bekanntgabe ist entweder durch Zustellung oder am dritten Tage nach Aufgabe zur Post bewirkt. Fällt das Ende der Frist auf einen Sonntag, einen allgemeinen Feiertag oder Sonnabend, so endet die Frist mit Ablauf des nächsten Werktages. Der Widerspruch muss die Bezeichnung der angefochtenen Verfügung sowie die Erklärung enthalten, dass Widerspruch gegen diese Verfügung eingelegt wird. Er ist zu unterzeichnen und soll begründet werden."
    },
    {
      "date": "2025-07-01",
      "id": "114140",
      "original_text": "Löschungsankündigung\nRheinland-Pfalz Amtsgericht Ludwigshafen a.Rhein (Ludwigshafen) HRB 65222\nUsta GmbH – Ludwigshafen",
      "type": "Löschungsankündigung",
      "state": "Rheinland-Pfalz",
      "amtsgericht": "Amtsgericht Ludwigshafen a.Rhein (Ludwigshafen)",
      "registernummer": "HRB 65222",
      "registerart": "HRB",
      "company_name": "Usta GmbH",
      "company_seat": "Ludwigshafen",
      "details": "01.07.2025 (Bekanntmachungsdatum)\n\nRheinland-Pfalz Amtsgericht Ludwigshafen a.Rhein (Ludwigshafen) HRB 65222\nLöschungsankündigung\n\nUsta GmbH\nGesellschaft mit beschränkter Haftung\nLudwigshafen\n\nDas Registergericht beabsichtigt die Gesellschaft von Amts wegen nach § 394 FamFG zu löschen. Die Frist zur Erhebung eines Widerspruchs ist auf einen Monat festgesetzt."
    },
    {
      "date": "2025-07-01",
      "id": "114141",
      "original_text": "Registerbekanntmachung nach dem Umwandlungsgesetz\nNordrhein-Westfalen Amtsgericht Mönchengladbach HRB 5519\nINAQUA Vertriebsgesellschaft mbH – Mönchengladbach",
      "type": "Registerbekanntmachung nach dem Umwandlungsgesetz",
      "state": "Nordrhein-Westfalen",
      "amtsgericht": "Amtsgericht Mönchengladbach",
      "registernummer": "HRB 5519",
      "registerart": "HRB",
      "company_name": "INAQUA Vertriebsgesellschaft mbH",
      "company_seat": "Mönchengladbach",
      "details": "01.07.2025 (Bekanntmachungsdatum)\n\nNordrhein-Westfalen Amtsgericht Mönchengladbach HRB 5519\nRegisterbekanntmachung nach dem Umwandlungsgesetz 01.07.2025 (Eintragungsdatum)\n\nINAQUA Vertriebsgesellschaft mbH\nGesellschaft mit beschränkter Haftung\nMönchengladbach\n\nDen Gläubigern der an der Verschmelzung beteiligten Rechtsträger ist, wenn sie binnen sechs Monaten nach dem Tag, an dem die Eintragung der Verschmelzung in das Register des Sitzes desjenigen Rechtsträgers, dessen Gläubiger sie sind, nach § 19 Absatz 3 UmwG als bekanntgemacht gilt, ihren Anspruch nach Grund und Höhe schriftlich anmelden, Sicherheit zu leisten, soweit sie nicht Befriedigung verlangen können. Dieses Recht steht den Gläubigern jedoch nur zu, wenn sie glaubhaft machen, dass durch die Verschmelzung die Erfüllung ihrer Forderung gefährdet wird."
    },
    {
      "date": "2025-07-01",
      "id": "114142",
      "original_text": "Löschungsankündigung\nNordrhein-Westfalen Amtsgericht Köln HRB 111888\nSpiegel Gerüstbau GmbH – Bergisch Gladbach",
      "type": "Löschungsankündigung",
      "state": "Nordrhein-Westfalen",
      "amtsgericht": "Amtsgericht Köln",
      "registernummer": "HRB 111888",
      "registerart": "HRB",
      "company_name": "Spiegel Gerüstbau GmbH",
      "company_seat": "Bergisch Gladbach",
      "details": "01.07.2025 (Bekanntmachungsdatum)\n\nNordrhein-Westfalen Amtsgericht Köln HRB 111888\nLöschungsankündigung\n\nSpiegel Gerüstbau GmbH\nGesellschaft mit beschränkter Haftung\nBergisch Gladbach\n\nDas Registergericht beabsichtigt die Gesellschaft von Amts wegen nach § 394 FamFG zu löschen. Die Frist zur Erhebung eines Widerspruchs ist auf einen Monat festgesetzt."
    },
    {
      "date": "2025-07-01",
      "id": "114143",
      "original_text": "Registerbekanntmachung nach dem Umwandlungsgesetz\nRheinland-Pfalz Amtsgericht Zweibrücken HRA 30808\nSchmölz Heizung - Sanitär e.K. – Erfweiler",
      "type": "Registerbekanntmachung nach dem Umwandlungsgesetz",
      "state": "Rheinland-Pfalz",
      "amtsgericht": "Amtsgericht Zweibrücken",
      "registernummer": "HRA 30808",
      "registerart": "HRA",
      "company_name": "Schmölz Heizung - Sanitär e.K.",
      "company_seat": "Erfweiler",
      "details": "01.07.2025 (Bekanntmachungsdatum)\n\nRheinland-Pfalz Amtsgericht Zweibrücken HRA 30808\nRegisterbekanntmachung nach dem Umwandlungsgesetz 01.07.2025 (Eintragungsdatum)\n\nSchmölz Heizung - Sanitär e.K.\nEinzelkaufmann / Einzelkauffrau\nErfweiler\n\nAls nicht eingetragen wird veröffentlicht: Den Gläubigern der an der Ausgliederung beteiligten Rechtsträger ist, wenn sie binnen sechs Monaten nach dem Tag, an dem die Eintragung der Ausgliederung in das Register des Sitzes desjenigen Rechtsträgers,dessen Gläubiger sie sind, nach § 19 Abs. 3 UmwG als bekannt gemacht gilt, ihren Anspruch nach Grund und Höhe schriftlich anmelden, Sicherheit zu leisten, soweit sie nicht Befriedigung verlangen können. Dieses Recht steht den Gläubigern jedoch nur zu, wenn sie glaubhaft machen, dass durch die Ausgliederung die Erfüllung der Forderung gefährdet wird."
    },
    {
      "date": "2025-07-01",
      "id": "114144",
      "original_text": "Registerbekanntmachung nach dem Umwandlungsgesetz\nNordrhein-Westfalen Amtsgericht Duisburg HRB 20855\niQbis GmbH – Mülheim an der Ruhr",
      "type": "Registerbekanntmachung nach dem Umwandlungsgesetz",
      "state": "Nordrhein-Westfalen",
      "amtsgericht": "Amtsgericht Duisburg",
      "registernummer": "HRB 20855",
      "registerart": "HRB",
      "company_name": "iQbis GmbH",
      "company_seat": "Mülheim an der Ruhr",
      "details": "01.07.2025 (Bekanntmachungsdatum)\n\nNordrhein-Westfalen Amtsgericht Duisburg HRB 20855\nRegisterbekanntmachung nach dem Umwandlungsgesetz 01.07.2025 (Eintragungsdatum)\n\niQbis GmbH\nGesellschaft mit beschränkter Haftung\nMülheim an der Ruhr\n\nDie Gesellschaft hat Gläubigern, deren Forderungen vor dieser Bekanntmachung begründet worden sind, Sicherheit zu leisten, soweit sie nicht Befriedigung verlangen können, wenn sie sich binnen sechs Monaten zu diesem Zweck melden."
    },
    {
      "date": "2025-07-01",
      "id": "114145",
      "original_text": "Registerbekanntmachung nach dem Umwandlungsgesetz\nNordrhein-Westfalen Amtsgericht Iserlohn HRA 5636\nKOSTAL Automobil Elektrik GmbH & Co. KG – Lüdenscheid",
      "type": "Registerbekanntmachung nach dem Umwandlungsgesetz",
      "state": "Nordrhein-Westfalen",
      "amtsgericht": "Amtsgericht Iserlohn",
      "registernummer": "HRA 5636",
      "registerart": "HRA",
      "company_name": "KOSTAL Automobil Elektrik GmbH & Co. KG",
      "company_seat": "Lüdenscheid",
      "details": "01.07.2025 (Bekanntmachungsdatum)\n\nNordrhein-Westfalen Amtsgericht Iserlohn HRA 5636\nRegisterbekanntmachung nach dem Umwandlungsgesetz 01.07.2025 (Eintragungsdatum)\n\nKOSTAL Automobil Elektrik GmbH & Co. KG\nKommanditgesellschaft\nLüdenscheid\n\nDen Gläubigern der an der Abspaltung beteiligten Rechtsträger ist, wenn sie binnen sechs Monaten nach dem Tag, an dem die Eintragung der Abspaltung in das Register des Sitzes desjenigen Rechtsträgers, dessen Gläubiger sie sind, nach § 19 Absatz 3 UmwG als bekanntgemacht gilt, ihren Anspruch nach Grund und Höhe schriftlich anmelden, Sicherheit zu leisten, soweit sie nicht Befriedigung verlangen können. Dieses Recht steht den Gläubigern jedoch nur zu, wenn sie glaubhaft machen, dass durch die Abspaltung die Erfüllung ihrer Forderung gefährdet wird."
    },
    {
      "date": "2025-07-01",
      "id": "114146",
      "original_text": "Sonstige Registerbekanntmachung\nNordrhein-Westfalen Amtsgericht Köln HRB 111811\nMed 360° SE – Leverkusen",
      "type": "Sonstige Registerbekanntmachung",
      "state": "Nordrhein-Westfalen",
      "amtsgericht": "Amtsgericht Köln",
      "registernummer": "HRB 111811",
      "registerart": "HRB",
      "company_name": "Med 360° SE",
      "company_seat": "Leverkusen",
      "details": "01.07.2025 (Bekanntmachungsdatum)\n\nNordrhein-Westfalen Amtsgericht Köln HRB 111811\nSonstige Registerbekanntmachung\n\nMed 360° SE\nEuropäische Aktiengesellschaft (SE)\nLeverkusen\n\nDem Registergericht ist eine Liste der Mitglieder des Aufsichtsrates eingereicht worden."
    },
    {
      "date": "2025-07-01",
      "id": "114147",
      "original_text": "Einreichung neuer Dokumente\nNordrhein-Westfalen Amtsgericht Köln HRB 30660\nSEVEN PRINCIPLES AG – Köln",
      "type": "Einreichung neuer Dokumente",
      "state": "Nordrhein-Westfalen",
      "amtsgericht": "Amtsgericht Köln",
      "registernummer": "HRB 30660",
      "registerart": "HRB",
      "company_name": "SEVEN PRINCIPLES AG",
      "company_seat": "Köln",
      "details": "01.07.2025 (Bekanntmachungsdatum)\n\nNordrhein-Westfalen Amtsgericht Köln HRB 30660\nEinreichung neuer Dokumente\n\nSEVEN PRINCIPLES AG\nAktiengesellschaft\nKöln\n\nDem Registergericht ist eine neue Liste der Mitglieder des Aufsichtsrates eingereicht worden."
    },
    {
      "date": "2025-07-01",
      "id": "114148",
      "original_text": "Löschungsankündigung\nNordrhein-Westfalen Amtsgericht Dortmund HRB 31833\nCuranobis Plus UG (haftungsbeschränkt) – Castrop-Rauxel",
      "type": "Löschungsankündigung",
      "state": "Nordrhein-Westfalen",
      "amtsgericht": "Amtsgericht Dortmund",
      "registernummer": "HRB 31833",
      "registerart": "HRB",
      "company_name": "Curanobis Plus UG (haftungsbeschränkt)",
      "company_seat": "Castrop-Rauxel",
      "details": "01.07.2025 (Bekanntmachungsdatum)\n\nNordrhein-Westfalen Amtsgericht Dortmund HRB 31833\nLöschungsankündigung\n\nCuranobis Plus UG (haftungsbeschränkt)\nGesellschaft mit beschränkter Haftung\nCastrop-Rauxel\n\nDas Registergericht beabsichtigt die Gesellschaft von Amts wegen nach § 394 FamFG zu löschen. Die Frist zur Erhebung eines Widerspruchs ist auf zwei Monate festgesetzt."
    },
    {
      "date": "2025-07-01",
      "id": "114149",
      "original_text": "Löschungsankündigung\nNordrhein-Westfalen Amtsgericht Kleve HRB 2489\nB + M Service-GmbH – Goch",
      "type": "Löschungsankündigung",
      "state": "Nordrhein-Westfalen",
      "amtsgericht": "Amtsgericht Kleve",
      "registernummer": "HRB 2489",
      "registerart": "HRB",
      "company_name": "B + M Service-GmbH",
      "company_seat": "Goch",
      "details": "01.07.2025 (Bekanntmachungsdatum)\n\nNordrhein-Westfalen Amtsgericht Kleve HRB 2489\nLöschungsankündigung\n\nB + M Service-GmbH\nGesellschaft mit beschränkter Haftung\nGoch\n\nDas Registergericht beabsichtigt die Gesellschaft von Amts wegen nach § 394 FamFG zu löschen. Die Frist zur Erhebung eines Widerspruchs ist auf einen Monat festgesetzt."
    },
    {
      "date": "2025-07-01",
      "id": "114150",
      "original_text": "Registerbekanntmachung nach dem Umwandlungsgesetz\nNordrhein-Westfalen Amtsgericht Düsseldorf HRB 47759\nQlikTech GmbH – Düsseldorf",
      "type": "Registerbekanntmachung nach dem Umwandlungsgesetz",
      "state": "Nordrhein-Westfalen",
      "amtsgericht": "Amtsgericht Düsseldorf",
      "registernummer": "HRB 47759",
      "registerart": "HRB",
      "company_name": "QlikTech GmbH",
      "company_seat": "Düsseldorf",
      "details": "01.07.2025 (Bekanntmachungsdatum)\n\nNordrhein-Westfalen Amtsgericht Düsseldorf HRB 47759\nRegisterbekanntmachung nach dem Umwandlungsgesetz 01.07.2025 (Eintragungsdatum)\n\nQlikTech GmbH\nGesellschaft mit beschränkter Haftung\nDüsseldorf\n\nDen Gläubigern der an der Verschmelzung beteiligten Rechtsträger ist, wenn sie binnen sechs Monaten nach dem Tag, an dem die Eintragung der Verschmelzung in das Register des Sitzes desjenigen Rechtsträgers, dessen Gläubiger sie sind, nach § 19 Absatz 3 UmwG als bekanntgemacht gilt, ihren Anspruch nach Grund und Höhe schriftlich anmelden, Sicherheit zu leisten, soweit sie nicht Befriedigung verlangen können. Dieses Recht steht den Gläubigern jedoch nur zu, wenn sie glaubhaft machen, dass durch die Verschmelzung die Erfüllung ihrer Forderung gefährdet wird."
    },
    {
      "date": "2025-07-01",
      "id": "114151",
      "original_text": "Registerbekanntmachung nach dem Umwandlungsgesetz\nNordrhein-Westfalen Amtsgericht Duisburg HRB 20148\niQbis consulting GmbH – Mülheim an der Ruhr",
      "type": "Registerbekanntmachung nach dem Umwandlungsgesetz",
      "state": "Nordrhein-Westfalen",
      "amtsgericht": "Amtsgericht Duisburg",
      "registernummer": "HRB 20148",
      "registerart": "HRB",
      "company_name": "iQbis consulting GmbH",
      "company_seat": "Mülheim an der Ruhr",
      "details": "01.07.2025 (Bekanntmachungsdatum)\n\nNordrhein-Westfalen Amtsgericht Duisburg HRB 20148\nRegisterbekanntmachung nach dem Umwandlungsgesetz 01.07.2025 (Eintragungsdatum)\n\niQbis consulting GmbH\nGesellschaft mit beschränkter Haftung\nMülheim an der Ruhr\n\nDie Gesellschaft hat Gläubigern, deren Forderungen vor dieser Bekanntmachung begründet worden sind, Sicherheit zu leisten, soweit sie nicht Befriedigung verlangen können, wenn sie sich binnen sechs Monaten zu diesem Zweck melden."
    },
    {
      "date": "2025-07-01",
      "id": "114152",
      "original_text": "Löschungsankündigung\nNordrhein-Westfalen Amtsgericht Bad Oeynhausen HRB 17934\nSB Sani-Bau GmbH – Herford",
      "type": "Löschungsankündigung",
      "state": "Nordrhein-Westfalen",
      "amtsgericht": "Amtsgericht Bad Oeynhausen",
      "registernummer": "HRB 17934",
      "registerart": "HRB",
      "company_name": "SB Sani-Bau GmbH",
      "company_seat": "Herford",
      "details": "01.07.2025 (Bekanntmachungsdatum)\n\nNordrhein-Westfalen Amtsgericht Bad Oeynhausen HRB 17934\nLöschungsankündigung\n\nSB Sani-Bau GmbH\nGesellschaft mit beschränkter Haftung\nHerford\n\nDas Registergericht beabsichtigt die Gesellschaft von Amts wegen nach § 394 FamFG zu löschen. Die Frist zur Erhebung eines Widerspruchs ist auf zwei Monate festgesetzt."
    },
    {
      "date": "2025-07-01",
      "id": "114153",
      "original_text": "Löschungsankündigung\nNordrhein-Westfalen Amtsgericht Dortmund HRB 22760\nIRIPO UG (haftungsbeschränkt) – Dortmund",
      "type": "Löschungsankündigung",
      "state": "Nordrhein-Westfalen",
      "amtsgericht": "Amtsgericht Dortmund",
      "registernummer": "HRB 22760",
      "registerart": "HRB",
      "company_name": "IRIPO UG (haftungsbeschränkt)",
      "company_seat": "Dortmund",
      "details": "01.07.2025 (Bekanntmachungsdatum)\n\nNordrhein-Westfalen Amtsgericht Dortmund HRB 22760\nLöschungsankündigung\n\nIRIPO UG (haftungsbeschränkt)\nGesellschaft mit beschränkter Haftung\nDortmund\n\nDas Registergericht beabsichtigt die Gesellschaft von Amts wegen nach § 394 FamFG zu löschen. Die Frist zur Erhebung eines Widerspruchs ist auf zwei Monate festgesetzt."
    },
    {
      "date": "2025-07-01",
      "id": "114154",
      "original_text": "Registerbekanntmachung nach dem Umwandlungsgesetz\nNordrhein-Westfalen Amtsgericht Paderborn HRB 6328\nWilson Naturstein GmbH – Anröchte",
      "type": "Registerbekanntmachung nach dem Umwandlungsgesetz",
      "state": "Nordrhein-Westfalen",
      "amtsgericht": "Amtsgericht Paderborn",
      "registernummer": "HRB 6328",
      "registerart": "HRB",
      "company_name": "Wilson Naturstein GmbH",
      "company_seat": "Anröchte",
      "details": "01.07.2025 (Bekanntmachungsdatum)\n\nNordrhein-Westfalen Amtsgericht Paderborn HRB 6328\nRegisterbekanntmachung nach dem Umwandlungsgesetz 01.07.2025 (Eintragungsdatum)\n\nWilson Naturstein GmbH\nGesellschaft mit beschränkter Haftung\nAnröchte\n\nDen Gläubigern der an der Verschmelzung beteiligten Rechtsträger ist, wenn sie binnen sechs Monaten nach dem Tag, an dem die Eintragung der Verschmelzung in das Register des Sitzes desjenigen Rechtsträgers, dessen Gläubiger sie sind, nach § 19 Absatz 3 UmwG als bekanntgemacht gilt, ihren Anspruch nach Grund und Höhe schriftlich anmelden, Sicherheit zu leisten, soweit sie nicht Befriedigung verlangen können. Dieses Recht steht den Gläubigern jedoch nur zu, wenn sie glaubhaft machen, dass durch die Verschmelzung die Erfüllung ihrer Forderung gefährdet wird."
    },
    {
      "date": "2025-07-01",
      "id": "114155",
      "original_text": "Registerbekanntmachung nach dem Umwandlungsgesetz\nNordrhein-Westfalen Amtsgericht Düsseldorf HRB 105826\nCFT Germany GmbH – Düsseldorf",
      "type": "Registerbekanntmachung nach dem Umwandlungsgesetz",
      "state": "Nordrhein-Westfalen",
      "amtsgericht": "Amtsgericht Düsseldorf",
      "registernummer": "HRB 105826",
      "registerart": "HRB",
      "company_name": "CFT Germany GmbH",
      "company_seat": "Düsseldorf",
      "details": "01.07.2025 (Bekanntmachungsdatum)\n\nNordrhein-Westfalen Amtsgericht Düsseldorf HRB 105826\nRegisterbekanntmachung nach dem Umwandlungsgesetz 01.07.2025 (Eintragungsdatum)\n\nCFT Germany GmbH\nGesellschaft mit beschränkter Haftung\nDüsseldorf\n\nDen Gläubigern der an der Verschmelzung beteiligten Rechtsträger ist, wenn sie binnen sechs Monaten nach dem Tag, an dem die Eintragung der Verschmelzung in das Register des Sitzes desjenigen Rechtsträgers, dessen Gläubiger sie sind, nach § 19 Absatz 3 UmwG als bekanntgemacht gilt, ihren Anspruch nach Grund und Höhe schriftlich anmelden, Sicherheit zu leisten, soweit sie nicht Befriedigung verlangen können. Dieses Recht steht den Gläubigern jedoch nur zu, wenn sie glaubhaft machen, dass durch die Verschmelzung die Erfüllung ihrer Forderung gefährdet wird."
    },
    {
      "date": "2025-07-01",
      "id": "114156",
      "original_text": "Registerbekanntmachung nach dem Umwandlungsgesetz\nNordrhein-Westfalen Amtsgericht Mönchengladbach HRB 12587\nVidara Germany GmbH – Mönchengladbach",
      "type": "Registerbekanntmachung nach dem Umwandlungsgesetz",
      "state": "Nordrhein-Westfalen",
      "amtsgericht": "Amtsgericht Mönchengladbach",
      "registernummer": "HRB 12587",
      "registerart": "HRB",
      "company_name": "Vidara Germany GmbH",
      "company_seat": "Mönchengladbach",
      "details": "01.07.2025 (Bekanntmachungsdatum)\n\nNordrhein-Westfalen Amtsgericht Mönchengladbach HRB 12587\nRegisterbekanntmachung nach dem Umwandlungsgesetz 01.07.2025 (Eintragungsdatum)\n\nVidara Germany GmbH\nGesellschaft mit beschränkter Haftung\nMönchengladbach\n\nDen Gläubigern der an der Verschmelzung beteiligten Rechtsträger ist, wenn sie binnen sechs Monaten nach dem Tag, an dem die Eintragung der Verschmelzung in das Register des Sitzes desjenigen Rechtsträgers, dessen Gläubiger sie sind, nach § 19 Absatz 3 UmwG als bekanntgemacht gilt, ihren Anspruch nach Grund und Höhe schriftlich anmelden, Sicherheit zu leisten, soweit sie nicht Befriedigung verlangen können. Dieses Recht steht den Gläubigern jedoch nur zu, wenn sie glaubhaft machen, dass durch die Verschmelzung die Erfüllung ihrer Forderung gefährdet wird."
    },
    {
      "date": "2025-07-01",
      "id": "114157",
      "original_text": "Registerbekanntmachung nach dem Umwandlungsgesetz\nNordrhein-Westfalen Amtsgericht Lemgo HRB 8855\nEcclesia med GmbH – Detmold",
      "type": "Registerbekanntmachung nach dem Umwandlungsgesetz",
      "state": "Nordrhein-Westfalen",
      "amtsgericht": "Amtsgericht Lemgo",
      "registernummer": "HRB 8855",
      "registerart": "HRB",
      "company_name": "Ecclesia med GmbH",
      "company_seat": "Detmold",
      "details": "01.07.2025 (Bekanntmachungsdatum)\n\nNordrhein-Westfalen Amtsgericht Lemgo HRB 8855\nRegisterbekanntmachung nach dem Umwandlungsgesetz 01.07.2025 (Eintragungsdatum)\n\nEcclesia med GmbH\nGesellschaft mit beschränkter Haftung\nDetmold\n\nDen Gläubigern der an der Verschmelzung beteiligten Rechtsträger ist, wenn sie binnen sechs Monaten nach dem Tag, an dem die Eintragung der Verschmelzung in das Register des Sitzes desjenigen Rechtsträgers, dessen Gläubiger sie sind, nach § 19 Absatz 3 UmwG als bekanntgemacht gilt, ihren Anspruch nach Grund und Höhe schriftlich anmelden, Sicherheit zu leisten, soweit sie nicht Befriedigung verlangen können. Dieses Recht steht den Gläubigern jedoch nur zu, wenn sie glaubhaft machen, dass durch die Verschmelzung die Erfüllung ihrer Forderung gefährdet wird."
    },
    {
      "date": "2025-07-01",
      "id": "114158",
      "original_text": "Registerbekanntmachung nach dem Umwandlungsgesetz\nNordrhein-Westfalen Amtsgericht Bielefeld HRB 46270\nh + p hachmeister + partner GmbH – Bielefeld",
      "type": "Registerbekanntmachung nach dem Umwandlungsgesetz",
      "state": "Nordrhein-Westfalen",
      "amtsgericht": "Amtsgericht Bielefeld",
      "registernummer": "HRB 46270",
      "registerart": "HRB",
      "company_name": "h + p hachmeister + partner GmbH",
      "company_seat": "Bielefeld",
      "details": "01.07.2025 (Bekanntmachungsdatum)\n\nNordrhein-Westfalen Amtsgericht Bielefeld HRB 46270\nRegisterbekanntmachung nach dem Umwandlungsgesetz 01.07.2025 (Eintragungsdatum)\n\nh + p hachmeister + partner GmbH\nGesellschaft mit beschränkter Haftung\nBielefeld\n\nDen Gläubigern der an der formwechselnden Umwandlung beteiligten Rechtsträger ist, wenn sie binnen sechs Monaten nach dem Tag, an dem die Eintragung der formwechselnden Umwandlung in das Register des Sitzes desjenigen Rechtsträgers, dessen Gläubiger sie sind, nach § 19 Absatz 3 UmwG als bekanntgemacht gilt, ihren Anspruch nach Grund und Höhe schriftlich anmelden, Sicherheit zu leisten, soweit sie nicht Befriedigung verlangen können. Dieses Recht steht den Gläubigern jedoch nur zu, wenn sie glaubhaft machen, dass durch die formwechselnden Umwandlung die Erfüllung ihrer Forderung gefährdet wird."
    },
    {
      "date": "2025-07-01",
      "id": "114159",
      "original_text": "Löschungsankündigung\nNordrhein-Westfalen Amtsgericht Düsseldorf HRB 97349\nWessendorf GmbH – Monheim am Rhein",
      "type": "Löschungsankündigung",
      "state": "Nordrhein-Westfalen",
      "amtsgericht": "Amtsgericht Düsseldorf",
      "registernummer": "HRB 97349",
      "registerart": "HRB",
      "company_name": "Wessendorf GmbH",
      "company_seat": "Monheim am Rhein",
      "details": "01.07.2025 (Bekanntmachungsdatum)\n\nNordrhein-Westfalen Amtsgericht Düsseldorf HRB 97349\nLöschungsankündigung\n\nWessendorf GmbH\nGesellschaft mit beschränkter Haftung\nMonheim am Rhein\n\nDas Registergericht beabsichtigt die Gesellschaft von Amts wegen nach § 394 FamFG zu löschen. Die Frist zur Erhebung eines Widerspruchs ist auf 3 Wochen festgesetzt.\n\nRechtsbehelfsbelehrung:\nDas Widerspruchsrecht steht jedem zu, der an der Unterlassung der Löschung ein berechtigtes Interesse hat. Der Widerspruch ist bei dem Amtsgericht Düsseldorf -Registergericht-, Werdener Straße 1, 40227 Düsseldorf schriftlich in deutscher Sprache oder zur Niederschrift der Geschäftsstelle einzulegen. Der Widerspruch kann auch zur Niederschrift der Geschäftsstelle eines jeden Amtsgerichtes abgegeben werden. Die Einlegung ist auch durch Übertragung eines elektronischen Dokuments an die elektronische Poststelle des Gerichts möglich. Das elektronische Dokument muss für die Bearbeitung durch das Gericht geeignet und mit einer qualifizierten elektronischen Signatur der verantwortenden Person versehen sein oder von der verantwortenden Person signiert und auf einem sicheren Übermittlungsweg gemäß § 130a ZPO nach näherer Maßgabe der Verordnung über die technischen Rahmenbedingungen des elektronischen Rechtsverkehrs und über das besondere elektronische Behördenpostfach (BGBl. I, S.3803) eingereicht werden. Weitere Informationen erhalten Sie auf der Internetseite www.justiz.de.\nDer Widerspruch muss spätestens innerhalb der gesetzten Frist nach dem Datum der Bekanntmachung der Löschungsankündigung bei dem Amtsgericht - Registergericht - Düsseldorf eingegangen sein.  Dies gilt auch dann, wenn der Widerspruch zur Niederschrift der Geschäftsstelle eines anderen Amtsgerichtes abgegeben wurde. Die Frist beginnt mit dem Tage der Bekanntmachung der Löschungsankündigung in dem für die Bekanntmachung der Eintragungen in das Handelsregister bestimmten elektronischen Informations- und Kommunikationssystem nach § 10 des Handelsgesetzbuches. Fällt das Ende der Frist auf einen Sonntag, einen allgemeinen Feiertag oder Sonnabend, so endet die Frist mit Ablauf des nächsten Werktages.\nDer Widerspruch muss die Bezeichnung der angefochtenen Löschungsankündigung sowie die Erklärung enthalten, dass Widerspruch gegen diese Löschungsankündigung eingelegt wird. Er ist zu unterzeichnen und soll begründet werden."
    },
    {
      "date": "2025-07-01",
      "id": "114160",
      "original_text": "Löschungsankündigung\nNordrhein-Westfalen Amtsgericht Kleve HRB 15882\nKTW UG (haftungsbeschränkt) – Emmerich am Rhein",
      "type": "Löschungsankündigung",
      "state": "Nordrhein-Westfalen",
      "amtsgericht": "Amtsgericht Kleve",
      "registernummer": "HRB 15882",
      "registerart": "HRB",
      "company_name": "KTW UG (haftungsbeschränkt)",
      "company_seat": "Emmerich am Rhein",
      "details": "01.07.2025 (Bekanntmachungsdatum)\n\nNordrhein-Westfalen Amtsgericht Kleve HRB 15882\nLöschungsankündigung\n\nKTW UG (haftungsbeschränkt)\nGesellschaft mit beschränkter Haftung\nEmmerich am Rhein\n\nDas Registergericht beabsichtigt die Gesellschaft von Amts wegen nach § 394 FamFG zu löschen. Die Frist zur Erhebung eines Widerspruchs ist auf einen Monat festgesetzt."
    },
    {
      "date": "2025-07-01",
      "id": "114161",
      "original_text": "Löschungsankündigung\nNordrhein-Westfalen Amtsgericht Recklinghausen VR 2739\nDC Zum Kuckuck e.V. – Datteln",
      "type": "Löschungsankündigung",
      "state": "Nordrhein-Westfalen",
      "amtsgericht": "Amtsgericht Recklinghausen",
      "registernummer": "VR 2739",
      "registerart": "VR",
      "company_name": "DC Zum Kuckuck e.V.",
      "company_seat": "Datteln",
      "details": "01.07.2025 (Bekanntmachungsdatum)\n\nNordrhein-Westfalen Amtsgericht Recklinghausen VR 2739\nLöschungsankündigung\n\nDC Zum Kuckuck e.V.\neingetragener Verein\nDatteln\n\nDas Registergericht beabsichtigt, den im Vereinsregister eingetragenen Verein auf Grund des Wegfalls sämtlicher Mitglieder von Amts wegen zu löschen.\n\nGegen diese Verfügung kann Widerspruch eingelegt werden. Die Frist zur Erhebung eines Widerspruchs gegen die beabsichtigte Löschung von Amts wegen ist auf einen Monat festgesetzt."
    },
    {
      "date": "2025-07-01",
      "id": "114162",
      "original_text": "Löschungsankündigung\nNordrhein-Westfalen Amtsgericht Düsseldorf HRB 101289\nJasminze UG (haftungsbeschränkt) – Ratingen",
      "type": "Löschungsankündigung",
      "state": "Nordrhein-Westfalen",
      "amtsgericht": "Amtsgericht Düsseldorf",
      "registernummer": "HRB 101289",
      "registerart": "HRB",
      "company_name": "Jasminze UG (haftungsbeschränkt)",
      "company_seat": "Ratingen",
      "details": "01.07.2025 (Bekanntmachungsdatum)\n\nNordrhein-Westfalen Amtsgericht Düsseldorf HRB 101289\nLöschungsankündigung\n\nJasminze UG (haftungsbeschränkt)\nGesellschaft mit beschränkter Haftung\nRatingen\n\nDas Registergericht beabsichtigt die Gesellschaft von Amts wegen nach § 394 FamFG zu löschen. Die Frist zur Erhebung eines Widerspruchs ist auf 3 Wochen festgesetzt.\n\nRechtsbehelfsbelehrung:\nDas Widerspruchsrecht steht jedem zu, der an der Unterlassung der Löschung ein berechtigtes Interesse hat. Der Widerspruch ist bei dem Amtsgericht Düsseldorf -Registergericht-, Werdener Straße 1, 40227 Düsseldorf schriftlich in deutscher Sprache oder zur Niederschrift der Geschäftsstelle einzulegen. Der Widerspruch kann auch zur Niederschrift der Geschäftsstelle eines jeden Amtsgerichtes abgegeben werden. Die Einlegung ist auch durch Übertragung eines elektronischen Dokuments an die elektronische Poststelle des Gerichts möglich. Das elektronische Dokument muss für die Bearbeitung durch das Gericht geeignet und mit einer qualifizierten elektronischen Signatur der verantwortenden Person versehen sein oder von der verantwortenden Person signiert und auf einem sicheren Übermittlungsweg gemäß § 130a ZPO nach näherer Maßgabe der Verordnung über die technischen Rahmenbedingungen des elektronischen Rechtsverkehrs und über das besondere elektronische Behördenpostfach (BGBl. I, S.3803) eingereicht werden. Weitere Informationen erhalten Sie auf der Internetseite www.justiz.de.\nDer Widerspruch muss spätestens innerhalb der gesetzten Frist nach dem Datum der Bekanntmachung der Löschungsankündigung bei dem Amtsgericht - Registergericht - Düsseldorf eingegangen sein.  Dies gilt auch dann, wenn der Widerspruch zur Niederschrift der Geschäftsstelle eines anderen Amtsgerichtes abgegeben wurde. Die Frist beginnt mit dem Tage der Bekanntmachung der Löschungsankündigung in dem für die Bekanntmachung der Eintragungen in das Handelsregister bestimmten elektronischen Informations- und Kommunikationssystem nach § 10 des Handelsgesetzbuches. Fällt das Ende der Frist auf einen Sonntag, einen allgemeinen Feiertag oder Sonnabend, so endet die Frist mit Ablauf des nächsten Werktages.\nDer Widerspruch muss die Bezeichnung der angefochtenen Löschungsankündigung sowie die Erklärung enthalten, dass Widerspruch gegen diese Löschungsankündigung eingelegt wird. Er ist zu unterzeichnen und soll begründet werden."
    },
    {
      "date": "2025-07-01",
      "id": "114163",
      "original_text": "Registerbekanntmachung nach dem Umwandlungsgesetz\nNordrhein-Westfalen Amtsgericht Köln HRB 104128\nTÜV Rheinland Verkehrsinfrastruktur GmbH – Köln",
      "type": "Registerbekanntmachung nach dem Umwandlungsgesetz",
      "state": "Nordrhein-Westfalen",
      "amtsgericht": "Amtsgericht Köln",
      "registernummer": "HRB 104128",
      "registerart": "HRB",
      "company_name": "TÜV Rheinland Verkehrsinfrastruktur GmbH",
      "company_seat": "Köln",
      "details": "01.07.2025 (Bekanntmachungsdatum)\n\nNordrhein-Westfalen Amtsgericht Köln HRB 104128\nRegisterbekanntmachung nach dem Umwandlungsgesetz 01.07.2025 (Eintragungsdatum)\n\nTÜV Rheinland Verkehrsinfrastruktur GmbH\nGesellschaft mit beschränkter Haftung\nKöln\n\nDen Gläubigern der an der Verschmelzung beteiligten Rechtsträger ist, wenn sie binnen sechs Monaten nach dem Tag, an dem die Eintragung der Verschmelzung in das Register des Sitzes desjenigen Rechtsträgers, dessen Gläubiger sie sind, nach § 19 Absatz 3 UmwG als bekanntgemacht gilt, ihren Anspruch nach Grund und Höhe schriftlich anmelden, Sicherheit zu leisten, soweit sie nicht Befriedigung verlangen können. Dieses Recht steht den Gläubigern jedoch nur zu, wenn sie glaubhaft machen, dass durch die Verschmelzung die Erfüllung ihrer Forderung gefährdet wird."
    },
    {
      "date": "2025-07-01",
      "id": "114164",
      "original_text": "Registerbekanntmachung nach dem Umwandlungsgesetz\nNordrhein-Westfalen Amtsgericht Neuss HRB 21620\nROBUR Industrials GmbH – Dormagen",
      "type": "Registerbekanntmachung nach dem Umwandlungsgesetz",
      "state": "Nordrhein-Westfalen",
      "amtsgericht": "Amtsgericht Neuss",
      "registernummer": "HRB 21620",
      "registerart": "HRB",
      "company_name": "ROBUR Industrials GmbH",
      "company_seat": "Dormagen",
      "details": "01.07.2025 (Bekanntmachungsdatum)\n\nNordrhein-Westfalen Amtsgericht Neuss HRB 21620\nRegisterbekanntmachung nach dem Umwandlungsgesetz 01.07.2025 (Eintragungsdatum)\n\nROBUR Industrials GmbH\nGesellschaft mit beschränkter Haftung\nDormagen\n\nDen Gläubigern der an der Verschmelzung beteiligten Rechtsträger ist, wenn sie binnen sechs Monaten nach dem Tag, an dem die Eintragung der Verschmelzung in das Register des Sitzes desjenigen Rechtsträgers, dessen Gläubiger sie sind, nach § 19 Absatz 3 UmwG als bekanntgemacht gilt, ihren Anspruch nach Grund und Höhe schriftlich anmelden, Sicherheit zu leisten, soweit sie nicht Befriedigung verlangen können. Dieses Recht steht den Gläubigern jedoch nur zu, wenn sie glaubhaft machen, dass durch die Verschmelzung die Erfüllung ihrer Forderung gefährdet wird."
    },
    {
      "date": "2025-07-01",
      "id": "114165",
      "original_text": "Löschungsankündigung\nNordrhein-Westfalen Amtsgericht Köln HRB 79536\nAutoglascenter Erftstadt GmbH – Erftstadt",
      "type": "Löschungsankündigung",
      "state": "Nordrhein-Westfalen",
      "amtsgericht": "Amtsgericht Köln",
      "registernummer": "HRB 79536",
      "registerart": "HRB",
      "company_name": "Autoglascenter Erftstadt GmbH",
      "company_seat": "Erftstadt",
      "details": "01.07.2025 (Bekanntmachungsdatum)\n\nNordrhein-Westfalen Amtsgericht Köln HRB 79536\nLöschungsankündigung\n\nAutoglascenter Erftstadt GmbH\nGesellschaft mit beschränkter Haftung\nErftstadt\n\nDas Registergericht beabsichtigt die Gesellschaft von Amts wegen nach § 394 FamFG zu löschen. Die Frist zur Erhebung eines Widerspruchs ist auf einen Monat festgesetzt."
    },
    {
      "date": "2025-07-01",
      "id": "114166",
      "original_text": "Registerbekanntmachung nach dem Umwandlungsgesetz\nNordrhein-Westfalen Amtsgericht Iserlohn HRA 5729\nKOSTAL Electro Mobility Deutschland GmbH & Co. KG – Lüdenscheid",
      "type": "Registerbekanntmachung nach dem Umwandlungsgesetz",
      "state": "Nordrhein-Westfalen",
      "amtsgericht": "Amtsgericht Iserlohn",
      "registernummer": "HRA 5729",
      "registerart": "HRA",
      "company_name": "KOSTAL Electro Mobility Deutschland GmbH & Co. KG",
      "company_seat": "Lüdenscheid",
      "details": "01.07.2025 (Bekanntmachungsdatum)\n\nNordrhein-Westfalen Amtsgericht Iserlohn HRA 5729\nRegisterbekanntmachung nach dem Umwandlungsgesetz 01.07.2025 (Eintragungsdatum)\n\nKOSTAL Electro Mobility Deutschland GmbH & Co. KG\nKommanditgesellschaft\nLüdenscheid\n\nDen Gläubigern der an der Abspaltung beteiligten Rechtsträger ist, wenn sie binnen sechs Monaten nach dem Tag, an dem die Eintragung der Abspaltung in das Register des Sitzes desjenigen Rechtsträgers, dessen Gläubiger sie sind, nach § 19 Absatz 3 UmwG als bekanntgemacht gilt, ihren Anspruch nach Grund und Höhe schriftlich anmelden, Sicherheit zu leisten, soweit sie nicht Befriedigung verlangen können. Dieses Recht steht den Gläubigern jedoch nur zu, wenn sie glaubhaft machen, dass durch die Abspaltung die Erfüllung ihrer Forderung gefährdet wird."
    },
    {
      "date": "2025-07-01",
      "id": "114167",
      "original_text": "Löschungsankündigung\nNordrhein-Westfalen Amtsgericht Hamm HRA 4109\nGesundheitszentrum Rehneses GmbH & Co. KG – Hamm",
      "type": "Löschungsankündigung",
      "state": "Nordrhein-Westfalen",
      "amtsgericht": "Amtsgericht Hamm",
      "registernummer": "HRA 4109",
      "registerart": "HRA",
      "company_name": "Gesundheitszentrum Rehneses GmbH & Co. KG",
      "company_seat": "Hamm",
      "details": "01.07.2025 (Bekanntmachungsdatum)\n\nNordrhein-Westfalen Amtsgericht Hamm HRA 4109\nLöschungsankündigung\n\nGesundheitszentrum Rehneses GmbH & Co. KG\nKommanditgesellschaft\nHamm\n\nDas Registergericht beabsichtigt die Firma von Amts wegen nach § 394 FamFG zu löschen. Die Frist zur Erhebung eines Widerspruchs ist auf einen Monat festgesetzt."
    },
    {
      "date": "2025-07-01",
      "id": "114168",
      "original_text": "Registerbekanntmachung nach dem Umwandlungsgesetz\nThüringen Amtsgericht Jena HRA 202242\nKäserei Altenburger Land GmbH & Co. KG – Schmölln",
      "type": "Registerbekanntmachung nach dem Umwandlungsgesetz",
      "state": "Thüringen",
      "amtsgericht": "Amtsgericht Jena",
      "registernummer": "HRA 202242",
      "registerart": "HRA",
      "company_name": "Käserei Altenburger Land GmbH & Co. KG",
      "company_seat": "Schmölln",
      "details": "01.07.2025 (Bekanntmachungsdatum)\n\nThüringen Amtsgericht Jena HRA 202242\nRegisterbekanntmachung nach dem Umwandlungsgesetz 01.07.2025 (Eintragungsdatum)\n\nKäserei Altenburger Land GmbH & Co. KG\nKommanditgesellschaft\nSchmölln\n\nDie Verschmelzung wurde am 18.06.2025 in das Register der übernehmenden Gesellschaft eingetragen (siehe Amtsgericht Dortmund HRB 13707). Nicht eingetragen: Den Gläubigern der an der Verschmelzung beteiligten Rechtsträger, ist wenn sie binnen sechs Monaten nach dem Tag, an dem die Eintragung der Verschmelzung in das Register des Sitzes desjenigen Rechtsträgers, dessen Gläubiger sie sind,  nach § 19 Abs. 3 UmwG als bekanntgemacht gilt, ihren Anspruch nach Grund und Höhe schriftlich anmelden, Sicherheit zu leisten, soweit sie nicht Befriedigung verlangen können. Dieses Recht steht ihnen jedoch nur zu, wenn sie glaubhaft machen, daß durch die Verschmelzung die Erfüllung ihrer Forderung gefährdet wird."
    },
    {
      "date": "2025-07-01",
      "id": "114169",
      "original_text": "Registerbekanntmachung nach dem Umwandlungsgesetz\nHessen Amtsgericht Hanau HRA 92852\nThomas Szwillus Ing. Büro für MSR-Technik Meßmatic e.K. – Schöneck",
      "type": "Registerbekanntmachung nach dem Umwandlungsgesetz",
      "state": "Hessen",
      "amtsgericht": "Amtsgericht Hanau",
      "registernummer": "HRA 92852",
      "registerart": "HRA",
      "company_name": "Thomas Szwillus Ing. Büro für MSR-Technik Meßmatic e.K.",
      "company_seat": "Schöneck",
      "details": "01.07.2025 (Bekanntmachungsdatum)\n\nHessen Amtsgericht Hanau HRA 92852\nRegisterbekanntmachung nach dem Umwandlungsgesetz 01.07.2025 (Eintragungsdatum)\n\nThomas Szwillus Ing. Büro für MSR-Technik Meßmatic e.K.\nEinzelkaufmann / Einzelkauffrau\nSchöneck\n\nDen Gläubigern der an der Verschmelzung beteiligten Rechtsträger ist, wenn sie binnen sechs Monaten nach dem Tag, an dem die Eintragung der Verschmelzung in das Register des Sitzes desjenigen Rechtsträgers, dessen Gläubiger sie sind, nach § 19 Absatz 3 UmwG bekannt gemacht worden ist, ihren Anspruch nach Grund und Höhe schriftlich anmelden, Sicherheit zu leisten, soweit sie nicht Befriedigung verlangen können. Dieses Recht steht den Gläubigern jedoch nur zu, wenn sie glaubhaft machen, dass durch die Verschmelzung die Erfüllung ihrer Forderung gefährdet wird."
    },
    {
      "date": "2025-07-01",
      "id": "114170",
      "original_text": "Registerbekanntmachung nach dem Umwandlungsgesetz\nHessen Amtsgericht Frankfurt am Main HRB 83867\nAdrett Immobilienleasing GmbH – Eschborn",
      "type": "Registerbekanntmachung nach dem Umwandlungsgesetz",
      "state": "Hessen",
      "amtsgericht": "Amtsgericht Frankfurt am Main",
      "registernummer": "HRB 83867",
      "registerart": "HRB",
      "company_name": "Adrett Immobilienleasing GmbH",
      "company_seat": "Eschborn",
      "details": "01.07.2025 (Bekanntmachungsdatum)\n\nHessen Amtsgericht Frankfurt am Main HRB 83867\nRegisterbekanntmachung nach dem Umwandlungsgesetz 01.07.2025 (Eintragungsdatum)\n\nAdrett Immobilienleasing GmbH\nGesellschaft mit beschränkter Haftung\nEschborn\n\nDen Gläubigern der an der Verschmelzung beteiligten Rechtsträger ist, wenn sie binnen sechs Monaten nach dem Tag, an dem die Eintragung der Verschmelzung in das Register des Sitzes desjenigen Rechtsträgers, dessen Gläubiger sie sind, nach § 19 Absatz 3 UmwG bekannt gemacht worden ist, ihren Anspruch nach Grund und Höhe schriftlich anmelden, Sicherheit zu leisten, soweit sie nicht Befriedigung verlangen können. Dieses Recht steht den Gläubigern jedoch nur zu, wenn sie glaubhaft machen, dass durch die Verschmelzung die Erfüllung ihrer Forderung gefährdet wird."
    },
    {
      "date": "2025-07-01",
      "id": "114171",
      "original_text": "Registerbekanntmachung nach dem Umwandlungsgesetz\nHessen Amtsgericht Frankfurt am Main HRB 108963\nMulana Consulting GmbH – Frankfurt am Main",
      "type": "Registerbekanntmachung nach dem Umwandlungsgesetz",
      "state": "Hessen",
      "amtsgericht": "Amtsgericht Frankfurt am Main",
      "registernummer": "HRB 108963",
      "registerart": "HRB",
      "company_name": "Mulana Consulting GmbH",
      "company_seat": "Frankfurt am Main",
      "details": "01.07.2025 (Bekanntmachungsdatum)\n\nHessen Amtsgericht Frankfurt am Main HRB 108963\nRegisterbekanntmachung nach dem Umwandlungsgesetz 01.07.2025 (Eintragungsdatum)\n\nMulana Consulting GmbH\nGesellschaft mit beschränkter Haftung\nFrankfurt am Main\n\nDen Gläubigern der an der Verschmelzung beteiligten Rechtsträger ist, wenn sie binnen sechs Monaten nach dem Tag, an dem die Eintragung der Verschmelzung in das Register des Sitzes desjenigen Rechtsträgers, dessen Gläubiger sie sind, nach § 19 Absatz 3 UmwG bekannt gemacht worden ist, ihren Anspruch nach Grund und Höhe schriftlich anmelden, Sicherheit zu leisten, soweit sie nicht Befriedigung verlangen können. Dieses Recht steht den Gläubigern jedoch nur zu, wenn sie glaubhaft machen, dass durch die Verschmelzung die Erfüllung ihrer Forderung gefährdet wird."
    },
    {
      "date": "2025-07-01",
      "id": "114172",
      "original_text": "Einreichung neuer Dokumente\nHessen Amtsgericht Frankfurt am Main HRB 116860\nPAYONE GmbH – Frankfurt am Main",
      "type": "Einreichung neuer Dokumente",
      "state": "Hessen",
      "amtsgericht": "Amtsgericht Frankfurt am Main",
      "registernummer": "HRB 116860",
      "registerart": "HRB",
      "company_name": "PAYONE GmbH",
      "company_seat": "Frankfurt am Main",
      "details": "01.07.2025 (Bekanntmachungsdatum)\n\nHessen Amtsgericht Frankfurt am Main HRB 116860\nEinreichung neuer Dokumente 01.07.2025 (Eintragungsdatum)\n\nPAYONE GmbH\nGesellschaft mit beschränkter Haftung\nFrankfurt am Main\n\nDurch eine Änderung in den Personen der Aufsichtsratsmitglieder ist eine Liste der Mitglieder des Aufsichtsrates zum Handelsregister eingereicht worden."
    },
    {
      "date": "2025-07-01",
      "id": "114173",
      "original_text": "Sonstige Registerbekanntmachung\nHessen Amtsgericht Wetzlar VR 3412\nHeimat- und Geschichtsverein Mittenaar-Bicken e.V. – Mittenaar-Bicken",
      "type": "Sonstige Registerbekanntmachung",
      "state": "Hessen",
      "amtsgericht": "Amtsgericht Wetzlar",
      "registernummer": "VR 3412",
      "registerart": "VR",
      "company_name": "Heimat- und Geschichtsverein Mittenaar-Bicken e.V.",
      "company_seat": "Mittenaar-Bicken",
      "details": "01.07.2025 (Bekanntmachungsdatum)\n\nHessen Amtsgericht Wetzlar VR 3412\nSonstige Registerbekanntmachung 01.07.2025 (Eintragungsdatum)\n\nHeimat- und Geschichtsverein Mittenaar-Bicken e.V.\neingetragener Verein\nMittenaar-Bicken\n\nDer Verein ist aufgelöst."
    },
    {
      "date": "2025-07-01",
      "id": "114174",
      "original_text": "Registerbekanntmachung nach dem Umwandlungsgesetz\nHessen Amtsgericht Frankfurt am Main HRB 82687\nAdipes Immobilienleasing GmbH – Eschborn",
      "type": "Registerbekanntmachung nach dem Umwandlungsgesetz",
      "state": "Hessen",
      "amtsgericht": "Amtsgericht Frankfurt am Main",
      "registernummer": "HRB 82687",
      "registerart": "HRB",
      "company_name": "Adipes Immobilienleasing GmbH",
      "company_seat": "Eschborn",
      "details": "01.07.2025 (Bekanntmachungsdatum)\n\nHessen Amtsgericht Frankfurt am Main HRB 82687\nRegisterbekanntmachung nach dem Umwandlungsgesetz 01.07.2025 (Eintragungsdatum)\n\nAdipes Immobilienleasing GmbH\nGesellschaft mit beschränkter Haftung\nEschborn\n\nDen Gläubigern der an der Verschmelzung beteiligten Rechtsträger ist, wenn sie binnen sechs Monaten nach dem Tag, an dem die Eintragung der Verschmelzung in das Register des Sitzes derjenigen Rechtsträger deren Gläubiger sie sind, nach § 19 Absatz 3 UmwG bekannt gemacht worden ist, ihren Anspruch nach Grund und Höhe schriftlich anmelden, Sicherheit zu leisten, soweit sie nicht Befriedigung verlangen können. Dieses Recht steht den Gläubigern jedoch nur zu, wenn sie glaubhaft machen, dass durch die Verschmelzung die Erfüllung ihrer Forderung gefährdet wird."
    },
    {
      "date": "2025-07-01",
      "id": "114175",
      "original_text": "Sonstige Registerbekanntmachung\nHessen Amtsgericht Kassel VR 4772\nFachverband Elektromobilität e.V. – Bad Emstal",
      "type": "Sonstige Registerbekanntmachung",
      "state": "Hessen",
      "amtsgericht": "Amtsgericht Kassel",
      "registernummer": "VR 4772",
      "registerart": "VR",
      "company_name": "Fachverband Elektromobilität e.V.",
      "company_seat": "Bad Emstal",
      "details": "01.07.2025 (Bekanntmachungsdatum)\n\nHessen Amtsgericht Kassel VR 4772\nSonstige Registerbekanntmachung 01.07.2025 (Eintragungsdatum)\n\nFachverband Elektromobilität e.V.\neingetragener Verein\nBad Emstal\n\nDurch rechtskräftigen Beschluss des Amtsgerichts Kassel vom 25.04.2025 ist dem Verein gemäß § 73 BGB die Rechtsfähigkeit entzogen worden."
    },
    {
      "date": "2025-07-01",
      "id": "114176",
      "original_text": "Löschungsankündigung\nHessen Amtsgericht Offenbach am Main HRB 50313\nC.A. Gebäudemanagement GmbH – Offenbach am Main",
      "type": "Löschungsankündigung",
      "state": "Hessen",
      "amtsgericht": "Amtsgericht Offenbach am Main",
      "registernummer": "HRB 50313",
      "registerart": "HRB",
      "company_name": "C.A. Gebäudemanagement GmbH",
      "company_seat": "Offenbach am Main",
      "details": "01.07.2025 (Bekanntmachungsdatum)\n\nHessen Amtsgericht Offenbach am Main HRB 50313\nLöschungsankündigung\n\nC.A. Gebäudemanagement GmbH\nGesellschaft mit beschränkter Haftung\nOffenbach am Main\n\nDas Registergericht beabsichtigt die im Handelsregister eingetragene Gesellschaft von Amts wegen nach § 394 FamFG zu löschen. Die Frist zur Erhebung eines Widerspruchs gegen die beabsichtigte Löschung wird auf 3 Monate festgesetzt."
    },
    {
      "date": "2025-07-01",
      "id": "114177",
      "original_text": "Löschungsankündigung\nHessen Amtsgericht Offenbach am Main HRB 49593\nÖzer Mobile GmbH – Offenbach am Main",
      "type": "Löschungsankündigung",
      "state": "Hessen",
      "amtsgericht": "Amtsgericht Offenbach am Main",
      "registernummer": "HRB 49593",
      "registerart": "HRB",
      "company_name": "Özer Mobile GmbH",
      "company_seat": "Offenbach am Main",
      "details": "01.07.2025 (Bekanntmachungsdatum)\n\nHessen Amtsgericht Offenbach am Main HRB 49593\nLöschungsankündigung\n\nÖzer Mobile GmbH\nGesellschaft mit beschränkter Haftung\nOffenbach am Main\n\nDas Registergericht beabsichtigt die im Handelsregister eingetragene Gesellschaft von Amts wegen nach § 394 FamFG zu löschen. Die Frist zur Erhebung eines Widerspruchs gegen die beabsichtigte Löschung wird auf 3 Monate festgesetzt."
    },
    {
      "date": "2025-07-01",
      "id": "114178",
      "original_text": "Einreichung neuer Dokumente\nHessen Amtsgericht Friedberg HRB 10160\nUsa-Wellenbad Bad Nauheim - Friedberg (Hessen) GmbH – Bad Nauheim",
      "type": "Einreichung neuer Dokumente",
      "state": "Hessen",
      "amtsgericht": "Amtsgericht Friedberg",
      "registernummer": "HRB 10160",
      "registerart": "HRB",
      "company_name": "Usa-Wellenbad Bad Nauheim - Friedberg (Hessen) GmbH",
      "company_seat": "Bad Nauheim",
      "details": "01.07.2025 (Bekanntmachungsdatum)\n\nHessen Amtsgericht Friedberg HRB 10160\nEinreichung neuer Dokumente\n\nUsa-Wellenbad Bad Nauheim - Friedberg (Hessen) GmbH\nGesellschaft mit beschränkter Haftung\nBad Nauheim\n\nDurch eine Änderung in den Personen der Aufsichtsratsmitglieder ist eine Liste der Mitglieder des Aufsichtsrates zum Handelsregister eingereicht worden."
    },
    {
      "date": "2025-07-01",
      "id": "114179",
      "original_text": "Registerbekanntmachung nach dem Umwandlungsgesetz\nHessen Amtsgericht Hanau HRB 100578\nGlobalis Erlebnisreisen GmbH – Schöneck",
      "type": "Registerbekanntmachung nach dem Umwandlungsgesetz",
      "state": "Hessen",
      "amtsgericht": "Amtsgericht Hanau",
      "registernummer": "HRB 100578",
      "registerart": "HRB",
      "company_name": "Globalis Erlebnisreisen GmbH",
      "company_seat": "Schöneck",
      "details": "01.07.2025 (Bekanntmachungsdatum)\n\nHessen Amtsgericht Hanau HRB 100578\nRegisterbekanntmachung nach dem Umwandlungsgesetz 01.07.2025 (Eintragungsdatum)\n\nGlobalis Erlebnisreisen GmbH\nGesellschaft mit beschränkter Haftung\nSchöneck\n\nDen Gläubigern der an der Abspaltung beteiligten Rechtsträger ist, wenn sie binnen sechs Monaten nach dem Tag, an dem die Eintragung der Abspaltung in das Register des Sitzes desjenigen Rechtsträgers, dessen Gläubiger sie sind, nach §§ 125, 19 Absatz 3 UmwG bekannt gemacht worden ist, ihren Anspruch nach Grund und Höhe schriftlich anmelden, Sicherheit zu leisten, soweit sie nicht Befriedigung verlangen können. Dieses Recht steht den Gläubigern jedoch nur zu, wenn sie glaubhaft machen, dass durch die Abspaltung die Erfüllung ihrer Forderung gefährdet wird."
    },
    {
      "date": "2025-07-01",
      "id": "114180",
      "original_text": "Löschungsankündigung\nHessen Amtsgericht Frankfurt am Main HRB 115416\nEG Bauunternehmung GmbH – Frankfurt am Main",
      "type": "Löschungsankündigung",
      "state": "Hessen",
      "amtsgericht": "Amtsgericht Frankfurt am Main",
      "registernummer": "HRB 115416",
      "registerart": "HRB",
      "company_name": "EG Bauunternehmung GmbH",
      "company_seat": "Frankfurt am Main",
      "details": "01.07.2025 (Bekanntmachungsdatum)\n\nHessen Amtsgericht Frankfurt am Main HRB 115416\nLöschungsankündigung\n\nEG Bauunternehmung GmbH\nGesellschaft mit beschränkter Haftung\nFrankfurt am Main\n\nDas Registergericht beabsichtigt die im Handelsregister eingetragene Gesellschaft von Amts wegen nach § 394 FamFG zu löschen. Die Frist zur Erhebung eines Widerspruchs gegen die beabsichtigte Löschung wird auf 1 Monat festgesetzt."
    },
    {
      "date": "2025-07-01",
      "id": "114181",
      "original_text": "Registerbekanntmachung nach dem Umwandlungsgesetz\nHessen Amtsgericht Wiesbaden HRA 11581\nTaunus-Auto-Verkaufs-GmbH & Co. KG – Wiesbaden",
      "type": "Registerbekanntmachung nach dem Umwandlungsgesetz",
      "state": "Hessen",
      "amtsgericht": "Amtsgericht Wiesbaden",
      "registernummer": "HRA 11581",
      "registerart": "HRA",
      "company_name": "Taunus-Auto-Verkaufs-GmbH & Co. KG",
      "company_seat": "Wiesbaden",
      "details": "01.07.2025 (Bekanntmachungsdatum)\n\nHessen Amtsgericht Wiesbaden HRA 11581\nRegisterbekanntmachung nach dem Umwandlungsgesetz 01.07.2025 (Eintragungsdatum)\n\nTaunus-Auto-Verkaufs-GmbH & Co. KG\nKommanditgesellschaft\nWiesbaden\n\nDen Gläubigern der an der formwechselnden Umwandlung beteiligten Rechtsträger ist, wenn sie binnen sechs Monaten nach dem Tag, an dem die Eintragung der formwechselnden Umwandlung in das Register des Sitzes desjenigen Rechtsträgers, dessen Gläubiger sie sind, nach § 201 UmwG bekannt gemacht worden ist, ihren Anspruch nach Grund und Höhe schriftlich anmelden, Sicherheit zu leisten, soweit sie nicht Befriedigung verlangen können. Dieses Recht steht den Gläubigern jedoch nur zu, wenn sie glaubhaft machen, dass durch die formwechselnden Umwandlung die Erfüllung ihrer Forderung gefährdet wird."
    },
    {
      "date": "2025-07-01",
      "id": "114182",
      "original_text": "Registerbekanntmachung nach dem Umwandlungsgesetz\nHessen Amtsgericht Wiesbaden HRB 33687\nB&B Hotels Management GmbH – Hochheim am Main",
      "type": "Registerbekanntmachung nach dem Umwandlungsgesetz",
      "state": "Hessen",
      "amtsgericht": "Amtsgericht Wiesbaden",
      "registernummer": "HRB 33687",
      "registerart": "HRB",
      "company_name": "B&B Hotels Management GmbH",
      "company_seat": "Hochheim am Main",
      "details": "01.07.2025 (Bekanntmachungsdatum)\n\nHessen Amtsgericht Wiesbaden HRB 33687\nRegisterbekanntmachung nach dem Umwandlungsgesetz 01.07.2025 (Eintragungsdatum)\n\nB&B Hotels Management GmbH\nGesellschaft mit beschränkter Haftung\nHochheim am Main\n\nDen Gläubigern der an der Verschmelzung beteiligten Rechtsträger ist, wenn sie binnen sechs Monaten nach dem Tag, an dem die Eintragung der Verschmelzung in das Register des Sitzes derjenigen Rechtsträger deren Gläubiger sie sind, nach § 19 Absatz 3 UmwG bekannt gemacht worden ist, ihren Anspruch nach Grund und Höhe schriftlich anmelden, Sicherheit zu leisten, soweit sie nicht Befriedigung verlangen können. Dieses Recht steht den Gläubigern jedoch nur zu, wenn sie glaubhaft machen, dass durch die Verschmelzung die Erfüllung ihrer Forderung gefährdet wird."
    },
    {
      "date": "2025-07-01",
      "id": "114183",
      "original_text": "Sonstige Registerbekanntmachung\nHessen Amtsgericht Kassel VR 3825\nHeimatverein Langenthal e.V. – Langenthal",
      "type": "Sonstige Registerbekanntmachung",
      "state": "Hessen",
      "amtsgericht": "Amtsgericht Kassel",
      "registernummer": "VR 3825",
      "registerart": "VR",
      "company_name": "Heimatverein Langenthal e.V.",
      "company_seat": "Langenthal",
      "details": "01.07.2025 (Bekanntmachungsdatum)\n\nHessen Amtsgericht Kassel VR 3825\nSonstige Registerbekanntmachung 01.07.2025 (Eintragungsdatum)\n\nHeimatverein Langenthal e.V.\neingetragener Verein\nLangenthal\n\nDer Verein ist aufgelöst."
    },
    {
      "date": "2025-07-01",
      "id": "114184",
      "original_text": "Sonstige Registerbekanntmachung\nHessen Amtsgericht Kassel VR 1064\nRadfahrer-Verein Kassel 1899 e. V. – Kassel",
      "type": "Sonstige Registerbekanntmachung",
      "state": "Hessen",
      "amtsgericht": "Amtsgericht Kassel",
      "registernummer": "VR 1064",
      "registerart": "VR",
      "company_name": "Radfahrer-Verein Kassel 1899 e. V.",
      "company_seat": "Kassel",
      "details": "01.07.2025 (Bekanntmachungsdatum)\n\nHessen Amtsgericht Kassel VR 1064\nSonstige Registerbekanntmachung 01.07.2025 (Eintragungsdatum)\n\nRadfahrer-Verein Kassel 1899 e. V.\neingetragener Verein\nKassel\n\nDer Verein ist aufgelöst."
    },
    {
      "date": "2025-07-01",
      "id": "114185",
      "original_text": "Einreichung neuer Dokumente\nHessen Amtsgericht Darmstadt HRB 83385\nCondor Flugdienst Gesellschaft mit beschränkter Haftung – Kelsterbach",
      "type": "Einreichung neuer Dokumente",
      "state": "Hessen",
      "amtsgericht": "Amtsgericht Darmstadt",
      "registernummer": "HRB 83385",
      "registerart": "HRB",
      "company_name": "Condor Flugdienst Gesellschaft mit beschränkter Haftung",
      "company_seat": "Kelsterbach",
      "details": "01.07.2025 (Bekanntmachungsdatum)\n\nHessen Amtsgericht Darmstadt HRB 83385\nEinreichung neuer Dokumente 01.07.2025 (Eintragungsdatum)\n\nCondor Flugdienst Gesellschaft mit beschränkter Haftung\nGesellschaft mit beschränkter Haftung\nKelsterbach\n\nWegen Änderungen in den Personen der Aufsichtsratsmitglieder ist eine Liste der Mitglieder des Aufsichtsrates zum Handelsregister eingereicht worden."
    },
    {
      "date": "2025-07-01",
      "id": "114186",
      "original_text": "Löschungsankündigung\nHessen Amtsgericht Hanau HRB 97953\nSOKONI UG (haftungsbeschränkt) – Maintal",
      "type": "Löschungsankündigung",
      "state": "Hessen",
      "amtsgericht": "Amtsgericht Hanau",
      "registernummer": "HRB 97953",
      "registerart": "HRB",
      "company_name": "SOKONI UG (haftungsbeschränkt)",
      "company_seat": "Maintal",
      "details": "01.07.2025 (Bekanntmachungsdatum)\n\nHessen Amtsgericht Hanau HRB 97953\nLöschungsankündigung\n\nSOKONI UG (haftungsbeschränkt)\nGesellschaft mit beschränkter Haftung\nMaintal\n\nDas Registergericht beabsichtigt die im Handelsregister eingetragene Gesellschaft von Amts wegen nach § 394 FamFG zu löschen. Die Frist zur Erhebung eines Widerspruchs gegen die beabsichtigte Löschung wird auf 3 Monate festgesetzt."
    },
    {
      "date": "2025-07-01",
      "id": "114187",
      "original_text": "Löschungsankündigung\nHessen Amtsgericht Offenbach am Main HRB 34056\nILFORD Imaging GmbH – Dreieich",
      "type": "Löschungsankündigung",
      "state": "Hessen",
      "amtsgericht": "Amtsgericht Offenbach am Main",
      "registernummer": "HRB 34056",
      "registerart": "HRB",
      "company_name": "ILFORD Imaging GmbH",
      "company_seat": "Dreieich",
      "details": "01.07.2025 (Bekanntmachungsdatum)\n\nHessen Amtsgericht Offenbach am Main HRB 34056\nLöschungsankündigung\n\nILFORD Imaging GmbH\nGesellschaft mit beschränkter Haftung\nDreieich\n\nDas Registergericht beabsichtigt die im Handelsregister eingetragene Gesellschaft von Amts wegen nach § 394 FamFG zu löschen. Die Frist zur Erhebung eines Widerspruchs gegen die beabsichtigte Löschung wird auf 3 Monate festgesetzt."
    },
    {
      "date": "2025-07-01",
      "id": "114188",
      "original_text": "Löschungsankündigung\nHessen Amtsgericht Wiesbaden VR 3202\nFörderverein zur Früherkennung von Nierenerkrankungen – Wiesbaden",
      "type": "Löschungsankündigung",
      "state": "Hessen",
      "amtsgericht": "Amtsgericht Wiesbaden",
      "registernummer": "VR 3202",
      "registerart": "VR",
      "company_name": "Förderverein zur Früherkennung von Nierenerkrankungen",
      "company_seat": "Wiesbaden",
      "details": "01.07.2025 (Bekanntmachungsdatum)\n\nHessen Amtsgericht Wiesbaden VR 3202\nLöschungsankündigung 01.07.2025 (Eintragungsdatum)\n\nFörderverein zur Früherkennung von Nierenerkrankungen\neingetragener Verein\nWiesbaden\n\nDer Verein ist aufgelöst."
    },
    {
      "date": "2025-07-01",
      "id": "114189",
      "original_text": "Registerbekanntmachung nach dem Umwandlungsgesetz\nHessen Amtsgericht Hanau HRB 93344\nMeßmatic Verwaltungs-GmbH – Schöneck",
      "type": "Registerbekanntmachung nach dem Umwandlungsgesetz",
      "state": "Hessen",
      "amtsgericht": "Amtsgericht Hanau",
      "registernummer": "HRB 93344",
      "registerart": "HRB",
      "company_name": "Meßmatic Verwaltungs-GmbH",
      "company_seat": "Schöneck",
      "details": "01.07.2025 (Bekanntmachungsdatum)\n\nHessen Amtsgericht Hanau HRB 93344\nRegisterbekanntmachung nach dem Umwandlungsgesetz 01.07.2025 (Eintragungsdatum)\n\nMeßmatic Verwaltungs-GmbH\nGesellschaft mit beschränkter Haftung\nSchöneck\n\nDen Gläubigern der an der Verschmelzung beteiligten Rechtsträger ist, wenn sie binnen sechs Monaten nach dem Tag, an dem die Eintragung der Verschmelzung in das Register des Sitzes desjenigen Rechtsträgers, dessen Gläubiger sie sind, nach § 19 Absatz 3 UmwG bekannt gemacht worden ist, ihren Anspruch nach Grund und Höhe schriftlich anmelden, Sicherheit zu leisten, soweit sie nicht Befriedigung verlangen können. Dieses Recht steht den Gläubigern jedoch nur zu, wenn sie glaubhaft machen, dass durch die Verschmelzung die Erfüllung ihrer Forderung gefährdet wird."
    },
    {
      "date": "2025-07-01",
      "id": "114190",
      "original_text": "Registerbekanntmachung nach dem Umwandlungsgesetz\nHessen Amtsgericht Wiesbaden HRB 35886\nEasyRent 24 GmbH – Hochheim am Main",
      "type": "Registerbekanntmachung nach dem Umwandlungsgesetz",
      "state": "Hessen",
      "amtsgericht": "Amtsgericht Wiesbaden",
      "registernummer": "HRB 35886",
      "registerart": "HRB",
      "company_name": "EasyRent 24 GmbH",
      "company_seat": "Hochheim am Main",
      "details": "01.07.2025 (Bekanntmachungsdatum)\n\nHessen Amtsgericht Wiesbaden HRB 35886\nRegisterbekanntmachung nach dem Umwandlungsgesetz 01.07.2025 (Eintragungsdatum)\n\nEasyRent 24 GmbH\nGesellschaft mit beschränkter Haftung\nHochheim am Main\n\nDen Gläubigern der an der formwechselnden Umwandlung beteiligten Rechtsträger ist, wenn sie binnen sechs Monaten nach dem Tag, an dem die Eintragung der formwechselnden Umwandlung in das Register des Sitzes derjenigen Rechtsträger deren Gläubiger sie sind, nach § 201 UmwG bekannt gemacht worden ist, ihren Anspruch nach Grund und Höhe schriftlich anmelden, Sicherheit zu leisten, soweit sie nicht Befriedigung verlangen können. Dieses Recht steht den Gläubigern jedoch nur zu, wenn sie glaubhaft machen, dass durch die formwechselnden Umwandlung die Erfüllung ihrer Forderung gefährdet wird."
    },
    {
      "date": "2025-07-01",
      "id": "114191",
      "original_text": "Löschungsankündigung\nHessen Amtsgericht Offenbach am Main HRB 46373\nRaab Hausbau GmbH – Mühlheim am Main",
      "type": "Löschungsankündigung",
      "state": "Hessen",
      "amtsgericht": "Amtsgericht Offenbach am Main",
      "registernummer": "HRB 46373",
      "registerart": "HRB",
      "company_name": "Raab Hausbau GmbH",
      "company_seat": "Mühlheim am Main",
      "details": "01.07.2025 (Bekanntmachungsdatum)\n\nHessen Amtsgericht Offenbach am Main HRB 46373\nLöschungsankündigung\n\nRaab Hausbau GmbH\nGesellschaft mit beschränkter Haftung\nMühlheim am Main\n\nDas Registergericht beabsichtigt die im Handelsregister eingetragene Gesellschaft von Amts wegen nach § 394 FamFG zu löschen. Die Frist zur Erhebung eines Widerspruchs gegen die beabsichtigte Löschung wird auf 3 Monate festgesetzt."
    },
    {
      "date": "2025-07-01",
      "id": "114192",
      "original_text": "Einreichung neuer Dokumente\nHessen Amtsgericht Bad Hersfeld HRB 2297\nBKK Akademie GmbH – Rotenburg a. d. Fulda",
      "type": "Einreichung neuer Dokumente",
      "state": "Hessen",
      "amtsgericht": "Amtsgericht Bad Hersfeld",
      "registernummer": "HRB 2297",
      "registerart": "HRB",
      "company_name": "BKK Akademie GmbH",
      "company_seat": "Rotenburg a. d. Fulda",
      "details": "01.07.2025 (Bekanntmachungsdatum)\n\nHessen Amtsgericht Bad Hersfeld HRB 2297\nEinreichung neuer Dokumente 01.07.2025 (Eintragungsdatum)\n\nBKK Akademie GmbH\nGesellschaft mit beschränkter Haftung\nRotenburg a. d. Fulda\n\nDurch eine Änderung in den Personen der Aufsichtsratsmitglieder ist eine Liste der Mitglieder des Aufsichtsrates zum Handelsregister eingereicht worden."
    },
    {
      "date": "2025-07-01",
      "id": "114193",
      "original_text": "Registerbekanntmachung nach dem Umwandlungsgesetz\nHessen Amtsgericht Frankfurt am Main HRB 83867\nAdrett Immobilienleasing GmbH – Eschborn",
      "type": "Registerbekanntmachung nach dem Umwandlungsgesetz",
      "state": "Hessen",
      "amtsgericht": "Amtsgericht Frankfurt am Main",
      "registernummer": "HRB 83867",
      "registerart": "HRB",
      "company_name": "Adrett Immobilienleasing GmbH",
      "company_seat": "Eschborn",
      "details": "01.07.2025 (Bekanntmachungsdatum)\n\nHessen Amtsgericht Frankfurt am Main HRB 83867\nRegisterbekanntmachung nach dem Umwandlungsgesetz 01.07.2025 (Eintragungsdatum)\n\nAdrett Immobilienleasing GmbH\nGesellschaft mit beschränkter Haftung\nEschborn\n\nDen Gläubigern der an der Verschmelzung beteiligten Rechtsträger ist, wenn sie binnen sechs Monaten nach dem Tag, an dem die Eintragung der Verschmelzung in das Register des Sitzes desjenigen Rechtsträgers, dessen Gläubiger sie sind, nach § 19 Absatz 3 UmwG bekannt gemacht worden ist, ihren Anspruch nach Grund und Höhe schriftlich anmelden, Sicherheit zu leisten, soweit sie nicht Befriedigung verlangen können. Dieses Recht steht den Gläubigern jedoch nur zu, wenn sie glaubhaft machen, dass durch die Verschmelzung die Erfüllung ihrer Forderung gefährdet wird."
    }
  ]
}