{
  "date": "2025-07-19",
  "date_of_scrape": "2025-08-26T14:16:01.414Z",
  "tool_version": "0.2.0",
  "number_of_announcements": 36,
  "announcements": [
    {
      "date": "2025-07-19",
      "id": "116688",
      "original_text": "Registerbekanntmachung nach dem Umwandlungsgesetz\nBayern Amtsgericht Nürnberg HRB 16993\nZimmerei Regnath GmbH – Freystadt",
      "type": "Registerbekanntmachung nach dem Umwandlungsgesetz",
      "state": "Bayern",
      "amtsgericht": "Amtsgericht Nürnberg",
      "registernummer": "HRB 16993",
      "registerart": "HRB",
      "company_name": "Zimmerei Regnath GmbH",
      "company_seat": "Freystadt",
      "details": "19.07.2025 (Bekanntmachungsdatum)\n\nBayern Amtsgericht Nürnberg HRB 16993\nRegisterbekanntmachung nach dem Umwandlungsgesetz 18.07.2025 (Eintragungsdatum)\n\nZimmerei Regnath GmbH\nGesellschaft mit beschränkter Haftung\nFreystadt\n\nDen Gläubigern der an der Verschmelzung beteiligten Rechtsträger ist, wenn sie binnen sechs Monaten nach dem Tag, an dem die Eintragung der Verschmelzung in das Register des Sitzes desjenigen Rechtsträgers, dessen Gläubiger sie sind, nach § 19 Abs. 3 UmwG als bekannt gemacht gilt, ihren Anspruch nach Grund und Höhe in Textform anmelden, Sicherheit zu leisten, soweit sie nicht Befriedigung verlangen können. Dieses Recht steht den Gläubigern jedoch nur zu, wenn sie glaubhaft machen, dass durch die Verschmelzung die Erfüllung ihrer Forderung gefährdet wird."
    },
    {
      "date": "2025-07-19",
      "id": "116689",
      "original_text": "Registerbekanntmachung nach dem Umwandlungsgesetz\nBayern Amtsgericht Würzburg HRA 8981\nSteffen Tobsch e.K. – Neubrunn",
      "type": "Registerbekanntmachung nach dem Umwandlungsgesetz",
      "state": "Bayern",
      "amtsgericht": "Amtsgericht Würzburg",
      "registernummer": "HRA 8981",
      "registerart": "HRA",
      "company_name": "Steffen Tobsch e.K.",
      "company_seat": "Neubrunn",
      "details": "19.07.2025 (Bekanntmachungsdatum)\n\nBayern Amtsgericht Würzburg HRA 8981\nRegisterbekanntmachung nach dem Umwandlungsgesetz 18.07.2025 (Eintragungsdatum)\n\nSteffen Tobsch e.K.\nEinzelkaufmann / Einzelkauffrau\nNeubrunn\n\nDen Gläubigern der an der Ausgliederung beteiligten Rechtsträger ist, wenn sie binnen sechs Monaten nach dem Tag, an dem die Eintragung der Ausgliederung in das Register des Sitzes desjenigen Rechtsträgers, dessen Gläubiger sie sind, nach §§ 125, 19 Abs. 3 UmwG als bekannt gemacht gilt, ihren Anspruch nach Grund und Höhe in Textform anmelden, Sicherheit zu leisten, soweit sie nicht Befriedigung verlangen können. Dieses Recht steht den Gläubigern jedoch nur zu, wenn sie glaubhaft machen, dass durch die Ausgliederung die Erfüllung ihrer Forderung gefährdet wird."
    },
    {
      "date": "2025-07-19",
      "id": "116690",
      "original_text": "Einreichung neuer Dokumente\nBayern Amtsgericht München HRB 764\nMünchener VEREIN Krankenversicherung a. G. – München",
      "type": "Einreichung neuer Dokumente",
      "state": "Bayern",
      "amtsgericht": "Amtsgericht München",
      "registernummer": "HRB 764",
      "registerart": "HRB",
      "company_name": "Münchener VEREIN Krankenversicherung a. G.",
      "company_seat": "München",
      "details": "19.07.2025 (Bekanntmachungsdatum)\n\nBayern Amtsgericht München HRB 764\nEinreichung neuer Dokumente\n\nMünchener VEREIN Krankenversicherung a. G.\nVersicherungsverein auf Gegenseitigkeit\nMünchen\n\nDem Amtsgericht München -Registergericht- ist eine Liste der Mitglieder des Aufsichtsrats eingereicht worden, §§ 189 Abs. 3 Satz 1 VAG, 106 AktG."
    },
    {
      "date": "2025-07-19",
      "id": "116691",
      "original_text": "Registerbekanntmachung nach dem Umwandlungsgesetz\nBayern Amtsgericht Aschaffenburg HRB 9963\nLinde Material Handling GmbH – Aschaffenburg",
      "type": "Registerbekanntmachung nach dem Umwandlungsgesetz",
      "state": "Bayern",
      "amtsgericht": "Amtsgericht Aschaffenburg",
      "registernummer": "HRB 9963",
      "registerart": "HRB",
      "company_name": "Linde Material Handling GmbH",
      "company_seat": "Aschaffenburg",
      "details": "19.07.2025 (Bekanntmachungsdatum)\n\nBayern Amtsgericht Aschaffenburg HRB 9963\nRegisterbekanntmachung nach dem Umwandlungsgesetz 18.07.2025 (Eintragungsdatum)\n\nLinde Material Handling GmbH\nGesellschaft mit beschränkter Haftung\nAschaffenburg\n\nDen Gläubigern der an der Verschmelzung beteiligten Rechtsträger ist, wenn sie binnen sechs Monaten nach dem Tag, an dem die Eintragung der Verschmelzung in das Register des Sitzes desjenigen Rechtsträgers, dessen Gläubiger sie sind, nach § 19 Abs. 3 UmwG als bekannt gemacht gilt, ihren Anspruch nach Grund und Höhe in Textform anmelden, Sicherheit zu leisten, soweit sie nicht Befriedigung verlangen können. Dieses Recht steht den Gläubigern jedoch nur zu, wenn sie glaubhaft machen, dass durch die Verschmelzung die Erfüllung ihrer Forderung gefährdet wird."
    },
    {
      "date": "2025-07-19",
      "id": "116692",
      "original_text": "Einreichung neuer Dokumente\nBayern Amtsgericht München HRB 211154\nMÜNCHENER VEREIN Lebensversicherung AG – München",
      "type": "Einreichung neuer Dokumente",
      "state": "Bayern",
      "amtsgericht": "Amtsgericht München",
      "registernummer": "HRB 211154",
      "registerart": "HRB",
      "company_name": "MÜNCHENER VEREIN Lebensversicherung AG",
      "company_seat": "München",
      "details": "19.07.2025 (Bekanntmachungsdatum)\n\nBayern Amtsgericht München HRB 211154\nEinreichung neuer Dokumente\n\nMÜNCHENER VEREIN Lebensversicherung AG\nAktiengesellschaft\nMünchen\n\nDem Amtsgericht München -Registergericht- ist eine Liste der Mitglieder des Aufsichtsrats eingereicht worden, § 106 AktG."
    },
    {
      "date": "2025-07-19",
      "id": "116693",
      "original_text": "Einreichung neuer Dokumente\nBayern Amtsgericht München HRB 178011\nTeleservice AG – München",
      "type": "Einreichung neuer Dokumente",
      "state": "Bayern",
      "amtsgericht": "Amtsgericht München",
      "registernummer": "HRB 178011",
      "registerart": "HRB",
      "company_name": "Teleservice AG",
      "company_seat": "München",
      "details": "19.07.2025 (Bekanntmachungsdatum)\n\nBayern Amtsgericht München HRB 178011\nEinreichung neuer Dokumente\n\nTeleservice AG\nAktiengesellschaft\nMünchen\n\nDem Amtsgericht München -Registergericht- ist eine Liste der Mitglieder des Aufsichtsrats eingereicht worden, § 106 AktG."
    },
    {
      "date": "2025-07-19",
      "id": "116694",
      "original_text": "Registerbekanntmachung nach dem Umwandlungsgesetz\nBayern Amtsgericht München HRB 135389\nINTARIA AG Wirtschaftsprüfungsgesellschaft Steuerberatungsgesellschaft – München",
      "type": "Registerbekanntmachung nach dem Umwandlungsgesetz",
      "state": "Bayern",
      "amtsgericht": "Amtsgericht München",
      "registernummer": "HRB 135389",
      "registerart": "HRB",
      "company_name": "INTARIA AG Wirtschaftsprüfungsgesellschaft Steuerberatungsgesellschaft",
      "company_seat": "München",
      "details": "19.07.2025 (Bekanntmachungsdatum)\n\nBayern Amtsgericht München HRB 135389\nRegisterbekanntmachung nach dem Umwandlungsgesetz 18.07.2025 (Eintragungsdatum)\n\nINTARIA AG Wirtschaftsprüfungsgesellschaft Steuerberatungsgesellschaft\nAktiengesellschaft\nMünchen\n\nDen Gläubigern der an der Verschmelzung beteiligten Rechtsträger ist, wenn sie binnen sechs Monaten nach dem Tag, an dem die Eintragung der Verschmelzung in das Register des Sitzes desjenigen Rechtsträgers, dessen Gläubiger sie sind, nach § 19 Abs. 3 UmwG als bekannt gemacht gilt, ihren Anspruch nach Grund und Höhe in Textform anmelden, Sicherheit zu leisten, soweit sie nicht Befriedigung verlangen können. Dieses Recht steht den Gläubigern jedoch nur zu, wenn sie glaubhaft machen, dass durch die Verschmelzung die Erfüllung ihrer Forderung gefährdet wird."
    },
    {
      "date": "2025-07-19",
      "id": "116695",
      "original_text": "Registerbekanntmachung nach dem Umwandlungsgesetz\nBayern Amtsgericht München HRB 270508\nDataCraft GmbH – München",
      "type": "Registerbekanntmachung nach dem Umwandlungsgesetz",
      "state": "Bayern",
      "amtsgericht": "Amtsgericht München",
      "registernummer": "HRB 270508",
      "registerart": "HRB",
      "company_name": "DataCraft GmbH",
      "company_seat": "München",
      "details": "19.07.2025 (Bekanntmachungsdatum)\n\nBayern Amtsgericht München HRB 270508\nRegisterbekanntmachung nach dem Umwandlungsgesetz 18.07.2025 (Eintragungsdatum)\n\nDataCraft GmbH\nGesellschaft mit beschränkter Haftung\nMünchen\n\nDen Gläubigern der an der Verschmelzung beteiligten Rechtsträger ist, wenn sie binnen sechs Monaten nach dem Tag, an dem die Eintragung der Verschmelzung in das Register des Sitzes desjenigen Rechtsträgers, dessen Gläubiger sie sind, nach § 19 Abs. 3 UmwG als bekannt gemacht gilt, ihren Anspruch nach Grund und Höhe in Textform anmelden, Sicherheit zu leisten, soweit sie nicht Befriedigung verlangen können. Dieses Recht steht den Gläubigern jedoch nur zu, wenn sie glaubhaft machen, dass durch die Verschmelzung die Erfüllung ihrer Forderung gefährdet wird."
    },
    {
      "date": "2025-07-19",
      "id": "116696",
      "original_text": "Registerbekanntmachung nach dem Umwandlungsgesetz\nBayern Amtsgericht München HRB 220006\nAmadeus IT Services GmbH – Erding",
      "type": "Registerbekanntmachung nach dem Umwandlungsgesetz",
      "state": "Bayern",
      "amtsgericht": "Amtsgericht München",
      "registernummer": "HRB 220006",
      "registerart": "HRB",
      "company_name": "Amadeus IT Services GmbH",
      "company_seat": "Erding",
      "details": "19.07.2025 (Bekanntmachungsdatum)\n\nBayern Amtsgericht München HRB 220006\nRegisterbekanntmachung nach dem Umwandlungsgesetz 18.07.2025 (Eintragungsdatum)\n\nAmadeus IT Services GmbH\nGesellschaft mit beschränkter Haftung\nErding\n\nDen Gläubigern der an der Verschmelzung beteiligten Rechtsträger ist, wenn sie binnen sechs Monaten nach dem Tag, an dem die Eintragung der Verschmelzung in das Register des Sitzes desjenigen Rechtsträgers, dessen Gläubiger sie sind, nach § 19 Abs. 3 UmwG als bekannt gemacht gilt, ihren Anspruch nach Grund und Höhe in Textform anmelden, Sicherheit zu leisten, soweit sie nicht Befriedigung verlangen können. Dieses Recht steht den Gläubigern jedoch nur zu, wenn sie glaubhaft machen, dass durch die Verschmelzung die Erfüllung ihrer Forderung gefährdet wird."
    },
    {
      "date": "2025-07-19",
      "id": "116697",
      "original_text": "Registerbekanntmachung nach dem Umwandlungsgesetz\nBayern Amtsgericht Deggendorf HRB 610\nGenoVersicherungsService GmbH – Viechtach",
      "type": "Registerbekanntmachung nach dem Umwandlungsgesetz",
      "state": "Bayern",
      "amtsgericht": "Amtsgericht Deggendorf",
      "registernummer": "HRB 610",
      "registerart": "HRB",
      "company_name": "GenoVersicherungsService GmbH",
      "company_seat": "Viechtach",
      "details": "19.07.2025 (Bekanntmachungsdatum)\n\nBayern Amtsgericht Deggendorf HRB 610\nRegisterbekanntmachung nach dem Umwandlungsgesetz 18.07.2025 (Eintragungsdatum)\n\nGenoVersicherungsService GmbH\nGesellschaft mit beschränkter Haftung\nViechtach\n\nDen Gläubigern der an der Verschmelzung beteiligten Rechtsträger ist, wenn sie binnen sechs Monaten nach dem Tag, an dem die Eintragung der Verschmelzung in das Register des Sitzes desjenigen Rechtsträgers, dessen Gläubiger sie sind, nach § 19 Abs. 3 UmwG als bekannt gemacht gilt, ihren Anspruch nach Grund und Höhe in Textform anmelden, Sicherheit zu leisten, soweit sie nicht Befriedigung verlangen können. Dieses Recht steht den Gläubigern jedoch nur zu, wenn sie glaubhaft machen, dass durch die Verschmelzung die Erfüllung ihrer Forderung gefährdet wird."
    },
    {
      "date": "2025-07-19",
      "id": "116698",
      "original_text": "Registerbekanntmachung nach dem Umwandlungsgesetz\nBayern Amtsgericht München HRB 232821\nOtto LSE Holding GmbH – München",
      "type": "Registerbekanntmachung nach dem Umwandlungsgesetz",
      "state": "Bayern",
      "amtsgericht": "Amtsgericht München",
      "registernummer": "HRB 232821",
      "registerart": "HRB",
      "company_name": "Otto LSE Holding GmbH",
      "company_seat": "München",
      "details": "19.07.2025 (Bekanntmachungsdatum)\n\nBayern Amtsgericht München HRB 232821\nRegisterbekanntmachung nach dem Umwandlungsgesetz 18.07.2025 (Eintragungsdatum)\n\nOtto LSE Holding GmbH\nGesellschaft mit beschränkter Haftung\nMünchen\n\nDen Gläubigern der an der Verschmelzung beteiligten Rechtsträger ist, wenn sie binnen sechs Monaten nach dem Tag, an dem die Eintragung der Verschmelzung in das Register des Sitzes desjenigen Rechtsträgers, dessen Gläubiger sie sind, nach § 19 Abs. 3 UmwG als bekannt gemacht gilt, ihren Anspruch nach Grund und Höhe in Textform anmelden, Sicherheit zu leisten, soweit sie nicht Befriedigung verlangen können. Dieses Recht steht den Gläubigern jedoch nur zu, wenn sie glaubhaft machen, dass durch die Verschmelzung die Erfüllung ihrer Forderung gefährdet wird."
    },
    {
      "date": "2025-07-19",
      "id": "116699",
      "original_text": "Registerbekanntmachung nach dem Umwandlungsgesetz\nBayern Amtsgericht München HRB 285837\nRuhrgebiets Immobilien Verwaltungs GmbH – Rottach-Egern",
      "type": "Registerbekanntmachung nach dem Umwandlungsgesetz",
      "state": "Bayern",
      "amtsgericht": "Amtsgericht München",
      "registernummer": "HRB 285837",
      "registerart": "HRB",
      "company_name": "Ruhrgebiets Immobilien Verwaltungs GmbH",
      "company_seat": "Rottach-Egern",
      "details": "19.07.2025 (Bekanntmachungsdatum)\n\nBayern Amtsgericht München HRB 285837\nRegisterbekanntmachung nach dem Umwandlungsgesetz 18.07.2025 (Eintragungsdatum)\n\nRuhrgebiets Immobilien Verwaltungs GmbH\nGesellschaft mit beschränkter Haftung\nRottach-Egern\n\nDen Gläubigern der an der Verschmelzung beteiligten Rechtsträger ist, wenn sie binnen sechs Monaten nach dem Tag, an dem die Eintragung der Verschmelzung in das Register des Sitzes desjenigen Rechtsträgers, dessen Gläubiger sie sind, nach § 19 Abs. 3 UmwG als bekannt gemacht gilt, ihren Anspruch nach Grund und Höhe in Textform anmelden, Sicherheit zu leisten, soweit sie nicht Befriedigung verlangen können. Dieses Recht steht den Gläubigern jedoch nur zu, wenn sie glaubhaft machen, dass durch die Verschmelzung die Erfüllung ihrer Forderung gefährdet wird."
    },
    {
      "date": "2025-07-19",
      "id": "116700",
      "original_text": "Registerbekanntmachung nach dem Umwandlungsgesetz\nBayern Amtsgericht Deggendorf GnR 37\nVR GenoBank DonauWald eG – Viechtach",
      "type": "Registerbekanntmachung nach dem Umwandlungsgesetz",
      "state": "Bayern",
      "amtsgericht": "Amtsgericht Deggendorf",
      "registernummer": "GnR 37",
      "registerart": "GnR",
      "company_name": "VR GenoBank DonauWald eG",
      "company_seat": "Viechtach",
      "details": "19.07.2025 (Bekanntmachungsdatum)\n\nBayern Amtsgericht Deggendorf GnR 37\nRegisterbekanntmachung nach dem Umwandlungsgesetz 18.07.2025 (Eintragungsdatum)\n\nVR GenoBank DonauWald eG\neingetragene Genossenschaft\nViechtach\n\nDen Gläubigern der an der Verschmelzung beteiligten Rechtsträger ist, wenn sie binnen sechs Monaten nach dem Tag, an dem die Eintragung der Verschmelzung in das Register des Sitzes desjenigen Rechtsträgers, dessen Gläubiger sie sind, nach § 19 Abs. 3 UmwG als bekannt gemacht gilt, ihren Anspruch nach Grund und Höhe in Textform anmelden, Sicherheit zu leisten, soweit sie nicht Befriedigung verlangen können. Dieses Recht steht den Gläubigern jedoch nur zu, wenn sie glaubhaft machen, dass durch die Verschmelzung die Erfüllung ihrer Forderung gefährdet wird."
    },
    {
      "date": "2025-07-19",
      "id": "116701",
      "original_text": "Einreichung neuer Dokumente\nBayern Amtsgericht Augsburg HRB 37716\nPATRIZIA SE – Augsburg",
      "type": "Einreichung neuer Dokumente",
      "state": "Bayern",
      "amtsgericht": "Amtsgericht Augsburg",
      "registernummer": "HRB 37716",
      "registerart": "HRB",
      "company_name": "PATRIZIA SE",
      "company_seat": "Augsburg",
      "details": "19.07.2025 (Bekanntmachungsdatum)\n\nBayern Amtsgericht Augsburg HRB 37716\nEinreichung neuer Dokumente 18.07.2025 (Eintragungsdatum)\n\nPATRIZIA SE\nEuropäische Aktiengesellschaft (SE)\nAugsburg\n\nDem Amtsgericht Augsburg -Registergericht- ist eine Liste der Mitglieder des Veraltungsrats eingereicht worden, Art. 9 Abs. 1 Buchst. c (ii) SE-VO i.V.m. § 46 SEAG."
    },
    {
      "date": "2025-07-19",
      "id": "116702",
      "original_text": "Löschungsankündigung\nBayern Amtsgericht Landshut HRB 12684\nFEROLIN GmbH – Weihmichl",
      "type": "Löschungsankündigung",
      "state": "Bayern",
      "amtsgericht": "Amtsgericht Landshut",
      "registernummer": "HRB 12684",
      "registerart": "HRB",
      "company_name": "FEROLIN GmbH",
      "company_seat": "Weihmichl",
      "details": "19.07.2025 (Bekanntmachungsdatum)\n\nBayern Amtsgericht Landshut HRB 12684\nLöschungsankündigung\n\nFEROLIN GmbH\nGesellschaft mit beschränkter Haftung\nWeihmichl\n\nDas Registergericht beabsichtigt, die im Handelsregister eingetragene Gesellschaft wegen Vermögenslosigkeit von Amts wegen nach § 394 FamFG zu löschen. Die Frist zur Erhebung eines Widerspruchs ist auf einen Monat festgesetzt."
    },
    {
      "date": "2025-07-19",
      "id": "116703",
      "original_text": "Registerbekanntmachung nach dem Umwandlungsgesetz\nBayern Amtsgericht München HRB 89701\nHRS-Beteiligungstreuhand GmbH – München",
      "type": "Registerbekanntmachung nach dem Umwandlungsgesetz",
      "state": "Bayern",
      "amtsgericht": "Amtsgericht München",
      "registernummer": "HRB 89701",
      "registerart": "HRB",
      "company_name": "HRS-Beteiligungstreuhand GmbH",
      "company_seat": "München",
      "details": "19.07.2025 (Bekanntmachungsdatum)\n\nBayern Amtsgericht München HRB 89701\nRegisterbekanntmachung nach dem Umwandlungsgesetz 18.07.2025 (Eintragungsdatum)\n\nHRS-Beteiligungstreuhand GmbH\nGesellschaft mit beschränkter Haftung\nMünchen\n\nDen Gläubigern der an der Verschmelzung beteiligten Rechtsträger ist, wenn sie binnen sechs Monaten nach dem Tag, an dem die Eintragung der Verschmelzung in das Register des Sitzes desjenigen Rechtsträgers, dessen Gläubiger sie sind, nach § 19 Abs. 3 UmwG als bekannt gemacht gilt, ihren Anspruch nach Grund und Höhe in Textform anmelden, Sicherheit zu leisten, soweit sie nicht Befriedigung verlangen können. Dieses Recht steht den Gläubigern jedoch nur zu, wenn sie glaubhaft machen, dass durch die Verschmelzung die Erfüllung ihrer Forderung gefährdet wird."
    },
    {
      "date": "2025-07-19",
      "id": "116704",
      "original_text": "Registerbekanntmachung nach dem Umwandlungsgesetz\nBayern Amtsgericht München HRB 227309\nSafety & Technical Supplies Holding GmbH – München",
      "type": "Registerbekanntmachung nach dem Umwandlungsgesetz",
      "state": "Bayern",
      "amtsgericht": "Amtsgericht München",
      "registernummer": "HRB 227309",
      "registerart": "HRB",
      "company_name": "Safety & Technical Supplies Holding GmbH",
      "company_seat": "München",
      "details": "19.07.2025 (Bekanntmachungsdatum)\n\nBayern Amtsgericht München HRB 227309\nRegisterbekanntmachung nach dem Umwandlungsgesetz\n\nSafety & Technical Supplies Holding GmbH\nGesellschaft mit beschränkter Haftung\nMünchen\n\nVeröffentlichung vom 14.7.2025 ergänzt:\n\nEs wird darauf hingewiesen, dass ein Verschmelzungsplan oder sein Entwurf über eine grenzüberschreitende Verschmelzung zur Aufnahme mit der Chase (Investment) II Luxembourg S.à r.l., mit Sitz in Großherzogtum Luxemburg/Luxemburg (Registre de commerce et des sociétés B294019) (société à responsabilité limitée - Gesellschaft mit beschränkter Haftung  nach luxemburgischem Recht) beim Handelsregister eingereicht worden ist.\nDie Anteilsinhaber, die Gläubiger sowie die zuständigen Betriebsräte der an der grenzüberschreitenden Verschmelzung beteiligten Gesellschaften oder, soweit es keinen Betriebsrat gibt, die Arbeitnehmer der an der grenzüberschreitenden Verschmelzung beteiligten Gesellschaften, können der jeweiligen Gesellschaft  ( unter info@stsgroup.info oder postalisch an die Anschrift der Gesellschaft am Promenadeplatz 12, c/o TLI Steuerberater PartG mbB, 80333 München, Deutschland) spätestens fünf Arbeitstage vor dem Tag der Gesellschafterversammlung (21.8.2025)  Bemerkungen zum Verschmelzungsplan  übermitteln."
    },
    {
      "date": "2025-07-19",
      "id": "116705",
      "original_text": "Löschungsankündigung\nBayern Amtsgericht München HRB 194226\nBau Cap GmbH – München",
      "type": "Löschungsankündigung",
      "state": "Bayern",
      "amtsgericht": "Amtsgericht München",
      "registernummer": "HRB 194226",
      "registerart": "HRB",
      "company_name": "Bau Cap GmbH",
      "company_seat": "München",
      "details": "19.07.2025 (Bekanntmachungsdatum)\n\nBayern Amtsgericht München HRB 194226\nLöschungsankündigung\n\nBau Cap GmbH\nGesellschaft mit beschränkter Haftung\nMünchen\n\nDas Registergericht beabsichtigt, die im Handelsregister eingetragene Gesellschaft wegen Vermögenslosigkeit von Amts wegen nach § 394 FamFG zu löschen. Die Frist zur Erhebung eines Widerspruchs ist auf drei Monate festgesetzt."
    },
    {
      "date": "2025-07-19",
      "id": "116706",
      "original_text": "Registerbekanntmachung nach dem Umwandlungsgesetz\nBayern Amtsgericht Aschaffenburg HRB 17185\nSPIE ELMOBIS GmbH – Niedernberg",
      "type": "Registerbekanntmachung nach dem Umwandlungsgesetz",
      "state": "Bayern",
      "amtsgericht": "Amtsgericht Aschaffenburg",
      "registernummer": "HRB 17185",
      "registerart": "HRB",
      "company_name": "SPIE ELMOBIS GmbH",
      "company_seat": "Niedernberg",
      "details": "19.07.2025 (Bekanntmachungsdatum)\n\nBayern Amtsgericht Aschaffenburg HRB 17185\nRegisterbekanntmachung nach dem Umwandlungsgesetz 18.07.2025 (Eintragungsdatum)\n\nSPIE ELMOBIS GmbH\nGesellschaft mit beschränkter Haftung\nNiedernberg\n\nDen Gläubigern der an der Verschmelzung beteiligten Rechtsträger ist, wenn sie binnen sechs Monaten nach dem Tag, an dem die Eintragung der Verschmelzung in das Register des Sitzes desjenigen Rechtsträgers, dessen Gläubiger sie sind, nach § 19 Abs. 3 UmwG als bekannt gemacht gilt, ihren Anspruch nach Grund und Höhe in Textform anmelden, Sicherheit zu leisten, soweit sie nicht Befriedigung verlangen können. Dieses Recht steht den Gläubigern jedoch nur zu, wenn sie glaubhaft machen, dass durch die Verschmelzung die Erfüllung ihrer Forderung gefährdet wird."
    },
    {
      "date": "2025-07-19",
      "id": "116707",
      "original_text": "Registerbekanntmachung nach dem Umwandlungsgesetz\nBayern Amtsgericht Bamberg HRB 4784\nGuck Verwaltungs-GmbH – Hallstadt",
      "type": "Registerbekanntmachung nach dem Umwandlungsgesetz",
      "state": "Bayern",
      "amtsgericht": "Amtsgericht Bamberg",
      "registernummer": "HRB 4784",
      "registerart": "HRB",
      "company_name": "Guck Verwaltungs-GmbH",
      "company_seat": "Hallstadt",
      "details": "19.07.2025 (Bekanntmachungsdatum)\n\nBayern Amtsgericht Bamberg HRB 4784\nRegisterbekanntmachung nach dem Umwandlungsgesetz 18.07.2025 (Eintragungsdatum)\n\nGuck Verwaltungs-GmbH\nGesellschaft mit beschränkter Haftung\nHallstadt\n\nDen Gläubigern der an der Verschmelzung beteiligten Rechtsträger ist, wenn sie binnen sechs Monaten nach dem Tag, an dem die Eintragung der Verschmelzung in das Register des Sitzes desjenigen Rechtsträgers, dessen Gläubiger sie sind, nach § 19 Abs. 3 UmwG als bekannt gemacht gilt, ihren Anspruch nach Grund und Höhe in Textform anmelden, Sicherheit zu leisten, soweit sie nicht Befriedigung verlangen können. Dieses Recht steht den Gläubigern jedoch nur zu, wenn sie glaubhaft machen, dass durch die Verschmelzung die Erfüllung ihrer Forderung gefährdet wird."
    },
    {
      "date": "2025-07-19",
      "id": "116708",
      "original_text": "Einreichung neuer Dokumente\nBayern Amtsgericht Nürnberg HRB 8616\nOmnibusverkehr Franken GmbH (OVF) – Nürnberg",
      "type": "Einreichung neuer Dokumente",
      "state": "Bayern",
      "amtsgericht": "Amtsgericht Nürnberg",
      "registernummer": "HRB 8616",
      "registerart": "HRB",
      "company_name": "Omnibusverkehr Franken GmbH (OVF)",
      "company_seat": "Nürnberg",
      "details": "19.07.2025 (Bekanntmachungsdatum)\n\nBayern Amtsgericht Nürnberg HRB 8616\nEinreichung neuer Dokumente 18.07.2025 (Eintragungsdatum)\n\nOmnibusverkehr Franken GmbH (OVF)\nGesellschaft mit beschränkter Haftung\nNürnberg\n\nDem Amtsgericht Nürnberg -Registergericht- ist eine Liste der Mitglieder des Aufsichtsrats eingereicht worden, § 52 Abs. 3 S. 2 GmbHG."
    },
    {
      "date": "2025-07-19",
      "id": "116709",
      "original_text": "Löschungsankündigung\nBayern Amtsgericht München HRB 201926\nBZ Foods SE – München",
      "type": "Löschungsankündigung",
      "state": "Bayern",
      "amtsgericht": "Amtsgericht München",
      "registernummer": "HRB 201926",
      "registerart": "HRB",
      "company_name": "BZ Foods SE",
      "company_seat": "München",
      "details": "19.07.2025 (Bekanntmachungsdatum)\n\nBayern Amtsgericht München HRB 201926\nLöschungsankündigung\n\nBZ Foods SE\nEuropäische Aktiengesellschaft (SE)\nMünchen\n\nDas Registergericht beabsichtigt, die im Handelsregister eingetragene Gesellschaft wegen Vermögenslosigkeit von Amts wegen nach § 394 FamFG zu löschen. Die Frist zur Erhebung eines Widerspruchs ist auf drei Monate festgesetzt."
    },
    {
      "date": "2025-07-19",
      "id": "116710",
      "original_text": "Registerbekanntmachung nach dem Umwandlungsgesetz\nBayern Amtsgericht München HRB 195519\nmehappy GmbH – München",
      "type": "Registerbekanntmachung nach dem Umwandlungsgesetz",
      "state": "Bayern",
      "amtsgericht": "Amtsgericht München",
      "registernummer": "HRB 195519",
      "registerart": "HRB",
      "company_name": "mehappy GmbH",
      "company_seat": "München",
      "details": "19.07.2025 (Bekanntmachungsdatum)\n\nBayern Amtsgericht München HRB 195519\nRegisterbekanntmachung nach dem Umwandlungsgesetz 18.07.2025 (Eintragungsdatum)\n\nmehappy GmbH\nGesellschaft mit beschränkter Haftung\nMünchen\n\nDen Gläubigern der an der Verschmelzung beteiligten Rechtsträger ist, wenn sie binnen sechs Monaten nach dem Tag, an dem die Eintragung der Verschmelzung in das Register des Sitzes desjenigen Rechtsträgers, dessen Gläubiger sie sind, nach § 19 Abs. 3 UmwG als bekannt gemacht gilt, ihren Anspruch nach Grund und Höhe in Textform anmelden, Sicherheit zu leisten, soweit sie nicht Befriedigung verlangen können. Dieses Recht steht den Gläubigern jedoch nur zu, wenn sie glaubhaft machen, dass durch die Verschmelzung die Erfüllung ihrer Forderung gefährdet wird."
    },
    {
      "date": "2025-07-19",
      "id": "116711",
      "original_text": "Sonstige Registerbekanntmachung\nBayern Amtsgericht München HRB 244280\nNorCom Information Technology GmbH & Co. KGaA – München",
      "type": "Sonstige Registerbekanntmachung",
      "state": "Bayern",
      "amtsgericht": "Amtsgericht München",
      "registernummer": "HRB 244280",
      "registerart": "HRB",
      "company_name": "NorCom Information Technology GmbH & Co. KGaA",
      "company_seat": "München",
      "details": "19.07.2025 (Bekanntmachungsdatum)\n\nBayern Amtsgericht München HRB 244280\nSonstige Registerbekanntmachung\n\nNorCom Information Technology GmbH & Co. KGaA\nKommanditgesellschaft auf Aktien\nMünchen\n\nDem Amtsgericht München -Registergericht- isteine Liste der Mitglieder des Aufsichtsrats eingereicht worden, §§ 278 Abs. 3, 106 AktG."
    },
    {
      "date": "2025-07-19",
      "id": "116712",
      "original_text": "Registerbekanntmachung nach dem Umwandlungsgesetz\nBayern Amtsgericht Regensburg HRB 8641\nS-Refit AG – Regensburg",
      "type": "Registerbekanntmachung nach dem Umwandlungsgesetz",
      "state": "Bayern",
      "amtsgericht": "Amtsgericht Regensburg",
      "registernummer": "HRB 8641",
      "registerart": "HRB",
      "company_name": "S-Refit AG",
      "company_seat": "Regensburg",
      "details": "19.07.2025 (Bekanntmachungsdatum)\n\nBayern Amtsgericht Regensburg HRB 8641\nRegisterbekanntmachung nach dem Umwandlungsgesetz 18.07.2025 (Eintragungsdatum)\n\nS-Refit AG\nAktiengesellschaft\nRegensburg\n\nDen Gläubigern des formwechselnden Rechtsträgers ist, wenn sie binnen sechs Monaten nach dem Tag, an dem die Eintragung des Formwechsels nach § 201 UmwG als bekannt gemacht gilt, ihren Anspruch nach Grund und Höhe in Textform anmelden, Sicherheit zu leisten, soweit sie nicht Befriedigung verlangen können. Dieses Recht steht den Gläubigern jedoch nur zu, wenn sie glaubhaft machen, dass durch den Formwechsel die Erfüllung ihrer Forderung gefährdet wird."
    },
    {
      "date": "2025-07-19",
      "id": "116713",
      "original_text": "Registerbekanntmachung nach dem Umwandlungsgesetz\nBayern Amtsgericht Aschaffenburg HRB 9855\nLMH Immobilien Verwaltungs-GmbH – Aschaffenburg",
      "type": "Registerbekanntmachung nach dem Umwandlungsgesetz",
      "state": "Bayern",
      "amtsgericht": "Amtsgericht Aschaffenburg",
      "registernummer": "HRB 9855",
      "registerart": "HRB",
      "company_name": "LMH Immobilien Verwaltungs-GmbH",
      "company_seat": "Aschaffenburg",
      "details": "19.07.2025 (Bekanntmachungsdatum)\n\nBayern Amtsgericht Aschaffenburg HRB 9855\nRegisterbekanntmachung nach dem Umwandlungsgesetz 18.07.2025 (Eintragungsdatum)\n\nLMH Immobilien Verwaltungs-GmbH\nGesellschaft mit beschränkter Haftung\nAschaffenburg\n\nDen Gläubigern der an der Verschmelzung beteiligten Rechtsträger ist, wenn sie binnen sechs Monaten nach dem Tag, an dem die Eintragung der Verschmelzung in das Register des Sitzes desjenigen Rechtsträgers, dessen Gläubiger sie sind, nach § 19 Abs. 3 UmwG als bekannt gemacht gilt, ihren Anspruch nach Grund und Höhe in Textform anmelden, Sicherheit zu leisten, soweit sie nicht Befriedigung verlangen können. Dieses Recht steht den Gläubigern jedoch nur zu, wenn sie glaubhaft machen, dass durch die Verschmelzung die Erfüllung ihrer Forderung gefährdet wird."
    },
    {
      "date": "2025-07-19",
      "id": "116714",
      "original_text": "Einreichung neuer Dokumente\nBayern Amtsgericht München HRB 242375\nMutares Management SE – München",
      "type": "Einreichung neuer Dokumente",
      "state": "Bayern",
      "amtsgericht": "Amtsgericht München",
      "registernummer": "HRB 242375",
      "registerart": "HRB",
      "company_name": "Mutares Management SE",
      "company_seat": "München",
      "details": "19.07.2025 (Bekanntmachungsdatum)\n\nBayern Amtsgericht München HRB 242375\nEinreichung neuer Dokumente\n\nMutares Management SE\nEuropäische Aktiengesellschaft (SE)\nMünchen\n\nDem Amtsgericht München -Registergericht- ist eine Liste der Mitglieder des Aufsichtsrats eingereicht worden, Art. 9 Abs. 1 Buchst. c (ii) SE-VO i.V.m. § 106 AktG."
    },
    {
      "date": "2025-07-19",
      "id": "116715",
      "original_text": "Registerbekanntmachung nach dem Umwandlungsgesetz\nBayern Amtsgericht München HRB 230601\nSPIE ISW Business Services GmbH – München",
      "type": "Registerbekanntmachung nach dem Umwandlungsgesetz",
      "state": "Bayern",
      "amtsgericht": "Amtsgericht München",
      "registernummer": "HRB 230601",
      "registerart": "HRB",
      "company_name": "SPIE ISW Business Services GmbH",
      "company_seat": "München",
      "details": "19.07.2025 (Bekanntmachungsdatum)\n\nBayern Amtsgericht München HRB 230601\nRegisterbekanntmachung nach dem Umwandlungsgesetz 18.07.2025 (Eintragungsdatum)\n\nSPIE ISW Business Services GmbH\nGesellschaft mit beschränkter Haftung\nMünchen\n\nDen Gläubigern der an der Verschmelzung beteiligten Rechtsträger ist, wenn sie binnen sechs Monaten nach dem Tag, an dem die Eintragung der Verschmelzung in das Register des Sitzes desjenigen Rechtsträgers, dessen Gläubiger sie sind, nach § 19 Abs. 3 UmwG als bekannt gemacht gilt, ihren Anspruch nach Grund und Höhe in Textform anmelden, Sicherheit zu leisten, soweit sie nicht Befriedigung verlangen können. Dieses Recht steht den Gläubigern jedoch nur zu, wenn sie glaubhaft machen, dass durch die Verschmelzung die Erfüllung ihrer Forderung gefährdet wird."
    },
    {
      "date": "2025-07-19",
      "id": "116716",
      "original_text": "Sonstige Registerbekanntmachung\nBayern Amtsgericht München HRB 240850\nBurda Digital SE – München",
      "type": "Sonstige Registerbekanntmachung",
      "state": "Bayern",
      "amtsgericht": "Amtsgericht München",
      "registernummer": "HRB 240850",
      "registerart": "HRB",
      "company_name": "Burda Digital SE",
      "company_seat": "München",
      "details": "19.07.2025 (Bekanntmachungsdatum)\n\nBayern Amtsgericht München HRB 240850\nSonstige Registerbekanntmachung\n\nBurda Digital SE\nEuropäische Aktiengesellschaft (SE)\nMünchen\n\nDem #Re.Name ist eine Liste der Mitglieder des Verwaltungsrats eingereicht worden, Art. 9 Abs. 1 Buchst. c (ii) SE-VO i.V.m. § 106 AktG."
    },
    {
      "date": "2025-07-19",
      "id": "116717",
      "original_text": "Registerbekanntmachung nach dem Umwandlungsgesetz\nBayern Amtsgericht München HRA 120954\nRaffael Krag e.K. – Garching b.München",
      "type": "Registerbekanntmachung nach dem Umwandlungsgesetz",
      "state": "Bayern",
      "amtsgericht": "Amtsgericht München",
      "registernummer": "HRA 120954",
      "registerart": "HRA",
      "company_name": "Raffael Krag e.K.",
      "company_seat": "Garching b.München",
      "details": "19.07.2025 (Bekanntmachungsdatum)\n\nBayern Amtsgericht München HRA 120954\nRegisterbekanntmachung nach dem Umwandlungsgesetz 18.07.2025 (Eintragungsdatum)\n\nRaffael Krag e.K.\nEinzelkaufmann / Einzelkauffrau\nGarching b.München\n\nDen Gläubigern der an der Ausgliederung beteiligten Rechtsträger ist, wenn sie binnen sechs Monaten nach dem Tag, an dem die Eintragung der Ausgliederung in das Register des Sitzes desjenigen Rechtsträgers, dessen Gläubiger sie sind, nach §§ 125, 19 Abs. 3 UmwG als bekannt gemacht gilt, ihren Anspruch nach Grund und Höhe in Textform anmelden, Sicherheit zu leisten, soweit sie nicht Befriedigung verlangen können. Dieses Recht steht den Gläubigern jedoch nur zu, wenn sie glaubhaft machen, dass durch die Ausgliederung die Erfüllung ihrer Forderung gefährdet wird."
    },
    {
      "date": "2025-07-19",
      "id": "116718",
      "original_text": "Registerbekanntmachung nach dem Umwandlungsgesetz\nBayern Amtsgericht München HRA 120565\nRuf Immobilien GmbH & Co. KG – Kirchseeon",
      "type": "Registerbekanntmachung nach dem Umwandlungsgesetz",
      "state": "Bayern",
      "amtsgericht": "Amtsgericht München",
      "registernummer": "HRA 120565",
      "registerart": "HRA",
      "company_name": "Ruf Immobilien GmbH & Co. KG",
      "company_seat": "Kirchseeon",
      "details": "19.07.2025 (Bekanntmachungsdatum)\n\nBayern Amtsgericht München HRA 120565\nRegisterbekanntmachung nach dem Umwandlungsgesetz 18.07.2025 (Eintragungsdatum)\n\nRuf Immobilien GmbH & Co. KG\nKommanditgesellschaft\nKirchseeon\n\nDen Gläubigern der an der Ausgliederung beteiligten Rechtsträger ist, wenn sie binnen sechs Monaten nach dem Tag, an dem die Eintragung der Ausgliederung in das Register des Sitzes desjenigen Rechtsträgers, dessen Gläubiger sie sind, nach §§ 125, 19 Abs. 3 UmwG als bekannt gemacht gilt, ihren Anspruch nach Grund und Höhe in Textform anmelden, Sicherheit zu leisten, soweit sie nicht Befriedigung verlangen können. Dieses Recht steht den Gläubigern jedoch nur zu, wenn sie glaubhaft machen, dass durch die Ausgliederung die Erfüllung ihrer Forderung gefährdet wird."
    },
    {
      "date": "2025-07-19",
      "id": "116719",
      "original_text": "Registerbekanntmachung nach dem Umwandlungsgesetz\nBayern Amtsgericht München HRA 121122\nFriedrich Ruf Immobilien e.K. – Kirchseeon",
      "type": "Registerbekanntmachung nach dem Umwandlungsgesetz",
      "state": "Bayern",
      "amtsgericht": "Amtsgericht München",
      "registernummer": "HRA 121122",
      "registerart": "HRA",
      "company_name": "Friedrich Ruf Immobilien e.K.",
      "company_seat": "Kirchseeon",
      "details": "19.07.2025 (Bekanntmachungsdatum)\n\nBayern Amtsgericht München HRA 121122\nRegisterbekanntmachung nach dem Umwandlungsgesetz 18.07.2025 (Eintragungsdatum)\n\nFriedrich Ruf Immobilien e.K.\nEinzelkaufmann / Einzelkauffrau\nKirchseeon\n\nDen Gläubigern der an der Ausgliederung beteiligten Rechtsträger ist, wenn sie binnen sechs Monaten nach dem Tag, an dem die Eintragung der Ausgliederung in das Register des Sitzes desjenigen Rechtsträgers, dessen Gläubiger sie sind, nach §§ 125, 19 Abs. 3 UmwG als bekannt gemacht gilt, ihren Anspruch nach Grund und Höhe in Textform anmelden, Sicherheit zu leisten, soweit sie nicht Befriedigung verlangen können. Dieses Recht steht den Gläubigern jedoch nur zu, wenn sie glaubhaft machen, dass durch die Ausgliederung die Erfüllung ihrer Forderung gefährdet wird."
    },
    {
      "date": "2025-07-19",
      "id": "116720",
      "original_text": "Registerbekanntmachung nach dem Umwandlungsgesetz\nBayern Amtsgericht Ingolstadt HRB 10980\nKoppold Metalltechnik GmbH – Hohenwart",
      "type": "Registerbekanntmachung nach dem Umwandlungsgesetz",
      "state": "Bayern",
      "amtsgericht": "Amtsgericht Ingolstadt",
      "registernummer": "HRB 10980",
      "registerart": "HRB",
      "company_name": "Koppold Metalltechnik GmbH",
      "company_seat": "Hohenwart",
      "details": "19.07.2025 (Bekanntmachungsdatum)\n\nBayern Amtsgericht Ingolstadt HRB 10980\nRegisterbekanntmachung nach dem Umwandlungsgesetz 18.07.2025 (Eintragungsdatum)\n\nKoppold Metalltechnik GmbH\nGesellschaft mit beschränkter Haftung\nHohenwart\n\nDen Gläubigern der an der Verschmelzung beteiligten Rechtsträger ist, wenn sie binnen sechs Monaten nach dem Tag, an dem die Eintragung der Verschmelzung in das Register des Sitzes desjenigen Rechtsträgers, dessen Gläubiger sie sind, nach § 19 Abs. 3 UmwG als bekannt gemacht gilt, ihren Anspruch nach Grund und Höhe in Textform anmelden, Sicherheit zu leisten, soweit sie nicht Befriedigung verlangen können. Dieses Recht steht den Gläubigern jedoch nur zu, wenn sie glaubhaft machen, dass durch die Verschmelzung die Erfüllung ihrer Forderung gefährdet wird."
    },
    {
      "date": "2025-07-19",
      "id": "116721",
      "original_text": "Löschungsankündigung\nBayern Amtsgericht Augsburg HRB 21343\nfidus Publikations-Service Gesellschaft mit beschränkter Haftung – Nördlingen",
      "type": "Löschungsankündigung",
      "state": "Bayern",
      "amtsgericht": "Amtsgericht Augsburg",
      "registernummer": "HRB 21343",
      "registerart": "HRB",
      "company_name": "fidus Publikations-Service Gesellschaft mit beschränkter Haftung",
      "company_seat": "Nördlingen",
      "details": "19.07.2025 (Bekanntmachungsdatum)\n\nBayern Amtsgericht Augsburg HRB 21343\nLöschungsankündigung\n\nfidus Publikations-Service Gesellschaft mit beschränkter Haftung\nGesellschaft mit beschränkter Haftung\nNördlingen\n\nDas Registergericht beabsichtigt, die im Handelsregister eingetragene Gesellschaft wegen Vermögenslosigkeit von Amts wegen nach § 394 FamFG zu löschen. Die Frist zur Erhebung eines Widerspruchs ist auf einen Monat festgesetzt."
    },
    {
      "date": "2025-07-19",
      "id": "116722",
      "original_text": "Löschungsankündigung\nBayern Amtsgericht Hof HRB 5215\nP&C Immobilienmanagement UG (haftungsbeschränkt) – Wunsiedel",
      "type": "Löschungsankündigung",
      "state": "Bayern",
      "amtsgericht": "Amtsgericht Hof",
      "registernummer": "HRB 5215",
      "registerart": "HRB",
      "company_name": "P&C Immobilienmanagement UG (haftungsbeschränkt)",
      "company_seat": "Wunsiedel",
      "details": "19.07.2025 (Bekanntmachungsdatum)\n\nBayern Amtsgericht Hof HRB 5215\nLöschungsankündigung\n\nP&C Immobilienmanagement UG (haftungsbeschränkt)\nGesellschaft mit beschränkter Haftung\nWunsiedel\n\nDas Registergericht beabsichtigt, die im Handelsregister eingetragene Gesellschaft wegen Vermögenslosigkeit von Amts wegen nach § 394 FamFG zu löschen. Die Frist zur Erhebung eines Widerspruchs ist auf sechs Wochen festgesetzt."
    },
    {
      "date": "2025-07-19",
      "id": "116723",
      "original_text": "Registerbekanntmachung nach dem Umwandlungsgesetz\nMecklenburg-Vorpommern Amtsgericht Rostock HRA 5596\nJens Piepenburg e.K. – Biendorf",
      "type": "Registerbekanntmachung nach dem Umwandlungsgesetz",
      "state": "Mecklenburg-Vorpommern",
      "amtsgericht": "Amtsgericht Rostock",
      "registernummer": "HRA 5596",
      "registerart": "HRA",
      "company_name": "Jens Piepenburg e.K.",
      "company_seat": "Biendorf",
      "details": "19.07.2025 (Bekanntmachungsdatum)\n\nMecklenburg-Vorpommern Amtsgericht Rostock HRA 5596\nRegisterbekanntmachung nach dem Umwandlungsgesetz 19.07.2025 (Eintragungsdatum)\n\nJens Piepenburg e.K.\nEinzelkaufmann / Einzelkauffrau\nBiendorf\n\nDen Gläubigern der an der Ausgliederung beteiligten Rechtsträger ist, wenn sie binnen sechs Monaten nach dem Tag, an dem die Eintragung der Ausgliederung in das Register des Sitzes desjenigen Rechtsträgers, dessen Gläubiger sie sind, nach § 19 Abs. 3 UmwG als bekannt gemacht gilt, ihren Anspruch nach Grund und Höhe in Textform anmelden,\nSicherheit zu leisten, soweit sie nicht Befriedigung verlangen können. Dieses Recht steht den Gläubigern jedoch nur zu, wenn sie glaubhaft machen, dass durch die Ausgliederung die Erfüllung der Forderung gefährdet wird."
    }
  ]
}