{
  "date": "2025-07-22",
  "date_of_scrape": "2025-08-26T15:07:53.349Z",
  "tool_version": "0.2.0",
  "number_of_announcements": 204,
  "announcements": [
    {
      "date": "2025-07-22",
      "id": "116878",
      "original_text": "Sonstige Registerbekanntmachung\nBayern Amtsgericht Kempten (Allgäu) HRB 17465\nMAHA Group AG – Haldenwang",
      "type": "Sonstige Registerbekanntmachung",
      "state": "Bayern",
      "amtsgericht": "Amtsgericht Kempten (Allgäu)",
      "registernummer": "HRB 17465",
      "registerart": "HRB",
      "company_name": "MAHA Group AG",
      "company_seat": "Haldenwang",
      "details": "22.07.2025 (Bekanntmachungsdatum)\n\nBayern Amtsgericht Kempten (Allgäu) HRB 17465\nSonstige Registerbekanntmachung 19.07.2025 (Eintragungsdatum)\n\nMAHA Group AG\nAktiengesellschaft\nHaldenwang\n\nDie Gesellschaft hat den Umwandlungsplan vom 14.07.2025 über die formwechselnde Umwandlung der Gesellschaft in die \"MAHA Group SE\" (Europäische Aktiengesellschaft, Societas Europaea) mit dem Sitz in Haldenwang am 15.07.2025 beim Amtsgericht Kempten (Allgäu) (Registergericht) zur Offenlegung gemäß Art. 37 Abs. 5 SE-VO eingereicht."
    },
    {
      "date": "2025-07-22",
      "id": "116879",
      "original_text": "Einreichung neuer Dokumente\nBayern Amtsgericht Kempten (Allgäu) HRB 17465\nMAHA Group AG – Haldenwang",
      "type": "Einreichung neuer Dokumente",
      "state": "Bayern",
      "amtsgericht": "Amtsgericht Kempten (Allgäu)",
      "registernummer": "HRB 17465",
      "registerart": "HRB",
      "company_name": "MAHA Group AG",
      "company_seat": "Haldenwang",
      "details": "22.07.2025 (Bekanntmachungsdatum)\n\nBayern Amtsgericht Kempten (Allgäu) HRB 17465\nEinreichung neuer Dokumente 19.07.2025 (Eintragungsdatum)\n\nMAHA Group AG\nAktiengesellschaft\nHaldenwang\n\nDie Gesellschaft hat den Umwandlungsplan vom 14.07.2025 über die formwechselnde Umwandlung der Gesellschaft in die \"MAHA Group SE\" (Europäische Aktiengesellschaft, Societas Europaea) mit dem Sitz in Haldenwang am 15.07.2025 beim Amtsgericht Kempten (Allgäu) (Registergericht) zur Offenlegung gemäß Art. 37 Abs. 5 SE-VO eingereicht."
    },
    {
      "date": "2025-07-22",
      "id": "116880",
      "original_text": "Registerbekanntmachung nach dem Umwandlungsgesetz\nBayern Amtsgericht München HRB 281306\nLEO II.-VV14 GmbH – München",
      "type": "Registerbekanntmachung nach dem Umwandlungsgesetz",
      "state": "Bayern",
      "amtsgericht": "Amtsgericht München",
      "registernummer": "HRB 281306",
      "registerart": "HRB",
      "company_name": "LEO II.-VV14 GmbH",
      "company_seat": "München",
      "details": "22.07.2025 (Bekanntmachungsdatum)\n\nBayern Amtsgericht München HRB 281306\nRegisterbekanntmachung nach dem Umwandlungsgesetz 21.07.2025 (Eintragungsdatum)\n\nLEO II.-VV14 GmbH\nGesellschaft mit beschränkter Haftung\nMünchen\n\nDen Gläubigern der an der Verschmelzung beteiligten Rechtsträger ist, wenn sie binnen sechs Monaten nach dem Tag, an dem die Eintragung der Verschmelzung in das Register des Sitzes desjenigen Rechtsträgers, dessen Gläubiger sie sind, nach § 19 Abs. 3 UmwG als bekannt gemacht gilt, ihren Anspruch nach Grund und Höhe in Textform anmelden, Sicherheit zu leisten, soweit sie nicht Befriedigung verlangen können. Dieses Recht steht den Gläubigern jedoch nur zu, wenn sie glaubhaft machen, dass durch die Verschmelzung die Erfüllung ihrer Forderung gefährdet wird."
    },
    {
      "date": "2025-07-22",
      "id": "116881",
      "original_text": "Registerbekanntmachung nach dem Umwandlungsgesetz\nBayern Amtsgericht München HRB 259178\nKorian Eichenpark GmbH – München",
      "type": "Registerbekanntmachung nach dem Umwandlungsgesetz",
      "state": "Bayern",
      "amtsgericht": "Amtsgericht München",
      "registernummer": "HRB 259178",
      "registerart": "HRB",
      "company_name": "Korian Eichenpark GmbH",
      "company_seat": "München",
      "details": "22.07.2025 (Bekanntmachungsdatum)\n\nBayern Amtsgericht München HRB 259178\nRegisterbekanntmachung nach dem Umwandlungsgesetz 21.07.2025 (Eintragungsdatum)\n\nKorian Eichenpark GmbH\nGesellschaft mit beschränkter Haftung\nMünchen\n\nDen Gläubigern der an der Verschmelzung beteiligten Rechtsträger ist, wenn sie binnen sechs Monaten nach dem Tag, an dem die Eintragung der Verschmelzung in das Register des Sitzes desjenigen Rechtsträgers, dessen Gläubiger sie sind, nach § 19 Abs. 3 UmwG als bekannt gemacht gilt, ihren Anspruch nach Grund und Höhe in Textform anmelden, Sicherheit zu leisten, soweit sie nicht Befriedigung verlangen können. Dieses Recht steht den Gläubigern jedoch nur zu, wenn sie glaubhaft machen, dass durch die Verschmelzung die Erfüllung ihrer Forderung gefährdet wird."
    },
    {
      "date": "2025-07-22",
      "id": "116882",
      "original_text": "Löschungsankündigung\nBayern Amtsgericht Bayreuth HRB 3456\nwork.on elektrotechnik gmbh – Bayreuth",
      "type": "Löschungsankündigung",
      "state": "Bayern",
      "amtsgericht": "Amtsgericht Bayreuth",
      "registernummer": "HRB 3456",
      "registerart": "HRB",
      "company_name": "work.on elektrotechnik gmbh",
      "company_seat": "Bayreuth",
      "details": "22.07.2025 (Bekanntmachungsdatum)\n\nBayern Amtsgericht Bayreuth HRB 3456\nLöschungsankündigung\n\nwork.on elektrotechnik gmbh\nGesellschaft mit beschränkter Haftung\nBayreuth\n\nDas Registergericht beabsichtigt, die im Handelsregister eingetragene Gesellschaft wegen Vermögenslosigkeit von Amts wegen nach § 394 FamFG zu löschen. Die Frist zur Erhebung eines Widerspruchs ist auf drei Monate festgesetzt."
    },
    {
      "date": "2025-07-22",
      "id": "116883",
      "original_text": "Registerbekanntmachung nach dem Umwandlungsgesetz\nBayern Amtsgericht München HRB 242380\nitesys DE GmbH – München",
      "type": "Registerbekanntmachung nach dem Umwandlungsgesetz",
      "state": "Bayern",
      "amtsgericht": "Amtsgericht München",
      "registernummer": "HRB 242380",
      "registerart": "HRB",
      "company_name": "itesys DE GmbH",
      "company_seat": "München",
      "details": "22.07.2025 (Bekanntmachungsdatum)\n\nBayern Amtsgericht München HRB 242380\nRegisterbekanntmachung nach dem Umwandlungsgesetz 21.07.2025 (Eintragungsdatum)\n\nitesys DE GmbH\nGesellschaft mit beschränkter Haftung\nMünchen\n\nDen Gläubigern der an der Verschmelzung beteiligten Rechtsträger ist, wenn sie binnen sechs Monaten nach dem Tag, an dem die Eintragung der Verschmelzung in das Register des Sitzes desjenigen Rechtsträgers, dessen Gläubiger sie sind, nach § 19 Abs. 3 UmwG als bekannt gemacht gilt, ihren Anspruch nach Grund und Höhe in Textform anmelden, Sicherheit zu leisten, soweit sie nicht Befriedigung verlangen können. Dieses Recht steht den Gläubigern jedoch nur zu, wenn sie glaubhaft machen, dass durch die Verschmelzung die Erfüllung ihrer Forderung gefährdet wird."
    },
    {
      "date": "2025-07-22",
      "id": "116884",
      "original_text": "Löschungsankündigung\nBayern Amtsgericht Hof HRB 5262\nLand-, Forst-, Garten- und Kommunaltechnik Manfred Weber GmbH – Rehau",
      "type": "Löschungsankündigung",
      "state": "Bayern",
      "amtsgericht": "Amtsgericht Hof",
      "registernummer": "HRB 5262",
      "registerart": "HRB",
      "company_name": "Land-, Forst-, Garten- und Kommunaltechnik Manfred Weber GmbH",
      "company_seat": "Rehau",
      "details": "22.07.2025 (Bekanntmachungsdatum)\n\nBayern Amtsgericht Hof HRB 5262\nLöschungsankündigung\n\nLand-, Forst-, Garten- und Kommunaltechnik Manfred Weber GmbH\nGesellschaft mit beschränkter Haftung\nRehau\n\nDas Registergericht beabsichtigt, die im Handelsregister eingetragene Gesellschaft wegen Vermögenslosigkeit von Amts wegen nach § 394 FamFG zu löschen. Die Frist zur Erhebung eines Widerspruchs ist auf sechs Wochen festgesetzt."
    },
    {
      "date": "2025-07-22",
      "id": "116885",
      "original_text": "Registerbekanntmachung nach dem Umwandlungsgesetz\nBayern Amtsgericht München HRB 130686\nWerner Sieß GmbH – Garmisch-Partenkirchen",
      "type": "Registerbekanntmachung nach dem Umwandlungsgesetz",
      "state": "Bayern",
      "amtsgericht": "Amtsgericht München",
      "registernummer": "HRB 130686",
      "registerart": "HRB",
      "company_name": "Werner Sieß GmbH",
      "company_seat": "Garmisch-Partenkirchen",
      "details": "22.07.2025 (Bekanntmachungsdatum)\n\nBayern Amtsgericht München HRB 130686\nRegisterbekanntmachung nach dem Umwandlungsgesetz 21.07.2025 (Eintragungsdatum)\n\nWerner Sieß GmbH\nGesellschaft mit beschränkter Haftung\nGarmisch-Partenkirchen\n\nDen Gläubigern der an der Verschmelzung beteiligten Rechtsträger ist, wenn sie binnen sechs Monaten nach dem Tag, an dem die Eintragung der Verschmelzung in das Register des Sitzes desjenigen Rechtsträgers, dessen Gläubiger sie sind, nach § 19 Abs. 3 UmwG als bekannt gemacht gilt, ihren Anspruch nach Grund und Höhe in Textform anmelden, Sicherheit zu leisten, soweit sie nicht Befriedigung verlangen können. Dieses Recht steht den Gläubigern jedoch nur zu, wenn sie glaubhaft machen, dass durch die Verschmelzung die Erfüllung ihrer Forderung gefährdet wird."
    },
    {
      "date": "2025-07-22",
      "id": "116886",
      "original_text": "Registerbekanntmachung nach dem Umwandlungsgesetz\nBayern Amtsgericht Aschaffenburg HRB 6503\nSPIE Automation GmbH – Niedernberg",
      "type": "Registerbekanntmachung nach dem Umwandlungsgesetz",
      "state": "Bayern",
      "amtsgericht": "Amtsgericht Aschaffenburg",
      "registernummer": "HRB 6503",
      "registerart": "HRB",
      "company_name": "SPIE Automation GmbH",
      "company_seat": "Niedernberg",
      "details": "22.07.2025 (Bekanntmachungsdatum)\n\nBayern Amtsgericht Aschaffenburg HRB 6503\nRegisterbekanntmachung nach dem Umwandlungsgesetz 21.07.2025 (Eintragungsdatum)\n\nSPIE Automation GmbH\nGesellschaft mit beschränkter Haftung\nNiedernberg\n\nDen Gläubigern der an der Verschmelzung beteiligten Rechtsträger ist, wenn sie binnen sechs Monaten nach dem Tag, an dem die Eintragung der Verschmelzung in das Register des Sitzes desjenigen Rechtsträgers, dessen Gläubiger sie sind, nach § 19 Abs. 3 UmwG als bekannt gemacht gilt, ihren Anspruch nach Grund und Höhe in Textform anmelden, Sicherheit zu leisten, soweit sie nicht Befriedigung verlangen können. Dieses Recht steht den Gläubigern jedoch nur zu, wenn sie glaubhaft machen, dass durch die Verschmelzung die Erfüllung ihrer Forderung gefährdet wird."
    },
    {
      "date": "2025-07-22",
      "id": "116887",
      "original_text": "Registerbekanntmachung nach dem Umwandlungsgesetz\nBayern Amtsgericht München HRB 293479\nWVT Vermögensverwaltungs GmbH – Grünwald",
      "type": "Registerbekanntmachung nach dem Umwandlungsgesetz",
      "state": "Bayern",
      "amtsgericht": "Amtsgericht München",
      "registernummer": "HRB 293479",
      "registerart": "HRB",
      "company_name": "WVT Vermögensverwaltungs GmbH",
      "company_seat": "Grünwald",
      "details": "22.07.2025 (Bekanntmachungsdatum)\n\nBayern Amtsgericht München HRB 293479\nRegisterbekanntmachung nach dem Umwandlungsgesetz 21.07.2025 (Eintragungsdatum)\n\nWVT Vermögensverwaltungs GmbH\nGesellschaft mit beschränkter Haftung\nGrünwald\n\nDen Gläubigern der an der Verschmelzung beteiligten Rechtsträger ist, wenn sie binnen sechs Monaten nach dem Tag, an dem die Eintragung der Verschmelzung in das Register des Sitzes desjenigen Rechtsträgers, dessen Gläubiger sie sind, nach § 19 Abs. 3 UmwG als bekannt gemacht gilt, ihren Anspruch nach Grund und Höhe in Textform anmelden, Sicherheit zu leisten, soweit sie nicht Befriedigung verlangen können. Dieses Recht steht den Gläubigern jedoch nur zu, wenn sie glaubhaft machen, dass durch die Verschmelzung die Erfüllung ihrer Forderung gefährdet wird."
    },
    {
      "date": "2025-07-22",
      "id": "116888",
      "original_text": "Registerbekanntmachung nach dem Umwandlungsgesetz\nBayern Amtsgericht München HRB 121937\nLHI Platzierungsgarantie GmbH – Pullach i. Isartal",
      "type": "Registerbekanntmachung nach dem Umwandlungsgesetz",
      "state": "Bayern",
      "amtsgericht": "Amtsgericht München",
      "registernummer": "HRB 121937",
      "registerart": "HRB",
      "company_name": "LHI Platzierungsgarantie GmbH",
      "company_seat": "Pullach i. Isartal",
      "details": "22.07.2025 (Bekanntmachungsdatum)\n\nBayern Amtsgericht München HRB 121937\nRegisterbekanntmachung nach dem Umwandlungsgesetz 21.07.2025 (Eintragungsdatum)\n\nLHI Platzierungsgarantie GmbH\nGesellschaft mit beschränkter Haftung\nPullach i. Isartal\n\nDen Gläubigern der an der Verschmelzung beteiligten Rechtsträger ist, wenn sie binnen sechs Monaten nach dem Tag, an dem die Eintragung der Verschmelzung in das Register des Sitzes desjenigen Rechtsträgers, dessen Gläubiger sie sind, nach § 19 Abs. 3 UmwG als bekannt gemacht gilt, ihren Anspruch nach Grund und Höhe in Textform anmelden, Sicherheit zu leisten, soweit sie nicht Befriedigung verlangen können. Dieses Recht steht den Gläubigern jedoch nur zu, wenn sie glaubhaft machen, dass durch die Verschmelzung die Erfüllung ihrer Forderung gefährdet wird."
    },
    {
      "date": "2025-07-22",
      "id": "116889",
      "original_text": "Registerbekanntmachung nach dem Umwandlungsgesetz\nBayern Amtsgericht Augsburg HRB 32894\nAS Invest UG (haftungsbeschränkt) – Nördlingen",
      "type": "Registerbekanntmachung nach dem Umwandlungsgesetz",
      "state": "Bayern",
      "amtsgericht": "Amtsgericht Augsburg",
      "registernummer": "HRB 32894",
      "registerart": "HRB",
      "company_name": "AS Invest UG (haftungsbeschränkt)",
      "company_seat": "Nördlingen",
      "details": "22.07.2025 (Bekanntmachungsdatum)\n\nBayern Amtsgericht Augsburg HRB 32894\nRegisterbekanntmachung nach dem Umwandlungsgesetz 21.07.2025 (Eintragungsdatum)\n\nAS Invest UG (haftungsbeschränkt)\nGesellschaft mit beschränkter Haftung\nNördlingen\n\nDen Gläubigern der an der Verschmelzung beteiligten Rechtsträger ist, wenn sie binnen sechs Monaten nach dem Tag, an dem die Eintragung der Verschmelzung in das Register des Sitzes desjenigen Rechtsträgers, dessen Gläubiger sie sind, nach § 19 Abs. 3 UmwG als bekannt gemacht gilt, ihren Anspruch nach Grund und Höhe in Textform anmelden, Sicherheit zu leisten, soweit sie nicht Befriedigung verlangen können. Dieses Recht steht den Gläubigern jedoch nur zu, wenn sie glaubhaft machen, dass durch die Verschmelzung die Erfüllung ihrer Forderung gefährdet wird."
    },
    {
      "date": "2025-07-22",
      "id": "116890",
      "original_text": "Registerbekanntmachung nach dem Umwandlungsgesetz\nBayern Amtsgericht Schweinfurt HRB 280\nKLT Hummel Plastic GmbH – Schweinfurt",
      "type": "Registerbekanntmachung nach dem Umwandlungsgesetz",
      "state": "Bayern",
      "amtsgericht": "Amtsgericht Schweinfurt",
      "registernummer": "HRB 280",
      "registerart": "HRB",
      "company_name": "KLT Hummel Plastic GmbH",
      "company_seat": "Schweinfurt",
      "details": "22.07.2025 (Bekanntmachungsdatum)\n\nBayern Amtsgericht Schweinfurt HRB 280\nRegisterbekanntmachung nach dem Umwandlungsgesetz 21.07.2025 (Eintragungsdatum)\n\nKLT Hummel Plastic GmbH\nGesellschaft mit beschränkter Haftung\nSchweinfurt\n\nDen Gläubigern der an der Verschmelzung beteiligten Rechtsträger ist, wenn sie binnen sechs Monaten nach dem Tag, an dem die Eintragung der Verschmelzung in das Register des Sitzes desjenigen Rechtsträgers, dessen Gläubiger sie sind, nach § 19 Abs. 3 UmwG als bekannt gemacht gilt, ihren Anspruch nach Grund und Höhe in Textform anmelden, Sicherheit zu leisten, soweit sie nicht Befriedigung verlangen können. Dieses Recht steht den Gläubigern jedoch nur zu, wenn sie glaubhaft machen, dass durch die Verschmelzung die Erfüllung ihrer Forderung gefährdet wird."
    },
    {
      "date": "2025-07-22",
      "id": "116891",
      "original_text": "Registerbekanntmachung nach dem Umwandlungsgesetz\nBayern Amtsgericht Schweinfurt HRB 1119\nKLT Winkle Plastic GmbH – Schweinfurt",
      "type": "Registerbekanntmachung nach dem Umwandlungsgesetz",
      "state": "Bayern",
      "amtsgericht": "Amtsgericht Schweinfurt",
      "registernummer": "HRB 1119",
      "registerart": "HRB",
      "company_name": "KLT Winkle Plastic GmbH",
      "company_seat": "Schweinfurt",
      "details": "22.07.2025 (Bekanntmachungsdatum)\n\nBayern Amtsgericht Schweinfurt HRB 1119\nRegisterbekanntmachung nach dem Umwandlungsgesetz 21.07.2025 (Eintragungsdatum)\n\nKLT Winkle Plastic GmbH\nGesellschaft mit beschränkter Haftung\nSchweinfurt\n\nDen Gläubigern der an der Verschmelzung beteiligten Rechtsträger ist, wenn sie binnen sechs Monaten nach dem Tag, an dem die Eintragung der Verschmelzung in das Register des Sitzes desjenigen Rechtsträgers, dessen Gläubiger sie sind, nach § 19 Abs. 3 UmwG als bekannt gemacht gilt, ihren Anspruch nach Grund und Höhe in Textform anmelden, Sicherheit zu leisten, soweit sie nicht Befriedigung verlangen können. Dieses Recht steht den Gläubigern jedoch nur zu, wenn sie glaubhaft machen, dass durch die Verschmelzung die Erfüllung ihrer Forderung gefährdet wird."
    },
    {
      "date": "2025-07-22",
      "id": "116892",
      "original_text": "Löschungsankündigung\nBayern Amtsgericht Nürnberg HRB 33966\nConsort IT GmbH – Nürnberg",
      "type": "Löschungsankündigung",
      "state": "Bayern",
      "amtsgericht": "Amtsgericht Nürnberg",
      "registernummer": "HRB 33966",
      "registerart": "HRB",
      "company_name": "Consort IT GmbH",
      "company_seat": "Nürnberg",
      "details": "22.07.2025 (Bekanntmachungsdatum)\n\nBayern Amtsgericht Nürnberg HRB 33966\nLöschungsankündigung\n\nConsort IT GmbH\nGesellschaft mit beschränkter Haftung\nNürnberg\n\nDas Registergericht beabsichtigt, die im Handelsregister eingetragene Gesellschaft wegen Vermögenslosigkeit von Amts wegen nach § 394 FamFG zu löschen. Die Frist zur Erhebung eines Widerspruchs ist auf einen Monat festgesetzt."
    },
    {
      "date": "2025-07-22",
      "id": "116893",
      "original_text": "Registerbekanntmachung nach dem Umwandlungsgesetz\nBayern Amtsgericht Würzburg VR 200040\nInternationaler Integrationsverein Perspektive e.V. – Würzburg",
      "type": "Registerbekanntmachung nach dem Umwandlungsgesetz",
      "state": "Bayern",
      "amtsgericht": "Amtsgericht Würzburg",
      "registernummer": "VR 200040",
      "registerart": "VR",
      "company_name": "Internationaler Integrationsverein Perspektive e.V.",
      "company_seat": "Würzburg",
      "details": "22.07.2025 (Bekanntmachungsdatum)\n\nBayern Amtsgericht Würzburg VR 200040\nRegisterbekanntmachung nach dem Umwandlungsgesetz 20.07.2025 (Eintragungsdatum)\n\nInternationaler Integrationsverein Perspektive e.V.\neingetragener Verein\nWürzburg\n\nDen Gläubigern des formwechselnden Rechtsträgers ist, wenn sie binnen sechs Monaten nach dem Tag, an dem die Eintragung des Formwechsels nach § 201 UmwG als bekannt gemacht gilt, ihren Anspruch nach Grund und Höhe in Textform anmelden, Sicherheit zu leisten, soweit sie nicht Befriedigung verlangen können. Dieses Recht steht den Gläubigern jedoch nur zu, wenn sie glaubhaft machen, dass durch den Formwechsel die Erfüllung ihrer Forderung gefährdet wird."
    },
    {
      "date": "2025-07-22",
      "id": "116894",
      "original_text": "Registerbekanntmachung nach dem Umwandlungsgesetz\nBayern Amtsgericht München HRA 120719\nMalerfachbetrieb Bekaj e.K. – Unterhaching",
      "type": "Registerbekanntmachung nach dem Umwandlungsgesetz",
      "state": "Bayern",
      "amtsgericht": "Amtsgericht München",
      "registernummer": "HRA 120719",
      "registerart": "HRA",
      "company_name": "Malerfachbetrieb Bekaj e.K.",
      "company_seat": "Unterhaching",
      "details": "22.07.2025 (Bekanntmachungsdatum)\n\nBayern Amtsgericht München HRA 120719\nRegisterbekanntmachung nach dem Umwandlungsgesetz 21.07.2025 (Eintragungsdatum)\n\nMalerfachbetrieb Bekaj e.K.\nEinzelkaufmann / Einzelkauffrau\nUnterhaching\n\nDen Gläubigern der an der Ausgliederung beteiligten Rechtsträger ist, wenn sie binnen sechs Monaten nach dem Tag, an dem die Eintragung der Ausgliederung in das Register des Sitzes desjenigen Rechtsträgers, dessen Gläubiger sie sind, nach §§ 125, 19 Abs. 3 UmwG als bekannt gemacht gilt, ihren Anspruch nach Grund und Höhe in Textform anmelden, Sicherheit zu leisten, soweit sie nicht Befriedigung verlangen können. Dieses Recht steht den Gläubigern jedoch nur zu, wenn sie glaubhaft machen, dass durch die Ausgliederung die Erfüllung ihrer Forderung gefährdet wird."
    },
    {
      "date": "2025-07-22",
      "id": "116895",
      "original_text": "Registerbekanntmachung nach dem Umwandlungsgesetz\nBayern Amtsgericht Memmingen HRA 14206\nRobert Specht e.K. – Balzhausen",
      "type": "Registerbekanntmachung nach dem Umwandlungsgesetz",
      "state": "Bayern",
      "amtsgericht": "Amtsgericht Memmingen",
      "registernummer": "HRA 14206",
      "registerart": "HRA",
      "company_name": "Robert Specht e.K.",
      "company_seat": "Balzhausen",
      "details": "22.07.2025 (Bekanntmachungsdatum)\n\nBayern Amtsgericht Memmingen HRA 14206\nRegisterbekanntmachung nach dem Umwandlungsgesetz 21.07.2025 (Eintragungsdatum)\n\nRobert Specht e.K.\nEinzelkaufmann / Einzelkauffrau\nBalzhausen\n\nDen Gläubigern der an der Ausgliederung beteiligten Rechtsträger ist, wenn sie binnen sechs Monaten nach dem Tag, an dem die Eintragung der Ausgliederung in das Register des Sitzes desjenigen Rechtsträgers, dessen Gläubiger sie sind, nach §§ 125, 19 Abs. 3 UmwG als bekannt gemacht gilt, ihren Anspruch nach Grund und Höhe in Textform anmelden, Sicherheit zu leisten, soweit sie nicht Befriedigung verlangen können. Dieses Recht steht den Gläubigern jedoch nur zu, wenn sie glaubhaft machen, dass durch die Ausgliederung die Erfüllung ihrer Forderung gefährdet wird."
    },
    {
      "date": "2025-07-22",
      "id": "116896",
      "original_text": "Registerbekanntmachung nach dem Umwandlungsgesetz\nBayern Amtsgericht Traunstein HRB 30576\nA.I. Fitness GmbH – Rosenheim",
      "type": "Registerbekanntmachung nach dem Umwandlungsgesetz",
      "state": "Bayern",
      "amtsgericht": "Amtsgericht Traunstein",
      "registernummer": "HRB 30576",
      "registerart": "HRB",
      "company_name": "A.I. Fitness GmbH",
      "company_seat": "Rosenheim",
      "details": "22.07.2025 (Bekanntmachungsdatum)\n\nBayern Amtsgericht Traunstein HRB 30576\nRegisterbekanntmachung nach dem Umwandlungsgesetz 21.07.2025 (Eintragungsdatum)\n\nA.I. Fitness GmbH\nGesellschaft mit beschränkter Haftung\nRosenheim\n\nDen Gläubigern der an der Verschmelzung beteiligten Rechtsträger ist, wenn sie binnen sechs Monaten nach dem Tag, an dem die Eintragung der Verschmelzung in das Register des Sitzes desjenigen Rechtsträgers, dessen Gläubiger sie sind, nach § 19 Abs. 3 UmwG als bekannt gemacht gilt, ihren Anspruch nach Grund und Höhe in Textform anmelden, Sicherheit zu leisten, soweit sie nicht Befriedigung verlangen können. Dieses Recht steht den Gläubigern jedoch nur zu, wenn sie glaubhaft machen, dass durch die Verschmelzung die Erfüllung ihrer Forderung gefährdet wird.Den Gläubigern der an der Verschmelzung beteiligten Rechtsträger ist, wenn sie binnen sechs Monaten nach dem Tag, an dem die Eintragung der Verschmelzung in das Register des Sitzes desjenigen Rechtsträgers, dessen Gläubiger sie sind, nach § 19 Abs. 3 UmwG als bekannt gemacht gilt, ihren Anspruch nach Grund und Höhe in Textform anmelden, Sicherheit zu leisten, soweit sie nicht Befriedigung verlangen können. Dieses Recht steht den Gläubigern jedoch nur zu, wenn sie glaubhaft machen, dass durch die Verschmelzung die Erfüllung ihrer Forderung gefährdet wird."
    },
    {
      "date": "2025-07-22",
      "id": "116897",
      "original_text": "Registerbekanntmachung nach dem Umwandlungsgesetz\nBayern Amtsgericht München HRB 43115\nFFS Film- & Fernseh-Synchron GmbH – München",
      "type": "Registerbekanntmachung nach dem Umwandlungsgesetz",
      "state": "Bayern",
      "amtsgericht": "Amtsgericht München",
      "registernummer": "HRB 43115",
      "registerart": "HRB",
      "company_name": "FFS Film- & Fernseh-Synchron GmbH",
      "company_seat": "München",
      "details": "22.07.2025 (Bekanntmachungsdatum)\n\nBayern Amtsgericht München HRB 43115\nRegisterbekanntmachung nach dem Umwandlungsgesetz 21.07.2025 (Eintragungsdatum)\n\nFFS Film- & Fernseh-Synchron GmbH\nGesellschaft mit beschränkter Haftung\nMünchen\n\nDen Gläubigern der an der Verschmelzung beteiligten Rechtsträger ist, wenn sie binnen sechs Monaten nach dem Tag, an dem die Eintragung der Verschmelzung in das Register des Sitzes desjenigen Rechtsträgers, dessen Gläubiger sie sind, nach § 19 Abs. 3 UmwG als bekannt gemacht gilt, ihren Anspruch nach Grund und Höhe in Textform anmelden, Sicherheit zu leisten, soweit sie nicht Befriedigung verlangen können. Dieses Recht steht den Gläubigern jedoch nur zu, wenn sie glaubhaft machen, dass durch die Verschmelzung die Erfüllung ihrer Forderung gefährdet wird."
    },
    {
      "date": "2025-07-22",
      "id": "116898",
      "original_text": "Registerbekanntmachung nach dem Umwandlungsgesetz\nBayern Amtsgericht Nürnberg HRB 24992\nGMW Gesellschaft für Markt- und Wirkungsforschung mbH – Nürnberg",
      "type": "Registerbekanntmachung nach dem Umwandlungsgesetz",
      "state": "Bayern",
      "amtsgericht": "Amtsgericht Nürnberg",
      "registernummer": "HRB 24992",
      "registerart": "HRB",
      "company_name": "GMW Gesellschaft für Markt- und Wirkungsforschung mbH",
      "company_seat": "Nürnberg",
      "details": "22.07.2025 (Bekanntmachungsdatum)\n\nBayern Amtsgericht Nürnberg HRB 24992\nRegisterbekanntmachung nach dem Umwandlungsgesetz 21.07.2025 (Eintragungsdatum)\n\nGMW Gesellschaft für Markt- und Wirkungsforschung mbH\nGesellschaft mit beschränkter Haftung\nNürnberg\n\nDen Gläubigern der an der Verschmelzung beteiligten Rechtsträger ist, wenn sie binnen sechs Monaten nach dem Tag, an dem die Eintragung der Verschmelzung in das Register des Sitzes desjenigen Rechtsträgers, dessen Gläubiger sie sind, nach § 19 Abs. 3 UmwG als bekannt gemacht gilt, ihren Anspruch nach Grund und Höhe in Textform anmelden, Sicherheit zu leisten, soweit sie nicht Befriedigung verlangen können. Dieses Recht steht den Gläubigern jedoch nur zu, wenn sie glaubhaft machen, dass durch die Verschmelzung die Erfüllung ihrer Forderung gefährdet wird."
    },
    {
      "date": "2025-07-22",
      "id": "116899",
      "original_text": "Registerbekanntmachung nach dem Umwandlungsgesetz\nBayern Amtsgericht Regensburg HRB 19044\nKarl Consulting GmbH – Abensberg",
      "type": "Registerbekanntmachung nach dem Umwandlungsgesetz",
      "state": "Bayern",
      "amtsgericht": "Amtsgericht Regensburg",
      "registernummer": "HRB 19044",
      "registerart": "HRB",
      "company_name": "Karl Consulting GmbH",
      "company_seat": "Abensberg",
      "details": "22.07.2025 (Bekanntmachungsdatum)\n\nBayern Amtsgericht Regensburg HRB 19044\nRegisterbekanntmachung nach dem Umwandlungsgesetz 21.07.2025 (Eintragungsdatum)\n\nKarl Consulting GmbH\nGesellschaft mit beschränkter Haftung\nAbensberg\n\nDen Gläubigern der an der Verschmelzung beteiligten Rechtsträger ist, wenn sie binnen sechs Monaten nach dem Tag, an dem die Eintragung der Verschmelzung in das Register des Sitzes desjenigen Rechtsträgers, dessen Gläubiger sie sind, nach § 19 Abs. 3 UmwG als bekannt gemacht gilt, ihren Anspruch nach Grund und Höhe in Textform anmelden, Sicherheit zu leisten, soweit sie nicht Befriedigung verlangen können. Dieses Recht steht den Gläubigern jedoch nur zu, wenn sie glaubhaft machen, dass durch die Verschmelzung die Erfüllung ihrer Forderung gefährdet wird."
    },
    {
      "date": "2025-07-22",
      "id": "116900",
      "original_text": "Löschungsankündigung\nBayern Amtsgericht Nürnberg HRB 22451\nGENSO German Energy Solutions GmbH – Nürnberg",
      "type": "Löschungsankündigung",
      "state": "Bayern",
      "amtsgericht": "Amtsgericht Nürnberg",
      "registernummer": "HRB 22451",
      "registerart": "HRB",
      "company_name": "GENSO German Energy Solutions GmbH",
      "company_seat": "Nürnberg",
      "details": "22.07.2025 (Bekanntmachungsdatum)\n\nBayern Amtsgericht Nürnberg HRB 22451\nLöschungsankündigung\n\nGENSO German Energy Solutions GmbH\nGesellschaft mit beschränkter Haftung\nNürnberg\n\nDas Registergericht beabsichtigt, die im Handelsregister eingetragene Gesellschaft wegen Vermögenslosigkeit von Amts wegen nach § 394 FamFG zu löschen. Die Frist zur Erhebung eines Widerspruchs ist auf einen Monat festgesetzt."
    },
    {
      "date": "2025-07-22",
      "id": "116901",
      "original_text": "Registerbekanntmachung nach dem Umwandlungsgesetz\nBayern Amtsgericht Regensburg HRB 14910\nCURADEMIC GmbH – Saal a. d. Donau",
      "type": "Registerbekanntmachung nach dem Umwandlungsgesetz",
      "state": "Bayern",
      "amtsgericht": "Amtsgericht Regensburg",
      "registernummer": "HRB 14910",
      "registerart": "HRB",
      "company_name": "CURADEMIC GmbH",
      "company_seat": "Saal a. d. Donau",
      "details": "22.07.2025 (Bekanntmachungsdatum)\n\nBayern Amtsgericht Regensburg HRB 14910\nRegisterbekanntmachung nach dem Umwandlungsgesetz 21.07.2025 (Eintragungsdatum)\n\nCURADEMIC GmbH\nGesellschaft mit beschränkter Haftung\nSaal a. d. Donau\n\nDen Gläubigern der an der Verschmelzung beteiligten Rechtsträger ist, wenn sie binnen sechs Monaten nach dem Tag, an dem die Eintragung der Verschmelzung in das Register des Sitzes desjenigen Rechtsträgers, dessen Gläubiger sie sind, nach § 19 Abs. 3 UmwG als bekannt gemacht gilt, ihren Anspruch nach Grund und Höhe in Textform anmelden, Sicherheit zu leisten, soweit sie nicht Befriedigung verlangen können. Dieses Recht steht den Gläubigern jedoch nur zu, wenn sie glaubhaft machen, dass durch die Verschmelzung die Erfüllung ihrer Forderung gefährdet wird."
    },
    {
      "date": "2025-07-22",
      "id": "116902",
      "original_text": "Registerbekanntmachung nach dem Umwandlungsgesetz\nBayern Amtsgericht Regensburg HRB 12781\nOstarek Immobilien UG (haftungsbeschränkt) – Regensburg",
      "type": "Registerbekanntmachung nach dem Umwandlungsgesetz",
      "state": "Bayern",
      "amtsgericht": "Amtsgericht Regensburg",
      "registernummer": "HRB 12781",
      "registerart": "HRB",
      "company_name": "Ostarek Immobilien UG (haftungsbeschränkt)",
      "company_seat": "Regensburg",
      "details": "22.07.2025 (Bekanntmachungsdatum)\n\nBayern Amtsgericht Regensburg HRB 12781\nRegisterbekanntmachung nach dem Umwandlungsgesetz 21.07.2025 (Eintragungsdatum)\n\nOstarek Immobilien UG (haftungsbeschränkt)\nGesellschaft mit beschränkter Haftung\nRegensburg\n\nDen Gläubigern der an der Verschmelzung beteiligten Rechtsträger ist, wenn sie binnen sechs Monaten nach dem Tag, an dem die Eintragung der Verschmelzung in das Register des Sitzes desjenigen Rechtsträgers, dessen Gläubiger sie sind, nach § 19 Abs. 3 UmwG als bekannt gemacht gilt, ihren Anspruch nach Grund und Höhe in Textform anmelden, Sicherheit zu leisten, soweit sie nicht Befriedigung verlangen können. Dieses Recht steht den Gläubigern jedoch nur zu, wenn sie glaubhaft machen, dass durch die Verschmelzung die Erfüllung ihrer Forderung gefährdet wird."
    },
    {
      "date": "2025-07-22",
      "id": "116903",
      "original_text": "Einreichung neuer Dokumente\nBayern Amtsgericht München HRB 301313\nLaimberg 134. V V AG – München",
      "type": "Einreichung neuer Dokumente",
      "state": "Bayern",
      "amtsgericht": "Amtsgericht München",
      "registernummer": "HRB 301313",
      "registerart": "HRB",
      "company_name": "Laimberg 134. V V AG",
      "company_seat": "München",
      "details": "22.07.2025 (Bekanntmachungsdatum)\n\nBayern Amtsgericht München HRB 301313\nEinreichung neuer Dokumente\n\nLaimberg 134. V V AG\nAktiengesellschaft\nMünchen\n\nDem Amtsgericht München -Registergericht- ist eine Liste der Mitglieder des Aufsichtsrats eingereicht worden, § 106 AktG."
    },
    {
      "date": "2025-07-22",
      "id": "116904",
      "original_text": "Registerbekanntmachung nach dem Umwandlungsgesetz\nBayern Amtsgericht München HRB 301680\nKopfbrand GmbH – München",
      "type": "Registerbekanntmachung nach dem Umwandlungsgesetz",
      "state": "Bayern",
      "amtsgericht": "Amtsgericht München",
      "registernummer": "HRB 301680",
      "registerart": "HRB",
      "company_name": "Kopfbrand GmbH",
      "company_seat": "München",
      "details": "22.07.2025 (Bekanntmachungsdatum)\n\nBayern Amtsgericht München HRB 301680\nRegisterbekanntmachung nach dem Umwandlungsgesetz 21.07.2025 (Eintragungsdatum)\n\nKopfbrand GmbH\nGesellschaft mit beschränkter Haftung\nMünchen\n\nDen Gläubigern der an der Ausgliederung beteiligten Rechtsträger ist, wenn sie binnen sechs Monaten nach dem Tag, an dem die Eintragung der Ausgliederung in das Register des Sitzes desjenigen Rechtsträgers, dessen Gläubiger sie sind, nach §§ 125, 19 Abs. 3 UmwG als bekannt gemacht gilt, ihren Anspruch nach Grund und Höhe in Textform anmelden, Sicherheit zu leisten, soweit sie nicht Befriedigung verlangen können. Dieses Recht steht den Gläubigern jedoch nur zu, wenn sie glaubhaft machen, dass durch die Ausgliederung die Erfüllung ihrer Forderung gefährdet wird."
    },
    {
      "date": "2025-07-22",
      "id": "116905",
      "original_text": "Registerbekanntmachung nach dem Umwandlungsgesetz\nBayern Amtsgericht Memmingen HRA 14207\nR. Specht GmbH & Co. KG – Balzhausen",
      "type": "Registerbekanntmachung nach dem Umwandlungsgesetz",
      "state": "Bayern",
      "amtsgericht": "Amtsgericht Memmingen",
      "registernummer": "HRA 14207",
      "registerart": "HRA",
      "company_name": "R. Specht GmbH & Co. KG",
      "company_seat": "Balzhausen",
      "details": "22.07.2025 (Bekanntmachungsdatum)\n\nBayern Amtsgericht Memmingen HRA 14207\nRegisterbekanntmachung nach dem Umwandlungsgesetz 21.07.2025 (Eintragungsdatum)\n\nR. Specht GmbH & Co. KG\nKommanditgesellschaft\nBalzhausen\n\nDen Gläubigern der an der Ausgliederung beteiligten Rechtsträger ist, wenn sie binnen sechs Monaten nach dem Tag, an dem die Eintragung der Ausgliederung in das Register des Sitzes desjenigen Rechtsträgers, dessen Gläubiger sie sind, nach §§ 125, 19 Abs. 3 UmwG als bekannt gemacht gilt, ihren Anspruch nach Grund und Höhe in Textform anmelden, Sicherheit zu leisten, soweit sie nicht Befriedigung verlangen können. Dieses Recht steht den Gläubigern jedoch nur zu, wenn sie glaubhaft machen, dass durch die Ausgliederung die Erfüllung ihrer Forderung gefährdet wird."
    },
    {
      "date": "2025-07-22",
      "id": "116906",
      "original_text": "Registerbekanntmachung nach dem Umwandlungsgesetz\nBayern Amtsgericht Hof HRB 5041\nTenowo Hof GmbH – Hof",
      "type": "Registerbekanntmachung nach dem Umwandlungsgesetz",
      "state": "Bayern",
      "amtsgericht": "Amtsgericht Hof",
      "registernummer": "HRB 5041",
      "registerart": "HRB",
      "company_name": "Tenowo Hof GmbH",
      "company_seat": "Hof",
      "details": "22.07.2025 (Bekanntmachungsdatum)\n\nBayern Amtsgericht Hof HRB 5041\nRegisterbekanntmachung nach dem Umwandlungsgesetz 21.07.2025 (Eintragungsdatum)\n\nTenowo Hof GmbH\nGesellschaft mit beschränkter Haftung\nHof\n\nDen Gläubigern der an der Verschmelzung beteiligten Rechtsträger ist, wenn sie binnen sechs Monaten nach dem Tag, an dem die Eintragung der Verschmelzung in das Register des Sitzes desjenigen Rechtsträgers, dessen Gläubiger sie sind, nach § 19 Abs. 3 UmwG als bekannt gemacht gilt, ihren Anspruch nach Grund und Höhe in Textform anmelden, Sicherheit zu leisten, soweit sie nicht Befriedigung verlangen können. Dieses Recht steht den Gläubigern jedoch nur zu, wenn sie glaubhaft machen, dass durch die Verschmelzung die Erfüllung ihrer Forderung gefährdet wird."
    },
    {
      "date": "2025-07-22",
      "id": "116907",
      "original_text": "Registerbekanntmachung nach dem Umwandlungsgesetz\nBayern Amtsgericht Hof HRB 5040\nTenowo Mittweida GmbH – Hof",
      "type": "Registerbekanntmachung nach dem Umwandlungsgesetz",
      "state": "Bayern",
      "amtsgericht": "Amtsgericht Hof",
      "registernummer": "HRB 5040",
      "registerart": "HRB",
      "company_name": "Tenowo Mittweida GmbH",
      "company_seat": "Hof",
      "details": "22.07.2025 (Bekanntmachungsdatum)\n\nBayern Amtsgericht Hof HRB 5040\nRegisterbekanntmachung nach dem Umwandlungsgesetz 21.07.2025 (Eintragungsdatum)\n\nTenowo Mittweida GmbH\nGesellschaft mit beschränkter Haftung\nHof\n\nDen Gläubigern der an der Verschmelzung beteiligten Rechtsträger ist, wenn sie binnen sechs Monaten nach dem Tag, an dem die Eintragung der Verschmelzung in das Register des Sitzes desjenigen Rechtsträgers, dessen Gläubiger sie sind, nach § 19 Abs. 3 UmwG als bekannt gemacht gilt, ihren Anspruch nach Grund und Höhe in Textform anmelden, Sicherheit zu leisten, soweit sie nicht Befriedigung verlangen können. Dieses Recht steht den Gläubigern jedoch nur zu, wenn sie glaubhaft machen, dass durch die Verschmelzung die Erfüllung ihrer Forderung gefährdet wird."
    },
    {
      "date": "2025-07-22",
      "id": "116908",
      "original_text": "Registerbekanntmachung nach dem Umwandlungsgesetz\nBayern Amtsgericht Regensburg HRA 11179\nKarl Consulting e.K. – Abensberg",
      "type": "Registerbekanntmachung nach dem Umwandlungsgesetz",
      "state": "Bayern",
      "amtsgericht": "Amtsgericht Regensburg",
      "registernummer": "HRA 11179",
      "registerart": "HRA",
      "company_name": "Karl Consulting e.K.",
      "company_seat": "Abensberg",
      "details": "22.07.2025 (Bekanntmachungsdatum)\n\nBayern Amtsgericht Regensburg HRA 11179\nRegisterbekanntmachung nach dem Umwandlungsgesetz 21.07.2025 (Eintragungsdatum)\n\nKarl Consulting e.K.\nEinzelkaufmann / Einzelkauffrau\nAbensberg\n\nDen Gläubigern der an der Verschmelzung beteiligten Rechtsträger ist, wenn sie binnen sechs Monaten nach dem Tag, an dem die Eintragung der Verschmelzung in das Register des Sitzes desjenigen Rechtsträgers, dessen Gläubiger sie sind, nach § 19 Abs. 3 UmwG als bekannt gemacht gilt, ihren Anspruch nach Grund und Höhe in Textform anmelden, Sicherheit zu leisten, soweit sie nicht Befriedigung verlangen können. Dieses Recht steht den Gläubigern jedoch nur zu, wenn sie glaubhaft machen, dass durch die Verschmelzung die Erfüllung ihrer Forderung gefährdet wird."
    },
    {
      "date": "2025-07-22",
      "id": "116909",
      "original_text": "Registerbekanntmachung nach dem Umwandlungsgesetz\nBayern Amtsgericht München HRB 188468\nPLU Campus GmbH – München",
      "type": "Registerbekanntmachung nach dem Umwandlungsgesetz",
      "state": "Bayern",
      "amtsgericht": "Amtsgericht München",
      "registernummer": "HRB 188468",
      "registerart": "HRB",
      "company_name": "PLU Campus GmbH",
      "company_seat": "München",
      "details": "22.07.2025 (Bekanntmachungsdatum)\n\nBayern Amtsgericht München HRB 188468\nRegisterbekanntmachung nach dem Umwandlungsgesetz 21.07.2025 (Eintragungsdatum)\n\nPLU Campus GmbH\nGesellschaft mit beschränkter Haftung\nMünchen\n\nDen Gläubigern der an der Verschmelzung beteiligten Rechtsträger ist, wenn sie binnen sechs Monaten nach dem Tag, an dem die Eintragung der Verschmelzung in das Register des Sitzes desjenigen Rechtsträgers, dessen Gläubiger sie sind, nach § 19 Abs. 3 UmwG als bekannt gemacht gilt, ihren Anspruch nach Grund und Höhe in Textform anmelden, Sicherheit zu leisten, soweit sie nicht Befriedigung verlangen können. Dieses Recht steht den Gläubigern jedoch nur zu, wenn sie glaubhaft machen, dass durch die Verschmelzung die Erfüllung ihrer Forderung gefährdet wird."
    },
    {
      "date": "2025-07-22",
      "id": "116910",
      "original_text": "Registerbekanntmachung nach dem Umwandlungsgesetz\nBayern Amtsgericht Traunstein HRB 33962\nA.I. Fitness Lahnstein GmbH – Rosenheim",
      "type": "Registerbekanntmachung nach dem Umwandlungsgesetz",
      "state": "Bayern",
      "amtsgericht": "Amtsgericht Traunstein",
      "registernummer": "HRB 33962",
      "registerart": "HRB",
      "company_name": "A.I. Fitness Lahnstein GmbH",
      "company_seat": "Rosenheim",
      "details": "22.07.2025 (Bekanntmachungsdatum)\n\nBayern Amtsgericht Traunstein HRB 33962\nRegisterbekanntmachung nach dem Umwandlungsgesetz 21.07.2025 (Eintragungsdatum)\n\nA.I. Fitness Lahnstein GmbH\nGesellschaft mit beschränkter Haftung\nRosenheim\n\nDen Gläubigern der an der Verschmelzung beteiligten Rechtsträger ist, wenn sie binnen sechs Monaten nach dem Tag, an dem die Eintragung der Verschmelzung in das Register des Sitzes desjenigen Rechtsträgers, dessen Gläubiger sie sind, nach § 19 Abs. 3 UmwG als bekannt gemacht gilt, ihren Anspruch nach Grund und Höhe in Textform anmelden, Sicherheit zu leisten, soweit sie nicht Befriedigung verlangen können. Dieses Recht steht den Gläubigern jedoch nur zu, wenn sie glaubhaft machen, dass durch die Verschmelzung die Erfüllung ihrer Forderung gefährdet wird."
    },
    {
      "date": "2025-07-22",
      "id": "116911",
      "original_text": "Registerbekanntmachung nach dem Umwandlungsgesetz\nBayern Amtsgericht München HRB 202956\nEckart Bauträger GmbH – Grünwald",
      "type": "Registerbekanntmachung nach dem Umwandlungsgesetz",
      "state": "Bayern",
      "amtsgericht": "Amtsgericht München",
      "registernummer": "HRB 202956",
      "registerart": "HRB",
      "company_name": "Eckart Bauträger GmbH",
      "company_seat": "Grünwald",
      "details": "22.07.2025 (Bekanntmachungsdatum)\n\nBayern Amtsgericht München HRB 202956\nRegisterbekanntmachung nach dem Umwandlungsgesetz 21.07.2025 (Eintragungsdatum)\n\nEckart Bauträger GmbH\nGesellschaft mit beschränkter Haftung\nGrünwald\n\nDen Gläubigern der an der Verschmelzung beteiligten Rechtsträger ist, wenn sie binnen sechs Monaten nach dem Tag, an dem die Eintragung der Verschmelzung in das Register des Sitzes desjenigen Rechtsträgers, dessen Gläubiger sie sind, nach § 19 Abs. 3 UmwG als bekannt gemacht gilt, ihren Anspruch nach Grund und Höhe in Textform anmelden, Sicherheit zu leisten, soweit sie nicht Befriedigung verlangen können. Dieses Recht steht den Gläubigern jedoch nur zu, wenn sie glaubhaft machen, dass durch die Verschmelzung die Erfüllung ihrer Forderung gefährdet wird."
    },
    {
      "date": "2025-07-22",
      "id": "116912",
      "original_text": "Registerbekanntmachung nach dem Umwandlungsgesetz\nBayern Amtsgericht Hof HRB 2439\nTenowo GmbH – Hof",
      "type": "Registerbekanntmachung nach dem Umwandlungsgesetz",
      "state": "Bayern",
      "amtsgericht": "Amtsgericht Hof",
      "registernummer": "HRB 2439",
      "registerart": "HRB",
      "company_name": "Tenowo GmbH",
      "company_seat": "Hof",
      "details": "22.07.2025 (Bekanntmachungsdatum)\n\nBayern Amtsgericht Hof HRB 2439\nRegisterbekanntmachung nach dem Umwandlungsgesetz 21.07.2025 (Eintragungsdatum)\n\nTenowo GmbH\nGesellschaft mit beschränkter Haftung\nHof\n\nDen Gläubigern der an der Verschmelzung beteiligten Rechtsträger ist, wenn sie binnen sechs Monaten nach dem Tag, an dem die Eintragung der Verschmelzung in das Register des Sitzes desjenigen Rechtsträgers, dessen Gläubiger sie sind, nach § 19 Abs. 3 UmwG als bekannt gemacht gilt, ihren Anspruch nach Grund und Höhe in Textform anmelden, Sicherheit zu leisten, soweit sie nicht Befriedigung verlangen können. Dieses Recht steht den Gläubigern jedoch nur zu, wenn sie glaubhaft machen, dass durch die Verschmelzung die Erfüllung ihrer Forderung gefährdet wird."
    },
    {
      "date": "2025-07-22",
      "id": "116913",
      "original_text": "Löschungsankündigung\nBayern Amtsgericht Nürnberg HRB 29960\nfp food consult GmbH – Nürnberg",
      "type": "Löschungsankündigung",
      "state": "Bayern",
      "amtsgericht": "Amtsgericht Nürnberg",
      "registernummer": "HRB 29960",
      "registerart": "HRB",
      "company_name": "fp food consult GmbH",
      "company_seat": "Nürnberg",
      "details": "22.07.2025 (Bekanntmachungsdatum)\n\nBayern Amtsgericht Nürnberg HRB 29960\nLöschungsankündigung\n\nfp food consult GmbH\nGesellschaft mit beschränkter Haftung\nNürnberg\n\nDas Registergericht beabsichtigt, die im Handelsregister eingetragene Gesellschaft wegen Vermögenslosigkeit von Amts wegen nach § 394 FamFG zu löschen. Die Frist zur Erhebung eines Widerspruchs ist auf einen Monat festgesetzt."
    },
    {
      "date": "2025-07-22",
      "id": "116914",
      "original_text": "Registerbekanntmachung nach dem Umwandlungsgesetz\nBayern Amtsgericht Hof HRB 5042\nTenowo Reichenbach GmbH – Hof",
      "type": "Registerbekanntmachung nach dem Umwandlungsgesetz",
      "state": "Bayern",
      "amtsgericht": "Amtsgericht Hof",
      "registernummer": "HRB 5042",
      "registerart": "HRB",
      "company_name": "Tenowo Reichenbach GmbH",
      "company_seat": "Hof",
      "details": "22.07.2025 (Bekanntmachungsdatum)\n\nBayern Amtsgericht Hof HRB 5042\nRegisterbekanntmachung nach dem Umwandlungsgesetz 21.07.2025 (Eintragungsdatum)\n\nTenowo Reichenbach GmbH\nGesellschaft mit beschränkter Haftung\nHof\n\nDen Gläubigern der an der Verschmelzung beteiligten Rechtsträger ist, wenn sie binnen sechs Monaten nach dem Tag, an dem die Eintragung der Verschmelzung in das Register des Sitzes desjenigen Rechtsträgers, dessen Gläubiger sie sind, nach § 19 Abs. 3 UmwG als bekannt gemacht gilt, ihren Anspruch nach Grund und Höhe in Textform anmelden, Sicherheit zu leisten, soweit sie nicht Befriedigung verlangen können. Dieses Recht steht den Gläubigern jedoch nur zu, wenn sie glaubhaft machen, dass durch die Verschmelzung die Erfüllung ihrer Forderung gefährdet wird."
    },
    {
      "date": "2025-07-22",
      "id": "116915",
      "original_text": "Registerbekanntmachung nach dem Umwandlungsgesetz\nBayern Amtsgericht München HRB 138578\nVASSOL Value Added Services Solutions GmbH – München",
      "type": "Registerbekanntmachung nach dem Umwandlungsgesetz",
      "state": "Bayern",
      "amtsgericht": "Amtsgericht München",
      "registernummer": "HRB 138578",
      "registerart": "HRB",
      "company_name": "VASSOL Value Added Services Solutions GmbH",
      "company_seat": "München",
      "details": "22.07.2025 (Bekanntmachungsdatum)\n\nBayern Amtsgericht München HRB 138578\nRegisterbekanntmachung nach dem Umwandlungsgesetz 21.07.2025 (Eintragungsdatum)\n\nVASSOL Value Added Services Solutions GmbH\nGesellschaft mit beschränkter Haftung\nMünchen\n\nDen Gläubigern der an der Verschmelzung beteiligten Rechtsträger ist, wenn sie binnen sechs Monaten nach dem Tag, an dem die Eintragung der Verschmelzung in das Register des Sitzes desjenigen Rechtsträgers, dessen Gläubiger sie sind, nach § 19 Abs. 3 UmwG als bekannt gemacht gilt, ihren Anspruch nach Grund und Höhe in Textform anmelden, Sicherheit zu leisten, soweit sie nicht Befriedigung verlangen können. Dieses Recht steht den Gläubigern jedoch nur zu, wenn sie glaubhaft machen, dass durch die Verschmelzung die Erfüllung ihrer Forderung gefährdet wird."
    },
    {
      "date": "2025-07-22",
      "id": "116916",
      "original_text": "Einreichung neuer Dokumente\nBayern Amtsgericht Passau HRB 9502\nFeuchter Bekleidungsmanagement AG – Ringelai",
      "type": "Einreichung neuer Dokumente",
      "state": "Bayern",
      "amtsgericht": "Amtsgericht Passau",
      "registernummer": "HRB 9502",
      "registerart": "HRB",
      "company_name": "Feuchter Bekleidungsmanagement AG",
      "company_seat": "Ringelai",
      "details": "22.07.2025 (Bekanntmachungsdatum)\n\nBayern Amtsgericht Passau HRB 9502\nEinreichung neuer Dokumente\n\nFeuchter Bekleidungsmanagement AG\nAktiengesellschaft\nRingelai\n\nDem #Re.Name ist eine Liste der Mitglieder des Aufsichtsrats eingereicht worden, § 106 AktG."
    },
    {
      "date": "2025-07-22",
      "id": "116917",
      "original_text": "Löschungsankündigung\nBayern Amtsgericht Ansbach HRB 4896\nDas Rastkontor GmbH – Aurach",
      "type": "Löschungsankündigung",
      "state": "Bayern",
      "amtsgericht": "Amtsgericht Ansbach",
      "registernummer": "HRB 4896",
      "registerart": "HRB",
      "company_name": "Das Rastkontor GmbH",
      "company_seat": "Aurach",
      "details": "22.07.2025 (Bekanntmachungsdatum)\n\nBayern Amtsgericht Ansbach HRB 4896\nLöschungsankündigung\n\nDas Rastkontor GmbH\nGesellschaft mit beschränkter Haftung\nAurach\n\nDas Registergericht beabsichtigt, die im Handelsregister eingetragene Gesellschaft wegen Vermögenslosigkeit von Amts wegen nach § 394 FamFG zu löschen. Die Frist zur Erhebung eines Widerspruchs ist auf sechs Wochen festgesetzt."
    },
    {
      "date": "2025-07-22",
      "id": "116918",
      "original_text": "Registerbekanntmachung nach dem Umwandlungsgesetz\nBayern Amtsgericht München HRB 140149\nmsg systems AG – Ismaning",
      "type": "Registerbekanntmachung nach dem Umwandlungsgesetz",
      "state": "Bayern",
      "amtsgericht": "Amtsgericht München",
      "registernummer": "HRB 140149",
      "registerart": "HRB",
      "company_name": "msg systems AG",
      "company_seat": "Ismaning",
      "details": "22.07.2025 (Bekanntmachungsdatum)\n\nBayern Amtsgericht München HRB 140149\nRegisterbekanntmachung nach dem Umwandlungsgesetz 21.07.2025 (Eintragungsdatum)\n\nmsg systems AG\nAktiengesellschaft\nIsmaning\n\nDen Gläubigern der an der Verschmelzung beteiligten Rechtsträger ist, wenn sie binnen sechs Monaten nach dem Tag, an dem die Eintragung der Verschmelzung in das Register des Sitzes desjenigen Rechtsträgers, dessen Gläubiger sie sind, nach § 19 Abs. 3 UmwG als bekannt gemacht gilt, ihren Anspruch nach Grund und Höhe in Textform anmelden, Sicherheit zu leisten, soweit sie nicht Befriedigung verlangen können. Dieses Recht steht den Gläubigern jedoch nur zu, wenn sie glaubhaft machen, dass durch die Verschmelzung die Erfüllung ihrer Forderung gefährdet wird."
    },
    {
      "date": "2025-07-22",
      "id": "116919",
      "original_text": "Registerbekanntmachung nach dem Umwandlungsgesetz\nBayern Amtsgericht Hof HRB 2439\nTenowo GmbH – Hof",
      "type": "Registerbekanntmachung nach dem Umwandlungsgesetz",
      "state": "Bayern",
      "amtsgericht": "Amtsgericht Hof",
      "registernummer": "HRB 2439",
      "registerart": "HRB",
      "company_name": "Tenowo GmbH",
      "company_seat": "Hof",
      "details": "22.07.2025 (Bekanntmachungsdatum)\n\nBayern Amtsgericht Hof HRB 2439\nRegisterbekanntmachung nach dem Umwandlungsgesetz 21.07.2025 (Eintragungsdatum)\n\nTenowo GmbH\nGesellschaft mit beschränkter Haftung\nHof\n\nDen Gläubigern der an der Verschmelzung beteiligten Rechtsträger ist, wenn sie binnen sechs Monaten nach dem Tag, an dem die Eintragung der Verschmelzung in das Register des Sitzes desjenigen Rechtsträgers, dessen Gläubiger sie sind, nach § 19 Abs. 3 UmwG als bekannt gemacht gilt, ihren Anspruch nach Grund und Höhe in Textform anmelden, Sicherheit zu leisten, soweit sie nicht Befriedigung verlangen können. Dieses Recht steht den Gläubigern jedoch nur zu, wenn sie glaubhaft machen, dass durch die Verschmelzung die Erfüllung ihrer Forderung gefährdet wird."
    },
    {
      "date": "2025-07-22",
      "id": "116920",
      "original_text": "Registerbekanntmachung nach dem Umwandlungsgesetz\nBayern Amtsgericht Hof HRB 2439\nTenowo GmbH – Hof",
      "type": "Registerbekanntmachung nach dem Umwandlungsgesetz",
      "state": "Bayern",
      "amtsgericht": "Amtsgericht Hof",
      "registernummer": "HRB 2439",
      "registerart": "HRB",
      "company_name": "Tenowo GmbH",
      "company_seat": "Hof",
      "details": "22.07.2025 (Bekanntmachungsdatum)\n\nBayern Amtsgericht Hof HRB 2439\nRegisterbekanntmachung nach dem Umwandlungsgesetz 21.07.2025 (Eintragungsdatum)\n\nTenowo GmbH\nGesellschaft mit beschränkter Haftung\nHof\n\nDen Gläubigern der an der Verschmelzung beteiligten Rechtsträger ist, wenn sie binnen sechs Monaten nach dem Tag, an dem die Eintragung der Verschmelzung in das Register des Sitzes desjenigen Rechtsträgers, dessen Gläubiger sie sind, nach § 19 Abs. 3 UmwG als bekannt gemacht gilt, ihren Anspruch nach Grund und Höhe in Textform anmelden, Sicherheit zu leisten, soweit sie nicht Befriedigung verlangen können. Dieses Recht steht den Gläubigern jedoch nur zu, wenn sie glaubhaft machen, dass durch die Verschmelzung die Erfüllung ihrer Forderung gefährdet wird."
    },
    {
      "date": "2025-07-22",
      "id": "116921",
      "original_text": "Registerbekanntmachung nach dem Umwandlungsgesetz\nBayern Amtsgericht Regensburg VR 862\nPRO FAMILIA, Deutsche Gesellschaft für Familienplanung, Sexualpädagogik und Sexualberatung, Ortsverband Regensburg e.V. – Regensburg",
      "type": "Registerbekanntmachung nach dem Umwandlungsgesetz",
      "state": "Bayern",
      "amtsgericht": "Amtsgericht Regensburg",
      "registernummer": "VR 862",
      "registerart": "VR",
      "company_name": "PRO FAMILIA, Deutsche Gesellschaft für Familienplanung, Sexualpädagogik und Sexualberatung, Ortsverband Regensburg e.V.",
      "company_seat": "Regensburg",
      "details": "22.07.2025 (Bekanntmachungsdatum)\n\nBayern Amtsgericht Regensburg VR 862\nRegisterbekanntmachung nach dem Umwandlungsgesetz 21.07.2025 (Eintragungsdatum)\n\nPRO FAMILIA, Deutsche Gesellschaft für Familienplanung, Sexualpädagogik und Sexualberatung, Ortsverband Regensburg e.V.\neingetragener Verein\nRegensburg\n\nDen Gläubigern der an der Verschmelzung beteiligten Rechtsträger ist, wenn sie binnen sechs Monaten nach dem Tag, an dem die Eintragung der Verschmelzung in das Register des Sitzes desjenigen Rechtsträgers, dessen Gläubiger sie sind, nach § 19 Abs. 3 UmwG als bekannt gemacht gilt, ihren Anspruch nach Grund und Höhe in Textform anmelden, Sicherheit zu leisten, soweit sie nicht Befriedigung verlangen können. Dieses Recht steht den Gläubigern jedoch nur zu, wenn sie glaubhaft machen, dass durch die Verschmelzung die Erfüllung ihrer Forderung gefährdet wird."
    },
    {
      "date": "2025-07-22",
      "id": "116922",
      "original_text": "Registerbekanntmachung nach dem Umwandlungsgesetz\nBayern Amtsgericht Nürnberg HRB 37213\nT9 GMW GmbH – Nürnberg",
      "type": "Registerbekanntmachung nach dem Umwandlungsgesetz",
      "state": "Bayern",
      "amtsgericht": "Amtsgericht Nürnberg",
      "registernummer": "HRB 37213",
      "registerart": "HRB",
      "company_name": "T9 GMW GmbH",
      "company_seat": "Nürnberg",
      "details": "22.07.2025 (Bekanntmachungsdatum)\n\nBayern Amtsgericht Nürnberg HRB 37213\nRegisterbekanntmachung nach dem Umwandlungsgesetz 21.07.2025 (Eintragungsdatum)\n\nT9 GMW GmbH\nGesellschaft mit beschränkter Haftung\nNürnberg\n\nDen Gläubigern der an der Verschmelzung beteiligten Rechtsträger ist, wenn sie binnen sechs Monaten nach dem Tag, an dem die Eintragung der Verschmelzung in das Register des Sitzes desjenigen Rechtsträgers, dessen Gläubiger sie sind, nach § 19 Abs. 3 UmwG als bekannt gemacht gilt, ihren Anspruch nach Grund und Höhe in Textform anmelden, Sicherheit zu leisten, soweit sie nicht Befriedigung verlangen können. Dieses Recht steht den Gläubigern jedoch nur zu, wenn sie glaubhaft machen, dass durch die Verschmelzung die Erfüllung ihrer Forderung gefährdet wird."
    },
    {
      "date": "2025-07-22",
      "id": "116923",
      "original_text": "Registerbekanntmachung nach dem Umwandlungsgesetz\nBerlin Amtsgericht Berlin (Charlottenburg) HRB 86382\nApleona Infra Services GmbH – Berlin",
      "type": "Registerbekanntmachung nach dem Umwandlungsgesetz",
      "state": "Berlin",
      "amtsgericht": "Amtsgericht Berlin (Charlottenburg)",
      "registernummer": "HRB 86382",
      "registerart": "HRB",
      "company_name": "Apleona Infra Services GmbH",
      "company_seat": "Berlin",
      "details": "22.07.2025 (Bekanntmachungsdatum)\n\nBerlin Amtsgericht Berlin (Charlottenburg) HRB 86382\nRegisterbekanntmachung nach dem Umwandlungsgesetz 21.07.2025 (Eintragungsdatum)\n\nApleona Infra Services GmbH\nGesellschaft mit beschränkter Haftung\nBerlin\n\nZu Eintragungsnummer 117 vom 21.07.2025 wird als nicht eingetragen veröffentlicht: Den Gläubigern der an der Verschmelzung beteiligten Rechtsträger ist, wenn sie binnen sechs Monaten nach dem Tag, an dem die Eintragung der Verschmelzung in das Register des Sitzes desjenigen Rechtsträgers, dessen Gläubiger sie sind, als bekannt gemacht gilt, ihren Anspruch nach Grund und Höhe schriftlich anmelden, Sicherheit zu leisten, soweit sie nicht Befriedigung verlangen können. Dieses Recht steht den Gläubigern jedoch nur zu, wenn sie glaubhaft machen, dass durch die Verschmelzung die Erfüllung ihrer Forderung gefährdet wird. Das Recht, Sicherheitsleistung zu verlangen, steht Gläubigern nicht zu, die im Falle der Insolvenz ein Recht auf vorzugsweise Befriedigung aus einer Deckungsmasse haben, die nach gesetzlicher Vorschrift zu ihrem Schutz errichtet und staatlich überwacht ist."
    },
    {
      "date": "2025-07-22",
      "id": "116924",
      "original_text": "Sonstige Registerbekanntmachung\nBrandenburg Amtsgericht Potsdam HRB 34928\nVILEG GmbH – Teltow",
      "type": "Sonstige Registerbekanntmachung",
      "state": "Brandenburg",
      "amtsgericht": "Amtsgericht Potsdam",
      "registernummer": "HRB 34928",
      "registerart": "HRB",
      "company_name": "VILEG GmbH",
      "company_seat": "Teltow",
      "details": "22.07.2025 (Bekanntmachungsdatum)\n\nBrandenburg Amtsgericht Potsdam HRB 34928\nSonstige Registerbekanntmachung\n\nVILEG GmbH\nGesellschaft mit beschränkter Haftung\nTeltow\n\nAls nicht eingetragen wird veröffentlicht: In der VILEG GmbH ist die Löschung der Eintragung des Geschäftsführers Dariusz Winkiel unter lfd Nr. 2 Spalte 4 b) vom 1. 11. 2923 von Amts wegen gemäß § 395 FamFG beabsichtigt, da nach Ermittlungen des Gerichts festgestellt werden musste, dass der eingetragene Geschäftsführer bereits am 7.3.2021 in Polen verstorben ist.\nLaut Schreiben der Staatsanwaltschaft  Berlin, AZ; 244 JS 13/25, liegt hier offensichtlich ein Identitätsmissbrauch vor. Die Person, welche die Personalien des verstorbenen Herrn Winkiel unbefugt benutzt hatte, konnte nicht namhaft gemacht werden.\nSomit ist es am 1.11.2023  zu einer unrichtigen Eintragung gekommen und das Amtslöschungsverfahren war von Amts wegen einzuleiten.\nSie erhalten Gelegenheit, gegen die beabsichtigte Löschung Widerspruch einzulegen. In diesem Fall reichen Sie bitte Unterlagen ein, welche die Richtigkeit der Eintragung vom\n1.11.2023 bezeugen.\nSollte binnen 2 Monaten ab Erhalt dieses Schreibens kein Widerspruch eingehen, erfolgt die Löschung der Eintragung des Geschäftsführers Winkiel im Register."
    },
    {
      "date": "2025-07-22",
      "id": "116925",
      "original_text": "Registerbekanntmachung nach dem Umwandlungsgesetz\nBaden-Württemberg Amtsgericht Stuttgart HRB 777399\nJolu Consult GmbH – Kirchheim unter Teck",
      "type": "Registerbekanntmachung nach dem Umwandlungsgesetz",
      "state": "Baden-Württemberg",
      "amtsgericht": "Amtsgericht Stuttgart",
      "registernummer": "HRB 777399",
      "registerart": "HRB",
      "company_name": "Jolu Consult GmbH",
      "company_seat": "Kirchheim unter Teck",
      "details": "22.07.2025 (Bekanntmachungsdatum)\n\nBaden-Württemberg Amtsgericht Stuttgart HRB 777399\nRegisterbekanntmachung nach dem Umwandlungsgesetz 22.07.2025 (Eintragungsdatum)\n\nJolu Consult GmbH\nGesellschaft mit beschränkter Haftung\nKirchheim unter Teck\n\nAls nicht eingetragen wird bekanntgemacht:\nDen Gläubigern der an der Verschmelzung beteiligten Rechtsträger ist, wenn sie binnen sechs Monaten nach dem Tag, an dem die Eintragung der Verschmelzung in das Register des Sitzes desjenigen Rechtsträgers, dessen Gläubiger sie sind, nach § 19 Abs. 3 UmwG als bekanntgemacht gilt, ihren Anspruch nach Grund und Höhe schriftlich anmelden, Sicherheit zu leisten, soweit sie nicht Befriedigung verlangen können. Dieses Recht steht den Gläubigern jedoch nur zu, wenn sie glaubhaft machen, dass durch die Verschmelzung die Erfüllung ihrer Forderung gefährdet wird."
    },
    {
      "date": "2025-07-22",
      "id": "116926",
      "original_text": "Sonstige Registerbekanntmachung\nBerlin Amtsgericht Berlin (Charlottenburg) HRB 5041\nBBB Bürgschaftsbank zu Berlin-Brandenburg GmbH – Berlin",
      "type": "Sonstige Registerbekanntmachung",
      "state": "Berlin",
      "amtsgericht": "Amtsgericht Berlin (Charlottenburg)",
      "registernummer": "HRB 5041",
      "registerart": "HRB",
      "company_name": "BBB Bürgschaftsbank zu Berlin-Brandenburg GmbH",
      "company_seat": "Berlin",
      "details": "22.07.2025 (Bekanntmachungsdatum)\n\nBerlin Amtsgericht Berlin (Charlottenburg) HRB 5041\nSonstige Registerbekanntmachung\n\nBBB Bürgschaftsbank zu Berlin-Brandenburg GmbH\nGesellschaft mit beschränkter Haftung\nBerlin\n\nAls nicht eingetragen wird veröffentlicht:Es wurde eine neue Liste der Aufsichtsratsmitglieder eingereicht (§52 GmbHG)."
    },
    {
      "date": "2025-07-22",
      "id": "116927",
      "original_text": "Sonstige Registerbekanntmachung\nHamburg Amtsgericht Hamburg HRB 91249\nHamburg Innovation GmbH – Hamburg",
      "type": "Sonstige Registerbekanntmachung",
      "state": "Hamburg",
      "amtsgericht": "Amtsgericht Hamburg",
      "registernummer": "HRB 91249",
      "registerart": "HRB",
      "company_name": "Hamburg Innovation GmbH",
      "company_seat": "Hamburg",
      "details": "22.07.2025 (Bekanntmachungsdatum)\n\nHamburg Amtsgericht Hamburg HRB 91249\nSonstige Registerbekanntmachung\n\nHamburg Innovation GmbH\nGesellschaft mit beschränkter Haftung\nHamburg\n\nAls nicht eingetragen wird bekannt gemacht: Liste des Aufsichtsrats wurde eingereicht."
    },
    {
      "date": "2025-07-22",
      "id": "116928",
      "original_text": "Löschungsankündigung\nBrandenburg Amtsgericht Potsdam HRB 26324\nKlimaerdspeicher GmbH – Schwielowsee",
      "type": "Löschungsankündigung",
      "state": "Brandenburg",
      "amtsgericht": "Amtsgericht Potsdam",
      "registernummer": "HRB 26324",
      "registerart": "HRB",
      "company_name": "Klimaerdspeicher GmbH",
      "company_seat": "Schwielowsee",
      "details": "22.07.2025 (Bekanntmachungsdatum)\n\nBrandenburg Amtsgericht Potsdam HRB 26324\nLöschungsankündigung\n\nKlimaerdspeicher GmbH\nGesellschaft mit beschränkter Haftung\nSchwielowsee\n\nBei der nachstehenden Gesellschaft wird das Amtslöschungsverfahren gemäß § 394 FamFG eingeleitet. Widerspruchsfrist: 8 Wochen"
    },
    {
      "date": "2025-07-22",
      "id": "116929",
      "original_text": "Registerbekanntmachung nach dem Umwandlungsgesetz\nSchleswig-Holstein Amtsgericht Flensburg HRB 13202\nEuroScience GmbH – Kappeln",
      "type": "Registerbekanntmachung nach dem Umwandlungsgesetz",
      "state": "Schleswig-Holstein",
      "amtsgericht": "Amtsgericht Flensburg",
      "registernummer": "HRB 13202",
      "registerart": "HRB",
      "company_name": "EuroScience GmbH",
      "company_seat": "Kappeln",
      "details": "22.07.2025 (Bekanntmachungsdatum)\n\nSchleswig-Holstein Amtsgericht Flensburg HRB 13202\nRegisterbekanntmachung nach dem Umwandlungsgesetz 17.07.2025 (Eintragungsdatum)\n\nEuroScience GmbH\nGesellschaft mit beschränkter Haftung\nKappeln\n\nZu Eintragungsnummer 3 vom 17.07.2025 wird als nicht eingetragen veröffentlicht:\nDen Gläubigern der an der Verschmelzung beteiligten Rechtsträger ist, wenn sie binnen sechs Monaten nach dem Tag, an dem die Eintragung der Verschmelzung in das Register des Sitzes desjenigen Rechtsträgers, dessen Gläubiger sie sind, als bekannt gemacht gilt, ihren Anspruch nach Grund und Höhe schriftlich anmelden, Sicherheit zu leisten, soweit sie nicht Befriedigung verlangen können. Dieses Recht steht den Gläubigern jedoch nur zu, wenn sie glaubhaft machen, dass durch die Verschmelzung die Erfüllung ihrer Forderung gefährdet wird. Das Recht, Sicherheitsleistung zu verlangen, steht Gläubigern nicht zu, die im Falle der Insolvenz ein Recht auf vorzugsweise Befriedigung aus einer Deckungsmasse haben, die nach gesetzlicher Vorschrift zu ihrem Schutz errichtet und staatlich überwacht ist."
    },
    {
      "date": "2025-07-22",
      "id": "116930",
      "original_text": "Löschungsankündigung\nBaden-Württemberg Amtsgericht Freiburg HRB 713838\nHot4Spot GmbH – Heitersheim",
      "type": "Löschungsankündigung",
      "state": "Baden-Württemberg",
      "amtsgericht": "Amtsgericht Freiburg",
      "registernummer": "HRB 713838",
      "registerart": "HRB",
      "company_name": "Hot4Spot GmbH",
      "company_seat": "Heitersheim",
      "details": "22.07.2025 (Bekanntmachungsdatum)\n\nBaden-Württemberg Amtsgericht Freiburg HRB 713838\nLöschungsankündigung\n\nHot4Spot GmbH\nGesellschaft mit beschränkter Haftung\nHeitersheim\n\nAls nicht eingetragen wird bekanntgemacht:\nDas Gericht beabsichtigt, die Gesellschaft wegen Vermögenslosigkeit im Handelsregister von Amts wegen nach § 394 FamFG zu löschen. Die Frist zur Geltendmachung eines Widerspruchs gegen die beabsichtigte Löschung ist auf einen Monat ab Veröffentlichung bestimmt."
    },
    {
      "date": "2025-07-22",
      "id": "116931",
      "original_text": "Registerbekanntmachung nach dem Umwandlungsgesetz\nHamburg Amtsgericht Hamburg HRB 36445\nGayen & Berns, Homann GmbH – Hamburg",
      "type": "Registerbekanntmachung nach dem Umwandlungsgesetz",
      "state": "Hamburg",
      "amtsgericht": "Amtsgericht Hamburg",
      "registernummer": "HRB 36445",
      "registerart": "HRB",
      "company_name": "Gayen & Berns, Homann GmbH",
      "company_seat": "Hamburg",
      "details": "22.07.2025 (Bekanntmachungsdatum)\n\nHamburg Amtsgericht Hamburg HRB 36445\nRegisterbekanntmachung nach dem Umwandlungsgesetz 22.07.2025 (Eintragungsdatum)\n\nGayen & Berns, Homann GmbH\nGesellschaft mit beschränkter Haftung\nHamburg\n\nAls nicht eingetragen wird bekannt gemacht:\nDen Gläubigern der an der Verschmelzung beteiligten Gesellschaften ist, wenn sie binnen sechs Monaten nach dem Tag, an dem die Eintragung der Verschmelzung in das Register des Sitzes desjenigen Rechtsträgers, dessen Gläubiger sie sind, nach § 19 Absatz 3 UmwG als bekannt gemacht gilt, ihren Anspruch nach Grund und Höhe schriftlich anmelden, Sicherheit zu leisten, soweit sie nicht Befriedigung verlangen können. Dieses Recht steht den Gläubigern jedoch nur zu, wenn sie glaubhaft machen, dass durch die Verschmelzung die Erfüllung ihrer Forderung gefährdet wird."
    },
    {
      "date": "2025-07-22",
      "id": "116932",
      "original_text": "Registerbekanntmachung nach dem Umwandlungsgesetz\nHamburg Amtsgericht Hamburg HRB 177498\nGGW GmbH – Hamburg",
      "type": "Registerbekanntmachung nach dem Umwandlungsgesetz",
      "state": "Hamburg",
      "amtsgericht": "Amtsgericht Hamburg",
      "registernummer": "HRB 177498",
      "registerart": "HRB",
      "company_name": "GGW GmbH",
      "company_seat": "Hamburg",
      "details": "22.07.2025 (Bekanntmachungsdatum)\n\nHamburg Amtsgericht Hamburg HRB 177498\nRegisterbekanntmachung nach dem Umwandlungsgesetz 22.07.2025 (Eintragungsdatum)\n\nGGW GmbH\nGesellschaft mit beschränkter Haftung\nHamburg\n\nAls nicht eingetragen wird bekannt gemacht:\nDen Gläubigern der an der Verschmelzung beteiligten Gesellschaften ist, wenn sie binnen sechs Monaten nach dem Tag, an dem die Eintragung der Verschmelzung in das Register des Sitzes desjenigen Rechtsträgers, dessen Gläubiger sie sind, nach § 19 Absatz 3 UmwG als bekannt gemacht gilt, ihren Anspruch nach Grund und Höhe schriftlich anmelden, Sicherheit zu leisten, soweit sie nicht Befriedigung verlangen können. Dieses Recht steht den Gläubigern jedoch nur zu, wenn sie glaubhaft machen, dass durch die Verschmelzung die Erfüllung ihrer Forderung gefährdet wird."
    },
    {
      "date": "2025-07-22",
      "id": "116933",
      "original_text": "Registerbekanntmachung nach dem Umwandlungsgesetz\nHamburg Amtsgericht Hamburg HRB 70871\nHansekontor Maklergesellschaft mbH – Hamburg",
      "type": "Registerbekanntmachung nach dem Umwandlungsgesetz",
      "state": "Hamburg",
      "amtsgericht": "Amtsgericht Hamburg",
      "registernummer": "HRB 70871",
      "registerart": "HRB",
      "company_name": "Hansekontor Maklergesellschaft mbH",
      "company_seat": "Hamburg",
      "details": "22.07.2025 (Bekanntmachungsdatum)\n\nHamburg Amtsgericht Hamburg HRB 70871\nRegisterbekanntmachung nach dem Umwandlungsgesetz 22.07.2025 (Eintragungsdatum)\n\nHansekontor Maklergesellschaft mbH\nGesellschaft mit beschränkter Haftung\nHamburg\n\nAls nicht eingetragen wird bekannt gemacht:\nDen Gläubigern der an der Verschmelzung beteiligten Gesellschaften ist, wenn sie binnen sechs Monaten nach dem Tag, an dem die Eintragung der Verschmelzung in das Register des Sitzes desjenigen Rechtsträgers, dessen Gläubiger sie sind, nach § 19 Absatz 3 UmwG als bekannt gemacht gilt, ihren Anspruch nach Grund und Höhe schriftlich anmelden, Sicherheit zu leisten, soweit sie nicht Befriedigung verlangen können. Dieses Recht steht den Gläubigern jedoch nur zu, wenn sie glaubhaft machen, dass durch die Verschmelzung die Erfüllung ihrer Forderung gefährdet wird."
    },
    {
      "date": "2025-07-22",
      "id": "116934",
      "original_text": "Registerbekanntmachung nach dem Umwandlungsgesetz\nBrandenburg Amtsgericht Neuruppin HRA 3889\nIH & S Innovatives Homecare Servicing Inh. Gabriele Frey e.K. – Prenzlau",
      "type": "Registerbekanntmachung nach dem Umwandlungsgesetz",
      "state": "Brandenburg",
      "amtsgericht": "Amtsgericht Neuruppin",
      "registernummer": "HRA 3889",
      "registerart": "HRA",
      "company_name": "IH & S Innovatives Homecare Servicing Inh. Gabriele Frey e.K.",
      "company_seat": "Prenzlau",
      "details": "22.07.2025 (Bekanntmachungsdatum)\n\nBrandenburg Amtsgericht Neuruppin HRA 3889\nRegisterbekanntmachung nach dem Umwandlungsgesetz 21.07.2025 (Eintragungsdatum)\n\nIH & S Innovatives Homecare Servicing Inh. Gabriele Frey e.K.\nEinzelkaufmann / Einzelkauffrau\nPrenzlau\n\nZu Eintragungsnummer 2 vom 21.07.2025 wird als nicht eingetragen veröffentlicht:\nDen Gläubigern der an der Umwandlung beteiligten Rechtsträger ist, wenn sie binnen sechs Monaten nach dem Tag, an dem die Eintragung der Umwandlung in das Register des Sitzes desjenigen Rechtsträgers, dessen Gläubiger sie sind, als bekannt gemacht gilt, ihren Anspruch nach Grund und Höhe schriftlich anmelden, Sicherheit zu leisten, soweit sie nicht Befriedigung verlangen können. Dieses Recht steht den Gläubigern jedoch nur zu, wenn sie glaubhaft machen, dass durch die Umwandlung die Erfüllung ihrer Forderung gefährdet wird"
    },
    {
      "date": "2025-07-22",
      "id": "116935",
      "original_text": "Registerbekanntmachung nach dem Umwandlungsgesetz\nBrandenburg Amtsgericht Cottbus HRA 4462\nStefan Vielhaber, Finanzberater und Versicherungsvermittler e.Kfm. – Schönefeld",
      "type": "Registerbekanntmachung nach dem Umwandlungsgesetz",
      "state": "Brandenburg",
      "amtsgericht": "Amtsgericht Cottbus",
      "registernummer": "HRA 4462",
      "registerart": "HRA",
      "company_name": "Stefan Vielhaber, Finanzberater und Versicherungsvermittler e.Kfm.",
      "company_seat": "Schönefeld",
      "details": "22.07.2025 (Bekanntmachungsdatum)\n\nBrandenburg Amtsgericht Cottbus HRA 4462\nRegisterbekanntmachung nach dem Umwandlungsgesetz 21.07.2025 (Eintragungsdatum)\n\nStefan Vielhaber, Finanzberater und Versicherungsvermittler e.Kfm.\nEinzelkaufmann / Einzelkauffrau\nSchönefeld\n\nAls nicht eingetragen wird veröffentlicht:\nDen Gläubigern der an der Spaltung beteiligten Rechtsträger ist, wenn sie binnen sechs Monaten nach dem Tag, an dem die Eintragung der Spaltung in das Register des Sitzes desjenigen Rechtsträgers, dessen Gläubiger sie sind, als bekannt gemacht gilt, ihren Anspruch nach Grund und Höhe schriftlich anmelden, Sicherheit zu leisten, soweit sie nicht Befriedigung verlangen können. Dieses Recht steht den Gläubigern jedoch nur zu, wenn sie glaubhaft machen, dass durch die Spaltung die Erfüllung ihrer Forderung gefährdet wird"
    },
    {
      "date": "2025-07-22",
      "id": "116936",
      "original_text": "Registerbekanntmachung nach dem Umwandlungsgesetz\nBerlin Amtsgericht Berlin (Charlottenburg) HRB 229241\n4regional GmbH – Berlin",
      "type": "Registerbekanntmachung nach dem Umwandlungsgesetz",
      "state": "Berlin",
      "amtsgericht": "Amtsgericht Berlin (Charlottenburg)",
      "registernummer": "HRB 229241",
      "registerart": "HRB",
      "company_name": "4regional GmbH",
      "company_seat": "Berlin",
      "details": "22.07.2025 (Bekanntmachungsdatum)\n\nBerlin Amtsgericht Berlin (Charlottenburg) HRB 229241\nRegisterbekanntmachung nach dem Umwandlungsgesetz 21.07.2025 (Eintragungsdatum)\n\n4regional GmbH\nGesellschaft mit beschränkter Haftung\nBerlin\n\nZu Eintragungsnummer 3 vom 21.07.2025 wird als nicht eingetragen veröffentlicht:Den Gläubigern der an der Verschmelzung beteiligten Rechtsträger ist, wenn sie binnen sechs Monaten nach dem Tag, an dem die Eintragung der Verschmelzung in das Register des Sitzes desjenigen Rechtsträgers, dessen Gläubiger sie sind, als bekannt gemacht gilt, ihren Anspruch nach Grund und Höhe schriftlich anmelden, Sicherheit zu leisten, soweit sie nicht Befriedigung verlangen können. Dieses Recht steht den Gläubigern jedoch nur zu, wenn sie glaubhaft machen, dass durch die Verschmelzung die Erfüllung ihrer Forderung gefährdet wird. Das Recht, Sicherheitsleistung zu verlangen, steht Gläubigern nicht zu, die im Falle der Insolvenz ein Recht auf vorzugsweise Befriedigung aus einer Deckungsmasse haben, die nach gesetzlicher Vorschrift zu ihrem Schutz errichtet und staatlich überwacht ist."
    },
    {
      "date": "2025-07-22",
      "id": "116937",
      "original_text": "Registerbekanntmachung nach dem Umwandlungsgesetz\nBaden-Württemberg Amtsgericht Stuttgart GnR 720299\nWagner eG – Michelbach an der Binz",
      "type": "Registerbekanntmachung nach dem Umwandlungsgesetz",
      "state": "Baden-Württemberg",
      "amtsgericht": "Amtsgericht Stuttgart",
      "registernummer": "GnR 720299",
      "registerart": "GnR",
      "company_name": "Wagner eG",
      "company_seat": "Michelbach an der Binz",
      "details": "22.07.2025 (Bekanntmachungsdatum)\n\nBaden-Württemberg Amtsgericht Stuttgart GnR 720299\nRegisterbekanntmachung nach dem Umwandlungsgesetz 22.07.2025 (Eintragungsdatum)\n\nWagner eG\neingetragene Genossenschaft\nMichelbach an der Binz\n\nAls nicht eingetragen wird bekanntgemacht:\nDen Gläubigern des an dem Formwechsel beteiligten Rechtsträgers ist, wenn sie binnen sechs Monaten nach dem Tag, an dem die Eintragung des Formwechsels in das Register des Sitzes desjenigen Rechtsträgers, dessen Gläubiger sie sind, nach § 19 Abs. 3 UmwG als bekanntgemacht gilt, ihren Anspruch nach Grund und Höhe schriftlich anmelden, Sicherheit zu leisten, soweit sie nicht Befriedigung verlangen können. Dieses Recht steht den Gläubigern jedoch nur zu, wenn sie glaubhaft machen, dass durch den Formwechsel die Erfüllung ihrer Forderung gefährdet wird."
    },
    {
      "date": "2025-07-22",
      "id": "116938",
      "original_text": "Registerbekanntmachung nach dem Umwandlungsgesetz\nBerlin Amtsgericht Berlin (Charlottenburg) HRB 259595\nRegional KonTouren GmbH – Berlin",
      "type": "Registerbekanntmachung nach dem Umwandlungsgesetz",
      "state": "Berlin",
      "amtsgericht": "Amtsgericht Berlin (Charlottenburg)",
      "registernummer": "HRB 259595",
      "registerart": "HRB",
      "company_name": "Regional KonTouren GmbH",
      "company_seat": "Berlin",
      "details": "22.07.2025 (Bekanntmachungsdatum)\n\nBerlin Amtsgericht Berlin (Charlottenburg) HRB 259595\nRegisterbekanntmachung nach dem Umwandlungsgesetz 21.07.2025 (Eintragungsdatum)\n\nRegional KonTouren GmbH\nGesellschaft mit beschränkter Haftung\nBerlin\n\nZu Eintragungsnummer 2 vom 21.07.2025 wird als nicht eingetragen veröffentlicht:Den Gläubigern der an der Verschmelzung beteiligten Rechtsträger ist, wenn sie binnen sechs Monaten nach dem Tag, an dem die Eintragung der Verschmelzung in das Register des Sitzes desjenigen Rechtsträgers, dessen Gläubiger sie sind, als bekannt gemacht gilt, ihren Anspruch nach Grund und Höhe schriftlich anmelden, Sicherheit zu leisten, soweit sie nicht Befriedigung verlangen können. Dieses Recht steht den Gläubigern jedoch nur zu, wenn sie glaubhaft machen, dass durch die Verschmelzung die Erfüllung ihrer Forderung gefährdet wird. Das Recht, Sicherheitsleistung zu verlangen, steht Gläubigern nicht zu, die im Falle der Insolvenz ein Recht auf vorzugsweise Befriedigung aus einer Deckungsmasse haben, die nach gesetzlicher Vorschrift zu ihrem Schutz errichtet und staatlich überwacht ist."
    },
    {
      "date": "2025-07-22",
      "id": "116939",
      "original_text": "Registerbekanntmachung nach dem Umwandlungsgesetz\nBaden-Württemberg Amtsgericht Stuttgart HRB 787619\nMathias Wagner UG (haftungsbeschränkt) – Schwäbisch Hall",
      "type": "Registerbekanntmachung nach dem Umwandlungsgesetz",
      "state": "Baden-Württemberg",
      "amtsgericht": "Amtsgericht Stuttgart",
      "registernummer": "HRB 787619",
      "registerart": "HRB",
      "company_name": "Mathias Wagner UG (haftungsbeschränkt)",
      "company_seat": "Schwäbisch Hall",
      "details": "22.07.2025 (Bekanntmachungsdatum)\n\nBaden-Württemberg Amtsgericht Stuttgart HRB 787619\nRegisterbekanntmachung nach dem Umwandlungsgesetz 22.07.2025 (Eintragungsdatum)\n\nMathias Wagner UG (haftungsbeschränkt)\nGesellschaft mit beschränkter Haftung\nSchwäbisch Hall\n\nAls nicht eingetragen wird bekanntgemacht:\nDen Gläubigern des an dem Formwechsel beteiligten Rechtsträgers ist, wenn sie binnen sechs Monaten nach dem Tag, an dem die Eintragung des Formwechsels in das Register des Sitzes desjenigen Rechtsträgers, dessen Gläubiger sie sind, nach § 19 Abs. 3 UmwG als bekanntgemacht gilt, ihren Anspruch nach Grund und Höhe schriftlich anmelden, Sicherheit zu leisten, soweit sie nicht Befriedigung verlangen können. Dieses Recht steht den Gläubigern jedoch nur zu, wenn sie glaubhaft machen, dass durch den Formwechsel die Erfüllung ihrer Forderung gefährdet wird."
    },
    {
      "date": "2025-07-22",
      "id": "116940",
      "original_text": "Löschungsankündigung\nBaden-Württemberg Amtsgericht Stuttgart HRA 730008\nSmart Logistik e.K. – Leinfelden-Echterdingen",
      "type": "Löschungsankündigung",
      "state": "Baden-Württemberg",
      "amtsgericht": "Amtsgericht Stuttgart",
      "registernummer": "HRA 730008",
      "registerart": "HRA",
      "company_name": "Smart Logistik e.K.",
      "company_seat": "Leinfelden-Echterdingen",
      "details": "22.07.2025 (Bekanntmachungsdatum)\n\nBaden-Württemberg Amtsgericht Stuttgart HRA 730008\nLöschungsankündigung\n\nSmart Logistik e.K.\nEinzelkaufmann / Einzelkauffrau\nLeinfelden-Echterdingen\n\nDas Registergericht beabsichtigt, die Firma im Handelsregister von Amts wegen nach § 31 Abs. 2 HGB zu löschen. Die Frist zur Geltendmachung eines Widerspruchs gegen die beabsichtigte Löschung ist auf einen Monat ab Veröffentlichung bestimmt."
    },
    {
      "date": "2025-07-22",
      "id": "116941",
      "original_text": "Löschungsankündigung\nBerlin Amtsgericht Berlin (Charlottenburg) HRB 75964\nHDW GmbH Dienstleistungs- Instandhaltungs- und Reparaturservice – Berlin",
      "type": "Löschungsankündigung",
      "state": "Berlin",
      "amtsgericht": "Amtsgericht Berlin (Charlottenburg)",
      "registernummer": "HRB 75964",
      "registerart": "HRB",
      "company_name": "HDW GmbH Dienstleistungs- Instandhaltungs- und Reparaturservice",
      "company_seat": "Berlin",
      "details": "22.07.2025 (Bekanntmachungsdatum)\n\nBerlin Amtsgericht Berlin (Charlottenburg) HRB 75964\nLöschungsankündigung\n\nHDW GmbH Dienstleistungs- Instandhaltungs- und Reparaturservice\nGesellschaft mit beschränkter Haftung\nBerlin\n\nBei der nachstehenden Gesellschaft wird das Amtslöschungsverfahren gemäß § 394 FamFG eingeleitet. Widerspruchsfrist 6 Wochen"
    },
    {
      "date": "2025-07-22",
      "id": "116942",
      "original_text": "Registerbekanntmachung nach dem Umwandlungsgesetz\nBaden-Württemberg Amtsgericht Mannheim HRB 6327\nSchaller Mediahaus GmbH – Mannheim",
      "type": "Registerbekanntmachung nach dem Umwandlungsgesetz",
      "state": "Baden-Württemberg",
      "amtsgericht": "Amtsgericht Mannheim",
      "registernummer": "HRB 6327",
      "registerart": "HRB",
      "company_name": "Schaller Mediahaus GmbH",
      "company_seat": "Mannheim",
      "details": "22.07.2025 (Bekanntmachungsdatum)\n\nBaden-Württemberg Amtsgericht Mannheim HRB 6327\nRegisterbekanntmachung nach dem Umwandlungsgesetz 22.07.2025 (Eintragungsdatum)\n\nSchaller Mediahaus GmbH\nGesellschaft mit beschränkter Haftung\nMannheim\n\nDen Gläubigern der an der Verschmelzung beteiligten Rechtsträger ist, wenn sie binnen sechs Monaten nach dem Tag, an dem die Eintragung der Verschmelzung in das Register des Sitzes desjenigen Rechtsträgers, dessen Gläubiger sie sind, nach § 19 Abs. 3 UmwG als bekanntgemacht gilt, ihren Anspruch nach Grund und Höhe schriftlich anmelden, Sicherheit zu leisten, soweit sie nicht Befriedigung verlangen können. Dieses Recht steht den Gläubigern jedoch nur zu, wenn sie glaubhaft machen, dass durch die Verschmelzung die Erfüllung ihrer Forderung gefährdet wird."
    },
    {
      "date": "2025-07-22",
      "id": "116943",
      "original_text": "Registerbekanntmachung nach dem Umwandlungsgesetz\nBaden-Württemberg Amtsgericht Ulm HRA 729686\nEcoLiving Ravensburg GmbH & Co. KG – Ravensburg",
      "type": "Registerbekanntmachung nach dem Umwandlungsgesetz",
      "state": "Baden-Württemberg",
      "amtsgericht": "Amtsgericht Ulm",
      "registernummer": "HRA 729686",
      "registerart": "HRA",
      "company_name": "EcoLiving Ravensburg GmbH & Co. KG",
      "company_seat": "Ravensburg",
      "details": "22.07.2025 (Bekanntmachungsdatum)\n\nBaden-Württemberg Amtsgericht Ulm HRA 729686\nRegisterbekanntmachung nach dem Umwandlungsgesetz 22.07.2025 (Eintragungsdatum)\n\nEcoLiving Ravensburg GmbH & Co. KG\nKommanditgesellschaft\nRavensburg\n\nAls nicht eingetragen wird bekanntgemacht:\nDen Gläubigern des an dem Formwechsel beteiligten Rechtsträgers ist, wenn sie binnen sechs Monaten nach dem Tag, an dem die Eintragung des Formwechsels in das Register des Sitzes desjenigen Rechtsträgers, dessen Gläubiger sie sind, nach § 19 Abs. 3 UmwG als bekanntgemacht gilt, ihren Anspruch nach Grund und Höhe schriftlich anmelden, Sicherheit zu leisten, soweit sie nicht Befriedigung verlangen können. Dieses Recht steht den Gläubigern jedoch nur zu, wenn sie glaubhaft machen, dass durch den Formwechsel die Erfüllung ihrer Forderung gefährdet wird."
    },
    {
      "date": "2025-07-22",
      "id": "116944",
      "original_text": "Löschungsankündigung\nBaden-Württemberg Amtsgericht Freiburg HRA 704439\nHottenlocher \"Der Hofladen.\" GmbH & Co. KG – Konstanz",
      "type": "Löschungsankündigung",
      "state": "Baden-Württemberg",
      "amtsgericht": "Amtsgericht Freiburg",
      "registernummer": "HRA 704439",
      "registerart": "HRA",
      "company_name": "Hottenlocher \"Der Hofladen.\" GmbH & Co. KG",
      "company_seat": "Konstanz",
      "details": "22.07.2025 (Bekanntmachungsdatum)\n\nBaden-Württemberg Amtsgericht Freiburg HRA 704439\nLöschungsankündigung\n\nHottenlocher \"Der Hofladen.\" GmbH & Co. KG\nKommanditgesellschaft\nKonstanz\n\nAls nicht eingetragen wird bekanntgemacht:\nDas Gericht beabsichtigt, die Gesellschaft wegen Vermögenslosigkeit im Handelsregister von Amts wegen nach § 394 FamFG zu löschen. Die Frist zur Geltendmachung eines Widerspruchs gegen die beabsichtigte Löschung ist auf einen Monat ab Veröffentlichung bestimmt."
    },
    {
      "date": "2025-07-22",
      "id": "116945",
      "original_text": "Registerbekanntmachung nach dem Umwandlungsgesetz\nBaden-Württemberg Amtsgericht Stuttgart HRB 778739\nDillinger Weg Projektentwicklungs- GmbH – Fellbach",
      "type": "Registerbekanntmachung nach dem Umwandlungsgesetz",
      "state": "Baden-Württemberg",
      "amtsgericht": "Amtsgericht Stuttgart",
      "registernummer": "HRB 778739",
      "registerart": "HRB",
      "company_name": "Dillinger Weg Projektentwicklungs- GmbH",
      "company_seat": "Fellbach",
      "details": "22.07.2025 (Bekanntmachungsdatum)\n\nBaden-Württemberg Amtsgericht Stuttgart HRB 778739\nRegisterbekanntmachung nach dem Umwandlungsgesetz 22.07.2025 (Eintragungsdatum)\n\nDillinger Weg Projektentwicklungs- GmbH\nGesellschaft mit beschränkter Haftung\nFellbach\n\nAls nicht eingetragen wird bekanntgemacht:\nDen Gläubigern der an der Verschmelzung beteiligten Rechtsträger ist, wenn sie binnen sechs Monaten nach dem Tag, an dem die Eintragung der Verschmelzung in das Register des Sitzes desjenigen Rechtsträgers, dessen Gläubiger sie sind, nach § 19 Abs. 3 UmwG als bekanntgemacht gilt, ihren Anspruch nach Grund und Höhe schriftlich anmelden, Sicherheit zu leisten, soweit sie nicht Befriedigung verlangen können. Dieses Recht steht den Gläubigern jedoch nur zu, wenn sie glaubhaft machen, dass durch die Verschmelzung die Erfüllung ihrer Forderung gefährdet wird."
    },
    {
      "date": "2025-07-22",
      "id": "116946",
      "original_text": "Registerbekanntmachung nach dem Umwandlungsgesetz\nBaden-Württemberg Amtsgericht Ulm HRB 738156\nSTORZ Capital GmbH – Ravensburg",
      "type": "Registerbekanntmachung nach dem Umwandlungsgesetz",
      "state": "Baden-Württemberg",
      "amtsgericht": "Amtsgericht Ulm",
      "registernummer": "HRB 738156",
      "registerart": "HRB",
      "company_name": "STORZ Capital GmbH",
      "company_seat": "Ravensburg",
      "details": "22.07.2025 (Bekanntmachungsdatum)\n\nBaden-Württemberg Amtsgericht Ulm HRB 738156\nRegisterbekanntmachung nach dem Umwandlungsgesetz 22.07.2025 (Eintragungsdatum)\n\nSTORZ Capital GmbH\nGesellschaft mit beschränkter Haftung\nRavensburg\n\nAls nicht eingetragen wird bekanntgemacht:\nDen Gläubigern des an dem Formwechsel beteiligten Rechtsträgers ist, wenn sie binnen sechs Monaten nach dem Tag, an dem die Eintragung des Formwechsels in das Register des Sitzes desjenigen Rechtsträgers, dessen Gläubiger sie sind, nach § 19 Abs. 3 UmwG als bekanntgemacht gilt, ihren Anspruch nach Grund und Höhe schriftlich anmelden, Sicherheit zu leisten, soweit sie nicht Befriedigung verlangen können. Dieses Recht steht den Gläubigern jedoch nur zu, wenn sie glaubhaft machen, dass durch den Formwechsel die Erfüllung ihrer Forderung gefährdet wird."
    },
    {
      "date": "2025-07-22",
      "id": "116947",
      "original_text": "Löschungsankündigung\nBerlin Amtsgericht Berlin (Charlottenburg) HRB 210553\nCHROMIC GmbH – Berlin",
      "type": "Löschungsankündigung",
      "state": "Berlin",
      "amtsgericht": "Amtsgericht Berlin (Charlottenburg)",
      "registernummer": "HRB 210553",
      "registerart": "HRB",
      "company_name": "CHROMIC GmbH",
      "company_seat": "Berlin",
      "details": "22.07.2025 (Bekanntmachungsdatum)\n\nBerlin Amtsgericht Berlin (Charlottenburg) HRB 210553\nLöschungsankündigung\n\nCHROMIC GmbH\nGesellschaft mit beschränkter Haftung\nBerlin\n\nBei der nachstehenden Gesellschaft wird das Amtslöschungsverfahren gemäß § 394 FamFG eingeleitet. Widerspruchsfrist 6 Wochen"
    },
    {
      "date": "2025-07-22",
      "id": "116948",
      "original_text": "Registerbekanntmachung nach dem Umwandlungsgesetz\nBaden-Württemberg Amtsgericht Stuttgart HRB 796928\nKiTa Campus Remscheid GmbH – Fellbach",
      "type": "Registerbekanntmachung nach dem Umwandlungsgesetz",
      "state": "Baden-Württemberg",
      "amtsgericht": "Amtsgericht Stuttgart",
      "registernummer": "HRB 796928",
      "registerart": "HRB",
      "company_name": "KiTa Campus Remscheid GmbH",
      "company_seat": "Fellbach",
      "details": "22.07.2025 (Bekanntmachungsdatum)\n\nBaden-Württemberg Amtsgericht Stuttgart HRB 796928\nRegisterbekanntmachung nach dem Umwandlungsgesetz 22.07.2025 (Eintragungsdatum)\n\nKiTa Campus Remscheid GmbH\nGesellschaft mit beschränkter Haftung\nFellbach\n\nDen Gläubigern der an der Verschmelzung beteiligten Rechtsträger ist, wenn sie binnen sechs Monaten nach dem Tag, an dem die Eintragung der Verschmelzung in das Register des Sitzes desjenigen Rechtsträgers, dessen Gläubiger sie sind, nach § 19 Abs. 3 UmwG als bekanntgemacht gilt, ihren Anspruch nach Grund und Höhe schriftlich anmelden, Sicherheit zu leisten, soweit sie nicht Befriedigung verlangen können. Dieses Recht steht den Gläubigern jedoch nur zu, wenn sie glaubhaft machen, dass durch die Verschmelzung die Erfüllung ihrer Forderung gefährdet wird."
    },
    {
      "date": "2025-07-22",
      "id": "116949",
      "original_text": "Registerbekanntmachung nach dem Umwandlungsgesetz\nHamburg Amtsgericht Hamburg HRB 167244\nvR&S Vorsorgemanagement GmbH – Hamburg",
      "type": "Registerbekanntmachung nach dem Umwandlungsgesetz",
      "state": "Hamburg",
      "amtsgericht": "Amtsgericht Hamburg",
      "registernummer": "HRB 167244",
      "registerart": "HRB",
      "company_name": "vR&S Vorsorgemanagement GmbH",
      "company_seat": "Hamburg",
      "details": "22.07.2025 (Bekanntmachungsdatum)\n\nHamburg Amtsgericht Hamburg HRB 167244\nRegisterbekanntmachung nach dem Umwandlungsgesetz 22.07.2025 (Eintragungsdatum)\n\nvR&S Vorsorgemanagement GmbH\nGesellschaft mit beschränkter Haftung\nHamburg\n\nAls nicht eingetragen wird bekannt gemacht:\nDen Gläubigern der an der Verschmelzung beteiligten Gesellschaften ist, wenn sie binnen sechs Monaten nach dem Tag, an dem die Eintragung der Verschmelzung in das Register des Sitzes desjenigen Rechtsträgers, dessen Gläubiger sie sind, nach § 19 Absatz 3 UmwG als bekannt gemacht gilt, ihren Anspruch nach Grund und Höhe schriftlich anmelden, Sicherheit zu leisten, soweit sie nicht Befriedigung verlangen können. Dieses Recht steht den Gläubigern jedoch nur zu, wenn sie glaubhaft machen, dass durch die Verschmelzung die Erfüllung ihrer Forderung gefährdet wird."
    },
    {
      "date": "2025-07-22",
      "id": "116950",
      "original_text": "Registerbekanntmachung nach dem Umwandlungsgesetz\nHamburg Amtsgericht Hamburg HRB 93652\nGGW Vorsorge GmbH – Hamburg",
      "type": "Registerbekanntmachung nach dem Umwandlungsgesetz",
      "state": "Hamburg",
      "amtsgericht": "Amtsgericht Hamburg",
      "registernummer": "HRB 93652",
      "registerart": "HRB",
      "company_name": "GGW Vorsorge GmbH",
      "company_seat": "Hamburg",
      "details": "22.07.2025 (Bekanntmachungsdatum)\n\nHamburg Amtsgericht Hamburg HRB 93652\nRegisterbekanntmachung nach dem Umwandlungsgesetz 22.07.2025 (Eintragungsdatum)\n\nGGW Vorsorge GmbH\nGesellschaft mit beschränkter Haftung\nHamburg\n\nAls nicht eingetragen wird bekannt gemacht:\nDen Gläubigern der an der Verschmelzung beteiligten Gesellschaften ist, wenn sie binnen sechs Monaten nach dem Tag, an dem die Eintragung der Verschmelzung in das Register des Sitzes desjenigen Rechtsträgers, dessen Gläubiger sie sind, nach § 19 Absatz 3 UmwG als bekannt gemacht gilt, ihren Anspruch nach Grund und Höhe schriftlich anmelden, Sicherheit zu leisten, soweit sie nicht Befriedigung verlangen können. Dieses Recht steht den Gläubigern jedoch nur zu, wenn sie glaubhaft machen, dass durch die Verschmelzung die Erfüllung ihrer Forderung gefährdet wird."
    },
    {
      "date": "2025-07-22",
      "id": "116951",
      "original_text": "Registerbekanntmachung nach dem Umwandlungsgesetz\nHamburg Amtsgericht Hamburg HRB 25938\nvon Rauchhaupt & Senftleben GmbH – Hamburg",
      "type": "Registerbekanntmachung nach dem Umwandlungsgesetz",
      "state": "Hamburg",
      "amtsgericht": "Amtsgericht Hamburg",
      "registernummer": "HRB 25938",
      "registerart": "HRB",
      "company_name": "von Rauchhaupt & Senftleben GmbH",
      "company_seat": "Hamburg",
      "details": "22.07.2025 (Bekanntmachungsdatum)\n\nHamburg Amtsgericht Hamburg HRB 25938\nRegisterbekanntmachung nach dem Umwandlungsgesetz 22.07.2025 (Eintragungsdatum)\n\nvon Rauchhaupt & Senftleben GmbH\nGesellschaft mit beschränkter Haftung\nHamburg\n\nAls nicht eingetragen wird bekannt gemacht:\nDen Gläubigern der an der Verschmelzung beteiligten Gesellschaften ist, wenn sie binnen sechs Monaten nach dem Tag, an dem die Eintragung der Verschmelzung in das Register des Sitzes desjenigen Rechtsträgers, dessen Gläubiger sie sind, nach § 19 Absatz 3 UmwG als bekannt gemacht gilt, ihren Anspruch nach Grund und Höhe schriftlich anmelden, Sicherheit zu leisten, soweit sie nicht Befriedigung verlangen können. Dieses Recht steht den Gläubigern jedoch nur zu, wenn sie glaubhaft machen, dass durch die Verschmelzung die Erfüllung ihrer Forderung gefährdet wird."
    },
    {
      "date": "2025-07-22",
      "id": "116952",
      "original_text": "Registerbekanntmachung nach dem Umwandlungsgesetz\nHamburg Amtsgericht Hamburg HRB 173078\nAescudata GmbH – Hamburg",
      "type": "Registerbekanntmachung nach dem Umwandlungsgesetz",
      "state": "Hamburg",
      "amtsgericht": "Amtsgericht Hamburg",
      "registernummer": "HRB 173078",
      "registerart": "HRB",
      "company_name": "Aescudata GmbH",
      "company_seat": "Hamburg",
      "details": "22.07.2025 (Bekanntmachungsdatum)\n\nHamburg Amtsgericht Hamburg HRB 173078\nRegisterbekanntmachung nach dem Umwandlungsgesetz 22.07.2025 (Eintragungsdatum)\n\nAescudata GmbH\nGesellschaft mit beschränkter Haftung\nHamburg\n\nAls nicht eingetragen wird bekannt gemacht:\nDen Gläubigern der an der formwechselnden Umwandlung beteiligten Gesellschaften ist, wenn sie binnen sechs Monaten nach dem Tag, an dem die Eintragung der formwechselnden Umwandlung in das Register des Sitzes desjenigen Rechtsträgers, dessen Gläubiger sie sind, nach § 19 Absatz 3 UmwG als bekannt gemacht gilt, ihren Anspruch nach Grund und Höhe schriftlich anmelden, Sicherheit zu leisten, soweit sie nicht Befriedigung verlangen können. Dieses Recht steht den Gläubigern jedoch nur zu, wenn sie glaubhaft machen, dass durch die formwechselnde Umwandlung die Erfüllung ihrer Forderung gefährdet wird."
    },
    {
      "date": "2025-07-22",
      "id": "116953",
      "original_text": "Registerbekanntmachung nach dem Umwandlungsgesetz\nHamburg Amtsgericht Hamburg HRA 132586\nAescudata SE & Co. KG – Hamburg",
      "type": "Registerbekanntmachung nach dem Umwandlungsgesetz",
      "state": "Hamburg",
      "amtsgericht": "Amtsgericht Hamburg",
      "registernummer": "HRA 132586",
      "registerart": "HRA",
      "company_name": "Aescudata SE & Co. KG",
      "company_seat": "Hamburg",
      "details": "22.07.2025 (Bekanntmachungsdatum)\n\nHamburg Amtsgericht Hamburg HRA 132586\nRegisterbekanntmachung nach dem Umwandlungsgesetz 22.07.2025 (Eintragungsdatum)\n\nAescudata SE & Co. KG\nKommanditgesellschaft\nHamburg\n\nAls nicht eingetragen wird bekannt gemacht:\nDen Gläubigern der an der formwechselnden Umwandlung beteiligten Gesellschaften ist, wenn sie binnen sechs Monaten nach dem Tag, an dem die Eintragung der formwechselnden Umwandlung in das Register des Sitzes desjenigen Rechtsträgers, dessen Gläubiger sie sind, nach § 19 Absatz 3 UmwG als bekannt gemacht gilt, ihren Anspruch nach Grund und Höhe schriftlich anmelden, Sicherheit zu leisten, soweit sie nicht Befriedigung verlangen können. Dieses Recht steht den Gläubigern jedoch nur zu, wenn sie glaubhaft machen, dass durch die formwechselnde Umwandlung die Erfüllung ihrer Forderung gefährdet wird."
    },
    {
      "date": "2025-07-22",
      "id": "116954",
      "original_text": "Löschungsankündigung\nBaden-Württemberg Amtsgericht Mannheim HRB 714055\nFisherman Tom Restaurant GmbH – Sinsheim",
      "type": "Löschungsankündigung",
      "state": "Baden-Württemberg",
      "amtsgericht": "Amtsgericht Mannheim",
      "registernummer": "HRB 714055",
      "registerart": "HRB",
      "company_name": "Fisherman Tom Restaurant GmbH",
      "company_seat": "Sinsheim",
      "details": "22.07.2025 (Bekanntmachungsdatum)\n\nBaden-Württemberg Amtsgericht Mannheim HRB 714055\nLöschungsankündigung\n\nFisherman Tom Restaurant GmbH\nGesellschaft mit beschränkter Haftung\nSinsheim\n\nDas Gericht beabsichtigt, die Gesellschaft wegen Vermögenslosigkeit im Handelsregister von Amts wegen nach § 394 FamFG zu löschen. Die Frist zur Geltendmachung eines Widerspruchs gegen die beabsichtigte Löschung ist auf einen Monat ab Veröffentlichung bestimmt."
    },
    {
      "date": "2025-07-22",
      "id": "116955",
      "original_text": "Registerbekanntmachung nach dem Umwandlungsgesetz\nBerlin Amtsgericht Berlin (Charlottenburg) HRA 63722\nLivio Lipp e.K. – Berlin",
      "type": "Registerbekanntmachung nach dem Umwandlungsgesetz",
      "state": "Berlin",
      "amtsgericht": "Amtsgericht Berlin (Charlottenburg)",
      "registernummer": "HRA 63722",
      "registerart": "HRA",
      "company_name": "Livio Lipp e.K.",
      "company_seat": "Berlin",
      "details": "22.07.2025 (Bekanntmachungsdatum)\n\nBerlin Amtsgericht Berlin (Charlottenburg) HRA 63722\nRegisterbekanntmachung nach dem Umwandlungsgesetz 21.07.2025 (Eintragungsdatum)\n\nLivio Lipp e.K.\nEinzelkaufmann / Einzelkauffrau\nBerlin\n\nZu Eintragungsnummer 2 vom 21.07.2025 wird als nicht eingetragen veröffentlicht: Den Gläubigern der an der Spaltung beteiligten Rechtsträger ist, wenn sie binnen sechs Monaten nach dem Tag, an dem die Eintragung der Spaltung in das Register des Sitzes desjenigen Rechtsträgers, dessen Gläubiger sie sind, als bekannt gemacht gilt, ihren Anspruch nach Grund und Höhe schriftlich anmelden, Sicherheit zu leisten, soweit sie nicht Befriedigung verlangen können. Dieses Recht steht den Gläubigern jedoch nur zu, wenn sie glaubhaft machen, dass durch die Spaltung die Erfüllung ihrer Forderung gefährdet wird. Das Recht, Sicherheitsleistung zu verlangen, steht Gläubigern nicht zu, die im Falle der Insolvenz ein Recht auf vorzugsweise Befriedigung aus einer Deckungsmasse haben, die nach gesetzlicher Vorschrift zu ihrem Schutz errichtet und staatlich überwacht ist."
    },
    {
      "date": "2025-07-22",
      "id": "116956",
      "original_text": "Registerbekanntmachung nach dem Umwandlungsgesetz\nBerlin Amtsgericht Berlin (Charlottenburg) HRB 271562\nBerliner Haus- und Grundstückswartung Livio Lipp GmbH – Berlin",
      "type": "Registerbekanntmachung nach dem Umwandlungsgesetz",
      "state": "Berlin",
      "amtsgericht": "Amtsgericht Berlin (Charlottenburg)",
      "registernummer": "HRB 271562",
      "registerart": "HRB",
      "company_name": "Berliner Haus- und Grundstückswartung Livio Lipp GmbH",
      "company_seat": "Berlin",
      "details": "22.07.2025 (Bekanntmachungsdatum)\n\nBerlin Amtsgericht Berlin (Charlottenburg) HRB 271562\nRegisterbekanntmachung nach dem Umwandlungsgesetz 21.07.2025 (Eintragungsdatum)\n\nBerliner Haus- und Grundstückswartung Livio Lipp GmbH\nGesellschaft mit beschränkter Haftung\nBerlin\n\nZu Eintragungsnummer 2 vom 21.07.2025 wird als nicht eingetragen veröffentlicht: Den Gläubigern der an der Spaltung beteiligten Rechtsträger ist, wenn sie binnen sechs Monaten nach dem Tag, an dem die Eintragung der Spaltung in das Register des Sitzes desjenigen Rechtsträgers, dessen Gläubiger sie sind, als bekannt gemacht gilt, ihren Anspruch nach Grund und Höhe schriftlich anmelden, Sicherheit zu leisten, soweit sie nicht Befriedigung verlangen können. Dieses Recht steht den Gläubigern jedoch nur zu, wenn sie glaubhaft machen, dass durch die Spaltung die Erfüllung ihrer Forderung gefährdet wird. Das Recht, Sicherheitsleistung zu verlangen, steht Gläubigern nicht zu, die im Falle der Insolvenz ein Recht auf vorzugsweise Befriedigung aus einer Deckungsmasse haben, die nach gesetzlicher Vorschrift zu ihrem Schutz errichtet und staatlich überwacht ist."
    },
    {
      "date": "2025-07-22",
      "id": "116957",
      "original_text": "Einreichung neuer Dokumente\nSachsen-Anhalt Amtsgericht Stendal HRB 29263\nLieken GmbH – Lutherstadt Wittenberg",
      "type": "Einreichung neuer Dokumente",
      "state": "Sachsen-Anhalt",
      "amtsgericht": "Amtsgericht Stendal",
      "registernummer": "HRB 29263",
      "registerart": "HRB",
      "company_name": "Lieken GmbH",
      "company_seat": "Lutherstadt Wittenberg",
      "details": "22.07.2025 (Bekanntmachungsdatum)\n\nSachsen-Anhalt Amtsgericht Stendal HRB 29263\nEinreichung neuer Dokumente\n\nLieken GmbH\nGesellschaft mit beschränkter Haftung\nLutherstadt Wittenberg\n\nEine Liste der Mitglieder des Aufsichtsrates wurde zum Handelsregister eingereicht."
    },
    {
      "date": "2025-07-22",
      "id": "116958",
      "original_text": "Registerbekanntmachung nach dem Umwandlungsgesetz\nBrandenburg Amtsgericht Neuruppin HRA 904\nCity Clean GmbH & Co. KG – Bötzow",
      "type": "Registerbekanntmachung nach dem Umwandlungsgesetz",
      "state": "Brandenburg",
      "amtsgericht": "Amtsgericht Neuruppin",
      "registernummer": "HRA 904",
      "registerart": "HRA",
      "company_name": "City Clean GmbH & Co. KG",
      "company_seat": "Bötzow",
      "details": "22.07.2025 (Bekanntmachungsdatum)\n\nBrandenburg Amtsgericht Neuruppin HRA 904\nRegisterbekanntmachung nach dem Umwandlungsgesetz 21.07.2025 (Eintragungsdatum)\n\nCity Clean GmbH & Co. KG\nKommanditgesellschaft\nBötzow\n\nZu Eintragungsnummer 10 vom 21.07.2025 wird als nicht eingetragen veröffentlicht:\nDen Gläubigern der an der Umwandlung beteiligten Rechtsträger ist, wenn sie binnen sechs Monaten nach dem Tag, an dem die Eintragung der Umwandlung in das Register des Sitzes desjenigen Rechtsträgers, dessen Gläubiger sie sind, als bekannt gemacht gilt, ihren Anspruch nach Grund und Höhe schriftlich anmelden, Sicherheit zu leisten, soweit sie nicht Befriedigung verlangen können. Dieses Recht steht den Gläubigern jedoch nur zu, wenn sie glaubhaft machen, dass durch die Umwandlung die Erfüllung ihrer Forderung gefährdet wird"
    },
    {
      "date": "2025-07-22",
      "id": "116959",
      "original_text": "Registerbekanntmachung nach dem Umwandlungsgesetz\nHamburg Amtsgericht Hamburg HRB 70187\nSunimex Handels-GmbH – Hamburg",
      "type": "Registerbekanntmachung nach dem Umwandlungsgesetz",
      "state": "Hamburg",
      "amtsgericht": "Amtsgericht Hamburg",
      "registernummer": "HRB 70187",
      "registerart": "HRB",
      "company_name": "Sunimex Handels-GmbH",
      "company_seat": "Hamburg",
      "details": "22.07.2025 (Bekanntmachungsdatum)\n\nHamburg Amtsgericht Hamburg HRB 70187\nRegisterbekanntmachung nach dem Umwandlungsgesetz 22.07.2025 (Eintragungsdatum)\n\nSunimex Handels-GmbH\nGesellschaft mit beschränkter Haftung\nHamburg\n\nAls nicht eingetragen wird bekannt gemacht:\nDen Gläubigern der an der Verschmelzung beteiligten Gesellschaften ist, wenn sie binnen sechs Monaten nach dem Tag, an dem die Eintragung der Verschmelzung in das Register des Sitzes desjenigen Rechtsträgers, dessen Gläubiger sie sind, nach § 19 Absatz 3 UmwG als bekannt gemacht gilt, ihren Anspruch nach Grund und Höhe schriftlich anmelden, Sicherheit zu leisten, soweit sie nicht Befriedigung verlangen können. Dieses Recht steht den Gläubigern jedoch nur zu, wenn sie glaubhaft machen, dass durch die Verschmelzung die Erfüllung ihrer Forderung gefährdet wird."
    },
    {
      "date": "2025-07-22",
      "id": "116960",
      "original_text": "Löschungsankündigung\nSaarland Amtsgericht Saarbrücken HRB 102396\nPMP Maschinenbau GmbH – Überherrn",
      "type": "Löschungsankündigung",
      "state": "Saarland",
      "amtsgericht": "Amtsgericht Saarbrücken",
      "registernummer": "HRB 102396",
      "registerart": "HRB",
      "company_name": "PMP Maschinenbau GmbH",
      "company_seat": "Überherrn",
      "details": "22.07.2025 (Bekanntmachungsdatum)\n\nSaarland Amtsgericht Saarbrücken HRB 102396\nLöschungsankündigung\n\nPMP Maschinenbau GmbH\nGesellschaft mit beschränkter Haftung\nÜberherrn\n\nEs ist beabsichtigt, die Gesellschaft von Amts wegen gemäß § 394 FamFG wegen Vermögenslosigkeit zu löschen.\nGegen die Löschung von Amts wegen ist das Rechtsmittel des Widerspruchs statthaft. Der Widerspruch ist binnen einer Frist von einem Monat beginnend mit dem Tag dieser Veröffentlichung durch Einreichen eines Widerspruchsschreibens -schriftlich oder zur Niederschrift der Geschäftsstelle beim Amtsgericht Saarbrücken, -zentrales Handelsregister-, Mainzerstr.178, 66121 Saarbrücken einzulegen.\nDer Widerspruch muss die Bezeichnung der angefochtenen Löschungsankündigung enthalten sowie die Erklärung, dass Widerspruch eingelegt wird. Er ist vom Widerspruchsführer oder seinem Bevollmächtigten zu unterzeichnen.\nDas Widerspruchsschreiben kann auch in der Form eines elektronischen Dokumentes eingereicht werden, das mit einer qualifizierten elektronischen Signatur nach dem Signaturgesetz versehen sein muss (§§ 14 Abs. 2 FamFG, 130a, 298 ZPO)."
    },
    {
      "date": "2025-07-22",
      "id": "116961",
      "original_text": "Löschungsankündigung\nThüringen Amtsgericht Rudolstadt VR 260879\nKooperatives Rheumazentrum Thüringen e.V. – Uhlstädt-Kirchhasel",
      "type": "Löschungsankündigung",
      "state": "Thüringen",
      "amtsgericht": "Amtsgericht Rudolstadt",
      "registernummer": "VR 260879",
      "registerart": "VR",
      "company_name": "Kooperatives Rheumazentrum Thüringen e.V.",
      "company_seat": "Uhlstädt-Kirchhasel",
      "details": "22.07.2025 (Bekanntmachungsdatum)\n\nThüringen Amtsgericht Rudolstadt VR 260879\nLöschungsankündigung\n\nKooperatives Rheumazentrum Thüringen e.V.\neingetragener Verein\nUhlstädt-Kirchhasel\n\nDas Gericht beabsichtigt, den im Vereinsregister eingetragenen Verein Kooperatives Rheumazentrum Thüringen e.V. gemäß § 395 FamFG wegen unzulässiger Eintragung von Amts wegen zu löschen. Der Verein ist infolge Wegfalls sämtlicher Mitglieder erloschen. Die Frist zur Geltendmachung eines Widerspruch gegen die beabsichtigte Löschung wird auf einen Monat ab dieser Veröffentlichung festgesetzt."
    },
    {
      "date": "2025-07-22",
      "id": "116962",
      "original_text": "Löschungsankündigung\nThüringen Amtsgericht Jena HRB 515718\nFKK - Fechner Kurier- und Kleintransporte UG (haftungsbeschränkt) – Nordhausen",
      "type": "Löschungsankündigung",
      "state": "Thüringen",
      "amtsgericht": "Amtsgericht Jena",
      "registernummer": "HRB 515718",
      "registerart": "HRB",
      "company_name": "FKK - Fechner Kurier- und Kleintransporte UG (haftungsbeschränkt)",
      "company_seat": "Nordhausen",
      "details": "22.07.2025 (Bekanntmachungsdatum)\n\nThüringen Amtsgericht Jena HRB 515718\nLöschungsankündigung\n\nFKK - Fechner Kurier- und Kleintransporte UG (haftungsbeschränkt)\nGesellschaft mit beschränkter Haftung\nNordhausen\n\nDas Registergericht beabsichtigt, die im Handelsregister eingetragene Gesellschaft wegen Vermögenslosigkeit nach § 394 FamFG von Amts wegen zu löschen. Die Frist zur Erhebung eines Widerspruchs gegen die beabsichtigte Löschung wird auf 6 Wochen festgesetzt."
    },
    {
      "date": "2025-07-22",
      "id": "116963",
      "original_text": "Einreichung neuer Dokumente\nSchleswig-Holstein Amtsgericht Lübeck HRB 1084 OL\nStrandhalle Grömitz GmbH – Grömitz",
      "type": "Einreichung neuer Dokumente",
      "state": "Schleswig-Holstein",
      "amtsgericht": "Amtsgericht Lübeck",
      "registernummer": "HRB 1084 OL",
      "registerart": "HRB",
      "company_name": "Strandhalle Grömitz GmbH",
      "company_seat": "Grömitz",
      "details": "22.07.2025 (Bekanntmachungsdatum)\n\nSchleswig-Holstein Amtsgericht Lübeck HRB 1084 OL\nEinreichung neuer Dokumente\n\nStrandhalle Grömitz GmbH\nGesellschaft mit beschränkter Haftung\nGrömitz\n\nAls nicht eingetragen wird veröffentlicht: Es wurde ein Liste der Aufsichtsratsmitglieder zum Handelsregister eingereicht."
    },
    {
      "date": "2025-07-22",
      "id": "116964",
      "original_text": "Registerbekanntmachung nach dem Umwandlungsgesetz\nHamburg Amtsgericht Hamburg HRA 118863\nBehrendt Holding GmbH & Co. KG – Hamburg",
      "type": "Registerbekanntmachung nach dem Umwandlungsgesetz",
      "state": "Hamburg",
      "amtsgericht": "Amtsgericht Hamburg",
      "registernummer": "HRA 118863",
      "registerart": "HRA",
      "company_name": "Behrendt Holding GmbH & Co. KG",
      "company_seat": "Hamburg",
      "details": "22.07.2025 (Bekanntmachungsdatum)\n\nHamburg Amtsgericht Hamburg HRA 118863\nRegisterbekanntmachung nach dem Umwandlungsgesetz 22.07.2025 (Eintragungsdatum)\n\nBehrendt Holding GmbH & Co. KG\nKommanditgesellschaft\nHamburg\n\nAls nicht eingetragen wird bekannt gemacht:\nDen Gläubigern der an der formwechselnden Umwandlung beteiligten Gesellschaften ist, wenn sie binnen sechs Monaten nach dem Tag, an dem die Eintragung der formwechselnden Umwandlung in das Register des Sitzes desjenigen Rechtsträgers, dessen Gläubiger sie sind, nach § 19 Absatz 3 UmwG als bekannt gemacht gilt, ihren Anspruch nach Grund und Höhe schriftlich anmelden, Sicherheit zu leisten, soweit sie nicht Befriedigung verlangen können. Dieses Recht steht den Gläubigern jedoch nur zu, wenn sie glaubhaft machen, dass durch die formwechselnde Umwandlung die Erfüllung ihrer Forderung gefährdet wird."
    },
    {
      "date": "2025-07-22",
      "id": "116965",
      "original_text": "Sonstige Registerbekanntmachung\nHamburg Amtsgericht Hamburg HRB 57422\nBäderland Hamburg GmbH – Hamburg",
      "type": "Sonstige Registerbekanntmachung",
      "state": "Hamburg",
      "amtsgericht": "Amtsgericht Hamburg",
      "registernummer": "HRB 57422",
      "registerart": "HRB",
      "company_name": "Bäderland Hamburg GmbH",
      "company_seat": "Hamburg",
      "details": "22.07.2025 (Bekanntmachungsdatum)\n\nHamburg Amtsgericht Hamburg HRB 57422\nSonstige Registerbekanntmachung 22.07.2025 (Eintragungsdatum)\n\nBäderland Hamburg GmbH\nGesellschaft mit beschränkter Haftung\nHamburg\n\nAls nicht eingetragen wird bekannt gemacht: Liste des Aufsichtsrats wurde eingereicht."
    },
    {
      "date": "2025-07-22",
      "id": "116966",
      "original_text": "Registerbekanntmachung nach dem Umwandlungsgesetz\nBerlin Amtsgericht Berlin (Charlottenburg) HRB 50854\nServicecenter Regina Warwel Organisationsberatung und Bürodienstleistungs GmbH – Berlin",
      "type": "Registerbekanntmachung nach dem Umwandlungsgesetz",
      "state": "Berlin",
      "amtsgericht": "Amtsgericht Berlin (Charlottenburg)",
      "registernummer": "HRB 50854",
      "registerart": "HRB",
      "company_name": "Servicecenter Regina Warwel Organisationsberatung und Bürodienstleistungs GmbH",
      "company_seat": "Berlin",
      "details": "22.07.2025 (Bekanntmachungsdatum)\n\nBerlin Amtsgericht Berlin (Charlottenburg) HRB 50854\nRegisterbekanntmachung nach dem Umwandlungsgesetz 21.07.2025 (Eintragungsdatum)\n\nServicecenter Regina Warwel Organisationsberatung und Bürodienstleistungs GmbH\nGesellschaft mit beschränkter Haftung\nBerlin\n\nZu Eintragungsnummer 5 vom 21.07.2025 wird als nicht eingetragen veröffentlicht:\nDen Gläubigern der an der Verschmelzung beteiligten Rechtsträger ist, wenn sie binnen sechs Monaten nach dem Tag, an dem die Eintragung der Verschmelzung in das Register des Sitzes desjenigen Rechtsträgers, dessen Gläubiger sie sind, als bekannt gemacht gilt, ihren Anspruch nach Grund und Höhe schriftlich anmelden, Sicherheit zu leisten, soweit sie nicht Befriedigung verlangen können. Dieses Recht steht den Gläubigern jedoch nur zu, wenn sie glaubhaft machen, dass durch die Verschmelzung die Erfüllung ihrer Forderung gefährdet wird. Das Recht, Sicherheitsleistung zu verlangen, steht Gläubigern nicht zu, die im Falle der Insolvenz ein Recht auf vorzugsweise Befriedigung aus einer Deckungsmasse haben, die nach gesetzlicher Vorschrift zu ihrem Schutz errichtet und staatlich überwacht ist."
    },
    {
      "date": "2025-07-22",
      "id": "116967",
      "original_text": "Registerbekanntmachung nach dem Umwandlungsgesetz\nBaden-Württemberg Amtsgericht Mannheim HRA 712705\nACS GmbH & Co. KG – Mauer",
      "type": "Registerbekanntmachung nach dem Umwandlungsgesetz",
      "state": "Baden-Württemberg",
      "amtsgericht": "Amtsgericht Mannheim",
      "registernummer": "HRA 712705",
      "registerart": "HRA",
      "company_name": "ACS GmbH & Co. KG",
      "company_seat": "Mauer",
      "details": "22.07.2025 (Bekanntmachungsdatum)\n\nBaden-Württemberg Amtsgericht Mannheim HRA 712705\nRegisterbekanntmachung nach dem Umwandlungsgesetz 22.07.2025 (Eintragungsdatum)\n\nACS GmbH & Co. KG\nKommanditgesellschaft\nMauer\n\nDen Gläubigern des an dem Formwechsel beteiligten Rechtsträgers ist, wenn sie binnen sechs Monaten nach dem Tag, an dem die Eintragung des Formwechsels in das Register des Sitzes desjenigen Rechtsträgers, dessen Gläubiger sie sind, nach § 19 Abs. 3 UmwG als bekanntgemacht gilt, ihren Anspruch nach Grund und Höhe schriftlich anmelden, Sicherheit zu leisten, soweit sie nicht Befriedigung verlangen können. Dieses Recht steht den Gläubigern jedoch nur zu, wenn sie glaubhaft machen, dass durch den Formwechsel die Erfüllung ihrer Forderung gefährdet wird."
    },
    {
      "date": "2025-07-22",
      "id": "116968",
      "original_text": "Sonstige Registerbekanntmachung\nBaden-Württemberg Amtsgericht Ulm HRB 552655\nWGV Holding AG – Ravensburg",
      "type": "Sonstige Registerbekanntmachung",
      "state": "Baden-Württemberg",
      "amtsgericht": "Amtsgericht Ulm",
      "registernummer": "HRB 552655",
      "registerart": "HRB",
      "company_name": "WGV Holding AG",
      "company_seat": "Ravensburg",
      "details": "22.07.2025 (Bekanntmachungsdatum)\n\nBaden-Württemberg Amtsgericht Ulm HRB 552655\nSonstige Registerbekanntmachung 22.07.2025 (Eintragungsdatum)\n\nWGV Holding AG\nAktiengesellschaft\nRavensburg\n\nDie Gesellschaft hat am 21.07.2025 die Liste über die Zusammensetzung des Aufsichtsrats zum Handelsregister eingereicht."
    },
    {
      "date": "2025-07-22",
      "id": "116969",
      "original_text": "Registerbekanntmachung nach dem Umwandlungsgesetz\nBaden-Württemberg Amtsgericht Mannheim HRB 744140\nACS GmbH – Mauer",
      "type": "Registerbekanntmachung nach dem Umwandlungsgesetz",
      "state": "Baden-Württemberg",
      "amtsgericht": "Amtsgericht Mannheim",
      "registernummer": "HRB 744140",
      "registerart": "HRB",
      "company_name": "ACS GmbH",
      "company_seat": "Mauer",
      "details": "22.07.2025 (Bekanntmachungsdatum)\n\nBaden-Württemberg Amtsgericht Mannheim HRB 744140\nRegisterbekanntmachung nach dem Umwandlungsgesetz 22.07.2025 (Eintragungsdatum)\n\nACS GmbH\nGesellschaft mit beschränkter Haftung\nMauer\n\nDen Gläubigern des an dem Formwechsel beteiligten Rechtsträgers ist, wenn sie binnen sechs Monaten nach dem Tag, an dem die Eintragung des Formwechsels in das Register des Sitzes desjenigen Rechtsträgers, dessen Gläubiger sie sind, nach § 19 Abs. 3 UmwG als bekanntgemacht gilt, ihren Anspruch nach Grund und Höhe schriftlich anmelden, Sicherheit zu leisten, soweit sie nicht Befriedigung verlangen können. Dieses Recht steht den Gläubigern jedoch nur zu, wenn sie glaubhaft machen, dass durch den Formwechsel die Erfüllung ihrer Forderung gefährdet wird."
    },
    {
      "date": "2025-07-22",
      "id": "116970",
      "original_text": "Einreichung neuer Dokumente\nBerlin Amtsgericht Berlin (Charlottenburg) HRB 256346\nSmart InsurTech AG – Berlin",
      "type": "Einreichung neuer Dokumente",
      "state": "Berlin",
      "amtsgericht": "Amtsgericht Berlin (Charlottenburg)",
      "registernummer": "HRB 256346",
      "registerart": "HRB",
      "company_name": "Smart InsurTech AG",
      "company_seat": "Berlin",
      "details": "22.07.2025 (Bekanntmachungsdatum)\n\nBerlin Amtsgericht Berlin (Charlottenburg) HRB 256346\nEinreichung neuer Dokumente\n\nSmart InsurTech AG\nAktiengesellschaft\nBerlin\n\nAls nicht eingetragen wird veröffentlicht: Es wurde eine neue Liste der Aufsichtsratsmitglieder eingereicht (§ 106 AktG)."
    },
    {
      "date": "2025-07-22",
      "id": "116971",
      "original_text": "Registerbekanntmachung nach dem Umwandlungsgesetz\nBaden-Württemberg Amtsgericht Stuttgart HRB 785416\naMoS KiTa Invest No. 2 GmbH – Fellbach",
      "type": "Registerbekanntmachung nach dem Umwandlungsgesetz",
      "state": "Baden-Württemberg",
      "amtsgericht": "Amtsgericht Stuttgart",
      "registernummer": "HRB 785416",
      "registerart": "HRB",
      "company_name": "aMoS KiTa Invest No. 2 GmbH",
      "company_seat": "Fellbach",
      "details": "22.07.2025 (Bekanntmachungsdatum)\n\nBaden-Württemberg Amtsgericht Stuttgart HRB 785416\nRegisterbekanntmachung nach dem Umwandlungsgesetz 22.07.2025 (Eintragungsdatum)\n\naMoS KiTa Invest No. 2 GmbH\nGesellschaft mit beschränkter Haftung\nFellbach\n\nAls nicht eingetragen wird bekanntgemacht:\nDen Gläubigern der an der Verschmelzung beteiligten Rechtsträger ist, wenn sie binnen sechs Monaten nach dem Tag, an dem die Eintragung der Verschmelzung in das Register des Sitzes desjenigen Rechtsträgers, dessen Gläubiger sie sind, nach § 19 Abs. 3 UmwG als bekanntgemacht gilt, ihren Anspruch nach Grund und Höhe schriftlich anmelden, Sicherheit zu leisten, soweit sie nicht Befriedigung verlangen können. Dieses Recht steht den Gläubigern jedoch nur zu, wenn sie glaubhaft machen, dass durch die Verschmelzung die Erfüllung ihrer Forderung gefährdet wird."
    },
    {
      "date": "2025-07-22",
      "id": "116972",
      "original_text": "Registerbekanntmachung nach dem Umwandlungsgesetz\nBaden-Württemberg Amtsgericht Stuttgart HRB 799449\nLaketyre GmbH – Balingen",
      "type": "Registerbekanntmachung nach dem Umwandlungsgesetz",
      "state": "Baden-Württemberg",
      "amtsgericht": "Amtsgericht Stuttgart",
      "registernummer": "HRB 799449",
      "registerart": "HRB",
      "company_name": "Laketyre GmbH",
      "company_seat": "Balingen",
      "details": "22.07.2025 (Bekanntmachungsdatum)\n\nBaden-Württemberg Amtsgericht Stuttgart HRB 799449\nRegisterbekanntmachung nach dem Umwandlungsgesetz 22.07.2025 (Eintragungsdatum)\n\nLaketyre GmbH\nGesellschaft mit beschränkter Haftung\nBalingen\n\nAls nicht eingetragen wird bekanntgemacht:\nDen Gläubigern der an der Ausgliederung beteiligten Rechtsträger ist, wenn sie binnen sechs Monaten nach dem Tag, an dem die Eintragung der Ausgliederung in das Register des Sitzes desjenigen Rechtsträgers, dessen Gläubiger sie sind, nach § 19 Abs. 3 UmwG als bekanntgemacht gilt, ihren Anspruch nach Grund und Höhe schriftlich anmelden, Sicherheit zu leisten, soweit sie nicht Befriedigung verlangen können. Dieses Recht steht den Gläubigern jedoch nur zu, wenn sie glaubhaft machen, dass durch die Ausgliederung die Erfüllung ihrer Forderung gefährdet wird."
    },
    {
      "date": "2025-07-22",
      "id": "116973",
      "original_text": "Registerbekanntmachung nach dem Umwandlungsgesetz\nSaarland Amtsgericht Saarbrücken HRA 13675\nKevin Fey Transport e. K. – Völklingen",
      "type": "Registerbekanntmachung nach dem Umwandlungsgesetz",
      "state": "Saarland",
      "amtsgericht": "Amtsgericht Saarbrücken",
      "registernummer": "HRA 13675",
      "registerart": "HRA",
      "company_name": "Kevin Fey Transport e. K.",
      "company_seat": "Völklingen",
      "details": "22.07.2025 (Bekanntmachungsdatum)\n\nSaarland Amtsgericht Saarbrücken HRA 13675\nRegisterbekanntmachung nach dem Umwandlungsgesetz 22.07.2025 (Eintragungsdatum)\n\nKevin Fey Transport e. K.\nEinzelkaufmann / Einzelkauffrau\nVölklingen\n\nAls nicht eingetragen wird bekannt gemacht: Den Gläubigern der an der Ausgliederung beteiligten Gesellschaften ist, wenn sie binnen sechs Monaten nach dem Tag, an dem die Eintragung der Ausgliederung in das Register des Sitzes desjenigen Rechtsträgers, dessen Gläubiger sie sind, nach § 19 Absatz 3 UmwG bekannt gemacht worden ist, ihren Anspruch nach Grund und Höhe schriftlich anmelden, Sicherheit zu leisten, soweit sie nicht Befriedigung verlangen können. Dieses Recht steht den Gläubigern jedoch nur zu, wenn sie glaubhaft machen, dass durch die Ausgliederung die Erfüllung ihrer Forderung gefährdet wird."
    },
    {
      "date": "2025-07-22",
      "id": "116974",
      "original_text": "Registerbekanntmachung nach dem Umwandlungsgesetz\nBaden-Württemberg Amtsgericht Stuttgart HRB 785232\nFitness United Biberach GmbH – Fellbach",
      "type": "Registerbekanntmachung nach dem Umwandlungsgesetz",
      "state": "Baden-Württemberg",
      "amtsgericht": "Amtsgericht Stuttgart",
      "registernummer": "HRB 785232",
      "registerart": "HRB",
      "company_name": "Fitness United Biberach GmbH",
      "company_seat": "Fellbach",
      "details": "22.07.2025 (Bekanntmachungsdatum)\n\nBaden-Württemberg Amtsgericht Stuttgart HRB 785232\nRegisterbekanntmachung nach dem Umwandlungsgesetz 22.07.2025 (Eintragungsdatum)\n\nFitness United Biberach GmbH\nGesellschaft mit beschränkter Haftung\nFellbach\n\nDen Gläubigern der an der Verschmelzung beteiligten Rechtsträger ist, wenn sie binnen sechs Monaten nach dem Tag, an dem die Eintragung der Verschmelzung in das Register des Sitzes desjenigen Rechtsträgers, dessen Gläubiger sie sind, nach § 19 Abs. 3 UmwG als bekanntgemacht gilt, ihren Anspruch nach Grund und Höhe schriftlich anmelden, Sicherheit zu leisten, soweit sie nicht Befriedigung verlangen können. Dieses Recht steht den Gläubigern jedoch nur zu, wenn sie glaubhaft machen, dass durch die Verschmelzung die Erfüllung ihrer Forderung gefährdet wird."
    },
    {
      "date": "2025-07-22",
      "id": "116975",
      "original_text": "Registerbekanntmachung nach dem Umwandlungsgesetz\nHamburg Amtsgericht Hamburg HRB 158657\nAchtzigste LOGIMAC Logistic Grundbesitz GmbH – Hamburg",
      "type": "Registerbekanntmachung nach dem Umwandlungsgesetz",
      "state": "Hamburg",
      "amtsgericht": "Amtsgericht Hamburg",
      "registernummer": "HRB 158657",
      "registerart": "HRB",
      "company_name": "Achtzigste LOGIMAC Logistic Grundbesitz GmbH",
      "company_seat": "Hamburg",
      "details": "22.07.2025 (Bekanntmachungsdatum)\n\nHamburg Amtsgericht Hamburg HRB 158657\nRegisterbekanntmachung nach dem Umwandlungsgesetz\n\nAchtzigste LOGIMAC Logistic Grundbesitz GmbH\nGesellschaft mit beschränkter Haftung\nHamburg\n\nBerichtigung zur Veröffentlichung vom 17.07.2025:\n\nAls nicht eingetragen wird bekanntgemacht:\nBekanntmachung gemäß §§ 336, 308 Umwandlungsgesetz\nAchtzigste LOGIMAC Logistic Grundbesitz GmbH, HRB 158657\n(nachfolgend \"Gesellschaft\")\nEs ist beabsichtigt, sowohl den Satzungssitz als auch den Verwaltungssitz der Gesellschaft von Hamburg nach 26A, Boulevard Royal, L-2449 Luxemburg, zu verlegen und zu diesem Zwecke einen grenzüberschreitenden Formwechsel in eine luxemburgische S.à r.l. (société à responsabilité limitée) nach Maßgabe der §§ 333 ff. UmwG durchzuführen.\n1.Gemäß §§ 336, 308 UmwG wird hiermit der Entwurf des Formwechselplans zum Handelsregister eingereicht mit der Bitte um unverzügliche Bekanntmachung gemäß §§ 336, 308 UmwG iVm. § 10 HGB.\n2. Die Bekanntmachung hat nach §§ 336, 308 Abs. 1 UmwG zu enthalten:\na. einen Hinweis darauf, dass der Formwechselplan oder sein Entwurf beim Handelsregister\neingereicht worden ist (§§ 336, 308 Abs. 1 Satz 2 Nr. 1 UmwG)\nb. Rechtsform, Firma und Sitz der an dem grenzüberschreitenden Formwechsel beteiligten\nGesellschaft (§§ 336, 308 Abs. 1 Satz 2 Nr. 2 UmwG)\nc. das Register, bei dem die an dem grenzüberschreitenden Formwechsel beteiligte Gesellschaft\neingetragen ist, sowie die jeweilige Registernummer (§§ 336, 308 Abs. 1 Satz 2 Nr. 3 UmwG)\nd. einen Hinweis an folgende Personen, dass sie der jeweiligen Gesellschaft spätestens fünf\nArbeitstage vor dem Tag der Gesellschafterversammlung Bemerkungen zum Formwechselplan übermitteln können:\naa) an die Anteilsinhaber und Gläubiger der an dem grenzüberschreitenden Formwechsel\nbeteiligten Gesellschaft sowie\nbb) an die zuständigen Betriebsräte der an dem grenzüberschreitenden Formwechsel\nbeteiligten Gesellschaft oder, soweit es keinen Betriebsrat gibt, an die Arbeitnehmer der\nan dem grenzüberschreitenden Formwechsel beteiligten Gesellschaft (§§ 336, 308\nAbs. 1 Satz 2 Nr. 4 UmwG).\n3. Dazu wird nach §§ 336, 308 Abs. 1 UmwG mitgeteilt:\na. Zu §§ 336, 308 Abs. 1 Satz 2 Nr. 1 UmwG:\nDer Entwurf des Formwechselplans samt Anlagen wurde mit diesem Schreiben beim\nHandelsregister eingereicht.\nb. Zu §§ 336, 308 Abs. 1 Satz 2 Nr. 2 UmwG\nAn dem grenzüberschreitenden Formwechsel ist die Gesellschaft beteiligt. Diese soll als\nformwechselnder Rechtsträger in eine luxemburgische S.à r.l. (société à responsabilité limitée) mit Satzungs- und Verwaltungssitz in 26A, Boulevard Royal, L-2449 Luxemburg, identitätswahrend gemäß den §§ 333 ff. UmwG formgewechselt werden. Die neue Firma der Gesellschaft wird Rosa Propco Wörth S.à r.l. lauten.\nc. Zu §§ 336, 308 Abs. 1 Satz 2 Nr. 3 UmwG:\ndie Registerdaten, bei der an dem grenzüberschreitenden Formwechsel beteiligten\nGesellschaft eingetragen sind:\n1. Formwechselnde Gesellschaft:\nAchtzigste LOGIMAC Logistic Grundbesitz GmbH ist eingetragen beim Handelsregister des Amtsgerichts Hamburg unter der Nummer HRB 158657.\n2. Zukünftige Registerdaten der Gesellschaft:\nDie Gesellschaft wird nach Vollzug des Formwechsels als Rosa Propco Wörth S.a r.l. im luxemburgischen Handels- und Gesellschaftsregister (Registre de commerce et des sociétés) eingetragen sein.\nd. Zu §§ 336, 308 Abs. 1 Satz 2 Nr. 4, Abs. 2 UmwG\nAnteilsinhaber, Gläubiger und Arbeitnehmer der an dem grenzüberschreitenden Formwechsel beteiligten Gesellschaft können der jeweiligen Gesellschaft spätestens fünf Arbeitstage vor dem Tag, an dem der Formwechselplan notariell beurkundet wird, Bemerkungen zum Formwechselplan an die jeweilige Geschäftsadresse übermitteln. Die notarielle Beurkundung wird am 29. August 2025 stattfinden."
    },
    {
      "date": "2025-07-22",
      "id": "116976",
      "original_text": "Registerbekanntmachung nach dem Umwandlungsgesetz\nBaden-Württemberg Amtsgericht Freiburg HRB 714652\ne.optimum Energieberatung GmbH – Offenburg",
      "type": "Registerbekanntmachung nach dem Umwandlungsgesetz",
      "state": "Baden-Württemberg",
      "amtsgericht": "Amtsgericht Freiburg",
      "registernummer": "HRB 714652",
      "registerart": "HRB",
      "company_name": "e.optimum Energieberatung GmbH",
      "company_seat": "Offenburg",
      "details": "22.07.2025 (Bekanntmachungsdatum)\n\nBaden-Württemberg Amtsgericht Freiburg HRB 714652\nRegisterbekanntmachung nach dem Umwandlungsgesetz 22.07.2025 (Eintragungsdatum)\n\ne.optimum Energieberatung GmbH\nGesellschaft mit beschränkter Haftung\nOffenburg\n\nDen Gläubigern der an der Verschmelzung beteiligten Rechtsträger ist, wenn sie binnen sechs Monaten nach dem Tag, an dem die Eintragung der Verschmelzung in das Register des Sitzes desjenigen Rechtsträgers, dessen Gläubiger sie sind, nach § 19 Abs. 3 UmwG als bekanntgemacht gilt, ihren Anspruch nach Grund und Höhe schriftlich anmelden, Sicherheit zu leisten, soweit sie nicht Befriedigung verlangen können. Dieses Recht steht den Gläubigern jedoch nur zu, wenn sie glaubhaft machen, dass durch die Verschmelzung die Erfüllung ihrer Forderung gefährdet wird."
    },
    {
      "date": "2025-07-22",
      "id": "116977",
      "original_text": "Löschungsankündigung\nBerlin Amtsgericht Berlin (Charlottenburg) HRB 241501\nCam Gastro GmbH – Berlin",
      "type": "Löschungsankündigung",
      "state": "Berlin",
      "amtsgericht": "Amtsgericht Berlin (Charlottenburg)",
      "registernummer": "HRB 241501",
      "registerart": "HRB",
      "company_name": "Cam Gastro GmbH",
      "company_seat": "Berlin",
      "details": "22.07.2025 (Bekanntmachungsdatum)\n\nBerlin Amtsgericht Berlin (Charlottenburg) HRB 241501\nLöschungsankündigung\n\nCam Gastro GmbH\nGesellschaft mit beschränkter Haftung\nBerlin\n\nBei der nachstehenden Gesellschaft wird das Amtslöschungsverfahren gemäß § 394 FamFG eingeleitet. Widerspruchsfrist 6 Wochen"
    },
    {
      "date": "2025-07-22",
      "id": "116978",
      "original_text": "Löschungsankündigung\nBerlin Amtsgericht Berlin (Charlottenburg) HRB 168634\nTechCode Accelerator (Germany) TCAC GmbH – Berlin",
      "type": "Löschungsankündigung",
      "state": "Berlin",
      "amtsgericht": "Amtsgericht Berlin (Charlottenburg)",
      "registernummer": "HRB 168634",
      "registerart": "HRB",
      "company_name": "TechCode Accelerator (Germany) TCAC GmbH",
      "company_seat": "Berlin",
      "details": "22.07.2025 (Bekanntmachungsdatum)\n\nBerlin Amtsgericht Berlin (Charlottenburg) HRB 168634\nLöschungsankündigung\n\nTechCode Accelerator (Germany) TCAC GmbH\nGesellschaft mit beschränkter Haftung\nBerlin\n\nBei der nachstehenden Gesellschaft wird das Amtslöschungsverfahren gemäß § 394 FamFG eingeleitet. Widerspruchsfrist 6 Wochen"
    },
    {
      "date": "2025-07-22",
      "id": "116979",
      "original_text": "Registerbekanntmachung nach dem Umwandlungsgesetz\nBaden-Württemberg Amtsgericht Stuttgart HRB 107111\nMayer-Kuvert-network GmbH – Heilbronn",
      "type": "Registerbekanntmachung nach dem Umwandlungsgesetz",
      "state": "Baden-Württemberg",
      "amtsgericht": "Amtsgericht Stuttgart",
      "registernummer": "HRB 107111",
      "registerart": "HRB",
      "company_name": "Mayer-Kuvert-network GmbH",
      "company_seat": "Heilbronn",
      "details": "22.07.2025 (Bekanntmachungsdatum)\n\nBaden-Württemberg Amtsgericht Stuttgart HRB 107111\nRegisterbekanntmachung nach dem Umwandlungsgesetz 22.07.2025 (Eintragungsdatum)\n\nMayer-Kuvert-network GmbH\nGesellschaft mit beschränkter Haftung\nHeilbronn\n\nAls nicht eingetragen wird bekanntgemacht:\nDen Gläubigern der an der Verschmelzung beteiligten Rechtsträger ist, wenn sie binnen sechs Monaten nach dem Tag, an dem die Eintragung der Verschmelzung in das Register des Sitzes desjenigen Rechtsträgers, dessen Gläubiger sie sind, nach § 19 Abs. 3 UmwG als bekanntgemacht gilt, ihren Anspruch nach Grund und Höhe schriftlich anmelden, Sicherheit zu leisten, soweit sie nicht Befriedigung verlangen können. Dieses Recht steht den Gläubigern jedoch nur zu, wenn sie glaubhaft machen, dass durch die Verschmelzung die Erfüllung ihrer Forderung gefährdet wird."
    },
    {
      "date": "2025-07-22",
      "id": "116980",
      "original_text": "Registerbekanntmachung nach dem Umwandlungsgesetz\nBaden-Württemberg Amtsgericht Stuttgart HRB 107111\nMayer-Kuvert-network GmbH – Heilbronn",
      "type": "Registerbekanntmachung nach dem Umwandlungsgesetz",
      "state": "Baden-Württemberg",
      "amtsgericht": "Amtsgericht Stuttgart",
      "registernummer": "HRB 107111",
      "registerart": "HRB",
      "company_name": "Mayer-Kuvert-network GmbH",
      "company_seat": "Heilbronn",
      "details": "22.07.2025 (Bekanntmachungsdatum)\n\nBaden-Württemberg Amtsgericht Stuttgart HRB 107111\nRegisterbekanntmachung nach dem Umwandlungsgesetz 22.07.2025 (Eintragungsdatum)\n\nMayer-Kuvert-network GmbH\nGesellschaft mit beschränkter Haftung\nHeilbronn\n\nAls nicht eingetragen wird bekanntgemacht:\nDen Gläubigern der an der Verschmelzung beteiligten Rechtsträger ist, wenn sie binnen sechs Monaten nach dem Tag, an dem die Eintragung der Verschmelzung in das Register des Sitzes desjenigen Rechtsträgers, dessen Gläubiger sie sind, nach § 19 Abs. 3 UmwG als bekanntgemacht gilt, ihren Anspruch nach Grund und Höhe schriftlich anmelden, Sicherheit zu leisten, soweit sie nicht Befriedigung verlangen können. Dieses Recht steht den Gläubigern jedoch nur zu, wenn sie glaubhaft machen, dass durch die Verschmelzung die Erfüllung ihrer Forderung gefährdet wird."
    },
    {
      "date": "2025-07-22",
      "id": "116981",
      "original_text": "Registerbekanntmachung nach dem Umwandlungsgesetz\nNordrhein-Westfalen Amtsgericht Coesfeld HRB 19949\nHüser UG (haftungsbeschränkt) – Lüdinghausen",
      "type": "Registerbekanntmachung nach dem Umwandlungsgesetz",
      "state": "Nordrhein-Westfalen",
      "amtsgericht": "Amtsgericht Coesfeld",
      "registernummer": "HRB 19949",
      "registerart": "HRB",
      "company_name": "Hüser UG (haftungsbeschränkt)",
      "company_seat": "Lüdinghausen",
      "details": "22.07.2025 (Bekanntmachungsdatum)\n\nNordrhein-Westfalen Amtsgericht Coesfeld HRB 19949\nRegisterbekanntmachung nach dem Umwandlungsgesetz 22.07.2025 (Eintragungsdatum)\n\nHüser UG (haftungsbeschränkt)\nGesellschaft mit beschränkter Haftung\nLüdinghausen\n\nDen Gläubigern der an der Verschmelzung beteiligten Rechtsträger ist, wenn sie binnen sechs Monaten nach dem Tag, an dem die Eintragung der Verschmelzung in das Register des Sitzes desjenigen Rechtsträgers, dessen Gläubiger sie sind, nach § 19 Absatz 3 UmwG als bekanntgemacht gilt, ihren Anspruch nach Grund und Höhe schriftlich anmelden, Sicherheit zu leisten, soweit sie nicht Befriedigung verlangen können. Dieses Recht steht den Gläubigern jedoch nur zu, wenn sie glaubhaft machen, dass durch die Verschmelzung die Erfüllung ihrer Forderung gefährdet wird."
    },
    {
      "date": "2025-07-22",
      "id": "116982",
      "original_text": "Registerbekanntmachung nach dem Umwandlungsgesetz\nBaden-Württemberg Amtsgericht Mannheim HRA 712306\nMetzgerei & Partyservice Ehehalt GmbH & Co. KG – Reilingen",
      "type": "Registerbekanntmachung nach dem Umwandlungsgesetz",
      "state": "Baden-Württemberg",
      "amtsgericht": "Amtsgericht Mannheim",
      "registernummer": "HRA 712306",
      "registerart": "HRA",
      "company_name": "Metzgerei & Partyservice Ehehalt GmbH & Co. KG",
      "company_seat": "Reilingen",
      "details": "22.07.2025 (Bekanntmachungsdatum)\n\nBaden-Württemberg Amtsgericht Mannheim HRA 712306\nRegisterbekanntmachung nach dem Umwandlungsgesetz 22.07.2025 (Eintragungsdatum)\n\nMetzgerei & Partyservice Ehehalt GmbH & Co. KG\nKommanditgesellschaft\nReilingen\n\nAls nicht eingetragen wird bekanntgemacht:\nDen Gläubigern der an der Ausgliederung beteiligten Rechtsträger ist, wenn sie binnen sechs Monaten nach dem Tag, an dem die Eintragung der Ausgliederung in das Register des Sitzes desjenigen Rechtsträgers, dessen Gläubiger sie sind, nach § 19 Abs. 3 UmwG als bekanntgemacht gilt, ihren Anspruch nach Grund und Höhe schriftlich anmelden, Sicherheit zu leisten, soweit sie nicht Befriedigung verlangen können. Dieses Recht steht den Gläubigern jedoch nur zu, wenn sie glaubhaft machen, dass durch die Ausgliederung die Erfüllung ihrer Forderung gefährdet wird."
    },
    {
      "date": "2025-07-22",
      "id": "116983",
      "original_text": "Registerbekanntmachung nach dem Umwandlungsgesetz\nBaden-Württemberg Amtsgericht Mannheim HRA 712241\nMetzgerei Karlheinz Ehehalt e.K. – Reilingen",
      "type": "Registerbekanntmachung nach dem Umwandlungsgesetz",
      "state": "Baden-Württemberg",
      "amtsgericht": "Amtsgericht Mannheim",
      "registernummer": "HRA 712241",
      "registerart": "HRA",
      "company_name": "Metzgerei Karlheinz Ehehalt e.K.",
      "company_seat": "Reilingen",
      "details": "22.07.2025 (Bekanntmachungsdatum)\n\nBaden-Württemberg Amtsgericht Mannheim HRA 712241\nRegisterbekanntmachung nach dem Umwandlungsgesetz 22.07.2025 (Eintragungsdatum)\n\nMetzgerei Karlheinz Ehehalt e.K.\nEinzelkaufmann / Einzelkauffrau\nReilingen\n\nAls nicht eingetragen wird bekanntgemacht: Den Gläubigern der an der Ausgliederung beteiligten Rechtsträger ist, wenn sie binnen sechs Monaten nach dem Tag, an dem die Eintragung der Ausgliederung in das Register des Sitzes desjenigen Rechtsträgers, dessen Gläubiger sie sind, nach § 19 Abs. 3 UmwG als bekanntgemacht gilt, ihren Anspruch nach Grund und Höhe schriftlich anmelden, Sicherheit zu leisten, soweit sie nicht Befriedigung verlangen können. Dieses Recht steht den Gläubigern jedoch nur zu, wenn sie glaubhaft machen, dass durch die Ausgliederung die Erfüllung ihrer Forderung gefährdet wird."
    },
    {
      "date": "2025-07-22",
      "id": "116984",
      "original_text": "Registerbekanntmachung nach dem Umwandlungsgesetz\nBerlin Amtsgericht Berlin (Charlottenburg) HRB 208408\nRonny Jopp Verwaltungs UG (haftungsbeschränkt) – Berlin",
      "type": "Registerbekanntmachung nach dem Umwandlungsgesetz",
      "state": "Berlin",
      "amtsgericht": "Amtsgericht Berlin (Charlottenburg)",
      "registernummer": "HRB 208408",
      "registerart": "HRB",
      "company_name": "Ronny Jopp Verwaltungs UG (haftungsbeschränkt)",
      "company_seat": "Berlin",
      "details": "22.07.2025 (Bekanntmachungsdatum)\n\nBerlin Amtsgericht Berlin (Charlottenburg) HRB 208408\nRegisterbekanntmachung nach dem Umwandlungsgesetz 21.07.2025 (Eintragungsdatum)\n\nRonny Jopp Verwaltungs UG (haftungsbeschränkt)\nGesellschaft mit beschränkter Haftung\nBerlin\n\nZu Eintragungsnummer 2 vom 21.07.2025 wird als nicht eingetragen veröffentlicht: Den Gläubigern der an der Verschmelzung beteiligten Rechtsträger ist, wenn sie binnen sechs Monaten nach dem Tag, an dem die Eintragung der Verschmelzung in das Register des Sitzes desjenigen Rechtsträgers, dessen Gläubiger sie sind, als bekannt gemacht gilt, ihren Anspruch nach Grund und Höhe schriftlich anmelden, Sicherheit zu leisten, soweit sie nicht Befriedigung verlangen können. Dieses Recht steht den Gläubigern jedoch nur zu, wenn sie glaubhaft machen, dass durch die Verschmelzung die Erfüllung ihrer Forderung gefährdet wird. Das Recht, Sicherheitsleistung zu verlangen, steht Gläubigern nicht zu, die im Falle der Insolvenz ein Recht auf vorzugsweise Befriedigung aus einer Deckungsmasse haben, die nach gesetzlicher Vorschrift zu ihrem Schutz errichtet und staatlich überwacht ist."
    },
    {
      "date": "2025-07-22",
      "id": "116985",
      "original_text": "Sonstige Registerbekanntmachung\nSchleswig-Holstein Amtsgericht Lübeck HRB 18312\nPort X Logistics Europe GmbH – Glinde",
      "type": "Sonstige Registerbekanntmachung",
      "state": "Schleswig-Holstein",
      "amtsgericht": "Amtsgericht Lübeck",
      "registernummer": "HRB 18312",
      "registerart": "HRB",
      "company_name": "Port X Logistics Europe GmbH",
      "company_seat": "Glinde",
      "details": "22.07.2025 (Bekanntmachungsdatum)\n\nSchleswig-Holstein Amtsgericht Lübeck HRB 18312\nSonstige Registerbekanntmachung\n\nPort X Logistics Europe GmbH\nGesellschaft mit beschränkter Haftung\nGlinde\n\nAls nicht eingetragen wird veröffentlicht:\nSehr geehrter Herr Starke,\n\nin der Handelsregistersache der\n\nPort X Logistics Europe GmbH\n\nergeben sich aus den mir vorliegenden Unterlagen Anhaltspunkte dafür, dass die Gesellschaft, als deren Geschäftsführer Sie noch eingetragen sind, vermögenslos ist:\n\n- Löschungsantrag des Finanzamtes Stormarns vom 21.03.2025/ 16.06.2025 aufgrund Vermögenslosigkeit\n- Beschluss des Amtsgerichts Reinbek vom 30.05.2025, wonach der Antrag auf Eröffnung des Insolvenzverfahrens als unzulässig verworfen wurde.\n\nIch beabsichtige daher, die Gesellschaft wegen Vermögenslosigkeit gemäß § 394 FamFG zu löschen.\n\nIch bestimme eine Frist von einem Monat zur Geltendmachung eines Widerspruchs gegen die Löschung, § 394 Abs. 2 S. 1 FamFG.\n\nGgf. bitte ich Sie, mir binnen derselben Frist mitzuteilen, ob die genannte Gesellschaft noch Vermögen hat, ggf. welche Vermögensgegenstände sie besitzt, ob die Gesellschaft noch Partei eines noch nicht rechtskräftig abgeschlossenen Rechtsstreits ist oder ob sonst noch eine Abwicklung stattfindet.\n\nNach Fristablauf ohne Widerspruch von Ihnen oder anderer Seite wird die Gesellschaft gelöscht.\n\nMit freundlichen Grüßen\n\nDammann\nDipl.-Rechtspflegerin (FH)"
    },
    {
      "date": "2025-07-22",
      "id": "116986",
      "original_text": "Löschungsankündigung\nBrandenburg Amtsgericht Potsdam HRB 33310\nMO´s Textilien GmbH – Zossen",
      "type": "Löschungsankündigung",
      "state": "Brandenburg",
      "amtsgericht": "Amtsgericht Potsdam",
      "registernummer": "HRB 33310",
      "registerart": "HRB",
      "company_name": "MO´s Textilien GmbH",
      "company_seat": "Zossen",
      "details": "22.07.2025 (Bekanntmachungsdatum)\n\nBrandenburg Amtsgericht Potsdam HRB 33310\nLöschungsankündigung\n\nMO´s Textilien GmbH\nGesellschaft mit beschränkter Haftung\nZossen\n\nBei der nachstehenden Gesellschaft wird das Amtslöschungsverfahren gemäß § 394 FamFG eingeleitet. Widerspruchsfrist: 8 Wochen."
    },
    {
      "date": "2025-07-22",
      "id": "116987",
      "original_text": "Registerbekanntmachung nach dem Umwandlungsgesetz\nBaden-Württemberg Amtsgericht Mannheim HRA 4356\nLandesbank Baden-Württemberg – Mannheim",
      "type": "Registerbekanntmachung nach dem Umwandlungsgesetz",
      "state": "Baden-Württemberg",
      "amtsgericht": "Amtsgericht Mannheim",
      "registernummer": "HRA 4356",
      "registerart": "HRA",
      "company_name": "Landesbank Baden-Württemberg",
      "company_seat": "Mannheim",
      "details": "22.07.2025 (Bekanntmachungsdatum)\n\nBaden-Württemberg Amtsgericht Mannheim HRA 4356\nRegisterbekanntmachung nach dem Umwandlungsgesetz 22.07.2025 (Eintragungsdatum)\n\nLandesbank Baden-Württemberg\nSonstige juristische Person\nMannheim\n\nDen Gläubigern der an der Abspaltung beteiligten Rechtsträger ist, wenn sie binnen sechs Monaten nach dem Tag, an dem die Eintragung der Abspaltung in das Register des Sitzes desjenigen Rechtsträgers, dessen Gläubiger sie sind, nach § 19 Abs. 3 UmwG als bekanntgemacht gilt, ihren Anspruch nach Grund und Höhe schriftlich anmelden, Sicherheit zu leisten, soweit sie nicht Befriedigung verlangen können. Dieses Recht steht den Gläubigern jedoch nur zu, wenn sie glaubhaft machen, dass durch die Abspaltung die Erfüllung ihrer Forderung gefährdet wird."
    },
    {
      "date": "2025-07-22",
      "id": "116988",
      "original_text": "Löschungsankündigung\nBaden-Württemberg Amtsgericht Mannheim HRB 713971\nsmooster GmbH – Mannheim",
      "type": "Löschungsankündigung",
      "state": "Baden-Württemberg",
      "amtsgericht": "Amtsgericht Mannheim",
      "registernummer": "HRB 713971",
      "registerart": "HRB",
      "company_name": "smooster GmbH",
      "company_seat": "Mannheim",
      "details": "22.07.2025 (Bekanntmachungsdatum)\n\nBaden-Württemberg Amtsgericht Mannheim HRB 713971\nLöschungsankündigung\n\nsmooster GmbH\nGesellschaft mit beschränkter Haftung\nMannheim\n\nAls nicht eingetragen wird bekanntgemacht: Das Gericht beabsichtigt, die Gesellschaft wegen Vermögenslosigkeit im Handelsregister von Amts wegen nach § 394 FamFG zu löschen. Die Frist zur Geltendmachung eines Widerspruchs gegen die beabsichtigte Löschung ist auf einen Monat ab Veröffentlichung bestimmt."
    },
    {
      "date": "2025-07-22",
      "id": "116989",
      "original_text": "Einreichung neuer Dokumente\nBaden-Württemberg Amtsgericht Stuttgart HRB 360610\nHUGO BOSS AG – Metzingen",
      "type": "Einreichung neuer Dokumente",
      "state": "Baden-Württemberg",
      "amtsgericht": "Amtsgericht Stuttgart",
      "registernummer": "HRB 360610",
      "registerart": "HRB",
      "company_name": "HUGO BOSS AG",
      "company_seat": "Metzingen",
      "details": "22.07.2025 (Bekanntmachungsdatum)\n\nBaden-Württemberg Amtsgericht Stuttgart HRB 360610\nEinreichung neuer Dokumente 22.07.2025 (Eintragungsdatum)\n\nHUGO BOSS AG\nAktiengesellschaft\nMetzingen\n\nDie Gesellschaft hat am 11.07.2025 die Liste über die Zusammensetzung des Aufsichtsrats zum Handelsregister eingereicht."
    },
    {
      "date": "2025-07-22",
      "id": "116990",
      "original_text": "Registerbekanntmachung nach dem Umwandlungsgesetz\nBaden-Württemberg Amtsgericht Mannheim HRA 104440\nLandesbank Baden-Württemberg – Karlsruhe",
      "type": "Registerbekanntmachung nach dem Umwandlungsgesetz",
      "state": "Baden-Württemberg",
      "amtsgericht": "Amtsgericht Mannheim",
      "registernummer": "HRA 104440",
      "registerart": "HRA",
      "company_name": "Landesbank Baden-Württemberg",
      "company_seat": "Karlsruhe",
      "details": "22.07.2025 (Bekanntmachungsdatum)\n\nBaden-Württemberg Amtsgericht Mannheim HRA 104440\nRegisterbekanntmachung nach dem Umwandlungsgesetz 22.07.2025 (Eintragungsdatum)\n\nLandesbank Baden-Württemberg\nSonstige juristische Person\nKarlsruhe\n\nDen Gläubigern der an der Abspaltung beteiligten Rechtsträger ist, wenn sie binnen sechs Monaten nach dem Tag, an dem die Eintragung der Abspaltung in das Register des Sitzes desjenigen Rechtsträgers, dessen Gläubiger sie sind, nach § 19 Abs. 3 UmwG als bekanntgemacht gilt, ihren Anspruch nach Grund und Höhe schriftlich anmelden, Sicherheit zu leisten, soweit sie nicht Befriedigung verlangen können. Dieses Recht steht den Gläubigern jedoch nur zu, wenn sie glaubhaft machen, dass durch die Abspaltung die Erfüllung ihrer Forderung gefährdet wird."
    },
    {
      "date": "2025-07-22",
      "id": "116991",
      "original_text": "Registerbekanntmachung nach dem Umwandlungsgesetz\nBerlin Amtsgericht Berlin (Charlottenburg) HRB 123567\nGFG Gewährleistungsmanagement GmbH – Berlin",
      "type": "Registerbekanntmachung nach dem Umwandlungsgesetz",
      "state": "Berlin",
      "amtsgericht": "Amtsgericht Berlin (Charlottenburg)",
      "registernummer": "HRB 123567",
      "registerart": "HRB",
      "company_name": "GFG Gewährleistungsmanagement GmbH",
      "company_seat": "Berlin",
      "details": "22.07.2025 (Bekanntmachungsdatum)\n\nBerlin Amtsgericht Berlin (Charlottenburg) HRB 123567\nRegisterbekanntmachung nach dem Umwandlungsgesetz 22.07.2025 (Eintragungsdatum)\n\nGFG Gewährleistungsmanagement GmbH\nGesellschaft mit beschränkter Haftung\nBerlin\n\nZu Eintragungsnummer 9 vom 22.07.2025 wird als nicht eingetragen veröffentlicht: Den Gläubigern der an der Verschmelzung beteiligten Rechtsträger ist, wenn sie binnen sechs Monaten nach dem Tag, an dem die Eintragung der Verschmelzung in das Register des Sitzes desjenigen Rechtsträgers, dessen Gläubiger sie sind, als bekannt gemacht gilt, ihren Anspruch nach Grund und Höhe schriftlich anmelden, Sicherheit zu leisten, soweit sie nicht Befriedigung verlangen können. Dieses Recht steht den Gläubigern jedoch nur zu, wenn sie glaubhaft machen, dass durch die Verschmelzung die Erfüllung ihrer Forderung gefährdet wird. Das Recht, Sicherheitsleistung zu verlangen, steht Gläubigern nicht zu, die im Falle der Insolvenz ein Recht auf vorzugsweise Befriedigung aus einer Deckungsmasse haben, die nach gesetzlicher Vorschrift zu ihrem Schutz errichtet und staatlich überwacht ist."
    },
    {
      "date": "2025-07-22",
      "id": "116992",
      "original_text": "Registerbekanntmachung nach dem Umwandlungsgesetz\nBerlin Amtsgericht Berlin (Charlottenburg) HRB 92640\nApellas Vierte Grundbesitzverwaltungsgesellschaft mbH – Berlin",
      "type": "Registerbekanntmachung nach dem Umwandlungsgesetz",
      "state": "Berlin",
      "amtsgericht": "Amtsgericht Berlin (Charlottenburg)",
      "registernummer": "HRB 92640",
      "registerart": "HRB",
      "company_name": "Apellas Vierte Grundbesitzverwaltungsgesellschaft mbH",
      "company_seat": "Berlin",
      "details": "22.07.2025 (Bekanntmachungsdatum)\n\nBerlin Amtsgericht Berlin (Charlottenburg) HRB 92640\nRegisterbekanntmachung nach dem Umwandlungsgesetz 22.07.2025 (Eintragungsdatum)\n\nApellas Vierte Grundbesitzverwaltungsgesellschaft mbH\nGesellschaft mit beschränkter Haftung\nBerlin\n\nZu Eintragungsnummer 11 vom 22.07.2025 wird als nicht eingetragen veröffentlicht: Den Gläubigern der an der Verschmelzung beteiligten Rechtsträger ist, wenn sie binnen sechs Monaten nach dem Tag, an dem die Eintragung der Verschmelzung in das Register des Sitzes desjenigen Rechtsträgers, dessen Gläubiger sie sind, als bekannt gemacht gilt, ihren Anspruch nach Grund und Höhe schriftlich anmelden, Sicherheit zu leisten, soweit sie nicht Befriedigung verlangen können. Dieses Recht steht den Gläubigern jedoch nur zu, wenn sie glaubhaft machen, dass durch die Verschmelzung die Erfüllung ihrer Forderung gefährdet wird. Das Recht, Sicherheitsleistung zu verlangen, steht Gläubigern nicht zu, die im Falle der Insolvenz ein Recht auf vorzugsweise Befriedigung aus einer Deckungsmasse haben, die nach gesetzlicher Vorschrift zu ihrem Schutz errichtet und staatlich überwacht ist."
    },
    {
      "date": "2025-07-22",
      "id": "116993",
      "original_text": "Registerbekanntmachung nach dem Umwandlungsgesetz\nHamburg Amtsgericht Hamburg HRB 26010\nVopak Germany GmbH – Hamburg",
      "type": "Registerbekanntmachung nach dem Umwandlungsgesetz",
      "state": "Hamburg",
      "amtsgericht": "Amtsgericht Hamburg",
      "registernummer": "HRB 26010",
      "registerart": "HRB",
      "company_name": "Vopak Germany GmbH",
      "company_seat": "Hamburg",
      "details": "22.07.2025 (Bekanntmachungsdatum)\n\nHamburg Amtsgericht Hamburg HRB 26010\nRegisterbekanntmachung nach dem Umwandlungsgesetz\n\nVopak Germany GmbH\nGesellschaft mit beschränkter Haftung\nHamburg\n\nAls nicht eingetragen wird bekanntgemacht:\nEs wird darauf hingewiesen, dass ein Verschmelzungsplan oder sein Entwurf über eine grenzüberschreitende Verschmelzung zur Aufnahme mit der Vopak Internationaal B.V. mit Sitz in Rotterdam / Niederlande, beim Handelsregister eingereicht worden ist.\nDie Anteilsinhaber, die Gläubiger sowie die zuständigen Betriebsräte der an der grenzüberschreitenden Verschmelzung beteiligten Gesellschaften oder, soweit es keinen Betriebsrat gibt, die Arbeitnehmer der an der grenzüberschreitenden Verschmelzung beteiligten Gesellschaften, können der jeweiligen Gesellschaft spätestens fünf Arbeitstage vor dem Tag der Versammlung (27.08.2025) Bemerkungen zum Verschmelzungsplan übermitteln."
    },
    {
      "date": "2025-07-22",
      "id": "116994",
      "original_text": "Registerbekanntmachung nach dem Umwandlungsgesetz\nMecklenburg-Vorpommern Amtsgericht Schwerin HRB 2091\nD. & F. Transport-Gesellschaft mbH – Gägelow",
      "type": "Registerbekanntmachung nach dem Umwandlungsgesetz",
      "state": "Mecklenburg-Vorpommern",
      "amtsgericht": "Amtsgericht Schwerin",
      "registernummer": "HRB 2091",
      "registerart": "HRB",
      "company_name": "D. & F. Transport-Gesellschaft mbH",
      "company_seat": "Gägelow",
      "details": "22.07.2025 (Bekanntmachungsdatum)\n\nMecklenburg-Vorpommern Amtsgericht Schwerin HRB 2091\nRegisterbekanntmachung nach dem Umwandlungsgesetz 22.07.2025 (Eintragungsdatum)\n\nD. & F. Transport-Gesellschaft mbH\nGesellschaft mit beschränkter Haftung\nGägelow\n\nDen Gläubigern der an der Abspaltung beteiligten Rechtsträger ist, wenn sie binnen 6 Monaten nach dem Tag, an dem die Eintragung der Abspaltung in das Register desjenigen Rechtsträgers, dessen Gläubiger sie sind, nach § 19 Abs. 3 UmwG als bekannt gemacht gilt, ihren Anspruch nach Grund und Höhe schriftlich anmelden, Sicherheit zu leisten, soweit sie nicht Befriedigung verlangen können. Dieses Recht steht ihnen jedoch nur zu, wenn sie glaubhaft machen, dass durch die Abspaltung die Erfüllung ihrer Forderung gefährdet wird."
    },
    {
      "date": "2025-07-22",
      "id": "116995",
      "original_text": "Einreichung neuer Dokumente\nSachsen Amtsgericht Dresden HRB 28693\nRohde & Schwarz INRADIOS GmbH – Dresden",
      "type": "Einreichung neuer Dokumente",
      "state": "Sachsen",
      "amtsgericht": "Amtsgericht Dresden",
      "registernummer": "HRB 28693",
      "registerart": "HRB",
      "company_name": "Rohde & Schwarz INRADIOS GmbH",
      "company_seat": "Dresden",
      "details": "22.07.2025 (Bekanntmachungsdatum)\n\nSachsen Amtsgericht Dresden HRB 28693\nEinreichung neuer Dokumente\n\nRohde & Schwarz INRADIOS GmbH\nGesellschaft mit beschränkter Haftung\nDresden\n\nAm 18.07.2025 wurde beim Handelsregister des Amtsgerichts Dresden die Liste der Mitglieder des Aufsichtsrats gemäß § 52 GmbHG eingereicht."
    },
    {
      "date": "2025-07-22",
      "id": "116996",
      "original_text": "Löschungsankündigung\nSachsen Amtsgericht Dresden HRB 23014\nAMW Verwaltungsgesellschaft mbH – Freital",
      "type": "Löschungsankündigung",
      "state": "Sachsen",
      "amtsgericht": "Amtsgericht Dresden",
      "registernummer": "HRB 23014",
      "registerart": "HRB",
      "company_name": "AMW Verwaltungsgesellschaft mbH",
      "company_seat": "Freital",
      "details": "22.07.2025 (Bekanntmachungsdatum)\n\nSachsen Amtsgericht Dresden HRB 23014\nLöschungsankündigung\n\nAMW Verwaltungsgesellschaft mbH\nGesellschaft mit beschränkter Haftung\nFreital\n\nDas Registergericht beabsichtigt, die im Handelsregister eingetragene Gesellschaft von Amts wegen nach § 394 FamFG zu löschen. Die Frist zu Erhebung eines Widerspruchs gegen die beabsichtigte Löschung wird auf einen Monat festgesetzt."
    },
    {
      "date": "2025-07-22",
      "id": "116997",
      "original_text": "Löschungsankündigung\nSachsen Amtsgericht Dresden HRB 35930\nnetportale24 GmbH – Dresden",
      "type": "Löschungsankündigung",
      "state": "Sachsen",
      "amtsgericht": "Amtsgericht Dresden",
      "registernummer": "HRB 35930",
      "registerart": "HRB",
      "company_name": "netportale24 GmbH",
      "company_seat": "Dresden",
      "details": "22.07.2025 (Bekanntmachungsdatum)\n\nSachsen Amtsgericht Dresden HRB 35930\nLöschungsankündigung\n\nnetportale24 GmbH\nGesellschaft mit beschränkter Haftung\nDresden\n\nDas Registergericht beabsichtigt, die im Handelsregister eingetragene Gesellschaft von Amts wegen nach § 394 FamFG zu löschen. Die Frist zu Erhebung eines Widerspruchs gegen die beabsichtigte Löschung wird auf einen Monat festgesetzt."
    },
    {
      "date": "2025-07-22",
      "id": "116998",
      "original_text": "Registerbekanntmachung nach dem Umwandlungsgesetz\nBrandenburg Amtsgericht Neuruppin HRA 3923\nMichael Naß Service & Vertrieb Brandschutz e.K. – Schwedt/Oder",
      "type": "Registerbekanntmachung nach dem Umwandlungsgesetz",
      "state": "Brandenburg",
      "amtsgericht": "Amtsgericht Neuruppin",
      "registernummer": "HRA 3923",
      "registerart": "HRA",
      "company_name": "Michael Naß Service & Vertrieb Brandschutz e.K.",
      "company_seat": "Schwedt/Oder",
      "details": "22.07.2025 (Bekanntmachungsdatum)\n\nBrandenburg Amtsgericht Neuruppin HRA 3923\nRegisterbekanntmachung nach dem Umwandlungsgesetz 22.07.2025 (Eintragungsdatum)\n\nMichael Naß Service & Vertrieb Brandschutz e.K.\nEinzelkaufmann / Einzelkauffrau\nSchwedt/Oder\n\nZu Eintragungsnummer 2 vom 22.07.2025 wird als nicht eingetragen veröffentlicht:\nDen Gläubigern der an der Umwandlung beteiligten Rechtsträger ist, wenn sie binnen sechs Monaten nach dem Tag, an dem die Eintragung der Umwandlung in das Register des Sitzes desjenigen Rechtsträgers, dessen Gläubiger sie sind, als bekannt gemacht gilt, ihren Anspruch nach Grund und Höhe schriftlich anmelden, Sicherheit zu leisten, soweit sie nicht Befriedigung verlangen können. Dieses Recht steht den Gläubigern jedoch nur zu, wenn sie glaubhaft machen, dass durch die Umwandlung die Erfüllung ihrer Forderung gefährdet wird"
    },
    {
      "date": "2025-07-22",
      "id": "116999",
      "original_text": "Registerbekanntmachung nach dem Umwandlungsgesetz\nNiedersachsen Amtsgericht Hannover HRB 229215\nDiefenbach Coaching Operations GmbH – Hannover",
      "type": "Registerbekanntmachung nach dem Umwandlungsgesetz",
      "state": "Niedersachsen",
      "amtsgericht": "Amtsgericht Hannover",
      "registernummer": "HRB 229215",
      "registerart": "HRB",
      "company_name": "Diefenbach Coaching Operations GmbH",
      "company_seat": "Hannover",
      "details": "22.07.2025 (Bekanntmachungsdatum)\n\nNiedersachsen Amtsgericht Hannover HRB 229215\nRegisterbekanntmachung nach dem Umwandlungsgesetz 22.07.2025 (Eintragungsdatum)\n\nDiefenbach Coaching Operations GmbH\nGesellschaft mit beschränkter Haftung\nHannover\n\nDen Gläubigern der an der Ausgliederung beteiligten Rechtsträger ist, wenn sie binnen sechs Monaten nach dem Tag, an dem die Eintragung der Ausgliederung in das Register des Sitzes desjenigen Rechtsträgers, dessen Gläubiger sie sind, nach § 19 Abs. 3 UmwG als bekannt gemacht gilt, ihren Anspruch nach Grund und Höhe schriftlich anmelden, Sicherheit zu leisten, soweit sie nicht Befriedigung verlangen können. Dieses Recht steht den Gläubigern jedoch nur zu, wenn sie glaubhaft machen, dass durch die Ausgliederung die Erfüllung der Forderung gefährdet wird."
    },
    {
      "date": "2025-07-22",
      "id": "117000",
      "original_text": "Löschungsankündigung\nNiedersachsen Amtsgericht Braunschweig HRB 100536 früher Amtsgericht Wolfsburg\nAISIN Technical Center Europe S.A. Wolfsburg Branch – Wolfsburg",
      "type": "Löschungsankündigung",
      "state": "Niedersachsen",
      "amtsgericht": "Amtsgericht Braunschweig",
      "registernummer": "HRB 100536",
      "registerart": "HRB",
      "company_name": "AISIN Technical Center Europe S.A. Wolfsburg Branch",
      "company_seat": "Wolfsburg",
      "former_amtsgericht": "Wolfsburg",
      "details": "22.07.2025 (Bekanntmachungsdatum)\n\nNiedersachsen Amtsgericht Braunschweig HRB 100536 früher Amtsgericht Wolfsburg\nLöschungsankündigung 22.07.2025 (Eintragungsdatum)\n\nAISIN Technical Center Europe S.A. Wolfsburg Branch\nRechtsform ausländischen Rechts HRB\nWolfsburg\n\nDas Registergericht beabsichtigt, die Zweigniederlassung von Amts wegen nach § 395 FamFG zu löschen. Die Frist zur Erhebung eines Widerspruchs ist auf 1 Monat ab dieser Registerbekanntmachung festgesetzt."
    },
    {
      "date": "2025-07-22",
      "id": "117001",
      "original_text": "Einreichung neuer Dokumente\nNiedersachsen Amtsgericht Braunschweig HRB 204446\nMedizinisches Versorgungszentrum Am Klinikum Wolfsburg gemeinnützige GmbH (MVZ WOB gGmbH) – Wolfsburg",
      "type": "Einreichung neuer Dokumente",
      "state": "Niedersachsen",
      "amtsgericht": "Amtsgericht Braunschweig",
      "registernummer": "HRB 204446",
      "registerart": "HRB",
      "company_name": "Medizinisches Versorgungszentrum Am Klinikum Wolfsburg gemeinnützige GmbH (MVZ WOB gGmbH)",
      "company_seat": "Wolfsburg",
      "details": "22.07.2025 (Bekanntmachungsdatum)\n\nNiedersachsen Amtsgericht Braunschweig HRB 204446\nEinreichung neuer Dokumente 20.02.2025 (Eintragungsdatum)\n\nMedizinisches Versorgungszentrum Am Klinikum Wolfsburg gemeinnützige GmbH (MVZ WOB gGmbH)\nGesellschaft mit beschränkter Haftung\nWolfsburg\n\nDie Liste der Mitglieder des Aufsichtsrats wurde beim Registergericht eingereicht."
    },
    {
      "date": "2025-07-22",
      "id": "117002",
      "original_text": "Registerbekanntmachung nach dem Umwandlungsgesetz\nNiedersachsen Amtsgericht Walsrode HRB 212881\nD&M Engineering GmbH – Twistringen",
      "type": "Registerbekanntmachung nach dem Umwandlungsgesetz",
      "state": "Niedersachsen",
      "amtsgericht": "Amtsgericht Walsrode",
      "registernummer": "HRB 212881",
      "registerart": "HRB",
      "company_name": "D&M Engineering GmbH",
      "company_seat": "Twistringen",
      "details": "22.07.2025 (Bekanntmachungsdatum)\n\nNiedersachsen Amtsgericht Walsrode HRB 212881\nRegisterbekanntmachung nach dem Umwandlungsgesetz 22.07.2025 (Eintragungsdatum)\n\nD&M Engineering GmbH\nGesellschaft mit beschränkter Haftung\nTwistringen\n\nDen Gläubigern der an der formwechselnden Umwandlung beteiligten Rechtsträger ist, wenn sie binnen sechs Monaten nach dem Tag, an dem die Eintragung der Umwandlung in das Register des Sitzes desjenigen Rechtsträgers, dessen Gläubiger sie sind, nach § 19 Abs. 3 UmwG als bekannt gemacht gilt, ihren Anspruch nach Grund und Höhe schriftlich anmelden, Sicherheit zu leisten, soweit sie nicht Befriedigung verlangen können. Dieses Recht steht den Gläubigern jedoch nur zu, wenn sie glaubhaft machen, dass durch die formwechselnde Umwandlung die Erfüllung der Forderung gefährdet wird."
    },
    {
      "date": "2025-07-22",
      "id": "117003",
      "original_text": "Registerbekanntmachung nach dem Umwandlungsgesetz\nNiedersachsen Amtsgericht Lüneburg HRA 204524\nE-Motionbike Rick Bufe e.K. Verkauf und Handel von Zweirädern – Langlingen",
      "type": "Registerbekanntmachung nach dem Umwandlungsgesetz",
      "state": "Niedersachsen",
      "amtsgericht": "Amtsgericht Lüneburg",
      "registernummer": "HRA 204524",
      "registerart": "HRA",
      "company_name": "E-Motionbike Rick Bufe e.K. Verkauf und Handel von Zweirädern",
      "company_seat": "Langlingen",
      "details": "22.07.2025 (Bekanntmachungsdatum)\n\nNiedersachsen Amtsgericht Lüneburg HRA 204524\nRegisterbekanntmachung nach dem Umwandlungsgesetz 22.07.2025 (Eintragungsdatum)\n\nE-Motionbike Rick Bufe e.K. Verkauf und Handel von Zweirädern\nEinzelkaufmann / Einzelkauffrau\nLanglingen\n\nDen Gläubigern der an der Ausgliederung beteiligten Rechtsträger ist, wenn sie binnen sechs Monaten nach dem Tag, an dem die Eintragung der Ausgliederung in das Register des Sitzes desjenigen Rechtsträgers, dessen Gläubiger sie sind, nach § 19 Abs. 3 UmwG als bekannt gemacht gilt, ihren Anspruch nach Grund und Höhe schriftlich anmelden, Sicherheit zu leisten, soweit sie nicht Befriedigung verlangen können. Dieses Recht steht den Gläubigern jedoch nur zu, wenn sie glaubhaft machen, dass durch die Ausgliederung die Erfüllung der Forderung gefährdet wird."
    },
    {
      "date": "2025-07-22",
      "id": "117004",
      "original_text": "Registerbekanntmachung nach dem Umwandlungsgesetz\nNiedersachsen Amtsgericht Hannover HRB 60028\nCSL Verwaltungs GmbH – Langenhagen",
      "type": "Registerbekanntmachung nach dem Umwandlungsgesetz",
      "state": "Niedersachsen",
      "amtsgericht": "Amtsgericht Hannover",
      "registernummer": "HRB 60028",
      "registerart": "HRB",
      "company_name": "CSL Verwaltungs GmbH",
      "company_seat": "Langenhagen",
      "details": "22.07.2025 (Bekanntmachungsdatum)\n\nNiedersachsen Amtsgericht Hannover HRB 60028\nRegisterbekanntmachung nach dem Umwandlungsgesetz 22.07.2025 (Eintragungsdatum)\n\nCSL Verwaltungs GmbH\nGesellschaft mit beschränkter Haftung\nLangenhagen\n\nDen Gläubigern der an der Verschmelzung beteiligten Rechtsträger ist, wenn sie binnen sechs Monaten nach dem Tag, an dem die Eintragung der Verschmelzung in das Register des Sitzes desjenigen Rechtsträgers, dessen Gläubiger sie sind, nach § 19  Abs.  3 UmwG als bekannt gemacht gilt, ihren Anspruch nach Grund und Höhe schriftlich anmelden, Sicherheit zu leisten, soweit sie nicht Befriedigung verlangen können. Dieses Recht steht den Gläubigern jedoch nur zu, wenn sie glaubhaft machen, dass durch die Verschmelzung die Erfüllung der Forderung gefährdet wird."
    },
    {
      "date": "2025-07-22",
      "id": "117005",
      "original_text": "Registerbekanntmachung nach dem Umwandlungsgesetz\nNiedersachsen Amtsgericht Lüneburg HRB 211748\nWe-Love-E GmbH – Langlingen",
      "type": "Registerbekanntmachung nach dem Umwandlungsgesetz",
      "state": "Niedersachsen",
      "amtsgericht": "Amtsgericht Lüneburg",
      "registernummer": "HRB 211748",
      "registerart": "HRB",
      "company_name": "We-Love-E GmbH",
      "company_seat": "Langlingen",
      "details": "22.07.2025 (Bekanntmachungsdatum)\n\nNiedersachsen Amtsgericht Lüneburg HRB 211748\nRegisterbekanntmachung nach dem Umwandlungsgesetz 22.07.2025 (Eintragungsdatum)\n\nWe-Love-E GmbH\nGesellschaft mit beschränkter Haftung\nLanglingen\n\nDen Gläubigern der an der Ausgliederung beteiligten Rechtsträger ist, wenn sie binnen sechs Monaten nach dem Tag, an dem die Eintragung der Ausgliederung in das Register des Sitzes desjenigen Rechtsträgers, dessen Gläubiger sie sind, nach § 19 Abs. 3 UmwG als bekannt gemacht gilt, ihren Anspruch nach Grund und Höhe schriftlich anmelden, Sicherheit zu leisten, soweit sie nicht Befriedigung verlangen können. Dieses Recht steht den Gläubigern jedoch nur zu, wenn sie glaubhaft machen, dass durch die Ausgliederung die Erfüllung der Forderung gefährdet wird."
    },
    {
      "date": "2025-07-22",
      "id": "117006",
      "original_text": "Registerbekanntmachung nach dem Umwandlungsgesetz\nNiedersachsen Amtsgericht Walsrode GsR 484\nDiedrichs & Marischen Holzbau eGbR – Twistringen",
      "type": "Registerbekanntmachung nach dem Umwandlungsgesetz",
      "state": "Niedersachsen",
      "amtsgericht": "Amtsgericht Walsrode",
      "registernummer": "GsR 484",
      "registerart": "GsR",
      "company_name": "Diedrichs & Marischen Holzbau eGbR",
      "company_seat": "Twistringen",
      "details": "22.07.2025 (Bekanntmachungsdatum)\n\nNiedersachsen Amtsgericht Walsrode GsR 484\nRegisterbekanntmachung nach dem Umwandlungsgesetz 22.07.2025 (Eintragungsdatum)\n\nDiedrichs & Marischen Holzbau eGbR\nGesellschaft bürgerlichen Rechts\nTwistringen\n\nDen Gläubigern der an der formwechselnden Umwandlung beteiligten Rechtsträger ist, wenn sie binnen sechs Monaten nach dem Tag, an dem die Eintragung der Umwandlung in das Register des Sitzes desjenigen Rechtsträgers, dessen Gläubiger sie sind, nach § 19 Abs. 3 UmwG als bekannt gemacht gilt, ihren Anspruch nach Grund und Höhe schriftlich anmelden, Sicherheit zu leisten, soweit sie nicht Befriedigung verlangen können. Dieses Recht steht den Gläubigern jedoch nur zu, wenn sie glaubhaft machen, dass durch die formwechselnde Umwandlung die Erfüllung der Forderung gefährdet wird."
    },
    {
      "date": "2025-07-22",
      "id": "117007",
      "original_text": "Registerbekanntmachung nach dem Umwandlungsgesetz\nNiedersachsen Amtsgericht Hannover HRA 206742\nDiefenbach Coaching e.K. – Hannover",
      "type": "Registerbekanntmachung nach dem Umwandlungsgesetz",
      "state": "Niedersachsen",
      "amtsgericht": "Amtsgericht Hannover",
      "registernummer": "HRA 206742",
      "registerart": "HRA",
      "company_name": "Diefenbach Coaching e.K.",
      "company_seat": "Hannover",
      "details": "22.07.2025 (Bekanntmachungsdatum)\n\nNiedersachsen Amtsgericht Hannover HRA 206742\nRegisterbekanntmachung nach dem Umwandlungsgesetz 22.07.2025 (Eintragungsdatum)\n\nDiefenbach Coaching e.K.\nEinzelkaufmann / Einzelkauffrau\nHannover\n\nDen Gläubigern der an der Ausgliederung beteiligten Rechtsträger ist, wenn sie binnen sechs Monaten nach dem Tag, an dem die Eintragung der Ausgliederung in das Register des Sitzes desjenigen Rechtsträgers, dessen Gläubiger sie sind, nach § 19 Abs. 3 UmwG als bekannt gemacht gilt, ihren Anspruch nach Grund und Höhe schriftlich anmelden, Sicherheit zu leisten, soweit sie nicht Befriedigung verlangen können. Dieses Recht steht den Gläubigern jedoch nur zu, wenn sie glaubhaft machen, dass durch die Ausgliederung die Erfüllung der Forderung gefährdet wird."
    },
    {
      "date": "2025-07-22",
      "id": "117008",
      "original_text": "Sonstige Registerbekanntmachung\nNiedersachsen Amtsgericht Lüneburg HRB 207876\nImmobilien Eschborn GmbH – Winsen (Aller)",
      "type": "Sonstige Registerbekanntmachung",
      "state": "Niedersachsen",
      "amtsgericht": "Amtsgericht Lüneburg",
      "registernummer": "HRB 207876",
      "registerart": "HRB",
      "company_name": "Immobilien Eschborn GmbH",
      "company_seat": "Winsen (Aller)",
      "details": "22.07.2025 (Bekanntmachungsdatum)\n\nNiedersachsen Amtsgericht Lüneburg HRB 207876\nSonstige Registerbekanntmachung 22.07.2025 (Eintragungsdatum)\n\nImmobilien Eschborn GmbH\nGesellschaft mit beschränkter Haftung\nWinsen (Aller)\n\nDen Gläubigern der Gesellschaft, deren Forderungen begründet worden sind, bevor die Eintragung der Beendigung des Vertrages in das Handelsregister nach § 10 HGB als bekanntgemacht gilt, ist vom anderen Vertragsteil Sicherheit zu leisten, wenn sie sich binnen sechs Monaten nach der Bekanntmachung zu diesem Zweck bei ihm melden."
    },
    {
      "date": "2025-07-22",
      "id": "117009",
      "original_text": "Löschungsankündigung\nNiedersachsen Amtsgericht Oldenburg (Oldenburg) HRB 211850\nEMSDELTA Schiffahrts- und Handelsges. m.b.H. – Delmenhorst",
      "type": "Löschungsankündigung",
      "state": "Niedersachsen",
      "amtsgericht": "Amtsgericht Oldenburg (Oldenburg)",
      "registernummer": "HRB 211850",
      "registerart": "HRB",
      "company_name": "EMSDELTA Schiffahrts- und Handelsges. m.b.H.",
      "company_seat": "Delmenhorst",
      "details": "22.07.2025 (Bekanntmachungsdatum)\n\nNiedersachsen Amtsgericht Oldenburg (Oldenburg) HRB 211850\nLöschungsankündigung\n\nEMSDELTA Schiffahrts- und Handelsges. m.b.H.\nGesellschaft mit beschränkter Haftung\nDelmenhorst\n\nDas Registergericht beabsichtigt, die Gesellschaft von Amts wegen nach § 394 FamFG zu löschen. Die Frist zur Erhebung eines Widerspruchs ist auf 1 Monat ab dieser Registerbekanntmachung festgesetzt."
    },
    {
      "date": "2025-07-22",
      "id": "117010",
      "original_text": "Registerbekanntmachung nach dem Umwandlungsgesetz\nRheinland-Pfalz Amtsgericht Landau HRB 30403\nRaven Capital GmbH – Landau in der Pfalz",
      "type": "Registerbekanntmachung nach dem Umwandlungsgesetz",
      "state": "Rheinland-Pfalz",
      "amtsgericht": "Amtsgericht Landau",
      "registernummer": "HRB 30403",
      "registerart": "HRB",
      "company_name": "Raven Capital GmbH",
      "company_seat": "Landau in der Pfalz",
      "details": "22.07.2025 (Bekanntmachungsdatum)\n\nRheinland-Pfalz Amtsgericht Landau HRB 30403\nRegisterbekanntmachung nach dem Umwandlungsgesetz 13.06.2025 (Eintragungsdatum)\n\nRaven Capital GmbH\nGesellschaft mit beschränkter Haftung\nLandau in der Pfalz\n\nAls nicht eingetragen wird veröffentlicht: Den Gläubigern der an der Verschmelzung beteiligten Rechtsträger ist, wenn sie binnen sechs Monaten nach dem Tag, an dem die Eintragung der Verschmelzung in das Register des Sitzes desjenigen Rechtsträgers, dessen Gläubiger sie sind, nach § 19 Abs. 3 UmwG als bekannt gemacht gilt, ihren Anspruch nach Grund und Höhe schriftlich anmelden, Sicherheit zu leisten, soweit sie nicht Befriedigung verlangen können. Dieses Recht steht den Gläubigern jedoch nur zu, wenn sie glaubhaft machen, dass durch die Verschmelzung die Erfüllung der Forderung gefährdet wird."
    },
    {
      "date": "2025-07-22",
      "id": "117011",
      "original_text": "Registerbekanntmachung nach dem Umwandlungsgesetz\nRheinland-Pfalz Amtsgericht Montabaur HRB 13084\nWyatt Technology Europe GmbH – Dernbach",
      "type": "Registerbekanntmachung nach dem Umwandlungsgesetz",
      "state": "Rheinland-Pfalz",
      "amtsgericht": "Amtsgericht Montabaur",
      "registernummer": "HRB 13084",
      "registerart": "HRB",
      "company_name": "Wyatt Technology Europe GmbH",
      "company_seat": "Dernbach",
      "details": "22.07.2025 (Bekanntmachungsdatum)\n\nRheinland-Pfalz Amtsgericht Montabaur HRB 13084\nRegisterbekanntmachung nach dem Umwandlungsgesetz 22.07.2025 (Eintragungsdatum)\n\nWyatt Technology Europe GmbH\nGesellschaft mit beschränkter Haftung\nDernbach\n\nAls nicht eingetragen wird veröffentlicht: Den Gläubigern der an der Verschmelzung beteiligten Rechtsträger ist, wenn sie binnen sechs Monaten nach dem Tag, an dem die Eintragung der Verschmelzung in das Register des Sitzes desjenigen Rechtsträgers, dessen Gläubiger sie sind, nach § 19 Abs. 3 UmwG als bekannt gemacht gilt, ihren Anspruch nach Grund und Höhe schriftlich anmelden, Sicherheit zu leisten, soweit sie nicht Befriedigung verlangen können. Dieses Recht steht den Gläubigern jedoch nur zu, wenn sie glaubhaft machen, dass durch die Verschmelzung die Erfüllung der Forderung gefährdet wird."
    },
    {
      "date": "2025-07-22",
      "id": "117012",
      "original_text": "Sonstige Registerbekanntmachung\nRheinland-Pfalz Amtsgericht Wittlich HRB 47024\nSteil Beteiligungsgesellschaft mbH – Trier",
      "type": "Sonstige Registerbekanntmachung",
      "state": "Rheinland-Pfalz",
      "amtsgericht": "Amtsgericht Wittlich",
      "registernummer": "HRB 47024",
      "registerart": "HRB",
      "company_name": "Steil Beteiligungsgesellschaft mbH",
      "company_seat": "Trier",
      "details": "22.07.2025 (Bekanntmachungsdatum)\n\nRheinland-Pfalz Amtsgericht Wittlich HRB 47024\nSonstige Registerbekanntmachung 22.07.2025 (Eintragungsdatum)\n\nSteil Beteiligungsgesellschaft mbH\nGesellschaft mit beschränkter Haftung\nTrier\n\nAls nicht eingetragen wird veröffentlicht: Den Gläubigern der Gesellschaft, deren Forderungen begründet worden sind, bevor die Eintragung der Beendigung des Beherrschungs- undGewinnabführungsvertrages in das Handelsregister nach § 10 des Handelsgesetzbuches als bekanntgemacht gilt, hat der andere Vertragsteil Sicherheit zu leisten, wenn sie sich binnen sechs Monaten nach der Bekanntmachung der Eintragung zu diesem Zweck bei ihm melden."
    },
    {
      "date": "2025-07-22",
      "id": "117013",
      "original_text": "Einreichung neuer Dokumente\nRheinland-Pfalz Amtsgericht Wittlich HRB 4709\nTEMME AG – Konz",
      "type": "Einreichung neuer Dokumente",
      "state": "Rheinland-Pfalz",
      "amtsgericht": "Amtsgericht Wittlich",
      "registernummer": "HRB 4709",
      "registerart": "HRB",
      "company_name": "TEMME AG",
      "company_seat": "Konz",
      "details": "22.07.2025 (Bekanntmachungsdatum)\n\nRheinland-Pfalz Amtsgericht Wittlich HRB 4709\nEinreichung neuer Dokumente 22.07.2025 (Eintragungsdatum)\n\nTEMME AG\nAktiengesellschaft\nKonz\n\nDem Registergericht ist eine neue Liste der Mitglieder des Aufsichtsrates eingereicht worden."
    },
    {
      "date": "2025-07-22",
      "id": "117014",
      "original_text": "Registerbekanntmachung nach dem Umwandlungsgesetz\nRheinland-Pfalz Amtsgericht Landau HRB 2951\nJoppe GmbH – Offenbach/Queich",
      "type": "Registerbekanntmachung nach dem Umwandlungsgesetz",
      "state": "Rheinland-Pfalz",
      "amtsgericht": "Amtsgericht Landau",
      "registernummer": "HRB 2951",
      "registerart": "HRB",
      "company_name": "Joppe GmbH",
      "company_seat": "Offenbach/Queich",
      "details": "22.07.2025 (Bekanntmachungsdatum)\n\nRheinland-Pfalz Amtsgericht Landau HRB 2951\nRegisterbekanntmachung nach dem Umwandlungsgesetz 05.06.2025 (Eintragungsdatum)\n\nJoppe GmbH\nGesellschaft mit beschränkter Haftung\nOffenbach/Queich\n\nAls nicht eingetragen wird veröffentlicht: Den Gläubigern der an der Verschmelzung beteiligten Rechtsträger ist, wenn sie binnen sechs Monaten nach dem Tag, an dem die Eintragung der Verschmelzung in das Register des Sitzes desjenigen Rechtsträgers,dessen Gläubiger sie sind, nach § 19 Abs. 3 UmwG als bekannt gemacht gilt, ihren Anspruch nach Grund und Höhe schriftlich anmelden, Sicherheit zu leisten, soweit sie nicht Befriedigung verlangen können. Dieses Recht steht den Gläubigern jedoch nur zu, wenn sie glaubhaft machen, dass durch die Verschmelzung die Erfüllung der Forderung gefährdet wird."
    },
    {
      "date": "2025-07-22",
      "id": "117015",
      "original_text": "Sonstige Registerbekanntmachung\nRheinland-Pfalz Amtsgericht Mainz HRB 4066\nEckes-Granini Deutschland GmbH – Nieder-Olm",
      "type": "Sonstige Registerbekanntmachung",
      "state": "Rheinland-Pfalz",
      "amtsgericht": "Amtsgericht Mainz",
      "registernummer": "HRB 4066",
      "registerart": "HRB",
      "company_name": "Eckes-Granini Deutschland GmbH",
      "company_seat": "Nieder-Olm",
      "details": "22.07.2025 (Bekanntmachungsdatum)\n\nRheinland-Pfalz Amtsgericht Mainz HRB 4066\nSonstige Registerbekanntmachung\n\nEckes-Granini  Deutschland GmbH\nGesellschaft mit beschränkter Haftung\nNieder-Olm\n\nDem Registergericht ist eine Liste der Mitglieder des Aufsichtsrates eingereicht worden."
    },
    {
      "date": "2025-07-22",
      "id": "117016",
      "original_text": "Registerbekanntmachung nach dem Umwandlungsgesetz\nRheinland-Pfalz Amtsgericht Ludwigshafen a.Rhein (Ludwigshafen) HRB 69668\nscaffmax GmbH – Neustadt an der Weinstraße",
      "type": "Registerbekanntmachung nach dem Umwandlungsgesetz",
      "state": "Rheinland-Pfalz",
      "amtsgericht": "Amtsgericht Ludwigshafen a.Rhein (Ludwigshafen)",
      "registernummer": "HRB 69668",
      "registerart": "HRB",
      "company_name": "scaffmax GmbH",
      "company_seat": "Neustadt an der Weinstraße",
      "details": "22.07.2025 (Bekanntmachungsdatum)\n\nRheinland-Pfalz Amtsgericht Ludwigshafen a.Rhein (Ludwigshafen) HRB 69668\nRegisterbekanntmachung nach dem Umwandlungsgesetz 22.07.2025 (Eintragungsdatum)\n\nscaffmax GmbH\nGesellschaft mit beschränkter Haftung\nNeustadt an der Weinstraße\n\nAls nicht eingetragen wird veröffentlicht: Den Gläubigern der an der Verschmelzung beteiligten Rechtsträger ist, wenn sie binnen sechs Monaten nach dem Tag, an dem die Eintragung der Verschmelzung in das Register des Sitzes desjenigen Rechtsträgers,dessen Gläubiger sie sind, nach § 19 Abs. 3 UmwG als bekannt gemacht gilt, ihren Anspruch nach Grund und Höhe schriftlich anmelden, Sicherheit zu leisten, soweit sie nicht Befriedigung verlangen können. Dieses Recht steht den Gläubigern jedoch nur zu, wenn sie glaubhaft machen, dass durch die Verschmelzung die Erfüllungd er Forderung gefährdet wird."
    },
    {
      "date": "2025-07-22",
      "id": "117017",
      "original_text": "Registerbekanntmachung nach dem Umwandlungsgesetz\nRheinland-Pfalz Amtsgericht Landau HRB 33021\nBeamvest GmbH – Ottersheim",
      "type": "Registerbekanntmachung nach dem Umwandlungsgesetz",
      "state": "Rheinland-Pfalz",
      "amtsgericht": "Amtsgericht Landau",
      "registernummer": "HRB 33021",
      "registerart": "HRB",
      "company_name": "Beamvest GmbH",
      "company_seat": "Ottersheim",
      "details": "22.07.2025 (Bekanntmachungsdatum)\n\nRheinland-Pfalz Amtsgericht Landau HRB 33021\nRegisterbekanntmachung nach dem Umwandlungsgesetz 17.04.2025 (Eintragungsdatum)\n\nBeamvest GmbH\nGesellschaft mit beschränkter Haftung\nOttersheim\n\nAls nicht eingetragen wird veröffentlicht: Den Gläubigern der an der Verschmelzung beteiligten Rechtsträger ist, wenn sie binnen sechs Monaten nach dem Tag, an dem die Eintragung der Verschmelzung in das Register des Sitzes desjenigen Rechtsträgers,dessen Gläubiger sie sind, nach § 19 Abs. 3 UmwG als bekannt gemacht gilt, ihren Anspruch nach Grund und Höhe schriftlich anmelden, Sicherheit zu leisten, soweit sie nicht Befriedigung verlangen können. Dieses Recht steht den Gläubigern jedoch nur zu, wenn sie glaubhaft machen, dass durch die Verschmelzung die Erfüllungd er Forderung gefährdet wird."
    },
    {
      "date": "2025-07-22",
      "id": "117018",
      "original_text": "Löschungsankündigung\nRheinland-Pfalz Amtsgericht Montabaur HRA 21697\nProjektgesellschaft \"Wohnpark Gutshof Henn\" GmbH & Co. KG – Neuwied",
      "type": "Löschungsankündigung",
      "state": "Rheinland-Pfalz",
      "amtsgericht": "Amtsgericht Montabaur",
      "registernummer": "HRA 21697",
      "registerart": "HRA",
      "company_name": "Projektgesellschaft \"Wohnpark Gutshof Henn\" GmbH & Co. KG",
      "company_seat": "Neuwied",
      "details": "22.07.2025 (Bekanntmachungsdatum)\n\nRheinland-Pfalz Amtsgericht Montabaur HRA 21697\nLöschungsankündigung\n\nProjektgesellschaft \"Wohnpark Gutshof Henn\" GmbH & Co. KG\nKommanditgesellschaft\nNeuwied\n\nDas Registergericht beabsichtigt die Firma von Amts wegen nach § 394 FamFG zu löschen. Die Frist zur Erhebung eines Widerspruchs ist auf 1 Monat festgesetzt."
    },
    {
      "date": "2025-07-22",
      "id": "117019",
      "original_text": "Registerbekanntmachung nach dem Umwandlungsgesetz\nNordrhein-Westfalen Amtsgericht Köln HRB 90354\nYuzu Food GmbH – Köln",
      "type": "Registerbekanntmachung nach dem Umwandlungsgesetz",
      "state": "Nordrhein-Westfalen",
      "amtsgericht": "Amtsgericht Köln",
      "registernummer": "HRB 90354",
      "registerart": "HRB",
      "company_name": "Yuzu Food GmbH",
      "company_seat": "Köln",
      "details": "22.07.2025 (Bekanntmachungsdatum)\n\nNordrhein-Westfalen Amtsgericht Köln HRB 90354\nRegisterbekanntmachung nach dem Umwandlungsgesetz\n\nYuzu Food GmbH\nGesellschaft mit beschränkter Haftung\nKöln\n\nDen Gläubigern der an der Verschmelzung beteiligten Rechtsträger ist, wenn sie binnen sechs Monaten nach dem Tag, an dem die Eintragung der Verschmelzung in das Register des Sitzes desjenigen Rechtsträgers, dessen Gläubiger sie sind, nach § 19 Absatz 3 UmwG als bekanntgemacht gilt, ihren Anspruch nach Grund und Höhe schriftlich anmelden, Sicherheit zu leisten, soweit sie nicht Befriedigung verlangen können. Dieses Recht steht den Gläubigern jedoch nur zu, wenn sie glaubhaft machen, dass durch die Verschmelzung die Erfüllung ihrer Forderung gefährdet wird."
    },
    {
      "date": "2025-07-22",
      "id": "117020",
      "original_text": "Registerbekanntmachung nach dem Umwandlungsgesetz\nNordrhein-Westfalen Amtsgericht Düsseldorf HRB 13010\nATS Allgemeine Treuhand GmbH Buchprüfungsgesellschaft Steuerberatungsgesellschaft – Düsseldorf",
      "type": "Registerbekanntmachung nach dem Umwandlungsgesetz",
      "state": "Nordrhein-Westfalen",
      "amtsgericht": "Amtsgericht Düsseldorf",
      "registernummer": "HRB 13010",
      "registerart": "HRB",
      "company_name": "ATS Allgemeine Treuhand GmbH Buchprüfungsgesellschaft Steuerberatungsgesellschaft",
      "company_seat": "Düsseldorf",
      "details": "22.07.2025 (Bekanntmachungsdatum)\n\nNordrhein-Westfalen Amtsgericht Düsseldorf HRB 13010\nRegisterbekanntmachung nach dem Umwandlungsgesetz 22.07.2025 (Eintragungsdatum)\n\nATS Allgemeine Treuhand GmbH Buchprüfungsgesellschaft Steuerberatungsgesellschaft\nGesellschaft mit beschränkter Haftung\nDüsseldorf\n\nDen Gläubigern der an der Verschmelzung beteiligten Rechtsträger ist, wenn sie binnen sechs Monaten nach dem Tag, an dem die Eintragung der Verschmelzung in das Register des Sitzes desjenigen Rechtsträgers, dessen Gläubiger sie sind, nach § 19 Absatz 3 UmwG als bekanntgemacht gilt, ihren Anspruch nach Grund und Höhe schriftlich anmelden, Sicherheit zu leisten, soweit sie nicht Befriedigung verlangen können. Dieses Recht steht den Gläubigern jedoch nur zu, wenn sie glaubhaft machen, dass durch die Verschmelzung die Erfüllung ihrer Forderung gefährdet wird."
    },
    {
      "date": "2025-07-22",
      "id": "117021",
      "original_text": "Einreichung neuer Dokumente\nNordrhein-Westfalen Amtsgericht Dortmund HRB 15582\nIHK Gesellschaft für Informationsverarbeitung mbH – Dortmund",
      "type": "Einreichung neuer Dokumente",
      "state": "Nordrhein-Westfalen",
      "amtsgericht": "Amtsgericht Dortmund",
      "registernummer": "HRB 15582",
      "registerart": "HRB",
      "company_name": "IHK Gesellschaft für Informationsverarbeitung mbH",
      "company_seat": "Dortmund",
      "details": "22.07.2025 (Bekanntmachungsdatum)\n\nNordrhein-Westfalen Amtsgericht Dortmund HRB 15582\nEinreichung neuer Dokumente\n\nIHK Gesellschaft für Informationsverarbeitung mbH\nGesellschaft mit beschränkter Haftung\nDortmund\n\nDem Registergericht ist eine neue Liste der Mitglieder des Aufsichtsrates eingereicht worden."
    },
    {
      "date": "2025-07-22",
      "id": "117022",
      "original_text": "Registerbekanntmachung nach dem Umwandlungsgesetz\nNordrhein-Westfalen Amtsgericht Siegburg HRA 7242\nBraschoß Brandschutz GmbH & Co. KG – Niederkassel",
      "type": "Registerbekanntmachung nach dem Umwandlungsgesetz",
      "state": "Nordrhein-Westfalen",
      "amtsgericht": "Amtsgericht Siegburg",
      "registernummer": "HRA 7242",
      "registerart": "HRA",
      "company_name": "Braschoß Brandschutz GmbH & Co. KG",
      "company_seat": "Niederkassel",
      "details": "22.07.2025 (Bekanntmachungsdatum)\n\nNordrhein-Westfalen Amtsgericht Siegburg HRA 7242\nRegisterbekanntmachung nach dem Umwandlungsgesetz 17.07.2025 (Eintragungsdatum)\n\nBraschoß Brandschutz GmbH & Co. KG\nKommanditgesellschaft\nNiederkassel\n\nDen Gläubigern der an der Ausgliederung beteiligten Rechtsträger ist, wenn sie binnen sechs Monaten nach dem Tag, an dem die Eintragung der Ausgliederung in das Register des Sitzes desjenigen Rechtsträgers, dessen Gläubiger sie sind, nach § 19 Absatz 3 UmwG als bekanntgemacht gilt, ihren Anspruch nach Grund und Höhe schriftlich anmelden, Sicherheit zu leisten, soweit sie nicht Befriedigung verlangen können. Dieses Recht steht den Gläubigern jedoch nur zu, wenn sie glaubhaft machen, dass durch die Ausgliederung die Erfüllung ihrer Forderung gefährdet wird."
    },
    {
      "date": "2025-07-22",
      "id": "117023",
      "original_text": "Einreichung neuer Dokumente\nNordrhein-Westfalen Amtsgericht Köln HRB 35652\nHEUBECK AG – Köln",
      "type": "Einreichung neuer Dokumente",
      "state": "Nordrhein-Westfalen",
      "amtsgericht": "Amtsgericht Köln",
      "registernummer": "HRB 35652",
      "registerart": "HRB",
      "company_name": "HEUBECK AG",
      "company_seat": "Köln",
      "details": "22.07.2025 (Bekanntmachungsdatum)\n\nNordrhein-Westfalen Amtsgericht Köln HRB 35652\nEinreichung neuer Dokumente\n\nHEUBECK AG\nAktiengesellschaft\nKöln\n\nDem Registergericht ist eine Liste der Mitglieder des Aufsichtsrates eingereicht worden."
    },
    {
      "date": "2025-07-22",
      "id": "117024",
      "original_text": "Löschungsankündigung\nNordrhein-Westfalen Amtsgericht Gelsenkirchen HRB 17550\nHomone UG (haftungsbeschränkt) – Gelsenkirchen",
      "type": "Löschungsankündigung",
      "state": "Nordrhein-Westfalen",
      "amtsgericht": "Amtsgericht Gelsenkirchen",
      "registernummer": "HRB 17550",
      "registerart": "HRB",
      "company_name": "Homone UG (haftungsbeschränkt)",
      "company_seat": "Gelsenkirchen",
      "details": "22.07.2025 (Bekanntmachungsdatum)\n\nNordrhein-Westfalen Amtsgericht Gelsenkirchen HRB 17550\nLöschungsankündigung\n\nHomone UG (haftungsbeschränkt)\nGesellschaft mit beschränkter Haftung\nGelsenkirchen\n\nDas Gericht beabsichtigt, die Gesellschaft Homone UG (haftungsbeschränkt) mit Sitz in Gelsenkirchen, HRB 17550 Amtsgericht Gelsenkirchen, wegen Vermögenslosigkeit zu löschen.\n\nHiermit wird denjenigen, die an der Unterlassung der Löschung ein berechtigtes Interesse haben, gem. § 394 Abs. 2 FamFG Gelegenheit gegeben, gegen dieses Vorhaben binnen eines Monats nach dieser Bekanntmachung Widerspruch einzulegen. Der Widerspruch kann schriftlich oder zu Protokoll der Geschäftsstelle erhoben werden."
    },
    {
      "date": "2025-07-22",
      "id": "117025",
      "original_text": "Löschungsankündigung\nNordrhein-Westfalen Amtsgericht Siegburg HRB 10231\nDe Markestee GmbH, Zweigniederlassung der De Markestee Beheer B.V. – Troisdorf",
      "type": "Löschungsankündigung",
      "state": "Nordrhein-Westfalen",
      "amtsgericht": "Amtsgericht Siegburg",
      "registernummer": "HRB 10231",
      "registerart": "HRB",
      "company_name": "De Markestee GmbH, Zweigniederlassung der De Markestee Beheer B.V.",
      "company_seat": "Troisdorf",
      "details": "22.07.2025 (Bekanntmachungsdatum)\n\nNordrhein-Westfalen Amtsgericht Siegburg HRB 10231\nLöschungsankündigung\n\nDe Markestee GmbH, Zweigniederlassung der De Markestee Beheer B.V.\nRechtsform ausländischen Rechts HRB\nTroisdorf\n\nDas Registergericht hat festgestellt, dass die Gesellschaft seit dem 25.02.2025 im ausländischen Register gelöscht. Damit handelt es sich bei der Eintragung der Zweigniederlassung im hiesigen Handelsregister um eine unzulässige Eintragung, die nach § 395 FamFG von Amts wegen zu löschen ist. Einwände gegen die Löschung sind durch Widerspruch binnen einer Frist von 1 Monat ab Bekanntgabe dieser Mitteilung geltend zu machen, andernfalls die Löschung erfolgen.\nEinzulegen ist der Widerspruch bei dem Amtsgericht Siegburg, Neue Poststraße 16, 53721 Siegburg, und zwar entweder schriftlich in deutscher Sprache oder mündlich zur Niederschrift der Geschäftsstelle. Der Widerspruch kann auch zur Niederschrift der Geschäftsstelle eines jeden Amtsgerichts abgegeben werden. Der Widerspruch ist binnen der in der Verfügung bestimmten Frist einzulegen. Die Frist ist nur gewahrt, wenn der Widerspruch rechtzeitig bei dem Amtsgericht Siegburg eingeht, auch wenn der Widerspruch zur Niederschrift der Geschäftsstelle eines anderen Amtsgerichts abgegeben wurde. Die Frist beginnt jeweils mit der schriftlichen Bekanntgabe der Verfügung an die Beteiligten. Kann die schriftliche Bekanntgabe an einen Beteiligten nicht bewirkt werden, beginnt die Frist spätestens mit Ablauf von fünf Monaten nach Erlass der Verfügung. Die Bekanntgabe ist entweder durch Zustellung oder am dritten Tage nach Aufgabe zur Post bewirkt. Sofern die Löschung noch nicht erfolgt ist, kann der Widerspruch auch noch nach Ablauf der Frist eingelegt werden. Fällt das Ende der Frist auf einen Sonnabend, einen Sonntag oder einen allgemeinen Feiertag, endet die Frist mit Ablauf des nächsten Werktages. Der Widerspruch ist zu unterzeichnen. Eine Begründung des Widerspruchs ist nicht vorgeschrieben."
    },
    {
      "date": "2025-07-22",
      "id": "117026",
      "original_text": "Registerbekanntmachung nach dem Umwandlungsgesetz\nNordrhein-Westfalen Amtsgericht Iserlohn HRA 4883\nCONCEPTUS Immobilien GmbH & Co. KG – Meinerzhagen",
      "type": "Registerbekanntmachung nach dem Umwandlungsgesetz",
      "state": "Nordrhein-Westfalen",
      "amtsgericht": "Amtsgericht Iserlohn",
      "registernummer": "HRA 4883",
      "registerart": "HRA",
      "company_name": "CONCEPTUS Immobilien GmbH & Co. KG",
      "company_seat": "Meinerzhagen",
      "details": "22.07.2025 (Bekanntmachungsdatum)\n\nNordrhein-Westfalen Amtsgericht Iserlohn HRA 4883\nRegisterbekanntmachung nach dem Umwandlungsgesetz 22.07.2025 (Eintragungsdatum)\n\nCONCEPTUS Immobilien GmbH & Co. KG\nKommanditgesellschaft\nMeinerzhagen\n\nDen Gläubigern der an der Verschmelzung beteiligten Rechtsträger ist, wenn sie binnen sechs Monaten nach dem Tag, an dem die Eintragung der Verschmelzung in das Register des Sitzes desjenigen Rechtsträgers, dessen Gläubiger sie sind, nach § 19 Absatz 3 UmwG als bekanntgemacht gilt, ihren Anspruch nach Grund und Höhe schriftlich anmelden, Sicherheit zu leisten, soweit sie nicht Befriedigung verlangen können. Dieses Recht steht den Gläubigern jedoch nur zu, wenn sie glaubhaft machen, dass durch die Verschmelzung die Erfüllung ihrer Forderung gefährdet wird."
    },
    {
      "date": "2025-07-22",
      "id": "117027",
      "original_text": "Registerbekanntmachung nach dem Umwandlungsgesetz\nNordrhein-Westfalen Amtsgericht Bonn HRB 20583\nbsmb GmbH – Bonn",
      "type": "Registerbekanntmachung nach dem Umwandlungsgesetz",
      "state": "Nordrhein-Westfalen",
      "amtsgericht": "Amtsgericht Bonn",
      "registernummer": "HRB 20583",
      "registerart": "HRB",
      "company_name": "bsmb GmbH",
      "company_seat": "Bonn",
      "details": "22.07.2025 (Bekanntmachungsdatum)\n\nNordrhein-Westfalen Amtsgericht Bonn HRB 20583\nRegisterbekanntmachung nach dem Umwandlungsgesetz 22.07.2025 (Eintragungsdatum)\n\nbsmb GmbH\nGesellschaft mit beschränkter Haftung\nBonn\n\nDen Gläubigern der an der Verschmelzung beteiligten Rechtsträger ist, wenn sie binnen sechs Monaten nach dem Tag, an dem die Eintragung der Verschmelzung in das Register des Sitzes desjenigen Rechtsträgers, dessen Gläubiger sie sind, nach § 19 Absatz 3 UmwG als bekanntgemacht gilt, ihren Anspruch nach Grund und Höhe schriftlich anmelden, Sicherheit zu leisten, soweit sie nicht Befriedigung verlangen können. Dieses Recht steht den Gläubigern jedoch nur zu, wenn sie glaubhaft machen, dass durch die Verschmelzung die Erfüllung ihrer Forderung gefährdet wird."
    },
    {
      "date": "2025-07-22",
      "id": "117028",
      "original_text": "Einreichung neuer Dokumente\nNordrhein-Westfalen Amtsgericht Gelsenkirchen HRB 10573\nStadtwerke Gelsenkirchen Photovoltaik GmbH – Gelsenkirchen",
      "type": "Einreichung neuer Dokumente",
      "state": "Nordrhein-Westfalen",
      "amtsgericht": "Amtsgericht Gelsenkirchen",
      "registernummer": "HRB 10573",
      "registerart": "HRB",
      "company_name": "Stadtwerke Gelsenkirchen Photovoltaik GmbH",
      "company_seat": "Gelsenkirchen",
      "details": "22.07.2025 (Bekanntmachungsdatum)\n\nNordrhein-Westfalen Amtsgericht Gelsenkirchen HRB 10573\nEinreichung neuer Dokumente\n\nStadtwerke Gelsenkirchen Photovoltaik GmbH\nGesellschaft mit beschränkter Haftung\nGelsenkirchen\n\nDem Registergericht ist eine neue Liste der Mitglieder des Aufsichtsrates eingereicht worden."
    },
    {
      "date": "2025-07-22",
      "id": "117029",
      "original_text": "Registerbekanntmachung nach dem Umwandlungsgesetz\nNordrhein-Westfalen Amtsgericht Steinfurt HRB 10182\nAtemzentrum Großhansdorf GmbH – Ibbenbüren",
      "type": "Registerbekanntmachung nach dem Umwandlungsgesetz",
      "state": "Nordrhein-Westfalen",
      "amtsgericht": "Amtsgericht Steinfurt",
      "registernummer": "HRB 10182",
      "registerart": "HRB",
      "company_name": "Atemzentrum Großhansdorf GmbH",
      "company_seat": "Ibbenbüren",
      "details": "22.07.2025 (Bekanntmachungsdatum)\n\nNordrhein-Westfalen Amtsgericht Steinfurt HRB 10182\nRegisterbekanntmachung nach dem Umwandlungsgesetz 22.07.2025 (Eintragungsdatum)\n\nAtemzentrum Großhansdorf GmbH\nGesellschaft mit beschränkter Haftung\nIbbenbüren\n\nDen Gläubigern der an der Verschmelzung beteiligten Rechtsträger ist, wenn sie binnen sechs Monaten nach dem Tag, an dem die Eintragung der Verschmelzung in das Register des Sitzes desjenigen Rechtsträgers, dessen Gläubiger sie sind, nach § 19 Absatz 3 UmwG als bekanntgemacht gilt, ihren Anspruch nach Grund und Höhe schriftlich anmelden, Sicherheit zu leisten, soweit sie nicht Befriedigung verlangen können. Dieses Recht steht den Gläubigern jedoch nur zu, wenn sie glaubhaft machen, dass durch die Verschmelzung die Erfüllung ihrer Forderung gefährdet wird."
    },
    {
      "date": "2025-07-22",
      "id": "117030",
      "original_text": "Registerbekanntmachung nach dem Umwandlungsgesetz\nNordrhein-Westfalen Amtsgericht Aachen HRB 1582\nNeuefeind Haustechnik GmbH – Aachen",
      "type": "Registerbekanntmachung nach dem Umwandlungsgesetz",
      "state": "Nordrhein-Westfalen",
      "amtsgericht": "Amtsgericht Aachen",
      "registernummer": "HRB 1582",
      "registerart": "HRB",
      "company_name": "Neuefeind Haustechnik GmbH",
      "company_seat": "Aachen",
      "details": "22.07.2025 (Bekanntmachungsdatum)\n\nNordrhein-Westfalen Amtsgericht Aachen HRB 1582\nRegisterbekanntmachung nach dem Umwandlungsgesetz 22.07.2025 (Eintragungsdatum)\n\nNeuefeind Haustechnik GmbH\nGesellschaft mit beschränkter Haftung\nAachen\n\nDen Gläubigern der an der Verschmelzung beteiligten Rechtsträger ist, wenn sie binnen sechs Monaten nach dem Tag, an dem die Eintragung der Verschmelzung in das Register des Sitzes derjenigen Rechtsträger deren Gläubiger sie sind, nach § 19 Absatz 3 UmwG als bekanntgemacht gilt, ihren Anspruch nach Grund und Höhe schriftlich anmelden, Sicherheit zu leisten, soweit sie nicht Befriedigung verlangen können. Dieses Recht steht den Gläubigern jedoch nur zu, wenn sie glaubhaft machen, dass durch die Verschmelzung die Erfüllung ihrer Forderung gefährdet wird."
    },
    {
      "date": "2025-07-22",
      "id": "117031",
      "original_text": "Registerbekanntmachung nach dem Umwandlungsgesetz\nNordrhein-Westfalen Amtsgericht Siegen HRB 10652\nSGB International GmbH – Siegen",
      "type": "Registerbekanntmachung nach dem Umwandlungsgesetz",
      "state": "Nordrhein-Westfalen",
      "amtsgericht": "Amtsgericht Siegen",
      "registernummer": "HRB 10652",
      "registerart": "HRB",
      "company_name": "SGB International GmbH",
      "company_seat": "Siegen",
      "details": "22.07.2025 (Bekanntmachungsdatum)\n\nNordrhein-Westfalen Amtsgericht Siegen HRB 10652\nRegisterbekanntmachung nach dem Umwandlungsgesetz 22.07.2025 (Eintragungsdatum)\n\nSGB International GmbH\nGesellschaft mit beschränkter Haftung\nSiegen\n\nDen Gläubigern der an der Verschmelzung beteiligten Rechtsträger ist, wenn sie binnen sechs Monaten nach dem Tag, an dem die Eintragung der Verschmelzung in das Register des Sitzes derjenigen Rechtsträger deren Gläubiger sie sind, nach § 19 Absatz 3 UmwG als bekanntgemacht gilt, ihren Anspruch nach Grund und Höhe schriftlich anmelden, Sicherheit zu leisten, soweit sie nicht Befriedigung verlangen können. Dieses Recht steht den Gläubigern jedoch nur zu, wenn sie glaubhaft machen, dass durch die Verschmelzung die Erfüllung ihrer Forderung gefährdet wird."
    },
    {
      "date": "2025-07-22",
      "id": "117032",
      "original_text": "Registerbekanntmachung nach dem Umwandlungsgesetz\nNordrhein-Westfalen Amtsgericht Münster HRB 20858\nAlliance Automotive Germany GmbH – Münster",
      "type": "Registerbekanntmachung nach dem Umwandlungsgesetz",
      "state": "Nordrhein-Westfalen",
      "amtsgericht": "Amtsgericht Münster",
      "registernummer": "HRB 20858",
      "registerart": "HRB",
      "company_name": "Alliance Automotive Germany GmbH",
      "company_seat": "Münster",
      "details": "22.07.2025 (Bekanntmachungsdatum)\n\nNordrhein-Westfalen Amtsgericht Münster HRB 20858\nRegisterbekanntmachung nach dem Umwandlungsgesetz 22.07.2025 (Eintragungsdatum)\n\nAlliance Automotive Germany GmbH\nGesellschaft mit beschränkter Haftung\nMünster\n\nDen Gläubigern der an der Verschmelzung beteiligten Rechtsträger ist, wenn sie binnen sechs Monaten nach dem Tag, an dem die Eintragung der Verschmelzung in das Register des Sitzes desjenigen Rechtsträgers, dessen Gläubiger sie sind, nach § 19 Absatz 3 UmwG als bekanntgemacht gilt, ihren Anspruch nach Grund und Höhe schriftlich anmelden, Sicherheit zu leisten, soweit sie nicht Befriedigung verlangen können. Dieses Recht steht den Gläubigern jedoch nur zu, wenn sie glaubhaft machen, dass durch die Verschmelzung die Erfüllung ihrer Forderung gefährdet wird."
    },
    {
      "date": "2025-07-22",
      "id": "117033",
      "original_text": "Löschungsankündigung\nNordrhein-Westfalen Amtsgericht Köln HRB 83552\nIMMAGINE E PAROLA - Kommunikation und Imagebildung UG (haftungsbeschränkt) Agentur für PR und Public Affairs – Overath",
      "type": "Löschungsankündigung",
      "state": "Nordrhein-Westfalen",
      "amtsgericht": "Amtsgericht Köln",
      "registernummer": "HRB 83552",
      "registerart": "HRB",
      "company_name": "IMMAGINE E PAROLA - Kommunikation und Imagebildung UG (haftungsbeschränkt) Agentur für PR und Public Affairs",
      "company_seat": "Overath",
      "details": "22.07.2025 (Bekanntmachungsdatum)\n\nNordrhein-Westfalen Amtsgericht Köln HRB 83552\nLöschungsankündigung\n\nIMMAGINE E PAROLA - Kommunikation und Imagebildung UG (haftungsbeschränkt) Agentur für PR und Public Affairs\nGesellschaft mit beschränkter Haftung\nOverath\n\nDas Registergericht beabsichtigt die Gesellschaft von Amts wegen nach § 394 FamFG zu löschen. Die Frist zur Erhebung eines Widerspruchs ist auf einen Monat festgesetzt."
    },
    {
      "date": "2025-07-22",
      "id": "117034",
      "original_text": "Löschungsankündigung\nNordrhein-Westfalen Amtsgericht Dortmund HRB 36300\nNurhak GmbH – Castrop-Rauxel",
      "type": "Löschungsankündigung",
      "state": "Nordrhein-Westfalen",
      "amtsgericht": "Amtsgericht Dortmund",
      "registernummer": "HRB 36300",
      "registerart": "HRB",
      "company_name": "Nurhak GmbH",
      "company_seat": "Castrop-Rauxel",
      "details": "22.07.2025 (Bekanntmachungsdatum)\n\nNordrhein-Westfalen Amtsgericht Dortmund HRB 36300\nLöschungsankündigung\n\nNurhak GmbH\nGesellschaft mit beschränkter Haftung\nCastrop-Rauxel\n\nDas Registergericht beabsichtigt die Gesellschaft von Amts wegen nach § 394 FamFG zu löschen. Die Frist zur Erhebung eines Widerspruchs ist auf zwei Monate festgesetzt."
    },
    {
      "date": "2025-07-22",
      "id": "117035",
      "original_text": "Löschungsankündigung\nNordrhein-Westfalen Amtsgericht Aachen HRB 28339\nTrio Baustoffhandel GmbH – Aachen",
      "type": "Löschungsankündigung",
      "state": "Nordrhein-Westfalen",
      "amtsgericht": "Amtsgericht Aachen",
      "registernummer": "HRB 28339",
      "registerart": "HRB",
      "company_name": "Trio Baustoffhandel GmbH",
      "company_seat": "Aachen",
      "details": "22.07.2025 (Bekanntmachungsdatum)\n\nNordrhein-Westfalen Amtsgericht Aachen HRB 28339\nLöschungsankündigung\n\nTrio Baustoffhandel GmbH\nGesellschaft mit beschränkter Haftung\nAachen\n\nDas Registergericht beabsichtigt, von Amts wegen die Gesellschaft wegen Vermögenslosigkeit nach § 394 FamFG zu löschen, weil das Finanzamt Frankfurt am Main mit Schreiben vom 02.07.2025 Umstände mitgeteilt hat, aufgrund derer das Gericht davon überzeugt ist, dass die Gesellschaft vollständig vermögenslos ist.\n\nZur Geltendmachung des Widerspruchs gegen die beabsichtigte Löschung wird hiermit eine Frist von einem Monat ab Veröffentlichung dieser Ankündigung bestimmt.\n\nRechtsbehelfsbelehrung:\n\nGegen diese Verfügung kann Widerspruch eingelegt werden. Zum Widerspruch ist jeder berechtigt, der an der Unterlassung der Löschung ein berechtigtes Interesse hat.\n\nDer Widerspruch ist bei dem Amtsgericht Aachen, Adalbertsteinweg 92, 52070 Aachen schriftlich in deutscher Sprache oder zur Niederschrift der Geschäftsstelle einzulegen. Der Widerspruch kann auch zur Niederschrift der Geschäftsstelle eines jeden Amtsgerichtes abgegeben werden.\n\nDer Widerspruch muss spätestens innerhalb der gesetzten Frist nach der Bekanntgabe der Verfügung bei dem Amtsgericht Aachen eingegangen sein. Dies gilt auch dann, wenn der Widerspruch zur Niederschrift der Geschäftsstelle eines anderen Amtsgerichtes abgegeben wurde. Die Frist beginnt mit der Bekanntgabe der Verfügung durch Veröffentlichung. Fällt das Ende der Frist auf einen Sonntag, einen allgemeinen Feiertag oder Sonnabend, so endet die Frist mit Ablauf des nächsten Werktages.\n\nDer Widerspruch muss die Bezeichnung der angefochtenen Verfügung sowie die Erklärung enthalten, dass Widerspruch gegen diese Verfügung eingelegt wird. Er ist zu unterzeichnen und soll begründet werden.\n\nDie Einlegung ist auch durch Übertragung eines elektronischen Dokuments an die elektronische Poststelle des Gerichts möglich. Das elektronische Dokument muss für die Bearbeitung durch das Gericht geeignet und mit einer qualifizierten elektronischen Signatur der verantwortenden Person versehen sein oder von der verantwortenden Person signiert und auf einem sicheren Übermittlungsweg gemäß § 130 a ZPO nach näherer Maßgabe der Verordnung über die technischen Rahmenbedingungen des elektronischen Rechtsverkehrs und über das besondere elektronische Behördenpostfach (BGBl. I, S. 3803) eingereicht werden. Weitere Informationen erhalten Sie auf der Internetseite www.justiz.de."
    },
    {
      "date": "2025-07-22",
      "id": "117036",
      "original_text": "Löschungsankündigung\nNordrhein-Westfalen Amtsgericht Köln HRB 104687\nBO Berlin Beauty GmbH – Köln",
      "type": "Löschungsankündigung",
      "state": "Nordrhein-Westfalen",
      "amtsgericht": "Amtsgericht Köln",
      "registernummer": "HRB 104687",
      "registerart": "HRB",
      "company_name": "BO Berlin Beauty GmbH",
      "company_seat": "Köln",
      "details": "22.07.2025 (Bekanntmachungsdatum)\n\nNordrhein-Westfalen Amtsgericht Köln HRB 104687\nLöschungsankündigung\n\nBO Berlin Beauty GmbH\nGesellschaft mit beschränkter Haftung\nKöln\n\nDas Registergericht beabsichtigt, die im Handelsregister eingetragene Gesellschaft gemäß § 394 Absatz 1 FamFG wegen Vermögenslosigkeit von Amts wegen zu löschen. Gegen diese Verfügung kann Widerspruch eingelegt werden. Die Frist zur Erhebung eines Widerspruchs gegen die beabsichtigte Löschung von Amts wegen ist auf einen Monat festgesetzt. Rechtsbehelfsbelehrung: Gegen diese Verfügung können Sie Widerspruch einlegen. Der Widerspruch ist bei dem Amtsgericht Köln, Reichenspergerplatz 1, 50670 Köln schriftlich in deutscher Sprache oder zur Niederschrift der Geschäftsstelle einzulegen. Der Widerspruch kann auch zur Niederschrift der Geschäftsstelle eines jeden Amtsgerichtes abgegeben werden. Die Einlegung ist auch durch Übertragung eines elektronischen Dokuments an die elektronische Poststelle des Gerichts möglich. Das elektronische Dokument muss für die Bearbeitung durch das Gericht geeignet und mit einer qualifizierten elektronischen Signatur der verantwortenden Person versehen sein oder von der verantwortenden Person signiert und auf einem sicheren Übermittlungsweg gemäß § 130a ZPO nach näherer Maßgabe der Verordnung über die technischen Rahmenbedingungen des elektronischen Rechtsverkehrs und über das besondere elektronische Behördenpostfach (BGBl. I, S.3803) eingereicht werden. Weitere Informationen erhalten Sie auf der Internetseite www.justiz.de.Der Widerspruch muss spätestens innerhalb der gesetzten Frist bei dem Amtsgericht Köln eingegangen sein. Dies gilt auch dann, wenn der Widerspruch zur Niederschrift der Geschäftsstelle eines anderen Amtsgerichtes abgegeben wurde. Die Frist beginnt mit der Veröffentlichung. Fällt das Ende der Frist auf einen Sonntag, einen allgemeinen Feiertag oder Sonnabend, so endet die Frist mit Ablauf des nächsten Werktages.\n\nDer Widerspruch muss die Bezeichnung der angefochtenen Verfügung sowie die Erklärung enthalten, dass Widerspruch gegen diese Verfügung eingelegt wird. Er ist zu unterzeichnen und soll begründet werden."
    },
    {
      "date": "2025-07-22",
      "id": "117037",
      "original_text": "Löschungsankündigung\nNordrhein-Westfalen Amtsgericht Dortmund HRB 35182\nToolParty.de UG (haftungsbeschränkt) – Dortmund",
      "type": "Löschungsankündigung",
      "state": "Nordrhein-Westfalen",
      "amtsgericht": "Amtsgericht Dortmund",
      "registernummer": "HRB 35182",
      "registerart": "HRB",
      "company_name": "ToolParty.de UG (haftungsbeschränkt)",
      "company_seat": "Dortmund",
      "details": "22.07.2025 (Bekanntmachungsdatum)\n\nNordrhein-Westfalen Amtsgericht Dortmund HRB 35182\nLöschungsankündigung 18.07.2025 (Eintragungsdatum)\n\nToolParty.de UG (haftungsbeschränkt)\nGesellschaft mit beschränkter Haftung\nDortmund\n\nDas Registergericht beabsichtigt die Gesellschaft von Amts wegen nach § 394 FamFG zu löschen. Die Frist zur Erhebung eines Widerspruchs ist auf zwei Monate festgesetzt."
    },
    {
      "date": "2025-07-22",
      "id": "117038",
      "original_text": "Einreichung neuer Dokumente\nNordrhein-Westfalen Amtsgericht Steinfurt HRB 7831\nDEOS AG – Rheine",
      "type": "Einreichung neuer Dokumente",
      "state": "Nordrhein-Westfalen",
      "amtsgericht": "Amtsgericht Steinfurt",
      "registernummer": "HRB 7831",
      "registerart": "HRB",
      "company_name": "DEOS AG",
      "company_seat": "Rheine",
      "details": "22.07.2025 (Bekanntmachungsdatum)\n\nNordrhein-Westfalen Amtsgericht Steinfurt HRB 7831\nEinreichung neuer Dokumente 22.07.2025 (Eintragungsdatum)\n\nDEOS AG\nAktiengesellschaft\nRheine\n\nDem Registergericht ist eine Liste der Mitglieder des Aufsichtsrates eingereicht worden."
    },
    {
      "date": "2025-07-22",
      "id": "117039",
      "original_text": "Registerbekanntmachung nach dem Umwandlungsgesetz\nNordrhein-Westfalen Amtsgericht Hamm HRB 8357\nDatenmühle GmbH – Holzwickede",
      "type": "Registerbekanntmachung nach dem Umwandlungsgesetz",
      "state": "Nordrhein-Westfalen",
      "amtsgericht": "Amtsgericht Hamm",
      "registernummer": "HRB 8357",
      "registerart": "HRB",
      "company_name": "Datenmühle GmbH",
      "company_seat": "Holzwickede",
      "details": "22.07.2025 (Bekanntmachungsdatum)\n\nNordrhein-Westfalen Amtsgericht Hamm HRB 8357\nRegisterbekanntmachung nach dem Umwandlungsgesetz 12.06.2025 (Eintragungsdatum)\n\nDatenmühle GmbH\nGesellschaft mit beschränkter Haftung\nHolzwickede\n\nDen Gläubigern der an der Verschmelzung beteiligten Rechtsträger ist, wenn sie binnen sechs Monaten nach dem Tag, an dem die Eintragung der Verschmelzung in das Register des Sitzes derjenigen Rechtsträger deren Gläubiger sie sind, nach § 19 Absatz 3 UmwG als bekanntgemacht gilt, ihren Anspruch nach Grund und Höhe schriftlich anmelden, Sicherheit zu leisten, soweit sie nicht Befriedigung verlangen können. Dieses Recht steht den Gläubigern jedoch nur zu, wenn sie glaubhaft machen, dass durch die Verschmelzung die Erfüllung ihrer Forderung gefährdet wird."
    },
    {
      "date": "2025-07-22",
      "id": "117040",
      "original_text": "Registerbekanntmachung nach dem Umwandlungsgesetz\nNordrhein-Westfalen Amtsgericht Düsseldorf HRB 102266\nScannell Deutschland No. 012 GmbH – Düsseldorf",
      "type": "Registerbekanntmachung nach dem Umwandlungsgesetz",
      "state": "Nordrhein-Westfalen",
      "amtsgericht": "Amtsgericht Düsseldorf",
      "registernummer": "HRB 102266",
      "registerart": "HRB",
      "company_name": "Scannell Deutschland No. 012 GmbH",
      "company_seat": "Düsseldorf",
      "details": "22.07.2025 (Bekanntmachungsdatum)\n\nNordrhein-Westfalen Amtsgericht Düsseldorf HRB 102266\nRegisterbekanntmachung nach dem Umwandlungsgesetz\n\nScannell Deutschland No. 012 GmbH\nGesellschaft mit beschränkter Haftung\nDüsseldorf\n\nDem Registergericht ist der Entwurf eines Formwechselplanes über den geplanten Formwechsel der Gesellschaft mit beschränkter Haftung nach deutschem Recht unter der Firma Scannell Deutschland No. 012 GmbH mit Sitz in Düsseldorf (Amtsgericht Düsseldorf, HRB 102266) in eine limited liability company nach luxemburgischem Recht (Societe a responsabilite limitee) unter der Firma SCANNELL PROPERTIES HOLLFELD S.A.R.L. mit Sitz in Luxemburg / Luxemburg (luxemburgisches Register (Registre de Commerce et des Societes, Luxembourg)) eingereicht worden.\nEin Hinweis an folgende Personen, dass sie der Gesellschaft spätestens fünf Arbeitstage vor dem 21. August 2025 Bemerkungen zum Formwechselplan übermitteln können: an die Gläubiger der Scannell Deutschland No. 012 GmbH."
    },
    {
      "date": "2025-07-22",
      "id": "117041",
      "original_text": "Registerbekanntmachung nach dem Umwandlungsgesetz\nNordrhein-Westfalen Amtsgericht Siegen HRB 1199\nSGB GmbH – Hüttental-Weidenau",
      "type": "Registerbekanntmachung nach dem Umwandlungsgesetz",
      "state": "Nordrhein-Westfalen",
      "amtsgericht": "Amtsgericht Siegen",
      "registernummer": "HRB 1199",
      "registerart": "HRB",
      "company_name": "SGB GmbH",
      "company_seat": "Hüttental-Weidenau",
      "details": "22.07.2025 (Bekanntmachungsdatum)\n\nNordrhein-Westfalen Amtsgericht Siegen HRB 1199\nRegisterbekanntmachung nach dem Umwandlungsgesetz 22.07.2025 (Eintragungsdatum)\n\nSGB GmbH\nGesellschaft mit beschränkter Haftung\nHüttental-Weidenau\n\nDen Gläubigern der an der Verschmelzung beteiligten Rechtsträger ist, wenn sie binnen sechs Monaten nach dem Tag, an dem die Eintragung der Verschmelzung in das Register des Sitzes derjenigen Rechtsträger deren Gläubiger sie sind, nach § 19 Absatz 3 UmwG als bekanntgemacht gilt, ihren Anspruch nach Grund und Höhe schriftlich anmelden, Sicherheit zu leisten, soweit sie nicht Befriedigung verlangen können. Dieses Recht steht den Gläubigern jedoch nur zu, wenn sie glaubhaft machen, dass durch die Verschmelzung die Erfüllung ihrer Forderung gefährdet wird."
    },
    {
      "date": "2025-07-22",
      "id": "117042",
      "original_text": "Löschungsankündigung\nNordrhein-Westfalen Amtsgericht Wuppertal HRB 32896\nSTAR Freizeit- und Unterhaltung-Spielautomaten GmbH – Remscheid",
      "type": "Löschungsankündigung",
      "state": "Nordrhein-Westfalen",
      "amtsgericht": "Amtsgericht Wuppertal",
      "registernummer": "HRB 32896",
      "registerart": "HRB",
      "company_name": "STAR Freizeit- und Unterhaltung-Spielautomaten GmbH",
      "company_seat": "Remscheid",
      "details": "22.07.2025 (Bekanntmachungsdatum)\n\nNordrhein-Westfalen Amtsgericht Wuppertal HRB 32896\nLöschungsankündigung\n\nSTAR Freizeit- und Unterhaltung-Spielautomaten GmbH\nGesellschaft mit beschränkter Haftung\nRemscheid\n\nDas Registergericht beabsichtigt die Gesellschaft von Amts wegen nach § 394 FamFG zu löschen. Die Frist zur Erhebung eines Widerspruchs ist auf einen Monat festgesetzt."
    },
    {
      "date": "2025-07-22",
      "id": "117043",
      "original_text": "Löschungsankündigung\nNordrhein-Westfalen Amtsgericht Düsseldorf HRB 74538\nIFC Germany Holding GmbH – Düsseldorf",
      "type": "Löschungsankündigung",
      "state": "Nordrhein-Westfalen",
      "amtsgericht": "Amtsgericht Düsseldorf",
      "registernummer": "HRB 74538",
      "registerart": "HRB",
      "company_name": "IFC Germany Holding GmbH",
      "company_seat": "Düsseldorf",
      "details": "22.07.2025 (Bekanntmachungsdatum)\n\nNordrhein-Westfalen Amtsgericht Düsseldorf HRB 74538\nLöschungsankündigung\n\nIFC Germany Holding GmbH\nGesellschaft mit beschränkter Haftung\nDüsseldorf\n\nDas Registergericht beabsichtigt die Gesellschaft von Amts wegen nach § 394 FamFG zu löschen. Die Frist zur Erhebung eines Widerspruchs ist auf 3 Wochen festgesetzt.\n\nRechtsbehelfsbelehrung:\nDas Widerspruchsrecht steht jedem zu, der an der Unterlassung der Löschung ein berechtigtes Interesse hat. Der Widerspruch ist bei dem Amtsgericht Düsseldorf -Registergericht-, Werdener Straße 1, 40227 Düsseldorf schriftlich in deutscher Sprache oder zur Niederschrift der Geschäftsstelle einzulegen. Der Widerspruch kann auch zur Niederschrift der Geschäftsstelle eines jeden Amtsgerichtes abgegeben werden. Die Einlegung ist auch durch Übertragung eines elektronischen Dokuments an die elektronische Poststelle des Gerichts möglich. Das elektronische Dokument muss für die Bearbeitung durch das Gericht geeignet und mit einer qualifizierten elektronischen Signatur der verantwortenden Person versehen sein oder von der verantwortenden Person signiert und auf einem sicheren Übermittlungsweg gemäß § 130a ZPO nach näherer Maßgabe der Verordnung über die technischen Rahmenbedingungen des elektronischen Rechtsverkehrs und über das besondere elektronische Behördenpostfach (BGBl. I, S.3803) eingereicht werden. Weitere Informationen erhalten Sie auf der Internetseite www.justiz.de.\nDer Widerspruch muss spätestens innerhalb der gesetzten Frist nach dem Datum der Bekanntmachung der Löschungsankündigung bei dem Amtsgericht - Registergericht - Düsseldorf eingegangen sein.  Dies gilt auch dann, wenn der Widerspruch zur Niederschrift der Geschäftsstelle eines anderen Amtsgerichtes abgegeben wurde. Die Frist beginnt mit dem Tage der Bekanntmachung der Löschungsankündigung in dem für die Bekanntmachung der Eintragungen in das Handelsregister bestimmten elektronischen Informations- und Kommunikationssystem nach § 10 des Handelsgesetzbuches. Fällt das Ende der Frist auf einen Sonntag, einen allgemeinen Feiertag oder Sonnabend, so endet die Frist mit Ablauf des nächsten Werktages.\nDer Widerspruch muss die Bezeichnung der angefochtenen Löschungsankündigung sowie die Erklärung enthalten, dass Widerspruch gegen diese Löschungsankündigung eingelegt wird. Er ist zu unterzeichnen und soll begründet werden."
    },
    {
      "date": "2025-07-22",
      "id": "117044",
      "original_text": "Löschungsankündigung\nNordrhein-Westfalen Amtsgericht Köln HRB 120048\nMelius Hansa GmbH – Köln",
      "type": "Löschungsankündigung",
      "state": "Nordrhein-Westfalen",
      "amtsgericht": "Amtsgericht Köln",
      "registernummer": "HRB 120048",
      "registerart": "HRB",
      "company_name": "Melius Hansa GmbH",
      "company_seat": "Köln",
      "details": "22.07.2025 (Bekanntmachungsdatum)\n\nNordrhein-Westfalen Amtsgericht Köln HRB 120048\nLöschungsankündigung\n\nMelius Hansa GmbH\nGesellschaft mit beschränkter Haftung\nKöln\n\nDas Registergericht beabsichtigt, die im Handelsregister eingetragene Gesellschaft gemäß § 394 Absatz 1 FamFG wegen Vermögenslosigkeit von Amts wegen zu löschen. Gegen diese Verfügung kann Widerspruch eingelegt werden. Die Frist zur Erhebung eines Widerspruchs gegen die beabsichtigte Löschung von Amts wegen ist auf einen Monat festgesetzt. Rechtsbehelfsbelehrung: Gegen diese Verfügung können Sie Widerspruch einlegen. Der Widerspruch ist bei dem Amtsgericht Köln, Reichenspergerplatz 1, 50670 Köln schriftlich in deutscher Sprache oder zur Niederschrift der Geschäftsstelle einzulegen. Der Widerspruch kann auch zur Niederschrift der Geschäftsstelle eines jeden Amtsgerichtes abgegeben werden. Die Einlegung ist auch durch Übertragung eines elektronischen Dokuments an die elektronische Poststelle des Gerichts möglich. Das elektronische Dokument muss für die Bearbeitung durch das Gericht geeignet und mit einer qualifizierten elektronischen Signatur der verantwortenden Person versehen sein oder von der verantwortenden Person signiert und auf einem sicheren Übermittlungsweg gemäß § 130a ZPO nach näherer Maßgabe der Verordnung über die technischen Rahmenbedingungen des elektronischen Rechtsverkehrs und über das besondere elektronische Behördenpostfach (BGBl. I, S.3803) eingereicht werden. Weitere Informationen erhalten Sie auf der Internetseite www.justiz.de.Der Widerspruch muss spätestens innerhalb der gesetzten Frist bei dem Amtsgericht Köln eingegangen sein. Dies gilt auch dann, wenn der Widerspruch zur Niederschrift der Geschäftsstelle eines anderen Amtsgerichtes abgegeben wurde. Die Frist beginnt mit der Veröffentlichung. Fällt das Ende der Frist auf einen Sonntag, einen allgemeinen Feiertag oder Sonnabend, so endet die Frist mit Ablauf des nächsten Werktages.\n\nDer Widerspruch muss die Bezeichnung der angefochtenen Verfügung sowie die Erklärung enthalten, dass Widerspruch gegen diese Verfügung eingelegt wird. Er ist zu unterzeichnen und soll begründet werden."
    },
    {
      "date": "2025-07-22",
      "id": "117045",
      "original_text": "Registerbekanntmachung nach dem Umwandlungsgesetz\nNordrhein-Westfalen Amtsgericht Bonn HRB 6955\nHelmuth Vianden GmbH – Bonn",
      "type": "Registerbekanntmachung nach dem Umwandlungsgesetz",
      "state": "Nordrhein-Westfalen",
      "amtsgericht": "Amtsgericht Bonn",
      "registernummer": "HRB 6955",
      "registerart": "HRB",
      "company_name": "Helmuth Vianden GmbH",
      "company_seat": "Bonn",
      "details": "22.07.2025 (Bekanntmachungsdatum)\n\nNordrhein-Westfalen Amtsgericht Bonn HRB 6955\nRegisterbekanntmachung nach dem Umwandlungsgesetz 22.07.2025 (Eintragungsdatum)\n\nHelmuth Vianden GmbH\nGesellschaft mit beschränkter Haftung\nBonn\n\nDen Gläubigern der an der Verschmelzung beteiligten Rechtsträger ist, wenn sie binnen sechs Monaten nach dem Tag, an dem die Eintragung der Verschmelzung in das Register des Sitzes desjenigen Rechtsträgers, dessen Gläubiger sie sind, nach § 19 Absatz 3 UmwG als bekanntgemacht gilt, ihren Anspruch nach Grund und Höhe schriftlich anmelden, Sicherheit zu leisten, soweit sie nicht Befriedigung verlangen können. Dieses Recht steht den Gläubigern jedoch nur zu, wenn sie glaubhaft machen, dass durch die Verschmelzung die Erfüllung ihrer Forderung gefährdet wird."
    },
    {
      "date": "2025-07-22",
      "id": "117046",
      "original_text": "Registerbekanntmachung nach dem Umwandlungsgesetz\nNordrhein-Westfalen Amtsgericht Siegburg HRA 7229\nBraschoss Feuerschutz e.K. – Niederkassel",
      "type": "Registerbekanntmachung nach dem Umwandlungsgesetz",
      "state": "Nordrhein-Westfalen",
      "amtsgericht": "Amtsgericht Siegburg",
      "registernummer": "HRA 7229",
      "registerart": "HRA",
      "company_name": "Braschoss Feuerschutz e.K.",
      "company_seat": "Niederkassel",
      "details": "22.07.2025 (Bekanntmachungsdatum)\n\nNordrhein-Westfalen Amtsgericht Siegburg HRA 7229\nRegisterbekanntmachung nach dem Umwandlungsgesetz 17.07.2025 (Eintragungsdatum)\n\nBraschoss Feuerschutz e.K.\nEinzelkaufmann / Einzelkauffrau\nNiederkassel\n\nDie Gesellschaft hat Gläubigern, deren Forderungen vor dieser Bekanntmachung begründet worden sind, Sicherheit zu leisten, soweit sie nicht Befriedigung verlangen können, wenn sie sich binnen sechs Monaten zu diesem Zweck melden."
    },
    {
      "date": "2025-07-22",
      "id": "117047",
      "original_text": "Registerbekanntmachung nach dem Umwandlungsgesetz\nNordrhein-Westfalen Amtsgericht Steinfurt HRB 6978\nSANIMED GmbH – Ibbenbüren",
      "type": "Registerbekanntmachung nach dem Umwandlungsgesetz",
      "state": "Nordrhein-Westfalen",
      "amtsgericht": "Amtsgericht Steinfurt",
      "registernummer": "HRB 6978",
      "registerart": "HRB",
      "company_name": "SANIMED GmbH",
      "company_seat": "Ibbenbüren",
      "details": "22.07.2025 (Bekanntmachungsdatum)\n\nNordrhein-Westfalen Amtsgericht Steinfurt HRB 6978\nRegisterbekanntmachung nach dem Umwandlungsgesetz 22.07.2025 (Eintragungsdatum)\n\nSANIMED GmbH\nGesellschaft mit beschränkter Haftung\nIbbenbüren\n\nDen Gläubigern der an der Verschmelzung beteiligten Rechtsträger ist, wenn sie binnen sechs Monaten nach dem Tag, an dem die Eintragung der Verschmelzung in das Register des Sitzes derjenigen Rechtsträger deren Gläubiger sie sind, nach § 19 Absatz 3 UmwG als bekanntgemacht gilt, ihren Anspruch nach Grund und Höhe schriftlich anmelden, Sicherheit zu leisten, soweit sie nicht Befriedigung verlangen können. Dieses Recht steht den Gläubigern jedoch nur zu, wenn sie glaubhaft machen, dass durch die Verschmelzung die Erfüllung ihrer Forderung gefährdet wird."
    },
    {
      "date": "2025-07-22",
      "id": "117048",
      "original_text": "Einreichung neuer Dokumente\nNordrhein-Westfalen Amtsgericht Mönchengladbach HRB 14011\nSpeira GmbH – Grevenbroich",
      "type": "Einreichung neuer Dokumente",
      "state": "Nordrhein-Westfalen",
      "amtsgericht": "Amtsgericht Mönchengladbach",
      "registernummer": "HRB 14011",
      "registerart": "HRB",
      "company_name": "Speira GmbH",
      "company_seat": "Grevenbroich",
      "details": "22.07.2025 (Bekanntmachungsdatum)\n\nNordrhein-Westfalen Amtsgericht Mönchengladbach HRB 14011\nEinreichung neuer Dokumente\n\nSpeira GmbH\nGesellschaft mit beschränkter Haftung\nGrevenbroich\n\nDem Registergericht ist eine neue Liste der Mitglieder des Aufsichtsrates eingereicht worden."
    },
    {
      "date": "2025-07-22",
      "id": "117049",
      "original_text": "Sonstige Registerbekanntmachung\nNordrhein-Westfalen Amtsgericht Köln HRB 75951\nOBI Group Holding Management SE – Wermelskirchen",
      "type": "Sonstige Registerbekanntmachung",
      "state": "Nordrhein-Westfalen",
      "amtsgericht": "Amtsgericht Köln",
      "registernummer": "HRB 75951",
      "registerart": "HRB",
      "company_name": "OBI Group Holding Management SE",
      "company_seat": "Wermelskirchen",
      "details": "22.07.2025 (Bekanntmachungsdatum)\n\nNordrhein-Westfalen Amtsgericht Köln HRB 75951\nSonstige Registerbekanntmachung\n\nOBI Group Holding Management SE\nEuropäische Aktiengesellschaft (SE)\nWermelskirchen\n\nDem Registergericht ist eine Liste der Mitglieder des Aufsichtsrates eingereicht worden."
    },
    {
      "date": "2025-07-22",
      "id": "117050",
      "original_text": "Registerbekanntmachung nach dem Umwandlungsgesetz\nNordrhein-Westfalen Amtsgericht Aachen HRB 6480\nDeutz Heizung-Sanitär GmbH – Aachen",
      "type": "Registerbekanntmachung nach dem Umwandlungsgesetz",
      "state": "Nordrhein-Westfalen",
      "amtsgericht": "Amtsgericht Aachen",
      "registernummer": "HRB 6480",
      "registerart": "HRB",
      "company_name": "Deutz Heizung-Sanitär GmbH",
      "company_seat": "Aachen",
      "details": "22.07.2025 (Bekanntmachungsdatum)\n\nNordrhein-Westfalen Amtsgericht Aachen HRB 6480\nRegisterbekanntmachung nach dem Umwandlungsgesetz 22.07.2025 (Eintragungsdatum)\n\nDeutz Heizung-Sanitär GmbH\nGesellschaft mit beschränkter Haftung\nAachen\n\nDen Gläubigern der an der Verschmelzung beteiligten Rechtsträger ist, wenn sie binnen sechs Monaten nach dem Tag, an dem die Eintragung der Verschmelzung in das Register des Sitzes derjenigen Rechtsträger deren Gläubiger sie sind, nach § 19 Absatz 3 UmwG als bekanntgemacht gilt, ihren Anspruch nach Grund und Höhe schriftlich anmelden, Sicherheit zu leisten, soweit sie nicht Befriedigung verlangen können. Dieses Recht steht den Gläubigern jedoch nur zu, wenn sie glaubhaft machen, dass durch die Verschmelzung die Erfüllung ihrer Forderung gefährdet wird."
    },
    {
      "date": "2025-07-22",
      "id": "117051",
      "original_text": "Löschungsankündigung\nNordrhein-Westfalen Amtsgericht Dortmund HRB 32197\nCAY GmbH – Dortmund",
      "type": "Löschungsankündigung",
      "state": "Nordrhein-Westfalen",
      "amtsgericht": "Amtsgericht Dortmund",
      "registernummer": "HRB 32197",
      "registerart": "HRB",
      "company_name": "CAY GmbH",
      "company_seat": "Dortmund",
      "details": "22.07.2025 (Bekanntmachungsdatum)\n\nNordrhein-Westfalen Amtsgericht Dortmund HRB 32197\nLöschungsankündigung 22.07.2025 (Eintragungsdatum)\n\nCAY GmbH\nGesellschaft mit beschränkter Haftung\nDortmund\n\nDas Registergericht beabsichtigt die Gesellschaft von Amts wegen nach § 394 FamFG zu löschen. Die Frist zur Erhebung eines Widerspruchs ist auf zwei Monate festgesetzt."
    },
    {
      "date": "2025-07-22",
      "id": "117052",
      "original_text": "Löschungsankündigung\nNordrhein-Westfalen Amtsgericht Gütersloh HRA 6426\nSN Solartechnics International AG & Co. Solarpark III OHG – Versmold",
      "type": "Löschungsankündigung",
      "state": "Nordrhein-Westfalen",
      "amtsgericht": "Amtsgericht Gütersloh",
      "registernummer": "HRA 6426",
      "registerart": "HRA",
      "company_name": "SN Solartechnics International AG & Co. Solarpark III OHG",
      "company_seat": "Versmold",
      "details": "22.07.2025 (Bekanntmachungsdatum)\n\nNordrhein-Westfalen Amtsgericht Gütersloh HRA 6426\nLöschungsankündigung\n\nSN Solartechnics International AG & Co. Solarpark III OHG\nOffene Handelsgesellschaft\nVersmold\n\nDas Registergericht beabsichtigt die Firma von Amts wegen nach §§ 6, 31 Abs. 2 HGB, § 393 FamFG zu löschen. Die Frist zur Erhebung eines Widerspruchs ist auf einen Monat festgesetzt."
    },
    {
      "date": "2025-07-22",
      "id": "117053",
      "original_text": "Löschungsankündigung\nNordrhein-Westfalen Amtsgericht Düsseldorf HRB 86515\nHörwelt24 AG – Düsseldorf",
      "type": "Löschungsankündigung",
      "state": "Nordrhein-Westfalen",
      "amtsgericht": "Amtsgericht Düsseldorf",
      "registernummer": "HRB 86515",
      "registerart": "HRB",
      "company_name": "Hörwelt24 AG",
      "company_seat": "Düsseldorf",
      "details": "22.07.2025 (Bekanntmachungsdatum)\n\nNordrhein-Westfalen Amtsgericht Düsseldorf HRB 86515\nLöschungsankündigung\n\nHörwelt24 AG\nAktiengesellschaft\nDüsseldorf\n\nBetr.: Hörwelt AG, Achenbachstr. 20, 40237 Düsseldorf\n\nDas Registergericht beabsichtigt die Gesellschaft von Amts wegen nach § 394 FamFG zu löschen. Die Frist zur Erhebung eines Widerspruchs ist auf 3 Wochen festgesetzt.\n\nRechtsbehelfsbelehrung:\nDas Widerspruchsrecht steht jedem zu, der an der Unterlassung der Löschung ein berechtigtes Interesse hat. Der Widerspruch ist bei dem Amtsgericht Düsseldorf -Registergericht-, Werdener Straße 1, 40227 Düsseldorf schriftlich in deutscher Sprache oder zur Niederschrift der Geschäftsstelle einzulegen. Der Widerspruch kann auch zur Niederschrift der Geschäftsstelle eines jeden Amtsgerichtes abgegeben werden. Die Einlegung ist auch durch Übertragung eines elektronischen Dokuments an die elektronische Poststelle des Gerichts möglich. Das elektronische Dokument muss für die Bearbeitung durch das Gericht geeignet und mit einer qualifizierten elektronischen Signatur der verantwortenden Person versehen sein oder von der verantwortenden Person signiert und auf einem sicheren Übermittlungsweg gemäß § 130a ZPO nach näherer Maßgabe der Verordnung über die technischen Rahmenbedingungen des elektronischen Rechtsverkehrs und über das besondere elektronische Behördenpostfach (BGBl. I, S.3803) eingereicht werden. Weitere Informationen erhalten Sie auf der Internetseite www.justiz.de.\nDer Widerspruch muss spätestens innerhalb der gesetzten Frist nach dem Datum der Bekanntmachung der Löschungsankündigung bei dem Amtsgericht - Registergericht - Düsseldorf eingegangen sein.  Dies gilt auch dann, wenn der Widerspruch zur Niederschrift der Geschäftsstelle eines anderen Amtsgerichtes abgegeben wurde. Die Frist beginnt mit dem Tage der Bekanntmachung der Löschungsankündigung in dem für die Bekanntmachung der Eintragungen in das Handelsregister bestimmten elektronischen Informations- und Kommunikationssystem nach § 10 des Handelsgesetzbuches. Fällt das Ende der Frist auf einen Sonntag, einen allgemeinen Feiertag oder Sonnabend, so endet die Frist mit Ablauf des nächsten Werktages.\nDer Widerspruch muss die Bezeichnung der angefochtenen Löschungsankündigung sowie die Erklärung enthalten, dass Widerspruch gegen diese Löschungsankündigung eingelegt wird. Er ist zu unterzeichnen und soll begründet werden."
    },
    {
      "date": "2025-07-22",
      "id": "117054",
      "original_text": "Registerbekanntmachung nach dem Umwandlungsgesetz\nNordrhein-Westfalen Amtsgericht Düsseldorf HRB 24304\nWestInvest Gesellschaft für Investmentfonds mbH – Düsseldorf",
      "type": "Registerbekanntmachung nach dem Umwandlungsgesetz",
      "state": "Nordrhein-Westfalen",
      "amtsgericht": "Amtsgericht Düsseldorf",
      "registernummer": "HRB 24304",
      "registerart": "HRB",
      "company_name": "WestInvest Gesellschaft für Investmentfonds mbH",
      "company_seat": "Düsseldorf",
      "details": "22.07.2025 (Bekanntmachungsdatum)\n\nNordrhein-Westfalen Amtsgericht Düsseldorf HRB 24304\nRegisterbekanntmachung nach dem Umwandlungsgesetz 22.07.2025 (Eintragungsdatum)\n\nWestInvest Gesellschaft für Investmentfonds mbH\nGesellschaft mit beschränkter Haftung\nDüsseldorf\n\n1.Der Entwurf des gemeinsamen Verschmelzungsplans mit den Verschmelzungsbedingungen für eine grenzüberschreitende Verschmelzung zwischen der TARGETSELECT LOGISTICS FRANCE (als übertragende Gesellschaft) und der WestInvest Gesellschaft für Investmentfonds mbH (als übernehmende Gesellschaft) ist beim Handelsregister der übernehmenden Gesellschaft eingereicht worden.\n\n2. An der grenzüberschreitenden Verschmelzung sind die folgenden Gesellschaften\nbeteiligt:\na) als übertragende Gesellschaft:\nDie TARGETSELECT LOGISTICS FRANCE mit Sitz (siege social) in Tour Ariane,\n5 place de la Pyramide - 92800 Puteaux, Frankreich, eine vereinfachte Aktiengesellschaft nach französischem Recht (sogenannte societe par actions\nsimplifiee);\n\nb) als übernehmende Gesellschaft:\nDie WestInvest Gesellschaft für Investmentfonds mbH mit Sitz in Düsseldorf,\nDeutschland, eine Kapitalgesellschaft in Rechtsform der Gesellschaft mit beschränkter Haftung nach dem Recht der Bundesrepublik Deutschland.\n\n3. Die an der grenzüberschreitenden Verschmelzung beteiligten Gesellschaften sind in den folgenden Registern eingetragen:\n\na) Die übertragende Gesellschaft TARGETSELECT LOGISTICS FRANCE ist eingetragen im Nanterre Gesellschafts- und Handelsregister (Registre du commerce\net des societes, R.C.S.) unter der Nummer 818 311 359;\n\nb) Die übernehmende Gesellschaft WestInvest Gesellschaft für Investmentfonds\nmbH ist eingetragen im Handelsregister des Amtsgerichts Düsseldorf unter der\nHRB 24304.\n4. Hinweis zur Möglichkeit der Übermittlung von Bemerkungen zum Verschmelzungsplan\n\nGläubiger und Anteilsinhaber sowie Betriebsräte oder - soweit es keine Betriebsräte gibt - Arbeitnehmer der an der grenzüberschreitenden Verschmelzung\nbeteiligten Gesellschaften haben im Rahmen der grenzüberschreitenden Verschmelzung ein Anhörungsrecht.\n\nBei der übertragenden Gesellschaft, der TARGETSELECT LOGISTICS\nFRANCE, sind keine Arbeitnehmer beschäftigt und demzufolge auch kein Betriebsrat\netabliert. Die übernehmende Gesellschaft, die WestInvest Gesellschaft\nfür Investmentfonds mbH, beschäftigt Arbeitnehmer und hat einen Betriebsrat in\nDüsseldorf etabliert. Demzufolge gibt es bei der die WestInvest Gesellschaft für\nInvestmentfonds mbH einen Betriebsrat der im Rahmen der Verschmelzung\nRechte geltend machen kann, insbesondere Bemerkungen zum Verschmelzungsplan oder dessen Entwurf übermitteln kann.\n\nDie Gläubiger und Anteilsinhaber der an der Verschmelzung beteiligten Gesellschaften sowie der vorgenannte Betriebsrat der WestInvest Gesellschaft für Investmentfonds mbH können bis spätestens fünf Arbeitstage vor dem Tag der\nVersammlung der Anteilsinhaber der jeweiligen verschmelzenden Gesellschaft,\ndie über die Zustimmung zu dem Verschmelzungsplan beschließen, Bemerkungen\nzum Verschmelzungsplan bzw. dessen Entwurf übermitteln (vgl. § 308\nAbs. 1 Satz 2 Nr. 4 UmwG).\n\nDie Beurkundung des Zustimmungsbeschlusses der Anteilsinhaber der WestInvest\nGesellschaft für Investmentfonds mbH in Deutschland wird voraussichtlich\nam 22. September 2025, jedoch in keinem Fall vor diesem Tag erfolgen.\n\nDie Beurkundung des Zustimmungsbeschlusses der Anteilsinhaber der\nTARGETSELECT LOGISTICS FRANCE in Frankreich wird voraussichtlich am\n22. September 2025, jedoch in keinem Fall vor diesem Tag erfolgen.\n\nVollständige Auskünfte über die Modalitäten der Ausübung der Rechte der Anteilsinhaber, Gläubiger sowie der Arbeitnehmervertreter und Arbeitnehmer der\nbeteiligten Gesellschaften können unter den folgenden Adressen kostenlos angefordert werden. Dies sind zugleich die Zielanschriften für Bemerkungen zum\nVerschmelzungsplan:\nWestInvest Gesellschaft für Investmentfonds mbH\nKönigshof, Hamborner Straße 55,\n40472 Düsseldorf\nDeutschland\n\nTARGETSELECT LOGISTICS FRANCE\nTour Ariane, 5 place de la Pyramide\n92800 Puteaux\nFrankreich"
    },
    {
      "date": "2025-07-22",
      "id": "117055",
      "original_text": "Registerbekanntmachung nach dem Umwandlungsgesetz\nNordrhein-Westfalen Amtsgericht Köln HRB 70601\nYUZU FOOD GmbH – Köln",
      "type": "Registerbekanntmachung nach dem Umwandlungsgesetz",
      "state": "Nordrhein-Westfalen",
      "amtsgericht": "Amtsgericht Köln",
      "registernummer": "HRB 70601",
      "registerart": "HRB",
      "company_name": "YUZU FOOD GmbH",
      "company_seat": "Köln",
      "details": "22.07.2025 (Bekanntmachungsdatum)\n\nNordrhein-Westfalen Amtsgericht Köln HRB 70601\nRegisterbekanntmachung nach dem Umwandlungsgesetz 22.07.2025 (Eintragungsdatum)\n\nYUZU FOOD GmbH\nGesellschaft mit beschränkter Haftung\nKöln\n\nvDen Gläubigern der an der Verschmelzung beteiligten Rechtsträger ist, wenn sie binnen sechs Monaten nach dem Tag, an dem die Eintragung der Verschmelzung in das Register des Sitzes desjenigen Rechtsträgers, dessen Gläubiger sie sind, nach § 19 Absatz 3 UmwG als bekanntgemacht gilt, ihren Anspruch nach Grund und Höhe schriftlich anmelden, Sicherheit zu leisten, soweit sie nicht Befriedigung verlangen können. Dieses Recht steht den Gläubigern jedoch nur zu, wenn sie glaubhaft machen, dass durch die Verschmelzung die Erfüllung ihrer Forderung gefährdet wird."
    },
    {
      "date": "2025-07-22",
      "id": "117056",
      "original_text": "Löschungsankündigung\nNordrhein-Westfalen Amtsgericht Mönchengladbach HRB 16195\nBadwelt Niederrhein GW GmbH – Mönchengladbach",
      "type": "Löschungsankündigung",
      "state": "Nordrhein-Westfalen",
      "amtsgericht": "Amtsgericht Mönchengladbach",
      "registernummer": "HRB 16195",
      "registerart": "HRB",
      "company_name": "Badwelt Niederrhein GW GmbH",
      "company_seat": "Mönchengladbach",
      "details": "22.07.2025 (Bekanntmachungsdatum)\n\nNordrhein-Westfalen Amtsgericht Mönchengladbach HRB 16195\nLöschungsankündigung\n\nBadwelt Niederrhein GW GmbH\nGesellschaft mit beschränkter Haftung\nMönchengladbach\n\nBadwelt Niederrhein GW GmbH, Mönchengladbach (Amtsgericht Mönchengladbach, HRB 16195).\nDas Registergericht beabsichtigt, die im Handelsregister eingetragene Gesellschaft gemäß § 394 Absatz 1 FamFG wegen Vermögenslosigkeit von Amts wegen zu löschen. Gegen diese Verfügung kann Widerspruch eingelegt werden. Die Frist zur Erhebung eines Widerspruchs gegen die beabsichtigte Löschung von Amts wegen ist auf drei Monate festgesetzt."
    },
    {
      "date": "2025-07-22",
      "id": "117057",
      "original_text": "Registerbekanntmachung nach dem Umwandlungsgesetz\nHessen Amtsgericht Frankfurt am Main HRB 126516\nBlitz F22-13 GmbH – Frankfurt am Main",
      "type": "Registerbekanntmachung nach dem Umwandlungsgesetz",
      "state": "Hessen",
      "amtsgericht": "Amtsgericht Frankfurt am Main",
      "registernummer": "HRB 126516",
      "registerart": "HRB",
      "company_name": "Blitz F22-13 GmbH",
      "company_seat": "Frankfurt am Main",
      "details": "22.07.2025 (Bekanntmachungsdatum)\n\nHessen Amtsgericht Frankfurt am Main HRB 126516\nRegisterbekanntmachung nach dem Umwandlungsgesetz 22.07.2025 (Eintragungsdatum)\n\nBlitz F22-13 GmbH\nGesellschaft mit beschränkter Haftung\nFrankfurt am Main\n\nEs wird darauf hingewiesen, dass der Formwechselplan beim Handelsregister eingereicht worden ist.\nAn dem Formwechsel ist die Blitz F22-13 GmbH, eine Gesellschaft mit beschränkter Haftung nach deutschem Recht mit Sitz in Frankfurt am Main, als formwechselnde Ge-sellschaft beteiligt.\nDer an dem grenzüberschreitenden Formwechsel beteiligte Rechtsträger ist in folgen-dem Register unter der folgenden Nummer eingetragen: Die Blitz F22-13 GmbH ist eingetragen im Handelsregister des Amtsgerichts Frankfurt am Main unter HRB 126516.\nGesellschafter, Gläubiger und die Arbeitnehmer der Gesellschaft - ein Betriebsrat exis-tiert nicht; einziger Arbeitnehmer ist der Geschäftsführer der Gesellschaft - sind auf die Möglichkeit hinzuweisen, der Gesellschaft spätestens fünf Arbeitstage vor dem Tag der Gesellschafterversammlung, die frühestens einen Monat nach der Bekanntmachung stattfinden darf, Bemerkungen zum Formwechselplan zu übermitteln. Die Gesellschaf-terversammlung soll nach derzeitiger Planung am /9:08,1025 stattfinden. Die Bemer-kungen zum Formwechselplan sind an folgende Adresse zu richten:\nBlitz F22-13 GmbH c/o ieVEST Ltd, Fritz-Reichle-Ring 6b, 78315 Radolfzell am Bodensee."
    },
    {
      "date": "2025-07-22",
      "id": "117058",
      "original_text": "Registerbekanntmachung nach dem Umwandlungsgesetz\nHessen Amtsgericht Darmstadt HRB 98439\nFranz-Josef Klotz GmbH CNC Fertigung – Babenhausen",
      "type": "Registerbekanntmachung nach dem Umwandlungsgesetz",
      "state": "Hessen",
      "amtsgericht": "Amtsgericht Darmstadt",
      "registernummer": "HRB 98439",
      "registerart": "HRB",
      "company_name": "Franz-Josef Klotz GmbH CNC Fertigung",
      "company_seat": "Babenhausen",
      "details": "22.07.2025 (Bekanntmachungsdatum)\n\nHessen Amtsgericht Darmstadt HRB 98439\nRegisterbekanntmachung nach dem Umwandlungsgesetz 22.07.2025 (Eintragungsdatum)\n\nFranz-Josef Klotz GmbH CNC Fertigung\nGesellschaft mit beschränkter Haftung\nBabenhausen\n\nDen Gläubigern der an der Verschmelzung beteiligten Rechtsträger ist, wenn sie binnen sechs Monaten nach dem Tag, an dem die Eintragung der Verschmelzung in das Register des Sitzes desjenigen Rechtsträgers, dessen Gläubiger sie sind, nach § 19 Absatz 3 UmwG bekannt gemacht worden ist, ihren Anspruch nach Grund und Höhe schriftlich anmelden, Sicherheit zu leisten, soweit sie nicht Befriedigung verlangen können. Dieses Recht steht den Gläubigern jedoch nur zu, wenn sie glaubhaft machen, dass durch die Verschmelzung die Erfüllung ihrer Forderung gefährdet wird."
    },
    {
      "date": "2025-07-22",
      "id": "117059",
      "original_text": "Löschungsankündigung\nHessen Amtsgericht Wiesbaden HRB 26190\nFive Media GmbH – Wiesbaden",
      "type": "Löschungsankündigung",
      "state": "Hessen",
      "amtsgericht": "Amtsgericht Wiesbaden",
      "registernummer": "HRB 26190",
      "registerart": "HRB",
      "company_name": "Five Media GmbH",
      "company_seat": "Wiesbaden",
      "details": "22.07.2025 (Bekanntmachungsdatum)\n\nHessen Amtsgericht Wiesbaden HRB 26190\nLöschungsankündigung\n\nFive Media GmbH\nGesellschaft mit beschränkter Haftung\nWiesbaden\n\nDas Registergericht beabsichtigt die im Handelsregister eingetragene Gesellschaft von Amts wegen nach § 394 FamFG zu löschen. Die Frist zur Erhebung eines Widerspruchs gegen die beabsichtigte Löschung wird auf 3 Monate festgesetzt."
    },
    {
      "date": "2025-07-22",
      "id": "117060",
      "original_text": "Einreichung neuer Dokumente\nHessen Amtsgericht Gießen HRB 6845\nPVA TePla AG – Wettenberg",
      "type": "Einreichung neuer Dokumente",
      "state": "Hessen",
      "amtsgericht": "Amtsgericht Gießen",
      "registernummer": "HRB 6845",
      "registerart": "HRB",
      "company_name": "PVA TePla AG",
      "company_seat": "Wettenberg",
      "details": "22.07.2025 (Bekanntmachungsdatum)\n\nHessen Amtsgericht Gießen HRB 6845\nEinreichung neuer Dokumente\n\nPVA TePla AG\nAktiengesellschaft\nWettenberg\n\nDurch eine Änderung in den Personen der Aufsichtsratsmitglieder ist eine Liste der Mitglieder des Aufsichtsrates zum Handelsregister eingereicht worden."
    },
    {
      "date": "2025-07-22",
      "id": "117061",
      "original_text": "Einreichung neuer Dokumente\nHessen Amtsgericht Gießen HRB 6845\nPVA TePla AG – Wettenberg",
      "type": "Einreichung neuer Dokumente",
      "state": "Hessen",
      "amtsgericht": "Amtsgericht Gießen",
      "registernummer": "HRB 6845",
      "registerart": "HRB",
      "company_name": "PVA TePla AG",
      "company_seat": "Wettenberg",
      "details": "22.07.2025 (Bekanntmachungsdatum)\n\nHessen Amtsgericht Gießen HRB 6845\nEinreichung neuer Dokumente 22.07.2025 (Eintragungsdatum)\n\nPVA TePla AG\nAktiengesellschaft\nWettenberg\n\nDurch eine Änderung in den Personen der Aufsichtsratsmitglieder ist eine Liste der Mitglieder des Aufsichtsrates zum Handelsregister eingereicht worden."
    },
    {
      "date": "2025-07-22",
      "id": "117062",
      "original_text": "Registerbekanntmachung nach dem Umwandlungsgesetz\nHessen Amtsgericht Frankfurt am Main HRB 132950\nsmile X InterCo GmbH – Frankfurt am Main",
      "type": "Registerbekanntmachung nach dem Umwandlungsgesetz",
      "state": "Hessen",
      "amtsgericht": "Amtsgericht Frankfurt am Main",
      "registernummer": "HRB 132950",
      "registerart": "HRB",
      "company_name": "smile X InterCo GmbH",
      "company_seat": "Frankfurt am Main",
      "details": "22.07.2025 (Bekanntmachungsdatum)\n\nHessen Amtsgericht Frankfurt am Main HRB 132950\nRegisterbekanntmachung nach dem Umwandlungsgesetz 22.07.2025 (Eintragungsdatum)\n\nsmile X InterCo GmbH\nGesellschaft mit beschränkter Haftung\nFrankfurt am Main\n\nDen Gläubigern der an der Verschmelzung beteiligten Rechtsträger ist, wenn sie binnen sechs Monaten nach dem Tag, an dem die Eintragung der Verschmelzung in das Register des Sitzes derjenigen Rechtsträger deren Gläubiger sie sind, nach § 19 Absatz 3 UmwG bekannt gemacht worden ist, ihren Anspruch nach Grund und Höhe schriftlich anmelden, Sicherheit zu leisten, soweit sie nicht Befriedigung verlangen können. Dieses Recht steht den Gläubigern jedoch nur zu, wenn sie glaubhaft machen, dass durch die Verschmelzung die Erfüllung ihrer Forderung gefährdet wird."
    },
    {
      "date": "2025-07-22",
      "id": "117063",
      "original_text": "Registerbekanntmachung nach dem Umwandlungsgesetz\nHessen Amtsgericht Darmstadt HRB 6498\nSkoberne Schornsteinsysteme GmbH – Pfungstadt",
      "type": "Registerbekanntmachung nach dem Umwandlungsgesetz",
      "state": "Hessen",
      "amtsgericht": "Amtsgericht Darmstadt",
      "registernummer": "HRB 6498",
      "registerart": "HRB",
      "company_name": "Skoberne Schornsteinsysteme GmbH",
      "company_seat": "Pfungstadt",
      "details": "22.07.2025 (Bekanntmachungsdatum)\n\nHessen Amtsgericht Darmstadt HRB 6498\nRegisterbekanntmachung nach dem Umwandlungsgesetz 22.07.2025 (Eintragungsdatum)\n\nSkoberne Schornsteinsysteme GmbH\nGesellschaft mit beschränkter Haftung\nPfungstadt\n\nDie Gesellschaft hat Gläubigern, deren Forderungen vor dieser Bekanntmachung begründet worden sind, Sicherheit zu leisten, soweit sie nicht Befriedigung verlangen können, wenn sie sich binnen sechs Monaten nach dieser Bekanntmachung zu diesem Zweck melden.\nDen Gläubigern der an der Verschmelzung beteiligten Rechtsträger ist, wenn sie binnen sechs Monaten nach dem Tag, an dem die Eintragung der Verschmelzung in das Register des Sitzes derjenigen Rechtsträger deren Gläubiger sie sind, nach § 19 Absatz 3 UmwG bekannt gemacht worden ist, ihren Anspruch nach Grund und Höhe schriftlich anmelden, Sicherheit zu leisten, soweit sie nicht Befriedigung verlangen können. Dieses Recht steht den Gläubigern jedoch nur zu, wenn sie glaubhaft machen, dass durch die Verschmelzung die Erfüllung ihrer Forderung gefährdet wird."
    },
    {
      "date": "2025-07-22",
      "id": "117064",
      "original_text": "Registerbekanntmachung nach dem Umwandlungsgesetz\nHessen Amtsgericht Darmstadt HRB 94757\nLastMile Rüsselsheim-Main-Taunus GmbH – Rüsselsheim",
      "type": "Registerbekanntmachung nach dem Umwandlungsgesetz",
      "state": "Hessen",
      "amtsgericht": "Amtsgericht Darmstadt",
      "registernummer": "HRB 94757",
      "registerart": "HRB",
      "company_name": "LastMile Rüsselsheim-Main-Taunus GmbH",
      "company_seat": "Rüsselsheim",
      "details": "22.07.2025 (Bekanntmachungsdatum)\n\nHessen Amtsgericht Darmstadt HRB 94757\nRegisterbekanntmachung nach dem Umwandlungsgesetz 22.07.2025 (Eintragungsdatum)\n\nLastMile Rüsselsheim-Main-Taunus GmbH\nGesellschaft mit beschränkter Haftung\nRüsselsheim\n\nDen Gläubigern der an der Verschmelzung beteiligten Rechtsträger ist, wenn sie binnen sechs Monaten nach dem Tag, an dem die Eintragung der Verschmelzung in das Register des Sitzes derjenigen Rechtsträger deren Gläubiger sie sind, nach § 19 Absatz 3 UmwG bekannt gemacht worden ist, ihren Anspruch nach Grund und Höhe schriftlich anmelden, Sicherheit zu leisten, soweit sie nicht Befriedigung verlangen können. Dieses Recht steht den Gläubigern jedoch nur zu, wenn sie glaubhaft machen, dass durch die Verschmelzung die Erfüllung ihrer Forderung gefährdet wird."
    },
    {
      "date": "2025-07-22",
      "id": "117065",
      "original_text": "Löschungsankündigung\nHessen Amtsgericht Wetzlar HRB 4108\nBurger KfZ Autohaus Schnorr GmbH – Herborn",
      "type": "Löschungsankündigung",
      "state": "Hessen",
      "amtsgericht": "Amtsgericht Wetzlar",
      "registernummer": "HRB 4108",
      "registerart": "HRB",
      "company_name": "Burger KfZ Autohaus Schnorr GmbH",
      "company_seat": "Herborn",
      "details": "22.07.2025 (Bekanntmachungsdatum)\n\nHessen Amtsgericht Wetzlar HRB 4108\nLöschungsankündigung\n\nBurger KfZ Autohaus Schnorr GmbH\nGesellschaft mit beschränkter Haftung\nHerborn\n\nDas Registergericht beabsichtigt die im Handelsregister eingetragene Gesellschaft von Amts wegen nach § 394 FamFG zu löschen. Die Frist zur Erhebung eines Widerspruchs gegen die beabsichtigte Löschung wird auf 2 Monate festgesetzt."
    },
    {
      "date": "2025-07-22",
      "id": "117066",
      "original_text": "Löschungsankündigung\nHessen Amtsgericht Frankfurt am Main HRB 113207\nBauklar GmbH – Frankfurt am Main",
      "type": "Löschungsankündigung",
      "state": "Hessen",
      "amtsgericht": "Amtsgericht Frankfurt am Main",
      "registernummer": "HRB 113207",
      "registerart": "HRB",
      "company_name": "Bauklar GmbH",
      "company_seat": "Frankfurt am Main",
      "details": "22.07.2025 (Bekanntmachungsdatum)\n\nHessen Amtsgericht Frankfurt am Main HRB 113207\nLöschungsankündigung 22.07.2025 (Eintragungsdatum)\n\nBauklar GmbH\nGesellschaft mit beschränkter Haftung\nFrankfurt am Main\n\nEs ist beabsichtigt die Gesellschaft wegen Vermögenslosigkeit gemäß § 394 FamFG von Amts wegen zu löschen. Hiergegen kann innerhalb eines Monats nach dieser Veröffentlichung Widerspruch bei dem Amtsgericht Frankfurt am Main eingelegt werden."
    },
    {
      "date": "2025-07-22",
      "id": "117067",
      "original_text": "Löschungsankündigung\nHessen Amtsgericht Wiesbaden HRB 34761\nAV Schweißtechnik und Industrieservice GmbH – Wiesbaden",
      "type": "Löschungsankündigung",
      "state": "Hessen",
      "amtsgericht": "Amtsgericht Wiesbaden",
      "registernummer": "HRB 34761",
      "registerart": "HRB",
      "company_name": "AV Schweißtechnik und Industrieservice GmbH",
      "company_seat": "Wiesbaden",
      "details": "22.07.2025 (Bekanntmachungsdatum)\n\nHessen Amtsgericht Wiesbaden HRB 34761\nLöschungsankündigung\n\nAV Schweißtechnik und Industrieservice GmbH\nGesellschaft mit beschränkter Haftung\nWiesbaden\n\nDas Registergericht beabsichtigt die im Handelsregister eingetragene Gesellschaft von Amts wegen nach § 394 FamFG zu löschen. Die Frist zur Erhebung eines Widerspruchs gegen die beabsichtigte Löschung wird auf 3 Monate festgesetzt."
    },
    {
      "date": "2025-07-22",
      "id": "117068",
      "original_text": "Registerbekanntmachung nach dem Umwandlungsgesetz\nHessen Amtsgericht Fritzlar HRB 11000\nB. Braun Melsungen Aktiengesellschaft – Melsungen",
      "type": "Registerbekanntmachung nach dem Umwandlungsgesetz",
      "state": "Hessen",
      "amtsgericht": "Amtsgericht Fritzlar",
      "registernummer": "HRB 11000",
      "registerart": "HRB",
      "company_name": "B. Braun Melsungen Aktiengesellschaft",
      "company_seat": "Melsungen",
      "details": "22.07.2025 (Bekanntmachungsdatum)\n\nHessen Amtsgericht Fritzlar HRB 11000\nRegisterbekanntmachung nach dem Umwandlungsgesetz 22.07.2025 (Eintragungsdatum)\n\nB. Braun Melsungen Aktiengesellschaft\nAktiengesellschaft\nMelsungen\n\nDie Gesellschaft hat den Entwurf des Abspaltungsvertrages zwischen ihr und der Aesulap Holding GmbH mit dem Sitz in Melsungen (Amtsgericht Fritzlar HRB 12696) beim Amtsgericht Fritzlar (Registergericht) zur Einsichtnahme eingereicht."
    },
    {
      "date": "2025-07-22",
      "id": "117069",
      "original_text": "Einreichung neuer Dokumente\nHessen Amtsgericht Hanau HRB 91522\nKlinikum Hanau GmbH – Hanau",
      "type": "Einreichung neuer Dokumente",
      "state": "Hessen",
      "amtsgericht": "Amtsgericht Hanau",
      "registernummer": "HRB 91522",
      "registerart": "HRB",
      "company_name": "Klinikum Hanau GmbH",
      "company_seat": "Hanau",
      "details": "22.07.2025 (Bekanntmachungsdatum)\n\nHessen Amtsgericht Hanau HRB 91522\nEinreichung neuer Dokumente\n\nKlinikum Hanau GmbH\nGesellschaft mit beschränkter Haftung\nHanau\n\nDurch eine Änderung in den Personen der Aufsichtsratsmitglieder ist eine Liste der Mitglieder des Aufsichtsrates zum Handelsregister eingereicht worden."
    },
    {
      "date": "2025-07-22",
      "id": "117070",
      "original_text": "Registerbekanntmachung nach dem Umwandlungsgesetz\nHessen Amtsgericht Offenbach am Main HRB 22148\nSPORT 2000 GmbH – Mainhausen",
      "type": "Registerbekanntmachung nach dem Umwandlungsgesetz",
      "state": "Hessen",
      "amtsgericht": "Amtsgericht Offenbach am Main",
      "registernummer": "HRB 22148",
      "registerart": "HRB",
      "company_name": "SPORT 2000 GmbH",
      "company_seat": "Mainhausen",
      "details": "22.07.2025 (Bekanntmachungsdatum)\n\nHessen Amtsgericht Offenbach am Main HRB 22148\nRegisterbekanntmachung nach dem Umwandlungsgesetz 22.07.2025 (Eintragungsdatum)\n\nSPORT 2000 GmbH\nGesellschaft mit beschränkter Haftung\nMainhausen\n\nDen Gläubigern der an der Verschmelzung beteiligten Rechtsträger ist, wenn sie binnen sechs Monaten nach dem Tag, an dem die Eintragung der Verschmelzung in das Register des Sitzes desjenigen Rechtsträgers, dessen Gläubiger sie sind, nach § 19 Absatz 3 UmwG bekannt gemacht worden ist, ihren Anspruch nach Grund und Höhe schriftlich anmelden, Sicherheit zu leisten, soweit sie nicht Befriedigung verlangen können. Dieses Recht steht den Gläubigern jedoch nur zu, wenn sie glaubhaft machen, dass durch die Verschmelzung die Erfüllung ihrer Forderung gefährdet wird."
    },
    {
      "date": "2025-07-22",
      "id": "117071",
      "original_text": "Einreichung neuer Dokumente\nHessen Amtsgericht Wetzlar HRB 1025\nEnergie- und Wassergesellschaft mbH – Wetzlar",
      "type": "Einreichung neuer Dokumente",
      "state": "Hessen",
      "amtsgericht": "Amtsgericht Wetzlar",
      "registernummer": "HRB 1025",
      "registerart": "HRB",
      "company_name": "Energie- und Wassergesellschaft mbH",
      "company_seat": "Wetzlar",
      "details": "22.07.2025 (Bekanntmachungsdatum)\n\nHessen Amtsgericht Wetzlar HRB 1025\nEinreichung neuer Dokumente\n\nEnergie- und Wassergesellschaft mbH\nGesellschaft mit beschränkter Haftung\nWetzlar\n\nDurch eine Änderung in den Personen der Aufsichtsratsmitglieder ist eine Liste der Mitglieder des Aufsichtsrates zum Handelsregister eingereicht worden."
    },
    {
      "date": "2025-07-22",
      "id": "117072",
      "original_text": "Registerbekanntmachung nach dem Umwandlungsgesetz\nHessen Amtsgericht Frankfurt am Main HRB 39391\nFFM Health & Fitness GmbH – Frankfurt am Main",
      "type": "Registerbekanntmachung nach dem Umwandlungsgesetz",
      "state": "Hessen",
      "amtsgericht": "Amtsgericht Frankfurt am Main",
      "registernummer": "HRB 39391",
      "registerart": "HRB",
      "company_name": "FFM Health & Fitness GmbH",
      "company_seat": "Frankfurt am Main",
      "details": "22.07.2025 (Bekanntmachungsdatum)\n\nHessen Amtsgericht Frankfurt am Main HRB 39391\nRegisterbekanntmachung nach dem Umwandlungsgesetz 22.07.2025 (Eintragungsdatum)\n\nFFM Health & Fitness GmbH\nGesellschaft mit beschränkter Haftung\nFrankfurt am Main\n\nDen Gläubigern der an der Verschmelzung beteiligten Rechtsträger ist, wenn sie binnen sechs Monaten nach dem Tag, an dem die Eintragung der Verschmelzung in das Register des Sitzes desjenigen Rechtsträgers, dessen Gläubiger sie sind, nach § 19 Absatz 3 UmwG bekannt gemacht worden ist, ihren Anspruch nach Grund und Höhe schriftlich anmelden, Sicherheit zu leisten, soweit sie nicht Befriedigung verlangen können. Dieses Recht steht den Gläubigern jedoch nur zu, wenn sie glaubhaft machen, dass durch die Verschmelzung die Erfüllung ihrer Forderung gefährdet wird."
    },
    {
      "date": "2025-07-22",
      "id": "117073",
      "original_text": "Registerbekanntmachung nach dem Umwandlungsgesetz\nHessen Amtsgericht Darmstadt HRA 87825\nFranz-Josef Klotz CNC Fertigung e. K. – Babenhausen",
      "type": "Registerbekanntmachung nach dem Umwandlungsgesetz",
      "state": "Hessen",
      "amtsgericht": "Amtsgericht Darmstadt",
      "registernummer": "HRA 87825",
      "registerart": "HRA",
      "company_name": "Franz-Josef Klotz CNC Fertigung e. K.",
      "company_seat": "Babenhausen",
      "details": "22.07.2025 (Bekanntmachungsdatum)\n\nHessen Amtsgericht Darmstadt HRA 87825\nRegisterbekanntmachung nach dem Umwandlungsgesetz 22.07.2025 (Eintragungsdatum)\n\nFranz-Josef Klotz CNC Fertigung e. K.\nEinzelkaufmann / Einzelkauffrau\nBabenhausen\n\nDen Gläubigern der an der Verschmelzung beteiligten Rechtsträger ist, wenn sie binnen sechs Monaten nach dem Tag, an dem die Eintragung der Verschmelzung in das Register des Sitzes desjenigen Rechtsträgers, dessen Gläubiger sie sind, nach § 19 Absatz 3 UmwG bekannt gemacht worden ist, ihren Anspruch nach Grund und Höhe schriftlich anmelden, Sicherheit zu leisten, soweit sie nicht Befriedigung verlangen können. Dieses Recht steht den Gläubigern jedoch nur zu, wenn sie glaubhaft machen, dass durch die Verschmelzung die Erfüllung ihrer Forderung gefährdet wird."
    },
    {
      "date": "2025-07-22",
      "id": "117074",
      "original_text": "Einreichung neuer Dokumente\nHessen Amtsgericht Frankfurt am Main HRB 74165\nPricewaterhouseCoopers Legal Aktiengesellschaft Rechtsanwaltsgesellschaft – Frankfurt am Main",
      "type": "Einreichung neuer Dokumente",
      "state": "Hessen",
      "amtsgericht": "Amtsgericht Frankfurt am Main",
      "registernummer": "HRB 74165",
      "registerart": "HRB",
      "company_name": "PricewaterhouseCoopers Legal Aktiengesellschaft Rechtsanwaltsgesellschaft",
      "company_seat": "Frankfurt am Main",
      "details": "22.07.2025 (Bekanntmachungsdatum)\n\nHessen Amtsgericht Frankfurt am Main HRB 74165\nEinreichung neuer Dokumente\n\nPricewaterhouseCoopers Legal Aktiengesellschaft Rechtsanwaltsgesellschaft\nAktiengesellschaft\nFrankfurt am Main\n\nDurch eine Änderung in den Personen der Aufsichtsratsmitglieder ist eine Liste der Mitglieder des Aufsichtsrates zum Handelsregister eingereicht worden."
    },
    {
      "date": "2025-07-22",
      "id": "117075",
      "original_text": "Registerbekanntmachung nach dem Umwandlungsgesetz\nHessen Amtsgericht Frankfurt am Main HRB 116838\nWertig-lmmobilien UG (haftungsbeschränkt) – Bad Vilbel",
      "type": "Registerbekanntmachung nach dem Umwandlungsgesetz",
      "state": "Hessen",
      "amtsgericht": "Amtsgericht Frankfurt am Main",
      "registernummer": "HRB 116838",
      "registerart": "HRB",
      "company_name": "Wertig-lmmobilien UG (haftungsbeschränkt)",
      "company_seat": "Bad Vilbel",
      "details": "22.07.2025 (Bekanntmachungsdatum)\n\nHessen Amtsgericht Frankfurt am Main HRB 116838\nRegisterbekanntmachung nach dem Umwandlungsgesetz 22.07.2025 (Eintragungsdatum)\n\nWertig-lmmobilien UG (haftungsbeschränkt)\nGesellschaft mit beschränkter Haftung\nBad Vilbel\n\nDen Gläubigern der an der Verschmelzung beteiligten Rechtsträger ist, wenn sie binnen sechs Monaten nach dem Tag, an dem die Eintragung der Verschmelzung in das Register des Sitzes desjenigen Rechtsträgers, dessen Gläubiger sie sind, nach § 19 Absatz 3 UmwG bekannt gemacht worden ist, ihren Anspruch nach Grund und Höhe schriftlich anmelden, Sicherheit zu leisten, soweit sie nicht Befriedigung verlangen können. Dieses Recht steht den Gläubigern jedoch nur zu, wenn sie glaubhaft machen, dass durch die Verschmelzung die Erfüllung ihrer Forderung gefährdet wird."
    },
    {
      "date": "2025-07-22",
      "id": "117076",
      "original_text": "Registerbekanntmachung nach dem Umwandlungsgesetz\nHessen Amtsgericht Frankfurt am Main HRB 132761\nsmile Verwaltungs-GmbH 4 – Frankfurt am Main",
      "type": "Registerbekanntmachung nach dem Umwandlungsgesetz",
      "state": "Hessen",
      "amtsgericht": "Amtsgericht Frankfurt am Main",
      "registernummer": "HRB 132761",
      "registerart": "HRB",
      "company_name": "smile Verwaltungs-GmbH 4",
      "company_seat": "Frankfurt am Main",
      "details": "22.07.2025 (Bekanntmachungsdatum)\n\nHessen Amtsgericht Frankfurt am Main HRB 132761\nRegisterbekanntmachung nach dem Umwandlungsgesetz 22.07.2025 (Eintragungsdatum)\n\nsmile Verwaltungs-GmbH 4\nGesellschaft mit beschränkter Haftung\nFrankfurt am Main\n\nDen Gläubigern der an der Verschmelzung beteiligten Rechtsträger ist, wenn sie binnen sechs Monaten nach dem Tag, an dem die Eintragung der Verschmelzung in das Register des Sitzes derjenigen Rechtsträger deren Gläubiger sie sind, nach § 19 Absatz 3 UmwG bekannt gemacht worden ist, ihren Anspruch nach Grund und Höhe schriftlich anmelden, Sicherheit zu leisten, soweit sie nicht Befriedigung verlangen können. Dieses Recht steht den Gläubigern jedoch nur zu, wenn sie glaubhaft machen, dass durch die Verschmelzung die Erfüllung ihrer Forderung gefährdet wird."
    },
    {
      "date": "2025-07-22",
      "id": "117077",
      "original_text": "Löschungsankündigung\nHessen Amtsgericht Darmstadt HRB 103233\nV+V BAU. UG (haftungsbeschränkt) – Münster",
      "type": "Löschungsankündigung",
      "state": "Hessen",
      "amtsgericht": "Amtsgericht Darmstadt",
      "registernummer": "HRB 103233",
      "registerart": "HRB",
      "company_name": "V+V BAU. UG (haftungsbeschränkt)",
      "company_seat": "Münster",
      "details": "22.07.2025 (Bekanntmachungsdatum)\n\nHessen Amtsgericht Darmstadt HRB 103233\nLöschungsankündigung\n\nV+V BAU. UG (haftungsbeschränkt)\nGesellschaft mit beschränkter Haftung\nMünster\n\nDas Registergericht beabsichtigt die im Handelsregister eingetragene Gesellschaft von Amts wegen nach § 394 FamFG zu löschen. Die Frist zur Erhebung eines Widerspruchs gegen die beabsichtigte Löschung wird auf 3 Monate festgesetzt."
    },
    {
      "date": "2025-07-22",
      "id": "117078",
      "original_text": "Registerbekanntmachung nach dem Umwandlungsgesetz\nHessen Amtsgericht Wiesbaden HRB 23345\nMegaCAD Stadtplanung GmbH – Wiesbaden",
      "type": "Registerbekanntmachung nach dem Umwandlungsgesetz",
      "state": "Hessen",
      "amtsgericht": "Amtsgericht Wiesbaden",
      "registernummer": "HRB 23345",
      "registerart": "HRB",
      "company_name": "MegaCAD Stadtplanung GmbH",
      "company_seat": "Wiesbaden",
      "details": "22.07.2025 (Bekanntmachungsdatum)\n\nHessen Amtsgericht Wiesbaden HRB 23345\nRegisterbekanntmachung nach dem Umwandlungsgesetz 22.07.2025 (Eintragungsdatum)\n\nMegaCAD Stadtplanung GmbH\nGesellschaft mit beschränkter Haftung\nWiesbaden\n\nDen Gläubigern der an der Verschmelzung beteiligten Rechtsträger ist, wenn sie binnen sechs Monaten nach dem Tag, an dem die Eintragung der Verschmelzung in das Register des Sitzes derjenigen Rechtsträger deren Gläubiger sie sind, nach § 19 Absatz 3 UmwG bekannt gemacht worden ist, ihren Anspruch nach Grund und Höhe schriftlich anmelden, Sicherheit zu leisten, soweit sie nicht Befriedigung verlangen können. Dieses Recht steht den Gläubigern jedoch nur zu, wenn sie glaubhaft machen, dass durch die Verschmelzung die Erfüllung ihrer Forderung gefährdet wird."
    },
    {
      "date": "2025-07-22",
      "id": "117079",
      "original_text": "Sonstige Registerbekanntmachung\nHessen Amtsgericht Frankfurt am Main HRB 6712\nNassauische Heimstätte Wohnungs- und Entwicklungsgesellschaft mit beschränkter Haftung – Frankfurt am Main",
      "type": "Sonstige Registerbekanntmachung",
      "state": "Hessen",
      "amtsgericht": "Amtsgericht Frankfurt am Main",
      "registernummer": "HRB 6712",
      "registerart": "HRB",
      "company_name": "Nassauische Heimstätte Wohnungs- und Entwicklungsgesellschaft mit beschränkter Haftung",
      "company_seat": "Frankfurt am Main",
      "details": "22.07.2025 (Bekanntmachungsdatum)\n\nHessen Amtsgericht Frankfurt am Main HRB 6712\nSonstige Registerbekanntmachung\n\nNassauische Heimstätte Wohnungs- und Entwicklungsgesellschaft mit beschränkter Haftung\nGesellschaft mit beschränkter Haftung\nFrankfurt am Main\n\nDurch eine Änderung in den Personen der Aufsichtsratsmitglieder ist eine Liste der Mitglieder des Aufsichtsrates zum Handelsregister eingereicht worden."
    },
    {
      "date": "2025-07-22",
      "id": "117080",
      "original_text": "Registerbekanntmachung nach dem Umwandlungsgesetz\nHessen Amtsgericht Frankfurt am Main HRB 117077\nWertig-Immobilien UG (haftungsbeschränkt) – Bad Vilbel",
      "type": "Registerbekanntmachung nach dem Umwandlungsgesetz",
      "state": "Hessen",
      "amtsgericht": "Amtsgericht Frankfurt am Main",
      "registernummer": "HRB 117077",
      "registerart": "HRB",
      "company_name": "Wertig-Immobilien UG (haftungsbeschränkt)",
      "company_seat": "Bad Vilbel",
      "details": "22.07.2025 (Bekanntmachungsdatum)\n\nHessen Amtsgericht Frankfurt am Main HRB 117077\nRegisterbekanntmachung nach dem Umwandlungsgesetz 22.07.2025 (Eintragungsdatum)\n\nWertig-Immobilien UG (haftungsbeschränkt)\nGesellschaft mit beschränkter Haftung\nBad Vilbel\n\nDen Gläubigern der an der Verschmelzung beteiligten Rechtsträger ist, wenn sie binnen sechs Monaten nach dem Tag, an dem die Eintragung der Verschmelzung in das Register des Sitzes desjenigen Rechtsträgers, dessen Gläubiger sie sind, nach § 19 Absatz 3 UmwG bekannt gemacht worden ist, ihren Anspruch nach Grund und Höhe schriftlich anmelden, Sicherheit zu leisten, soweit sie nicht Befriedigung verlangen können. Dieses Recht steht den Gläubigern jedoch nur zu, wenn sie glaubhaft machen, dass durch die Verschmelzung die Erfüllung ihrer Forderung gefährdet wird."
    },
    {
      "date": "2025-07-22",
      "id": "117081",
      "original_text": "Registerbekanntmachung nach dem Umwandlungsgesetz\nHessen Amtsgericht Offenbach am Main HRB 22148\nSPORT 2000 GmbH – Mainhausen",
      "type": "Registerbekanntmachung nach dem Umwandlungsgesetz",
      "state": "Hessen",
      "amtsgericht": "Amtsgericht Offenbach am Main",
      "registernummer": "HRB 22148",
      "registerart": "HRB",
      "company_name": "SPORT 2000 GmbH",
      "company_seat": "Mainhausen",
      "details": "22.07.2025 (Bekanntmachungsdatum)\n\nHessen Amtsgericht Offenbach am Main HRB 22148\nRegisterbekanntmachung nach dem Umwandlungsgesetz 22.07.2025 (Eintragungsdatum)\n\nSPORT 2000 GmbH\nGesellschaft mit beschränkter Haftung\nMainhausen\n\nDen Gläubigern der an der Verschmelzung beteiligten Rechtsträger ist, wenn sie binnen sechs Monaten nach dem Tag, an dem die Eintragung der Verschmelzung in das Register des Sitzes desjenigen Rechtsträgers, dessen Gläubiger sie sind, nach § 19 Absatz 3 UmwG bekannt gemacht worden ist, ihren Anspruch nach Grund und Höhe schriftlich anmelden, Sicherheit zu leisten, soweit sie nicht Befriedigung verlangen können. Dieses Recht steht den Gläubigern jedoch nur zu, wenn sie glaubhaft machen, dass durch die Verschmelzung die Erfüllung ihrer Forderung gefährdet wird."
    }
  ]
}