{
  "date": "2025-07-07",
  "date_of_scrape": "2025-07-08T04:16:58.719Z",
  "tool_version": "0.2.0",
  "number_of_announcements": 147,
  "announcements": [
    {
      "date": "2025-07-07",
      "id": "114744",
      "original_text": "Registerbekanntmachung nach dem Umwandlungsgesetz\nBaden-Württemberg Amtsgericht Stuttgart HRB 411393\nBWPOST Zollernalb GmbH – Balingen",
      "type": "Registerbekanntmachung nach dem Umwandlungsgesetz",
      "state": "Baden-Württemberg",
      "amtsgericht": "Amtsgericht Stuttgart",
      "registernummer": "HRB 411393",
      "registerart": "HRB",
      "company_name": "BWPOST Zollernalb GmbH",
      "company_seat": "Balingen",
      "details": "07.07.2025 (Bekanntmachungsdatum)\n\nBaden-Württemberg Amtsgericht Stuttgart HRB 411393\nRegisterbekanntmachung nach dem Umwandlungsgesetz 07.07.2025 (Eintragungsdatum)\n\nBWPOST Zollernalb GmbH\nGesellschaft mit beschränkter Haftung\nBalingen\n\nAls nicht eingetragen wird bekanntgemacht:\nDen Gläubigern der an der Verschmelzung beteiligten Rechtsträger ist, wenn sie binnen sechs Monaten nach dem Tag, an dem die Eintragung der Verschmelzung in das Register des Sitzes desjenigen Rechtsträgers, dessen Gläubiger sie sind, nach § 19 Abs. 3 UmwG als bekanntgemacht gilt, ihren Anspruch nach Grund und Höhe schriftlich anmelden, Sicherheit zu leisten, soweit sie nicht Befriedigung verlangen können. Dieses Recht steht den Gläubigern jedoch nur zu, wenn sie glaubhaft machen, dass durch die Verschmelzung die Erfüllung ihrer Forderung gefährdet wird."
    },
    {
      "date": "2025-07-07",
      "id": "114745",
      "original_text": "Registerbekanntmachung nach dem Umwandlungsgesetz\nSchleswig-Holstein Amtsgericht Flensburg HRB 1542 HU\nvodafone Shop netpart comshop GmbH – Husum",
      "type": "Registerbekanntmachung nach dem Umwandlungsgesetz",
      "state": "Schleswig-Holstein",
      "amtsgericht": "Amtsgericht Flensburg",
      "registernummer": "HRB 1542 HU",
      "registerart": "HRB",
      "company_name": "vodafone Shop netpart comshop GmbH",
      "company_seat": "Husum",
      "details": "07.07.2025 (Bekanntmachungsdatum)\n\nSchleswig-Holstein Amtsgericht Flensburg HRB 1542 HU\nRegisterbekanntmachung nach dem Umwandlungsgesetz 04.07.2025 (Eintragungsdatum)\n\nvodafone Shop netpart comshop GmbH\nGesellschaft mit beschränkter Haftung\nHusum\n\nZu Eintragungsnummer 4 vom 04.07.2025 wird als nicht eingetragen veröffentlicht: Den Gläubigern der an der Verschmelzung beteiligten Rechtsträger ist, wenn sie binnen sechs Monaten nach dem Tag, an dem die Eintragung der Verschmelzung in das Register des Sitzes desjenigen Rechtsträgers, dessen Gläubiger sie sind, als bekannt gemacht gilt, ihren Anspruch nach Grund und Höhe schriftlich anmelden, Sicherheit zu leisten, soweit sie nicht Befriedigung verlangen können. Dieses Recht steht den Gläubigern jedoch nur zu, wenn sie glaubhaft machen, dass durch die Verschmelzung die Erfüllung ihrer Forderung gefährdet wird. Das Recht, Sicherheitsleistung zu verlangen, steht Gläubigern nicht zu, die im Falle der Insolvenz ein Recht auf vorzugsweise Befriedigung aus einer Deckungsmasse haben, die nach gesetzlicher Vorschrift zu ihrem Schutz errichtet und staatlich überwacht ist."
    },
    {
      "date": "2025-07-07",
      "id": "114746",
      "original_text": "Löschungsankündigung\nSaarland Amtsgericht Saarbrücken HRB 108241\nMS Infotec GmbH – Saarbrücken",
      "type": "Löschungsankündigung",
      "state": "Saarland",
      "amtsgericht": "Amtsgericht Saarbrücken",
      "registernummer": "HRB 108241",
      "registerart": "HRB",
      "company_name": "MS Infotec GmbH",
      "company_seat": "Saarbrücken",
      "details": "07.07.2025 (Bekanntmachungsdatum)\n\nSaarland Amtsgericht Saarbrücken HRB 108241\nLöschungsankündigung\n\nMS Infotec GmbH\nGesellschaft mit beschränkter Haftung\nSaarbrücken\n\nEs ist beabsichtigt, die Gesellschaft von Amts wegen gemäß § 394 FamFG wegen Vermögenslosigkeit zu löschen.\nGegen die Löschung von Amts wegen ist das Rechtsmittel des Widerspruchs statthaft. Der Widerspruch ist binnen einer Frist zwei Monaten beginnend mit dem Tag dieser Veröffentlichung durch Einreichen eines Widerspruchsschreibens -schriftlich oder zur Niederschrift der Geschäftsstelle beim Amtsgericht Saarbrücken, -zentrales Handelsregister-, Mainzerstr.178, 66121 Saarbrücken einzulegen.\nDer Widerspruch muss die Bezeichnung der angefochtenen Löschungsankündigung enthalten sowie die Erklärung, dass Widerspruch eingelegt wird. Er ist vom Widerspruchsführer oder seinem Bevollmächtigten zu unterzeichnen.\nDas Widerspruchsschreiben kann auch in der Form eines elektronischen Dokumentes eingereicht werden, das mit einer qualifizierten elektronischen Signatur nach dem Signaturgesetz versehen sein muss (§§ 14 Abs. 2 FamFG, 130a, 298 ZPO)."
    },
    {
      "date": "2025-07-07",
      "id": "114747",
      "original_text": "Löschungsankündigung\nSaarland Amtsgericht Saarbrücken HRB 105970\nMTB Trockenbau UG (haftungsbeschränkt) – Saarbrücken",
      "type": "Löschungsankündigung",
      "state": "Saarland",
      "amtsgericht": "Amtsgericht Saarbrücken",
      "registernummer": "HRB 105970",
      "registerart": "HRB",
      "company_name": "MTB Trockenbau UG (haftungsbeschränkt)",
      "company_seat": "Saarbrücken",
      "details": "07.07.2025 (Bekanntmachungsdatum)\n\nSaarland Amtsgericht Saarbrücken HRB 105970\nLöschungsankündigung\n\nMTB Trockenbau UG (haftungsbeschränkt)\nGesellschaft mit beschränkter Haftung\nSaarbrücken\n\nEs ist beabsichtigt, die Gesellschaft von Amts wegen gemäß § 394 FamFG wegen Vermögenslosigkeit zu löschen.\nGegen die Löschung von Amts wegen ist das Rechtsmittel des Widerspruchs statthaft. Der Widerspruch ist binnen einer Frist drei Monaten beginnend mit dem Tag dieser Veröffentlichung durch Einreichen eines Widerspruchsschreibens -schriftlich oder zur Niederschrift der Geschäftsstelle beim Amtsgericht Saarbrücken, -zentrales Handelsregister-, Mainzerstr.178, 66121 Saarbrücken einzulegen.\nDer Widerspruch muss die Bezeichnung der angefochtenen Löschungsankündigung enthalten sowie die Erklärung, dass Widerspruch eingelegt wird. Er ist vom Widerspruchsführer oder seinem Bevollmächtigten zu unterzeichnen.\nDas Widerspruchsschreiben kann auch in der Form eines elektronischen Dokumentes eingereicht werden, das mit einer qualifizierten elektronischen Signatur nach dem Signaturgesetz versehen sein muss (§§ 14 Abs. 2 FamFG, 130a, 298 ZPO)."
    },
    {
      "date": "2025-07-07",
      "id": "114748",
      "original_text": "Registerbekanntmachung nach dem Umwandlungsgesetz\nBaden-Württemberg Amtsgericht Mannheim HRB 744951\nIRED intelligent real estate development GmbH – Mannheim",
      "type": "Registerbekanntmachung nach dem Umwandlungsgesetz",
      "state": "Baden-Württemberg",
      "amtsgericht": "Amtsgericht Mannheim",
      "registernummer": "HRB 744951",
      "registerart": "HRB",
      "company_name": "IRED intelligent real estate development GmbH",
      "company_seat": "Mannheim",
      "details": "07.07.2025 (Bekanntmachungsdatum)\n\nBaden-Württemberg Amtsgericht Mannheim HRB 744951\nRegisterbekanntmachung nach dem Umwandlungsgesetz 07.07.2025 (Eintragungsdatum)\n\nIRED intelligent real estate development GmbH\nGesellschaft mit beschränkter Haftung\nMannheim\n\nAls nicht eingetragen wird bekanntgemacht:\nDen Gläubigern der an der Verschmelzung beteiligten Rechtsträger ist, wenn sie binnen sechs Monaten nach dem Tag, an dem die Eintragung der Verschmelzung in das Register des Sitzes desjenigen Rechtsträgers, dessen Gläubiger sie sind, nach § 19 Abs. 3 UmwG als bekanntgemacht gilt, ihren Anspruch nach Grund und Höhe schriftlich anmelden, Sicherheit zu leisten, soweit sie nicht Befriedigung verlangen können. Dieses Recht steht den Gläubigern jedoch nur zu, wenn sie glaubhaft machen, dass durch die Verschmelzung die Erfüllung ihrer Forderung gefährdet wird."
    },
    {
      "date": "2025-07-07",
      "id": "114749",
      "original_text": "Registerbekanntmachung nach dem Umwandlungsgesetz\nBaden-Württemberg Amtsgericht Mannheim HRB 744951\nIRED intelligent real estate development GmbH – Mannheim",
      "type": "Registerbekanntmachung nach dem Umwandlungsgesetz",
      "state": "Baden-Württemberg",
      "amtsgericht": "Amtsgericht Mannheim",
      "registernummer": "HRB 744951",
      "registerart": "HRB",
      "company_name": "IRED intelligent real estate development GmbH",
      "company_seat": "Mannheim",
      "details": "07.07.2025 (Bekanntmachungsdatum)\n\nBaden-Württemberg Amtsgericht Mannheim HRB 744951\nRegisterbekanntmachung nach dem Umwandlungsgesetz 07.07.2025 (Eintragungsdatum)\n\nIRED intelligent real estate development GmbH\nGesellschaft mit beschränkter Haftung\nMannheim\n\nAls nicht eingetragen wird bekanntgemacht:\nDen Gläubigern der an der Verschmelzung beteiligten Rechtsträger ist, wenn sie binnen sechs Monaten nach dem Tag, an dem die Eintragung der Verschmelzung in das Register des Sitzes desjenigen Rechtsträgers, dessen Gläubiger sie sind, nach § 19 Abs. 3 UmwG als bekanntgemacht gilt, ihren Anspruch nach Grund und Höhe schriftlich anmelden, Sicherheit zu leisten, soweit sie nicht Befriedigung verlangen können. Dieses Recht steht den Gläubigern jedoch nur zu, wenn sie glaubhaft machen, dass durch die Verschmelzung die Erfüllung ihrer Forderung gefährdet wird."
    },
    {
      "date": "2025-07-07",
      "id": "114750",
      "original_text": "Registerbekanntmachung nach dem Umwandlungsgesetz\nBaden-Württemberg Amtsgericht Mannheim HRB 738104\nMurphys Ventures GmbH – Mannheim",
      "type": "Registerbekanntmachung nach dem Umwandlungsgesetz",
      "state": "Baden-Württemberg",
      "amtsgericht": "Amtsgericht Mannheim",
      "registernummer": "HRB 738104",
      "registerart": "HRB",
      "company_name": "Murphys Ventures GmbH",
      "company_seat": "Mannheim",
      "details": "07.07.2025 (Bekanntmachungsdatum)\n\nBaden-Württemberg Amtsgericht Mannheim HRB 738104\nRegisterbekanntmachung nach dem Umwandlungsgesetz 07.07.2025 (Eintragungsdatum)\n\nMurphys Ventures GmbH\nGesellschaft mit beschränkter Haftung\nMannheim\n\nAls nicht eingetragen wird bekanntgemacht:\nDen Gläubigern der an der Verschmelzung beteiligten Rechtsträger ist, wenn sie binnen sechs Monaten nach dem Tag, an dem die Eintragung der Verschmelzung in das Register des Sitzes desjenigen Rechtsträgers, dessen Gläubiger sie sind, nach § 19 Abs. 3 UmwG als bekanntgemacht gilt, ihren Anspruch nach Grund und Höhe schriftlich anmelden, Sicherheit zu leisten, soweit sie nicht Befriedigung verlangen können. Dieses Recht steht den Gläubigern jedoch nur zu, wenn sie glaubhaft machen, dass durch die Verschmelzung die Erfüllung ihrer Forderung gefährdet wird."
    },
    {
      "date": "2025-07-07",
      "id": "114751",
      "original_text": "Einreichung neuer Dokumente\nBaden-Württemberg Amtsgericht Stuttgart HRB 750582\nVfB Stuttgart 1893 AG – Stuttgart",
      "type": "Einreichung neuer Dokumente",
      "state": "Baden-Württemberg",
      "amtsgericht": "Amtsgericht Stuttgart",
      "registernummer": "HRB 750582",
      "registerart": "HRB",
      "company_name": "VfB Stuttgart 1893 AG",
      "company_seat": "Stuttgart",
      "details": "07.07.2025 (Bekanntmachungsdatum)\n\nBaden-Württemberg Amtsgericht Stuttgart HRB 750582\nEinreichung neuer Dokumente 07.07.2025 (Eintragungsdatum)\n\nVfB Stuttgart 1893 AG\nAktiengesellschaft\nStuttgart\n\nDie Gesellschaft hat am 03.07.2025 die Liste über die Zusammensetzung des Aufsichtsrats zum Handelsregister eingereicht."
    },
    {
      "date": "2025-07-07",
      "id": "114752",
      "original_text": "Einreichung neuer Dokumente\nNiedersachsen Amtsgericht Braunschweig HRB 10019\nBraunschweiger Versorgungs-Verwaltungs-Aktiengesellschaft – Braunschweig",
      "type": "Einreichung neuer Dokumente",
      "state": "Niedersachsen",
      "amtsgericht": "Amtsgericht Braunschweig",
      "registernummer": "HRB 10019",
      "registerart": "HRB",
      "company_name": "Braunschweiger Versorgungs-Verwaltungs-Aktiengesellschaft",
      "company_seat": "Braunschweig",
      "details": "07.07.2025 (Bekanntmachungsdatum)\n\nNiedersachsen Amtsgericht Braunschweig HRB 10019\nEinreichung neuer Dokumente 07.07.2025 (Eintragungsdatum)\n\nBraunschweiger Versorgungs-Verwaltungs-Aktiengesellschaft\nAktiengesellschaft\nBraunschweig\n\nDie Liste der Mitglieder des Aufsichtsrats wurde beim Registergericht eingereicht."
    },
    {
      "date": "2025-07-07",
      "id": "114753",
      "original_text": "Löschungsankündigung\nSchleswig-Holstein Amtsgericht Lübeck HRB 21426\nForSer Holstein UG (haftungsbeschränkt) – Lauenburg/Elbe",
      "type": "Löschungsankündigung",
      "state": "Schleswig-Holstein",
      "amtsgericht": "Amtsgericht Lübeck",
      "registernummer": "HRB 21426",
      "registerart": "HRB",
      "company_name": "ForSer Holstein UG (haftungsbeschränkt)",
      "company_seat": "Lauenburg/Elbe",
      "details": "07.07.2025 (Bekanntmachungsdatum)\n\nSchleswig-Holstein Amtsgericht Lübeck HRB 21426\nLöschungsankündigung\n\nForSer Holstein UG (haftungsbeschränkt)\nGesellschaft mit beschränkter Haftung\nLauenburg/Elbe\n\nEs ist die Löschung der nachstehenden Gesellschaft wegen Vermögenslosigkeit gemäß § 394 FamFG beabsichtigt.\nWiderspruchsfrist: 1 Monat."
    },
    {
      "date": "2025-07-07",
      "id": "114754",
      "original_text": "Registerbekanntmachung nach dem Umwandlungsgesetz\nBaden-Württemberg Amtsgericht Freiburg HRB 728631\nPlantax GmbH – Lörrach",
      "type": "Registerbekanntmachung nach dem Umwandlungsgesetz",
      "state": "Baden-Württemberg",
      "amtsgericht": "Amtsgericht Freiburg",
      "registernummer": "HRB 728631",
      "registerart": "HRB",
      "company_name": "Plantax GmbH",
      "company_seat": "Lörrach",
      "details": "07.07.2025 (Bekanntmachungsdatum)\n\nBaden-Württemberg Amtsgericht Freiburg HRB 728631\nRegisterbekanntmachung nach dem Umwandlungsgesetz 07.07.2025 (Eintragungsdatum)\n\nPlantax GmbH\nGesellschaft mit beschränkter Haftung\nLörrach\n\nAls nicht eingetragen wird bekanntgemacht:\nDen Gläubigern der an der Verschmelzung beteiligten Rechtsträger ist, wenn sie binnen sechs Monaten nach dem Tag, an dem die Eintragung der Verschmelzung in das Register des Sitzes desjenigen Rechtsträgers, dessen Gläubiger sie sind, nach § 19 Abs. 3 UmwG als bekanntgemacht gilt, ihren Anspruch nach Grund und Höhe schriftlich anmelden, Sicherheit zu leisten, soweit sie nicht Befriedigung verlangen können. Dieses Recht steht den Gläubigern jedoch nur zu, wenn sie glaubhaft machen, dass durch die Verschmelzung die Erfüllung ihrer Forderung gefährdet wird."
    },
    {
      "date": "2025-07-07",
      "id": "114755",
      "original_text": "Einreichung neuer Dokumente\nBaden-Württemberg Amtsgericht Stuttgart HRB 727184\nHIPP Medical AG – Kolbingen",
      "type": "Einreichung neuer Dokumente",
      "state": "Baden-Württemberg",
      "amtsgericht": "Amtsgericht Stuttgart",
      "registernummer": "HRB 727184",
      "registerart": "HRB",
      "company_name": "HIPP Medical AG",
      "company_seat": "Kolbingen",
      "details": "07.07.2025 (Bekanntmachungsdatum)\n\nBaden-Württemberg Amtsgericht Stuttgart HRB 727184\nEinreichung neuer Dokumente\n\nHIPP Medical AG\nAktiengesellschaft\nKolbingen\n\nDie Gesellschaft hat am 03.07.2025 die Liste über die Zusammensetzung des Aufsichtsrats zum Handelsregister eingereicht."
    },
    {
      "date": "2025-07-07",
      "id": "114756",
      "original_text": "Einreichung neuer Dokumente\nBaden-Württemberg Amtsgericht Stuttgart HRB 727184\nHIPP Medical AG – Kolbingen",
      "type": "Einreichung neuer Dokumente",
      "state": "Baden-Württemberg",
      "amtsgericht": "Amtsgericht Stuttgart",
      "registernummer": "HRB 727184",
      "registerart": "HRB",
      "company_name": "HIPP Medical AG",
      "company_seat": "Kolbingen",
      "details": "07.07.2025 (Bekanntmachungsdatum)\n\nBaden-Württemberg Amtsgericht Stuttgart HRB 727184\nEinreichung neuer Dokumente\n\nHIPP Medical AG\nAktiengesellschaft\nKolbingen\n\nDie Gesellschaft hat am 03.07.2025 die Liste über die Zusammensetzung des Aufsichtsrats zum Handelsregister eingereicht."
    },
    {
      "date": "2025-07-07",
      "id": "114757",
      "original_text": "Registerbekanntmachung nach dem Umwandlungsgesetz\nSchleswig-Holstein Amtsgericht Kiel HRA 12487\nquimedic e. K. – Norderstedt",
      "type": "Registerbekanntmachung nach dem Umwandlungsgesetz",
      "state": "Schleswig-Holstein",
      "amtsgericht": "Amtsgericht Kiel",
      "registernummer": "HRA 12487",
      "registerart": "HRA",
      "company_name": "quimedic e. K.",
      "company_seat": "Norderstedt",
      "details": "07.07.2025 (Bekanntmachungsdatum)\n\nSchleswig-Holstein Amtsgericht Kiel HRA 12487\nRegisterbekanntmachung nach dem Umwandlungsgesetz 04.07.2025 (Eintragungsdatum)\n\nquimedic e. K.\nEinzelkaufmann / Einzelkauffrau\nNorderstedt\n\nZu Eintragungsnummer 2 vom 04.07.2025 wird als nicht eingetragen veröffentlicht: Den Gläubigern der an der Spaltung beteiligten Rechtsträger ist, wenn sie binnen sechs Monaten nach dem Tag, an dem die Eintragung der Spaltung in das Register des Sitzes desjenigen Rechtsträgers, dessen Gläubiger sie sind,  bekannt gemacht worden ist, ihren Anspruch nach Grund und Höhe schriftlich anmelden, Sicherheit zu leisten, soweit sie nicht Befriedigung verlangen können. Dieses Recht steht den Gläubigern jedoch nur zu, wenn sie glaubhaft machen, dass durch die Spaltung die Erfüllung ihrer Forderung gefährdet wird."
    },
    {
      "date": "2025-07-07",
      "id": "114758",
      "original_text": "Registerbekanntmachung nach dem Umwandlungsgesetz\nHamburg Amtsgericht Hamburg HRB 95148\nImmobilienHaus Hamburg GmbH – Hamburg",
      "type": "Registerbekanntmachung nach dem Umwandlungsgesetz",
      "state": "Hamburg",
      "amtsgericht": "Amtsgericht Hamburg",
      "registernummer": "HRB 95148",
      "registerart": "HRB",
      "company_name": "ImmobilienHaus Hamburg GmbH",
      "company_seat": "Hamburg",
      "details": "07.07.2025 (Bekanntmachungsdatum)\n\nHamburg Amtsgericht Hamburg HRB 95148\nRegisterbekanntmachung nach dem Umwandlungsgesetz 07.07.2025 (Eintragungsdatum)\n\nImmobilienHaus Hamburg GmbH\nGesellschaft mit beschränkter Haftung\nHamburg\n\nAls nicht eingetragen wird bekannt gemacht:\nDen Gläubigern der an der Verschmelzung beteiligten Gesellschaften ist, wenn sie binnen sechs Monaten nach dem Tag, an dem die Eintragung der Verschmelzung in das Register des Sitzes desjenigen Rechtsträgers, dessen Gläubiger sie sind, nach § 19 Absatz 3 UmwG als bekannt gemacht gilt, ihren Anspruch nach Grund und Höhe schriftlich anmelden, Sicherheit zu leisten, soweit sie nicht Befriedigung verlangen können. Dieses Recht steht den Gläubigern jedoch nur zu, wenn sie glaubhaft machen, dass durch die Verschmelzung die Erfüllung ihrer Forderung gefährdet wird."
    },
    {
      "date": "2025-07-07",
      "id": "114759",
      "original_text": "Registerbekanntmachung nach dem Umwandlungsgesetz\nHamburg Amtsgericht Hamburg HRA 132542\nWolfgang Sattler e.K. – Hamburg",
      "type": "Registerbekanntmachung nach dem Umwandlungsgesetz",
      "state": "Hamburg",
      "amtsgericht": "Amtsgericht Hamburg",
      "registernummer": "HRA 132542",
      "registerart": "HRA",
      "company_name": "Wolfgang Sattler e.K.",
      "company_seat": "Hamburg",
      "details": "07.07.2025 (Bekanntmachungsdatum)\n\nHamburg Amtsgericht Hamburg HRA 132542\nRegisterbekanntmachung nach dem Umwandlungsgesetz 07.07.2025 (Eintragungsdatum)\n\nWolfgang Sattler e.K.\nEinzelkaufmann\nHamburg\n\nAls nicht eingetragen wird bekannt gemacht:\nDen Gläubigern der an der Verschmelzung beteiligten Gesellschaften ist, wenn sie binnen sechs Monaten nach dem Tag, an dem die Eintragung der Verschmelzung in das Register des Sitzes desjenigen Rechtsträgers, dessen Gläubiger sie sind, nach § 19 Absatz 3 UmwG als bekannt gemacht gilt, ihren Anspruch nach Grund und Höhe schriftlich anmelden, Sicherheit zu leisten, soweit sie nicht Befriedigung verlangen können. Dieses Recht steht den Gläubigern jedoch nur zu, wenn sie glaubhaft machen, dass durch die Verschmelzung die Erfüllung ihrer Forderung gefährdet wird."
    },
    {
      "date": "2025-07-07",
      "id": "114760",
      "original_text": "Registerbekanntmachung nach dem Umwandlungsgesetz\nHamburg Amtsgericht Hamburg HRB 80259\nJung von Matt MUSIC GmbH – Hamburg",
      "type": "Registerbekanntmachung nach dem Umwandlungsgesetz",
      "state": "Hamburg",
      "amtsgericht": "Amtsgericht Hamburg",
      "registernummer": "HRB 80259",
      "registerart": "HRB",
      "company_name": "Jung von Matt MUSIC GmbH",
      "company_seat": "Hamburg",
      "details": "07.07.2025 (Bekanntmachungsdatum)\n\nHamburg Amtsgericht Hamburg HRB 80259\nRegisterbekanntmachung nach dem Umwandlungsgesetz 30.06.2025 (Eintragungsdatum)\n\nJung von Matt MUSIC GmbH\nGesellschaft mit beschränkter Haftung\nHamburg\n\nAls nicht eingetragen wird bekannt gemacht:\nDen Gläubigern der an der Verschmelzung beteiligten Gesellschaften ist, wenn sie binnen sechs Monaten nach dem Tag, an dem die Eintragung der Verschmelzung in das Register des Sitzes desjenigen Rechtsträgers, dessen Gläubiger sie sind, nach § 19 Absatz 3 UmwG als bekannt gemacht gilt, ihren Anspruch nach Grund und Höhe schriftlich anmelden, Sicherheit zu leisten, soweit sie nicht Befriedigung verlangen können. Dieses Recht steht den Gläubigern jedoch nur zu, wenn sie glaubhaft machen, dass durch die Verschmelzung die Erfüllung ihrer Forderung gefährdet wird."
    },
    {
      "date": "2025-07-07",
      "id": "114761",
      "original_text": "Sonstige Registerbekanntmachung\nHamburg Amtsgericht Hamburg HRB 73071\nAlbis Leasing AG – Hamburg",
      "type": "Sonstige Registerbekanntmachung",
      "state": "Hamburg",
      "amtsgericht": "Amtsgericht Hamburg",
      "registernummer": "HRB 73071",
      "registerart": "HRB",
      "company_name": "Albis Leasing AG",
      "company_seat": "Hamburg",
      "details": "07.07.2025 (Bekanntmachungsdatum)\n\nHamburg Amtsgericht Hamburg HRB 73071\nSonstige Registerbekanntmachung\n\nAlbis Leasing AG\nAktiengesellschaft\nHamburg\n\nAls nicht eingetragen wird bekannt gemacht: Liste des Aufsichtsrats wurde eingereicht."
    },
    {
      "date": "2025-07-07",
      "id": "114762",
      "original_text": "Registerbekanntmachung nach dem Umwandlungsgesetz\nHamburg Amtsgericht Hamburg HRB 160487\nSKILL Vision GmbH – Hamburg",
      "type": "Registerbekanntmachung nach dem Umwandlungsgesetz",
      "state": "Hamburg",
      "amtsgericht": "Amtsgericht Hamburg",
      "registernummer": "HRB 160487",
      "registerart": "HRB",
      "company_name": "SKILL Vision GmbH",
      "company_seat": "Hamburg",
      "details": "07.07.2025 (Bekanntmachungsdatum)\n\nHamburg Amtsgericht Hamburg HRB 160487\nRegisterbekanntmachung nach dem Umwandlungsgesetz 30.06.2025 (Eintragungsdatum)\n\nSKILL Vision GmbH\nGesellschaft mit beschränkter Haftung\nHamburg\n\nAls nicht eingetragen wird bekannt gemacht:\nDen Gläubigern der an der Verschmelzung beteiligten Gesellschaften ist, wenn sie binnen sechs Monaten nach dem Tag, an dem die Eintragung der Verschmelzung in das Register des Sitzes desjenigen Rechtsträgers, dessen Gläubiger sie sind, nach § 19 Absatz 3 UmwG als bekannt gemacht gilt, ihren Anspruch nach Grund und Höhe schriftlich anmelden, Sicherheit zu leisten, soweit sie nicht Befriedigung verlangen können. Dieses Recht steht den Gläubigern jedoch nur zu, wenn sie glaubhaft machen, dass durch die Verschmelzung die Erfüllung ihrer Forderung gefährdet wird."
    },
    {
      "date": "2025-07-07",
      "id": "114763",
      "original_text": "Löschungsankündigung\nBerlin Amtsgericht Berlin (Charlottenburg) HRB 178044\nVIVRE CONCEPT Bauen GmbH – Berlin",
      "type": "Löschungsankündigung",
      "state": "Berlin",
      "amtsgericht": "Amtsgericht Berlin (Charlottenburg)",
      "registernummer": "HRB 178044",
      "registerart": "HRB",
      "company_name": "VIVRE CONCEPT Bauen GmbH",
      "company_seat": "Berlin",
      "details": "07.07.2025 (Bekanntmachungsdatum)\n\nBerlin Amtsgericht Berlin (Charlottenburg) HRB 178044\nLöschungsankündigung\n\nVIVRE CONCEPT Bauen GmbH\nGesellschaft mit beschränkter Haftung\nBerlin\n\nBei der nachstehenden Gesellschaft wird das Amtslöschungsverfahren gemäß § 394 FamFG eingeleitet. Widerspruchsfrist 6 Wochen"
    },
    {
      "date": "2025-07-07",
      "id": "114764",
      "original_text": "Registerbekanntmachung nach dem Umwandlungsgesetz\nBaden-Württemberg Amtsgericht Freiburg HRB 708039\nInuvet GmbH – Lörrach",
      "type": "Registerbekanntmachung nach dem Umwandlungsgesetz",
      "state": "Baden-Württemberg",
      "amtsgericht": "Amtsgericht Freiburg",
      "registernummer": "HRB 708039",
      "registerart": "HRB",
      "company_name": "Inuvet GmbH",
      "company_seat": "Lörrach",
      "details": "07.07.2025 (Bekanntmachungsdatum)\n\nBaden-Württemberg Amtsgericht Freiburg HRB 708039\nRegisterbekanntmachung nach dem Umwandlungsgesetz 07.07.2025 (Eintragungsdatum)\n\nInuvet GmbH\nGesellschaft mit beschränkter Haftung\nLörrach\n\nAls nicht eingetragen wird bekanntgemacht:\nDen Gläubigern der an der Verschmelzung beteiligten Rechtsträger (\"Inuvet GmbH\", Lörrach (Amtsgericht Freiburg i. Br. HRB 708039) und \"Plantax GmbH\", Lörrach (Amtsgericht Freiburg i. Br. HRB 728631) ) ist, wenn sie binnen sechs Monaten nach dem Tag, an dem die Eintragung der Verschmelzung in das Register des Sitzes desjenigen Rechtsträgers, dessen Gläubiger sie sind, nach § 19 Abs. 3 UmwG als bekanntgemacht gilt, ihren Anspruch nach Grund und Höhe schriftlich anmelden, Sicherheit zu leisten, soweit sie nicht Befriedigung verlangen können. Dieses Recht steht den Gläubigern jedoch nur zu, wenn sie glaubhaft machen, dass durch die Verschmelzung die Erfüllung ihrer Forderung gefährdet wird."
    },
    {
      "date": "2025-07-07",
      "id": "114765",
      "original_text": "Registerbekanntmachung nach dem Umwandlungsgesetz\nNiedersachsen Amtsgericht Hannover HRB 216599\nEuropean Carbon Fiber GmbH – Hannover",
      "type": "Registerbekanntmachung nach dem Umwandlungsgesetz",
      "state": "Niedersachsen",
      "amtsgericht": "Amtsgericht Hannover",
      "registernummer": "HRB 216599",
      "registerart": "HRB",
      "company_name": "European Carbon Fiber GmbH",
      "company_seat": "Hannover",
      "details": "07.07.2025 (Bekanntmachungsdatum)\n\nNiedersachsen Amtsgericht Hannover HRB 216599\nRegisterbekanntmachung nach dem Umwandlungsgesetz 07.07.2025 (Eintragungsdatum)\n\nEuropean Carbon Fiber GmbH\nGesellschaft mit beschränkter Haftung\nHannover\n\nDen Gläubigern der an der Verschmelzung beteiligten Rechtsträger ist, wenn sie binnen sechs Monaten nach dem Tag, an dem die Eintragung der Verschmelzung in das Register des Sitzes desjenigen Rechtsträgers, dessen Gläubiger sie sind, nach § 19  Abs.  3 UmwG als bekannt gemacht gilt, ihren Anspruch nach Grund und Höhe schriftlich anmelden, Sicherheit zu leisten, soweit sie nicht Befriedigung verlangen können. Dieses Recht steht den Gläubigern jedoch nur zu, wenn sie glaubhaft machen, dass durch die Verschmelzung die Erfüllung der Forderung gefährdet wird."
    },
    {
      "date": "2025-07-07",
      "id": "114766",
      "original_text": "Einreichung neuer Dokumente\nNiedersachsen Amtsgericht Hannover HRB 6580\nTUI AG – Hannover und Berlin",
      "type": "Einreichung neuer Dokumente",
      "state": "Niedersachsen",
      "amtsgericht": "Amtsgericht Hannover",
      "registernummer": "HRB 6580",
      "registerart": "HRB",
      "company_name": "TUI AG",
      "company_seat": "Hannover und Berlin",
      "details": "07.07.2025 (Bekanntmachungsdatum)\n\nNiedersachsen Amtsgericht Hannover HRB 6580\nEinreichung neuer Dokumente\n\nTUI AG\nAktiengesellschaft\nHannover und Berlin\n\nDie Liste der Mitglieder des Aufsichtsrats wurde beim Registergericht eingereicht."
    },
    {
      "date": "2025-07-07",
      "id": "114767",
      "original_text": "Einreichung neuer Dokumente\nBerlin Amtsgericht Berlin (Charlottenburg) HRB 321\nTUI AG – Berlin und Hannover",
      "type": "Einreichung neuer Dokumente",
      "state": "Berlin",
      "amtsgericht": "Amtsgericht Berlin (Charlottenburg)",
      "registernummer": "HRB 321",
      "registerart": "HRB",
      "company_name": "TUI AG",
      "company_seat": "Berlin und Hannover",
      "details": "07.07.2025 (Bekanntmachungsdatum)\n\nBerlin Amtsgericht Berlin (Charlottenburg) HRB 321\nEinreichung neuer Dokumente\n\nTUI AG\nAktiengesellschaft\nBerlin und Hannover\n\nAls nicht eingetragen wird veröffentlicht: Es wurde eine neue Liste der Aufsichtsratsmitglieder eingereicht (§ 106 AktG)."
    },
    {
      "date": "2025-07-07",
      "id": "114768",
      "original_text": "Registerbekanntmachung nach dem Umwandlungsgesetz\nBrandenburg Amtsgericht Frankfurt/Oder GnR 212\nPutzteufel eG – Ahrensfelde",
      "type": "Registerbekanntmachung nach dem Umwandlungsgesetz",
      "state": "Brandenburg",
      "amtsgericht": "Amtsgericht Frankfurt/Oder",
      "registernummer": "GnR 212",
      "registerart": "GnR",
      "company_name": "Putzteufel eG",
      "company_seat": "Ahrensfelde",
      "details": "07.07.2025 (Bekanntmachungsdatum)\n\nBrandenburg Amtsgericht Frankfurt/Oder GnR 212\nRegisterbekanntmachung nach dem Umwandlungsgesetz 11.06.2025 (Eintragungsdatum)\n\nPutzteufel eG\neingetragene Genossenschaft\nAhrensfelde\n\nZu Eintragungsnummer 6 vom 11.06.2025 wird als nicht eingetragen veröffentlicht: Als nicht eingetragen wird veröffentlicht:\nDen Gläubigern der an der Umwandlung beteiligten Rechtsträger ist, wenn sie binnen sechs Monaten nach dem Tag, an dem die Eintragung der Umwandlung in das Register des Sitzes desjenigen Rechtsträgers, dessen Gläubiger sie sind, als bekannt gemacht gilt, ihren Anspruch nach Grund und Höhe schriftlich anmelden, Sicherheit zu leisten, soweit sie nicht Befriedigung verlangen können. Dieses Recht steht den Gläubigern jedoch nur zu, wenn sie glaubhaft machen, dass durch die Umwandlung die Erfüllung ihrer Forderung gefährdet wird"
    },
    {
      "date": "2025-07-07",
      "id": "114769",
      "original_text": "Löschungsankündigung\nSaarland Amtsgericht Saarbrücken HRB 105949\nEUROTA Holding GmbH – Saarbrücken",
      "type": "Löschungsankündigung",
      "state": "Saarland",
      "amtsgericht": "Amtsgericht Saarbrücken",
      "registernummer": "HRB 105949",
      "registerart": "HRB",
      "company_name": "EUROTA Holding GmbH",
      "company_seat": "Saarbrücken",
      "details": "07.07.2025 (Bekanntmachungsdatum)\n\nSaarland Amtsgericht Saarbrücken HRB 105949\nLöschungsankündigung\n\nEUROTA Holding GmbH\nGesellschaft mit beschränkter Haftung\nSaarbrücken\n\nEs ist beabsichtigt, die Gesellschaft von Amts wegen gemäß § 394 FamFG wegen Vermögenslosigkeit zu löschen.\nGegen die Löschung von Amts wegen ist das Rechtsmittel des Widerspruchs statthaft. Der Widerspruch ist binnen einer Frist zwei Monaten beginnend mit dem Tag dieser Veröffentlichung durch Einreichen eines Widerspruchsschreibens -schriftlich oder zur Niederschrift der Geschäftsstelle beim Amtsgericht Saarbrücken, -zentrales Handelsregister-, Mainzerstr.178, 66121 Saarbrücken einzulegen.\nDer Widerspruch muss die Bezeichnung der angefochtenen Löschungsankündigung enthalten sowie die Erklärung, dass Widerspruch eingelegt wird. Er ist vom Widerspruchsführer oder seinem Bevollmächtigten zu unterzeichnen.\nDas Widerspruchsschreiben kann auch in der Form eines elektronischen Dokumentes eingereicht werden, das mit einer qualifizierten elektronischen Signatur nach dem Signaturgesetz versehen sein muss (§§ 14 Abs. 2 FamFG, 130a, 298 ZPO)."
    },
    {
      "date": "2025-07-07",
      "id": "114770",
      "original_text": "Sonstige Registerbekanntmachung\nHamburg Amtsgericht Hamburg HRB 59437\nHafenCity Hamburg GmbH – Hamburg",
      "type": "Sonstige Registerbekanntmachung",
      "state": "Hamburg",
      "amtsgericht": "Amtsgericht Hamburg",
      "registernummer": "HRB 59437",
      "registerart": "HRB",
      "company_name": "HafenCity Hamburg GmbH",
      "company_seat": "Hamburg",
      "details": "07.07.2025 (Bekanntmachungsdatum)\n\nHamburg Amtsgericht Hamburg HRB 59437\nSonstige Registerbekanntmachung\n\nHafenCity Hamburg GmbH\nGesellschaft mit beschränkter Haftung\nHamburg\n\nAls nicht eingetragen wird bekannt gemacht: Liste des Aufsichtsrats wurde eingereicht."
    },
    {
      "date": "2025-07-07",
      "id": "114771",
      "original_text": "Einreichung neuer Dokumente\nBaden-Württemberg Amtsgericht Stuttgart HRB 225217\nBITE Business Information Technology AG – Filderstadt",
      "type": "Einreichung neuer Dokumente",
      "state": "Baden-Württemberg",
      "amtsgericht": "Amtsgericht Stuttgart",
      "registernummer": "HRB 225217",
      "registerart": "HRB",
      "company_name": "BITE Business Information Technology AG",
      "company_seat": "Filderstadt",
      "details": "07.07.2025 (Bekanntmachungsdatum)\n\nBaden-Württemberg Amtsgericht Stuttgart HRB 225217\nEinreichung neuer Dokumente\n\nBITE Business Information Technology AG\nAktiengesellschaft\nFilderstadt\n\nDie Gesellschaft hat am 07.07.2025 die Liste über die Zusammensetzung des Aufsichtsrats zum Handelsregister eingereicht."
    },
    {
      "date": "2025-07-07",
      "id": "114772",
      "original_text": "Registerbekanntmachung nach dem Umwandlungsgesetz\nBerlin Amtsgericht Berlin (Charlottenburg) HRB 233711\nCosmo MidCo 6 (MBG Schwelm) GmbH – Berlin",
      "type": "Registerbekanntmachung nach dem Umwandlungsgesetz",
      "state": "Berlin",
      "amtsgericht": "Amtsgericht Berlin (Charlottenburg)",
      "registernummer": "HRB 233711",
      "registerart": "HRB",
      "company_name": "Cosmo MidCo 6 (MBG Schwelm) GmbH",
      "company_seat": "Berlin",
      "details": "07.07.2025 (Bekanntmachungsdatum)\n\nBerlin Amtsgericht Berlin (Charlottenburg) HRB 233711\nRegisterbekanntmachung nach dem Umwandlungsgesetz 03.07.2025 (Eintragungsdatum)\n\nCosmo MidCo 6 (MBG Schwelm) GmbH\nGesellschaft mit beschränkter Haftung\nBerlin\n\nZu Eintragungsnummer 10 vom 03.07.2025 wird als nicht eingetragen veröffentlicht: Den Gläubigern der an der Spaltung beteiligten Rechtsträger ist, wenn sie binnen sechs Monaten nach dem Tag, an dem die Eintragung der Spaltung in das Register des Sitzes desjenigen Rechtsträgers, dessen Gläubiger sie sind, als bekannt gemacht gilt, ihren Anspruch nach Grund und Höhe schriftlich anmelden, Sicherheit zu leisten, soweit sie nicht Befriedigung verlangen können. Dieses Recht steht den Gläubigern jedoch nur zu, wenn sie glaubhaft machen, dass durch die Spaltung die Erfüllung ihrer Forderung gefährdet wird. Das Recht, Sicherheitsleistung zu verlangen, steht Gläubigern nicht zu, die im Falle der Insolvenz ein Recht auf vorzugsweise Befriedigung aus einer Deckungsmasse haben, die nach gesetzlicher Vorschrift zu ihrem Schutz errichtet und staatlich überwacht ist."
    },
    {
      "date": "2025-07-07",
      "id": "114773",
      "original_text": "Registerbekanntmachung nach dem Umwandlungsgesetz\nBerlin Amtsgericht Berlin (Charlottenburg) HRB 233684\nCosmo MidCo 1 (WBR) GmbH – Berlin",
      "type": "Registerbekanntmachung nach dem Umwandlungsgesetz",
      "state": "Berlin",
      "amtsgericht": "Amtsgericht Berlin (Charlottenburg)",
      "registernummer": "HRB 233684",
      "registerart": "HRB",
      "company_name": "Cosmo MidCo 1 (WBR) GmbH",
      "company_seat": "Berlin",
      "details": "07.07.2025 (Bekanntmachungsdatum)\n\nBerlin Amtsgericht Berlin (Charlottenburg) HRB 233684\nRegisterbekanntmachung nach dem Umwandlungsgesetz 03.07.2025 (Eintragungsdatum)\n\nCosmo MidCo 1 (WBR) GmbH\nGesellschaft mit beschränkter Haftung\nBerlin\n\nZu Eintragungsnummer 9 vom 03.07.2025 wird als nicht eingetragen veröffentlicht: Den Gläubigern der an der Spaltung beteiligten Rechtsträger ist, wenn sie binnen sechs Monaten nach dem Tag, an dem die Eintragung der Spaltung in das Register des Sitzes desjenigen Rechtsträgers, dessen Gläubiger sie sind, als bekannt gemacht gilt, ihren Anspruch nach Grund und Höhe schriftlich anmelden, Sicherheit zu leisten, soweit sie nicht Befriedigung verlangen können. Dieses Recht steht den Gläubigern jedoch nur zu, wenn sie glaubhaft machen, dass durch die Spaltung die Erfüllung ihrer Forderung gefährdet wird. Das Recht, Sicherheitsleistung zu verlangen, steht Gläubigern nicht zu, die im Falle der Insolvenz ein Recht auf vorzugsweise Befriedigung aus einer Deckungsmasse haben, die nach gesetzlicher Vorschrift zu ihrem Schutz errichtet und staatlich überwacht ist."
    },
    {
      "date": "2025-07-07",
      "id": "114774",
      "original_text": "Einreichung neuer Dokumente\nBerlin Amtsgericht Berlin (Charlottenburg) HRB 133814\nBEOS AG – Berlin",
      "type": "Einreichung neuer Dokumente",
      "state": "Berlin",
      "amtsgericht": "Amtsgericht Berlin (Charlottenburg)",
      "registernummer": "HRB 133814",
      "registerart": "HRB",
      "company_name": "BEOS AG",
      "company_seat": "Berlin",
      "details": "07.07.2025 (Bekanntmachungsdatum)\n\nBerlin Amtsgericht Berlin (Charlottenburg) HRB 133814\nEinreichung neuer Dokumente\n\nBEOS AG\nAktiengesellschaft\nBerlin\n\nAls nicht eingetragen wird veröffentlicht: Es wurde eine neue Liste der Aufsichtsratsmitglieder eingereicht (§ 106 AktG)."
    },
    {
      "date": "2025-07-07",
      "id": "114775",
      "original_text": "Registerbekanntmachung nach dem Umwandlungsgesetz\nBaden-Württemberg Amtsgericht Stuttgart HRB 782263\nAUDERE GC GmbH – Fellbach",
      "type": "Registerbekanntmachung nach dem Umwandlungsgesetz",
      "state": "Baden-Württemberg",
      "amtsgericht": "Amtsgericht Stuttgart",
      "registernummer": "HRB 782263",
      "registerart": "HRB",
      "company_name": "AUDERE GC GmbH",
      "company_seat": "Fellbach",
      "details": "07.07.2025 (Bekanntmachungsdatum)\n\nBaden-Württemberg Amtsgericht Stuttgart HRB 782263\nRegisterbekanntmachung nach dem Umwandlungsgesetz 07.07.2025 (Eintragungsdatum)\n\nAUDERE GC GmbH\nGesellschaft mit beschränkter Haftung\nFellbach\n\nAls nicht eingetragen wird bekanntgemacht:\nDen Gläubigern der an der Verschmelzung beteiligten Rechtsträger ist, wenn sie binnen sechs Monaten nach dem Tag, an dem die Eintragung der Verschmelzung in das Register des Sitzes desjenigen Rechtsträgers, dessen Gläubiger sie sind, nach § 19 Abs. 3 UmwG als bekanntgemacht gilt, ihren Anspruch nach Grund und Höhe schriftlich anmelden, Sicherheit zu leisten, soweit sie nicht Befriedigung verlangen können. Dieses Recht steht den Gläubigern jedoch nur zu, wenn sie glaubhaft machen, dass durch die Verschmelzung die Erfüllung ihrer Forderung gefährdet wird."
    },
    {
      "date": "2025-07-07",
      "id": "114776",
      "original_text": "Registerbekanntmachung nach dem Umwandlungsgesetz\nBaden-Württemberg Amtsgericht Stuttgart HRB 784642\naudere Gesellschaftsimmobilien Invest No. 5 GmbH – Fellbach",
      "type": "Registerbekanntmachung nach dem Umwandlungsgesetz",
      "state": "Baden-Württemberg",
      "amtsgericht": "Amtsgericht Stuttgart",
      "registernummer": "HRB 784642",
      "registerart": "HRB",
      "company_name": "audere Gesellschaftsimmobilien Invest No. 5 GmbH",
      "company_seat": "Fellbach",
      "details": "07.07.2025 (Bekanntmachungsdatum)\n\nBaden-Württemberg Amtsgericht Stuttgart HRB 784642\nRegisterbekanntmachung nach dem Umwandlungsgesetz 07.07.2025 (Eintragungsdatum)\n\naudere Gesellschaftsimmobilien Invest No. 5 GmbH\nGesellschaft mit beschränkter Haftung\nFellbach\n\nAls nicht eingetragen wird bekanntgemacht: Den Gläubigern der an der Verschmelzung beteiligten Rechtsträger ist, wenn sie binnen sechs Monaten nach dem Tag, an dem die Eintragung der Verschmelzung in das Register des Sitzes desjenigen Rechtsträgers, dessen Gläubiger sie sind, nach § 19 Abs. 3 UmwG als bekanntgemacht gilt, ihren Anspruch nach Grund und Höhe schriftlich anmelden, Sicherheit zu leisten, soweit sie nicht Befriedigung verlangen können. Dieses Recht steht den Gläubigern jedoch nur zu, wenn sie glaubhaft machen, dass durch die Verschmelzung die Erfüllung ihrer Forderung gefährdet wird."
    },
    {
      "date": "2025-07-07",
      "id": "114777",
      "original_text": "Löschungsankündigung\nBrandenburg Amtsgericht Neuruppin HRB 14730\nQasva GmbH – Hennigsdorf",
      "type": "Löschungsankündigung",
      "state": "Brandenburg",
      "amtsgericht": "Amtsgericht Neuruppin",
      "registernummer": "HRB 14730",
      "registerart": "HRB",
      "company_name": "Qasva GmbH",
      "company_seat": "Hennigsdorf",
      "details": "07.07.2025 (Bekanntmachungsdatum)\n\nBrandenburg Amtsgericht Neuruppin HRB 14730\nLöschungsankündigung\n\nQasva GmbH\nGesellschaft mit beschränkter Haftung\nHennigsdorf\n\nBei der nachstehenden Gesellschaft wird das Amtslöschungsverfahren gemäß § 394 FamFG eingeleitet.\nWiderspruchsfrist: 1 Monat"
    },
    {
      "date": "2025-07-07",
      "id": "114778",
      "original_text": "Registerbekanntmachung nach dem Umwandlungsgesetz\nBerlin Amtsgericht Berlin (Charlottenburg) HRB 192075\nGuerilla Workers UG (haftungsbeschränkt) – Berlin",
      "type": "Registerbekanntmachung nach dem Umwandlungsgesetz",
      "state": "Berlin",
      "amtsgericht": "Amtsgericht Berlin (Charlottenburg)",
      "registernummer": "HRB 192075",
      "registerart": "HRB",
      "company_name": "Guerilla Workers UG (haftungsbeschränkt)",
      "company_seat": "Berlin",
      "details": "07.07.2025 (Bekanntmachungsdatum)\n\nBerlin Amtsgericht Berlin (Charlottenburg) HRB 192075\nRegisterbekanntmachung nach dem Umwandlungsgesetz 04.07.2025 (Eintragungsdatum)\n\nGuerilla Workers UG (haftungsbeschränkt)\nGesellschaft mit beschränkter Haftung\nBerlin\n\nZu Eintragungsnummer 2 vom 04.07.2025 wird als nicht eingetragen veröffentlicht: Den Gläubigern der an der Verschmelzung beteiligten Rechtsträger ist, wenn sie binnen sechs Monaten nach dem Tag, an dem die Eintragung der Verschmelzung in das Register des Sitzes desjenigen Rechtsträgers, dessen Gläubiger sie sind, als bekannt gemacht gilt, ihren Anspruch nach Grund und Höhe schriftlich anmelden, Sicherheit zu leisten, soweit sie nicht Befriedigung verlangen können. Dieses Recht steht den Gläubigern jedoch nur zu, wenn sie glaubhaft machen, dass durch die Verschmelzung die Erfüllung ihrer Forderung gefährdet wird. Das Recht, Sicherheitsleistung zu verlangen, steht Gläubigern nicht zu, die im Falle der Insolvenz ein Recht auf vorzugsweise Befriedigung aus einer Deckungsmasse haben, die nach gesetzlicher Vorschrift zu ihrem Schutz errichtet und staatlich überwacht ist."
    },
    {
      "date": "2025-07-07",
      "id": "114779",
      "original_text": "Löschungsankündigung\nThüringen Amtsgericht Jena HRB 210385\nINFORM Beteiligungs GmbH – Gera",
      "type": "Löschungsankündigung",
      "state": "Thüringen",
      "amtsgericht": "Amtsgericht Jena",
      "registernummer": "HRB 210385",
      "registerart": "HRB",
      "company_name": "INFORM Beteiligungs GmbH",
      "company_seat": "Gera",
      "details": "07.07.2025 (Bekanntmachungsdatum)\n\nThüringen Amtsgericht Jena HRB 210385\nLöschungsankündigung\n\nINFORM Beteiligungs GmbH\nGesellschaft mit beschränkter Haftung\nGera\n\nDas Registergericht beabsichtigt, die im Handelsregister eingetragene Gesellschaft wegen Vermögenslosigkeit nach § 394 FamFG von Amts wegen zu löschen. Die Frist zur Erhebung eines Widerspruchs gegen die beabsichtigte Löschung wird auf 6 Wochen festgesetzt."
    },
    {
      "date": "2025-07-07",
      "id": "114780",
      "original_text": "Registerbekanntmachung nach dem Umwandlungsgesetz\nThüringen Amtsgericht Jena HRA 505277\nFahrdienst Esche GmbH & Co. KG – Sömmerda",
      "type": "Registerbekanntmachung nach dem Umwandlungsgesetz",
      "state": "Thüringen",
      "amtsgericht": "Amtsgericht Jena",
      "registernummer": "HRA 505277",
      "registerart": "HRA",
      "company_name": "Fahrdienst Esche GmbH & Co. KG",
      "company_seat": "Sömmerda",
      "details": "07.07.2025 (Bekanntmachungsdatum)\n\nThüringen Amtsgericht Jena HRA 505277\nRegisterbekanntmachung nach dem Umwandlungsgesetz 07.07.2025 (Eintragungsdatum)\n\nFahrdienst Esche GmbH & Co. KG\nKommanditgesellschaft\nSömmerda\n\nNicht eingetragen: Den Gläubigern des formwechselnden  Rechtsträgers, ist wenn sie binnen sechs Monaten nach dem Tag, an dem die Eintragung des Formwechsels nach § 201 UmwG als bekanntgemacht gilt, ihren Anspruch nach Grund und Höhe schriftlich anmelden, Sicherheit zu leisten, soweit sie nicht Befriedigung verlangen können. Dieses Recht steht ihnen jedoch nur zu, wenn sie glaubhaft machen, daß durch den Formwechsel die Erfüllung ihrer Forderung gefährdet wird."
    },
    {
      "date": "2025-07-07",
      "id": "114781",
      "original_text": "Sonstige Registerbekanntmachung\nBaden-Württemberg Amtsgericht Ulm HRB 748646\nTOX SE – Weingarten",
      "type": "Sonstige Registerbekanntmachung",
      "state": "Baden-Württemberg",
      "amtsgericht": "Amtsgericht Ulm",
      "registernummer": "HRB 748646",
      "registerart": "HRB",
      "company_name": "TOX SE",
      "company_seat": "Weingarten",
      "details": "07.07.2025 (Bekanntmachungsdatum)\n\nBaden-Württemberg Amtsgericht Ulm HRB 748646\nSonstige Registerbekanntmachung\n\nTOX SE\nEuropäische Aktiengesellschaft (SE)\nWeingarten\n\nDie Gesellschaft hat am 30.06.2025 die Liste über die Zusammensetzung des Aufsichtsrats zum Handelsregister eingereicht."
    },
    {
      "date": "2025-07-07",
      "id": "114782",
      "original_text": "Registerbekanntmachung nach dem Umwandlungsgesetz\nBerlin Amtsgericht Berlin (Charlottenburg) HRB 122760\nGuerilla Production Berlin GmbH – Berlin",
      "type": "Registerbekanntmachung nach dem Umwandlungsgesetz",
      "state": "Berlin",
      "amtsgericht": "Amtsgericht Berlin (Charlottenburg)",
      "registernummer": "HRB 122760",
      "registerart": "HRB",
      "company_name": "Guerilla Production Berlin GmbH",
      "company_seat": "Berlin",
      "details": "07.07.2025 (Bekanntmachungsdatum)\n\nBerlin Amtsgericht Berlin (Charlottenburg) HRB 122760\nRegisterbekanntmachung nach dem Umwandlungsgesetz 04.07.2025 (Eintragungsdatum)\n\nGuerilla Production Berlin GmbH\nGesellschaft mit beschränkter Haftung\nBerlin\n\nZu Eintragungsnummer 8 vom 04.07.2025 wird als nicht eingetragen veröffentlicht: Den Gläubigern der an der Verschmelzung beteiligten Rechtsträger ist, wenn sie binnen sechs Monaten nach dem Tag, an dem die Eintragung der Verschmelzung in das Register des Sitzes desjenigen Rechtsträgers, dessen Gläubiger sie sind, als bekannt gemacht gilt, ihren Anspruch nach Grund und Höhe schriftlich anmelden, Sicherheit zu leisten, soweit sie nicht Befriedigung verlangen können. Dieses Recht steht den Gläubigern jedoch nur zu, wenn sie glaubhaft machen, dass durch die Verschmelzung die Erfüllung ihrer Forderung gefährdet wird. Das Recht, Sicherheitsleistung zu verlangen, steht Gläubigern nicht zu, die im Falle der Insolvenz ein Recht auf vorzugsweise Befriedigung aus einer Deckungsmasse haben, die nach gesetzlicher Vorschrift zu ihrem Schutz errichtet und staatlich überwacht ist."
    },
    {
      "date": "2025-07-07",
      "id": "114783",
      "original_text": "Einreichung neuer Dokumente\nBaden-Württemberg Amtsgericht Mannheim HRB 7501\nMannheimer Versicherung Aktiengesellschaft – Mannheim",
      "type": "Einreichung neuer Dokumente",
      "state": "Baden-Württemberg",
      "amtsgericht": "Amtsgericht Mannheim",
      "registernummer": "HRB 7501",
      "registerart": "HRB",
      "company_name": "Mannheimer Versicherung Aktiengesellschaft",
      "company_seat": "Mannheim",
      "details": "07.07.2025 (Bekanntmachungsdatum)\n\nBaden-Württemberg Amtsgericht Mannheim HRB 7501\nEinreichung neuer Dokumente\n\nMannheimer Versicherung Aktiengesellschaft\nAktiengesellschaft\nMannheim\n\nDie Gesellschaft hat am 04.07.2025 die Liste über die Zusammensetzung des Aufsichtsrats zum Handelsregister eingereicht."
    },
    {
      "date": "2025-07-07",
      "id": "114784",
      "original_text": "Registerbekanntmachung nach dem Umwandlungsgesetz\nSchleswig-Holstein Amtsgericht Kiel HRB 28246\nBio Power Service GmbH – Bordesholm",
      "type": "Registerbekanntmachung nach dem Umwandlungsgesetz",
      "state": "Schleswig-Holstein",
      "amtsgericht": "Amtsgericht Kiel",
      "registernummer": "HRB 28246",
      "registerart": "HRB",
      "company_name": "Bio Power Service GmbH",
      "company_seat": "Bordesholm",
      "details": "07.07.2025 (Bekanntmachungsdatum)\n\nSchleswig-Holstein Amtsgericht Kiel HRB 28246\nRegisterbekanntmachung nach dem Umwandlungsgesetz 03.07.2025 (Eintragungsdatum)\n\nBio Power Service GmbH\nGesellschaft mit beschränkter Haftung\nBordesholm\n\nZu Eintragungsnummer 2 vom 03.07.2025 wird als nicht eingetragen veröffentlicht: Den Gläubigern der an der Verschmelzung beteiligten Rechtsträger ist, wenn sie binnen sechs Monaten nach dem Tag, an dem die Eintragung der Verschmelzung in das Register des Sitzes desjenigen Rechtsträgers, dessen Gläubiger sie sind, nach § 19 Abs. 3 UmwG bekannt gemacht worden ist, ihren Anspruch nach Grund und Höhe schriftlich anmelden, Sicherheit zu leisten, soweit sie nicht Befriedigung verlangen können. Dieses Recht steht den Gläubigern jedoch nur zu, wenn sie glaubhaft machen, dass durch die Verschmelzung die Erfüllung ihrer Forderung gefährdet wird."
    },
    {
      "date": "2025-07-07",
      "id": "114785",
      "original_text": "Löschungsankündigung\nBerlin Amtsgericht Berlin (Charlottenburg) HRB 237762\nCry Bau GmbH – Berlin",
      "type": "Löschungsankündigung",
      "state": "Berlin",
      "amtsgericht": "Amtsgericht Berlin (Charlottenburg)",
      "registernummer": "HRB 237762",
      "registerart": "HRB",
      "company_name": "Cry Bau GmbH",
      "company_seat": "Berlin",
      "details": "07.07.2025 (Bekanntmachungsdatum)\n\nBerlin Amtsgericht Berlin (Charlottenburg) HRB 237762\nLöschungsankündigung\n\nCry Bau GmbH\nGesellschaft mit beschränkter Haftung\nBerlin\n\nBei der nachstehenden Gesellschaft wird das Amtslöschungsverfahren gemäß § 394 FamFG eingeleitet. Widerspruchsfrist 6 Wochen"
    },
    {
      "date": "2025-07-07",
      "id": "114786",
      "original_text": "Löschungsankündigung\nBerlin Amtsgericht Berlin (Charlottenburg) HRB 186441\nSteffen Geske Management UG (haftungsbeschränkt) – Berlin",
      "type": "Löschungsankündigung",
      "state": "Berlin",
      "amtsgericht": "Amtsgericht Berlin (Charlottenburg)",
      "registernummer": "HRB 186441",
      "registerart": "HRB",
      "company_name": "Steffen Geske Management UG (haftungsbeschränkt)",
      "company_seat": "Berlin",
      "details": "07.07.2025 (Bekanntmachungsdatum)\n\nBerlin Amtsgericht Berlin (Charlottenburg) HRB 186441\nLöschungsankündigung\n\nSteffen Geske Management UG (haftungsbeschränkt)\nGesellschaft mit beschränkter Haftung\nBerlin\n\nBei der nachstehenden Gesellschaft wird das Amtslöschungsverfahren gemäß § 394 FamFG eingeleitet. Widerspruchsfrist 6 Wochen"
    },
    {
      "date": "2025-07-07",
      "id": "114787",
      "original_text": "Registerbekanntmachung nach dem Umwandlungsgesetz\nBerlin Amtsgericht Berlin (Charlottenburg) HRB 145893\n7berge GmbH – Berlin",
      "type": "Registerbekanntmachung nach dem Umwandlungsgesetz",
      "state": "Berlin",
      "amtsgericht": "Amtsgericht Berlin (Charlottenburg)",
      "registernummer": "HRB 145893",
      "registerart": "HRB",
      "company_name": "7berge GmbH",
      "company_seat": "Berlin",
      "details": "07.07.2025 (Bekanntmachungsdatum)\n\nBerlin Amtsgericht Berlin (Charlottenburg) HRB 145893\nRegisterbekanntmachung nach dem Umwandlungsgesetz 04.07.2025 (Eintragungsdatum)\n\n7berge GmbH\nGesellschaft mit beschränkter Haftung\nBerlin\n\nZu Eintragungsnummer 4 vom 04.07.2025 wird als nicht eingetragen veröffentlicht:\nDen Gläubigern der an der Verschmelzung beteiligten Rechtsträger ist, wenn sie binnen sechs Monaten nach dem Tag, an dem die Eintragung der Verschmelzung in das Register des Sitzes desjenigen Rechtsträgers, dessen Gläubiger sie sind, als bekannt gemacht gilt, ihren Anspruch nach Grund und Höhe schriftlich anmelden, Sicherheit zu leisten, soweit sie nicht Befriedigung verlangen können. Dieses Recht steht den Gläubigern jedoch nur zu, wenn sie glaubhaft machen, dass durch die Verschmelzung die Erfüllung ihrer Forderung gefährdet wird. Das Recht, Sicherheitsleistung zu verlangen, steht Gläubigern nicht zu, die im Falle der Insolvenz ein Recht auf vorzugsweise Befriedigung aus einer Deckungsmasse haben, die nach gesetzlicher Vorschrift zu ihrem Schutz errichtet und staatlich überwacht ist."
    },
    {
      "date": "2025-07-07",
      "id": "114788",
      "original_text": "Registerbekanntmachung nach dem Umwandlungsgesetz\nBerlin Amtsgericht Berlin (Charlottenburg) HRB 195672\nTigerMilk.Education GmbH – Berlin",
      "type": "Registerbekanntmachung nach dem Umwandlungsgesetz",
      "state": "Berlin",
      "amtsgericht": "Amtsgericht Berlin (Charlottenburg)",
      "registernummer": "HRB 195672",
      "registerart": "HRB",
      "company_name": "TigerMilk.Education GmbH",
      "company_seat": "Berlin",
      "details": "07.07.2025 (Bekanntmachungsdatum)\n\nBerlin Amtsgericht Berlin (Charlottenburg) HRB 195672\nRegisterbekanntmachung nach dem Umwandlungsgesetz 04.07.2025 (Eintragungsdatum)\n\nTigerMilk.Education GmbH\nGesellschaft mit beschränkter Haftung\nBerlin\n\nZu Eintragungsnummer 2 vom 04.07.2025 wird als nicht eingetragen veröffentlicht:\nDen Gläubigern der an der Verschmelzung beteiligten Rechtsträger ist, wenn sie binnen sechs Monaten nach dem Tag, an dem die Eintragung der Verschmelzung in das Register des Sitzes desjenigen Rechtsträgers, dessen Gläubiger sie sind, als bekannt gemacht gilt, ihren Anspruch nach Grund und Höhe schriftlich anmelden, Sicherheit zu leisten, soweit sie nicht Befriedigung verlangen können. Dieses Recht steht den Gläubigern jedoch nur zu, wenn sie glaubhaft machen, dass durch die Verschmelzung die Erfüllung ihrer Forderung gefährdet wird. Das Recht, Sicherheitsleistung zu verlangen, steht Gläubigern nicht zu, die im Falle der Insolvenz ein Recht auf vorzugsweise Befriedigung aus einer Deckungsmasse haben, die nach gesetzlicher Vorschrift zu ihrem Schutz errichtet und staatlich überwacht ist."
    },
    {
      "date": "2025-07-07",
      "id": "114789",
      "original_text": "Löschungsankündigung\nBerlin Amtsgericht Berlin (Charlottenburg) HRB 223435\nWelter GmbH – Berlin",
      "type": "Löschungsankündigung",
      "state": "Berlin",
      "amtsgericht": "Amtsgericht Berlin (Charlottenburg)",
      "registernummer": "HRB 223435",
      "registerart": "HRB",
      "company_name": "Welter GmbH",
      "company_seat": "Berlin",
      "details": "07.07.2025 (Bekanntmachungsdatum)\n\nBerlin Amtsgericht Berlin (Charlottenburg) HRB 223435\nLöschungsankündigung\n\nWelter GmbH\nGesellschaft mit beschränkter Haftung\nBerlin\n\nBei der nachstehenden Gesellschaft wird das Amtslöschungsverfahren gemäß § 394 FamFG eingeleitet. Widerspruchsfrist 6 Wochen"
    },
    {
      "date": "2025-07-07",
      "id": "114790",
      "original_text": "Registerbekanntmachung nach dem Umwandlungsgesetz\nBaden-Württemberg Amtsgericht Stuttgart HRB 727303\nSchiMo GmbH – Bempflingen",
      "type": "Registerbekanntmachung nach dem Umwandlungsgesetz",
      "state": "Baden-Württemberg",
      "amtsgericht": "Amtsgericht Stuttgart",
      "registernummer": "HRB 727303",
      "registerart": "HRB",
      "company_name": "SchiMo GmbH",
      "company_seat": "Bempflingen",
      "details": "07.07.2025 (Bekanntmachungsdatum)\n\nBaden-Württemberg Amtsgericht Stuttgart HRB 727303\nRegisterbekanntmachung nach dem Umwandlungsgesetz 07.07.2025 (Eintragungsdatum)\n\nSchiMo GmbH\nGesellschaft mit beschränkter Haftung\nBempflingen\n\nDen Gläubigern der an der Verschmelzung beteiligten Rechtsträger ist, wenn sie binnen sechs Monaten nach dem Tag, an dem die Eintragung der Verschmelzung in das Register des Sitzes desjenigen Rechtsträgers, dessen Gläubiger sie sind, nach § 19 Abs. 3 UmwG als bekanntgemacht gilt, ihren Anspruch nach Grund und Höhe schriftlich anmelden, Sicherheit zu leisten, soweit sie nicht Befriedigung verlangen können. Dieses Recht steht den Gläubigern jedoch nur zu, wenn sie glaubhaft machen, dass durch die Verschmelzung die Erfüllung ihrer Forderung gefährdet wird."
    },
    {
      "date": "2025-07-07",
      "id": "114791",
      "original_text": "Löschungsankündigung\nBerlin Amtsgericht Berlin (Charlottenburg) HRB 260400\nPRB-Haus UG (haftungsbeschränkt) – Berlin",
      "type": "Löschungsankündigung",
      "state": "Berlin",
      "amtsgericht": "Amtsgericht Berlin (Charlottenburg)",
      "registernummer": "HRB 260400",
      "registerart": "HRB",
      "company_name": "PRB-Haus UG (haftungsbeschränkt)",
      "company_seat": "Berlin",
      "details": "07.07.2025 (Bekanntmachungsdatum)\n\nBerlin Amtsgericht Berlin (Charlottenburg) HRB 260400\nLöschungsankündigung\n\nPRB-Haus UG (haftungsbeschränkt)\nGesellschaft mit beschränkter Haftung\nBerlin\n\nBei der nachstehenden Gesellschaft wird das Amtslöschungsverfahren gemäß § 394 FamFG eingeleitet. Widerspruchsfrist\n6 Wochen."
    },
    {
      "date": "2025-07-07",
      "id": "114792",
      "original_text": "Löschungsankündigung\nBaden-Württemberg Amtsgericht Freiburg HRB 702709\nEckle Personal GmbH – Konstanz",
      "type": "Löschungsankündigung",
      "state": "Baden-Württemberg",
      "amtsgericht": "Amtsgericht Freiburg",
      "registernummer": "HRB 702709",
      "registerart": "HRB",
      "company_name": "Eckle Personal GmbH",
      "company_seat": "Konstanz",
      "details": "07.07.2025 (Bekanntmachungsdatum)\n\nBaden-Württemberg Amtsgericht Freiburg HRB 702709\nLöschungsankündigung 07.07.2025 (Eintragungsdatum)\n\nEckle Personal GmbH\nGesellschaft mit beschränkter Haftung\nKonstanz\n\nAls nicht eingetragen wird bekanntgemacht:\nDas Gericht beabsichtigt, die Gesellschaft wegen Vermögenslosigkeit im Handelsregister von Amts wegen nach § 394 FamFG zu löschen. Die Frist zur Geltendmachung eines Widerspruchs gegen die beabsichtigte Löschung ist auf einen Monat ab Veröffentlichung bestimmt."
    },
    {
      "date": "2025-07-07",
      "id": "114793",
      "original_text": "Einreichung neuer Dokumente\nSachsen-Anhalt Amtsgericht Stendal HRB 202435\nFlugplatzgesellschaft mbH Halle/Oppin. – Landsberg",
      "type": "Einreichung neuer Dokumente",
      "state": "Sachsen-Anhalt",
      "amtsgericht": "Amtsgericht Stendal",
      "registernummer": "HRB 202435",
      "registerart": "HRB",
      "company_name": "Flugplatzgesellschaft mbH Halle/Oppin.",
      "company_seat": "Landsberg",
      "details": "07.07.2025 (Bekanntmachungsdatum)\n\nSachsen-Anhalt Amtsgericht Stendal HRB 202435\nEinreichung neuer Dokumente\n\nFlugplatzgesellschaft mbH Halle/Oppin.\nGesellschaft mit beschränkter Haftung\nLandsberg\n\nEine Liste der Mitglieder des Aufsichtsrates wurde zum Handelsregister eingereicht."
    },
    {
      "date": "2025-07-07",
      "id": "114794",
      "original_text": "Registerbekanntmachung nach dem Umwandlungsgesetz\nBerlin Amtsgericht Berlin (Charlottenburg) HRB 151549\nMakerist GmbH – Berlin",
      "type": "Registerbekanntmachung nach dem Umwandlungsgesetz",
      "state": "Berlin",
      "amtsgericht": "Amtsgericht Berlin (Charlottenburg)",
      "registernummer": "HRB 151549",
      "registerart": "HRB",
      "company_name": "Makerist GmbH",
      "company_seat": "Berlin",
      "details": "07.07.2025 (Bekanntmachungsdatum)\n\nBerlin Amtsgericht Berlin (Charlottenburg) HRB 151549\nRegisterbekanntmachung nach dem Umwandlungsgesetz 07.07.2025 (Eintragungsdatum)\n\nMakerist GmbH\nGesellschaft mit beschränkter Haftung\nBerlin\n\nZu Eintragungsnummer 16 vom 07.07.2025 wird als nicht eingetragen veröffentlicht: Den Gläubigern der an der Verschmelzung beteiligten Rechtsträger ist, wenn sie binnen sechs Monaten nach dem Tag, an dem die Eintragung der Verschmelzung in das Register des Sitzes desjenigen Rechtsträgers, dessen Gläubiger sie sind, als bekannt gemacht gilt, ihren Anspruch nach Grund und Höhe schriftlich anmelden, Sicherheit zu leisten, soweit sie nicht Befriedigung verlangen können. Dieses Recht steht den Gläubigern jedoch nur zu, wenn sie glaubhaft machen, dass durch die Verschmelzung die Erfüllung ihrer Forderung gefährdet wird. Das Recht, Sicherheitsleistung zu verlangen, steht Gläubigern nicht zu, die im Falle der Insolvenz ein Recht auf vorzugsweise Befriedigung aus einer Deckungsmasse haben, die nach gesetzlicher Vorschrift zu ihrem Schutz errichtet und staatlich überwacht ist."
    },
    {
      "date": "2025-07-07",
      "id": "114795",
      "original_text": "Registerbekanntmachung nach dem Umwandlungsgesetz\nHamburg Amtsgericht Hamburg HRB 16617\nHaGa Hanseatische Gastronomie-Betriebe G.m.b.H. – Hamburg",
      "type": "Registerbekanntmachung nach dem Umwandlungsgesetz",
      "state": "Hamburg",
      "amtsgericht": "Amtsgericht Hamburg",
      "registernummer": "HRB 16617",
      "registerart": "HRB",
      "company_name": "HaGa Hanseatische Gastronomie-Betriebe G.m.b.H.",
      "company_seat": "Hamburg",
      "details": "07.07.2025 (Bekanntmachungsdatum)\n\nHamburg Amtsgericht Hamburg HRB 16617\nRegisterbekanntmachung nach dem Umwandlungsgesetz 07.07.2025 (Eintragungsdatum)\n\nHaGa Hanseatische Gastronomie-Betriebe G.m.b.H.\nGesellschaft mit beschränkter Haftung\nHamburg\n\nAls nicht eingetragen wird bekannt gemacht:\nDen Gläubigern der an der Verschmelzung beteiligten Gesellschaften ist, wenn sie binnen sechs Monaten nach dem Tag, an dem die Eintragung der Verschmelzung in das Register des Sitzes desjenigen Rechtsträgers, dessen Gläubiger sie sind, nach § 19 Absatz 3 UmwG als bekannt gemacht gilt, ihren Anspruch nach Grund und Höhe schriftlich anmelden, Sicherheit zu leisten, soweit sie nicht Befriedigung verlangen können. Dieses Recht steht den Gläubigern jedoch nur zu, wenn sie glaubhaft machen, dass durch die Verschmelzung die Erfüllung ihrer Forderung gefährdet wird."
    },
    {
      "date": "2025-07-07",
      "id": "114796",
      "original_text": "Einreichung neuer Dokumente\nHamburg Amtsgericht Hamburg HRB 181011\nRyan Specialty Europe GmbH – Hamburg",
      "type": "Einreichung neuer Dokumente",
      "state": "Hamburg",
      "amtsgericht": "Amtsgericht Hamburg",
      "registernummer": "HRB 181011",
      "registerart": "HRB",
      "company_name": "Ryan Specialty Europe GmbH",
      "company_seat": "Hamburg",
      "details": "07.07.2025 (Bekanntmachungsdatum)\n\nHamburg Amtsgericht Hamburg HRB 181011\nEinreichung neuer Dokumente\n\nRyan Specialty Europe GmbH\nGesellschaft mit beschränkter Haftung\nHamburg\n\nAls nicht eingetragen wird bekanntgemacht:\nEs wird darauf hingewiesen, dass ein Verschmelzungsplan oder sein Entwurf über eine grenzüberschreitende Verschmelzung vom 30.06.2025 zur Aufnahme mit der Ryan Specialty Europe GmbH mit Sitz in Hamburg/Bundesrepublik Deutschland (Amtsgericht Hamburg HRB 181011) (Gesellschaft mit beschränkter Haftung) als übernehmende Gesellschaft und der Ryan Specialty Nordics AB mit Sitz in Stockholm/Schweden (Bolagsverket 556741-6572) (Aktiengesellschaft nach schwedischem Recht) sowie der RSG Construction & Specialty AB mit Sitz in Stockholm/Schweden (Bolagsverket 556686-1984) (Aktiengesellschaft nach schwedischem Recht) als übertragende Gesellschaften beim Handelsregister eingereicht worden ist.\nDie Anteilsinhaber, die Gläubiger sowie die zuständigen Betriebsräte der an der grenzüberschreitenden Verschmelzung beteiligten Gesellschaften oder, soweit es keinen Betriebsrat gibt, die Arbeitnehmer der an der grenzüberschreitenden Verschmelzung beteiligten Gesellschaften, können der jeweiligen Gesellschaft spätestens fünf Arbeitstage vor dem Tag der Gesellschafterversammlung, die am 01.09.2025 stattfinden wird, Bemerkungen zum Verschmelzungsplan übermitteln."
    },
    {
      "date": "2025-07-07",
      "id": "114797",
      "original_text": "Registerbekanntmachung nach dem Umwandlungsgesetz\nBaden-Württemberg Amtsgericht Stuttgart HRA 736447\nLeibinger Family Office GmbH & Co. KG – Ditzingen",
      "type": "Registerbekanntmachung nach dem Umwandlungsgesetz",
      "state": "Baden-Württemberg",
      "amtsgericht": "Amtsgericht Stuttgart",
      "registernummer": "HRA 736447",
      "registerart": "HRA",
      "company_name": "Leibinger Family Office GmbH & Co. KG",
      "company_seat": "Ditzingen",
      "details": "07.07.2025 (Bekanntmachungsdatum)\n\nBaden-Württemberg Amtsgericht Stuttgart HRA 736447\nRegisterbekanntmachung nach dem Umwandlungsgesetz 07.07.2025 (Eintragungsdatum)\n\nLeibinger Family Office GmbH & Co. KG\nKommanditgesellschaft\nDitzingen\n\nAls nicht eingetragen wird bekanntgemacht: Den Gläubigern der an der Verschmelzung beteiligten Rechtsträger ist, wenn sie binnen sechs Monaten nach dem Tag, an dem die Eintragung der Verschmelzung in das Register des Sitzes desjenigen Rechtsträgers, dessen Gläubiger sie sind, nach § 19 Abs. 3 UmwG als bekanntgemacht gilt, ihren Anspruch nach Grund und Höhe schriftlich anmelden, Sicherheit zu leisten, soweit sie nicht Befriedigung verlangen können. Dieses Recht steht den Gläubigern jedoch nur zu, wenn sie glaubhaft machen, dass durch die Verschmelzung die Erfüllung ihrer Forderung gefährdet wird."
    },
    {
      "date": "2025-07-07",
      "id": "114798",
      "original_text": "Einreichung neuer Dokumente\nBaden-Württemberg Amtsgericht Stuttgart HRB 106182\nHoerner-Bank Aktiengesellschaft – Heilbronn",
      "type": "Einreichung neuer Dokumente",
      "state": "Baden-Württemberg",
      "amtsgericht": "Amtsgericht Stuttgart",
      "registernummer": "HRB 106182",
      "registerart": "HRB",
      "company_name": "Hoerner-Bank Aktiengesellschaft",
      "company_seat": "Heilbronn",
      "details": "07.07.2025 (Bekanntmachungsdatum)\n\nBaden-Württemberg Amtsgericht Stuttgart HRB 106182\nEinreichung neuer Dokumente 07.07.2025 (Eintragungsdatum)\n\nHoerner-Bank Aktiengesellschaft\nAktiengesellschaft\nHeilbronn\n\nDie Gesellschaft hat am 03.07.2025 die Liste über die Zusammensetzung des Aufsichtsrats zum Handelsregister eingereicht."
    },
    {
      "date": "2025-07-07",
      "id": "114799",
      "original_text": "Sonstige Registerbekanntmachung\nHamburg Amtsgericht Hamburg HRB 73169\nExxonMobil Central Europe Holding GmbH – Hamburg",
      "type": "Sonstige Registerbekanntmachung",
      "state": "Hamburg",
      "amtsgericht": "Amtsgericht Hamburg",
      "registernummer": "HRB 73169",
      "registerart": "HRB",
      "company_name": "ExxonMobil Central Europe Holding GmbH",
      "company_seat": "Hamburg",
      "details": "07.07.2025 (Bekanntmachungsdatum)\n\nHamburg Amtsgericht Hamburg HRB 73169\nSonstige Registerbekanntmachung\n\nExxonMobil Central Europe Holding GmbH\nGesellschaft mit beschränkter Haftung\nHamburg\n\nAls nicht eingetragen wird bekannt gemacht: Liste des Aufsichtsrats wurde eingereicht."
    },
    {
      "date": "2025-07-07",
      "id": "114800",
      "original_text": "Registerbekanntmachung nach dem Umwandlungsgesetz\nBaden-Württemberg Amtsgericht Stuttgart HRB 754724\nReusch Vermögens-Verwaltung GmbH – Metzingen",
      "type": "Registerbekanntmachung nach dem Umwandlungsgesetz",
      "state": "Baden-Württemberg",
      "amtsgericht": "Amtsgericht Stuttgart",
      "registernummer": "HRB 754724",
      "registerart": "HRB",
      "company_name": "Reusch Vermögens-Verwaltung GmbH",
      "company_seat": "Metzingen",
      "details": "07.07.2025 (Bekanntmachungsdatum)\n\nBaden-Württemberg Amtsgericht Stuttgart HRB 754724\nRegisterbekanntmachung nach dem Umwandlungsgesetz 07.07.2025 (Eintragungsdatum)\n\nReusch Vermögens-Verwaltung GmbH\nGesellschaft mit beschränkter Haftung\nMetzingen\n\nAls nicht eingetragen wird bekanntgemacht:\nDen Gläubigern der an der Verschmelzung beteiligten Rechtsträger ist, wenn sie binnen sechs Monaten nach dem Tag, an dem die Eintragung der Verschmelzung in das Register des Sitzes desjenigen Rechtsträgers, dessen Gläubiger sie sind, nach § 19 Abs. 3 UmwG als bekanntgemacht gilt, ihren Anspruch nach Grund und Höhe schriftlich anmelden, Sicherheit zu leisten, soweit sie nicht Befriedigung verlangen können. Dieses Recht steht den Gläubigern jedoch nur zu, wenn sie glaubhaft machen, dass durch die Verschmelzung die Erfüllung ihrer Forderung gefährdet wird."
    },
    {
      "date": "2025-07-07",
      "id": "114801",
      "original_text": "Registerbekanntmachung nach dem Umwandlungsgesetz\nBaden-Württemberg Amtsgericht Ulm HRA 2661\nVolker Munk Immobilien e.K. – Ulm",
      "type": "Registerbekanntmachung nach dem Umwandlungsgesetz",
      "state": "Baden-Württemberg",
      "amtsgericht": "Amtsgericht Ulm",
      "registernummer": "HRA 2661",
      "registerart": "HRA",
      "company_name": "Volker Munk Immobilien e.K.",
      "company_seat": "Ulm",
      "details": "07.07.2025 (Bekanntmachungsdatum)\n\nBaden-Württemberg Amtsgericht Ulm HRA 2661\nRegisterbekanntmachung nach dem Umwandlungsgesetz 07.07.2025 (Eintragungsdatum)\n\nVolker Munk Immobilien e.K.\nEinzelkaufmann / Einzelkauffrau\nUlm\n\nAls nicht eingetragen wird bekanntgemacht:\nDen Gläubigern der an der Ausgliederung beteiligten Rechtsträger ist, wenn sie binnen sechs Monaten nach dem Tag, an dem die Eintragung der Ausgliederung in das Register des Sitzes desjenigen Rechtsträgers, dessen Gläubiger sie sind, nach § 19 Abs. 3 UmwG als bekanntgemacht gilt, ihren Anspruch nach Grund und Höhe schriftlich anmelden, Sicherheit zu leisten, soweit sie nicht Befriedigung verlangen können. Dieses Recht steht den Gläubigern jedoch nur zu, wenn sie glaubhaft machen, dass durch die Ausgliederung die Erfüllung ihrer Forderung gefährdet wird."
    },
    {
      "date": "2025-07-07",
      "id": "114802",
      "original_text": "Registerbekanntmachung nach dem Umwandlungsgesetz\nBaden-Württemberg Amtsgericht Ulm HRA 729413\nMunk Immobilien GmbH & Co. KG – Ulm",
      "type": "Registerbekanntmachung nach dem Umwandlungsgesetz",
      "state": "Baden-Württemberg",
      "amtsgericht": "Amtsgericht Ulm",
      "registernummer": "HRA 729413",
      "registerart": "HRA",
      "company_name": "Munk Immobilien GmbH & Co. KG",
      "company_seat": "Ulm",
      "details": "07.07.2025 (Bekanntmachungsdatum)\n\nBaden-Württemberg Amtsgericht Ulm HRA 729413\nRegisterbekanntmachung nach dem Umwandlungsgesetz 07.07.2025 (Eintragungsdatum)\n\nMunk Immobilien GmbH & Co. KG\nKommanditgesellschaft\nUlm\n\nAls nicht eingetragen wird bekanntgemacht:\nDen Gläubigern der an der Ausgliederung beteiligten Rechtsträger ist, wenn sie binnen sechs Monaten nach dem Tag, an dem die Eintragung der Ausgliederung in das Register des Sitzes desjenigen Rechtsträgers, dessen Gläubiger sie sind, nach § 19 Abs. 3 UmwG als bekanntgemacht gilt, ihren Anspruch nach Grund und Höhe schriftlich anmelden, Sicherheit zu leisten, soweit sie nicht Befriedigung verlangen können. Dieses Recht steht den Gläubigern jedoch nur zu, wenn sie glaubhaft machen, dass durch die Ausgliederung die Erfüllung ihrer Forderung gefährdet wird."
    },
    {
      "date": "2025-07-07",
      "id": "114803",
      "original_text": "Registerbekanntmachung nach dem Umwandlungsgesetz\nBaden-Württemberg Amtsgericht Stuttgart HRB 740146\ndiconium strategy GmbH – Stuttgart",
      "type": "Registerbekanntmachung nach dem Umwandlungsgesetz",
      "state": "Baden-Württemberg",
      "amtsgericht": "Amtsgericht Stuttgart",
      "registernummer": "HRB 740146",
      "registerart": "HRB",
      "company_name": "diconium strategy GmbH",
      "company_seat": "Stuttgart",
      "details": "07.07.2025 (Bekanntmachungsdatum)\n\nBaden-Württemberg Amtsgericht Stuttgart HRB 740146\nRegisterbekanntmachung nach dem Umwandlungsgesetz 07.07.2025 (Eintragungsdatum)\n\ndiconium strategy GmbH\nGesellschaft mit beschränkter Haftung\nStuttgart\n\nAls nicht eingetragen wird bekanntgemacht: Den Gläubigern der an der Verschmelzung beteiligten Rechtsträger ist, wenn sie binnen sechs Monaten nach dem Tag, an dem die Eintragung der Verschmelzung in das Register des Sitzes desjenigen Rechtsträgers, dessen Gläubiger sie sind, nach § 19 Abs. 3 UmwG als bekanntgemacht gilt, ihren Anspruch nach Grund und Höhe schriftlich anmelden, Sicherheit zu leisten, soweit sie nicht Befriedigung verlangen können. Dieses Recht steht den Gläubigern jedoch nur zu, wenn sie glaubhaft machen, dass durch die Verschmelzung die Erfüllung ihrer Forderung gefährdet wird."
    },
    {
      "date": "2025-07-07",
      "id": "114804",
      "original_text": "Registerbekanntmachung nach dem Umwandlungsgesetz\nBerlin Amtsgericht Berlin (Charlottenburg) HRB 91703\nDDB Group GmbH – Berlin",
      "type": "Registerbekanntmachung nach dem Umwandlungsgesetz",
      "state": "Berlin",
      "amtsgericht": "Amtsgericht Berlin (Charlottenburg)",
      "registernummer": "HRB 91703",
      "registerart": "HRB",
      "company_name": "DDB Group GmbH",
      "company_seat": "Berlin",
      "details": "07.07.2025 (Bekanntmachungsdatum)\n\nBerlin Amtsgericht Berlin (Charlottenburg) HRB 91703\nRegisterbekanntmachung nach dem Umwandlungsgesetz 07.07.2025 (Eintragungsdatum)\n\nDDB Group GmbH\nGesellschaft mit beschränkter Haftung\nBerlin\n\nZu Eintragungsnummer 49 vom 07.07.2025 wird als nicht eingetragen veröffentlicht: Den Gläubigern der an der Verschmelzung beteiligten Rechtsträger ist, wenn sie binnen sechs Monaten nach dem Tag, an dem die Eintragung der Verschmelzung in das Register des Sitzes desjenigen Rechtsträgers, dessen Gläubiger sie sind, als bekannt gemacht gilt, ihren Anspruch nach Grund und Höhe schriftlich anmelden, Sicherheit zu leisten, soweit sie nicht Befriedigung verlangen können. Dieses Recht steht den Gläubigern jedoch nur zu, wenn sie glaubhaft machen, dass durch die Verschmelzung die Erfüllung ihrer Forderung gefährdet wird. Das Recht, Sicherheitsleistung zu verlangen, steht Gläubigern nicht zu, die im Falle der Insolvenz ein Recht auf vorzugsweise Befriedigung aus einer Deckungsmasse haben, die nach gesetzlicher Vorschrift zu ihrem Schutz errichtet und staatlich überwacht ist."
    },
    {
      "date": "2025-07-07",
      "id": "114805",
      "original_text": "Löschungsankündigung\nBrandenburg Amtsgericht Frankfurt/Oder HRB 20994\nEFESTO Bauausführung GmbH – Wandlitz",
      "type": "Löschungsankündigung",
      "state": "Brandenburg",
      "amtsgericht": "Amtsgericht Frankfurt/Oder",
      "registernummer": "HRB 20994",
      "registerart": "HRB",
      "company_name": "EFESTO Bauausführung GmbH",
      "company_seat": "Wandlitz",
      "details": "07.07.2025 (Bekanntmachungsdatum)\n\nBrandenburg Amtsgericht Frankfurt/Oder HRB 20994\nLöschungsankündigung\n\nEFESTO Bauausführung GmbH\nGesellschaft mit beschränkter Haftung\nWandlitz\n\nBei der nachstehenden Gesellschaft wird das Amtslöschungsverfahren gemäß § 394 FamFG eingeleitet."
    },
    {
      "date": "2025-07-07",
      "id": "114806",
      "original_text": "Sonstige Registerbekanntmachung\nBrandenburg Amtsgericht Frankfurt/Oder HRB 16689\nR. KIEL - Bau GmbH – Schorfheide",
      "type": "Sonstige Registerbekanntmachung",
      "state": "Brandenburg",
      "amtsgericht": "Amtsgericht Frankfurt/Oder",
      "registernummer": "HRB 16689",
      "registerart": "HRB",
      "company_name": "R. KIEL - Bau GmbH",
      "company_seat": "Schorfheide",
      "details": "07.07.2025 (Bekanntmachungsdatum)\n\nBrandenburg Amtsgericht Frankfurt/Oder HRB 16689\nSonstige Registerbekanntmachung 01.07.2025 (Eintragungsdatum)\n\nR. KIEL - Bau GmbH\nGesellschaft mit beschränkter Haftung\nSchorfheide\n\nAls nicht eingetragen wird veröffentlicht:\nDen Gläubigern der an der Verschmelzung beteiligten Rechtsträger ist, wenn sie binnen sechs Monaten nach dem Tag, an dem die Eintragung der Verschmelzung in das Register des Sitzes desjenigen Rechtsträgers, dessen Gläubiger sie sind, als bekannt gemacht gilt, ihren Anspruch nach Grund und Höhe schriftlich anmelden, Sicherheit zu leisten, soweit sie nicht Befriedigung verlangen können. Dieses Recht steht den Gläubigern jedoch nur zu, wenn sie glaubhaft machen, dass durch die Verschmelzung die Erfüllung ihrer Forderung gefährdet wird"
    },
    {
      "date": "2025-07-07",
      "id": "114807",
      "original_text": "Registerbekanntmachung nach dem Umwandlungsgesetz\nSachsen Amtsgericht Leipzig HRB 36102\nMenageriehöfe Dresden GmbH – Leipzig",
      "type": "Registerbekanntmachung nach dem Umwandlungsgesetz",
      "state": "Sachsen",
      "amtsgericht": "Amtsgericht Leipzig",
      "registernummer": "HRB 36102",
      "registerart": "HRB",
      "company_name": "Menageriehöfe Dresden GmbH",
      "company_seat": "Leipzig",
      "details": "07.07.2025 (Bekanntmachungsdatum)\n\nSachsen Amtsgericht Leipzig HRB 36102\nRegisterbekanntmachung nach dem Umwandlungsgesetz 07.07.2025 (Eintragungsdatum)\n\nMenageriehöfe Dresden GmbH\nGesellschaft mit beschränkter Haftung\nLeipzig\n\nDen Gläubigern der an der Verschmelzung beteiligten Rechtsträger ist, wenn sie binnen sechs Monaten nach dem Tag, an dem die Eintragung der Verschmelzung in das Register des Sitzes desjenigen Rechtsträgers, dessen Gläubiger sie sind, nach § 19 Abs. 3 UmwG als bekannt gemacht gilt, ihren Anspruch nach Grund und Höhe in Textform anmelden, Sicherheit zu leisten, soweit sie nicht Befriedigung verlangen können. Dieses Recht steht den Gläubigern jedoch nur zu, wenn sie glaubhaft machen, dass durch die Verschmelzung die Erfüllung der Forderung gefährdet wird."
    },
    {
      "date": "2025-07-07",
      "id": "114808",
      "original_text": "Löschungsankündigung\nSachsen Amtsgericht Dresden HRB 38046\nCDI Commerce International UG (haftungsbeschränkt) – Dresden",
      "type": "Löschungsankündigung",
      "state": "Sachsen",
      "amtsgericht": "Amtsgericht Dresden",
      "registernummer": "HRB 38046",
      "registerart": "HRB",
      "company_name": "CDI Commerce International UG (haftungsbeschränkt)",
      "company_seat": "Dresden",
      "details": "07.07.2025 (Bekanntmachungsdatum)\n\nSachsen Amtsgericht Dresden HRB 38046\nLöschungsankündigung\n\nCDI Commerce International UG (haftungsbeschränkt)\nGesellschaft mit beschränkter Haftung\nDresden\n\nDas Registergericht beabsichtigt, die im Handelsregister eingetragene Gesellschaft von Amts wegen nach § 394 FamFG zu löschen. Die Frist zu Erhebung eines Widerspruchs gegen die beabsichtigte Löschung wird auf einen Monat festgesetzt."
    },
    {
      "date": "2025-07-07",
      "id": "114809",
      "original_text": "Registerbekanntmachung nach dem Umwandlungsgesetz\nSachsen Amtsgericht Leipzig GsR 68\nHennig Besitzunternehmen eGbR – Zwenkau",
      "type": "Registerbekanntmachung nach dem Umwandlungsgesetz",
      "state": "Sachsen",
      "amtsgericht": "Amtsgericht Leipzig",
      "registernummer": "GsR 68",
      "registerart": "GsR",
      "company_name": "Hennig Besitzunternehmen eGbR",
      "company_seat": "Zwenkau",
      "details": "07.07.2025 (Bekanntmachungsdatum)\n\nSachsen Amtsgericht Leipzig GsR 68\nRegisterbekanntmachung nach dem Umwandlungsgesetz 07.07.2025 (Eintragungsdatum)\n\nHennig Besitzunternehmen eGbR\nGesellschaft bürgerlichen Rechts\nZwenkau\n\nDen Gläubigern der an der Umwandlung beteiligten Rechtsträger ist, wenn sie binnen sechs Monaten nach dem Tag, an dem die Eintragung der Umwandlung in das Register des Sitzes desjenigen Rechtsträgers, dessen Gläubiger sie sind, nach § 19 Abs. 3 UmwG als bekannt gemacht gilt, ihren Anspruch nach Grund und Höhe in Textform anmelden, Sicherheit zu leisten, soweit sie nicht Befriedigung verlangen können. Dieses Recht steht den Gläubigern jedoch nur zu, wenn sie glaubhaft machen, dass durch die Umwandlung die Erfüllung der Forderung gefährdet wird."
    },
    {
      "date": "2025-07-07",
      "id": "114810",
      "original_text": "Registerbekanntmachung nach dem Umwandlungsgesetz\nSachsen Amtsgericht Dresden HRB 46808\nRudolph Finanzkonzepte GmbH – Dresden",
      "type": "Registerbekanntmachung nach dem Umwandlungsgesetz",
      "state": "Sachsen",
      "amtsgericht": "Amtsgericht Dresden",
      "registernummer": "HRB 46808",
      "registerart": "HRB",
      "company_name": "Rudolph Finanzkonzepte GmbH",
      "company_seat": "Dresden",
      "details": "07.07.2025 (Bekanntmachungsdatum)\n\nSachsen Amtsgericht Dresden HRB 46808\nRegisterbekanntmachung nach dem Umwandlungsgesetz 07.07.2025 (Eintragungsdatum)\n\nRudolph Finanzkonzepte GmbH\nGesellschaft mit beschränkter Haftung\nDresden\n\nDen Gläubigern der an der Ausgliederung beteiligten Rechtsträger ist, wenn sie binnen sechs Monaten nach dem Tag, an dem die Eintragung der Ausgliederung in das Register des Sitzes desjenigen Rechtsträgers, dessen Gläubiger sie sind, nach § 19 Abs. 3 UmwG als bekannt gemacht gilt, ihren Anspruch nach Grund und Höhe in Textform anmelden, Sicherheit zu leisten, soweit sie nicht Befriedigung verlangen können. Dieses Recht steht den Gläubigern jedoch nur zu, wenn sie glaubhaft machen, dass durch die Ausgliederung die Erfüllung der Forderung gefährdet wird."
    },
    {
      "date": "2025-07-07",
      "id": "114811",
      "original_text": "Löschungsankündigung\nSachsen Amtsgericht Dresden HRB 30145\nCAPEDIA Consulting UG (haftungsbeschränkt) – Dresden",
      "type": "Löschungsankündigung",
      "state": "Sachsen",
      "amtsgericht": "Amtsgericht Dresden",
      "registernummer": "HRB 30145",
      "registerart": "HRB",
      "company_name": "CAPEDIA Consulting UG (haftungsbeschränkt)",
      "company_seat": "Dresden",
      "details": "07.07.2025 (Bekanntmachungsdatum)\n\nSachsen Amtsgericht Dresden HRB 30145\nLöschungsankündigung\n\nCAPEDIA Consulting UG (haftungsbeschränkt)\nGesellschaft mit beschränkter Haftung\nDresden\n\nDas Registergericht beabsichtigt, die im Handelsregister eingetragene Gesellschaft von Amts wegen nach § 394 FamFG zu löschen. Die Frist zu Erhebung eines Widerspruchs gegen die beabsichtigte Löschung wird auf einen Monat festgesetzt."
    },
    {
      "date": "2025-07-07",
      "id": "114812",
      "original_text": "Registerbekanntmachung nach dem Umwandlungsgesetz\nSachsen Amtsgericht Leipzig HRB 44330\nHennig Besitzunternehmen GmbH – Zwenkau",
      "type": "Registerbekanntmachung nach dem Umwandlungsgesetz",
      "state": "Sachsen",
      "amtsgericht": "Amtsgericht Leipzig",
      "registernummer": "HRB 44330",
      "registerart": "HRB",
      "company_name": "Hennig Besitzunternehmen GmbH",
      "company_seat": "Zwenkau",
      "details": "07.07.2025 (Bekanntmachungsdatum)\n\nSachsen Amtsgericht Leipzig HRB 44330\nRegisterbekanntmachung nach dem Umwandlungsgesetz 07.07.2025 (Eintragungsdatum)\n\nHennig Besitzunternehmen GmbH\nGesellschaft mit beschränkter Haftung\nZwenkau\n\nDen Gläubigern der an der Umwandlung beteiligten Rechtsträger ist, wenn sie binnen sechs Monaten nach dem Tag, an dem die Eintragung der Umwandlung in das Register des Sitzes desjenigen Rechtsträgers, dessen Gläubiger sie sind, nach § 19 Abs. 3 UmwG als bekannt gemacht gilt, ihren Anspruch nach Grund und Höhe in Textform anmelden, Sicherheit zu leisten, soweit sie nicht Befriedigung verlangen können. Dieses Recht steht den Gläubigern jedoch nur zu, wenn sie glaubhaft machen, dass durch die Umwandlung die Erfüllung der Forderung gefährdet wird."
    },
    {
      "date": "2025-07-07",
      "id": "114813",
      "original_text": "Registerbekanntmachung nach dem Umwandlungsgesetz\nSachsen Amtsgericht Dresden HRA 12278\nOskar Rudolph e.K. – Dresden",
      "type": "Registerbekanntmachung nach dem Umwandlungsgesetz",
      "state": "Sachsen",
      "amtsgericht": "Amtsgericht Dresden",
      "registernummer": "HRA 12278",
      "registerart": "HRA",
      "company_name": "Oskar Rudolph e.K.",
      "company_seat": "Dresden",
      "details": "07.07.2025 (Bekanntmachungsdatum)\n\nSachsen Amtsgericht Dresden HRA 12278\nRegisterbekanntmachung nach dem Umwandlungsgesetz 07.07.2025 (Eintragungsdatum)\n\nOskar Rudolph e.K.\nEinzelkaufmann / Einzelkauffrau\nDresden\n\nDen Gläubigern der an der Ausgliederung beteiligten Rechtsträger ist, wenn sie binnen sechs Monaten nach dem Tag, an dem die Eintragung der Ausgliederung in das Register des Sitzes desjenigen Rechtsträgers, dessen Gläubiger sie sind, nach § 19 Abs. 3 UmwG als bekannt gemacht gilt, ihren Anspruch nach Grund und Höhe in Textform anmelden, Sicherheit zu leisten, soweit sie nicht Befriedigung verlangen können. Dieses Recht steht den Gläubigern jedoch nur zu, wenn sie glaubhaft machen, dass durch die Ausgliederung die Erfüllung der Forderung gefährdet wird."
    },
    {
      "date": "2025-07-07",
      "id": "114814",
      "original_text": "Löschungsankündigung\nNiedersachsen Amtsgericht Göttingen HRA 201811\nRGB Delivery e.K. – Rosdorf",
      "type": "Löschungsankündigung",
      "state": "Niedersachsen",
      "amtsgericht": "Amtsgericht Göttingen",
      "registernummer": "HRA 201811",
      "registerart": "HRA",
      "company_name": "RGB Delivery e.K.",
      "company_seat": "Rosdorf",
      "details": "07.07.2025 (Bekanntmachungsdatum)\n\nNiedersachsen Amtsgericht Göttingen HRA 201811\nLöschungsankündigung\n\nRGB Delivery e.K.\nEinzelkaufmann / Einzelkauffrau\nRosdorf\n\nDas Registergericht beabsichtigt, die Firma von Amts wegen nach § 31 Abs. 2 Satz 2 HGB, § 393 FamFG zu löschen. Die Frist zur Erhebung eines Widerspruchs ist auf 1 Monat ab dieser Registerbekanntmachung festgesetzt."
    },
    {
      "date": "2025-07-07",
      "id": "114815",
      "original_text": "Registerbekanntmachung nach dem Umwandlungsgesetz\nNiedersachsen Amtsgericht Braunschweig GnR 200042\nHolding Dieckmann eG – Helmstedt",
      "type": "Registerbekanntmachung nach dem Umwandlungsgesetz",
      "state": "Niedersachsen",
      "amtsgericht": "Amtsgericht Braunschweig",
      "registernummer": "GnR 200042",
      "registerart": "GnR",
      "company_name": "Holding Dieckmann eG",
      "company_seat": "Helmstedt",
      "details": "07.07.2025 (Bekanntmachungsdatum)\n\nNiedersachsen Amtsgericht Braunschweig GnR 200042\nRegisterbekanntmachung nach dem Umwandlungsgesetz 07.07.2025 (Eintragungsdatum)\n\nHolding Dieckmann eG\neingetragene Genossenschaft\nHelmstedt\n\nDen Gläubigern der an der formwechselnden Umwandlung beteiligten Rechtsträger ist, wenn sie binnen sechs Monaten nach dem Tag, an dem die Eintragung der Umwandlung in das Register des Sitzes desjenigen Rechtsträgers, dessen Gläubiger sie sind, nach § 19 Abs. 3 UmwG als bekannt gemacht gilt, ihren Anspruch nach Grund und Höhe schriftlich anmelden, Sicherheit zu leisten, soweit sie nicht Befriedigung verlangen können. Dieses Recht steht den Gläubigern jedoch nur zu, wenn sie glaubhaft machen, dass durch die formwechselnde Umwandlung die Erfüllung der Forderung gefährdet wird."
    },
    {
      "date": "2025-07-07",
      "id": "114816",
      "original_text": "Löschungsankündigung\nNiedersachsen Amtsgericht Osnabrück HRB 219419\nLuxe Performance GmbH – Herzlake",
      "type": "Löschungsankündigung",
      "state": "Niedersachsen",
      "amtsgericht": "Amtsgericht Osnabrück",
      "registernummer": "HRB 219419",
      "registerart": "HRB",
      "company_name": "Luxe Performance GmbH",
      "company_seat": "Herzlake",
      "details": "07.07.2025 (Bekanntmachungsdatum)\n\nNiedersachsen Amtsgericht Osnabrück HRB 219419\nLöschungsankündigung\n\nLuxe Performance GmbH\nGesellschaft mit beschränkter Haftung\nHerzlake\n\nDas Registergericht beabsichtigt, die Gesellschaft von Amts wegen nach § 394 FamFG wegen Vermögenslosigkeit zu löschen. Die Frist zur Erhebung eines Widerspruchs ist auf 1 Monat ab dieser Registerbekanntmachung festgesetzt."
    },
    {
      "date": "2025-07-07",
      "id": "114817",
      "original_text": "Registerbekanntmachung nach dem Umwandlungsgesetz\nNiedersachsen Amtsgericht Braunschweig HRB 203135\nJD Holding GmbH – Helmstedt",
      "type": "Registerbekanntmachung nach dem Umwandlungsgesetz",
      "state": "Niedersachsen",
      "amtsgericht": "Amtsgericht Braunschweig",
      "registernummer": "HRB 203135",
      "registerart": "HRB",
      "company_name": "JD Holding GmbH",
      "company_seat": "Helmstedt",
      "details": "07.07.2025 (Bekanntmachungsdatum)\n\nNiedersachsen Amtsgericht Braunschweig HRB 203135\nRegisterbekanntmachung nach dem Umwandlungsgesetz 07.07.2025 (Eintragungsdatum)\n\nJD Holding GmbH\nGesellschaft mit beschränkter Haftung\nHelmstedt\n\nDen Gläubigern der an der formwechselnden Umwandlung beteiligten Rechtsträger ist, wenn sie binnen sechs Monaten nach dem Tag, an dem die Eintragung der Umwandlung in das Register des Sitzes desjenigen Rechtsträgers, dessen Gläubiger sie sind, nach § 19 Abs. 3 UmwG als bekannt gemacht gilt, ihren Anspruch nach Grund und Höhe schriftlich anmelden, Sicherheit zu leisten, soweit sie nicht Befriedigung verlangen können. Dieses Recht steht den Gläubigern jedoch nur zu, wenn sie glaubhaft machen, dass durch die formwechselnde Umwandlung die Erfüllung der Forderung gefährdet wird."
    },
    {
      "date": "2025-07-07",
      "id": "114818",
      "original_text": "Registerbekanntmachung nach dem Umwandlungsgesetz\nNiedersachsen Amtsgericht Hannover HRB 225023\nGolden Tree Vermögensverwaltung GmbH – Garbsen",
      "type": "Registerbekanntmachung nach dem Umwandlungsgesetz",
      "state": "Niedersachsen",
      "amtsgericht": "Amtsgericht Hannover",
      "registernummer": "HRB 225023",
      "registerart": "HRB",
      "company_name": "Golden Tree Vermögensverwaltung GmbH",
      "company_seat": "Garbsen",
      "details": "07.07.2025 (Bekanntmachungsdatum)\n\nNiedersachsen Amtsgericht Hannover HRB 225023\nRegisterbekanntmachung nach dem Umwandlungsgesetz 07.07.2025 (Eintragungsdatum)\n\nGolden Tree Vermögensverwaltung GmbH\nGesellschaft mit beschränkter Haftung\nGarbsen\n\nDen Gläubigern der an der Verschmelzung beteiligten Rechtsträger ist, wenn sie binnen sechs Monaten nach dem Tag, an dem die Eintragung der Verschmelzung in das Register des Sitzes desjenigen Rechtsträgers, dessen Gläubiger sie sind, nach § 19  Abs.  3 UmwG als bekannt gemacht gilt, ihren Anspruch nach Grund und Höhe schriftlich anmelden, Sicherheit zu leisten, soweit sie nicht Befriedigung verlangen können. Dieses Recht steht den Gläubigern jedoch nur zu, wenn sie glaubhaft machen, dass durch die Verschmelzung die Erfüllung der Forderung gefährdet wird."
    },
    {
      "date": "2025-07-07",
      "id": "114819",
      "original_text": "Löschungsankündigung\nNiedersachsen Amtsgericht Hildesheim HRB 202023\nSHB GmbH – Wittingen",
      "type": "Löschungsankündigung",
      "state": "Niedersachsen",
      "amtsgericht": "Amtsgericht Hildesheim",
      "registernummer": "HRB 202023",
      "registerart": "HRB",
      "company_name": "SHB GmbH",
      "company_seat": "Wittingen",
      "details": "07.07.2025 (Bekanntmachungsdatum)\n\nNiedersachsen Amtsgericht Hildesheim HRB 202023\nLöschungsankündigung\n\nSHB GmbH\nGesellschaft mit beschränkter Haftung\nWittingen\n\nDas Registergericht beabsichtigt, die Gesellschaft von Amts wegen nach § 394 FamFG zu löschen. Die Frist zur Erhebung eines Widerspruchs ist auf 1 Monat ab dieser Registerbekanntmachung festgesetzt."
    },
    {
      "date": "2025-07-07",
      "id": "114820",
      "original_text": "Löschungsankündigung\nNiedersachsen Amtsgericht Osnabrück HRB 216007\nDSP-Digitalisierung UG (haftungsbeschränkt) – Meppen",
      "type": "Löschungsankündigung",
      "state": "Niedersachsen",
      "amtsgericht": "Amtsgericht Osnabrück",
      "registernummer": "HRB 216007",
      "registerart": "HRB",
      "company_name": "DSP-Digitalisierung UG (haftungsbeschränkt)",
      "company_seat": "Meppen",
      "details": "07.07.2025 (Bekanntmachungsdatum)\n\nNiedersachsen Amtsgericht Osnabrück HRB 216007\nLöschungsankündigung 07.07.2025 (Eintragungsdatum)\n\nDSP-Digitalisierung UG (haftungsbeschränkt)\nGesellschaft mit beschränkter Haftung\nMeppen\n\nDas Registergericht beabsichtigt, die Gesellschaft von Amts wegen nach § 394 FamFG wegen Vermögenslosigkeit zu löschen. Die Frist zur Erhebung eines Widerspruchs ist auf 1 Monat ab dieser Registerbekanntmachung festgesetzt."
    },
    {
      "date": "2025-07-07",
      "id": "114821",
      "original_text": "Löschungsankündigung\nRheinland-Pfalz Amtsgericht Ludwigshafen a.Rhein (Ludwigshafen) VR 20416\nKarnevalgesellschaft Hallodria 1954 Frankenthal – Frankenthal",
      "type": "Löschungsankündigung",
      "state": "Rheinland-Pfalz",
      "amtsgericht": "Amtsgericht Ludwigshafen a.Rhein (Ludwigshafen)",
      "registernummer": "VR 20416",
      "registerart": "VR",
      "company_name": "Karnevalgesellschaft Hallodria 1954 Frankenthal",
      "company_seat": "Frankenthal",
      "details": "07.07.2025 (Bekanntmachungsdatum)\n\nRheinland-Pfalz Amtsgericht Ludwigshafen a.Rhein (Ludwigshafen) VR 20416\nLöschungsankündigung 07.07.2025 (Eintragungsdatum)\n\nKarnevalgesellschaft Hallodria 1954 Frankenthal\neingetragener Verein\nFrankenthal\n\nDas Registergericht beabsichtigt den Verein von Amts wegen Einstellung des Vereinszwecks zu löschen. Die Frist zur Erhebung eines Widerspruchs ist auf  #DV.Fr(Text=\"Bitte wählen Sie die Widerspruchsfristaus!\",Eingabe=\"einen Monat\",\"zwei Monate\",\"drei Monate\",\"#insert(Text=\"Freitext\")\"|\"freier Text\") festgesetzt."
    },
    {
      "date": "2025-07-07",
      "id": "114822",
      "original_text": "Registerbekanntmachung nach dem Umwandlungsgesetz\nRheinland-Pfalz Amtsgericht Koblenz HRB 23958\nBEWA solutions GmbH – 56291 Laudert",
      "type": "Registerbekanntmachung nach dem Umwandlungsgesetz",
      "state": "Rheinland-Pfalz",
      "amtsgericht": "Amtsgericht Koblenz",
      "registernummer": "HRB 23958",
      "registerart": "HRB",
      "company_name": "BEWA solutions GmbH",
      "company_seat": "56291 Laudert",
      "details": "07.07.2025 (Bekanntmachungsdatum)\n\nRheinland-Pfalz Amtsgericht Koblenz HRB 23958\nRegisterbekanntmachung nach dem Umwandlungsgesetz 07.07.2025 (Eintragungsdatum)\n\nBEWA solutions GmbH\nGesellschaft mit beschränkter Haftung\n56291 Laudert\n\nAls nicht eingetragen wird veröffentlicht: Den Gläubigern der an der Verschmelzung beteiligten Rechtsträger ist, wenn sie binnen sechs Monaten nach dem Tag, an dem die Eintragung der Verschmelzung in das Register des Sitzes desjenigen Rechtsträgers,dessen Gläubiger sie sind, nach § 19 Abs. 3 UmwG als bekannt gemacht gilt, ihren Anspruch nach Grund und Höhe schriftlich anmelden, Sicherheit zu leisten, soweit sie nicht Befriedigung verlangen können. Dieses Recht steht den Gläubigern jedoch nur zu, wenn sie glaubhaft machen, dass durch die Verschmelzung die Erfüllungd er Forderung gefährdet wird."
    },
    {
      "date": "2025-07-07",
      "id": "114823",
      "original_text": "Löschungsankündigung\nRheinland-Pfalz Amtsgericht Ludwigshafen a.Rhein (Ludwigshafen) HRB 63663\nPM Graphisches Maschinen Contor UG (haftungsbeschränkt) – Maxdorf",
      "type": "Löschungsankündigung",
      "state": "Rheinland-Pfalz",
      "amtsgericht": "Amtsgericht Ludwigshafen a.Rhein (Ludwigshafen)",
      "registernummer": "HRB 63663",
      "registerart": "HRB",
      "company_name": "PM Graphisches Maschinen Contor UG (haftungsbeschränkt)",
      "company_seat": "Maxdorf",
      "details": "07.07.2025 (Bekanntmachungsdatum)\n\nRheinland-Pfalz Amtsgericht Ludwigshafen a.Rhein (Ludwigshafen) HRB 63663\nLöschungsankündigung\n\nPM Graphisches Maschinen Contor UG (haftungsbeschränkt)\nGesellschaft mit beschränkter Haftung\nMaxdorf\n\nDas Registergericht beabsichtigt die Gesellschaft von Amts wegen nach § 394 FamFG zu löschen. Die Frist zur Erhebung eines Widerspruchs ist auf einen Monat festgesetzt."
    },
    {
      "date": "2025-07-07",
      "id": "114824",
      "original_text": "Löschungsankündigung\nBremen Amtsgericht Bremen HRA 28367\nBB ZEA JAKARTA GmbH & Co. KG – Bremen",
      "type": "Löschungsankündigung",
      "state": "Bremen",
      "amtsgericht": "Amtsgericht Bremen",
      "registernummer": "HRA 28367",
      "registerart": "HRA",
      "company_name": "BB ZEA JAKARTA GmbH & Co. KG",
      "company_seat": "Bremen",
      "details": "07.07.2025 (Bekanntmachungsdatum)\n\nBremen Amtsgericht Bremen HRA 28367\nLöschungsankündigung\n\nBB ZEA JAKARTA GmbH & Co. KG\nKommanditgesellschaft\nBremen\n\nEs ist beabsichtigt die im Handelsregister eingetragene Gesellschaft von Amts wegen gemäß § 394 FamFG zu löschen. Gegen die Löschung kann beim AG Bremen schriftlich oder zu Protokoll der Geschäftsstelle Widerspruch eingelegt werden. Widerspruchsfrist 4 Wochen."
    },
    {
      "date": "2025-07-07",
      "id": "114825",
      "original_text": "Registerbekanntmachung nach dem Umwandlungsgesetz\nBremen Amtsgericht Bremen HRB 34496\ngeniales.marketing GmbH – Bremen",
      "type": "Registerbekanntmachung nach dem Umwandlungsgesetz",
      "state": "Bremen",
      "amtsgericht": "Amtsgericht Bremen",
      "registernummer": "HRB 34496",
      "registerart": "HRB",
      "company_name": "geniales.marketing GmbH",
      "company_seat": "Bremen",
      "details": "07.07.2025 (Bekanntmachungsdatum)\n\nBremen Amtsgericht Bremen HRB 34496\nRegisterbekanntmachung nach dem Umwandlungsgesetz 25.06.2025 (Eintragungsdatum)\n\ngeniales.marketing GmbH\nGesellschaft mit beschränkter Haftung\nBremen\n\nZu Eintragungsnummer 2 vom 25.06.2025 wird als nicht eingetragen veröffentlicht: Den Gläubigern der an der Verschmelzung beteiligten Rechtsträger ist, wenn sie binnen sechs Monaten nach dem Tag, an dem die Eintragung der Verschmelzung in das Register des Sitzes desjenigen Rechtsträgers, dessen Gläubiger sie sind, als bekannt gemacht gilt, ihren Anspruch nach Grund und Höhe schriftlich anmelden, Sicherheit zu leisten, soweit sie nicht Befriedigung verlangen können. Dieses Recht steht den Gläubigern jedoch nur zu, wenn sie glaubhaft machen, dass durch die Verschmelzung die Erfüllung ihrer Forderung gefährdet wird. Das Recht, Sicherheitsleistung zu verlangen, steht Gläubigern nicht zu, die im Falle der Insolvenz ein Recht auf vorzugsweise Befriedigung aus einer Deckungsmasse haben, die nach gesetzlicher Vorschrift zu ihrem Schutz errichtet und staatlich überwacht ist.:"
    },
    {
      "date": "2025-07-07",
      "id": "114826",
      "original_text": "Löschungsankündigung\nBremen Amtsgericht Bremen HRA 25902\ncbprocess gmbh & co. kg – Bremen",
      "type": "Löschungsankündigung",
      "state": "Bremen",
      "amtsgericht": "Amtsgericht Bremen",
      "registernummer": "HRA 25902",
      "registerart": "HRA",
      "company_name": "cbprocess gmbh & co. kg",
      "company_seat": "Bremen",
      "details": "07.07.2025 (Bekanntmachungsdatum)\n\nBremen Amtsgericht Bremen HRA 25902\nLöschungsankündigung\n\ncbprocess gmbh & co. kg\nKommanditgesellschaft\nBremen\n\nEs ist beabsichtigt die im Handelsregister eingetragene Firma von Amts wegen gemäß § 31 Abs.2 HGB zu löschen. Gegen die Löschung kann beim AG Bremen schriftlich oder zu Protokoll der Geschäftsstelle Widerspruch eingelegt werden. Widerspruchsfrist 4 Wochen."
    },
    {
      "date": "2025-07-07",
      "id": "114827",
      "original_text": "Löschungsankündigung\nBremen Amtsgericht Bremen HRB 20194\nCibuk Bau GmbH – Bremen",
      "type": "Löschungsankündigung",
      "state": "Bremen",
      "amtsgericht": "Amtsgericht Bremen",
      "registernummer": "HRB 20194",
      "registerart": "HRB",
      "company_name": "Cibuk Bau GmbH",
      "company_seat": "Bremen",
      "details": "07.07.2025 (Bekanntmachungsdatum)\n\nBremen Amtsgericht Bremen HRB 20194\nLöschungsankündigung\n\nCibuk Bau GmbH\nGesellschaft mit beschränkter Haftung\nBremen\n\nEs ist beabsichtigt die im Handelsregister eingetragene Gesellschaft von Amts wegen gemäß § 394 FamFG zu löschen. Gegen die Löschung kann beim AG Bremen schriftlich oder zu Protokoll der Geschäftsstelle Widerspruch eingelegt werden. Widerspruchsfrist 4 Wochen."
    },
    {
      "date": "2025-07-07",
      "id": "114828",
      "original_text": "Registerbekanntmachung nach dem Umwandlungsgesetz\nNordrhein-Westfalen Amtsgericht Duisburg HRB 9092\nthyssenkrupp AG – Duisburg und Essen",
      "type": "Registerbekanntmachung nach dem Umwandlungsgesetz",
      "state": "Nordrhein-Westfalen",
      "amtsgericht": "Amtsgericht Duisburg",
      "registernummer": "HRB 9092",
      "registerart": "HRB",
      "company_name": "thyssenkrupp AG",
      "company_seat": "Duisburg und Essen",
      "details": "07.07.2025 (Bekanntmachungsdatum)\n\nNordrhein-Westfalen Amtsgericht Duisburg HRB 9092\nRegisterbekanntmachung nach dem Umwandlungsgesetz\n\nthyssenkrupp AG\nAktiengesellschaft\nDuisburg und Essen\n\nDem Registergericht ist der Entwurf eines Vertrages über die geplante Abspaltung von Vermögensteilen der thyssenkrupp AG auf die thyssenkrupp Projekt 2 GmbH, dem die für den 08.08.2025 vorgesehene Hauptversammlung zustimmen soll, eingereicht worden."
    },
    {
      "date": "2025-07-07",
      "id": "114829",
      "original_text": "Registerbekanntmachung nach dem Umwandlungsgesetz\nNordrhein-Westfalen Amtsgericht Düsseldorf HRB 27617\nChannel Z GmbH – Düsseldorf",
      "type": "Registerbekanntmachung nach dem Umwandlungsgesetz",
      "state": "Nordrhein-Westfalen",
      "amtsgericht": "Amtsgericht Düsseldorf",
      "registernummer": "HRB 27617",
      "registerart": "HRB",
      "company_name": "Channel Z GmbH",
      "company_seat": "Düsseldorf",
      "details": "07.07.2025 (Bekanntmachungsdatum)\n\nNordrhein-Westfalen Amtsgericht Düsseldorf HRB 27617\nRegisterbekanntmachung nach dem Umwandlungsgesetz 07.07.2025 (Eintragungsdatum)\n\nChannel Z GmbH\nGesellschaft mit beschränkter Haftung\nDüsseldorf\n\nDen Gläubigern der an der Verschmelzung beteiligten Rechtsträger ist, wenn sie binnen sechs Monaten nach dem Tag, an dem die Eintragung der Verschmelzung in das Register des Sitzes desjenigen Rechtsträgers, dessen Gläubiger sie sind, nach § 19 Absatz 3 UmwG als bekanntgemacht gilt, ihren Anspruch nach Grund und Höhe schriftlich anmelden, Sicherheit zu leisten, soweit sie nicht Befriedigung verlangen können. Dieses Recht steht den Gläubigern jedoch nur zu, wenn sie glaubhaft machen, dass durch die Verschmelzung die Erfüllung ihrer Forderung gefährdet wird."
    },
    {
      "date": "2025-07-07",
      "id": "114830",
      "original_text": "Registerbekanntmachung nach dem Umwandlungsgesetz\nNordrhein-Westfalen Amtsgericht Köln HRB 60974\nCaligari Doku GmbH – Köln",
      "type": "Registerbekanntmachung nach dem Umwandlungsgesetz",
      "state": "Nordrhein-Westfalen",
      "amtsgericht": "Amtsgericht Köln",
      "registernummer": "HRB 60974",
      "registerart": "HRB",
      "company_name": "Caligari Doku GmbH",
      "company_seat": "Köln",
      "details": "07.07.2025 (Bekanntmachungsdatum)\n\nNordrhein-Westfalen Amtsgericht Köln HRB 60974\nRegisterbekanntmachung nach dem Umwandlungsgesetz 07.07.2025 (Eintragungsdatum)\n\nCaligari Doku GmbH\nGesellschaft mit beschränkter Haftung\nKöln\n\nDen Gläubigern der an der Verschmelzung beteiligten Rechtsträger ist, wenn sie binnen sechs Monaten nach dem Tag, an dem die Eintragung der Verschmelzung in das Register des Sitzes desjenigen Rechtsträgers, dessen Gläubiger sie sind, nach § 19 Absatz 3 UmwG als bekanntgemacht gilt, ihren Anspruch nach Grund und Höhe schriftlich anmelden, Sicherheit zu leisten, soweit sie nicht Befriedigung verlangen können. Dieses Recht steht den Gläubigern jedoch nur zu, wenn sie glaubhaft machen, dass durch die Verschmelzung die Erfüllung ihrer Forderung gefährdet wird."
    },
    {
      "date": "2025-07-07",
      "id": "114831",
      "original_text": "Registerbekanntmachung nach dem Umwandlungsgesetz\nNordrhein-Westfalen Amtsgericht Köln HRB 99892\nbähr consult:ING GmbH – Köln",
      "type": "Registerbekanntmachung nach dem Umwandlungsgesetz",
      "state": "Nordrhein-Westfalen",
      "amtsgericht": "Amtsgericht Köln",
      "registernummer": "HRB 99892",
      "registerart": "HRB",
      "company_name": "bähr consult:ING GmbH",
      "company_seat": "Köln",
      "details": "07.07.2025 (Bekanntmachungsdatum)\n\nNordrhein-Westfalen Amtsgericht Köln HRB 99892\nRegisterbekanntmachung nach dem Umwandlungsgesetz 07.07.2025 (Eintragungsdatum)\n\nbähr consult:ING GmbH\nGesellschaft mit beschränkter Haftung\nKöln\n\nDen Gläubigern der an der Verschmelzung beteiligten Rechtsträger ist, wenn sie binnen sechs Monaten nach dem Tag, an dem die Eintragung der Verschmelzung in das Register des Sitzes desjenigen Rechtsträgers, dessen Gläubiger sie sind, nach § 19 Absatz 3 UmwG als bekanntgemacht gilt, ihren Anspruch nach Grund und Höhe schriftlich anmelden, Sicherheit zu leisten, soweit sie nicht Befriedigung verlangen können. Dieses Recht steht den Gläubigern jedoch nur zu, wenn sie glaubhaft machen, dass durch die Verschmelzung die Erfüllung ihrer Forderung gefährdet wird."
    },
    {
      "date": "2025-07-07",
      "id": "114832",
      "original_text": "Registerbekanntmachung nach dem Umwandlungsgesetz\nNordrhein-Westfalen Amtsgericht Lemgo HRB 1865\nM. Begemann Holzbau GmbH – Bad Salzuflen",
      "type": "Registerbekanntmachung nach dem Umwandlungsgesetz",
      "state": "Nordrhein-Westfalen",
      "amtsgericht": "Amtsgericht Lemgo",
      "registernummer": "HRB 1865",
      "registerart": "HRB",
      "company_name": "M. Begemann Holzbau GmbH",
      "company_seat": "Bad Salzuflen",
      "details": "07.07.2025 (Bekanntmachungsdatum)\n\nNordrhein-Westfalen Amtsgericht Lemgo HRB 1865\nRegisterbekanntmachung nach dem Umwandlungsgesetz 07.07.2025 (Eintragungsdatum)\n\nM. Begemann Holzbau GmbH\nGesellschaft mit beschränkter Haftung\nBad Salzuflen\n\nDen Gläubigern der an der Verschmelzung beteiligten Rechtsträger ist, wenn sie binnen sechs Monaten nach dem Tag, an dem die Eintragung der Verschmelzung in das Register des Sitzes desjenigen Rechtsträgers, dessen Gläubiger sie sind, nach § 19 Absatz 3 UmwG als bekanntgemacht gilt, ihren Anspruch nach Grund und Höhe schriftlich anmelden, Sicherheit zu leisten, soweit sie nicht Befriedigung verlangen können. Dieses Recht steht den Gläubigern jedoch nur zu, wenn sie glaubhaft machen, dass durch die Verschmelzung die Erfüllung ihrer Forderung gefährdet wird."
    },
    {
      "date": "2025-07-07",
      "id": "114833",
      "original_text": "Löschungsankündigung\nNordrhein-Westfalen Amtsgericht Köln HRB 115040\nBölükbasi GmbH – Köln",
      "type": "Löschungsankündigung",
      "state": "Nordrhein-Westfalen",
      "amtsgericht": "Amtsgericht Köln",
      "registernummer": "HRB 115040",
      "registerart": "HRB",
      "company_name": "Bölükbasi GmbH",
      "company_seat": "Köln",
      "details": "07.07.2025 (Bekanntmachungsdatum)\n\nNordrhein-Westfalen Amtsgericht Köln HRB 115040\nLöschungsankündigung\n\nBölükbasi GmbH\nGesellschaft mit beschränkter Haftung\nKöln\n\nDas Registergericht beabsichtigt die Gesellschaft von Amts wegen nach § 394 FamFG zu löschen. Die Frist zur Erhebung eines Widerspruchs ist auf einen Monat festgesetzt."
    },
    {
      "date": "2025-07-07",
      "id": "114834",
      "original_text": "Einreichung neuer Dokumente\nNordrhein-Westfalen Amtsgericht Wuppertal HRB 12670\nARZ Haan AG – Haan",
      "type": "Einreichung neuer Dokumente",
      "state": "Nordrhein-Westfalen",
      "amtsgericht": "Amtsgericht Wuppertal",
      "registernummer": "HRB 12670",
      "registerart": "HRB",
      "company_name": "ARZ Haan AG",
      "company_seat": "Haan",
      "details": "07.07.2025 (Bekanntmachungsdatum)\n\nNordrhein-Westfalen Amtsgericht Wuppertal HRB 12670\nEinreichung neuer Dokumente\n\nARZ Haan AG\nAktiengesellschaft\nHaan\n\nDem Registergericht ist eine neue Liste der Mitglieder des Aufsichtsrates eingereicht worden."
    },
    {
      "date": "2025-07-07",
      "id": "114835",
      "original_text": "Registerbekanntmachung nach dem Umwandlungsgesetz\nNordrhein-Westfalen Amtsgericht Dortmund HRB 5604\nH-Bahn-Gesellschaft Dortmund mit beschränkter Haftung – Dortmund.",
      "type": "Registerbekanntmachung nach dem Umwandlungsgesetz",
      "state": "Nordrhein-Westfalen",
      "amtsgericht": "Amtsgericht Dortmund",
      "registernummer": "HRB 5604",
      "registerart": "HRB",
      "company_name": "H-Bahn-Gesellschaft Dortmund mit beschränkter Haftung",
      "company_seat": "Dortmund.",
      "details": "07.07.2025 (Bekanntmachungsdatum)\n\nNordrhein-Westfalen Amtsgericht Dortmund HRB 5604\nRegisterbekanntmachung nach dem Umwandlungsgesetz 07.07.2025 (Eintragungsdatum)\n\nH-Bahn-Gesellschaft Dortmund mit beschränkter Haftung\nGesellschaft mit beschränkter Haftung\nDortmund.\n\nDen Gläubigern der an der Verschmelzung beteiligten Rechtsträger ist, wenn sie binnen sechs Monaten nach dem Tag, an dem die Eintragung der Verschmelzung in das Register des Sitzes desjenigen Rechtsträgers, dessen Gläubiger sie sind, nach § 19 Absatz 3 UmwG als bekanntgemacht gilt, ihren Anspruch nach Grund und Höhe schriftlich anmelden, Sicherheit zu leisten, soweit sie nicht Befriedigung verlangen können. Dieses Recht steht den Gläubigern jedoch nur zu, wenn sie glaubhaft machen, dass durch die Verschmelzung die Erfüllung ihrer Forderung gefährdet wird."
    },
    {
      "date": "2025-07-07",
      "id": "114836",
      "original_text": "Einreichung neuer Dokumente\nNordrhein-Westfalen Amtsgericht Köln HRB 53629\nnexum AG – Köln",
      "type": "Einreichung neuer Dokumente",
      "state": "Nordrhein-Westfalen",
      "amtsgericht": "Amtsgericht Köln",
      "registernummer": "HRB 53629",
      "registerart": "HRB",
      "company_name": "nexum AG",
      "company_seat": "Köln",
      "details": "07.07.2025 (Bekanntmachungsdatum)\n\nNordrhein-Westfalen Amtsgericht Köln HRB 53629\nEinreichung neuer Dokumente\n\nnexum AG\nAktiengesellschaft\nKöln\n\nDem Registergericht ist eine neue Liste der Mitglieder des Aufsichtsrates eingereicht worden."
    },
    {
      "date": "2025-07-07",
      "id": "114837",
      "original_text": "Einreichung neuer Dokumente\nNordrhein-Westfalen Amtsgericht Düsseldorf HRB 104105\nGE Healthcare GmbH – Düsseldorf",
      "type": "Einreichung neuer Dokumente",
      "state": "Nordrhein-Westfalen",
      "amtsgericht": "Amtsgericht Düsseldorf",
      "registernummer": "HRB 104105",
      "registerart": "HRB",
      "company_name": "GE Healthcare GmbH",
      "company_seat": "Düsseldorf",
      "details": "07.07.2025 (Bekanntmachungsdatum)\n\nNordrhein-Westfalen Amtsgericht Düsseldorf HRB 104105\nEinreichung neuer Dokumente\n\nGE Healthcare GmbH\nGesellschaft mit beschränkter Haftung\nDüsseldorf\n\nDem Registergericht ist eine Liste der Mitglieder des Aufsichtsrates eingereicht worden."
    },
    {
      "date": "2025-07-07",
      "id": "114838",
      "original_text": "Löschungsankündigung\nNordrhein-Westfalen Amtsgericht Dortmund HRB 29889\nBEST INVEST Immobilien & Beratung GmbH – Dortmund",
      "type": "Löschungsankündigung",
      "state": "Nordrhein-Westfalen",
      "amtsgericht": "Amtsgericht Dortmund",
      "registernummer": "HRB 29889",
      "registerart": "HRB",
      "company_name": "BEST INVEST Immobilien & Beratung GmbH",
      "company_seat": "Dortmund",
      "details": "07.07.2025 (Bekanntmachungsdatum)\n\nNordrhein-Westfalen Amtsgericht Dortmund HRB 29889\nLöschungsankündigung\n\nBEST INVEST Immobilien & Beratung GmbH\nGesellschaft mit beschränkter Haftung\nDortmund\n\nDas Registergericht beabsichtigt die Gesellschaft von Amts wegen nach § 394 FamFG zu löschen. Die Frist zur Erhebung eines Widerspruchs ist auf zwei Monate festgesetzt."
    },
    {
      "date": "2025-07-07",
      "id": "114839",
      "original_text": "Registerbekanntmachung nach dem Umwandlungsgesetz\nNordrhein-Westfalen Amtsgericht Siegburg HRB 8725\nSOLUM Facility Management GmbH – Sankt Augustin",
      "type": "Registerbekanntmachung nach dem Umwandlungsgesetz",
      "state": "Nordrhein-Westfalen",
      "amtsgericht": "Amtsgericht Siegburg",
      "registernummer": "HRB 8725",
      "registerart": "HRB",
      "company_name": "SOLUM Facility Management GmbH",
      "company_seat": "Sankt Augustin",
      "details": "07.07.2025 (Bekanntmachungsdatum)\n\nNordrhein-Westfalen Amtsgericht Siegburg HRB 8725\nRegisterbekanntmachung nach dem Umwandlungsgesetz 07.07.2025 (Eintragungsdatum)\n\nSOLUM Facility Management GmbH\nGesellschaft mit beschränkter Haftung\nSankt Augustin\n\nDen Gläubigern der an der Verschmelzung beteiligten Rechtsträger ist, wenn sie binnen sechs Monaten nach dem Tag, an dem die Eintragung der Verschmelzung in das Register des Sitzes desjenigen Rechtsträgers, dessen Gläubiger sie sind, nach § 19 Absatz 3 UmwG als bekanntgemacht gilt, ihren Anspruch nach Grund und Höhe schriftlich anmelden, Sicherheit zu leisten, soweit sie nicht Befriedigung verlangen können. Dieses Recht steht den Gläubigern jedoch nur zu, wenn sie glaubhaft machen, dass durch die Verschmelzung die Erfüllung ihrer Forderung gefährdet wird."
    },
    {
      "date": "2025-07-07",
      "id": "114840",
      "original_text": "Registerbekanntmachung nach dem Umwandlungsgesetz\nNordrhein-Westfalen Amtsgericht Köln HRB 79119\nFlexresponse Verwaltungs GmbH – Köln",
      "type": "Registerbekanntmachung nach dem Umwandlungsgesetz",
      "state": "Nordrhein-Westfalen",
      "amtsgericht": "Amtsgericht Köln",
      "registernummer": "HRB 79119",
      "registerart": "HRB",
      "company_name": "Flexresponse Verwaltungs GmbH",
      "company_seat": "Köln",
      "details": "07.07.2025 (Bekanntmachungsdatum)\n\nNordrhein-Westfalen Amtsgericht Köln HRB 79119\nRegisterbekanntmachung nach dem Umwandlungsgesetz 07.07.2025 (Eintragungsdatum)\n\nFlexresponse Verwaltungs GmbH\nGesellschaft mit beschränkter Haftung\nKöln\n\nDen Gläubigern der an der Verschmelzung beteiligten Rechtsträger ist, wenn sie binnen sechs Monaten nach dem Tag, an dem die Eintragung der Verschmelzung in das Register des Sitzes desjenigen Rechtsträgers, dessen Gläubiger sie sind, nach § 19 Absatz 3 UmwG als bekanntgemacht gilt, ihren Anspruch nach Grund und Höhe schriftlich anmelden, Sicherheit zu leisten, soweit sie nicht Befriedigung verlangen können. Dieses Recht steht den Gläubigern jedoch nur zu, wenn sie glaubhaft machen, dass durch die Verschmelzung die Erfüllung ihrer Forderung gefährdet wird."
    },
    {
      "date": "2025-07-07",
      "id": "114841",
      "original_text": "Einreichung neuer Dokumente\nNordrhein-Westfalen Amtsgericht Hagen HRB 4526\nStadtwerke Schwerte GmbH – Schwerte",
      "type": "Einreichung neuer Dokumente",
      "state": "Nordrhein-Westfalen",
      "amtsgericht": "Amtsgericht Hagen",
      "registernummer": "HRB 4526",
      "registerart": "HRB",
      "company_name": "Stadtwerke Schwerte GmbH",
      "company_seat": "Schwerte",
      "details": "07.07.2025 (Bekanntmachungsdatum)\n\nNordrhein-Westfalen Amtsgericht Hagen HRB 4526\nEinreichung neuer Dokumente\n\nStadtwerke Schwerte GmbH\nGesellschaft mit beschränkter Haftung\nSchwerte\n\nDem Registergericht ist eine Liste der Mitglieder des Aufsichtsrates eingereicht worden."
    },
    {
      "date": "2025-07-07",
      "id": "114842",
      "original_text": "Löschungsankündigung\nNordrhein-Westfalen Amtsgericht Bonn HRB 24739\nHotel Bonnoxford GmbH – Bonn",
      "type": "Löschungsankündigung",
      "state": "Nordrhein-Westfalen",
      "amtsgericht": "Amtsgericht Bonn",
      "registernummer": "HRB 24739",
      "registerart": "HRB",
      "company_name": "Hotel Bonnoxford GmbH",
      "company_seat": "Bonn",
      "details": "07.07.2025 (Bekanntmachungsdatum)\n\nNordrhein-Westfalen Amtsgericht Bonn HRB 24739\nLöschungsankündigung\n\nHotel Bonnoxford GmbH\nGesellschaft mit beschränkter Haftung\nBonn\n\nDas Registergericht beabsichtigt die Gesellschaft von Amts wegen nach § 394 FamFG zu löschen. Die Frist zur Erhebung eines Widerspruchs ist auf einen Monat festgesetzt."
    },
    {
      "date": "2025-07-07",
      "id": "114843",
      "original_text": "Registerbekanntmachung nach dem Umwandlungsgesetz\nNordrhein-Westfalen Amtsgericht Mönchengladbach HRB 17503\nJBS Holding GmbH – Mönchengladbach",
      "type": "Registerbekanntmachung nach dem Umwandlungsgesetz",
      "state": "Nordrhein-Westfalen",
      "amtsgericht": "Amtsgericht Mönchengladbach",
      "registernummer": "HRB 17503",
      "registerart": "HRB",
      "company_name": "JBS Holding GmbH",
      "company_seat": "Mönchengladbach",
      "details": "07.07.2025 (Bekanntmachungsdatum)\n\nNordrhein-Westfalen Amtsgericht Mönchengladbach HRB 17503\nRegisterbekanntmachung nach dem Umwandlungsgesetz 07.07.2025 (Eintragungsdatum)\n\nJBS Holding GmbH\nGesellschaft mit beschränkter Haftung\nMönchengladbach\n\nDem Registergericht ist der Entwurf eines Verschmelzungsplanes über die geplante Verschmelzung der Gesellschaft mit beschränkter Haftung nach niederländischem Recht unter Firma JBS Food and Agri B.V. mit Sitz in Wezep / Niederlande (niederländische Handelskammer (KvK) unter Registrierungsnummer: 68481543) mit der Gesellschaft mit beschränkter Haftung nach deutschem Recht unter Firma JBS Holding GmbH mit Sitz in Mönchengladbach (Amtsgericht Mönchengladbach, HRB 17503) eingereicht worden.\n\nDie Rechte der Gläubiger der übernehmenden deutschen JBS Holding GmbH ergeben sich aus § 305 Abs. 2 UmwG i.V.m. § 22 UmwG. Danach ist den Gläubigern der an der Verschmelzung beteiligten JBS Holding GmbH Sicherheit zu leisten, wenn sie binnen sechs Monaten nach dem Tag, an dem die Eintragung der Verschmelzung in das Register des Sitzes der JBS Holding GmbH nach § 305 Abs. 2 i.V.m. § 19 Abs. 3 UmwG als bekannt gemacht gilt, ihren Anspruch nach Grund und Höhe schriftlich anmelden. Dieses Recht steht den Gläubigern nur zu, wenn sie glaubhaft machen, dass durch die Verschmelzung die Erfüllung ihrer Forderungen gefährdet wird. Die Gläubiger sind in der Bekanntmachung der Eintragung der Verschmelzung bei der JBS Holding GmbH gem. § 305 Abs. 2 i.V.m. § 22 Abs. 1 Satz 3 UmwG auf dieses Recht hinzuweisen. Das Recht, Sicherheitsleistung zu verlangen, steht Gläubigern nicht zu, die im Falle der Insolvenz ein Recht auf vorzugsweise Befriedigung aus einer Deckungsmasse haben, die nach gesetzlicher Vorschrift zu ihrem Schutz errichtet und staatlich überwacht ist. Hinsichtlich des Anspruchs der Gläubiger ist unerheblich, ob dieser Anspruch auf Vertrag oder Gesetz beruht. Sicherheitsleistungen können aber nur Gläubiger eines so genannten obligatorischen Anspruchs verlangen. § 22 UmwG erfasst keine dinglichen Ansprüche, da insoweit der Gegenstand des dinglichen Rechts die Sicherheit darstellt. Der Inhalt der Forderung ist nur insoweit von Bedeutung, als diese einen Vermögenswert darstellen muss. Der zu sichernde Anspruch muss deshalb nicht notwendig unmittelbar auf Geld gerichtet sein, vielmehr besteht auch bei einem Anspruch auf Lieferung von Sachen oder sonstigen Leistungen ein Sicherheitsbedürfnis hinsichtlich eines später eventuell daraus resultierenden Schadensersatzanspruches.\n\nDer Anspruch ist unmittelbar gegenüber der JBS Holding GmbH unter deren Geschäftsanschrift Am Rosengarten 4, 41063 Mönchengladbach, geltend zu machen. Hierzu ist eine genaue Beschreibung der dem Anspruch zu Grunde liegenden Forderung erforderlich, so dass eine Individualisierung ohne weitere Nachforschungen möglich ist. Es wird darauf hingewiesen, dass die Sicherheitsleistung spätestens sechs Monate nach Bekanntmachung der Eintragung der Verschmelzung in das Handelsregister der JBS Holding GmbH gefordert werden muss\n\nDie vollständigen Auskünfte über die Modalitäten für die Ausübung der Rechte der Gläubiger und der Minderheitsgesellschafter können kostenlos eingeholt werden bei der JBS Holding GmbH, Am Rosengarten 4, 41063 Mönchengladbach.\n\nBemerkungen zum Verschmelzungsplan können spätestens fünf Arbeitstage vor dem Tag der Gesellschafterversammlung bzw. der notariellen Beurkundung des Verschmelzungsplans an die jeweilige Gesellschaft von den nachfolgend genannten Personen übermittelt werden. Dieser Hinweis ist an folgende Personen gerichtet:\na) an die Anteilsinhaber und Gläubiger der an der grenzüberschreitenden Verschmelzung beteiligten Gesellschaften sowie\nb) an die zuständigen Betriebsräte/Arbeitnehmervertretungen der an der grenzüberschreitenden Verschmelzung beteiligten Gesellschaften oder, soweit es keinen Betriebsrat gibt, an die Arbeitnehmer der an der grenzüberschreitenden Verschmelzung beteiligten Gesellschaften."
    },
    {
      "date": "2025-07-07",
      "id": "114844",
      "original_text": "Registerbekanntmachung nach dem Umwandlungsgesetz\nNordrhein-Westfalen Amtsgericht Hagen HRB 5061\nFritz Schmidt Gesellschaft mit beschränkter Haftung – Wetter (Ruhr)",
      "type": "Registerbekanntmachung nach dem Umwandlungsgesetz",
      "state": "Nordrhein-Westfalen",
      "amtsgericht": "Amtsgericht Hagen",
      "registernummer": "HRB 5061",
      "registerart": "HRB",
      "company_name": "Fritz Schmidt Gesellschaft mit beschränkter Haftung",
      "company_seat": "Wetter (Ruhr)",
      "details": "07.07.2025 (Bekanntmachungsdatum)\n\nNordrhein-Westfalen Amtsgericht Hagen HRB 5061\nRegisterbekanntmachung nach dem Umwandlungsgesetz 04.07.2025 (Eintragungsdatum)\n\nFritz Schmidt Gesellschaft mit beschränkter Haftung\nGesellschaft mit beschränkter Haftung\nWetter (Ruhr)\n\nDen Gläubigern der an der Verschmelzung beteiligten Rechtsträger ist, wenn sie binnen sechs Monaten nach dem Tag, an dem die Eintragung der Verschmelzung in das Register des Sitzes desjenigen Rechtsträgers, dessen Gläubiger sie sind, nach § 19 Absatz 3 UmwG als bekanntgemacht gilt, ihren Anspruch nach Grund und Höhe schriftlich anmelden, Sicherheit zu leisten, soweit sie nicht Befriedigung verlangen können. Dieses Recht steht den Gläubigern jedoch nur zu, wenn sie glaubhaft machen, dass durch die Verschmelzung die Erfüllung ihrer Forderung gefährdet wird."
    },
    {
      "date": "2025-07-07",
      "id": "114845",
      "original_text": "Löschungsankündigung\nNordrhein-Westfalen Amtsgericht Bad Oeynhausen HRB 16681\nWESTFALEN GARAGEN Services UG (haftungsbeschränkt) – Herford",
      "type": "Löschungsankündigung",
      "state": "Nordrhein-Westfalen",
      "amtsgericht": "Amtsgericht Bad Oeynhausen",
      "registernummer": "HRB 16681",
      "registerart": "HRB",
      "company_name": "WESTFALEN GARAGEN Services UG (haftungsbeschränkt)",
      "company_seat": "Herford",
      "details": "07.07.2025 (Bekanntmachungsdatum)\n\nNordrhein-Westfalen Amtsgericht Bad Oeynhausen HRB 16681\nLöschungsankündigung\n\nWESTFALEN GARAGEN Services UG (haftungsbeschränkt)\nGesellschaft mit beschränkter Haftung\nHerford\n\nDas Registergericht beabsichtigt die Gesellschaft von Amts wegen nach § 394 FamFG zu löschen. Die Frist zur Erhebung eines Widerspruchs ist auf einen Monat festgesetzt."
    },
    {
      "date": "2025-07-07",
      "id": "114846",
      "original_text": "Registerbekanntmachung nach dem Umwandlungsgesetz\nNordrhein-Westfalen Amtsgericht Münster HRB 17207\nmeibers.datenschutz GmbH – Münster",
      "type": "Registerbekanntmachung nach dem Umwandlungsgesetz",
      "state": "Nordrhein-Westfalen",
      "amtsgericht": "Amtsgericht Münster",
      "registernummer": "HRB 17207",
      "registerart": "HRB",
      "company_name": "meibers.datenschutz GmbH",
      "company_seat": "Münster",
      "details": "07.07.2025 (Bekanntmachungsdatum)\n\nNordrhein-Westfalen Amtsgericht Münster HRB 17207\nRegisterbekanntmachung nach dem Umwandlungsgesetz 07.07.2025 (Eintragungsdatum)\n\nmeibers.datenschutz GmbH\nGesellschaft mit beschränkter Haftung\nMünster\n\nDen Gläubigern der an der Verschmelzung beteiligten Rechtsträger ist, wenn sie binnen sechs Monaten nach dem Tag, an dem die Eintragung der Verschmelzung in das Register des Sitzes desjenigen Rechtsträgers, dessen Gläubiger sie sind, nach § 19 Absatz 3 UmwG als bekanntgemacht gilt, ihren Anspruch nach Grund und Höhe schriftlich anmelden, Sicherheit zu leisten, soweit sie nicht Befriedigung verlangen können. Dieses Recht steht den Gläubigern jedoch nur zu, wenn sie glaubhaft machen, dass durch die Verschmelzung die Erfüllung ihrer Forderung gefährdet wird."
    },
    {
      "date": "2025-07-07",
      "id": "114847",
      "original_text": "Registerbekanntmachung nach dem Umwandlungsgesetz\nNordrhein-Westfalen Amtsgericht Essen HRB 32710\nthyssenkrupp Projekt 2 GmbH – Essen",
      "type": "Registerbekanntmachung nach dem Umwandlungsgesetz",
      "state": "Nordrhein-Westfalen",
      "amtsgericht": "Amtsgericht Essen",
      "registernummer": "HRB 32710",
      "registerart": "HRB",
      "company_name": "thyssenkrupp Projekt 2 GmbH",
      "company_seat": "Essen",
      "details": "07.07.2025 (Bekanntmachungsdatum)\n\nNordrhein-Westfalen Amtsgericht Essen HRB 32710\nRegisterbekanntmachung nach dem Umwandlungsgesetz\n\nthyssenkrupp Projekt 2 GmbH\nGesellschaft mit beschränkter Haftung\nEssen\n\nDem Registergericht ist der Abspaltungs- und Übernahmevertrag über die geplante Abspaltung von Vermögensteilen der thysenkrupp AG mit Sitz in Duisburg und Essen (Amtsgericht Duisburg HRB 9092 und Amtsgericht Essen HRB 15364)mit der thyssenkrupp Project 2 GmbH mit Sitz in Essen ( Amtsgericht Essen HRB 32710), dem die für den 08.08.2025 vorgesehene Hauptversammlung zustimmen soll, eingereicht worden."
    },
    {
      "date": "2025-07-07",
      "id": "114848",
      "original_text": "Löschungsankündigung\nNordrhein-Westfalen Amtsgericht Essen HRB 28975\nWindooria Unternehmergesellschaft (haftungsbeschränkt) – Essen",
      "type": "Löschungsankündigung",
      "state": "Nordrhein-Westfalen",
      "amtsgericht": "Amtsgericht Essen",
      "registernummer": "HRB 28975",
      "registerart": "HRB",
      "company_name": "Windooria Unternehmergesellschaft (haftungsbeschränkt)",
      "company_seat": "Essen",
      "details": "07.07.2025 (Bekanntmachungsdatum)\n\nNordrhein-Westfalen Amtsgericht Essen HRB 28975\nLöschungsankündigung\n\nWindooria Unternehmergesellschaft (haftungsbeschränkt)\nGesellschaft mit beschränkter Haftung\nEssen\n\nDas Registergericht beabsichtigt die Gesellschaft von Amts wegen nach § 394 FamFG zu löschen. Die Frist zur Erhebung eines Widerspruchs ist auf einen Monat festgesetzt. Dem Registergericht ist eine Liste der Mitglieder des Aufsichtsrates eingereicht worden."
    },
    {
      "date": "2025-07-07",
      "id": "114849",
      "original_text": "Registerbekanntmachung nach dem Umwandlungsgesetz\nNordrhein-Westfalen Amtsgericht Münster HRB 17685\nmeibers.rechtsanwälte Rechtsanwaltsgesellschaft mbH – Münster",
      "type": "Registerbekanntmachung nach dem Umwandlungsgesetz",
      "state": "Nordrhein-Westfalen",
      "amtsgericht": "Amtsgericht Münster",
      "registernummer": "HRB 17685",
      "registerart": "HRB",
      "company_name": "meibers.rechtsanwälte Rechtsanwaltsgesellschaft mbH",
      "company_seat": "Münster",
      "details": "07.07.2025 (Bekanntmachungsdatum)\n\nNordrhein-Westfalen Amtsgericht Münster HRB 17685\nRegisterbekanntmachung nach dem Umwandlungsgesetz 07.07.2025 (Eintragungsdatum)\n\nmeibers.rechtsanwälte Rechtsanwaltsgesellschaft mbH\nGesellschaft mit beschränkter Haftung\nMünster\n\nDen Gläubigern der an der Verschmelzung beteiligten Rechtsträger ist, wenn sie binnen sechs Monaten nach dem Tag, an dem die Eintragung der Verschmelzung in das Register des Sitzes desjenigen Rechtsträgers, dessen Gläubiger sie sind, nach § 19 Absatz 3 UmwG als bekanntgemacht gilt, ihren Anspruch nach Grund und Höhe schriftlich anmelden, Sicherheit zu leisten, soweit sie nicht Befriedigung verlangen können. Dieses Recht steht den Gläubigern jedoch nur zu, wenn sie glaubhaft machen, dass durch die Verschmelzung die Erfüllung ihrer Forderung gefährdet wird."
    },
    {
      "date": "2025-07-07",
      "id": "114850",
      "original_text": "Registerbekanntmachung nach dem Umwandlungsgesetz\nNordrhein-Westfalen Amtsgericht Köln HRB 49413\n\"Erdgasversorgung Oberleichlingen GmbH\" – Leichlingen",
      "type": "Registerbekanntmachung nach dem Umwandlungsgesetz",
      "state": "Nordrhein-Westfalen",
      "amtsgericht": "Amtsgericht Köln",
      "registernummer": "HRB 49413",
      "registerart": "HRB",
      "company_name": "\"Erdgasversorgung Oberleichlingen GmbH\"",
      "company_seat": "Leichlingen",
      "details": "07.07.2025 (Bekanntmachungsdatum)\n\nNordrhein-Westfalen Amtsgericht Köln HRB 49413\nRegisterbekanntmachung nach dem Umwandlungsgesetz 07.07.2025 (Eintragungsdatum)\n\n\"Erdgasversorgung Oberleichlingen GmbH\"\nGesellschaft mit beschränkter Haftung\nLeichlingen\n\nDen Gläubigern der an der Verschmelzung beteiligten Rechtsträger ist, wenn sie binnen sechs Monaten nach dem Tag, an dem die Eintragung der Verschmelzung in das Register des Sitzes desjenigen Rechtsträgers, dessen Gläubiger sie sind, nach § 19 Absatz 3 UmwG als bekanntgemacht gilt, ihren Anspruch nach Grund und Höhe schriftlich anmelden, Sicherheit zu leisten, soweit sie nicht Befriedigung verlangen können. Dieses Recht steht den Gläubigern jedoch nur zu, wenn sie glaubhaft machen, dass durch die Verschmelzung die Erfüllung ihrer Forderung gefährdet wird."
    },
    {
      "date": "2025-07-07",
      "id": "114851",
      "original_text": "Registerbekanntmachung nach dem Umwandlungsgesetz\nNordrhein-Westfalen Amtsgericht Köln HRB 106590\nDRAGON GmbH – Köln",
      "type": "Registerbekanntmachung nach dem Umwandlungsgesetz",
      "state": "Nordrhein-Westfalen",
      "amtsgericht": "Amtsgericht Köln",
      "registernummer": "HRB 106590",
      "registerart": "HRB",
      "company_name": "DRAGON GmbH",
      "company_seat": "Köln",
      "details": "07.07.2025 (Bekanntmachungsdatum)\n\nNordrhein-Westfalen Amtsgericht Köln HRB 106590\nRegisterbekanntmachung nach dem Umwandlungsgesetz 07.07.2025 (Eintragungsdatum)\n\nDRAGON GmbH\nGesellschaft mit beschränkter Haftung\nKöln\n\nDen Gläubigern der an der Verschmelzung beteiligten Rechtsträger ist, wenn sie binnen sechs Monaten nach dem Tag, an dem die Eintragung der Verschmelzung in das Register des Sitzes desjenigen Rechtsträgers, dessen Gläubiger sie sind, nach § 19 Absatz 3 UmwG als bekanntgemacht gilt, ihren Anspruch nach Grund und Höhe schriftlich anmelden, Sicherheit zu leisten, soweit sie nicht Befriedigung verlangen können. Dieses Recht steht den Gläubigern jedoch nur zu, wenn sie glaubhaft machen, dass durch die Verschmelzung die Erfüllung ihrer Forderung gefährdet wird."
    },
    {
      "date": "2025-07-07",
      "id": "114852",
      "original_text": "Registerbekanntmachung nach dem Umwandlungsgesetz\nNordrhein-Westfalen Amtsgericht Köln HRB 112573\nMW Holding UG (haftungsbeschränkt) – Köln",
      "type": "Registerbekanntmachung nach dem Umwandlungsgesetz",
      "state": "Nordrhein-Westfalen",
      "amtsgericht": "Amtsgericht Köln",
      "registernummer": "HRB 112573",
      "registerart": "HRB",
      "company_name": "MW Holding UG (haftungsbeschränkt)",
      "company_seat": "Köln",
      "details": "07.07.2025 (Bekanntmachungsdatum)\n\nNordrhein-Westfalen Amtsgericht Köln HRB 112573\nRegisterbekanntmachung nach dem Umwandlungsgesetz 07.07.2025 (Eintragungsdatum)\n\nMW Holding UG (haftungsbeschränkt)\nGesellschaft mit beschränkter Haftung\nKöln\n\nDen Gläubigern der an der Verschmelzung beteiligten Rechtsträger ist, wenn sie binnen sechs Monaten nach dem Tag, an dem die Eintragung der Verschmelzung in das Register des Sitzes desjenigen Rechtsträgers, dessen Gläubiger sie sind, nach § 19 Absatz 3 UmwG als bekanntgemacht gilt, ihren Anspruch nach Grund und Höhe schriftlich anmelden, Sicherheit zu leisten, soweit sie nicht Befriedigung verlangen können. Dieses Recht steht den Gläubigern jedoch nur zu, wenn sie glaubhaft machen, dass durch die Verschmelzung die Erfüllung ihrer Forderung gefährdet wird."
    },
    {
      "date": "2025-07-07",
      "id": "114853",
      "original_text": "Registerbekanntmachung nach dem Umwandlungsgesetz\nNordrhein-Westfalen Amtsgericht Köln HRB 50868\nTelesis Markiersysteme GmbH – Radevormwald",
      "type": "Registerbekanntmachung nach dem Umwandlungsgesetz",
      "state": "Nordrhein-Westfalen",
      "amtsgericht": "Amtsgericht Köln",
      "registernummer": "HRB 50868",
      "registerart": "HRB",
      "company_name": "Telesis Markiersysteme GmbH",
      "company_seat": "Radevormwald",
      "details": "07.07.2025 (Bekanntmachungsdatum)\n\nNordrhein-Westfalen Amtsgericht Köln HRB 50868\nRegisterbekanntmachung nach dem Umwandlungsgesetz 07.07.2025 (Eintragungsdatum)\n\nTelesis Markiersysteme GmbH\nGesellschaft mit beschränkter Haftung\nRadevormwald\n\nDen Gläubigern der an der Verschmelzung beteiligten Rechtsträger ist, wenn sie binnen sechs Monaten nach dem Tag, an dem die Eintragung der Verschmelzung in das Register des Sitzes desjenigen Rechtsträgers, dessen Gläubiger sie sind, nach § 19 Absatz 3 UmwG als bekanntgemacht gilt, ihren Anspruch nach Grund und Höhe schriftlich anmelden, Sicherheit zu leisten, soweit sie nicht Befriedigung verlangen können. Dieses Recht steht den Gläubigern jedoch nur zu, wenn sie glaubhaft machen, dass durch die Verschmelzung die Erfüllung ihrer Forderung gefährdet wird."
    },
    {
      "date": "2025-07-07",
      "id": "114854",
      "original_text": "Registerbekanntmachung nach dem Umwandlungsgesetz\nNordrhein-Westfalen Amtsgericht Köln HRB 109733\nRyu Sports GmbH – Köln",
      "type": "Registerbekanntmachung nach dem Umwandlungsgesetz",
      "state": "Nordrhein-Westfalen",
      "amtsgericht": "Amtsgericht Köln",
      "registernummer": "HRB 109733",
      "registerart": "HRB",
      "company_name": "Ryu Sports GmbH",
      "company_seat": "Köln",
      "details": "07.07.2025 (Bekanntmachungsdatum)\n\nNordrhein-Westfalen Amtsgericht Köln HRB 109733\nRegisterbekanntmachung nach dem Umwandlungsgesetz 07.07.2025 (Eintragungsdatum)\n\nRyu Sports GmbH\nGesellschaft mit beschränkter Haftung\nKöln\n\nDen Gläubigern der an der Verschmelzung beteiligten Rechtsträger ist, wenn sie binnen sechs Monaten nach dem Tag, an dem die Eintragung der Verschmelzung in das Register des Sitzes desjenigen Rechtsträgers, dessen Gläubiger sie sind, nach § 19 Absatz 3 UmwG als bekanntgemacht gilt, ihren Anspruch nach Grund und Höhe schriftlich anmelden, Sicherheit zu leisten, soweit sie nicht Befriedigung verlangen können. Dieses Recht steht den Gläubigern jedoch nur zu, wenn sie glaubhaft machen, dass durch die Verschmelzung die Erfüllung ihrer Forderung gefährdet wird."
    },
    {
      "date": "2025-07-07",
      "id": "114855",
      "original_text": "Registerbekanntmachung nach dem Umwandlungsgesetz\nNordrhein-Westfalen Amtsgericht Köln HRB 34886\nbähr ingenieure GmbH – Köln",
      "type": "Registerbekanntmachung nach dem Umwandlungsgesetz",
      "state": "Nordrhein-Westfalen",
      "amtsgericht": "Amtsgericht Köln",
      "registernummer": "HRB 34886",
      "registerart": "HRB",
      "company_name": "bähr ingenieure GmbH",
      "company_seat": "Köln",
      "details": "07.07.2025 (Bekanntmachungsdatum)\n\nNordrhein-Westfalen Amtsgericht Köln HRB 34886\nRegisterbekanntmachung nach dem Umwandlungsgesetz 07.07.2025 (Eintragungsdatum)\n\nbähr ingenieure GmbH\nGesellschaft mit beschränkter Haftung\nKöln\n\nDen Gläubigern der an der Verschmelzung beteiligten Rechtsträger ist, wenn sie binnen sechs Monaten nach dem Tag, an dem die Eintragung der Verschmelzung in das Register des Sitzes desjenigen Rechtsträgers, dessen Gläubiger sie sind, nach § 19 Absatz 3 UmwG als bekanntgemacht gilt, ihren Anspruch nach Grund und Höhe schriftlich anmelden, Sicherheit zu leisten, soweit sie nicht Befriedigung verlangen können. Dieses Recht steht den Gläubigern jedoch nur zu, wenn sie glaubhaft machen, dass durch die Verschmelzung die Erfüllung ihrer Forderung gefährdet wird."
    },
    {
      "date": "2025-07-07",
      "id": "114856",
      "original_text": "Löschungsankündigung\nNordrhein-Westfalen Amtsgericht Düsseldorf HRB 29800\nKlaus Wilke GmbH – Düsseldorf",
      "type": "Löschungsankündigung",
      "state": "Nordrhein-Westfalen",
      "amtsgericht": "Amtsgericht Düsseldorf",
      "registernummer": "HRB 29800",
      "registerart": "HRB",
      "company_name": "Klaus Wilke GmbH",
      "company_seat": "Düsseldorf",
      "details": "07.07.2025 (Bekanntmachungsdatum)\n\nNordrhein-Westfalen Amtsgericht Düsseldorf HRB 29800\nLöschungsankündigung\n\nKlaus Wilke GmbH\nGesellschaft mit beschränkter Haftung\nDüsseldorf\n\nDas Registergericht beabsichtigt die Gesellschaft von Amts wegen nach § 394 Abs. 1 FamFG zu löschen. Die Frist zur Erhebung eines Widerspruchs ist auf 3 Wochen festgesetzt.\n\nRechtsbehelfsbelehrung:\nDas Widerspruchsrecht steht jedem zu, der an der Unterlassung der Löschung ein berechtigtes Interesse hat. Der Widerspruch ist bei dem Amtsgericht Düsseldorf -Registergericht-, Werdener Straße 1, 40227 Düsseldorf schriftlich in deutscher Sprache oder zur Niederschrift der Geschäftsstelle einzulegen. Der Widerspruch kann auch zur Niederschrift der Geschäftsstelle eines jeden Amtsgerichtes abgegeben werden. Die Einlegung ist auch durch Übertragung eines elektronischen Dokuments an die elektronische Poststelle des Gerichts möglich. Das elektronische Dokument muss für die Bearbeitung durch das Gericht geeignet und mit einer qualifizierten elektronischen Signatur der verantwortenden Person versehen sein oder von der verantwortenden Person signiert und auf einem sicheren Übermittlungsweg gemäß § 130a ZPO nach näherer Maßgabe der Verordnung über die technischen Rahmenbedingungen des elektronischen Rechtsverkehrs und über das besondere elektronische Behördenpostfach (BGBl. I, S.3803) eingereicht werden. Weitere Informationen erhalten Sie auf der Internetseite www.justiz.de.\nDer Widerspruch muss spätestens innerhalb der gesetzten Frist nach dem Datum der Bekanntmachung der Löschungsankündigung bei dem Amtsgericht - Registergericht - Düsseldorf eingegangen sein.  Dies gilt auch dann, wenn der Widerspruch zur Niederschrift der Geschäftsstelle eines anderen Amtsgerichtes abgegeben wurde. Die Frist beginnt mit dem Tage der Bekanntmachung der Löschungsankündigung in dem für die Bekanntmachung der Eintragungen in das Handelsregister bestimmten elektronischen Informations- und Kommunikationssystem nach § 10 des Handelsgesetzbuches. Fällt das Ende der Frist auf einen Sonntag, einen allgemeinen Feiertag oder Sonnabend, so endet die Frist mit Ablauf des nächsten Werktages.\nDer Widerspruch muss die Bezeichnung der angefochtenen Löschungsankündigung sowie die Erklärung enthalten, dass Widerspruch gegen diese Löschungsankündigung eingelegt wird. Er ist zu unterzeichnen und soll begründet werden."
    },
    {
      "date": "2025-07-07",
      "id": "114857",
      "original_text": "Registerbekanntmachung nach dem Umwandlungsgesetz\nNordrhein-Westfalen Amtsgericht Köln HRB 48601\nStadtwerke Leichlingen GmbH – Leichlingen",
      "type": "Registerbekanntmachung nach dem Umwandlungsgesetz",
      "state": "Nordrhein-Westfalen",
      "amtsgericht": "Amtsgericht Köln",
      "registernummer": "HRB 48601",
      "registerart": "HRB",
      "company_name": "Stadtwerke Leichlingen GmbH",
      "company_seat": "Leichlingen",
      "details": "07.07.2025 (Bekanntmachungsdatum)\n\nNordrhein-Westfalen Amtsgericht Köln HRB 48601\nRegisterbekanntmachung nach dem Umwandlungsgesetz 07.07.2025 (Eintragungsdatum)\n\nStadtwerke Leichlingen GmbH\nGesellschaft mit beschränkter Haftung\nLeichlingen\n\nDen Gläubigern der an der Verschmelzung beteiligten Rechtsträger ist, wenn sie binnen sechs Monaten nach dem Tag, an dem die Eintragung der Verschmelzung in das Register des Sitzes desjenigen Rechtsträgers, dessen Gläubiger sie sind, nach § 19 Absatz 3 UmwG als bekanntgemacht gilt, ihren Anspruch nach Grund und Höhe schriftlich anmelden, Sicherheit zu leisten, soweit sie nicht Befriedigung verlangen können. Dieses Recht steht den Gläubigern jedoch nur zu, wenn sie glaubhaft machen, dass durch die Verschmelzung die Erfüllung ihrer Forderung gefährdet wird."
    },
    {
      "date": "2025-07-07",
      "id": "114858",
      "original_text": "Löschungsankündigung\nNordrhein-Westfalen Amtsgericht Köln HRA 28257\nH & S Haustechnik GmbH & Co. KG – Köln",
      "type": "Löschungsankündigung",
      "state": "Nordrhein-Westfalen",
      "amtsgericht": "Amtsgericht Köln",
      "registernummer": "HRA 28257",
      "registerart": "HRA",
      "company_name": "H & S Haustechnik GmbH & Co. KG",
      "company_seat": "Köln",
      "details": "07.07.2025 (Bekanntmachungsdatum)\n\nNordrhein-Westfalen Amtsgericht Köln HRA 28257\nLöschungsankündigung\n\nH & S Haustechnik GmbH & Co. KG\nKommanditgesellschaft\nKöln\n\nDas Registergericht beabsichtigt die Firma von Amts wegen nach § 394 FamFG zu löschen. Die Frist zur Erhebung eines Widerspruchs ist auf 1 Monat festgesetzt."
    },
    {
      "date": "2025-07-07",
      "id": "114859",
      "original_text": "Löschungsankündigung\nNordrhein-Westfalen Amtsgericht Bonn HRA 8230\nX-Ventor GmbH & Co. KG – Bonn",
      "type": "Löschungsankündigung",
      "state": "Nordrhein-Westfalen",
      "amtsgericht": "Amtsgericht Bonn",
      "registernummer": "HRA 8230",
      "registerart": "HRA",
      "company_name": "X-Ventor GmbH & Co. KG",
      "company_seat": "Bonn",
      "details": "07.07.2025 (Bekanntmachungsdatum)\n\nNordrhein-Westfalen Amtsgericht Bonn HRA 8230\nLöschungsankündigung\n\nX-Ventor GmbH & Co. KG\nKommanditgesellschaft\nBonn\n\nDas Registergericht beabsichtigt die Firma von Amts wegen nach § 394 FamFG zu löschen. Die Frist zur Erhebung eines Widerspruchs ist auf einen Monat festgesetzt."
    },
    {
      "date": "2025-07-07",
      "id": "114860",
      "original_text": "Registerbekanntmachung nach dem Umwandlungsgesetz\nNordrhein-Westfalen Amtsgericht Köln HRB 113210\nMARTON Solar GmbH – Köln",
      "type": "Registerbekanntmachung nach dem Umwandlungsgesetz",
      "state": "Nordrhein-Westfalen",
      "amtsgericht": "Amtsgericht Köln",
      "registernummer": "HRB 113210",
      "registerart": "HRB",
      "company_name": "MARTON Solar GmbH",
      "company_seat": "Köln",
      "details": "07.07.2025 (Bekanntmachungsdatum)\n\nNordrhein-Westfalen Amtsgericht Köln HRB 113210\nRegisterbekanntmachung nach dem Umwandlungsgesetz 07.07.2025 (Eintragungsdatum)\n\nMARTON Solar GmbH\nGesellschaft mit beschränkter Haftung\nKöln\n\nDen Gläubigern der an der Verschmelzung beteiligten Rechtsträger ist, wenn sie binnen sechs Monaten nach dem Tag, an dem die Eintragung der Verschmelzung in das Register des Sitzes desjenigen Rechtsträgers, dessen Gläubiger sie sind, nach § 19 Absatz 3 UmwG als bekanntgemacht gilt, ihren Anspruch nach Grund und Höhe schriftlich anmelden, Sicherheit zu leisten, soweit sie nicht Befriedigung verlangen können. Dieses Recht steht den Gläubigern jedoch nur zu, wenn sie glaubhaft machen, dass durch die Verschmelzung die Erfüllung ihrer Forderung gefährdet wird."
    },
    {
      "date": "2025-07-07",
      "id": "114861",
      "original_text": "Einreichung neuer Dokumente\nNordrhein-Westfalen Amtsgericht Dortmund HRB 8204\nPVAG Polizeiversicherungs-Aktiengesellschaft – Dortmund",
      "type": "Einreichung neuer Dokumente",
      "state": "Nordrhein-Westfalen",
      "amtsgericht": "Amtsgericht Dortmund",
      "registernummer": "HRB 8204",
      "registerart": "HRB",
      "company_name": "PVAG Polizeiversicherungs-Aktiengesellschaft",
      "company_seat": "Dortmund",
      "details": "07.07.2025 (Bekanntmachungsdatum)\n\nNordrhein-Westfalen Amtsgericht Dortmund HRB 8204\nEinreichung neuer Dokumente\n\nPVAG Polizeiversicherungs-Aktiengesellschaft\nAktiengesellschaft\nDortmund\n\nDem Registergericht ist eine neue Liste der Mitglieder des Aufsichtsrates eingereicht worden."
    },
    {
      "date": "2025-07-07",
      "id": "114862",
      "original_text": "Löschungsankündigung\nNordrhein-Westfalen Amtsgericht Düsseldorf HRB 71387\nPort Event Center GmbH – Düsseldorf",
      "type": "Löschungsankündigung",
      "state": "Nordrhein-Westfalen",
      "amtsgericht": "Amtsgericht Düsseldorf",
      "registernummer": "HRB 71387",
      "registerart": "HRB",
      "company_name": "Port Event Center GmbH",
      "company_seat": "Düsseldorf",
      "details": "07.07.2025 (Bekanntmachungsdatum)\n\nNordrhein-Westfalen Amtsgericht Düsseldorf HRB 71387\nLöschungsankündigung\n\nPort Event Center GmbH\nGesellschaft mit beschränkter Haftung\nDüsseldorf\n\nDas Registergericht beabsichtigt die Gesellschaft von Amts wegen nach § 394 FamFG zu löschen. Die Frist zur Erhebung eines Widerspruchs ist auf 3 Wochen festgesetzt.\n\nRechtsbehelfsbelehrung:\nDas Widerspruchsrecht steht jedem zu, der an der Unterlassung der Löschung ein berechtigtes Interesse hat. Der Widerspruch ist bei dem Amtsgericht Düsseldorf -Registergericht-, Werdener Straße 1, 40227 Düsseldorf schriftlich in deutscher Sprache oder zur Niederschrift der Geschäftsstelle einzulegen. Der Widerspruch kann auch zur Niederschrift der Geschäftsstelle eines jeden Amtsgerichtes abgegeben werden. Die Einlegung ist auch durch Übertragung eines elektronischen Dokuments an die elektronische Poststelle des Gerichts möglich. Das elektronische Dokument muss für die Bearbeitung durch das Gericht geeignet und mit einer qualifizierten elektronischen Signatur der verantwortenden Person versehen sein oder von der verantwortenden Person signiert und auf einem sicheren Übermittlungsweg gemäß § 130a ZPO nach näherer Maßgabe der Verordnung über die technischen Rahmenbedingungen des elektronischen Rechtsverkehrs und über das besondere elektronische Behördenpostfach (BGBl. I, S.3803) eingereicht werden. Weitere Informationen erhalten Sie auf der Internetseite www.justiz.de.\nDer Widerspruch muss spätestens innerhalb der gesetzten Frist nach dem Datum der Bekanntmachung der Löschungsankündigung bei dem Amtsgericht - Registergericht - Düsseldorf eingegangen sein.  Dies gilt auch dann, wenn der Widerspruch zur Niederschrift der Geschäftsstelle eines anderen Amtsgerichtes abgegeben wurde. Die Frist beginnt mit dem Tage der Bekanntmachung der Löschungsankündigung in dem für die Bekanntmachung der Eintragungen in das Handelsregister bestimmten elektronischen Informations- und Kommunikationssystem nach § 10 des Handelsgesetzbuches. Fällt das Ende der Frist auf einen Sonntag, einen allgemeinen Feiertag oder Sonnabend, so endet die Frist mit Ablauf des nächsten Werktages.\nDer Widerspruch muss die Bezeichnung der angefochtenen Löschungsankündigung sowie die Erklärung enthalten, dass Widerspruch gegen diese Löschungsankündigung eingelegt wird. Er ist zu unterzeichnen und soll begründet werden."
    },
    {
      "date": "2025-07-07",
      "id": "114863",
      "original_text": "Registerbekanntmachung nach dem Umwandlungsgesetz\nNordrhein-Westfalen Amtsgericht Mönchengladbach HRB 9754\nBosal Deutschland GmbH – Viersen",
      "type": "Registerbekanntmachung nach dem Umwandlungsgesetz",
      "state": "Nordrhein-Westfalen",
      "amtsgericht": "Amtsgericht Mönchengladbach",
      "registernummer": "HRB 9754",
      "registerart": "HRB",
      "company_name": "Bosal Deutschland GmbH",
      "company_seat": "Viersen",
      "details": "07.07.2025 (Bekanntmachungsdatum)\n\nNordrhein-Westfalen Amtsgericht Mönchengladbach HRB 9754\nRegisterbekanntmachung nach dem Umwandlungsgesetz 07.07.2025 (Eintragungsdatum)\n\nBosal Deutschland GmbH\nGesellschaft mit beschränkter Haftung\nViersen\n\nDem Registergericht ist der Entwurf eines Verschmelzungsplanes über die geplante Verschmelzung der Gesellschaft mit beschränkter Haftung nach deutschem Recht unter Firma Bosal Deutschland GmbH mit Sitz in Viersen (Amtsgericht Mönchengladbach, HRB 9754) als übertragender Gesellschaft mit der Gesellschaft mit beschränkter Haftung nach dem Recht der Tschechischen Republik unter Firma Bosal Aftermarket Europe, spol. s r.o. mit Sitz in Brandýs nad Labem-Stará Boleslav, (Handelsregister des Stadtgerichts in Prag unter Sektion C Aktennummer 289611 (Identifikationsnummer 068 22 479)) als übernehmender Gesellschaft eingereicht worden.\n\nDie Bosal Deutschland GmbH hat Arbeitnehmer und einen Betriebsrat. Die Bosal Aftermarket Europe, spol. s r.o hat Arbeitnehmer; bei Bosal Aftermarket Europe, spol, s r.o ist eine Arbeitnehmervertretung (Gewerkschaften) tätig.\n\nEin Verschmelzungsbeschluss der Bosal Deutschland GmbH ist gemäß §§ 312 Abs. 2, 307 Abs. 3 UmwG nicht erforderlich\nDie vollständigen Auskünfte über diese Modalitäten können kostenlos eingeholt werden bei den Gesellschaften: Bosal Deutschland GmbH, Metallstraße 5, 41751 Viersen/Deutschland, E-Mail: heinz.richter@bosal.com, und bei der Bosal Aftermarket Europe, spol. s r.o., Zápská 1857, Brandýs nad Labem, PLZ 250 01, Brandýs nad Labem-Stará Boleslav, Tschechische Republik, E-Mail: elisabeth.bos@bosal.com.\n\nBemerkungen zum Verschmelzungsplan können spätestens fünf Arbeitstage vor dem Tag der Gesellschafterversammlung bzw. der notariellen Beurkundung des Verschmelzungsplans an die jeweilige Gesellschaft von den nachfolgend genannten Personen übermittelt werden. Dieser Hinweis ist an folgende Personen gerichtet:\na) an die Anteilsinhaber und Gläubiger der an der grenzüberschreitenden Verschmelzung beteiligten Gesellschaften sowie\nb) an die zuständigen Betriebsräte/Arbeitnehmervertretungen der an der grenzüberschreitenden Verschmelzung beteiligten Gesellschaften oder, soweit es keinen Betriebsrat gibt, an die Arbeitnehmer der an der grenzüberschreitenden Verschmelzung beteiligten Gesellschaften."
    },
    {
      "date": "2025-07-07",
      "id": "114864",
      "original_text": "Registerbekanntmachung nach dem Umwandlungsgesetz\nNordrhein-Westfalen Amtsgericht Essen HRB 15364\nthyssenkrupp AG – Duisburg und Essen",
      "type": "Registerbekanntmachung nach dem Umwandlungsgesetz",
      "state": "Nordrhein-Westfalen",
      "amtsgericht": "Amtsgericht Essen",
      "registernummer": "HRB 15364",
      "registerart": "HRB",
      "company_name": "thyssenkrupp AG",
      "company_seat": "Duisburg und Essen",
      "details": "07.07.2025 (Bekanntmachungsdatum)\n\nNordrhein-Westfalen Amtsgericht Essen HRB 15364\nRegisterbekanntmachung nach dem Umwandlungsgesetz\n\nthyssenkrupp AG\nAktiengesellschaft\nDuisburg und Essen\n\nDem Registergericht ist der Abspaltungs- und Übernahmevertrag zwischen der thyssenkrupp AG mit Sitz in Duisburg und Essen (Amtsgericht Duisburg HRB 9092 und Amtsgericht Essen HRB 15364) und der thyssenkrupp Projekt 2 GmbH mit Sitz in Essen (Amtsgericht Essen HRB 32710) eingereicht worden."
    },
    {
      "date": "2025-07-07",
      "id": "114865",
      "original_text": "Registerbekanntmachung nach dem Umwandlungsgesetz\nNordrhein-Westfalen Amtsgericht Lemgo HRB 1273\nRainer Rudolph Dachdecker GmbH – Bad Salzuflen",
      "type": "Registerbekanntmachung nach dem Umwandlungsgesetz",
      "state": "Nordrhein-Westfalen",
      "amtsgericht": "Amtsgericht Lemgo",
      "registernummer": "HRB 1273",
      "registerart": "HRB",
      "company_name": "Rainer Rudolph Dachdecker GmbH",
      "company_seat": "Bad Salzuflen",
      "details": "07.07.2025 (Bekanntmachungsdatum)\n\nNordrhein-Westfalen Amtsgericht Lemgo HRB 1273\nRegisterbekanntmachung nach dem Umwandlungsgesetz 07.07.2025 (Eintragungsdatum)\n\nRainer Rudolph Dachdecker GmbH\nGesellschaft mit beschränkter Haftung\nBad Salzuflen\n\nDen Gläubigern der an der Verschmelzung beteiligten Rechtsträger ist, wenn sie binnen sechs Monaten nach dem Tag, an dem die Eintragung der Verschmelzung in das Register des Sitzes desjenigen Rechtsträgers, dessen Gläubiger sie sind, nach § 19 Absatz 3 UmwG als bekanntgemacht gilt, ihren Anspruch nach Grund und Höhe schriftlich anmelden, Sicherheit zu leisten, soweit sie nicht Befriedigung verlangen können. Dieses Recht steht den Gläubigern jedoch nur zu, wenn sie glaubhaft machen, dass durch die Verschmelzung die Erfüllung ihrer Forderung gefährdet wird."
    },
    {
      "date": "2025-07-07",
      "id": "114866",
      "original_text": "Registerbekanntmachung nach dem Umwandlungsgesetz\nNordrhein-Westfalen Amtsgericht Düsseldorf HRB 36441\nVictoria Lebensversicherung Aktiengesellschaft – Düsseldorf",
      "type": "Registerbekanntmachung nach dem Umwandlungsgesetz",
      "state": "Nordrhein-Westfalen",
      "amtsgericht": "Amtsgericht Düsseldorf",
      "registernummer": "HRB 36441",
      "registerart": "HRB",
      "company_name": "Victoria Lebensversicherung Aktiengesellschaft",
      "company_seat": "Düsseldorf",
      "details": "07.07.2025 (Bekanntmachungsdatum)\n\nNordrhein-Westfalen Amtsgericht Düsseldorf HRB 36441\nRegisterbekanntmachung nach dem Umwandlungsgesetz\n\nVictoria Lebensversicherung Aktiengesellschaft\nAktiengesellschaft\nDüsseldorf\n\nDem Registergericht ist der Entwurf eines Vertrages über die geplante Verschmelzung der die Victoria Lebensversicherung Aktiengesellschaft mit der ERGO Lebensversicherung Aktiengesellschaft eingereicht worden."
    },
    {
      "date": "2025-07-07",
      "id": "114867",
      "original_text": "Einreichung neuer Dokumente\nNordrhein-Westfalen Amtsgericht Dortmund HRB 25925\nAmazon Logistik Werne GmbH – Werne",
      "type": "Einreichung neuer Dokumente",
      "state": "Nordrhein-Westfalen",
      "amtsgericht": "Amtsgericht Dortmund",
      "registernummer": "HRB 25925",
      "registerart": "HRB",
      "company_name": "Amazon Logistik Werne GmbH",
      "company_seat": "Werne",
      "details": "07.07.2025 (Bekanntmachungsdatum)\n\nNordrhein-Westfalen Amtsgericht Dortmund HRB 25925\nEinreichung neuer Dokumente\n\nAmazon Logistik Werne GmbH\nGesellschaft mit beschränkter Haftung\nWerne\n\nDem Registergericht ist eine neue Liste der Mitglieder des Aufsichtsrates eingereicht worden."
    },
    {
      "date": "2025-07-07",
      "id": "114868",
      "original_text": "Löschungsankündigung\nNordrhein-Westfalen Amtsgericht Neuss HRB 19556\nHGH Service UG (haftungsbeschränkt) – Kaarst",
      "type": "Löschungsankündigung",
      "state": "Nordrhein-Westfalen",
      "amtsgericht": "Amtsgericht Neuss",
      "registernummer": "HRB 19556",
      "registerart": "HRB",
      "company_name": "HGH Service UG (haftungsbeschränkt)",
      "company_seat": "Kaarst",
      "details": "07.07.2025 (Bekanntmachungsdatum)\n\nNordrhein-Westfalen Amtsgericht Neuss HRB 19556\nLöschungsankündigung\n\nHGH Service UG (haftungsbeschränkt)\nGesellschaft mit beschränkter Haftung\nKaarst\n\nEs ist beabsichtigt, die Gesellschaft wegen Vermögenslosigkeit aufgrund des § 394 Abs. 1 FamFG zu löschen. Frist zur Geltendmachung eines Widerspruchs: 1 Monat.\n\nRechtsbehelfsbelehrung:\nGegen diese Verfügung können Sie Widerspruch einlegen.\nDer Widerspruch ist bei dem Amtsgericht Neuss - Registergericht -, Breite Str. 48, 41460 Neuss schriftlich in deutscher Sprache oder zur Niederschrift der Geschäftsstelle einzulegen.\nDer Widerspruch kann auch zur Niederschrift der Geschäftsstelle eines jeden Amtsgerichtes abgegeben werden.\nDie Einlegung ist auch durch Übertragung eines elektronischen Dokuments an die elektronische Poststelle des Gerichts möglich. Das elektronische Dokument muss für die Bearbeitung durch das Gericht geeignet und mit einer qualifizierten elektronischen Signatur der verantwortenden Person versehen sein oder von der verantwortenden Person signiert und auf einem sicheren Übermittlungsweg gemäß § 130a ZPO nach näherer Maßgabe der Verordnung über die technischen Rahmenbedingungen des elektronischen Rechtsverkehrs und über das besondere elektronische Behördenpostfach (BGBl. I, S.3803) eingereicht werden. Weitere Informationen erhalten Sie auf der Internetseite www.justiz.de.\nDer Widerspruch muss spätestens innerhalb der gesetzten Frist nach der schriftlichen Bekanntgabe der Verfügung bei dem Amtsgericht - Registergericht - Neuss eingegangen sein. Dies gilt auch dann, wenn der Widerspruch zur Niederschrift der Geschäftsstelle eines anderen Amtsgerichtes abgegeben wurde. Die Frist beginnt mit der schriftlichen Bekanntgabe der Verfügung. Die Bekanntgabe ist entweder durch Zustellung oder am dritten Tage nach Aufgabe zur Post bewirkt. Fällt das Ende der Frist auf einen Sonntag, einen allgemeinen Feiertag oder Sonnabend, so endet die Frist mit Ablauf des nächsten Werktages.\n\nDer Widerspruch muss die Bezeichnung der angefochtenen Verfügung sowie die Erklärung enthalten, dass Widerspruch gegen diese Verfügung eingelegt wird. Er ist zu unterzeichnen und soll begründet werden."
    },
    {
      "date": "2025-07-07",
      "id": "114869",
      "original_text": "Registerbekanntmachung nach dem Umwandlungsgesetz\nNordrhein-Westfalen Amtsgericht Köln HRB 123561\nElmos Semiconductor SE – Leverkusen",
      "type": "Registerbekanntmachung nach dem Umwandlungsgesetz",
      "state": "Nordrhein-Westfalen",
      "amtsgericht": "Amtsgericht Köln",
      "registernummer": "HRB 123561",
      "registerart": "HRB",
      "company_name": "Elmos Semiconductor SE",
      "company_seat": "Leverkusen",
      "details": "07.07.2025 (Bekanntmachungsdatum)\n\nNordrhein-Westfalen Amtsgericht Köln HRB 123561\nRegisterbekanntmachung nach dem Umwandlungsgesetz\n\nElmos Semiconductor SE\nEuropäische Aktiengesellschaft (SE)\nLeverkusen\n\nDem Registergericht ist ein Verschmelzungsvertrag über die geplante Verschmelzung der Mechaless Systems GmbH mit Sitz in Bruchsal (Amtsgericht Mannheim, HRB 109528) mit der Elmos SemiconductorSE mit Sitz  in Leverkusen, (Amtsgerichts Köln ,HRB 123561) eingereicht worden."
    },
    {
      "date": "2025-07-07",
      "id": "114870",
      "original_text": "Registerbekanntmachung nach dem Umwandlungsgesetz\nNordrhein-Westfalen Amtsgericht Bad Oeynhausen HRB 20035\nKanther Immobilien GmbH – Bünde",
      "type": "Registerbekanntmachung nach dem Umwandlungsgesetz",
      "state": "Nordrhein-Westfalen",
      "amtsgericht": "Amtsgericht Bad Oeynhausen",
      "registernummer": "HRB 20035",
      "registerart": "HRB",
      "company_name": "Kanther Immobilien GmbH",
      "company_seat": "Bünde",
      "details": "07.07.2025 (Bekanntmachungsdatum)\n\nNordrhein-Westfalen Amtsgericht Bad Oeynhausen HRB 20035\nRegisterbekanntmachung nach dem Umwandlungsgesetz 07.07.2025 (Eintragungsdatum)\n\nKanther Immobilien GmbH\nGesellschaft mit beschränkter Haftung\nBünde\n\nDen Gläubigern der an der Ausgliederung beteiligten Rechtsträger ist, wenn sie binnen sechs Monaten nach dem Tag, an dem die Eintragung der Ausgliederung in das Register des Sitzes desjenigen Rechtsträgers, dessen Gläubiger sie sind, nach § 19 Absatz 3 UmwG als bekanntgemacht gilt, ihren Anspruch nach Grund und Höhe schriftlich anmelden, Sicherheit zu leisten, soweit sie nicht Befriedigung verlangen können. Dieses Recht steht den Gläubigern jedoch nur zu, wenn sie glaubhaft machen, dass durch die Ausgliederung die Erfüllung ihrer Forderung gefährdet wird."
    },
    {
      "date": "2025-07-07",
      "id": "114871",
      "original_text": "Löschungsankündigung\nNordrhein-Westfalen Amtsgericht Wuppertal HRB 25928\nBrandsConcept UG (haftungsbeschränkt) – Remscheid",
      "type": "Löschungsankündigung",
      "state": "Nordrhein-Westfalen",
      "amtsgericht": "Amtsgericht Wuppertal",
      "registernummer": "HRB 25928",
      "registerart": "HRB",
      "company_name": "BrandsConcept UG (haftungsbeschränkt)",
      "company_seat": "Remscheid",
      "details": "07.07.2025 (Bekanntmachungsdatum)\n\nNordrhein-Westfalen Amtsgericht Wuppertal HRB 25928\nLöschungsankündigung 04.07.2025 (Eintragungsdatum)\n\nBrandsConcept UG (haftungsbeschränkt)\nGesellschaft mit beschränkter Haftung\nRemscheid\n\nDas Registergericht beabsichtigt die Gesellschaft von Amts wegen nach § 394 FamFG zu löschen. Die Frist zur Erhebung eines Widerspruchs ist auf einen Monat festgesetzt."
    },
    {
      "date": "2025-07-07",
      "id": "114872",
      "original_text": "Einreichung neuer Dokumente\nHessen Amtsgericht Frankfurt am Main HRB 130133\nPwC Deutschland Holding Aktiengesellschaft Wirtschaftsprüfungsgesellschaft – Frankfurt am Main",
      "type": "Einreichung neuer Dokumente",
      "state": "Hessen",
      "amtsgericht": "Amtsgericht Frankfurt am Main",
      "registernummer": "HRB 130133",
      "registerart": "HRB",
      "company_name": "PwC Deutschland Holding Aktiengesellschaft Wirtschaftsprüfungsgesellschaft",
      "company_seat": "Frankfurt am Main",
      "details": "07.07.2025 (Bekanntmachungsdatum)\n\nHessen Amtsgericht Frankfurt am Main HRB 130133\nEinreichung neuer Dokumente\n\nPwC Deutschland Holding Aktiengesellschaft Wirtschaftsprüfungsgesellschaft\nAktiengesellschaft\nFrankfurt am Main\n\nDurch eine Änderung in den Personen der Aufsichtsratsmitglieder ist eine Liste der Mitglieder des Aufsichtsrates zum Handelsregister eingereicht worden."
    },
    {
      "date": "2025-07-07",
      "id": "114873",
      "original_text": "Einreichung neuer Dokumente\nHessen Amtsgericht Frankfurt am Main HRB 118350\nSTRABAG Property and Facility Services GmbH – Frankfurt am Main",
      "type": "Einreichung neuer Dokumente",
      "state": "Hessen",
      "amtsgericht": "Amtsgericht Frankfurt am Main",
      "registernummer": "HRB 118350",
      "registerart": "HRB",
      "company_name": "STRABAG Property and Facility Services GmbH",
      "company_seat": "Frankfurt am Main",
      "details": "07.07.2025 (Bekanntmachungsdatum)\n\nHessen Amtsgericht Frankfurt am Main HRB 118350\nEinreichung neuer Dokumente 07.07.2025 (Eintragungsdatum)\n\nSTRABAG Property and Facility Services GmbH\nGesellschaft mit beschränkter Haftung\nFrankfurt am Main\n\nDurch eine Änderung in den Personen der Aufsichtsratsmitglieder ist eine Liste der Mitglieder des Aufsichtsrates zum Handelsregister eingereicht worden."
    },
    {
      "date": "2025-07-07",
      "id": "114874",
      "original_text": "Registerbekanntmachung nach dem Umwandlungsgesetz\nHessen Amtsgericht Bad Homburg v.d.H. HRA 6302\nDaniel Frommel e. K. – Bad Homburg v. d. Höhe",
      "type": "Registerbekanntmachung nach dem Umwandlungsgesetz",
      "state": "Hessen",
      "amtsgericht": "Amtsgericht Bad Homburg v.d.H.",
      "registernummer": "HRA 6302",
      "registerart": "HRA",
      "company_name": "Daniel Frommel e. K.",
      "company_seat": "Bad Homburg v. d. Höhe",
      "details": "07.07.2025 (Bekanntmachungsdatum)\n\nHessen Amtsgericht Bad Homburg v.d.H. HRA 6302\nRegisterbekanntmachung nach dem Umwandlungsgesetz 07.07.2025 (Eintragungsdatum)\n\nDaniel Frommel e. K.\nEinzelkaufmann / Einzelkauffrau\nBad Homburg v. d. Höhe\n\nDen Gläubigern der an der Ausgliederung beteiligten Rechtsträger ist, wenn sie binnen sechs Monaten nach dem Tag, an dem die Eintragung der Ausgliederung in das Register des Sitzes desjenigen Rechtsträgers, dessen Gläubiger sie sind, nach §§ 125, 19 Absatz 3 UmwG bekannt gemacht worden ist, ihren Anspruch nach Grund und Höhe schriftlich anmelden, Sicherheit zu leisten, soweit sie nicht Befriedigung verlangen können. Dieses Recht steht den Gläubigern jedoch nur zu, wenn sie glaubhaft machen, dass durch die Ausgliederung die Erfüllung ihrer Forderung gefährdet wird."
    },
    {
      "date": "2025-07-07",
      "id": "114875",
      "original_text": "Einreichung neuer Dokumente\nHessen Amtsgericht Frankfurt am Main HRB 114056\nSource For Alpha AG – Frankfurt am Main",
      "type": "Einreichung neuer Dokumente",
      "state": "Hessen",
      "amtsgericht": "Amtsgericht Frankfurt am Main",
      "registernummer": "HRB 114056",
      "registerart": "HRB",
      "company_name": "Source For Alpha AG",
      "company_seat": "Frankfurt am Main",
      "details": "07.07.2025 (Bekanntmachungsdatum)\n\nHessen Amtsgericht Frankfurt am Main HRB 114056\nEinreichung neuer Dokumente 07.07.2025 (Eintragungsdatum)\n\nSource For Alpha AG\nAktiengesellschaft\nFrankfurt am Main\n\nDurch eine Änderung in den Personen der Aufsichtsratsmitglieder ist eine Liste der Mitglieder des Aufsichtsrates zum Handelsregister eingereicht worden."
    },
    {
      "date": "2025-07-07",
      "id": "114876",
      "original_text": "Löschungsankündigung\nHessen Amtsgericht Wiesbaden HRB 25104\nINTRACT GmbH nach luxemburgischem Recht, KOMPETENZ, DIE VERBINDET, Société á responsabilité limitée, Niederlassung Deutschland – Wiesbaden",
      "type": "Löschungsankündigung",
      "state": "Hessen",
      "amtsgericht": "Amtsgericht Wiesbaden",
      "registernummer": "HRB 25104",
      "registerart": "HRB",
      "company_name": "INTRACT GmbH nach luxemburgischem Recht, KOMPETENZ, DIE VERBINDET, Société á responsabilité limitée, Niederlassung Deutschland",
      "company_seat": "Wiesbaden",
      "details": "07.07.2025 (Bekanntmachungsdatum)\n\nHessen Amtsgericht Wiesbaden HRB 25104\nLöschungsankündigung\n\nINTRACT GmbH nach luxemburgischem Recht, KOMPETENZ, DIE VERBINDET, Société á responsabilité limitée, Niederlassung Deutschland\nRechtsform ausländischen Rechts HRB\nWiesbaden\n\nDas Registergericht beabsichtigt die im Handelsregister eingetragene Gesellschaft von Amts wegen nach § 395 Abs. 1 FamFG zu löschen. Die Frist zur Erhebung eines Widerspruchs gegen die beabsichtigte Löschung wird auf 2 Monate festgesetzt."
    },
    {
      "date": "2025-07-07",
      "id": "114877",
      "original_text": "Einreichung neuer Dokumente\nHessen Amtsgericht Darmstadt HRB 102702\nRöchling Medical Solutions SE – Brensbach",
      "type": "Einreichung neuer Dokumente",
      "state": "Hessen",
      "amtsgericht": "Amtsgericht Darmstadt",
      "registernummer": "HRB 102702",
      "registerart": "HRB",
      "company_name": "Röchling Medical Solutions SE",
      "company_seat": "Brensbach",
      "details": "07.07.2025 (Bekanntmachungsdatum)\n\nHessen Amtsgericht Darmstadt HRB 102702\nEinreichung neuer Dokumente\n\nRöchling Medical Solutions SE\nEuropäische Aktiengesellschaft (SE)\nBrensbach\n\nDurch eine Änderung in den Personen der Aufsichtsratsmitglieder ist eine Liste der Mitglieder des Aufsichtsrates zum Handelsregister eingereicht worden."
    },
    {
      "date": "2025-07-07",
      "id": "114878",
      "original_text": "Registerbekanntmachung nach dem Umwandlungsgesetz\nHessen Amtsgericht Frankfurt am Main HRB 137812\nBRIX Hausverwaltung GmbH – Frankfurt am Main",
      "type": "Registerbekanntmachung nach dem Umwandlungsgesetz",
      "state": "Hessen",
      "amtsgericht": "Amtsgericht Frankfurt am Main",
      "registernummer": "HRB 137812",
      "registerart": "HRB",
      "company_name": "BRIX Hausverwaltung GmbH",
      "company_seat": "Frankfurt am Main",
      "details": "07.07.2025 (Bekanntmachungsdatum)\n\nHessen Amtsgericht Frankfurt am Main HRB 137812\nRegisterbekanntmachung nach dem Umwandlungsgesetz 07.07.2025 (Eintragungsdatum)\n\nBRIX Hausverwaltung GmbH\nGesellschaft mit beschränkter Haftung\nFrankfurt am Main\n\nDen Gläubigern der an der Abspaltung beteiligten Rechtsträger ist, wenn sie binnen sechs Monaten nach dem Tag, an dem die Eintragung der Abspaltung in das Register des Sitzes desjenigen Rechtsträgers, dessen Gläubiger sie sind, nach §§ 125, 19 Absatz 3 UmwG bekannt gemacht worden ist, ihren Anspruch nach Grund und Höhe schriftlich anmelden, Sicherheit zu leisten, soweit sie nicht Befriedigung verlangen können. Dieses Recht steht den Gläubigern jedoch nur zu, wenn sie glaubhaft machen, dass durch die Abspaltung die Erfüllung ihrer Forderung gefährdet wird."
    },
    {
      "date": "2025-07-07",
      "id": "114879",
      "original_text": "Registerbekanntmachung nach dem Umwandlungsgesetz\nHessen Amtsgericht Frankfurt am Main HRB 131611\nCapital Land Holding GmbH – Frankfurt am Main",
      "type": "Registerbekanntmachung nach dem Umwandlungsgesetz",
      "state": "Hessen",
      "amtsgericht": "Amtsgericht Frankfurt am Main",
      "registernummer": "HRB 131611",
      "registerart": "HRB",
      "company_name": "Capital Land Holding GmbH",
      "company_seat": "Frankfurt am Main",
      "details": "07.07.2025 (Bekanntmachungsdatum)\n\nHessen Amtsgericht Frankfurt am Main HRB 131611\nRegisterbekanntmachung nach dem Umwandlungsgesetz 07.07.2025 (Eintragungsdatum)\n\nCapital Land Holding GmbH\nGesellschaft mit beschränkter Haftung\nFrankfurt am Main\n\nDen Gläubigern der an der formwechselnden Umwandlung beteiligten Rechtsträger ist, wenn sie binnen sechs Monaten nach dem Tag, an dem die Eintragung der formwechselnden Umwandlung in das Register des Sitzes desjenigen Rechtsträgers, dessen Gläubiger sie sind, nach § 201 UmwG bekannt gemacht worden ist, ihren Anspruch nach Grund und Höhe schriftlich anmelden, Sicherheit zu leisten, soweit sie nicht Befriedigung verlangen können. Dieses Recht steht den Gläubigern jedoch nur zu, wenn sie glaubhaft machen, dass durch die formwechselnden Umwandlung die Erfüllung ihrer Forderung gefährdet wird."
    },
    {
      "date": "2025-07-07",
      "id": "114880",
      "original_text": "Löschungsankündigung\nHessen Amtsgericht Limburg HRB 7289\nY.S. Bau GmbH – Hadamar",
      "type": "Löschungsankündigung",
      "state": "Hessen",
      "amtsgericht": "Amtsgericht Limburg",
      "registernummer": "HRB 7289",
      "registerart": "HRB",
      "company_name": "Y.S. Bau GmbH",
      "company_seat": "Hadamar",
      "details": "07.07.2025 (Bekanntmachungsdatum)\n\nHessen Amtsgericht Limburg HRB 7289\nLöschungsankündigung\n\nY.S. Bau GmbH\nGesellschaft mit beschränkter Haftung\nHadamar\n\nDas Registergericht beabsichtigt die im Handelsregister eingetragene Gesellschaft von Amts wegen nach § 394 FamFG zu löschen. Die Frist zur Erhebung eines Widerspruchs gegen die beabsichtigte Löschung wird auf 3 Monate festgesetzt."
    },
    {
      "date": "2025-07-07",
      "id": "114881",
      "original_text": "Registerbekanntmachung nach dem Umwandlungsgesetz\nHessen Amtsgericht Wetzlar HRB 9362\nDr. Erich Pfeiffer Stiftung Verwaltung GmbH – Wetzlar",
      "type": "Registerbekanntmachung nach dem Umwandlungsgesetz",
      "state": "Hessen",
      "amtsgericht": "Amtsgericht Wetzlar",
      "registernummer": "HRB 9362",
      "registerart": "HRB",
      "company_name": "Dr. Erich Pfeiffer Stiftung Verwaltung GmbH",
      "company_seat": "Wetzlar",
      "details": "07.07.2025 (Bekanntmachungsdatum)\n\nHessen Amtsgericht Wetzlar HRB 9362\nRegisterbekanntmachung nach dem Umwandlungsgesetz 07.07.2025 (Eintragungsdatum)\n\nDr. Erich Pfeiffer Stiftung Verwaltung GmbH\nGesellschaft mit beschränkter Haftung\nWetzlar\n\nDen Gläubigern der an der Verschmelzung beteiligten Rechtsträger ist, wenn sie binnen sechs Monaten nach dem Tag, an dem die Eintragung der Verschmelzung in das Register des Sitzes desjenigen Rechtsträgers, dessen Gläubiger sie sind, nach § 19 Absatz 3 UmwG bekannt gemacht worden ist, ihren Anspruch nach Grund und Höhe schriftlich anmelden, Sicherheit zu leisten, soweit sie nicht Befriedigung verlangen können. Dieses Recht steht den Gläubigern jedoch nur zu, wenn sie glaubhaft machen, dass durch die Verschmelzung die Erfüllung ihrer Forderung gefährdet wird."
    },
    {
      "date": "2025-07-07",
      "id": "114882",
      "original_text": "Registerbekanntmachung nach dem Umwandlungsgesetz\nHessen Amtsgericht Frankfurt am Main HRA 45057\nBRIX GmbH & Co. KG – Frankfurt am Main",
      "type": "Registerbekanntmachung nach dem Umwandlungsgesetz",
      "state": "Hessen",
      "amtsgericht": "Amtsgericht Frankfurt am Main",
      "registernummer": "HRA 45057",
      "registerart": "HRA",
      "company_name": "BRIX GmbH & Co. KG",
      "company_seat": "Frankfurt am Main",
      "details": "07.07.2025 (Bekanntmachungsdatum)\n\nHessen Amtsgericht Frankfurt am Main HRA 45057\nRegisterbekanntmachung nach dem Umwandlungsgesetz 07.07.2025 (Eintragungsdatum)\n\nBRIX GmbH & Co. KG\nKommanditgesellschaft\nFrankfurt am Main\n\nDen Gläubigern der an der Abspaltung beteiligten Rechtsträger ist, wenn sie binnen sechs Monaten nach dem Tag, an dem die Eintragung der Abspaltung in das Register des Sitzes desjenigen Rechtsträgers, dessen Gläubiger sie sind, nach §§ 125, 19 Absatz 3 UmwG bekannt gemacht worden ist, ihren Anspruch nach Grund und Höhe schriftlich anmelden, Sicherheit zu leisten, soweit sie nicht Befriedigung verlangen können. Dieses Recht steht den Gläubigern jedoch nur zu, wenn sie glaubhaft machen, dass durch die Abspaltung die Erfüllung ihrer Forderung gefährdet wird."
    },
    {
      "date": "2025-07-07",
      "id": "114883",
      "original_text": "Registerbekanntmachung nach dem Umwandlungsgesetz\nHessen Amtsgericht Frankfurt am Main HRB 23296\nN T E Nachrichtentechnik und Elektronik GmbH, Vertrieb und Service – Frankfurt am Main",
      "type": "Registerbekanntmachung nach dem Umwandlungsgesetz",
      "state": "Hessen",
      "amtsgericht": "Amtsgericht Frankfurt am Main",
      "registernummer": "HRB 23296",
      "registerart": "HRB",
      "company_name": "N T E Nachrichtentechnik und Elektronik GmbH, Vertrieb und Service",
      "company_seat": "Frankfurt am Main",
      "details": "07.07.2025 (Bekanntmachungsdatum)\n\nHessen Amtsgericht Frankfurt am Main HRB 23296\nRegisterbekanntmachung nach dem Umwandlungsgesetz 07.07.2025 (Eintragungsdatum)\n\nN T E  Nachrichtentechnik und Elektronik GmbH, Vertrieb und Service\nGesellschaft mit beschränkter Haftung\nFrankfurt am Main\n\nDen Gläubigern der an der Verschmelzung beteiligten Rechtsträger ist, wenn sie binnen sechs Monaten nach dem Tag, an dem die Eintragung der Verschmelzung in das Register des Sitzes derjenigen Rechtsträger deren Gläubiger sie sind, nach § 19 Absatz 3 UmwG bekannt gemacht worden ist, ihren Anspruch nach Grund und Höhe schriftlich anmelden, Sicherheit zu leisten, soweit sie nicht Befriedigung verlangen können. Dieses Recht steht den Gläubigern jedoch nur zu, wenn sie glaubhaft machen, dass durch die Verschmelzung die Erfüllung ihrer Forderung gefährdet wird."
    },
    {
      "date": "2025-07-07",
      "id": "114884",
      "original_text": "Registerbekanntmachung nach dem Umwandlungsgesetz\nHessen Amtsgericht Wetzlar HRB 6742\nDr. Erich Pfeiffer GmbH – Wetzlar",
      "type": "Registerbekanntmachung nach dem Umwandlungsgesetz",
      "state": "Hessen",
      "amtsgericht": "Amtsgericht Wetzlar",
      "registernummer": "HRB 6742",
      "registerart": "HRB",
      "company_name": "Dr. Erich Pfeiffer GmbH",
      "company_seat": "Wetzlar",
      "details": "07.07.2025 (Bekanntmachungsdatum)\n\nHessen Amtsgericht Wetzlar HRB 6742\nRegisterbekanntmachung nach dem Umwandlungsgesetz 07.07.2025 (Eintragungsdatum)\n\nDr. Erich Pfeiffer GmbH\nGesellschaft mit beschränkter Haftung\nWetzlar\n\nDen Gläubigern der an der Verschmelzung beteiligten Rechtsträger ist, wenn sie binnen sechs Monaten nach dem Tag, an dem die Eintragung der Verschmelzung in das Register des Sitzes desjenigen Rechtsträgers, dessen Gläubiger sie sind, nach § 19 Absatz 3 UmwG bekannt gemacht worden ist, ihren Anspruch nach Grund und Höhe schriftlich anmelden, Sicherheit zu leisten, soweit sie nicht Befriedigung verlangen können. Dieses Recht steht den Gläubigern jedoch nur zu, wenn sie glaubhaft machen, dass durch die Verschmelzung die Erfüllung ihrer Forderung gefährdet wird."
    },
    {
      "date": "2025-07-07",
      "id": "114885",
      "original_text": "Einreichung neuer Dokumente\nHessen Amtsgericht Frankfurt am Main HRB 95593\nEGC EUROGROUP Consulting AG – Frankfurt am Main",
      "type": "Einreichung neuer Dokumente",
      "state": "Hessen",
      "amtsgericht": "Amtsgericht Frankfurt am Main",
      "registernummer": "HRB 95593",
      "registerart": "HRB",
      "company_name": "EGC EUROGROUP Consulting AG",
      "company_seat": "Frankfurt am Main",
      "details": "07.07.2025 (Bekanntmachungsdatum)\n\nHessen Amtsgericht Frankfurt am Main HRB 95593\nEinreichung neuer Dokumente\n\nEGC EUROGROUP Consulting AG\nAktiengesellschaft\nFrankfurt am Main\n\nDurch eine Änderung in den Personen der Aufsichtsratsmitglieder ist eine Liste der Mitglieder des Aufsichtsrates zum Handelsregister eingereicht worden."
    },
    {
      "date": "2025-07-07",
      "id": "114886",
      "original_text": "Registerbekanntmachung nach dem Umwandlungsgesetz\nHessen Amtsgericht Bad Homburg v.d.H. HRB 16705\nFrommel Datenschutz GmbH – Bad Homburg v. d. Höhe",
      "type": "Registerbekanntmachung nach dem Umwandlungsgesetz",
      "state": "Hessen",
      "amtsgericht": "Amtsgericht Bad Homburg v.d.H.",
      "registernummer": "HRB 16705",
      "registerart": "HRB",
      "company_name": "Frommel Datenschutz GmbH",
      "company_seat": "Bad Homburg v. d. Höhe",
      "details": "07.07.2025 (Bekanntmachungsdatum)\n\nHessen Amtsgericht Bad Homburg v.d.H. HRB 16705\nRegisterbekanntmachung nach dem Umwandlungsgesetz 07.07.2025 (Eintragungsdatum)\n\nFrommel Datenschutz GmbH\nGesellschaft mit beschränkter Haftung\nBad Homburg v. d. Höhe\n\nDen Gläubigern der an der Ausgliederung beteiligten Rechtsträger ist, wenn sie binnen sechs Monaten nach dem Tag, an dem die Eintragung der Ausgliederung in das Register des Sitzes desjenigen Rechtsträgers, dessen Gläubiger sie sind, nach §§ 125, 19 Absatz 3 UmwG bekannt gemacht worden ist, ihren Anspruch nach Grund und Höhe schriftlich anmelden, Sicherheit zu leisten, soweit sie nicht Befriedigung verlangen können. Dieses Recht steht den Gläubigern jedoch nur zu, wenn sie glaubhaft machen, dass durch die Ausgliederung die Erfüllung ihrer Forderung gefährdet wird."
    },
    {
      "date": "2025-07-07",
      "id": "114887",
      "original_text": "Registerbekanntmachung nach dem Umwandlungsgesetz\nHessen Amtsgericht Darmstadt VR 2487\nVogelschutz- und Zuchtverein Weiterstadt e.V. AZ-Ortsgruppe Darmstadt – Weiterstadt",
      "type": "Registerbekanntmachung nach dem Umwandlungsgesetz",
      "state": "Hessen",
      "amtsgericht": "Amtsgericht Darmstadt",
      "registernummer": "VR 2487",
      "registerart": "VR",
      "company_name": "Vogelschutz- und Zuchtverein Weiterstadt e.V. AZ-Ortsgruppe Darmstadt",
      "company_seat": "Weiterstadt",
      "details": "07.07.2025 (Bekanntmachungsdatum)\n\nHessen Amtsgericht Darmstadt VR 2487\nRegisterbekanntmachung nach dem Umwandlungsgesetz 07.07.2025 (Eintragungsdatum)\n\nVogelschutz- und Zuchtverein Weiterstadt e.V. AZ-Ortsgruppe Darmstadt\neingetragener Verein\nWeiterstadt\n\nDen Gläubigern der an der Verschmelzung beteiligten Rechtsträger ist, wenn sie binnen sechs Monaten nach dem Tag, an dem die Eintragung der Verschmelzung in das Register des Sitzes derjenigen Rechtsträger deren Gläubiger sie sind, nach § 19 Absatz 3 UmwG bekannt gemacht worden ist, ihren Anspruch nach Grund und Höhe schriftlich anmelden, Sicherheit zu leisten, soweit sie nicht Befriedigung verlangen können. Dieses Recht steht den Gläubigern jedoch nur zu, wenn sie glaubhaft machen, dass durch die Verschmelzung die Erfüllung ihrer Forderung gefährdet wird."
    },
    {
      "date": "2025-07-07",
      "id": "114888",
      "original_text": "Löschungsankündigung\nHessen Amtsgericht Eschwege HRB 2241\nEAG engineering GmbH – Hessisch Lichtenau",
      "type": "Löschungsankündigung",
      "state": "Hessen",
      "amtsgericht": "Amtsgericht Eschwege",
      "registernummer": "HRB 2241",
      "registerart": "HRB",
      "company_name": "EAG engineering GmbH",
      "company_seat": "Hessisch Lichtenau",
      "details": "07.07.2025 (Bekanntmachungsdatum)\n\nHessen Amtsgericht Eschwege HRB 2241\nLöschungsankündigung\n\nEAG engineering GmbH\nGesellschaft mit beschränkter Haftung\nHessisch Lichtenau\n\nDas Registergericht beabsichtigt die im Handelsregister eingetragene Gesellschaft von Amts wegen nach § 394 FamFG zu löschen. Die Frist zur Erhebung eines Widerspruchs gegen die beabsichtigte Löschung wird auf 3 Monate festgesetzt."
    },
    {
      "date": "2025-07-07",
      "id": "114889",
      "original_text": "Löschungsankündigung\nHessen Amtsgericht Kassel HRB 18346\nCamilo Transport GmbH – Kassel",
      "type": "Löschungsankündigung",
      "state": "Hessen",
      "amtsgericht": "Amtsgericht Kassel",
      "registernummer": "HRB 18346",
      "registerart": "HRB",
      "company_name": "Camilo Transport GmbH",
      "company_seat": "Kassel",
      "details": "07.07.2025 (Bekanntmachungsdatum)\n\nHessen Amtsgericht Kassel HRB 18346\nLöschungsankündigung\n\nCamilo Transport GmbH\nGesellschaft mit beschränkter Haftung\nKassel\n\nEs ist beabsichtigt den im Handelsregister eingetragenen Geschäftsführer Nicolae-Cosmin Micu, geb. am 18.12.1986, zuletzt wohnhaft in 34127 Kassel, zur Zeit unbekannten Aufenthalts, gemäß § 395 FamFG von Amts wegen zu löschen, da das Amts als Geschäftsführer durch rechtskräftige Gewerbeuntersagung des Regierungspräsidiums Kassel vom 24.01.2025 kraft Gesetzes erloschen ist (§ 6 Abs. 2 S. 2 Nr. 2 GmbHG) und die Eintragung somit nachträglich unzulässig geworden ist. Hiergegen kann innerhalb eines Monats nach Veröffentlichung dieser Verfügung Widerspruch bei dem Amtsgericht Kassel eingelegt werden."
    },
    {
      "date": "2025-07-07",
      "id": "114890",
      "original_text": "Löschungsankündigung\nHessen Amtsgericht Darmstadt HRB 103046\nDolunay GmbH – Höchst im Odenwald",
      "type": "Löschungsankündigung",
      "state": "Hessen",
      "amtsgericht": "Amtsgericht Darmstadt",
      "registernummer": "HRB 103046",
      "registerart": "HRB",
      "company_name": "Dolunay GmbH",
      "company_seat": "Höchst im Odenwald",
      "details": "07.07.2025 (Bekanntmachungsdatum)\n\nHessen Amtsgericht Darmstadt HRB 103046\nLöschungsankündigung 07.07.2025 (Eintragungsdatum)\n\nDolunay GmbH\nGesellschaft mit beschränkter Haftung\nHöchst im Odenwald\n\nDas Registergericht beabsichtigt die im Handelsregister eingetragene Gesellschaft von Amts wegen nach § 394 FamFG zu löschen. Die Frist zur Erhebung eines Widerspruchs gegen die beabsichtigte Löschung wird auf 3 Monate festgesetzt."
    }
  ]
}