{
  "date": "2025-07-05",
  "date_of_scrape": "2025-07-06T04:13:34.856Z",
  "tool_version": "0.2.0",
  "number_of_announcements": 39,
  "announcements": [
    {
      "date": "2025-07-05",
      "id": "114705",
      "original_text": "Registerbekanntmachung nach dem Umwandlungsgesetz\nBayern Amtsgericht Kempten (Allgäu) GnR 857\nVR Bank Kempten-Oberallgäu eG – Kempten (Allgäu)",
      "type": "Registerbekanntmachung nach dem Umwandlungsgesetz",
      "state": "Bayern",
      "amtsgericht": "Amtsgericht Kempten (Allgäu)",
      "registernummer": "GnR 857",
      "registerart": "GnR",
      "company_name": "VR Bank Kempten-Oberallgäu eG",
      "company_seat": "Kempten (Allgäu)",
      "details": "05.07.2025 (Bekanntmachungsdatum)\n\nBayern Amtsgericht Kempten (Allgäu) GnR 857\nRegisterbekanntmachung nach dem Umwandlungsgesetz 04.07.2025 (Eintragungsdatum)\n\nVR Bank Kempten-Oberallgäu eG\neingetragene Genossenschaft\nKempten (Allgäu)\n\nDen Gläubigern der an der Verschmelzung beteiligten Rechtsträger ist, wenn sie binnen sechs Monaten nach dem Tag, an dem die Eintragung der Verschmelzung in das Register des Sitzes desjenigen Rechtsträgers, dessen Gläubiger sie sind, nach § 19 Abs. 3 UmwG als bekannt gemacht gilt, ihren Anspruch nach Grund und Höhe in Textform anmelden, Sicherheit zu leisten, soweit sie nicht Befriedigung verlangen können. Dieses Recht steht den Gläubigern jedoch nur zu, wenn sie glaubhaft machen, dass durch die Verschmelzung die Erfüllung ihrer Forderung gefährdet wird."
    },
    {
      "date": "2025-07-05",
      "id": "114706",
      "original_text": "Registerbekanntmachung nach dem Umwandlungsgesetz\nBayern Amtsgericht Fürth HRA 7334\nSchenk Immobilien GmbH & Co. KG – Fürth",
      "type": "Registerbekanntmachung nach dem Umwandlungsgesetz",
      "state": "Bayern",
      "amtsgericht": "Amtsgericht Fürth",
      "registernummer": "HRA 7334",
      "registerart": "HRA",
      "company_name": "Schenk Immobilien GmbH & Co. KG",
      "company_seat": "Fürth",
      "details": "05.07.2025 (Bekanntmachungsdatum)\n\nBayern Amtsgericht Fürth HRA 7334\nRegisterbekanntmachung nach dem Umwandlungsgesetz 04.07.2025 (Eintragungsdatum)\n\nSchenk Immobilien GmbH & Co. KG\nKommanditgesellschaft\nFürth\n\nDen Gläubigern der an der Verschmelzung beteiligten Rechtsträger ist, wenn sie binnen sechs Monaten nach dem Tag, an dem die Eintragung der Verschmelzung in das Register des Sitzes desjenigen Rechtsträgers, dessen Gläubiger sie sind, nach § 19 Abs. 3 UmwG als bekannt gemacht gilt, ihren Anspruch nach Grund und Höhe in Textform anmelden, Sicherheit zu leisten, soweit sie nicht Befriedigung verlangen können. Dieses Recht steht den Gläubigern jedoch nur zu, wenn sie glaubhaft machen, dass durch die Verschmelzung die Erfüllung ihrer Forderung gefährdet wird."
    },
    {
      "date": "2025-07-05",
      "id": "114707",
      "original_text": "Registerbekanntmachung nach dem Umwandlungsgesetz\nBayern Amtsgericht München HRB 70290\nBayernwerk Natur GmbH – Unterschleißheim",
      "type": "Registerbekanntmachung nach dem Umwandlungsgesetz",
      "state": "Bayern",
      "amtsgericht": "Amtsgericht München",
      "registernummer": "HRB 70290",
      "registerart": "HRB",
      "company_name": "Bayernwerk Natur GmbH",
      "company_seat": "Unterschleißheim",
      "details": "05.07.2025 (Bekanntmachungsdatum)\n\nBayern Amtsgericht München HRB 70290\nRegisterbekanntmachung nach dem Umwandlungsgesetz 04.07.2025 (Eintragungsdatum)\n\nBayernwerk Natur GmbH\nGesellschaft mit beschränkter Haftung\nUnterschleißheim\n\nDen Gläubigern der an der Verschmelzung beteiligten Rechtsträger ist, wenn sie binnen sechs Monaten nach dem Tag, an dem die Eintragung der Verschmelzung in das Register des Sitzes desjenigen Rechtsträgers, dessen Gläubiger sie sind, nach § 19 Abs. 3 UmwG als bekannt gemacht gilt, ihren Anspruch nach Grund und Höhe in Textform anmelden, Sicherheit zu leisten, soweit sie nicht Befriedigung verlangen können. Dieses Recht steht den Gläubigern jedoch nur zu, wenn sie glaubhaft machen, dass durch die Verschmelzung die Erfüllung ihrer Forderung gefährdet wird."
    },
    {
      "date": "2025-07-05",
      "id": "114708",
      "original_text": "Registerbekanntmachung nach dem Umwandlungsgesetz\nBayern Amtsgericht Passau HRA 13824\nGetränke Rudolf Oppowa e.K. – Kirchham",
      "type": "Registerbekanntmachung nach dem Umwandlungsgesetz",
      "state": "Bayern",
      "amtsgericht": "Amtsgericht Passau",
      "registernummer": "HRA 13824",
      "registerart": "HRA",
      "company_name": "Getränke Rudolf Oppowa e.K.",
      "company_seat": "Kirchham",
      "details": "05.07.2025 (Bekanntmachungsdatum)\n\nBayern Amtsgericht Passau HRA 13824\nRegisterbekanntmachung nach dem Umwandlungsgesetz 04.07.2025 (Eintragungsdatum)\n\nGetränke Rudolf Oppowa e.K.\nEinzelkaufmann / Einzelkauffrau\nKirchham\n\nDen Gläubigern der an der Ausgliederung beteiligten Rechtsträger ist, wenn sie binnen sechs Monaten nach dem Tag, an dem die Eintragung der Ausgliederung in das Register des Sitzes desjenigen Rechtsträgers, dessen Gläubiger sie sind, nach §§ 125, 19 Abs. 3 UmwG als bekannt gemacht gilt, ihren Anspruch nach Grund und Höhe in Textform anmelden, Sicherheit zu leisten, soweit sie nicht Befriedigung verlangen können. Dieses Recht steht den Gläubigern jedoch nur zu, wenn sie glaubhaft machen, dass durch die Ausgliederung die Erfüllung ihrer Forderung gefährdet wird."
    },
    {
      "date": "2025-07-05",
      "id": "114709",
      "original_text": "Registerbekanntmachung nach dem Umwandlungsgesetz\nBayern Amtsgericht München HRB 263652\nCollego GmbH – München",
      "type": "Registerbekanntmachung nach dem Umwandlungsgesetz",
      "state": "Bayern",
      "amtsgericht": "Amtsgericht München",
      "registernummer": "HRB 263652",
      "registerart": "HRB",
      "company_name": "Collego GmbH",
      "company_seat": "München",
      "details": "05.07.2025 (Bekanntmachungsdatum)\n\nBayern Amtsgericht München HRB 263652\nRegisterbekanntmachung nach dem Umwandlungsgesetz 04.07.2025 (Eintragungsdatum)\n\nCollego GmbH\nGesellschaft mit beschränkter Haftung\nMünchen\n\nDen Gläubigern der an der Verschmelzung beteiligten Rechtsträger ist, wenn sie binnen sechs Monaten nach dem Tag, an dem die Eintragung der Verschmelzung in das Register des Sitzes desjenigen Rechtsträgers, dessen Gläubiger sie sind, nach § 19 Abs. 3 UmwG als bekannt gemacht gilt, ihren Anspruch nach Grund und Höhe in Textform anmelden, Sicherheit zu leisten, soweit sie nicht Befriedigung verlangen können. Dieses Recht steht den Gläubigern jedoch nur zu, wenn sie glaubhaft machen, dass durch die Verschmelzung die Erfüllung ihrer Forderung gefährdet wird."
    },
    {
      "date": "2025-07-05",
      "id": "114710",
      "original_text": "Registerbekanntmachung nach dem Umwandlungsgesetz\nBayern Amtsgericht München HRB 104615\nBuchhandlung L. Werner GmbH – München",
      "type": "Registerbekanntmachung nach dem Umwandlungsgesetz",
      "state": "Bayern",
      "amtsgericht": "Amtsgericht München",
      "registernummer": "HRB 104615",
      "registerart": "HRB",
      "company_name": "Buchhandlung L. Werner GmbH",
      "company_seat": "München",
      "details": "05.07.2025 (Bekanntmachungsdatum)\n\nBayern Amtsgericht München HRB 104615\nRegisterbekanntmachung nach dem Umwandlungsgesetz 04.07.2025 (Eintragungsdatum)\n\nBuchhandlung L. Werner GmbH\nGesellschaft mit beschränkter Haftung\nMünchen\n\nDen Gläubigern der an der Verschmelzung beteiligten Rechtsträger ist, wenn sie binnen sechs Monaten nach dem Tag, an dem die Eintragung der Verschmelzung in das Register des Sitzes desjenigen Rechtsträgers, dessen Gläubiger sie sind, nach § 19 Abs. 3 UmwG als bekannt gemacht gilt, ihren Anspruch nach Grund und Höhe in Textform anmelden, Sicherheit zu leisten, soweit sie nicht Befriedigung verlangen können. Dieses Recht steht den Gläubigern jedoch nur zu, wenn sie glaubhaft machen, dass durch die Verschmelzung die Erfüllung ihrer Forderung gefährdet wird."
    },
    {
      "date": "2025-07-05",
      "id": "114711",
      "original_text": "Registerbekanntmachung nach dem Umwandlungsgesetz\nBayern Amtsgericht Nürnberg HRA 20255\nLabor Dr. Jochen Herrmann GmbH & Co. KG – Lauf a.d.Pegnitz",
      "type": "Registerbekanntmachung nach dem Umwandlungsgesetz",
      "state": "Bayern",
      "amtsgericht": "Amtsgericht Nürnberg",
      "registernummer": "HRA 20255",
      "registerart": "HRA",
      "company_name": "Labor Dr. Jochen Herrmann GmbH & Co. KG",
      "company_seat": "Lauf a.d.Pegnitz",
      "details": "05.07.2025 (Bekanntmachungsdatum)\n\nBayern Amtsgericht Nürnberg HRA 20255\nRegisterbekanntmachung nach dem Umwandlungsgesetz 04.07.2025 (Eintragungsdatum)\n\nLabor Dr. Jochen Herrmann GmbH & Co. KG\nKommanditgesellschaft\nLauf a.d.Pegnitz\n\nDen Gläubigern der an der Ausgliederung beteiligten Rechtsträger ist, wenn sie binnen sechs Monaten nach dem Tag, an dem die Eintragung der Ausgliederung in das Register des Sitzes desjenigen Rechtsträgers, dessen Gläubiger sie sind, nach §§ 125, 19 Abs. 3 UmwG als bekannt gemacht gilt, ihren Anspruch nach Grund und Höhe in Textform anmelden, Sicherheit zu leisten, soweit sie nicht Befriedigung verlangen können. Dieses Recht steht den Gläubigern jedoch nur zu, wenn sie glaubhaft machen, dass durch die Ausgliederung die Erfüllung ihrer Forderung gefährdet wird."
    },
    {
      "date": "2025-07-05",
      "id": "114712",
      "original_text": "Registerbekanntmachung nach dem Umwandlungsgesetz\nBayern Amtsgericht Fürth HRB 13541\nGS Schenk Tiefbau GmbH – Fürth",
      "type": "Registerbekanntmachung nach dem Umwandlungsgesetz",
      "state": "Bayern",
      "amtsgericht": "Amtsgericht Fürth",
      "registernummer": "HRB 13541",
      "registerart": "HRB",
      "company_name": "GS Schenk Tiefbau GmbH",
      "company_seat": "Fürth",
      "details": "05.07.2025 (Bekanntmachungsdatum)\n\nBayern Amtsgericht Fürth HRB 13541\nRegisterbekanntmachung nach dem Umwandlungsgesetz 04.07.2025 (Eintragungsdatum)\n\nGS Schenk Tiefbau GmbH\nGesellschaft mit beschränkter Haftung\nFürth\n\nDen Gläubigern der an der Verschmelzung beteiligten Rechtsträger ist, wenn sie binnen sechs Monaten nach dem Tag, an dem die Eintragung der Verschmelzung in das Register des Sitzes desjenigen Rechtsträgers, dessen Gläubiger sie sind, nach § 19 Abs. 3 UmwG als bekannt gemacht gilt, ihren Anspruch nach Grund und Höhe in Textform anmelden, Sicherheit zu leisten, soweit sie nicht Befriedigung verlangen können. Dieses Recht steht den Gläubigern jedoch nur zu, wenn sie glaubhaft machen, dass durch die Verschmelzung die Erfüllung ihrer Forderung gefährdet wird."
    },
    {
      "date": "2025-07-05",
      "id": "114713",
      "original_text": "Sonstige Registerbekanntmachung\nBayern Amtsgericht München HRB 221935\nSentivo GmbH – München",
      "type": "Sonstige Registerbekanntmachung",
      "state": "Bayern",
      "amtsgericht": "Amtsgericht München",
      "registernummer": "HRB 221935",
      "registerart": "HRB",
      "company_name": "Sentivo GmbH",
      "company_seat": "München",
      "details": "05.07.2025 (Bekanntmachungsdatum)\n\nBayern Amtsgericht München HRB 221935\nSonstige Registerbekanntmachung 04.07.2025 (Eintragungsdatum)\n\nSentivo GmbH\nGesellschaft mit beschränkter Haftung\nMünchen\n\nDen Gläubigern der Gesellschaft, deren Forderungen begründet worden sind, bevor die Eintragung der Beendigung des Beherrschungs- und Gewinnabführungsvertrages in das Handelsregister nach § 10 des Handelsgesetzbuches als bekanntgemacht gilt, hat der andere Vertragsteil Sicherheit zu leisten, wenn sie sich binnen sechs Monaten nach der Bekanntmachung der Eintragung zu diesem Zweck bei ihm melden."
    },
    {
      "date": "2025-07-05",
      "id": "114714",
      "original_text": "Registerbekanntmachung nach dem Umwandlungsgesetz\nBayern Amtsgericht München HRB 226373\nKorian Care X Betriebs-GmbH – München",
      "type": "Registerbekanntmachung nach dem Umwandlungsgesetz",
      "state": "Bayern",
      "amtsgericht": "Amtsgericht München",
      "registernummer": "HRB 226373",
      "registerart": "HRB",
      "company_name": "Korian Care X Betriebs-GmbH",
      "company_seat": "München",
      "details": "05.07.2025 (Bekanntmachungsdatum)\n\nBayern Amtsgericht München HRB 226373\nRegisterbekanntmachung nach dem Umwandlungsgesetz 04.07.2025 (Eintragungsdatum)\n\nKorian Care X Betriebs-GmbH\nGesellschaft mit beschränkter Haftung\nMünchen\n\nDen Gläubigern der an der Verschmelzung beteiligten Rechtsträger ist, wenn sie binnen sechs Monaten nach dem Tag, an dem die Eintragung der Verschmelzung in das Register des Sitzes desjenigen Rechtsträgers, dessen Gläubiger sie sind, nach § 19 Abs. 3 UmwG als bekannt gemacht gilt, ihren Anspruch nach Grund und Höhe in Textform anmelden, Sicherheit zu leisten, soweit sie nicht Befriedigung verlangen können. Dieses Recht steht den Gläubigern jedoch nur zu, wenn sie glaubhaft machen, dass durch die Verschmelzung die Erfüllung ihrer Forderung gefährdet wird."
    },
    {
      "date": "2025-07-05",
      "id": "114715",
      "original_text": "Einreichung neuer Dokumente\nBayern Amtsgericht München HRB 149416\nVersicherungskammer Bayern Pensionskasse Aktiengesellschaft – München",
      "type": "Einreichung neuer Dokumente",
      "state": "Bayern",
      "amtsgericht": "Amtsgericht München",
      "registernummer": "HRB 149416",
      "registerart": "HRB",
      "company_name": "Versicherungskammer Bayern Pensionskasse Aktiengesellschaft",
      "company_seat": "München",
      "details": "05.07.2025 (Bekanntmachungsdatum)\n\nBayern Amtsgericht München HRB 149416\nEinreichung neuer Dokumente\n\nVersicherungskammer Bayern Pensionskasse Aktiengesellschaft\nAktiengesellschaft\nMünchen\n\nDem Amtsgericht München -Registergericht- ist eine Liste der Mitglieder des Aufsichtsrats eingereicht worden, § 106 AktG."
    },
    {
      "date": "2025-07-05",
      "id": "114716",
      "original_text": "Registerbekanntmachung nach dem Umwandlungsgesetz\nBayern Amtsgericht München HRB 239501\nTinyclues GmbH – München",
      "type": "Registerbekanntmachung nach dem Umwandlungsgesetz",
      "state": "Bayern",
      "amtsgericht": "Amtsgericht München",
      "registernummer": "HRB 239501",
      "registerart": "HRB",
      "company_name": "Tinyclues GmbH",
      "company_seat": "München",
      "details": "05.07.2025 (Bekanntmachungsdatum)\n\nBayern Amtsgericht München HRB 239501\nRegisterbekanntmachung nach dem Umwandlungsgesetz 04.07.2025 (Eintragungsdatum)\n\nTinyclues GmbH\nGesellschaft mit beschränkter Haftung\nMünchen\n\nEs wird darauf hingewiesen, dass ein Entwurf des Verschmelzungsplans über eine grenzüberschreitende Verschmelzung zur Aufnahme mit der Splio SAS, eine Vereinfachte Aktiengesellschaft Societe par actions simplifiee (SAS) nach französischem Recht mit Sitz in Paris, Frankreich, Geschäftsanschrift: 27 Boulevard Des Italiens, 75002 Paris, Frankreich eingetragen im Handels- und Gesellschaftsregister (Registre du Commerce et des Societes - RCS) von Paris unter Nr. 434533071, als aufnehmende Gesellschaft beim Handelsregister eingereicht worden ist. Die Anteilsinhaber, die Gläubiger sowie die zuständigen Betriebsräte der an der grenzüberschreitenden Verschmelzung beteiligten Gesellschaften oder, soweit es keinen Betriebsrat gibt, die Arbeitnehmer der an der grenzüberschreitenden Verschmelzung beteiligten Gesellschaften, können der jeweiligen Gesellschaft spätestens fünf Arbeitstage vor dem Tag der Gesellschafterversammlung Bemerkungen zum Verschmelzungsplan übermitteln:\nZu § 308 Abs. 1 Satz 2 Nr. 4: a) Die übertragende Gesellschaft verfügt weder über Arbeitnehmer noch einen Betriebsrat. Der Sozial- und Wirtschaftsausschuss der aufnehmenden Gesellschaft wurde gemäß den französischen Vorschriften über die Verschmelzung informiert und beraten.\nb) Die Anteilsinhaber und Gläubiger der aufnehmenden Gesellschaft und der übertragenden Gesellschaft sowie die Arbeitnehmer der an der grenzüberschreitenden Verschmelzung beteiligten Gesellschaften können bis spätestens fünf Arbeitstage vor dem 12.08.2025 Bemerkungen zum Verschmelzungsplan übermitteln. Ein Beschluss der Anteilsinhaber der übertragenden Gesellschaft ist gemäß § 312 Abs. 2, 307 Abs. 3 UmwG nicht erforderlich.\nc) Die Anmeldung von Ansprüchen sämtlicher Gläubiger beider beteiligten Gesellschaften sowie Bemerkungen zu dem Verschmelzungsplan sind zu richten an: Bezüglich der Tinyclues GmbH: Tinyclues GmbH c/o Forvis Mazars GmbH & Co. KG, Ridlerstraße 39, 80339 München, Deutschland ascialom@splio.com Bezüglich der Splio SAS: Splio SAS 27 Boulevard Des Italiens, 75002 Paris, Frankreich tcoudry@splio.com. Unter dieser Anschrift werden den Gläubigern kostenlos auch weitere erschöpfende Auskünfte erteilt. Gläubigern, die einen Anspruch gegen die übertragende Gesellschaft haben, wird Sicherheit geleistet, wenn sie innerhalb von drei Monaten (314 Abs. 3 UmwG) nach Bekanntmachung des Entwurfs des Verschmelzungsplanes ihre Forderung dem Grunde und der Höhe nach schriftlich geltend machen. Nach Ablauf von drei Monaten nach Bekanntmachung des Entwurfs des Verschmelzungsplanes"
    },
    {
      "date": "2025-07-05",
      "id": "114717",
      "original_text": "Registerbekanntmachung nach dem Umwandlungsgesetz\nBayern Amtsgericht München HRB 118177\nKOPAS Beteiligungs GmbH – Pullach i. Isartal",
      "type": "Registerbekanntmachung nach dem Umwandlungsgesetz",
      "state": "Bayern",
      "amtsgericht": "Amtsgericht München",
      "registernummer": "HRB 118177",
      "registerart": "HRB",
      "company_name": "KOPAS Beteiligungs GmbH",
      "company_seat": "Pullach i. Isartal",
      "details": "05.07.2025 (Bekanntmachungsdatum)\n\nBayern Amtsgericht München HRB 118177\nRegisterbekanntmachung nach dem Umwandlungsgesetz 04.07.2025 (Eintragungsdatum)\n\nKOPAS Beteiligungs GmbH\nGesellschaft mit beschränkter Haftung\nPullach i. Isartal\n\nDen Gläubigern der an der Verschmelzung beteiligten Rechtsträger ist, wenn sie binnen sechs Monaten nach dem Tag, an dem die Eintragung der Verschmelzung in das Register des Sitzes desjenigen Rechtsträgers, dessen Gläubiger sie sind, nach § 19 Abs. 3 UmwG als bekannt gemacht gilt, ihren Anspruch nach Grund und Höhe in Textform anmelden, Sicherheit zu leisten, soweit sie nicht Befriedigung verlangen können. Dieses Recht steht den Gläubigern jedoch nur zu, wenn sie glaubhaft machen, dass durch die Verschmelzung die Erfüllung ihrer Forderung gefährdet wird."
    },
    {
      "date": "2025-07-05",
      "id": "114718",
      "original_text": "Registerbekanntmachung nach dem Umwandlungsgesetz\nBayern Amtsgericht Nürnberg HRA 20194\nLabordienstleistungen Dr. Jochen Herrmann e.K. – Lauf a.d.Pegnitz",
      "type": "Registerbekanntmachung nach dem Umwandlungsgesetz",
      "state": "Bayern",
      "amtsgericht": "Amtsgericht Nürnberg",
      "registernummer": "HRA 20194",
      "registerart": "HRA",
      "company_name": "Labordienstleistungen Dr. Jochen Herrmann e.K.",
      "company_seat": "Lauf a.d.Pegnitz",
      "details": "05.07.2025 (Bekanntmachungsdatum)\n\nBayern Amtsgericht Nürnberg HRA 20194\nRegisterbekanntmachung nach dem Umwandlungsgesetz 04.07.2025 (Eintragungsdatum)\n\nLabordienstleistungen Dr. Jochen Herrmann e.K.\nEinzelkaufmann / Einzelkauffrau\nLauf a.d.Pegnitz\n\nDen Gläubigern der an der Ausgliederung beteiligten Rechtsträger ist, wenn sie binnen sechs Monaten nach dem Tag, an dem die Eintragung der Ausgliederung in das Register des Sitzes desjenigen Rechtsträgers, dessen Gläubiger sie sind, nach §§ 125, 19 Abs. 3 UmwG als bekannt gemacht gilt, ihren Anspruch nach Grund und Höhe in Textform anmelden, Sicherheit zu leisten, soweit sie nicht Befriedigung verlangen können. Dieses Recht steht den Gläubigern jedoch nur zu, wenn sie glaubhaft machen, dass durch die Ausgliederung die Erfüllung ihrer Forderung gefährdet wird."
    },
    {
      "date": "2025-07-05",
      "id": "114719",
      "original_text": "Registerbekanntmachung nach dem Umwandlungsgesetz\nBayern Amtsgericht München HRB 259566\nSozialkonzept Betriebs- und Beteiligungs GmbH – München",
      "type": "Registerbekanntmachung nach dem Umwandlungsgesetz",
      "state": "Bayern",
      "amtsgericht": "Amtsgericht München",
      "registernummer": "HRB 259566",
      "registerart": "HRB",
      "company_name": "Sozialkonzept Betriebs- und Beteiligungs GmbH",
      "company_seat": "München",
      "details": "05.07.2025 (Bekanntmachungsdatum)\n\nBayern Amtsgericht München HRB 259566\nRegisterbekanntmachung nach dem Umwandlungsgesetz 04.07.2025 (Eintragungsdatum)\n\nSozialkonzept Betriebs- und Beteiligungs GmbH\nGesellschaft mit beschränkter Haftung\nMünchen\n\nDen Gläubigern der an der Verschmelzung beteiligten Rechtsträger ist, wenn sie binnen sechs Monaten nach dem Tag, an dem die Eintragung der Verschmelzung in das Register des Sitzes desjenigen Rechtsträgers, dessen Gläubiger sie sind, nach § 19 Abs. 3 UmwG als bekannt gemacht gilt, ihren Anspruch nach Grund und Höhe in Textform anmelden, Sicherheit zu leisten, soweit sie nicht Befriedigung verlangen können. Dieses Recht steht den Gläubigern jedoch nur zu, wenn sie glaubhaft machen, dass durch die Verschmelzung die Erfüllung ihrer Forderung gefährdet wird."
    },
    {
      "date": "2025-07-05",
      "id": "114720",
      "original_text": "Registerbekanntmachung nach dem Umwandlungsgesetz\nBayern Amtsgericht München HRB 271396\nRCAP Beteiligungsgesellschaft UG (haftungsbeschränkt) – München",
      "type": "Registerbekanntmachung nach dem Umwandlungsgesetz",
      "state": "Bayern",
      "amtsgericht": "Amtsgericht München",
      "registernummer": "HRB 271396",
      "registerart": "HRB",
      "company_name": "RCAP Beteiligungsgesellschaft UG (haftungsbeschränkt)",
      "company_seat": "München",
      "details": "05.07.2025 (Bekanntmachungsdatum)\n\nBayern Amtsgericht München HRB 271396\nRegisterbekanntmachung nach dem Umwandlungsgesetz 04.07.2025 (Eintragungsdatum)\n\nRCAP Beteiligungsgesellschaft UG (haftungsbeschränkt)\nGesellschaft mit beschränkter Haftung\nMünchen\n\nDen Gläubigern der an der Verschmelzung beteiligten Rechtsträger ist, wenn sie binnen sechs Monaten nach dem Tag, an dem die Eintragung der Verschmelzung in das Register des Sitzes desjenigen Rechtsträgers, dessen Gläubiger sie sind, nach § 19 Abs. 3 UmwG als bekannt gemacht gilt, ihren Anspruch nach Grund und Höhe in Textform anmelden, Sicherheit zu leisten, soweit sie nicht Befriedigung verlangen können. Dieses Recht steht den Gläubigern jedoch nur zu, wenn sie glaubhaft machen, dass durch die Verschmelzung die Erfüllung ihrer Forderung gefährdet wird."
    },
    {
      "date": "2025-07-05",
      "id": "114721",
      "original_text": "Registerbekanntmachung nach dem Umwandlungsgesetz\nBayern Amtsgericht Aschaffenburg HRB 4029\nSKC Carbon Produkte GmbH – Obernburg",
      "type": "Registerbekanntmachung nach dem Umwandlungsgesetz",
      "state": "Bayern",
      "amtsgericht": "Amtsgericht Aschaffenburg",
      "registernummer": "HRB 4029",
      "registerart": "HRB",
      "company_name": "SKC Carbon Produkte GmbH",
      "company_seat": "Obernburg",
      "details": "05.07.2025 (Bekanntmachungsdatum)\n\nBayern Amtsgericht Aschaffenburg HRB 4029\nRegisterbekanntmachung nach dem Umwandlungsgesetz 04.07.2025 (Eintragungsdatum)\n\nSKC Carbon Produkte GmbH\nGesellschaft mit beschränkter Haftung\nObernburg\n\nDen Gläubigern der an der Verschmelzung beteiligten Rechtsträger ist, wenn sie binnen sechs Monaten nach dem Tag, an dem die Eintragung der Verschmelzung in das Register des Sitzes desjenigen Rechtsträgers, dessen Gläubiger sie sind, nach § 19 Abs. 3 UmwG als bekannt gemacht gilt, ihren Anspruch nach Grund und Höhe in Textform anmelden, Sicherheit zu leisten, soweit sie nicht Befriedigung verlangen können. Dieses Recht steht den Gläubigern jedoch nur zu, wenn sie glaubhaft machen, dass durch die Verschmelzung die Erfüllung ihrer Forderung gefährdet wird."
    },
    {
      "date": "2025-07-05",
      "id": "114722",
      "original_text": "Registerbekanntmachung nach dem Umwandlungsgesetz\nBayern Amtsgericht München HRB 226373\nKorian Care X Betriebs-GmbH – München",
      "type": "Registerbekanntmachung nach dem Umwandlungsgesetz",
      "state": "Bayern",
      "amtsgericht": "Amtsgericht München",
      "registernummer": "HRB 226373",
      "registerart": "HRB",
      "company_name": "Korian Care X Betriebs-GmbH",
      "company_seat": "München",
      "details": "05.07.2025 (Bekanntmachungsdatum)\n\nBayern Amtsgericht München HRB 226373\nRegisterbekanntmachung nach dem Umwandlungsgesetz 04.07.2025 (Eintragungsdatum)\n\nKorian Care X Betriebs-GmbH\nGesellschaft mit beschränkter Haftung\nMünchen\n\nDen Gläubigern der an der Verschmelzung beteiligten Rechtsträger ist, wenn sie binnen sechs Monaten nach dem Tag, an dem die Eintragung der Verschmelzung in das Register des Sitzes desjenigen Rechtsträgers, dessen Gläubiger sie sind, nach § 19 Abs. 3 UmwG als bekannt gemacht gilt, ihren Anspruch nach Grund und Höhe in Textform anmelden, Sicherheit zu leisten, soweit sie nicht Befriedigung verlangen können. Dieses Recht steht den Gläubigern jedoch nur zu, wenn sie glaubhaft machen, dass durch die Verschmelzung die Erfüllung ihrer Forderung gefährdet wird."
    },
    {
      "date": "2025-07-05",
      "id": "114723",
      "original_text": "Registerbekanntmachung nach dem Umwandlungsgesetz\nBayern Amtsgericht Kempten (Allgäu) HRB 528\nImmobiliengesellschaft der Allgäuer Volksbank GmbH. – Kempten",
      "type": "Registerbekanntmachung nach dem Umwandlungsgesetz",
      "state": "Bayern",
      "amtsgericht": "Amtsgericht Kempten (Allgäu)",
      "registernummer": "HRB 528",
      "registerart": "HRB",
      "company_name": "Immobiliengesellschaft der Allgäuer Volksbank GmbH.",
      "company_seat": "Kempten",
      "details": "05.07.2025 (Bekanntmachungsdatum)\n\nBayern Amtsgericht Kempten (Allgäu) HRB 528\nRegisterbekanntmachung nach dem Umwandlungsgesetz 04.07.2025 (Eintragungsdatum)\n\nImmobiliengesellschaft der Allgäuer Volksbank GmbH.\nGesellschaft mit beschränkter Haftung\nKempten\n\nDen Gläubigern der an der Verschmelzung beteiligten Rechtsträger ist, wenn sie binnen sechs Monaten nach dem Tag, an dem die Eintragung der Verschmelzung in das Register des Sitzes desjenigen Rechtsträgers, dessen Gläubiger sie sind, nach § 19 Abs. 3 UmwG als bekannt gemacht gilt, ihren Anspruch nach Grund und Höhe in Textform anmelden, Sicherheit zu leisten, soweit sie nicht Befriedigung verlangen können. Dieses Recht steht den Gläubigern jedoch nur zu, wenn sie glaubhaft machen, dass durch die Verschmelzung die Erfüllung ihrer Forderung gefährdet wird."
    },
    {
      "date": "2025-07-05",
      "id": "114724",
      "original_text": "Registerbekanntmachung nach dem Umwandlungsgesetz\nBayern Amtsgericht Regensburg HRB 1453\nWolf GmbH – Mainburg",
      "type": "Registerbekanntmachung nach dem Umwandlungsgesetz",
      "state": "Bayern",
      "amtsgericht": "Amtsgericht Regensburg",
      "registernummer": "HRB 1453",
      "registerart": "HRB",
      "company_name": "Wolf GmbH",
      "company_seat": "Mainburg",
      "details": "05.07.2025 (Bekanntmachungsdatum)\n\nBayern Amtsgericht Regensburg HRB 1453\nRegisterbekanntmachung nach dem Umwandlungsgesetz 04.07.2025 (Eintragungsdatum)\n\nWolf GmbH\nGesellschaft mit beschränkter Haftung\nMainburg\n\nDen Gläubigern der an der Verschmelzung beteiligten Rechtsträger ist, wenn sie binnen sechs Monaten nach dem Tag, an dem die Eintragung der Verschmelzung in das Register des Sitzes desjenigen Rechtsträgers, dessen Gläubiger sie sind, nach § 19 Abs. 3 UmwG als bekannt gemacht gilt, ihren Anspruch nach Grund und Höhe in Textform anmelden, Sicherheit zu leisten, soweit sie nicht Befriedigung verlangen können. Dieses Recht steht den Gläubigern jedoch nur zu, wenn sie glaubhaft machen, dass durch die Verschmelzung die Erfüllung ihrer Forderung gefährdet wird."
    },
    {
      "date": "2025-07-05",
      "id": "114725",
      "original_text": "Löschungsankündigung\nBayern Amtsgericht München HRB 211630\neSS-Zet GmbH – Unterhaching",
      "type": "Löschungsankündigung",
      "state": "Bayern",
      "amtsgericht": "Amtsgericht München",
      "registernummer": "HRB 211630",
      "registerart": "HRB",
      "company_name": "eSS-Zet GmbH",
      "company_seat": "Unterhaching",
      "details": "05.07.2025 (Bekanntmachungsdatum)\n\nBayern Amtsgericht München HRB 211630\nLöschungsankündigung 04.07.2025 (Eintragungsdatum)\n\neSS-Zet GmbH\nGesellschaft mit beschränkter Haftung\nUnterhaching\n\nDas Registergericht beabsichtigt, die im Handelsregister eingetragene Gesellschaft wegen Vermögenslosigkeit von Amts wegen nach § 394 FamFG zu löschen. Die Frist zur Erhebung eines Widerspruchs ist auf drei Monate festgesetzt."
    },
    {
      "date": "2025-07-05",
      "id": "114726",
      "original_text": "Registerbekanntmachung nach dem Umwandlungsgesetz\nBayern Amtsgericht München HRB 248309\nWorkspire GmbH – München",
      "type": "Registerbekanntmachung nach dem Umwandlungsgesetz",
      "state": "Bayern",
      "amtsgericht": "Amtsgericht München",
      "registernummer": "HRB 248309",
      "registerart": "HRB",
      "company_name": "Workspire GmbH",
      "company_seat": "München",
      "details": "05.07.2025 (Bekanntmachungsdatum)\n\nBayern Amtsgericht München HRB 248309\nRegisterbekanntmachung nach dem Umwandlungsgesetz 04.07.2025 (Eintragungsdatum)\n\nWorkspire GmbH\nGesellschaft mit beschränkter Haftung\nMünchen\n\nDen Gläubigern der an der Verschmelzung beteiligten Rechtsträger ist, wenn sie binnen sechs Monaten nach dem Tag, an dem die Eintragung der Verschmelzung in das Register des Sitzes desjenigen Rechtsträgers, dessen Gläubiger sie sind, nach § 19 Abs. 3 UmwG als bekannt gemacht gilt, ihren Anspruch nach Grund und Höhe in Textform anmelden, Sicherheit zu leisten, soweit sie nicht Befriedigung verlangen können. Dieses Recht steht den Gläubigern jedoch nur zu, wenn sie glaubhaft machen, dass durch die Verschmelzung die Erfüllung ihrer Forderung gefährdet wird."
    },
    {
      "date": "2025-07-05",
      "id": "114727",
      "original_text": "Einreichung neuer Dokumente\nBayern Amtsgericht Coburg HRB 1537\nHUK-COBURG-Krankenversicherung AG – Coburg",
      "type": "Einreichung neuer Dokumente",
      "state": "Bayern",
      "amtsgericht": "Amtsgericht Coburg",
      "registernummer": "HRB 1537",
      "registerart": "HRB",
      "company_name": "HUK-COBURG-Krankenversicherung AG",
      "company_seat": "Coburg",
      "details": "05.07.2025 (Bekanntmachungsdatum)\n\nBayern Amtsgericht Coburg HRB 1537\nEinreichung neuer Dokumente 04.07.2025 (Eintragungsdatum)\n\nHUK-COBURG-Krankenversicherung AG\nAktiengesellschaft\nCoburg\n\nDem Amtsgericht Coburg -Registergericht- ist eine Liste der Mitglieder des Aufsichtsrats eingereicht worden, § 106 AktG."
    },
    {
      "date": "2025-07-05",
      "id": "114728",
      "original_text": "Registerbekanntmachung nach dem Umwandlungsgesetz\nBayern Amtsgericht München HRB 224187\nEnergreen Renewables GmbH – Unterhaching",
      "type": "Registerbekanntmachung nach dem Umwandlungsgesetz",
      "state": "Bayern",
      "amtsgericht": "Amtsgericht München",
      "registernummer": "HRB 224187",
      "registerart": "HRB",
      "company_name": "Energreen Renewables GmbH",
      "company_seat": "Unterhaching",
      "details": "05.07.2025 (Bekanntmachungsdatum)\n\nBayern Amtsgericht München HRB 224187\nRegisterbekanntmachung nach dem Umwandlungsgesetz 04.07.2025 (Eintragungsdatum)\n\nEnergreen Renewables GmbH\nGesellschaft mit beschränkter Haftung\nUnterhaching\n\nDen Gläubigern der an der Verschmelzung beteiligten Rechtsträger ist, wenn sie binnen sechs Monaten nach dem Tag, an dem die Eintragung der Verschmelzung in das Register des Sitzes desjenigen Rechtsträgers, dessen Gläubiger sie sind, nach § 19 Abs. 3 UmwG als bekannt gemacht gilt, ihren Anspruch nach Grund und Höhe in Textform anmelden, Sicherheit zu leisten, soweit sie nicht Befriedigung verlangen können. Dieses Recht steht den Gläubigern jedoch nur zu, wenn sie glaubhaft machen, dass durch die Verschmelzung die Erfüllung ihrer Forderung gefährdet wird."
    },
    {
      "date": "2025-07-05",
      "id": "114729",
      "original_text": "Registerbekanntmachung nach dem Umwandlungsgesetz\nBayern Amtsgericht Fürth HRB 15417\nGS SCHENK GmbH – Fürth",
      "type": "Registerbekanntmachung nach dem Umwandlungsgesetz",
      "state": "Bayern",
      "amtsgericht": "Amtsgericht Fürth",
      "registernummer": "HRB 15417",
      "registerart": "HRB",
      "company_name": "GS SCHENK GmbH",
      "company_seat": "Fürth",
      "details": "05.07.2025 (Bekanntmachungsdatum)\n\nBayern Amtsgericht Fürth HRB 15417\nRegisterbekanntmachung nach dem Umwandlungsgesetz 04.07.2025 (Eintragungsdatum)\n\nGS SCHENK GmbH\nGesellschaft mit beschränkter Haftung\nFürth\n\nDen Gläubigern der an der Verschmelzung beteiligten Rechtsträger ist, wenn sie binnen sechs Monaten nach dem Tag, an dem die Eintragung der Verschmelzung in das Register des Sitzes desjenigen Rechtsträgers, dessen Gläubiger sie sind, nach § 19 Abs. 3 UmwG als bekannt gemacht gilt, ihren Anspruch nach Grund und Höhe in Textform anmelden, Sicherheit zu leisten, soweit sie nicht Befriedigung verlangen können. Dieses Recht steht den Gläubigern jedoch nur zu, wenn sie glaubhaft machen, dass durch die Verschmelzung die Erfüllung ihrer Forderung gefährdet wird."
    },
    {
      "date": "2025-07-05",
      "id": "114730",
      "original_text": "Einreichung neuer Dokumente\nBayern Amtsgericht Coburg HRB 3533\nHUK-COBURG-Holding AG – Coburg",
      "type": "Einreichung neuer Dokumente",
      "state": "Bayern",
      "amtsgericht": "Amtsgericht Coburg",
      "registernummer": "HRB 3533",
      "registerart": "HRB",
      "company_name": "HUK-COBURG-Holding AG",
      "company_seat": "Coburg",
      "details": "05.07.2025 (Bekanntmachungsdatum)\n\nBayern Amtsgericht Coburg HRB 3533\nEinreichung neuer Dokumente 04.07.2025 (Eintragungsdatum)\n\nHUK-COBURG-Holding AG\nAktiengesellschaft\nCoburg\n\nDem Amtsgericht Coburg -Registergericht- ist eine Liste der Mitglieder des Aufsichtsrats eingereicht worden, § 106 AktG."
    },
    {
      "date": "2025-07-05",
      "id": "114731",
      "original_text": "Einreichung neuer Dokumente\nBayern Amtsgericht München HRB 57531\nBKL Baukran Logistik GmbH – Forstinning",
      "type": "Einreichung neuer Dokumente",
      "state": "Bayern",
      "amtsgericht": "Amtsgericht München",
      "registernummer": "HRB 57531",
      "registerart": "HRB",
      "company_name": "BKL Baukran Logistik GmbH",
      "company_seat": "Forstinning",
      "details": "05.07.2025 (Bekanntmachungsdatum)\n\nBayern Amtsgericht München HRB 57531\nEinreichung neuer Dokumente\n\nBKL Baukran Logistik GmbH\nGesellschaft mit beschränkter Haftung\nForstinning\n\nDem Amtsgericht München -Registergericht- ist eine Liste der Mitglieder des Aufsichtsrats eingereicht worden, § 52 Abs. 3 S. 2 GmbHG."
    },
    {
      "date": "2025-07-05",
      "id": "114732",
      "original_text": "Registerbekanntmachung nach dem Umwandlungsgesetz\nBayern Amtsgericht München HRB 103977\nHOKAS Beteiligungs GmbH – Pullach i. Isartal",
      "type": "Registerbekanntmachung nach dem Umwandlungsgesetz",
      "state": "Bayern",
      "amtsgericht": "Amtsgericht München",
      "registernummer": "HRB 103977",
      "registerart": "HRB",
      "company_name": "HOKAS Beteiligungs GmbH",
      "company_seat": "Pullach i. Isartal",
      "details": "05.07.2025 (Bekanntmachungsdatum)\n\nBayern Amtsgericht München HRB 103977\nRegisterbekanntmachung nach dem Umwandlungsgesetz 04.07.2025 (Eintragungsdatum)\n\nHOKAS Beteiligungs GmbH\nGesellschaft mit beschränkter Haftung\nPullach i. Isartal\n\nDen Gläubigern der an der Verschmelzung beteiligten Rechtsträger ist, wenn sie binnen sechs Monaten nach dem Tag, an dem die Eintragung der Verschmelzung in das Register des Sitzes desjenigen Rechtsträgers, dessen Gläubiger sie sind, nach § 19 Abs. 3 UmwG als bekannt gemacht gilt, ihren Anspruch nach Grund und Höhe in Textform anmelden, Sicherheit zu leisten, soweit sie nicht Befriedigung verlangen können. Dieses Recht steht den Gläubigern jedoch nur zu, wenn sie glaubhaft machen, dass durch die Verschmelzung die Erfüllung ihrer Forderung gefährdet wird."
    },
    {
      "date": "2025-07-05",
      "id": "114733",
      "original_text": "Registerbekanntmachung nach dem Umwandlungsgesetz\nBayern Amtsgericht München HRB 259566\nSozialkonzept Betriebs- und Beteiligungs GmbH – München",
      "type": "Registerbekanntmachung nach dem Umwandlungsgesetz",
      "state": "Bayern",
      "amtsgericht": "Amtsgericht München",
      "registernummer": "HRB 259566",
      "registerart": "HRB",
      "company_name": "Sozialkonzept Betriebs- und Beteiligungs GmbH",
      "company_seat": "München",
      "details": "05.07.2025 (Bekanntmachungsdatum)\n\nBayern Amtsgericht München HRB 259566\nRegisterbekanntmachung nach dem Umwandlungsgesetz 04.07.2025 (Eintragungsdatum)\n\nSozialkonzept Betriebs- und Beteiligungs GmbH\nGesellschaft mit beschränkter Haftung\nMünchen\n\nDen Gläubigern der an der Verschmelzung beteiligten Rechtsträger ist, wenn sie binnen sechs Monaten nach dem Tag, an dem die Eintragung der Verschmelzung in das Register des Sitzes desjenigen Rechtsträgers, dessen Gläubiger sie sind, nach § 19 Abs. 3 UmwG als bekannt gemacht gilt, ihren Anspruch nach Grund und Höhe in Textform anmelden, Sicherheit zu leisten, soweit sie nicht Befriedigung verlangen können. Dieses Recht steht den Gläubigern jedoch nur zu, wenn sie glaubhaft machen, dass durch die Verschmelzung die Erfüllung ihrer Forderung gefährdet wird."
    },
    {
      "date": "2025-07-05",
      "id": "114734",
      "original_text": "Sonstige Registerbekanntmachung\nBayern Amtsgericht München HRB 141728\nactiv factoring AG – München",
      "type": "Sonstige Registerbekanntmachung",
      "state": "Bayern",
      "amtsgericht": "Amtsgericht München",
      "registernummer": "HRB 141728",
      "registerart": "HRB",
      "company_name": "activ factoring AG",
      "company_seat": "München",
      "details": "05.07.2025 (Bekanntmachungsdatum)\n\nBayern Amtsgericht München HRB 141728\nSonstige Registerbekanntmachung 04.07.2025 (Eintragungsdatum)\n\nactiv factoring AG\nAktiengesellschaft\nMünchen\n\nDem Amtsgericht München -Registergericht- ist eine Liste der Mitglieder des Aufsichtsrats eingereicht worden, § 106 AktG."
    },
    {
      "date": "2025-07-05",
      "id": "114735",
      "original_text": "Einreichung neuer Dokumente\nBayern Amtsgericht München HRB 227195\nAllane SE – Pullach i.Isartal",
      "type": "Einreichung neuer Dokumente",
      "state": "Bayern",
      "amtsgericht": "Amtsgericht München",
      "registernummer": "HRB 227195",
      "registerart": "HRB",
      "company_name": "Allane SE",
      "company_seat": "Pullach i.Isartal",
      "details": "05.07.2025 (Bekanntmachungsdatum)\n\nBayern Amtsgericht München HRB 227195\nEinreichung neuer Dokumente\n\nAllane SE\nEuropäische Aktiengesellschaft (SE)\nPullach i.Isartal\n\nDem #Re.Name ist eine Liste der Mitglieder des Aufsichtsrats eingereicht worden, Art. 9 Abs. 1 Buchst. c (ii) SE-VO i.V.m. § 106 AktG."
    },
    {
      "date": "2025-07-05",
      "id": "114736",
      "original_text": "Einreichung neuer Dokumente\nBayern Amtsgericht Coburg HRB 30\nHUK-COBURG-Lebensversicherung AG – Coburg",
      "type": "Einreichung neuer Dokumente",
      "state": "Bayern",
      "amtsgericht": "Amtsgericht Coburg",
      "registernummer": "HRB 30",
      "registerart": "HRB",
      "company_name": "HUK-COBURG-Lebensversicherung AG",
      "company_seat": "Coburg",
      "details": "05.07.2025 (Bekanntmachungsdatum)\n\nBayern Amtsgericht Coburg HRB 30\nEinreichung neuer Dokumente 04.07.2025 (Eintragungsdatum)\n\nHUK-COBURG-Lebensversicherung AG\nAktiengesellschaft\nCoburg\n\nDem Amtsgericht Coburg -Registergericht- ist eine Liste der Mitglieder des Aufsichtsrats eingereicht worden, § 106 AktG."
    },
    {
      "date": "2025-07-05",
      "id": "114737",
      "original_text": "Registerbekanntmachung nach dem Umwandlungsgesetz\nBayern Amtsgericht Passau HRA 13916\nrma-Tours Reisebüro e.K. – Hauzenberg",
      "type": "Registerbekanntmachung nach dem Umwandlungsgesetz",
      "state": "Bayern",
      "amtsgericht": "Amtsgericht Passau",
      "registernummer": "HRA 13916",
      "registerart": "HRA",
      "company_name": "rma-Tours Reisebüro e.K.",
      "company_seat": "Hauzenberg",
      "details": "05.07.2025 (Bekanntmachungsdatum)\n\nBayern Amtsgericht Passau HRA 13916\nRegisterbekanntmachung nach dem Umwandlungsgesetz 04.07.2025 (Eintragungsdatum)\n\nrma-Tours Reisebüro e.K.\nEinzelkaufmann / Einzelkauffrau\nHauzenberg\n\nDen Gläubigern der an der Ausgliederung beteiligten Rechtsträger ist, wenn sie binnen sechs Monaten nach dem Tag, an dem die Eintragung der Ausgliederung in das Register des Sitzes desjenigen Rechtsträgers, dessen Gläubiger sie sind, nach §§ 125, 19 Abs. 3 UmwG als bekannt gemacht gilt, ihren Anspruch nach Grund und Höhe in Textform anmelden, Sicherheit zu leisten, soweit sie nicht Befriedigung verlangen können. Dieses Recht steht den Gläubigern jedoch nur zu, wenn sie glaubhaft machen, dass durch die Ausgliederung die Erfüllung ihrer Forderung gefährdet wird."
    },
    {
      "date": "2025-07-05",
      "id": "114738",
      "original_text": "Registerbekanntmachung nach dem Umwandlungsgesetz\nBayern Amtsgericht Nürnberg HRB 37676\nRay Estate GmbH – Nürnberg",
      "type": "Registerbekanntmachung nach dem Umwandlungsgesetz",
      "state": "Bayern",
      "amtsgericht": "Amtsgericht Nürnberg",
      "registernummer": "HRB 37676",
      "registerart": "HRB",
      "company_name": "Ray Estate GmbH",
      "company_seat": "Nürnberg",
      "details": "05.07.2025 (Bekanntmachungsdatum)\n\nBayern Amtsgericht Nürnberg HRB 37676\nRegisterbekanntmachung nach dem Umwandlungsgesetz 04.07.2025 (Eintragungsdatum)\n\nRay Estate GmbH\nGesellschaft mit beschränkter Haftung\nNürnberg\n\nDen Gläubigern der an der Verschmelzung beteiligten Rechtsträger ist, wenn sie binnen sechs Monaten nach dem Tag, an dem die Eintragung der Verschmelzung in das Register des Sitzes desjenigen Rechtsträgers, dessen Gläubiger sie sind, nach § 19 Abs. 3 UmwG als bekannt gemacht gilt, ihren Anspruch nach Grund und Höhe in Textform anmelden, Sicherheit zu leisten, soweit sie nicht Befriedigung verlangen können. Dieses Recht steht den Gläubigern jedoch nur zu, wenn sie glaubhaft machen, dass durch die Verschmelzung die Erfüllung ihrer Forderung gefährdet wird."
    },
    {
      "date": "2025-07-05",
      "id": "114739",
      "original_text": "Einreichung neuer Dokumente\nBayern Amtsgericht Coburg HRB 100\nHUK-COBURG Haftpflicht-Unterstützungs-Kasse kraftfahrender Beamter Deutschlands a.G. in Coburg – Coburg",
      "type": "Einreichung neuer Dokumente",
      "state": "Bayern",
      "amtsgericht": "Amtsgericht Coburg",
      "registernummer": "HRB 100",
      "registerart": "HRB",
      "company_name": "HUK-COBURG Haftpflicht-Unterstützungs-Kasse kraftfahrender Beamter Deutschlands a.G. in Coburg",
      "company_seat": "Coburg",
      "details": "05.07.2025 (Bekanntmachungsdatum)\n\nBayern Amtsgericht Coburg HRB 100\nEinreichung neuer Dokumente 04.07.2025 (Eintragungsdatum)\n\nHUK-COBURG Haftpflicht-Unterstützungs-Kasse kraftfahrender Beamter Deutschlands a.G. in Coburg\nVersicherungsverein auf Gegenseitigkeit\nCoburg\n\nDem Amtsgericht Coburg -Registergericht- ist eine Liste der Mitglieder des Aufsichtsrats eingereicht worden, §§ 189 Abs. 3 Satz 1 VAG, 106 AktG."
    },
    {
      "date": "2025-07-05",
      "id": "114740",
      "original_text": "Einreichung neuer Dokumente\nBayern Amtsgericht Coburg HRB 465\nHUK-COBURG-Allgemeine Versicherung AG – Coburg",
      "type": "Einreichung neuer Dokumente",
      "state": "Bayern",
      "amtsgericht": "Amtsgericht Coburg",
      "registernummer": "HRB 465",
      "registerart": "HRB",
      "company_name": "HUK-COBURG-Allgemeine Versicherung AG",
      "company_seat": "Coburg",
      "details": "05.07.2025 (Bekanntmachungsdatum)\n\nBayern Amtsgericht Coburg HRB 465\nEinreichung neuer Dokumente 04.07.2025 (Eintragungsdatum)\n\nHUK-COBURG-Allgemeine Versicherung AG\nAktiengesellschaft\nCoburg\n\nDem Amtsgericht Coburg -Registergericht- ist eine Liste der Mitglieder des Aufsichtsrats eingereicht worden, § 106 AktG."
    },
    {
      "date": "2025-07-05",
      "id": "114741",
      "original_text": "Einreichung neuer Dokumente\nBayern Amtsgericht München HRB 223552\nSino-German United AG – München",
      "type": "Einreichung neuer Dokumente",
      "state": "Bayern",
      "amtsgericht": "Amtsgericht München",
      "registernummer": "HRB 223552",
      "registerart": "HRB",
      "company_name": "Sino-German United AG",
      "company_seat": "München",
      "details": "05.07.2025 (Bekanntmachungsdatum)\n\nBayern Amtsgericht München HRB 223552\nEinreichung neuer Dokumente 04.07.2025 (Eintragungsdatum)\n\nSino-German United AG\nAktiengesellschaft\nMünchen\n\nDem Amtsgericht München -Registergericht- ist eine Liste der Mitglieder des Aufsichtsrats eingereicht worden, § 106 AktG."
    },
    {
      "date": "2025-07-05",
      "id": "114742",
      "original_text": "Registerbekanntmachung nach dem Umwandlungsgesetz\nBayern Amtsgericht München HRB 221935\nSentivo GmbH – München",
      "type": "Registerbekanntmachung nach dem Umwandlungsgesetz",
      "state": "Bayern",
      "amtsgericht": "Amtsgericht München",
      "registernummer": "HRB 221935",
      "registerart": "HRB",
      "company_name": "Sentivo GmbH",
      "company_seat": "München",
      "details": "05.07.2025 (Bekanntmachungsdatum)\n\nBayern Amtsgericht München HRB 221935\nRegisterbekanntmachung nach dem Umwandlungsgesetz 04.07.2025 (Eintragungsdatum)\n\nSentivo GmbH\nGesellschaft mit beschränkter Haftung\nMünchen\n\nDen Gläubigern der an der Verschmelzung beteiligten Rechtsträger ist, wenn sie binnen sechs Monaten nach dem Tag, an dem die Eintragung der Verschmelzung in das Register des Sitzes desjenigen Rechtsträgers, dessen Gläubiger sie sind, nach § 19 Abs. 3 UmwG als bekannt gemacht gilt, ihren Anspruch nach Grund und Höhe in Textform anmelden, Sicherheit zu leisten, soweit sie nicht Befriedigung verlangen können. Dieses Recht steht den Gläubigern jedoch nur zu, wenn sie glaubhaft machen, dass durch die Verschmelzung die Erfüllung ihrer Forderung gefährdet wird."
    },
    {
      "date": "2025-07-05",
      "id": "114743",
      "original_text": "Registerbekanntmachung nach dem Umwandlungsgesetz\nBayern Amtsgericht München HRB 194876\nFANDUS Grundstücks-Vermietungsgesellschaft mbH – Pullach i. Isartal",
      "type": "Registerbekanntmachung nach dem Umwandlungsgesetz",
      "state": "Bayern",
      "amtsgericht": "Amtsgericht München",
      "registernummer": "HRB 194876",
      "registerart": "HRB",
      "company_name": "FANDUS Grundstücks-Vermietungsgesellschaft mbH",
      "company_seat": "Pullach i. Isartal",
      "details": "05.07.2025 (Bekanntmachungsdatum)\n\nBayern Amtsgericht München HRB 194876\nRegisterbekanntmachung nach dem Umwandlungsgesetz 04.07.2025 (Eintragungsdatum)\n\nFANDUS Grundstücks-Vermietungsgesellschaft mbH\nGesellschaft mit beschränkter Haftung\nPullach i. Isartal\n\nDen Gläubigern der an der Verschmelzung beteiligten Rechtsträger ist, wenn sie binnen sechs Monaten nach dem Tag, an dem die Eintragung der Verschmelzung in das Register des Sitzes desjenigen Rechtsträgers, dessen Gläubiger sie sind, nach § 19 Abs. 3 UmwG als bekannt gemacht gilt, ihren Anspruch nach Grund und Höhe in Textform anmelden, Sicherheit zu leisten, soweit sie nicht Befriedigung verlangen können. Dieses Recht steht den Gläubigern jedoch nur zu, wenn sie glaubhaft machen, dass durch die Verschmelzung die Erfüllung ihrer Forderung gefährdet wird."
    }
  ]
}