{
  "date": "2025-07-28",
  "date_of_scrape": "2025-08-26T16:03:33.285Z",
  "tool_version": "0.2.0",
  "number_of_announcements": 195,
  "announcements": [
    {
      "date": "2025-07-28",
      "id": "117712",
      "original_text": "Löschungsankündigung\nSaarland Amtsgericht Saarbrücken HRB 104232\nQbing Industrial Solutions GmbH – Saarbrücken",
      "type": "Löschungsankündigung",
      "state": "Saarland",
      "amtsgericht": "Amtsgericht Saarbrücken",
      "registernummer": "HRB 104232",
      "registerart": "HRB",
      "company_name": "Qbing Industrial Solutions GmbH",
      "company_seat": "Saarbrücken",
      "details": "28.07.2025 (Bekanntmachungsdatum)\n\nSaarland Amtsgericht Saarbrücken HRB 104232\nLöschungsankündigung\n\nQbing Industrial Solutions GmbH\nGesellschaft mit beschränkter Haftung\nSaarbrücken\n\nEs ist beabsichtigt, die Gesellschaft von Amts wegen gemäß § 394 FamFG wegen Vermögenslosigkeit zu löschen.\nGegen die Löschung von Amts wegen ist das Rechtsmittel des Widerspruchs statthaft. Der Widerspruch ist binnen einer Frist zwei Monaten beginnend mit dem Tag dieser Veröffentlichung durch Einreichen eines Widerspruchsschreibens -schriftlich oder zur Niederschrift der Geschäftsstelle beim Amtsgericht Saarbrücken, -zentrales Handelsregister-, Mainzerstr.178, 66121 Saarbrücken einzulegen.\nDer Widerspruch muss die Bezeichnung der angefochtenen Löschungsankündigung enthalten sowie die Erklärung, dass Widerspruch eingelegt wird. Er ist vom Widerspruchsführer oder seinem Bevollmächtigten zu unterzeichnen.\nDas Widerspruchsschreiben kann auch in der Form eines elektronischen Dokumentes eingereicht werden, das mit einer qualifizierten elektronischen Signatur nach dem Signaturgesetz versehen sein muss (§§ 14 Abs. 2 FamFG, 130a, 298 ZPO)."
    },
    {
      "date": "2025-07-28",
      "id": "117713",
      "original_text": "Löschungsankündigung\nSaarland Amtsgericht Saarbrücken HRB 9243\nIgel GmbH – Saarbrücken",
      "type": "Löschungsankündigung",
      "state": "Saarland",
      "amtsgericht": "Amtsgericht Saarbrücken",
      "registernummer": "HRB 9243",
      "registerart": "HRB",
      "company_name": "Igel GmbH",
      "company_seat": "Saarbrücken",
      "details": "28.07.2025 (Bekanntmachungsdatum)\n\nSaarland Amtsgericht Saarbrücken HRB 9243\nLöschungsankündigung\n\nIgel GmbH\nGesellschaft mit beschränkter Haftung\nSaarbrücken\n\nEs ist beabsichtigt, die Gesellschaft von Amts wegen gemäß § 394 FamFG wegen Vermögenslosigkeit zu löschen.\nGegen die Löschung von Amts wegen ist das Rechtsmittel des Widerspruchs statthaft. Der Widerspruch ist binnen einer Frist zwei Monaten beginnend mit dem Tag dieser Veröffentlichung durch Einreichen eines Widerspruchsschreibens -schriftlich oder zur Niederschrift der Geschäftsstelle beim Amtsgericht Saarbrücken, -zentrales Handelsregister-, Mainzerstr.178, 66121 Saarbrücken einzulegen.\nDer Widerspruch muss die Bezeichnung der angefochtenen Löschungsankündigung enthalten sowie die Erklärung, dass Widerspruch eingelegt wird. Er ist vom Widerspruchsführer oder seinem Bevollmächtigten zu unterzeichnen.\nDas Widerspruchsschreiben kann auch in der Form eines elektronischen Dokumentes eingereicht werden, das mit einer qualifizierten elektronischen Signatur nach dem Signaturgesetz versehen sein muss (§§ 14 Abs. 2 FamFG, 130a, 298 ZPO)."
    },
    {
      "date": "2025-07-28",
      "id": "117714",
      "original_text": "Registerbekanntmachung nach dem Umwandlungsgesetz\nBaden-Württemberg Amtsgericht Mannheim HRB 336869\nRhein Neckar Post GmbH – Heidelberg",
      "type": "Registerbekanntmachung nach dem Umwandlungsgesetz",
      "state": "Baden-Württemberg",
      "amtsgericht": "Amtsgericht Mannheim",
      "registernummer": "HRB 336869",
      "registerart": "HRB",
      "company_name": "Rhein Neckar Post GmbH",
      "company_seat": "Heidelberg",
      "details": "28.07.2025 (Bekanntmachungsdatum)\n\nBaden-Württemberg Amtsgericht Mannheim HRB 336869\nRegisterbekanntmachung nach dem Umwandlungsgesetz 28.07.2025 (Eintragungsdatum)\n\nRhein Neckar Post GmbH\nGesellschaft mit beschränkter Haftung\nHeidelberg\n\nDen Gläubigern der an der Verschmelzung beteiligten Rechtsträger ist, wenn sie binnen sechs Monaten nach dem Tag, an dem die Eintragung der Verschmelzung in das Register des Sitzes desjenigen Rechtsträgers, dessen Gläubiger sie sind, nach § 19 Abs. 3 UmwG als bekanntgemacht gilt, ihren Anspruch nach Grund und Höhe schriftlich anmelden, Sicherheit zu leisten, soweit sie nicht Befriedigung verlangen können. Dieses Recht steht den Gläubigern jedoch nur zu, wenn sie glaubhaft machen, dass durch die Verschmelzung die Erfüllung ihrer Forderung gefährdet wird."
    },
    {
      "date": "2025-07-28",
      "id": "117715",
      "original_text": "Registerbekanntmachung nach dem Umwandlungsgesetz\nBaden-Württemberg Amtsgericht Mannheim HRB 336869\nRhein Neckar Post GmbH – Heidelberg",
      "type": "Registerbekanntmachung nach dem Umwandlungsgesetz",
      "state": "Baden-Württemberg",
      "amtsgericht": "Amtsgericht Mannheim",
      "registernummer": "HRB 336869",
      "registerart": "HRB",
      "company_name": "Rhein Neckar Post GmbH",
      "company_seat": "Heidelberg",
      "details": "28.07.2025 (Bekanntmachungsdatum)\n\nBaden-Württemberg Amtsgericht Mannheim HRB 336869\nRegisterbekanntmachung nach dem Umwandlungsgesetz 28.07.2025 (Eintragungsdatum)\n\nRhein Neckar Post GmbH\nGesellschaft mit beschränkter Haftung\nHeidelberg\n\nDen Gläubigern der an der Verschmelzung beteiligten Rechtsträger ist, wenn sie binnen sechs Monaten nach dem Tag, an dem die Eintragung der Verschmelzung in das Register des Sitzes desjenigen Rechtsträgers, dessen Gläubiger sie sind, nach § 19 Abs. 3 UmwG als bekanntgemacht gilt, ihren Anspruch nach Grund und Höhe schriftlich anmelden, Sicherheit zu leisten, soweit sie nicht Befriedigung verlangen können. Dieses Recht steht den Gläubigern jedoch nur zu, wenn sie glaubhaft machen, dass durch die Verschmelzung die Erfüllung ihrer Forderung gefährdet wird."
    },
    {
      "date": "2025-07-28",
      "id": "117716",
      "original_text": "Registerbekanntmachung nach dem Umwandlungsgesetz\nSaarland Amtsgericht Saarbrücken HRB 10650\napplied microsystems holding GmbH – Saarbrücken",
      "type": "Registerbekanntmachung nach dem Umwandlungsgesetz",
      "state": "Saarland",
      "amtsgericht": "Amtsgericht Saarbrücken",
      "registernummer": "HRB 10650",
      "registerart": "HRB",
      "company_name": "applied microsystems holding GmbH",
      "company_seat": "Saarbrücken",
      "details": "28.07.2025 (Bekanntmachungsdatum)\n\nSaarland Amtsgericht Saarbrücken HRB 10650\nRegisterbekanntmachung nach dem Umwandlungsgesetz 28.07.2025 (Eintragungsdatum)\n\napplied microsystems holding GmbH\nGesellschaft mit beschränkter Haftung\nSaarbrücken\n\nAls nicht eingetragen wird bekannt gemacht: Den Gläubigern der an der Verschmelzung beteiligten Gesellschaften ist, wenn sie binnen sechs Monaten nach dem Tag, an dem die Eintragung der Verschmelzung in das Register des Sitzes desjenigen Rechtsträgers, dessen Gläubiger sie sind, nach § 19 Absatz 3 UmwG bekannt gemacht worden ist, ihren Anspruch nach Grund und Höhe schriftlich anmelden, Sicherheit zu leisten, soweit sie nicht Befriedigung verlangen können. Dieses Recht steht den Gläubigern jedoch nur zu, wenn sie glaubhaft machen, dass durch die Verschmelzung die Erfüllung ihrer Forderung gefährdet wird."
    },
    {
      "date": "2025-07-28",
      "id": "117717",
      "original_text": "Registerbekanntmachung nach dem Umwandlungsgesetz\nBaden-Württemberg Amtsgericht Stuttgart HRB 734335\nRCH Holding GmbH – Ilshofen",
      "type": "Registerbekanntmachung nach dem Umwandlungsgesetz",
      "state": "Baden-Württemberg",
      "amtsgericht": "Amtsgericht Stuttgart",
      "registernummer": "HRB 734335",
      "registerart": "HRB",
      "company_name": "RCH Holding GmbH",
      "company_seat": "Ilshofen",
      "details": "28.07.2025 (Bekanntmachungsdatum)\n\nBaden-Württemberg Amtsgericht Stuttgart HRB 734335\nRegisterbekanntmachung nach dem Umwandlungsgesetz 28.07.2025 (Eintragungsdatum)\n\nRCH Holding GmbH\nGesellschaft mit beschränkter Haftung\nIlshofen\n\nAls nicht eingetragen wird bekanntgemacht:\nDen Gläubigern der an der Verschmelzung beteiligten Rechtsträger ist, wenn sie binnen sechs Monaten nach dem Tag, an dem die Eintragung der Verschmelzung in das Register des Sitzes desjenigen Rechtsträgers, dessen Gläubiger sie sind, nach § 19 Abs. 3 UmwG als bekanntgemacht gilt, ihren Anspruch nach Grund und Höhe schriftlich anmelden, Sicherheit zu leisten, soweit sie nicht Befriedigung verlangen können. Dieses Recht steht den Gläubigern jedoch nur zu, wenn sie glaubhaft machen, dass durch die Verschmelzung die Erfüllung ihrer Forderung gefährdet wird."
    },
    {
      "date": "2025-07-28",
      "id": "117718",
      "original_text": "Sonstige Registerbekanntmachung\nHamburg Amtsgericht Hamburg HRB 75783\n\"Hanseatic Brokerhouse Securities AG\" – Hamburg",
      "type": "Sonstige Registerbekanntmachung",
      "state": "Hamburg",
      "amtsgericht": "Amtsgericht Hamburg",
      "registernummer": "HRB 75783",
      "registerart": "HRB",
      "company_name": "\"Hanseatic Brokerhouse Securities AG\"",
      "company_seat": "Hamburg",
      "details": "28.07.2025 (Bekanntmachungsdatum)\n\nHamburg Amtsgericht Hamburg HRB 75783\nSonstige Registerbekanntmachung\n\n\"Hanseatic Brokerhouse Securities AG\"\nAktiengesellschaft\nHamburg\n\nAls nicht eingetragen wird bekannt gemacht: Liste des Aufsichtsrats wurde eingereicht."
    },
    {
      "date": "2025-07-28",
      "id": "117719",
      "original_text": "Löschungsankündigung\nBaden-Württemberg Amtsgericht Mannheim HRB 361627\nSchroth Dachdecker GmbH – Ettlingen",
      "type": "Löschungsankündigung",
      "state": "Baden-Württemberg",
      "amtsgericht": "Amtsgericht Mannheim",
      "registernummer": "HRB 361627",
      "registerart": "HRB",
      "company_name": "Schroth Dachdecker GmbH",
      "company_seat": "Ettlingen",
      "details": "28.07.2025 (Bekanntmachungsdatum)\n\nBaden-Württemberg Amtsgericht Mannheim HRB 361627\nLöschungsankündigung\n\nSchroth Dachdecker GmbH\nGesellschaft mit beschränkter Haftung\nEttlingen\n\nDas Gericht beabsichtigt, die Gesellschaft wegen Vermögenslosigkeit im Handelsregister von Amts wegen nach § 394 FamFG zu löschen. Die Frist zur Geltendmachung eines Widerspruchs gegen die beabsichtigte Löschung ist auf einen Monat ab Veröffentlichung bestimmt."
    },
    {
      "date": "2025-07-28",
      "id": "117720",
      "original_text": "Registerbekanntmachung nach dem Umwandlungsgesetz\nBaden-Württemberg Amtsgericht Mannheim HRB 362791\nfix.your.focus-GmbH – Pforzheim",
      "type": "Registerbekanntmachung nach dem Umwandlungsgesetz",
      "state": "Baden-Württemberg",
      "amtsgericht": "Amtsgericht Mannheim",
      "registernummer": "HRB 362791",
      "registerart": "HRB",
      "company_name": "fix.your.focus-GmbH",
      "company_seat": "Pforzheim",
      "details": "28.07.2025 (Bekanntmachungsdatum)\n\nBaden-Württemberg Amtsgericht Mannheim HRB 362791\nRegisterbekanntmachung nach dem Umwandlungsgesetz 28.07.2025 (Eintragungsdatum)\n\nfix.your.focus-GmbH\nGesellschaft mit beschränkter Haftung\nPforzheim\n\nAls nicht eingetragen wird bekanntgemacht:\nDen Gläubigern der an der Verschmelzung beteiligten Rechtsträger ist, wenn sie binnen sechs Monaten nach dem Tag, an dem die Eintragung der Verschmelzung in das Register des Sitzes desjenigen Rechtsträgers, dessen Gläubiger sie sind, nach § 19 Abs. 3 UmwG als bekanntgemacht gilt, ihren Anspruch nach Grund und Höhe schriftlich anmelden, Sicherheit zu leisten, soweit sie nicht Befriedigung verlangen können. Dieses Recht steht den Gläubigern jedoch nur zu, wenn sie glaubhaft machen, dass durch die Verschmelzung die Erfüllung ihrer Forderung gefährdet wird."
    },
    {
      "date": "2025-07-28",
      "id": "117721",
      "original_text": "Registerbekanntmachung nach dem Umwandlungsgesetz\nBaden-Württemberg Amtsgericht Ulm HRB 750241\nHörger GF GmbH – Sontheim",
      "type": "Registerbekanntmachung nach dem Umwandlungsgesetz",
      "state": "Baden-Württemberg",
      "amtsgericht": "Amtsgericht Ulm",
      "registernummer": "HRB 750241",
      "registerart": "HRB",
      "company_name": "Hörger GF GmbH",
      "company_seat": "Sontheim",
      "details": "28.07.2025 (Bekanntmachungsdatum)\n\nBaden-Württemberg Amtsgericht Ulm HRB 750241\nRegisterbekanntmachung nach dem Umwandlungsgesetz 28.07.2025 (Eintragungsdatum)\n\nHörger GF GmbH\nGesellschaft mit beschränkter Haftung\nSontheim\n\nAls nicht eingetragen wird bekanntgemacht:\nDen Gläubigern des an dem Formwechsel beteiligten Rechtsträgers ist, wenn sie binnen sechs Monaten nach dem Tag, an dem die Eintragung des Formwechsels in das Register des Sitzes desjenigen Rechtsträgers, dessen Gläubiger sie sind, nach § 19 Abs. 3 UmwG als bekanntgemacht gilt, ihren Anspruch nach Grund und Höhe schriftlich anmelden, Sicherheit zu leisten, soweit sie nicht Befriedigung verlangen können. Dieses Recht steht den Gläubigern jedoch nur zu, wenn sie glaubhaft machen, dass durch den Formwechsel die Erfüllung ihrer Forderung gefährdet wird."
    },
    {
      "date": "2025-07-28",
      "id": "117722",
      "original_text": "Registerbekanntmachung nach dem Umwandlungsgesetz\nBaden-Württemberg Amtsgericht Ulm HRB 661669\nHörger AG – Sontheim an der Brenz",
      "type": "Registerbekanntmachung nach dem Umwandlungsgesetz",
      "state": "Baden-Württemberg",
      "amtsgericht": "Amtsgericht Ulm",
      "registernummer": "HRB 661669",
      "registerart": "HRB",
      "company_name": "Hörger AG",
      "company_seat": "Sontheim an der Brenz",
      "details": "28.07.2025 (Bekanntmachungsdatum)\n\nBaden-Württemberg Amtsgericht Ulm HRB 661669\nRegisterbekanntmachung nach dem Umwandlungsgesetz 28.07.2025 (Eintragungsdatum)\n\nHörger AG\nAktiengesellschaft\nSontheim an der Brenz\n\nAls nicht eingetragen wird bekanntgemacht:\nDen Gläubigern des an dem Formwechsel beteiligten Rechtsträgers ist, wenn sie binnen sechs Monaten nach dem Tag, an dem die Eintragung des Formwechsels in das Register des Sitzes desjenigen Rechtsträgers, dessen Gläubiger sie sind, nach § 19 Abs. 3 UmwG als bekanntgemacht gilt, ihren Anspruch nach Grund und Höhe schriftlich anmelden, Sicherheit zu leisten, soweit sie nicht Befriedigung verlangen können. Dieses Recht steht den Gläubigern jedoch nur zu, wenn sie glaubhaft machen, dass durch den Formwechsel die Erfüllung ihrer Forderung gefährdet wird."
    },
    {
      "date": "2025-07-28",
      "id": "117723",
      "original_text": "Einreichung neuer Dokumente\nBaden-Württemberg Amtsgericht Stuttgart HRB 23332\nBosch Pensionsfonds AG – Stuttgart",
      "type": "Einreichung neuer Dokumente",
      "state": "Baden-Württemberg",
      "amtsgericht": "Amtsgericht Stuttgart",
      "registernummer": "HRB 23332",
      "registerart": "HRB",
      "company_name": "Bosch Pensionsfonds AG",
      "company_seat": "Stuttgart",
      "details": "28.07.2025 (Bekanntmachungsdatum)\n\nBaden-Württemberg Amtsgericht Stuttgart HRB 23332\nEinreichung neuer Dokumente\n\nBosch Pensionsfonds AG\nAktiengesellschaft\nStuttgart\n\nDie Gesellschaft hat am 25.07.2025 die Liste über die Zusammensetzung des Aufsichtsrats zum Handelsregister eingereicht."
    },
    {
      "date": "2025-07-28",
      "id": "117724",
      "original_text": "Registerbekanntmachung nach dem Umwandlungsgesetz\nBaden-Württemberg Amtsgericht Mannheim HRB 712032\nstocard GmbH – Mannheim",
      "type": "Registerbekanntmachung nach dem Umwandlungsgesetz",
      "state": "Baden-Württemberg",
      "amtsgericht": "Amtsgericht Mannheim",
      "registernummer": "HRB 712032",
      "registerart": "HRB",
      "company_name": "stocard GmbH",
      "company_seat": "Mannheim",
      "details": "28.07.2025 (Bekanntmachungsdatum)\n\nBaden-Württemberg Amtsgericht Mannheim HRB 712032\nRegisterbekanntmachung nach dem Umwandlungsgesetz\n\nstocard GmbH\nGesellschaft mit beschränkter Haftung\nMannheim\n\nDie Gesellschaft hat am 24.07.2025 den Entwurf des Verschmelzungsvertrages zwischen der \"Klarna Bank AB\", Stockholm/Schweden (schwedisches Handelsregister (Bolagsverket) Registrierungsnummer  556737-0431)\nund der hiesigen Gesellschaft (übertragender Rechtsträger) zum Handelsregister eingereicht.\n\nWeitere Angaben gemäß § 308 Abs. 1 UmwG:\n1. An der grenzüberschreitenden Verschmelzung sind beteiligt (§ 308 Abs. 1 S. 2 Nr. 2 UmwG)\n- Die stocard GmbH, eine Gesellschaft mit beschränkter Haftung deutschen Rechts, mit Sitz in Mannheim, Deutschland, eingetragen im Handelsregister des Amtsgerichts Mannheims unter HRB 712032, als übertragende Gesellschaft\n- die Klarna Bank AB, eine Aktiengesellschaft nach schwedischem Recht, mit Sitz in Stockholm, Schweden, eingetragen im zentralen schwedischen Handelsregister (Bolagsverket) unter Registrierungsnummer 556737-0431, als übernehmende Gesellschaft.\n\n2. Die Urkunden sind hinterlegt (§ 308 Abs. 1 S. 2 Nr. 3)\n- für die stocard GmbH mit Sitz in Mannheim/Deutschland beim Handelsregister des Amtsgerichts Mannheim unter HRB 712032\n- für die Klarna Bank AB. mit Sitz in Stockholm/Schweden beim schwedischen Handelsregister (Bolagsverket) unter Registrierungsnummer 556737-0431\n\n3. Zu den Modalitäten der Ausübung der Rechte der Gläubiger und der Minderheitsgesellschafter wird Folgendes mitgeteilt:\nGläubigern, die einen Anspruch gegen die Gesellschaft haben, wird Sicherheit geleistet, wenn sie innerhalb von sechs Monaten (§ 305 Abs. 2 i.V.m. § 22 UmwG) nach Offenlegung der Eintragung ihre Forderung dem Grunde und der Höhe nach schriftlich geltend machen. Der Anspruch steht den Gläubigern nur insoweit zu, als dass sie glaubhaft machen können, dass ihre Ansprüche durch die Verschmelzung gefährdet sind und sie nicht bereits Befriedigung verlangen können. Die Anmeldung ist zu richten an stocard GmbH z.H. der Geschäftsführung Glücksteinallee 25, 68163 Mannheim\nUnter dieser Anschrift können kostenlos erschöpfende Auskünfte über diese Modalitäten eingeholt werden.\nEs ist unerheblich, ob der Anspruch des jeweiligen Gläubigers auf Vertrag oder Gesetz beruht. Allerdings muss es sich um einen so genannten obligatorischen Anspruch handeln. Dingliche Ansprüche fallen nicht in den Anwendungsbereich des § 305 Abs. 2 i.V.m. § 22 UmwG, da der Gegenstand des dinglichen Rechts eine ausreichende Sicherheit darstellt. Anspruchsinhalt muss nicht notwendig ein Geldbetrag sein. Jeglicher Vermögenswert, z.B. die Lieferung einer Sache oder die Einbringung einer Dienstleistung, ist ausreichend, da auch insoweit ein Sicherungsbedürfnis im Hinblick auf einen später gegebenenfalls daraus resultierenden Schadenersatzanspruch besteht.\nGläubigern, die im Falle der Insolvenz ein Recht auf vorzugsweise Befriedigung aus einer Deckungsmasse haben, die nach gesetzlicher Vorschrift zu ihrem Schutz errichtet und staatlich überwacht ist, steht das Recht, Sicherheitsleistung zu verlangen, nicht zu.\nNach Ablauf von sechs Monaten nach Bekanntmachung der Eintragung der Verschmelzung in das Handelsregister der aufnehmenden Klarna Bank AB kommt eine Sicherheitsleistung nicht mehr in Betracht.\nWeder die Klarna Bank AB, noch die stocard GmbH hat Minderheitsgesellschafter, so dass Angaben über die Ausübung von deren Rechten entfallen.\n\n4. Die Anteilsinhaber und Gläubiger der an der grenzüberschreitenden Verschmelzung beteiligten Gesellschaften sowie - da vorliegend zuständige Betriebsräte nicht vorhanden sind - die Arbeitnehmer der an der grenzüberschreitenden Verschmelzung beteiligten Gesellschaften können der jeweiligen Gesellschaft spätestens fünf Arbeitstage vor dem Tag der Gesellschafterversammlung Bemerkungen zum Verschmelzungsplan übermitteln (§ 308 Abs. 1 Satz 2 Nr. 4 UmwG):\nBemerkungen können an folgende Anschriften der an der grenzüberschreitenden Verschmelzung beteiligten Gesellschaften übermittelt werden:\na) stocard GmbH als übertragende Gesellschaft: Glücksteinallee 25, 68163 Mannheim,\nDeutschland\nb) Klarna Bank AB  als aufnehmende Gesellschaft: Sveavägen 46, 11134 Stockholm, Schweden\nAuskünfte über Modalitäten der Rechtsausübung können kostenlos unter folgender Anschrift eingeholt werden:\na) stocard GmbH als übertragende Gesellschaft: Glücksteinallee 25, 68163 Mannheim,\nDeutschland\nb) Klarna Bank AB  als aufnehmende Gesellschaft: Sveavägen 46, 11134 Stockholm, Schweden"
    },
    {
      "date": "2025-07-28",
      "id": "117725",
      "original_text": "Sonstige Registerbekanntmachung\nSachsen-Anhalt Amtsgericht Stendal GnR 8\nMilchliefergenossenschaft Altmark eG – Bismark (Altmark)",
      "type": "Sonstige Registerbekanntmachung",
      "state": "Sachsen-Anhalt",
      "amtsgericht": "Amtsgericht Stendal",
      "registernummer": "GnR 8",
      "registerart": "GnR",
      "company_name": "Milchliefergenossenschaft Altmark eG",
      "company_seat": "Bismark (Altmark)",
      "details": "28.07.2025 (Bekanntmachungsdatum)\n\nSachsen-Anhalt Amtsgericht Stendal GnR 8\nSonstige Registerbekanntmachung 19.02.2024 (Eintragungsdatum)\n\nMilchliefergenossenschaft Altmark eG\neingetragene Genossenschaft\nBismark (Altmark)\n\nAls nicht eingetragen wird veröffentlicht: Der Geschäftsanteil beträgt 20,00 EUR.\n\nDen Gläubigern der Genossenschaft ist, wenn sie sich binnen 6 Monaten nach der Bekanntmachung bei der Genossenschaft zu diesem Zweck melden, Sicherheit zu leisten, soweit sie nicht Befriedigung verlangen können (§ 22 Abs. 1 bis 3 GenG)."
    },
    {
      "date": "2025-07-28",
      "id": "117726",
      "original_text": "Löschungsankündigung\nMecklenburg-Vorpommern Amtsgericht Rostock HRB 11402\nIntensivpflege Norddeutschland GmbH – Rostock",
      "type": "Löschungsankündigung",
      "state": "Mecklenburg-Vorpommern",
      "amtsgericht": "Amtsgericht Rostock",
      "registernummer": "HRB 11402",
      "registerart": "HRB",
      "company_name": "Intensivpflege Norddeutschland GmbH",
      "company_seat": "Rostock",
      "details": "28.07.2025 (Bekanntmachungsdatum)\n\nMecklenburg-Vorpommern Amtsgericht Rostock HRB 11402\nLöschungsankündigung\n\nIntensivpflege Norddeutschland GmbH\nGesellschaft mit beschränkter Haftung\nRostock\n\nDas Registergericht beabsichtigt, die im Handelsregister eingetragene Gesellschaft von Amts wegen nach § 394 FamFG zu löschen. Die Frist zur Erhebung eines Widerspruchs gegen die beabsichtigte Löschung wird auf einen Monat festgesetzt."
    },
    {
      "date": "2025-07-28",
      "id": "117727",
      "original_text": "Sonstige Registerbekanntmachung\nBaden-Württemberg Amtsgericht Mannheim HRB 733200\nMapstar AG – Karlsruhe",
      "type": "Sonstige Registerbekanntmachung",
      "state": "Baden-Württemberg",
      "amtsgericht": "Amtsgericht Mannheim",
      "registernummer": "HRB 733200",
      "registerart": "HRB",
      "company_name": "Mapstar AG",
      "company_seat": "Karlsruhe",
      "details": "28.07.2025 (Bekanntmachungsdatum)\n\nBaden-Württemberg Amtsgericht Mannheim HRB 733200\nSonstige Registerbekanntmachung\n\nMapstar AG\nAktiengesellschaft\nKarlsruhe\n\nDie Gesellschaft hat am 15.04.2025 die Liste über die Zusammensetzung des Aufsichtsrats zum Handelsregister eingereicht."
    },
    {
      "date": "2025-07-28",
      "id": "117728",
      "original_text": "Löschungsankündigung\nBaden-Württemberg Amtsgericht Stuttgart HRB 252134\nD.W. VERMÖGENSVERWALTUNGSGESELLSCHAFT I MBH – Renningen",
      "type": "Löschungsankündigung",
      "state": "Baden-Württemberg",
      "amtsgericht": "Amtsgericht Stuttgart",
      "registernummer": "HRB 252134",
      "registerart": "HRB",
      "company_name": "D.W. VERMÖGENSVERWALTUNGSGESELLSCHAFT I MBH",
      "company_seat": "Renningen",
      "details": "28.07.2025 (Bekanntmachungsdatum)\n\nBaden-Württemberg Amtsgericht Stuttgart HRB 252134\nLöschungsankündigung\n\nD.W. VERMÖGENSVERWALTUNGSGESELLSCHAFT  I MBH\nGesellschaft mit beschränkter Haftung\nRenningen\n\nAls nicht eingetragen wird bekanntgemacht:\nDas Gericht beabsichtigt, die Gesellschaft wegen Vermögenslosigkeit im Handelsregister von Amts wegen nach § 394 FamFG zu löschen. Die Frist zur Geltendmachung eines Widerspruchs gegen die beabsichtigte Löschung ist auf zwei Monate ab Veröffentlichung bestimmt."
    },
    {
      "date": "2025-07-28",
      "id": "117729",
      "original_text": "Registerbekanntmachung nach dem Umwandlungsgesetz\nBaden-Württemberg Amtsgericht Stuttgart HRB 264094\nmedi1one medical gmbh – Fellbach",
      "type": "Registerbekanntmachung nach dem Umwandlungsgesetz",
      "state": "Baden-Württemberg",
      "amtsgericht": "Amtsgericht Stuttgart",
      "registernummer": "HRB 264094",
      "registerart": "HRB",
      "company_name": "medi1one medical gmbh",
      "company_seat": "Fellbach",
      "details": "28.07.2025 (Bekanntmachungsdatum)\n\nBaden-Württemberg Amtsgericht Stuttgart HRB 264094\nRegisterbekanntmachung nach dem Umwandlungsgesetz 28.07.2025 (Eintragungsdatum)\n\nmedi1one medical gmbh\nGesellschaft mit beschränkter Haftung\nFellbach\n\nAls nicht eingetragen wird bekanntgemacht:\nDen Gläubigern der an der Verschmelzung beteiligten Rechtsträger ist, wenn sie binnen sechs Monaten nach dem Tag, an dem die Eintragung der Verschmelzung in das Register des Sitzes desjenigen Rechtsträgers, dessen Gläubiger sie sind, nach § 19 Abs. 3 UmwG als bekanntgemacht gilt, ihren Anspruch nach Grund und Höhe schriftlich anmelden, Sicherheit zu leisten, soweit sie nicht Befriedigung verlangen können. Dieses Recht steht den Gläubigern jedoch nur zu, wenn sie glaubhaft machen, dass durch die Verschmelzung die Erfüllung ihrer Forderung gefährdet wird."
    },
    {
      "date": "2025-07-28",
      "id": "117730",
      "original_text": "Einreichung neuer Dokumente\nHamburg Amtsgericht Hamburg HRB 150001\nStromunion AG – Hamburg",
      "type": "Einreichung neuer Dokumente",
      "state": "Hamburg",
      "amtsgericht": "Amtsgericht Hamburg",
      "registernummer": "HRB 150001",
      "registerart": "HRB",
      "company_name": "Stromunion AG",
      "company_seat": "Hamburg",
      "details": "28.07.2025 (Bekanntmachungsdatum)\n\nHamburg Amtsgericht Hamburg HRB 150001\nEinreichung neuer Dokumente\n\nStromunion AG\nAktiengesellschaft\nHamburg\n\nDie Gesellschaft hat gemäß § 62 UmwG den Entwurf des Verschmelzungsvertrages bei dem Handelsregister eingereicht, mit dem\n\ndie SUAG Mecklenburg-Vorpommern GmbH mit Sitz in Hamburg (Amtsgericht Hamburg HRB 152828);\n\ndie SUAG Ludwigslust GmbH mit Sitz in Hamburg (Amtsgericht Hamburg HRB 153943);\n\ndie SUAG Magdeburg GmbH mit Sitz in Hamburg (Amtsgericht Hamburg HRB 149549) und\n\ndie SUAG Weiden GmbH mit Sitz in Weiden i.d . Opf., (Amtsgericht Weiden i. d. Opf. HRB 6182)\n\nals übertragende Gesellschaften\n\nauf die Stromunion AG mit Sitz in Hamburg (Amtsgericht Hamburg HRB 150001) als übernehmende Gesellschaft verschmolzen wird."
    },
    {
      "date": "2025-07-28",
      "id": "117731",
      "original_text": "Registerbekanntmachung nach dem Umwandlungsgesetz\nBerlin Amtsgericht Berlin (Charlottenburg) HRB 176302\nPYUR Vertrieb & Service GmbH – Berlin",
      "type": "Registerbekanntmachung nach dem Umwandlungsgesetz",
      "state": "Berlin",
      "amtsgericht": "Amtsgericht Berlin (Charlottenburg)",
      "registernummer": "HRB 176302",
      "registerart": "HRB",
      "company_name": "PYUR Vertrieb & Service GmbH",
      "company_seat": "Berlin",
      "details": "28.07.2025 (Bekanntmachungsdatum)\n\nBerlin Amtsgericht Berlin (Charlottenburg) HRB 176302\nRegisterbekanntmachung nach dem Umwandlungsgesetz 25.07.2025 (Eintragungsdatum)\n\nPYUR Vertrieb & Service GmbH\nGesellschaft mit beschränkter Haftung\nBerlin\n\nZu Eintragungsnummer 30 vom 25.07.2025 wird als nicht eingetragen veröffentlicht: Den Gläubigern der an der Spaltung beteiligten Rechtsträger ist, wenn sie binnen sechs Monaten nach dem Tag, an dem die Eintragung der Spaltung in das Register des Sitzes desjenigen Rechtsträgers, dessen Gläubiger sie sind, als bekannt gemacht gilt, ihren Anspruch nach Grund und Höhe schriftlich anmelden, Sicherheit zu leisten, soweit sie nicht Befriedigung verlangen können. Dieses Recht steht den Gläubigern jedoch nur zu, wenn sie glaubhaft machen, dass durch die Spaltung die Erfüllung ihrer Forderung gefährdet wird. Das Recht, Sicherheitsleistung zu verlangen, steht Gläubigern nicht zu, die im Falle der Insolvenz ein Recht auf vorzugsweise Befriedigung aus einer Deckungsmasse haben, die nach gesetzlicher Vorschrift zu ihrem Schutz errichtet und staatlich überwacht ist."
    },
    {
      "date": "2025-07-28",
      "id": "117732",
      "original_text": "Registerbekanntmachung nach dem Umwandlungsgesetz\nMecklenburg-Vorpommern Amtsgericht Neubrandenburg HRB 6310\nneu-mobil GmbH – Neubrandenburg",
      "type": "Registerbekanntmachung nach dem Umwandlungsgesetz",
      "state": "Mecklenburg-Vorpommern",
      "amtsgericht": "Amtsgericht Neubrandenburg",
      "registernummer": "HRB 6310",
      "registerart": "HRB",
      "company_name": "neu-mobil GmbH",
      "company_seat": "Neubrandenburg",
      "details": "28.07.2025 (Bekanntmachungsdatum)\n\nMecklenburg-Vorpommern Amtsgericht Neubrandenburg HRB 6310\nRegisterbekanntmachung nach dem Umwandlungsgesetz 28.07.2025 (Eintragungsdatum)\n\nneu-mobil GmbH\nGesellschaft mit beschränkter Haftung\nNeubrandenburg\n\nAls nicht eingetragen wird veröffentlicht: Den Gläubigern der an der Verschmelzung beteiligten Rechtsträger ist, wenn sie binnen sechs Monaten nach dem Tag, an dem die Eintragung der Verschmelzung in das Register des Sitzes desjenigen Rechtsträgers, dessen Gläubiger sie sind, nach § 19 Abs. 3 UmwG als bekannt gemacht gilt,\nihren Anspruch nach Grund und Höhe in Textform anmelden, Sicherheit zu leisten, soweit sie nicht Befriedigung verlangen können. Dieses Recht steht den Gläubigern jedoch nur zu, wenn sie glaubhaft machen, dass durch die Verschmelzung die Erfüllung der Forderung gefährdet wird."
    },
    {
      "date": "2025-07-28",
      "id": "117733",
      "original_text": "Registerbekanntmachung nach dem Umwandlungsgesetz\nBrandenburg Amtsgericht Cottbus HRB 8507\nHobby- und Freizeitbörse aktiv GmbH – Cottbus",
      "type": "Registerbekanntmachung nach dem Umwandlungsgesetz",
      "state": "Brandenburg",
      "amtsgericht": "Amtsgericht Cottbus",
      "registernummer": "HRB 8507",
      "registerart": "HRB",
      "company_name": "Hobby- und Freizeitbörse aktiv GmbH",
      "company_seat": "Cottbus",
      "details": "28.07.2025 (Bekanntmachungsdatum)\n\nBrandenburg Amtsgericht Cottbus HRB 8507\nRegisterbekanntmachung nach dem Umwandlungsgesetz 25.07.2025 (Eintragungsdatum)\n\nHobby- und Freizeitbörse aktiv GmbH\nGesellschaft mit beschränkter Haftung\nCottbus\n\nAls nicht eingetragen wird veröffentlicht:\nDen Gläubigern der an der Verschmelzung beteiligten Rechtsträger ist, wenn sie binnen sechs Monaten nach dem Tag, an dem die Eintragung der Verschmelzung in das Register des Sitzes desjenigen Rechtsträgers, dessen Gläubiger sie sind, als bekannt gemacht gilt, ihren Anspruch nach Grund und Höhe schriftlich anmelden, Sicherheit zu leisten, soweit sie nicht Befriedigung verlangen können. Dieses Recht steht den Gläubigern jedoch nur zu, wenn sie glaubhaft machen, dass durch die Verschmelzung die Erfüllung ihrer Forderung gefährdet wird"
    },
    {
      "date": "2025-07-28",
      "id": "117734",
      "original_text": "Registerbekanntmachung nach dem Umwandlungsgesetz\nMecklenburg-Vorpommern Amtsgericht Neubrandenburg HRB 1194\nNeubrandenburger Stadtwerke GmbH – Neubrandenburg",
      "type": "Registerbekanntmachung nach dem Umwandlungsgesetz",
      "state": "Mecklenburg-Vorpommern",
      "amtsgericht": "Amtsgericht Neubrandenburg",
      "registernummer": "HRB 1194",
      "registerart": "HRB",
      "company_name": "Neubrandenburger Stadtwerke GmbH",
      "company_seat": "Neubrandenburg",
      "details": "28.07.2025 (Bekanntmachungsdatum)\n\nMecklenburg-Vorpommern Amtsgericht Neubrandenburg HRB 1194\nRegisterbekanntmachung nach dem Umwandlungsgesetz 28.07.2025 (Eintragungsdatum)\n\nNeubrandenburger Stadtwerke GmbH\nGesellschaft mit beschränkter Haftung\nNeubrandenburg\n\nAls nicht eingetragen wird veröffentlicht: Den Gläubigern der an der Verschmelzung beteiligten Rechtsträger ist, wenn sie binnen sechs Monaten nach dem Tag, an dem die Eintragung der Verschmelzung in das Register des Sitzes desjenigen Rechtsträgers, dessen Gläubiger sie sind, nach § 19 Abs. 3 UmwG als bekannt gemacht gilt,\nihren Anspruch nach Grund und Höhe in Textform anmelden, Sicherheit zu leisten, soweit sie nicht Befriedigung verlangen können. Dieses Recht steht den Gläubigern jedoch nur zu, wenn sie glaubhaft machen, dass durch die Verschmelzung die Erfüllung der Forderung gefährdet wird."
    },
    {
      "date": "2025-07-28",
      "id": "117735",
      "original_text": "Registerbekanntmachung nach dem Umwandlungsgesetz\nHamburg Amtsgericht Hamburg HRB 131859\nPIA GmbH – Hamburg",
      "type": "Registerbekanntmachung nach dem Umwandlungsgesetz",
      "state": "Hamburg",
      "amtsgericht": "Amtsgericht Hamburg",
      "registernummer": "HRB 131859",
      "registerart": "HRB",
      "company_name": "PIA GmbH",
      "company_seat": "Hamburg",
      "details": "28.07.2025 (Bekanntmachungsdatum)\n\nHamburg Amtsgericht Hamburg HRB 131859\nRegisterbekanntmachung nach dem Umwandlungsgesetz 28.07.2025 (Eintragungsdatum)\n\nPIA GmbH\nGesellschaft mit beschränkter Haftung\nHamburg\n\nAls nicht eingetragen wird bekannt gemacht:\nDen Gläubigern der an der Verschmelzung beteiligten Gesellschaften ist, wenn sie binnen sechs Monaten nach dem Tag, an dem die Eintragung der Verschmelzung in das Register des Sitzes desjenigen Rechtsträgers, dessen Gläubiger sie sind, nach § 19 Absatz 3 UmwG als bekannt gemacht gilt, ihren Anspruch nach Grund und Höhe schriftlich anmelden, Sicherheit zu leisten, soweit sie nicht Befriedigung verlangen können. Dieses Recht steht den Gläubigern jedoch nur zu, wenn sie glaubhaft machen, dass durch die Verschmelzung die Erfüllung ihrer Forderung gefährdet wird."
    },
    {
      "date": "2025-07-28",
      "id": "117736",
      "original_text": "Registerbekanntmachung nach dem Umwandlungsgesetz\nBaden-Württemberg Amtsgericht Ulm HRB 727499\nFerkelhof Wohnhaas Verwaltungs-GmbH – Biberach an der Riß",
      "type": "Registerbekanntmachung nach dem Umwandlungsgesetz",
      "state": "Baden-Württemberg",
      "amtsgericht": "Amtsgericht Ulm",
      "registernummer": "HRB 727499",
      "registerart": "HRB",
      "company_name": "Ferkelhof Wohnhaas Verwaltungs-GmbH",
      "company_seat": "Biberach an der Riß",
      "details": "28.07.2025 (Bekanntmachungsdatum)\n\nBaden-Württemberg Amtsgericht Ulm HRB 727499\nRegisterbekanntmachung nach dem Umwandlungsgesetz 28.07.2025 (Eintragungsdatum)\n\nFerkelhof Wohnhaas Verwaltungs-GmbH\nGesellschaft mit beschränkter Haftung\nBiberach an der Riß\n\nAls nicht eingetragen wird bekanntgemacht:\nDen Gläubigern der an der Verschmelzung beteiligten Rechtsträger ist, wenn sie binnen sechs Monaten nach dem Tag, an dem die Eintragung der Verschmelzung in das Register des Sitzes desjenigen Rechtsträgers, dessen Gläubiger sie sind, nach § 19 Abs. 3 UmwG als bekanntgemacht gilt, ihren Anspruch nach Grund und Höhe schriftlich anmelden, Sicherheit zu leisten, soweit sie nicht Befriedigung verlangen können. Dieses Recht steht den Gläubigern jedoch nur zu, wenn sie glaubhaft machen, dass durch die Verschmelzung die Erfüllung ihrer Forderung gefährdet wird."
    },
    {
      "date": "2025-07-28",
      "id": "117737",
      "original_text": "Registerbekanntmachung nach dem Umwandlungsgesetz\nBaden-Württemberg Amtsgericht Ulm HRA 722863\nFerkelhof Wohnhaas OHG – Biberach an der Riß",
      "type": "Registerbekanntmachung nach dem Umwandlungsgesetz",
      "state": "Baden-Württemberg",
      "amtsgericht": "Amtsgericht Ulm",
      "registernummer": "HRA 722863",
      "registerart": "HRA",
      "company_name": "Ferkelhof Wohnhaas OHG",
      "company_seat": "Biberach an der Riß",
      "details": "28.07.2025 (Bekanntmachungsdatum)\n\nBaden-Württemberg Amtsgericht Ulm HRA 722863\nRegisterbekanntmachung nach dem Umwandlungsgesetz 28.07.2025 (Eintragungsdatum)\n\nFerkelhof Wohnhaas OHG\nOffene Handelsgesellschaft\nBiberach an der Riß\n\nAls nicht eingetragen wird bekanntgemacht:\nDen Gläubigern der an der Verschmelzung beteiligten Rechtsträger ist, wenn sie binnen sechs Monaten nach dem Tag, an dem die Eintragung der Verschmelzung in das Register des Sitzes desjenigen Rechtsträgers, dessen Gläubiger sie sind, nach § 19 Abs. 3 UmwG als bekanntgemacht gilt, ihren Anspruch nach Grund und Höhe schriftlich anmelden, Sicherheit zu leisten, soweit sie nicht Befriedigung verlangen können. Dieses Recht steht den Gläubigern jedoch nur zu, wenn sie glaubhaft machen, dass durch die Verschmelzung die Erfüllung ihrer Forderung gefährdet wird."
    },
    {
      "date": "2025-07-28",
      "id": "117738",
      "original_text": "Registerbekanntmachung nach dem Umwandlungsgesetz\nBaden-Württemberg Amtsgericht Freiburg HRA 700769\nIng. Alfred Winkler GmbH & Co. KG – Villingen-Schwenningen",
      "type": "Registerbekanntmachung nach dem Umwandlungsgesetz",
      "state": "Baden-Württemberg",
      "amtsgericht": "Amtsgericht Freiburg",
      "registernummer": "HRA 700769",
      "registerart": "HRA",
      "company_name": "Ing. Alfred Winkler GmbH & Co. KG",
      "company_seat": "Villingen-Schwenningen",
      "details": "28.07.2025 (Bekanntmachungsdatum)\n\nBaden-Württemberg Amtsgericht Freiburg HRA 700769\nRegisterbekanntmachung nach dem Umwandlungsgesetz 28.07.2025 (Eintragungsdatum)\n\nIng. Alfred Winkler GmbH & Co. KG\nKommanditgesellschaft\nVillingen-Schwenningen\n\nDen Gläubigern der an der Verschmelzung beteiligten Rechtsträger ist, wenn sie binnen sechs Monaten nach dem Tag, an dem die Eintragung der Verschmelzung in das Register des Sitzes desjenigen Rechtsträgers, dessen Gläubiger sie sind, nach § 19 Abs. 3 UmwG als bekanntgemacht gilt, ihren Anspruch nach Grund und Höhe schriftlich anmelden, Sicherheit zu leisten, soweit sie nicht Befriedigung verlangen können. Dieses Recht steht den Gläubigern jedoch nur zu, wenn sie glaubhaft machen, dass durch die Verschmelzung die Erfüllung ihrer Forderung gefährdet wird."
    },
    {
      "date": "2025-07-28",
      "id": "117739",
      "original_text": "Einreichung neuer Dokumente\nSchleswig-Holstein Amtsgericht Pinneberg HRB 19144\nGolf Resort Gut Apeldör AG – Hennstedt/Krs. Dithmarschen",
      "type": "Einreichung neuer Dokumente",
      "state": "Schleswig-Holstein",
      "amtsgericht": "Amtsgericht Pinneberg",
      "registernummer": "HRB 19144",
      "registerart": "HRB",
      "company_name": "Golf Resort Gut Apeldör AG",
      "company_seat": "Hennstedt/Krs. Dithmarschen",
      "details": "28.07.2025 (Bekanntmachungsdatum)\n\nSchleswig-Holstein Amtsgericht Pinneberg HRB 19144\nEinreichung neuer Dokumente\n\nGolf Resort Gut Apeldör AG\nAktiengesellschaft\nHennstedt/Krs. Dithmarschen\n\nAls nicht eingetragen wird veröffentlicht: Es wurde eine neue Liste der Aufsichtsratsmitglieder zum Handelsregister eingereicht."
    },
    {
      "date": "2025-07-28",
      "id": "117740",
      "original_text": "Registerbekanntmachung nach dem Umwandlungsgesetz\nHamburg Amtsgericht Hamburg HRA 131974\nDehua Chen e.K. – Hamburg",
      "type": "Registerbekanntmachung nach dem Umwandlungsgesetz",
      "state": "Hamburg",
      "amtsgericht": "Amtsgericht Hamburg",
      "registernummer": "HRA 131974",
      "registerart": "HRA",
      "company_name": "Dehua Chen e.K.",
      "company_seat": "Hamburg",
      "details": "28.07.2025 (Bekanntmachungsdatum)\n\nHamburg Amtsgericht Hamburg HRA 131974\nRegisterbekanntmachung nach dem Umwandlungsgesetz 28.07.2025 (Eintragungsdatum)\n\nDehua Chen e.K.\nEinzelkaufmann\nHamburg\n\nAls nicht eingetragen wird bekannt gemacht:\nDen Gläubigern der an der Ausgliederung beteiligten Gesellschaften ist, wenn sie binnen sechs Monaten nach dem Tag, an dem die Eintragung der Ausgliederung in das Register des Sitzes desjenigen Rechtsträgers, dessen Gläubiger sie sind, nach § 19 Absatz 3 UmwG als bekannt gemacht gilt, ihren Anspruch nach Grund und Höhe schriftlich anmelden, Sicherheit zu leisten, soweit sie nicht Befriedigung verlangen können. Dieses Recht steht den Gläubigern jedoch nur zu, wenn sie glaubhaft machen, dass durch die Ausgliederung die Erfüllung ihrer Forderung gefährdet wird."
    },
    {
      "date": "2025-07-28",
      "id": "117741",
      "original_text": "Registerbekanntmachung nach dem Umwandlungsgesetz\nBerlin Amtsgericht Berlin (Charlottenburg) HRB 274904\nKüpper & Kollegen Influencer GmbH – Berlin",
      "type": "Registerbekanntmachung nach dem Umwandlungsgesetz",
      "state": "Berlin",
      "amtsgericht": "Amtsgericht Berlin (Charlottenburg)",
      "registernummer": "HRB 274904",
      "registerart": "HRB",
      "company_name": "Küpper & Kollegen Influencer GmbH",
      "company_seat": "Berlin",
      "details": "28.07.2025 (Bekanntmachungsdatum)\n\nBerlin Amtsgericht Berlin (Charlottenburg) HRB 274904\nRegisterbekanntmachung nach dem Umwandlungsgesetz 27.07.2025 (Eintragungsdatum)\n\nKüpper & Kollegen Influencer GmbH\nGesellschaft mit beschränkter Haftung\nBerlin\n\nZu Eintragungsnummer 3 vom 27.07.2025 wird als nicht eingetragen veröffentlicht:\n\nDen Gläubigern der an der Verschmelzung beteiligten Rechtsträger ist, wenn sie binnen sechs Monaten nach dem Tag, an dem die Eintragung der Verschmelzung in das Register des Sitzes desjenigen Rechtsträgers, dessen Gläubiger sie sind, als bekannt gemacht gilt, ihren Anspruch nach Grund und Höhe schriftlich anmelden, Sicherheit zu leisten, soweit sie nicht Befriedigung verlangen können. Dieses Recht steht den Gläubigern jedoch nur zu, wenn sie glaubhaft machen, dass durch die Verschmelzung die Erfüllung ihrer Forderung gefährdet wird. Das Recht, Sicherheitsleistung zu verlangen, steht Gläubigern nicht zu, die im Falle der Insolvenz ein Recht auf vorzugsweise Befriedigung aus einer Deckungsmasse haben, die nach gesetzlicher Vorschrift zu ihrem Schutz errichtet und staatlich überwacht ist."
    },
    {
      "date": "2025-07-28",
      "id": "117742",
      "original_text": "Registerbekanntmachung nach dem Umwandlungsgesetz\nHamburg Amtsgericht Hamburg HRB 182288\nChen Coaching FDL GmbH – Hamburg",
      "type": "Registerbekanntmachung nach dem Umwandlungsgesetz",
      "state": "Hamburg",
      "amtsgericht": "Amtsgericht Hamburg",
      "registernummer": "HRB 182288",
      "registerart": "HRB",
      "company_name": "Chen Coaching FDL GmbH",
      "company_seat": "Hamburg",
      "details": "28.07.2025 (Bekanntmachungsdatum)\n\nHamburg Amtsgericht Hamburg HRB 182288\nRegisterbekanntmachung nach dem Umwandlungsgesetz 28.07.2025 (Eintragungsdatum)\n\nChen Coaching FDL GmbH\nGesellschaft mit beschränkter Haftung\nHamburg\n\nAls nicht eingetragen wird bekannt gemacht:\nDen Gläubigern der an der Ausgliederung beteiligten Gesellschaften ist, wenn sie binnen sechs Monaten nach dem Tag, an dem die Eintragung der Ausgliederung in das Register des Sitzes desjenigen Rechtsträgers, dessen Gläubiger sie sind, nach § 19 Absatz 3 UmwG als bekannt gemacht gilt, ihren Anspruch nach Grund und Höhe schriftlich anmelden, Sicherheit zu leisten, soweit sie nicht Befriedigung verlangen können. Dieses Recht steht den Gläubigern jedoch nur zu, wenn sie glaubhaft machen, dass durch die Ausgliederung die Erfüllung ihrer Forderung gefährdet wird."
    },
    {
      "date": "2025-07-28",
      "id": "117743",
      "original_text": "Registerbekanntmachung nach dem Umwandlungsgesetz\nSchleswig-Holstein Amtsgericht Pinneberg HRB 1862 ME\nCapital Support Deutschland GmbH – Ostrohe",
      "type": "Registerbekanntmachung nach dem Umwandlungsgesetz",
      "state": "Schleswig-Holstein",
      "amtsgericht": "Amtsgericht Pinneberg",
      "registernummer": "HRB 1862 ME",
      "registerart": "HRB",
      "company_name": "Capital Support Deutschland GmbH",
      "company_seat": "Ostrohe",
      "details": "28.07.2025 (Bekanntmachungsdatum)\n\nSchleswig-Holstein Amtsgericht Pinneberg HRB 1862 ME\nRegisterbekanntmachung nach dem Umwandlungsgesetz 25.07.2025 (Eintragungsdatum)\n\nCapital Support Deutschland GmbH\nGesellschaft mit beschränkter Haftung\nOstrohe\n\nAls nicht eingetragen wird veröffentlicht: Den Gläubigern der an der Verschmelzung beteiligten Rechtsträger ist, wenn sie binnen sechs Monaten nach dem Tag, an dem die Eintragung der Verschmelzung in das Register des Sitzes desjenigen Rechtsträgers, dessen Gläubiger sie sind, als bekannt gemacht gilt, ihren Anspruch nach Grund und Höhe schriftlich anmelden, Sicherheit zu leisten, soweit sie nicht Befriedigung verlangen können. Dieses Recht steht den Gläubigern jedoch nur zu, wenn sie glaubhaft machen, dass durch die Verschmelzung die Erfüllung ihrer Forderung gefährdet wird. Das Recht, Sicherheitsleistung zu verlangen, steht Gläubigern nicht zu, die im Falle der Insolvenz ein Recht auf vorzugsweise Befriedigung aus einer Deckungsmasse haben, die nach gesetzlicher Vorschrift zu ihrem Schutz errichtet und staatlich überwacht ist."
    },
    {
      "date": "2025-07-28",
      "id": "117744",
      "original_text": "Löschungsankündigung\nMecklenburg-Vorpommern Amtsgericht Stralsund HRA 2400\nProra Projektentwicklungs GmbH & Co. Haus Hamburg KG – Buschvitz",
      "type": "Löschungsankündigung",
      "state": "Mecklenburg-Vorpommern",
      "amtsgericht": "Amtsgericht Stralsund",
      "registernummer": "HRA 2400",
      "registerart": "HRA",
      "company_name": "Prora Projektentwicklungs GmbH & Co. Haus Hamburg KG",
      "company_seat": "Buschvitz",
      "details": "28.07.2025 (Bekanntmachungsdatum)\n\nMecklenburg-Vorpommern Amtsgericht Stralsund HRA 2400\nLöschungsankündigung\n\nProra Projektentwicklungs GmbH & Co. Haus Hamburg KG\nKommanditgesellschaft\nBuschvitz\n\nDas Registergericht beabsichtigt, die Firma von Amts wegen nach § 31 Abs. 2 HGB zu löschen. Die Frist zur Erhebung eines Widerspruchs ist auf 1 Monat festgesetzt."
    },
    {
      "date": "2025-07-28",
      "id": "117745",
      "original_text": "Registerbekanntmachung nach dem Umwandlungsgesetz\nBaden-Württemberg Amtsgericht Mannheim HRB 730948\nPro Concept Projektbau Bayernstraße GmbH – Mannheim",
      "type": "Registerbekanntmachung nach dem Umwandlungsgesetz",
      "state": "Baden-Württemberg",
      "amtsgericht": "Amtsgericht Mannheim",
      "registernummer": "HRB 730948",
      "registerart": "HRB",
      "company_name": "Pro Concept Projektbau Bayernstraße GmbH",
      "company_seat": "Mannheim",
      "details": "28.07.2025 (Bekanntmachungsdatum)\n\nBaden-Württemberg Amtsgericht Mannheim HRB 730948\nRegisterbekanntmachung nach dem Umwandlungsgesetz 28.07.2025 (Eintragungsdatum)\n\nPro Concept Projektbau Bayernstraße GmbH\nGesellschaft mit beschränkter Haftung\nMannheim\n\nDen Gläubigern des an dem Formwechsel beteiligten Rechtsträgers ist, wenn sie binnen sechs Monaten nach dem Tag, an dem die Eintragung des Formwechsels in das Register des Sitzes desjenigen Rechtsträgers, dessen Gläubiger sie sind, nach § 19 Abs. 3 UmwG als bekanntgemacht gilt, ihren Anspruch nach Grund und Höhe schriftlich anmelden, Sicherheit zu leisten, soweit sie nicht Befriedigung verlangen können. Dieses Recht steht den Gläubigern jedoch nur zu, wenn sie glaubhaft machen, dass durch den Formwechsel die Erfüllung ihrer Forderung gefährdet wird."
    },
    {
      "date": "2025-07-28",
      "id": "117746",
      "original_text": "Registerbekanntmachung nach dem Umwandlungsgesetz\nBaden-Württemberg Amtsgericht Mannheim HRA 712714\nPro Concept Projektbau Bayernstraße GmbH & Co. KG – Mannheim",
      "type": "Registerbekanntmachung nach dem Umwandlungsgesetz",
      "state": "Baden-Württemberg",
      "amtsgericht": "Amtsgericht Mannheim",
      "registernummer": "HRA 712714",
      "registerart": "HRA",
      "company_name": "Pro Concept Projektbau Bayernstraße GmbH & Co. KG",
      "company_seat": "Mannheim",
      "details": "28.07.2025 (Bekanntmachungsdatum)\n\nBaden-Württemberg Amtsgericht Mannheim HRA 712714\nRegisterbekanntmachung nach dem Umwandlungsgesetz 28.07.2025 (Eintragungsdatum)\n\nPro Concept Projektbau Bayernstraße GmbH & Co. KG\nKommanditgesellschaft\nMannheim\n\nDen Gläubigern des an dem Formwechsel beteiligten Rechtsträgers ist, wenn sie binnen sechs Monaten nach dem Tag, an dem die Eintragung des Formwechsels in das Register des Sitzes desjenigen Rechtsträgers, dessen Gläubiger sie sind, nach § 19 Abs. 3 UmwG als bekanntgemacht gilt, ihren Anspruch nach Grund und Höhe schriftlich anmelden, Sicherheit zu leisten, soweit sie nicht Befriedigung verlangen können. Dieses Recht steht den Gläubigern jedoch nur zu, wenn sie glaubhaft machen, dass durch den Formwechsel die Erfüllung ihrer Forderung gefährdet wird."
    },
    {
      "date": "2025-07-28",
      "id": "117747",
      "original_text": "Löschungsankündigung\nSaarland Amtsgericht Saarbrücken GsR 357\nKO5 eGbR – Saarbrücken",
      "type": "Löschungsankündigung",
      "state": "Saarland",
      "amtsgericht": "Amtsgericht Saarbrücken",
      "registernummer": "GsR 357",
      "registerart": "GsR",
      "company_name": "KO5 eGbR",
      "company_seat": "Saarbrücken",
      "details": "28.07.2025 (Bekanntmachungsdatum)\n\nSaarland Amtsgericht Saarbrücken GsR 357\nLöschungsankündigung\n\nKO5 eGbR\nGesellschaft bürgerlichen Rechts\nSaarbrücken\n\nEs ist beabsichtigt, die erfolgte Ersteintragung vom 29.08.2024 von Amts wegen gemäß § 395 Abs. 1 FamFG zu löschen.Die Eintragung der Gesellschaft vom 29.08.2024 war versehentlich doppelt erfolgt, obwohl am 27.08.2024 bereits die Ersteintragung der Gesellschaft im Handelsregister des Amtsgerichts Saarbrücken unter der Registernummer GsR 346 erfolgt war.\nDie vorgenommene Ersteintragung soll daher gemäß § 395 Abs. 1 FamFG von Amts wegen als von Anfang an unzulässig gelöscht werden.\nGegen die Löschung von Amts wegen ist das Rechtsmittel des Widerspruchs statthaft. Der Widerspruch ist binnen einer Frist einem Monat beginnend mit dem Tag dieser Veröffentlichung durch Einreichen eines Widerspruchsschreibens -schriftlich oder zur Niederschrift der Geschäftsstelle beim Amtsgericht Saarbrücken, -zentrales Handelsregister-, Mainzerstr.178, 66121 Saarbrücken einzulegen.\nDer Widerspruch muss die Bezeichnung der angefochtenen Löschungsankündigung enthalten sowie die Erklärung, dass Widerspruch eingelegt wird. Er ist vom Widerspruchsführer oder seinem Bevollmächtigten zu unterzeichnen.\nDas Widerspruchsschreiben kann auch in der Form eines elektronischen Dokumentes eingereicht werden, das mit einer qualifizierten elektronischen Signatur nach dem Signaturgesetz versehen sein muss (§§ 14 Abs. 2 FamFG, 130a, 298 ZPO)."
    },
    {
      "date": "2025-07-28",
      "id": "117748",
      "original_text": "Registerbekanntmachung nach dem Umwandlungsgesetz\nBerlin Amtsgericht Berlin (Charlottenburg) HRB 232417\nlumato GmbH – Berlin",
      "type": "Registerbekanntmachung nach dem Umwandlungsgesetz",
      "state": "Berlin",
      "amtsgericht": "Amtsgericht Berlin (Charlottenburg)",
      "registernummer": "HRB 232417",
      "registerart": "HRB",
      "company_name": "lumato GmbH",
      "company_seat": "Berlin",
      "details": "28.07.2025 (Bekanntmachungsdatum)\n\nBerlin Amtsgericht Berlin (Charlottenburg) HRB 232417\nRegisterbekanntmachung nach dem Umwandlungsgesetz 25.07.2025 (Eintragungsdatum)\n\nlumato GmbH\nGesellschaft mit beschränkter Haftung\nBerlin\n\nZu Eintragungsnummer 4 vom 25.07.2025 wird als nicht eingetragen veröffentlicht: Den Gläubigern der an der Verschmelzung beteiligten Rechtsträger ist, wenn sie binnen sechs Monaten nach dem Tag, an dem die Eintragung der Verschmelzung in das Register des Sitzes desjenigen Rechtsträgers, dessen Gläubiger sie sind, als bekannt gemacht gilt, ihren Anspruch nach Grund und Höhe schriftlich anmelden, Sicherheit zu leisten, soweit sie nicht Befriedigung verlangen können. Dieses Recht steht den Gläubigern jedoch nur zu, wenn sie glaubhaft machen, dass durch die Verschmelzung die Erfüllung ihrer Forderung gefährdet wird. Das Recht, Sicherheitsleistung zu verlangen, steht Gläubigern nicht zu, die im Falle der Insolvenz ein Recht auf vorzugsweise Befriedigung aus einer Deckungsmasse haben, die nach gesetzlicher Vorschrift zu ihrem Schutz errichtet und staatlich überwacht ist."
    },
    {
      "date": "2025-07-28",
      "id": "117749",
      "original_text": "Registerbekanntmachung nach dem Umwandlungsgesetz\nBerlin Amtsgericht Berlin (Charlottenburg) HRB 218908\nSana Gesundheit GmbH – Berlin",
      "type": "Registerbekanntmachung nach dem Umwandlungsgesetz",
      "state": "Berlin",
      "amtsgericht": "Amtsgericht Berlin (Charlottenburg)",
      "registernummer": "HRB 218908",
      "registerart": "HRB",
      "company_name": "Sana Gesundheit GmbH",
      "company_seat": "Berlin",
      "details": "28.07.2025 (Bekanntmachungsdatum)\n\nBerlin Amtsgericht Berlin (Charlottenburg) HRB 218908\nRegisterbekanntmachung nach dem Umwandlungsgesetz 27.07.2025 (Eintragungsdatum)\n\nSana Gesundheit GmbH\nGesellschaft mit beschränkter Haftung\nBerlin\n\nZu Eintragungsnummer 7 vom 27.07.2025 wird als nicht eingetragen veröffentlicht:\n\nDen Gläubigern der an der Verschmelzung beteiligten Rechtsträger ist, wenn sie binnen sechs Monaten nach dem Tag, an dem die Eintragung der Verschmelzung in das Register des Sitzes desjenigen Rechtsträgers, dessen Gläubiger sie sind, als bekannt gemacht gilt, ihren Anspruch nach Grund und Höhe schriftlich anmelden, Sicherheit zu leisten, soweit sie nicht Befriedigung verlangen können. Dieses Recht steht den Gläubigern jedoch nur zu, wenn sie glaubhaft machen, dass durch die Verschmelzung die Erfüllung ihrer Forderung gefährdet wird. Das Recht, Sicherheitsleistung zu verlangen, steht Gläubigern nicht zu, die im Falle der Insolvenz ein Recht auf vorzugsweise Befriedigung aus einer Deckungsmasse haben, die nach gesetzlicher Vorschrift zu ihrem Schutz errichtet und staatlich überwacht ist."
    },
    {
      "date": "2025-07-28",
      "id": "117750",
      "original_text": "Registerbekanntmachung nach dem Umwandlungsgesetz\nBerlin Amtsgericht Berlin (Charlottenburg) HRB 192474\nG LOL GmbH – Berlin",
      "type": "Registerbekanntmachung nach dem Umwandlungsgesetz",
      "state": "Berlin",
      "amtsgericht": "Amtsgericht Berlin (Charlottenburg)",
      "registernummer": "HRB 192474",
      "registerart": "HRB",
      "company_name": "G LOL GmbH",
      "company_seat": "Berlin",
      "details": "28.07.2025 (Bekanntmachungsdatum)\n\nBerlin Amtsgericht Berlin (Charlottenburg) HRB 192474\nRegisterbekanntmachung nach dem Umwandlungsgesetz 25.07.2025 (Eintragungsdatum)\n\nG LOL GmbH\nGesellschaft mit beschränkter Haftung\nBerlin\n\nZu Eintragungsnummer 4 vom 25.07.2025 wird als nicht eingetragen veröffentlicht: Den Gläubigern der an der Verschmelzung beteiligten Rechtsträger ist, wenn sie binnen sechs Monaten nach dem Tag, an dem die Eintragung der Verschmelzung in das Register des Sitzes desjenigen Rechtsträgers, dessen Gläubiger sie sind, als bekannt gemacht gilt, ihren Anspruch nach Grund und Höhe schriftlich anmelden, Sicherheit zu leisten, soweit sie nicht Befriedigung verlangen können. Dieses Recht steht den Gläubigern jedoch nur zu, wenn sie glaubhaft machen, dass durch die Verschmelzung die Erfüllung ihrer Forderung gefährdet wird. Das Recht, Sicherheitsleistung zu verlangen, steht Gläubigern nicht zu, die im Falle der Insolvenz ein Recht auf vorzugsweise Befriedigung aus einer Deckungsmasse haben, die nach gesetzlicher Vorschrift zu ihrem Schutz errichtet und staatlich überwacht ist."
    },
    {
      "date": "2025-07-28",
      "id": "117751",
      "original_text": "Registerbekanntmachung nach dem Umwandlungsgesetz\nBerlin Amtsgericht Berlin (Charlottenburg) HRB 110758\nBAUDIS Aktiengesellschaft – Berlin",
      "type": "Registerbekanntmachung nach dem Umwandlungsgesetz",
      "state": "Berlin",
      "amtsgericht": "Amtsgericht Berlin (Charlottenburg)",
      "registernummer": "HRB 110758",
      "registerart": "HRB",
      "company_name": "BAUDIS Aktiengesellschaft",
      "company_seat": "Berlin",
      "details": "28.07.2025 (Bekanntmachungsdatum)\n\nBerlin Amtsgericht Berlin (Charlottenburg) HRB 110758\nRegisterbekanntmachung nach dem Umwandlungsgesetz 23.07.2025 (Eintragungsdatum)\n\nBAUDIS Aktiengesellschaft\nAktiengesellschaft\nBerlin\n\nZu Eintragungsnummer 8 vom 23.07.2025 wird als nicht eingetragen veröffentlicht: Den Gläubigern der an der Verschmelzung beteiligten Rechtsträger ist, wenn sie binnen sechs Monaten nach dem Tag, an dem die Eintragung der Verschmelzung in das Register des Sitzes desjenigen Rechtsträgers, dessen Gläubiger sie sind, als bekannt gemacht gilt, ihren Anspruch nach Grund und Höhe schriftlich anmelden, Sicherheit zu leisten, soweit sie nicht Befriedigung verlangen können. Dieses Recht steht den Gläubigern jedoch nur zu, wenn sie glaubhaft machen, dass durch die Verschmelzung die Erfüllung ihrer Forderung gefährdet wird. Das Recht, Sicherheitsleistung zu verlangen, steht Gläubigern nicht zu, die im Falle der Insolvenz ein Recht auf vorzugsweise Befriedigung aus einer Deckungsmasse haben, die nach gesetzlicher Vorschrift zu ihrem Schutz errichtet und staatlich überwacht ist."
    },
    {
      "date": "2025-07-28",
      "id": "117752",
      "original_text": "Registerbekanntmachung nach dem Umwandlungsgesetz\nBerlin Amtsgericht Berlin (Charlottenburg) HRB 211645\nBaudis Generalplanungs UG (haftungsbeschränkt) – Berlin",
      "type": "Registerbekanntmachung nach dem Umwandlungsgesetz",
      "state": "Berlin",
      "amtsgericht": "Amtsgericht Berlin (Charlottenburg)",
      "registernummer": "HRB 211645",
      "registerart": "HRB",
      "company_name": "Baudis Generalplanungs UG (haftungsbeschränkt)",
      "company_seat": "Berlin",
      "details": "28.07.2025 (Bekanntmachungsdatum)\n\nBerlin Amtsgericht Berlin (Charlottenburg) HRB 211645\nRegisterbekanntmachung nach dem Umwandlungsgesetz 23.07.2025 (Eintragungsdatum)\n\nBaudis Generalplanungs UG (haftungsbeschränkt)\nGesellschaft mit beschränkter Haftung\nBerlin\n\nZu Eintragungsnummer 4 vom 23.07.2025 wird als nicht eingetragen veröffentlicht: Den Gläubigern der an der Verschmelzung beteiligten Rechtsträger ist, wenn sie binnen sechs Monaten nach dem Tag, an dem die Eintragung der Verschmelzung in das Register des Sitzes desjenigen Rechtsträgers, dessen Gläubiger sie sind, als bekannt gemacht gilt, ihren Anspruch nach Grund und Höhe schriftlich anmelden, Sicherheit zu leisten, soweit sie nicht Befriedigung verlangen können. Dieses Recht steht den Gläubigern jedoch nur zu, wenn sie glaubhaft machen, dass durch die Verschmelzung die Erfüllung ihrer Forderung gefährdet wird. Das Recht, Sicherheitsleistung zu verlangen, steht Gläubigern nicht zu, die im Falle der Insolvenz ein Recht auf vorzugsweise Befriedigung aus einer Deckungsmasse haben, die nach gesetzlicher Vorschrift zu ihrem Schutz errichtet und staatlich überwacht ist."
    },
    {
      "date": "2025-07-28",
      "id": "117753",
      "original_text": "Registerbekanntmachung nach dem Umwandlungsgesetz\nBerlin Amtsgericht Berlin (Charlottenburg) HRB 149145\nBAUDIS Planungs- und Bauleitungs GmbH – Berlin",
      "type": "Registerbekanntmachung nach dem Umwandlungsgesetz",
      "state": "Berlin",
      "amtsgericht": "Amtsgericht Berlin (Charlottenburg)",
      "registernummer": "HRB 149145",
      "registerart": "HRB",
      "company_name": "BAUDIS Planungs- und Bauleitungs GmbH",
      "company_seat": "Berlin",
      "details": "28.07.2025 (Bekanntmachungsdatum)\n\nBerlin Amtsgericht Berlin (Charlottenburg) HRB 149145\nRegisterbekanntmachung nach dem Umwandlungsgesetz 23.07.2025 (Eintragungsdatum)\n\nBAUDIS Planungs- und Bauleitungs GmbH\nGesellschaft mit beschränkter Haftung\nBerlin\n\nZu Eintragungsnummer 8 vom 23.07.2025 wird als nicht eingetragen veröffentlicht: Den Gläubigern der an der Verschmelzung beteiligten Rechtsträger ist, wenn sie binnen sechs Monaten nach dem Tag, an dem die Eintragung der Verschmelzung in das Register des Sitzes desjenigen Rechtsträgers, dessen Gläubiger sie sind, als bekannt gemacht gilt, ihren Anspruch nach Grund und Höhe schriftlich anmelden, Sicherheit zu leisten, soweit sie nicht Befriedigung verlangen können. Dieses Recht steht den Gläubigern jedoch nur zu, wenn sie glaubhaft machen, dass durch die Verschmelzung die Erfüllung ihrer Forderung gefährdet wird. Das Recht, Sicherheitsleistung zu verlangen, steht Gläubigern nicht zu, die im Falle der Insolvenz ein Recht auf vorzugsweise Befriedigung aus einer Deckungsmasse haben, die nach gesetzlicher Vorschrift zu ihrem Schutz errichtet und staatlich überwacht ist."
    },
    {
      "date": "2025-07-28",
      "id": "117754",
      "original_text": "Registerbekanntmachung nach dem Umwandlungsgesetz\nBerlin Amtsgericht Berlin (Charlottenburg) HRB 238192\nBaudis TGA UG (haftungsbeschränkt) – Berlin",
      "type": "Registerbekanntmachung nach dem Umwandlungsgesetz",
      "state": "Berlin",
      "amtsgericht": "Amtsgericht Berlin (Charlottenburg)",
      "registernummer": "HRB 238192",
      "registerart": "HRB",
      "company_name": "Baudis TGA UG (haftungsbeschränkt)",
      "company_seat": "Berlin",
      "details": "28.07.2025 (Bekanntmachungsdatum)\n\nBerlin Amtsgericht Berlin (Charlottenburg) HRB 238192\nRegisterbekanntmachung nach dem Umwandlungsgesetz 23.07.2025 (Eintragungsdatum)\n\nBaudis TGA UG (haftungsbeschränkt)\nGesellschaft mit beschränkter Haftung\nBerlin\n\nZu Eintragungsnummer 3 vom 23.07.2025 wird als nicht eingetragen veröffentlicht: Den Gläubigern der an der Verschmelzung beteiligten Rechtsträger ist, wenn sie binnen sechs Monaten nach dem Tag, an dem die Eintragung der Verschmelzung in das Register des Sitzes desjenigen Rechtsträgers, dessen Gläubiger sie sind, als bekannt gemacht gilt, ihren Anspruch nach Grund und Höhe schriftlich anmelden, Sicherheit zu leisten, soweit sie nicht Befriedigung verlangen können. Dieses Recht steht den Gläubigern jedoch nur zu, wenn sie glaubhaft machen, dass durch die Verschmelzung die Erfüllung ihrer Forderung gefährdet wird. Das Recht, Sicherheitsleistung zu verlangen, steht Gläubigern nicht zu, die im Falle der Insolvenz ein Recht auf vorzugsweise Befriedigung aus einer Deckungsmasse haben, die nach gesetzlicher Vorschrift zu ihrem Schutz errichtet und staatlich überwacht ist."
    },
    {
      "date": "2025-07-28",
      "id": "117755",
      "original_text": "Registerbekanntmachung nach dem Umwandlungsgesetz\nBerlin Amtsgericht Berlin (Charlottenburg) HRB 111710\nSidecrew GmbH – Berlin",
      "type": "Registerbekanntmachung nach dem Umwandlungsgesetz",
      "state": "Berlin",
      "amtsgericht": "Amtsgericht Berlin (Charlottenburg)",
      "registernummer": "HRB 111710",
      "registerart": "HRB",
      "company_name": "Sidecrew GmbH",
      "company_seat": "Berlin",
      "details": "28.07.2025 (Bekanntmachungsdatum)\n\nBerlin Amtsgericht Berlin (Charlottenburg) HRB 111710\nRegisterbekanntmachung nach dem Umwandlungsgesetz 25.07.2025 (Eintragungsdatum)\n\nSidecrew GmbH\nGesellschaft mit beschränkter Haftung\nBerlin\n\nZu Eintragungsnummer 12 vom 25.07.2025 wird als nicht eingetragen veröffentlicht: Den Gläubigern der an der Verschmelzung beteiligten Rechtsträger ist, wenn sie binnen sechs Monaten nach dem Tag, an dem die Eintragung der Verschmelzung in das Register des Sitzes desjenigen Rechtsträgers, dessen Gläubiger sie sind, als bekannt gemacht gilt, ihren Anspruch nach Grund und Höhe schriftlich anmelden, Sicherheit zu leisten, soweit sie nicht Befriedigung verlangen können. Dieses Recht steht den Gläubigern jedoch nur zu, wenn sie glaubhaft machen, dass durch die Verschmelzung die Erfüllung ihrer Forderung gefährdet wird. Das Recht, Sicherheitsleistung zu verlangen, steht Gläubigern nicht zu, die im Falle der Insolvenz ein Recht auf vorzugsweise Befriedigung aus einer Deckungsmasse haben, die nach gesetzlicher Vorschrift zu ihrem Schutz errichtet und staatlich überwacht ist."
    },
    {
      "date": "2025-07-28",
      "id": "117756",
      "original_text": "Registerbekanntmachung nach dem Umwandlungsgesetz\nBerlin Amtsgericht Berlin (Charlottenburg) HRB 184402\nG Esports Holding GmbH – Berlin",
      "type": "Registerbekanntmachung nach dem Umwandlungsgesetz",
      "state": "Berlin",
      "amtsgericht": "Amtsgericht Berlin (Charlottenburg)",
      "registernummer": "HRB 184402",
      "registerart": "HRB",
      "company_name": "G Esports Holding GmbH",
      "company_seat": "Berlin",
      "details": "28.07.2025 (Bekanntmachungsdatum)\n\nBerlin Amtsgericht Berlin (Charlottenburg) HRB 184402\nRegisterbekanntmachung nach dem Umwandlungsgesetz 25.07.2025 (Eintragungsdatum)\n\nG Esports Holding GmbH\nGesellschaft mit beschränkter Haftung\nBerlin\n\nZu Eintragungsnummer 13 vom 25.07.2025 wird als nicht eingetragen veröffentlicht: Den Gläubigern der an der Verschmelzung beteiligten Rechtsträger ist, wenn sie binnen sechs Monaten nach dem Tag, an dem die Eintragung der Verschmelzung in das Register des Sitzes desjenigen Rechtsträgers, dessen Gläubiger sie sind, als bekannt gemacht gilt, ihren Anspruch nach Grund und Höhe schriftlich anmelden, Sicherheit zu leisten, soweit sie nicht Befriedigung verlangen können. Dieses Recht steht den Gläubigern jedoch nur zu, wenn sie glaubhaft machen, dass durch die Verschmelzung die Erfüllung ihrer Forderung gefährdet wird. Das Recht, Sicherheitsleistung zu verlangen, steht Gläubigern nicht zu, die im Falle der Insolvenz ein Recht auf vorzugsweise Befriedigung aus einer Deckungsmasse haben, die nach gesetzlicher Vorschrift zu ihrem Schutz errichtet und staatlich überwacht ist."
    },
    {
      "date": "2025-07-28",
      "id": "117757",
      "original_text": "Registerbekanntmachung nach dem Umwandlungsgesetz\nBaden-Württemberg Amtsgericht Freiburg VR 480235\nAktions-Team Gengenbach e.V. – Gengenbach",
      "type": "Registerbekanntmachung nach dem Umwandlungsgesetz",
      "state": "Baden-Württemberg",
      "amtsgericht": "Amtsgericht Freiburg",
      "registernummer": "VR 480235",
      "registerart": "VR",
      "company_name": "Aktions-Team Gengenbach e.V.",
      "company_seat": "Gengenbach",
      "details": "28.07.2025 (Bekanntmachungsdatum)\n\nBaden-Württemberg Amtsgericht Freiburg VR 480235\nRegisterbekanntmachung nach dem Umwandlungsgesetz 28.07.2025 (Eintragungsdatum)\n\nAktions-Team Gengenbach e.V.\neingetragener Verein\nGengenbach\n\nAls nicht eingetragen wird bekanntgemacht:\nDen Gläubigern der an der Verschmelzung beteiligten Rechtsträger ist, wenn sie binnen sechs Monaten nach dem Tag, an dem die Eintragung der Verschmelzung in das Register des Sitzes desjenigen Rechtsträgers, dessen Gläubiger sie sind, nach § 19 Abs. 3 UmwG als bekanntgemacht gilt, ihren Anspruch nach Grund und Höhe schriftlich anmelden, Sicherheit zu leisten, soweit sie nicht Befriedigung verlangen können. Dieses Recht steht den Gläubigern jedoch nur zu, wenn sie glaubhaft machen, dass durch die Verschmelzung die Erfüllung ihrer Forderung gefährdet wird."
    },
    {
      "date": "2025-07-28",
      "id": "117758",
      "original_text": "Registerbekanntmachung nach dem Umwandlungsgesetz\nBaden-Württemberg Amtsgericht Freiburg VR 480031\nGewerbe- und Handwerkerverein Gengenbach e.V. – Gengenbach",
      "type": "Registerbekanntmachung nach dem Umwandlungsgesetz",
      "state": "Baden-Württemberg",
      "amtsgericht": "Amtsgericht Freiburg",
      "registernummer": "VR 480031",
      "registerart": "VR",
      "company_name": "Gewerbe- und Handwerkerverein Gengenbach e.V.",
      "company_seat": "Gengenbach",
      "details": "28.07.2025 (Bekanntmachungsdatum)\n\nBaden-Württemberg Amtsgericht Freiburg VR 480031\nRegisterbekanntmachung nach dem Umwandlungsgesetz 28.07.2025 (Eintragungsdatum)\n\nGewerbe- und Handwerkerverein Gengenbach e.V.\neingetragener Verein\nGengenbach\n\nAls nicht eingetragen wird bekanntgemacht:\nDen Gläubigern der an der Verschmelzung beteiligten Rechtsträger ist, wenn sie binnen sechs Monaten nach dem Tag, an dem die Eintragung der Verschmelzung in das Register des Sitzes desjenigen Rechtsträgers, dessen Gläubiger sie sind, nach § 19 Abs. 3 UmwG als bekanntgemacht gilt, ihren Anspruch nach Grund und Höhe schriftlich anmelden, Sicherheit zu leisten, soweit sie nicht Befriedigung verlangen können. Dieses Recht steht den Gläubigern jedoch nur zu, wenn sie glaubhaft machen, dass durch die Verschmelzung die Erfüllung ihrer Forderung gefährdet wird."
    },
    {
      "date": "2025-07-28",
      "id": "117759",
      "original_text": "Registerbekanntmachung nach dem Umwandlungsgesetz\nSachsen-Anhalt Amtsgericht Stendal HRB 35675\nElektroprüfungen.info GmbH – Laucha an der Unstrut",
      "type": "Registerbekanntmachung nach dem Umwandlungsgesetz",
      "state": "Sachsen-Anhalt",
      "amtsgericht": "Amtsgericht Stendal",
      "registernummer": "HRB 35675",
      "registerart": "HRB",
      "company_name": "Elektroprüfungen.info GmbH",
      "company_seat": "Laucha an der Unstrut",
      "details": "28.07.2025 (Bekanntmachungsdatum)\n\nSachsen-Anhalt Amtsgericht Stendal HRB 35675\nRegisterbekanntmachung nach dem Umwandlungsgesetz 28.07.2025 (Eintragungsdatum)\n\nElektroprüfungen.info GmbH\nGesellschaft mit beschränkter Haftung\nLaucha an der Unstrut\n\nNicht eingetragen:\nDen Gläubigern der an der Verschmelzung beteiligten Rechtsträger ist, wenn sie binnen sechs Monaten nach dem Tag, an dem die Eintragung der Verschmelzung nach § 19 Abs. 3 UmwG als bekanntgemacht gilt, ihren Anspruch nach Grund und Höhe schriftlich anmelden, Sicherheit zu leisten, soweit sie nicht Befriedigung verlangen können. Dieses Recht steht ihnen jedoch nur zu, wenn sie glaubhaft machen, dass durch die Verschmelzung die Erfüllung ihrer Forderung gefährdet wird."
    },
    {
      "date": "2025-07-28",
      "id": "117760",
      "original_text": "Registerbekanntmachung nach dem Umwandlungsgesetz\nSachsen-Anhalt Amtsgericht Stendal HRB 35704\nESC Group GmbH – Laucha an der Unstrut",
      "type": "Registerbekanntmachung nach dem Umwandlungsgesetz",
      "state": "Sachsen-Anhalt",
      "amtsgericht": "Amtsgericht Stendal",
      "registernummer": "HRB 35704",
      "registerart": "HRB",
      "company_name": "ESC Group GmbH",
      "company_seat": "Laucha an der Unstrut",
      "details": "28.07.2025 (Bekanntmachungsdatum)\n\nSachsen-Anhalt Amtsgericht Stendal HRB 35704\nRegisterbekanntmachung nach dem Umwandlungsgesetz 28.07.2025 (Eintragungsdatum)\n\nESC Group GmbH\nGesellschaft mit beschränkter Haftung\nLaucha an der Unstrut\n\nNicht eingetragen:\nDen Gläubigern der an der Verschmelzung beteiligten Rechtsträger ist, wenn sie binnen sechs Monaten nach dem Tag, an dem die Eintragung der Verschmelzung nach § 19 Abs. 3 UmwG als bekanntgemacht gilt, ihren Anspruch nach Grund und Höhe schriftlich anmelden, Sicherheit zu leisten, soweit sie nicht Befriedigung verlangen können. Dieses Recht steht ihnen jedoch nur zu, wenn sie glaubhaft machen, dass durch die Verschmelzung die Erfüllung ihrer Forderung gefährdet wird."
    },
    {
      "date": "2025-07-28",
      "id": "117761",
      "original_text": "Einreichung neuer Dokumente\nBaden-Württemberg Amtsgericht Stuttgart HRB 746374\nBosch Engineering GmbH – Abstatt",
      "type": "Einreichung neuer Dokumente",
      "state": "Baden-Württemberg",
      "amtsgericht": "Amtsgericht Stuttgart",
      "registernummer": "HRB 746374",
      "registerart": "HRB",
      "company_name": "Bosch Engineering GmbH",
      "company_seat": "Abstatt",
      "details": "28.07.2025 (Bekanntmachungsdatum)\n\nBaden-Württemberg Amtsgericht Stuttgart HRB 746374\nEinreichung neuer Dokumente 28.07.2025 (Eintragungsdatum)\n\nBosch Engineering GmbH\nGesellschaft mit beschränkter Haftung\nAbstatt\n\nDie Gesellschaft hat am 23.07.2025 die Liste über die Zusammensetzung des Aufsichtsrats zum Handelsregister eingereicht."
    },
    {
      "date": "2025-07-28",
      "id": "117762",
      "original_text": "Registerbekanntmachung nach dem Umwandlungsgesetz\nBerlin Amtsgericht Berlin (Charlottenburg) HRB 233784\nMünchener Baugesellschaft mbH – Berlin",
      "type": "Registerbekanntmachung nach dem Umwandlungsgesetz",
      "state": "Berlin",
      "amtsgericht": "Amtsgericht Berlin (Charlottenburg)",
      "registernummer": "HRB 233784",
      "registerart": "HRB",
      "company_name": "Münchener Baugesellschaft mbH",
      "company_seat": "Berlin",
      "details": "28.07.2025 (Bekanntmachungsdatum)\n\nBerlin Amtsgericht Berlin (Charlottenburg) HRB 233784\nRegisterbekanntmachung nach dem Umwandlungsgesetz 25.07.2025 (Eintragungsdatum)\n\nMünchener Baugesellschaft mbH\nGesellschaft mit beschränkter Haftung\nBerlin\n\nZu Eintragungsnummer 19 vom 25.07.2025 wird als nicht eingetragen veröffentlicht: Den Gläubigern der an der Verschmelzung beteiligten Rechtsträger ist, wenn sie binnen sechs Monaten nach dem Tag, an dem die Eintragung der Verschmelzung in das Register des Sitzes desjenigen Rechtsträgers, dessen Gläubiger sie sind, als bekannt gemacht gilt, ihren Anspruch nach Grund und Höhe schriftlich anmelden, Sicherheit zu leisten, soweit sie nicht Befriedigung verlangen können. Dieses Recht steht den Gläubigern jedoch nur zu, wenn sie glaubhaft machen, dass durch die Verschmelzung die Erfüllung ihrer Forderung gefährdet wird. Das Recht, Sicherheitsleistung zu verlangen, steht Gläubigern nicht zu, die im Falle der Insolvenz ein Recht auf vorzugsweise Befriedigung aus einer Deckungsmasse haben, die nach gesetzlicher Vorschrift zu ihrem Schutz errichtet und staatlich überwacht ist."
    },
    {
      "date": "2025-07-28",
      "id": "117763",
      "original_text": "Registerbekanntmachung nach dem Umwandlungsgesetz\nBerlin Amtsgericht Berlin (Charlottenburg) HRB 233784\nMünchener Baugesellschaft mbH – Berlin",
      "type": "Registerbekanntmachung nach dem Umwandlungsgesetz",
      "state": "Berlin",
      "amtsgericht": "Amtsgericht Berlin (Charlottenburg)",
      "registernummer": "HRB 233784",
      "registerart": "HRB",
      "company_name": "Münchener Baugesellschaft mbH",
      "company_seat": "Berlin",
      "details": "28.07.2025 (Bekanntmachungsdatum)\n\nBerlin Amtsgericht Berlin (Charlottenburg) HRB 233784\nRegisterbekanntmachung nach dem Umwandlungsgesetz 25.07.2025 (Eintragungsdatum)\n\nMünchener Baugesellschaft mbH\nGesellschaft mit beschränkter Haftung\nBerlin\n\nZu Eintragungsnummer 20 vom 25.07.2025 wird als nicht eingetragen veröffentlicht: Den Gläubigern der an der Verschmelzung beteiligten Rechtsträger ist, wenn sie binnen sechs Monaten nach dem Tag, an dem die Eintragung der Verschmelzung in das Register des Sitzes desjenigen Rechtsträgers, dessen Gläubiger sie sind, als bekannt gemacht gilt, ihren Anspruch nach Grund und Höhe schriftlich anmelden, Sicherheit zu leisten, soweit sie nicht Befriedigung verlangen können. Dieses Recht steht den Gläubigern jedoch nur zu, wenn sie glaubhaft machen, dass durch die Verschmelzung die Erfüllung ihrer Forderung gefährdet wird. Das Recht, Sicherheitsleistung zu verlangen, steht Gläubigern nicht zu, die im Falle der Insolvenz ein Recht auf vorzugsweise Befriedigung aus einer Deckungsmasse haben, die nach gesetzlicher Vorschrift zu ihrem Schutz errichtet und staatlich überwacht ist."
    },
    {
      "date": "2025-07-28",
      "id": "117764",
      "original_text": "Registerbekanntmachung nach dem Umwandlungsgesetz\nBerlin Amtsgericht Berlin (Charlottenburg) HRB 233784\nMünchener Baugesellschaft mbH – Berlin",
      "type": "Registerbekanntmachung nach dem Umwandlungsgesetz",
      "state": "Berlin",
      "amtsgericht": "Amtsgericht Berlin (Charlottenburg)",
      "registernummer": "HRB 233784",
      "registerart": "HRB",
      "company_name": "Münchener Baugesellschaft mbH",
      "company_seat": "Berlin",
      "details": "28.07.2025 (Bekanntmachungsdatum)\n\nBerlin Amtsgericht Berlin (Charlottenburg) HRB 233784\nRegisterbekanntmachung nach dem Umwandlungsgesetz 25.07.2025 (Eintragungsdatum)\n\nMünchener Baugesellschaft mbH\nGesellschaft mit beschränkter Haftung\nBerlin\n\nZu Eintragungsnummer 19 vom 25.07.2025 wird als nicht eingetragen veröffentlicht: Den Gläubigern der an der Verschmelzung beteiligten Rechtsträger ist, wenn sie binnen sechs Monaten nach dem Tag, an dem die Eintragung der Verschmelzung in das Register des Sitzes desjenigen Rechtsträgers, dessen Gläubiger sie sind, als bekannt gemacht gilt, ihren Anspruch nach Grund und Höhe schriftlich anmelden, Sicherheit zu leisten, soweit sie nicht Befriedigung verlangen können. Dieses Recht steht den Gläubigern jedoch nur zu, wenn sie glaubhaft machen, dass durch die Verschmelzung die Erfüllung ihrer Forderung gefährdet wird. Das Recht, Sicherheitsleistung zu verlangen, steht Gläubigern nicht zu, die im Falle der Insolvenz ein Recht auf vorzugsweise Befriedigung aus einer Deckungsmasse haben, die nach gesetzlicher Vorschrift zu ihrem Schutz errichtet und staatlich überwacht ist."
    },
    {
      "date": "2025-07-28",
      "id": "117765",
      "original_text": "Registerbekanntmachung nach dem Umwandlungsgesetz\nBerlin Amtsgericht Berlin (Charlottenburg) HRB 233784\nMünchener Baugesellschaft mbH – Berlin",
      "type": "Registerbekanntmachung nach dem Umwandlungsgesetz",
      "state": "Berlin",
      "amtsgericht": "Amtsgericht Berlin (Charlottenburg)",
      "registernummer": "HRB 233784",
      "registerart": "HRB",
      "company_name": "Münchener Baugesellschaft mbH",
      "company_seat": "Berlin",
      "details": "28.07.2025 (Bekanntmachungsdatum)\n\nBerlin Amtsgericht Berlin (Charlottenburg) HRB 233784\nRegisterbekanntmachung nach dem Umwandlungsgesetz 25.07.2025 (Eintragungsdatum)\n\nMünchener Baugesellschaft mbH\nGesellschaft mit beschränkter Haftung\nBerlin\n\nZu Eintragungsnummer 20 vom 25.07.2025 wird als nicht eingetragen veröffentlicht: Den Gläubigern der an der Verschmelzung beteiligten Rechtsträger ist, wenn sie binnen sechs Monaten nach dem Tag, an dem die Eintragung der Verschmelzung in das Register des Sitzes desjenigen Rechtsträgers, dessen Gläubiger sie sind, als bekannt gemacht gilt, ihren Anspruch nach Grund und Höhe schriftlich anmelden, Sicherheit zu leisten, soweit sie nicht Befriedigung verlangen können. Dieses Recht steht den Gläubigern jedoch nur zu, wenn sie glaubhaft machen, dass durch die Verschmelzung die Erfüllung ihrer Forderung gefährdet wird. Das Recht, Sicherheitsleistung zu verlangen, steht Gläubigern nicht zu, die im Falle der Insolvenz ein Recht auf vorzugsweise Befriedigung aus einer Deckungsmasse haben, die nach gesetzlicher Vorschrift zu ihrem Schutz errichtet und staatlich überwacht ist."
    },
    {
      "date": "2025-07-28",
      "id": "117766",
      "original_text": "Registerbekanntmachung nach dem Umwandlungsgesetz\nBerlin Amtsgericht Berlin (Charlottenburg) HRB 233784\nMünchener Baugesellschaft mbH – Berlin",
      "type": "Registerbekanntmachung nach dem Umwandlungsgesetz",
      "state": "Berlin",
      "amtsgericht": "Amtsgericht Berlin (Charlottenburg)",
      "registernummer": "HRB 233784",
      "registerart": "HRB",
      "company_name": "Münchener Baugesellschaft mbH",
      "company_seat": "Berlin",
      "details": "28.07.2025 (Bekanntmachungsdatum)\n\nBerlin Amtsgericht Berlin (Charlottenburg) HRB 233784\nRegisterbekanntmachung nach dem Umwandlungsgesetz 25.07.2025 (Eintragungsdatum)\n\nMünchener Baugesellschaft mbH\nGesellschaft mit beschränkter Haftung\nBerlin\n\nZu Eintragungsnummer 21 vom 25.07.2025 wird als nicht eingetragen veröffentlicht: Den Gläubigern der an der Verschmelzung beteiligten Rechtsträger ist, wenn sie binnen sechs Monaten nach dem Tag, an dem die Eintragung der Verschmelzung in das Register des Sitzes desjenigen Rechtsträgers, dessen Gläubiger sie sind, als bekannt gemacht gilt, ihren Anspruch nach Grund und Höhe schriftlich anmelden, Sicherheit zu leisten, soweit sie nicht Befriedigung verlangen können. Dieses Recht steht den Gläubigern jedoch nur zu, wenn sie glaubhaft machen, dass durch die Verschmelzung die Erfüllung ihrer Forderung gefährdet wird. Das Recht, Sicherheitsleistung zu verlangen, steht Gläubigern nicht zu, die im Falle der Insolvenz ein Recht auf vorzugsweise Befriedigung aus einer Deckungsmasse haben, die nach gesetzlicher Vorschrift zu ihrem Schutz errichtet und staatlich überwacht ist."
    },
    {
      "date": "2025-07-28",
      "id": "117767",
      "original_text": "Registerbekanntmachung nach dem Umwandlungsgesetz\nBerlin Amtsgericht Berlin (Charlottenburg) HRB 233784\nMünchener Baugesellschaft mbH – Berlin",
      "type": "Registerbekanntmachung nach dem Umwandlungsgesetz",
      "state": "Berlin",
      "amtsgericht": "Amtsgericht Berlin (Charlottenburg)",
      "registernummer": "HRB 233784",
      "registerart": "HRB",
      "company_name": "Münchener Baugesellschaft mbH",
      "company_seat": "Berlin",
      "details": "28.07.2025 (Bekanntmachungsdatum)\n\nBerlin Amtsgericht Berlin (Charlottenburg) HRB 233784\nRegisterbekanntmachung nach dem Umwandlungsgesetz 25.07.2025 (Eintragungsdatum)\n\nMünchener Baugesellschaft mbH\nGesellschaft mit beschränkter Haftung\nBerlin\n\nZu Eintragungsnummer 22 vom 25.07.2025 wird als nicht eingetragen veröffentlicht: Den Gläubigern der an der Verschmelzung beteiligten Rechtsträger ist, wenn sie binnen sechs Monaten nach dem Tag, an dem die Eintragung der Verschmelzung in das Register des Sitzes desjenigen Rechtsträgers, dessen Gläubiger sie sind, als bekannt gemacht gilt, ihren Anspruch nach Grund und Höhe schriftlich anmelden, Sicherheit zu leisten, soweit sie nicht Befriedigung verlangen können. Dieses Recht steht den Gläubigern jedoch nur zu, wenn sie glaubhaft machen, dass durch die Verschmelzung die Erfüllung ihrer Forderung gefährdet wird. Das Recht, Sicherheitsleistung zu verlangen, steht Gläubigern nicht zu, die im Falle der Insolvenz ein Recht auf vorzugsweise Befriedigung aus einer Deckungsmasse haben, die nach gesetzlicher Vorschrift zu ihrem Schutz errichtet und staatlich überwacht ist."
    },
    {
      "date": "2025-07-28",
      "id": "117768",
      "original_text": "Registerbekanntmachung nach dem Umwandlungsgesetz\nBerlin Amtsgericht Berlin (Charlottenburg) HRB 233784\nMünchener Baugesellschaft mbH – Berlin",
      "type": "Registerbekanntmachung nach dem Umwandlungsgesetz",
      "state": "Berlin",
      "amtsgericht": "Amtsgericht Berlin (Charlottenburg)",
      "registernummer": "HRB 233784",
      "registerart": "HRB",
      "company_name": "Münchener Baugesellschaft mbH",
      "company_seat": "Berlin",
      "details": "28.07.2025 (Bekanntmachungsdatum)\n\nBerlin Amtsgericht Berlin (Charlottenburg) HRB 233784\nRegisterbekanntmachung nach dem Umwandlungsgesetz 25.07.2025 (Eintragungsdatum)\n\nMünchener Baugesellschaft mbH\nGesellschaft mit beschränkter Haftung\nBerlin\n\nZu Eintragungsnummer 23 vom 25.07.2025 wird als nicht eingetragen veröffentlicht: Den Gläubigern der an der Verschmelzung beteiligten Rechtsträger ist, wenn sie binnen sechs Monaten nach dem Tag, an dem die Eintragung der Verschmelzung in das Register des Sitzes desjenigen Rechtsträgers, dessen Gläubiger sie sind, als bekannt gemacht gilt, ihren Anspruch nach Grund und Höhe schriftlich anmelden, Sicherheit zu leisten, soweit sie nicht Befriedigung verlangen können. Dieses Recht steht den Gläubigern jedoch nur zu, wenn sie glaubhaft machen, dass durch die Verschmelzung die Erfüllung ihrer Forderung gefährdet wird. Das Recht, Sicherheitsleistung zu verlangen, steht Gläubigern nicht zu, die im Falle der Insolvenz ein Recht auf vorzugsweise Befriedigung aus einer Deckungsmasse haben, die nach gesetzlicher Vorschrift zu ihrem Schutz errichtet und staatlich überwacht ist."
    },
    {
      "date": "2025-07-28",
      "id": "117769",
      "original_text": "Registerbekanntmachung nach dem Umwandlungsgesetz\nBerlin Amtsgericht Berlin (Charlottenburg) HRB 233784\nMünchener Baugesellschaft mbH – Berlin",
      "type": "Registerbekanntmachung nach dem Umwandlungsgesetz",
      "state": "Berlin",
      "amtsgericht": "Amtsgericht Berlin (Charlottenburg)",
      "registernummer": "HRB 233784",
      "registerart": "HRB",
      "company_name": "Münchener Baugesellschaft mbH",
      "company_seat": "Berlin",
      "details": "28.07.2025 (Bekanntmachungsdatum)\n\nBerlin Amtsgericht Berlin (Charlottenburg) HRB 233784\nRegisterbekanntmachung nach dem Umwandlungsgesetz 25.07.2025 (Eintragungsdatum)\n\nMünchener Baugesellschaft mbH\nGesellschaft mit beschränkter Haftung\nBerlin\n\nZu Eintragungsnummer 24 vom 25.07.2025 wird als nicht eingetragen veröffentlicht: Den Gläubigern der an der Verschmelzung beteiligten Rechtsträger ist, wenn sie binnen sechs Monaten nach dem Tag, an dem die Eintragung der Verschmelzung in das Register des Sitzes desjenigen Rechtsträgers, dessen Gläubiger sie sind, als bekannt gemacht gilt, ihren Anspruch nach Grund und Höhe schriftlich anmelden, Sicherheit zu leisten, soweit sie nicht Befriedigung verlangen können. Dieses Recht steht den Gläubigern jedoch nur zu, wenn sie glaubhaft machen, dass durch die Verschmelzung die Erfüllung ihrer Forderung gefährdet wird. Das Recht, Sicherheitsleistung zu verlangen, steht Gläubigern nicht zu, die im Falle der Insolvenz ein Recht auf vorzugsweise Befriedigung aus einer Deckungsmasse haben, die nach gesetzlicher Vorschrift zu ihrem Schutz errichtet und staatlich überwacht ist."
    },
    {
      "date": "2025-07-28",
      "id": "117770",
      "original_text": "Registerbekanntmachung nach dem Umwandlungsgesetz\nBerlin Amtsgericht Berlin (Charlottenburg) HRB 233784\nMünchener Baugesellschaft mbH – Berlin",
      "type": "Registerbekanntmachung nach dem Umwandlungsgesetz",
      "state": "Berlin",
      "amtsgericht": "Amtsgericht Berlin (Charlottenburg)",
      "registernummer": "HRB 233784",
      "registerart": "HRB",
      "company_name": "Münchener Baugesellschaft mbH",
      "company_seat": "Berlin",
      "details": "28.07.2025 (Bekanntmachungsdatum)\n\nBerlin Amtsgericht Berlin (Charlottenburg) HRB 233784\nRegisterbekanntmachung nach dem Umwandlungsgesetz 25.07.2025 (Eintragungsdatum)\n\nMünchener Baugesellschaft mbH\nGesellschaft mit beschränkter Haftung\nBerlin\n\nZu Eintragungsnummer 25 vom 25.07.2025 wird als nicht eingetragen veröffentlicht: Den Gläubigern der an der Verschmelzung beteiligten Rechtsträger ist, wenn sie binnen sechs Monaten nach dem Tag, an dem die Eintragung der Verschmelzung in das Register des Sitzes desjenigen Rechtsträgers, dessen Gläubiger sie sind, als bekannt gemacht gilt, ihren Anspruch nach Grund und Höhe schriftlich anmelden, Sicherheit zu leisten, soweit sie nicht Befriedigung verlangen können. Dieses Recht steht den Gläubigern jedoch nur zu, wenn sie glaubhaft machen, dass durch die Verschmelzung die Erfüllung ihrer Forderung gefährdet wird. Das Recht, Sicherheitsleistung zu verlangen, steht Gläubigern nicht zu, die im Falle der Insolvenz ein Recht auf vorzugsweise Befriedigung aus einer Deckungsmasse haben, die nach gesetzlicher Vorschrift zu ihrem Schutz errichtet und staatlich überwacht ist."
    },
    {
      "date": "2025-07-28",
      "id": "117771",
      "original_text": "Registerbekanntmachung nach dem Umwandlungsgesetz\nBerlin Amtsgericht Berlin (Charlottenburg) HRB 218908\nSana Gesundheit GmbH – Berlin",
      "type": "Registerbekanntmachung nach dem Umwandlungsgesetz",
      "state": "Berlin",
      "amtsgericht": "Amtsgericht Berlin (Charlottenburg)",
      "registernummer": "HRB 218908",
      "registerart": "HRB",
      "company_name": "Sana Gesundheit GmbH",
      "company_seat": "Berlin",
      "details": "28.07.2025 (Bekanntmachungsdatum)\n\nBerlin Amtsgericht Berlin (Charlottenburg) HRB 218908\nRegisterbekanntmachung nach dem Umwandlungsgesetz 28.07.2025 (Eintragungsdatum)\n\nSana Gesundheit GmbH\nGesellschaft mit beschränkter Haftung\nBerlin\n\nZu Eintragungsnummer 8 vom 28.07.2025 wird als nicht eingetragen veröffentlicht:\n\nDen Gläubigern der an der Verschmelzung beteiligten Rechtsträger ist, wenn sie binnen sechs Monaten nach dem Tag, an dem die Eintragung der Verschmelzung in das Register des Sitzes desjenigen Rechtsträgers, dessen Gläubiger sie sind, als bekannt gemacht gilt, ihren Anspruch nach Grund und Höhe schriftlich anmelden, Sicherheit zu leisten, soweit sie nicht Befriedigung verlangen können. Dieses Recht steht den Gläubigern jedoch nur zu, wenn sie glaubhaft machen, dass durch die Verschmelzung die Erfüllung ihrer Forderung gefährdet wird. Das Recht, Sicherheitsleistung zu verlangen, steht Gläubigern nicht zu, die im Falle der Insolvenz ein Recht auf vorzugsweise Befriedigung aus einer Deckungsmasse haben, die nach gesetzlicher Vorschrift zu ihrem Schutz errichtet und staatlich überwacht ist."
    },
    {
      "date": "2025-07-28",
      "id": "117772",
      "original_text": "Registerbekanntmachung nach dem Umwandlungsgesetz\nBrandenburg Amtsgericht Cottbus HRB 12873\nRefugium Beelitz Pavillon B 3 Grundstücksgesellschaft mbH – Schönefeld",
      "type": "Registerbekanntmachung nach dem Umwandlungsgesetz",
      "state": "Brandenburg",
      "amtsgericht": "Amtsgericht Cottbus",
      "registernummer": "HRB 12873",
      "registerart": "HRB",
      "company_name": "Refugium Beelitz Pavillon B 3 Grundstücksgesellschaft mbH",
      "company_seat": "Schönefeld",
      "details": "28.07.2025 (Bekanntmachungsdatum)\n\nBrandenburg Amtsgericht Cottbus HRB 12873\nRegisterbekanntmachung nach dem Umwandlungsgesetz 28.07.2025 (Eintragungsdatum)\n\nRefugium Beelitz Pavillon B 3 Grundstücksgesellschaft mbH\nGesellschaft mit beschränkter Haftung\nSchönefeld\n\nDen Gläubigern der an der Verschmelzung beteiligten Rechtsträger ist, wenn sie binnen sechs Monaten nach dem Tag, an dem die Eintragung der Verschmelzung in das Register des Sitzes desjenigen Rechtsträgers, dessen Gläubiger sie sind, als bekannt gemacht gilt, ihren Anspruch nach Grund und Höhe schriftlich anmelden, Sicherheit zu leisten, soweit sie nicht Befriedigung verlangen können. Dieses Recht steht den Gläubigern jedoch nur zu, wenn sie glaubhaft machen, dass durch die Verschmelzung die Erfüllung ihrer Forderung gefährdet wird"
    },
    {
      "date": "2025-07-28",
      "id": "117773",
      "original_text": "Sonstige Registerbekanntmachung\nBrandenburg Amtsgericht Neuruppin HRB 703\nWOBA Templin - UM, Wohnungsbaugesellschaft mit beschränkter Haftung – Templin",
      "type": "Sonstige Registerbekanntmachung",
      "state": "Brandenburg",
      "amtsgericht": "Amtsgericht Neuruppin",
      "registernummer": "HRB 703",
      "registerart": "HRB",
      "company_name": "WOBA Templin - UM, Wohnungsbaugesellschaft mit beschränkter Haftung",
      "company_seat": "Templin",
      "details": "28.07.2025 (Bekanntmachungsdatum)\n\nBrandenburg Amtsgericht Neuruppin HRB 703\nSonstige Registerbekanntmachung\n\nWOBA Templin - UM, Wohnungsbaugesellschaft mit beschränkter Haftung\nGesellschaft mit beschränkter Haftung\nTemplin\n\nAls nicht eingetragen wird bekannt gemacht: Eine Liste der Mitglieder des Aufsichtsrates wurde zum Handelsregister eingereicht."
    },
    {
      "date": "2025-07-28",
      "id": "117774",
      "original_text": "Registerbekanntmachung nach dem Umwandlungsgesetz\nSchleswig-Holstein Amtsgericht Kiel HRB 1084 EC\nMontage- und Haustechnik MHJ GmbH – Barkelsby",
      "type": "Registerbekanntmachung nach dem Umwandlungsgesetz",
      "state": "Schleswig-Holstein",
      "amtsgericht": "Amtsgericht Kiel",
      "registernummer": "HRB 1084 EC",
      "registerart": "HRB",
      "company_name": "Montage- und Haustechnik MHJ GmbH",
      "company_seat": "Barkelsby",
      "details": "28.07.2025 (Bekanntmachungsdatum)\n\nSchleswig-Holstein Amtsgericht Kiel HRB 1084 EC\nRegisterbekanntmachung nach dem Umwandlungsgesetz 25.07.2025 (Eintragungsdatum)\n\nMontage- und Haustechnik MHJ GmbH\nGesellschaft mit beschränkter Haftung\nBarkelsby\n\nZu Eintragungsnummer 7 vom 25.07.2025 wird als nicht eingetragen veröffentlicht: Als nicht eingetragen wird veröffentlicht: Den Gläubigern der an der Verschmelzung beteiligten Rechtsträger ist, wenn sie binnen sechs Monaten nach dem Tag, an dem die Eintragung der Verschmelzung in das Register des Sitzes desjenigen Rechtsträgers, dessen Gläubiger sie sind, nach § 19 Abs. 3 UmwG bekannt gemacht worden ist, ihren Anspruch nach Grund und Höhe schriftlich anmelden, Sicherheit zu leisten, soweit sie nicht Befriedigung verlangen können. Dieses Recht steht den Gläubigern jedoch nur zu, wenn sie glaubhaft machen, dass durch die Verschmelzung die Erfüllung ihrer Forderung gefährdet wird."
    },
    {
      "date": "2025-07-28",
      "id": "117775",
      "original_text": "Einreichung neuer Dokumente\nSchleswig-Holstein Amtsgericht Kiel HRB 1955 NM\nBRIGADE Elektronik GmbH – Neumünster",
      "type": "Einreichung neuer Dokumente",
      "state": "Schleswig-Holstein",
      "amtsgericht": "Amtsgericht Kiel",
      "registernummer": "HRB 1955 NM",
      "registerart": "HRB",
      "company_name": "BRIGADE Elektronik GmbH",
      "company_seat": "Neumünster",
      "details": "28.07.2025 (Bekanntmachungsdatum)\n\nSchleswig-Holstein Amtsgericht Kiel HRB 1955 NM\nEinreichung neuer Dokumente\n\nBRIGADE Elektronik GmbH\nGesellschaft mit beschränkter Haftung\nNeumünster\n\nAls nicht eingetragen wird veröffentlicht:\n\n1. Der Entwurf des Verschmelzungsplans ist beim Handelsregister\neingereicht worden ist.\n2. An der grenzüberschreitenden Verschmelzung sind beteiligt als übertragende\nGesellschaft die BRIGADE Elektronik GmbH mit Sitz in Neumünster,\neine Gesellschaft mit beschränkter Haftung nach deutschem Recht, und als\nübernehmende Gesellschaft die Brigade Electronics (EU) B.V. mit Sitz in\nHeibloem in der Gemeinde Leudal, Niederlande, eine Gesellschaft mit beschränkter\nHaftung nach niederländischem Recht (besloten vennotschap\nmet beperkte aansprakelijkheid).\n3. Die übertragende Gesellschaft ist eingetragen im Handelsregister des Amtsgerichts\nKiel unter HRB 1955 NM. Die übernehmende Gesellschaft ist eingetragen\nim niederländischen Handelsregister (Kamer van Koophandel) unter\nNummer 14132628.\n4. Ein Hinweis an folgende Personen, dass sie der Gesellschaft spätestens fünf\nArbeitstage vor dem 17. September 2025 Bemerkungen zum Verschmelzungsplan\nübermitteln können:\na) an die Gesellschafter sowie die Gläubiger der an der grenzüberschreitenden\nGesellschaft beteiligten Gesellschaften sowie\nb) an die Arbeitnehmer der an der grenzüberschreitenden Gesellschaft\nbeteiligten Gesellschaften."
    },
    {
      "date": "2025-07-28",
      "id": "117776",
      "original_text": "Registerbekanntmachung nach dem Umwandlungsgesetz\nSchleswig-Holstein Amtsgericht Kiel HRB 1494 RD\nCeravis Futtermittel GmbH – Rendsburg",
      "type": "Registerbekanntmachung nach dem Umwandlungsgesetz",
      "state": "Schleswig-Holstein",
      "amtsgericht": "Amtsgericht Kiel",
      "registernummer": "HRB 1494 RD",
      "registerart": "HRB",
      "company_name": "Ceravis Futtermittel GmbH",
      "company_seat": "Rendsburg",
      "details": "28.07.2025 (Bekanntmachungsdatum)\n\nSchleswig-Holstein Amtsgericht Kiel HRB 1494 RD\nRegisterbekanntmachung nach dem Umwandlungsgesetz 25.07.2025 (Eintragungsdatum)\n\nCeravis Futtermittel GmbH\nGesellschaft mit beschränkter Haftung\nRendsburg\n\nZu Eintragungsnummer 22 vom 25.07.2025 wird als nicht eingetragen veröffentlicht: Als nicht eingetragen wird veröffentlicht: Den Gläubigern der an der Verschmelzung beteiligten Rechtsträger ist, wenn sie binnen sechs Monaten nach dem Tag, an dem die Eintragung der Verschmelzung in das Register des Sitzes desjenigen Rechtsträgers, dessen Gläubiger sie sind, nach § 19 Abs. 3 UmwG bekannt gemacht worden ist, ihren Anspruch nach Grund und Höhe schriftlich anmelden, Sicherheit zu leisten, soweit sie nicht Befriedigung verlangen können. Dieses Recht steht den Gläubigern jedoch nur zu, wenn sie glaubhaft machen, dass durch die Verschmelzung die Erfüllung ihrer Forderung gefährdet wird."
    },
    {
      "date": "2025-07-28",
      "id": "117777",
      "original_text": "Registerbekanntmachung nach dem Umwandlungsgesetz\nBerlin Amtsgericht Berlin (Charlottenburg) HRB 96822\nAufwind Berlin gGmbH – Berlin",
      "type": "Registerbekanntmachung nach dem Umwandlungsgesetz",
      "state": "Berlin",
      "amtsgericht": "Amtsgericht Berlin (Charlottenburg)",
      "registernummer": "HRB 96822",
      "registerart": "HRB",
      "company_name": "Aufwind Berlin gGmbH",
      "company_seat": "Berlin",
      "details": "28.07.2025 (Bekanntmachungsdatum)\n\nBerlin Amtsgericht Berlin (Charlottenburg) HRB 96822\nRegisterbekanntmachung nach dem Umwandlungsgesetz 25.07.2025 (Eintragungsdatum)\n\nAufwind Berlin gGmbH\nGesellschaft mit beschränkter Haftung\nBerlin\n\nZu Eintragungsnummer 12 vom 25.07.2025 wird als nicht eingetragen veröffentlicht:\nDen Gläubigern der an der Verschmelzung beteiligten Rechtsträger ist, wenn sie binnen sechs Monaten nach dem Tag, an dem die Eintragung der Verschmelzung in das Register des Sitzes desjenigen Rechtsträgers, dessen Gläubiger sie sind, als bekannt gemacht gilt, ihren Anspruch nach Grund und Höhe schriftlich anmelden, Sicherheit zu leisten, soweit sie nicht Befriedigung verlangen können. Dieses Recht steht den Gläubigern jedoch nur zu, wenn sie glaubhaft machen, dass durch die Verschmelzung die Erfüllung ihrer Forderung gefährdet wird. Das Recht, Sicherheitsleistung zu verlangen, steht Gläubigern nicht zu, die im Falle der Insolvenz ein Recht auf vorzugsweise Befriedigung aus einer Deckungsmasse haben, die nach gesetzlicher Vorschrift zu ihrem Schutz errichtet und staatlich überwacht ist."
    },
    {
      "date": "2025-07-28",
      "id": "117778",
      "original_text": "Registerbekanntmachung nach dem Umwandlungsgesetz\nBerlin Amtsgericht Berlin (Charlottenburg) HRB 171427\nXammit GmbH – Berlin",
      "type": "Registerbekanntmachung nach dem Umwandlungsgesetz",
      "state": "Berlin",
      "amtsgericht": "Amtsgericht Berlin (Charlottenburg)",
      "registernummer": "HRB 171427",
      "registerart": "HRB",
      "company_name": "Xammit GmbH",
      "company_seat": "Berlin",
      "details": "28.07.2025 (Bekanntmachungsdatum)\n\nBerlin Amtsgericht Berlin (Charlottenburg) HRB 171427\nRegisterbekanntmachung nach dem Umwandlungsgesetz 25.07.2025 (Eintragungsdatum)\n\nXammit GmbH\nGesellschaft mit beschränkter Haftung\nBerlin\n\nZu Eintragungsnummer 13 vom 25.07.2025 wird als nicht eingetragen veröffentlicht: Den Gläubigern der an der Verschmelzung beteiligten Rechtsträger ist, wenn sie binnen sechs Monaten nach dem Tag, an dem die Eintragung der Verschmelzung in das Register des Sitzes desjenigen Rechtsträgers, dessen Gläubiger sie sind, als bekannt gemacht gilt, ihren Anspruch nach Grund und Höhe schriftlich anmelden, Sicherheit zu leisten, soweit sie nicht Befriedigung verlangen können. Dieses Recht steht den Gläubigern jedoch nur zu, wenn sie glaubhaft machen, dass durch die Verschmelzung die Erfüllung ihrer Forderung gefährdet wird. Das Recht, Sicherheitsleistung zu verlangen, steht Gläubigern nicht zu, die im Falle der Insolvenz ein Recht auf vorzugsweise Befriedigung aus einer Deckungsmasse haben, die nach gesetzlicher Vorschrift zu ihrem Schutz errichtet und staatlich überwacht ist."
    },
    {
      "date": "2025-07-28",
      "id": "117779",
      "original_text": "Registerbekanntmachung nach dem Umwandlungsgesetz\nBerlin Amtsgericht Berlin (Charlottenburg) HRB 162160\nRESSAP - Real Estate Service Solution Applications - GmbH – Berlin",
      "type": "Registerbekanntmachung nach dem Umwandlungsgesetz",
      "state": "Berlin",
      "amtsgericht": "Amtsgericht Berlin (Charlottenburg)",
      "registernummer": "HRB 162160",
      "registerart": "HRB",
      "company_name": "RESSAP - Real Estate Service Solution Applications - GmbH",
      "company_seat": "Berlin",
      "details": "28.07.2025 (Bekanntmachungsdatum)\n\nBerlin Amtsgericht Berlin (Charlottenburg) HRB 162160\nRegisterbekanntmachung nach dem Umwandlungsgesetz 25.07.2025 (Eintragungsdatum)\n\nRESSAP - Real Estate Service Solution Applications - GmbH\nGesellschaft mit beschränkter Haftung\nBerlin\n\nZu Eintragungsnummer 19 vom 25.07.2025 wird als nicht eingetragen veröffentlicht: Den Gläubigern der an der Verschmelzung beteiligten Rechtsträger ist, wenn sie binnen sechs Monaten nach dem Tag, an dem die Eintragung der Verschmelzung in das Register des Sitzes desjenigen Rechtsträgers, dessen Gläubiger sie sind, als bekannt gemacht gilt, ihren Anspruch nach Grund und Höhe schriftlich anmelden, Sicherheit zu leisten, soweit sie nicht Befriedigung verlangen können. Dieses Recht steht den Gläubigern jedoch nur zu, wenn sie glaubhaft machen, dass durch die Verschmelzung die Erfüllung ihrer Forderung gefährdet wird. Das Recht, Sicherheitsleistung zu verlangen, steht Gläubigern nicht zu, die im Falle der Insolvenz ein Recht auf vorzugsweise Befriedigung aus einer Deckungsmasse haben, die nach gesetzlicher Vorschrift zu ihrem Schutz errichtet und staatlich überwacht ist."
    },
    {
      "date": "2025-07-28",
      "id": "117780",
      "original_text": "Registerbekanntmachung nach dem Umwandlungsgesetz\nBerlin Amtsgericht Berlin (Charlottenburg) HRB 146502\nWestconcept GmbH – Berlin",
      "type": "Registerbekanntmachung nach dem Umwandlungsgesetz",
      "state": "Berlin",
      "amtsgericht": "Amtsgericht Berlin (Charlottenburg)",
      "registernummer": "HRB 146502",
      "registerart": "HRB",
      "company_name": "Westconcept GmbH",
      "company_seat": "Berlin",
      "details": "28.07.2025 (Bekanntmachungsdatum)\n\nBerlin Amtsgericht Berlin (Charlottenburg) HRB 146502\nRegisterbekanntmachung nach dem Umwandlungsgesetz 25.07.2025 (Eintragungsdatum)\n\nWestconcept GmbH\nGesellschaft mit beschränkter Haftung\nBerlin\n\nZu Eintragungsnummer 15 vom 25.07.2025 wird als nicht eingetragen veröffentlicht: Den Gläubigern der an der Verschmelzung beteiligten Rechtsträger ist, wenn sie binnen sechs Monaten nach dem Tag, an dem die Eintragung der Verschmelzung in das Register des Sitzes desjenigen Rechtsträgers, dessen Gläubiger sie sind, als bekannt gemacht gilt, ihren Anspruch nach Grund und Höhe schriftlich anmelden, Sicherheit zu leisten, soweit sie nicht Befriedigung verlangen können. Dieses Recht steht den Gläubigern jedoch nur zu, wenn sie glaubhaft machen, dass durch die Verschmelzung die Erfüllung ihrer Forderung gefährdet wird. Das Recht, Sicherheitsleistung zu verlangen, steht Gläubigern nicht zu, die im Falle der Insolvenz ein Recht auf vorzugsweise Befriedigung aus einer Deckungsmasse haben, die nach gesetzlicher Vorschrift zu ihrem Schutz errichtet und staatlich überwacht ist."
    },
    {
      "date": "2025-07-28",
      "id": "117781",
      "original_text": "Registerbekanntmachung nach dem Umwandlungsgesetz\nBerlin Amtsgericht Berlin (Charlottenburg) HRB 160878\nWestgrund Halle Immobilienverwaltung GmbH – Berlin",
      "type": "Registerbekanntmachung nach dem Umwandlungsgesetz",
      "state": "Berlin",
      "amtsgericht": "Amtsgericht Berlin (Charlottenburg)",
      "registernummer": "HRB 160878",
      "registerart": "HRB",
      "company_name": "Westgrund Halle Immobilienverwaltung GmbH",
      "company_seat": "Berlin",
      "details": "28.07.2025 (Bekanntmachungsdatum)\n\nBerlin Amtsgericht Berlin (Charlottenburg) HRB 160878\nRegisterbekanntmachung nach dem Umwandlungsgesetz 25.07.2025 (Eintragungsdatum)\n\nWestgrund Halle Immobilienverwaltung GmbH\nGesellschaft mit beschränkter Haftung\nBerlin\n\nZu Eintragungsnummer 14 vom 25.07.2025 wird als nicht eingetragen veröffentlicht: Den Gläubigern der an der Verschmelzung beteiligten Rechtsträger ist, wenn sie binnen sechs Monaten nach dem Tag, an dem die Eintragung der Verschmelzung in das Register des Sitzes desjenigen Rechtsträgers, dessen Gläubiger sie sind, als bekannt gemacht gilt, ihren Anspruch nach Grund und Höhe schriftlich anmelden, Sicherheit zu leisten, soweit sie nicht Befriedigung verlangen können. Dieses Recht steht den Gläubigern jedoch nur zu, wenn sie glaubhaft machen, dass durch die Verschmelzung die Erfüllung ihrer Forderung gefährdet wird. Das Recht, Sicherheitsleistung zu verlangen, steht Gläubigern nicht zu, die im Falle der Insolvenz ein Recht auf vorzugsweise Befriedigung aus einer Deckungsmasse haben, die nach gesetzlicher Vorschrift zu ihrem Schutz errichtet und staatlich überwacht ist."
    },
    {
      "date": "2025-07-28",
      "id": "117782",
      "original_text": "Registerbekanntmachung nach dem Umwandlungsgesetz\nBerlin Amtsgericht Berlin (Charlottenburg) HRB 251690\nSAE Schneider Autark Energie GmbH – Berlin",
      "type": "Registerbekanntmachung nach dem Umwandlungsgesetz",
      "state": "Berlin",
      "amtsgericht": "Amtsgericht Berlin (Charlottenburg)",
      "registernummer": "HRB 251690",
      "registerart": "HRB",
      "company_name": "SAE Schneider Autark Energie GmbH",
      "company_seat": "Berlin",
      "details": "28.07.2025 (Bekanntmachungsdatum)\n\nBerlin Amtsgericht Berlin (Charlottenburg) HRB 251690\nRegisterbekanntmachung nach dem Umwandlungsgesetz 25.07.2025 (Eintragungsdatum)\n\nSAE Schneider Autark Energie GmbH\nGesellschaft mit beschränkter Haftung\nBerlin\n\nZu Eintragungsnummer 3 vom 25.07.2025 wird als nicht eingetragen veröffentlicht: Den Gläubigern der an der Verschmelzung beteiligten Rechtsträger ist, wenn sie binnen sechs Monaten nach dem Tag, an dem die Eintragung der Verschmelzung in das Register des Sitzes desjenigen Rechtsträgers, dessen Gläubiger sie sind, als bekannt gemacht gilt, ihren Anspruch nach Grund und Höhe schriftlich anmelden, Sicherheit zu leisten, soweit sie nicht Befriedigung verlangen können. Dieses Recht steht den Gläubigern jedoch nur zu, wenn sie glaubhaft machen, dass durch die Verschmelzung die Erfüllung ihrer Forderung gefährdet wird. Das Recht, Sicherheitsleistung zu verlangen, steht Gläubigern nicht zu, die im Falle der Insolvenz ein Recht auf vorzugsweise Befriedigung aus einer Deckungsmasse haben, die nach gesetzlicher Vorschrift zu ihrem Schutz errichtet und staatlich überwacht ist."
    },
    {
      "date": "2025-07-28",
      "id": "117783",
      "original_text": "Registerbekanntmachung nach dem Umwandlungsgesetz\nBerlin Amtsgericht Berlin (Charlottenburg) HRB 247570\nCSR Autark Energie & Gebäudetechnik GmbH – Berlin",
      "type": "Registerbekanntmachung nach dem Umwandlungsgesetz",
      "state": "Berlin",
      "amtsgericht": "Amtsgericht Berlin (Charlottenburg)",
      "registernummer": "HRB 247570",
      "registerart": "HRB",
      "company_name": "CSR Autark Energie & Gebäudetechnik GmbH",
      "company_seat": "Berlin",
      "details": "28.07.2025 (Bekanntmachungsdatum)\n\nBerlin Amtsgericht Berlin (Charlottenburg) HRB 247570\nRegisterbekanntmachung nach dem Umwandlungsgesetz 25.07.2025 (Eintragungsdatum)\n\nCSR Autark Energie & Gebäudetechnik GmbH\nGesellschaft mit beschränkter Haftung\nBerlin\n\nZu Eintragungsnummer 4 vom 25.07.2025 wird als nicht eingetragen veröffentlicht: Den Gläubigern der an der Verschmelzung beteiligten Rechtsträger ist, wenn sie binnen sechs Monaten nach dem Tag, an dem die Eintragung der Verschmelzung in das Register des Sitzes desjenigen Rechtsträgers, dessen Gläubiger sie sind, als bekannt gemacht gilt, ihren Anspruch nach Grund und Höhe schriftlich anmelden, Sicherheit zu leisten, soweit sie nicht Befriedigung verlangen können. Dieses Recht steht den Gläubigern jedoch nur zu, wenn sie glaubhaft machen, dass durch die Verschmelzung die Erfüllung ihrer Forderung gefährdet wird. Das Recht, Sicherheitsleistung zu verlangen, steht Gläubigern nicht zu, die im Falle der Insolvenz ein Recht auf vorzugsweise Befriedigung aus einer Deckungsmasse haben, die nach gesetzlicher Vorschrift zu ihrem Schutz errichtet und staatlich überwacht ist."
    },
    {
      "date": "2025-07-28",
      "id": "117784",
      "original_text": "Registerbekanntmachung nach dem Umwandlungsgesetz\nBerlin Amtsgericht Berlin (Charlottenburg) HRB 146740\nWestgrund Immobilien Beteiligung GmbH – Berlin",
      "type": "Registerbekanntmachung nach dem Umwandlungsgesetz",
      "state": "Berlin",
      "amtsgericht": "Amtsgericht Berlin (Charlottenburg)",
      "registernummer": "HRB 146740",
      "registerart": "HRB",
      "company_name": "Westgrund Immobilien Beteiligung GmbH",
      "company_seat": "Berlin",
      "details": "28.07.2025 (Bekanntmachungsdatum)\n\nBerlin Amtsgericht Berlin (Charlottenburg) HRB 146740\nRegisterbekanntmachung nach dem Umwandlungsgesetz 25.07.2025 (Eintragungsdatum)\n\nWestgrund Immobilien Beteiligung GmbH\nGesellschaft mit beschränkter Haftung\nBerlin\n\nZu Eintragungsnummer 13 vom 25.07.2025 wird als nicht eingetragen veröffentlicht: Den Gläubigern der an der Verschmelzung beteiligten Rechtsträger ist, wenn sie binnen sechs Monaten nach dem Tag, an dem die Eintragung der Verschmelzung in das Register des Sitzes desjenigen Rechtsträgers, dessen Gläubiger sie sind, als bekannt gemacht gilt, ihren Anspruch nach Grund und Höhe schriftlich anmelden, Sicherheit zu leisten, soweit sie nicht Befriedigung verlangen können. Dieses Recht steht den Gläubigern jedoch nur zu, wenn sie glaubhaft machen, dass durch die Verschmelzung die Erfüllung ihrer Forderung gefährdet wird. Das Recht, Sicherheitsleistung zu verlangen, steht Gläubigern nicht zu, die im Falle der Insolvenz ein Recht auf vorzugsweise Befriedigung aus einer Deckungsmasse haben, die nach gesetzlicher Vorschrift zu ihrem Schutz errichtet und staatlich überwacht ist."
    },
    {
      "date": "2025-07-28",
      "id": "117785",
      "original_text": "Löschungsankündigung\nBrandenburg Amtsgericht Potsdam HRB 34286\nDelta Haus Verwaltungs GmbH – Schönwalde-Glien",
      "type": "Löschungsankündigung",
      "state": "Brandenburg",
      "amtsgericht": "Amtsgericht Potsdam",
      "registernummer": "HRB 34286",
      "registerart": "HRB",
      "company_name": "Delta Haus Verwaltungs GmbH",
      "company_seat": "Schönwalde-Glien",
      "details": "28.07.2025 (Bekanntmachungsdatum)\n\nBrandenburg Amtsgericht Potsdam HRB 34286\nLöschungsankündigung\n\nDelta Haus Verwaltungs GmbH\nGesellschaft mit beschränkter Haftung\nSchönwalde-Glien\n\nBei der nachstehenden Gesellschaft wird das Amtslöschungsverfahren gemäß § 394 FamFG eingeleitet. Widerspruchsfrist: 8 Wochen."
    },
    {
      "date": "2025-07-28",
      "id": "117786",
      "original_text": "Registerbekanntmachung nach dem Umwandlungsgesetz\nBerlin Amtsgericht Berlin (Charlottenburg) HRB 148734\nWestgrund Immobilien Beteiligung II. GmbH – Berlin",
      "type": "Registerbekanntmachung nach dem Umwandlungsgesetz",
      "state": "Berlin",
      "amtsgericht": "Amtsgericht Berlin (Charlottenburg)",
      "registernummer": "HRB 148734",
      "registerart": "HRB",
      "company_name": "Westgrund Immobilien Beteiligung II. GmbH",
      "company_seat": "Berlin",
      "details": "28.07.2025 (Bekanntmachungsdatum)\n\nBerlin Amtsgericht Berlin (Charlottenburg) HRB 148734\nRegisterbekanntmachung nach dem Umwandlungsgesetz 25.07.2025 (Eintragungsdatum)\n\nWestgrund Immobilien Beteiligung II. GmbH\nGesellschaft mit beschränkter Haftung\nBerlin\n\nZu Eintragungsnummer 14 vom 25.07.2025 wird als nicht eingetragen veröffentlicht: Den Gläubigern der an der Verschmelzung beteiligten Rechtsträger ist, wenn sie binnen sechs Monaten nach dem Tag, an dem die Eintragung der Verschmelzung in das Register des Sitzes desjenigen Rechtsträgers, dessen Gläubiger sie sind, als bekannt gemacht gilt, ihren Anspruch nach Grund und Höhe schriftlich anmelden, Sicherheit zu leisten, soweit sie nicht Befriedigung verlangen können. Dieses Recht steht den Gläubigern jedoch nur zu, wenn sie glaubhaft machen, dass durch die Verschmelzung die Erfüllung ihrer Forderung gefährdet wird. Das Recht, Sicherheitsleistung zu verlangen, steht Gläubigern nicht zu, die im Falle der Insolvenz ein Recht auf vorzugsweise Befriedigung aus einer Deckungsmasse haben, die nach gesetzlicher Vorschrift zu ihrem Schutz errichtet und staatlich überwacht ist."
    },
    {
      "date": "2025-07-28",
      "id": "117787",
      "original_text": "Löschungsankündigung\nMecklenburg-Vorpommern Amtsgericht Rostock HRA 3617\nASTOR Fonds 1 Einkaufs- und Dienstleistungszentrum Güstrow GmbH & Co. KG – Güstrow",
      "type": "Löschungsankündigung",
      "state": "Mecklenburg-Vorpommern",
      "amtsgericht": "Amtsgericht Rostock",
      "registernummer": "HRA 3617",
      "registerart": "HRA",
      "company_name": "ASTOR Fonds 1 Einkaufs- und Dienstleistungszentrum Güstrow GmbH & Co. KG",
      "company_seat": "Güstrow",
      "details": "28.07.2025 (Bekanntmachungsdatum)\n\nMecklenburg-Vorpommern Amtsgericht Rostock HRA 3617\nLöschungsankündigung\n\nASTOR Fonds 1 Einkaufs- und Dienstleistungszentrum Güstrow GmbH & Co. KG\nKommanditgesellschaft\nGüstrow\n\nDas Registergericht beabsichtigt, die im Handelsregister eingetragene Gesellschaft von Amts wegen nach § 394 FamFG zu löschen. Die Frist zur Erhebung eines Widerspruchs gegen die beabsichtigte Löschung wird auf einen Monat festgesetzt."
    },
    {
      "date": "2025-07-28",
      "id": "117788",
      "original_text": "Registerbekanntmachung nach dem Umwandlungsgesetz\nSchleswig-Holstein Amtsgericht Pinneberg HRA 9992\nKühl Haus- und Grundstücksverwaltung GmbH & Co. KG – Uetersen",
      "type": "Registerbekanntmachung nach dem Umwandlungsgesetz",
      "state": "Schleswig-Holstein",
      "amtsgericht": "Amtsgericht Pinneberg",
      "registernummer": "HRA 9992",
      "registerart": "HRA",
      "company_name": "Kühl Haus- und Grundstücksverwaltung GmbH & Co. KG",
      "company_seat": "Uetersen",
      "details": "28.07.2025 (Bekanntmachungsdatum)\n\nSchleswig-Holstein Amtsgericht Pinneberg HRA 9992\nRegisterbekanntmachung nach dem Umwandlungsgesetz 25.07.2025 (Eintragungsdatum)\n\nKühl Haus- und Grundstücksverwaltung GmbH & Co. KG\nKommanditgesellschaft\nUetersen\n\nZu Eintragungsnummer 2 vom 25.07.2025 wird als nicht eingetragen veröffentlicht:  Als nicht eingetragen wird veröffentlicht: Den Gläubigern ist, wenn sie binnen sechs Monaten nach dem Tag, an dem die Eintragung der Umwandlung als bekannt gemacht gilt, ihren Anspruch nach Grund und Höhe schriftlich anmelden, Sicherheit zu leisten, soweit sie nicht Befriedigung verlangen können. Dieses Recht steht den Gläubigern jedoch nur zu, wenn sie glaubhaft machen, dass durch die Umwandlung die Erfüllung ihrer Forderung gefährdet wird. Das Recht, Sicherheitsleistung zu verlangen, steht Gläubigern nicht zu, die im Falle der Insolvenz ein Recht auf vorzugsweise Befriedigung aus einer Deckungsmasse haben, die nach gesetzlicher Vorschrift zu ihrem Schutz errichtet und staatlich überwacht ist."
    },
    {
      "date": "2025-07-28",
      "id": "117789",
      "original_text": "Registerbekanntmachung nach dem Umwandlungsgesetz\nBerlin Amtsgericht Berlin (Charlottenburg) HRB 208295\nWasserstadt Co-Living GmbH – Berlin",
      "type": "Registerbekanntmachung nach dem Umwandlungsgesetz",
      "state": "Berlin",
      "amtsgericht": "Amtsgericht Berlin (Charlottenburg)",
      "registernummer": "HRB 208295",
      "registerart": "HRB",
      "company_name": "Wasserstadt Co-Living GmbH",
      "company_seat": "Berlin",
      "details": "28.07.2025 (Bekanntmachungsdatum)\n\nBerlin Amtsgericht Berlin (Charlottenburg) HRB 208295\nRegisterbekanntmachung nach dem Umwandlungsgesetz 25.07.2025 (Eintragungsdatum)\n\nWasserstadt Co-Living GmbH\nGesellschaft mit beschränkter Haftung\nBerlin\n\nZu Eintragungsnummer 12 vom 25.07.2025 wird als nicht eingetragen veröffentlicht: Den Gläubigern der an der Verschmelzung beteiligten Rechtsträger ist, wenn sie binnen sechs Monaten nach dem Tag, an dem die Eintragung der Verschmelzung in das Register des Sitzes desjenigen Rechtsträgers, dessen Gläubiger sie sind, als bekannt gemacht gilt, ihren Anspruch nach Grund und Höhe schriftlich anmelden, Sicherheit zu leisten, soweit sie nicht Befriedigung verlangen können. Dieses Recht steht den Gläubigern jedoch nur zu, wenn sie glaubhaft machen, dass durch die Verschmelzung die Erfüllung ihrer Forderung gefährdet wird. Das Recht, Sicherheitsleistung zu verlangen, steht Gläubigern nicht zu, die im Falle der Insolvenz ein Recht auf vorzugsweise Befriedigung aus einer Deckungsmasse haben, die nach gesetzlicher Vorschrift zu ihrem Schutz errichtet und staatlich überwacht ist."
    },
    {
      "date": "2025-07-28",
      "id": "117790",
      "original_text": "Registerbekanntmachung nach dem Umwandlungsgesetz\nBaden-Württemberg Amtsgericht Mannheim HRB 717981\nConradia Medical Prevention GmbH – Heidelberg",
      "type": "Registerbekanntmachung nach dem Umwandlungsgesetz",
      "state": "Baden-Württemberg",
      "amtsgericht": "Amtsgericht Mannheim",
      "registernummer": "HRB 717981",
      "registerart": "HRB",
      "company_name": "Conradia Medical Prevention GmbH",
      "company_seat": "Heidelberg",
      "details": "28.07.2025 (Bekanntmachungsdatum)\n\nBaden-Württemberg Amtsgericht Mannheim HRB 717981\nRegisterbekanntmachung nach dem Umwandlungsgesetz 28.07.2025 (Eintragungsdatum)\n\nConradia Medical Prevention GmbH\nGesellschaft mit beschränkter Haftung\nHeidelberg\n\nAls nicht eingetragen wird bekanntgemacht:\nDen Gläubigern der an der Verschmelzung beteiligten Rechtsträger ist, wenn sie binnen sechs Monaten nach dem Tag, an dem die Eintragung der Verschmelzung in das Register des Sitzes desjenigen Rechtsträgers, dessen Gläubiger sie sind, nach § 19 Abs. 3 UmwG als bekanntgemacht gilt, ihren Anspruch nach Grund und Höhe schriftlich anmelden, Sicherheit zu leisten, soweit sie nicht Befriedigung verlangen können. Dieses Recht steht den Gläubigern jedoch nur zu, wenn sie glaubhaft machen, dass durch die Verschmelzung die Erfüllung ihrer Forderung gefährdet wird."
    },
    {
      "date": "2025-07-28",
      "id": "117791",
      "original_text": "Löschungsankündigung\nSchleswig-Holstein Amtsgericht Lübeck HRA 10138\nBootshuus GmbH + Co. KG – Grömitz",
      "type": "Löschungsankündigung",
      "state": "Schleswig-Holstein",
      "amtsgericht": "Amtsgericht Lübeck",
      "registernummer": "HRA 10138",
      "registerart": "HRA",
      "company_name": "Bootshuus GmbH + Co. KG",
      "company_seat": "Grömitz",
      "details": "28.07.2025 (Bekanntmachungsdatum)\n\nSchleswig-Holstein Amtsgericht Lübeck HRA 10138\nLöschungsankündigung\n\nBootshuus GmbH + Co. KG\nKommanditgesellschaft\nGrömitz\n\nEs ist die Löschung der nachstehenden Gesellschaft wegen Vermögenslosigkeit gemäß § 394 FamFG beabsichtigt."
    },
    {
      "date": "2025-07-28",
      "id": "117792",
      "original_text": "Löschungsankündigung\nNordrhein-Westfalen Amtsgericht Coesfeld HRB 20470\nOIM Gebäudetechnik GmbH – Coesfeld",
      "type": "Löschungsankündigung",
      "state": "Nordrhein-Westfalen",
      "amtsgericht": "Amtsgericht Coesfeld",
      "registernummer": "HRB 20470",
      "registerart": "HRB",
      "company_name": "OIM Gebäudetechnik GmbH",
      "company_seat": "Coesfeld",
      "details": "28.07.2025 (Bekanntmachungsdatum)\n\nNordrhein-Westfalen Amtsgericht Coesfeld HRB 20470\nLöschungsankündigung\n\nOIM Gebäudetechnik GmbH\nGesellschaft mit beschränkter Haftung\nCoesfeld\n\nDas Registergericht beabsichtigt, den Rechtsträger wegen Vermögenslosigkeit gemäß § 394 FamFG von Amts wegen zu löschen.\n\nGegen diese Verfügung kann Widerspruch eingelegt werden. Die Frist zur Erhebung eines Widerspruchs gegen die beabsichtigte Löschung ist auf zwei Monate ab Veröffentlichung festgesetzt."
    },
    {
      "date": "2025-07-28",
      "id": "117793",
      "original_text": "Registerbekanntmachung nach dem Umwandlungsgesetz\nBaden-Württemberg Amtsgericht Stuttgart HRB 787714\nKraft Baustatik GmbH – Besigheim",
      "type": "Registerbekanntmachung nach dem Umwandlungsgesetz",
      "state": "Baden-Württemberg",
      "amtsgericht": "Amtsgericht Stuttgart",
      "registernummer": "HRB 787714",
      "registerart": "HRB",
      "company_name": "Kraft Baustatik GmbH",
      "company_seat": "Besigheim",
      "details": "28.07.2025 (Bekanntmachungsdatum)\n\nBaden-Württemberg Amtsgericht Stuttgart HRB 787714\nRegisterbekanntmachung nach dem Umwandlungsgesetz 28.07.2025 (Eintragungsdatum)\n\nKraft Baustatik GmbH\nGesellschaft mit beschränkter Haftung\nBesigheim\n\nDen Gläubigern der an der Verschmelzung beteiligten Rechtsträger ist, wenn sie binnen sechs Monaten nach dem Tag, an dem die Eintragung der Verschmelzung in das Register des Sitzes desjenigen Rechtsträgers, dessen Gläubiger sie sind, nach § 19 Abs. 3 UmwG als bekanntgemacht gilt, ihren Anspruch nach Grund und Höhe schriftlich anmelden, Sicherheit zu leisten, soweit sie nicht Befriedigung verlangen können. Dieses Recht steht den Gläubigern jedoch nur zu, wenn sie glaubhaft machen, dass durch die Verschmelzung die Erfüllung ihrer Forderung gefährdet wird."
    },
    {
      "date": "2025-07-28",
      "id": "117794",
      "original_text": "Löschungsankündigung\nMecklenburg-Vorpommern Amtsgericht Stralsund HRB 20024\nAF-Depot UG (haftungsbeschränkt) – Sundhagen",
      "type": "Löschungsankündigung",
      "state": "Mecklenburg-Vorpommern",
      "amtsgericht": "Amtsgericht Stralsund",
      "registernummer": "HRB 20024",
      "registerart": "HRB",
      "company_name": "AF-Depot UG (haftungsbeschränkt)",
      "company_seat": "Sundhagen",
      "details": "28.07.2025 (Bekanntmachungsdatum)\n\nMecklenburg-Vorpommern Amtsgericht Stralsund HRB 20024\nLöschungsankündigung 28.07.2025 (Eintragungsdatum)\n\nAF-Depot UG (haftungsbeschränkt)\nGesellschaft mit beschränkter Haftung\nSundhagen\n\nDas Registergericht beabsichtigt, die im Handelsregister eingetragene Gesellschaft von Amts wegen nach § 394 FamFG zu löschen. Die Frist zur Erhebung eines Widerspruchs gegen die beabsichtigte Löschung wird auf 1 Monat festgesetzt."
    },
    {
      "date": "2025-07-28",
      "id": "117795",
      "original_text": "Einreichung neuer Dokumente\nHamburg Amtsgericht Hamburg HRB 77668\nH L S Hamburger Logistik Service GmbH – Hamburg",
      "type": "Einreichung neuer Dokumente",
      "state": "Hamburg",
      "amtsgericht": "Amtsgericht Hamburg",
      "registernummer": "HRB 77668",
      "registerart": "HRB",
      "company_name": "H L S Hamburger Logistik Service GmbH",
      "company_seat": "Hamburg",
      "details": "28.07.2025 (Bekanntmachungsdatum)\n\nHamburg Amtsgericht Hamburg HRB 77668\nEinreichung neuer Dokumente\n\nH L S Hamburger Logistik Service GmbH\nGesellschaft mit beschränkter Haftung\nHamburg\n\nAls nicht eingetragen wird bekannt gemacht: Liste des Aufsichtsrats wurde eingereicht."
    },
    {
      "date": "2025-07-28",
      "id": "117796",
      "original_text": "Registerbekanntmachung nach dem Umwandlungsgesetz\nBaden-Württemberg Amtsgericht Stuttgart HRA 742093\nM. KAPPEL Entsorgungs GmbH & Co. KG – Fellbach",
      "type": "Registerbekanntmachung nach dem Umwandlungsgesetz",
      "state": "Baden-Württemberg",
      "amtsgericht": "Amtsgericht Stuttgart",
      "registernummer": "HRA 742093",
      "registerart": "HRA",
      "company_name": "M. KAPPEL Entsorgungs GmbH & Co. KG",
      "company_seat": "Fellbach",
      "details": "28.07.2025 (Bekanntmachungsdatum)\n\nBaden-Württemberg Amtsgericht Stuttgart HRA 742093\nRegisterbekanntmachung nach dem Umwandlungsgesetz 28.07.2025 (Eintragungsdatum)\n\nM. KAPPEL Entsorgungs GmbH & Co. KG\nKommanditgesellschaft\nFellbach\n\nAls nicht eingetragen wird bekanntgemacht:\nDen Gläubigern der an der Ausgliederung beteiligten Rechtsträger ist, wenn sie binnen sechs Monaten nach dem Tag, an dem die Eintragung der Ausgliederung in das Register des Sitzes desjenigen Rechtsträgers, dessen Gläubiger sie sind, nach § 19 Abs. 3 UmwG als bekanntgemacht gilt, ihren Anspruch nach Grund und Höhe schriftlich anmelden, Sicherheit zu leisten, soweit sie nicht Befriedigung verlangen können. Dieses Recht steht den Gläubigern jedoch nur zu, wenn sie glaubhaft machen, dass durch die Ausgliederung die Erfüllung ihrer Forderung gefährdet wird."
    },
    {
      "date": "2025-07-28",
      "id": "117797",
      "original_text": "Einreichung neuer Dokumente\nSchleswig-Holstein Amtsgericht Flensburg HRB 9373\nSchleswiger Stadtwerke EEG GmbH – Schleswig",
      "type": "Einreichung neuer Dokumente",
      "state": "Schleswig-Holstein",
      "amtsgericht": "Amtsgericht Flensburg",
      "registernummer": "HRB 9373",
      "registerart": "HRB",
      "company_name": "Schleswiger Stadtwerke EEG GmbH",
      "company_seat": "Schleswig",
      "details": "28.07.2025 (Bekanntmachungsdatum)\n\nSchleswig-Holstein Amtsgericht Flensburg HRB 9373\nEinreichung neuer Dokumente\n\nSchleswiger Stadtwerke EEG GmbH\nGesellschaft mit beschränkter Haftung\nSchleswig\n\nNeue Aufsichtsratsliste nach Änderung eingereicht am 28.07.2025."
    },
    {
      "date": "2025-07-28",
      "id": "117798",
      "original_text": "Registerbekanntmachung nach dem Umwandlungsgesetz\nBaden-Württemberg Amtsgericht Stuttgart HRA 742429\noccasii Time OHG – Löchgau",
      "type": "Registerbekanntmachung nach dem Umwandlungsgesetz",
      "state": "Baden-Württemberg",
      "amtsgericht": "Amtsgericht Stuttgart",
      "registernummer": "HRA 742429",
      "registerart": "HRA",
      "company_name": "occasii Time OHG",
      "company_seat": "Löchgau",
      "details": "28.07.2025 (Bekanntmachungsdatum)\n\nBaden-Württemberg Amtsgericht Stuttgart HRA 742429\nRegisterbekanntmachung nach dem Umwandlungsgesetz 28.07.2025 (Eintragungsdatum)\n\noccasii Time OHG\nOffene Handelsgesellschaft\nLöchgau\n\nDen Gläubigern der an der Verschmelzung beteiligten Rechtsträger ist, wenn sie binnen sechs Monaten nach dem Tag, an dem die Eintragung der Verschmelzung in das Register des Sitzes desjenigen Rechtsträgers, dessen Gläubiger sie sind, nach § 19 Abs. 3 UmwG als bekanntgemacht gilt, ihren Anspruch nach Grund und Höhe schriftlich anmelden, Sicherheit zu leisten, soweit sie nicht Befriedigung verlangen können. Dieses Recht steht den Gläubigern jedoch nur zu, wenn sie glaubhaft machen, dass durch die Verschmelzung die Erfüllung ihrer Forderung gefährdet wird."
    },
    {
      "date": "2025-07-28",
      "id": "117799",
      "original_text": "Registerbekanntmachung nach dem Umwandlungsgesetz\nBerlin Amtsgericht Berlin (Charlottenburg) HRB 249439\nOranya Concepts GmbH – Berlin",
      "type": "Registerbekanntmachung nach dem Umwandlungsgesetz",
      "state": "Berlin",
      "amtsgericht": "Amtsgericht Berlin (Charlottenburg)",
      "registernummer": "HRB 249439",
      "registerart": "HRB",
      "company_name": "Oranya Concepts GmbH",
      "company_seat": "Berlin",
      "details": "28.07.2025 (Bekanntmachungsdatum)\n\nBerlin Amtsgericht Berlin (Charlottenburg) HRB 249439\nRegisterbekanntmachung nach dem Umwandlungsgesetz 23.07.2025 (Eintragungsdatum)\n\nOranya Concepts GmbH\nGesellschaft mit beschränkter Haftung\nBerlin\n\nZu Eintragungsnummer 4 vom 23.07.2025 wird als nicht eingetragen veröffentlicht: Den Gläubigern der an der Verschmelzung beteiligten Rechtsträger ist, wenn sie binnen sechs Monaten nach dem Tag, an dem die Eintragung der Verschmelzung in das Register des Sitzes desjenigen Rechtsträgers, dessen Gläubiger sie sind, als bekannt gemacht gilt, ihren Anspruch nach Grund und Höhe schriftlich anmelden, Sicherheit zu leisten, soweit sie nicht Befriedigung verlangen können. Dieses Recht steht den Gläubigern jedoch nur zu, wenn sie glaubhaft machen, dass durch die Verschmelzung die Erfüllung ihrer Forderung gefährdet wird. Das Recht, Sicherheitsleistung zu verlangen, steht Gläubigern nicht zu, die im Falle der Insolvenz ein Recht auf vorzugsweise Befriedigung aus einer Deckungsmasse haben, die nach gesetzlicher Vorschrift zu ihrem Schutz errichtet und staatlich überwacht ist."
    },
    {
      "date": "2025-07-28",
      "id": "117800",
      "original_text": "Einreichung neuer Dokumente\nBrandenburg Amtsgericht Cottbus HRB 687\nBASF Schwarzheide GmbH – Schwarzheide",
      "type": "Einreichung neuer Dokumente",
      "state": "Brandenburg",
      "amtsgericht": "Amtsgericht Cottbus",
      "registernummer": "HRB 687",
      "registerart": "HRB",
      "company_name": "BASF Schwarzheide GmbH",
      "company_seat": "Schwarzheide",
      "details": "28.07.2025 (Bekanntmachungsdatum)\n\nBrandenburg Amtsgericht Cottbus HRB 687\nEinreichung neuer Dokumente\n\nBASF Schwarzheide GmbH\nGesellschaft mit beschränkter Haftung\nSchwarzheide\n\nDer Geschäftsführer hat eine Liste der Aufsichtsratsmitglieder gem. § 52 Abs. 2 Satz 2 GmbHG zum Handelsregister eingereicht"
    },
    {
      "date": "2025-07-28",
      "id": "117801",
      "original_text": "Einreichung neuer Dokumente\nBrandenburg Amtsgericht Neuruppin HRB 907\nFWG- Fernwärmegesellschaft mit beschränkter Haftung Templin – Templin",
      "type": "Einreichung neuer Dokumente",
      "state": "Brandenburg",
      "amtsgericht": "Amtsgericht Neuruppin",
      "registernummer": "HRB 907",
      "registerart": "HRB",
      "company_name": "FWG- Fernwärmegesellschaft mit beschränkter Haftung Templin",
      "company_seat": "Templin",
      "details": "28.07.2025 (Bekanntmachungsdatum)\n\nBrandenburg Amtsgericht Neuruppin HRB 907\nEinreichung neuer Dokumente\n\nFWG- Fernwärmegesellschaft mit beschränkter Haftung Templin\nGesellschaft mit beschränkter Haftung\nTemplin\n\nAls nicht eingetragen wird veröffentlicht: Eine Liste der Mitglieder des Aufsichtsrates wurde zum Handelsregister eingereicht."
    },
    {
      "date": "2025-07-28",
      "id": "117802",
      "original_text": "Sonstige Registerbekanntmachung\nHamburg Amtsgericht Hamburg VR 4934\nBWV Nord - Das Berufsbildungswerk der Versicherungswirtschaft Norddeutschlands e.V. – Hamburg",
      "type": "Sonstige Registerbekanntmachung",
      "state": "Hamburg",
      "amtsgericht": "Amtsgericht Hamburg",
      "registernummer": "VR 4934",
      "registerart": "VR",
      "company_name": "BWV Nord - Das Berufsbildungswerk der Versicherungswirtschaft Norddeutschlands e.V.",
      "company_seat": "Hamburg",
      "details": "28.07.2025 (Bekanntmachungsdatum)\n\nHamburg Amtsgericht Hamburg VR 4934\nSonstige Registerbekanntmachung 23.07.2025 (Eintragungsdatum)\n\nBWV Nord - Das Berufsbildungswerk der Versicherungswirtschaft Norddeutschlands e.V.\neingetragener Verein\nHamburg\n\nDer Verein ist als übernehmender Rechtsträger nach Maßgabe des Verschmelzungsvertrages vom 11.11.2024 sowie der Zustimmungsbeschlüsse ihrer Mitgliederversammlung vom 11.04.2025 und der Mitgliederversammlung des übertragenden Rechtsträgers vom 02.04.2025 mit dem Berufsbildungswerk der Versicherungswirtschaft (BWV) Schleswig-Holstein/Mecklenburg-Vorpommern e.V. mit Sitz in Kiel (Amtsgericht Kiel VR 3403 KI) verschmolzen worden.\nAls nicht eingetragen wird bekannt gemacht:\nDen Gläubigern der an der Verschmelzung beteiligten Rechtsträger ist, wenn sie binnen sechs Monaten nach dem Tag, an dem die Eintragung der Verschmelzung in das Register des Sitzes desjenigen Rechtsträgers, dessen Gläubiger sie sind, nach § 19 Absatz 3 UmwG als bekannt gemacht gilt, ihren Anspruch nach Grund und Höhe schriftlich anmelden, Sicherheit zu leisten, soweit sie nicht Befriedigung verlangen können. Dieses Recht steht den Gläubigern jedoch nur zu, wenn sie glaubhaft machen, dass durch die Verschmelzung die Erfüllung ihrer Forderung gefährdet wird."
    },
    {
      "date": "2025-07-28",
      "id": "117803",
      "original_text": "Registerbekanntmachung nach dem Umwandlungsgesetz\nBaden-Württemberg Amtsgericht Ulm HRB 743891\nDIVACO Providus Holding GmbH – Langenburg",
      "type": "Registerbekanntmachung nach dem Umwandlungsgesetz",
      "state": "Baden-Württemberg",
      "amtsgericht": "Amtsgericht Ulm",
      "registernummer": "HRB 743891",
      "registerart": "HRB",
      "company_name": "DIVACO Providus Holding GmbH",
      "company_seat": "Langenburg",
      "details": "28.07.2025 (Bekanntmachungsdatum)\n\nBaden-Württemberg Amtsgericht Ulm HRB 743891\nRegisterbekanntmachung nach dem Umwandlungsgesetz 28.07.2025 (Eintragungsdatum)\n\nDIVACO Providus Holding GmbH\nGesellschaft mit beschränkter Haftung\nLangenburg\n\nAls nicht eingetragen wird bekanntgemacht:\nDen Gläubigern der an der Verschmelzung beteiligten Rechtsträger ist, wenn sie binnen sechs Monaten nach dem Tag, an dem die Eintragung der Verschmelzung in das Register des Sitzes desjenigen Rechtsträgers, dessen Gläubiger sie sind, nach § 19 Abs. 3 UmwG als bekanntgemacht gilt, ihren Anspruch nach Grund und Höhe schriftlich anmelden, Sicherheit zu leisten, soweit sie nicht Befriedigung verlangen können. Dieses Recht steht den Gläubigern jedoch nur zu, wenn sie glaubhaft machen, dass durch die Verschmelzung die Erfüllung ihrer Forderung gefährdet wird."
    },
    {
      "date": "2025-07-28",
      "id": "117804",
      "original_text": "Registerbekanntmachung nach dem Umwandlungsgesetz\nBaden-Württemberg Amtsgericht Ulm HRB 747173\nProvidus Cura GmbH – Langenburg",
      "type": "Registerbekanntmachung nach dem Umwandlungsgesetz",
      "state": "Baden-Württemberg",
      "amtsgericht": "Amtsgericht Ulm",
      "registernummer": "HRB 747173",
      "registerart": "HRB",
      "company_name": "Providus Cura GmbH",
      "company_seat": "Langenburg",
      "details": "28.07.2025 (Bekanntmachungsdatum)\n\nBaden-Württemberg Amtsgericht Ulm HRB 747173\nRegisterbekanntmachung nach dem Umwandlungsgesetz 28.07.2025 (Eintragungsdatum)\n\nProvidus Cura GmbH\nGesellschaft mit beschränkter Haftung\nLangenburg\n\nAls nicht eingetragen wird bekanntgemacht:\nDen Gläubigern der an der Verschmelzung beteiligten Rechtsträger ist, wenn sie binnen sechs Monaten nach dem Tag, an dem die Eintragung der Verschmelzung in das Register des Sitzes desjenigen Rechtsträgers, dessen Gläubiger sie sind, nach § 19 Abs. 3 UmwG als bekanntgemacht gilt, ihren Anspruch nach Grund und Höhe schriftlich anmelden, Sicherheit zu leisten, soweit sie nicht Befriedigung verlangen können. Dieses Recht steht den Gläubigern jedoch nur zu, wenn sie glaubhaft machen, dass durch die Verschmelzung die Erfüllung ihrer Forderung gefährdet wird."
    },
    {
      "date": "2025-07-28",
      "id": "117805",
      "original_text": "Registerbekanntmachung nach dem Umwandlungsgesetz\nMecklenburg-Vorpommern Amtsgericht Schwerin HRB 5893\nFIT Freizeit-, Infrastruktur- und Tourismusservice Schwerin GmbH – Schwerin",
      "type": "Registerbekanntmachung nach dem Umwandlungsgesetz",
      "state": "Mecklenburg-Vorpommern",
      "amtsgericht": "Amtsgericht Schwerin",
      "registernummer": "HRB 5893",
      "registerart": "HRB",
      "company_name": "FIT Freizeit-, Infrastruktur- und Tourismusservice Schwerin GmbH",
      "company_seat": "Schwerin",
      "details": "28.07.2025 (Bekanntmachungsdatum)\n\nMecklenburg-Vorpommern Amtsgericht Schwerin HRB 5893\nRegisterbekanntmachung nach dem Umwandlungsgesetz 28.07.2025 (Eintragungsdatum)\n\nFIT Freizeit-, Infrastruktur- und Tourismusservice Schwerin GmbH\nGesellschaft mit beschränkter Haftung\nSchwerin\n\nDie Gesellschaft hat Gläubigern, deren Forderungen vor dieser Bekanntmachung begründet worden sind, Sicherheit zu leisten, soweit sie nicht Befriedigung verlangen können, wenn sie sich binnen sechs Monaten zu diesem Zweck melden."
    },
    {
      "date": "2025-07-28",
      "id": "117806",
      "original_text": "Registerbekanntmachung nach dem Umwandlungsgesetz\nMecklenburg-Vorpommern Amtsgericht Schwerin HRB 1603\nStadtwerke Schwerin GmbH (SWS) – Schwerin",
      "type": "Registerbekanntmachung nach dem Umwandlungsgesetz",
      "state": "Mecklenburg-Vorpommern",
      "amtsgericht": "Amtsgericht Schwerin",
      "registernummer": "HRB 1603",
      "registerart": "HRB",
      "company_name": "Stadtwerke Schwerin GmbH (SWS)",
      "company_seat": "Schwerin",
      "details": "28.07.2025 (Bekanntmachungsdatum)\n\nMecklenburg-Vorpommern Amtsgericht Schwerin HRB 1603\nRegisterbekanntmachung nach dem Umwandlungsgesetz 28.07.2025 (Eintragungsdatum)\n\nStadtwerke Schwerin GmbH (SWS)\nGesellschaft mit beschränkter Haftung\nSchwerin\n\nDie Gesellschaft hat Gläubigern, deren Forderungen vor dieser Bekanntmachung begründet worden sind, Sicherheit zu leisten, soweit sie nicht Befriedigung verlangen können, wenn sie sich binnen sechs Monaten zu diesem Zweck melden."
    },
    {
      "date": "2025-07-28",
      "id": "117807",
      "original_text": "Registerbekanntmachung nach dem Umwandlungsgesetz\nBaden-Württemberg Amtsgericht Ulm HRB 746707\nHuss Vermögensverwaltung GmbH – Holzkirch",
      "type": "Registerbekanntmachung nach dem Umwandlungsgesetz",
      "state": "Baden-Württemberg",
      "amtsgericht": "Amtsgericht Ulm",
      "registernummer": "HRB 746707",
      "registerart": "HRB",
      "company_name": "Huss Vermögensverwaltung GmbH",
      "company_seat": "Holzkirch",
      "details": "28.07.2025 (Bekanntmachungsdatum)\n\nBaden-Württemberg Amtsgericht Ulm HRB 746707\nRegisterbekanntmachung nach dem Umwandlungsgesetz 28.07.2025 (Eintragungsdatum)\n\nHuss Vermögensverwaltung GmbH\nGesellschaft mit beschränkter Haftung\nHolzkirch\n\nAls nicht eingetragen wird bekanntgemacht:\nDen Gläubigern der an der Verschmelzung beteiligten Rechtsträger ist, wenn sie binnen sechs Monaten nach dem Tag, an dem die Eintragung der Verschmelzung in das Register des Sitzes desjenigen Rechtsträgers, dessen Gläubiger sie sind, nach § 19 Abs. 3 UmwG als bekanntgemacht gilt, ihren Anspruch nach Grund und Höhe schriftlich anmelden, Sicherheit zu leisten, soweit sie nicht Befriedigung verlangen können. Dieses Recht steht den Gläubigern jedoch nur zu, wenn sie glaubhaft machen, dass durch die Verschmelzung die Erfüllung ihrer Forderung gefährdet wird."
    },
    {
      "date": "2025-07-28",
      "id": "117808",
      "original_text": "Registerbekanntmachung nach dem Umwandlungsgesetz\nBaden-Württemberg Amtsgericht Ulm HRB 702261\nLORCHER Klimabeteiligungen GmbH – Lorch",
      "type": "Registerbekanntmachung nach dem Umwandlungsgesetz",
      "state": "Baden-Württemberg",
      "amtsgericht": "Amtsgericht Ulm",
      "registernummer": "HRB 702261",
      "registerart": "HRB",
      "company_name": "LORCHER Klimabeteiligungen GmbH",
      "company_seat": "Lorch",
      "details": "28.07.2025 (Bekanntmachungsdatum)\n\nBaden-Württemberg Amtsgericht Ulm HRB 702261\nRegisterbekanntmachung nach dem Umwandlungsgesetz 28.07.2025 (Eintragungsdatum)\n\nLORCHER Klimabeteiligungen GmbH\nGesellschaft mit beschränkter Haftung\nLorch\n\nAls nicht eingetragen wird bekanntgemacht:\nDen Gläubigern der an der Verschmelzung beteiligten Rechtsträger ist, wenn sie binnen sechs Monaten nach dem Tag, an dem die Eintragung der Verschmelzung in das Register des Sitzes desjenigen Rechtsträgers, dessen Gläubiger sie sind, nach § 19 Abs. 3 UmwG als bekanntgemacht gilt, ihren Anspruch nach Grund und Höhe schriftlich anmelden, Sicherheit zu leisten, soweit sie nicht Befriedigung verlangen können. Dieses Recht steht den Gläubigern jedoch nur zu, wenn sie glaubhaft machen, dass durch die Verschmelzung die Erfüllung ihrer Forderung gefährdet wird."
    },
    {
      "date": "2025-07-28",
      "id": "117809",
      "original_text": "Registerbekanntmachung nach dem Umwandlungsgesetz\nBaden-Württemberg Amtsgericht Ulm HRB 700219\nParadair Apparatebau GmbH – Lorch",
      "type": "Registerbekanntmachung nach dem Umwandlungsgesetz",
      "state": "Baden-Württemberg",
      "amtsgericht": "Amtsgericht Ulm",
      "registernummer": "HRB 700219",
      "registerart": "HRB",
      "company_name": "Paradair Apparatebau GmbH",
      "company_seat": "Lorch",
      "details": "28.07.2025 (Bekanntmachungsdatum)\n\nBaden-Württemberg Amtsgericht Ulm HRB 700219\nRegisterbekanntmachung nach dem Umwandlungsgesetz 28.07.2025 (Eintragungsdatum)\n\nParadair Apparatebau GmbH\nGesellschaft mit beschränkter Haftung\nLorch\n\nAls nicht eingetragen wird bekanntgemacht:\nDen Gläubigern der an der Verschmelzung beteiligten Rechtsträger ist, wenn sie binnen sechs Monaten nach dem Tag, an dem die Eintragung der Verschmelzung in das Register des Sitzes desjenigen Rechtsträgers, dessen Gläubiger sie sind, nach § 19 Abs. 3 UmwG als bekanntgemacht gilt, ihren Anspruch nach Grund und Höhe schriftlich anmelden, Sicherheit zu leisten, soweit sie nicht Befriedigung verlangen können. Dieses Recht steht den Gläubigern jedoch nur zu, wenn sie glaubhaft machen, dass durch die Verschmelzung die Erfüllung ihrer Forderung gefährdet wird."
    },
    {
      "date": "2025-07-28",
      "id": "117810",
      "original_text": "Registerbekanntmachung nach dem Umwandlungsgesetz\nSachsen-Anhalt Amtsgericht Stendal HRB 35591\nKronos Software Holding GmbH – Magdeburg",
      "type": "Registerbekanntmachung nach dem Umwandlungsgesetz",
      "state": "Sachsen-Anhalt",
      "amtsgericht": "Amtsgericht Stendal",
      "registernummer": "HRB 35591",
      "registerart": "HRB",
      "company_name": "Kronos Software Holding GmbH",
      "company_seat": "Magdeburg",
      "details": "28.07.2025 (Bekanntmachungsdatum)\n\nSachsen-Anhalt Amtsgericht Stendal HRB 35591\nRegisterbekanntmachung nach dem Umwandlungsgesetz 28.07.2025 (Eintragungsdatum)\n\nKronos Software Holding GmbH\nGesellschaft mit beschränkter Haftung\nMagdeburg\n\nNicht eingetragen:\nDen Gläubigern der an der Verschmelzung beteiligten Rechtsträger ist, wenn sie binnen sechs Monaten nach dem Tag, an dem die Eintragung der Verschmelzung nach § 19 Abs. 3 UmwG als bekanntgemacht gilt, ihren Anspruch nach Grund und Höhe schriftlich anmelden, Sicherheit zu leisten, soweit sie nicht Befriedigung verlangen können. Dieses Recht steht ihnen jedoch nur zu, wenn sie glaubhaft machen, dass durch die Verschmelzung die Erfüllung ihrer Forderung gefährdet wird."
    },
    {
      "date": "2025-07-28",
      "id": "117811",
      "original_text": "Registerbekanntmachung nach dem Umwandlungsgesetz\nSachsen-Anhalt Amtsgericht Stendal HRB 30940\nSelectLine Holding GmbH – Magdeburg",
      "type": "Registerbekanntmachung nach dem Umwandlungsgesetz",
      "state": "Sachsen-Anhalt",
      "amtsgericht": "Amtsgericht Stendal",
      "registernummer": "HRB 30940",
      "registerart": "HRB",
      "company_name": "SelectLine Holding GmbH",
      "company_seat": "Magdeburg",
      "details": "28.07.2025 (Bekanntmachungsdatum)\n\nSachsen-Anhalt Amtsgericht Stendal HRB 30940\nRegisterbekanntmachung nach dem Umwandlungsgesetz 28.07.2025 (Eintragungsdatum)\n\nSelectLine Holding GmbH\nGesellschaft mit beschränkter Haftung\nMagdeburg\n\nNicht eingetragen:\nDen Gläubigern der an der Verschmelzung beteiligten Rechtsträger ist, wenn sie binnen sechs Monaten nach dem Tag, an dem die Eintragung der Verschmelzung nach § 19 Abs. 3 UmwG als bekanntgemacht gilt, ihren Anspruch nach Grund und Höhe schriftlich anmelden, Sicherheit zu leisten, soweit sie nicht Befriedigung verlangen können. Dieses Recht steht ihnen jedoch nur zu, wenn sie glaubhaft machen, dass durch die Verschmelzung die Erfüllung ihrer Forderung gefährdet wird."
    },
    {
      "date": "2025-07-28",
      "id": "117812",
      "original_text": "Registerbekanntmachung nach dem Umwandlungsgesetz\nSachsen-Anhalt Amtsgericht Stendal HRB 35466\nKronos Beteiligungsgesellschaft mbH – Magdeburg",
      "type": "Registerbekanntmachung nach dem Umwandlungsgesetz",
      "state": "Sachsen-Anhalt",
      "amtsgericht": "Amtsgericht Stendal",
      "registernummer": "HRB 35466",
      "registerart": "HRB",
      "company_name": "Kronos Beteiligungsgesellschaft mbH",
      "company_seat": "Magdeburg",
      "details": "28.07.2025 (Bekanntmachungsdatum)\n\nSachsen-Anhalt Amtsgericht Stendal HRB 35466\nRegisterbekanntmachung nach dem Umwandlungsgesetz 28.07.2025 (Eintragungsdatum)\n\nKronos Beteiligungsgesellschaft mbH\nGesellschaft mit beschränkter Haftung\nMagdeburg\n\nNicht eingetragen:\nDen Gläubigern der an der Verschmelzung beteiligten Rechtsträger ist, wenn sie binnen sechs Monaten nach dem Tag, an dem die Eintragung der Verschmelzung nach § 19 Abs. 3 UmwG als bekanntgemacht gilt, ihren Anspruch nach Grund und Höhe schriftlich anmelden, Sicherheit zu leisten, soweit sie nicht Befriedigung verlangen können. Dieses Recht steht ihnen jedoch nur zu, wenn sie glaubhaft machen, dass durch die Verschmelzung die Erfüllung ihrer Forderung gefährdet wird."
    },
    {
      "date": "2025-07-28",
      "id": "117813",
      "original_text": "Registerbekanntmachung nach dem Umwandlungsgesetz\nSachsen-Anhalt Amtsgericht Stendal HRB 115209\nDarjes GmbH – Magdeburg",
      "type": "Registerbekanntmachung nach dem Umwandlungsgesetz",
      "state": "Sachsen-Anhalt",
      "amtsgericht": "Amtsgericht Stendal",
      "registernummer": "HRB 115209",
      "registerart": "HRB",
      "company_name": "Darjes GmbH",
      "company_seat": "Magdeburg",
      "details": "28.07.2025 (Bekanntmachungsdatum)\n\nSachsen-Anhalt Amtsgericht Stendal HRB 115209\nRegisterbekanntmachung nach dem Umwandlungsgesetz 28.07.2025 (Eintragungsdatum)\n\nDarjes GmbH\nGesellschaft mit beschränkter Haftung\nMagdeburg\n\nNicht eingetragen:\nDen Gläubigern der an der Verschmelzung beteiligten Rechtsträger ist, wenn sie binnen sechs Monaten nach dem Tag, an dem die Eintragung der Verschmelzung nach § 19 Abs. 3 UmwG als bekanntgemacht gilt, ihren Anspruch nach Grund und Höhe schriftlich anmelden, Sicherheit zu leisten, soweit sie nicht Befriedigung verlangen können. Dieses Recht steht ihnen jedoch nur zu, wenn sie glaubhaft machen, dass durch die Verschmelzung die Erfüllung ihrer Forderung gefährdet wird."
    },
    {
      "date": "2025-07-28",
      "id": "117814",
      "original_text": "Registerbekanntmachung nach dem Umwandlungsgesetz\nSachsen-Anhalt Amtsgericht Stendal HRB 14201\nElbe Grundbesitz GmbH – Magdeburg",
      "type": "Registerbekanntmachung nach dem Umwandlungsgesetz",
      "state": "Sachsen-Anhalt",
      "amtsgericht": "Amtsgericht Stendal",
      "registernummer": "HRB 14201",
      "registerart": "HRB",
      "company_name": "Elbe Grundbesitz GmbH",
      "company_seat": "Magdeburg",
      "details": "28.07.2025 (Bekanntmachungsdatum)\n\nSachsen-Anhalt Amtsgericht Stendal HRB 14201\nRegisterbekanntmachung nach dem Umwandlungsgesetz 28.07.2025 (Eintragungsdatum)\n\nElbe Grundbesitz GmbH\nGesellschaft mit beschränkter Haftung\nMagdeburg\n\nNicht eingetragen:\nDen Gläubigern der an der Verschmelzung beteiligten Rechtsträger ist, wenn sie binnen sechs Monaten nach dem Tag, an dem die Eintragung der Verschmelzung nach § 19 Abs. 3 UmwG als bekanntgemacht gilt, ihren Anspruch nach Grund und Höhe schriftlich anmelden, Sicherheit zu leisten, soweit sie nicht Befriedigung verlangen können. Dieses Recht steht ihnen jedoch nur zu, wenn sie glaubhaft machen, dass durch die Verschmelzung die Erfüllung ihrer Forderung gefährdet wird."
    },
    {
      "date": "2025-07-28",
      "id": "117815",
      "original_text": "Löschungsankündigung\nBaden-Württemberg Amtsgericht Stuttgart HRA 734330\nGastro One GmbH & Co. KG – Stuttgart",
      "type": "Löschungsankündigung",
      "state": "Baden-Württemberg",
      "amtsgericht": "Amtsgericht Stuttgart",
      "registernummer": "HRA 734330",
      "registerart": "HRA",
      "company_name": "Gastro One GmbH & Co. KG",
      "company_seat": "Stuttgart",
      "details": "28.07.2025 (Bekanntmachungsdatum)\n\nBaden-Württemberg Amtsgericht Stuttgart HRA 734330\nLöschungsankündigung\n\nGastro One GmbH & Co. KG\nKommanditgesellschaft\nStuttgart\n\nDas Gericht beabsichtigt, die Gesellschaft wegen Vermögenslosigkeit im Handelsregister von Amts wegen nach § 394 FamFG zu löschen. Die Frist zur Geltendmachung eines Widerspruchs gegen die beabsichtigte Löschung ist auf zwei Monate ab Veröffentlichung bestimmt."
    },
    {
      "date": "2025-07-28",
      "id": "117816",
      "original_text": "Einreichung neuer Dokumente\nBerlin Amtsgericht Berlin (Charlottenburg) HRB 127347\nStorengy Deutschland Infrastructures GmbH – Berlin",
      "type": "Einreichung neuer Dokumente",
      "state": "Berlin",
      "amtsgericht": "Amtsgericht Berlin (Charlottenburg)",
      "registernummer": "HRB 127347",
      "registerart": "HRB",
      "company_name": "Storengy Deutschland Infrastructures GmbH",
      "company_seat": "Berlin",
      "details": "28.07.2025 (Bekanntmachungsdatum)\n\nBerlin Amtsgericht Berlin (Charlottenburg) HRB 127347\nEinreichung neuer Dokumente\n\nStorengy Deutschland Infrastructures GmbH\nGesellschaft mit beschränkter Haftung\nBerlin\n\nAls nicht eingetragen wird veröffentlicht: Es wurde eine neue Liste der Aufsichtsratsmitglieder eingereicht (§52 GmbHG)."
    },
    {
      "date": "2025-07-28",
      "id": "117817",
      "original_text": "Registerbekanntmachung nach dem Umwandlungsgesetz\nBaden-Württemberg Amtsgericht Freiburg HRB 706926\nKnoblauch Design GmbH – Markdorf",
      "type": "Registerbekanntmachung nach dem Umwandlungsgesetz",
      "state": "Baden-Württemberg",
      "amtsgericht": "Amtsgericht Freiburg",
      "registernummer": "HRB 706926",
      "registerart": "HRB",
      "company_name": "Knoblauch Design GmbH",
      "company_seat": "Markdorf",
      "details": "28.07.2025 (Bekanntmachungsdatum)\n\nBaden-Württemberg Amtsgericht Freiburg HRB 706926\nRegisterbekanntmachung nach dem Umwandlungsgesetz 28.07.2025 (Eintragungsdatum)\n\nKnoblauch Design GmbH\nGesellschaft mit beschränkter Haftung\nMarkdorf\n\nAls nicht eingetragen wird bekanntgemacht:\nDen Gläubigern der an der Verschmelzung beteiligten Rechtsträger ist, wenn sie binnen sechs Monaten nach dem Tag, an dem die Eintragung der Verschmelzung in das Register des Sitzes desjenigen Rechtsträgers, dessen Gläubiger sie sind, nach § 19 Abs. 3 UmwG als bekanntgemacht gilt, ihren Anspruch nach Grund und Höhe schriftlich anmelden, Sicherheit zu leisten, soweit sie nicht Befriedigung verlangen können. Dieses Recht steht den Gläubigern jedoch nur zu, wenn sie glaubhaft machen, dass durch die Verschmelzung die Erfüllung ihrer Forderung gefährdet wird."
    },
    {
      "date": "2025-07-28",
      "id": "117818",
      "original_text": "Registerbekanntmachung nach dem Umwandlungsgesetz\nSachsen Amtsgericht Leipzig HRB 35933\nLVP Apartment GmbH – Leipzig",
      "type": "Registerbekanntmachung nach dem Umwandlungsgesetz",
      "state": "Sachsen",
      "amtsgericht": "Amtsgericht Leipzig",
      "registernummer": "HRB 35933",
      "registerart": "HRB",
      "company_name": "LVP Apartment GmbH",
      "company_seat": "Leipzig",
      "details": "28.07.2025 (Bekanntmachungsdatum)\n\nSachsen Amtsgericht Leipzig HRB 35933\nRegisterbekanntmachung nach dem Umwandlungsgesetz 28.07.2025 (Eintragungsdatum)\n\nLVP Apartment GmbH\nGesellschaft mit beschränkter Haftung\nLeipzig\n\nDen Gläubigern der an der Verschmelzung beteiligten Rechtsträger ist, wenn sie binnen sechs Monaten nach dem Tag, an dem die Eintragung der Verschmelzung in das Register des Sitzes desjenigen Rechtsträgers, dessen Gläubiger sie sind, nach § 19 Abs. 3 UmwG als bekannt gemacht gilt, ihren Anspruch nach Grund und Höhe in Textform anmelden, Sicherheit zu leisten, soweit sie nicht Befriedigung verlangen können. Dieses Recht steht den Gläubigern jedoch nur zu, wenn sie glaubhaft machen, dass durch die Verschmelzung die Erfüllung der Forderung gefährdet wird."
    },
    {
      "date": "2025-07-28",
      "id": "117819",
      "original_text": "Registerbekanntmachung nach dem Umwandlungsgesetz\nSachsen Amtsgericht Dresden HRB 27365\nLeopolder Vertriebs GmbH – Großenhain",
      "type": "Registerbekanntmachung nach dem Umwandlungsgesetz",
      "state": "Sachsen",
      "amtsgericht": "Amtsgericht Dresden",
      "registernummer": "HRB 27365",
      "registerart": "HRB",
      "company_name": "Leopolder Vertriebs GmbH",
      "company_seat": "Großenhain",
      "details": "28.07.2025 (Bekanntmachungsdatum)\n\nSachsen Amtsgericht Dresden HRB 27365\nRegisterbekanntmachung nach dem Umwandlungsgesetz\n\nLeopolder Vertriebs GmbH\nGesellschaft mit beschränkter Haftung\nGroßenhain\n\nBeim Handelsregister Dresden ist der Entwurf eines Verschmelzungsplans eingereicht worden,\ngemäß § 308 UmwG wird veröffentlicht: Die Leopolder Vertriebs GmbH, Amtsgericht\nDresden, HRB 27365 ist übertragender Rechtsträger und die Leopolder Vertriebs GmbH mit dem\nSitz in Kuchl, Österreich, Firmenbuch beim Landgericht Salzburg, Österreich, Fn 312205 a ist\nübernehmender Rechtsträger. Ein Hinweis geht hiermit an folgende Personen, dass sie der\njeweiligen Gesellschaft spätestens fünf Arbeitstage vor dem Tag der Gesellschafterversammlung Bemerkungen zum Verschmelzungsplan übermitteln können: An die Anteilsinhaber und Gläubiger der an der grenzüberschreitenden Verschmelzung beteiligten Gesellschaften sowie an die zuständigen Betriebsräte der an der grenzüberschreitenden Verschmelzung beteiligten Gesellschaften oder, soweit es keinen Betriebsrat gibt, an die Arbeitnehmer der an der grenzüberschreitenden Verschmelzung beteiligten Gesellschaften."
    },
    {
      "date": "2025-07-28",
      "id": "117820",
      "original_text": "Registerbekanntmachung nach dem Umwandlungsgesetz\nSachsen Amtsgericht Chemnitz HRB 17076\nStraßenbahn-Bus GmbH Plauen – Plauen",
      "type": "Registerbekanntmachung nach dem Umwandlungsgesetz",
      "state": "Sachsen",
      "amtsgericht": "Amtsgericht Chemnitz",
      "registernummer": "HRB 17076",
      "registerart": "HRB",
      "company_name": "Straßenbahn-Bus GmbH Plauen",
      "company_seat": "Plauen",
      "details": "28.07.2025 (Bekanntmachungsdatum)\n\nSachsen Amtsgericht Chemnitz HRB 17076\nRegisterbekanntmachung nach dem Umwandlungsgesetz 28.07.2025 (Eintragungsdatum)\n\nStraßenbahn-Bus GmbH Plauen\nGesellschaft mit beschränkter Haftung\nPlauen\n\nDen Gläubigern der an der Verschmelzung beteiligten Rechtsträger ist, wenn sie binnen sechs Monaten nach dem Tag, an dem die Eintragung der Verschmelzung in das Register des Sitzes desjenigen Rechtsträgers, dessen Gläubiger sie sind, nach § 19 Abs. 3 UmwG als bekannt gemacht gilt, ihren Anspruch nach Grund und Höhe in Textform anmelden, Sicherheit zu leisten, soweit sie nicht Befriedigung verlangen können. Dieses Recht steht den Gläubigern jedoch nur zu, wenn sie glaubhaft machen, dass durch die Verschmelzung die Erfüllung der Forderung gefährdet wird."
    },
    {
      "date": "2025-07-28",
      "id": "117821",
      "original_text": "Registerbekanntmachung nach dem Umwandlungsgesetz\nSachsen Amtsgericht Leipzig HRB 39934\nQUARTERBACK Projekt 38 GmbH – Leipzig",
      "type": "Registerbekanntmachung nach dem Umwandlungsgesetz",
      "state": "Sachsen",
      "amtsgericht": "Amtsgericht Leipzig",
      "registernummer": "HRB 39934",
      "registerart": "HRB",
      "company_name": "QUARTERBACK Projekt 38 GmbH",
      "company_seat": "Leipzig",
      "details": "28.07.2025 (Bekanntmachungsdatum)\n\nSachsen Amtsgericht Leipzig HRB 39934\nRegisterbekanntmachung nach dem Umwandlungsgesetz 28.07.2025 (Eintragungsdatum)\n\nQUARTERBACK Projekt 38 GmbH\nGesellschaft mit beschränkter Haftung\nLeipzig\n\nDen Gläubigern der an der Verschmelzung beteiligten Rechtsträger ist, wenn sie binnen sechs Monaten nach dem Tag, an dem die Eintragung der Verschmelzung in das Register des Sitzes desjenigen Rechtsträgers, dessen Gläubiger sie sind, nach § 19 Abs. 3 UmwG als bekannt gemacht gilt, ihren Anspruch nach Grund und Höhe in Textform anmelden, Sicherheit zu leisten, soweit sie nicht Befriedigung verlangen können. Dieses Recht steht den Gläubigern jedoch nur zu, wenn sie glaubhaft machen, dass durch die Verschmelzung die Erfüllung der Forderung gefährdet wird."
    },
    {
      "date": "2025-07-28",
      "id": "117822",
      "original_text": "Registerbekanntmachung nach dem Umwandlungsgesetz\nSachsen Amtsgericht Leipzig HRB 32473\nVICUS GROUP AG – Leipzig",
      "type": "Registerbekanntmachung nach dem Umwandlungsgesetz",
      "state": "Sachsen",
      "amtsgericht": "Amtsgericht Leipzig",
      "registernummer": "HRB 32473",
      "registerart": "HRB",
      "company_name": "VICUS GROUP AG",
      "company_seat": "Leipzig",
      "details": "28.07.2025 (Bekanntmachungsdatum)\n\nSachsen Amtsgericht Leipzig HRB 32473\nRegisterbekanntmachung nach dem Umwandlungsgesetz 28.07.2025 (Eintragungsdatum)\n\nVICUS GROUP AG\nAktiengesellschaft\nLeipzig\n\nDen Gläubigern der an der Umwandlung beteiligten Rechtsträger ist, wenn sie binnen sechs Monaten nach dem Tag, an dem die Eintragung der Umwandlung in das Register des Sitzes desjenigen Rechtsträgers, dessen Gläubiger sie sind, nach § 19 Abs. 3 UmwG als bekannt gemacht gilt, ihren Anspruch nach Grund und Höhe in Textform anmelden, Sicherheit zu leisten, soweit sie nicht Befriedigung verlangen können. Dieses Recht steht den Gläubigern jedoch nur zu, wenn sie glaubhaft machen, dass durch die Umwandlung die Erfüllung der Forderung gefährdet wird."
    },
    {
      "date": "2025-07-28",
      "id": "117823",
      "original_text": "Registerbekanntmachung nach dem Umwandlungsgesetz\nSachsen Amtsgericht Leipzig HRB 35749\nLE 5 Projekt GmbH – Leipzig",
      "type": "Registerbekanntmachung nach dem Umwandlungsgesetz",
      "state": "Sachsen",
      "amtsgericht": "Amtsgericht Leipzig",
      "registernummer": "HRB 35749",
      "registerart": "HRB",
      "company_name": "LE 5 Projekt GmbH",
      "company_seat": "Leipzig",
      "details": "28.07.2025 (Bekanntmachungsdatum)\n\nSachsen Amtsgericht Leipzig HRB 35749\nRegisterbekanntmachung nach dem Umwandlungsgesetz 28.07.2025 (Eintragungsdatum)\n\nLE 5 Projekt GmbH\nGesellschaft mit beschränkter Haftung\nLeipzig\n\nDen Gläubigern der an der Verschmelzung beteiligten Rechtsträger ist, wenn sie binnen sechs Monaten nach dem Tag, an dem die Eintragung der Verschmelzung in das Register des Sitzes desjenigen Rechtsträgers, dessen Gläubiger sie sind, nach § 19 Abs. 3 UmwG als bekannt gemacht gilt, ihren Anspruch nach Grund und Höhe in Textform anmelden, Sicherheit zu leisten, soweit sie nicht Befriedigung verlangen können. Dieses Recht steht den Gläubigern jedoch nur zu, wenn sie glaubhaft machen, dass durch die Verschmelzung die Erfüllung der Forderung gefährdet wird."
    },
    {
      "date": "2025-07-28",
      "id": "117824",
      "original_text": "Registerbekanntmachung nach dem Umwandlungsgesetz\nSachsen Amtsgericht Leipzig HRB 39935\nQUARTERBACK Projekt 39 GmbH – Leipzig",
      "type": "Registerbekanntmachung nach dem Umwandlungsgesetz",
      "state": "Sachsen",
      "amtsgericht": "Amtsgericht Leipzig",
      "registernummer": "HRB 39935",
      "registerart": "HRB",
      "company_name": "QUARTERBACK Projekt 39 GmbH",
      "company_seat": "Leipzig",
      "details": "28.07.2025 (Bekanntmachungsdatum)\n\nSachsen Amtsgericht Leipzig HRB 39935\nRegisterbekanntmachung nach dem Umwandlungsgesetz 28.07.2025 (Eintragungsdatum)\n\nQUARTERBACK Projekt 39 GmbH\nGesellschaft mit beschränkter Haftung\nLeipzig\n\nDen Gläubigern der an der Verschmelzung beteiligten Rechtsträger ist, wenn sie binnen sechs Monaten nach dem Tag, an dem die Eintragung der Verschmelzung in das Register des Sitzes desjenigen Rechtsträgers, dessen Gläubiger sie sind, nach § 19 Abs. 3 UmwG als bekannt gemacht gilt, ihren Anspruch nach Grund und Höhe in Textform anmelden, Sicherheit zu leisten, soweit sie nicht Befriedigung verlangen können. Dieses Recht steht den Gläubigern jedoch nur zu, wenn sie glaubhaft machen, dass durch die Verschmelzung die Erfüllung der Forderung gefährdet wird."
    },
    {
      "date": "2025-07-28",
      "id": "117825",
      "original_text": "Registerbekanntmachung nach dem Umwandlungsgesetz\nSachsen Amtsgericht Chemnitz HRB 818\nPlauener Straßenbahn GmbH – Plauen",
      "type": "Registerbekanntmachung nach dem Umwandlungsgesetz",
      "state": "Sachsen",
      "amtsgericht": "Amtsgericht Chemnitz",
      "registernummer": "HRB 818",
      "registerart": "HRB",
      "company_name": "Plauener Straßenbahn GmbH",
      "company_seat": "Plauen",
      "details": "28.07.2025 (Bekanntmachungsdatum)\n\nSachsen Amtsgericht Chemnitz HRB 818\nRegisterbekanntmachung nach dem Umwandlungsgesetz 28.07.2025 (Eintragungsdatum)\n\nPlauener Straßenbahn GmbH\nGesellschaft mit beschränkter Haftung\nPlauen\n\nDen Gläubigern der an der Verschmelzung beteiligten Rechtsträger ist, wenn sie binnen sechs Monaten nach dem Tag, an dem die Eintragung der Verschmelzung in das Register des Sitzes desjenigen Rechtsträgers, dessen Gläubiger sie sind, nach § 19 Abs. 3 UmwG als bekannt gemacht gilt, ihren Anspruch nach Grund und Höhe in Textform anmelden, Sicherheit zu leisten, soweit sie nicht Befriedigung verlangen können. Dieses Recht steht den Gläubigern jedoch nur zu, wenn sie glaubhaft machen, dass durch die Verschmelzung die Erfüllung der Forderung gefährdet wird."
    },
    {
      "date": "2025-07-28",
      "id": "117826",
      "original_text": "Registerbekanntmachung nach dem Umwandlungsgesetz\nSachsen Amtsgericht Leipzig HRB 34736\nQUARTERBACK Projekt 9 GmbH – Leipzig",
      "type": "Registerbekanntmachung nach dem Umwandlungsgesetz",
      "state": "Sachsen",
      "amtsgericht": "Amtsgericht Leipzig",
      "registernummer": "HRB 34736",
      "registerart": "HRB",
      "company_name": "QUARTERBACK Projekt 9 GmbH",
      "company_seat": "Leipzig",
      "details": "28.07.2025 (Bekanntmachungsdatum)\n\nSachsen Amtsgericht Leipzig HRB 34736\nRegisterbekanntmachung nach dem Umwandlungsgesetz 28.07.2025 (Eintragungsdatum)\n\nQUARTERBACK Projekt 9 GmbH\nGesellschaft mit beschränkter Haftung\nLeipzig\n\nDen Gläubigern der an der Verschmelzung beteiligten Rechtsträger ist, wenn sie binnen sechs Monaten nach dem Tag, an dem die Eintragung der Verschmelzung in das Register des Sitzes desjenigen Rechtsträgers, dessen Gläubiger sie sind, nach § 19 Abs. 3 UmwG als bekannt gemacht gilt, ihren Anspruch nach Grund und Höhe in Textform anmelden, Sicherheit zu leisten, soweit sie nicht Befriedigung verlangen können. Dieses Recht steht den Gläubigern jedoch nur zu, wenn sie glaubhaft machen, dass durch die Verschmelzung die Erfüllung der Forderung gefährdet wird."
    },
    {
      "date": "2025-07-28",
      "id": "117827",
      "original_text": "Registerbekanntmachung nach dem Umwandlungsgesetz\nSachsen Amtsgericht Leipzig HRB 35989\nBirkenmond Art GmbH – Leipzig",
      "type": "Registerbekanntmachung nach dem Umwandlungsgesetz",
      "state": "Sachsen",
      "amtsgericht": "Amtsgericht Leipzig",
      "registernummer": "HRB 35989",
      "registerart": "HRB",
      "company_name": "Birkenmond Art GmbH",
      "company_seat": "Leipzig",
      "details": "28.07.2025 (Bekanntmachungsdatum)\n\nSachsen Amtsgericht Leipzig HRB 35989\nRegisterbekanntmachung nach dem Umwandlungsgesetz 28.07.2025 (Eintragungsdatum)\n\nBirkenmond Art GmbH\nGesellschaft mit beschränkter Haftung\nLeipzig\n\nDen Gläubigern der an der Verschmelzung beteiligten Rechtsträger ist, wenn sie binnen sechs Monaten nach dem Tag, an dem die Eintragung der Verschmelzung in das Register des Sitzes desjenigen Rechtsträgers, dessen Gläubiger sie sind, nach § 19 Abs. 3 UmwG als bekannt gemacht gilt, ihren Anspruch nach Grund und Höhe in Textform anmelden, Sicherheit zu leisten, soweit sie nicht Befriedigung verlangen können. Dieses Recht steht den Gläubigern jedoch nur zu, wenn sie glaubhaft machen, dass durch die Verschmelzung die Erfüllung der Forderung gefährdet wird."
    },
    {
      "date": "2025-07-28",
      "id": "117828",
      "original_text": "Registerbekanntmachung nach dem Umwandlungsgesetz\nSachsen Amtsgericht Leipzig HRB 44388\nVICUS GROUP GmbH – Leipzig",
      "type": "Registerbekanntmachung nach dem Umwandlungsgesetz",
      "state": "Sachsen",
      "amtsgericht": "Amtsgericht Leipzig",
      "registernummer": "HRB 44388",
      "registerart": "HRB",
      "company_name": "VICUS GROUP GmbH",
      "company_seat": "Leipzig",
      "details": "28.07.2025 (Bekanntmachungsdatum)\n\nSachsen Amtsgericht Leipzig HRB 44388\nRegisterbekanntmachung nach dem Umwandlungsgesetz 28.07.2025 (Eintragungsdatum)\n\nVICUS GROUP GmbH\nGesellschaft mit beschränkter Haftung\nLeipzig\n\nDen Gläubigern der an der Umwandlung beteiligten Rechtsträger ist, wenn sie binnen sechs Monaten nach dem Tag, an dem die Eintragung der Umwandlung in das Register des Sitzes desjenigen Rechtsträgers, dessen Gläubiger sie sind, nach § 19 Abs. 3 UmwG als bekannt gemacht gilt, ihren Anspruch nach Grund und Höhe in Textform anmelden, Sicherheit zu leisten, soweit sie nicht Befriedigung verlangen können. Dieses Recht steht den Gläubigern jedoch nur zu, wenn sie glaubhaft machen, dass durch die Umwandlung die Erfüllung der Forderung gefährdet wird."
    },
    {
      "date": "2025-07-28",
      "id": "117829",
      "original_text": "Registerbekanntmachung nach dem Umwandlungsgesetz\nSachsen Amtsgericht Leipzig HRB 35988\nGondwana Sculptures GmbH – Leipzig",
      "type": "Registerbekanntmachung nach dem Umwandlungsgesetz",
      "state": "Sachsen",
      "amtsgericht": "Amtsgericht Leipzig",
      "registernummer": "HRB 35988",
      "registerart": "HRB",
      "company_name": "Gondwana Sculptures GmbH",
      "company_seat": "Leipzig",
      "details": "28.07.2025 (Bekanntmachungsdatum)\n\nSachsen Amtsgericht Leipzig HRB 35988\nRegisterbekanntmachung nach dem Umwandlungsgesetz 28.07.2025 (Eintragungsdatum)\n\nGondwana Sculptures GmbH\nGesellschaft mit beschränkter Haftung\nLeipzig\n\nDen Gläubigern der an der Verschmelzung beteiligten Rechtsträger ist, wenn sie binnen sechs Monaten nach dem Tag, an dem die Eintragung der Verschmelzung in das Register des Sitzes desjenigen Rechtsträgers, dessen Gläubiger sie sind, nach § 19 Abs. 3 UmwG als bekannt gemacht gilt, ihren Anspruch nach Grund und Höhe in Textform anmelden, Sicherheit zu leisten, soweit sie nicht Befriedigung verlangen können. Dieses Recht steht den Gläubigern jedoch nur zu, wenn sie glaubhaft machen, dass durch die Verschmelzung die Erfüllung der Forderung gefährdet wird."
    },
    {
      "date": "2025-07-28",
      "id": "117830",
      "original_text": "Registerbekanntmachung nach dem Umwandlungsgesetz\nSachsen Amtsgericht Leipzig HRB 11142\nSensLab - Gesellschaft zur Entwicklung und Herstellung bioelektrochemischer Sensoren mbH – Leipzig",
      "type": "Registerbekanntmachung nach dem Umwandlungsgesetz",
      "state": "Sachsen",
      "amtsgericht": "Amtsgericht Leipzig",
      "registernummer": "HRB 11142",
      "registerart": "HRB",
      "company_name": "SensLab - Gesellschaft zur Entwicklung und Herstellung bioelektrochemischer Sensoren mbH",
      "company_seat": "Leipzig",
      "details": "28.07.2025 (Bekanntmachungsdatum)\n\nSachsen Amtsgericht Leipzig HRB 11142\nRegisterbekanntmachung nach dem Umwandlungsgesetz 28.07.2025 (Eintragungsdatum)\n\nSensLab - Gesellschaft zur Entwicklung und Herstellung bioelektrochemischer Sensoren mbH\nGesellschaft mit beschränkter Haftung\nLeipzig\n\nDen Gläubigern der an der Verschmelzung beteiligten Rechtsträger ist, wenn sie binnen sechs Monaten nach dem Tag, an dem die Eintragung der Verschmelzung in das Register des Sitzes desjenigen Rechtsträgers, dessen Gläubiger sie sind, nach § 19 Abs. 3 UmwG als bekannt gemacht gilt, ihren Anspruch nach Grund und Höhe in Textform anmelden, Sicherheit zu leisten, soweit sie nicht Befriedigung verlangen können. Dieses Recht steht den Gläubigern jedoch nur zu, wenn sie glaubhaft machen, dass durch die Verschmelzung die Erfüllung der Forderung gefährdet wird."
    },
    {
      "date": "2025-07-28",
      "id": "117831",
      "original_text": "Registerbekanntmachung nach dem Umwandlungsgesetz\nSachsen Amtsgericht Leipzig HRB 34754\nLE Quartier 12 GmbH – Leipzig",
      "type": "Registerbekanntmachung nach dem Umwandlungsgesetz",
      "state": "Sachsen",
      "amtsgericht": "Amtsgericht Leipzig",
      "registernummer": "HRB 34754",
      "registerart": "HRB",
      "company_name": "LE Quartier 12 GmbH",
      "company_seat": "Leipzig",
      "details": "28.07.2025 (Bekanntmachungsdatum)\n\nSachsen Amtsgericht Leipzig HRB 34754\nRegisterbekanntmachung nach dem Umwandlungsgesetz 28.07.2025 (Eintragungsdatum)\n\nLE Quartier 12 GmbH\nGesellschaft mit beschränkter Haftung\nLeipzig\n\nDen Gläubigern der an der Verschmelzung beteiligten Rechtsträger ist, wenn sie binnen sechs Monaten nach dem Tag, an dem die Eintragung der Verschmelzung in das Register des Sitzes desjenigen Rechtsträgers, dessen Gläubiger sie sind, nach § 19 Abs. 3 UmwG als bekannt gemacht gilt, ihren Anspruch nach Grund und Höhe in Textform anmelden, Sicherheit zu leisten, soweit sie nicht Befriedigung verlangen können. Dieses Recht steht den Gläubigern jedoch nur zu, wenn sie glaubhaft machen, dass durch die Verschmelzung die Erfüllung der Forderung gefährdet wird."
    },
    {
      "date": "2025-07-28",
      "id": "117832",
      "original_text": "Einreichung neuer Dokumente\nBaden-Württemberg Amtsgericht Stuttgart HRB 14562\nIBM Deutschland GmbH – Ehningen",
      "type": "Einreichung neuer Dokumente",
      "state": "Baden-Württemberg",
      "amtsgericht": "Amtsgericht Stuttgart",
      "registernummer": "HRB 14562",
      "registerart": "HRB",
      "company_name": "IBM Deutschland GmbH",
      "company_seat": "Ehningen",
      "details": "28.07.2025 (Bekanntmachungsdatum)\n\nBaden-Württemberg Amtsgericht Stuttgart HRB 14562\nEinreichung neuer Dokumente\n\nIBM Deutschland GmbH\nGesellschaft mit beschränkter Haftung\nEhningen\n\nDie Gesellschaft hat am 25.07.2025 die Liste über die Zusammensetzung des Aufsichtsrats zum Handelsregister eingereicht."
    },
    {
      "date": "2025-07-28",
      "id": "117833",
      "original_text": "Registerbekanntmachung nach dem Umwandlungsgesetz\nNiedersachsen Amtsgericht Walsrode HRA 205501\nNando Meyer Metalltechnik e.K. – Langwedel",
      "type": "Registerbekanntmachung nach dem Umwandlungsgesetz",
      "state": "Niedersachsen",
      "amtsgericht": "Amtsgericht Walsrode",
      "registernummer": "HRA 205501",
      "registerart": "HRA",
      "company_name": "Nando Meyer Metalltechnik e.K.",
      "company_seat": "Langwedel",
      "details": "28.07.2025 (Bekanntmachungsdatum)\n\nNiedersachsen Amtsgericht Walsrode HRA 205501\nRegisterbekanntmachung nach dem Umwandlungsgesetz 28.07.2025 (Eintragungsdatum)\n\nNando Meyer Metalltechnik e.K.\nEinzelkaufmann / Einzelkauffrau\nLangwedel\n\nDen Gläubigern der an der Ausgliederung beteiligten Rechtsträger ist, wenn sie binnen sechs Monaten nach dem Tag, an dem die Eintragung der Ausgliederung in das Register des Sitzes desjenigen Rechtsträgers, dessen Gläubiger sie sind, nach § 19 Abs. 3 UmwG als bekannt gemacht gilt, ihren Anspruch nach Grund und Höhe schriftlich anmelden, Sicherheit zu leisten, soweit sie nicht Befriedigung verlangen können. Dieses Recht steht den Gläubigern jedoch nur zu, wenn sie glaubhaft machen, dass durch die Ausgliederung die Erfüllung der Forderung gefährdet wird."
    },
    {
      "date": "2025-07-28",
      "id": "117834",
      "original_text": "Registerbekanntmachung nach dem Umwandlungsgesetz\nNiedersachsen Amtsgericht Walsrode HRA 205592\nMR-Metalltechnik GmbH & Co. KG – Langwedel",
      "type": "Registerbekanntmachung nach dem Umwandlungsgesetz",
      "state": "Niedersachsen",
      "amtsgericht": "Amtsgericht Walsrode",
      "registernummer": "HRA 205592",
      "registerart": "HRA",
      "company_name": "MR-Metalltechnik GmbH & Co. KG",
      "company_seat": "Langwedel",
      "details": "28.07.2025 (Bekanntmachungsdatum)\n\nNiedersachsen Amtsgericht Walsrode HRA 205592\nRegisterbekanntmachung nach dem Umwandlungsgesetz 28.07.2025 (Eintragungsdatum)\n\nMR-Metalltechnik GmbH & Co. KG\nKommanditgesellschaft\nLangwedel\n\nDen Gläubigern der an der Ausgliederung beteiligten Rechtsträger ist, wenn sie binnen sechs Monaten nach dem Tag, an dem die Eintragung der Ausgliederung in das Register des Sitzes desjenigen Rechtsträgers, dessen Gläubiger sie sind, nach § 19 Abs. 3 UmwG als bekannt gemacht gilt, ihren Anspruch nach Grund und Höhe schriftlich anmelden, Sicherheit zu leisten, soweit sie nicht Befriedigung verlangen können. Dieses Recht steht den Gläubigern jedoch nur zu, wenn sie glaubhaft machen, dass durch die Ausgliederung die Erfüllung der Forderung gefährdet wird."
    },
    {
      "date": "2025-07-28",
      "id": "117835",
      "original_text": "Einreichung neuer Dokumente\nNiedersachsen Amtsgericht Walsrode GnR 200008\nEnergie eG, Böhmetal – Walsrode",
      "type": "Einreichung neuer Dokumente",
      "state": "Niedersachsen",
      "amtsgericht": "Amtsgericht Walsrode",
      "registernummer": "GnR 200008",
      "registerart": "GnR",
      "company_name": "Energie eG, Böhmetal",
      "company_seat": "Walsrode",
      "details": "28.07.2025 (Bekanntmachungsdatum)\n\nNiedersachsen Amtsgericht Walsrode GnR 200008\nEinreichung neuer Dokumente\n\nEnergie eG, Böhmetal\neingetragene Genossenschaft\nWalsrode\n\nDie Liste der Mitglieder des Aufsichtsrats wurde beim Registergericht eingereicht."
    },
    {
      "date": "2025-07-28",
      "id": "117836",
      "original_text": "Löschungsankündigung\nNiedersachsen Amtsgericht Hildesheim HRB 207948\nSingh Gastronomie UG (haftungsbeschränkt) – Ilsede",
      "type": "Löschungsankündigung",
      "state": "Niedersachsen",
      "amtsgericht": "Amtsgericht Hildesheim",
      "registernummer": "HRB 207948",
      "registerart": "HRB",
      "company_name": "Singh Gastronomie UG (haftungsbeschränkt)",
      "company_seat": "Ilsede",
      "details": "28.07.2025 (Bekanntmachungsdatum)\n\nNiedersachsen Amtsgericht Hildesheim HRB 207948\nLöschungsankündigung\n\nSingh Gastronomie UG (haftungsbeschränkt)\nGesellschaft mit beschränkter Haftung\nIlsede\n\nDas Registergericht beabsichtigt, die Gesellschaft von Amts wegen nach § 394 FamFG zu löschen. Die Frist zur Erhebung eines Widerspruchs ist auf 1 Monat ab dieser Registerbekanntmachung festgesetzt."
    },
    {
      "date": "2025-07-28",
      "id": "117837",
      "original_text": "Registerbekanntmachung nach dem Umwandlungsgesetz\nNiedersachsen Amtsgericht Tostedt HRB 211350\nMybooks GmbH – Heeslingen",
      "type": "Registerbekanntmachung nach dem Umwandlungsgesetz",
      "state": "Niedersachsen",
      "amtsgericht": "Amtsgericht Tostedt",
      "registernummer": "HRB 211350",
      "registerart": "HRB",
      "company_name": "Mybooks GmbH",
      "company_seat": "Heeslingen",
      "details": "28.07.2025 (Bekanntmachungsdatum)\n\nNiedersachsen Amtsgericht Tostedt HRB 211350\nRegisterbekanntmachung nach dem Umwandlungsgesetz 28.07.2025 (Eintragungsdatum)\n\nMybooks GmbH\nGesellschaft mit beschränkter Haftung\nHeeslingen\n\nDen Gläubigern der an der Verschmelzung beteiligten Rechtsträger ist, wenn sie binnen sechs Monaten nach dem Tag, an dem die Eintragung der Verschmelzung in das Register des Sitzes desjenigen Rechtsträgers, dessen Gläubiger sie sind, nach § 19  Abs.  3 UmwG als bekannt gemacht gilt, ihren Anspruch nach Grund und Höhe schriftlich anmelden, Sicherheit zu leisten, soweit sie nicht Befriedigung verlangen können. Dieses Recht steht den Gläubigern jedoch nur zu, wenn sie glaubhaft machen, dass durch die Verschmelzung die Erfüllung der Forderung gefährdet wird."
    },
    {
      "date": "2025-07-28",
      "id": "117838",
      "original_text": "Einreichung neuer Dokumente\nNiedersachsen Amtsgericht Lüneburg HRB 900\nBHZP GmbH – Dahlenburg",
      "type": "Einreichung neuer Dokumente",
      "state": "Niedersachsen",
      "amtsgericht": "Amtsgericht Lüneburg",
      "registernummer": "HRB 900",
      "registerart": "HRB",
      "company_name": "BHZP GmbH",
      "company_seat": "Dahlenburg",
      "details": "28.07.2025 (Bekanntmachungsdatum)\n\nNiedersachsen Amtsgericht Lüneburg HRB 900\nEinreichung neuer Dokumente\n\nBHZP GmbH\nGesellschaft mit beschränkter Haftung\nDahlenburg\n\nDie Liste der Mitglieder des Aufsichtsrats wurde beim Registergericht eingereicht."
    },
    {
      "date": "2025-07-28",
      "id": "117839",
      "original_text": "Registerbekanntmachung nach dem Umwandlungsgesetz\nNiedersachsen Amtsgericht Tostedt HRB 211407\nKolibri Immobilien GmbH – Heeslingen",
      "type": "Registerbekanntmachung nach dem Umwandlungsgesetz",
      "state": "Niedersachsen",
      "amtsgericht": "Amtsgericht Tostedt",
      "registernummer": "HRB 211407",
      "registerart": "HRB",
      "company_name": "Kolibri Immobilien GmbH",
      "company_seat": "Heeslingen",
      "details": "28.07.2025 (Bekanntmachungsdatum)\n\nNiedersachsen Amtsgericht Tostedt HRB 211407\nRegisterbekanntmachung nach dem Umwandlungsgesetz 28.07.2025 (Eintragungsdatum)\n\nKolibri Immobilien GmbH\nGesellschaft mit beschränkter Haftung\nHeeslingen\n\nDen Gläubigern der an der Verschmelzung beteiligten Rechtsträger ist, wenn sie binnen sechs Monaten nach dem Tag, an dem die Eintragung der Verschmelzung in das Register des Sitzes desjenigen Rechtsträgers, dessen Gläubiger sie sind, nach § 19  Abs.  3 UmwG als bekannt gemacht gilt, ihren Anspruch nach Grund und Höhe schriftlich anmelden, Sicherheit zu leisten, soweit sie nicht Befriedigung verlangen können. Dieses Recht steht den Gläubigern jedoch nur zu, wenn sie glaubhaft machen, dass durch die Verschmelzung die Erfüllung der Forderung gefährdet wird."
    },
    {
      "date": "2025-07-28",
      "id": "117840",
      "original_text": "Löschungsankündigung\nNiedersachsen Amtsgericht Hannover HRA 204464\nGPP IT-Sicherheit GmbH & Co. KG – Hannover",
      "type": "Löschungsankündigung",
      "state": "Niedersachsen",
      "amtsgericht": "Amtsgericht Hannover",
      "registernummer": "HRA 204464",
      "registerart": "HRA",
      "company_name": "GPP IT-Sicherheit GmbH & Co. KG",
      "company_seat": "Hannover",
      "details": "28.07.2025 (Bekanntmachungsdatum)\n\nNiedersachsen Amtsgericht Hannover HRA 204464\nLöschungsankündigung\n\nGPP IT-Sicherheit GmbH & Co. KG\nKommanditgesellschaft\nHannover\n\nDas Registergericht beabsichtigt, die Firma von Amts wegen nach § 394 FamFG zu löschen. Die Frist zur Erhebung eines Widerspruchs ist auf 1 Monat ab dieser Registerbekanntmachung festgesetzt."
    },
    {
      "date": "2025-07-28",
      "id": "117841",
      "original_text": "Löschungsankündigung\nNiedersachsen Amtsgericht Osnabrück HRB 211328\nQuadt | Hagel GmbH – Lingen",
      "type": "Löschungsankündigung",
      "state": "Niedersachsen",
      "amtsgericht": "Amtsgericht Osnabrück",
      "registernummer": "HRB 211328",
      "registerart": "HRB",
      "company_name": "Quadt | Hagel GmbH",
      "company_seat": "Lingen",
      "details": "28.07.2025 (Bekanntmachungsdatum)\n\nNiedersachsen Amtsgericht Osnabrück HRB 211328\nLöschungsankündigung\n\nQuadt | Hagel GmbH\nGesellschaft mit beschränkter Haftung\nLingen\n\nDas Registergericht beabsichtigt, die Gesellschaft von Amts wegen nach § 394 FamFG wegen Vermögenslosigkeit zu löschen. Die Frist zur Erhebung eines Widerspruchs ist auf 1 Monat ab dieser Registerbekanntmachung festgesetzt."
    },
    {
      "date": "2025-07-28",
      "id": "117842",
      "original_text": "Registerbekanntmachung nach dem Umwandlungsgesetz\nRheinland-Pfalz Amtsgericht Koblenz HRA 23247\nJHO Steuer- und Wirtschaftsberatung e.K. – Remagen",
      "type": "Registerbekanntmachung nach dem Umwandlungsgesetz",
      "state": "Rheinland-Pfalz",
      "amtsgericht": "Amtsgericht Koblenz",
      "registernummer": "HRA 23247",
      "registerart": "HRA",
      "company_name": "JHO Steuer- und Wirtschaftsberatung e.K.",
      "company_seat": "Remagen",
      "details": "28.07.2025 (Bekanntmachungsdatum)\n\nRheinland-Pfalz Amtsgericht Koblenz HRA 23247\nRegisterbekanntmachung nach dem Umwandlungsgesetz 28.07.2025 (Eintragungsdatum)\n\nJHO Steuer- und Wirtschaftsberatung e.K.\nEinzelkaufmann / Einzelkauffrau\nRemagen\n\nAls nicht eingetragen wird veröffentlicht: Den Gläubigern der an der Ausgliederung beteiligten Rechtsträger ist, wenn sie binnen sechs Monaten nac hdem Tag, an dem die Eintragung der Ausgliederung in das Register des Sitzes desjenigen Rechtsträgers,dessen Gläubiger sie sind, nach § 19 Abs. 3 UmwG als bekannt gemacht gilt, ihren Anspruch nach Grund und Höhe schriftlich anmelden, Sicherheit zu leisten, soweit sie nicht Befriedigung verlangen können. Dieses Recht steht den Gläubigern jedoch nur zu, wenn sie glaubhaft machen, dass durch die Ausgliederung die Erfüllung der Forderung gefährdet wird."
    },
    {
      "date": "2025-07-28",
      "id": "117843",
      "original_text": "Registerbekanntmachung nach dem Umwandlungsgesetz\nRheinland-Pfalz Amtsgericht Koblenz HRB 94\nLotto Rheinland-Pfalz GmbH – Koblenz",
      "type": "Registerbekanntmachung nach dem Umwandlungsgesetz",
      "state": "Rheinland-Pfalz",
      "amtsgericht": "Amtsgericht Koblenz",
      "registernummer": "HRB 94",
      "registerart": "HRB",
      "company_name": "Lotto Rheinland-Pfalz GmbH",
      "company_seat": "Koblenz",
      "details": "28.07.2025 (Bekanntmachungsdatum)\n\nRheinland-Pfalz Amtsgericht Koblenz HRB 94\nRegisterbekanntmachung nach dem Umwandlungsgesetz 28.07.2025 (Eintragungsdatum)\n\nLotto Rheinland-Pfalz GmbH\nGesellschaft mit beschränkter Haftung\nKoblenz\n\nAls nicht eingetragen wird veröffentlicht: Den Gläubigern der an der Verschmelzung beteiligten Rechtsträger ist, wenn sie binnen sechs Monaten nach dem Tag, an dem die Eintragung der Verschmelzung in das Register des Sitzes desjenigen Rechtsträgers,dessen Gläubiger sie sind, nach § 19 Abs. 3 UmwG als bekannt gemacht gilt, ihren Anspruch nach Grund und Höhe schriftlich anmelden, Sicherheit zu leisten, soweit sie nicht Befriedigung verlangen können. Dieses Recht steht den Gläubigern jedoch nur zu, wenn sie glaubhaft machen, dass durch die Verschmelzung die Erfüllungd er Forderung gefährdet wird."
    },
    {
      "date": "2025-07-28",
      "id": "117844",
      "original_text": "Registerbekanntmachung nach dem Umwandlungsgesetz\nRheinland-Pfalz Amtsgericht Landau HRB 2564\nSOT Vermögensverwaltungs GmbH – Bad Bergzabern",
      "type": "Registerbekanntmachung nach dem Umwandlungsgesetz",
      "state": "Rheinland-Pfalz",
      "amtsgericht": "Amtsgericht Landau",
      "registernummer": "HRB 2564",
      "registerart": "HRB",
      "company_name": "SOT Vermögensverwaltungs GmbH",
      "company_seat": "Bad Bergzabern",
      "details": "28.07.2025 (Bekanntmachungsdatum)\n\nRheinland-Pfalz Amtsgericht Landau HRB 2564\nRegisterbekanntmachung nach dem Umwandlungsgesetz 28.07.2025 (Eintragungsdatum)\n\nSOT Vermögensverwaltungs GmbH\nGesellschaft mit beschränkter Haftung\nBad Bergzabern\n\nAls nicht eingetragen wird veröffentlicht: Den Gläubigern der an der Verschmelzung beteiligten Rechtsträger ist, wenn sie binnen sechs Monaten nach dem Tag, an dem die Eintragung der Verschmelzung in das Register des Sitzes desjenigen Rechtsträgers, dessen Gläubiger sie sind, nach § 19 Abs. 3 UmwG als bekannt gemacht gilt, ihren Anspruch nach Grund und Höhe schriftlich anmelden, Sicherheit zu leisten, soweit sie nicht Befriedigung verlangen können. Dieses Recht steht den Gläubigern jedoch nur zu, wenn sie glaubhaft machen, dass durch die Verschmelzung die Erfüllung der Forderung gefährdet wird."
    },
    {
      "date": "2025-07-28",
      "id": "117845",
      "original_text": "Sonstige Registerbekanntmachung\nRheinland-Pfalz Amtsgericht Wittlich HRB 41239\nEwerhardt Transporte GmbH – Trierweiler",
      "type": "Sonstige Registerbekanntmachung",
      "state": "Rheinland-Pfalz",
      "amtsgericht": "Amtsgericht Wittlich",
      "registernummer": "HRB 41239",
      "registerart": "HRB",
      "company_name": "Ewerhardt Transporte GmbH",
      "company_seat": "Trierweiler",
      "details": "28.07.2025 (Bekanntmachungsdatum)\n\nRheinland-Pfalz Amtsgericht Wittlich HRB 41239\nSonstige Registerbekanntmachung 28.07.2025 (Eintragungsdatum)\n\nEwerhardt Transporte GmbH\nGesellschaft mit beschränkter Haftung\nTrierweiler\n\nAls nicht eingetragen wird veröffentlicht: Den Gläubigern der Gesellschaft, deren Forderungen begründet worden sind, bevor die Eintragung der Beendigung des Gewinnabführungsvertrages in das Handelsregister nach § 10 des Handelsgesetzbuches als bekanntgemacht gilt, hat der andere Vertragsteil Sicherheit zu leisten, wenn sie sich binnen sechs Monaten nach der Bekanntmachung der Eintragung zu diesem Zweck bei ihm melden."
    },
    {
      "date": "2025-07-28",
      "id": "117846",
      "original_text": "Löschungsankündigung\nRheinland-Pfalz Amtsgericht Landau HRB 32378\nGroß Dienstleistungen UG (haftungsbeschränkt) – Kuhardt",
      "type": "Löschungsankündigung",
      "state": "Rheinland-Pfalz",
      "amtsgericht": "Amtsgericht Landau",
      "registernummer": "HRB 32378",
      "registerart": "HRB",
      "company_name": "Groß Dienstleistungen UG (haftungsbeschränkt)",
      "company_seat": "Kuhardt",
      "details": "28.07.2025 (Bekanntmachungsdatum)\n\nRheinland-Pfalz Amtsgericht Landau HRB 32378\nLöschungsankündigung\n\nGroß Dienstleistungen UG (haftungsbeschränkt)\nGesellschaft mit beschränkter Haftung\nKuhardt\n\nDas Registergericht beabsichtigt die Gesellschaft von Amts wegen nach § 394 FamFG zu löschen. Die Frist zur Erhebung eines Widerspruchs ist auf einen Monat festgesetzt."
    },
    {
      "date": "2025-07-28",
      "id": "117847",
      "original_text": "Löschungsankündigung\nRheinland-Pfalz Amtsgericht Montabaur HRB 29222\nDalik GmbH – Wissen",
      "type": "Löschungsankündigung",
      "state": "Rheinland-Pfalz",
      "amtsgericht": "Amtsgericht Montabaur",
      "registernummer": "HRB 29222",
      "registerart": "HRB",
      "company_name": "Dalik GmbH",
      "company_seat": "Wissen",
      "details": "28.07.2025 (Bekanntmachungsdatum)\n\nRheinland-Pfalz Amtsgericht Montabaur HRB 29222\nLöschungsankündigung\n\nDalik GmbH\nGesellschaft mit beschränkter Haftung\nWissen\n\nDas Registergericht beabsichtigt die Gesellschaft von Amts wegen nach § 394 FamFG zu löschen. Die Frist zur Erhebung eines Widerspruchs ist auf einen Monat festgesetzt."
    },
    {
      "date": "2025-07-28",
      "id": "117848",
      "original_text": "Registerbekanntmachung nach dem Umwandlungsgesetz\nRheinland-Pfalz Amtsgericht Koblenz HRB 31240\nProf. Dr. Ottersbach GmbH – Remagen",
      "type": "Registerbekanntmachung nach dem Umwandlungsgesetz",
      "state": "Rheinland-Pfalz",
      "amtsgericht": "Amtsgericht Koblenz",
      "registernummer": "HRB 31240",
      "registerart": "HRB",
      "company_name": "Prof. Dr. Ottersbach GmbH",
      "company_seat": "Remagen",
      "details": "28.07.2025 (Bekanntmachungsdatum)\n\nRheinland-Pfalz Amtsgericht Koblenz HRB 31240\nRegisterbekanntmachung nach dem Umwandlungsgesetz 28.07.2025 (Eintragungsdatum)\n\nProf. Dr. Ottersbach GmbH\nGesellschaft mit beschränkter Haftung\nRemagen\n\nAls nicht eingetragen wird veröffentlicht: Den Gläubigern der an der Ausgliederung beteiligten Rechtsträger ist, wenn sie binnen sechs Monaten nac hdem Tag, an dem die Eintragung der Ausgliederung in das Register des Sitzes desjenigen Rechtsträgers,dessen Gläubiger sie sind, nach § 19 Abs. 3 UmwG als bekannt gemacht gilt, ihren Anspruch nach Grund und Höhe schriftlich anmelden, Sicherheit zu leisten, soweit sie nicht Befriedigung verlangen können. Dieses Recht steht den Gläubigern jedoch nur zu, wenn sie glaubhaft machen, dass durch die Ausgliederung die Erfüllung der Forderung gefährdet wird."
    },
    {
      "date": "2025-07-28",
      "id": "117849",
      "original_text": "Registerbekanntmachung nach dem Umwandlungsgesetz\nRheinland-Pfalz Amtsgericht Mainz HRB 11747\nLudwig Pfaff u. E. Pfaff Wwe. Metallverarbeitungswerkstätte GmbH – Worms",
      "type": "Registerbekanntmachung nach dem Umwandlungsgesetz",
      "state": "Rheinland-Pfalz",
      "amtsgericht": "Amtsgericht Mainz",
      "registernummer": "HRB 11747",
      "registerart": "HRB",
      "company_name": "Ludwig Pfaff u. E. Pfaff Wwe. Metallverarbeitungswerkstätte GmbH",
      "company_seat": "Worms",
      "details": "28.07.2025 (Bekanntmachungsdatum)\n\nRheinland-Pfalz Amtsgericht Mainz HRB 11747\nRegisterbekanntmachung nach dem Umwandlungsgesetz 28.07.2025 (Eintragungsdatum)\n\nLudwig Pfaff u. E. Pfaff Wwe. Metallverarbeitungswerkstätte GmbH\nGesellschaft mit beschränkter Haftung\nWorms\n\nAls nicht eingetragen wird veröffentlicht:\nDen Gläubigern der an der Verschmelzung beteiligten Rechtsträger ist, wenn sie binnen sechs Monaten nach dem Tag, an dem die Eintragung der Verschmelzung in das Register des Sitzes desjenigen Rechtsträgers, dessen Gläubiger sie sind, nach § 19 Abs. 3 UmwG als bekannt gemacht gilt, ihren Anspruch nach Grund und Höhe schriftlich anmelden, Sicherheit zu leisten, soweit sie nicht Befriedigung verlangen können. Dieses Recht steht den Gläubigern jedoch nur zu, wenn sie glaubhaft machen, dass durch die Verschmelzung die Erfüllung der Forderung gefährdet wird."
    },
    {
      "date": "2025-07-28",
      "id": "117850",
      "original_text": "Löschungsankündigung\nBremen Amtsgericht Bremen HRB 38549\nSP BS Projekt GmbH – Bremen",
      "type": "Löschungsankündigung",
      "state": "Bremen",
      "amtsgericht": "Amtsgericht Bremen",
      "registernummer": "HRB 38549",
      "registerart": "HRB",
      "company_name": "SP BS Projekt GmbH",
      "company_seat": "Bremen",
      "details": "28.07.2025 (Bekanntmachungsdatum)\n\nBremen Amtsgericht Bremen HRB 38549\nLöschungsankündigung\n\nSP BS Projekt GmbH\nGesellschaft mit beschränkter Haftung\nBremen\n\nEs ist beabsichtigt die im Handelsregister eingetragene Gesellschaft von Amts wegen gemäß § 394 FamFG zu löschen. Gegen die Löschung kann beim AG Bremen schriftlich oder zu Protokoll der Geschäftsstelle Widerspruch eingelegt werden. Widerspruchsfrist 4 Wochen."
    },
    {
      "date": "2025-07-28",
      "id": "117851",
      "original_text": "Löschungsankündigung\nBremen Amtsgericht Bremen HRB 36210\nB&S BiSma-Bau GmbH – Bremen",
      "type": "Löschungsankündigung",
      "state": "Bremen",
      "amtsgericht": "Amtsgericht Bremen",
      "registernummer": "HRB 36210",
      "registerart": "HRB",
      "company_name": "B&S BiSma-Bau GmbH",
      "company_seat": "Bremen",
      "details": "28.07.2025 (Bekanntmachungsdatum)\n\nBremen Amtsgericht Bremen HRB 36210\nLöschungsankündigung\n\nB&S BiSma-Bau GmbH\nGesellschaft mit beschränkter Haftung\nBremen\n\nEs ist beabsichtigt die im Handelsregister eingetragene Gesellschaft von Amts wegen gemäß § 394 FamFG zu löschen. Gegen die Löschung kann beim AG Bremen schriftlich oder zu Protokoll der Geschäftsstelle Widerspruch eingelegt werden. Widerspruchsfrist 4 Wochen."
    },
    {
      "date": "2025-07-28",
      "id": "117852",
      "original_text": "Einreichung neuer Dokumente\nBremen Amtsgericht Bremen HRB 21807\nDie JugendHerbergen (DJH) gemeinnützige Gesellschaft mit beschränkter Haftung – Bremen",
      "type": "Einreichung neuer Dokumente",
      "state": "Bremen",
      "amtsgericht": "Amtsgericht Bremen",
      "registernummer": "HRB 21807",
      "registerart": "HRB",
      "company_name": "Die JugendHerbergen (DJH) gemeinnützige Gesellschaft mit beschränkter Haftung",
      "company_seat": "Bremen",
      "details": "28.07.2025 (Bekanntmachungsdatum)\n\nBremen Amtsgericht Bremen HRB 21807\nEinreichung neuer Dokumente\n\nDie JugendHerbergen (DJH) gemeinnützige Gesellschaft mit beschränkter Haftung\nGesellschaft mit beschränkter Haftung\nBremen\n\nAls nicht eingetragen wird veröffentlicht: Liste des Aufsichtsrats wurde eingereicht."
    },
    {
      "date": "2025-07-28",
      "id": "117853",
      "original_text": "Einreichung neuer Dokumente\nNordrhein-Westfalen Amtsgericht Köln HRB 45136\nLoMa III Aktiengesellschaft – Hürth",
      "type": "Einreichung neuer Dokumente",
      "state": "Nordrhein-Westfalen",
      "amtsgericht": "Amtsgericht Köln",
      "registernummer": "HRB 45136",
      "registerart": "HRB",
      "company_name": "LoMa III Aktiengesellschaft",
      "company_seat": "Hürth",
      "details": "28.07.2025 (Bekanntmachungsdatum)\n\nNordrhein-Westfalen Amtsgericht Köln HRB 45136\nEinreichung neuer Dokumente\n\nLoMa III Aktiengesellschaft\nAktiengesellschaft\nHürth\n\nDem Registergericht ist eine Liste der Mitglieder des Aufsichtsrates eingereicht worden."
    },
    {
      "date": "2025-07-28",
      "id": "117854",
      "original_text": "Registerbekanntmachung nach dem Umwandlungsgesetz\nNordrhein-Westfalen Amtsgericht Steinfurt HRB 14151\nInstitut für sozialwissenschaftliche Forschung und Entwicklung (IsFE) UG (haftungsbeschränkt) – Greven",
      "type": "Registerbekanntmachung nach dem Umwandlungsgesetz",
      "state": "Nordrhein-Westfalen",
      "amtsgericht": "Amtsgericht Steinfurt",
      "registernummer": "HRB 14151",
      "registerart": "HRB",
      "company_name": "Institut für sozialwissenschaftliche Forschung und Entwicklung (IsFE) UG (haftungsbeschränkt)",
      "company_seat": "Greven",
      "details": "28.07.2025 (Bekanntmachungsdatum)\n\nNordrhein-Westfalen Amtsgericht Steinfurt HRB 14151\nRegisterbekanntmachung nach dem Umwandlungsgesetz 28.07.2025 (Eintragungsdatum)\n\nInstitut für sozialwissenschaftliche Forschung und Entwicklung (IsFE) UG (haftungsbeschränkt)\nGesellschaft mit beschränkter Haftung\nGreven\n\nDen Gläubigern der an der Verschmelzung beteiligten Rechtsträger ist, wenn sie binnen sechs Monaten nach dem Tag, an dem die Eintragung der Verschmelzung in das Register des Sitzes desjenigen Rechtsträgers, dessen Gläubiger sie sind, nach § 19 Absatz 3 UmwG als bekanntgemacht gilt, ihren Anspruch nach Grund und Höhe schriftlich anmelden, Sicherheit zu leisten, soweit sie nicht Befriedigung verlangen können. Dieses Recht steht den Gläubigern jedoch nur zu, wenn sie glaubhaft machen, dass durch die Verschmelzung die Erfüllung ihrer Forderung gefährdet wird."
    },
    {
      "date": "2025-07-28",
      "id": "117855",
      "original_text": "Registerbekanntmachung nach dem Umwandlungsgesetz\nNordrhein-Westfalen Amtsgericht Düsseldorf HRB 62734\nGrant Thornton AG Wirtschaftsprüfungsgesellschaft – Düsseldorf",
      "type": "Registerbekanntmachung nach dem Umwandlungsgesetz",
      "state": "Nordrhein-Westfalen",
      "amtsgericht": "Amtsgericht Düsseldorf",
      "registernummer": "HRB 62734",
      "registerart": "HRB",
      "company_name": "Grant Thornton AG Wirtschaftsprüfungsgesellschaft",
      "company_seat": "Düsseldorf",
      "details": "28.07.2025 (Bekanntmachungsdatum)\n\nNordrhein-Westfalen Amtsgericht Düsseldorf HRB 62734\nRegisterbekanntmachung nach dem Umwandlungsgesetz 28.07.2025 (Eintragungsdatum)\n\nGrant Thornton AG Wirtschaftsprüfungsgesellschaft\nAktiengesellschaft\nDüsseldorf\n\nDen Gläubigern der an der Verschmelzung beteiligten Rechtsträger ist, wenn sie binnen sechs Monaten nach dem Tag, an dem die Eintragung der Verschmelzung in das Register des Sitzes desjenigen Rechtsträgers, dessen Gläubiger sie sind, nach § 19 Absatz 3 UmwG als bekanntgemacht gilt, ihren Anspruch nach Grund und Höhe schriftlich anmelden, Sicherheit zu leisten, soweit sie nicht Befriedigung verlangen können. Dieses Recht steht den Gläubigern jedoch nur zu, wenn sie glaubhaft machen, dass durch die Verschmelzung die Erfüllung ihrer Forderung gefährdet wird."
    },
    {
      "date": "2025-07-28",
      "id": "117856",
      "original_text": "Registerbekanntmachung nach dem Umwandlungsgesetz\nNordrhein-Westfalen Amtsgericht Neuss HRB 22849\nCP-Pro Solutions GmbH – Dormagen",
      "type": "Registerbekanntmachung nach dem Umwandlungsgesetz",
      "state": "Nordrhein-Westfalen",
      "amtsgericht": "Amtsgericht Neuss",
      "registernummer": "HRB 22849",
      "registerart": "HRB",
      "company_name": "CP-Pro Solutions GmbH",
      "company_seat": "Dormagen",
      "details": "28.07.2025 (Bekanntmachungsdatum)\n\nNordrhein-Westfalen Amtsgericht Neuss HRB 22849\nRegisterbekanntmachung nach dem Umwandlungsgesetz 28.07.2025 (Eintragungsdatum)\n\nCP-Pro Solutions GmbH\nGesellschaft mit beschränkter Haftung\nDormagen\n\nDen Gläubigern der an der Verschmelzung beteiligten Rechtsträger ist, wenn sie binnen sechs Monaten nach dem Tag, an dem die Eintragung der Verschmelzung in das Register des Sitzes desjenigen Rechtsträgers, dessen Gläubiger sie sind, nach § 19 Absatz 3 UmwG als bekanntgemacht gilt, ihren Anspruch nach Grund und Höhe schriftlich anmelden, Sicherheit zu leisten, soweit sie nicht Befriedigung verlangen können. Dieses Recht steht den Gläubigern jedoch nur zu, wenn sie glaubhaft machen, dass durch die Verschmelzung die Erfüllung ihrer Forderung gefährdet wird."
    },
    {
      "date": "2025-07-28",
      "id": "117857",
      "original_text": "Registerbekanntmachung nach dem Umwandlungsgesetz\nNordrhein-Westfalen Amtsgericht Köln HRB 43093\nFSP GmbH Consulting & IT-Services – Köln",
      "type": "Registerbekanntmachung nach dem Umwandlungsgesetz",
      "state": "Nordrhein-Westfalen",
      "amtsgericht": "Amtsgericht Köln",
      "registernummer": "HRB 43093",
      "registerart": "HRB",
      "company_name": "FSP GmbH Consulting & IT-Services",
      "company_seat": "Köln",
      "details": "28.07.2025 (Bekanntmachungsdatum)\n\nNordrhein-Westfalen Amtsgericht Köln HRB 43093\nRegisterbekanntmachung nach dem Umwandlungsgesetz 28.07.2025 (Eintragungsdatum)\n\nFSP GmbH Consulting & IT-Services\nGesellschaft mit beschränkter Haftung\nKöln\n\nDen Gläubigern der an der Verschmelzung beteiligten Rechtsträger ist, wenn sie binnen sechs Monaten nach dem Tag, an dem die Eintragung der Verschmelzung in das Register des Sitzes desjenigen Rechtsträgers, dessen Gläubiger sie sind, nach § 19 Absatz 3 UmwG als bekanntgemacht gilt, ihren Anspruch nach Grund und Höhe schriftlich anmelden, Sicherheit zu leisten, soweit sie nicht Befriedigung verlangen können. Dieses Recht steht den Gläubigern jedoch nur zu, wenn sie glaubhaft machen, dass durch die Verschmelzung die Erfüllung ihrer Forderung gefährdet wird."
    },
    {
      "date": "2025-07-28",
      "id": "117858",
      "original_text": "Registerbekanntmachung nach dem Umwandlungsgesetz\nNordrhein-Westfalen Amtsgericht Arnsberg HRB 15352\nPlantoVision UG (haftungsbeschränkt) – Menden",
      "type": "Registerbekanntmachung nach dem Umwandlungsgesetz",
      "state": "Nordrhein-Westfalen",
      "amtsgericht": "Amtsgericht Arnsberg",
      "registernummer": "HRB 15352",
      "registerart": "HRB",
      "company_name": "PlantoVision UG (haftungsbeschränkt)",
      "company_seat": "Menden",
      "details": "28.07.2025 (Bekanntmachungsdatum)\n\nNordrhein-Westfalen Amtsgericht Arnsberg HRB 15352\nRegisterbekanntmachung nach dem Umwandlungsgesetz 28.07.2025 (Eintragungsdatum)\n\nPlantoVision UG (haftungsbeschränkt)\nGesellschaft mit beschränkter Haftung\nMenden\n\nDen Gläubigern der an der Verschmelzung beteiligten Rechtsträger ist, wenn sie binnen sechs Monaten nach dem Tag, an dem die Eintragung der Verschmelzung in das Register des Sitzes desjenigen Rechtsträgers, dessen Gläubiger sie sind, nach § 19 Absatz 3 UmwG als bekanntgemacht gilt, ihren Anspruch nach Grund und Höhe schriftlich anmelden, Sicherheit zu leisten, soweit sie nicht Befriedigung verlangen können. Dieses Recht steht den Gläubigern jedoch nur zu, wenn sie glaubhaft machen, dass durch die Verschmelzung die Erfüllung ihrer Forderung gefährdet wird."
    },
    {
      "date": "2025-07-28",
      "id": "117859",
      "original_text": "Löschungsankündigung\nNordrhein-Westfalen Amtsgericht Münster HRA 6984\nMichele Schimmenti Pizzeria La Lanterna – Warendorf",
      "type": "Löschungsankündigung",
      "state": "Nordrhein-Westfalen",
      "amtsgericht": "Amtsgericht Münster",
      "registernummer": "HRA 6984",
      "registerart": "HRA",
      "company_name": "Michele Schimmenti Pizzeria La Lanterna",
      "company_seat": "Warendorf",
      "details": "28.07.2025 (Bekanntmachungsdatum)\n\nNordrhein-Westfalen Amtsgericht Münster HRA 6984\nLöschungsankündigung\n\nMichele Schimmenti Pizzeria La Lanterna\nEinzelkaufmann / Einzelkauffrau\nWarendorf\n\nDas Registergericht beabsichtigt die Firma von Amts wegen nach § 31 Abs. 2 HGB, § 393 FamFG zu löschen. Die Frist zur Erhebung eines Widerspruchs ist auf zwei Monate festgesetzt."
    },
    {
      "date": "2025-07-28",
      "id": "117860",
      "original_text": "Registerbekanntmachung nach dem Umwandlungsgesetz\nNordrhein-Westfalen Amtsgericht Köln HRB 87077\nGielen Beteiligungsgesellschaft mbH – Köln",
      "type": "Registerbekanntmachung nach dem Umwandlungsgesetz",
      "state": "Nordrhein-Westfalen",
      "amtsgericht": "Amtsgericht Köln",
      "registernummer": "HRB 87077",
      "registerart": "HRB",
      "company_name": "Gielen Beteiligungsgesellschaft mbH",
      "company_seat": "Köln",
      "details": "28.07.2025 (Bekanntmachungsdatum)\n\nNordrhein-Westfalen Amtsgericht Köln HRB 87077\nRegisterbekanntmachung nach dem Umwandlungsgesetz 28.07.2025 (Eintragungsdatum)\n\nGielen Beteiligungsgesellschaft mbH\nGesellschaft mit beschränkter Haftung\nKöln\n\nDen Gläubigern der an der Verschmelzung beteiligten Rechtsträger ist, wenn sie binnen sechs Monaten nach dem Tag, an dem die Eintragung der Verschmelzung in das Register des Sitzes desjenigen Rechtsträgers, dessen Gläubiger sie sind, nach § 19 Absatz 3 UmwG als bekanntgemacht gilt, ihren Anspruch nach Grund und Höhe schriftlich anmelden, Sicherheit zu leisten, soweit sie nicht Befriedigung verlangen können. Dieses Recht steht den Gläubigern jedoch nur zu, wenn sie glaubhaft machen, dass durch die Verschmelzung die Erfüllung ihrer Forderung gefährdet wird."
    },
    {
      "date": "2025-07-28",
      "id": "117861",
      "original_text": "Registerbekanntmachung nach dem Umwandlungsgesetz\nNordrhein-Westfalen Amtsgericht Köln HRB 90460\nbackbone management GmbH – Köln",
      "type": "Registerbekanntmachung nach dem Umwandlungsgesetz",
      "state": "Nordrhein-Westfalen",
      "amtsgericht": "Amtsgericht Köln",
      "registernummer": "HRB 90460",
      "registerart": "HRB",
      "company_name": "backbone management GmbH",
      "company_seat": "Köln",
      "details": "28.07.2025 (Bekanntmachungsdatum)\n\nNordrhein-Westfalen Amtsgericht Köln HRB 90460\nRegisterbekanntmachung nach dem Umwandlungsgesetz 28.07.2025 (Eintragungsdatum)\n\nbackbone management GmbH\nGesellschaft mit beschränkter Haftung\nKöln\n\nDen Gläubigern der an der Verschmelzung beteiligten Rechtsträger ist, wenn sie binnen sechs Monaten nach dem Tag, an dem die Eintragung der Verschmelzung in das Register des Sitzes desjenigen Rechtsträgers, dessen Gläubiger sie sind, nach § 19 Absatz 3 UmwG als bekanntgemacht gilt, ihren Anspruch nach Grund und Höhe schriftlich anmelden, Sicherheit zu leisten, soweit sie nicht Befriedigung verlangen können. Dieses Recht steht den Gläubigern jedoch nur zu, wenn sie glaubhaft machen, dass durch die Verschmelzung die Erfüllung ihrer Forderung gefährdet wird."
    },
    {
      "date": "2025-07-28",
      "id": "117862",
      "original_text": "Registerbekanntmachung nach dem Umwandlungsgesetz\nNordrhein-Westfalen Amtsgericht Düsseldorf HRB 46319\nBIOGARTEN Verwaltungs GmbH – Hilden",
      "type": "Registerbekanntmachung nach dem Umwandlungsgesetz",
      "state": "Nordrhein-Westfalen",
      "amtsgericht": "Amtsgericht Düsseldorf",
      "registernummer": "HRB 46319",
      "registerart": "HRB",
      "company_name": "BIOGARTEN Verwaltungs GmbH",
      "company_seat": "Hilden",
      "details": "28.07.2025 (Bekanntmachungsdatum)\n\nNordrhein-Westfalen Amtsgericht Düsseldorf HRB 46319\nRegisterbekanntmachung nach dem Umwandlungsgesetz 28.07.2025 (Eintragungsdatum)\n\nBIOGARTEN Verwaltungs GmbH\nGesellschaft mit beschränkter Haftung\nHilden\n\nDen Gläubigern der an der Verschmelzung beteiligten Rechtsträger ist, wenn sie binnen sechs Monaten nach dem Tag, an dem die Eintragung der Verschmelzung in das Register des Sitzes desjenigen Rechtsträgers, dessen Gläubiger sie sind, nach § 19 Absatz 3 UmwG als bekanntgemacht gilt, ihren Anspruch nach Grund und Höhe schriftlich anmelden, Sicherheit zu leisten, soweit sie nicht Befriedigung verlangen können. Dieses Recht steht den Gläubigern jedoch nur zu, wenn sie glaubhaft machen, dass durch die Verschmelzung die Erfüllung ihrer Forderung gefährdet wird."
    },
    {
      "date": "2025-07-28",
      "id": "117863",
      "original_text": "Registerbekanntmachung nach dem Umwandlungsgesetz\nNordrhein-Westfalen Amtsgericht Düsseldorf HRB 19300\nMediconsult Aktiengesellschaft für Investitionsplanung, Beteiligungsberatung und Vermittlung – Düsseldorf",
      "type": "Registerbekanntmachung nach dem Umwandlungsgesetz",
      "state": "Nordrhein-Westfalen",
      "amtsgericht": "Amtsgericht Düsseldorf",
      "registernummer": "HRB 19300",
      "registerart": "HRB",
      "company_name": "Mediconsult Aktiengesellschaft für Investitionsplanung, Beteiligungsberatung und Vermittlung",
      "company_seat": "Düsseldorf",
      "details": "28.07.2025 (Bekanntmachungsdatum)\n\nNordrhein-Westfalen Amtsgericht Düsseldorf HRB 19300\nRegisterbekanntmachung nach dem Umwandlungsgesetz 28.07.2025 (Eintragungsdatum)\n\nMediconsult Aktiengesellschaft für Investitionsplanung, Beteiligungsberatung und Vermittlung\nAktiengesellschaft\nDüsseldorf\n\nDen Gläubigern der an der formwechselnden Umwandlung beteiligten Rechtsträger ist, wenn sie binnen sechs Monaten nach dem Tag, an dem die Eintragung der formwechselnden Umwandlung in das Register des Sitzes desjenigen Rechtsträgers, dessen Gläubiger sie sind, nach § 19 Absatz 3 UmwG als bekanntgemacht gilt, ihren Anspruch nach Grund und Höhe schriftlich anmelden, Sicherheit zu leisten, soweit sie nicht Befriedigung verlangen können. Dieses Recht steht den Gläubigern jedoch nur zu, wenn sie glaubhaft machen, dass durch die formwechselnden Umwandlung die Erfüllung ihrer Forderung gefährdet wird."
    },
    {
      "date": "2025-07-28",
      "id": "117864",
      "original_text": "Registerbekanntmachung nach dem Umwandlungsgesetz\nNordrhein-Westfalen Amtsgericht Bochum HRA 8134\nVersicherungsdienst der Herner Sparkasse UG (haftungsbeschränkt) & Co. KG Finanz- und Versicherungsvermittlung – Herne",
      "type": "Registerbekanntmachung nach dem Umwandlungsgesetz",
      "state": "Nordrhein-Westfalen",
      "amtsgericht": "Amtsgericht Bochum",
      "registernummer": "HRA 8134",
      "registerart": "HRA",
      "company_name": "Versicherungsdienst der Herner Sparkasse UG (haftungsbeschränkt) & Co. KG Finanz- und Versicherungsvermittlung",
      "company_seat": "Herne",
      "details": "28.07.2025 (Bekanntmachungsdatum)\n\nNordrhein-Westfalen Amtsgericht Bochum HRA 8134\nRegisterbekanntmachung nach dem Umwandlungsgesetz 28.07.2025 (Eintragungsdatum)\n\nVersicherungsdienst der Herner Sparkasse UG (haftungsbeschränkt) & Co. KG Finanz- und Versicherungsvermittlung\nKommanditgesellschaft\nHerne\n\nDen Gläubigern der an der formwechselnden Umwandlung beteiligten Rechtsträger ist, wenn sie binnen sechs Monaten nach dem Tag, an dem die Eintragung der formwechselnden Umwandlung in das Register des Sitzes desjenigen Rechtsträgers, dessen Gläubiger sie sind, nach § 19 Absatz 3 UmwG als bekanntgemacht gilt, ihren Anspruch nach Grund und Höhe schriftlich anmelden, Sicherheit zu leisten, soweit sie nicht Befriedigung verlangen können. Dieses Recht steht den Gläubigern jedoch nur zu, wenn sie glaubhaft machen, dass durch die formwechselnden Umwandlung die Erfüllung ihrer Forderung gefährdet wird."
    },
    {
      "date": "2025-07-28",
      "id": "117865",
      "original_text": "Löschungsankündigung\nNordrhein-Westfalen Amtsgericht Dortmund HRB 8435\nCSB Computer, Systeme, Beratung und Vertriebsgesellschaft mit beschränkter Haftung. – Dortmund",
      "type": "Löschungsankündigung",
      "state": "Nordrhein-Westfalen",
      "amtsgericht": "Amtsgericht Dortmund",
      "registernummer": "HRB 8435",
      "registerart": "HRB",
      "company_name": "CSB Computer, Systeme, Beratung und Vertriebsgesellschaft mit beschränkter Haftung.",
      "company_seat": "Dortmund",
      "details": "28.07.2025 (Bekanntmachungsdatum)\n\nNordrhein-Westfalen Amtsgericht Dortmund HRB 8435\nLöschungsankündigung\n\nCSB Computer, Systeme, Beratung und Vertriebsgesellschaft mit beschränkter Haftung.\nGesellschaft mit beschränkter Haftung\nDortmund\n\nDas Registergericht beabsichtigt die Gesellschaft von Amts wegen nach § 394 FamFG zu löschen. Die Frist zur Erhebung eines Widerspruchs ist auf zwei Monate festgesetzt."
    },
    {
      "date": "2025-07-28",
      "id": "117866",
      "original_text": "Registerbekanntmachung nach dem Umwandlungsgesetz\nNordrhein-Westfalen Amtsgericht Paderborn HRB 16332\nAdven GmbH – Paderborn",
      "type": "Registerbekanntmachung nach dem Umwandlungsgesetz",
      "state": "Nordrhein-Westfalen",
      "amtsgericht": "Amtsgericht Paderborn",
      "registernummer": "HRB 16332",
      "registerart": "HRB",
      "company_name": "Adven GmbH",
      "company_seat": "Paderborn",
      "details": "28.07.2025 (Bekanntmachungsdatum)\n\nNordrhein-Westfalen Amtsgericht Paderborn HRB 16332\nRegisterbekanntmachung nach dem Umwandlungsgesetz 28.07.2025 (Eintragungsdatum)\n\nAdven GmbH\nGesellschaft mit beschränkter Haftung\nPaderborn\n\nDen Gläubigern der an der Verschmelzung beteiligten Rechtsträger ist, wenn sie binnen sechs Monaten nach dem Tag, an dem die Eintragung der Verschmelzung in das Register des Sitzes desjenigen Rechtsträgers, dessen Gläubiger sie sind, nach § 19 Absatz 3 UmwG als bekanntgemacht gilt, ihren Anspruch nach Grund und Höhe schriftlich anmelden, Sicherheit zu leisten, soweit sie nicht Befriedigung verlangen können. Dieses Recht steht den Gläubigern jedoch nur zu, wenn sie glaubhaft machen, dass durch die Verschmelzung die Erfüllung ihrer Forderung gefährdet wird."
    },
    {
      "date": "2025-07-28",
      "id": "117867",
      "original_text": "Registerbekanntmachung nach dem Umwandlungsgesetz\nNordrhein-Westfalen Amtsgericht Bochum HRB 22209\nFlachdach Herne GmbH – Herne",
      "type": "Registerbekanntmachung nach dem Umwandlungsgesetz",
      "state": "Nordrhein-Westfalen",
      "amtsgericht": "Amtsgericht Bochum",
      "registernummer": "HRB 22209",
      "registerart": "HRB",
      "company_name": "Flachdach Herne GmbH",
      "company_seat": "Herne",
      "details": "28.07.2025 (Bekanntmachungsdatum)\n\nNordrhein-Westfalen Amtsgericht Bochum HRB 22209\nRegisterbekanntmachung nach dem Umwandlungsgesetz 24.07.2025 (Eintragungsdatum)\n\nFlachdach Herne GmbH\nGesellschaft mit beschränkter Haftung\nHerne\n\nDen Gläubigern der an der Ausgliederung beteiligten Rechtsträger ist, wenn sie binnen sechs Monaten nach dem Tag, an dem die Eintragung der Ausgliederung in das Register des Sitzes derjenigen Rechtsträger deren Gläubiger sie sind, nach § 19 Absatz 3 UmwG als bekanntgemacht gilt, ihren Anspruch nach Grund und Höhe schriftlich anmelden, Sicherheit zu leisten, soweit sie nicht Befriedigung verlangen können. Dieses Recht steht den Gläubigern jedoch nur zu, wenn sie glaubhaft machen, dass durch die Ausgliederung die Erfüllung ihrer Forderung gefährdet wird."
    },
    {
      "date": "2025-07-28",
      "id": "117868",
      "original_text": "Registerbekanntmachung nach dem Umwandlungsgesetz\nNordrhein-Westfalen Amtsgericht Arnsberg HRB 13324\nddp Water Institute GmbH – Sundern",
      "type": "Registerbekanntmachung nach dem Umwandlungsgesetz",
      "state": "Nordrhein-Westfalen",
      "amtsgericht": "Amtsgericht Arnsberg",
      "registernummer": "HRB 13324",
      "registerart": "HRB",
      "company_name": "ddp Water Institute GmbH",
      "company_seat": "Sundern",
      "details": "28.07.2025 (Bekanntmachungsdatum)\n\nNordrhein-Westfalen Amtsgericht Arnsberg HRB 13324\nRegisterbekanntmachung nach dem Umwandlungsgesetz 28.07.2025 (Eintragungsdatum)\n\nddp Water Institute GmbH\nGesellschaft mit beschränkter Haftung\nSundern\n\nDen Gläubigern der an der Verschmelzung beteiligten Rechtsträger ist, wenn sie binnen sechs Monaten nach dem Tag, an dem die Eintragung der Verschmelzung in das Register des Sitzes desjenigen Rechtsträgers, dessen Gläubiger sie sind, nach § 19 Absatz 3 UmwG als bekanntgemacht gilt, ihren Anspruch nach Grund und Höhe schriftlich anmelden, Sicherheit zu leisten, soweit sie nicht Befriedigung verlangen können. Dieses Recht steht den Gläubigern jedoch nur zu, wenn sie glaubhaft machen, dass durch die Verschmelzung die Erfüllung ihrer Forderung gefährdet wird."
    },
    {
      "date": "2025-07-28",
      "id": "117869",
      "original_text": "Löschungsankündigung\nNordrhein-Westfalen Amtsgericht Gütersloh HRB 7529\nGang GmbH – Rheda-Wiedenbrück",
      "type": "Löschungsankündigung",
      "state": "Nordrhein-Westfalen",
      "amtsgericht": "Amtsgericht Gütersloh",
      "registernummer": "HRB 7529",
      "registerart": "HRB",
      "company_name": "Gang GmbH",
      "company_seat": "Rheda-Wiedenbrück",
      "details": "28.07.2025 (Bekanntmachungsdatum)\n\nNordrhein-Westfalen Amtsgericht Gütersloh HRB 7529\nLöschungsankündigung\n\nGang GmbH\nGesellschaft mit beschränkter Haftung\nRheda-Wiedenbrück\n\nDas Registergericht beabsichtigt die Gesellschaft von Amts wegen nach § 394 FamFG zu löschen. Die Frist zur Erhebung eines Widerspruchs ist auf einen Monat festgesetzt."
    },
    {
      "date": "2025-07-28",
      "id": "117870",
      "original_text": "Registerbekanntmachung nach dem Umwandlungsgesetz\nNordrhein-Westfalen Amtsgericht Siegen HRB 9420\nMMT GmbH – Siegen",
      "type": "Registerbekanntmachung nach dem Umwandlungsgesetz",
      "state": "Nordrhein-Westfalen",
      "amtsgericht": "Amtsgericht Siegen",
      "registernummer": "HRB 9420",
      "registerart": "HRB",
      "company_name": "MMT GmbH",
      "company_seat": "Siegen",
      "details": "28.07.2025 (Bekanntmachungsdatum)\n\nNordrhein-Westfalen Amtsgericht Siegen HRB 9420\nRegisterbekanntmachung nach dem Umwandlungsgesetz 28.07.2025 (Eintragungsdatum)\n\nMMT GmbH\nGesellschaft mit beschränkter Haftung\nSiegen\n\nDen Gläubigern der an der Ausgliederung beteiligten Rechtsträger ist, wenn sie binnen sechs Monaten nach dem Tag, an dem die Eintragung der Ausgliederung in das Register des Sitzes derjenigen Rechtsträger deren Gläubiger sie sind, nach § 19 Absatz 3 UmwG als bekanntgemacht gilt, ihren Anspruch nach Grund und Höhe schriftlich anmelden, Sicherheit zu leisten, soweit sie nicht Befriedigung verlangen können. Dieses Recht steht den Gläubigern jedoch nur zu, wenn sie glaubhaft machen, dass durch die Ausgliederung die Erfüllung ihrer Forderung gefährdet wird."
    },
    {
      "date": "2025-07-28",
      "id": "117871",
      "original_text": "Löschungsankündigung\nNordrhein-Westfalen Amtsgericht Hagen HRB 11125\nISLI GmbH – Hagen",
      "type": "Löschungsankündigung",
      "state": "Nordrhein-Westfalen",
      "amtsgericht": "Amtsgericht Hagen",
      "registernummer": "HRB 11125",
      "registerart": "HRB",
      "company_name": "ISLI GmbH",
      "company_seat": "Hagen",
      "details": "28.07.2025 (Bekanntmachungsdatum)\n\nNordrhein-Westfalen Amtsgericht Hagen HRB 11125\nLöschungsankündigung\n\nISLI GmbH\nGesellschaft mit beschränkter Haftung\nHagen\n\nIn obiger Handelsregistersache wird bekannt gemacht:\nDas Registergericht beabsichtigt, die im Handelsregister eingetragene Gesellschaft gemäß § 394 I FamFG wegen Vermögenslosigkeit von Amts wegen zu löschen. Gegen diese Verfügung kann Widerspruch eingelegt werden. Die Frist zur Erhebung eines Widerspruchs gegen die beabsichtigte Löschung von Amts wegen ist auf drei Monate festgesetzt.\n\nRechtsbehelfsbelehrung:\nGegen diese Verfügung können Sie Widerspruch einlegen.\n\nDer Widerspruch ist bei dem Amtsgericht Hagen, Heinitzstraße 42, 58097 Hagen schriftlich in deutscher Sprache oder zur Niederschrift der Geschäftsstelle einzulegen. Der Widerspruch kann auch zur Niederschrift der Geschäftsstelle eines jeden Amtsgerichts abgegeben werden.\n\nDer Widerspruch muss spätestens innerhalb der gesetzten Frist bei dem Amtsgericht Hagen eingegangen sein. Dies gilt auch dann, wenn der Widerspruch zur Geschäftsstelle eines anderen Amtsgerichtes abgegeben wurde. Die Frist beginnt mit der Veröffentlichung. Fällt das Ende der Frist auf einen Sonntag, einen allgemeinen Feiertag oder Sonnabend, so endet die Frist mit Ablauf des nächsten Werktages.\n\nDer Widerspruch muss die Bezeichnung der angefochtenen Verfügung sowie die Erklärung erhalten, dass Widerspruch gegen diese Verfügung eingelegt wird. Er ist zu unterzeichnen und soll begründet werden."
    },
    {
      "date": "2025-07-28",
      "id": "117872",
      "original_text": "Registerbekanntmachung nach dem Umwandlungsgesetz\nNordrhein-Westfalen Amtsgericht Köln HRA 38207\nInstitut für schulbegleitenden Unterricht Thilo Schenk e.K. – Köln",
      "type": "Registerbekanntmachung nach dem Umwandlungsgesetz",
      "state": "Nordrhein-Westfalen",
      "amtsgericht": "Amtsgericht Köln",
      "registernummer": "HRA 38207",
      "registerart": "HRA",
      "company_name": "Institut für schulbegleitenden Unterricht Thilo Schenk e.K.",
      "company_seat": "Köln",
      "details": "28.07.2025 (Bekanntmachungsdatum)\n\nNordrhein-Westfalen Amtsgericht Köln HRA 38207\nRegisterbekanntmachung nach dem Umwandlungsgesetz 28.07.2025 (Eintragungsdatum)\n\nInstitut für schulbegleitenden Unterricht Thilo Schenk e.K.\nEinzelkaufmann / Einzelkauffrau\nKöln\n\nDen Gläubigern der an der Ausgliederung beteiligten Rechtsträger ist, wenn sie binnen sechs Monaten nach dem Tag, an dem die Eintragung der Ausgliederung in das Register des Sitzes desjenigen Rechtsträgers, dessen Gläubiger sie sind, nach § 19 Absatz 3 UmwG als bekanntgemacht gilt, ihren Anspruch nach Grund und Höhe schriftlich anmelden, Sicherheit zu leisten, soweit sie nicht Befriedigung verlangen können. Dieses Recht steht den Gläubigern jedoch nur zu, wenn sie glaubhaft machen, dass durch die Ausgliederung die Erfüllung ihrer Forderung gefährdet wird."
    },
    {
      "date": "2025-07-28",
      "id": "117873",
      "original_text": "Registerbekanntmachung nach dem Umwandlungsgesetz\nNordrhein-Westfalen Amtsgericht Neuss HRB 22329\nacubat UG (haftungsbeschränkt) – Korschenbroich",
      "type": "Registerbekanntmachung nach dem Umwandlungsgesetz",
      "state": "Nordrhein-Westfalen",
      "amtsgericht": "Amtsgericht Neuss",
      "registernummer": "HRB 22329",
      "registerart": "HRB",
      "company_name": "acubat UG (haftungsbeschränkt)",
      "company_seat": "Korschenbroich",
      "details": "28.07.2025 (Bekanntmachungsdatum)\n\nNordrhein-Westfalen Amtsgericht Neuss HRB 22329\nRegisterbekanntmachung nach dem Umwandlungsgesetz 28.07.2025 (Eintragungsdatum)\n\nacubat UG (haftungsbeschränkt)\nGesellschaft mit beschränkter Haftung\nKorschenbroich\n\nDen Gläubigern der an der Verschmelzung beteiligten Rechtsträger ist, wenn sie binnen sechs Monaten nach dem Tag, an dem die Eintragung der Verschmelzung in das Register des Sitzes desjenigen Rechtsträgers, dessen Gläubiger sie sind, nach § 19 Absatz 3 UmwG als bekanntgemacht gilt, ihren Anspruch nach Grund und Höhe schriftlich anmelden, Sicherheit zu leisten, soweit sie nicht Befriedigung verlangen können. Dieses Recht steht den Gläubigern jedoch nur zu, wenn sie glaubhaft machen, dass durch die Verschmelzung die Erfüllung ihrer Forderung gefährdet wird."
    },
    {
      "date": "2025-07-28",
      "id": "117874",
      "original_text": "Registerbekanntmachung nach dem Umwandlungsgesetz\nNordrhein-Westfalen Amtsgericht Bochum HRB 12779\nBuse Getränke Vertrieb GmbH Getränkefachgroßhandel – Bochum",
      "type": "Registerbekanntmachung nach dem Umwandlungsgesetz",
      "state": "Nordrhein-Westfalen",
      "amtsgericht": "Amtsgericht Bochum",
      "registernummer": "HRB 12779",
      "registerart": "HRB",
      "company_name": "Buse Getränke Vertrieb GmbH Getränkefachgroßhandel",
      "company_seat": "Bochum",
      "details": "28.07.2025 (Bekanntmachungsdatum)\n\nNordrhein-Westfalen Amtsgericht Bochum HRB 12779\nRegisterbekanntmachung nach dem Umwandlungsgesetz 25.07.2025 (Eintragungsdatum)\n\nBuse Getränke Vertrieb GmbH Getränkefachgroßhandel\nGesellschaft mit beschränkter Haftung\nBochum\n\nDen Gläubigern der an der Verschmelzung beteiligten Rechtsträger ist, wenn sie binnen sechs Monaten nach dem Tag, an dem die Eintragung der Verschmelzung in das Register des Sitzes derjenigen Rechtsträger deren Gläubiger sie sind, nach § 19 Absatz 3 UmwG als bekanntgemacht gilt, ihren Anspruch nach Grund und Höhe schriftlich anmelden, Sicherheit zu leisten, soweit sie nicht Befriedigung verlangen können. Dieses Recht steht den Gläubigern jedoch nur zu, wenn sie glaubhaft machen, dass durch die Verschmelzung die Erfüllung ihrer Forderung gefährdet wird."
    },
    {
      "date": "2025-07-28",
      "id": "117875",
      "original_text": "Sonstige Registerbekanntmachung\nNordrhein-Westfalen Amtsgericht Duisburg HRB 16086\nALDI Digital Services GmbH – Mülheim an der Ruhr",
      "type": "Sonstige Registerbekanntmachung",
      "state": "Nordrhein-Westfalen",
      "amtsgericht": "Amtsgericht Duisburg",
      "registernummer": "HRB 16086",
      "registerart": "HRB",
      "company_name": "ALDI Digital Services GmbH",
      "company_seat": "Mülheim an der Ruhr",
      "details": "28.07.2025 (Bekanntmachungsdatum)\n\nNordrhein-Westfalen Amtsgericht Duisburg HRB 16086\nSonstige Registerbekanntmachung 28.07.2025 (Eintragungsdatum)\n\nALDI Digital Services GmbH\nGesellschaft mit beschränkter Haftung\nMülheim an der Ruhr\n\nAls nicht eingetragen wird veröffentlicht: Den Gläubigern der Gesellschaft, deren Forderungen begründet worden sind bevor die Eintragung der Beendigung des Beherrschungs- und Gewinnabführungsvertrages  in das Handelsregister nach § 10 des Handelsgesetzbuches als bekanntgemacht gilt, hat der andere Vertragsteil Sicherheit zu leisten, wenn sie sich binnen sechs Monaten nach der Bekanntmachung der Eintragung zu diesem Zweck bei ihm melden."
    },
    {
      "date": "2025-07-28",
      "id": "117876",
      "original_text": "Löschungsankündigung\nNordrhein-Westfalen Amtsgericht Düsseldorf HRB 87390\nMODDS GmbH – Düsseldorf",
      "type": "Löschungsankündigung",
      "state": "Nordrhein-Westfalen",
      "amtsgericht": "Amtsgericht Düsseldorf",
      "registernummer": "HRB 87390",
      "registerart": "HRB",
      "company_name": "MODDS GmbH",
      "company_seat": "Düsseldorf",
      "details": "28.07.2025 (Bekanntmachungsdatum)\n\nNordrhein-Westfalen Amtsgericht Düsseldorf HRB 87390\nLöschungsankündigung\n\nMODDS GmbH\nGesellschaft mit beschränkter Haftung\nDüsseldorf\n\nDas Registergericht beabsichtigt die Gesellschaft von Amts wegen nach § 394 FamFG zu löschen. Die Frist zur Erhebung eines Widerspruchs ist auf 3 Wochen festgesetzt.\n\nRechtsbehelfsbelehrung:\nDas Widerspruchsrecht steht jedem zu, der an der Unterlassung der Löschung ein berechtigtes Interesse hat. Der Widerspruch ist bei dem Amtsgericht Düsseldorf -Registergericht-, Werdener Straße 1, 40227 Düsseldorf schriftlich in deutscher Sprache oder zur Niederschrift der Geschäftsstelle einzulegen. Der Widerspruch kann auch zur Niederschrift der Geschäftsstelle eines jeden Amtsgerichtes abgegeben werden. Die Einlegung ist auch durch Übertragung eines elektronischen Dokuments an die elektronische Poststelle des Gerichts möglich. Das elektronische Dokument muss für die Bearbeitung durch das Gericht geeignet und mit einer qualifizierten elektronischen Signatur der verantwortenden Person versehen sein oder von der verantwortenden Person signiert und auf einem sicheren Übermittlungsweg gemäß § 130a ZPO nach näherer Maßgabe der Verordnung über die technischen Rahmenbedingungen des elektronischen Rechtsverkehrs und über das besondere elektronische Behördenpostfach (BGBl. I, S.3803) eingereicht werden. Weitere Informationen erhalten Sie auf der Internetseite www.justiz.de.\nDer Widerspruch muss spätestens innerhalb der gesetzten Frist nach dem Datum der Bekanntmachung der Löschungsankündigung bei dem Amtsgericht - Registergericht - Düsseldorf eingegangen sein.  Dies gilt auch dann, wenn der Widerspruch zur Niederschrift der Geschäftsstelle eines anderen Amtsgerichtes abgegeben wurde. Die Frist beginnt mit dem Tage der Bekanntmachung der Löschungsankündigung in dem für die Bekanntmachung der Eintragungen in das Handelsregister bestimmten elektronischen Informations- und Kommunikationssystem nach § 10 des Handelsgesetzbuches. Fällt das Ende der Frist auf einen Sonntag, einen allgemeinen Feiertag oder Sonnabend, so endet die Frist mit Ablauf des nächsten Werktages.\nDer Widerspruch muss die Bezeichnung der angefochtenen Löschungsankündigung sowie die Erklärung enthalten, dass Widerspruch gegen diese Löschungsankündigung eingelegt wird. Er ist zu unterzeichnen und soll begründet werden."
    },
    {
      "date": "2025-07-28",
      "id": "117877",
      "original_text": "Löschungsankündigung\nNordrhein-Westfalen Amtsgericht Duisburg HRA 13627\nNFT Dogtari KG – Mülheim an der Ruhr",
      "type": "Löschungsankündigung",
      "state": "Nordrhein-Westfalen",
      "amtsgericht": "Amtsgericht Duisburg",
      "registernummer": "HRA 13627",
      "registerart": "HRA",
      "company_name": "NFT Dogtari KG",
      "company_seat": "Mülheim an der Ruhr",
      "details": "28.07.2025 (Bekanntmachungsdatum)\n\nNordrhein-Westfalen Amtsgericht Duisburg HRA 13627\nLöschungsankündigung\n\nNFT Dogtari KG\nKommanditgesellschaft\nMülheim an der Ruhr\n\nHRA 13627, NFT Dogtari KG , soll von Amts wegen gemäß §§ 31 Abs. 2, 6 HGB, 393 FamFG gelöscht werden.\nDie Frist zur Erhebung eines Widerspruchs gegen die beabsichtigte Löschung von Amts wegen ist auf drei Monate festgesetzt.\n\nRechtsbehelfsbelehrung\nGegen diese Verfügung können Sie Widerspruch einlegen.\nDer Widerspruch ist bei dem Amtsgericht -Registergericht- Duisburg, Kardinal-Galen-Str. 124-132, 47058 Duisburg, schriftlich in deutscher Sprache oder zur Niederschrift der Geschäftsstelle einzulegen. Der Widerspruch kann auch zur Niederschrift der Geschäftsstelle eines jeden Amtsgerichtes abgegeben werden.\n\nDer Widerspruch muss spätestens innerhalb der gesetzten Frist nach der schriftlichen Bekanntgabe der Verfügung bei dem Amtsgericht Duisburg eingegangen sein. Dies gilt auch dann, wenn der Widerspruch zur Niederschrift der Geschäftsstelle eines anderen Amtsgerichtes abgegeben wurde. Die Frist beginnt mit der schriftlichen Bekanntgabe der Verfügung.\n\nDer Widerspruch muss die Bezeichnung der angefochtenen Verfügung sowie die Erklärung enthalten, dass Widerspruch gegen diese Verfügung eingelegt wird. Er ist zu unterzeichnen und soll begründet werden.\n\nDie Einlegung ist auch durch Übertragung eines elektronischen Dokuments an die elektronische Poststelle des Gerichts möglich. Das elektronische Dokument muss für die Bearbeitung durch das Gericht geeignet und mit einer qualifizierten elektronischen Signatur der verantwortenden Person versehen sein oder von der verantwortenden Person signiert und auf einem sicheren Übermittlungsweg gemäß § 130 a ZPO nach näherer Maßgabe der Verordnung über die technischen Rahmenbedingungen des elektronischen Rechtsverkehrs und über das besondere elektronische Behördenpostfach (BGBl. 2017 I, S. 3803) eingereicht werden. Weitere Informationen erhalten Sie auf der Internetseite www.justiz.de."
    },
    {
      "date": "2025-07-28",
      "id": "117878",
      "original_text": "Registerbekanntmachung nach dem Umwandlungsgesetz\nNordrhein-Westfalen Amtsgericht Düsseldorf HRB 100391\necom fulfillment GmbH – Monheim am Rhein",
      "type": "Registerbekanntmachung nach dem Umwandlungsgesetz",
      "state": "Nordrhein-Westfalen",
      "amtsgericht": "Amtsgericht Düsseldorf",
      "registernummer": "HRB 100391",
      "registerart": "HRB",
      "company_name": "ecom fulfillment GmbH",
      "company_seat": "Monheim am Rhein",
      "details": "28.07.2025 (Bekanntmachungsdatum)\n\nNordrhein-Westfalen Amtsgericht Düsseldorf HRB 100391\nRegisterbekanntmachung nach dem Umwandlungsgesetz 28.07.2025 (Eintragungsdatum)\n\necom fulfillment GmbH\nGesellschaft mit beschränkter Haftung\nMonheim am Rhein\n\nDen Gläubigern der an der Verschmelzung beteiligten Rechtsträger ist, wenn sie binnen sechs Monaten nach dem Tag, an dem die Eintragung der Verschmelzung in das Register des Sitzes desjenigen Rechtsträgers, dessen Gläubiger sie sind, nach § 19 Absatz 3 UmwG als bekanntgemacht gilt, ihren Anspruch nach Grund und Höhe schriftlich anmelden, Sicherheit zu leisten, soweit sie nicht Befriedigung verlangen können. Dieses Recht steht den Gläubigern jedoch nur zu, wenn sie glaubhaft machen, dass durch die Verschmelzung die Erfüllung ihrer Forderung gefährdet wird."
    },
    {
      "date": "2025-07-28",
      "id": "117879",
      "original_text": "Registerbekanntmachung nach dem Umwandlungsgesetz\nNordrhein-Westfalen Amtsgericht Essen HRB 27425\nGreyfield Development GmbH – Essen",
      "type": "Registerbekanntmachung nach dem Umwandlungsgesetz",
      "state": "Nordrhein-Westfalen",
      "amtsgericht": "Amtsgericht Essen",
      "registernummer": "HRB 27425",
      "registerart": "HRB",
      "company_name": "Greyfield Development GmbH",
      "company_seat": "Essen",
      "details": "28.07.2025 (Bekanntmachungsdatum)\n\nNordrhein-Westfalen Amtsgericht Essen HRB 27425\nRegisterbekanntmachung nach dem Umwandlungsgesetz 28.07.2025 (Eintragungsdatum)\n\nGreyfield Development GmbH\nGesellschaft mit beschränkter Haftung\nEssen\n\nDen Gläubigern der an der Verschmelzung beteiligten Rechtsträger ist, wenn sie binnen sechs Monaten nach dem Tag, an dem die Eintragung der Verschmelzung in das Register des Sitzes derjenigen Rechtsträger deren Gläubiger sie sind, nach § 19 Absatz 3 UmwG als bekanntgemacht gilt, ihren Anspruch nach Grund und Höhe schriftlich anmelden, Sicherheit zu leisten, soweit sie nicht Befriedigung verlangen können. Dieses Recht steht den Gläubigern jedoch nur zu, wenn sie glaubhaft machen, dass durch die Verschmelzung die Erfüllung ihrer Forderung gefährdet wird."
    },
    {
      "date": "2025-07-28",
      "id": "117880",
      "original_text": "Registerbekanntmachung nach dem Umwandlungsgesetz\nNordrhein-Westfalen Amtsgericht Paderborn HRB 16772\nCuraleaf Deutschland GmbH – Paderborn",
      "type": "Registerbekanntmachung nach dem Umwandlungsgesetz",
      "state": "Nordrhein-Westfalen",
      "amtsgericht": "Amtsgericht Paderborn",
      "registernummer": "HRB 16772",
      "registerart": "HRB",
      "company_name": "Curaleaf Deutschland GmbH",
      "company_seat": "Paderborn",
      "details": "28.07.2025 (Bekanntmachungsdatum)\n\nNordrhein-Westfalen Amtsgericht Paderborn HRB 16772\nRegisterbekanntmachung nach dem Umwandlungsgesetz 28.07.2025 (Eintragungsdatum)\n\nCuraleaf Deutschland GmbH\nGesellschaft mit beschränkter Haftung\nPaderborn\n\nDen Gläubigern der an der Verschmelzung beteiligten Rechtsträger ist, wenn sie binnen sechs Monaten nach dem Tag, an dem die Eintragung der Verschmelzung in das Register des Sitzes desjenigen Rechtsträgers, dessen Gläubiger sie sind, nach § 19 Absatz 3 UmwG als bekanntgemacht gilt, ihren Anspruch nach Grund und Höhe schriftlich anmelden, Sicherheit zu leisten, soweit sie nicht Befriedigung verlangen können. Dieses Recht steht den Gläubigern jedoch nur zu, wenn sie glaubhaft machen, dass durch die Verschmelzung die Erfüllung ihrer Forderung gefährdet wird."
    },
    {
      "date": "2025-07-28",
      "id": "117881",
      "original_text": "Löschungsankündigung\nNordrhein-Westfalen Amtsgericht Mönchengladbach HRB 14417\nGreene Planet GmbH – Erkelenz",
      "type": "Löschungsankündigung",
      "state": "Nordrhein-Westfalen",
      "amtsgericht": "Amtsgericht Mönchengladbach",
      "registernummer": "HRB 14417",
      "registerart": "HRB",
      "company_name": "Greene Planet GmbH",
      "company_seat": "Erkelenz",
      "details": "28.07.2025 (Bekanntmachungsdatum)\n\nNordrhein-Westfalen Amtsgericht Mönchengladbach HRB 14417\nLöschungsankündigung\n\nGreene Planet GmbH\nGesellschaft mit beschränkter Haftung\nErkelenz\n\nGreene Planet GmbH, Erkelenz (Amtsgericht Mönchengladbach, HRB 14417).\nDas Registergericht beabsichtigt, die im Handelsregister eingetragene Gesellschaft gemäß § 394 Absatz 1 FamFG wegen Vermögenslosigkeit von Amts wegen zu löschen. Gegen diese Verfügung kann Widerspruch eingelegt werden. Die Frist zur Erhebung eines Widerspruchs gegen die beabsichtigte Löschung von Amts wegen ist auf drei Monate festgesetzt."
    },
    {
      "date": "2025-07-28",
      "id": "117882",
      "original_text": "Löschungsankündigung\nNordrhein-Westfalen Amtsgericht Aachen HRB 26736\nSeniorenheim Landidylle GmbH – Aachen",
      "type": "Löschungsankündigung",
      "state": "Nordrhein-Westfalen",
      "amtsgericht": "Amtsgericht Aachen",
      "registernummer": "HRB 26736",
      "registerart": "HRB",
      "company_name": "Seniorenheim Landidylle GmbH",
      "company_seat": "Aachen",
      "details": "28.07.2025 (Bekanntmachungsdatum)\n\nNordrhein-Westfalen Amtsgericht Aachen HRB 26736\nLöschungsankündigung\n\nSeniorenheim Landidylle GmbH\nGesellschaft mit beschränkter Haftung\nAachen\n\nDas Registergericht beabsichtigt, von Amts wegen die Gesellschaft wegen Vermögenslosigkeit nach § 394 FamFG zu löschen.\nweil das Insolvenzverfahren Amtsgericht Aachen (Az.: 91 IN 114/24) beendet und Vermögen der Gesellschaft nicht mehr erkennbar ist.\n\nZur Geltendmachung des Widerspruchs gegen die beabsichtigte Löschung wird hiermit eine Frist von einem Monat ab Veröffentlichung dieser Ankündigung bestimmt.\n\nRechtsbehelfsbelehrung:\n\nGegen diese Verfügung kann Widerspruch eingelegt werden. Zum Widerspruch ist jeder berechtigt, der an der Unterlassung der Löschung ein berechtigtes Interesse hat.\n\nDer Widerspruch ist bei dem Amtsgericht Aachen, Adalbertsteinweg 92, 52070 Aachen schriftlich in deutscher Sprache oder zur Niederschrift der Geschäftsstelle einzulegen. Der Widerspruch kann auch zur Niederschrift der Geschäftsstelle eines jeden Amtsgerichtes abgegeben werden.\n\nDer Widerspruch muss spätestens innerhalb der gesetzten Frist nach der Bekanntgabe der Verfügung bei dem Amtsgericht Aachen eingegangen sein. Dies gilt auch dann, wenn der Widerspruch zur Niederschrift der Geschäftsstelle eines anderen Amtsgerichtes abgegeben wurde. Die Frist beginnt mit der Bekanntgabe der Verfügung durch Veröffentlichung. Fällt das Ende der Frist auf einen Sonntag, einen allgemeinen Feiertag oder Sonnabend, so endet die Frist mit Ablauf des nächsten Werktages.\n\nDer Widerspruch muss die Bezeichnung der angefochtenen Verfügung sowie die Erklärung enthalten, dass Widerspruch gegen diese Verfügung eingelegt wird. Er ist zu unterzeichnen und soll begründet werden.\n\nDie Einlegung ist auch durch Übertragung eines elektronischen Dokuments an die elektronische Poststelle des Gerichts möglich. Das elektronische Dokument muss für die Bearbeitung durch das Gericht geeignet und mit einer qualifizierten elektronischen Signatur der verantwortenden Person versehen sein oder von der verantwortenden Person signiert und auf einem sicheren Übermittlungsweg gemäß § 130 a ZPO nach näherer Maßgabe der Verordnung über die technischen Rahmenbedingungen des elektronischen Rechtsverkehrs und über das besondere elektronische Behördenpostfach (BGBl. I, S. 3803) eingereicht werden. Weitere Informationen erhalten Sie auf der Internetseite www.justiz.de."
    },
    {
      "date": "2025-07-28",
      "id": "117883",
      "original_text": "Registerbekanntmachung nach dem Umwandlungsgesetz\nNordrhein-Westfalen Amtsgericht Düsseldorf HRB 109734\nMediconsult GmbH – Düsseldorf",
      "type": "Registerbekanntmachung nach dem Umwandlungsgesetz",
      "state": "Nordrhein-Westfalen",
      "amtsgericht": "Amtsgericht Düsseldorf",
      "registernummer": "HRB 109734",
      "registerart": "HRB",
      "company_name": "Mediconsult GmbH",
      "company_seat": "Düsseldorf",
      "details": "28.07.2025 (Bekanntmachungsdatum)\n\nNordrhein-Westfalen Amtsgericht Düsseldorf HRB 109734\nRegisterbekanntmachung nach dem Umwandlungsgesetz 28.07.2025 (Eintragungsdatum)\n\nMediconsult GmbH\nGesellschaft mit beschränkter Haftung\nDüsseldorf\n\nDen Gläubigern der an der formwechselnden Umwandlung beteiligten Rechtsträger ist, wenn sie binnen sechs Monaten nach dem Tag, an dem die Eintragung der formwechselnden Umwandlung in das Register des Sitzes desjenigen Rechtsträgers, dessen Gläubiger sie sind, nach § 19 Absatz 3 UmwG als bekanntgemacht gilt, ihren Anspruch nach Grund und Höhe schriftlich anmelden, Sicherheit zu leisten, soweit sie nicht Befriedigung verlangen können. Dieses Recht steht den Gläubigern jedoch nur zu, wenn sie glaubhaft machen, dass durch die formwechselnden Umwandlung die Erfüllung ihrer Forderung gefährdet wird."
    },
    {
      "date": "2025-07-28",
      "id": "117884",
      "original_text": "Registerbekanntmachung nach dem Umwandlungsgesetz\nNordrhein-Westfalen Amtsgericht Köln HRB 123683\nInstitut für schulbegleitenden Unterricht Schenk GmbH – Köln",
      "type": "Registerbekanntmachung nach dem Umwandlungsgesetz",
      "state": "Nordrhein-Westfalen",
      "amtsgericht": "Amtsgericht Köln",
      "registernummer": "HRB 123683",
      "registerart": "HRB",
      "company_name": "Institut für schulbegleitenden Unterricht Schenk GmbH",
      "company_seat": "Köln",
      "details": "28.07.2025 (Bekanntmachungsdatum)\n\nNordrhein-Westfalen Amtsgericht Köln HRB 123683\nRegisterbekanntmachung nach dem Umwandlungsgesetz 28.07.2025 (Eintragungsdatum)\n\nInstitut für schulbegleitenden Unterricht Schenk GmbH\nGesellschaft mit beschränkter Haftung\nKöln\n\nDen Gläubigern der an der Ausgliederung beteiligten Rechtsträger ist, wenn sie binnen sechs Monaten nach dem Tag, an dem die Eintragung der Ausgliederung in das Register des Sitzes desjenigen Rechtsträgers, dessen Gläubiger sie sind, nach § 19 Absatz 3 UmwG als bekanntgemacht gilt, ihren Anspruch nach Grund und Höhe schriftlich anmelden, Sicherheit zu leisten, soweit sie nicht Befriedigung verlangen können. Dieses Recht steht den Gläubigern jedoch nur zu, wenn sie glaubhaft machen, dass durch die Ausgliederung die Erfüllung ihrer Forderung gefährdet wird."
    },
    {
      "date": "2025-07-28",
      "id": "117885",
      "original_text": "Löschungsankündigung\nNordrhein-Westfalen Amtsgericht Münster HRB 18989\nPersonallogistik Nord-West GmbH – Beckum",
      "type": "Löschungsankündigung",
      "state": "Nordrhein-Westfalen",
      "amtsgericht": "Amtsgericht Münster",
      "registernummer": "HRB 18989",
      "registerart": "HRB",
      "company_name": "Personallogistik Nord-West GmbH",
      "company_seat": "Beckum",
      "details": "28.07.2025 (Bekanntmachungsdatum)\n\nNordrhein-Westfalen Amtsgericht Münster HRB 18989\nLöschungsankündigung\n\nPersonallogistik Nord-West GmbH\nGesellschaft mit beschränkter Haftung\nBeckum\n\nDas Registergericht beabsichtigt die Gesellschaft von Amts wegen nach § 394 FamFG zu löschen. Die Frist zur Erhebung eines Widerspruchs ist auf 3 Wochen festgesetzt.\n\nRechtbehelfsbelehrung:\n\nGegen diese Verfügung können Sie Widerspruch einlegen.\n\nDer Widerspruch ist bei dem Amtsgericht Münster, Gerichtsstraße 2 bis 6, 48149 Münster schriftlich in deutscher Sprache oder zur Niederschrift der Geschäftsstelle eines jeden Amtsgerichtes abgegeben werden.\nDie Einlegung ist auch durch Übertragung eines elektronischen Dokuments an die elektronische Poststelle des Gerichts möglich. Das elektronische Dokument muss für die Bearbeitung durch das Gericht geeignet und mit einer qualifizierten elektronischen Signatur der verantwortenden Person versehen sein oder von der verantwortenden Person signiert und auf einem sicheren Übermittlungsweg gem. § 130a ZPO nach nähere Maßgabe der Verordnung über die technischen Rahmenbedingungen des elektronischen Rechtsverkehrs und über das besondere elektronische Behördenpostfach (BGBI. I. S.3808) eingereicht werden. Weitere Informationen erhalten Sie auf der Internetseite www.justiz.de.\n\nDer Widerspruch muss spätestens innerhalb der gesetzten Frist nach der schriftlichen Bekanntgabe der Verfügung bei dem Amtsgericht Münster eingegangen sein. Dies gilt auch dann, wenn der Widerspruch zur Niederschrift der Geschäftsstelle eines anderen Amtsgerichtes abgegeben wurde. Die Frist beginnt mit der schriftlichen Bekanntgabe der Verfügung, spätestens mit Ablauf von fünf Monaten nach Erlass der Verfügung. Die Bekanntgabe ist entweder durch Zustellung oder am dritten Tage nach Aufgabe zur Post bewirkt. Fällt das Ende der First auf einen Sonntag, einen allgemeinen Feiertag oder Sonnabend, so endet die Frist mit Ablauf des nächsten Werktages.\n\nDer Widerspruch muss die Bezeichnung der angefochtenen Verfügung sowie die Erklärung enthalten, dass Widerspruch gegen diese Verfügung eingelegt wird. Er ist zu unterzeichnen  und soll begründet werden."
    },
    {
      "date": "2025-07-28",
      "id": "117886",
      "original_text": "Löschungsankündigung\nThüringen Amtsgericht Jena HRB 503623\nelmi Verwaltungs-GmbH – Erfurt",
      "type": "Löschungsankündigung",
      "state": "Thüringen",
      "amtsgericht": "Amtsgericht Jena",
      "registernummer": "HRB 503623",
      "registerart": "HRB",
      "company_name": "elmi Verwaltungs-GmbH",
      "company_seat": "Erfurt",
      "details": "28.07.2025 (Bekanntmachungsdatum)\n\nThüringen Amtsgericht Jena HRB 503623\nLöschungsankündigung\n\nelmi Verwaltungs-GmbH\nGesellschaft mit beschränkter Haftung\nErfurt\n\nDas Registergericht beabsichtigt, die im Handelsregister eingetragene Gesellschaft wegen Vermögenslosigkeit nach § 394 FamFG von Amts wegen zu löschen. Die Frist zur Erhebung eines Widerspruchs gegen die beabsichtigte Löschung wird auf 6 Wochen festgesetzt."
    },
    {
      "date": "2025-07-28",
      "id": "117887",
      "original_text": "Löschungsankündigung\nThüringen Amtsgericht Jena HRA 501333\nelmi GmbH & Co. KG – Erfurt",
      "type": "Löschungsankündigung",
      "state": "Thüringen",
      "amtsgericht": "Amtsgericht Jena",
      "registernummer": "HRA 501333",
      "registerart": "HRA",
      "company_name": "elmi GmbH & Co. KG",
      "company_seat": "Erfurt",
      "details": "28.07.2025 (Bekanntmachungsdatum)\n\nThüringen Amtsgericht Jena HRA 501333\nLöschungsankündigung\n\nelmi GmbH & Co. KG\nKommanditgesellschaft\nErfurt\n\nDas Registergericht beabsichtigt, die im Handelsregister eingetragene Gesellschaft wegen Vermögenslosigkeit nach § 394 FamFG von Amts wegen zu löschen. Die Frist zur Erhebung eines Widerspruchs gegen die beabsichtigte Löschung wird auf 6 Wochen festgesetzt."
    },
    {
      "date": "2025-07-28",
      "id": "117888",
      "original_text": "Löschungsankündigung\nThüringen Amtsgericht Jena HRB 201391\nDittmar & Schneider Gebäudereinigung GmbH – Jena",
      "type": "Löschungsankündigung",
      "state": "Thüringen",
      "amtsgericht": "Amtsgericht Jena",
      "registernummer": "HRB 201391",
      "registerart": "HRB",
      "company_name": "Dittmar & Schneider Gebäudereinigung GmbH",
      "company_seat": "Jena",
      "details": "28.07.2025 (Bekanntmachungsdatum)\n\nThüringen Amtsgericht Jena HRB 201391\nLöschungsankündigung\n\nDittmar & Schneider Gebäudereinigung GmbH\nGesellschaft mit beschränkter Haftung\nJena\n\nDas Registergericht beabsichtigt, den im Handelsregister eingetragenen Geschäftsführer Ronald Herold wegen unzulässiger Eintragung nach § 395 FamFG von Amts wegen zu löschen. Die Frist zur Erhebung eines Widerspruchs gegen die beabsichtigte Löschung wird auf 2 Wochen  festgesetzt."
    },
    {
      "date": "2025-07-28",
      "id": "117889",
      "original_text": "Löschungsankündigung\nThüringen Amtsgericht Jena HRB 511714\nGastronauten UG (haftungsbeschränkt) – Erfurt",
      "type": "Löschungsankündigung",
      "state": "Thüringen",
      "amtsgericht": "Amtsgericht Jena",
      "registernummer": "HRB 511714",
      "registerart": "HRB",
      "company_name": "Gastronauten UG (haftungsbeschränkt)",
      "company_seat": "Erfurt",
      "details": "28.07.2025 (Bekanntmachungsdatum)\n\nThüringen Amtsgericht Jena HRB 511714\nLöschungsankündigung\n\nGastronauten UG (haftungsbeschränkt)\nGesellschaft mit beschränkter Haftung\nErfurt\n\nDas Registergericht beabsichtigt, die im Handelsregister eingetragene Gesellschaft wegen Vermögenslosigkeit nach § 394 FamFG von Amts wegen zu löschen. Die Frist zur Erhebung eines Widerspruchs gegen die beabsichtigte Löschung wird auf 6 Wochen festgesetzt."
    },
    {
      "date": "2025-07-28",
      "id": "117890",
      "original_text": "Löschungsankündigung\nHessen Amtsgericht Frankfurt am Main HRB 73218\nPatina Lounge GmbH – Frankfurt am Main",
      "type": "Löschungsankündigung",
      "state": "Hessen",
      "amtsgericht": "Amtsgericht Frankfurt am Main",
      "registernummer": "HRB 73218",
      "registerart": "HRB",
      "company_name": "Patina Lounge GmbH",
      "company_seat": "Frankfurt am Main",
      "details": "28.07.2025 (Bekanntmachungsdatum)\n\nHessen Amtsgericht Frankfurt am Main HRB 73218\nLöschungsankündigung 28.07.2025 (Eintragungsdatum)\n\nPatina Lounge GmbH\nGesellschaft mit beschränkter Haftung\nFrankfurt am Main\n\nDas Registergericht beabsichtigt die im Handelsregister eingetragene Gesellschaft von Amts wegen nach § 394 FamFG zu löschen. Die Frist zur Erhebung eines Widerspruchs gegen die beabsichtigte Löschung wird auf 1 Monat festgesetzt."
    },
    {
      "date": "2025-07-28",
      "id": "117891",
      "original_text": "Löschungsankündigung\nHessen Amtsgericht Frankfurt am Main HRB 99872\nBaschar Business Center GmbH – Frankfurt am Main",
      "type": "Löschungsankündigung",
      "state": "Hessen",
      "amtsgericht": "Amtsgericht Frankfurt am Main",
      "registernummer": "HRB 99872",
      "registerart": "HRB",
      "company_name": "Baschar Business Center GmbH",
      "company_seat": "Frankfurt am Main",
      "details": "28.07.2025 (Bekanntmachungsdatum)\n\nHessen Amtsgericht Frankfurt am Main HRB 99872\nLöschungsankündigung 28.07.2025 (Eintragungsdatum)\n\nBaschar Business Center GmbH\nGesellschaft mit beschränkter Haftung\nFrankfurt am Main\n\nDas Registergericht beabsichtigt die im Handelsregister eingetragene Gesellschaft von Amts wegen nach § 394 FamFG zu löschen. Die Frist zur Erhebung eines Widerspruchs gegen die beabsichtigte Löschung wird auf 1 Monat festgesetzt."
    },
    {
      "date": "2025-07-28",
      "id": "117892",
      "original_text": "Löschungsankündigung\nHessen Amtsgericht Wiesbaden HRB 12612\nCaravana Trading GmbH – Wiesbaden",
      "type": "Löschungsankündigung",
      "state": "Hessen",
      "amtsgericht": "Amtsgericht Wiesbaden",
      "registernummer": "HRB 12612",
      "registerart": "HRB",
      "company_name": "Caravana Trading GmbH",
      "company_seat": "Wiesbaden",
      "details": "28.07.2025 (Bekanntmachungsdatum)\n\nHessen Amtsgericht Wiesbaden HRB 12612\nLöschungsankündigung\n\nCaravana Trading GmbH\nGesellschaft mit beschränkter Haftung\nWiesbaden\n\nDas Registergericht beabsichtigt die im Handelsregister eingetragene Gesellschaft von Amts wegen nach § 394 FamFG zu löschen. Die Frist zur Erhebung eines Widerspruchs gegen die beabsichtigte Löschung wird auf 3 Monate festgesetzt."
    },
    {
      "date": "2025-07-28",
      "id": "117893",
      "original_text": "Löschungsankündigung\nHessen Amtsgericht Wiesbaden HRB 30304\nE-Z Bauunternehmen UG (haftungsbeschränkt) – Wiesbaden",
      "type": "Löschungsankündigung",
      "state": "Hessen",
      "amtsgericht": "Amtsgericht Wiesbaden",
      "registernummer": "HRB 30304",
      "registerart": "HRB",
      "company_name": "E-Z Bauunternehmen UG (haftungsbeschränkt)",
      "company_seat": "Wiesbaden",
      "details": "28.07.2025 (Bekanntmachungsdatum)\n\nHessen Amtsgericht Wiesbaden HRB 30304\nLöschungsankündigung\n\nE-Z Bauunternehmen UG (haftungsbeschränkt)\nGesellschaft mit beschränkter Haftung\nWiesbaden\n\nDas Registergericht beabsichtigt die im Handelsregister eingetragene Gesellschaft von Amts wegen nach § 394 FamFG zu löschen. Die Frist zur Erhebung eines Widerspruchs gegen die beabsichtigte Löschung wird auf 3 Monate festgesetzt."
    },
    {
      "date": "2025-07-28",
      "id": "117894",
      "original_text": "Sonstige Registerbekanntmachung\nHessen Amtsgericht Limburg VR 2321\nVolksgruppe der Zaza – Limburg",
      "type": "Sonstige Registerbekanntmachung",
      "state": "Hessen",
      "amtsgericht": "Amtsgericht Limburg",
      "registernummer": "VR 2321",
      "registerart": "VR",
      "company_name": "Volksgruppe der Zaza",
      "company_seat": "Limburg",
      "details": "28.07.2025 (Bekanntmachungsdatum)\n\nHessen Amtsgericht Limburg VR 2321\nSonstige Registerbekanntmachung 28.07.2025 (Eintragungsdatum)\n\nVolksgruppe der Zaza\neingetragener Verein\nLimburg\n\nDer Verein ist aufgelöst."
    },
    {
      "date": "2025-07-28",
      "id": "117895",
      "original_text": "Einreichung neuer Dokumente\nHessen Amtsgericht Gießen HRB 5727\nDUO PLAST AG – Lauterbach (Hessen)",
      "type": "Einreichung neuer Dokumente",
      "state": "Hessen",
      "amtsgericht": "Amtsgericht Gießen",
      "registernummer": "HRB 5727",
      "registerart": "HRB",
      "company_name": "DUO PLAST AG",
      "company_seat": "Lauterbach (Hessen)",
      "details": "28.07.2025 (Bekanntmachungsdatum)\n\nHessen Amtsgericht Gießen HRB 5727\nEinreichung neuer Dokumente\n\nDUO PLAST AG\nAktiengesellschaft\nLauterbach (Hessen)\n\nAufgrund einer Änderung in den Personen der Aufsichtsratsmitglieder ist eine Liste der Mitglieder des Aufsichtsrates zum Handelsregister eingereicht worden."
    },
    {
      "date": "2025-07-28",
      "id": "117896",
      "original_text": "Löschungsankündigung\nHessen Amtsgericht Fritzlar HRA 16184\nKletterpark Edersee Ltd. & Co. KG – Edertal-Hemfurth",
      "type": "Löschungsankündigung",
      "state": "Hessen",
      "amtsgericht": "Amtsgericht Fritzlar",
      "registernummer": "HRA 16184",
      "registerart": "HRA",
      "company_name": "Kletterpark Edersee Ltd. & Co. KG",
      "company_seat": "Edertal-Hemfurth",
      "details": "28.07.2025 (Bekanntmachungsdatum)\n\nHessen Amtsgericht Fritzlar HRA 16184\nLöschungsankündigung 28.07.2025 (Eintragungsdatum)\n\nKletterpark Edersee Ltd. & Co. KG\nKommanditgesellschaft\nEdertal-Hemfurth\n\nDas Registergericht beabsichtigt die im Handelsregister eingetragene Firma von Amts wegen nach § 394 Abs. 4 FamFG zu löschen. Die Frist zur Erhebung eines Widerspruchs gegen die beabsichtigte Löschung wird auf 3 Monate festgesetzt."
    },
    {
      "date": "2025-07-28",
      "id": "117897",
      "original_text": "Registerbekanntmachung nach dem Umwandlungsgesetz\nHessen Amtsgericht Gießen HRB 9453\nHP&P Holding GmbH – Gießen",
      "type": "Registerbekanntmachung nach dem Umwandlungsgesetz",
      "state": "Hessen",
      "amtsgericht": "Amtsgericht Gießen",
      "registernummer": "HRB 9453",
      "registerart": "HRB",
      "company_name": "HP&P Holding GmbH",
      "company_seat": "Gießen",
      "details": "28.07.2025 (Bekanntmachungsdatum)\n\nHessen Amtsgericht Gießen HRB 9453\nRegisterbekanntmachung nach dem Umwandlungsgesetz 28.07.2025 (Eintragungsdatum)\n\nHP&P Holding GmbH\nGesellschaft mit beschränkter Haftung\nGießen\n\nDen Gläubigern der an der Verschmelzung beteiligten Rechtsträger ist, wenn sie binnen sechs Monaten nach dem Tag, an dem die Eintragung der Verschmelzung in das Register des Sitzes desjenigen Rechtsträgers, dessen Gläubiger sie sind, nach § 19 Absatz 3 UmwG bekannt gemacht worden ist, ihren Anspruch nach Grund und Höhe schriftlich anmelden, Sicherheit zu leisten, soweit sie nicht Befriedigung verlangen können. Dieses Recht steht den Gläubigern jedoch nur zu, wenn sie glaubhaft machen, dass durch die Verschmelzung die Erfüllung ihrer Forderung gefährdet wird."
    },
    {
      "date": "2025-07-28",
      "id": "117898",
      "original_text": "Löschungsankündigung\nHessen Amtsgericht Hanau HRB 99114\nSwiss Investment EUSI GmbH – Hanau",
      "type": "Löschungsankündigung",
      "state": "Hessen",
      "amtsgericht": "Amtsgericht Hanau",
      "registernummer": "HRB 99114",
      "registerart": "HRB",
      "company_name": "Swiss Investment EUSI GmbH",
      "company_seat": "Hanau",
      "details": "28.07.2025 (Bekanntmachungsdatum)\n\nHessen Amtsgericht Hanau HRB 99114\nLöschungsankündigung\n\nSwiss Investment EUSI GmbH\nGesellschaft mit beschränkter Haftung\nHanau\n\nDas Registergericht beabsichtigt die im Handelsregister eingetragene Gesellschaft von Amts wegen nach § 394 FamFG zu löschen. Die Frist zur Erhebung eines Widerspruchs gegen die beabsichtigte Löschung wird auf 3 Monate festgesetzt."
    },
    {
      "date": "2025-07-28",
      "id": "117899",
      "original_text": "Registerbekanntmachung nach dem Umwandlungsgesetz\nHessen Amtsgericht Darmstadt HRB 94757\nLastMile Rüsselsheim-Main-Taunus GmbH – Rüsselsheim",
      "type": "Registerbekanntmachung nach dem Umwandlungsgesetz",
      "state": "Hessen",
      "amtsgericht": "Amtsgericht Darmstadt",
      "registernummer": "HRB 94757",
      "registerart": "HRB",
      "company_name": "LastMile Rüsselsheim-Main-Taunus GmbH",
      "company_seat": "Rüsselsheim",
      "details": "28.07.2025 (Bekanntmachungsdatum)\n\nHessen Amtsgericht Darmstadt HRB 94757\nRegisterbekanntmachung nach dem Umwandlungsgesetz 28.07.2025 (Eintragungsdatum)\n\nLastMile Rüsselsheim-Main-Taunus GmbH\nGesellschaft mit beschränkter Haftung\nRüsselsheim\n\nDen Gläubigern der an der Verschmelzung beteiligten Rechtsträger ist, wenn sie binnen sechs Monaten nach dem Tag, an dem die Eintragung der Verschmelzung in das Register des Sitzes derjenigen Rechtsträger deren Gläubiger sie sind, nach § 19 Absatz 3 UmwG bekannt gemacht worden ist, ihren Anspruch nach Grund und Höhe schriftlich anmelden, Sicherheit zu leisten, soweit sie nicht Befriedigung verlangen können. Dieses Recht steht den Gläubigern jedoch nur zu, wenn sie glaubhaft machen, dass durch die Verschmelzung die Erfüllung ihrer Forderung gefährdet wird."
    },
    {
      "date": "2025-07-28",
      "id": "117900",
      "original_text": "Registerbekanntmachung nach dem Umwandlungsgesetz\nHessen Amtsgericht Gießen HRB 12161\nEugen Fahrenbruch Transporte GmbH – Gießen",
      "type": "Registerbekanntmachung nach dem Umwandlungsgesetz",
      "state": "Hessen",
      "amtsgericht": "Amtsgericht Gießen",
      "registernummer": "HRB 12161",
      "registerart": "HRB",
      "company_name": "Eugen Fahrenbruch Transporte GmbH",
      "company_seat": "Gießen",
      "details": "28.07.2025 (Bekanntmachungsdatum)\n\nHessen Amtsgericht Gießen HRB 12161\nRegisterbekanntmachung nach dem Umwandlungsgesetz 28.07.2025 (Eintragungsdatum)\n\nEugen Fahrenbruch Transporte GmbH\nGesellschaft mit beschränkter Haftung\nGießen\n\nDen Gläubigern der an der Ausgliederung beteiligten Rechtsträger ist, wenn sie binnen sechs Monaten nach dem Tag, an dem die Eintragung der Ausgliederung in das Register des Sitzes desjenigen Rechtsträgers, dessen Gläubiger sie sind, nach §§ 125, 19 Absatz 3 UmwG bekannt gemacht worden ist, ihren Anspruch nach Grund und Höhe schriftlich anmelden, Sicherheit zu leisten, soweit sie nicht Befriedigung verlangen können. Dieses Recht steht den Gläubigern jedoch nur zu, wenn sie glaubhaft machen, dass durch die Ausgliederung die Erfüllung ihrer Forderung gefährdet wird."
    },
    {
      "date": "2025-07-28",
      "id": "117901",
      "original_text": "Sonstige Registerbekanntmachung\nHessen Amtsgericht Wetzlar VR 2711\nKaninchenzuchtverein H 298 Manderbach – Dillenburg-Manderbach",
      "type": "Sonstige Registerbekanntmachung",
      "state": "Hessen",
      "amtsgericht": "Amtsgericht Wetzlar",
      "registernummer": "VR 2711",
      "registerart": "VR",
      "company_name": "Kaninchenzuchtverein H 298 Manderbach",
      "company_seat": "Dillenburg-Manderbach",
      "details": "28.07.2025 (Bekanntmachungsdatum)\n\nHessen Amtsgericht Wetzlar VR 2711\nSonstige Registerbekanntmachung 26.07.2025 (Eintragungsdatum)\n\nKaninchenzuchtverein H 298 Manderbach\neingetragener Verein\nDillenburg-Manderbach\n\nDer Verein ist aufgelöst."
    },
    {
      "date": "2025-07-28",
      "id": "117902",
      "original_text": "Registerbekanntmachung nach dem Umwandlungsgesetz\nHessen Amtsgericht Frankfurt am Main HRB 139031\nWHK Controlling GmbH – Frankfurt am Main",
      "type": "Registerbekanntmachung nach dem Umwandlungsgesetz",
      "state": "Hessen",
      "amtsgericht": "Amtsgericht Frankfurt am Main",
      "registernummer": "HRB 139031",
      "registerart": "HRB",
      "company_name": "WHK Controlling GmbH",
      "company_seat": "Frankfurt am Main",
      "details": "28.07.2025 (Bekanntmachungsdatum)\n\nHessen Amtsgericht Frankfurt am Main HRB 139031\nRegisterbekanntmachung nach dem Umwandlungsgesetz 28.07.2025 (Eintragungsdatum)\n\nWHK Controlling GmbH\nGesellschaft mit beschränkter Haftung\nFrankfurt am Main\n\nDen Gläubigern der an der Verschmelzung beteiligten Rechtsträger ist, wenn sie binnen sechs Monaten nach dem Tag, an dem die Eintragung der Verschmelzung in das Register des Sitzes desjenigen Rechtsträgers, dessen Gläubiger sie sind, nach § 19 Absatz 3 UmwG bekannt gemacht worden ist, ihren Anspruch nach Grund und Höhe schriftlich anmelden, Sicherheit zu leisten, soweit sie nicht Befriedigung verlangen können. Dieses Recht steht den Gläubigern jedoch nur zu, wenn sie glaubhaft machen, dass durch die Verschmelzung die Erfüllung ihrer Forderung gefährdet wird."
    },
    {
      "date": "2025-07-28",
      "id": "117903",
      "original_text": "Registerbekanntmachung nach dem Umwandlungsgesetz\nHessen Amtsgericht Gießen VR 903\nArbeiterwohlfahrt Kreisverband Gießen-Land e.V. – Lollar",
      "type": "Registerbekanntmachung nach dem Umwandlungsgesetz",
      "state": "Hessen",
      "amtsgericht": "Amtsgericht Gießen",
      "registernummer": "VR 903",
      "registerart": "VR",
      "company_name": "Arbeiterwohlfahrt Kreisverband Gießen-Land e.V.",
      "company_seat": "Lollar",
      "details": "28.07.2025 (Bekanntmachungsdatum)\n\nHessen Amtsgericht Gießen VR 903\nRegisterbekanntmachung nach dem Umwandlungsgesetz 28.07.2025 (Eintragungsdatum)\n\nArbeiterwohlfahrt Kreisverband Gießen-Land e.V.\neingetragener Verein\nLollar\n\nDen Gläubigern der an der Verschmelzung beteiligten Rechtsträger ist, wenn sie binnen sechs Monaten nach dem Tag, an dem die Eintragung der Verschmelzung in das Register des Sitzes desjenigen Rechtsträgers, dessen Gläubiger sie sind, nach § 19 Absatz 3 UmwG bekannt gemacht worden ist, ihren Anspruch nach Grund und Höhe schriftlich anmelden, Sicherheit zu leisten, soweit sie nicht Befriedigung verlangen können. Dieses Recht steht den Gläubigern jedoch nur zu, wenn sie glaubhaft machen, dass durch die Verschmelzung die Erfüllung ihrer Forderung gefährdet wird."
    },
    {
      "date": "2025-07-28",
      "id": "117904",
      "original_text": "Registerbekanntmachung nach dem Umwandlungsgesetz\nHessen Amtsgericht Gießen VR 818\nArbeiterwohlfahrt Stadtkreis Gießen e.V. – Gießen",
      "type": "Registerbekanntmachung nach dem Umwandlungsgesetz",
      "state": "Hessen",
      "amtsgericht": "Amtsgericht Gießen",
      "registernummer": "VR 818",
      "registerart": "VR",
      "company_name": "Arbeiterwohlfahrt Stadtkreis Gießen e.V.",
      "company_seat": "Gießen",
      "details": "28.07.2025 (Bekanntmachungsdatum)\n\nHessen Amtsgericht Gießen VR 818\nRegisterbekanntmachung nach dem Umwandlungsgesetz 28.07.2025 (Eintragungsdatum)\n\nArbeiterwohlfahrt Stadtkreis Gießen e.V.\neingetragener Verein\nGießen\n\nDen Gläubigern der an der Verschmelzung beteiligten Rechtsträger ist, wenn sie binnen sechs Monaten nach dem Tag, an dem die Eintragung der Verschmelzung in das Register des Sitzes desjenigen Rechtsträgers, dessen Gläubiger sie sind, nach § 19 Absatz 3 UmwG bekannt gemacht worden ist, ihren Anspruch nach Grund und Höhe schriftlich anmelden, Sicherheit zu leisten, soweit sie nicht Befriedigung verlangen können. Dieses Recht steht den Gläubigern jedoch nur zu, wenn sie glaubhaft machen, dass durch die Verschmelzung die Erfüllung ihrer Forderung gefährdet wird."
    },
    {
      "date": "2025-07-28",
      "id": "117905",
      "original_text": "Löschungsankündigung\nHessen Amtsgericht Kassel HRA 9964\nBCV Agentur Bärbel Pöchheim GmbH & Co. KG – Kassel",
      "type": "Löschungsankündigung",
      "state": "Hessen",
      "amtsgericht": "Amtsgericht Kassel",
      "registernummer": "HRA 9964",
      "registerart": "HRA",
      "company_name": "BCV Agentur Bärbel Pöchheim GmbH & Co. KG",
      "company_seat": "Kassel",
      "details": "28.07.2025 (Bekanntmachungsdatum)\n\nHessen Amtsgericht Kassel HRA 9964\nLöschungsankündigung\n\nBCV Agentur Bärbel Pöchheim GmbH & Co. KG\nKommanditgesellschaft\nKassel\n\nDas Registergericht beabsichtigt, die im Handelsregister eingetragene Firma zu löschen. Die Gesellschaft ist aufgelöst und die Firma ist ohne Liquidation erloschen. Die Frist zur Erhebung eines Widerspruchs gegen die beabsichtigte Löschung wird auf 1 Monat festgesetzt. Dieser kann schriftlich oder zu Protokoll der Geschäftsstelle bei dem Registergericht des Amtsgerichts Kassel Friedrichsstraße 32-34, 34117 Kassel innerhalb von 1 Monat ab Veröffentlichung dieser Bekanntmachung erhoben werden."
    },
    {
      "date": "2025-07-28",
      "id": "117906",
      "original_text": "Registerbekanntmachung nach dem Umwandlungsgesetz\nHessen Amtsgericht Gießen HRA 5567\nEugen Fahrenbruch Int. Transporte OHG – Gießen",
      "type": "Registerbekanntmachung nach dem Umwandlungsgesetz",
      "state": "Hessen",
      "amtsgericht": "Amtsgericht Gießen",
      "registernummer": "HRA 5567",
      "registerart": "HRA",
      "company_name": "Eugen Fahrenbruch Int. Transporte OHG",
      "company_seat": "Gießen",
      "details": "28.07.2025 (Bekanntmachungsdatum)\n\nHessen Amtsgericht Gießen HRA 5567\nRegisterbekanntmachung nach dem Umwandlungsgesetz 28.07.2025 (Eintragungsdatum)\n\nEugen Fahrenbruch Int. Transporte OHG\nOffene Handelsgesellschaft\nGießen\n\nDen Gläubigern der an der Ausgliederung beteiligten Rechtsträger ist, wenn sie binnen sechs Monaten nach dem Tag, an dem die Eintragung der Ausgliederung in das Register des Sitzes desjenigen Rechtsträgers, dessen Gläubiger sie sind, nach §§ 125, 19 Absatz 3 UmwG bekannt gemacht worden ist, ihren Anspruch nach Grund und Höhe schriftlich anmelden, Sicherheit zu leisten, soweit sie nicht Befriedigung verlangen können. Dieses Recht steht den Gläubigern jedoch nur zu, wenn sie glaubhaft machen, dass durch die Ausgliederung die Erfüllung ihrer Forderung gefährdet wird."
    }
  ]
}