{
  "date": "2025-07-20",
  "date_of_scrape": "2025-08-26T14:16:23.704Z",
  "tool_version": "0.2.0",
  "number_of_announcements": 2,
  "announcements": [
    {
      "date": "2025-07-20",
      "id": "116724",
      "original_text": "Registerbekanntmachung nach dem Umwandlungsgesetz\nMecklenburg-Vorpommern Amtsgericht Rostock HRB 16967\nVersicherungsbüro Ludwig GmbH – Rostock",
      "type": "Registerbekanntmachung nach dem Umwandlungsgesetz",
      "state": "Mecklenburg-Vorpommern",
      "amtsgericht": "Amtsgericht Rostock",
      "registernummer": "HRB 16967",
      "registerart": "HRB",
      "company_name": "Versicherungsbüro Ludwig GmbH",
      "company_seat": "Rostock",
      "details": "20.07.2025 (Bekanntmachungsdatum)\n\nMecklenburg-Vorpommern Amtsgericht Rostock HRB 16967\nRegisterbekanntmachung nach dem Umwandlungsgesetz 20.07.2025 (Eintragungsdatum)\n\nVersicherungsbüro Ludwig GmbH\nGesellschaft mit beschränkter Haftung\nRostock\n\nDen Gläubigern der an der Verschmelzung beteiligten Rechtsträger ist, wenn sie binnen sechs Monaten nach dem Tag, an dem die Eintragung der Verschmelzung in das Register des Sitzes desjenigen Rechtsträgers, dessen Gläubiger sie sind, nach § 19 Abs. 3 UmwG als bekannt gemacht gilt, ihren Anspruch nach Grund und Höhe in Textform anmelden, Sicherheit zu leisten, soweit sie nicht Befriedigung verlangen können. Dieses Recht steht den Gläubigern jedoch nur zu, wenn sie glaubhaft machen, dass durch die Verschmelzung die Erfüllung der Forderung gefährdet wird."
    },
    {
      "date": "2025-07-20",
      "id": "116725",
      "original_text": "Registerbekanntmachung nach dem Umwandlungsgesetz\nMecklenburg-Vorpommern Amtsgericht Rostock HRB 11980\nGlaser & Huke Versicherungsmakler GmbH – Rostock",
      "type": "Registerbekanntmachung nach dem Umwandlungsgesetz",
      "state": "Mecklenburg-Vorpommern",
      "amtsgericht": "Amtsgericht Rostock",
      "registernummer": "HRB 11980",
      "registerart": "HRB",
      "company_name": "Glaser & Huke Versicherungsmakler GmbH",
      "company_seat": "Rostock",
      "details": "20.07.2025 (Bekanntmachungsdatum)\n\nMecklenburg-Vorpommern Amtsgericht Rostock HRB 11980\nRegisterbekanntmachung nach dem Umwandlungsgesetz 20.07.2025 (Eintragungsdatum)\n\nGlaser & Huke Versicherungsmakler GmbH\nGesellschaft mit beschränkter Haftung\nRostock\n\nDen Gläubigern der an der Verschmelzung beteiligten Rechtsträger ist, wenn sie binnen sechs Monaten nach dem Tag, an dem die Eintragung der Verschmelzung in das Register des Sitzes desjenigen Rechtsträgers, dessen Gläubiger sie sind, nach § 19 Abs. 3 UmwG als bekannt gemacht gilt, ihren Anspruch nach Grund und Höhe in Textform anmelden, Sicherheit zu leisten, soweit sie nicht Befriedigung verlangen können. Dieses Recht steht den Gläubigern jedoch nur zu, wenn sie glaubhaft machen, dass durch die Verschmelzung die Erfüllung der Forderung gefährdet wird."
    }
  ]
}