{
  "date": "2025-07-15",
  "date_of_scrape": "2025-08-26T13:25:45.704Z",
  "tool_version": "0.2.0",
  "number_of_announcements": 202,
  "announcements": [
    {
      "date": "2025-07-15",
      "id": "115811",
      "original_text": "Löschungsankündigung\nBayern Amtsgericht Ingolstadt HRB 8995\nWT-Industries GmbH – Pollenfeld-Preith",
      "type": "Löschungsankündigung",
      "state": "Bayern",
      "amtsgericht": "Amtsgericht Ingolstadt",
      "registernummer": "HRB 8995",
      "registerart": "HRB",
      "company_name": "WT-Industries GmbH",
      "company_seat": "Pollenfeld-Preith",
      "details": "15.07.2025 (Bekanntmachungsdatum)\n\nBayern Amtsgericht Ingolstadt HRB 8995\nLöschungsankündigung\n\nWT-Industries GmbH\nGesellschaft mit beschränkter Haftung\nPollenfeld-Preith\n\nDas Registergericht beabsichtigt, die im Handelsregister eingetragene Gesellschaft wegen Vermögenslosigkeit von Amts wegen nach § 394 FamFG zu löschen. Die Frist zur Erhebung eines Widerspruchs ist auf einen Monat festgesetzt."
    },
    {
      "date": "2025-07-15",
      "id": "115812",
      "original_text": "Löschungsankündigung\nBayern Amtsgericht Ingolstadt HRB 10625\nDem-Bau GmbH – Ingolstadt",
      "type": "Löschungsankündigung",
      "state": "Bayern",
      "amtsgericht": "Amtsgericht Ingolstadt",
      "registernummer": "HRB 10625",
      "registerart": "HRB",
      "company_name": "Dem-Bau GmbH",
      "company_seat": "Ingolstadt",
      "details": "15.07.2025 (Bekanntmachungsdatum)\n\nBayern Amtsgericht Ingolstadt HRB 10625\nLöschungsankündigung\n\nDem-Bau GmbH\nGesellschaft mit beschränkter Haftung\nIngolstadt\n\nDas Registergericht beabsichtigt, die im Handelsregister eingetragene Gesellschaft wegen Vermögenslosigkeit von Amts wegen nach § 394 FamFG zu löschen. Die Frist zur Erhebung eines Widerspruchs ist auf einen Monat festgesetzt."
    },
    {
      "date": "2025-07-15",
      "id": "115813",
      "original_text": "Löschungsankündigung\nBayern Amtsgericht Nürnberg HRB 26294\nH. K. Bau UG (haftungsbeschränkt) – Nürnberg",
      "type": "Löschungsankündigung",
      "state": "Bayern",
      "amtsgericht": "Amtsgericht Nürnberg",
      "registernummer": "HRB 26294",
      "registerart": "HRB",
      "company_name": "H. K. Bau UG (haftungsbeschränkt)",
      "company_seat": "Nürnberg",
      "details": "15.07.2025 (Bekanntmachungsdatum)\n\nBayern Amtsgericht Nürnberg HRB 26294\nLöschungsankündigung\n\nH. K. Bau UG (haftungsbeschränkt)\nGesellschaft mit beschränkter Haftung\nNürnberg\n\nDas Registergericht beabsichtigt, die im Handelsregister eingetragene Gesellschaft wegen Vermögenslosigkeit von Amts wegen nach § 394 FamFG zu löschen. Die Frist zur Erhebung eines Widerspruchs ist auf einen Monat festgesetzt."
    },
    {
      "date": "2025-07-15",
      "id": "115814",
      "original_text": "Registerbekanntmachung nach dem Umwandlungsgesetz\nBayern Amtsgericht Augsburg HRB 28995\nJR OP Personalservice GmbH – Augsburg",
      "type": "Registerbekanntmachung nach dem Umwandlungsgesetz",
      "state": "Bayern",
      "amtsgericht": "Amtsgericht Augsburg",
      "registernummer": "HRB 28995",
      "registerart": "HRB",
      "company_name": "JR OP Personalservice GmbH",
      "company_seat": "Augsburg",
      "details": "15.07.2025 (Bekanntmachungsdatum)\n\nBayern Amtsgericht Augsburg HRB 28995\nRegisterbekanntmachung nach dem Umwandlungsgesetz 14.07.2025 (Eintragungsdatum)\n\nJR OP Personalservice GmbH\nGesellschaft mit beschränkter Haftung\nAugsburg\n\nDen Gläubigern der an der Verschmelzung beteiligten Rechtsträger ist, wenn sie binnen sechs Monaten nach dem Tag, an dem die Eintragung der Verschmelzung in das Register des Sitzes desjenigen Rechtsträgers, dessen Gläubiger sie sind, nach § 19 Abs. 3 UmwG als bekannt gemacht gilt, ihren Anspruch nach Grund und Höhe in Textform anmelden, Sicherheit zu leisten, soweit sie nicht Befriedigung verlangen können. Dieses Recht steht den Gläubigern jedoch nur zu, wenn sie glaubhaft machen, dass durch die Verschmelzung die Erfüllung ihrer Forderung gefährdet wird."
    },
    {
      "date": "2025-07-15",
      "id": "115815",
      "original_text": "Registerbekanntmachung nach dem Umwandlungsgesetz\nBayern Amtsgericht Aschaffenburg HRB 18142\nJosera petfood GmbH – Kleinheubach",
      "type": "Registerbekanntmachung nach dem Umwandlungsgesetz",
      "state": "Bayern",
      "amtsgericht": "Amtsgericht Aschaffenburg",
      "registernummer": "HRB 18142",
      "registerart": "HRB",
      "company_name": "Josera petfood GmbH",
      "company_seat": "Kleinheubach",
      "details": "15.07.2025 (Bekanntmachungsdatum)\n\nBayern Amtsgericht Aschaffenburg HRB 18142\nRegisterbekanntmachung nach dem Umwandlungsgesetz 14.07.2025 (Eintragungsdatum)\n\nJosera petfood GmbH\nGesellschaft mit beschränkter Haftung\nKleinheubach\n\nDen Gläubigern des formwechselnden Rechtsträgers ist, wenn sie binnen sechs Monaten nach dem Tag, an dem die Eintragung des Formwechsels nach § 201 UmwG als bekannt gemacht gilt, ihren Anspruch nach Grund und Höhe in Textform anmelden, Sicherheit zu leisten, soweit sie nicht Befriedigung verlangen können. Dieses Recht steht den Gläubigern jedoch nur zu, wenn sie glaubhaft machen, dass durch den Formwechsel die Erfüllung ihrer Forderung gefährdet wird."
    },
    {
      "date": "2025-07-15",
      "id": "115816",
      "original_text": "Löschungsankündigung\nBayern Amtsgericht München HRB 281921\nCarsija Company UG (haftungsbeschränkt) – München",
      "type": "Löschungsankündigung",
      "state": "Bayern",
      "amtsgericht": "Amtsgericht München",
      "registernummer": "HRB 281921",
      "registerart": "HRB",
      "company_name": "Carsija Company UG (haftungsbeschränkt)",
      "company_seat": "München",
      "details": "15.07.2025 (Bekanntmachungsdatum)\n\nBayern Amtsgericht München HRB 281921\nLöschungsankündigung 14.07.2025 (Eintragungsdatum)\n\nCarsija Company UG (haftungsbeschränkt)\nGesellschaft mit beschränkter Haftung\nMünchen\n\nDas Registergericht beabsichtigt, die im Handelsregister eingetragene Gesellschaft wegen Vermögenslosigkeit von Amts wegen nach § 394 FamFG zu löschen. Die Frist zur Erhebung eines Widerspruchs ist auf drei Monate festgesetzt."
    },
    {
      "date": "2025-07-15",
      "id": "115817",
      "original_text": "Registerbekanntmachung nach dem Umwandlungsgesetz\nBayern Amtsgericht Nürnberg HRB 33191\nJump Besitz GmbH – Nürnberg",
      "type": "Registerbekanntmachung nach dem Umwandlungsgesetz",
      "state": "Bayern",
      "amtsgericht": "Amtsgericht Nürnberg",
      "registernummer": "HRB 33191",
      "registerart": "HRB",
      "company_name": "Jump Besitz GmbH",
      "company_seat": "Nürnberg",
      "details": "15.07.2025 (Bekanntmachungsdatum)\n\nBayern Amtsgericht Nürnberg HRB 33191\nRegisterbekanntmachung nach dem Umwandlungsgesetz 14.07.2025 (Eintragungsdatum)\n\nJump Besitz GmbH\nGesellschaft mit beschränkter Haftung\nNürnberg\n\nDen Gläubigern der an der Verschmelzung beteiligten Rechtsträger ist, wenn sie binnen sechs Monaten nach dem Tag, an dem die Eintragung der Verschmelzung in das Register des Sitzes desjenigen Rechtsträgers, dessen Gläubiger sie sind, nach § 19 Abs. 3 UmwG als bekannt gemacht gilt, ihren Anspruch nach Grund und Höhe in Textform anmelden, Sicherheit zu leisten, soweit sie nicht Befriedigung verlangen können. Dieses Recht steht den Gläubigern jedoch nur zu, wenn sie glaubhaft machen, dass durch die Verschmelzung die Erfüllung ihrer Forderung gefährdet wird."
    },
    {
      "date": "2025-07-15",
      "id": "115818",
      "original_text": "Einreichung neuer Dokumente\nBayern Amtsgericht Kempten (Allgäu) HRB 1018\nOberstdorfer Bergbahn AG – Oberstdorf",
      "type": "Einreichung neuer Dokumente",
      "state": "Bayern",
      "amtsgericht": "Amtsgericht Kempten (Allgäu)",
      "registernummer": "HRB 1018",
      "registerart": "HRB",
      "company_name": "Oberstdorfer Bergbahn AG",
      "company_seat": "Oberstdorf",
      "details": "15.07.2025 (Bekanntmachungsdatum)\n\nBayern Amtsgericht Kempten (Allgäu) HRB 1018\nEinreichung neuer Dokumente 14.07.2025 (Eintragungsdatum)\n\nOberstdorfer Bergbahn AG\nAktiengesellschaft\nOberstdorf\n\nDem Amtsgericht Kempten (Allgäu) -Registergericht- ist eine Liste der Mitglieder des Aufsichtsrats eingereicht worden, § 106 AktG."
    },
    {
      "date": "2025-07-15",
      "id": "115819",
      "original_text": "Registerbekanntmachung nach dem Umwandlungsgesetz\nBayern Amtsgericht München HRB 118229\nSHS VIVEON AG – München",
      "type": "Registerbekanntmachung nach dem Umwandlungsgesetz",
      "state": "Bayern",
      "amtsgericht": "Amtsgericht München",
      "registernummer": "HRB 118229",
      "registerart": "HRB",
      "company_name": "SHS VIVEON AG",
      "company_seat": "München",
      "details": "15.07.2025 (Bekanntmachungsdatum)\n\nBayern Amtsgericht München HRB 118229\nRegisterbekanntmachung nach dem Umwandlungsgesetz 14.07.2025 (Eintragungsdatum)\n\nSHS VIVEON AG\nAktiengesellschaft\nMünchen\n\nDem Amtsgericht München -Registergericht- ist ein Verschmelzungsvertrag zwischen der Sidetrade AG, Frankfurt am Main (Amtsgericht Frankfurt am Main  HRB 134695) und der Gesellschaft als übertragendem Rechtsträger zur Einsichtnahme eingereicht worden."
    },
    {
      "date": "2025-07-15",
      "id": "115820",
      "original_text": "Löschungsankündigung\nBayern Amtsgericht München HRB 270938\nGES UG (haftungsbeschränkt) – Ismaning",
      "type": "Löschungsankündigung",
      "state": "Bayern",
      "amtsgericht": "Amtsgericht München",
      "registernummer": "HRB 270938",
      "registerart": "HRB",
      "company_name": "GES UG (haftungsbeschränkt)",
      "company_seat": "Ismaning",
      "details": "15.07.2025 (Bekanntmachungsdatum)\n\nBayern Amtsgericht München HRB 270938\nLöschungsankündigung 11.07.2025 (Eintragungsdatum)\n\nGES UG (haftungsbeschränkt)\nGesellschaft mit beschränkter Haftung\nIsmaning\n\nDas Registergericht beabsichtigt, die im Handelsregister eingetragene Gesellschaft wegen Vermögenslosigkeit von Amts wegen nach § 394 FamFG zu löschen. Die Frist zur Erhebung eines Widerspruchs ist auf drei Monate festgesetzt."
    },
    {
      "date": "2025-07-15",
      "id": "115821",
      "original_text": "Registerbekanntmachung nach dem Umwandlungsgesetz\nBayern Amtsgericht Aschaffenburg HRB 18141\nfoodforplanet GmbH – Kleinheubach",
      "type": "Registerbekanntmachung nach dem Umwandlungsgesetz",
      "state": "Bayern",
      "amtsgericht": "Amtsgericht Aschaffenburg",
      "registernummer": "HRB 18141",
      "registerart": "HRB",
      "company_name": "foodforplanet GmbH",
      "company_seat": "Kleinheubach",
      "details": "15.07.2025 (Bekanntmachungsdatum)\n\nBayern Amtsgericht Aschaffenburg HRB 18141\nRegisterbekanntmachung nach dem Umwandlungsgesetz 14.07.2025 (Eintragungsdatum)\n\nfoodforplanet GmbH\nGesellschaft mit beschränkter Haftung\nKleinheubach\n\nDen Gläubigern des formwechselnden Rechtsträgers ist, wenn sie binnen sechs Monaten nach dem Tag, an dem die Eintragung des Formwechsels nach § 201 UmwG als bekannt gemacht gilt, ihren Anspruch nach Grund und Höhe in Textform anmelden, Sicherheit zu leisten, soweit sie nicht Befriedigung verlangen können. Dieses Recht steht den Gläubigern jedoch nur zu, wenn sie glaubhaft machen, dass durch den Formwechsel die Erfüllung ihrer Forderung gefährdet wird."
    },
    {
      "date": "2025-07-15",
      "id": "115822",
      "original_text": "Registerbekanntmachung nach dem Umwandlungsgesetz\nBayern Amtsgericht München HRB 301832\nSCUR-Alpha 1861 GmbH – München",
      "type": "Registerbekanntmachung nach dem Umwandlungsgesetz",
      "state": "Bayern",
      "amtsgericht": "Amtsgericht München",
      "registernummer": "HRB 301832",
      "registerart": "HRB",
      "company_name": "SCUR-Alpha 1861 GmbH",
      "company_seat": "München",
      "details": "15.07.2025 (Bekanntmachungsdatum)\n\nBayern Amtsgericht München HRB 301832\nRegisterbekanntmachung nach dem Umwandlungsgesetz 14.07.2025 (Eintragungsdatum)\n\nSCUR-Alpha 1861 GmbH\nGesellschaft mit beschränkter Haftung\nMünchen\n\nDen Gläubigern der an der Verschmelzung beteiligten Rechtsträger ist, wenn sie binnen sechs Monaten nach dem Tag, an dem die Eintragung der Verschmelzung in das Register des Sitzes desjenigen Rechtsträgers, dessen Gläubiger sie sind, nach § 19 Abs. 3 UmwG als bekannt gemacht gilt, ihren Anspruch nach Grund und Höhe in Textform anmelden, Sicherheit zu leisten, soweit sie nicht Befriedigung verlangen können. Dieses Recht steht den Gläubigern jedoch nur zu, wenn sie glaubhaft machen, dass durch die Verschmelzung die Erfüllung ihrer Forderung gefährdet wird."
    },
    {
      "date": "2025-07-15",
      "id": "115823",
      "original_text": "Löschungsankündigung\nBayern Amtsgericht Nürnberg HRB 21111\nHEAVEN FRESH CANADA INC. Zweigniederlassung Deutschland – Nürnberg",
      "type": "Löschungsankündigung",
      "state": "Bayern",
      "amtsgericht": "Amtsgericht Nürnberg",
      "registernummer": "HRB 21111",
      "registerart": "HRB",
      "company_name": "HEAVEN FRESH CANADA INC. Zweigniederlassung Deutschland",
      "company_seat": "Nürnberg",
      "details": "15.07.2025 (Bekanntmachungsdatum)\n\nBayern Amtsgericht Nürnberg HRB 21111\nLöschungsankündigung\n\nHEAVEN FRESH CANADA INC. Zweigniederlassung Deutschland\nRechtsform ausländischen Rechts HRB\nNürnberg\n\nDas Registergericht beabsichtigt, die im Handelsregister eingetragene Gesellschaft wegen Vermögenslosigkeit von Amts wegen nach § 394 FamFG zu löschen. Die Frist zur Erhebung eines Widerspruchs ist auf drei Monate festgesetzt."
    },
    {
      "date": "2025-07-15",
      "id": "115824",
      "original_text": "Registerbekanntmachung nach dem Umwandlungsgesetz\nBayern Amtsgericht Aschaffenburg HRA 5192\nfoodforplanet GmbH & Co. KG – Kleinheubach",
      "type": "Registerbekanntmachung nach dem Umwandlungsgesetz",
      "state": "Bayern",
      "amtsgericht": "Amtsgericht Aschaffenburg",
      "registernummer": "HRA 5192",
      "registerart": "HRA",
      "company_name": "foodforplanet GmbH & Co. KG",
      "company_seat": "Kleinheubach",
      "details": "15.07.2025 (Bekanntmachungsdatum)\n\nBayern Amtsgericht Aschaffenburg HRA 5192\nRegisterbekanntmachung nach dem Umwandlungsgesetz 14.07.2025 (Eintragungsdatum)\n\nfoodforplanet GmbH & Co. KG\nKommanditgesellschaft\nKleinheubach\n\nDen Gläubigern des formwechselnden Rechtsträgers ist, wenn sie binnen sechs Monaten nach dem Tag, an dem die Eintragung des Formwechsels nach § 201 UmwG als bekannt gemacht gilt, ihren Anspruch nach Grund und Höhe in Textform anmelden, Sicherheit zu leisten, soweit sie nicht Befriedigung verlangen können. Dieses Recht steht den Gläubigern jedoch nur zu, wenn sie glaubhaft machen, dass durch den Formwechsel die Erfüllung ihrer Forderung gefährdet wird."
    },
    {
      "date": "2025-07-15",
      "id": "115825",
      "original_text": "Registerbekanntmachung nach dem Umwandlungsgesetz\nBayern Amtsgericht Schweinfurt HRB 9768\nHandyhelden GmbH – Schweinfurt",
      "type": "Registerbekanntmachung nach dem Umwandlungsgesetz",
      "state": "Bayern",
      "amtsgericht": "Amtsgericht Schweinfurt",
      "registernummer": "HRB 9768",
      "registerart": "HRB",
      "company_name": "Handyhelden GmbH",
      "company_seat": "Schweinfurt",
      "details": "15.07.2025 (Bekanntmachungsdatum)\n\nBayern Amtsgericht Schweinfurt HRB 9768\nRegisterbekanntmachung nach dem Umwandlungsgesetz 14.07.2025 (Eintragungsdatum)\n\nHandyhelden GmbH\nGesellschaft mit beschränkter Haftung\nSchweinfurt\n\nDen Gläubigern der an der Ausgliederung beteiligten Rechtsträger ist, wenn sie binnen sechs Monaten nach dem Tag, an dem die Eintragung der Ausgliederung in das Register des Sitzes desjenigen Rechtsträgers, dessen Gläubiger sie sind, nach §§ 125, 19 Abs. 3 UmwG als bekannt gemacht gilt, ihren Anspruch nach Grund und Höhe in Textform anmelden, Sicherheit zu leisten, soweit sie nicht Befriedigung verlangen können. Dieses Recht steht den Gläubigern jedoch nur zu, wenn sie glaubhaft machen, dass durch die Ausgliederung die Erfüllung ihrer Forderung gefährdet wird."
    },
    {
      "date": "2025-07-15",
      "id": "115826",
      "original_text": "Registerbekanntmachung nach dem Umwandlungsgesetz\nBayern Amtsgericht Aschaffenburg HRA 5614\nJosera petfood GmbH & Co. KG – Kleinheubach",
      "type": "Registerbekanntmachung nach dem Umwandlungsgesetz",
      "state": "Bayern",
      "amtsgericht": "Amtsgericht Aschaffenburg",
      "registernummer": "HRA 5614",
      "registerart": "HRA",
      "company_name": "Josera petfood GmbH & Co. KG",
      "company_seat": "Kleinheubach",
      "details": "15.07.2025 (Bekanntmachungsdatum)\n\nBayern Amtsgericht Aschaffenburg HRA 5614\nRegisterbekanntmachung nach dem Umwandlungsgesetz 14.07.2025 (Eintragungsdatum)\n\nJosera petfood GmbH & Co. KG\nKommanditgesellschaft\nKleinheubach\n\nDen Gläubigern des formwechselnden Rechtsträgers ist, wenn sie binnen sechs Monaten nach dem Tag, an dem die Eintragung des Formwechsels nach § 201 UmwG als bekannt gemacht gilt, ihren Anspruch nach Grund und Höhe in Textform anmelden, Sicherheit zu leisten, soweit sie nicht Befriedigung verlangen können. Dieses Recht steht den Gläubigern jedoch nur zu, wenn sie glaubhaft machen, dass durch den Formwechsel die Erfüllung ihrer Forderung gefährdet wird."
    },
    {
      "date": "2025-07-15",
      "id": "115827",
      "original_text": "Registerbekanntmachung nach dem Umwandlungsgesetz\nBayern Amtsgericht München HRB 96295\nAllergika Pharma GmbH – Wolfratshausen",
      "type": "Registerbekanntmachung nach dem Umwandlungsgesetz",
      "state": "Bayern",
      "amtsgericht": "Amtsgericht München",
      "registernummer": "HRB 96295",
      "registerart": "HRB",
      "company_name": "Allergika Pharma GmbH",
      "company_seat": "Wolfratshausen",
      "details": "15.07.2025 (Bekanntmachungsdatum)\n\nBayern Amtsgericht München HRB 96295\nRegisterbekanntmachung nach dem Umwandlungsgesetz 14.07.2025 (Eintragungsdatum)\n\nAllergika Pharma GmbH\nGesellschaft mit beschränkter Haftung\nWolfratshausen\n\nDen Gläubigern der an der Verschmelzung beteiligten Rechtsträger ist, wenn sie binnen sechs Monaten nach dem Tag, an dem die Eintragung der Verschmelzung in das Register des Sitzes desjenigen Rechtsträgers, dessen Gläubiger sie sind, nach § 19 Abs. 3 UmwG als bekannt gemacht gilt, ihren Anspruch nach Grund und Höhe in Textform anmelden, Sicherheit zu leisten, soweit sie nicht Befriedigung verlangen können. Dieses Recht steht den Gläubigern jedoch nur zu, wenn sie glaubhaft machen, dass durch die Verschmelzung die Erfüllung ihrer Forderung gefährdet wird."
    },
    {
      "date": "2025-07-15",
      "id": "115828",
      "original_text": "Löschungsankündigung\nBayern Amtsgericht München HRB 245605\nSame Day Courier Services UG (haftungsbeschränkt) – München",
      "type": "Löschungsankündigung",
      "state": "Bayern",
      "amtsgericht": "Amtsgericht München",
      "registernummer": "HRB 245605",
      "registerart": "HRB",
      "company_name": "Same Day Courier Services UG (haftungsbeschränkt)",
      "company_seat": "München",
      "details": "15.07.2025 (Bekanntmachungsdatum)\n\nBayern Amtsgericht München HRB 245605\nLöschungsankündigung 14.07.2025 (Eintragungsdatum)\n\nSame Day Courier Services UG (haftungsbeschränkt)\nGesellschaft mit beschränkter Haftung\nMünchen\n\nDas Registergericht beabsichtigt, die im Handelsregister eingetragene Gesellschaft wegen Vermögenslosigkeit von Amts wegen nach § 394 FamFG zu löschen. Die Frist zur Erhebung eines Widerspruchs ist auf drei Monate festgesetzt."
    },
    {
      "date": "2025-07-15",
      "id": "115829",
      "original_text": "Löschungsankündigung\nBayern Amtsgericht Fürth HRB 5220\nWinner Software GmbH – Stein",
      "type": "Löschungsankündigung",
      "state": "Bayern",
      "amtsgericht": "Amtsgericht Fürth",
      "registernummer": "HRB 5220",
      "registerart": "HRB",
      "company_name": "Winner Software GmbH",
      "company_seat": "Stein",
      "details": "15.07.2025 (Bekanntmachungsdatum)\n\nBayern Amtsgericht Fürth HRB 5220\nLöschungsankündigung\n\nWinner Software GmbH\nGesellschaft mit beschränkter Haftung\nStein\n\nDas Registergericht beabsichtigt, die im Handelsregister eingetragene Gesellschaft wegen Vermögenslosigkeit von Amts wegen nach § 394 FamFG zu löschen. Die Frist zur Erhebung eines Widerspruchs ist auf drei Monate festgesetzt."
    },
    {
      "date": "2025-07-15",
      "id": "115830",
      "original_text": "Einreichung neuer Dokumente\nBayern Amtsgericht Kempten (Allgäu) HRB 3147\nRegionalverkehr Allgäu GmbH (RVA) – Oberstdorf",
      "type": "Einreichung neuer Dokumente",
      "state": "Bayern",
      "amtsgericht": "Amtsgericht Kempten (Allgäu)",
      "registernummer": "HRB 3147",
      "registerart": "HRB",
      "company_name": "Regionalverkehr Allgäu GmbH (RVA)",
      "company_seat": "Oberstdorf",
      "details": "15.07.2025 (Bekanntmachungsdatum)\n\nBayern Amtsgericht Kempten (Allgäu) HRB 3147\nEinreichung neuer Dokumente 14.07.2025 (Eintragungsdatum)\n\nRegionalverkehr Allgäu GmbH (RVA)\nGesellschaft mit beschränkter Haftung\nOberstdorf\n\nDem Amtsgericht Kempten (Allgäu) -Registergericht- ist eine Liste der Mitglieder des Aufsichtsrats eingereicht worden, § 52 Abs. 3 S. 2 GmbHG."
    },
    {
      "date": "2025-07-15",
      "id": "115831",
      "original_text": "Registerbekanntmachung nach dem Umwandlungsgesetz\nBayern Amtsgericht München HRB 299062\nIsakaj GmbH – Fürstenfeldbruck",
      "type": "Registerbekanntmachung nach dem Umwandlungsgesetz",
      "state": "Bayern",
      "amtsgericht": "Amtsgericht München",
      "registernummer": "HRB 299062",
      "registerart": "HRB",
      "company_name": "Isakaj GmbH",
      "company_seat": "Fürstenfeldbruck",
      "details": "15.07.2025 (Bekanntmachungsdatum)\n\nBayern Amtsgericht München HRB 299062\nRegisterbekanntmachung nach dem Umwandlungsgesetz 14.07.2025 (Eintragungsdatum)\n\nIsakaj GmbH\nGesellschaft mit beschränkter Haftung\nFürstenfeldbruck\n\nDen Gläubigern der an der Ausgliederung beteiligten Rechtsträger ist, wenn sie binnen sechs Monaten nach dem Tag, an dem die Eintragung der Ausgliederung in das Register des Sitzes desjenigen Rechtsträgers, dessen Gläubiger sie sind, nach §§ 125, 19 Abs. 3 UmwG als bekannt gemacht gilt, ihren Anspruch nach Grund und Höhe in Textform anmelden, Sicherheit zu leisten, soweit sie nicht Befriedigung verlangen können. Dieses Recht steht den Gläubigern jedoch nur zu, wenn sie glaubhaft machen, dass durch die Ausgliederung die Erfüllung ihrer Forderung gefährdet wird."
    },
    {
      "date": "2025-07-15",
      "id": "115832",
      "original_text": "Löschungsankündigung\nBayern Amtsgericht Nürnberg HRB 30914\nPowerBind Nürnberg GmbH – Nürnberg",
      "type": "Löschungsankündigung",
      "state": "Bayern",
      "amtsgericht": "Amtsgericht Nürnberg",
      "registernummer": "HRB 30914",
      "registerart": "HRB",
      "company_name": "PowerBind Nürnberg GmbH",
      "company_seat": "Nürnberg",
      "details": "15.07.2025 (Bekanntmachungsdatum)\n\nBayern Amtsgericht Nürnberg HRB 30914\nLöschungsankündigung\n\nPowerBind Nürnberg GmbH\nGesellschaft mit beschränkter Haftung\nNürnberg\n\nDas Registergericht beabsichtigt, die im Handelsregister eingetragene Gesellschaft wegen Vermögenslosigkeit von Amts wegen nach § 394 FamFG zu löschen. Die Frist zur Erhebung eines Widerspruchs ist auf einen Monat festgesetzt."
    },
    {
      "date": "2025-07-15",
      "id": "115833",
      "original_text": "Sonstige Registerbekanntmachung\nBayern Amtsgericht Regensburg HRB 18578\nVitesco Technologies Versicherungsdienst GmbH – Regensburg",
      "type": "Sonstige Registerbekanntmachung",
      "state": "Bayern",
      "amtsgericht": "Amtsgericht Regensburg",
      "registernummer": "HRB 18578",
      "registerart": "HRB",
      "company_name": "Vitesco Technologies Versicherungsdienst GmbH",
      "company_seat": "Regensburg",
      "details": "15.07.2025 (Bekanntmachungsdatum)\n\nBayern Amtsgericht Regensburg HRB 18578\nSonstige Registerbekanntmachung 14.07.2025 (Eintragungsdatum)\n\nVitesco Technologies Versicherungsdienst GmbH\nGesellschaft mit beschränkter Haftung\nRegensburg\n\nDen Gläubigern der Gesellschaft, deren Forderungen begründet worden sind, bevor die Eintragung der Beendigung des Beherrschungs- und Gewinnabführungsvertrages in das Handelsregister nach § 10 des Handelsgesetzbuches als bekanntgemacht gilt, hat der andere Vertragsteil Sicherheit zu leisten, wenn sie sich binnen sechs Monaten nach der Bekanntmachung der Eintragung zu diesem Zweck bei ihm melden."
    },
    {
      "date": "2025-07-15",
      "id": "115834",
      "original_text": "Löschungsankündigung\nBayern Amtsgericht Nürnberg HRB 11988\nSandtfoss-Helicopter- Charter GmbH – Nürnberg",
      "type": "Löschungsankündigung",
      "state": "Bayern",
      "amtsgericht": "Amtsgericht Nürnberg",
      "registernummer": "HRB 11988",
      "registerart": "HRB",
      "company_name": "Sandtfoss-Helicopter- Charter GmbH",
      "company_seat": "Nürnberg",
      "details": "15.07.2025 (Bekanntmachungsdatum)\n\nBayern Amtsgericht Nürnberg HRB 11988\nLöschungsankündigung\n\nSandtfoss-Helicopter- Charter GmbH\nGesellschaft mit beschränkter Haftung\nNürnberg\n\nDas Registergericht beabsichtigt, die im Handelsregister eingetragene Gesellschaft wegen Vermögenslosigkeit von Amts wegen nach § 394 FamFG zu löschen. Die Frist zur Erhebung eines Widerspruchs ist auf einen Monat festgesetzt."
    },
    {
      "date": "2025-07-15",
      "id": "115835",
      "original_text": "Löschungsankündigung\nBayern Amtsgericht Nürnberg HRB 24105\nclm-hotelconsulting gmbh – Postbauer-Heng",
      "type": "Löschungsankündigung",
      "state": "Bayern",
      "amtsgericht": "Amtsgericht Nürnberg",
      "registernummer": "HRB 24105",
      "registerart": "HRB",
      "company_name": "clm-hotelconsulting gmbh",
      "company_seat": "Postbauer-Heng",
      "details": "15.07.2025 (Bekanntmachungsdatum)\n\nBayern Amtsgericht Nürnberg HRB 24105\nLöschungsankündigung\n\nclm-hotelconsulting gmbh\nGesellschaft mit beschränkter Haftung\nPostbauer-Heng\n\nDas Registergericht beabsichtigt, die im Handelsregister eingetragene Gesellschaft wegen Vermögenslosigkeit von Amts wegen nach § 394 FamFG zu löschen. Die Frist zur Erhebung eines Widerspruchs ist auf einen Monat festgesetzt."
    },
    {
      "date": "2025-07-15",
      "id": "115836",
      "original_text": "Registerbekanntmachung nach dem Umwandlungsgesetz\nBayern Amtsgericht Augsburg HRB 35065\nFNZ Competence Center GmbH – Augsburg",
      "type": "Registerbekanntmachung nach dem Umwandlungsgesetz",
      "state": "Bayern",
      "amtsgericht": "Amtsgericht Augsburg",
      "registernummer": "HRB 35065",
      "registerart": "HRB",
      "company_name": "FNZ Competence Center GmbH",
      "company_seat": "Augsburg",
      "details": "15.07.2025 (Bekanntmachungsdatum)\n\nBayern Amtsgericht Augsburg HRB 35065\nRegisterbekanntmachung nach dem Umwandlungsgesetz 14.07.2025 (Eintragungsdatum)\n\nFNZ Competence Center GmbH\nGesellschaft mit beschränkter Haftung\nAugsburg\n\nDen Gläubigern der an der Verschmelzung beteiligten Rechtsträger ist, wenn sie binnen sechs Monaten nach dem Tag, an dem die Eintragung der Verschmelzung in das Register des Sitzes desjenigen Rechtsträgers, dessen Gläubiger sie sind, nach § 19 Abs. 3 UmwG als bekannt gemacht gilt, ihren Anspruch nach Grund und Höhe in Textform anmelden, Sicherheit zu leisten, soweit sie nicht Befriedigung verlangen können. Dieses Recht steht den Gläubigern jedoch nur zu, wenn sie glaubhaft machen, dass durch die Verschmelzung die Erfüllung ihrer Forderung gefährdet wird."
    },
    {
      "date": "2025-07-15",
      "id": "115837",
      "original_text": "Registerbekanntmachung nach dem Umwandlungsgesetz\nBayern Amtsgericht Aschaffenburg HRA 4442\nErbacher Food Intelligence GmbH & Co. KG – Kleinheubach",
      "type": "Registerbekanntmachung nach dem Umwandlungsgesetz",
      "state": "Bayern",
      "amtsgericht": "Amtsgericht Aschaffenburg",
      "registernummer": "HRA 4442",
      "registerart": "HRA",
      "company_name": "Erbacher Food Intelligence GmbH & Co. KG",
      "company_seat": "Kleinheubach",
      "details": "15.07.2025 (Bekanntmachungsdatum)\n\nBayern Amtsgericht Aschaffenburg HRA 4442\nRegisterbekanntmachung nach dem Umwandlungsgesetz 14.07.2025 (Eintragungsdatum)\n\nErbacher Food Intelligence GmbH & Co. KG\nKommanditgesellschaft\nKleinheubach\n\nDen Gläubigern des formwechselnden Rechtsträgers ist, wenn sie binnen sechs Monaten nach dem Tag, an dem die Eintragung des Formwechsels nach § 201 UmwG als bekannt gemacht gilt, ihren Anspruch nach Grund und Höhe in Textform anmelden, Sicherheit zu leisten, soweit sie nicht Befriedigung verlangen können. Dieses Recht steht den Gläubigern jedoch nur zu, wenn sie glaubhaft machen, dass durch den Formwechsel die Erfüllung ihrer Forderung gefährdet wird."
    },
    {
      "date": "2025-07-15",
      "id": "115838",
      "original_text": "Registerbekanntmachung nach dem Umwandlungsgesetz\nBayern Amtsgericht Coburg HRB 6130\nAir-Zone GmbH – Lichtenfels",
      "type": "Registerbekanntmachung nach dem Umwandlungsgesetz",
      "state": "Bayern",
      "amtsgericht": "Amtsgericht Coburg",
      "registernummer": "HRB 6130",
      "registerart": "HRB",
      "company_name": "Air-Zone GmbH",
      "company_seat": "Lichtenfels",
      "details": "15.07.2025 (Bekanntmachungsdatum)\n\nBayern Amtsgericht Coburg HRB 6130\nRegisterbekanntmachung nach dem Umwandlungsgesetz 11.07.2025 (Eintragungsdatum)\n\nAir-Zone GmbH\nGesellschaft mit beschränkter Haftung\nLichtenfels\n\nDen Gläubigern der an der Verschmelzung beteiligten Rechtsträger ist, wenn sie binnen sechs Monaten nach dem Tag, an dem die Eintragung der Verschmelzung in das Register des Sitzes desjenigen Rechtsträgers, dessen Gläubiger sie sind, nach § 19 Abs. 3 UmwG als bekannt gemacht gilt, ihren Anspruch nach Grund und Höhe in Textform anmelden, Sicherheit zu leisten, soweit sie nicht Befriedigung verlangen können. Dieses Recht steht den Gläubigern jedoch nur zu, wenn sie glaubhaft machen, dass durch die Verschmelzung die Erfüllung ihrer Forderung gefährdet wird."
    },
    {
      "date": "2025-07-15",
      "id": "115839",
      "original_text": "Registerbekanntmachung nach dem Umwandlungsgesetz\nBayern Amtsgericht München HRB 113712\nElsa Vermögens- und Beteiligungs AG – Grünwald",
      "type": "Registerbekanntmachung nach dem Umwandlungsgesetz",
      "state": "Bayern",
      "amtsgericht": "Amtsgericht München",
      "registernummer": "HRB 113712",
      "registerart": "HRB",
      "company_name": "Elsa Vermögens- und Beteiligungs AG",
      "company_seat": "Grünwald",
      "details": "15.07.2025 (Bekanntmachungsdatum)\n\nBayern Amtsgericht München HRB 113712\nRegisterbekanntmachung nach dem Umwandlungsgesetz 14.07.2025 (Eintragungsdatum)\n\nElsa Vermögens- und Beteiligungs AG\nAktiengesellschaft\nGrünwald\n\nDen Gläubigern der an der Verschmelzung beteiligten Rechtsträger ist, wenn sie binnen sechs Monaten nach dem Tag, an dem die Eintragung der Verschmelzung in das Register des Sitzes desjenigen Rechtsträgers, dessen Gläubiger sie sind, nach § 19 Abs. 3 UmwG als bekannt gemacht gilt, ihren Anspruch nach Grund und Höhe in Textform anmelden, Sicherheit zu leisten, soweit sie nicht Befriedigung verlangen können. Dieses Recht steht den Gläubigern jedoch nur zu, wenn sie glaubhaft machen, dass durch die Verschmelzung die Erfüllung ihrer Forderung gefährdet wird."
    },
    {
      "date": "2025-07-15",
      "id": "115840",
      "original_text": "Registerbekanntmachung nach dem Umwandlungsgesetz\nBayern Amtsgericht Schweinfurt HRA 10721\nHandyhelden, Inhaber Oguz Gökce e. K. – Schweinfurt",
      "type": "Registerbekanntmachung nach dem Umwandlungsgesetz",
      "state": "Bayern",
      "amtsgericht": "Amtsgericht Schweinfurt",
      "registernummer": "HRA 10721",
      "registerart": "HRA",
      "company_name": "Handyhelden, Inhaber Oguz Gökce e. K.",
      "company_seat": "Schweinfurt",
      "details": "15.07.2025 (Bekanntmachungsdatum)\n\nBayern Amtsgericht Schweinfurt HRA 10721\nRegisterbekanntmachung nach dem Umwandlungsgesetz 14.07.2025 (Eintragungsdatum)\n\nHandyhelden, Inhaber Oguz Gökce e. K.\nEinzelkaufmann / Einzelkauffrau\nSchweinfurt\n\nDen Gläubigern der an der Ausgliederung beteiligten Rechtsträger ist, wenn sie binnen sechs Monaten nach dem Tag, an dem die Eintragung der Ausgliederung in das Register des Sitzes desjenigen Rechtsträgers, dessen Gläubiger sie sind, nach §§ 125, 19 Abs. 3 UmwG als bekannt gemacht gilt, ihren Anspruch nach Grund und Höhe in Textform anmelden, Sicherheit zu leisten, soweit sie nicht Befriedigung verlangen können. Dieses Recht steht den Gläubigern jedoch nur zu, wenn sie glaubhaft machen, dass durch die Ausgliederung die Erfüllung ihrer Forderung gefährdet wird."
    },
    {
      "date": "2025-07-15",
      "id": "115841",
      "original_text": "Registerbekanntmachung nach dem Umwandlungsgesetz\nBayern Amtsgericht Nürnberg HRB 33284\nJUMP House Nürnberg GmbH – Nürnberg",
      "type": "Registerbekanntmachung nach dem Umwandlungsgesetz",
      "state": "Bayern",
      "amtsgericht": "Amtsgericht Nürnberg",
      "registernummer": "HRB 33284",
      "registerart": "HRB",
      "company_name": "JUMP House Nürnberg GmbH",
      "company_seat": "Nürnberg",
      "details": "15.07.2025 (Bekanntmachungsdatum)\n\nBayern Amtsgericht Nürnberg HRB 33284\nRegisterbekanntmachung nach dem Umwandlungsgesetz 14.07.2025 (Eintragungsdatum)\n\nJUMP House Nürnberg GmbH\nGesellschaft mit beschränkter Haftung\nNürnberg\n\nDen Gläubigern der an der Verschmelzung beteiligten Rechtsträger ist, wenn sie binnen sechs Monaten nach dem Tag, an dem die Eintragung der Verschmelzung in das Register des Sitzes desjenigen Rechtsträgers, dessen Gläubiger sie sind, nach § 19 Abs. 3 UmwG als bekannt gemacht gilt, ihren Anspruch nach Grund und Höhe in Textform anmelden, Sicherheit zu leisten, soweit sie nicht Befriedigung verlangen können. Dieses Recht steht den Gläubigern jedoch nur zu, wenn sie glaubhaft machen, dass durch die Verschmelzung die Erfüllung ihrer Forderung gefährdet wird."
    },
    {
      "date": "2025-07-15",
      "id": "115842",
      "original_text": "Registerbekanntmachung nach dem Umwandlungsgesetz\nBayern Amtsgericht München HRB 218329\nAmmersee-Communication GmbH – Germering",
      "type": "Registerbekanntmachung nach dem Umwandlungsgesetz",
      "state": "Bayern",
      "amtsgericht": "Amtsgericht München",
      "registernummer": "HRB 218329",
      "registerart": "HRB",
      "company_name": "Ammersee-Communication GmbH",
      "company_seat": "Germering",
      "details": "15.07.2025 (Bekanntmachungsdatum)\n\nBayern Amtsgericht München HRB 218329\nRegisterbekanntmachung nach dem Umwandlungsgesetz 14.07.2025 (Eintragungsdatum)\n\nAmmersee-Communication GmbH\nGesellschaft mit beschränkter Haftung\nGermering\n\nDen Gläubigern der an der Verschmelzung beteiligten Rechtsträger ist, wenn sie binnen sechs Monaten nach dem Tag, an dem die Eintragung der Verschmelzung in das Register des Sitzes desjenigen Rechtsträgers, dessen Gläubiger sie sind, nach § 19 Abs. 3 UmwG als bekannt gemacht gilt, ihren Anspruch nach Grund und Höhe in Textform anmelden, Sicherheit zu leisten, soweit sie nicht Befriedigung verlangen können. Dieses Recht steht den Gläubigern jedoch nur zu, wenn sie glaubhaft machen, dass durch die Verschmelzung die Erfüllung ihrer Forderung gefährdet wird."
    },
    {
      "date": "2025-07-15",
      "id": "115843",
      "original_text": "Registerbekanntmachung nach dem Umwandlungsgesetz\nBayern Amtsgericht München HRA 120413\nZweithaar-Studio Rothbauer-Golenia e.K. – München",
      "type": "Registerbekanntmachung nach dem Umwandlungsgesetz",
      "state": "Bayern",
      "amtsgericht": "Amtsgericht München",
      "registernummer": "HRA 120413",
      "registerart": "HRA",
      "company_name": "Zweithaar-Studio Rothbauer-Golenia e.K.",
      "company_seat": "München",
      "details": "15.07.2025 (Bekanntmachungsdatum)\n\nBayern Amtsgericht München HRA 120413\nRegisterbekanntmachung nach dem Umwandlungsgesetz 14.07.2025 (Eintragungsdatum)\n\nZweithaar-Studio Rothbauer-Golenia e.K.\nEinzelkaufmann / Einzelkauffrau\nMünchen\n\nZur Verschmelzung der Zweithaar-Studio Annemarie Rothbauer-Golenia Internationale Creationen GmbH mit Sitz in München, (Amtsgericht München HRB 88876) auf den Alleingesellschafter Jan-Dennis Golenia in Firma Zweithaar-Studio Rothbauer-Golenia e.K. mit Sitz in München (Amtsgericht München HRA 120413):\nDen Gläubigern der an der Verschmelzung beteiligten Rechtsträger ist, wenn sie binnen sechs Monaten nach dem Tag, an dem die Eintragung der Verschmelzung in das Register des Sitzes desjenigen Rechtsträgers, dessen Gläubiger sie sind, nach § 19 Abs. 3 UmwG als bekannt gemacht gilt, ihren Anspruch nach Grund und Höhe in Textform anmelden, Sicherheit zu leisten, soweit sie nicht Befriedigung verlangen können. Dieses Recht steht den Gläubigern jedoch nur zu, wenn sie glaubhaft machen, dass durch die Verschmelzung die Erfüllung ihrer Forderung gefährdet wird."
    },
    {
      "date": "2025-07-15",
      "id": "115844",
      "original_text": "Registerbekanntmachung nach dem Umwandlungsgesetz\nBayern Amtsgericht Amberg HRA 3010\nLabor Kneißler GmbH & Co. KG – Burglengenfeld",
      "type": "Registerbekanntmachung nach dem Umwandlungsgesetz",
      "state": "Bayern",
      "amtsgericht": "Amtsgericht Amberg",
      "registernummer": "HRA 3010",
      "registerart": "HRA",
      "company_name": "Labor Kneißler GmbH & Co. KG",
      "company_seat": "Burglengenfeld",
      "details": "15.07.2025 (Bekanntmachungsdatum)\n\nBayern Amtsgericht Amberg HRA 3010\nRegisterbekanntmachung nach dem Umwandlungsgesetz 14.07.2025 (Eintragungsdatum)\n\nLabor Kneißler GmbH & Co. KG\nKommanditgesellschaft\nBurglengenfeld\n\nDen Gläubigern der an der Verschmelzung beteiligten Rechtsträger ist, wenn sie binnen sechs Monaten nach dem Tag, an dem die Eintragung der Verschmelzung in das Register des Sitzes desjenigen Rechtsträgers, dessen Gläubiger sie sind, nach § 19 Abs. 3 UmwG als bekannt gemacht gilt, ihren Anspruch nach Grund und Höhe in Textform anmelden, Sicherheit zu leisten, soweit sie nicht Befriedigung verlangen können. Dieses Recht steht den Gläubigern jedoch nur zu, wenn sie glaubhaft machen, dass durch die Verschmelzung die Erfüllung ihrer Forderung gefährdet wird."
    },
    {
      "date": "2025-07-15",
      "id": "115845",
      "original_text": "Registerbekanntmachung nach dem Umwandlungsgesetz\nBayern Amtsgericht Aschaffenburg HRA 2827\nJosera GmbH & Co. KG – Kleinheubach",
      "type": "Registerbekanntmachung nach dem Umwandlungsgesetz",
      "state": "Bayern",
      "amtsgericht": "Amtsgericht Aschaffenburg",
      "registernummer": "HRA 2827",
      "registerart": "HRA",
      "company_name": "Josera GmbH & Co. KG",
      "company_seat": "Kleinheubach",
      "details": "15.07.2025 (Bekanntmachungsdatum)\n\nBayern Amtsgericht Aschaffenburg HRA 2827\nRegisterbekanntmachung nach dem Umwandlungsgesetz 14.07.2025 (Eintragungsdatum)\n\nJosera GmbH & Co. KG\nKommanditgesellschaft\nKleinheubach\n\nDen Gläubigern des formwechselnden Rechtsträgers ist, wenn sie binnen sechs Monaten nach dem Tag, an dem die Eintragung des Formwechsels nach § 201 UmwG als bekannt gemacht gilt, ihren Anspruch nach Grund und Höhe in Textform anmelden, Sicherheit zu leisten, soweit sie nicht Befriedigung verlangen können. Dieses Recht steht den Gläubigern jedoch nur zu, wenn sie glaubhaft machen, dass durch den Formwechsel die Erfüllung ihrer Forderung gefährdet wird."
    },
    {
      "date": "2025-07-15",
      "id": "115846",
      "original_text": "Registerbekanntmachung nach dem Umwandlungsgesetz\nBayern Amtsgericht Bamberg HRB 12066\nHolzbau Friedrich GmbH – Egloffstein",
      "type": "Registerbekanntmachung nach dem Umwandlungsgesetz",
      "state": "Bayern",
      "amtsgericht": "Amtsgericht Bamberg",
      "registernummer": "HRB 12066",
      "registerart": "HRB",
      "company_name": "Holzbau Friedrich GmbH",
      "company_seat": "Egloffstein",
      "details": "15.07.2025 (Bekanntmachungsdatum)\n\nBayern Amtsgericht Bamberg HRB 12066\nRegisterbekanntmachung nach dem Umwandlungsgesetz 14.07.2025 (Eintragungsdatum)\n\nHolzbau Friedrich GmbH\nGesellschaft mit beschränkter Haftung\nEgloffstein\n\nDen Gläubigern der an der Ausgliederung beteiligten Rechtsträger ist, wenn sie binnen sechs Monaten nach dem Tag, an dem die Eintragung der Ausgliederung in das Register des Sitzes desjenigen Rechtsträgers, dessen Gläubiger sie sind, nach §§ 125, 19 Abs. 3 UmwG als bekannt gemacht gilt, ihren Anspruch nach Grund und Höhe in Textform anmelden, Sicherheit zu leisten, soweit sie nicht Befriedigung verlangen können. Dieses Recht steht den Gläubigern jedoch nur zu, wenn sie glaubhaft machen, dass durch die Ausgliederung die Erfüllung ihrer Forderung gefährdet wird."
    },
    {
      "date": "2025-07-15",
      "id": "115847",
      "original_text": "Löschungsankündigung\nBayern Amtsgericht Nürnberg HRB 2222\nSOLO Gesellschaft für Finanzberatung mit beschränkter Haftung – Nürnberg",
      "type": "Löschungsankündigung",
      "state": "Bayern",
      "amtsgericht": "Amtsgericht Nürnberg",
      "registernummer": "HRB 2222",
      "registerart": "HRB",
      "company_name": "SOLO Gesellschaft für Finanzberatung mit beschränkter Haftung",
      "company_seat": "Nürnberg",
      "details": "15.07.2025 (Bekanntmachungsdatum)\n\nBayern Amtsgericht Nürnberg HRB 2222\nLöschungsankündigung\n\nSOLO Gesellschaft für Finanzberatung mit beschränkter Haftung\nGesellschaft mit beschränkter Haftung\nNürnberg\n\nDas Registergericht beabsichtigt, die im Handelsregister eingetragene Gesellschaft wegen Vermögenslosigkeit von Amts wegen nach § 394 FamFG zu löschen. Die Frist zur Erhebung eines Widerspruchs ist auf einen Monat festgesetzt."
    },
    {
      "date": "2025-07-15",
      "id": "115848",
      "original_text": "Registerbekanntmachung nach dem Umwandlungsgesetz\nBayern Amtsgericht Aschaffenburg PR 78\nSchultz & de Vries Immobilienbewertung PartG mbB – Elsenfeld",
      "type": "Registerbekanntmachung nach dem Umwandlungsgesetz",
      "state": "Bayern",
      "amtsgericht": "Amtsgericht Aschaffenburg",
      "registernummer": "PR 78",
      "registerart": "PR",
      "company_name": "Schultz & de Vries Immobilienbewertung PartG mbB",
      "company_seat": "Elsenfeld",
      "details": "15.07.2025 (Bekanntmachungsdatum)\n\nBayern Amtsgericht Aschaffenburg PR 78\nRegisterbekanntmachung nach dem Umwandlungsgesetz 14.07.2025 (Eintragungsdatum)\n\nSchultz & de Vries Immobilienbewertung PartG mbB\nPartnerschaftsgesellschaft\nElsenfeld\n\nDen Gläubigern des formwechselnden Rechtsträgers ist, wenn sie binnen sechs Monaten nach dem Tag, an dem die Eintragung des Formwechsels nach § 201 UmwG als bekannt gemacht gilt, ihren Anspruch nach Grund und Höhe in Textform anmelden, Sicherheit zu leisten, soweit sie nicht Befriedigung verlangen können. Dieses Recht steht den Gläubigern jedoch nur zu, wenn sie glaubhaft machen, dass durch den Formwechsel die Erfüllung ihrer Forderung gefährdet wird."
    },
    {
      "date": "2025-07-15",
      "id": "115849",
      "original_text": "Registerbekanntmachung nach dem Umwandlungsgesetz\nBayern Amtsgericht Coburg HRB 2427\nDK - Bio - Energetik - Zentrum GmbH – Lichtenfels-Roth",
      "type": "Registerbekanntmachung nach dem Umwandlungsgesetz",
      "state": "Bayern",
      "amtsgericht": "Amtsgericht Coburg",
      "registernummer": "HRB 2427",
      "registerart": "HRB",
      "company_name": "DK - Bio - Energetik - Zentrum GmbH",
      "company_seat": "Lichtenfels-Roth",
      "details": "15.07.2025 (Bekanntmachungsdatum)\n\nBayern Amtsgericht Coburg HRB 2427\nRegisterbekanntmachung nach dem Umwandlungsgesetz 11.07.2025 (Eintragungsdatum)\n\nDK - Bio - Energetik - Zentrum GmbH\nGesellschaft mit beschränkter Haftung\nLichtenfels-Roth\n\nDen Gläubigern der an der Verschmelzung beteiligten Rechtsträger ist, wenn sie binnen sechs Monaten nach dem Tag, an dem die Eintragung der Verschmelzung in das Register des Sitzes desjenigen Rechtsträgers, dessen Gläubiger sie sind, nach § 19 Abs. 3 UmwG als bekannt gemacht gilt, ihren Anspruch nach Grund und Höhe in Textform anmelden, Sicherheit zu leisten, soweit sie nicht Befriedigung verlangen können. Dieses Recht steht den Gläubigern jedoch nur zu, wenn sie glaubhaft machen, dass durch die Verschmelzung die Erfüllung ihrer Forderung gefährdet wird."
    },
    {
      "date": "2025-07-15",
      "id": "115850",
      "original_text": "Registerbekanntmachung nach dem Umwandlungsgesetz\nBayern Amtsgericht Aschaffenburg HRB 18143\nErbacher Food Intelligence GmbH – Kleinheubach",
      "type": "Registerbekanntmachung nach dem Umwandlungsgesetz",
      "state": "Bayern",
      "amtsgericht": "Amtsgericht Aschaffenburg",
      "registernummer": "HRB 18143",
      "registerart": "HRB",
      "company_name": "Erbacher Food Intelligence GmbH",
      "company_seat": "Kleinheubach",
      "details": "15.07.2025 (Bekanntmachungsdatum)\n\nBayern Amtsgericht Aschaffenburg HRB 18143\nRegisterbekanntmachung nach dem Umwandlungsgesetz 14.07.2025 (Eintragungsdatum)\n\nErbacher Food Intelligence GmbH\nGesellschaft mit beschränkter Haftung\nKleinheubach\n\nDen Gläubigern des formwechselnden Rechtsträgers ist, wenn sie binnen sechs Monaten nach dem Tag, an dem die Eintragung des Formwechsels nach § 201 UmwG als bekannt gemacht gilt, ihren Anspruch nach Grund und Höhe in Textform anmelden, Sicherheit zu leisten, soweit sie nicht Befriedigung verlangen können. Dieses Recht steht den Gläubigern jedoch nur zu, wenn sie glaubhaft machen, dass durch den Formwechsel die Erfüllung ihrer Forderung gefährdet wird."
    },
    {
      "date": "2025-07-15",
      "id": "115851",
      "original_text": "Löschungsankündigung\nBayern Amtsgericht München HRB 211929\nNeuHeim Immobilien GmbH – Planegg",
      "type": "Löschungsankündigung",
      "state": "Bayern",
      "amtsgericht": "Amtsgericht München",
      "registernummer": "HRB 211929",
      "registerart": "HRB",
      "company_name": "NeuHeim Immobilien GmbH",
      "company_seat": "Planegg",
      "details": "15.07.2025 (Bekanntmachungsdatum)\n\nBayern Amtsgericht München HRB 211929\nLöschungsankündigung 14.07.2025 (Eintragungsdatum)\n\nNeuHeim Immobilien GmbH\nGesellschaft mit beschränkter Haftung\nPlanegg\n\nDas Registergericht beabsichtigt, die im Handelsregister eingetragene Gesellschaft wegen Vermögenslosigkeit von Amts wegen nach § 394 FamFG zu löschen. Die Frist zur Erhebung eines Widerspruchs ist auf drei Monate festgesetzt."
    },
    {
      "date": "2025-07-15",
      "id": "115852",
      "original_text": "Sonstige Registerbekanntmachung\nBayern Amtsgericht Regensburg HRB 8641\nS-Refit AG – Regensburg",
      "type": "Sonstige Registerbekanntmachung",
      "state": "Bayern",
      "amtsgericht": "Amtsgericht Regensburg",
      "registernummer": "HRB 8641",
      "registerart": "HRB",
      "company_name": "S-Refit AG",
      "company_seat": "Regensburg",
      "details": "15.07.2025 (Bekanntmachungsdatum)\n\nBayern Amtsgericht Regensburg HRB 8641\nSonstige Registerbekanntmachung 14.07.2025 (Eintragungsdatum)\n\nS-Refit AG\nAktiengesellschaft\nRegensburg\n\nDen Gläubigern der Gesellschaft, deren Forderungen begründet worden sind, bevor die Eintragung des Beschlusses bekanntgemacht worden ist, ist, wenn sie sich binnen sechs Monaten nach der Bekanntmachung zu diesem Zweck melden, Sicherheit zu leisten, soweit sie nicht Befriedigung verlangen können. Das Recht, Sicherheitsleistung zu verlangen, steht Gläubigern nicht zu, die im Fall des Insolvenzverfahrens ein Recht auf vorzugsweise Befriedigung aus einer Deckungsmasse haben, die nach gesetzlicher Vorschrift zu ihrem Schutz errichtet und staatlich überwacht ist."
    },
    {
      "date": "2025-07-15",
      "id": "115853",
      "original_text": "Registerbekanntmachung nach dem Umwandlungsgesetz\nBerlin Amtsgericht Berlin (Charlottenburg) HRB 239509\nTRUST Versicherungsmakler GmbH – Berlin",
      "type": "Registerbekanntmachung nach dem Umwandlungsgesetz",
      "state": "Berlin",
      "amtsgericht": "Amtsgericht Berlin (Charlottenburg)",
      "registernummer": "HRB 239509",
      "registerart": "HRB",
      "company_name": "TRUST Versicherungsmakler GmbH",
      "company_seat": "Berlin",
      "details": "15.07.2025 (Bekanntmachungsdatum)\n\nBerlin Amtsgericht Berlin (Charlottenburg) HRB 239509\nRegisterbekanntmachung nach dem Umwandlungsgesetz 11.07.2025 (Eintragungsdatum)\n\nTRUST Versicherungsmakler GmbH\nGesellschaft mit beschränkter Haftung\nBerlin\n\nZu Eintragungsnummer 5 vom 11.07.2025 wird als nicht eingetragen veröffentlicht: Den Gläubigern der an der Verschmelzung beteiligten Rechtsträger ist, wenn sie binnen sechs Monaten nach dem Tag, an dem die Eintragung der Verschmelzung in das Register des Sitzes desjenigen Rechtsträgers, dessen Gläubiger sie sind, als bekannt gemacht gilt, ihren Anspruch nach Grund und Höhe schriftlich anmelden, Sicherheit zu leisten, soweit sie nicht Befriedigung verlangen können. Dieses Recht steht den Gläubigern jedoch nur zu, wenn sie glaubhaft machen, dass durch die Verschmelzung die Erfüllung ihrer Forderung gefährdet wird. Das Recht, Sicherheitsleistung zu verlangen, steht Gläubigern nicht zu, die im Falle der Insolvenz ein Recht auf vorzugsweise Befriedigung aus einer Deckungsmasse haben, die nach gesetzlicher Vorschrift zu ihrem Schutz errichtet und staatlich überwacht ist."
    },
    {
      "date": "2025-07-15",
      "id": "115854",
      "original_text": "Löschungsankündigung\nSchleswig-Holstein Amtsgericht Lübeck HRB 15076\nSBS - Verwaltungsges. mbH – Glinde",
      "type": "Löschungsankündigung",
      "state": "Schleswig-Holstein",
      "amtsgericht": "Amtsgericht Lübeck",
      "registernummer": "HRB 15076",
      "registerart": "HRB",
      "company_name": "SBS - Verwaltungsges. mbH",
      "company_seat": "Glinde",
      "details": "15.07.2025 (Bekanntmachungsdatum)\n\nSchleswig-Holstein Amtsgericht Lübeck HRB 15076\nLöschungsankündigung\n\nSBS - Verwaltungsges. mbH\nGesellschaft mit beschränkter Haftung\nGlinde\n\nEs ist die Löschung der nachstehenden Gesellschaft wegen Vermögenslosigkeit gemäß § 394 FamFG beabsichtigt."
    },
    {
      "date": "2025-07-15",
      "id": "115855",
      "original_text": "Registerbekanntmachung nach dem Umwandlungsgesetz\nBerlin Amtsgericht Berlin (Charlottenburg) HRB 275983\nJoseph Atelier GmbH – Berlin",
      "type": "Registerbekanntmachung nach dem Umwandlungsgesetz",
      "state": "Berlin",
      "amtsgericht": "Amtsgericht Berlin (Charlottenburg)",
      "registernummer": "HRB 275983",
      "registerart": "HRB",
      "company_name": "Joseph Atelier GmbH",
      "company_seat": "Berlin",
      "details": "15.07.2025 (Bekanntmachungsdatum)\n\nBerlin Amtsgericht Berlin (Charlottenburg) HRB 275983\nRegisterbekanntmachung nach dem Umwandlungsgesetz 14.07.2025 (Eintragungsdatum)\n\nJoseph Atelier GmbH\nGesellschaft mit beschränkter Haftung\nBerlin\n\nZu Eintragungsnummer 2 vom 14.07.2025 wird als nicht eingetragen veröffentlicht: Den Gläubigern der an der Spaltung beteiligten Rechtsträger ist, wenn sie binnen sechs Monaten nach dem Tag, an dem die Eintragung der Spaltung in das Register des Sitzes desjenigen Rechtsträgers, dessen Gläubiger sie sind, als bekannt gemacht gilt, ihren Anspruch nach Grund und Höhe schriftlich anmelden, Sicherheit zu leisten, soweit sie nicht Befriedigung verlangen können. Dieses Recht steht den Gläubigern jedoch nur zu, wenn sie glaubhaft machen, dass durch die Spaltung die Erfüllung ihrer Forderung gefährdet wird. Das Recht, Sicherheitsleistung zu verlangen, steht Gläubigern nicht zu, die im Falle der Insolvenz ein Recht auf vorzugsweise Befriedigung aus einer Deckungsmasse haben, die nach gesetzlicher Vorschrift zu ihrem Schutz errichtet und staatlich überwacht ist."
    },
    {
      "date": "2025-07-15",
      "id": "115856",
      "original_text": "Registerbekanntmachung nach dem Umwandlungsgesetz\nBerlin Amtsgericht Berlin (Charlottenburg) HRA 64238\nEU Joseph Atelier e.K. – Berlin",
      "type": "Registerbekanntmachung nach dem Umwandlungsgesetz",
      "state": "Berlin",
      "amtsgericht": "Amtsgericht Berlin (Charlottenburg)",
      "registernummer": "HRA 64238",
      "registerart": "HRA",
      "company_name": "EU Joseph Atelier e.K.",
      "company_seat": "Berlin",
      "details": "15.07.2025 (Bekanntmachungsdatum)\n\nBerlin Amtsgericht Berlin (Charlottenburg) HRA 64238\nRegisterbekanntmachung nach dem Umwandlungsgesetz 14.07.2025 (Eintragungsdatum)\n\nEU Joseph Atelier e.K.\nEinzelkaufmann / Einzelkauffrau\nBerlin\n\nZu Eintragungsnummer 2 vom 14.07.2025 wird als nicht eingetragen veröffentlicht: Den Gläubigern der an der Spaltung beteiligten Rechtsträger ist, wenn sie binnen sechs Monaten nach dem Tag, an dem die Eintragung der Spaltung in das Register des Sitzes desjenigen Rechtsträgers, dessen Gläubiger sie sind, als bekannt gemacht gilt, ihren Anspruch nach Grund und Höhe schriftlich anmelden, Sicherheit zu leisten, soweit sie nicht Befriedigung verlangen können. Dieses Recht steht den Gläubigern jedoch nur zu, wenn sie glaubhaft machen, dass durch die Spaltung die Erfüllung ihrer Forderung gefährdet wird. Das Recht, Sicherheitsleistung zu verlangen, steht Gläubigern nicht zu, die im Falle der Insolvenz ein Recht auf vorzugsweise Befriedigung aus einer Deckungsmasse haben, die nach gesetzlicher Vorschrift zu ihrem Schutz errichtet und staatlich überwacht ist."
    },
    {
      "date": "2025-07-15",
      "id": "115857",
      "original_text": "Sonstige Registerbekanntmachung\nHamburg Amtsgericht Hamburg HRB 43527\nAirbus Operations GmbH – Hamburg",
      "type": "Sonstige Registerbekanntmachung",
      "state": "Hamburg",
      "amtsgericht": "Amtsgericht Hamburg",
      "registernummer": "HRB 43527",
      "registerart": "HRB",
      "company_name": "Airbus Operations GmbH",
      "company_seat": "Hamburg",
      "details": "15.07.2025 (Bekanntmachungsdatum)\n\nHamburg Amtsgericht Hamburg HRB 43527\nSonstige Registerbekanntmachung\n\nAirbus Operations GmbH\nGesellschaft mit beschränkter Haftung\nHamburg\n\nAls nicht eingetragen wird bekannt gemacht: Liste des Aufsichtsrats wurde eingereicht."
    },
    {
      "date": "2025-07-15",
      "id": "115858",
      "original_text": "Sonstige Registerbekanntmachung\nHamburg Amtsgericht Hamburg HRB 2356\nHamburger Wasserwerke Gesellschaft mit beschränkter Haftung – Hamburg",
      "type": "Sonstige Registerbekanntmachung",
      "state": "Hamburg",
      "amtsgericht": "Amtsgericht Hamburg",
      "registernummer": "HRB 2356",
      "registerart": "HRB",
      "company_name": "Hamburger Wasserwerke Gesellschaft mit beschränkter Haftung",
      "company_seat": "Hamburg",
      "details": "15.07.2025 (Bekanntmachungsdatum)\n\nHamburg Amtsgericht Hamburg HRB 2356\nSonstige Registerbekanntmachung\n\nHamburger Wasserwerke Gesellschaft mit beschränkter Haftung\nGesellschaft mit beschränkter Haftung\nHamburg\n\nAls nicht eingetragen wird bekannt gemacht: Liste des Aufsichtsrats wurde eingereicht."
    },
    {
      "date": "2025-07-15",
      "id": "115859",
      "original_text": "Löschungsankündigung\nSchleswig-Holstein Amtsgericht Kiel HRB 18120\nFormica Management GmbH – Kaltenkirchen",
      "type": "Löschungsankündigung",
      "state": "Schleswig-Holstein",
      "amtsgericht": "Amtsgericht Kiel",
      "registernummer": "HRB 18120",
      "registerart": "HRB",
      "company_name": "Formica Management GmbH",
      "company_seat": "Kaltenkirchen",
      "details": "15.07.2025 (Bekanntmachungsdatum)\n\nSchleswig-Holstein Amtsgericht Kiel HRB 18120\nLöschungsankündigung\n\nFormica Management GmbH\nGesellschaft mit beschränkter Haftung\nKaltenkirchen\n\nEs ist die Löschung der nachstehenden Gesellschaft wegen Vermögenslosigkeit gemäß § 394 FamFG beabsichtigt. Widerspruchsfrist: 2 Monate."
    },
    {
      "date": "2025-07-15",
      "id": "115860",
      "original_text": "Registerbekanntmachung nach dem Umwandlungsgesetz\nBrandenburg Amtsgericht Cottbus HRA 4053\nKMS GmbH & Co. KG – Schönefeld",
      "type": "Registerbekanntmachung nach dem Umwandlungsgesetz",
      "state": "Brandenburg",
      "amtsgericht": "Amtsgericht Cottbus",
      "registernummer": "HRA 4053",
      "registerart": "HRA",
      "company_name": "KMS GmbH & Co. KG",
      "company_seat": "Schönefeld",
      "details": "15.07.2025 (Bekanntmachungsdatum)\n\nBrandenburg Amtsgericht Cottbus HRA 4053\nRegisterbekanntmachung nach dem Umwandlungsgesetz 14.07.2025 (Eintragungsdatum)\n\nKMS GmbH & Co. KG\nKommanditgesellschaft\nSchönefeld\n\nDen Gläubigern der an der Verschmelzung beteiligten Rechtsträger ist, wenn sie binnen sechs Monaten nach dem Tag, an dem die Eintragung der Verschmelzung in das Register des Sitzes desjenigen Rechtsträgers, dessen Gläubiger sie sind, als bekannt gemacht gilt, ihren Anspruch nach Grund und Höhe schriftlich anmelden, Sicherheit zu leisten, soweit sie nicht Befriedigung verlangen können. Dieses Recht steht den Gläubigern jedoch nur zu, wenn sie glaubhaft machen, dass durch die Verschmelzung die Erfüllung ihrer Forderung gefährdet wird."
    },
    {
      "date": "2025-07-15",
      "id": "115861",
      "original_text": "Registerbekanntmachung nach dem Umwandlungsgesetz\nBaden-Württemberg Amtsgericht Stuttgart HRB 721790\ncrossbase mediasolution GmbH – Böblingen",
      "type": "Registerbekanntmachung nach dem Umwandlungsgesetz",
      "state": "Baden-Württemberg",
      "amtsgericht": "Amtsgericht Stuttgart",
      "registernummer": "HRB 721790",
      "registerart": "HRB",
      "company_name": "crossbase mediasolution GmbH",
      "company_seat": "Böblingen",
      "details": "15.07.2025 (Bekanntmachungsdatum)\n\nBaden-Württemberg Amtsgericht Stuttgart HRB 721790\nRegisterbekanntmachung nach dem Umwandlungsgesetz 15.07.2025 (Eintragungsdatum)\n\ncrossbase mediasolution GmbH\nGesellschaft mit beschränkter Haftung\nBöblingen\n\nAls nicht eingetragen wird bekanntgemacht:\nDen Gläubigern der an der Verschmelzung beteiligten Rechtsträger ist, wenn sie binnen sechs Monaten nach dem Tag, an dem die Eintragung der Verschmelzung in das Register des Sitzes desjenigen Rechtsträgers, dessen Gläubiger sie sind, nach § 19 Abs. 3 UmwG als bekanntgemacht gilt, ihren Anspruch nach Grund und Höhe schriftlich anmelden, Sicherheit zu leisten, soweit sie nicht Befriedigung verlangen können. Dieses Recht steht den Gläubigern jedoch nur zu, wenn sie glaubhaft machen, dass durch die Verschmelzung die Erfüllung ihrer Forderung gefährdet wird."
    },
    {
      "date": "2025-07-15",
      "id": "115862",
      "original_text": "Registerbekanntmachung nach dem Umwandlungsgesetz\nHamburg Amtsgericht Hamburg HRB 158650\nDreiundachtzigste LOGIMAC Logistic Grundbesitz GmbH – Hamburg",
      "type": "Registerbekanntmachung nach dem Umwandlungsgesetz",
      "state": "Hamburg",
      "amtsgericht": "Amtsgericht Hamburg",
      "registernummer": "HRB 158650",
      "registerart": "HRB",
      "company_name": "Dreiundachtzigste LOGIMAC Logistic Grundbesitz GmbH",
      "company_seat": "Hamburg",
      "details": "15.07.2025 (Bekanntmachungsdatum)\n\nHamburg Amtsgericht Hamburg HRB 158650\nRegisterbekanntmachung nach dem Umwandlungsgesetz 15.07.2025 (Eintragungsdatum)\n\nDreiundachtzigste LOGIMAC Logistic Grundbesitz GmbH\nGesellschaft mit beschränkter Haftung\nHamburg\n\nAls nicht eingetragen wird bekannt gemacht:\nEs wird darauf hingewiesen, dass ein Formwechselplan oder sein Entwurf über einen grenzüberschreitenden Formwechsel in die Rosa Propco Langenhagen S.à r.l. mit Sitz in Luxemburg/Luxemburg (société à responsabilité limitée - Gesellschaft mit beschränkter Haftung  nach luxemburgischem Recht) beim Handelsregister eingereicht worden ist.\nDie Anteilsinhaber, die Gläubiger sowie die zuständigen Betriebsräte der an dem grenzüberschreitenden Formwechsel beteiligten Gesellschaft oder, soweit es keinen Betriebsrat gibt, die Arbeitnehmer der an dem grenzüberschreitenden Formwechsel beteiligten Gesellschaft, können der Gesellschaft spätestens fünf Arbeitstage vor dem Tag der Gesellschafterversammlung Bemerkungen zum Formwechselplan übermitteln."
    },
    {
      "date": "2025-07-15",
      "id": "115863",
      "original_text": "Einreichung neuer Dokumente\nBerlin Amtsgericht Berlin (Charlottenburg) HRB 170645\nCapita Customer Services (Germany) GmbH – Berlin",
      "type": "Einreichung neuer Dokumente",
      "state": "Berlin",
      "amtsgericht": "Amtsgericht Berlin (Charlottenburg)",
      "registernummer": "HRB 170645",
      "registerart": "HRB",
      "company_name": "Capita Customer Services (Germany) GmbH",
      "company_seat": "Berlin",
      "details": "15.07.2025 (Bekanntmachungsdatum)\n\nBerlin Amtsgericht Berlin (Charlottenburg) HRB 170645\nEinreichung neuer Dokumente\n\nCapita Customer Services (Germany) GmbH\nGesellschaft mit beschränkter Haftung\nBerlin\n\nAls nicht eingetragen wird veröffentlicht: Es wurde eine neue Liste der Aufsichtsratsmitglieder eingereicht (§52 GmbHG)."
    },
    {
      "date": "2025-07-15",
      "id": "115864",
      "original_text": "Einreichung neuer Dokumente\nBerlin Amtsgericht Berlin (Charlottenburg) HRB 170645\nCapita Customer Services (Germany) GmbH – Berlin",
      "type": "Einreichung neuer Dokumente",
      "state": "Berlin",
      "amtsgericht": "Amtsgericht Berlin (Charlottenburg)",
      "registernummer": "HRB 170645",
      "registerart": "HRB",
      "company_name": "Capita Customer Services (Germany) GmbH",
      "company_seat": "Berlin",
      "details": "15.07.2025 (Bekanntmachungsdatum)\n\nBerlin Amtsgericht Berlin (Charlottenburg) HRB 170645\nEinreichung neuer Dokumente\n\nCapita Customer Services (Germany) GmbH\nGesellschaft mit beschränkter Haftung\nBerlin\n\nAls nicht eingetragen wird veröffentlicht: Es wurde eine neue Liste der Aufsichtsratsmitglieder eingereicht (§52 GmbHG)."
    },
    {
      "date": "2025-07-15",
      "id": "115865",
      "original_text": "Einreichung neuer Dokumente\nBerlin Amtsgericht Berlin (Charlottenburg) HRB 167633\nFuturium gGmbH – Berlin",
      "type": "Einreichung neuer Dokumente",
      "state": "Berlin",
      "amtsgericht": "Amtsgericht Berlin (Charlottenburg)",
      "registernummer": "HRB 167633",
      "registerart": "HRB",
      "company_name": "Futurium gGmbH",
      "company_seat": "Berlin",
      "details": "15.07.2025 (Bekanntmachungsdatum)\n\nBerlin Amtsgericht Berlin (Charlottenburg) HRB 167633\nEinreichung neuer Dokumente\n\nFuturium gGmbH\nGesellschaft mit beschränkter Haftung\nBerlin\n\nAls nicht eingetragen wird veröffentlicht: Es wurde eine neue Liste der Aufsichtsratsmitglieder eingereicht (§52 GmbHG)."
    },
    {
      "date": "2025-07-15",
      "id": "115866",
      "original_text": "Registerbekanntmachung nach dem Umwandlungsgesetz\nHamburg Amtsgericht Hamburg HRB 181103\nDE38 Logimac GmbH – Hamburg",
      "type": "Registerbekanntmachung nach dem Umwandlungsgesetz",
      "state": "Hamburg",
      "amtsgericht": "Amtsgericht Hamburg",
      "registernummer": "HRB 181103",
      "registerart": "HRB",
      "company_name": "DE38 Logimac GmbH",
      "company_seat": "Hamburg",
      "details": "15.07.2025 (Bekanntmachungsdatum)\n\nHamburg Amtsgericht Hamburg HRB 181103\nRegisterbekanntmachung nach dem Umwandlungsgesetz 15.07.2025 (Eintragungsdatum)\n\nDE38 Logimac GmbH\nGesellschaft mit beschränkter Haftung\nHamburg\n\nAls nicht eingetragen wird bekannt gemacht:\nEs wird darauf hingewiesen, dass ein Formwechselplan oder sein Entwurf über einen grenzüberschreitenden Formwechsel in die Rosa Propco Gera S.à r.l. mit Sitz in Luxemburg/Luxemburg (société à responsabilité limitée - Gesellschaft mit beschränkter Haftung  nach luxemburgischem Recht) beim Handelsregister eingereicht worden ist.\nDie Anteilsinhaber, die Gläubiger sowie die zuständigen Betriebsräte der an dem grenzüberschreitenden Formwechsel beteiligten Gesellschaft oder, soweit es keinen Betriebsrat gibt, die Arbeitnehmer der an dem grenzüberschreitenden Formwechsel beteiligten Gesellschaft, können der Gesellschaft spätestens fünf Arbeitstage vor dem Tag der Gesellschafterversammlung Bemerkungen zum Formwechselplan übermitteln."
    },
    {
      "date": "2025-07-15",
      "id": "115867",
      "original_text": "Registerbekanntmachung nach dem Umwandlungsgesetz\nHamburg Amtsgericht Hamburg HRB 164285\nDE2 Logimac GmbH – Hamburg",
      "type": "Registerbekanntmachung nach dem Umwandlungsgesetz",
      "state": "Hamburg",
      "amtsgericht": "Amtsgericht Hamburg",
      "registernummer": "HRB 164285",
      "registerart": "HRB",
      "company_name": "DE2 Logimac GmbH",
      "company_seat": "Hamburg",
      "details": "15.07.2025 (Bekanntmachungsdatum)\n\nHamburg Amtsgericht Hamburg HRB 164285\nRegisterbekanntmachung nach dem Umwandlungsgesetz 15.07.2025 (Eintragungsdatum)\n\nDE2 Logimac GmbH\nGesellschaft mit beschränkter Haftung\nHamburg\n\nAls nicht eingetragen wird bekannt gemacht:\nEs wird darauf hingewiesen, dass ein Formwechselplan oder sein Entwurf über einen grenzüberschreitenden Formwechsel in die Rosa Propco Müllendorf S.à r.l. mit Sitz in Luxemburg/Luxemburg (société à responsabilité limitée - Gesellschaft mit beschränkter Haftung  nach luxemburgischem Recht) beim Handelsregister eingereicht worden ist.\nDie Anteilsinhaber, die Gläubiger sowie die zuständigen Betriebsräte der an dem grenzüberschreitenden Formwechsel beteiligten Gesellschaft oder, soweit es keinen Betriebsrat gibt, die Arbeitnehmer der an dem grenzüberschreitenden Formwechsel beteiligten Gesellschaft, können der Gesellschaft spätestens fünf Arbeitstage vor dem Tag der Gesellschafterversammlung Bemerkungen zum Formwechselplan übermitteln."
    },
    {
      "date": "2025-07-15",
      "id": "115868",
      "original_text": "Registerbekanntmachung nach dem Umwandlungsgesetz\nHamburg Amtsgericht Hamburg HRB 173627\nDE27 Logimac GmbH – Hamburg",
      "type": "Registerbekanntmachung nach dem Umwandlungsgesetz",
      "state": "Hamburg",
      "amtsgericht": "Amtsgericht Hamburg",
      "registernummer": "HRB 173627",
      "registerart": "HRB",
      "company_name": "DE27 Logimac GmbH",
      "company_seat": "Hamburg",
      "details": "15.07.2025 (Bekanntmachungsdatum)\n\nHamburg Amtsgericht Hamburg HRB 173627\nRegisterbekanntmachung nach dem Umwandlungsgesetz 15.07.2025 (Eintragungsdatum)\n\nDE27 Logimac GmbH\nGesellschaft mit beschränkter Haftung\nHamburg\n\nAls nicht eingetragen wird bekannt gemacht:\nEs wird darauf hingewiesen, dass ein Formwechselplan oder sein Entwurf über einen grenzüberschreitenden Formwechsel in die Rosa Propco Coswig S.à r.l. mit Sitz in Luxemburg/Luxemburg (société à responsabilité limitée - Gesellschaft mit beschränkter Haftung  nach luxemburgischem Recht) beim Handelsregister eingereicht worden ist.\nDie Anteilsinhaber, die Gläubiger sowie die zuständigen Betriebsräte der an dem grenzüberschreitenden Formwechsel beteiligten Gesellschaft oder, soweit es keinen Betriebsrat gibt, die Arbeitnehmer der an dem grenzüberschreitenden Formwechsel beteiligten Gesellschaft, können der Gesellschaft spätestens fünf Arbeitstage vor dem Tag der Gesellschafterversammlung Bemerkungen zum Formwechselplan übermitteln."
    },
    {
      "date": "2025-07-15",
      "id": "115869",
      "original_text": "Einreichung neuer Dokumente\nBaden-Württemberg Amtsgericht Stuttgart HRB 204231\nMann + Hummel Holding GmbH – Ludwigsburg",
      "type": "Einreichung neuer Dokumente",
      "state": "Baden-Württemberg",
      "amtsgericht": "Amtsgericht Stuttgart",
      "registernummer": "HRB 204231",
      "registerart": "HRB",
      "company_name": "Mann + Hummel Holding GmbH",
      "company_seat": "Ludwigsburg",
      "details": "15.07.2025 (Bekanntmachungsdatum)\n\nBaden-Württemberg Amtsgericht Stuttgart HRB 204231\nEinreichung neuer Dokumente\n\nMann + Hummel Holding GmbH\nGesellschaft mit beschränkter Haftung\nLudwigsburg\n\nDie Gesellschaft hat am 14.07.2025 die Liste über die Zusammensetzung des Aufsichtsrats zum Handelsregister eingereicht."
    },
    {
      "date": "2025-07-15",
      "id": "115870",
      "original_text": "Einreichung neuer Dokumente\nBerlin Amtsgericht Berlin (Charlottenburg) HRB 203542\nJumia Technologies AG – Berlin",
      "type": "Einreichung neuer Dokumente",
      "state": "Berlin",
      "amtsgericht": "Amtsgericht Berlin (Charlottenburg)",
      "registernummer": "HRB 203542",
      "registerart": "HRB",
      "company_name": "Jumia Technologies AG",
      "company_seat": "Berlin",
      "details": "15.07.2025 (Bekanntmachungsdatum)\n\nBerlin Amtsgericht Berlin (Charlottenburg) HRB 203542\nEinreichung neuer Dokumente\n\nJumia Technologies AG\nAktiengesellschaft\nBerlin\n\nAls nicht eingetragen wird veröffentlicht: Es wurde eine neue Liste der Aufsichtsratsmitglieder eingereicht (§ 106 AktG)."
    },
    {
      "date": "2025-07-15",
      "id": "115871",
      "original_text": "Löschungsankündigung\nSchleswig-Holstein Amtsgericht Pinneberg HRB 17447\nRoofabilly Dachdeckerei & Zimmerei UG (haftungsbeschränkt) – Burg",
      "type": "Löschungsankündigung",
      "state": "Schleswig-Holstein",
      "amtsgericht": "Amtsgericht Pinneberg",
      "registernummer": "HRB 17447",
      "registerart": "HRB",
      "company_name": "Roofabilly Dachdeckerei & Zimmerei UG (haftungsbeschränkt)",
      "company_seat": "Burg",
      "details": "15.07.2025 (Bekanntmachungsdatum)\n\nSchleswig-Holstein Amtsgericht Pinneberg HRB 17447\nLöschungsankündigung\n\nRoofabilly Dachdeckerei & Zimmerei UG (haftungsbeschränkt)\nGesellschaft mit beschränkter Haftung\nBurg\n\nEs ist die Löschung der nachstehenden Gesellschaft wegen Vermögenslosigkeit gemäß § 394 FamFG beabsichtigt. Widerspruchsfrist: 2 Monate."
    },
    {
      "date": "2025-07-15",
      "id": "115872",
      "original_text": "Registerbekanntmachung nach dem Umwandlungsgesetz\nBaden-Württemberg Amtsgericht Stuttgart HRB 766532\nICP Deutschland GmbH – Reutlingen",
      "type": "Registerbekanntmachung nach dem Umwandlungsgesetz",
      "state": "Baden-Württemberg",
      "amtsgericht": "Amtsgericht Stuttgart",
      "registernummer": "HRB 766532",
      "registerart": "HRB",
      "company_name": "ICP Deutschland GmbH",
      "company_seat": "Reutlingen",
      "details": "15.07.2025 (Bekanntmachungsdatum)\n\nBaden-Württemberg Amtsgericht Stuttgart HRB 766532\nRegisterbekanntmachung nach dem Umwandlungsgesetz 15.07.2025 (Eintragungsdatum)\n\nICP Deutschland GmbH\nGesellschaft mit beschränkter Haftung\nReutlingen\n\nDen Gläubigern der an der Verschmelzung beteiligten Rechtsträger ist, wenn sie binnen sechs Monaten nach dem Tag, an dem die Eintragung der Verschmelzung in das Register des Sitzes desjenigen Rechtsträgers, dessen Gläubiger sie sind, nach § 19 Abs. 3 UmwG als bekanntgemacht gilt, ihren Anspruch nach Grund und Höhe schriftlich anmelden, Sicherheit zu leisten, soweit sie nicht Befriedigung verlangen können. Dieses Recht steht den Gläubigern jedoch nur zu, wenn sie glaubhaft machen, dass durch die Verschmelzung die Erfüllung ihrer Forderung gefährdet wird."
    },
    {
      "date": "2025-07-15",
      "id": "115873",
      "original_text": "Registerbekanntmachung nach dem Umwandlungsgesetz\nBaden-Württemberg Amtsgericht Stuttgart HRB 790265\nChaparro Immobilien GmbH – Calw",
      "type": "Registerbekanntmachung nach dem Umwandlungsgesetz",
      "state": "Baden-Württemberg",
      "amtsgericht": "Amtsgericht Stuttgart",
      "registernummer": "HRB 790265",
      "registerart": "HRB",
      "company_name": "Chaparro Immobilien GmbH",
      "company_seat": "Calw",
      "details": "15.07.2025 (Bekanntmachungsdatum)\n\nBaden-Württemberg Amtsgericht Stuttgart HRB 790265\nRegisterbekanntmachung nach dem Umwandlungsgesetz 15.07.2025 (Eintragungsdatum)\n\nChaparro Immobilien GmbH\nGesellschaft mit beschränkter Haftung\nCalw\n\nAls nicht eingetragen wird bekanntgemacht:\nDen Gläubigern des an dem Formwechsel beteiligten Rechtsträgers ist, wenn sie binnen sechs Monaten nach dem Tag, an dem die Eintragung des Formwechsels in das Register des Sitzes desjenigen Rechtsträgers, dessen Gläubiger sie sind, nach § 19 Abs. 3 UmwG als bekanntgemacht gilt, ihren Anspruch nach Grund und Höhe schriftlich anmelden, Sicherheit zu leisten, soweit sie nicht Befriedigung verlangen können. Dieses Recht steht den Gläubigern jedoch nur zu, wenn sie glaubhaft machen, dass durch den Formwechsel die Erfüllung ihrer Forderung gefährdet wird."
    },
    {
      "date": "2025-07-15",
      "id": "115874",
      "original_text": "Einreichung neuer Dokumente\nBrandenburg Amtsgericht Neuruppin HRB 1203\nRegionale Entwicklungsgesellschaft in Oberhavel-Nord (REGiO-Nord) mbH – Gransee",
      "type": "Einreichung neuer Dokumente",
      "state": "Brandenburg",
      "amtsgericht": "Amtsgericht Neuruppin",
      "registernummer": "HRB 1203",
      "registerart": "HRB",
      "company_name": "Regionale Entwicklungsgesellschaft in Oberhavel-Nord (REGiO-Nord) mbH",
      "company_seat": "Gransee",
      "details": "15.07.2025 (Bekanntmachungsdatum)\n\nBrandenburg Amtsgericht Neuruppin HRB 1203\nEinreichung neuer Dokumente\n\nRegionale Entwicklungsgesellschaft in Oberhavel-Nord (REGiO-Nord) mbH\nGesellschaft mit beschränkter Haftung\nGransee\n\nAls nicht eingetragen wird veröffentlicht: Eine Liste der Mitglieder des Aufsichtsrates wurde zum Handelsregister eingereicht."
    },
    {
      "date": "2025-07-15",
      "id": "115875",
      "original_text": "Löschungsankündigung\nBaden-Württemberg Amtsgericht Stuttgart HRB 771680\nStrauss-Bau GmbH – Weinstadt",
      "type": "Löschungsankündigung",
      "state": "Baden-Württemberg",
      "amtsgericht": "Amtsgericht Stuttgart",
      "registernummer": "HRB 771680",
      "registerart": "HRB",
      "company_name": "Strauss-Bau GmbH",
      "company_seat": "Weinstadt",
      "details": "15.07.2025 (Bekanntmachungsdatum)\n\nBaden-Württemberg Amtsgericht Stuttgart HRB 771680\nLöschungsankündigung\n\nStrauss-Bau GmbH\nGesellschaft mit beschränkter Haftung\nWeinstadt\n\nAls nicht eingetragen wird bekanntgemacht:\nDas Gericht beabsichtigt, die Gesellschaft wegen Vermögenslosigkeit im Handelsregister von Amts wegen nach § 394 FamFG zu löschen. Die Frist zur Geltendmachung eines Widerspruchs gegen die beabsichtigte Löschung ist auf zwei Monate ab Veröffentlichung bestimmt."
    },
    {
      "date": "2025-07-15",
      "id": "115876",
      "original_text": "Registerbekanntmachung nach dem Umwandlungsgesetz\nBaden-Württemberg Amtsgericht Mannheim HRB 718931\nAMP Parking Europe GmbH – Karlsruhe",
      "type": "Registerbekanntmachung nach dem Umwandlungsgesetz",
      "state": "Baden-Württemberg",
      "amtsgericht": "Amtsgericht Mannheim",
      "registernummer": "HRB 718931",
      "registerart": "HRB",
      "company_name": "AMP Parking Europe GmbH",
      "company_seat": "Karlsruhe",
      "details": "15.07.2025 (Bekanntmachungsdatum)\n\nBaden-Württemberg Amtsgericht Mannheim HRB 718931\nRegisterbekanntmachung nach dem Umwandlungsgesetz 15.07.2025 (Eintragungsdatum)\n\nAMP Parking Europe GmbH\nGesellschaft mit beschränkter Haftung\nKarlsruhe\n\nAls nicht eingetragen wird bekanntgemacht:\nDen Gläubigern der an der Verschmelzung beteiligten Rechtsträger ist, wenn sie binnen sechs Monaten nach dem Tag, an dem die Eintragung der Verschmelzung in das Register des Sitzes desjenigen Rechtsträgers, dessen Gläubiger sie sind, nach § 19 Abs. 3 UmwG als bekanntgemacht gilt, ihren Anspruch nach Grund und Höhe schriftlich anmelden, Sicherheit zu leisten, soweit sie nicht Befriedigung verlangen können. Dieses Recht steht den Gläubigern jedoch nur zu, wenn sie glaubhaft machen, dass durch die Verschmelzung die Erfüllung ihrer Forderung gefährdet wird."
    },
    {
      "date": "2025-07-15",
      "id": "115877",
      "original_text": "Registerbekanntmachung nach dem Umwandlungsgesetz\nBaden-Württemberg Amtsgericht Stuttgart HRB 754016\ndiconium GmbH – Stuttgart",
      "type": "Registerbekanntmachung nach dem Umwandlungsgesetz",
      "state": "Baden-Württemberg",
      "amtsgericht": "Amtsgericht Stuttgart",
      "registernummer": "HRB 754016",
      "registerart": "HRB",
      "company_name": "diconium GmbH",
      "company_seat": "Stuttgart",
      "details": "15.07.2025 (Bekanntmachungsdatum)\n\nBaden-Württemberg Amtsgericht Stuttgart HRB 754016\nRegisterbekanntmachung nach dem Umwandlungsgesetz 15.07.2025 (Eintragungsdatum)\n\ndiconium GmbH\nGesellschaft mit beschränkter Haftung\nStuttgart\n\nAls nicht eingetragen wird bekanntgemacht:\nDen Gläubigern der an der Verschmelzung beteiligten Rechtsträger ist, wenn sie binnen sechs Monaten nach dem Tag, an dem die Eintragung der Verschmelzung in das Register des Sitzes desjenigen Rechtsträgers, dessen Gläubiger sie sind, nach § 19 Abs. 3 UmwG als bekanntgemacht gilt, ihren Anspruch nach Grund und Höhe schriftlich anmelden, Sicherheit zu leisten, soweit sie nicht Befriedigung verlangen können. Dieses Recht steht den Gläubigern jedoch nur zu, wenn sie glaubhaft machen, dass durch die Verschmelzung die Erfüllung ihrer Forderung gefährdet wird."
    },
    {
      "date": "2025-07-15",
      "id": "115878",
      "original_text": "Registerbekanntmachung nach dem Umwandlungsgesetz\nBaden-Württemberg Amtsgericht Stuttgart HRB 767917\nSchwabe trifft Inder UG (haftungsbeschränkt) – Brackenheim",
      "type": "Registerbekanntmachung nach dem Umwandlungsgesetz",
      "state": "Baden-Württemberg",
      "amtsgericht": "Amtsgericht Stuttgart",
      "registernummer": "HRB 767917",
      "registerart": "HRB",
      "company_name": "Schwabe trifft Inder UG (haftungsbeschränkt)",
      "company_seat": "Brackenheim",
      "details": "15.07.2025 (Bekanntmachungsdatum)\n\nBaden-Württemberg Amtsgericht Stuttgart HRB 767917\nRegisterbekanntmachung nach dem Umwandlungsgesetz 15.07.2025 (Eintragungsdatum)\n\nSchwabe trifft Inder UG (haftungsbeschränkt)\nGesellschaft mit beschränkter Haftung\nBrackenheim\n\nAls nicht eingetragen wird bekanntgemacht:\nDen Gläubigern der an der Verschmelzung beteiligten Rechtsträger ist, wenn sie binnen sechs Monaten nach dem Tag, an dem die Eintragung der Verschmelzung in das Register des Sitzes desjenigen Rechtsträgers, dessen Gläubiger sie sind, nach § 19 Abs. 3 UmwG als bekanntgemacht gilt, ihren Anspruch nach Grund und Höhe schriftlich anmelden, Sicherheit zu leisten, soweit sie nicht Befriedigung verlangen können. Dieses Recht steht den Gläubigern jedoch nur zu, wenn sie glaubhaft machen, dass durch die Verschmelzung die Erfüllung ihrer Forderung gefährdet wird."
    },
    {
      "date": "2025-07-15",
      "id": "115879",
      "original_text": "Registerbekanntmachung nach dem Umwandlungsgesetz\nBaden-Württemberg Amtsgericht Stuttgart HRB 760562\nperpedes service GmbH – Kirchheim unter Teck",
      "type": "Registerbekanntmachung nach dem Umwandlungsgesetz",
      "state": "Baden-Württemberg",
      "amtsgericht": "Amtsgericht Stuttgart",
      "registernummer": "HRB 760562",
      "registerart": "HRB",
      "company_name": "perpedes service GmbH",
      "company_seat": "Kirchheim unter Teck",
      "details": "15.07.2025 (Bekanntmachungsdatum)\n\nBaden-Württemberg Amtsgericht Stuttgart HRB 760562\nRegisterbekanntmachung nach dem Umwandlungsgesetz 15.07.2025 (Eintragungsdatum)\n\nperpedes service GmbH\nGesellschaft mit beschränkter Haftung\nKirchheim unter Teck\n\nAls nicht eingetragen wird bekanntgemacht:\nDen Gläubigern der an der Verschmelzung beteiligten Rechtsträger ist, wenn sie binnen sechs Monaten nach dem Tag, an dem die Eintragung der Verschmelzung in das Register des Sitzes desjenigen Rechtsträgers, dessen Gläubiger sie sind, nach § 19 Abs. 3 UmwG als bekanntgemacht gilt, ihren Anspruch nach Grund und Höhe schriftlich anmelden, Sicherheit zu leisten, soweit sie nicht Befriedigung verlangen können. Dieses Recht steht den Gläubigern jedoch nur zu, wenn sie glaubhaft machen, dass durch die Verschmelzung die Erfüllung ihrer Forderung gefährdet wird."
    },
    {
      "date": "2025-07-15",
      "id": "115880",
      "original_text": "Registerbekanntmachung nach dem Umwandlungsgesetz\nBaden-Württemberg Amtsgericht Mannheim HRB 709117\nAMP Parking Europe GmbH – Karlsruhe",
      "type": "Registerbekanntmachung nach dem Umwandlungsgesetz",
      "state": "Baden-Württemberg",
      "amtsgericht": "Amtsgericht Mannheim",
      "registernummer": "HRB 709117",
      "registerart": "HRB",
      "company_name": "AMP Parking Europe GmbH",
      "company_seat": "Karlsruhe",
      "details": "15.07.2025 (Bekanntmachungsdatum)\n\nBaden-Württemberg Amtsgericht Mannheim HRB 709117\nRegisterbekanntmachung nach dem Umwandlungsgesetz 15.07.2025 (Eintragungsdatum)\n\nAMP Parking Europe GmbH\nGesellschaft mit beschränkter Haftung\nKarlsruhe\n\nDen Gläubigern der an der Verschmelzung beteiligten Rechtsträger ist, wenn sie binnen sechs Monaten nach dem Tag, an dem die Eintragung der Verschmelzung in das Register des Sitzes desjenigen Rechtsträgers, dessen Gläubiger sie sind, nach § 19 Abs. 3 UmwG als bekanntgemacht gilt, ihren Anspruch nach Grund und Höhe schriftlich anmelden, Sicherheit zu leisten, soweit sie nicht Befriedigung verlangen können. Dieses Recht steht den Gläubigern jedoch nur zu, wenn sie glaubhaft machen, dass durch die Verschmelzung die Erfüllung ihrer Forderung gefährdet wird."
    },
    {
      "date": "2025-07-15",
      "id": "115881",
      "original_text": "Registerbekanntmachung nach dem Umwandlungsgesetz\nBaden-Württemberg Amtsgericht Stuttgart HRB 232066\nPERPEDES-Fußstützen-Gesellschaft mit beschränkter Haftung – Lenningen",
      "type": "Registerbekanntmachung nach dem Umwandlungsgesetz",
      "state": "Baden-Württemberg",
      "amtsgericht": "Amtsgericht Stuttgart",
      "registernummer": "HRB 232066",
      "registerart": "HRB",
      "company_name": "PERPEDES-Fußstützen-Gesellschaft mit beschränkter Haftung",
      "company_seat": "Lenningen",
      "details": "15.07.2025 (Bekanntmachungsdatum)\n\nBaden-Württemberg Amtsgericht Stuttgart HRB 232066\nRegisterbekanntmachung nach dem Umwandlungsgesetz 15.07.2025 (Eintragungsdatum)\n\nPERPEDES-Fußstützen-Gesellschaft mit beschränkter Haftung\nGesellschaft mit beschränkter Haftung\nLenningen\n\nAls nicht eingetragen wird bekanntgemacht:\nDen Gläubigern der an der Verschmelzung beteiligten Rechtsträger ist, wenn sie binnen sechs Monaten nach dem Tag, an dem die Eintragung der Verschmelzung in das Register des Sitzes desjenigen Rechtsträgers, dessen Gläubiger sie sind, nach § 19 Abs. 3 UmwG als bekanntgemacht gilt, ihren Anspruch nach Grund und Höhe schriftlich anmelden, Sicherheit zu leisten, soweit sie nicht Befriedigung verlangen können. Dieses Recht steht den Gläubigern jedoch nur zu, wenn sie glaubhaft machen, dass durch die Verschmelzung die Erfüllung ihrer Forderung gefährdet wird."
    },
    {
      "date": "2025-07-15",
      "id": "115882",
      "original_text": "Registerbekanntmachung nach dem Umwandlungsgesetz\nSchleswig-Holstein Amtsgericht Kiel HRB 19983\nMV Estate GmbH – Flintbek",
      "type": "Registerbekanntmachung nach dem Umwandlungsgesetz",
      "state": "Schleswig-Holstein",
      "amtsgericht": "Amtsgericht Kiel",
      "registernummer": "HRB 19983",
      "registerart": "HRB",
      "company_name": "MV Estate GmbH",
      "company_seat": "Flintbek",
      "details": "15.07.2025 (Bekanntmachungsdatum)\n\nSchleswig-Holstein Amtsgericht Kiel HRB 19983\nRegisterbekanntmachung nach dem Umwandlungsgesetz 14.07.2025 (Eintragungsdatum)\n\nMV Estate GmbH\nGesellschaft mit beschränkter Haftung\nFlintbek\n\nZu Eintragungsnummer 4 vom 14.07.2025 wird als nicht eingetragen veröffentlicht: Den Gläubigern der an der Verschmelzung beteiligten Rechtsträger ist, wenn sie binnen sechs Monaten nach dem Tag, an dem die Eintragung der Verschmelzung in das Register des Sitzes desjenigen Rechtsträgers, dessen Gläubiger sie sind, nach § 19 Abs. 3 UmwG bekannt gemacht worden ist, ihren Anspruch nach Grund und Höhe schriftlich anmelden, Sicherheit zu leisten, soweit sie nicht Befriedigung verlangen können. Dieses Recht steht den Gläubigern jedoch nur zu, wenn sie glaubhaft machen, dass durch die Verschmelzung die Erfüllung ihrer Forderung gefährdet wird.eröffentlicht:"
    },
    {
      "date": "2025-07-15",
      "id": "115883",
      "original_text": "Löschungsankündigung\nBaden-Württemberg Amtsgericht Mannheim HRB 726628\nWeinbrecht & Kücherer Oberflächenveredelung GmbH – Sternenfels",
      "type": "Löschungsankündigung",
      "state": "Baden-Württemberg",
      "amtsgericht": "Amtsgericht Mannheim",
      "registernummer": "HRB 726628",
      "registerart": "HRB",
      "company_name": "Weinbrecht & Kücherer Oberflächenveredelung GmbH",
      "company_seat": "Sternenfels",
      "details": "15.07.2025 (Bekanntmachungsdatum)\n\nBaden-Württemberg Amtsgericht Mannheim HRB 726628\nLöschungsankündigung\n\nWeinbrecht & Kücherer Oberflächenveredelung GmbH\nGesellschaft mit beschränkter Haftung\nSternenfels\n\nDas Gericht beabsichtigt, die Gesellschaft wegen Vermögenslosigkeit im Handelsregister von Amts wegen nach § 394 FamFG zu löschen. Die Frist zur Geltendmachung eines Widerspruchs gegen die beabsichtigte Löschung ist auf einen Monat ab Veröffentlichung bestimmt."
    },
    {
      "date": "2025-07-15",
      "id": "115884",
      "original_text": "Registerbekanntmachung nach dem Umwandlungsgesetz\nBaden-Württemberg Amtsgericht Stuttgart HRB 721752\nFierthbauer GmbH – Esslingen am Neckar",
      "type": "Registerbekanntmachung nach dem Umwandlungsgesetz",
      "state": "Baden-Württemberg",
      "amtsgericht": "Amtsgericht Stuttgart",
      "registernummer": "HRB 721752",
      "registerart": "HRB",
      "company_name": "Fierthbauer GmbH",
      "company_seat": "Esslingen am Neckar",
      "details": "15.07.2025 (Bekanntmachungsdatum)\n\nBaden-Württemberg Amtsgericht Stuttgart HRB 721752\nRegisterbekanntmachung nach dem Umwandlungsgesetz 15.07.2025 (Eintragungsdatum)\n\nFierthbauer GmbH\nGesellschaft mit beschränkter Haftung\nEsslingen am Neckar\n\nDen Gläubigern der an der Verschmelzung beteiligten Rechtsträger ist, wenn sie binnen sechs Monaten nach dem Tag, an dem die Eintragung der Verschmelzung in das Register des Sitzes desjenigen Rechtsträgers, dessen Gläubiger sie sind, nach § 19 Abs. 3 UmwG als bekanntgemacht gilt, ihren Anspruch nach Grund und Höhe schriftlich anmelden, Sicherheit zu leisten, soweit sie nicht Befriedigung verlangen können. Dieses Recht steht den Gläubigern jedoch nur zu, wenn sie glaubhaft machen, dass durch die Verschmelzung die Erfüllung ihrer Forderung gefährdet wird."
    },
    {
      "date": "2025-07-15",
      "id": "115885",
      "original_text": "Registerbekanntmachung nach dem Umwandlungsgesetz\nBrandenburg Amtsgericht Cottbus HRA 2408\nKrieger Systems GmbH & Co. KG – Schönefeld",
      "type": "Registerbekanntmachung nach dem Umwandlungsgesetz",
      "state": "Brandenburg",
      "amtsgericht": "Amtsgericht Cottbus",
      "registernummer": "HRA 2408",
      "registerart": "HRA",
      "company_name": "Krieger Systems GmbH & Co. KG",
      "company_seat": "Schönefeld",
      "details": "15.07.2025 (Bekanntmachungsdatum)\n\nBrandenburg Amtsgericht Cottbus HRA 2408\nRegisterbekanntmachung nach dem Umwandlungsgesetz 14.07.2025 (Eintragungsdatum)\n\nKrieger Systems GmbH & Co. KG\nKommanditgesellschaft\nSchönefeld\n\nDen Gläubigern der an der Verschmelzung beteiligten Rechtsträger ist, wenn sie binnen sechs Monaten nach dem Tag, an dem die Eintragung der Verschmelzung in das Register des Sitzes desjenigen Rechtsträgers, dessen Gläubiger sie sind, als bekannt gemacht gilt, ihren Anspruch nach Grund und Höhe schriftlich anmelden, Sicherheit zu leisten, soweit sie nicht Befriedigung verlangen können. Dieses Recht steht den Gläubigern jedoch nur zu, wenn sie glaubhaft machen, dass durch die Verschmelzung die Erfüllung ihrer Forderung gefährdet wird."
    },
    {
      "date": "2025-07-15",
      "id": "115886",
      "original_text": "Registerbekanntmachung nach dem Umwandlungsgesetz\nBaden-Württemberg Amtsgericht Stuttgart HRB 730466\nTHALES Immobilien Deutschland GmbH – Stuttgart",
      "type": "Registerbekanntmachung nach dem Umwandlungsgesetz",
      "state": "Baden-Württemberg",
      "amtsgericht": "Amtsgericht Stuttgart",
      "registernummer": "HRB 730466",
      "registerart": "HRB",
      "company_name": "THALES Immobilien Deutschland GmbH",
      "company_seat": "Stuttgart",
      "details": "15.07.2025 (Bekanntmachungsdatum)\n\nBaden-Württemberg Amtsgericht Stuttgart HRB 730466\nRegisterbekanntmachung nach dem Umwandlungsgesetz 15.07.2025 (Eintragungsdatum)\n\nTHALES Immobilien Deutschland GmbH\nGesellschaft mit beschränkter Haftung\nStuttgart\n\nAls nicht eingetragen wird bekanntgemacht:\nDen Gläubigern der an der Verschmelzung beteiligten Rechtsträger ist, wenn sie binnen sechs Monaten nach dem Tag, an dem die Eintragung der Verschmelzung in das Register des Sitzes desjenigen Rechtsträgers, dessen Gläubiger sie sind, nach § 19 Abs. 3 UmwG als bekanntgemacht gilt, ihren Anspruch nach Grund und Höhe schriftlich anmelden, Sicherheit zu leisten, soweit sie nicht Befriedigung verlangen können. Dieses Recht steht den Gläubigern jedoch nur zu, wenn sie glaubhaft machen, dass durch die Verschmelzung die Erfüllung ihrer Forderung gefährdet wird."
    },
    {
      "date": "2025-07-15",
      "id": "115887",
      "original_text": "Registerbekanntmachung nach dem Umwandlungsgesetz\nBaden-Württemberg Amtsgericht Stuttgart HRB 770723\nCTP Cleanteam Personalmanagement GmbH – Schramberg",
      "type": "Registerbekanntmachung nach dem Umwandlungsgesetz",
      "state": "Baden-Württemberg",
      "amtsgericht": "Amtsgericht Stuttgart",
      "registernummer": "HRB 770723",
      "registerart": "HRB",
      "company_name": "CTP Cleanteam Personalmanagement GmbH",
      "company_seat": "Schramberg",
      "details": "15.07.2025 (Bekanntmachungsdatum)\n\nBaden-Württemberg Amtsgericht Stuttgart HRB 770723\nRegisterbekanntmachung nach dem Umwandlungsgesetz 15.07.2025 (Eintragungsdatum)\n\nCTP Cleanteam Personalmanagement GmbH\nGesellschaft mit beschränkter Haftung\nSchramberg\n\nAls nicht eingetragen wird bekanntgemacht:\nDen Gläubigern der an der Verschmelzung beteiligten Rechtsträger ist, wenn sie binnen sechs Monaten nach dem Tag, an dem die Eintragung der Verschmelzung in das Register des Sitzes desjenigen Rechtsträgers, dessen Gläubiger sie sind, nach § 19 Abs. 3 UmwG als bekanntgemacht gilt, ihren Anspruch nach Grund und Höhe schriftlich anmelden, Sicherheit zu leisten, soweit sie nicht Befriedigung verlangen können. Dieses Recht steht den Gläubigern jedoch nur zu, wenn sie glaubhaft machen, dass durch die Verschmelzung die Erfüllung ihrer Forderung gefährdet wird."
    },
    {
      "date": "2025-07-15",
      "id": "115888",
      "original_text": "Einreichung neuer Dokumente\nNordrhein-Westfalen Amtsgericht Coesfeld HRB 21823\nRailand Raiffeisen AG – Nottuln",
      "type": "Einreichung neuer Dokumente",
      "state": "Nordrhein-Westfalen",
      "amtsgericht": "Amtsgericht Coesfeld",
      "registernummer": "HRB 21823",
      "registerart": "HRB",
      "company_name": "Railand Raiffeisen AG",
      "company_seat": "Nottuln",
      "details": "15.07.2025 (Bekanntmachungsdatum)\n\nNordrhein-Westfalen Amtsgericht Coesfeld HRB 21823\nEinreichung neuer Dokumente\n\nRailand Raiffeisen AG\nAktiengesellschaft\nNottuln\n\nDie Liste der Mitglieder des Aufsichtsrates ist zum Handelsregister eingereicht worden."
    },
    {
      "date": "2025-07-15",
      "id": "115889",
      "original_text": "Registerbekanntmachung nach dem Umwandlungsgesetz\nBaden-Württemberg Amtsgericht Mannheim HRB 729746\nmeine hundeschule Toma GmbH – Karlsruhe",
      "type": "Registerbekanntmachung nach dem Umwandlungsgesetz",
      "state": "Baden-Württemberg",
      "amtsgericht": "Amtsgericht Mannheim",
      "registernummer": "HRB 729746",
      "registerart": "HRB",
      "company_name": "meine hundeschule Toma GmbH",
      "company_seat": "Karlsruhe",
      "details": "15.07.2025 (Bekanntmachungsdatum)\n\nBaden-Württemberg Amtsgericht Mannheim HRB 729746\nRegisterbekanntmachung nach dem Umwandlungsgesetz 15.07.2025 (Eintragungsdatum)\n\nmeine hundeschule Toma GmbH\nGesellschaft mit beschränkter Haftung\nKarlsruhe\n\nDen Gläubigern der an der Verschmelzung beteiligten Rechtsträger ist, wenn sie binnen sechs Monaten nach dem Tag, an dem die Eintragung der Verschmelzung in das Register des Sitzes desjenigen Rechtsträgers, dessen Gläubiger sie sind, nach § 19 Abs. 3 UmwG als bekanntgemacht gilt, ihren Anspruch nach Grund und Höhe schriftlich anmelden, Sicherheit zu leisten, soweit sie nicht Befriedigung verlangen können. Dieses Recht steht den Gläubigern jedoch nur zu, wenn sie glaubhaft machen, dass durch die Verschmelzung die Erfüllung ihrer Forderung gefährdet wird."
    },
    {
      "date": "2025-07-15",
      "id": "115890",
      "original_text": "Einreichung neuer Dokumente\nBaden-Württemberg Amtsgericht Mannheim HRB 108991\nstellenonline.de Aktiengesellschaft – Karlsruhe",
      "type": "Einreichung neuer Dokumente",
      "state": "Baden-Württemberg",
      "amtsgericht": "Amtsgericht Mannheim",
      "registernummer": "HRB 108991",
      "registerart": "HRB",
      "company_name": "stellenonline.de Aktiengesellschaft",
      "company_seat": "Karlsruhe",
      "details": "15.07.2025 (Bekanntmachungsdatum)\n\nBaden-Württemberg Amtsgericht Mannheim HRB 108991\nEinreichung neuer Dokumente\n\nstellenonline.de Aktiengesellschaft\nAktiengesellschaft\nKarlsruhe\n\nDie Gesellschaft hat am 07.07.2025 die Liste über die Zusammensetzung des Aufsichtsrats zum Handelsregister eingereicht."
    },
    {
      "date": "2025-07-15",
      "id": "115891",
      "original_text": "Löschungsankündigung\nBaden-Württemberg Amtsgericht Freiburg HRB 713104\nDÖRING Metalltechnik UG (haftungsbeschränkt) – Biberach",
      "type": "Löschungsankündigung",
      "state": "Baden-Württemberg",
      "amtsgericht": "Amtsgericht Freiburg",
      "registernummer": "HRB 713104",
      "registerart": "HRB",
      "company_name": "DÖRING Metalltechnik UG (haftungsbeschränkt)",
      "company_seat": "Biberach",
      "details": "15.07.2025 (Bekanntmachungsdatum)\n\nBaden-Württemberg Amtsgericht Freiburg HRB 713104\nLöschungsankündigung\n\nDÖRING Metalltechnik UG (haftungsbeschränkt)\nGesellschaft mit beschränkter Haftung\nBiberach\n\nDas Gericht beabsichtigt, die Gesellschaft wegen Vermögenslosigkeit im Handelsregister von Amts wegen nach § 394 FamFG zu löschen. Die Frist zur Geltendmachung eines Widerspruchs gegen die beabsichtigte Löschung ist auf einen Monat ab Veröffentlichung bestimmt."
    },
    {
      "date": "2025-07-15",
      "id": "115892",
      "original_text": "Einreichung neuer Dokumente\nBrandenburg Amtsgericht Frankfurt/Oder HRB 15914\nBeRec GmbH – Werneuchen",
      "type": "Einreichung neuer Dokumente",
      "state": "Brandenburg",
      "amtsgericht": "Amtsgericht Frankfurt/Oder",
      "registernummer": "HRB 15914",
      "registerart": "HRB",
      "company_name": "BeRec GmbH",
      "company_seat": "Werneuchen",
      "details": "15.07.2025 (Bekanntmachungsdatum)\n\nBrandenburg Amtsgericht Frankfurt/Oder HRB 15914\nEinreichung neuer Dokumente\n\nBeRec GmbH\nGesellschaft mit beschränkter Haftung\nWerneuchen\n\nAls nicht eingetragen wird veröffentlicht: Als nicht eingetragen wird veröffentlicht:\nDen Gläubigern der an der Verschmelzung beteiligten Rechtsträger ist, wenn sie binnen sechs Monaten nach dem Tag, an dem die Eintragung der Verschmelzung in das Register des Sitzes desjenigen Rechtsträgers, dessen Gläubiger sie sind, als bekannt gemacht gilt, ihren Anspruch nach Grund und Höhe schriftlich anmelden, Sicherheit zu leisten, soweit sie nicht Befriedigung verlangen können. Dieses Recht steht den Gläubigern jedoch nur zu, wenn sie glaubhaft machen, dass durch die Verschmelzung die Erfüllung ihrer Forderung gefährdet wird"
    },
    {
      "date": "2025-07-15",
      "id": "115893",
      "original_text": "Registerbekanntmachung nach dem Umwandlungsgesetz\nBerlin Amtsgericht Berlin (Charlottenburg) HRA 64465\nKASEMI Drive 030 GmbH & Co. KG – Berlin",
      "type": "Registerbekanntmachung nach dem Umwandlungsgesetz",
      "state": "Berlin",
      "amtsgericht": "Amtsgericht Berlin (Charlottenburg)",
      "registernummer": "HRA 64465",
      "registerart": "HRA",
      "company_name": "KASEMI Drive 030 GmbH & Co. KG",
      "company_seat": "Berlin",
      "details": "15.07.2025 (Bekanntmachungsdatum)\n\nBerlin Amtsgericht Berlin (Charlottenburg) HRA 64465\nRegisterbekanntmachung nach dem Umwandlungsgesetz 14.07.2025 (Eintragungsdatum)\n\nKASEMI Drive 030 GmbH & Co. KG\nKommanditgesellschaft\nBerlin\n\nZu Eintragungsnummer 1 vom 14.07.2025 wird als nicht eingetragen veröffentlicht: Den Gläubigern ist, wenn sie binnen sechs Monaten nach dem Tag, an dem die Eintragung der Umwandlung als bekannt gemacht gilt, ihren Anspruch nach Grund und Höhe schriftlich anmelden, Sicherheit zu leisten, soweit sie nicht Befriedigung verlangen können. Dieses Recht steht den Gläubigern jedoch nur zu, wenn sie glaubhaft machen, dass durch die Umwandlung die Erfüllung ihrer Forderung gefährdet wird. Das Recht, Sicherheitsleistung zu verlangen, steht Gläubigern nicht zu, die im Falle der Insolvenz ein Recht auf vorzugsweise Befriedigung aus einer Deckungsmasse haben, die nach gesetzlicher Vorschrift zu ihrem Schutz errichtet und staatlich überwacht ist."
    },
    {
      "date": "2025-07-15",
      "id": "115894",
      "original_text": "Registerbekanntmachung nach dem Umwandlungsgesetz\nSchleswig-Holstein Amtsgericht Kiel HRB 23464\nFuchs Bau Flietig GmbH – Flintbek",
      "type": "Registerbekanntmachung nach dem Umwandlungsgesetz",
      "state": "Schleswig-Holstein",
      "amtsgericht": "Amtsgericht Kiel",
      "registernummer": "HRB 23464",
      "registerart": "HRB",
      "company_name": "Fuchs Bau Flietig GmbH",
      "company_seat": "Flintbek",
      "details": "15.07.2025 (Bekanntmachungsdatum)\n\nSchleswig-Holstein Amtsgericht Kiel HRB 23464\nRegisterbekanntmachung nach dem Umwandlungsgesetz 14.07.2025 (Eintragungsdatum)\n\nFuchs Bau Flietig GmbH\nGesellschaft mit beschränkter Haftung\nFlintbek\n\nZu Eintragungsnummer 3 vom 14.07.2025 wird als nicht eingetragen veröffentlicht: Den Gläubigern der an der Verschmelzung beteiligten Rechtsträger ist, wenn sie binnen sechs Monaten nach dem Tag, an dem die Eintragung der Verschmelzung in das Register des Sitzes desjenigen Rechtsträgers, dessen Gläubiger sie sind, nach § 19 Abs. 3 UmwG bekannt gemacht worden ist, ihren Anspruch nach Grund und Höhe schriftlich anmelden, Sicherheit zu leisten, soweit sie nicht Befriedigung verlangen können. Dieses Recht steht den Gläubigern jedoch nur zu, wenn sie glaubhaft machen, dass durch die Verschmelzung die Erfüllung ihrer Forderung gefährdet wird."
    },
    {
      "date": "2025-07-15",
      "id": "115895",
      "original_text": "Einreichung neuer Dokumente\nSchleswig-Holstein Amtsgericht Lübeck HRB 18871\nMedia Sachsenwald GmbH – Reinbek",
      "type": "Einreichung neuer Dokumente",
      "state": "Schleswig-Holstein",
      "amtsgericht": "Amtsgericht Lübeck",
      "registernummer": "HRB 18871",
      "registerart": "HRB",
      "company_name": "Media Sachsenwald GmbH",
      "company_seat": "Reinbek",
      "details": "15.07.2025 (Bekanntmachungsdatum)\n\nSchleswig-Holstein Amtsgericht Lübeck HRB 18871\nEinreichung neuer Dokumente\n\nMedia Sachsenwald GmbH\nGesellschaft mit beschränkter Haftung\nReinbek\n\nAls nicht eingetragen wird veröffentlicht:\nEs wurde eine neue Liste der Aufsichtsratsmitglieder bei dem Handelsregister eingereicht."
    },
    {
      "date": "2025-07-15",
      "id": "115896",
      "original_text": "Registerbekanntmachung nach dem Umwandlungsgesetz\nBerlin Amtsgericht Berlin (Charlottenburg) HRB 244228\nKASEMI Drive 030 GmbH – Berlin",
      "type": "Registerbekanntmachung nach dem Umwandlungsgesetz",
      "state": "Berlin",
      "amtsgericht": "Amtsgericht Berlin (Charlottenburg)",
      "registernummer": "HRB 244228",
      "registerart": "HRB",
      "company_name": "KASEMI Drive 030 GmbH",
      "company_seat": "Berlin",
      "details": "15.07.2025 (Bekanntmachungsdatum)\n\nBerlin Amtsgericht Berlin (Charlottenburg) HRB 244228\nRegisterbekanntmachung nach dem Umwandlungsgesetz 14.07.2025 (Eintragungsdatum)\n\nKASEMI Drive 030 GmbH\nGesellschaft mit beschränkter Haftung\nBerlin\n\nZu Eintragungsnummer 4 vom 14.07.2025 wird als nicht eingetragen veröffentlicht: Den Gläubigern ist, wenn sie binnen sechs Monaten nach dem Tag, an dem die Eintragung der Umwandlung als bekannt gemacht gilt, ihren Anspruch nach Grund und Höhe schriftlich anmelden, Sicherheit zu leisten, soweit sie nicht Befriedigung verlangen können. Dieses Recht steht den Gläubigern jedoch nur zu, wenn sie glaubhaft machen, dass durch die Umwandlung die Erfüllung ihrer Forderung gefährdet wird. Das Recht, Sicherheitsleistung zu verlangen, steht Gläubigern nicht zu, die im Falle der Insolvenz ein Recht auf vorzugsweise Befriedigung aus einer Deckungsmasse haben, die nach gesetzlicher Vorschrift zu ihrem Schutz errichtet und staatlich überwacht ist."
    },
    {
      "date": "2025-07-15",
      "id": "115897",
      "original_text": "Registerbekanntmachung nach dem Umwandlungsgesetz\nBaden-Württemberg Amtsgericht Freiburg HRA 708935\nMANG Versicherungs- und Finanzvermittlung GmbH & Co. KG – Villingen-Schwenningen",
      "type": "Registerbekanntmachung nach dem Umwandlungsgesetz",
      "state": "Baden-Württemberg",
      "amtsgericht": "Amtsgericht Freiburg",
      "registernummer": "HRA 708935",
      "registerart": "HRA",
      "company_name": "MANG Versicherungs- und Finanzvermittlung GmbH & Co. KG",
      "company_seat": "Villingen-Schwenningen",
      "details": "15.07.2025 (Bekanntmachungsdatum)\n\nBaden-Württemberg Amtsgericht Freiburg HRA 708935\nRegisterbekanntmachung nach dem Umwandlungsgesetz 15.07.2025 (Eintragungsdatum)\n\nMANG Versicherungs- und Finanzvermittlung GmbH & Co. KG\nKommanditgesellschaft\nVillingen-Schwenningen\n\nAls nicht eingetragen wird bekanntgemacht:\nDen Gläubigern der an der Ausgliederung beteiligten Rechtsträger ist, wenn sie binnen sechs Monaten nach dem Tag, an dem die Eintragung der Ausgliederung in das Register des Sitzes desjenigen Rechtsträgers, dessen Gläubiger sie sind, nach § 19 Abs. 3 UmwG als bekanntgemacht gilt, ihren Anspruch nach Grund und Höhe schriftlich anmelden, Sicherheit zu leisten, soweit sie nicht Befriedigung verlangen können. Dieses Recht steht den Gläubigern jedoch nur zu, wenn sie glaubhaft machen, dass durch die Ausgliederung die Erfüllung ihrer Forderung gefährdet wird."
    },
    {
      "date": "2025-07-15",
      "id": "115898",
      "original_text": "Löschungsankündigung\nBerlin Amtsgericht Berlin (Charlottenburg) HRB 243881\nFoton Bauprojekte GmbH – Berlin",
      "type": "Löschungsankündigung",
      "state": "Berlin",
      "amtsgericht": "Amtsgericht Berlin (Charlottenburg)",
      "registernummer": "HRB 243881",
      "registerart": "HRB",
      "company_name": "Foton Bauprojekte GmbH",
      "company_seat": "Berlin",
      "details": "15.07.2025 (Bekanntmachungsdatum)\n\nBerlin Amtsgericht Berlin (Charlottenburg) HRB 243881\nLöschungsankündigung\n\nFoton Bauprojekte GmbH\nGesellschaft mit beschränkter Haftung\nBerlin\n\nBei der nachstehenden Gesellschaft wird das Amtslöschungsverfahren gemäß § 394 FamFG eingeleitet. Widerspruchsfrist 6 Wochen"
    },
    {
      "date": "2025-07-15",
      "id": "115899",
      "original_text": "Löschungsankündigung\nBerlin Amtsgericht Berlin (Charlottenburg) HRB 237347\nJ.C.T.G Ventures UG (haftungsbeschränkt) – Berlin",
      "type": "Löschungsankündigung",
      "state": "Berlin",
      "amtsgericht": "Amtsgericht Berlin (Charlottenburg)",
      "registernummer": "HRB 237347",
      "registerart": "HRB",
      "company_name": "J.C.T.G Ventures UG (haftungsbeschränkt)",
      "company_seat": "Berlin",
      "details": "15.07.2025 (Bekanntmachungsdatum)\n\nBerlin Amtsgericht Berlin (Charlottenburg) HRB 237347\nLöschungsankündigung\n\nJ.C.T.G Ventures UG (haftungsbeschränkt)\nGesellschaft mit beschränkter Haftung\nBerlin\n\nBei der nachstehenden Gesellschaft wird das Amtslöschungsverfahren gemäß § 394 FamFG eingeleitet. Widerspruchsfrist 6 Wochen"
    },
    {
      "date": "2025-07-15",
      "id": "115900",
      "original_text": "Registerbekanntmachung nach dem Umwandlungsgesetz\nBaden-Württemberg Amtsgericht Stuttgart HRB 783386\nBuck Industries GmbH – Herrenberg",
      "type": "Registerbekanntmachung nach dem Umwandlungsgesetz",
      "state": "Baden-Württemberg",
      "amtsgericht": "Amtsgericht Stuttgart",
      "registernummer": "HRB 783386",
      "registerart": "HRB",
      "company_name": "Buck Industries GmbH",
      "company_seat": "Herrenberg",
      "details": "15.07.2025 (Bekanntmachungsdatum)\n\nBaden-Württemberg Amtsgericht Stuttgart HRB 783386\nRegisterbekanntmachung nach dem Umwandlungsgesetz 15.07.2025 (Eintragungsdatum)\n\nBuck Industries GmbH\nGesellschaft mit beschränkter Haftung\nHerrenberg\n\nAls nicht eingetragen wird bekanntgemacht:\nDen Gläubigern der an der Verschmelzung beteiligten Rechtsträger ist, wenn sie binnen sechs Monaten nach dem Tag, an dem die Eintragung der Verschmelzung in das Register des Sitzes desjenigen Rechtsträgers, dessen Gläubiger sie sind, nach § 19 Abs. 3 UmwG als bekanntgemacht gilt, ihren Anspruch nach Grund und Höhe schriftlich anmelden, Sicherheit zu leisten, soweit sie nicht Befriedigung verlangen können. Dieses Recht steht den Gläubigern jedoch nur zu, wenn sie glaubhaft machen, dass durch die Verschmelzung die Erfüllung ihrer Forderung gefährdet wird."
    },
    {
      "date": "2025-07-15",
      "id": "115901",
      "original_text": "Registerbekanntmachung nach dem Umwandlungsgesetz\nBaden-Württemberg Amtsgericht Stuttgart HRB 742259\nBuck Industries GmbH – Herrenberg",
      "type": "Registerbekanntmachung nach dem Umwandlungsgesetz",
      "state": "Baden-Württemberg",
      "amtsgericht": "Amtsgericht Stuttgart",
      "registernummer": "HRB 742259",
      "registerart": "HRB",
      "company_name": "Buck Industries GmbH",
      "company_seat": "Herrenberg",
      "details": "15.07.2025 (Bekanntmachungsdatum)\n\nBaden-Württemberg Amtsgericht Stuttgart HRB 742259\nRegisterbekanntmachung nach dem Umwandlungsgesetz 15.07.2025 (Eintragungsdatum)\n\nBuck Industries GmbH\nGesellschaft mit beschränkter Haftung\nHerrenberg\n\nAls nicht eingetragen wird bekanntgemacht:\nDen Gläubigern der an der Verschmelzung beteiligten Rechtsträger ist, wenn sie binnen sechs Monaten nach dem Tag, an dem die Eintragung der Verschmelzung in das Register des Sitzes desjenigen Rechtsträgers, dessen Gläubiger sie sind, nach § 19 Abs. 3 UmwG als bekanntgemacht gilt, ihren Anspruch nach Grund und Höhe schriftlich anmelden, Sicherheit zu leisten, soweit sie nicht Befriedigung verlangen können. Dieses Recht steht den Gläubigern jedoch nur zu, wenn sie glaubhaft machen, dass durch die Verschmelzung die Erfüllung ihrer Forderung gefährdet wird."
    },
    {
      "date": "2025-07-15",
      "id": "115902",
      "original_text": "Registerbekanntmachung nach dem Umwandlungsgesetz\nHamburg Amtsgericht Hamburg HRB 99204\nalstria office AG – Hamburg",
      "type": "Registerbekanntmachung nach dem Umwandlungsgesetz",
      "state": "Hamburg",
      "amtsgericht": "Amtsgericht Hamburg",
      "registernummer": "HRB 99204",
      "registerart": "HRB",
      "company_name": "alstria office AG",
      "company_seat": "Hamburg",
      "details": "15.07.2025 (Bekanntmachungsdatum)\n\nHamburg Amtsgericht Hamburg HRB 99204\nRegisterbekanntmachung nach dem Umwandlungsgesetz 15.07.2025 (Eintragungsdatum)\n\nalstria office AG\nAktiengesellschaft\nHamburg\n\nAls nicht eingetragen wird bekannt gemacht:\nEs wird darauf hingewiesen, dass ein Formwechselplan oder sein Entwurf über einen grenzüberschreitenden Formwechsel in die alstria S.à r.l. mit Sitz in Luxemburg/Luxemburg (société à responsabilité limitée - Gesellschaft mit beschränkter Haftung nach luxemburgischem Recht) beim Handelsregister eingereicht worden ist.\nDie Anteilsinhaber, die Gläubiger sowie die zuständigen Betriebsräte der an dem grenzüberschreitenden Formwechsel beteiligten Gesellschaft oder, soweit es keinen Betriebsrat gibt, die Arbeitnehmer der an dem grenzüberschreitenden Formwechsel beteiligten Gesellschaft, können der Gesellschaft spätestens fünf Arbeitstage vor dem Tag der Gesellschafterversammlung, die für den 26.08.2025 geplant ist, Bemerkungen zum Formwechselplan übermitteln."
    },
    {
      "date": "2025-07-15",
      "id": "115903",
      "original_text": "Löschungsankündigung\nBaden-Württemberg Amtsgericht Freiburg HRB 713393\nM&C GmbH – Offenburg",
      "type": "Löschungsankündigung",
      "state": "Baden-Württemberg",
      "amtsgericht": "Amtsgericht Freiburg",
      "registernummer": "HRB 713393",
      "registerart": "HRB",
      "company_name": "M&C GmbH",
      "company_seat": "Offenburg",
      "details": "15.07.2025 (Bekanntmachungsdatum)\n\nBaden-Württemberg Amtsgericht Freiburg HRB 713393\nLöschungsankündigung 15.07.2025 (Eintragungsdatum)\n\nM&C GmbH\nGesellschaft mit beschränkter Haftung\nOffenburg\n\nAls nicht eingetragen wird bekanntgemacht:\nDas Gericht beabsichtigt, die Gesellschaft wegen Vermögenslosigkeit im Handelsregister von Amts wegen nach § 394 FamFG zu löschen. Die Frist zur Geltendmachung eines Widerspruchs gegen die beabsichtigte Löschung ist auf einen Monat ab Veröffentlichung bestimmt."
    },
    {
      "date": "2025-07-15",
      "id": "115904",
      "original_text": "Löschungsankündigung\nHamburg Amtsgericht Hamburg HRA 121794\nOXXAN Holding GmbH & Co. KG – Hamburg",
      "type": "Löschungsankündigung",
      "state": "Hamburg",
      "amtsgericht": "Amtsgericht Hamburg",
      "registernummer": "HRA 121794",
      "registerart": "HRA",
      "company_name": "OXXAN Holding GmbH & Co. KG",
      "company_seat": "Hamburg",
      "details": "15.07.2025 (Bekanntmachungsdatum)\n\nHamburg Amtsgericht Hamburg HRA 121794\nLöschungsankündigung\n\nOXXAN Holding GmbH & Co. KG\nKommanditgesellschaft\nHamburg\n\nDas Registergericht beabsichtigt, die im Handelsregister eingetragene Firma von Amts wegen nach § 31 Abs. 2 HBG zu löschen. Die Frist zur Erhebung eines Widerspruchs gegen die beabsichtigte Löschung wird auf 3 Monate festgesetzt."
    },
    {
      "date": "2025-07-15",
      "id": "115905",
      "original_text": "Löschungsankündigung\nBaden-Württemberg Amtsgericht Stuttgart HRB 470819\nBaumeister Großküchentechnik GmbH – Rottweil",
      "type": "Löschungsankündigung",
      "state": "Baden-Württemberg",
      "amtsgericht": "Amtsgericht Stuttgart",
      "registernummer": "HRB 470819",
      "registerart": "HRB",
      "company_name": "Baumeister Großküchentechnik GmbH",
      "company_seat": "Rottweil",
      "details": "15.07.2025 (Bekanntmachungsdatum)\n\nBaden-Württemberg Amtsgericht Stuttgart HRB 470819\nLöschungsankündigung\n\nBaumeister Großküchentechnik GmbH\nGesellschaft mit beschränkter Haftung\nRottweil\n\nAls nicht eingetragen wird bekanntgemacht:\nDas Gericht beabsichtigt, die Gesellschaft wegen Vermögenslosigkeit im Handelsregister von Amts wegen nach § 394 FamFG zu löschen. Die Frist zur Geltendmachung eines Widerspruchs gegen die beabsichtigte Löschung ist auf zwei Monate ab Veröffentlichung bestimmt."
    },
    {
      "date": "2025-07-15",
      "id": "115906",
      "original_text": "Einreichung neuer Dokumente\nBaden-Württemberg Amtsgericht Stuttgart HRB 460822\nEnergieversorgung Trossingen GmbH – Trossingen",
      "type": "Einreichung neuer Dokumente",
      "state": "Baden-Württemberg",
      "amtsgericht": "Amtsgericht Stuttgart",
      "registernummer": "HRB 460822",
      "registerart": "HRB",
      "company_name": "Energieversorgung Trossingen GmbH",
      "company_seat": "Trossingen",
      "details": "15.07.2025 (Bekanntmachungsdatum)\n\nBaden-Württemberg Amtsgericht Stuttgart HRB 460822\nEinreichung neuer Dokumente\n\nEnergieversorgung Trossingen GmbH\nGesellschaft mit beschränkter Haftung\nTrossingen\n\nDie Gesellschaft hat am 15.07.2025 die Liste über die Zusammensetzung des Aufsichtsrats zum Handelsregister eingereicht."
    },
    {
      "date": "2025-07-15",
      "id": "115907",
      "original_text": "Registerbekanntmachung nach dem Umwandlungsgesetz\nHamburg Amtsgericht Hamburg HRA 131921\nThe Bow e.K. – Hamburg",
      "type": "Registerbekanntmachung nach dem Umwandlungsgesetz",
      "state": "Hamburg",
      "amtsgericht": "Amtsgericht Hamburg",
      "registernummer": "HRA 131921",
      "registerart": "HRA",
      "company_name": "The Bow e.K.",
      "company_seat": "Hamburg",
      "details": "15.07.2025 (Bekanntmachungsdatum)\n\nHamburg Amtsgericht Hamburg HRA 131921\nRegisterbekanntmachung nach dem Umwandlungsgesetz 15.07.2025 (Eintragungsdatum)\n\nThe Bow e.K.\nEinzelkaufmann\nHamburg\n\nAls nicht eingetragen wird bekannt gemacht:\nDen Gläubigern der an der Ausgliederung beteiligten Gesellschaften ist, wenn sie binnen sechs Monaten nach dem Tag, an dem die Eintragung der Ausgliederung in das Register des Sitzes desjenigen Rechtsträgers, dessen Gläubiger sie sind, nach § 19 Absatz 3 UmwG als bekannt gemacht gilt, ihren Anspruch nach Grund und Höhe schriftlich anmelden, Sicherheit zu leisten, soweit sie nicht Befriedigung verlangen können. Dieses Recht steht den Gläubigern jedoch nur zu, wenn sie glaubhaft machen, dass durch die Ausgliederung die Erfüllung ihrer Forderung gefährdet wird."
    },
    {
      "date": "2025-07-15",
      "id": "115908",
      "original_text": "Registerbekanntmachung nach dem Umwandlungsgesetz\nMecklenburg-Vorpommern Amtsgericht Schwerin HRB 1767\nHW Leasing GmbH – Wismar",
      "type": "Registerbekanntmachung nach dem Umwandlungsgesetz",
      "state": "Mecklenburg-Vorpommern",
      "amtsgericht": "Amtsgericht Schwerin",
      "registernummer": "HRB 1767",
      "registerart": "HRB",
      "company_name": "HW Leasing GmbH",
      "company_seat": "Wismar",
      "details": "15.07.2025 (Bekanntmachungsdatum)\n\nMecklenburg-Vorpommern Amtsgericht Schwerin HRB 1767\nRegisterbekanntmachung nach dem Umwandlungsgesetz 15.07.2025 (Eintragungsdatum)\n\nHW Leasing GmbH\nGesellschaft mit beschränkter Haftung\nWismar\n\nDen Gläubigern der an der Verschmelzung beteiligten Gesellschaften ist, wenn sie binnen sechs Monaten nach dem Tag, an dem die Eintragung der Verschmelzungen in das Register des Sitzes desjenigen Rechtsträgers, dessen Gläubiger sie sind, nach § 19 Absatz 3 UmwG als bekanntgemacht gilt, ihren Anspruch nach Grund und Höhe schriftlich anmelden, Sicherheit zu leisten, soweit sie nicht Befriedigung verlangen können. Dieses Recht steht den Gläubigern jedoch nur zu, wenn sie glaubhaft machen, dass durch die Verschmelzung die Erfüllung ihrer Forderung gefährdet wird."
    },
    {
      "date": "2025-07-15",
      "id": "115909",
      "original_text": "Registerbekanntmachung nach dem Umwandlungsgesetz\nMecklenburg-Vorpommern Amtsgericht Schwerin HRB 12359\nLfS Leasinggesellschaft für Sozialwirtschaft mbH – Wismar",
      "type": "Registerbekanntmachung nach dem Umwandlungsgesetz",
      "state": "Mecklenburg-Vorpommern",
      "amtsgericht": "Amtsgericht Schwerin",
      "registernummer": "HRB 12359",
      "registerart": "HRB",
      "company_name": "LfS Leasinggesellschaft für Sozialwirtschaft mbH",
      "company_seat": "Wismar",
      "details": "15.07.2025 (Bekanntmachungsdatum)\n\nMecklenburg-Vorpommern Amtsgericht Schwerin HRB 12359\nRegisterbekanntmachung nach dem Umwandlungsgesetz 15.07.2025 (Eintragungsdatum)\n\nLfS Leasinggesellschaft für Sozialwirtschaft mbH\nGesellschaft mit beschränkter Haftung\nWismar\n\nDen Gläubigern der an der Verschmelzung beteiligten Gesellschaften ist, wenn sie binnen sechs Monaten nach dem Tag, an dem die Eintragung der Verschmelzungen in das Register des Sitzes desjenigen Rechtsträgers, dessen Gläubiger sie sind, nach § 19 Absatz 3 UmwG als bekanntgemacht gilt, ihren Anspruch nach Grund und Höhe schriftlich anmelden, Sicherheit zu leisten, soweit sie nicht Befriedigung verlangen können. Dieses Recht steht den Gläubigern jedoch nur zu, wenn sie glaubhaft machen, dass durch die Verschmelzung die Erfüllung ihrer Forderung gefährdet wird."
    },
    {
      "date": "2025-07-15",
      "id": "115910",
      "original_text": "Registerbekanntmachung nach dem Umwandlungsgesetz\nBaden-Württemberg Amtsgericht Stuttgart HRB 770446\nHWS Reuter & Reuter Verwaltungs GmbH Steuerberatungsgesellschaft – Reutlingen",
      "type": "Registerbekanntmachung nach dem Umwandlungsgesetz",
      "state": "Baden-Württemberg",
      "amtsgericht": "Amtsgericht Stuttgart",
      "registernummer": "HRB 770446",
      "registerart": "HRB",
      "company_name": "HWS Reuter & Reuter Verwaltungs GmbH Steuerberatungsgesellschaft",
      "company_seat": "Reutlingen",
      "details": "15.07.2025 (Bekanntmachungsdatum)\n\nBaden-Württemberg Amtsgericht Stuttgart HRB 770446\nRegisterbekanntmachung nach dem Umwandlungsgesetz 15.07.2025 (Eintragungsdatum)\n\nHWS Reuter & Reuter Verwaltungs GmbH Steuerberatungsgesellschaft\nGesellschaft mit beschränkter Haftung\nReutlingen\n\nAls nicht eingetragen wird bekanntgemacht: Den Gläubigern der an der Verschmelzung beteiligten Rechtsträger ist, wenn sie binnen sechs Monaten nach dem Tag, an dem die Eintragung der Verschmelzung in das Register des Sitzes desjenigen Rechtsträgers, dessen Gläubiger sie sind, nach § 19 Abs. 3 UmwG als bekanntgemacht gilt, ihren Anspruch nach Grund und Höhe schriftlich anmelden, Sicherheit zu leisten, soweit sie nicht Befriedigung verlangen können. Dieses Recht steht den Gläubigern jedoch nur zu, wenn sie glaubhaft machen, dass durch die Verschmelzung die Erfüllung ihrer Forderung gefährdet wird."
    },
    {
      "date": "2025-07-15",
      "id": "115911",
      "original_text": "Sonstige Registerbekanntmachung\nBaden-Württemberg Amtsgericht Ulm HRB 670647\nStadtwerke Crailsheim GmbH – Crailsheim",
      "type": "Sonstige Registerbekanntmachung",
      "state": "Baden-Württemberg",
      "amtsgericht": "Amtsgericht Ulm",
      "registernummer": "HRB 670647",
      "registerart": "HRB",
      "company_name": "Stadtwerke Crailsheim GmbH",
      "company_seat": "Crailsheim",
      "details": "15.07.2025 (Bekanntmachungsdatum)\n\nBaden-Württemberg Amtsgericht Ulm HRB 670647\nSonstige Registerbekanntmachung\n\nStadtwerke Crailsheim GmbH\nGesellschaft mit beschränkter Haftung\nCrailsheim\n\nDie Gesellschaft hat am 11.07.2025 die Liste über die Zusammensetzung des Aufsichtsrats zum Handelsregister eingereicht."
    },
    {
      "date": "2025-07-15",
      "id": "115912",
      "original_text": "Registerbekanntmachung nach dem Umwandlungsgesetz\nHamburg Amtsgericht Hamburg HRB 84027\nREAL Solution Factoring GmbH – Hamburg",
      "type": "Registerbekanntmachung nach dem Umwandlungsgesetz",
      "state": "Hamburg",
      "amtsgericht": "Amtsgericht Hamburg",
      "registernummer": "HRB 84027",
      "registerart": "HRB",
      "company_name": "REAL Solution Factoring GmbH",
      "company_seat": "Hamburg",
      "details": "15.07.2025 (Bekanntmachungsdatum)\n\nHamburg Amtsgericht Hamburg HRB 84027\nRegisterbekanntmachung nach dem Umwandlungsgesetz 15.07.2025 (Eintragungsdatum)\n\nREAL Solution Factoring GmbH\nGesellschaft mit beschränkter Haftung\nHamburg\n\nAls nicht eingetragen wird bekannt gemacht:\nDen Gläubigern der an der Verschmelzung beteiligten Gesellschaften ist, wenn sie binnen sechs Monaten nach dem Tag, an dem die Eintragung der Verschmelzung in das Register des Sitzes desjenigen Rechtsträgers, dessen Gläubiger sie sind, nach § 19 Absatz 3 UmwG als bekannt gemacht gilt, ihren Anspruch nach Grund und Höhe schriftlich anmelden, Sicherheit zu leisten, soweit sie nicht Befriedigung verlangen können. Dieses Recht steht den Gläubigern jedoch nur zu, wenn sie glaubhaft machen, dass durch die Verschmelzung die Erfüllung ihrer Forderung gefährdet wird."
    },
    {
      "date": "2025-07-15",
      "id": "115913",
      "original_text": "Registerbekanntmachung nach dem Umwandlungsgesetz\nHamburg Amtsgericht Hamburg HRB 97144\nMAKELARUS GmbH – Hamburg",
      "type": "Registerbekanntmachung nach dem Umwandlungsgesetz",
      "state": "Hamburg",
      "amtsgericht": "Amtsgericht Hamburg",
      "registernummer": "HRB 97144",
      "registerart": "HRB",
      "company_name": "MAKELARUS GmbH",
      "company_seat": "Hamburg",
      "details": "15.07.2025 (Bekanntmachungsdatum)\n\nHamburg Amtsgericht Hamburg HRB 97144\nRegisterbekanntmachung nach dem Umwandlungsgesetz 15.07.2025 (Eintragungsdatum)\n\nMAKELARUS GmbH\nGesellschaft mit beschränkter Haftung\nHamburg\n\nAls nicht eingetragen wird bekannt gemacht:\nDen Gläubigern der an der Verschmelzung beteiligten Gesellschaften ist, wenn sie binnen sechs Monaten nach dem Tag, an dem die Eintragung der Verschmelzung in das Register des Sitzes desjenigen Rechtsträgers, dessen Gläubiger sie sind, nach § 19 Absatz 3 UmwG als bekannt gemacht gilt, ihren Anspruch nach Grund und Höhe schriftlich anmelden, Sicherheit zu leisten, soweit sie nicht Befriedigung verlangen können. Dieses Recht steht den Gläubigern jedoch nur zu, wenn sie glaubhaft machen, dass durch die Verschmelzung die Erfüllung ihrer Forderung gefährdet wird."
    },
    {
      "date": "2025-07-15",
      "id": "115914",
      "original_text": "Registerbekanntmachung nach dem Umwandlungsgesetz\nSaarland Amtsgericht Saarbrücken HRB 10779\nqards GmbH – Saarbrücken",
      "type": "Registerbekanntmachung nach dem Umwandlungsgesetz",
      "state": "Saarland",
      "amtsgericht": "Amtsgericht Saarbrücken",
      "registernummer": "HRB 10779",
      "registerart": "HRB",
      "company_name": "qards GmbH",
      "company_seat": "Saarbrücken",
      "details": "15.07.2025 (Bekanntmachungsdatum)\n\nSaarland Amtsgericht Saarbrücken HRB 10779\nRegisterbekanntmachung nach dem Umwandlungsgesetz 15.07.2025 (Eintragungsdatum)\n\nqards GmbH\nGesellschaft mit beschränkter Haftung\nSaarbrücken\n\nAls nicht eingetragen wird bekannt gemacht: Den Gläubigern der an der Verschmelzung beteiligten Gesellschaften ist, wenn sie binnen sechs Monaten nach dem Tag, an dem die Eintragung der Verschmelzung in das Register des Sitzes desjenigen Rechtsträgers, dessen Gläubiger sie sind, nach § 19 Absatz 3 UmwG bekannt gemacht worden ist, ihren Anspruch nach Grund und Höhe schriftlich anmelden, Sicherheit zu leisten, soweit sie nicht Befriedigung verlangen können. Dieses Recht steht den Gläubigern jedoch nur zu, wenn sie glaubhaft machen, dass durch die Verschmelzung die Erfüllung ihrer Forderung gefährdet wird."
    },
    {
      "date": "2025-07-15",
      "id": "115915",
      "original_text": "Löschungsankündigung\nBrandenburg Amtsgericht Neuruppin HRB 10829\nGrit 40. Vermögensverwaltungs GmbH – Liebenwalde",
      "type": "Löschungsankündigung",
      "state": "Brandenburg",
      "amtsgericht": "Amtsgericht Neuruppin",
      "registernummer": "HRB 10829",
      "registerart": "HRB",
      "company_name": "Grit 40. Vermögensverwaltungs GmbH",
      "company_seat": "Liebenwalde",
      "details": "15.07.2025 (Bekanntmachungsdatum)\n\nBrandenburg Amtsgericht Neuruppin HRB 10829\nLöschungsankündigung\n\nGrit 40. Vermögensverwaltungs GmbH\nGesellschaft mit beschränkter Haftung\nLiebenwalde\n\nBei der nachstehenden Gesellschaft wird das Amtslöschungsverfahren gemäß § 394 FamFG eingeleitet.\nWiderspruchsfrist: 1 Monat"
    },
    {
      "date": "2025-07-15",
      "id": "115916",
      "original_text": "Löschungsankündigung\nBrandenburg Amtsgericht Frankfurt/Oder HRB 17634\nWilly's Gasthaus Neuendorf UG (haftungsbeschränkt) – Beeskow",
      "type": "Löschungsankündigung",
      "state": "Brandenburg",
      "amtsgericht": "Amtsgericht Frankfurt/Oder",
      "registernummer": "HRB 17634",
      "registerart": "HRB",
      "company_name": "Willy's Gasthaus Neuendorf UG (haftungsbeschränkt)",
      "company_seat": "Beeskow",
      "details": "15.07.2025 (Bekanntmachungsdatum)\n\nBrandenburg Amtsgericht Frankfurt/Oder HRB 17634\nLöschungsankündigung\n\nWilly's Gasthaus Neuendorf UG (haftungsbeschränkt)\nGesellschaft mit beschränkter Haftung\nBeeskow\n\nBei der nachstehenden Gesellschaft wird das Amtslöschungsverfahren gemäß § 394 FamFG eingeleitet."
    },
    {
      "date": "2025-07-15",
      "id": "115917",
      "original_text": "Sonstige Registerbekanntmachung\nHamburg Amtsgericht Hamburg HRB 171306\nAirbus Aerostructures GmbH – Hamburg",
      "type": "Sonstige Registerbekanntmachung",
      "state": "Hamburg",
      "amtsgericht": "Amtsgericht Hamburg",
      "registernummer": "HRB 171306",
      "registerart": "HRB",
      "company_name": "Airbus Aerostructures GmbH",
      "company_seat": "Hamburg",
      "details": "15.07.2025 (Bekanntmachungsdatum)\n\nHamburg Amtsgericht Hamburg HRB 171306\nSonstige Registerbekanntmachung 15.07.2025 (Eintragungsdatum)\n\nAirbus Aerostructures GmbH\nGesellschaft mit beschränkter Haftung\nHamburg\n\nAls nicht eingetragen wird bekannt gemacht: Liste des Aufsichtsrats wurde eingereicht."
    },
    {
      "date": "2025-07-15",
      "id": "115918",
      "original_text": "Einreichung neuer Dokumente\nBerlin Amtsgericht Berlin (Charlottenburg) HRB 39889\nOKV-Ostdeutsche Kommunalversicherung auf Gegenseitigkeit – Berlin",
      "type": "Einreichung neuer Dokumente",
      "state": "Berlin",
      "amtsgericht": "Amtsgericht Berlin (Charlottenburg)",
      "registernummer": "HRB 39889",
      "registerart": "HRB",
      "company_name": "OKV-Ostdeutsche Kommunalversicherung auf Gegenseitigkeit",
      "company_seat": "Berlin",
      "details": "15.07.2025 (Bekanntmachungsdatum)\n\nBerlin Amtsgericht Berlin (Charlottenburg) HRB 39889\nEinreichung neuer Dokumente\n\nOKV-Ostdeutsche Kommunalversicherung auf Gegenseitigkeit\nVersicherungsverein auf Gegenseitigkeit\nBerlin\n\nAls nicht eingetragen wird veröffentlicht:\nEs wurde eine neue Liste der Aufsichtsratsmitglieder eingereicht (§ 106 AktG)."
    },
    {
      "date": "2025-07-15",
      "id": "115919",
      "original_text": "Einreichung neuer Dokumente\nBerlin Amtsgericht Berlin (Charlottenburg) HRB 283\nBayer Pharma Aktiengesellschaft – Berlin",
      "type": "Einreichung neuer Dokumente",
      "state": "Berlin",
      "amtsgericht": "Amtsgericht Berlin (Charlottenburg)",
      "registernummer": "HRB 283",
      "registerart": "HRB",
      "company_name": "Bayer Pharma Aktiengesellschaft",
      "company_seat": "Berlin",
      "details": "15.07.2025 (Bekanntmachungsdatum)\n\nBerlin Amtsgericht Berlin (Charlottenburg) HRB 283\nEinreichung neuer Dokumente\n\nBayer Pharma Aktiengesellschaft\nAktiengesellschaft\nBerlin\n\nAls nicht eingetragen wird veröffentlicht: Es wurde eine neue Liste der Aufsichtsratsmitglieder eingereicht (§ 106 AktG)."
    },
    {
      "date": "2025-07-15",
      "id": "115920",
      "original_text": "Registerbekanntmachung nach dem Umwandlungsgesetz\nBaden-Württemberg Amtsgericht Stuttgart HRB 732953\nErchinger Verwaltungs-GmbH – Tuttlingen",
      "type": "Registerbekanntmachung nach dem Umwandlungsgesetz",
      "state": "Baden-Württemberg",
      "amtsgericht": "Amtsgericht Stuttgart",
      "registernummer": "HRB 732953",
      "registerart": "HRB",
      "company_name": "Erchinger Verwaltungs-GmbH",
      "company_seat": "Tuttlingen",
      "details": "15.07.2025 (Bekanntmachungsdatum)\n\nBaden-Württemberg Amtsgericht Stuttgart HRB 732953\nRegisterbekanntmachung nach dem Umwandlungsgesetz 15.07.2025 (Eintragungsdatum)\n\nErchinger Verwaltungs-GmbH\nGesellschaft mit beschränkter Haftung\nTuttlingen\n\nAls nicht eingetragen wird bekanntgemacht:\nDen Gläubigern der an der Verschmelzung beteiligten Rechtsträger ist, wenn sie binnen sechs Monaten nach dem Tag, an dem die Eintragung der Verschmelzung in das Register des Sitzes desjenigen Rechtsträgers, dessen Gläubiger sie sind, nach § 19 Abs. 3 UmwG als bekanntgemacht gilt, ihren Anspruch nach Grund und Höhe schriftlich anmelden, Sicherheit zu leisten, soweit sie nicht Befriedigung verlangen können. Dieses Recht steht den Gläubigern jedoch nur zu, wenn sie glaubhaft machen, dass durch die Verschmelzung die Erfüllung ihrer Forderung gefährdet wird."
    },
    {
      "date": "2025-07-15",
      "id": "115921",
      "original_text": "Löschungsankündigung\nSachsen Amtsgericht Dresden HRB 31131\nTransKonzept GmbH – Großröhrsdorf",
      "type": "Löschungsankündigung",
      "state": "Sachsen",
      "amtsgericht": "Amtsgericht Dresden",
      "registernummer": "HRB 31131",
      "registerart": "HRB",
      "company_name": "TransKonzept GmbH",
      "company_seat": "Großröhrsdorf",
      "details": "15.07.2025 (Bekanntmachungsdatum)\n\nSachsen Amtsgericht Dresden HRB 31131\nLöschungsankündigung\n\nTransKonzept GmbH\nGesellschaft mit beschränkter Haftung\nGroßröhrsdorf\n\nDas Registergericht beabsichtigt, die im Handelsregister eingetragene Gesellschaft von Amts wegen nach § 394 FamFG zu löschen. Die Frist zu Erhebung eines Widerspruchs gegen die beabsichtigte Löschung wird auf einen Monat festgesetzt."
    },
    {
      "date": "2025-07-15",
      "id": "115922",
      "original_text": "Löschungsankündigung\nSachsen Amtsgericht Leipzig VR 6779\nReprocialised Projekt e.V. – Leipzig",
      "type": "Löschungsankündigung",
      "state": "Sachsen",
      "amtsgericht": "Amtsgericht Leipzig",
      "registernummer": "VR 6779",
      "registerart": "VR",
      "company_name": "Reprocialised Projekt e.V.",
      "company_seat": "Leipzig",
      "details": "15.07.2025 (Bekanntmachungsdatum)\n\nSachsen Amtsgericht Leipzig VR 6779\nLöschungsankündigung\n\nReprocialised Projekt e.V.\neingetragener Verein\nLeipzig\n\nDas Gericht beabsichtigt, gemäß § 4 Absatz 2 Ziffer 1 der Verordnung über das Vereinsregister das Registerblatt  des Vereins zu schließen, da nach Mitteilung des bisherigen Vorstandes sämtliche Mitglieder aus dem Verein ausgeschieden sind. Zur Geltendmachung eines Widerspruchs gegen die beabsichtigte Schließung wird eine Frist von einem Monat nach der Veröffentlichung bestimmt."
    },
    {
      "date": "2025-07-15",
      "id": "115923",
      "original_text": "Sonstige Registerbekanntmachung\nSachsen Amtsgericht Leipzig HRB 39518\nthalest group AG – Leipzig",
      "type": "Sonstige Registerbekanntmachung",
      "state": "Sachsen",
      "amtsgericht": "Amtsgericht Leipzig",
      "registernummer": "HRB 39518",
      "registerart": "HRB",
      "company_name": "thalest group AG",
      "company_seat": "Leipzig",
      "details": "15.07.2025 (Bekanntmachungsdatum)\n\nSachsen Amtsgericht Leipzig HRB 39518\nSonstige Registerbekanntmachung\n\nthalest group AG\nAktiengesellschaft\nLeipzig\n\nAm 08.07.2025 wurde beim Handelsregister des Amtsgerichts Leipzig die Liste der Mitglieder des Aufsichtsrats gemäß § 106 AktG eingereicht."
    },
    {
      "date": "2025-07-15",
      "id": "115924",
      "original_text": "Registerbekanntmachung nach dem Umwandlungsgesetz\nSachsen Amtsgericht Chemnitz HRB 31686\nSüGa-Versicherungsservice GmbH – Chemnitz",
      "type": "Registerbekanntmachung nach dem Umwandlungsgesetz",
      "state": "Sachsen",
      "amtsgericht": "Amtsgericht Chemnitz",
      "registernummer": "HRB 31686",
      "registerart": "HRB",
      "company_name": "SüGa-Versicherungsservice GmbH",
      "company_seat": "Chemnitz",
      "details": "15.07.2025 (Bekanntmachungsdatum)\n\nSachsen Amtsgericht Chemnitz HRB 31686\nRegisterbekanntmachung nach dem Umwandlungsgesetz 15.07.2025 (Eintragungsdatum)\n\nSüGa-Versicherungsservice GmbH\nGesellschaft mit beschränkter Haftung\nChemnitz\n\nDen Gläubigern der an der Verschmelzung beteiligten Rechtsträger ist, wenn sie binnen sechs Monaten nach dem Tag, an dem die Eintragung der Verschmelzung in das Register des Sitzes desjenigen Rechtsträgers, dessen Gläubiger sie sind, nach § 19 Abs. 3 UmwG als bekannt gemacht gilt, ihren Anspruch nach Grund und Höhe in Textform anmelden, Sicherheit zu leisten, soweit sie nicht Befriedigung verlangen können. Dieses Recht steht den Gläubigern jedoch nur zu, wenn sie glaubhaft machen, dass durch die Verschmelzung die Erfüllung der Forderung gefährdet wird."
    },
    {
      "date": "2025-07-15",
      "id": "115925",
      "original_text": "Löschungsankündigung\nSachsen Amtsgericht Dresden HRB 34437\nMeissner Haus und Grundvertrieb EOOD Zweigniederlassung Käbschütztal OT Sornitz – Käbschütztal",
      "type": "Löschungsankündigung",
      "state": "Sachsen",
      "amtsgericht": "Amtsgericht Dresden",
      "registernummer": "HRB 34437",
      "registerart": "HRB",
      "company_name": "Meissner Haus und Grundvertrieb EOOD Zweigniederlassung Käbschütztal OT Sornitz",
      "company_seat": "Käbschütztal",
      "details": "15.07.2025 (Bekanntmachungsdatum)\n\nSachsen Amtsgericht Dresden HRB 34437\nLöschungsankündigung\n\nMeissner Haus und Grundvertrieb EOOD Zweigniederlassung Käbschütztal OT Sornitz\nRechtsform ausländischen Rechts HRB\nKäbschütztal\n\nDas Registergericht beabsichtigt, die im Handelsregister eingetragene Gesellschaft von Amts wegen nach § 394 FamFG zu löschen. Die Frist zu Erhebung eines Widerspruchs gegen die beabsichtigte Löschung wird auf einen Monat festgesetzt."
    },
    {
      "date": "2025-07-15",
      "id": "115926",
      "original_text": "Registerbekanntmachung nach dem Umwandlungsgesetz\nSachsen Amtsgericht Chemnitz HRB 37196\nMFW = Marketing, Finanz- und Wirtschaftsdienst Vermittlung GmbH – Chemnitz",
      "type": "Registerbekanntmachung nach dem Umwandlungsgesetz",
      "state": "Sachsen",
      "amtsgericht": "Amtsgericht Chemnitz",
      "registernummer": "HRB 37196",
      "registerart": "HRB",
      "company_name": "MFW = Marketing, Finanz- und Wirtschaftsdienst Vermittlung GmbH",
      "company_seat": "Chemnitz",
      "details": "15.07.2025 (Bekanntmachungsdatum)\n\nSachsen Amtsgericht Chemnitz HRB 37196\nRegisterbekanntmachung nach dem Umwandlungsgesetz 15.07.2025 (Eintragungsdatum)\n\nMFW = Marketing, Finanz- und Wirtschaftsdienst Vermittlung GmbH\nGesellschaft mit beschränkter Haftung\nChemnitz\n\nDen Gläubigern der an der Verschmelzung beteiligten Rechtsträger ist, wenn sie binnen sechs Monaten nach dem Tag, an dem die Eintragung der Verschmelzung in das Register des Sitzes desjenigen Rechtsträgers, dessen Gläubiger sie sind, nach § 19 Abs. 3 UmwG als bekannt gemacht gilt, ihren Anspruch nach Grund und Höhe in Textform anmelden, Sicherheit zu leisten, soweit sie nicht Befriedigung verlangen können. Dieses Recht steht den Gläubigern jedoch nur zu, wenn sie glaubhaft machen, dass durch die Verschmelzung die Erfüllung der Forderung gefährdet wird."
    },
    {
      "date": "2025-07-15",
      "id": "115927",
      "original_text": "Registerbekanntmachung nach dem Umwandlungsgesetz\nSachsen Amtsgericht Dresden HRB 6547\nSorabia Agrar Aktiengesellschaft – Rosenthal",
      "type": "Registerbekanntmachung nach dem Umwandlungsgesetz",
      "state": "Sachsen",
      "amtsgericht": "Amtsgericht Dresden",
      "registernummer": "HRB 6547",
      "registerart": "HRB",
      "company_name": "Sorabia Agrar Aktiengesellschaft",
      "company_seat": "Rosenthal",
      "details": "15.07.2025 (Bekanntmachungsdatum)\n\nSachsen Amtsgericht Dresden HRB 6547\nRegisterbekanntmachung nach dem Umwandlungsgesetz\n\nSorabia Agrar Aktiengesellschaft\nAktiengesellschaft\nRosenthal\n\nGemäß § 62 Abs. 3 S. 2 UmwG ist durch den Vorstand der übernehmenden Gesellschaft ein Entwurf  eines Verschmelzungsvertrages bei dem Register der übernehmenden Gesellschaft eingereicht  worden und ist in dem Registerordner  hinterlegt."
    },
    {
      "date": "2025-07-15",
      "id": "115928",
      "original_text": "Sonstige Registerbekanntmachung\nSachsen Amtsgericht Chemnitz HRA 1486\nMTG Imiella Medizintechnik e.K. Inh.: Thomas Imiella – Lugau/Erzgeb.",
      "type": "Sonstige Registerbekanntmachung",
      "state": "Sachsen",
      "amtsgericht": "Amtsgericht Chemnitz",
      "registernummer": "HRA 1486",
      "registerart": "HRA",
      "company_name": "MTG Imiella Medizintechnik e.K. Inh.: Thomas Imiella",
      "company_seat": "Lugau/Erzgeb.",
      "details": "15.07.2025 (Bekanntmachungsdatum)\n\nSachsen Amtsgericht Chemnitz HRA 1486\nSonstige Registerbekanntmachung 15.07.2025 (Eintragungsdatum)\n\nMTG Imiella Medizintechnik e.K. Inh.: Thomas Imiella\nEinzelkaufmann / Einzelkauffrau\nLugau/Erzgeb.\n\nUnternehmensgegenstand: Entwicklung, Herstellung und Vertrieb von medizinischen Einwegartikeln"
    },
    {
      "date": "2025-07-15",
      "id": "115929",
      "original_text": "Registerbekanntmachung nach dem Umwandlungsgesetz\nNiedersachsen Amtsgericht Osnabrück HRB 110855 früher Amtsgericht Bad Iburg\nheristo aktiengesellschaft – Bad Rothenfelde",
      "type": "Registerbekanntmachung nach dem Umwandlungsgesetz",
      "state": "Niedersachsen",
      "amtsgericht": "Amtsgericht Osnabrück",
      "registernummer": "HRB 110855",
      "registerart": "HRB",
      "company_name": "heristo aktiengesellschaft",
      "company_seat": "Bad Rothenfelde",
      "former_amtsgericht": "Bad Iburg",
      "details": "15.07.2025 (Bekanntmachungsdatum)\n\nNiedersachsen Amtsgericht Osnabrück HRB 110855 früher Amtsgericht Bad Iburg\nRegisterbekanntmachung nach dem Umwandlungsgesetz 15.07.2025 (Eintragungsdatum)\n\nheristo aktiengesellschaft\nAktiengesellschaft\nBad Rothenfelde\n\nDen Gläubigern der an der Verschmelzung beteiligten Rechtsträger ist, wenn sie binnen sechs Monaten nach dem Tag, an dem die Eintragung der Verschmelzung in das Register des Sitzes desjenigen Rechtsträgers, dessen Gläubiger sie sind, nach § 19  Abs.  3 UmwG als bekannt gemacht gilt, ihren Anspruch nach Grund und Höhe schriftlich anmelden, Sicherheit zu leisten, soweit sie nicht Befriedigung verlangen können. Dieses Recht steht den Gläubigern jedoch nur zu, wenn sie glaubhaft machen, dass durch die Verschmelzung die Erfüllung der Forderung gefährdet wird."
    },
    {
      "date": "2025-07-15",
      "id": "115930",
      "original_text": "Registerbekanntmachung nach dem Umwandlungsgesetz\nNiedersachsen Amtsgericht Lüneburg VR 130061\nDeutsche Verkehrswacht Soltau e. V. – Soltau",
      "type": "Registerbekanntmachung nach dem Umwandlungsgesetz",
      "state": "Niedersachsen",
      "amtsgericht": "Amtsgericht Lüneburg",
      "registernummer": "VR 130061",
      "registerart": "VR",
      "company_name": "Deutsche Verkehrswacht Soltau e. V.",
      "company_seat": "Soltau",
      "details": "15.07.2025 (Bekanntmachungsdatum)\n\nNiedersachsen Amtsgericht Lüneburg VR 130061\nRegisterbekanntmachung nach dem Umwandlungsgesetz 15.07.2025 (Eintragungsdatum)\n\nDeutsche Verkehrswacht Soltau e. V.\neingetragener Verein\nSoltau\n\nDen Gläubigern der an der Verschmelzung beteiligten Rechtsträger ist, wenn sie binnen sechs Monaten nach dem Tag, an dem die Eintragung der Verschmelzung in das Register des Sitzes desjenigen Rechtsträgers, dessen Gläubiger sie sind, nach § 19  Abs.  3 UmwG als bekannt gemacht gilt, ihren Anspruch nach Grund und Höhe schriftlich anmelden, Sicherheit zu leisten, soweit sie nicht Befriedigung verlangen können. Dieses Recht steht den Gläubigern jedoch nur zu, wenn sie glaubhaft machen, dass durch die Verschmelzung die Erfüllung der Forderung gefährdet wird."
    },
    {
      "date": "2025-07-15",
      "id": "115931",
      "original_text": "Registerbekanntmachung nach dem Umwandlungsgesetz\nNiedersachsen Amtsgericht Oldenburg (Oldenburg) HRB 217980\nHeiss Anbaugeräte GmbH – Apen",
      "type": "Registerbekanntmachung nach dem Umwandlungsgesetz",
      "state": "Niedersachsen",
      "amtsgericht": "Amtsgericht Oldenburg (Oldenburg)",
      "registernummer": "HRB 217980",
      "registerart": "HRB",
      "company_name": "Heiss Anbaugeräte GmbH",
      "company_seat": "Apen",
      "details": "15.07.2025 (Bekanntmachungsdatum)\n\nNiedersachsen Amtsgericht Oldenburg (Oldenburg) HRB 217980\nRegisterbekanntmachung nach dem Umwandlungsgesetz 15.07.2025 (Eintragungsdatum)\n\nHeiss Anbaugeräte GmbH\nGesellschaft mit beschränkter Haftung\nApen\n\nDen Gläubigern der an der Verschmelzung beteiligten Rechtsträger ist, wenn sie binnen sechs Monaten nach dem Tag, an dem die Eintragung der Verschmelzung in das Register des Sitzes desjenigen Rechtsträgers, dessen Gläubiger sie sind, nach § 19  Abs.  3 UmwG als bekannt gemacht gilt, ihren Anspruch nach Grund und Höhe schriftlich anmelden, Sicherheit zu leisten, soweit sie nicht Befriedigung verlangen können. Dieses Recht steht den Gläubigern jedoch nur zu, wenn sie glaubhaft machen, dass durch die Verschmelzung die Erfüllung der Forderung gefährdet wird."
    },
    {
      "date": "2025-07-15",
      "id": "115932",
      "original_text": "Löschungsankündigung\nNiedersachsen Amtsgericht Oldenburg (Oldenburg) HRB 215093\nDrewianka Verwaltungs- und Beteiligungs GmbH – Visbek",
      "type": "Löschungsankündigung",
      "state": "Niedersachsen",
      "amtsgericht": "Amtsgericht Oldenburg (Oldenburg)",
      "registernummer": "HRB 215093",
      "registerart": "HRB",
      "company_name": "Drewianka Verwaltungs- und Beteiligungs GmbH",
      "company_seat": "Visbek",
      "details": "15.07.2025 (Bekanntmachungsdatum)\n\nNiedersachsen Amtsgericht Oldenburg (Oldenburg) HRB 215093\nLöschungsankündigung\n\nDrewianka Verwaltungs- und Beteiligungs GmbH\nGesellschaft mit beschränkter Haftung\nVisbek\n\nDas Registergericht beabsichtigt, die Gesellschaft von Amts wegen nach § 394 FamFG zu löschen. Die Frist zur Erhebung eines Widerspruchs ist auf 1 Monat ab dieser Registerbekanntmachung festgesetzt."
    },
    {
      "date": "2025-07-15",
      "id": "115933",
      "original_text": "Registerbekanntmachung nach dem Umwandlungsgesetz\nRheinland-Pfalz Amtsgericht Landau VR 698\nKath. Krankenpflegeverein St. Elisabeth der Pfarrei \"Hl. Theodard\" Rülzheim e.V. – Rülzheim",
      "type": "Registerbekanntmachung nach dem Umwandlungsgesetz",
      "state": "Rheinland-Pfalz",
      "amtsgericht": "Amtsgericht Landau",
      "registernummer": "VR 698",
      "registerart": "VR",
      "company_name": "Kath. Krankenpflegeverein St. Elisabeth der Pfarrei \"Hl. Theodard\" Rülzheim e.V.",
      "company_seat": "Rülzheim",
      "details": "15.07.2025 (Bekanntmachungsdatum)\n\nRheinland-Pfalz Amtsgericht Landau VR 698\nRegisterbekanntmachung nach dem Umwandlungsgesetz 15.07.2025 (Eintragungsdatum)\n\nKath. Krankenpflegeverein St. Elisabeth der Pfarrei \"Hl. Theodard\" Rülzheim e.V.\neingetragener Verein\nRülzheim\n\nAls nicht eingetragen wird veröffentlicht: Den Gläubigern der an der Verschmelzung beteiligten Rechtsträger ist, wenn sie binnen sechs Monaten nach dem Tag, an dem die Eintragung der Verschmelzung in das Register des Sitzes desjenigen Rechtsträgers, dessen Gläubiger sie sind, nach § 19 Abs. 3 UmwG als bekannt gemacht gilt, ihren Anspruch nach Grund und Höhe schriftlich anmelden, Sicherheit zu leisten, soweit sie nicht Befriedigung verlangen können. Dieses Recht steht den Gläubigern jedoch nur zu, wenn sie glaubhaft machen, dass durch die Verschmelzung die Erfüllung der Forderung gefährdet wird."
    },
    {
      "date": "2025-07-15",
      "id": "115934",
      "original_text": "Registerbekanntmachung nach dem Umwandlungsgesetz\nRheinland-Pfalz Amtsgericht Landau VR 593\nKatholischer Krankenpflegeverein St. Elisabethenverein e.V – Hördt",
      "type": "Registerbekanntmachung nach dem Umwandlungsgesetz",
      "state": "Rheinland-Pfalz",
      "amtsgericht": "Amtsgericht Landau",
      "registernummer": "VR 593",
      "registerart": "VR",
      "company_name": "Katholischer Krankenpflegeverein St. Elisabethenverein e.V",
      "company_seat": "Hördt",
      "details": "15.07.2025 (Bekanntmachungsdatum)\n\nRheinland-Pfalz Amtsgericht Landau VR 593\nRegisterbekanntmachung nach dem Umwandlungsgesetz 15.07.2025 (Eintragungsdatum)\n\nKatholischer Krankenpflegeverein St. Elisabethenverein e.V\neingetragener Verein\nHördt\n\nAls nicht eingetragen wird veröffentlicht: Den Gläubigern der an der Verschmelzung beteiligten Rechtsträger ist, wenn sie binnen sechs Monaten nach dem Tag, an dem die Eintragung der Verschmelzung in das Register des Sitzes desjenigen Rechtsträgers, dessen Gläubiger sie sind, nach § 19 Abs. 3 UmwG als bekannt gemacht gilt, ihren Anspruch nach Grund und Höhe schriftlich anmelden, Sicherheit zu leisten, soweit sie nicht Befriedigung verlangen können. Dieses Recht steht den Gläubigern jedoch nur zu, wenn sie glaubhaft machen, dass durch die Verschmelzung die Erfüllung der Forderung gefährdet wird."
    },
    {
      "date": "2025-07-15",
      "id": "115935",
      "original_text": "Registerbekanntmachung nach dem Umwandlungsgesetz\nRheinland-Pfalz Amtsgericht Landau VR 602\nKatholischer Krankenpflegeverein Elisabethenverein - Leimersheim e. V. – Leimersheim.",
      "type": "Registerbekanntmachung nach dem Umwandlungsgesetz",
      "state": "Rheinland-Pfalz",
      "amtsgericht": "Amtsgericht Landau",
      "registernummer": "VR 602",
      "registerart": "VR",
      "company_name": "Katholischer Krankenpflegeverein Elisabethenverein - Leimersheim e. V.",
      "company_seat": "Leimersheim.",
      "details": "15.07.2025 (Bekanntmachungsdatum)\n\nRheinland-Pfalz Amtsgericht Landau VR 602\nRegisterbekanntmachung nach dem Umwandlungsgesetz 15.07.2025 (Eintragungsdatum)\n\nKatholischer Krankenpflegeverein Elisabethenverein - Leimersheim e. V.\neingetragener Verein\nLeimersheim.\n\nAls nicht eingetragen wird veröffentlicht: Den Gläubigern der an der Verschmelzung beteiligten Rechtsträger ist, wenn sie binnen sechs Monaten nach dem Tag, an dem die Eintragung der Verschmelzung in das Register des Sitzes desjenigen Rechtsträgers, dessen Gläubiger sie sind, nach § 19 Abs. 3 UmwG als bekannt gemacht gilt, ihren Anspruch nach Grund und Höhe schriftlich anmelden, Sicherheit zu leisten, soweit sie nicht Befriedigung verlangen können. Dieses Recht steht den Gläubigern jedoch nur zu, wenn sie glaubhaft machen, dass durch die Verschmelzung die Erfüllung der Forderung gefährdet wird."
    },
    {
      "date": "2025-07-15",
      "id": "115936",
      "original_text": "Registerbekanntmachung nach dem Umwandlungsgesetz\nRheinland-Pfalz Amtsgericht Mainz GsR 302\nBacharach Immobilien eGbR – Bacharach",
      "type": "Registerbekanntmachung nach dem Umwandlungsgesetz",
      "state": "Rheinland-Pfalz",
      "amtsgericht": "Amtsgericht Mainz",
      "registernummer": "GsR 302",
      "registerart": "GsR",
      "company_name": "Bacharach Immobilien eGbR",
      "company_seat": "Bacharach",
      "details": "15.07.2025 (Bekanntmachungsdatum)\n\nRheinland-Pfalz Amtsgericht Mainz GsR 302\nRegisterbekanntmachung nach dem Umwandlungsgesetz 15.07.2025 (Eintragungsdatum)\n\nBacharach Immobilien eGbR\nGesellschaft bürgerlichen Rechts\nBacharach\n\nAls nicht eingetragen wird veröffentlicht:\nDen Gläubigern des formwechselnden Rechtsträgers ist, wenn sie binnen sechs Monaten nach dem Tag, an dem die Eintragung des Formwechsels nach § 201 UmwG als bekannt gemacht gilt, ihren Anspruch nach Grund und Höhe schriftlich anmelden, Sicherheit zu leisten, soweit sie nicht Befriedigung verlangen können. Dieses Recht steht den Gläubigern jedoch nur zu, wenn sie glaubhaft machen, dass durch den Formwechsel die Erfüllung der Forderung gefährdet wird."
    },
    {
      "date": "2025-07-15",
      "id": "115937",
      "original_text": "Einreichung neuer Dokumente\nRheinland-Pfalz Amtsgericht Mainz HRB 128\nKraftwerke Mainz-Wiesbaden Aktiengesellschaft. – Mainz",
      "type": "Einreichung neuer Dokumente",
      "state": "Rheinland-Pfalz",
      "amtsgericht": "Amtsgericht Mainz",
      "registernummer": "HRB 128",
      "registerart": "HRB",
      "company_name": "Kraftwerke Mainz-Wiesbaden Aktiengesellschaft.",
      "company_seat": "Mainz",
      "details": "15.07.2025 (Bekanntmachungsdatum)\n\nRheinland-Pfalz Amtsgericht Mainz HRB 128\nEinreichung neuer Dokumente\n\nKraftwerke Mainz-Wiesbaden Aktiengesellschaft.\nAktiengesellschaft\nMainz\n\nDem Registergericht ist eine neue Liste der Mitglieder des Aufsichtsrates eingereicht worden."
    },
    {
      "date": "2025-07-15",
      "id": "115938",
      "original_text": "Sonstige Registerbekanntmachung\nRheinland-Pfalz Amtsgericht Ludwigshafen a.Rhein (Ludwigshafen) HRB 69277\nSHE International AG – Ludwigshafen am Rhein",
      "type": "Sonstige Registerbekanntmachung",
      "state": "Rheinland-Pfalz",
      "amtsgericht": "Amtsgericht Ludwigshafen a.Rhein (Ludwigshafen)",
      "registernummer": "HRB 69277",
      "registerart": "HRB",
      "company_name": "SHE International AG",
      "company_seat": "Ludwigshafen am Rhein",
      "details": "15.07.2025 (Bekanntmachungsdatum)\n\nRheinland-Pfalz Amtsgericht Ludwigshafen a.Rhein (Ludwigshafen) HRB 69277\nSonstige Registerbekanntmachung 15.07.2025 (Eintragungsdatum)\n\nSHE International AG\nAktiengesellschaft\nLudwigshafen am Rhein\n\nDem Registergericht ist eine neue Liste der Mitglieder des Aufsichtsrates eingereicht worden."
    },
    {
      "date": "2025-07-15",
      "id": "115939",
      "original_text": "Registerbekanntmachung nach dem Umwandlungsgesetz\nRheinland-Pfalz Amtsgericht Landau VR 949\nKath. Krankenpflegeverein St. Elisabeth e.V. – Kuhardt",
      "type": "Registerbekanntmachung nach dem Umwandlungsgesetz",
      "state": "Rheinland-Pfalz",
      "amtsgericht": "Amtsgericht Landau",
      "registernummer": "VR 949",
      "registerart": "VR",
      "company_name": "Kath. Krankenpflegeverein St. Elisabeth e.V.",
      "company_seat": "Kuhardt",
      "details": "15.07.2025 (Bekanntmachungsdatum)\n\nRheinland-Pfalz Amtsgericht Landau VR 949\nRegisterbekanntmachung nach dem Umwandlungsgesetz 15.07.2025 (Eintragungsdatum)\n\nKath. Krankenpflegeverein St. Elisabeth e.V.\neingetragener Verein\nKuhardt\n\nAls nicht eingetragen wird veröffentlicht: Den Gläubigern der an der Verschmelzung beteiligten Rechtsträger ist, wenn sie binnen sechs Monaten nach dem Tag, an dem die Eintragung der Verschmelzung in das Register des Sitzes desjenigen Rechtsträgers, dessen Gläubiger sie sind, nach § 19 Abs. 3 UmwG als bekannt gemacht gilt, ihren Anspruch nach Grund und Höhe schriftlich anmelden, Sicherheit zu leisten, soweit sie nicht Befriedigung verlangen können. Dieses Recht steht den Gläubigern jedoch nur zu, wenn sie glaubhaft machen, dass durch die Verschmelzung die Erfüllung der Forderung gefährdet wird."
    },
    {
      "date": "2025-07-15",
      "id": "115940",
      "original_text": "Einreichung neuer Dokumente\nBremen Amtsgericht Bremen HRB 20499\ndbh Logistics IT AG – Bremen",
      "type": "Einreichung neuer Dokumente",
      "state": "Bremen",
      "amtsgericht": "Amtsgericht Bremen",
      "registernummer": "HRB 20499",
      "registerart": "HRB",
      "company_name": "dbh Logistics IT AG",
      "company_seat": "Bremen",
      "details": "15.07.2025 (Bekanntmachungsdatum)\n\nBremen Amtsgericht Bremen HRB 20499\nEinreichung neuer Dokumente\n\ndbh Logistics IT AG\nAktiengesellschaft\nBremen\n\nAls nicht eingetragen wird bekannt gemacht: Liste des Aufsichtsrats wurde eingereicht."
    },
    {
      "date": "2025-07-15",
      "id": "115941",
      "original_text": "Registerbekanntmachung nach dem Umwandlungsgesetz\nBremen Amtsgericht Bremen HRA 22650\nContainer-Service Friedrich Tiemann & Sohn GmbH & Co. KG – Bremen",
      "type": "Registerbekanntmachung nach dem Umwandlungsgesetz",
      "state": "Bremen",
      "amtsgericht": "Amtsgericht Bremen",
      "registernummer": "HRA 22650",
      "registerart": "HRA",
      "company_name": "Container-Service Friedrich Tiemann & Sohn GmbH & Co. KG",
      "company_seat": "Bremen",
      "details": "15.07.2025 (Bekanntmachungsdatum)\n\nBremen Amtsgericht Bremen HRA 22650\nRegisterbekanntmachung nach dem Umwandlungsgesetz 09.07.2025 (Eintragungsdatum)\n\nContainer-Service Friedrich Tiemann & Sohn GmbH & Co. KG\nKommanditgesellschaft\nBremen\n\nAls nicht eingetragen wird veröffentlicht: Den Gläubigern der an der Verschmelzung beteiligten Rechtsträger ist, wenn sie binnen sechs Monaten nach dem Tag, an dem die Eintragung der Verschmelzung in das Register des Sitzes desjenigen Rechtsträgers, dessen Gläubiger sie sind, als bekannt gemacht gilt, ihren Anspruch nach Grund und Höhe schriftlich anmelden, Sicherheit zu leisten, soweit sie nicht Befriedigung verlangen können. Dieses Recht steht den Gläubigern jedoch nur zu, wenn sie glaubhaft machen, dass durch die Verschmelzung die Erfüllung ihrer Forderung gefährdet wird. Das Recht, Sicherheitsleistung zu verlangen, steht Gläubigern nicht zu, die im Falle der Insolvenz ein Recht auf vorzugsweise Befriedigung aus einer Deckungsmasse haben, die nach gesetzlicher Vorschrift zu ihrem Schutz errichtet und staatlich überwacht ist."
    },
    {
      "date": "2025-07-15",
      "id": "115942",
      "original_text": "Registerbekanntmachung nach dem Umwandlungsgesetz\nBremen Amtsgericht Bremen HRB 37443\nSAACKE Beteiligungs-GmbH – Bremen",
      "type": "Registerbekanntmachung nach dem Umwandlungsgesetz",
      "state": "Bremen",
      "amtsgericht": "Amtsgericht Bremen",
      "registernummer": "HRB 37443",
      "registerart": "HRB",
      "company_name": "SAACKE Beteiligungs-GmbH",
      "company_seat": "Bremen",
      "details": "15.07.2025 (Bekanntmachungsdatum)\n\nBremen Amtsgericht Bremen HRB 37443\nRegisterbekanntmachung nach dem Umwandlungsgesetz\n\nSAACKE Beteiligungs-GmbH\nGesellschaft mit beschränkter Haftung\nBremen\n\nAls nicht eingetragen wird veröffentlicht: Der Entwurf des gemeinsamen Verschmelzungsplanes wurde am 09.07.2025 beim Handelsregister eingereicht (§§ 305, 308, 61 UmwG).\nRechtsform, Firma und Sitz der an der grenzüberschreitenden Verschmelzung beteiligten Gesellschaften:\nAls übertragende Gesellschaft die Danish Marine Service ApS, eine Gesellschaft mit beschränkter Haftung nach dänischem Recht mit Sitz in Pandrup. Sie ist eingetragen im zentralen Unternehmensregister der dänischen Wirtschaftsbehörde unter der Nummer 31578256. Als übernehmende Gesellschaft die SAACKE Beteiligungs-GmbH, eine Gesellschaft mit beschränkter Haftung nach deutschem Recht. Sie ist eingetragen im Handelsregister des Amtsgerichts Bremen unter HRB 37443 HB.\nDie Anteilsinhaber und Gläubiger sowie die zuständigen Betriebsräte oder soweit es keine Betriebsräte gibt - Arbeitnehmer der vorgenannten Gesellschaften werden hiermit darauf hingewiesen, dass sie der jeweiligen Gesellschaft spätestens fünf Arbeitstage vor der Gesellschafterversammlung am 25. August 2025 Bemerkungen zum Verschmelzungsplan übermitteln können."
    },
    {
      "date": "2025-07-15",
      "id": "115943",
      "original_text": "Sonstige Registerbekanntmachung\nNordrhein-Westfalen Amtsgericht Düsseldorf HRB 89357\nFortuna VV SE – Düsseldorf",
      "type": "Sonstige Registerbekanntmachung",
      "state": "Nordrhein-Westfalen",
      "amtsgericht": "Amtsgericht Düsseldorf",
      "registernummer": "HRB 89357",
      "registerart": "HRB",
      "company_name": "Fortuna VV SE",
      "company_seat": "Düsseldorf",
      "details": "15.07.2025 (Bekanntmachungsdatum)\n\nNordrhein-Westfalen Amtsgericht Düsseldorf HRB 89357\nSonstige Registerbekanntmachung\n\nFortuna VV SE\nEuropäische Aktiengesellschaft (SE)\nDüsseldorf\n\nDem Registergericht ist eine Liste der Mitglieder des Verwaltungsrates eingereicht worden."
    },
    {
      "date": "2025-07-15",
      "id": "115944",
      "original_text": "Einreichung neuer Dokumente\nNordrhein-Westfalen Amtsgericht Köln HRB 63521\nCAM Alternatives GmbH – Köln",
      "type": "Einreichung neuer Dokumente",
      "state": "Nordrhein-Westfalen",
      "amtsgericht": "Amtsgericht Köln",
      "registernummer": "HRB 63521",
      "registerart": "HRB",
      "company_name": "CAM Alternatives GmbH",
      "company_seat": "Köln",
      "details": "15.07.2025 (Bekanntmachungsdatum)\n\nNordrhein-Westfalen Amtsgericht Köln HRB 63521\nEinreichung neuer Dokumente 15.07.2025 (Eintragungsdatum)\n\nCAM Alternatives GmbH\nGesellschaft mit beschränkter Haftung\nKöln\n\nDem Registergericht ist eine neue Liste der Mitglieder des Aufsichtsrates eingereicht worden."
    },
    {
      "date": "2025-07-15",
      "id": "115945",
      "original_text": "Registerbekanntmachung nach dem Umwandlungsgesetz\nNordrhein-Westfalen Amtsgericht Münster HRB 19589\nBlautal Grundstück GmbH – Münster",
      "type": "Registerbekanntmachung nach dem Umwandlungsgesetz",
      "state": "Nordrhein-Westfalen",
      "amtsgericht": "Amtsgericht Münster",
      "registernummer": "HRB 19589",
      "registerart": "HRB",
      "company_name": "Blautal Grundstück GmbH",
      "company_seat": "Münster",
      "details": "15.07.2025 (Bekanntmachungsdatum)\n\nNordrhein-Westfalen Amtsgericht Münster HRB 19589\nDie Registerbekanntmachung ist nachträglich am 21.07.2025 um 20:01 Uhr gelöscht worden.\nWegen der Einzelheiten und näherer Auskünfte wenden Sie sich bitte an das Amtsgericht Münster ."
    },
    {
      "date": "2025-07-15",
      "id": "115946",
      "original_text": "Registerbekanntmachung nach dem Umwandlungsgesetz\nNordrhein-Westfalen Amtsgericht Essen HRB 4423\nCONDOR Schutz- und Sicherheitsdienst GmbH – Essen",
      "type": "Registerbekanntmachung nach dem Umwandlungsgesetz",
      "state": "Nordrhein-Westfalen",
      "amtsgericht": "Amtsgericht Essen",
      "registernummer": "HRB 4423",
      "registerart": "HRB",
      "company_name": "CONDOR Schutz- und Sicherheitsdienst GmbH",
      "company_seat": "Essen",
      "details": "15.07.2025 (Bekanntmachungsdatum)\n\nNordrhein-Westfalen Amtsgericht Essen HRB 4423\nRegisterbekanntmachung nach dem Umwandlungsgesetz 15.07.2025 (Eintragungsdatum)\n\nCONDOR Schutz- und Sicherheitsdienst GmbH\nGesellschaft mit beschränkter Haftung\nEssen\n\nDen Gläubigern der an der Ausgliederung beteiligten Rechtsträger ist, wenn sie binnen sechs Monaten nach dem Tag, an dem die Eintragung der Ausgliederung in das Register des Sitzes derjenigen Rechtsträger deren Gläubiger sie sind, nach § 19 Absatz 3 UmwG als bekanntgemacht gilt, ihren Anspruch nach Grund und Höhe schriftlich anmelden, Sicherheit zu leisten, soweit sie nicht Befriedigung verlangen können. Dieses Recht steht den Gläubigern jedoch nur zu, wenn sie glaubhaft machen, dass durch die Ausgliederung die Erfüllung ihrer Forderung gefährdet wird."
    },
    {
      "date": "2025-07-15",
      "id": "115947",
      "original_text": "Registerbekanntmachung nach dem Umwandlungsgesetz\nNordrhein-Westfalen Amtsgericht Duisburg HRB 12769\nApleona Infra Services GmbH – Oberhausen",
      "type": "Registerbekanntmachung nach dem Umwandlungsgesetz",
      "state": "Nordrhein-Westfalen",
      "amtsgericht": "Amtsgericht Duisburg",
      "registernummer": "HRB 12769",
      "registerart": "HRB",
      "company_name": "Apleona Infra Services GmbH",
      "company_seat": "Oberhausen",
      "details": "15.07.2025 (Bekanntmachungsdatum)\n\nNordrhein-Westfalen Amtsgericht Duisburg HRB 12769\nRegisterbekanntmachung nach dem Umwandlungsgesetz 15.07.2025 (Eintragungsdatum)\n\nApleona Infra Services GmbH\nGesellschaft mit beschränkter Haftung\nOberhausen\n\nDie Gesellschaft hat Gläubigern, deren Forderungen vor dieser Bekanntmachung begründet worden sind, Sicherheit zu leisten, soweit sie nicht Befriedigung verlangen können, wenn sie sich binnen sechs Monaten zu diesem Zweck melden."
    },
    {
      "date": "2025-07-15",
      "id": "115948",
      "original_text": "Löschungsankündigung\nNordrhein-Westfalen Amtsgericht Duisburg HRB 25856\nMA Dialog UG (haftungsbeschränkt) – Oberhausen",
      "type": "Löschungsankündigung",
      "state": "Nordrhein-Westfalen",
      "amtsgericht": "Amtsgericht Duisburg",
      "registernummer": "HRB 25856",
      "registerart": "HRB",
      "company_name": "MA Dialog UG (haftungsbeschränkt)",
      "company_seat": "Oberhausen",
      "details": "15.07.2025 (Bekanntmachungsdatum)\n\nNordrhein-Westfalen Amtsgericht Duisburg HRB 25856\nLöschungsankündigung 15.07.2025 (Eintragungsdatum)\n\nMA Dialog UG (haftungsbeschränkt)\nGesellschaft mit beschränkter Haftung\nOberhausen\n\nHRB 25856:\nMA Dialog UG (haftungsbeschränkt), Oberhausen\nWenger Höfe 11, 46284 Dorsten.\nDas Registergericht beabsichtigt, die im Handelsregister eingetragene Gesellschaft gemäß § 394 FamFG wegen Vermögenslosigkeit von Amts wegen zu löschen. Gegen diese Verfügung kann Widerspruch eingelegt werden. Die Frist zur Erhebung eines Widerspruchs gegen die beabsichtigte Löschung von Amts wegen ist auf drei Monate festgesetzt.\nRechtsbehelfsbelehrung Der Widerspruch ist bei dem Amtsgericht Duisburg, Kardinal-Galen-Str. 124-132, 47058 Duisburg schriftlich in deutscher Sprache oder zur Niederschrift der Geschäftsstelle einzulegen. Der Widerspruch kann auch zur Niederschrift der Geschäftsstelle eines jeden Amtsgerichtes abgegeben werden. Die Einlegung ist auch durch Übertragung eines elektronischen Dokuments an die elektronische Poststelle des Gerichts möglich. Das elektronische Dokument muss für die Bearbeitung durch das Gericht geeignet und mit einer qualifizierten elektronischen Signatur der verantwortenden Person versehen sein oder von der verantwortenden Person signiert und auf einem sicheren Übermittlungsweg gemäß § 130 a ZPO nach näherer Maßgabe der Verordnung über die technischen Rahmenbedingungen des elektronischen Rechtsverkehrs und über das besondere elektronische Behördenpostfach (BGBl. I, S. 3803) eingereicht werden. Weitere Informationen erhalten Sie auf der Internetseite www.justiz.de <http://www.justiz.de>. Der Widerspruch muss spätestens innerhalb der gesetzten Frist bei dem Amtsgericht Duisburg eingegangen sein. Dies gilt auch dann, wenn der Widerspruch zur Niederschrift der Geschäftsstelle eines anderen Amtsgerichtes abgegeben wurde. Die Frist beginnt mit der Veröffentlichung. Fällt das Ende der Frist auf einen Sonntag, einen allgemeinen Feiertag oder Sonnabend, so endet die Frist mit Ablauf des nächsten Werktages. Der Widerspruch muss die Bezeichnung der angefochtenen Verfügung sowie die Erklärung enthalten, dass Widerspruch gegen diese Verfügung eingelegt wird. Er ist zu unterzeichnen und soll begründet werden."
    },
    {
      "date": "2025-07-15",
      "id": "115949",
      "original_text": "Registerbekanntmachung nach dem Umwandlungsgesetz\nNordrhein-Westfalen Amtsgericht Düsseldorf HRB 102764\nFlottenlotse GmbH – Langenfeld",
      "type": "Registerbekanntmachung nach dem Umwandlungsgesetz",
      "state": "Nordrhein-Westfalen",
      "amtsgericht": "Amtsgericht Düsseldorf",
      "registernummer": "HRB 102764",
      "registerart": "HRB",
      "company_name": "Flottenlotse GmbH",
      "company_seat": "Langenfeld",
      "details": "15.07.2025 (Bekanntmachungsdatum)\n\nNordrhein-Westfalen Amtsgericht Düsseldorf HRB 102764\nRegisterbekanntmachung nach dem Umwandlungsgesetz 15.07.2025 (Eintragungsdatum)\n\nFlottenlotse GmbH\nGesellschaft mit beschränkter Haftung\nLangenfeld\n\nDen Gläubigern der an der Verschmelzung beteiligten Rechtsträger ist, wenn sie binnen sechs Monaten nach dem Tag, an dem die Eintragung der Verschmelzung in das Register des Sitzes desjenigen Rechtsträgers, dessen Gläubiger sie sind, nach § 19 Absatz 3 UmwG als bekanntgemacht gilt, ihren Anspruch nach Grund und Höhe schriftlich anmelden, Sicherheit zu leisten, soweit sie nicht Befriedigung verlangen können. Dieses Recht steht den Gläubigern jedoch nur zu, wenn sie glaubhaft machen, dass durch die Verschmelzung die Erfüllung ihrer Forderung gefährdet wird."
    },
    {
      "date": "2025-07-15",
      "id": "115950",
      "original_text": "Löschungsankündigung\nNordrhein-Westfalen Amtsgericht Kleve HRB 16688\nMT Networks UG (haftungsbeschränkt) – Emmerich am Rhein",
      "type": "Löschungsankündigung",
      "state": "Nordrhein-Westfalen",
      "amtsgericht": "Amtsgericht Kleve",
      "registernummer": "HRB 16688",
      "registerart": "HRB",
      "company_name": "MT Networks UG (haftungsbeschränkt)",
      "company_seat": "Emmerich am Rhein",
      "details": "15.07.2025 (Bekanntmachungsdatum)\n\nNordrhein-Westfalen Amtsgericht Kleve HRB 16688\nLöschungsankündigung\n\nMT Networks UG (haftungsbeschränkt)\nGesellschaft mit beschränkter Haftung\nEmmerich am Rhein\n\nDas Registergericht beabsichtigt die Gesellschaft von Amts wegen nach § 394 FamFG zu löschen. Die Frist zur Erhebung eines Widerspruchs ist auf einen Monat festgesetzt."
    },
    {
      "date": "2025-07-15",
      "id": "115951",
      "original_text": "Einreichung neuer Dokumente\nNordrhein-Westfalen Amtsgericht Köln HRB 58850\nEuforma Aktiengesellschaft für das Forderungsmanagement in Europa – Köln",
      "type": "Einreichung neuer Dokumente",
      "state": "Nordrhein-Westfalen",
      "amtsgericht": "Amtsgericht Köln",
      "registernummer": "HRB 58850",
      "registerart": "HRB",
      "company_name": "Euforma Aktiengesellschaft für das Forderungsmanagement in Europa",
      "company_seat": "Köln",
      "details": "15.07.2025 (Bekanntmachungsdatum)\n\nNordrhein-Westfalen Amtsgericht Köln HRB 58850\nEinreichung neuer Dokumente\n\nEuforma Aktiengesellschaft für das Forderungsmanagement in Europa\nAktiengesellschaft\nKöln\n\nDem Registergericht ist eine Liste der Mitglieder des Aufsichtsrates eingereicht worden."
    },
    {
      "date": "2025-07-15",
      "id": "115952",
      "original_text": "Löschungsankündigung\nNordrhein-Westfalen Amtsgericht Neuss HRB 23178\nHeela Research GmbH – Neuss",
      "type": "Löschungsankündigung",
      "state": "Nordrhein-Westfalen",
      "amtsgericht": "Amtsgericht Neuss",
      "registernummer": "HRB 23178",
      "registerart": "HRB",
      "company_name": "Heela Research GmbH",
      "company_seat": "Neuss",
      "details": "15.07.2025 (Bekanntmachungsdatum)\n\nNordrhein-Westfalen Amtsgericht Neuss HRB 23178\nLöschungsankündigung\n\nHeela Research GmbH\nGesellschaft mit beschränkter Haftung\nNeuss\n\nes ist beabsichtigt, die im Handelsregister eingetragene Gesellschaft gemäß § 394 Absatz 1 FamFG wegen Vermögenslosigkeit von Amts wegen zu löschen.\n\nFrist zur Geltendmachung eines Widerspruchs: 1 Monat\n\nRechtsbehelfsbelehrung:\nGegen diese Verfügung können Sie Widerspruch einlegen. Der Widerspruch ist bei dem Amtsgericht Neuss, Breite Straße 48, 41460 Neuss schriftlich in deutscher Sprache oder zur Niederschrift der Geschäftsstelle einzulegen. Der Widerspruch kann auch zur Niederschrift der Geschäftsstelle eines jeden Amtsgerichtes abgegeben werden. Die Einlegung ist auch durch Übertragung eines elektronischen Dokuments an die elektronische Poststelle des Gerichts möglich. Das elektronische Dokument muss für die Bearbeitung durch das Gericht geeignet und mit einer qualifizierten elektronischen Signatur der verantwortenden Person versehen sein oder von der verantwortenden Person signiert und auf einem sicheren Übermittlungsweg gemäß § 130a ZPO nach näherer Maßgabe der Verordnung über die technischen Rahmenbedingungen des elektronischen Rechtsverkehrs und über das besondere elektronische Behördenpostfach (BGBl. I, S.3803) eingereicht werden. Weitere Informationen erhalten Sie auf der Internetseite www.justiz.de.\nDer Widerspruch muss spätestens innerhalb der gesetzten Frist bei dem Amtsgericht Neuss eingegangen sein. Dies gilt auch dann, wenn der Widerspruch zur Niederschrift der Geschäftsstelle eines anderen Amtsgerichtes abgegeben wurde. Die Frist beginnt mit der Veröffentlichung. Fällt das Ende der Frist auf einen Sonntag, einen allgemeinen Feiertag oder Sonnabend, so endet die Frist mit Ablauf des nächsten Werktages. Der Widerspruch muss die Bezeichnung der angefochtenen Verfügung sowie die Erklärung enthalten, dass Widerspruch gegen diese Verfügung eingelegt wird. Er ist zu unterzeichnen und soll begründet werden."
    },
    {
      "date": "2025-07-15",
      "id": "115953",
      "original_text": "Registerbekanntmachung nach dem Umwandlungsgesetz\nNordrhein-Westfalen Amtsgericht Dortmund HRB 35150\nB54 Autoservice GmbH – Dortmund",
      "type": "Registerbekanntmachung nach dem Umwandlungsgesetz",
      "state": "Nordrhein-Westfalen",
      "amtsgericht": "Amtsgericht Dortmund",
      "registernummer": "HRB 35150",
      "registerart": "HRB",
      "company_name": "B54 Autoservice GmbH",
      "company_seat": "Dortmund",
      "details": "15.07.2025 (Bekanntmachungsdatum)\n\nNordrhein-Westfalen Amtsgericht Dortmund HRB 35150\nRegisterbekanntmachung nach dem Umwandlungsgesetz 15.07.2025 (Eintragungsdatum)\n\nB54 Autoservice GmbH\nGesellschaft mit beschränkter Haftung\nDortmund\n\nDen Gläubigern der an der Verschmelzung beteiligten Rechtsträger ist, wenn sie binnen sechs Monaten nach dem Tag, an dem die Eintragung der Verschmelzung in das Register des Sitzes desjenigen Rechtsträgers, dessen Gläubiger sie sind, nach § 19 Absatz 3 UmwG als bekanntgemacht gilt, ihren Anspruch nach Grund und Höhe schriftlich anmelden, Sicherheit zu leisten, soweit sie nicht Befriedigung verlangen können. Dieses Recht steht den Gläubigern jedoch nur zu, wenn sie glaubhaft machen, dass durch die Verschmelzung die Erfüllung ihrer Forderung gefährdet wird."
    },
    {
      "date": "2025-07-15",
      "id": "115954",
      "original_text": "Löschungsankündigung\nNordrhein-Westfalen Amtsgericht Mönchengladbach HRB 14591\nAP Rohstoffhandel GmbH – Erkelenz",
      "type": "Löschungsankündigung",
      "state": "Nordrhein-Westfalen",
      "amtsgericht": "Amtsgericht Mönchengladbach",
      "registernummer": "HRB 14591",
      "registerart": "HRB",
      "company_name": "AP Rohstoffhandel GmbH",
      "company_seat": "Erkelenz",
      "details": "15.07.2025 (Bekanntmachungsdatum)\n\nNordrhein-Westfalen Amtsgericht Mönchengladbach HRB 14591\nLöschungsankündigung\n\nAP Rohstoffhandel GmbH\nGesellschaft mit beschränkter Haftung\nErkelenz\n\nDas Registergericht beabsichtigt, die im Handelsregister eingetragene Gesellschaft gemäß § 394 Absatz 1 FamFG wegen Vermögenslosigkeit von Amts wegen zu löschen. Gegen diese Verfügung kann Widerspruch eingelegt werden. Die Frist zur Erhebung eines Widerspruchs gegen die beabsichtigte Löschung von Amts wegen ist auf drei Monate festgesetzt."
    },
    {
      "date": "2025-07-15",
      "id": "115955",
      "original_text": "Löschungsankündigung\nNordrhein-Westfalen Amtsgericht Köln HRB 92289\nCK Kolonia UG (haftungsbeschränkt) – Köln",
      "type": "Löschungsankündigung",
      "state": "Nordrhein-Westfalen",
      "amtsgericht": "Amtsgericht Köln",
      "registernummer": "HRB 92289",
      "registerart": "HRB",
      "company_name": "CK Kolonia UG (haftungsbeschränkt)",
      "company_seat": "Köln",
      "details": "15.07.2025 (Bekanntmachungsdatum)\n\nNordrhein-Westfalen Amtsgericht Köln HRB 92289\nLöschungsankündigung\n\nCK Kolonia UG (haftungsbeschränkt)\nGesellschaft mit beschränkter Haftung\nKöln\n\nDas Registergericht beabsichtigt die Gesellschaft von Amts wegen nach § 394 FamFG zu löschen. Die Frist zur Erhebung eines Widerspruchs ist auf einen Monat festgesetzt."
    },
    {
      "date": "2025-07-15",
      "id": "115956",
      "original_text": "Löschungsankündigung\nNordrhein-Westfalen Amtsgericht Bochum HRB 20444\nImpuls Baukonzepte GmbH – Herne",
      "type": "Löschungsankündigung",
      "state": "Nordrhein-Westfalen",
      "amtsgericht": "Amtsgericht Bochum",
      "registernummer": "HRB 20444",
      "registerart": "HRB",
      "company_name": "Impuls Baukonzepte GmbH",
      "company_seat": "Herne",
      "details": "15.07.2025 (Bekanntmachungsdatum)\n\nNordrhein-Westfalen Amtsgericht Bochum HRB 20444\nLöschungsankündigung 16.08.2025 (Eintragungsdatum)\n\nImpuls Baukonzepte GmbH\nGesellschaft mit beschränkter Haftung\nHerne\n\nDas Registergericht beabsichtigt die Gesellschaft von Amts wegen nach § 394 FamFG zu löschen. Die Frist zur Erhebung eines Widerspruchs ist auf drei Monate festgesetzt."
    },
    {
      "date": "2025-07-15",
      "id": "115957",
      "original_text": "Registerbekanntmachung nach dem Umwandlungsgesetz\nNordrhein-Westfalen Amtsgericht Siegen HRA 6567\nLandhotel Voss e.K. – Lennestadt-Saalhausen",
      "type": "Registerbekanntmachung nach dem Umwandlungsgesetz",
      "state": "Nordrhein-Westfalen",
      "amtsgericht": "Amtsgericht Siegen",
      "registernummer": "HRA 6567",
      "registerart": "HRA",
      "company_name": "Landhotel Voss e.K.",
      "company_seat": "Lennestadt-Saalhausen",
      "details": "15.07.2025 (Bekanntmachungsdatum)\n\nNordrhein-Westfalen Amtsgericht Siegen HRA 6567\nRegisterbekanntmachung nach dem Umwandlungsgesetz 15.07.2025 (Eintragungsdatum)\n\nLandhotel Voss e.K.\nEinzelkaufmann / Einzelkauffrau\nLennestadt-Saalhausen\n\nDen Gläubigern der an der Ausgliederung beteiligten Rechtsträger ist, wenn sie binnen sechs Monaten nach dem Tag, an dem die Eintragung der Ausgliederung in das Register des Sitzes desjenigen Rechtsträgers, dessen Gläubiger sie sind, nach § 19 Absatz 3 UmwG als bekanntgemacht gilt, ihren Anspruch nach Grund und Höhe schriftlich anmelden, Sicherheit zu leisten, soweit sie nicht Befriedigung verlangen können. Dieses Recht steht den Gläubigern jedoch nur zu, wenn sie glaubhaft machen, dass durch die Ausgliederung die Erfüllung ihrer Forderung gefährdet wird."
    },
    {
      "date": "2025-07-15",
      "id": "115958",
      "original_text": "Löschungsankündigung\nNordrhein-Westfalen Amtsgericht Köln HRB 76879\nIPR Consulting Services Limited Niederlassung Brühl – Brühl",
      "type": "Löschungsankündigung",
      "state": "Nordrhein-Westfalen",
      "amtsgericht": "Amtsgericht Köln",
      "registernummer": "HRB 76879",
      "registerart": "HRB",
      "company_name": "IPR Consulting Services Limited Niederlassung Brühl",
      "company_seat": "Brühl",
      "details": "15.07.2025 (Bekanntmachungsdatum)\n\nNordrhein-Westfalen Amtsgericht Köln HRB 76879\nLöschungsankündigung\n\nIPR Consulting Services Limited Niederlassung Brühl\nRechtsform ausländischen Rechts HRB\nBrühl\n\nDas Registergericht beabsichtigt die Gesellschaft von Amts wegen nach § 395 FamFG zu löschen. Die Frist zur Erhebung eines Widerspruchs ist auf einen Monat festgesetzt."
    },
    {
      "date": "2025-07-15",
      "id": "115959",
      "original_text": "Löschungsankündigung\nNordrhein-Westfalen Amtsgericht Gelsenkirchen HRB 16548\nSchwarz und Weiss Automobile GmbH – Gelsenkirchen",
      "type": "Löschungsankündigung",
      "state": "Nordrhein-Westfalen",
      "amtsgericht": "Amtsgericht Gelsenkirchen",
      "registernummer": "HRB 16548",
      "registerart": "HRB",
      "company_name": "Schwarz und Weiss Automobile GmbH",
      "company_seat": "Gelsenkirchen",
      "details": "15.07.2025 (Bekanntmachungsdatum)\n\nNordrhein-Westfalen Amtsgericht Gelsenkirchen HRB 16548\nLöschungsankündigung\n\nSchwarz und Weiss Automobile GmbH\nGesellschaft mit beschränkter Haftung\nGelsenkirchen\n\nDas Gericht beabsichtigt, die im Handelsregister eingetragene Schwarz und Weiss Automobile GmbH mit Sitz in Gelsenkirchen, HRB 16548, Amtsgericht Gelsenkirchen, wegen Vermögenslosigkeit zu löschen.\nHiermit wird denjenigen, die an der Unterlassung der Löschung ein berechtigtes Interesse haben, gem. § 394 Abs. 2 FamFG Gelegenheit gegeben, gegen dieses Vorhaben binnen eines Monats nach dieser Bekanntmachung Widerspruch einzulegen. Der Widerspruch kann schriftlich oder zu Protokoll der Geschäftsstelle erhoben werden."
    },
    {
      "date": "2025-07-15",
      "id": "115960",
      "original_text": "Einreichung neuer Dokumente\nNordrhein-Westfalen Amtsgericht Dortmund HRB 2405\nSIGNAL IDUNA Krankenversicherung a. G. – Dortmund",
      "type": "Einreichung neuer Dokumente",
      "state": "Nordrhein-Westfalen",
      "amtsgericht": "Amtsgericht Dortmund",
      "registernummer": "HRB 2405",
      "registerart": "HRB",
      "company_name": "SIGNAL IDUNA Krankenversicherung a. G.",
      "company_seat": "Dortmund",
      "details": "15.07.2025 (Bekanntmachungsdatum)\n\nNordrhein-Westfalen Amtsgericht Dortmund HRB 2405\nEinreichung neuer Dokumente\n\nSIGNAL IDUNA Krankenversicherung a. G.\nVersicherungsverein auf Gegenseitigkeit\nDortmund\n\nDem Registergericht ist eine neue Liste der Mitglieder des Aufsichtsrates eingereicht worden."
    },
    {
      "date": "2025-07-15",
      "id": "115961",
      "original_text": "Registerbekanntmachung nach dem Umwandlungsgesetz\nNordrhein-Westfalen Amtsgericht Siegen HRB 10713\nPOLYGON Deutschland GmbH – Olpe",
      "type": "Registerbekanntmachung nach dem Umwandlungsgesetz",
      "state": "Nordrhein-Westfalen",
      "amtsgericht": "Amtsgericht Siegen",
      "registernummer": "HRB 10713",
      "registerart": "HRB",
      "company_name": "POLYGON Deutschland GmbH",
      "company_seat": "Olpe",
      "details": "15.07.2025 (Bekanntmachungsdatum)\n\nNordrhein-Westfalen Amtsgericht Siegen HRB 10713\nRegisterbekanntmachung nach dem Umwandlungsgesetz 15.07.2025 (Eintragungsdatum)\n\nPOLYGON Deutschland GmbH\nGesellschaft mit beschränkter Haftung\nOlpe\n\nDen Gläubigern der an der Verschmelzung beteiligten Rechtsträger ist, wenn sie binnen sechs Monaten nach dem Tag, an dem die Eintragung der Verschmelzung in das Register des Sitzes derjenigen Rechtsträger deren Gläubiger sie sind, nach § 19 Absatz 3 UmwG als bekanntgemacht gilt, ihren Anspruch nach Grund und Höhe schriftlich anmelden, Sicherheit zu leisten, soweit sie nicht Befriedigung verlangen können. Dieses Recht steht den Gläubigern jedoch nur zu, wenn sie glaubhaft machen, dass durch die Verschmelzung die Erfüllung ihrer Forderung gefährdet wird."
    },
    {
      "date": "2025-07-15",
      "id": "115962",
      "original_text": "Registerbekanntmachung nach dem Umwandlungsgesetz\nNordrhein-Westfalen Amtsgericht Siegen HRB 10713\nPOLYGON Deutschland GmbH – Olpe",
      "type": "Registerbekanntmachung nach dem Umwandlungsgesetz",
      "state": "Nordrhein-Westfalen",
      "amtsgericht": "Amtsgericht Siegen",
      "registernummer": "HRB 10713",
      "registerart": "HRB",
      "company_name": "POLYGON Deutschland GmbH",
      "company_seat": "Olpe",
      "details": "15.07.2025 (Bekanntmachungsdatum)\n\nNordrhein-Westfalen Amtsgericht Siegen HRB 10713\nRegisterbekanntmachung nach dem Umwandlungsgesetz 15.07.2025 (Eintragungsdatum)\n\nPOLYGON Deutschland GmbH\nGesellschaft mit beschränkter Haftung\nOlpe\n\nDen Gläubigern der an der Verschmelzung beteiligten Rechtsträger ist, wenn sie binnen sechs Monaten nach dem Tag, an dem die Eintragung der Verschmelzung in das Register des Sitzes derjenigen Rechtsträger deren Gläubiger sie sind, nach § 19 Absatz 3 UmwG als bekanntgemacht gilt, ihren Anspruch nach Grund und Höhe schriftlich anmelden, Sicherheit zu leisten, soweit sie nicht Befriedigung verlangen können. Dieses Recht steht den Gläubigern jedoch nur zu, wenn sie glaubhaft machen, dass durch die Verschmelzung die Erfüllung ihrer Forderung gefährdet wird."
    },
    {
      "date": "2025-07-15",
      "id": "115963",
      "original_text": "Registerbekanntmachung nach dem Umwandlungsgesetz\nNordrhein-Westfalen Amtsgericht Siegen HRB 5459\nHAI Beteiligungsgesellschaft mbH – Freudenberg",
      "type": "Registerbekanntmachung nach dem Umwandlungsgesetz",
      "state": "Nordrhein-Westfalen",
      "amtsgericht": "Amtsgericht Siegen",
      "registernummer": "HRB 5459",
      "registerart": "HRB",
      "company_name": "HAI Beteiligungsgesellschaft mbH",
      "company_seat": "Freudenberg",
      "details": "15.07.2025 (Bekanntmachungsdatum)\n\nNordrhein-Westfalen Amtsgericht Siegen HRB 5459\nRegisterbekanntmachung nach dem Umwandlungsgesetz 17.05.2025 (Eintragungsdatum)\n\nHAI Beteiligungsgesellschaft mbH\nGesellschaft mit beschränkter Haftung\nFreudenberg\n\nDen Gläubigern der an der Verschmelzung beteiligten Rechtsträger ist, wenn sie binnen sechs Monaten nach dem Tag, an dem die Eintragung der Verschmelzung in das Register des Sitzes derjenigen Rechtsträger deren Gläubiger sie sind, nach § 19 Absatz 3 UmwG als bekanntgemacht gilt, ihren Anspruch nach Grund und Höhe schriftlich anmelden, Sicherheit zu leisten, soweit sie nicht Befriedigung verlangen können. Dieses Recht steht den Gläubigern jedoch nur zu, wenn sie glaubhaft machen, dass durch die Verschmelzung die Erfüllung ihrer Forderung gefährdet wird."
    },
    {
      "date": "2025-07-15",
      "id": "115964",
      "original_text": "Registerbekanntmachung nach dem Umwandlungsgesetz\nNordrhein-Westfalen Amtsgericht Siegen HRB 3773\ndtp Hoffmann GmbH – Freudenberg",
      "type": "Registerbekanntmachung nach dem Umwandlungsgesetz",
      "state": "Nordrhein-Westfalen",
      "amtsgericht": "Amtsgericht Siegen",
      "registernummer": "HRB 3773",
      "registerart": "HRB",
      "company_name": "dtp Hoffmann GmbH",
      "company_seat": "Freudenberg",
      "details": "15.07.2025 (Bekanntmachungsdatum)\n\nNordrhein-Westfalen Amtsgericht Siegen HRB 3773\nRegisterbekanntmachung nach dem Umwandlungsgesetz 17.05.2025 (Eintragungsdatum)\n\ndtp Hoffmann GmbH\nGesellschaft mit beschränkter Haftung\nFreudenberg\n\nDen Gläubigern der an der Verschmelzung beteiligten Rechtsträger ist, wenn sie binnen sechs Monaten nach dem Tag, an dem die Eintragung der Verschmelzung in das Register des Sitzes derjenigen Rechtsträger deren Gläubiger sie sind, nach § 19 Absatz 3 UmwG als bekanntgemacht gilt, ihren Anspruch nach Grund und Höhe schriftlich anmelden, Sicherheit zu leisten, soweit sie nicht Befriedigung verlangen können. Dieses Recht steht den Gläubigern jedoch nur zu, wenn sie glaubhaft machen, dass durch die Verschmelzung die Erfüllung ihrer Forderung gefährdet wird."
    },
    {
      "date": "2025-07-15",
      "id": "115965",
      "original_text": "Löschungsankündigung\nNordrhein-Westfalen Amtsgericht Aachen HRB 18609\nSystemhaus-Schönen UG (haftungsbeschränkt) – Aachen",
      "type": "Löschungsankündigung",
      "state": "Nordrhein-Westfalen",
      "amtsgericht": "Amtsgericht Aachen",
      "registernummer": "HRB 18609",
      "registerart": "HRB",
      "company_name": "Systemhaus-Schönen UG (haftungsbeschränkt)",
      "company_seat": "Aachen",
      "details": "15.07.2025 (Bekanntmachungsdatum)\n\nNordrhein-Westfalen Amtsgericht Aachen HRB 18609\nLöschungsankündigung\n\nSystemhaus-Schönen UG (haftungsbeschränkt)\nGesellschaft mit beschränkter Haftung\nAachen\n\nDas Registergericht beabsichtigt, von Amts wegen die Gesellschaft wegen Vermögenslosigkeit nach § 394 FamFG zu löschen, weil das Finanzamt Aachen-Stadt mit Schreiben vom 15.05.2025 Umstände mitgeteilt hat, aufgrund derer das Gericht davon überzeugt ist, dass die Gesellschaft vollständig vermögenslos ist.\n\nZur Geltendmachung des Widerspruchs gegen die beabsichtigte Löschung wird hiermit eine Frist von einem Monat ab Veröffentlichung dieser Ankündigung bestimmt.\n\nRechtsbehelfsbelehrung:\n\nGegen diese Verfügung kann Widerspruch eingelegt werden. Zum Widerspruch ist jeder berechtigt, der an der Unterlassung der Löschung ein berechtigtes Interesse hat.\n\nDer Widerspruch ist bei dem Amtsgericht Aachen, Adalbertsteinweg 92, 52070 Aachen schriftlich in deutscher Sprache oder zur Niederschrift der Geschäftsstelle einzulegen. Der Widerspruch kann auch zur Niederschrift der Geschäftsstelle eines jeden Amtsgerichtes abgegeben werden.\n\nDer Widerspruch muss spätestens innerhalb der gesetzten Frist nach der Bekanntgabe der Verfügung bei dem Amtsgericht Aachen eingegangen sein. Dies gilt auch dann, wenn der Widerspruch zur Niederschrift der Geschäftsstelle eines anderen Amtsgerichtes abgegeben wurde. Die Frist beginnt mit der Bekanntgabe der Verfügung durch Veröffentlichung. Fällt das Ende der Frist auf einen Sonntag, einen allgemeinen Feiertag oder Sonnabend, so endet die Frist mit Ablauf des nächsten Werktages.\n\nDer Widerspruch muss die Bezeichnung der angefochtenen Verfügung sowie die Erklärung enthalten, dass Widerspruch gegen diese Verfügung eingelegt wird. Er ist zu unterzeichnen und soll begründet werden.\n\nDie Einlegung ist auch durch Übertragung eines elektronischen Dokuments an die elektronische Poststelle des Gerichts möglich. Das elektronische Dokument muss für die Bearbeitung durch das Gericht geeignet und mit einer qualifizierten elektronischen Signatur der verantwortenden Person versehen sein oder von der verantwortenden Person signiert und auf einem sicheren Übermittlungsweg gemäß § 130 a ZPO nach näherer Maßgabe der Verordnung über die technischen Rahmenbedingungen des elektronischen Rechtsverkehrs und über das besondere elektronische Behördenpostfach (BGBl. I, S. 3803) eingereicht werden. Weitere Informationen erhalten Sie auf der Internetseite www.justiz.de."
    },
    {
      "date": "2025-07-15",
      "id": "115966",
      "original_text": "Registerbekanntmachung nach dem Umwandlungsgesetz\nNordrhein-Westfalen Amtsgericht Düsseldorf HRA 28192\nBSU-Consult eK – Monheim am Rhein",
      "type": "Registerbekanntmachung nach dem Umwandlungsgesetz",
      "state": "Nordrhein-Westfalen",
      "amtsgericht": "Amtsgericht Düsseldorf",
      "registernummer": "HRA 28192",
      "registerart": "HRA",
      "company_name": "BSU-Consult eK",
      "company_seat": "Monheim am Rhein",
      "details": "15.07.2025 (Bekanntmachungsdatum)\n\nNordrhein-Westfalen Amtsgericht Düsseldorf HRA 28192\nRegisterbekanntmachung nach dem Umwandlungsgesetz 15.07.2025 (Eintragungsdatum)\n\nBSU-Consult eK\nEinzelkaufmann / Einzelkauffrau\nMonheim am Rhein\n\nDen Gläubigern der an der Ausgliederung beteiligten Rechtsträger ist, wenn sie binnen sechs Monaten nach dem Tag, an dem die Eintragung der Ausgliederung in das Register des Sitzes desjenigen Rechtsträgers, dessen Gläubiger sie sind, nach § 19 Absatz 3 UmwG als bekanntgemacht gilt, ihren Anspruch nach Grund und Höhe schriftlich anmelden, Sicherheit zu leisten, soweit sie nicht Befriedigung verlangen können. Dieses Recht steht den Gläubigern jedoch nur zu, wenn sie glaubhaft machen, dass durch die Ausgliederung die Erfüllung ihrer Forderung gefährdet wird."
    },
    {
      "date": "2025-07-15",
      "id": "115967",
      "original_text": "Registerbekanntmachung nach dem Umwandlungsgesetz\nNordrhein-Westfalen Amtsgericht Düsseldorf HRB 78156\nPizF GmbH – Düsseldorf",
      "type": "Registerbekanntmachung nach dem Umwandlungsgesetz",
      "state": "Nordrhein-Westfalen",
      "amtsgericht": "Amtsgericht Düsseldorf",
      "registernummer": "HRB 78156",
      "registerart": "HRB",
      "company_name": "PizF GmbH",
      "company_seat": "Düsseldorf",
      "details": "15.07.2025 (Bekanntmachungsdatum)\n\nNordrhein-Westfalen Amtsgericht Düsseldorf HRB 78156\nRegisterbekanntmachung nach dem Umwandlungsgesetz 15.07.2025 (Eintragungsdatum)\n\nPizF GmbH\nGesellschaft mit beschränkter Haftung\nDüsseldorf\n\nDen Gläubigern der an der Verschmelzung beteiligten Rechtsträger ist, wenn sie binnen sechs Monaten nach dem Tag, an dem die Eintragung der Verschmelzung in das Register des Sitzes desjenigen Rechtsträgers, dessen Gläubiger sie sind, nach § 19 Absatz 3 UmwG als bekanntgemacht gilt, ihren Anspruch nach Grund und Höhe schriftlich anmelden, Sicherheit zu leisten, soweit sie nicht Befriedigung verlangen können. Dieses Recht steht den Gläubigern jedoch nur zu, wenn sie glaubhaft machen, dass durch die Verschmelzung die Erfüllung ihrer Forderung gefährdet wird."
    },
    {
      "date": "2025-07-15",
      "id": "115968",
      "original_text": "Registerbekanntmachung nach dem Umwandlungsgesetz\nNordrhein-Westfalen Amtsgericht Neuss HRB 23482\nMaler Gasthuber GmbH – Meerbusch",
      "type": "Registerbekanntmachung nach dem Umwandlungsgesetz",
      "state": "Nordrhein-Westfalen",
      "amtsgericht": "Amtsgericht Neuss",
      "registernummer": "HRB 23482",
      "registerart": "HRB",
      "company_name": "Maler Gasthuber GmbH",
      "company_seat": "Meerbusch",
      "details": "15.07.2025 (Bekanntmachungsdatum)\n\nNordrhein-Westfalen Amtsgericht Neuss HRB 23482\nRegisterbekanntmachung nach dem Umwandlungsgesetz 15.07.2025 (Eintragungsdatum)\n\nMaler Gasthuber GmbH\nGesellschaft mit beschränkter Haftung\nMeerbusch\n\nDen Gläubigern der an der Ausgliederung beteiligten Rechtsträger ist, wenn sie binnen sechs Monaten nach dem Tag, an dem die Eintragung der Ausgliederung in das Register des Sitzes derjenigen Rechtsträger deren Gläubiger sie sind, nach § 19 Absatz 3 UmwG als bekanntgemacht gilt, ihren Anspruch nach Grund und Höhe schriftlich anmelden, Sicherheit zu leisten, soweit sie nicht Befriedigung verlangen können. Dieses Recht steht den Gläubigern jedoch nur zu, wenn sie glaubhaft machen, dass durch die Ausgliederung die Erfüllung ihrer Forderung gefährdet wird."
    },
    {
      "date": "2025-07-15",
      "id": "115969",
      "original_text": "Löschungsankündigung\nNordrhein-Westfalen Amtsgericht Köln HRB 90766\nNew Chapter GmbH – Leverkusen",
      "type": "Löschungsankündigung",
      "state": "Nordrhein-Westfalen",
      "amtsgericht": "Amtsgericht Köln",
      "registernummer": "HRB 90766",
      "registerart": "HRB",
      "company_name": "New Chapter GmbH",
      "company_seat": "Leverkusen",
      "details": "15.07.2025 (Bekanntmachungsdatum)\n\nNordrhein-Westfalen Amtsgericht Köln HRB 90766\nLöschungsankündigung\n\nNew Chapter GmbH\nGesellschaft mit beschränkter Haftung\nLeverkusen\n\nDas Registergericht beabsichtigt die Gesellschaft von Amts wegen nach § 394 FamFG zu löschen. Die Frist zur Erhebung eines Widerspruchs ist auf einen Monat festgesetzt."
    },
    {
      "date": "2025-07-15",
      "id": "115970",
      "original_text": "Registerbekanntmachung nach dem Umwandlungsgesetz\nNordrhein-Westfalen Amtsgericht Siegburg HRB 2515\nUnicorn Software Gesellschaft für Datenverarbeitung mbH – Neunkirchen-Seelscheid",
      "type": "Registerbekanntmachung nach dem Umwandlungsgesetz",
      "state": "Nordrhein-Westfalen",
      "amtsgericht": "Amtsgericht Siegburg",
      "registernummer": "HRB 2515",
      "registerart": "HRB",
      "company_name": "Unicorn Software Gesellschaft für Datenverarbeitung mbH",
      "company_seat": "Neunkirchen-Seelscheid",
      "details": "15.07.2025 (Bekanntmachungsdatum)\n\nNordrhein-Westfalen Amtsgericht Siegburg HRB 2515\nRegisterbekanntmachung nach dem Umwandlungsgesetz 15.07.2025 (Eintragungsdatum)\n\nUnicorn Software Gesellschaft für Datenverarbeitung mbH\nGesellschaft mit beschränkter Haftung\nNeunkirchen-Seelscheid\n\nDen Gläubigern der an der Verschmelzung beteiligten Rechtsträger ist, wenn sie binnen sechs Monaten nach dem Tag, an dem die Eintragung der Verschmelzung in das Register des Sitzes desjenigen Rechtsträgers, dessen Gläubiger sie sind, nach § 19 Absatz 3 UmwG als bekanntgemacht gilt, ihren Anspruch nach Grund und Höhe schriftlich anmelden, Sicherheit zu leisten, soweit sie nicht Befriedigung verlangen können. Dieses Recht steht den Gläubigern jedoch nur zu, wenn sie glaubhaft machen, dass durch die Verschmelzung die Erfüllung ihrer Forderung gefährdet wird."
    },
    {
      "date": "2025-07-15",
      "id": "115971",
      "original_text": "Löschungsankündigung\nNordrhein-Westfalen Amtsgericht Köln HRB 109190\nBetter Home Real Estate GmbH – Leichlingen",
      "type": "Löschungsankündigung",
      "state": "Nordrhein-Westfalen",
      "amtsgericht": "Amtsgericht Köln",
      "registernummer": "HRB 109190",
      "registerart": "HRB",
      "company_name": "Better Home Real Estate GmbH",
      "company_seat": "Leichlingen",
      "details": "15.07.2025 (Bekanntmachungsdatum)\n\nNordrhein-Westfalen Amtsgericht Köln HRB 109190\nLöschungsankündigung\n\nBetter Home Real Estate GmbH\nGesellschaft mit beschränkter Haftung\nLeichlingen\n\nDas Registergericht beabsichtigt die Gesellschaft von Amts wegen nach § 394 FamFG zu löschen. Die Frist zur Erhebung eines Widerspruchs ist auf einen Monat festgesetzt."
    },
    {
      "date": "2025-07-15",
      "id": "115972",
      "original_text": "Registerbekanntmachung nach dem Umwandlungsgesetz\nNordrhein-Westfalen Amtsgericht Düsseldorf HRA 28289\nEuro Collect EOOD & Co. KG – Monheim am Rhein",
      "type": "Registerbekanntmachung nach dem Umwandlungsgesetz",
      "state": "Nordrhein-Westfalen",
      "amtsgericht": "Amtsgericht Düsseldorf",
      "registernummer": "HRA 28289",
      "registerart": "HRA",
      "company_name": "Euro Collect EOOD & Co. KG",
      "company_seat": "Monheim am Rhein",
      "details": "15.07.2025 (Bekanntmachungsdatum)\n\nNordrhein-Westfalen Amtsgericht Düsseldorf HRA 28289\nRegisterbekanntmachung nach dem Umwandlungsgesetz 15.07.2025 (Eintragungsdatum)\n\nEuro Collect EOOD & Co. KG\nKommanditgesellschaft\nMonheim am Rhein\n\nDen Gläubigern der an der formwechselnden Umwandlung beteiligten Rechtsträger ist, wenn sie binnen sechs Monaten nach dem Tag, an dem die Eintragung der formwechselnden Umwandlung in das Register des Sitzes desjenigen Rechtsträgers, dessen Gläubiger sie sind, nach § 19 Absatz 3 UmwG als bekanntgemacht gilt, ihren Anspruch nach Grund und Höhe schriftlich anmelden, Sicherheit zu leisten, soweit sie nicht Befriedigung verlangen können. Dieses Recht steht den Gläubigern jedoch nur zu, wenn sie glaubhaft machen, dass durch die formwechselnden Umwandlung die Erfüllung ihrer Forderung gefährdet wird."
    },
    {
      "date": "2025-07-15",
      "id": "115973",
      "original_text": "Einreichung neuer Dokumente\nNordrhein-Westfalen Amtsgericht Essen HRB 32959\nTrionista SE – Essen",
      "type": "Einreichung neuer Dokumente",
      "state": "Nordrhein-Westfalen",
      "amtsgericht": "Amtsgericht Essen",
      "registernummer": "HRB 32959",
      "registerart": "HRB",
      "company_name": "Trionista SE",
      "company_seat": "Essen",
      "details": "15.07.2025 (Bekanntmachungsdatum)\n\nNordrhein-Westfalen Amtsgericht Essen HRB 32959\nEinreichung neuer Dokumente\n\nTrionista SE\nEuropäische Aktiengesellschaft (SE)\nEssen\n\nDem Registergericht ist eine neue Liste der Mitglieder des Aufsichtsrates eingereicht worden."
    },
    {
      "date": "2025-07-15",
      "id": "115974",
      "original_text": "Registerbekanntmachung nach dem Umwandlungsgesetz\nNordrhein-Westfalen Amtsgericht Hamm HRB 7455\nVerlag Christliche Woche GmbH – Hamm",
      "type": "Registerbekanntmachung nach dem Umwandlungsgesetz",
      "state": "Nordrhein-Westfalen",
      "amtsgericht": "Amtsgericht Hamm",
      "registernummer": "HRB 7455",
      "registerart": "HRB",
      "company_name": "Verlag Christliche Woche GmbH",
      "company_seat": "Hamm",
      "details": "15.07.2025 (Bekanntmachungsdatum)\n\nNordrhein-Westfalen Amtsgericht Hamm HRB 7455\nRegisterbekanntmachung nach dem Umwandlungsgesetz 09.07.2025 (Eintragungsdatum)\n\nVerlag Christliche Woche GmbH\nGesellschaft mit beschränkter Haftung\nHamm\n\nDen Gläubigern der an der Verschmelzung beteiligten Rechtsträger ist, wenn sie binnen sechs Monaten nach dem Tag, an dem die Eintragung der Verschmelzung in das Register des Sitzes desjenigen Rechtsträgers, dessen Gläubiger sie sind, nach § 19 Absatz 3 UmwG als bekanntgemacht gilt, ihren Anspruch nach Grund und Höhe schriftlich anmelden, Sicherheit zu leisten, soweit sie nicht Befriedigung verlangen können. Dieses Recht steht den Gläubigern jedoch nur zu, wenn sie glaubhaft machen, dass durch die Verschmelzung die Erfüllung ihrer Forderung gefährdet wird."
    },
    {
      "date": "2025-07-15",
      "id": "115975",
      "original_text": "Löschungsankündigung\nNordrhein-Westfalen Amtsgericht Hagen HRB 12138\nRheinstein Freight Broker GmbH – Gevelsberg",
      "type": "Löschungsankündigung",
      "state": "Nordrhein-Westfalen",
      "amtsgericht": "Amtsgericht Hagen",
      "registernummer": "HRB 12138",
      "registerart": "HRB",
      "company_name": "Rheinstein Freight Broker GmbH",
      "company_seat": "Gevelsberg",
      "details": "15.07.2025 (Bekanntmachungsdatum)\n\nNordrhein-Westfalen Amtsgericht Hagen HRB 12138\nLöschungsankündigung\n\nRheinstein Freight Broker GmbH\nGesellschaft mit beschränkter Haftung\nGevelsberg\n\nDas Registergericht beabsichtigt, die im Handelsregister eingetragene Gesellschaft gemäß § 394 Absatz 1 FamFG wegen Vermögenslosigkeit von Amts wegen zu löschen.  Gegen diese Verfügung kann Widerspruch eingelegt werden. Die Frist zur Erhebung eines Widerspruchs gegen die beabsichtigte Löschung von Amts wegen ist auf drei Monate festgesetzt.\n\nRechtsbehelfsbelehrung:\nGegen diese Verfügung können Sie Widerspruch einlegen.\n\nDer Widerspruch ist bei dem Amtsgericht Hagen, Heinitzstraße 42, 58097 Hagen schriftlich in deutscher Sprache oder zur Niederschrift der Geschäftsstelle einzulegen. Der Widerspruch kann auch zur Niederschrift der Geschäftsstelle eines jeden Amtsgerichtes abgegeben werden.\n\nDer Widerspruch muss spätestens innerhalb der gesetzten Frist bei dem Amtsgericht Hagen eingegangen sein. Dies gilt auch dann, wenn der Widerspruch zur Niederschrift der Geschäftsstelle eines anderen Amtsgerichtes abgegeben wurde. Die Frist beginnt mit der Veröffentlichung. Fällt das Ende der Frist auf einen Sonntag, einen allgemeinen Feiertag oder Sonnabend, so endet die Frist mit Ablauf des nächsten Werktages.\n\nDer Widerspruch muss die Bezeichnung der angefochtenen Verfügung sowie die Erklärung enthalten, dass Widerspruch gegen diese Verfügung eingelegt wird. Er ist zu unterzeichnen und soll begründet werden."
    },
    {
      "date": "2025-07-15",
      "id": "115976",
      "original_text": "Löschungsankündigung\nNordrhein-Westfalen Amtsgericht Köln HRA 10261\nHans Böhne Immobilien KG – Köln",
      "type": "Löschungsankündigung",
      "state": "Nordrhein-Westfalen",
      "amtsgericht": "Amtsgericht Köln",
      "registernummer": "HRA 10261",
      "registerart": "HRA",
      "company_name": "Hans Böhne Immobilien KG",
      "company_seat": "Köln",
      "details": "15.07.2025 (Bekanntmachungsdatum)\n\nNordrhein-Westfalen Amtsgericht Köln HRA 10261\nLöschungsankündigung\n\nHans Böhne Immobilien KG\nKommanditgesellschaft\nKöln"
    },
    {
      "date": "2025-07-15",
      "id": "115977",
      "original_text": "Sonstige Registerbekanntmachung\nNordrhein-Westfalen Amtsgericht Gütersloh HRB 4284\nBITel Gesellschaft für Telekommunikation mbH – Gütersloh",
      "type": "Sonstige Registerbekanntmachung",
      "state": "Nordrhein-Westfalen",
      "amtsgericht": "Amtsgericht Gütersloh",
      "registernummer": "HRB 4284",
      "registerart": "HRB",
      "company_name": "BITel Gesellschaft für Telekommunikation mbH",
      "company_seat": "Gütersloh",
      "details": "15.07.2025 (Bekanntmachungsdatum)\n\nNordrhein-Westfalen Amtsgericht Gütersloh HRB 4284\nSonstige Registerbekanntmachung 15.07.2025 (Eintragungsdatum)\n\nBITel Gesellschaft für Telekommunikation mbH\nGesellschaft mit beschränkter Haftung\nGütersloh\n\nDem Registergericht ist eine Liste der Mitglieder des Aufsichtsrates eingereicht worden."
    },
    {
      "date": "2025-07-15",
      "id": "115978",
      "original_text": "Registerbekanntmachung nach dem Umwandlungsgesetz\nNordrhein-Westfalen Amtsgericht Siegen HRA 10048\nLandhotel Voss GmbH & Co. KG – Lennestadt",
      "type": "Registerbekanntmachung nach dem Umwandlungsgesetz",
      "state": "Nordrhein-Westfalen",
      "amtsgericht": "Amtsgericht Siegen",
      "registernummer": "HRA 10048",
      "registerart": "HRA",
      "company_name": "Landhotel Voss GmbH & Co. KG",
      "company_seat": "Lennestadt",
      "details": "15.07.2025 (Bekanntmachungsdatum)\n\nNordrhein-Westfalen Amtsgericht Siegen HRA 10048\nRegisterbekanntmachung nach dem Umwandlungsgesetz 15.07.2025 (Eintragungsdatum)\n\nLandhotel Voss GmbH & Co. KG\nKommanditgesellschaft\nLennestadt\n\nDen Gläubigern der an der Ausgliederung beteiligten Rechtsträger ist, wenn sie binnen sechs Monaten nach dem Tag, an dem die Eintragung der Ausgliederung in das Register des Sitzes desjenigen Rechtsträgers, dessen Gläubiger sie sind, nach § 19 Absatz 3 UmwG als bekanntgemacht gilt, ihren Anspruch nach Grund und Höhe schriftlich anmelden, Sicherheit zu leisten, soweit sie nicht Befriedigung verlangen können. Dieses Recht steht den Gläubigern jedoch nur zu, wenn sie glaubhaft machen, dass durch die Ausgliederung die Erfüllung ihrer Forderung gefährdet wird."
    },
    {
      "date": "2025-07-15",
      "id": "115979",
      "original_text": "Einreichung neuer Dokumente\nNordrhein-Westfalen Amtsgericht Köln HRB 672\nAXA Konzern Aktiengesellschaft – Köln",
      "type": "Einreichung neuer Dokumente",
      "state": "Nordrhein-Westfalen",
      "amtsgericht": "Amtsgericht Köln",
      "registernummer": "HRB 672",
      "registerart": "HRB",
      "company_name": "AXA Konzern Aktiengesellschaft",
      "company_seat": "Köln",
      "details": "15.07.2025 (Bekanntmachungsdatum)\n\nNordrhein-Westfalen Amtsgericht Köln HRB 672\nEinreichung neuer Dokumente\n\nAXA Konzern Aktiengesellschaft\nAktiengesellschaft\nKöln\n\nDem Registergericht ist eine Liste der Mitglieder des Aufsichtsrates eingereicht worden."
    },
    {
      "date": "2025-07-15",
      "id": "115980",
      "original_text": "Registerbekanntmachung nach dem Umwandlungsgesetz\nNordrhein-Westfalen Amtsgericht Arnsberg HRB 9199\nTIG Energiesysteme GmbH – Soest",
      "type": "Registerbekanntmachung nach dem Umwandlungsgesetz",
      "state": "Nordrhein-Westfalen",
      "amtsgericht": "Amtsgericht Arnsberg",
      "registernummer": "HRB 9199",
      "registerart": "HRB",
      "company_name": "TIG Energiesysteme GmbH",
      "company_seat": "Soest",
      "details": "15.07.2025 (Bekanntmachungsdatum)\n\nNordrhein-Westfalen Amtsgericht Arnsberg HRB 9199\nRegisterbekanntmachung nach dem Umwandlungsgesetz 15.07.2025 (Eintragungsdatum)\n\nTIG Energiesysteme GmbH\nGesellschaft mit beschränkter Haftung\nSoest\n\nDen Gläubigern der an der Verschmelzung beteiligten Rechtsträger ist, wenn sie binnen sechs Monaten nach dem Tag, an dem die Eintragung der Verschmelzung in das Register des Sitzes desjenigen Rechtsträgers, dessen Gläubiger sie sind, nach § 19 Absatz 3 UmwG als bekanntgemacht gilt, ihren Anspruch nach Grund und Höhe schriftlich anmelden, Sicherheit zu leisten, soweit sie nicht Befriedigung verlangen können. Dieses Recht steht den Gläubigern jedoch nur zu, wenn sie glaubhaft machen, dass durch die Verschmelzung die Erfüllung ihrer Forderung gefährdet wird."
    },
    {
      "date": "2025-07-15",
      "id": "115981",
      "original_text": "Registerbekanntmachung nach dem Umwandlungsgesetz\nNordrhein-Westfalen Amtsgericht Münster HRB 14744\nS. Weritz Beteiligungs GmbH – Everswinkel",
      "type": "Registerbekanntmachung nach dem Umwandlungsgesetz",
      "state": "Nordrhein-Westfalen",
      "amtsgericht": "Amtsgericht Münster",
      "registernummer": "HRB 14744",
      "registerart": "HRB",
      "company_name": "S. Weritz Beteiligungs GmbH",
      "company_seat": "Everswinkel",
      "details": "15.07.2025 (Bekanntmachungsdatum)\n\nNordrhein-Westfalen Amtsgericht Münster HRB 14744\nRegisterbekanntmachung nach dem Umwandlungsgesetz 15.07.2025 (Eintragungsdatum)\n\nS. Weritz Beteiligungs GmbH\nGesellschaft mit beschränkter Haftung\nEverswinkel\n\nDen Gläubigern der an der Verschmelzung beteiligten Rechtsträger ist, wenn sie binnen sechs Monaten nach dem Tag, an dem die Eintragung der Verschmelzung in das Register des Sitzes desjenigen Rechtsträgers, dessen Gläubiger sie sind, nach § 19 Absatz 3 UmwG als bekanntgemacht gilt, ihren Anspruch nach Grund und Höhe schriftlich anmelden, Sicherheit zu leisten, soweit sie nicht Befriedigung verlangen können. Dieses Recht steht den Gläubigern jedoch nur zu, wenn sie glaubhaft machen, dass durch die Verschmelzung die Erfüllung ihrer Forderung gefährdet wird."
    },
    {
      "date": "2025-07-15",
      "id": "115982",
      "original_text": "Registerbekanntmachung nach dem Umwandlungsgesetz\nNordrhein-Westfalen Amtsgericht Münster HRB 9609\nAMSBECK-Maschinentechnik GmbH – Everswinkel",
      "type": "Registerbekanntmachung nach dem Umwandlungsgesetz",
      "state": "Nordrhein-Westfalen",
      "amtsgericht": "Amtsgericht Münster",
      "registernummer": "HRB 9609",
      "registerart": "HRB",
      "company_name": "AMSBECK-Maschinentechnik GmbH",
      "company_seat": "Everswinkel",
      "details": "15.07.2025 (Bekanntmachungsdatum)\n\nNordrhein-Westfalen Amtsgericht Münster HRB 9609\nRegisterbekanntmachung nach dem Umwandlungsgesetz 15.07.2025 (Eintragungsdatum)\n\nAMSBECK-Maschinentechnik GmbH\nGesellschaft mit beschränkter Haftung\nEverswinkel\n\nDen Gläubigern der an der Verschmelzung beteiligten Rechtsträger ist, wenn sie binnen sechs Monaten nach dem Tag, an dem die Eintragung der Verschmelzung in das Register des Sitzes desjenigen Rechtsträgers, dessen Gläubiger sie sind, nach § 19 Absatz 3 UmwG als bekanntgemacht gilt, ihren Anspruch nach Grund und Höhe schriftlich anmelden, Sicherheit zu leisten, soweit sie nicht Befriedigung verlangen können. Dieses Recht steht den Gläubigern jedoch nur zu, wenn sie glaubhaft machen, dass durch die Verschmelzung die Erfüllung ihrer Forderung gefährdet wird."
    },
    {
      "date": "2025-07-15",
      "id": "115983",
      "original_text": "Löschungsankündigung\nHessen Amtsgericht Frankfurt am Main HRB 53201\nErinc Hoch- und Tiefbau GmbH – Frankfurt am Main",
      "type": "Löschungsankündigung",
      "state": "Hessen",
      "amtsgericht": "Amtsgericht Frankfurt am Main",
      "registernummer": "HRB 53201",
      "registerart": "HRB",
      "company_name": "Erinc Hoch- und Tiefbau GmbH",
      "company_seat": "Frankfurt am Main",
      "details": "15.07.2025 (Bekanntmachungsdatum)\n\nHessen Amtsgericht Frankfurt am Main HRB 53201\nLöschungsankündigung\n\nErinc Hoch- und Tiefbau GmbH\nGesellschaft mit beschränkter Haftung\nFrankfurt am Main\n\nEs ist beabsichtigt die Gesellschaft wegen Vermögenslosigkeit gemäß § 394 FamFG von Amts wegen zu löschen. Hiergegen kann innerhalb eines Monats nach dieser Veröffentlichung Widerspruch bei dem Amtsgericht Frankfurt am Main eingelegt werden."
    },
    {
      "date": "2025-07-15",
      "id": "115984",
      "original_text": "Registerbekanntmachung nach dem Umwandlungsgesetz\nHessen Amtsgericht Darmstadt HRB 1085\nEcho JIE GmbH – Darmstadt",
      "type": "Registerbekanntmachung nach dem Umwandlungsgesetz",
      "state": "Hessen",
      "amtsgericht": "Amtsgericht Darmstadt",
      "registernummer": "HRB 1085",
      "registerart": "HRB",
      "company_name": "Echo JIE GmbH",
      "company_seat": "Darmstadt",
      "details": "15.07.2025 (Bekanntmachungsdatum)\n\nHessen Amtsgericht Darmstadt HRB 1085\nRegisterbekanntmachung nach dem Umwandlungsgesetz 15.07.2025 (Eintragungsdatum)\n\nEcho JIE GmbH\nGesellschaft mit beschränkter Haftung\nDarmstadt\n\nDen Gläubigern der an der Verschmelzung beteiligten Rechtsträger ist, wenn sie binnen sechs Monaten nach dem Tag, an dem die Eintragung der Verschmelzung in das Register des Sitzes derjenigen Rechtsträger deren Gläubiger sie sind, nach § 19 Absatz 3 UmwG bekannt gemacht worden ist, ihren Anspruch nach Grund und Höhe schriftlich anmelden, Sicherheit zu leisten, soweit sie nicht Befriedigung verlangen können. Dieses Recht steht den Gläubigern jedoch nur zu, wenn sie glaubhaft machen, dass durch die Verschmelzung die Erfüllung ihrer Forderung gefährdet wird."
    },
    {
      "date": "2025-07-15",
      "id": "115985",
      "original_text": "Sonstige Registerbekanntmachung\nHessen Amtsgericht Wiesbaden HRB 21589\nWTW Pensionsfonds AG – Wiesbaden",
      "type": "Sonstige Registerbekanntmachung",
      "state": "Hessen",
      "amtsgericht": "Amtsgericht Wiesbaden",
      "registernummer": "HRB 21589",
      "registerart": "HRB",
      "company_name": "WTW Pensionsfonds AG",
      "company_seat": "Wiesbaden",
      "details": "15.07.2025 (Bekanntmachungsdatum)\n\nHessen Amtsgericht Wiesbaden HRB 21589\nSonstige Registerbekanntmachung 15.07.2025 (Eintragungsdatum)\n\nWTW Pensionsfonds AG\nAktiengesellschaft\nWiesbaden\n\nDurch eine Änderung in den Personen der Aufsichtsratsmitglieder ist eine Liste der Mitglieder des Aufsichtsrates zum Handelsregister eingereicht worden."
    },
    {
      "date": "2025-07-15",
      "id": "115986",
      "original_text": "Löschungsankündigung\nHessen Amtsgericht Frankfurt am Main HRB 125451\nTerra Mater Renewables Management GmbH – Frankfurt am Main",
      "type": "Löschungsankündigung",
      "state": "Hessen",
      "amtsgericht": "Amtsgericht Frankfurt am Main",
      "registernummer": "HRB 125451",
      "registerart": "HRB",
      "company_name": "Terra Mater Renewables Management GmbH",
      "company_seat": "Frankfurt am Main",
      "details": "15.07.2025 (Bekanntmachungsdatum)\n\nHessen Amtsgericht Frankfurt am Main HRB 125451\nLöschungsankündigung\n\nTerra Mater Renewables Management GmbH\nGesellschaft mit beschränkter Haftung\nFrankfurt am Main\n\nEs ist beabsichtig, die Gesellschaft wegen Vermögenslosigkeit gemäß § 394 FamFG von Amts wegen im Handelsregister zu löschen. Hiergegen kann innerhalb eines Zeitraums von 1 Monat nach dieser Veröffentlichung Widerspruch bei dem Amtsgericht Frankfurt am Main eingelegt werden."
    },
    {
      "date": "2025-07-15",
      "id": "115987",
      "original_text": "Einreichung neuer Dokumente\nHessen Amtsgericht Wiesbaden HRB 21321\nAmbulance Wiesbaden Erich Traudes GmbH – Wiesbaden",
      "type": "Einreichung neuer Dokumente",
      "state": "Hessen",
      "amtsgericht": "Amtsgericht Wiesbaden",
      "registernummer": "HRB 21321",
      "registerart": "HRB",
      "company_name": "Ambulance Wiesbaden Erich Traudes GmbH",
      "company_seat": "Wiesbaden",
      "details": "15.07.2025 (Bekanntmachungsdatum)\n\nHessen Amtsgericht Wiesbaden HRB 21321\nEinreichung neuer Dokumente\n\nAmbulance Wiesbaden Erich Traudes GmbH\nGesellschaft mit beschränkter Haftung\nWiesbaden\n\nDurch eine Änderung in den Personen der Aufsichtsratsmitglieder ist eine Liste der Mitglieder des Aufsichtsrates zum Handelsregister eingereicht worden."
    },
    {
      "date": "2025-07-15",
      "id": "115988",
      "original_text": "Einreichung neuer Dokumente\nHessen Amtsgericht Frankfurt am Main HRB 86576\nGenerali Pensionsfonds AG – Frankfurt am Main",
      "type": "Einreichung neuer Dokumente",
      "state": "Hessen",
      "amtsgericht": "Amtsgericht Frankfurt am Main",
      "registernummer": "HRB 86576",
      "registerart": "HRB",
      "company_name": "Generali Pensionsfonds AG",
      "company_seat": "Frankfurt am Main",
      "details": "15.07.2025 (Bekanntmachungsdatum)\n\nHessen Amtsgericht Frankfurt am Main HRB 86576\nEinreichung neuer Dokumente 15.07.2025 (Eintragungsdatum)\n\nGenerali Pensionsfonds AG\nAktiengesellschaft\nFrankfurt am Main\n\nDurch eine Änderung in den Personen der Aufsichtsratsmitglieder ist eine Liste der Mitglieder des Aufsichtsrates zum Handelsregister eingereicht worden."
    },
    {
      "date": "2025-07-15",
      "id": "115989",
      "original_text": "Löschungsankündigung\nHessen Amtsgericht Frankfurt am Main HRB 112600\nIDCE GmbH – Frankfurt am Main",
      "type": "Löschungsankündigung",
      "state": "Hessen",
      "amtsgericht": "Amtsgericht Frankfurt am Main",
      "registernummer": "HRB 112600",
      "registerart": "HRB",
      "company_name": "IDCE GmbH",
      "company_seat": "Frankfurt am Main",
      "details": "15.07.2025 (Bekanntmachungsdatum)\n\nHessen Amtsgericht Frankfurt am Main HRB 112600\nLöschungsankündigung\n\nIDCE GmbH\nGesellschaft mit beschränkter Haftung\nFrankfurt am Main\n\nDas Registergericht beabsichtigt die im Handelsregister eingetragene Gesellschaft von Amts wegen nach § 394 FamFG zu löschen. Die Frist zur Erhebung eines Widerspruchs gegen die beabsichtigte Löschung wird auf 1 Monate festgesetzt."
    },
    {
      "date": "2025-07-15",
      "id": "115990",
      "original_text": "Sonstige Registerbekanntmachung\nHessen Amtsgericht Wiesbaden VR 5511\nVerein der Freunde und Förderer der Clemens-Brentano-Schule – Oestrich-Winkel",
      "type": "Sonstige Registerbekanntmachung",
      "state": "Hessen",
      "amtsgericht": "Amtsgericht Wiesbaden",
      "registernummer": "VR 5511",
      "registerart": "VR",
      "company_name": "Verein der Freunde und Förderer der Clemens-Brentano-Schule",
      "company_seat": "Oestrich-Winkel",
      "details": "15.07.2025 (Bekanntmachungsdatum)\n\nHessen Amtsgericht Wiesbaden VR 5511\nSonstige Registerbekanntmachung 15.07.2025 (Eintragungsdatum)\n\nVerein der Freunde und Förderer der Clemens-Brentano-Schule\neingetragener Verein\nOestrich-Winkel\n\nDer Verein ist aufgelöst."
    },
    {
      "date": "2025-07-15",
      "id": "115991",
      "original_text": "Löschungsankündigung\nHessen Amtsgericht Frankfurt am Main HRB 125045\nKunstberg Energie UG (haftungsbeschränkt) – Frankfurt am Main",
      "type": "Löschungsankündigung",
      "state": "Hessen",
      "amtsgericht": "Amtsgericht Frankfurt am Main",
      "registernummer": "HRB 125045",
      "registerart": "HRB",
      "company_name": "Kunstberg Energie UG (haftungsbeschränkt)",
      "company_seat": "Frankfurt am Main",
      "details": "15.07.2025 (Bekanntmachungsdatum)\n\nHessen Amtsgericht Frankfurt am Main HRB 125045\nLöschungsankündigung\n\nKunstberg Energie UG (haftungsbeschränkt)\nGesellschaft mit beschränkter Haftung\nFrankfurt am Main\n\nEs ist beabsichtigt die Gesellschaft wegen Vermögenslosigkeit gemäß § 394 FamFG von Amts wegen zu löschen. Hiergegen kann innerhalb eines Monats nach dieser Veröffentlichung Widerspruch bei dem Amtsgericht Frankfurt am Main eingelegt werden."
    },
    {
      "date": "2025-07-15",
      "id": "115992",
      "original_text": "Löschungsankündigung\nHessen Amtsgericht Frankfurt am Main HRB 84233\nArthair Cutting Club GmbH – Frankfurt am Main",
      "type": "Löschungsankündigung",
      "state": "Hessen",
      "amtsgericht": "Amtsgericht Frankfurt am Main",
      "registernummer": "HRB 84233",
      "registerart": "HRB",
      "company_name": "Arthair Cutting Club GmbH",
      "company_seat": "Frankfurt am Main",
      "details": "15.07.2025 (Bekanntmachungsdatum)\n\nHessen Amtsgericht Frankfurt am Main HRB 84233\nLöschungsankündigung\n\nArthair Cutting Club GmbH\nGesellschaft mit beschränkter Haftung\nFrankfurt am Main\n\nEs ist beabsichtig, die Gesellschaft wegen Vermögenslosigkeit gemäß § 394 FamFG von Amts wegen im Handelsregister zu löschen. Hiergegen kann innerhalb eines Zeitraums von 1 Monat nach dieser Veröffentlichung Widerspruch bei dem Amtsgericht Frankfurt am Main eingelegt werden."
    },
    {
      "date": "2025-07-15",
      "id": "115993",
      "original_text": "Sonstige Registerbekanntmachung\nHessen Amtsgericht Bad Homburg v.d.H. VR 2156\nKVNA Karnevals Verein Neu-Anspach – Neu-Anspach",
      "type": "Sonstige Registerbekanntmachung",
      "state": "Hessen",
      "amtsgericht": "Amtsgericht Bad Homburg v.d.H.",
      "registernummer": "VR 2156",
      "registerart": "VR",
      "company_name": "KVNA Karnevals Verein Neu-Anspach",
      "company_seat": "Neu-Anspach",
      "details": "15.07.2025 (Bekanntmachungsdatum)\n\nHessen Amtsgericht Bad Homburg v.d.H. VR 2156\nSonstige Registerbekanntmachung 15.07.2025 (Eintragungsdatum)\n\nKVNA Karnevals Verein Neu-Anspach\neingetragener Verein\nNeu-Anspach\n\nDer Verein ist aufgelöst."
    },
    {
      "date": "2025-07-15",
      "id": "115994",
      "original_text": "Registerbekanntmachung nach dem Umwandlungsgesetz\nHessen Amtsgericht Wiesbaden HRB 26137\nLudwig Fey Redux UG (haftungsbeschränkt) – Wiesbaden",
      "type": "Registerbekanntmachung nach dem Umwandlungsgesetz",
      "state": "Hessen",
      "amtsgericht": "Amtsgericht Wiesbaden",
      "registernummer": "HRB 26137",
      "registerart": "HRB",
      "company_name": "Ludwig Fey Redux UG (haftungsbeschränkt)",
      "company_seat": "Wiesbaden",
      "details": "15.07.2025 (Bekanntmachungsdatum)\n\nHessen Amtsgericht Wiesbaden HRB 26137\nRegisterbekanntmachung nach dem Umwandlungsgesetz 15.07.2025 (Eintragungsdatum)\n\nLudwig Fey Redux UG (haftungsbeschränkt)\nGesellschaft mit beschränkter Haftung\nWiesbaden\n\nDen Gläubigern der an der Verschmelzung beteiligten Rechtsträger ist, wenn sie binnen sechs Monaten nach dem Tag, an dem die Eintragung der Verschmelzung in das Register des Sitzes derjenigen Rechtsträger deren Gläubiger sie sind, nach § 19 Absatz 3 UmwG bekannt gemacht worden ist, ihren Anspruch nach Grund und Höhe schriftlich anmelden, Sicherheit zu leisten, soweit sie nicht Befriedigung verlangen können. Dieses Recht steht den Gläubigern jedoch nur zu, wenn sie glaubhaft machen, dass durch die Verschmelzung die Erfüllung ihrer Forderung gefährdet wird."
    },
    {
      "date": "2025-07-15",
      "id": "115995",
      "original_text": "Registerbekanntmachung nach dem Umwandlungsgesetz\nHessen Amtsgericht Darmstadt HRA 87464\nIFZU e.K – Groß-Gerau",
      "type": "Registerbekanntmachung nach dem Umwandlungsgesetz",
      "state": "Hessen",
      "amtsgericht": "Amtsgericht Darmstadt",
      "registernummer": "HRA 87464",
      "registerart": "HRA",
      "company_name": "IFZU e.K",
      "company_seat": "Groß-Gerau",
      "details": "15.07.2025 (Bekanntmachungsdatum)\n\nHessen Amtsgericht Darmstadt HRA 87464\nRegisterbekanntmachung nach dem Umwandlungsgesetz 15.07.2025 (Eintragungsdatum)\n\nIFZU e.K\nEinzelkaufmann / Einzelkauffrau\nGroß-Gerau\n\nDen Gläubigern der an der Ausgliederung beteiligten Rechtsträger ist, wenn sie binnen sechs Monaten nach dem Tag, an dem die Eintragung der Ausgliederung in das Register des Sitzes desjenigen Rechtsträgers, dessen Gläubiger sie sind, nach §§ 125, 19 Absatz 3 UmwG bekannt gemacht worden ist, ihren Anspruch nach Grund und Höhe schriftlich anmelden, Sicherheit zu leisten, soweit sie nicht Befriedigung verlangen können. Dieses Recht steht den Gläubigern jedoch nur zu, wenn sie glaubhaft machen, dass durch die Ausgliederung die Erfüllung ihrer Forderung gefährdet wird."
    },
    {
      "date": "2025-07-15",
      "id": "115996",
      "original_text": "Registerbekanntmachung nach dem Umwandlungsgesetz\nHessen Amtsgericht Darmstadt HRB 1249\nEcho Zeitungen GmbH – Darmstadt",
      "type": "Registerbekanntmachung nach dem Umwandlungsgesetz",
      "state": "Hessen",
      "amtsgericht": "Amtsgericht Darmstadt",
      "registernummer": "HRB 1249",
      "registerart": "HRB",
      "company_name": "Echo Zeitungen GmbH",
      "company_seat": "Darmstadt",
      "details": "15.07.2025 (Bekanntmachungsdatum)\n\nHessen Amtsgericht Darmstadt HRB 1249\nRegisterbekanntmachung nach dem Umwandlungsgesetz 15.07.2025 (Eintragungsdatum)\n\nEcho Zeitungen GmbH\nGesellschaft mit beschränkter Haftung\nDarmstadt\n\nDen Gläubigern der an der Verschmelzung beteiligten Rechtsträger ist, wenn sie binnen sechs Monaten nach dem Tag, an dem die Eintragung der Verschmelzung in das Register des Sitzes derjenigen Rechtsträger deren Gläubiger sie sind, nach § 19 Absatz 3 UmwG bekannt gemacht worden ist, ihren Anspruch nach Grund und Höhe schriftlich anmelden, Sicherheit zu leisten, soweit sie nicht Befriedigung verlangen können. Dieses Recht steht den Gläubigern jedoch nur zu, wenn sie glaubhaft machen, dass durch die Verschmelzung die Erfüllung ihrer Forderung gefährdet wird."
    },
    {
      "date": "2025-07-15",
      "id": "115997",
      "original_text": "Registerbekanntmachung nach dem Umwandlungsgesetz\nHessen Amtsgericht Fulda HRB 8209\nKSE Konzept GmbH – Eichenzell",
      "type": "Registerbekanntmachung nach dem Umwandlungsgesetz",
      "state": "Hessen",
      "amtsgericht": "Amtsgericht Fulda",
      "registernummer": "HRB 8209",
      "registerart": "HRB",
      "company_name": "KSE Konzept GmbH",
      "company_seat": "Eichenzell",
      "details": "15.07.2025 (Bekanntmachungsdatum)\n\nHessen Amtsgericht Fulda HRB 8209\nRegisterbekanntmachung nach dem Umwandlungsgesetz 15.07.2025 (Eintragungsdatum)\n\nKSE Konzept GmbH\nGesellschaft mit beschränkter Haftung\nEichenzell\n\nDen Gläubigern der an der Verschmelzung beteiligten Rechtsträger ist, wenn sie binnen sechs Monaten nach dem Tag, an dem die Eintragung der Verschmelzung in das Register des Sitzes desjenigen Rechtsträgers, dessen Gläubiger sie sind, nach § 19 Absatz 3 UmwG bekannt gemacht worden ist, ihren Anspruch nach Grund und Höhe schriftlich anmelden, Sicherheit zu leisten, soweit sie nicht Befriedigung verlangen können. Dieses Recht steht den Gläubigern jedoch nur zu, wenn sie glaubhaft machen, dass durch die Verschmelzung die Erfüllung ihrer Forderung gefährdet wird."
    },
    {
      "date": "2025-07-15",
      "id": "115998",
      "original_text": "Registerbekanntmachung nach dem Umwandlungsgesetz\nHessen Amtsgericht Frankfurt am Main HRA 54203\nCosmo Properties 1 (WBR) B.V. & Co. KG – Frankfurt am Main",
      "type": "Registerbekanntmachung nach dem Umwandlungsgesetz",
      "state": "Hessen",
      "amtsgericht": "Amtsgericht Frankfurt am Main",
      "registernummer": "HRA 54203",
      "registerart": "HRA",
      "company_name": "Cosmo Properties 1 (WBR) B.V. & Co. KG",
      "company_seat": "Frankfurt am Main",
      "details": "15.07.2025 (Bekanntmachungsdatum)\n\nHessen Amtsgericht Frankfurt am Main HRA 54203\nRegisterbekanntmachung nach dem Umwandlungsgesetz 15.07.2025 (Eintragungsdatum)\n\nCosmo Properties 1 (WBR) B.V. & Co. KG\nKommanditgesellschaft\nFrankfurt am Main\n\nDen Gläubigern der an der Ausgliederung beteiligten Rechtsträger ist, wenn sie binnen sechs Monaten nach dem Tag, an dem die Eintragung der Ausgliederung in das Register des Sitzes desjenigen Rechtsträgers, dessen Gläubiger sie sind, nach §§ 125, 19 Absatz 3 UmwG bekannt gemacht worden ist, ihren Anspruch nach Grund und Höhe schriftlich anmelden, Sicherheit zu leisten, soweit sie nicht Befriedigung verlangen können. Dieses Recht steht den Gläubigern jedoch nur zu, wenn sie glaubhaft machen, dass durch die Ausgliederung die Erfüllung ihrer Forderung gefährdet wird."
    },
    {
      "date": "2025-07-15",
      "id": "115999",
      "original_text": "Sonstige Registerbekanntmachung\nHessen Amtsgericht Fritzlar VR 3111\nKULTUR- & TOURIST-INFO MELSUNGER LAND e.V. – Melsungen",
      "type": "Sonstige Registerbekanntmachung",
      "state": "Hessen",
      "amtsgericht": "Amtsgericht Fritzlar",
      "registernummer": "VR 3111",
      "registerart": "VR",
      "company_name": "KULTUR- & TOURIST-INFO MELSUNGER LAND e.V.",
      "company_seat": "Melsungen",
      "details": "15.07.2025 (Bekanntmachungsdatum)\n\nHessen Amtsgericht Fritzlar VR 3111\nSonstige Registerbekanntmachung 15.07.2025 (Eintragungsdatum)\n\nKULTUR- & TOURIST-INFO MELSUNGER LAND e.V.\neingetragener Verein\nMelsungen\n\nDer Verein ist aufgelöst."
    },
    {
      "date": "2025-07-15",
      "id": "116000",
      "original_text": "Registerbekanntmachung nach dem Umwandlungsgesetz\nHessen Amtsgericht Frankfurt am Main HRB 50879\nDB InfraGO Aktiengesellschaft – Frankfurt am Main",
      "type": "Registerbekanntmachung nach dem Umwandlungsgesetz",
      "state": "Hessen",
      "amtsgericht": "Amtsgericht Frankfurt am Main",
      "registernummer": "HRB 50879",
      "registerart": "HRB",
      "company_name": "DB InfraGO Aktiengesellschaft",
      "company_seat": "Frankfurt am Main",
      "details": "15.07.2025 (Bekanntmachungsdatum)\n\nHessen Amtsgericht Frankfurt am Main HRB 50879\nRegisterbekanntmachung nach dem Umwandlungsgesetz 15.07.2025 (Eintragungsdatum)\n\nDB InfraGO Aktiengesellschaft\nAktiengesellschaft\nFrankfurt am Main\n\nDie Gesellschaft hat den Entwurf des Verschmelzungsvertrages zwischen ihr und der DSD Digitale Schiene Deutschland GmbH, Berlin (Amtsgericht Charlottenburg, HRB 212233 B) beim Amtsgericht Frankfurt am Main (Registergericht) zur Einsichtnahme eingereicht."
    },
    {
      "date": "2025-07-15",
      "id": "116001",
      "original_text": "Sonstige Registerbekanntmachung\nHessen Amtsgericht Bad Hersfeld HRB 826\nAmazon Logistik GmbH – Bad Hersfeld",
      "type": "Sonstige Registerbekanntmachung",
      "state": "Hessen",
      "amtsgericht": "Amtsgericht Bad Hersfeld",
      "registernummer": "HRB 826",
      "registerart": "HRB",
      "company_name": "Amazon Logistik GmbH",
      "company_seat": "Bad Hersfeld",
      "details": "15.07.2025 (Bekanntmachungsdatum)\n\nHessen Amtsgericht Bad Hersfeld HRB 826\nSonstige Registerbekanntmachung\n\nAmazon Logistik GmbH\nGesellschaft mit beschränkter Haftung\nBad Hersfeld\n\nDurch eine Änderung in den Personen der Aufsichtsratsmitglieder ist eine Liste der Mitglieder des Aufsichtsrates zum Handelsregister eingereicht worden."
    },
    {
      "date": "2025-07-15",
      "id": "116002",
      "original_text": "Sonstige Registerbekanntmachung\nHessen Amtsgericht Offenbach am Main VR 736\nArbeitergesangverein \"Vorwärts\" 1900 – Dietzenbach",
      "type": "Sonstige Registerbekanntmachung",
      "state": "Hessen",
      "amtsgericht": "Amtsgericht Offenbach am Main",
      "registernummer": "VR 736",
      "registerart": "VR",
      "company_name": "Arbeitergesangverein \"Vorwärts\" 1900",
      "company_seat": "Dietzenbach",
      "details": "15.07.2025 (Bekanntmachungsdatum)\n\nHessen Amtsgericht Offenbach am Main VR 736\nSonstige Registerbekanntmachung 15.07.2025 (Eintragungsdatum)\n\nArbeitergesangverein \"Vorwärts\" 1900\neingetragener Verein\nDietzenbach\n\nDer Verein ist aufgelöst."
    },
    {
      "date": "2025-07-15",
      "id": "116003",
      "original_text": "Registerbekanntmachung nach dem Umwandlungsgesetz\nHessen Amtsgericht Wiesbaden HRB 26118\nLudwig Fey Elektricitätsgesellschaft UG (haftungsbeschränkt) – Wiesbaden",
      "type": "Registerbekanntmachung nach dem Umwandlungsgesetz",
      "state": "Hessen",
      "amtsgericht": "Amtsgericht Wiesbaden",
      "registernummer": "HRB 26118",
      "registerart": "HRB",
      "company_name": "Ludwig Fey Elektricitätsgesellschaft UG (haftungsbeschränkt)",
      "company_seat": "Wiesbaden",
      "details": "15.07.2025 (Bekanntmachungsdatum)\n\nHessen Amtsgericht Wiesbaden HRB 26118\nRegisterbekanntmachung nach dem Umwandlungsgesetz 15.07.2025 (Eintragungsdatum)\n\nLudwig Fey Elektricitätsgesellschaft UG (haftungsbeschränkt)\nGesellschaft mit beschränkter Haftung\nWiesbaden\n\nDen Gläubigern der an der Verschmelzung beteiligten Rechtsträger ist, wenn sie binnen sechs Monaten nach dem Tag, an dem die Eintragung der Verschmelzung in das Register des Sitzes derjenigen Rechtsträger deren Gläubiger sie sind, nach § 19 Absatz 3 UmwG bekannt gemacht worden ist, ihren Anspruch nach Grund und Höhe schriftlich anmelden, Sicherheit zu leisten, soweit sie nicht Befriedigung verlangen können. Dieses Recht steht den Gläubigern jedoch nur zu, wenn sie glaubhaft machen, dass durch die Verschmelzung die Erfüllung ihrer Forderung gefährdet wird."
    },
    {
      "date": "2025-07-15",
      "id": "116004",
      "original_text": "Einreichung neuer Dokumente\nHessen Amtsgericht Wetzlar HRB 44\nPfeiffer Vacuum Technology AG – Aßlar",
      "type": "Einreichung neuer Dokumente",
      "state": "Hessen",
      "amtsgericht": "Amtsgericht Wetzlar",
      "registernummer": "HRB 44",
      "registerart": "HRB",
      "company_name": "Pfeiffer Vacuum Technology AG",
      "company_seat": "Aßlar",
      "details": "15.07.2025 (Bekanntmachungsdatum)\n\nHessen Amtsgericht Wetzlar HRB 44\nEinreichung neuer Dokumente\n\nPfeiffer Vacuum Technology AG\nAktiengesellschaft\nAßlar\n\nDurch eine Änderung in den Personen der Aufsichtsratsmitglieder ist eine Liste der Mitglieder des Aufsichtsrates zum Handelsregister eingereicht worden."
    },
    {
      "date": "2025-07-15",
      "id": "116005",
      "original_text": "Registerbekanntmachung nach dem Umwandlungsgesetz\nHessen Amtsgericht Wiesbaden HRB 35922\nMerbag Wiesbaden GmbH – Wiesbaden",
      "type": "Registerbekanntmachung nach dem Umwandlungsgesetz",
      "state": "Hessen",
      "amtsgericht": "Amtsgericht Wiesbaden",
      "registernummer": "HRB 35922",
      "registerart": "HRB",
      "company_name": "Merbag Wiesbaden GmbH",
      "company_seat": "Wiesbaden",
      "details": "15.07.2025 (Bekanntmachungsdatum)\n\nHessen Amtsgericht Wiesbaden HRB 35922\nRegisterbekanntmachung nach dem Umwandlungsgesetz 15.07.2025 (Eintragungsdatum)\n\nMerbag Wiesbaden GmbH\nGesellschaft mit beschränkter Haftung\nWiesbaden\n\nDen Gläubigern der an der formwechselnden Umwandlung beteiligten Rechtsträger ist, wenn sie binnen sechs Monaten nach dem Tag, an dem die Eintragung der formwechselnden Umwandlung in das Register des Sitzes derjenigen Rechtsträger deren Gläubiger sie sind, nach § 201 UmwG bekannt gemacht worden ist, ihren Anspruch nach Grund und Höhe schriftlich anmelden, Sicherheit zu leisten, soweit sie nicht Befriedigung verlangen können. Dieses Recht steht den Gläubigern jedoch nur zu, wenn sie glaubhaft machen, dass durch die formwechselnden Umwandlung die Erfüllung ihrer Forderung gefährdet wird."
    },
    {
      "date": "2025-07-15",
      "id": "116006",
      "original_text": "Einreichung neuer Dokumente\nHessen Amtsgericht Frankfurt am Main HRB 79808\nDB Vertrieb GmbH – Frankfurt am Main",
      "type": "Einreichung neuer Dokumente",
      "state": "Hessen",
      "amtsgericht": "Amtsgericht Frankfurt am Main",
      "registernummer": "HRB 79808",
      "registerart": "HRB",
      "company_name": "DB Vertrieb GmbH",
      "company_seat": "Frankfurt am Main",
      "details": "15.07.2025 (Bekanntmachungsdatum)\n\nHessen Amtsgericht Frankfurt am Main HRB 79808\nEinreichung neuer Dokumente 15.07.2025 (Eintragungsdatum)\n\nDB Vertrieb GmbH\nGesellschaft mit beschränkter Haftung\nFrankfurt am Main\n\nDurch eine Änderung in den Personen der Aufsichtsratsmitglieder ist eine Liste der Mitglieder des Aufsichtsrates zum Handelsregister eingereicht worden."
    },
    {
      "date": "2025-07-15",
      "id": "116007",
      "original_text": "Einreichung neuer Dokumente\nHessen Amtsgericht Frankfurt am Main HRB 79808\nDB Vertrieb GmbH – Frankfurt am Main",
      "type": "Einreichung neuer Dokumente",
      "state": "Hessen",
      "amtsgericht": "Amtsgericht Frankfurt am Main",
      "registernummer": "HRB 79808",
      "registerart": "HRB",
      "company_name": "DB Vertrieb GmbH",
      "company_seat": "Frankfurt am Main",
      "details": "15.07.2025 (Bekanntmachungsdatum)\n\nHessen Amtsgericht Frankfurt am Main HRB 79808\nEinreichung neuer Dokumente 15.07.2025 (Eintragungsdatum)\n\nDB Vertrieb GmbH\nGesellschaft mit beschränkter Haftung\nFrankfurt am Main\n\nDurch eine Änderung in den Personen der Aufsichtsratsmitglieder ist eine Liste der Mitglieder des Aufsichtsrates zum Handelsregister eingereicht worden."
    },
    {
      "date": "2025-07-15",
      "id": "116008",
      "original_text": "Sonstige Registerbekanntmachung\nHessen Amtsgericht Offenbach am Main VR 1529\nWIR - Bürger für Dietzenbach (WIR - BfD) – Dietzenbach",
      "type": "Sonstige Registerbekanntmachung",
      "state": "Hessen",
      "amtsgericht": "Amtsgericht Offenbach am Main",
      "registernummer": "VR 1529",
      "registerart": "VR",
      "company_name": "WIR - Bürger für Dietzenbach (WIR - BfD)",
      "company_seat": "Dietzenbach",
      "details": "15.07.2025 (Bekanntmachungsdatum)\n\nHessen Amtsgericht Offenbach am Main VR 1529\nSonstige Registerbekanntmachung 15.07.2025 (Eintragungsdatum)\n\nWIR - Bürger für Dietzenbach (WIR - BfD)\neingetragener Verein\nDietzenbach\n\nDer Verein ist aufgelöst."
    },
    {
      "date": "2025-07-15",
      "id": "116009",
      "original_text": "Löschungsankündigung\nHessen Amtsgericht Offenbach am Main HRB 52572\nLM Hochbau GmbH – Offenbach am Main",
      "type": "Löschungsankündigung",
      "state": "Hessen",
      "amtsgericht": "Amtsgericht Offenbach am Main",
      "registernummer": "HRB 52572",
      "registerart": "HRB",
      "company_name": "LM Hochbau GmbH",
      "company_seat": "Offenbach am Main",
      "details": "15.07.2025 (Bekanntmachungsdatum)\n\nHessen Amtsgericht Offenbach am Main HRB 52572\nLöschungsankündigung 15.07.2025 (Eintragungsdatum)\n\nLM Hochbau GmbH\nGesellschaft mit beschränkter Haftung\nOffenbach am Main\n\nDas Registergericht beabsichtigt die im Handelsregister eingetragene Gesellschaft von Amts wegen nach § 394 FamFG zu löschen. Die Frist zur Erhebung eines Widerspruchs gegen die beabsichtigte Löschung wird auf 3 Monate festgesetzt."
    },
    {
      "date": "2025-07-15",
      "id": "116010",
      "original_text": "Löschungsankündigung\nHessen Amtsgericht Friedberg HRB 7739\nSandalon Betriebs GmbH – Rosbach vor der Höhe",
      "type": "Löschungsankündigung",
      "state": "Hessen",
      "amtsgericht": "Amtsgericht Friedberg",
      "registernummer": "HRB 7739",
      "registerart": "HRB",
      "company_name": "Sandalon Betriebs GmbH",
      "company_seat": "Rosbach vor der Höhe",
      "details": "15.07.2025 (Bekanntmachungsdatum)\n\nHessen Amtsgericht Friedberg HRB 7739\nLöschungsankündigung\n\nSandalon Betriebs GmbH\nGesellschaft mit beschränkter Haftung\nRosbach vor der Höhe\n\nDas Registergericht beabsichtigt die im Handelsregister eingetragene Gesellschaft von Amts wegen nach § 394 FamFG zu löschen. Die Frist zur Erhebung eines Widerspruchs gegen die beabsichtigte Löschung wird auf 3 Monate festgesetzt."
    },
    {
      "date": "2025-07-15",
      "id": "116011",
      "original_text": "Löschungsankündigung\nHessen Amtsgericht Gießen HRB 1676\nNebhuth GmbH – Lollar",
      "type": "Löschungsankündigung",
      "state": "Hessen",
      "amtsgericht": "Amtsgericht Gießen",
      "registernummer": "HRB 1676",
      "registerart": "HRB",
      "company_name": "Nebhuth GmbH",
      "company_seat": "Lollar",
      "details": "15.07.2025 (Bekanntmachungsdatum)\n\nHessen Amtsgericht Gießen HRB 1676\nLöschungsankündigung\n\nNebhuth GmbH\nGesellschaft mit beschränkter Haftung\nLollar\n\nEs ist beabsichtigt, die Gesellschaft wegen Vermögenslosigkeit gemäß § 394 FamFG von Amts wegen zu löschen. Hiergegen kann innerhalb von drei Monaten nach dieser Veröffentlichung Widerspruch beim Amtsgericht Gießen eingelegt werden. Sollte Widerspruch eingelegt werden, dürfte dies nur mit Begründung erfolgversprechend sein. Insbesondere sollte vorhandenes Vermögen der Gesellschaft innerhalb der genannten Frist nachgewiesen werden."
    },
    {
      "date": "2025-07-15",
      "id": "116012",
      "original_text": "Registerbekanntmachung nach dem Umwandlungsgesetz\nHessen Amtsgericht Fulda HRB 7975\nKSE Energietechnik GmbH – Eichenzell",
      "type": "Registerbekanntmachung nach dem Umwandlungsgesetz",
      "state": "Hessen",
      "amtsgericht": "Amtsgericht Fulda",
      "registernummer": "HRB 7975",
      "registerart": "HRB",
      "company_name": "KSE Energietechnik GmbH",
      "company_seat": "Eichenzell",
      "details": "15.07.2025 (Bekanntmachungsdatum)\n\nHessen Amtsgericht Fulda HRB 7975\nRegisterbekanntmachung nach dem Umwandlungsgesetz 15.07.2025 (Eintragungsdatum)\n\nKSE Energietechnik GmbH\nGesellschaft mit beschränkter Haftung\nEichenzell\n\nDen Gläubigern der an der Verschmelzung beteiligten Rechtsträger ist, wenn sie binnen sechs Monaten nach dem Tag, an dem die Eintragung der Verschmelzung in das Register des Sitzes desjenigen Rechtsträgers, dessen Gläubiger sie sind, nach § 19 Absatz 3 UmwG bekannt gemacht worden ist, ihren Anspruch nach Grund und Höhe schriftlich anmelden, Sicherheit zu leisten, soweit sie nicht Befriedigung verlangen können. Dieses Recht steht den Gläubigern jedoch nur zu, wenn sie glaubhaft machen, dass durch die Verschmelzung die Erfüllung ihrer Forderung gefährdet wird."
    }
  ]
}